purge recyclebin;
DROP TABLE IF EXISTS t2;
DROP TABLE IF EXISTS t1;
#mysql_modify-5
#TRIGGER
#CREATE DATA
CREATE TABLE t1(c0 INT(5) PRIMARY KEY,
c1 FLOAT ,
c2 DOUBLE NOT NULL,
c3 CHAR(10) DEFAULT 'A',
c4 VARCHAR(10) UNIQUE,
c5 CHAR(10),
c6 INT,
c7 TIME,
c8 YEAR );
INSERT INTO t1 VALUES(1,1.0,1.1,'中文','','',0,'11:11:11','2000'),
(2,1.1,1.2,'中!文','A','a',1,'11:11:11','2001'),
(3,1.2,2.2,'中!文','B','a',1,'11:11:11','2002'),
(4,1.3,3.2,'中!文','C','a',1,'11:11:11','2003'),
(5,1.4,4.2,'中!文','D','a',1,'11:11:11','2004'),
(6,1.5,5.2,'中!文','E','a',1,'11:11:11','2005'),
(7,1.6,6.2,'中!文','F','a',1,'11:11:11','2006'),
(8,1.7,7.2,'中!文','G','a',1,'11:11:11','2007'),
(9,1.8,8.2,'中!文','H','a',1,'11:11:11','2011'),
(10,1.9,9.2,'中!文','I','a',1,'11:11:11','2012'),
(11,2.0,1.9,'中!文','J','a',1,'11:11:11','2011'),
(12,2.1,1.8,'中!文','K','a',1,'11:11:11','2012');
CREATE TABLE t2(c0 INT(4),
c1 FLOAT UNIQUE,
c2 DOUBLE,
c3 CHAR(10),
c4 VARCHAR(5),
c5 INT,
c6 TIME,
CONSTRAINT fk_c0_c0 FOREIGN KEY(c0) REFERENCES t1(c0));
INSERT INTO t2 VALUES(1,1.0,1.1,'中文','',0,'11:11:11'),
(2,1.1,1.2,'中!文','a',1,'11:11:11'),
(3,1.2,2.2,'中!文','a',1,'11:11:11'),
(4,1.3,3.2,'中!文','a',1,'11:11:11'),
(5,1.4,4.2,'中!文','a',1,'11:11:11');
#创建trigger后，修改引用列，然后触发trigger执行
#insert型触发器
DROP TRIGGER IF EXISTS trg_insert;
CREATE TRIGGER trg_insert AFTER INSERT ON t2
FOR EACH ROW
BEGIN
DECLARE a VARCHAR(10);
SET a=CONCAT(NEW.c4,'A');
INSERT INTO t1(c0,c1,c2,c4,c5,c6,c7,c8) VALUES(NEW.c0+10,NEW.c1,NEW.c2,a,NEW.c5,NEW.c6,'12:12:12','2020');
END
//
#修改驱动表的列
ALTER TABLE t2 CHANGE c2 c2 DOUBLE(5,0) AFTER c5;
INSERT INTO t2 VALUES(6,1.5,'中￥文','a',1,5.2,'10:10:10');
SELECT * FROM t1 ORDER BY 1;
c0	c1	c2	c3	c4	c5	c6	c7	c8
1	1	1.1	中文			0	11:11:11	2000
2	1.1	1.2	中!文	A	a	1	11:11:11	2001
3	1.2	2.2	中!文	B	a	1	11:11:11	2002
4	1.3	3.2	中!文	C	a	1	11:11:11	2003
5	1.4	4.2	中!文	D	a	1	11:11:11	2004
6	1.5	5.2	中!文	E	a	1	11:11:11	2005
7	1.6	6.2	中!文	F	a	1	11:11:11	2006
8	1.7	7.2	中!文	G	a	1	11:11:11	2007
9	1.8	8.2	中!文	H	a	1	11:11:11	2011
10	1.9	9.2	中!文	I	a	1	11:11:11	2012
11	2	1.9	中!文	J	a	1	11:11:11	2011
12	2.1	1.8	中!文	K	a	1	11:11:11	2012
16	1.5	5	A	aA	1	101010	12:12:12	2020
SELECT * FROM t2 ORDER BY 1;
c0	c1	c3	c4	c5	c2	c6
1	1	中文		0	1	11:11:11
2	1.1	中!文	a	1	1	11:11:11
3	1.2	中!文	a	1	2	11:11:11
4	1.3	中!文	a	1	3	11:11:11
5	1.4	中!文	a	1	4	11:11:11
6	1.5	中￥文	a	1	5	10:10:10
ALTER TABLE t2 CHANGE c4 m4 VARCHAR(6) DEFAULT 'A';
INSERT INTO t2 VALUES(7,1.6,'中0文','b',2,6.2,'12:12:12');
SELECT * FROM t1 ORDER BY 1;
c0	c1	c2	c3	c4	c5	c6	c7	c8
1	1	1.1	中文			0	11:11:11	2000
2	1.1	1.2	中!文	A	a	1	11:11:11	2001
3	1.2	2.2	中!文	B	a	1	11:11:11	2002
4	1.3	3.2	中!文	C	a	1	11:11:11	2003
5	1.4	4.2	中!文	D	a	1	11:11:11	2004
6	1.5	5.2	中!文	E	a	1	11:11:11	2005
7	1.6	6.2	中!文	F	a	1	11:11:11	2006
8	1.7	7.2	中!文	G	a	1	11:11:11	2007
9	1.8	8.2	中!文	H	a	1	11:11:11	2011
10	1.9	9.2	中!文	I	a	1	11:11:11	2012
11	2	1.9	中!文	J	a	1	11:11:11	2011
12	2.1	1.8	中!文	K	a	1	11:11:11	2012
16	1.5	5	A	aA	1	101010	12:12:12	2020
SELECT * FROM t2 ORDER BY 1;
c0	c1	c3	m4	c5	c2	c6
1	1	中文		0	1	11:11:11
2	1.1	中!文	a	1	1	11:11:11
3	1.2	中!文	a	1	2	11:11:11
4	1.3	中!文	a	1	3	11:11:11
5	1.4	中!文	a	1	4	11:11:11
6	1.5	中￥文	a	1	5	10:10:10
ALTER TABLE t2 CHANGE m4 c4 VARCHAR(6) DEFAULT 'A';
INSERT INTO t2 VALUES(7,1.6,'中0文','b',2,6.2,'12:12:12');
SELECT * FROM t1 ORDER BY 1;
c0	c1	c2	c3	c4	c5	c6	c7	c8
1	1	1.1	中文			0	11:11:11	2000
2	1.1	1.2	中!文	A	a	1	11:11:11	2001
3	1.2	2.2	中!文	B	a	1	11:11:11	2002
4	1.3	3.2	中!文	C	a	1	11:11:11	2003
5	1.4	4.2	中!文	D	a	1	11:11:11	2004
6	1.5	5.2	中!文	E	a	1	11:11:11	2005
7	1.6	6.2	中!文	F	a	1	11:11:11	2006
8	1.7	7.2	中!文	G	a	1	11:11:11	2007
9	1.8	8.2	中!文	H	a	1	11:11:11	2011
10	1.9	9.2	中!文	I	a	1	11:11:11	2012
11	2	1.9	中!文	J	a	1	11:11:11	2011
12	2.1	1.8	中!文	K	a	1	11:11:11	2012
16	1.5	5	A	aA	1	101010	12:12:12	2020
17	1.6	6	A	bA	2	121212	12:12:12	2020
SELECT * FROM t2 ORDER BY 1;
c0	c1	c3	c4	c5	c2	c6
1	1	中文		0	1	11:11:11
2	1.1	中!文	a	1	1	11:11:11
3	1.2	中!文	a	1	2	11:11:11
4	1.3	中!文	a	1	3	11:11:11
5	1.4	中!文	a	1	4	11:11:11
6	1.5	中￥文	a	1	5	10:10:10
7	1.6	中0文	b	2	6	12:12:12
#修改触发表的列
INSERT INTO t2 VALUES(8,1.7,'中8文','c',3,7.2,'13:13:13');
SELECT * FROM t1 ORDER BY 1;
c0	c1	c2	c3	c4	c5	c6	c7	c8
1	1	1.1	中文			0	11:11:11	2000
2	1.1	1.2	中!文	A	a	1	11:11:11	2001
3	1.2	2.2	中!文	B	a	1	11:11:11	2002
4	1.3	3.2	中!文	C	a	1	11:11:11	2003
5	1.4	4.2	中!文	D	a	1	11:11:11	2004
6	1.5	5.2	中!文	E	a	1	11:11:11	2005
7	1.6	6.2	中!文	F	a	1	11:11:11	2006
8	1.7	7.2	中!文	G	a	1	11:11:11	2007
9	1.8	8.2	中!文	H	a	1	11:11:11	2011
10	1.9	9.2	中!文	I	a	1	11:11:11	2012
11	2	1.9	中!文	J	a	1	11:11:11	2011
12	2.1	1.8	中!文	K	a	1	11:11:11	2012
16	1.5	5	A	aA	1	101010	12:12:12	2020
17	1.6	6	A	bA	2	121212	12:12:12	2020
18	1.7	7	A	cA	3	131313	12:12:12	2020
SELECT * FROM t2 ORDER BY 1;
c0	c1	c3	c4	c5	c2	c6
1	1	中文		0	1	11:11:11
2	1.1	中!文	a	1	1	11:11:11
3	1.2	中!文	a	1	2	11:11:11
4	1.3	中!文	a	1	3	11:11:11
5	1.4	中!文	a	1	4	11:11:11
6	1.5	中￥文	a	1	5	10:10:10
7	1.6	中0文	b	2	6	12:12:12
8	1.7	中8文	c	3	7	13:13:13
ALTER TABLE t1 CHANGE c2 m2 DOUBLE;
INSERT INTO t2 VALUES(9,1.8,'中7文','d',4,8.2,'14:14:14');
SELECT * FROM t1 ORDER BY 1;
c0	c1	m2	c3	c4	c5	c6	c7	c8
1	1	1.1	中文			0	11:11:11	2000
2	1.1	1.2	中!文	A	a	1	11:11:11	2001
3	1.2	2.2	中!文	B	a	1	11:11:11	2002
4	1.3	3.2	中!文	C	a	1	11:11:11	2003
5	1.4	4.2	中!文	D	a	1	11:11:11	2004
6	1.5	5.2	中!文	E	a	1	11:11:11	2005
7	1.6	6.2	中!文	F	a	1	11:11:11	2006
8	1.7	7.2	中!文	G	a	1	11:11:11	2007
9	1.8	8.2	中!文	H	a	1	11:11:11	2011
10	1.9	9.2	中!文	I	a	1	11:11:11	2012
11	2	1.9	中!文	J	a	1	11:11:11	2011
12	2.1	1.8	中!文	K	a	1	11:11:11	2012
16	1.5	5	A	aA	1	101010	12:12:12	2020
17	1.6	6	A	bA	2	121212	12:12:12	2020
18	1.7	7	A	cA	3	131313	12:12:12	2020
SELECT * FROM t2 ORDER BY 1;
c0	c1	c3	c4	c5	c2	c6
1	1	中文		0	1	11:11:11
2	1.1	中!文	a	1	1	11:11:11
3	1.2	中!文	a	1	2	11:11:11
4	1.3	中!文	a	1	3	11:11:11
5	1.4	中!文	a	1	4	11:11:11
6	1.5	中￥文	a	1	5	10:10:10
7	1.6	中0文	b	2	6	12:12:12
8	1.7	中8文	c	3	7	13:13:13
ALTER TABLE t1 MODIFY m2 VARCHAR(5) AFTER c1;
ALTER TABLE t1 CHANGE m2 c2 VARCHAR(5);
INSERT INTO t2 VALUES(10,1.9,'中6文','e',5,9.2,'15:15:15');
SELECT * FROM t1 ORDER BY 1;
c0	c1	c2	c3	c4	c5	c6	c7	c8
1	1	1.1	中文			0	11:11:11	2000
2	1.1	1.2	中!文	A	a	1	11:11:11	2001
3	1.2	2.2	中!文	B	a	1	11:11:11	2002
4	1.3	3.2	中!文	C	a	1	11:11:11	2003
5	1.4	4.2	中!文	D	a	1	11:11:11	2004
6	1.5	5.2	中!文	E	a	1	11:11:11	2005
7	1.6	6.2	中!文	F	a	1	11:11:11	2006
8	1.7	7.2	中!文	G	a	1	11:11:11	2007
9	1.8	8.2	中!文	H	a	1	11:11:11	2011
10	1.9	9.2	中!文	I	a	1	11:11:11	2012
11	2	1.9	中!文	J	a	1	11:11:11	2011
12	2.1	1.8	中!文	K	a	1	11:11:11	2012
16	1.5	5	A	aA	1	101010	12:12:12	2020
17	1.6	6	A	bA	2	121212	12:12:12	2020
18	1.7	7	A	cA	3	131313	12:12:12	2020
20	1.9	9	A	eA	5	151515	12:12:12	2020
SELECT * FROM t2 ORDER BY 1;
c0	c1	c3	c4	c5	c2	c6
1	1	中文		0	1	11:11:11
2	1.1	中!文	a	1	1	11:11:11
3	1.2	中!文	a	1	2	11:11:11
4	1.3	中!文	a	1	3	11:11:11
5	1.4	中!文	a	1	4	11:11:11
6	1.5	中￥文	a	1	5	10:10:10
7	1.6	中0文	b	2	6	12:12:12
8	1.7	中8文	c	3	7	13:13:13
10	1.9	中6文	e	5	9	15:15:15
#重新创建触发器
DROP TRIGGER IF EXISTS trg_insert;
CREATE TRIGGER trg_insert AFTER INSERT ON t2
FOR EACH ROW
BEGIN
DECLARE a VARCHAR(10);
SET a=CONCAT(NEW.c4,'A');
INSERT INTO t1(c0,c1,m2,c4,c5,c6,c7,c8) VALUES(NEW.c0+10,NEW.c1,0,a,NEW.c5,NEW.c6,'12:12:12','2020');
END
//
INSERT INTO t2 VALUES(11,2.0,'中5文','f',6,10.2,'16:16:16');
SELECT * FROM t1 ORDER BY 1;
c0	c1	c2	c3	c4	c5	c6	c7	c8
1	1	1.1	中文			0	11:11:11	2000
2	1.1	1.2	中!文	A	a	1	11:11:11	2001
3	1.2	2.2	中!文	B	a	1	11:11:11	2002
4	1.3	3.2	中!文	C	a	1	11:11:11	2003
5	1.4	4.2	中!文	D	a	1	11:11:11	2004
6	1.5	5.2	中!文	E	a	1	11:11:11	2005
7	1.6	6.2	中!文	F	a	1	11:11:11	2006
8	1.7	7.2	中!文	G	a	1	11:11:11	2007
9	1.8	8.2	中!文	H	a	1	11:11:11	2011
10	1.9	9.2	中!文	I	a	1	11:11:11	2012
11	2	1.9	中!文	J	a	1	11:11:11	2011
12	2.1	1.8	中!文	K	a	1	11:11:11	2012
16	1.5	5	A	aA	1	101010	12:12:12	2020
17	1.6	6	A	bA	2	121212	12:12:12	2020
18	1.7	7	A	cA	3	131313	12:12:12	2020
20	1.9	9	A	eA	5	151515	12:12:12	2020
SELECT * FROM t2 ORDER BY 1;
c0	c1	c3	c4	c5	c2	c6
1	1	中文		0	1	11:11:11
2	1.1	中!文	a	1	1	11:11:11
3	1.2	中!文	a	1	2	11:11:11
4	1.3	中!文	a	1	3	11:11:11
5	1.4	中!文	a	1	4	11:11:11
6	1.5	中￥文	a	1	5	10:10:10
7	1.6	中0文	b	2	6	12:12:12
8	1.7	中8文	c	3	7	13:13:13
10	1.9	中6文	e	5	9	15:15:15
#update型触发器
DROP TABLE IF EXISTS t2;
DROP TABLE IF EXISTS t1;
CREATE TABLE t1(c0 INT(5) PRIMARY KEY,
c1 FLOAT ,
c2 DOUBLE NOT NULL,
c3 CHAR(10) DEFAULT 'A',
c4 VARCHAR(10) UNIQUE,
c5 CHAR(10),
c6 INT,
c7 TIME,
c8 YEAR);
INSERT INTO t1 VALUES(1,1.0,1.1,'中文','','',0,'11:11:11','2000'),
(2,1.1,1.2,'中!文','A','a',1,'11:11:11','2001'),
(3,1.2,2.2,'中!文','B','a',2,'11:11:11','2002'),
(4,1.3,3.2,'中!文','C','a',3,'11:11:11','2003'),
(5,1.4,4.2,'中!文','D','a',4,'11:11:11','2004'),
(6,1.5,5.2,'中!文','E','a',5,'11:11:11','2005'),
(7,1.6,6.2,'中!文','F','a',6,'11:11:11','2006'),
(8,1.7,7.2,'中!文','G','a',7,'11:11:11','2007'),
(9,1.8,8.2,'中!文','H','a',8,'11:11:11','2011'),
(10,1.9,9.2,'中!文','I','a',9,'11:11:11','2012'),
(11,2.0,1.9,'中!文','J','a',10,'11:11:11','2011'),
(12,2.1,1.8,'中!文','K','a',11,'11:11:11','2012');
CREATE TABLE t2(c0 INT(4),
c1 FLOAT UNIQUE,
c2 DOUBLE,
c3 CHAR(10),
c4 VARCHAR(5),
c5 INT,
c6 TIME,
CONSTRAINT fk_c0_c0 FOREIGN KEY(c0) REFERENCES t1(c0));
INSERT INTO t2 VALUES(1,1.0,1.1,'中文','',0,'11:11:11'),
(2,1.1,1.2,'中!文','a',1,'11:11:11'),
(3,1.2,2.2,'中!文','a',2,'11:11:11'),
(4,1.3,3.2,'中!文','a',3,'11:11:11'),
(5,1.4,4.2,'中!文','a',4,'11:11:11');
DROP TRIGGER IF EXISTS trg_update;
CREATE TRIGGER trg_update BEFORE UPDATE ON t2
FOR EACH ROW
BEGIN
UPDATE t1 SET c1=NEW.c1,c2=NEW.c2,c4=CONCAT(NEW.c4,'A') WHERE c6=NEW.c5;
END
//
#修改驱动表的列
ALTER TABLE t2 CHANGE c3 c3 VARCHAR(10) DEFAULT 'A' AFTER c4;
SELECT * FROM t2 ORDER BY 2;
c0	c1	c2	c4	c3	c5	c6
1	1	1.1		中文	0	11:11:11
2	1.1	1.2	a	中!文	1	11:11:11
3	1.2	2.2	a	中!文	2	11:11:11
4	1.3	3.2	a	中!文	3	11:11:11
5	1.4	4.2	a	中!文	4	11:11:11
UPDATE t2 SET c1=1.5,c2=5.2,c4='b',c5=1,c6='12:12:12' WHERE c3='中文';
SELECT * FROM t1 ORDER BY 1;
c0	c1	c2	c3	c4	c5	c6	c7	c8
1	1	1.1	中文			0	11:11:11	2000
2	1.5	5.2	中!文	bA	a	1	11:11:11	2001
3	1.2	2.2	中!文	B	a	2	11:11:11	2002
4	1.3	3.2	中!文	C	a	3	11:11:11	2003
5	1.4	4.2	中!文	D	a	4	11:11:11	2004
6	1.5	5.2	中!文	E	a	5	11:11:11	2005
7	1.6	6.2	中!文	F	a	6	11:11:11	2006
8	1.7	7.2	中!文	G	a	7	11:11:11	2007
9	1.8	8.2	中!文	H	a	8	11:11:11	2011
10	1.9	9.2	中!文	I	a	9	11:11:11	2012
11	2	1.9	中!文	J	a	10	11:11:11	2011
12	2.1	1.8	中!文	K	a	11	11:11:11	2012
SELECT * FROM t2 ORDER BY 1;
c0	c1	c2	c4	c3	c5	c6
1	1.5	5.2	b	中文	1	12:12:12
2	1.1	1.2	a	中!文	1	11:11:11
3	1.2	2.2	a	中!文	2	11:11:11
4	1.3	3.2	a	中!文	3	11:11:11
5	1.4	4.2	a	中!文	4	11:11:11
ALTER TABLE t2 CHANGE c1 c1 VARCHAR(10) AFTER c2;
UPDATE t2 SET c1='a',c2=5.3,c4='c',c5=2,c6='22:22:22' WHERE c0=2;
SELECT * FROM t1 ORDER BY 1;
c0	c1	c2	c3	c4	c5	c6	c7	c8
1	1	1.1	中文			0	11:11:11	2000
2	1.5	5.2	中!文	bA	a	1	11:11:11	2001
3	1.2	2.2	中!文	B	a	2	11:11:11	2002
4	1.3	3.2	中!文	C	a	3	11:11:11	2003
5	1.4	4.2	中!文	D	a	4	11:11:11	2004
6	1.5	5.2	中!文	E	a	5	11:11:11	2005
7	1.6	6.2	中!文	F	a	6	11:11:11	2006
8	1.7	7.2	中!文	G	a	7	11:11:11	2007
9	1.8	8.2	中!文	H	a	8	11:11:11	2011
10	1.9	9.2	中!文	I	a	9	11:11:11	2012
11	2	1.9	中!文	J	a	10	11:11:11	2011
12	2.1	1.8	中!文	K	a	11	11:11:11	2012
SELECT * FROM t2 ORDER BY 1;
c0	c2	c1	c4	c3	c5	c6
1	5.2	1.5	b	中文	1	12:12:12
2	1.2	1.1	a	中!文	1	11:11:11
3	2.2	1.2	a	中!文	2	11:11:11
4	3.2	1.3	a	中!文	3	11:11:11
5	4.2	1.4	a	中!文	4	11:11:11
UPDATE t2 SET c1='1.6',c2=5.3,c4='c',c5=2,c6='22:22:22' WHERE c0=2;
SELECT * FROM t1 ORDER BY 1;
c0	c1	c2	c3	c4	c5	c6	c7	c8
1	1	1.1	中文			0	11:11:11	2000
2	1.5	5.2	中!文	bA	a	1	11:11:11	2001
3	1.6	5.3	中!文	cA	a	2	11:11:11	2002
4	1.3	3.2	中!文	C	a	3	11:11:11	2003
5	1.4	4.2	中!文	D	a	4	11:11:11	2004
6	1.5	5.2	中!文	E	a	5	11:11:11	2005
7	1.6	6.2	中!文	F	a	6	11:11:11	2006
8	1.7	7.2	中!文	G	a	7	11:11:11	2007
9	1.8	8.2	中!文	H	a	8	11:11:11	2011
10	1.9	9.2	中!文	I	a	9	11:11:11	2012
11	2	1.9	中!文	J	a	10	11:11:11	2011
12	2.1	1.8	中!文	K	a	11	11:11:11	2012
SELECT * FROM t2 ORDER BY 1;
c0	c2	c1	c4	c3	c5	c6
1	5.2	1.5	b	中文	1	12:12:12
2	5.3	1.6	c	中!文	2	22:22:22
3	2.2	1.2	a	中!文	2	11:11:11
4	3.2	1.3	a	中!文	3	11:11:11
5	4.2	1.4	a	中!文	4	11:11:11
ALTER TABLE t2 CHANGE c1 m1 VARCHAR(10);
UPDATE t2 SET m1='1.7',c2=6.3,c4='d',c5=3,c6='20:20:20' WHERE c0=3;
SELECT * FROM t1 ORDER BY 1;
c0	c1	c2	c3	c4	c5	c6	c7	c8
1	1	1.1	中文			0	11:11:11	2000
2	1.5	5.2	中!文	bA	a	1	11:11:11	2001
3	1.6	5.3	中!文	cA	a	2	11:11:11	2002
4	1.3	3.2	中!文	C	a	3	11:11:11	2003
5	1.4	4.2	中!文	D	a	4	11:11:11	2004
6	1.5	5.2	中!文	E	a	5	11:11:11	2005
7	1.6	6.2	中!文	F	a	6	11:11:11	2006
8	1.7	7.2	中!文	G	a	7	11:11:11	2007
9	1.8	8.2	中!文	H	a	8	11:11:11	2011
10	1.9	9.2	中!文	I	a	9	11:11:11	2012
11	2	1.9	中!文	J	a	10	11:11:11	2011
12	2.1	1.8	中!文	K	a	11	11:11:11	2012
SELECT * FROM t2 ORDER BY 1;
c0	c2	m1	c4	c3	c5	c6
1	5.2	1.5	b	中文	1	12:12:12
2	5.3	1.6	c	中!文	2	22:22:22
3	2.2	1.2	a	中!文	2	11:11:11
4	3.2	1.3	a	中!文	3	11:11:11
5	4.2	1.4	a	中!文	4	11:11:11
ALTER TABLE t2 CHANGE m1 c1 VARCHAR(10);
UPDATE t2 SET c1='1.7',c2=6.3,c4='d',c5=3,c6='20:20:20' WHERE c0=3;
SELECT * FROM t1 ORDER BY 1;
c0	c1	c2	c3	c4	c5	c6	c7	c8
1	1	1.1	中文			0	11:11:11	2000
2	1.5	5.2	中!文	bA	a	1	11:11:11	2001
3	1.6	5.3	中!文	cA	a	2	11:11:11	2002
4	1.7	6.3	中!文	dA	a	3	11:11:11	2003
5	1.4	4.2	中!文	D	a	4	11:11:11	2004
6	1.5	5.2	中!文	E	a	5	11:11:11	2005
7	1.6	6.2	中!文	F	a	6	11:11:11	2006
8	1.7	7.2	中!文	G	a	7	11:11:11	2007
9	1.8	8.2	中!文	H	a	8	11:11:11	2011
10	1.9	9.2	中!文	I	a	9	11:11:11	2012
11	2	1.9	中!文	J	a	10	11:11:11	2011
12	2.1	1.8	中!文	K	a	11	11:11:11	2012
SELECT * FROM t2 ORDER BY 1;
c0	c2	c1	c4	c3	c5	c6
1	5.2	1.5	b	中文	1	12:12:12
2	5.3	1.6	c	中!文	2	22:22:22
3	6.3	1.7	d	中!文	3	20:20:20
4	3.2	1.3	a	中!文	3	11:11:11
5	4.2	1.4	a	中!文	4	11:11:11
#修改触发表的列
#暂不支持，待支持后执行sql
#########Empty recycle bin, delete test database, tables, etc##########
purge recyclebin;
