purge recyclebin;
DROP TABLE IF EXISTS t2;
DROP TABLE IF EXISTS t1;
#CREATE DATA (DATA TYPE + INDEX + CONSTRAINT)
CREATE TABLE t1(c0 INT(5) PRIMARY KEY,
c1 FLOAT ,
c2 DOUBLE NOT NULL,
c3 CHAR(10) DEFAULT 'A',
c4 VARCHAR(10) UNIQUE,
c5 CHAR(10) CHARACTER SET 'gb18030' COLLATE 'gb18030_bin',
c6 INT(5) ZEROFILL,
c7 TIME,
c8 YEAR);
INSERT INTO t1 VALUES(1,1.0,1.1,'中文','','',0,'11:11:11','2000'),
(2,1.1,1.2,'中!文','A','a',1,'11:11:11','2001'),
(3,1.2,2.2,'中!文','B','a',2,'11:11:11','2002'),
(4,1.3,3.2,'中!文','C','a',3,'11:11:11','2003'),
(5,1.4,4.2,'中!文','D','a',4,'11:11:11','2004'),
(6,1.5,5.2,'中!文','E','a',5,'11:11:11','2005'),
(7,1.6,6.2,'中!文','F','a',6,'11:11:11','2006'),
(8,1.7,7.2,'中!文','G','a',7,'11:11:11','2007'),
(9,1.8,8.2,'中!文','H','a',8,'11:11:11','2011'),
(10,1.9,9.2,'中!文','I','a',9,'11:11:11','2012'),
(11,2.0,1.9,'中!文','J','a',10,'11:11:11','2011'),
(12,2.1,1.8,'中!文','K','a',11,'11:11:11','2012');
#mysql_modify-1-1
#mysql_modify-1-2
#修改单列
#修改列顺序结合修改列属性(默认值、非空、空、唯一、主键、自增、常规索引和组合索引、列名、字符集和字符序)
ALTER TABLE t1 CHANGE c1 m1 INT FIRST AFTER c2;
ERROR 42000: You have an error in your SQL syntax; check the manual that corresponds to your OceanBase version for the right syntax to use near 'AFTER c2' at line 1
ALTER TABLE t1 CHANGE c1 m1 INT AFTER c2 BEFORE c1;
ERROR 42000: You have an error in your SQL syntax; check the manual that corresponds to your OceanBase version for the right syntax to use near 'BEFORE c1' at line 1
ALTER TABLE t1 CHANGE c1 c1 INT FIRST AFTER c2;
ERROR 42000: You have an error in your SQL syntax; check the manual that corresponds to your OceanBase version for the right syntax to use near 'AFTER c2' at line 1
ALTER TABLE t1 MODIFY c1 INT FIRST AFTER c2;
ERROR 42000: You have an error in your SQL syntax; check the manual that corresponds to your OceanBase version for the right syntax to use near 'AFTER c2' at line 1
ALTER TABLE t1 MODIFY c1 INT BEFORE c1 AFTER c2;
ERROR 42000: You have an error in your SQL syntax; check the manual that corresponds to your OceanBase version for the right syntax to use near 'AFTER c2' at line 1
ALTER TABLE t1 CHANGE COLUMN c0 m1 INT(5) FIRST;
ALTER TABLE t1 CHANGE COLUMN c0 m1 INT(5);
SELECT * FROM t1 WHERE c0=12;
ERROR 42S22: Unknown column 'c0' in 'where clause'
INSERT INTO t1 VALUES(12,2.2,1.7,'中!文','L','b',12,'12:12:12','2022');
ERROR 23000: Duplicate entry '12' for key 'PRIMARY'
INSERT INTO t1 VALUES(NULL,2.2,1.7,'中!文','L','b',12,'12:12:12','2022');
ERROR 23000: Column 'm1' cannot be null
INSERT INTO t1 VALUES(13,2.2,1.7,'中!文','L','b',12,'12:12:12','2022');
SELECT * FROM t1 WHERE m1=13;
m1	c1	c2	c3	c4	c5	c6	c7	c8
13	2.2	1.7	中!文	L	b	00012	12:12:12	2022
UPDATE t1 SET m1=1 WHERE m1=13;
ERROR 23000: Duplicate entry '1' for key 'PRIMARY'
UPDATE t1 SET m1=14 WHERE m1=13;
SELECT * FROM t1 WHERE m1=14;
m1	c1	c2	c3	c4	c5	c6	c7	c8
14	2.2	1.7	中!文	L	b	00012	12:12:12	2022
DELETE FROM t1 WHERE m1=14;
SELECT * FROM t1 WHERE m1=14;
m1	c1	c2	c3	c4	c5	c6	c7	c8
ALTER TABLE t1 CHANGE m1 c0 INT(5) ZEROFILL;
#此处有点问题，修改列以后，zerofill限制条件没有了，导致查询结果和MySQL不一致，待完全支持修改列功能后重新执行sql。
ALTER TABLE t1 MODIFY COLUMN m1 INT(5) AFTER c8;
INSERT INTO t1 VALUES(14,2.3,1.6,'中!文','M','c',13,'13:13:13','2023');
INSERT INTO t1 VALUES(2.3,1.6,'中!文','M','c',13,'13:13:13','2023',14);
SELECT * FROM t1 ORDER BY 1;
c0	c1	c2	c3	c4	c5	c6	c7	c8
00001	1	1.1	中文			00000	11:11:11	2000
00002	1.1	1.2	中!文	A	a	00001	11:11:11	2001
00003	1.2	2.2	中!文	B	a	00002	11:11:11	2002
00004	1.3	3.2	中!文	C	a	00003	11:11:11	2003
00005	1.4	4.2	中!文	D	a	00004	11:11:11	2004
00006	1.5	5.2	中!文	E	a	00005	11:11:11	2005
00007	1.6	6.2	中!文	F	a	00006	11:11:11	2006
00008	1.7	7.2	中!文	G	a	00007	11:11:11	2007
00009	1.8	8.2	中!文	H	a	00008	11:11:11	2011
00010	1.9	9.2	中!文	I	a	00009	11:11:11	2012
00011	2	1.9	中!文	J	a	00010	11:11:11	2011
00012	2.1	1.8	中!文	K	a	00011	11:11:11	2012
00014	2.3	1.6	中!文	M	c	00013	13:13:13	2023
DROP TABLE IF EXISTS t2;
DROP TABLE IF EXISTS t1;
CREATE TABLE t1(c0 INT(5) PRIMARY KEY,
c1 FLOAT ,
c2 DOUBLE NOT NULL,
c3 CHAR(10) DEFAULT 'A',
c4 VARCHAR(10) UNIQUE,
c5 CHAR(10) CHARACTER SET 'gb18030' COLLATE 'gb18030_bin',
c6 INT(5) ZEROFILL,
c7 TIME,
c8 YEAR);
INSERT INTO t1 VALUES(1,1.0,1.1,'中文','','',0,'11:11:11','2000'),
(2,1.1,1.2,'中!文','A','a',1,'11:11:11','2001'),
(3,1.2,2.2,'中!文','B','a',2,'11:11:11','2002'),
(4,1.3,3.2,'中!文','C','a',3,'11:11:11','2003'),
(5,1.4,4.2,'中!文','D','a',4,'11:11:11','2004'),
(6,1.5,5.2,'中!文','E','a',5,'11:11:11','2005'),
(7,1.6,6.2,'中!文','F','a',6,'11:11:11','2006'),
(8,1.7,7.2,'中!文','G','a',7,'11:11:11','2007'),
(9,1.8,8.2,'中!文','H','a',8,'11:11:11','2011'),
(10,1.9,9.2,'中!文','I','a',9,'11:11:11','2012'),
(11,2.0,1.9,'中!文','J','a',10,'11:11:11','2011'),
(12,2.1,1.8,'中!文','K','a',11,'11:11:11','2012');
CREATE TABLE t2(c0 INT,
c1 VARCHAR(10),
CONSTRAINT fk_c0_c0 FOREIGN KEY(c0) REFERENCES t1(c0));
INSERT INTO t2 VALUES(1,'A'),
(2,'B'),
(2,'A'),
(3,'C'),
(3,'D'),
(3,'B');
#修改外键列
ALTER TABLE t2 CHANGE c0 c1 INT;
ERROR 42S21: Duplicate column name 'c1'
ALTER TABLE t2 CHANGE c0 l0 INT AFTER c1;
ALTER TABLE t2 CHANGE c0 l0 INT(5) ZEROFILL;
ALTER TABLE t2 CHANGE c0 l0 VARCHAR(10);
ALTER TABLE t2 CHANGE c0 l0 INT;
ALTER TABLE t2 CHANGE l0 l0 INT AFTER c1;
INSERT INTO t2 VALUES(2,'C');
INSERT INTO t2 VALUES('C',2);
SELECT * FROM t2 WHERE l0=2 ORDER BY 1,2;
c1	l0
A	2
B	2
C	2
UPDATE t2 SET c0=3 WHERE c0=1;
ERROR 42S22: Unknown column 'c0' in 'field list'
DELETE FROM t2 WHERE c0=1;
ERROR 42S22: Unknown column 'c0' in 'where clause'
SELECT * FROM t2 ORDER BY 1,2;
c1	l0
A	1
A	2
B	2
B	3
C	2
C	3
D	3
ALTER TABLE t2 MODIFY l0 INT FIRST;
INSERT INTO t2 VALUES('D',3);
INSERT INTO t2 VALUES(3,'D');
SELECT * FROM t2 ORDER BY 1,2;
l0	c1
1	A
2	A
2	B
2	C
3	B
3	C
3	D
3	D
ALTER TABLE t2 MODIFY l0 VARCHAR(10) AFTER c1;
ERROR HY000: 'l0': used in a foreign key constraint
ALTER TABLE t2 MODIFY l0 INT(11) ZEROFILL AFTER c1;
ERROR HY000: 'l0': used in a foreign key constraint
ALTER TABLE t2 MODIFY l0 INT(11) ZEROFILL;
ERROR HY000: 'l0': used in a foreign key constraint
#修改外键列的对应列
ALTER TABLE t1 CHANGE c0 l0 INT(5) AFTER c1;
ALTER TABLE t1 MODIFY c0 l0 INT(5) AFTER c1;
ERROR 42000: You have an error in your SQL syntax; check the manual that corresponds to your OceanBase version for the right syntax to use near 'l0 INT(5) AFTER c1' at line 1
ALTER TABLE t1 MODIFY c0 INT(5) ZEROFILL AFTER c1;
ALTER TABLE t1 CHANGE c0 c0 INT(5) ZEROFILL AFTER c1;
ALTER TABLE t1 MODIFY c0 INT(5) ZEROFILL;
ALTER TABLE t1 CHANGE c0 c0 INT(5) ZEROFILL;
ALTER TABLE t1 MODIFY c0 INT(6) AFTER c1;
ALTER TABLE t1 MODIFY c0 VARCHAR(5);
ALTER TABLE t1 CHANGE c0 l0 VARCHAR(5);
ALTER TABLE t1 MODIFY c0 INT(5) AFTER c1;
INSERT INTO t1 VALUES(13,2.2,1.7,'中!文','L','b',12,'12:12:12','2022');
INSERT INTO t1 VALUES(2.2,13,1.7,'中!文','L','b',12,'12:12:12','2022');
SELECT * FROM t1 ORDER BY 1;
c1	l0	c2	c3	c4	c5	c6	c7	c8
1	1	1.1	中文			00000	11:11:11	2000
1.1	2	1.2	中!文	A	a	00001	11:11:11	2001
1.2	3	2.2	中!文	B	a	00002	11:11:11	2002
1.3	4	3.2	中!文	C	a	00003	11:11:11	2003
1.4	5	4.2	中!文	D	a	00004	11:11:11	2004
1.5	6	5.2	中!文	E	a	00005	11:11:11	2005
1.6	7	6.2	中!文	F	a	00006	11:11:11	2006
1.7	8	7.2	中!文	G	a	00007	11:11:11	2007
1.8	9	8.2	中!文	H	a	00008	11:11:11	2011
1.9	10	9.2	中!文	I	a	00009	11:11:11	2012
2	11	1.9	中!文	J	a	00010	11:11:11	2011
2.1	12	1.8	中!文	K	a	00011	11:11:11	2012
2.2	13	1.7	中!文	L	b	00012	12:12:12	2022
#修改自增列
DROP TABLE IF EXISTS t2;
DROP TABLE IF EXISTS t1;
CREATE TABLE t1(c0 INT(5) AUTO_INCREMENT,
c1 FLOAT ,
c2 DOUBLE NOT NULL,
c3 CHAR(10) DEFAULT 'A',
c4 VARCHAR(10) UNIQUE,
c5 CHAR(10) CHARACTER SET 'gb18030' COLLATE 'gb18030_bin',
c6 INT(5) ZEROFILL,
c7 TIME,
c8 YEAR);
INSERT INTO t1 VALUES(1,1.0,1.1,'中文','','',0,'11:11:11','2000'),
(2,1.1,1.2,'中!文','A','a',1,'11:11:11','2001'),
(3,1.2,2.2,'中!文','B','a',2,'11:11:11','2002'),
(4,1.3,3.2,'中!文','C','a',3,'11:11:11','2003'),
(5,1.4,4.2,'中!文','D','a',4,'11:11:11','2004'),
(6,1.5,5.2,'中!文','E','a',5,'11:11:11','2005'),
(7,1.6,6.2,'中!文','F','a',6,'11:11:11','2006'),
(8,1.7,7.2,'中!文','G','a',7,'11:11:11','2007'),
(9,1.8,8.2,'中!文','H','a',8,'11:11:11','2011'),
(10,1.9,9.2,'中!文','I','a',9,'11:11:11','2012'),
(11,2.0,1.9,'中!文','J','a',10,'11:11:11','2011'),
(12,2.1,1.8,'中!文','K','a',11,'11:11:11','2012');
ALTER TABLE t1 CHANGE c0 l0 INT AFTER c1;
ALTER TABLE t1 MODIFY c0 INT AFTER c1;
ALTER TABLE t1 CHANGE c0 c0 INT AFTER c1;
ALTER TABLE t1 MODIFY c0 INT(5) ZEROFILL;
ALTER TABLE t1 MODIFY c0 VARCHAR(20);
ALTER TABLE t1 CHANGE c0 c0 VARCHAR(20);
ALTER TABLE t1 CHANGE c0 c0 INT(5) ZEROFILL AUTO_INCREMENT;
ALTER TABLE t1 CHANGE c0 c0 INT(3) AUTO_INCREMENT;
ALTER TABLE t1 MODIFY c0 INT(3) AUTO_INCREMENT;
ALTER TABLE t1 MODIFY c0 INT(6) AUTO_INCREMENT;
ALTER TABLE t1 CHANGE c0 c0 INT(5) AUTO_INCREMENT;
ALTER TABLE t1 MODIFY c0 INT(5) AUTO_INCREMENT;
INSERT INTO t1(c1,c2,c3,c4,c5,c6,c7,c8) VALUES(2.2,1.7,'中!文','L','b',12,'12:12:12','2022');
SELECT * FROM t1 ORDER BY 1;
c1	l0	c2	c3	c4	c5	c6	c7	c8
1	1	1.1	中文			00000	11:11:11	2000
1.1	2	1.2	中!文	A	a	00001	11:11:11	2001
1.2	3	2.2	中!文	B	a	00002	11:11:11	2002
1.3	4	3.2	中!文	C	a	00003	11:11:11	2003
1.4	5	4.2	中!文	D	a	00004	11:11:11	2004
1.5	6	5.2	中!文	E	a	00005	11:11:11	2005
1.6	7	6.2	中!文	F	a	00006	11:11:11	2006
1.7	8	7.2	中!文	G	a	00007	11:11:11	2007
1.8	9	8.2	中!文	H	a	00008	11:11:11	2011
1.9	10	9.2	中!文	I	a	00009	11:11:11	2012
2	11	1.9	中!文	J	a	00010	11:11:11	2011
2.1	12	1.8	中!文	K	a	00011	11:11:11	2012
2.2	NULL	1.7	中!文	L	b	00012	12:12:12	2022
#修改唯一约束列
DROP TABLE IF EXISTS t1;
CREATE TABLE t1(c0 INT(5),
c1 FLOAT ,
c2 DOUBLE NOT NULL,
c3 CHAR(10) DEFAULT 'A',
c4 VARCHAR(10) UNIQUE,
c5 CHAR(10) CHARACTER SET 'gb18030' COLLATE 'gb18030_bin',
c6 INT(5) ZEROFILL,
c7 TIME,
c8 YEAR);
INSERT INTO t1 VALUES(1,1.0,1.1,'中文','','',0,'11:11:11','2000'),
(2,1.1,1.2,'中!文','A','a',1,'11:11:11','2001'),
(3,1.2,2.2,'中!文','B','a',2,'11:11:11','2002'),
(4,1.3,3.2,'中!文','C','a',3,'11:11:11','2003'),
(5,1.4,4.2,'中!文','D','a',4,'11:11:11','2004'),
(6,1.5,5.2,'中!文','E','a',5,'11:11:11','2005'),
(7,1.6,6.2,'中!文','F','a',6,'11:11:11','2006'),
(8,1.7,7.2,'中!文','G','a',7,'11:11:11','2007'),
(9,1.8,8.2,'中!文','H','a',8,'11:11:11','2011'),
(10,1.9,9.2,'中!文','I','a',9,'11:11:11','2012'),
(11,2.0,1.9,'中!文','J','a',10,'11:11:11','2011'),
(12,2.1,1.8,'中!文','K','a',11,'11:11:11','2012');
INSERT INTO t1 VALUES(12,2.1,1.8,'中!文','K','a',11,'11:11:11','2012');
INSERT INTO t1 VALUES('K',12,2.1,1.8,'中!文','a',11,'11:11:11','2012');
INSERT INTO t1 VALUES('L',13,2.2,1.7,'中!文','b',12,'12:12:12','2013');
SELECT * FROM t1 ORDER BY 2;
c0	c1	c2	c3	c4	c5	c6	c7	c8
1	1	1.1	中文			00000	11:11:11	2000
2	1.1	1.2	中!文	A	a	00001	11:11:11	2001
3	1.2	2.2	中!文	B	a	00002	11:11:11	2002
4	1.3	3.2	中!文	C	a	00003	11:11:11	2003
5	1.4	4.2	中!文	D	a	00004	11:11:11	2004
6	1.5	5.2	中!文	E	a	00005	11:11:11	2005
7	1.6	6.2	中!文	F	a	00006	11:11:11	2006
8	1.7	7.2	中!文	G	a	00007	11:11:11	2007
9	1.8	8.2	中!文	H	a	00008	11:11:11	2011
10	1.9	9.2	中!文	I	a	00009	11:11:11	2012
11	2	1.9	中!文	J	a	00010	11:11:11	2011
12	2.1	1.8	中!文	K	a	00011	11:11:11	2012
ALTER TABLE t1 MODIFY c4 VARCHAR(10) AFTER c3;
INSERT INTO t1 VALUES(14,2.3,1.6,'中!文','M','c',13,'13:13:13','2014');
SELECT * FROM t1 ORDER BY 1;
c0	c1	c2	c3	c4	c5	c6	c7	c8
1	1	1.1	中文			00000	11:11:11	2000
2	1.1	1.2	中!文	A	a	00001	11:11:11	2001
3	1.2	2.2	中!文	B	a	00002	11:11:11	2002
4	1.3	3.2	中!文	C	a	00003	11:11:11	2003
5	1.4	4.2	中!文	D	a	00004	11:11:11	2004
6	1.5	5.2	中!文	E	a	00005	11:11:11	2005
7	1.6	6.2	中!文	F	a	00006	11:11:11	2006
8	1.7	7.2	中!文	G	a	00007	11:11:11	2007
9	1.8	8.2	中!文	H	a	00008	11:11:11	2011
10	1.9	9.2	中!文	I	a	00009	11:11:11	2012
11	2	1.9	中!文	J	a	00010	11:11:11	2011
12	2.1	1.8	中!文	K	a	00011	11:11:11	2012
14	2.3	1.6	中!文	M	c	00013	13:13:13	2014
ALTER TABLE t1 CHANGE c4 l4 VARCHAR(15) FIRST;
ALTER TABLE t1 MODIFY c4 VARCHAR(15) FIRST;
INSERT INTO t1 VALUES('N',15,2.4,1.5,'中!文','d',14,'14:14:14','2014');
SELECT * FROM t1 ORDER BY 2;
l4	c0	c1	c2	c3	c5	c6	c7	c8
	1	1	1.1	中文		00000	11:11:11	2000
A	2	1.1	1.2	中!文	a	00001	11:11:11	2001
B	3	1.2	2.2	中!文	a	00002	11:11:11	2002
C	4	1.3	3.2	中!文	a	00003	11:11:11	2003
D	5	1.4	4.2	中!文	a	00004	11:11:11	2004
E	6	1.5	5.2	中!文	a	00005	11:11:11	2005
F	7	1.6	6.2	中!文	a	00006	11:11:11	2006
G	8	1.7	7.2	中!文	a	00007	11:11:11	2007
H	9	1.8	8.2	中!文	a	00008	11:11:11	2011
I	10	1.9	9.2	中!文	a	00009	11:11:11	2012
J	11	2	1.9	中!文	a	00010	11:11:11	2011
K	12	2.1	1.8	中!文	a	00011	11:11:11	2012
M	14	2.3	1.6	中!文	c	00013	13:13:13	2014
N	15	2.4	1.5	中!文	d	00014	14:14:14	2014
ALTER TABLE t1 MODIFY c4 VARCHAR(5) AFTER c3;
INSERT INTO t1 VALUES(16,2.5,1.4,'中!文','N','e',15,'15:15:15','2015');
INSERT INTO t1 VALUES(16,2.5,1.4,'中!文','O','e',15,'15:15:15','2015');
SELECT * FROM t1 ORDER BY 1;
l4	c0	c1	c2	c3	c5	c6	c7	c8
	1	1	1.1	中文		00000	11:11:11	2000
A	2	1.1	1.2	中!文	a	00001	11:11:11	2001
B	3	1.2	2.2	中!文	a	00002	11:11:11	2002
C	4	1.3	3.2	中!文	a	00003	11:11:11	2003
D	5	1.4	4.2	中!文	a	00004	11:11:11	2004
E	6	1.5	5.2	中!文	a	00005	11:11:11	2005
F	7	1.6	6.2	中!文	a	00006	11:11:11	2006
G	8	1.7	7.2	中!文	a	00007	11:11:11	2007
H	9	1.8	8.2	中!文	a	00008	11:11:11	2011
I	10	1.9	9.2	中!文	a	00009	11:11:11	2012
J	11	2	1.9	中!文	a	00010	11:11:11	2011
K	12	2.1	1.8	中!文	a	00011	11:11:11	2012
M	14	2.3	1.6	中!文	c	00013	13:13:13	2014
N	15	2.4	1.5	中!文	d	00014	14:14:14	2014
ALTER TABLE t1 MODIFY c4 VARBINARY(5) FIRST;
INSERT INTO t1 VALUES('P',17,2.6,1.3,'中!文','f',16,'16:16:16','2016');
SELECT * FROM t1 ORDER BY 2;
l4	c0	c1	c2	c3	c5	c6	c7	c8
	1	1	1.1	中文		00000	11:11:11	2000
A	2	1.1	1.2	中!文	a	00001	11:11:11	2001
B	3	1.2	2.2	中!文	a	00002	11:11:11	2002
C	4	1.3	3.2	中!文	a	00003	11:11:11	2003
D	5	1.4	4.2	中!文	a	00004	11:11:11	2004
E	6	1.5	5.2	中!文	a	00005	11:11:11	2005
F	7	1.6	6.2	中!文	a	00006	11:11:11	2006
G	8	1.7	7.2	中!文	a	00007	11:11:11	2007
H	9	1.8	8.2	中!文	a	00008	11:11:11	2011
I	10	1.9	9.2	中!文	a	00009	11:11:11	2012
J	11	2	1.9	中!文	a	00010	11:11:11	2011
K	12	2.1	1.8	中!文	a	00011	11:11:11	2012
M	14	2.3	1.6	中!文	c	00013	13:13:13	2014
N	15	2.4	1.5	中!文	d	00014	14:14:14	2014
P	17	2.6	1.3	中!文	f	00016	16:16:16	2016
#修改默认值约束列
DROP TABLE IF EXISTS t1;
CREATE TABLE t1(c0 INT(5),
c1 FLOAT ,
c2 DOUBLE NOT NULL,
c3 CHAR(10) DEFAULT 'A',
c4 VARCHAR(10) UNIQUE,
c5 CHAR(10) CHARACTER SET 'gb18030' COLLATE 'gb18030_bin',
c6 INT(5) ZEROFILL,
c7 TIME,
c8 YEAR);
INSERT INTO t1 VALUES(1,1.0,1.1,'中文','','',0,'11:11:11','2000'),
(2,1.1,1.2,'中!文','A','a',1,'11:11:11','2001'),
(3,1.2,2.2,'中!文','B','a',2,'11:11:11','2002'),
(4,1.3,3.2,'中!文','C','a',3,'11:11:11','2003'),
(5,1.4,4.2,'中!文','D','a',4,'11:11:11','2004'),
(6,1.5,5.2,'中!文','E','a',5,'11:11:11','2005'),
(7,1.6,6.2,'中!文','F','a',6,'11:11:11','2006'),
(8,1.7,7.2,'中!文','G','a',7,'11:11:11','2007'),
(9,1.8,8.2,'中!文','H','a',8,'11:11:11','2011');
INSERT INTO t1(c0,c1,c2,c4,c5,c6,c7,c8) VALUES
(10,1.9,9.2,'I','a',9,'11:11:11','2012'),
(11,2.0,1.9,'J','a',10,'11:11:11','2011'),
(12,2.1,1.8,'K','a',11,'11:11:11','2012');
ALTER TABLE t1 CHANGE c3 c3 CHAR(10) DEFAULT 'AA' AFTER c4;
SELECT * FROM t1 ORDER BY 1;
c0	c1	c2	c4	c3	c5	c6	c7	c8
1	1	1.1		中文		00000	11:11:11	2000
2	1.1	1.2	A	中!文	a	00001	11:11:11	2001
3	1.2	2.2	B	中!文	a	00002	11:11:11	2002
4	1.3	3.2	C	中!文	a	00003	11:11:11	2003
5	1.4	4.2	D	中!文	a	00004	11:11:11	2004
6	1.5	5.2	E	中!文	a	00005	11:11:11	2005
7	1.6	6.2	F	中!文	a	00006	11:11:11	2006
8	1.7	7.2	G	中!文	a	00007	11:11:11	2007
9	1.8	8.2	H	中!文	a	00008	11:11:11	2011
10	1.9	9.2	I	A	a	00009	11:11:11	2012
11	2	1.9	J	A	a	00010	11:11:11	2011
12	2.1	1.8	K	A	a	00011	11:11:11	2012
INSERT INTO t1(c0,c1,c2,c4,c5,c6,c7,c8) VALUES(13,2.2,1.7,'L','b',12,'12:12:12','2012');
SELECT * FROM t1 ORDER BY 1;
c0	c1	c2	c4	c3	c5	c6	c7	c8
1	1	1.1		中文		00000	11:11:11	2000
2	1.1	1.2	A	中!文	a	00001	11:11:11	2001
3	1.2	2.2	B	中!文	a	00002	11:11:11	2002
4	1.3	3.2	C	中!文	a	00003	11:11:11	2003
5	1.4	4.2	D	中!文	a	00004	11:11:11	2004
6	1.5	5.2	E	中!文	a	00005	11:11:11	2005
7	1.6	6.2	F	中!文	a	00006	11:11:11	2006
8	1.7	7.2	G	中!文	a	00007	11:11:11	2007
9	1.8	8.2	H	中!文	a	00008	11:11:11	2011
10	1.9	9.2	I	A	a	00009	11:11:11	2012
11	2	1.9	J	A	a	00010	11:11:11	2011
12	2.1	1.8	K	A	a	00011	11:11:11	2012
13	2.2	1.7	L	AA	b	00012	12:12:12	2012
ALTER TABLE t1 CHANGE c3 m3 CHAR(10) DEFAULT 'BB';
INSERT INTO t1(c0,c1,c2,c4,c5,c6,c7,c8) VALUES(14,2.3,1.6,'M','c',13,'13:13:13','2013');
SELECT * FROM t1 ORDER BY 1;
c0	c1	c2	c4	m3	c5	c6	c7	c8
1	1	1.1		中文		00000	11:11:11	2000
2	1.1	1.2	A	中!文	a	00001	11:11:11	2001
3	1.2	2.2	B	中!文	a	00002	11:11:11	2002
4	1.3	3.2	C	中!文	a	00003	11:11:11	2003
5	1.4	4.2	D	中!文	a	00004	11:11:11	2004
6	1.5	5.2	E	中!文	a	00005	11:11:11	2005
7	1.6	6.2	F	中!文	a	00006	11:11:11	2006
8	1.7	7.2	G	中!文	a	00007	11:11:11	2007
9	1.8	8.2	H	中!文	a	00008	11:11:11	2011
10	1.9	9.2	I	A	a	00009	11:11:11	2012
11	2	1.9	J	A	a	00010	11:11:11	2011
12	2.1	1.8	K	A	a	00011	11:11:11	2012
13	2.2	1.7	L	AA	b	00012	12:12:12	2012
14	2.3	1.6	M	BB	c	00013	13:13:13	2013
UPDATE t1 SET m3='CC' WHERE c3='A';
ERROR 42S22: Unknown column 'c3' in 'where clause'
UPDATE t1 SET c3='CC' WHERE m3='A';
ERROR 42S22: Unknown column 'c3' in 'field list'
DELETE FROM t1 WHERE c3='A';
ERROR 42S22: Unknown column 'c3' in 'where clause'
SELECT * FROM t1 ORDER BY 1;
c0	c1	c2	c4	m3	c5	c6	c7	c8
1	1	1.1		中文		00000	11:11:11	2000
2	1.1	1.2	A	中!文	a	00001	11:11:11	2001
3	1.2	2.2	B	中!文	a	00002	11:11:11	2002
4	1.3	3.2	C	中!文	a	00003	11:11:11	2003
5	1.4	4.2	D	中!文	a	00004	11:11:11	2004
6	1.5	5.2	E	中!文	a	00005	11:11:11	2005
7	1.6	6.2	F	中!文	a	00006	11:11:11	2006
8	1.7	7.2	G	中!文	a	00007	11:11:11	2007
9	1.8	8.2	H	中!文	a	00008	11:11:11	2011
10	1.9	9.2	I	A	a	00009	11:11:11	2012
11	2	1.9	J	A	a	00010	11:11:11	2011
12	2.1	1.8	K	A	a	00011	11:11:11	2012
13	2.2	1.7	L	AA	b	00012	12:12:12	2012
14	2.3	1.6	M	BB	c	00013	13:13:13	2013
UPDATE t1 SET m3='CC' WHERE m3='A';
DELETE FROM t1 WHERE m3='AA';
SELECT * FROM t1 ORDER BY 1;
c0	c1	c2	c4	m3	c5	c6	c7	c8
1	1	1.1		中文		00000	11:11:11	2000
2	1.1	1.2	A	中!文	a	00001	11:11:11	2001
3	1.2	2.2	B	中!文	a	00002	11:11:11	2002
4	1.3	3.2	C	中!文	a	00003	11:11:11	2003
5	1.4	4.2	D	中!文	a	00004	11:11:11	2004
6	1.5	5.2	E	中!文	a	00005	11:11:11	2005
7	1.6	6.2	F	中!文	a	00006	11:11:11	2006
8	1.7	7.2	G	中!文	a	00007	11:11:11	2007
9	1.8	8.2	H	中!文	a	00008	11:11:11	2011
10	1.9	9.2	I	CC	a	00009	11:11:11	2012
11	2	1.9	J	CC	a	00010	11:11:11	2011
12	2.1	1.8	K	CC	a	00011	11:11:11	2012
14	2.3	1.6	M	BB	c	00013	13:13:13	2013
ALTER TABLE t1 MODIFY m3 CHAR(20) DEFAULT 'B' AFTER c2;
SELECT * FROM t1 ORDER BY 1;
c0	c1	c2	m3	c4	c5	c6	c7	c8
1	1	1.1	中文			00000	11:11:11	2000
2	1.1	1.2	中!文	A	a	00001	11:11:11	2001
3	1.2	2.2	中!文	B	a	00002	11:11:11	2002
4	1.3	3.2	中!文	C	a	00003	11:11:11	2003
5	1.4	4.2	中!文	D	a	00004	11:11:11	2004
6	1.5	5.2	中!文	E	a	00005	11:11:11	2005
7	1.6	6.2	中!文	F	a	00006	11:11:11	2006
8	1.7	7.2	中!文	G	a	00007	11:11:11	2007
9	1.8	8.2	中!文	H	a	00008	11:11:11	2011
10	1.9	9.2	CC	I	a	00009	11:11:11	2012
11	2	1.9	CC	J	a	00010	11:11:11	2011
12	2.1	1.8	CC	K	a	00011	11:11:11	2012
14	2.3	1.6	BB	M	c	00013	13:13:13	2013
INSERT INTO t1(c0,c1,c2,c4,c5,c6,c7,c8) VALUES(15,2.4,1.5,'N','c',14,'14:14:14','2014');
INSERT INTO t1 VALUES(16,2.5,1.4,'O','d',15,'15:15:15','2015');
ERROR 21S01: Column count doesn't match value count at row 1
INSERT INTO t1 VALUES(16,2.5,1.4,'DD','O','d',15,'15:15:15','2015');
SELECT * FROM t1 ORDER BY 1;
c0	c1	c2	m3	c4	c5	c6	c7	c8
1	1	1.1	中文			00000	11:11:11	2000
2	1.1	1.2	中!文	A	a	00001	11:11:11	2001
3	1.2	2.2	中!文	B	a	00002	11:11:11	2002
4	1.3	3.2	中!文	C	a	00003	11:11:11	2003
5	1.4	4.2	中!文	D	a	00004	11:11:11	2004
6	1.5	5.2	中!文	E	a	00005	11:11:11	2005
7	1.6	6.2	中!文	F	a	00006	11:11:11	2006
8	1.7	7.2	中!文	G	a	00007	11:11:11	2007
9	1.8	8.2	中!文	H	a	00008	11:11:11	2011
10	1.9	9.2	CC	I	a	00009	11:11:11	2012
11	2	1.9	CC	J	a	00010	11:11:11	2011
12	2.1	1.8	CC	K	a	00011	11:11:11	2012
14	2.3	1.6	BB	M	c	00013	13:13:13	2013
15	2.4	1.5	B	N	c	00014	14:14:14	2014
16	2.5	1.4	DD	O	d	00015	15:15:15	2015
ALTER TABLE t1 MODIFY m3 CHAR(10) CHARACTER SET 'gbk' COLLATE 'gbk_bin' DEFAULT 'TEST' COMMENT '修改列' AFTER c2;
SELECT * FROM t1 ORDER BY 1;
c0	c1	c2	m3	c4	c5	c6	c7	c8
1	1	1.1	中文			00000	11:11:11	2000
2	1.1	1.2	中!文	A	a	00001	11:11:11	2001
3	1.2	2.2	中!文	B	a	00002	11:11:11	2002
4	1.3	3.2	中!文	C	a	00003	11:11:11	2003
5	1.4	4.2	中!文	D	a	00004	11:11:11	2004
6	1.5	5.2	中!文	E	a	00005	11:11:11	2005
7	1.6	6.2	中!文	F	a	00006	11:11:11	2006
8	1.7	7.2	中!文	G	a	00007	11:11:11	2007
9	1.8	8.2	中!文	H	a	00008	11:11:11	2011
10	1.9	9.2	CC	I	a	00009	11:11:11	2012
11	2	1.9	CC	J	a	00010	11:11:11	2011
12	2.1	1.8	CC	K	a	00011	11:11:11	2012
14	2.3	1.6	BB	M	c	00013	13:13:13	2013
15	2.4	1.5	B	N	c	00014	14:14:14	2014
16	2.5	1.4	DD	O	d	00015	15:15:15	2015
INSERT INTO t1(c0,c1,c2,c4,c5,c6,c7,c8) VALUES(18,2.6,1.6,'Q','b',15,'16:16:16','2016');
SELECT * FROM t1 ORDER BY 1;
c0	c1	c2	m3	c4	c5	c6	c7	c8
1	1	1.1	中文			00000	11:11:11	2000
2	1.1	1.2	中!文	A	a	00001	11:11:11	2001
3	1.2	2.2	中!文	B	a	00002	11:11:11	2002
4	1.3	3.2	中!文	C	a	00003	11:11:11	2003
5	1.4	4.2	中!文	D	a	00004	11:11:11	2004
6	1.5	5.2	中!文	E	a	00005	11:11:11	2005
7	1.6	6.2	中!文	F	a	00006	11:11:11	2006
8	1.7	7.2	中!文	G	a	00007	11:11:11	2007
9	1.8	8.2	中!文	H	a	00008	11:11:11	2011
10	1.9	9.2	CC	I	a	00009	11:11:11	2012
11	2	1.9	CC	J	a	00010	11:11:11	2011
12	2.1	1.8	CC	K	a	00011	11:11:11	2012
14	2.3	1.6	BB	M	c	00013	13:13:13	2013
15	2.4	1.5	B	N	c	00014	14:14:14	2014
16	2.5	1.4	DD	O	d	00015	15:15:15	2015
18	2.6	1.6	TEST	Q	b	00015	16:16:16	2016
#修改非空约束列
DROP TABLE IF EXISTS t1;
CREATE TABLE t1(c0 INT(5),
c1 FLOAT ,
c2 DOUBLE NOT NULL,
c3 CHAR(10) DEFAULT 'A',
c4 VARCHAR(10) UNIQUE,
c5 CHAR(10) CHARACTER SET 'gb18030' COLLATE 'gb18030_bin',
c6 INT(5) ZEROFILL,
c7 TIME,
c8 YEAR);
INSERT INTO t1 VALUES(1,1.0,1.1,'中文','','',0,'11:11:11','2000'),
(2,1.1,1.2,'中!文','A','a',1,'11:11:11','2001'),
(3,1.2,2.2,'中!文','B','a',2,'11:11:11','2002'),
(4,1.3,3.2,'中!文','C','a',3,'11:11:11','2003'),
(5,1.4,4.2,'中!文','D','a',4,'11:11:11','2004'),
(6,1.5,5.2,'中!文','E','a',5,'11:11:11','2005'),
(7,1.6,6.2,'中!文','F','a',6,'11:11:11','2006'),
(8,1.7,7.2,'中!文','G','a',7,'11:11:11','2007'),
(9,1.8,8.2,'中!文','H','a',8,'11:11:11','2011');
INSERT INTO t1(c0,c1,c2,c4,c5,c6,c7,c8) VALUES
(10,1.9,9.2,'I','a',9,'11:11:11','2012'),
(11,2.0,1.9,'J','a',10,'11:11:11','2011'),
(12,2.1,1.8,'K','a',11,'11:11:11','2012');
ALTER TABLE t1 CHANGE c2 m2 DOUBLE(5,0) NOT NULL FIRST;
ALTER TABLE t1 CHANGE c2 c2 DOUBLE(5,0) NOT NULL FIRST;
INSERT INTO t1 VALUES(1.7,13,2.2,'中-文','L','b',12,'12:12:12','2012');
SELECT * FROM t1 ORDER BY 2;
m2	c0	c1	c3	c4	c5	c6	c7	c8
1	1	1	中文			00000	11:11:11	2000
1	2	1.1	中!文	A	a	00001	11:11:11	2001
2	3	1.2	中!文	B	a	00002	11:11:11	2002
3	4	1.3	中!文	C	a	00003	11:11:11	2003
4	5	1.4	中!文	D	a	00004	11:11:11	2004
5	6	1.5	中!文	E	a	00005	11:11:11	2005
6	7	1.6	中!文	F	a	00006	11:11:11	2006
7	8	1.7	中!文	G	a	00007	11:11:11	2007
8	9	1.8	中!文	H	a	00008	11:11:11	2011
9	10	1.9	A	I	a	00009	11:11:11	2012
2	11	2	A	J	a	00010	11:11:11	2011
2	12	2.1	A	K	a	00011	11:11:11	2012
2	13	2.2	中-文	L	b	00012	12:12:12	2012
ALTER TABLE t1 CHANGE c2 m2 INT NOT NULL AFTER c1;
ALTER TABLE t1 CHANGE c2 m2 INT DEFAULT NULL;
ALTER TABLE t1 CHANGE c2 c2 INT DEFAULT NULL AFTER c1;
INSERT INTO t1(c0,c1,c4,c5,c6,c7,c8) VALUES(14,2.3,'M','b',14,'14:14:14','2014');
SELECT * FROM t1 ORDER BY 1;
m2	c0	c1	c3	c4	c5	c6	c7	c8
1	1	1	中文			00000	11:11:11	2000
1	2	1.1	中!文	A	a	00001	11:11:11	2001
2	3	1.2	中!文	B	a	00002	11:11:11	2002
2	11	2	A	J	a	00010	11:11:11	2011
2	12	2.1	A	K	a	00011	11:11:11	2012
2	13	2.2	中-文	L	b	00012	12:12:12	2012
3	4	1.3	中!文	C	a	00003	11:11:11	2003
4	5	1.4	中!文	D	a	00004	11:11:11	2004
5	6	1.5	中!文	E	a	00005	11:11:11	2005
6	7	1.6	中!文	F	a	00006	11:11:11	2006
7	8	1.7	中!文	G	a	00007	11:11:11	2007
8	9	1.8	中!文	H	a	00008	11:11:11	2011
9	10	1.9	A	I	a	00009	11:11:11	2012
#修改检查约束列
DROP TABLE IF EXISTS t1;
CREATE TABLE t1(c0 INT(5),
c1 FLOAT ,
c2 DOUBLE NOT NULL,
c3 CHAR(10) DEFAULT 'A',
c4 VARCHAR(10) UNIQUE,
c5 CHAR(10) CHARACTER SET 'gb18030' COLLATE 'gb18030_bin',
c6 INT(5) ZEROFILL,
c7 TIME,
c8 YEAR,CHECK(c8>=c6)
);
INSERT INTO t1 VALUES(1,1.0,1.1,'中文','','',1000,'11:11:11','2000'),
(2,1.1,1.2,'中!文','A','a',1100,'11:11:11','2001'),
(3,1.2,2.2,'中!文','B','a',1200,'11:11:11','2002'),
(4,1.3,3.2,'中!文','C','a',1300,'11:11:11','2003'),
(5,1.4,4.2,'中!文','D','a',1400,'11:11:11','2004'),
(6,1.5,5.2,'中!文','E','a',1500,'11:11:11','2005'),
(7,1.6,6.2,'中!文','F','a',1600,'11:11:11','2006'),
(8,1.7,7.2,'中!文','G','a',1700,'11:11:11','2007'),
(9,1.8,8.2,'中!文','H','a',1800,'11:11:11','2011');
ALTER TABLE t1 CHANGE c8 m8 YEAR AFTER c6;
ALTER TABLE t1 CHANGE c8 c8 YEAR ATEFR c6;
DESC t1;
Field	Type	Null	Key	Default	Extra
c0	int(5)	YES		NULL	
c1	float	YES		NULL	
c2	double	NO		NULL	
c3	char(10)	YES		A	
c4	varchar(10)	YES	UNI	NULL	
c5	char(10)	YES		NULL	
c6	int(5) unsigned	YES		NULL	
c7	time	YES		NULL	
c8	year(4)	YES		NULL	
INSERT INTO t1 VALUES(10,1.9,8.3,'中-文','I','b',2800,'12:12:12','2012');
INSERT INTO t1 VALUES(10,1.9,8.3,'中-文','I','b',2800,'2012','12:12:12');
INSERT INTO t1 VALUES(10,1.9,8.3,'中-文','I','b',1900,'2012','12:12:12');
SELECT * FROM t1 ORDER BY 1;
c0	c1	c2	c3	c4	c5	c6	c7	c8
1	1	1.1	中文			01000	11:11:11	2000
2	1.1	1.2	中!文	A	a	01100	11:11:11	2001
3	1.2	2.2	中!文	B	a	01200	11:11:11	2002
4	1.3	3.2	中!文	C	a	01300	11:11:11	2003
5	1.4	4.2	中!文	D	a	01400	11:11:11	2004
6	1.5	5.2	中!文	E	a	01500	11:11:11	2005
7	1.6	6.2	中!文	F	a	01600	11:11:11	2006
8	1.7	7.2	中!文	G	a	01700	11:11:11	2007
9	1.8	8.2	中!文	H	a	01800	11:11:11	2011
ALTER TABLE t1 CHANGE c8 m8 YEAR;
DESC t1;
Field	Type	Null	Key	Default	Extra
c0	int(5)	YES		NULL	
c1	float	YES		NULL	
c2	double	NO		NULL	
c3	char(10)	YES		A	
c4	varchar(10)	YES	UNI	NULL	
c5	char(10)	YES		NULL	
c6	int(5) unsigned	YES		NULL	
c7	time	YES		NULL	
m8	year(4)	YES		NULL	
INSERT INTO t1 VALUES(11,2.0,8.4,'中=文','J','c',2900,'2013','13:13:13');
INSERT INTO t1(c0,c1,c2,c3,c4,c5,c6,m8,c7) VALUES(11,2.0,8.4,'中=文','J','c',2900,'2013','13:13:13');
INSERT INTO t1(c0,c1,c2,c3,c4,c5,c6,m8,c7) VALUES(11,2.0,8.4,'中=文','J','c',2000,'2013','13:13:13');
DELETE FROM t1 WHERE m8 IN(2000,2013);
SELECT * FROM t1 ORDER BY 1;
c0	c1	c2	c3	c4	c5	c6	c7	m8
2	1.1	1.2	中!文	A	a	01100	11:11:11	2001
3	1.2	2.2	中!文	B	a	01200	11:11:11	2002
4	1.3	3.2	中!文	C	a	01300	11:11:11	2003
5	1.4	4.2	中!文	D	a	01400	11:11:11	2004
6	1.5	5.2	中!文	E	a	01500	11:11:11	2005
7	1.6	6.2	中!文	F	a	01600	11:11:11	2006
8	1.7	7.2	中!文	G	a	01700	11:11:11	2007
9	1.8	8.2	中!文	H	a	01800	11:11:11	2011
ALTER TABLE t1 MODIFY m8 TIMESTAMP DEFAULT '2000-01-01 00:00:00' AFTER c7;
ERROR 0A000: Alter column with check constraint not supported
ALTER TABLE t1 MODIFY m8 TIMESTAMP AFTER c7;
ERROR 0A000: Alter column with check constraint not supported
ALTER TABLE t1 MODIFY m8 YEAR AFTER c7;
DESC t1;
Field	Type	Null	Key	Default	Extra
c0	int(5)	YES		NULL	
c1	float	YES		NULL	
c2	double	NO		NULL	
c3	char(10)	YES		A	
c4	varchar(10)	YES	UNI	NULL	
c5	char(10)	YES		NULL	
c6	int(5) unsigned	YES		NULL	
c7	time	YES		NULL	
m8	year(4)	YES		NULL	
INSERT INTO t1 VALUES(12,2.1,8.5,'中0文','K','d',2100,'2014','14:14:14');
ERROR 01000: Data truncated for column 'm8' at row 1
INSERT INTO t1 VALUES(12,2.1,8.5,'中0文','K','d',2100,'14:14:14','2014');
ERROR HY000: check constraint violated
INSERT INTO t1 VALUES(12,2.1,8.5,'中0文','K','d',2014,'14:14:14','2014');
SELECT * FROM t1 ORDER BY 1;
c0	c1	c2	c3	c4	c5	c6	c7	m8
2	1.1	1.2	中!文	A	a	01100	11:11:11	2001
3	1.2	2.2	中!文	B	a	01200	11:11:11	2002
4	1.3	3.2	中!文	C	a	01300	11:11:11	2003
5	1.4	4.2	中!文	D	a	01400	11:11:11	2004
6	1.5	5.2	中!文	E	a	01500	11:11:11	2005
7	1.6	6.2	中!文	F	a	01600	11:11:11	2006
8	1.7	7.2	中!文	G	a	01700	11:11:11	2007
9	1.8	8.2	中!文	H	a	01800	11:11:11	2011
12	2.1	8.5	中0文	K	d	02014	14:14:14	2014
ALTER TABLE t1 CHANGE c6 m6 INT(5) ZEROFILL AFTER c0;
ALTER TABLE t1 CHANGE c6 c6 INT(5) ZEROFILL AFTER c0;
DESC t1;
Field	Type	Null	Key	Default	Extra
c0	int(5)	YES		NULL	
c6	int(5) unsigned	YES		NULL	
c1	float	YES		NULL	
c2	double	NO		NULL	
c3	char(10)	YES		A	
c4	varchar(10)	YES	UNI	NULL	
c5	char(10)	YES		NULL	
c7	time	YES		NULL	
m8	year(4)	YES		NULL	
INSERT INTO t1 VALUES(13,2024,2.2,8.6,'中9文','L','d','15:15:15','2015');
ERROR HY000: check constraint violated
INSERT INTO t1 VALUES(13,2014,2.2,8.6,'中9文','L','d','15:15:15','2015');
SELECT * FROM t1 ORDER BY 1;
c0	c6	c1	c2	c3	c4	c5	c7	m8
2	01100	1.1	1.2	中!文	A	a	11:11:11	2001
3	01200	1.2	2.2	中!文	B	a	11:11:11	2002
4	01300	1.3	3.2	中!文	C	a	11:11:11	2003
5	01400	1.4	4.2	中!文	D	a	11:11:11	2004
6	01500	1.5	5.2	中!文	E	a	11:11:11	2005
7	01600	1.6	6.2	中!文	F	a	11:11:11	2006
8	01700	1.7	7.2	中!文	G	a	11:11:11	2007
9	01800	1.8	8.2	中!文	H	a	11:11:11	2011
12	02014	2.1	8.5	中0文	K	d	14:14:14	2014
13	02014	2.2	8.6	中9文	L	d	15:15:15	2015
ALTER TABLE t1 CHANGE c6 m6 INT(6) ZEROFILL;
ALTER TABLE t1 CHANGE m6 m6 INT(5) NOT NULL;
ERROR 0A000: Alter column with check constraint not supported
ALTER TABLE t1 CHANGE m6 m6 INT(5) ZEROFILL DEFAULT 0;
DESC t1;
Field	Type	Null	Key	Default	Extra
c0	int(5)	YES		NULL	
m6	int(5) unsigned	YES		0	
c1	float	YES		NULL	
c2	double	NO		NULL	
c3	char(10)	YES		A	
c4	varchar(10)	YES	UNI	NULL	
c5	char(10)	YES		NULL	
c7	time	YES		NULL	
m8	year(4)	YES		NULL	
SELECT * FROM t1 ORDER BY 1;
c0	m6	c1	c2	c3	c4	c5	c7	m8
2	01100	1.1	1.2	中!文	A	a	11:11:11	2001
3	01200	1.2	2.2	中!文	B	a	11:11:11	2002
4	01300	1.3	3.2	中!文	C	a	11:11:11	2003
5	01400	1.4	4.2	中!文	D	a	11:11:11	2004
6	01500	1.5	5.2	中!文	E	a	11:11:11	2005
7	01600	1.6	6.2	中!文	F	a	11:11:11	2006
8	01700	1.7	7.2	中!文	G	a	11:11:11	2007
9	01800	1.8	8.2	中!文	H	a	11:11:11	2011
12	02014	2.1	8.5	中0文	K	d	14:14:14	2014
13	02014	2.2	8.6	中9文	L	d	15:15:15	2015
INSERT INTO t1(c0,c1,c2,c3,c4,c5,c7,m8) VALUES(14,2.3,8.7,'中8文','M','e','16:16:16','2016');
SELECT * FROM t1 ORDER BY 1;
c0	m6	c1	c2	c3	c4	c5	c7	m8
2	01100	1.1	1.2	中!文	A	a	11:11:11	2001
3	01200	1.2	2.2	中!文	B	a	11:11:11	2002
4	01300	1.3	3.2	中!文	C	a	11:11:11	2003
5	01400	1.4	4.2	中!文	D	a	11:11:11	2004
6	01500	1.5	5.2	中!文	E	a	11:11:11	2005
7	01600	1.6	6.2	中!文	F	a	11:11:11	2006
8	01700	1.7	7.2	中!文	G	a	11:11:11	2007
9	01800	1.8	8.2	中!文	H	a	11:11:11	2011
12	02014	2.1	8.5	中0文	K	d	14:14:14	2014
13	02014	2.2	8.6	中9文	L	d	15:15:15	2015
14	00000	2.3	8.7	中8文	M	e	16:16:16	2016
ALTER TABLE t1 MODIFY m6 INT NOT NULL AFTER c5;
ERROR 0A000: Alter column with check constraint not supported
ALTER TABLE t1 MODIFY m6 INT(5) ZEROFILL AFTER c5;
DESC t1;
Field	Type	Null	Key	Default	Extra
c0	int(5)	YES		NULL	
c1	float	YES		NULL	
c2	double	NO		NULL	
c3	char(10)	YES		A	
c4	varchar(10)	YES	UNI	NULL	
c5	char(10)	YES		NULL	
m6	int(5) unsigned	YES		NULL	
c7	time	YES		NULL	
m8	year(4)	YES		NULL	
INSERT INTO t1 VALUES(15,2.4,8.8,'中7文','N','a',2020,'17:17:17','2017');
ERROR HY000: check constraint violated
INSERT INTO t1 VALUES(15,2.4,8.8,'中7文','N','a',2010,'17:17:17','2017');
SELECT * FROM t1 ORDER BY 1;
c0	c1	c2	c3	c4	c5	m6	c7	m8
2	1.1	1.2	中!文	A	a	01100	11:11:11	2001
3	1.2	2.2	中!文	B	a	01200	11:11:11	2002
4	1.3	3.2	中!文	C	a	01300	11:11:11	2003
5	1.4	4.2	中!文	D	a	01400	11:11:11	2004
6	1.5	5.2	中!文	E	a	01500	11:11:11	2005
7	1.6	6.2	中!文	F	a	01600	11:11:11	2006
8	1.7	7.2	中!文	G	a	01700	11:11:11	2007
9	1.8	8.2	中!文	H	a	01800	11:11:11	2011
12	2.1	8.5	中0文	K	d	02014	14:14:14	2014
13	2.2	8.6	中9文	L	d	02014	15:15:15	2015
14	2.3	8.7	中8文	M	e	00000	16:16:16	2016
15	2.4	8.8	中7文	N	a	02010	17:17:17	2017
#修改指定字符集和字符序列
DROP TABLE IF EXISTS t1;
CREATE TABLE t1(c0 INT(5),
c1 FLOAT ,
c2 DOUBLE NOT NULL,
c3 CHAR(10) DEFAULT 'A',
c4 VARCHAR(10) UNIQUE,
c5 CHAR(10) CHARACTER SET 'gb18030' COLLATE 'gb18030_bin',
c6 INT(5) ZEROFILL,
c7 TIME,
c8 YEAR
);
INSERT INTO t1 VALUES(1,1.0,1.1,'中文','','',1000,'11:11:11','2000'),
(2,1.1,1.2,'中!文','A','a',1100,'11:11:11','2001'),
(3,1.2,2.2,'中!文','B','a',1200,'11:11:11','2002'),
(4,1.3,3.2,'中!文','C','a',1300,'11:11:11','2003'),
(5,1.4,4.2,'中!文','D','a',1400,'11:11:11','2004'),
(6,1.5,5.2,'中!文','E','a',1500,'11:11:11','2005'),
(7,1.6,6.2,'中!文','F','a',1600,'11:11:11','2006'),
(8,1.7,7.2,'中!文','G','a',1700,'11:11:11','2007'),
(9,1.8,8.2,'中!文','H','a',1800,'11:11:11','2011');
ALTER TABLE t1 CHANGE c5 m5 CHAR(20) CHARACTER SET 'utf16' COLLATE 'utf16_bin' AFTER c3;
ALTER TABLE t1 CHANGE c5 c5 CHAR(20) CHARACTER SET 'utf16' COLLATE 'utf16_bin' AFTER c3;
INSERT INTO t1 VALUES(10,1.9,8.3,'中!文','I','b',1900,'12:12:12','2012');
ERROR 23000: Duplicate entry 'b' for key 'c4'
INSERT INTO t1 VALUES(10,1.9,8.3,'中!文','b','I',1900,'12:12:12','2012');
SELECT * FROM t1 ORDER BY 1;
c0	c1	c2	c3	m5	c4	c6	c7	c8
1	1	1.1	中文			01000	11:11:11	2000
2	1.1	1.2	中!文	a	A	01100	11:11:11	2001
3	1.2	2.2	中!文	a	B	01200	11:11:11	2002
4	1.3	3.2	中!文	a	C	01300	11:11:11	2003
5	1.4	4.2	中!文	a	D	01400	11:11:11	2004
6	1.5	5.2	中!文	a	E	01500	11:11:11	2005
7	1.6	6.2	中!文	a	F	01600	11:11:11	2006
8	1.7	7.2	中!文	a	G	01700	11:11:11	2007
9	1.8	8.2	中!文	a	H	01800	11:11:11	2011
10	1.9	8.3	中!文	b	I	01900	12:12:12	2012
#修改常规索引列和组合索引列
DROP TABLE IF EXISTS t1;
CREATE TABLE t1(c0 INT(5) ZEROFILL,
c1 FLOAT AUTO_INCREMENT PRIMARY KEY,
c2 DOUBLE NOT NULL,
c3 CHAR(10) DEFAULT 'A',
c4 VARCHAR(10) UNIQUE,
c5 CHAR(10),
c6 INT NOT NULL,
c7 TIME DEFAULT '12:00:00',
c8 YEAR );
INSERT INTO t1 VALUES(1,1.0,1.1,'中文','','',0,'11:11:11','2000'),
(2,1.1,1.2,'中!文','A','a',1,'11:11:11','2001'),
(3,1.2,2.2,'中!文','B','a',1,'11:11:11','2002'),
(4,1.3,3.2,'中!文','C','a',1,'11:11:11','2003'),
(5,1.4,4.2,'中!文','D','a',1,'11:11:11','2004'),
(6,1.5,5.2,'中!文','E','a',1,'11:11:11','2005'),
(7,1.6,6.2,'中!文','F','a',1,'11:11:11','2006'),
(8,1.7,7.2,'中!文','G','a',1,'11:11:11','2007'),
(9,1.8,8.2,'中!文','H','a',1,'11:11:11','2011'),
(10,1.9,9.2,'中!文','I','a',1,'11:11:11','2012'),
(11,2.0,1.9,'中!文','J','a',1,'11:11:11','2011');
ALTER TABLE t1 CHANGE c5 m5 CHAR(10) AFTER c3;
ALTER TABLE t1 CHANGE c5 m5 CHAR(15);
ALTER TABLE t1 CHANGE m5 m5 CHAR(20) AFTER c8;
SELECT * FROM t1 ORDER BY 1;
c0	c1	c2	c3	c4	c6	c7	c8	m5
00001	1	1.1	中文		0	11:11:11	2000	
00002	1.1	1.2	中!文	A	1	11:11:11	2001	a
00003	1.2	2.2	中!文	B	1	11:11:11	2002	a
00004	1.3	3.2	中!文	C	1	11:11:11	2003	a
00005	1.4	4.2	中!文	D	1	11:11:11	2004	a
00006	1.5	5.2	中!文	E	1	11:11:11	2005	a
00007	1.6	6.2	中!文	F	1	11:11:11	2006	a
00008	1.7	7.2	中!文	G	1	11:11:11	2007	a
00009	1.8	8.2	中!文	H	1	11:11:11	2011	a
00010	1.9	9.2	中!文	I	1	11:11:11	2012	a
00011	2	1.9	中!文	J	1	11:11:11	2011	a
INSERT INTO t1 VALUES(12,2.1,2.0,'中!文','K','b',2,'12:12:12','2012');
INSERT INTO t1 VALUES(12,2.1,2.0,'中!文','K',2,'12:12:12','2012','b');
SELECT * FROM t1 WHERE m5='b';
c0	c1	c2	c3	c4	c6	c7	c8	m5
00012	2.1	2	中!文	K	2	12:12:12	2012	b
ALTER TABLE t1 CHANGE m5 c5 VARCHAR(20) AFTER c4;
ALTER TABLE t1 CHANGE m5 m5 VARCHAR(20) AFTER c4;
INSERT INTO t1 VALUES(13,2.2,2.1,'中!文','L','c',3,'13:13:13','2013');
SELECT * FROM t1 ORDER BY 1;
c0	c1	c2	c3	c4	c5	c6	c7	c8
00001	1	1.1	中文			0	11:11:11	2000
00002	1.1	1.2	中!文	A	a	1	11:11:11	2001
00003	1.2	2.2	中!文	B	a	1	11:11:11	2002
00004	1.3	3.2	中!文	C	a	1	11:11:11	2003
00005	1.4	4.2	中!文	D	a	1	11:11:11	2004
00006	1.5	5.2	中!文	E	a	1	11:11:11	2005
00007	1.6	6.2	中!文	F	a	1	11:11:11	2006
00008	1.7	7.2	中!文	G	a	1	11:11:11	2007
00009	1.8	8.2	中!文	H	a	1	11:11:11	2011
00010	1.9	9.2	中!文	I	a	1	11:11:11	2012
00011	2	1.9	中!文	J	a	1	11:11:11	2011
00012	2.1	2	中!文	K	b	2	12:12:12	2012
00013	2.2	2.1	中!文	L	c	3	13:13:13	2013
SELECT /*+INDEX(t1 ind_1) */ * FROM t1 ORDER BY 1;
c0	c1	c2	c3	c4	c5	c6	c7	c8
00001	1	1.1	中文			0	11:11:11	2000
00002	1.1	1.2	中!文	A	a	1	11:11:11	2001
00003	1.2	2.2	中!文	B	a	1	11:11:11	2002
00004	1.3	3.2	中!文	C	a	1	11:11:11	2003
00005	1.4	4.2	中!文	D	a	1	11:11:11	2004
00006	1.5	5.2	中!文	E	a	1	11:11:11	2005
00007	1.6	6.2	中!文	F	a	1	11:11:11	2006
00008	1.7	7.2	中!文	G	a	1	11:11:11	2007
00009	1.8	8.2	中!文	H	a	1	11:11:11	2011
00010	1.9	9.2	中!文	I	a	1	11:11:11	2012
00011	2	1.9	中!文	J	a	1	11:11:11	2011
00012	2.1	2	中!文	K	b	2	12:12:12	2012
00013	2.2	2.1	中!文	L	c	3	13:13:13	2013
ALTER TABLE t1 MODIFY m5 BINARY(10) AFTER c4;
INSERT INTO t1 VALUES(15,2.4,2.3,'中0文','N','e',5,'15:15:15','2015');
SELECT /*+INDEX(t1 ind_1) */ * FROM t1 ORDER BY 1;
c0	c1	c2	c3	c4	c5	c6	c7	c8
00001	1	1.1	中文			0	11:11:11	2000
00002	1.1	1.2	中!文	A	a	1	11:11:11	2001
00003	1.2	2.2	中!文	B	a	1	11:11:11	2002
00004	1.3	3.2	中!文	C	a	1	11:11:11	2003
00005	1.4	4.2	中!文	D	a	1	11:11:11	2004
00006	1.5	5.2	中!文	E	a	1	11:11:11	2005
00007	1.6	6.2	中!文	F	a	1	11:11:11	2006
00008	1.7	7.2	中!文	G	a	1	11:11:11	2007
00009	1.8	8.2	中!文	H	a	1	11:11:11	2011
00010	1.9	9.2	中!文	I	a	1	11:11:11	2012
00011	2	1.9	中!文	J	a	1	11:11:11	2011
00012	2.1	2	中!文	K	b	2	12:12:12	2012
00013	2.2	2.1	中!文	L	c	3	13:13:13	2013
00015	2.4	2.3	中0文	N	e	5	15:15:15	2015
ALTER TABLE t1 CHANGE c6 m6 INT NOT NULL AFTER c0;
ALTER TABLE t1 CHANGE c6 c6 INT(5) ZEROFILL DEFAULT 0 AFTER c0;
INSERT INTO t1 VALUES(16,6,2.5,2.2,'中9文','O','a','16:16:16','2016');
SELECT /*+INDEX(t1 ind_2) */ * FROM t1 ORDER BY 1;
c0	m6	c1	c2	c3	c4	c5	c7	c8
00001	0	1	1.1	中文			11:11:11	2000
00002	1	1.1	1.2	中!文	A	a	11:11:11	2001
00003	1	1.2	2.2	中!文	B	a	11:11:11	2002
00004	1	1.3	3.2	中!文	C	a	11:11:11	2003
00005	1	1.4	4.2	中!文	D	a	11:11:11	2004
00006	1	1.5	5.2	中!文	E	a	11:11:11	2005
00007	1	1.6	6.2	中!文	F	a	11:11:11	2006
00008	1	1.7	7.2	中!文	G	a	11:11:11	2007
00009	1	1.8	8.2	中!文	H	a	11:11:11	2011
00010	1	1.9	9.2	中!文	I	a	11:11:11	2012
00011	1	2	1.9	中!文	J	a	11:11:11	2011
00012	2	2.1	2	中!文	K	b	12:12:12	2012
00013	3	2.2	2.1	中!文	L	c	13:13:13	2013
00015	5	2.4	2.3	中0文	N	e	15:15:15	2015
00016	6	2.5	2.2	中9文	O	a	16:16:16	2016
ALTER TABLE t1 CHANGE c6 m6 INT(5) ZEROFILL DEFAULT 0;
SELECT /*+INDEX(t1 ind_2) */ * FROM t1 ORDER BY 1;
c0	m6	c1	c2	c3	c4	c5	c7	c8
00001	0	1	1.1	中文			11:11:11	2000
00002	1	1.1	1.2	中!文	A	a	11:11:11	2001
00003	1	1.2	2.2	中!文	B	a	11:11:11	2002
00004	1	1.3	3.2	中!文	C	a	11:11:11	2003
00005	1	1.4	4.2	中!文	D	a	11:11:11	2004
00006	1	1.5	5.2	中!文	E	a	11:11:11	2005
00007	1	1.6	6.2	中!文	F	a	11:11:11	2006
00008	1	1.7	7.2	中!文	G	a	11:11:11	2007
00009	1	1.8	8.2	中!文	H	a	11:11:11	2011
00010	1	1.9	9.2	中!文	I	a	11:11:11	2012
00011	1	2	1.9	中!文	J	a	11:11:11	2011
00012	2	2.1	2	中!文	K	b	12:12:12	2012
00013	3	2.2	2.1	中!文	L	c	13:13:13	2013
00015	5	2.4	2.3	中0文	N	e	15:15:15	2015
00016	6	2.5	2.2	中9文	O	a	16:16:16	2016
INSERT INTO t1 VALUES(17,7,2.6,2.3,'中8文','P','b','2017','17:17:17');
INSERT INTO t1 VALUES(17,7,2.6,2.3,'中8文','P','b','2017','2022-04-07 17:17:17');
#修改生成列及依赖列
DROP TABLE IF EXISTS t1;
CREATE TABLE t1(c0 INT(3),
c1 FLOAT,
c2 DOUBLE NOT NULL,
c3 CHAR(10) DEFAULT 'A',
c4 CHAR(10) GENERATED ALWAYS AS (UPPER(c3)) VIRTUAL COMMENT '字符串生成列',
c5 INT GENERATED ALWAYS AS (c0*2) STORED COMMENT '数值生成列',
c6 TIME);
INSERT INTO t1(c0,c1,c2,c3,c6) VALUES(1,1.0,1.1,'','11:11:11'),
(2,1.1,1.2,'a','11:11:11'),
(3,1.2,2.2,'b','11:11:11'),
(4,1.3,3.2,'c','11:11:11'),
(5,1.4,4.2,'d','11:11:11');
COMMIT;
SELECT * FROM t1 ORDER BY c0;
c0	c1	c2	c3	c4	c5	c6
1	1	1.1			2	11:11:11
2	1.1	1.2	a	A	4	11:11:11
3	1.2	2.2	b	B	6	11:11:11
4	1.3	3.2	c	C	8	11:11:11
5	1.4	4.2	d	D	10	11:11:11
#事务
#mysql_modify-1-5
DROP TABLE IF EXISTS t1;
CREATE TABLE t1(c0 INT(5) ZEROFILL,
c1 FLOAT ,
c2 DOUBLE NOT NULL,
c3 CHAR(10) DEFAULT 'A',
c4 VARCHAR(10) ,
c5 CHAR(10),
c6 INT NOT NULL,
c7 TIME DEFAULT '12:00:00',
c8 YEAR );
INSERT INTO t1 VALUES(1,1.0,1.1,'中文','','',0,'11:11:11','2000'),
(2,1.1,1.2,'中!文','A','a',1,'11:11:11','2001'),
(3,1.2,2.2,'中!文','B','a',1,'11:11:11','2002'),
(4,1.3,3.2,'中!文','C','a',1,'11:11:11','2003'),
(5,1.4,4.2,'中!文','D','a',1,'11:11:11','2004'),
(6,1.5,5.2,'中!文','E','a',1,'11:11:11','2005'),
(7,1.6,6.2,'中!文','F','a',1,'11:11:11','2006'),
(8,1.7,7.2,'中!文','G','a',1,'11:11:11','2007'),
(9,1.8,8.2,'中!文','H','a',1,'11:11:11','2011'),
(10,1.9,9.2,'中!文','I','a',1,'11:11:11','2012'),
(11,2.0,1.9,'中!文','J','a',1,'11:11:11','2011');
COMMIT;
SELECT * FROM t1 ORDER BY c0;
c0	c1	c2	c3	c4	c5	c6	c7	c8
00001	1	1.1	中文			0	11:11:11	2000
00002	1.1	1.2	中!文	A	a	1	11:11:11	2001
00003	1.2	2.2	中!文	B	a	1	11:11:11	2002
00004	1.3	3.2	中!文	C	a	1	11:11:11	2003
00005	1.4	4.2	中!文	D	a	1	11:11:11	2004
00006	1.5	5.2	中!文	E	a	1	11:11:11	2005
00007	1.6	6.2	中!文	F	a	1	11:11:11	2006
00008	1.7	7.2	中!文	G	a	1	11:11:11	2007
00009	1.8	8.2	中!文	H	a	1	11:11:11	2011
00010	1.9	9.2	中!文	I	a	1	11:11:11	2012
00011	2	1.9	中!文	J	a	1	11:11:11	2011
#设置自动提交为0
SET AUTOCOMMIT=0;
BEGIN;
ALTER TABLE t1 CHANGE c4 m4 VARCHAR(10) AFTER c5;
ROLLBACK;
BEGIN;
ALTER TABLE t1 CHANGE c4 c4 VARCHAR(10) AFTER c5;
ROLLBACK;
INSERT INTO t1 VALUES(12,2.1,1.8,'中-文','K','b',2,'12:12:12','2012');
SELECT * FROM t1 ORDER BY c0;
c0	c1	c2	c3	c5	m4	c6	c7	c8
00001	1	1.1	中文			0	11:11:11	2000
00002	1.1	1.2	中!文	a	A	1	11:11:11	2001
00003	1.2	2.2	中!文	a	B	1	11:11:11	2002
00004	1.3	3.2	中!文	a	C	1	11:11:11	2003
00005	1.4	4.2	中!文	a	D	1	11:11:11	2004
00006	1.5	5.2	中!文	a	E	1	11:11:11	2005
00007	1.6	6.2	中!文	a	F	1	11:11:11	2006
00008	1.7	7.2	中!文	a	G	1	11:11:11	2007
00009	1.8	8.2	中!文	a	H	1	11:11:11	2011
00010	1.9	9.2	中!文	a	I	1	11:11:11	2012
00011	2	1.9	中!文	a	J	1	11:11:11	2011
00012	2.1	1.8	中-文	K	b	2	12:12:12	2012
BEGIN;
SAVEPOINT s1;
ALTER TABLE t1 CHANGE c4 m4 VARCHAR(20);
SAVEPOINT s2;
ALTER TABLE t1 MODIFY m4 CHAR(10);
SAVEPOINT s3;
ALTER TABLE t1 CHANGE m4 m4 CHAR(10) AFTER c3;
ROLLBACK TO s1;
ERROR 42000: savepoint does not exist
SET AUTOCOMMIT=1;
#对表进行加锁后删除列
#mysql_modify-1-3
#OB目前不支持对表的加锁操作，故先不测试。可以进行对行的加锁操作。
DROP TABLE IF EXISTS t1;
CREATE TABLE t1(c0 INT(4),
c1 FLOAT ,
c2 DOUBLE,
c3 CHAR(10),
c4 CHAR(10),
c5 INT,
c6 TIME);
INSERT INTO t1 VALUES(1,1.0,1.1,'中文','',0,'11:11:11'),
(2,1.1,1.2,'中!文','a',1,'11:11:11'),
(3,1.2,2.2,'中!文','a',1,'11:11:11'),
(4,1.3,3.2,'中!文','a',1,'11:11:11'),
(5,1.4,4.2,'中!文','a',1,'11:11:11');
COMMIT;
SELECT * FROM t1 ORDER BY 1;
c0	c1	c2	c3	c4	c5	c6
1	1	1.1	中文		0	11:11:11
2	1.1	1.2	中!文	a	1	11:11:11
3	1.2	2.2	中!文	a	1	11:11:11
4	1.3	3.2	中!文	a	1	11:11:11
5	1.4	4.2	中!文	a	1	11:11:11
#对行加锁
SELECT * FROM t1 WHERE c0=1 FOR UPDATE;
c0	c1	c2	c3	c4	c5	c6
1	1	1.1	中文		0	11:11:11
ALTER TABLE t1 CHANGE c0 m0 INT(4) AFTER c1;
ALTER TABLE t1 CHANGE c0 c0 INT(5) ZEROFILL AFTER c1;
INSERT INTO t1 VALUES(6,1.5,5.2,'中文','b',1,'12:12:12');
SELECT * FROM t1 ORDER BY 1;
c1	m0	c2	c3	c4	c5	c6
1	1	1.1	中文		0	11:11:11
1.1	2	1.2	中!文	a	1	11:11:11
1.2	3	2.2	中!文	a	1	11:11:11
1.3	4	3.2	中!文	a	1	11:11:11
1.4	5	4.2	中!文	a	1	11:11:11
6	2	5.2	中文	b	1	12:12:12
#当索引或者约束失效时，删除列
DROP TABLE IF EXISTS t1;
CREATE TABLE t1(c0 INT(4) PRIMARY KEY,
c1 FLOAT UNIQUE,
c2 DOUBLE,
c3 CHAR(10),
c4 CHAR(10),
c5 INT,
c6 TIME);
INSERT INTO t1 VALUES(1,1.0,1.1,'中文','',0,'11:11:11'),
(2,1.1,1.2,'中!文','a',1,'11:11:11'),
(3,1.2,2.2,'中!文','a',1,'11:11:11'),
(4,1.3,3.2,'中!文','a',1,'11:11:11'),
(5,1.4,4.2,'中!文','a',1,'11:11:11');
COMMIT;
#修改索引状态为INVISIBLE
ALTER TABLE t1 ALTER INDEX ind_1 INVISIBLE;
ALTER TABLE t1 ALTER INDEX ind_2 INVISIBLE;
ALTER TABLE t1 ALTER INDEX c1 INVISIBLE;
ALTER TABLE t1 CHANGE c2 m2 DOUBLE AFTER c0;
ALTER TABLE t1 CHANGE c2 c2 FLOAT(5,0) DEFAULT 0 AFTER c0;
INSERT INTO t1 VALUES(6,1.5,4.3,'中-文','b',2,'12:12:12');
SELECT * FROM t1 ORDER BY 1;
c0	m2	c1	c3	c4	c5	c6
1	1.1	1	中文		0	11:11:11
2	1.2	1.1	中!文	a	1	11:11:11
3	2.2	1.2	中!文	a	1	11:11:11
4	3.2	1.3	中!文	a	1	11:11:11
5	4.2	1.4	中!文	a	1	11:11:11
6	1.5	4.3	中-文	b	2	12:12:12
ALTER TABLE t1 CHANGE c2 m2 FLOAT(10,0) DEFAULT 10;
ALTER TABLE t1 CHANGE c2 m2 FLOAT(15,0) DEFAULT 0;
ALTER TABLE t1 CHANGE c2 m2 FLOAT(5,0) DEFAULT 10;
INSERT INTO t1(c0,c1,c3,c4,c5,c6) VALUES(7,1.6,'中=文','c',3,'13:13:13');
SELECT /*+INDEX(ind_1)*/ * FROM t1 WHERE m2=10;
c0	m2	c1	c3	c4	c5	c6
ALTER TABLE t1 MODIFY m2 DOUBLE AFTER c1;
INSERT INTO t1 VALUES(8,1.7,5.1,'中0文','d',4,'14:14:14');
SELECT /*+INDEX(ind_1)*/ * FROM t1 ORDER BY 1;
c0	c1	m2	c3	c4	c5	c6
1	1	1.1	中文		0	11:11:11
2	1.1	1.2	中!文	a	1	11:11:11
3	1.2	2.2	中!文	a	1	11:11:11
4	1.3	3.2	中!文	a	1	11:11:11
5	1.4	4.2	中!文	a	1	11:11:11
6	4.3	1.5	中-文	b	2	12:12:12
7	1.6	NULL	中=文	c	3	13:13:13
8	1.7	5.1	中0文	d	4	14:14:14
#禁用唯一索引SET UNIQUE_CHECKS=OFF;
ALTER TABLE t1 ALTER INDEX c1 VISIBLE;
SET UNIQUE_CHECKS=OFF;
ALTER TABLE t1 CHANGE c1 m1 FLOAT(5,0) AFTER m2;
ALTER TABLE t1 CHANGE c1 m1 FLOAT AFTER m2;
ALTER TABLE t1 MODIFY m1 CHAR(5) DEFAULT 'A' AFTER c4;
INSERT INTO t1(c0,m2,c3,c4,c5,c6) VALUES(7,5.2,'中0文','a',2,'12:12:12');
SELECT * FROM t1 ORDER BY 1;
c0	m2	c3	c4	m1	c5	c6
1	1.1	中文		1	0	11:11:11
2	1.2	中!文	a	1.1	1	11:11:11
3	2.2	中!文	a	1.2	1	11:11:11
4	3.2	中!文	a	1.3	1	11:11:11
5	4.2	中!文	a	1.4	1	11:11:11
6	1.5	中-文	b	4.3	2	12:12:12
7	NULL	中=文	c	1.6	3	13:13:13
8	5.1	中0文	d	1.7	4	14:14:14
SET UNIQUE_CHECKS=ON;
#禁用外键SET FOREIGN_KEY_CHECKS=OFF;
DROP TABLE IF EXISTS t2;
CREATE TABLE t2(c0 INT(4),
c1 FLOAT UNIQUE,
c2 DOUBLE,
c3 CHAR(10),
c4 CHAR(10),
c5 INT,
c6 TIME,
CONSTRAINT fk_c0_c0 FOREIGN KEY(c0) REFERENCES t1(c0));
INSERT INTO t2 VALUES(1,1.0,1.1,'中文','',0,'11:11:11'),
(2,1.1,1.2,'中!文','a',1,'11:11:11'),
(3,1.2,2.2,'中!文','a',1,'11:11:11'),
(4,1.3,3.2,'中!文','a',1,'11:11:11'),
(5,1.4,4.2,'中!文','a',1,'11:11:11');
SET FOREIGN_KEY_CHECKS=OFF;
ALTER TABLE t2 CHANGE c0 m0 INT(4) AFTER c6;
ALTER TABLE t2 CHANGE c0 m0 FLOAT(5,0) AFTER c6;
ALTER TABLE t2 CHANGE c0 m0 INT(4) DEFAULT 0;
INSERT INTO t2 VALUES(7,1.6,5.2,'中文','b',2,'12:12:12');
SELECT * FROM t2 ORDER BY 1;
c1	c2	c3	c4	c5	c6	m0
1	1.1	中文		0	11:11:11	1
1.1	1.2	中!文	a	1	11:11:11	2
1.2	2.2	中!文	a	1	11:11:11	3
1.3	3.2	中!文	a	1	11:11:11	4
1.4	4.2	中!文	a	1	11:11:11	5
ALTER TABLE t2 MODIFY m0 FLOAT(5,0) AFTER c6;
ERROR HY000: 'm0': used in a foreign key constraint
ALTER TABLE t2 MODIFY m0 DOUBLE(5,0);
ERROR HY000: 'm0': used in a foreign key constraint
ALTER TABLE t2 MODIFY m0 INT(10) ZEROFILL AFTER c6;
ERROR HY000: 'm0': used in a foreign key constraint
ALTER TABLE t2 MODIFY m0 INT(4) ZEROFILL;
ERROR HY000: 'm0': used in a foreign key constraint
ALTER TABLE t2 MODIFY m0 INT(10) AFTER c6;
ALTER TABLE t2 MODIFY m0 INT(4) AFTER c6;
INSERT INTO t2 VALUES(1.7,5.3,'中9文','c',3,'13:13:13',22);
SELECT * FROM t2 ORDER BY 1;
c1	c2	c3	c4	c5	c6	m0
1	1.1	中文		0	11:11:11	1
1.1	1.2	中!文	a	1	11:11:11	2
1.2	2.2	中!文	a	1	11:11:11	3
1.3	3.2	中!文	a	1	11:11:11	4
1.4	4.2	中!文	a	1	11:11:11	5
1.7	5.3	中9文	c	3	13:13:13	22
SET FOREIGN_KEY_CHECKS=ON;
INSERT INTO t2 VALUES(1.8,5.4,'中8文','d',4,'14:14:14',23);
ERROR 23000: Cannot add or update a child row: a foreign key constraint fails
SELECT * FROM t2 ORDER BY 1;
c1	c2	c3	c4	c5	c6	m0
1	1.1	中文		0	11:11:11	1
1.1	1.2	中!文	a	1	11:11:11	2
1.2	2.2	中!文	a	1	11:11:11	3
1.3	3.2	中!文	a	1	11:11:11	4
1.4	4.2	中!文	a	1	11:11:11	5
1.7	5.3	中9文	c	3	13:13:13	22
#删除多列并修改新增列
#CREATE DATA (DATA TYPE + INDEX + CONSTRAINT)
DROP TABLE IF EXISTS t2;
DROP TABLE IF EXISTS t1;
CREATE TABLE t1(c0 INT(5) ZEROFILL,
c1 FLOAT NOT NULL,
c2 DOUBLE AUTO_INCREMENT PRIMARY KEY,
c3 BIT(20) DEFAULT 0,
c4 BLOB,
c5 TEXT,
c6 VARCHAR(50) UNIQUE,
c7 CHAR(50),
c8 BINARY(50) NOT NULL,
c9 VARBINARY(50) NOT NULL,
c10 ENUM('a','b','c','d','e','f','g','h'),
c11 SET('i','j','k','l','m','n','o','p'),
c12 TIME NOT NULL,
c13 DATE NOT NULL,
c14 DATETIME NOT NULL,
c15 TIMESTAMP NOT NULL,
c16 YEAR ,CHECK(c16>=2000));
INSERT INTO t1 VALUES(1,1.5,1,'',x'89504E470D0A1A0A0000000D4948445206105000000097048597300000EC300000EC301C76FA8640000001','89504E470D0A1A0A00C76FA8640000001E49444154384F6350DAE843','','','teshu*符号@$￥%','SHUZI!1234567','a','i','20:12:12','2000-12-12','2000-01-01 01:01:01','2001-01-01 12:01:01.34567','2000'),
(2,2.5,2,b'110101',x'89504E470D0A1A0A0000000D4997300000EC300000EC301C76FA8640000001E49444154384','89504E470D0A1A0A00C76FA8640000001E49444154384F6350DAE843','中文—汉化','english_language','teshu*符号@$￥%','SHUZI!1234567','b','i','21:12:12','2001-12-22','2001-01-01 13:01:01','2001-11-01 11:01:01.34567','2010'),
(3,3.5,3,b'011101',x'89504E470D0A1A0A00C76FA8640000001E49444154384F6350DAE843126220493550F1A8066242','89504E470D0A1A0A00C76FA8640000001E49444154384F6350DAE843','删除时使用情景','english_language','teshu*符号@$￥%','SHUZI!1234567','c','i','22:12:12','2002-12-02','2002-01-01 14:01:01','2002-12-01 02:01:01.34567','2000'),
(4,4.5,4,b'010111',x'89504E470D0A1A0A00C76FA8640000001E49444154384F6350DAE843126220493550F1A8066242','89504E470D0A1A0A00C76FA8640000001E49444154384F6350DAE843','删除中——汉化','english_language','teshu*符号@$￥%','SHUZI!1234567','d','j','23:12:12','2003-12-11','2003-01-01 15:01:01','2002-11-01 03:01:01.34567','2010'),
(5,5.5,5,b'111101',x'89504E470D0A1A0A00C76FA8640000001E49444154384F6350DAE843126220493550','89504E470D0A1A0A00C76FA8640000001E49444154384F6350DAE843','删除中文*汉化删除','english_language','teshu*符号@$￥%','SHUZI!1234567','e','k','20:22:12','2004-12-12','2004-01-01 16:01:01','2002-02-04 05:01:01.34567','2000'),
(6,6.5,6,b'110111',x'89504E470D0A1A0A00C76FA8640000001E49444154384F6350DAE843126220493550','89504E470D0A1A0A00C76FA8640000001E49444154384F6350DAE843','除列时使用情景','english_language','teshu*符号@$￥%','SHUZI!1234567','f','k','20:32:12','2021-12-13','2010-01-01 21:01:01','2003-03-01 04:01:01.34567','2010');
INSERT INTO t1 VALUES(7,7.5,7,b'01101',x'89504E470D0A1A0A00C76FA8640000001E49444154384F6350DAE843126220493550','89504E470D0A1A0A00C76FA8640000001E49444154384F6350DAE843','删列时使用情景','english_language','teshu*符号@$￥%','SHUZI!1234567','g','l','20:42:12','2020-12-14','2011-01-01 22:01:01','2004-04-01 05:01:01.34567','2000'),
(8,8.5,8,b'01001',x'89504E470D0A1A0A00C76FA8640000001E49444154384F6350DAE843126220493550','89504E470D0A1A0A00C76FA8640000001E49444154384F6350DAE843','删除列使用情景','english_language','teshu*符号@$￥%','SHUZI!1234567','h','l','20:52:12','2015-12-15','2012-01-01 23:01:01','2005-05-01 06:01:01.34567','2020'),
(9,9.5,9,b'10101',x'89504E470D0A1A0A00C76FA8640000001E49444154384F6350DAE843126220493550','89504E470D0A1A0A00C76FA8640000001E49444154384F6350DAE843','删中文——汉化删除','english_language','teshu*符号@$￥%','SHUZI!1234567','a','l','20:12:42','2014-12-16','2013-01-01 20:01:01','2006-06-01 07:01:01.34567','2000'),
(10,10.5,10,b'0010101',x'89504E470D0A1A0A00C76FA8640000001E49444154384F6350DAE843','89504E470D0A1A0A00C76FA8640000001E49444154384F6350DAE843126220493550','删除列时用情景','english_language','teshu*符号@$￥%','SHUZI!1234567','a','m','21:12:52','2013-12-17','2014-01-01 01:11:01','2007-07-01 08:01:01.34567','2020'),
(11,1.15,11,b'0100101',x'89504E470D0A1A0A00C76FA8640000001E49444154384F6350DAE843','89504E470D0A1A0A00C76FA8640000001E49444154384F6350DAE843126220493550','中文——汉化删除','english_language','teshu*符号@$￥%','SHUZI!1234567','b','n','21:12:32','2012-12-18','2011-01-01 01:21:01','2008-08-01 01:01:01.34567','2010'),
(12,1.25,12,b'0101001',x'89504E470D0A1A0A00C76FA8640000001E49444154384F6350DAE843','89504E470D0A1A0A00C76FA8640000001E49444154384F6350DAE843126220493550','删除中文——汉化','english_language','teshu*符号@$￥%','SHUZI!1234567','b','n','22:12:22','2011-12-19','2010-01-01 01:31:01','2009-09-01 01:01:01.34567','2020'),
(13,1.35,13,b'0101010',x'89504E470D0A1A0A00C76FA8640000001E49444154384F6350DAE843','89504E470D0A1A0A00C76FA8640000001E49444154384F6350DAE843126220493550F1','删除列时使情景','english_language','teshu*符号@$￥%','SHUZI!1234567','c','m','22:12:12','2017-12-10','2018-01-01 01:41:01','2010-10-01 01:01:01.34567','2000');
COMMIT;
CREATE INDEX ind_1 ON t1(c12);
CREATE INDEX ind_2 ON t1(c1,c3,c13,c14);
DESC t1;
Field	Type	Null	Key	Default	Extra
c0	int(5) unsigned	YES		NULL	
c1	float	NO	MUL	NULL	
c2	double	NO	PRI	NULL	auto_increment
c3	bit(20)	YES		b'0'	
c4	blob	YES		NULL	
c5	text	YES		NULL	
c6	varchar(50)	YES	UNI	NULL	
c7	char(50)	YES		NULL	
c8	binary(50)	NO		NULL	
c9	varbinary(50)	NO		NULL	
c10	enum('a','b','c','d','e','f','g','h')	YES		NULL	
c11	set('i','j','k','l','m','n','o','p')	YES		NULL	
c12	time	NO	MUL	NULL	
c13	date	NO		NULL	
c14	datetime	NO		NULL	
c15	timestamp	NO		NULL	
c16	year(4)	YES		NULL	
#修改列并新增列
ALTER TABLE t1 CHANGE c10 m10 VARCHAR(10) AFTER c6,ADD COLUMN c17 INT(5) ZEROFILL;
ALTER TABLE t1 CHANGE c10 c10 VARCHAR(10) AFTER c6,ADD COLUMN c17 INT(5) ZEROFILL;
DESC t1;
Field	Type	Null	Key	Default	Extra
c0	int(5) unsigned	YES		NULL	
c1	float	NO	MUL	NULL	
c2	double	NO	PRI	NULL	auto_increment
c3	bit(20)	YES		b'0'	
c4	blob	YES		NULL	
c5	text	YES		NULL	
c6	varchar(50)	YES	UNI	NULL	
m10	varchar(10)	YES		NULL	
c7	char(50)	YES		NULL	
c8	binary(50)	NO		NULL	
c9	varbinary(50)	NO		NULL	
c11	set('i','j','k','l','m','n','o','p')	YES		NULL	
c12	time	NO	MUL	NULL	
c13	date	NO		NULL	
c14	datetime	NO		NULL	
c15	timestamp	NO		NULL	
c16	year(4)	YES		NULL	
c17	int(5) unsigned	YES		NULL	
INSERT INTO t1 VALUES(22,2.05,23,b'01011101',x'89504E470D0A1A0A00C76FA8640000001E49444154384F6350DAE843','89504E470D0A1A0A0000000EC300000EC301C76FA8640000001E49444154384F6350DAE843126220493550F','中文删$除汉化','english_language','teshu*符号@$￥%','SHUZI!1234567','f','j','19:12:12','2022-12-12','1980-01-01 01:41:01','2000-06-01 01:01:01.34567','2010');
ERROR 21S01: Column count doesn't match value count at row 1
INSERT INTO t1 VALUES(22,2.06,23,b'01011101',x'89504E470D0A1A0A00C76FA8640000001E49444154384F6350DAE843','89504E470D0A1A0A0000000EC300000EC301C76FA8640000001E49444154384F6350DAE843126220493550F','中文删$除汉化','test','english_language','teshu*符号@$￥%','SHUZI!1234567','j','19:12:12','2022-12-12','1980-01-01 01:41:01','2000-06-01 01:01:01.34567','2010',1);
SELECT * FROM t1 ORDER BY 1;
c0	c1	c2	c3	c4	c5	c6	m10	c7	c8	c9	c11	c12	c13	c14	c15	c16	c17
00001	1.5	1	   	�PNG

   IHDRP   ���0  �0  �0v��@  	89504E470D0A1A0A00C76FA8640000001E49444154384F6350DAE843		a		teshu*符号@$￥%                                	SHUZI!1234567	i	20:12:12	2000-12-12	2000-01-01 01:01:01	2001-01-01 12:01:01	2000	NULL
00002	2.5	2	  5	�PNG

   I�0  �0  �0v��@  �DC�	89504E470D0A1A0A00C76FA8640000001E49444154384F6350DAE843	中文—汉化	b	english_language	teshu*符号@$￥%                                	SHUZI!1234567	i	21:12:12	2001-12-22	2001-01-01 13:01:01	2001-11-01 11:01:01	2010	NULL
00003	3.5	3	  	�PNG

 �o�d   IDAT8OcP��Cb I5P�bB	89504E470D0A1A0A00C76FA8640000001E49444154384F6350DAE843	删除时使用情景	c	english_language	teshu*符号@$￥%                                	SHUZI!1234567	i	22:12:12	2002-12-02	2002-01-01 14:01:01	2002-12-01 02:01:01	2000	NULL
00004	4.5	4	  	�PNG

 �o�d   IDAT8OcP��Cb I5P�bB	89504E470D0A1A0A00C76FA8640000001E49444154384F6350DAE843	删除中——汉化	d	english_language	teshu*符号@$￥%                                	SHUZI!1234567	j	23:12:12	2003-12-11	2003-01-01 15:01:01	2002-11-01 03:01:01	2010	NULL
00005	5.5	5	  =	�PNG

 �o�d   IDAT8OcP��Cb I5P	89504E470D0A1A0A00C76FA8640000001E49444154384F6350DAE843	删除中文*汉化删除	e	english_language	teshu*符号@$￥%                                	SHUZI!1234567	k	20:22:12	2004-12-12	2004-01-01 16:01:01	2002-02-04 05:01:01	2000	NULL
00006	6.5	6	  7	�PNG

 �o�d   IDAT8OcP��Cb I5P	89504E470D0A1A0A00C76FA8640000001E49444154384F6350DAE843	除列时使用情景	f	english_language	teshu*符号@$￥%                                	SHUZI!1234567	k	20:32:12	2021-12-13	2010-01-01 21:01:01	2003-03-01 04:01:01	2010	NULL
00007	7.5	7	  	�PNG

 �o�d   IDAT8OcP��Cb I5P	89504E470D0A1A0A00C76FA8640000001E49444154384F6350DAE843	删列时使用情景	g	english_language	teshu*符号@$￥%                                	SHUZI!1234567	l	20:42:12	2020-12-14	2011-01-01 22:01:01	2004-04-01 05:01:01	2000	NULL
00008	8.5	8	  		�PNG

 �o�d   IDAT8OcP��Cb I5P	89504E470D0A1A0A00C76FA8640000001E49444154384F6350DAE843	删除列使用情景	h	english_language	teshu*符号@$￥%                                	SHUZI!1234567	l	20:52:12	2015-12-15	2012-01-01 23:01:01	2005-05-01 06:01:01	2020	NULL
00009	9.5	9	  	�PNG

 �o�d   IDAT8OcP��Cb I5P	89504E470D0A1A0A00C76FA8640000001E49444154384F6350DAE843	删中文——汉化删除	a	english_language	teshu*符号@$￥%                                	SHUZI!1234567	l	20:12:42	2014-12-16	2013-01-01 20:01:01	2006-06-01 07:01:01	2000	NULL
00010	10.5	10	  	�PNG

 �o�d   IDAT8OcP��C	89504E470D0A1A0A00C76FA8640000001E49444154384F6350DAE843126220493550	删除列时用情景	a	english_language	teshu*符号@$￥%                                	SHUZI!1234567	m	21:12:52	2013-12-17	2014-01-01 01:11:01	2007-07-01 08:01:01	2020	NULL
00011	1.15	11	  %	�PNG

 �o�d   IDAT8OcP��C	89504E470D0A1A0A00C76FA8640000001E49444154384F6350DAE843126220493550	中文——汉化删除	b	english_language	teshu*符号@$￥%                                	SHUZI!1234567	n	21:12:32	2012-12-18	2011-01-01 01:21:01	2008-08-01 01:01:01	2010	NULL
00012	1.25	12	  )	�PNG

 �o�d   IDAT8OcP��C	89504E470D0A1A0A00C76FA8640000001E49444154384F6350DAE843126220493550	删除中文——汉化	b	english_language	teshu*符号@$￥%                                	SHUZI!1234567	n	22:12:22	2011-12-19	2010-01-01 01:31:01	2009-09-01 01:01:01	2020	NULL
00013	1.35	13	  *	�PNG

 �o�d   IDAT8OcP��C	89504E470D0A1A0A00C76FA8640000001E49444154384F6350DAE843126220493550F1	删除列时使情景	c	english_language	teshu*符号@$￥%                                	SHUZI!1234567	m	22:12:12	2017-12-10	2018-01-01 01:41:01	2010-10-01 01:01:01	2000	NULL
00022	2.06	23	  ]	�PNG

 �o�d   IDAT8OcP��C	89504E470D0A1A0A0000000EC300000EC301C76FA8640000001E49444154384F6350DAE843126220493550F	中文删$除汉化	test	english_language	teshu*符号@$￥%                                	SHUZI!1234567	j	19:12:12	2022-12-12	1980-01-01 01:41:01	2000-06-01 01:01:01	2010	00001
#修改列并新增相同的列名
ALTER TABLE t1 CHANGE c0 m0 INT(5) ZEROFILL AFTER c1,ADD COLUMN m0 INT(5) FIRST;
DESC t1;
Field	Type	Null	Key	Default	Extra
c0	int(5) unsigned	YES		NULL	
c1	float	NO	MUL	NULL	
c2	double	NO	PRI	NULL	auto_increment
c3	bit(20)	YES		b'0'	
c4	blob	YES		NULL	
c5	text	YES		NULL	
c6	varchar(50)	YES	UNI	NULL	
m10	varchar(10)	YES		NULL	
c7	char(50)	YES		NULL	
c8	binary(50)	NO		NULL	
c9	varbinary(50)	NO		NULL	
c11	set('i','j','k','l','m','n','o','p')	YES		NULL	
c12	time	NO	MUL	NULL	
c13	date	NO		NULL	
c14	datetime	NO		NULL	
c15	timestamp	NO		NULL	
c16	year(4)	YES		NULL	
c17	int(5) unsigned	YES		NULL	
INSERT INTO t1 VALUES(23,2.07,24,b'01011101',x'89504E470D0A1A0A00C76FA8640000001E49444154384F6350DAE843','89504E470D0A1A0A0000000EC300000EC301C76FA8640000001E49444154384F6350DAE843126220493550F','中文删=除汉化','test1','english_language','teshu*符号@$￥%','SHUZI!1234567','k','19:12:12','2022-12-12','1980-01-01 01:41:01','2000-06-01 01:01:01.34567','2011',2);
INSERT INTO t1 VALUES(0,23,2.07,24,b'01011101',x'89504E470D0A1A0A00C76FA8640000001E49444154384F6350DAE843','89504E470D0A1A0A0000000EC300000EC301C76FA8640000001E49444154384F6350DAE843126220493550F','中文删=除汉化','test1','english_language','teshu*符号@$￥%','SHUZI!1234567','k','19:12:12','2022-12-12','1980-01-01 01:41:01','2000-06-01 01:01:01.34567','2011',2);
SELECT * FROM t1 ORDER BY 1;
c0	c1	c2	c3	c4	c5	c6	m10	c7	c8	c9	c11	c12	c13	c14	c15	c16	c17
00001	1.5	1	   	�PNG

   IHDRP   ���0  �0  �0v��@  	89504E470D0A1A0A00C76FA8640000001E49444154384F6350DAE843		a		teshu*符号@$￥%                                	SHUZI!1234567	i	20:12:12	2000-12-12	2000-01-01 01:01:01	2001-01-01 12:01:01	2000	NULL
00002	2.5	2	  5	�PNG

   I�0  �0  �0v��@  �DC�	89504E470D0A1A0A00C76FA8640000001E49444154384F6350DAE843	中文—汉化	b	english_language	teshu*符号@$￥%                                	SHUZI!1234567	i	21:12:12	2001-12-22	2001-01-01 13:01:01	2001-11-01 11:01:01	2010	NULL
00003	3.5	3	  	�PNG

 �o�d   IDAT8OcP��Cb I5P�bB	89504E470D0A1A0A00C76FA8640000001E49444154384F6350DAE843	删除时使用情景	c	english_language	teshu*符号@$￥%                                	SHUZI!1234567	i	22:12:12	2002-12-02	2002-01-01 14:01:01	2002-12-01 02:01:01	2000	NULL
00004	4.5	4	  	�PNG

 �o�d   IDAT8OcP��Cb I5P�bB	89504E470D0A1A0A00C76FA8640000001E49444154384F6350DAE843	删除中——汉化	d	english_language	teshu*符号@$￥%                                	SHUZI!1234567	j	23:12:12	2003-12-11	2003-01-01 15:01:01	2002-11-01 03:01:01	2010	NULL
00005	5.5	5	  =	�PNG

 �o�d   IDAT8OcP��Cb I5P	89504E470D0A1A0A00C76FA8640000001E49444154384F6350DAE843	删除中文*汉化删除	e	english_language	teshu*符号@$￥%                                	SHUZI!1234567	k	20:22:12	2004-12-12	2004-01-01 16:01:01	2002-02-04 05:01:01	2000	NULL
00006	6.5	6	  7	�PNG

 �o�d   IDAT8OcP��Cb I5P	89504E470D0A1A0A00C76FA8640000001E49444154384F6350DAE843	除列时使用情景	f	english_language	teshu*符号@$￥%                                	SHUZI!1234567	k	20:32:12	2021-12-13	2010-01-01 21:01:01	2003-03-01 04:01:01	2010	NULL
00007	7.5	7	  	�PNG

 �o�d   IDAT8OcP��Cb I5P	89504E470D0A1A0A00C76FA8640000001E49444154384F6350DAE843	删列时使用情景	g	english_language	teshu*符号@$￥%                                	SHUZI!1234567	l	20:42:12	2020-12-14	2011-01-01 22:01:01	2004-04-01 05:01:01	2000	NULL
00008	8.5	8	  		�PNG

 �o�d   IDAT8OcP��Cb I5P	89504E470D0A1A0A00C76FA8640000001E49444154384F6350DAE843	删除列使用情景	h	english_language	teshu*符号@$￥%                                	SHUZI!1234567	l	20:52:12	2015-12-15	2012-01-01 23:01:01	2005-05-01 06:01:01	2020	NULL
00009	9.5	9	  	�PNG

 �o�d   IDAT8OcP��Cb I5P	89504E470D0A1A0A00C76FA8640000001E49444154384F6350DAE843	删中文——汉化删除	a	english_language	teshu*符号@$￥%                                	SHUZI!1234567	l	20:12:42	2014-12-16	2013-01-01 20:01:01	2006-06-01 07:01:01	2000	NULL
00010	10.5	10	  	�PNG

 �o�d   IDAT8OcP��C	89504E470D0A1A0A00C76FA8640000001E49444154384F6350DAE843126220493550	删除列时用情景	a	english_language	teshu*符号@$￥%                                	SHUZI!1234567	m	21:12:52	2013-12-17	2014-01-01 01:11:01	2007-07-01 08:01:01	2020	NULL
00011	1.15	11	  %	�PNG

 �o�d   IDAT8OcP��C	89504E470D0A1A0A00C76FA8640000001E49444154384F6350DAE843126220493550	中文——汉化删除	b	english_language	teshu*符号@$￥%                                	SHUZI!1234567	n	21:12:32	2012-12-18	2011-01-01 01:21:01	2008-08-01 01:01:01	2010	NULL
00012	1.25	12	  )	�PNG

 �o�d   IDAT8OcP��C	89504E470D0A1A0A00C76FA8640000001E49444154384F6350DAE843126220493550	删除中文——汉化	b	english_language	teshu*符号@$￥%                                	SHUZI!1234567	n	22:12:22	2011-12-19	2010-01-01 01:31:01	2009-09-01 01:01:01	2020	NULL
00013	1.35	13	  *	�PNG

 �o�d   IDAT8OcP��C	89504E470D0A1A0A00C76FA8640000001E49444154384F6350DAE843126220493550F1	删除列时使情景	c	english_language	teshu*符号@$￥%                                	SHUZI!1234567	m	22:12:12	2017-12-10	2018-01-01 01:41:01	2010-10-01 01:01:01	2000	NULL
00022	2.06	23	  ]	�PNG

 �o�d   IDAT8OcP��C	89504E470D0A1A0A0000000EC300000EC301C76FA8640000001E49444154384F6350DAE843126220493550F	中文删$除汉化	test	english_language	teshu*符号@$￥%                                	SHUZI!1234567	j	19:12:12	2022-12-12	1980-01-01 01:41:01	2000-06-01 01:01:01	2010	00001
00023	2.07	24	  ]	�PNG

 �o�d   IDAT8OcP��C	89504E470D0A1A0A0000000EC300000EC301C76FA8640000001E49444154384F6350DAE843126220493550F	中文删=除汉化	test1	english_language	teshu*符号@$￥%                                	SHUZI!1234567	k	19:12:12	2022-12-12	1980-01-01 01:41:01	2000-06-01 01:01:01	2011	00002
#修改多列并删除列
ALTER TABLE t1 MODIFY m0 CHAR(10) DEFAULT 'A' AFTER c5,DROP c4,CHANGE c0 c0 INT FIRST;
DESC t1;
Field	Type	Null	Key	Default	Extra
c0	int(5) unsigned	YES		NULL	
c1	float	NO	MUL	NULL	
c2	double	NO	PRI	NULL	auto_increment
c3	bit(20)	YES		b'0'	
c4	blob	YES		NULL	
c5	text	YES		NULL	
c6	varchar(50)	YES	UNI	NULL	
m10	varchar(10)	YES		NULL	
c7	char(50)	YES		NULL	
c8	binary(50)	NO		NULL	
c9	varbinary(50)	NO		NULL	
c11	set('i','j','k','l','m','n','o','p')	YES		NULL	
c12	time	NO	MUL	NULL	
c13	date	NO		NULL	
c14	datetime	NO		NULL	
c15	timestamp	NO		NULL	
c16	year(4)	YES		NULL	
c17	int(5) unsigned	YES		NULL	
INSERT INTO t1 VALUES(24,2.08,25,b'0111101','89504E470D0A1A0A0000000EC300000EC301C76FA8640000001E49444154384F6350DAE843126220493550F','B','中文删9除汉化','test2','english_luage','teshu*$￥%','SHUZ234567','l','22:22:22','2022-12-22','1982-12-22 22:42:21','2020-06-21 21:01:21.34567','2021',3);
SELECT * FROM t1 ORDER BY 1;
c0	c1	c2	c3	c4	c5	c6	m10	c7	c8	c9	c11	c12	c13	c14	c15	c16	c17
00001	1.5	1	   	�PNG

   IHDRP   ���0  �0  �0v��@  	89504E470D0A1A0A00C76FA8640000001E49444154384F6350DAE843		a		teshu*符号@$￥%                                	SHUZI!1234567	i	20:12:12	2000-12-12	2000-01-01 01:01:01	2001-01-01 12:01:01	2000	NULL
00002	2.5	2	  5	�PNG

   I�0  �0  �0v��@  �DC�	89504E470D0A1A0A00C76FA8640000001E49444154384F6350DAE843	中文—汉化	b	english_language	teshu*符号@$￥%                                	SHUZI!1234567	i	21:12:12	2001-12-22	2001-01-01 13:01:01	2001-11-01 11:01:01	2010	NULL
00003	3.5	3	  	�PNG

 �o�d   IDAT8OcP��Cb I5P�bB	89504E470D0A1A0A00C76FA8640000001E49444154384F6350DAE843	删除时使用情景	c	english_language	teshu*符号@$￥%                                	SHUZI!1234567	i	22:12:12	2002-12-02	2002-01-01 14:01:01	2002-12-01 02:01:01	2000	NULL
00004	4.5	4	  	�PNG

 �o�d   IDAT8OcP��Cb I5P�bB	89504E470D0A1A0A00C76FA8640000001E49444154384F6350DAE843	删除中——汉化	d	english_language	teshu*符号@$￥%                                	SHUZI!1234567	j	23:12:12	2003-12-11	2003-01-01 15:01:01	2002-11-01 03:01:01	2010	NULL
00005	5.5	5	  =	�PNG

 �o�d   IDAT8OcP��Cb I5P	89504E470D0A1A0A00C76FA8640000001E49444154384F6350DAE843	删除中文*汉化删除	e	english_language	teshu*符号@$￥%                                	SHUZI!1234567	k	20:22:12	2004-12-12	2004-01-01 16:01:01	2002-02-04 05:01:01	2000	NULL
00006	6.5	6	  7	�PNG

 �o�d   IDAT8OcP��Cb I5P	89504E470D0A1A0A00C76FA8640000001E49444154384F6350DAE843	除列时使用情景	f	english_language	teshu*符号@$￥%                                	SHUZI!1234567	k	20:32:12	2021-12-13	2010-01-01 21:01:01	2003-03-01 04:01:01	2010	NULL
00007	7.5	7	  	�PNG

 �o�d   IDAT8OcP��Cb I5P	89504E470D0A1A0A00C76FA8640000001E49444154384F6350DAE843	删列时使用情景	g	english_language	teshu*符号@$￥%                                	SHUZI!1234567	l	20:42:12	2020-12-14	2011-01-01 22:01:01	2004-04-01 05:01:01	2000	NULL
00008	8.5	8	  		�PNG

 �o�d   IDAT8OcP��Cb I5P	89504E470D0A1A0A00C76FA8640000001E49444154384F6350DAE843	删除列使用情景	h	english_language	teshu*符号@$￥%                                	SHUZI!1234567	l	20:52:12	2015-12-15	2012-01-01 23:01:01	2005-05-01 06:01:01	2020	NULL
00009	9.5	9	  	�PNG

 �o�d   IDAT8OcP��Cb I5P	89504E470D0A1A0A00C76FA8640000001E49444154384F6350DAE843	删中文——汉化删除	a	english_language	teshu*符号@$￥%                                	SHUZI!1234567	l	20:12:42	2014-12-16	2013-01-01 20:01:01	2006-06-01 07:01:01	2000	NULL
00010	10.5	10	  	�PNG

 �o�d   IDAT8OcP��C	89504E470D0A1A0A00C76FA8640000001E49444154384F6350DAE843126220493550	删除列时用情景	a	english_language	teshu*符号@$￥%                                	SHUZI!1234567	m	21:12:52	2013-12-17	2014-01-01 01:11:01	2007-07-01 08:01:01	2020	NULL
00011	1.15	11	  %	�PNG

 �o�d   IDAT8OcP��C	89504E470D0A1A0A00C76FA8640000001E49444154384F6350DAE843126220493550	中文——汉化删除	b	english_language	teshu*符号@$￥%                                	SHUZI!1234567	n	21:12:32	2012-12-18	2011-01-01 01:21:01	2008-08-01 01:01:01	2010	NULL
00012	1.25	12	  )	�PNG

 �o�d   IDAT8OcP��C	89504E470D0A1A0A00C76FA8640000001E49444154384F6350DAE843126220493550	删除中文——汉化	b	english_language	teshu*符号@$￥%                                	SHUZI!1234567	n	22:12:22	2011-12-19	2010-01-01 01:31:01	2009-09-01 01:01:01	2020	NULL
00013	1.35	13	  *	�PNG

 �o�d   IDAT8OcP��C	89504E470D0A1A0A00C76FA8640000001E49444154384F6350DAE843126220493550F1	删除列时使情景	c	english_language	teshu*符号@$￥%                                	SHUZI!1234567	m	22:12:12	2017-12-10	2018-01-01 01:41:01	2010-10-01 01:01:01	2000	NULL
00022	2.06	23	  ]	�PNG

 �o�d   IDAT8OcP��C	89504E470D0A1A0A0000000EC300000EC301C76FA8640000001E49444154384F6350DAE843126220493550F	中文删$除汉化	test	english_language	teshu*符号@$￥%                                	SHUZI!1234567	j	19:12:12	2022-12-12	1980-01-01 01:41:01	2000-06-01 01:01:01	2010	00001
00023	2.07	24	  ]	�PNG

 �o�d   IDAT8OcP��C	89504E470D0A1A0A0000000EC300000EC301C76FA8640000001E49444154384F6350DAE843126220493550F	中文删=除汉化	test1	english_language	teshu*符号@$￥%                                	SHUZI!1234567	k	19:12:12	2022-12-12	1980-01-01 01:41:01	2000-06-01 01:01:01	2011	00002
00024	2.08	25	  =	89504E470D0A1A0A0000000EC300000EC301C76FA8640000001E49444154384F6350DAE843126220493550F	B	中文删9除汉化	test2	english_luage	teshu*$￥%                                       	SHUZ234567	l	22:22:22	2022-12-22	1982-12-22 22:42:21	2020-06-21 21:01:21	2021	00003
#修改为生成列并新增列和删除列
ALTER TABLE t1 CHANGE c10 c10 VARCHAR(10) AS (UPPER(c11)) AFTER c9,DROP m0 ,ADD COLUMN c19 CHAR(100) ,MODIFY c17 CHAR(10) AFTER c1;
ALTER TABLE t1 DROP m0,MODIFY c10 VARCHAR(10) AS (UPPER(c11)) AFTER c9,ADD c19 CHAR(10) AFTER c1;
DESC t1;
Field	Type	Null	Key	Default	Extra
c0	int(5) unsigned	YES		NULL	
c1	float	NO	MUL	NULL	
c2	double	NO	PRI	NULL	auto_increment
c3	bit(20)	YES		b'0'	
c4	blob	YES		NULL	
c5	text	YES		NULL	
c6	varchar(50)	YES	UNI	NULL	
m10	varchar(10)	YES		NULL	
c7	char(50)	YES		NULL	
c8	binary(50)	NO		NULL	
c9	varbinary(50)	NO		NULL	
c11	set('i','j','k','l','m','n','o','p')	YES		NULL	
c12	time	NO	MUL	NULL	
c13	date	NO		NULL	
c14	datetime	NO		NULL	
c15	timestamp	NO		NULL	
c16	year(4)	YES		NULL	
c17	int(5) unsigned	YES		NULL	
INSERT INTO t1(c0,c1,c2,c5,c6,c7,c8,c9,c10,c11,c12,c13,c14,c15,c16,c17)
VALUES(25,5.56,3.09,'89504E470D0A1A0A00C76FA8640000001E49444154384F6350DAE843','89504E4550F','中文删8除汉化','englshlanguage','teshu符$￥%','aa','m','09:02:02','2000-02-02','1982-06-01 01:41:01','2006-06-01 06:06:06.34567','2016',4);
SELECT * FROM t1 ORDER BY 1;
c0	c1	c2	c3	c4	c5	c6	m10	c7	c8	c9	c11	c12	c13	c14	c15	c16	c17
00001	1.5	1	   	�PNG

   IHDRP   ���0  �0  �0v��@  	89504E470D0A1A0A00C76FA8640000001E49444154384F6350DAE843		a		teshu*符号@$￥%                                	SHUZI!1234567	i	20:12:12	2000-12-12	2000-01-01 01:01:01	2001-01-01 12:01:01	2000	NULL
00002	2.5	2	  5	�PNG

   I�0  �0  �0v��@  �DC�	89504E470D0A1A0A00C76FA8640000001E49444154384F6350DAE843	中文—汉化	b	english_language	teshu*符号@$￥%                                	SHUZI!1234567	i	21:12:12	2001-12-22	2001-01-01 13:01:01	2001-11-01 11:01:01	2010	NULL
00003	3.5	3	  	�PNG

 �o�d   IDAT8OcP��Cb I5P�bB	89504E470D0A1A0A00C76FA8640000001E49444154384F6350DAE843	删除时使用情景	c	english_language	teshu*符号@$￥%                                	SHUZI!1234567	i	22:12:12	2002-12-02	2002-01-01 14:01:01	2002-12-01 02:01:01	2000	NULL
00004	4.5	4	  	�PNG

 �o�d   IDAT8OcP��Cb I5P�bB	89504E470D0A1A0A00C76FA8640000001E49444154384F6350DAE843	删除中——汉化	d	english_language	teshu*符号@$￥%                                	SHUZI!1234567	j	23:12:12	2003-12-11	2003-01-01 15:01:01	2002-11-01 03:01:01	2010	NULL
00005	5.5	5	  =	�PNG

 �o�d   IDAT8OcP��Cb I5P	89504E470D0A1A0A00C76FA8640000001E49444154384F6350DAE843	删除中文*汉化删除	e	english_language	teshu*符号@$￥%                                	SHUZI!1234567	k	20:22:12	2004-12-12	2004-01-01 16:01:01	2002-02-04 05:01:01	2000	NULL
00006	6.5	6	  7	�PNG

 �o�d   IDAT8OcP��Cb I5P	89504E470D0A1A0A00C76FA8640000001E49444154384F6350DAE843	除列时使用情景	f	english_language	teshu*符号@$￥%                                	SHUZI!1234567	k	20:32:12	2021-12-13	2010-01-01 21:01:01	2003-03-01 04:01:01	2010	NULL
00007	7.5	7	  	�PNG

 �o�d   IDAT8OcP��Cb I5P	89504E470D0A1A0A00C76FA8640000001E49444154384F6350DAE843	删列时使用情景	g	english_language	teshu*符号@$￥%                                	SHUZI!1234567	l	20:42:12	2020-12-14	2011-01-01 22:01:01	2004-04-01 05:01:01	2000	NULL
00008	8.5	8	  		�PNG

 �o�d   IDAT8OcP��Cb I5P	89504E470D0A1A0A00C76FA8640000001E49444154384F6350DAE843	删除列使用情景	h	english_language	teshu*符号@$￥%                                	SHUZI!1234567	l	20:52:12	2015-12-15	2012-01-01 23:01:01	2005-05-01 06:01:01	2020	NULL
00009	9.5	9	  	�PNG

 �o�d   IDAT8OcP��Cb I5P	89504E470D0A1A0A00C76FA8640000001E49444154384F6350DAE843	删中文——汉化删除	a	english_language	teshu*符号@$￥%                                	SHUZI!1234567	l	20:12:42	2014-12-16	2013-01-01 20:01:01	2006-06-01 07:01:01	2000	NULL
00010	10.5	10	  	�PNG

 �o�d   IDAT8OcP��C	89504E470D0A1A0A00C76FA8640000001E49444154384F6350DAE843126220493550	删除列时用情景	a	english_language	teshu*符号@$￥%                                	SHUZI!1234567	m	21:12:52	2013-12-17	2014-01-01 01:11:01	2007-07-01 08:01:01	2020	NULL
00011	1.15	11	  %	�PNG

 �o�d   IDAT8OcP��C	89504E470D0A1A0A00C76FA8640000001E49444154384F6350DAE843126220493550	中文——汉化删除	b	english_language	teshu*符号@$￥%                                	SHUZI!1234567	n	21:12:32	2012-12-18	2011-01-01 01:21:01	2008-08-01 01:01:01	2010	NULL
00012	1.25	12	  )	�PNG

 �o�d   IDAT8OcP��C	89504E470D0A1A0A00C76FA8640000001E49444154384F6350DAE843126220493550	删除中文——汉化	b	english_language	teshu*符号@$￥%                                	SHUZI!1234567	n	22:12:22	2011-12-19	2010-01-01 01:31:01	2009-09-01 01:01:01	2020	NULL
00013	1.35	13	  *	�PNG

 �o�d   IDAT8OcP��C	89504E470D0A1A0A00C76FA8640000001E49444154384F6350DAE843126220493550F1	删除列时使情景	c	english_language	teshu*符号@$￥%                                	SHUZI!1234567	m	22:12:12	2017-12-10	2018-01-01 01:41:01	2010-10-01 01:01:01	2000	NULL
00022	2.06	23	  ]	�PNG

 �o�d   IDAT8OcP��C	89504E470D0A1A0A0000000EC300000EC301C76FA8640000001E49444154384F6350DAE843126220493550F	中文删$除汉化	test	english_language	teshu*符号@$￥%                                	SHUZI!1234567	j	19:12:12	2022-12-12	1980-01-01 01:41:01	2000-06-01 01:01:01	2010	00001
00023	2.07	24	  ]	�PNG

 �o�d   IDAT8OcP��C	89504E470D0A1A0A0000000EC300000EC301C76FA8640000001E49444154384F6350DAE843126220493550F	中文删=除汉化	test1	english_language	teshu*符号@$￥%                                	SHUZI!1234567	k	19:12:12	2022-12-12	1980-01-01 01:41:01	2000-06-01 01:01:01	2011	00002
00024	2.08	25	  =	89504E470D0A1A0A0000000EC300000EC301C76FA8640000001E49444154384F6350DAE843126220493550F	B	中文删9除汉化	test2	english_luage	teshu*$￥%                                       	SHUZ234567	l	22:22:22	2022-12-22	1982-12-22 22:42:21	2020-06-21 21:01:21	2021	00003
#修改多列
DROP TABLE IF EXISTS t1;
CREATE TABLE t1(c0 INT(5) ZEROFILL,
c1 FLOAT NOT NULL,
c2 DOUBLE AUTO_INCREMENT PRIMARY KEY,
c3 BIT(20) DEFAULT 0,
c4 BLOB,
c5 TEXT,
c6 VARCHAR(50) UNIQUE,
c7 CHAR(50),
c8 BINARY(50) NOT NULL,
c9 VARBINARY(50) NOT NULL,
c10 ENUM('a','b','c','d','e','f','g','h'),
c11 SET('i','j','k','l','m','n','o','p'),
c12 TIME NOT NULL,
c13 DATE NOT NULL,
c14 DATETIME NOT NULL,
c15 TIMESTAMP NOT NULL,
c16 YEAR ,CHECK(c16>=2000));
INSERT INTO t1 VALUES(1,1.5,1,'',x'89504E470D0A1A0A0000000D4948445206105000000097048597300000EC300000EC301C76FA8640000001','89504E470D0A1A0A00C76FA8640000001E49444154384F6350DAE843','','','teshu*符号@$￥%','SHUZI!1234567','a','i','20:12:12','2000-12-12','2000-01-01 01:01:01','2001-01-01 12:01:01.34567','2000'),
(2,2.5,2,b'110101',x'89504E470D0A1A0A0000000D4997300000EC300000EC301C76FA8640000001E49444154384','89504E470D0A1A0A00C76FA8640000001E49444154384F6350DAE843','中文—汉化','english_language','teshu*符号@$￥%','SHUZI!1234567','b','i','21:12:12','2001-12-22','2001-01-01 13:01:01','2001-11-01 11:01:01.34567','2010'),
(3,3.5,3,b'011101',x'89504E470D0A1A0A00C76FA8640000001E49444154384F6350DAE843126220493550F1A8066242','89504E470D0A1A0A00C76FA8640000001E49444154384F6350DAE843','删除时使用情景','english_language','teshu*符号@$￥%','SHUZI!1234567','c','i','22:12:12','2002-12-02','2002-01-01 14:01:01','2002-12-01 02:01:01.34567','2000'),
(4,4.5,4,b'010111',x'89504E470D0A1A0A00C76FA8640000001E49444154384F6350DAE843126220493550F1A8066242','89504E470D0A1A0A00C76FA8640000001E49444154384F6350DAE843','删除中——汉化','english_language','teshu*符号@$￥%','SHUZI!1234567','d','j','23:12:12','2003-12-11','2003-01-01 15:01:01','2002-11-01 03:01:01.34567','2010'),
(5,5.5,5,b'111101',x'89504E470D0A1A0A00C76FA8640000001E49444154384F6350DAE843126220493550','89504E470D0A1A0A00C76FA8640000001E49444154384F6350DAE843','删除中文*汉化删除','english_language','teshu*符号@$￥%','SHUZI!1234567','e','k','20:22:12','2004-12-12','2004-01-01 16:01:01','2002-02-04 05:01:01.34567','2000'),
(6,6.5,6,b'110111',x'89504E470D0A1A0A00C76FA8640000001E49444154384F6350DAE843126220493550','89504E470D0A1A0A00C76FA8640000001E49444154384F6350DAE843','除列时使用情景','english_language','teshu*符号@$￥%','SHUZI!1234567','f','k','20:32:12','2021-12-13','2010-01-01 21:01:01','2003-03-01 04:01:01.34567','2010');
INSERT INTO t1 VALUES(7,7.5,7,b'01101',x'89504E470D0A1A0A00C76FA8640000001E49444154384F6350DAE843126220493550','89504E470D0A1A0A00C76FA8640000001E49444154384F6350DAE843','删列时使用情景','english_language','teshu*符号@$￥%','SHUZI!1234567','g','l','20:42:12','2020-12-14','2011-01-01 22:01:01','2004-04-01 05:01:01.34567','2000'),
(8,8.5,8,b'01001',x'89504E470D0A1A0A00C76FA8640000001E49444154384F6350DAE843126220493550','89504E470D0A1A0A00C76FA8640000001E49444154384F6350DAE843','删除列使用情景','english_language','teshu*符号@$￥%','SHUZI!1234567','h','l','20:52:12','2015-12-15','2012-01-01 23:01:01','2005-05-01 06:01:01.34567','2020'),
(9,9.5,9,b'10101',x'89504E470D0A1A0A00C76FA8640000001E49444154384F6350DAE843126220493550','89504E470D0A1A0A00C76FA8640000001E49444154384F6350DAE843','删中文——汉化删除','english_language','teshu*符号@$￥%','SHUZI!1234567','a','l','20:12:42','2014-12-16','2013-01-01 20:01:01','2006-06-01 07:01:01.34567','2000'),
(10,10.5,10,b'0010101',x'89504E470D0A1A0A00C76FA8640000001E49444154384F6350DAE843','89504E470D0A1A0A00C76FA8640000001E49444154384F6350DAE843126220493550','删除列时用情景','english_language','teshu*符号@$￥%','SHUZI!1234567','a','m','21:12:52','2013-12-17','2014-01-01 01:11:01','2007-07-01 08:01:01.34567','2020'),
(11,1.15,11,b'0100101',x'89504E470D0A1A0A00C76FA8640000001E49444154384F6350DAE843','89504E470D0A1A0A00C76FA8640000001E49444154384F6350DAE843126220493550','中文——汉化删除','english_language','teshu*符号@$￥%','SHUZI!1234567','b','n','21:12:32','2012-12-18','2011-01-01 01:21:01','2008-08-01 01:01:01.34567','2010'),
(12,1.25,12,b'0101001',x'89504E470D0A1A0A00C76FA8640000001E49444154384F6350DAE843','89504E470D0A1A0A00C76FA8640000001E49444154384F6350DAE843126220493550','删除中文——汉化','english_language','teshu*符号@$￥%','SHUZI!1234567','b','n','22:12:22','2011-12-19','2010-01-01 01:31:01','2009-09-01 01:01:01.34567','2020'),
(13,1.35,13,b'0101010',x'89504E470D0A1A0A00C76FA8640000001E49444154384F6350DAE843','89504E470D0A1A0A00C76FA8640000001E49444154384F6350DAE843126220493550F1','删除列时使情景','english_language','teshu*符号@$￥%','SHUZI!1234567','c','m','22:12:12','2017-12-10','2018-01-01 01:41:01','2010-10-01 01:01:01.34567','2000');
ALTER TABLE t1 CHANGE c1 c1 FLOAT AFTER c5,CHANGE c2 m2 DOUBLE BEFORE c4,CHANGE c3 c3 VARCHAR(20) AFTER c0;
ALTER TABLE t1 MODIFY c1 FLOAT AFTER c5,MODIFY c3 VARCHAR(20) AFTER c0,MODIFY c8 CHAR(60) BEFORE c6;
DESC t1;
Field	Type	Null	Key	Default	Extra
c0	int(5) unsigned	YES		NULL	
c3	varchar(20)	YES		NULL	
m2	double	NO	PRI	NULL	
c4	blob	YES		NULL	
c5	text	YES		NULL	
c1	float	YES		NULL	
c8	char(60)	YES		NULL	
c6	varchar(50)	YES	UNI	NULL	
c7	char(50)	YES		NULL	
c9	varbinary(50)	NO		NULL	
c10	enum('a','b','c','d','e','f','g','h')	YES		NULL	
c11	set('i','j','k','l','m','n','o','p')	YES		NULL	
c12	time	NO		NULL	
c13	date	NO		NULL	
c14	datetime	NO		NULL	
c15	timestamp	NO		NULL	
c16	year(4)	YES		NULL	
SELECT * FROM t1 ORDER BY 1;
c0	c3	m2	c4	c5	c1	c8	c6	c7	c9	c10	c11	c12	c13	c14	c15	c16
00001	0	1	�PNG

   IHDRP   ���0  �0  �0v��@  	89504E470D0A1A0A00C76FA8640000001E49444154384F6350DAE843	1.5	teshu*符号@$￥%                                			SHUZI!1234567	a	i	20:12:12	2000-12-12	2000-01-01 01:01:01	2001-01-01 12:01:01	2000
00002	53	2	�PNG

   I�0  �0  �0v��@  �DC�	89504E470D0A1A0A00C76FA8640000001E49444154384F6350DAE843	2.5	teshu*符号@$￥%                                	中文—汉化	english_language	SHUZI!1234567	b	i	21:12:12	2001-12-22	2001-01-01 13:01:01	2001-11-01 11:01:01	2010
00003	29	3	�PNG

 �o�d   IDAT8OcP��Cb I5P�bB	89504E470D0A1A0A00C76FA8640000001E49444154384F6350DAE843	3.5	teshu*符号@$￥%                                	删除时使用情景	english_language	SHUZI!1234567	c	i	22:12:12	2002-12-02	2002-01-01 14:01:01	2002-12-01 02:01:01	2000
00004	23	4	�PNG

 �o�d   IDAT8OcP��Cb I5P�bB	89504E470D0A1A0A00C76FA8640000001E49444154384F6350DAE843	4.5	teshu*符号@$￥%                                	删除中——汉化	english_language	SHUZI!1234567	d	j	23:12:12	2003-12-11	2003-01-01 15:01:01	2002-11-01 03:01:01	2010
00005	61	5	�PNG

 �o�d   IDAT8OcP��Cb I5P	89504E470D0A1A0A00C76FA8640000001E49444154384F6350DAE843	5.5	teshu*符号@$￥%                                	删除中文*汉化删除	english_language	SHUZI!1234567	e	k	20:22:12	2004-12-12	2004-01-01 16:01:01	2002-02-04 05:01:01	2000
00006	55	6	�PNG

 �o�d   IDAT8OcP��Cb I5P	89504E470D0A1A0A00C76FA8640000001E49444154384F6350DAE843	6.5	teshu*符号@$￥%                                	除列时使用情景	english_language	SHUZI!1234567	f	k	20:32:12	2021-12-13	2010-01-01 21:01:01	2003-03-01 04:01:01	2010
00007	13	7	�PNG

 �o�d   IDAT8OcP��Cb I5P	89504E470D0A1A0A00C76FA8640000001E49444154384F6350DAE843	7.5	teshu*符号@$￥%                                	删列时使用情景	english_language	SHUZI!1234567	g	l	20:42:12	2020-12-14	2011-01-01 22:01:01	2004-04-01 05:01:01	2000
00008	9	8	�PNG

 �o�d   IDAT8OcP��Cb I5P	89504E470D0A1A0A00C76FA8640000001E49444154384F6350DAE843	8.5	teshu*符号@$￥%                                	删除列使用情景	english_language	SHUZI!1234567	h	l	20:52:12	2015-12-15	2012-01-01 23:01:01	2005-05-01 06:01:01	2020
00009	21	9	�PNG

 �o�d   IDAT8OcP��Cb I5P	89504E470D0A1A0A00C76FA8640000001E49444154384F6350DAE843	9.5	teshu*符号@$￥%                                	删中文——汉化删除	english_language	SHUZI!1234567	a	l	20:12:42	2014-12-16	2013-01-01 20:01:01	2006-06-01 07:01:01	2000
00010	21	10	�PNG

 �o�d   IDAT8OcP��C	89504E470D0A1A0A00C76FA8640000001E49444154384F6350DAE843126220493550	10.5	teshu*符号@$￥%                                	删除列时用情景	english_language	SHUZI!1234567	a	m	21:12:52	2013-12-17	2014-01-01 01:11:01	2007-07-01 08:01:01	2020
00011	37	11	�PNG

 �o�d   IDAT8OcP��C	89504E470D0A1A0A00C76FA8640000001E49444154384F6350DAE843126220493550	1.15	teshu*符号@$￥%                                	中文——汉化删除	english_language	SHUZI!1234567	b	n	21:12:32	2012-12-18	2011-01-01 01:21:01	2008-08-01 01:01:01	2010
00012	41	12	�PNG

 �o�d   IDAT8OcP��C	89504E470D0A1A0A00C76FA8640000001E49444154384F6350DAE843126220493550	1.25	teshu*符号@$￥%                                	删除中文——汉化	english_language	SHUZI!1234567	b	n	22:12:22	2011-12-19	2010-01-01 01:31:01	2009-09-01 01:01:01	2020
00013	42	13	�PNG

 �o�d   IDAT8OcP��C	89504E470D0A1A0A00C76FA8640000001E49444154384F6350DAE843126220493550F1	1.35	teshu*符号@$￥%                                	删除列时使情景	english_language	SHUZI!1234567	c	m	22:12:12	2017-12-10	2018-01-01 01:41:01	2010-10-01 01:01:01	2000
#以下操作都暂不支持，后续支持后再完善case
DROP TABLE IF EXISTS t2;
DROP TABLE IF EXISTS t1;
#########Empty recycle bin, delete test database, tables, etc##########
purge recyclebin;
