purge recyclebin;
DROP TABLE IF EXISTS t1;
DROP TABLE IF EXISTS t2;
#mysql_modify-3
#mysql_modify-3-1/mysql_modify-3-2/mysql_modify-3-3
######################PARTITION BY HASH########################
#普通哈希分区表
DROP TABLE IF EXISTS t1;
CREATE TABLE t1(c0 INT,
c1 FLOAT ,
c2 DOUBLE,
c3 CHAR(10),
c4 VARCHAR(10),
c5 CHAR(10),
c6 INT,
c7 DATE,
c8 YEAR)
PARTITION BY HASH(c8) PARTITIONS 3;
INSERT INTO t1 VALUES(1,1.0,1.1,'中文','','',0,'2010-10-11','1989'),
(2,1.1,1.2,'中!文','A','a',1,'2001-01-11','2001'),
(3,1.2,2.2,'中!文','B','a',2,'2016-02-11','2002'),
(4,1.3,3.2,'中!文','C','a',1,'2021-03-11','2003'),
(5,1.4,4.2,'中!文','D','a',2,'2011-11-01','2004'),
(6,1.5,5.2,'中!文','E','a',1,'2014-01-11','2005'),
(7,1.6,6.2,'中!文','F','a',3,'2011-11-01','2006'),
(8,1.7,7.2,'中!文','G','a',1,'2017-01-11','2007'),
(9,1.8,8.2,'中!文','H','a',4,'2013-11-01','2011'),
(10,1.9,9.2,'中!文','I','a',5,'2011-11-11','2013'),
(11,2.0,1.9,'中!文','J','a',6,'2015-01-01','2016'),
(12,2.1,1.8,'中!文','K','a',7,'2012-12-11','2016');
ALTER TABLE t1 CHANGE c8 c8 DATE DEFAULT '2000-01-01' AFTER c5;
ALTER TABLE t1 CHANGE c8 m8 YEAR DEFAULT '2000';
ALTER TABLE t1 MODIFY m8 DATE DEFAULT '2000-01-01' AFTER c7;
ALTER TABLE t1 MODIFY m8 YEAR NOT NULL UNIQUE AFTER c7;
UPDATE t1 SET m8='2014' WHERE c0=11;
ALTER TABLE t1 MODIFY m8 YEAR NOT NULL UNIQUE AFTER c7;
INSERT INTO t1 VALUES(14,2.3,1.6,'中9文','M','b',8,'2013-12-13','2018');
SELECT * FROM t1 ORDER BY 1;
c0	c1	c2	c3	c4	c5	c6	c7	m8
1	1	1.1	中文			0	2010-10-11	1989
2	1.1	1.2	中!文	A	a	1	2001-01-11	2001
3	1.2	2.2	中!文	B	a	2	2016-02-11	2002
4	1.3	3.2	中!文	C	a	1	2021-03-11	2003
5	1.4	4.2	中!文	D	a	2	2011-11-01	2004
6	1.5	5.2	中!文	E	a	1	2014-01-11	2005
7	1.6	6.2	中!文	F	a	3	2011-11-01	2006
8	1.7	7.2	中!文	G	a	1	2017-01-11	2007
9	1.8	8.2	中!文	H	a	4	2013-11-01	2011
10	1.9	9.2	中!文	I	a	5	2011-11-11	2013
11	2	1.9	中!文	J	a	6	2015-01-01	2014
12	2.1	1.8	中!文	K	a	7	2012-12-11	2016
14	2.3	1.6	中9文	M	b	8	2013-12-13	2018
#修改列与其他操作混用情景
ALTER TABLE t1 CHANGE m8 m8 YEAR AFTER m7,ADD INDEX ind_1(m8);
ALTER TABLE t1 CHANGE m8 m8 YEAR AFTER c6,ADD PARTITION(PARTITION BY HASH(c8) PARTITIONS 4);
#修改分区键并添加普通索引和联合索引
DROP TABLE IF EXISTS t1;
CREATE TABLE t1(c0 INT,
c1 FLOAT ,
c2 DOUBLE,
c3 CHAR(10),
c4 VARCHAR(10),
c5 CHAR(10),
c6 INT,
c7 DATE,
c8 YEAR)
PARTITION BY HASH(c8) PARTITIONS 3;
INSERT INTO t1 VALUES(1,1.0,1.1,'中文','','',0,'2010-10-11','1989'),
(2,1.1,1.2,'中!文','A','a',1,'2001-01-11','2001'),
(3,1.2,2.2,'中!文','B','a',2,'2016-02-11','2002'),
(4,1.3,3.2,'中!文','C','a',1,'2021-03-11','2003'),
(5,1.4,4.2,'中!文','D','a',2,'2011-11-01','2004'),
(6,1.5,5.2,'中!文','E','a',1,'2014-01-11','2005'),
(7,1.6,6.2,'中!文','F','a',3,'2011-11-01','2006'),
(8,1.7,7.2,'中!文','G','a',1,'2017-01-11','2007'),
(9,1.8,8.2,'中!文','H','a',4,'2013-11-01','2011'),
(10,1.9,9.2,'中!文','I','a',5,'2011-11-11','2013'),
(11,2.0,1.9,'中!文','J','a',6,'2015-01-01','2016'),
(12,2.1,1.8,'中!文','K','a',7,'2012-12-11','2016');
CREATE INDEX ind_1 ON t1(c7);
CREATE INDEX ind_2 ON t1(c1,c8);
ALTER TABLE t1 CHANGE c8 c8 YEAR DEFAULT '2000' AFTER c6;
SELECT /*+INDEX(ind_2) */ * FROM t1 WHERE c1<2 AND c8>2005 ORDER BY 1;
c0	c1	c2	c3	c4	c5	c6	c8	c7
7	1.6	6.2	中!文	F	a	3	2006	2011-11-01
8	1.7	7.2	中!文	G	a	1	2007	2017-01-11
9	1.8	8.2	中!文	H	a	4	2011	2013-11-01
10	1.9	9.2	中!文	I	a	5	2013	2011-11-11
ALTER TABLE t1 CHANGE c8 m8 DATE,DROP PARTITION p0;
ERROR 42000: You have an error in your SQL syntax; check the manual that corresponds to your OceanBase version for the right syntax to use near 'PARTITION p0' at line 1
ALTER TABLE t1 CHANGE c8 m8 DATE DEFAULT '2000-01-01';
ALTER TABLE t1 MODIFY c8 DATE DEFAULT '2000-01-01';
ALTER TABLE t1 CHANGE c8 m8 YEAR;
SELECT /*+INDEX(ind_2) */ * FROM t1 WHERE c1<2 AND m8>2005 ORDER BY 1;
c0	c1	c2	c3	c4	c5	c6	m8	c7
7	1.6	6.2	中!文	F	a	3	2006	2011-11-01
8	1.7	7.2	中!文	G	a	1	2007	2017-01-11
9	1.8	8.2	中!文	H	a	4	2011	2013-11-01
10	1.9	9.2	中!文	I	a	5	2013	2011-11-11
INSERT INTO t1 VALUES(13,2.2,1.7,'中=文','L','c',9,'2017','2012-12-17');
DELETE FROM t1 WHERE m8=2002;
SELECT * FROM t1 ORDER BY 1;
c0	c1	c2	c3	c4	c5	c6	m8	c7
1	1	1.1	中文			0	1989	2010-10-11
2	1.1	1.2	中!文	A	a	1	2001	2001-01-11
4	1.3	3.2	中!文	C	a	1	2003	2021-03-11
5	1.4	4.2	中!文	D	a	2	2004	2011-11-01
6	1.5	5.2	中!文	E	a	1	2005	2014-01-11
7	1.6	6.2	中!文	F	a	3	2006	2011-11-01
8	1.7	7.2	中!文	G	a	1	2007	2017-01-11
9	1.8	8.2	中!文	H	a	4	2011	2013-11-01
10	1.9	9.2	中!文	I	a	5	2013	2011-11-11
11	2	1.9	中!文	J	a	6	2016	2015-01-01
12	2.1	1.8	中!文	K	a	7	2016	2012-12-11
13	2.2	1.7	中=文	L	c	9	2017	2012-12-17
alter system set _enable_drop_and_add_index = true;
ALTER TABLE t1 DROP INDEX ind_2,MODIFY m8 YEAR DEFAULT '2000',ADD INDEX ind2(m8);
alter system set _enable_drop_and_add_index = false;
SELECT /*+INDEX(ind2) */ * FROM t1 WHERE m8=2005;
c0	c1	c2	c3	c4	c5	c6	m8	c7
6	1.5	5.2	中!文	E	a	1	2005	2014-01-11
ALTER TABLE t1 MODIFY m8 YEAR AFTER c7,ADD c9 INT(4) ZEROFILL DEFAULT 0 AFTER c6,DROP c5;
INSERT INTO t1 VALUES(14,2.3,1.6,'中-文','M',10,1,'2012-02-18','2018');
SELECT /*+INDEX(ind2) */ * FROM t1 WHERE m8=2018;
c0	c1	c2	c3	c4	c6	c9	c7	m8
14	2.3	1.6	中-文	M	10	0001	2012-02-18	2018
#在分区表创建分区索引，然后修改索引列
DROP TABLE IF EXISTS t1;
CREATE TABLE t1(c0 INT,
c1 FLOAT ,
c2 DOUBLE,
c3 CHAR(10),
c4 VARCHAR(10),
c5 CHAR(10),
c6 INT,
c7 DATE,
c8 YEAR)
PARTITION BY HASH(c8) PARTITIONS 3;
INSERT INTO t1 VALUES(1,1.0,1.1,'中文','','',0,'2010-10-11','1989'),
(2,1.1,1.2,'中!文','A','a',1,'2001-01-11','2001'),
(3,1.2,2.2,'中!文','B','a',2,'2016-02-11','2002'),
(4,1.3,3.2,'中!文','C','a',1,'2021-03-11','2003'),
(5,1.4,4.2,'中!文','D','a',2,'2011-11-01','2004'),
(6,1.5,5.2,'中!文','E','a',1,'2014-01-11','2005'),
(7,1.6,6.2,'中!文','F','a',3,'2011-11-01','2006'),
(8,1.7,7.2,'中!文','G','a',1,'2017-01-11','2007'),
(9,1.8,8.2,'中!文','H','a',4,'2013-11-01','2011'),
(10,1.9,9.2,'中!文','I','a',5,'2011-11-11','2013'),
(11,2.0,1.9,'中!文','J','a',6,'2015-01-01','2016'),
(12,2.1,1.8,'中!文','K','a',7,'2012-12-11','2016');
ALTER TABLE t1 CHANGE c8 c8 YEAR DEFAULT '2000' FIRST;
#使用新增列创建全局分区索引
CREATE INDEX ind_g ON t1(c8,c6) GLOBAL
PARTITION BY RANGE(c6)
(PARTITION p1 VALUES LESS THAN(4),
PARTITION p2 VALUES LESS THAN(8),
PARTITION p3 VALUES LESS THAN(10),
PARTITION p4 VALUES LESS THAN(MAXVALUE)
);
CREATE INDEX ind_g ON t1(c8,c6) GLOBAL
PARTITION BY RANGE(c8)
(PARTITION p1 VALUES LESS THAN(4),
PARTITION p2 VALUES LESS THAN(8),
PARTITION p3 VALUES LESS THAN(10),
PARTITION p4 VALUES LESS THAN(MAXVALUE)
);
INSERT INTO t1 VALUES('2017',13,2.2,1.7,'中!文','L','b',8,'2018-10-08');
SELECT /*+INDEX(ind_g) */ * FROM t1 WHERE c8>2010 AND c6<6 ORDER BY 1;
c8	c0	c1	c2	c3	c4	c5	c6	c7
2011	9	1.8	8.2	中!文	H	a	4	2013-11-01
2013	10	1.9	9.2	中!文	I	a	5	2011-11-11
#在分区表中新增修改列并添加唯一索引
DROP TABLE IF EXISTS t1;
CREATE TABLE t1(c0 INT,
c1 FLOAT ,
c2 DOUBLE,
c3 CHAR(10),
c4 VARCHAR(10),
c5 CHAR(10),
c6 INT,
c7 DATE,
c8 YEAR)
PARTITION BY HASH(c8)
(PARTITION p1,PARTITION p2,PARTITION p3);
INSERT INTO t1 VALUES(1,1.0,1.1,'中文','','',0,'2010-10-11','1989'),
(2,1.1,1.2,'中!文','A','a',1,'2001-01-11','2001'),
(3,1.2,2.2,'中!文','B','a',2,'2016-02-11','2002'),
(4,1.3,3.2,'中!文','C','a',1,'2021-03-11','2003'),
(5,1.4,4.2,'中!文','D','a',2,'2011-11-01','2004'),
(6,1.5,5.2,'中!文','E','a',1,'2014-01-11','2005'),
(7,1.6,6.2,'中!文','F','a',3,'2011-11-01','2006'),
(8,1.7,7.2,'中!文','G','a',1,'2017-01-11','2007'),
(9,1.8,8.2,'中!文','H','a',4,'2013-11-01','2011'),
(10,1.9,9.2,'中!文','I','a',5,'2011-11-11','2013'),
(11,2.0,1.9,'中!文','J','a',6,'2015-01-01','2016'),
(12,2.1,1.8,'中!文','K','a',7,'2012-12-11','2017');
ALTER TABLE t1 MODIFY c8 YEAR DEFAULT '2000' AFTER c6,DROP PARTITION p1;
ERROR 42000: You have an error in your SQL syntax; check the manual that corresponds to your OceanBase version for the right syntax to use near 'PARTITION p1' at line 1
ALTER TABLE t1 MODIFY c8 YEAR DEFAULT '2000' AFTER c6,ADD CONSTRAINT uni_key UNIQUE KEY(c8,c6);
INSERT INTO t1 VALUES(13,2.2,1.7,'中!文','L','a',8,'2017','2018-12-18');
SELECT * FROM t1 ORDER BY 1;
c0	c1	c2	c3	c4	c5	c6	c7	c8
1	1	1.1	中文			0	2010-10-11	1989
2	1.1	1.2	中!文	A	a	1	2001-01-11	2001
3	1.2	2.2	中!文	B	a	2	2016-02-11	2002
4	1.3	3.2	中!文	C	a	1	2021-03-11	2003
5	1.4	4.2	中!文	D	a	2	2011-11-01	2004
6	1.5	5.2	中!文	E	a	1	2014-01-11	2005
7	1.6	6.2	中!文	F	a	3	2011-11-01	2006
8	1.7	7.2	中!文	G	a	1	2017-01-11	2007
9	1.8	8.2	中!文	H	a	4	2013-11-01	2011
10	1.9	9.2	中!文	I	a	5	2011-11-11	2013
11	2	1.9	中!文	J	a	6	2015-01-01	2016
12	2.1	1.8	中!文	K	a	7	2012-12-11	2017
INSERT INTO t1 VALUES(13,2.2,1.7,'中!文','L','a',8,'2017','2018-12-18');
INSERT INTO t1 VALUES(13,2.2,1.7,'中!文','L','a',8,'2017','2018-12-18');
#分区键带有非空约束
DROP TABLE IF EXISTS t1;
CREATE TABLE t1(c0 INT NOT NULL,
c1 FLOAT DEFAULT 0,
c2 DOUBLE,
c3 CHAR(10),
c4 VARCHAR(10),
c5 CHAR(10),
c6 INT,
c7 DATE,
c8 YEAR )
PARTITION BY HASH(c8)
(PARTITION p1,PARTITION p2,PARTITION p3);
INSERT INTO t1 VALUES(1,1.0,1.1,'中文','','',0,'2010-10-11','1989'),
(2,1.1,1.2,'中!文','A','a',1,'2001-01-11','2001'),
(3,1.2,2.2,'中!文','B','a',2,'2016-02-11','2002'),
(4,1.3,3.2,'中!文','C','a',1,'2021-03-11','2003'),
(5,1.4,4.2,'中!文','D','a',2,'2011-11-01','2004'),
(6,1.5,5.2,'中!文','E','a',1,'2014-01-11','2005'),
(7,1.6,6.2,'中!文','F','a',3,'2011-11-01','2006'),
(8,1.7,7.2,'中!文','G','a',1,'2017-01-11','2007'),
(9,1.8,8.2,'中!文','H','a',4,'2013-11-01','2011'),
(10,1.9,9.2,'中!文','I','a',5,'2011-11-11','2013'),
(11,2.0,1.9,'中!文','J','a',6,'2015-01-01','2016'),
(12,2.1,1.8,'中!文','K','a',7,'2012-12-11','2017');
ALTER TABLE t1 CHANGE c8 m8 YEAR NOT NULL AFTER c6;
#修改列且带有自增约束
DROP TABLE IF EXISTS t1;
CREATE TABLE t1(c0 INT ,
c1 FLOAT DEFAULT 0,
c2 DOUBLE,
c3 CHAR(10),
c4 VARCHAR(10),
c5 CHAR(10),
c6 INT,
c7 DATE,
c8 YEAR NOT NULL)
PARTITION BY HASH(c0) PARTITIONS 2;
INSERT INTO t1 VALUES(1,1.0,1.1,'中文','','',0,'2010-10-11','1989'),
(2,1.1,1.2,'中!文','A','a',1,'2001-01-11','2001'),
(3,1.2,2.2,'中!文','B','a',2,'2016-02-11','2002'),
(4,1.3,3.2,'中!文','C','a',1,'2021-03-11','2003'),
(5,1.4,4.2,'中!文','D','a',2,'2011-11-01','2004'),
(6,1.5,5.2,'中!文','E','a',1,'2014-01-11','2005'),
(7,1.6,6.2,'中!文','F','a',3,'2011-11-01','2006'),
(8,1.7,7.2,'中!文','G','a',1,'2017-01-11','2007'),
(9,1.8,8.2,'中!文','H','a',4,'2013-11-01','2011'),
(10,1.9,9.2,'中!文','I','a',5,'2011-11-11','2013'),
(11,2.0,1.9,'中!文','J','a',6,'2015-01-01','2016'),
(12,2.1,1.8,'中!文','K','a',7,'2012-12-11','2017');
ALTER TABLE t1 CHANGE c0 c0 INT(4) AUTO_INCREMENT AFTER c2,DROP c1,MODIFY c8 YEAR DEFAULT '2000' AFTER c6;
INSERT INTO t1(c2,c3,c4,c5,c6,c7) VALUES(1.7,'中!文','L','a',8,'2013-12-13');
SELECT * FROM t1 ORDER BY 2;
c2	c0	c3	c4	c5	c6	c8	c7
1.1	1	中文			0	1989	2010-10-11
1.2	2	中!文	A	a	1	2001	2001-01-11
2.2	3	中!文	B	a	2	2002	2016-02-11
3.2	4	中!文	C	a	1	2003	2021-03-11
4.2	5	中!文	D	a	2	2004	2011-11-01
5.2	6	中!文	E	a	1	2005	2014-01-11
6.2	7	中!文	F	a	3	2006	2011-11-01
7.2	8	中!文	G	a	1	2007	2017-01-11
8.2	9	中!文	H	a	4	2011	2013-11-01
9.2	10	中!文	I	a	5	2013	2011-11-11
1.9	11	中!文	J	a	6	2016	2015-01-01
1.8	12	中!文	K	a	7	2017	2012-12-11
1.7	13	中!文	L	a	8	2000	2013-12-13
ALTER TABLE t1 CHANGE c0 m0 INT(4);
INSERT INTO t1(c2,c3,c4,c5,c6,c7) VALUES(1.6,'中0文','M','b',9,'2019-12-19');
SELECT * FROM t1 ORDER BY 2;
c2	m0	c3	c4	c5	c6	c8	c7
1.6	NULL	中0文	M	b	9	2000	2019-12-19
1.1	1	中文			0	1989	2010-10-11
1.2	2	中!文	A	a	1	2001	2001-01-11
2.2	3	中!文	B	a	2	2002	2016-02-11
3.2	4	中!文	C	a	1	2003	2021-03-11
4.2	5	中!文	D	a	2	2004	2011-11-01
5.2	6	中!文	E	a	1	2005	2014-01-11
6.2	7	中!文	F	a	3	2006	2011-11-01
7.2	8	中!文	G	a	1	2007	2017-01-11
8.2	9	中!文	H	a	4	2011	2013-11-01
9.2	10	中!文	I	a	5	2013	2011-11-11
1.9	11	中!文	J	a	6	2016	2015-01-01
1.8	12	中!文	K	a	7	2017	2012-12-11
1.7	13	中!文	L	a	8	2000	2013-12-13
#修改列为生成列
#STORED/VIRTUAL类型生成列,分区键为生成列的引用列
DROP TABLE IF EXISTS t1;
CREATE TABLE t1(c0 INT ,
c1 FLOAT ,
c2 DOUBLE,
c3 CHAR(10),
c4 VARCHAR(10),
c5 CHAR(10),
c6 INT,
c7 TIME,
c8 YEAR GENERATED ALWAYS AS (c6*2) STORED COMMENT '数值生成列')
PARTITION BY HASH(c8) PARTITIONS 4;
INSERT INTO t1(c0,c1,c2,c3,c4,c5,c6,c7) VALUES(1,1.0,1.1,'中文','','',1000,'11:11:11'),
(2,1.1,1.2,'中!文','A','a',1001,'11:11:11'),
(3,1.2,2.2,'中@文','B','a',1002,'11:11:11'),
(4,1.3,3.2,'中_文','C','a',1003,'11:11:11'),
(5,1.4,4.2,'中$文','D','a',1004,'11:11:11'),
(6,1.5,5.2,'中%文','E','a',1005,'11:11:11'),
(7,1.6,6.2,'中^文','F','a',1006,'11:11:11'),
(8,1.7,7.2,'中&文','G','a',1000,'11:11:11'),
(9,1.8,8.2,'中*文','H','a',1001,'11:11:11'),
(10,1.9,9.2,'中-文','I','a',1002,'11:11:11'),
(11,2.0,1.9,'中=文','J','a',1003,'11:11:11'),
(12,2.1,1.8,'中+文','K','a',1004,'11:11:11');
#新增列为其他新增列的引用列
DROP TABLE IF EXISTS t1;
CREATE TABLE t1(c0 INT ,
c1 FLOAT ,
c2 DOUBLE,
c3 CHAR(10),
c4 VARCHAR(10),
c5 CHAR(10),
c6 INT,
c7 TIME,
c8 YEAR)
PARTITION BY HASH(c6)
(PARTITION p1,PARTITION p2,PARTITION p3,PARTITION p4);
INSERT INTO t1 VALUES(1,1.0,1.1,'中文','','',0,'10:10:11','1989'),
(2,1.1,1.2,'中!文','A','a',1,'01:01:11','2001'),
(3,1.2,2.2,'中!文','B','a',2,'16:02:11','2002'),
(4,1.3,3.2,'中!文','C','a',1,'21:03:11','2003'),
(5,1.4,4.2,'中!文','D','a',2,'11:11:01','2004'),
(6,1.5,5.2,'中!文','E','a',1,'14:01:11','2005'),
(7,1.6,6.2,'中!文','F','a',3,'11:11:01','2006'),
(8,1.7,7.2,'中!文','G','a',1,'17:01:11','2007'),
(9,1.8,8.2,'中!文','H','a',4,'13:11:01','2011'),
(10,1.9,9.2,'中!文','I','a',5,'11:11:11','2013'),
(11,2.0,1.9,'中!文','J','a',6,'15:01:01','2016'),
(12,2.1,1.8,'中!文','K','a',7,'12:12:11','2017');
#######################PARTITION BY KEY#########################
#普通KEY分区表
DROP TABLE IF EXISTS t1;
CREATE TABLE t1(c0 INT,
c1 FLOAT ,
c2 DOUBLE,
c3 CHAR(10),
c4 VARCHAR(10),
c5 CHAR(10),
c6 INT,
c7 DATE,
c8 YEAR)
PARTITION BY KEY(c8) PARTITIONS 3;
INSERT INTO t1 VALUES(1,1.0,1.1,'中文','','',0,'2010-10-11','1989'),
(2,1.1,1.2,'中!文','A','a',1,'2001-01-11','2001'),
(3,1.2,2.2,'中!文','B','a',2,'2016-02-11','2002'),
(4,1.3,3.2,'中!文','C','a',1,'2021-03-11','2003'),
(5,1.4,4.2,'中!文','D','a',2,'2011-11-01','2004'),
(6,1.5,5.2,'中!文','E','a',1,'2014-01-11','2005'),
(7,1.6,6.2,'中!文','F','a',3,'2011-11-01','2006'),
(8,1.7,7.2,'中!文','G','a',1,'2017-01-11','2007'),
(9,1.8,8.2,'中!文','H','a',4,'2013-11-01','2011'),
(10,1.9,9.2,'中!文','I','a',5,'2011-11-11','2013'),
(11,2.0,1.9,'中!文','J','a',6,'2015-01-01','2016'),
(12,2.1,1.8,'中!文','K','a',7,'2012-12-11','2016');
ALTER TABLE t1 CHANGE c8 c8 DATE DEFAULT '2000-01-01' AFTER c5;
ALTER TABLE t1 CHANGE c8 m8 YEAR DEFAULT '2000';
ALTER TABLE t1 MODIFY m8 DATE DEFAULT '2000-01-01' AFTER c7;
ALTER TABLE t1 MODIFY m8 YEAR NOT NULL UNIQUE AFTER c7;
UPDATE t1 SET m8='2014' WHERE c0=11;
ALTER TABLE t1 MODIFY m8 YEAR NOT NULL UNIQUE AFTER c7;
INSERT INTO t1 VALUES(14,2.3,1.6,'中9文','M','b',8,'2013-12-13','2018');
SELECT * FROM t1 ORDER BY 1;
c0	c1	c2	c3	c4	c5	c6	c7	m8
1	1	1.1	中文			0	2010-10-11	1989
2	1.1	1.2	中!文	A	a	1	2001-01-11	2001
3	1.2	2.2	中!文	B	a	2	2016-02-11	2002
4	1.3	3.2	中!文	C	a	1	2021-03-11	2003
5	1.4	4.2	中!文	D	a	2	2011-11-01	2004
6	1.5	5.2	中!文	E	a	1	2014-01-11	2005
7	1.6	6.2	中!文	F	a	3	2011-11-01	2006
8	1.7	7.2	中!文	G	a	1	2017-01-11	2007
9	1.8	8.2	中!文	H	a	4	2013-11-01	2011
10	1.9	9.2	中!文	I	a	5	2011-11-11	2013
11	2	1.9	中!文	J	a	6	2015-01-01	2014
12	2.1	1.8	中!文	K	a	7	2012-12-11	2016
14	2.3	1.6	中9文	M	b	8	2013-12-13	2018
#修改列与其他操作混用情景
ALTER TABLE t1 CHANGE m8 m8 YEAR AFTER m7,ADD INDEX ind_1(m8);
ALTER TABLE t1 CHANGE m8 m8 YEAR AFTER c6,ADD PARTITION(PARTITION BY HASH(c8) PARTITIONS 4);
#修改分区键并添加普通索引和联合索引
DROP TABLE IF EXISTS t1;
CREATE TABLE t1(c0 INT,
c1 FLOAT ,
c2 DOUBLE,
c3 CHAR(10),
c4 VARCHAR(10),
c5 CHAR(10),
c6 INT,
c7 DATE,
c8 YEAR)
PARTITION BY KEY(c8) PARTITIONS 3;
INSERT INTO t1 VALUES(1,1.0,1.1,'中文','','',0,'2010-10-11','1989'),
(2,1.1,1.2,'中!文','A','a',1,'2001-01-11','2001'),
(3,1.2,2.2,'中!文','B','a',2,'2016-02-11','2002'),
(4,1.3,3.2,'中!文','C','a',1,'2021-03-11','2003'),
(5,1.4,4.2,'中!文','D','a',2,'2011-11-01','2004'),
(6,1.5,5.2,'中!文','E','a',1,'2014-01-11','2005'),
(7,1.6,6.2,'中!文','F','a',3,'2011-11-01','2006'),
(8,1.7,7.2,'中!文','G','a',1,'2017-01-11','2007'),
(9,1.8,8.2,'中!文','H','a',4,'2013-11-01','2011'),
(10,1.9,9.2,'中!文','I','a',5,'2011-11-11','2013'),
(11,2.0,1.9,'中!文','J','a',6,'2015-01-01','2016'),
(12,2.1,1.8,'中!文','K','a',7,'2012-12-11','2016');
CREATE INDEX ind_1 ON t1(c7);
CREATE INDEX ind_2 ON t1(c1,c8);
ALTER TABLE t1 CHANGE c8 c8 YEAR DEFAULT '2000' AFTER c6;
SELECT /*+INDEX(ind_2) */ * FROM t1 WHERE c1<2 AND c8>2005 ORDER BY 1;
c0	c1	c2	c3	c4	c5	c6	c8	c7
7	1.6	6.2	中!文	F	a	3	2006	2011-11-01
8	1.7	7.2	中!文	G	a	1	2007	2017-01-11
9	1.8	8.2	中!文	H	a	4	2011	2013-11-01
10	1.9	9.2	中!文	I	a	5	2013	2011-11-11
ALTER TABLE t1 CHANGE c8 m8 DATE,DROP PARTITION p0;
ERROR 42000: You have an error in your SQL syntax; check the manual that corresponds to your OceanBase version for the right syntax to use near 'PARTITION p0' at line 1
ALTER TABLE t1 CHANGE c8 m8 DATE DEFAULT '2000-01-01';
ALTER TABLE t1 MODIFY c8 DATE DEFAULT '2000-01-01';
ALTER TABLE t1 CHANGE c8 m8 YEAR;
SELECT /*+INDEX(ind_2) */ * FROM t1 WHERE c1<2 AND m8>2005 ORDER BY 1;
c0	c1	c2	c3	c4	c5	c6	m8	c7
7	1.6	6.2	中!文	F	a	3	2006	2011-11-01
8	1.7	7.2	中!文	G	a	1	2007	2017-01-11
9	1.8	8.2	中!文	H	a	4	2011	2013-11-01
10	1.9	9.2	中!文	I	a	5	2013	2011-11-11
INSERT INTO t1 VALUES(13,2.2,1.7,'中=文','L','c',9,'2017','2012-12-17');
DELETE FROM t1 WHERE m8=2002;
SELECT * FROM t1 ORDER BY 1;
c0	c1	c2	c3	c4	c5	c6	m8	c7
1	1	1.1	中文			0	1989	2010-10-11
2	1.1	1.2	中!文	A	a	1	2001	2001-01-11
4	1.3	3.2	中!文	C	a	1	2003	2021-03-11
5	1.4	4.2	中!文	D	a	2	2004	2011-11-01
6	1.5	5.2	中!文	E	a	1	2005	2014-01-11
7	1.6	6.2	中!文	F	a	3	2006	2011-11-01
8	1.7	7.2	中!文	G	a	1	2007	2017-01-11
9	1.8	8.2	中!文	H	a	4	2011	2013-11-01
10	1.9	9.2	中!文	I	a	5	2013	2011-11-11
11	2	1.9	中!文	J	a	6	2016	2015-01-01
12	2.1	1.8	中!文	K	a	7	2016	2012-12-11
13	2.2	1.7	中=文	L	c	9	2017	2012-12-17
alter system set _enable_drop_and_add_index = true;
ALTER TABLE t1 DROP INDEX ind_2,MODIFY m8 YEAR DEFAULT '2000',ADD INDEX ind2(m8);
alter system set _enable_drop_and_add_index = false;
SELECT /*+INDEX(ind2) */ * FROM t1 WHERE m8=2005;
c0	c1	c2	c3	c4	c5	c6	m8	c7
6	1.5	5.2	中!文	E	a	1	2005	2014-01-11
ALTER TABLE t1 MODIFY m8 YEAR AFTER c7,ADD c9 INT(4) ZEROFILL DEFAULT 0 AFTER c6,DROP c5;
INSERT INTO t1 VALUES(14,2.3,1.6,'中-文','M',10,1,'2012-02-18','2018');
SELECT /*+INDEX(ind2) */ * FROM t1 WHERE m8=2018;
c0	c1	c2	c3	c4	c6	c9	c7	m8
14	2.3	1.6	中-文	M	10	0001	2012-02-18	2018
#在分区表创建分区索引，然后修改索引列
DROP TABLE IF EXISTS t1;
CREATE TABLE t1(c0 INT,
c1 FLOAT ,
c2 DOUBLE,
c3 CHAR(10),
c4 VARCHAR(10),
c5 CHAR(10),
c6 INT,
c7 DATE,
c8 YEAR)
PARTITION BY KEY(c8) PARTITIONS 3;
INSERT INTO t1 VALUES(1,1.0,1.1,'中文','','',0,'2010-10-11','1989'),
(2,1.1,1.2,'中!文','A','a',1,'2001-01-11','2001'),
(3,1.2,2.2,'中!文','B','a',2,'2016-02-11','2002'),
(4,1.3,3.2,'中!文','C','a',1,'2021-03-11','2003'),
(5,1.4,4.2,'中!文','D','a',2,'2011-11-01','2004'),
(6,1.5,5.2,'中!文','E','a',1,'2014-01-11','2005'),
(7,1.6,6.2,'中!文','F','a',3,'2011-11-01','2006'),
(8,1.7,7.2,'中!文','G','a',1,'2017-01-11','2007'),
(9,1.8,8.2,'中!文','H','a',4,'2013-11-01','2011'),
(10,1.9,9.2,'中!文','I','a',5,'2011-11-11','2013'),
(11,2.0,1.9,'中!文','J','a',6,'2015-01-01','2016'),
(12,2.1,1.8,'中!文','K','a',7,'2012-12-11','2016');
ALTER TABLE t1 CHANGE c8 c8 YEAR DEFAULT '2000' FIRST;
#使用新增列创建全局分区索引
CREATE INDEX ind_g ON t1(c8,c6) GLOBAL
PARTITION BY RANGE(c6)
(PARTITION p1 VALUES LESS THAN(4),
PARTITION p2 VALUES LESS THAN(8),
PARTITION p3 VALUES LESS THAN(10),
PARTITION p4 VALUES LESS THAN(MAXVALUE)
);
CREATE INDEX ind_g ON t1(c8,c6) GLOBAL
PARTITION BY RANGE(c8)
(PARTITION p1 VALUES LESS THAN(4),
PARTITION p2 VALUES LESS THAN(8),
PARTITION p3 VALUES LESS THAN(10),
PARTITION p4 VALUES LESS THAN(MAXVALUE)
);
INSERT INTO t1 VALUES('2017',13,2.2,1.7,'中!文','L','b',8,'2018-10-08');
SELECT /*+INDEX(ind_g) */ * FROM t1 WHERE c8>2010 AND c6<6 ORDER BY 1;
c8	c0	c1	c2	c3	c4	c5	c6	c7
2011	9	1.8	8.2	中!文	H	a	4	2013-11-01
2013	10	1.9	9.2	中!文	I	a	5	2011-11-11
#在分区表中新增修改列并添加唯一索引
DROP TABLE IF EXISTS t1;
CREATE TABLE t1(c0 INT,
c1 FLOAT ,
c2 DOUBLE,
c3 CHAR(10),
c4 VARCHAR(10),
c5 CHAR(10),
c6 INT,
c7 DATE,
c8 YEAR)
PARTITION BY KEY(c8)
(PARTITION p1,PARTITION p2,PARTITION p3);
INSERT INTO t1 VALUES(1,1.0,1.1,'中文','','',0,'2010-10-11','1989'),
(2,1.1,1.2,'中!文','A','a',1,'2001-01-11','2001'),
(3,1.2,2.2,'中!文','B','a',2,'2016-02-11','2002'),
(4,1.3,3.2,'中!文','C','a',1,'2021-03-11','2003'),
(5,1.4,4.2,'中!文','D','a',2,'2011-11-01','2004'),
(6,1.5,5.2,'中!文','E','a',1,'2014-01-11','2005'),
(7,1.6,6.2,'中!文','F','a',3,'2011-11-01','2006'),
(8,1.7,7.2,'中!文','G','a',1,'2017-01-11','2007'),
(9,1.8,8.2,'中!文','H','a',4,'2013-11-01','2011'),
(10,1.9,9.2,'中!文','I','a',5,'2011-11-11','2013'),
(11,2.0,1.9,'中!文','J','a',6,'2015-01-01','2016'),
(12,2.1,1.8,'中!文','K','a',7,'2012-12-11','2017');
ALTER TABLE t1 MODIFY c8 YEAR DEFAULT '2000' AFTER c6,DROP PARTITION p1;
ERROR 42000: You have an error in your SQL syntax; check the manual that corresponds to your OceanBase version for the right syntax to use near 'PARTITION p1' at line 1
ALTER TABLE t1 MODIFY c8 YEAR DEFAULT '2000' AFTER c6,ADD CONSTRAINT uni_key UNIQUE KEY(c8,c6);
INSERT INTO t1 VALUES(13,2.2,1.7,'中!文','L','a',8,'2017','2018-12-18');
SELECT * FROM t1 ORDER BY 1;
c0	c1	c2	c3	c4	c5	c6	c7	c8
1	1	1.1	中文			0	2010-10-11	1989
2	1.1	1.2	中!文	A	a	1	2001-01-11	2001
3	1.2	2.2	中!文	B	a	2	2016-02-11	2002
4	1.3	3.2	中!文	C	a	1	2021-03-11	2003
5	1.4	4.2	中!文	D	a	2	2011-11-01	2004
6	1.5	5.2	中!文	E	a	1	2014-01-11	2005
7	1.6	6.2	中!文	F	a	3	2011-11-01	2006
8	1.7	7.2	中!文	G	a	1	2017-01-11	2007
9	1.8	8.2	中!文	H	a	4	2013-11-01	2011
10	1.9	9.2	中!文	I	a	5	2011-11-11	2013
11	2	1.9	中!文	J	a	6	2015-01-01	2016
12	2.1	1.8	中!文	K	a	7	2012-12-11	2017
INSERT INTO t1 VALUES(13,2.2,1.7,'中!文','L','a',8,'2017','2018-12-18');
INSERT INTO t1 VALUES(13,2.2,1.7,'中!文','L','a',8,'2017','2018-12-18');
#分区键带有外键约束(暂不支持)
#分区键带有非空约束
DROP TABLE IF EXISTS t1;
CREATE TABLE t1(c0 INT NOT NULL,
c1 FLOAT DEFAULT 0,
c2 DOUBLE,
c3 CHAR(10),
c4 VARCHAR(10),
c5 CHAR(10),
c6 INT,
c7 DATE,
c8 YEAR )
PARTITION BY KEY(c8)
(PARTITION p1,PARTITION p2,PARTITION p3);
INSERT INTO t1 VALUES(1,1.0,1.1,'中文','','',0,'2010-10-11','1989'),
(2,1.1,1.2,'中!文','A','a',1,'2001-01-11','2001'),
(3,1.2,2.2,'中!文','B','a',2,'2016-02-11','2002'),
(4,1.3,3.2,'中!文','C','a',1,'2021-03-11','2003'),
(5,1.4,4.2,'中!文','D','a',2,'2011-11-01','2004'),
(6,1.5,5.2,'中!文','E','a',1,'2014-01-11','2005'),
(7,1.6,6.2,'中!文','F','a',3,'2011-11-01','2006'),
(8,1.7,7.2,'中!文','G','a',1,'2017-01-11','2007'),
(9,1.8,8.2,'中!文','H','a',4,'2013-11-01','2011'),
(10,1.9,9.2,'中!文','I','a',5,'2011-11-11','2013'),
(11,2.0,1.9,'中!文','J','a',6,'2015-01-01','2016'),
(12,2.1,1.8,'中!文','K','a',7,'2012-12-11','2017');
ALTER TABLE t1 CHANGE c8 m8 YEAR NOT NULL AFTER c6;
#修改列且带有自增约束
DROP TABLE IF EXISTS t1;
CREATE TABLE t1(c0 INT ,
c1 FLOAT DEFAULT 0,
c2 DOUBLE,
c3 CHAR(10),
c4 VARCHAR(10),
c5 CHAR(10),
c6 INT,
c7 DATE,
c8 YEAR NOT NULL)
PARTITION BY KEY(c0) PARTITIONS 2;
INSERT INTO t1 VALUES(1,1.0,1.1,'中文','','',0,'2010-10-11','1989'),
(2,1.1,1.2,'中!文','A','a',1,'2001-01-11','2001'),
(3,1.2,2.2,'中!文','B','a',2,'2016-02-11','2002'),
(4,1.3,3.2,'中!文','C','a',1,'2021-03-11','2003'),
(5,1.4,4.2,'中!文','D','a',2,'2011-11-01','2004'),
(6,1.5,5.2,'中!文','E','a',1,'2014-01-11','2005'),
(7,1.6,6.2,'中!文','F','a',3,'2011-11-01','2006'),
(8,1.7,7.2,'中!文','G','a',1,'2017-01-11','2007'),
(9,1.8,8.2,'中!文','H','a',4,'2013-11-01','2011'),
(10,1.9,9.2,'中!文','I','a',5,'2011-11-11','2013'),
(11,2.0,1.9,'中!文','J','a',6,'2015-01-01','2016'),
(12,2.1,1.8,'中!文','K','a',7,'2012-12-11','2017');
ALTER TABLE t1 CHANGE c0 c0 INT(4) AUTO_INCREMENT AFTER c2,DROP c1,MODIFY c8 YEAR DEFAULT '2000' AFTER c6;
INSERT INTO t1(c2,c3,c4,c5,c6,c7) VALUES(1.7,'中!文','L','a',8,'2013-12-13');
SELECT * FROM t1 ORDER BY 2;
c2	c0	c3	c4	c5	c6	c8	c7
1.1	1	中文			0	1989	2010-10-11
1.2	2	中!文	A	a	1	2001	2001-01-11
2.2	3	中!文	B	a	2	2002	2016-02-11
3.2	4	中!文	C	a	1	2003	2021-03-11
4.2	5	中!文	D	a	2	2004	2011-11-01
5.2	6	中!文	E	a	1	2005	2014-01-11
6.2	7	中!文	F	a	3	2006	2011-11-01
7.2	8	中!文	G	a	1	2007	2017-01-11
8.2	9	中!文	H	a	4	2011	2013-11-01
9.2	10	中!文	I	a	5	2013	2011-11-11
1.9	11	中!文	J	a	6	2016	2015-01-01
1.8	12	中!文	K	a	7	2017	2012-12-11
1.7	13	中!文	L	a	8	2000	2013-12-13
ALTER TABLE t1 CHANGE c0 m0 INT(4);
INSERT INTO t1(c2,c3,c4,c5,c6,c7) VALUES(1.6,'中0文','M','b',9,'2019-12-19');
SELECT * FROM t1 ORDER BY 2;
c2	m0	c3	c4	c5	c6	c8	c7
1.6	NULL	中0文	M	b	9	2000	2019-12-19
1.1	1	中文			0	1989	2010-10-11
1.2	2	中!文	A	a	1	2001	2001-01-11
2.2	3	中!文	B	a	2	2002	2016-02-11
3.2	4	中!文	C	a	1	2003	2021-03-11
4.2	5	中!文	D	a	2	2004	2011-11-01
5.2	6	中!文	E	a	1	2005	2014-01-11
6.2	7	中!文	F	a	3	2006	2011-11-01
7.2	8	中!文	G	a	1	2007	2017-01-11
8.2	9	中!文	H	a	4	2011	2013-11-01
9.2	10	中!文	I	a	5	2013	2011-11-11
1.9	11	中!文	J	a	6	2016	2015-01-01
1.8	12	中!文	K	a	7	2017	2012-12-11
1.7	13	中!文	L	a	8	2000	2013-12-13
#修改列为生成列
#STORED/VIRTUAL类型生成列,分区键为生成列的引用列
DROP TABLE IF EXISTS t1;
CREATE TABLE t1(c0 INT ,
c1 FLOAT ,
c2 DOUBLE,
c3 CHAR(10),
c4 VARCHAR(10),
c5 CHAR(10),
c6 INT,
c7 TIME,
c8 YEAR GENERATED ALWAYS AS (c6*2) STORED COMMENT '数值生成列')
PARTITION BY KEY(c8) PARTITIONS 4;
INSERT INTO t1(c0,c1,c2,c3,c4,c5,c6,c7) VALUES(1,1.0,1.1,'中文','','',1000,'11:11:11'),
(2,1.1,1.2,'中!文','A','a',1001,'11:11:11'),
(3,1.2,2.2,'中@文','B','a',1002,'11:11:11'),
(4,1.3,3.2,'中_文','C','a',1003,'11:11:11'),
(5,1.4,4.2,'中$文','D','a',1004,'11:11:11'),
(6,1.5,5.2,'中%文','E','a',1005,'11:11:11'),
(7,1.6,6.2,'中^文','F','a',1006,'11:11:11'),
(8,1.7,7.2,'中&文','G','a',1000,'11:11:11'),
(9,1.8,8.2,'中*文','H','a',1001,'11:11:11'),
(10,1.9,9.2,'中-文','I','a',1002,'11:11:11'),
(11,2.0,1.9,'中=文','J','a',1003,'11:11:11'),
(12,2.1,1.8,'中+文','K','a',1004,'11:11:11');
#新增列为其他新增列的引用列
DROP TABLE IF EXISTS t1;
CREATE TABLE t1(c0 INT ,
c1 FLOAT ,
c2 DOUBLE,
c3 CHAR(10),
c4 VARCHAR(10),
c5 CHAR(10),
c6 INT ,
c7 TIME,
c8 YEAR)
PARTITION BY KEY(c6)
(PARTITION p1,PARTITION p2,PARTITION p3,PARTITION p4);
INSERT INTO t1 VALUES(1,1.0,1.1,'中文','','',0,'10:10:11','1989'),
(2,1.1,1.2,'中!文','A','a',1,'01:01:11','2001'),
(3,1.2,2.2,'中!文','B','a',2,'16:02:11','2002'),
(4,1.3,3.2,'中!文','C','a',1,'21:03:11','2003'),
(5,1.4,4.2,'中!文','D','a',2,'11:11:01','2004'),
(6,1.5,5.2,'中!文','E','a',1,'14:01:11','2005'),
(7,1.6,6.2,'中!文','F','a',3,'11:11:01','2006'),
(8,1.7,7.2,'中!文','G','a',1,'17:01:11','2007'),
(9,1.8,8.2,'中!文','H','a',4,'13:11:01','2011'),
(10,1.9,9.2,'中!文','I','a',5,'11:11:11','2013'),
(11,2.0,1.9,'中!文','J','a',6,'15:01:01','2016'),
(12,2.1,1.8,'中!文','K','a',7,'12:12:11','2017');
DROP VIEW IF EXISTS v1;
DROP TABLE IF EXISTS t2;
DROP TABLE IF EXISTS t1;
#########Empty recycle bin, delete test database, tables, etc##########
purge recyclebin;
