purge recyclebin;
DROP TABLE IF EXISTS t2;
DROP TABLE IF EXISTS t1;
#无/有外键约束时，修改列后执行DML操作
CREATE TABLE t1(c0 INT(4) PRIMARY KEY,
c1 FLOAT UNIQUE,
c2 DOUBLE,
c3 CHAR(10),
c4 CHAR(10),
c5 INT,
c6 TIME);
INSERT INTO t1 VALUES(1,1.0,1.1,'中文','',0,'11:11:11'),
(2,1.1,1.2,'中!文','a',1,'11:11:11'),
(3,1.2,2.2,'中!文','a',1,'11:11:11'),
(4,1.3,3.2,'中!文','a',1,'11:11:11'),
(5,1.4,4.2,'中!文','a',1,'11:11:11');
#外键带有ON UPDATE引用行为
#ON UPDATE CASCADE
CREATE TABLE t2(c0 INT(4),
c1 FLOAT UNIQUE,
c2 DOUBLE,
c3 CHAR(10),
c4 CHAR(10),
c5 INT,
c6 TIME);
INSERT INTO t2 VALUES(1,1.0,1.1,'中文','',0,'11:11:11'),
(2,1.1,1.2,'中!文','a',1,'11:11:11'),
(3,1.2,2.2,'中!文','a',1,'11:11:11'),
(4,1.3,3.2,'中!文','a',1,'11:11:11'),
(5,1.4,4.2,'中!文','a',1,'11:11:11');
ALTER TABLE t2 CHANGE c0 c0 INT(4) ZEROFILL AFTER c1,ADD CONSTRAINT fk_c0_c0 FOREIGN KEY(c0) REFERENCES t1(c0) ON UPDATE CASCADE;
ALTER TABLE t2 CHANGE c0 c0 INT AFTER c1,ADD CONSTRAINT fk_c0_c0 FOREIGN KEY(c0) REFERENCES t1(c0) ON UPDATE CASCADE;
ALTER TABLE t1 CHANGE c0 m0 INT(4) ZEROFILL;
ALTER TABLE t1 CHANGE c0 m0 INT(4);
INSERT INTO t1 VALUES(6,1.5,5.2,'中!文','b',2,'12:12:12');
SELECT * FROM t1 ORDER BY 1;
m0	c1	c2	c3	c4	c5	c6
0001	1	1.1	中文		0	11:11:11
0002	1.1	1.2	中!文	a	1	11:11:11
0003	1.2	2.2	中!文	a	1	11:11:11
0004	1.3	3.2	中!文	a	1	11:11:11
0005	1.4	4.2	中!文	a	1	11:11:11
0006	1.5	5.2	中!文	b	2	12:12:12
SELECT * FROM t2 ORDER BY 1;
c0	c1	c2	c3	c4	c5	c6
1	1	1.1	中文		0	11:11:11
2	1.1	1.2	中!文	a	1	11:11:11
3	1.2	2.2	中!文	a	1	11:11:11
4	1.3	3.2	中!文	a	1	11:11:11
5	1.4	4.2	中!文	a	1	11:11:11
UPDATE t1 SET m0=10 WHERE c5=0;
SELECT * FROM t1 ORDER BY 1;
m0	c1	c2	c3	c4	c5	c6
0002	1.1	1.2	中!文	a	1	11:11:11
0003	1.2	2.2	中!文	a	1	11:11:11
0004	1.3	3.2	中!文	a	1	11:11:11
0005	1.4	4.2	中!文	a	1	11:11:11
0006	1.5	5.2	中!文	b	2	12:12:12
0010	1	1.1	中文		0	11:11:11
SELECT * FROM t2 ORDER BY 1;
c0	c1	c2	c3	c4	c5	c6
1	1	1.1	中文		0	11:11:11
2	1.1	1.2	中!文	a	1	11:11:11
3	1.2	2.2	中!文	a	1	11:11:11
4	1.3	3.2	中!文	a	1	11:11:11
5	1.4	4.2	中!文	a	1	11:11:11
DELETE FROM t1 WHERE m0=10;
SELECT * FROM t1 ORDER BY 1;
m0	c1	c2	c3	c4	c5	c6
0002	1.1	1.2	中!文	a	1	11:11:11
0003	1.2	2.2	中!文	a	1	11:11:11
0004	1.3	3.2	中!文	a	1	11:11:11
0005	1.4	4.2	中!文	a	1	11:11:11
0006	1.5	5.2	中!文	b	2	12:12:12
SELECT * FROM t2 ORDER BY 1;
c0	c1	c2	c3	c4	c5	c6
1	1	1.1	中文		0	11:11:11
2	1.1	1.2	中!文	a	1	11:11:11
3	1.2	2.2	中!文	a	1	11:11:11
4	1.3	3.2	中!文	a	1	11:11:11
5	1.4	4.2	中!文	a	1	11:11:11
UPDATE t2 SET c0=11 WHERE c5=0;
SELECT * FROM t1 ORDER BY 1;
m0	c1	c2	c3	c4	c5	c6
0002	1.1	1.2	中!文	a	1	11:11:11
0003	1.2	2.2	中!文	a	1	11:11:11
0004	1.3	3.2	中!文	a	1	11:11:11
0005	1.4	4.2	中!文	a	1	11:11:11
0006	1.5	5.2	中!文	b	2	12:12:12
SELECT * FROM t2 ORDER BY 1;
c0	c1	c2	c3	c4	c5	c6
2	1.1	1.2	中!文	a	1	11:11:11
3	1.2	2.2	中!文	a	1	11:11:11
4	1.3	3.2	中!文	a	1	11:11:11
5	1.4	4.2	中!文	a	1	11:11:11
11	1	1.1	中文		0	11:11:11
DELETE FROM t2 WHERE c0=10;
SELECT * FROM t1 ORDER BY 1;
m0	c1	c2	c3	c4	c5	c6
0002	1.1	1.2	中!文	a	1	11:11:11
0003	1.2	2.2	中!文	a	1	11:11:11
0004	1.3	3.2	中!文	a	1	11:11:11
0005	1.4	4.2	中!文	a	1	11:11:11
0006	1.5	5.2	中!文	b	2	12:12:12
SELECT * FROM t2 ORDER BY 1;
c0	c1	c2	c3	c4	c5	c6
2	1.1	1.2	中!文	a	1	11:11:11
3	1.2	2.2	中!文	a	1	11:11:11
4	1.3	3.2	中!文	a	1	11:11:11
5	1.4	4.2	中!文	a	1	11:11:11
11	1	1.1	中文		0	11:11:11
INSERT INTO t2 VALUES(1.6,6,6.2,'中!文','c',3,'13:13:13');
SELECT * FROM t1 ORDER BY 1;
m0	c1	c2	c3	c4	c5	c6
0002	1.1	1.2	中!文	a	1	11:11:11
0003	1.2	2.2	中!文	a	1	11:11:11
0004	1.3	3.2	中!文	a	1	11:11:11
0005	1.4	4.2	中!文	a	1	11:11:11
0006	1.5	5.2	中!文	b	2	12:12:12
SELECT * FROM t2 ORDER BY 1;
c0	c1	c2	c3	c4	c5	c6
2	1.1	1.2	中!文	a	1	11:11:11
2	6	6.2	中!文	c	3	13:13:13
3	1.2	2.2	中!文	a	1	11:11:11
4	1.3	3.2	中!文	a	1	11:11:11
5	1.4	4.2	中!文	a	1	11:11:11
11	1	1.1	中文		0	11:11:11
INSERT INTO t2 VALUES(1.7,7,7.2,'中!文','d',4,'14:14:14');
SELECT * FROM t1 ORDER BY 1;
m0	c1	c2	c3	c4	c5	c6
0002	1.1	1.2	中!文	a	1	11:11:11
0003	1.2	2.2	中!文	a	1	11:11:11
0004	1.3	3.2	中!文	a	1	11:11:11
0005	1.4	4.2	中!文	a	1	11:11:11
0006	1.5	5.2	中!文	b	2	12:12:12
SELECT * FROM t2 ORDER BY 1;
c0	c1	c2	c3	c4	c5	c6
2	1.1	1.2	中!文	a	1	11:11:11
2	6	6.2	中!文	c	3	13:13:13
2	7	7.2	中!文	d	4	14:14:14
3	1.2	2.2	中!文	a	1	11:11:11
4	1.3	3.2	中!文	a	1	11:11:11
5	1.4	4.2	中!文	a	1	11:11:11
11	1	1.1	中文		0	11:11:11
#ON UPDATE RESTRICT
DROP TABLE IF EXISTS t2;
DROP TABLE IF EXISTS t1;
CREATE TABLE t1(c0 INT(4) PRIMARY KEY,
c1 FLOAT UNIQUE,
c2 DOUBLE,
c3 CHAR(10),
c4 CHAR(10),
c5 INT,
c6 TIME);
INSERT INTO t1 VALUES(1,1.0,1.1,'中文','',0,'11:11:11'),
(2,1.1,1.2,'中!文','a',1,'11:11:11'),
(3,1.2,2.2,'中!文','a',1,'11:11:11'),
(4,1.3,3.2,'中!文','a',1,'11:11:11'),
(5,1.4,4.2,'中!文','a',1,'11:11:11');
CREATE TABLE t2(c0 INT(4),
c1 FLOAT UNIQUE,
c2 DOUBLE,
c3 CHAR(10),
c4 CHAR(10),
c5 INT,
c6 TIME
);
INSERT INTO t2 VALUES(1,1.0,1.1,'中文','',0,'11:11:11'),
(2,1.1,1.2,'中!文','a',1,'11:11:11'),
(3,1.2,2.2,'中!文','a',1,'11:11:11'),
(4,1.3,3.2,'中!文','a',1,'11:11:11'),
(5,1.4,4.2,'中!文','a',1,'11:11:11');
ALTER TABLE t2 MODIFY c0 INT(4) ZEROFILL AFTER c1,ADD CONSTRAINT fk_c0_c0 FOREIGN KEY(c0) REFERENCES t1(c0) ON UPDATE RESTRICT;
ALTER TABLE t2 MODIFY c0 INT AFTER c1,ADD CONSTRAINT fk_c0_c0 FOREIGN KEY(c0) REFERENCES t1(c0) ON UPDATE RESTRICT;
ALTER TABLE t1 CHANGE c0 m0 INT(4) ZEROFILL;
ALTER TABLE t1 CHANGE c0 m0 INT(4);
INSERT INTO t1 VALUES(6,1.5,5.2,'中!文','b',2,'12:12:12');
SELECT * FROM t1 ORDER BY 1;
m0	c1	c2	c3	c4	c5	c6
0001	1	1.1	中文		0	11:11:11
0002	1.1	1.2	中!文	a	1	11:11:11
0003	1.2	2.2	中!文	a	1	11:11:11
0004	1.3	3.2	中!文	a	1	11:11:11
0005	1.4	4.2	中!文	a	1	11:11:11
0006	1.5	5.2	中!文	b	2	12:12:12
SELECT * FROM t2 ORDER BY 1;
c0	c1	c2	c3	c4	c5	c6
1	1	1.1	中文		0	11:11:11
2	1.1	1.2	中!文	a	1	11:11:11
3	1.2	2.2	中!文	a	1	11:11:11
4	1.3	3.2	中!文	a	1	11:11:11
5	1.4	4.2	中!文	a	1	11:11:11
UPDATE t1 SET m0=10 WHERE c5=0;
SELECT * FROM t1 ORDER BY 1;
m0	c1	c2	c3	c4	c5	c6
0002	1.1	1.2	中!文	a	1	11:11:11
0003	1.2	2.2	中!文	a	1	11:11:11
0004	1.3	3.2	中!文	a	1	11:11:11
0005	1.4	4.2	中!文	a	1	11:11:11
0006	1.5	5.2	中!文	b	2	12:12:12
0010	1	1.1	中文		0	11:11:11
SELECT * FROM t2 ORDER BY 1;
c0	c1	c2	c3	c4	c5	c6
1	1	1.1	中文		0	11:11:11
2	1.1	1.2	中!文	a	1	11:11:11
3	1.2	2.2	中!文	a	1	11:11:11
4	1.3	3.2	中!文	a	1	11:11:11
5	1.4	4.2	中!文	a	1	11:11:11
DELETE FROM t1 WHERE m0=5;
SELECT * FROM t1 ORDER BY 1;
m0	c1	c2	c3	c4	c5	c6
0002	1.1	1.2	中!文	a	1	11:11:11
0003	1.2	2.2	中!文	a	1	11:11:11
0004	1.3	3.2	中!文	a	1	11:11:11
0006	1.5	5.2	中!文	b	2	12:12:12
0010	1	1.1	中文		0	11:11:11
SELECT * FROM t2 ORDER BY 1;
c0	c1	c2	c3	c4	c5	c6
1	1	1.1	中文		0	11:11:11
2	1.1	1.2	中!文	a	1	11:11:11
3	1.2	2.2	中!文	a	1	11:11:11
4	1.3	3.2	中!文	a	1	11:11:11
5	1.4	4.2	中!文	a	1	11:11:11
UPDATE t2 SET c0=11 WHERE c5=0;
SELECT * FROM t1 ORDER BY 1;
m0	c1	c2	c3	c4	c5	c6
0002	1.1	1.2	中!文	a	1	11:11:11
0003	1.2	2.2	中!文	a	1	11:11:11
0004	1.3	3.2	中!文	a	1	11:11:11
0006	1.5	5.2	中!文	b	2	12:12:12
0010	1	1.1	中文		0	11:11:11
SELECT * FROM t2 ORDER BY 1;
c0	c1	c2	c3	c4	c5	c6
2	1.1	1.2	中!文	a	1	11:11:11
3	1.2	2.2	中!文	a	1	11:11:11
4	1.3	3.2	中!文	a	1	11:11:11
5	1.4	4.2	中!文	a	1	11:11:11
11	1	1.1	中文		0	11:11:11
DELETE FROM t2 WHERE c0=5;
SELECT * FROM t1 ORDER BY 1;
m0	c1	c2	c3	c4	c5	c6
0002	1.1	1.2	中!文	a	1	11:11:11
0003	1.2	2.2	中!文	a	1	11:11:11
0004	1.3	3.2	中!文	a	1	11:11:11
0006	1.5	5.2	中!文	b	2	12:12:12
0010	1	1.1	中文		0	11:11:11
SELECT * FROM t2 ORDER BY 1;
c0	c1	c2	c3	c4	c5	c6
2	1.1	1.2	中!文	a	1	11:11:11
3	1.2	2.2	中!文	a	1	11:11:11
4	1.3	3.2	中!文	a	1	11:11:11
11	1	1.1	中文		0	11:11:11
INSERT INTO t2 VALUES(1.6,6,6.2,'中!文','c',3,'13:13:13');
SELECT * FROM t1 ORDER BY 1;
m0	c1	c2	c3	c4	c5	c6
0002	1.1	1.2	中!文	a	1	11:11:11
0003	1.2	2.2	中!文	a	1	11:11:11
0004	1.3	3.2	中!文	a	1	11:11:11
0006	1.5	5.2	中!文	b	2	12:12:12
0010	1	1.1	中文		0	11:11:11
SELECT * FROM t2 ORDER BY 1;
c0	c1	c2	c3	c4	c5	c6
2	1.1	1.2	中!文	a	1	11:11:11
2	6	6.2	中!文	c	3	13:13:13
3	1.2	2.2	中!文	a	1	11:11:11
4	1.3	3.2	中!文	a	1	11:11:11
11	1	1.1	中文		0	11:11:11
INSERT INTO t2 VALUES(1.7,7,7.2,'中!文','d',4,'14:14:14');
SELECT * FROM t1 ORDER BY 1;
m0	c1	c2	c3	c4	c5	c6
0002	1.1	1.2	中!文	a	1	11:11:11
0003	1.2	2.2	中!文	a	1	11:11:11
0004	1.3	3.2	中!文	a	1	11:11:11
0006	1.5	5.2	中!文	b	2	12:12:12
0010	1	1.1	中文		0	11:11:11
SELECT * FROM t2 ORDER BY 1;
c0	c1	c2	c3	c4	c5	c6
2	1.1	1.2	中!文	a	1	11:11:11
2	6	6.2	中!文	c	3	13:13:13
2	7	7.2	中!文	d	4	14:14:14
3	1.2	2.2	中!文	a	1	11:11:11
4	1.3	3.2	中!文	a	1	11:11:11
11	1	1.1	中文		0	11:11:11
ALTER TABLE t2 CHANGE c0 m0 INT(5);
UPDATE t1 SET m0=10 WHERE c5=0;
UPDATE t2 SET m0=11 WHERE c5=0;
SELECT * FROM t1 ORDER BY 1;
m0	c1	c2	c3	c4	c5	c6
0002	1.1	1.2	中!文	a	1	11:11:11
0003	1.2	2.2	中!文	a	1	11:11:11
0004	1.3	3.2	中!文	a	1	11:11:11
0006	1.5	5.2	中!文	b	2	12:12:12
0010	1	1.1	中文		0	11:11:11
SELECT * FROM t2 ORDER BY 1;
m0	c1	c2	c3	c4	c5	c6
2	1.1	1.2	中!文	a	1	11:11:11
2	6	6.2	中!文	c	3	13:13:13
2	7	7.2	中!文	d	4	14:14:14
3	1.2	2.2	中!文	a	1	11:11:11
4	1.3	3.2	中!文	a	1	11:11:11
11	1	1.1	中文		0	11:11:11
ALTER TABLE t2 CHANGE m0 m0 INT(5) FIRST;
UPDATE t1 SET m0=10 WHERE c5=0;
UPDATE t2 SET m0=11 WHERE c5=0;
SELECT * FROM t1 ORDER BY 1;
m0	c1	c2	c3	c4	c5	c6
0002	1.1	1.2	中!文	a	1	11:11:11
0003	1.2	2.2	中!文	a	1	11:11:11
0004	1.3	3.2	中!文	a	1	11:11:11
0006	1.5	5.2	中!文	b	2	12:12:12
0010	1	1.1	中文		0	11:11:11
SELECT * FROM t2 ORDER BY 1;
m0	c1	c2	c3	c4	c5	c6
2	1.1	1.2	中!文	a	1	11:11:11
2	6	6.2	中!文	c	3	13:13:13
2	7	7.2	中!文	d	4	14:14:14
3	1.2	2.2	中!文	a	1	11:11:11
4	1.3	3.2	中!文	a	1	11:11:11
11	1	1.1	中文		0	11:11:11
ALTER TABLE t1 CHANGE m0 c0 INT;
UPDATE t1 SET c0=10 WHERE c5=0;
SELECT * FROM t1 ORDER BY 1;
c0	c1	c2	c3	c4	c5	c6
2	1.1	1.2	中!文	a	1	11:11:11
3	1.2	2.2	中!文	a	1	11:11:11
4	1.3	3.2	中!文	a	1	11:11:11
6	1.5	5.2	中!文	b	2	12:12:12
10	1	1.1	中文		0	11:11:11
UPDATE t2 SET m0=11 WHERE c5=0;
SELECT * FROM t1 ORDER BY 2;
c0	c1	c2	c3	c4	c5	c6
10	1	1.1	中文		0	11:11:11
2	1.1	1.2	中!文	a	1	11:11:11
3	1.2	2.2	中!文	a	1	11:11:11
4	1.3	3.2	中!文	a	1	11:11:11
6	1.5	5.2	中!文	b	2	12:12:12
ALTER TABLE t1 MODIFY c0 INT(4) ZEROFILL;
ALTER TABLE t1 MODIFY c0 FLOAT;
ALTER TABLE t1 MODIFY c0 INT AFTER c6;
UPDATE t1 SET c0=10 WHERE c5=0;
SELECT * FROM t1 ORDER BY 1;
c1	c2	c3	c4	c5	c6	c0
1	1.1	中文		0	11:11:11	10
1.1	1.2	中!文	a	1	11:11:11	2
1.2	2.2	中!文	a	1	11:11:11	3
1.3	3.2	中!文	a	1	11:11:11	4
1.5	5.2	中!文	b	2	12:12:12	6
UPDATE t2 SET m0=11 WHERE c5=0;
SELECT * FROM t2 ORDER BY 1;
m0	c1	c2	c3	c4	c5	c6
2	1.1	1.2	中!文	a	1	11:11:11
2	6	6.2	中!文	c	3	13:13:13
2	7	7.2	中!文	d	4	14:14:14
3	1.2	2.2	中!文	a	1	11:11:11
4	1.3	3.2	中!文	a	1	11:11:11
11	1	1.1	中文		0	11:11:11
#外键带有ON DELETE引用行为
DROP TABLE IF EXISTS t2;
DROP TABLE IF EXISTS t1;
CREATE TABLE t1(c0 INT(4) PRIMARY KEY,
c1 FLOAT UNIQUE,
c2 DOUBLE,
c3 CHAR(10),
c4 CHAR(10),
c5 INT,
c6 TIME);
INSERT INTO t1 VALUES(1,1.0,1.1,'中文','',0,'11:11:11'),
(2,1.1,1.2,'中!文','a',1,'11:11:11'),
(3,1.2,2.2,'中!文','a',1,'11:11:11'),
(4,1.3,3.2,'中!文','a',1,'11:11:11'),
(5,1.4,4.2,'中!文','a',1,'11:11:11');
#ON DELETE CASCADE
CREATE TABLE t2(c0 INT(4),
c1 FLOAT UNIQUE,
c2 DOUBLE,
c3 CHAR(10),
c4 CHAR(10),
c5 INT,
c6 TIME
);
INSERT INTO t2 VALUES(1,1.0,1.1,'中文','',0,'11:11:11'),
(2,1.1,1.2,'中!文','a',1,'11:11:11'),
(3,1.2,2.2,'中!文','a',1,'11:11:11'),
(4,1.3,3.2,'中!文','a',1,'11:11:11'),
(5,1.4,4.2,'中!文','a',1,'11:11:11');
ALTER TABLE t2 MODIFY c0 INT(4) ZEROFILL AFTER c1,ADD CONSTRAINT fk_c0_c0 FOREIGN KEY(c0) REFERENCES t1(c0) ON DELETE CASCADE;
ALTER TABLE t2 MODIFY c0 INT AFTER c1,ADD CONSTRAINT fk_c0_c0 FOREIGN KEY(c0) REFERENCES t1(c0) ON DELETE CASCADE;
ALTER TABLE t1 CHANGE c0 m0 INT(4) ZEROFILL;
ALTER TABLE t1 CHANGE c0 m0 INT(4);
INSERT INTO t1 VALUES(6,1.5,5.2,'中!文','b',2,'12:12:12');
SELECT * FROM t1 ORDER BY 1;
m0	c1	c2	c3	c4	c5	c6
0001	1	1.1	中文		0	11:11:11
0002	1.1	1.2	中!文	a	1	11:11:11
0003	1.2	2.2	中!文	a	1	11:11:11
0004	1.3	3.2	中!文	a	1	11:11:11
0005	1.4	4.2	中!文	a	1	11:11:11
0006	1.5	5.2	中!文	b	2	12:12:12
SELECT * FROM t2 ORDER BY 1;
c0	c1	c2	c3	c4	c5	c6
1	1	1.1	中文		0	11:11:11
2	1.1	1.2	中!文	a	1	11:11:11
3	1.2	2.2	中!文	a	1	11:11:11
4	1.3	3.2	中!文	a	1	11:11:11
5	1.4	4.2	中!文	a	1	11:11:11
UPDATE t1 SET m0=10 WHERE c5=0;
SELECT * FROM t1 ORDER BY 1;
m0	c1	c2	c3	c4	c5	c6
0002	1.1	1.2	中!文	a	1	11:11:11
0003	1.2	2.2	中!文	a	1	11:11:11
0004	1.3	3.2	中!文	a	1	11:11:11
0005	1.4	4.2	中!文	a	1	11:11:11
0006	1.5	5.2	中!文	b	2	12:12:12
0010	1	1.1	中文		0	11:11:11
SELECT * FROM t2 ORDER BY 1;
c0	c1	c2	c3	c4	c5	c6
1	1	1.1	中文		0	11:11:11
2	1.1	1.2	中!文	a	1	11:11:11
3	1.2	2.2	中!文	a	1	11:11:11
4	1.3	3.2	中!文	a	1	11:11:11
5	1.4	4.2	中!文	a	1	11:11:11
DELETE FROM t1 WHERE m0=1;
SELECT * FROM t1 ORDER BY 1;
m0	c1	c2	c3	c4	c5	c6
0002	1.1	1.2	中!文	a	1	11:11:11
0003	1.2	2.2	中!文	a	1	11:11:11
0004	1.3	3.2	中!文	a	1	11:11:11
0005	1.4	4.2	中!文	a	1	11:11:11
0006	1.5	5.2	中!文	b	2	12:12:12
0010	1	1.1	中文		0	11:11:11
SELECT * FROM t2 ORDER BY 1;
c0	c1	c2	c3	c4	c5	c6
1	1	1.1	中文		0	11:11:11
2	1.1	1.2	中!文	a	1	11:11:11
3	1.2	2.2	中!文	a	1	11:11:11
4	1.3	3.2	中!文	a	1	11:11:11
5	1.4	4.2	中!文	a	1	11:11:11
UPDATE t2 SET c0=11 WHERE c0=5;
SELECT * FROM t1 ORDER BY 1;
m0	c1	c2	c3	c4	c5	c6
0002	1.1	1.2	中!文	a	1	11:11:11
0003	1.2	2.2	中!文	a	1	11:11:11
0004	1.3	3.2	中!文	a	1	11:11:11
0005	1.4	4.2	中!文	a	1	11:11:11
0006	1.5	5.2	中!文	b	2	12:12:12
0010	1	1.1	中文		0	11:11:11
SELECT * FROM t2 ORDER BY 1;
c0	c1	c2	c3	c4	c5	c6
1	1	1.1	中文		0	11:11:11
2	1.1	1.2	中!文	a	1	11:11:11
3	1.2	2.2	中!文	a	1	11:11:11
4	1.3	3.2	中!文	a	1	11:11:11
11	1.4	4.2	中!文	a	1	11:11:11
DELETE FROM t2 WHERE c0=2;
SELECT * FROM t1 ORDER BY 1;
m0	c1	c2	c3	c4	c5	c6
0002	1.1	1.2	中!文	a	1	11:11:11
0003	1.2	2.2	中!文	a	1	11:11:11
0004	1.3	3.2	中!文	a	1	11:11:11
0005	1.4	4.2	中!文	a	1	11:11:11
0006	1.5	5.2	中!文	b	2	12:12:12
0010	1	1.1	中文		0	11:11:11
SELECT * FROM t2 ORDER BY 1;
c0	c1	c2	c3	c4	c5	c6
1	1	1.1	中文		0	11:11:11
3	1.2	2.2	中!文	a	1	11:11:11
4	1.3	3.2	中!文	a	1	11:11:11
11	1.4	4.2	中!文	a	1	11:11:11
INSERT INTO t2 VALUES(1.6,6,6.2,'中!文','c',3,'13:13:13');
SELECT * FROM t1 ORDER BY 1;
m0	c1	c2	c3	c4	c5	c6
0002	1.1	1.2	中!文	a	1	11:11:11
0003	1.2	2.2	中!文	a	1	11:11:11
0004	1.3	3.2	中!文	a	1	11:11:11
0005	1.4	4.2	中!文	a	1	11:11:11
0006	1.5	5.2	中!文	b	2	12:12:12
0010	1	1.1	中文		0	11:11:11
SELECT * FROM t2 ORDER BY 1;
c0	c1	c2	c3	c4	c5	c6
1	1	1.1	中文		0	11:11:11
2	6	6.2	中!文	c	3	13:13:13
3	1.2	2.2	中!文	a	1	11:11:11
4	1.3	3.2	中!文	a	1	11:11:11
11	1.4	4.2	中!文	a	1	11:11:11
INSERT INTO t2 VALUES(1.7,7,7.2,'中!文','d',4,'14:14:14');
SELECT * FROM t1 ORDER BY 1;
m0	c1	c2	c3	c4	c5	c6
0002	1.1	1.2	中!文	a	1	11:11:11
0003	1.2	2.2	中!文	a	1	11:11:11
0004	1.3	3.2	中!文	a	1	11:11:11
0005	1.4	4.2	中!文	a	1	11:11:11
0006	1.5	5.2	中!文	b	2	12:12:12
0010	1	1.1	中文		0	11:11:11
SELECT * FROM t2 ORDER BY 1;
c0	c1	c2	c3	c4	c5	c6
1	1	1.1	中文		0	11:11:11
2	6	6.2	中!文	c	3	13:13:13
2	7	7.2	中!文	d	4	14:14:14
3	1.2	2.2	中!文	a	1	11:11:11
4	1.3	3.2	中!文	a	1	11:11:11
11	1.4	4.2	中!文	a	1	11:11:11
ALTER TABLE t2 CHANGE c0 m0 INT(4);
INSERT INTO t2 VALUES(1.8,7,8.2,'中!文','e',8,'18:18:18');
INSERT INTO t2 VALUES(1.1,2,1.2,'中!文','d',4,'14:14:14');
SELECT * FROM t2 ORDER BY 1;
m0	c1	c2	c3	c4	c5	c6
1	1	1.1	中文		0	11:11:11
1	2	1.2	中!文	d	4	14:14:14
2	6	6.2	中!文	c	3	13:13:13
2	7	7.2	中!文	d	4	14:14:14
3	1.2	2.2	中!文	a	1	11:11:11
4	1.3	3.2	中!文	a	1	11:11:11
11	1.4	4.2	中!文	a	1	11:11:11
ALTER TABLE t2 CHANGE m0 m0 INT(5) FIRST;
INSERT INTO t2 VALUES(1,1.0,1.1,'中!文','a',5,'15:15:15');
INSERT INTO t2 VALUES(2,1.0,1.1,'中!文','a',5,'15:15:15');
SELECT * FROM t2 ORDER BY 1,2;
m0	c1	c2	c3	c4	c5	c6
1	1	1.1	中文		0	11:11:11
1	2	1.2	中!文	d	4	14:14:14
2	6	6.2	中!文	c	3	13:13:13
2	7	7.2	中!文	d	4	14:14:14
3	1.2	2.2	中!文	a	1	11:11:11
4	1.3	3.2	中!文	a	1	11:11:11
11	1.4	4.2	中!文	a	1	11:11:11
#ON DELETE RESTRICT
DROP TABLE IF EXISTS t2;
DROP TABLE IF EXISTS t1;
CREATE TABLE t1(c0 INT(4) PRIMARY KEY,
c1 FLOAT UNIQUE,
c2 DOUBLE,
c3 CHAR(10),
c4 CHAR(10),
c5 INT,
c6 TIME);
INSERT INTO t1 VALUES(1,1.0,1.1,'中文','',0,'11:11:11'),
(2,1.1,1.2,'中!文','a',1,'11:11:11'),
(3,1.2,2.2,'中!文','a',1,'11:11:11'),
(4,1.3,3.2,'中!文','a',1,'11:11:11'),
(5,1.4,4.2,'中!文','a',1,'11:11:11');
CREATE TABLE t2(c0 INT(4),
c1 FLOAT UNIQUE,
c2 DOUBLE,
c3 CHAR(10),
c4 CHAR(10),
c5 INT,
c6 TIME
);
INSERT INTO t2 VALUES(1,1.0,1.1,'中文','',0,'11:11:11'),
(2,1.1,1.2,'中!文','a',1,'11:11:11'),
(3,1.2,2.2,'中!文','a',1,'11:11:11'),
(4,1.3,3.2,'中!文','a',1,'11:11:11'),
(5,1.4,4.2,'中!文','a',1,'11:11:11');
ALTER TABLE t2 MODIFY c0 INT(4) ZEROFILL AFTER c1,ADD CONSTRAINT fk_c0_c0 FOREIGN KEY(c0) REFERENCES t1(c0) ON DELETE RESTRICT;
ALTER TABLE t2 MODIFY c0 INT AFTER c1,ADD CONSTRAINT fk_c0_c0 FOREIGN KEY(c0) REFERENCES t1(c0) ON DELETE RESTRICT;
ALTER TABLE t1 CHANGE c0 m0 INT(4) ZEROFILL;
ALTER TABLE t1 CHANGE c0 m0 INT(4);
INSERT INTO t1 VALUES(6,1.5,5.2,'中!文','b',2,'12:12:12');
SELECT * FROM t1 ORDER BY 1;
m0	c1	c2	c3	c4	c5	c6
0001	1	1.1	中文		0	11:11:11
0002	1.1	1.2	中!文	a	1	11:11:11
0003	1.2	2.2	中!文	a	1	11:11:11
0004	1.3	3.2	中!文	a	1	11:11:11
0005	1.4	4.2	中!文	a	1	11:11:11
0006	1.5	5.2	中!文	b	2	12:12:12
SELECT * FROM t2 ORDER BY 1;
c0	c1	c2	c3	c4	c5	c6
1	1	1.1	中文		0	11:11:11
2	1.1	1.2	中!文	a	1	11:11:11
3	1.2	2.2	中!文	a	1	11:11:11
4	1.3	3.2	中!文	a	1	11:11:11
5	1.4	4.2	中!文	a	1	11:11:11
UPDATE t1 SET m0=10 WHERE c5=0;
SELECT * FROM t1 ORDER BY 1;
m0	c1	c2	c3	c4	c5	c6
0002	1.1	1.2	中!文	a	1	11:11:11
0003	1.2	2.2	中!文	a	1	11:11:11
0004	1.3	3.2	中!文	a	1	11:11:11
0005	1.4	4.2	中!文	a	1	11:11:11
0006	1.5	5.2	中!文	b	2	12:12:12
0010	1	1.1	中文		0	11:11:11
SELECT * FROM t2 ORDER BY 1;
c0	c1	c2	c3	c4	c5	c6
1	1	1.1	中文		0	11:11:11
2	1.1	1.2	中!文	a	1	11:11:11
3	1.2	2.2	中!文	a	1	11:11:11
4	1.3	3.2	中!文	a	1	11:11:11
5	1.4	4.2	中!文	a	1	11:11:11
DELETE FROM t1 WHERE m0=1;
SELECT * FROM t1 ORDER BY 1;
m0	c1	c2	c3	c4	c5	c6
0002	1.1	1.2	中!文	a	1	11:11:11
0003	1.2	2.2	中!文	a	1	11:11:11
0004	1.3	3.2	中!文	a	1	11:11:11
0005	1.4	4.2	中!文	a	1	11:11:11
0006	1.5	5.2	中!文	b	2	12:12:12
0010	1	1.1	中文		0	11:11:11
SELECT * FROM t2 ORDER BY 1;
c0	c1	c2	c3	c4	c5	c6
1	1	1.1	中文		0	11:11:11
2	1.1	1.2	中!文	a	1	11:11:11
3	1.2	2.2	中!文	a	1	11:11:11
4	1.3	3.2	中!文	a	1	11:11:11
5	1.4	4.2	中!文	a	1	11:11:11
UPDATE t2 SET c0=11 WHERE c5=0;
SELECT * FROM t1 ORDER BY 1;
m0	c1	c2	c3	c4	c5	c6
0002	1.1	1.2	中!文	a	1	11:11:11
0003	1.2	2.2	中!文	a	1	11:11:11
0004	1.3	3.2	中!文	a	1	11:11:11
0005	1.4	4.2	中!文	a	1	11:11:11
0006	1.5	5.2	中!文	b	2	12:12:12
0010	1	1.1	中文		0	11:11:11
SELECT * FROM t2 ORDER BY 1;
c0	c1	c2	c3	c4	c5	c6
2	1.1	1.2	中!文	a	1	11:11:11
3	1.2	2.2	中!文	a	1	11:11:11
4	1.3	3.2	中!文	a	1	11:11:11
5	1.4	4.2	中!文	a	1	11:11:11
11	1	1.1	中文		0	11:11:11
DELETE FROM t2 WHERE c0=1;
SELECT * FROM t1 ORDER BY 1;
m0	c1	c2	c3	c4	c5	c6
0002	1.1	1.2	中!文	a	1	11:11:11
0003	1.2	2.2	中!文	a	1	11:11:11
0004	1.3	3.2	中!文	a	1	11:11:11
0005	1.4	4.2	中!文	a	1	11:11:11
0006	1.5	5.2	中!文	b	2	12:12:12
0010	1	1.1	中文		0	11:11:11
SELECT * FROM t2 ORDER BY 1;
c0	c1	c2	c3	c4	c5	c6
2	1.1	1.2	中!文	a	1	11:11:11
3	1.2	2.2	中!文	a	1	11:11:11
4	1.3	3.2	中!文	a	1	11:11:11
5	1.4	4.2	中!文	a	1	11:11:11
11	1	1.1	中文		0	11:11:11
INSERT INTO t2 VALUES(1.6,6,6.2,'中!文','c',3,'13:13:13');
SELECT * FROM t1 ORDER BY 1;
m0	c1	c2	c3	c4	c5	c6
0002	1.1	1.2	中!文	a	1	11:11:11
0003	1.2	2.2	中!文	a	1	11:11:11
0004	1.3	3.2	中!文	a	1	11:11:11
0005	1.4	4.2	中!文	a	1	11:11:11
0006	1.5	5.2	中!文	b	2	12:12:12
0010	1	1.1	中文		0	11:11:11
SELECT * FROM t2 ORDER BY 1;
c0	c1	c2	c3	c4	c5	c6
2	1.1	1.2	中!文	a	1	11:11:11
2	6	6.2	中!文	c	3	13:13:13
3	1.2	2.2	中!文	a	1	11:11:11
4	1.3	3.2	中!文	a	1	11:11:11
5	1.4	4.2	中!文	a	1	11:11:11
11	1	1.1	中文		0	11:11:11
INSERT INTO t2 VALUES(1.7,7,7.2,'中!文','d',4,'14:14:14');
SELECT * FROM t1 ORDER BY 1;
m0	c1	c2	c3	c4	c5	c6
0002	1.1	1.2	中!文	a	1	11:11:11
0003	1.2	2.2	中!文	a	1	11:11:11
0004	1.3	3.2	中!文	a	1	11:11:11
0005	1.4	4.2	中!文	a	1	11:11:11
0006	1.5	5.2	中!文	b	2	12:12:12
0010	1	1.1	中文		0	11:11:11
SELECT * FROM t2 ORDER BY 1;
c0	c1	c2	c3	c4	c5	c6
2	1.1	1.2	中!文	a	1	11:11:11
2	6	6.2	中!文	c	3	13:13:13
2	7	7.2	中!文	d	4	14:14:14
3	1.2	2.2	中!文	a	1	11:11:11
4	1.3	3.2	中!文	a	1	11:11:11
5	1.4	4.2	中!文	a	1	11:11:11
11	1	1.1	中文		0	11:11:11
ALTER TABLE t2 CHANGE c0 m0 INT(4);
INSERT INTO t2 VALUES(1.8,7,8.2,'中!文','e',8,'18:18:18');
INSERT INTO t2 VALUES(1.0,1,1.1,'中!文','a',1,'10:10:10');
DELETE FROM t2 WHERE m0=6;
SELECT * FROM t2 ORDER BY 1;
m0	c1	c2	c3	c4	c5	c6
2	1.1	1.2	中!文	a	1	11:11:11
2	6	6.2	中!文	c	3	13:13:13
2	7	7.2	中!文	d	4	14:14:14
3	1.2	2.2	中!文	a	1	11:11:11
4	1.3	3.2	中!文	a	1	11:11:11
5	1.4	4.2	中!文	a	1	11:11:11
11	1	1.1	中文		0	11:11:11
ALTER TABLE t2 CHANGE m0 m0 INT(5) FIRST;
INSERT INTO t2 VALUES(7,1.8,8.2,'中!文','e',8,'18:18:18');
INSERT INTO t2 VALUES(6,1.5,5.1,'中!文','b',6,'16:16:16');
DELETE FROM t2 WHERE m0=2;
SELECT * FROM t2 ORDER BY 1,2;
m0	c1	c2	c3	c4	c5	c6
3	1.2	2.2	中!文	a	1	11:11:11
4	1.3	3.2	中!文	a	1	11:11:11
5	1.4	4.2	中!文	a	1	11:11:11
6	1.5	5.1	中!文	b	6	16:16:16
7	1.8	8.2	中!文	e	8	18:18:18
11	1	1.1	中文		0	11:11:11
DELETE FROM t1 WHERE m0=1;
ALTER TABLE t1 CHANGE m0 m0 INT(4);
DELETE FROM t1 WHERE m0=1;
DELETE FROM t2 WHERE m0=1;
SELECT * FROM t1 ORDER BY 1,2;
m0	c1	c2	c3	c4	c5	c6
2	1.1	1.2	中!文	a	1	11:11:11
3	1.2	2.2	中!文	a	1	11:11:11
4	1.3	3.2	中!文	a	1	11:11:11
5	1.4	4.2	中!文	a	1	11:11:11
6	1.5	5.2	中!文	b	2	12:12:12
10	1	1.1	中文		0	11:11:11
SELECT * FROM t2 ORDER BY 1,2;
m0	c1	c2	c3	c4	c5	c6
3	1.2	2.2	中!文	a	1	11:11:11
4	1.3	3.2	中!文	a	1	11:11:11
5	1.4	4.2	中!文	a	1	11:11:11
6	1.5	5.1	中!文	b	6	16:16:16
7	1.8	8.2	中!文	e	8	18:18:18
11	1	1.1	中文		0	11:11:11
ALTER TABLE t1 CHANGE m0 c0 INT(5) ZEROFILL;
ALTER TABLE t1 CHANGE m0 c0 INT(5);
DELETE FROM t1 WHERE c0=1;
SELECT * FROM t1 ORDER BY 1,2;
c0	c1	c2	c3	c4	c5	c6
00002	1.1	1.2	中!文	a	1	11:11:11
00003	1.2	2.2	中!文	a	1	11:11:11
00004	1.3	3.2	中!文	a	1	11:11:11
00005	1.4	4.2	中!文	a	1	11:11:11
00006	1.5	5.2	中!文	b	2	12:12:12
00010	1	1.1	中文		0	11:11:11
DELETE FROM t1 WHERE c0=3;
DELETE FROM t2 WHERE m0=3;
SELECT * FROM t1 ORDER BY 1,2;
c0	c1	c2	c3	c4	c5	c6
00002	1.1	1.2	中!文	a	1	11:11:11
00004	1.3	3.2	中!文	a	1	11:11:11
00005	1.4	4.2	中!文	a	1	11:11:11
00006	1.5	5.2	中!文	b	2	12:12:12
00010	1	1.1	中文		0	11:11:11
SELECT * FROM t2 ORDER BY 1,2;
m0	c1	c2	c3	c4	c5	c6
4	1.3	3.2	中!文	a	1	11:11:11
5	1.4	4.2	中!文	a	1	11:11:11
6	1.5	5.1	中!文	b	6	16:16:16
7	1.8	8.2	中!文	e	8	18:18:18
11	1	1.1	中文		0	11:11:11
#在生成列上创建唯一约束
#表中创建生成列并加上唯一约束，然后修改列
DROP TABLE IF EXISTS t2;
DROP TABLE IF EXISTS t1;
CREATE TABLE t1(c0 INT(3),
c1 FLOAT,
c2 DOUBLE NOT NULL,
c3 CHAR(10) DEFAULT 'A',
c4 CHAR(10) AS (UPPER(c3)) VIRTUAL COMMENT '字符串生成列' UNIQUE,
c5 INT AS (c0*2) STORED COMMENT '数值生成列' UNIQUE,
c6 TIME);
INSERT INTO t1(c0,c1,c2,c3,c6) VALUES(1,1.0,1.1,'','11:11:11'),
(2,1.1,1.2,'a','11:11:11'),
(3,1.2,2.2,'b','11:11:11'),
(4,1.3,3.2,'c','11:11:11'),
(5,1.4,4.2,'d','11:11:11');
ALTER TABLE t1 CHANGE c5 c5 INT(5) AS (c0*2) STORED COMMENT '数值生成列' UNIQUE AFTER c2;
ALTER TABLE t1 CHANGE c5 m5 FLOAT(6,0) AS (c0*2) STORED COMMENT '数值生成列';
ALTER TABLE t1 MODIFY c5 INT(5) AS (c0*2) STORED COMMENT '数值生成列' UNIQUE AFTER c2;
ALTER TABLE t1 MODIFY c5 FLOAT(6,0) AS (c0*2) STORED COMMENT '数值生成列';
#表中无生成列，修改普通列为生成列并加上唯一约束
DROP TABLE IF EXISTS t1;
CREATE TABLE t1(c0 INT(3),
c1 FLOAT,
c2 DOUBLE NOT NULL,
c3 CHAR(10) DEFAULT 'A',
c4 CHAR(10),
c5 INT,
c6 TIME);
INSERT INTO t1 VALUES(1,1.0,1.1,'AA','a',0,'11:11:11'),
(2,1.1,1.2,'AA','a',1,'11:11:11'),
(3,1.2,2.2,'CC','b',2,'11:11:11'),
(4,1.3,3.2,'DD','c',3,'11:11:11'),
(5,1.4,4.2,'EE','d',4,'11:11:11');
ALTER TABLE t1 CHANGE c4 c4 CHAR(10) AS (LOWER(c3)) VIRTUAL COMMENT '字符串生成列' AFTER c2,ADD CONSTRAINT uni_key UNIQUE KEY (c4);
ALTER TABLE t1 CHANGE c4 c4 CHAR(10) AS (LOWER(c3)) STORED COMMENT '字符串生成列' AFTER c2,ADD CONSTRAINT uni_key UNIQUE KEY (c4);
UPDATE t1 SET c3='BB' WHERE c0=2;
ALTER TABLE t1 CHANGE c4 c4 CHAR(10) AS (LOWER(c3)) STORED COMMENT '字符串生成列' AFTER c2,ADD CONSTRAINT uni_key UNIQUE KEY (c4);
ALTER TABLE t1 MODIFY c5 INT(5) ZEROFILL AS (2*c0) STORED COMMENT '数值生成列' AFTER c4,ADD CONSTRAINT uni_key UNIQUE KEY (c5);
ALTER TABLE t1 MODIFY c5 INT(5) ZEROFILL AS (2*c0) STORED COMMENT '数值生成列' AFTER c4,ADD CONSTRAINT uni_key UNIQUE KEY (c5);
#创建生成列，并在生成列上创建全局唯一索引，然后在修改列
DROP TABLE IF EXISTS t1;
CREATE TABLE t1(c0 INT(3),
c1 FLOAT,
c2 DOUBLE NOT NULL,
c3 CHAR(10) DEFAULT 'A',
c4 CHAR(10) AS (UPPER(c3)) VIRTUAL COMMENT '字符串生成列',
c5 INT AS (c0*2) STORED COMMENT '数值生成列',
c6 TIME);
INSERT INTO t1(c0,c1,c2,c3,c6) VALUES(1,1.0,1.1,'','11:11:11'),
(2,1.1,1.2,'a','11:11:11'),
(3,1.2,2.2,'b','11:11:11'),
(4,1.3,3.2,'c','11:11:11'),
(5,1.4,4.2,'d','11:11:11');
CREATE UNIQUE INDEX uni_global ON t1(c4,c5) GLOBAL;
ALTER TABLE t1 CHANGE c5 c5 INT AS (c0*3) VIRTUAL COMMENT '数值生成列' AFTER c3;
ALTER TABLE t1 CHANGE c5 m5 INT AS (c0*2) STORED COMMENT '数值生成列';
ALTER TABLE t1 MODIFY c5 INT AS (c0*2) STORED COMMENT '数值生成列';
ALTER TABLE t1 MODIFY c5 INT AS (c0*3) VIRTUAL COMMENT '数值生成列' AFTER c3;
#在生成列基础上创建局部唯一索引，然后在修改列
ALTER TABLE t1 DROP INDEX uni_global;
CREATE UNIQUE INDEX uni_local ON t1(c4,c5) LOCAL;
ALTER TABLE t1 CHANGE c5 c5 INT AS (c0*3) VIRTUAL COMMENT '数值生成列' AFTER c3;
ALTER TABLE t1 CHANGE c5 m5 INT AS (c0*2) STORED COMMENT '数值生成列';
ALTER TABLE t1 MODIFY c5 INT AS (c0*2) STORED COMMENT '数值生成列';
ALTER TABLE t1 MODIFY c5 INT AS (c0*3) VIRTUAL COMMENT '数值生成列' AFTER c3;
#修改普通列为生成列，并创建全局唯一索引
DROP TABLE IF EXISTS t1;
CREATE TABLE t1(c0 INT(3),
c1 FLOAT,
c2 DOUBLE NOT NULL,
c3 CHAR(10) DEFAULT 'A',
c4 CHAR(10),
c5 INT,
c6 TIME);
INSERT INTO t1 VALUES(1,1.0,1.1,'AA','a',0,'11:11:11'),
(2,1.1,1.2,'AA','a',1,'11:11:11'),
(3,1.2,2.2,'CC','b',2,'11:11:11'),
(4,1.3,3.2,'DD','c',3,'11:11:11'),
(5,1.4,4.2,'EE','d',4,'11:11:11');
CREATE UNIQUE INDEX uni_global ON t1(c3,c5) GLOBAL;
ALTER TABLE t1 CHANGE c4 c4 VARCHAR(10) AS (LOWER(c3)) VIRTUAL COMMENT '字符串生成列' AFTER c2;
ALTER TABLE t1 CHANGE c4 m4 CHAR(10) AS (LOWER(c3)) STORED COMMENT '字符串生成列';
ALTER TABLE t1 MODIFY c4 VARCHAR(10) AS (LOWER(c3)) VIRTUAL COMMENT '字符串生成列' AFTER c2;
ALTER TABLE t1 MODIFY c4 CHAR(10) AS (LOWER(c3)) STORED COMMENT '字符串生成列';
ALTER TABLE t1 DROP INDEX uni_global;
#在生成列基础上创建局部唯一索引，然后在修改列
ALTER TABLE t1 ADD c7 INT AS (2*c0) STORED COMMENT '数值生成列' AFTER c5;
CREATE UNIQUE INDEX uni_local ON t1(c7,c0) LOCAL;
INSERT INTO t1(c0,c1,c2,c3,c4) VALUES(6,1.6,6.2,'f','16:16:16');
SELECT * FROM t1 ORDER BY 1,2,3,4;
c0	c1	c2	c3	c4	c5	c7	c6
1	1	1.1	AA	a	0	2	11:11:11
2	1.1	1.2	AA	a	1	4	11:11:11
3	1.2	2.2	CC	b	2	6	11:11:11
4	1.3	3.2	DD	c	3	8	11:11:11
5	1.4	4.2	EE	d	4	10	11:11:11
6	1.6	6.2	f	16:16:16	NULL	12	NULL
#在生成列上创建全局/局部索引,然后修改列
DROP TABLE IF EXISTS t1;
CREATE TABLE t1(c0 INT(3),
c1 FLOAT,
c2 DOUBLE NOT NULL,
c3 CHAR(10) DEFAULT 'A',
c4 CHAR(10) AS (UPPER(c3)) VIRTUAL COMMENT '字符串生成列',
c5 INT AS (c0*2) STORED COMMENT '数值生成列',
c6 TIME);
INSERT INTO t1(c0,c1,c2,c3,c6) VALUES(1,1.0,1.1,'','11:11:11'),
(2,1.1,1.2,'a','11:11:11'),
(3,1.2,2.2,'b','11:11:11'),
(4,1.3,3.2,'c','11:11:11'),
(5,1.4,4.2,'d','11:11:11');
CREATE INDEX global_ind ON t1(c5) GLOBAL
PARTITION BY RANGE(c5)
(PARTITION p1 VALUES LESS THAN(5),
PARTITION p2 VALUES LESS THAN(10),
PARTITION p3 VALUES LESS THAN(15)
);
ALTER TABLE t1 CHANGE c5 c5 INT AS (c0*2) STORED COMMENT '数值生成列' AFTER c2;
ALTER TABLE t1 CHANGE c5 m5 INT AS (c0*2) STORED COMMENT '数值生成列';
ALTER TABLE t1 MODIFY m5 INT AS (c0*2) STORED COMMENT '数值生成列' AFTER c2;
ALTER TABLE t1 MODIFY m5 INT AS (c0*2) STORED COMMENT '数值生成列';
ALTER TABLE t1 DROP INDEX global_ind;
CREATE INDEX local_ind ON t1(c4) LOCAL;
ALTER TABLE t1 CHANGE c4 c4 CHAR(10) AS (UPPER(c3)) VIRTUAL COMMENT '字符串生成列' AFTER c2;
ALTER TABLE t1 CHANGE c4 m4 CHAR(10) AS (UPPER(c3)) VIRTUAL COMMENT '字符串生成列';
ALTER TABLE t1 MODIFY c4 CHAR(10) AS (UPPER(c3)) VIRTUAL COMMENT '字符串生成列' BEFORE c2;
ALTER TABLE t1 MODIFY c4 CHAR(10) AS (UPPER(c3)) VIRTUAL COMMENT '字符串生成列';
#OB不支持修改普通列为生成列，所以在修改列上创建全局/局部索引不进行测试
#不支持OB的MySQL模式创建函数索引，故不测试
#创建局部前缀、非前缀索引和全局前缀索引后，执行DDL操作 【OB目前不支持全局非前缀索引，故不测试】
DROP TABLE IF EXISTS t1;
CREATE TABLE t1(c0 INT,
c1 FLOAT ,
c2 DOUBLE,
c3 CHAR(10),
c4 VARCHAR(10),
c5 CHAR(10),
c6 INT,
c7 DATE,
c8 YEAR)
PARTITION BY RANGE COLUMNS(c4)
(PARTITION p1 VALUES LESS THAN('E'),
PARTITION p2 VALUES LESS THAN('J'),
PARTITION p3 VALUES LESS THAN('O'),
PARTITION p4 VALUES LESS THAN(MAXVALUE)
);
INSERT INTO t1 VALUES(1,1.0,1.1,'中文','','',0,'2010-10-11','1989'),
(2,1.1,1.2,'中!文','A','a',1,'2001-01-11','2001'),
(3,1.2,2.2,'中!文','B','b',2,'2016-02-11','2002'),
(4,1.3,3.2,'中!文','C','c',1,'2021-03-11','2003'),
(5,1.4,4.2,'中!文','D','d',2,'2011-11-01','2004'),
(6,1.5,5.2,'中!文','E','e',1,'2014-01-11','2005'),
(7,1.6,6.2,'中!文','F','f',3,'2011-11-01','2006'),
(8,1.7,7.2,'中!文','G','g',1,'2017-01-11','2007'),
(9,1.8,8.2,'中!文','H','h',4,'2013-11-01','2011'),
(10,1.9,9.2,'中!文','I','i',5,'2011-11-11','2013'),
(11,2.0,1.9,'中!文','J','j',6,'2015-01-01','2016'),
(12,2.1,1.8,'中!文','K','k',7,'2012-12-11','2016');
#创建局部前缀索引
CREATE INDEX loc_ind ON t1(c4,c5) LOCAL
PARTITION BY RANGE COLUMNS(c4)
(PARTITION p1 VALUES LESS THAN('E'),
PARTITION p2 VALUES LESS THAN('J'),
PARTITION p3 VALUES LESS THAN('O'),
PARTITION p4 VALUES LESS THAN(MAXVALUE)
);
CREATE INDEX loc_ind ON t1(c4,c5) LOCAL;
#此处有问题，修改分区键列报错，在和开发确认
#修改列属性、顺序、列名后结合不同的函数/运算符使用
DROP TABLE IF EXISTS t1;
CREATE TABLE t1(c0 INT,
c1 FLOAT ,
c2 DOUBLE,
c3 CHAR(10),
c4 VARCHAR(10),
c5 CHAR(10),
c6 INT,
c7 DATE,
c8 YEAR)
PARTITION BY RANGE COLUMNS(c4)
(PARTITION p1 VALUES LESS THAN('E'),
PARTITION p2 VALUES LESS THAN('J'),
PARTITION p3 VALUES LESS THAN('O'),
PARTITION p4 VALUES LESS THAN(MAXVALUE)
);
INSERT INTO t1 VALUES(1,1.0,1.1,'中文','','',0,'2010-10-11','1989'),
(2,1.1,1.2,'中!文','A','a',1,'2001-01-11','2001'),
(3,1.2,2.2,'中!文','B','b',2,'2016-02-11','2002'),
(4,1.3,3.2,'中!文','C','c',1,'2021-03-11','2003'),
(5,1.4,4.2,'中!文','D','d',2,'2011-11-01','2004'),
(6,1.5,5.2,'中!文','E','e',1,'2014-01-11','2005'),
(7,1.6,6.2,'中!文','F','f',3,'2011-11-01','2006'),
(8,1.7,7.2,'中!文','G','g',1,'2017-01-11','2007'),
(9,1.8,8.2,'中!文','H','h',4,'2013-11-01','2011'),
(10,1.9,9.2,'中!文','I','i',5,'2011-11-11','2013'),
(11,2.0,1.9,'中!文','J','j',6,'2015-01-01','2016'),
(12,2.1,1.8,'中!文','K','k',7,'2012-12-11','2016');
ALTER TABLE t1 ADD CONSTRAINT uni_key UNIQUE KEY (c1,c4,c5);
#修改列属性及顺序后使用函数
ALTER TABLE t1 MODIFY c6 INT(4) ZEROFILL DEFAULT 0 AFTER c0;
SELECT MOD(c6,2) 'c6列取余', 2*c6 'c6列的2倍值', c6 DIV(2) 'c6列的商数' FROM t1 ORDER BY 1,2,3;
c6列取余	c6列的2倍值	c6列的商数
0	0	0
0	4	1
0	4	1
0	8	2
0	12	3
1	2	0
1	2	0
1	2	0
1	2	0
1	6	1
1	10	2
1	14	3
SELECT c6 FROM t1 WHERE c6>3 AND c6 IN(5,6) ORDER BY 1;
c6
0005
0006
SELECT @var1 := MIN(c6) 'c6列赋值给变量var1' FROM t1;
c6列赋值给变量var1
0
SELECT AVG(c6) 'C6列平均值',MAX(c6) 'C6列最大值',SUM(c6) 'C6列合计值' FROM t1;
C6列平均值	C6列最大值	C6列合计值
2.7500	7	33
SELECT TIME(c6) 'c6列使用时间函数1',YEAR(c6) 'c6列使用时间函数2',HOUR(c6) 'c6列使用时间函数3' FROM t1 ORDER BY 1;
c6列使用时间函数1	c6列使用时间函数2	c6列使用时间函数3
00:00:00	0	0
00:00:01	NULL	0
00:00:01	NULL	0
00:00:01	NULL	0
00:00:01	NULL	0
00:00:02	NULL	0
00:00:02	NULL	0
00:00:03	NULL	0
00:00:04	NULL	0
00:00:05	NULL	0
00:00:06	NULL	0
00:00:07	NULL	0
SELECT BIN(c6),ASCII(c6),CONCAT(c6,c5) FROM t1 ORDER BY 1,2,3;
BIN(c6)	ASCII(c6)	CONCAT(c6,c5)
0	48	0000
1	48	0001a
1	48	0001c
1	48	0001e
1	48	0001g
10	48	0002b
10	48	0002d
100	48	0004h
101	48	0005i
11	48	0003f
110	48	0006j
111	48	0007k
SELECT GREATEST(c6,c0) FROM t1 ORDER BY 1;
GREATEST(c6,c0)
1
2
3
4
5
6
7
8
9
10
11
12
SELECT CASE 1000*c6 WHEN 1000*c6 > 5000 THEN 'A' ELSE 'B' END FROM t1 ORDER BY 1;
CASE 1000*c6 WHEN 1000*c6 > 5000 THEN 'A' ELSE 'B' END
A
B
B
B
B
B
B
B
B
B
B
B
SELECT MD5(c6) 'c6列加密' FROM t1 ORDER BY 1;
c6列加密
25bbdcd06c32d477f7fa1c3e4a91b032
25bbdcd06c32d477f7fa1c3e4a91b032
25bbdcd06c32d477f7fa1c3e4a91b032
25bbdcd06c32d477f7fa1c3e4a91b032
4a7d1ed414474e4033ac29ccb8653d9b
6950aac2d7932e1f1a4c3cf6ada1316e
7cd86ecb09aa48c6e620b340f6a74592
7f8bb0fe8b33780a08fe6b60ced14529
95b09698fda1f64af16708ffb859eab9
d39934ce111a864abf40391f3da9cdf5
fcd04e26e900e94b9ed6dd604fed2b64
fcd04e26e900e94b9ed6dd604fed2b64
SELECT CHARSET(c6) FROM t1;
CHARSET(c6)
binary
binary
binary
binary
binary
binary
binary
binary
binary
binary
binary
binary
SELECT ANY_VALUE(c6) FROM t1 GROUP BY c3 ORDER BY 1;
ANY_VALUE(c6)
0
1
UPDATE t1 SET c6=NULL WHERE c0>10;
COMMIT;
SELECT NVL(c6,0) FROM t1 ORDER BY 1;
NVL(c6,0)
0
0
0
1
1
1
1
2
2
3
4
5
#修改列名后使用函数
ALTER TABLE t1 CHANGE c6 m6 INT(4) ZEROFILL;
SELECT MOD(c6,2) 'c6列取余', 2*c6 'c6列的2倍值', c6 DIV(2) 'c6列的商数' FROM t1 ORDER BY 1,2,3;
SELECT MOD(m6,2) 'm6列取余', 2*m6 'm6列的2倍值', m6 DIV(2) 'm6列的商数' FROM t1 ORDER BY 1,2,3;
m6列取余	m6列的2倍值	m6列的商数
NULL	NULL	NULL
NULL	NULL	NULL
0	0	0
0	4	1
0	4	1
0	8	2
1	2	0
1	2	0
1	2	0
1	2	0
1	6	1
1	10	2
SELECT c6 FROM t1 WHERE c6>3 AND c6 IN(5,6) ORDER BY 1;
SELECT m6 FROM t1 WHERE m6>3 AND m6 IN(5,6) ORDER BY 1;
m6
0005
SELECT @var1 := MIN(c6) 'c6列赋值给变量var1' FROM t1;
SELECT @var1 := MIN(m6) 'm6列赋值给变量var1' FROM t1;
m6列赋值给变量var1
0
SELECT AVG(c6) 'C6列平均值',MAX(c6) 'C6列最大值',SUM(c6) 'C6列合计值' FROM t1;
SELECT AVG(m6) 'm6列平均值',MAX(m6) 'm6列最大值',SUM(m6) 'm6列合计值' FROM t1;
m6列平均值	m6列最大值	m6列合计值
2.0000	5	20
SELECT TIME(c6) 'c6列使用时间函数1',YEAR(c6) 'c6列使用时间函数2',HOUR(c6) 'c6列使用时间函数3' FROM t1 ORDER BY 1;
SELECT TIME(m6) 'm6列使用时间函数1',YEAR(m6) 'm6列使用时间函数2',HOUR(m6) 'm6列使用时间函数3' FROM t1 ORDER BY 1;
m6列使用时间函数1	m6列使用时间函数2	m6列使用时间函数3
NULL	NULL	NULL
NULL	NULL	NULL
00:00:00	0	0
00:00:01	NULL	0
00:00:01	NULL	0
00:00:01	NULL	0
00:00:01	NULL	0
00:00:02	NULL	0
00:00:02	NULL	0
00:00:03	NULL	0
00:00:04	NULL	0
00:00:05	NULL	0
SELECT BIN(c6),ASCII(c6),CONCAT(c6,c5) FROM t1 ORDER BY 1,2,3;
SELECT BIN(m6),ASCII(m6),CONCAT(m6,c5) FROM t1 ORDER BY 1,2,3;
BIN(m6)	ASCII(m6)	CONCAT(m6,c5)
NULL	NULL	NULL
NULL	NULL	NULL
0	48	0000
1	48	0001a
1	48	0001c
1	48	0001e
1	48	0001g
10	48	0002b
10	48	0002d
100	48	0004h
101	48	0005i
11	48	0003f
SELECT GREATEST(c6,c0) FROM t1 ORDER BY 1;
SELECT GREATEST(m6,c0) FROM t1 ORDER BY 1;
GREATEST(m6,c0)
NULL
NULL
1
2
3
4
5
6
7
8
9
10
SELECT CASE 1000*c6 WHEN 1000*c6 > 5000 THEN 'A' ELSE 'B' END FROM t1 ORDER BY 1;
SELECT CASE 1000*m6 WHEN 1000*m6 > 5000 THEN 'A' ELSE 'B' END FROM t1 ORDER BY 1;
CASE 1000*m6 WHEN 1000*m6 > 5000 THEN 'A' ELSE 'B' END
A
B
B
B
B
B
B
B
B
B
B
B
SELECT MD5(c6) 'c6列加密' FROM t1 ORDER BY 1;
SELECT MD5(m6) 'c6列加密' FROM t1 ORDER BY 1;
c6列加密
NULL
NULL
25bbdcd06c32d477f7fa1c3e4a91b032
25bbdcd06c32d477f7fa1c3e4a91b032
25bbdcd06c32d477f7fa1c3e4a91b032
25bbdcd06c32d477f7fa1c3e4a91b032
4a7d1ed414474e4033ac29ccb8653d9b
7cd86ecb09aa48c6e620b340f6a74592
95b09698fda1f64af16708ffb859eab9
d39934ce111a864abf40391f3da9cdf5
fcd04e26e900e94b9ed6dd604fed2b64
fcd04e26e900e94b9ed6dd604fed2b64
SELECT CHARSET(c6) FROM t1;
SELECT CHARSET(m6) FROM t1;
CHARSET(m6)
binary
binary
binary
binary
binary
binary
binary
binary
binary
binary
binary
binary
SELECT ANY_VALUE(c6) FROM t1 GROUP BY c3 ORDER BY 1;
SELECT ANY_VALUE(m6) FROM t1 GROUP BY c3 ORDER BY 1;
ANY_VALUE(m6)
0
1
UPDATE t1 SET m6=NULL WHERE c0>10;
COMMIT;
SELECT NVL(c6,0) FROM t1 ORDER BY 1;
SELECT NVL(m6,0) FROM t1 ORDER BY 1;
NVL(m6,0)
0
0
0
1
1
1
1
2
2
3
4
5
DROP TABLE IF EXISTS t2;
DROP TABLE IF EXISTS t1;
#########Empty recycle bin, delete test database, tables, etc##########
purge recyclebin;
