purge recyclebin;
SET sql_mode='PAD_CHAR_TO_FULL_LENGTH';
#修改字符串类型和长度
DROP TABLE IF EXISTS t1;
CREATE TABLE t1(c1 INT,
c2 CHAR(10))
PARTITION BY RANGE(c1)
(PARTITION p1 VALUES LESS THAN(15),
PARTITION p2 VALUES LESS THAN(25),
PARTITION p3 VALUES LESS THAN(35)
);
INSERT INTO t1 VALUES(0,'A'),(2,'B'),(4,'C'),(8,'D'),(16,'E'),(18,'F'),(20,'G');
SELECT c2,CHAR_LENGTH(c2) FROM t1 ORDER BY 1;
c2	CHAR_LENGTH(c2)
A         	10
B         	10
C         	10
D         	10
E         	10
F         	10
G         	10
ALTER TABLE t1 MODIFY c2 CHAR(20) FIRST;
SELECT c2,CHAR_LENGTH(c2) FROM t1 ORDER BY 1;
c2	CHAR_LENGTH(c2)
A                   	20
B                   	20
C                   	20
D                   	20
E                   	20
F                   	20
G                   	20
INSERT INTO t1 VALUES(21,'test@$测试数据123');
SELECT c2,CHAR_LENGTH(c2) FROM t1 ORDER BY 1;
c2	CHAR_LENGTH(c2)
21                  	20
A                   	20
B                   	20
C                   	20
D                   	20
E                   	20
F                   	20
G                   	20
INSERT INTO t1 VALUES(21,'test@$测试数据123  test@$测试数据123  test@$测试数据123  test@$测试数据123');
SELECT c2,CHAR_LENGTH(c2) FROM t1 ORDER BY 1;
c2	CHAR_LENGTH(c2)
21                  	20
21                  	20
A                   	20
B                   	20
C                   	20
D                   	20
E                   	20
F                   	20
G                   	20
UPDATE t1 SET c2='test@$测试数据test@$测试数据123' WHERE c1=0;
SELECT c2,CHAR_LENGTH(c2) FROM t1 ORDER BY 1;
c2	CHAR_LENGTH(c2)
B                   	20
C                   	20
D                   	20
E                   	20
F                   	20
G                   	20
test@$测试数据test@$测试数据	20
test@$测试数据test@$测试数据	20
test@$测试数据test@$测试数据	20
DELETE FROM t1 WHERE c2='B                   ';
SELECT c2,CHAR_LENGTH(c2) FROM t1 ORDER BY 1;
c2	CHAR_LENGTH(c2)
C                   	20
D                   	20
E                   	20
F                   	20
G                   	20
test@$测试数据test@$测试数据	20
test@$测试数据test@$测试数据	20
test@$测试数据test@$测试数据	20
ALTER TABLE t1 CHANGE c2 m2 CHAR(20) DEFAULT 'TEST/TEST/STEST/TEST/TEST/TEST/';
ALTER TABLE t1 CHANGE c2 m2 CHAR(20) DEFAULT 'TEST/TEST/TEST/TEST/';
SELECT m2,CHAR_LENGTH(m2) FROM t1 ORDER BY 1;
m2	CHAR_LENGTH(m2)
C                   	20
D                   	20
E                   	20
F                   	20
G                   	20
test@$测试数据test@$测试数据	20
test@$测试数据test@$测试数据	20
test@$测试数据test@$测试数据	20
INSERT INTO t1(c1) VALUES(22);
SELECT m2,CHAR_LENGTH(m2) FROM t1 ORDER BY 1;
m2	CHAR_LENGTH(m2)
C                   	20
D                   	20
E                   	20
F                   	20
G                   	20
TEST/TEST/TEST/TEST/	20
test@$测试数据test@$测试数据	20
test@$测试数据test@$测试数据	20
test@$测试数据test@$测试数据	20
INSERT INTO t1 VALUES(23,'测试数据123@%&￥测试数据123@%&￥￥￥');
SELECT m2,CHAR_LENGTH(m2) FROM t1 ORDER BY 1;
m2	CHAR_LENGTH(m2)
23                  	20
C                   	20
D                   	20
E                   	20
F                   	20
G                   	20
TEST/TEST/TEST/TEST/	20
test@$测试数据test@$测试数据	20
test@$测试数据test@$测试数据	20
test@$测试数据test@$测试数据	20
UPDATE t1 SET m2='测试数据' WHERE c1=23;
SELECT m2,CHAR_LENGTH(m2) FROM t1 ORDER BY 1;
m2	CHAR_LENGTH(m2)
23                  	20
C                   	20
D                   	20
E                   	20
F                   	20
G                   	20
TEST/TEST/TEST/TEST/	20
test@$测试数据test@$测试数据	20
test@$测试数据test@$测试数据	20
test@$测试数据test@$测试数据	20
DELETE FROM t1 WHERE m2='测试数据                ';
SELECT m2,CHAR_LENGTH(m2) FROM t1 ORDER BY 1;
m2	CHAR_LENGTH(m2)
23                  	20
C                   	20
D                   	20
E                   	20
F                   	20
G                   	20
TEST/TEST/TEST/TEST/	20
test@$测试数据test@$测试数据	20
test@$测试数据test@$测试数据	20
test@$测试数据test@$测试数据	20
ALTER TABLE t1 MODIFY m2 VARCHAR(10) NOT NULL DEFAULT '修改列类型 和其他属性' COMMENT '修改列类型' FIRST;
#char类型修改为其他类型
DROP TABLE IF EXISTS t1;
CREATE TABLE t1(c1 INT,
c2 CHAR(10))
PARTITION BY LIST COLUMNS(c2)
(PARTITION p1 VALUES IN('0','3','5','6','7','9','11','13','14','15'),
PARTITION p2 VALUES IN('20','23','25','26','27','29','31','33','34','35'),
PARTITION p3 VALUES IN('40','43','45','46','47','49','51','53','54','55')
);
INSERT INTO t1 VALUES(0,'7'),(2,'3'),(4,'5'),(8,'6'),(16,'14'),(18,'9'),(20,'13');
#此处OB修改成功，MySQL修改报错，OB有问题，开发在改，问题链接：
ALTER TABLE t1 MODIFY c2 INT(5) PRIMARY KEY AUTO_INCREMENT COMMENT '字符串类型修改为数值类型' FIRST;
SELECT c2,CHAR_LENGTH(c2) FROM t1 ORDER BY 1;
c2	CHAR_LENGTH(c2)
3	1
5	1
6	1
7	1
9	1
13	2
14	2
INSERT INTO t1 VALUES(21,'21'),(22,'23');
INSERT INTO t1 VALUES(21,'20'),(22,'23');
SELECT c2,CHAR_LENGTH(c2) FROM t1 ORDER BY 1;
c2	CHAR_LENGTH(c2)
3	1
5	1
6	1
7	1
9	1
13	2
14	2
#修改其他列为CHAR类型
ALTER TABLE t1 MODIFY c1 CHAR(5) FIRST;
SELECT c1,CHAR_LENGTH(c1) FROM t1 ORDER BY 1;
c1	CHAR_LENGTH(c1)
0    	5
16   	5
18   	5
2    	5
20   	5
4    	5
8    	5
INSERT INTO t1 VALUES(123456,'40');
UPDATE t1 SET c1='超过5个字的条目' WHERE c1='16   ';
DELETE FROM t1 WHERE c1='4';
SELECT c1,CHAR_LENGTH(c1) FROM t1 ORDER BY 1;
c1	CHAR_LENGTH(c1)
0    	5
12345	5
18   	5
2    	5
20   	5
8    	5
超过5个字	5
DROP TABLE IF EXISTS t1;
CREATE TABLE t1(c1 INT,
c2 CHAR(5))
PARTITION BY LIST COLUMNS(c2)
(PARTITION p1 VALUES IN('0','3','5','6','7','9','11000','13','14','15'),
PARTITION p2 VALUES IN('20','23','25','26000','27','29','31','33','34','35'),
PARTITION p3 VALUES IN('40000','43000','45','46','47','49','51','53','54','55')
);
INSERT INTO t1 VALUES(0,'7'),(2,'3'),(4,'5'),(8,'6'),(16,'11000'),(18,'9'),(20,'14');
SELECT c2,CHAR_LENGTH(c2) FROM t1 ORDER BY 1;
c2	CHAR_LENGTH(c2)
11000	5
14   	5
3    	5
5    	5
6    	5
7    	5
9    	5
#此处修改分区键报错为已知问题，待开发修复后执行
DROP TABLE IF EXISTS t1;
CREATE TABLE t1(c1 FLOAT,
c2 VARCHAR(5))
PARTITION BY LIST COLUMNS(c2)
(PARTITION p1 VALUES IN('0','3','5','6','7','9','11000','13','14','15'),
PARTITION p2 VALUES IN('20','23','25','26000','27','29','31','33','34','35'),
PARTITION p3 VALUES IN('40000','43000','45','46','47','49','51','53','54','55')
);
INSERT INTO t1 VALUES(0.234,'7'),(2.456,'3'),(4.654,'5'),(8.367,'6'),(16.733,'11000'),(18.8932,'9'),(20.0987766,'14');
SELECT c2,CHAR_LENGTH(c2) FROM t1 ORDER BY 1;
c2	CHAR_LENGTH(c2)
11000	5
14	2
3	1
5	1
6	1
7	1
9	1
ALTER TABLE t1 MODIFY c1 BINARY(5),MODIFY c2 VARBINARY(5);
SELECT c1,CHAR_LENGTH(c1),c2,CHAR_LENGTH(c2) FROM t1 ORDER BY 1;
c1	CHAR_LENGTH(c1)	c2	CHAR_LENGTH(c2)
0.234	5	7	1
16.73	5	11000	5
18.89	5	9	1
2.456	5	3	1
20.09	5	14	2
4.654	5	5	1
8.367	5	6	1
INSERT INTO t1 VALUES('AABBCCDDEEFF','260000'),('1','51');
UPDATE t1 SET c1='test123', c2='430003' WHERE c1=1;
SELECT c1,CHAR_LENGTH(c1),c2,CHAR_LENGTH(c2) FROM t1 ORDER BY 1;
c1	CHAR_LENGTH(c1)	c2	CHAR_LENGTH(c2)
0.234	5	7	1
16.73	5	11000	5
18.89	5	9	1
2.456	5	3	1
20.09	5	14	2
4.654	5	5	1
8.367	5	6	1
AABBC	5	26000	5
test1	5	43000	5
#暂不支持，待支持后执行sql
DROP TABLE IF EXISTS t1;
CREATE TABLE t1(c1 CHAR(10) AS (CONCAT(c2,'AA')),
c2 VARCHAR(5))
PARTITION BY LIST COLUMNS(c2)
(PARTITION p1 VALUES IN('0','3','5','6','7','9','11000','13','14','15'),
PARTITION p2 VALUES IN('20','23','25','26000','27','29','31','33','34','35'),
PARTITION p3 VALUES IN('40000','43000','45','46','47','49','51','53','54','55')
);
INSERT INTO t1(c2) VALUES('7'),('3'),('5'),('6'),('11000'),('9'),('14');
SELECT c1,CHAR_LENGTH(c1),c2,CHAR_LENGTH(c2) FROM t1 ORDER BY 1;
c1	CHAR_LENGTH(c1)	c2	CHAR_LENGTH(c2)
11000AA   	10	11000	5
14AA      	10	14	2
3AA       	10	3	1
5AA       	10	5	1
6AA       	10	6	1
7AA       	10	7	1
9AA       	10	9	1
DELETE FROM t1 WHERE c1='11000AA';
SELECT c1,CHAR_LENGTH(c1),c2,CHAR_LENGTH(c2) FROM t1 ORDER BY 1;
c1	CHAR_LENGTH(c1)	c2	CHAR_LENGTH(c2)
14AA      	10	14	2
3AA       	10	3	1
5AA       	10	5	1
6AA       	10	6	1
7AA       	10	7	1
9AA       	10	9	1
#在复制表中测试禁用修剪后新增列，并校验。
DROP TABLE IF EXISTS t1;
CREATE TABLE t1(c1 INT,
c2 CHAR(10));
INSERT INTO t1 VALUES(0,'A'),(2,'B'),(4,'C'),(8,'D'),(16,'E'),(18,'F'),(20,'G');
DROP TABLE IF EXISTS t2;
CREATE TABLE t2 AS SELECT * FROM t1;
SELECT * FROM t2 ORDER BY 1;
c1	c2
0	A         
2	B         
4	C         
8	D         
16	E         
18	F         
20	G         
ALTER TABLE t2 CHANGE c1 c1 CHAR(5) UNIQUE COMMENT '唯一约束列',MODIFY c2 BINARY(4) FIRST;
SELECT c1,CHAR_LENGTH(c1),c2,CHAR_LENGTH(c2) FROM t2 ORDER BY 1;
c1	CHAR_LENGTH(c1)	c2	CHAR_LENGTH(c2)
0    	5	A   	4
16   	5	E   	4
18   	5	F   	4
2    	5	B   	4
20   	5	G   	4
4    	5	C   	4
8    	5	D   	4
INSERT INTO t2 VALUES('1234567','AA/BB/CC'),('12      ','AB        ');
SELECT c1,CHAR_LENGTH(c1),c2,CHAR_LENGTH(c2) FROM t2 ORDER BY 1;
c1	CHAR_LENGTH(c1)	c2	CHAR_LENGTH(c2)
0    	5	A   	4
16   	5	E   	4
18   	5	F   	4
2    	5	B   	4
20   	5	G   	4
4    	5	C   	4
8    	5	D   	4
AA/BB	5	1234	4
AB   	5	12  	4
UPDATE t2 SET c1='tstecaseofadd' , c2='tstecaseofadd' WHERE c2='G   ';
SELECT c1,CHAR_LENGTH(c1),c2,CHAR_LENGTH(c2) FROM t2 ORDER BY 1;
c1	CHAR_LENGTH(c1)	c2	CHAR_LENGTH(c2)
0    	5	A   	4
16   	5	E   	4
18   	5	F   	4
2    	5	B   	4
4    	5	C   	4
8    	5	D   	4
AA/BB	5	1234	4
AB   	5	12  	4
tstec	5	tste	4
DELETE FROM t2 WHERE c2='12  ';
SELECT c1,CHAR_LENGTH(c1),c2,CHAR_LENGTH(c2) FROM t2 ORDER BY 1;
c1	CHAR_LENGTH(c1)	c2	CHAR_LENGTH(c2)
0    	5	A   	4
16   	5	E   	4
18   	5	F   	4
2    	5	B   	4
4    	5	C   	4
8    	5	D   	4
AA/BB	5	1234	4
tstec	5	tste	4
DROP TABLE IF EXISTS t2;
CREATE TABLE t2 LIKE t1;
INSERT INTO t2 SELECT * FROM t1;
SELECT * FROM t2 ORDER BY 1;
c1	c2
0	A         
2	B         
4	C         
8	D         
16	E         
18	F         
20	G         
ALTER TABLE t2 CHANGE c1 c1 CHAR(5) UNIQUE COMMENT '唯一约束列',MODIFY c2 BINARY(4) FIRST;
SELECT c1,CHAR_LENGTH(c1),c2,CHAR_LENGTH(c2) FROM t2 ORDER BY 1;
c1	CHAR_LENGTH(c1)	c2	CHAR_LENGTH(c2)
0    	5	A   	4
16   	5	E   	4
18   	5	F   	4
2    	5	B   	4
20   	5	G   	4
4    	5	C   	4
8    	5	D   	4
INSERT INTO t2 VALUES('1234567','AA/BB/CC'),('12      ','AB        ');
SELECT c1,CHAR_LENGTH(c1),c2,CHAR_LENGTH(c2) FROM t2 ORDER BY 1;
c1	CHAR_LENGTH(c1)	c2	CHAR_LENGTH(c2)
0    	5	A   	4
16   	5	E   	4
18   	5	F   	4
2    	5	B   	4
20   	5	G   	4
4    	5	C   	4
8    	5	D   	4
AA/BB	5	1234	4
AB   	5	12  	4
UPDATE t2 SET c1='tstecaseofadd' , c2='tstecaseofadd' WHERE c2='G   ';
SELECT c1,CHAR_LENGTH(c1),c2,CHAR_LENGTH(c2) FROM t2 ORDER BY 1;
c1	CHAR_LENGTH(c1)	c2	CHAR_LENGTH(c2)
0    	5	A   	4
16   	5	E   	4
18   	5	F   	4
2    	5	B   	4
4    	5	C   	4
8    	5	D   	4
AA/BB	5	1234	4
AB   	5	12  	4
tstec	5	tste	4
DELETE FROM t2 WHERE c2='12  ';
SELECT c1,CHAR_LENGTH(c1),c2,CHAR_LENGTH(c2) FROM t2 ORDER BY 1;
c1	CHAR_LENGTH(c1)	c2	CHAR_LENGTH(c2)
0    	5	A   	4
16   	5	E   	4
18   	5	F   	4
2    	5	B   	4
4    	5	C   	4
8    	5	D   	4
AA/BB	5	1234	4
tstec	5	tste	4
DROP TABLE IF EXISTS t1;
CREATE TABLE t1(c1 INT,
c2 CHAR(10));
INSERT INTO t1 VALUES(0,'A'),(2,'B'),(4,'C'),(8,'D'),(16,'E'),(18,'F'),(20,'G');
DROP TABLE IF EXISTS t2;
CREATE TABLE t2 LIKE t1;
INSERT INTO t2 SELECT * FROM t1;
SELECT * FROM t2 ORDER BY 1;
c1	c2
0	A         
2	B         
4	C         
8	D         
16	E         
18	F         
20	G         
ALTER TABLE t2 MODIFY c2 BINARY(5) DEFAULT 'TEST' FIRST,ADD c3 CHAR(5) FIRST,DROP c1;
INSERT INTO t2 VALUES('TESTCASE','特殊%￥……&字符'),('aa','bb');
SELECT c2,CHAR_LENGTH(c2),c3,CHAR_LENGTH(c3) FROM t2 ORDER BY 1;
c2	CHAR_LENGTH(c2)	c3	CHAR_LENGTH(c3)
A    	5	NULL	NULL
B    	5	NULL	NULL
C    	5	NULL	NULL
D    	5	NULL	NULL
E    	5	NULL	NULL
F    	5	NULL	NULL
G    	5	NULL	NULL
bb   	5	aa   	5
特�	5	TESTC	5
UPDATE t2 SET c2='test/test',c3='hahhahh' WHERE c3='aa   ';
SELECT c2,CHAR_LENGTH(c2),c3,CHAR_LENGTH(c3) FROM t2 ORDER BY 1;
c2	CHAR_LENGTH(c2)	c3	CHAR_LENGTH(c3)
A    	5	NULL	NULL
B    	5	NULL	NULL
C    	5	NULL	NULL
D    	5	NULL	NULL
E    	5	NULL	NULL
F    	5	NULL	NULL
G    	5	NULL	NULL
test/	5	hahha	5
特�	5	TESTC	5
DELETE FROM t2 WHERE c2='test/';
SELECT c2,CHAR_LENGTH(c2),c3,CHAR_LENGTH(c3) FROM t2 ORDER BY 1;
c2	CHAR_LENGTH(c2)	c3	CHAR_LENGTH(c3)
A    	5	NULL	NULL
B    	5	NULL	NULL
C    	5	NULL	NULL
D    	5	NULL	NULL
E    	5	NULL	NULL
F    	5	NULL	NULL
G    	5	NULL	NULL
特�	5	TESTC	5
DROP TABLE IF EXISTS t2;
CREATE TABLE t2 AS SELECT * FROM t1;
SELECT * FROM t2 ORDER BY 1;
c1	c2
0	A         
2	B         
4	C         
8	D         
16	E         
18	F         
20	G         
#在视图中测试禁用修剪后修改列，并校验。
DROP TABLE IF EXISTS t1;
CREATE TABLE t1(c1 INT,
c2 CHAR(5));
INSERT INTO t1 VALUES(0,'A'),(2,'B'),(4,'C'),(8,'D'),(16,'E'),(18,'F'),(20,'G');
DROP VIEW IF EXISTS v1;
CREATE VIEW v1 AS SELECT * FROM t1;
DESC v1;
Field	Type	Null	Key	Default	Extra
c1	int(11)	YES		NULL	
c2	char(5)	YES		NULL	
SELECT * FROM v1 ORDER BY 1;
c1	c2
0	A    
2	B    
4	C    
8	D    
16	E    
18	F    
20	G    
ALTER TABLE v1 CHANGE c2 c2 BINARY(4) UNIQUE COMMENT '唯一约束列',MODIFY c1 CHAR(3) DEFAULT 'TES' AFTER c2;
ALTER TABLE t1 CHANGE c2 c2 BINARY(4) UNIQUE COMMENT '唯一约束列',MODIFY c1 CHAR(3) DEFAULT 'TES' AFTER c2;
INSERT INTO v1 VALUES('AABBCCDD','testcase'),('a              ','H             ');
SELECT c1,c2,CHAR_LENGTH(c2) FROM v1;
c1	c2	CHAR_LENGTH(c2)
0  	A   	4
2  	B   	4
4  	C   	4
8  	D   	4
16 	E   	4
18 	F   	4
20 	G   	4
AAB	test	4
a  	H   	4
UPDATE v1 SET c2='tstecaseofadd' , c1='tstecaseofadd' WHERE c2='G   ';
SELECT c1,CHAR_LENGTH(c1),c2,CHAR_LENGTH(c2) FROM v1 ORDER BY 1;
c1	CHAR_LENGTH(c1)	c2	CHAR_LENGTH(c2)
0  	3	A   	4
16 	3	E   	4
18 	3	F   	4
2  	3	B   	4
4  	3	C   	4
8  	3	D   	4
a  	3	H   	4
AAB	3	test	4
tst	3	tste	4
DELETE FROM v1 WHERE c1='a  ';
SELECT c1,CHAR_LENGTH(c1),c2,CHAR_LENGTH(c2) FROM v1 ORDER BY 1;
c1	CHAR_LENGTH(c1)	c2	CHAR_LENGTH(c2)
0  	3	A   	4
16 	3	E   	4
18 	3	F   	4
2  	3	B   	4
4  	3	C   	4
8  	3	D   	4
AAB	3	test	4
tst	3	tste	4
DROP TABLE IF EXISTS t1;
CREATE TABLE t1(c1 INT,
c2 CHAR(5));
INSERT INTO t1 VALUES(0,'A'),(2,'B'),(4,'C'),(8,'D'),(16,'E'),(18,'F'),(20,'G');
DROP VIEW IF EXISTS v1;
CREATE VIEW v1 AS SELECT * FROM t1;
DESC v1;
Field	Type	Null	Key	Default	Extra
c1	int(11)	YES		NULL	
c2	char(5)	YES		NULL	
SELECT * FROM v1 ORDER BY 1;
c1	c2
0	A    
2	B    
4	C    
8	D    
16	E    
18	F    
20	G    
#在临时表中测试禁用修剪后修改列，并校验。
#########Empty recycle bin, delete test database, tables, etc##########
purge recyclebin;
