purge recyclebin;
DROP TABLE IF EXISTS t1;
DROP TABLE IF EXISTS t2;
#mysql_modify-3
#mysql_modify-3-1/mysql_modify-3-2/mysql_modify-3-3/mysql_modify-3-4
################PARTITION BY LIST WITH SUBPARITIONS##################
#Create Data
CREATE TABLE t1(c0 INT,
c1 FLOAT ,
c2 DOUBLE,
c3 CHAR(10),
c4 VARCHAR(10),
c5 CHAR(10),
c6 INT,
c7 DATE,
c8 YEAR)
PARTITION BY LIST(c0)
SUBPARTITION BY HASH(c6) SUBPARTITIONS 3
(PARTITION l1 VALUES IN (0,1,2,3,4,5,6),
PARTITION l2 VALUES IN (7,8,9,10,11,12,13)
);
INSERT INTO t1 VALUES(1,1.0,1.1,'中文','','',0,'2010-10-11','2000'),
(2,1.1,1.2,'中!文','A','a',1,'2001-01-11','2001'),
(3,1.2,2.2,'中!文','B','a',2,'2016-02-11','2002'),
(4,1.3,3.2,'中!文','C','a',1,'2021-03-11','2003'),
(5,1.4,4.2,'中!文','D','a',2,'2011-11-01','2004'),
(6,1.5,5.2,'中!文','E','a',1,'2014-01-11','2005'),
(7,1.6,6.2,'中!文','F','a',3,'2011-11-01','2006'),
(8,1.7,7.2,'中!文','G','a',1,'2017-01-11','2007'),
(9,1.8,8.2,'中!文','H','a',4,'2013-11-01','2011'),
(10,1.9,9.2,'中!文','I','a',5,'2011-11-11','2012'),
(11,2.0,1.9,'中!文','J','a',6,'2015-01-01','2011'),
(12,2.1,1.8,'中!文','K','a',7,'2012-12-11','2012');
#修改列
ALTER TABLE t1 CHANGE c6 c6 INT(5) ZEROFILL AFTER c7;
INSERT INTO t1 VALUES(13,2.2,1.7,'中!文','L','b','2013-12-13',8,'2013');
#暂不支持，等支持后执行下面sql
#删除分区后修改列
DROP TABLE IF EXISTS t1;
CREATE TABLE t1(c0 INT,
c1 FLOAT ,
c2 DOUBLE,
c3 CHAR(10),
c4 VARCHAR(10),
c5 CHAR(10),
c6 INT,
c7 DATE,
c8 YEAR)
PARTITION BY LIST(c0)
SUBPARTITION BY HASH(c6) SUBPARTITIONS 3
(PARTITION l1 VALUES IN (0,1,2,3,4,5,6),
PARTITION l2 VALUES IN (7,8,9,10,11,12,13)
);
INSERT INTO t1 VALUES(1,1.0,1.1,'中文','','',0,'2010-10-11','2000'),
(2,1.1,1.2,'中!文','A','a',1,'2001-01-11','2001'),
(3,1.2,2.2,'中!文','B','a',2,'2016-02-11','2002'),
(4,1.3,3.2,'中!文','C','a',1,'2021-03-11','2003'),
(5,1.4,4.2,'中!文','D','a',2,'2011-11-01','2004'),
(6,1.5,5.2,'中!文','E','a',1,'2014-01-11','2005'),
(7,1.6,6.2,'中!文','F','a',3,'2011-11-01','2006'),
(8,1.7,7.2,'中!文','G','a',1,'2017-01-11','2007'),
(9,1.8,8.2,'中!文','H','a',4,'2013-11-01','2011'),
(10,1.9,9.2,'中!文','I','a',5,'2011-11-11','2012'),
(11,2.0,1.9,'中!文','J','a',6,'2015-01-01','2011'),
(12,2.1,1.8,'中!文','K','a',7,'2012-12-11','2012');
#删除主分区后新增列
ALTER TABLE t1 MODIFY c6 INT(4) ZEROFILL DEFAULT 0,DROP PARTITION l1;
ERROR 42000: You have an error in your SQL syntax; check the manual that corresponds to your OceanBase version for the right syntax to use near 'PARTITION l1' at line 1
ALTER TABLE t1 DROP PARTITION l1;
ALTER TABLE t1 CHANGE c6 c6 INT(4) ZEROFILL DEFAULT 0,ADD c9 VARCHAR(5) DEFAULT 'A' AFTER c6;
INSERT INTO t1 VALUES(13,2.2,1.7,'中文','L','b',8,'12:12:12','2000');
INSERT INTO t1 VALUES(13,2.2,1.7,'中文','L','b',8,'B','12:12:12','2000');
SELECT * FROM t1 ORDER BY c0;
c0	c1	c2	c3	c4	c5	c6	c9	c7	c8
7	1.6	6.2	中!文	F	a	0003	A	2011-11-01	2006
8	1.7	7.2	中!文	G	a	0001	A	2017-01-11	2007
9	1.8	8.2	中!文	H	a	0004	A	2013-11-01	2011
10	1.9	9.2	中!文	I	a	0005	A	2011-11-11	2012
11	2	1.9	中!文	J	a	0006	A	2015-01-01	2011
12	2.1	1.8	中!文	K	a	0007	A	2012-12-11	2012
13	2.2	1.7	中文	L	b	0008	B	2012-12-12	2000
ALTER TABLE t1 ADD PARTITION(PARTITION l1 VALUES IN (0,1,2,3,4,5,6));
ALTER TABLE t1 CHANGE c0 c0 INT AFTER c1,DROP PARTITION l1;
ERROR 42000: You have an error in your SQL syntax; check the manual that corresponds to your OceanBase version for the right syntax to use near 'PARTITION l1' at line 1
#OB不支持remove所有分区，故不测试
#修改列后新增分区
ALTER TABLE t1 CHANGE c0 c0 INT AFTER c1,ADD PARTITION (PARTITION l3 VALUES IN (14,15,16,17));
ERROR 42000: You have an error in your SQL syntax; check the manual that corresponds to your OceanBase version for the right syntax to use near 'PARTITION (PARTITION l3 VALUES IN (14,15,16,17))' at line 1
ALTER TABLE t1 MODIFY c0 INT AFTER c1,REORGANIZE PARTITION l2 INTO (PARTITION l3 VALUES IN (7,8,9,10,11,12,13,14,15,16,17));
ERROR 42000: You have an error in your SQL syntax; check the manual that corresponds to your OceanBase version for the right syntax to use near 'REORGANIZE PARTITION l2 INTO (PARTITION l3 VALUES IN (7,8,9,10,11,12,13,14,15,16' at line 1
#修改列带有索引或者约束
DROP TABLE IF EXISTS t1;
CREATE TABLE t1(c0 INT NOT NULL,
c1 FLOAT ,
c2 DOUBLE,
c3 CHAR(10),
c4 VARCHAR(10),
c5 CHAR(10),
c6 INT,
c7 TIME,
c8 YEAR )
PARTITION BY LIST(c8)
SUBPARTITION BY KEY(c8) SUBPARTITIONS 3
(PARTITION l1 VALUES IN (2000,2002,2004,2006,2008,2010,2012),
PARTITION l2 VALUES IN (2001,2003,2005,2007,2009,2011,2013)
);
INSERT INTO t1 VALUES(1,1.0,1.1,'中文','','',0,'11:11:11','2000'),
(2,1.1,1.2,'中!文','A','a',1,'11:11:11','2001'),
(3,1.2,2.2,'中@文','B','a',1,'11:11:11','2002'),
(4,1.3,3.2,'中_文','C','a',1,'11:11:11','2003'),
(5,1.4,4.2,'中$文','D','a',1,'11:11:11','2004'),
(6,1.5,5.2,'中%文','E','a',1,'11:11:11','2005'),
(7,1.6,6.2,'中^文','F','a',1,'11:11:11','2006'),
(8,1.7,7.2,'中&文','G','a',1,'11:11:11','2007'),
(9,1.8,8.2,'中*文','H','a',1,'11:11:11','2011'),
(10,1.9,9.2,'中-文','I','a',1,'11:11:11','2012'),
(11,2.0,1.9,'中=文','J','a',1,'11:11:11','2013'),
(12,2.1,1.8,'中+文','K','a',1,'11:11:11','2010');
#暂不支持，待支持后执行sql
#修改列列带有唯一约束
DROP TABLE IF EXISTS t1;
CREATE TABLE t1(c0 INT NOT NULL,
c1 FLOAT ,
c2 DOUBLE,
c3 CHAR(10),
c4 VARCHAR(10),
c5 CHAR(10),
c6 INT,
c7 TIME,
c8 YEAR )
PARTITION BY LIST(c8)
SUBPARTITION BY KEY(c8) SUBPARTITIONS 3
(PARTITION l1 VALUES IN (2000,2002,2004,2006,2008,2010,2012),
PARTITION l2 VALUES IN (2001,2003,2005,2007,2009,2011,2013)
);
INSERT INTO t1 VALUES(1,1.0,1.1,'中文','','',0,'11:11:11','2000'),
(2,1.1,1.2,'中!文','A','a',1,'11:11:11','2001'),
(3,1.2,2.2,'中@文','B','a',1,'11:11:11','2002'),
(4,1.3,3.2,'中_文','C','a',1,'11:11:11','2003'),
(5,1.4,4.2,'中$文','D','a',1,'11:11:11','2004'),
(6,1.5,5.2,'中%文','E','a',1,'11:11:11','2005'),
(7,1.6,6.2,'中^文','F','a',1,'11:11:11','2006'),
(8,1.7,7.2,'中&文','G','a',1,'11:11:11','2007'),
(9,1.8,8.2,'中*文','H','a',1,'11:11:11','2011'),
(10,1.9,9.2,'中-文','I','a',1,'11:11:11','2012'),
(11,2.0,1.9,'中=文','J','a',1,'11:11:11','2013'),
(12,2.1,1.8,'中+文','K','a',1,'11:11:11','2010');
ALTER TABLE t1 CHANGE c8 c8 YEAR UNIQUE AFTER c6;
INSERT INTO t1 VALUES(13,2.2,1.7,'中-文','L','b',2,'2010','12:12:12');
INSERT INTO t1 VALUES(13,2.2,1.7,'中-文','L','b',2,'2008','12:12:12');
SELECT * FROM t1 ORDER BY 1;
c0	c1	c2	c3	c4	c5	c6	c7	c8
1	1	1.1	中文			0	11:11:11	2000
2	1.1	1.2	中!文	A	a	1	11:11:11	2001
3	1.2	2.2	中@文	B	a	1	11:11:11	2002
4	1.3	3.2	中_文	C	a	1	11:11:11	2003
5	1.4	4.2	中$文	D	a	1	11:11:11	2004
6	1.5	5.2	中%文	E	a	1	11:11:11	2005
7	1.6	6.2	中^文	F	a	1	11:11:11	2006
8	1.7	7.2	中&文	G	a	1	11:11:11	2007
9	1.8	8.2	中*文	H	a	1	11:11:11	2011
10	1.9	9.2	中-文	I	a	1	11:11:11	2012
11	2	1.9	中=文	J	a	1	11:11:11	2013
12	2.1	1.8	中+文	K	a	1	11:11:11	2010
ALTER TABLE t1 DROP INDEX c8;
INSERT INTO t1 VALUES(14,2.3,1.6,'中-文','M','c',3,'2008','13:13:13');
SELECT * FROM t1 ORDER BY 1;
c0	c1	c2	c3	c4	c5	c6	c7	c8
1	1	1.1	中文			0	11:11:11	2000
2	1.1	1.2	中!文	A	a	1	11:11:11	2001
3	1.2	2.2	中@文	B	a	1	11:11:11	2002
4	1.3	3.2	中_文	C	a	1	11:11:11	2003
5	1.4	4.2	中$文	D	a	1	11:11:11	2004
6	1.5	5.2	中%文	E	a	1	11:11:11	2005
7	1.6	6.2	中^文	F	a	1	11:11:11	2006
8	1.7	7.2	中&文	G	a	1	11:11:11	2007
9	1.8	8.2	中*文	H	a	1	11:11:11	2011
10	1.9	9.2	中-文	I	a	1	11:11:11	2012
11	2	1.9	中=文	J	a	1	11:11:11	2013
12	2.1	1.8	中+文	K	a	1	11:11:11	2010
ALTER TABLE t1 CHANGE c8 m8 DATE,ADD CONSTRAINT uni_key UNIQUE KEY(m8);
ALTER TABLE t1 CHANGE c8 m8 YEAR AFTER c7,ADD CONSTRAINT uni_key UNIQUE KEY(m8);
ALTER TABLE t1 CHANGE c8 m8 YEAR,ADD CONSTRAINT uni_key UNIQUE KEY(m8);
DELETE FROM t1 WHERE c8='2008';
ALTER TABLE t1 CHANGE c8 m8 YEAR,ADD CONSTRAINT uni_key UNIQUE KEY(m8);
INSERT INTO t1 VALUES(13,2.2,1.7,'中-文','L','b',2,'2010','12:12:12');
INSERT INTO t1 VALUES(13,2.2,1.7,'中-文','L','b',2,'2008','12:12:12');
SELECT * FROM t1 ORDER BY 1;
c0	c1	c2	c3	c4	c5	c6	c7	m8
1	1	1.1	中文			0	11:11:11	2000
2	1.1	1.2	中!文	A	a	1	11:11:11	2001
3	1.2	2.2	中@文	B	a	1	11:11:11	2002
4	1.3	3.2	中_文	C	a	1	11:11:11	2003
5	1.4	4.2	中$文	D	a	1	11:11:11	2004
6	1.5	5.2	中%文	E	a	1	11:11:11	2005
7	1.6	6.2	中^文	F	a	1	11:11:11	2006
8	1.7	7.2	中&文	G	a	1	11:11:11	2007
9	1.8	8.2	中*文	H	a	1	11:11:11	2011
10	1.9	9.2	中-文	I	a	1	11:11:11	2012
11	2	1.9	中=文	J	a	1	11:11:11	2013
12	2.1	1.8	中+文	K	a	1	11:11:11	2010
ALTER TABLE t1 DROP INDEX uni_key;
INSERT INTO t1 VALUES(14,2.3,1.6,'中-文','M','c',3,'2008','13:13:13');
SELECT * FROM t1 ORDER BY 1;
c0	c1	c2	c3	c4	c5	c6	c7	m8
1	1	1.1	中文			0	11:11:11	2000
2	1.1	1.2	中!文	A	a	1	11:11:11	2001
3	1.2	2.2	中@文	B	a	1	11:11:11	2002
4	1.3	3.2	中_文	C	a	1	11:11:11	2003
5	1.4	4.2	中$文	D	a	1	11:11:11	2004
6	1.5	5.2	中%文	E	a	1	11:11:11	2005
7	1.6	6.2	中^文	F	a	1	11:11:11	2006
8	1.7	7.2	中&文	G	a	1	11:11:11	2007
9	1.8	8.2	中*文	H	a	1	11:11:11	2011
10	1.9	9.2	中-文	I	a	1	11:11:11	2012
11	2	1.9	中=文	J	a	1	11:11:11	2013
12	2.1	1.8	中+文	K	a	1	11:11:11	2010
ALTER TABLE t1 MODIFY m8 YEAR AFTER c7,ADD CONSTRAINT uni_key UNIQUE KEY(c6,m8);
INSERT INTO t1 VALUES(15,2.4,1.5,'中0文','N','d',3,'14:14:14','2008');
SELECT * FROM t1 ORDER BY 1;
c0	c1	c2	c3	c4	c5	c6	c7	m8
1	1	1.1	中文			0	11:11:11	2000
2	1.1	1.2	中!文	A	a	1	11:11:11	2001
3	1.2	2.2	中@文	B	a	1	11:11:11	2002
4	1.3	3.2	中_文	C	a	1	11:11:11	2003
5	1.4	4.2	中$文	D	a	1	11:11:11	2004
6	1.5	5.2	中%文	E	a	1	11:11:11	2005
7	1.6	6.2	中^文	F	a	1	11:11:11	2006
8	1.7	7.2	中&文	G	a	1	11:11:11	2007
9	1.8	8.2	中*文	H	a	1	11:11:11	2011
10	1.9	9.2	中-文	I	a	1	11:11:11	2012
11	2	1.9	中=文	J	a	1	11:11:11	2013
12	2.1	1.8	中+文	K	a	1	11:11:11	2010
15	2.4	1.5	中0文	N	d	3	14:14:14	2008
INSERT INTO t1 VALUES(15,2.4,1.5,'中0文','N','d',1,'14:14:14','2008');
INSERT INTO t1 VALUES(15,2.4,1.5,'中0文','N','d',1,'14:14:14','2009');
SELECT * FROM t1 ORDER BY 1,7,9;
c0	c1	c2	c3	c4	c5	c6	c7	m8
1	1	1.1	中文			0	11:11:11	2000
2	1.1	1.2	中!文	A	a	1	11:11:11	2001
3	1.2	2.2	中@文	B	a	1	11:11:11	2002
4	1.3	3.2	中_文	C	a	1	11:11:11	2003
5	1.4	4.2	中$文	D	a	1	11:11:11	2004
6	1.5	5.2	中%文	E	a	1	11:11:11	2005
7	1.6	6.2	中^文	F	a	1	11:11:11	2006
8	1.7	7.2	中&文	G	a	1	11:11:11	2007
9	1.8	8.2	中*文	H	a	1	11:11:11	2011
10	1.9	9.2	中-文	I	a	1	11:11:11	2012
11	2	1.9	中=文	J	a	1	11:11:11	2013
12	2.1	1.8	中+文	K	a	1	11:11:11	2010
15	2.4	1.5	中0文	N	d	1	14:14:14	2008
15	2.4	1.5	中0文	N	d	1	14:14:14	2009
15	2.4	1.5	中0文	N	d	3	14:14:14	2008
#暂不知此，待支持后执行sql
#修改列加上常规索引/组合索引
DROP TABLE IF EXISTS t1;
CREATE TABLE t1(c0 INT,
c1 FLOAT ,
c2 DOUBLE,
c3 CHAR(10),
c4 VARCHAR(10),
c5 CHAR(10),
c6 INT,
c7 TIME,
c8 YEAR)
PARTITION BY LIST(c8)
SUBPARTITION BY KEY(c0) SUBPARTITIONS 3
(PARTITION l1 VALUES IN (2000,2002,2004,2006,2008,2010,2012),
PARTITION l2 VALUES IN (2001,2003,2005,2007,2009,2011,2013)
);
INSERT INTO t1 VALUES(1,1.0,1.1,'中文','','',0,'11:11:11','2000'),
(2,1.1,1.2,'中!文','A','a',1,'11:11:11','2001'),
(3,1.2,2.2,'中@文','B','a',1,'11:11:11','2002'),
(4,1.3,3.2,'中_文','C','a',1,'11:11:11','2003'),
(5,1.4,4.2,'中$文','D','a',1,'11:11:11','2004'),
(6,1.5,5.2,'中%文','E','a',1,'11:11:11','2005'),
(7,1.6,6.2,'中^文','F','a',1,'11:11:11','2006'),
(8,1.7,7.2,'中&文','G','a',1,'11:11:11','2007'),
(9,1.8,8.2,'中*文','H','a',1,'11:11:11','2011'),
(10,1.9,9.2,'中-文','I','a',1,'11:11:11','2012'),
(11,2.0,1.9,'中=文','J','a',1,'11:11:11','2013'),
(12,2.1,1.8,'中+文','K','a',1,'11:11:11','2010');
CREATE INDEX ind_1 ON t1(c0);
CREATE INDEX ind_2 ON t1(c8,c7);
#暂不支持，待执行后执行sql
#修改列加上自增约束和生成列
DROP TABLE IF EXISTS t1;
CREATE TABLE t1(c0 INT ,
c1 FLOAT ,
c2 DOUBLE,
c3 CHAR(10),
c4 VARCHAR(10),
c5 CHAR(10),
c6 INT,
c7 TIME,
c8 YEAR)
PARTITION BY LIST(c8) SUBPARTITION BY HASH(c0)
(PARTITION l1 VALUES IN (2000,2002,2004,2006,2008,2010,2012)
(SUBPARTITION s1,SUBPARTITION s2),
PARTITION l2 VALUES IN (2001,2003,2005,2007,2009,2011,2013)
(SUBPARTITION s3,SUBPARTITION s4)
);
INSERT INTO t1 VALUES(1,1.0,1.1,'中文','','',1000,'11:11:11','2000'),
(2,1.1,1.2,'中!文','A','a',1000,'11:11:11','2001'),
(3,1.2,2.2,'中@文','B','a',1000,'11:11:11','2002'),
(4,1.3,3.2,'中_文','C','a',1001,'11:11:11','2003'),
(5,1.4,4.2,'中$文','D','a',1001,'11:11:11','2004'),
(6,1.5,5.2,'中%文','E','a',1001,'11:11:11','2005'),
(7,1.6,6.2,'中^文','F','a',1002,'11:11:11','2006'),
(8,1.7,7.2,'中&文','G','a',1002,'11:11:11','2007'),
(9,1.8,8.2,'中*文','H','a',1002,'11:11:11','2008'),
(10,1.9,9.2,'中-文','I','a',1003,'11:11:11','2009'),
(11,2.0,1.9,'中=文','J','a',1003,'11:11:11','2010'),
(12,2.1,1.8,'中+文','K','a',1003,'11:11:11','2011');
ALTER TABLE t1 MODIFY c0 INT AUTO_INCREMENT AFTER c1;
ALTER TABLE t1 CHANGE c8 m8 YEAR AS (c6*2) STORED COMMENT '生成列1';
ERROR HY000: 'Changing the STORED status' is not supported for generated columns.
ALTER TABLE t1 CHANGE c0 m0 INT AS (c6*2) STORED COMMENT '生成列1';
ERROR HY000: 'Changing the STORED status' is not supported for generated columns.
INSERT INTO t1(c1,c2,c3,c4,c5,c6,c7,c8) VALUES(2.2,1.7,'中9文','L','b',1005,'15:15:15','2012');
SELECT * FROM t1 ORDER BY 1;
c1	c0	c2	c3	c4	c5	c6	c7	c8
1	1	1.1	中文			1000	11:11:11	2000
1.1	2	1.2	中!文	A	a	1000	11:11:11	2001
1.2	3	2.2	中@文	B	a	1000	11:11:11	2002
1.3	4	3.2	中_文	C	a	1001	11:11:11	2003
1.4	5	4.2	中$文	D	a	1001	11:11:11	2004
1.5	6	5.2	中%文	E	a	1001	11:11:11	2005
1.6	7	6.2	中^文	F	a	1002	11:11:11	2006
1.7	8	7.2	中&文	G	a	1002	11:11:11	2007
1.8	9	8.2	中*文	H	a	1002	11:11:11	2008
1.9	10	9.2	中-文	I	a	1003	11:11:11	2009
2	11	1.9	中=文	J	a	1003	11:11:11	2010
2.1	12	1.8	中+文	K	a	1003	11:11:11	2011
2.2	13	1.7	中9文	L	b	1005	15:15:15	2012
#修改生成列及生成列引用列
DROP TABLE IF EXISTS t1;
CREATE TABLE t1(c0 INT ,
c1 FLOAT ,
c2 DOUBLE,
c3 CHAR(10),
c4 VARCHAR(10),
c5 CHAR(10),
c6 INT,
c7 TIME,
c8 YEAR AS (c6*2) STORED COMMENT '生成列1')
PARTITION BY LIST(c8) SUBPARTITION BY HASH(c0)
(PARTITION l1 VALUES IN (2000,2002,2004,2006,2008,2010,2012)
(SUBPARTITION s1,SUBPARTITION s2),
PARTITION l2 VALUES IN (2001,2003,2005,2007,2009,2011,2013)
(SUBPARTITION s3,SUBPARTITION s4)
);
INSERT INTO t1(c0,c1,c2,c3,c4,c5,c6,c7) VALUES(1,1.0,1.1,'中文','','',1000,'11:11:11'),
(2,1.1,1.2,'中!文','A','a',1000,'11:11:11'),
(3,1.2,2.2,'中@文','B','a',1000,'11:11:11'),
(4,1.3,3.2,'中_文','C','a',1001,'11:11:11'),
(5,1.4,4.2,'中$文','D','a',1001,'11:11:11'),
(6,1.5,5.2,'中%文','E','a',1001,'11:11:11'),
(7,1.6,6.2,'中^文','F','a',1002,'11:11:11'),
(8,1.7,7.2,'中&文','G','a',1002,'11:11:11'),
(9,1.8,8.2,'中*文','H','a',1002,'11:11:11'),
(10,1.9,9.2,'中-文','I','a',1003,'11:11:11'),
(11,2.0,1.9,'中=文','J','a',1003,'11:11:11'),
(12,2.1,1.8,'中+文','K','a',1003,'11:11:11');
ALTER TABLE t1 MODIFY c8 YEAR  AS (c6*2-10) STORED COMMENT '生成列1';
Got one of the listed errors
ALTER TABLE t1 CHANGE c8 c8 YEAR  AS (c6*2) STORED COMMENT '生成列1' AFTER c6;
ALTER TABLE t1 MODIFY c6 INT DEFAULT 1000 AFTER c2;
INSERT INTO t1(c0,c1,c2,c3,c4,c5,c7) VALUES(13,2.2,1.7,'中+文','L','b','13:13:13');
ALTER TABLE t1 CHANGE c6 m6 INT;
INSERT INTO t1(c0,c1,c2,c3,c4,c5,m6,c7) VALUES(14,2.3,1.6,'中0文','M','c',1003,'13:14:14');
##########################PARTITION BY RANGE WITH SUBPARITIONS#############################
DROP TABLE IF EXISTS t1;
CREATE TABLE t1(c0 INT,
c1 FLOAT ,
c2 DOUBLE,
c3 CHAR(10),
c4 VARCHAR(10),
c5 CHAR(10),
c6 INT,
c7 DATE,
c8 YEAR)
PARTITION BY RANGE(c0)
SUBPARTITION BY HASH(c6) SUBPARTITIONS 3
(PARTITION l1 VALUES LESS THAN(7),
PARTITION l2 VALUES LESS THAN(15),
PARTITION l3 VALUES LESS THAN(20)
);
INSERT INTO t1 VALUES(1,1.0,1.1,'中文','','',0,'2010-10-11','2000'),
(2,1.1,1.2,'中!文','A','a',1,'2001-01-11','2001'),
(3,1.2,2.2,'中!文','B','a',2,'2016-02-11','2002'),
(4,1.3,3.2,'中!文','C','a',1,'2021-03-11','2003'),
(5,1.4,4.2,'中!文','D','a',2,'2011-11-01','2004'),
(6,1.5,5.2,'中!文','E','a',1,'2014-01-11','2005'),
(7,1.6,6.2,'中!文','F','a',3,'2011-11-01','2006'),
(8,1.7,7.2,'中!文','G','a',1,'2017-01-11','2007'),
(9,1.8,8.2,'中!文','H','a',4,'2013-11-01','2011'),
(10,1.9,9.2,'中!文','I','a',5,'2011-11-11','2012'),
(11,2.0,1.9,'中!文','J','a',6,'2015-01-01','2011'),
(12,2.1,1.8,'中!文','K','a',7,'2012-12-11','2012');
#修改列
ALTER TABLE t1 CHANGE c6 c6 INT(5) ZEROFILL AFTER c7;
INSERT INTO t1 VALUES(13,2.2,1.7,'中!文','L','b','2013-12-13',8,'2013');
#暂不支持，等支持后执行下面sql
DROP TABLE IF EXISTS t1;
CREATE TABLE t1(c0 INT,
c1 FLOAT ,
c2 DOUBLE,
c3 CHAR(10),
c4 VARCHAR(10),
c5 CHAR(10),
c6 INT,
c7 DATE,
c8 YEAR)
PARTITION BY RANGE(c0)
SUBPARTITION BY HASH(c6) SUBPARTITIONS 3
(PARTITION l1 VALUES LESS THAN(7),
PARTITION l2 VALUES LESS THAN(15),
PARTITION l3 VALUES LESS THAN(20)
);
INSERT INTO t1 VALUES(1,1.0,1.1,'中文','','',0,'2010-10-11','2000'),
(2,1.1,1.2,'中!文','A','a',1,'2001-01-11','2001'),
(3,1.2,2.2,'中!文','B','a',2,'2016-02-11','2002'),
(4,1.3,3.2,'中!文','C','a',1,'2021-03-11','2003'),
(5,1.4,4.2,'中!文','D','a',2,'2011-11-01','2004'),
(6,1.5,5.2,'中!文','E','a',1,'2014-01-11','2005'),
(7,1.6,6.2,'中!文','F','a',3,'2011-11-01','2006'),
(8,1.7,7.2,'中!文','G','a',1,'2017-01-11','2007'),
(9,1.8,8.2,'中!文','H','a',4,'2013-11-01','2011'),
(10,1.9,9.2,'中!文','I','a',5,'2011-11-11','2012'),
(11,2.0,1.9,'中!文','J','a',6,'2015-01-01','2011'),
(12,2.1,1.8,'中!文','K','a',7,'2012-12-11','2012');
ALTER TABLE t1 DROP SUBPARTITION l2sp0;
ALTER TABLE t1 CHANGE c0 m0 INT,DROP SUBPARTITION l2sp0;
ERROR 42000: You have an error in your SQL syntax; check the manual that corresponds to your OceanBase version for the right syntax to use near 'l2sp0' at line 1
ALTER TABLE t1 MODIFY c0 INT(3) ZEROFILL,DROP COLUMN c5,DROP SUBPARTITION l2sp0;
ERROR 42000: You have an error in your SQL syntax; check the manual that corresponds to your OceanBase version for the right syntax to use near 'l2sp0' at line 1
#删除主分区后新增列
ALTER TABLE t1 MODIFY c6 INT(4) ZEROFILL DEFAULT 0,DROP PARTITION l1;
ERROR 42000: You have an error in your SQL syntax; check the manual that corresponds to your OceanBase version for the right syntax to use near 'PARTITION l1' at line 1
ALTER TABLE t1 DROP PARTITION l1;
ALTER TABLE t1 CHANGE c6 c6 INT(4) ZEROFILL DEFAULT 0,ADD c9 VARCHAR(5) DEFAULT 'A' AFTER c6;
INSERT INTO t1 VALUES(13,2.2,1.7,'中文','L','b',8,'2011-11-11','2000');
INSERT INTO t1 VALUES(13,2.2,1.7,'中文','L','b',8,'B','2011-12-12','2000');
SELECT * FROM t1 ORDER BY c0;
c0	c1	c2	c3	c4	c5	c6	c9	c7	c8
7	1.6	6.2	中!文	F	a	0003	A	2011-11-01	2006
8	1.7	7.2	中!文	G	a	0001	A	2017-01-11	2007
9	1.8	8.2	中!文	H	a	0004	A	2013-11-01	2011
10	1.9	9.2	中!文	I	a	0005	A	2011-11-11	2012
11	2	1.9	中!文	J	a	0006	A	2015-01-01	2011
12	2.1	1.8	中!文	K	a	0007	A	2012-12-11	2012
13	2.2	1.7	中文	L	b	0008	B	2011-12-12	2000
ALTER TABLE t1 ADD PARTITION(PARTITION l1 VALUES LESS THAN(25));
ALTER TABLE t1 CHANGE c0 c0 INT AFTER c1,DROP PARTITION l1;
ERROR 42000: You have an error in your SQL syntax; check the manual that corresponds to your OceanBase version for the right syntax to use near 'PARTITION l1' at line 1
#OB不支持remove所有分区，故不测试
#修改列后新增分区
ALTER TABLE t1 CHANGE c0 c0 INT AFTER c1,ADD PARTITION (PARTITION l4 VALUES LESS THAN(30));
ERROR 42000: You have an error in your SQL syntax; check the manual that corresponds to your OceanBase version for the right syntax to use near 'PARTITION (PARTITION l4 VALUES LESS THAN(30))' at line 1
ALTER TABLE t1 MODIFY c0 INT AFTER c1,REORGANIZE PARTITION l3 INTO (PARTITION l4 VALUES LESS THAN(30));
ERROR 42000: You have an error in your SQL syntax; check the manual that corresponds to your OceanBase version for the right syntax to use near 'REORGANIZE PARTITION l3 INTO (PARTITION l4 VALUES LESS THAN(30))' at line 1
#修改列带有索引或者约束
DROP TABLE IF EXISTS t1;
CREATE TABLE t1(c0 INT ,
c1 FLOAT ,
c2 DOUBLE,
c3 CHAR(10),
c4 VARCHAR(10),
c5 CHAR(10),
c6 INT,
c7 DATE,
c8 YEAR)
PARTITION BY RANGE(c0)
(PARTITION l1 VALUES LESS THAN(7),
PARTITION l2 VALUES LESS THAN(15)
);
INSERT INTO t1 VALUES(1,1.0,1.1,'中文','','',0,'2010-10-11','2000'),
(2,1.1,1.2,'中!文','A','a',1,'2001-01-11','2001'),
(3,1.2,2.2,'中!文','B','a',2,'2016-02-11','2002'),
(4,1.3,3.2,'中!文','C','a',1,'2021-03-11','2003'),
(5,1.4,4.2,'中!文','D','a',2,'2011-11-01','2004'),
(6,1.5,5.2,'中!文','E','a',1,'2014-01-11','2005'),
(7,1.6,6.2,'中!文','F','a',3,'2011-11-01','2006'),
(8,1.7,7.2,'中!文','G','a',1,'2017-01-11','2007'),
(9,1.8,8.2,'中!文','H','a',4,'2013-11-01','2011'),
(10,1.9,9.2,'中!文','I','a',5,'2011-11-11','2012'),
(11,2.0,1.9,'中!文','J','a',6,'2015-01-01','2011'),
(12,2.1,1.8,'中!文','K','a',7,'2012-12-11','2012');
#暂不支持，待支持后执行sql
#唯一索引+常规索引+组合索引
DROP TABLE IF EXISTS t1;
CREATE TABLE t1(c0 INT ,
c1 FLOAT ,
c2 DOUBLE,
c3 CHAR(10),
c4 VARCHAR(10),
c5 CHAR(10),
c6 INT,
c7 DATE,
c8 YEAR,
UNIQUE KEY uk(c0,c8))
PARTITION BY RANGE(c8) SUBPARTITION BY HASH(c8)
(PARTITION l1 VALUES LESS THAN(2000)
(SUBPARTITION sb1,SUBPARTITION sb2),
PARTITION l2 VALUES LESS THAN(2005)
(SUBPARTITION sb3,SUBPARTITION sb4),
PARTITION l3 VALUES LESS THAN(2010)
(SUBPARTITION sb5,SUBPARTITION sb6),
PARTITION l4 VALUES LESS THAN(2015)
(SUBPARTITION sb7,SUBPARTITION sb8),
PARTITION l5 VALUES LESS THAN(2020)
(SUBPARTITION sb9,SUBPARTITION sb10)
);
INSERT INTO t1 VALUES(1,1.0,1.1,'中文','','',0,'2010-10-11','2000'),
(2,1.1,1.2,'中!文','A','a',1,'2001-01-11','2001'),
(3,1.2,2.2,'中!文','B','a',2,'2016-02-11','2002'),
(4,1.3,3.2,'中!文','C','a',1,'2021-03-11','2003'),
(5,1.4,4.2,'中!文','D','a',2,'2011-11-01','2004'),
(6,1.5,5.2,'中!文','E','a',1,'2014-01-11','2005'),
(7,1.6,6.2,'中!文','F','a',3,'2011-11-01','2006'),
(8,1.7,7.2,'中!文','G','a',1,'2017-01-11','2007'),
(9,1.8,8.2,'中!文','H','a',4,'2013-11-01','2011'),
(10,1.9,9.2,'中!文','I','a',5,'2011-11-11','2012'),
(11,2.0,1.9,'中!文','J','a',6,'2015-01-01','2013'),
(12,2.1,1.8,'中!文','K','a',7,'2012-12-11','2010');
CREATE INDEX ind_1 ON t1(c0);
CREATE INDEX ind_2 ON t1(c6,c8);
ALTER TABLE t1 CHANGE c8 c8 YEAR UNIQUE AFTER c6;
INSERT INTO t1 VALUES(13,2.2,1.7,'中-文','L','b',2,'2010','2012-02-01');
INSERT INTO t1 VALUES(13,2.2,1.7,'中-文','L','b',2,'2008','2012-10-10');
SELECT * FROM t1 ORDER BY 1;
c0	c1	c2	c3	c4	c5	c6	c7	c8
1	1	1.1	中文			0	2010-10-11	2000
2	1.1	1.2	中!文	A	a	1	2001-01-11	2001
3	1.2	2.2	中!文	B	a	2	2016-02-11	2002
4	1.3	3.2	中!文	C	a	1	2021-03-11	2003
5	1.4	4.2	中!文	D	a	2	2011-11-01	2004
6	1.5	5.2	中!文	E	a	1	2014-01-11	2005
7	1.6	6.2	中!文	F	a	3	2011-11-01	2006
8	1.7	7.2	中!文	G	a	1	2017-01-11	2007
9	1.8	8.2	中!文	H	a	4	2013-11-01	2011
10	1.9	9.2	中!文	I	a	5	2011-11-11	2012
11	2	1.9	中!文	J	a	6	2015-01-01	2013
12	2.1	1.8	中!文	K	a	7	2012-12-11	2010
ALTER TABLE t1 DROP INDEX c8;
INSERT INTO t1 VALUES(14,2.3,1.6,'中-文','M','c',3,'2008','2010-10-10');
SELECT * FROM t1 ORDER BY 1;
c0	c1	c2	c3	c4	c5	c6	c7	c8
1	1	1.1	中文			0	2010-10-11	2000
2	1.1	1.2	中!文	A	a	1	2001-01-11	2001
3	1.2	2.2	中!文	B	a	2	2016-02-11	2002
4	1.3	3.2	中!文	C	a	1	2021-03-11	2003
5	1.4	4.2	中!文	D	a	2	2011-11-01	2004
6	1.5	5.2	中!文	E	a	1	2014-01-11	2005
7	1.6	6.2	中!文	F	a	3	2011-11-01	2006
8	1.7	7.2	中!文	G	a	1	2017-01-11	2007
9	1.8	8.2	中!文	H	a	4	2013-11-01	2011
10	1.9	9.2	中!文	I	a	5	2011-11-11	2012
11	2	1.9	中!文	J	a	6	2015-01-01	2013
12	2.1	1.8	中!文	K	a	7	2012-12-11	2010
ALTER TABLE t1 CHANGE c8 m8 DATE,ADD CONSTRAINT uni_key UNIQUE KEY(m8);
ALTER TABLE t1 CHANGE c8 m8 YEAR AFTER c7,ADD CONSTRAINT uni_key UNIQUE KEY(m8);
ALTER TABLE t1 CHANGE c8 m8 YEAR,ADD CONSTRAINT uni_key UNIQUE KEY(m8);
DELETE FROM t1 WHERE c8='2008';
ALTER TABLE t1 CHANGE c8 m8 YEAR,ADD CONSTRAINT uni_key UNIQUE KEY(m8);
INSERT INTO t1 VALUES(13,2.2,1.7,'中-文','L','b',2,'2010','2002-10-10');
INSERT INTO t1 VALUES(13,2.2,1.7,'中-文','L','b',2,'2008','2003-10-10');
SELECT * FROM t1 ORDER BY 1;
c0	c1	c2	c3	c4	c5	c6	c7	m8
1	1	1.1	中文			0	2010-10-11	2000
2	1.1	1.2	中!文	A	a	1	2001-01-11	2001
3	1.2	2.2	中!文	B	a	2	2016-02-11	2002
4	1.3	3.2	中!文	C	a	1	2021-03-11	2003
5	1.4	4.2	中!文	D	a	2	2011-11-01	2004
6	1.5	5.2	中!文	E	a	1	2014-01-11	2005
7	1.6	6.2	中!文	F	a	3	2011-11-01	2006
8	1.7	7.2	中!文	G	a	1	2017-01-11	2007
9	1.8	8.2	中!文	H	a	4	2013-11-01	2011
10	1.9	9.2	中!文	I	a	5	2011-11-11	2012
11	2	1.9	中!文	J	a	6	2015-01-01	2013
12	2.1	1.8	中!文	K	a	7	2012-12-11	2010
ALTER TABLE t1 DROP INDEX uni_key;
INSERT INTO t1 VALUES(14,2.3,1.6,'中-文','M','c',3,'2008','2004-11-14');
SELECT * FROM t1 ORDER BY 1;
c0	c1	c2	c3	c4	c5	c6	c7	m8
1	1	1.1	中文			0	2010-10-11	2000
2	1.1	1.2	中!文	A	a	1	2001-01-11	2001
3	1.2	2.2	中!文	B	a	2	2016-02-11	2002
4	1.3	3.2	中!文	C	a	1	2021-03-11	2003
5	1.4	4.2	中!文	D	a	2	2011-11-01	2004
6	1.5	5.2	中!文	E	a	1	2014-01-11	2005
7	1.6	6.2	中!文	F	a	3	2011-11-01	2006
8	1.7	7.2	中!文	G	a	1	2017-01-11	2007
9	1.8	8.2	中!文	H	a	4	2013-11-01	2011
10	1.9	9.2	中!文	I	a	5	2011-11-11	2012
11	2	1.9	中!文	J	a	6	2015-01-01	2013
12	2.1	1.8	中!文	K	a	7	2012-12-11	2010
ALTER TABLE t1 MODIFY m8 YEAR AFTER c7,ADD CONSTRAINT uni_key UNIQUE KEY(c6,m8);
INSERT INTO t1 VALUES(15,2.4,1.5,'中0文','N','d',3,'2003-10-10','2008');
SELECT * FROM t1 ORDER BY 1;
c0	c1	c2	c3	c4	c5	c6	c7	m8
1	1	1.1	中文			0	2010-10-11	2000
2	1.1	1.2	中!文	A	a	1	2001-01-11	2001
3	1.2	2.2	中!文	B	a	2	2016-02-11	2002
4	1.3	3.2	中!文	C	a	1	2021-03-11	2003
5	1.4	4.2	中!文	D	a	2	2011-11-01	2004
6	1.5	5.2	中!文	E	a	1	2014-01-11	2005
7	1.6	6.2	中!文	F	a	3	2011-11-01	2006
8	1.7	7.2	中!文	G	a	1	2017-01-11	2007
9	1.8	8.2	中!文	H	a	4	2013-11-01	2011
10	1.9	9.2	中!文	I	a	5	2011-11-11	2012
11	2	1.9	中!文	J	a	6	2015-01-01	2013
12	2.1	1.8	中!文	K	a	7	2012-12-11	2010
15	2.4	1.5	中0文	N	d	3	2003-10-10	2008
INSERT INTO t1 VALUES(15,2.4,1.5,'中0文','N','d',1,'2005-12-10','2009');
SELECT * FROM t1 ORDER BY 1,7,9;
c0	c1	c2	c3	c4	c5	c6	c7	m8
1	1	1.1	中文			0	2010-10-11	2000
2	1.1	1.2	中!文	A	a	1	2001-01-11	2001
3	1.2	2.2	中!文	B	a	2	2016-02-11	2002
4	1.3	3.2	中!文	C	a	1	2021-03-11	2003
5	1.4	4.2	中!文	D	a	2	2011-11-01	2004
6	1.5	5.2	中!文	E	a	1	2014-01-11	2005
7	1.6	6.2	中!文	F	a	3	2011-11-01	2006
8	1.7	7.2	中!文	G	a	1	2017-01-11	2007
9	1.8	8.2	中!文	H	a	4	2013-11-01	2011
10	1.9	9.2	中!文	I	a	5	2011-11-11	2012
11	2	1.9	中!文	J	a	6	2015-01-01	2013
12	2.1	1.8	中!文	K	a	7	2012-12-11	2010
15	2.4	1.5	中0文	N	d	1	2005-12-10	2009
15	2.4	1.5	中0文	N	d	3	2003-10-10	2008
#暂不知此，待支持后执行sql
#修改列加上常规索引/组合索引
DROP TABLE IF EXISTS t1;
CREATE TABLE t1(c0 INT ,
c1 FLOAT ,
c2 DOUBLE,
c3 CHAR(10),
c4 VARCHAR(10),
c5 CHAR(10),
c6 INT,
c7 DATE,
c8 YEAR,
UNIQUE KEY uk(c0,c8))
PARTITION BY RANGE(c8) SUBPARTITION BY HASH(c8)
(PARTITION l1 VALUES LESS THAN(2000)
(SUBPARTITION sb1,SUBPARTITION sb2),
PARTITION l2 VALUES LESS THAN(2005)
(SUBPARTITION sb3,SUBPARTITION sb4),
PARTITION l3 VALUES LESS THAN(2010)
(SUBPARTITION sb5,SUBPARTITION sb6),
PARTITION l4 VALUES LESS THAN(2015)
(SUBPARTITION sb7,SUBPARTITION sb8),
PARTITION l5 VALUES LESS THAN(2020)
(SUBPARTITION sb9,SUBPARTITION sb10)
);
INSERT INTO t1 VALUES(1,1.0,1.1,'中文','','',0,'2010-10-11','2000'),
(2,1.1,1.2,'中!文','A','a',1,'2001-01-11','2001'),
(3,1.2,2.2,'中!文','B','a',2,'2016-02-11','2002'),
(4,1.3,3.2,'中!文','C','a',1,'2021-03-11','2003'),
(5,1.4,4.2,'中!文','D','a',2,'2011-11-01','2004'),
(6,1.5,5.2,'中!文','E','a',1,'2014-01-11','2005'),
(7,1.6,6.2,'中!文','F','a',3,'2011-11-01','2006'),
(8,1.7,7.2,'中!文','G','a',1,'2017-01-11','2007'),
(9,1.8,8.2,'中!文','H','a',4,'2013-11-01','2011'),
(10,1.9,9.2,'中!文','I','a',5,'2011-11-11','2012'),
(11,2.0,1.9,'中!文','J','a',6,'2015-01-01','2013'),
(12,2.1,1.8,'中!文','K','a',7,'2012-12-11','2010');
CREATE INDEX ind_1 ON t1(c0);
CREATE INDEX ind_2 ON t1(c6,c8);
#暂不支持
DROP TABLE IF EXISTS t2;
DROP TABLE IF EXISTS t1;
#########Empty recycle bin, delete test database, tables, etc##########
purge recyclebin;
