purge recyclebin;
DROP TABLE IF EXISTS t2;
DROP TABLE IF EXISTS t1;
DROP TABLE IF EXISTS t2;
#mysql_add-4
#mysql_add-4-3
#mysql_add-4-3-1
#单基表试图
#基表带有不同类型数据和不同约束以及不同索引
#CREATE DATA (DATA TYPE + INDEX + CONSTRAINT)
CREATE TABLE t1(c0 INT(5) ZEROFILL,
c1 FLOAT AUTO_INCREMENT PRIMARY KEY,
c2 DOUBLE NOT NULL,
c3 CHAR(10) DEFAULT 'A',
c4 VARCHAR(10) UNIQUE,
c5 CHAR(10),
c6 INT,
c7 TIME,
c8 YEAR ,CHECK(c8>=2000));
INSERT INTO t1 VALUES(1,1.0,1.1,'中文','','',0,'11:11:11','2000'),
(2,1.1,1.2,'中!文','A','a',1,'11:11:11','2001'),
(3,1.2,2.2,'中!文','B','a',1,'11:11:11','2002'),
(4,1.3,3.2,'中!文','C','a',1,'11:11:11','2003'),
(5,1.4,4.2,'中!文','D','a',1,'11:11:11','2004'),
(6,1.5,5.2,'中!文','E','a',1,'11:11:11','2005'),
(7,1.6,6.2,'中!文','F','a',1,'11:11:11','2006'),
(8,1.7,7.2,'中!文','G','a',1,'11:11:11','2007'),
(9,1.8,8.2,'中!文','H','a',1,'11:11:11','2011'),
(10,1.9,9.2,'中!文','I','a',1,'11:11:11','2012'),
(11,2.0,1.9,'中!文','J','a',1,'11:11:11','2011'),
(12,2.1,1.8,'中!文','K','a',1,'11:11:11','2012');
CREATE INDEX ind_1 ON t1(c5);
CREATE INDEX ind_2 ON t1(c6,c7);
drop view v1;
CREATE VIEW v1 AS SELECT * FROM t1;
SELECT * FROM v1 ORDER BY c0;
c0	c1	c2	c3	c4	c5	c6	c7	c8
00001	1	1.1	中文			0	11:11:11	2000
00002	1.1	1.2	中!文	A	a	1	11:11:11	2001
00003	1.2	2.2	中!文	B	a	1	11:11:11	2002
00004	1.3	3.2	中!文	C	a	1	11:11:11	2003
00005	1.4	4.2	中!文	D	a	1	11:11:11	2004
00006	1.5	5.2	中!文	E	a	1	11:11:11	2005
00007	1.6	6.2	中!文	F	a	1	11:11:11	2006
00008	1.7	7.2	中!文	G	a	1	11:11:11	2007
00009	1.8	8.2	中!文	H	a	1	11:11:11	2011
00010	1.9	9.2	中!文	I	a	1	11:11:11	2012
00011	2	1.9	中!文	J	a	1	11:11:11	2011
00012	2.1	1.8	中!文	K	a	1	11:11:11	2012
DESC v1;
Field	Type	Null	Key	Default	Extra
c0	int(5) unsigned	YES		NULL	
c1	float	NO		NULL	
c2	double	NO		NULL	
c3	char(10)	YES			
c4	varchar(10)	YES		NULL	
c5	char(10)	YES		NULL	
c6	int(11)	YES		NULL	
c7	time	YES		NULL	
c8	year(4)	YES		NULL	
ALTER TABLE v1 CHANGE c1 c1 INT NOT NULL DEFAULT 0;
ALTER TABLE v1 MODIFY c1 INT NOT NULL DEFAULT 0;
ALTER TABLE t1 CHANGE c0 c0 INT NOT NULL DEFAULT 0 AFTER c2;
DESC v1;
Field	Type	Null	Key	Default	Extra
c0	int(11)	NO			
c1	float	NO		NULL	
c2	double	NO		NULL	
c3	char(10)	YES			
c4	varchar(10)	YES		NULL	
c5	char(10)	YES		NULL	
c6	int(11)	YES		NULL	
c7	time	YES		NULL	
c8	year(4)	YES		NULL	
INSERT INTO v1 VALUES(2.2,13,1.7,'中!文','L','b',2,'21:21:21','2013',0);
INSERT INTO v1 VALUES(2.2,13,1.7,'中!文','L','b',2,'21:21:21','2013');
SELECT * FROM v1 ORDER BY c0;
c0	c1	c2	c3	c4	c5	c6	c7	c8
1	1	1.1	中文			0	11:11:11	2000
2	1.1	1.2	中!文	A	a	1	11:11:11	2001
2	13	1.7	中!文	L	b	2	21:21:21	2013
3	1.2	2.2	中!文	B	a	1	11:11:11	2002
4	1.3	3.2	中!文	C	a	1	11:11:11	2003
5	1.4	4.2	中!文	D	a	1	11:11:11	2004
6	1.5	5.2	中!文	E	a	1	11:11:11	2005
7	1.6	6.2	中!文	F	a	1	11:11:11	2006
8	1.7	7.2	中!文	G	a	1	11:11:11	2007
9	1.8	8.2	中!文	H	a	1	11:11:11	2011
10	1.9	9.2	中!文	I	a	1	11:11:11	2012
11	2	1.9	中!文	J	a	1	11:11:11	2011
12	2.1	1.8	中!文	K	a	1	11:11:11	2012
SELECT * FROM t1 ORDER BY c0;
c1	c2	c0	c3	c4	c5	c6	c7	c8
1	1.1	1	中文			0	11:11:11	2000
1.1	1.2	2	中!文	A	a	1	11:11:11	2001
13	1.7	2	中!文	L	b	2	21:21:21	2013
1.2	2.2	3	中!文	B	a	1	11:11:11	2002
1.3	3.2	4	中!文	C	a	1	11:11:11	2003
1.4	4.2	5	中!文	D	a	1	11:11:11	2004
1.5	5.2	6	中!文	E	a	1	11:11:11	2005
1.6	6.2	7	中!文	F	a	1	11:11:11	2006
1.7	7.2	8	中!文	G	a	1	11:11:11	2007
1.8	8.2	9	中!文	H	a	1	11:11:11	2011
1.9	9.2	10	中!文	I	a	1	11:11:11	2012
2	1.9	11	中!文	J	a	1	11:11:11	2011
2.1	1.8	12	中!文	K	a	1	11:11:11	2012
ALTER TABLE t1 CHANGE c0 m0 INT(6) ZEROFILL NOT NULL;
DESC v1;
INSERT INTO v1 VALUES(2.3,14,1.8,'中0文','M','c',3,'23:23:23','2015');
SELECT * FROM v1 ORDER BY c0;
DROP VIEW v1;
CREATE VIEW v1 AS SELECT * FROM t1;
SELECT * FROM v1 ORDER BY 1;
c1	c2	m0	c3	c4	c5	c6	c7	c8
1	1.1	000001	中文			0	11:11:11	2000
1.1	1.2	000002	中!文	A	a	1	11:11:11	2001
1.2	2.2	000003	中!文	B	a	1	11:11:11	2002
1.3	3.2	000004	中!文	C	a	1	11:11:11	2003
1.4	4.2	000005	中!文	D	a	1	11:11:11	2004
1.5	5.2	000006	中!文	E	a	1	11:11:11	2005
1.6	6.2	000007	中!文	F	a	1	11:11:11	2006
1.7	7.2	000008	中!文	G	a	1	11:11:11	2007
1.8	8.2	000009	中!文	H	a	1	11:11:11	2011
1.9	9.2	000010	中!文	I	a	1	11:11:11	2012
2	1.9	000011	中!文	J	a	1	11:11:11	2011
2.1	1.8	000012	中!文	K	a	1	11:11:11	2012
13	1.7	000002	中!文	L	b	2	21:21:21	2013
DESC v1;
Field	Type	Null	Key	Default	Extra
c1	float	NO		NULL	
c2	double	NO		NULL	
m0	int(6) unsigned	NO		NULL	
c3	char(10)	YES			
c4	varchar(10)	YES		NULL	
c5	char(10)	YES		NULL	
c6	int(11)	YES		NULL	
c7	time	YES		NULL	
c8	year(4)	YES		NULL	
ALTER TABLE t1 MODIFY m0 FLOAT(5,0) DEFAULT 0 FIRST;
INSERT INTO v1 VALUES(2.2,1.6,13,'中!文','M','c',3,'21:31:31','2033');
DROP TABLE t1;
CREATE TABLE t1(c0 INT(5) ZEROFILL,
c1 FLOAT AUTO_INCREMENT PRIMARY KEY,
c2 DOUBLE NOT NULL,
c3 CHAR(10) DEFAULT 'A',
c4 VARCHAR(10) UNIQUE,
c5 CHAR(10),
c6 INT,
c7 TIME,
c8 YEAR ,CHECK(c8>=2000));
INSERT INTO t1 VALUES(1,1.0,1.1,'中文','','',0,'11:11:11','2000'),
(2,1.1,1.2,'中!文','A','a',1,'11:11:11','2001'),
(3,1.2,2.2,'中!文','B','a',1,'11:11:11','2002'),
(4,1.3,3.2,'中!文','C','a',1,'11:11:11','2003'),
(5,1.4,4.2,'中!文','D','a',1,'11:11:11','2004'),
(6,1.5,5.2,'中!文','E','a',1,'11:11:11','2005'),
(7,1.6,6.2,'中!文','F','a',1,'11:11:11','2006'),
(8,1.7,7.2,'中!文','G','a',1,'11:11:11','2007'),
(9,1.8,8.2,'中!文','H','a',1,'11:11:11','2011'),
(10,1.9,9.2,'中!文','I','a',1,'11:11:11','2012'),
(11,2.0,1.9,'中!文','J','a',1,'11:11:11','2011'),
(12,2.1,1.8,'中!文','K','a',1,'11:11:11','2012');
CREATE INDEX ind_1 ON t1(c5);
CREATE INDEX ind_2 ON t1(c6,c7);
DROP VIEW v1;
CREATE VIEW v1 AS SELECT * FROM t1;
SELECT * FROM v1 ORDER BY 1;
c0	c1	c2	c3	c4	c5	c6	c7	c8
00001	1	1.1	中文			0	11:11:11	2000
00002	1.1	1.2	中!文	A	a	1	11:11:11	2001
00003	1.2	2.2	中!文	B	a	1	11:11:11	2002
00004	1.3	3.2	中!文	C	a	1	11:11:11	2003
00005	1.4	4.2	中!文	D	a	1	11:11:11	2004
00006	1.5	5.2	中!文	E	a	1	11:11:11	2005
00007	1.6	6.2	中!文	F	a	1	11:11:11	2006
00008	1.7	7.2	中!文	G	a	1	11:11:11	2007
00009	1.8	8.2	中!文	H	a	1	11:11:11	2011
00010	1.9	9.2	中!文	I	a	1	11:11:11	2012
00011	2	1.9	中!文	J	a	1	11:11:11	2011
00012	2.1	1.8	中!文	K	a	1	11:11:11	2012
DESC v1;
Field	Type	Null	Key	Default	Extra
c0	int(5) unsigned	YES		NULL	
c1	float	NO		NULL	
c2	double	NO		NULL	
c3	char(10)	YES			
c4	varchar(10)	YES		NULL	
c5	char(10)	YES		NULL	
c6	int(11)	YES		NULL	
c7	time	YES		NULL	
c8	year(4)	YES		NULL	
#多基表试图
DROP VIEW IF EXISTS v1;
DROP TABLE IF EXISTS t2;
DROP TABLE IF EXISTS t1;
CREATE TABLE t1(c0 INT(5) PRIMARY KEY,
c1 FLOAT ,
c2 DOUBLE NOT NULL,
c3 CHAR(10) DEFAULT 'A',
c4 VARCHAR(10) UNIQUE,
c5 CHAR(10),
c6 INT,
c7 TIME,
c8 YEAR ,CHECK(c8>=2000));
CREATE TABLE t2(c0 INT(5),
c1 FLOAT,
c2 DOUBLE NOT NULL,
c3 CHAR(10) DEFAULT 'A',
c4 VARCHAR(10) UNIQUE,
c5 CHAR(10),
c6 INT,
c7 TIME,
c8 YEAR ,CHECK(c8>=2000),
CONSTRAINT fk_c0_c0 FOREIGN KEY(c0) REFERENCES t1(c0));
INSERT INTO t1 VALUES(1,1.0,1.1,'中文','','',0,'11:11:11','2000'),
(2,1.1,1.2,'中!文','A','a',1,'11:11:11','2001'),
(3,1.2,2.2,'中!文','B','a',1,'11:11:11','2002'),
(4,1.3,3.2,'中!文','C','a',1,'11:11:11','2003'),
(5,1.4,4.2,'中!文','D','a',1,'11:11:11','2004'),
(6,1.5,5.2,'中!文','E','a',1,'11:11:11','2005'),
(7,1.6,6.2,'中!文','F','a',1,'11:11:11','2006'),
(8,1.7,7.2,'中!文','G','a',1,'11:11:11','2007'),
(9,1.8,8.2,'中!文','H','a',1,'11:11:11','2011'),
(10,1.9,9.2,'中!文','I','a',1,'11:11:11','2012'),
(11,2.0,1.9,'中!文','J','a',1,'11:11:11','2011'),
(12,2.1,1.8,'中!文','K','a',1,'11:11:11','2012');
INSERT INTO t2 VALUES(1,1.0,1.1,'中文','','',0,'11:11:11','2000'),
(2,1.1,1.2,'中!文','A','a',1,'11:11:11','2001'),
(3,1.2,2.2,'中!文','B','a',1,'11:11:11','2002'),
(4,1.3,3.2,'中!文','C','a',1,'11:11:11','2003'),
(5,1.4,4.2,'中!文','D','a',1,'11:11:11','2004'),
(6,1.5,5.2,'中!文','E','a',1,'11:11:11','2005'),
(7,1.6,6.2,'中!文','F','a',1,'11:11:11','2006'),
(8,1.7,7.2,'中!文','G','a',1,'11:11:11','2007'),
(9,1.8,8.2,'中!文','H','a',1,'11:11:11','2011'),
(10,1.9,9.2,'中!文','I','a',1,'11:11:11','2012'),
(11,2.0,1.9,'中!文','J','a',1,'11:11:11','2011'),
(12,2.1,1.8,'中!文','K','a',1,'11:11:11','2012');
CREATE INDEX ind_1 ON t1(c5);
CREATE INDEX ind_2 ON t2(c6,c7);
CREATE VIEW v1 AS SELECT t1.c0,t2.c1,t1.c3,t2.c4,t1.c5,t2.c6,t1.c7,t2.c8 FROM t1 JOIN t2 ON t1.c0=t2.c0;
SELECT * FROM v1 ORDER BY 1;
c0	c1	c3	c4	c5	c6	c7	c8
1	1	中文			0	11:11:11	2000
2	1.1	中!文	A	a	1	11:11:11	2001
3	1.2	中!文	B	a	1	11:11:11	2002
4	1.3	中!文	C	a	1	11:11:11	2003
5	1.4	中!文	D	a	1	11:11:11	2004
6	1.5	中!文	E	a	1	11:11:11	2005
7	1.6	中!文	F	a	1	11:11:11	2006
8	1.7	中!文	G	a	1	11:11:11	2007
9	1.8	中!文	H	a	1	11:11:11	2011
10	1.9	中!文	I	a	1	11:11:11	2012
11	2	中!文	J	a	1	11:11:11	2011
12	2.1	中!文	K	a	1	11:11:11	2012
DESC v1;
Field	Type	Null	Key	Default	Extra
c0	int(5)	NO		NULL	
c1	float	YES		NULL	
c3	char(10)	YES			
c4	varchar(10)	YES		NULL	
c5	char(10)	YES		NULL	
c6	int(11)	YES		NULL	
c7	time	YES		NULL	
c8	year(4)	YES		NULL	
ALTER TABLE v1 CHANGE c3 m3 VARCHAR(10) NOT NULL,MODIFY c5 BINARY(10) DEFAULT 'A' AFTER c1;
ALTER TABLE t2 CHANGE c3 m3 VARCHAR(10) NOT NULL,MODIFY c5 BINARY(10) DEFAULT 'A' AFTER c1;
DESC t2;
Field	Type	Null	Key	Default	Extra
c0	int(5)	YES		NULL	
c1	float	YES		NULL	
c5	binary(10)	YES		A	
c2	double	NO		NULL	
m3	varchar(10)	NO		NULL	
c4	varchar(10)	YES	UNI	NULL	
c6	int(11)	YES	MUL	NULL	
c7	time	YES		NULL	
c8	year(4)	YES		NULL	
DESC v1;
Field	Type	Null	Key	Default	Extra
c0	int(5)	NO		NULL	
c1	float	YES		NULL	
c3	char(10)	YES			
c4	varchar(10)	YES		NULL	
c5	char(10)	YES		NULL	
c6	int(11)	YES		NULL	
c7	time	YES		NULL	
c8	year(4)	YES		NULL	
SELECT * FROM v1 ORDER BY 1;
c0	c1	c3	c4	c5	c6	c7	c8
1	1	中文			0	11:11:11	2000
2	1.1	中!文	A	a	1	11:11:11	2001
3	1.2	中!文	B	a	1	11:11:11	2002
4	1.3	中!文	C	a	1	11:11:11	2003
5	1.4	中!文	D	a	1	11:11:11	2004
6	1.5	中!文	E	a	1	11:11:11	2005
7	1.6	中!文	F	a	1	11:11:11	2006
8	1.7	中!文	G	a	1	11:11:11	2007
9	1.8	中!文	H	a	1	11:11:11	2011
10	1.9	中!文	I	a	1	11:11:11	2012
11	2	中!文	J	a	1	11:11:11	2011
12	2.1	中!文	K	a	1	11:11:11	2012
UPDATE v1 SET c0=13,c6=10 WHERE c1=1.1;
SELECT * FROM t2 ORDER BY 1;
c0	c1	c5	c2	m3	c4	c6	c7	c8
1	1	          	1.1	中文		0	11:11:11	2000
2	1.1	a         	1.2	中!文	A	1	11:11:11	2001
3	1.2	a         	2.2	中!文	B	1	11:11:11	2002
4	1.3	a         	3.2	中!文	C	1	11:11:11	2003
5	1.4	a         	4.2	中!文	D	1	11:11:11	2004
6	1.5	a         	5.2	中!文	E	1	11:11:11	2005
7	1.6	a         	6.2	中!文	F	1	11:11:11	2006
8	1.7	a         	7.2	中!文	G	1	11:11:11	2007
9	1.8	a         	8.2	中!文	H	1	11:11:11	2011
10	1.9	a         	9.2	中!文	I	1	11:11:11	2012
11	2	a         	1.9	中!文	J	1	11:11:11	2011
12	2.1	a         	1.8	中!文	K	1	11:11:11	2012
UPDATE t2 SET c8='2013',c6=10 WHERE c1 LIKE'1.1%';
SELECT * FROM t2 ORDER BY 1;
c0	c1	c5	c2	m3	c4	c6	c7	c8
1	1	          	1.1	中文		0	11:11:11	2000
2	1.1	a         	1.2	中!文	A	10	11:11:11	2013
3	1.2	a         	2.2	中!文	B	1	11:11:11	2002
4	1.3	a         	3.2	中!文	C	1	11:11:11	2003
5	1.4	a         	4.2	中!文	D	1	11:11:11	2004
6	1.5	a         	5.2	中!文	E	1	11:11:11	2005
7	1.6	a         	6.2	中!文	F	1	11:11:11	2006
8	1.7	a         	7.2	中!文	G	1	11:11:11	2007
9	1.8	a         	8.2	中!文	H	1	11:11:11	2011
10	1.9	a         	9.2	中!文	I	1	11:11:11	2012
11	2	a         	1.9	中!文	J	1	11:11:11	2011
12	2.1	a         	1.8	中!文	K	1	11:11:11	2012
#新增、修改、删除基表列，对视图的影响
DROP VIEW IF EXISTS v1;
CREATE VIEW v1 AS SELECT t1.c0,t2.c2,t1.c3,t2.c4,t1.c5,t2.c6,t1.c7,t2.c8 FROM t1 JOIN t2 ON t1.c0=t2.c0;
SELECT * FROM v1 ORDER BY 1;
c0	c2	c3	c4	c5	c6	c7	c8
1	1.1	中文			0	11:11:11	2000
2	1.2	中!文	A	a	10	11:11:11	2013
3	2.2	中!文	B	a	1	11:11:11	2002
4	3.2	中!文	C	a	1	11:11:11	2003
5	4.2	中!文	D	a	1	11:11:11	2004
6	5.2	中!文	E	a	1	11:11:11	2005
7	6.2	中!文	F	a	1	11:11:11	2006
8	7.2	中!文	G	a	1	11:11:11	2007
9	8.2	中!文	H	a	1	11:11:11	2011
10	9.2	中!文	I	a	1	11:11:11	2012
11	1.9	中!文	J	a	1	11:11:11	2011
12	1.8	中!文	K	a	1	11:11:11	2012
DESC v1;
Field	Type	Null	Key	Default	Extra
c0	int(5)	NO		NULL	
c2	double	NO		NULL	
c3	char(10)	YES			
c4	varchar(10)	YES		NULL	
c5	char(10)	YES		NULL	
c6	int(11)	YES		NULL	
c7	time	YES		NULL	
c8	year(4)	YES		NULL	
UPDATE v1 SET c0=13,c6=10 WHERE c2=1.1;
UPDATE v1 SET c5='b',c3='中0文' WHERE c2=1.1;
SELECT * FROM v1 ORDER BY 1;
c0	c2	c3	c4	c5	c6	c7	c8
1	1.1	中0文		b	0	11:11:11	2000
2	1.2	中!文	A	a	10	11:11:11	2013
3	2.2	中!文	B	a	1	11:11:11	2002
4	3.2	中!文	C	a	1	11:11:11	2003
5	4.2	中!文	D	a	1	11:11:11	2004
6	5.2	中!文	E	a	1	11:11:11	2005
7	6.2	中!文	F	a	1	11:11:11	2006
8	7.2	中!文	G	a	1	11:11:11	2007
9	8.2	中!文	H	a	1	11:11:11	2011
10	9.2	中!文	I	a	1	11:11:11	2012
11	1.9	中!文	J	a	1	11:11:11	2011
12	1.8	中!文	K	a	1	11:11:11	2012
SELECT * FROM t1 ORDER BY 1;
c0	c1	c2	c3	c4	c5	c6	c7	c8
1	1	1.1	中0文		b	0	11:11:11	2000
2	1.1	1.2	中!文	A	a	1	11:11:11	2001
3	1.2	2.2	中!文	B	a	1	11:11:11	2002
4	1.3	3.2	中!文	C	a	1	11:11:11	2003
5	1.4	4.2	中!文	D	a	1	11:11:11	2004
6	1.5	5.2	中!文	E	a	1	11:11:11	2005
7	1.6	6.2	中!文	F	a	1	11:11:11	2006
8	1.7	7.2	中!文	G	a	1	11:11:11	2007
9	1.8	8.2	中!文	H	a	1	11:11:11	2011
10	1.9	9.2	中!文	I	a	1	11:11:11	2012
11	2	1.9	中!文	J	a	1	11:11:11	2011
12	2.1	1.8	中!文	K	a	1	11:11:11	2012
SELECT * FROM t2 ORDER BY 1;
c0	c1	c5	c2	m3	c4	c6	c7	c8
1	1	          	1.1	中文		0	11:11:11	2000
2	1.1	a         	1.2	中!文	A	10	11:11:11	2013
3	1.2	a         	2.2	中!文	B	1	11:11:11	2002
4	1.3	a         	3.2	中!文	C	1	11:11:11	2003
5	1.4	a         	4.2	中!文	D	1	11:11:11	2004
6	1.5	a         	5.2	中!文	E	1	11:11:11	2005
7	1.6	a         	6.2	中!文	F	1	11:11:11	2006
8	1.7	a         	7.2	中!文	G	1	11:11:11	2007
9	1.8	a         	8.2	中!文	H	1	11:11:11	2011
10	1.9	a         	9.2	中!文	I	1	11:11:11	2012
11	2	a         	1.9	中!文	J	1	11:11:11	2011
12	2.1	a         	1.8	中!文	K	1	11:11:11	2012
DROP TABLE IF EXISTS t2;
DROP TABLE IF EXISTS t1;
DROP VIEW IF EXISTS v1;
#########Empty recycle bin, delete test database, tables, etc##########
purge recyclebin;
