##################################子查询的形式##################################
######使用子查询创建table######
drop table stu;
drop table stu1;
drop view stu_view;
drop view stu1_view;
drop synonym stu1_syn;
drop synonym stu_syn;
drop table stu_cp;
drop table stu1_cp;
create table stu(s1 number, child nvarchar2(6), parent nvarchar2(6));
insert into stu values(0,0,0);
insert into stu values(1,'中国','亚太');
insert into stu values(2,'北京','中国');
insert into stu values(3,'浙江','中国');
insert into stu values(4,'余杭区','浙江');
insert into stu values(5,'西湖区','浙江');
insert into stu values(6,'北京','中国');
insert into stu values(7,'首尔','韩国');
insert into stu values(8,'朝阳区','北京');
create index stu_parent on stu(parent);
# 不支持使用层次查询来create table
create table stu1 as select level lev, t.* from stu t
start with t.parent in ('亚太', '中国')
connect by nocycle t.parent = prior t.child order siblings by t.s1,t.child;
drop table stu1;
# 不支持使用层次查询来create table
create table stu1 as select level lev, t.* from (select t1.s1 s1, t1.child child, t2.parent parent from stu t1, stu t2 where t1.child = t2.child) t
start with t.parent in (select parent from stu where parent not in ('浙江','北京','韩国'))
connect by nocycle prior t.parent = t.child order siblings by t.s1,t.child;
drop table stu1;
create table stu1 as select level lev, t.* from (select t1.s1 s1, t1.child child, t2.parent parent from stu t1, stu t2 where t1.child = t2.child) t
start with t.parent in (select parent from stu where parent not in ('浙江','北京','韩国'))
connect by nocycle t.parent = prior t.child order siblings by t.s1,t.child;
drop table stu1;
create table stu1 as select level, t.child, t.parent from (select t1.s1 s1, t1.child child, t2.parent parent from stu t1, stu t2 where t1.child = t2.child) t
start with t.parent in (select parent from stu where parent not in ('浙江','北京','韩国'))
connect by nocycle t.parent = prior t.child group by level,child,parent having child <> (select '0' from dual);
ERROR HY000: must name LEVEL with a column alias
drop table stu1;
create table stu1 as select level, t.* from (select t1.s1 s1, t1.child child, t2.parent parent from stu t1, stu t2 where t1.child = t2.child) t
connect by nocycle t.parent = prior t.child order siblings by t.s1,t.child;
ERROR HY000: must name LEVEL with a column alias
drop table stu1;
drop view stu_view;
# 使用层次查询来create view
# 不支持使用层次查询来create view
create view stu_view as select level lev, t.* from (select t1.s1 s1, t1.child child, t2.parent parent from stu t1, stu t2 where t1.child = t2.child) t
start with t.parent in (select parent from stu where parent not in ('浙江','北京','韩国'))
connect by nocycle prior t.parent = t.child order siblings by t.s1,t.child;
drop view stu_view;
create view stu_view as select level, t.child, t.parent from (select t1.s1 s1, t1.child child, t2.parent parent from stu t1, stu t2 where t1.child = t2.child) t
start with t.parent in (select parent from stu where parent not in ('浙江','北京','韩国'))
connect by nocycle t.parent = prior t.child group by level,child,parent having child <> (select '0' from dual);
ERROR 0A000: internal error code, arguments: -4007, expression without a column alias not supported
drop view stu_view;
create view stu_view as select level, t.* from (select t1.s1 s1, t1.child child, t2.parent parent from stu t1, stu t2 where t1.child = t2.child) t
connect by nocycle t.parent = prior t.child order siblings by t.s1,t.child;
ERROR 0A000: internal error code, arguments: -4007, expression without a column alias not supported
drop table stu1;
drop view stu_view;
# create synonym 后只能是对象，不能为子查询，预期失败。
create synonym stu_view for (select level lev, t.* from (select t1.s1 s1, t1.child child, t2.parent parent from stu t1, stu t2 where t1.child = t2.child) t
start with t.parent in (select parent from stu where parent not in ('浙江','北京','韩国'))
connect by nocycle prior t.parent = t.child order siblings by t.s1,t.child);
ERROR 42000: You have an error in your SQL syntax; check the manual that corresponds to your OceanBase version for the right syntax to use near '(select level lev, t.* from (select t1.s1 s1, t1.child child, t2.parent parent f' at line 1
######子查询和层次查询的嵌套使用######
drop table stu1;
drop table stu;
drop view stu_view;
drop synonym stu_syn;
create table stu(s1 number, child nvarchar2(6), parent nvarchar2(6));
insert into stu values(0,0,0);
insert into stu values(1,'中国','亚太');
insert into stu values(2,'北京','中国');
insert into stu values(3,'浙江','中国');
insert into stu values(4,'余杭区','浙江');
insert into stu values(5,'西湖区','浙江');
insert into stu values(6,'北京','中国');
insert into stu values(7,'首尔','韩国');
insert into stu values(8,'朝阳区','北京');
create index stu_parent on stu(parent);
select level, t.* from
(select level lev, t.* from stu t
start with t.parent in ('亚太', '中国')
connect by nocycle t.parent = prior t.child order siblings by t.s1,t.child) t
start with t.lev = '1'
connect by nocycle prior t.child = t.parent order siblings by t.child,t.parent;
LEVEL	LEV	S1	CHILD	PARENT
1	1	1	中国	亚太
1	1	2	北京	中国
1	1	3	浙江	中国
1	1	6	北京	中国
2	1	2	北京	中国
2	1	3	浙江	中国
2	1	6	北京	中国
2	2	2	北京	中国
2	2	3	浙江	中国
2	2	4	余杭区	浙江
2	2	5	西湖区	浙江
2	2	6	北京	中国
2	2	8	朝阳区	北京
2	2	8	朝阳区	北京
2	2	8	朝阳区	北京
2	2	8	朝阳区	北京
2	3	4	余杭区	浙江
2	3	5	西湖区	浙江
2	3	8	朝阳区	北京
2	3	8	朝阳区	北京
2	3	8	朝阳区	北京
2	3	8	朝阳区	北京
3	2	4	余杭区	浙江
3	2	4	余杭区	浙江
3	2	5	西湖区	浙江
3	2	5	西湖区	浙江
3	2	8	朝阳区	北京
3	2	8	朝阳区	北京
3	2	8	朝阳区	北京
3	2	8	朝阳区	北京
3	2	8	朝阳区	北京
3	2	8	朝阳区	北京
3	2	8	朝阳区	北京
3	2	8	朝阳区	北京
3	3	4	余杭区	浙江
3	3	4	余杭区	浙江
3	3	5	西湖区	浙江
3	3	5	西湖区	浙江
3	3	8	朝阳区	北京
3	3	8	朝阳区	北京
3	3	8	朝阳区	北京
3	3	8	朝阳区	北京
3	3	8	朝阳区	北京
3	3	8	朝阳区	北京
3	3	8	朝阳区	北京
3	3	8	朝阳区	北京
select level, t.* from
(select level lev, t.* from stu t
start with t.parent in ('亚太', '中国')
connect by nocycle t.parent = prior t.child order siblings by t.s1,t.child) t
start with t.lev = '1'
connect by nocycle t.child = prior t.parent order siblings by t.child,t.parent;
LEVEL	LEV	S1	CHILD	PARENT
1	1	1	中国	亚太
1	1	2	北京	中国
1	1	3	浙江	中国
1	1	6	北京	中国
2	1	1	中国	亚太
2	1	1	中国	亚太
2	1	1	中国	亚太
# 以上参考结果在test文件中.
# nvarchar2作为节点及connect的条件, 使用order siblings by(子查询含层次查询)
select level, t.* from 
(select level lev, t.* from (select t1.s1 s1, t1.child child, t2.parent parent from stu t1, stu t2 where t1.child = t2.child) t
start with t.parent in (select parent from stu where parent not in ('浙江','北京','韩国'))
connect by nocycle prior t.parent = t.child order siblings by t.s1,t.child) t
start with t.lev <> 1
connect by nocycle prior t.child = t.parent order siblings by t.child, t.parent;
LEVEL	LEV	S1	CHILD	PARENT
1	2	1	中国	亚太
1	2	1	中国	亚太
1	2	1	中国	亚太
1	2	1	中国	亚太
1	2	1	中国	亚太
2	1	2	北京	中国
2	1	2	北京	中国
2	1	2	北京	中国
2	1	2	北京	中国
2	1	2	北京	中国
2	1	2	北京	中国
2	1	2	北京	中国
2	1	2	北京	中国
2	1	2	北京	中国
2	1	2	北京	中国
2	1	3	浙江	中国
2	1	3	浙江	中国
2	1	3	浙江	中国
2	1	3	浙江	中国
2	1	3	浙江	中国
2	1	6	北京	中国
2	1	6	北京	中国
2	1	6	北京	中国
2	1	6	北京	中国
2	1	6	北京	中国
2	1	6	北京	中国
2	1	6	北京	中国
2	1	6	北京	中国
2	1	6	北京	中国
2	1	6	北京	中国
select level, t.* from
(select level lev, t.* from (select t1.s1 s1, t1.child child, t2.parent parent from stu t1, stu t2 where t1.child = t2.child) t
start with t.parent in (select parent from stu where parent not in ('浙江','北京','韩国'))
connect by nocycle t.parent = prior t.child order siblings by t.s1,t.child) t
start with t.lev = 1
connect by nocycle prior t.child = t.parent order siblings by t.child, t.parent;
LEVEL	LEV	S1	CHILD	PARENT
1	1	0	0	0
1	1	1	中国	亚太
1	1	2	北京	中国
1	1	2	北京	中国
1	1	3	浙江	中国
1	1	6	北京	中国
1	1	6	北京	中国
2	1	2	北京	中国
2	1	2	北京	中国
2	1	3	浙江	中国
2	1	6	北京	中国
2	1	6	北京	中国
2	2	2	北京	中国
2	2	2	北京	中国
2	2	3	浙江	中国
2	2	4	余杭区	浙江
2	2	5	西湖区	浙江
2	2	6	北京	中国
2	2	6	北京	中国
2	2	8	朝阳区	北京
2	2	8	朝阳区	北京
2	2	8	朝阳区	北京
2	2	8	朝阳区	北京
2	2	8	朝阳区	北京
2	2	8	朝阳区	北京
2	2	8	朝阳区	北京
2	2	8	朝阳区	北京
2	2	8	朝阳区	北京
2	2	8	朝阳区	北京
2	2	8	朝阳区	北京
2	2	8	朝阳区	北京
2	2	8	朝阳区	北京
2	2	8	朝阳区	北京
2	2	8	朝阳区	北京
2	2	8	朝阳区	北京
2	3	4	余杭区	浙江
2	3	5	西湖区	浙江
2	3	8	朝阳区	北京
2	3	8	朝阳区	北京
2	3	8	朝阳区	北京
2	3	8	朝阳区	北京
2	3	8	朝阳区	北京
2	3	8	朝阳区	北京
2	3	8	朝阳区	北京
2	3	8	朝阳区	北京
2	3	8	朝阳区	北京
2	3	8	朝阳区	北京
2	3	8	朝阳区	北京
2	3	8	朝阳区	北京
2	3	8	朝阳区	北京
2	3	8	朝阳区	北京
2	3	8	朝阳区	北京
2	3	8	朝阳区	北京
3	2	4	余杭区	浙江
3	2	4	余杭区	浙江
3	2	5	西湖区	浙江
3	2	5	西湖区	浙江
3	2	8	朝阳区	北京
3	2	8	朝阳区	北京
3	2	8	朝阳区	北京
3	2	8	朝阳区	北京
3	2	8	朝阳区	北京
3	2	8	朝阳区	北京
3	2	8	朝阳区	北京
3	2	8	朝阳区	北京
3	2	8	朝阳区	北京
3	2	8	朝阳区	北京
3	2	8	朝阳区	北京
3	2	8	朝阳区	北京
3	2	8	朝阳区	北京
3	2	8	朝阳区	北京
3	2	8	朝阳区	北京
3	2	8	朝阳区	北京
3	2	8	朝阳区	北京
3	2	8	朝阳区	北京
3	2	8	朝阳区	北京
3	2	8	朝阳区	北京
3	2	8	朝阳区	北京
3	2	8	朝阳区	北京
3	2	8	朝阳区	北京
3	2	8	朝阳区	北京
3	2	8	朝阳区	北京
3	2	8	朝阳区	北京
3	2	8	朝阳区	北京
3	2	8	朝阳区	北京
3	2	8	朝阳区	北京
3	2	8	朝阳区	北京
3	2	8	朝阳区	北京
3	2	8	朝阳区	北京
3	3	4	余杭区	浙江
3	3	4	余杭区	浙江
3	3	5	西湖区	浙江
3	3	5	西湖区	浙江
3	3	8	朝阳区	北京
3	3	8	朝阳区	北京
3	3	8	朝阳区	北京
3	3	8	朝阳区	北京
3	3	8	朝阳区	北京
3	3	8	朝阳区	北京
3	3	8	朝阳区	北京
3	3	8	朝阳区	北京
3	3	8	朝阳区	北京
3	3	8	朝阳区	北京
3	3	8	朝阳区	北京
3	3	8	朝阳区	北京
3	3	8	朝阳区	北京
3	3	8	朝阳区	北京
3	3	8	朝阳区	北京
3	3	8	朝阳区	北京
3	3	8	朝阳区	北京
3	3	8	朝阳区	北京
3	3	8	朝阳区	北京
3	3	8	朝阳区	北京
3	3	8	朝阳区	北京
3	3	8	朝阳区	北京
3	3	8	朝阳区	北京
3	3	8	朝阳区	北京
3	3	8	朝阳区	北京
3	3	8	朝阳区	北京
3	3	8	朝阳区	北京
3	3	8	朝阳区	北京
3	3	8	朝阳区	北京
3	3	8	朝阳区	北京
3	3	8	朝阳区	北京
3	3	8	朝阳区	北京
# 不命名level关键字，预期异常
select level, t.* from
(select level, t.* from (select t1.s1 s1, t1.child child, t2.parent parent from stu t1, stu t2 where t1.child = t2.child) t
start with t.parent in (select parent from stu where parent not in ('浙江','北京','韩国'))
connect by nocycle t.parent = prior t.child order siblings by t.s1,t.child) t
start with t.level = 1
connect by nocycle prior t.child = t.parent order siblings by t.child, t.parent;
ERROR 42000: You have an error in your SQL syntax; check the manual that corresponds to your OceanBase version for the right syntax to use near ''韩国'))
connect by nocycle t.parent = prior t.child order siblings by t.s1,t.' at line 2
# nvarchar2作为节点及connect的条件, 使用group by having子查询(子查询含层次查询)
select level,t.* from
(select level lev, t.child, t.parent from (select t1.s1 s1, t1.child child, t2.parent parent from stu t1, stu t2 where t1.child = t2.child) t
start with t.parent in (select parent from stu where parent not in ('浙江','北京','韩国'))
connect by nocycle t.parent = prior t.child group by level,child,parent having child <> (select '0' from dual)) t
start with t.lev = '2'
connect by nocycle prior t.child = t.parent order siblings by t.child, t.parent;
LEVEL	LEV	CHILD	PARENT
1	2	余杭区	浙江
1	2	北京	中国
1	2	朝阳区	北京
1	2	浙江	中国
1	2	西湖区	浙江
2	2	余杭区	浙江
2	2	朝阳区	北京
2	2	西湖区	浙江
2	3	余杭区	浙江
2	3	朝阳区	北京
2	3	西湖区	浙江
# 缺失start with(子查询含层次查询)
select level, t.* from
(select level lev, t.* from (select t1.s1 s1, t1.child child, t2.parent parent from stu t1, stu t2 where t1.child = t2.child) t
connect by nocycle t.parent = prior t.child order siblings by t.s1,t.child) t
start with t.parent not in (select parent from stu where parent not in ('浙江','北京','韩国','中国'))
connect by nocycle prior t.child = t.parent order siblings by t.child, t.parent;
LEVEL	LEV	S1	CHILD	PARENT
1	1	2	北京	中国
1	1	2	北京	中国
1	1	3	浙江	中国
1	1	4	余杭区	浙江
1	1	5	西湖区	浙江
1	1	6	北京	中国
1	1	6	北京	中国
1	1	7	首尔	韩国
1	1	8	朝阳区	北京
1	2	2	北京	中国
1	2	2	北京	中国
1	2	3	浙江	中国
1	2	4	余杭区	浙江
1	2	5	西湖区	浙江
1	2	6	北京	中国
1	2	6	北京	中国
1	2	8	朝阳区	北京
1	2	8	朝阳区	北京
1	2	8	朝阳区	北京
1	2	8	朝阳区	北京
1	3	4	余杭区	浙江
1	3	5	西湖区	浙江
1	3	8	朝阳区	北京
1	3	8	朝阳区	北京
1	3	8	朝阳区	北京
1	3	8	朝阳区	北京
2	1	4	余杭区	浙江
2	1	4	余杭区	浙江
2	1	5	西湖区	浙江
2	1	5	西湖区	浙江
2	1	8	朝阳区	北京
2	1	8	朝阳区	北京
2	1	8	朝阳区	北京
2	1	8	朝阳区	北京
2	1	8	朝阳区	北京
2	1	8	朝阳区	北京
2	1	8	朝阳区	北京
2	1	8	朝阳区	北京
2	2	4	余杭区	浙江
2	2	4	余杭区	浙江
2	2	5	西湖区	浙江
2	2	5	西湖区	浙江
2	2	8	朝阳区	北京
2	2	8	朝阳区	北京
2	2	8	朝阳区	北京
2	2	8	朝阳区	北京
2	2	8	朝阳区	北京
2	2	8	朝阳区	北京
2	2	8	朝阳区	北京
2	2	8	朝阳区	北京
2	2	8	朝阳区	北京
2	2	8	朝阳区	北京
2	2	8	朝阳区	北京
2	2	8	朝阳区	北京
2	2	8	朝阳区	北京
2	2	8	朝阳区	北京
2	2	8	朝阳区	北京
2	2	8	朝阳区	北京
2	2	8	朝阳区	北京
2	2	8	朝阳区	北京
2	2	8	朝阳区	北京
2	2	8	朝阳区	北京
2	2	8	朝阳区	北京
2	2	8	朝阳区	北京
2	2	8	朝阳区	北京
2	2	8	朝阳区	北京
2	2	8	朝阳区	北京
2	2	8	朝阳区	北京
2	2	8	朝阳区	北京
2	2	8	朝阳区	北京
2	2	8	朝阳区	北京
2	2	8	朝阳区	北京
2	2	8	朝阳区	北京
2	2	8	朝阳区	北京
2	3	4	余杭区	浙江
2	3	4	余杭区	浙江
2	3	5	西湖区	浙江
2	3	5	西湖区	浙江
2	3	8	朝阳区	北京
2	3	8	朝阳区	北京
2	3	8	朝阳区	北京
2	3	8	朝阳区	北京
2	3	8	朝阳区	北京
2	3	8	朝阳区	北京
2	3	8	朝阳区	北京
2	3	8	朝阳区	北京
2	3	8	朝阳区	北京
2	3	8	朝阳区	北京
2	3	8	朝阳区	北京
2	3	8	朝阳区	北京
2	3	8	朝阳区	北京
2	3	8	朝阳区	北京
2	3	8	朝阳区	北京
2	3	8	朝阳区	北京
2	3	8	朝阳区	北京
2	3	8	朝阳区	北京
2	3	8	朝阳区	北京
2	3	8	朝阳区	北京
2	3	8	朝阳区	北京
2	3	8	朝阳区	北京
2	3	8	朝阳区	北京
2	3	8	朝阳区	北京
2	3	8	朝阳区	北京
2	3	8	朝阳区	北京
2	3	8	朝阳区	北京
2	3	8	朝阳区	北京
2	3	8	朝阳区	北京
2	3	8	朝阳区	北京
2	3	8	朝阳区	北京
2	3	8	朝阳区	北京
# 缺失connect by子句验证
select level, t.* from
(select level lev, t.* from (select t1.s1 s1, t1.child child, t2.parent parent from stu t1, stu t2 where t1.child = t2.child) t
start with t.parent in (select parent from stu where parent not in ('浙江','北京','韩国'))) t
start with t.lev = '2'
connect by nocycle prior t.child = t.parent order siblings by t.child, t.parent;
ERROR 42000: You have an error in your SQL syntax; check the manual that corresponds to your OceanBase version for the right syntax to use near ') t
start with t.lev = '2'
connect by nocycle prior t.child = t.parent order sib' at line 3
# 层次查询嵌套层次查询，多个查询中使用相同的函数1
select to_number(level) lev1, to_char(t.lev) lev, nvl(t.s1,66) s1, length(t.child) len, lengthb(t.parent) lenb from
(select to_number(level) lev, nvl(t.s1,66) s1, t.child child, t.parent parent from stu t
start with t.parent in ('亚太', '中国')
connect by nocycle t.parent = prior t.child order siblings by t.s1,t.child) t
start with t.lev = '1'
connect by nocycle prior t.child = t.parent order siblings by t.child,t.parent;
LEV1	LEV	S1	LEN	LENB
1	1	1	2	4
1	1	2	2	4
1	1	3	2	4
1	1	6	2	4
2	1	2	2	4
2	1	3	2	4
2	1	6	2	4
2	2	2	2	4
2	2	3	2	4
2	2	4	3	4
2	2	5	3	4
2	2	6	2	4
2	2	8	3	4
2	2	8	3	4
2	2	8	3	4
2	2	8	3	4
2	3	4	3	4
2	3	5	3	4
2	3	8	3	4
2	3	8	3	4
2	3	8	3	4
2	3	8	3	4
3	2	4	3	4
3	2	4	3	4
3	2	5	3	4
3	2	5	3	4
3	2	8	3	4
3	2	8	3	4
3	2	8	3	4
3	2	8	3	4
3	2	8	3	4
3	2	8	3	4
3	2	8	3	4
3	2	8	3	4
3	3	4	3	4
3	3	4	3	4
3	3	5	3	4
3	3	5	3	4
3	3	8	3	4
3	3	8	3	4
3	3	8	3	4
3	3	8	3	4
3	3	8	3	4
3	3	8	3	4
3	3	8	3	4
3	3	8	3	4
select to_number(level) lev1, to_char(t.lev) lev, nvl(t.s1,66) s1, length(t.child) len, lengthb(t.parent) lenb from
(select level lev, t.* from stu t
start with to_char(t.parent) in ('亚太', '中国')
connect by nocycle to_char(t.parent) = prior to_char(t.child) order siblings by t.s1,t.child) t
start with to_char(t.lev) = '1'
connect by nocycle to_char(t.child) = prior to_char(t.parent) order siblings by t.child,t.parent;
LEV1	LEV	S1	LEN	LENB
1	1	1	2	4
1	1	2	2	4
1	1	3	2	4
1	1	6	2	4
2	1	1	2	4
2	1	1	2	4
2	1	1	2	4
# 层次查询嵌套层次查询，多个查询中使用相同的函数2
select to_char(level) lev1, to_number(t.lev) lev, nvl(t.s1,66) s1, length(t.child) len, lengthb(t.parent) lenb from 
(select level lev, t.* from (select t1.s1 s1, t1.child child, t2.parent parent from stu t1, stu t2 where t1.child = t2.child) t
start with to_char(t.parent) in (select parent from stu where parent not in ('浙江','北京','韩国'))
connect by nocycle prior nvl(t.parent,'aa') = nvl(t.child,'a') order siblings by t.s1,t.child) t
start with to_char(t.lev) <> to_char(1)
connect by nocycle prior nvl(t.child,'aa') = nvl(t.parent,'aa') order siblings by t.child, t.parent;
LEV1	LEV	S1	LEN	LENB
1	2	1	2	4
1	2	1	2	4
1	2	1	2	4
1	2	1	2	4
1	2	1	2	4
2	1	2	2	4
2	1	2	2	4
2	1	2	2	4
2	1	2	2	4
2	1	2	2	4
2	1	2	2	4
2	1	2	2	4
2	1	2	2	4
2	1	2	2	4
2	1	2	2	4
2	1	3	2	4
2	1	3	2	4
2	1	3	2	4
2	1	3	2	4
2	1	3	2	4
2	1	6	2	4
2	1	6	2	4
2	1	6	2	4
2	1	6	2	4
2	1	6	2	4
2	1	6	2	4
2	1	6	2	4
2	1	6	2	4
2	1	6	2	4
2	1	6	2	4
select level, t.* from
(select level lev, t.* from (select t1.s1 s1, t1.child child, t2.parent parent from stu t1, stu t2 where t1.child = t2.child) t
start with upper(t.parent) in (select parent from stu where parent not in ('浙江','北京','韩国'))
connect by nocycle upper(t.parent) = prior upper(t.child) order siblings by t.s1,t.child) t
start with abs(t.lev) = 1
connect by nocycle prior upper(t.child) = upper(t.parent) order siblings by t.child, t.parent;
LEVEL	LEV	S1	CHILD	PARENT
1	1	0	0	0
1	1	1	中国	亚太
1	1	2	北京	中国
1	1	2	北京	中国
1	1	3	浙江	中国
1	1	6	北京	中国
1	1	6	北京	中国
2	1	2	北京	中国
2	1	2	北京	中国
2	1	3	浙江	中国
2	1	6	北京	中国
2	1	6	北京	中国
2	2	2	北京	中国
2	2	2	北京	中国
2	2	3	浙江	中国
2	2	4	余杭区	浙江
2	2	5	西湖区	浙江
2	2	6	北京	中国
2	2	6	北京	中国
2	2	8	朝阳区	北京
2	2	8	朝阳区	北京
2	2	8	朝阳区	北京
2	2	8	朝阳区	北京
2	2	8	朝阳区	北京
2	2	8	朝阳区	北京
2	2	8	朝阳区	北京
2	2	8	朝阳区	北京
2	2	8	朝阳区	北京
2	2	8	朝阳区	北京
2	2	8	朝阳区	北京
2	2	8	朝阳区	北京
2	2	8	朝阳区	北京
2	2	8	朝阳区	北京
2	2	8	朝阳区	北京
2	2	8	朝阳区	北京
2	3	4	余杭区	浙江
2	3	5	西湖区	浙江
2	3	8	朝阳区	北京
2	3	8	朝阳区	北京
2	3	8	朝阳区	北京
2	3	8	朝阳区	北京
2	3	8	朝阳区	北京
2	3	8	朝阳区	北京
2	3	8	朝阳区	北京
2	3	8	朝阳区	北京
2	3	8	朝阳区	北京
2	3	8	朝阳区	北京
2	3	8	朝阳区	北京
2	3	8	朝阳区	北京
2	3	8	朝阳区	北京
2	3	8	朝阳区	北京
2	3	8	朝阳区	北京
2	3	8	朝阳区	北京
3	2	4	余杭区	浙江
3	2	4	余杭区	浙江
3	2	5	西湖区	浙江
3	2	5	西湖区	浙江
3	2	8	朝阳区	北京
3	2	8	朝阳区	北京
3	2	8	朝阳区	北京
3	2	8	朝阳区	北京
3	2	8	朝阳区	北京
3	2	8	朝阳区	北京
3	2	8	朝阳区	北京
3	2	8	朝阳区	北京
3	2	8	朝阳区	北京
3	2	8	朝阳区	北京
3	2	8	朝阳区	北京
3	2	8	朝阳区	北京
3	2	8	朝阳区	北京
3	2	8	朝阳区	北京
3	2	8	朝阳区	北京
3	2	8	朝阳区	北京
3	2	8	朝阳区	北京
3	2	8	朝阳区	北京
3	2	8	朝阳区	北京
3	2	8	朝阳区	北京
3	2	8	朝阳区	北京
3	2	8	朝阳区	北京
3	2	8	朝阳区	北京
3	2	8	朝阳区	北京
3	2	8	朝阳区	北京
3	2	8	朝阳区	北京
3	2	8	朝阳区	北京
3	2	8	朝阳区	北京
3	2	8	朝阳区	北京
3	2	8	朝阳区	北京
3	2	8	朝阳区	北京
3	2	8	朝阳区	北京
3	3	4	余杭区	浙江
3	3	4	余杭区	浙江
3	3	5	西湖区	浙江
3	3	5	西湖区	浙江
3	3	8	朝阳区	北京
3	3	8	朝阳区	北京
3	3	8	朝阳区	北京
3	3	8	朝阳区	北京
3	3	8	朝阳区	北京
3	3	8	朝阳区	北京
3	3	8	朝阳区	北京
3	3	8	朝阳区	北京
3	3	8	朝阳区	北京
3	3	8	朝阳区	北京
3	3	8	朝阳区	北京
3	3	8	朝阳区	北京
3	3	8	朝阳区	北京
3	3	8	朝阳区	北京
3	3	8	朝阳区	北京
3	3	8	朝阳区	北京
3	3	8	朝阳区	北京
3	3	8	朝阳区	北京
3	3	8	朝阳区	北京
3	3	8	朝阳区	北京
3	3	8	朝阳区	北京
3	3	8	朝阳区	北京
3	3	8	朝阳区	北京
3	3	8	朝阳区	北京
3	3	8	朝阳区	北京
3	3	8	朝阳区	北京
3	3	8	朝阳区	北京
3	3	8	朝阳区	北京
3	3	8	朝阳区	北京
3	3	8	朝阳区	北京
3	3	8	朝阳区	北京
3	3	8	朝阳区	北京
# 层次查询嵌套层次查询，多个查询中使用相同的函数3
select trunc(level) lev1, trunc(t.lev) lev, length(t.child) len, lengthb(t.parent) lenb from
(select trunc(level) lev, lower(t.child) child, lower(t.parent) parent from (select t1.s1 s1, t1.child child, t2.parent parent from stu t1, stu t2 where t1.child = t2.child) t
start with nvl2(t.parent,t.parent,t.parent) in (select parent from stu where parent not in ('浙江','北京','韩国'))
connect by nocycle lower(t.parent) = prior t.child group by level,child,parent having child <> (select '0' from dual)) t
start with nvl2(t.lev,t.lev,t.lev) = '2'
connect by nocycle prior t.child = upper(t.parent) order siblings by t.child, t.parent;
LEV1	LEV	LEN	LENB
1	2	2	4
1	2	2	4
1	2	3	4
1	2	3	4
1	2	3	4
2	2	3	4
2	2	3	4
2	2	3	4
2	3	3	4
2	3	3	4
2	3	3	4
# 层次查询嵌套层次查询，多个查询中使用相同的函数4
select round(level) lev1, t.* from
(select round(level) lev, t.* from (select t1.s1 s1, t1.child child, t2.parent parent from stu t1, stu t2 where t1.child = t2.child) t
connect by nocycle to_char(t.parent) = prior t.child order siblings by t.s1,t.child) t
start with t.parent not in (select parent from stu where parent not in ('浙江','北京','韩国','中国'))
connect by nocycle prior t.child = to_char(t.parent) order siblings by t.child, t.parent;
LEV1	LEV	S1	CHILD	PARENT
1	1	2	北京	中国
1	1	2	北京	中国
1	1	3	浙江	中国
1	1	4	余杭区	浙江
1	1	5	西湖区	浙江
1	1	6	北京	中国
1	1	6	北京	中国
1	1	7	首尔	韩国
1	1	8	朝阳区	北京
1	2	2	北京	中国
1	2	2	北京	中国
1	2	3	浙江	中国
1	2	4	余杭区	浙江
1	2	5	西湖区	浙江
1	2	6	北京	中国
1	2	6	北京	中国
1	2	8	朝阳区	北京
1	2	8	朝阳区	北京
1	2	8	朝阳区	北京
1	2	8	朝阳区	北京
1	3	4	余杭区	浙江
1	3	5	西湖区	浙江
1	3	8	朝阳区	北京
1	3	8	朝阳区	北京
1	3	8	朝阳区	北京
1	3	8	朝阳区	北京
2	1	4	余杭区	浙江
2	1	4	余杭区	浙江
2	1	5	西湖区	浙江
2	1	5	西湖区	浙江
2	1	8	朝阳区	北京
2	1	8	朝阳区	北京
2	1	8	朝阳区	北京
2	1	8	朝阳区	北京
2	1	8	朝阳区	北京
2	1	8	朝阳区	北京
2	1	8	朝阳区	北京
2	1	8	朝阳区	北京
2	2	4	余杭区	浙江
2	2	4	余杭区	浙江
2	2	5	西湖区	浙江
2	2	5	西湖区	浙江
2	2	8	朝阳区	北京
2	2	8	朝阳区	北京
2	2	8	朝阳区	北京
2	2	8	朝阳区	北京
2	2	8	朝阳区	北京
2	2	8	朝阳区	北京
2	2	8	朝阳区	北京
2	2	8	朝阳区	北京
2	2	8	朝阳区	北京
2	2	8	朝阳区	北京
2	2	8	朝阳区	北京
2	2	8	朝阳区	北京
2	2	8	朝阳区	北京
2	2	8	朝阳区	北京
2	2	8	朝阳区	北京
2	2	8	朝阳区	北京
2	2	8	朝阳区	北京
2	2	8	朝阳区	北京
2	2	8	朝阳区	北京
2	2	8	朝阳区	北京
2	2	8	朝阳区	北京
2	2	8	朝阳区	北京
2	2	8	朝阳区	北京
2	2	8	朝阳区	北京
2	2	8	朝阳区	北京
2	2	8	朝阳区	北京
2	2	8	朝阳区	北京
2	2	8	朝阳区	北京
2	2	8	朝阳区	北京
2	2	8	朝阳区	北京
2	2	8	朝阳区	北京
2	2	8	朝阳区	北京
2	3	4	余杭区	浙江
2	3	4	余杭区	浙江
2	3	5	西湖区	浙江
2	3	5	西湖区	浙江
2	3	8	朝阳区	北京
2	3	8	朝阳区	北京
2	3	8	朝阳区	北京
2	3	8	朝阳区	北京
2	3	8	朝阳区	北京
2	3	8	朝阳区	北京
2	3	8	朝阳区	北京
2	3	8	朝阳区	北京
2	3	8	朝阳区	北京
2	3	8	朝阳区	北京
2	3	8	朝阳区	北京
2	3	8	朝阳区	北京
2	3	8	朝阳区	北京
2	3	8	朝阳区	北京
2	3	8	朝阳区	北京
2	3	8	朝阳区	北京
2	3	8	朝阳区	北京
2	3	8	朝阳区	北京
2	3	8	朝阳区	北京
2	3	8	朝阳区	北京
2	3	8	朝阳区	北京
2	3	8	朝阳区	北京
2	3	8	朝阳区	北京
2	3	8	朝阳区	北京
2	3	8	朝阳区	北京
2	3	8	朝阳区	北京
2	3	8	朝阳区	北京
2	3	8	朝阳区	北京
2	3	8	朝阳区	北京
2	3	8	朝阳区	北京
2	3	8	朝阳区	北京
2	3	8	朝阳区	北京
######with table as ... select语法######
drop table stu1;
drop table stu;
create table stu(s1 number, child nvarchar2(6), parent nvarchar2(6));
insert into stu values(0,0,0);
insert into stu values(1,'中国','亚太');
insert into stu values(2,'北京','中国');
insert into stu values(3,'浙江','中国');
insert into stu values(4,'余杭区','浙江');
insert into stu values(5,'西湖区','浙江');
insert into stu values(6,'北京','中国');
insert into stu values(7,'首尔','韩国');
insert into stu values(8,'朝阳区','北京');
create index stu_parent on stu(parent);
with stu1 as (
select level, t.* from (
select level lev, t.* from (select t1.s1 s1, t1.child child, t2.parent parent from stu t1, stu t2 where t1.child = t2.child) t
start with upper(t.parent) in (select parent from stu where parent not in ('浙江','北京','韩国'))
connect by nocycle upper(t.parent) = prior upper(t.child) order siblings by t.s1,t.child
) t
start with abs(t.lev) = 1
connect by nocycle prior upper(t.child) = upper(t.parent) order siblings by t.child, t.parent
) select * from stu1;
LEVEL	LEV	S1	CHILD	PARENT
1	1	0	0	0
1	1	1	中国	亚太
1	1	2	北京	中国
1	1	2	北京	中国
1	1	3	浙江	中国
1	1	6	北京	中国
1	1	6	北京	中国
2	1	2	北京	中国
2	1	2	北京	中国
2	1	3	浙江	中国
2	1	6	北京	中国
2	1	6	北京	中国
2	2	2	北京	中国
2	2	2	北京	中国
2	2	3	浙江	中国
2	2	4	余杭区	浙江
2	2	5	西湖区	浙江
2	2	6	北京	中国
2	2	6	北京	中国
2	2	8	朝阳区	北京
2	2	8	朝阳区	北京
2	2	8	朝阳区	北京
2	2	8	朝阳区	北京
2	2	8	朝阳区	北京
2	2	8	朝阳区	北京
2	2	8	朝阳区	北京
2	2	8	朝阳区	北京
2	2	8	朝阳区	北京
2	2	8	朝阳区	北京
2	2	8	朝阳区	北京
2	2	8	朝阳区	北京
2	2	8	朝阳区	北京
2	2	8	朝阳区	北京
2	2	8	朝阳区	北京
2	2	8	朝阳区	北京
2	3	4	余杭区	浙江
2	3	5	西湖区	浙江
2	3	8	朝阳区	北京
2	3	8	朝阳区	北京
2	3	8	朝阳区	北京
2	3	8	朝阳区	北京
2	3	8	朝阳区	北京
2	3	8	朝阳区	北京
2	3	8	朝阳区	北京
2	3	8	朝阳区	北京
2	3	8	朝阳区	北京
2	3	8	朝阳区	北京
2	3	8	朝阳区	北京
2	3	8	朝阳区	北京
2	3	8	朝阳区	北京
2	3	8	朝阳区	北京
2	3	8	朝阳区	北京
2	3	8	朝阳区	北京
3	2	4	余杭区	浙江
3	2	4	余杭区	浙江
3	2	5	西湖区	浙江
3	2	5	西湖区	浙江
3	2	8	朝阳区	北京
3	2	8	朝阳区	北京
3	2	8	朝阳区	北京
3	2	8	朝阳区	北京
3	2	8	朝阳区	北京
3	2	8	朝阳区	北京
3	2	8	朝阳区	北京
3	2	8	朝阳区	北京
3	2	8	朝阳区	北京
3	2	8	朝阳区	北京
3	2	8	朝阳区	北京
3	2	8	朝阳区	北京
3	2	8	朝阳区	北京
3	2	8	朝阳区	北京
3	2	8	朝阳区	北京
3	2	8	朝阳区	北京
3	2	8	朝阳区	北京
3	2	8	朝阳区	北京
3	2	8	朝阳区	北京
3	2	8	朝阳区	北京
3	2	8	朝阳区	北京
3	2	8	朝阳区	北京
3	2	8	朝阳区	北京
3	2	8	朝阳区	北京
3	2	8	朝阳区	北京
3	2	8	朝阳区	北京
3	2	8	朝阳区	北京
3	2	8	朝阳区	北京
3	2	8	朝阳区	北京
3	2	8	朝阳区	北京
3	2	8	朝阳区	北京
3	2	8	朝阳区	北京
3	3	4	余杭区	浙江
3	3	4	余杭区	浙江
3	3	5	西湖区	浙江
3	3	5	西湖区	浙江
3	3	8	朝阳区	北京
3	3	8	朝阳区	北京
3	3	8	朝阳区	北京
3	3	8	朝阳区	北京
3	3	8	朝阳区	北京
3	3	8	朝阳区	北京
3	3	8	朝阳区	北京
3	3	8	朝阳区	北京
3	3	8	朝阳区	北京
3	3	8	朝阳区	北京
3	3	8	朝阳区	北京
3	3	8	朝阳区	北京
3	3	8	朝阳区	北京
3	3	8	朝阳区	北京
3	3	8	朝阳区	北京
3	3	8	朝阳区	北京
3	3	8	朝阳区	北京
3	3	8	朝阳区	北京
3	3	8	朝阳区	北京
3	3	8	朝阳区	北京
3	3	8	朝阳区	北京
3	3	8	朝阳区	北京
3	3	8	朝阳区	北京
3	3	8	朝阳区	北京
3	3	8	朝阳区	北京
3	3	8	朝阳区	北京
3	3	8	朝阳区	北京
3	3	8	朝阳区	北京
3	3	8	朝阳区	北京
3	3	8	朝阳区	北京
3	3	8	朝阳区	北京
3	3	8	朝阳区	北京
with stu1 as (
select to_char(level) lev1, to_number(t.lev) lev, nvl(t.s1,66) s1, length(t.child) len, lengthb(t.parent) lenb from 
(select level lev, t.* from (select t1.s1 s1, t1.child child, t2.parent parent from stu t1, stu t2 where t1.child = t2.child) t
start with to_char(t.parent) in (select parent from stu where parent not in ('浙江','北京','韩国'))
connect by nocycle prior nvl(t.parent,'aa') = nvl(t.child,'a') order siblings by t.s1,t.child) t
start with to_char(t.lev) <> to_char(1)
connect by nocycle prior nvl(t.child,'aa') = nvl(t.parent,'aa') order siblings by t.child, t.parent 
) select * from stu1;
LEV1	LEV	S1	LEN	LENB
1	2	1	2	4
1	2	1	2	4
1	2	1	2	4
1	2	1	2	4
1	2	1	2	4
2	1	2	2	4
2	1	2	2	4
2	1	2	2	4
2	1	2	2	4
2	1	2	2	4
2	1	2	2	4
2	1	2	2	4
2	1	2	2	4
2	1	2	2	4
2	1	2	2	4
2	1	3	2	4
2	1	3	2	4
2	1	3	2	4
2	1	3	2	4
2	1	3	2	4
2	1	6	2	4
2	1	6	2	4
2	1	6	2	4
2	1	6	2	4
2	1	6	2	4
2	1	6	2	4
2	1	6	2	4
2	1	6	2	4
2	1	6	2	4
2	1	6	2	4
with stu1 as (
select level,t.* from
(select level lev, t.child, t.parent from (select t1.s1 s1, t1.child child, t2.parent parent from stu t1, stu t2 where t1.child = t2.child) t
start with t.parent in (select parent from stu where parent not in ('浙江','北京','韩国'))
connect by nocycle t.parent = prior t.child group by level,child,parent having child <> (select '0' from dual)) t
start with t.lev = '2'
connect by nocycle prior t.child = t.parent order siblings by t.child, t.parent
) select * from stu1;
LEVEL	LEV	CHILD	PARENT
1	2	余杭区	浙江
1	2	北京	中国
1	2	朝阳区	北京
1	2	浙江	中国
1	2	西湖区	浙江
2	2	余杭区	浙江
2	2	朝阳区	北京
2	2	西湖区	浙江
2	3	余杭区	浙江
2	3	朝阳区	北京
2	3	西湖区	浙江
######dml条件中使用层次查询######
drop table stu;
drop table stu1;
create table stu(s1 number, child number(6), parent number(6));
create table stu1(s1 number);
insert into stu values(0,0,0);
insert into stu values(1,10,1);
insert into stu values(2,20,10);
insert into stu values(3,30,10);
insert into stu values(4,40,30);
insert into stu values(5,50,30);
insert into stu values(6,60,10);
insert into stu values(7,70,200);
insert into stu values(8,80,60);
create index stu_parent on stu(parent);
insert into stu1 values(0);
insert into stu1 values(1);
insert into stu1 values(2);
insert into stu1 values(3);
insert into stu1 values(4);
insert into stu1 values(5);
insert into stu1 values(6);
insert into stu1 values(7);
insert into stu1 values(8);
insert into stu1 values(9);
select * from stu1 where s1 in (
select t.s1 from (select t1.s1 s1, t1.child child, t2.parent parent from stu t1, stu t2 where t1.child = t2.child) t
start with t.parent in (select parent from stu where parent < 50)
connect by nocycle prior t.parent = t.child group by t.s1);
S1
0
1
2
3
4
5
6
select * from stu1 where s1 not in (
select t.s1 from (select t1.s1 s1, t1.child child, t2.parent parent from stu t1, stu t2 where t1.child = t2.child) t
start with t.parent in (select parent from stu where parent < 50)
connect by nocycle t.parent = prior t.child group by t.s1);
S1
7
9
# dml条件中使用层次查询, 暂不支持
update stu set s1=66 where s1 in (
select t.s1 from stu t
start with t.parent in (0, 1)
connect by nocycle t.parent = prior t.child and t.s1 < 5);
delete from stu where s1 not in (
select t.s1 from stu t
start with t.parent in (0, 1)
connect by nocycle t.parent = prior t.child and t.s1 < 5);
drop table stu;
drop table stu1;
drop view stu_view;
drop view stu1_view;
drop synonym stu1_syn;
drop synonym stu_syn;
drop table stu_cp;
drop table stu1_cp;
