#Environmental cleaning
drop user hjw@'%';
create user hjw identified by 'hjw';
grant all on *.* to hjw WITH GRANT OPTION;
#avg-6   pl语句
#avg-6-1-1   存储过程
#存储过程=====>while循环
drop table hj_test;
CREATE TABLE hj_test(c1 int,c2 int);
drop procedure procedure_1;
CREATE PROCEDURE procedure_1()
BEGIN
DECLARE i INT DEFAULT 1;
WHILE i < (SELECT AVG(300) FROM DUAL LIMIT 1)
DO
INSERT INTO hj_test VALUES (i, (select avg(i+200) from dual));
SET i = i + 1;
END WHILE;
COMMIT;
END;
/
call procedure_1();
#存储过程=====>REPEAT循环
drop procedure procedure_1;
DROP TABLE hj_test;
CREATE TABLE hj_test(c1 int,c2 int);
CREATE PROCEDURE PROCEDURE_1()
BEGIN
DECLARE i INT DEFAULT 1;
REPEAT
INSERT INTO hj_test VALUES (i, (SELECT AVG(i+200) FROM dual));
SET i = i + 1;
UNTIL i > 20 END REPEAT;
END;
/
call procedure_1();
SELECT * FROM hj_test ORDER BY c1 ASC;
c1	c2
1	201
2	202
3	203
4	204
5	205
6	206
7	207
8	208
9	209
10	210
11	211
12	212
13	213
14	214
15	215
16	216
17	217
18	218
19	219
20	220
#存储过程=====>loop循环
DROP TABLE hj_test;
CREATE TABLE hj_test(c1 int,c2 int);
drop procedure procedure_1;
create procedure procedure_1()
begin
declare i int;
set i = 1;
lp : loop
insert into hj_test values (i,(SELECT AVG(i+200) FROM dual));
set i = i + 1;
if i > 201 then
leave lp;
end if;
end loop;
end;
/
CALL procedure_1();
drop procedure procedure_1;
DROP TABLE hj_test;
#avg-5-2-2    触发器
DROP TABLE hj_test1;
CREATE TABLE hj_test1(c1 int,c2 int);
DROP TABLE hj_test2;
CREATE TABLE hj_test2(c1 int,c2 int);
INSERT INTO hj_test1 values((select avg(40000) from dual),(select avg(250000) from dual));
INSERT INTO hj_test1 values((select avg(20000) from dual),(select avg(90000) from dual));
INSERT INTO hj_test1 values((select avg(160000) from dual),(select avg(360000) from dual));
INSERT INTO hj_test1 values((select avg(490000) from dual),(select avg(640000) from dual));
SELECT * FROM hj_test1 ORDER BY c1 ASC;
c1	c2
20000	90000
40000	250000
160000	360000
490000	640000
INSERT INTO hj_test2 values((select avg(5123) from dual),(select avg(25161) from dual));
INSERT INTO hj_test2 values((select avg(5212) from dual),(select avg(546414) from dual));
INSERT INTO hj_test2 values((select avg(154641) from dual),(select avg(121) from dual));
INSERT INTO hj_test2 values((select avg(2313) from dual),(select avg(21314) from dual));
SELECT * FROM hj_test2 ORDER BY c1 ASC;
c1	c2
2313	21314
5123	25161
5212	546414
154641	121
DROP TRIGGER TRIGGER_1;
CREATE TRIGGER TRIGGER_1 AFTER DELETE ON hj_test2
FOR EACH ROW
BEGIN
DELETE FROM hj_test1 WHERE c1=(select round(avg(160000)) from dual) OR c2=(select round(avg(640000)) from dual);
END
/
SELECT * FROM hj_test2 ORDER BY c1 ASC;
c1	c2
2313	21314
5123	25161
5212	546414
154641	121
SELECT * FROM hj_test1 ORDER BY c1 ASC;
c1	c2
20000	90000
40000	250000
160000	360000
490000	640000
DELETE FROM hj_test2 WHERE c2=(select round(avg(25161)) from dual);
SELECT * FROM hj_test2 ORDER BY c1 ASC;
c1	c2
2313	21314
5212	546414
154641	121
SELECT * FROM hj_test1 ORDER BY c1 ASC;
c1	c2
20000	90000
40000	250000
DROP TRIGGER TRIGGER_1;
CREATE TRIGGER TRIGGER_1 AFTER DELETE ON hj_test2
FOR EACH ROW
BEGIN
INSERT INTO hj_test1 values((select round(avg(5000)) from dual),(select round(avg(6666)) from dual));
END
/
SELECT * FROM hj_test2 ORDER BY c1 ASC;
c1	c2
2313	21314
5212	546414
154641	121
SELECT * FROM hj_test1 ORDER BY c1 ASC;
c1	c2
20000	90000
40000	250000
DELETE FROM hj_test2 WHERE c1=(select round(avg(5212)) from dual);
SELECT * FROM hj_test2 ORDER BY c1 ASC;
c1	c2
2313	21314
154641	121
SELECT * FROM hj_test1 ORDER BY c1 ASC;
c1	c2
5000	6666
20000	90000
40000	250000
DROP TRIGGER TRIGGER_1;
CREATE TRIGGER TRIGGER_1 AFTER delete ON hj_test2
FOR EACH ROW
BEGIN
UPDATE hj_test1 SET c1=((select round(avg(3000))+round(avg(2000)) from dual));
END
/
SELECT * FROM hj_test2 ORDER BY c1 ASC;
c1	c2
2313	21314
154641	121
SELECT * FROM hj_test1 ORDER BY c1 ASC;
c1	c2
5000	6666
20000	90000
40000	250000
DELETE FROM hj_test2 WHERE c1=(select round(avg(2313)) from dual);
SELECT * FROM hj_test2 ORDER BY c1 ASC;
c1	c2
154641	121
SELECT * FROM hj_test1 ORDER BY c1 ASC;
c1	c2
5000	250000
5000	90000
5000	6666
DROP TRIGGER TRIGGER_1;
DROP TABLE hj_test1;
DROP TABLE hj_test2;
#avg-5-2-3    自定义函数
DROP FUNCTION abc;
CREATE FUNCTION abc()
RETURNS FLOAT
BEGIN
RETURN (SELECT AVG(300) FROM DUAL);
END;
/
select abc() from dual;
abc()
300
DROP FUNCTION abc;
CREATE FUNCTION abc()
RETURNS int
BEGIN
RETURN (SELECT AVG(1234134) FROM DUAL);
END;
/
select abc() from dual;
abc()
1234134
DROP FUNCTION abc;
CREATE FUNCTION abc()
RETURNS char(50)
BEGIN
RETURN (SELECT AVG('shfiwwfwgfw') FROM DUAL);
END;
/
select abc() from dual;
abc()
0
Warnings:
Warning	1292	Truncated incorrect DOUBLE value: 'shfiwwfwgfw'
Warning	1292	Truncated incorrect DOUBLE value: 'shfiwwfwgfw'
DROP FUNCTION abc;
CREATE FUNCTION abc()
RETURNS int
BEGIN
RETURN (SELECT AVG(null) FROM DUAL);
END;
/
select abc() from dual;
abc()
NULL
DROP FUNCTION abc;
CREATE FUNCTION abc()
RETURNS bigint
BEGIN
RETURN (SELECT AVG(-54564564564) FROM DUAL);
END;
/
select abc() from dual;
abc()
-54564564564
# Clean up users
drop user hjw@'%' ;
