#Environmental cleaning
drop user hjw@'%';
create user hjw identified by 'hjw';
grant all on *.* to hjw WITH GRANT OPTION;
#avg-8   分区表
#avg-8-1   hash分区表
DROP TABLE hj_test;
CREATE TABLE hj_test(c1 int,c2 int,c3 char(80))
partition BY hash((select avg(c1) from dual))(
PARTITION p1,
PARTITION p2,
PARTITION p3,
PARTITION p4);
CREATE TABLE hj_test(c1 int,c2 int,c3 char(80))
partition BY hash(avg(c1))(
PARTITION p1,
PARTITION p2,
PARTITION p3,
PARTITION p4);
CREATE TABLE hj_test(c1 int,c2 int,c3 char(80))
partition BY hash(avg(c3))(
PARTITION p1,
PARTITION p2,
PARTITION p3,
PARTITION p4);
CREATE TABLE hj_test(c1 int,c2 int,c3 char(80))
partition BY hash(c1)(
PARTITION p1,
PARTITION p2,
PARTITION p3,
PARTITION p4);
INSERT INTO hj_test VALUES (1,231,'foo');
INSERT INTO hj_test VALUES (4,453,'bar');
INSERT INTO hj_test VALUES (9,54613,'baz');
SELECT * FROM hj_test ORDER BY c1 ASC;
c1	c2	c3
1	231	foo
4	453	bar
9	54613	baz
SELECT * FROM hj_test WHERE avg(c1) = 2;
SELECT * FROM hj_test WHERE c1 = avg(4);
SELECT * FROM hj_test WHERE c1 =(select avg(4) from dual);
c1	c2	c3
4	453	bar
INSERT INTO hj_test VALUES ((select avg(545643) from dual),(select avg(23115513) from dual),'foo');
INSERT INTO hj_test PARTITION(p1) VALUES ((select avg(545643) from dual),(select avg(23115513) from dual),'foo');
INSERT INTO hj_test PARTITION(p2) VALUES ((select avg(545643) from dual),(select avg(23115513) from dual),'foo');
INSERT INTO hj_test PARTITION(p3) VALUES ((select avg(545643) from dual),(select avg(23115513) from dual),'foo');
SELECT * FROM hj_test ORDER BY c1 ASC;
c1	c2	c3
1	231	foo
4	453	bar
9	54613	baz
545643	23115513	foo
#avg-8-2   key分区表
DROP TABLE hj_test;
CREATE TABLE hj_test(c1 int,c2 int,c3 char(80))
partition BY key((select avg(c1) from dual))(
PARTITION p1,
PARTITION p2,
PARTITION p3,
PARTITION p4);
CREATE TABLE hj_test(c1 int,c2 int,c3 char(80))
partition BY key(avg(c1))(
PARTITION p1,
PARTITION p2,
PARTITION p3,
PARTITION p4);
CREATE TABLE hj_test(c1 int,c2 int,c3 char(80))
partition BY key(avg(c3))(
PARTITION p1,
PARTITION p2,
PARTITION p3,
PARTITION p4);
CREATE TABLE hj_test(c1 int,c2 int,c3 char(80))
partition BY key(c1)(
PARTITION p1,
PARTITION p2,
PARTITION p3,
PARTITION p4);
INSERT INTO hj_test VALUES (1,231,'foo');
INSERT INTO hj_test VALUES (4,453,'bar');
INSERT INTO hj_test VALUES (9,54613,'baz');
SELECT * FROM hj_test ORDER BY c1 ASC;
c1	c2	c3
1	231	foo
4	453	bar
9	54613	baz
SELECT * FROM hj_test WHERE avg(c1) = 2;
SELECT * FROM hj_test WHERE c1 = avg(4);
SELECT * FROM hj_test WHERE c1 =(select avg(4) from dual);
c1	c2	c3
4	453	bar
INSERT INTO hj_test VALUES ((select avg(545643) from dual),(select avg(23115513) from dual),'foo');
INSERT INTO hj_test PARTITION(p1) VALUES ((select avg(545643) from dual),(select avg(23115513) from dual),'foo');
INSERT INTO hj_test PARTITION(p2) VALUES ((select avg(545643) from dual),(select avg(23115513) from dual),'foo');
INSERT INTO hj_test PARTITION(p3) VALUES ((select avg(545643) from dual),(select avg(23115513) from dual),'foo');
SELECT * FROM hj_test ORDER BY c1 ASC;
c1	c2	c3
1	231	foo
4	453	bar
9	54613	baz
545643	23115513	foo
#avg-8-3   list分区表
DROP TABLE hj_test;
CREATE TABLE hj_test(c1 int,c2 int,c3 char(80))
partition BY list(avg(c1))(
PARTITION p1 values((select avg(400) from dual)),
PARTITION p2 values((select avg(1600) from dual)),
PARTITION p3 values((select avg(3200) from dual)),
PARTITION p4 values((select avg(6400) from dual)));
CREATE TABLE hj_test(c1 int,c2 int,c3 char(80))
partition BY list(avg(c3))(
PARTITION p1 values((select avg(400) from dual)),
PARTITION p2 values((select avg(1600) from dual)),
PARTITION p3 values((select avg(3200) from dual)),
PARTITION p4 values((select avg(6400) from dual)));
CREATE TABLE hj_test(c1 int,c2 int,c3 char(80))
partition BY list(c1)(
PARTITION p1 values((select avg(400) from dual)),
PARTITION p2 values((select avg(1600) from dual)),
PARTITION p3 values((select avg(3200) from dual)),
PARTITION p4 values((select avg(6400) from dual)));
CREATE TABLE hj_test(c1 int,c2 int,c3 char(80))
partition BY list(c1)(
PARTITION p1 values((select avg(400) from dual)),
PARTITION p2 values((select avg(1600) from dual)),
PARTITION p3 values((select avg(3200) from dual)),
PARTITION p4 values((select avg(6400) from dual)));
CREATE TABLE hj_test(c1 int,c2 int,c3 char(80))
partition BY list(c1)(
PARTITION p1 values in(400),
PARTITION p2 values in(1600),
PARTITION p3 values in(3200),
PARTITION p4 values in(6400));
INSERT INTO hj_test VALUES (400,231,'foo');
INSERT INTO hj_test VALUES (1600,453,'bar');
INSERT INTO hj_test VALUES (3200,54613,'baz');
INSERT INTO hj_test VALUES ((select avg(6400) from dual) ,56,'obu');
INSERT INTO hj_test VALUES ((select avg(3200) from dual),54151,'hihp');
SELECT * FROM hj_test ORDER BY c1 ASC;
c1	c2	c3
400	231	foo
1600	453	bar
3200	54613	baz
3200	54151	hihp
6400	56	obu
SELECT * FROM hj_test PARTITION(p1) WHERE c1 =(select avg(400) from dual);
c1	c2	c3
400	231	foo
SELECT * FROM hj_test PARTITION(p2) WHERE c1 =(select avg(1600) from dual);
c1	c2	c3
1600	453	bar
SELECT * FROM hj_test PARTITION(p3) WHERE c1 =(select avg(3200) from dual);
c1	c2	c3
3200	54613	baz
3200	54151	hihp
SELECT * FROM hj_test PARTITION(p4) WHERE c1 =(select avg(3200) from dual);
c1	c2	c3
#avg-8-4   range分区表
DROP TABLE hj_test;
CREATE TABLE hj_test(c1 int,c2 int,c3 char(80))
partition BY range((select avg(c1) from dual))(
PARTITION p1 VALUES less than((select avg(400) from dual)),
PARTITION p2 VALUES less than((select avg(1600) from dual)),
PARTITION p3 VALUES less than((select avg(3200) from dual)),
PARTITION p4 VALUES less than((select avg(6400) from dual)));
CREATE TABLE hj_test(c1 int,c2 int,c3 char(80))
partition BY range((select avg(c3) from dual))(
PARTITION p1 VALUES less than((select avg(400) from dual)),
PARTITION p2 VALUES less than((select avg(1600) from dual)),
PARTITION p3 VALUES less than((select avg(3200) from dual)),
PARTITION p4 VALUES less than((select avg(6400) from dual)));
CREATE TABLE hj_test(c1 int,c2 int,c3 char(80))
partition BY range(c1)(
PARTITION p1 VALUES less than((select avg(400) from dual)),
PARTITION p2 VALUES less than((select avg(1600) from dual)),
PARTITION p3 VALUES less than((select avg(3200) from dual)),
PARTITION p4 VALUES less than((select avg(6400) from dual)));
CREATE TABLE hj_test(c1 int,c2 int,c3 char(80))
partition BY range(c3)(
PARTITION p1 VALUES less than((select avg(400) from dual)),
PARTITION p2 VALUES less than((select avg(1600) from dual)),
PARTITION p3 VALUES less than((select avg(3200) from dual)),
PARTITION p4 VALUES less than((select avg(6400) from dual)));
CREATE TABLE hj_test(c1 int,c2 int,c3 char(80))
partition BY range(c1)(
PARTITION p1 VALUES less than(400),
PARTITION p2 VALUES less than(1600),
PARTITION p3 VALUES less than(3200),
PARTITION p4 VALUES less than(6400));
INSERT INTO hj_test VALUES (1,231,'foo');
INSERT INTO hj_test VALUES (4,453,'bar');
INSERT INTO hj_test VALUES (9,54613,'baz');
INSERT INTO hj_test VALUES ((select avg(1600) from dual),231,'foo');
INSERT INTO hj_test VALUES ((select avg(6399) from dual),564,'sdfw');
SELECT * FROM hj_test ORDER BY c1 ASC;
c1	c2	c3
1	231	foo
4	453	bar
9	54613	baz
1600	231	foo
6399	564	sdfw
SELECT * FROM hj_test WHERE c1 = avg(c1);
SELECT * FROM hj_test PARTITION(p2) WHERE c1 =(select avg(1600) from dual);
c1	c2	c3
SELECT * FROM hj_test PARTITION(p1) WHERE c1 =(select avg(1600) from dual);
c1	c2	c3
SELECT * FROM hj_test PARTITION(p3) WHERE c1 =(select avg(1600) from dual);
c1	c2	c3
1600	231	foo
SELECT * FROM hj_test PARTITION(p4) WHERE c1 =(select avg(1600) from dual);
c1	c2	c3
#avg-8-5   组合分区表
DROP TABLE hj_test;
CREATE TABLE hj_test (
c1 NUMBER
)
PARTITION BY RANGE (c1)
(
PARTITION p1 VALUES LESS THAN (100)
SUBPARTITION BY LIST (c1)
(
SUBPARTITION sp1 VALUES ((select avg(200) from dual)),
SUBPARTITION sp2 VALUES ((select avg(400) from dual))
),
PARTITION p2 VALUES LESS THAN (200)
SUBPARTITION BY LIST (c1)
(
SUBPARTITION sp3 VALUES (select avg(900) from dual),
SUBPARTITION sp4 VALUES (select avg(1600) from dual)
));
create table hj_test(id int,h1 bigint) partition by range(id) subpartition by hash(avg(h1))
(
partition p1 values less than(200)(subpartition p11),
partition p2 values less than(400)(subpartition p22),
partition p3 values less than(MAXVALUE)(subpartition p33)
);
drop table test1;
create table test1(c1 bigint);
insert into test1 values(66);
create table hj_test(id int,h1 bigint) partition by range(id) subpartition by hash((select avg(c1) from test1))
(
partition p1 values less than(200)(subpartition p11),
partition p2 values less than(400)(subpartition p22),
partition p3 values less than(MAXVALUE)(subpartition p33)
);
drop table test1;
create table hj_test(id int,h1 bigint) partition by range(id) subpartition by hash(h1)
(
partition p1 values less than(200)(subpartition p11),
partition p2 values less than(400)(subpartition p22),
partition p3 values less than(MAXVALUE)(subpartition p33)
);
INSERT INTO hj_test VALUES (199,231);
INSERT INTO hj_test VALUES (398,453);
INSERT INTO hj_test VALUES (201,54613);
INSERT INTO hj_test VALUES ((select avg(6399) from dual),231);
INSERT INTO hj_test VALUES ((select avg(null) from dual),564);
select id,h1 from hj_test order by id asc;
id	h1
NULL	564
199	231
201	54613
398	453
6399	231
drop table hj_test;
create table hj_test(id int,h1 bigint) partition by list(id) subpartition by key(h1)
(
partition p1 values in(200)(subpartition p11),
partition p2 values in(400)(subpartition p22),
partition p3 values in(600)(subpartition p33)
);
INSERT INTO hj_test VALUES (200,231);
INSERT INTO hj_test VALUES (400,453);
INSERT INTO hj_test VALUES (600,54613);
INSERT INTO hj_test VALUES ((select avg(6399) from dual),231);
INSERT INTO hj_test VALUES ((select avg(null) from dual),564);
INSERT INTO hj_test VALUES ((select avg(600) from dual),null);
select id,h1 from hj_test order by id asc;
id	h1
200	231
400	453
600	54613
600	NULL
select id,h1 from hj_test partition (p1) order by id asc;
id	h1
200	231
select id,h1 from hj_test partition (p2) order by id asc;
id	h1
400	453
select id,h1 from hj_test partition (p3) order by id asc;
id	h1
600	54613
600	NULL
select id,h1 from hj_test subpartition (p11) order by id asc;
select id,h1 from hj_test subpartition (p22) order by id asc;
select id,h1 from hj_test subpartition (p33) order by id asc;
update hj_test partition (p1) set id=(select 201 from dual) where id=200;
update hj_test partition (p1) set id=(select 206 from dual) where h1 is null;
update hj_test partition (p3) set id=(select 601 from dual) where h1 is null;
update hj_test partition (p3) set h1=(select 600 from dual) where h1 is null;
select id,h1 from hj_test order by id asc;
id	h1
200	231
400	453
600	54613
600	600
DELETE from hj_test PARTITION (p3) where id=(select avg(600) from dual);
select id,h1 from hj_test order by id asc;
id	h1
200	231
400	453
DELETE from (select avg(id) from hj_test) PARTITION (p2) where id=(select avg(400) from dual);
drop table hj_test;
# Clean up users
drop user hjw@'%' ;
