drop table if exists t1, t2, info_t;
create table t1(a int, b int, primary key (a, b)) partition by hash(b) partitions 3;
affected rows: 0
insert into t1 values(1, 1), (2, 2), (3, 3), (4, 4), (5, 5), (6, 6);
affected rows: 6
info: Records: 6  Duplicates: 0  Warnings: 0
select * from t1;
a	b
3	3
6	6
1	1
4	4
2	2
5	5
affected rows: 6
update t1 set a=10 where a>0;
affected rows: 6
info: Rows matched: 6  Changed: 6  Warnings: 0
select * from t1;
a	b
10	3
10	6
10	1
10	4
10	2
10	5
affected rows: 6
delete from t1 where a>0;
affected rows: 6
select * from t1;
a	b
affected rows: 0
insert into t1 values(1, 1), (2, 2), (3, 3), (4, 4), (5, 5), (6, 6);
affected rows: 6
info: Records: 6  Duplicates: 0  Warnings: 0
insert into t1 values(1, 1);
ERROR 23000: Duplicate entry '1-1' for key 'PRIMARY'
insert into t1 values(2, 2);
ERROR 23000: Duplicate entry '2-2' for key 'PRIMARY'
insert into t1 values(3, 3), (4, 4);
ERROR 23000: Duplicated primary key
insert into t1 values(6, 6);
ERROR 23000: Duplicate entry '6-6' for key 'PRIMARY'
insert into t1 values(3, 3), (4, 4), (5, 5), (6, 6);
ERROR 23000: Duplicated primary key
delete from t1 where a<0;
affected rows: 0
select * from t1;
a	b
3	3
6	6
1	1
4	4
2	2
5	5
affected rows: 6
update t1 set a=6 where a<0;
affected rows: 0
info: Rows matched: 0  Changed: 0  Warnings: 0
select * from t1;
a	b
3	3
6	6
1	1
4	4
2	2
5	5
affected rows: 6
update t1 set a=5 where a>1;
affected rows: 4
info: Rows matched: 5  Changed: 4  Warnings: 0
select * from t1;
a	b
5	3
5	6
1	1
5	4
5	2
5	5
affected rows: 6
delete from t1 where b>0;
affected rows: 6
insert into t1 values(1, 1), (2, 2), (3, 3), (4, 4), (5, 5), (6, 6);
affected rows: 6
info: Records: 6  Duplicates: 0  Warnings: 0
insert into t1 values(1, 1), (2, 2), (3, 3), (4, 4) on duplicate key update a=values(a)+1;
affected rows: 8
info: Records: 4  Duplicates: 4  Warnings: 0
update t1 set a=10 where b>2 and b<5;
affected rows: 2
info: Rows matched: 2  Changed: 2  Warnings: 0
select * from t1;
a	b
6	6
10	3
2	1
10	4
3	2
5	5
affected rows: 6
drop table t1;
affected rows: 0
CREATE TABLE `info_t`(id INT, gmt_create DATETIME, info VARCHAR(20), PRIMARY KEY (gmt_create))
PARTITION BY RANGE COLUMNS(gmt_create)
(PARTITION p0 VALUES LESS THAN ('2015-01-01 00:00:00'),
PARTITION p1 VALUES LESS THAN ('2016-01-01 00:00:00'),
PARTITION p2 VALUES LESS THAN ('2017-01-01 00:00:00'),
PARTITION p3 VALUES LESS THAN (MAXVALUE));
affected rows: 0
insert into info_t values(1, '2015-06-18', 'alibaba'), (2, '2016-06-18', 'alipay'), (3, '2017-06-18', 'taobao'), (4, '2018-06-18', 'tmall');
affected rows: 4
info: Records: 4  Duplicates: 0  Warnings: 0
insert into info_t values(1, '2015-06-18', 'alibaba'), (2, '2016-06-18', 'alipay'), (3, '2017-06-18', 'taobao') on duplicate key update id=values(id)+1;
affected rows: 6
info: Records: 3  Duplicates: 3  Warnings: 0
select * from info_t;
id	gmt_create	info
2	2015-06-18 00:00:00	alibaba
3	2016-06-18 00:00:00	alipay
4	2017-06-18 00:00:00	taobao
4	2018-06-18 00:00:00	tmall
affected rows: 4
update info_t set id=10 where gmt_create>'2016-06-01' and gmt_create<'2017-06-19';
affected rows: 2
info: Rows matched: 2  Changed: 2  Warnings: 0
select * from info_t;
id	gmt_create	info
2	2015-06-18 00:00:00	alibaba
10	2016-06-18 00:00:00	alipay
10	2017-06-18 00:00:00	taobao
4	2018-06-18 00:00:00	tmall
affected rows: 4
drop table info_t;
affected rows: 0
create table t1(a int, b int, c int, primary key(a, b)) partition by key(a, b) partitions 3;
affected rows: 0
insert into t1 values(1, 1, 1), (2, 2, 2), (3, 3, 3), (4, 4, 4), (5, 5, 5), (6, 6, 6);
affected rows: 6
info: Records: 6  Duplicates: 0  Warnings: 0
select * from t1;
a	b	c
1	1	1
3	3	3
5	5	5
2	2	2
4	4	4
6	6	6
affected rows: 6
update t1 set a=10 where a>0;
affected rows: 6
info: Rows matched: 6  Changed: 6  Warnings: 0
update t1 set a=10, b=20 where a>0;
ERROR 23000: Duplicate entry '10-20' for key 'PRIMARY'
update t1 set a=10, b=20 where a=1 and b=2;
affected rows: 0
info: Rows matched: 0  Changed: 0  Warnings: 0
select * from t1;
a	b	c
10	1	1
10	2	2
10	4	4
10	5	5
10	3	3
10	6	6
affected rows: 6
update t1 set a=10, b=20 where a=1 and b=20;
affected rows: 0
info: Rows matched: 0  Changed: 0  Warnings: 0
update t1 set a=10 where a=11;
affected rows: 0
info: Rows matched: 0  Changed: 0  Warnings: 0
select * from t1;
a	b	c
10	1	1
10	2	2
10	4	4
10	5	5
10	3	3
10	6	6
affected rows: 6
drop table t1;
affected rows: 0
create table t1(a int, b int, c int, primary key(a, b)) partition by key(a, b) partitions 3;
affected rows: 0
insert into t1 values(1, 1, 1), (2, 2, 2), (3, 3, 3), (4, 4, 4), (5, 5, 5), (6, 6, 6);
affected rows: 6
info: Records: 6  Duplicates: 0  Warnings: 0
select * from t1;
a	b	c
1	1	1
3	3	3
5	5	5
2	2	2
4	4	4
6	6	6
affected rows: 6
update t1 set a=1, b=2 where a=10 and b>0;
affected rows: 0
info: Rows matched: 0  Changed: 0  Warnings: 0
update t1 set c=a+1 where a=6 and b<0;
affected rows: 0
info: Rows matched: 0  Changed: 0  Warnings: 0
update t1 set c=a+1 where a=6 and b>0;
affected rows: 1
info: Rows matched: 1  Changed: 1  Warnings: 0
select * from t1;
a	b	c
1	1	1
3	3	3
5	5	5
2	2	2
4	4	4
6	6	7
affected rows: 6
update t1 set c=c+a where b=10 and a<0;
affected rows: 0
info: Rows matched: 0  Changed: 0  Warnings: 0
select * from t1;
a	b	c
1	1	1
3	3	3
5	5	5
2	2	2
4	4	4
6	6	7
affected rows: 6
drop table t1;
affected rows: 0
create table t1(a int, b datetime, c varchar(20), primary key(b, c))
partition by range columns(b, c) (
partition p0 values less than ('2015-01-01', 'abc'),
partition p1 values less than ('2016-01-01', 'bcd'),
partition p2 values less than ('2017-01-01', 'cde'),
partition p3 values less than (MAXVALUE, MAXVALUE)
);
affected rows: 0
insert into t1 values(1, '2015-06-01', 'aaa'), (2, '2016-06-01', 'bbb'), (3, '2017-06-01', 'ccc'), (4, '2018-06-01', 'ddd');
affected rows: 4
info: Records: 4  Duplicates: 0  Warnings: 0
select * from t1;
a	b	c
1	2015-06-01 00:00:00	aaa
2	2016-06-01 00:00:00	bbb
3	2017-06-01 00:00:00	ccc
4	2018-06-01 00:00:00	ddd
affected rows: 4
update t1 set b='2017-06-18' where b>'2017-06-02';
affected rows: 1
info: Rows matched: 1  Changed: 1  Warnings: 0
select * from t1;
a	b	c
1	2015-06-01 00:00:00	aaa
2	2016-06-01 00:00:00	bbb
3	2017-06-01 00:00:00	ccc
4	2017-06-18 00:00:00	ddd
affected rows: 4
update t1 set a=10, b='20170618', c='aaa';
ERROR 23000: Duplicate entry '2017-06-18 00:00:00.000000-aaa' for key 'PRIMARY'
update t1 set a=10;
affected rows: 4
info: Rows matched: 4  Changed: 4  Warnings: 0
select * from t1;
a	b	c
10	2015-06-01 00:00:00	aaa
10	2016-06-01 00:00:00	bbb
10	2017-06-01 00:00:00	ccc
10	2017-06-18 00:00:00	ddd
affected rows: 4
delete from t1 where c>'cccbc';
affected rows: 1
select * from t1;
a	b	c
10	2015-06-01 00:00:00	aaa
10	2016-06-01 00:00:00	bbb
10	2017-06-01 00:00:00	ccc
affected rows: 3
drop table t1;
affected rows: 0
create table t1(a int, b int, c int, d int, primary key(a, b, c)) partition by key(b, c) partitions 5;
affected rows: 0
insert into t1 values(1, 1, 1, 1), (2, 2, 2, 2), (3, 3, 3, 3), (4, 4, 4, 4), (5, 5, 5, 5), (6, 6, 6, 6);
affected rows: 6
info: Records: 6  Duplicates: 0  Warnings: 0
update t1 set a=10 where b>5 and c>5;
affected rows: 1
info: Rows matched: 1  Changed: 1  Warnings: 0
select * from t1;
a	b	c	d
5	5	5	5
1	1	1	1
3	3	3	3
4	4	4	4
10	6	6	6
2	2	2	2
affected rows: 6
update t1 set a=10, b=1 where b>5 and c<5;
affected rows: 0
info: Rows matched: 0  Changed: 0  Warnings: 0
update t1 set a=10 where b>5 and c<5;
affected rows: 0
info: Rows matched: 0  Changed: 0  Warnings: 0
select * from t1;
a	b	c	d
5	5	5	5
1	1	1	1
3	3	3	3
4	4	4	4
10	6	6	6
2	2	2	2
affected rows: 6
update t1 set a=10 where a>0 order by a;
affected rows: 5
info: Rows matched: 6  Changed: 5  Warnings: 0
select * from t1;
a	b	c	d
10	5	5	5
10	1	1	1
10	3	3	3
10	4	4	4
10	6	6	6
10	2	2	2
affected rows: 6
update t1 set a=10 where a>0 order by a limit 1;
affected rows: 0
info: Rows matched: 1  Changed: 0  Warnings: 0
drop table t1;
affected rows: 0
create table t1(a int, b int, c int, d int, primary key(a, b, c)) partition by key(b, c) partitions 5;
affected rows: 0
insert into t1 values(1, 1, 1, 1), (2, 2, 2, 2), (3, 3, 3, 3), (4, 4, 4, 4), (5, 5, 5, 5), (6, 6, 6, 6);
affected rows: 6
info: Records: 6  Duplicates: 0  Warnings: 0
create table t2(a int, b int, primary key(a, b)) partition by key(a, b) partitions 5;
affected rows: 0
insert into t2 values(1, 2), (2, 1);
affected rows: 2
info: Records: 2  Duplicates: 0  Warnings: 0
update t1 set a=(select a from t2 where a=1 and b=2) where b in (select b from t2);
affected rows: 1
info: Rows matched: 2  Changed: 1  Warnings: 0
select * from t1;
a	b	c	d
5	5	5	5
1	1	1	1
3	3	3	3
4	4	4	4
6	6	6	6
1	2	2	2
affected rows: 6
drop table t1, t2;
affected rows: 0
create table t1(a int, b int, c int, d int, primary key(a, b, c))
partition by range columns(c) subpartition by hash(b) subpartitions 5 (
partition p0 values less than (1),
partition p1 values less than (2),
partition p2 values less than (3),
partition p3 values less than (4),
partition p4 values less than (maxvalue)
);
affected rows: 0
insert into t1 values(1, 1, 1, 1), (2, 2, 2, 2), (3, 3, 3, 3), (4, 4, 4, 4), (5, 5, 5, 5), (6, 6, 6, 6);
affected rows: 6
info: Records: 6  Duplicates: 0  Warnings: 0
insert into t1 values(1, 1, 1, 1), (2, 2, 2, 2), (3, 3, 3, 3), (4, 4, 4, 4) on duplicate key update a=values(a)+2, d=values(d)+1;
affected rows: 8
info: Records: 4  Duplicates: 4  Warnings: 0
select * from t1;
a	b	c	d
4	2	2	3
6	4	4	5
6	6	6	6
5	5	5	5
5	3	3	4
3	1	1	2
affected rows: 6
update t1 set a=10 where c>0 and b=1;
affected rows: 1
info: Rows matched: 1  Changed: 1  Warnings: 0
select * from t1;
a	b	c	d
4	2	2	3
6	4	4	5
6	6	6	6
5	5	5	5
5	3	3	4
10	1	1	2
affected rows: 6
update t1 set a=10, d=10 where c>0 and b>0;
affected rows: 6
info: Rows matched: 6  Changed: 6  Warnings: 0
select * from t1;
a	b	c	d
10	2	2	10
10	4	4	10
10	6	6	10
10	5	5	10
10	3	3	10
10	1	1	10
affected rows: 6
update t1 set a=10, d=a where c=1 and b=1;
affected rows: 0
info: Rows matched: 1  Changed: 0  Warnings: 0
select * from t1;
a	b	c	d
10	2	2	10
10	4	4	10
10	6	6	10
10	5	5	10
10	3	3	10
10	1	1	10
affected rows: 6
update t1 set a=10, d=a where c=1 and b>0;
affected rows: 0
info: Rows matched: 1  Changed: 0  Warnings: 0
select * from t1;
a	b	c	d
10	2	2	10
10	4	4	10
10	6	6	10
10	5	5	10
10	3	3	10
10	1	1	10
affected rows: 6
update t1 set a=10, d=a where c=2 and b>0 order by d;
affected rows: 0
info: Rows matched: 1  Changed: 0  Warnings: 0
select * from t1;
a	b	c	d
10	2	2	10
10	4	4	10
10	6	6	10
10	5	5	10
10	3	3	10
10	1	1	10
affected rows: 6
update t1 set a=10, d=a where c=2 and b>0 order by d limit 10;
affected rows: 0
info: Rows matched: 1  Changed: 0  Warnings: 0
drop table t1;
affected rows: 0
create table t1(a int, b int, c int, primary key(a, b)) partition by hash(b) partitions 5;
affected rows: 0
create table t2(a int, b int, c int, primary key(a, b)) partition by hash(b) partitions 5;
affected rows: 0
insert into t1 values(1, 1, 1), (2, 2, 2), (3, 3, 3), (4, 4, 4), (5, 5, 5), (6, 6, 6);
affected rows: 6
info: Records: 6  Duplicates: 0  Warnings: 0
insert into t2 values(1, 1, 1), (2, 2, 2), (3, 3, 3), (4, 4, 4), (5, 5, 5), (6, 6, 6);
affected rows: 6
info: Records: 6  Duplicates: 0  Warnings: 0
explain basic update t1 set a=10 where b in (select b from t2);
Query Plan
=======================================
|ID|OPERATOR           |NAME          |
---------------------------------------
|0 |EXCHANGE IN DISTR  |              |
|1 | EXCHANGE OUT DISTR|              |
|2 |  UPDATE           |              |
|3 |   MERGE JOIN      |              |
|4 |    SORT           |              |
|5 |     TABLE SCAN    |t1            |
|6 |    SUBPLAN SCAN   |SUBQUERY_TABLE|
|7 |     MERGE DISTINCT|              |
|8 |      SORT         |              |
|9 |       TABLE SCAN  |t2            |
=======================================

Outputs & filters: 
-------------------------------------
  0 - output(nil), filter(nil)
  1 - output(nil), filter(nil)
  2 - output(nil), filter(nil), params([{t1: (t1.a, t1.b, t1.c)}]), update([t1.a=?])
  3 - output([t1.a], [t1.b], [t1.c], [?]), filter(nil), 
      equal_conds([t1.b = SUBQUERY_TABLE.b]), other_conds(nil)
  4 - output([t1.a], [t1.b], [t1.c]), filter(nil), sort_keys([t1.b, ASC])
  5 - output([t1.b], [t1.a], [t1.c]), filter(nil), 
      access([t1.b], [t1.a], [t1.c]), partitions(p[0-4])
  6 - output([SUBQUERY_TABLE.b]), filter(nil), 
      access([SUBQUERY_TABLE.b])
  7 - output([t2.b]), filter(nil), 
      distinct([t2.b])
  8 - output([t2.b]), filter(nil), sort_keys([t2.b, ASC])
  9 - output([t2.b]), filter(nil), 
      access([t2.b]), partitions(p[0-4])

affected rows: 1
update t1 set a=10 where b in (select b from t2);
affected rows: 6
info: Rows matched: 6  Changed: 6  Warnings: 0
select * from t1;
a	b	c
10	5	5
10	1	1
10	6	6
10	2	2
10	3	3
10	4	4
affected rows: 6
update t1 set a=(select a from t2) where b in (select b from t2);
ERROR 21000: Subquery returns more than 1 row
drop table t1, t2;
affected rows: 0
create table t1(a int, b int, c int, primary key(a, b)) partition by key(a, b) partitions 5;
affected rows: 0
create table t2(a int, b int, c int, primary key(a, b)) partition by key(a, b) partitions 5;
affected rows: 0
insert into t1 values(1, 1, 1), (2, 2, 2), (3, 3, 3), (4, 4, 4), (5, 5, 5), (6, 6, 6);
affected rows: 6
info: Records: 6  Duplicates: 0  Warnings: 0
insert into t2 values(1, 1, 1), (2, 2, 2), (3, 3, 3), (4, 4, 4), (5, 5, 5), (6, 6, 6);
affected rows: 6
info: Records: 6  Duplicates: 0  Warnings: 0
explain basic delete from t1 where (a, b) in (select a, b from t2);
Query Plan
=======================================
|ID|OPERATOR           |NAME          |
---------------------------------------
|0 |EXCHANGE IN DISTR  |              |
|1 | EXCHANGE OUT DISTR|              |
|2 |  DELETE           |              |
|3 |   MERGE JOIN      |              |
|4 |    TABLE SCAN     |t1            |
|5 |    SUBPLAN SCAN   |SUBQUERY_TABLE|
|6 |     TABLE SCAN    |t2            |
=======================================

Outputs & filters: 
-------------------------------------
  0 - output(nil), filter(nil)
  1 - output(nil), filter(nil)
  2 - output(nil), filter(nil), params([{t1: (t1.a, t1.b, t1.c)}])
  3 - output([t1.a], [t1.b], [t1.c]), filter(nil), 
      equal_conds([t1.a = SUBQUERY_TABLE.a], [t1.b = SUBQUERY_TABLE.b]), other_conds(nil)
  4 - output([t1.a], [t1.b], [t1.c]), filter(nil), 
      access([t1.a], [t1.b], [t1.c]), partitions(p[0-4])
  5 - output([SUBQUERY_TABLE.a], [SUBQUERY_TABLE.b]), filter(nil), 
      access([SUBQUERY_TABLE.a], [SUBQUERY_TABLE.b])
  6 - output([t2.a], [t2.b]), filter(nil), 
      access([t2.a], [t2.b]), partitions(p[0-4])

affected rows: 1
delete from t1 where (a, b) in (select a, b from t2);
affected rows: 6
select * from t1;
a	b	c
affected rows: 0
drop table t1, t2;
affected rows: 0
create table t1(a int, b int, c int, d int, primary key(a, b, c)) 
partition by range columns(c) subpartition by hash(b) subpartitions 5 ( 
partition p0 values less than (1),
partition p1 values less than (2),
partition p2 values less than (3),
partition p3 values less than (4),
partition p4 values less than (maxvalue)
);
affected rows: 0
create table t2(a int, b int, c int, d int, primary key(a, b, c))
partition by range columns(c) subpartition by hash(b) subpartitions 5 ( 
partition p0 values less than (1),
partition p1 values less than (2),
partition p2 values less than (3),
partition p3 values less than (4),
partition p4 values less than (maxvalue)
);
affected rows: 0
insert into t1 values(1, 1, 1, 1), (2, 2, 2, 2), (3, 3, 3, 3), (4, 4, 4, 4), (5, 5, 5, 5), (6, 6, 6, 6);
affected rows: 6
info: Records: 6  Duplicates: 0  Warnings: 0
insert into t2 values(1, 1, 1, 1), (2, 2, 2, 2), (3, 3, 3, 3), (4, 4, 4, 4), (5, 5, 5, 5), (6, 6, 6, 6);
affected rows: 6
info: Records: 6  Duplicates: 0  Warnings: 0
explain basic update t1 set a=10 where (b, c) in (select b, c from t2);
Query Plan
=======================================
|ID|OPERATOR           |NAME          |
---------------------------------------
|0 |EXCHANGE IN DISTR  |              |
|1 | EXCHANGE OUT DISTR|              |
|2 |  UPDATE           |              |
|3 |   HASH JOIN       |              |
|4 |    SUBPLAN SCAN   |SUBQUERY_TABLE|
|5 |     HASH DISTINCT |              |
|6 |      TABLE SCAN   |t2            |
|7 |    TABLE SCAN     |t1            |
=======================================

Outputs & filters: 
-------------------------------------
  0 - output(nil), filter(nil)
  1 - output(nil), filter(nil)
  2 - output(nil), filter(nil), params([{t1: (t1.a, t1.b, t1.c, t1.d)}]), update([t1.a=?])
  3 - output([t1.a], [t1.b], [t1.c], [t1.d], [?]), filter(nil), 
      equal_conds([t1.b = SUBQUERY_TABLE.b], [t1.c = SUBQUERY_TABLE.c]), other_conds(nil)
  4 - output([SUBQUERY_TABLE.b], [SUBQUERY_TABLE.c]), filter(nil), 
      access([SUBQUERY_TABLE.b], [SUBQUERY_TABLE.c])
  5 - output([t2.b], [t2.c]), filter(nil), 
      distinct([t2.b], [t2.c])
  6 - output([t2.c], [t2.b]), filter(nil), 
      access([t2.c], [t2.b]), partitions(p0sp[0-4], p1sp[0-4], p2sp[0-4], p3sp[0-4], p4sp[0-4])
  7 - output([t1.c], [t1.b], [t1.a], [t1.d]), filter(nil), 
      access([t1.c], [t1.b], [t1.a], [t1.d]), partitions(p0sp[0-4], p1sp[0-4], p2sp[0-4], p3sp[0-4], p4sp[0-4])

affected rows: 1
update t1 set a=10 where (b, c) in (select b, c from t2);
affected rows: 6
info: Rows matched: 6  Changed: 6  Warnings: 0
select * from t1;
a	b	c	d
10	2	2	2
10	4	4	4
10	6	6	6
10	5	5	5
10	3	3	3
10	1	1	1
affected rows: 6
update t1 set a=10 where b in (select b from t2);
affected rows: 0
info: Rows matched: 6  Changed: 0  Warnings: 0
drop table t1, t2;
affected rows: 0
create table t1(a int, b int, primary key(a, b)) partition by hash(b) partitions 3;
affected rows: 0
replace into t1 values(1, 1), (2, 2), (3, 3), (4, 4), (5, 5), (6, 6);
affected rows: 6
info: Records: 6  Duplicates: 0  Warnings: 0
insert into t1 values(1, 1), (2, 2), (3, 3), (4, 4), (5, 5), (6, 6) on duplicate key update a=1;
affected rows: 10
info: Records: 6  Duplicates: 5  Warnings: 0
select * from t1;
a	b
1	3
1	6
1	1
1	4
1	2
1	5
affected rows: 6
delete from t1;
affected rows: 6
insert into t1 values(1, 1), (2, 2), (3, 3), (4, 4), (5, 5), (6, 6);
affected rows: 6
info: Records: 6  Duplicates: 0  Warnings: 0
select * from t1;
a	b
3	3
6	6
1	1
4	4
2	2
5	5
affected rows: 6
replace into t1 values(1, 1), (2, 2), (3, 3), (4, 4), (5, 5), (6, 6), (7, 7), (5, 5);
affected rows: 8
info: Records: 8  Duplicates: 0  Warnings: 0
select * from t1;
a	b
3	3
6	6
1	1
4	4
7	7
2	2
5	5
affected rows: 7
drop table t1;
affected rows: 0
create table t1(a int, b int) partition by hash(b) partitions 5;
affected rows: 0
create table t2(a int, b int) partition by hash(b) partitions 5;
affected rows: 0
insert into t1 values(1, 1), (2, 2), (3, 3), (4, 4), (5, 5), (6, 6);
affected rows: 6
info: Records: 6  Duplicates: 0  Warnings: 0
explain basic insert into t2 partition(p0) select * from t1 partition(p0);
Query Plan
=====================
|ID|OPERATOR   |NAME|
---------------------
|0 |INSERT     |    |
|1 | TABLE SCAN|t1  |
=====================

Outputs & filters: 
-------------------------------------
  0 - output([nextval(1)], [?], [()], [t1.a], [t1.b]), filter(nil), 
      columns([t2.__pk_increment], [t2.__pk_cluster_id], [t2.__pk_partition_id], [t2.a], [t2.b]), partitions(p0)
  1 - output([t1.a], [t1.b]), filter(nil), 
      access([t1.b], [t1.a]), partitions(p0)

affected rows: 1
insert into t2 partition(p0) select * from t1 partition(p0);
affected rows: 1
select * from t1;
a	b
5	5
1	1
6	6
2	2
3	3
4	4
affected rows: 6
select * from t2;
a	b
5	5
affected rows: 1
insert into t2 select * from t1 where b=2;
affected rows: 1
select * from t2;
a	b
5	5
2	2
affected rows: 2
drop table t1, t2;
affected rows: 0
CREATE TABLE t1(`c1` int(11) DEFAULT NULL, `c2` int(11) DEFAULT NULL ) partition by range(c1) (partition p0 values less than (10), partition p1 values less than (20));
affected rows: 0
CREATE TABLE t2(`c1` int(11) DEFAULT NULL, `c2` int(11) DEFAULT NULL ) partition by range(c1) (partition p0 values less than (10), partition p1 values less than (20));
affected rows: 0
insert into t1 values(1, 1), (2, 2), (3, 3), (4, 4), (11, 11), (12, 12), (13, 13), (14, 14);
affected rows: 8
info: Records: 8  Duplicates: 0  Warnings: 0
explain basic insert into t2 select * from t1 where c1<9;
Query Plan
=====================
|ID|OPERATOR   |NAME|
---------------------
|0 |INSERT     |    |
|1 | TABLE SCAN|t1  |
=====================

Outputs & filters: 
-------------------------------------
  0 - output([nextval(1)], [?], [()], [t1.c1], [t1.c2]), filter(nil), 
      columns([t2.__pk_increment], [t2.__pk_cluster_id], [t2.__pk_partition_id], [t2.c1], [t2.c2]), partitions(p0)
  1 - output([t1.c1], [t1.c2]), filter([t1.c1 < 9]), 
      access([t1.c1], [t1.c2]), partitions(p0)

affected rows: 1
insert into t2 select * from t1 where c1<9;
affected rows: 4
info: Records: 4  Duplicates: 0  Warnings: 0
select * from t1;
c1	c2
1	1
2	2
3	3
4	4
11	11
12	12
13	13
14	14
affected rows: 8
select * from t2;
c1	c2
1	1
2	2
3	3
4	4
affected rows: 4
insert into t2 select * from t1 where c1<8;
affected rows: 4
info: Records: 4  Duplicates: 0  Warnings: 0
insert into t2 select * from t1 where c1<7;
affected rows: 4
info: Records: 4  Duplicates: 0  Warnings: 0
select * from t2;
c1	c2
1	1
2	2
3	3
4	4
1	1
2	2
3	3
4	4
1	1
2	2
3	3
4	4
affected rows: 12
select hit_count from oceanbase.GV$OB_PLAN_CACHE_PLAN_STAT where tenant_id=1 and statement='insert into t2 select * from t1 where c1<?';
hit_count
2
affected rows: 1
drop table t1, t2;
affected rows: 0
create table t1(a int, b int, c int, primary key(a, b)) partition by range(a) subpartition by hash(b) subpartitions 5 (partition p0 values less than(10), partition p1 values less than(20));
affected rows: 0
create table t2(a int, b int, c int, primary key(a, b)) partition by range(a) subpartition by hash(b) subpartitions 5 (partition p0 values less than(10), partition p1 values less than(20));
affected rows: 0
explain basic insert into t1 select * from t2 where a<9 and b=1;
Query Plan
=====================
|ID|OPERATOR   |NAME|
---------------------
|0 |INSERT     |    |
|1 | TABLE SCAN|t2  |
=====================

Outputs & filters: 
-------------------------------------
  0 - output([t2.a], [t2.b], [t2.c]), filter(nil), 
      columns([t1.a], [t1.b], [t1.c]), partitions(p0sp1)
  1 - output([t2.a], [t2.b], [t2.c]), filter([t2.b = 1]), 
      access([t2.a], [t2.b], [t2.c]), partitions(p0sp1)

affected rows: 1
insert into t2 values(1, 1, 1), (2, 2, 2), (3, 3, 3), (8, 8, 8), (11, 11, 11), (12, 12, 12), (13, 13, 13);
affected rows: 7
info: Records: 7  Duplicates: 0  Warnings: 0
insert into t1 select * from t2 where a<9 and b=1;
affected rows: 1
select * from t1;
a	b	c
1	1	1
affected rows: 1
select * from t2;
a	b	c
1	1	1
2	2	2
3	3	3
8	8	8
11	11	11
12	12	12
13	13	13
affected rows: 7
drop table t1, t2;
affected rows: 0
