drop table t1;
drop table t2;
drop table info_t;
create table t1(a int, b int, primary key (a, b)) partition by hash(b) partitions 3;
affected rows: 0
insert into t1 values(1, 1);
affected rows: 1
insert into t1 values(2, 2);
affected rows: 1
insert into t1 values(3, 3);
affected rows: 1
insert into t1 values(4, 4);
affected rows: 1
insert into t1 values(5, 5);
affected rows: 1
insert into t1 values(6, 6);
affected rows: 1
select * from t1;
A	B
2	2
1	1
4	4
6	6
3	3
5	5
affected rows: 6
update t1 set a=10 where a>0;
affected rows: 6
info: Rows matched: 6  Changed: 6  Warnings: 0
select * from t1;
A	B
10	2
10	1
10	4
10	6
10	3
10	5
affected rows: 6
delete from t1 where a>0;
affected rows: 6
select * from t1;
A	B
affected rows: 0
insert into t1 values(1, 1);
affected rows: 1
insert into t1 values(2, 2);
affected rows: 1
insert into t1 values(3, 3);
affected rows: 1
insert into t1 values(4, 4);
affected rows: 1
insert into t1 values(5, 5);
affected rows: 1
insert into t1 values(6, 6);
affected rows: 1
insert into t1 values(1, 1);
ERROR 23000: unique constraint '1-1' for key 'T1_OBPK_1234' violated
insert into t1 values(2, 2);
ERROR 23000: unique constraint '2-2' for key 'T1_OBPK_1234' violated
insert into t1 values(3, 3);
ERROR 23000: unique constraint '3-3' for key 'T1_OBPK_1234' violated
insert into t1 values(4, 4);
ERROR 23000: unique constraint '4-4' for key 'T1_OBPK_1234' violated
insert into t1 values(6, 6);
ERROR 23000: unique constraint '6-6' for key 'T1_OBPK_1234' violated
insert into t1 values(3, 3);
ERROR 23000: unique constraint '3-3' for key 'T1_OBPK_1234' violated
insert into t1 values(4, 4);
ERROR 23000: unique constraint '4-4' for key 'T1_OBPK_1234' violated
insert into t1 values(5, 5);
ERROR 23000: unique constraint '5-5' for key 'T1_OBPK_1234' violated
insert into t1 values(6, 6);
ERROR 23000: unique constraint '6-6' for key 'T1_OBPK_1234' violated
delete from t1 where a<0;
affected rows: 0
select * from t1;
A	B
2	2
1	1
4	4
6	6
3	3
5	5
affected rows: 6
update t1 set a=6 where a<0;
affected rows: 0
info: Rows matched: 0  Changed: 0  Warnings: 0
select * from t1;
A	B
2	2
1	1
4	4
6	6
3	3
5	5
affected rows: 6
update t1 set a=5 where a>1;
affected rows: 5
info: Rows matched: 5  Changed: 5  Warnings: 0
select * from t1;
A	B
5	2
1	1
5	4
5	6
5	3
5	5
affected rows: 6
delete from t1 where b>0;
affected rows: 6
insert into t1 values(1, 1);
affected rows: 1
insert into t1 values(2, 2);
affected rows: 1
insert into t1 values(3, 3);
affected rows: 1
insert into t1 values(4, 4);
affected rows: 1
insert into t1 values(5, 5);
affected rows: 1
insert into t1 values(6, 6);
affected rows: 1
insert into t1 values(1, 1);
ERROR 23000: unique constraint '1-1' for key 'T1_OBPK_1234' violated
insert into t1 values(2, 2);
ERROR 23000: unique constraint '2-2' for key 'T1_OBPK_1234' violated
insert into t1 values(3, 3);
ERROR 23000: unique constraint '3-3' for key 'T1_OBPK_1234' violated
insert into t1 values(4, 4);
ERROR 23000: unique constraint '4-4' for key 'T1_OBPK_1234' violated
update t1 set a=10 where b>2 and b<5;
affected rows: 2
info: Rows matched: 2  Changed: 2  Warnings: 0
select * from t1;
A	B
2	2
1	1
6	6
10	4
5	5
10	3
affected rows: 6
drop table t1;
affected rows: 0
CREATE TABLE info_t(id INT, gmt_create DATE, info VARCHAR(20), PRIMARY KEY (gmt_create))
PARTITION BY RANGE (gmt_create)
(PARTITION p0 VALUES LESS THAN (to_date('2015-01-01 00:00:00','YYYY-MM-DD HH24:MI:SS')),
PARTITION p1 VALUES LESS THAN (to_date('2016-01-01 00:00:00','YYYY-MM-DD HH24:MI:SS')),
PARTITION p2 VALUES LESS THAN (to_date('2017-01-01 00:00:00','YYYY-MM-DD HH24:MI:SS')),
PARTITION p3 VALUES LESS THAN (MAXVALUE));
affected rows: 0
insert into info_t values(1, to_date('2015-06-18','YYYY-MM-DD HH24:MI:SS'), 'alibaba');
affected rows: 1
insert into info_t values(2, to_date('2016-06-18','YYYY-MM-DD HH24:MI:SS'), 'alipay');
affected rows: 1
insert into info_t values(3, to_date('2017-06-18','YYYY-MM-DD HH24:MI:SS'), 'taobao');
affected rows: 1
insert into info_t values(4, to_date('2018-06-18','YYYY-MM-DD HH24:MI:SS'), 'tmall');
affected rows: 1
insert into info_t values(1, to_date('2015-06-18','YYYY-MM-DD HH24:MI:SS'), 'alibaba');
ERROR 23000: unique constraint '2015-06-18 00:00:00' for key 'INFO_T_OBPK_1234' violated
insert into info_t values(2, to_date('2016-06-18','YYYY-MM-DD HH24:MI:SS'), 'alipay');
ERROR 23000: unique constraint '2016-06-18 00:00:00' for key 'INFO_T_OBPK_1234' violated
insert into info_t values(3, to_date('2017-06-18','YYYY-MM-DD HH24:MI:SS'), 'taobao');
ERROR 23000: unique constraint '2017-06-18 00:00:00' for key 'INFO_T_OBPK_1234' violated
select * from info_t;
ID	GMT_CREATE	INFO
1	2015-06-18 00:00:00	alibaba
2	2016-06-18 00:00:00	alipay
3	2017-06-18 00:00:00	taobao
4	2018-06-18 00:00:00	tmall
affected rows: 4
update info_t set id=10 where gmt_create>'2016-06-01' and gmt_create<'2017-06-19';
affected rows: 2
info: Rows matched: 2  Changed: 2  Warnings: 0
select * from info_t;
ID	GMT_CREATE	INFO
1	2015-06-18 00:00:00	alibaba
10	2016-06-18 00:00:00	alipay
10	2017-06-18 00:00:00	taobao
4	2018-06-18 00:00:00	tmall
affected rows: 4
drop table info_t;
affected rows: 0
create table t1(a int, b int, c int, primary key(a, b)) partition by hash(a, b) partitions 3;
affected rows: 0
insert into t1 values(1, 1, 1);
affected rows: 1
insert into t1 values(2, 2, 2);
affected rows: 1
insert into t1 values(3, 3, 3);
affected rows: 1
insert into t1 values(4, 4, 4);
affected rows: 1
insert into t1 values(5, 5, 5);
affected rows: 1
insert into t1 values(6, 6, 6);
affected rows: 1
select * from t1;
A	B	C
2	2	2
6	6	6
1	1	1
4	4	4
5	5	5
3	3	3
affected rows: 6
update t1 set a=10 where a>0;
ERROR HY000: updating partition key column would cause a partition change
alter table t1 enable row movement;
affected rows: 0
update t1 set a=10, b=20 where a>0;
ERROR 23000: unique constraint '10-20' for key 'T1_OBPK_1234' violated
update t1 set a=10, b=20 where a=1 and b=2;
affected rows: 0
info: Rows matched: 0  Changed: 0  Warnings: 0
select * from t1;
A	B	C
2	2	2
6	6	6
1	1	1
4	4	4
5	5	5
3	3	3
affected rows: 6
update t1 set a=10, b=20 where a=1 and b=20;
affected rows: 0
info: Rows matched: 0  Changed: 0  Warnings: 0
update t1 set a=10 where a=11;
affected rows: 0
info: Rows matched: 0  Changed: 0  Warnings: 0
select * from t1;
A	B	C
2	2	2
6	6	6
1	1	1
4	4	4
5	5	5
3	3	3
affected rows: 6
drop table t1;
affected rows: 0
create table t1(a int, b int, c int, primary key(a, b)) partition by hash(a, b) partitions 3;
affected rows: 0
insert into t1 values(1, 1, 1);
affected rows: 1
insert into t1 values(2, 2, 2);
affected rows: 1
insert into t1 values(3, 3, 3);
affected rows: 1
insert into t1 values(4, 4, 4);
affected rows: 1
insert into t1 values(5, 5, 5);
affected rows: 1
insert into t1 values(6, 6, 6);
affected rows: 1
select * from t1;
A	B	C
2	2	2
6	6	6
1	1	1
4	4	4
5	5	5
3	3	3
affected rows: 6
update t1 set a=1, b=2 where a=10 and b>0;
affected rows: 0
info: Rows matched: 0  Changed: 0  Warnings: 0
update t1 set c=a+1 where a=6 and b<0;
affected rows: 0
info: Rows matched: 0  Changed: 0  Warnings: 0
update t1 set c=a+1 where a=6 and b>0;
affected rows: 1
info: Rows matched: 1  Changed: 1  Warnings: 0
select * from t1;
A	B	C
2	2	2
6	6	7
1	1	1
4	4	4
5	5	5
3	3	3
affected rows: 6
update t1 set c=c+a where b=10 and a<0;
affected rows: 0
info: Rows matched: 0  Changed: 0  Warnings: 0
select * from t1;
A	B	C
2	2	2
6	6	7
1	1	1
4	4	4
5	5	5
3	3	3
affected rows: 6
drop table t1;
affected rows: 0
create table t1(a int, b date, c varchar(20), primary key(b, c))
partition by range (b, c) (
partition p0 values less than (to_date('2015-01-01 00:00:00','YYYY-MM-DD HH24:MI:SS'), 'abc'),
partition p1 values less than (to_date('2016-01-01 00:00:00','YYYY-MM-DD HH24:MI:SS'), 'bcd'),
partition p2 values less than (to_date('2017-01-01 00:00:00','YYYY-MM-DD HH24:MI:SS'), 'cde'),
partition p3 values less than (MAXVALUE, MAXVALUE)
);
affected rows: 0
insert into t1 values(1, to_date('2015-06-01','YYYY-MM-DD HH24:MI:SS'), 'aaa');
affected rows: 1
insert into t1 values(2, to_date('2016-06-01','YYYY-MM-DD HH24:MI:SS'), 'bbb');
affected rows: 1
insert into t1 values(3, to_date('2017-06-01','YYYY-MM-DD HH24:MI:SS'), 'ccc');
affected rows: 1
insert into t1 values(4, to_date('2018-06-01','YYYY-MM-DD HH24:MI:SS'), 'ddd');
affected rows: 1
select * from t1;
A	B	C
1	2015-06-01 00:00:00	aaa
2	2016-06-01 00:00:00	bbb
3	2017-06-01 00:00:00	ccc
4	2018-06-01 00:00:00	ddd
affected rows: 4
update t1 set b='2017-06-18' where b>to_date('2017-06-02','YYYY-MM-DD HH24:MI:SS');
affected rows: 1
info: Rows matched: 1  Changed: 1  Warnings: 0
select * from t1;
A	B	C
1	2015-06-01 00:00:00	aaa
2	2016-06-01 00:00:00	bbb
3	2017-06-01 00:00:00	ccc
4	2017-06-18 00:00:00	ddd
affected rows: 4
alter table t1 enable row movement;
affected rows: 0
update t1 set a=10, b='20170618', c='aaa';
ERROR 23000: unique constraint '2017-06-18 00:00:00-aaa' for key 'T1_OBPK_1234' violated
update t1 set a=10;
affected rows: 4
info: Rows matched: 4  Changed: 4  Warnings: 0
select * from t1;
A	B	C
10	2015-06-01 00:00:00	aaa
10	2016-06-01 00:00:00	bbb
10	2017-06-01 00:00:00	ccc
10	2017-06-18 00:00:00	ddd
affected rows: 4
delete from t1 where c>'cccbc';
affected rows: 1
select * from t1;
A	B	C
10	2015-06-01 00:00:00	aaa
10	2016-06-01 00:00:00	bbb
10	2017-06-01 00:00:00	ccc
affected rows: 3
drop table t1;
affected rows: 0
create table t1(a int, b int, c int, d int, primary key(a, b, c)) partition by HASH(b, c) partitions 5;
affected rows: 0
insert into t1 values(1, 1, 1, 1);
affected rows: 1
insert into t1 values (2, 2, 2, 2);
affected rows: 1
insert into t1 values (3, 3, 3, 3);
affected rows: 1
insert into t1 values (4, 4, 4, 4);
affected rows: 1
insert into t1 values (5, 5, 5, 5);
affected rows: 1
insert into t1 values (6, 6, 6, 6);
affected rows: 1
update t1 set a=10 where b>5 and c>5;
affected rows: 1
info: Rows matched: 1  Changed: 1  Warnings: 0
select * from t1;
A	B	C	D
2	2	2	2
10	6	6	6
1	1	1	1
4	4	4	4
3	3	3	3
5	5	5	5
affected rows: 6
update t1 set a=10, b=1 where b>5 and c<5;
affected rows: 0
info: Rows matched: 0  Changed: 0  Warnings: 0
update t1 set a=10 where b>5 and c<5;
affected rows: 0
info: Rows matched: 0  Changed: 0  Warnings: 0
select * from t1;
A	B	C	D
2	2	2	2
10	6	6	6
1	1	1	1
4	4	4	4
3	3	3	3
5	5	5	5
affected rows: 6
update t1 set a=10 where a>0;
affected rows: 6
info: Rows matched: 6  Changed: 6  Warnings: 0
select * from t1;
A	B	C	D
10	2	2	2
10	6	6	6
10	1	1	1
10	4	4	4
10	3	3	3
10	5	5	5
affected rows: 6
update t1 set a=10 where a>0;
affected rows: 6
info: Rows matched: 6  Changed: 6  Warnings: 0
drop table t1;
affected rows: 0
create table t1(a int, b int, c int, d int, primary key(a, b, c)) partition by hash(b, c) partitions 5;
affected rows: 0
insert into t1 values(1, 1, 1, 1);
affected rows: 1
insert into t1 values (2, 2, 2, 2);
affected rows: 1
insert into t1 values (3, 3, 3, 3);
affected rows: 1
insert into t1 values (4, 4, 4, 4);
affected rows: 1
insert into t1 values (5, 5, 5, 5);
affected rows: 1
insert into t1 values (6, 6, 6, 6);
affected rows: 1
create table t2(a int, b int, primary key(a, b)) partition by hash(a, b) partitions 5;
affected rows: 0
insert into t2 values(1, 2);
affected rows: 1
insert into t2 values (2, 1);
affected rows: 1
update t1 set a=(select a from t2 where a=1 and b=2) where b in (select b from t2);
affected rows: 2
info: Rows matched: 2  Changed: 2  Warnings: 0
select * from t1;
A	B	C	D
1	2	2	2
6	6	6	6
1	1	1	1
4	4	4	4
3	3	3	3
5	5	5	5
affected rows: 6
drop table t1;
affected rows: 0
drop table t2;
affected rows: 0
create table t1(a int, b int, c int, d int, primary key(a, b, c))
partition by range(c) subpartition by hash(b) subpartitions 5 (
partition p0 values less than (1),
partition p1 values less than (2),
partition p2 values less than (3),
partition p3 values less than (4),
partition p4 values less than (maxvalue)
);
affected rows: 0
insert into t1 values (1, 1, 1, 1);
affected rows: 1
insert into t1 values (2, 2, 2, 2);
affected rows: 1
insert into t1 values (3, 3, 3, 3);
affected rows: 1
insert into t1 values (4, 4, 4, 4);
affected rows: 1
insert into t1 values (5, 5, 5, 5);
affected rows: 1
insert into t1 values (6, 6, 6, 6);
affected rows: 1
insert into t1 values (1, 1, 1, 1);
ERROR 23000: unique constraint '1-1-1' for key 'T1_OBPK_1234' violated
insert into t1 values (2, 2, 2, 2);
ERROR 23000: unique constraint '2-2-2' for key 'T1_OBPK_1234' violated
insert into t1 values (3, 3, 3, 3);
ERROR 23000: unique constraint '3-3-3' for key 'T1_OBPK_1234' violated
insert into t1 values (4, 4, 4, 4);
ERROR 23000: unique constraint '4-4-4' for key 'T1_OBPK_1234' violated
select * from t1;
A	B	C	D
1	1	1	1
2	2	2	2
3	3	3	3
4	4	4	4
5	5	5	5
6	6	6	6
affected rows: 6
update t1 set a=10 where c>0 and b=1;
affected rows: 1
info: Rows matched: 1  Changed: 1  Warnings: 0
select * from t1;
A	B	C	D
10	1	1	1
2	2	2	2
3	3	3	3
4	4	4	4
5	5	5	5
6	6	6	6
affected rows: 6
update t1 set a=10, d=10 where c>0 and b>0;
affected rows: 6
info: Rows matched: 6  Changed: 6  Warnings: 0
select * from t1;
A	B	C	D
10	1	1	10
10	2	2	10
10	3	3	10
10	4	4	10
10	5	5	10
10	6	6	10
affected rows: 6
update t1 set a=10, d=a where c=1 and b=1;
affected rows: 1
info: Rows matched: 1  Changed: 1  Warnings: 0
select * from t1;
A	B	C	D
10	1	1	10
10	2	2	10
10	3	3	10
10	4	4	10
10	5	5	10
10	6	6	10
affected rows: 6
update t1 set a=10, d=a where c=1 and b>0;
affected rows: 1
info: Rows matched: 1  Changed: 1  Warnings: 0
select * from t1;
A	B	C	D
10	1	1	10
10	2	2	10
10	3	3	10
10	4	4	10
10	5	5	10
10	6	6	10
affected rows: 6
update t1 set a=10, d=a where c=2 and b>0 ;
affected rows: 1
info: Rows matched: 1  Changed: 1  Warnings: 0
select * from t1;
A	B	C	D
10	1	1	10
10	2	2	10
10	3	3	10
10	4	4	10
10	5	5	10
10	6	6	10
affected rows: 6
update t1 set a=10, d=a where c=2 and b>0 ;
affected rows: 1
info: Rows matched: 1  Changed: 1  Warnings: 0
drop table t1;
affected rows: 0
create table t1(a int, b int, c int, primary key(a, b)) partition by hash(b) partitions 5;
affected rows: 0
create table t2(a int, b int, c int, primary key(a, b)) partition by hash(b) partitions 5;
affected rows: 0
insert into t1 values(1, 1, 1);
affected rows: 1
insert into t1 values(2, 2, 2);
affected rows: 1
insert into t1 values(3, 3, 3);
affected rows: 1
insert into t1 values(4, 4, 4);
affected rows: 1
insert into t1 values(5, 5, 5);
affected rows: 1
insert into t1 values(6, 6, 6);
affected rows: 1
insert into t2 values(1, 1, 1);
affected rows: 1
insert into t2 values(2, 2, 2);
affected rows: 1
insert into t2 values(3, 3, 3);
affected rows: 1
insert into t2 values(4, 4, 4);
affected rows: 1
insert into t2 values(5, 5, 5);
affected rows: 1
insert into t2 values(6, 6, 6);
affected rows: 1
explain basic update t1 set a=10 where b in (select b from t2);
Query Plan
===========================================
|ID|OPERATOR                     |NAME    |
-------------------------------------------
|0 |PX COORDINATOR               |        |
|1 |└─EXCHANGE OUT DISTR         |:EX10000|
|2 |  └─PX PARTITION ITERATOR    |        |
|3 |    └─UPDATE                 |        |
|4 |      └─HASH RIGHT SEMI JOIN |        |
|5 |        ├─TABLE FULL SCAN    |T2      |
|6 |        └─TABLE FULL SCAN    |T1      |
===========================================
Outputs & filters:
-------------------------------------
  0 - output(nil), filter(nil), rowset=16
  1 - output(nil), filter(nil), rowset=16
      dop=1
  2 - output(nil), filter(nil), rowset=16
      partition wise, force partition granule
  3 - output(nil), filter(nil)
      table_columns([{T1: ({T1: (T1.A, T1.B, T1.C)})}]),
      update([T1.A=column_conv(NUMBER,PS:(-1,0),NOT NULL,10)])
  4 - output([T1.A], [T1.B], [T1.C]), filter(nil), rowset=16
      equal_conds([T1.B = T2.B]), other_conds(nil)
  5 - output([T2.B]), filter(nil), rowset=16
      access([T2.B]), partitions(p[0-4])
      is_index_back=false, is_global_index=false, 
      range_key([T2.A], [T2.B]), range(MIN,MIN ; MAX,MAX)always true
  6 - output([T1.A], [T1.B], [T1.C]), filter(nil), rowset=16
      access([T1.A], [T1.B], [T1.C]), partitions(p[0-4])
      is_index_back=false, is_global_index=false, 
      range_key([T1.A], [T1.B]), range(MIN,MIN ; MAX,MAX)always true
affected rows: 31
update t1 set a=10 where b in (select b from t2);
affected rows: 6
info: Rows matched: 6  Changed: 6  Warnings: 0
select * from t1;
A	B	C
10	2	2
10	1	1
10	4	4
10	3	3
10	5	5
10	6	6
affected rows: 6
update t1 set a=(select a from t2) where b in (select b from t2);
ERROR 21000: single-row subquery returns more than one row
drop table t1;
affected rows: 0
drop table t2;
affected rows: 0
create table t1(a int, b int, c int, primary key(a, b)) partition by hash(a, b) partitions 5;
affected rows: 0
create table t2(a int, b int, c int, primary key(a, b)) partition by hash(a, b) partitions 5;
affected rows: 0
insert into t1 values(1, 1, 1);
affected rows: 1
insert into t1 values(2, 2, 2);
affected rows: 1
insert into t1 values(3, 3, 3);
affected rows: 1
insert into t1 values(4, 4, 4);
affected rows: 1
insert into t1 values(5, 5, 5);
affected rows: 1
insert into t1 values(6, 6, 6);
affected rows: 1
insert into t2 values(1, 1, 1);
affected rows: 1
insert into t2 values (2, 2, 2);
affected rows: 1
insert into t2 values (3, 3, 3);
affected rows: 1
insert into t2 values (4, 4, 4);
affected rows: 1
insert into t2 values (5, 5, 5);
affected rows: 1
insert into t2 values (6, 6, 6);
affected rows: 1
explain delete from t1 where (a, b) in (select a, b from t2);
Query Plan
=============================================================
|ID|OPERATOR                 |NAME    |EST.ROWS|EST.TIME(us)|
-------------------------------------------------------------
|0 |PX COORDINATOR           |        |1       |33          |
|1 |└─EXCHANGE OUT DISTR     |:EX10000|1       |33          |
|2 |  └─PX PARTITION ITERATOR|        |1       |33          |
|3 |    └─DELETE             |        |1       |33          |
|4 |      └─MERGE JOIN       |        |1       |22          |
|5 |        ├─TABLE FULL SCAN|T2      |1       |11          |
|6 |        └─TABLE FULL SCAN|T1      |1       |11          |
=============================================================
Outputs & filters:
-------------------------------------
  0 - output(nil), filter(nil), rowset=16
  1 - output(nil), filter(nil), rowset=16
      dop=1
  2 - output(nil), filter(nil), rowset=16
      partition wise, force partition granule
  3 - output(nil), filter(nil)
      table_columns([{T1: ({T1: (T1.A, T1.B, T1.C)})}])
  4 - output([T1.A], [T1.B], [T1.C]), filter(nil), rowset=16
      equal_conds([T1.A = T2.A], [T1.B = T2.B]), other_conds(nil)
      merge_directions([ASC], [ASC])
  5 - output([T2.A], [T2.B]), filter(nil), rowset=16
      access([T2.A], [T2.B]), partitions(p[0-4])
      is_index_back=false, is_global_index=false, 
      range_key([T2.A], [T2.B]), range(MIN,MIN ; MAX,MAX)always true
  6 - output([T1.A], [T1.B], [T1.C]), filter(nil), rowset=16
      access([T1.A], [T1.B], [T1.C]), partitions(p[0-4])
      is_index_back=false, is_global_index=false, 
      range_key([T1.A], [T1.B]), range(MIN,MIN ; MAX,MAX)always true
affected rows: 31
delete from t1 where (a, b) in (select a, b from t2);
affected rows: 6
select * from t1;
A	B	C
affected rows: 0
drop table t1;
affected rows: 0
drop table t2;
affected rows: 0
create table t1(a int, b int, c int, d int, primary key(a, b, c))
partition by range(c) subpartition by hash(b) subpartitions 5 (
partition p0 values less than (1),
partition p1 values less than (2),
partition p2 values less than (3),
partition p3 values less than (4),
partition p4 values less than (maxvalue)
);
affected rows: 0
create table t2(a int, b int, c int, d int, primary key(a, b, c))
partition by range(c) subpartition by hash(b) subpartitions 5 (
partition p0 values less than (1),
partition p1 values less than (2),
partition p2 values less than (3),
partition p3 values less than (4),
partition p4 values less than (maxvalue)
);
affected rows: 0
insert into t1 values(1, 1, 1, 1);
affected rows: 1
insert into t1 values(2, 2, 2, 2);
affected rows: 1
insert into t1 values(3, 3, 3, 3);
affected rows: 1
insert into t1 values(4, 4, 4, 4);
affected rows: 1
insert into t1 values(5, 5, 5, 5);
affected rows: 1
insert into t1 values(6, 6, 6, 6);
affected rows: 1
insert into t2 values(1, 1, 1, 1);
affected rows: 1
insert into t2 values (2, 2, 2, 2);
affected rows: 1
insert into t2 values (3, 3, 3, 3);
affected rows: 1
insert into t2 values (4, 4, 4, 4);
affected rows: 1
insert into t2 values (5, 5, 5, 5);
affected rows: 1
insert into t2 values (6, 6, 6, 6);
affected rows: 1
explain basic update t1 set a=10 where (b, c) in (select b, c from t2);
Query Plan
===========================================
|ID|OPERATOR                     |NAME    |
-------------------------------------------
|0 |PX COORDINATOR               |        |
|1 |└─EXCHANGE OUT DISTR         |:EX10000|
|2 |  └─PX PARTITION ITERATOR    |        |
|3 |    └─UPDATE                 |        |
|4 |      └─HASH RIGHT SEMI JOIN |        |
|5 |        ├─TABLE FULL SCAN    |T2      |
|6 |        └─TABLE FULL SCAN    |T1      |
===========================================
Outputs & filters:
-------------------------------------
  0 - output(nil), filter(nil), rowset=16
  1 - output(nil), filter(nil), rowset=16
      dop=1
  2 - output(nil), filter(nil), rowset=16
      partition wise, force partition granule
  3 - output(nil), filter(nil)
      table_columns([{T1: ({T1: (T1.A, T1.B, T1.C, T1.D)})}]),
      update([T1.A=column_conv(NUMBER,PS:(-1,0),NOT NULL,10)])
  4 - output([T1.A], [T1.B], [T1.C], [T1.D]), filter(nil), rowset=16
      equal_conds([T1.B = T2.B], [T1.C = T2.C]), other_conds(nil)
  5 - output([T2.B], [T2.C]), filter(nil), rowset=16
      access([T2.B], [T2.C]), partitions(p0sp[0-4], p1sp[0-4], p2sp[0-4], p3sp[0-4], p4sp[0-4])
      is_index_back=false, is_global_index=false, 
      range_key([T2.A], [T2.B], [T2.C]), range(MIN,MIN,MIN ; MAX,MAX,MAX)always true
  6 - output([T1.A], [T1.B], [T1.C], [T1.D]), filter(nil), rowset=16
      access([T1.A], [T1.B], [T1.C], [T1.D]), partitions(p0sp[0-4], p1sp[0-4], p2sp[0-4], p3sp[0-4], p4sp[0-4])
      is_index_back=false, is_global_index=false, 
      range_key([T1.A], [T1.B], [T1.C]), range(MIN,MIN,MIN ; MAX,MAX,MAX)always true
affected rows: 31
update t1 set a=10 where (b, c) in (select b, c from t2);
affected rows: 6
info: Rows matched: 6  Changed: 6  Warnings: 0
select * from t1;
A	B	C	D
10	1	1	1
10	2	2	2
10	3	3	3
10	4	4	4
10	5	5	5
10	6	6	6
affected rows: 6
update t1 set a=10 where b in (select b from t2);
affected rows: 6
info: Rows matched: 6  Changed: 6  Warnings: 0
drop table t1;
affected rows: 0
drop table t2;
affected rows: 0
create table t1(a int, b int, primary key(a, b)) partition by hash(b) partitions 3;
affected rows: 0
insert into t1 values(1, 1);
affected rows: 1
insert into t1 values (2, 2);
affected rows: 1
insert into t1 values (3, 3);
affected rows: 1
insert into t1 values (4, 4);
affected rows: 1
insert into t1 values (5, 5);
affected rows: 1
insert into t1 values (6, 6);
affected rows: 1
select * from t1;
A	B
2	2
1	1
4	4
6	6
3	3
5	5
affected rows: 6
delete from t1;
affected rows: 6
insert into t1 values(1, 1);
affected rows: 1
insert into t1 values (2, 2);
affected rows: 1
insert into t1 values (3, 3);
affected rows: 1
insert into t1 values (4, 4);
affected rows: 1
insert into t1 values (5, 5);
affected rows: 1
insert into t1 values (6, 6);
affected rows: 1
select * from t1;
A	B
2	2
1	1
4	4
6	6
3	3
5	5
affected rows: 6
select * from t1;
A	B
2	2
1	1
4	4
6	6
3	3
5	5
affected rows: 6
drop table t1;
affected rows: 0
create table t1(a int, b int) partition by hash(b) partitions 5;
affected rows: 0
create table t2(a int, b int) partition by hash(b) partitions 5;
affected rows: 0
insert into t1 values(1, 1), (2, 2), (3, 3), (4, 4), (5, 5), (6, 6);
affected rows: 6
info: Records: 6  Duplicates: 0  Warnings: 0
explain basic insert into t2 select * from t1 partition(p0);
Query Plan
============================================
|ID|OPERATOR               |NAME           |
--------------------------------------------
|0 |DISTRIBUTED INSERT     |               |
|1 |└─PX COORDINATOR       |               |
|2 |  └─EXCHANGE OUT DISTR |:EX10000       |
|3 |    └─SUBPLAN SCAN     |ANONYMOUS_VIEW1|
|4 |      └─TABLE FULL SCAN|T1             |
============================================
Outputs & filters:
-------------------------------------
  0 - output(nil), filter(nil)
      columns([{T2: ({T2: (T2.__pk_increment, T2.A, T2.B)})}]), partitions(p[0-4]), 
      column_values([T_HIDDEN_PK], [column_conv(NUMBER,PS:(-1,0),NULL,ANONYMOUS_VIEW1.A)], [column_conv(NUMBER,PS:(-1,0),NULL,ANONYMOUS_VIEW1.B)])
  1 - output([ANONYMOUS_VIEW1.A], [ANONYMOUS_VIEW1.B]), filter(nil), rowset=16
  2 - output([ANONYMOUS_VIEW1.A], [ANONYMOUS_VIEW1.B]), filter(nil), rowset=16
      is_single, dop=1
  3 - output([ANONYMOUS_VIEW1.A], [ANONYMOUS_VIEW1.B]), filter(nil), rowset=16
      access([ANONYMOUS_VIEW1.A], [ANONYMOUS_VIEW1.B])
  4 - output([T1.A], [T1.B]), filter(nil), rowset=16
      access([T1.B], [T1.A]), partitions(p0)
      is_index_back=false, is_global_index=false, 
      range_key([T1.__pk_increment]), range(MIN ; MAX)always true
affected rows: 23
insert into t2 select * from t1 partition(p0);
affected rows: 1
select * from t1;
A	B
2	2
1	1
4	4
3	3
5	5
6	6
affected rows: 6
select * from t2;
A	B
2	2
affected rows: 1
insert into t2 select * from t1 where b=2;
affected rows: 1
select * from t2;
A	B
2	2
2	2
affected rows: 2
drop table t1;
affected rows: 0
drop table t2;
affected rows: 0
alter system flush plan cache global;
affected rows: 0
CREATE TABLE t1(c1 int DEFAULT NULL, c2 int DEFAULT NULL ) partition by range(c1) (partition p0 values less than (10), partition p1 values less than (20));
affected rows: 0
CREATE TABLE t2(c1 int DEFAULT NULL, c2 int DEFAULT NULL ) partition by range(c1) (partition p0 values less than (10), partition p1 values less than (20));
affected rows: 0
insert into t1 values(1, 1);
affected rows: 1
insert into t1 values(2, 2);
affected rows: 1
insert into t1 values(3, 3);
affected rows: 1
insert into t1 values(4, 4);
affected rows: 1
insert into t1 values(11, 11);
affected rows: 1
insert into t1 values(12, 12);
affected rows: 1
insert into t1 values(13, 13);
affected rows: 1
insert into t1 values(14, 14);
affected rows: 1
explain basic insert into t2 select * from t1 where c1<9;
Query Plan
============================================
|ID|OPERATOR               |NAME           |
--------------------------------------------
|0 |DISTRIBUTED INSERT     |               |
|1 |└─PX COORDINATOR       |               |
|2 |  └─EXCHANGE OUT DISTR |:EX10000       |
|3 |    └─SUBPLAN SCAN     |ANONYMOUS_VIEW1|
|4 |      └─TABLE FULL SCAN|T1             |
============================================
Outputs & filters:
-------------------------------------
  0 - output(nil), filter(nil)
      columns([{T2: ({T2: (T2.__pk_increment, T2.C1, T2.C2)})}]), partitions(p0), 
      column_values([T_HIDDEN_PK], [column_conv(NUMBER,PS:(-1,0),NULL,ANONYMOUS_VIEW1.C1)], [column_conv(NUMBER,PS:(-1,0),NULL,ANONYMOUS_VIEW1.C2)])
  1 - output([ANONYMOUS_VIEW1.C1], [ANONYMOUS_VIEW1.C2]), filter(nil), rowset=16
  2 - output([ANONYMOUS_VIEW1.C1], [ANONYMOUS_VIEW1.C2]), filter(nil), rowset=16
      is_single, dop=1
  3 - output([ANONYMOUS_VIEW1.C1], [ANONYMOUS_VIEW1.C2]), filter(nil), rowset=16
      access([ANONYMOUS_VIEW1.C1], [ANONYMOUS_VIEW1.C2])
  4 - output([T1.C1], [T1.C2]), filter([T1.C1 < 9]), rowset=16
      access([T1.C1], [T1.C2]), partitions(p0)
      is_index_back=false, is_global_index=false, filter_before_indexback[false], 
      range_key([T1.__pk_increment]), range(MIN ; MAX)always true
affected rows: 23
insert into t2 select * from t1 where c1<9;
affected rows: 4
info: Records: 4  Duplicates: 0  Warnings: 0
select * from t1;
C1	C2
1	1
2	2
3	3
4	4
11	11
12	12
13	13
14	14
affected rows: 8
select * from t2;
C1	C2
1	1
2	2
3	3
4	4
affected rows: 4
insert into t2 select * from t1 where c1<8;
affected rows: 4
info: Records: 4  Duplicates: 0  Warnings: 0
insert into t2 select * from t1 where c1<7;
affected rows: 4
info: Records: 4  Duplicates: 0  Warnings: 0
select * from t2;
C1	C2
1	1
2	2
3	3
4	4
1	1
2	2
3	3
4	4
1	1
2	2
3	3
4	4
affected rows: 12
select hit_count from SYS.GV$OB_PLAN_CACHE_PLAN_STAT where tenant_id=SYS_CONTEXT('USERENV', 'CON_ID') and statement like'insert into t2 select * from t1 where c1<?';
HIT_COUNT
2
affected rows: 1
drop table t1;
affected rows: 0
drop table t2;
affected rows: 0
create table t1(a int, b int, c int, primary key(a, b)) partition by range(a) subpartition by hash(b) subpartitions 5 (partition p0 values less than(10), partition p1 values less than(20));
affected rows: 0
create table t2(a int, b int, c int, primary key(a, b)) partition by range(a) subpartition by hash(b) subpartitions 5 (partition p0 values less than(10), partition p1 values less than(20));
affected rows: 0
insert into t1 select * from t2 where a<9 and b=1;
affected rows: 0
insert into t2 values(1, 1, 1);
affected rows: 1
insert into t2 values (2, 2, 2);
affected rows: 1
insert into t2 values (3, 3, 3);
affected rows: 1
insert into t2 values (8, 8, 8);
affected rows: 1
insert into t2 values (11, 11, 11);
affected rows: 1
insert into t2 values (12, 12, 12);
affected rows: 1
insert into t2 values (13, 13, 13);
affected rows: 1
insert into t1 select * from t2 where a<9 and b=1;
affected rows: 1
select * from t1;
A	B	C
1	1	1
affected rows: 1
select * from t2;
A	B	C
2	2	2
1	1	1
8	8	8
3	3	3
13	13	13
11	11	11
12	12	12
affected rows: 7
drop table t1;
affected rows: 0
drop table t2;
affected rows: 0
create table t1 (c1 int, c2 int, c3 int, primary key (c1, c2)) partition by hash(c1,c2) partitions 3;
affected rows: 0
insert into t1 (c1, c2) values (1, 1);
affected rows: 1
insert into t1 (c1, c2) values (2, 1);
affected rows: 1
insert into t1 (c1, c2) values (3, 1);
affected rows: 1
insert into t1 (c1, c2) values (4, 1);
affected rows: 1
insert into t1 (c1, c2) values (5, 1);
affected rows: 1
insert into t1 (c1, c2) values (6, 1);
affected rows: 1
select * from t1 partition (p0);
C1	C2	C3
2	1	NULL
3	1	NULL
affected rows: 2
select * from t1 partition (p1);
C1	C2	C3
1	1	NULL
4	1	NULL
5	1	NULL
6	1	NULL
affected rows: 4
select * from t1 partition (p2);
C1	C2	C3
affected rows: 0
drop table t1;
affected rows: 0
