use test;
drop table if exists t1;
drop table if exists test;
drop table if exists obschema_t_WJ9;
create table t1 (c1 int, c2 int) partition by list(c1) (partition p0 values in (1,2,3), partition p1 values in (7,9));
insert into t1 values(1,2);
insert into t1 values(2,2);
insert into t1 values(5, 10);
ERROR HY000: Table has no partition for value
select * from t1 where c1 = 1;
c1	c2
1	2
explain select * from t1 where c1 = 1;
Query Plan
===================================
|ID|OPERATOR  |NAME|EST. ROWS|COST|
-----------------------------------
|0 |TABLE SCAN|t1  |1        |37  |
===================================

Outputs & filters: 
-------------------------------------
  0 - output([t1.c1], [t1.c2]), filter([t1.c1 = 1]), 
      access([t1.c1], [t1.c2]), partitions(p0)

select * from t1 where c1 = 10;
c1	c2
explain select * from t1 where c1 = 10;
Query Plan
===================================
|ID|OPERATOR  |NAME|EST. ROWS|COST|
-----------------------------------
|0 |TABLE SCAN|t1  |1        |37  |
===================================

Outputs & filters: 
-------------------------------------
  0 - output([t1.c1], [t1.c2]), filter([t1.c1 = 10]), 
      access([t1.c1], [t1.c2]), partitions(p0)

select * from t1 where c1 > 1;
c1	c2
2	2
explain select * from t1 where c1 > 1;
Query Plan
============================================
|ID|OPERATOR           |NAME|EST. ROWS|COST|
--------------------------------------------
|0 |EXCHANGE IN DISTR  |    |1        |37  |
|1 | EXCHANGE OUT DISTR|    |1        |37  |
|2 |  TABLE SCAN       |t1  |1        |37  |
============================================

Outputs & filters: 
-------------------------------------
  0 - output([t1.c1], [t1.c2]), filter(nil)
  1 - output([t1.c1], [t1.c2]), filter(nil)
  2 - output([t1.c1], [t1.c2]), filter([t1.c1 > 1]), 
      access([t1.c1], [t1.c2]), partitions(p[0-1])

drop table t1;
create table t1 (c1 int, c2 int) partition by list (c1) (partition p0 values in (1,2), partition p1 values in (2));
ERROR HY000: Multiple definition of same constant in list partitioning
create table t1 (c1 int, c2 int) partition by list (c1) (partition p0 values in (2,2));
ERROR HY000: Multiple definition of same constant in list partitioning
create table t1 (c1 int, c2 int) partition by list (c1) (partition p0 values in (1), partition p1 values in (2), partition p1 values in (4));
ERROR HY000: Duplicate partition name 'p1'
create table t1 (c1 int, c2 int) partition by list(c1) (partition p0 values in (1,2,3), partition p1 values in (7,9), partition p2 values in default);
ERROR 42000: You have an error in your SQL syntax; check the manual that corresponds to your OceanBase version for the right syntax to use near 'default)' at line 1
create table t1 (c1 int, c2 int) partition by list(c1) (partition p0 values in (1,2,3), partition p1 values in (7,9), partition p2 values in (default), partition p3 values in (default));
ERROR HY000: Multiple definition of same constant in list partitioning
create table t1 (c1 int, c2 int) partition by list(c1) (partition p0 values in (1,2,3), partition p1 values in (7,9), partition p2 values in (default));
insert into t1 values(1, 1);
insert into t1 values(10, 1);
select * from t1 where c1 = 1;
c1	c2
1	1
explain select * from t1 where c1 = 10;
Query Plan
===================================
|ID|OPERATOR  |NAME|EST. ROWS|COST|
-----------------------------------
|0 |TABLE SCAN|t1  |1        |37  |
===================================

Outputs & filters: 
-------------------------------------
  0 - output([t1.c1], [t1.c2]), filter([t1.c1 = 10]), 
      access([t1.c1], [t1.c2]), partitions(p2)

select * from t1;
c1	c2
1	1
10	1
drop table t1;
create table t1 (c1 timestamp, c2 int) partition by list(c1) (partition p0 values in (1519660800000000));
ERROR HY000: Field 'c1' is of a not allowed type for this type of partitioning
create table t1 (c1 year, c2 int) partition by list(c1) (partition p0 values in (2018));
insert into t1 values(2018, 9);
select * from t1 where c1 = 2018;
c1	c2
2018	9
explain select * from t1 where c1 = 2018;
Query Plan
===================================
|ID|OPERATOR  |NAME|EST. ROWS|COST|
-----------------------------------
|0 |TABLE SCAN|t1  |1        |37  |
===================================

Outputs & filters: 
-------------------------------------
  0 - output([t1.c1], [t1.c2]), filter([t1.c1 = ?]), 
      access([t1.c1], [t1.c2]), partitions(p0)

drop table t1;
create table t1 (c1 int, c2 int) partition by list(c1 + 1) (partition p0 values in (1), partition p1 values in (2,3));
insert into t1 values(1,2);
explain insert into t1 values(1,2);
Query Plan
====================================
|ID|OPERATOR   |NAME|EST. ROWS|COST|
------------------------------------
|0 |INSERT     |    |0        |0   |
|1 | EXPRESSION|    |0        |0   |
====================================

Outputs & filters: 
-------------------------------------
  0 - output([nextval(1)], [?], [()], [__values.c1], [__values.c2]), filter(nil), 
      columns([t1.__pk_increment], [t1.__pk_cluster_id], [t1.__pk_partition_id], [t1.c1], [t1.c2]), partitions(p1)
  1 - output([__values.c1], [__values.c2]), filter(nil)
      values({1, 2})

select * from t1 where c1 = 1;
c1	c2
1	2
explain select * from t1 where c1 = 1;
Query Plan
===================================
|ID|OPERATOR  |NAME|EST. ROWS|COST|
-----------------------------------
|0 |TABLE SCAN|t1  |1        |37  |
===================================

Outputs & filters: 
-------------------------------------
  0 - output([t1.c1], [t1.c2]), filter([t1.c1 = 1]), 
      access([t1.c1], [t1.c2]), partitions(p1)

drop table t1;
create table t1 (c1 int, c2 int) partition by list(c1 + c2) (partition p0 values in (1), partition p1 values in (2,3));
insert into t1 values(1,1);
insert into t1 values(0,0);
ERROR HY000: Table has no partition for value
explain update t1 set c2 = 5 where c1 = 0;
Query Plan
===============================================
|ID|OPERATOR              |NAME|EST. ROWS|COST|
-----------------------------------------------
|0 |MULTI PARTITION UPDATE|    |4        |671 |
|1 | EXCHANGE IN DISTR    |    |4        |667 |
|2 |  EXCHANGE OUT DISTR  |    |4        |666 |
|3 |   TABLE SCAN         |t1  |4        |666 |
===============================================

Outputs & filters: 
-------------------------------------
  0 - output(nil), filter(nil), params([{t1: (t1.__pk_increment, t1.__pk_cluster_id, t1.__pk_partition_id, t1.c1, t1.c2)}]), index_info([{t1: (t1.__pk_increment, t1.__pk_cluster_id, t1.__pk_partition_id, t1.c1, t1.c2)}]), update([t1.c2=?])
  1 - output([t1.__pk_increment], [t1.__pk_cluster_id], [t1.__pk_partition_id], [t1.c1], [t1.c2], [?]), filter(nil)
  2 - output([t1.c1], [t1.c2], [t1.__pk_increment], [t1.__pk_cluster_id], [t1.__pk_partition_id]), filter(nil)
  3 - output([t1.c1], [t1.c2], [t1.__pk_increment], [t1.__pk_cluster_id], [t1.__pk_partition_id]), filter([t1.c1 = 0]), 
      access([t1.c1], [t1.c2], [t1.__pk_increment], [t1.__pk_cluster_id], [t1.__pk_partition_id]), partitions(p[0-1])

update t1 set c2 = 5 where c1 = 0;
delete from t1 where c1 = 0;
explain delete from t1 where c1 = 0;
Query Plan
============================================
|ID|OPERATOR           |NAME|EST. ROWS|COST|
--------------------------------------------
|0 |EXCHANGE IN DISTR  |    |4        |670 |
|1 | EXCHANGE OUT DISTR|    |4        |670 |
|2 |  DELETE           |    |4        |670 |
|3 |   TABLE SCAN      |t1  |4        |666 |
============================================

Outputs & filters: 
-------------------------------------
  0 - output(nil), filter(nil)
  1 - output(nil), filter(nil)
  2 - output(nil), filter(nil), params([{t1: (t1.__pk_increment, t1.__pk_cluster_id, t1.__pk_partition_id, t1.c1, t1.c2)}])
  3 - output([t1.__pk_increment], [t1.__pk_cluster_id], [t1.__pk_partition_id], [t1.c1], [t1.c2]), filter([t1.c1 = 0]), 
      access([t1.c1], [t1.c2], [t1.__pk_increment], [t1.__pk_cluster_id], [t1.__pk_partition_id]), partitions(p[0-1])

select * from t1 where c1 = 1;
c1	c2
1	1
explain select * from t1 where c1 = 1;
Query Plan
============================================
|ID|OPERATOR           |NAME|EST. ROWS|COST|
--------------------------------------------
|0 |EXCHANGE IN DISTR  |    |4        |667 |
|1 | EXCHANGE OUT DISTR|    |4        |666 |
|2 |  TABLE SCAN       |t1  |4        |666 |
============================================

Outputs & filters: 
-------------------------------------
  0 - output([t1.c1], [t1.c2]), filter(nil)
  1 - output([t1.c1], [t1.c2]), filter(nil)
  2 - output([t1.c1], [t1.c2]), filter([t1.c1 = 1]), 
      access([t1.c1], [t1.c2]), partitions(p[0-1])

drop table t1;
create table t1 (c1 int, c2 int, c3 int) partition by list columns(c1,c2) (partition p0 values in (1,2), partition p1 values in (1,2));
ERROR HY000: Multiple definition of same constant in list partitioning
create table t1 (c1 int, c2 int, c3 int) partition by list columns(c1,c2) (partition p0 values in (1,2), partition p1 values in ((1,3), (1,3)));
ERROR HY000: Multiple definition of same constant in list partitioning
create table t1 (c1 int, c2 int, c3 int) partition by list columns(c1,c2) (partition p0 values in (1,2), partition p1 values in ((1,3)));
drop table t1;
create table t1 (c1 int, c2 int, c3 int) partition by list columns(c1,c2) (partition p0 values in (default), partition p1 values in (default));
ERROR HY000: Multiple definition of same constant in list partitioning
create table t1 (c1 int, c2 int, c3 int) partition by list columns(c1,c2) (partition p0 values in (1,2));
drop table t1;
create table t1 (c1 int, c2 int, c3 int) partition by list columns(c1,c2) (partition p0 values in (1,2,3,4));
ERROR HY000: Inconsistency in usage of column lists for partitioning
create table t1 (c1 int, c2 int, c3 int) partition by list columns(c1,c2) (partition p0 values in ((1,2),3,4));
ERROR HY000: Inconsistency in usage of column lists for partitioning
create table t1 (c1 int, c2 int, c3 int) partition by list columns(c1,c2) (partition p0 values in ((1,2),(3,4)));
drop table t1;
create table t1 (c1 int, c2 int, c3 int) partition by list columns(c1,c2) (partition p0 values in ((1,2)));
drop table t1;
create table t1 (c1 int, c2 int, c3 int) partition by list columns(c1,c2) (partition p0 values in (1,2,(3,4)));
ERROR HY000: Inconsistency in usage of column lists for partitioning
create table t1 (c1 int, c2 int, c3 int) partition by list columns(c1,c2) (partition p0 values in ((1,2),(3)));
ERROR HY000: Inconsistency in usage of column lists for partitioning
create table t1 (c1 int, c2 int, c3 int) partition by list columns(c1,c2) (partition p0 values in ((1,2)), partition p1 values in (default,default));
ERROR 42000: You have an error in your SQL syntax; check the manual that corresponds to your OceanBase version for the right syntax to use near ',default))' at line 1
create table t1 (c1 int, c2 int, c3 int) partition by list columns(c1,c2) (partition p0 values in (1,2), partition p1 values in ((default)));
ERROR 42000: You have an error in your SQL syntax; check the manual that corresponds to your OceanBase version for the right syntax to use near ')))' at line 1
create table t1 (c1 int, c2 int, c3 int) partition by list columns(c1,c2) (partition p0 values in ('1','2'));
ERROR HY000: Partition column values of incorrect type
create table t1 (c1 varchar(100), c2 varchar(100), c3 int) partition by list columns(c1,c2) (partition p0 values in ('1','2'));
drop table t1;
create table t1 (c1 varchar(100), c2 varchar(100), c3 int) partition by list columns(c1,c2) (partition p0 values in (1,2));
ERROR HY000: Partition column values of incorrect type
create table t1 (c1 int, c2 int, c3 int) partition by list columns(c1 + 1,c2) (partition p0 values in (1,2));
ERROR 42000: You have an error in your SQL syntax; check the manual that corresponds to your OceanBase version for the right syntax to use near '+ 1,c2) (partition p0 values in (1,2))' at line 1
create table t1 (c1 int, c2 int, c3 int) partition by hash(c1) subpartition by list(c2) subpartition template(subpartition p0 values in (1,2,3), subpartition p1 values in (default)) partitions 3;
insert into t1 values(0,1,3);
select * from t1 where c1 = 0 and c2 = 1;
c1	c2	c3
0	1	3
explain select * from t1 where c1 = 0 and c2 = 1;
Query Plan
===================================
|ID|OPERATOR  |NAME|EST. ROWS|COST|
-----------------------------------
|0 |TABLE SCAN|t1  |1        |37  |
===================================

Outputs & filters: 
-------------------------------------
  0 - output([t1.c1], [t1.c2], [t1.c3]), filter([t1.c1 = 0], [t1.c2 = 1]), 
      access([t1.c1], [t1.c2], [t1.c3]), partitions(p0sp0)

insert into t1 values(0,5,3);
select * from t1 where c1 = 0 and c2 = 5;
c1	c2	c3
0	5	3
explain select * from t1 where c1 = 0 and c2 = 5;
Query Plan
===================================
|ID|OPERATOR  |NAME|EST. ROWS|COST|
-----------------------------------
|0 |TABLE SCAN|t1  |1        |37  |
===================================

Outputs & filters: 
-------------------------------------
  0 - output([t1.c1], [t1.c2], [t1.c3]), filter([t1.c1 = 0], [t1.c2 = 5]), 
      access([t1.c1], [t1.c2], [t1.c3]), partitions(p0sp1)

drop table t1;
create table t1 (c1 int, c2 int, c3 int) partition by list(c1) subpartition by hash(c2) subpartitions 3 (partition p0 values in (1,2,3), partition p1 values in (default));
insert into t1 values(1,0,3);
select * from t1 where c1 = 1 and c2 = 0;
c1	c2	c3
1	0	3
explain select * from t1 where c1 = 1 and c2 = 0;
Query Plan
===================================
|ID|OPERATOR  |NAME|EST. ROWS|COST|
-----------------------------------
|0 |TABLE SCAN|t1  |1        |37  |
===================================

Outputs & filters: 
-------------------------------------
  0 - output([t1.c1], [t1.c2], [t1.c3]), filter([t1.c1 = 1], [t1.c2 = 0]), 
      access([t1.c1], [t1.c2], [t1.c3]), partitions(p0sp0)

insert into t1 values(5,0,3);
select * from t1 where c1 = 5 and c2 = 0;
c1	c2	c3
5	0	3
explain select * from t1 where c1 = 5 and c2 = 0;
Query Plan
===================================
|ID|OPERATOR  |NAME|EST. ROWS|COST|
-----------------------------------
|0 |TABLE SCAN|t1  |1        |37  |
===================================

Outputs & filters: 
-------------------------------------
  0 - output([t1.c1], [t1.c2], [t1.c3]), filter([t1.c1 = 5], [t1.c2 = 0]), 
      access([t1.c1], [t1.c2], [t1.c3]), partitions(p1sp0)

drop table t1;
create table t1 (c1 int, c2 int, c3 int) partition by range(c1) subpartition by list(c2) subpartition template (subpartition p0 values in (1,2,3), subpartition p1 values in (default)) (partition p0 values less than (5), partition p1 values less than(10));
insert into t1 values(0,1,3);
select * from t1 where c1 = 0 and c2 = 1;
c1	c2	c3
0	1	3
explain select * from t1 where c1 = 0 and c2 = 1;
Query Plan
===================================
|ID|OPERATOR  |NAME|EST. ROWS|COST|
-----------------------------------
|0 |TABLE SCAN|t1  |1        |37  |
===================================

Outputs & filters: 
-------------------------------------
  0 - output([t1.c1], [t1.c2], [t1.c3]), filter([t1.c1 = 0], [t1.c2 = 1]), 
      access([t1.c1], [t1.c2], [t1.c3]), partitions(p0sp0)

insert into t1 values(6,5,3);
select * from t1 where c1 = 6 and c2 = 5;
c1	c2	c3
6	5	3
explain select * from t1 where c1 = 6 and c2 = 5;
Query Plan
===================================
|ID|OPERATOR  |NAME|EST. ROWS|COST|
-----------------------------------
|0 |TABLE SCAN|t1  |1        |37  |
===================================

Outputs & filters: 
-------------------------------------
  0 - output([t1.c1], [t1.c2], [t1.c3]), filter([t1.c1 = 6], [t1.c2 = 5]), 
      access([t1.c1], [t1.c2], [t1.c3]), partitions(p1sp1)

drop table t1;
create table t1 (c1 int, c2 int, c3 int) partition by list(c1) subpartition by range(c2) subpartition template (subpartition p0 values less than (5), subpartition p1 values less than (maxvalue)) (partition p0 values in (1,2,3), partition p1 values in (default));
insert into t1 values(0,1,3);
select * from t1 where c1 = 0 and c2 = 1;
c1	c2	c3
0	1	3
explain select * from t1 where c1 = 0 and c2 = 1;
Query Plan
===================================
|ID|OPERATOR  |NAME|EST. ROWS|COST|
-----------------------------------
|0 |TABLE SCAN|t1  |1        |37  |
===================================

Outputs & filters: 
-------------------------------------
  0 - output([t1.c1], [t1.c2], [t1.c3]), filter([t1.c1 = 0], [t1.c2 = 1]), 
      access([t1.c1], [t1.c2], [t1.c3]), partitions(p1sp0)

insert into t1 values(6,5,3);
select * from t1 where c1 = 6 and c2 = 5;
c1	c2	c3
6	5	3
explain select * from t1 where c1 = 6 and c2 = 5;
Query Plan
===================================
|ID|OPERATOR  |NAME|EST. ROWS|COST|
-----------------------------------
|0 |TABLE SCAN|t1  |1        |37  |
===================================

Outputs & filters: 
-------------------------------------
  0 - output([t1.c1], [t1.c2], [t1.c3]), filter([t1.c1 = 6], [t1.c2 = 5]), 
      access([t1.c1], [t1.c2], [t1.c3]), partitions(p1sp1)

drop table t1;
create table t1 (c1 int, c2 int, c3 int) partition by range(c1) subpartition by list(c2) subpartition template (subpartition p0 values in (1,2,3), subpartition p1 values in (default)) (partition p0 values less than (5), partition p1 values less than(10));
insert into t1 values(6,1,2);
alter table t1 drop partition (p1);
select * from t1;
c1	c2	c3
insert into t1 values(6,1,0);
ERROR HY000: Table has no partition for value
alter table t1 add partition (partition p1 values less than(maxvalue));
insert into t1 values(6,1,0);
drop table t1;
create table t1(a int, b int, c int, d int, e int, primary key(a,b,c,d), key k1(b) local, key k2(c,b) local, key k3(c,d,b) local) partition by list columns(b,c) (partition p0 values in ((1,1),(2,2),(3,3)),partition p1 values in (default));
insert into t1 values(1,1,1,1,1),(2,2,2,2,2),(3,3,3,3,3),(4,4,4,4,4),(5,5,5,5,5),(6,6,6,6,6),(7,7,7,7,7),(8,8,8,8,8),(9,9,9,9,9),(10,10,10,10,10);
select/*+index(t1 k2)*/ * from t1 where (c,b) in ((1,1),(2,2),(3,3),(4,4),(5,5)) order by a,b,c,d;
a	b	c	d	e
1	1	1	1	1
2	2	2	2	2
3	3	3	3	3
4	4	4	4	4
5	5	5	5	5
drop table t1;
create table obschema_t_WJ9(obschema_c_0_cvA tinyint(255) auto_increment NOT NULL,
obschema_c_1_c9 bit(64) NOT NULL default b'1111111111111111111111111111111111111111111111111111111111111111',
obschema_c_2_XR datetime NOT NULL default now(),
obschema_c_3_VCtDbq varchar(200) NOT NULL default 'aEFGHI01',
obschema_c_4_OWQZ varchar(150) NOT NULL default 'CDEFGHI01',
primary key(obschema_c_0_cvA,
obschema_c_1_c9,
obschema_c_2_XR,
obschema_c_3_VCtDbq,
obschema_c_4_OWQZ),
index obschema_i_0_tX(obschema_c_0_cvA,
obschema_c_1_c9,
obschema_c_2_XR,
obschema_c_3_VCtDbq,
obschema_c_4_OWQZ) LOCAL ,
partition_id varchar(1) COLLATE utf8mb4_bin GENERATED ALWAYS AS (substr(obschema_c_3_VCtDbq,
200 ,
1)) VIRTUAL,
UNIQUE KEY uk(obschema_c_3_VCtDbq,
partition_id) local)partition by list columns(partition_id) (partition p0 values in ('00'), partition p1 values in ('01'), partition p2 values in ('02'));
replace into obschema_t_WJ9(obschema_c_1_c9,obschema_c_2_XR,obschema_c_3_VCtDbq,obschema_c_4_OWQZ) values(now(6),now(6),now(6),now(6));
ERROR HY000: Table has no partition for value
replace into obschema_t_WJ9() values();
ERROR HY000: Table has no partition for value
drop table obschema_t_WJ9;
CREATE TABLE `test` (
`partner_id` varchar(400) COLLATE utf8mb4_bin NOT NULL,
`out_trade_no` varchar(64) COLLATE utf8mb4_bin NOT NULL,
`trade_from` varchar(200) COLLATE utf8mb4_bin NOT NULL,
`trade_no_prefix` varchar(1) COLLATE utf8mb4_bin DEFAULT NULL,
`trade_no` varchar(64) COLLATE utf8mb4_bin NOT NULL,
`gmt_create` datetime(6) NOT NULL,
`partition_id` varchar(2),
PRIMARY KEY (`out_trade_no`, `partner_id`, `trade_from`,`partition_id`)
) partition by list columns(partition_id)
(partition p00 values in (('00')),
partition p01 values in (('01')),
partition p02 values in (('02')),
partition p03 values in (('03')));
show create table test;
Table	Create Table
test	CREATE TABLE `test` (
  `partner_id` varchar(400) CHARACTER SET utf8mb4 COLLATE utf8mb4_bin NOT NULL,
  `out_trade_no` varchar(64) CHARACTER SET utf8mb4 COLLATE utf8mb4_bin NOT NULL,
  `trade_from` varchar(200) CHARACTER SET utf8mb4 COLLATE utf8mb4_bin NOT NULL,
  `trade_no_prefix` varchar(1) CHARACTER SET utf8mb4 COLLATE utf8mb4_bin DEFAULT NULL,
  `trade_no` varchar(64) CHARACTER SET utf8mb4 COLLATE utf8mb4_bin NOT NULL,
  `gmt_create` datetime(6) NOT NULL,
  `partition_id` varchar(2) NOT NULL,
  PRIMARY KEY (`out_trade_no`, `partner_id`, `trade_from`, `partition_id`)
) DEFAULT CHARSET = utf8mb4 COMPRESSION = 'lz4_1.0' REPLICA_NUM = 1 BLOCK_SIZE = 16384 USE_BLOOM_FILTER = FALSE TABLET_SIZE = 134217728 PCTFREE = 10
 partition by list columns(partition_id)
(partition p00 values in ('00'),
partition p01 values in ('01'),
partition p02 values in ('02'),
partition p03 values in ('03'))
drop table test;
create table t1 (c1 int, c2 int) partition by list (c1) (partition p0 values in (1), partition p1 values in (default));
show create table t1;
Table	Create Table
t1	CREATE TABLE `t1` (
  `c1` int(11) DEFAULT NULL,
  `c2` int(11) DEFAULT NULL
) DEFAULT CHARSET = utf8mb4 COMPRESSION = 'lz4_1.0' REPLICA_NUM = 1 BLOCK_SIZE = 16384 USE_BLOOM_FILTER = FALSE TABLET_SIZE = 134217728 PCTFREE = 10
 partition by list(c1)
(partition p0 values in (1),
partition p1 values in (DEFAULT))
drop table t1;
create table t1 (c1 int, c2 int) partition by list columns(c1, c2) (partition p0 values in (1,2), partition p1 values in (default));
show create table t1;
Table	Create Table
t1	CREATE TABLE `t1` (
  `c1` int(11) DEFAULT NULL,
  `c2` int(11) DEFAULT NULL
) DEFAULT CHARSET = utf8mb4 COMPRESSION = 'lz4_1.0' REPLICA_NUM = 1 BLOCK_SIZE = 16384 USE_BLOOM_FILTER = FALSE TABLET_SIZE = 134217728 PCTFREE = 10
 partition by list columns(c1, c2)
(partition p0 values in ((1,2)),
partition p1 values in (DEFAULT))
drop table t1;
