drop table if exists t1;
#
# Bug#12725206/Bug#61765: WRONG QUERY RESULTS ON SUBPARTITIONS BASED
#                         ON USIGNED BIGINT
#
CREATE TABLE t1 (c1 INT)
PARTITION BY HASH (c1)
PARTITIONS 15;
INSERT INTO t1 VALUES (1);
INSERT INTO t1 VALUES (2);
INSERT INTO t1 VALUES (3);
INSERT INTO t1 VALUES (4);
INSERT INTO t1 VALUES (5);
DROP TABLE t1;
create table t1 (a int unsigned)
partition by hash(a div 2)
partitions 4;
insert into t1 values (null);
insert into t1 values (0);
insert into t1 values (1);
insert into t1 values (2);
insert into t1 values (3);
insert into t1 values (4);
insert into t1 values (5);
insert into t1 values (6);
insert into t1 values (7);
select * from t1 where a < 0;
a
select * from t1 where a is null or (a >= 5 and a <= 7);
a
NULL
5
6
7
select * from t1 where a is null;
a
NULL
select * from t1 where a is not null;
a
0
1
2
3
4
5
6
7
select * from t1 where a >= 1 and a < 3;
a
1
2
select * from t1 where a >= 3 and a <= 5;
a
3
4
5
select * from t1 where a > 2 and a < 4;
a
3
select * from t1 where a > 3 and a <= 6;
a
4
5
6
select * from t1 where a > 5;
a
6
7
select * from t1 where a >= 1 and a <= 5;
a
1
2
3
4
5
explain partitions select * from t1 where a < 0;
Query Plan
================================================
|ID|OPERATOR           |NAME    |EST. ROWS|COST|
------------------------------------------------
|0 |EXCHANGE IN DISTR  |        |3        |38  |
|1 | EXCHANGE OUT DISTR|:EX10000|3        |37  |
|2 |  GRANULE ITERATOR |        |3        |37  |
|3 |   TABLE SCAN      |t1      |3        |37  |
================================================

Outputs & filters: 
-------------------------------------
  0 - output([t1.a]), filter(nil)
  1 - output([t1.a]), filter(nil), dop=1
  2 - output([t1.a]), filter(nil)
  3 - output([t1.a]), filter([t1.a < 0]), 
      access([t1.a]), partitions(p[0-3])

explain partitions select * from t1 where a is null or (a >= 5 and a <= 7);
Query Plan
================================================
|ID|OPERATOR           |NAME    |EST. ROWS|COST|
------------------------------------------------
|0 |EXCHANGE IN DISTR  |        |1        |37  |
|1 | EXCHANGE OUT DISTR|:EX10000|1        |37  |
|2 |  GRANULE ITERATOR |        |1        |37  |
|3 |   TABLE SCAN      |t1      |1        |37  |
================================================

Outputs & filters: 
-------------------------------------
  0 - output([t1.a]), filter(nil)
  1 - output([t1.a]), filter(nil), dop=1
  2 - output([t1.a]), filter(nil)
  3 - output([t1.a]), filter([(T_OP_IS, t1.a, NULL, 0) OR t1.a >= 5 AND t1.a <= 7]), 
      access([t1.a]), partitions(p[0-3])

explain partitions select * from t1 where a is null;
explain partitions select * from t1 where a is not null;
Query Plan
================================================
|ID|OPERATOR           |NAME    |EST. ROWS|COST|
------------------------------------------------
|0 |EXCHANGE IN DISTR  |        |12       |38  |
|1 | EXCHANGE OUT DISTR|:EX10000|12       |37  |
|2 |  GRANULE ITERATOR |        |12       |37  |
|3 |   TABLE SCAN      |t1      |12       |37  |
================================================

Outputs & filters: 
-------------------------------------
  0 - output([t1.a]), filter(nil)
  1 - output([t1.a]), filter(nil), dop=1
  2 - output([t1.a]), filter(nil)
  3 - output([t1.a]), filter([(T_OP_IS_NOT, t1.a, NULL, 0)]), 
      access([t1.a]), partitions(p[0-3])

explain partitions select * from t1 where a >= 1 and a < 3;
Query Plan
================================================
|ID|OPERATOR           |NAME    |EST. ROWS|COST|
------------------------------------------------
|0 |EXCHANGE IN DISTR  |        |1        |38  |
|1 | EXCHANGE OUT DISTR|:EX10000|1        |38  |
|2 |  GRANULE ITERATOR |        |1        |38  |
|3 |   TABLE SCAN      |t1      |1        |38  |
================================================

Outputs & filters: 
-------------------------------------
  0 - output([t1.a]), filter(nil)
  1 - output([t1.a]), filter(nil), dop=1
  2 - output([t1.a]), filter(nil)
  3 - output([t1.a]), filter([t1.a >= 1], [t1.a < 3]), 
      access([t1.a]), partitions(p[0-3])

explain partitions select * from t1 where a >= 3 and a <= 5;
Query Plan
================================================
|ID|OPERATOR           |NAME    |EST. ROWS|COST|
------------------------------------------------
|0 |EXCHANGE IN DISTR  |        |1        |38  |
|1 | EXCHANGE OUT DISTR|:EX10000|1        |38  |
|2 |  GRANULE ITERATOR |        |1        |38  |
|3 |   TABLE SCAN      |t1      |1        |38  |
================================================

Outputs & filters: 
-------------------------------------
  0 - output([t1.a]), filter(nil)
  1 - output([t1.a]), filter(nil), dop=1
  2 - output([t1.a]), filter(nil)
  3 - output([t1.a]), filter([t1.a >= 3], [t1.a <= 5]), 
      access([t1.a]), partitions(p[0-3])

explain partitions select * from t1 where a > 2 and a < 4;
Query Plan
================================================
|ID|OPERATOR           |NAME    |EST. ROWS|COST|
------------------------------------------------
|0 |EXCHANGE IN DISTR  |        |1        |38  |
|1 | EXCHANGE OUT DISTR|:EX10000|1        |38  |
|2 |  GRANULE ITERATOR |        |1        |38  |
|3 |   TABLE SCAN      |t1      |1        |38  |
================================================

Outputs & filters: 
-------------------------------------
  0 - output([t1.a]), filter(nil)
  1 - output([t1.a]), filter(nil), dop=1
  2 - output([t1.a]), filter(nil)
  3 - output([t1.a]), filter([t1.a > 2], [t1.a < 4]), 
      access([t1.a]), partitions(p[0-3])

explain partitions select * from t1 where a > 3 and a <= 6;
Query Plan
================================================
|ID|OPERATOR           |NAME    |EST. ROWS|COST|
------------------------------------------------
|0 |EXCHANGE IN DISTR  |        |1        |38  |
|1 | EXCHANGE OUT DISTR|:EX10000|1        |38  |
|2 |  GRANULE ITERATOR |        |1        |38  |
|3 |   TABLE SCAN      |t1      |1        |38  |
================================================

Outputs & filters: 
-------------------------------------
  0 - output([t1.a]), filter(nil)
  1 - output([t1.a]), filter(nil), dop=1
  2 - output([t1.a]), filter(nil)
  3 - output([t1.a]), filter([t1.a > 3], [t1.a <= 6]), 
      access([t1.a]), partitions(p[0-3])

explain partitions select * from t1 where a > 5;
Query Plan
================================================
|ID|OPERATOR           |NAME    |EST. ROWS|COST|
------------------------------------------------
|0 |EXCHANGE IN DISTR  |        |3        |38  |
|1 | EXCHANGE OUT DISTR|:EX10000|3        |37  |
|2 |  GRANULE ITERATOR |        |3        |37  |
|3 |   TABLE SCAN      |t1      |3        |37  |
================================================

Outputs & filters: 
-------------------------------------
  0 - output([t1.a]), filter(nil)
  1 - output([t1.a]), filter(nil), dop=1
  2 - output([t1.a]), filter(nil)
  3 - output([t1.a]), filter([t1.a > 5]), 
      access([t1.a]), partitions(p[0-3])

explain partitions select * from t1 where a >= 1 and a <= 5;
Query Plan
================================================
|ID|OPERATOR           |NAME    |EST. ROWS|COST|
------------------------------------------------
|0 |EXCHANGE IN DISTR  |        |1        |38  |
|1 | EXCHANGE OUT DISTR|:EX10000|1        |38  |
|2 |  GRANULE ITERATOR |        |1        |38  |
|3 |   TABLE SCAN      |t1      |1        |38  |
================================================

Outputs & filters: 
-------------------------------------
  0 - output([t1.a]), filter(nil)
  1 - output([t1.a]), filter(nil), dop=1
  2 - output([t1.a]), filter(nil)
  3 - output([t1.a]), filter([t1.a >= 1], [t1.a <= 5]), 
      access([t1.a]), partitions(p[0-3])

drop table t1;
CREATE TABLE t1 (
a int not null,
b int not null,
c int not null,
primary key(a,b))
partition by hash (a + 2)
partitions 3
;
insert into t1 values (1,1,1);
insert into t1 values (2,1,1);
insert into t1 values (3,1,1);
insert into t1 values (4,1,1);
insert into t1 values (5,1,1);
select * from t1;
a	b	c
1	1	1
4	1	1
2	1	1
5	1	1
3	1	1
update t1 set c=3 where b=1;
select * from t1;
a	b	c
1	1	3
4	1	3
2	1	3
5	1	3
3	1	3
select b from t1 where a=3;
b
1
select b,c from t1 where a=1 AND b=1;
b	c
1	3
delete from t1 where a=1;
delete from t1 where c=3;
select * from t1;
a	b	c
ALTER TABLE t1
partition by hash (a + 3)
partitions 3
;
ERROR 0A000: re-partition a patitioned table not supported
drop table t1;
CREATE TABLE t1 (
a int not null,
b int not null,
c int not null,
primary key(a,b))
partition by hash (a)
;
drop table t1;
CREATE TABLE t1 (
a int not null,
b int not null,
c int not null,
primary key(a,b))
partition by key (a)
;
drop table t1;
CREATE TABLE t1 (f1 INTEGER, f2 char(20))  PARTITION BY HASH(f1) PARTITIONS 2;
INSERT INTO t1 SET f1 = 0 - 1, f2 = '#######';
select * from t1;
f1	f2
-1	#######
drop table t1;
CREATE TABLE t1 (s1 int)  PARTITION BY HASH (s1);
INSERT INTO t1 VALUES (0);
DROP TABLE t1;
create table t1 (c1 int DEFAULT NULL,
c2 varchar (30) DEFAULT NULL,
c3 date DEFAULT NULL)
partition by hash (EXTRACT(DAY FROM c3))
partitions 12;
insert into t1 values
(136,'abc','2002-01-05');
insert into t1 values(142,'abc','2002-02-14');
insert into t1 values(162,'abc','2002-06-28');
insert into t1 values
(182,'abc','2002-11-09');
insert into t1 values(158,'abc','2002-06-01');
insert into t1 values(184,'abc','2002-11-22');
select * from t1;
c1	c2	c3
158	abc	2002-06-01
142	abc	2002-02-14
162	abc	2002-06-28
136	abc	2002-01-05
182	abc	2002-11-09
184	abc	2002-11-22
select * from t1 where c3 between '2002-01-01' and '2002-12-31';
c1	c2	c3
158	abc	2002-06-01
142	abc	2002-02-14
162	abc	2002-06-28
136	abc	2002-01-05
182	abc	2002-11-09
184	abc	2002-11-22
drop table t1;
CREATE TABLE t1 (c1 INT) PARTITION BY HASH(c1) PARTITIONS 1;
INSERT DELAYED INTO t1 VALUES (1);
ERROR 42000: You have an error in your SQL syntax; check the manual that corresponds to your OceanBase version for the right syntax to use near 'DELAYED INTO t1 VALUES (1)' at line 1
DROP TABLE t1;
