drop table if exists t1,t2,t3;
set autocommit=0;
create table t1 (a int not null) PARTITION BY KEY (a) PARTITIONS 3;
insert into t1 values (1);
insert into t1 values (2);
insert into t1 values (3);
select * from t1;
a
1
2
3
show status like "Qcache_queries_in_cache";
Variable_name	Value
drop table t1;
commit;
set autocommit=1;
begin;
create table t1 (a int not null) PARTITION BY KEY (a) PARTITIONS 3;
insert into t1 values (1);
insert into t1 values (2);
insert into t1 values (3);
select * from t1;
a
1
2
3
show status like "Qcache_queries_in_cache";
Variable_name	Value
drop table t1;
commit;
create table t1 (a int not null) PARTITION BY KEY (a) PARTITIONS 3;
create table t2 (a int not null) PARTITION BY KEY (a) PARTITIONS 3;
create table t3 (a int not null) PARTITION BY KEY (a) PARTITIONS 3;
insert into t1 values (1);
insert into t1 values (2);
insert into t2 values (1);
insert into t2 values (2);
insert into t3 values (1);
insert into t3 values (2);
select * from t1;
a
1
2
select * from t2;
a
1
2
select * from t3;
a
1
2
show status like "Qcache_queries_in_cache";
Variable_name	Value
show status like "Qcache_hits";
Variable_name	Value
begin;
select * from t1;
a
1
2
select * from t2;
a
1
2
select * from t3;
a
1
2
show status like "Qcache_queries_in_cache";
Variable_name	Value
show status like "Qcache_hits";
Variable_name	Value
insert into t1 values (3);
insert into t2 values (3);
insert into t1 values (4);
select * from t1;
a
1
2
3
4
select * from t2;
a
1
2
3
select * from t3;
a
1
2
show status like "Qcache_queries_in_cache";
Variable_name	Value
show status like "Qcache_hits";
Variable_name	Value
commit;
show status like "Qcache_queries_in_cache";
Variable_name	Value
drop table t3,t2,t1;
CREATE TABLE t1 (id int(11) NOT NULL , PRIMARY KEY (id)) PARTITION BY HASH (id) PARTITIONS 3;
select count(*) from t1;
count(*)
0
insert into t1 (id) values (0);
select count(*) from t1;
count(*)
1
drop table t1;
SET @@autocommit=1;
connection default
SHOW VARIABLES LIKE 'have_query_cache';
Variable_name	Value
SET @@autocommit=1;
CREATE TABLE t2 (s1 int, s2 varchar(1000), key(s1) LOCAL) PARTITION BY KEY (s1) PARTITIONS 3;
INSERT INTO t2 VALUES (1,repeat('a',10));
INSERT INTO t2 VALUES(2,repeat('a',10));
INSERT INTO t2 VALUES(3,repeat('a',10));
INSERT INTO t2 VALUES(4,repeat('a',10));
COMMIT;
START TRANSACTION;
SELECT  count(*) FROM t2 WHERE s2 = 'w';
count(*)
0
UPDATE t2 SET s2 = 'w' WHERE s1 = 3;
SELECT  count(*) FROM t2 WHERE s2 = 'w';
count(*)
1
show status like "Qcache_queries_in_cache";
Variable_name	Value
connection connection1
START TRANSACTION;
SELECT  count(*) FROM t2 WHERE s2 = 'w';
count(*)
0
INSERT INTO t2 VALUES (5,'w');
SELECT  count(*) FROM t2 WHERE s2 = 'w';
count(*)
1
COMMIT;
SELECT  count(*) FROM t2 WHERE s2 = 'w';
count(*)
1
show status like "Qcache_queries_in_cache";
Variable_name	Value
connection default
SELECT  count(*) FROM t2 WHERE s2 = 'w';
count(*)
2
COMMIT;
show status like "Qcache_queries_in_cache";
Variable_name	Value
SELECT  count(*) FROM t2 WHERE s2 = 'w';
count(*)
2
show status like "Qcache_queries_in_cache";
Variable_name	Value
connection connection1
SELECT  count(*) FROM t2 WHERE s2 = 'w';
count(*)
2
START TRANSACTION;
SELECT  count(*) FROM t2 WHERE s2 = 'w';
count(*)
2
INSERT INTO t2 VALUES (6,'w');
SELECT  count(*) FROM t2 WHERE s2 = 'w';
count(*)
3
connection default
SELECT  count(*) FROM t2 WHERE s2 = 'w';
count(*)
2
START TRANSACTION;
SELECT  count(*) FROM t2 WHERE s2 = 'w';
count(*)
2
DELETE from t2 WHERE s1=3;
SELECT  count(*) FROM t2 WHERE s2 = 'w';
count(*)
1
COMMIT;
connection connection1
COMMIT;
SELECT  count(*) FROM t2 WHERE s2 = 'w';
count(*)
2
show status like "Qcache_queries_in_cache";
Variable_name	Value
show status like "Qcache_hits";
Variable_name	Value
drop table t2;
