drop table if exists t1,t2;
CREATE TABLE t1 (
c1 INT,
c2 VARCHAR(100),
c3 BIGINT ,
PRIMARY KEY(c1,c2),
KEY(c1) LOCAL)
PARTITION BY HASH (c1) PARTITIONS 4;
CREATE TABLE t2 (
c1 INT,
c2 VARCHAR(100),
c3 BIGINT ,
PRIMARY KEY(c1,c2),
KEY(c1) LOCAL)
PARTITION BY HASH (c1) PARTITIONS 4;
select * from t1 where c1 = 3;
c1	c2	c3
3	C3	9
select * from t1 where c1 <=> 3;
c1	c2	c3
3	C3	9
select * from t1 where c1 = 3 or c1 = 4;
c1	c2	c3
4	C4	16
3	C3	9
select * from t1 where c1 > 98;
c1	c2	c3
10004	C4	10016
10008	C8	10064
10012	C12	10144
10016	C16	10256
10001	C1	10001
10005	C5	10025
10009	C9	10081
10013	C13	10169
10002	C2	10004
10006	C6	10036
10010	C10	10100
10014	C14	10196
10003	C3	10009
10007	C7	10049
10011	C11	10121
10015	C15	10225
select * from t1 where c1 >=98;
c1	c2	c3
10004	C4	10016
10008	C8	10064
10012	C12	10144
10016	C16	10256
10001	C1	10001
10005	C5	10025
10009	C9	10081
10013	C13	10169
10002	C2	10004
10006	C6	10036
10010	C10	10100
10014	C14	10196
10003	C3	10009
10007	C7	10049
10011	C11	10121
10015	C15	10225
select * from t1 where c1 < 3;
c1	c2	c3
1	C1	1
2	C2	4
select * from t1 where c1 <= 3;
c1	c2	c3
1	C1	1
2	C2	4
3	C3	9
select * from t1 where c1 <=3 and c1>=1;
c1	c2	c3
1	C1	1
2	C2	4
3	C3	9
select * from t1 partition(p0);
c1	c2	c3
4	C4	16
8	C8	64
12	C12	144
16	C16	256
10004	C4	10016
10008	C8	10064
10012	C12	10144
10016	C16	10256
select * from t1 partition(p0,p1);
c1	c2	c3
4	C4	16
8	C8	64
12	C12	144
16	C16	256
10004	C4	10016
10008	C8	10064
10012	C12	10144
10016	C16	10256
1	C1	1
5	C5	25
9	C9	81
13	C13	169
10001	C1	10001
10005	C5	10025
10009	C9	10081
10013	C13	10169
select * from t1;
c1	c2	c3
4	C4	16
8	C8	64
12	C12	144
16	C16	256
10004	C4	10016
10008	C8	10064
10012	C12	10144
10016	C16	10256
1	C1	1
5	C5	25
9	C9	81
13	C13	169
10001	C1	10001
10005	C5	10025
10009	C9	10081
10013	C13	10169
2	C2	4
6	C6	36
10	C10	100
14	C14	196
10002	C2	10004
10006	C6	10036
10010	C10	10100
10014	C14	10196
3	C3	9
7	C7	49
11	C11	121
15	C15	225
10003	C3	10009
10007	C7	10049
10011	C11	10121
10015	C15	10225
update t1 set c2=concat(c2,'_up') where c1=1;
update t1 set c2=concat(c2,'_up') where c1<=>1;
explain partitions update t1 set c2=concat(c2,'_up') where c1=2 or c3=3;
Query Plan
============================================
|ID|OPERATOR           |NAME|EST. ROWS|COST|
--------------------------------------------
|0 |EXCHANGE IN DISTR  |    |1        |39  |
|1 | EXCHANGE OUT DISTR|    |1        |39  |
|2 |  UPDATE           |    |1        |39  |
|3 |   TABLE SCAN      |t1  |1        |39  |
============================================

Outputs & filters: 
-------------------------------------
  0 - output(nil), filter(nil)
  1 - output(nil), filter(nil)
  2 - output(nil), filter(nil), params([{t1: (t1.c1, t1.c2, t1.c3)}]), update([t1.c2=column_conv(VARCHAR,utf8mb4_general_ci,length:100,NOT NULL,concat(t1.c2, '_up'))])
  3 - output([t1.c1], [t1.c2], [t1.c3], [column_conv(VARCHAR,utf8mb4_general_ci,length:100,NOT NULL,concat(t1.c2, '_up'))]), filter([t1.c1 = 2 OR t1.c3 = 3]), 
      access([t1.c1], [t1.c2], [t1.c3]), partitions(p[0-3])

update t1 set c2=concat(c2,'_up') where c1=2 or c3=3;
explain partitions update t1 set c2=concat(c2,'_up') where c1>98;
Query Plan
============================================
|ID|OPERATOR           |NAME|EST. ROWS|COST|
--------------------------------------------
|0 |EXCHANGE IN DISTR  |    |16       |53  |
|1 | EXCHANGE OUT DISTR|    |16       |53  |
|2 |  UPDATE           |    |16       |53  |
|3 |   TABLE SCAN      |t1  |16       |37  |
============================================

Outputs & filters: 
-------------------------------------
  0 - output(nil), filter(nil)
  1 - output(nil), filter(nil)
  2 - output(nil), filter(nil), params([{t1: (t1.c1, t1.c2, t1.c3)}]), update([t1.c2=column_conv(VARCHAR,utf8mb4_general_ci,length:100,NOT NULL,concat(t1.c2, '_up'))])
  3 - output([t1.c1], [t1.c2], [t1.c3], [column_conv(VARCHAR,utf8mb4_general_ci,length:100,NOT NULL,concat(t1.c2, '_up'))]), filter(nil), 
      access([t1.c1], [t1.c2], [t1.c3]), partitions(p[0-3])

update t1 set c2=concat(c2,'_up') where c1>98;
explain partitions update t1 set c2=concat(c2,'_up') where c1>=98;
Query Plan
============================================
|ID|OPERATOR           |NAME|EST. ROWS|COST|
--------------------------------------------
|0 |EXCHANGE IN DISTR  |    |16       |53  |
|1 | EXCHANGE OUT DISTR|    |16       |53  |
|2 |  UPDATE           |    |16       |53  |
|3 |   TABLE SCAN      |t1  |16       |37  |
============================================

Outputs & filters: 
-------------------------------------
  0 - output(nil), filter(nil)
  1 - output(nil), filter(nil)
  2 - output(nil), filter(nil), params([{t1: (t1.c1, t1.c2, t1.c3)}]), update([t1.c2=column_conv(VARCHAR,utf8mb4_general_ci,length:100,NOT NULL,concat(t1.c2, '_up'))])
  3 - output([t1.c1], [t1.c2], [t1.c3], [column_conv(VARCHAR,utf8mb4_general_ci,length:100,NOT NULL,concat(t1.c2, '_up'))]), filter(nil), 
      access([t1.c1], [t1.c2], [t1.c3]), partitions(p[0-3])

update t1 set c2=concat(c2,'_up') where c1>=98;
explain partitions update t1 set c2=concat(c2,'_up') where c1<3;
Query Plan
============================================
|ID|OPERATOR           |NAME|EST. ROWS|COST|
--------------------------------------------
|0 |EXCHANGE IN DISTR  |    |0        |10  |
|1 | EXCHANGE OUT DISTR|    |0        |10  |
|2 |  UPDATE           |    |0        |10  |
|3 |   TABLE SCAN      |t1  |0        |10  |
============================================

Outputs & filters: 
-------------------------------------
  0 - output(nil), filter(nil)
  1 - output(nil), filter(nil)
  2 - output(nil), filter(nil), params([{t1: (t1.c1, t1.c2, t1.c3)}]), update([t1.c2=column_conv(VARCHAR,utf8mb4_general_ci,length:100,NOT NULL,concat(t1.c2, '_up'))])
  3 - output([t1.c1], [t1.c2], [t1.c3], [column_conv(VARCHAR,utf8mb4_general_ci,length:100,NOT NULL,concat(t1.c2, '_up'))]), filter(nil), 
      access([t1.c1], [t1.c2], [t1.c3]), partitions(p[0-3])

update t1 set c2=concat(c2,'_up') where c1<3;
explain partitions update t1 set c2=concat(c2,'_up') where c1<=3;
Query Plan
============================================
|ID|OPERATOR           |NAME|EST. ROWS|COST|
--------------------------------------------
|0 |EXCHANGE IN DISTR  |    |0        |10  |
|1 | EXCHANGE OUT DISTR|    |0        |10  |
|2 |  UPDATE           |    |0        |10  |
|3 |   TABLE SCAN      |t1  |0        |10  |
============================================

Outputs & filters: 
-------------------------------------
  0 - output(nil), filter(nil)
  1 - output(nil), filter(nil)
  2 - output(nil), filter(nil), params([{t1: (t1.c1, t1.c2, t1.c3)}]), update([t1.c2=column_conv(VARCHAR,utf8mb4_general_ci,length:100,NOT NULL,concat(t1.c2, '_up'))])
  3 - output([t1.c1], [t1.c2], [t1.c3], [column_conv(VARCHAR,utf8mb4_general_ci,length:100,NOT NULL,concat(t1.c2, '_up'))]), filter(nil), 
      access([t1.c1], [t1.c2], [t1.c3]), partitions(p[0-3])

update t1 set c2=concat(c2,'_up') where c1<=3;
explain partitions update t1 set c2=concat(c2,'_up') where c1<=3 and c1>=1;
Query Plan
============================================
|ID|OPERATOR           |NAME|EST. ROWS|COST|
--------------------------------------------
|0 |EXCHANGE IN DISTR  |    |0        |10  |
|1 | EXCHANGE OUT DISTR|    |0        |10  |
|2 |  UPDATE           |    |0        |10  |
|3 |   TABLE SCAN      |t1  |0        |10  |
============================================

Outputs & filters: 
-------------------------------------
  0 - output(nil), filter(nil)
  1 - output(nil), filter(nil)
  2 - output(nil), filter(nil), params([{t1: (t1.c1, t1.c2, t1.c3)}]), update([t1.c2=column_conv(VARCHAR,utf8mb4_general_ci,length:100,NOT NULL,concat(t1.c2, '_up'))])
  3 - output([t1.c1], [t1.c2], [t1.c3], [column_conv(VARCHAR,utf8mb4_general_ci,length:100,NOT NULL,concat(t1.c2, '_up'))]), filter(nil), 
      access([t1.c1], [t1.c2], [t1.c3]), partitions(p[0-3])

update t1 set c2=concat(c2,'_up') where c1<=3 and c1>=1;
explain partitions update t1 set c2=concat(c2,'_up') where c2>'C90';
Query Plan
============================================
|ID|OPERATOR           |NAME|EST. ROWS|COST|
--------------------------------------------
|0 |EXCHANGE IN DISTR  |    |7        |48  |
|1 | EXCHANGE OUT DISTR|    |7        |48  |
|2 |  UPDATE           |    |7        |48  |
|3 |   TABLE SCAN      |t1  |7        |42  |
============================================

Outputs & filters: 
-------------------------------------
  0 - output(nil), filter(nil)
  1 - output(nil), filter(nil)
  2 - output(nil), filter(nil), params([{t1: (t1.c1, t1.c2, t1.c3)}]), update([t1.c2=column_conv(VARCHAR,utf8mb4_general_ci,length:100,NOT NULL,concat(t1.c2, '_up'))])
  3 - output([t1.c1], [t1.c2], [t1.c3], [column_conv(VARCHAR,utf8mb4_general_ci,length:100,NOT NULL,concat(t1.c2, '_up'))]), filter([t1.c2 > 'C90']), 
      access([t1.c1], [t1.c2], [t1.c3]), partitions(p[0-3])

update t1 set c2=concat(c2,'_up') where c2>'C90';
delete from t1 where c1 = 3;
delete from t1 where c1 <=> 4;
explain partitions delete from t1 where c1 = 5 or c1 = 4;
Query Plan
============================================
|ID|OPERATOR           |NAME|EST. ROWS|COST|
--------------------------------------------
|0 |EXCHANGE IN DISTR  |    |2        |38  |
|1 | EXCHANGE OUT DISTR|    |2        |38  |
|2 |  DELETE           |    |2        |38  |
|3 |   TABLE SCAN      |t1  |2        |36  |
============================================

Outputs & filters: 
-------------------------------------
  0 - output(nil), filter(nil)
  1 - output(nil), filter(nil)
  2 - output(nil), filter(nil), params([{t1: (t1.c1, t1.c2, t1.c3)}])
  3 - output([t1.c1], [t1.c2], [t1.c3]), filter(nil), 
      access([t1.c1], [t1.c2], [t1.c3]), partitions(p[0-1])

delete from t1 where c1 = 5 or c1 = 4;
explain partitions delete from t1 where c1 > 98;
Query Plan
============================================
|ID|OPERATOR           |NAME|EST. ROWS|COST|
--------------------------------------------
|0 |EXCHANGE IN DISTR  |    |16       |53  |
|1 | EXCHANGE OUT DISTR|    |16       |53  |
|2 |  DELETE           |    |16       |53  |
|3 |   TABLE SCAN      |t1  |16       |37  |
============================================

Outputs & filters: 
-------------------------------------
  0 - output(nil), filter(nil)
  1 - output(nil), filter(nil)
  2 - output(nil), filter(nil), params([{t1: (t1.c1, t1.c2, t1.c3)}])
  3 - output([t1.c1], [t1.c2], [t1.c3]), filter(nil), 
      access([t1.c1], [t1.c2], [t1.c3]), partitions(p[0-3])

delete from t1 where c1 > 98;
explain partitions delete from t1 where c1 >= 98;
Query Plan
============================================
|ID|OPERATOR           |NAME|EST. ROWS|COST|
--------------------------------------------
|0 |EXCHANGE IN DISTR  |    |0        |10  |
|1 | EXCHANGE OUT DISTR|    |0        |10  |
|2 |  DELETE           |    |0        |10  |
|3 |   TABLE SCAN      |t1  |0        |10  |
============================================

Outputs & filters: 
-------------------------------------
  0 - output(nil), filter(nil)
  1 - output(nil), filter(nil)
  2 - output(nil), filter(nil), params([{t1: (t1.c1, t1.c2, t1.c3)}])
  3 - output([t1.c1], [t1.c2], [t1.c3]), filter(nil), 
      access([t1.c1], [t1.c2], [t1.c3]), partitions(p[0-3])

delete from t1 where c1 >= 98;
explain partitions delete from t1 where c1<3;
Query Plan
============================================
|ID|OPERATOR           |NAME|EST. ROWS|COST|
--------------------------------------------
|0 |EXCHANGE IN DISTR  |    |0        |10  |
|1 | EXCHANGE OUT DISTR|    |0        |10  |
|2 |  DELETE           |    |0        |10  |
|3 |   TABLE SCAN      |t1  |0        |10  |
============================================

Outputs & filters: 
-------------------------------------
  0 - output(nil), filter(nil)
  1 - output(nil), filter(nil)
  2 - output(nil), filter(nil), params([{t1: (t1.c1, t1.c2, t1.c3)}])
  3 - output([t1.c1], [t1.c2], [t1.c3]), filter(nil), 
      access([t1.c1], [t1.c2], [t1.c3]), partitions(p[0-3])

delete from t1 where c1<3;
explain partitions delete from t1 where c1<=3;
Query Plan
============================================
|ID|OPERATOR           |NAME|EST. ROWS|COST|
--------------------------------------------
|0 |EXCHANGE IN DISTR  |    |0        |10  |
|1 | EXCHANGE OUT DISTR|    |0        |10  |
|2 |  DELETE           |    |0        |10  |
|3 |   TABLE SCAN      |t1  |0        |10  |
============================================

Outputs & filters: 
-------------------------------------
  0 - output(nil), filter(nil)
  1 - output(nil), filter(nil)
  2 - output(nil), filter(nil), params([{t1: (t1.c1, t1.c2, t1.c3)}])
  3 - output([t1.c1], [t1.c2], [t1.c3]), filter(nil), 
      access([t1.c1], [t1.c2], [t1.c3]), partitions(p[0-3])

delete from t1 where c1<=3;
explain partitions delete from t1 where c1>=6 and c1<=8;
Query Plan
============================================
|ID|OPERATOR           |NAME|EST. ROWS|COST|
--------------------------------------------
|0 |EXCHANGE IN DISTR  |    |4        |40  |
|1 | EXCHANGE OUT DISTR|    |4        |40  |
|2 |  DELETE           |    |4        |40  |
|3 |   TABLE SCAN      |t1  |4        |36  |
============================================

Outputs & filters: 
-------------------------------------
  0 - output(nil), filter(nil)
  1 - output(nil), filter(nil)
  2 - output(nil), filter(nil), params([{t1: (t1.c1, t1.c2, t1.c3)}])
  3 - output([t1.c1], [t1.c2], [t1.c3]), filter(nil), 
      access([t1.c1], [t1.c2], [t1.c3]), partitions(p[0-3])

delete from t1 where c1>=6 and c1<=8;
delete from t1 partition(p0);
delete from t1 partition(p0,p1);
delete from t1;
drop table if exists t1,t2;
CREATE TABLE t1 (
c1 INT,
c2 VARCHAR(100),
c3 BIGINT ,
PRIMARY KEY(c1,c2),
KEY(c1) LOCAL)
PARTITION BY KEY (c1) PARTITIONS 4;
CREATE TABLE t2 (
c1 INT,
c2 VARCHAR(100),
c3 BIGINT ,
PRIMARY KEY(c1,c2),
KEY(c1) LOCAL)
PARTITION BY KEY (c1) PARTITIONS 4;
select * from t1 where c1 = 3;
c1	c2	c3
3	C3	9
select * from t1 where c1 <=> 3;
c1	c2	c3
3	C3	9
select * from t1 where c1 = 3 or c1 = 4;
c1	c2	c3
3	C3	9
4	C4	16
select * from t1 where c1 > 98;
c1	c2	c3
10006	C6	10036
10009	C9	10081
10014	C14	10196
10003	C3	10009
10005	C5	10025
10011	C11	10121
10001	C1	10001
10002	C2	10004
10004	C4	10016
10007	C7	10049
10008	C8	10064
10010	C10	10100
10012	C12	10144
10013	C13	10169
10015	C15	10225
10016	C16	10256
select * from t1 where c1 >=98;
c1	c2	c3
10006	C6	10036
10009	C9	10081
10014	C14	10196
10003	C3	10009
10005	C5	10025
10011	C11	10121
10001	C1	10001
10002	C2	10004
10004	C4	10016
10007	C7	10049
10008	C8	10064
10010	C10	10100
10012	C12	10144
10013	C13	10169
10015	C15	10225
10016	C16	10256
select * from t1 where c1 < 3;
c1	c2	c3
1	C1	1
2	C2	4
select * from t1 where c1 <= 3;
c1	c2	c3
1	C1	1
2	C2	4
3	C3	9
select * from t1 where c1 <=3 and c1>=1;
c1	c2	c3
1	C1	1
2	C2	4
3	C3	9
select * from t1 partition(p0);
c1	c2	c3
5	C5	25
6	C6	36
9	C9	81
13	C13	169
10006	C6	10036
10009	C9	10081
10014	C14	10196
select * from t1 partition(p0,p1);
c1	c2	c3
5	C5	25
6	C6	36
9	C9	81
13	C13	169
10006	C6	10036
10009	C9	10081
10014	C14	10196
7	C7	49
8	C8	64
10	C10	100
11	C11	121
12	C12	144
16	C16	256
10003	C3	10009
select * from t1;
c1	c2	c3
5	C5	25
6	C6	36
9	C9	81
13	C13	169
10006	C6	10036
10009	C9	10081
10014	C14	10196
7	C7	49
8	C8	64
10	C10	100
11	C11	121
12	C12	144
16	C16	256
10003	C3	10009
1	C1	1
2	C2	4
3	C3	9
4	C4	16
14	C14	196
10005	C5	10025
10011	C11	10121
15	C15	225
10001	C1	10001
10002	C2	10004
10004	C4	10016
10007	C7	10049
10008	C8	10064
10010	C10	10100
10012	C12	10144
10013	C13	10169
10015	C15	10225
10016	C16	10256
update t1 set c2=concat(c2,'_up') where c1=1;
update t1 set c2=concat(c2,'_up') where c1<=>1;
explain partitions update t1 set c2=concat(c2,'_up') where c1=2 or c3=3;
Query Plan
============================================
|ID|OPERATOR           |NAME|EST. ROWS|COST|
--------------------------------------------
|0 |EXCHANGE IN DISTR  |    |1        |38  |
|1 | EXCHANGE OUT DISTR|    |1        |38  |
|2 |  UPDATE           |    |1        |38  |
|3 |   TABLE SCAN      |t1  |1        |38  |
============================================

Outputs & filters: 
-------------------------------------
  0 - output(nil), filter(nil)
  1 - output(nil), filter(nil)
  2 - output(nil), filter(nil), params([{t1: (t1.c1, t1.c2, t1.c3)}]), update([t1.c2=column_conv(VARCHAR,utf8mb4_general_ci,length:100,NOT NULL,concat(t1.c2, '_up'))])
  3 - output([t1.c1], [t1.c2], [t1.c3], [column_conv(VARCHAR,utf8mb4_general_ci,length:100,NOT NULL,concat(t1.c2, '_up'))]), filter([t1.c1 = 2 OR t1.c3 = 3]), 
      access([t1.c1], [t1.c2], [t1.c3]), partitions(p[0-3])

update t1 set c2=concat(c2,'_up') where c1=2 or c3=3;
explain partitions update t1 set c2=concat(c2,'_up') where c1>98;
Query Plan
============================================
|ID|OPERATOR           |NAME|EST. ROWS|COST|
--------------------------------------------
|0 |EXCHANGE IN DISTR  |    |12       |49  |
|1 | EXCHANGE OUT DISTR|    |12       |49  |
|2 |  UPDATE           |    |12       |49  |
|3 |   TABLE SCAN      |t1  |12       |37  |
============================================

Outputs & filters: 
-------------------------------------
  0 - output(nil), filter(nil)
  1 - output(nil), filter(nil)
  2 - output(nil), filter(nil), params([{t1: (t1.c1, t1.c2, t1.c3)}]), update([t1.c2=column_conv(VARCHAR,utf8mb4_general_ci,length:100,NOT NULL,concat(t1.c2, '_up'))])
  3 - output([t1.c1], [t1.c2], [t1.c3], [column_conv(VARCHAR,utf8mb4_general_ci,length:100,NOT NULL,concat(t1.c2, '_up'))]), filter(nil), 
      access([t1.c1], [t1.c2], [t1.c3]), partitions(p[0-3])

update t1 set c2=concat(c2,'_up') where c1>98;
explain partitions update t1 set c2=concat(c2,'_up') where c1>=98;
Query Plan
============================================
|ID|OPERATOR           |NAME|EST. ROWS|COST|
--------------------------------------------
|0 |EXCHANGE IN DISTR  |    |12       |49  |
|1 | EXCHANGE OUT DISTR|    |12       |49  |
|2 |  UPDATE           |    |12       |49  |
|3 |   TABLE SCAN      |t1  |12       |37  |
============================================

Outputs & filters: 
-------------------------------------
  0 - output(nil), filter(nil)
  1 - output(nil), filter(nil)
  2 - output(nil), filter(nil), params([{t1: (t1.c1, t1.c2, t1.c3)}]), update([t1.c2=column_conv(VARCHAR,utf8mb4_general_ci,length:100,NOT NULL,concat(t1.c2, '_up'))])
  3 - output([t1.c1], [t1.c2], [t1.c3], [column_conv(VARCHAR,utf8mb4_general_ci,length:100,NOT NULL,concat(t1.c2, '_up'))]), filter(nil), 
      access([t1.c1], [t1.c2], [t1.c3]), partitions(p[0-3])

update t1 set c2=concat(c2,'_up') where c1>=98;
explain partitions update t1 set c2=concat(c2,'_up') where c1<3;
Query Plan
============================================
|ID|OPERATOR           |NAME|EST. ROWS|COST|
--------------------------------------------
|0 |EXCHANGE IN DISTR  |    |0        |10  |
|1 | EXCHANGE OUT DISTR|    |0        |10  |
|2 |  UPDATE           |    |0        |10  |
|3 |   TABLE SCAN      |t1  |0        |10  |
============================================

Outputs & filters: 
-------------------------------------
  0 - output(nil), filter(nil)
  1 - output(nil), filter(nil)
  2 - output(nil), filter(nil), params([{t1: (t1.c1, t1.c2, t1.c3)}]), update([t1.c2=column_conv(VARCHAR,utf8mb4_general_ci,length:100,NOT NULL,concat(t1.c2, '_up'))])
  3 - output([t1.c1], [t1.c2], [t1.c3], [column_conv(VARCHAR,utf8mb4_general_ci,length:100,NOT NULL,concat(t1.c2, '_up'))]), filter(nil), 
      access([t1.c1], [t1.c2], [t1.c3]), partitions(p[0-3])

update t1 set c2=concat(c2,'_up') where c1<3;
explain partitions update t1 set c2=concat(c2,'_up') where c1<=3;
Query Plan
============================================
|ID|OPERATOR           |NAME|EST. ROWS|COST|
--------------------------------------------
|0 |EXCHANGE IN DISTR  |    |0        |10  |
|1 | EXCHANGE OUT DISTR|    |0        |10  |
|2 |  UPDATE           |    |0        |10  |
|3 |   TABLE SCAN      |t1  |0        |10  |
============================================

Outputs & filters: 
-------------------------------------
  0 - output(nil), filter(nil)
  1 - output(nil), filter(nil)
  2 - output(nil), filter(nil), params([{t1: (t1.c1, t1.c2, t1.c3)}]), update([t1.c2=column_conv(VARCHAR,utf8mb4_general_ci,length:100,NOT NULL,concat(t1.c2, '_up'))])
  3 - output([t1.c1], [t1.c2], [t1.c3], [column_conv(VARCHAR,utf8mb4_general_ci,length:100,NOT NULL,concat(t1.c2, '_up'))]), filter(nil), 
      access([t1.c1], [t1.c2], [t1.c3]), partitions(p[0-3])

update t1 set c2=concat(c2,'_up') where c1<=3;
explain partitions update t1 set c2=concat(c2,'_up') where c1<=3 and c1>=1;
Query Plan
============================================
|ID|OPERATOR           |NAME|EST. ROWS|COST|
--------------------------------------------
|0 |EXCHANGE IN DISTR  |    |0        |10  |
|1 | EXCHANGE OUT DISTR|    |0        |10  |
|2 |  UPDATE           |    |0        |10  |
|3 |   TABLE SCAN      |t1  |0        |10  |
============================================

Outputs & filters: 
-------------------------------------
  0 - output(nil), filter(nil)
  1 - output(nil), filter(nil)
  2 - output(nil), filter(nil), params([{t1: (t1.c1, t1.c2, t1.c3)}]), update([t1.c2=column_conv(VARCHAR,utf8mb4_general_ci,length:100,NOT NULL,concat(t1.c2, '_up'))])
  3 - output([t1.c1], [t1.c2], [t1.c3], [column_conv(VARCHAR,utf8mb4_general_ci,length:100,NOT NULL,concat(t1.c2, '_up'))]), filter(nil), 
      access([t1.c1], [t1.c2], [t1.c3]), partitions(p[0-3])

update t1 set c2=concat(c2,'_up') where c1<=3 and c1>=1;
explain partitions update t1 set c2=concat(c2,'_up') where c2>'C90';
Query Plan
============================================
|ID|OPERATOR           |NAME|EST. ROWS|COST|
--------------------------------------------
|0 |EXCHANGE IN DISTR  |    |6        |47  |
|1 | EXCHANGE OUT DISTR|    |6        |47  |
|2 |  UPDATE           |    |6        |47  |
|3 |   TABLE SCAN      |t1  |6        |41  |
============================================

Outputs & filters: 
-------------------------------------
  0 - output(nil), filter(nil)
  1 - output(nil), filter(nil)
  2 - output(nil), filter(nil), params([{t1: (t1.c1, t1.c2, t1.c3)}]), update([t1.c2=column_conv(VARCHAR,utf8mb4_general_ci,length:100,NOT NULL,concat(t1.c2, '_up'))])
  3 - output([t1.c1], [t1.c2], [t1.c3], [column_conv(VARCHAR,utf8mb4_general_ci,length:100,NOT NULL,concat(t1.c2, '_up'))]), filter([t1.c2 > 'C90']), 
      access([t1.c1], [t1.c2], [t1.c3]), partitions(p[0-3])

update t1 set c2=concat(c2,'_up') where c2>'C90';
delete from t1 where c1 = 3;
delete from t1 where c1 <=> 4;
explain partitions delete from t1 where c1 = 5 or c1 = 4;
Query Plan
============================================
|ID|OPERATOR           |NAME|EST. ROWS|COST|
--------------------------------------------
|0 |EXCHANGE IN DISTR  |    |2        |38  |
|1 | EXCHANGE OUT DISTR|    |2        |38  |
|2 |  DELETE           |    |2        |38  |
|3 |   TABLE SCAN      |t1  |2        |36  |
============================================

Outputs & filters: 
-------------------------------------
  0 - output(nil), filter(nil)
  1 - output(nil), filter(nil)
  2 - output(nil), filter(nil), params([{t1: (t1.c1, t1.c2, t1.c3)}])
  3 - output([t1.c1], [t1.c2], [t1.c3]), filter(nil), 
      access([t1.c1], [t1.c2], [t1.c3]), partitions(p0, p2)

delete from t1 where c1 = 5 or c1 = 4;
explain partitions delete from t1 where c1 > 98;
Query Plan
============================================
|ID|OPERATOR           |NAME|EST. ROWS|COST|
--------------------------------------------
|0 |EXCHANGE IN DISTR  |    |12       |49  |
|1 | EXCHANGE OUT DISTR|    |12       |49  |
|2 |  DELETE           |    |12       |49  |
|3 |   TABLE SCAN      |t1  |12       |37  |
============================================

Outputs & filters: 
-------------------------------------
  0 - output(nil), filter(nil)
  1 - output(nil), filter(nil)
  2 - output(nil), filter(nil), params([{t1: (t1.c1, t1.c2, t1.c3)}])
  3 - output([t1.c1], [t1.c2], [t1.c3]), filter(nil), 
      access([t1.c1], [t1.c2], [t1.c3]), partitions(p[0-3])

delete from t1 where c1 > 98;
explain partitions delete from t1 where c1 >= 98;
Query Plan
============================================
|ID|OPERATOR           |NAME|EST. ROWS|COST|
--------------------------------------------
|0 |EXCHANGE IN DISTR  |    |0        |10  |
|1 | EXCHANGE OUT DISTR|    |0        |10  |
|2 |  DELETE           |    |0        |10  |
|3 |   TABLE SCAN      |t1  |0        |10  |
============================================

Outputs & filters: 
-------------------------------------
  0 - output(nil), filter(nil)
  1 - output(nil), filter(nil)
  2 - output(nil), filter(nil), params([{t1: (t1.c1, t1.c2, t1.c3)}])
  3 - output([t1.c1], [t1.c2], [t1.c3]), filter(nil), 
      access([t1.c1], [t1.c2], [t1.c3]), partitions(p[0-3])

delete from t1 where c1 >= 98;
explain partitions delete from t1 where c1<3;
Query Plan
============================================
|ID|OPERATOR           |NAME|EST. ROWS|COST|
--------------------------------------------
|0 |EXCHANGE IN DISTR  |    |0        |10  |
|1 | EXCHANGE OUT DISTR|    |0        |10  |
|2 |  DELETE           |    |0        |10  |
|3 |   TABLE SCAN      |t1  |0        |10  |
============================================

Outputs & filters: 
-------------------------------------
  0 - output(nil), filter(nil)
  1 - output(nil), filter(nil)
  2 - output(nil), filter(nil), params([{t1: (t1.c1, t1.c2, t1.c3)}])
  3 - output([t1.c1], [t1.c2], [t1.c3]), filter(nil), 
      access([t1.c1], [t1.c2], [t1.c3]), partitions(p[0-3])

delete from t1 where c1<3;
explain partitions delete from t1 where c1<=3;
Query Plan
============================================
|ID|OPERATOR           |NAME|EST. ROWS|COST|
--------------------------------------------
|0 |EXCHANGE IN DISTR  |    |0        |10  |
|1 | EXCHANGE OUT DISTR|    |0        |10  |
|2 |  DELETE           |    |0        |10  |
|3 |   TABLE SCAN      |t1  |0        |10  |
============================================

Outputs & filters: 
-------------------------------------
  0 - output(nil), filter(nil)
  1 - output(nil), filter(nil)
  2 - output(nil), filter(nil), params([{t1: (t1.c1, t1.c2, t1.c3)}])
  3 - output([t1.c1], [t1.c2], [t1.c3]), filter(nil), 
      access([t1.c1], [t1.c2], [t1.c3]), partitions(p[0-3])

delete from t1 where c1<=3;
explain partitions delete from t1 where c1>=6 and c1<=8;
Query Plan
============================================
|ID|OPERATOR           |NAME|EST. ROWS|COST|
--------------------------------------------
|0 |EXCHANGE IN DISTR  |    |4        |40  |
|1 | EXCHANGE OUT DISTR|    |4        |40  |
|2 |  DELETE           |    |4        |40  |
|3 |   TABLE SCAN      |t1  |4        |36  |
============================================

Outputs & filters: 
-------------------------------------
  0 - output(nil), filter(nil)
  1 - output(nil), filter(nil)
  2 - output(nil), filter(nil), params([{t1: (t1.c1, t1.c2, t1.c3)}])
  3 - output([t1.c1], [t1.c2], [t1.c3]), filter(nil), 
      access([t1.c1], [t1.c2], [t1.c3]), partitions(p[0-3])

delete from t1 where c1>=6 and c1<=8;
delete from t1 partition(p0);
delete from t1 partition(p0,p1);
delete from t1;
