drop table if exists t1,t2,t3,t4;
create table t1(pk varchar(10) primary key,i1 int, i2 int);
insert into t1 values('abbbbbbbbb',1,10),('aabbbbbbbb',2,10);
desc t1;
Field	Type	Null	Key	Default	Extra
pk	varchar(10)	NO	PRI	NULL	
i1	int(11)	YES		NULL	
i2	int(11)	YES		NULL	
alter table t1 modify column pk varchar(20);
desc t1;
Field	Type	Null	Key	Default	Extra
pk	varchar(20)	NO	PRI	NULL	
i1	int(11)	YES		NULL	
i2	int(11)	YES		NULL	
select * from t1;
pk	i1	i2
aabbbbbbbb	2	10
abbbbbbbbb	1	10
insert into t1 values('aaabbbbbbbbbbbb',3,15),('aaaabbbb',4,8);
insert into t1 values('aaaaab',5,6);
insert into t1 values('aaaaaabbbbbbbbbbbbbbbbbbb',6,25);
ERROR 22001: Data too long for column 'pk' at row 1
insert into t1 values('aaaaaaab',7,8),('aaaaaaa8bbbbbbbbbbbbb',8,21);
ERROR 22001: Data too long for column 'pk' at row 2
select * from t1;
pk	i1	i2
aaaaab	5	6
aaaabbbb	4	8
aaabbbbbbbbbbbb	3	15
aabbbbbbbb	2	10
abbbbbbbbb	1	10
update t1 set pk='aaaaaaaaabbb',i1=9,i2=12 where pk='abbbbbbbbb';
update t1 set pk='aaaaaaaaaa',i1=10,i2=10 where pk='aabbbbbbbb';
update t1 set pk='aaaaaaaaaaabbbbbbbbbbb',i1=11,i2=22 where pk='aaabbbbbbbbbbbb';
ERROR 22001: Data too long for column 'pk' at row 1
select * from t1;
pk	i1	i2
aaaaaaaaaa	10	10
aaaaaaaaabbb	9	12
aaaaab	5	6
aaaabbbb	4	8
aaabbbbbbbbbbbb	3	15
delete from t1 where pk='aaabbbbbbbbbbbb';
alter table t1 modify column pk varchar(30);
select * from t1;
pk	i1	i2
aaaaaaaaaa	10	10
aaaaaaaaabbb	9	12
aaaaab	5	6
aaaabbbb	4	8
insert into t1 values('aaabbbbbbbbbbbb',3,15);
select * from t1;
pk	i1	i2
aaaaaaaaaa	10	10
aaaaaaaaabbb	9	12
aaaaab	5	6
aaaabbbb	4	8
aaabbbbbbbbbbbb	3	15
delete from t1 where pk='aaaabbbb';
alter table t1 modify column pk varchar(31);
select * from t1;
pk	i1	i2
aaaaaaaaaa	10	10
aaaaaaaaabbb	9	12
aaaaab	5	6
aaabbbbbbbbbbbb	3	15
insert into t1 values('aaaabbbb',4,8);
select * from t1;
pk	i1	i2
aaaaaaaaaa	10	10
aaaaaaaaabbb	9	12
aaaaab	5	6
aaaabbbb	4	8
aaabbbbbbbbbbbb	3	15
replace into t1 values('aaaaaaaaaaaabbbbbbbbbbb',12,23);
replace into t1 values('aaaaaaaaaaaaabbbbbbbbbbbbbbbbbbb',13,32);
ERROR 22001: Data too long for column 'pk' at row 1
select * from t1;
pk	i1	i2
aaaaaaaaaa	10	10
aaaaaaaaaaaabbbbbbbbbbb	12	23
aaaaaaaaabbb	9	12
aaaaab	5	6
aaaabbbb	4	8
aaabbbbbbbbbbbb	3	15
desc t1;
Field	Type	Null	Key	Default	Extra
pk	varchar(31)	NO	PRI	NULL	
i1	int(11)	YES		NULL	
i2	int(11)	YES		NULL	
alter table t1 modify column pk varchar(35);
desc t1;
Field	Type	Null	Key	Default	Extra
pk	varchar(35)	NO	PRI	NULL	
i1	int(11)	YES		NULL	
i2	int(11)	YES		NULL	
insert into t1 values('aaaaaaaaaaaaaabbbbbbbbbbbbbbbbbb',14,32);
insert into t1 values('aaaaaaaaaaaaaaabbbbbbbbbbbbbbbbbbbbb',15,36);
ERROR 22001: Data too long for column 'pk' at row 1
insert into t1 values('aaaaaaaaaaaaaaaabbbb',16,20);
select * from t1;
pk	i1	i2
aaaaaaaaaa	10	10
aaaaaaaaaaaaaaaabbbb	16	20
aaaaaaaaaaaaaabbbbbbbbbbbbbbbbbb	14	32
aaaaaaaaaaaabbbbbbbbbbb	12	23
aaaaaaaaabbb	9	12
aaaaab	5	6
aaaabbbb	4	8
aaabbbbbbbbbbbb	3	15
update t1 set pk='aaaaaaaaaaaaaaaaabbbbbbbbbbbbbbb',i1=17,i2=32 where pk='aaabbbbbbbbbbbb';
update t1 set pk='aaaaaaaaaaaaaaaaaabbbbbbbbbbbbbbbbbb',i1=18,i2=36 where pk='aaaabbbb';
ERROR 22001: Data too long for column 'pk' at row 1
update t1 set pk='aaaaaaaaaaaaaaaaaaab',i1=19,i2=20 where pk='aaaaab';
select * from t1;
pk	i1	i2
aaaaaaaaaa	10	10
aaaaaaaaaaaaaaaaaaab	19	20
aaaaaaaaaaaaaaaaabbbbbbbbbbbbbbb	17	32
aaaaaaaaaaaaaaaabbbb	16	20
aaaaaaaaaaaaaabbbbbbbbbbbbbbbbbb	14	32
aaaaaaaaaaaabbbbbbbbbbb	12	23
aaaaaaaaabbb	9	12
aaaabbbb	4	8
delete from t1 where pk='aaaabbbb';
alter table t1 modify column pk varchar(40);
select * from t1;
pk	i1	i2
aaaaaaaaaa	10	10
aaaaaaaaaaaaaaaaaaab	19	20
aaaaaaaaaaaaaaaaabbbbbbbbbbbbbbb	17	32
aaaaaaaaaaaaaaaabbbb	16	20
aaaaaaaaaaaaaabbbbbbbbbbbbbbbbbb	14	32
aaaaaaaaaaaabbbbbbbbbbb	12	23
aaaaaaaaabbb	9	12
insert into t1 values('aaaabbbb',4,8);
select * from t1;
pk	i1	i2
aaaaaaaaaa	10	10
aaaaaaaaaaaaaaaaaaab	19	20
aaaaaaaaaaaaaaaaabbbbbbbbbbbbbbb	17	32
aaaaaaaaaaaaaaaabbbb	16	20
aaaaaaaaaaaaaabbbbbbbbbbbbbbbbbb	14	32
aaaaaaaaaaaabbbbbbbbbbb	12	23
aaaaaaaaabbb	9	12
aaaabbbb	4	8
replace into t1 values('aaaaaaaaaaaaaaaaaaaabbbbbbbbbbbbbbb',20,35);
replace into t1 values('aaaaaaaaaaaaaaaaaaaaabbbbbbbbbbbbbbbbbbbb',21,41);
ERROR 22001: Data too long for column 'pk' at row 1
replace into t1 values('aaaaaaaaaaaaaaaaabbbbbbbbbbbbbbb',17,32);
select * from t1;
pk	i1	i2
aaaaaaaaaa	10	10
aaaaaaaaaaaaaaaaaaaabbbbbbbbbbbbbbb	20	35
aaaaaaaaaaaaaaaaaaab	19	20
aaaaaaaaaaaaaaaaabbbbbbbbbbbbbbb	17	32
aaaaaaaaaaaaaaaabbbb	16	20
aaaaaaaaaaaaaabbbbbbbbbbbbbbbbbb	14	32
aaaaaaaaaaaabbbbbbbbbbb	12	23
aaaaaaaaabbb	9	12
aaaabbbb	4	8
drop table t1;
create table t2(pk varchar(5) primary key default 'a' not null,i1 int,i2 int);
insert into t2 values('aa',2,2),('aaa',3,3);
insert into t2(i1,i2) values(1,1);
alter table t2 modify column pk varchar(6) default 'a' not null;
select * from t2;
pk	i1	i2
a	1	1
aa	2	2
aaa	3	3
alter table t2 alter pk set default 'aaaaa';
insert into t2(i1,i2) values(5,5);
select * from t2;
pk	i1	i2
a	1	1
aa	2	2
aaa	3	3
aaaaa	5	5
alter table t2 alter pk set default 'aaaaaa';
select * from t2;
pk	i1	i2
a	1	1
aa	2	2
aaa	3	3
aaaaa	5	5
insert into t2(i1,i2) values(6,6);
select * from t2;
pk	i1	i2
a	1	1
aa	2	2
aaa	3	3
aaaaa	5	5
aaaaaa	6	6
alter table t2 alter pk set default 'aaaaaaa';
ERROR 42000: Invalid default value for 'pk'
select * from t2;
pk	i1	i2
a	1	1
aa	2	2
aaa	3	3
aaaaa	5	5
aaaaaa	6	6
alter table t2 modify column pk varchar(7) default 'aaaaaa' not null;
insert into t2(i1,i2) values(6,6);
ERROR 23000: Duplicate entry 'aaaaaa' for key 'PRIMARY'
alter table t2 alter pk set default 'aaaaaaa';
insert into t2(i1,i2) values(7,7);
alter table t2 alter pk set default 'aaaaaaaa';
ERROR 42000: Invalid default value for 'pk'
select * from t2;
pk	i1	i2
a	1	1
aa	2	2
aaa	3	3
aaaaa	5	5
aaaaaa	6	6
aaaaaaa	7	7
drop table t2;
create table t3(pk varchar(5) primary key, i1 int, i2 int) EXPIRE_INFO ( pk = "aaaaa");
insert into t3 values('aa',2,2),('aaaa',4,4);
alter table t3 modify column pk varchar(6);
insert into t3 values('aaaaa',5,5);
select * from t3;
pk	i1	i2
aa	2	2
aaaa	4	4
aaaaa	5	5
select * from t3;
pk	i1	i2
aa	2	2
aaaa	4	4
aaaaa	5	5
insert into t3 values('aaaaaa',6,6);
select * from t3;
pk	i1	i2
aa	2	2
aaaa	4	4
aaaaa	5	5
aaaaaa	6	6
alter table t3 set EXPIRE_INFO (pk="aaaaaa");
select * from t3;
pk	i1	i2
aa	2	2
aaaa	4	4
aaaaa	5	5
aaaaaa	6	6
create table t4(pk varchar(5) primary key, i1 int, i2 int) EXPIRE_INFO (pk = "aaaaaa");
insert into t4 values('aaaaa',5,5);
alter table t4 modify column pk varchar(6);
insert into t4 values('aaaaaa',6,6);
select * from t4;
pk	i1	i2
aaaaa	5	5
aaaaaa	6	6
select * from t4;
pk	i1	i2
aaaaa	5	5
aaaaaa	6	6
alter table t4 set EXPIRE_INFO (pk > "aaaaaa");
alter table t4 modify column pk varchar(8);
insert into t4 values('aaaaaaa',7,7),('aaaaaaaa',8,8);
select * from t4;
pk	i1	i2
aaaaa	5	5
aaaaaa	6	6
aaaaaaa	7	7
aaaaaaaa	8	8
select * from t4;
pk	i1	i2
aaaaa	5	5
aaaaaa	6	6
aaaaaaa	7	7
aaaaaaaa	8	8
create table t1(pk varchar(20) primary key, i1 int, i2 int);
alter table t1 modify column pk varchar(10);
desc t1;
Field	Type	Null	Key	Default	Extra
pk	varchar(10)	NO	PRI	NULL	
i1	int(11)	YES		NULL	
i2	int(11)	YES		NULL	
alter table t1 modify column pk varchar(0);
desc t1;
Field	Type	Null	Key	Default	Extra
pk	varchar(0)	NO	PRI	NULL	
i1	int(11)	YES		NULL	
i2	int(11)	YES		NULL	
alter table t1 modify column pk varchar(4096);
desc t1;
Field	Type	Null	Key	Default	Extra
pk	varchar(4096)	NO	PRI	NULL	
i1	int(11)	YES		NULL	
i2	int(11)	YES		NULL	
alter table t1 modify column pk varchar(4097);
ERROR 42000: Specified key was too long; max key length is 16384 bytes
desc t1;
Field	Type	Null	Key	Default	Extra
pk	varchar(4096)	NO	PRI	NULL	
i1	int(11)	YES		NULL	
i2	int(11)	YES		NULL	
alter table t1 modify column pk varchar(-1);
ERROR 42000: You have an error in your SQL syntax; check the manual that corresponds to your OceanBase version for the right syntax to use near '-1)' at line 1
