drop table if exists t1,t2,t3,t4;
create table t1(i1 int, f1 float, s1 varchar(255), d1 datetime, i2 int, f2 float,s2 varchar(1024), d2 datetime,primary key(i1,s1,d1));
desc t1;
Field	Type	Null	Key	Default	Extra
i1	int(11)	NO	PRI	NULL	
f1	float	YES		NULL	
s1	varchar(255)	NO	PRI	NULL	
d1	datetime	NO	PRI	NULL	
i2	int(11)	YES		NULL	
f2	float	YES		NULL	
s2	varchar(1024)	YES		NULL	
d2	datetime	YES		NULL	
explain t1;
Field	Type	Null	Key	Default	Extra
i1	int(11)	NO	PRI	NULL	
f1	float	YES		NULL	
s1	varchar(255)	NO	PRI	NULL	
d1	datetime	NO	PRI	NULL	
i2	int(11)	YES		NULL	
f2	float	YES		NULL	
s2	varchar(1024)	YES		NULL	
d2	datetime	YES		NULL	
insert into t1(i1,f1,s1,d1,i2,f2,s2,d2)values(1,1.2345,'row1_column3','2020-02-01 20:00:00',2,2.34542,'row1_column7','2014-04-01 20:00:00'),(2,1.2345231,'row2_column3','2014-04-01 20:00:00',3,2.34542,'row2_column7','2014-04-01 20:00:00');
select * from t1;
i1	f1	s1	d1	i2	f2	s2	d2
1	1.2345	row1_column3	2020-02-01 20:00:00	2	2.34542	row1_column7	2014-04-01 20:00:00
2	1.23452	row2_column3	2014-04-01 20:00:00	3	2.34542	row2_column7	2014-04-01 20:00:00
desc t1;
Field	Type	Null	Key	Default	Extra
i1	int(11)	NO	PRI	NULL	
f1	float	YES		NULL	
s1	varchar(255)	NO	PRI	NULL	
d1	datetime	NO	PRI	NULL	
i2	int(11)	YES		NULL	
f2	float	YES		NULL	
s2	varchar(1024)	YES		NULL	
d2	datetime	YES		NULL	
explain t1;
Field	Type	Null	Key	Default	Extra
i1	int(11)	NO	PRI	NULL	
f1	float	YES		NULL	
s1	varchar(255)	NO	PRI	NULL	
d1	datetime	NO	PRI	NULL	
i2	int(11)	YES		NULL	
f2	float	YES		NULL	
s2	varchar(1024)	YES		NULL	
d2	datetime	YES		NULL	
update t1 set i2=10,f2=10.1,s2='be_updated',d2='2011-11-11 10:00:00' where i1=1 and f1=1.2345 and s1='row1_column3' and d1='2020-02-01 20:00:00';
desc t1;
Field	Type	Null	Key	Default	Extra
i1	int(11)	NO	PRI	NULL	
f1	float	YES		NULL	
s1	varchar(255)	NO	PRI	NULL	
d1	datetime	NO	PRI	NULL	
i2	int(11)	YES		NULL	
f2	float	YES		NULL	
s2	varchar(1024)	YES		NULL	
d2	datetime	YES		NULL	
explain t1;
Field	Type	Null	Key	Default	Extra
i1	int(11)	NO	PRI	NULL	
f1	float	YES		NULL	
s1	varchar(255)	NO	PRI	NULL	
d1	datetime	NO	PRI	NULL	
i2	int(11)	YES		NULL	
f2	float	YES		NULL	
s2	varchar(1024)	YES		NULL	
d2	datetime	YES		NULL	
delete from t1 where i1=1 and f1=1.2345 and s1='row1_column3' and d1='2020-02-01 20:00:00';
desc t1;
Field	Type	Null	Key	Default	Extra
i1	int(11)	NO	PRI	NULL	
f1	float	YES		NULL	
s1	varchar(255)	NO	PRI	NULL	
d1	datetime	NO	PRI	NULL	
i2	int(11)	YES		NULL	
f2	float	YES		NULL	
s2	varchar(1024)	YES		NULL	
d2	datetime	YES		NULL	
explain t1;
Field	Type	Null	Key	Default	Extra
i1	int(11)	NO	PRI	NULL	
f1	float	YES		NULL	
s1	varchar(255)	NO	PRI	NULL	
d1	datetime	NO	PRI	NULL	
i2	int(11)	YES		NULL	
f2	float	YES		NULL	
s2	varchar(1024)	YES		NULL	
d2	datetime	YES		NULL	
delete from t1 where i1=2 and f1=1.2345231 and s1='row2_column3' and d1='2014-04-01 20:00:00';
select * from t1;
i1	f1	s1	d1	i2	f2	s2	d2
1	1.2345	row1_column3	2020-02-01 20:00:00	2	2.34542	row1_column7	2014-04-01 20:00:00
2	1.23452	row2_column3	2014-04-01 20:00:00	3	2.34542	row2_column7	2014-04-01 20:00:00
desc t1;
Field	Type	Null	Key	Default	Extra
i1	int(11)	NO	PRI	NULL	
f1	float	YES		NULL	
s1	varchar(255)	NO	PRI	NULL	
d1	datetime	NO	PRI	NULL	
i2	int(11)	YES		NULL	
f2	float	YES		NULL	
s2	varchar(1024)	YES		NULL	
d2	datetime	YES		NULL	
explain t1;
Field	Type	Null	Key	Default	Extra
i1	int(11)	NO	PRI	NULL	
f1	float	YES		NULL	
s1	varchar(255)	NO	PRI	NULL	
d1	datetime	NO	PRI	NULL	
i2	int(11)	YES		NULL	
f2	float	YES		NULL	
s2	varchar(1024)	YES		NULL	
d2	datetime	YES		NULL	
drop table t1;
create table t2(s varchar(4096) primary key,a int);
desc t2;
Field	Type	Null	Key	Default	Extra
s	varchar(4096)	NO	PRI	NULL	
a	int(11)	YES		NULL	
explain t2;
Field	Type	Null	Key	Default	Extra
s	varchar(4096)	NO	PRI	NULL	
a	int(11)	YES		NULL	
drop table t2;
create table t1(c1 int primary key, c2 int, cc3 int);
desc t1 'c_';
Field	Type	Null	Key	Default	Extra
c1	int(11)	NO	PRI	NULL	
c2	int(11)	YES		NULL	
explain t1 'c_';
Field	Type	Null	Key	Default	Extra
c1	int(11)	NO	PRI	NULL	
c2	int(11)	YES		NULL	
drop table t1;
