drop table if exists t, t1, xf, xf2, xf3, xf4, xf5, xf6;
create table t1(a int primary key, b int as (a+1));
insert into t1 values(1, 1);
ERROR HY000: The value specified for generated column 'b' in table 't1' is not allowed
insert into t1 values(1, default);
select * from t1;
a	b
1	2
insert into t1(a) values(1);
ERROR 23000: Duplicate entry '1' for key 'PRIMARY'
select * from t1;
a	b
1	2
insert into t1 values();
ERROR HY000: Field 'a' doesn't have a default value
select * from t1;
a	b
1	2
insert into t1 values(1, default) on duplicate key update a=3;
select * from t1;
a	b
3	4
insert into t1 values(1, default) on duplicate key update b=default;
select * from t1;
a	b
1	2
3	4
insert into t1 values(1, default) on duplicate key update b=2;
ERROR HY000: The value specified for generated column 'b' in table 't1' is not allowed
select * from t1;
a	b
1	2
3	4
alter table t1 modify b int;
ERROR 0A000: Changing the STORED status for generated columns not supported
alter table t1 change b c int;
ERROR 0A000: Changing the STORED status for generated columns not supported
drop table t1;
create table t1(a int primary key, b int);
alter table t1 modify b int as (a+1);
ERROR 0A000: Changing the STORED status for generated columns not supported
drop table t1;
create table t1(a int primary key, b int as (a+1));
alter table t1 modify b int;
ERROR 0A000: Changing the STORED status for generated columns not supported
alter table t1 change b c int;
ERROR 0A000: Changing the STORED status for generated columns not supported
alter table t1 alter column b set default 1;
ERROR 0A000: Changing the STORED status for generated columns not supported
drop table t1;
create table t1(a int primary key, b int as (a+1));
alter table t1 modify b int as (a+2);
ERROR 0A000: Modify generated column definition not supported
drop table t1;
create table t(pk int primary key, a int);
insert into t values(1,1);
alter table t add column b int as(a+1);
select * from t;
pk	a	b
1	1	2
create index idx on t(b);
explain basic select /*+index(t primary)*/* from t;
Query Plan
====================
|ID|OPERATOR  |NAME|
--------------------
|0 |TABLE SCAN|t   |
====================

Outputs & filters: 
-------------------------------------
  0 - output([t.pk], [t.a], [t.b]), filter(nil), 
      access([t.pk], [t.a], [t.b]), partitions(p0)

select /*+index(t primary)*/* from t;
pk	a	b
1	1	2
explain basic select /*+index(t idx)*/* from t;
Query Plan
======================
|ID|OPERATOR  |NAME  |
----------------------
|0 |TABLE SCAN|t(idx)|
======================

Outputs & filters: 
-------------------------------------
  0 - output([t.pk], [t.a], [t.b]), filter(nil), 
      access([t.pk], [t.a], [t.b]), partitions(p0)

select /*+index(t idx)*/* from t;
pk	a	b
1	1	2
drop table t;
create table t(a int, b int, c int as (a+b));
insert into t values();
drop table t;
set sql_mode=PAD_CHAR_TO_FULL_LENGTH;
create table t(pk int primary key, a char(5));
insert into t values(1,'a');
alter table t add column b char(10) as(concat(a, '1'));
select * from t;
pk	a	b
1	a    	a    1    
alter system major freeze tenant = sys;
alter system major freeze tenant = all_user;
alter system major freeze tenant = all_meta;
select * from t;
pk	a	b
1	a    	a    1    
drop table t;
set sql_mode=PAD_CHAR_TO_FULL_LENGTH;
create table t(pk int primary key, a char(5));
insert into t values(1,'a');
alter table t add column b char(10) as(concat(a, '1')) stored;
select * from t;
pk	a	b
1	a    	a    1    
alter system major freeze tenant = sys;
alter system major freeze tenant = all_user;
alter system major freeze tenant = all_meta;
select * from t;
pk	a	b
1	a    	a    1    
drop table t;
create table t(a int,b varchar(100),c varchar(100)) progressive_merge_num=2;
insert into t values (1,'aaaaaaaaaaaaaaaaaaaaaaaaaaaaaaaaaaaaaaaaaaaaaaaaaaaaaaaaaaaaaaaaaaaaaaaaaaaaaaaaaaaaa','bbbbbbbbbbbbbbbbbbbbbbbbbbbbbbbbbbbbbbbbbbbbbbbbbbbbbbbbbbbb');
insert into t select * from t;
alter system major freeze tenant = sys;
alter system major freeze tenant = all_user;
alter system major freeze tenant = all_meta;
alter table t add column gen int as(a+1) stored;
create index idx on t(gen);
show index from t;
Table	Non_unique	Key_name	Seq_in_index	Column_name	Collation	Cardinality	Sub_part	Packed	Null	Index_type	Comment	Index_comment	Visible
t	1	idx	1	gen	A	NULL	NULL	NULL	YES	BTREE	available		YES
explain basic select /*+index(t primary)*/* from t;
Query Plan
====================
|ID|OPERATOR  |NAME|
--------------------
|0 |TABLE SCAN|t   |
====================

Outputs & filters: 
-------------------------------------
  0 - output([t.a], [t.b], [t.c], [t.gen]), filter(nil), 
      access([t.a], [t.b], [t.c], [t.gen]), partitions(p0)

select /*+index(t primary)*/* from t;
a	b	c	gen
1	aaaaaaaaaaaaaaaaaaaaaaaaaaaaaaaaaaaaaaaaaaaaaaaaaaaaaaaaaaaaaaaaaaaaaaaaaaaaaaaaaaaaa	bbbbbbbbbbbbbbbbbbbbbbbbbbbbbbbbbbbbbbbbbbbbbbbbbbbbbbbbbbbb	2
1	aaaaaaaaaaaaaaaaaaaaaaaaaaaaaaaaaaaaaaaaaaaaaaaaaaaaaaaaaaaaaaaaaaaaaaaaaaaaaaaaaaaaa	bbbbbbbbbbbbbbbbbbbbbbbbbbbbbbbbbbbbbbbbbbbbbbbbbbbbbbbbbbbb	2
explain basic select /*+index(t idx)*/* from t;
Query Plan
======================
|ID|OPERATOR  |NAME  |
----------------------
|0 |TABLE SCAN|t(idx)|
======================

Outputs & filters: 
-------------------------------------
  0 - output([t.a], [t.b], [t.c], [t.gen]), filter(nil), 
      access([t.a], [t.b], [t.c], [t.gen]), partitions(p0)

select /*+index(t idx)*/* from t;
a	b	c	gen
1	aaaaaaaaaaaaaaaaaaaaaaaaaaaaaaaaaaaaaaaaaaaaaaaaaaaaaaaaaaaaaaaaaaaaaaaaaaaaaaaaaaaaa	bbbbbbbbbbbbbbbbbbbbbbbbbbbbbbbbbbbbbbbbbbbbbbbbbbbbbbbbbbbb	2
1	aaaaaaaaaaaaaaaaaaaaaaaaaaaaaaaaaaaaaaaaaaaaaaaaaaaaaaaaaaaaaaaaaaaaaaaaaaaaaaaaaaaaa	bbbbbbbbbbbbbbbbbbbbbbbbbbbbbbbbbbbbbbbbbbbbbbbbbbbbbbbbbbbb	2
drop table t;
create table t(pk int primary key, a int);
insert into t values(1,1);
alter system major freeze tenant = sys;
alter system major freeze tenant = all_user;
alter system major freeze tenant = all_meta;
alter table t add column gen int as(a+1) stored;
create index idx on t(gen);
show index from t;
Table	Non_unique	Key_name	Seq_in_index	Column_name	Collation	Cardinality	Sub_part	Packed	Null	Index_type	Comment	Index_comment	Visible
t	0	PRIMARY	1	pk	A	NULL	NULL	NULL		BTREE	available		YES
t	1	idx	1	gen	A	NULL	NULL	NULL	YES	BTREE	available		YES
explain basic select /*+index(t primary)*/* from t;
Query Plan
====================
|ID|OPERATOR  |NAME|
--------------------
|0 |TABLE SCAN|t   |
====================

Outputs & filters: 
-------------------------------------
  0 - output([t.pk], [t.a], [t.gen]), filter(nil), 
      access([t.pk], [t.a], [t.gen]), partitions(p0)

select /*+index(t primary)*/* from t;
pk	a	gen
1	1	2
explain basic select /*+index(t idx)*/* from t;
Query Plan
======================
|ID|OPERATOR  |NAME  |
----------------------
|0 |TABLE SCAN|t(idx)|
======================

Outputs & filters: 
-------------------------------------
  0 - output([t.pk], [t.a], [t.gen]), filter(nil), 
      access([t.pk], [t.a], [t.gen]), partitions(p0)

select /*+index(t idx)*/* from t;
pk	a	gen
1	1	2
drop table t;
create table t(a int as (1+1));
insert into t values(default);
select * from t;
a
2
drop table t;
create table t(a int, b int as (a+1));
insert into t values(1, default);
select * from t;
a	b
1	2
drop table t;
create table t(a int, b int);
insert into t values(1, a+1);
select * from t;
a	b
1	2
drop table t;
create table t(a int, b varchar(25) default null, c datetime, v_c1 varchar(20) generated always as (substr(b, 3)), v_c2 varchar(20) generated always as (substr(v_c1, 3))  virtual, primary key(a,b,c));
ERROR HY000: 'Defining a generated column on generated column(s)' is not supported for generated columns.
create table t(a int, b varchar(25), c datetime, d varchar(100) default null, v_column varchar(20) generated always as (substr(b, 3)) virtual, primary key(a,b,c)) partition by key(v_column) subpartition by range columns(c) subpartition template (
subpartition p20170101 values less than('2017-01-01 00:00:00'),
subpartition p20170701 values less than('2017-07-01 00:00:00'),
subpartition p20180101 values less than('2018-01-01 00:00:00')) partitions 3;
insert into t(a,b,c) values(1, 'asdfadsfasdfdsa', '2016-09-28 00:00:00');
select * from t;
a	b	c	d	v_column
1	asdfadsfasdfdsa	2016-09-28 00:00:00	NULL	dfadsfasdfdsa
select * from t where b like 'asdasdfadfasdfdasf';
a	b	c	d	v_column
alter system major freeze tenant = sys;
alter system major freeze tenant = all_user;
alter system major freeze tenant = all_meta;
insert into t(a,b,c) values(2, 'asdfadsfasddsa', '2018-09-28 00:00:00');
ERROR HY000: Table has no partition for value
insert into t(a,b,c) values(3, 'asdfadsfasdsa', '2017-02-28 00:00:00');
insert into t(a,b,c) values(4, 'asdfadsfasda', '2017-04-28 00:00:00');
insert into t(a,b,c) values(5, 'asdfadsfasd', '2017-09-28 00:00:00');
update t set d='2017-09-28 00:08:00' where a=5 and b='a' and c='2018-09-28';
replace /*+USE_PLAN_CACHE(NONE)*/ into t(b,c) values('dddddddddd','2017-09-28 00:00:00');
Warnings:
Warning	1364	Field 'a' doesn't have a default value
insert into t(a,b,c) values(5, 'bbbbbbbbbb','2017-02-28 00:00:00') on duplicate key update d='ssssssss';
delete from t where a=5 and b='a' and c='2018-09-28';
alter system major freeze tenant = sys;
alter system major freeze tenant = all_user;
alter system major freeze tenant = all_meta;
replace /*+USE_PLAN_CACHE(NONE)*/ into t(b,c) values('dddddddddd','2017-09-28 00:00:00');
Warnings:
Warning	1364	Field 'a' doesn't have a default value
alter system major freeze tenant = sys;
alter system major freeze tenant = all_user;
alter system major freeze tenant = all_meta;
insert into t(a,b,c) values(5, 'bbbbbbbbbb','2017-02-28 00:00:00') on duplicate key update d=default;
alter system major freeze tenant = sys;
alter system major freeze tenant = all_user;
alter system major freeze tenant = all_meta;
create index idx on t(v_column, a) local;
explain basic select * from t where substr(b,3) ='abcde';
Query Plan
=====================================
|ID|OPERATOR               |NAME    |
-------------------------------------
|0 |PX COORDINATOR         |        |
|1 | EXCHANGE OUT DISTR    |:EX10000|
|2 |  PX PARTITION ITERATOR|        |
|3 |   TABLE SCAN          |t       |
=====================================

Outputs & filters: 
-------------------------------------
  0 - output([INTERNAL_FUNCTION(t.a, t.b, t.c, t.d, t.v_column)]), filter(nil)
  1 - output([INTERNAL_FUNCTION(t.a, t.b, t.c, t.d, t.v_column)]), filter(nil), dop=1
  2 - output([t.a], [t.b], [t.c], [t.v_column], [t.d]), filter(nil)
  3 - output([t.a], [t.b], [t.c], [t.v_column], [t.d]), filter([substr(t.b, 3) = 'abcde']), 
      access([t.a], [t.b], [t.c], [t.v_column], [t.d]), partitions(p0sp[0-2], p1sp[0-2], p2sp[0-2])

select * from t where substr(b,3) ='abcde';
a	b	c	d	v_column
alter system major freeze tenant = sys;
alter system major freeze tenant = all_user;
alter system major freeze tenant = all_meta;
explain basic select * from t where substr(b,3) ='abcde';
Query Plan
=====================================
|ID|OPERATOR               |NAME    |
-------------------------------------
|0 |PX COORDINATOR         |        |
|1 | EXCHANGE OUT DISTR    |:EX10000|
|2 |  PX PARTITION ITERATOR|        |
|3 |   TABLE SCAN          |t       |
=====================================

Outputs & filters: 
-------------------------------------
  0 - output([INTERNAL_FUNCTION(t.a, t.b, t.c, t.d, t.v_column)]), filter(nil)
  1 - output([INTERNAL_FUNCTION(t.a, t.b, t.c, t.d, t.v_column)]), filter(nil), dop=1
  2 - output([t.a], [t.b], [t.c], [t.v_column], [t.d]), filter(nil)
  3 - output([t.a], [t.b], [t.c], [t.v_column], [t.d]), filter([substr(t.b, 3) = 'abcde']), 
      access([t.a], [t.b], [t.c], [t.v_column], [t.d]), partitions(p0sp[0-2], p1sp[0-2], p2sp[0-2])

select * from t where substr(b,3) ='abcde';
a	b	c	d	v_column
drop index idx on t;
alter table t drop column v_column;
ERROR 0A000: Not supported feature or function
create table tmp(a int, b varchar(25) default null, c datetime, d varchar(100) default null);
insert into tmp values(1,1,1,1),(2,2,2,2),(3,3,3,3),(4,4,4,4),(5,5,5,5);
insert into t(a,b,c,d) select * from tmp;
insert into t(a,b,c,d) values(1,1,1,1),(2,2,2,2),(3,3,3,3),(4,4,4,4),(5,5,5,5);
ERROR 23000: Duplicate entry '1-1-0000-00-00 00:00:00.000000' for key 'PRIMARY'
drop table tmp;
alter system major freeze tenant = sys;
alter system major freeze tenant = all_user;
alter system major freeze tenant = all_meta;
alter table t add column v_column0 varchar(25) generated always as (substr(b, 3)) virtual;
alter system major freeze tenant = sys;
alter system major freeze tenant = all_user;
alter system major freeze tenant = all_meta;
alter table t add column v_column1 varchar(25) generated always as (substr(v_column0, 2)) virtual;
ERROR HY000: 'Defining a generated column on generated column(s)' is not supported for generated columns.
alter system major freeze tenant = sys;
alter system major freeze tenant = all_user;
alter system major freeze tenant = all_meta;
alter table t drop column v_column1;
ERROR 42000: Can't DROP 'v_column1'; check that column/key exists
alter table t add column v_column1 varchar(25) generated always as (substr(b, 10)) stored;
alter system major freeze tenant = sys;
alter system major freeze tenant = all_user;
alter system major freeze tenant = all_meta;
select * from t where substr(v_column1, 9)=9;
a	b	c	d	v_column	v_column0	v_column1
select * from t where substr(v_column1, 10)=9;
a	b	c	d	v_column	v_column0	v_column1
select * from t where substr(v_column1, 11)=9;
a	b	c	d	v_column	v_column0	v_column1
select * from t where substr(v_column1, 12)=9;
a	b	c	d	v_column	v_column0	v_column1
alter system major freeze tenant = sys;
alter system major freeze tenant = all_user;
alter system major freeze tenant = all_meta;
select * from t where substr(v_column1, 9)=9;
a	b	c	d	v_column	v_column0	v_column1
select * from t where substr(v_column1, 10)=9;
a	b	c	d	v_column	v_column0	v_column1
select * from t where substr(v_column1, 11)=9;
a	b	c	d	v_column	v_column0	v_column1
select * from t where substr(v_column1, 12)=9;
a	b	c	d	v_column	v_column0	v_column1
drop table t;
create table t(a int, b int as(a+1));
alter table t add column c int as(b+1);
ERROR HY000: 'Defining a generated column on generated column(s)' is not supported for generated columns.
drop table t;
create table t(a int, b int as(a+1), c int as(b+1));
ERROR HY000: 'Defining a generated column on generated column(s)' is not supported for generated columns.
create table t(a int primary key, c int, b varchar(10) as (a+1));
insert into t(a) values(1);
alter system major freeze tenant = sys;
alter system major freeze tenant = all_user;
alter system major freeze tenant = all_meta;
create index i1 on t(c) storing(b);
insert into t(a) values(2);
show index from t;
Table	Non_unique	Key_name	Seq_in_index	Column_name	Collation	Cardinality	Sub_part	Packed	Null	Index_type	Comment	Index_comment	Visible
t	0	PRIMARY	1	a	A	NULL	NULL	NULL		BTREE	available		YES
t	1	i1	1	c	A	NULL	NULL	NULL	YES	BTREE	available		YES
explain basic select * from t where c>1 and b=3;
Query Plan
=====================
|ID|OPERATOR  |NAME |
---------------------
|0 |TABLE SCAN|t(i1)|
=====================

Outputs & filters: 
-------------------------------------
  0 - output([t.a], [t.c], [t.b]), filter([cast(t.b, DECIMAL(-1, -1)) = ?]), 
      access([t.a], [t.c], [t.b]), partitions(p0)

select * from t where c>1 and b=3;
a	c	b
drop table t;
create table xf(c1 int primary key, c2 varchar(10), c3 as (case when c2 = 'T' then c1 end));
ERROR 42000: You have an error in your SQL syntax; check the manual that corresponds to your OceanBase version for the right syntax to use near 'as (case when c2 = 'T' then c1 end))' at line 1
create table xf(c1 int primary key, c2 varchar(10), c3 int as (case when c2 = 'T' then c1 end));
show create table xf;
Table	Create Table
xf	CREATE TABLE `xf` (
  `c1` int(11) NOT NULL,
  `c2` varchar(10) DEFAULT NULL,
  `c3` int(11) GENERATED ALWAYS AS ((case when (`c2` = 'T') then `c1` else NULL end)) VIRTUAL,
  PRIMARY KEY (`c1`)
) DEFAULT CHARSET = utf8mb4 COMPRESSION = 'lz4_1.0' REPLICA_NUM = NUM BLOCK_SIZE = SIZE USE_BLOOM_FILTER = FALSE TABLET_SIZE = SIZE PCTFREE = 10
drop table xf;
create table xf2(c1 int, c2 varchar(25), c3 varchar(20) generated always as (substr(c2, 3)));
show create table xf2;
Table	Create Table
xf2	CREATE TABLE `xf2` (
  `c1` int(11) DEFAULT NULL,
  `c2` varchar(25) DEFAULT NULL,
  `c3` varchar(20) GENERATED ALWAYS AS (substr(`c2`,3)) VIRTUAL
) DEFAULT CHARSET = utf8mb4 COMPRESSION = 'lz4_1.0' REPLICA_NUM = NUM BLOCK_SIZE = SIZE USE_BLOOM_FILTER = FALSE TABLET_SIZE = SIZE PCTFREE = 10
alter table xf2 add c4 generated always as (substr(c2, 3));
ERROR 42000: You have an error in your SQL syntax; check the manual that corresponds to your OceanBase version for the right syntax to use near 'generated always as (substr(c2, 3))' at line 1
alter table xf2 add c4 varchar(25) generated always as (substr(c2, 3));
show create table xf2;
Table	Create Table
xf2	CREATE TABLE `xf2` (
  `c1` int(11) DEFAULT NULL,
  `c2` varchar(25) DEFAULT NULL,
  `c3` varchar(20) GENERATED ALWAYS AS (substr(`c2`,3)) VIRTUAL,
  `c4` varchar(25) GENERATED ALWAYS AS (substr(`c2`,3)) VIRTUAL
) DEFAULT CHARSET = utf8mb4 COMPRESSION = 'lz4_1.0' REPLICA_NUM = NUM BLOCK_SIZE = SIZE USE_BLOOM_FILTER = FALSE TABLET_SIZE = SIZE PCTFREE = 10
drop table xf2;
create table xf3(c1 int primary key, c2 varchar(10), c3 char as (case when c2 = 'T' then c1 end));
insert into xf3 (c1, c2) values (1, "T");
select * from xf3;
c1	c2	c3
1	T	1
insert into xf3 (c1, c2) values (2, "TT");
select * from xf3;
c1	c2	c3
1	T	1
2	TT	NULL
drop table xf3;
create table xf4(c1 char primary key, c2 varchar(10), c3 int as (case when c2 = 'T' then c1 end));
insert into xf4 (c1, c2) values ('1', "T");
set sql_mode=STRICT_TRANS_TABLES;
insert into xf4 (c1, c2) values ('a', "T");
ERROR HY000: Incorrect integer value
set sql_mode='';
insert into xf4 (c1, c2) values ('a', "T");
select * from xf4;
c1	c2	c3
1	T	1
a	T	0
drop table xf4;
create table xf5(c1 smallint primary key, c2 varchar(10), c3 bigint as (case when c2 = 'T' then c1 end));
insert into xf5 (c1, c2) values (1, "T");
select * from xf5;
c1	c2	c3
1	T	1
drop table xf5;
create table xf6(c1 bigint primary key, c2 varchar(10), c3 smallint as (case when c2 = 'T' then c1 end));
insert into xf6 (c1, c2) values (1, "T");
set sql_mode=STRICT_TRANS_TABLES;
insert into xf6 (c1, c2) values (2147483647, "T");
ERROR 22003: Out of range value for column 'c3' at row 1
set sql_mode='';
insert into xf6 (c1, c2) values (2147483647, "T");
select * from xf6;
c1	c2	c3
1	T	1
2147483647	T	32767
drop table xf6;
