merge happens
drop table if exists tbl1,tbl2;
create table tbl1 (i1 int, v2 varchar(80), i3 char(20),i4 float, d4 datetime(6),i5 decimal(5,3), primary key(i3));
create  unique index idx1 on tbl1(i1);
create  unique index idx2 on tbl1(v2);
create  unique index idx3 on tbl1(i3);
create  unique index idx5 on tbl1(d4);
insert into tbl1 values(1,'now','haha1',1.6256,'2014-05-04 12:00:00',-10.235);
insert into tbl1 values(2,'now','haha1',2.6256,'2014-05-04 12:00:00',-10.235);
ERROR 23000: Duplicate entry 'haha1' for key 'PRIMARY'
alter table  tbl1  alter  column v2 set  default 'aaa';
alter table  tbl1  alter  column v1 set  null;
ERROR 42000: You have an error in your SQL syntax; check the manual that corresponds to your OceanBase version for the right syntax to use near 'null' at line 1
alter table  tbl1  alter  column i4 set  not null;
ERROR 42000: You have an error in your SQL syntax; check the manual that corresponds to your OceanBase version for the right syntax to use near 'not null' at line 1
show create table tbl1;
Table	Create Table
tbl1	CREATE TABLE `tbl1` (
  `i1` int(11) DEFAULT NULL,
  `v2` varchar(80) DEFAULT 'aaa',
  `i3` char(20) NOT NULL,
  `i4` float DEFAULT NULL,
  `d4` datetime(6) DEFAULT NULL,
  `i5` decimal(5,3) DEFAULT NULL,
  PRIMARY KEY (`i3`),
  UNIQUE KEY `idx1` (`i1`) BLOCK_SIZE 16384 LOCAL,
  UNIQUE KEY `idx2` (`v2`) BLOCK_SIZE 16384 LOCAL,
  UNIQUE KEY `idx3` (`i3`) BLOCK_SIZE 16384 LOCAL,
  UNIQUE KEY `idx5` (`d4`) BLOCK_SIZE 16384 LOCAL
) ORGANIZATION INDEX DEFAULT CHARSET = utf8mb4 COMPRESSION = 'lz4_1.0' REPLICA_NUM = NUM BLOCK_SIZE = SIZE USE_BLOOM_FILTER = FALSE ENABLE_MACRO_BLOCK_BLOOM_FILTER = FALSE TABLET_SIZE = SIZE PCTFREE = 10
drop index  idx1 on tbl1;
drop index  idx2 on tbl1;
drop index  idx3 on tbl1;
drop index  idx5 on tbl1;
create  unique index idx1 on tbl1(i1,i3);
create  unique index idx2 on tbl1(v2,i3);
create  unique index idx3 on tbl1(i3);
create  unique index idx5 on tbl1(d4,i3);
select * from tbl1;
i1	v2	i3	i4	d4	i5
1	now	haha1	1.6256	2014-05-04 12:00:00.000000	-10.235
delete from tbl1;
select * from tbl1;
i1	v2	i3	i4	d4	i5
insert into tbl1 values(1,'now','haha1',1.6256,'2014-05-04 12:00:00',-10.235);
insert into tbl1 values(2,'now','haha1',2.6256,'2014-05-04 12:00:00',-10.235);
ERROR 23000: Duplicate entry 'haha1' for key 'PRIMARY'
drop index  idx1 on tbl1;
drop index  idx2 on tbl1;
drop index  idx3 on tbl1;
drop index  idx5 on tbl1;
create   index idx1 on tbl1(i1,i3);
create   index idx2 on tbl1(v2,i3);
create   index idx3 on tbl1(i3);
create   index idx4 on tbl1(i3);
create   index idx5 on tbl1(d4,i3);
create   index idx6 on tbl1(i3);
delete from tbl1;
insert into tbl1 values(1,'now','haha1',1.6256,'2014-05-04 12:00:00',-10.235);
insert into tbl1 values(1,'now','haha2',2.6256,'2014-05-04 12:00:00',-10.235);
select * from tbl1;
i1	v2	i3	i4	d4	i5
1	now	haha1	1.6256	2014-05-04 12:00:00.000000	-10.235
1	now	haha2	2.6256	2014-05-04 12:00:00.000000	-10.235
