create table t1(pk int primary key, a int, b int, c varchar(1024));
create index i1 on t1(b) storing(c);
insert into t1 values(1,1,1,'a'),(2,1,1,'a');
replace into t1 values(3,1,1,'a'),(4,1,1,'a');
CASE1
set autocommit=0;
delete from t1 where pk=1;
delete from t1 where pk=2;
set autocommit=0;
delete from t1 where pk=3;
delete from t1 where pk=4;
select pk, b, c from t1 where b>0 and b<10;
pk	b	c
1	1	a
2	1	a
select pk, a, b from t1 where pk>0 and pk<10;
pk	a	b
1	1	1
2	1	1
select * from t1 where b>0 and b<10;
pk	a	b	c
1	1	1	a
2	1	1	a
select pk, b, c from t1 where b>0 and b<10;
pk	b	c
3	1	a
4	1	a
select pk, a, b from t1 where pk>0 and pk<10;
pk	a	b
3	1	1
4	1	1
select * from t1 where b>0 and b<10;
pk	a	b	c
3	1	1	a
4	1	1	a
commit;
select pk, b, c from t1 where b>0 and b<10;
pk	b	c
3	1	a
4	1	a
select pk, a, b from t1 where pk>0 and pk<10;
pk	a	b
3	1	1
4	1	1
select * from t1 where b>0 and b<10;
pk	a	b	c
3	1	1	a
4	1	1	a
commit;
select pk, b, c from t1 where b>0 and b<10;
pk	b	c
select pk, a, b from t1 where pk>0 and pk<10;
pk	a	b
select * from t1 where b>0 and b<10;
pk	a	b	c
commit;
select pk, b, c from t1 where b>0 and b<10;
pk	b	c
select pk, a, b from t1 where pk>0 and pk<10;
pk	a	b
select * from t1 where b>0 and b<10;
pk	a	b	c
commit;
CASE2
set autocommit=0;
replace into t1 values(1,1,1,'a'),(2,1,1,'a');
commit;
delete from t1 where pk=1;
set autocommit=0;
delete from t1 where pk=2;
delete from t1 where pk=1;
Got one of the listed errors
update t1 set b=4 where pk=1;
Got one of the listed errors
insert into t1 values(1,2,2,'b');
Got one of the listed errors
replace into t1 values(1,3,3,'c');
Got one of the listed errors
select pk, b, c from t1 where b>0 and b<10;
pk	b	c
1	1	a
select pk, a, b from t1 where pk>0 and pk<10;
pk	a	b
1	1	1
select * from t1 where b>0 and b<10;
pk	a	b	c
1	1	1	a
select pk, b, c from t1 where b>0 and b<10;
pk	b	c
2	1	a
select pk, a, b from t1 where pk>0 and pk<10;
pk	a	b
2	1	1
select * from t1 where b>0 and b<10;
pk	a	b	c
2	1	1	a
commit;
select pk, b, c from t1 where b>0 and b<10;
pk	b	c
2	1	a
select pk, a, b from t1 where pk>0 and pk<10;
pk	a	b
2	1	1
select * from t1 where b>0 and b<10;
pk	a	b	c
2	1	1	a
commit;
select pk, b, c from t1 where b>0 and b<10;
pk	b	c
select pk, a, b from t1 where pk>0 and pk<10;
pk	a	b
select * from t1 where b>0 and b<10;
pk	a	b	c
commit;
select pk, b, c from t1 where b>0 and b<10;
pk	b	c
select pk, a, b from t1 where pk>0 and pk<10;
pk	a	b
select * from t1 where b>0 and b<10;
pk	a	b	c
commit;
CASE3
set autocommit=0;
replace into t1 values(1,1,1,'a'),(2,1,1,'a'),(3,1,1,'a');
commit;
delete from t1 where pk=1;
set autocommit=0;
delete from t1 where pk=2;
update t1 set a=a+1, b=b+1, c='b' where pk=3;
replace into t1 values(3,3,3,'c');
insert into t1 values(4,1,1,'a');
select pk, b, c from t1 where b>0 and b<10;
pk	b	c
1	1	a
4	1	a
3	3	c
select pk, a, b from t1 where pk>0 and pk<10;
pk	a	b
1	1	1
3	3	3
4	1	1
select * from t1 where b>0 and b<10;
pk	a	b	c
1	1	1	a
4	1	1	a
3	3	3	c
select pk, b, c from t1 where b>0 and b<10;
pk	b	c
2	1	a
3	1	a
select pk, a, b from t1 where pk>0 and pk<10;
pk	a	b
2	1	1
3	1	1
select * from t1 where b>0 and b<10;
pk	a	b	c
2	1	1	a
3	1	1	a
commit;
select pk, b, c from t1 where b>0 and b<10;
pk	b	c
2	1	a
3	1	a
select pk, a, b from t1 where pk>0 and pk<10;
pk	a	b
2	1	1
3	1	1
select * from t1 where b>0 and b<10;
pk	a	b	c
2	1	1	a
3	1	1	a
commit;
select pk, b, c from t1 where b>0 and b<10;
pk	b	c
4	1	a
3	3	c
select pk, a, b from t1 where pk>0 and pk<10;
pk	a	b
3	3	3
4	1	1
select * from t1 where b>0 and b<10;
pk	a	b	c
4	1	1	a
3	3	3	c
commit;
select pk, b, c from t1 where b>0 and b<10;
pk	b	c
4	1	a
3	3	c
select pk, a, b from t1 where pk>0 and pk<10;
pk	a	b
3	3	3
4	1	1
select * from t1 where b>0 and b<10;
pk	a	b	c
4	1	1	a
3	3	3	c
commit;
CASE4
set autocommit=0;
replace into t1 values(5,1,1,'a'),(6,1,1,'a');
commit;
delete from t1 where pk=5;
set autocommit=0;
delete from t1 where pk=6;
select pk, b, c from t1 where b>0 and b<10;
pk	b	c
4	1	a
5	1	a
3	3	c
select pk, a, b from t1 where pk>0 and pk<10;
pk	a	b
3	3	3
4	1	1
5	1	1
select * from t1 where b>0 and b<10;
pk	a	b	c
4	1	1	a
5	1	1	a
3	3	3	c
select pk, b, c from t1 where b>0 and b<10;
pk	b	c
4	1	a
6	1	a
3	3	c
select pk, a, b from t1 where pk>0 and pk<10;
pk	a	b
3	3	3
4	1	1
6	1	1
select * from t1 where b>0 and b<10;
pk	a	b	c
4	1	1	a
6	1	1	a
3	3	3	c
commit;
select pk, b, c from t1 where b>0 and b<10;
pk	b	c
4	1	a
6	1	a
3	3	c
select pk, a, b from t1 where pk>0 and pk<10;
pk	a	b
3	3	3
4	1	1
6	1	1
select * from t1 where b>0 and b<10;
pk	a	b	c
4	1	1	a
6	1	1	a
3	3	3	c
select pk, b, c from t1 where b>0 and b<10;
pk	b	c
4	1	a
3	3	c
select pk, a, b from t1 where pk>0 and pk<10;
pk	a	b
3	3	3
4	1	1
select * from t1 where b>0 and b<10;
pk	a	b	c
4	1	1	a
3	3	3	c
rollback;
select pk, b, c from t1 where b>0 and b<10;
pk	b	c
4	1	a
6	1	a
3	3	c
select pk, a, b from t1 where pk>0 and pk<10;
pk	a	b
3	3	3
4	1	1
6	1	1
select * from t1 where b>0 and b<10;
pk	a	b	c
4	1	1	a
6	1	1	a
3	3	3	c
drop table t1;
