set global ob_trx_timeout = 500000000;
drop table if exists t1;
create table t1(pk1 int, c1 int, c2 int, c3 int, primary key(pk1));
insert into t1(pk1,c1,c2,c3) values(1,1,1,1);
insert into t1(pk1,c1,c2,c3) values(2,2,2,1);
insert into t1(pk1,c1,c2,c3) values(3,3,3,1);
insert into t1(pk1,c1,c2,c3) values(4,4,4,1);
insert into t1(pk1,c1,c2,c3) values(5,5,5,1);
insert into t1(pk1,c1,c2,c3) values(6,6,6,1);
insert into t1(pk1,c1,c2,c3) values(7,7,7,1);
insert into t1(pk1,c1,c2,c3) values(8,8,8,1);
create index i1 on t1(c1,c2) storing(c3);
select * from t1;
pk1	c1	c2	c3
1	1	1	1
2	2	2	1
3	3	3	1
4	4	4	1
5	5	5	1
6	6	6	1
7	7	7	1
8	8	8	1
pk1	c1	c2	c3
1	1	1	1
2	2	2	1
3	3	3	1
4	4	4	1
5	5	5	1
6	6	6	1
7	7	7	1
8	8	8	1
set autocommit=0;
set autocommit=0;
update t1 set c3=c3+1 where (c1,c2) in ((1,1),(2,2));
update t1 set c3=c3+1 where c1 in (3,4) and c2 in (3,4);
select * from t1;
pk1	c1	c2	c3
1	1	1	2
2	2	2	2
3	3	3	2
4	4	4	2
5	5	5	1
6	6	6	1
7	7	7	1
8	8	8	1
pk1	c1	c2	c3
1	1	1	2
2	2	2	2
3	3	3	2
4	4	4	2
5	5	5	1
6	6	6	1
7	7	7	1
8	8	8	1
delete from t1 where (c1,c2) in ((5,5),(6,6));
delete from t1 where c1 in (7,8) and c2 in (7,8);
select * from t1;
pk1	c1	c2	c3
1	1	1	2
2	2	2	2
3	3	3	2
4	4	4	2
pk1	c1	c2	c3
1	1	1	2
2	2	2	2
3	3	3	2
4	4	4	2
select * from t1;
pk1	c1	c2	c3
1	1	1	1
2	2	2	1
3	3	3	1
4	4	4	1
5	5	5	1
6	6	6	1
7	7	7	1
8	8	8	1
pk1	c1	c2	c3
1	1	1	1
2	2	2	1
3	3	3	1
4	4	4	1
5	5	5	1
6	6	6	1
7	7	7	1
8	8	8	1
commit;
select * from t1;
pk1	c1	c2	c3
1	1	1	2
2	2	2	2
3	3	3	2
4	4	4	2
pk1	c1	c2	c3
1	1	1	2
2	2	2	2
3	3	3	2
4	4	4	2
commit;
select * from t1;
pk1	c1	c2	c3
1	1	1	2
2	2	2	2
3	3	3	2
4	4	4	2
pk1	c1	c2	c3
1	1	1	2
2	2	2	2
3	3	3	2
4	4	4	2
commit;
delete from t1;
replace into t1(pk1,c1,c2,c3) values (1,1,1,1),(2,2,2,1),(3,3,3,1),(4,4,4,1),(5,5,5,1),(6,6,6,1),(7,7,7,1),(8,8,8,1);
select * from t1;
pk1	c1	c2	c3
1	1	1	1
2	2	2	1
3	3	3	1
4	4	4	1
5	5	5	1
6	6	6	1
7	7	7	1
8	8	8	1
pk1	c1	c2	c3
1	1	1	1
2	2	2	1
3	3	3	1
4	4	4	1
5	5	5	1
6	6	6	1
7	7	7	1
8	8	8	1
update t1 set c3=c3+1 where (c1,c2) in ((1,1),(2,2));
update t1 set c3=c3+1 where c1 in (3,4) and c2 in (3,4);
select * from t1;
pk1	c1	c2	c3
1	1	1	2
2	2	2	2
3	3	3	2
4	4	4	2
5	5	5	1
6	6	6	1
7	7	7	1
8	8	8	1
pk1	c1	c2	c3
1	1	1	2
2	2	2	2
3	3	3	2
4	4	4	2
5	5	5	1
6	6	6	1
7	7	7	1
8	8	8	1
delete from t1 where (c1,c2) in ((5,5),(6,6));
delete from t1 where c1 in (7,8) and c2 in (7,8);
select * from t1;
pk1	c1	c2	c3
1	1	1	1
2	2	2	1
3	3	3	1
4	4	4	1
pk1	c1	c2	c3
1	1	1	1
2	2	2	1
3	3	3	1
4	4	4	1
commit;
select * from t1;
pk1	c1	c2	c3
1	1	1	1
2	2	2	1
3	3	3	1
4	4	4	1
pk1	c1	c2	c3
1	1	1	1
2	2	2	1
3	3	3	1
4	4	4	1
commit;
select * from t1;
pk1	c1	c2	c3
1	1	1	2
2	2	2	2
3	3	3	2
4	4	4	2
pk1	c1	c2	c3
1	1	1	2
2	2	2	2
3	3	3	2
4	4	4	2
commit;
delete from t1;
replace into t1(pk1,c1,c2,c3) values (1,1,1,1),(2,2,2,1),(3,3,3,1),(4,4,4,1),(5,5,5,1),(6,6,6,1),(7,7,7,1),(8,8,8,1);
select * from t1;
pk1	c1	c2	c3
1	1	1	1
2	2	2	1
3	3	3	1
4	4	4	1
5	5	5	1
6	6	6	1
7	7	7	1
8	8	8	1
pk1	c1	c2	c3
1	1	1	1
2	2	2	1
3	3	3	1
4	4	4	1
5	5	5	1
6	6	6	1
7	7	7	1
8	8	8	1
delete from t1 where (c1,c2) in ((5,5),(6,6));
delete from t1 where c1 in (7,8) and c2 in (7,8);
update t1 set c3=c3+1 where (c1,c2) in ((1,1),(2,2));
update t1 set c3=c3+1 where c1 in (3,4) and c2 in (3,4);
update t1 set c3=c3+1 where (c1,c2) in ((7,7),(8,8));
update t1 set c3=c3+1 where c1 in (5,6) and c2 in (6,6);
select * from t1;
pk1	c1	c2	c3
1	1	1	2
2	2	2	2
3	3	3	2
4	4	4	2
pk1	c1	c2	c3
1	1	1	2
2	2	2	2
3	3	3	2
4	4	4	2
commit;
select * from t1;
pk1	c1	c2	c3
1	1	1	2
2	2	2	2
3	3	3	2
4	4	4	2
pk1	c1	c2	c3
1	1	1	2
2	2	2	2
3	3	3	2
4	4	4	2
delete from t1 where (c1,c2) in ((5,5),(6,6));
delete from t1 where c1 in (7,8) and c2 in (7,8);
select * from t1;
pk1	c1	c2	c3
1	1	1	2
2	2	2	2
3	3	3	2
4	4	4	2
pk1	c1	c2	c3
1	1	1	2
2	2	2	2
3	3	3	2
4	4	4	2
update t1 set c3=c3+1 where (c1,c2) in ((1,1),(2,2));
update t1 set c3=c3+1 where c1 in (3,4) and c2 in (3,4);
update t1 set c3=c3+1 where (c1,c2) in ((7,7),(8,8));
update t1 set c3=c3+1 where c1 in (5,6) and c2 in (6,6);
select * from t1;
pk1	c1	c2	c3
1	1	1	3
2	2	2	3
3	3	3	3
4	4	4	3
pk1	c1	c2	c3
1	1	1	3
2	2	2	3
3	3	3	3
4	4	4	3
commit;
select * from t1;
pk1	c1	c2	c3
1	1	1	3
2	2	2	3
3	3	3	3
4	4	4	3
pk1	c1	c2	c3
1	1	1	3
2	2	2	3
3	3	3	3
4	4	4	3
commit;
delete from t1;
replace into t1(pk1,c1,c2,c3) values (1,1,1,1),(2,2,2,1),(3,3,3,1),(4,4,4,1),(5,5,5,1),(6,6,6,1),(7,7,7,1),(8,8,8,1);
select * from t1;
pk1	c1	c2	c3
1	1	1	1
2	2	2	1
3	3	3	1
4	4	4	1
5	5	5	1
6	6	6	1
7	7	7	1
8	8	8	1
pk1	c1	c2	c3
1	1	1	1
2	2	2	1
3	3	3	1
4	4	4	1
5	5	5	1
6	6	6	1
7	7	7	1
8	8	8	1
update t1 set c3=c3+1 where (c1,c2) in ((1,1),(2,2),(7,7),(8,8));
update t1 set c3=c3+1 where c1 in (3,4,5,6) and c2 in (3,4,5,6);
delete from t1 where (c1,c2) in ((5,5),(6,6));
delete from t1 where c1 in (7,8) and c2 in (7,8);
insert into t1(pk1,c1,c2,c3) values (7,7,7,1);
replace into t1(pk1,c1,c2,c3) values (8,8,8,1);
insert into t1(pk1,c1,c2,c3) values (9,9,9,1);
replace into t1(pk1,c1,c2,c3) values (10,10,10,1);
select * from t1;
pk1	c1	c2	c3
1	1	1	2
2	2	2	2
3	3	3	2
4	4	4	2
7	7	7	1
8	8	8	1
9	9	9	1
10	10	10	1
pk1	c1	c2	c3
1	1	1	2
2	2	2	2
3	3	3	2
4	4	4	2
7	7	7	1
8	8	8	1
9	9	9	1
10	10	10	1
update t1 set c3=c3+1 where (c1,c2) in ((1,1),(2,2),(7,7),(8,8));
Got one of the listed errors
update t1 set c3=c3+1 where c1 in (3,4,5,6) and c2 in (3,4,5,6);
Got one of the listed errors
update t1 set c3=c3+1 where c1 in (1,2);
Got one of the listed errors
update t1 set c3=c3+1 where c1 in (7,8);
Got one of the listed errors
delete from t1 where (c1,c2) in ((5,5),(6,6));
Got one of the listed errors
delete from t1 where c1 in (7,8) and c2 in (7,8);
Got one of the listed errors
delete from t1 where c1 in (3,4);
Got one of the listed errors
delete from t1 where c1 in (7,8);
Got one of the listed errors
insert into t1(pk1,c1,c2,c3) values (7,7,7,1);
Got one of the listed errors
replace into t1(pk1,c1,c2,c3) values (8,8,8,1);
Got one of the listed errors
insert into t1(pk1,c1,c2,c3) values (9,9,9,1);
Got one of the listed errors
replace into t1(pk1,c1,c2,c3) values (10,10,10,1);
Got one of the listed errors
update t1 set c3=c3+1 where pk1 in (7,8);
Got one of the listed errors
update t1 set c3=c3+1 where pk1 in (9,10);
update t1 set c3=c3+1 where c1 in (9,10);
update t1 set c3=c3+1 where (c1,c2) in ((9,9),(10,10));
delete from t1 where c1 in (10,9) and c2 in (10,9);
select * from t1;
pk1	c1	c2	c3
1	1	1	1
2	2	2	1
3	3	3	1
4	4	4	1
5	5	5	1
6	6	6	1
7	7	7	1
8	8	8	1
pk1	c1	c2	c3
1	1	1	1
2	2	2	1
3	3	3	1
4	4	4	1
5	5	5	1
6	6	6	1
7	7	7	1
8	8	8	1
select * from t1;
pk1	c1	c2	c3
1	1	1	2
2	2	2	2
3	3	3	2
4	4	4	2
7	7	7	1
8	8	8	1
9	9	9	1
10	10	10	1
pk1	c1	c2	c3
1	1	1	2
2	2	2	2
3	3	3	2
4	4	4	2
7	7	7	1
8	8	8	1
9	9	9	1
10	10	10	1
commit;
select * from t1;
pk1	c1	c2	c3
1	1	1	2
2	2	2	2
3	3	3	2
4	4	4	2
7	7	7	1
8	8	8	1
9	9	9	1
10	10	10	1
pk1	c1	c2	c3
1	1	1	2
2	2	2	2
3	3	3	2
4	4	4	2
7	7	7	1
8	8	8	1
9	9	9	1
10	10	10	1
update t1 set c3=c3+1 where (c1,c2) in ((9,9),(10,10));
select * from t1;
pk1	c1	c2	c3
1	1	1	2
2	2	2	2
3	3	3	2
4	4	4	2
7	7	7	1
8	8	8	1
9	9	9	2
10	10	10	2
pk1	c1	c2	c3
1	1	1	2
2	2	2	2
3	3	3	2
4	4	4	2
7	7	7	1
8	8	8	1
9	9	9	2
10	10	10	2
delete from t1 where c1 in (10,9) and c2 in (10,9);
select * from t1;
pk1	c1	c2	c3
1	1	1	2
2	2	2	2
3	3	3	2
4	4	4	2
7	7	7	1
8	8	8	1
pk1	c1	c2	c3
1	1	1	2
2	2	2	2
3	3	3	2
4	4	4	2
7	7	7	1
8	8	8	1
commit;
select * from t1;
pk1	c1	c2	c3
1	1	1	2
2	2	2	2
3	3	3	2
4	4	4	2
7	7	7	1
8	8	8	1
pk1	c1	c2	c3
1	1	1	2
2	2	2	2
3	3	3	2
4	4	4	2
7	7	7	1
8	8	8	1
commit;
set autocommit=1;
set autocommit=1;
drop table t1;
set global ob_enable_index_direct_select =0;
