create table t1(pk int primary key, a int, b int);
create index i1 on t1(b);
insert into t1(pk, a, b) values(1,1,1),(2,1,1),(3,1,1),(4,1,1);
set autocommit=0;
select pk, b from t1 where b between 0 and 1000;
pk	b
1	1
2	1
3	1
4	1
select pk, a, b from t1 where pk>0 and pk<10;
pk	a	b
1	1	1
2	1	1
3	1	1
4	1	1
select * from t1 where b>0 and b<1000;
pk	a	b
1	1	1
2	1	1
3	1	1
4	1	1
set autocommit=0;
update t1 set a=20, b=20 where pk=2;
update t1 set a=30, b=30 where pk=3;
delete from t1 where pk=4;
insert into t1 values(5,1,1);
replace into t1 values(6,1,1);
replace into t1 values(7,1,1);
commit;
select pk, b from t1 where b between 0 and 1000;
pk	b
1	1
2	20
3	30
5	1
6	1
7	1
select pk, a, b from t1 where pk>0 and pk<10;
pk	a	b
1	1	1
2	20	20
3	30	30
5	1	1
6	1	1
7	1	1
select * from t1 where b>0 and b<1000;
pk	a	b
1	1	1
2	20	20
3	30	30
5	1	1
6	1	1
7	1	1
update t1 set a=a+100, b=b+100 where pk=3;
update t1 set a=a+100, b=b+100 where pk=4;
update t1 set a=a+100, b=b+100 where pk=5;
update t1 set a=a+100, b=b+100 where pk=6;
select pk, b from t1 where b between 0 and 1000;
pk	b
1	1
2	20
3	130
5	101
6	101
7	1
select pk, a, b from t1 where pk>0 and pk<10;
pk	a	b
1	1	1
2	20	20
3	130	130
5	101	101
6	101	101
7	1	1
select * from t1 where b>0 and b<1000;
pk	a	b
1	1	1
2	20	20
3	130	130
5	101	101
6	101	101
7	1	1
commit;
select pk, b from t1 where b between 0 and 1000;
pk	b
1	1
2	20
3	130
5	101
6	101
7	1
select pk, a, b from t1 where pk>0 and pk<10;
pk	a	b
1	1	1
2	20	20
3	130	130
5	101	101
6	101	101
7	1	1
select * from t1 where b>0 and b<1000;
pk	a	b
1	1	1
2	20	20
3	130	130
5	101	101
6	101	101
7	1	1
commit;
select pk, b from t1 where b between 0 and 1000;
pk	b
1	1
2	20
3	130
5	101
6	101
7	1
select pk, a, b from t1 where pk>0 and pk<10;
pk	a	b
1	1	1
2	20	20
3	130	130
5	101	101
6	101	101
7	1	1
select * from t1 where b>0 and b<1000;
pk	a	b
1	1	1
2	20	20
3	130	130
5	101	101
6	101	101
7	1	1
commit;
select pk, b from t1 where b between 0 and 1000;
pk	b
1	1
2	20
3	130
5	101
6	101
7	1
select pk, a, b from t1 where pk>0 and pk<10;
pk	a	b
1	1	1
2	20	20
3	130	130
5	101	101
6	101	101
7	1	1
select * from t1 where b>0 and b<1000;
pk	a	b
1	1	1
2	20	20
3	130	130
5	101	101
6	101	101
7	1	1
commit;
drop table t1;
