create table t1(pk1 int, pk2 int, c1 int, c2 int, primary key(pk1,pk2));
insert into t1(pk1,pk2,c1,c2) values(1,1,1,1);
insert into t1(pk1,pk2,c1,c2) values(2,2,2,1);
insert into t1(pk1,pk2,c1,c2) values(3,3,3,1);
insert into t1(pk1,pk2,c1,c2) values(4,4,4,1);
insert into t1(pk1,pk2,c1,c2) values(5,5,5,1);
insert into t1(pk1,pk2,c1,c2) values(6,6,6,1);
insert into t1(pk1,pk2,c1,c2) values(7,7,7,1);
insert into t1(pk1,pk2,c1,c2) values(8,8,8,1);
create index i1 on t1(c1) storing(c2);
select * from t1;
pk1	pk2	c1	c2
1	1	1	1
2	2	2	1
3	3	3	1
4	4	4	1
5	5	5	1
6	6	6	1
7	7	7	1
8	8	8	1
pk1	pk2	c1	c2
1	1	1	1
2	2	2	1
3	3	3	1
4	4	4	1
5	5	5	1
6	6	6	1
7	7	7	1
8	8	8	1
set autocommit=0;
set autocommit=0;
update t1 set c2=c2+1 where c1=1 or c1=2 or c1=3 or c1=4;
select * from t1;
pk1	pk2	c1	c2
1	1	1	2
2	2	2	2
3	3	3	2
4	4	4	2
5	5	5	1
6	6	6	1
7	7	7	1
8	8	8	1
pk1	pk2	c1	c2
1	1	1	2
2	2	2	2
3	3	3	2
4	4	4	2
5	5	5	1
6	6	6	1
7	7	7	1
8	8	8	1
delete from t1 where c1=5 or c1=6;
select * from t1;
pk1	pk2	c1	c2
1	1	1	2
2	2	2	2
3	3	3	2
4	4	4	2
7	7	7	1
8	8	8	1
pk1	pk2	c1	c2
1	1	1	2
2	2	2	2
3	3	3	2
4	4	4	2
7	7	7	1
8	8	8	1
select * from t1;
pk1	pk2	c1	c2
1	1	1	1
2	2	2	1
3	3	3	1
4	4	4	1
5	5	5	1
6	6	6	1
7	7	7	1
8	8	8	1
pk1	pk2	c1	c2
1	1	1	1
2	2	2	1
3	3	3	1
4	4	4	1
5	5	5	1
6	6	6	1
7	7	7	1
8	8	8	1
commit;
select * from t1;
pk1	pk2	c1	c2
1	1	1	1
2	2	2	1
3	3	3	1
4	4	4	1
5	5	5	1
6	6	6	1
7	7	7	1
8	8	8	1
pk1	pk2	c1	c2
1	1	1	1
2	2	2	1
3	3	3	1
4	4	4	1
5	5	5	1
6	6	6	1
7	7	7	1
8	8	8	1
delete from t1 where c1=5 or c1=6 or c1=7 or c1=8;
update t1 set c2=c2+1 where c1=5 or c1=6 or c1=7 or c1=8;
select * from t1;
pk1	pk2	c1	c2
1	1	1	2
2	2	2	2
3	3	3	2
4	4	4	2
pk1	pk2	c1	c2
1	1	1	2
2	2	2	2
3	3	3	2
4	4	4	2
commit;
select * from t1;
pk1	pk2	c1	c2
1	1	1	2
2	2	2	2
3	3	3	2
4	4	4	2
pk1	pk2	c1	c2
1	1	1	2
2	2	2	2
3	3	3	2
4	4	4	2
commit;
select * from t1;
pk1	pk2	c1	c2
1	1	1	2
2	2	2	2
3	3	3	2
4	4	4	2
pk1	pk2	c1	c2
1	1	1	2
2	2	2	2
3	3	3	2
4	4	4	2
commit;
delete from t1;
replace into t1(pk1,pk2,c1,c2) values (1,1,1,1),(2,2,2,1),(3,3,3,1),(4,4,4,1),(5,5,5,1),(6,6,6,1),(7,7,7,1),(8,8,8,1);
select * from t1;
pk1	pk2	c1	c2
1	1	1	1
2	2	2	1
3	3	3	1
4	4	4	1
5	5	5	1
6	6	6	1
7	7	7	1
8	8	8	1
pk1	pk2	c1	c2
1	1	1	1
2	2	2	1
3	3	3	1
4	4	4	1
5	5	5	1
6	6	6	1
7	7	7	1
8	8	8	1
update t1 set c2=c2+1 where c1=1 or c1=2 or c1=3 or c1=4;
select * from t1;
pk1	pk2	c1	c2
1	1	1	2
2	2	2	2
3	3	3	2
4	4	4	2
5	5	5	1
6	6	6	1
7	7	7	1
8	8	8	1
pk1	pk2	c1	c2
1	1	1	2
2	2	2	2
3	3	3	2
4	4	4	2
5	5	5	1
6	6	6	1
7	7	7	1
8	8	8	1
delete from t1 where c1=5 or c1=6 or c1=7 or c1=8;
select * from t1;
pk1	pk2	c1	c2
1	1	1	1
2	2	2	1
3	3	3	1
4	4	4	1
pk1	pk2	c1	c2
1	1	1	1
2	2	2	1
3	3	3	1
4	4	4	1
commit;
select * from t1;
pk1	pk2	c1	c2
1	1	1	2
2	2	2	2
3	3	3	2
4	4	4	2
pk1	pk2	c1	c2
1	1	1	2
2	2	2	2
3	3	3	2
4	4	4	2
commit;
select * from t1;
pk1	pk2	c1	c2
1	1	1	2
2	2	2	2
3	3	3	2
4	4	4	2
pk1	pk2	c1	c2
1	1	1	2
2	2	2	2
3	3	3	2
4	4	4	2
commit;
delete from t1;
replace into t1(pk1,pk2,c1,c2) values (1,1,1,1),(2,2,2,1),(3,3,3,1),(4,4,4,1),(5,5,5,1),(6,6,6,1),(7,7,7,1),(8,8,8,1);
select * from t1;
pk1	pk2	c1	c2
1	1	1	1
2	2	2	1
3	3	3	1
4	4	4	1
5	5	5	1
6	6	6	1
7	7	7	1
8	8	8	1
pk1	pk2	c1	c2
1	1	1	1
2	2	2	1
3	3	3	1
4	4	4	1
5	5	5	1
6	6	6	1
7	7	7	1
8	8	8	1
update t1 set c2=c2+1 where c1=1 or c1=2 or c1=3 or c1=4;
delete from t1 where c1=5 or c1=6 or c1=7 or c1=8;
select * from t1;
pk1	pk2	c1	c2
1	1	1	2
2	2	2	2
3	3	3	2
4	4	4	2
pk1	pk2	c1	c2
1	1	1	2
2	2	2	2
3	3	3	2
4	4	4	2
commit;
select * from t1;
pk1	pk2	c1	c2
1	1	1	2
2	2	2	2
3	3	3	2
4	4	4	2
pk1	pk2	c1	c2
1	1	1	2
2	2	2	2
3	3	3	2
4	4	4	2
update t1 set c2=c2+1 where c1=1 or c1=2 or c1=3 or c1=4;
delete from t1 where c1=5 or c1=6 or c1=7 or c1=8;
select * from t1;
pk1	pk2	c1	c2
1	1	1	3
2	2	2	3
3	3	3	3
4	4	4	3
pk1	pk2	c1	c2
1	1	1	3
2	2	2	3
3	3	3	3
4	4	4	3
delete from t1 where c1=1 or c1=2 or c1=3 or c1=4;
update t1 set c2=c2+1 where c1=1 or c1=2 or c1=3 or c1=4 or c1=5 or c1=6 or c1=7 or c1=8;
select * from t1;
pk1	pk2	c1	c2
pk1	pk2	c1	c2
commit;
delete from t1;
replace into t1(pk1,pk2,c1,c2) values (1,1,1,1),(2,2,2,1),(3,3,3,1),(4,4,4,1),(5,5,5,1),(6,6,6,1),(7,7,7,1),(8,8,8,1);
select * from t1;
pk1	pk2	c1	c2
1	1	1	1
2	2	2	1
3	3	3	1
4	4	4	1
5	5	5	1
6	6	6	1
7	7	7	1
8	8	8	1
pk1	pk2	c1	c2
1	1	1	1
2	2	2	1
3	3	3	1
4	4	4	1
5	5	5	1
6	6	6	1
7	7	7	1
8	8	8	1
update t1 set c2=c2+1 where c1=1 or c1=2 or c1=3 or c1=4;
delete from t1 where c1=5 or c1=6 or c1=7 or c1=8;
select * from t1;
pk1	pk2	c1	c2
1	1	1	2
2	2	2	2
3	3	3	2
4	4	4	2
pk1	pk2	c1	c2
1	1	1	2
2	2	2	2
3	3	3	2
4	4	4	2
insert into t1(pk1,pk2,c1,c2) values (9,9,9,1),(10,10,10,1);
update t1 set c2=c2+1 where c1=1 or c1=2 or c1=3 or c1=4;
Got one of the listed errors
delete from t1 where c1=5 or c1=6 or c1=7 or c1=8;
Got one of the listed errors
update t1 set c2=c2+1 where pk1=1 or pk2=1;
Got one of the listed errors
delete from t1 where pk1=1 or pk2=1;
Got one of the listed errors
update t1 set c2=2+1 where c1=1 or c2=1;
Got one of the listed errors
delete from t1 where c1=1 or c2=1;
Got one of the listed errors
update t1 set c2=c2+1 where c1=1 or c1=2;
Got one of the listed errors
delete from t1 where c1=1 or c1=2;
Got one of the listed errors
update t1 set c2=c2+1 where (pk1=9 and pk2=9) or (pk1=10 and pk2=10);
delete from t1 where (pk1=9 and pk2=9) or (pk1=10 and pk2=10);
update t1 set c2=c2+1 where c1=9 or c2=10;
delete from t1 where c1=10 or c2=10;
select * from t1;
pk1	pk2	c1	c2
1	1	1	1
2	2	2	1
3	3	3	1
4	4	4	1
5	5	5	1
6	6	6	1
7	7	7	1
8	8	8	1
pk1	pk2	c1	c2
1	1	1	1
2	2	2	1
3	3	3	1
4	4	4	1
5	5	5	1
6	6	6	1
7	7	7	1
8	8	8	1
select * from t1;
pk1	pk2	c1	c2
1	1	1	2
2	2	2	2
3	3	3	2
4	4	4	2
9	9	9	1
10	10	10	1
pk1	pk2	c1	c2
1	1	1	2
2	2	2	2
3	3	3	2
4	4	4	2
9	9	9	1
10	10	10	1
commit;
select * from t1;
pk1	pk2	c1	c2
1	1	1	2
2	2	2	2
3	3	3	2
4	4	4	2
9	9	9	1
10	10	10	1
pk1	pk2	c1	c2
1	1	1	2
2	2	2	2
3	3	3	2
4	4	4	2
9	9	9	1
10	10	10	1
update t1 set c2=c2+1 where c1=9 or c2=9;
select * from t1;
pk1	pk2	c1	c2
1	1	1	2
2	2	2	2
3	3	3	2
4	4	4	2
9	9	9	2
10	10	10	1
pk1	pk2	c1	c2
1	1	1	2
2	2	2	2
3	3	3	2
4	4	4	2
9	9	9	2
10	10	10	1
delete from t1 where c1=10 or c2=10;
select * from t1;
pk1	pk2	c1	c2
1	1	1	2
2	2	2	2
3	3	3	2
4	4	4	2
9	9	9	2
pk1	pk2	c1	c2
1	1	1	2
2	2	2	2
3	3	3	2
4	4	4	2
9	9	9	2
commit;
select * from t1;
pk1	pk2	c1	c2
1	1	1	2
2	2	2	2
3	3	3	2
4	4	4	2
9	9	9	2
pk1	pk2	c1	c2
1	1	1	2
2	2	2	2
3	3	3	2
4	4	4	2
9	9	9	2
commit;
set autocommit=1;
set autocommit=1;
drop table t1;
set global ob_enable_index_direct_select =0;
