create table t1(pk int primary key, a int, b int);
create index i1 on t1(b);
insert into t1(pk, a, b) values(1,1,1),(2,1,1);
select * from t1;
pk	a	b
1	1	1
2	1	1
set autocommit=0;
select pk, b from t1 where b>0 and b<=1;
pk	b
1	1
2	1
select pk, a, b from t1 where pk>0 and pk<10;
pk	a	b
1	1	1
2	1	1
select * from t1 where b>0 and b<=1;
pk	a	b
1	1	1
2	1	1
set autocommit=0;
update t1 set a=10, b=10 where pk=1;
delete from t1 where pk=2;
commit;
insert into t1(pk,a ,b) values(3,1,1);
select * from t1;
pk	a	b
1	10	10
3	1	1
select pk, b from t1 where b>0 and b<=10;
pk	b
3	1
1	10
select pk, a, b from t1 where pk>0 and pk<10;
pk	a	b
1	10	10
3	1	1
select * from t1 where b>0 and b<=10;
pk	a	b
3	1	1
1	10	10
commit;
select pk, b from t1 where b>0 and b<=10;
pk	b
3	1
1	10
select pk, a, b from t1 where pk>0 and pk<10;
pk	a	b
1	10	10
3	1	1
select * from t1 where b>0 and b<=10;
pk	a	b
3	1	1
1	10	10
set autocommit=0;
update t1 set a=30, b=30 where pk=3;
insert into t1 values(4,1,1);
commit;
delete from t1 where pk=4;
select pk, b from t1 where b>0 and b<=30;
pk	b
1	10
3	30
select pk, a, b from t1 where pk>0 and pk<10;
pk	a	b
1	10	10
3	30	30
select * from t1 where b>0 and b<=30;
pk	a	b
1	10	10
3	30	30
commit;
select pk, b from t1 where b>0 and b<=30;
pk	b
1	10
3	30
select pk, a, b from t1 where pk>0 and pk<10;
pk	a	b
1	10	10
3	30	30
select * from t1 where b>0 and b<=30;
pk	a	b
1	10	10
3	30	30
