create table t1(pk int primary key, a int, b int, c varchar(1024));
create index i1 on t1(b) storing(c);
set autocommit=0;
replace into t1 values(1,1,1,'a');
set autocommit=0;
replace into t1 values(2,1,1,'a');
select pk, b, c from t1 where b>0 and b<10;
pk	b	c
2	1	a
select pk, a, b from t1 where pk>0 and pk<10;
pk	a	b
2	1	1
select * from t1 where b>0 and b<10;
pk	a	b	c
2	1	1	a
select pk, b, c from t1 where b>0 and b<10;
pk	b	c
1	1	a
select pk, a, b from t1 where pk>0 and pk<10;
pk	a	b
1	1	1
select * from t1 where b>0 and b<10;
pk	a	b	c
1	1	1	a
commit;
select pk, b, c from t1 where b>0 and b<10;
pk	b	c
1	1	a
select pk, a, b from t1 where pk>0 and pk<10;
pk	a	b
1	1	1
select * from t1 where b>0 and b<10;
pk	a	b	c
1	1	1	a
commit;
select pk, b, c from t1 where b>0 and b<10;
pk	b	c
1	1	a
2	1	a
select pk, a, b from t1 where pk>0 and pk<10;
pk	a	b
1	1	1
2	1	1
select * from t1 where b>0 and b<10;
pk	a	b	c
1	1	1	a
2	1	1	a
commit;
select pk, b, c from t1 where b>0 and b<10;
pk	b	c
1	1	a
2	1	a
select pk, a, b from t1 where pk>0 and pk<10;
pk	a	b
1	1	1
2	1	1
select * from t1 where b>0 and b<10;
pk	a	b	c
1	1	1	a
2	1	1	a
commit;
set autocommit=0;
replace into t1 values(3,1,1,'a');
set autocommit=0;
replace into t1 values(4,1,1,'a');
delete from t1 where pk=3;
update t1 set b=4 where pk=3;
insert into t1 values(3,1,1,'a');
Got one of the listed errors
replace into t1 values(3,1,1,'c');
Got one of the listed errors
select pk, b, c from t1 where b>0 and b<10;
pk	b	c
1	1	a
2	1	a
4	1	a
select pk, a, b from t1 where pk>0 and pk<10;
pk	a	b
1	1	1
2	1	1
4	1	1
select * from t1 where b>0 and b<10;
pk	a	b	c
1	1	1	a
2	1	1	a
4	1	1	a
select pk, b, c from t1 where b>0 and b<10;
pk	b	c
1	1	a
2	1	a
3	1	a
select pk, a, b from t1 where pk>0 and pk<10;
pk	a	b
1	1	1
2	1	1
3	1	1
select * from t1 where b>0 and b<10;
pk	a	b	c
1	1	1	a
2	1	1	a
3	1	1	a
commit;
select pk, b, c from t1 where b>0 and b<10;
pk	b	c
1	1	a
2	1	a
3	1	a
select pk, a, b from t1 where pk>0 and pk<10;
pk	a	b
1	1	1
2	1	1
3	1	1
select * from t1 where b>0 and b<10;
pk	a	b	c
1	1	1	a
2	1	1	a
3	1	1	a
commit;
select pk, b, c from t1 where b>0 and b<10;
pk	b	c
1	1	a
2	1	a
3	1	a
4	1	a
select pk, a, b from t1 where pk>0 and pk<10;
pk	a	b
1	1	1
2	1	1
3	1	1
4	1	1
select * from t1 where b>0 and b<10;
pk	a	b	c
1	1	1	a
2	1	1	a
3	1	1	a
4	1	1	a
commit;
select pk, b, c from t1 where b>0 and b<10;
pk	b	c
1	1	a
2	1	a
3	1	a
4	1	a
select pk, a, b from t1 where pk>0 and pk<10;
pk	a	b
1	1	1
2	1	1
3	1	1
4	1	1
select * from t1 where b>0 and b<10;
pk	a	b	c
1	1	1	a
2	1	1	a
3	1	1	a
4	1	1	a
commit;
set autocommit=0;
replace into t1 values(5,1,1,'a'),(6,1,1,'a'),(7,1,1,'a');
commit;
replace into t1 values(7,2,2,'b');
set autocommit=0;
delete from t1 where pk=5;
update t1 set a=a+1, b=b+1, c='b' where pk=6;
replace into t1 values(8,1,1,'a');
select pk, b, c from t1 where b>0 and b<10;
pk	b	c
1	1	a
2	1	a
3	1	a
4	1	a
6	2	b
7	1	a
8	1	a
select pk, a, b from t1 where pk>0 and pk<10;
pk	a	b
1	1	1
2	1	1
3	1	1
4	1	1
6	2	2
7	1	1
8	1	1
select * from t1 where b>0 and b<10;
pk	a	b	c
1	1	1	a
2	1	1	a
3	1	1	a
4	1	1	a
6	2	2	b
7	1	1	a
8	1	1	a
select pk, b, c from t1 where b>0 and b<10;
pk	b	c
1	1	a
2	1	a
3	1	a
4	1	a
5	1	a
6	1	a
7	2	b
select pk, a, b from t1 where pk>0 and pk<10;
pk	a	b
1	1	1
2	1	1
3	1	1
4	1	1
5	1	1
6	1	1
7	2	2
select * from t1 where b>0 and b<10;
pk	a	b	c
1	1	1	a
2	1	1	a
3	1	1	a
4	1	1	a
5	1	1	a
6	1	1	a
7	2	2	b
commit;
select pk, b, c from t1 where b>0 and b<10;
pk	b	c
1	1	a
2	1	a
3	1	a
4	1	a
5	1	a
6	1	a
7	2	b
select pk, a, b from t1 where pk>0 and pk<10;
pk	a	b
1	1	1
2	1	1
3	1	1
4	1	1
5	1	1
6	1	1
7	2	2
select * from t1 where b>0 and b<10;
pk	a	b	c
1	1	1	a
2	1	1	a
3	1	1	a
4	1	1	a
5	1	1	a
6	1	1	a
7	2	2	b
commit;
select pk, b, c from t1 where b>0 and b<10;
pk	b	c
1	1	a
2	1	a
3	1	a
4	1	a
6	2	b
7	2	b
8	1	a
select pk, a, b from t1 where pk>0 and pk<10;
pk	a	b
1	1	1
2	1	1
3	1	1
4	1	1
6	2	2
7	2	2
8	1	1
select * from t1 where b>0 and b<10;
pk	a	b	c
1	1	1	a
2	1	1	a
3	1	1	a
4	1	1	a
6	2	2	b
7	2	2	b
8	1	1	a
commit;
select pk, b, c from t1 where b>0 and b<10;
pk	b	c
1	1	a
2	1	a
3	1	a
4	1	a
6	2	b
7	2	b
8	1	a
select pk, a, b from t1 where pk>0 and pk<10;
pk	a	b
1	1	1
2	1	1
3	1	1
4	1	1
6	2	2
7	2	2
8	1	1
select * from t1 where b>0 and b<10;
pk	a	b	c
1	1	1	a
2	1	1	a
3	1	1	a
4	1	1	a
6	2	2	b
7	2	2	b
8	1	1	a
commit;
set autocommit=0;
replace into t1 values(8,2,2,'b'),(9,2,2,'b');
commit;
replace into t1 values(8,3,3,'c');
set autocommit=0;
replace into t1 values(9,3,3,'c');
select pk, b, c from t1 where b>0 and b<10;
pk	b	c
1	1	a
2	1	a
3	1	a
4	1	a
6	2	b
7	2	b
8	2	b
9	3	c
select pk, a, b from t1 where pk>0 and pk<10;
pk	a	b
1	1	1
2	1	1
3	1	1
4	1	1
6	2	2
7	2	2
8	2	2
9	3	3
select * from t1 where b>0 and b<10;
pk	a	b	c
1	1	1	a
2	1	1	a
3	1	1	a
4	1	1	a
6	2	2	b
7	2	2	b
8	2	2	b
9	3	3	c
select pk, b, c from t1 where b>0 and b<10;
pk	b	c
1	1	a
2	1	a
3	1	a
4	1	a
6	2	b
7	2	b
8	3	c
9	2	b
select pk, a, b from t1 where pk>0 and pk<10;
pk	a	b
1	1	1
2	1	1
3	1	1
4	1	1
6	2	2
7	2	2
8	3	3
9	2	2
select * from t1 where b>0 and b<10;
pk	a	b	c
1	1	1	a
2	1	1	a
3	1	1	a
4	1	1	a
6	2	2	b
7	2	2	b
8	3	3	c
9	2	2	b
commit;
select pk, b, c from t1 where b>0 and b<10;
pk	b	c
1	1	a
2	1	a
3	1	a
4	1	a
6	2	b
7	2	b
8	3	c
9	2	b
select pk, a, b from t1 where pk>0 and pk<10;
pk	a	b
1	1	1
2	1	1
3	1	1
4	1	1
6	2	2
7	2	2
8	3	3
9	2	2
select * from t1 where b>0 and b<10;
pk	a	b	c
1	1	1	a
2	1	1	a
3	1	1	a
4	1	1	a
6	2	2	b
7	2	2	b
8	3	3	c
9	2	2	b
commit;
select pk, b, c from t1 where b>0 and b<10;
pk	b	c
1	1	a
2	1	a
3	1	a
4	1	a
6	2	b
7	2	b
8	3	c
9	3	c
select pk, a, b from t1 where pk>0 and pk<10;
pk	a	b
1	1	1
2	1	1
3	1	1
4	1	1
6	2	2
7	2	2
8	3	3
9	3	3
select * from t1 where b>0 and b<10;
pk	a	b	c
1	1	1	a
2	1	1	a
3	1	1	a
4	1	1	a
6	2	2	b
7	2	2	b
8	3	3	c
9	3	3	c
rollback;
select pk, b, c from t1 where b>0 and b<10;
pk	b	c
1	1	a
2	1	a
3	1	a
4	1	a
6	2	b
7	2	b
8	3	c
9	2	b
select pk, a, b from t1 where pk>0 and pk<10;
pk	a	b
1	1	1
2	1	1
3	1	1
4	1	1
6	2	2
7	2	2
8	3	3
9	2	2
select * from t1 where b>0 and b<10;
pk	a	b	c
1	1	1	a
2	1	1	a
3	1	1	a
4	1	1	a
6	2	2	b
7	2	2	b
8	3	3	c
9	2	2	b
drop table t1;
