set sql_mode="";
-- ========================= SELECT ====================================================================================
drop table if exists t1;
create table t1 (a bigint primary key, b char(100) , c char(100) , d char(100) , e char(100) ,  key i1(b) , unique index i2(c,d,e));
insert into t1 values(1,'aaaa','aaaa','aaaa','aaaa'),(2,'xxxc','xxxb','xxxb','xxxb'),(3,'xxxb','xxxc','xxxc','xxxc'),(4,'xxxa','xxxa','xxxa','xxxa'),(5,'zzzz','zzzz','zzzz','zzzz'),(6,NULL,NULL,'xxxa','xxxa'),(7,'zxxx','zxxx','zxxx','zxxx'),(8,'axxx','axxx','axxx','axxx'),(9,'zaaz','zaaz','zaaz','zaaz'),(10,'zbbz','zbbz','zbbz','zbbz');
-- col_str1 [NOT] LIKE ‘xxx’ [ESCAPE col_str3]
SELECT * FROM t1 WHERE b like 'xxx' ;
a	b	c	d	e
EXPLAIN SELECT * FROM t1 WHERE b like 'xxx' ;
-- col_str1 [NOT] LIKE ‘xxx%’ [ESCAPE col_str3]
SELECT * FROM t1 WHERE b like 'xxx%' ;
a	b	c	d	e
4	xxxa	xxxa	xxxa	xxxa
3	xxxb	xxxc	xxxc	xxxc
2	xxxc	xxxb	xxxb	xxxb
SELECT * FROM t1 WHERE b like 'xxx%' ESCAPE 'x' ;
a	b	c	d	e
SELECT * FROM t1 WHERE b like 'xxx%' ESCAPE 'a' ;
a	b	c	d	e
4	xxxa	xxxa	xxxa	xxxa
3	xxxb	xxxc	xxxc	xxxc
2	xxxc	xxxb	xxxb	xxxb
SELECT * FROM t1 WHERE b NOT like 'xxx%' ;
a	b	c	d	e
1	aaaa	aaaa	aaaa	aaaa
5	zzzz	zzzz	zzzz	zzzz
7	zxxx	zxxx	zxxx	zxxx
8	axxx	axxx	axxx	axxx
9	zaaz	zaaz	zaaz	zaaz
10	zbbz	zbbz	zbbz	zbbz
SELECT * FROM t1 WHERE b NOT like 'xxx%' ESCAPE 'x' ;
a	b	c	d	e
1	aaaa	aaaa	aaaa	aaaa
2	xxxc	xxxb	xxxb	xxxb
3	xxxb	xxxc	xxxc	xxxc
4	xxxa	xxxa	xxxa	xxxa
5	zzzz	zzzz	zzzz	zzzz
7	zxxx	zxxx	zxxx	zxxx
8	axxx	axxx	axxx	axxx
9	zaaz	zaaz	zaaz	zaaz
10	zbbz	zbbz	zbbz	zbbz
SELECT * FROM t1 WHERE b NOT like 'xxx%' ESCAPE 'a' ;
a	b	c	d	e
1	aaaa	aaaa	aaaa	aaaa
5	zzzz	zzzz	zzzz	zzzz
7	zxxx	zxxx	zxxx	zxxx
8	axxx	axxx	axxx	axxx
9	zaaz	zaaz	zaaz	zaaz
10	zbbz	zbbz	zbbz	zbbz
-- col_str1 [NOT] LIKE ‘z%z’ [ESCAPE col_str3]
SELECT * FROM t1 WHERE b like 'z%z' ;
a	b	c	d	e
5	zzzz	zzzz	zzzz	zzzz
9	zaaz	zaaz	zaaz	zaaz
10	zbbz	zbbz	zbbz	zbbz
SELECT * FROM t1 WHERE b like 'z%z' ESCAPE 'x' ;
a	b	c	d	e
5	zzzz	zzzz	zzzz	zzzz
9	zaaz	zaaz	zaaz	zaaz
10	zbbz	zbbz	zbbz	zbbz
SELECT * FROM t1 WHERE b like 'z%z' ESCAPE 'a' ;
a	b	c	d	e
5	zzzz	zzzz	zzzz	zzzz
9	zaaz	zaaz	zaaz	zaaz
10	zbbz	zbbz	zbbz	zbbz
SELECT * FROM t1 WHERE b NOT like 'z%z' ;
a	b	c	d	e
1	aaaa	aaaa	aaaa	aaaa
2	xxxc	xxxb	xxxb	xxxb
3	xxxb	xxxc	xxxc	xxxc
4	xxxa	xxxa	xxxa	xxxa
7	zxxx	zxxx	zxxx	zxxx
8	axxx	axxx	axxx	axxx
SELECT * FROM t1 WHERE b NOT like 'z%z' ESCAPE 'x' ;
a	b	c	d	e
1	aaaa	aaaa	aaaa	aaaa
2	xxxc	xxxb	xxxb	xxxb
3	xxxb	xxxc	xxxc	xxxc
4	xxxa	xxxa	xxxa	xxxa
7	zxxx	zxxx	zxxx	zxxx
8	axxx	axxx	axxx	axxx
SELECT * FROM t1 WHERE b NOT like 'z%z' ESCAPE 'a' ;
a	b	c	d	e
1	aaaa	aaaa	aaaa	aaaa
2	xxxc	xxxb	xxxb	xxxb
3	xxxb	xxxc	xxxc	xxxc
4	xxxa	xxxa	xxxa	xxxa
7	zxxx	zxxx	zxxx	zxxx
8	axxx	axxx	axxx	axxx
-- col_str1 [NOT] LIKE ‘z__z’ [ESCAPE col_str3]
SELECT * FROM t1 WHERE b like 'z__z' ;
a	b	c	d	e
5	zzzz	zzzz	zzzz	zzzz
9	zaaz	zaaz	zaaz	zaaz
10	zbbz	zbbz	zbbz	zbbz
SELECT * FROM t1 WHERE b like 'z__z' ESCAPE 'x' ;
a	b	c	d	e
5	zzzz	zzzz	zzzz	zzzz
9	zaaz	zaaz	zaaz	zaaz
10	zbbz	zbbz	zbbz	zbbz
SELECT * FROM t1 WHERE b like 'z__z' ESCAPE 'a' ;
a	b	c	d	e
5	zzzz	zzzz	zzzz	zzzz
9	zaaz	zaaz	zaaz	zaaz
10	zbbz	zbbz	zbbz	zbbz
SELECT * FROM t1 WHERE b NOT like 'z__z' ;
a	b	c	d	e
1	aaaa	aaaa	aaaa	aaaa
2	xxxc	xxxb	xxxb	xxxb
3	xxxb	xxxc	xxxc	xxxc
4	xxxa	xxxa	xxxa	xxxa
7	zxxx	zxxx	zxxx	zxxx
8	axxx	axxx	axxx	axxx
SELECT * FROM t1 WHERE b NOT like 'z__z' ESCAPE 'x' ;
a	b	c	d	e
1	aaaa	aaaa	aaaa	aaaa
2	xxxc	xxxb	xxxb	xxxb
3	xxxb	xxxc	xxxc	xxxc
4	xxxa	xxxa	xxxa	xxxa
7	zxxx	zxxx	zxxx	zxxx
8	axxx	axxx	axxx	axxx
SELECT * FROM t1 WHERE b NOT like 'z__z' ESCAPE 'a' ;
a	b	c	d	e
1	aaaa	aaaa	aaaa	aaaa
2	xxxc	xxxb	xxxb	xxxb
3	xxxb	xxxc	xxxc	xxxc
4	xxxa	xxxa	xxxa	xxxa
7	zxxx	zxxx	zxxx	zxxx
8	axxx	axxx	axxx	axxx
-- col_str1 [NOT] LIKE ‘z%z%’ [ESCAPE col_str3]
SELECT * FROM t1 WHERE b like 'z%z%' ;
a	b	c	d	e
5	zzzz	zzzz	zzzz	zzzz
9	zaaz	zaaz	zaaz	zaaz
10	zbbz	zbbz	zbbz	zbbz
SELECT * FROM t1 WHERE b like 'z%z%' ESCAPE 'x' ;
a	b	c	d	e
5	zzzz	zzzz	zzzz	zzzz
9	zaaz	zaaz	zaaz	zaaz
10	zbbz	zbbz	zbbz	zbbz
SELECT * FROM t1 WHERE b like 'z%z%' ESCAPE 'a' ;
a	b	c	d	e
5	zzzz	zzzz	zzzz	zzzz
9	zaaz	zaaz	zaaz	zaaz
10	zbbz	zbbz	zbbz	zbbz
SELECT * FROM t1 WHERE b like 'z%%%%%%%%%%%%%%%z%' ;
a	b	c	d	e
5	zzzz	zzzz	zzzz	zzzz
9	zaaz	zaaz	zaaz	zaaz
10	zbbz	zbbz	zbbz	zbbz
SELECT * FROM t1 WHERE b like 'z%%%%%%%%%%%%%%%z%' ESCAPE 'x' ;
a	b	c	d	e
5	zzzz	zzzz	zzzz	zzzz
9	zaaz	zaaz	zaaz	zaaz
10	zbbz	zbbz	zbbz	zbbz
SELECT * FROM t1 WHERE b like 'z%%%%%%%%%%%%%%%z%' ESCAPE 'a' ;
a	b	c	d	e
5	zzzz	zzzz	zzzz	zzzz
9	zaaz	zaaz	zaaz	zaaz
10	zbbz	zbbz	zbbz	zbbz
SELECT * FROM t1 WHERE b like 'z_%%%%%%%%%%%%%%%z%' ;
a	b	c	d	e
5	zzzz	zzzz	zzzz	zzzz
9	zaaz	zaaz	zaaz	zaaz
10	zbbz	zbbz	zbbz	zbbz
SELECT * FROM t1 WHERE b like 'z%_%%%%%%%%%%%%%z%' ESCAPE 'x' ;
a	b	c	d	e
5	zzzz	zzzz	zzzz	zzzz
9	zaaz	zaaz	zaaz	zaaz
10	zbbz	zbbz	zbbz	zbbz
SELECT * FROM t1 WHERE b like 'z%%%%%%%%%%%%%%%_z%' ESCAPE 'a' ;
a	b	c	d	e
5	zzzz	zzzz	zzzz	zzzz
9	zaaz	zaaz	zaaz	zaaz
10	zbbz	zbbz	zbbz	zbbz
SELECT * FROM t1 WHERE b like 'z%%%%%%%%%%%%%%%%%%%%%%%%%%%%%z%%%%%%%%%%%%%%%' ;
a	b	c	d	e
5	zzzz	zzzz	zzzz	zzzz
9	zaaz	zaaz	zaaz	zaaz
10	zbbz	zbbz	zbbz	zbbz
SELECT * FROM t1 WHERE b like 'z%%%%%%%%%%%%%%%%%%%%%%%%%%%%%z%%%%%%%%%%%%%%%' ESCAPE 'x' ;
a	b	c	d	e
5	zzzz	zzzz	zzzz	zzzz
9	zaaz	zaaz	zaaz	zaaz
10	zbbz	zbbz	zbbz	zbbz
SELECT * FROM t1 WHERE b like 'z%%%%%%%%%%%%%%%%%%%%%%%%%%%%%z%%%%%%%%%%%%%%%' ESCAPE 'a' ;
a	b	c	d	e
5	zzzz	zzzz	zzzz	zzzz
9	zaaz	zaaz	zaaz	zaaz
10	zbbz	zbbz	zbbz	zbbz
SELECT * FROM t1 WHERE b like 'z_%%%%%%%%%%%%%%%z%%%%%%%%%%%%%%%' ;
a	b	c	d	e
5	zzzz	zzzz	zzzz	zzzz
9	zaaz	zaaz	zaaz	zaaz
10	zbbz	zbbz	zbbz	zbbz
SELECT * FROM t1 WHERE b like 'z%%%%%%%%%%%%%%%_%%%%%%%%%%%%%z%%%%%%%%%%%%%%%' ESCAPE 'x' ;
a	b	c	d	e
5	zzzz	zzzz	zzzz	zzzz
9	zaaz	zaaz	zaaz	zaaz
10	zbbz	zbbz	zbbz	zbbz
SELECT * FROM t1 WHERE b like 'z%%%%%%%%%%%%%%%%%%%%%%%%%%%%%_z%%%%%%%%%%%%%%%' ESCAPE 'a' ;
a	b	c	d	e
5	zzzz	zzzz	zzzz	zzzz
9	zaaz	zaaz	zaaz	zaaz
10	zbbz	zbbz	zbbz	zbbz
-- col_str1 [NOT] LIKE ‘%xxx%’ [ESCAPE col_str3]
SELECT * FROM t1 WHERE b like '%xxx%' ;
a	b	c	d	e
2	xxxc	xxxb	xxxb	xxxb
3	xxxb	xxxc	xxxc	xxxc
4	xxxa	xxxa	xxxa	xxxa
7	zxxx	zxxx	zxxx	zxxx
8	axxx	axxx	axxx	axxx
SELECT * FROM t1 WHERE b like '%xxx%' ESCAPE 'x' ;
a	b	c	d	e
SELECT * FROM t1 WHERE b like '%xxx%' ESCAPE 'a' ;
a	b	c	d	e
2	xxxc	xxxb	xxxb	xxxb
3	xxxb	xxxc	xxxc	xxxc
4	xxxa	xxxa	xxxa	xxxa
7	zxxx	zxxx	zxxx	zxxx
8	axxx	axxx	axxx	axxx
SELECT * FROM t1 WHERE b NOT like '%xxx%' ;
a	b	c	d	e
1	aaaa	aaaa	aaaa	aaaa
5	zzzz	zzzz	zzzz	zzzz
9	zaaz	zaaz	zaaz	zaaz
10	zbbz	zbbz	zbbz	zbbz
SELECT * FROM t1 WHERE b NOT like '%xxx%' ESCAPE 'x' ;
a	b	c	d	e
1	aaaa	aaaa	aaaa	aaaa
2	xxxc	xxxb	xxxb	xxxb
3	xxxb	xxxc	xxxc	xxxc
4	xxxa	xxxa	xxxa	xxxa
5	zzzz	zzzz	zzzz	zzzz
7	zxxx	zxxx	zxxx	zxxx
8	axxx	axxx	axxx	axxx
9	zaaz	zaaz	zaaz	zaaz
10	zbbz	zbbz	zbbz	zbbz
SELECT * FROM t1 WHERE b NOT like '%xxx%' ESCAPE 'a' ;
a	b	c	d	e
1	aaaa	aaaa	aaaa	aaaa
5	zzzz	zzzz	zzzz	zzzz
9	zaaz	zaaz	zaaz	zaaz
10	zbbz	zbbz	zbbz	zbbz
-- col_str1 [NOT] LIKE ‘%xxx’ [ESCAPE col_str3]
SELECT * FROM t1 WHERE b like '%xxx' ;
a	b	c	d	e
7	zxxx	zxxx	zxxx	zxxx
8	axxx	axxx	axxx	axxx
SELECT * FROM t1 WHERE b like '%xxx' ESCAPE 'x' ;
a	b	c	d	e
7	zxxx	zxxx	zxxx	zxxx
8	axxx	axxx	axxx	axxx
SELECT * FROM t1 WHERE b like '%xxx' ESCAPE 'a' ;
a	b	c	d	e
7	zxxx	zxxx	zxxx	zxxx
8	axxx	axxx	axxx	axxx
SELECT * FROM t1 WHERE b NOT like '_xxx' ;
a	b	c	d	e
1	aaaa	aaaa	aaaa	aaaa
2	xxxc	xxxb	xxxb	xxxb
3	xxxb	xxxc	xxxc	xxxc
4	xxxa	xxxa	xxxa	xxxa
5	zzzz	zzzz	zzzz	zzzz
9	zaaz	zaaz	zaaz	zaaz
10	zbbz	zbbz	zbbz	zbbz
SELECT * FROM t1 WHERE b NOT like '_xxx' ESCAPE 'x' ;
a	b	c	d	e
1	aaaa	aaaa	aaaa	aaaa
2	xxxc	xxxb	xxxb	xxxb
3	xxxb	xxxc	xxxc	xxxc
4	xxxa	xxxa	xxxa	xxxa
5	zzzz	zzzz	zzzz	zzzz
7	zxxx	zxxx	zxxx	zxxx
8	axxx	axxx	axxx	axxx
9	zaaz	zaaz	zaaz	zaaz
10	zbbz	zbbz	zbbz	zbbz
SELECT * FROM t1 WHERE b NOT like '_xxx' ESCAPE 'a' ;
a	b	c	d	e
1	aaaa	aaaa	aaaa	aaaa
2	xxxc	xxxb	xxxb	xxxb
3	xxxb	xxxc	xxxc	xxxc
4	xxxa	xxxa	xxxa	xxxa
5	zzzz	zzzz	zzzz	zzzz
9	zaaz	zaaz	zaaz	zaaz
10	zbbz	zbbz	zbbz	zbbz
-- col_str1 [NOT] LIKE ‘xxx_’ [ESCAPE col_str3]
SELECT * FROM t1 WHERE b like 'xxx_' ;
a	b	c	d	e
2	xxxc	xxxb	xxxb	xxxb
3	xxxb	xxxc	xxxc	xxxc
4	xxxa	xxxa	xxxa	xxxa
SELECT * FROM t1 WHERE b like 'xxx_' ESCAPE 'x' ;
a	b	c	d	e
SELECT * FROM t1 WHERE b like 'xxx_' ESCAPE 'a' ;
a	b	c	d	e
2	xxxc	xxxb	xxxb	xxxb
3	xxxb	xxxc	xxxc	xxxc
4	xxxa	xxxa	xxxa	xxxa
SELECT * FROM t1 WHERE b NOT like 'xxx_' ;
a	b	c	d	e
1	aaaa	aaaa	aaaa	aaaa
5	zzzz	zzzz	zzzz	zzzz
7	zxxx	zxxx	zxxx	zxxx
8	axxx	axxx	axxx	axxx
9	zaaz	zaaz	zaaz	zaaz
10	zbbz	zbbz	zbbz	zbbz
SELECT * FROM t1 WHERE b NOT like 'xxx_' ESCAPE 'x' ;
a	b	c	d	e
1	aaaa	aaaa	aaaa	aaaa
2	xxxc	xxxb	xxxb	xxxb
3	xxxb	xxxc	xxxc	xxxc
4	xxxa	xxxa	xxxa	xxxa
5	zzzz	zzzz	zzzz	zzzz
7	zxxx	zxxx	zxxx	zxxx
8	axxx	axxx	axxx	axxx
9	zaaz	zaaz	zaaz	zaaz
10	zbbz	zbbz	zbbz	zbbz
SELECT * FROM t1 WHERE b NOT like 'xxx_' ESCAPE 'a' ;
a	b	c	d	e
1	aaaa	aaaa	aaaa	aaaa
5	zzzz	zzzz	zzzz	zzzz
7	zxxx	zxxx	zxxx	zxxx
8	axxx	axxx	axxx	axxx
9	zaaz	zaaz	zaaz	zaaz
10	zbbz	zbbz	zbbz	zbbz
-- col_str1 [NOT] LIKE ‘_xxx_’ [ESCAPE col_str3]
SELECT * FROM t1 WHERE b like '_xxx_' ;
a	b	c	d	e
SELECT * FROM t1 WHERE b like '_xxx_' ESCAPE 'x' ;
a	b	c	d	e
SELECT * FROM t1 WHERE b like '_xxx_' ESCAPE 'a' ;
a	b	c	d	e
SELECT * FROM t1 WHERE b NOT like '_xxx_' ;
a	b	c	d	e
1	aaaa	aaaa	aaaa	aaaa
2	xxxc	xxxb	xxxb	xxxb
3	xxxb	xxxc	xxxc	xxxc
4	xxxa	xxxa	xxxa	xxxa
5	zzzz	zzzz	zzzz	zzzz
7	zxxx	zxxx	zxxx	zxxx
8	axxx	axxx	axxx	axxx
9	zaaz	zaaz	zaaz	zaaz
10	zbbz	zbbz	zbbz	zbbz
SELECT * FROM t1 WHERE b NOT like '_xxx_' ESCAPE 'x' ;
a	b	c	d	e
1	aaaa	aaaa	aaaa	aaaa
2	xxxc	xxxb	xxxb	xxxb
3	xxxb	xxxc	xxxc	xxxc
4	xxxa	xxxa	xxxa	xxxa
5	zzzz	zzzz	zzzz	zzzz
7	zxxx	zxxx	zxxx	zxxx
8	axxx	axxx	axxx	axxx
9	zaaz	zaaz	zaaz	zaaz
10	zbbz	zbbz	zbbz	zbbz
SELECT * FROM t1 WHERE b NOT like '_xxx_' ESCAPE 'a' ;
a	b	c	d	e
1	aaaa	aaaa	aaaa	aaaa
2	xxxc	xxxb	xxxb	xxxb
3	xxxb	xxxc	xxxc	xxxc
4	xxxa	xxxa	xxxa	xxxa
5	zzzz	zzzz	zzzz	zzzz
7	zxxx	zxxx	zxxx	zxxx
8	axxx	axxx	axxx	axxx
9	zaaz	zaaz	zaaz	zaaz
10	zbbz	zbbz	zbbz	zbbz
-- col_str1 [NOT] LIKE ‘_xxx’ [ESCAPE col_str3]
SELECT * FROM t1 WHERE b like '_xxx' ;
a	b	c	d	e
7	zxxx	zxxx	zxxx	zxxx
8	axxx	axxx	axxx	axxx
SELECT * FROM t1 WHERE b like '_xxx' ESCAPE 'x' ;
a	b	c	d	e
SELECT * FROM t1 WHERE b like '_xxx' ESCAPE 'a' ;
a	b	c	d	e
7	zxxx	zxxx	zxxx	zxxx
8	axxx	axxx	axxx	axxx
SELECT * FROM t1 WHERE b NOT like '_xxx' ;
a	b	c	d	e
1	aaaa	aaaa	aaaa	aaaa
2	xxxc	xxxb	xxxb	xxxb
3	xxxb	xxxc	xxxc	xxxc
4	xxxa	xxxa	xxxa	xxxa
5	zzzz	zzzz	zzzz	zzzz
9	zaaz	zaaz	zaaz	zaaz
10	zbbz	zbbz	zbbz	zbbz
SELECT * FROM t1 WHERE b NOT like '_xxx' ESCAPE 'x' ;
a	b	c	d	e
1	aaaa	aaaa	aaaa	aaaa
2	xxxc	xxxb	xxxb	xxxb
3	xxxb	xxxc	xxxc	xxxc
4	xxxa	xxxa	xxxa	xxxa
5	zzzz	zzzz	zzzz	zzzz
7	zxxx	zxxx	zxxx	zxxx
8	axxx	axxx	axxx	axxx
9	zaaz	zaaz	zaaz	zaaz
10	zbbz	zbbz	zbbz	zbbz
SELECT * FROM t1 WHERE b NOT like '_xxx' ESCAPE 'a' ;
a	b	c	d	e
1	aaaa	aaaa	aaaa	aaaa
2	xxxc	xxxb	xxxb	xxxb
3	xxxb	xxxc	xxxc	xxxc
4	xxxa	xxxa	xxxa	xxxa
5	zzzz	zzzz	zzzz	zzzz
9	zaaz	zaaz	zaaz	zaaz
10	zbbz	zbbz	zbbz	zbbz
-- col_str1 [NOT] LIKE ‘_xxx%’ [ESCAPE col_str3]
SELECT * FROM t1 WHERE b like '_xxx%' ;
a	b	c	d	e
7	zxxx	zxxx	zxxx	zxxx
8	axxx	axxx	axxx	axxx
SELECT * FROM t1 WHERE b like '_xxx%' ESCAPE 'x' ;
a	b	c	d	e
SELECT * FROM t1 WHERE b like '_xxx%' ESCAPE 'a' ;
a	b	c	d	e
7	zxxx	zxxx	zxxx	zxxx
8	axxx	axxx	axxx	axxx
SELECT * FROM t1 WHERE b NOT like '_xxx%' ;
a	b	c	d	e
1	aaaa	aaaa	aaaa	aaaa
2	xxxc	xxxb	xxxb	xxxb
3	xxxb	xxxc	xxxc	xxxc
4	xxxa	xxxa	xxxa	xxxa
5	zzzz	zzzz	zzzz	zzzz
9	zaaz	zaaz	zaaz	zaaz
10	zbbz	zbbz	zbbz	zbbz
SELECT * FROM t1 WHERE b NOT like '_xxx%' ESCAPE 'x' ;
a	b	c	d	e
1	aaaa	aaaa	aaaa	aaaa
2	xxxc	xxxb	xxxb	xxxb
3	xxxb	xxxc	xxxc	xxxc
4	xxxa	xxxa	xxxa	xxxa
5	zzzz	zzzz	zzzz	zzzz
7	zxxx	zxxx	zxxx	zxxx
8	axxx	axxx	axxx	axxx
9	zaaz	zaaz	zaaz	zaaz
10	zbbz	zbbz	zbbz	zbbz
SELECT * FROM t1 WHERE b NOT like '_xxx%' ESCAPE 'a' ;
a	b	c	d	e
1	aaaa	aaaa	aaaa	aaaa
2	xxxc	xxxb	xxxb	xxxb
3	xxxb	xxxc	xxxc	xxxc
4	xxxa	xxxa	xxxa	xxxa
5	zzzz	zzzz	zzzz	zzzz
9	zaaz	zaaz	zaaz	zaaz
10	zbbz	zbbz	zbbz	zbbz
-- col_str1 [NOT] LIKE ‘%xxx_’ [ESCAPE col_str3]
SELECT * FROM t1 WHERE b like '%xxx_' ;
a	b	c	d	e
2	xxxc	xxxb	xxxb	xxxb
3	xxxb	xxxc	xxxc	xxxc
4	xxxa	xxxa	xxxa	xxxa
SELECT * FROM t1 WHERE b like '%xxx_' ESCAPE 'x' ;
a	b	c	d	e
SELECT * FROM t1 WHERE b like '%xxx_' ESCAPE 'a' ;
a	b	c	d	e
2	xxxc	xxxb	xxxb	xxxb
3	xxxb	xxxc	xxxc	xxxc
4	xxxa	xxxa	xxxa	xxxa
SELECT * FROM t1 WHERE b NOT like '%xxx_' ;
a	b	c	d	e
1	aaaa	aaaa	aaaa	aaaa
5	zzzz	zzzz	zzzz	zzzz
7	zxxx	zxxx	zxxx	zxxx
8	axxx	axxx	axxx	axxx
9	zaaz	zaaz	zaaz	zaaz
10	zbbz	zbbz	zbbz	zbbz
SELECT * FROM t1 WHERE b NOT like '%xxx_' ESCAPE 'x' ;
a	b	c	d	e
1	aaaa	aaaa	aaaa	aaaa
2	xxxc	xxxb	xxxb	xxxb
3	xxxb	xxxc	xxxc	xxxc
4	xxxa	xxxa	xxxa	xxxa
5	zzzz	zzzz	zzzz	zzzz
7	zxxx	zxxx	zxxx	zxxx
8	axxx	axxx	axxx	axxx
9	zaaz	zaaz	zaaz	zaaz
10	zbbz	zbbz	zbbz	zbbz
SELECT * FROM t1 WHERE b NOT like '%xxx_' ESCAPE 'a' ;
a	b	c	d	e
1	aaaa	aaaa	aaaa	aaaa
5	zzzz	zzzz	zzzz	zzzz
7	zxxx	zxxx	zxxx	zxxx
8	axxx	axxx	axxx	axxx
9	zaaz	zaaz	zaaz	zaaz
10	zbbz	zbbz	zbbz	zbbz
-- col_str1 [NOT] LIKE ‘_x_x_’ [ESCAPE col_str3]
SELECT * FROM t1 WHERE b like '_x_x_' ;
a	b	c	d	e
SELECT * FROM t1 WHERE b like '_x_x_' ESCAPE 'x' ;
a	b	c	d	e
SELECT * FROM t1 WHERE b like '_x_x_' ESCAPE 'a' ;
a	b	c	d	e
SELECT * FROM t1 WHERE b NOT like '_x_x_' ;
a	b	c	d	e
1	aaaa	aaaa	aaaa	aaaa
2	xxxc	xxxb	xxxb	xxxb
3	xxxb	xxxc	xxxc	xxxc
4	xxxa	xxxa	xxxa	xxxa
5	zzzz	zzzz	zzzz	zzzz
7	zxxx	zxxx	zxxx	zxxx
8	axxx	axxx	axxx	axxx
9	zaaz	zaaz	zaaz	zaaz
10	zbbz	zbbz	zbbz	zbbz
SELECT * FROM t1 WHERE b NOT like '_x_x_' ESCAPE 'x' ;
a	b	c	d	e
1	aaaa	aaaa	aaaa	aaaa
2	xxxc	xxxb	xxxb	xxxb
3	xxxb	xxxc	xxxc	xxxc
4	xxxa	xxxa	xxxa	xxxa
5	zzzz	zzzz	zzzz	zzzz
7	zxxx	zxxx	zxxx	zxxx
8	axxx	axxx	axxx	axxx
9	zaaz	zaaz	zaaz	zaaz
10	zbbz	zbbz	zbbz	zbbz
SELECT * FROM t1 WHERE b NOT like '_x_x_' ESCAPE 'a' ;
a	b	c	d	e
1	aaaa	aaaa	aaaa	aaaa
2	xxxc	xxxb	xxxb	xxxb
3	xxxb	xxxc	xxxc	xxxc
4	xxxa	xxxa	xxxa	xxxa
5	zzzz	zzzz	zzzz	zzzz
7	zxxx	zxxx	zxxx	zxxx
8	axxx	axxx	axxx	axxx
9	zaaz	zaaz	zaaz	zaaz
10	zbbz	zbbz	zbbz	zbbz
-- col_str1 [NOT] LIKE ‘_x_x%’ [ESCAPE col_str3]
SELECT * FROM t1 WHERE b like '_x_x%' ;
a	b	c	d	e
7	zxxx	zxxx	zxxx	zxxx
8	axxx	axxx	axxx	axxx
SELECT * FROM t1 WHERE b like '_x_x%' ESCAPE 'x' ;
a	b	c	d	e
SELECT * FROM t1 WHERE b like '_x_x%' ESCAPE 'a' ;
a	b	c	d	e
7	zxxx	zxxx	zxxx	zxxx
8	axxx	axxx	axxx	axxx
SELECT * FROM t1 WHERE b NOT like '_x_x%' ;
a	b	c	d	e
1	aaaa	aaaa	aaaa	aaaa
2	xxxc	xxxb	xxxb	xxxb
3	xxxb	xxxc	xxxc	xxxc
4	xxxa	xxxa	xxxa	xxxa
5	zzzz	zzzz	zzzz	zzzz
9	zaaz	zaaz	zaaz	zaaz
10	zbbz	zbbz	zbbz	zbbz
SELECT * FROM t1 WHERE b NOT like '_x_x%' ESCAPE 'x' ;
a	b	c	d	e
1	aaaa	aaaa	aaaa	aaaa
2	xxxc	xxxb	xxxb	xxxb
3	xxxb	xxxc	xxxc	xxxc
4	xxxa	xxxa	xxxa	xxxa
5	zzzz	zzzz	zzzz	zzzz
7	zxxx	zxxx	zxxx	zxxx
8	axxx	axxx	axxx	axxx
9	zaaz	zaaz	zaaz	zaaz
10	zbbz	zbbz	zbbz	zbbz
SELECT * FROM t1 WHERE b NOT like '_x_x%' ESCAPE 'a' ;
a	b	c	d	e
1	aaaa	aaaa	aaaa	aaaa
2	xxxc	xxxb	xxxb	xxxb
3	xxxb	xxxc	xxxc	xxxc
4	xxxa	xxxa	xxxa	xxxa
5	zzzz	zzzz	zzzz	zzzz
9	zaaz	zaaz	zaaz	zaaz
10	zbbz	zbbz	zbbz	zbbz
-- col_str1 [NOT] LIKE ‘_x%x_’ [ESCAPE col_str3]
SELECT * FROM t1 WHERE b like '_x%x_' ;
a	b	c	d	e
2	xxxc	xxxb	xxxb	xxxb
3	xxxb	xxxc	xxxc	xxxc
4	xxxa	xxxa	xxxa	xxxa
7	zxxx	zxxx	zxxx	zxxx
8	axxx	axxx	axxx	axxx
SELECT * FROM t1 WHERE b like '_x%x_' ESCAPE 'x' ;
a	b	c	d	e
SELECT * FROM t1 WHERE b like '_x%x_' ESCAPE 'a' ;
a	b	c	d	e
2	xxxc	xxxb	xxxb	xxxb
3	xxxb	xxxc	xxxc	xxxc
4	xxxa	xxxa	xxxa	xxxa
7	zxxx	zxxx	zxxx	zxxx
8	axxx	axxx	axxx	axxx
SELECT * FROM t1 WHERE b NOT like '_x%x_' ;
a	b	c	d	e
1	aaaa	aaaa	aaaa	aaaa
5	zzzz	zzzz	zzzz	zzzz
9	zaaz	zaaz	zaaz	zaaz
10	zbbz	zbbz	zbbz	zbbz
SELECT * FROM t1 WHERE b NOT like '_x%x_' ESCAPE 'x' ;
a	b	c	d	e
1	aaaa	aaaa	aaaa	aaaa
2	xxxc	xxxb	xxxb	xxxb
3	xxxb	xxxc	xxxc	xxxc
4	xxxa	xxxa	xxxa	xxxa
5	zzzz	zzzz	zzzz	zzzz
7	zxxx	zxxx	zxxx	zxxx
8	axxx	axxx	axxx	axxx
9	zaaz	zaaz	zaaz	zaaz
10	zbbz	zbbz	zbbz	zbbz
SELECT * FROM t1 WHERE b NOT like '_x%x_' ESCAPE 'a' ;
a	b	c	d	e
1	aaaa	aaaa	aaaa	aaaa
5	zzzz	zzzz	zzzz	zzzz
9	zaaz	zaaz	zaaz	zaaz
10	zbbz	zbbz	zbbz	zbbz
-- col_str1 [NOT] LIKE ‘_x%x%’ [ESCAPE col_str3]
SELECT * FROM t1 WHERE b like '_x%x%' ;
a	b	c	d	e
2	xxxc	xxxb	xxxb	xxxb
3	xxxb	xxxc	xxxc	xxxc
4	xxxa	xxxa	xxxa	xxxa
7	zxxx	zxxx	zxxx	zxxx
8	axxx	axxx	axxx	axxx
SELECT * FROM t1 WHERE b like '_x%x%' ESCAPE 'x' ;
a	b	c	d	e
SELECT * FROM t1 WHERE b like '_x%x%' ESCAPE 'a' ;
a	b	c	d	e
2	xxxc	xxxb	xxxb	xxxb
3	xxxb	xxxc	xxxc	xxxc
4	xxxa	xxxa	xxxa	xxxa
7	zxxx	zxxx	zxxx	zxxx
8	axxx	axxx	axxx	axxx
SELECT * FROM t1 WHERE b NOT like '_x%x%' ;
a	b	c	d	e
1	aaaa	aaaa	aaaa	aaaa
5	zzzz	zzzz	zzzz	zzzz
9	zaaz	zaaz	zaaz	zaaz
10	zbbz	zbbz	zbbz	zbbz
SELECT * FROM t1 WHERE b NOT like '_x%x%' ESCAPE 'x' ;
a	b	c	d	e
1	aaaa	aaaa	aaaa	aaaa
2	xxxc	xxxb	xxxb	xxxb
3	xxxb	xxxc	xxxc	xxxc
4	xxxa	xxxa	xxxa	xxxa
5	zzzz	zzzz	zzzz	zzzz
7	zxxx	zxxx	zxxx	zxxx
8	axxx	axxx	axxx	axxx
9	zaaz	zaaz	zaaz	zaaz
10	zbbz	zbbz	zbbz	zbbz
SELECT * FROM t1 WHERE b NOT like '_x%x%' ESCAPE 'a' ;
a	b	c	d	e
1	aaaa	aaaa	aaaa	aaaa
5	zzzz	zzzz	zzzz	zzzz
9	zaaz	zaaz	zaaz	zaaz
10	zbbz	zbbz	zbbz	zbbz
-- col_str1 [NOT] LIKE ‘%x_x_’ [ESCAPE col_str3]
SELECT * FROM t1 WHERE b like '%x_x_' ;
a	b	c	d	e
2	xxxc	xxxb	xxxb	xxxb
3	xxxb	xxxc	xxxc	xxxc
4	xxxa	xxxa	xxxa	xxxa
SELECT * FROM t1 WHERE b like '%x_x_' ESCAPE 'x' ;
a	b	c	d	e
SELECT * FROM t1 WHERE b like '%x_x_' ESCAPE 'a' ;
a	b	c	d	e
2	xxxc	xxxb	xxxb	xxxb
3	xxxb	xxxc	xxxc	xxxc
4	xxxa	xxxa	xxxa	xxxa
SELECT * FROM t1 WHERE b NOT like '%x_x_' ;
a	b	c	d	e
1	aaaa	aaaa	aaaa	aaaa
5	zzzz	zzzz	zzzz	zzzz
7	zxxx	zxxx	zxxx	zxxx
8	axxx	axxx	axxx	axxx
9	zaaz	zaaz	zaaz	zaaz
10	zbbz	zbbz	zbbz	zbbz
SELECT * FROM t1 WHERE b NOT like '%x_x_' ESCAPE 'x' ;
a	b	c	d	e
1	aaaa	aaaa	aaaa	aaaa
2	xxxc	xxxb	xxxb	xxxb
3	xxxb	xxxc	xxxc	xxxc
4	xxxa	xxxa	xxxa	xxxa
5	zzzz	zzzz	zzzz	zzzz
7	zxxx	zxxx	zxxx	zxxx
8	axxx	axxx	axxx	axxx
9	zaaz	zaaz	zaaz	zaaz
10	zbbz	zbbz	zbbz	zbbz
SELECT * FROM t1 WHERE b NOT like '%x_x_' ESCAPE 'a' ;
a	b	c	d	e
1	aaaa	aaaa	aaaa	aaaa
5	zzzz	zzzz	zzzz	zzzz
7	zxxx	zxxx	zxxx	zxxx
8	axxx	axxx	axxx	axxx
9	zaaz	zaaz	zaaz	zaaz
10	zbbz	zbbz	zbbz	zbbz
-- col_str1 [NOT] LIKE ‘%x_x%’ [ESCAPE col_str3]
SELECT * FROM t1 WHERE b like '%x_x%' ;
a	b	c	d	e
2	xxxc	xxxb	xxxb	xxxb
3	xxxb	xxxc	xxxc	xxxc
4	xxxa	xxxa	xxxa	xxxa
7	zxxx	zxxx	zxxx	zxxx
8	axxx	axxx	axxx	axxx
SELECT * FROM t1 WHERE b like '%x_x%' ESCAPE 'x' ;
a	b	c	d	e
SELECT * FROM t1 WHERE b like '%x_x%' ESCAPE 'a' ;
a	b	c	d	e
2	xxxc	xxxb	xxxb	xxxb
3	xxxb	xxxc	xxxc	xxxc
4	xxxa	xxxa	xxxa	xxxa
7	zxxx	zxxx	zxxx	zxxx
8	axxx	axxx	axxx	axxx
SELECT * FROM t1 WHERE b NOT like '%x_x%' ;
a	b	c	d	e
1	aaaa	aaaa	aaaa	aaaa
5	zzzz	zzzz	zzzz	zzzz
9	zaaz	zaaz	zaaz	zaaz
10	zbbz	zbbz	zbbz	zbbz
SELECT * FROM t1 WHERE b NOT like '%x_x%' ESCAPE 'x' ;
a	b	c	d	e
1	aaaa	aaaa	aaaa	aaaa
2	xxxc	xxxb	xxxb	xxxb
3	xxxb	xxxc	xxxc	xxxc
4	xxxa	xxxa	xxxa	xxxa
5	zzzz	zzzz	zzzz	zzzz
7	zxxx	zxxx	zxxx	zxxx
8	axxx	axxx	axxx	axxx
9	zaaz	zaaz	zaaz	zaaz
10	zbbz	zbbz	zbbz	zbbz
SELECT * FROM t1 WHERE b NOT like '%x_x%' ESCAPE 'a' ;
a	b	c	d	e
1	aaaa	aaaa	aaaa	aaaa
5	zzzz	zzzz	zzzz	zzzz
9	zaaz	zaaz	zaaz	zaaz
10	zbbz	zbbz	zbbz	zbbz
-- col_str1 [NOT] LIKE ‘%x%x_’ [ESCAPE col_str3]
SELECT * FROM t1 WHERE b like '%x%x_' ;
a	b	c	d	e
2	xxxc	xxxb	xxxb	xxxb
3	xxxb	xxxc	xxxc	xxxc
4	xxxa	xxxa	xxxa	xxxa
7	zxxx	zxxx	zxxx	zxxx
8	axxx	axxx	axxx	axxx
SELECT * FROM t1 WHERE b like '%x%x_' ESCAPE 'x' ;
a	b	c	d	e
SELECT * FROM t1 WHERE b like '%x%x_' ESCAPE 'a' ;
a	b	c	d	e
2	xxxc	xxxb	xxxb	xxxb
3	xxxb	xxxc	xxxc	xxxc
4	xxxa	xxxa	xxxa	xxxa
7	zxxx	zxxx	zxxx	zxxx
8	axxx	axxx	axxx	axxx
SELECT * FROM t1 WHERE b NOT like '%x%x_' ;
a	b	c	d	e
1	aaaa	aaaa	aaaa	aaaa
5	zzzz	zzzz	zzzz	zzzz
9	zaaz	zaaz	zaaz	zaaz
10	zbbz	zbbz	zbbz	zbbz
SELECT * FROM t1 WHERE b NOT like '%x%x_' ESCAPE 'x' ;
a	b	c	d	e
1	aaaa	aaaa	aaaa	aaaa
2	xxxc	xxxb	xxxb	xxxb
3	xxxb	xxxc	xxxc	xxxc
4	xxxa	xxxa	xxxa	xxxa
5	zzzz	zzzz	zzzz	zzzz
7	zxxx	zxxx	zxxx	zxxx
8	axxx	axxx	axxx	axxx
9	zaaz	zaaz	zaaz	zaaz
10	zbbz	zbbz	zbbz	zbbz
SELECT * FROM t1 WHERE b NOT like '%x%x_' ESCAPE 'a' ;
a	b	c	d	e
1	aaaa	aaaa	aaaa	aaaa
5	zzzz	zzzz	zzzz	zzzz
9	zaaz	zaaz	zaaz	zaaz
10	zbbz	zbbz	zbbz	zbbz
-- col_str1 [NOT] LIKE ‘%x%x%’ [ESCAPE col_str3]
SELECT * FROM t1 WHERE b like '%x%x%' ;
a	b	c	d	e
2	xxxc	xxxb	xxxb	xxxb
3	xxxb	xxxc	xxxc	xxxc
4	xxxa	xxxa	xxxa	xxxa
7	zxxx	zxxx	zxxx	zxxx
8	axxx	axxx	axxx	axxx
SELECT * FROM t1 WHERE b like '%x%x%' ESCAPE 'x' ;
a	b	c	d	e
SELECT * FROM t1 WHERE b like '%x%x%' ESCAPE 'a' ;
a	b	c	d	e
2	xxxc	xxxb	xxxb	xxxb
3	xxxb	xxxc	xxxc	xxxc
4	xxxa	xxxa	xxxa	xxxa
7	zxxx	zxxx	zxxx	zxxx
8	axxx	axxx	axxx	axxx
SELECT * FROM t1 WHERE b NOT like '%x%x%' ;
a	b	c	d	e
1	aaaa	aaaa	aaaa	aaaa
5	zzzz	zzzz	zzzz	zzzz
9	zaaz	zaaz	zaaz	zaaz
10	zbbz	zbbz	zbbz	zbbz
SELECT * FROM t1 WHERE b NOT like '%x%x%' ESCAPE 'x' ;
a	b	c	d	e
1	aaaa	aaaa	aaaa	aaaa
2	xxxc	xxxb	xxxb	xxxb
3	xxxb	xxxc	xxxc	xxxc
4	xxxa	xxxa	xxxa	xxxa
5	zzzz	zzzz	zzzz	zzzz
7	zxxx	zxxx	zxxx	zxxx
8	axxx	axxx	axxx	axxx
9	zaaz	zaaz	zaaz	zaaz
10	zbbz	zbbz	zbbz	zbbz
SELECT * FROM t1 WHERE b NOT like '%x%x%' ESCAPE 'a' ;
a	b	c	d	e
1	aaaa	aaaa	aaaa	aaaa
5	zzzz	zzzz	zzzz	zzzz
9	zaaz	zaaz	zaaz	zaaz
10	zbbz	zbbz	zbbz	zbbz
-- NULL [NOT] LIKE col_str2 [ESCAPE col_str3]
SELECT * FROM t1 WHERE NULL like 'xxx%' ;
a	b	c	d	e
SELECT * FROM t1 WHERE NULL like 'xxx%' ESCAPE 'x' ;
a	b	c	d	e
SELECT * FROM t1 WHERE NULL like 'xxx%' ESCAPE 'a' ;
a	b	c	d	e
SELECT * FROM t1 WHERE NULL NOT like 'xxx%' ;
a	b	c	d	e
SELECT * FROM t1 WHERE NULL NOT like 'xxx%' ESCAPE 'x' ;
a	b	c	d	e
SELECT * FROM t1 WHERE NULL NOT like 'xxx%' ESCAPE 'a' ;
a	b	c	d	e
-- col_str1 [NOT] LIKE ‘NULL’ [ESCAPE col_str3]
SELECT * FROM t1 WHERE b like NULL ;
a	b	c	d	e
SELECT * FROM t1 WHERE b like NULL ESCAPE 'x' ;
a	b	c	d	e
SELECT * FROM t1 WHERE b like NULL ESCAPE 'a' ;
a	b	c	d	e
SELECT * FROM t1 WHERE b NOT like NULL ;
a	b	c	d	e
SELECT * FROM t1 WHERE b NOT like NULL ESCAPE 'x' ;
a	b	c	d	e
SELECT * FROM t1 WHERE b NOT like NULL ESCAPE 'a' ;
a	b	c	d	e
-- col_str1 [NOT] LIKE col_str2 [ESCAPE NULL]
SELECT * FROM t1 WHERE b like 'xxx%' ESCAPE NULL ;
a	b	c	d	e
2	xxxc	xxxb	xxxb	xxxb
3	xxxb	xxxc	xxxc	xxxc
4	xxxa	xxxa	xxxa	xxxa
SELECT * FROM t1 WHERE b NOT like 'xxx%' ESCAPE NULL ;
a	b	c	d	e
1	aaaa	aaaa	aaaa	aaaa
5	zzzz	zzzz	zzzz	zzzz
7	zxxx	zxxx	zxxx	zxxx
8	axxx	axxx	axxx	axxx
9	zaaz	zaaz	zaaz	zaaz
10	zbbz	zbbz	zbbz	zbbz
-- col_str1 [NOT] LIKE col_str2 [ESCAPE col_str3]其中col_str1分别为联合索引前缀字段、中间字段、尾部字段
SELECT * FROM t1 WHERE c like 'xxx%' ;
a	b	c	d	e
2	xxxc	xxxb	xxxb	xxxb
3	xxxb	xxxc	xxxc	xxxc
4	xxxa	xxxa	xxxa	xxxa
SELECT * FROM t1 WHERE c like 'xxx%' ESCAPE 'x' ;
a	b	c	d	e
SELECT * FROM t1 WHERE c like 'xxx%' ESCAPE 'a' ;
a	b	c	d	e
4	xxxa	xxxa	xxxa	xxxa
2	xxxc	xxxb	xxxb	xxxb
3	xxxb	xxxc	xxxc	xxxc
SELECT * FROM t1 WHERE c NOT like 'xxx%' ;
a	b	c	d	e
1	aaaa	aaaa	aaaa	aaaa
5	zzzz	zzzz	zzzz	zzzz
7	zxxx	zxxx	zxxx	zxxx
8	axxx	axxx	axxx	axxx
9	zaaz	zaaz	zaaz	zaaz
10	zbbz	zbbz	zbbz	zbbz
SELECT * FROM t1 WHERE c NOT like 'xxx%' ESCAPE 'x' ;
a	b	c	d	e
1	aaaa	aaaa	aaaa	aaaa
2	xxxc	xxxb	xxxb	xxxb
3	xxxb	xxxc	xxxc	xxxc
4	xxxa	xxxa	xxxa	xxxa
5	zzzz	zzzz	zzzz	zzzz
7	zxxx	zxxx	zxxx	zxxx
8	axxx	axxx	axxx	axxx
9	zaaz	zaaz	zaaz	zaaz
10	zbbz	zbbz	zbbz	zbbz
SELECT * FROM t1 WHERE c NOT like 'xxx%' ESCAPE 'a' ;
a	b	c	d	e
1	aaaa	aaaa	aaaa	aaaa
5	zzzz	zzzz	zzzz	zzzz
7	zxxx	zxxx	zxxx	zxxx
8	axxx	axxx	axxx	axxx
9	zaaz	zaaz	zaaz	zaaz
10	zbbz	zbbz	zbbz	zbbz
SELECT * FROM t1 WHERE d like 'xxx%' ;
a	b	c	d	e
2	xxxc	xxxb	xxxb	xxxb
3	xxxb	xxxc	xxxc	xxxc
4	xxxa	xxxa	xxxa	xxxa
6	NULL	NULL	xxxa	xxxa
SELECT * FROM t1 WHERE d like 'xxx%' ESCAPE 'x' ;
a	b	c	d	e
SELECT * FROM t1 WHERE d like 'xxx%' ESCAPE 'a' ;
a	b	c	d	e
2	xxxc	xxxb	xxxb	xxxb
3	xxxb	xxxc	xxxc	xxxc
4	xxxa	xxxa	xxxa	xxxa
6	NULL	NULL	xxxa	xxxa
SELECT * FROM t1 WHERE d NOT like 'xxx%' ;
a	b	c	d	e
1	aaaa	aaaa	aaaa	aaaa
5	zzzz	zzzz	zzzz	zzzz
7	zxxx	zxxx	zxxx	zxxx
8	axxx	axxx	axxx	axxx
9	zaaz	zaaz	zaaz	zaaz
10	zbbz	zbbz	zbbz	zbbz
SELECT * FROM t1 WHERE d NOT like 'xxx%' ESCAPE 'x' ;
a	b	c	d	e
1	aaaa	aaaa	aaaa	aaaa
2	xxxc	xxxb	xxxb	xxxb
3	xxxb	xxxc	xxxc	xxxc
4	xxxa	xxxa	xxxa	xxxa
5	zzzz	zzzz	zzzz	zzzz
6	NULL	NULL	xxxa	xxxa
7	zxxx	zxxx	zxxx	zxxx
8	axxx	axxx	axxx	axxx
9	zaaz	zaaz	zaaz	zaaz
10	zbbz	zbbz	zbbz	zbbz
SELECT * FROM t1 WHERE d NOT like 'xxx%' ESCAPE 'a' ;
a	b	c	d	e
1	aaaa	aaaa	aaaa	aaaa
5	zzzz	zzzz	zzzz	zzzz
7	zxxx	zxxx	zxxx	zxxx
8	axxx	axxx	axxx	axxx
9	zaaz	zaaz	zaaz	zaaz
10	zbbz	zbbz	zbbz	zbbz
SELECT * FROM t1 WHERE e like 'xxx%' ;
a	b	c	d	e
2	xxxc	xxxb	xxxb	xxxb
3	xxxb	xxxc	xxxc	xxxc
4	xxxa	xxxa	xxxa	xxxa
6	NULL	NULL	xxxa	xxxa
SELECT * FROM t1 WHERE e like 'xxx%' ESCAPE 'x' ;
a	b	c	d	e
SELECT * FROM t1 WHERE e like 'xxx%' ESCAPE 'a' ;
a	b	c	d	e
2	xxxc	xxxb	xxxb	xxxb
3	xxxb	xxxc	xxxc	xxxc
4	xxxa	xxxa	xxxa	xxxa
6	NULL	NULL	xxxa	xxxa
SELECT * FROM t1 WHERE e NOT like 'xxx%' ;
a	b	c	d	e
1	aaaa	aaaa	aaaa	aaaa
5	zzzz	zzzz	zzzz	zzzz
7	zxxx	zxxx	zxxx	zxxx
8	axxx	axxx	axxx	axxx
9	zaaz	zaaz	zaaz	zaaz
10	zbbz	zbbz	zbbz	zbbz
SELECT * FROM t1 WHERE e NOT like 'xxx%' ESCAPE 'x' ;
a	b	c	d	e
1	aaaa	aaaa	aaaa	aaaa
2	xxxc	xxxb	xxxb	xxxb
3	xxxb	xxxc	xxxc	xxxc
4	xxxa	xxxa	xxxa	xxxa
5	zzzz	zzzz	zzzz	zzzz
6	NULL	NULL	xxxa	xxxa
7	zxxx	zxxx	zxxx	zxxx
8	axxx	axxx	axxx	axxx
9	zaaz	zaaz	zaaz	zaaz
10	zbbz	zbbz	zbbz	zbbz
SELECT * FROM t1 WHERE e NOT like 'xxx%' ESCAPE 'a' ;
a	b	c	d	e
1	aaaa	aaaa	aaaa	aaaa
5	zzzz	zzzz	zzzz	zzzz
7	zxxx	zxxx	zxxx	zxxx
8	axxx	axxx	axxx	axxx
9	zaaz	zaaz	zaaz	zaaz
10	zbbz	zbbz	zbbz	zbbz
-- col_str1||’xxx’ [NOT] LIKE col_str2 [ESCAPE col_str3]
SELECT * FROM t1 WHERE 'xxx'||b like 'xxxxxx%' ;
a	b	c	d	e
SELECT * FROM t1 WHERE 'xxx'||b like 'xxxxxx%' ESCAPE 'x' ;
a	b	c	d	e
2	xxxc	xxxb	xxxb	xxxb
3	xxxb	xxxc	xxxc	xxxc
4	xxxa	xxxa	xxxa	xxxa
SELECT * FROM t1 WHERE 'xxx'||b like 'xxxxxx%' ESCAPE 'a' ;
a	b	c	d	e
SELECT * FROM t1 WHERE 'xxx'||b NOT like 'xxxxxx%' ;
a	b	c	d	e
1	aaaa	aaaa	aaaa	aaaa
2	xxxc	xxxb	xxxb	xxxb
3	xxxb	xxxc	xxxc	xxxc
4	xxxa	xxxa	xxxa	xxxa
5	zzzz	zzzz	zzzz	zzzz
7	zxxx	zxxx	zxxx	zxxx
8	axxx	axxx	axxx	axxx
9	zaaz	zaaz	zaaz	zaaz
10	zbbz	zbbz	zbbz	zbbz
SELECT * FROM t1 WHERE 'xxx'||b NOT like 'xxxxxx%' ESCAPE 'x' ;
a	b	c	d	e
1	aaaa	aaaa	aaaa	aaaa
5	zzzz	zzzz	zzzz	zzzz
7	zxxx	zxxx	zxxx	zxxx
8	axxx	axxx	axxx	axxx
9	zaaz	zaaz	zaaz	zaaz
10	zbbz	zbbz	zbbz	zbbz
SELECT * FROM t1 WHERE 'xxx'||b NOT like 'xxxxxx%' ESCAPE 'a' ;
a	b	c	d	e
1	aaaa	aaaa	aaaa	aaaa
2	xxxc	xxxb	xxxb	xxxb
3	xxxb	xxxc	xxxc	xxxc
4	xxxa	xxxa	xxxa	xxxa
5	zzzz	zzzz	zzzz	zzzz
7	zxxx	zxxx	zxxx	zxxx
8	axxx	axxx	axxx	axxx
9	zaaz	zaaz	zaaz	zaaz
10	zbbz	zbbz	zbbz	zbbz
-- col like col_str2中col_str2是concat、substr、upper、lower等字符串函数的输出
SELECT * FROM t1 WHERE CONCAT(b,'ccc') like 'xxx%' ;
a	b	c	d	e
2	xxxc	xxxb	xxxb	xxxb
3	xxxb	xxxc	xxxc	xxxc
4	xxxa	xxxa	xxxa	xxxa
SELECT * FROM t1 WHERE REPEAT(b,5) like 'xxx%' ESCAPE 'x' ;
a	b	c	d	e
SELECT * FROM t1 WHERE LOWER(b) like 'xxx%' ESCAPE 'a' ;
a	b	c	d	e
2	xxxc	xxxb	xxxb	xxxb
3	xxxb	xxxc	xxxc	xxxc
4	xxxa	xxxa	xxxa	xxxa
SELECT * FROM t1 WHERE SUBSTR(b,1,4) like 'xxx%' ESCAPE 'a' ;
a	b	c	d	e
2	xxxc	xxxb	xxxb	xxxb
3	xxxb	xxxc	xxxc	xxxc
4	xxxa	xxxa	xxxa	xxxa
SELECT * FROM t1 WHERE b like CONCAT('xxx' , '%') ;
a	b	c	d	e
2	xxxc	xxxb	xxxb	xxxb
3	xxxb	xxxc	xxxc	xxxc
4	xxxa	xxxa	xxxa	xxxa
EXPLAIN SELECT * FROM t1 WHERE b like REPEAT('x' , 3) ;
EXPLAIN SELECT * FROM t1 WHERE b like SUBSTR('%xxx%',2,4) ;
EXPLAIN SELECT * FROM t1 WHERE b like UPPER('xxx%') ;
EXPLAIN SELECT * FROM t1 WHERE b like LOWER('XXX%') ;
-- 通过and/or连接多个like表达式
SELECT * FROM t1 WHERE b like 'xxx%' and b like 'yyy%' ;
a	b	c	d	e
SELECT * FROM t1 WHERE b like 'xxx%' ESCAPE 'x' or b like 'xxx%' ;
a	b	c	d	e
2	xxxc	xxxb	xxxb	xxxb
3	xxxb	xxxc	xxxc	xxxc
4	xxxa	xxxa	xxxa	xxxa
SELECT * FROM t1 WHERE b like 'xxx%' ESCAPE 'a' or b like 'xxx%' and b not like 'yyy%' ;
a	b	c	d	e
2	xxxc	xxxb	xxxb	xxxb
3	xxxb	xxxc	xxxc	xxxc
4	xxxa	xxxa	xxxa	xxxa
SELECT * FROM t1 WHERE b != 'xxxx' and b like 'xxx%' ;
a	b	c	d	e
2	xxxc	xxxb	xxxb	xxxb
3	xxxb	xxxc	xxxc	xxxc
4	xxxa	xxxa	xxxa	xxxa
SELECT * FROM t1 WHERE b = 'xxxx' or b like 'xxx%' ;
a	b	c	d	e
2	xxxc	xxxb	xxxb	xxxb
3	xxxb	xxxc	xxxc	xxxc
4	xxxa	xxxa	xxxa	xxxa
-- c1上建索引i1，c2上建索引i2 c1 like '' and c2 = ''
SELECT * FROM t1 WHERE b like 'xxx%' ;
a	b	c	d	e
2	xxxc	xxxb	xxxb	xxxb
3	xxxb	xxxc	xxxc	xxxc
4	xxxa	xxxa	xxxa	xxxa
EXPLAIN SELECT * FROM t1 WHERE c = 'zzzz' ;
SELECT * FROM t1 WHERE b like 'xxx%' and c like 'xxx%' ;
a	b	c	d	e
2	xxxc	xxxb	xxxb	xxxb
3	xxxb	xxxc	xxxc	xxxc
4	xxxa	xxxa	xxxa	xxxa
SELECT * FROM t1 WHERE b like 'xxx%' or c like 'xxx%' ;
a	b	c	d	e
2	xxxc	xxxb	xxxb	xxxb
3	xxxb	xxxc	xxxc	xxxc
4	xxxa	xxxa	xxxa	xxxa
SELECT * FROM t1 WHERE b = 'xxxc' and c like 'xxx%' ;
a	b	c	d	e
2	xxxc	xxxb	xxxb	xxxb
SELECT * FROM t1 WHERE b = 'xxxc' or c like 'xxx%' ;
a	b	c	d	e
2	xxxc	xxxb	xxxb	xxxb
3	xxxb	xxxc	xxxc	xxxc
4	xxxa	xxxa	xxxa	xxxa
SELECT * FROM t1 WHERE b like 'xxx%' and c = 'zzzz' ;
a	b	c	d	e
SELECT * FROM t1 WHERE b like 'xxx%' or c = 'zzzz' ;
a	b	c	d	e
2	xxxc	xxxb	xxxb	xxxb
3	xxxb	xxxc	xxxc	xxxc
4	xxxa	xxxa	xxxa	xxxa
5	zzzz	zzzz	zzzz	zzzz
-- col like 'xxx%'中，col用别名，以及表使用别名
SELECT a,b as b2,c,d,e FROM t1 HAVING b2 like 'xxx%' ;
a	b2	c	d	e
2	xxxc	xxxb	xxxb	xxxb
3	xxxb	xxxc	xxxc	xxxc
4	xxxa	xxxa	xxxa	xxxa
SELECT a,b as b2,c,d,e FROM t1 HAVING b2 like 'xxx%' ESCAPE 'x' ;
a	b2	c	d	e
SELECT a,b as b2,c,d,e FROM t1 HAVING b2 like 'xxx%' ESCAPE 'a' ;
a	b2	c	d	e
4	xxxa	xxxa	xxxa	xxxa
3	xxxb	xxxc	xxxc	xxxc
2	xxxc	xxxb	xxxb	xxxb
SELECT a,b as b2,c,d,e FROM t1 HAVING b2 NOT like 'xxx%' ;
a	b2	c	d	e
1	aaaa	aaaa	aaaa	aaaa
5	zzzz	zzzz	zzzz	zzzz
7	zxxx	zxxx	zxxx	zxxx
8	axxx	axxx	axxx	axxx
9	zaaz	zaaz	zaaz	zaaz
10	zbbz	zbbz	zbbz	zbbz
SELECT a,b as b2,c,d,e FROM t1 HAVING b2 NOT like 'xxx%' ESCAPE 'x' ;
a	b2	c	d	e
1	aaaa	aaaa	aaaa	aaaa
2	xxxc	xxxb	xxxb	xxxb
3	xxxb	xxxc	xxxc	xxxc
4	xxxa	xxxa	xxxa	xxxa
5	zzzz	zzzz	zzzz	zzzz
7	zxxx	zxxx	zxxx	zxxx
8	axxx	axxx	axxx	axxx
9	zaaz	zaaz	zaaz	zaaz
10	zbbz	zbbz	zbbz	zbbz
SELECT a,b as b2,c,d,e FROM t1 HAVING b2 NOT like 'xxx%' ESCAPE 'a' ;
a	b2	c	d	e
1	aaaa	aaaa	aaaa	aaaa
5	zzzz	zzzz	zzzz	zzzz
7	zxxx	zxxx	zxxx	zxxx
8	axxx	axxx	axxx	axxx
9	zaaz	zaaz	zaaz	zaaz
10	zbbz	zbbz	zbbz	zbbz
-- like匹配的字符串中含有特殊字符
SELECT * FROM t1 WHERE b like '\0%' ;
a	b	c	d	e
SELECT * FROM t1 WHERE b like '\t%' ESCAPE 'x' ;
a	b	c	d	e
SELECT * FROM t1 WHERE b like '\n%' ESCAPE 'a' ;
a	b	c	d	e
SELECT * FROM t1 WHERE b NOT like '%%' ;
a	b	c	d	e
SELECT * FROM t1 WHERE b NOT like '_%' ESCAPE 'x' ;
a	b	c	d	e
SELECT * FROM t1 WHERE b NOT like '!%' ESCAPE 'a' ;
a	b	c	d	e
1	aaaa	aaaa	aaaa	aaaa
2	xxxc	xxxb	xxxb	xxxb
3	xxxb	xxxc	xxxc	xxxc
4	xxxa	xxxa	xxxa	xxxa
5	zzzz	zzzz	zzzz	zzzz
7	zxxx	zxxx	zxxx	zxxx
8	axxx	axxx	axxx	axxx
9	zaaz	zaaz	zaaz	zaaz
10	zbbz	zbbz	zbbz	zbbz
-- 匹配字符串偏长的情况
SELECT * FROM t1 WHERE b like 'xxx%%%%%%%%%%%%%%%%%%%%%%%%%%%%%%%%%%%%' ;
a	b	c	d	e
2	xxxc	xxxb	xxxb	xxxb
3	xxxb	xxxc	xxxc	xxxc
4	xxxa	xxxa	xxxa	xxxa
SELECT * FROM t1 WHERE b like 'xxx_%%%%%%%%%%%%%%%%%%%%%%%%%%%%%%%%%%%' ESCAPE 'x' ;
a	b	c	d	e
SELECT * FROM t1 WHERE b like '%%%%%%%%%%%%%%%%%%%%%%%%%%%%%%%%%%%xxx%' ESCAPE 'a' ;
a	b	c	d	e
2	xxxc	xxxb	xxxb	xxxb
3	xxxb	xxxc	xxxc	xxxc
4	xxxa	xxxa	xxxa	xxxa
7	zxxx	zxxx	zxxx	zxxx
8	axxx	axxx	axxx	axxx
SELECT * FROM t1 WHERE b NOT like 'xxyyyyyyyyyyyyyyyyyyyyyyyyyyyyyyyyyyy%' ;
a	b	c	d	e
1	aaaa	aaaa	aaaa	aaaa
2	xxxc	xxxb	xxxb	xxxb
3	xxxb	xxxc	xxxc	xxxc
4	xxxa	xxxa	xxxa	xxxa
5	zzzz	zzzz	zzzz	zzzz
7	zxxx	zxxx	zxxx	zxxx
8	axxx	axxx	axxx	axxx
9	zaaz	zaaz	zaaz	zaaz
10	zbbz	zbbz	zbbz	zbbz
SELECT * FROM t1 WHERE b NOT like 'xxxyyyyyyyyyyyyyyyyyyyyyyyyyyyyyyyyyy%' ESCAPE 'x' ;
a	b	c	d	e
1	aaaa	aaaa	aaaa	aaaa
2	xxxc	xxxb	xxxb	xxxb
3	xxxb	xxxc	xxxc	xxxc
4	xxxa	xxxa	xxxa	xxxa
5	zzzz	zzzz	zzzz	zzzz
7	zxxx	zxxx	zxxx	zxxx
8	axxx	axxx	axxx	axxx
9	zaaz	zaaz	zaaz	zaaz
10	zbbz	zbbz	zbbz	zbbz
SELECT * FROM t1 WHERE b NOT like 'xxxyyyyyyyyyyyyyyyyyyyyyyyyyyyyyyyyyyyy%' ESCAPE 'a' ;
a	b	c	d	e
1	aaaa	aaaa	aaaa	aaaa
2	xxxc	xxxb	xxxb	xxxb
3	xxxb	xxxc	xxxc	xxxc
4	xxxa	xxxa	xxxa	xxxa
5	zzzz	zzzz	zzzz	zzzz
7	zxxx	zxxx	zxxx	zxxx
8	axxx	axxx	axxx	axxx
9	zaaz	zaaz	zaaz	zaaz
10	zbbz	zbbz	zbbz	zbbz
-- 涉及类型转换
SELECT * FROM t1 WHERE a like 'xxx%' ;
a	b	c	d	e
SELECT * FROM t1 WHERE b like 12345 ;
a	b	c	d	e
-- having语句中测试like ‘xxx%’走索引
SELECT * FROM t1 HAVING b like 'xxx%' ;
a	b	c	d	e
2	xxxc	xxxb	xxxb	xxxb
3	xxxb	xxxc	xxxc	xxxc
4	xxxa	xxxa	xxxa	xxxa
SELECT * FROM t1 HAVING b like 'xxx%' ESCAPE 'x' ;
a	b	c	d	e
SELECT * FROM t1 HAVING b like 'xxx%' ESCAPE 'a' ;
a	b	c	d	e
4	xxxa	xxxa	xxxa	xxxa
3	xxxb	xxxc	xxxc	xxxc
2	xxxc	xxxb	xxxb	xxxb
SELECT * FROM t1 HAVING b NOT like 'xxx%' ;
a	b	c	d	e
1	aaaa	aaaa	aaaa	aaaa
5	zzzz	zzzz	zzzz	zzzz
7	zxxx	zxxx	zxxx	zxxx
8	axxx	axxx	axxx	axxx
9	zaaz	zaaz	zaaz	zaaz
10	zbbz	zbbz	zbbz	zbbz
SELECT * FROM t1 HAVING b NOT like 'xxx%' ESCAPE 'x' ;
a	b	c	d	e
1	aaaa	aaaa	aaaa	aaaa
2	xxxc	xxxb	xxxb	xxxb
3	xxxb	xxxc	xxxc	xxxc
4	xxxa	xxxa	xxxa	xxxa
5	zzzz	zzzz	zzzz	zzzz
7	zxxx	zxxx	zxxx	zxxx
8	axxx	axxx	axxx	axxx
9	zaaz	zaaz	zaaz	zaaz
10	zbbz	zbbz	zbbz	zbbz
SELECT * FROM t1 HAVING b NOT like 'xxx%' ESCAPE 'a' ;
a	b	c	d	e
1	aaaa	aaaa	aaaa	aaaa
5	zzzz	zzzz	zzzz	zzzz
7	zxxx	zxxx	zxxx	zxxx
8	axxx	axxx	axxx	axxx
9	zaaz	zaaz	zaaz	zaaz
10	zbbz	zbbz	zbbz	zbbz
-- 边界值测试
SELECT * FROM t1 WHERE b like hex('xxx%') ;
a	b	c	d	e
SELECT * FROM t1 WHERE b like hex('xxx%') ESCAPE 'x' ;
a	b	c	d	e
SELECT * FROM t1 WHERE b like hex('xxx%') ESCAPE 'a' ;
a	b	c	d	e
SELECT * FROM t1 WHERE b NOT like hex('xxx%') ;
a	b	c	d	e
1	aaaa	aaaa	aaaa	aaaa
2	xxxc	xxxb	xxxb	xxxb
3	xxxb	xxxc	xxxc	xxxc
4	xxxa	xxxa	xxxa	xxxa
5	zzzz	zzzz	zzzz	zzzz
7	zxxx	zxxx	zxxx	zxxx
8	axxx	axxx	axxx	axxx
9	zaaz	zaaz	zaaz	zaaz
10	zbbz	zbbz	zbbz	zbbz
SELECT * FROM t1 WHERE b NOT like hex('xxx%') ESCAPE 'x' ;
a	b	c	d	e
1	aaaa	aaaa	aaaa	aaaa
2	xxxc	xxxb	xxxb	xxxb
3	xxxb	xxxc	xxxc	xxxc
4	xxxa	xxxa	xxxa	xxxa
5	zzzz	zzzz	zzzz	zzzz
7	zxxx	zxxx	zxxx	zxxx
8	axxx	axxx	axxx	axxx
9	zaaz	zaaz	zaaz	zaaz
10	zbbz	zbbz	zbbz	zbbz
SELECT * FROM t1 WHERE b NOT like hex('xxx%') ESCAPE 'a' ;
a	b	c	d	e
1	aaaa	aaaa	aaaa	aaaa
2	xxxc	xxxb	xxxb	xxxb
3	xxxb	xxxc	xxxc	xxxc
4	xxxa	xxxa	xxxa	xxxa
5	zzzz	zzzz	zzzz	zzzz
7	zxxx	zxxx	zxxx	zxxx
8	axxx	axxx	axxx	axxx
9	zaaz	zaaz	zaaz	zaaz
10	zbbz	zbbz	zbbz	zbbz
SELECT * FROM t1 WHERE b like X'78787825' ESCAPE X'0f' ;
a	b	c	d	e
2	xxxc	xxxb	xxxb	xxxb
3	xxxb	xxxc	xxxc	xxxc
4	xxxa	xxxa	xxxa	xxxa
SELECT * FROM t1 WHERE b like X'78787825' ESCAPE X'00' ;
a	b	c	d	e
2	xxxc	xxxb	xxxb	xxxb
3	xxxb	xxxc	xxxc	xxxc
4	xxxa	xxxa	xxxa	xxxa
SELECT * FROM t1 WHERE b like X'78787825' ESCAPE X'ff' ;
a	b	c	d	e
2	xxxc	xxxb	xxxb	xxxb
3	xxxb	xxxc	xxxc	xxxc
4	xxxa	xxxa	xxxa	xxxa
SELECT * FROM t1 WHERE b like X'78787825' ESCAPE X'78' ;
a	b	c	d	e
SELECT * FROM t1 WHERE b like X'78787825' ESCAPE X'25' ;
a	b	c	d	e
2	xxxc	xxxb	xxxb	xxxb
3	xxxb	xxxc	xxxc	xxxc
4	xxxa	xxxa	xxxa	xxxa
SELECT * FROM t1 WHERE b like X'0000' ESCAPE '0' ;
a	b	c	d	e
SELECT * FROM t1 WHERE b like X'00000000' ESCAPE '0' ;
a	b	c	d	e
SELECT * FROM t1 WHERE b like X'ffff' ESCAPE 'f' ;
a	b	c	d	e
SELECT * FROM t1 WHERE b like X'ffffffff' ESCAPE 'f' ;
a	b	c	d	e
SELECT * FROM t1 WHERE b like X'ff0000ff' ESCAPE 'f' ;
a	b	c	d	e
SELECT * FROM t1 WHERE b like X'78787825' ESCAPE 'f' ;
a	b	c	d	e
4	xxxa	xxxa	xxxa	xxxa
3	xxxb	xxxc	xxxc	xxxc
2	xxxc	xxxb	xxxb	xxxb
SELECT * FROM t1 WHERE b like X'78787825' ESCAPE '0' ;
a	b	c	d	e
2	xxxc	xxxb	xxxb	xxxb
3	xxxb	xxxc	xxxc	xxxc
4	xxxa	xxxa	xxxa	xxxa
SELECT * FROM t1 WHERE b like X'78787825' ESCAPE 'f' ;
a	b	c	d	e
2	xxxc	xxxb	xxxb	xxxb
3	xxxb	xxxc	xxxc	xxxc
4	xxxa	xxxa	xxxa	xxxa
SELECT * FROM t1 WHERE b like X'78787825' ESCAPE '8' ;
a	b	c	d	e
2	xxxc	xxxb	xxxb	xxxb
3	xxxb	xxxc	xxxc	xxxc
4	xxxa	xxxa	xxxa	xxxa
SELECT * FROM t1 WHERE b like X'78787825' ESCAPE '5' ;
a	b	c	d	e
2	xxxc	xxxb	xxxb	xxxb
3	xxxb	xxxc	xxxc	xxxc
4	xxxa	xxxa	xxxa	xxxa
SELECT * FROM t1 WHERE b NOT like X'0000' ESCAPE '0' ;
a	b	c	d	e
1	aaaa	aaaa	aaaa	aaaa
2	xxxc	xxxb	xxxb	xxxb
3	xxxb	xxxc	xxxc	xxxc
4	xxxa	xxxa	xxxa	xxxa
5	zzzz	zzzz	zzzz	zzzz
7	zxxx	zxxx	zxxx	zxxx
8	axxx	axxx	axxx	axxx
9	zaaz	zaaz	zaaz	zaaz
10	zbbz	zbbz	zbbz	zbbz
SELECT * FROM t1 WHERE b NOT like X'00000000' ESCAPE '0' ;
a	b	c	d	e
1	aaaa	aaaa	aaaa	aaaa
2	xxxc	xxxb	xxxb	xxxb
3	xxxb	xxxc	xxxc	xxxc
4	xxxa	xxxa	xxxa	xxxa
5	zzzz	zzzz	zzzz	zzzz
7	zxxx	zxxx	zxxx	zxxx
8	axxx	axxx	axxx	axxx
9	zaaz	zaaz	zaaz	zaaz
10	zbbz	zbbz	zbbz	zbbz
SELECT * FROM t1 WHERE b NOT like X'ffff' ESCAPE 'f' ;
a	b	c	d	e
1	aaaa	aaaa	aaaa	aaaa
2	xxxc	xxxb	xxxb	xxxb
3	xxxb	xxxc	xxxc	xxxc
4	xxxa	xxxa	xxxa	xxxa
5	zzzz	zzzz	zzzz	zzzz
7	zxxx	zxxx	zxxx	zxxx
8	axxx	axxx	axxx	axxx
9	zaaz	zaaz	zaaz	zaaz
10	zbbz	zbbz	zbbz	zbbz
SELECT * FROM t1 WHERE b NOT like X'ffffffff' ESCAPE 'f' ;
a	b	c	d	e
1	aaaa	aaaa	aaaa	aaaa
2	xxxc	xxxb	xxxb	xxxb
3	xxxb	xxxc	xxxc	xxxc
4	xxxa	xxxa	xxxa	xxxa
5	zzzz	zzzz	zzzz	zzzz
7	zxxx	zxxx	zxxx	zxxx
8	axxx	axxx	axxx	axxx
9	zaaz	zaaz	zaaz	zaaz
10	zbbz	zbbz	zbbz	zbbz
SELECT * FROM t1 WHERE b NOT like X'ff0000ff' ESCAPE 'f' ;
a	b	c	d	e
1	aaaa	aaaa	aaaa	aaaa
2	xxxc	xxxb	xxxb	xxxb
3	xxxb	xxxc	xxxc	xxxc
4	xxxa	xxxa	xxxa	xxxa
5	zzzz	zzzz	zzzz	zzzz
7	zxxx	zxxx	zxxx	zxxx
8	axxx	axxx	axxx	axxx
9	zaaz	zaaz	zaaz	zaaz
10	zbbz	zbbz	zbbz	zbbz
SELECT * FROM t1 WHERE b NOT like X'78787825' ESCAPE '0' ;
a	b	c	d	e
1	aaaa	aaaa	aaaa	aaaa
5	zzzz	zzzz	zzzz	zzzz
7	zxxx	zxxx	zxxx	zxxx
8	axxx	axxx	axxx	axxx
9	zaaz	zaaz	zaaz	zaaz
10	zbbz	zbbz	zbbz	zbbz
SELECT * FROM t1 WHERE b NOT like X'78787825' ESCAPE 'f' ;
a	b	c	d	e
1	aaaa	aaaa	aaaa	aaaa
5	zzzz	zzzz	zzzz	zzzz
7	zxxx	zxxx	zxxx	zxxx
8	axxx	axxx	axxx	axxx
9	zaaz	zaaz	zaaz	zaaz
10	zbbz	zbbz	zbbz	zbbz
SELECT * FROM t1 WHERE b like X'78787825252525252525252525' ESCAPE 'f' ;
a	b	c	d	e
2	xxxc	xxxb	xxxb	xxxb
3	xxxb	xxxc	xxxc	xxxc
4	xxxa	xxxa	xxxa	xxxa
SELECT * FROM t1 WHERE b NOT like X'78787825252525252525252525' ESCAPE 'f' ;
a	b	c	d	e
1	aaaa	aaaa	aaaa	aaaa
5	zzzz	zzzz	zzzz	zzzz
7	zxxx	zxxx	zxxx	zxxx
8	axxx	axxx	axxx	axxx
9	zaaz	zaaz	zaaz	zaaz
10	zbbz	zbbz	zbbz	zbbz
SELECT * FROM t1 WHERE b like 'xxx%%%%%%%%%%' ESCAPE 'f' ;
a	b	c	d	e
2	xxxc	xxxb	xxxb	xxxb
3	xxxb	xxxc	xxxc	xxxc
4	xxxa	xxxa	xxxa	xxxa
SELECT * FROM t1 WHERE b NOT like 'xxx%%%%%%%%%%' ESCAPE 'f' ;
a	b	c	d	e
1	aaaa	aaaa	aaaa	aaaa
5	zzzz	zzzz	zzzz	zzzz
7	zxxx	zxxx	zxxx	zxxx
8	axxx	axxx	axxx	axxx
9	zaaz	zaaz	zaaz	zaaz
10	zbbz	zbbz	zbbz	zbbz
SELECT * FROM t1 WHERE b like 'xxx_%%%%%%%%%' ESCAPE 'f' ;
a	b	c	d	e
2	xxxc	xxxb	xxxb	xxxb
3	xxxb	xxxc	xxxc	xxxc
4	xxxa	xxxa	xxxa	xxxa
SELECT * FROM t1 WHERE b NOT like 'xxx_%%%%%%%%%' ESCAPE 'f' ;
a	b	c	d	e
1	aaaa	aaaa	aaaa	aaaa
5	zzzz	zzzz	zzzz	zzzz
7	zxxx	zxxx	zxxx	zxxx
8	axxx	axxx	axxx	axxx
9	zaaz	zaaz	zaaz	zaaz
10	zbbz	zbbz	zbbz	zbbz
-- Cover 0x00-FF in like str
EXPLAIN SELECT * FROM t1 WHERE b like 0x000102030405060708090A0B0C0D0E0F101112131415161718191A1B1C1D0E1F202122232425262728292A2B2C2D0E2F303132333435363738393A3B3C3D0E3F404142434445464748494A4B4C4D0E4F505152535455565758595A5B5C5D0E5F606162636465666768696A6B6C6D0E6F707172737475767778797A7B7C7D0E7F808182838485868788898A8B8C8D0E8F909192939495969798999A9B9C9D0E9FA0A1A2A3A4A5A6A7A8A9AAABACAD0EAFB0B1B2B3B4B5B6B7B8B9BABBBCBD0EBFC0C1C2C3C4C5C6C7C8C9CACBCCCD0ECFD0D1D2D3D4D5D6D7D8D9DADBDCDD0EDFE0E1E2E3E4E5E6E7E8E9EAEBECED0EEFF0F1F2F3F4F5F6F7F8F9FAFBFCFD0EFF  ESCAPE '&' ;
EXPLAIN SELECT * FROM t1 WHERE b like 0x000102030405060708090A0B0C0D0E0F101112131415161718191A1B1C1D0E1F202122232425262728292A2B2C2D0E2F303132333435363738393A3B3C3D0E3F404142434445464748494A4B4C4D0E4F505152535455565758595A5B5C5D0E5F606162636465666768696A6B6C6D0E6F707172737475767778797A7B7C7D0E7F808182838485868788898A8B8C8D0E8F909192939495969798999A9B9C9D0E9FA0A1A2A3A4A5A6A7A8A9AAABACAD0EAFB0B1B2B3B4B5B6B7B8B9BABBBCBD0EBFC0C1C2C3C4C5C6C7C8C9CACBCCCD0ECFD0D1D2D3D4D5D6D7D8D9DADBDCDD0EDFE0E1E2E3E4E5E6E7E8E9EAEBECED0EEFF0F1F2F3F4F5F6F7F8F9FAFBFCFD0EFF ;
EXPLAIN SELECT * FROM t1 WHERE b like x'000102030405060708090A0B0C0D0E0F101112131415161718191A1B1C1D0E1F202122232425262728292A2B2C2D0E2F303132333435363738393A3B3C3D0E3F404142434445464748494A4B4C4D0E4F505152535455565758595A5B5C5D0E5F606162636465666768696A6B6C6D0E6F707172737475767778797A7B7C7D0E7F808182838485868788898A8B8C8D0E8F909192939495969798999A9B9C9D0E9FA0A1A2A3A4A5A6A7A8A9AAABACAD0EAFB0B1B2B3B4B5B6B7B8B9BABBBCBD0EBFC0C1C2C3C4C5C6C7C8C9CACBCCCD0ECFD0D1D2D3D4D5D6D7D8D9DADBDCDD0EDFE0E1E2E3E4E5E6E7E8E9EAEBECED0EEFF0F1F2F3F4F5F6F7F8F9FAFBFCFD0EFF'  ESCAPE '&' ;
EXPLAIN SELECT * FROM t1 WHERE b like x'000102030405060708090A0B0C0D0E0F101112131415161718191A1B1C1D0E1F202122232425262728292A2B2C2D0E2F303132333435363738393A3B3C3D0E3F404142434445464748494A4B4C4D0E4F505152535455565758595A5B5C5D0E5F606162636465666768696A6B6C6D0E6F707172737475767778797A7B7C7D0E7F808182838485868788898A8B8C8D0E8F909192939495969798999A9B9C9D0E9FA0A1A2A3A4A5A6A7A8A9AAABACAD0EAFB0B1B2B3B4B5B6B7B8B9BABBBCBD0EBFC0C1C2C3C4C5C6C7C8C9CACBCCCD0ECFD0D1D2D3D4D5D6D7D8D9DADBDCDD0EDFE0E1E2E3E4E5E6E7E8E9EAEBECED0EEFF0F1F2F3F4F5F6F7F8F9FAFBFCFD0EFF' ;
EXPLAIN SELECT * FROM t1 WHERE b like X'000102030405060708090A0B0C0D0E0F101112131415161718191A1B1C1D0E1F202122232425262728292A2B2C2D0E2F303132333435363738393A3B3C3D0E3F404142434445464748494A4B4C4D0E4F505152535455565758595A5B5C5D0E5F606162636465666768696A6B6C6D0E6F707172737475767778797A7B7C7D0E7F808182838485868788898A8B8C8D0E8F909192939495969798999A9B9C9D0E9FA0A1A2A3A4A5A6A7A8A9AAABACAD0EAFB0B1B2B3B4B5B6B7B8B9BABBBCBD0EBFC0C1C2C3C4C5C6C7C8C9CACBCCCD0ECFD0D1D2D3D4D5D6D7D8D9DADBDCDD0EDFE0E1E2E3E4E5E6E7E8E9EAEBECED0EEFF0F1F2F3F4F5F6F7F8F9FAFBFCFD0EFF'  ESCAPE '&' ;
EXPLAIN SELECT * FROM t1 WHERE b like X'000102030405060708090A0B0C0D0E0F101112131415161718191A1B1C1D0E1F202122232425262728292A2B2C2D0E2F303132333435363738393A3B3C3D0E3F404142434445464748494A4B4C4D0E4F505152535455565758595A5B5C5D0E5F606162636465666768696A6B6C6D0E6F707172737475767778797A7B7C7D0E7F808182838485868788898A8B8C8D0E8F909192939495969798999A9B9C9D0E9FA0A1A2A3A4A5A6A7A8A9AAABACAD0EAFB0B1B2B3B4B5B6B7B8B9BABBBCBD0EBFC0C1C2C3C4C5C6C7C8C9CACBCCCD0ECFD0D1D2D3D4D5D6D7D8D9DADBDCDD0EDFE0E1E2E3E4E5E6E7E8E9EAEBECED0EEFF0F1F2F3F4F5F6F7F8F9FAFBFCFD0EFF' ;
SELECT * FROM t1 WHERE b like 0x000102030405060708090A0B0C0D0E0F101112131415161718191A1B1C1D0E1F202122232425262728292A2B2C2D0E2F303132333435363738393A3B3C3D0E3F404142434445464748494A4B4C4D0E4F505152535455565758595A5B5C5D0E5F606162636465666768696A6B6C6D0E6F707172737475767778797A7B7C7D0E7F808182838485868788898A8B8C8D0E8F909192939495969798999A9B9C9D0E9FA0A1A2A3A4A5A6A7A8A9AAABACAD0EAFB0B1B2B3B4B5B6B7B8B9BABBBCBD0EBFC0C1C2C3C4C5C6C7C8C9CACBCCCD0ECFD0D1D2D3D4D5D6D7D8D9DADBDCDD0EDFE0E1E2E3E4E5E6E7E8E9EAEBECED0EEFF0F1F2F3F4F5F6F7F8F9FAFBFCFD0EFF  ESCAPE '&' ;
a	b	c	d	e
SELECT * FROM t1 WHERE b like 0x000102030405060708090A0B0C0D0E0F101112131415161718191A1B1C1D0E1F202122232425262728292A2B2C2D0E2F303132333435363738393A3B3C3D0E3F404142434445464748494A4B4C4D0E4F505152535455565758595A5B5C5D0E5F606162636465666768696A6B6C6D0E6F707172737475767778797A7B7C7D0E7F808182838485868788898A8B8C8D0E8F909192939495969798999A9B9C9D0E9FA0A1A2A3A4A5A6A7A8A9AAABACAD0EAFB0B1B2B3B4B5B6B7B8B9BABBBCBD0EBFC0C1C2C3C4C5C6C7C8C9CACBCCCD0ECFD0D1D2D3D4D5D6D7D8D9DADBDCDD0EDFE0E1E2E3E4E5E6E7E8E9EAEBECED0EEFF0F1F2F3F4F5F6F7F8F9FAFBFCFD0EFF ;
a	b	c	d	e
SELECT * FROM t1 WHERE b like x'000102030405060708090A0B0C0D0E0F101112131415161718191A1B1C1D0E1F202122232425262728292A2B2C2D0E2F303132333435363738393A3B3C3D0E3F404142434445464748494A4B4C4D0E4F505152535455565758595A5B5C5D0E5F606162636465666768696A6B6C6D0E6F707172737475767778797A7B7C7D0E7F808182838485868788898A8B8C8D0E8F909192939495969798999A9B9C9D0E9FA0A1A2A3A4A5A6A7A8A9AAABACAD0EAFB0B1B2B3B4B5B6B7B8B9BABBBCBD0EBFC0C1C2C3C4C5C6C7C8C9CACBCCCD0ECFD0D1D2D3D4D5D6D7D8D9DADBDCDD0EDFE0E1E2E3E4E5E6E7E8E9EAEBECED0EEFF0F1F2F3F4F5F6F7F8F9FAFBFCFD0EFF'  ESCAPE '&' ;
a	b	c	d	e
SELECT * FROM t1 WHERE b like x'000102030405060708090A0B0C0D0E0F101112131415161718191A1B1C1D0E1F202122232425262728292A2B2C2D0E2F303132333435363738393A3B3C3D0E3F404142434445464748494A4B4C4D0E4F505152535455565758595A5B5C5D0E5F606162636465666768696A6B6C6D0E6F707172737475767778797A7B7C7D0E7F808182838485868788898A8B8C8D0E8F909192939495969798999A9B9C9D0E9FA0A1A2A3A4A5A6A7A8A9AAABACAD0EAFB0B1B2B3B4B5B6B7B8B9BABBBCBD0EBFC0C1C2C3C4C5C6C7C8C9CACBCCCD0ECFD0D1D2D3D4D5D6D7D8D9DADBDCDD0EDFE0E1E2E3E4E5E6E7E8E9EAEBECED0EEFF0F1F2F3F4F5F6F7F8F9FAFBFCFD0EFF' ;
a	b	c	d	e
SELECT * FROM t1 WHERE b like X'000102030405060708090A0B0C0D0E0F101112131415161718191A1B1C1D0E1F202122232425262728292A2B2C2D0E2F303132333435363738393A3B3C3D0E3F404142434445464748494A4B4C4D0E4F505152535455565758595A5B5C5D0E5F606162636465666768696A6B6C6D0E6F707172737475767778797A7B7C7D0E7F808182838485868788898A8B8C8D0E8F909192939495969798999A9B9C9D0E9FA0A1A2A3A4A5A6A7A8A9AAABACAD0EAFB0B1B2B3B4B5B6B7B8B9BABBBCBD0EBFC0C1C2C3C4C5C6C7C8C9CACBCCCD0ECFD0D1D2D3D4D5D6D7D8D9DADBDCDD0EDFE0E1E2E3E4E5E6E7E8E9EAEBECED0EEFF0F1F2F3F4F5F6F7F8F9FAFBFCFD0EFF'  ESCAPE '&' ;
a	b	c	d	e
SELECT * FROM t1 WHERE b like X'000102030405060708090A0B0C0D0E0F101112131415161718191A1B1C1D0E1F202122232425262728292A2B2C2D0E2F303132333435363738393A3B3C3D0E3F404142434445464748494A4B4C4D0E4F505152535455565758595A5B5C5D0E5F606162636465666768696A6B6C6D0E6F707172737475767778797A7B7C7D0E7F808182838485868788898A8B8C8D0E8F909192939495969798999A9B9C9D0E9FA0A1A2A3A4A5A6A7A8A9AAABACAD0EAFB0B1B2B3B4B5B6B7B8B9BABBBCBD0EBFC0C1C2C3C4C5C6C7C8C9CACBCCCD0ECFD0D1D2D3D4D5D6D7D8D9DADBDCDD0EDFE0E1E2E3E4E5E6E7E8E9EAEBECED0EEFF0F1F2F3F4F5F6F7F8F9FAFBFCFD0EFF' ;
a	b	c	d	e
EXPLAIN SELECT * FROM t1 WHERE b not like 0x000102030405060708090A0B0C0D0E0F101112131415161718191A1B1C1D0E1F202122232425262728292A2B2C2D0E2F303132333435363738393A3B3C3D0E3F404142434445464748494A4B4C4D0E4F505152535455565758595A5B5C5D0E5F606162636465666768696A6B6C6D0E6F707172737475767778797A7B7C7D0E7F808182838485868788898A8B8C8D0E8F909192939495969798999A9B9C9D0E9FA0A1A2A3A4A5A6A7A8A9AAABACAD0EAFB0B1B2B3B4B5B6B7B8B9BABBBCBD0EBFC0C1C2C3C4C5C6C7C8C9CACBCCCD0ECFD0D1D2D3D4D5D6D7D8D9DADBDCDD0EDFE0E1E2E3E4E5E6E7E8E9EAEBECED0EEFF0F1F2F3F4F5F6F7F8F9FAFBFCFD0EFF  ESCAPE '&' ;
EXPLAIN SELECT * FROM t1 WHERE b not like 0x000102030405060708090A0B0C0D0E0F101112131415161718191A1B1C1D0E1F202122232425262728292A2B2C2D0E2F303132333435363738393A3B3C3D0E3F404142434445464748494A4B4C4D0E4F505152535455565758595A5B5C5D0E5F606162636465666768696A6B6C6D0E6F707172737475767778797A7B7C7D0E7F808182838485868788898A8B8C8D0E8F909192939495969798999A9B9C9D0E9FA0A1A2A3A4A5A6A7A8A9AAABACAD0EAFB0B1B2B3B4B5B6B7B8B9BABBBCBD0EBFC0C1C2C3C4C5C6C7C8C9CACBCCCD0ECFD0D1D2D3D4D5D6D7D8D9DADBDCDD0EDFE0E1E2E3E4E5E6E7E8E9EAEBECED0EEFF0F1F2F3F4F5F6F7F8F9FAFBFCFD0EFF ;
EXPLAIN SELECT * FROM t1 WHERE b not like x'000102030405060708090A0B0C0D0E0F101112131415161718191A1B1C1D0E1F202122232425262728292A2B2C2D0E2F303132333435363738393A3B3C3D0E3F404142434445464748494A4B4C4D0E4F505152535455565758595A5B5C5D0E5F606162636465666768696A6B6C6D0E6F707172737475767778797A7B7C7D0E7F808182838485868788898A8B8C8D0E8F909192939495969798999A9B9C9D0E9FA0A1A2A3A4A5A6A7A8A9AAABACAD0EAFB0B1B2B3B4B5B6B7B8B9BABBBCBD0EBFC0C1C2C3C4C5C6C7C8C9CACBCCCD0ECFD0D1D2D3D4D5D6D7D8D9DADBDCDD0EDFE0E1E2E3E4E5E6E7E8E9EAEBECED0EEFF0F1F2F3F4F5F6F7F8F9FAFBFCFD0EFF'  ESCAPE '&' ;
EXPLAIN SELECT * FROM t1 WHERE b not like x'000102030405060708090A0B0C0D0E0F101112131415161718191A1B1C1D0E1F202122232425262728292A2B2C2D0E2F303132333435363738393A3B3C3D0E3F404142434445464748494A4B4C4D0E4F505152535455565758595A5B5C5D0E5F606162636465666768696A6B6C6D0E6F707172737475767778797A7B7C7D0E7F808182838485868788898A8B8C8D0E8F909192939495969798999A9B9C9D0E9FA0A1A2A3A4A5A6A7A8A9AAABACAD0EAFB0B1B2B3B4B5B6B7B8B9BABBBCBD0EBFC0C1C2C3C4C5C6C7C8C9CACBCCCD0ECFD0D1D2D3D4D5D6D7D8D9DADBDCDD0EDFE0E1E2E3E4E5E6E7E8E9EAEBECED0EEFF0F1F2F3F4F5F6F7F8F9FAFBFCFD0EFF' ;
EXPLAIN SELECT * FROM t1 WHERE b not like X'000102030405060708090A0B0C0D0E0F101112131415161718191A1B1C1D0E1F202122232425262728292A2B2C2D0E2F303132333435363738393A3B3C3D0E3F404142434445464748494A4B4C4D0E4F505152535455565758595A5B5C5D0E5F606162636465666768696A6B6C6D0E6F707172737475767778797A7B7C7D0E7F808182838485868788898A8B8C8D0E8F909192939495969798999A9B9C9D0E9FA0A1A2A3A4A5A6A7A8A9AAABACAD0EAFB0B1B2B3B4B5B6B7B8B9BABBBCBD0EBFC0C1C2C3C4C5C6C7C8C9CACBCCCD0ECFD0D1D2D3D4D5D6D7D8D9DADBDCDD0EDFE0E1E2E3E4E5E6E7E8E9EAEBECED0EEFF0F1F2F3F4F5F6F7F8F9FAFBFCFD0EFF'  ESCAPE '&' ;
EXPLAIN SELECT * FROM t1 WHERE b not like X'000102030405060708090A0B0C0D0E0F101112131415161718191A1B1C1D0E1F202122232425262728292A2B2C2D0E2F303132333435363738393A3B3C3D0E3F404142434445464748494A4B4C4D0E4F505152535455565758595A5B5C5D0E5F606162636465666768696A6B6C6D0E6F707172737475767778797A7B7C7D0E7F808182838485868788898A8B8C8D0E8F909192939495969798999A9B9C9D0E9FA0A1A2A3A4A5A6A7A8A9AAABACAD0EAFB0B1B2B3B4B5B6B7B8B9BABBBCBD0EBFC0C1C2C3C4C5C6C7C8C9CACBCCCD0ECFD0D1D2D3D4D5D6D7D8D9DADBDCDD0EDFE0E1E2E3E4E5E6E7E8E9EAEBECED0EEFF0F1F2F3F4F5F6F7F8F9FAFBFCFD0EFF' ;
SELECT * FROM t1 WHERE b not like 0x000102030405060708090A0B0C0D0E0F101112131415161718191A1B1C1D0E1F202122232425262728292A2B2C2D0E2F303132333435363738393A3B3C3D0E3F404142434445464748494A4B4C4D0E4F505152535455565758595A5B5C5D0E5F606162636465666768696A6B6C6D0E6F707172737475767778797A7B7C7D0E7F808182838485868788898A8B8C8D0E8F909192939495969798999A9B9C9D0E9FA0A1A2A3A4A5A6A7A8A9AAABACAD0EAFB0B1B2B3B4B5B6B7B8B9BABBBCBD0EBFC0C1C2C3C4C5C6C7C8C9CACBCCCD0ECFD0D1D2D3D4D5D6D7D8D9DADBDCDD0EDFE0E1E2E3E4E5E6E7E8E9EAEBECED0EEFF0F1F2F3F4F5F6F7F8F9FAFBFCFD0EFF  ESCAPE '&' ;
a	b	c	d	e
1	aaaa	aaaa	aaaa	aaaa
2	xxxc	xxxb	xxxb	xxxb
3	xxxb	xxxc	xxxc	xxxc
4	xxxa	xxxa	xxxa	xxxa
5	zzzz	zzzz	zzzz	zzzz
7	zxxx	zxxx	zxxx	zxxx
8	axxx	axxx	axxx	axxx
9	zaaz	zaaz	zaaz	zaaz
10	zbbz	zbbz	zbbz	zbbz
SELECT * FROM t1 WHERE b not like 0x000102030405060708090A0B0C0D0E0F101112131415161718191A1B1C1D0E1F202122232425262728292A2B2C2D0E2F303132333435363738393A3B3C3D0E3F404142434445464748494A4B4C4D0E4F505152535455565758595A5B5C5D0E5F606162636465666768696A6B6C6D0E6F707172737475767778797A7B7C7D0E7F808182838485868788898A8B8C8D0E8F909192939495969798999A9B9C9D0E9FA0A1A2A3A4A5A6A7A8A9AAABACAD0EAFB0B1B2B3B4B5B6B7B8B9BABBBCBD0EBFC0C1C2C3C4C5C6C7C8C9CACBCCCD0ECFD0D1D2D3D4D5D6D7D8D9DADBDCDD0EDFE0E1E2E3E4E5E6E7E8E9EAEBECED0EEFF0F1F2F3F4F5F6F7F8F9FAFBFCFD0EFF ;
a	b	c	d	e
1	aaaa	aaaa	aaaa	aaaa
2	xxxc	xxxb	xxxb	xxxb
3	xxxb	xxxc	xxxc	xxxc
4	xxxa	xxxa	xxxa	xxxa
5	zzzz	zzzz	zzzz	zzzz
7	zxxx	zxxx	zxxx	zxxx
8	axxx	axxx	axxx	axxx
9	zaaz	zaaz	zaaz	zaaz
10	zbbz	zbbz	zbbz	zbbz
SELECT * FROM t1 WHERE b not like x'000102030405060708090A0B0C0D0E0F101112131415161718191A1B1C1D0E1F202122232425262728292A2B2C2D0E2F303132333435363738393A3B3C3D0E3F404142434445464748494A4B4C4D0E4F505152535455565758595A5B5C5D0E5F606162636465666768696A6B6C6D0E6F707172737475767778797A7B7C7D0E7F808182838485868788898A8B8C8D0E8F909192939495969798999A9B9C9D0E9FA0A1A2A3A4A5A6A7A8A9AAABACAD0EAFB0B1B2B3B4B5B6B7B8B9BABBBCBD0EBFC0C1C2C3C4C5C6C7C8C9CACBCCCD0ECFD0D1D2D3D4D5D6D7D8D9DADBDCDD0EDFE0E1E2E3E4E5E6E7E8E9EAEBECED0EEFF0F1F2F3F4F5F6F7F8F9FAFBFCFD0EFF'  ESCAPE '&' ;
a	b	c	d	e
1	aaaa	aaaa	aaaa	aaaa
2	xxxc	xxxb	xxxb	xxxb
3	xxxb	xxxc	xxxc	xxxc
4	xxxa	xxxa	xxxa	xxxa
5	zzzz	zzzz	zzzz	zzzz
7	zxxx	zxxx	zxxx	zxxx
8	axxx	axxx	axxx	axxx
9	zaaz	zaaz	zaaz	zaaz
10	zbbz	zbbz	zbbz	zbbz
SELECT * FROM t1 WHERE b not like x'000102030405060708090A0B0C0D0E0F101112131415161718191A1B1C1D0E1F202122232425262728292A2B2C2D0E2F303132333435363738393A3B3C3D0E3F404142434445464748494A4B4C4D0E4F505152535455565758595A5B5C5D0E5F606162636465666768696A6B6C6D0E6F707172737475767778797A7B7C7D0E7F808182838485868788898A8B8C8D0E8F909192939495969798999A9B9C9D0E9FA0A1A2A3A4A5A6A7A8A9AAABACAD0EAFB0B1B2B3B4B5B6B7B8B9BABBBCBD0EBFC0C1C2C3C4C5C6C7C8C9CACBCCCD0ECFD0D1D2D3D4D5D6D7D8D9DADBDCDD0EDFE0E1E2E3E4E5E6E7E8E9EAEBECED0EEFF0F1F2F3F4F5F6F7F8F9FAFBFCFD0EFF' ;
a	b	c	d	e
1	aaaa	aaaa	aaaa	aaaa
2	xxxc	xxxb	xxxb	xxxb
3	xxxb	xxxc	xxxc	xxxc
4	xxxa	xxxa	xxxa	xxxa
5	zzzz	zzzz	zzzz	zzzz
7	zxxx	zxxx	zxxx	zxxx
8	axxx	axxx	axxx	axxx
9	zaaz	zaaz	zaaz	zaaz
10	zbbz	zbbz	zbbz	zbbz
SELECT * FROM t1 WHERE b not like X'000102030405060708090A0B0C0D0E0F101112131415161718191A1B1C1D0E1F202122232425262728292A2B2C2D0E2F303132333435363738393A3B3C3D0E3F404142434445464748494A4B4C4D0E4F505152535455565758595A5B5C5D0E5F606162636465666768696A6B6C6D0E6F707172737475767778797A7B7C7D0E7F808182838485868788898A8B8C8D0E8F909192939495969798999A9B9C9D0E9FA0A1A2A3A4A5A6A7A8A9AAABACAD0EAFB0B1B2B3B4B5B6B7B8B9BABBBCBD0EBFC0C1C2C3C4C5C6C7C8C9CACBCCCD0ECFD0D1D2D3D4D5D6D7D8D9DADBDCDD0EDFE0E1E2E3E4E5E6E7E8E9EAEBECED0EEFF0F1F2F3F4F5F6F7F8F9FAFBFCFD0EFF'  ESCAPE '&' ;
a	b	c	d	e
1	aaaa	aaaa	aaaa	aaaa
2	xxxc	xxxb	xxxb	xxxb
3	xxxb	xxxc	xxxc	xxxc
4	xxxa	xxxa	xxxa	xxxa
5	zzzz	zzzz	zzzz	zzzz
7	zxxx	zxxx	zxxx	zxxx
8	axxx	axxx	axxx	axxx
9	zaaz	zaaz	zaaz	zaaz
10	zbbz	zbbz	zbbz	zbbz
SELECT * FROM t1 WHERE b not like X'000102030405060708090A0B0C0D0E0F101112131415161718191A1B1C1D0E1F202122232425262728292A2B2C2D0E2F303132333435363738393A3B3C3D0E3F404142434445464748494A4B4C4D0E4F505152535455565758595A5B5C5D0E5F606162636465666768696A6B6C6D0E6F707172737475767778797A7B7C7D0E7F808182838485868788898A8B8C8D0E8F909192939495969798999A9B9C9D0E9FA0A1A2A3A4A5A6A7A8A9AAABACAD0EAFB0B1B2B3B4B5B6B7B8B9BABBBCBD0EBFC0C1C2C3C4C5C6C7C8C9CACBCCCD0ECFD0D1D2D3D4D5D6D7D8D9DADBDCDD0EDFE0E1E2E3E4E5E6E7E8E9EAEBECED0EEFF0F1F2F3F4F5F6F7F8F9FAFBFCFD0EFF' ;
a	b	c	d	e
1	aaaa	aaaa	aaaa	aaaa
2	xxxc	xxxb	xxxb	xxxb
3	xxxb	xxxc	xxxc	xxxc
4	xxxa	xxxa	xxxa	xxxa
5	zzzz	zzzz	zzzz	zzzz
7	zxxx	zxxx	zxxx	zxxx
8	axxx	axxx	axxx	axxx
9	zaaz	zaaz	zaaz	zaaz
10	zbbz	zbbz	zbbz	zbbz
-- ========================= SELECT FOR UPDATE ====================================================================================
drop table if exists t1;
create table t1 (a bigint primary key, b char(100) , c char(100) , d char(100) , e char(100) ,  key i1(b) , unique index i2(c,d,e) , index i3(c));
insert into t1 values(1,'aaaa','aaaa','aaaa','aaaa'),(2,'xxxc','xxxb','xxxb','xxxb'),(3,'xxxb','xxxc','xxxc','xxxc'),(4,'xxxa','xxxa','xxxa','xxxa'),(5,'zzzz','zzzz','zzzz','zzzz'),(6,NULL,NULL,'xxxa','xxxa'),(7,'zxxx','zxxx','zxxx','zxxx'),(8,'axxx','axxx','axxx','axxx'),(9,'zaaz','zaaz','zaaz','zaaz'),(10,'zbbz','zbbz','zbbz','zbbz');
-- col_str1 [NOT] LIKE ‘xxx’ [ESCAPE col_str3]
SELECT * FROM t1 WHERE b like 'xxx' ;
a	b	c	d	e
EXPLAIN SELECT * FROM t1 WHERE b like 'xxx' ;
-- col_str1 [NOT] LIKE ‘xxx%’ [ESCAPE col_str3]
SELECT * FROM t1 WHERE b like 'xxx%' ;
a	b	c	d	e
4	xxxa	xxxa	xxxa	xxxa
3	xxxb	xxxc	xxxc	xxxc
2	xxxc	xxxb	xxxb	xxxb
SELECT * FROM t1 WHERE b like 'xxx%' ESCAPE 'x' ;
a	b	c	d	e
SELECT * FROM t1 WHERE b like 'xxx%' ESCAPE 'a' ;
a	b	c	d	e
4	xxxa	xxxa	xxxa	xxxa
3	xxxb	xxxc	xxxc	xxxc
2	xxxc	xxxb	xxxb	xxxb
SELECT * FROM t1 WHERE b NOT like 'xxx%' ;
a	b	c	d	e
1	aaaa	aaaa	aaaa	aaaa
5	zzzz	zzzz	zzzz	zzzz
7	zxxx	zxxx	zxxx	zxxx
8	axxx	axxx	axxx	axxx
9	zaaz	zaaz	zaaz	zaaz
10	zbbz	zbbz	zbbz	zbbz
SELECT * FROM t1 WHERE b NOT like 'xxx%' ESCAPE 'x' ;
a	b	c	d	e
1	aaaa	aaaa	aaaa	aaaa
2	xxxc	xxxb	xxxb	xxxb
3	xxxb	xxxc	xxxc	xxxc
4	xxxa	xxxa	xxxa	xxxa
5	zzzz	zzzz	zzzz	zzzz
7	zxxx	zxxx	zxxx	zxxx
8	axxx	axxx	axxx	axxx
9	zaaz	zaaz	zaaz	zaaz
10	zbbz	zbbz	zbbz	zbbz
SELECT * FROM t1 WHERE b NOT like 'xxx%' ESCAPE 'a' ;
a	b	c	d	e
1	aaaa	aaaa	aaaa	aaaa
5	zzzz	zzzz	zzzz	zzzz
7	zxxx	zxxx	zxxx	zxxx
8	axxx	axxx	axxx	axxx
9	zaaz	zaaz	zaaz	zaaz
10	zbbz	zbbz	zbbz	zbbz
-- col_str1 [NOT] LIKE ‘z%z’ [ESCAPE col_str3]
SELECT * FROM t1 WHERE b like 'z%z' ;
a	b	c	d	e
5	zzzz	zzzz	zzzz	zzzz
9	zaaz	zaaz	zaaz	zaaz
10	zbbz	zbbz	zbbz	zbbz
SELECT * FROM t1 WHERE b like 'z%z' ESCAPE 'x' ;
a	b	c	d	e
5	zzzz	zzzz	zzzz	zzzz
9	zaaz	zaaz	zaaz	zaaz
10	zbbz	zbbz	zbbz	zbbz
SELECT * FROM t1 WHERE b like 'z%z' ESCAPE 'a' ;
a	b	c	d	e
5	zzzz	zzzz	zzzz	zzzz
9	zaaz	zaaz	zaaz	zaaz
10	zbbz	zbbz	zbbz	zbbz
SELECT * FROM t1 WHERE b NOT like 'z%z' ;
a	b	c	d	e
1	aaaa	aaaa	aaaa	aaaa
2	xxxc	xxxb	xxxb	xxxb
3	xxxb	xxxc	xxxc	xxxc
4	xxxa	xxxa	xxxa	xxxa
7	zxxx	zxxx	zxxx	zxxx
8	axxx	axxx	axxx	axxx
SELECT * FROM t1 WHERE b NOT like 'z%z' ESCAPE 'x' ;
a	b	c	d	e
1	aaaa	aaaa	aaaa	aaaa
2	xxxc	xxxb	xxxb	xxxb
3	xxxb	xxxc	xxxc	xxxc
4	xxxa	xxxa	xxxa	xxxa
7	zxxx	zxxx	zxxx	zxxx
8	axxx	axxx	axxx	axxx
SELECT * FROM t1 WHERE b NOT like 'z%z' ESCAPE 'a' ;
a	b	c	d	e
1	aaaa	aaaa	aaaa	aaaa
2	xxxc	xxxb	xxxb	xxxb
3	xxxb	xxxc	xxxc	xxxc
4	xxxa	xxxa	xxxa	xxxa
7	zxxx	zxxx	zxxx	zxxx
8	axxx	axxx	axxx	axxx
-- col_str1 [NOT] LIKE ‘z__z’ [ESCAPE col_str3]
SELECT * FROM t1 WHERE b like 'z__z' ;
a	b	c	d	e
5	zzzz	zzzz	zzzz	zzzz
9	zaaz	zaaz	zaaz	zaaz
10	zbbz	zbbz	zbbz	zbbz
SELECT * FROM t1 WHERE b like 'z__z' ESCAPE 'x' ;
a	b	c	d	e
5	zzzz	zzzz	zzzz	zzzz
9	zaaz	zaaz	zaaz	zaaz
10	zbbz	zbbz	zbbz	zbbz
SELECT * FROM t1 WHERE b like 'z__z' ESCAPE 'a' ;
a	b	c	d	e
5	zzzz	zzzz	zzzz	zzzz
9	zaaz	zaaz	zaaz	zaaz
10	zbbz	zbbz	zbbz	zbbz
SELECT * FROM t1 WHERE b NOT like 'z__z' ;
a	b	c	d	e
1	aaaa	aaaa	aaaa	aaaa
2	xxxc	xxxb	xxxb	xxxb
3	xxxb	xxxc	xxxc	xxxc
4	xxxa	xxxa	xxxa	xxxa
7	zxxx	zxxx	zxxx	zxxx
8	axxx	axxx	axxx	axxx
SELECT * FROM t1 WHERE b NOT like 'z__z' ESCAPE 'x' ;
a	b	c	d	e
1	aaaa	aaaa	aaaa	aaaa
2	xxxc	xxxb	xxxb	xxxb
3	xxxb	xxxc	xxxc	xxxc
4	xxxa	xxxa	xxxa	xxxa
7	zxxx	zxxx	zxxx	zxxx
8	axxx	axxx	axxx	axxx
SELECT * FROM t1 WHERE b NOT like 'z__z' ESCAPE 'a' ;
a	b	c	d	e
1	aaaa	aaaa	aaaa	aaaa
2	xxxc	xxxb	xxxb	xxxb
3	xxxb	xxxc	xxxc	xxxc
4	xxxa	xxxa	xxxa	xxxa
7	zxxx	zxxx	zxxx	zxxx
8	axxx	axxx	axxx	axxx
-- col_str1 [NOT] LIKE ‘z%z%’ [ESCAPE col_str3]
SELECT * FROM t1 WHERE b like 'z%z%' ;
a	b	c	d	e
5	zzzz	zzzz	zzzz	zzzz
9	zaaz	zaaz	zaaz	zaaz
10	zbbz	zbbz	zbbz	zbbz
SELECT * FROM t1 WHERE b like 'z%z%' ESCAPE 'x' ;
a	b	c	d	e
5	zzzz	zzzz	zzzz	zzzz
9	zaaz	zaaz	zaaz	zaaz
10	zbbz	zbbz	zbbz	zbbz
SELECT * FROM t1 WHERE b like 'z%z%' ESCAPE 'a' ;
a	b	c	d	e
5	zzzz	zzzz	zzzz	zzzz
9	zaaz	zaaz	zaaz	zaaz
10	zbbz	zbbz	zbbz	zbbz
SELECT * FROM t1 WHERE b like 'z%%%%%%%%%%%%%%%z%' ;
a	b	c	d	e
5	zzzz	zzzz	zzzz	zzzz
9	zaaz	zaaz	zaaz	zaaz
10	zbbz	zbbz	zbbz	zbbz
SELECT * FROM t1 WHERE b like 'z%%%%%%%%%%%%%%%z%' ESCAPE 'x' ;
a	b	c	d	e
5	zzzz	zzzz	zzzz	zzzz
9	zaaz	zaaz	zaaz	zaaz
10	zbbz	zbbz	zbbz	zbbz
SELECT * FROM t1 WHERE b like 'z%%%%%%%%%%%%%%%z%' ESCAPE 'a' ;
a	b	c	d	e
5	zzzz	zzzz	zzzz	zzzz
9	zaaz	zaaz	zaaz	zaaz
10	zbbz	zbbz	zbbz	zbbz
SELECT * FROM t1 WHERE b like 'z_%%%%%%%%%%%%%%%z%' ;
a	b	c	d	e
5	zzzz	zzzz	zzzz	zzzz
9	zaaz	zaaz	zaaz	zaaz
10	zbbz	zbbz	zbbz	zbbz
SELECT * FROM t1 WHERE b like 'z%_%%%%%%%%%%%%%z%' ESCAPE 'x' ;
a	b	c	d	e
5	zzzz	zzzz	zzzz	zzzz
9	zaaz	zaaz	zaaz	zaaz
10	zbbz	zbbz	zbbz	zbbz
SELECT * FROM t1 WHERE b like 'z%%%%%%%%%%%%%%%_z%' ESCAPE 'a' ;
a	b	c	d	e
5	zzzz	zzzz	zzzz	zzzz
9	zaaz	zaaz	zaaz	zaaz
10	zbbz	zbbz	zbbz	zbbz
SELECT * FROM t1 WHERE b like 'z%%%%%%%%%%%%%%%%%%%%%%%%%%%%%z%%%%%%%%%%%%%%%' ;
a	b	c	d	e
5	zzzz	zzzz	zzzz	zzzz
9	zaaz	zaaz	zaaz	zaaz
10	zbbz	zbbz	zbbz	zbbz
SELECT * FROM t1 WHERE b like 'z%%%%%%%%%%%%%%%%%%%%%%%%%%%%%z%%%%%%%%%%%%%%%' ESCAPE 'x' ;
a	b	c	d	e
5	zzzz	zzzz	zzzz	zzzz
9	zaaz	zaaz	zaaz	zaaz
10	zbbz	zbbz	zbbz	zbbz
SELECT * FROM t1 WHERE b like 'z%%%%%%%%%%%%%%%%%%%%%%%%%%%%%z%%%%%%%%%%%%%%%' ESCAPE 'a' ;
a	b	c	d	e
5	zzzz	zzzz	zzzz	zzzz
9	zaaz	zaaz	zaaz	zaaz
10	zbbz	zbbz	zbbz	zbbz
SELECT * FROM t1 WHERE b like 'z_%%%%%%%%%%%%%%%z%%%%%%%%%%%%%%%' ;
a	b	c	d	e
5	zzzz	zzzz	zzzz	zzzz
9	zaaz	zaaz	zaaz	zaaz
10	zbbz	zbbz	zbbz	zbbz
SELECT * FROM t1 WHERE b like 'z%%%%%%%%%%%%%%%_%%%%%%%%%%%%%z%%%%%%%%%%%%%%%' ESCAPE 'x' ;
a	b	c	d	e
5	zzzz	zzzz	zzzz	zzzz
9	zaaz	zaaz	zaaz	zaaz
10	zbbz	zbbz	zbbz	zbbz
SELECT * FROM t1 WHERE b like 'z%%%%%%%%%%%%%%%%%%%%%%%%%%%%%_z%%%%%%%%%%%%%%%' ESCAPE 'a' ;
a	b	c	d	e
5	zzzz	zzzz	zzzz	zzzz
9	zaaz	zaaz	zaaz	zaaz
10	zbbz	zbbz	zbbz	zbbz
-- col_str1 [NOT] LIKE ‘%xxx%’ [ESCAPE col_str3]
SELECT * FROM t1 WHERE b like '%xxx%' ;
a	b	c	d	e
2	xxxc	xxxb	xxxb	xxxb
3	xxxb	xxxc	xxxc	xxxc
4	xxxa	xxxa	xxxa	xxxa
7	zxxx	zxxx	zxxx	zxxx
8	axxx	axxx	axxx	axxx
SELECT * FROM t1 WHERE b like '%xxx%' ESCAPE 'x' ;
a	b	c	d	e
SELECT * FROM t1 WHERE b like '%xxx%' ESCAPE 'a' ;
a	b	c	d	e
2	xxxc	xxxb	xxxb	xxxb
3	xxxb	xxxc	xxxc	xxxc
4	xxxa	xxxa	xxxa	xxxa
7	zxxx	zxxx	zxxx	zxxx
8	axxx	axxx	axxx	axxx
SELECT * FROM t1 WHERE b NOT like '%xxx%' ;
a	b	c	d	e
1	aaaa	aaaa	aaaa	aaaa
5	zzzz	zzzz	zzzz	zzzz
9	zaaz	zaaz	zaaz	zaaz
10	zbbz	zbbz	zbbz	zbbz
SELECT * FROM t1 WHERE b NOT like '%xxx%' ESCAPE 'x' ;
a	b	c	d	e
1	aaaa	aaaa	aaaa	aaaa
2	xxxc	xxxb	xxxb	xxxb
3	xxxb	xxxc	xxxc	xxxc
4	xxxa	xxxa	xxxa	xxxa
5	zzzz	zzzz	zzzz	zzzz
7	zxxx	zxxx	zxxx	zxxx
8	axxx	axxx	axxx	axxx
9	zaaz	zaaz	zaaz	zaaz
10	zbbz	zbbz	zbbz	zbbz
SELECT * FROM t1 WHERE b NOT like '%xxx%' ESCAPE 'a' ;
a	b	c	d	e
1	aaaa	aaaa	aaaa	aaaa
5	zzzz	zzzz	zzzz	zzzz
9	zaaz	zaaz	zaaz	zaaz
10	zbbz	zbbz	zbbz	zbbz
-- col_str1 [NOT] LIKE ‘%xxx’ [ESCAPE col_str3]
SELECT * FROM t1 WHERE b like '%xxx' ;
a	b	c	d	e
7	zxxx	zxxx	zxxx	zxxx
8	axxx	axxx	axxx	axxx
SELECT * FROM t1 WHERE b like '%xxx' ESCAPE 'x' ;
a	b	c	d	e
7	zxxx	zxxx	zxxx	zxxx
8	axxx	axxx	axxx	axxx
SELECT * FROM t1 WHERE b like '%xxx' ESCAPE 'a' ;
a	b	c	d	e
7	zxxx	zxxx	zxxx	zxxx
8	axxx	axxx	axxx	axxx
SELECT * FROM t1 WHERE b NOT like '_xxx' ;
a	b	c	d	e
1	aaaa	aaaa	aaaa	aaaa
2	xxxc	xxxb	xxxb	xxxb
3	xxxb	xxxc	xxxc	xxxc
4	xxxa	xxxa	xxxa	xxxa
5	zzzz	zzzz	zzzz	zzzz
9	zaaz	zaaz	zaaz	zaaz
10	zbbz	zbbz	zbbz	zbbz
SELECT * FROM t1 WHERE b NOT like '_xxx' ESCAPE 'x' ;
a	b	c	d	e
1	aaaa	aaaa	aaaa	aaaa
2	xxxc	xxxb	xxxb	xxxb
3	xxxb	xxxc	xxxc	xxxc
4	xxxa	xxxa	xxxa	xxxa
5	zzzz	zzzz	zzzz	zzzz
7	zxxx	zxxx	zxxx	zxxx
8	axxx	axxx	axxx	axxx
9	zaaz	zaaz	zaaz	zaaz
10	zbbz	zbbz	zbbz	zbbz
SELECT * FROM t1 WHERE b NOT like '_xxx' ESCAPE 'a' ;
a	b	c	d	e
1	aaaa	aaaa	aaaa	aaaa
2	xxxc	xxxb	xxxb	xxxb
3	xxxb	xxxc	xxxc	xxxc
4	xxxa	xxxa	xxxa	xxxa
5	zzzz	zzzz	zzzz	zzzz
9	zaaz	zaaz	zaaz	zaaz
10	zbbz	zbbz	zbbz	zbbz
-- col_str1 [NOT] LIKE ‘xxx_’ [ESCAPE col_str3]
SELECT * FROM t1 WHERE b like 'xxx_' ;
a	b	c	d	e
2	xxxc	xxxb	xxxb	xxxb
3	xxxb	xxxc	xxxc	xxxc
4	xxxa	xxxa	xxxa	xxxa
SELECT * FROM t1 WHERE b like 'xxx_' ESCAPE 'x' ;
a	b	c	d	e
SELECT * FROM t1 WHERE b like 'xxx_' ESCAPE 'a' ;
a	b	c	d	e
2	xxxc	xxxb	xxxb	xxxb
3	xxxb	xxxc	xxxc	xxxc
4	xxxa	xxxa	xxxa	xxxa
SELECT * FROM t1 WHERE b NOT like 'xxx_' ;
a	b	c	d	e
1	aaaa	aaaa	aaaa	aaaa
5	zzzz	zzzz	zzzz	zzzz
7	zxxx	zxxx	zxxx	zxxx
8	axxx	axxx	axxx	axxx
9	zaaz	zaaz	zaaz	zaaz
10	zbbz	zbbz	zbbz	zbbz
SELECT * FROM t1 WHERE b NOT like 'xxx_' ESCAPE 'x' ;
a	b	c	d	e
1	aaaa	aaaa	aaaa	aaaa
2	xxxc	xxxb	xxxb	xxxb
3	xxxb	xxxc	xxxc	xxxc
4	xxxa	xxxa	xxxa	xxxa
5	zzzz	zzzz	zzzz	zzzz
7	zxxx	zxxx	zxxx	zxxx
8	axxx	axxx	axxx	axxx
9	zaaz	zaaz	zaaz	zaaz
10	zbbz	zbbz	zbbz	zbbz
SELECT * FROM t1 WHERE b NOT like 'xxx_' ESCAPE 'a' ;
a	b	c	d	e
1	aaaa	aaaa	aaaa	aaaa
5	zzzz	zzzz	zzzz	zzzz
7	zxxx	zxxx	zxxx	zxxx
8	axxx	axxx	axxx	axxx
9	zaaz	zaaz	zaaz	zaaz
10	zbbz	zbbz	zbbz	zbbz
-- col_str1 [NOT] LIKE ‘_xxx_’ [ESCAPE col_str3]
SELECT * FROM t1 WHERE b like '_xxx_' ;
a	b	c	d	e
SELECT * FROM t1 WHERE b like '_xxx_' ESCAPE 'x' ;
a	b	c	d	e
SELECT * FROM t1 WHERE b like '_xxx_' ESCAPE 'a' ;
a	b	c	d	e
SELECT * FROM t1 WHERE b NOT like '_xxx_' ;
a	b	c	d	e
1	aaaa	aaaa	aaaa	aaaa
2	xxxc	xxxb	xxxb	xxxb
3	xxxb	xxxc	xxxc	xxxc
4	xxxa	xxxa	xxxa	xxxa
5	zzzz	zzzz	zzzz	zzzz
7	zxxx	zxxx	zxxx	zxxx
8	axxx	axxx	axxx	axxx
9	zaaz	zaaz	zaaz	zaaz
10	zbbz	zbbz	zbbz	zbbz
SELECT * FROM t1 WHERE b NOT like '_xxx_' ESCAPE 'x' ;
a	b	c	d	e
1	aaaa	aaaa	aaaa	aaaa
2	xxxc	xxxb	xxxb	xxxb
3	xxxb	xxxc	xxxc	xxxc
4	xxxa	xxxa	xxxa	xxxa
5	zzzz	zzzz	zzzz	zzzz
7	zxxx	zxxx	zxxx	zxxx
8	axxx	axxx	axxx	axxx
9	zaaz	zaaz	zaaz	zaaz
10	zbbz	zbbz	zbbz	zbbz
SELECT * FROM t1 WHERE b NOT like '_xxx_' ESCAPE 'a' ;
a	b	c	d	e
1	aaaa	aaaa	aaaa	aaaa
2	xxxc	xxxb	xxxb	xxxb
3	xxxb	xxxc	xxxc	xxxc
4	xxxa	xxxa	xxxa	xxxa
5	zzzz	zzzz	zzzz	zzzz
7	zxxx	zxxx	zxxx	zxxx
8	axxx	axxx	axxx	axxx
9	zaaz	zaaz	zaaz	zaaz
10	zbbz	zbbz	zbbz	zbbz
-- col_str1 [NOT] LIKE ‘_xxx’ [ESCAPE col_str3]
SELECT * FROM t1 WHERE b like '_xxx' ;
a	b	c	d	e
7	zxxx	zxxx	zxxx	zxxx
8	axxx	axxx	axxx	axxx
SELECT * FROM t1 WHERE b like '_xxx' ESCAPE 'x' ;
a	b	c	d	e
SELECT * FROM t1 WHERE b like '_xxx' ESCAPE 'a' ;
a	b	c	d	e
7	zxxx	zxxx	zxxx	zxxx
8	axxx	axxx	axxx	axxx
SELECT * FROM t1 WHERE b NOT like '_xxx' ;
a	b	c	d	e
1	aaaa	aaaa	aaaa	aaaa
2	xxxc	xxxb	xxxb	xxxb
3	xxxb	xxxc	xxxc	xxxc
4	xxxa	xxxa	xxxa	xxxa
5	zzzz	zzzz	zzzz	zzzz
9	zaaz	zaaz	zaaz	zaaz
10	zbbz	zbbz	zbbz	zbbz
SELECT * FROM t1 WHERE b NOT like '_xxx' ESCAPE 'x' ;
a	b	c	d	e
1	aaaa	aaaa	aaaa	aaaa
2	xxxc	xxxb	xxxb	xxxb
3	xxxb	xxxc	xxxc	xxxc
4	xxxa	xxxa	xxxa	xxxa
5	zzzz	zzzz	zzzz	zzzz
7	zxxx	zxxx	zxxx	zxxx
8	axxx	axxx	axxx	axxx
9	zaaz	zaaz	zaaz	zaaz
10	zbbz	zbbz	zbbz	zbbz
SELECT * FROM t1 WHERE b NOT like '_xxx' ESCAPE 'a' ;
a	b	c	d	e
1	aaaa	aaaa	aaaa	aaaa
2	xxxc	xxxb	xxxb	xxxb
3	xxxb	xxxc	xxxc	xxxc
4	xxxa	xxxa	xxxa	xxxa
5	zzzz	zzzz	zzzz	zzzz
9	zaaz	zaaz	zaaz	zaaz
10	zbbz	zbbz	zbbz	zbbz
-- col_str1 [NOT] LIKE ‘_xxx%’ [ESCAPE col_str3]
SELECT * FROM t1 WHERE b like '_xxx%' ;
a	b	c	d	e
7	zxxx	zxxx	zxxx	zxxx
8	axxx	axxx	axxx	axxx
SELECT * FROM t1 WHERE b like '_xxx%' ESCAPE 'x' ;
a	b	c	d	e
SELECT * FROM t1 WHERE b like '_xxx%' ESCAPE 'a' ;
a	b	c	d	e
7	zxxx	zxxx	zxxx	zxxx
8	axxx	axxx	axxx	axxx
SELECT * FROM t1 WHERE b NOT like '_xxx%' ;
a	b	c	d	e
1	aaaa	aaaa	aaaa	aaaa
2	xxxc	xxxb	xxxb	xxxb
3	xxxb	xxxc	xxxc	xxxc
4	xxxa	xxxa	xxxa	xxxa
5	zzzz	zzzz	zzzz	zzzz
9	zaaz	zaaz	zaaz	zaaz
10	zbbz	zbbz	zbbz	zbbz
SELECT * FROM t1 WHERE b NOT like '_xxx%' ESCAPE 'x' ;
a	b	c	d	e
1	aaaa	aaaa	aaaa	aaaa
2	xxxc	xxxb	xxxb	xxxb
3	xxxb	xxxc	xxxc	xxxc
4	xxxa	xxxa	xxxa	xxxa
5	zzzz	zzzz	zzzz	zzzz
7	zxxx	zxxx	zxxx	zxxx
8	axxx	axxx	axxx	axxx
9	zaaz	zaaz	zaaz	zaaz
10	zbbz	zbbz	zbbz	zbbz
SELECT * FROM t1 WHERE b NOT like '_xxx%' ESCAPE 'a' ;
a	b	c	d	e
1	aaaa	aaaa	aaaa	aaaa
2	xxxc	xxxb	xxxb	xxxb
3	xxxb	xxxc	xxxc	xxxc
4	xxxa	xxxa	xxxa	xxxa
5	zzzz	zzzz	zzzz	zzzz
9	zaaz	zaaz	zaaz	zaaz
10	zbbz	zbbz	zbbz	zbbz
-- col_str1 [NOT] LIKE ‘%xxx_’ [ESCAPE col_str3]
SELECT * FROM t1 WHERE b like '%xxx_' ;
a	b	c	d	e
2	xxxc	xxxb	xxxb	xxxb
3	xxxb	xxxc	xxxc	xxxc
4	xxxa	xxxa	xxxa	xxxa
SELECT * FROM t1 WHERE b like '%xxx_' ESCAPE 'x' ;
a	b	c	d	e
SELECT * FROM t1 WHERE b like '%xxx_' ESCAPE 'a' ;
a	b	c	d	e
2	xxxc	xxxb	xxxb	xxxb
3	xxxb	xxxc	xxxc	xxxc
4	xxxa	xxxa	xxxa	xxxa
SELECT * FROM t1 WHERE b NOT like '%xxx_' ;
a	b	c	d	e
1	aaaa	aaaa	aaaa	aaaa
5	zzzz	zzzz	zzzz	zzzz
7	zxxx	zxxx	zxxx	zxxx
8	axxx	axxx	axxx	axxx
9	zaaz	zaaz	zaaz	zaaz
10	zbbz	zbbz	zbbz	zbbz
SELECT * FROM t1 WHERE b NOT like '%xxx_' ESCAPE 'x' ;
a	b	c	d	e
1	aaaa	aaaa	aaaa	aaaa
2	xxxc	xxxb	xxxb	xxxb
3	xxxb	xxxc	xxxc	xxxc
4	xxxa	xxxa	xxxa	xxxa
5	zzzz	zzzz	zzzz	zzzz
7	zxxx	zxxx	zxxx	zxxx
8	axxx	axxx	axxx	axxx
9	zaaz	zaaz	zaaz	zaaz
10	zbbz	zbbz	zbbz	zbbz
SELECT * FROM t1 WHERE b NOT like '%xxx_' ESCAPE 'a' ;
a	b	c	d	e
1	aaaa	aaaa	aaaa	aaaa
5	zzzz	zzzz	zzzz	zzzz
7	zxxx	zxxx	zxxx	zxxx
8	axxx	axxx	axxx	axxx
9	zaaz	zaaz	zaaz	zaaz
10	zbbz	zbbz	zbbz	zbbz
-- col_str1 [NOT] LIKE ‘_x_x_’ [ESCAPE col_str3]
SELECT * FROM t1 WHERE b like '_x_x_' ;
a	b	c	d	e
SELECT * FROM t1 WHERE b like '_x_x_' ESCAPE 'x' ;
a	b	c	d	e
SELECT * FROM t1 WHERE b like '_x_x_' ESCAPE 'a' ;
a	b	c	d	e
SELECT * FROM t1 WHERE b NOT like '_x_x_' ;
a	b	c	d	e
1	aaaa	aaaa	aaaa	aaaa
2	xxxc	xxxb	xxxb	xxxb
3	xxxb	xxxc	xxxc	xxxc
4	xxxa	xxxa	xxxa	xxxa
5	zzzz	zzzz	zzzz	zzzz
7	zxxx	zxxx	zxxx	zxxx
8	axxx	axxx	axxx	axxx
9	zaaz	zaaz	zaaz	zaaz
10	zbbz	zbbz	zbbz	zbbz
SELECT * FROM t1 WHERE b NOT like '_x_x_' ESCAPE 'x' ;
a	b	c	d	e
1	aaaa	aaaa	aaaa	aaaa
2	xxxc	xxxb	xxxb	xxxb
3	xxxb	xxxc	xxxc	xxxc
4	xxxa	xxxa	xxxa	xxxa
5	zzzz	zzzz	zzzz	zzzz
7	zxxx	zxxx	zxxx	zxxx
8	axxx	axxx	axxx	axxx
9	zaaz	zaaz	zaaz	zaaz
10	zbbz	zbbz	zbbz	zbbz
SELECT * FROM t1 WHERE b NOT like '_x_x_' ESCAPE 'a' ;
a	b	c	d	e
1	aaaa	aaaa	aaaa	aaaa
2	xxxc	xxxb	xxxb	xxxb
3	xxxb	xxxc	xxxc	xxxc
4	xxxa	xxxa	xxxa	xxxa
5	zzzz	zzzz	zzzz	zzzz
7	zxxx	zxxx	zxxx	zxxx
8	axxx	axxx	axxx	axxx
9	zaaz	zaaz	zaaz	zaaz
10	zbbz	zbbz	zbbz	zbbz
-- col_str1 [NOT] LIKE ‘_x_x%’ [ESCAPE col_str3]
SELECT * FROM t1 WHERE b like '_x_x%' ;
a	b	c	d	e
7	zxxx	zxxx	zxxx	zxxx
8	axxx	axxx	axxx	axxx
SELECT * FROM t1 WHERE b like '_x_x%' ESCAPE 'x' ;
a	b	c	d	e
SELECT * FROM t1 WHERE b like '_x_x%' ESCAPE 'a' ;
a	b	c	d	e
7	zxxx	zxxx	zxxx	zxxx
8	axxx	axxx	axxx	axxx
SELECT * FROM t1 WHERE b NOT like '_x_x%' ;
a	b	c	d	e
1	aaaa	aaaa	aaaa	aaaa
2	xxxc	xxxb	xxxb	xxxb
3	xxxb	xxxc	xxxc	xxxc
4	xxxa	xxxa	xxxa	xxxa
5	zzzz	zzzz	zzzz	zzzz
9	zaaz	zaaz	zaaz	zaaz
10	zbbz	zbbz	zbbz	zbbz
SELECT * FROM t1 WHERE b NOT like '_x_x%' ESCAPE 'x' ;
a	b	c	d	e
1	aaaa	aaaa	aaaa	aaaa
2	xxxc	xxxb	xxxb	xxxb
3	xxxb	xxxc	xxxc	xxxc
4	xxxa	xxxa	xxxa	xxxa
5	zzzz	zzzz	zzzz	zzzz
7	zxxx	zxxx	zxxx	zxxx
8	axxx	axxx	axxx	axxx
9	zaaz	zaaz	zaaz	zaaz
10	zbbz	zbbz	zbbz	zbbz
SELECT * FROM t1 WHERE b NOT like '_x_x%' ESCAPE 'a' ;
a	b	c	d	e
1	aaaa	aaaa	aaaa	aaaa
2	xxxc	xxxb	xxxb	xxxb
3	xxxb	xxxc	xxxc	xxxc
4	xxxa	xxxa	xxxa	xxxa
5	zzzz	zzzz	zzzz	zzzz
9	zaaz	zaaz	zaaz	zaaz
10	zbbz	zbbz	zbbz	zbbz
-- col_str1 [NOT] LIKE ‘_x%x_’ [ESCAPE col_str3]
SELECT * FROM t1 WHERE b like '_x%x_' ;
a	b	c	d	e
2	xxxc	xxxb	xxxb	xxxb
3	xxxb	xxxc	xxxc	xxxc
4	xxxa	xxxa	xxxa	xxxa
7	zxxx	zxxx	zxxx	zxxx
8	axxx	axxx	axxx	axxx
SELECT * FROM t1 WHERE b like '_x%x_' ESCAPE 'x' ;
a	b	c	d	e
SELECT * FROM t1 WHERE b like '_x%x_' ESCAPE 'a' ;
a	b	c	d	e
2	xxxc	xxxb	xxxb	xxxb
3	xxxb	xxxc	xxxc	xxxc
4	xxxa	xxxa	xxxa	xxxa
7	zxxx	zxxx	zxxx	zxxx
8	axxx	axxx	axxx	axxx
SELECT * FROM t1 WHERE b NOT like '_x%x_' ;
a	b	c	d	e
1	aaaa	aaaa	aaaa	aaaa
5	zzzz	zzzz	zzzz	zzzz
9	zaaz	zaaz	zaaz	zaaz
10	zbbz	zbbz	zbbz	zbbz
SELECT * FROM t1 WHERE b NOT like '_x%x_' ESCAPE 'x' ;
a	b	c	d	e
1	aaaa	aaaa	aaaa	aaaa
2	xxxc	xxxb	xxxb	xxxb
3	xxxb	xxxc	xxxc	xxxc
4	xxxa	xxxa	xxxa	xxxa
5	zzzz	zzzz	zzzz	zzzz
7	zxxx	zxxx	zxxx	zxxx
8	axxx	axxx	axxx	axxx
9	zaaz	zaaz	zaaz	zaaz
10	zbbz	zbbz	zbbz	zbbz
SELECT * FROM t1 WHERE b NOT like '_x%x_' ESCAPE 'a' ;
a	b	c	d	e
1	aaaa	aaaa	aaaa	aaaa
5	zzzz	zzzz	zzzz	zzzz
9	zaaz	zaaz	zaaz	zaaz
10	zbbz	zbbz	zbbz	zbbz
-- col_str1 [NOT] LIKE ‘_x%x%’ [ESCAPE col_str3]
SELECT * FROM t1 WHERE b like '_x%x%' ;
a	b	c	d	e
2	xxxc	xxxb	xxxb	xxxb
3	xxxb	xxxc	xxxc	xxxc
4	xxxa	xxxa	xxxa	xxxa
7	zxxx	zxxx	zxxx	zxxx
8	axxx	axxx	axxx	axxx
SELECT * FROM t1 WHERE b like '_x%x%' ESCAPE 'x' ;
a	b	c	d	e
SELECT * FROM t1 WHERE b like '_x%x%' ESCAPE 'a' ;
a	b	c	d	e
2	xxxc	xxxb	xxxb	xxxb
3	xxxb	xxxc	xxxc	xxxc
4	xxxa	xxxa	xxxa	xxxa
7	zxxx	zxxx	zxxx	zxxx
8	axxx	axxx	axxx	axxx
SELECT * FROM t1 WHERE b NOT like '_x%x%' ;
a	b	c	d	e
1	aaaa	aaaa	aaaa	aaaa
5	zzzz	zzzz	zzzz	zzzz
9	zaaz	zaaz	zaaz	zaaz
10	zbbz	zbbz	zbbz	zbbz
SELECT * FROM t1 WHERE b NOT like '_x%x%' ESCAPE 'x' ;
a	b	c	d	e
1	aaaa	aaaa	aaaa	aaaa
2	xxxc	xxxb	xxxb	xxxb
3	xxxb	xxxc	xxxc	xxxc
4	xxxa	xxxa	xxxa	xxxa
5	zzzz	zzzz	zzzz	zzzz
7	zxxx	zxxx	zxxx	zxxx
8	axxx	axxx	axxx	axxx
9	zaaz	zaaz	zaaz	zaaz
10	zbbz	zbbz	zbbz	zbbz
SELECT * FROM t1 WHERE b NOT like '_x%x%' ESCAPE 'a' ;
a	b	c	d	e
1	aaaa	aaaa	aaaa	aaaa
5	zzzz	zzzz	zzzz	zzzz
9	zaaz	zaaz	zaaz	zaaz
10	zbbz	zbbz	zbbz	zbbz
-- col_str1 [NOT] LIKE ‘%x_x_’ [ESCAPE col_str3]
SELECT * FROM t1 WHERE b like '%x_x_' ;
a	b	c	d	e
2	xxxc	xxxb	xxxb	xxxb
3	xxxb	xxxc	xxxc	xxxc
4	xxxa	xxxa	xxxa	xxxa
SELECT * FROM t1 WHERE b like '%x_x_' ESCAPE 'x' ;
a	b	c	d	e
SELECT * FROM t1 WHERE b like '%x_x_' ESCAPE 'a' ;
a	b	c	d	e
2	xxxc	xxxb	xxxb	xxxb
3	xxxb	xxxc	xxxc	xxxc
4	xxxa	xxxa	xxxa	xxxa
SELECT * FROM t1 WHERE b NOT like '%x_x_' ;
a	b	c	d	e
1	aaaa	aaaa	aaaa	aaaa
5	zzzz	zzzz	zzzz	zzzz
7	zxxx	zxxx	zxxx	zxxx
8	axxx	axxx	axxx	axxx
9	zaaz	zaaz	zaaz	zaaz
10	zbbz	zbbz	zbbz	zbbz
SELECT * FROM t1 WHERE b NOT like '%x_x_' ESCAPE 'x' ;
a	b	c	d	e
1	aaaa	aaaa	aaaa	aaaa
2	xxxc	xxxb	xxxb	xxxb
3	xxxb	xxxc	xxxc	xxxc
4	xxxa	xxxa	xxxa	xxxa
5	zzzz	zzzz	zzzz	zzzz
7	zxxx	zxxx	zxxx	zxxx
8	axxx	axxx	axxx	axxx
9	zaaz	zaaz	zaaz	zaaz
10	zbbz	zbbz	zbbz	zbbz
SELECT * FROM t1 WHERE b NOT like '%x_x_' ESCAPE 'a' ;
a	b	c	d	e
1	aaaa	aaaa	aaaa	aaaa
5	zzzz	zzzz	zzzz	zzzz
7	zxxx	zxxx	zxxx	zxxx
8	axxx	axxx	axxx	axxx
9	zaaz	zaaz	zaaz	zaaz
10	zbbz	zbbz	zbbz	zbbz
-- col_str1 [NOT] LIKE ‘%x_x%’ [ESCAPE col_str3]
SELECT * FROM t1 WHERE b like '%x_x%' ;
a	b	c	d	e
2	xxxc	xxxb	xxxb	xxxb
3	xxxb	xxxc	xxxc	xxxc
4	xxxa	xxxa	xxxa	xxxa
7	zxxx	zxxx	zxxx	zxxx
8	axxx	axxx	axxx	axxx
SELECT * FROM t1 WHERE b like '%x_x%' ESCAPE 'x' ;
a	b	c	d	e
SELECT * FROM t1 WHERE b like '%x_x%' ESCAPE 'a' ;
a	b	c	d	e
2	xxxc	xxxb	xxxb	xxxb
3	xxxb	xxxc	xxxc	xxxc
4	xxxa	xxxa	xxxa	xxxa
7	zxxx	zxxx	zxxx	zxxx
8	axxx	axxx	axxx	axxx
SELECT * FROM t1 WHERE b NOT like '%x_x%' ;
a	b	c	d	e
1	aaaa	aaaa	aaaa	aaaa
5	zzzz	zzzz	zzzz	zzzz
9	zaaz	zaaz	zaaz	zaaz
10	zbbz	zbbz	zbbz	zbbz
SELECT * FROM t1 WHERE b NOT like '%x_x%' ESCAPE 'x' ;
a	b	c	d	e
1	aaaa	aaaa	aaaa	aaaa
2	xxxc	xxxb	xxxb	xxxb
3	xxxb	xxxc	xxxc	xxxc
4	xxxa	xxxa	xxxa	xxxa
5	zzzz	zzzz	zzzz	zzzz
7	zxxx	zxxx	zxxx	zxxx
8	axxx	axxx	axxx	axxx
9	zaaz	zaaz	zaaz	zaaz
10	zbbz	zbbz	zbbz	zbbz
SELECT * FROM t1 WHERE b NOT like '%x_x%' ESCAPE 'a' ;
a	b	c	d	e
1	aaaa	aaaa	aaaa	aaaa
5	zzzz	zzzz	zzzz	zzzz
9	zaaz	zaaz	zaaz	zaaz
10	zbbz	zbbz	zbbz	zbbz
-- col_str1 [NOT] LIKE ‘%x%x_’ [ESCAPE col_str3]
SELECT * FROM t1 WHERE b like '%x%x_' ;
a	b	c	d	e
2	xxxc	xxxb	xxxb	xxxb
3	xxxb	xxxc	xxxc	xxxc
4	xxxa	xxxa	xxxa	xxxa
7	zxxx	zxxx	zxxx	zxxx
8	axxx	axxx	axxx	axxx
SELECT * FROM t1 WHERE b like '%x%x_' ESCAPE 'x' ;
a	b	c	d	e
SELECT * FROM t1 WHERE b like '%x%x_' ESCAPE 'a' ;
a	b	c	d	e
2	xxxc	xxxb	xxxb	xxxb
3	xxxb	xxxc	xxxc	xxxc
4	xxxa	xxxa	xxxa	xxxa
7	zxxx	zxxx	zxxx	zxxx
8	axxx	axxx	axxx	axxx
SELECT * FROM t1 WHERE b NOT like '%x%x_' ;
a	b	c	d	e
1	aaaa	aaaa	aaaa	aaaa
5	zzzz	zzzz	zzzz	zzzz
9	zaaz	zaaz	zaaz	zaaz
10	zbbz	zbbz	zbbz	zbbz
SELECT * FROM t1 WHERE b NOT like '%x%x_' ESCAPE 'x' ;
a	b	c	d	e
1	aaaa	aaaa	aaaa	aaaa
2	xxxc	xxxb	xxxb	xxxb
3	xxxb	xxxc	xxxc	xxxc
4	xxxa	xxxa	xxxa	xxxa
5	zzzz	zzzz	zzzz	zzzz
7	zxxx	zxxx	zxxx	zxxx
8	axxx	axxx	axxx	axxx
9	zaaz	zaaz	zaaz	zaaz
10	zbbz	zbbz	zbbz	zbbz
SELECT * FROM t1 WHERE b NOT like '%x%x_' ESCAPE 'a' ;
a	b	c	d	e
1	aaaa	aaaa	aaaa	aaaa
5	zzzz	zzzz	zzzz	zzzz
9	zaaz	zaaz	zaaz	zaaz
10	zbbz	zbbz	zbbz	zbbz
-- col_str1 [NOT] LIKE ‘%x%x%’ [ESCAPE col_str3]
SELECT * FROM t1 WHERE b like '%x%x%' ;
a	b	c	d	e
2	xxxc	xxxb	xxxb	xxxb
3	xxxb	xxxc	xxxc	xxxc
4	xxxa	xxxa	xxxa	xxxa
7	zxxx	zxxx	zxxx	zxxx
8	axxx	axxx	axxx	axxx
SELECT * FROM t1 WHERE b like '%x%x%' ESCAPE 'x' ;
a	b	c	d	e
SELECT * FROM t1 WHERE b like '%x%x%' ESCAPE 'a' ;
a	b	c	d	e
2	xxxc	xxxb	xxxb	xxxb
3	xxxb	xxxc	xxxc	xxxc
4	xxxa	xxxa	xxxa	xxxa
7	zxxx	zxxx	zxxx	zxxx
8	axxx	axxx	axxx	axxx
SELECT * FROM t1 WHERE b NOT like '%x%x%' ;
a	b	c	d	e
1	aaaa	aaaa	aaaa	aaaa
5	zzzz	zzzz	zzzz	zzzz
9	zaaz	zaaz	zaaz	zaaz
10	zbbz	zbbz	zbbz	zbbz
SELECT * FROM t1 WHERE b NOT like '%x%x%' ESCAPE 'x' ;
a	b	c	d	e
1	aaaa	aaaa	aaaa	aaaa
2	xxxc	xxxb	xxxb	xxxb
3	xxxb	xxxc	xxxc	xxxc
4	xxxa	xxxa	xxxa	xxxa
5	zzzz	zzzz	zzzz	zzzz
7	zxxx	zxxx	zxxx	zxxx
8	axxx	axxx	axxx	axxx
9	zaaz	zaaz	zaaz	zaaz
10	zbbz	zbbz	zbbz	zbbz
SELECT * FROM t1 WHERE b NOT like '%x%x%' ESCAPE 'a' ;
a	b	c	d	e
1	aaaa	aaaa	aaaa	aaaa
5	zzzz	zzzz	zzzz	zzzz
9	zaaz	zaaz	zaaz	zaaz
10	zbbz	zbbz	zbbz	zbbz
-- NULL [NOT] LIKE col_str2 [ESCAPE col_str3]
SELECT * FROM t1 WHERE NULL like 'xxx%' ;
a	b	c	d	e
SELECT * FROM t1 WHERE NULL like 'xxx%' ESCAPE 'x' ;
a	b	c	d	e
SELECT * FROM t1 WHERE NULL like 'xxx%' ESCAPE 'a' ;
a	b	c	d	e
SELECT * FROM t1 WHERE NULL NOT like 'xxx%' ;
a	b	c	d	e
SELECT * FROM t1 WHERE NULL NOT like 'xxx%' ESCAPE 'x' ;
a	b	c	d	e
SELECT * FROM t1 WHERE NULL NOT like 'xxx%' ESCAPE 'a' ;
a	b	c	d	e
-- col_str1 [NOT] LIKE ‘NULL’ [ESCAPE col_str3]
SELECT * FROM t1 WHERE b like NULL ;
a	b	c	d	e
SELECT * FROM t1 WHERE b like NULL ESCAPE 'x' ;
a	b	c	d	e
SELECT * FROM t1 WHERE b like NULL ESCAPE 'a' ;
a	b	c	d	e
SELECT * FROM t1 WHERE b NOT like NULL ;
a	b	c	d	e
SELECT * FROM t1 WHERE b NOT like NULL ESCAPE 'x' ;
a	b	c	d	e
SELECT * FROM t1 WHERE b NOT like NULL ESCAPE 'a' ;
a	b	c	d	e
-- col_str1 [NOT] LIKE col_str2 [ESCAPE NULL]
SELECT * FROM t1 WHERE b like 'xxx%' ESCAPE NULL ;
a	b	c	d	e
2	xxxc	xxxb	xxxb	xxxb
3	xxxb	xxxc	xxxc	xxxc
4	xxxa	xxxa	xxxa	xxxa
SELECT * FROM t1 WHERE b NOT like 'xxx%' ESCAPE NULL ;
a	b	c	d	e
1	aaaa	aaaa	aaaa	aaaa
5	zzzz	zzzz	zzzz	zzzz
7	zxxx	zxxx	zxxx	zxxx
8	axxx	axxx	axxx	axxx
9	zaaz	zaaz	zaaz	zaaz
10	zbbz	zbbz	zbbz	zbbz
-- col_str1 [NOT] LIKE col_str2 [ESCAPE col_str3]其中col_str1分别为联合索引前缀字段、中间字段、尾部字段
SELECT * FROM t1 WHERE c like 'xxx%' ;
a	b	c	d	e
2	xxxc	xxxb	xxxb	xxxb
3	xxxb	xxxc	xxxc	xxxc
4	xxxa	xxxa	xxxa	xxxa
SELECT * FROM t1 WHERE c like 'xxx%' ESCAPE 'x' ;
a	b	c	d	e
SELECT * FROM t1 WHERE c like 'xxx%' ESCAPE 'a' ;
a	b	c	d	e
4	xxxa	xxxa	xxxa	xxxa
2	xxxc	xxxb	xxxb	xxxb
3	xxxb	xxxc	xxxc	xxxc
SELECT * FROM t1 WHERE c NOT like 'xxx%' ;
a	b	c	d	e
1	aaaa	aaaa	aaaa	aaaa
5	zzzz	zzzz	zzzz	zzzz
7	zxxx	zxxx	zxxx	zxxx
8	axxx	axxx	axxx	axxx
9	zaaz	zaaz	zaaz	zaaz
10	zbbz	zbbz	zbbz	zbbz
SELECT * FROM t1 WHERE c NOT like 'xxx%' ESCAPE 'x' ;
a	b	c	d	e
1	aaaa	aaaa	aaaa	aaaa
2	xxxc	xxxb	xxxb	xxxb
3	xxxb	xxxc	xxxc	xxxc
4	xxxa	xxxa	xxxa	xxxa
5	zzzz	zzzz	zzzz	zzzz
7	zxxx	zxxx	zxxx	zxxx
8	axxx	axxx	axxx	axxx
9	zaaz	zaaz	zaaz	zaaz
10	zbbz	zbbz	zbbz	zbbz
SELECT * FROM t1 WHERE c NOT like 'xxx%' ESCAPE 'a' ;
a	b	c	d	e
1	aaaa	aaaa	aaaa	aaaa
5	zzzz	zzzz	zzzz	zzzz
7	zxxx	zxxx	zxxx	zxxx
8	axxx	axxx	axxx	axxx
9	zaaz	zaaz	zaaz	zaaz
10	zbbz	zbbz	zbbz	zbbz
SELECT * FROM t1 WHERE d like 'xxx%' ;
a	b	c	d	e
2	xxxc	xxxb	xxxb	xxxb
3	xxxb	xxxc	xxxc	xxxc
4	xxxa	xxxa	xxxa	xxxa
6	NULL	NULL	xxxa	xxxa
SELECT * FROM t1 WHERE d like 'xxx%' ESCAPE 'x' ;
a	b	c	d	e
SELECT * FROM t1 WHERE d like 'xxx%' ESCAPE 'a' ;
a	b	c	d	e
2	xxxc	xxxb	xxxb	xxxb
3	xxxb	xxxc	xxxc	xxxc
4	xxxa	xxxa	xxxa	xxxa
6	NULL	NULL	xxxa	xxxa
SELECT * FROM t1 WHERE d NOT like 'xxx%' ;
a	b	c	d	e
1	aaaa	aaaa	aaaa	aaaa
5	zzzz	zzzz	zzzz	zzzz
7	zxxx	zxxx	zxxx	zxxx
8	axxx	axxx	axxx	axxx
9	zaaz	zaaz	zaaz	zaaz
10	zbbz	zbbz	zbbz	zbbz
SELECT * FROM t1 WHERE d NOT like 'xxx%' ESCAPE 'x' ;
a	b	c	d	e
1	aaaa	aaaa	aaaa	aaaa
2	xxxc	xxxb	xxxb	xxxb
3	xxxb	xxxc	xxxc	xxxc
4	xxxa	xxxa	xxxa	xxxa
5	zzzz	zzzz	zzzz	zzzz
6	NULL	NULL	xxxa	xxxa
7	zxxx	zxxx	zxxx	zxxx
8	axxx	axxx	axxx	axxx
9	zaaz	zaaz	zaaz	zaaz
10	zbbz	zbbz	zbbz	zbbz
SELECT * FROM t1 WHERE d NOT like 'xxx%' ESCAPE 'a' ;
a	b	c	d	e
1	aaaa	aaaa	aaaa	aaaa
5	zzzz	zzzz	zzzz	zzzz
7	zxxx	zxxx	zxxx	zxxx
8	axxx	axxx	axxx	axxx
9	zaaz	zaaz	zaaz	zaaz
10	zbbz	zbbz	zbbz	zbbz
SELECT * FROM t1 WHERE e like 'xxx%' ;
a	b	c	d	e
2	xxxc	xxxb	xxxb	xxxb
3	xxxb	xxxc	xxxc	xxxc
4	xxxa	xxxa	xxxa	xxxa
6	NULL	NULL	xxxa	xxxa
SELECT * FROM t1 WHERE e like 'xxx%' ESCAPE 'x' ;
a	b	c	d	e
SELECT * FROM t1 WHERE e like 'xxx%' ESCAPE 'a' ;
a	b	c	d	e
2	xxxc	xxxb	xxxb	xxxb
3	xxxb	xxxc	xxxc	xxxc
4	xxxa	xxxa	xxxa	xxxa
6	NULL	NULL	xxxa	xxxa
SELECT * FROM t1 WHERE e NOT like 'xxx%' ;
a	b	c	d	e
1	aaaa	aaaa	aaaa	aaaa
5	zzzz	zzzz	zzzz	zzzz
7	zxxx	zxxx	zxxx	zxxx
8	axxx	axxx	axxx	axxx
9	zaaz	zaaz	zaaz	zaaz
10	zbbz	zbbz	zbbz	zbbz
SELECT * FROM t1 WHERE e NOT like 'xxx%' ESCAPE 'x' ;
a	b	c	d	e
1	aaaa	aaaa	aaaa	aaaa
2	xxxc	xxxb	xxxb	xxxb
3	xxxb	xxxc	xxxc	xxxc
4	xxxa	xxxa	xxxa	xxxa
5	zzzz	zzzz	zzzz	zzzz
6	NULL	NULL	xxxa	xxxa
7	zxxx	zxxx	zxxx	zxxx
8	axxx	axxx	axxx	axxx
9	zaaz	zaaz	zaaz	zaaz
10	zbbz	zbbz	zbbz	zbbz
SELECT * FROM t1 WHERE e NOT like 'xxx%' ESCAPE 'a' ;
a	b	c	d	e
1	aaaa	aaaa	aaaa	aaaa
5	zzzz	zzzz	zzzz	zzzz
7	zxxx	zxxx	zxxx	zxxx
8	axxx	axxx	axxx	axxx
9	zaaz	zaaz	zaaz	zaaz
10	zbbz	zbbz	zbbz	zbbz
-- col_str1||’xxx’ [NOT] LIKE col_str2 [ESCAPE col_str3]
SELECT * FROM t1 WHERE 'xxx'||b like 'xxxxxx%' ;
a	b	c	d	e
SELECT * FROM t1 WHERE 'xxx'||b like 'xxxxxx%' ESCAPE 'x' ;
a	b	c	d	e
2	xxxc	xxxb	xxxb	xxxb
3	xxxb	xxxc	xxxc	xxxc
4	xxxa	xxxa	xxxa	xxxa
SELECT * FROM t1 WHERE 'xxx'||b like 'xxxxxx%' ESCAPE 'a' ;
a	b	c	d	e
SELECT * FROM t1 WHERE 'xxx'||b NOT like 'xxxxxx%' ;
a	b	c	d	e
1	aaaa	aaaa	aaaa	aaaa
2	xxxc	xxxb	xxxb	xxxb
3	xxxb	xxxc	xxxc	xxxc
4	xxxa	xxxa	xxxa	xxxa
5	zzzz	zzzz	zzzz	zzzz
7	zxxx	zxxx	zxxx	zxxx
8	axxx	axxx	axxx	axxx
9	zaaz	zaaz	zaaz	zaaz
10	zbbz	zbbz	zbbz	zbbz
SELECT * FROM t1 WHERE 'xxx'||b NOT like 'xxxxxx%' ESCAPE 'x' ;
a	b	c	d	e
1	aaaa	aaaa	aaaa	aaaa
5	zzzz	zzzz	zzzz	zzzz
7	zxxx	zxxx	zxxx	zxxx
8	axxx	axxx	axxx	axxx
9	zaaz	zaaz	zaaz	zaaz
10	zbbz	zbbz	zbbz	zbbz
SELECT * FROM t1 WHERE 'xxx'||b NOT like 'xxxxxx%' ESCAPE 'a' ;
a	b	c	d	e
1	aaaa	aaaa	aaaa	aaaa
2	xxxc	xxxb	xxxb	xxxb
3	xxxb	xxxc	xxxc	xxxc
4	xxxa	xxxa	xxxa	xxxa
5	zzzz	zzzz	zzzz	zzzz
7	zxxx	zxxx	zxxx	zxxx
8	axxx	axxx	axxx	axxx
9	zaaz	zaaz	zaaz	zaaz
10	zbbz	zbbz	zbbz	zbbz
-- col like col_str2中col_str2是concat、substr、upper、lower等字符串函数的输出
SELECT * FROM t1 WHERE CONCAT(b,'ccc') like 'xxx%' ;
a	b	c	d	e
2	xxxc	xxxb	xxxb	xxxb
3	xxxb	xxxc	xxxc	xxxc
4	xxxa	xxxa	xxxa	xxxa
SELECT * FROM t1 WHERE REPEAT(b,5) like 'xxx%' ESCAPE 'x' ;
a	b	c	d	e
SELECT * FROM t1 WHERE LOWER(b) like 'xxx%' ESCAPE 'a' ;
a	b	c	d	e
2	xxxc	xxxb	xxxb	xxxb
3	xxxb	xxxc	xxxc	xxxc
4	xxxa	xxxa	xxxa	xxxa
SELECT * FROM t1 WHERE SUBSTR(b,1,4) like 'xxx%' ESCAPE 'a' ;
a	b	c	d	e
2	xxxc	xxxb	xxxb	xxxb
3	xxxb	xxxc	xxxc	xxxc
4	xxxa	xxxa	xxxa	xxxa
SELECT * FROM t1 WHERE b like CONCAT('xxx' , '%') ;
a	b	c	d	e
2	xxxc	xxxb	xxxb	xxxb
3	xxxb	xxxc	xxxc	xxxc
4	xxxa	xxxa	xxxa	xxxa
EXPLAIN SELECT * FROM t1 WHERE b like REPEAT('x' , 3) ;
EXPLAIN SELECT * FROM t1 WHERE b like SUBSTR('%xxx%',2,4) ;
EXPLAIN SELECT * FROM t1 WHERE b like UPPER('xxx%') ;
EXPLAIN SELECT * FROM t1 WHERE b like LOWER('XXX%') ;
-- 通过and/or连接多个like表达式
SELECT * FROM t1 WHERE b like 'xxx%' and b like 'yyy%' ;
a	b	c	d	e
SELECT * FROM t1 WHERE b like 'xxx%' ESCAPE 'x' or b like 'xxx%' ;
a	b	c	d	e
2	xxxc	xxxb	xxxb	xxxb
3	xxxb	xxxc	xxxc	xxxc
4	xxxa	xxxa	xxxa	xxxa
SELECT * FROM t1 WHERE b like 'xxx%' ESCAPE 'a' or b like 'xxx%' and b not like 'yyy%' ;
a	b	c	d	e
2	xxxc	xxxb	xxxb	xxxb
3	xxxb	xxxc	xxxc	xxxc
4	xxxa	xxxa	xxxa	xxxa
SELECT * FROM t1 WHERE b != 'xxxx' and b like 'xxx%' ;
a	b	c	d	e
2	xxxc	xxxb	xxxb	xxxb
3	xxxb	xxxc	xxxc	xxxc
4	xxxa	xxxa	xxxa	xxxa
SELECT * FROM t1 WHERE b = 'xxxx' or b like 'xxx%' ;
a	b	c	d	e
2	xxxc	xxxb	xxxb	xxxb
3	xxxb	xxxc	xxxc	xxxc
4	xxxa	xxxa	xxxa	xxxa
-- c1上建索引i1，c2上建索引i2 c1 like '' and c2 = ''
SELECT * FROM t1 WHERE b like 'xxx%' ;
a	b	c	d	e
2	xxxc	xxxb	xxxb	xxxb
3	xxxb	xxxc	xxxc	xxxc
4	xxxa	xxxa	xxxa	xxxa
EXPLAIN SELECT * FROM t1 WHERE c = 'zzzz' ;
SELECT * FROM t1 WHERE b like 'xxx%' and c like 'xxx%' ;
a	b	c	d	e
2	xxxc	xxxb	xxxb	xxxb
3	xxxb	xxxc	xxxc	xxxc
4	xxxa	xxxa	xxxa	xxxa
SELECT * FROM t1 WHERE b like 'xxx%' or c like 'xxx%' ;
a	b	c	d	e
2	xxxc	xxxb	xxxb	xxxb
3	xxxb	xxxc	xxxc	xxxc
4	xxxa	xxxa	xxxa	xxxa
SELECT * FROM t1 WHERE b = 'xxxc' and c like 'xxx%' ;
a	b	c	d	e
2	xxxc	xxxb	xxxb	xxxb
SELECT * FROM t1 WHERE b = 'xxxc' or c like 'xxx%' ;
a	b	c	d	e
2	xxxc	xxxb	xxxb	xxxb
3	xxxb	xxxc	xxxc	xxxc
4	xxxa	xxxa	xxxa	xxxa
SELECT * FROM t1 WHERE b like 'xxx%' and c = 'zzzz' ;
a	b	c	d	e
SELECT * FROM t1 WHERE b like 'xxx%' or c = 'zzzz' ;
a	b	c	d	e
2	xxxc	xxxb	xxxb	xxxb
3	xxxb	xxxc	xxxc	xxxc
4	xxxa	xxxa	xxxa	xxxa
5	zzzz	zzzz	zzzz	zzzz
-- col like 'xxx%'中，col用别名，以及表使用别名
SELECT a,b as b2,c,d,e FROM t1 HAVING b2 like 'xxx%' ;
a	b2	c	d	e
2	xxxc	xxxb	xxxb	xxxb
3	xxxb	xxxc	xxxc	xxxc
4	xxxa	xxxa	xxxa	xxxa
SELECT a,b as b2,c,d,e FROM t1 HAVING b2 like 'xxx%' ESCAPE 'x' ;
a	b2	c	d	e
SELECT a,b as b2,c,d,e FROM t1 HAVING b2 like 'xxx%' ESCAPE 'a' ;
a	b2	c	d	e
4	xxxa	xxxa	xxxa	xxxa
3	xxxb	xxxc	xxxc	xxxc
2	xxxc	xxxb	xxxb	xxxb
SELECT a,b as b2,c,d,e FROM t1 HAVING b2 NOT like 'xxx%' ;
a	b2	c	d	e
1	aaaa	aaaa	aaaa	aaaa
5	zzzz	zzzz	zzzz	zzzz
7	zxxx	zxxx	zxxx	zxxx
8	axxx	axxx	axxx	axxx
9	zaaz	zaaz	zaaz	zaaz
10	zbbz	zbbz	zbbz	zbbz
SELECT a,b as b2,c,d,e FROM t1 HAVING b2 NOT like 'xxx%' ESCAPE 'x' ;
a	b2	c	d	e
1	aaaa	aaaa	aaaa	aaaa
2	xxxc	xxxb	xxxb	xxxb
3	xxxb	xxxc	xxxc	xxxc
4	xxxa	xxxa	xxxa	xxxa
5	zzzz	zzzz	zzzz	zzzz
7	zxxx	zxxx	zxxx	zxxx
8	axxx	axxx	axxx	axxx
9	zaaz	zaaz	zaaz	zaaz
10	zbbz	zbbz	zbbz	zbbz
SELECT a,b as b2,c,d,e FROM t1 HAVING b2 NOT like 'xxx%' ESCAPE 'a' ;
a	b2	c	d	e
1	aaaa	aaaa	aaaa	aaaa
5	zzzz	zzzz	zzzz	zzzz
7	zxxx	zxxx	zxxx	zxxx
8	axxx	axxx	axxx	axxx
9	zaaz	zaaz	zaaz	zaaz
10	zbbz	zbbz	zbbz	zbbz
-- like匹配的字符串中含有特殊字符
SELECT * FROM t1 WHERE b like '\0%' ;
a	b	c	d	e
SELECT * FROM t1 WHERE b like '\t%' ESCAPE 'x' ;
a	b	c	d	e
SELECT * FROM t1 WHERE b like '\n%' ESCAPE 'a' ;
a	b	c	d	e
SELECT * FROM t1 WHERE b NOT like '%%' ;
a	b	c	d	e
SELECT * FROM t1 WHERE b NOT like '_%' ESCAPE 'x' ;
a	b	c	d	e
SELECT * FROM t1 WHERE b NOT like '!%' ESCAPE 'a' ;
a	b	c	d	e
1	aaaa	aaaa	aaaa	aaaa
2	xxxc	xxxb	xxxb	xxxb
3	xxxb	xxxc	xxxc	xxxc
4	xxxa	xxxa	xxxa	xxxa
5	zzzz	zzzz	zzzz	zzzz
7	zxxx	zxxx	zxxx	zxxx
8	axxx	axxx	axxx	axxx
9	zaaz	zaaz	zaaz	zaaz
10	zbbz	zbbz	zbbz	zbbz
-- 匹配字符串偏长的情况
SELECT * FROM t1 WHERE b like 'xxx%%%%%%%%%%%%%%%%%%%%%%%%%%%%%%%%%%%%' ;
a	b	c	d	e
2	xxxc	xxxb	xxxb	xxxb
3	xxxb	xxxc	xxxc	xxxc
4	xxxa	xxxa	xxxa	xxxa
SELECT * FROM t1 WHERE b like 'xxx_%%%%%%%%%%%%%%%%%%%%%%%%%%%%%%%%%%%' ESCAPE 'x' ;
a	b	c	d	e
SELECT * FROM t1 WHERE b like '%%%%%%%%%%%%%%%%%%%%%%%%%%%%%%%%%%%xxx%' ESCAPE 'a' ;
a	b	c	d	e
2	xxxc	xxxb	xxxb	xxxb
3	xxxb	xxxc	xxxc	xxxc
4	xxxa	xxxa	xxxa	xxxa
7	zxxx	zxxx	zxxx	zxxx
8	axxx	axxx	axxx	axxx
SELECT * FROM t1 WHERE b NOT like 'xxyyyyyyyyyyyyyyyyyyyyyyyyyyyyyyyyyyy%' ;
a	b	c	d	e
1	aaaa	aaaa	aaaa	aaaa
2	xxxc	xxxb	xxxb	xxxb
3	xxxb	xxxc	xxxc	xxxc
4	xxxa	xxxa	xxxa	xxxa
5	zzzz	zzzz	zzzz	zzzz
7	zxxx	zxxx	zxxx	zxxx
8	axxx	axxx	axxx	axxx
9	zaaz	zaaz	zaaz	zaaz
10	zbbz	zbbz	zbbz	zbbz
SELECT * FROM t1 WHERE b NOT like 'xxxyyyyyyyyyyyyyyyyyyyyyyyyyyyyyyyyyy%' ESCAPE 'x' ;
a	b	c	d	e
1	aaaa	aaaa	aaaa	aaaa
2	xxxc	xxxb	xxxb	xxxb
3	xxxb	xxxc	xxxc	xxxc
4	xxxa	xxxa	xxxa	xxxa
5	zzzz	zzzz	zzzz	zzzz
7	zxxx	zxxx	zxxx	zxxx
8	axxx	axxx	axxx	axxx
9	zaaz	zaaz	zaaz	zaaz
10	zbbz	zbbz	zbbz	zbbz
SELECT * FROM t1 WHERE b NOT like 'xxxyyyyyyyyyyyyyyyyyyyyyyyyyyyyyyyyyyyy%' ESCAPE 'a' ;
a	b	c	d	e
1	aaaa	aaaa	aaaa	aaaa
2	xxxc	xxxb	xxxb	xxxb
3	xxxb	xxxc	xxxc	xxxc
4	xxxa	xxxa	xxxa	xxxa
5	zzzz	zzzz	zzzz	zzzz
7	zxxx	zxxx	zxxx	zxxx
8	axxx	axxx	axxx	axxx
9	zaaz	zaaz	zaaz	zaaz
10	zbbz	zbbz	zbbz	zbbz
-- 涉及类型转换
SELECT * FROM t1 WHERE a like 'xxx%' ;
a	b	c	d	e
SELECT * FROM t1 WHERE b like 12345 ;
a	b	c	d	e
-- having语句中测试like ‘xxx%’走索引
SELECT * FROM t1 HAVING b like 'xxx%' ;
a	b	c	d	e
2	xxxc	xxxb	xxxb	xxxb
3	xxxb	xxxc	xxxc	xxxc
4	xxxa	xxxa	xxxa	xxxa
SELECT * FROM t1 HAVING b like 'xxx%' ESCAPE 'x' ;
a	b	c	d	e
SELECT * FROM t1 HAVING b like 'xxx%' ESCAPE 'a' ;
a	b	c	d	e
4	xxxa	xxxa	xxxa	xxxa
3	xxxb	xxxc	xxxc	xxxc
2	xxxc	xxxb	xxxb	xxxb
SELECT * FROM t1 HAVING b NOT like 'xxx%' ;
a	b	c	d	e
1	aaaa	aaaa	aaaa	aaaa
5	zzzz	zzzz	zzzz	zzzz
7	zxxx	zxxx	zxxx	zxxx
8	axxx	axxx	axxx	axxx
9	zaaz	zaaz	zaaz	zaaz
10	zbbz	zbbz	zbbz	zbbz
SELECT * FROM t1 HAVING b NOT like 'xxx%' ESCAPE 'x' ;
a	b	c	d	e
1	aaaa	aaaa	aaaa	aaaa
2	xxxc	xxxb	xxxb	xxxb
3	xxxb	xxxc	xxxc	xxxc
4	xxxa	xxxa	xxxa	xxxa
5	zzzz	zzzz	zzzz	zzzz
7	zxxx	zxxx	zxxx	zxxx
8	axxx	axxx	axxx	axxx
9	zaaz	zaaz	zaaz	zaaz
10	zbbz	zbbz	zbbz	zbbz
SELECT * FROM t1 HAVING b NOT like 'xxx%' ESCAPE 'a' ;
a	b	c	d	e
1	aaaa	aaaa	aaaa	aaaa
5	zzzz	zzzz	zzzz	zzzz
7	zxxx	zxxx	zxxx	zxxx
8	axxx	axxx	axxx	axxx
9	zaaz	zaaz	zaaz	zaaz
10	zbbz	zbbz	zbbz	zbbz
-- 边界值测试
SELECT * FROM t1 WHERE b like hex('xxx%') ;
a	b	c	d	e
SELECT * FROM t1 WHERE b like hex('xxx%') ESCAPE 'x' ;
a	b	c	d	e
SELECT * FROM t1 WHERE b like hex('xxx%') ESCAPE 'a' ;
a	b	c	d	e
SELECT * FROM t1 WHERE b NOT like hex('xxx%') ;
a	b	c	d	e
1	aaaa	aaaa	aaaa	aaaa
2	xxxc	xxxb	xxxb	xxxb
3	xxxb	xxxc	xxxc	xxxc
4	xxxa	xxxa	xxxa	xxxa
5	zzzz	zzzz	zzzz	zzzz
7	zxxx	zxxx	zxxx	zxxx
8	axxx	axxx	axxx	axxx
9	zaaz	zaaz	zaaz	zaaz
10	zbbz	zbbz	zbbz	zbbz
SELECT * FROM t1 WHERE b NOT like hex('xxx%') ESCAPE 'x' ;
a	b	c	d	e
1	aaaa	aaaa	aaaa	aaaa
2	xxxc	xxxb	xxxb	xxxb
3	xxxb	xxxc	xxxc	xxxc
4	xxxa	xxxa	xxxa	xxxa
5	zzzz	zzzz	zzzz	zzzz
7	zxxx	zxxx	zxxx	zxxx
8	axxx	axxx	axxx	axxx
9	zaaz	zaaz	zaaz	zaaz
10	zbbz	zbbz	zbbz	zbbz
SELECT * FROM t1 WHERE b NOT like hex('xxx%') ESCAPE 'a' ;
a	b	c	d	e
1	aaaa	aaaa	aaaa	aaaa
2	xxxc	xxxb	xxxb	xxxb
3	xxxb	xxxc	xxxc	xxxc
4	xxxa	xxxa	xxxa	xxxa
5	zzzz	zzzz	zzzz	zzzz
7	zxxx	zxxx	zxxx	zxxx
8	axxx	axxx	axxx	axxx
9	zaaz	zaaz	zaaz	zaaz
10	zbbz	zbbz	zbbz	zbbz
SELECT * FROM t1 WHERE b like X'78787825' ESCAPE X'0f' ;
a	b	c	d	e
2	xxxc	xxxb	xxxb	xxxb
3	xxxb	xxxc	xxxc	xxxc
4	xxxa	xxxa	xxxa	xxxa
SELECT * FROM t1 WHERE b like X'78787825' ESCAPE X'00' ;
a	b	c	d	e
2	xxxc	xxxb	xxxb	xxxb
3	xxxb	xxxc	xxxc	xxxc
4	xxxa	xxxa	xxxa	xxxa
SELECT * FROM t1 WHERE b like X'78787825' ESCAPE X'ff' ;
a	b	c	d	e
2	xxxc	xxxb	xxxb	xxxb
3	xxxb	xxxc	xxxc	xxxc
4	xxxa	xxxa	xxxa	xxxa
SELECT * FROM t1 WHERE b like X'78787825' ESCAPE X'78' ;
a	b	c	d	e
SELECT * FROM t1 WHERE b like X'78787825' ESCAPE X'25' ;
a	b	c	d	e
2	xxxc	xxxb	xxxb	xxxb
3	xxxb	xxxc	xxxc	xxxc
4	xxxa	xxxa	xxxa	xxxa
SELECT * FROM t1 WHERE b like X'0000' ESCAPE '0' ;
a	b	c	d	e
SELECT * FROM t1 WHERE b like X'00000000' ESCAPE '0' ;
a	b	c	d	e
SELECT * FROM t1 WHERE b like X'ffff' ESCAPE 'f' ;
a	b	c	d	e
SELECT * FROM t1 WHERE b like X'ffffffff' ESCAPE 'f' ;
a	b	c	d	e
SELECT * FROM t1 WHERE b like X'ff0000ff' ESCAPE 'f' ;
a	b	c	d	e
SELECT * FROM t1 WHERE b like X'78787825' ESCAPE 'f' ;
a	b	c	d	e
4	xxxa	xxxa	xxxa	xxxa
3	xxxb	xxxc	xxxc	xxxc
2	xxxc	xxxb	xxxb	xxxb
SELECT * FROM t1 WHERE b like X'78787825' ESCAPE '0' ;
a	b	c	d	e
2	xxxc	xxxb	xxxb	xxxb
3	xxxb	xxxc	xxxc	xxxc
4	xxxa	xxxa	xxxa	xxxa
SELECT * FROM t1 WHERE b like X'78787825' ESCAPE 'f' ;
a	b	c	d	e
2	xxxc	xxxb	xxxb	xxxb
3	xxxb	xxxc	xxxc	xxxc
4	xxxa	xxxa	xxxa	xxxa
SELECT * FROM t1 WHERE b like X'78787825' ESCAPE '8' ;
a	b	c	d	e
2	xxxc	xxxb	xxxb	xxxb
3	xxxb	xxxc	xxxc	xxxc
4	xxxa	xxxa	xxxa	xxxa
SELECT * FROM t1 WHERE b like X'78787825' ESCAPE '5' ;
a	b	c	d	e
2	xxxc	xxxb	xxxb	xxxb
3	xxxb	xxxc	xxxc	xxxc
4	xxxa	xxxa	xxxa	xxxa
SELECT * FROM t1 WHERE b NOT like X'0000' ESCAPE '0' ;
a	b	c	d	e
1	aaaa	aaaa	aaaa	aaaa
2	xxxc	xxxb	xxxb	xxxb
3	xxxb	xxxc	xxxc	xxxc
4	xxxa	xxxa	xxxa	xxxa
5	zzzz	zzzz	zzzz	zzzz
7	zxxx	zxxx	zxxx	zxxx
8	axxx	axxx	axxx	axxx
9	zaaz	zaaz	zaaz	zaaz
10	zbbz	zbbz	zbbz	zbbz
SELECT * FROM t1 WHERE b NOT like X'00000000' ESCAPE '0' ;
a	b	c	d	e
1	aaaa	aaaa	aaaa	aaaa
2	xxxc	xxxb	xxxb	xxxb
3	xxxb	xxxc	xxxc	xxxc
4	xxxa	xxxa	xxxa	xxxa
5	zzzz	zzzz	zzzz	zzzz
7	zxxx	zxxx	zxxx	zxxx
8	axxx	axxx	axxx	axxx
9	zaaz	zaaz	zaaz	zaaz
10	zbbz	zbbz	zbbz	zbbz
SELECT * FROM t1 WHERE b NOT like X'ffff' ESCAPE 'f' ;
a	b	c	d	e
1	aaaa	aaaa	aaaa	aaaa
2	xxxc	xxxb	xxxb	xxxb
3	xxxb	xxxc	xxxc	xxxc
4	xxxa	xxxa	xxxa	xxxa
5	zzzz	zzzz	zzzz	zzzz
7	zxxx	zxxx	zxxx	zxxx
8	axxx	axxx	axxx	axxx
9	zaaz	zaaz	zaaz	zaaz
10	zbbz	zbbz	zbbz	zbbz
SELECT * FROM t1 WHERE b NOT like X'ffffffff' ESCAPE 'f' ;
a	b	c	d	e
1	aaaa	aaaa	aaaa	aaaa
2	xxxc	xxxb	xxxb	xxxb
3	xxxb	xxxc	xxxc	xxxc
4	xxxa	xxxa	xxxa	xxxa
5	zzzz	zzzz	zzzz	zzzz
7	zxxx	zxxx	zxxx	zxxx
8	axxx	axxx	axxx	axxx
9	zaaz	zaaz	zaaz	zaaz
10	zbbz	zbbz	zbbz	zbbz
SELECT * FROM t1 WHERE b NOT like X'ff0000ff' ESCAPE 'f' ;
a	b	c	d	e
1	aaaa	aaaa	aaaa	aaaa
2	xxxc	xxxb	xxxb	xxxb
3	xxxb	xxxc	xxxc	xxxc
4	xxxa	xxxa	xxxa	xxxa
5	zzzz	zzzz	zzzz	zzzz
7	zxxx	zxxx	zxxx	zxxx
8	axxx	axxx	axxx	axxx
9	zaaz	zaaz	zaaz	zaaz
10	zbbz	zbbz	zbbz	zbbz
SELECT * FROM t1 WHERE b NOT like X'78787825' ESCAPE '0' ;
a	b	c	d	e
1	aaaa	aaaa	aaaa	aaaa
5	zzzz	zzzz	zzzz	zzzz
7	zxxx	zxxx	zxxx	zxxx
8	axxx	axxx	axxx	axxx
9	zaaz	zaaz	zaaz	zaaz
10	zbbz	zbbz	zbbz	zbbz
SELECT * FROM t1 WHERE b NOT like X'78787825' ESCAPE 'f' ;
a	b	c	d	e
1	aaaa	aaaa	aaaa	aaaa
5	zzzz	zzzz	zzzz	zzzz
7	zxxx	zxxx	zxxx	zxxx
8	axxx	axxx	axxx	axxx
9	zaaz	zaaz	zaaz	zaaz
10	zbbz	zbbz	zbbz	zbbz
SELECT * FROM t1 WHERE b like X'78787825252525252525252525' ESCAPE 'f' ;
a	b	c	d	e
2	xxxc	xxxb	xxxb	xxxb
3	xxxb	xxxc	xxxc	xxxc
4	xxxa	xxxa	xxxa	xxxa
SELECT * FROM t1 WHERE b NOT like X'78787825252525252525252525' ESCAPE 'f' ;
a	b	c	d	e
1	aaaa	aaaa	aaaa	aaaa
5	zzzz	zzzz	zzzz	zzzz
7	zxxx	zxxx	zxxx	zxxx
8	axxx	axxx	axxx	axxx
9	zaaz	zaaz	zaaz	zaaz
10	zbbz	zbbz	zbbz	zbbz
SELECT * FROM t1 WHERE b like 'xxx%%%%%%%%%%' ESCAPE 'f' ;
a	b	c	d	e
2	xxxc	xxxb	xxxb	xxxb
3	xxxb	xxxc	xxxc	xxxc
4	xxxa	xxxa	xxxa	xxxa
SELECT * FROM t1 WHERE b NOT like 'xxx%%%%%%%%%%' ESCAPE 'f' ;
a	b	c	d	e
1	aaaa	aaaa	aaaa	aaaa
5	zzzz	zzzz	zzzz	zzzz
7	zxxx	zxxx	zxxx	zxxx
8	axxx	axxx	axxx	axxx
9	zaaz	zaaz	zaaz	zaaz
10	zbbz	zbbz	zbbz	zbbz
SELECT * FROM t1 WHERE b like 'xxx_%%%%%%%%%' ESCAPE 'f' ;
a	b	c	d	e
2	xxxc	xxxb	xxxb	xxxb
3	xxxb	xxxc	xxxc	xxxc
4	xxxa	xxxa	xxxa	xxxa
SELECT * FROM t1 WHERE b NOT like 'xxx_%%%%%%%%%' ESCAPE 'f' ;
a	b	c	d	e
1	aaaa	aaaa	aaaa	aaaa
5	zzzz	zzzz	zzzz	zzzz
7	zxxx	zxxx	zxxx	zxxx
8	axxx	axxx	axxx	axxx
9	zaaz	zaaz	zaaz	zaaz
10	zbbz	zbbz	zbbz	zbbz
-- Cover 0x00-FF in like str
EXPLAIN SELECT * FROM t1 WHERE b like 0x000102030405060708090A0B0C0D0E0F101112131415161718191A1B1C1D0E1F202122232425262728292A2B2C2D0E2F303132333435363738393A3B3C3D0E3F404142434445464748494A4B4C4D0E4F505152535455565758595A5B5C5D0E5F606162636465666768696A6B6C6D0E6F707172737475767778797A7B7C7D0E7F808182838485868788898A8B8C8D0E8F909192939495969798999A9B9C9D0E9FA0A1A2A3A4A5A6A7A8A9AAABACAD0EAFB0B1B2B3B4B5B6B7B8B9BABBBCBD0EBFC0C1C2C3C4C5C6C7C8C9CACBCCCD0ECFD0D1D2D3D4D5D6D7D8D9DADBDCDD0EDFE0E1E2E3E4E5E6E7E8E9EAEBECED0EEFF0F1F2F3F4F5F6F7F8F9FAFBFCFD0EFF  ESCAPE '&' ;
EXPLAIN SELECT * FROM t1 WHERE b like 0x000102030405060708090A0B0C0D0E0F101112131415161718191A1B1C1D0E1F202122232425262728292A2B2C2D0E2F303132333435363738393A3B3C3D0E3F404142434445464748494A4B4C4D0E4F505152535455565758595A5B5C5D0E5F606162636465666768696A6B6C6D0E6F707172737475767778797A7B7C7D0E7F808182838485868788898A8B8C8D0E8F909192939495969798999A9B9C9D0E9FA0A1A2A3A4A5A6A7A8A9AAABACAD0EAFB0B1B2B3B4B5B6B7B8B9BABBBCBD0EBFC0C1C2C3C4C5C6C7C8C9CACBCCCD0ECFD0D1D2D3D4D5D6D7D8D9DADBDCDD0EDFE0E1E2E3E4E5E6E7E8E9EAEBECED0EEFF0F1F2F3F4F5F6F7F8F9FAFBFCFD0EFF ;
EXPLAIN SELECT * FROM t1 WHERE b like x'000102030405060708090A0B0C0D0E0F101112131415161718191A1B1C1D0E1F202122232425262728292A2B2C2D0E2F303132333435363738393A3B3C3D0E3F404142434445464748494A4B4C4D0E4F505152535455565758595A5B5C5D0E5F606162636465666768696A6B6C6D0E6F707172737475767778797A7B7C7D0E7F808182838485868788898A8B8C8D0E8F909192939495969798999A9B9C9D0E9FA0A1A2A3A4A5A6A7A8A9AAABACAD0EAFB0B1B2B3B4B5B6B7B8B9BABBBCBD0EBFC0C1C2C3C4C5C6C7C8C9CACBCCCD0ECFD0D1D2D3D4D5D6D7D8D9DADBDCDD0EDFE0E1E2E3E4E5E6E7E8E9EAEBECED0EEFF0F1F2F3F4F5F6F7F8F9FAFBFCFD0EFF'  ESCAPE '&' ;
EXPLAIN SELECT * FROM t1 WHERE b like x'000102030405060708090A0B0C0D0E0F101112131415161718191A1B1C1D0E1F202122232425262728292A2B2C2D0E2F303132333435363738393A3B3C3D0E3F404142434445464748494A4B4C4D0E4F505152535455565758595A5B5C5D0E5F606162636465666768696A6B6C6D0E6F707172737475767778797A7B7C7D0E7F808182838485868788898A8B8C8D0E8F909192939495969798999A9B9C9D0E9FA0A1A2A3A4A5A6A7A8A9AAABACAD0EAFB0B1B2B3B4B5B6B7B8B9BABBBCBD0EBFC0C1C2C3C4C5C6C7C8C9CACBCCCD0ECFD0D1D2D3D4D5D6D7D8D9DADBDCDD0EDFE0E1E2E3E4E5E6E7E8E9EAEBECED0EEFF0F1F2F3F4F5F6F7F8F9FAFBFCFD0EFF' ;
EXPLAIN SELECT * FROM t1 WHERE b like X'000102030405060708090A0B0C0D0E0F101112131415161718191A1B1C1D0E1F202122232425262728292A2B2C2D0E2F303132333435363738393A3B3C3D0E3F404142434445464748494A4B4C4D0E4F505152535455565758595A5B5C5D0E5F606162636465666768696A6B6C6D0E6F707172737475767778797A7B7C7D0E7F808182838485868788898A8B8C8D0E8F909192939495969798999A9B9C9D0E9FA0A1A2A3A4A5A6A7A8A9AAABACAD0EAFB0B1B2B3B4B5B6B7B8B9BABBBCBD0EBFC0C1C2C3C4C5C6C7C8C9CACBCCCD0ECFD0D1D2D3D4D5D6D7D8D9DADBDCDD0EDFE0E1E2E3E4E5E6E7E8E9EAEBECED0EEFF0F1F2F3F4F5F6F7F8F9FAFBFCFD0EFF'  ESCAPE '&' ;
EXPLAIN SELECT * FROM t1 WHERE b like X'000102030405060708090A0B0C0D0E0F101112131415161718191A1B1C1D0E1F202122232425262728292A2B2C2D0E2F303132333435363738393A3B3C3D0E3F404142434445464748494A4B4C4D0E4F505152535455565758595A5B5C5D0E5F606162636465666768696A6B6C6D0E6F707172737475767778797A7B7C7D0E7F808182838485868788898A8B8C8D0E8F909192939495969798999A9B9C9D0E9FA0A1A2A3A4A5A6A7A8A9AAABACAD0EAFB0B1B2B3B4B5B6B7B8B9BABBBCBD0EBFC0C1C2C3C4C5C6C7C8C9CACBCCCD0ECFD0D1D2D3D4D5D6D7D8D9DADBDCDD0EDFE0E1E2E3E4E5E6E7E8E9EAEBECED0EEFF0F1F2F3F4F5F6F7F8F9FAFBFCFD0EFF' ;
SELECT * FROM t1 WHERE b like 0x000102030405060708090A0B0C0D0E0F101112131415161718191A1B1C1D0E1F202122232425262728292A2B2C2D0E2F303132333435363738393A3B3C3D0E3F404142434445464748494A4B4C4D0E4F505152535455565758595A5B5C5D0E5F606162636465666768696A6B6C6D0E6F707172737475767778797A7B7C7D0E7F808182838485868788898A8B8C8D0E8F909192939495969798999A9B9C9D0E9FA0A1A2A3A4A5A6A7A8A9AAABACAD0EAFB0B1B2B3B4B5B6B7B8B9BABBBCBD0EBFC0C1C2C3C4C5C6C7C8C9CACBCCCD0ECFD0D1D2D3D4D5D6D7D8D9DADBDCDD0EDFE0E1E2E3E4E5E6E7E8E9EAEBECED0EEFF0F1F2F3F4F5F6F7F8F9FAFBFCFD0EFF  ESCAPE '&' ;
a	b	c	d	e
SELECT * FROM t1 WHERE b like 0x000102030405060708090A0B0C0D0E0F101112131415161718191A1B1C1D0E1F202122232425262728292A2B2C2D0E2F303132333435363738393A3B3C3D0E3F404142434445464748494A4B4C4D0E4F505152535455565758595A5B5C5D0E5F606162636465666768696A6B6C6D0E6F707172737475767778797A7B7C7D0E7F808182838485868788898A8B8C8D0E8F909192939495969798999A9B9C9D0E9FA0A1A2A3A4A5A6A7A8A9AAABACAD0EAFB0B1B2B3B4B5B6B7B8B9BABBBCBD0EBFC0C1C2C3C4C5C6C7C8C9CACBCCCD0ECFD0D1D2D3D4D5D6D7D8D9DADBDCDD0EDFE0E1E2E3E4E5E6E7E8E9EAEBECED0EEFF0F1F2F3F4F5F6F7F8F9FAFBFCFD0EFF ;
a	b	c	d	e
SELECT * FROM t1 WHERE b like x'000102030405060708090A0B0C0D0E0F101112131415161718191A1B1C1D0E1F202122232425262728292A2B2C2D0E2F303132333435363738393A3B3C3D0E3F404142434445464748494A4B4C4D0E4F505152535455565758595A5B5C5D0E5F606162636465666768696A6B6C6D0E6F707172737475767778797A7B7C7D0E7F808182838485868788898A8B8C8D0E8F909192939495969798999A9B9C9D0E9FA0A1A2A3A4A5A6A7A8A9AAABACAD0EAFB0B1B2B3B4B5B6B7B8B9BABBBCBD0EBFC0C1C2C3C4C5C6C7C8C9CACBCCCD0ECFD0D1D2D3D4D5D6D7D8D9DADBDCDD0EDFE0E1E2E3E4E5E6E7E8E9EAEBECED0EEFF0F1F2F3F4F5F6F7F8F9FAFBFCFD0EFF'  ESCAPE '&' ;
a	b	c	d	e
SELECT * FROM t1 WHERE b like x'000102030405060708090A0B0C0D0E0F101112131415161718191A1B1C1D0E1F202122232425262728292A2B2C2D0E2F303132333435363738393A3B3C3D0E3F404142434445464748494A4B4C4D0E4F505152535455565758595A5B5C5D0E5F606162636465666768696A6B6C6D0E6F707172737475767778797A7B7C7D0E7F808182838485868788898A8B8C8D0E8F909192939495969798999A9B9C9D0E9FA0A1A2A3A4A5A6A7A8A9AAABACAD0EAFB0B1B2B3B4B5B6B7B8B9BABBBCBD0EBFC0C1C2C3C4C5C6C7C8C9CACBCCCD0ECFD0D1D2D3D4D5D6D7D8D9DADBDCDD0EDFE0E1E2E3E4E5E6E7E8E9EAEBECED0EEFF0F1F2F3F4F5F6F7F8F9FAFBFCFD0EFF' ;
a	b	c	d	e
SELECT * FROM t1 WHERE b like X'000102030405060708090A0B0C0D0E0F101112131415161718191A1B1C1D0E1F202122232425262728292A2B2C2D0E2F303132333435363738393A3B3C3D0E3F404142434445464748494A4B4C4D0E4F505152535455565758595A5B5C5D0E5F606162636465666768696A6B6C6D0E6F707172737475767778797A7B7C7D0E7F808182838485868788898A8B8C8D0E8F909192939495969798999A9B9C9D0E9FA0A1A2A3A4A5A6A7A8A9AAABACAD0EAFB0B1B2B3B4B5B6B7B8B9BABBBCBD0EBFC0C1C2C3C4C5C6C7C8C9CACBCCCD0ECFD0D1D2D3D4D5D6D7D8D9DADBDCDD0EDFE0E1E2E3E4E5E6E7E8E9EAEBECED0EEFF0F1F2F3F4F5F6F7F8F9FAFBFCFD0EFF'  ESCAPE '&' ;
a	b	c	d	e
SELECT * FROM t1 WHERE b like X'000102030405060708090A0B0C0D0E0F101112131415161718191A1B1C1D0E1F202122232425262728292A2B2C2D0E2F303132333435363738393A3B3C3D0E3F404142434445464748494A4B4C4D0E4F505152535455565758595A5B5C5D0E5F606162636465666768696A6B6C6D0E6F707172737475767778797A7B7C7D0E7F808182838485868788898A8B8C8D0E8F909192939495969798999A9B9C9D0E9FA0A1A2A3A4A5A6A7A8A9AAABACAD0EAFB0B1B2B3B4B5B6B7B8B9BABBBCBD0EBFC0C1C2C3C4C5C6C7C8C9CACBCCCD0ECFD0D1D2D3D4D5D6D7D8D9DADBDCDD0EDFE0E1E2E3E4E5E6E7E8E9EAEBECED0EEFF0F1F2F3F4F5F6F7F8F9FAFBFCFD0EFF' ;
a	b	c	d	e
EXPLAIN SELECT * FROM t1 WHERE b not like 0x000102030405060708090A0B0C0D0E0F101112131415161718191A1B1C1D0E1F202122232425262728292A2B2C2D0E2F303132333435363738393A3B3C3D0E3F404142434445464748494A4B4C4D0E4F505152535455565758595A5B5C5D0E5F606162636465666768696A6B6C6D0E6F707172737475767778797A7B7C7D0E7F808182838485868788898A8B8C8D0E8F909192939495969798999A9B9C9D0E9FA0A1A2A3A4A5A6A7A8A9AAABACAD0EAFB0B1B2B3B4B5B6B7B8B9BABBBCBD0EBFC0C1C2C3C4C5C6C7C8C9CACBCCCD0ECFD0D1D2D3D4D5D6D7D8D9DADBDCDD0EDFE0E1E2E3E4E5E6E7E8E9EAEBECED0EEFF0F1F2F3F4F5F6F7F8F9FAFBFCFD0EFF  ESCAPE '&' ;
EXPLAIN SELECT * FROM t1 WHERE b not like 0x000102030405060708090A0B0C0D0E0F101112131415161718191A1B1C1D0E1F202122232425262728292A2B2C2D0E2F303132333435363738393A3B3C3D0E3F404142434445464748494A4B4C4D0E4F505152535455565758595A5B5C5D0E5F606162636465666768696A6B6C6D0E6F707172737475767778797A7B7C7D0E7F808182838485868788898A8B8C8D0E8F909192939495969798999A9B9C9D0E9FA0A1A2A3A4A5A6A7A8A9AAABACAD0EAFB0B1B2B3B4B5B6B7B8B9BABBBCBD0EBFC0C1C2C3C4C5C6C7C8C9CACBCCCD0ECFD0D1D2D3D4D5D6D7D8D9DADBDCDD0EDFE0E1E2E3E4E5E6E7E8E9EAEBECED0EEFF0F1F2F3F4F5F6F7F8F9FAFBFCFD0EFF ;
EXPLAIN SELECT * FROM t1 WHERE b not like x'000102030405060708090A0B0C0D0E0F101112131415161718191A1B1C1D0E1F202122232425262728292A2B2C2D0E2F303132333435363738393A3B3C3D0E3F404142434445464748494A4B4C4D0E4F505152535455565758595A5B5C5D0E5F606162636465666768696A6B6C6D0E6F707172737475767778797A7B7C7D0E7F808182838485868788898A8B8C8D0E8F909192939495969798999A9B9C9D0E9FA0A1A2A3A4A5A6A7A8A9AAABACAD0EAFB0B1B2B3B4B5B6B7B8B9BABBBCBD0EBFC0C1C2C3C4C5C6C7C8C9CACBCCCD0ECFD0D1D2D3D4D5D6D7D8D9DADBDCDD0EDFE0E1E2E3E4E5E6E7E8E9EAEBECED0EEFF0F1F2F3F4F5F6F7F8F9FAFBFCFD0EFF'  ESCAPE '&' ;
EXPLAIN SELECT * FROM t1 WHERE b not like x'000102030405060708090A0B0C0D0E0F101112131415161718191A1B1C1D0E1F202122232425262728292A2B2C2D0E2F303132333435363738393A3B3C3D0E3F404142434445464748494A4B4C4D0E4F505152535455565758595A5B5C5D0E5F606162636465666768696A6B6C6D0E6F707172737475767778797A7B7C7D0E7F808182838485868788898A8B8C8D0E8F909192939495969798999A9B9C9D0E9FA0A1A2A3A4A5A6A7A8A9AAABACAD0EAFB0B1B2B3B4B5B6B7B8B9BABBBCBD0EBFC0C1C2C3C4C5C6C7C8C9CACBCCCD0ECFD0D1D2D3D4D5D6D7D8D9DADBDCDD0EDFE0E1E2E3E4E5E6E7E8E9EAEBECED0EEFF0F1F2F3F4F5F6F7F8F9FAFBFCFD0EFF' ;
EXPLAIN SELECT * FROM t1 WHERE b not like X'000102030405060708090A0B0C0D0E0F101112131415161718191A1B1C1D0E1F202122232425262728292A2B2C2D0E2F303132333435363738393A3B3C3D0E3F404142434445464748494A4B4C4D0E4F505152535455565758595A5B5C5D0E5F606162636465666768696A6B6C6D0E6F707172737475767778797A7B7C7D0E7F808182838485868788898A8B8C8D0E8F909192939495969798999A9B9C9D0E9FA0A1A2A3A4A5A6A7A8A9AAABACAD0EAFB0B1B2B3B4B5B6B7B8B9BABBBCBD0EBFC0C1C2C3C4C5C6C7C8C9CACBCCCD0ECFD0D1D2D3D4D5D6D7D8D9DADBDCDD0EDFE0E1E2E3E4E5E6E7E8E9EAEBECED0EEFF0F1F2F3F4F5F6F7F8F9FAFBFCFD0EFF'  ESCAPE '&' ;
EXPLAIN SELECT * FROM t1 WHERE b not like X'000102030405060708090A0B0C0D0E0F101112131415161718191A1B1C1D0E1F202122232425262728292A2B2C2D0E2F303132333435363738393A3B3C3D0E3F404142434445464748494A4B4C4D0E4F505152535455565758595A5B5C5D0E5F606162636465666768696A6B6C6D0E6F707172737475767778797A7B7C7D0E7F808182838485868788898A8B8C8D0E8F909192939495969798999A9B9C9D0E9FA0A1A2A3A4A5A6A7A8A9AAABACAD0EAFB0B1B2B3B4B5B6B7B8B9BABBBCBD0EBFC0C1C2C3C4C5C6C7C8C9CACBCCCD0ECFD0D1D2D3D4D5D6D7D8D9DADBDCDD0EDFE0E1E2E3E4E5E6E7E8E9EAEBECED0EEFF0F1F2F3F4F5F6F7F8F9FAFBFCFD0EFF' ;
SELECT * FROM t1 WHERE b not like 0x000102030405060708090A0B0C0D0E0F101112131415161718191A1B1C1D0E1F202122232425262728292A2B2C2D0E2F303132333435363738393A3B3C3D0E3F404142434445464748494A4B4C4D0E4F505152535455565758595A5B5C5D0E5F606162636465666768696A6B6C6D0E6F707172737475767778797A7B7C7D0E7F808182838485868788898A8B8C8D0E8F909192939495969798999A9B9C9D0E9FA0A1A2A3A4A5A6A7A8A9AAABACAD0EAFB0B1B2B3B4B5B6B7B8B9BABBBCBD0EBFC0C1C2C3C4C5C6C7C8C9CACBCCCD0ECFD0D1D2D3D4D5D6D7D8D9DADBDCDD0EDFE0E1E2E3E4E5E6E7E8E9EAEBECED0EEFF0F1F2F3F4F5F6F7F8F9FAFBFCFD0EFF  ESCAPE '&' ;
a	b	c	d	e
1	aaaa	aaaa	aaaa	aaaa
2	xxxc	xxxb	xxxb	xxxb
3	xxxb	xxxc	xxxc	xxxc
4	xxxa	xxxa	xxxa	xxxa
5	zzzz	zzzz	zzzz	zzzz
7	zxxx	zxxx	zxxx	zxxx
8	axxx	axxx	axxx	axxx
9	zaaz	zaaz	zaaz	zaaz
10	zbbz	zbbz	zbbz	zbbz
SELECT * FROM t1 WHERE b not like 0x000102030405060708090A0B0C0D0E0F101112131415161718191A1B1C1D0E1F202122232425262728292A2B2C2D0E2F303132333435363738393A3B3C3D0E3F404142434445464748494A4B4C4D0E4F505152535455565758595A5B5C5D0E5F606162636465666768696A6B6C6D0E6F707172737475767778797A7B7C7D0E7F808182838485868788898A8B8C8D0E8F909192939495969798999A9B9C9D0E9FA0A1A2A3A4A5A6A7A8A9AAABACAD0EAFB0B1B2B3B4B5B6B7B8B9BABBBCBD0EBFC0C1C2C3C4C5C6C7C8C9CACBCCCD0ECFD0D1D2D3D4D5D6D7D8D9DADBDCDD0EDFE0E1E2E3E4E5E6E7E8E9EAEBECED0EEFF0F1F2F3F4F5F6F7F8F9FAFBFCFD0EFF ;
a	b	c	d	e
1	aaaa	aaaa	aaaa	aaaa
2	xxxc	xxxb	xxxb	xxxb
3	xxxb	xxxc	xxxc	xxxc
4	xxxa	xxxa	xxxa	xxxa
5	zzzz	zzzz	zzzz	zzzz
7	zxxx	zxxx	zxxx	zxxx
8	axxx	axxx	axxx	axxx
9	zaaz	zaaz	zaaz	zaaz
10	zbbz	zbbz	zbbz	zbbz
SELECT * FROM t1 WHERE b not like x'000102030405060708090A0B0C0D0E0F101112131415161718191A1B1C1D0E1F202122232425262728292A2B2C2D0E2F303132333435363738393A3B3C3D0E3F404142434445464748494A4B4C4D0E4F505152535455565758595A5B5C5D0E5F606162636465666768696A6B6C6D0E6F707172737475767778797A7B7C7D0E7F808182838485868788898A8B8C8D0E8F909192939495969798999A9B9C9D0E9FA0A1A2A3A4A5A6A7A8A9AAABACAD0EAFB0B1B2B3B4B5B6B7B8B9BABBBCBD0EBFC0C1C2C3C4C5C6C7C8C9CACBCCCD0ECFD0D1D2D3D4D5D6D7D8D9DADBDCDD0EDFE0E1E2E3E4E5E6E7E8E9EAEBECED0EEFF0F1F2F3F4F5F6F7F8F9FAFBFCFD0EFF'  ESCAPE '&' ;
a	b	c	d	e
1	aaaa	aaaa	aaaa	aaaa
2	xxxc	xxxb	xxxb	xxxb
3	xxxb	xxxc	xxxc	xxxc
4	xxxa	xxxa	xxxa	xxxa
5	zzzz	zzzz	zzzz	zzzz
7	zxxx	zxxx	zxxx	zxxx
8	axxx	axxx	axxx	axxx
9	zaaz	zaaz	zaaz	zaaz
10	zbbz	zbbz	zbbz	zbbz
SELECT * FROM t1 WHERE b not like x'000102030405060708090A0B0C0D0E0F101112131415161718191A1B1C1D0E1F202122232425262728292A2B2C2D0E2F303132333435363738393A3B3C3D0E3F404142434445464748494A4B4C4D0E4F505152535455565758595A5B5C5D0E5F606162636465666768696A6B6C6D0E6F707172737475767778797A7B7C7D0E7F808182838485868788898A8B8C8D0E8F909192939495969798999A9B9C9D0E9FA0A1A2A3A4A5A6A7A8A9AAABACAD0EAFB0B1B2B3B4B5B6B7B8B9BABBBCBD0EBFC0C1C2C3C4C5C6C7C8C9CACBCCCD0ECFD0D1D2D3D4D5D6D7D8D9DADBDCDD0EDFE0E1E2E3E4E5E6E7E8E9EAEBECED0EEFF0F1F2F3F4F5F6F7F8F9FAFBFCFD0EFF' ;
a	b	c	d	e
1	aaaa	aaaa	aaaa	aaaa
2	xxxc	xxxb	xxxb	xxxb
3	xxxb	xxxc	xxxc	xxxc
4	xxxa	xxxa	xxxa	xxxa
5	zzzz	zzzz	zzzz	zzzz
7	zxxx	zxxx	zxxx	zxxx
8	axxx	axxx	axxx	axxx
9	zaaz	zaaz	zaaz	zaaz
10	zbbz	zbbz	zbbz	zbbz
SELECT * FROM t1 WHERE b not like X'000102030405060708090A0B0C0D0E0F101112131415161718191A1B1C1D0E1F202122232425262728292A2B2C2D0E2F303132333435363738393A3B3C3D0E3F404142434445464748494A4B4C4D0E4F505152535455565758595A5B5C5D0E5F606162636465666768696A6B6C6D0E6F707172737475767778797A7B7C7D0E7F808182838485868788898A8B8C8D0E8F909192939495969798999A9B9C9D0E9FA0A1A2A3A4A5A6A7A8A9AAABACAD0EAFB0B1B2B3B4B5B6B7B8B9BABBBCBD0EBFC0C1C2C3C4C5C6C7C8C9CACBCCCD0ECFD0D1D2D3D4D5D6D7D8D9DADBDCDD0EDFE0E1E2E3E4E5E6E7E8E9EAEBECED0EEFF0F1F2F3F4F5F6F7F8F9FAFBFCFD0EFF'  ESCAPE '&' ;
a	b	c	d	e
1	aaaa	aaaa	aaaa	aaaa
2	xxxc	xxxb	xxxb	xxxb
3	xxxb	xxxc	xxxc	xxxc
4	xxxa	xxxa	xxxa	xxxa
5	zzzz	zzzz	zzzz	zzzz
7	zxxx	zxxx	zxxx	zxxx
8	axxx	axxx	axxx	axxx
9	zaaz	zaaz	zaaz	zaaz
10	zbbz	zbbz	zbbz	zbbz
SELECT * FROM t1 WHERE b not like X'000102030405060708090A0B0C0D0E0F101112131415161718191A1B1C1D0E1F202122232425262728292A2B2C2D0E2F303132333435363738393A3B3C3D0E3F404142434445464748494A4B4C4D0E4F505152535455565758595A5B5C5D0E5F606162636465666768696A6B6C6D0E6F707172737475767778797A7B7C7D0E7F808182838485868788898A8B8C8D0E8F909192939495969798999A9B9C9D0E9FA0A1A2A3A4A5A6A7A8A9AAABACAD0EAFB0B1B2B3B4B5B6B7B8B9BABBBCBD0EBFC0C1C2C3C4C5C6C7C8C9CACBCCCD0ECFD0D1D2D3D4D5D6D7D8D9DADBDCDD0EDFE0E1E2E3E4E5E6E7E8E9EAEBECED0EEFF0F1F2F3F4F5F6F7F8F9FAFBFCFD0EFF' ;
a	b	c	d	e
1	aaaa	aaaa	aaaa	aaaa
2	xxxc	xxxb	xxxb	xxxb
3	xxxb	xxxc	xxxc	xxxc
4	xxxa	xxxa	xxxa	xxxa
5	zzzz	zzzz	zzzz	zzzz
7	zxxx	zxxx	zxxx	zxxx
8	axxx	axxx	axxx	axxx
9	zaaz	zaaz	zaaz	zaaz
10	zbbz	zbbz	zbbz	zbbz
-- ========================= UPDATE ... LIMIT ====================================================================================
-- col_str1 [NOT] LIKE ‘xxx’ [ESCAPE col_str3]
replace into t1 values(1,'aaaa','aaaa','aaaa','aaaa'),(2,'xxxc','xxxb','xxxb','xxxb'),(3,'xxxb','xxxc','xxxc','xxxc'),(4,'xxxa','xxxa','xxxa','xxxa'),(5,'zzzz','zzzz','zzzz','zzzz'),(6,NULL,NULL,'xxxa','xxxa'),(7,'zxxx','zxxx','zxxx','zxxx'),(8,'axxx','axxx','axxx','axxx'),(9,'zaaz','zaaz','zaaz','zaaz'),(10,'zbbz','zbbz','zbbz','zbbz');
UPDATE t1 SET b=CONCAT(b,'_update') WHERE b like 'xxx' LIMIT 2;
SELECT * FROM t1;
a	b	c	d	e
1	aaaa	aaaa	aaaa	aaaa
2	xxxc	xxxb	xxxb	xxxb
3	xxxb	xxxc	xxxc	xxxc
4	xxxa	xxxa	xxxa	xxxa
5	zzzz	zzzz	zzzz	zzzz
6	NULL	NULL	xxxa	xxxa
7	zxxx	zxxx	zxxx	zxxx
8	axxx	axxx	axxx	axxx
9	zaaz	zaaz	zaaz	zaaz
10	zbbz	zbbz	zbbz	zbbz
replace into t1 values(1,'aaaa','aaaa','aaaa','aaaa'),(2,'xxxc','xxxb','xxxb','xxxb'),(3,'xxxb','xxxc','xxxc','xxxc'),(4,'xxxa','xxxa','xxxa','xxxa'),(5,'zzzz','zzzz','zzzz','zzzz'),(6,NULL,NULL,'xxxa','xxxa'),(7,'zxxx','zxxx','zxxx','zxxx'),(8,'axxx','axxx','axxx','axxx'),(9,'zaaz','zaaz','zaaz','zaaz'),(10,'zbbz','zbbz','zbbz','zbbz');
EXPLAIN UPDATE t1 SET b=CONCAT(b,'_update') WHERE b like 'xxx' LIMIT 2;
SELECT * FROM t1;
a	b	c	d	e
1	aaaa	aaaa	aaaa	aaaa
2	xxxc	xxxb	xxxb	xxxb
3	xxxb	xxxc	xxxc	xxxc
4	xxxa	xxxa	xxxa	xxxa
5	zzzz	zzzz	zzzz	zzzz
6	NULL	NULL	xxxa	xxxa
7	zxxx	zxxx	zxxx	zxxx
8	axxx	axxx	axxx	axxx
9	zaaz	zaaz	zaaz	zaaz
10	zbbz	zbbz	zbbz	zbbz
-- col_str1 [NOT] LIKE ‘xxx%’ [ESCAPE col_str3]
replace into t1 values(1,'aaaa','aaaa','aaaa','aaaa'),(2,'xxxc','xxxb','xxxb','xxxb'),(3,'xxxb','xxxc','xxxc','xxxc'),(4,'xxxa','xxxa','xxxa','xxxa'),(5,'zzzz','zzzz','zzzz','zzzz'),(6,NULL,NULL,'xxxa','xxxa'),(7,'zxxx','zxxx','zxxx','zxxx'),(8,'axxx','axxx','axxx','axxx'),(9,'zaaz','zaaz','zaaz','zaaz'),(10,'zbbz','zbbz','zbbz','zbbz');
UPDATE t1 SET b=CONCAT(b,'_update') WHERE b like 'xxx%' LIMIT 2;
SELECT * FROM t1;
a	b	c	d	e
1	aaaa	aaaa	aaaa	aaaa
2	xxxc	xxxb	xxxb	xxxb
3	xxxb_update	xxxc	xxxc	xxxc
4	xxxa_update	xxxa	xxxa	xxxa
5	zzzz	zzzz	zzzz	zzzz
6	NULL	NULL	xxxa	xxxa
7	zxxx	zxxx	zxxx	zxxx
8	axxx	axxx	axxx	axxx
9	zaaz	zaaz	zaaz	zaaz
10	zbbz	zbbz	zbbz	zbbz
replace into t1 values(1,'aaaa','aaaa','aaaa','aaaa'),(2,'xxxc','xxxb','xxxb','xxxb'),(3,'xxxb','xxxc','xxxc','xxxc'),(4,'xxxa','xxxa','xxxa','xxxa'),(5,'zzzz','zzzz','zzzz','zzzz'),(6,NULL,NULL,'xxxa','xxxa'),(7,'zxxx','zxxx','zxxx','zxxx'),(8,'axxx','axxx','axxx','axxx'),(9,'zaaz','zaaz','zaaz','zaaz'),(10,'zbbz','zbbz','zbbz','zbbz');
UPDATE t1 SET b=CONCAT(b,'_update') WHERE b like 'xxx%' ESCAPE 'x' LIMIT 2;
SELECT * FROM t1;
a	b	c	d	e
1	aaaa	aaaa	aaaa	aaaa
2	xxxc	xxxb	xxxb	xxxb
3	xxxb	xxxc	xxxc	xxxc
4	xxxa	xxxa	xxxa	xxxa
5	zzzz	zzzz	zzzz	zzzz
6	NULL	NULL	xxxa	xxxa
7	zxxx	zxxx	zxxx	zxxx
8	axxx	axxx	axxx	axxx
9	zaaz	zaaz	zaaz	zaaz
10	zbbz	zbbz	zbbz	zbbz
replace into t1 values(1,'aaaa','aaaa','aaaa','aaaa'),(2,'xxxc','xxxb','xxxb','xxxb'),(3,'xxxb','xxxc','xxxc','xxxc'),(4,'xxxa','xxxa','xxxa','xxxa'),(5,'zzzz','zzzz','zzzz','zzzz'),(6,NULL,NULL,'xxxa','xxxa'),(7,'zxxx','zxxx','zxxx','zxxx'),(8,'axxx','axxx','axxx','axxx'),(9,'zaaz','zaaz','zaaz','zaaz'),(10,'zbbz','zbbz','zbbz','zbbz');
UPDATE t1 SET b=CONCAT(b,'_update') WHERE b like 'xxx%' ESCAPE 'a' LIMIT 2;
SELECT * FROM t1;
a	b	c	d	e
1	aaaa	aaaa	aaaa	aaaa
2	xxxc	xxxb	xxxb	xxxb
3	xxxb_update	xxxc	xxxc	xxxc
4	xxxa_update	xxxa	xxxa	xxxa
5	zzzz	zzzz	zzzz	zzzz
6	NULL	NULL	xxxa	xxxa
7	zxxx	zxxx	zxxx	zxxx
8	axxx	axxx	axxx	axxx
9	zaaz	zaaz	zaaz	zaaz
10	zbbz	zbbz	zbbz	zbbz
replace into t1 values(1,'aaaa','aaaa','aaaa','aaaa'),(2,'xxxc','xxxb','xxxb','xxxb'),(3,'xxxb','xxxc','xxxc','xxxc'),(4,'xxxa','xxxa','xxxa','xxxa'),(5,'zzzz','zzzz','zzzz','zzzz'),(6,NULL,NULL,'xxxa','xxxa'),(7,'zxxx','zxxx','zxxx','zxxx'),(8,'axxx','axxx','axxx','axxx'),(9,'zaaz','zaaz','zaaz','zaaz'),(10,'zbbz','zbbz','zbbz','zbbz');
UPDATE t1 SET b=CONCAT(b,'_update') WHERE b NOT like 'xxx%' LIMIT 2;
SELECT * FROM t1;
a	b	c	d	e
1	aaaa_update	aaaa	aaaa	aaaa
2	xxxc	xxxb	xxxb	xxxb
3	xxxb	xxxc	xxxc	xxxc
4	xxxa	xxxa	xxxa	xxxa
5	zzzz_update	zzzz	zzzz	zzzz
6	NULL	NULL	xxxa	xxxa
7	zxxx	zxxx	zxxx	zxxx
8	axxx	axxx	axxx	axxx
9	zaaz	zaaz	zaaz	zaaz
10	zbbz	zbbz	zbbz	zbbz
replace into t1 values(1,'aaaa','aaaa','aaaa','aaaa'),(2,'xxxc','xxxb','xxxb','xxxb'),(3,'xxxb','xxxc','xxxc','xxxc'),(4,'xxxa','xxxa','xxxa','xxxa'),(5,'zzzz','zzzz','zzzz','zzzz'),(6,NULL,NULL,'xxxa','xxxa'),(7,'zxxx','zxxx','zxxx','zxxx'),(8,'axxx','axxx','axxx','axxx'),(9,'zaaz','zaaz','zaaz','zaaz'),(10,'zbbz','zbbz','zbbz','zbbz');
UPDATE t1 SET b=CONCAT(b,'_update') WHERE b NOT like 'xxx%' ESCAPE 'x' LIMIT 2;
SELECT * FROM t1;
a	b	c	d	e
1	aaaa_update	aaaa	aaaa	aaaa
2	xxxc_update	xxxb	xxxb	xxxb
3	xxxb	xxxc	xxxc	xxxc
4	xxxa	xxxa	xxxa	xxxa
5	zzzz	zzzz	zzzz	zzzz
6	NULL	NULL	xxxa	xxxa
7	zxxx	zxxx	zxxx	zxxx
8	axxx	axxx	axxx	axxx
9	zaaz	zaaz	zaaz	zaaz
10	zbbz	zbbz	zbbz	zbbz
replace into t1 values(1,'aaaa','aaaa','aaaa','aaaa'),(2,'xxxc','xxxb','xxxb','xxxb'),(3,'xxxb','xxxc','xxxc','xxxc'),(4,'xxxa','xxxa','xxxa','xxxa'),(5,'zzzz','zzzz','zzzz','zzzz'),(6,NULL,NULL,'xxxa','xxxa'),(7,'zxxx','zxxx','zxxx','zxxx'),(8,'axxx','axxx','axxx','axxx'),(9,'zaaz','zaaz','zaaz','zaaz'),(10,'zbbz','zbbz','zbbz','zbbz');
UPDATE t1 SET b=CONCAT(b,'_update') WHERE b NOT like 'xxx%' ESCAPE 'a' LIMIT 2;
SELECT * FROM t1;
a	b	c	d	e
1	aaaa_update	aaaa	aaaa	aaaa
2	xxxc	xxxb	xxxb	xxxb
3	xxxb	xxxc	xxxc	xxxc
4	xxxa	xxxa	xxxa	xxxa
5	zzzz_update	zzzz	zzzz	zzzz
6	NULL	NULL	xxxa	xxxa
7	zxxx	zxxx	zxxx	zxxx
8	axxx	axxx	axxx	axxx
9	zaaz	zaaz	zaaz	zaaz
10	zbbz	zbbz	zbbz	zbbz
-- col_str1 [NOT] LIKE ‘z%z’ [ESCAPE col_str3]
replace into t1 values(1,'aaaa','aaaa','aaaa','aaaa'),(2,'xxxc','xxxb','xxxb','xxxb'),(3,'xxxb','xxxc','xxxc','xxxc'),(4,'xxxa','xxxa','xxxa','xxxa'),(5,'zzzz','zzzz','zzzz','zzzz'),(6,NULL,NULL,'xxxa','xxxa'),(7,'zxxx','zxxx','zxxx','zxxx'),(8,'axxx','axxx','axxx','axxx'),(9,'zaaz','zaaz','zaaz','zaaz'),(10,'zbbz','zbbz','zbbz','zbbz');
UPDATE t1 SET b=CONCAT(b,'_update') WHERE b like 'z%z' LIMIT 2;
SELECT * FROM t1;
a	b	c	d	e
1	aaaa	aaaa	aaaa	aaaa
2	xxxc	xxxb	xxxb	xxxb
3	xxxb	xxxc	xxxc	xxxc
4	xxxa	xxxa	xxxa	xxxa
5	zzzz	zzzz	zzzz	zzzz
6	NULL	NULL	xxxa	xxxa
7	zxxx	zxxx	zxxx	zxxx
8	axxx	axxx	axxx	axxx
9	zaaz_update	zaaz	zaaz	zaaz
10	zbbz_update	zbbz	zbbz	zbbz
replace into t1 values(1,'aaaa','aaaa','aaaa','aaaa'),(2,'xxxc','xxxb','xxxb','xxxb'),(3,'xxxb','xxxc','xxxc','xxxc'),(4,'xxxa','xxxa','xxxa','xxxa'),(5,'zzzz','zzzz','zzzz','zzzz'),(6,NULL,NULL,'xxxa','xxxa'),(7,'zxxx','zxxx','zxxx','zxxx'),(8,'axxx','axxx','axxx','axxx'),(9,'zaaz','zaaz','zaaz','zaaz'),(10,'zbbz','zbbz','zbbz','zbbz');
UPDATE t1 SET b=CONCAT(b,'_update') WHERE b like 'z%z' ESCAPE 'x' LIMIT 2;
SELECT * FROM t1;
a	b	c	d	e
1	aaaa	aaaa	aaaa	aaaa
2	xxxc	xxxb	xxxb	xxxb
3	xxxb	xxxc	xxxc	xxxc
4	xxxa	xxxa	xxxa	xxxa
5	zzzz	zzzz	zzzz	zzzz
6	NULL	NULL	xxxa	xxxa
7	zxxx	zxxx	zxxx	zxxx
8	axxx	axxx	axxx	axxx
9	zaaz_update	zaaz	zaaz	zaaz
10	zbbz_update	zbbz	zbbz	zbbz
replace into t1 values(1,'aaaa','aaaa','aaaa','aaaa'),(2,'xxxc','xxxb','xxxb','xxxb'),(3,'xxxb','xxxc','xxxc','xxxc'),(4,'xxxa','xxxa','xxxa','xxxa'),(5,'zzzz','zzzz','zzzz','zzzz'),(6,NULL,NULL,'xxxa','xxxa'),(7,'zxxx','zxxx','zxxx','zxxx'),(8,'axxx','axxx','axxx','axxx'),(9,'zaaz','zaaz','zaaz','zaaz'),(10,'zbbz','zbbz','zbbz','zbbz');
UPDATE t1 SET b=CONCAT(b,'_update') WHERE b like 'z%z' ESCAPE 'a' LIMIT 2;
SELECT * FROM t1;
a	b	c	d	e
1	aaaa	aaaa	aaaa	aaaa
2	xxxc	xxxb	xxxb	xxxb
3	xxxb	xxxc	xxxc	xxxc
4	xxxa	xxxa	xxxa	xxxa
5	zzzz	zzzz	zzzz	zzzz
6	NULL	NULL	xxxa	xxxa
7	zxxx	zxxx	zxxx	zxxx
8	axxx	axxx	axxx	axxx
9	zaaz_update	zaaz	zaaz	zaaz
10	zbbz_update	zbbz	zbbz	zbbz
replace into t1 values(1,'aaaa','aaaa','aaaa','aaaa'),(2,'xxxc','xxxb','xxxb','xxxb'),(3,'xxxb','xxxc','xxxc','xxxc'),(4,'xxxa','xxxa','xxxa','xxxa'),(5,'zzzz','zzzz','zzzz','zzzz'),(6,NULL,NULL,'xxxa','xxxa'),(7,'zxxx','zxxx','zxxx','zxxx'),(8,'axxx','axxx','axxx','axxx'),(9,'zaaz','zaaz','zaaz','zaaz'),(10,'zbbz','zbbz','zbbz','zbbz');
UPDATE t1 SET b=CONCAT(b,'_update') WHERE b NOT like 'z%z' LIMIT 2;
SELECT * FROM t1;
a	b	c	d	e
1	aaaa_update	aaaa	aaaa	aaaa
2	xxxc_update	xxxb	xxxb	xxxb
3	xxxb	xxxc	xxxc	xxxc
4	xxxa	xxxa	xxxa	xxxa
5	zzzz	zzzz	zzzz	zzzz
6	NULL	NULL	xxxa	xxxa
7	zxxx	zxxx	zxxx	zxxx
8	axxx	axxx	axxx	axxx
9	zaaz	zaaz	zaaz	zaaz
10	zbbz	zbbz	zbbz	zbbz
replace into t1 values(1,'aaaa','aaaa','aaaa','aaaa'),(2,'xxxc','xxxb','xxxb','xxxb'),(3,'xxxb','xxxc','xxxc','xxxc'),(4,'xxxa','xxxa','xxxa','xxxa'),(5,'zzzz','zzzz','zzzz','zzzz'),(6,NULL,NULL,'xxxa','xxxa'),(7,'zxxx','zxxx','zxxx','zxxx'),(8,'axxx','axxx','axxx','axxx'),(9,'zaaz','zaaz','zaaz','zaaz'),(10,'zbbz','zbbz','zbbz','zbbz');
UPDATE t1 SET b=CONCAT(b,'_update') WHERE b NOT like 'z%z' ESCAPE 'x' LIMIT 2;
SELECT * FROM t1;
a	b	c	d	e
1	aaaa_update	aaaa	aaaa	aaaa
2	xxxc_update	xxxb	xxxb	xxxb
3	xxxb	xxxc	xxxc	xxxc
4	xxxa	xxxa	xxxa	xxxa
5	zzzz	zzzz	zzzz	zzzz
6	NULL	NULL	xxxa	xxxa
7	zxxx	zxxx	zxxx	zxxx
8	axxx	axxx	axxx	axxx
9	zaaz	zaaz	zaaz	zaaz
10	zbbz	zbbz	zbbz	zbbz
replace into t1 values(1,'aaaa','aaaa','aaaa','aaaa'),(2,'xxxc','xxxb','xxxb','xxxb'),(3,'xxxb','xxxc','xxxc','xxxc'),(4,'xxxa','xxxa','xxxa','xxxa'),(5,'zzzz','zzzz','zzzz','zzzz'),(6,NULL,NULL,'xxxa','xxxa'),(7,'zxxx','zxxx','zxxx','zxxx'),(8,'axxx','axxx','axxx','axxx'),(9,'zaaz','zaaz','zaaz','zaaz'),(10,'zbbz','zbbz','zbbz','zbbz');
UPDATE t1 SET b=CONCAT(b,'_update') WHERE b NOT like 'z%z' ESCAPE 'a' LIMIT 2;
SELECT * FROM t1;
a	b	c	d	e
1	aaaa_update	aaaa	aaaa	aaaa
2	xxxc_update	xxxb	xxxb	xxxb
3	xxxb	xxxc	xxxc	xxxc
4	xxxa	xxxa	xxxa	xxxa
5	zzzz	zzzz	zzzz	zzzz
6	NULL	NULL	xxxa	xxxa
7	zxxx	zxxx	zxxx	zxxx
8	axxx	axxx	axxx	axxx
9	zaaz	zaaz	zaaz	zaaz
10	zbbz	zbbz	zbbz	zbbz
-- col_str1 [NOT] LIKE ‘z__z’ [ESCAPE col_str3]
replace into t1 values(1,'aaaa','aaaa','aaaa','aaaa'),(2,'xxxc','xxxb','xxxb','xxxb'),(3,'xxxb','xxxc','xxxc','xxxc'),(4,'xxxa','xxxa','xxxa','xxxa'),(5,'zzzz','zzzz','zzzz','zzzz'),(6,NULL,NULL,'xxxa','xxxa'),(7,'zxxx','zxxx','zxxx','zxxx'),(8,'axxx','axxx','axxx','axxx'),(9,'zaaz','zaaz','zaaz','zaaz'),(10,'zbbz','zbbz','zbbz','zbbz');
UPDATE t1 SET b=CONCAT(b,'_update') WHERE b like 'z__z' LIMIT 2;
SELECT * FROM t1;
a	b	c	d	e
1	aaaa	aaaa	aaaa	aaaa
2	xxxc	xxxb	xxxb	xxxb
3	xxxb	xxxc	xxxc	xxxc
4	xxxa	xxxa	xxxa	xxxa
5	zzzz	zzzz	zzzz	zzzz
6	NULL	NULL	xxxa	xxxa
7	zxxx	zxxx	zxxx	zxxx
8	axxx	axxx	axxx	axxx
9	zaaz_update	zaaz	zaaz	zaaz
10	zbbz_update	zbbz	zbbz	zbbz
replace into t1 values(1,'aaaa','aaaa','aaaa','aaaa'),(2,'xxxc','xxxb','xxxb','xxxb'),(3,'xxxb','xxxc','xxxc','xxxc'),(4,'xxxa','xxxa','xxxa','xxxa'),(5,'zzzz','zzzz','zzzz','zzzz'),(6,NULL,NULL,'xxxa','xxxa'),(7,'zxxx','zxxx','zxxx','zxxx'),(8,'axxx','axxx','axxx','axxx'),(9,'zaaz','zaaz','zaaz','zaaz'),(10,'zbbz','zbbz','zbbz','zbbz');
UPDATE t1 SET b=CONCAT(b,'_update') WHERE b like 'z__z' ESCAPE 'x' LIMIT 2;
SELECT * FROM t1;
a	b	c	d	e
1	aaaa	aaaa	aaaa	aaaa
2	xxxc	xxxb	xxxb	xxxb
3	xxxb	xxxc	xxxc	xxxc
4	xxxa	xxxa	xxxa	xxxa
5	zzzz	zzzz	zzzz	zzzz
6	NULL	NULL	xxxa	xxxa
7	zxxx	zxxx	zxxx	zxxx
8	axxx	axxx	axxx	axxx
9	zaaz_update	zaaz	zaaz	zaaz
10	zbbz_update	zbbz	zbbz	zbbz
replace into t1 values(1,'aaaa','aaaa','aaaa','aaaa'),(2,'xxxc','xxxb','xxxb','xxxb'),(3,'xxxb','xxxc','xxxc','xxxc'),(4,'xxxa','xxxa','xxxa','xxxa'),(5,'zzzz','zzzz','zzzz','zzzz'),(6,NULL,NULL,'xxxa','xxxa'),(7,'zxxx','zxxx','zxxx','zxxx'),(8,'axxx','axxx','axxx','axxx'),(9,'zaaz','zaaz','zaaz','zaaz'),(10,'zbbz','zbbz','zbbz','zbbz');
UPDATE t1 SET b=CONCAT(b,'_update') WHERE b like 'z__z' ESCAPE 'a' LIMIT 2;
SELECT * FROM t1;
a	b	c	d	e
1	aaaa	aaaa	aaaa	aaaa
2	xxxc	xxxb	xxxb	xxxb
3	xxxb	xxxc	xxxc	xxxc
4	xxxa	xxxa	xxxa	xxxa
5	zzzz	zzzz	zzzz	zzzz
6	NULL	NULL	xxxa	xxxa
7	zxxx	zxxx	zxxx	zxxx
8	axxx	axxx	axxx	axxx
9	zaaz_update	zaaz	zaaz	zaaz
10	zbbz_update	zbbz	zbbz	zbbz
replace into t1 values(1,'aaaa','aaaa','aaaa','aaaa'),(2,'xxxc','xxxb','xxxb','xxxb'),(3,'xxxb','xxxc','xxxc','xxxc'),(4,'xxxa','xxxa','xxxa','xxxa'),(5,'zzzz','zzzz','zzzz','zzzz'),(6,NULL,NULL,'xxxa','xxxa'),(7,'zxxx','zxxx','zxxx','zxxx'),(8,'axxx','axxx','axxx','axxx'),(9,'zaaz','zaaz','zaaz','zaaz'),(10,'zbbz','zbbz','zbbz','zbbz');
UPDATE t1 SET b=CONCAT(b,'_update') WHERE b NOT like 'z__z' LIMIT 2;
SELECT * FROM t1;
a	b	c	d	e
1	aaaa_update	aaaa	aaaa	aaaa
2	xxxc_update	xxxb	xxxb	xxxb
3	xxxb	xxxc	xxxc	xxxc
4	xxxa	xxxa	xxxa	xxxa
5	zzzz	zzzz	zzzz	zzzz
6	NULL	NULL	xxxa	xxxa
7	zxxx	zxxx	zxxx	zxxx
8	axxx	axxx	axxx	axxx
9	zaaz	zaaz	zaaz	zaaz
10	zbbz	zbbz	zbbz	zbbz
replace into t1 values(1,'aaaa','aaaa','aaaa','aaaa'),(2,'xxxc','xxxb','xxxb','xxxb'),(3,'xxxb','xxxc','xxxc','xxxc'),(4,'xxxa','xxxa','xxxa','xxxa'),(5,'zzzz','zzzz','zzzz','zzzz'),(6,NULL,NULL,'xxxa','xxxa'),(7,'zxxx','zxxx','zxxx','zxxx'),(8,'axxx','axxx','axxx','axxx'),(9,'zaaz','zaaz','zaaz','zaaz'),(10,'zbbz','zbbz','zbbz','zbbz');
UPDATE t1 SET b=CONCAT(b,'_update') WHERE b NOT like 'z__z' ESCAPE 'x' LIMIT 2;
SELECT * FROM t1;
a	b	c	d	e
1	aaaa_update	aaaa	aaaa	aaaa
2	xxxc_update	xxxb	xxxb	xxxb
3	xxxb	xxxc	xxxc	xxxc
4	xxxa	xxxa	xxxa	xxxa
5	zzzz	zzzz	zzzz	zzzz
6	NULL	NULL	xxxa	xxxa
7	zxxx	zxxx	zxxx	zxxx
8	axxx	axxx	axxx	axxx
9	zaaz	zaaz	zaaz	zaaz
10	zbbz	zbbz	zbbz	zbbz
replace into t1 values(1,'aaaa','aaaa','aaaa','aaaa'),(2,'xxxc','xxxb','xxxb','xxxb'),(3,'xxxb','xxxc','xxxc','xxxc'),(4,'xxxa','xxxa','xxxa','xxxa'),(5,'zzzz','zzzz','zzzz','zzzz'),(6,NULL,NULL,'xxxa','xxxa'),(7,'zxxx','zxxx','zxxx','zxxx'),(8,'axxx','axxx','axxx','axxx'),(9,'zaaz','zaaz','zaaz','zaaz'),(10,'zbbz','zbbz','zbbz','zbbz');
UPDATE t1 SET b=CONCAT(b,'_update') WHERE b NOT like 'z__z' ESCAPE 'a' LIMIT 2;
SELECT * FROM t1;
a	b	c	d	e
1	aaaa_update	aaaa	aaaa	aaaa
2	xxxc_update	xxxb	xxxb	xxxb
3	xxxb	xxxc	xxxc	xxxc
4	xxxa	xxxa	xxxa	xxxa
5	zzzz	zzzz	zzzz	zzzz
6	NULL	NULL	xxxa	xxxa
7	zxxx	zxxx	zxxx	zxxx
8	axxx	axxx	axxx	axxx
9	zaaz	zaaz	zaaz	zaaz
10	zbbz	zbbz	zbbz	zbbz
-- col_str1 [NOT] LIKE ‘z%z%’ [ESCAPE col_str3]
replace into t1 values(1,'aaaa','aaaa','aaaa','aaaa'),(2,'xxxc','xxxb','xxxb','xxxb'),(3,'xxxb','xxxc','xxxc','xxxc'),(4,'xxxa','xxxa','xxxa','xxxa'),(5,'zzzz','zzzz','zzzz','zzzz'),(6,NULL,NULL,'xxxa','xxxa'),(7,'zxxx','zxxx','zxxx','zxxx'),(8,'axxx','axxx','axxx','axxx'),(9,'zaaz','zaaz','zaaz','zaaz'),(10,'zbbz','zbbz','zbbz','zbbz');
UPDATE t1 SET b=CONCAT(b,'_update') WHERE b like 'z%z%' LIMIT 2;
SELECT * FROM t1;
a	b	c	d	e
1	aaaa	aaaa	aaaa	aaaa
2	xxxc	xxxb	xxxb	xxxb
3	xxxb	xxxc	xxxc	xxxc
4	xxxa	xxxa	xxxa	xxxa
5	zzzz	zzzz	zzzz	zzzz
6	NULL	NULL	xxxa	xxxa
7	zxxx	zxxx	zxxx	zxxx
8	axxx	axxx	axxx	axxx
9	zaaz_update	zaaz	zaaz	zaaz
10	zbbz_update	zbbz	zbbz	zbbz
replace into t1 values(1,'aaaa','aaaa','aaaa','aaaa'),(2,'xxxc','xxxb','xxxb','xxxb'),(3,'xxxb','xxxc','xxxc','xxxc'),(4,'xxxa','xxxa','xxxa','xxxa'),(5,'zzzz','zzzz','zzzz','zzzz'),(6,NULL,NULL,'xxxa','xxxa'),(7,'zxxx','zxxx','zxxx','zxxx'),(8,'axxx','axxx','axxx','axxx'),(9,'zaaz','zaaz','zaaz','zaaz'),(10,'zbbz','zbbz','zbbz','zbbz');
UPDATE t1 SET b=CONCAT(b,'_update') WHERE b like 'z%z%' ESCAPE 'x' LIMIT 2;
SELECT * FROM t1;
a	b	c	d	e
1	aaaa	aaaa	aaaa	aaaa
2	xxxc	xxxb	xxxb	xxxb
3	xxxb	xxxc	xxxc	xxxc
4	xxxa	xxxa	xxxa	xxxa
5	zzzz	zzzz	zzzz	zzzz
6	NULL	NULL	xxxa	xxxa
7	zxxx	zxxx	zxxx	zxxx
8	axxx	axxx	axxx	axxx
9	zaaz_update	zaaz	zaaz	zaaz
10	zbbz_update	zbbz	zbbz	zbbz
replace into t1 values(1,'aaaa','aaaa','aaaa','aaaa'),(2,'xxxc','xxxb','xxxb','xxxb'),(3,'xxxb','xxxc','xxxc','xxxc'),(4,'xxxa','xxxa','xxxa','xxxa'),(5,'zzzz','zzzz','zzzz','zzzz'),(6,NULL,NULL,'xxxa','xxxa'),(7,'zxxx','zxxx','zxxx','zxxx'),(8,'axxx','axxx','axxx','axxx'),(9,'zaaz','zaaz','zaaz','zaaz'),(10,'zbbz','zbbz','zbbz','zbbz');
UPDATE t1 SET b=CONCAT(b,'_update') WHERE b like 'z%z%' ESCAPE 'a' LIMIT 2;
SELECT * FROM t1;
a	b	c	d	e
1	aaaa	aaaa	aaaa	aaaa
2	xxxc	xxxb	xxxb	xxxb
3	xxxb	xxxc	xxxc	xxxc
4	xxxa	xxxa	xxxa	xxxa
5	zzzz	zzzz	zzzz	zzzz
6	NULL	NULL	xxxa	xxxa
7	zxxx	zxxx	zxxx	zxxx
8	axxx	axxx	axxx	axxx
9	zaaz_update	zaaz	zaaz	zaaz
10	zbbz_update	zbbz	zbbz	zbbz
replace into t1 values(1,'aaaa','aaaa','aaaa','aaaa'),(2,'xxxc','xxxb','xxxb','xxxb'),(3,'xxxb','xxxc','xxxc','xxxc'),(4,'xxxa','xxxa','xxxa','xxxa'),(5,'zzzz','zzzz','zzzz','zzzz'),(6,NULL,NULL,'xxxa','xxxa'),(7,'zxxx','zxxx','zxxx','zxxx'),(8,'axxx','axxx','axxx','axxx'),(9,'zaaz','zaaz','zaaz','zaaz'),(10,'zbbz','zbbz','zbbz','zbbz');
UPDATE t1 SET b=CONCAT(b,'_update') WHERE b like 'z%%%%%%%%%%%%%%%z%' LIMIT 2;
SELECT * FROM t1;
a	b	c	d	e
1	aaaa	aaaa	aaaa	aaaa
2	xxxc	xxxb	xxxb	xxxb
3	xxxb	xxxc	xxxc	xxxc
4	xxxa	xxxa	xxxa	xxxa
5	zzzz	zzzz	zzzz	zzzz
6	NULL	NULL	xxxa	xxxa
7	zxxx	zxxx	zxxx	zxxx
8	axxx	axxx	axxx	axxx
9	zaaz_update	zaaz	zaaz	zaaz
10	zbbz_update	zbbz	zbbz	zbbz
replace into t1 values(1,'aaaa','aaaa','aaaa','aaaa'),(2,'xxxc','xxxb','xxxb','xxxb'),(3,'xxxb','xxxc','xxxc','xxxc'),(4,'xxxa','xxxa','xxxa','xxxa'),(5,'zzzz','zzzz','zzzz','zzzz'),(6,NULL,NULL,'xxxa','xxxa'),(7,'zxxx','zxxx','zxxx','zxxx'),(8,'axxx','axxx','axxx','axxx'),(9,'zaaz','zaaz','zaaz','zaaz'),(10,'zbbz','zbbz','zbbz','zbbz');
UPDATE t1 SET b=CONCAT(b,'_update') WHERE b like 'z%%%%%%%%%%%%%%%z%' ESCAPE 'x' LIMIT 2;
SELECT * FROM t1;
a	b	c	d	e
1	aaaa	aaaa	aaaa	aaaa
2	xxxc	xxxb	xxxb	xxxb
3	xxxb	xxxc	xxxc	xxxc
4	xxxa	xxxa	xxxa	xxxa
5	zzzz	zzzz	zzzz	zzzz
6	NULL	NULL	xxxa	xxxa
7	zxxx	zxxx	zxxx	zxxx
8	axxx	axxx	axxx	axxx
9	zaaz_update	zaaz	zaaz	zaaz
10	zbbz_update	zbbz	zbbz	zbbz
replace into t1 values(1,'aaaa','aaaa','aaaa','aaaa'),(2,'xxxc','xxxb','xxxb','xxxb'),(3,'xxxb','xxxc','xxxc','xxxc'),(4,'xxxa','xxxa','xxxa','xxxa'),(5,'zzzz','zzzz','zzzz','zzzz'),(6,NULL,NULL,'xxxa','xxxa'),(7,'zxxx','zxxx','zxxx','zxxx'),(8,'axxx','axxx','axxx','axxx'),(9,'zaaz','zaaz','zaaz','zaaz'),(10,'zbbz','zbbz','zbbz','zbbz');
UPDATE t1 SET b=CONCAT(b,'_update') WHERE b like 'z%%%%%%%%%%%%%%%z%' ESCAPE 'a' LIMIT 2;
SELECT * FROM t1;
a	b	c	d	e
1	aaaa	aaaa	aaaa	aaaa
2	xxxc	xxxb	xxxb	xxxb
3	xxxb	xxxc	xxxc	xxxc
4	xxxa	xxxa	xxxa	xxxa
5	zzzz	zzzz	zzzz	zzzz
6	NULL	NULL	xxxa	xxxa
7	zxxx	zxxx	zxxx	zxxx
8	axxx	axxx	axxx	axxx
9	zaaz_update	zaaz	zaaz	zaaz
10	zbbz_update	zbbz	zbbz	zbbz
replace into t1 values(1,'aaaa','aaaa','aaaa','aaaa'),(2,'xxxc','xxxb','xxxb','xxxb'),(3,'xxxb','xxxc','xxxc','xxxc'),(4,'xxxa','xxxa','xxxa','xxxa'),(5,'zzzz','zzzz','zzzz','zzzz'),(6,NULL,NULL,'xxxa','xxxa'),(7,'zxxx','zxxx','zxxx','zxxx'),(8,'axxx','axxx','axxx','axxx'),(9,'zaaz','zaaz','zaaz','zaaz'),(10,'zbbz','zbbz','zbbz','zbbz');
UPDATE t1 SET b=CONCAT(b,'_update') WHERE b like 'z_%%%%%%%%%%%%%%%z%' LIMIT 2;
SELECT * FROM t1;
a	b	c	d	e
1	aaaa	aaaa	aaaa	aaaa
2	xxxc	xxxb	xxxb	xxxb
3	xxxb	xxxc	xxxc	xxxc
4	xxxa	xxxa	xxxa	xxxa
5	zzzz	zzzz	zzzz	zzzz
6	NULL	NULL	xxxa	xxxa
7	zxxx	zxxx	zxxx	zxxx
8	axxx	axxx	axxx	axxx
9	zaaz_update	zaaz	zaaz	zaaz
10	zbbz_update	zbbz	zbbz	zbbz
replace into t1 values(1,'aaaa','aaaa','aaaa','aaaa'),(2,'xxxc','xxxb','xxxb','xxxb'),(3,'xxxb','xxxc','xxxc','xxxc'),(4,'xxxa','xxxa','xxxa','xxxa'),(5,'zzzz','zzzz','zzzz','zzzz'),(6,NULL,NULL,'xxxa','xxxa'),(7,'zxxx','zxxx','zxxx','zxxx'),(8,'axxx','axxx','axxx','axxx'),(9,'zaaz','zaaz','zaaz','zaaz'),(10,'zbbz','zbbz','zbbz','zbbz');
UPDATE t1 SET b=CONCAT(b,'_update') WHERE b like 'z%_%%%%%%%%%%%%%z%' ESCAPE 'x' LIMIT 2;
SELECT * FROM t1;
a	b	c	d	e
1	aaaa	aaaa	aaaa	aaaa
2	xxxc	xxxb	xxxb	xxxb
3	xxxb	xxxc	xxxc	xxxc
4	xxxa	xxxa	xxxa	xxxa
5	zzzz	zzzz	zzzz	zzzz
6	NULL	NULL	xxxa	xxxa
7	zxxx	zxxx	zxxx	zxxx
8	axxx	axxx	axxx	axxx
9	zaaz_update	zaaz	zaaz	zaaz
10	zbbz_update	zbbz	zbbz	zbbz
replace into t1 values(1,'aaaa','aaaa','aaaa','aaaa'),(2,'xxxc','xxxb','xxxb','xxxb'),(3,'xxxb','xxxc','xxxc','xxxc'),(4,'xxxa','xxxa','xxxa','xxxa'),(5,'zzzz','zzzz','zzzz','zzzz'),(6,NULL,NULL,'xxxa','xxxa'),(7,'zxxx','zxxx','zxxx','zxxx'),(8,'axxx','axxx','axxx','axxx'),(9,'zaaz','zaaz','zaaz','zaaz'),(10,'zbbz','zbbz','zbbz','zbbz');
UPDATE t1 SET b=CONCAT(b,'_update') WHERE b like 'z%%%%%%%%%%%%%%%_z%' ESCAPE 'a' LIMIT 2;
SELECT * FROM t1;
a	b	c	d	e
1	aaaa	aaaa	aaaa	aaaa
2	xxxc	xxxb	xxxb	xxxb
3	xxxb	xxxc	xxxc	xxxc
4	xxxa	xxxa	xxxa	xxxa
5	zzzz	zzzz	zzzz	zzzz
6	NULL	NULL	xxxa	xxxa
7	zxxx	zxxx	zxxx	zxxx
8	axxx	axxx	axxx	axxx
9	zaaz_update	zaaz	zaaz	zaaz
10	zbbz_update	zbbz	zbbz	zbbz
replace into t1 values(1,'aaaa','aaaa','aaaa','aaaa'),(2,'xxxc','xxxb','xxxb','xxxb'),(3,'xxxb','xxxc','xxxc','xxxc'),(4,'xxxa','xxxa','xxxa','xxxa'),(5,'zzzz','zzzz','zzzz','zzzz'),(6,NULL,NULL,'xxxa','xxxa'),(7,'zxxx','zxxx','zxxx','zxxx'),(8,'axxx','axxx','axxx','axxx'),(9,'zaaz','zaaz','zaaz','zaaz'),(10,'zbbz','zbbz','zbbz','zbbz');
UPDATE t1 SET b=CONCAT(b,'_update') WHERE b like 'z%%%%%%%%%%%%%%%%%%%%%%%%%%%%%z%%%%%%%%%%%%%%%' LIMIT 2;
SELECT * FROM t1;
a	b	c	d	e
1	aaaa	aaaa	aaaa	aaaa
2	xxxc	xxxb	xxxb	xxxb
3	xxxb	xxxc	xxxc	xxxc
4	xxxa	xxxa	xxxa	xxxa
5	zzzz	zzzz	zzzz	zzzz
6	NULL	NULL	xxxa	xxxa
7	zxxx	zxxx	zxxx	zxxx
8	axxx	axxx	axxx	axxx
9	zaaz_update	zaaz	zaaz	zaaz
10	zbbz_update	zbbz	zbbz	zbbz
replace into t1 values(1,'aaaa','aaaa','aaaa','aaaa'),(2,'xxxc','xxxb','xxxb','xxxb'),(3,'xxxb','xxxc','xxxc','xxxc'),(4,'xxxa','xxxa','xxxa','xxxa'),(5,'zzzz','zzzz','zzzz','zzzz'),(6,NULL,NULL,'xxxa','xxxa'),(7,'zxxx','zxxx','zxxx','zxxx'),(8,'axxx','axxx','axxx','axxx'),(9,'zaaz','zaaz','zaaz','zaaz'),(10,'zbbz','zbbz','zbbz','zbbz');
UPDATE t1 SET b=CONCAT(b,'_update') WHERE b like 'z%%%%%%%%%%%%%%%%%%%%%%%%%%%%%z%%%%%%%%%%%%%%%' ESCAPE 'x' LIMIT 2;
SELECT * FROM t1;
a	b	c	d	e
1	aaaa	aaaa	aaaa	aaaa
2	xxxc	xxxb	xxxb	xxxb
3	xxxb	xxxc	xxxc	xxxc
4	xxxa	xxxa	xxxa	xxxa
5	zzzz	zzzz	zzzz	zzzz
6	NULL	NULL	xxxa	xxxa
7	zxxx	zxxx	zxxx	zxxx
8	axxx	axxx	axxx	axxx
9	zaaz_update	zaaz	zaaz	zaaz
10	zbbz_update	zbbz	zbbz	zbbz
replace into t1 values(1,'aaaa','aaaa','aaaa','aaaa'),(2,'xxxc','xxxb','xxxb','xxxb'),(3,'xxxb','xxxc','xxxc','xxxc'),(4,'xxxa','xxxa','xxxa','xxxa'),(5,'zzzz','zzzz','zzzz','zzzz'),(6,NULL,NULL,'xxxa','xxxa'),(7,'zxxx','zxxx','zxxx','zxxx'),(8,'axxx','axxx','axxx','axxx'),(9,'zaaz','zaaz','zaaz','zaaz'),(10,'zbbz','zbbz','zbbz','zbbz');
UPDATE t1 SET b=CONCAT(b,'_update') WHERE b like 'z%%%%%%%%%%%%%%%%%%%%%%%%%%%%%z%%%%%%%%%%%%%%%' ESCAPE 'a' LIMIT 2;
SELECT * FROM t1;
a	b	c	d	e
1	aaaa	aaaa	aaaa	aaaa
2	xxxc	xxxb	xxxb	xxxb
3	xxxb	xxxc	xxxc	xxxc
4	xxxa	xxxa	xxxa	xxxa
5	zzzz	zzzz	zzzz	zzzz
6	NULL	NULL	xxxa	xxxa
7	zxxx	zxxx	zxxx	zxxx
8	axxx	axxx	axxx	axxx
9	zaaz_update	zaaz	zaaz	zaaz
10	zbbz_update	zbbz	zbbz	zbbz
replace into t1 values(1,'aaaa','aaaa','aaaa','aaaa'),(2,'xxxc','xxxb','xxxb','xxxb'),(3,'xxxb','xxxc','xxxc','xxxc'),(4,'xxxa','xxxa','xxxa','xxxa'),(5,'zzzz','zzzz','zzzz','zzzz'),(6,NULL,NULL,'xxxa','xxxa'),(7,'zxxx','zxxx','zxxx','zxxx'),(8,'axxx','axxx','axxx','axxx'),(9,'zaaz','zaaz','zaaz','zaaz'),(10,'zbbz','zbbz','zbbz','zbbz');
UPDATE t1 SET b=CONCAT(b,'_update') WHERE b like 'z_%%%%%%%%%%%%%%%z%%%%%%%%%%%%%%%' LIMIT 2;
SELECT * FROM t1;
a	b	c	d	e
1	aaaa	aaaa	aaaa	aaaa
2	xxxc	xxxb	xxxb	xxxb
3	xxxb	xxxc	xxxc	xxxc
4	xxxa	xxxa	xxxa	xxxa
5	zzzz	zzzz	zzzz	zzzz
6	NULL	NULL	xxxa	xxxa
7	zxxx	zxxx	zxxx	zxxx
8	axxx	axxx	axxx	axxx
9	zaaz_update	zaaz	zaaz	zaaz
10	zbbz_update	zbbz	zbbz	zbbz
replace into t1 values(1,'aaaa','aaaa','aaaa','aaaa'),(2,'xxxc','xxxb','xxxb','xxxb'),(3,'xxxb','xxxc','xxxc','xxxc'),(4,'xxxa','xxxa','xxxa','xxxa'),(5,'zzzz','zzzz','zzzz','zzzz'),(6,NULL,NULL,'xxxa','xxxa'),(7,'zxxx','zxxx','zxxx','zxxx'),(8,'axxx','axxx','axxx','axxx'),(9,'zaaz','zaaz','zaaz','zaaz'),(10,'zbbz','zbbz','zbbz','zbbz');
UPDATE t1 SET b=CONCAT(b,'_update') WHERE b like 'z%%%%%%%%%%%%%%%_%%%%%%%%%%%%%z%%%%%%%%%%%%%%%' ESCAPE 'x' LIMIT 2;
SELECT * FROM t1;
a	b	c	d	e
1	aaaa	aaaa	aaaa	aaaa
2	xxxc	xxxb	xxxb	xxxb
3	xxxb	xxxc	xxxc	xxxc
4	xxxa	xxxa	xxxa	xxxa
5	zzzz	zzzz	zzzz	zzzz
6	NULL	NULL	xxxa	xxxa
7	zxxx	zxxx	zxxx	zxxx
8	axxx	axxx	axxx	axxx
9	zaaz_update	zaaz	zaaz	zaaz
10	zbbz_update	zbbz	zbbz	zbbz
replace into t1 values(1,'aaaa','aaaa','aaaa','aaaa'),(2,'xxxc','xxxb','xxxb','xxxb'),(3,'xxxb','xxxc','xxxc','xxxc'),(4,'xxxa','xxxa','xxxa','xxxa'),(5,'zzzz','zzzz','zzzz','zzzz'),(6,NULL,NULL,'xxxa','xxxa'),(7,'zxxx','zxxx','zxxx','zxxx'),(8,'axxx','axxx','axxx','axxx'),(9,'zaaz','zaaz','zaaz','zaaz'),(10,'zbbz','zbbz','zbbz','zbbz');
UPDATE t1 SET b=CONCAT(b,'_update') WHERE b like 'z%%%%%%%%%%%%%%%%%%%%%%%%%%%%%_z%%%%%%%%%%%%%%%' ESCAPE 'a' LIMIT 2;
SELECT * FROM t1;
a	b	c	d	e
1	aaaa	aaaa	aaaa	aaaa
2	xxxc	xxxb	xxxb	xxxb
3	xxxb	xxxc	xxxc	xxxc
4	xxxa	xxxa	xxxa	xxxa
5	zzzz	zzzz	zzzz	zzzz
6	NULL	NULL	xxxa	xxxa
7	zxxx	zxxx	zxxx	zxxx
8	axxx	axxx	axxx	axxx
9	zaaz_update	zaaz	zaaz	zaaz
10	zbbz_update	zbbz	zbbz	zbbz
-- col_str1 [NOT] LIKE ‘%xxx%’ [ESCAPE col_str3]
replace into t1 values(1,'aaaa','aaaa','aaaa','aaaa'),(2,'xxxc','xxxb','xxxb','xxxb'),(3,'xxxb','xxxc','xxxc','xxxc'),(4,'xxxa','xxxa','xxxa','xxxa'),(5,'zzzz','zzzz','zzzz','zzzz'),(6,NULL,NULL,'xxxa','xxxa'),(7,'zxxx','zxxx','zxxx','zxxx'),(8,'axxx','axxx','axxx','axxx'),(9,'zaaz','zaaz','zaaz','zaaz'),(10,'zbbz','zbbz','zbbz','zbbz');
UPDATE t1 SET b=CONCAT(b,'_update') WHERE b like '%xxx%' LIMIT 2;
SELECT * FROM t1;
a	b	c	d	e
1	aaaa	aaaa	aaaa	aaaa
2	xxxc	xxxb	xxxb	xxxb
3	xxxb	xxxc	xxxc	xxxc
4	xxxa_update	xxxa	xxxa	xxxa
5	zzzz	zzzz	zzzz	zzzz
6	NULL	NULL	xxxa	xxxa
7	zxxx	zxxx	zxxx	zxxx
8	axxx_update	axxx	axxx	axxx
9	zaaz	zaaz	zaaz	zaaz
10	zbbz	zbbz	zbbz	zbbz
replace into t1 values(1,'aaaa','aaaa','aaaa','aaaa'),(2,'xxxc','xxxb','xxxb','xxxb'),(3,'xxxb','xxxc','xxxc','xxxc'),(4,'xxxa','xxxa','xxxa','xxxa'),(5,'zzzz','zzzz','zzzz','zzzz'),(6,NULL,NULL,'xxxa','xxxa'),(7,'zxxx','zxxx','zxxx','zxxx'),(8,'axxx','axxx','axxx','axxx'),(9,'zaaz','zaaz','zaaz','zaaz'),(10,'zbbz','zbbz','zbbz','zbbz');
UPDATE t1 SET b=CONCAT(b,'_update') WHERE b like '%xxx%' ESCAPE 'x' LIMIT 2;
SELECT * FROM t1;
a	b	c	d	e
1	aaaa	aaaa	aaaa	aaaa
2	xxxc	xxxb	xxxb	xxxb
3	xxxb	xxxc	xxxc	xxxc
4	xxxa	xxxa	xxxa	xxxa
5	zzzz	zzzz	zzzz	zzzz
6	NULL	NULL	xxxa	xxxa
7	zxxx	zxxx	zxxx	zxxx
8	axxx	axxx	axxx	axxx
9	zaaz	zaaz	zaaz	zaaz
10	zbbz	zbbz	zbbz	zbbz
replace into t1 values(1,'aaaa','aaaa','aaaa','aaaa'),(2,'xxxc','xxxb','xxxb','xxxb'),(3,'xxxb','xxxc','xxxc','xxxc'),(4,'xxxa','xxxa','xxxa','xxxa'),(5,'zzzz','zzzz','zzzz','zzzz'),(6,NULL,NULL,'xxxa','xxxa'),(7,'zxxx','zxxx','zxxx','zxxx'),(8,'axxx','axxx','axxx','axxx'),(9,'zaaz','zaaz','zaaz','zaaz'),(10,'zbbz','zbbz','zbbz','zbbz');
UPDATE t1 SET b=CONCAT(b,'_update') WHERE b like '%xxx%' ESCAPE 'a' LIMIT 2;
SELECT * FROM t1;
a	b	c	d	e
1	aaaa	aaaa	aaaa	aaaa
2	xxxc	xxxb	xxxb	xxxb
3	xxxb	xxxc	xxxc	xxxc
4	xxxa_update	xxxa	xxxa	xxxa
5	zzzz	zzzz	zzzz	zzzz
6	NULL	NULL	xxxa	xxxa
7	zxxx	zxxx	zxxx	zxxx
8	axxx_update	axxx	axxx	axxx
9	zaaz	zaaz	zaaz	zaaz
10	zbbz	zbbz	zbbz	zbbz
replace into t1 values(1,'aaaa','aaaa','aaaa','aaaa'),(2,'xxxc','xxxb','xxxb','xxxb'),(3,'xxxb','xxxc','xxxc','xxxc'),(4,'xxxa','xxxa','xxxa','xxxa'),(5,'zzzz','zzzz','zzzz','zzzz'),(6,NULL,NULL,'xxxa','xxxa'),(7,'zxxx','zxxx','zxxx','zxxx'),(8,'axxx','axxx','axxx','axxx'),(9,'zaaz','zaaz','zaaz','zaaz'),(10,'zbbz','zbbz','zbbz','zbbz');
UPDATE t1 SET b=CONCAT(b,'_update') WHERE b NOT like '%xxx%' LIMIT 2;
SELECT * FROM t1;
a	b	c	d	e
1	aaaa_update	aaaa	aaaa	aaaa
2	xxxc	xxxb	xxxb	xxxb
3	xxxb	xxxc	xxxc	xxxc
4	xxxa	xxxa	xxxa	xxxa
5	zzzz_update	zzzz	zzzz	zzzz
6	NULL	NULL	xxxa	xxxa
7	zxxx	zxxx	zxxx	zxxx
8	axxx	axxx	axxx	axxx
9	zaaz	zaaz	zaaz	zaaz
10	zbbz	zbbz	zbbz	zbbz
replace into t1 values(1,'aaaa','aaaa','aaaa','aaaa'),(2,'xxxc','xxxb','xxxb','xxxb'),(3,'xxxb','xxxc','xxxc','xxxc'),(4,'xxxa','xxxa','xxxa','xxxa'),(5,'zzzz','zzzz','zzzz','zzzz'),(6,NULL,NULL,'xxxa','xxxa'),(7,'zxxx','zxxx','zxxx','zxxx'),(8,'axxx','axxx','axxx','axxx'),(9,'zaaz','zaaz','zaaz','zaaz'),(10,'zbbz','zbbz','zbbz','zbbz');
UPDATE t1 SET b=CONCAT(b,'_update') WHERE b NOT like '%xxx%' ESCAPE 'x' LIMIT 2;
SELECT * FROM t1;
a	b	c	d	e
1	aaaa_update	aaaa	aaaa	aaaa
2	xxxc_update	xxxb	xxxb	xxxb
3	xxxb	xxxc	xxxc	xxxc
4	xxxa	xxxa	xxxa	xxxa
5	zzzz	zzzz	zzzz	zzzz
6	NULL	NULL	xxxa	xxxa
7	zxxx	zxxx	zxxx	zxxx
8	axxx	axxx	axxx	axxx
9	zaaz	zaaz	zaaz	zaaz
10	zbbz	zbbz	zbbz	zbbz
replace into t1 values(1,'aaaa','aaaa','aaaa','aaaa'),(2,'xxxc','xxxb','xxxb','xxxb'),(3,'xxxb','xxxc','xxxc','xxxc'),(4,'xxxa','xxxa','xxxa','xxxa'),(5,'zzzz','zzzz','zzzz','zzzz'),(6,NULL,NULL,'xxxa','xxxa'),(7,'zxxx','zxxx','zxxx','zxxx'),(8,'axxx','axxx','axxx','axxx'),(9,'zaaz','zaaz','zaaz','zaaz'),(10,'zbbz','zbbz','zbbz','zbbz');
UPDATE t1 SET b=CONCAT(b,'_update') WHERE b NOT like '%xxx%' ESCAPE 'a' LIMIT 2;
SELECT * FROM t1;
a	b	c	d	e
1	aaaa_update	aaaa	aaaa	aaaa
2	xxxc	xxxb	xxxb	xxxb
3	xxxb	xxxc	xxxc	xxxc
4	xxxa	xxxa	xxxa	xxxa
5	zzzz_update	zzzz	zzzz	zzzz
6	NULL	NULL	xxxa	xxxa
7	zxxx	zxxx	zxxx	zxxx
8	axxx	axxx	axxx	axxx
9	zaaz	zaaz	zaaz	zaaz
10	zbbz	zbbz	zbbz	zbbz
-- col_str1 [NOT] LIKE ‘%xxx’ [ESCAPE col_str3]
replace into t1 values(1,'aaaa','aaaa','aaaa','aaaa'),(2,'xxxc','xxxb','xxxb','xxxb'),(3,'xxxb','xxxc','xxxc','xxxc'),(4,'xxxa','xxxa','xxxa','xxxa'),(5,'zzzz','zzzz','zzzz','zzzz'),(6,NULL,NULL,'xxxa','xxxa'),(7,'zxxx','zxxx','zxxx','zxxx'),(8,'axxx','axxx','axxx','axxx'),(9,'zaaz','zaaz','zaaz','zaaz'),(10,'zbbz','zbbz','zbbz','zbbz');
UPDATE t1 SET b=CONCAT(b,'_update') WHERE b like '%xxx' LIMIT 2;
SELECT * FROM t1;
a	b	c	d	e
1	aaaa	aaaa	aaaa	aaaa
2	xxxc	xxxb	xxxb	xxxb
3	xxxb	xxxc	xxxc	xxxc
4	xxxa	xxxa	xxxa	xxxa
5	zzzz	zzzz	zzzz	zzzz
6	NULL	NULL	xxxa	xxxa
7	zxxx_update	zxxx	zxxx	zxxx
8	axxx_update	axxx	axxx	axxx
9	zaaz	zaaz	zaaz	zaaz
10	zbbz	zbbz	zbbz	zbbz
replace into t1 values(1,'aaaa','aaaa','aaaa','aaaa'),(2,'xxxc','xxxb','xxxb','xxxb'),(3,'xxxb','xxxc','xxxc','xxxc'),(4,'xxxa','xxxa','xxxa','xxxa'),(5,'zzzz','zzzz','zzzz','zzzz'),(6,NULL,NULL,'xxxa','xxxa'),(7,'zxxx','zxxx','zxxx','zxxx'),(8,'axxx','axxx','axxx','axxx'),(9,'zaaz','zaaz','zaaz','zaaz'),(10,'zbbz','zbbz','zbbz','zbbz');
UPDATE t1 SET b=CONCAT(b,'_update') WHERE b like '%xxx' ESCAPE 'x' LIMIT 2;
SELECT * FROM t1;
a	b	c	d	e
1	aaaa	aaaa	aaaa	aaaa
2	xxxc	xxxb	xxxb	xxxb
3	xxxb	xxxc	xxxc	xxxc
4	xxxa	xxxa	xxxa	xxxa
5	zzzz	zzzz	zzzz	zzzz
6	NULL	NULL	xxxa	xxxa
7	zxxx_update	zxxx	zxxx	zxxx
8	axxx_update	axxx	axxx	axxx
9	zaaz	zaaz	zaaz	zaaz
10	zbbz	zbbz	zbbz	zbbz
replace into t1 values(1,'aaaa','aaaa','aaaa','aaaa'),(2,'xxxc','xxxb','xxxb','xxxb'),(3,'xxxb','xxxc','xxxc','xxxc'),(4,'xxxa','xxxa','xxxa','xxxa'),(5,'zzzz','zzzz','zzzz','zzzz'),(6,NULL,NULL,'xxxa','xxxa'),(7,'zxxx','zxxx','zxxx','zxxx'),(8,'axxx','axxx','axxx','axxx'),(9,'zaaz','zaaz','zaaz','zaaz'),(10,'zbbz','zbbz','zbbz','zbbz');
UPDATE t1 SET b=CONCAT(b,'_update') WHERE b like '%xxx' ESCAPE 'a' LIMIT 2;
SELECT * FROM t1;
a	b	c	d	e
1	aaaa	aaaa	aaaa	aaaa
2	xxxc	xxxb	xxxb	xxxb
3	xxxb	xxxc	xxxc	xxxc
4	xxxa	xxxa	xxxa	xxxa
5	zzzz	zzzz	zzzz	zzzz
6	NULL	NULL	xxxa	xxxa
7	zxxx_update	zxxx	zxxx	zxxx
8	axxx_update	axxx	axxx	axxx
9	zaaz	zaaz	zaaz	zaaz
10	zbbz	zbbz	zbbz	zbbz
replace into t1 values(1,'aaaa','aaaa','aaaa','aaaa'),(2,'xxxc','xxxb','xxxb','xxxb'),(3,'xxxb','xxxc','xxxc','xxxc'),(4,'xxxa','xxxa','xxxa','xxxa'),(5,'zzzz','zzzz','zzzz','zzzz'),(6,NULL,NULL,'xxxa','xxxa'),(7,'zxxx','zxxx','zxxx','zxxx'),(8,'axxx','axxx','axxx','axxx'),(9,'zaaz','zaaz','zaaz','zaaz'),(10,'zbbz','zbbz','zbbz','zbbz');
UPDATE t1 SET b=CONCAT(b,'_update') WHERE b NOT like '_xxx' LIMIT 2;
SELECT * FROM t1;
a	b	c	d	e
1	aaaa_update	aaaa	aaaa	aaaa
2	xxxc_update	xxxb	xxxb	xxxb
3	xxxb	xxxc	xxxc	xxxc
4	xxxa	xxxa	xxxa	xxxa
5	zzzz	zzzz	zzzz	zzzz
6	NULL	NULL	xxxa	xxxa
7	zxxx	zxxx	zxxx	zxxx
8	axxx	axxx	axxx	axxx
9	zaaz	zaaz	zaaz	zaaz
10	zbbz	zbbz	zbbz	zbbz
replace into t1 values(1,'aaaa','aaaa','aaaa','aaaa'),(2,'xxxc','xxxb','xxxb','xxxb'),(3,'xxxb','xxxc','xxxc','xxxc'),(4,'xxxa','xxxa','xxxa','xxxa'),(5,'zzzz','zzzz','zzzz','zzzz'),(6,NULL,NULL,'xxxa','xxxa'),(7,'zxxx','zxxx','zxxx','zxxx'),(8,'axxx','axxx','axxx','axxx'),(9,'zaaz','zaaz','zaaz','zaaz'),(10,'zbbz','zbbz','zbbz','zbbz');
UPDATE t1 SET b=CONCAT(b,'_update') WHERE b NOT like '_xxx' ESCAPE 'x' LIMIT 2;
SELECT * FROM t1;
a	b	c	d	e
1	aaaa_update	aaaa	aaaa	aaaa
2	xxxc_update	xxxb	xxxb	xxxb
3	xxxb	xxxc	xxxc	xxxc
4	xxxa	xxxa	xxxa	xxxa
5	zzzz	zzzz	zzzz	zzzz
6	NULL	NULL	xxxa	xxxa
7	zxxx	zxxx	zxxx	zxxx
8	axxx	axxx	axxx	axxx
9	zaaz	zaaz	zaaz	zaaz
10	zbbz	zbbz	zbbz	zbbz
replace into t1 values(1,'aaaa','aaaa','aaaa','aaaa'),(2,'xxxc','xxxb','xxxb','xxxb'),(3,'xxxb','xxxc','xxxc','xxxc'),(4,'xxxa','xxxa','xxxa','xxxa'),(5,'zzzz','zzzz','zzzz','zzzz'),(6,NULL,NULL,'xxxa','xxxa'),(7,'zxxx','zxxx','zxxx','zxxx'),(8,'axxx','axxx','axxx','axxx'),(9,'zaaz','zaaz','zaaz','zaaz'),(10,'zbbz','zbbz','zbbz','zbbz');
UPDATE t1 SET b=CONCAT(b,'_update') WHERE b NOT like '_xxx' ESCAPE 'a' LIMIT 2;
SELECT * FROM t1;
a	b	c	d	e
1	aaaa_update	aaaa	aaaa	aaaa
2	xxxc_update	xxxb	xxxb	xxxb
3	xxxb	xxxc	xxxc	xxxc
4	xxxa	xxxa	xxxa	xxxa
5	zzzz	zzzz	zzzz	zzzz
6	NULL	NULL	xxxa	xxxa
7	zxxx	zxxx	zxxx	zxxx
8	axxx	axxx	axxx	axxx
9	zaaz	zaaz	zaaz	zaaz
10	zbbz	zbbz	zbbz	zbbz
-- col_str1 [NOT] LIKE ‘xxx_’ [ESCAPE col_str3]
replace into t1 values(1,'aaaa','aaaa','aaaa','aaaa'),(2,'xxxc','xxxb','xxxb','xxxb'),(3,'xxxb','xxxc','xxxc','xxxc'),(4,'xxxa','xxxa','xxxa','xxxa'),(5,'zzzz','zzzz','zzzz','zzzz'),(6,NULL,NULL,'xxxa','xxxa'),(7,'zxxx','zxxx','zxxx','zxxx'),(8,'axxx','axxx','axxx','axxx'),(9,'zaaz','zaaz','zaaz','zaaz'),(10,'zbbz','zbbz','zbbz','zbbz');
UPDATE t1 SET b=CONCAT(b,'_update') WHERE b like 'xxx_' LIMIT 2;
SELECT * FROM t1;
a	b	c	d	e
1	aaaa	aaaa	aaaa	aaaa
2	xxxc	xxxb	xxxb	xxxb
3	xxxb_update	xxxc	xxxc	xxxc
4	xxxa_update	xxxa	xxxa	xxxa
5	zzzz	zzzz	zzzz	zzzz
6	NULL	NULL	xxxa	xxxa
7	zxxx	zxxx	zxxx	zxxx
8	axxx	axxx	axxx	axxx
9	zaaz	zaaz	zaaz	zaaz
10	zbbz	zbbz	zbbz	zbbz
replace into t1 values(1,'aaaa','aaaa','aaaa','aaaa'),(2,'xxxc','xxxb','xxxb','xxxb'),(3,'xxxb','xxxc','xxxc','xxxc'),(4,'xxxa','xxxa','xxxa','xxxa'),(5,'zzzz','zzzz','zzzz','zzzz'),(6,NULL,NULL,'xxxa','xxxa'),(7,'zxxx','zxxx','zxxx','zxxx'),(8,'axxx','axxx','axxx','axxx'),(9,'zaaz','zaaz','zaaz','zaaz'),(10,'zbbz','zbbz','zbbz','zbbz');
UPDATE t1 SET b=CONCAT(b,'_update') WHERE b like 'xxx_' ESCAPE 'x' LIMIT 2;
SELECT * FROM t1;
a	b	c	d	e
1	aaaa	aaaa	aaaa	aaaa
2	xxxc	xxxb	xxxb	xxxb
3	xxxb	xxxc	xxxc	xxxc
4	xxxa	xxxa	xxxa	xxxa
5	zzzz	zzzz	zzzz	zzzz
6	NULL	NULL	xxxa	xxxa
7	zxxx	zxxx	zxxx	zxxx
8	axxx	axxx	axxx	axxx
9	zaaz	zaaz	zaaz	zaaz
10	zbbz	zbbz	zbbz	zbbz
replace into t1 values(1,'aaaa','aaaa','aaaa','aaaa'),(2,'xxxc','xxxb','xxxb','xxxb'),(3,'xxxb','xxxc','xxxc','xxxc'),(4,'xxxa','xxxa','xxxa','xxxa'),(5,'zzzz','zzzz','zzzz','zzzz'),(6,NULL,NULL,'xxxa','xxxa'),(7,'zxxx','zxxx','zxxx','zxxx'),(8,'axxx','axxx','axxx','axxx'),(9,'zaaz','zaaz','zaaz','zaaz'),(10,'zbbz','zbbz','zbbz','zbbz');
UPDATE t1 SET b=CONCAT(b,'_update') WHERE b like 'xxx_' ESCAPE 'a' LIMIT 2;
SELECT * FROM t1;
a	b	c	d	e
1	aaaa	aaaa	aaaa	aaaa
2	xxxc	xxxb	xxxb	xxxb
3	xxxb_update	xxxc	xxxc	xxxc
4	xxxa_update	xxxa	xxxa	xxxa
5	zzzz	zzzz	zzzz	zzzz
6	NULL	NULL	xxxa	xxxa
7	zxxx	zxxx	zxxx	zxxx
8	axxx	axxx	axxx	axxx
9	zaaz	zaaz	zaaz	zaaz
10	zbbz	zbbz	zbbz	zbbz
replace into t1 values(1,'aaaa','aaaa','aaaa','aaaa'),(2,'xxxc','xxxb','xxxb','xxxb'),(3,'xxxb','xxxc','xxxc','xxxc'),(4,'xxxa','xxxa','xxxa','xxxa'),(5,'zzzz','zzzz','zzzz','zzzz'),(6,NULL,NULL,'xxxa','xxxa'),(7,'zxxx','zxxx','zxxx','zxxx'),(8,'axxx','axxx','axxx','axxx'),(9,'zaaz','zaaz','zaaz','zaaz'),(10,'zbbz','zbbz','zbbz','zbbz');
UPDATE t1 SET b=CONCAT(b,'_update') WHERE b NOT like 'xxx_' LIMIT 2;
SELECT * FROM t1;
a	b	c	d	e
1	aaaa_update	aaaa	aaaa	aaaa
2	xxxc	xxxb	xxxb	xxxb
3	xxxb	xxxc	xxxc	xxxc
4	xxxa	xxxa	xxxa	xxxa
5	zzzz_update	zzzz	zzzz	zzzz
6	NULL	NULL	xxxa	xxxa
7	zxxx	zxxx	zxxx	zxxx
8	axxx	axxx	axxx	axxx
9	zaaz	zaaz	zaaz	zaaz
10	zbbz	zbbz	zbbz	zbbz
replace into t1 values(1,'aaaa','aaaa','aaaa','aaaa'),(2,'xxxc','xxxb','xxxb','xxxb'),(3,'xxxb','xxxc','xxxc','xxxc'),(4,'xxxa','xxxa','xxxa','xxxa'),(5,'zzzz','zzzz','zzzz','zzzz'),(6,NULL,NULL,'xxxa','xxxa'),(7,'zxxx','zxxx','zxxx','zxxx'),(8,'axxx','axxx','axxx','axxx'),(9,'zaaz','zaaz','zaaz','zaaz'),(10,'zbbz','zbbz','zbbz','zbbz');
UPDATE t1 SET b=CONCAT(b,'_update') WHERE b NOT like 'xxx_' ESCAPE 'x' LIMIT 2;
SELECT * FROM t1;
a	b	c	d	e
1	aaaa_update	aaaa	aaaa	aaaa
2	xxxc_update	xxxb	xxxb	xxxb
3	xxxb	xxxc	xxxc	xxxc
4	xxxa	xxxa	xxxa	xxxa
5	zzzz	zzzz	zzzz	zzzz
6	NULL	NULL	xxxa	xxxa
7	zxxx	zxxx	zxxx	zxxx
8	axxx	axxx	axxx	axxx
9	zaaz	zaaz	zaaz	zaaz
10	zbbz	zbbz	zbbz	zbbz
replace into t1 values(1,'aaaa','aaaa','aaaa','aaaa'),(2,'xxxc','xxxb','xxxb','xxxb'),(3,'xxxb','xxxc','xxxc','xxxc'),(4,'xxxa','xxxa','xxxa','xxxa'),(5,'zzzz','zzzz','zzzz','zzzz'),(6,NULL,NULL,'xxxa','xxxa'),(7,'zxxx','zxxx','zxxx','zxxx'),(8,'axxx','axxx','axxx','axxx'),(9,'zaaz','zaaz','zaaz','zaaz'),(10,'zbbz','zbbz','zbbz','zbbz');
UPDATE t1 SET b=CONCAT(b,'_update') WHERE b NOT like 'xxx_' ESCAPE 'a' LIMIT 2;
SELECT * FROM t1;
a	b	c	d	e
1	aaaa_update	aaaa	aaaa	aaaa
2	xxxc	xxxb	xxxb	xxxb
3	xxxb	xxxc	xxxc	xxxc
4	xxxa	xxxa	xxxa	xxxa
5	zzzz_update	zzzz	zzzz	zzzz
6	NULL	NULL	xxxa	xxxa
7	zxxx	zxxx	zxxx	zxxx
8	axxx	axxx	axxx	axxx
9	zaaz	zaaz	zaaz	zaaz
10	zbbz	zbbz	zbbz	zbbz
-- col_str1 [NOT] LIKE ‘_xxx_’ [ESCAPE col_str3]
replace into t1 values(1,'aaaa','aaaa','aaaa','aaaa'),(2,'xxxc','xxxb','xxxb','xxxb'),(3,'xxxb','xxxc','xxxc','xxxc'),(4,'xxxa','xxxa','xxxa','xxxa'),(5,'zzzz','zzzz','zzzz','zzzz'),(6,NULL,NULL,'xxxa','xxxa'),(7,'zxxx','zxxx','zxxx','zxxx'),(8,'axxx','axxx','axxx','axxx'),(9,'zaaz','zaaz','zaaz','zaaz'),(10,'zbbz','zbbz','zbbz','zbbz');
UPDATE t1 SET b=CONCAT(b,'_update') WHERE b like '_xxx_' LIMIT 2;
SELECT * FROM t1;
a	b	c	d	e
1	aaaa	aaaa	aaaa	aaaa
2	xxxc	xxxb	xxxb	xxxb
3	xxxb	xxxc	xxxc	xxxc
4	xxxa	xxxa	xxxa	xxxa
5	zzzz	zzzz	zzzz	zzzz
6	NULL	NULL	xxxa	xxxa
7	zxxx	zxxx	zxxx	zxxx
8	axxx	axxx	axxx	axxx
9	zaaz	zaaz	zaaz	zaaz
10	zbbz	zbbz	zbbz	zbbz
replace into t1 values(1,'aaaa','aaaa','aaaa','aaaa'),(2,'xxxc','xxxb','xxxb','xxxb'),(3,'xxxb','xxxc','xxxc','xxxc'),(4,'xxxa','xxxa','xxxa','xxxa'),(5,'zzzz','zzzz','zzzz','zzzz'),(6,NULL,NULL,'xxxa','xxxa'),(7,'zxxx','zxxx','zxxx','zxxx'),(8,'axxx','axxx','axxx','axxx'),(9,'zaaz','zaaz','zaaz','zaaz'),(10,'zbbz','zbbz','zbbz','zbbz');
UPDATE t1 SET b=CONCAT(b,'_update') WHERE b like '_xxx_' ESCAPE 'x' LIMIT 2;
SELECT * FROM t1;
a	b	c	d	e
1	aaaa	aaaa	aaaa	aaaa
2	xxxc	xxxb	xxxb	xxxb
3	xxxb	xxxc	xxxc	xxxc
4	xxxa	xxxa	xxxa	xxxa
5	zzzz	zzzz	zzzz	zzzz
6	NULL	NULL	xxxa	xxxa
7	zxxx	zxxx	zxxx	zxxx
8	axxx	axxx	axxx	axxx
9	zaaz	zaaz	zaaz	zaaz
10	zbbz	zbbz	zbbz	zbbz
replace into t1 values(1,'aaaa','aaaa','aaaa','aaaa'),(2,'xxxc','xxxb','xxxb','xxxb'),(3,'xxxb','xxxc','xxxc','xxxc'),(4,'xxxa','xxxa','xxxa','xxxa'),(5,'zzzz','zzzz','zzzz','zzzz'),(6,NULL,NULL,'xxxa','xxxa'),(7,'zxxx','zxxx','zxxx','zxxx'),(8,'axxx','axxx','axxx','axxx'),(9,'zaaz','zaaz','zaaz','zaaz'),(10,'zbbz','zbbz','zbbz','zbbz');
UPDATE t1 SET b=CONCAT(b,'_update') WHERE b like '_xxx_' ESCAPE 'a' LIMIT 2;
SELECT * FROM t1;
a	b	c	d	e
1	aaaa	aaaa	aaaa	aaaa
2	xxxc	xxxb	xxxb	xxxb
3	xxxb	xxxc	xxxc	xxxc
4	xxxa	xxxa	xxxa	xxxa
5	zzzz	zzzz	zzzz	zzzz
6	NULL	NULL	xxxa	xxxa
7	zxxx	zxxx	zxxx	zxxx
8	axxx	axxx	axxx	axxx
9	zaaz	zaaz	zaaz	zaaz
10	zbbz	zbbz	zbbz	zbbz
replace into t1 values(1,'aaaa','aaaa','aaaa','aaaa'),(2,'xxxc','xxxb','xxxb','xxxb'),(3,'xxxb','xxxc','xxxc','xxxc'),(4,'xxxa','xxxa','xxxa','xxxa'),(5,'zzzz','zzzz','zzzz','zzzz'),(6,NULL,NULL,'xxxa','xxxa'),(7,'zxxx','zxxx','zxxx','zxxx'),(8,'axxx','axxx','axxx','axxx'),(9,'zaaz','zaaz','zaaz','zaaz'),(10,'zbbz','zbbz','zbbz','zbbz');
UPDATE t1 SET b=CONCAT(b,'_update') WHERE b NOT like '_xxx_' LIMIT 2;
SELECT * FROM t1;
a	b	c	d	e
1	aaaa_update	aaaa	aaaa	aaaa
2	xxxc_update	xxxb	xxxb	xxxb
3	xxxb	xxxc	xxxc	xxxc
4	xxxa	xxxa	xxxa	xxxa
5	zzzz	zzzz	zzzz	zzzz
6	NULL	NULL	xxxa	xxxa
7	zxxx	zxxx	zxxx	zxxx
8	axxx	axxx	axxx	axxx
9	zaaz	zaaz	zaaz	zaaz
10	zbbz	zbbz	zbbz	zbbz
replace into t1 values(1,'aaaa','aaaa','aaaa','aaaa'),(2,'xxxc','xxxb','xxxb','xxxb'),(3,'xxxb','xxxc','xxxc','xxxc'),(4,'xxxa','xxxa','xxxa','xxxa'),(5,'zzzz','zzzz','zzzz','zzzz'),(6,NULL,NULL,'xxxa','xxxa'),(7,'zxxx','zxxx','zxxx','zxxx'),(8,'axxx','axxx','axxx','axxx'),(9,'zaaz','zaaz','zaaz','zaaz'),(10,'zbbz','zbbz','zbbz','zbbz');
UPDATE t1 SET b=CONCAT(b,'_update') WHERE b NOT like '_xxx_' ESCAPE 'x' LIMIT 2;
SELECT * FROM t1;
a	b	c	d	e
1	aaaa_update	aaaa	aaaa	aaaa
2	xxxc_update	xxxb	xxxb	xxxb
3	xxxb	xxxc	xxxc	xxxc
4	xxxa	xxxa	xxxa	xxxa
5	zzzz	zzzz	zzzz	zzzz
6	NULL	NULL	xxxa	xxxa
7	zxxx	zxxx	zxxx	zxxx
8	axxx	axxx	axxx	axxx
9	zaaz	zaaz	zaaz	zaaz
10	zbbz	zbbz	zbbz	zbbz
replace into t1 values(1,'aaaa','aaaa','aaaa','aaaa'),(2,'xxxc','xxxb','xxxb','xxxb'),(3,'xxxb','xxxc','xxxc','xxxc'),(4,'xxxa','xxxa','xxxa','xxxa'),(5,'zzzz','zzzz','zzzz','zzzz'),(6,NULL,NULL,'xxxa','xxxa'),(7,'zxxx','zxxx','zxxx','zxxx'),(8,'axxx','axxx','axxx','axxx'),(9,'zaaz','zaaz','zaaz','zaaz'),(10,'zbbz','zbbz','zbbz','zbbz');
UPDATE t1 SET b=CONCAT(b,'_update') WHERE b NOT like '_xxx_' ESCAPE 'a' LIMIT 2;
SELECT * FROM t1;
a	b	c	d	e
1	aaaa_update	aaaa	aaaa	aaaa
2	xxxc_update	xxxb	xxxb	xxxb
3	xxxb	xxxc	xxxc	xxxc
4	xxxa	xxxa	xxxa	xxxa
5	zzzz	zzzz	zzzz	zzzz
6	NULL	NULL	xxxa	xxxa
7	zxxx	zxxx	zxxx	zxxx
8	axxx	axxx	axxx	axxx
9	zaaz	zaaz	zaaz	zaaz
10	zbbz	zbbz	zbbz	zbbz
-- col_str1 [NOT] LIKE ‘_xxx’ [ESCAPE col_str3]
replace into t1 values(1,'aaaa','aaaa','aaaa','aaaa'),(2,'xxxc','xxxb','xxxb','xxxb'),(3,'xxxb','xxxc','xxxc','xxxc'),(4,'xxxa','xxxa','xxxa','xxxa'),(5,'zzzz','zzzz','zzzz','zzzz'),(6,NULL,NULL,'xxxa','xxxa'),(7,'zxxx','zxxx','zxxx','zxxx'),(8,'axxx','axxx','axxx','axxx'),(9,'zaaz','zaaz','zaaz','zaaz'),(10,'zbbz','zbbz','zbbz','zbbz');
UPDATE t1 SET b=CONCAT(b,'_update') WHERE b like '_xxx' LIMIT 2;
SELECT * FROM t1;
a	b	c	d	e
1	aaaa	aaaa	aaaa	aaaa
2	xxxc	xxxb	xxxb	xxxb
3	xxxb	xxxc	xxxc	xxxc
4	xxxa	xxxa	xxxa	xxxa
5	zzzz	zzzz	zzzz	zzzz
6	NULL	NULL	xxxa	xxxa
7	zxxx_update	zxxx	zxxx	zxxx
8	axxx_update	axxx	axxx	axxx
9	zaaz	zaaz	zaaz	zaaz
10	zbbz	zbbz	zbbz	zbbz
replace into t1 values(1,'aaaa','aaaa','aaaa','aaaa'),(2,'xxxc','xxxb','xxxb','xxxb'),(3,'xxxb','xxxc','xxxc','xxxc'),(4,'xxxa','xxxa','xxxa','xxxa'),(5,'zzzz','zzzz','zzzz','zzzz'),(6,NULL,NULL,'xxxa','xxxa'),(7,'zxxx','zxxx','zxxx','zxxx'),(8,'axxx','axxx','axxx','axxx'),(9,'zaaz','zaaz','zaaz','zaaz'),(10,'zbbz','zbbz','zbbz','zbbz');
UPDATE t1 SET b=CONCAT(b,'_update') WHERE b like '_xxx' ESCAPE 'x' LIMIT 2;
SELECT * FROM t1;
a	b	c	d	e
1	aaaa	aaaa	aaaa	aaaa
2	xxxc	xxxb	xxxb	xxxb
3	xxxb	xxxc	xxxc	xxxc
4	xxxa	xxxa	xxxa	xxxa
5	zzzz	zzzz	zzzz	zzzz
6	NULL	NULL	xxxa	xxxa
7	zxxx	zxxx	zxxx	zxxx
8	axxx	axxx	axxx	axxx
9	zaaz	zaaz	zaaz	zaaz
10	zbbz	zbbz	zbbz	zbbz
replace into t1 values(1,'aaaa','aaaa','aaaa','aaaa'),(2,'xxxc','xxxb','xxxb','xxxb'),(3,'xxxb','xxxc','xxxc','xxxc'),(4,'xxxa','xxxa','xxxa','xxxa'),(5,'zzzz','zzzz','zzzz','zzzz'),(6,NULL,NULL,'xxxa','xxxa'),(7,'zxxx','zxxx','zxxx','zxxx'),(8,'axxx','axxx','axxx','axxx'),(9,'zaaz','zaaz','zaaz','zaaz'),(10,'zbbz','zbbz','zbbz','zbbz');
UPDATE t1 SET b=CONCAT(b,'_update') WHERE b like '_xxx' ESCAPE 'a' LIMIT 2;
SELECT * FROM t1;
a	b	c	d	e
1	aaaa	aaaa	aaaa	aaaa
2	xxxc	xxxb	xxxb	xxxb
3	xxxb	xxxc	xxxc	xxxc
4	xxxa	xxxa	xxxa	xxxa
5	zzzz	zzzz	zzzz	zzzz
6	NULL	NULL	xxxa	xxxa
7	zxxx_update	zxxx	zxxx	zxxx
8	axxx_update	axxx	axxx	axxx
9	zaaz	zaaz	zaaz	zaaz
10	zbbz	zbbz	zbbz	zbbz
replace into t1 values(1,'aaaa','aaaa','aaaa','aaaa'),(2,'xxxc','xxxb','xxxb','xxxb'),(3,'xxxb','xxxc','xxxc','xxxc'),(4,'xxxa','xxxa','xxxa','xxxa'),(5,'zzzz','zzzz','zzzz','zzzz'),(6,NULL,NULL,'xxxa','xxxa'),(7,'zxxx','zxxx','zxxx','zxxx'),(8,'axxx','axxx','axxx','axxx'),(9,'zaaz','zaaz','zaaz','zaaz'),(10,'zbbz','zbbz','zbbz','zbbz');
UPDATE t1 SET b=CONCAT(b,'_update') WHERE b NOT like '_xxx' LIMIT 2;
SELECT * FROM t1;
a	b	c	d	e
1	aaaa_update	aaaa	aaaa	aaaa
2	xxxc_update	xxxb	xxxb	xxxb
3	xxxb	xxxc	xxxc	xxxc
4	xxxa	xxxa	xxxa	xxxa
5	zzzz	zzzz	zzzz	zzzz
6	NULL	NULL	xxxa	xxxa
7	zxxx	zxxx	zxxx	zxxx
8	axxx	axxx	axxx	axxx
9	zaaz	zaaz	zaaz	zaaz
10	zbbz	zbbz	zbbz	zbbz
replace into t1 values(1,'aaaa','aaaa','aaaa','aaaa'),(2,'xxxc','xxxb','xxxb','xxxb'),(3,'xxxb','xxxc','xxxc','xxxc'),(4,'xxxa','xxxa','xxxa','xxxa'),(5,'zzzz','zzzz','zzzz','zzzz'),(6,NULL,NULL,'xxxa','xxxa'),(7,'zxxx','zxxx','zxxx','zxxx'),(8,'axxx','axxx','axxx','axxx'),(9,'zaaz','zaaz','zaaz','zaaz'),(10,'zbbz','zbbz','zbbz','zbbz');
UPDATE t1 SET b=CONCAT(b,'_update') WHERE b NOT like '_xxx' ESCAPE 'x' LIMIT 2;
SELECT * FROM t1;
a	b	c	d	e
1	aaaa_update	aaaa	aaaa	aaaa
2	xxxc_update	xxxb	xxxb	xxxb
3	xxxb	xxxc	xxxc	xxxc
4	xxxa	xxxa	xxxa	xxxa
5	zzzz	zzzz	zzzz	zzzz
6	NULL	NULL	xxxa	xxxa
7	zxxx	zxxx	zxxx	zxxx
8	axxx	axxx	axxx	axxx
9	zaaz	zaaz	zaaz	zaaz
10	zbbz	zbbz	zbbz	zbbz
replace into t1 values(1,'aaaa','aaaa','aaaa','aaaa'),(2,'xxxc','xxxb','xxxb','xxxb'),(3,'xxxb','xxxc','xxxc','xxxc'),(4,'xxxa','xxxa','xxxa','xxxa'),(5,'zzzz','zzzz','zzzz','zzzz'),(6,NULL,NULL,'xxxa','xxxa'),(7,'zxxx','zxxx','zxxx','zxxx'),(8,'axxx','axxx','axxx','axxx'),(9,'zaaz','zaaz','zaaz','zaaz'),(10,'zbbz','zbbz','zbbz','zbbz');
UPDATE t1 SET b=CONCAT(b,'_update') WHERE b NOT like '_xxx' ESCAPE 'a' LIMIT 2;
SELECT * FROM t1;
a	b	c	d	e
1	aaaa_update	aaaa	aaaa	aaaa
2	xxxc_update	xxxb	xxxb	xxxb
3	xxxb	xxxc	xxxc	xxxc
4	xxxa	xxxa	xxxa	xxxa
5	zzzz	zzzz	zzzz	zzzz
6	NULL	NULL	xxxa	xxxa
7	zxxx	zxxx	zxxx	zxxx
8	axxx	axxx	axxx	axxx
9	zaaz	zaaz	zaaz	zaaz
10	zbbz	zbbz	zbbz	zbbz
-- col_str1 [NOT] LIKE ‘_xxx%’ [ESCAPE col_str3]
replace into t1 values(1,'aaaa','aaaa','aaaa','aaaa'),(2,'xxxc','xxxb','xxxb','xxxb'),(3,'xxxb','xxxc','xxxc','xxxc'),(4,'xxxa','xxxa','xxxa','xxxa'),(5,'zzzz','zzzz','zzzz','zzzz'),(6,NULL,NULL,'xxxa','xxxa'),(7,'zxxx','zxxx','zxxx','zxxx'),(8,'axxx','axxx','axxx','axxx'),(9,'zaaz','zaaz','zaaz','zaaz'),(10,'zbbz','zbbz','zbbz','zbbz');
UPDATE t1 SET b=CONCAT(b,'_update') WHERE b like '_xxx%' LIMIT 2;
SELECT * FROM t1;
a	b	c	d	e
1	aaaa	aaaa	aaaa	aaaa
2	xxxc	xxxb	xxxb	xxxb
3	xxxb	xxxc	xxxc	xxxc
4	xxxa	xxxa	xxxa	xxxa
5	zzzz	zzzz	zzzz	zzzz
6	NULL	NULL	xxxa	xxxa
7	zxxx_update	zxxx	zxxx	zxxx
8	axxx_update	axxx	axxx	axxx
9	zaaz	zaaz	zaaz	zaaz
10	zbbz	zbbz	zbbz	zbbz
replace into t1 values(1,'aaaa','aaaa','aaaa','aaaa'),(2,'xxxc','xxxb','xxxb','xxxb'),(3,'xxxb','xxxc','xxxc','xxxc'),(4,'xxxa','xxxa','xxxa','xxxa'),(5,'zzzz','zzzz','zzzz','zzzz'),(6,NULL,NULL,'xxxa','xxxa'),(7,'zxxx','zxxx','zxxx','zxxx'),(8,'axxx','axxx','axxx','axxx'),(9,'zaaz','zaaz','zaaz','zaaz'),(10,'zbbz','zbbz','zbbz','zbbz');
UPDATE t1 SET b=CONCAT(b,'_update') WHERE b like '_xxx%' ESCAPE 'x' LIMIT 2;
SELECT * FROM t1;
a	b	c	d	e
1	aaaa	aaaa	aaaa	aaaa
2	xxxc	xxxb	xxxb	xxxb
3	xxxb	xxxc	xxxc	xxxc
4	xxxa	xxxa	xxxa	xxxa
5	zzzz	zzzz	zzzz	zzzz
6	NULL	NULL	xxxa	xxxa
7	zxxx	zxxx	zxxx	zxxx
8	axxx	axxx	axxx	axxx
9	zaaz	zaaz	zaaz	zaaz
10	zbbz	zbbz	zbbz	zbbz
replace into t1 values(1,'aaaa','aaaa','aaaa','aaaa'),(2,'xxxc','xxxb','xxxb','xxxb'),(3,'xxxb','xxxc','xxxc','xxxc'),(4,'xxxa','xxxa','xxxa','xxxa'),(5,'zzzz','zzzz','zzzz','zzzz'),(6,NULL,NULL,'xxxa','xxxa'),(7,'zxxx','zxxx','zxxx','zxxx'),(8,'axxx','axxx','axxx','axxx'),(9,'zaaz','zaaz','zaaz','zaaz'),(10,'zbbz','zbbz','zbbz','zbbz');
UPDATE t1 SET b=CONCAT(b,'_update') WHERE b like '_xxx%' ESCAPE 'a' LIMIT 2;
SELECT * FROM t1;
a	b	c	d	e
1	aaaa	aaaa	aaaa	aaaa
2	xxxc	xxxb	xxxb	xxxb
3	xxxb	xxxc	xxxc	xxxc
4	xxxa	xxxa	xxxa	xxxa
5	zzzz	zzzz	zzzz	zzzz
6	NULL	NULL	xxxa	xxxa
7	zxxx_update	zxxx	zxxx	zxxx
8	axxx_update	axxx	axxx	axxx
9	zaaz	zaaz	zaaz	zaaz
10	zbbz	zbbz	zbbz	zbbz
replace into t1 values(1,'aaaa','aaaa','aaaa','aaaa'),(2,'xxxc','xxxb','xxxb','xxxb'),(3,'xxxb','xxxc','xxxc','xxxc'),(4,'xxxa','xxxa','xxxa','xxxa'),(5,'zzzz','zzzz','zzzz','zzzz'),(6,NULL,NULL,'xxxa','xxxa'),(7,'zxxx','zxxx','zxxx','zxxx'),(8,'axxx','axxx','axxx','axxx'),(9,'zaaz','zaaz','zaaz','zaaz'),(10,'zbbz','zbbz','zbbz','zbbz');
UPDATE t1 SET b=CONCAT(b,'_update') WHERE b NOT like '_xxx%' LIMIT 2;
SELECT * FROM t1;
a	b	c	d	e
1	aaaa_update	aaaa	aaaa	aaaa
2	xxxc_update	xxxb	xxxb	xxxb
3	xxxb	xxxc	xxxc	xxxc
4	xxxa	xxxa	xxxa	xxxa
5	zzzz	zzzz	zzzz	zzzz
6	NULL	NULL	xxxa	xxxa
7	zxxx	zxxx	zxxx	zxxx
8	axxx	axxx	axxx	axxx
9	zaaz	zaaz	zaaz	zaaz
10	zbbz	zbbz	zbbz	zbbz
replace into t1 values(1,'aaaa','aaaa','aaaa','aaaa'),(2,'xxxc','xxxb','xxxb','xxxb'),(3,'xxxb','xxxc','xxxc','xxxc'),(4,'xxxa','xxxa','xxxa','xxxa'),(5,'zzzz','zzzz','zzzz','zzzz'),(6,NULL,NULL,'xxxa','xxxa'),(7,'zxxx','zxxx','zxxx','zxxx'),(8,'axxx','axxx','axxx','axxx'),(9,'zaaz','zaaz','zaaz','zaaz'),(10,'zbbz','zbbz','zbbz','zbbz');
UPDATE t1 SET b=CONCAT(b,'_update') WHERE b NOT like '_xxx%' ESCAPE 'x' LIMIT 2;
SELECT * FROM t1;
a	b	c	d	e
1	aaaa_update	aaaa	aaaa	aaaa
2	xxxc_update	xxxb	xxxb	xxxb
3	xxxb	xxxc	xxxc	xxxc
4	xxxa	xxxa	xxxa	xxxa
5	zzzz	zzzz	zzzz	zzzz
6	NULL	NULL	xxxa	xxxa
7	zxxx	zxxx	zxxx	zxxx
8	axxx	axxx	axxx	axxx
9	zaaz	zaaz	zaaz	zaaz
10	zbbz	zbbz	zbbz	zbbz
replace into t1 values(1,'aaaa','aaaa','aaaa','aaaa'),(2,'xxxc','xxxb','xxxb','xxxb'),(3,'xxxb','xxxc','xxxc','xxxc'),(4,'xxxa','xxxa','xxxa','xxxa'),(5,'zzzz','zzzz','zzzz','zzzz'),(6,NULL,NULL,'xxxa','xxxa'),(7,'zxxx','zxxx','zxxx','zxxx'),(8,'axxx','axxx','axxx','axxx'),(9,'zaaz','zaaz','zaaz','zaaz'),(10,'zbbz','zbbz','zbbz','zbbz');
UPDATE t1 SET b=CONCAT(b,'_update') WHERE b NOT like '_xxx%' ESCAPE 'a' LIMIT 2;
SELECT * FROM t1;
a	b	c	d	e
1	aaaa_update	aaaa	aaaa	aaaa
2	xxxc_update	xxxb	xxxb	xxxb
3	xxxb	xxxc	xxxc	xxxc
4	xxxa	xxxa	xxxa	xxxa
5	zzzz	zzzz	zzzz	zzzz
6	NULL	NULL	xxxa	xxxa
7	zxxx	zxxx	zxxx	zxxx
8	axxx	axxx	axxx	axxx
9	zaaz	zaaz	zaaz	zaaz
10	zbbz	zbbz	zbbz	zbbz
-- col_str1 [NOT] LIKE ‘%xxx_’ [ESCAPE col_str3]
replace into t1 values(1,'aaaa','aaaa','aaaa','aaaa'),(2,'xxxc','xxxb','xxxb','xxxb'),(3,'xxxb','xxxc','xxxc','xxxc'),(4,'xxxa','xxxa','xxxa','xxxa'),(5,'zzzz','zzzz','zzzz','zzzz'),(6,NULL,NULL,'xxxa','xxxa'),(7,'zxxx','zxxx','zxxx','zxxx'),(8,'axxx','axxx','axxx','axxx'),(9,'zaaz','zaaz','zaaz','zaaz'),(10,'zbbz','zbbz','zbbz','zbbz');
UPDATE t1 SET b=CONCAT(b,'_update') WHERE b like '%xxx_' LIMIT 2;
SELECT * FROM t1;
a	b	c	d	e
1	aaaa	aaaa	aaaa	aaaa
2	xxxc	xxxb	xxxb	xxxb
3	xxxb_update	xxxc	xxxc	xxxc
4	xxxa_update	xxxa	xxxa	xxxa
5	zzzz	zzzz	zzzz	zzzz
6	NULL	NULL	xxxa	xxxa
7	zxxx	zxxx	zxxx	zxxx
8	axxx	axxx	axxx	axxx
9	zaaz	zaaz	zaaz	zaaz
10	zbbz	zbbz	zbbz	zbbz
replace into t1 values(1,'aaaa','aaaa','aaaa','aaaa'),(2,'xxxc','xxxb','xxxb','xxxb'),(3,'xxxb','xxxc','xxxc','xxxc'),(4,'xxxa','xxxa','xxxa','xxxa'),(5,'zzzz','zzzz','zzzz','zzzz'),(6,NULL,NULL,'xxxa','xxxa'),(7,'zxxx','zxxx','zxxx','zxxx'),(8,'axxx','axxx','axxx','axxx'),(9,'zaaz','zaaz','zaaz','zaaz'),(10,'zbbz','zbbz','zbbz','zbbz');
UPDATE t1 SET b=CONCAT(b,'_update') WHERE b like '%xxx_' ESCAPE 'x' LIMIT 2;
SELECT * FROM t1;
a	b	c	d	e
1	aaaa	aaaa	aaaa	aaaa
2	xxxc	xxxb	xxxb	xxxb
3	xxxb	xxxc	xxxc	xxxc
4	xxxa	xxxa	xxxa	xxxa
5	zzzz	zzzz	zzzz	zzzz
6	NULL	NULL	xxxa	xxxa
7	zxxx	zxxx	zxxx	zxxx
8	axxx	axxx	axxx	axxx
9	zaaz	zaaz	zaaz	zaaz
10	zbbz	zbbz	zbbz	zbbz
replace into t1 values(1,'aaaa','aaaa','aaaa','aaaa'),(2,'xxxc','xxxb','xxxb','xxxb'),(3,'xxxb','xxxc','xxxc','xxxc'),(4,'xxxa','xxxa','xxxa','xxxa'),(5,'zzzz','zzzz','zzzz','zzzz'),(6,NULL,NULL,'xxxa','xxxa'),(7,'zxxx','zxxx','zxxx','zxxx'),(8,'axxx','axxx','axxx','axxx'),(9,'zaaz','zaaz','zaaz','zaaz'),(10,'zbbz','zbbz','zbbz','zbbz');
UPDATE t1 SET b=CONCAT(b,'_update') WHERE b like '%xxx_' ESCAPE 'a' LIMIT 2;
SELECT * FROM t1;
a	b	c	d	e
1	aaaa	aaaa	aaaa	aaaa
2	xxxc	xxxb	xxxb	xxxb
3	xxxb_update	xxxc	xxxc	xxxc
4	xxxa_update	xxxa	xxxa	xxxa
5	zzzz	zzzz	zzzz	zzzz
6	NULL	NULL	xxxa	xxxa
7	zxxx	zxxx	zxxx	zxxx
8	axxx	axxx	axxx	axxx
9	zaaz	zaaz	zaaz	zaaz
10	zbbz	zbbz	zbbz	zbbz
replace into t1 values(1,'aaaa','aaaa','aaaa','aaaa'),(2,'xxxc','xxxb','xxxb','xxxb'),(3,'xxxb','xxxc','xxxc','xxxc'),(4,'xxxa','xxxa','xxxa','xxxa'),(5,'zzzz','zzzz','zzzz','zzzz'),(6,NULL,NULL,'xxxa','xxxa'),(7,'zxxx','zxxx','zxxx','zxxx'),(8,'axxx','axxx','axxx','axxx'),(9,'zaaz','zaaz','zaaz','zaaz'),(10,'zbbz','zbbz','zbbz','zbbz');
UPDATE t1 SET b=CONCAT(b,'_update') WHERE b NOT like '%xxx_' LIMIT 2;
SELECT * FROM t1;
a	b	c	d	e
1	aaaa_update	aaaa	aaaa	aaaa
2	xxxc	xxxb	xxxb	xxxb
3	xxxb	xxxc	xxxc	xxxc
4	xxxa	xxxa	xxxa	xxxa
5	zzzz_update	zzzz	zzzz	zzzz
6	NULL	NULL	xxxa	xxxa
7	zxxx	zxxx	zxxx	zxxx
8	axxx	axxx	axxx	axxx
9	zaaz	zaaz	zaaz	zaaz
10	zbbz	zbbz	zbbz	zbbz
replace into t1 values(1,'aaaa','aaaa','aaaa','aaaa'),(2,'xxxc','xxxb','xxxb','xxxb'),(3,'xxxb','xxxc','xxxc','xxxc'),(4,'xxxa','xxxa','xxxa','xxxa'),(5,'zzzz','zzzz','zzzz','zzzz'),(6,NULL,NULL,'xxxa','xxxa'),(7,'zxxx','zxxx','zxxx','zxxx'),(8,'axxx','axxx','axxx','axxx'),(9,'zaaz','zaaz','zaaz','zaaz'),(10,'zbbz','zbbz','zbbz','zbbz');
UPDATE t1 SET b=CONCAT(b,'_update') WHERE b NOT like '%xxx_' ESCAPE 'x' LIMIT 2;
SELECT * FROM t1;
a	b	c	d	e
1	aaaa_update	aaaa	aaaa	aaaa
2	xxxc_update	xxxb	xxxb	xxxb
3	xxxb	xxxc	xxxc	xxxc
4	xxxa	xxxa	xxxa	xxxa
5	zzzz	zzzz	zzzz	zzzz
6	NULL	NULL	xxxa	xxxa
7	zxxx	zxxx	zxxx	zxxx
8	axxx	axxx	axxx	axxx
9	zaaz	zaaz	zaaz	zaaz
10	zbbz	zbbz	zbbz	zbbz
replace into t1 values(1,'aaaa','aaaa','aaaa','aaaa'),(2,'xxxc','xxxb','xxxb','xxxb'),(3,'xxxb','xxxc','xxxc','xxxc'),(4,'xxxa','xxxa','xxxa','xxxa'),(5,'zzzz','zzzz','zzzz','zzzz'),(6,NULL,NULL,'xxxa','xxxa'),(7,'zxxx','zxxx','zxxx','zxxx'),(8,'axxx','axxx','axxx','axxx'),(9,'zaaz','zaaz','zaaz','zaaz'),(10,'zbbz','zbbz','zbbz','zbbz');
UPDATE t1 SET b=CONCAT(b,'_update') WHERE b NOT like '%xxx_' ESCAPE 'a' LIMIT 2;
SELECT * FROM t1;
a	b	c	d	e
1	aaaa_update	aaaa	aaaa	aaaa
2	xxxc	xxxb	xxxb	xxxb
3	xxxb	xxxc	xxxc	xxxc
4	xxxa	xxxa	xxxa	xxxa
5	zzzz_update	zzzz	zzzz	zzzz
6	NULL	NULL	xxxa	xxxa
7	zxxx	zxxx	zxxx	zxxx
8	axxx	axxx	axxx	axxx
9	zaaz	zaaz	zaaz	zaaz
10	zbbz	zbbz	zbbz	zbbz
-- col_str1 [NOT] LIKE ‘_x_x_’ [ESCAPE col_str3]
replace into t1 values(1,'aaaa','aaaa','aaaa','aaaa'),(2,'xxxc','xxxb','xxxb','xxxb'),(3,'xxxb','xxxc','xxxc','xxxc'),(4,'xxxa','xxxa','xxxa','xxxa'),(5,'zzzz','zzzz','zzzz','zzzz'),(6,NULL,NULL,'xxxa','xxxa'),(7,'zxxx','zxxx','zxxx','zxxx'),(8,'axxx','axxx','axxx','axxx'),(9,'zaaz','zaaz','zaaz','zaaz'),(10,'zbbz','zbbz','zbbz','zbbz');
UPDATE t1 SET b=CONCAT(b,'_update') WHERE b like '_x_x_' LIMIT 2;
SELECT * FROM t1;
a	b	c	d	e
1	aaaa	aaaa	aaaa	aaaa
2	xxxc	xxxb	xxxb	xxxb
3	xxxb	xxxc	xxxc	xxxc
4	xxxa	xxxa	xxxa	xxxa
5	zzzz	zzzz	zzzz	zzzz
6	NULL	NULL	xxxa	xxxa
7	zxxx	zxxx	zxxx	zxxx
8	axxx	axxx	axxx	axxx
9	zaaz	zaaz	zaaz	zaaz
10	zbbz	zbbz	zbbz	zbbz
replace into t1 values(1,'aaaa','aaaa','aaaa','aaaa'),(2,'xxxc','xxxb','xxxb','xxxb'),(3,'xxxb','xxxc','xxxc','xxxc'),(4,'xxxa','xxxa','xxxa','xxxa'),(5,'zzzz','zzzz','zzzz','zzzz'),(6,NULL,NULL,'xxxa','xxxa'),(7,'zxxx','zxxx','zxxx','zxxx'),(8,'axxx','axxx','axxx','axxx'),(9,'zaaz','zaaz','zaaz','zaaz'),(10,'zbbz','zbbz','zbbz','zbbz');
UPDATE t1 SET b=CONCAT(b,'_update') WHERE b like '_x_x_' ESCAPE 'x' LIMIT 2;
SELECT * FROM t1;
a	b	c	d	e
1	aaaa	aaaa	aaaa	aaaa
2	xxxc	xxxb	xxxb	xxxb
3	xxxb	xxxc	xxxc	xxxc
4	xxxa	xxxa	xxxa	xxxa
5	zzzz	zzzz	zzzz	zzzz
6	NULL	NULL	xxxa	xxxa
7	zxxx	zxxx	zxxx	zxxx
8	axxx	axxx	axxx	axxx
9	zaaz	zaaz	zaaz	zaaz
10	zbbz	zbbz	zbbz	zbbz
replace into t1 values(1,'aaaa','aaaa','aaaa','aaaa'),(2,'xxxc','xxxb','xxxb','xxxb'),(3,'xxxb','xxxc','xxxc','xxxc'),(4,'xxxa','xxxa','xxxa','xxxa'),(5,'zzzz','zzzz','zzzz','zzzz'),(6,NULL,NULL,'xxxa','xxxa'),(7,'zxxx','zxxx','zxxx','zxxx'),(8,'axxx','axxx','axxx','axxx'),(9,'zaaz','zaaz','zaaz','zaaz'),(10,'zbbz','zbbz','zbbz','zbbz');
UPDATE t1 SET b=CONCAT(b,'_update') WHERE b like '_x_x_' ESCAPE 'a' LIMIT 2;
SELECT * FROM t1;
a	b	c	d	e
1	aaaa	aaaa	aaaa	aaaa
2	xxxc	xxxb	xxxb	xxxb
3	xxxb	xxxc	xxxc	xxxc
4	xxxa	xxxa	xxxa	xxxa
5	zzzz	zzzz	zzzz	zzzz
6	NULL	NULL	xxxa	xxxa
7	zxxx	zxxx	zxxx	zxxx
8	axxx	axxx	axxx	axxx
9	zaaz	zaaz	zaaz	zaaz
10	zbbz	zbbz	zbbz	zbbz
replace into t1 values(1,'aaaa','aaaa','aaaa','aaaa'),(2,'xxxc','xxxb','xxxb','xxxb'),(3,'xxxb','xxxc','xxxc','xxxc'),(4,'xxxa','xxxa','xxxa','xxxa'),(5,'zzzz','zzzz','zzzz','zzzz'),(6,NULL,NULL,'xxxa','xxxa'),(7,'zxxx','zxxx','zxxx','zxxx'),(8,'axxx','axxx','axxx','axxx'),(9,'zaaz','zaaz','zaaz','zaaz'),(10,'zbbz','zbbz','zbbz','zbbz');
UPDATE t1 SET b=CONCAT(b,'_update') WHERE b NOT like '_x_x_' LIMIT 2;
SELECT * FROM t1;
a	b	c	d	e
1	aaaa_update	aaaa	aaaa	aaaa
2	xxxc_update	xxxb	xxxb	xxxb
3	xxxb	xxxc	xxxc	xxxc
4	xxxa	xxxa	xxxa	xxxa
5	zzzz	zzzz	zzzz	zzzz
6	NULL	NULL	xxxa	xxxa
7	zxxx	zxxx	zxxx	zxxx
8	axxx	axxx	axxx	axxx
9	zaaz	zaaz	zaaz	zaaz
10	zbbz	zbbz	zbbz	zbbz
replace into t1 values(1,'aaaa','aaaa','aaaa','aaaa'),(2,'xxxc','xxxb','xxxb','xxxb'),(3,'xxxb','xxxc','xxxc','xxxc'),(4,'xxxa','xxxa','xxxa','xxxa'),(5,'zzzz','zzzz','zzzz','zzzz'),(6,NULL,NULL,'xxxa','xxxa'),(7,'zxxx','zxxx','zxxx','zxxx'),(8,'axxx','axxx','axxx','axxx'),(9,'zaaz','zaaz','zaaz','zaaz'),(10,'zbbz','zbbz','zbbz','zbbz');
UPDATE t1 SET b=CONCAT(b,'_update') WHERE b NOT like '_x_x_' ESCAPE 'x' LIMIT 2;
SELECT * FROM t1;
a	b	c	d	e
1	aaaa_update	aaaa	aaaa	aaaa
2	xxxc_update	xxxb	xxxb	xxxb
3	xxxb	xxxc	xxxc	xxxc
4	xxxa	xxxa	xxxa	xxxa
5	zzzz	zzzz	zzzz	zzzz
6	NULL	NULL	xxxa	xxxa
7	zxxx	zxxx	zxxx	zxxx
8	axxx	axxx	axxx	axxx
9	zaaz	zaaz	zaaz	zaaz
10	zbbz	zbbz	zbbz	zbbz
replace into t1 values(1,'aaaa','aaaa','aaaa','aaaa'),(2,'xxxc','xxxb','xxxb','xxxb'),(3,'xxxb','xxxc','xxxc','xxxc'),(4,'xxxa','xxxa','xxxa','xxxa'),(5,'zzzz','zzzz','zzzz','zzzz'),(6,NULL,NULL,'xxxa','xxxa'),(7,'zxxx','zxxx','zxxx','zxxx'),(8,'axxx','axxx','axxx','axxx'),(9,'zaaz','zaaz','zaaz','zaaz'),(10,'zbbz','zbbz','zbbz','zbbz');
UPDATE t1 SET b=CONCAT(b,'_update') WHERE b NOT like '_x_x_' ESCAPE 'a' LIMIT 2;
SELECT * FROM t1;
a	b	c	d	e
1	aaaa_update	aaaa	aaaa	aaaa
2	xxxc_update	xxxb	xxxb	xxxb
3	xxxb	xxxc	xxxc	xxxc
4	xxxa	xxxa	xxxa	xxxa
5	zzzz	zzzz	zzzz	zzzz
6	NULL	NULL	xxxa	xxxa
7	zxxx	zxxx	zxxx	zxxx
8	axxx	axxx	axxx	axxx
9	zaaz	zaaz	zaaz	zaaz
10	zbbz	zbbz	zbbz	zbbz
-- col_str1 [NOT] LIKE ‘_x_x%’ [ESCAPE col_str3]
replace into t1 values(1,'aaaa','aaaa','aaaa','aaaa'),(2,'xxxc','xxxb','xxxb','xxxb'),(3,'xxxb','xxxc','xxxc','xxxc'),(4,'xxxa','xxxa','xxxa','xxxa'),(5,'zzzz','zzzz','zzzz','zzzz'),(6,NULL,NULL,'xxxa','xxxa'),(7,'zxxx','zxxx','zxxx','zxxx'),(8,'axxx','axxx','axxx','axxx'),(9,'zaaz','zaaz','zaaz','zaaz'),(10,'zbbz','zbbz','zbbz','zbbz');
UPDATE t1 SET b=CONCAT(b,'_update') WHERE b like '_x_x%' LIMIT 2;
SELECT * FROM t1;
a	b	c	d	e
1	aaaa	aaaa	aaaa	aaaa
2	xxxc	xxxb	xxxb	xxxb
3	xxxb	xxxc	xxxc	xxxc
4	xxxa	xxxa	xxxa	xxxa
5	zzzz	zzzz	zzzz	zzzz
6	NULL	NULL	xxxa	xxxa
7	zxxx_update	zxxx	zxxx	zxxx
8	axxx_update	axxx	axxx	axxx
9	zaaz	zaaz	zaaz	zaaz
10	zbbz	zbbz	zbbz	zbbz
replace into t1 values(1,'aaaa','aaaa','aaaa','aaaa'),(2,'xxxc','xxxb','xxxb','xxxb'),(3,'xxxb','xxxc','xxxc','xxxc'),(4,'xxxa','xxxa','xxxa','xxxa'),(5,'zzzz','zzzz','zzzz','zzzz'),(6,NULL,NULL,'xxxa','xxxa'),(7,'zxxx','zxxx','zxxx','zxxx'),(8,'axxx','axxx','axxx','axxx'),(9,'zaaz','zaaz','zaaz','zaaz'),(10,'zbbz','zbbz','zbbz','zbbz');
UPDATE t1 SET b=CONCAT(b,'_update') WHERE b like '_x_x%' ESCAPE 'x' LIMIT 2;
SELECT * FROM t1;
a	b	c	d	e
1	aaaa	aaaa	aaaa	aaaa
2	xxxc	xxxb	xxxb	xxxb
3	xxxb	xxxc	xxxc	xxxc
4	xxxa	xxxa	xxxa	xxxa
5	zzzz	zzzz	zzzz	zzzz
6	NULL	NULL	xxxa	xxxa
7	zxxx	zxxx	zxxx	zxxx
8	axxx	axxx	axxx	axxx
9	zaaz	zaaz	zaaz	zaaz
10	zbbz	zbbz	zbbz	zbbz
replace into t1 values(1,'aaaa','aaaa','aaaa','aaaa'),(2,'xxxc','xxxb','xxxb','xxxb'),(3,'xxxb','xxxc','xxxc','xxxc'),(4,'xxxa','xxxa','xxxa','xxxa'),(5,'zzzz','zzzz','zzzz','zzzz'),(6,NULL,NULL,'xxxa','xxxa'),(7,'zxxx','zxxx','zxxx','zxxx'),(8,'axxx','axxx','axxx','axxx'),(9,'zaaz','zaaz','zaaz','zaaz'),(10,'zbbz','zbbz','zbbz','zbbz');
UPDATE t1 SET b=CONCAT(b,'_update') WHERE b like '_x_x%' ESCAPE 'a' LIMIT 2;
SELECT * FROM t1;
a	b	c	d	e
1	aaaa	aaaa	aaaa	aaaa
2	xxxc	xxxb	xxxb	xxxb
3	xxxb	xxxc	xxxc	xxxc
4	xxxa	xxxa	xxxa	xxxa
5	zzzz	zzzz	zzzz	zzzz
6	NULL	NULL	xxxa	xxxa
7	zxxx_update	zxxx	zxxx	zxxx
8	axxx_update	axxx	axxx	axxx
9	zaaz	zaaz	zaaz	zaaz
10	zbbz	zbbz	zbbz	zbbz
replace into t1 values(1,'aaaa','aaaa','aaaa','aaaa'),(2,'xxxc','xxxb','xxxb','xxxb'),(3,'xxxb','xxxc','xxxc','xxxc'),(4,'xxxa','xxxa','xxxa','xxxa'),(5,'zzzz','zzzz','zzzz','zzzz'),(6,NULL,NULL,'xxxa','xxxa'),(7,'zxxx','zxxx','zxxx','zxxx'),(8,'axxx','axxx','axxx','axxx'),(9,'zaaz','zaaz','zaaz','zaaz'),(10,'zbbz','zbbz','zbbz','zbbz');
UPDATE t1 SET b=CONCAT(b,'_update') WHERE b NOT like '_x_x%' LIMIT 2;
SELECT * FROM t1;
a	b	c	d	e
1	aaaa_update	aaaa	aaaa	aaaa
2	xxxc_update	xxxb	xxxb	xxxb
3	xxxb	xxxc	xxxc	xxxc
4	xxxa	xxxa	xxxa	xxxa
5	zzzz	zzzz	zzzz	zzzz
6	NULL	NULL	xxxa	xxxa
7	zxxx	zxxx	zxxx	zxxx
8	axxx	axxx	axxx	axxx
9	zaaz	zaaz	zaaz	zaaz
10	zbbz	zbbz	zbbz	zbbz
replace into t1 values(1,'aaaa','aaaa','aaaa','aaaa'),(2,'xxxc','xxxb','xxxb','xxxb'),(3,'xxxb','xxxc','xxxc','xxxc'),(4,'xxxa','xxxa','xxxa','xxxa'),(5,'zzzz','zzzz','zzzz','zzzz'),(6,NULL,NULL,'xxxa','xxxa'),(7,'zxxx','zxxx','zxxx','zxxx'),(8,'axxx','axxx','axxx','axxx'),(9,'zaaz','zaaz','zaaz','zaaz'),(10,'zbbz','zbbz','zbbz','zbbz');
UPDATE t1 SET b=CONCAT(b,'_update') WHERE b NOT like '_x_x%' ESCAPE 'x' LIMIT 2;
SELECT * FROM t1;
a	b	c	d	e
1	aaaa_update	aaaa	aaaa	aaaa
2	xxxc_update	xxxb	xxxb	xxxb
3	xxxb	xxxc	xxxc	xxxc
4	xxxa	xxxa	xxxa	xxxa
5	zzzz	zzzz	zzzz	zzzz
6	NULL	NULL	xxxa	xxxa
7	zxxx	zxxx	zxxx	zxxx
8	axxx	axxx	axxx	axxx
9	zaaz	zaaz	zaaz	zaaz
10	zbbz	zbbz	zbbz	zbbz
replace into t1 values(1,'aaaa','aaaa','aaaa','aaaa'),(2,'xxxc','xxxb','xxxb','xxxb'),(3,'xxxb','xxxc','xxxc','xxxc'),(4,'xxxa','xxxa','xxxa','xxxa'),(5,'zzzz','zzzz','zzzz','zzzz'),(6,NULL,NULL,'xxxa','xxxa'),(7,'zxxx','zxxx','zxxx','zxxx'),(8,'axxx','axxx','axxx','axxx'),(9,'zaaz','zaaz','zaaz','zaaz'),(10,'zbbz','zbbz','zbbz','zbbz');
UPDATE t1 SET b=CONCAT(b,'_update') WHERE b NOT like '_x_x%' ESCAPE 'a' LIMIT 2;
SELECT * FROM t1;
a	b	c	d	e
1	aaaa_update	aaaa	aaaa	aaaa
2	xxxc_update	xxxb	xxxb	xxxb
3	xxxb	xxxc	xxxc	xxxc
4	xxxa	xxxa	xxxa	xxxa
5	zzzz	zzzz	zzzz	zzzz
6	NULL	NULL	xxxa	xxxa
7	zxxx	zxxx	zxxx	zxxx
8	axxx	axxx	axxx	axxx
9	zaaz	zaaz	zaaz	zaaz
10	zbbz	zbbz	zbbz	zbbz
-- col_str1 [NOT] LIKE ‘_x%x_’ [ESCAPE col_str3]
replace into t1 values(1,'aaaa','aaaa','aaaa','aaaa'),(2,'xxxc','xxxb','xxxb','xxxb'),(3,'xxxb','xxxc','xxxc','xxxc'),(4,'xxxa','xxxa','xxxa','xxxa'),(5,'zzzz','zzzz','zzzz','zzzz'),(6,NULL,NULL,'xxxa','xxxa'),(7,'zxxx','zxxx','zxxx','zxxx'),(8,'axxx','axxx','axxx','axxx'),(9,'zaaz','zaaz','zaaz','zaaz'),(10,'zbbz','zbbz','zbbz','zbbz');
UPDATE t1 SET b=CONCAT(b,'_update') WHERE b like '_x%x_' LIMIT 2;
SELECT * FROM t1;
a	b	c	d	e
1	aaaa	aaaa	aaaa	aaaa
2	xxxc	xxxb	xxxb	xxxb
3	xxxb	xxxc	xxxc	xxxc
4	xxxa_update	xxxa	xxxa	xxxa
5	zzzz	zzzz	zzzz	zzzz
6	NULL	NULL	xxxa	xxxa
7	zxxx	zxxx	zxxx	zxxx
8	axxx_update	axxx	axxx	axxx
9	zaaz	zaaz	zaaz	zaaz
10	zbbz	zbbz	zbbz	zbbz
replace into t1 values(1,'aaaa','aaaa','aaaa','aaaa'),(2,'xxxc','xxxb','xxxb','xxxb'),(3,'xxxb','xxxc','xxxc','xxxc'),(4,'xxxa','xxxa','xxxa','xxxa'),(5,'zzzz','zzzz','zzzz','zzzz'),(6,NULL,NULL,'xxxa','xxxa'),(7,'zxxx','zxxx','zxxx','zxxx'),(8,'axxx','axxx','axxx','axxx'),(9,'zaaz','zaaz','zaaz','zaaz'),(10,'zbbz','zbbz','zbbz','zbbz');
UPDATE t1 SET b=CONCAT(b,'_update') WHERE b like '_x%x_' ESCAPE 'x' LIMIT 2;
SELECT * FROM t1;
a	b	c	d	e
1	aaaa	aaaa	aaaa	aaaa
2	xxxc	xxxb	xxxb	xxxb
3	xxxb	xxxc	xxxc	xxxc
4	xxxa	xxxa	xxxa	xxxa
5	zzzz	zzzz	zzzz	zzzz
6	NULL	NULL	xxxa	xxxa
7	zxxx	zxxx	zxxx	zxxx
8	axxx	axxx	axxx	axxx
9	zaaz	zaaz	zaaz	zaaz
10	zbbz	zbbz	zbbz	zbbz
replace into t1 values(1,'aaaa','aaaa','aaaa','aaaa'),(2,'xxxc','xxxb','xxxb','xxxb'),(3,'xxxb','xxxc','xxxc','xxxc'),(4,'xxxa','xxxa','xxxa','xxxa'),(5,'zzzz','zzzz','zzzz','zzzz'),(6,NULL,NULL,'xxxa','xxxa'),(7,'zxxx','zxxx','zxxx','zxxx'),(8,'axxx','axxx','axxx','axxx'),(9,'zaaz','zaaz','zaaz','zaaz'),(10,'zbbz','zbbz','zbbz','zbbz');
UPDATE t1 SET b=CONCAT(b,'_update') WHERE b like '_x%x_' ESCAPE 'a' LIMIT 2;
SELECT * FROM t1;
a	b	c	d	e
1	aaaa	aaaa	aaaa	aaaa
2	xxxc	xxxb	xxxb	xxxb
3	xxxb	xxxc	xxxc	xxxc
4	xxxa_update	xxxa	xxxa	xxxa
5	zzzz	zzzz	zzzz	zzzz
6	NULL	NULL	xxxa	xxxa
7	zxxx	zxxx	zxxx	zxxx
8	axxx_update	axxx	axxx	axxx
9	zaaz	zaaz	zaaz	zaaz
10	zbbz	zbbz	zbbz	zbbz
replace into t1 values(1,'aaaa','aaaa','aaaa','aaaa'),(2,'xxxc','xxxb','xxxb','xxxb'),(3,'xxxb','xxxc','xxxc','xxxc'),(4,'xxxa','xxxa','xxxa','xxxa'),(5,'zzzz','zzzz','zzzz','zzzz'),(6,NULL,NULL,'xxxa','xxxa'),(7,'zxxx','zxxx','zxxx','zxxx'),(8,'axxx','axxx','axxx','axxx'),(9,'zaaz','zaaz','zaaz','zaaz'),(10,'zbbz','zbbz','zbbz','zbbz');
UPDATE t1 SET b=CONCAT(b,'_update') WHERE b NOT like '_x%x_' LIMIT 2;
SELECT * FROM t1;
a	b	c	d	e
1	aaaa_update	aaaa	aaaa	aaaa
2	xxxc	xxxb	xxxb	xxxb
3	xxxb	xxxc	xxxc	xxxc
4	xxxa	xxxa	xxxa	xxxa
5	zzzz_update	zzzz	zzzz	zzzz
6	NULL	NULL	xxxa	xxxa
7	zxxx	zxxx	zxxx	zxxx
8	axxx	axxx	axxx	axxx
9	zaaz	zaaz	zaaz	zaaz
10	zbbz	zbbz	zbbz	zbbz
replace into t1 values(1,'aaaa','aaaa','aaaa','aaaa'),(2,'xxxc','xxxb','xxxb','xxxb'),(3,'xxxb','xxxc','xxxc','xxxc'),(4,'xxxa','xxxa','xxxa','xxxa'),(5,'zzzz','zzzz','zzzz','zzzz'),(6,NULL,NULL,'xxxa','xxxa'),(7,'zxxx','zxxx','zxxx','zxxx'),(8,'axxx','axxx','axxx','axxx'),(9,'zaaz','zaaz','zaaz','zaaz'),(10,'zbbz','zbbz','zbbz','zbbz');
UPDATE t1 SET b=CONCAT(b,'_update') WHERE b NOT like '_x%x_' ESCAPE 'x' LIMIT 2;
SELECT * FROM t1;
a	b	c	d	e
1	aaaa_update	aaaa	aaaa	aaaa
2	xxxc_update	xxxb	xxxb	xxxb
3	xxxb	xxxc	xxxc	xxxc
4	xxxa	xxxa	xxxa	xxxa
5	zzzz	zzzz	zzzz	zzzz
6	NULL	NULL	xxxa	xxxa
7	zxxx	zxxx	zxxx	zxxx
8	axxx	axxx	axxx	axxx
9	zaaz	zaaz	zaaz	zaaz
10	zbbz	zbbz	zbbz	zbbz
replace into t1 values(1,'aaaa','aaaa','aaaa','aaaa'),(2,'xxxc','xxxb','xxxb','xxxb'),(3,'xxxb','xxxc','xxxc','xxxc'),(4,'xxxa','xxxa','xxxa','xxxa'),(5,'zzzz','zzzz','zzzz','zzzz'),(6,NULL,NULL,'xxxa','xxxa'),(7,'zxxx','zxxx','zxxx','zxxx'),(8,'axxx','axxx','axxx','axxx'),(9,'zaaz','zaaz','zaaz','zaaz'),(10,'zbbz','zbbz','zbbz','zbbz');
UPDATE t1 SET b=CONCAT(b,'_update') WHERE b NOT like '_x%x_' ESCAPE 'a' LIMIT 2;
SELECT * FROM t1;
a	b	c	d	e
1	aaaa_update	aaaa	aaaa	aaaa
2	xxxc	xxxb	xxxb	xxxb
3	xxxb	xxxc	xxxc	xxxc
4	xxxa	xxxa	xxxa	xxxa
5	zzzz_update	zzzz	zzzz	zzzz
6	NULL	NULL	xxxa	xxxa
7	zxxx	zxxx	zxxx	zxxx
8	axxx	axxx	axxx	axxx
9	zaaz	zaaz	zaaz	zaaz
10	zbbz	zbbz	zbbz	zbbz
-- col_str1 [NOT] LIKE ‘_x%x%’ [ESCAPE col_str3]
replace into t1 values(1,'aaaa','aaaa','aaaa','aaaa'),(2,'xxxc','xxxb','xxxb','xxxb'),(3,'xxxb','xxxc','xxxc','xxxc'),(4,'xxxa','xxxa','xxxa','xxxa'),(5,'zzzz','zzzz','zzzz','zzzz'),(6,NULL,NULL,'xxxa','xxxa'),(7,'zxxx','zxxx','zxxx','zxxx'),(8,'axxx','axxx','axxx','axxx'),(9,'zaaz','zaaz','zaaz','zaaz'),(10,'zbbz','zbbz','zbbz','zbbz');
UPDATE t1 SET b=CONCAT(b,'_update') WHERE b like '_x%x%' LIMIT 2;
SELECT * FROM t1;
a	b	c	d	e
1	aaaa	aaaa	aaaa	aaaa
2	xxxc	xxxb	xxxb	xxxb
3	xxxb	xxxc	xxxc	xxxc
4	xxxa_update	xxxa	xxxa	xxxa
5	zzzz	zzzz	zzzz	zzzz
6	NULL	NULL	xxxa	xxxa
7	zxxx	zxxx	zxxx	zxxx
8	axxx_update	axxx	axxx	axxx
9	zaaz	zaaz	zaaz	zaaz
10	zbbz	zbbz	zbbz	zbbz
replace into t1 values(1,'aaaa','aaaa','aaaa','aaaa'),(2,'xxxc','xxxb','xxxb','xxxb'),(3,'xxxb','xxxc','xxxc','xxxc'),(4,'xxxa','xxxa','xxxa','xxxa'),(5,'zzzz','zzzz','zzzz','zzzz'),(6,NULL,NULL,'xxxa','xxxa'),(7,'zxxx','zxxx','zxxx','zxxx'),(8,'axxx','axxx','axxx','axxx'),(9,'zaaz','zaaz','zaaz','zaaz'),(10,'zbbz','zbbz','zbbz','zbbz');
UPDATE t1 SET b=CONCAT(b,'_update') WHERE b like '_x%x%' ESCAPE 'x' LIMIT 2;
SELECT * FROM t1;
a	b	c	d	e
1	aaaa	aaaa	aaaa	aaaa
2	xxxc	xxxb	xxxb	xxxb
3	xxxb	xxxc	xxxc	xxxc
4	xxxa	xxxa	xxxa	xxxa
5	zzzz	zzzz	zzzz	zzzz
6	NULL	NULL	xxxa	xxxa
7	zxxx	zxxx	zxxx	zxxx
8	axxx	axxx	axxx	axxx
9	zaaz	zaaz	zaaz	zaaz
10	zbbz	zbbz	zbbz	zbbz
replace into t1 values(1,'aaaa','aaaa','aaaa','aaaa'),(2,'xxxc','xxxb','xxxb','xxxb'),(3,'xxxb','xxxc','xxxc','xxxc'),(4,'xxxa','xxxa','xxxa','xxxa'),(5,'zzzz','zzzz','zzzz','zzzz'),(6,NULL,NULL,'xxxa','xxxa'),(7,'zxxx','zxxx','zxxx','zxxx'),(8,'axxx','axxx','axxx','axxx'),(9,'zaaz','zaaz','zaaz','zaaz'),(10,'zbbz','zbbz','zbbz','zbbz');
UPDATE t1 SET b=CONCAT(b,'_update') WHERE b like '_x%x%' ESCAPE 'a' LIMIT 2;
SELECT * FROM t1;
a	b	c	d	e
1	aaaa	aaaa	aaaa	aaaa
2	xxxc	xxxb	xxxb	xxxb
3	xxxb	xxxc	xxxc	xxxc
4	xxxa_update	xxxa	xxxa	xxxa
5	zzzz	zzzz	zzzz	zzzz
6	NULL	NULL	xxxa	xxxa
7	zxxx	zxxx	zxxx	zxxx
8	axxx_update	axxx	axxx	axxx
9	zaaz	zaaz	zaaz	zaaz
10	zbbz	zbbz	zbbz	zbbz
replace into t1 values(1,'aaaa','aaaa','aaaa','aaaa'),(2,'xxxc','xxxb','xxxb','xxxb'),(3,'xxxb','xxxc','xxxc','xxxc'),(4,'xxxa','xxxa','xxxa','xxxa'),(5,'zzzz','zzzz','zzzz','zzzz'),(6,NULL,NULL,'xxxa','xxxa'),(7,'zxxx','zxxx','zxxx','zxxx'),(8,'axxx','axxx','axxx','axxx'),(9,'zaaz','zaaz','zaaz','zaaz'),(10,'zbbz','zbbz','zbbz','zbbz');
UPDATE t1 SET b=CONCAT(b,'_update') WHERE b NOT like '_x%x%' LIMIT 2;
SELECT * FROM t1;
a	b	c	d	e
1	aaaa_update	aaaa	aaaa	aaaa
2	xxxc	xxxb	xxxb	xxxb
3	xxxb	xxxc	xxxc	xxxc
4	xxxa	xxxa	xxxa	xxxa
5	zzzz_update	zzzz	zzzz	zzzz
6	NULL	NULL	xxxa	xxxa
7	zxxx	zxxx	zxxx	zxxx
8	axxx	axxx	axxx	axxx
9	zaaz	zaaz	zaaz	zaaz
10	zbbz	zbbz	zbbz	zbbz
replace into t1 values(1,'aaaa','aaaa','aaaa','aaaa'),(2,'xxxc','xxxb','xxxb','xxxb'),(3,'xxxb','xxxc','xxxc','xxxc'),(4,'xxxa','xxxa','xxxa','xxxa'),(5,'zzzz','zzzz','zzzz','zzzz'),(6,NULL,NULL,'xxxa','xxxa'),(7,'zxxx','zxxx','zxxx','zxxx'),(8,'axxx','axxx','axxx','axxx'),(9,'zaaz','zaaz','zaaz','zaaz'),(10,'zbbz','zbbz','zbbz','zbbz');
UPDATE t1 SET b=CONCAT(b,'_update') WHERE b NOT like '_x%x%' ESCAPE 'x' LIMIT 2;
SELECT * FROM t1;
a	b	c	d	e
1	aaaa_update	aaaa	aaaa	aaaa
2	xxxc_update	xxxb	xxxb	xxxb
3	xxxb	xxxc	xxxc	xxxc
4	xxxa	xxxa	xxxa	xxxa
5	zzzz	zzzz	zzzz	zzzz
6	NULL	NULL	xxxa	xxxa
7	zxxx	zxxx	zxxx	zxxx
8	axxx	axxx	axxx	axxx
9	zaaz	zaaz	zaaz	zaaz
10	zbbz	zbbz	zbbz	zbbz
replace into t1 values(1,'aaaa','aaaa','aaaa','aaaa'),(2,'xxxc','xxxb','xxxb','xxxb'),(3,'xxxb','xxxc','xxxc','xxxc'),(4,'xxxa','xxxa','xxxa','xxxa'),(5,'zzzz','zzzz','zzzz','zzzz'),(6,NULL,NULL,'xxxa','xxxa'),(7,'zxxx','zxxx','zxxx','zxxx'),(8,'axxx','axxx','axxx','axxx'),(9,'zaaz','zaaz','zaaz','zaaz'),(10,'zbbz','zbbz','zbbz','zbbz');
UPDATE t1 SET b=CONCAT(b,'_update') WHERE b NOT like '_x%x%' ESCAPE 'a' LIMIT 2;
SELECT * FROM t1;
a	b	c	d	e
1	aaaa_update	aaaa	aaaa	aaaa
2	xxxc	xxxb	xxxb	xxxb
3	xxxb	xxxc	xxxc	xxxc
4	xxxa	xxxa	xxxa	xxxa
5	zzzz_update	zzzz	zzzz	zzzz
6	NULL	NULL	xxxa	xxxa
7	zxxx	zxxx	zxxx	zxxx
8	axxx	axxx	axxx	axxx
9	zaaz	zaaz	zaaz	zaaz
10	zbbz	zbbz	zbbz	zbbz
-- col_str1 [NOT] LIKE ‘%x_x_’ [ESCAPE col_str3]
replace into t1 values(1,'aaaa','aaaa','aaaa','aaaa'),(2,'xxxc','xxxb','xxxb','xxxb'),(3,'xxxb','xxxc','xxxc','xxxc'),(4,'xxxa','xxxa','xxxa','xxxa'),(5,'zzzz','zzzz','zzzz','zzzz'),(6,NULL,NULL,'xxxa','xxxa'),(7,'zxxx','zxxx','zxxx','zxxx'),(8,'axxx','axxx','axxx','axxx'),(9,'zaaz','zaaz','zaaz','zaaz'),(10,'zbbz','zbbz','zbbz','zbbz');
UPDATE t1 SET b=CONCAT(b,'_update') WHERE b like '%x_x_' LIMIT 2;
SELECT * FROM t1;
a	b	c	d	e
1	aaaa	aaaa	aaaa	aaaa
2	xxxc	xxxb	xxxb	xxxb
3	xxxb_update	xxxc	xxxc	xxxc
4	xxxa_update	xxxa	xxxa	xxxa
5	zzzz	zzzz	zzzz	zzzz
6	NULL	NULL	xxxa	xxxa
7	zxxx	zxxx	zxxx	zxxx
8	axxx	axxx	axxx	axxx
9	zaaz	zaaz	zaaz	zaaz
10	zbbz	zbbz	zbbz	zbbz
replace into t1 values(1,'aaaa','aaaa','aaaa','aaaa'),(2,'xxxc','xxxb','xxxb','xxxb'),(3,'xxxb','xxxc','xxxc','xxxc'),(4,'xxxa','xxxa','xxxa','xxxa'),(5,'zzzz','zzzz','zzzz','zzzz'),(6,NULL,NULL,'xxxa','xxxa'),(7,'zxxx','zxxx','zxxx','zxxx'),(8,'axxx','axxx','axxx','axxx'),(9,'zaaz','zaaz','zaaz','zaaz'),(10,'zbbz','zbbz','zbbz','zbbz');
UPDATE t1 SET b=CONCAT(b,'_update') WHERE b like '%x_x_' ESCAPE 'x' LIMIT 2;
SELECT * FROM t1;
a	b	c	d	e
1	aaaa	aaaa	aaaa	aaaa
2	xxxc	xxxb	xxxb	xxxb
3	xxxb	xxxc	xxxc	xxxc
4	xxxa	xxxa	xxxa	xxxa
5	zzzz	zzzz	zzzz	zzzz
6	NULL	NULL	xxxa	xxxa
7	zxxx	zxxx	zxxx	zxxx
8	axxx	axxx	axxx	axxx
9	zaaz	zaaz	zaaz	zaaz
10	zbbz	zbbz	zbbz	zbbz
replace into t1 values(1,'aaaa','aaaa','aaaa','aaaa'),(2,'xxxc','xxxb','xxxb','xxxb'),(3,'xxxb','xxxc','xxxc','xxxc'),(4,'xxxa','xxxa','xxxa','xxxa'),(5,'zzzz','zzzz','zzzz','zzzz'),(6,NULL,NULL,'xxxa','xxxa'),(7,'zxxx','zxxx','zxxx','zxxx'),(8,'axxx','axxx','axxx','axxx'),(9,'zaaz','zaaz','zaaz','zaaz'),(10,'zbbz','zbbz','zbbz','zbbz');
UPDATE t1 SET b=CONCAT(b,'_update') WHERE b like '%x_x_' ESCAPE 'a' LIMIT 2;
SELECT * FROM t1;
a	b	c	d	e
1	aaaa	aaaa	aaaa	aaaa
2	xxxc	xxxb	xxxb	xxxb
3	xxxb_update	xxxc	xxxc	xxxc
4	xxxa_update	xxxa	xxxa	xxxa
5	zzzz	zzzz	zzzz	zzzz
6	NULL	NULL	xxxa	xxxa
7	zxxx	zxxx	zxxx	zxxx
8	axxx	axxx	axxx	axxx
9	zaaz	zaaz	zaaz	zaaz
10	zbbz	zbbz	zbbz	zbbz
replace into t1 values(1,'aaaa','aaaa','aaaa','aaaa'),(2,'xxxc','xxxb','xxxb','xxxb'),(3,'xxxb','xxxc','xxxc','xxxc'),(4,'xxxa','xxxa','xxxa','xxxa'),(5,'zzzz','zzzz','zzzz','zzzz'),(6,NULL,NULL,'xxxa','xxxa'),(7,'zxxx','zxxx','zxxx','zxxx'),(8,'axxx','axxx','axxx','axxx'),(9,'zaaz','zaaz','zaaz','zaaz'),(10,'zbbz','zbbz','zbbz','zbbz');
UPDATE t1 SET b=CONCAT(b,'_update') WHERE b NOT like '%x_x_' LIMIT 2;
SELECT * FROM t1;
a	b	c	d	e
1	aaaa_update	aaaa	aaaa	aaaa
2	xxxc	xxxb	xxxb	xxxb
3	xxxb	xxxc	xxxc	xxxc
4	xxxa	xxxa	xxxa	xxxa
5	zzzz_update	zzzz	zzzz	zzzz
6	NULL	NULL	xxxa	xxxa
7	zxxx	zxxx	zxxx	zxxx
8	axxx	axxx	axxx	axxx
9	zaaz	zaaz	zaaz	zaaz
10	zbbz	zbbz	zbbz	zbbz
replace into t1 values(1,'aaaa','aaaa','aaaa','aaaa'),(2,'xxxc','xxxb','xxxb','xxxb'),(3,'xxxb','xxxc','xxxc','xxxc'),(4,'xxxa','xxxa','xxxa','xxxa'),(5,'zzzz','zzzz','zzzz','zzzz'),(6,NULL,NULL,'xxxa','xxxa'),(7,'zxxx','zxxx','zxxx','zxxx'),(8,'axxx','axxx','axxx','axxx'),(9,'zaaz','zaaz','zaaz','zaaz'),(10,'zbbz','zbbz','zbbz','zbbz');
UPDATE t1 SET b=CONCAT(b,'_update') WHERE b NOT like '%x_x_' ESCAPE 'x' LIMIT 2;
SELECT * FROM t1;
a	b	c	d	e
1	aaaa_update	aaaa	aaaa	aaaa
2	xxxc_update	xxxb	xxxb	xxxb
3	xxxb	xxxc	xxxc	xxxc
4	xxxa	xxxa	xxxa	xxxa
5	zzzz	zzzz	zzzz	zzzz
6	NULL	NULL	xxxa	xxxa
7	zxxx	zxxx	zxxx	zxxx
8	axxx	axxx	axxx	axxx
9	zaaz	zaaz	zaaz	zaaz
10	zbbz	zbbz	zbbz	zbbz
replace into t1 values(1,'aaaa','aaaa','aaaa','aaaa'),(2,'xxxc','xxxb','xxxb','xxxb'),(3,'xxxb','xxxc','xxxc','xxxc'),(4,'xxxa','xxxa','xxxa','xxxa'),(5,'zzzz','zzzz','zzzz','zzzz'),(6,NULL,NULL,'xxxa','xxxa'),(7,'zxxx','zxxx','zxxx','zxxx'),(8,'axxx','axxx','axxx','axxx'),(9,'zaaz','zaaz','zaaz','zaaz'),(10,'zbbz','zbbz','zbbz','zbbz');
UPDATE t1 SET b=CONCAT(b,'_update') WHERE b NOT like '%x_x_' ESCAPE 'a' LIMIT 2;
SELECT * FROM t1;
a	b	c	d	e
1	aaaa_update	aaaa	aaaa	aaaa
2	xxxc	xxxb	xxxb	xxxb
3	xxxb	xxxc	xxxc	xxxc
4	xxxa	xxxa	xxxa	xxxa
5	zzzz_update	zzzz	zzzz	zzzz
6	NULL	NULL	xxxa	xxxa
7	zxxx	zxxx	zxxx	zxxx
8	axxx	axxx	axxx	axxx
9	zaaz	zaaz	zaaz	zaaz
10	zbbz	zbbz	zbbz	zbbz
-- col_str1 [NOT] LIKE ‘%x_x%’ [ESCAPE col_str3]
replace into t1 values(1,'aaaa','aaaa','aaaa','aaaa'),(2,'xxxc','xxxb','xxxb','xxxb'),(3,'xxxb','xxxc','xxxc','xxxc'),(4,'xxxa','xxxa','xxxa','xxxa'),(5,'zzzz','zzzz','zzzz','zzzz'),(6,NULL,NULL,'xxxa','xxxa'),(7,'zxxx','zxxx','zxxx','zxxx'),(8,'axxx','axxx','axxx','axxx'),(9,'zaaz','zaaz','zaaz','zaaz'),(10,'zbbz','zbbz','zbbz','zbbz');
UPDATE t1 SET b=CONCAT(b,'_update') WHERE b like '%x_x%' LIMIT 2;
SELECT * FROM t1;
a	b	c	d	e
1	aaaa	aaaa	aaaa	aaaa
2	xxxc	xxxb	xxxb	xxxb
3	xxxb	xxxc	xxxc	xxxc
4	xxxa_update	xxxa	xxxa	xxxa
5	zzzz	zzzz	zzzz	zzzz
6	NULL	NULL	xxxa	xxxa
7	zxxx	zxxx	zxxx	zxxx
8	axxx_update	axxx	axxx	axxx
9	zaaz	zaaz	zaaz	zaaz
10	zbbz	zbbz	zbbz	zbbz
replace into t1 values(1,'aaaa','aaaa','aaaa','aaaa'),(2,'xxxc','xxxb','xxxb','xxxb'),(3,'xxxb','xxxc','xxxc','xxxc'),(4,'xxxa','xxxa','xxxa','xxxa'),(5,'zzzz','zzzz','zzzz','zzzz'),(6,NULL,NULL,'xxxa','xxxa'),(7,'zxxx','zxxx','zxxx','zxxx'),(8,'axxx','axxx','axxx','axxx'),(9,'zaaz','zaaz','zaaz','zaaz'),(10,'zbbz','zbbz','zbbz','zbbz');
UPDATE t1 SET b=CONCAT(b,'_update') WHERE b like '%x_x%' ESCAPE 'x' LIMIT 2;
SELECT * FROM t1;
a	b	c	d	e
1	aaaa	aaaa	aaaa	aaaa
2	xxxc	xxxb	xxxb	xxxb
3	xxxb	xxxc	xxxc	xxxc
4	xxxa	xxxa	xxxa	xxxa
5	zzzz	zzzz	zzzz	zzzz
6	NULL	NULL	xxxa	xxxa
7	zxxx	zxxx	zxxx	zxxx
8	axxx	axxx	axxx	axxx
9	zaaz	zaaz	zaaz	zaaz
10	zbbz	zbbz	zbbz	zbbz
replace into t1 values(1,'aaaa','aaaa','aaaa','aaaa'),(2,'xxxc','xxxb','xxxb','xxxb'),(3,'xxxb','xxxc','xxxc','xxxc'),(4,'xxxa','xxxa','xxxa','xxxa'),(5,'zzzz','zzzz','zzzz','zzzz'),(6,NULL,NULL,'xxxa','xxxa'),(7,'zxxx','zxxx','zxxx','zxxx'),(8,'axxx','axxx','axxx','axxx'),(9,'zaaz','zaaz','zaaz','zaaz'),(10,'zbbz','zbbz','zbbz','zbbz');
UPDATE t1 SET b=CONCAT(b,'_update') WHERE b like '%x_x%' ESCAPE 'a' LIMIT 2;
SELECT * FROM t1;
a	b	c	d	e
1	aaaa	aaaa	aaaa	aaaa
2	xxxc	xxxb	xxxb	xxxb
3	xxxb	xxxc	xxxc	xxxc
4	xxxa_update	xxxa	xxxa	xxxa
5	zzzz	zzzz	zzzz	zzzz
6	NULL	NULL	xxxa	xxxa
7	zxxx	zxxx	zxxx	zxxx
8	axxx_update	axxx	axxx	axxx
9	zaaz	zaaz	zaaz	zaaz
10	zbbz	zbbz	zbbz	zbbz
replace into t1 values(1,'aaaa','aaaa','aaaa','aaaa'),(2,'xxxc','xxxb','xxxb','xxxb'),(3,'xxxb','xxxc','xxxc','xxxc'),(4,'xxxa','xxxa','xxxa','xxxa'),(5,'zzzz','zzzz','zzzz','zzzz'),(6,NULL,NULL,'xxxa','xxxa'),(7,'zxxx','zxxx','zxxx','zxxx'),(8,'axxx','axxx','axxx','axxx'),(9,'zaaz','zaaz','zaaz','zaaz'),(10,'zbbz','zbbz','zbbz','zbbz');
UPDATE t1 SET b=CONCAT(b,'_update') WHERE b NOT like '%x_x%' LIMIT 2;
SELECT * FROM t1;
a	b	c	d	e
1	aaaa_update	aaaa	aaaa	aaaa
2	xxxc	xxxb	xxxb	xxxb
3	xxxb	xxxc	xxxc	xxxc
4	xxxa	xxxa	xxxa	xxxa
5	zzzz_update	zzzz	zzzz	zzzz
6	NULL	NULL	xxxa	xxxa
7	zxxx	zxxx	zxxx	zxxx
8	axxx	axxx	axxx	axxx
9	zaaz	zaaz	zaaz	zaaz
10	zbbz	zbbz	zbbz	zbbz
replace into t1 values(1,'aaaa','aaaa','aaaa','aaaa'),(2,'xxxc','xxxb','xxxb','xxxb'),(3,'xxxb','xxxc','xxxc','xxxc'),(4,'xxxa','xxxa','xxxa','xxxa'),(5,'zzzz','zzzz','zzzz','zzzz'),(6,NULL,NULL,'xxxa','xxxa'),(7,'zxxx','zxxx','zxxx','zxxx'),(8,'axxx','axxx','axxx','axxx'),(9,'zaaz','zaaz','zaaz','zaaz'),(10,'zbbz','zbbz','zbbz','zbbz');
UPDATE t1 SET b=CONCAT(b,'_update') WHERE b NOT like '%x_x%' ESCAPE 'x' LIMIT 2;
SELECT * FROM t1;
a	b	c	d	e
1	aaaa_update	aaaa	aaaa	aaaa
2	xxxc_update	xxxb	xxxb	xxxb
3	xxxb	xxxc	xxxc	xxxc
4	xxxa	xxxa	xxxa	xxxa
5	zzzz	zzzz	zzzz	zzzz
6	NULL	NULL	xxxa	xxxa
7	zxxx	zxxx	zxxx	zxxx
8	axxx	axxx	axxx	axxx
9	zaaz	zaaz	zaaz	zaaz
10	zbbz	zbbz	zbbz	zbbz
replace into t1 values(1,'aaaa','aaaa','aaaa','aaaa'),(2,'xxxc','xxxb','xxxb','xxxb'),(3,'xxxb','xxxc','xxxc','xxxc'),(4,'xxxa','xxxa','xxxa','xxxa'),(5,'zzzz','zzzz','zzzz','zzzz'),(6,NULL,NULL,'xxxa','xxxa'),(7,'zxxx','zxxx','zxxx','zxxx'),(8,'axxx','axxx','axxx','axxx'),(9,'zaaz','zaaz','zaaz','zaaz'),(10,'zbbz','zbbz','zbbz','zbbz');
UPDATE t1 SET b=CONCAT(b,'_update') WHERE b NOT like '%x_x%' ESCAPE 'a' LIMIT 2;
SELECT * FROM t1;
a	b	c	d	e
1	aaaa_update	aaaa	aaaa	aaaa
2	xxxc	xxxb	xxxb	xxxb
3	xxxb	xxxc	xxxc	xxxc
4	xxxa	xxxa	xxxa	xxxa
5	zzzz_update	zzzz	zzzz	zzzz
6	NULL	NULL	xxxa	xxxa
7	zxxx	zxxx	zxxx	zxxx
8	axxx	axxx	axxx	axxx
9	zaaz	zaaz	zaaz	zaaz
10	zbbz	zbbz	zbbz	zbbz
-- col_str1 [NOT] LIKE ‘%x%x_’ [ESCAPE col_str3]
replace into t1 values(1,'aaaa','aaaa','aaaa','aaaa'),(2,'xxxc','xxxb','xxxb','xxxb'),(3,'xxxb','xxxc','xxxc','xxxc'),(4,'xxxa','xxxa','xxxa','xxxa'),(5,'zzzz','zzzz','zzzz','zzzz'),(6,NULL,NULL,'xxxa','xxxa'),(7,'zxxx','zxxx','zxxx','zxxx'),(8,'axxx','axxx','axxx','axxx'),(9,'zaaz','zaaz','zaaz','zaaz'),(10,'zbbz','zbbz','zbbz','zbbz');
UPDATE t1 SET b=CONCAT(b,'_update') WHERE b like '%x%x_' LIMIT 2;
SELECT * FROM t1;
a	b	c	d	e
1	aaaa	aaaa	aaaa	aaaa
2	xxxc	xxxb	xxxb	xxxb
3	xxxb	xxxc	xxxc	xxxc
4	xxxa_update	xxxa	xxxa	xxxa
5	zzzz	zzzz	zzzz	zzzz
6	NULL	NULL	xxxa	xxxa
7	zxxx	zxxx	zxxx	zxxx
8	axxx_update	axxx	axxx	axxx
9	zaaz	zaaz	zaaz	zaaz
10	zbbz	zbbz	zbbz	zbbz
replace into t1 values(1,'aaaa','aaaa','aaaa','aaaa'),(2,'xxxc','xxxb','xxxb','xxxb'),(3,'xxxb','xxxc','xxxc','xxxc'),(4,'xxxa','xxxa','xxxa','xxxa'),(5,'zzzz','zzzz','zzzz','zzzz'),(6,NULL,NULL,'xxxa','xxxa'),(7,'zxxx','zxxx','zxxx','zxxx'),(8,'axxx','axxx','axxx','axxx'),(9,'zaaz','zaaz','zaaz','zaaz'),(10,'zbbz','zbbz','zbbz','zbbz');
UPDATE t1 SET b=CONCAT(b,'_update') WHERE b like '%x%x_' ESCAPE 'x' LIMIT 2;
SELECT * FROM t1;
a	b	c	d	e
1	aaaa	aaaa	aaaa	aaaa
2	xxxc	xxxb	xxxb	xxxb
3	xxxb	xxxc	xxxc	xxxc
4	xxxa	xxxa	xxxa	xxxa
5	zzzz	zzzz	zzzz	zzzz
6	NULL	NULL	xxxa	xxxa
7	zxxx	zxxx	zxxx	zxxx
8	axxx	axxx	axxx	axxx
9	zaaz	zaaz	zaaz	zaaz
10	zbbz	zbbz	zbbz	zbbz
replace into t1 values(1,'aaaa','aaaa','aaaa','aaaa'),(2,'xxxc','xxxb','xxxb','xxxb'),(3,'xxxb','xxxc','xxxc','xxxc'),(4,'xxxa','xxxa','xxxa','xxxa'),(5,'zzzz','zzzz','zzzz','zzzz'),(6,NULL,NULL,'xxxa','xxxa'),(7,'zxxx','zxxx','zxxx','zxxx'),(8,'axxx','axxx','axxx','axxx'),(9,'zaaz','zaaz','zaaz','zaaz'),(10,'zbbz','zbbz','zbbz','zbbz');
UPDATE t1 SET b=CONCAT(b,'_update') WHERE b like '%x%x_' ESCAPE 'a' LIMIT 2;
SELECT * FROM t1;
a	b	c	d	e
1	aaaa	aaaa	aaaa	aaaa
2	xxxc	xxxb	xxxb	xxxb
3	xxxb	xxxc	xxxc	xxxc
4	xxxa_update	xxxa	xxxa	xxxa
5	zzzz	zzzz	zzzz	zzzz
6	NULL	NULL	xxxa	xxxa
7	zxxx	zxxx	zxxx	zxxx
8	axxx_update	axxx	axxx	axxx
9	zaaz	zaaz	zaaz	zaaz
10	zbbz	zbbz	zbbz	zbbz
replace into t1 values(1,'aaaa','aaaa','aaaa','aaaa'),(2,'xxxc','xxxb','xxxb','xxxb'),(3,'xxxb','xxxc','xxxc','xxxc'),(4,'xxxa','xxxa','xxxa','xxxa'),(5,'zzzz','zzzz','zzzz','zzzz'),(6,NULL,NULL,'xxxa','xxxa'),(7,'zxxx','zxxx','zxxx','zxxx'),(8,'axxx','axxx','axxx','axxx'),(9,'zaaz','zaaz','zaaz','zaaz'),(10,'zbbz','zbbz','zbbz','zbbz');
UPDATE t1 SET b=CONCAT(b,'_update') WHERE b NOT like '%x%x_' LIMIT 2;
SELECT * FROM t1;
a	b	c	d	e
1	aaaa_update	aaaa	aaaa	aaaa
2	xxxc	xxxb	xxxb	xxxb
3	xxxb	xxxc	xxxc	xxxc
4	xxxa	xxxa	xxxa	xxxa
5	zzzz_update	zzzz	zzzz	zzzz
6	NULL	NULL	xxxa	xxxa
7	zxxx	zxxx	zxxx	zxxx
8	axxx	axxx	axxx	axxx
9	zaaz	zaaz	zaaz	zaaz
10	zbbz	zbbz	zbbz	zbbz
replace into t1 values(1,'aaaa','aaaa','aaaa','aaaa'),(2,'xxxc','xxxb','xxxb','xxxb'),(3,'xxxb','xxxc','xxxc','xxxc'),(4,'xxxa','xxxa','xxxa','xxxa'),(5,'zzzz','zzzz','zzzz','zzzz'),(6,NULL,NULL,'xxxa','xxxa'),(7,'zxxx','zxxx','zxxx','zxxx'),(8,'axxx','axxx','axxx','axxx'),(9,'zaaz','zaaz','zaaz','zaaz'),(10,'zbbz','zbbz','zbbz','zbbz');
UPDATE t1 SET b=CONCAT(b,'_update') WHERE b NOT like '%x%x_' ESCAPE 'x' LIMIT 2;
SELECT * FROM t1;
a	b	c	d	e
1	aaaa_update	aaaa	aaaa	aaaa
2	xxxc_update	xxxb	xxxb	xxxb
3	xxxb	xxxc	xxxc	xxxc
4	xxxa	xxxa	xxxa	xxxa
5	zzzz	zzzz	zzzz	zzzz
6	NULL	NULL	xxxa	xxxa
7	zxxx	zxxx	zxxx	zxxx
8	axxx	axxx	axxx	axxx
9	zaaz	zaaz	zaaz	zaaz
10	zbbz	zbbz	zbbz	zbbz
replace into t1 values(1,'aaaa','aaaa','aaaa','aaaa'),(2,'xxxc','xxxb','xxxb','xxxb'),(3,'xxxb','xxxc','xxxc','xxxc'),(4,'xxxa','xxxa','xxxa','xxxa'),(5,'zzzz','zzzz','zzzz','zzzz'),(6,NULL,NULL,'xxxa','xxxa'),(7,'zxxx','zxxx','zxxx','zxxx'),(8,'axxx','axxx','axxx','axxx'),(9,'zaaz','zaaz','zaaz','zaaz'),(10,'zbbz','zbbz','zbbz','zbbz');
UPDATE t1 SET b=CONCAT(b,'_update') WHERE b NOT like '%x%x_' ESCAPE 'a' LIMIT 2;
SELECT * FROM t1;
a	b	c	d	e
1	aaaa_update	aaaa	aaaa	aaaa
2	xxxc	xxxb	xxxb	xxxb
3	xxxb	xxxc	xxxc	xxxc
4	xxxa	xxxa	xxxa	xxxa
5	zzzz_update	zzzz	zzzz	zzzz
6	NULL	NULL	xxxa	xxxa
7	zxxx	zxxx	zxxx	zxxx
8	axxx	axxx	axxx	axxx
9	zaaz	zaaz	zaaz	zaaz
10	zbbz	zbbz	zbbz	zbbz
-- col_str1 [NOT] LIKE ‘%x%x%’ [ESCAPE col_str3]
replace into t1 values(1,'aaaa','aaaa','aaaa','aaaa'),(2,'xxxc','xxxb','xxxb','xxxb'),(3,'xxxb','xxxc','xxxc','xxxc'),(4,'xxxa','xxxa','xxxa','xxxa'),(5,'zzzz','zzzz','zzzz','zzzz'),(6,NULL,NULL,'xxxa','xxxa'),(7,'zxxx','zxxx','zxxx','zxxx'),(8,'axxx','axxx','axxx','axxx'),(9,'zaaz','zaaz','zaaz','zaaz'),(10,'zbbz','zbbz','zbbz','zbbz');
UPDATE t1 SET b=CONCAT(b,'_update') WHERE b like '%x%x%' LIMIT 2;
SELECT * FROM t1;
a	b	c	d	e
1	aaaa	aaaa	aaaa	aaaa
2	xxxc	xxxb	xxxb	xxxb
3	xxxb	xxxc	xxxc	xxxc
4	xxxa_update	xxxa	xxxa	xxxa
5	zzzz	zzzz	zzzz	zzzz
6	NULL	NULL	xxxa	xxxa
7	zxxx	zxxx	zxxx	zxxx
8	axxx_update	axxx	axxx	axxx
9	zaaz	zaaz	zaaz	zaaz
10	zbbz	zbbz	zbbz	zbbz
replace into t1 values(1,'aaaa','aaaa','aaaa','aaaa'),(2,'xxxc','xxxb','xxxb','xxxb'),(3,'xxxb','xxxc','xxxc','xxxc'),(4,'xxxa','xxxa','xxxa','xxxa'),(5,'zzzz','zzzz','zzzz','zzzz'),(6,NULL,NULL,'xxxa','xxxa'),(7,'zxxx','zxxx','zxxx','zxxx'),(8,'axxx','axxx','axxx','axxx'),(9,'zaaz','zaaz','zaaz','zaaz'),(10,'zbbz','zbbz','zbbz','zbbz');
UPDATE t1 SET b=CONCAT(b,'_update') WHERE b like '%x%x%' ESCAPE 'x' LIMIT 2;
SELECT * FROM t1;
a	b	c	d	e
1	aaaa	aaaa	aaaa	aaaa
2	xxxc	xxxb	xxxb	xxxb
3	xxxb	xxxc	xxxc	xxxc
4	xxxa	xxxa	xxxa	xxxa
5	zzzz	zzzz	zzzz	zzzz
6	NULL	NULL	xxxa	xxxa
7	zxxx	zxxx	zxxx	zxxx
8	axxx	axxx	axxx	axxx
9	zaaz	zaaz	zaaz	zaaz
10	zbbz	zbbz	zbbz	zbbz
replace into t1 values(1,'aaaa','aaaa','aaaa','aaaa'),(2,'xxxc','xxxb','xxxb','xxxb'),(3,'xxxb','xxxc','xxxc','xxxc'),(4,'xxxa','xxxa','xxxa','xxxa'),(5,'zzzz','zzzz','zzzz','zzzz'),(6,NULL,NULL,'xxxa','xxxa'),(7,'zxxx','zxxx','zxxx','zxxx'),(8,'axxx','axxx','axxx','axxx'),(9,'zaaz','zaaz','zaaz','zaaz'),(10,'zbbz','zbbz','zbbz','zbbz');
UPDATE t1 SET b=CONCAT(b,'_update') WHERE b like '%x%x%' ESCAPE 'a' LIMIT 2;
SELECT * FROM t1;
a	b	c	d	e
1	aaaa	aaaa	aaaa	aaaa
2	xxxc	xxxb	xxxb	xxxb
3	xxxb	xxxc	xxxc	xxxc
4	xxxa_update	xxxa	xxxa	xxxa
5	zzzz	zzzz	zzzz	zzzz
6	NULL	NULL	xxxa	xxxa
7	zxxx	zxxx	zxxx	zxxx
8	axxx_update	axxx	axxx	axxx
9	zaaz	zaaz	zaaz	zaaz
10	zbbz	zbbz	zbbz	zbbz
replace into t1 values(1,'aaaa','aaaa','aaaa','aaaa'),(2,'xxxc','xxxb','xxxb','xxxb'),(3,'xxxb','xxxc','xxxc','xxxc'),(4,'xxxa','xxxa','xxxa','xxxa'),(5,'zzzz','zzzz','zzzz','zzzz'),(6,NULL,NULL,'xxxa','xxxa'),(7,'zxxx','zxxx','zxxx','zxxx'),(8,'axxx','axxx','axxx','axxx'),(9,'zaaz','zaaz','zaaz','zaaz'),(10,'zbbz','zbbz','zbbz','zbbz');
UPDATE t1 SET b=CONCAT(b,'_update') WHERE b NOT like '%x%x%' LIMIT 2;
SELECT * FROM t1;
a	b	c	d	e
1	aaaa_update	aaaa	aaaa	aaaa
2	xxxc	xxxb	xxxb	xxxb
3	xxxb	xxxc	xxxc	xxxc
4	xxxa	xxxa	xxxa	xxxa
5	zzzz_update	zzzz	zzzz	zzzz
6	NULL	NULL	xxxa	xxxa
7	zxxx	zxxx	zxxx	zxxx
8	axxx	axxx	axxx	axxx
9	zaaz	zaaz	zaaz	zaaz
10	zbbz	zbbz	zbbz	zbbz
replace into t1 values(1,'aaaa','aaaa','aaaa','aaaa'),(2,'xxxc','xxxb','xxxb','xxxb'),(3,'xxxb','xxxc','xxxc','xxxc'),(4,'xxxa','xxxa','xxxa','xxxa'),(5,'zzzz','zzzz','zzzz','zzzz'),(6,NULL,NULL,'xxxa','xxxa'),(7,'zxxx','zxxx','zxxx','zxxx'),(8,'axxx','axxx','axxx','axxx'),(9,'zaaz','zaaz','zaaz','zaaz'),(10,'zbbz','zbbz','zbbz','zbbz');
UPDATE t1 SET b=CONCAT(b,'_update') WHERE b NOT like '%x%x%' ESCAPE 'x' LIMIT 2;
SELECT * FROM t1;
a	b	c	d	e
1	aaaa_update	aaaa	aaaa	aaaa
2	xxxc_update	xxxb	xxxb	xxxb
3	xxxb	xxxc	xxxc	xxxc
4	xxxa	xxxa	xxxa	xxxa
5	zzzz	zzzz	zzzz	zzzz
6	NULL	NULL	xxxa	xxxa
7	zxxx	zxxx	zxxx	zxxx
8	axxx	axxx	axxx	axxx
9	zaaz	zaaz	zaaz	zaaz
10	zbbz	zbbz	zbbz	zbbz
replace into t1 values(1,'aaaa','aaaa','aaaa','aaaa'),(2,'xxxc','xxxb','xxxb','xxxb'),(3,'xxxb','xxxc','xxxc','xxxc'),(4,'xxxa','xxxa','xxxa','xxxa'),(5,'zzzz','zzzz','zzzz','zzzz'),(6,NULL,NULL,'xxxa','xxxa'),(7,'zxxx','zxxx','zxxx','zxxx'),(8,'axxx','axxx','axxx','axxx'),(9,'zaaz','zaaz','zaaz','zaaz'),(10,'zbbz','zbbz','zbbz','zbbz');
UPDATE t1 SET b=CONCAT(b,'_update') WHERE b NOT like '%x%x%' ESCAPE 'a' LIMIT 2;
SELECT * FROM t1;
a	b	c	d	e
1	aaaa_update	aaaa	aaaa	aaaa
2	xxxc	xxxb	xxxb	xxxb
3	xxxb	xxxc	xxxc	xxxc
4	xxxa	xxxa	xxxa	xxxa
5	zzzz_update	zzzz	zzzz	zzzz
6	NULL	NULL	xxxa	xxxa
7	zxxx	zxxx	zxxx	zxxx
8	axxx	axxx	axxx	axxx
9	zaaz	zaaz	zaaz	zaaz
10	zbbz	zbbz	zbbz	zbbz
-- NULL [NOT] LIKE col_str2 [ESCAPE col_str3]
replace into t1 values(1,'aaaa','aaaa','aaaa','aaaa'),(2,'xxxc','xxxb','xxxb','xxxb'),(3,'xxxb','xxxc','xxxc','xxxc'),(4,'xxxa','xxxa','xxxa','xxxa'),(5,'zzzz','zzzz','zzzz','zzzz'),(6,NULL,NULL,'xxxa','xxxa'),(7,'zxxx','zxxx','zxxx','zxxx'),(8,'axxx','axxx','axxx','axxx'),(9,'zaaz','zaaz','zaaz','zaaz'),(10,'zbbz','zbbz','zbbz','zbbz');
UPDATE t1 SET b=CONCAT(b,'_update') WHERE NULL like 'xxx%' LIMIT 2;
SELECT * FROM t1;
a	b	c	d	e
1	aaaa	aaaa	aaaa	aaaa
2	xxxc	xxxb	xxxb	xxxb
3	xxxb	xxxc	xxxc	xxxc
4	xxxa	xxxa	xxxa	xxxa
5	zzzz	zzzz	zzzz	zzzz
6	NULL	NULL	xxxa	xxxa
7	zxxx	zxxx	zxxx	zxxx
8	axxx	axxx	axxx	axxx
9	zaaz	zaaz	zaaz	zaaz
10	zbbz	zbbz	zbbz	zbbz
replace into t1 values(1,'aaaa','aaaa','aaaa','aaaa'),(2,'xxxc','xxxb','xxxb','xxxb'),(3,'xxxb','xxxc','xxxc','xxxc'),(4,'xxxa','xxxa','xxxa','xxxa'),(5,'zzzz','zzzz','zzzz','zzzz'),(6,NULL,NULL,'xxxa','xxxa'),(7,'zxxx','zxxx','zxxx','zxxx'),(8,'axxx','axxx','axxx','axxx'),(9,'zaaz','zaaz','zaaz','zaaz'),(10,'zbbz','zbbz','zbbz','zbbz');
UPDATE t1 SET b=CONCAT(b,'_update') WHERE NULL like 'xxx%' ESCAPE 'x' LIMIT 2;
SELECT * FROM t1;
a	b	c	d	e
1	aaaa	aaaa	aaaa	aaaa
2	xxxc	xxxb	xxxb	xxxb
3	xxxb	xxxc	xxxc	xxxc
4	xxxa	xxxa	xxxa	xxxa
5	zzzz	zzzz	zzzz	zzzz
6	NULL	NULL	xxxa	xxxa
7	zxxx	zxxx	zxxx	zxxx
8	axxx	axxx	axxx	axxx
9	zaaz	zaaz	zaaz	zaaz
10	zbbz	zbbz	zbbz	zbbz
replace into t1 values(1,'aaaa','aaaa','aaaa','aaaa'),(2,'xxxc','xxxb','xxxb','xxxb'),(3,'xxxb','xxxc','xxxc','xxxc'),(4,'xxxa','xxxa','xxxa','xxxa'),(5,'zzzz','zzzz','zzzz','zzzz'),(6,NULL,NULL,'xxxa','xxxa'),(7,'zxxx','zxxx','zxxx','zxxx'),(8,'axxx','axxx','axxx','axxx'),(9,'zaaz','zaaz','zaaz','zaaz'),(10,'zbbz','zbbz','zbbz','zbbz');
UPDATE t1 SET b=CONCAT(b,'_update') WHERE NULL like 'xxx%' ESCAPE 'a' LIMIT 2;
SELECT * FROM t1;
a	b	c	d	e
1	aaaa	aaaa	aaaa	aaaa
2	xxxc	xxxb	xxxb	xxxb
3	xxxb	xxxc	xxxc	xxxc
4	xxxa	xxxa	xxxa	xxxa
5	zzzz	zzzz	zzzz	zzzz
6	NULL	NULL	xxxa	xxxa
7	zxxx	zxxx	zxxx	zxxx
8	axxx	axxx	axxx	axxx
9	zaaz	zaaz	zaaz	zaaz
10	zbbz	zbbz	zbbz	zbbz
replace into t1 values(1,'aaaa','aaaa','aaaa','aaaa'),(2,'xxxc','xxxb','xxxb','xxxb'),(3,'xxxb','xxxc','xxxc','xxxc'),(4,'xxxa','xxxa','xxxa','xxxa'),(5,'zzzz','zzzz','zzzz','zzzz'),(6,NULL,NULL,'xxxa','xxxa'),(7,'zxxx','zxxx','zxxx','zxxx'),(8,'axxx','axxx','axxx','axxx'),(9,'zaaz','zaaz','zaaz','zaaz'),(10,'zbbz','zbbz','zbbz','zbbz');
UPDATE t1 SET b=CONCAT(b,'_update') WHERE NULL NOT like 'xxx%' LIMIT 2;
SELECT * FROM t1;
a	b	c	d	e
1	aaaa	aaaa	aaaa	aaaa
2	xxxc	xxxb	xxxb	xxxb
3	xxxb	xxxc	xxxc	xxxc
4	xxxa	xxxa	xxxa	xxxa
5	zzzz	zzzz	zzzz	zzzz
6	NULL	NULL	xxxa	xxxa
7	zxxx	zxxx	zxxx	zxxx
8	axxx	axxx	axxx	axxx
9	zaaz	zaaz	zaaz	zaaz
10	zbbz	zbbz	zbbz	zbbz
replace into t1 values(1,'aaaa','aaaa','aaaa','aaaa'),(2,'xxxc','xxxb','xxxb','xxxb'),(3,'xxxb','xxxc','xxxc','xxxc'),(4,'xxxa','xxxa','xxxa','xxxa'),(5,'zzzz','zzzz','zzzz','zzzz'),(6,NULL,NULL,'xxxa','xxxa'),(7,'zxxx','zxxx','zxxx','zxxx'),(8,'axxx','axxx','axxx','axxx'),(9,'zaaz','zaaz','zaaz','zaaz'),(10,'zbbz','zbbz','zbbz','zbbz');
UPDATE t1 SET b=CONCAT(b,'_update') WHERE NULL NOT like 'xxx%' ESCAPE 'x' LIMIT 2;
SELECT * FROM t1;
a	b	c	d	e
1	aaaa	aaaa	aaaa	aaaa
2	xxxc	xxxb	xxxb	xxxb
3	xxxb	xxxc	xxxc	xxxc
4	xxxa	xxxa	xxxa	xxxa
5	zzzz	zzzz	zzzz	zzzz
6	NULL	NULL	xxxa	xxxa
7	zxxx	zxxx	zxxx	zxxx
8	axxx	axxx	axxx	axxx
9	zaaz	zaaz	zaaz	zaaz
10	zbbz	zbbz	zbbz	zbbz
replace into t1 values(1,'aaaa','aaaa','aaaa','aaaa'),(2,'xxxc','xxxb','xxxb','xxxb'),(3,'xxxb','xxxc','xxxc','xxxc'),(4,'xxxa','xxxa','xxxa','xxxa'),(5,'zzzz','zzzz','zzzz','zzzz'),(6,NULL,NULL,'xxxa','xxxa'),(7,'zxxx','zxxx','zxxx','zxxx'),(8,'axxx','axxx','axxx','axxx'),(9,'zaaz','zaaz','zaaz','zaaz'),(10,'zbbz','zbbz','zbbz','zbbz');
UPDATE t1 SET b=CONCAT(b,'_update') WHERE NULL NOT like 'xxx%' ESCAPE 'a' LIMIT 2;
SELECT * FROM t1;
a	b	c	d	e
1	aaaa	aaaa	aaaa	aaaa
2	xxxc	xxxb	xxxb	xxxb
3	xxxb	xxxc	xxxc	xxxc
4	xxxa	xxxa	xxxa	xxxa
5	zzzz	zzzz	zzzz	zzzz
6	NULL	NULL	xxxa	xxxa
7	zxxx	zxxx	zxxx	zxxx
8	axxx	axxx	axxx	axxx
9	zaaz	zaaz	zaaz	zaaz
10	zbbz	zbbz	zbbz	zbbz
-- col_str1 [NOT] LIKE ‘NULL’ [ESCAPE col_str3]
replace into t1 values(1,'aaaa','aaaa','aaaa','aaaa'),(2,'xxxc','xxxb','xxxb','xxxb'),(3,'xxxb','xxxc','xxxc','xxxc'),(4,'xxxa','xxxa','xxxa','xxxa'),(5,'zzzz','zzzz','zzzz','zzzz'),(6,NULL,NULL,'xxxa','xxxa'),(7,'zxxx','zxxx','zxxx','zxxx'),(8,'axxx','axxx','axxx','axxx'),(9,'zaaz','zaaz','zaaz','zaaz'),(10,'zbbz','zbbz','zbbz','zbbz');
UPDATE t1 SET b=CONCAT(b,'_update') WHERE b like NULL LIMIT 2;
SELECT * FROM t1;
a	b	c	d	e
1	aaaa	aaaa	aaaa	aaaa
2	xxxc	xxxb	xxxb	xxxb
3	xxxb	xxxc	xxxc	xxxc
4	xxxa	xxxa	xxxa	xxxa
5	zzzz	zzzz	zzzz	zzzz
6	NULL	NULL	xxxa	xxxa
7	zxxx	zxxx	zxxx	zxxx
8	axxx	axxx	axxx	axxx
9	zaaz	zaaz	zaaz	zaaz
10	zbbz	zbbz	zbbz	zbbz
replace into t1 values(1,'aaaa','aaaa','aaaa','aaaa'),(2,'xxxc','xxxb','xxxb','xxxb'),(3,'xxxb','xxxc','xxxc','xxxc'),(4,'xxxa','xxxa','xxxa','xxxa'),(5,'zzzz','zzzz','zzzz','zzzz'),(6,NULL,NULL,'xxxa','xxxa'),(7,'zxxx','zxxx','zxxx','zxxx'),(8,'axxx','axxx','axxx','axxx'),(9,'zaaz','zaaz','zaaz','zaaz'),(10,'zbbz','zbbz','zbbz','zbbz');
UPDATE t1 SET b=CONCAT(b,'_update') WHERE b like NULL ESCAPE 'x' LIMIT 2;
SELECT * FROM t1;
a	b	c	d	e
1	aaaa	aaaa	aaaa	aaaa
2	xxxc	xxxb	xxxb	xxxb
3	xxxb	xxxc	xxxc	xxxc
4	xxxa	xxxa	xxxa	xxxa
5	zzzz	zzzz	zzzz	zzzz
6	NULL	NULL	xxxa	xxxa
7	zxxx	zxxx	zxxx	zxxx
8	axxx	axxx	axxx	axxx
9	zaaz	zaaz	zaaz	zaaz
10	zbbz	zbbz	zbbz	zbbz
replace into t1 values(1,'aaaa','aaaa','aaaa','aaaa'),(2,'xxxc','xxxb','xxxb','xxxb'),(3,'xxxb','xxxc','xxxc','xxxc'),(4,'xxxa','xxxa','xxxa','xxxa'),(5,'zzzz','zzzz','zzzz','zzzz'),(6,NULL,NULL,'xxxa','xxxa'),(7,'zxxx','zxxx','zxxx','zxxx'),(8,'axxx','axxx','axxx','axxx'),(9,'zaaz','zaaz','zaaz','zaaz'),(10,'zbbz','zbbz','zbbz','zbbz');
UPDATE t1 SET b=CONCAT(b,'_update') WHERE b like NULL ESCAPE 'a' LIMIT 2;
SELECT * FROM t1;
a	b	c	d	e
1	aaaa	aaaa	aaaa	aaaa
2	xxxc	xxxb	xxxb	xxxb
3	xxxb	xxxc	xxxc	xxxc
4	xxxa	xxxa	xxxa	xxxa
5	zzzz	zzzz	zzzz	zzzz
6	NULL	NULL	xxxa	xxxa
7	zxxx	zxxx	zxxx	zxxx
8	axxx	axxx	axxx	axxx
9	zaaz	zaaz	zaaz	zaaz
10	zbbz	zbbz	zbbz	zbbz
replace into t1 values(1,'aaaa','aaaa','aaaa','aaaa'),(2,'xxxc','xxxb','xxxb','xxxb'),(3,'xxxb','xxxc','xxxc','xxxc'),(4,'xxxa','xxxa','xxxa','xxxa'),(5,'zzzz','zzzz','zzzz','zzzz'),(6,NULL,NULL,'xxxa','xxxa'),(7,'zxxx','zxxx','zxxx','zxxx'),(8,'axxx','axxx','axxx','axxx'),(9,'zaaz','zaaz','zaaz','zaaz'),(10,'zbbz','zbbz','zbbz','zbbz');
UPDATE t1 SET b=CONCAT(b,'_update') WHERE b NOT like NULL LIMIT 2;
SELECT * FROM t1;
a	b	c	d	e
1	aaaa	aaaa	aaaa	aaaa
2	xxxc	xxxb	xxxb	xxxb
3	xxxb	xxxc	xxxc	xxxc
4	xxxa	xxxa	xxxa	xxxa
5	zzzz	zzzz	zzzz	zzzz
6	NULL	NULL	xxxa	xxxa
7	zxxx	zxxx	zxxx	zxxx
8	axxx	axxx	axxx	axxx
9	zaaz	zaaz	zaaz	zaaz
10	zbbz	zbbz	zbbz	zbbz
replace into t1 values(1,'aaaa','aaaa','aaaa','aaaa'),(2,'xxxc','xxxb','xxxb','xxxb'),(3,'xxxb','xxxc','xxxc','xxxc'),(4,'xxxa','xxxa','xxxa','xxxa'),(5,'zzzz','zzzz','zzzz','zzzz'),(6,NULL,NULL,'xxxa','xxxa'),(7,'zxxx','zxxx','zxxx','zxxx'),(8,'axxx','axxx','axxx','axxx'),(9,'zaaz','zaaz','zaaz','zaaz'),(10,'zbbz','zbbz','zbbz','zbbz');
UPDATE t1 SET b=CONCAT(b,'_update') WHERE b NOT like NULL ESCAPE 'x' LIMIT 2;
SELECT * FROM t1;
a	b	c	d	e
1	aaaa	aaaa	aaaa	aaaa
2	xxxc	xxxb	xxxb	xxxb
3	xxxb	xxxc	xxxc	xxxc
4	xxxa	xxxa	xxxa	xxxa
5	zzzz	zzzz	zzzz	zzzz
6	NULL	NULL	xxxa	xxxa
7	zxxx	zxxx	zxxx	zxxx
8	axxx	axxx	axxx	axxx
9	zaaz	zaaz	zaaz	zaaz
10	zbbz	zbbz	zbbz	zbbz
replace into t1 values(1,'aaaa','aaaa','aaaa','aaaa'),(2,'xxxc','xxxb','xxxb','xxxb'),(3,'xxxb','xxxc','xxxc','xxxc'),(4,'xxxa','xxxa','xxxa','xxxa'),(5,'zzzz','zzzz','zzzz','zzzz'),(6,NULL,NULL,'xxxa','xxxa'),(7,'zxxx','zxxx','zxxx','zxxx'),(8,'axxx','axxx','axxx','axxx'),(9,'zaaz','zaaz','zaaz','zaaz'),(10,'zbbz','zbbz','zbbz','zbbz');
UPDATE t1 SET b=CONCAT(b,'_update') WHERE b NOT like NULL ESCAPE 'a' LIMIT 2;
SELECT * FROM t1;
a	b	c	d	e
1	aaaa	aaaa	aaaa	aaaa
2	xxxc	xxxb	xxxb	xxxb
3	xxxb	xxxc	xxxc	xxxc
4	xxxa	xxxa	xxxa	xxxa
5	zzzz	zzzz	zzzz	zzzz
6	NULL	NULL	xxxa	xxxa
7	zxxx	zxxx	zxxx	zxxx
8	axxx	axxx	axxx	axxx
9	zaaz	zaaz	zaaz	zaaz
10	zbbz	zbbz	zbbz	zbbz
-- col_str1 [NOT] LIKE col_str2 [ESCAPE NULL]
replace into t1 values(1,'aaaa','aaaa','aaaa','aaaa'),(2,'xxxc','xxxb','xxxb','xxxb'),(3,'xxxb','xxxc','xxxc','xxxc'),(4,'xxxa','xxxa','xxxa','xxxa'),(5,'zzzz','zzzz','zzzz','zzzz'),(6,NULL,NULL,'xxxa','xxxa'),(7,'zxxx','zxxx','zxxx','zxxx'),(8,'axxx','axxx','axxx','axxx'),(9,'zaaz','zaaz','zaaz','zaaz'),(10,'zbbz','zbbz','zbbz','zbbz');
UPDATE t1 SET b=CONCAT(b,'_update') WHERE b like 'xxx%' ESCAPE NULL LIMIT 2;
SELECT * FROM t1;
a	b	c	d	e
1	aaaa	aaaa	aaaa	aaaa
2	xxxc_update	xxxb	xxxb	xxxb
3	xxxb_update	xxxc	xxxc	xxxc
4	xxxa	xxxa	xxxa	xxxa
5	zzzz	zzzz	zzzz	zzzz
6	NULL	NULL	xxxa	xxxa
7	zxxx	zxxx	zxxx	zxxx
8	axxx	axxx	axxx	axxx
9	zaaz	zaaz	zaaz	zaaz
10	zbbz	zbbz	zbbz	zbbz
replace into t1 values(1,'aaaa','aaaa','aaaa','aaaa'),(2,'xxxc','xxxb','xxxb','xxxb'),(3,'xxxb','xxxc','xxxc','xxxc'),(4,'xxxa','xxxa','xxxa','xxxa'),(5,'zzzz','zzzz','zzzz','zzzz'),(6,NULL,NULL,'xxxa','xxxa'),(7,'zxxx','zxxx','zxxx','zxxx'),(8,'axxx','axxx','axxx','axxx'),(9,'zaaz','zaaz','zaaz','zaaz'),(10,'zbbz','zbbz','zbbz','zbbz');
UPDATE t1 SET b=CONCAT(b,'_update') WHERE b NOT like 'xxx%' ESCAPE NULL LIMIT 2;
SELECT * FROM t1;
a	b	c	d	e
1	aaaa_update	aaaa	aaaa	aaaa
2	xxxc	xxxb	xxxb	xxxb
3	xxxb	xxxc	xxxc	xxxc
4	xxxa	xxxa	xxxa	xxxa
5	zzzz_update	zzzz	zzzz	zzzz
6	NULL	NULL	xxxa	xxxa
7	zxxx	zxxx	zxxx	zxxx
8	axxx	axxx	axxx	axxx
9	zaaz	zaaz	zaaz	zaaz
10	zbbz	zbbz	zbbz	zbbz
-- col_str1 [NOT] LIKE col_str2 [ESCAPE col_str3]其中col_str1分别为联合索引前缀字段、中间字段、尾部字段
replace into t1 values(1,'aaaa','aaaa','aaaa','aaaa'),(2,'xxxc','xxxb','xxxb','xxxb'),(3,'xxxb','xxxc','xxxc','xxxc'),(4,'xxxa','xxxa','xxxa','xxxa'),(5,'zzzz','zzzz','zzzz','zzzz'),(6,NULL,NULL,'xxxa','xxxa'),(7,'zxxx','zxxx','zxxx','zxxx'),(8,'axxx','axxx','axxx','axxx'),(9,'zaaz','zaaz','zaaz','zaaz'),(10,'zbbz','zbbz','zbbz','zbbz');
UPDATE t1 SET b=CONCAT(b,'_update') WHERE c like 'xxx%' LIMIT 2;
SELECT * FROM t1;
a	b	c	d	e
1	aaaa	aaaa	aaaa	aaaa
2	xxxc_update	xxxb	xxxb	xxxb
3	xxxb_update	xxxc	xxxc	xxxc
4	xxxa	xxxa	xxxa	xxxa
5	zzzz	zzzz	zzzz	zzzz
6	NULL	NULL	xxxa	xxxa
7	zxxx	zxxx	zxxx	zxxx
8	axxx	axxx	axxx	axxx
9	zaaz	zaaz	zaaz	zaaz
10	zbbz	zbbz	zbbz	zbbz
replace into t1 values(1,'aaaa','aaaa','aaaa','aaaa'),(2,'xxxc','xxxb','xxxb','xxxb'),(3,'xxxb','xxxc','xxxc','xxxc'),(4,'xxxa','xxxa','xxxa','xxxa'),(5,'zzzz','zzzz','zzzz','zzzz'),(6,NULL,NULL,'xxxa','xxxa'),(7,'zxxx','zxxx','zxxx','zxxx'),(8,'axxx','axxx','axxx','axxx'),(9,'zaaz','zaaz','zaaz','zaaz'),(10,'zbbz','zbbz','zbbz','zbbz');
UPDATE t1 SET b=CONCAT(b,'_update') WHERE c like 'xxx%' ESCAPE 'x' LIMIT 2;
SELECT * FROM t1;
a	b	c	d	e
1	aaaa	aaaa	aaaa	aaaa
2	xxxc	xxxb	xxxb	xxxb
3	xxxb	xxxc	xxxc	xxxc
4	xxxa	xxxa	xxxa	xxxa
5	zzzz	zzzz	zzzz	zzzz
6	NULL	NULL	xxxa	xxxa
7	zxxx	zxxx	zxxx	zxxx
8	axxx	axxx	axxx	axxx
9	zaaz	zaaz	zaaz	zaaz
10	zbbz	zbbz	zbbz	zbbz
replace into t1 values(1,'aaaa','aaaa','aaaa','aaaa'),(2,'xxxc','xxxb','xxxb','xxxb'),(3,'xxxb','xxxc','xxxc','xxxc'),(4,'xxxa','xxxa','xxxa','xxxa'),(5,'zzzz','zzzz','zzzz','zzzz'),(6,NULL,NULL,'xxxa','xxxa'),(7,'zxxx','zxxx','zxxx','zxxx'),(8,'axxx','axxx','axxx','axxx'),(9,'zaaz','zaaz','zaaz','zaaz'),(10,'zbbz','zbbz','zbbz','zbbz');
UPDATE t1 SET b=CONCAT(b,'_update') WHERE c like 'xxx%' ESCAPE 'a' LIMIT 2;
SELECT * FROM t1;
a	b	c	d	e
1	aaaa	aaaa	aaaa	aaaa
2	xxxc_update	xxxb	xxxb	xxxb
3	xxxb	xxxc	xxxc	xxxc
4	xxxa_update	xxxa	xxxa	xxxa
5	zzzz	zzzz	zzzz	zzzz
6	NULL	NULL	xxxa	xxxa
7	zxxx	zxxx	zxxx	zxxx
8	axxx	axxx	axxx	axxx
9	zaaz	zaaz	zaaz	zaaz
10	zbbz	zbbz	zbbz	zbbz
replace into t1 values(1,'aaaa','aaaa','aaaa','aaaa'),(2,'xxxc','xxxb','xxxb','xxxb'),(3,'xxxb','xxxc','xxxc','xxxc'),(4,'xxxa','xxxa','xxxa','xxxa'),(5,'zzzz','zzzz','zzzz','zzzz'),(6,NULL,NULL,'xxxa','xxxa'),(7,'zxxx','zxxx','zxxx','zxxx'),(8,'axxx','axxx','axxx','axxx'),(9,'zaaz','zaaz','zaaz','zaaz'),(10,'zbbz','zbbz','zbbz','zbbz');
UPDATE t1 SET b=CONCAT(b,'_update') WHERE c NOT like 'xxx%' LIMIT 2;
SELECT * FROM t1;
a	b	c	d	e
1	aaaa_update	aaaa	aaaa	aaaa
2	xxxc	xxxb	xxxb	xxxb
3	xxxb	xxxc	xxxc	xxxc
4	xxxa	xxxa	xxxa	xxxa
5	zzzz_update	zzzz	zzzz	zzzz
6	NULL	NULL	xxxa	xxxa
7	zxxx	zxxx	zxxx	zxxx
8	axxx	axxx	axxx	axxx
9	zaaz	zaaz	zaaz	zaaz
10	zbbz	zbbz	zbbz	zbbz
replace into t1 values(1,'aaaa','aaaa','aaaa','aaaa'),(2,'xxxc','xxxb','xxxb','xxxb'),(3,'xxxb','xxxc','xxxc','xxxc'),(4,'xxxa','xxxa','xxxa','xxxa'),(5,'zzzz','zzzz','zzzz','zzzz'),(6,NULL,NULL,'xxxa','xxxa'),(7,'zxxx','zxxx','zxxx','zxxx'),(8,'axxx','axxx','axxx','axxx'),(9,'zaaz','zaaz','zaaz','zaaz'),(10,'zbbz','zbbz','zbbz','zbbz');
UPDATE t1 SET b=CONCAT(b,'_update') WHERE c NOT like 'xxx%' ESCAPE 'x' LIMIT 2;
SELECT * FROM t1;
a	b	c	d	e
1	aaaa_update	aaaa	aaaa	aaaa
2	xxxc_update	xxxb	xxxb	xxxb
3	xxxb	xxxc	xxxc	xxxc
4	xxxa	xxxa	xxxa	xxxa
5	zzzz	zzzz	zzzz	zzzz
6	NULL	NULL	xxxa	xxxa
7	zxxx	zxxx	zxxx	zxxx
8	axxx	axxx	axxx	axxx
9	zaaz	zaaz	zaaz	zaaz
10	zbbz	zbbz	zbbz	zbbz
replace into t1 values(1,'aaaa','aaaa','aaaa','aaaa'),(2,'xxxc','xxxb','xxxb','xxxb'),(3,'xxxb','xxxc','xxxc','xxxc'),(4,'xxxa','xxxa','xxxa','xxxa'),(5,'zzzz','zzzz','zzzz','zzzz'),(6,NULL,NULL,'xxxa','xxxa'),(7,'zxxx','zxxx','zxxx','zxxx'),(8,'axxx','axxx','axxx','axxx'),(9,'zaaz','zaaz','zaaz','zaaz'),(10,'zbbz','zbbz','zbbz','zbbz');
UPDATE t1 SET b=CONCAT(b,'_update') WHERE c NOT like 'xxx%' ESCAPE 'a' LIMIT 2;
SELECT * FROM t1;
a	b	c	d	e
1	aaaa_update	aaaa	aaaa	aaaa
2	xxxc	xxxb	xxxb	xxxb
3	xxxb	xxxc	xxxc	xxxc
4	xxxa	xxxa	xxxa	xxxa
5	zzzz_update	zzzz	zzzz	zzzz
6	NULL	NULL	xxxa	xxxa
7	zxxx	zxxx	zxxx	zxxx
8	axxx	axxx	axxx	axxx
9	zaaz	zaaz	zaaz	zaaz
10	zbbz	zbbz	zbbz	zbbz
replace into t1 values(1,'aaaa','aaaa','aaaa','aaaa'),(2,'xxxc','xxxb','xxxb','xxxb'),(3,'xxxb','xxxc','xxxc','xxxc'),(4,'xxxa','xxxa','xxxa','xxxa'),(5,'zzzz','zzzz','zzzz','zzzz'),(6,NULL,NULL,'xxxa','xxxa'),(7,'zxxx','zxxx','zxxx','zxxx'),(8,'axxx','axxx','axxx','axxx'),(9,'zaaz','zaaz','zaaz','zaaz'),(10,'zbbz','zbbz','zbbz','zbbz');
UPDATE t1 SET b=CONCAT(b,'_update') WHERE d like 'xxx%' LIMIT 2;
SELECT * FROM t1;
a	b	c	d	e
1	aaaa	aaaa	aaaa	aaaa
2	xxxc_update	xxxb	xxxb	xxxb
3	xxxb_update	xxxc	xxxc	xxxc
4	xxxa	xxxa	xxxa	xxxa
5	zzzz	zzzz	zzzz	zzzz
6	NULL	NULL	xxxa	xxxa
7	zxxx	zxxx	zxxx	zxxx
8	axxx	axxx	axxx	axxx
9	zaaz	zaaz	zaaz	zaaz
10	zbbz	zbbz	zbbz	zbbz
replace into t1 values(1,'aaaa','aaaa','aaaa','aaaa'),(2,'xxxc','xxxb','xxxb','xxxb'),(3,'xxxb','xxxc','xxxc','xxxc'),(4,'xxxa','xxxa','xxxa','xxxa'),(5,'zzzz','zzzz','zzzz','zzzz'),(6,NULL,NULL,'xxxa','xxxa'),(7,'zxxx','zxxx','zxxx','zxxx'),(8,'axxx','axxx','axxx','axxx'),(9,'zaaz','zaaz','zaaz','zaaz'),(10,'zbbz','zbbz','zbbz','zbbz');
UPDATE t1 SET b=CONCAT(b,'_update') WHERE d like 'xxx%' ESCAPE 'x' LIMIT 2;
SELECT * FROM t1;
a	b	c	d	e
1	aaaa	aaaa	aaaa	aaaa
2	xxxc	xxxb	xxxb	xxxb
3	xxxb	xxxc	xxxc	xxxc
4	xxxa	xxxa	xxxa	xxxa
5	zzzz	zzzz	zzzz	zzzz
6	NULL	NULL	xxxa	xxxa
7	zxxx	zxxx	zxxx	zxxx
8	axxx	axxx	axxx	axxx
9	zaaz	zaaz	zaaz	zaaz
10	zbbz	zbbz	zbbz	zbbz
replace into t1 values(1,'aaaa','aaaa','aaaa','aaaa'),(2,'xxxc','xxxb','xxxb','xxxb'),(3,'xxxb','xxxc','xxxc','xxxc'),(4,'xxxa','xxxa','xxxa','xxxa'),(5,'zzzz','zzzz','zzzz','zzzz'),(6,NULL,NULL,'xxxa','xxxa'),(7,'zxxx','zxxx','zxxx','zxxx'),(8,'axxx','axxx','axxx','axxx'),(9,'zaaz','zaaz','zaaz','zaaz'),(10,'zbbz','zbbz','zbbz','zbbz');
UPDATE t1 SET b=CONCAT(b,'_update') WHERE d like 'xxx%' ESCAPE 'a' LIMIT 2;
SELECT * FROM t1;
a	b	c	d	e
1	aaaa	aaaa	aaaa	aaaa
2	xxxc_update	xxxb	xxxb	xxxb
3	xxxb_update	xxxc	xxxc	xxxc
4	xxxa	xxxa	xxxa	xxxa
5	zzzz	zzzz	zzzz	zzzz
6	NULL	NULL	xxxa	xxxa
7	zxxx	zxxx	zxxx	zxxx
8	axxx	axxx	axxx	axxx
9	zaaz	zaaz	zaaz	zaaz
10	zbbz	zbbz	zbbz	zbbz
replace into t1 values(1,'aaaa','aaaa','aaaa','aaaa'),(2,'xxxc','xxxb','xxxb','xxxb'),(3,'xxxb','xxxc','xxxc','xxxc'),(4,'xxxa','xxxa','xxxa','xxxa'),(5,'zzzz','zzzz','zzzz','zzzz'),(6,NULL,NULL,'xxxa','xxxa'),(7,'zxxx','zxxx','zxxx','zxxx'),(8,'axxx','axxx','axxx','axxx'),(9,'zaaz','zaaz','zaaz','zaaz'),(10,'zbbz','zbbz','zbbz','zbbz');
UPDATE t1 SET b=CONCAT(b,'_update') WHERE d NOT like 'xxx%' LIMIT 2;
SELECT * FROM t1;
a	b	c	d	e
1	aaaa_update	aaaa	aaaa	aaaa
2	xxxc	xxxb	xxxb	xxxb
3	xxxb	xxxc	xxxc	xxxc
4	xxxa	xxxa	xxxa	xxxa
5	zzzz_update	zzzz	zzzz	zzzz
6	NULL	NULL	xxxa	xxxa
7	zxxx	zxxx	zxxx	zxxx
8	axxx	axxx	axxx	axxx
9	zaaz	zaaz	zaaz	zaaz
10	zbbz	zbbz	zbbz	zbbz
replace into t1 values(1,'aaaa','aaaa','aaaa','aaaa'),(2,'xxxc','xxxb','xxxb','xxxb'),(3,'xxxb','xxxc','xxxc','xxxc'),(4,'xxxa','xxxa','xxxa','xxxa'),(5,'zzzz','zzzz','zzzz','zzzz'),(6,NULL,NULL,'xxxa','xxxa'),(7,'zxxx','zxxx','zxxx','zxxx'),(8,'axxx','axxx','axxx','axxx'),(9,'zaaz','zaaz','zaaz','zaaz'),(10,'zbbz','zbbz','zbbz','zbbz');
UPDATE t1 SET b=CONCAT(b,'_update') WHERE d NOT like 'xxx%' ESCAPE 'x' LIMIT 2;
SELECT * FROM t1;
a	b	c	d	e
1	aaaa_update	aaaa	aaaa	aaaa
2	xxxc_update	xxxb	xxxb	xxxb
3	xxxb	xxxc	xxxc	xxxc
4	xxxa	xxxa	xxxa	xxxa
5	zzzz	zzzz	zzzz	zzzz
6	NULL	NULL	xxxa	xxxa
7	zxxx	zxxx	zxxx	zxxx
8	axxx	axxx	axxx	axxx
9	zaaz	zaaz	zaaz	zaaz
10	zbbz	zbbz	zbbz	zbbz
replace into t1 values(1,'aaaa','aaaa','aaaa','aaaa'),(2,'xxxc','xxxb','xxxb','xxxb'),(3,'xxxb','xxxc','xxxc','xxxc'),(4,'xxxa','xxxa','xxxa','xxxa'),(5,'zzzz','zzzz','zzzz','zzzz'),(6,NULL,NULL,'xxxa','xxxa'),(7,'zxxx','zxxx','zxxx','zxxx'),(8,'axxx','axxx','axxx','axxx'),(9,'zaaz','zaaz','zaaz','zaaz'),(10,'zbbz','zbbz','zbbz','zbbz');
UPDATE t1 SET b=CONCAT(b,'_update') WHERE d NOT like 'xxx%' ESCAPE 'a' LIMIT 2;
SELECT * FROM t1;
a	b	c	d	e
1	aaaa_update	aaaa	aaaa	aaaa
2	xxxc	xxxb	xxxb	xxxb
3	xxxb	xxxc	xxxc	xxxc
4	xxxa	xxxa	xxxa	xxxa
5	zzzz_update	zzzz	zzzz	zzzz
6	NULL	NULL	xxxa	xxxa
7	zxxx	zxxx	zxxx	zxxx
8	axxx	axxx	axxx	axxx
9	zaaz	zaaz	zaaz	zaaz
10	zbbz	zbbz	zbbz	zbbz
replace into t1 values(1,'aaaa','aaaa','aaaa','aaaa'),(2,'xxxc','xxxb','xxxb','xxxb'),(3,'xxxb','xxxc','xxxc','xxxc'),(4,'xxxa','xxxa','xxxa','xxxa'),(5,'zzzz','zzzz','zzzz','zzzz'),(6,NULL,NULL,'xxxa','xxxa'),(7,'zxxx','zxxx','zxxx','zxxx'),(8,'axxx','axxx','axxx','axxx'),(9,'zaaz','zaaz','zaaz','zaaz'),(10,'zbbz','zbbz','zbbz','zbbz');
UPDATE t1 SET b=CONCAT(b,'_update') WHERE e like 'xxx%' LIMIT 2;
SELECT * FROM t1;
a	b	c	d	e
1	aaaa	aaaa	aaaa	aaaa
2	xxxc_update	xxxb	xxxb	xxxb
3	xxxb_update	xxxc	xxxc	xxxc
4	xxxa	xxxa	xxxa	xxxa
5	zzzz	zzzz	zzzz	zzzz
6	NULL	NULL	xxxa	xxxa
7	zxxx	zxxx	zxxx	zxxx
8	axxx	axxx	axxx	axxx
9	zaaz	zaaz	zaaz	zaaz
10	zbbz	zbbz	zbbz	zbbz
replace into t1 values(1,'aaaa','aaaa','aaaa','aaaa'),(2,'xxxc','xxxb','xxxb','xxxb'),(3,'xxxb','xxxc','xxxc','xxxc'),(4,'xxxa','xxxa','xxxa','xxxa'),(5,'zzzz','zzzz','zzzz','zzzz'),(6,NULL,NULL,'xxxa','xxxa'),(7,'zxxx','zxxx','zxxx','zxxx'),(8,'axxx','axxx','axxx','axxx'),(9,'zaaz','zaaz','zaaz','zaaz'),(10,'zbbz','zbbz','zbbz','zbbz');
UPDATE t1 SET b=CONCAT(b,'_update') WHERE e like 'xxx%' ESCAPE 'x' LIMIT 2;
SELECT * FROM t1;
a	b	c	d	e
1	aaaa	aaaa	aaaa	aaaa
2	xxxc	xxxb	xxxb	xxxb
3	xxxb	xxxc	xxxc	xxxc
4	xxxa	xxxa	xxxa	xxxa
5	zzzz	zzzz	zzzz	zzzz
6	NULL	NULL	xxxa	xxxa
7	zxxx	zxxx	zxxx	zxxx
8	axxx	axxx	axxx	axxx
9	zaaz	zaaz	zaaz	zaaz
10	zbbz	zbbz	zbbz	zbbz
replace into t1 values(1,'aaaa','aaaa','aaaa','aaaa'),(2,'xxxc','xxxb','xxxb','xxxb'),(3,'xxxb','xxxc','xxxc','xxxc'),(4,'xxxa','xxxa','xxxa','xxxa'),(5,'zzzz','zzzz','zzzz','zzzz'),(6,NULL,NULL,'xxxa','xxxa'),(7,'zxxx','zxxx','zxxx','zxxx'),(8,'axxx','axxx','axxx','axxx'),(9,'zaaz','zaaz','zaaz','zaaz'),(10,'zbbz','zbbz','zbbz','zbbz');
UPDATE t1 SET b=CONCAT(b,'_update') WHERE e like 'xxx%' ESCAPE 'a' LIMIT 2;
SELECT * FROM t1;
a	b	c	d	e
1	aaaa	aaaa	aaaa	aaaa
2	xxxc_update	xxxb	xxxb	xxxb
3	xxxb_update	xxxc	xxxc	xxxc
4	xxxa	xxxa	xxxa	xxxa
5	zzzz	zzzz	zzzz	zzzz
6	NULL	NULL	xxxa	xxxa
7	zxxx	zxxx	zxxx	zxxx
8	axxx	axxx	axxx	axxx
9	zaaz	zaaz	zaaz	zaaz
10	zbbz	zbbz	zbbz	zbbz
replace into t1 values(1,'aaaa','aaaa','aaaa','aaaa'),(2,'xxxc','xxxb','xxxb','xxxb'),(3,'xxxb','xxxc','xxxc','xxxc'),(4,'xxxa','xxxa','xxxa','xxxa'),(5,'zzzz','zzzz','zzzz','zzzz'),(6,NULL,NULL,'xxxa','xxxa'),(7,'zxxx','zxxx','zxxx','zxxx'),(8,'axxx','axxx','axxx','axxx'),(9,'zaaz','zaaz','zaaz','zaaz'),(10,'zbbz','zbbz','zbbz','zbbz');
UPDATE t1 SET b=CONCAT(b,'_update') WHERE e NOT like 'xxx%' LIMIT 2;
SELECT * FROM t1;
a	b	c	d	e
1	aaaa_update	aaaa	aaaa	aaaa
2	xxxc	xxxb	xxxb	xxxb
3	xxxb	xxxc	xxxc	xxxc
4	xxxa	xxxa	xxxa	xxxa
5	zzzz_update	zzzz	zzzz	zzzz
6	NULL	NULL	xxxa	xxxa
7	zxxx	zxxx	zxxx	zxxx
8	axxx	axxx	axxx	axxx
9	zaaz	zaaz	zaaz	zaaz
10	zbbz	zbbz	zbbz	zbbz
replace into t1 values(1,'aaaa','aaaa','aaaa','aaaa'),(2,'xxxc','xxxb','xxxb','xxxb'),(3,'xxxb','xxxc','xxxc','xxxc'),(4,'xxxa','xxxa','xxxa','xxxa'),(5,'zzzz','zzzz','zzzz','zzzz'),(6,NULL,NULL,'xxxa','xxxa'),(7,'zxxx','zxxx','zxxx','zxxx'),(8,'axxx','axxx','axxx','axxx'),(9,'zaaz','zaaz','zaaz','zaaz'),(10,'zbbz','zbbz','zbbz','zbbz');
UPDATE t1 SET b=CONCAT(b,'_update') WHERE e NOT like 'xxx%' ESCAPE 'x' LIMIT 2;
SELECT * FROM t1;
a	b	c	d	e
1	aaaa_update	aaaa	aaaa	aaaa
2	xxxc_update	xxxb	xxxb	xxxb
3	xxxb	xxxc	xxxc	xxxc
4	xxxa	xxxa	xxxa	xxxa
5	zzzz	zzzz	zzzz	zzzz
6	NULL	NULL	xxxa	xxxa
7	zxxx	zxxx	zxxx	zxxx
8	axxx	axxx	axxx	axxx
9	zaaz	zaaz	zaaz	zaaz
10	zbbz	zbbz	zbbz	zbbz
replace into t1 values(1,'aaaa','aaaa','aaaa','aaaa'),(2,'xxxc','xxxb','xxxb','xxxb'),(3,'xxxb','xxxc','xxxc','xxxc'),(4,'xxxa','xxxa','xxxa','xxxa'),(5,'zzzz','zzzz','zzzz','zzzz'),(6,NULL,NULL,'xxxa','xxxa'),(7,'zxxx','zxxx','zxxx','zxxx'),(8,'axxx','axxx','axxx','axxx'),(9,'zaaz','zaaz','zaaz','zaaz'),(10,'zbbz','zbbz','zbbz','zbbz');
UPDATE t1 SET b=CONCAT(b,'_update') WHERE e NOT like 'xxx%' ESCAPE 'a' LIMIT 2;
SELECT * FROM t1;
a	b	c	d	e
1	aaaa_update	aaaa	aaaa	aaaa
2	xxxc	xxxb	xxxb	xxxb
3	xxxb	xxxc	xxxc	xxxc
4	xxxa	xxxa	xxxa	xxxa
5	zzzz_update	zzzz	zzzz	zzzz
6	NULL	NULL	xxxa	xxxa
7	zxxx	zxxx	zxxx	zxxx
8	axxx	axxx	axxx	axxx
9	zaaz	zaaz	zaaz	zaaz
10	zbbz	zbbz	zbbz	zbbz
-- col_str1||’xxx’ [NOT] LIKE col_str2 [ESCAPE col_str3]
replace into t1 values(1,'aaaa','aaaa','aaaa','aaaa'),(2,'xxxc','xxxb','xxxb','xxxb'),(3,'xxxb','xxxc','xxxc','xxxc'),(4,'xxxa','xxxa','xxxa','xxxa'),(5,'zzzz','zzzz','zzzz','zzzz'),(6,NULL,NULL,'xxxa','xxxa'),(7,'zxxx','zxxx','zxxx','zxxx'),(8,'axxx','axxx','axxx','axxx'),(9,'zaaz','zaaz','zaaz','zaaz'),(10,'zbbz','zbbz','zbbz','zbbz');
UPDATE t1 SET b=CONCAT(b,'_update') WHERE 'xxx'||b like 'xxxxxx%' LIMIT 2;
SELECT * FROM t1;
a	b	c	d	e
1	aaaa	aaaa	aaaa	aaaa
2	xxxc	xxxb	xxxb	xxxb
3	xxxb	xxxc	xxxc	xxxc
4	xxxa	xxxa	xxxa	xxxa
5	zzzz	zzzz	zzzz	zzzz
6	NULL	NULL	xxxa	xxxa
7	zxxx	zxxx	zxxx	zxxx
8	axxx	axxx	axxx	axxx
9	zaaz	zaaz	zaaz	zaaz
10	zbbz	zbbz	zbbz	zbbz
replace into t1 values(1,'aaaa','aaaa','aaaa','aaaa'),(2,'xxxc','xxxb','xxxb','xxxb'),(3,'xxxb','xxxc','xxxc','xxxc'),(4,'xxxa','xxxa','xxxa','xxxa'),(5,'zzzz','zzzz','zzzz','zzzz'),(6,NULL,NULL,'xxxa','xxxa'),(7,'zxxx','zxxx','zxxx','zxxx'),(8,'axxx','axxx','axxx','axxx'),(9,'zaaz','zaaz','zaaz','zaaz'),(10,'zbbz','zbbz','zbbz','zbbz');
UPDATE t1 SET b=CONCAT(b,'_update') WHERE 'xxx'||b like 'xxxxxx%' ESCAPE 'x' LIMIT 2;
SELECT * FROM t1;
a	b	c	d	e
1	aaaa	aaaa	aaaa	aaaa
2	xxxc_update	xxxb	xxxb	xxxb
3	xxxb_update	xxxc	xxxc	xxxc
4	xxxa	xxxa	xxxa	xxxa
5	zzzz	zzzz	zzzz	zzzz
6	NULL	NULL	xxxa	xxxa
7	zxxx	zxxx	zxxx	zxxx
8	axxx	axxx	axxx	axxx
9	zaaz	zaaz	zaaz	zaaz
10	zbbz	zbbz	zbbz	zbbz
replace into t1 values(1,'aaaa','aaaa','aaaa','aaaa'),(2,'xxxc','xxxb','xxxb','xxxb'),(3,'xxxb','xxxc','xxxc','xxxc'),(4,'xxxa','xxxa','xxxa','xxxa'),(5,'zzzz','zzzz','zzzz','zzzz'),(6,NULL,NULL,'xxxa','xxxa'),(7,'zxxx','zxxx','zxxx','zxxx'),(8,'axxx','axxx','axxx','axxx'),(9,'zaaz','zaaz','zaaz','zaaz'),(10,'zbbz','zbbz','zbbz','zbbz');
UPDATE t1 SET b=CONCAT(b,'_update') WHERE 'xxx'||b like 'xxxxxx%' ESCAPE 'a' LIMIT 2;
SELECT * FROM t1;
a	b	c	d	e
1	aaaa	aaaa	aaaa	aaaa
2	xxxc	xxxb	xxxb	xxxb
3	xxxb	xxxc	xxxc	xxxc
4	xxxa	xxxa	xxxa	xxxa
5	zzzz	zzzz	zzzz	zzzz
6	NULL	NULL	xxxa	xxxa
7	zxxx	zxxx	zxxx	zxxx
8	axxx	axxx	axxx	axxx
9	zaaz	zaaz	zaaz	zaaz
10	zbbz	zbbz	zbbz	zbbz
replace into t1 values(1,'aaaa','aaaa','aaaa','aaaa'),(2,'xxxc','xxxb','xxxb','xxxb'),(3,'xxxb','xxxc','xxxc','xxxc'),(4,'xxxa','xxxa','xxxa','xxxa'),(5,'zzzz','zzzz','zzzz','zzzz'),(6,NULL,NULL,'xxxa','xxxa'),(7,'zxxx','zxxx','zxxx','zxxx'),(8,'axxx','axxx','axxx','axxx'),(9,'zaaz','zaaz','zaaz','zaaz'),(10,'zbbz','zbbz','zbbz','zbbz');
UPDATE t1 SET b=CONCAT(b,'_update') WHERE 'xxx'||b NOT like 'xxxxxx%' LIMIT 2;
SELECT * FROM t1;
a	b	c	d	e
1	aaaa_update	aaaa	aaaa	aaaa
2	xxxc_update	xxxb	xxxb	xxxb
3	xxxb	xxxc	xxxc	xxxc
4	xxxa	xxxa	xxxa	xxxa
5	zzzz	zzzz	zzzz	zzzz
6	NULL	NULL	xxxa	xxxa
7	zxxx	zxxx	zxxx	zxxx
8	axxx	axxx	axxx	axxx
9	zaaz	zaaz	zaaz	zaaz
10	zbbz	zbbz	zbbz	zbbz
replace into t1 values(1,'aaaa','aaaa','aaaa','aaaa'),(2,'xxxc','xxxb','xxxb','xxxb'),(3,'xxxb','xxxc','xxxc','xxxc'),(4,'xxxa','xxxa','xxxa','xxxa'),(5,'zzzz','zzzz','zzzz','zzzz'),(6,NULL,NULL,'xxxa','xxxa'),(7,'zxxx','zxxx','zxxx','zxxx'),(8,'axxx','axxx','axxx','axxx'),(9,'zaaz','zaaz','zaaz','zaaz'),(10,'zbbz','zbbz','zbbz','zbbz');
UPDATE t1 SET b=CONCAT(b,'_update') WHERE 'xxx'||b NOT like 'xxxxxx%' ESCAPE 'x' LIMIT 2;
SELECT * FROM t1;
a	b	c	d	e
1	aaaa_update	aaaa	aaaa	aaaa
2	xxxc	xxxb	xxxb	xxxb
3	xxxb	xxxc	xxxc	xxxc
4	xxxa	xxxa	xxxa	xxxa
5	zzzz_update	zzzz	zzzz	zzzz
6	NULL	NULL	xxxa	xxxa
7	zxxx	zxxx	zxxx	zxxx
8	axxx	axxx	axxx	axxx
9	zaaz	zaaz	zaaz	zaaz
10	zbbz	zbbz	zbbz	zbbz
replace into t1 values(1,'aaaa','aaaa','aaaa','aaaa'),(2,'xxxc','xxxb','xxxb','xxxb'),(3,'xxxb','xxxc','xxxc','xxxc'),(4,'xxxa','xxxa','xxxa','xxxa'),(5,'zzzz','zzzz','zzzz','zzzz'),(6,NULL,NULL,'xxxa','xxxa'),(7,'zxxx','zxxx','zxxx','zxxx'),(8,'axxx','axxx','axxx','axxx'),(9,'zaaz','zaaz','zaaz','zaaz'),(10,'zbbz','zbbz','zbbz','zbbz');
UPDATE t1 SET b=CONCAT(b,'_update') WHERE 'xxx'||b NOT like 'xxxxxx%' ESCAPE 'a' LIMIT 2;
SELECT * FROM t1;
a	b	c	d	e
1	aaaa_update	aaaa	aaaa	aaaa
2	xxxc_update	xxxb	xxxb	xxxb
3	xxxb	xxxc	xxxc	xxxc
4	xxxa	xxxa	xxxa	xxxa
5	zzzz	zzzz	zzzz	zzzz
6	NULL	NULL	xxxa	xxxa
7	zxxx	zxxx	zxxx	zxxx
8	axxx	axxx	axxx	axxx
9	zaaz	zaaz	zaaz	zaaz
10	zbbz	zbbz	zbbz	zbbz
-- col like col_str2中col_str2是concat、substr、upper、lower等字符串函数的输出
replace into t1 values(1,'aaaa','aaaa','aaaa','aaaa'),(2,'xxxc','xxxb','xxxb','xxxb'),(3,'xxxb','xxxc','xxxc','xxxc'),(4,'xxxa','xxxa','xxxa','xxxa'),(5,'zzzz','zzzz','zzzz','zzzz'),(6,NULL,NULL,'xxxa','xxxa'),(7,'zxxx','zxxx','zxxx','zxxx'),(8,'axxx','axxx','axxx','axxx'),(9,'zaaz','zaaz','zaaz','zaaz'),(10,'zbbz','zbbz','zbbz','zbbz');
UPDATE t1 SET b=CONCAT(b,'_update') WHERE CONCAT(b,'ccc') like 'xxx%' LIMIT 2;
SELECT * FROM t1;
a	b	c	d	e
1	aaaa	aaaa	aaaa	aaaa
2	xxxc_update	xxxb	xxxb	xxxb
3	xxxb_update	xxxc	xxxc	xxxc
4	xxxa	xxxa	xxxa	xxxa
5	zzzz	zzzz	zzzz	zzzz
6	NULL	NULL	xxxa	xxxa
7	zxxx	zxxx	zxxx	zxxx
8	axxx	axxx	axxx	axxx
9	zaaz	zaaz	zaaz	zaaz
10	zbbz	zbbz	zbbz	zbbz
replace into t1 values(1,'aaaa','aaaa','aaaa','aaaa'),(2,'xxxc','xxxb','xxxb','xxxb'),(3,'xxxb','xxxc','xxxc','xxxc'),(4,'xxxa','xxxa','xxxa','xxxa'),(5,'zzzz','zzzz','zzzz','zzzz'),(6,NULL,NULL,'xxxa','xxxa'),(7,'zxxx','zxxx','zxxx','zxxx'),(8,'axxx','axxx','axxx','axxx'),(9,'zaaz','zaaz','zaaz','zaaz'),(10,'zbbz','zbbz','zbbz','zbbz');
UPDATE t1 SET b=CONCAT(b,'_update') WHERE REPEAT(b,5) like 'xxx%' ESCAPE 'x' LIMIT 2;
SELECT * FROM t1;
a	b	c	d	e
1	aaaa	aaaa	aaaa	aaaa
2	xxxc	xxxb	xxxb	xxxb
3	xxxb	xxxc	xxxc	xxxc
4	xxxa	xxxa	xxxa	xxxa
5	zzzz	zzzz	zzzz	zzzz
6	NULL	NULL	xxxa	xxxa
7	zxxx	zxxx	zxxx	zxxx
8	axxx	axxx	axxx	axxx
9	zaaz	zaaz	zaaz	zaaz
10	zbbz	zbbz	zbbz	zbbz
replace into t1 values(1,'aaaa','aaaa','aaaa','aaaa'),(2,'xxxc','xxxb','xxxb','xxxb'),(3,'xxxb','xxxc','xxxc','xxxc'),(4,'xxxa','xxxa','xxxa','xxxa'),(5,'zzzz','zzzz','zzzz','zzzz'),(6,NULL,NULL,'xxxa','xxxa'),(7,'zxxx','zxxx','zxxx','zxxx'),(8,'axxx','axxx','axxx','axxx'),(9,'zaaz','zaaz','zaaz','zaaz'),(10,'zbbz','zbbz','zbbz','zbbz');
UPDATE t1 SET b=CONCAT(b,'_update') WHERE LOWER(b) like 'xxx%' ESCAPE 'a' LIMIT 2;
SELECT * FROM t1;
a	b	c	d	e
1	aaaa	aaaa	aaaa	aaaa
2	xxxc_update	xxxb	xxxb	xxxb
3	xxxb_update	xxxc	xxxc	xxxc
4	xxxa	xxxa	xxxa	xxxa
5	zzzz	zzzz	zzzz	zzzz
6	NULL	NULL	xxxa	xxxa
7	zxxx	zxxx	zxxx	zxxx
8	axxx	axxx	axxx	axxx
9	zaaz	zaaz	zaaz	zaaz
10	zbbz	zbbz	zbbz	zbbz
replace into t1 values(1,'aaaa','aaaa','aaaa','aaaa'),(2,'xxxc','xxxb','xxxb','xxxb'),(3,'xxxb','xxxc','xxxc','xxxc'),(4,'xxxa','xxxa','xxxa','xxxa'),(5,'zzzz','zzzz','zzzz','zzzz'),(6,NULL,NULL,'xxxa','xxxa'),(7,'zxxx','zxxx','zxxx','zxxx'),(8,'axxx','axxx','axxx','axxx'),(9,'zaaz','zaaz','zaaz','zaaz'),(10,'zbbz','zbbz','zbbz','zbbz');
UPDATE t1 SET b=CONCAT(b,'_update') WHERE SUBSTR(b,1,4) like 'xxx%' ESCAPE 'a' LIMIT 2;
SELECT * FROM t1;
a	b	c	d	e
1	aaaa	aaaa	aaaa	aaaa
2	xxxc_update	xxxb	xxxb	xxxb
3	xxxb_update	xxxc	xxxc	xxxc
4	xxxa	xxxa	xxxa	xxxa
5	zzzz	zzzz	zzzz	zzzz
6	NULL	NULL	xxxa	xxxa
7	zxxx	zxxx	zxxx	zxxx
8	axxx	axxx	axxx	axxx
9	zaaz	zaaz	zaaz	zaaz
10	zbbz	zbbz	zbbz	zbbz
replace into t1 values(1,'aaaa','aaaa','aaaa','aaaa'),(2,'xxxc','xxxb','xxxb','xxxb'),(3,'xxxb','xxxc','xxxc','xxxc'),(4,'xxxa','xxxa','xxxa','xxxa'),(5,'zzzz','zzzz','zzzz','zzzz'),(6,NULL,NULL,'xxxa','xxxa'),(7,'zxxx','zxxx','zxxx','zxxx'),(8,'axxx','axxx','axxx','axxx'),(9,'zaaz','zaaz','zaaz','zaaz'),(10,'zbbz','zbbz','zbbz','zbbz');
UPDATE t1 SET b=CONCAT(b,'_update') WHERE b like CONCAT('xxx' , '%') LIMIT 2;
SELECT * FROM t1;
a	b	c	d	e
1	aaaa	aaaa	aaaa	aaaa
2	xxxc_update	xxxb	xxxb	xxxb
3	xxxb_update	xxxc	xxxc	xxxc
4	xxxa	xxxa	xxxa	xxxa
5	zzzz	zzzz	zzzz	zzzz
6	NULL	NULL	xxxa	xxxa
7	zxxx	zxxx	zxxx	zxxx
8	axxx	axxx	axxx	axxx
9	zaaz	zaaz	zaaz	zaaz
10	zbbz	zbbz	zbbz	zbbz
replace into t1 values(1,'aaaa','aaaa','aaaa','aaaa'),(2,'xxxc','xxxb','xxxb','xxxb'),(3,'xxxb','xxxc','xxxc','xxxc'),(4,'xxxa','xxxa','xxxa','xxxa'),(5,'zzzz','zzzz','zzzz','zzzz'),(6,NULL,NULL,'xxxa','xxxa'),(7,'zxxx','zxxx','zxxx','zxxx'),(8,'axxx','axxx','axxx','axxx'),(9,'zaaz','zaaz','zaaz','zaaz'),(10,'zbbz','zbbz','zbbz','zbbz');
EXPLAIN UPDATE t1 SET b=CONCAT(b,'_update') WHERE b like REPEAT('x' , 3) LIMIT 2;
SELECT * FROM t1;
a	b	c	d	e
1	aaaa	aaaa	aaaa	aaaa
2	xxxc	xxxb	xxxb	xxxb
3	xxxb	xxxc	xxxc	xxxc
4	xxxa	xxxa	xxxa	xxxa
5	zzzz	zzzz	zzzz	zzzz
6	NULL	NULL	xxxa	xxxa
7	zxxx	zxxx	zxxx	zxxx
8	axxx	axxx	axxx	axxx
9	zaaz	zaaz	zaaz	zaaz
10	zbbz	zbbz	zbbz	zbbz
replace into t1 values(1,'aaaa','aaaa','aaaa','aaaa'),(2,'xxxc','xxxb','xxxb','xxxb'),(3,'xxxb','xxxc','xxxc','xxxc'),(4,'xxxa','xxxa','xxxa','xxxa'),(5,'zzzz','zzzz','zzzz','zzzz'),(6,NULL,NULL,'xxxa','xxxa'),(7,'zxxx','zxxx','zxxx','zxxx'),(8,'axxx','axxx','axxx','axxx'),(9,'zaaz','zaaz','zaaz','zaaz'),(10,'zbbz','zbbz','zbbz','zbbz');
EXPLAIN UPDATE t1 SET b=CONCAT(b,'_update') WHERE b like SUBSTR('%xxx%',2,4) LIMIT 2;
SELECT * FROM t1;
a	b	c	d	e
1	aaaa	aaaa	aaaa	aaaa
2	xxxc	xxxb	xxxb	xxxb
3	xxxb	xxxc	xxxc	xxxc
4	xxxa	xxxa	xxxa	xxxa
5	zzzz	zzzz	zzzz	zzzz
6	NULL	NULL	xxxa	xxxa
7	zxxx	zxxx	zxxx	zxxx
8	axxx	axxx	axxx	axxx
9	zaaz	zaaz	zaaz	zaaz
10	zbbz	zbbz	zbbz	zbbz
replace into t1 values(1,'aaaa','aaaa','aaaa','aaaa'),(2,'xxxc','xxxb','xxxb','xxxb'),(3,'xxxb','xxxc','xxxc','xxxc'),(4,'xxxa','xxxa','xxxa','xxxa'),(5,'zzzz','zzzz','zzzz','zzzz'),(6,NULL,NULL,'xxxa','xxxa'),(7,'zxxx','zxxx','zxxx','zxxx'),(8,'axxx','axxx','axxx','axxx'),(9,'zaaz','zaaz','zaaz','zaaz'),(10,'zbbz','zbbz','zbbz','zbbz');
EXPLAIN UPDATE t1 SET b=CONCAT(b,'_update') WHERE b like UPPER('xxx%') LIMIT 2;
SELECT * FROM t1;
a	b	c	d	e
1	aaaa	aaaa	aaaa	aaaa
2	xxxc	xxxb	xxxb	xxxb
3	xxxb	xxxc	xxxc	xxxc
4	xxxa	xxxa	xxxa	xxxa
5	zzzz	zzzz	zzzz	zzzz
6	NULL	NULL	xxxa	xxxa
7	zxxx	zxxx	zxxx	zxxx
8	axxx	axxx	axxx	axxx
9	zaaz	zaaz	zaaz	zaaz
10	zbbz	zbbz	zbbz	zbbz
replace into t1 values(1,'aaaa','aaaa','aaaa','aaaa'),(2,'xxxc','xxxb','xxxb','xxxb'),(3,'xxxb','xxxc','xxxc','xxxc'),(4,'xxxa','xxxa','xxxa','xxxa'),(5,'zzzz','zzzz','zzzz','zzzz'),(6,NULL,NULL,'xxxa','xxxa'),(7,'zxxx','zxxx','zxxx','zxxx'),(8,'axxx','axxx','axxx','axxx'),(9,'zaaz','zaaz','zaaz','zaaz'),(10,'zbbz','zbbz','zbbz','zbbz');
EXPLAIN UPDATE t1 SET b=CONCAT(b,'_update') WHERE b like LOWER('XXX%') LIMIT 2;
SELECT * FROM t1;
a	b	c	d	e
1	aaaa	aaaa	aaaa	aaaa
2	xxxc	xxxb	xxxb	xxxb
3	xxxb	xxxc	xxxc	xxxc
4	xxxa	xxxa	xxxa	xxxa
5	zzzz	zzzz	zzzz	zzzz
6	NULL	NULL	xxxa	xxxa
7	zxxx	zxxx	zxxx	zxxx
8	axxx	axxx	axxx	axxx
9	zaaz	zaaz	zaaz	zaaz
10	zbbz	zbbz	zbbz	zbbz
-- 通过and/or连接多个like表达式
replace into t1 values(1,'aaaa','aaaa','aaaa','aaaa'),(2,'xxxc','xxxb','xxxb','xxxb'),(3,'xxxb','xxxc','xxxc','xxxc'),(4,'xxxa','xxxa','xxxa','xxxa'),(5,'zzzz','zzzz','zzzz','zzzz'),(6,NULL,NULL,'xxxa','xxxa'),(7,'zxxx','zxxx','zxxx','zxxx'),(8,'axxx','axxx','axxx','axxx'),(9,'zaaz','zaaz','zaaz','zaaz'),(10,'zbbz','zbbz','zbbz','zbbz');
UPDATE t1 SET b=CONCAT(b,'_update') WHERE b like 'xxx%' and b like 'yyy%' LIMIT 2;
SELECT * FROM t1;
a	b	c	d	e
1	aaaa	aaaa	aaaa	aaaa
2	xxxc	xxxb	xxxb	xxxb
3	xxxb	xxxc	xxxc	xxxc
4	xxxa	xxxa	xxxa	xxxa
5	zzzz	zzzz	zzzz	zzzz
6	NULL	NULL	xxxa	xxxa
7	zxxx	zxxx	zxxx	zxxx
8	axxx	axxx	axxx	axxx
9	zaaz	zaaz	zaaz	zaaz
10	zbbz	zbbz	zbbz	zbbz
replace into t1 values(1,'aaaa','aaaa','aaaa','aaaa'),(2,'xxxc','xxxb','xxxb','xxxb'),(3,'xxxb','xxxc','xxxc','xxxc'),(4,'xxxa','xxxa','xxxa','xxxa'),(5,'zzzz','zzzz','zzzz','zzzz'),(6,NULL,NULL,'xxxa','xxxa'),(7,'zxxx','zxxx','zxxx','zxxx'),(8,'axxx','axxx','axxx','axxx'),(9,'zaaz','zaaz','zaaz','zaaz'),(10,'zbbz','zbbz','zbbz','zbbz');
UPDATE t1 SET b=CONCAT(b,'_update') WHERE b like 'xxx%' ESCAPE 'x' or b like 'xxx%' LIMIT 2;
SELECT * FROM t1;
a	b	c	d	e
1	aaaa	aaaa	aaaa	aaaa
2	xxxc_update	xxxb	xxxb	xxxb
3	xxxb_update	xxxc	xxxc	xxxc
4	xxxa	xxxa	xxxa	xxxa
5	zzzz	zzzz	zzzz	zzzz
6	NULL	NULL	xxxa	xxxa
7	zxxx	zxxx	zxxx	zxxx
8	axxx	axxx	axxx	axxx
9	zaaz	zaaz	zaaz	zaaz
10	zbbz	zbbz	zbbz	zbbz
replace into t1 values(1,'aaaa','aaaa','aaaa','aaaa'),(2,'xxxc','xxxb','xxxb','xxxb'),(3,'xxxb','xxxc','xxxc','xxxc'),(4,'xxxa','xxxa','xxxa','xxxa'),(5,'zzzz','zzzz','zzzz','zzzz'),(6,NULL,NULL,'xxxa','xxxa'),(7,'zxxx','zxxx','zxxx','zxxx'),(8,'axxx','axxx','axxx','axxx'),(9,'zaaz','zaaz','zaaz','zaaz'),(10,'zbbz','zbbz','zbbz','zbbz');
UPDATE t1 SET b=CONCAT(b,'_update') WHERE b like 'xxx%' ESCAPE 'a' or b like 'xxx%' and b not like 'yyy%' LIMIT 2;
SELECT * FROM t1;
a	b	c	d	e
1	aaaa	aaaa	aaaa	aaaa
2	xxxc_update	xxxb	xxxb	xxxb
3	xxxb_update	xxxc	xxxc	xxxc
4	xxxa	xxxa	xxxa	xxxa
5	zzzz	zzzz	zzzz	zzzz
6	NULL	NULL	xxxa	xxxa
7	zxxx	zxxx	zxxx	zxxx
8	axxx	axxx	axxx	axxx
9	zaaz	zaaz	zaaz	zaaz
10	zbbz	zbbz	zbbz	zbbz
replace into t1 values(1,'aaaa','aaaa','aaaa','aaaa'),(2,'xxxc','xxxb','xxxb','xxxb'),(3,'xxxb','xxxc','xxxc','xxxc'),(4,'xxxa','xxxa','xxxa','xxxa'),(5,'zzzz','zzzz','zzzz','zzzz'),(6,NULL,NULL,'xxxa','xxxa'),(7,'zxxx','zxxx','zxxx','zxxx'),(8,'axxx','axxx','axxx','axxx'),(9,'zaaz','zaaz','zaaz','zaaz'),(10,'zbbz','zbbz','zbbz','zbbz');
UPDATE t1 SET b=CONCAT(b,'_update') WHERE b != 'xxxx' and b like 'xxx%' LIMIT 2;
SELECT * FROM t1;
a	b	c	d	e
1	aaaa	aaaa	aaaa	aaaa
2	xxxc_update	xxxb	xxxb	xxxb
3	xxxb_update	xxxc	xxxc	xxxc
4	xxxa	xxxa	xxxa	xxxa
5	zzzz	zzzz	zzzz	zzzz
6	NULL	NULL	xxxa	xxxa
7	zxxx	zxxx	zxxx	zxxx
8	axxx	axxx	axxx	axxx
9	zaaz	zaaz	zaaz	zaaz
10	zbbz	zbbz	zbbz	zbbz
replace into t1 values(1,'aaaa','aaaa','aaaa','aaaa'),(2,'xxxc','xxxb','xxxb','xxxb'),(3,'xxxb','xxxc','xxxc','xxxc'),(4,'xxxa','xxxa','xxxa','xxxa'),(5,'zzzz','zzzz','zzzz','zzzz'),(6,NULL,NULL,'xxxa','xxxa'),(7,'zxxx','zxxx','zxxx','zxxx'),(8,'axxx','axxx','axxx','axxx'),(9,'zaaz','zaaz','zaaz','zaaz'),(10,'zbbz','zbbz','zbbz','zbbz');
UPDATE t1 SET b=CONCAT(b,'_update') WHERE b = 'xxxx' or b like 'xxx%' LIMIT 2;
SELECT * FROM t1;
a	b	c	d	e
1	aaaa	aaaa	aaaa	aaaa
2	xxxc_update	xxxb	xxxb	xxxb
3	xxxb_update	xxxc	xxxc	xxxc
4	xxxa	xxxa	xxxa	xxxa
5	zzzz	zzzz	zzzz	zzzz
6	NULL	NULL	xxxa	xxxa
7	zxxx	zxxx	zxxx	zxxx
8	axxx	axxx	axxx	axxx
9	zaaz	zaaz	zaaz	zaaz
10	zbbz	zbbz	zbbz	zbbz
-- c1上建索引i1，c2上建索引i2 c1 like '' and c2 = ''
replace into t1 values(1,'aaaa','aaaa','aaaa','aaaa'),(2,'xxxc','xxxb','xxxb','xxxb'),(3,'xxxb','xxxc','xxxc','xxxc'),(4,'xxxa','xxxa','xxxa','xxxa'),(5,'zzzz','zzzz','zzzz','zzzz'),(6,NULL,NULL,'xxxa','xxxa'),(7,'zxxx','zxxx','zxxx','zxxx'),(8,'axxx','axxx','axxx','axxx'),(9,'zaaz','zaaz','zaaz','zaaz'),(10,'zbbz','zbbz','zbbz','zbbz');
UPDATE t1 SET b=CONCAT(b,'_update') WHERE b like 'xxx%' LIMIT 2;
SELECT * FROM t1;
a	b	c	d	e
1	aaaa	aaaa	aaaa	aaaa
2	xxxc	xxxb	xxxb	xxxb
3	xxxb_update	xxxc	xxxc	xxxc
4	xxxa_update	xxxa	xxxa	xxxa
5	zzzz	zzzz	zzzz	zzzz
6	NULL	NULL	xxxa	xxxa
7	zxxx	zxxx	zxxx	zxxx
8	axxx	axxx	axxx	axxx
9	zaaz	zaaz	zaaz	zaaz
10	zbbz	zbbz	zbbz	zbbz
replace into t1 values(1,'aaaa','aaaa','aaaa','aaaa'),(2,'xxxc','xxxb','xxxb','xxxb'),(3,'xxxb','xxxc','xxxc','xxxc'),(4,'xxxa','xxxa','xxxa','xxxa'),(5,'zzzz','zzzz','zzzz','zzzz'),(6,NULL,NULL,'xxxa','xxxa'),(7,'zxxx','zxxx','zxxx','zxxx'),(8,'axxx','axxx','axxx','axxx'),(9,'zaaz','zaaz','zaaz','zaaz'),(10,'zbbz','zbbz','zbbz','zbbz');
EXPLAIN UPDATE t1 SET b=CONCAT(b,'_update') WHERE c = 'zzzz' LIMIT 2;
SELECT * FROM t1;
a	b	c	d	e
1	aaaa	aaaa	aaaa	aaaa
2	xxxc	xxxb	xxxb	xxxb
3	xxxb	xxxc	xxxc	xxxc
4	xxxa	xxxa	xxxa	xxxa
5	zzzz	zzzz	zzzz	zzzz
6	NULL	NULL	xxxa	xxxa
7	zxxx	zxxx	zxxx	zxxx
8	axxx	axxx	axxx	axxx
9	zaaz	zaaz	zaaz	zaaz
10	zbbz	zbbz	zbbz	zbbz
replace into t1 values(1,'aaaa','aaaa','aaaa','aaaa'),(2,'xxxc','xxxb','xxxb','xxxb'),(3,'xxxb','xxxc','xxxc','xxxc'),(4,'xxxa','xxxa','xxxa','xxxa'),(5,'zzzz','zzzz','zzzz','zzzz'),(6,NULL,NULL,'xxxa','xxxa'),(7,'zxxx','zxxx','zxxx','zxxx'),(8,'axxx','axxx','axxx','axxx'),(9,'zaaz','zaaz','zaaz','zaaz'),(10,'zbbz','zbbz','zbbz','zbbz');
UPDATE t1 SET b=CONCAT(b,'_update') WHERE b like 'xxx%' and c like 'xxx%' LIMIT 2;
SELECT * FROM t1;
a	b	c	d	e
1	aaaa	aaaa	aaaa	aaaa
2	xxxc_update	xxxb	xxxb	xxxb
3	xxxb_update	xxxc	xxxc	xxxc
4	xxxa	xxxa	xxxa	xxxa
5	zzzz	zzzz	zzzz	zzzz
6	NULL	NULL	xxxa	xxxa
7	zxxx	zxxx	zxxx	zxxx
8	axxx	axxx	axxx	axxx
9	zaaz	zaaz	zaaz	zaaz
10	zbbz	zbbz	zbbz	zbbz
replace into t1 values(1,'aaaa','aaaa','aaaa','aaaa'),(2,'xxxc','xxxb','xxxb','xxxb'),(3,'xxxb','xxxc','xxxc','xxxc'),(4,'xxxa','xxxa','xxxa','xxxa'),(5,'zzzz','zzzz','zzzz','zzzz'),(6,NULL,NULL,'xxxa','xxxa'),(7,'zxxx','zxxx','zxxx','zxxx'),(8,'axxx','axxx','axxx','axxx'),(9,'zaaz','zaaz','zaaz','zaaz'),(10,'zbbz','zbbz','zbbz','zbbz');
UPDATE t1 SET b=CONCAT(b,'_update') WHERE b like 'xxx%' or c like 'xxx%' LIMIT 2;
SELECT * FROM t1;
a	b	c	d	e
1	aaaa	aaaa	aaaa	aaaa
2	xxxc_update	xxxb	xxxb	xxxb
3	xxxb_update	xxxc	xxxc	xxxc
4	xxxa	xxxa	xxxa	xxxa
5	zzzz	zzzz	zzzz	zzzz
6	NULL	NULL	xxxa	xxxa
7	zxxx	zxxx	zxxx	zxxx
8	axxx	axxx	axxx	axxx
9	zaaz	zaaz	zaaz	zaaz
10	zbbz	zbbz	zbbz	zbbz
replace into t1 values(1,'aaaa','aaaa','aaaa','aaaa'),(2,'xxxc','xxxb','xxxb','xxxb'),(3,'xxxb','xxxc','xxxc','xxxc'),(4,'xxxa','xxxa','xxxa','xxxa'),(5,'zzzz','zzzz','zzzz','zzzz'),(6,NULL,NULL,'xxxa','xxxa'),(7,'zxxx','zxxx','zxxx','zxxx'),(8,'axxx','axxx','axxx','axxx'),(9,'zaaz','zaaz','zaaz','zaaz'),(10,'zbbz','zbbz','zbbz','zbbz');
UPDATE t1 SET b=CONCAT(b,'_update') WHERE b = 'xxxc' and c like 'xxx%' LIMIT 2;
SELECT * FROM t1;
a	b	c	d	e
1	aaaa	aaaa	aaaa	aaaa
2	xxxc_update	xxxb	xxxb	xxxb
3	xxxb	xxxc	xxxc	xxxc
4	xxxa	xxxa	xxxa	xxxa
5	zzzz	zzzz	zzzz	zzzz
6	NULL	NULL	xxxa	xxxa
7	zxxx	zxxx	zxxx	zxxx
8	axxx	axxx	axxx	axxx
9	zaaz	zaaz	zaaz	zaaz
10	zbbz	zbbz	zbbz	zbbz
replace into t1 values(1,'aaaa','aaaa','aaaa','aaaa'),(2,'xxxc','xxxb','xxxb','xxxb'),(3,'xxxb','xxxc','xxxc','xxxc'),(4,'xxxa','xxxa','xxxa','xxxa'),(5,'zzzz','zzzz','zzzz','zzzz'),(6,NULL,NULL,'xxxa','xxxa'),(7,'zxxx','zxxx','zxxx','zxxx'),(8,'axxx','axxx','axxx','axxx'),(9,'zaaz','zaaz','zaaz','zaaz'),(10,'zbbz','zbbz','zbbz','zbbz');
UPDATE t1 SET b=CONCAT(b,'_update') WHERE b = 'xxxc' or c like 'xxx%' LIMIT 2;
SELECT * FROM t1;
a	b	c	d	e
1	aaaa	aaaa	aaaa	aaaa
2	xxxc_update	xxxb	xxxb	xxxb
3	xxxb_update	xxxc	xxxc	xxxc
4	xxxa	xxxa	xxxa	xxxa
5	zzzz	zzzz	zzzz	zzzz
6	NULL	NULL	xxxa	xxxa
7	zxxx	zxxx	zxxx	zxxx
8	axxx	axxx	axxx	axxx
9	zaaz	zaaz	zaaz	zaaz
10	zbbz	zbbz	zbbz	zbbz
replace into t1 values(1,'aaaa','aaaa','aaaa','aaaa'),(2,'xxxc','xxxb','xxxb','xxxb'),(3,'xxxb','xxxc','xxxc','xxxc'),(4,'xxxa','xxxa','xxxa','xxxa'),(5,'zzzz','zzzz','zzzz','zzzz'),(6,NULL,NULL,'xxxa','xxxa'),(7,'zxxx','zxxx','zxxx','zxxx'),(8,'axxx','axxx','axxx','axxx'),(9,'zaaz','zaaz','zaaz','zaaz'),(10,'zbbz','zbbz','zbbz','zbbz');
UPDATE t1 SET b=CONCAT(b,'_update') WHERE b like 'xxx%' and c = 'zzzz' LIMIT 2;
SELECT * FROM t1;
a	b	c	d	e
1	aaaa	aaaa	aaaa	aaaa
2	xxxc	xxxb	xxxb	xxxb
3	xxxb	xxxc	xxxc	xxxc
4	xxxa	xxxa	xxxa	xxxa
5	zzzz	zzzz	zzzz	zzzz
6	NULL	NULL	xxxa	xxxa
7	zxxx	zxxx	zxxx	zxxx
8	axxx	axxx	axxx	axxx
9	zaaz	zaaz	zaaz	zaaz
10	zbbz	zbbz	zbbz	zbbz
replace into t1 values(1,'aaaa','aaaa','aaaa','aaaa'),(2,'xxxc','xxxb','xxxb','xxxb'),(3,'xxxb','xxxc','xxxc','xxxc'),(4,'xxxa','xxxa','xxxa','xxxa'),(5,'zzzz','zzzz','zzzz','zzzz'),(6,NULL,NULL,'xxxa','xxxa'),(7,'zxxx','zxxx','zxxx','zxxx'),(8,'axxx','axxx','axxx','axxx'),(9,'zaaz','zaaz','zaaz','zaaz'),(10,'zbbz','zbbz','zbbz','zbbz');
UPDATE t1 SET b=CONCAT(b,'_update') WHERE b like 'xxx%' or c = 'zzzz' LIMIT 2;
SELECT * FROM t1;
a	b	c	d	e
1	aaaa	aaaa	aaaa	aaaa
2	xxxc_update	xxxb	xxxb	xxxb
3	xxxb_update	xxxc	xxxc	xxxc
4	xxxa	xxxa	xxxa	xxxa
5	zzzz	zzzz	zzzz	zzzz
6	NULL	NULL	xxxa	xxxa
7	zxxx	zxxx	zxxx	zxxx
8	axxx	axxx	axxx	axxx
9	zaaz	zaaz	zaaz	zaaz
10	zbbz	zbbz	zbbz	zbbz
-- col like 'xxx%'中，col用别名，以及表使用别名
replace into t1 values(1,'aaaa','aaaa','aaaa','aaaa'),(2,'xxxc','xxxb','xxxb','xxxb'),(3,'xxxb','xxxc','xxxc','xxxc'),(4,'xxxa','xxxa','xxxa','xxxa'),(5,'zzzz','zzzz','zzzz','zzzz'),(6,NULL,NULL,'xxxa','xxxa'),(7,'zxxx','zxxx','zxxx','zxxx'),(8,'axxx','axxx','axxx','axxx'),(9,'zaaz','zaaz','zaaz','zaaz'),(10,'zbbz','zbbz','zbbz','zbbz');
SELECT a,b as b2,c,d,e FROM t1 HAVING b2 like 'xxx%' LIMIT 2;
a	b2	c	d	e
2	xxxc	xxxb	xxxb	xxxb
3	xxxb	xxxc	xxxc	xxxc
SELECT * FROM t1;
a	b	c	d	e
1	aaaa	aaaa	aaaa	aaaa
2	xxxc	xxxb	xxxb	xxxb
3	xxxb	xxxc	xxxc	xxxc
4	xxxa	xxxa	xxxa	xxxa
5	zzzz	zzzz	zzzz	zzzz
6	NULL	NULL	xxxa	xxxa
7	zxxx	zxxx	zxxx	zxxx
8	axxx	axxx	axxx	axxx
9	zaaz	zaaz	zaaz	zaaz
10	zbbz	zbbz	zbbz	zbbz
replace into t1 values(1,'aaaa','aaaa','aaaa','aaaa'),(2,'xxxc','xxxb','xxxb','xxxb'),(3,'xxxb','xxxc','xxxc','xxxc'),(4,'xxxa','xxxa','xxxa','xxxa'),(5,'zzzz','zzzz','zzzz','zzzz'),(6,NULL,NULL,'xxxa','xxxa'),(7,'zxxx','zxxx','zxxx','zxxx'),(8,'axxx','axxx','axxx','axxx'),(9,'zaaz','zaaz','zaaz','zaaz'),(10,'zbbz','zbbz','zbbz','zbbz');
SELECT a,b as b2,c,d,e FROM t1 HAVING b2 like 'xxx%' ESCAPE 'x' LIMIT 2;
a	b2	c	d	e
SELECT * FROM t1;
a	b	c	d	e
1	aaaa	aaaa	aaaa	aaaa
2	xxxc	xxxb	xxxb	xxxb
3	xxxb	xxxc	xxxc	xxxc
4	xxxa	xxxa	xxxa	xxxa
5	zzzz	zzzz	zzzz	zzzz
6	NULL	NULL	xxxa	xxxa
7	zxxx	zxxx	zxxx	zxxx
8	axxx	axxx	axxx	axxx
9	zaaz	zaaz	zaaz	zaaz
10	zbbz	zbbz	zbbz	zbbz
replace into t1 values(1,'aaaa','aaaa','aaaa','aaaa'),(2,'xxxc','xxxb','xxxb','xxxb'),(3,'xxxb','xxxc','xxxc','xxxc'),(4,'xxxa','xxxa','xxxa','xxxa'),(5,'zzzz','zzzz','zzzz','zzzz'),(6,NULL,NULL,'xxxa','xxxa'),(7,'zxxx','zxxx','zxxx','zxxx'),(8,'axxx','axxx','axxx','axxx'),(9,'zaaz','zaaz','zaaz','zaaz'),(10,'zbbz','zbbz','zbbz','zbbz');
SELECT a,b as b2,c,d,e FROM t1 HAVING b2 like 'xxx%' ESCAPE 'a' LIMIT 2;
a	b2	c	d	e
4	xxxa	xxxa	xxxa	xxxa
3	xxxb	xxxc	xxxc	xxxc
SELECT * FROM t1;
a	b	c	d	e
1	aaaa	aaaa	aaaa	aaaa
2	xxxc	xxxb	xxxb	xxxb
3	xxxb	xxxc	xxxc	xxxc
4	xxxa	xxxa	xxxa	xxxa
5	zzzz	zzzz	zzzz	zzzz
6	NULL	NULL	xxxa	xxxa
7	zxxx	zxxx	zxxx	zxxx
8	axxx	axxx	axxx	axxx
9	zaaz	zaaz	zaaz	zaaz
10	zbbz	zbbz	zbbz	zbbz
replace into t1 values(1,'aaaa','aaaa','aaaa','aaaa'),(2,'xxxc','xxxb','xxxb','xxxb'),(3,'xxxb','xxxc','xxxc','xxxc'),(4,'xxxa','xxxa','xxxa','xxxa'),(5,'zzzz','zzzz','zzzz','zzzz'),(6,NULL,NULL,'xxxa','xxxa'),(7,'zxxx','zxxx','zxxx','zxxx'),(8,'axxx','axxx','axxx','axxx'),(9,'zaaz','zaaz','zaaz','zaaz'),(10,'zbbz','zbbz','zbbz','zbbz');
SELECT a,b as b2,c,d,e FROM t1 HAVING b2 NOT like 'xxx%' LIMIT 2;
a	b2	c	d	e
1	aaaa	aaaa	aaaa	aaaa
5	zzzz	zzzz	zzzz	zzzz
SELECT * FROM t1;
a	b	c	d	e
1	aaaa	aaaa	aaaa	aaaa
2	xxxc	xxxb	xxxb	xxxb
3	xxxb	xxxc	xxxc	xxxc
4	xxxa	xxxa	xxxa	xxxa
5	zzzz	zzzz	zzzz	zzzz
6	NULL	NULL	xxxa	xxxa
7	zxxx	zxxx	zxxx	zxxx
8	axxx	axxx	axxx	axxx
9	zaaz	zaaz	zaaz	zaaz
10	zbbz	zbbz	zbbz	zbbz
replace into t1 values(1,'aaaa','aaaa','aaaa','aaaa'),(2,'xxxc','xxxb','xxxb','xxxb'),(3,'xxxb','xxxc','xxxc','xxxc'),(4,'xxxa','xxxa','xxxa','xxxa'),(5,'zzzz','zzzz','zzzz','zzzz'),(6,NULL,NULL,'xxxa','xxxa'),(7,'zxxx','zxxx','zxxx','zxxx'),(8,'axxx','axxx','axxx','axxx'),(9,'zaaz','zaaz','zaaz','zaaz'),(10,'zbbz','zbbz','zbbz','zbbz');
SELECT a,b as b2,c,d,e FROM t1 HAVING b2 NOT like 'xxx%' ESCAPE 'x' LIMIT 2;
a	b2	c	d	e
1	aaaa	aaaa	aaaa	aaaa
2	xxxc	xxxb	xxxb	xxxb
SELECT * FROM t1;
a	b	c	d	e
1	aaaa	aaaa	aaaa	aaaa
2	xxxc	xxxb	xxxb	xxxb
3	xxxb	xxxc	xxxc	xxxc
4	xxxa	xxxa	xxxa	xxxa
5	zzzz	zzzz	zzzz	zzzz
6	NULL	NULL	xxxa	xxxa
7	zxxx	zxxx	zxxx	zxxx
8	axxx	axxx	axxx	axxx
9	zaaz	zaaz	zaaz	zaaz
10	zbbz	zbbz	zbbz	zbbz
replace into t1 values(1,'aaaa','aaaa','aaaa','aaaa'),(2,'xxxc','xxxb','xxxb','xxxb'),(3,'xxxb','xxxc','xxxc','xxxc'),(4,'xxxa','xxxa','xxxa','xxxa'),(5,'zzzz','zzzz','zzzz','zzzz'),(6,NULL,NULL,'xxxa','xxxa'),(7,'zxxx','zxxx','zxxx','zxxx'),(8,'axxx','axxx','axxx','axxx'),(9,'zaaz','zaaz','zaaz','zaaz'),(10,'zbbz','zbbz','zbbz','zbbz');
SELECT a,b as b2,c,d,e FROM t1 HAVING b2 NOT like 'xxx%' ESCAPE 'a' LIMIT 2;
a	b2	c	d	e
1	aaaa	aaaa	aaaa	aaaa
5	zzzz	zzzz	zzzz	zzzz
SELECT * FROM t1;
a	b	c	d	e
1	aaaa	aaaa	aaaa	aaaa
2	xxxc	xxxb	xxxb	xxxb
3	xxxb	xxxc	xxxc	xxxc
4	xxxa	xxxa	xxxa	xxxa
5	zzzz	zzzz	zzzz	zzzz
6	NULL	NULL	xxxa	xxxa
7	zxxx	zxxx	zxxx	zxxx
8	axxx	axxx	axxx	axxx
9	zaaz	zaaz	zaaz	zaaz
10	zbbz	zbbz	zbbz	zbbz
-- like匹配的字符串中含有特殊字符
replace into t1 values(1,'aaaa','aaaa','aaaa','aaaa'),(2,'xxxc','xxxb','xxxb','xxxb'),(3,'xxxb','xxxc','xxxc','xxxc'),(4,'xxxa','xxxa','xxxa','xxxa'),(5,'zzzz','zzzz','zzzz','zzzz'),(6,NULL,NULL,'xxxa','xxxa'),(7,'zxxx','zxxx','zxxx','zxxx'),(8,'axxx','axxx','axxx','axxx'),(9,'zaaz','zaaz','zaaz','zaaz'),(10,'zbbz','zbbz','zbbz','zbbz');
UPDATE t1 SET b=CONCAT(b,'_update') WHERE b like '\0%' LIMIT 2;
SELECT * FROM t1;
a	b	c	d	e
1	aaaa	aaaa	aaaa	aaaa
2	xxxc	xxxb	xxxb	xxxb
3	xxxb	xxxc	xxxc	xxxc
4	xxxa	xxxa	xxxa	xxxa
5	zzzz	zzzz	zzzz	zzzz
6	NULL	NULL	xxxa	xxxa
7	zxxx	zxxx	zxxx	zxxx
8	axxx	axxx	axxx	axxx
9	zaaz	zaaz	zaaz	zaaz
10	zbbz	zbbz	zbbz	zbbz
replace into t1 values(1,'aaaa','aaaa','aaaa','aaaa'),(2,'xxxc','xxxb','xxxb','xxxb'),(3,'xxxb','xxxc','xxxc','xxxc'),(4,'xxxa','xxxa','xxxa','xxxa'),(5,'zzzz','zzzz','zzzz','zzzz'),(6,NULL,NULL,'xxxa','xxxa'),(7,'zxxx','zxxx','zxxx','zxxx'),(8,'axxx','axxx','axxx','axxx'),(9,'zaaz','zaaz','zaaz','zaaz'),(10,'zbbz','zbbz','zbbz','zbbz');
UPDATE t1 SET b=CONCAT(b,'_update') WHERE b like '\t%' ESCAPE 'x' LIMIT 2;
SELECT * FROM t1;
a	b	c	d	e
1	aaaa	aaaa	aaaa	aaaa
2	xxxc	xxxb	xxxb	xxxb
3	xxxb	xxxc	xxxc	xxxc
4	xxxa	xxxa	xxxa	xxxa
5	zzzz	zzzz	zzzz	zzzz
6	NULL	NULL	xxxa	xxxa
7	zxxx	zxxx	zxxx	zxxx
8	axxx	axxx	axxx	axxx
9	zaaz	zaaz	zaaz	zaaz
10	zbbz	zbbz	zbbz	zbbz
replace into t1 values(1,'aaaa','aaaa','aaaa','aaaa'),(2,'xxxc','xxxb','xxxb','xxxb'),(3,'xxxb','xxxc','xxxc','xxxc'),(4,'xxxa','xxxa','xxxa','xxxa'),(5,'zzzz','zzzz','zzzz','zzzz'),(6,NULL,NULL,'xxxa','xxxa'),(7,'zxxx','zxxx','zxxx','zxxx'),(8,'axxx','axxx','axxx','axxx'),(9,'zaaz','zaaz','zaaz','zaaz'),(10,'zbbz','zbbz','zbbz','zbbz');
UPDATE t1 SET b=CONCAT(b,'_update') WHERE b like '\n%' ESCAPE 'a' LIMIT 2;
SELECT * FROM t1;
a	b	c	d	e
1	aaaa	aaaa	aaaa	aaaa
2	xxxc	xxxb	xxxb	xxxb
3	xxxb	xxxc	xxxc	xxxc
4	xxxa	xxxa	xxxa	xxxa
5	zzzz	zzzz	zzzz	zzzz
6	NULL	NULL	xxxa	xxxa
7	zxxx	zxxx	zxxx	zxxx
8	axxx	axxx	axxx	axxx
9	zaaz	zaaz	zaaz	zaaz
10	zbbz	zbbz	zbbz	zbbz
replace into t1 values(1,'aaaa','aaaa','aaaa','aaaa'),(2,'xxxc','xxxb','xxxb','xxxb'),(3,'xxxb','xxxc','xxxc','xxxc'),(4,'xxxa','xxxa','xxxa','xxxa'),(5,'zzzz','zzzz','zzzz','zzzz'),(6,NULL,NULL,'xxxa','xxxa'),(7,'zxxx','zxxx','zxxx','zxxx'),(8,'axxx','axxx','axxx','axxx'),(9,'zaaz','zaaz','zaaz','zaaz'),(10,'zbbz','zbbz','zbbz','zbbz');
UPDATE t1 SET b=CONCAT(b,'_update') WHERE b NOT like '%%' LIMIT 2;
SELECT * FROM t1;
a	b	c	d	e
1	aaaa	aaaa	aaaa	aaaa
2	xxxc	xxxb	xxxb	xxxb
3	xxxb	xxxc	xxxc	xxxc
4	xxxa	xxxa	xxxa	xxxa
5	zzzz	zzzz	zzzz	zzzz
6	NULL	NULL	xxxa	xxxa
7	zxxx	zxxx	zxxx	zxxx
8	axxx	axxx	axxx	axxx
9	zaaz	zaaz	zaaz	zaaz
10	zbbz	zbbz	zbbz	zbbz
replace into t1 values(1,'aaaa','aaaa','aaaa','aaaa'),(2,'xxxc','xxxb','xxxb','xxxb'),(3,'xxxb','xxxc','xxxc','xxxc'),(4,'xxxa','xxxa','xxxa','xxxa'),(5,'zzzz','zzzz','zzzz','zzzz'),(6,NULL,NULL,'xxxa','xxxa'),(7,'zxxx','zxxx','zxxx','zxxx'),(8,'axxx','axxx','axxx','axxx'),(9,'zaaz','zaaz','zaaz','zaaz'),(10,'zbbz','zbbz','zbbz','zbbz');
UPDATE t1 SET b=CONCAT(b,'_update') WHERE b NOT like '_%' ESCAPE 'x' LIMIT 2;
SELECT * FROM t1;
a	b	c	d	e
1	aaaa	aaaa	aaaa	aaaa
2	xxxc	xxxb	xxxb	xxxb
3	xxxb	xxxc	xxxc	xxxc
4	xxxa	xxxa	xxxa	xxxa
5	zzzz	zzzz	zzzz	zzzz
6	NULL	NULL	xxxa	xxxa
7	zxxx	zxxx	zxxx	zxxx
8	axxx	axxx	axxx	axxx
9	zaaz	zaaz	zaaz	zaaz
10	zbbz	zbbz	zbbz	zbbz
replace into t1 values(1,'aaaa','aaaa','aaaa','aaaa'),(2,'xxxc','xxxb','xxxb','xxxb'),(3,'xxxb','xxxc','xxxc','xxxc'),(4,'xxxa','xxxa','xxxa','xxxa'),(5,'zzzz','zzzz','zzzz','zzzz'),(6,NULL,NULL,'xxxa','xxxa'),(7,'zxxx','zxxx','zxxx','zxxx'),(8,'axxx','axxx','axxx','axxx'),(9,'zaaz','zaaz','zaaz','zaaz'),(10,'zbbz','zbbz','zbbz','zbbz');
UPDATE t1 SET b=CONCAT(b,'_update') WHERE b NOT like '!%' ESCAPE 'a' LIMIT 2;
SELECT * FROM t1;
a	b	c	d	e
1	aaaa_update	aaaa	aaaa	aaaa
2	xxxc_update	xxxb	xxxb	xxxb
3	xxxb	xxxc	xxxc	xxxc
4	xxxa	xxxa	xxxa	xxxa
5	zzzz	zzzz	zzzz	zzzz
6	NULL	NULL	xxxa	xxxa
7	zxxx	zxxx	zxxx	zxxx
8	axxx	axxx	axxx	axxx
9	zaaz	zaaz	zaaz	zaaz
10	zbbz	zbbz	zbbz	zbbz
-- 匹配字符串偏长的情况
replace into t1 values(1,'aaaa','aaaa','aaaa','aaaa'),(2,'xxxc','xxxb','xxxb','xxxb'),(3,'xxxb','xxxc','xxxc','xxxc'),(4,'xxxa','xxxa','xxxa','xxxa'),(5,'zzzz','zzzz','zzzz','zzzz'),(6,NULL,NULL,'xxxa','xxxa'),(7,'zxxx','zxxx','zxxx','zxxx'),(8,'axxx','axxx','axxx','axxx'),(9,'zaaz','zaaz','zaaz','zaaz'),(10,'zbbz','zbbz','zbbz','zbbz');
UPDATE t1 SET b=CONCAT(b,'_update') WHERE b like 'xxx%%%%%%%%%%%%%%%%%%%%%%%%%%%%%%%%%%%%' LIMIT 2;
SELECT * FROM t1;
a	b	c	d	e
1	aaaa	aaaa	aaaa	aaaa
2	xxxc	xxxb	xxxb	xxxb
3	xxxb_update	xxxc	xxxc	xxxc
4	xxxa_update	xxxa	xxxa	xxxa
5	zzzz	zzzz	zzzz	zzzz
6	NULL	NULL	xxxa	xxxa
7	zxxx	zxxx	zxxx	zxxx
8	axxx	axxx	axxx	axxx
9	zaaz	zaaz	zaaz	zaaz
10	zbbz	zbbz	zbbz	zbbz
replace into t1 values(1,'aaaa','aaaa','aaaa','aaaa'),(2,'xxxc','xxxb','xxxb','xxxb'),(3,'xxxb','xxxc','xxxc','xxxc'),(4,'xxxa','xxxa','xxxa','xxxa'),(5,'zzzz','zzzz','zzzz','zzzz'),(6,NULL,NULL,'xxxa','xxxa'),(7,'zxxx','zxxx','zxxx','zxxx'),(8,'axxx','axxx','axxx','axxx'),(9,'zaaz','zaaz','zaaz','zaaz'),(10,'zbbz','zbbz','zbbz','zbbz');
UPDATE t1 SET b=CONCAT(b,'_update') WHERE b like 'xxx_%%%%%%%%%%%%%%%%%%%%%%%%%%%%%%%%%%%' ESCAPE 'x' LIMIT 2;
SELECT * FROM t1;
a	b	c	d	e
1	aaaa	aaaa	aaaa	aaaa
2	xxxc	xxxb	xxxb	xxxb
3	xxxb	xxxc	xxxc	xxxc
4	xxxa	xxxa	xxxa	xxxa
5	zzzz	zzzz	zzzz	zzzz
6	NULL	NULL	xxxa	xxxa
7	zxxx	zxxx	zxxx	zxxx
8	axxx	axxx	axxx	axxx
9	zaaz	zaaz	zaaz	zaaz
10	zbbz	zbbz	zbbz	zbbz
replace into t1 values(1,'aaaa','aaaa','aaaa','aaaa'),(2,'xxxc','xxxb','xxxb','xxxb'),(3,'xxxb','xxxc','xxxc','xxxc'),(4,'xxxa','xxxa','xxxa','xxxa'),(5,'zzzz','zzzz','zzzz','zzzz'),(6,NULL,NULL,'xxxa','xxxa'),(7,'zxxx','zxxx','zxxx','zxxx'),(8,'axxx','axxx','axxx','axxx'),(9,'zaaz','zaaz','zaaz','zaaz'),(10,'zbbz','zbbz','zbbz','zbbz');
UPDATE t1 SET b=CONCAT(b,'_update') WHERE b like '%%%%%%%%%%%%%%%%%%%%%%%%%%%%%%%%%%%xxx%' ESCAPE 'a' LIMIT 2;
SELECT * FROM t1;
a	b	c	d	e
1	aaaa	aaaa	aaaa	aaaa
2	xxxc	xxxb	xxxb	xxxb
3	xxxb	xxxc	xxxc	xxxc
4	xxxa_update	xxxa	xxxa	xxxa
5	zzzz	zzzz	zzzz	zzzz
6	NULL	NULL	xxxa	xxxa
7	zxxx	zxxx	zxxx	zxxx
8	axxx_update	axxx	axxx	axxx
9	zaaz	zaaz	zaaz	zaaz
10	zbbz	zbbz	zbbz	zbbz
replace into t1 values(1,'aaaa','aaaa','aaaa','aaaa'),(2,'xxxc','xxxb','xxxb','xxxb'),(3,'xxxb','xxxc','xxxc','xxxc'),(4,'xxxa','xxxa','xxxa','xxxa'),(5,'zzzz','zzzz','zzzz','zzzz'),(6,NULL,NULL,'xxxa','xxxa'),(7,'zxxx','zxxx','zxxx','zxxx'),(8,'axxx','axxx','axxx','axxx'),(9,'zaaz','zaaz','zaaz','zaaz'),(10,'zbbz','zbbz','zbbz','zbbz');
UPDATE t1 SET b=CONCAT(b,'_update') WHERE b NOT like 'xxyyyyyyyyyyyyyyyyyyyyyyyyyyyyyyyyyyy%' LIMIT 2;
SELECT * FROM t1;
a	b	c	d	e
1	aaaa_update	aaaa	aaaa	aaaa
2	xxxc_update	xxxb	xxxb	xxxb
3	xxxb	xxxc	xxxc	xxxc
4	xxxa	xxxa	xxxa	xxxa
5	zzzz	zzzz	zzzz	zzzz
6	NULL	NULL	xxxa	xxxa
7	zxxx	zxxx	zxxx	zxxx
8	axxx	axxx	axxx	axxx
9	zaaz	zaaz	zaaz	zaaz
10	zbbz	zbbz	zbbz	zbbz
replace into t1 values(1,'aaaa','aaaa','aaaa','aaaa'),(2,'xxxc','xxxb','xxxb','xxxb'),(3,'xxxb','xxxc','xxxc','xxxc'),(4,'xxxa','xxxa','xxxa','xxxa'),(5,'zzzz','zzzz','zzzz','zzzz'),(6,NULL,NULL,'xxxa','xxxa'),(7,'zxxx','zxxx','zxxx','zxxx'),(8,'axxx','axxx','axxx','axxx'),(9,'zaaz','zaaz','zaaz','zaaz'),(10,'zbbz','zbbz','zbbz','zbbz');
UPDATE t1 SET b=CONCAT(b,'_update') WHERE b NOT like 'xxxyyyyyyyyyyyyyyyyyyyyyyyyyyyyyyyyyy%' ESCAPE 'x' LIMIT 2;
SELECT * FROM t1;
a	b	c	d	e
1	aaaa_update	aaaa	aaaa	aaaa
2	xxxc_update	xxxb	xxxb	xxxb
3	xxxb	xxxc	xxxc	xxxc
4	xxxa	xxxa	xxxa	xxxa
5	zzzz	zzzz	zzzz	zzzz
6	NULL	NULL	xxxa	xxxa
7	zxxx	zxxx	zxxx	zxxx
8	axxx	axxx	axxx	axxx
9	zaaz	zaaz	zaaz	zaaz
10	zbbz	zbbz	zbbz	zbbz
replace into t1 values(1,'aaaa','aaaa','aaaa','aaaa'),(2,'xxxc','xxxb','xxxb','xxxb'),(3,'xxxb','xxxc','xxxc','xxxc'),(4,'xxxa','xxxa','xxxa','xxxa'),(5,'zzzz','zzzz','zzzz','zzzz'),(6,NULL,NULL,'xxxa','xxxa'),(7,'zxxx','zxxx','zxxx','zxxx'),(8,'axxx','axxx','axxx','axxx'),(9,'zaaz','zaaz','zaaz','zaaz'),(10,'zbbz','zbbz','zbbz','zbbz');
UPDATE t1 SET b=CONCAT(b,'_update') WHERE b NOT like 'xxxyyyyyyyyyyyyyyyyyyyyyyyyyyyyyyyyyyyy%' ESCAPE 'a' LIMIT 2;
SELECT * FROM t1;
a	b	c	d	e
1	aaaa_update	aaaa	aaaa	aaaa
2	xxxc_update	xxxb	xxxb	xxxb
3	xxxb	xxxc	xxxc	xxxc
4	xxxa	xxxa	xxxa	xxxa
5	zzzz	zzzz	zzzz	zzzz
6	NULL	NULL	xxxa	xxxa
7	zxxx	zxxx	zxxx	zxxx
8	axxx	axxx	axxx	axxx
9	zaaz	zaaz	zaaz	zaaz
10	zbbz	zbbz	zbbz	zbbz
-- 涉及类型转换
replace into t1 values(1,'aaaa','aaaa','aaaa','aaaa'),(2,'xxxc','xxxb','xxxb','xxxb'),(3,'xxxb','xxxc','xxxc','xxxc'),(4,'xxxa','xxxa','xxxa','xxxa'),(5,'zzzz','zzzz','zzzz','zzzz'),(6,NULL,NULL,'xxxa','xxxa'),(7,'zxxx','zxxx','zxxx','zxxx'),(8,'axxx','axxx','axxx','axxx'),(9,'zaaz','zaaz','zaaz','zaaz'),(10,'zbbz','zbbz','zbbz','zbbz');
UPDATE t1 SET b=CONCAT(b,'_update') WHERE a like 'xxx%' LIMIT 2;
SELECT * FROM t1;
a	b	c	d	e
1	aaaa	aaaa	aaaa	aaaa
2	xxxc	xxxb	xxxb	xxxb
3	xxxb	xxxc	xxxc	xxxc
4	xxxa	xxxa	xxxa	xxxa
5	zzzz	zzzz	zzzz	zzzz
6	NULL	NULL	xxxa	xxxa
7	zxxx	zxxx	zxxx	zxxx
8	axxx	axxx	axxx	axxx
9	zaaz	zaaz	zaaz	zaaz
10	zbbz	zbbz	zbbz	zbbz
replace into t1 values(1,'aaaa','aaaa','aaaa','aaaa'),(2,'xxxc','xxxb','xxxb','xxxb'),(3,'xxxb','xxxc','xxxc','xxxc'),(4,'xxxa','xxxa','xxxa','xxxa'),(5,'zzzz','zzzz','zzzz','zzzz'),(6,NULL,NULL,'xxxa','xxxa'),(7,'zxxx','zxxx','zxxx','zxxx'),(8,'axxx','axxx','axxx','axxx'),(9,'zaaz','zaaz','zaaz','zaaz'),(10,'zbbz','zbbz','zbbz','zbbz');
UPDATE t1 SET b=CONCAT(b,'_update') WHERE b like 12345 LIMIT 2;
SELECT * FROM t1;
a	b	c	d	e
1	aaaa	aaaa	aaaa	aaaa
2	xxxc	xxxb	xxxb	xxxb
3	xxxb	xxxc	xxxc	xxxc
4	xxxa	xxxa	xxxa	xxxa
5	zzzz	zzzz	zzzz	zzzz
6	NULL	NULL	xxxa	xxxa
7	zxxx	zxxx	zxxx	zxxx
8	axxx	axxx	axxx	axxx
9	zaaz	zaaz	zaaz	zaaz
10	zbbz	zbbz	zbbz	zbbz
-- having语句中测试like ‘xxx%’走索引
-- 边界值测试
replace into t1 values(1,'aaaa','aaaa','aaaa','aaaa'),(2,'xxxc','xxxb','xxxb','xxxb'),(3,'xxxb','xxxc','xxxc','xxxc'),(4,'xxxa','xxxa','xxxa','xxxa'),(5,'zzzz','zzzz','zzzz','zzzz'),(6,NULL,NULL,'xxxa','xxxa'),(7,'zxxx','zxxx','zxxx','zxxx'),(8,'axxx','axxx','axxx','axxx'),(9,'zaaz','zaaz','zaaz','zaaz'),(10,'zbbz','zbbz','zbbz','zbbz');
UPDATE t1 SET b=CONCAT(b,'_update') WHERE b like hex('xxx%') LIMIT 2;
SELECT * FROM t1;
a	b	c	d	e
1	aaaa	aaaa	aaaa	aaaa
2	xxxc	xxxb	xxxb	xxxb
3	xxxb	xxxc	xxxc	xxxc
4	xxxa	xxxa	xxxa	xxxa
5	zzzz	zzzz	zzzz	zzzz
6	NULL	NULL	xxxa	xxxa
7	zxxx	zxxx	zxxx	zxxx
8	axxx	axxx	axxx	axxx
9	zaaz	zaaz	zaaz	zaaz
10	zbbz	zbbz	zbbz	zbbz
replace into t1 values(1,'aaaa','aaaa','aaaa','aaaa'),(2,'xxxc','xxxb','xxxb','xxxb'),(3,'xxxb','xxxc','xxxc','xxxc'),(4,'xxxa','xxxa','xxxa','xxxa'),(5,'zzzz','zzzz','zzzz','zzzz'),(6,NULL,NULL,'xxxa','xxxa'),(7,'zxxx','zxxx','zxxx','zxxx'),(8,'axxx','axxx','axxx','axxx'),(9,'zaaz','zaaz','zaaz','zaaz'),(10,'zbbz','zbbz','zbbz','zbbz');
UPDATE t1 SET b=CONCAT(b,'_update') WHERE b like hex('xxx%') ESCAPE 'x' LIMIT 2;
SELECT * FROM t1;
a	b	c	d	e
1	aaaa	aaaa	aaaa	aaaa
2	xxxc	xxxb	xxxb	xxxb
3	xxxb	xxxc	xxxc	xxxc
4	xxxa	xxxa	xxxa	xxxa
5	zzzz	zzzz	zzzz	zzzz
6	NULL	NULL	xxxa	xxxa
7	zxxx	zxxx	zxxx	zxxx
8	axxx	axxx	axxx	axxx
9	zaaz	zaaz	zaaz	zaaz
10	zbbz	zbbz	zbbz	zbbz
replace into t1 values(1,'aaaa','aaaa','aaaa','aaaa'),(2,'xxxc','xxxb','xxxb','xxxb'),(3,'xxxb','xxxc','xxxc','xxxc'),(4,'xxxa','xxxa','xxxa','xxxa'),(5,'zzzz','zzzz','zzzz','zzzz'),(6,NULL,NULL,'xxxa','xxxa'),(7,'zxxx','zxxx','zxxx','zxxx'),(8,'axxx','axxx','axxx','axxx'),(9,'zaaz','zaaz','zaaz','zaaz'),(10,'zbbz','zbbz','zbbz','zbbz');
UPDATE t1 SET b=CONCAT(b,'_update') WHERE b like hex('xxx%') ESCAPE 'a' LIMIT 2;
SELECT * FROM t1;
a	b	c	d	e
1	aaaa	aaaa	aaaa	aaaa
2	xxxc	xxxb	xxxb	xxxb
3	xxxb	xxxc	xxxc	xxxc
4	xxxa	xxxa	xxxa	xxxa
5	zzzz	zzzz	zzzz	zzzz
6	NULL	NULL	xxxa	xxxa
7	zxxx	zxxx	zxxx	zxxx
8	axxx	axxx	axxx	axxx
9	zaaz	zaaz	zaaz	zaaz
10	zbbz	zbbz	zbbz	zbbz
replace into t1 values(1,'aaaa','aaaa','aaaa','aaaa'),(2,'xxxc','xxxb','xxxb','xxxb'),(3,'xxxb','xxxc','xxxc','xxxc'),(4,'xxxa','xxxa','xxxa','xxxa'),(5,'zzzz','zzzz','zzzz','zzzz'),(6,NULL,NULL,'xxxa','xxxa'),(7,'zxxx','zxxx','zxxx','zxxx'),(8,'axxx','axxx','axxx','axxx'),(9,'zaaz','zaaz','zaaz','zaaz'),(10,'zbbz','zbbz','zbbz','zbbz');
UPDATE t1 SET b=CONCAT(b,'_update') WHERE b NOT like hex('xxx%') LIMIT 2;
SELECT * FROM t1;
a	b	c	d	e
1	aaaa_update	aaaa	aaaa	aaaa
2	xxxc_update	xxxb	xxxb	xxxb
3	xxxb	xxxc	xxxc	xxxc
4	xxxa	xxxa	xxxa	xxxa
5	zzzz	zzzz	zzzz	zzzz
6	NULL	NULL	xxxa	xxxa
7	zxxx	zxxx	zxxx	zxxx
8	axxx	axxx	axxx	axxx
9	zaaz	zaaz	zaaz	zaaz
10	zbbz	zbbz	zbbz	zbbz
replace into t1 values(1,'aaaa','aaaa','aaaa','aaaa'),(2,'xxxc','xxxb','xxxb','xxxb'),(3,'xxxb','xxxc','xxxc','xxxc'),(4,'xxxa','xxxa','xxxa','xxxa'),(5,'zzzz','zzzz','zzzz','zzzz'),(6,NULL,NULL,'xxxa','xxxa'),(7,'zxxx','zxxx','zxxx','zxxx'),(8,'axxx','axxx','axxx','axxx'),(9,'zaaz','zaaz','zaaz','zaaz'),(10,'zbbz','zbbz','zbbz','zbbz');
UPDATE t1 SET b=CONCAT(b,'_update') WHERE b NOT like hex('xxx%') ESCAPE 'x' LIMIT 2;
SELECT * FROM t1;
a	b	c	d	e
1	aaaa_update	aaaa	aaaa	aaaa
2	xxxc_update	xxxb	xxxb	xxxb
3	xxxb	xxxc	xxxc	xxxc
4	xxxa	xxxa	xxxa	xxxa
5	zzzz	zzzz	zzzz	zzzz
6	NULL	NULL	xxxa	xxxa
7	zxxx	zxxx	zxxx	zxxx
8	axxx	axxx	axxx	axxx
9	zaaz	zaaz	zaaz	zaaz
10	zbbz	zbbz	zbbz	zbbz
replace into t1 values(1,'aaaa','aaaa','aaaa','aaaa'),(2,'xxxc','xxxb','xxxb','xxxb'),(3,'xxxb','xxxc','xxxc','xxxc'),(4,'xxxa','xxxa','xxxa','xxxa'),(5,'zzzz','zzzz','zzzz','zzzz'),(6,NULL,NULL,'xxxa','xxxa'),(7,'zxxx','zxxx','zxxx','zxxx'),(8,'axxx','axxx','axxx','axxx'),(9,'zaaz','zaaz','zaaz','zaaz'),(10,'zbbz','zbbz','zbbz','zbbz');
UPDATE t1 SET b=CONCAT(b,'_update') WHERE b NOT like hex('xxx%') ESCAPE 'a' LIMIT 2;
SELECT * FROM t1;
a	b	c	d	e
1	aaaa_update	aaaa	aaaa	aaaa
2	xxxc_update	xxxb	xxxb	xxxb
3	xxxb	xxxc	xxxc	xxxc
4	xxxa	xxxa	xxxa	xxxa
5	zzzz	zzzz	zzzz	zzzz
6	NULL	NULL	xxxa	xxxa
7	zxxx	zxxx	zxxx	zxxx
8	axxx	axxx	axxx	axxx
9	zaaz	zaaz	zaaz	zaaz
10	zbbz	zbbz	zbbz	zbbz
replace into t1 values(1,'aaaa','aaaa','aaaa','aaaa'),(2,'xxxc','xxxb','xxxb','xxxb'),(3,'xxxb','xxxc','xxxc','xxxc'),(4,'xxxa','xxxa','xxxa','xxxa'),(5,'zzzz','zzzz','zzzz','zzzz'),(6,NULL,NULL,'xxxa','xxxa'),(7,'zxxx','zxxx','zxxx','zxxx'),(8,'axxx','axxx','axxx','axxx'),(9,'zaaz','zaaz','zaaz','zaaz'),(10,'zbbz','zbbz','zbbz','zbbz');
UPDATE t1 SET b=CONCAT(b,'_update') WHERE b like X'78787825' ESCAPE X'0f' LIMIT 2;
replace into t1 values(1,'aaaa','aaaa','aaaa','aaaa'),(2,'xxxc','xxxb','xxxb','xxxb'),(3,'xxxb','xxxc','xxxc','xxxc'),(4,'xxxa','xxxa','xxxa','xxxa'),(5,'zzzz','zzzz','zzzz','zzzz'),(6,NULL,NULL,'xxxa','xxxa'),(7,'zxxx','zxxx','zxxx','zxxx'),(8,'axxx','axxx','axxx','axxx'),(9,'zaaz','zaaz','zaaz','zaaz'),(10,'zbbz','zbbz','zbbz','zbbz');
UPDATE t1 SET b=CONCAT(b,'_update') WHERE b like X'78787825' ESCAPE X'00' LIMIT 2;
replace into t1 values(1,'aaaa','aaaa','aaaa','aaaa'),(2,'xxxc','xxxb','xxxb','xxxb'),(3,'xxxb','xxxc','xxxc','xxxc'),(4,'xxxa','xxxa','xxxa','xxxa'),(5,'zzzz','zzzz','zzzz','zzzz'),(6,NULL,NULL,'xxxa','xxxa'),(7,'zxxx','zxxx','zxxx','zxxx'),(8,'axxx','axxx','axxx','axxx'),(9,'zaaz','zaaz','zaaz','zaaz'),(10,'zbbz','zbbz','zbbz','zbbz');
UPDATE t1 SET b=CONCAT(b,'_update') WHERE b like X'78787825' ESCAPE X'ff' LIMIT 2;
replace into t1 values(1,'aaaa','aaaa','aaaa','aaaa'),(2,'xxxc','xxxb','xxxb','xxxb'),(3,'xxxb','xxxc','xxxc','xxxc'),(4,'xxxa','xxxa','xxxa','xxxa'),(5,'zzzz','zzzz','zzzz','zzzz'),(6,NULL,NULL,'xxxa','xxxa'),(7,'zxxx','zxxx','zxxx','zxxx'),(8,'axxx','axxx','axxx','axxx'),(9,'zaaz','zaaz','zaaz','zaaz'),(10,'zbbz','zbbz','zbbz','zbbz');
UPDATE t1 SET b=CONCAT(b,'_update') WHERE b like X'78787825' ESCAPE X'78' LIMIT 2;
replace into t1 values(1,'aaaa','aaaa','aaaa','aaaa'),(2,'xxxc','xxxb','xxxb','xxxb'),(3,'xxxb','xxxc','xxxc','xxxc'),(4,'xxxa','xxxa','xxxa','xxxa'),(5,'zzzz','zzzz','zzzz','zzzz'),(6,NULL,NULL,'xxxa','xxxa'),(7,'zxxx','zxxx','zxxx','zxxx'),(8,'axxx','axxx','axxx','axxx'),(9,'zaaz','zaaz','zaaz','zaaz'),(10,'zbbz','zbbz','zbbz','zbbz');
UPDATE t1 SET b=CONCAT(b,'_update') WHERE b like X'78787825' ESCAPE X'25' LIMIT 2;
replace into t1 values(1,'aaaa','aaaa','aaaa','aaaa'),(2,'xxxc','xxxb','xxxb','xxxb'),(3,'xxxb','xxxc','xxxc','xxxc'),(4,'xxxa','xxxa','xxxa','xxxa'),(5,'zzzz','zzzz','zzzz','zzzz'),(6,NULL,NULL,'xxxa','xxxa'),(7,'zxxx','zxxx','zxxx','zxxx'),(8,'axxx','axxx','axxx','axxx'),(9,'zaaz','zaaz','zaaz','zaaz'),(10,'zbbz','zbbz','zbbz','zbbz');
UPDATE t1 SET b=CONCAT(b,'_update') WHERE b like X'0000' ESCAPE '0' LIMIT 2;
SELECT * FROM t1;
a	b	c	d	e
1	aaaa	aaaa	aaaa	aaaa
2	xxxc	xxxb	xxxb	xxxb
3	xxxb	xxxc	xxxc	xxxc
4	xxxa	xxxa	xxxa	xxxa
5	zzzz	zzzz	zzzz	zzzz
6	NULL	NULL	xxxa	xxxa
7	zxxx	zxxx	zxxx	zxxx
8	axxx	axxx	axxx	axxx
9	zaaz	zaaz	zaaz	zaaz
10	zbbz	zbbz	zbbz	zbbz
replace into t1 values(1,'aaaa','aaaa','aaaa','aaaa'),(2,'xxxc','xxxb','xxxb','xxxb'),(3,'xxxb','xxxc','xxxc','xxxc'),(4,'xxxa','xxxa','xxxa','xxxa'),(5,'zzzz','zzzz','zzzz','zzzz'),(6,NULL,NULL,'xxxa','xxxa'),(7,'zxxx','zxxx','zxxx','zxxx'),(8,'axxx','axxx','axxx','axxx'),(9,'zaaz','zaaz','zaaz','zaaz'),(10,'zbbz','zbbz','zbbz','zbbz');
UPDATE t1 SET b=CONCAT(b,'_update') WHERE b like X'00000000' ESCAPE '0' LIMIT 2;
SELECT * FROM t1;
a	b	c	d	e
1	aaaa	aaaa	aaaa	aaaa
2	xxxc	xxxb	xxxb	xxxb
3	xxxb	xxxc	xxxc	xxxc
4	xxxa	xxxa	xxxa	xxxa
5	zzzz	zzzz	zzzz	zzzz
6	NULL	NULL	xxxa	xxxa
7	zxxx	zxxx	zxxx	zxxx
8	axxx	axxx	axxx	axxx
9	zaaz	zaaz	zaaz	zaaz
10	zbbz	zbbz	zbbz	zbbz
replace into t1 values(1,'aaaa','aaaa','aaaa','aaaa'),(2,'xxxc','xxxb','xxxb','xxxb'),(3,'xxxb','xxxc','xxxc','xxxc'),(4,'xxxa','xxxa','xxxa','xxxa'),(5,'zzzz','zzzz','zzzz','zzzz'),(6,NULL,NULL,'xxxa','xxxa'),(7,'zxxx','zxxx','zxxx','zxxx'),(8,'axxx','axxx','axxx','axxx'),(9,'zaaz','zaaz','zaaz','zaaz'),(10,'zbbz','zbbz','zbbz','zbbz');
UPDATE t1 SET b=CONCAT(b,'_update') WHERE b like X'ffff' ESCAPE 'f' LIMIT 2;
SELECT * FROM t1;
a	b	c	d	e
1	aaaa	aaaa	aaaa	aaaa
2	xxxc	xxxb	xxxb	xxxb
3	xxxb	xxxc	xxxc	xxxc
4	xxxa	xxxa	xxxa	xxxa
5	zzzz	zzzz	zzzz	zzzz
6	NULL	NULL	xxxa	xxxa
7	zxxx	zxxx	zxxx	zxxx
8	axxx	axxx	axxx	axxx
9	zaaz	zaaz	zaaz	zaaz
10	zbbz	zbbz	zbbz	zbbz
replace into t1 values(1,'aaaa','aaaa','aaaa','aaaa'),(2,'xxxc','xxxb','xxxb','xxxb'),(3,'xxxb','xxxc','xxxc','xxxc'),(4,'xxxa','xxxa','xxxa','xxxa'),(5,'zzzz','zzzz','zzzz','zzzz'),(6,NULL,NULL,'xxxa','xxxa'),(7,'zxxx','zxxx','zxxx','zxxx'),(8,'axxx','axxx','axxx','axxx'),(9,'zaaz','zaaz','zaaz','zaaz'),(10,'zbbz','zbbz','zbbz','zbbz');
UPDATE t1 SET b=CONCAT(b,'_update') WHERE b like X'ffffffff' ESCAPE 'f' LIMIT 2;
SELECT * FROM t1;
a	b	c	d	e
1	aaaa	aaaa	aaaa	aaaa
2	xxxc	xxxb	xxxb	xxxb
3	xxxb	xxxc	xxxc	xxxc
4	xxxa	xxxa	xxxa	xxxa
5	zzzz	zzzz	zzzz	zzzz
6	NULL	NULL	xxxa	xxxa
7	zxxx	zxxx	zxxx	zxxx
8	axxx	axxx	axxx	axxx
9	zaaz	zaaz	zaaz	zaaz
10	zbbz	zbbz	zbbz	zbbz
replace into t1 values(1,'aaaa','aaaa','aaaa','aaaa'),(2,'xxxc','xxxb','xxxb','xxxb'),(3,'xxxb','xxxc','xxxc','xxxc'),(4,'xxxa','xxxa','xxxa','xxxa'),(5,'zzzz','zzzz','zzzz','zzzz'),(6,NULL,NULL,'xxxa','xxxa'),(7,'zxxx','zxxx','zxxx','zxxx'),(8,'axxx','axxx','axxx','axxx'),(9,'zaaz','zaaz','zaaz','zaaz'),(10,'zbbz','zbbz','zbbz','zbbz');
UPDATE t1 SET b=CONCAT(b,'_update') WHERE b like X'ff0000ff' ESCAPE 'f' LIMIT 2;
SELECT * FROM t1;
a	b	c	d	e
1	aaaa	aaaa	aaaa	aaaa
2	xxxc	xxxb	xxxb	xxxb
3	xxxb	xxxc	xxxc	xxxc
4	xxxa	xxxa	xxxa	xxxa
5	zzzz	zzzz	zzzz	zzzz
6	NULL	NULL	xxxa	xxxa
7	zxxx	zxxx	zxxx	zxxx
8	axxx	axxx	axxx	axxx
9	zaaz	zaaz	zaaz	zaaz
10	zbbz	zbbz	zbbz	zbbz
replace into t1 values(1,'aaaa','aaaa','aaaa','aaaa'),(2,'xxxc','xxxb','xxxb','xxxb'),(3,'xxxb','xxxc','xxxc','xxxc'),(4,'xxxa','xxxa','xxxa','xxxa'),(5,'zzzz','zzzz','zzzz','zzzz'),(6,NULL,NULL,'xxxa','xxxa'),(7,'zxxx','zxxx','zxxx','zxxx'),(8,'axxx','axxx','axxx','axxx'),(9,'zaaz','zaaz','zaaz','zaaz'),(10,'zbbz','zbbz','zbbz','zbbz');
UPDATE t1 SET b=CONCAT(b,'_update') WHERE b like X'78787825' ESCAPE 'f' LIMIT 2;
SELECT * FROM t1;
a	b	c	d	e
1	aaaa	aaaa	aaaa	aaaa
2	xxxc	xxxb	xxxb	xxxb
3	xxxb_update	xxxc	xxxc	xxxc
4	xxxa_update	xxxa	xxxa	xxxa
5	zzzz	zzzz	zzzz	zzzz
6	NULL	NULL	xxxa	xxxa
7	zxxx	zxxx	zxxx	zxxx
8	axxx	axxx	axxx	axxx
9	zaaz	zaaz	zaaz	zaaz
10	zbbz	zbbz	zbbz	zbbz
replace into t1 values(1,'aaaa','aaaa','aaaa','aaaa'),(2,'xxxc','xxxb','xxxb','xxxb'),(3,'xxxb','xxxc','xxxc','xxxc'),(4,'xxxa','xxxa','xxxa','xxxa'),(5,'zzzz','zzzz','zzzz','zzzz'),(6,NULL,NULL,'xxxa','xxxa'),(7,'zxxx','zxxx','zxxx','zxxx'),(8,'axxx','axxx','axxx','axxx'),(9,'zaaz','zaaz','zaaz','zaaz'),(10,'zbbz','zbbz','zbbz','zbbz');
UPDATE t1 SET b=CONCAT(b,'_update') WHERE b like X'78787825' ESCAPE '0' LIMIT 2;
SELECT * FROM t1;
a	b	c	d	e
1	aaaa	aaaa	aaaa	aaaa
2	xxxc	xxxb	xxxb	xxxb
3	xxxb_update	xxxc	xxxc	xxxc
4	xxxa_update	xxxa	xxxa	xxxa
5	zzzz	zzzz	zzzz	zzzz
6	NULL	NULL	xxxa	xxxa
7	zxxx	zxxx	zxxx	zxxx
8	axxx	axxx	axxx	axxx
9	zaaz	zaaz	zaaz	zaaz
10	zbbz	zbbz	zbbz	zbbz
replace into t1 values(1,'aaaa','aaaa','aaaa','aaaa'),(2,'xxxc','xxxb','xxxb','xxxb'),(3,'xxxb','xxxc','xxxc','xxxc'),(4,'xxxa','xxxa','xxxa','xxxa'),(5,'zzzz','zzzz','zzzz','zzzz'),(6,NULL,NULL,'xxxa','xxxa'),(7,'zxxx','zxxx','zxxx','zxxx'),(8,'axxx','axxx','axxx','axxx'),(9,'zaaz','zaaz','zaaz','zaaz'),(10,'zbbz','zbbz','zbbz','zbbz');
UPDATE t1 SET b=CONCAT(b,'_update') WHERE b like X'78787825' ESCAPE 'f' LIMIT 2;
SELECT * FROM t1;
a	b	c	d	e
1	aaaa	aaaa	aaaa	aaaa
2	xxxc	xxxb	xxxb	xxxb
3	xxxb_update	xxxc	xxxc	xxxc
4	xxxa_update	xxxa	xxxa	xxxa
5	zzzz	zzzz	zzzz	zzzz
6	NULL	NULL	xxxa	xxxa
7	zxxx	zxxx	zxxx	zxxx
8	axxx	axxx	axxx	axxx
9	zaaz	zaaz	zaaz	zaaz
10	zbbz	zbbz	zbbz	zbbz
replace into t1 values(1,'aaaa','aaaa','aaaa','aaaa'),(2,'xxxc','xxxb','xxxb','xxxb'),(3,'xxxb','xxxc','xxxc','xxxc'),(4,'xxxa','xxxa','xxxa','xxxa'),(5,'zzzz','zzzz','zzzz','zzzz'),(6,NULL,NULL,'xxxa','xxxa'),(7,'zxxx','zxxx','zxxx','zxxx'),(8,'axxx','axxx','axxx','axxx'),(9,'zaaz','zaaz','zaaz','zaaz'),(10,'zbbz','zbbz','zbbz','zbbz');
UPDATE t1 SET b=CONCAT(b,'_update') WHERE b like X'78787825' ESCAPE '8' LIMIT 2;
SELECT * FROM t1;
a	b	c	d	e
1	aaaa	aaaa	aaaa	aaaa
2	xxxc	xxxb	xxxb	xxxb
3	xxxb_update	xxxc	xxxc	xxxc
4	xxxa_update	xxxa	xxxa	xxxa
5	zzzz	zzzz	zzzz	zzzz
6	NULL	NULL	xxxa	xxxa
7	zxxx	zxxx	zxxx	zxxx
8	axxx	axxx	axxx	axxx
9	zaaz	zaaz	zaaz	zaaz
10	zbbz	zbbz	zbbz	zbbz
replace into t1 values(1,'aaaa','aaaa','aaaa','aaaa'),(2,'xxxc','xxxb','xxxb','xxxb'),(3,'xxxb','xxxc','xxxc','xxxc'),(4,'xxxa','xxxa','xxxa','xxxa'),(5,'zzzz','zzzz','zzzz','zzzz'),(6,NULL,NULL,'xxxa','xxxa'),(7,'zxxx','zxxx','zxxx','zxxx'),(8,'axxx','axxx','axxx','axxx'),(9,'zaaz','zaaz','zaaz','zaaz'),(10,'zbbz','zbbz','zbbz','zbbz');
UPDATE t1 SET b=CONCAT(b,'_update') WHERE b like X'78787825' ESCAPE '5' LIMIT 2;
SELECT * FROM t1;
a	b	c	d	e
1	aaaa	aaaa	aaaa	aaaa
2	xxxc	xxxb	xxxb	xxxb
3	xxxb_update	xxxc	xxxc	xxxc
4	xxxa_update	xxxa	xxxa	xxxa
5	zzzz	zzzz	zzzz	zzzz
6	NULL	NULL	xxxa	xxxa
7	zxxx	zxxx	zxxx	zxxx
8	axxx	axxx	axxx	axxx
9	zaaz	zaaz	zaaz	zaaz
10	zbbz	zbbz	zbbz	zbbz
replace into t1 values(1,'aaaa','aaaa','aaaa','aaaa'),(2,'xxxc','xxxb','xxxb','xxxb'),(3,'xxxb','xxxc','xxxc','xxxc'),(4,'xxxa','xxxa','xxxa','xxxa'),(5,'zzzz','zzzz','zzzz','zzzz'),(6,NULL,NULL,'xxxa','xxxa'),(7,'zxxx','zxxx','zxxx','zxxx'),(8,'axxx','axxx','axxx','axxx'),(9,'zaaz','zaaz','zaaz','zaaz'),(10,'zbbz','zbbz','zbbz','zbbz');
UPDATE t1 SET b=CONCAT(b,'_update') WHERE b NOT like X'0000' ESCAPE '0' LIMIT 2;
SELECT * FROM t1;
a	b	c	d	e
1	aaaa_update	aaaa	aaaa	aaaa
2	xxxc_update	xxxb	xxxb	xxxb
3	xxxb	xxxc	xxxc	xxxc
4	xxxa	xxxa	xxxa	xxxa
5	zzzz	zzzz	zzzz	zzzz
6	NULL	NULL	xxxa	xxxa
7	zxxx	zxxx	zxxx	zxxx
8	axxx	axxx	axxx	axxx
9	zaaz	zaaz	zaaz	zaaz
10	zbbz	zbbz	zbbz	zbbz
replace into t1 values(1,'aaaa','aaaa','aaaa','aaaa'),(2,'xxxc','xxxb','xxxb','xxxb'),(3,'xxxb','xxxc','xxxc','xxxc'),(4,'xxxa','xxxa','xxxa','xxxa'),(5,'zzzz','zzzz','zzzz','zzzz'),(6,NULL,NULL,'xxxa','xxxa'),(7,'zxxx','zxxx','zxxx','zxxx'),(8,'axxx','axxx','axxx','axxx'),(9,'zaaz','zaaz','zaaz','zaaz'),(10,'zbbz','zbbz','zbbz','zbbz');
UPDATE t1 SET b=CONCAT(b,'_update') WHERE b NOT like X'00000000' ESCAPE '0' LIMIT 2;
SELECT * FROM t1;
a	b	c	d	e
1	aaaa_update	aaaa	aaaa	aaaa
2	xxxc_update	xxxb	xxxb	xxxb
3	xxxb	xxxc	xxxc	xxxc
4	xxxa	xxxa	xxxa	xxxa
5	zzzz	zzzz	zzzz	zzzz
6	NULL	NULL	xxxa	xxxa
7	zxxx	zxxx	zxxx	zxxx
8	axxx	axxx	axxx	axxx
9	zaaz	zaaz	zaaz	zaaz
10	zbbz	zbbz	zbbz	zbbz
replace into t1 values(1,'aaaa','aaaa','aaaa','aaaa'),(2,'xxxc','xxxb','xxxb','xxxb'),(3,'xxxb','xxxc','xxxc','xxxc'),(4,'xxxa','xxxa','xxxa','xxxa'),(5,'zzzz','zzzz','zzzz','zzzz'),(6,NULL,NULL,'xxxa','xxxa'),(7,'zxxx','zxxx','zxxx','zxxx'),(8,'axxx','axxx','axxx','axxx'),(9,'zaaz','zaaz','zaaz','zaaz'),(10,'zbbz','zbbz','zbbz','zbbz');
UPDATE t1 SET b=CONCAT(b,'_update') WHERE b NOT like X'ffff' ESCAPE 'f' LIMIT 2;
SELECT * FROM t1;
a	b	c	d	e
1	aaaa_update	aaaa	aaaa	aaaa
2	xxxc_update	xxxb	xxxb	xxxb
3	xxxb	xxxc	xxxc	xxxc
4	xxxa	xxxa	xxxa	xxxa
5	zzzz	zzzz	zzzz	zzzz
6	NULL	NULL	xxxa	xxxa
7	zxxx	zxxx	zxxx	zxxx
8	axxx	axxx	axxx	axxx
9	zaaz	zaaz	zaaz	zaaz
10	zbbz	zbbz	zbbz	zbbz
replace into t1 values(1,'aaaa','aaaa','aaaa','aaaa'),(2,'xxxc','xxxb','xxxb','xxxb'),(3,'xxxb','xxxc','xxxc','xxxc'),(4,'xxxa','xxxa','xxxa','xxxa'),(5,'zzzz','zzzz','zzzz','zzzz'),(6,NULL,NULL,'xxxa','xxxa'),(7,'zxxx','zxxx','zxxx','zxxx'),(8,'axxx','axxx','axxx','axxx'),(9,'zaaz','zaaz','zaaz','zaaz'),(10,'zbbz','zbbz','zbbz','zbbz');
UPDATE t1 SET b=CONCAT(b,'_update') WHERE b NOT like X'ffffffff' ESCAPE 'f' LIMIT 2;
SELECT * FROM t1;
a	b	c	d	e
1	aaaa_update	aaaa	aaaa	aaaa
2	xxxc_update	xxxb	xxxb	xxxb
3	xxxb	xxxc	xxxc	xxxc
4	xxxa	xxxa	xxxa	xxxa
5	zzzz	zzzz	zzzz	zzzz
6	NULL	NULL	xxxa	xxxa
7	zxxx	zxxx	zxxx	zxxx
8	axxx	axxx	axxx	axxx
9	zaaz	zaaz	zaaz	zaaz
10	zbbz	zbbz	zbbz	zbbz
replace into t1 values(1,'aaaa','aaaa','aaaa','aaaa'),(2,'xxxc','xxxb','xxxb','xxxb'),(3,'xxxb','xxxc','xxxc','xxxc'),(4,'xxxa','xxxa','xxxa','xxxa'),(5,'zzzz','zzzz','zzzz','zzzz'),(6,NULL,NULL,'xxxa','xxxa'),(7,'zxxx','zxxx','zxxx','zxxx'),(8,'axxx','axxx','axxx','axxx'),(9,'zaaz','zaaz','zaaz','zaaz'),(10,'zbbz','zbbz','zbbz','zbbz');
UPDATE t1 SET b=CONCAT(b,'_update') WHERE b NOT like X'ff0000ff' ESCAPE 'f' LIMIT 2;
SELECT * FROM t1;
a	b	c	d	e
1	aaaa_update	aaaa	aaaa	aaaa
2	xxxc_update	xxxb	xxxb	xxxb
3	xxxb	xxxc	xxxc	xxxc
4	xxxa	xxxa	xxxa	xxxa
5	zzzz	zzzz	zzzz	zzzz
6	NULL	NULL	xxxa	xxxa
7	zxxx	zxxx	zxxx	zxxx
8	axxx	axxx	axxx	axxx
9	zaaz	zaaz	zaaz	zaaz
10	zbbz	zbbz	zbbz	zbbz
replace into t1 values(1,'aaaa','aaaa','aaaa','aaaa'),(2,'xxxc','xxxb','xxxb','xxxb'),(3,'xxxb','xxxc','xxxc','xxxc'),(4,'xxxa','xxxa','xxxa','xxxa'),(5,'zzzz','zzzz','zzzz','zzzz'),(6,NULL,NULL,'xxxa','xxxa'),(7,'zxxx','zxxx','zxxx','zxxx'),(8,'axxx','axxx','axxx','axxx'),(9,'zaaz','zaaz','zaaz','zaaz'),(10,'zbbz','zbbz','zbbz','zbbz');
UPDATE t1 SET b=CONCAT(b,'_update') WHERE b NOT like X'78787825' ESCAPE '0' LIMIT 2;
SELECT * FROM t1;
a	b	c	d	e
1	aaaa_update	aaaa	aaaa	aaaa
2	xxxc	xxxb	xxxb	xxxb
3	xxxb	xxxc	xxxc	xxxc
4	xxxa	xxxa	xxxa	xxxa
5	zzzz_update	zzzz	zzzz	zzzz
6	NULL	NULL	xxxa	xxxa
7	zxxx	zxxx	zxxx	zxxx
8	axxx	axxx	axxx	axxx
9	zaaz	zaaz	zaaz	zaaz
10	zbbz	zbbz	zbbz	zbbz
replace into t1 values(1,'aaaa','aaaa','aaaa','aaaa'),(2,'xxxc','xxxb','xxxb','xxxb'),(3,'xxxb','xxxc','xxxc','xxxc'),(4,'xxxa','xxxa','xxxa','xxxa'),(5,'zzzz','zzzz','zzzz','zzzz'),(6,NULL,NULL,'xxxa','xxxa'),(7,'zxxx','zxxx','zxxx','zxxx'),(8,'axxx','axxx','axxx','axxx'),(9,'zaaz','zaaz','zaaz','zaaz'),(10,'zbbz','zbbz','zbbz','zbbz');
UPDATE t1 SET b=CONCAT(b,'_update') WHERE b NOT like X'78787825' ESCAPE 'f' LIMIT 2;
SELECT * FROM t1;
a	b	c	d	e
1	aaaa_update	aaaa	aaaa	aaaa
2	xxxc	xxxb	xxxb	xxxb
3	xxxb	xxxc	xxxc	xxxc
4	xxxa	xxxa	xxxa	xxxa
5	zzzz_update	zzzz	zzzz	zzzz
6	NULL	NULL	xxxa	xxxa
7	zxxx	zxxx	zxxx	zxxx
8	axxx	axxx	axxx	axxx
9	zaaz	zaaz	zaaz	zaaz
10	zbbz	zbbz	zbbz	zbbz
replace into t1 values(1,'aaaa','aaaa','aaaa','aaaa'),(2,'xxxc','xxxb','xxxb','xxxb'),(3,'xxxb','xxxc','xxxc','xxxc'),(4,'xxxa','xxxa','xxxa','xxxa'),(5,'zzzz','zzzz','zzzz','zzzz'),(6,NULL,NULL,'xxxa','xxxa'),(7,'zxxx','zxxx','zxxx','zxxx'),(8,'axxx','axxx','axxx','axxx'),(9,'zaaz','zaaz','zaaz','zaaz'),(10,'zbbz','zbbz','zbbz','zbbz');
UPDATE t1 SET b=CONCAT(b,'_update') WHERE b like X'78787825252525252525252525' ESCAPE 'f' LIMIT 2;
SELECT * FROM t1;
a	b	c	d	e
1	aaaa	aaaa	aaaa	aaaa
2	xxxc	xxxb	xxxb	xxxb
3	xxxb_update	xxxc	xxxc	xxxc
4	xxxa_update	xxxa	xxxa	xxxa
5	zzzz	zzzz	zzzz	zzzz
6	NULL	NULL	xxxa	xxxa
7	zxxx	zxxx	zxxx	zxxx
8	axxx	axxx	axxx	axxx
9	zaaz	zaaz	zaaz	zaaz
10	zbbz	zbbz	zbbz	zbbz
replace into t1 values(1,'aaaa','aaaa','aaaa','aaaa'),(2,'xxxc','xxxb','xxxb','xxxb'),(3,'xxxb','xxxc','xxxc','xxxc'),(4,'xxxa','xxxa','xxxa','xxxa'),(5,'zzzz','zzzz','zzzz','zzzz'),(6,NULL,NULL,'xxxa','xxxa'),(7,'zxxx','zxxx','zxxx','zxxx'),(8,'axxx','axxx','axxx','axxx'),(9,'zaaz','zaaz','zaaz','zaaz'),(10,'zbbz','zbbz','zbbz','zbbz');
UPDATE t1 SET b=CONCAT(b,'_update') WHERE b NOT like X'78787825252525252525252525' ESCAPE 'f' LIMIT 2;
SELECT * FROM t1;
a	b	c	d	e
1	aaaa_update	aaaa	aaaa	aaaa
2	xxxc	xxxb	xxxb	xxxb
3	xxxb	xxxc	xxxc	xxxc
4	xxxa	xxxa	xxxa	xxxa
5	zzzz_update	zzzz	zzzz	zzzz
6	NULL	NULL	xxxa	xxxa
7	zxxx	zxxx	zxxx	zxxx
8	axxx	axxx	axxx	axxx
9	zaaz	zaaz	zaaz	zaaz
10	zbbz	zbbz	zbbz	zbbz
replace into t1 values(1,'aaaa','aaaa','aaaa','aaaa'),(2,'xxxc','xxxb','xxxb','xxxb'),(3,'xxxb','xxxc','xxxc','xxxc'),(4,'xxxa','xxxa','xxxa','xxxa'),(5,'zzzz','zzzz','zzzz','zzzz'),(6,NULL,NULL,'xxxa','xxxa'),(7,'zxxx','zxxx','zxxx','zxxx'),(8,'axxx','axxx','axxx','axxx'),(9,'zaaz','zaaz','zaaz','zaaz'),(10,'zbbz','zbbz','zbbz','zbbz');
UPDATE t1 SET b=CONCAT(b,'_update') WHERE b like 'xxx%%%%%%%%%%' ESCAPE 'f' LIMIT 2;
SELECT * FROM t1;
a	b	c	d	e
1	aaaa	aaaa	aaaa	aaaa
2	xxxc_update	xxxb	xxxb	xxxb
3	xxxb_update	xxxc	xxxc	xxxc
4	xxxa	xxxa	xxxa	xxxa
5	zzzz	zzzz	zzzz	zzzz
6	NULL	NULL	xxxa	xxxa
7	zxxx	zxxx	zxxx	zxxx
8	axxx	axxx	axxx	axxx
9	zaaz	zaaz	zaaz	zaaz
10	zbbz	zbbz	zbbz	zbbz
replace into t1 values(1,'aaaa','aaaa','aaaa','aaaa'),(2,'xxxc','xxxb','xxxb','xxxb'),(3,'xxxb','xxxc','xxxc','xxxc'),(4,'xxxa','xxxa','xxxa','xxxa'),(5,'zzzz','zzzz','zzzz','zzzz'),(6,NULL,NULL,'xxxa','xxxa'),(7,'zxxx','zxxx','zxxx','zxxx'),(8,'axxx','axxx','axxx','axxx'),(9,'zaaz','zaaz','zaaz','zaaz'),(10,'zbbz','zbbz','zbbz','zbbz');
UPDATE t1 SET b=CONCAT(b,'_update') WHERE b NOT like 'xxx%%%%%%%%%%' ESCAPE 'f' LIMIT 2;
SELECT * FROM t1;
a	b	c	d	e
1	aaaa_update	aaaa	aaaa	aaaa
2	xxxc	xxxb	xxxb	xxxb
3	xxxb	xxxc	xxxc	xxxc
4	xxxa	xxxa	xxxa	xxxa
5	zzzz_update	zzzz	zzzz	zzzz
6	NULL	NULL	xxxa	xxxa
7	zxxx	zxxx	zxxx	zxxx
8	axxx	axxx	axxx	axxx
9	zaaz	zaaz	zaaz	zaaz
10	zbbz	zbbz	zbbz	zbbz
replace into t1 values(1,'aaaa','aaaa','aaaa','aaaa'),(2,'xxxc','xxxb','xxxb','xxxb'),(3,'xxxb','xxxc','xxxc','xxxc'),(4,'xxxa','xxxa','xxxa','xxxa'),(5,'zzzz','zzzz','zzzz','zzzz'),(6,NULL,NULL,'xxxa','xxxa'),(7,'zxxx','zxxx','zxxx','zxxx'),(8,'axxx','axxx','axxx','axxx'),(9,'zaaz','zaaz','zaaz','zaaz'),(10,'zbbz','zbbz','zbbz','zbbz');
UPDATE t1 SET b=CONCAT(b,'_update') WHERE b like 'xxx_%%%%%%%%%' ESCAPE 'f' LIMIT 2;
SELECT * FROM t1;
a	b	c	d	e
1	aaaa	aaaa	aaaa	aaaa
2	xxxc_update	xxxb	xxxb	xxxb
3	xxxb_update	xxxc	xxxc	xxxc
4	xxxa	xxxa	xxxa	xxxa
5	zzzz	zzzz	zzzz	zzzz
6	NULL	NULL	xxxa	xxxa
7	zxxx	zxxx	zxxx	zxxx
8	axxx	axxx	axxx	axxx
9	zaaz	zaaz	zaaz	zaaz
10	zbbz	zbbz	zbbz	zbbz
replace into t1 values(1,'aaaa','aaaa','aaaa','aaaa'),(2,'xxxc','xxxb','xxxb','xxxb'),(3,'xxxb','xxxc','xxxc','xxxc'),(4,'xxxa','xxxa','xxxa','xxxa'),(5,'zzzz','zzzz','zzzz','zzzz'),(6,NULL,NULL,'xxxa','xxxa'),(7,'zxxx','zxxx','zxxx','zxxx'),(8,'axxx','axxx','axxx','axxx'),(9,'zaaz','zaaz','zaaz','zaaz'),(10,'zbbz','zbbz','zbbz','zbbz');
UPDATE t1 SET b=CONCAT(b,'_update') WHERE b NOT like 'xxx_%%%%%%%%%' ESCAPE 'f' LIMIT 2;
SELECT * FROM t1;
a	b	c	d	e
1	aaaa_update	aaaa	aaaa	aaaa
2	xxxc	xxxb	xxxb	xxxb
3	xxxb	xxxc	xxxc	xxxc
4	xxxa	xxxa	xxxa	xxxa
5	zzzz_update	zzzz	zzzz	zzzz
6	NULL	NULL	xxxa	xxxa
7	zxxx	zxxx	zxxx	zxxx
8	axxx	axxx	axxx	axxx
9	zaaz	zaaz	zaaz	zaaz
10	zbbz	zbbz	zbbz	zbbz
-- Cover 0x00-FF in like str
EXPLAIN UPDATE t1 SET b=CONCAT(b,'_update') WHERE b like 0x000102030405060708090A0B0C0D0E0F101112131415161718191A1B1C1D0E1F202122232425262728292A2B2C2D0E2F303132333435363738393A3B3C3D0E3F404142434445464748494A4B4C4D0E4F505152535455565758595A5B5C5D0E5F606162636465666768696A6B6C6D0E6F707172737475767778797A7B7C7D0E7F808182838485868788898A8B8C8D0E8F909192939495969798999A9B9C9D0E9FA0A1A2A3A4A5A6A7A8A9AAABACAD0EAFB0B1B2B3B4B5B6B7B8B9BABBBCBD0EBFC0C1C2C3C4C5C6C7C8C9CACBCCCD0ECFD0D1D2D3D4D5D6D7D8D9DADBDCDD0EDFE0E1E2E3E4E5E6E7E8E9EAEBECED0EEFF0F1F2F3F4F5F6F7F8F9FAFBFCFD0EFF  ESCAPE '&' LIMIT 2;
EXPLAIN UPDATE t1 SET b=CONCAT(b,'_update') WHERE b like 0x000102030405060708090A0B0C0D0E0F101112131415161718191A1B1C1D0E1F202122232425262728292A2B2C2D0E2F303132333435363738393A3B3C3D0E3F404142434445464748494A4B4C4D0E4F505152535455565758595A5B5C5D0E5F606162636465666768696A6B6C6D0E6F707172737475767778797A7B7C7D0E7F808182838485868788898A8B8C8D0E8F909192939495969798999A9B9C9D0E9FA0A1A2A3A4A5A6A7A8A9AAABACAD0EAFB0B1B2B3B4B5B6B7B8B9BABBBCBD0EBFC0C1C2C3C4C5C6C7C8C9CACBCCCD0ECFD0D1D2D3D4D5D6D7D8D9DADBDCDD0EDFE0E1E2E3E4E5E6E7E8E9EAEBECED0EEFF0F1F2F3F4F5F6F7F8F9FAFBFCFD0EFF LIMIT 2;
EXPLAIN UPDATE t1 SET b=CONCAT(b,'_update') WHERE b like x'000102030405060708090A0B0C0D0E0F101112131415161718191A1B1C1D0E1F202122232425262728292A2B2C2D0E2F303132333435363738393A3B3C3D0E3F404142434445464748494A4B4C4D0E4F505152535455565758595A5B5C5D0E5F606162636465666768696A6B6C6D0E6F707172737475767778797A7B7C7D0E7F808182838485868788898A8B8C8D0E8F909192939495969798999A9B9C9D0E9FA0A1A2A3A4A5A6A7A8A9AAABACAD0EAFB0B1B2B3B4B5B6B7B8B9BABBBCBD0EBFC0C1C2C3C4C5C6C7C8C9CACBCCCD0ECFD0D1D2D3D4D5D6D7D8D9DADBDCDD0EDFE0E1E2E3E4E5E6E7E8E9EAEBECED0EEFF0F1F2F3F4F5F6F7F8F9FAFBFCFD0EFF'  ESCAPE '&' LIMIT 2;
EXPLAIN UPDATE t1 SET b=CONCAT(b,'_update') WHERE b like x'000102030405060708090A0B0C0D0E0F101112131415161718191A1B1C1D0E1F202122232425262728292A2B2C2D0E2F303132333435363738393A3B3C3D0E3F404142434445464748494A4B4C4D0E4F505152535455565758595A5B5C5D0E5F606162636465666768696A6B6C6D0E6F707172737475767778797A7B7C7D0E7F808182838485868788898A8B8C8D0E8F909192939495969798999A9B9C9D0E9FA0A1A2A3A4A5A6A7A8A9AAABACAD0EAFB0B1B2B3B4B5B6B7B8B9BABBBCBD0EBFC0C1C2C3C4C5C6C7C8C9CACBCCCD0ECFD0D1D2D3D4D5D6D7D8D9DADBDCDD0EDFE0E1E2E3E4E5E6E7E8E9EAEBECED0EEFF0F1F2F3F4F5F6F7F8F9FAFBFCFD0EFF' LIMIT 2;
EXPLAIN UPDATE t1 SET b=CONCAT(b,'_update') WHERE b like X'000102030405060708090A0B0C0D0E0F101112131415161718191A1B1C1D0E1F202122232425262728292A2B2C2D0E2F303132333435363738393A3B3C3D0E3F404142434445464748494A4B4C4D0E4F505152535455565758595A5B5C5D0E5F606162636465666768696A6B6C6D0E6F707172737475767778797A7B7C7D0E7F808182838485868788898A8B8C8D0E8F909192939495969798999A9B9C9D0E9FA0A1A2A3A4A5A6A7A8A9AAABACAD0EAFB0B1B2B3B4B5B6B7B8B9BABBBCBD0EBFC0C1C2C3C4C5C6C7C8C9CACBCCCD0ECFD0D1D2D3D4D5D6D7D8D9DADBDCDD0EDFE0E1E2E3E4E5E6E7E8E9EAEBECED0EEFF0F1F2F3F4F5F6F7F8F9FAFBFCFD0EFF'  ESCAPE '&' LIMIT 2;
EXPLAIN UPDATE t1 SET b=CONCAT(b,'_update') WHERE b like X'000102030405060708090A0B0C0D0E0F101112131415161718191A1B1C1D0E1F202122232425262728292A2B2C2D0E2F303132333435363738393A3B3C3D0E3F404142434445464748494A4B4C4D0E4F505152535455565758595A5B5C5D0E5F606162636465666768696A6B6C6D0E6F707172737475767778797A7B7C7D0E7F808182838485868788898A8B8C8D0E8F909192939495969798999A9B9C9D0E9FA0A1A2A3A4A5A6A7A8A9AAABACAD0EAFB0B1B2B3B4B5B6B7B8B9BABBBCBD0EBFC0C1C2C3C4C5C6C7C8C9CACBCCCD0ECFD0D1D2D3D4D5D6D7D8D9DADBDCDD0EDFE0E1E2E3E4E5E6E7E8E9EAEBECED0EEFF0F1F2F3F4F5F6F7F8F9FAFBFCFD0EFF' LIMIT 2;
UPDATE t1 SET b=CONCAT(b,'_update') WHERE b like 0x000102030405060708090A0B0C0D0E0F101112131415161718191A1B1C1D0E1F202122232425262728292A2B2C2D0E2F303132333435363738393A3B3C3D0E3F404142434445464748494A4B4C4D0E4F505152535455565758595A5B5C5D0E5F606162636465666768696A6B6C6D0E6F707172737475767778797A7B7C7D0E7F808182838485868788898A8B8C8D0E8F909192939495969798999A9B9C9D0E9FA0A1A2A3A4A5A6A7A8A9AAABACAD0EAFB0B1B2B3B4B5B6B7B8B9BABBBCBD0EBFC0C1C2C3C4C5C6C7C8C9CACBCCCD0ECFD0D1D2D3D4D5D6D7D8D9DADBDCDD0EDFE0E1E2E3E4E5E6E7E8E9EAEBECED0EEFF0F1F2F3F4F5F6F7F8F9FAFBFCFD0EFF  ESCAPE '&' LIMIT 2;
UPDATE t1 SET b=CONCAT(b,'_update') WHERE b like 0x000102030405060708090A0B0C0D0E0F101112131415161718191A1B1C1D0E1F202122232425262728292A2B2C2D0E2F303132333435363738393A3B3C3D0E3F404142434445464748494A4B4C4D0E4F505152535455565758595A5B5C5D0E5F606162636465666768696A6B6C6D0E6F707172737475767778797A7B7C7D0E7F808182838485868788898A8B8C8D0E8F909192939495969798999A9B9C9D0E9FA0A1A2A3A4A5A6A7A8A9AAABACAD0EAFB0B1B2B3B4B5B6B7B8B9BABBBCBD0EBFC0C1C2C3C4C5C6C7C8C9CACBCCCD0ECFD0D1D2D3D4D5D6D7D8D9DADBDCDD0EDFE0E1E2E3E4E5E6E7E8E9EAEBECED0EEFF0F1F2F3F4F5F6F7F8F9FAFBFCFD0EFF LIMIT 2;
UPDATE t1 SET b=CONCAT(b,'_update') WHERE b like x'000102030405060708090A0B0C0D0E0F101112131415161718191A1B1C1D0E1F202122232425262728292A2B2C2D0E2F303132333435363738393A3B3C3D0E3F404142434445464748494A4B4C4D0E4F505152535455565758595A5B5C5D0E5F606162636465666768696A6B6C6D0E6F707172737475767778797A7B7C7D0E7F808182838485868788898A8B8C8D0E8F909192939495969798999A9B9C9D0E9FA0A1A2A3A4A5A6A7A8A9AAABACAD0EAFB0B1B2B3B4B5B6B7B8B9BABBBCBD0EBFC0C1C2C3C4C5C6C7C8C9CACBCCCD0ECFD0D1D2D3D4D5D6D7D8D9DADBDCDD0EDFE0E1E2E3E4E5E6E7E8E9EAEBECED0EEFF0F1F2F3F4F5F6F7F8F9FAFBFCFD0EFF'  ESCAPE '&' LIMIT 2;
UPDATE t1 SET b=CONCAT(b,'_update') WHERE b like x'000102030405060708090A0B0C0D0E0F101112131415161718191A1B1C1D0E1F202122232425262728292A2B2C2D0E2F303132333435363738393A3B3C3D0E3F404142434445464748494A4B4C4D0E4F505152535455565758595A5B5C5D0E5F606162636465666768696A6B6C6D0E6F707172737475767778797A7B7C7D0E7F808182838485868788898A8B8C8D0E8F909192939495969798999A9B9C9D0E9FA0A1A2A3A4A5A6A7A8A9AAABACAD0EAFB0B1B2B3B4B5B6B7B8B9BABBBCBD0EBFC0C1C2C3C4C5C6C7C8C9CACBCCCD0ECFD0D1D2D3D4D5D6D7D8D9DADBDCDD0EDFE0E1E2E3E4E5E6E7E8E9EAEBECED0EEFF0F1F2F3F4F5F6F7F8F9FAFBFCFD0EFF' LIMIT 2;
UPDATE t1 SET b=CONCAT(b,'_update') WHERE b like X'000102030405060708090A0B0C0D0E0F101112131415161718191A1B1C1D0E1F202122232425262728292A2B2C2D0E2F303132333435363738393A3B3C3D0E3F404142434445464748494A4B4C4D0E4F505152535455565758595A5B5C5D0E5F606162636465666768696A6B6C6D0E6F707172737475767778797A7B7C7D0E7F808182838485868788898A8B8C8D0E8F909192939495969798999A9B9C9D0E9FA0A1A2A3A4A5A6A7A8A9AAABACAD0EAFB0B1B2B3B4B5B6B7B8B9BABBBCBD0EBFC0C1C2C3C4C5C6C7C8C9CACBCCCD0ECFD0D1D2D3D4D5D6D7D8D9DADBDCDD0EDFE0E1E2E3E4E5E6E7E8E9EAEBECED0EEFF0F1F2F3F4F5F6F7F8F9FAFBFCFD0EFF'  ESCAPE '&' LIMIT 2;
UPDATE t1 SET b=CONCAT(b,'_update') WHERE b like X'000102030405060708090A0B0C0D0E0F101112131415161718191A1B1C1D0E1F202122232425262728292A2B2C2D0E2F303132333435363738393A3B3C3D0E3F404142434445464748494A4B4C4D0E4F505152535455565758595A5B5C5D0E5F606162636465666768696A6B6C6D0E6F707172737475767778797A7B7C7D0E7F808182838485868788898A8B8C8D0E8F909192939495969798999A9B9C9D0E9FA0A1A2A3A4A5A6A7A8A9AAABACAD0EAFB0B1B2B3B4B5B6B7B8B9BABBBCBD0EBFC0C1C2C3C4C5C6C7C8C9CACBCCCD0ECFD0D1D2D3D4D5D6D7D8D9DADBDCDD0EDFE0E1E2E3E4E5E6E7E8E9EAEBECED0EEFF0F1F2F3F4F5F6F7F8F9FAFBFCFD0EFF' LIMIT 2;
EXPLAIN UPDATE t1 SET b=CONCAT(b,'_update') WHERE b not like 0x000102030405060708090A0B0C0D0E0F101112131415161718191A1B1C1D0E1F202122232425262728292A2B2C2D0E2F303132333435363738393A3B3C3D0E3F404142434445464748494A4B4C4D0E4F505152535455565758595A5B5C5D0E5F606162636465666768696A6B6C6D0E6F707172737475767778797A7B7C7D0E7F808182838485868788898A8B8C8D0E8F909192939495969798999A9B9C9D0E9FA0A1A2A3A4A5A6A7A8A9AAABACAD0EAFB0B1B2B3B4B5B6B7B8B9BABBBCBD0EBFC0C1C2C3C4C5C6C7C8C9CACBCCCD0ECFD0D1D2D3D4D5D6D7D8D9DADBDCDD0EDFE0E1E2E3E4E5E6E7E8E9EAEBECED0EEFF0F1F2F3F4F5F6F7F8F9FAFBFCFD0EFF  ESCAPE '&' LIMIT 2;
EXPLAIN UPDATE t1 SET b=CONCAT(b,'_update') WHERE b not like 0x000102030405060708090A0B0C0D0E0F101112131415161718191A1B1C1D0E1F202122232425262728292A2B2C2D0E2F303132333435363738393A3B3C3D0E3F404142434445464748494A4B4C4D0E4F505152535455565758595A5B5C5D0E5F606162636465666768696A6B6C6D0E6F707172737475767778797A7B7C7D0E7F808182838485868788898A8B8C8D0E8F909192939495969798999A9B9C9D0E9FA0A1A2A3A4A5A6A7A8A9AAABACAD0EAFB0B1B2B3B4B5B6B7B8B9BABBBCBD0EBFC0C1C2C3C4C5C6C7C8C9CACBCCCD0ECFD0D1D2D3D4D5D6D7D8D9DADBDCDD0EDFE0E1E2E3E4E5E6E7E8E9EAEBECED0EEFF0F1F2F3F4F5F6F7F8F9FAFBFCFD0EFF LIMIT 2;
EXPLAIN UPDATE t1 SET b=CONCAT(b,'_update') WHERE b not like x'000102030405060708090A0B0C0D0E0F101112131415161718191A1B1C1D0E1F202122232425262728292A2B2C2D0E2F303132333435363738393A3B3C3D0E3F404142434445464748494A4B4C4D0E4F505152535455565758595A5B5C5D0E5F606162636465666768696A6B6C6D0E6F707172737475767778797A7B7C7D0E7F808182838485868788898A8B8C8D0E8F909192939495969798999A9B9C9D0E9FA0A1A2A3A4A5A6A7A8A9AAABACAD0EAFB0B1B2B3B4B5B6B7B8B9BABBBCBD0EBFC0C1C2C3C4C5C6C7C8C9CACBCCCD0ECFD0D1D2D3D4D5D6D7D8D9DADBDCDD0EDFE0E1E2E3E4E5E6E7E8E9EAEBECED0EEFF0F1F2F3F4F5F6F7F8F9FAFBFCFD0EFF'  ESCAPE '&' LIMIT 2;
EXPLAIN UPDATE t1 SET b=CONCAT(b,'_update') WHERE b not like x'000102030405060708090A0B0C0D0E0F101112131415161718191A1B1C1D0E1F202122232425262728292A2B2C2D0E2F303132333435363738393A3B3C3D0E3F404142434445464748494A4B4C4D0E4F505152535455565758595A5B5C5D0E5F606162636465666768696A6B6C6D0E6F707172737475767778797A7B7C7D0E7F808182838485868788898A8B8C8D0E8F909192939495969798999A9B9C9D0E9FA0A1A2A3A4A5A6A7A8A9AAABACAD0EAFB0B1B2B3B4B5B6B7B8B9BABBBCBD0EBFC0C1C2C3C4C5C6C7C8C9CACBCCCD0ECFD0D1D2D3D4D5D6D7D8D9DADBDCDD0EDFE0E1E2E3E4E5E6E7E8E9EAEBECED0EEFF0F1F2F3F4F5F6F7F8F9FAFBFCFD0EFF' LIMIT 2;
EXPLAIN UPDATE t1 SET b=CONCAT(b,'_update') WHERE b not like X'000102030405060708090A0B0C0D0E0F101112131415161718191A1B1C1D0E1F202122232425262728292A2B2C2D0E2F303132333435363738393A3B3C3D0E3F404142434445464748494A4B4C4D0E4F505152535455565758595A5B5C5D0E5F606162636465666768696A6B6C6D0E6F707172737475767778797A7B7C7D0E7F808182838485868788898A8B8C8D0E8F909192939495969798999A9B9C9D0E9FA0A1A2A3A4A5A6A7A8A9AAABACAD0EAFB0B1B2B3B4B5B6B7B8B9BABBBCBD0EBFC0C1C2C3C4C5C6C7C8C9CACBCCCD0ECFD0D1D2D3D4D5D6D7D8D9DADBDCDD0EDFE0E1E2E3E4E5E6E7E8E9EAEBECED0EEFF0F1F2F3F4F5F6F7F8F9FAFBFCFD0EFF'  ESCAPE '&' LIMIT 2;
EXPLAIN UPDATE t1 SET b=CONCAT(b,'_update') WHERE b not like X'000102030405060708090A0B0C0D0E0F101112131415161718191A1B1C1D0E1F202122232425262728292A2B2C2D0E2F303132333435363738393A3B3C3D0E3F404142434445464748494A4B4C4D0E4F505152535455565758595A5B5C5D0E5F606162636465666768696A6B6C6D0E6F707172737475767778797A7B7C7D0E7F808182838485868788898A8B8C8D0E8F909192939495969798999A9B9C9D0E9FA0A1A2A3A4A5A6A7A8A9AAABACAD0EAFB0B1B2B3B4B5B6B7B8B9BABBBCBD0EBFC0C1C2C3C4C5C6C7C8C9CACBCCCD0ECFD0D1D2D3D4D5D6D7D8D9DADBDCDD0EDFE0E1E2E3E4E5E6E7E8E9EAEBECED0EEFF0F1F2F3F4F5F6F7F8F9FAFBFCFD0EFF' LIMIT 2;
UPDATE t1 SET b=CONCAT(b,'_update') WHERE b not like 0x000102030405060708090A0B0C0D0E0F101112131415161718191A1B1C1D0E1F202122232425262728292A2B2C2D0E2F303132333435363738393A3B3C3D0E3F404142434445464748494A4B4C4D0E4F505152535455565758595A5B5C5D0E5F606162636465666768696A6B6C6D0E6F707172737475767778797A7B7C7D0E7F808182838485868788898A8B8C8D0E8F909192939495969798999A9B9C9D0E9FA0A1A2A3A4A5A6A7A8A9AAABACAD0EAFB0B1B2B3B4B5B6B7B8B9BABBBCBD0EBFC0C1C2C3C4C5C6C7C8C9CACBCCCD0ECFD0D1D2D3D4D5D6D7D8D9DADBDCDD0EDFE0E1E2E3E4E5E6E7E8E9EAEBECED0EEFF0F1F2F3F4F5F6F7F8F9FAFBFCFD0EFF  ESCAPE '&' LIMIT 2;
UPDATE t1 SET b=CONCAT(b,'_update') WHERE b not like 0x000102030405060708090A0B0C0D0E0F101112131415161718191A1B1C1D0E1F202122232425262728292A2B2C2D0E2F303132333435363738393A3B3C3D0E3F404142434445464748494A4B4C4D0E4F505152535455565758595A5B5C5D0E5F606162636465666768696A6B6C6D0E6F707172737475767778797A7B7C7D0E7F808182838485868788898A8B8C8D0E8F909192939495969798999A9B9C9D0E9FA0A1A2A3A4A5A6A7A8A9AAABACAD0EAFB0B1B2B3B4B5B6B7B8B9BABBBCBD0EBFC0C1C2C3C4C5C6C7C8C9CACBCCCD0ECFD0D1D2D3D4D5D6D7D8D9DADBDCDD0EDFE0E1E2E3E4E5E6E7E8E9EAEBECED0EEFF0F1F2F3F4F5F6F7F8F9FAFBFCFD0EFF LIMIT 2;
UPDATE t1 SET b=CONCAT(b,'_update') WHERE b not like x'000102030405060708090A0B0C0D0E0F101112131415161718191A1B1C1D0E1F202122232425262728292A2B2C2D0E2F303132333435363738393A3B3C3D0E3F404142434445464748494A4B4C4D0E4F505152535455565758595A5B5C5D0E5F606162636465666768696A6B6C6D0E6F707172737475767778797A7B7C7D0E7F808182838485868788898A8B8C8D0E8F909192939495969798999A9B9C9D0E9FA0A1A2A3A4A5A6A7A8A9AAABACAD0EAFB0B1B2B3B4B5B6B7B8B9BABBBCBD0EBFC0C1C2C3C4C5C6C7C8C9CACBCCCD0ECFD0D1D2D3D4D5D6D7D8D9DADBDCDD0EDFE0E1E2E3E4E5E6E7E8E9EAEBECED0EEFF0F1F2F3F4F5F6F7F8F9FAFBFCFD0EFF'  ESCAPE '&' LIMIT 2;
UPDATE t1 SET b=CONCAT(b,'_update') WHERE b not like x'000102030405060708090A0B0C0D0E0F101112131415161718191A1B1C1D0E1F202122232425262728292A2B2C2D0E2F303132333435363738393A3B3C3D0E3F404142434445464748494A4B4C4D0E4F505152535455565758595A5B5C5D0E5F606162636465666768696A6B6C6D0E6F707172737475767778797A7B7C7D0E7F808182838485868788898A8B8C8D0E8F909192939495969798999A9B9C9D0E9FA0A1A2A3A4A5A6A7A8A9AAABACAD0EAFB0B1B2B3B4B5B6B7B8B9BABBBCBD0EBFC0C1C2C3C4C5C6C7C8C9CACBCCCD0ECFD0D1D2D3D4D5D6D7D8D9DADBDCDD0EDFE0E1E2E3E4E5E6E7E8E9EAEBECED0EEFF0F1F2F3F4F5F6F7F8F9FAFBFCFD0EFF' LIMIT 2;
UPDATE t1 SET b=CONCAT(b,'_update') WHERE b not like X'000102030405060708090A0B0C0D0E0F101112131415161718191A1B1C1D0E1F202122232425262728292A2B2C2D0E2F303132333435363738393A3B3C3D0E3F404142434445464748494A4B4C4D0E4F505152535455565758595A5B5C5D0E5F606162636465666768696A6B6C6D0E6F707172737475767778797A7B7C7D0E7F808182838485868788898A8B8C8D0E8F909192939495969798999A9B9C9D0E9FA0A1A2A3A4A5A6A7A8A9AAABACAD0EAFB0B1B2B3B4B5B6B7B8B9BABBBCBD0EBFC0C1C2C3C4C5C6C7C8C9CACBCCCD0ECFD0D1D2D3D4D5D6D7D8D9DADBDCDD0EDFE0E1E2E3E4E5E6E7E8E9EAEBECED0EEFF0F1F2F3F4F5F6F7F8F9FAFBFCFD0EFF'  ESCAPE '&' LIMIT 2;
UPDATE t1 SET b=CONCAT(b,'_update') WHERE b not like X'000102030405060708090A0B0C0D0E0F101112131415161718191A1B1C1D0E1F202122232425262728292A2B2C2D0E2F303132333435363738393A3B3C3D0E3F404142434445464748494A4B4C4D0E4F505152535455565758595A5B5C5D0E5F606162636465666768696A6B6C6D0E6F707172737475767778797A7B7C7D0E7F808182838485868788898A8B8C8D0E8F909192939495969798999A9B9C9D0E9FA0A1A2A3A4A5A6A7A8A9AAABACAD0EAFB0B1B2B3B4B5B6B7B8B9BABBBCBD0EBFC0C1C2C3C4C5C6C7C8C9CACBCCCD0ECFD0D1D2D3D4D5D6D7D8D9DADBDCDD0EDFE0E1E2E3E4E5E6E7E8E9EAEBECED0EEFF0F1F2F3F4F5F6F7F8F9FAFBFCFD0EFF' LIMIT 2;
-- ========================= DELETE ... LIMIT ====================================================================================
-- col_str1 [NOT] LIKE ‘xxx’ [ESCAPE col_str3]
replace into t1 values(1,'aaaa','aaaa','aaaa','aaaa'),(2,'xxxc','xxxb','xxxb','xxxb'),(3,'xxxb','xxxc','xxxc','xxxc'),(4,'xxxa','xxxa','xxxa','xxxa'),(5,'zzzz','zzzz','zzzz','zzzz'),(6,NULL,NULL,'xxxa','xxxa'),(7,'zxxx','zxxx','zxxx','zxxx'),(8,'axxx','axxx','axxx','axxx'),(9,'zaaz','zaaz','zaaz','zaaz'),(10,'zbbz','zbbz','zbbz','zbbz');
DELETE FROM t1 WHERE b like 'xxx' LIMIT 2;
SELECT * FROM t1;
a	b	c	d	e
1	aaaa	aaaa	aaaa	aaaa
2	xxxc	xxxb	xxxb	xxxb
3	xxxb	xxxc	xxxc	xxxc
4	xxxa	xxxa	xxxa	xxxa
5	zzzz	zzzz	zzzz	zzzz
6	NULL	NULL	xxxa	xxxa
7	zxxx	zxxx	zxxx	zxxx
8	axxx	axxx	axxx	axxx
9	zaaz	zaaz	zaaz	zaaz
10	zbbz	zbbz	zbbz	zbbz
replace into t1 values(1,'aaaa','aaaa','aaaa','aaaa'),(2,'xxxc','xxxb','xxxb','xxxb'),(3,'xxxb','xxxc','xxxc','xxxc'),(4,'xxxa','xxxa','xxxa','xxxa'),(5,'zzzz','zzzz','zzzz','zzzz'),(6,NULL,NULL,'xxxa','xxxa'),(7,'zxxx','zxxx','zxxx','zxxx'),(8,'axxx','axxx','axxx','axxx'),(9,'zaaz','zaaz','zaaz','zaaz'),(10,'zbbz','zbbz','zbbz','zbbz');
EXPLAIN DELETE FROM t1 WHERE b like 'xxx' LIMIT 2;
SELECT * FROM t1;
a	b	c	d	e
1	aaaa	aaaa	aaaa	aaaa
2	xxxc	xxxb	xxxb	xxxb
3	xxxb	xxxc	xxxc	xxxc
4	xxxa	xxxa	xxxa	xxxa
5	zzzz	zzzz	zzzz	zzzz
6	NULL	NULL	xxxa	xxxa
7	zxxx	zxxx	zxxx	zxxx
8	axxx	axxx	axxx	axxx
9	zaaz	zaaz	zaaz	zaaz
10	zbbz	zbbz	zbbz	zbbz
-- col_str1 [NOT] LIKE ‘xxx%’ [ESCAPE col_str3]
replace into t1 values(1,'aaaa','aaaa','aaaa','aaaa'),(2,'xxxc','xxxb','xxxb','xxxb'),(3,'xxxb','xxxc','xxxc','xxxc'),(4,'xxxa','xxxa','xxxa','xxxa'),(5,'zzzz','zzzz','zzzz','zzzz'),(6,NULL,NULL,'xxxa','xxxa'),(7,'zxxx','zxxx','zxxx','zxxx'),(8,'axxx','axxx','axxx','axxx'),(9,'zaaz','zaaz','zaaz','zaaz'),(10,'zbbz','zbbz','zbbz','zbbz');
DELETE FROM t1 WHERE b like 'xxx%' LIMIT 2;
SELECT * FROM t1;
a	b	c	d	e
1	aaaa	aaaa	aaaa	aaaa
2	xxxc	xxxb	xxxb	xxxb
5	zzzz	zzzz	zzzz	zzzz
6	NULL	NULL	xxxa	xxxa
7	zxxx	zxxx	zxxx	zxxx
8	axxx	axxx	axxx	axxx
9	zaaz	zaaz	zaaz	zaaz
10	zbbz	zbbz	zbbz	zbbz
replace into t1 values(1,'aaaa','aaaa','aaaa','aaaa'),(2,'xxxc','xxxb','xxxb','xxxb'),(3,'xxxb','xxxc','xxxc','xxxc'),(4,'xxxa','xxxa','xxxa','xxxa'),(5,'zzzz','zzzz','zzzz','zzzz'),(6,NULL,NULL,'xxxa','xxxa'),(7,'zxxx','zxxx','zxxx','zxxx'),(8,'axxx','axxx','axxx','axxx'),(9,'zaaz','zaaz','zaaz','zaaz'),(10,'zbbz','zbbz','zbbz','zbbz');
DELETE FROM t1 WHERE b like 'xxx%' ESCAPE 'x' LIMIT 2;
SELECT * FROM t1;
a	b	c	d	e
1	aaaa	aaaa	aaaa	aaaa
2	xxxc	xxxb	xxxb	xxxb
3	xxxb	xxxc	xxxc	xxxc
4	xxxa	xxxa	xxxa	xxxa
5	zzzz	zzzz	zzzz	zzzz
6	NULL	NULL	xxxa	xxxa
7	zxxx	zxxx	zxxx	zxxx
8	axxx	axxx	axxx	axxx
9	zaaz	zaaz	zaaz	zaaz
10	zbbz	zbbz	zbbz	zbbz
replace into t1 values(1,'aaaa','aaaa','aaaa','aaaa'),(2,'xxxc','xxxb','xxxb','xxxb'),(3,'xxxb','xxxc','xxxc','xxxc'),(4,'xxxa','xxxa','xxxa','xxxa'),(5,'zzzz','zzzz','zzzz','zzzz'),(6,NULL,NULL,'xxxa','xxxa'),(7,'zxxx','zxxx','zxxx','zxxx'),(8,'axxx','axxx','axxx','axxx'),(9,'zaaz','zaaz','zaaz','zaaz'),(10,'zbbz','zbbz','zbbz','zbbz');
DELETE FROM t1 WHERE b like 'xxx%' ESCAPE 'a' LIMIT 2;
SELECT * FROM t1;
a	b	c	d	e
1	aaaa	aaaa	aaaa	aaaa
2	xxxc	xxxb	xxxb	xxxb
5	zzzz	zzzz	zzzz	zzzz
6	NULL	NULL	xxxa	xxxa
7	zxxx	zxxx	zxxx	zxxx
8	axxx	axxx	axxx	axxx
9	zaaz	zaaz	zaaz	zaaz
10	zbbz	zbbz	zbbz	zbbz
replace into t1 values(1,'aaaa','aaaa','aaaa','aaaa'),(2,'xxxc','xxxb','xxxb','xxxb'),(3,'xxxb','xxxc','xxxc','xxxc'),(4,'xxxa','xxxa','xxxa','xxxa'),(5,'zzzz','zzzz','zzzz','zzzz'),(6,NULL,NULL,'xxxa','xxxa'),(7,'zxxx','zxxx','zxxx','zxxx'),(8,'axxx','axxx','axxx','axxx'),(9,'zaaz','zaaz','zaaz','zaaz'),(10,'zbbz','zbbz','zbbz','zbbz');
DELETE FROM t1 WHERE b NOT like 'xxx%' LIMIT 2;
SELECT * FROM t1;
a	b	c	d	e
2	xxxc	xxxb	xxxb	xxxb
3	xxxb	xxxc	xxxc	xxxc
4	xxxa	xxxa	xxxa	xxxa
6	NULL	NULL	xxxa	xxxa
7	zxxx	zxxx	zxxx	zxxx
8	axxx	axxx	axxx	axxx
9	zaaz	zaaz	zaaz	zaaz
10	zbbz	zbbz	zbbz	zbbz
replace into t1 values(1,'aaaa','aaaa','aaaa','aaaa'),(2,'xxxc','xxxb','xxxb','xxxb'),(3,'xxxb','xxxc','xxxc','xxxc'),(4,'xxxa','xxxa','xxxa','xxxa'),(5,'zzzz','zzzz','zzzz','zzzz'),(6,NULL,NULL,'xxxa','xxxa'),(7,'zxxx','zxxx','zxxx','zxxx'),(8,'axxx','axxx','axxx','axxx'),(9,'zaaz','zaaz','zaaz','zaaz'),(10,'zbbz','zbbz','zbbz','zbbz');
DELETE FROM t1 WHERE b NOT like 'xxx%' ESCAPE 'x' LIMIT 2;
SELECT * FROM t1;
a	b	c	d	e
3	xxxb	xxxc	xxxc	xxxc
4	xxxa	xxxa	xxxa	xxxa
5	zzzz	zzzz	zzzz	zzzz
6	NULL	NULL	xxxa	xxxa
7	zxxx	zxxx	zxxx	zxxx
8	axxx	axxx	axxx	axxx
9	zaaz	zaaz	zaaz	zaaz
10	zbbz	zbbz	zbbz	zbbz
replace into t1 values(1,'aaaa','aaaa','aaaa','aaaa'),(2,'xxxc','xxxb','xxxb','xxxb'),(3,'xxxb','xxxc','xxxc','xxxc'),(4,'xxxa','xxxa','xxxa','xxxa'),(5,'zzzz','zzzz','zzzz','zzzz'),(6,NULL,NULL,'xxxa','xxxa'),(7,'zxxx','zxxx','zxxx','zxxx'),(8,'axxx','axxx','axxx','axxx'),(9,'zaaz','zaaz','zaaz','zaaz'),(10,'zbbz','zbbz','zbbz','zbbz');
DELETE FROM t1 WHERE b NOT like 'xxx%' ESCAPE 'a' LIMIT 2;
SELECT * FROM t1;
a	b	c	d	e
2	xxxc	xxxb	xxxb	xxxb
3	xxxb	xxxc	xxxc	xxxc
4	xxxa	xxxa	xxxa	xxxa
6	NULL	NULL	xxxa	xxxa
7	zxxx	zxxx	zxxx	zxxx
8	axxx	axxx	axxx	axxx
9	zaaz	zaaz	zaaz	zaaz
10	zbbz	zbbz	zbbz	zbbz
-- col_str1 [NOT] LIKE ‘z%z’ [ESCAPE col_str3]
replace into t1 values(1,'aaaa','aaaa','aaaa','aaaa'),(2,'xxxc','xxxb','xxxb','xxxb'),(3,'xxxb','xxxc','xxxc','xxxc'),(4,'xxxa','xxxa','xxxa','xxxa'),(5,'zzzz','zzzz','zzzz','zzzz'),(6,NULL,NULL,'xxxa','xxxa'),(7,'zxxx','zxxx','zxxx','zxxx'),(8,'axxx','axxx','axxx','axxx'),(9,'zaaz','zaaz','zaaz','zaaz'),(10,'zbbz','zbbz','zbbz','zbbz');
DELETE FROM t1 WHERE b like 'z%z' LIMIT 2;
SELECT * FROM t1;
a	b	c	d	e
1	aaaa	aaaa	aaaa	aaaa
2	xxxc	xxxb	xxxb	xxxb
3	xxxb	xxxc	xxxc	xxxc
4	xxxa	xxxa	xxxa	xxxa
5	zzzz	zzzz	zzzz	zzzz
6	NULL	NULL	xxxa	xxxa
7	zxxx	zxxx	zxxx	zxxx
8	axxx	axxx	axxx	axxx
replace into t1 values(1,'aaaa','aaaa','aaaa','aaaa'),(2,'xxxc','xxxb','xxxb','xxxb'),(3,'xxxb','xxxc','xxxc','xxxc'),(4,'xxxa','xxxa','xxxa','xxxa'),(5,'zzzz','zzzz','zzzz','zzzz'),(6,NULL,NULL,'xxxa','xxxa'),(7,'zxxx','zxxx','zxxx','zxxx'),(8,'axxx','axxx','axxx','axxx'),(9,'zaaz','zaaz','zaaz','zaaz'),(10,'zbbz','zbbz','zbbz','zbbz');
DELETE FROM t1 WHERE b like 'z%z' ESCAPE 'x' LIMIT 2;
SELECT * FROM t1;
a	b	c	d	e
1	aaaa	aaaa	aaaa	aaaa
2	xxxc	xxxb	xxxb	xxxb
3	xxxb	xxxc	xxxc	xxxc
4	xxxa	xxxa	xxxa	xxxa
5	zzzz	zzzz	zzzz	zzzz
6	NULL	NULL	xxxa	xxxa
7	zxxx	zxxx	zxxx	zxxx
8	axxx	axxx	axxx	axxx
replace into t1 values(1,'aaaa','aaaa','aaaa','aaaa'),(2,'xxxc','xxxb','xxxb','xxxb'),(3,'xxxb','xxxc','xxxc','xxxc'),(4,'xxxa','xxxa','xxxa','xxxa'),(5,'zzzz','zzzz','zzzz','zzzz'),(6,NULL,NULL,'xxxa','xxxa'),(7,'zxxx','zxxx','zxxx','zxxx'),(8,'axxx','axxx','axxx','axxx'),(9,'zaaz','zaaz','zaaz','zaaz'),(10,'zbbz','zbbz','zbbz','zbbz');
DELETE FROM t1 WHERE b like 'z%z' ESCAPE 'a' LIMIT 2;
SELECT * FROM t1;
a	b	c	d	e
1	aaaa	aaaa	aaaa	aaaa
2	xxxc	xxxb	xxxb	xxxb
3	xxxb	xxxc	xxxc	xxxc
4	xxxa	xxxa	xxxa	xxxa
5	zzzz	zzzz	zzzz	zzzz
6	NULL	NULL	xxxa	xxxa
7	zxxx	zxxx	zxxx	zxxx
8	axxx	axxx	axxx	axxx
replace into t1 values(1,'aaaa','aaaa','aaaa','aaaa'),(2,'xxxc','xxxb','xxxb','xxxb'),(3,'xxxb','xxxc','xxxc','xxxc'),(4,'xxxa','xxxa','xxxa','xxxa'),(5,'zzzz','zzzz','zzzz','zzzz'),(6,NULL,NULL,'xxxa','xxxa'),(7,'zxxx','zxxx','zxxx','zxxx'),(8,'axxx','axxx','axxx','axxx'),(9,'zaaz','zaaz','zaaz','zaaz'),(10,'zbbz','zbbz','zbbz','zbbz');
DELETE FROM t1 WHERE b NOT like 'z%z' LIMIT 2;
SELECT * FROM t1;
a	b	c	d	e
3	xxxb	xxxc	xxxc	xxxc
4	xxxa	xxxa	xxxa	xxxa
5	zzzz	zzzz	zzzz	zzzz
6	NULL	NULL	xxxa	xxxa
7	zxxx	zxxx	zxxx	zxxx
8	axxx	axxx	axxx	axxx
9	zaaz	zaaz	zaaz	zaaz
10	zbbz	zbbz	zbbz	zbbz
replace into t1 values(1,'aaaa','aaaa','aaaa','aaaa'),(2,'xxxc','xxxb','xxxb','xxxb'),(3,'xxxb','xxxc','xxxc','xxxc'),(4,'xxxa','xxxa','xxxa','xxxa'),(5,'zzzz','zzzz','zzzz','zzzz'),(6,NULL,NULL,'xxxa','xxxa'),(7,'zxxx','zxxx','zxxx','zxxx'),(8,'axxx','axxx','axxx','axxx'),(9,'zaaz','zaaz','zaaz','zaaz'),(10,'zbbz','zbbz','zbbz','zbbz');
DELETE FROM t1 WHERE b NOT like 'z%z' ESCAPE 'x' LIMIT 2;
SELECT * FROM t1;
a	b	c	d	e
3	xxxb	xxxc	xxxc	xxxc
4	xxxa	xxxa	xxxa	xxxa
5	zzzz	zzzz	zzzz	zzzz
6	NULL	NULL	xxxa	xxxa
7	zxxx	zxxx	zxxx	zxxx
8	axxx	axxx	axxx	axxx
9	zaaz	zaaz	zaaz	zaaz
10	zbbz	zbbz	zbbz	zbbz
replace into t1 values(1,'aaaa','aaaa','aaaa','aaaa'),(2,'xxxc','xxxb','xxxb','xxxb'),(3,'xxxb','xxxc','xxxc','xxxc'),(4,'xxxa','xxxa','xxxa','xxxa'),(5,'zzzz','zzzz','zzzz','zzzz'),(6,NULL,NULL,'xxxa','xxxa'),(7,'zxxx','zxxx','zxxx','zxxx'),(8,'axxx','axxx','axxx','axxx'),(9,'zaaz','zaaz','zaaz','zaaz'),(10,'zbbz','zbbz','zbbz','zbbz');
DELETE FROM t1 WHERE b NOT like 'z%z' ESCAPE 'a' LIMIT 2;
SELECT * FROM t1;
a	b	c	d	e
3	xxxb	xxxc	xxxc	xxxc
4	xxxa	xxxa	xxxa	xxxa
5	zzzz	zzzz	zzzz	zzzz
6	NULL	NULL	xxxa	xxxa
7	zxxx	zxxx	zxxx	zxxx
8	axxx	axxx	axxx	axxx
9	zaaz	zaaz	zaaz	zaaz
10	zbbz	zbbz	zbbz	zbbz
-- col_str1 [NOT] LIKE ‘z__z’ [ESCAPE col_str3]
replace into t1 values(1,'aaaa','aaaa','aaaa','aaaa'),(2,'xxxc','xxxb','xxxb','xxxb'),(3,'xxxb','xxxc','xxxc','xxxc'),(4,'xxxa','xxxa','xxxa','xxxa'),(5,'zzzz','zzzz','zzzz','zzzz'),(6,NULL,NULL,'xxxa','xxxa'),(7,'zxxx','zxxx','zxxx','zxxx'),(8,'axxx','axxx','axxx','axxx'),(9,'zaaz','zaaz','zaaz','zaaz'),(10,'zbbz','zbbz','zbbz','zbbz');
DELETE FROM t1 WHERE b like 'z__z' LIMIT 2;
SELECT * FROM t1;
a	b	c	d	e
1	aaaa	aaaa	aaaa	aaaa
2	xxxc	xxxb	xxxb	xxxb
3	xxxb	xxxc	xxxc	xxxc
4	xxxa	xxxa	xxxa	xxxa
5	zzzz	zzzz	zzzz	zzzz
6	NULL	NULL	xxxa	xxxa
7	zxxx	zxxx	zxxx	zxxx
8	axxx	axxx	axxx	axxx
replace into t1 values(1,'aaaa','aaaa','aaaa','aaaa'),(2,'xxxc','xxxb','xxxb','xxxb'),(3,'xxxb','xxxc','xxxc','xxxc'),(4,'xxxa','xxxa','xxxa','xxxa'),(5,'zzzz','zzzz','zzzz','zzzz'),(6,NULL,NULL,'xxxa','xxxa'),(7,'zxxx','zxxx','zxxx','zxxx'),(8,'axxx','axxx','axxx','axxx'),(9,'zaaz','zaaz','zaaz','zaaz'),(10,'zbbz','zbbz','zbbz','zbbz');
DELETE FROM t1 WHERE b like 'z__z' ESCAPE 'x' LIMIT 2;
SELECT * FROM t1;
a	b	c	d	e
1	aaaa	aaaa	aaaa	aaaa
2	xxxc	xxxb	xxxb	xxxb
3	xxxb	xxxc	xxxc	xxxc
4	xxxa	xxxa	xxxa	xxxa
5	zzzz	zzzz	zzzz	zzzz
6	NULL	NULL	xxxa	xxxa
7	zxxx	zxxx	zxxx	zxxx
8	axxx	axxx	axxx	axxx
replace into t1 values(1,'aaaa','aaaa','aaaa','aaaa'),(2,'xxxc','xxxb','xxxb','xxxb'),(3,'xxxb','xxxc','xxxc','xxxc'),(4,'xxxa','xxxa','xxxa','xxxa'),(5,'zzzz','zzzz','zzzz','zzzz'),(6,NULL,NULL,'xxxa','xxxa'),(7,'zxxx','zxxx','zxxx','zxxx'),(8,'axxx','axxx','axxx','axxx'),(9,'zaaz','zaaz','zaaz','zaaz'),(10,'zbbz','zbbz','zbbz','zbbz');
DELETE FROM t1 WHERE b like 'z__z' ESCAPE 'a' LIMIT 2;
SELECT * FROM t1;
a	b	c	d	e
1	aaaa	aaaa	aaaa	aaaa
2	xxxc	xxxb	xxxb	xxxb
3	xxxb	xxxc	xxxc	xxxc
4	xxxa	xxxa	xxxa	xxxa
5	zzzz	zzzz	zzzz	zzzz
6	NULL	NULL	xxxa	xxxa
7	zxxx	zxxx	zxxx	zxxx
8	axxx	axxx	axxx	axxx
replace into t1 values(1,'aaaa','aaaa','aaaa','aaaa'),(2,'xxxc','xxxb','xxxb','xxxb'),(3,'xxxb','xxxc','xxxc','xxxc'),(4,'xxxa','xxxa','xxxa','xxxa'),(5,'zzzz','zzzz','zzzz','zzzz'),(6,NULL,NULL,'xxxa','xxxa'),(7,'zxxx','zxxx','zxxx','zxxx'),(8,'axxx','axxx','axxx','axxx'),(9,'zaaz','zaaz','zaaz','zaaz'),(10,'zbbz','zbbz','zbbz','zbbz');
DELETE FROM t1 WHERE b NOT like 'z__z' LIMIT 2;
SELECT * FROM t1;
a	b	c	d	e
3	xxxb	xxxc	xxxc	xxxc
4	xxxa	xxxa	xxxa	xxxa
5	zzzz	zzzz	zzzz	zzzz
6	NULL	NULL	xxxa	xxxa
7	zxxx	zxxx	zxxx	zxxx
8	axxx	axxx	axxx	axxx
9	zaaz	zaaz	zaaz	zaaz
10	zbbz	zbbz	zbbz	zbbz
replace into t1 values(1,'aaaa','aaaa','aaaa','aaaa'),(2,'xxxc','xxxb','xxxb','xxxb'),(3,'xxxb','xxxc','xxxc','xxxc'),(4,'xxxa','xxxa','xxxa','xxxa'),(5,'zzzz','zzzz','zzzz','zzzz'),(6,NULL,NULL,'xxxa','xxxa'),(7,'zxxx','zxxx','zxxx','zxxx'),(8,'axxx','axxx','axxx','axxx'),(9,'zaaz','zaaz','zaaz','zaaz'),(10,'zbbz','zbbz','zbbz','zbbz');
DELETE FROM t1 WHERE b NOT like 'z__z' ESCAPE 'x' LIMIT 2;
SELECT * FROM t1;
a	b	c	d	e
3	xxxb	xxxc	xxxc	xxxc
4	xxxa	xxxa	xxxa	xxxa
5	zzzz	zzzz	zzzz	zzzz
6	NULL	NULL	xxxa	xxxa
7	zxxx	zxxx	zxxx	zxxx
8	axxx	axxx	axxx	axxx
9	zaaz	zaaz	zaaz	zaaz
10	zbbz	zbbz	zbbz	zbbz
replace into t1 values(1,'aaaa','aaaa','aaaa','aaaa'),(2,'xxxc','xxxb','xxxb','xxxb'),(3,'xxxb','xxxc','xxxc','xxxc'),(4,'xxxa','xxxa','xxxa','xxxa'),(5,'zzzz','zzzz','zzzz','zzzz'),(6,NULL,NULL,'xxxa','xxxa'),(7,'zxxx','zxxx','zxxx','zxxx'),(8,'axxx','axxx','axxx','axxx'),(9,'zaaz','zaaz','zaaz','zaaz'),(10,'zbbz','zbbz','zbbz','zbbz');
DELETE FROM t1 WHERE b NOT like 'z__z' ESCAPE 'a' LIMIT 2;
SELECT * FROM t1;
a	b	c	d	e
3	xxxb	xxxc	xxxc	xxxc
4	xxxa	xxxa	xxxa	xxxa
5	zzzz	zzzz	zzzz	zzzz
6	NULL	NULL	xxxa	xxxa
7	zxxx	zxxx	zxxx	zxxx
8	axxx	axxx	axxx	axxx
9	zaaz	zaaz	zaaz	zaaz
10	zbbz	zbbz	zbbz	zbbz
-- col_str1 [NOT] LIKE ‘z%z%’ [ESCAPE col_str3]
replace into t1 values(1,'aaaa','aaaa','aaaa','aaaa'),(2,'xxxc','xxxb','xxxb','xxxb'),(3,'xxxb','xxxc','xxxc','xxxc'),(4,'xxxa','xxxa','xxxa','xxxa'),(5,'zzzz','zzzz','zzzz','zzzz'),(6,NULL,NULL,'xxxa','xxxa'),(7,'zxxx','zxxx','zxxx','zxxx'),(8,'axxx','axxx','axxx','axxx'),(9,'zaaz','zaaz','zaaz','zaaz'),(10,'zbbz','zbbz','zbbz','zbbz');
DELETE FROM t1 WHERE b like 'z%z%' LIMIT 2;
SELECT * FROM t1;
a	b	c	d	e
1	aaaa	aaaa	aaaa	aaaa
2	xxxc	xxxb	xxxb	xxxb
3	xxxb	xxxc	xxxc	xxxc
4	xxxa	xxxa	xxxa	xxxa
5	zzzz	zzzz	zzzz	zzzz
6	NULL	NULL	xxxa	xxxa
7	zxxx	zxxx	zxxx	zxxx
8	axxx	axxx	axxx	axxx
replace into t1 values(1,'aaaa','aaaa','aaaa','aaaa'),(2,'xxxc','xxxb','xxxb','xxxb'),(3,'xxxb','xxxc','xxxc','xxxc'),(4,'xxxa','xxxa','xxxa','xxxa'),(5,'zzzz','zzzz','zzzz','zzzz'),(6,NULL,NULL,'xxxa','xxxa'),(7,'zxxx','zxxx','zxxx','zxxx'),(8,'axxx','axxx','axxx','axxx'),(9,'zaaz','zaaz','zaaz','zaaz'),(10,'zbbz','zbbz','zbbz','zbbz');
DELETE FROM t1 WHERE b like 'z%z%' ESCAPE 'x' LIMIT 2;
SELECT * FROM t1;
a	b	c	d	e
1	aaaa	aaaa	aaaa	aaaa
2	xxxc	xxxb	xxxb	xxxb
3	xxxb	xxxc	xxxc	xxxc
4	xxxa	xxxa	xxxa	xxxa
5	zzzz	zzzz	zzzz	zzzz
6	NULL	NULL	xxxa	xxxa
7	zxxx	zxxx	zxxx	zxxx
8	axxx	axxx	axxx	axxx
replace into t1 values(1,'aaaa','aaaa','aaaa','aaaa'),(2,'xxxc','xxxb','xxxb','xxxb'),(3,'xxxb','xxxc','xxxc','xxxc'),(4,'xxxa','xxxa','xxxa','xxxa'),(5,'zzzz','zzzz','zzzz','zzzz'),(6,NULL,NULL,'xxxa','xxxa'),(7,'zxxx','zxxx','zxxx','zxxx'),(8,'axxx','axxx','axxx','axxx'),(9,'zaaz','zaaz','zaaz','zaaz'),(10,'zbbz','zbbz','zbbz','zbbz');
DELETE FROM t1 WHERE b like 'z%z%' ESCAPE 'a' LIMIT 2;
SELECT * FROM t1;
a	b	c	d	e
1	aaaa	aaaa	aaaa	aaaa
2	xxxc	xxxb	xxxb	xxxb
3	xxxb	xxxc	xxxc	xxxc
4	xxxa	xxxa	xxxa	xxxa
5	zzzz	zzzz	zzzz	zzzz
6	NULL	NULL	xxxa	xxxa
7	zxxx	zxxx	zxxx	zxxx
8	axxx	axxx	axxx	axxx
replace into t1 values(1,'aaaa','aaaa','aaaa','aaaa'),(2,'xxxc','xxxb','xxxb','xxxb'),(3,'xxxb','xxxc','xxxc','xxxc'),(4,'xxxa','xxxa','xxxa','xxxa'),(5,'zzzz','zzzz','zzzz','zzzz'),(6,NULL,NULL,'xxxa','xxxa'),(7,'zxxx','zxxx','zxxx','zxxx'),(8,'axxx','axxx','axxx','axxx'),(9,'zaaz','zaaz','zaaz','zaaz'),(10,'zbbz','zbbz','zbbz','zbbz');
DELETE FROM t1 WHERE b like 'z%%%%%%%%%%%%%%%z%' LIMIT 2;
SELECT * FROM t1;
a	b	c	d	e
1	aaaa	aaaa	aaaa	aaaa
2	xxxc	xxxb	xxxb	xxxb
3	xxxb	xxxc	xxxc	xxxc
4	xxxa	xxxa	xxxa	xxxa
5	zzzz	zzzz	zzzz	zzzz
6	NULL	NULL	xxxa	xxxa
7	zxxx	zxxx	zxxx	zxxx
8	axxx	axxx	axxx	axxx
replace into t1 values(1,'aaaa','aaaa','aaaa','aaaa'),(2,'xxxc','xxxb','xxxb','xxxb'),(3,'xxxb','xxxc','xxxc','xxxc'),(4,'xxxa','xxxa','xxxa','xxxa'),(5,'zzzz','zzzz','zzzz','zzzz'),(6,NULL,NULL,'xxxa','xxxa'),(7,'zxxx','zxxx','zxxx','zxxx'),(8,'axxx','axxx','axxx','axxx'),(9,'zaaz','zaaz','zaaz','zaaz'),(10,'zbbz','zbbz','zbbz','zbbz');
DELETE FROM t1 WHERE b like 'z%%%%%%%%%%%%%%%z%' ESCAPE 'x' LIMIT 2;
SELECT * FROM t1;
a	b	c	d	e
1	aaaa	aaaa	aaaa	aaaa
2	xxxc	xxxb	xxxb	xxxb
3	xxxb	xxxc	xxxc	xxxc
4	xxxa	xxxa	xxxa	xxxa
5	zzzz	zzzz	zzzz	zzzz
6	NULL	NULL	xxxa	xxxa
7	zxxx	zxxx	zxxx	zxxx
8	axxx	axxx	axxx	axxx
replace into t1 values(1,'aaaa','aaaa','aaaa','aaaa'),(2,'xxxc','xxxb','xxxb','xxxb'),(3,'xxxb','xxxc','xxxc','xxxc'),(4,'xxxa','xxxa','xxxa','xxxa'),(5,'zzzz','zzzz','zzzz','zzzz'),(6,NULL,NULL,'xxxa','xxxa'),(7,'zxxx','zxxx','zxxx','zxxx'),(8,'axxx','axxx','axxx','axxx'),(9,'zaaz','zaaz','zaaz','zaaz'),(10,'zbbz','zbbz','zbbz','zbbz');
DELETE FROM t1 WHERE b like 'z%%%%%%%%%%%%%%%z%' ESCAPE 'a' LIMIT 2;
SELECT * FROM t1;
a	b	c	d	e
1	aaaa	aaaa	aaaa	aaaa
2	xxxc	xxxb	xxxb	xxxb
3	xxxb	xxxc	xxxc	xxxc
4	xxxa	xxxa	xxxa	xxxa
5	zzzz	zzzz	zzzz	zzzz
6	NULL	NULL	xxxa	xxxa
7	zxxx	zxxx	zxxx	zxxx
8	axxx	axxx	axxx	axxx
replace into t1 values(1,'aaaa','aaaa','aaaa','aaaa'),(2,'xxxc','xxxb','xxxb','xxxb'),(3,'xxxb','xxxc','xxxc','xxxc'),(4,'xxxa','xxxa','xxxa','xxxa'),(5,'zzzz','zzzz','zzzz','zzzz'),(6,NULL,NULL,'xxxa','xxxa'),(7,'zxxx','zxxx','zxxx','zxxx'),(8,'axxx','axxx','axxx','axxx'),(9,'zaaz','zaaz','zaaz','zaaz'),(10,'zbbz','zbbz','zbbz','zbbz');
DELETE FROM t1 WHERE b like 'z_%%%%%%%%%%%%%%%z%' LIMIT 2;
SELECT * FROM t1;
a	b	c	d	e
1	aaaa	aaaa	aaaa	aaaa
2	xxxc	xxxb	xxxb	xxxb
3	xxxb	xxxc	xxxc	xxxc
4	xxxa	xxxa	xxxa	xxxa
5	zzzz	zzzz	zzzz	zzzz
6	NULL	NULL	xxxa	xxxa
7	zxxx	zxxx	zxxx	zxxx
8	axxx	axxx	axxx	axxx
replace into t1 values(1,'aaaa','aaaa','aaaa','aaaa'),(2,'xxxc','xxxb','xxxb','xxxb'),(3,'xxxb','xxxc','xxxc','xxxc'),(4,'xxxa','xxxa','xxxa','xxxa'),(5,'zzzz','zzzz','zzzz','zzzz'),(6,NULL,NULL,'xxxa','xxxa'),(7,'zxxx','zxxx','zxxx','zxxx'),(8,'axxx','axxx','axxx','axxx'),(9,'zaaz','zaaz','zaaz','zaaz'),(10,'zbbz','zbbz','zbbz','zbbz');
DELETE FROM t1 WHERE b like 'z%_%%%%%%%%%%%%%z%' ESCAPE 'x' LIMIT 2;
SELECT * FROM t1;
a	b	c	d	e
1	aaaa	aaaa	aaaa	aaaa
2	xxxc	xxxb	xxxb	xxxb
3	xxxb	xxxc	xxxc	xxxc
4	xxxa	xxxa	xxxa	xxxa
5	zzzz	zzzz	zzzz	zzzz
6	NULL	NULL	xxxa	xxxa
7	zxxx	zxxx	zxxx	zxxx
8	axxx	axxx	axxx	axxx
replace into t1 values(1,'aaaa','aaaa','aaaa','aaaa'),(2,'xxxc','xxxb','xxxb','xxxb'),(3,'xxxb','xxxc','xxxc','xxxc'),(4,'xxxa','xxxa','xxxa','xxxa'),(5,'zzzz','zzzz','zzzz','zzzz'),(6,NULL,NULL,'xxxa','xxxa'),(7,'zxxx','zxxx','zxxx','zxxx'),(8,'axxx','axxx','axxx','axxx'),(9,'zaaz','zaaz','zaaz','zaaz'),(10,'zbbz','zbbz','zbbz','zbbz');
DELETE FROM t1 WHERE b like 'z%%%%%%%%%%%%%%%_z%' ESCAPE 'a' LIMIT 2;
SELECT * FROM t1;
a	b	c	d	e
1	aaaa	aaaa	aaaa	aaaa
2	xxxc	xxxb	xxxb	xxxb
3	xxxb	xxxc	xxxc	xxxc
4	xxxa	xxxa	xxxa	xxxa
5	zzzz	zzzz	zzzz	zzzz
6	NULL	NULL	xxxa	xxxa
7	zxxx	zxxx	zxxx	zxxx
8	axxx	axxx	axxx	axxx
replace into t1 values(1,'aaaa','aaaa','aaaa','aaaa'),(2,'xxxc','xxxb','xxxb','xxxb'),(3,'xxxb','xxxc','xxxc','xxxc'),(4,'xxxa','xxxa','xxxa','xxxa'),(5,'zzzz','zzzz','zzzz','zzzz'),(6,NULL,NULL,'xxxa','xxxa'),(7,'zxxx','zxxx','zxxx','zxxx'),(8,'axxx','axxx','axxx','axxx'),(9,'zaaz','zaaz','zaaz','zaaz'),(10,'zbbz','zbbz','zbbz','zbbz');
DELETE FROM t1 WHERE b like 'z%%%%%%%%%%%%%%%%%%%%%%%%%%%%%z%%%%%%%%%%%%%%%' LIMIT 2;
SELECT * FROM t1;
a	b	c	d	e
1	aaaa	aaaa	aaaa	aaaa
2	xxxc	xxxb	xxxb	xxxb
3	xxxb	xxxc	xxxc	xxxc
4	xxxa	xxxa	xxxa	xxxa
5	zzzz	zzzz	zzzz	zzzz
6	NULL	NULL	xxxa	xxxa
7	zxxx	zxxx	zxxx	zxxx
8	axxx	axxx	axxx	axxx
replace into t1 values(1,'aaaa','aaaa','aaaa','aaaa'),(2,'xxxc','xxxb','xxxb','xxxb'),(3,'xxxb','xxxc','xxxc','xxxc'),(4,'xxxa','xxxa','xxxa','xxxa'),(5,'zzzz','zzzz','zzzz','zzzz'),(6,NULL,NULL,'xxxa','xxxa'),(7,'zxxx','zxxx','zxxx','zxxx'),(8,'axxx','axxx','axxx','axxx'),(9,'zaaz','zaaz','zaaz','zaaz'),(10,'zbbz','zbbz','zbbz','zbbz');
DELETE FROM t1 WHERE b like 'z%%%%%%%%%%%%%%%%%%%%%%%%%%%%%z%%%%%%%%%%%%%%%' ESCAPE 'x' LIMIT 2;
SELECT * FROM t1;
a	b	c	d	e
1	aaaa	aaaa	aaaa	aaaa
2	xxxc	xxxb	xxxb	xxxb
3	xxxb	xxxc	xxxc	xxxc
4	xxxa	xxxa	xxxa	xxxa
5	zzzz	zzzz	zzzz	zzzz
6	NULL	NULL	xxxa	xxxa
7	zxxx	zxxx	zxxx	zxxx
8	axxx	axxx	axxx	axxx
replace into t1 values(1,'aaaa','aaaa','aaaa','aaaa'),(2,'xxxc','xxxb','xxxb','xxxb'),(3,'xxxb','xxxc','xxxc','xxxc'),(4,'xxxa','xxxa','xxxa','xxxa'),(5,'zzzz','zzzz','zzzz','zzzz'),(6,NULL,NULL,'xxxa','xxxa'),(7,'zxxx','zxxx','zxxx','zxxx'),(8,'axxx','axxx','axxx','axxx'),(9,'zaaz','zaaz','zaaz','zaaz'),(10,'zbbz','zbbz','zbbz','zbbz');
DELETE FROM t1 WHERE b like 'z%%%%%%%%%%%%%%%%%%%%%%%%%%%%%z%%%%%%%%%%%%%%%' ESCAPE 'a' LIMIT 2;
SELECT * FROM t1;
a	b	c	d	e
1	aaaa	aaaa	aaaa	aaaa
2	xxxc	xxxb	xxxb	xxxb
3	xxxb	xxxc	xxxc	xxxc
4	xxxa	xxxa	xxxa	xxxa
5	zzzz	zzzz	zzzz	zzzz
6	NULL	NULL	xxxa	xxxa
7	zxxx	zxxx	zxxx	zxxx
8	axxx	axxx	axxx	axxx
replace into t1 values(1,'aaaa','aaaa','aaaa','aaaa'),(2,'xxxc','xxxb','xxxb','xxxb'),(3,'xxxb','xxxc','xxxc','xxxc'),(4,'xxxa','xxxa','xxxa','xxxa'),(5,'zzzz','zzzz','zzzz','zzzz'),(6,NULL,NULL,'xxxa','xxxa'),(7,'zxxx','zxxx','zxxx','zxxx'),(8,'axxx','axxx','axxx','axxx'),(9,'zaaz','zaaz','zaaz','zaaz'),(10,'zbbz','zbbz','zbbz','zbbz');
DELETE FROM t1 WHERE b like 'z_%%%%%%%%%%%%%%%z%%%%%%%%%%%%%%%' LIMIT 2;
SELECT * FROM t1;
a	b	c	d	e
1	aaaa	aaaa	aaaa	aaaa
2	xxxc	xxxb	xxxb	xxxb
3	xxxb	xxxc	xxxc	xxxc
4	xxxa	xxxa	xxxa	xxxa
5	zzzz	zzzz	zzzz	zzzz
6	NULL	NULL	xxxa	xxxa
7	zxxx	zxxx	zxxx	zxxx
8	axxx	axxx	axxx	axxx
replace into t1 values(1,'aaaa','aaaa','aaaa','aaaa'),(2,'xxxc','xxxb','xxxb','xxxb'),(3,'xxxb','xxxc','xxxc','xxxc'),(4,'xxxa','xxxa','xxxa','xxxa'),(5,'zzzz','zzzz','zzzz','zzzz'),(6,NULL,NULL,'xxxa','xxxa'),(7,'zxxx','zxxx','zxxx','zxxx'),(8,'axxx','axxx','axxx','axxx'),(9,'zaaz','zaaz','zaaz','zaaz'),(10,'zbbz','zbbz','zbbz','zbbz');
DELETE FROM t1 WHERE b like 'z%%%%%%%%%%%%%%%_%%%%%%%%%%%%%z%%%%%%%%%%%%%%%' ESCAPE 'x' LIMIT 2;
SELECT * FROM t1;
a	b	c	d	e
1	aaaa	aaaa	aaaa	aaaa
2	xxxc	xxxb	xxxb	xxxb
3	xxxb	xxxc	xxxc	xxxc
4	xxxa	xxxa	xxxa	xxxa
5	zzzz	zzzz	zzzz	zzzz
6	NULL	NULL	xxxa	xxxa
7	zxxx	zxxx	zxxx	zxxx
8	axxx	axxx	axxx	axxx
replace into t1 values(1,'aaaa','aaaa','aaaa','aaaa'),(2,'xxxc','xxxb','xxxb','xxxb'),(3,'xxxb','xxxc','xxxc','xxxc'),(4,'xxxa','xxxa','xxxa','xxxa'),(5,'zzzz','zzzz','zzzz','zzzz'),(6,NULL,NULL,'xxxa','xxxa'),(7,'zxxx','zxxx','zxxx','zxxx'),(8,'axxx','axxx','axxx','axxx'),(9,'zaaz','zaaz','zaaz','zaaz'),(10,'zbbz','zbbz','zbbz','zbbz');
DELETE FROM t1 WHERE b like 'z%%%%%%%%%%%%%%%%%%%%%%%%%%%%%_z%%%%%%%%%%%%%%%' ESCAPE 'a' LIMIT 2;
SELECT * FROM t1;
a	b	c	d	e
1	aaaa	aaaa	aaaa	aaaa
2	xxxc	xxxb	xxxb	xxxb
3	xxxb	xxxc	xxxc	xxxc
4	xxxa	xxxa	xxxa	xxxa
5	zzzz	zzzz	zzzz	zzzz
6	NULL	NULL	xxxa	xxxa
7	zxxx	zxxx	zxxx	zxxx
8	axxx	axxx	axxx	axxx
-- col_str1 [NOT] LIKE ‘%xxx%’ [ESCAPE col_str3]
replace into t1 values(1,'aaaa','aaaa','aaaa','aaaa'),(2,'xxxc','xxxb','xxxb','xxxb'),(3,'xxxb','xxxc','xxxc','xxxc'),(4,'xxxa','xxxa','xxxa','xxxa'),(5,'zzzz','zzzz','zzzz','zzzz'),(6,NULL,NULL,'xxxa','xxxa'),(7,'zxxx','zxxx','zxxx','zxxx'),(8,'axxx','axxx','axxx','axxx'),(9,'zaaz','zaaz','zaaz','zaaz'),(10,'zbbz','zbbz','zbbz','zbbz');
DELETE FROM t1 WHERE b like '%xxx%' LIMIT 2;
SELECT * FROM t1;
a	b	c	d	e
1	aaaa	aaaa	aaaa	aaaa
2	xxxc	xxxb	xxxb	xxxb
3	xxxb	xxxc	xxxc	xxxc
5	zzzz	zzzz	zzzz	zzzz
6	NULL	NULL	xxxa	xxxa
7	zxxx	zxxx	zxxx	zxxx
9	zaaz	zaaz	zaaz	zaaz
10	zbbz	zbbz	zbbz	zbbz
replace into t1 values(1,'aaaa','aaaa','aaaa','aaaa'),(2,'xxxc','xxxb','xxxb','xxxb'),(3,'xxxb','xxxc','xxxc','xxxc'),(4,'xxxa','xxxa','xxxa','xxxa'),(5,'zzzz','zzzz','zzzz','zzzz'),(6,NULL,NULL,'xxxa','xxxa'),(7,'zxxx','zxxx','zxxx','zxxx'),(8,'axxx','axxx','axxx','axxx'),(9,'zaaz','zaaz','zaaz','zaaz'),(10,'zbbz','zbbz','zbbz','zbbz');
DELETE FROM t1 WHERE b like '%xxx%' ESCAPE 'x' LIMIT 2;
SELECT * FROM t1;
a	b	c	d	e
1	aaaa	aaaa	aaaa	aaaa
2	xxxc	xxxb	xxxb	xxxb
3	xxxb	xxxc	xxxc	xxxc
4	xxxa	xxxa	xxxa	xxxa
5	zzzz	zzzz	zzzz	zzzz
6	NULL	NULL	xxxa	xxxa
7	zxxx	zxxx	zxxx	zxxx
8	axxx	axxx	axxx	axxx
9	zaaz	zaaz	zaaz	zaaz
10	zbbz	zbbz	zbbz	zbbz
replace into t1 values(1,'aaaa','aaaa','aaaa','aaaa'),(2,'xxxc','xxxb','xxxb','xxxb'),(3,'xxxb','xxxc','xxxc','xxxc'),(4,'xxxa','xxxa','xxxa','xxxa'),(5,'zzzz','zzzz','zzzz','zzzz'),(6,NULL,NULL,'xxxa','xxxa'),(7,'zxxx','zxxx','zxxx','zxxx'),(8,'axxx','axxx','axxx','axxx'),(9,'zaaz','zaaz','zaaz','zaaz'),(10,'zbbz','zbbz','zbbz','zbbz');
DELETE FROM t1 WHERE b like '%xxx%' ESCAPE 'a' LIMIT 2;
SELECT * FROM t1;
a	b	c	d	e
1	aaaa	aaaa	aaaa	aaaa
2	xxxc	xxxb	xxxb	xxxb
3	xxxb	xxxc	xxxc	xxxc
5	zzzz	zzzz	zzzz	zzzz
6	NULL	NULL	xxxa	xxxa
7	zxxx	zxxx	zxxx	zxxx
9	zaaz	zaaz	zaaz	zaaz
10	zbbz	zbbz	zbbz	zbbz
replace into t1 values(1,'aaaa','aaaa','aaaa','aaaa'),(2,'xxxc','xxxb','xxxb','xxxb'),(3,'xxxb','xxxc','xxxc','xxxc'),(4,'xxxa','xxxa','xxxa','xxxa'),(5,'zzzz','zzzz','zzzz','zzzz'),(6,NULL,NULL,'xxxa','xxxa'),(7,'zxxx','zxxx','zxxx','zxxx'),(8,'axxx','axxx','axxx','axxx'),(9,'zaaz','zaaz','zaaz','zaaz'),(10,'zbbz','zbbz','zbbz','zbbz');
DELETE FROM t1 WHERE b NOT like '%xxx%' LIMIT 2;
SELECT * FROM t1;
a	b	c	d	e
2	xxxc	xxxb	xxxb	xxxb
3	xxxb	xxxc	xxxc	xxxc
4	xxxa	xxxa	xxxa	xxxa
6	NULL	NULL	xxxa	xxxa
7	zxxx	zxxx	zxxx	zxxx
8	axxx	axxx	axxx	axxx
9	zaaz	zaaz	zaaz	zaaz
10	zbbz	zbbz	zbbz	zbbz
replace into t1 values(1,'aaaa','aaaa','aaaa','aaaa'),(2,'xxxc','xxxb','xxxb','xxxb'),(3,'xxxb','xxxc','xxxc','xxxc'),(4,'xxxa','xxxa','xxxa','xxxa'),(5,'zzzz','zzzz','zzzz','zzzz'),(6,NULL,NULL,'xxxa','xxxa'),(7,'zxxx','zxxx','zxxx','zxxx'),(8,'axxx','axxx','axxx','axxx'),(9,'zaaz','zaaz','zaaz','zaaz'),(10,'zbbz','zbbz','zbbz','zbbz');
DELETE FROM t1 WHERE b NOT like '%xxx%' ESCAPE 'x' LIMIT 2;
SELECT * FROM t1;
a	b	c	d	e
3	xxxb	xxxc	xxxc	xxxc
4	xxxa	xxxa	xxxa	xxxa
5	zzzz	zzzz	zzzz	zzzz
6	NULL	NULL	xxxa	xxxa
7	zxxx	zxxx	zxxx	zxxx
8	axxx	axxx	axxx	axxx
9	zaaz	zaaz	zaaz	zaaz
10	zbbz	zbbz	zbbz	zbbz
replace into t1 values(1,'aaaa','aaaa','aaaa','aaaa'),(2,'xxxc','xxxb','xxxb','xxxb'),(3,'xxxb','xxxc','xxxc','xxxc'),(4,'xxxa','xxxa','xxxa','xxxa'),(5,'zzzz','zzzz','zzzz','zzzz'),(6,NULL,NULL,'xxxa','xxxa'),(7,'zxxx','zxxx','zxxx','zxxx'),(8,'axxx','axxx','axxx','axxx'),(9,'zaaz','zaaz','zaaz','zaaz'),(10,'zbbz','zbbz','zbbz','zbbz');
DELETE FROM t1 WHERE b NOT like '%xxx%' ESCAPE 'a' LIMIT 2;
SELECT * FROM t1;
a	b	c	d	e
2	xxxc	xxxb	xxxb	xxxb
3	xxxb	xxxc	xxxc	xxxc
4	xxxa	xxxa	xxxa	xxxa
6	NULL	NULL	xxxa	xxxa
7	zxxx	zxxx	zxxx	zxxx
8	axxx	axxx	axxx	axxx
9	zaaz	zaaz	zaaz	zaaz
10	zbbz	zbbz	zbbz	zbbz
-- col_str1 [NOT] LIKE ‘%xxx’ [ESCAPE col_str3]
replace into t1 values(1,'aaaa','aaaa','aaaa','aaaa'),(2,'xxxc','xxxb','xxxb','xxxb'),(3,'xxxb','xxxc','xxxc','xxxc'),(4,'xxxa','xxxa','xxxa','xxxa'),(5,'zzzz','zzzz','zzzz','zzzz'),(6,NULL,NULL,'xxxa','xxxa'),(7,'zxxx','zxxx','zxxx','zxxx'),(8,'axxx','axxx','axxx','axxx'),(9,'zaaz','zaaz','zaaz','zaaz'),(10,'zbbz','zbbz','zbbz','zbbz');
DELETE FROM t1 WHERE b like '%xxx' LIMIT 2;
SELECT * FROM t1;
a	b	c	d	e
1	aaaa	aaaa	aaaa	aaaa
2	xxxc	xxxb	xxxb	xxxb
3	xxxb	xxxc	xxxc	xxxc
4	xxxa	xxxa	xxxa	xxxa
5	zzzz	zzzz	zzzz	zzzz
6	NULL	NULL	xxxa	xxxa
9	zaaz	zaaz	zaaz	zaaz
10	zbbz	zbbz	zbbz	zbbz
replace into t1 values(1,'aaaa','aaaa','aaaa','aaaa'),(2,'xxxc','xxxb','xxxb','xxxb'),(3,'xxxb','xxxc','xxxc','xxxc'),(4,'xxxa','xxxa','xxxa','xxxa'),(5,'zzzz','zzzz','zzzz','zzzz'),(6,NULL,NULL,'xxxa','xxxa'),(7,'zxxx','zxxx','zxxx','zxxx'),(8,'axxx','axxx','axxx','axxx'),(9,'zaaz','zaaz','zaaz','zaaz'),(10,'zbbz','zbbz','zbbz','zbbz');
DELETE FROM t1 WHERE b like '%xxx' ESCAPE 'x' LIMIT 2;
SELECT * FROM t1;
a	b	c	d	e
1	aaaa	aaaa	aaaa	aaaa
2	xxxc	xxxb	xxxb	xxxb
3	xxxb	xxxc	xxxc	xxxc
4	xxxa	xxxa	xxxa	xxxa
5	zzzz	zzzz	zzzz	zzzz
6	NULL	NULL	xxxa	xxxa
9	zaaz	zaaz	zaaz	zaaz
10	zbbz	zbbz	zbbz	zbbz
replace into t1 values(1,'aaaa','aaaa','aaaa','aaaa'),(2,'xxxc','xxxb','xxxb','xxxb'),(3,'xxxb','xxxc','xxxc','xxxc'),(4,'xxxa','xxxa','xxxa','xxxa'),(5,'zzzz','zzzz','zzzz','zzzz'),(6,NULL,NULL,'xxxa','xxxa'),(7,'zxxx','zxxx','zxxx','zxxx'),(8,'axxx','axxx','axxx','axxx'),(9,'zaaz','zaaz','zaaz','zaaz'),(10,'zbbz','zbbz','zbbz','zbbz');
DELETE FROM t1 WHERE b like '%xxx' ESCAPE 'a' LIMIT 2;
SELECT * FROM t1;
a	b	c	d	e
1	aaaa	aaaa	aaaa	aaaa
2	xxxc	xxxb	xxxb	xxxb
3	xxxb	xxxc	xxxc	xxxc
4	xxxa	xxxa	xxxa	xxxa
5	zzzz	zzzz	zzzz	zzzz
6	NULL	NULL	xxxa	xxxa
9	zaaz	zaaz	zaaz	zaaz
10	zbbz	zbbz	zbbz	zbbz
replace into t1 values(1,'aaaa','aaaa','aaaa','aaaa'),(2,'xxxc','xxxb','xxxb','xxxb'),(3,'xxxb','xxxc','xxxc','xxxc'),(4,'xxxa','xxxa','xxxa','xxxa'),(5,'zzzz','zzzz','zzzz','zzzz'),(6,NULL,NULL,'xxxa','xxxa'),(7,'zxxx','zxxx','zxxx','zxxx'),(8,'axxx','axxx','axxx','axxx'),(9,'zaaz','zaaz','zaaz','zaaz'),(10,'zbbz','zbbz','zbbz','zbbz');
DELETE FROM t1 WHERE b NOT like '_xxx' LIMIT 2;
SELECT * FROM t1;
a	b	c	d	e
3	xxxb	xxxc	xxxc	xxxc
4	xxxa	xxxa	xxxa	xxxa
5	zzzz	zzzz	zzzz	zzzz
6	NULL	NULL	xxxa	xxxa
7	zxxx	zxxx	zxxx	zxxx
8	axxx	axxx	axxx	axxx
9	zaaz	zaaz	zaaz	zaaz
10	zbbz	zbbz	zbbz	zbbz
replace into t1 values(1,'aaaa','aaaa','aaaa','aaaa'),(2,'xxxc','xxxb','xxxb','xxxb'),(3,'xxxb','xxxc','xxxc','xxxc'),(4,'xxxa','xxxa','xxxa','xxxa'),(5,'zzzz','zzzz','zzzz','zzzz'),(6,NULL,NULL,'xxxa','xxxa'),(7,'zxxx','zxxx','zxxx','zxxx'),(8,'axxx','axxx','axxx','axxx'),(9,'zaaz','zaaz','zaaz','zaaz'),(10,'zbbz','zbbz','zbbz','zbbz');
DELETE FROM t1 WHERE b NOT like '_xxx' ESCAPE 'x' LIMIT 2;
SELECT * FROM t1;
a	b	c	d	e
3	xxxb	xxxc	xxxc	xxxc
4	xxxa	xxxa	xxxa	xxxa
5	zzzz	zzzz	zzzz	zzzz
6	NULL	NULL	xxxa	xxxa
7	zxxx	zxxx	zxxx	zxxx
8	axxx	axxx	axxx	axxx
9	zaaz	zaaz	zaaz	zaaz
10	zbbz	zbbz	zbbz	zbbz
replace into t1 values(1,'aaaa','aaaa','aaaa','aaaa'),(2,'xxxc','xxxb','xxxb','xxxb'),(3,'xxxb','xxxc','xxxc','xxxc'),(4,'xxxa','xxxa','xxxa','xxxa'),(5,'zzzz','zzzz','zzzz','zzzz'),(6,NULL,NULL,'xxxa','xxxa'),(7,'zxxx','zxxx','zxxx','zxxx'),(8,'axxx','axxx','axxx','axxx'),(9,'zaaz','zaaz','zaaz','zaaz'),(10,'zbbz','zbbz','zbbz','zbbz');
DELETE FROM t1 WHERE b NOT like '_xxx' ESCAPE 'a' LIMIT 2;
SELECT * FROM t1;
a	b	c	d	e
3	xxxb	xxxc	xxxc	xxxc
4	xxxa	xxxa	xxxa	xxxa
5	zzzz	zzzz	zzzz	zzzz
6	NULL	NULL	xxxa	xxxa
7	zxxx	zxxx	zxxx	zxxx
8	axxx	axxx	axxx	axxx
9	zaaz	zaaz	zaaz	zaaz
10	zbbz	zbbz	zbbz	zbbz
-- col_str1 [NOT] LIKE ‘xxx_’ [ESCAPE col_str3]
replace into t1 values(1,'aaaa','aaaa','aaaa','aaaa'),(2,'xxxc','xxxb','xxxb','xxxb'),(3,'xxxb','xxxc','xxxc','xxxc'),(4,'xxxa','xxxa','xxxa','xxxa'),(5,'zzzz','zzzz','zzzz','zzzz'),(6,NULL,NULL,'xxxa','xxxa'),(7,'zxxx','zxxx','zxxx','zxxx'),(8,'axxx','axxx','axxx','axxx'),(9,'zaaz','zaaz','zaaz','zaaz'),(10,'zbbz','zbbz','zbbz','zbbz');
DELETE FROM t1 WHERE b like 'xxx_' LIMIT 2;
SELECT * FROM t1;
a	b	c	d	e
1	aaaa	aaaa	aaaa	aaaa
2	xxxc	xxxb	xxxb	xxxb
5	zzzz	zzzz	zzzz	zzzz
6	NULL	NULL	xxxa	xxxa
7	zxxx	zxxx	zxxx	zxxx
8	axxx	axxx	axxx	axxx
9	zaaz	zaaz	zaaz	zaaz
10	zbbz	zbbz	zbbz	zbbz
replace into t1 values(1,'aaaa','aaaa','aaaa','aaaa'),(2,'xxxc','xxxb','xxxb','xxxb'),(3,'xxxb','xxxc','xxxc','xxxc'),(4,'xxxa','xxxa','xxxa','xxxa'),(5,'zzzz','zzzz','zzzz','zzzz'),(6,NULL,NULL,'xxxa','xxxa'),(7,'zxxx','zxxx','zxxx','zxxx'),(8,'axxx','axxx','axxx','axxx'),(9,'zaaz','zaaz','zaaz','zaaz'),(10,'zbbz','zbbz','zbbz','zbbz');
DELETE FROM t1 WHERE b like 'xxx_' ESCAPE 'x' LIMIT 2;
SELECT * FROM t1;
a	b	c	d	e
1	aaaa	aaaa	aaaa	aaaa
2	xxxc	xxxb	xxxb	xxxb
3	xxxb	xxxc	xxxc	xxxc
4	xxxa	xxxa	xxxa	xxxa
5	zzzz	zzzz	zzzz	zzzz
6	NULL	NULL	xxxa	xxxa
7	zxxx	zxxx	zxxx	zxxx
8	axxx	axxx	axxx	axxx
9	zaaz	zaaz	zaaz	zaaz
10	zbbz	zbbz	zbbz	zbbz
replace into t1 values(1,'aaaa','aaaa','aaaa','aaaa'),(2,'xxxc','xxxb','xxxb','xxxb'),(3,'xxxb','xxxc','xxxc','xxxc'),(4,'xxxa','xxxa','xxxa','xxxa'),(5,'zzzz','zzzz','zzzz','zzzz'),(6,NULL,NULL,'xxxa','xxxa'),(7,'zxxx','zxxx','zxxx','zxxx'),(8,'axxx','axxx','axxx','axxx'),(9,'zaaz','zaaz','zaaz','zaaz'),(10,'zbbz','zbbz','zbbz','zbbz');
DELETE FROM t1 WHERE b like 'xxx_' ESCAPE 'a' LIMIT 2;
SELECT * FROM t1;
a	b	c	d	e
1	aaaa	aaaa	aaaa	aaaa
2	xxxc	xxxb	xxxb	xxxb
5	zzzz	zzzz	zzzz	zzzz
6	NULL	NULL	xxxa	xxxa
7	zxxx	zxxx	zxxx	zxxx
8	axxx	axxx	axxx	axxx
9	zaaz	zaaz	zaaz	zaaz
10	zbbz	zbbz	zbbz	zbbz
replace into t1 values(1,'aaaa','aaaa','aaaa','aaaa'),(2,'xxxc','xxxb','xxxb','xxxb'),(3,'xxxb','xxxc','xxxc','xxxc'),(4,'xxxa','xxxa','xxxa','xxxa'),(5,'zzzz','zzzz','zzzz','zzzz'),(6,NULL,NULL,'xxxa','xxxa'),(7,'zxxx','zxxx','zxxx','zxxx'),(8,'axxx','axxx','axxx','axxx'),(9,'zaaz','zaaz','zaaz','zaaz'),(10,'zbbz','zbbz','zbbz','zbbz');
DELETE FROM t1 WHERE b NOT like 'xxx_' LIMIT 2;
SELECT * FROM t1;
a	b	c	d	e
2	xxxc	xxxb	xxxb	xxxb
3	xxxb	xxxc	xxxc	xxxc
4	xxxa	xxxa	xxxa	xxxa
6	NULL	NULL	xxxa	xxxa
7	zxxx	zxxx	zxxx	zxxx
8	axxx	axxx	axxx	axxx
9	zaaz	zaaz	zaaz	zaaz
10	zbbz	zbbz	zbbz	zbbz
replace into t1 values(1,'aaaa','aaaa','aaaa','aaaa'),(2,'xxxc','xxxb','xxxb','xxxb'),(3,'xxxb','xxxc','xxxc','xxxc'),(4,'xxxa','xxxa','xxxa','xxxa'),(5,'zzzz','zzzz','zzzz','zzzz'),(6,NULL,NULL,'xxxa','xxxa'),(7,'zxxx','zxxx','zxxx','zxxx'),(8,'axxx','axxx','axxx','axxx'),(9,'zaaz','zaaz','zaaz','zaaz'),(10,'zbbz','zbbz','zbbz','zbbz');
DELETE FROM t1 WHERE b NOT like 'xxx_' ESCAPE 'x' LIMIT 2;
SELECT * FROM t1;
a	b	c	d	e
3	xxxb	xxxc	xxxc	xxxc
4	xxxa	xxxa	xxxa	xxxa
5	zzzz	zzzz	zzzz	zzzz
6	NULL	NULL	xxxa	xxxa
7	zxxx	zxxx	zxxx	zxxx
8	axxx	axxx	axxx	axxx
9	zaaz	zaaz	zaaz	zaaz
10	zbbz	zbbz	zbbz	zbbz
replace into t1 values(1,'aaaa','aaaa','aaaa','aaaa'),(2,'xxxc','xxxb','xxxb','xxxb'),(3,'xxxb','xxxc','xxxc','xxxc'),(4,'xxxa','xxxa','xxxa','xxxa'),(5,'zzzz','zzzz','zzzz','zzzz'),(6,NULL,NULL,'xxxa','xxxa'),(7,'zxxx','zxxx','zxxx','zxxx'),(8,'axxx','axxx','axxx','axxx'),(9,'zaaz','zaaz','zaaz','zaaz'),(10,'zbbz','zbbz','zbbz','zbbz');
DELETE FROM t1 WHERE b NOT like 'xxx_' ESCAPE 'a' LIMIT 2;
SELECT * FROM t1;
a	b	c	d	e
2	xxxc	xxxb	xxxb	xxxb
3	xxxb	xxxc	xxxc	xxxc
4	xxxa	xxxa	xxxa	xxxa
6	NULL	NULL	xxxa	xxxa
7	zxxx	zxxx	zxxx	zxxx
8	axxx	axxx	axxx	axxx
9	zaaz	zaaz	zaaz	zaaz
10	zbbz	zbbz	zbbz	zbbz
-- col_str1 [NOT] LIKE ‘_xxx_’ [ESCAPE col_str3]
replace into t1 values(1,'aaaa','aaaa','aaaa','aaaa'),(2,'xxxc','xxxb','xxxb','xxxb'),(3,'xxxb','xxxc','xxxc','xxxc'),(4,'xxxa','xxxa','xxxa','xxxa'),(5,'zzzz','zzzz','zzzz','zzzz'),(6,NULL,NULL,'xxxa','xxxa'),(7,'zxxx','zxxx','zxxx','zxxx'),(8,'axxx','axxx','axxx','axxx'),(9,'zaaz','zaaz','zaaz','zaaz'),(10,'zbbz','zbbz','zbbz','zbbz');
DELETE FROM t1 WHERE b like '_xxx_' LIMIT 2;
SELECT * FROM t1;
a	b	c	d	e
1	aaaa	aaaa	aaaa	aaaa
2	xxxc	xxxb	xxxb	xxxb
3	xxxb	xxxc	xxxc	xxxc
4	xxxa	xxxa	xxxa	xxxa
5	zzzz	zzzz	zzzz	zzzz
6	NULL	NULL	xxxa	xxxa
7	zxxx	zxxx	zxxx	zxxx
8	axxx	axxx	axxx	axxx
9	zaaz	zaaz	zaaz	zaaz
10	zbbz	zbbz	zbbz	zbbz
replace into t1 values(1,'aaaa','aaaa','aaaa','aaaa'),(2,'xxxc','xxxb','xxxb','xxxb'),(3,'xxxb','xxxc','xxxc','xxxc'),(4,'xxxa','xxxa','xxxa','xxxa'),(5,'zzzz','zzzz','zzzz','zzzz'),(6,NULL,NULL,'xxxa','xxxa'),(7,'zxxx','zxxx','zxxx','zxxx'),(8,'axxx','axxx','axxx','axxx'),(9,'zaaz','zaaz','zaaz','zaaz'),(10,'zbbz','zbbz','zbbz','zbbz');
DELETE FROM t1 WHERE b like '_xxx_' ESCAPE 'x' LIMIT 2;
SELECT * FROM t1;
a	b	c	d	e
1	aaaa	aaaa	aaaa	aaaa
2	xxxc	xxxb	xxxb	xxxb
3	xxxb	xxxc	xxxc	xxxc
4	xxxa	xxxa	xxxa	xxxa
5	zzzz	zzzz	zzzz	zzzz
6	NULL	NULL	xxxa	xxxa
7	zxxx	zxxx	zxxx	zxxx
8	axxx	axxx	axxx	axxx
9	zaaz	zaaz	zaaz	zaaz
10	zbbz	zbbz	zbbz	zbbz
replace into t1 values(1,'aaaa','aaaa','aaaa','aaaa'),(2,'xxxc','xxxb','xxxb','xxxb'),(3,'xxxb','xxxc','xxxc','xxxc'),(4,'xxxa','xxxa','xxxa','xxxa'),(5,'zzzz','zzzz','zzzz','zzzz'),(6,NULL,NULL,'xxxa','xxxa'),(7,'zxxx','zxxx','zxxx','zxxx'),(8,'axxx','axxx','axxx','axxx'),(9,'zaaz','zaaz','zaaz','zaaz'),(10,'zbbz','zbbz','zbbz','zbbz');
DELETE FROM t1 WHERE b like '_xxx_' ESCAPE 'a' LIMIT 2;
SELECT * FROM t1;
a	b	c	d	e
1	aaaa	aaaa	aaaa	aaaa
2	xxxc	xxxb	xxxb	xxxb
3	xxxb	xxxc	xxxc	xxxc
4	xxxa	xxxa	xxxa	xxxa
5	zzzz	zzzz	zzzz	zzzz
6	NULL	NULL	xxxa	xxxa
7	zxxx	zxxx	zxxx	zxxx
8	axxx	axxx	axxx	axxx
9	zaaz	zaaz	zaaz	zaaz
10	zbbz	zbbz	zbbz	zbbz
replace into t1 values(1,'aaaa','aaaa','aaaa','aaaa'),(2,'xxxc','xxxb','xxxb','xxxb'),(3,'xxxb','xxxc','xxxc','xxxc'),(4,'xxxa','xxxa','xxxa','xxxa'),(5,'zzzz','zzzz','zzzz','zzzz'),(6,NULL,NULL,'xxxa','xxxa'),(7,'zxxx','zxxx','zxxx','zxxx'),(8,'axxx','axxx','axxx','axxx'),(9,'zaaz','zaaz','zaaz','zaaz'),(10,'zbbz','zbbz','zbbz','zbbz');
DELETE FROM t1 WHERE b NOT like '_xxx_' LIMIT 2;
SELECT * FROM t1;
a	b	c	d	e
3	xxxb	xxxc	xxxc	xxxc
4	xxxa	xxxa	xxxa	xxxa
5	zzzz	zzzz	zzzz	zzzz
6	NULL	NULL	xxxa	xxxa
7	zxxx	zxxx	zxxx	zxxx
8	axxx	axxx	axxx	axxx
9	zaaz	zaaz	zaaz	zaaz
10	zbbz	zbbz	zbbz	zbbz
replace into t1 values(1,'aaaa','aaaa','aaaa','aaaa'),(2,'xxxc','xxxb','xxxb','xxxb'),(3,'xxxb','xxxc','xxxc','xxxc'),(4,'xxxa','xxxa','xxxa','xxxa'),(5,'zzzz','zzzz','zzzz','zzzz'),(6,NULL,NULL,'xxxa','xxxa'),(7,'zxxx','zxxx','zxxx','zxxx'),(8,'axxx','axxx','axxx','axxx'),(9,'zaaz','zaaz','zaaz','zaaz'),(10,'zbbz','zbbz','zbbz','zbbz');
DELETE FROM t1 WHERE b NOT like '_xxx_' ESCAPE 'x' LIMIT 2;
SELECT * FROM t1;
a	b	c	d	e
3	xxxb	xxxc	xxxc	xxxc
4	xxxa	xxxa	xxxa	xxxa
5	zzzz	zzzz	zzzz	zzzz
6	NULL	NULL	xxxa	xxxa
7	zxxx	zxxx	zxxx	zxxx
8	axxx	axxx	axxx	axxx
9	zaaz	zaaz	zaaz	zaaz
10	zbbz	zbbz	zbbz	zbbz
replace into t1 values(1,'aaaa','aaaa','aaaa','aaaa'),(2,'xxxc','xxxb','xxxb','xxxb'),(3,'xxxb','xxxc','xxxc','xxxc'),(4,'xxxa','xxxa','xxxa','xxxa'),(5,'zzzz','zzzz','zzzz','zzzz'),(6,NULL,NULL,'xxxa','xxxa'),(7,'zxxx','zxxx','zxxx','zxxx'),(8,'axxx','axxx','axxx','axxx'),(9,'zaaz','zaaz','zaaz','zaaz'),(10,'zbbz','zbbz','zbbz','zbbz');
DELETE FROM t1 WHERE b NOT like '_xxx_' ESCAPE 'a' LIMIT 2;
SELECT * FROM t1;
a	b	c	d	e
3	xxxb	xxxc	xxxc	xxxc
4	xxxa	xxxa	xxxa	xxxa
5	zzzz	zzzz	zzzz	zzzz
6	NULL	NULL	xxxa	xxxa
7	zxxx	zxxx	zxxx	zxxx
8	axxx	axxx	axxx	axxx
9	zaaz	zaaz	zaaz	zaaz
10	zbbz	zbbz	zbbz	zbbz
-- col_str1 [NOT] LIKE ‘_xxx’ [ESCAPE col_str3]
replace into t1 values(1,'aaaa','aaaa','aaaa','aaaa'),(2,'xxxc','xxxb','xxxb','xxxb'),(3,'xxxb','xxxc','xxxc','xxxc'),(4,'xxxa','xxxa','xxxa','xxxa'),(5,'zzzz','zzzz','zzzz','zzzz'),(6,NULL,NULL,'xxxa','xxxa'),(7,'zxxx','zxxx','zxxx','zxxx'),(8,'axxx','axxx','axxx','axxx'),(9,'zaaz','zaaz','zaaz','zaaz'),(10,'zbbz','zbbz','zbbz','zbbz');
DELETE FROM t1 WHERE b like '_xxx' LIMIT 2;
SELECT * FROM t1;
a	b	c	d	e
1	aaaa	aaaa	aaaa	aaaa
2	xxxc	xxxb	xxxb	xxxb
3	xxxb	xxxc	xxxc	xxxc
4	xxxa	xxxa	xxxa	xxxa
5	zzzz	zzzz	zzzz	zzzz
6	NULL	NULL	xxxa	xxxa
9	zaaz	zaaz	zaaz	zaaz
10	zbbz	zbbz	zbbz	zbbz
replace into t1 values(1,'aaaa','aaaa','aaaa','aaaa'),(2,'xxxc','xxxb','xxxb','xxxb'),(3,'xxxb','xxxc','xxxc','xxxc'),(4,'xxxa','xxxa','xxxa','xxxa'),(5,'zzzz','zzzz','zzzz','zzzz'),(6,NULL,NULL,'xxxa','xxxa'),(7,'zxxx','zxxx','zxxx','zxxx'),(8,'axxx','axxx','axxx','axxx'),(9,'zaaz','zaaz','zaaz','zaaz'),(10,'zbbz','zbbz','zbbz','zbbz');
DELETE FROM t1 WHERE b like '_xxx' ESCAPE 'x' LIMIT 2;
SELECT * FROM t1;
a	b	c	d	e
1	aaaa	aaaa	aaaa	aaaa
2	xxxc	xxxb	xxxb	xxxb
3	xxxb	xxxc	xxxc	xxxc
4	xxxa	xxxa	xxxa	xxxa
5	zzzz	zzzz	zzzz	zzzz
6	NULL	NULL	xxxa	xxxa
7	zxxx	zxxx	zxxx	zxxx
8	axxx	axxx	axxx	axxx
9	zaaz	zaaz	zaaz	zaaz
10	zbbz	zbbz	zbbz	zbbz
replace into t1 values(1,'aaaa','aaaa','aaaa','aaaa'),(2,'xxxc','xxxb','xxxb','xxxb'),(3,'xxxb','xxxc','xxxc','xxxc'),(4,'xxxa','xxxa','xxxa','xxxa'),(5,'zzzz','zzzz','zzzz','zzzz'),(6,NULL,NULL,'xxxa','xxxa'),(7,'zxxx','zxxx','zxxx','zxxx'),(8,'axxx','axxx','axxx','axxx'),(9,'zaaz','zaaz','zaaz','zaaz'),(10,'zbbz','zbbz','zbbz','zbbz');
DELETE FROM t1 WHERE b like '_xxx' ESCAPE 'a' LIMIT 2;
SELECT * FROM t1;
a	b	c	d	e
1	aaaa	aaaa	aaaa	aaaa
2	xxxc	xxxb	xxxb	xxxb
3	xxxb	xxxc	xxxc	xxxc
4	xxxa	xxxa	xxxa	xxxa
5	zzzz	zzzz	zzzz	zzzz
6	NULL	NULL	xxxa	xxxa
9	zaaz	zaaz	zaaz	zaaz
10	zbbz	zbbz	zbbz	zbbz
replace into t1 values(1,'aaaa','aaaa','aaaa','aaaa'),(2,'xxxc','xxxb','xxxb','xxxb'),(3,'xxxb','xxxc','xxxc','xxxc'),(4,'xxxa','xxxa','xxxa','xxxa'),(5,'zzzz','zzzz','zzzz','zzzz'),(6,NULL,NULL,'xxxa','xxxa'),(7,'zxxx','zxxx','zxxx','zxxx'),(8,'axxx','axxx','axxx','axxx'),(9,'zaaz','zaaz','zaaz','zaaz'),(10,'zbbz','zbbz','zbbz','zbbz');
DELETE FROM t1 WHERE b NOT like '_xxx' LIMIT 2;
SELECT * FROM t1;
a	b	c	d	e
3	xxxb	xxxc	xxxc	xxxc
4	xxxa	xxxa	xxxa	xxxa
5	zzzz	zzzz	zzzz	zzzz
6	NULL	NULL	xxxa	xxxa
7	zxxx	zxxx	zxxx	zxxx
8	axxx	axxx	axxx	axxx
9	zaaz	zaaz	zaaz	zaaz
10	zbbz	zbbz	zbbz	zbbz
replace into t1 values(1,'aaaa','aaaa','aaaa','aaaa'),(2,'xxxc','xxxb','xxxb','xxxb'),(3,'xxxb','xxxc','xxxc','xxxc'),(4,'xxxa','xxxa','xxxa','xxxa'),(5,'zzzz','zzzz','zzzz','zzzz'),(6,NULL,NULL,'xxxa','xxxa'),(7,'zxxx','zxxx','zxxx','zxxx'),(8,'axxx','axxx','axxx','axxx'),(9,'zaaz','zaaz','zaaz','zaaz'),(10,'zbbz','zbbz','zbbz','zbbz');
DELETE FROM t1 WHERE b NOT like '_xxx' ESCAPE 'x' LIMIT 2;
SELECT * FROM t1;
a	b	c	d	e
3	xxxb	xxxc	xxxc	xxxc
4	xxxa	xxxa	xxxa	xxxa
5	zzzz	zzzz	zzzz	zzzz
6	NULL	NULL	xxxa	xxxa
7	zxxx	zxxx	zxxx	zxxx
8	axxx	axxx	axxx	axxx
9	zaaz	zaaz	zaaz	zaaz
10	zbbz	zbbz	zbbz	zbbz
replace into t1 values(1,'aaaa','aaaa','aaaa','aaaa'),(2,'xxxc','xxxb','xxxb','xxxb'),(3,'xxxb','xxxc','xxxc','xxxc'),(4,'xxxa','xxxa','xxxa','xxxa'),(5,'zzzz','zzzz','zzzz','zzzz'),(6,NULL,NULL,'xxxa','xxxa'),(7,'zxxx','zxxx','zxxx','zxxx'),(8,'axxx','axxx','axxx','axxx'),(9,'zaaz','zaaz','zaaz','zaaz'),(10,'zbbz','zbbz','zbbz','zbbz');
DELETE FROM t1 WHERE b NOT like '_xxx' ESCAPE 'a' LIMIT 2;
SELECT * FROM t1;
a	b	c	d	e
3	xxxb	xxxc	xxxc	xxxc
4	xxxa	xxxa	xxxa	xxxa
5	zzzz	zzzz	zzzz	zzzz
6	NULL	NULL	xxxa	xxxa
7	zxxx	zxxx	zxxx	zxxx
8	axxx	axxx	axxx	axxx
9	zaaz	zaaz	zaaz	zaaz
10	zbbz	zbbz	zbbz	zbbz
-- col_str1 [NOT] LIKE ‘_xxx%’ [ESCAPE col_str3]
replace into t1 values(1,'aaaa','aaaa','aaaa','aaaa'),(2,'xxxc','xxxb','xxxb','xxxb'),(3,'xxxb','xxxc','xxxc','xxxc'),(4,'xxxa','xxxa','xxxa','xxxa'),(5,'zzzz','zzzz','zzzz','zzzz'),(6,NULL,NULL,'xxxa','xxxa'),(7,'zxxx','zxxx','zxxx','zxxx'),(8,'axxx','axxx','axxx','axxx'),(9,'zaaz','zaaz','zaaz','zaaz'),(10,'zbbz','zbbz','zbbz','zbbz');
DELETE FROM t1 WHERE b like '_xxx%' LIMIT 2;
SELECT * FROM t1;
a	b	c	d	e
1	aaaa	aaaa	aaaa	aaaa
2	xxxc	xxxb	xxxb	xxxb
3	xxxb	xxxc	xxxc	xxxc
4	xxxa	xxxa	xxxa	xxxa
5	zzzz	zzzz	zzzz	zzzz
6	NULL	NULL	xxxa	xxxa
9	zaaz	zaaz	zaaz	zaaz
10	zbbz	zbbz	zbbz	zbbz
replace into t1 values(1,'aaaa','aaaa','aaaa','aaaa'),(2,'xxxc','xxxb','xxxb','xxxb'),(3,'xxxb','xxxc','xxxc','xxxc'),(4,'xxxa','xxxa','xxxa','xxxa'),(5,'zzzz','zzzz','zzzz','zzzz'),(6,NULL,NULL,'xxxa','xxxa'),(7,'zxxx','zxxx','zxxx','zxxx'),(8,'axxx','axxx','axxx','axxx'),(9,'zaaz','zaaz','zaaz','zaaz'),(10,'zbbz','zbbz','zbbz','zbbz');
DELETE FROM t1 WHERE b like '_xxx%' ESCAPE 'x' LIMIT 2;
SELECT * FROM t1;
a	b	c	d	e
1	aaaa	aaaa	aaaa	aaaa
2	xxxc	xxxb	xxxb	xxxb
3	xxxb	xxxc	xxxc	xxxc
4	xxxa	xxxa	xxxa	xxxa
5	zzzz	zzzz	zzzz	zzzz
6	NULL	NULL	xxxa	xxxa
7	zxxx	zxxx	zxxx	zxxx
8	axxx	axxx	axxx	axxx
9	zaaz	zaaz	zaaz	zaaz
10	zbbz	zbbz	zbbz	zbbz
replace into t1 values(1,'aaaa','aaaa','aaaa','aaaa'),(2,'xxxc','xxxb','xxxb','xxxb'),(3,'xxxb','xxxc','xxxc','xxxc'),(4,'xxxa','xxxa','xxxa','xxxa'),(5,'zzzz','zzzz','zzzz','zzzz'),(6,NULL,NULL,'xxxa','xxxa'),(7,'zxxx','zxxx','zxxx','zxxx'),(8,'axxx','axxx','axxx','axxx'),(9,'zaaz','zaaz','zaaz','zaaz'),(10,'zbbz','zbbz','zbbz','zbbz');
DELETE FROM t1 WHERE b like '_xxx%' ESCAPE 'a' LIMIT 2;
SELECT * FROM t1;
a	b	c	d	e
1	aaaa	aaaa	aaaa	aaaa
2	xxxc	xxxb	xxxb	xxxb
3	xxxb	xxxc	xxxc	xxxc
4	xxxa	xxxa	xxxa	xxxa
5	zzzz	zzzz	zzzz	zzzz
6	NULL	NULL	xxxa	xxxa
9	zaaz	zaaz	zaaz	zaaz
10	zbbz	zbbz	zbbz	zbbz
replace into t1 values(1,'aaaa','aaaa','aaaa','aaaa'),(2,'xxxc','xxxb','xxxb','xxxb'),(3,'xxxb','xxxc','xxxc','xxxc'),(4,'xxxa','xxxa','xxxa','xxxa'),(5,'zzzz','zzzz','zzzz','zzzz'),(6,NULL,NULL,'xxxa','xxxa'),(7,'zxxx','zxxx','zxxx','zxxx'),(8,'axxx','axxx','axxx','axxx'),(9,'zaaz','zaaz','zaaz','zaaz'),(10,'zbbz','zbbz','zbbz','zbbz');
DELETE FROM t1 WHERE b NOT like '_xxx%' LIMIT 2;
SELECT * FROM t1;
a	b	c	d	e
3	xxxb	xxxc	xxxc	xxxc
4	xxxa	xxxa	xxxa	xxxa
5	zzzz	zzzz	zzzz	zzzz
6	NULL	NULL	xxxa	xxxa
7	zxxx	zxxx	zxxx	zxxx
8	axxx	axxx	axxx	axxx
9	zaaz	zaaz	zaaz	zaaz
10	zbbz	zbbz	zbbz	zbbz
replace into t1 values(1,'aaaa','aaaa','aaaa','aaaa'),(2,'xxxc','xxxb','xxxb','xxxb'),(3,'xxxb','xxxc','xxxc','xxxc'),(4,'xxxa','xxxa','xxxa','xxxa'),(5,'zzzz','zzzz','zzzz','zzzz'),(6,NULL,NULL,'xxxa','xxxa'),(7,'zxxx','zxxx','zxxx','zxxx'),(8,'axxx','axxx','axxx','axxx'),(9,'zaaz','zaaz','zaaz','zaaz'),(10,'zbbz','zbbz','zbbz','zbbz');
DELETE FROM t1 WHERE b NOT like '_xxx%' ESCAPE 'x' LIMIT 2;
SELECT * FROM t1;
a	b	c	d	e
3	xxxb	xxxc	xxxc	xxxc
4	xxxa	xxxa	xxxa	xxxa
5	zzzz	zzzz	zzzz	zzzz
6	NULL	NULL	xxxa	xxxa
7	zxxx	zxxx	zxxx	zxxx
8	axxx	axxx	axxx	axxx
9	zaaz	zaaz	zaaz	zaaz
10	zbbz	zbbz	zbbz	zbbz
replace into t1 values(1,'aaaa','aaaa','aaaa','aaaa'),(2,'xxxc','xxxb','xxxb','xxxb'),(3,'xxxb','xxxc','xxxc','xxxc'),(4,'xxxa','xxxa','xxxa','xxxa'),(5,'zzzz','zzzz','zzzz','zzzz'),(6,NULL,NULL,'xxxa','xxxa'),(7,'zxxx','zxxx','zxxx','zxxx'),(8,'axxx','axxx','axxx','axxx'),(9,'zaaz','zaaz','zaaz','zaaz'),(10,'zbbz','zbbz','zbbz','zbbz');
DELETE FROM t1 WHERE b NOT like '_xxx%' ESCAPE 'a' LIMIT 2;
SELECT * FROM t1;
a	b	c	d	e
3	xxxb	xxxc	xxxc	xxxc
4	xxxa	xxxa	xxxa	xxxa
5	zzzz	zzzz	zzzz	zzzz
6	NULL	NULL	xxxa	xxxa
7	zxxx	zxxx	zxxx	zxxx
8	axxx	axxx	axxx	axxx
9	zaaz	zaaz	zaaz	zaaz
10	zbbz	zbbz	zbbz	zbbz
-- col_str1 [NOT] LIKE ‘%xxx_’ [ESCAPE col_str3]
replace into t1 values(1,'aaaa','aaaa','aaaa','aaaa'),(2,'xxxc','xxxb','xxxb','xxxb'),(3,'xxxb','xxxc','xxxc','xxxc'),(4,'xxxa','xxxa','xxxa','xxxa'),(5,'zzzz','zzzz','zzzz','zzzz'),(6,NULL,NULL,'xxxa','xxxa'),(7,'zxxx','zxxx','zxxx','zxxx'),(8,'axxx','axxx','axxx','axxx'),(9,'zaaz','zaaz','zaaz','zaaz'),(10,'zbbz','zbbz','zbbz','zbbz');
DELETE FROM t1 WHERE b like '%xxx_' LIMIT 2;
SELECT * FROM t1;
a	b	c	d	e
1	aaaa	aaaa	aaaa	aaaa
2	xxxc	xxxb	xxxb	xxxb
5	zzzz	zzzz	zzzz	zzzz
6	NULL	NULL	xxxa	xxxa
7	zxxx	zxxx	zxxx	zxxx
8	axxx	axxx	axxx	axxx
9	zaaz	zaaz	zaaz	zaaz
10	zbbz	zbbz	zbbz	zbbz
replace into t1 values(1,'aaaa','aaaa','aaaa','aaaa'),(2,'xxxc','xxxb','xxxb','xxxb'),(3,'xxxb','xxxc','xxxc','xxxc'),(4,'xxxa','xxxa','xxxa','xxxa'),(5,'zzzz','zzzz','zzzz','zzzz'),(6,NULL,NULL,'xxxa','xxxa'),(7,'zxxx','zxxx','zxxx','zxxx'),(8,'axxx','axxx','axxx','axxx'),(9,'zaaz','zaaz','zaaz','zaaz'),(10,'zbbz','zbbz','zbbz','zbbz');
DELETE FROM t1 WHERE b like '%xxx_' ESCAPE 'x' LIMIT 2;
SELECT * FROM t1;
a	b	c	d	e
1	aaaa	aaaa	aaaa	aaaa
2	xxxc	xxxb	xxxb	xxxb
3	xxxb	xxxc	xxxc	xxxc
4	xxxa	xxxa	xxxa	xxxa
5	zzzz	zzzz	zzzz	zzzz
6	NULL	NULL	xxxa	xxxa
7	zxxx	zxxx	zxxx	zxxx
8	axxx	axxx	axxx	axxx
9	zaaz	zaaz	zaaz	zaaz
10	zbbz	zbbz	zbbz	zbbz
replace into t1 values(1,'aaaa','aaaa','aaaa','aaaa'),(2,'xxxc','xxxb','xxxb','xxxb'),(3,'xxxb','xxxc','xxxc','xxxc'),(4,'xxxa','xxxa','xxxa','xxxa'),(5,'zzzz','zzzz','zzzz','zzzz'),(6,NULL,NULL,'xxxa','xxxa'),(7,'zxxx','zxxx','zxxx','zxxx'),(8,'axxx','axxx','axxx','axxx'),(9,'zaaz','zaaz','zaaz','zaaz'),(10,'zbbz','zbbz','zbbz','zbbz');
DELETE FROM t1 WHERE b like '%xxx_' ESCAPE 'a' LIMIT 2;
SELECT * FROM t1;
a	b	c	d	e
1	aaaa	aaaa	aaaa	aaaa
2	xxxc	xxxb	xxxb	xxxb
5	zzzz	zzzz	zzzz	zzzz
6	NULL	NULL	xxxa	xxxa
7	zxxx	zxxx	zxxx	zxxx
8	axxx	axxx	axxx	axxx
9	zaaz	zaaz	zaaz	zaaz
10	zbbz	zbbz	zbbz	zbbz
replace into t1 values(1,'aaaa','aaaa','aaaa','aaaa'),(2,'xxxc','xxxb','xxxb','xxxb'),(3,'xxxb','xxxc','xxxc','xxxc'),(4,'xxxa','xxxa','xxxa','xxxa'),(5,'zzzz','zzzz','zzzz','zzzz'),(6,NULL,NULL,'xxxa','xxxa'),(7,'zxxx','zxxx','zxxx','zxxx'),(8,'axxx','axxx','axxx','axxx'),(9,'zaaz','zaaz','zaaz','zaaz'),(10,'zbbz','zbbz','zbbz','zbbz');
DELETE FROM t1 WHERE b NOT like '%xxx_' LIMIT 2;
SELECT * FROM t1;
a	b	c	d	e
2	xxxc	xxxb	xxxb	xxxb
3	xxxb	xxxc	xxxc	xxxc
4	xxxa	xxxa	xxxa	xxxa
6	NULL	NULL	xxxa	xxxa
7	zxxx	zxxx	zxxx	zxxx
8	axxx	axxx	axxx	axxx
9	zaaz	zaaz	zaaz	zaaz
10	zbbz	zbbz	zbbz	zbbz
replace into t1 values(1,'aaaa','aaaa','aaaa','aaaa'),(2,'xxxc','xxxb','xxxb','xxxb'),(3,'xxxb','xxxc','xxxc','xxxc'),(4,'xxxa','xxxa','xxxa','xxxa'),(5,'zzzz','zzzz','zzzz','zzzz'),(6,NULL,NULL,'xxxa','xxxa'),(7,'zxxx','zxxx','zxxx','zxxx'),(8,'axxx','axxx','axxx','axxx'),(9,'zaaz','zaaz','zaaz','zaaz'),(10,'zbbz','zbbz','zbbz','zbbz');
DELETE FROM t1 WHERE b NOT like '%xxx_' ESCAPE 'x' LIMIT 2;
SELECT * FROM t1;
a	b	c	d	e
3	xxxb	xxxc	xxxc	xxxc
4	xxxa	xxxa	xxxa	xxxa
5	zzzz	zzzz	zzzz	zzzz
6	NULL	NULL	xxxa	xxxa
7	zxxx	zxxx	zxxx	zxxx
8	axxx	axxx	axxx	axxx
9	zaaz	zaaz	zaaz	zaaz
10	zbbz	zbbz	zbbz	zbbz
replace into t1 values(1,'aaaa','aaaa','aaaa','aaaa'),(2,'xxxc','xxxb','xxxb','xxxb'),(3,'xxxb','xxxc','xxxc','xxxc'),(4,'xxxa','xxxa','xxxa','xxxa'),(5,'zzzz','zzzz','zzzz','zzzz'),(6,NULL,NULL,'xxxa','xxxa'),(7,'zxxx','zxxx','zxxx','zxxx'),(8,'axxx','axxx','axxx','axxx'),(9,'zaaz','zaaz','zaaz','zaaz'),(10,'zbbz','zbbz','zbbz','zbbz');
DELETE FROM t1 WHERE b NOT like '%xxx_' ESCAPE 'a' LIMIT 2;
SELECT * FROM t1;
a	b	c	d	e
2	xxxc	xxxb	xxxb	xxxb
3	xxxb	xxxc	xxxc	xxxc
4	xxxa	xxxa	xxxa	xxxa
6	NULL	NULL	xxxa	xxxa
7	zxxx	zxxx	zxxx	zxxx
8	axxx	axxx	axxx	axxx
9	zaaz	zaaz	zaaz	zaaz
10	zbbz	zbbz	zbbz	zbbz
-- col_str1 [NOT] LIKE ‘_x_x_’ [ESCAPE col_str3]
replace into t1 values(1,'aaaa','aaaa','aaaa','aaaa'),(2,'xxxc','xxxb','xxxb','xxxb'),(3,'xxxb','xxxc','xxxc','xxxc'),(4,'xxxa','xxxa','xxxa','xxxa'),(5,'zzzz','zzzz','zzzz','zzzz'),(6,NULL,NULL,'xxxa','xxxa'),(7,'zxxx','zxxx','zxxx','zxxx'),(8,'axxx','axxx','axxx','axxx'),(9,'zaaz','zaaz','zaaz','zaaz'),(10,'zbbz','zbbz','zbbz','zbbz');
DELETE FROM t1 WHERE b like '_x_x_' LIMIT 2;
SELECT * FROM t1;
a	b	c	d	e
1	aaaa	aaaa	aaaa	aaaa
2	xxxc	xxxb	xxxb	xxxb
3	xxxb	xxxc	xxxc	xxxc
4	xxxa	xxxa	xxxa	xxxa
5	zzzz	zzzz	zzzz	zzzz
6	NULL	NULL	xxxa	xxxa
7	zxxx	zxxx	zxxx	zxxx
8	axxx	axxx	axxx	axxx
9	zaaz	zaaz	zaaz	zaaz
10	zbbz	zbbz	zbbz	zbbz
replace into t1 values(1,'aaaa','aaaa','aaaa','aaaa'),(2,'xxxc','xxxb','xxxb','xxxb'),(3,'xxxb','xxxc','xxxc','xxxc'),(4,'xxxa','xxxa','xxxa','xxxa'),(5,'zzzz','zzzz','zzzz','zzzz'),(6,NULL,NULL,'xxxa','xxxa'),(7,'zxxx','zxxx','zxxx','zxxx'),(8,'axxx','axxx','axxx','axxx'),(9,'zaaz','zaaz','zaaz','zaaz'),(10,'zbbz','zbbz','zbbz','zbbz');
DELETE FROM t1 WHERE b like '_x_x_' ESCAPE 'x' LIMIT 2;
SELECT * FROM t1;
a	b	c	d	e
1	aaaa	aaaa	aaaa	aaaa
2	xxxc	xxxb	xxxb	xxxb
3	xxxb	xxxc	xxxc	xxxc
4	xxxa	xxxa	xxxa	xxxa
5	zzzz	zzzz	zzzz	zzzz
6	NULL	NULL	xxxa	xxxa
7	zxxx	zxxx	zxxx	zxxx
8	axxx	axxx	axxx	axxx
9	zaaz	zaaz	zaaz	zaaz
10	zbbz	zbbz	zbbz	zbbz
replace into t1 values(1,'aaaa','aaaa','aaaa','aaaa'),(2,'xxxc','xxxb','xxxb','xxxb'),(3,'xxxb','xxxc','xxxc','xxxc'),(4,'xxxa','xxxa','xxxa','xxxa'),(5,'zzzz','zzzz','zzzz','zzzz'),(6,NULL,NULL,'xxxa','xxxa'),(7,'zxxx','zxxx','zxxx','zxxx'),(8,'axxx','axxx','axxx','axxx'),(9,'zaaz','zaaz','zaaz','zaaz'),(10,'zbbz','zbbz','zbbz','zbbz');
DELETE FROM t1 WHERE b like '_x_x_' ESCAPE 'a' LIMIT 2;
SELECT * FROM t1;
a	b	c	d	e
1	aaaa	aaaa	aaaa	aaaa
2	xxxc	xxxb	xxxb	xxxb
3	xxxb	xxxc	xxxc	xxxc
4	xxxa	xxxa	xxxa	xxxa
5	zzzz	zzzz	zzzz	zzzz
6	NULL	NULL	xxxa	xxxa
7	zxxx	zxxx	zxxx	zxxx
8	axxx	axxx	axxx	axxx
9	zaaz	zaaz	zaaz	zaaz
10	zbbz	zbbz	zbbz	zbbz
replace into t1 values(1,'aaaa','aaaa','aaaa','aaaa'),(2,'xxxc','xxxb','xxxb','xxxb'),(3,'xxxb','xxxc','xxxc','xxxc'),(4,'xxxa','xxxa','xxxa','xxxa'),(5,'zzzz','zzzz','zzzz','zzzz'),(6,NULL,NULL,'xxxa','xxxa'),(7,'zxxx','zxxx','zxxx','zxxx'),(8,'axxx','axxx','axxx','axxx'),(9,'zaaz','zaaz','zaaz','zaaz'),(10,'zbbz','zbbz','zbbz','zbbz');
DELETE FROM t1 WHERE b NOT like '_x_x_' LIMIT 2;
SELECT * FROM t1;
a	b	c	d	e
3	xxxb	xxxc	xxxc	xxxc
4	xxxa	xxxa	xxxa	xxxa
5	zzzz	zzzz	zzzz	zzzz
6	NULL	NULL	xxxa	xxxa
7	zxxx	zxxx	zxxx	zxxx
8	axxx	axxx	axxx	axxx
9	zaaz	zaaz	zaaz	zaaz
10	zbbz	zbbz	zbbz	zbbz
replace into t1 values(1,'aaaa','aaaa','aaaa','aaaa'),(2,'xxxc','xxxb','xxxb','xxxb'),(3,'xxxb','xxxc','xxxc','xxxc'),(4,'xxxa','xxxa','xxxa','xxxa'),(5,'zzzz','zzzz','zzzz','zzzz'),(6,NULL,NULL,'xxxa','xxxa'),(7,'zxxx','zxxx','zxxx','zxxx'),(8,'axxx','axxx','axxx','axxx'),(9,'zaaz','zaaz','zaaz','zaaz'),(10,'zbbz','zbbz','zbbz','zbbz');
DELETE FROM t1 WHERE b NOT like '_x_x_' ESCAPE 'x' LIMIT 2;
SELECT * FROM t1;
a	b	c	d	e
3	xxxb	xxxc	xxxc	xxxc
4	xxxa	xxxa	xxxa	xxxa
5	zzzz	zzzz	zzzz	zzzz
6	NULL	NULL	xxxa	xxxa
7	zxxx	zxxx	zxxx	zxxx
8	axxx	axxx	axxx	axxx
9	zaaz	zaaz	zaaz	zaaz
10	zbbz	zbbz	zbbz	zbbz
replace into t1 values(1,'aaaa','aaaa','aaaa','aaaa'),(2,'xxxc','xxxb','xxxb','xxxb'),(3,'xxxb','xxxc','xxxc','xxxc'),(4,'xxxa','xxxa','xxxa','xxxa'),(5,'zzzz','zzzz','zzzz','zzzz'),(6,NULL,NULL,'xxxa','xxxa'),(7,'zxxx','zxxx','zxxx','zxxx'),(8,'axxx','axxx','axxx','axxx'),(9,'zaaz','zaaz','zaaz','zaaz'),(10,'zbbz','zbbz','zbbz','zbbz');
DELETE FROM t1 WHERE b NOT like '_x_x_' ESCAPE 'a' LIMIT 2;
SELECT * FROM t1;
a	b	c	d	e
3	xxxb	xxxc	xxxc	xxxc
4	xxxa	xxxa	xxxa	xxxa
5	zzzz	zzzz	zzzz	zzzz
6	NULL	NULL	xxxa	xxxa
7	zxxx	zxxx	zxxx	zxxx
8	axxx	axxx	axxx	axxx
9	zaaz	zaaz	zaaz	zaaz
10	zbbz	zbbz	zbbz	zbbz
-- col_str1 [NOT] LIKE ‘_x_x%’ [ESCAPE col_str3]
replace into t1 values(1,'aaaa','aaaa','aaaa','aaaa'),(2,'xxxc','xxxb','xxxb','xxxb'),(3,'xxxb','xxxc','xxxc','xxxc'),(4,'xxxa','xxxa','xxxa','xxxa'),(5,'zzzz','zzzz','zzzz','zzzz'),(6,NULL,NULL,'xxxa','xxxa'),(7,'zxxx','zxxx','zxxx','zxxx'),(8,'axxx','axxx','axxx','axxx'),(9,'zaaz','zaaz','zaaz','zaaz'),(10,'zbbz','zbbz','zbbz','zbbz');
DELETE FROM t1 WHERE b like '_x_x%' LIMIT 2;
SELECT * FROM t1;
a	b	c	d	e
1	aaaa	aaaa	aaaa	aaaa
2	xxxc	xxxb	xxxb	xxxb
3	xxxb	xxxc	xxxc	xxxc
4	xxxa	xxxa	xxxa	xxxa
5	zzzz	zzzz	zzzz	zzzz
6	NULL	NULL	xxxa	xxxa
9	zaaz	zaaz	zaaz	zaaz
10	zbbz	zbbz	zbbz	zbbz
replace into t1 values(1,'aaaa','aaaa','aaaa','aaaa'),(2,'xxxc','xxxb','xxxb','xxxb'),(3,'xxxb','xxxc','xxxc','xxxc'),(4,'xxxa','xxxa','xxxa','xxxa'),(5,'zzzz','zzzz','zzzz','zzzz'),(6,NULL,NULL,'xxxa','xxxa'),(7,'zxxx','zxxx','zxxx','zxxx'),(8,'axxx','axxx','axxx','axxx'),(9,'zaaz','zaaz','zaaz','zaaz'),(10,'zbbz','zbbz','zbbz','zbbz');
DELETE FROM t1 WHERE b like '_x_x%' ESCAPE 'x' LIMIT 2;
SELECT * FROM t1;
a	b	c	d	e
1	aaaa	aaaa	aaaa	aaaa
2	xxxc	xxxb	xxxb	xxxb
3	xxxb	xxxc	xxxc	xxxc
4	xxxa	xxxa	xxxa	xxxa
5	zzzz	zzzz	zzzz	zzzz
6	NULL	NULL	xxxa	xxxa
7	zxxx	zxxx	zxxx	zxxx
8	axxx	axxx	axxx	axxx
9	zaaz	zaaz	zaaz	zaaz
10	zbbz	zbbz	zbbz	zbbz
replace into t1 values(1,'aaaa','aaaa','aaaa','aaaa'),(2,'xxxc','xxxb','xxxb','xxxb'),(3,'xxxb','xxxc','xxxc','xxxc'),(4,'xxxa','xxxa','xxxa','xxxa'),(5,'zzzz','zzzz','zzzz','zzzz'),(6,NULL,NULL,'xxxa','xxxa'),(7,'zxxx','zxxx','zxxx','zxxx'),(8,'axxx','axxx','axxx','axxx'),(9,'zaaz','zaaz','zaaz','zaaz'),(10,'zbbz','zbbz','zbbz','zbbz');
DELETE FROM t1 WHERE b like '_x_x%' ESCAPE 'a' LIMIT 2;
SELECT * FROM t1;
a	b	c	d	e
1	aaaa	aaaa	aaaa	aaaa
2	xxxc	xxxb	xxxb	xxxb
3	xxxb	xxxc	xxxc	xxxc
4	xxxa	xxxa	xxxa	xxxa
5	zzzz	zzzz	zzzz	zzzz
6	NULL	NULL	xxxa	xxxa
9	zaaz	zaaz	zaaz	zaaz
10	zbbz	zbbz	zbbz	zbbz
replace into t1 values(1,'aaaa','aaaa','aaaa','aaaa'),(2,'xxxc','xxxb','xxxb','xxxb'),(3,'xxxb','xxxc','xxxc','xxxc'),(4,'xxxa','xxxa','xxxa','xxxa'),(5,'zzzz','zzzz','zzzz','zzzz'),(6,NULL,NULL,'xxxa','xxxa'),(7,'zxxx','zxxx','zxxx','zxxx'),(8,'axxx','axxx','axxx','axxx'),(9,'zaaz','zaaz','zaaz','zaaz'),(10,'zbbz','zbbz','zbbz','zbbz');
DELETE FROM t1 WHERE b NOT like '_x_x%' LIMIT 2;
SELECT * FROM t1;
a	b	c	d	e
3	xxxb	xxxc	xxxc	xxxc
4	xxxa	xxxa	xxxa	xxxa
5	zzzz	zzzz	zzzz	zzzz
6	NULL	NULL	xxxa	xxxa
7	zxxx	zxxx	zxxx	zxxx
8	axxx	axxx	axxx	axxx
9	zaaz	zaaz	zaaz	zaaz
10	zbbz	zbbz	zbbz	zbbz
replace into t1 values(1,'aaaa','aaaa','aaaa','aaaa'),(2,'xxxc','xxxb','xxxb','xxxb'),(3,'xxxb','xxxc','xxxc','xxxc'),(4,'xxxa','xxxa','xxxa','xxxa'),(5,'zzzz','zzzz','zzzz','zzzz'),(6,NULL,NULL,'xxxa','xxxa'),(7,'zxxx','zxxx','zxxx','zxxx'),(8,'axxx','axxx','axxx','axxx'),(9,'zaaz','zaaz','zaaz','zaaz'),(10,'zbbz','zbbz','zbbz','zbbz');
DELETE FROM t1 WHERE b NOT like '_x_x%' ESCAPE 'x' LIMIT 2;
SELECT * FROM t1;
a	b	c	d	e
3	xxxb	xxxc	xxxc	xxxc
4	xxxa	xxxa	xxxa	xxxa
5	zzzz	zzzz	zzzz	zzzz
6	NULL	NULL	xxxa	xxxa
7	zxxx	zxxx	zxxx	zxxx
8	axxx	axxx	axxx	axxx
9	zaaz	zaaz	zaaz	zaaz
10	zbbz	zbbz	zbbz	zbbz
replace into t1 values(1,'aaaa','aaaa','aaaa','aaaa'),(2,'xxxc','xxxb','xxxb','xxxb'),(3,'xxxb','xxxc','xxxc','xxxc'),(4,'xxxa','xxxa','xxxa','xxxa'),(5,'zzzz','zzzz','zzzz','zzzz'),(6,NULL,NULL,'xxxa','xxxa'),(7,'zxxx','zxxx','zxxx','zxxx'),(8,'axxx','axxx','axxx','axxx'),(9,'zaaz','zaaz','zaaz','zaaz'),(10,'zbbz','zbbz','zbbz','zbbz');
DELETE FROM t1 WHERE b NOT like '_x_x%' ESCAPE 'a' LIMIT 2;
SELECT * FROM t1;
a	b	c	d	e
3	xxxb	xxxc	xxxc	xxxc
4	xxxa	xxxa	xxxa	xxxa
5	zzzz	zzzz	zzzz	zzzz
6	NULL	NULL	xxxa	xxxa
7	zxxx	zxxx	zxxx	zxxx
8	axxx	axxx	axxx	axxx
9	zaaz	zaaz	zaaz	zaaz
10	zbbz	zbbz	zbbz	zbbz
-- col_str1 [NOT] LIKE ‘_x%x_’ [ESCAPE col_str3]
replace into t1 values(1,'aaaa','aaaa','aaaa','aaaa'),(2,'xxxc','xxxb','xxxb','xxxb'),(3,'xxxb','xxxc','xxxc','xxxc'),(4,'xxxa','xxxa','xxxa','xxxa'),(5,'zzzz','zzzz','zzzz','zzzz'),(6,NULL,NULL,'xxxa','xxxa'),(7,'zxxx','zxxx','zxxx','zxxx'),(8,'axxx','axxx','axxx','axxx'),(9,'zaaz','zaaz','zaaz','zaaz'),(10,'zbbz','zbbz','zbbz','zbbz');
DELETE FROM t1 WHERE b like '_x%x_' LIMIT 2;
SELECT * FROM t1;
a	b	c	d	e
1	aaaa	aaaa	aaaa	aaaa
2	xxxc	xxxb	xxxb	xxxb
3	xxxb	xxxc	xxxc	xxxc
5	zzzz	zzzz	zzzz	zzzz
6	NULL	NULL	xxxa	xxxa
7	zxxx	zxxx	zxxx	zxxx
9	zaaz	zaaz	zaaz	zaaz
10	zbbz	zbbz	zbbz	zbbz
replace into t1 values(1,'aaaa','aaaa','aaaa','aaaa'),(2,'xxxc','xxxb','xxxb','xxxb'),(3,'xxxb','xxxc','xxxc','xxxc'),(4,'xxxa','xxxa','xxxa','xxxa'),(5,'zzzz','zzzz','zzzz','zzzz'),(6,NULL,NULL,'xxxa','xxxa'),(7,'zxxx','zxxx','zxxx','zxxx'),(8,'axxx','axxx','axxx','axxx'),(9,'zaaz','zaaz','zaaz','zaaz'),(10,'zbbz','zbbz','zbbz','zbbz');
DELETE FROM t1 WHERE b like '_x%x_' ESCAPE 'x' LIMIT 2;
SELECT * FROM t1;
a	b	c	d	e
1	aaaa	aaaa	aaaa	aaaa
2	xxxc	xxxb	xxxb	xxxb
3	xxxb	xxxc	xxxc	xxxc
4	xxxa	xxxa	xxxa	xxxa
5	zzzz	zzzz	zzzz	zzzz
6	NULL	NULL	xxxa	xxxa
7	zxxx	zxxx	zxxx	zxxx
8	axxx	axxx	axxx	axxx
9	zaaz	zaaz	zaaz	zaaz
10	zbbz	zbbz	zbbz	zbbz
replace into t1 values(1,'aaaa','aaaa','aaaa','aaaa'),(2,'xxxc','xxxb','xxxb','xxxb'),(3,'xxxb','xxxc','xxxc','xxxc'),(4,'xxxa','xxxa','xxxa','xxxa'),(5,'zzzz','zzzz','zzzz','zzzz'),(6,NULL,NULL,'xxxa','xxxa'),(7,'zxxx','zxxx','zxxx','zxxx'),(8,'axxx','axxx','axxx','axxx'),(9,'zaaz','zaaz','zaaz','zaaz'),(10,'zbbz','zbbz','zbbz','zbbz');
DELETE FROM t1 WHERE b like '_x%x_' ESCAPE 'a' LIMIT 2;
SELECT * FROM t1;
a	b	c	d	e
1	aaaa	aaaa	aaaa	aaaa
2	xxxc	xxxb	xxxb	xxxb
3	xxxb	xxxc	xxxc	xxxc
5	zzzz	zzzz	zzzz	zzzz
6	NULL	NULL	xxxa	xxxa
7	zxxx	zxxx	zxxx	zxxx
9	zaaz	zaaz	zaaz	zaaz
10	zbbz	zbbz	zbbz	zbbz
replace into t1 values(1,'aaaa','aaaa','aaaa','aaaa'),(2,'xxxc','xxxb','xxxb','xxxb'),(3,'xxxb','xxxc','xxxc','xxxc'),(4,'xxxa','xxxa','xxxa','xxxa'),(5,'zzzz','zzzz','zzzz','zzzz'),(6,NULL,NULL,'xxxa','xxxa'),(7,'zxxx','zxxx','zxxx','zxxx'),(8,'axxx','axxx','axxx','axxx'),(9,'zaaz','zaaz','zaaz','zaaz'),(10,'zbbz','zbbz','zbbz','zbbz');
DELETE FROM t1 WHERE b NOT like '_x%x_' LIMIT 2;
SELECT * FROM t1;
a	b	c	d	e
2	xxxc	xxxb	xxxb	xxxb
3	xxxb	xxxc	xxxc	xxxc
4	xxxa	xxxa	xxxa	xxxa
6	NULL	NULL	xxxa	xxxa
7	zxxx	zxxx	zxxx	zxxx
8	axxx	axxx	axxx	axxx
9	zaaz	zaaz	zaaz	zaaz
10	zbbz	zbbz	zbbz	zbbz
replace into t1 values(1,'aaaa','aaaa','aaaa','aaaa'),(2,'xxxc','xxxb','xxxb','xxxb'),(3,'xxxb','xxxc','xxxc','xxxc'),(4,'xxxa','xxxa','xxxa','xxxa'),(5,'zzzz','zzzz','zzzz','zzzz'),(6,NULL,NULL,'xxxa','xxxa'),(7,'zxxx','zxxx','zxxx','zxxx'),(8,'axxx','axxx','axxx','axxx'),(9,'zaaz','zaaz','zaaz','zaaz'),(10,'zbbz','zbbz','zbbz','zbbz');
DELETE FROM t1 WHERE b NOT like '_x%x_' ESCAPE 'x' LIMIT 2;
SELECT * FROM t1;
a	b	c	d	e
3	xxxb	xxxc	xxxc	xxxc
4	xxxa	xxxa	xxxa	xxxa
5	zzzz	zzzz	zzzz	zzzz
6	NULL	NULL	xxxa	xxxa
7	zxxx	zxxx	zxxx	zxxx
8	axxx	axxx	axxx	axxx
9	zaaz	zaaz	zaaz	zaaz
10	zbbz	zbbz	zbbz	zbbz
replace into t1 values(1,'aaaa','aaaa','aaaa','aaaa'),(2,'xxxc','xxxb','xxxb','xxxb'),(3,'xxxb','xxxc','xxxc','xxxc'),(4,'xxxa','xxxa','xxxa','xxxa'),(5,'zzzz','zzzz','zzzz','zzzz'),(6,NULL,NULL,'xxxa','xxxa'),(7,'zxxx','zxxx','zxxx','zxxx'),(8,'axxx','axxx','axxx','axxx'),(9,'zaaz','zaaz','zaaz','zaaz'),(10,'zbbz','zbbz','zbbz','zbbz');
DELETE FROM t1 WHERE b NOT like '_x%x_' ESCAPE 'a' LIMIT 2;
SELECT * FROM t1;
a	b	c	d	e
2	xxxc	xxxb	xxxb	xxxb
3	xxxb	xxxc	xxxc	xxxc
4	xxxa	xxxa	xxxa	xxxa
6	NULL	NULL	xxxa	xxxa
7	zxxx	zxxx	zxxx	zxxx
8	axxx	axxx	axxx	axxx
9	zaaz	zaaz	zaaz	zaaz
10	zbbz	zbbz	zbbz	zbbz
-- col_str1 [NOT] LIKE ‘_x%x%’ [ESCAPE col_str3]
replace into t1 values(1,'aaaa','aaaa','aaaa','aaaa'),(2,'xxxc','xxxb','xxxb','xxxb'),(3,'xxxb','xxxc','xxxc','xxxc'),(4,'xxxa','xxxa','xxxa','xxxa'),(5,'zzzz','zzzz','zzzz','zzzz'),(6,NULL,NULL,'xxxa','xxxa'),(7,'zxxx','zxxx','zxxx','zxxx'),(8,'axxx','axxx','axxx','axxx'),(9,'zaaz','zaaz','zaaz','zaaz'),(10,'zbbz','zbbz','zbbz','zbbz');
DELETE FROM t1 WHERE b like '_x%x%' LIMIT 2;
SELECT * FROM t1;
a	b	c	d	e
1	aaaa	aaaa	aaaa	aaaa
2	xxxc	xxxb	xxxb	xxxb
3	xxxb	xxxc	xxxc	xxxc
5	zzzz	zzzz	zzzz	zzzz
6	NULL	NULL	xxxa	xxxa
7	zxxx	zxxx	zxxx	zxxx
9	zaaz	zaaz	zaaz	zaaz
10	zbbz	zbbz	zbbz	zbbz
replace into t1 values(1,'aaaa','aaaa','aaaa','aaaa'),(2,'xxxc','xxxb','xxxb','xxxb'),(3,'xxxb','xxxc','xxxc','xxxc'),(4,'xxxa','xxxa','xxxa','xxxa'),(5,'zzzz','zzzz','zzzz','zzzz'),(6,NULL,NULL,'xxxa','xxxa'),(7,'zxxx','zxxx','zxxx','zxxx'),(8,'axxx','axxx','axxx','axxx'),(9,'zaaz','zaaz','zaaz','zaaz'),(10,'zbbz','zbbz','zbbz','zbbz');
DELETE FROM t1 WHERE b like '_x%x%' ESCAPE 'x' LIMIT 2;
SELECT * FROM t1;
a	b	c	d	e
1	aaaa	aaaa	aaaa	aaaa
2	xxxc	xxxb	xxxb	xxxb
3	xxxb	xxxc	xxxc	xxxc
4	xxxa	xxxa	xxxa	xxxa
5	zzzz	zzzz	zzzz	zzzz
6	NULL	NULL	xxxa	xxxa
7	zxxx	zxxx	zxxx	zxxx
8	axxx	axxx	axxx	axxx
9	zaaz	zaaz	zaaz	zaaz
10	zbbz	zbbz	zbbz	zbbz
replace into t1 values(1,'aaaa','aaaa','aaaa','aaaa'),(2,'xxxc','xxxb','xxxb','xxxb'),(3,'xxxb','xxxc','xxxc','xxxc'),(4,'xxxa','xxxa','xxxa','xxxa'),(5,'zzzz','zzzz','zzzz','zzzz'),(6,NULL,NULL,'xxxa','xxxa'),(7,'zxxx','zxxx','zxxx','zxxx'),(8,'axxx','axxx','axxx','axxx'),(9,'zaaz','zaaz','zaaz','zaaz'),(10,'zbbz','zbbz','zbbz','zbbz');
DELETE FROM t1 WHERE b like '_x%x%' ESCAPE 'a' LIMIT 2;
SELECT * FROM t1;
a	b	c	d	e
1	aaaa	aaaa	aaaa	aaaa
2	xxxc	xxxb	xxxb	xxxb
3	xxxb	xxxc	xxxc	xxxc
5	zzzz	zzzz	zzzz	zzzz
6	NULL	NULL	xxxa	xxxa
7	zxxx	zxxx	zxxx	zxxx
9	zaaz	zaaz	zaaz	zaaz
10	zbbz	zbbz	zbbz	zbbz
replace into t1 values(1,'aaaa','aaaa','aaaa','aaaa'),(2,'xxxc','xxxb','xxxb','xxxb'),(3,'xxxb','xxxc','xxxc','xxxc'),(4,'xxxa','xxxa','xxxa','xxxa'),(5,'zzzz','zzzz','zzzz','zzzz'),(6,NULL,NULL,'xxxa','xxxa'),(7,'zxxx','zxxx','zxxx','zxxx'),(8,'axxx','axxx','axxx','axxx'),(9,'zaaz','zaaz','zaaz','zaaz'),(10,'zbbz','zbbz','zbbz','zbbz');
DELETE FROM t1 WHERE b NOT like '_x%x%' LIMIT 2;
SELECT * FROM t1;
a	b	c	d	e
2	xxxc	xxxb	xxxb	xxxb
3	xxxb	xxxc	xxxc	xxxc
4	xxxa	xxxa	xxxa	xxxa
6	NULL	NULL	xxxa	xxxa
7	zxxx	zxxx	zxxx	zxxx
8	axxx	axxx	axxx	axxx
9	zaaz	zaaz	zaaz	zaaz
10	zbbz	zbbz	zbbz	zbbz
replace into t1 values(1,'aaaa','aaaa','aaaa','aaaa'),(2,'xxxc','xxxb','xxxb','xxxb'),(3,'xxxb','xxxc','xxxc','xxxc'),(4,'xxxa','xxxa','xxxa','xxxa'),(5,'zzzz','zzzz','zzzz','zzzz'),(6,NULL,NULL,'xxxa','xxxa'),(7,'zxxx','zxxx','zxxx','zxxx'),(8,'axxx','axxx','axxx','axxx'),(9,'zaaz','zaaz','zaaz','zaaz'),(10,'zbbz','zbbz','zbbz','zbbz');
DELETE FROM t1 WHERE b NOT like '_x%x%' ESCAPE 'x' LIMIT 2;
SELECT * FROM t1;
a	b	c	d	e
3	xxxb	xxxc	xxxc	xxxc
4	xxxa	xxxa	xxxa	xxxa
5	zzzz	zzzz	zzzz	zzzz
6	NULL	NULL	xxxa	xxxa
7	zxxx	zxxx	zxxx	zxxx
8	axxx	axxx	axxx	axxx
9	zaaz	zaaz	zaaz	zaaz
10	zbbz	zbbz	zbbz	zbbz
replace into t1 values(1,'aaaa','aaaa','aaaa','aaaa'),(2,'xxxc','xxxb','xxxb','xxxb'),(3,'xxxb','xxxc','xxxc','xxxc'),(4,'xxxa','xxxa','xxxa','xxxa'),(5,'zzzz','zzzz','zzzz','zzzz'),(6,NULL,NULL,'xxxa','xxxa'),(7,'zxxx','zxxx','zxxx','zxxx'),(8,'axxx','axxx','axxx','axxx'),(9,'zaaz','zaaz','zaaz','zaaz'),(10,'zbbz','zbbz','zbbz','zbbz');
DELETE FROM t1 WHERE b NOT like '_x%x%' ESCAPE 'a' LIMIT 2;
SELECT * FROM t1;
a	b	c	d	e
2	xxxc	xxxb	xxxb	xxxb
3	xxxb	xxxc	xxxc	xxxc
4	xxxa	xxxa	xxxa	xxxa
6	NULL	NULL	xxxa	xxxa
7	zxxx	zxxx	zxxx	zxxx
8	axxx	axxx	axxx	axxx
9	zaaz	zaaz	zaaz	zaaz
10	zbbz	zbbz	zbbz	zbbz
-- col_str1 [NOT] LIKE ‘%x_x_’ [ESCAPE col_str3]
replace into t1 values(1,'aaaa','aaaa','aaaa','aaaa'),(2,'xxxc','xxxb','xxxb','xxxb'),(3,'xxxb','xxxc','xxxc','xxxc'),(4,'xxxa','xxxa','xxxa','xxxa'),(5,'zzzz','zzzz','zzzz','zzzz'),(6,NULL,NULL,'xxxa','xxxa'),(7,'zxxx','zxxx','zxxx','zxxx'),(8,'axxx','axxx','axxx','axxx'),(9,'zaaz','zaaz','zaaz','zaaz'),(10,'zbbz','zbbz','zbbz','zbbz');
DELETE FROM t1 WHERE b like '%x_x_' LIMIT 2;
SELECT * FROM t1;
a	b	c	d	e
1	aaaa	aaaa	aaaa	aaaa
2	xxxc	xxxb	xxxb	xxxb
5	zzzz	zzzz	zzzz	zzzz
6	NULL	NULL	xxxa	xxxa
7	zxxx	zxxx	zxxx	zxxx
8	axxx	axxx	axxx	axxx
9	zaaz	zaaz	zaaz	zaaz
10	zbbz	zbbz	zbbz	zbbz
replace into t1 values(1,'aaaa','aaaa','aaaa','aaaa'),(2,'xxxc','xxxb','xxxb','xxxb'),(3,'xxxb','xxxc','xxxc','xxxc'),(4,'xxxa','xxxa','xxxa','xxxa'),(5,'zzzz','zzzz','zzzz','zzzz'),(6,NULL,NULL,'xxxa','xxxa'),(7,'zxxx','zxxx','zxxx','zxxx'),(8,'axxx','axxx','axxx','axxx'),(9,'zaaz','zaaz','zaaz','zaaz'),(10,'zbbz','zbbz','zbbz','zbbz');
DELETE FROM t1 WHERE b like '%x_x_' ESCAPE 'x' LIMIT 2;
SELECT * FROM t1;
a	b	c	d	e
1	aaaa	aaaa	aaaa	aaaa
2	xxxc	xxxb	xxxb	xxxb
3	xxxb	xxxc	xxxc	xxxc
4	xxxa	xxxa	xxxa	xxxa
5	zzzz	zzzz	zzzz	zzzz
6	NULL	NULL	xxxa	xxxa
7	zxxx	zxxx	zxxx	zxxx
8	axxx	axxx	axxx	axxx
9	zaaz	zaaz	zaaz	zaaz
10	zbbz	zbbz	zbbz	zbbz
replace into t1 values(1,'aaaa','aaaa','aaaa','aaaa'),(2,'xxxc','xxxb','xxxb','xxxb'),(3,'xxxb','xxxc','xxxc','xxxc'),(4,'xxxa','xxxa','xxxa','xxxa'),(5,'zzzz','zzzz','zzzz','zzzz'),(6,NULL,NULL,'xxxa','xxxa'),(7,'zxxx','zxxx','zxxx','zxxx'),(8,'axxx','axxx','axxx','axxx'),(9,'zaaz','zaaz','zaaz','zaaz'),(10,'zbbz','zbbz','zbbz','zbbz');
DELETE FROM t1 WHERE b like '%x_x_' ESCAPE 'a' LIMIT 2;
SELECT * FROM t1;
a	b	c	d	e
1	aaaa	aaaa	aaaa	aaaa
2	xxxc	xxxb	xxxb	xxxb
5	zzzz	zzzz	zzzz	zzzz
6	NULL	NULL	xxxa	xxxa
7	zxxx	zxxx	zxxx	zxxx
8	axxx	axxx	axxx	axxx
9	zaaz	zaaz	zaaz	zaaz
10	zbbz	zbbz	zbbz	zbbz
replace into t1 values(1,'aaaa','aaaa','aaaa','aaaa'),(2,'xxxc','xxxb','xxxb','xxxb'),(3,'xxxb','xxxc','xxxc','xxxc'),(4,'xxxa','xxxa','xxxa','xxxa'),(5,'zzzz','zzzz','zzzz','zzzz'),(6,NULL,NULL,'xxxa','xxxa'),(7,'zxxx','zxxx','zxxx','zxxx'),(8,'axxx','axxx','axxx','axxx'),(9,'zaaz','zaaz','zaaz','zaaz'),(10,'zbbz','zbbz','zbbz','zbbz');
DELETE FROM t1 WHERE b NOT like '%x_x_' LIMIT 2;
SELECT * FROM t1;
a	b	c	d	e
2	xxxc	xxxb	xxxb	xxxb
3	xxxb	xxxc	xxxc	xxxc
4	xxxa	xxxa	xxxa	xxxa
6	NULL	NULL	xxxa	xxxa
7	zxxx	zxxx	zxxx	zxxx
8	axxx	axxx	axxx	axxx
9	zaaz	zaaz	zaaz	zaaz
10	zbbz	zbbz	zbbz	zbbz
replace into t1 values(1,'aaaa','aaaa','aaaa','aaaa'),(2,'xxxc','xxxb','xxxb','xxxb'),(3,'xxxb','xxxc','xxxc','xxxc'),(4,'xxxa','xxxa','xxxa','xxxa'),(5,'zzzz','zzzz','zzzz','zzzz'),(6,NULL,NULL,'xxxa','xxxa'),(7,'zxxx','zxxx','zxxx','zxxx'),(8,'axxx','axxx','axxx','axxx'),(9,'zaaz','zaaz','zaaz','zaaz'),(10,'zbbz','zbbz','zbbz','zbbz');
DELETE FROM t1 WHERE b NOT like '%x_x_' ESCAPE 'x' LIMIT 2;
SELECT * FROM t1;
a	b	c	d	e
3	xxxb	xxxc	xxxc	xxxc
4	xxxa	xxxa	xxxa	xxxa
5	zzzz	zzzz	zzzz	zzzz
6	NULL	NULL	xxxa	xxxa
7	zxxx	zxxx	zxxx	zxxx
8	axxx	axxx	axxx	axxx
9	zaaz	zaaz	zaaz	zaaz
10	zbbz	zbbz	zbbz	zbbz
replace into t1 values(1,'aaaa','aaaa','aaaa','aaaa'),(2,'xxxc','xxxb','xxxb','xxxb'),(3,'xxxb','xxxc','xxxc','xxxc'),(4,'xxxa','xxxa','xxxa','xxxa'),(5,'zzzz','zzzz','zzzz','zzzz'),(6,NULL,NULL,'xxxa','xxxa'),(7,'zxxx','zxxx','zxxx','zxxx'),(8,'axxx','axxx','axxx','axxx'),(9,'zaaz','zaaz','zaaz','zaaz'),(10,'zbbz','zbbz','zbbz','zbbz');
DELETE FROM t1 WHERE b NOT like '%x_x_' ESCAPE 'a' LIMIT 2;
SELECT * FROM t1;
a	b	c	d	e
2	xxxc	xxxb	xxxb	xxxb
3	xxxb	xxxc	xxxc	xxxc
4	xxxa	xxxa	xxxa	xxxa
6	NULL	NULL	xxxa	xxxa
7	zxxx	zxxx	zxxx	zxxx
8	axxx	axxx	axxx	axxx
9	zaaz	zaaz	zaaz	zaaz
10	zbbz	zbbz	zbbz	zbbz
-- col_str1 [NOT] LIKE ‘%x_x%’ [ESCAPE col_str3]
replace into t1 values(1,'aaaa','aaaa','aaaa','aaaa'),(2,'xxxc','xxxb','xxxb','xxxb'),(3,'xxxb','xxxc','xxxc','xxxc'),(4,'xxxa','xxxa','xxxa','xxxa'),(5,'zzzz','zzzz','zzzz','zzzz'),(6,NULL,NULL,'xxxa','xxxa'),(7,'zxxx','zxxx','zxxx','zxxx'),(8,'axxx','axxx','axxx','axxx'),(9,'zaaz','zaaz','zaaz','zaaz'),(10,'zbbz','zbbz','zbbz','zbbz');
DELETE FROM t1 WHERE b like '%x_x%' LIMIT 2;
SELECT * FROM t1;
a	b	c	d	e
1	aaaa	aaaa	aaaa	aaaa
2	xxxc	xxxb	xxxb	xxxb
3	xxxb	xxxc	xxxc	xxxc
5	zzzz	zzzz	zzzz	zzzz
6	NULL	NULL	xxxa	xxxa
7	zxxx	zxxx	zxxx	zxxx
9	zaaz	zaaz	zaaz	zaaz
10	zbbz	zbbz	zbbz	zbbz
replace into t1 values(1,'aaaa','aaaa','aaaa','aaaa'),(2,'xxxc','xxxb','xxxb','xxxb'),(3,'xxxb','xxxc','xxxc','xxxc'),(4,'xxxa','xxxa','xxxa','xxxa'),(5,'zzzz','zzzz','zzzz','zzzz'),(6,NULL,NULL,'xxxa','xxxa'),(7,'zxxx','zxxx','zxxx','zxxx'),(8,'axxx','axxx','axxx','axxx'),(9,'zaaz','zaaz','zaaz','zaaz'),(10,'zbbz','zbbz','zbbz','zbbz');
DELETE FROM t1 WHERE b like '%x_x%' ESCAPE 'x' LIMIT 2;
SELECT * FROM t1;
a	b	c	d	e
1	aaaa	aaaa	aaaa	aaaa
2	xxxc	xxxb	xxxb	xxxb
3	xxxb	xxxc	xxxc	xxxc
4	xxxa	xxxa	xxxa	xxxa
5	zzzz	zzzz	zzzz	zzzz
6	NULL	NULL	xxxa	xxxa
7	zxxx	zxxx	zxxx	zxxx
8	axxx	axxx	axxx	axxx
9	zaaz	zaaz	zaaz	zaaz
10	zbbz	zbbz	zbbz	zbbz
replace into t1 values(1,'aaaa','aaaa','aaaa','aaaa'),(2,'xxxc','xxxb','xxxb','xxxb'),(3,'xxxb','xxxc','xxxc','xxxc'),(4,'xxxa','xxxa','xxxa','xxxa'),(5,'zzzz','zzzz','zzzz','zzzz'),(6,NULL,NULL,'xxxa','xxxa'),(7,'zxxx','zxxx','zxxx','zxxx'),(8,'axxx','axxx','axxx','axxx'),(9,'zaaz','zaaz','zaaz','zaaz'),(10,'zbbz','zbbz','zbbz','zbbz');
DELETE FROM t1 WHERE b like '%x_x%' ESCAPE 'a' LIMIT 2;
SELECT * FROM t1;
a	b	c	d	e
1	aaaa	aaaa	aaaa	aaaa
2	xxxc	xxxb	xxxb	xxxb
3	xxxb	xxxc	xxxc	xxxc
5	zzzz	zzzz	zzzz	zzzz
6	NULL	NULL	xxxa	xxxa
7	zxxx	zxxx	zxxx	zxxx
9	zaaz	zaaz	zaaz	zaaz
10	zbbz	zbbz	zbbz	zbbz
replace into t1 values(1,'aaaa','aaaa','aaaa','aaaa'),(2,'xxxc','xxxb','xxxb','xxxb'),(3,'xxxb','xxxc','xxxc','xxxc'),(4,'xxxa','xxxa','xxxa','xxxa'),(5,'zzzz','zzzz','zzzz','zzzz'),(6,NULL,NULL,'xxxa','xxxa'),(7,'zxxx','zxxx','zxxx','zxxx'),(8,'axxx','axxx','axxx','axxx'),(9,'zaaz','zaaz','zaaz','zaaz'),(10,'zbbz','zbbz','zbbz','zbbz');
DELETE FROM t1 WHERE b NOT like '%x_x%' LIMIT 2;
SELECT * FROM t1;
a	b	c	d	e
2	xxxc	xxxb	xxxb	xxxb
3	xxxb	xxxc	xxxc	xxxc
4	xxxa	xxxa	xxxa	xxxa
6	NULL	NULL	xxxa	xxxa
7	zxxx	zxxx	zxxx	zxxx
8	axxx	axxx	axxx	axxx
9	zaaz	zaaz	zaaz	zaaz
10	zbbz	zbbz	zbbz	zbbz
replace into t1 values(1,'aaaa','aaaa','aaaa','aaaa'),(2,'xxxc','xxxb','xxxb','xxxb'),(3,'xxxb','xxxc','xxxc','xxxc'),(4,'xxxa','xxxa','xxxa','xxxa'),(5,'zzzz','zzzz','zzzz','zzzz'),(6,NULL,NULL,'xxxa','xxxa'),(7,'zxxx','zxxx','zxxx','zxxx'),(8,'axxx','axxx','axxx','axxx'),(9,'zaaz','zaaz','zaaz','zaaz'),(10,'zbbz','zbbz','zbbz','zbbz');
DELETE FROM t1 WHERE b NOT like '%x_x%' ESCAPE 'x' LIMIT 2;
SELECT * FROM t1;
a	b	c	d	e
3	xxxb	xxxc	xxxc	xxxc
4	xxxa	xxxa	xxxa	xxxa
5	zzzz	zzzz	zzzz	zzzz
6	NULL	NULL	xxxa	xxxa
7	zxxx	zxxx	zxxx	zxxx
8	axxx	axxx	axxx	axxx
9	zaaz	zaaz	zaaz	zaaz
10	zbbz	zbbz	zbbz	zbbz
replace into t1 values(1,'aaaa','aaaa','aaaa','aaaa'),(2,'xxxc','xxxb','xxxb','xxxb'),(3,'xxxb','xxxc','xxxc','xxxc'),(4,'xxxa','xxxa','xxxa','xxxa'),(5,'zzzz','zzzz','zzzz','zzzz'),(6,NULL,NULL,'xxxa','xxxa'),(7,'zxxx','zxxx','zxxx','zxxx'),(8,'axxx','axxx','axxx','axxx'),(9,'zaaz','zaaz','zaaz','zaaz'),(10,'zbbz','zbbz','zbbz','zbbz');
DELETE FROM t1 WHERE b NOT like '%x_x%' ESCAPE 'a' LIMIT 2;
SELECT * FROM t1;
a	b	c	d	e
2	xxxc	xxxb	xxxb	xxxb
3	xxxb	xxxc	xxxc	xxxc
4	xxxa	xxxa	xxxa	xxxa
6	NULL	NULL	xxxa	xxxa
7	zxxx	zxxx	zxxx	zxxx
8	axxx	axxx	axxx	axxx
9	zaaz	zaaz	zaaz	zaaz
10	zbbz	zbbz	zbbz	zbbz
-- col_str1 [NOT] LIKE ‘%x%x_’ [ESCAPE col_str3]
replace into t1 values(1,'aaaa','aaaa','aaaa','aaaa'),(2,'xxxc','xxxb','xxxb','xxxb'),(3,'xxxb','xxxc','xxxc','xxxc'),(4,'xxxa','xxxa','xxxa','xxxa'),(5,'zzzz','zzzz','zzzz','zzzz'),(6,NULL,NULL,'xxxa','xxxa'),(7,'zxxx','zxxx','zxxx','zxxx'),(8,'axxx','axxx','axxx','axxx'),(9,'zaaz','zaaz','zaaz','zaaz'),(10,'zbbz','zbbz','zbbz','zbbz');
DELETE FROM t1 WHERE b like '%x%x_' LIMIT 2;
SELECT * FROM t1;
a	b	c	d	e
1	aaaa	aaaa	aaaa	aaaa
2	xxxc	xxxb	xxxb	xxxb
3	xxxb	xxxc	xxxc	xxxc
5	zzzz	zzzz	zzzz	zzzz
6	NULL	NULL	xxxa	xxxa
7	zxxx	zxxx	zxxx	zxxx
9	zaaz	zaaz	zaaz	zaaz
10	zbbz	zbbz	zbbz	zbbz
replace into t1 values(1,'aaaa','aaaa','aaaa','aaaa'),(2,'xxxc','xxxb','xxxb','xxxb'),(3,'xxxb','xxxc','xxxc','xxxc'),(4,'xxxa','xxxa','xxxa','xxxa'),(5,'zzzz','zzzz','zzzz','zzzz'),(6,NULL,NULL,'xxxa','xxxa'),(7,'zxxx','zxxx','zxxx','zxxx'),(8,'axxx','axxx','axxx','axxx'),(9,'zaaz','zaaz','zaaz','zaaz'),(10,'zbbz','zbbz','zbbz','zbbz');
DELETE FROM t1 WHERE b like '%x%x_' ESCAPE 'x' LIMIT 2;
SELECT * FROM t1;
a	b	c	d	e
1	aaaa	aaaa	aaaa	aaaa
2	xxxc	xxxb	xxxb	xxxb
3	xxxb	xxxc	xxxc	xxxc
4	xxxa	xxxa	xxxa	xxxa
5	zzzz	zzzz	zzzz	zzzz
6	NULL	NULL	xxxa	xxxa
7	zxxx	zxxx	zxxx	zxxx
8	axxx	axxx	axxx	axxx
9	zaaz	zaaz	zaaz	zaaz
10	zbbz	zbbz	zbbz	zbbz
replace into t1 values(1,'aaaa','aaaa','aaaa','aaaa'),(2,'xxxc','xxxb','xxxb','xxxb'),(3,'xxxb','xxxc','xxxc','xxxc'),(4,'xxxa','xxxa','xxxa','xxxa'),(5,'zzzz','zzzz','zzzz','zzzz'),(6,NULL,NULL,'xxxa','xxxa'),(7,'zxxx','zxxx','zxxx','zxxx'),(8,'axxx','axxx','axxx','axxx'),(9,'zaaz','zaaz','zaaz','zaaz'),(10,'zbbz','zbbz','zbbz','zbbz');
DELETE FROM t1 WHERE b like '%x%x_' ESCAPE 'a' LIMIT 2;
SELECT * FROM t1;
a	b	c	d	e
1	aaaa	aaaa	aaaa	aaaa
2	xxxc	xxxb	xxxb	xxxb
3	xxxb	xxxc	xxxc	xxxc
5	zzzz	zzzz	zzzz	zzzz
6	NULL	NULL	xxxa	xxxa
7	zxxx	zxxx	zxxx	zxxx
9	zaaz	zaaz	zaaz	zaaz
10	zbbz	zbbz	zbbz	zbbz
replace into t1 values(1,'aaaa','aaaa','aaaa','aaaa'),(2,'xxxc','xxxb','xxxb','xxxb'),(3,'xxxb','xxxc','xxxc','xxxc'),(4,'xxxa','xxxa','xxxa','xxxa'),(5,'zzzz','zzzz','zzzz','zzzz'),(6,NULL,NULL,'xxxa','xxxa'),(7,'zxxx','zxxx','zxxx','zxxx'),(8,'axxx','axxx','axxx','axxx'),(9,'zaaz','zaaz','zaaz','zaaz'),(10,'zbbz','zbbz','zbbz','zbbz');
DELETE FROM t1 WHERE b NOT like '%x%x_' LIMIT 2;
SELECT * FROM t1;
a	b	c	d	e
2	xxxc	xxxb	xxxb	xxxb
3	xxxb	xxxc	xxxc	xxxc
4	xxxa	xxxa	xxxa	xxxa
6	NULL	NULL	xxxa	xxxa
7	zxxx	zxxx	zxxx	zxxx
8	axxx	axxx	axxx	axxx
9	zaaz	zaaz	zaaz	zaaz
10	zbbz	zbbz	zbbz	zbbz
replace into t1 values(1,'aaaa','aaaa','aaaa','aaaa'),(2,'xxxc','xxxb','xxxb','xxxb'),(3,'xxxb','xxxc','xxxc','xxxc'),(4,'xxxa','xxxa','xxxa','xxxa'),(5,'zzzz','zzzz','zzzz','zzzz'),(6,NULL,NULL,'xxxa','xxxa'),(7,'zxxx','zxxx','zxxx','zxxx'),(8,'axxx','axxx','axxx','axxx'),(9,'zaaz','zaaz','zaaz','zaaz'),(10,'zbbz','zbbz','zbbz','zbbz');
DELETE FROM t1 WHERE b NOT like '%x%x_' ESCAPE 'x' LIMIT 2;
SELECT * FROM t1;
a	b	c	d	e
3	xxxb	xxxc	xxxc	xxxc
4	xxxa	xxxa	xxxa	xxxa
5	zzzz	zzzz	zzzz	zzzz
6	NULL	NULL	xxxa	xxxa
7	zxxx	zxxx	zxxx	zxxx
8	axxx	axxx	axxx	axxx
9	zaaz	zaaz	zaaz	zaaz
10	zbbz	zbbz	zbbz	zbbz
replace into t1 values(1,'aaaa','aaaa','aaaa','aaaa'),(2,'xxxc','xxxb','xxxb','xxxb'),(3,'xxxb','xxxc','xxxc','xxxc'),(4,'xxxa','xxxa','xxxa','xxxa'),(5,'zzzz','zzzz','zzzz','zzzz'),(6,NULL,NULL,'xxxa','xxxa'),(7,'zxxx','zxxx','zxxx','zxxx'),(8,'axxx','axxx','axxx','axxx'),(9,'zaaz','zaaz','zaaz','zaaz'),(10,'zbbz','zbbz','zbbz','zbbz');
DELETE FROM t1 WHERE b NOT like '%x%x_' ESCAPE 'a' LIMIT 2;
SELECT * FROM t1;
a	b	c	d	e
2	xxxc	xxxb	xxxb	xxxb
3	xxxb	xxxc	xxxc	xxxc
4	xxxa	xxxa	xxxa	xxxa
6	NULL	NULL	xxxa	xxxa
7	zxxx	zxxx	zxxx	zxxx
8	axxx	axxx	axxx	axxx
9	zaaz	zaaz	zaaz	zaaz
10	zbbz	zbbz	zbbz	zbbz
-- col_str1 [NOT] LIKE ‘%x%x%’ [ESCAPE col_str3]
replace into t1 values(1,'aaaa','aaaa','aaaa','aaaa'),(2,'xxxc','xxxb','xxxb','xxxb'),(3,'xxxb','xxxc','xxxc','xxxc'),(4,'xxxa','xxxa','xxxa','xxxa'),(5,'zzzz','zzzz','zzzz','zzzz'),(6,NULL,NULL,'xxxa','xxxa'),(7,'zxxx','zxxx','zxxx','zxxx'),(8,'axxx','axxx','axxx','axxx'),(9,'zaaz','zaaz','zaaz','zaaz'),(10,'zbbz','zbbz','zbbz','zbbz');
DELETE FROM t1 WHERE b like '%x%x%' LIMIT 2;
SELECT * FROM t1;
a	b	c	d	e
1	aaaa	aaaa	aaaa	aaaa
2	xxxc	xxxb	xxxb	xxxb
3	xxxb	xxxc	xxxc	xxxc
5	zzzz	zzzz	zzzz	zzzz
6	NULL	NULL	xxxa	xxxa
7	zxxx	zxxx	zxxx	zxxx
9	zaaz	zaaz	zaaz	zaaz
10	zbbz	zbbz	zbbz	zbbz
replace into t1 values(1,'aaaa','aaaa','aaaa','aaaa'),(2,'xxxc','xxxb','xxxb','xxxb'),(3,'xxxb','xxxc','xxxc','xxxc'),(4,'xxxa','xxxa','xxxa','xxxa'),(5,'zzzz','zzzz','zzzz','zzzz'),(6,NULL,NULL,'xxxa','xxxa'),(7,'zxxx','zxxx','zxxx','zxxx'),(8,'axxx','axxx','axxx','axxx'),(9,'zaaz','zaaz','zaaz','zaaz'),(10,'zbbz','zbbz','zbbz','zbbz');
DELETE FROM t1 WHERE b like '%x%x%' ESCAPE 'x' LIMIT 2;
SELECT * FROM t1;
a	b	c	d	e
1	aaaa	aaaa	aaaa	aaaa
2	xxxc	xxxb	xxxb	xxxb
3	xxxb	xxxc	xxxc	xxxc
4	xxxa	xxxa	xxxa	xxxa
5	zzzz	zzzz	zzzz	zzzz
6	NULL	NULL	xxxa	xxxa
7	zxxx	zxxx	zxxx	zxxx
8	axxx	axxx	axxx	axxx
9	zaaz	zaaz	zaaz	zaaz
10	zbbz	zbbz	zbbz	zbbz
replace into t1 values(1,'aaaa','aaaa','aaaa','aaaa'),(2,'xxxc','xxxb','xxxb','xxxb'),(3,'xxxb','xxxc','xxxc','xxxc'),(4,'xxxa','xxxa','xxxa','xxxa'),(5,'zzzz','zzzz','zzzz','zzzz'),(6,NULL,NULL,'xxxa','xxxa'),(7,'zxxx','zxxx','zxxx','zxxx'),(8,'axxx','axxx','axxx','axxx'),(9,'zaaz','zaaz','zaaz','zaaz'),(10,'zbbz','zbbz','zbbz','zbbz');
DELETE FROM t1 WHERE b like '%x%x%' ESCAPE 'a' LIMIT 2;
SELECT * FROM t1;
a	b	c	d	e
1	aaaa	aaaa	aaaa	aaaa
2	xxxc	xxxb	xxxb	xxxb
3	xxxb	xxxc	xxxc	xxxc
5	zzzz	zzzz	zzzz	zzzz
6	NULL	NULL	xxxa	xxxa
7	zxxx	zxxx	zxxx	zxxx
9	zaaz	zaaz	zaaz	zaaz
10	zbbz	zbbz	zbbz	zbbz
replace into t1 values(1,'aaaa','aaaa','aaaa','aaaa'),(2,'xxxc','xxxb','xxxb','xxxb'),(3,'xxxb','xxxc','xxxc','xxxc'),(4,'xxxa','xxxa','xxxa','xxxa'),(5,'zzzz','zzzz','zzzz','zzzz'),(6,NULL,NULL,'xxxa','xxxa'),(7,'zxxx','zxxx','zxxx','zxxx'),(8,'axxx','axxx','axxx','axxx'),(9,'zaaz','zaaz','zaaz','zaaz'),(10,'zbbz','zbbz','zbbz','zbbz');
DELETE FROM t1 WHERE b NOT like '%x%x%' LIMIT 2;
SELECT * FROM t1;
a	b	c	d	e
2	xxxc	xxxb	xxxb	xxxb
3	xxxb	xxxc	xxxc	xxxc
4	xxxa	xxxa	xxxa	xxxa
6	NULL	NULL	xxxa	xxxa
7	zxxx	zxxx	zxxx	zxxx
8	axxx	axxx	axxx	axxx
9	zaaz	zaaz	zaaz	zaaz
10	zbbz	zbbz	zbbz	zbbz
replace into t1 values(1,'aaaa','aaaa','aaaa','aaaa'),(2,'xxxc','xxxb','xxxb','xxxb'),(3,'xxxb','xxxc','xxxc','xxxc'),(4,'xxxa','xxxa','xxxa','xxxa'),(5,'zzzz','zzzz','zzzz','zzzz'),(6,NULL,NULL,'xxxa','xxxa'),(7,'zxxx','zxxx','zxxx','zxxx'),(8,'axxx','axxx','axxx','axxx'),(9,'zaaz','zaaz','zaaz','zaaz'),(10,'zbbz','zbbz','zbbz','zbbz');
DELETE FROM t1 WHERE b NOT like '%x%x%' ESCAPE 'x' LIMIT 2;
SELECT * FROM t1;
a	b	c	d	e
3	xxxb	xxxc	xxxc	xxxc
4	xxxa	xxxa	xxxa	xxxa
5	zzzz	zzzz	zzzz	zzzz
6	NULL	NULL	xxxa	xxxa
7	zxxx	zxxx	zxxx	zxxx
8	axxx	axxx	axxx	axxx
9	zaaz	zaaz	zaaz	zaaz
10	zbbz	zbbz	zbbz	zbbz
replace into t1 values(1,'aaaa','aaaa','aaaa','aaaa'),(2,'xxxc','xxxb','xxxb','xxxb'),(3,'xxxb','xxxc','xxxc','xxxc'),(4,'xxxa','xxxa','xxxa','xxxa'),(5,'zzzz','zzzz','zzzz','zzzz'),(6,NULL,NULL,'xxxa','xxxa'),(7,'zxxx','zxxx','zxxx','zxxx'),(8,'axxx','axxx','axxx','axxx'),(9,'zaaz','zaaz','zaaz','zaaz'),(10,'zbbz','zbbz','zbbz','zbbz');
DELETE FROM t1 WHERE b NOT like '%x%x%' ESCAPE 'a' LIMIT 2;
SELECT * FROM t1;
a	b	c	d	e
2	xxxc	xxxb	xxxb	xxxb
3	xxxb	xxxc	xxxc	xxxc
4	xxxa	xxxa	xxxa	xxxa
6	NULL	NULL	xxxa	xxxa
7	zxxx	zxxx	zxxx	zxxx
8	axxx	axxx	axxx	axxx
9	zaaz	zaaz	zaaz	zaaz
10	zbbz	zbbz	zbbz	zbbz
-- NULL [NOT] LIKE col_str2 [ESCAPE col_str3]
replace into t1 values(1,'aaaa','aaaa','aaaa','aaaa'),(2,'xxxc','xxxb','xxxb','xxxb'),(3,'xxxb','xxxc','xxxc','xxxc'),(4,'xxxa','xxxa','xxxa','xxxa'),(5,'zzzz','zzzz','zzzz','zzzz'),(6,NULL,NULL,'xxxa','xxxa'),(7,'zxxx','zxxx','zxxx','zxxx'),(8,'axxx','axxx','axxx','axxx'),(9,'zaaz','zaaz','zaaz','zaaz'),(10,'zbbz','zbbz','zbbz','zbbz');
DELETE FROM t1 WHERE NULL like 'xxx%' LIMIT 2;
SELECT * FROM t1;
a	b	c	d	e
1	aaaa	aaaa	aaaa	aaaa
2	xxxc	xxxb	xxxb	xxxb
3	xxxb	xxxc	xxxc	xxxc
4	xxxa	xxxa	xxxa	xxxa
5	zzzz	zzzz	zzzz	zzzz
6	NULL	NULL	xxxa	xxxa
7	zxxx	zxxx	zxxx	zxxx
8	axxx	axxx	axxx	axxx
9	zaaz	zaaz	zaaz	zaaz
10	zbbz	zbbz	zbbz	zbbz
replace into t1 values(1,'aaaa','aaaa','aaaa','aaaa'),(2,'xxxc','xxxb','xxxb','xxxb'),(3,'xxxb','xxxc','xxxc','xxxc'),(4,'xxxa','xxxa','xxxa','xxxa'),(5,'zzzz','zzzz','zzzz','zzzz'),(6,NULL,NULL,'xxxa','xxxa'),(7,'zxxx','zxxx','zxxx','zxxx'),(8,'axxx','axxx','axxx','axxx'),(9,'zaaz','zaaz','zaaz','zaaz'),(10,'zbbz','zbbz','zbbz','zbbz');
DELETE FROM t1 WHERE NULL like 'xxx%' ESCAPE 'x' LIMIT 2;
SELECT * FROM t1;
a	b	c	d	e
1	aaaa	aaaa	aaaa	aaaa
2	xxxc	xxxb	xxxb	xxxb
3	xxxb	xxxc	xxxc	xxxc
4	xxxa	xxxa	xxxa	xxxa
5	zzzz	zzzz	zzzz	zzzz
6	NULL	NULL	xxxa	xxxa
7	zxxx	zxxx	zxxx	zxxx
8	axxx	axxx	axxx	axxx
9	zaaz	zaaz	zaaz	zaaz
10	zbbz	zbbz	zbbz	zbbz
replace into t1 values(1,'aaaa','aaaa','aaaa','aaaa'),(2,'xxxc','xxxb','xxxb','xxxb'),(3,'xxxb','xxxc','xxxc','xxxc'),(4,'xxxa','xxxa','xxxa','xxxa'),(5,'zzzz','zzzz','zzzz','zzzz'),(6,NULL,NULL,'xxxa','xxxa'),(7,'zxxx','zxxx','zxxx','zxxx'),(8,'axxx','axxx','axxx','axxx'),(9,'zaaz','zaaz','zaaz','zaaz'),(10,'zbbz','zbbz','zbbz','zbbz');
DELETE FROM t1 WHERE NULL like 'xxx%' ESCAPE 'a' LIMIT 2;
SELECT * FROM t1;
a	b	c	d	e
1	aaaa	aaaa	aaaa	aaaa
2	xxxc	xxxb	xxxb	xxxb
3	xxxb	xxxc	xxxc	xxxc
4	xxxa	xxxa	xxxa	xxxa
5	zzzz	zzzz	zzzz	zzzz
6	NULL	NULL	xxxa	xxxa
7	zxxx	zxxx	zxxx	zxxx
8	axxx	axxx	axxx	axxx
9	zaaz	zaaz	zaaz	zaaz
10	zbbz	zbbz	zbbz	zbbz
replace into t1 values(1,'aaaa','aaaa','aaaa','aaaa'),(2,'xxxc','xxxb','xxxb','xxxb'),(3,'xxxb','xxxc','xxxc','xxxc'),(4,'xxxa','xxxa','xxxa','xxxa'),(5,'zzzz','zzzz','zzzz','zzzz'),(6,NULL,NULL,'xxxa','xxxa'),(7,'zxxx','zxxx','zxxx','zxxx'),(8,'axxx','axxx','axxx','axxx'),(9,'zaaz','zaaz','zaaz','zaaz'),(10,'zbbz','zbbz','zbbz','zbbz');
DELETE FROM t1 WHERE NULL NOT like 'xxx%' LIMIT 2;
SELECT * FROM t1;
a	b	c	d	e
1	aaaa	aaaa	aaaa	aaaa
2	xxxc	xxxb	xxxb	xxxb
3	xxxb	xxxc	xxxc	xxxc
4	xxxa	xxxa	xxxa	xxxa
5	zzzz	zzzz	zzzz	zzzz
6	NULL	NULL	xxxa	xxxa
7	zxxx	zxxx	zxxx	zxxx
8	axxx	axxx	axxx	axxx
9	zaaz	zaaz	zaaz	zaaz
10	zbbz	zbbz	zbbz	zbbz
replace into t1 values(1,'aaaa','aaaa','aaaa','aaaa'),(2,'xxxc','xxxb','xxxb','xxxb'),(3,'xxxb','xxxc','xxxc','xxxc'),(4,'xxxa','xxxa','xxxa','xxxa'),(5,'zzzz','zzzz','zzzz','zzzz'),(6,NULL,NULL,'xxxa','xxxa'),(7,'zxxx','zxxx','zxxx','zxxx'),(8,'axxx','axxx','axxx','axxx'),(9,'zaaz','zaaz','zaaz','zaaz'),(10,'zbbz','zbbz','zbbz','zbbz');
DELETE FROM t1 WHERE NULL NOT like 'xxx%' ESCAPE 'x' LIMIT 2;
SELECT * FROM t1;
a	b	c	d	e
1	aaaa	aaaa	aaaa	aaaa
2	xxxc	xxxb	xxxb	xxxb
3	xxxb	xxxc	xxxc	xxxc
4	xxxa	xxxa	xxxa	xxxa
5	zzzz	zzzz	zzzz	zzzz
6	NULL	NULL	xxxa	xxxa
7	zxxx	zxxx	zxxx	zxxx
8	axxx	axxx	axxx	axxx
9	zaaz	zaaz	zaaz	zaaz
10	zbbz	zbbz	zbbz	zbbz
replace into t1 values(1,'aaaa','aaaa','aaaa','aaaa'),(2,'xxxc','xxxb','xxxb','xxxb'),(3,'xxxb','xxxc','xxxc','xxxc'),(4,'xxxa','xxxa','xxxa','xxxa'),(5,'zzzz','zzzz','zzzz','zzzz'),(6,NULL,NULL,'xxxa','xxxa'),(7,'zxxx','zxxx','zxxx','zxxx'),(8,'axxx','axxx','axxx','axxx'),(9,'zaaz','zaaz','zaaz','zaaz'),(10,'zbbz','zbbz','zbbz','zbbz');
DELETE FROM t1 WHERE NULL NOT like 'xxx%' ESCAPE 'a' LIMIT 2;
SELECT * FROM t1;
a	b	c	d	e
1	aaaa	aaaa	aaaa	aaaa
2	xxxc	xxxb	xxxb	xxxb
3	xxxb	xxxc	xxxc	xxxc
4	xxxa	xxxa	xxxa	xxxa
5	zzzz	zzzz	zzzz	zzzz
6	NULL	NULL	xxxa	xxxa
7	zxxx	zxxx	zxxx	zxxx
8	axxx	axxx	axxx	axxx
9	zaaz	zaaz	zaaz	zaaz
10	zbbz	zbbz	zbbz	zbbz
-- col_str1 [NOT] LIKE ‘NULL’ [ESCAPE col_str3]
replace into t1 values(1,'aaaa','aaaa','aaaa','aaaa'),(2,'xxxc','xxxb','xxxb','xxxb'),(3,'xxxb','xxxc','xxxc','xxxc'),(4,'xxxa','xxxa','xxxa','xxxa'),(5,'zzzz','zzzz','zzzz','zzzz'),(6,NULL,NULL,'xxxa','xxxa'),(7,'zxxx','zxxx','zxxx','zxxx'),(8,'axxx','axxx','axxx','axxx'),(9,'zaaz','zaaz','zaaz','zaaz'),(10,'zbbz','zbbz','zbbz','zbbz');
DELETE FROM t1 WHERE b like NULL LIMIT 2;
SELECT * FROM t1;
a	b	c	d	e
1	aaaa	aaaa	aaaa	aaaa
2	xxxc	xxxb	xxxb	xxxb
3	xxxb	xxxc	xxxc	xxxc
4	xxxa	xxxa	xxxa	xxxa
5	zzzz	zzzz	zzzz	zzzz
6	NULL	NULL	xxxa	xxxa
7	zxxx	zxxx	zxxx	zxxx
8	axxx	axxx	axxx	axxx
9	zaaz	zaaz	zaaz	zaaz
10	zbbz	zbbz	zbbz	zbbz
replace into t1 values(1,'aaaa','aaaa','aaaa','aaaa'),(2,'xxxc','xxxb','xxxb','xxxb'),(3,'xxxb','xxxc','xxxc','xxxc'),(4,'xxxa','xxxa','xxxa','xxxa'),(5,'zzzz','zzzz','zzzz','zzzz'),(6,NULL,NULL,'xxxa','xxxa'),(7,'zxxx','zxxx','zxxx','zxxx'),(8,'axxx','axxx','axxx','axxx'),(9,'zaaz','zaaz','zaaz','zaaz'),(10,'zbbz','zbbz','zbbz','zbbz');
DELETE FROM t1 WHERE b like NULL ESCAPE 'x' LIMIT 2;
SELECT * FROM t1;
a	b	c	d	e
1	aaaa	aaaa	aaaa	aaaa
2	xxxc	xxxb	xxxb	xxxb
3	xxxb	xxxc	xxxc	xxxc
4	xxxa	xxxa	xxxa	xxxa
5	zzzz	zzzz	zzzz	zzzz
6	NULL	NULL	xxxa	xxxa
7	zxxx	zxxx	zxxx	zxxx
8	axxx	axxx	axxx	axxx
9	zaaz	zaaz	zaaz	zaaz
10	zbbz	zbbz	zbbz	zbbz
replace into t1 values(1,'aaaa','aaaa','aaaa','aaaa'),(2,'xxxc','xxxb','xxxb','xxxb'),(3,'xxxb','xxxc','xxxc','xxxc'),(4,'xxxa','xxxa','xxxa','xxxa'),(5,'zzzz','zzzz','zzzz','zzzz'),(6,NULL,NULL,'xxxa','xxxa'),(7,'zxxx','zxxx','zxxx','zxxx'),(8,'axxx','axxx','axxx','axxx'),(9,'zaaz','zaaz','zaaz','zaaz'),(10,'zbbz','zbbz','zbbz','zbbz');
DELETE FROM t1 WHERE b like NULL ESCAPE 'a' LIMIT 2;
SELECT * FROM t1;
a	b	c	d	e
1	aaaa	aaaa	aaaa	aaaa
2	xxxc	xxxb	xxxb	xxxb
3	xxxb	xxxc	xxxc	xxxc
4	xxxa	xxxa	xxxa	xxxa
5	zzzz	zzzz	zzzz	zzzz
6	NULL	NULL	xxxa	xxxa
7	zxxx	zxxx	zxxx	zxxx
8	axxx	axxx	axxx	axxx
9	zaaz	zaaz	zaaz	zaaz
10	zbbz	zbbz	zbbz	zbbz
replace into t1 values(1,'aaaa','aaaa','aaaa','aaaa'),(2,'xxxc','xxxb','xxxb','xxxb'),(3,'xxxb','xxxc','xxxc','xxxc'),(4,'xxxa','xxxa','xxxa','xxxa'),(5,'zzzz','zzzz','zzzz','zzzz'),(6,NULL,NULL,'xxxa','xxxa'),(7,'zxxx','zxxx','zxxx','zxxx'),(8,'axxx','axxx','axxx','axxx'),(9,'zaaz','zaaz','zaaz','zaaz'),(10,'zbbz','zbbz','zbbz','zbbz');
DELETE FROM t1 WHERE b NOT like NULL LIMIT 2;
SELECT * FROM t1;
a	b	c	d	e
1	aaaa	aaaa	aaaa	aaaa
2	xxxc	xxxb	xxxb	xxxb
3	xxxb	xxxc	xxxc	xxxc
4	xxxa	xxxa	xxxa	xxxa
5	zzzz	zzzz	zzzz	zzzz
6	NULL	NULL	xxxa	xxxa
7	zxxx	zxxx	zxxx	zxxx
8	axxx	axxx	axxx	axxx
9	zaaz	zaaz	zaaz	zaaz
10	zbbz	zbbz	zbbz	zbbz
replace into t1 values(1,'aaaa','aaaa','aaaa','aaaa'),(2,'xxxc','xxxb','xxxb','xxxb'),(3,'xxxb','xxxc','xxxc','xxxc'),(4,'xxxa','xxxa','xxxa','xxxa'),(5,'zzzz','zzzz','zzzz','zzzz'),(6,NULL,NULL,'xxxa','xxxa'),(7,'zxxx','zxxx','zxxx','zxxx'),(8,'axxx','axxx','axxx','axxx'),(9,'zaaz','zaaz','zaaz','zaaz'),(10,'zbbz','zbbz','zbbz','zbbz');
DELETE FROM t1 WHERE b NOT like NULL ESCAPE 'x' LIMIT 2;
SELECT * FROM t1;
a	b	c	d	e
1	aaaa	aaaa	aaaa	aaaa
2	xxxc	xxxb	xxxb	xxxb
3	xxxb	xxxc	xxxc	xxxc
4	xxxa	xxxa	xxxa	xxxa
5	zzzz	zzzz	zzzz	zzzz
6	NULL	NULL	xxxa	xxxa
7	zxxx	zxxx	zxxx	zxxx
8	axxx	axxx	axxx	axxx
9	zaaz	zaaz	zaaz	zaaz
10	zbbz	zbbz	zbbz	zbbz
replace into t1 values(1,'aaaa','aaaa','aaaa','aaaa'),(2,'xxxc','xxxb','xxxb','xxxb'),(3,'xxxb','xxxc','xxxc','xxxc'),(4,'xxxa','xxxa','xxxa','xxxa'),(5,'zzzz','zzzz','zzzz','zzzz'),(6,NULL,NULL,'xxxa','xxxa'),(7,'zxxx','zxxx','zxxx','zxxx'),(8,'axxx','axxx','axxx','axxx'),(9,'zaaz','zaaz','zaaz','zaaz'),(10,'zbbz','zbbz','zbbz','zbbz');
DELETE FROM t1 WHERE b NOT like NULL ESCAPE 'a' LIMIT 2;
SELECT * FROM t1;
a	b	c	d	e
1	aaaa	aaaa	aaaa	aaaa
2	xxxc	xxxb	xxxb	xxxb
3	xxxb	xxxc	xxxc	xxxc
4	xxxa	xxxa	xxxa	xxxa
5	zzzz	zzzz	zzzz	zzzz
6	NULL	NULL	xxxa	xxxa
7	zxxx	zxxx	zxxx	zxxx
8	axxx	axxx	axxx	axxx
9	zaaz	zaaz	zaaz	zaaz
10	zbbz	zbbz	zbbz	zbbz
-- col_str1 [NOT] LIKE col_str2 [ESCAPE NULL]
replace into t1 values(1,'aaaa','aaaa','aaaa','aaaa'),(2,'xxxc','xxxb','xxxb','xxxb'),(3,'xxxb','xxxc','xxxc','xxxc'),(4,'xxxa','xxxa','xxxa','xxxa'),(5,'zzzz','zzzz','zzzz','zzzz'),(6,NULL,NULL,'xxxa','xxxa'),(7,'zxxx','zxxx','zxxx','zxxx'),(8,'axxx','axxx','axxx','axxx'),(9,'zaaz','zaaz','zaaz','zaaz'),(10,'zbbz','zbbz','zbbz','zbbz');
DELETE FROM t1 WHERE b like 'xxx%' ESCAPE NULL LIMIT 2;
SELECT * FROM t1;
a	b	c	d	e
1	aaaa	aaaa	aaaa	aaaa
4	xxxa	xxxa	xxxa	xxxa
5	zzzz	zzzz	zzzz	zzzz
6	NULL	NULL	xxxa	xxxa
7	zxxx	zxxx	zxxx	zxxx
8	axxx	axxx	axxx	axxx
9	zaaz	zaaz	zaaz	zaaz
10	zbbz	zbbz	zbbz	zbbz
replace into t1 values(1,'aaaa','aaaa','aaaa','aaaa'),(2,'xxxc','xxxb','xxxb','xxxb'),(3,'xxxb','xxxc','xxxc','xxxc'),(4,'xxxa','xxxa','xxxa','xxxa'),(5,'zzzz','zzzz','zzzz','zzzz'),(6,NULL,NULL,'xxxa','xxxa'),(7,'zxxx','zxxx','zxxx','zxxx'),(8,'axxx','axxx','axxx','axxx'),(9,'zaaz','zaaz','zaaz','zaaz'),(10,'zbbz','zbbz','zbbz','zbbz');
DELETE FROM t1 WHERE b NOT like 'xxx%' ESCAPE NULL LIMIT 2;
SELECT * FROM t1;
a	b	c	d	e
2	xxxc	xxxb	xxxb	xxxb
3	xxxb	xxxc	xxxc	xxxc
4	xxxa	xxxa	xxxa	xxxa
6	NULL	NULL	xxxa	xxxa
7	zxxx	zxxx	zxxx	zxxx
8	axxx	axxx	axxx	axxx
9	zaaz	zaaz	zaaz	zaaz
10	zbbz	zbbz	zbbz	zbbz
-- col_str1 [NOT] LIKE col_str2 [ESCAPE col_str3]其中col_str1分别为联合索引前缀字段、中间字段、尾部字段
replace into t1 values(1,'aaaa','aaaa','aaaa','aaaa'),(2,'xxxc','xxxb','xxxb','xxxb'),(3,'xxxb','xxxc','xxxc','xxxc'),(4,'xxxa','xxxa','xxxa','xxxa'),(5,'zzzz','zzzz','zzzz','zzzz'),(6,NULL,NULL,'xxxa','xxxa'),(7,'zxxx','zxxx','zxxx','zxxx'),(8,'axxx','axxx','axxx','axxx'),(9,'zaaz','zaaz','zaaz','zaaz'),(10,'zbbz','zbbz','zbbz','zbbz');
DELETE FROM t1 WHERE c like 'xxx%' LIMIT 2;
SELECT * FROM t1;
a	b	c	d	e
1	aaaa	aaaa	aaaa	aaaa
4	xxxa	xxxa	xxxa	xxxa
5	zzzz	zzzz	zzzz	zzzz
6	NULL	NULL	xxxa	xxxa
7	zxxx	zxxx	zxxx	zxxx
8	axxx	axxx	axxx	axxx
9	zaaz	zaaz	zaaz	zaaz
10	zbbz	zbbz	zbbz	zbbz
replace into t1 values(1,'aaaa','aaaa','aaaa','aaaa'),(2,'xxxc','xxxb','xxxb','xxxb'),(3,'xxxb','xxxc','xxxc','xxxc'),(4,'xxxa','xxxa','xxxa','xxxa'),(5,'zzzz','zzzz','zzzz','zzzz'),(6,NULL,NULL,'xxxa','xxxa'),(7,'zxxx','zxxx','zxxx','zxxx'),(8,'axxx','axxx','axxx','axxx'),(9,'zaaz','zaaz','zaaz','zaaz'),(10,'zbbz','zbbz','zbbz','zbbz');
DELETE FROM t1 WHERE c like 'xxx%' ESCAPE 'x' LIMIT 2;
SELECT * FROM t1;
a	b	c	d	e
1	aaaa	aaaa	aaaa	aaaa
2	xxxc	xxxb	xxxb	xxxb
3	xxxb	xxxc	xxxc	xxxc
4	xxxa	xxxa	xxxa	xxxa
5	zzzz	zzzz	zzzz	zzzz
6	NULL	NULL	xxxa	xxxa
7	zxxx	zxxx	zxxx	zxxx
8	axxx	axxx	axxx	axxx
9	zaaz	zaaz	zaaz	zaaz
10	zbbz	zbbz	zbbz	zbbz
replace into t1 values(1,'aaaa','aaaa','aaaa','aaaa'),(2,'xxxc','xxxb','xxxb','xxxb'),(3,'xxxb','xxxc','xxxc','xxxc'),(4,'xxxa','xxxa','xxxa','xxxa'),(5,'zzzz','zzzz','zzzz','zzzz'),(6,NULL,NULL,'xxxa','xxxa'),(7,'zxxx','zxxx','zxxx','zxxx'),(8,'axxx','axxx','axxx','axxx'),(9,'zaaz','zaaz','zaaz','zaaz'),(10,'zbbz','zbbz','zbbz','zbbz');
DELETE FROM t1 WHERE c like 'xxx%' ESCAPE 'a' LIMIT 2;
SELECT * FROM t1;
a	b	c	d	e
1	aaaa	aaaa	aaaa	aaaa
3	xxxb	xxxc	xxxc	xxxc
5	zzzz	zzzz	zzzz	zzzz
6	NULL	NULL	xxxa	xxxa
7	zxxx	zxxx	zxxx	zxxx
8	axxx	axxx	axxx	axxx
9	zaaz	zaaz	zaaz	zaaz
10	zbbz	zbbz	zbbz	zbbz
replace into t1 values(1,'aaaa','aaaa','aaaa','aaaa'),(2,'xxxc','xxxb','xxxb','xxxb'),(3,'xxxb','xxxc','xxxc','xxxc'),(4,'xxxa','xxxa','xxxa','xxxa'),(5,'zzzz','zzzz','zzzz','zzzz'),(6,NULL,NULL,'xxxa','xxxa'),(7,'zxxx','zxxx','zxxx','zxxx'),(8,'axxx','axxx','axxx','axxx'),(9,'zaaz','zaaz','zaaz','zaaz'),(10,'zbbz','zbbz','zbbz','zbbz');
DELETE FROM t1 WHERE c NOT like 'xxx%' LIMIT 2;
SELECT * FROM t1;
a	b	c	d	e
2	xxxc	xxxb	xxxb	xxxb
3	xxxb	xxxc	xxxc	xxxc
4	xxxa	xxxa	xxxa	xxxa
6	NULL	NULL	xxxa	xxxa
7	zxxx	zxxx	zxxx	zxxx
8	axxx	axxx	axxx	axxx
9	zaaz	zaaz	zaaz	zaaz
10	zbbz	zbbz	zbbz	zbbz
replace into t1 values(1,'aaaa','aaaa','aaaa','aaaa'),(2,'xxxc','xxxb','xxxb','xxxb'),(3,'xxxb','xxxc','xxxc','xxxc'),(4,'xxxa','xxxa','xxxa','xxxa'),(5,'zzzz','zzzz','zzzz','zzzz'),(6,NULL,NULL,'xxxa','xxxa'),(7,'zxxx','zxxx','zxxx','zxxx'),(8,'axxx','axxx','axxx','axxx'),(9,'zaaz','zaaz','zaaz','zaaz'),(10,'zbbz','zbbz','zbbz','zbbz');
DELETE FROM t1 WHERE c NOT like 'xxx%' ESCAPE 'x' LIMIT 2;
SELECT * FROM t1;
a	b	c	d	e
3	xxxb	xxxc	xxxc	xxxc
4	xxxa	xxxa	xxxa	xxxa
5	zzzz	zzzz	zzzz	zzzz
6	NULL	NULL	xxxa	xxxa
7	zxxx	zxxx	zxxx	zxxx
8	axxx	axxx	axxx	axxx
9	zaaz	zaaz	zaaz	zaaz
10	zbbz	zbbz	zbbz	zbbz
replace into t1 values(1,'aaaa','aaaa','aaaa','aaaa'),(2,'xxxc','xxxb','xxxb','xxxb'),(3,'xxxb','xxxc','xxxc','xxxc'),(4,'xxxa','xxxa','xxxa','xxxa'),(5,'zzzz','zzzz','zzzz','zzzz'),(6,NULL,NULL,'xxxa','xxxa'),(7,'zxxx','zxxx','zxxx','zxxx'),(8,'axxx','axxx','axxx','axxx'),(9,'zaaz','zaaz','zaaz','zaaz'),(10,'zbbz','zbbz','zbbz','zbbz');
DELETE FROM t1 WHERE c NOT like 'xxx%' ESCAPE 'a' LIMIT 2;
SELECT * FROM t1;
a	b	c	d	e
2	xxxc	xxxb	xxxb	xxxb
3	xxxb	xxxc	xxxc	xxxc
4	xxxa	xxxa	xxxa	xxxa
6	NULL	NULL	xxxa	xxxa
7	zxxx	zxxx	zxxx	zxxx
8	axxx	axxx	axxx	axxx
9	zaaz	zaaz	zaaz	zaaz
10	zbbz	zbbz	zbbz	zbbz
replace into t1 values(1,'aaaa','aaaa','aaaa','aaaa'),(2,'xxxc','xxxb','xxxb','xxxb'),(3,'xxxb','xxxc','xxxc','xxxc'),(4,'xxxa','xxxa','xxxa','xxxa'),(5,'zzzz','zzzz','zzzz','zzzz'),(6,NULL,NULL,'xxxa','xxxa'),(7,'zxxx','zxxx','zxxx','zxxx'),(8,'axxx','axxx','axxx','axxx'),(9,'zaaz','zaaz','zaaz','zaaz'),(10,'zbbz','zbbz','zbbz','zbbz');
DELETE FROM t1 WHERE d like 'xxx%' LIMIT 2;
SELECT * FROM t1;
a	b	c	d	e
1	aaaa	aaaa	aaaa	aaaa
4	xxxa	xxxa	xxxa	xxxa
5	zzzz	zzzz	zzzz	zzzz
6	NULL	NULL	xxxa	xxxa
7	zxxx	zxxx	zxxx	zxxx
8	axxx	axxx	axxx	axxx
9	zaaz	zaaz	zaaz	zaaz
10	zbbz	zbbz	zbbz	zbbz
replace into t1 values(1,'aaaa','aaaa','aaaa','aaaa'),(2,'xxxc','xxxb','xxxb','xxxb'),(3,'xxxb','xxxc','xxxc','xxxc'),(4,'xxxa','xxxa','xxxa','xxxa'),(5,'zzzz','zzzz','zzzz','zzzz'),(6,NULL,NULL,'xxxa','xxxa'),(7,'zxxx','zxxx','zxxx','zxxx'),(8,'axxx','axxx','axxx','axxx'),(9,'zaaz','zaaz','zaaz','zaaz'),(10,'zbbz','zbbz','zbbz','zbbz');
DELETE FROM t1 WHERE d like 'xxx%' ESCAPE 'x' LIMIT 2;
SELECT * FROM t1;
a	b	c	d	e
1	aaaa	aaaa	aaaa	aaaa
2	xxxc	xxxb	xxxb	xxxb
3	xxxb	xxxc	xxxc	xxxc
4	xxxa	xxxa	xxxa	xxxa
5	zzzz	zzzz	zzzz	zzzz
6	NULL	NULL	xxxa	xxxa
7	zxxx	zxxx	zxxx	zxxx
8	axxx	axxx	axxx	axxx
9	zaaz	zaaz	zaaz	zaaz
10	zbbz	zbbz	zbbz	zbbz
replace into t1 values(1,'aaaa','aaaa','aaaa','aaaa'),(2,'xxxc','xxxb','xxxb','xxxb'),(3,'xxxb','xxxc','xxxc','xxxc'),(4,'xxxa','xxxa','xxxa','xxxa'),(5,'zzzz','zzzz','zzzz','zzzz'),(6,NULL,NULL,'xxxa','xxxa'),(7,'zxxx','zxxx','zxxx','zxxx'),(8,'axxx','axxx','axxx','axxx'),(9,'zaaz','zaaz','zaaz','zaaz'),(10,'zbbz','zbbz','zbbz','zbbz');
DELETE FROM t1 WHERE d like 'xxx%' ESCAPE 'a' LIMIT 2;
SELECT * FROM t1;
a	b	c	d	e
1	aaaa	aaaa	aaaa	aaaa
4	xxxa	xxxa	xxxa	xxxa
5	zzzz	zzzz	zzzz	zzzz
6	NULL	NULL	xxxa	xxxa
7	zxxx	zxxx	zxxx	zxxx
8	axxx	axxx	axxx	axxx
9	zaaz	zaaz	zaaz	zaaz
10	zbbz	zbbz	zbbz	zbbz
replace into t1 values(1,'aaaa','aaaa','aaaa','aaaa'),(2,'xxxc','xxxb','xxxb','xxxb'),(3,'xxxb','xxxc','xxxc','xxxc'),(4,'xxxa','xxxa','xxxa','xxxa'),(5,'zzzz','zzzz','zzzz','zzzz'),(6,NULL,NULL,'xxxa','xxxa'),(7,'zxxx','zxxx','zxxx','zxxx'),(8,'axxx','axxx','axxx','axxx'),(9,'zaaz','zaaz','zaaz','zaaz'),(10,'zbbz','zbbz','zbbz','zbbz');
DELETE FROM t1 WHERE d NOT like 'xxx%' LIMIT 2;
SELECT * FROM t1;
a	b	c	d	e
2	xxxc	xxxb	xxxb	xxxb
3	xxxb	xxxc	xxxc	xxxc
4	xxxa	xxxa	xxxa	xxxa
6	NULL	NULL	xxxa	xxxa
7	zxxx	zxxx	zxxx	zxxx
8	axxx	axxx	axxx	axxx
9	zaaz	zaaz	zaaz	zaaz
10	zbbz	zbbz	zbbz	zbbz
replace into t1 values(1,'aaaa','aaaa','aaaa','aaaa'),(2,'xxxc','xxxb','xxxb','xxxb'),(3,'xxxb','xxxc','xxxc','xxxc'),(4,'xxxa','xxxa','xxxa','xxxa'),(5,'zzzz','zzzz','zzzz','zzzz'),(6,NULL,NULL,'xxxa','xxxa'),(7,'zxxx','zxxx','zxxx','zxxx'),(8,'axxx','axxx','axxx','axxx'),(9,'zaaz','zaaz','zaaz','zaaz'),(10,'zbbz','zbbz','zbbz','zbbz');
DELETE FROM t1 WHERE d NOT like 'xxx%' ESCAPE 'x' LIMIT 2;
SELECT * FROM t1;
a	b	c	d	e
3	xxxb	xxxc	xxxc	xxxc
4	xxxa	xxxa	xxxa	xxxa
5	zzzz	zzzz	zzzz	zzzz
6	NULL	NULL	xxxa	xxxa
7	zxxx	zxxx	zxxx	zxxx
8	axxx	axxx	axxx	axxx
9	zaaz	zaaz	zaaz	zaaz
10	zbbz	zbbz	zbbz	zbbz
replace into t1 values(1,'aaaa','aaaa','aaaa','aaaa'),(2,'xxxc','xxxb','xxxb','xxxb'),(3,'xxxb','xxxc','xxxc','xxxc'),(4,'xxxa','xxxa','xxxa','xxxa'),(5,'zzzz','zzzz','zzzz','zzzz'),(6,NULL,NULL,'xxxa','xxxa'),(7,'zxxx','zxxx','zxxx','zxxx'),(8,'axxx','axxx','axxx','axxx'),(9,'zaaz','zaaz','zaaz','zaaz'),(10,'zbbz','zbbz','zbbz','zbbz');
DELETE FROM t1 WHERE d NOT like 'xxx%' ESCAPE 'a' LIMIT 2;
SELECT * FROM t1;
a	b	c	d	e
2	xxxc	xxxb	xxxb	xxxb
3	xxxb	xxxc	xxxc	xxxc
4	xxxa	xxxa	xxxa	xxxa
6	NULL	NULL	xxxa	xxxa
7	zxxx	zxxx	zxxx	zxxx
8	axxx	axxx	axxx	axxx
9	zaaz	zaaz	zaaz	zaaz
10	zbbz	zbbz	zbbz	zbbz
replace into t1 values(1,'aaaa','aaaa','aaaa','aaaa'),(2,'xxxc','xxxb','xxxb','xxxb'),(3,'xxxb','xxxc','xxxc','xxxc'),(4,'xxxa','xxxa','xxxa','xxxa'),(5,'zzzz','zzzz','zzzz','zzzz'),(6,NULL,NULL,'xxxa','xxxa'),(7,'zxxx','zxxx','zxxx','zxxx'),(8,'axxx','axxx','axxx','axxx'),(9,'zaaz','zaaz','zaaz','zaaz'),(10,'zbbz','zbbz','zbbz','zbbz');
DELETE FROM t1 WHERE e like 'xxx%' LIMIT 2;
SELECT * FROM t1;
a	b	c	d	e
1	aaaa	aaaa	aaaa	aaaa
4	xxxa	xxxa	xxxa	xxxa
5	zzzz	zzzz	zzzz	zzzz
6	NULL	NULL	xxxa	xxxa
7	zxxx	zxxx	zxxx	zxxx
8	axxx	axxx	axxx	axxx
9	zaaz	zaaz	zaaz	zaaz
10	zbbz	zbbz	zbbz	zbbz
replace into t1 values(1,'aaaa','aaaa','aaaa','aaaa'),(2,'xxxc','xxxb','xxxb','xxxb'),(3,'xxxb','xxxc','xxxc','xxxc'),(4,'xxxa','xxxa','xxxa','xxxa'),(5,'zzzz','zzzz','zzzz','zzzz'),(6,NULL,NULL,'xxxa','xxxa'),(7,'zxxx','zxxx','zxxx','zxxx'),(8,'axxx','axxx','axxx','axxx'),(9,'zaaz','zaaz','zaaz','zaaz'),(10,'zbbz','zbbz','zbbz','zbbz');
DELETE FROM t1 WHERE e like 'xxx%' ESCAPE 'x' LIMIT 2;
SELECT * FROM t1;
a	b	c	d	e
1	aaaa	aaaa	aaaa	aaaa
2	xxxc	xxxb	xxxb	xxxb
3	xxxb	xxxc	xxxc	xxxc
4	xxxa	xxxa	xxxa	xxxa
5	zzzz	zzzz	zzzz	zzzz
6	NULL	NULL	xxxa	xxxa
7	zxxx	zxxx	zxxx	zxxx
8	axxx	axxx	axxx	axxx
9	zaaz	zaaz	zaaz	zaaz
10	zbbz	zbbz	zbbz	zbbz
replace into t1 values(1,'aaaa','aaaa','aaaa','aaaa'),(2,'xxxc','xxxb','xxxb','xxxb'),(3,'xxxb','xxxc','xxxc','xxxc'),(4,'xxxa','xxxa','xxxa','xxxa'),(5,'zzzz','zzzz','zzzz','zzzz'),(6,NULL,NULL,'xxxa','xxxa'),(7,'zxxx','zxxx','zxxx','zxxx'),(8,'axxx','axxx','axxx','axxx'),(9,'zaaz','zaaz','zaaz','zaaz'),(10,'zbbz','zbbz','zbbz','zbbz');
DELETE FROM t1 WHERE e like 'xxx%' ESCAPE 'a' LIMIT 2;
SELECT * FROM t1;
a	b	c	d	e
1	aaaa	aaaa	aaaa	aaaa
4	xxxa	xxxa	xxxa	xxxa
5	zzzz	zzzz	zzzz	zzzz
6	NULL	NULL	xxxa	xxxa
7	zxxx	zxxx	zxxx	zxxx
8	axxx	axxx	axxx	axxx
9	zaaz	zaaz	zaaz	zaaz
10	zbbz	zbbz	zbbz	zbbz
replace into t1 values(1,'aaaa','aaaa','aaaa','aaaa'),(2,'xxxc','xxxb','xxxb','xxxb'),(3,'xxxb','xxxc','xxxc','xxxc'),(4,'xxxa','xxxa','xxxa','xxxa'),(5,'zzzz','zzzz','zzzz','zzzz'),(6,NULL,NULL,'xxxa','xxxa'),(7,'zxxx','zxxx','zxxx','zxxx'),(8,'axxx','axxx','axxx','axxx'),(9,'zaaz','zaaz','zaaz','zaaz'),(10,'zbbz','zbbz','zbbz','zbbz');
DELETE FROM t1 WHERE e NOT like 'xxx%' LIMIT 2;
SELECT * FROM t1;
a	b	c	d	e
2	xxxc	xxxb	xxxb	xxxb
3	xxxb	xxxc	xxxc	xxxc
4	xxxa	xxxa	xxxa	xxxa
6	NULL	NULL	xxxa	xxxa
7	zxxx	zxxx	zxxx	zxxx
8	axxx	axxx	axxx	axxx
9	zaaz	zaaz	zaaz	zaaz
10	zbbz	zbbz	zbbz	zbbz
replace into t1 values(1,'aaaa','aaaa','aaaa','aaaa'),(2,'xxxc','xxxb','xxxb','xxxb'),(3,'xxxb','xxxc','xxxc','xxxc'),(4,'xxxa','xxxa','xxxa','xxxa'),(5,'zzzz','zzzz','zzzz','zzzz'),(6,NULL,NULL,'xxxa','xxxa'),(7,'zxxx','zxxx','zxxx','zxxx'),(8,'axxx','axxx','axxx','axxx'),(9,'zaaz','zaaz','zaaz','zaaz'),(10,'zbbz','zbbz','zbbz','zbbz');
DELETE FROM t1 WHERE e NOT like 'xxx%' ESCAPE 'x' LIMIT 2;
SELECT * FROM t1;
a	b	c	d	e
3	xxxb	xxxc	xxxc	xxxc
4	xxxa	xxxa	xxxa	xxxa
5	zzzz	zzzz	zzzz	zzzz
6	NULL	NULL	xxxa	xxxa
7	zxxx	zxxx	zxxx	zxxx
8	axxx	axxx	axxx	axxx
9	zaaz	zaaz	zaaz	zaaz
10	zbbz	zbbz	zbbz	zbbz
replace into t1 values(1,'aaaa','aaaa','aaaa','aaaa'),(2,'xxxc','xxxb','xxxb','xxxb'),(3,'xxxb','xxxc','xxxc','xxxc'),(4,'xxxa','xxxa','xxxa','xxxa'),(5,'zzzz','zzzz','zzzz','zzzz'),(6,NULL,NULL,'xxxa','xxxa'),(7,'zxxx','zxxx','zxxx','zxxx'),(8,'axxx','axxx','axxx','axxx'),(9,'zaaz','zaaz','zaaz','zaaz'),(10,'zbbz','zbbz','zbbz','zbbz');
DELETE FROM t1 WHERE e NOT like 'xxx%' ESCAPE 'a' LIMIT 2;
SELECT * FROM t1;
a	b	c	d	e
2	xxxc	xxxb	xxxb	xxxb
3	xxxb	xxxc	xxxc	xxxc
4	xxxa	xxxa	xxxa	xxxa
6	NULL	NULL	xxxa	xxxa
7	zxxx	zxxx	zxxx	zxxx
8	axxx	axxx	axxx	axxx
9	zaaz	zaaz	zaaz	zaaz
10	zbbz	zbbz	zbbz	zbbz
-- col_str1||’xxx’ [NOT] LIKE col_str2 [ESCAPE col_str3]
replace into t1 values(1,'aaaa','aaaa','aaaa','aaaa'),(2,'xxxc','xxxb','xxxb','xxxb'),(3,'xxxb','xxxc','xxxc','xxxc'),(4,'xxxa','xxxa','xxxa','xxxa'),(5,'zzzz','zzzz','zzzz','zzzz'),(6,NULL,NULL,'xxxa','xxxa'),(7,'zxxx','zxxx','zxxx','zxxx'),(8,'axxx','axxx','axxx','axxx'),(9,'zaaz','zaaz','zaaz','zaaz'),(10,'zbbz','zbbz','zbbz','zbbz');
DELETE FROM t1 WHERE 'xxx'||b like 'xxxxxx%' LIMIT 2;
SELECT * FROM t1;
a	b	c	d	e
1	aaaa	aaaa	aaaa	aaaa
2	xxxc	xxxb	xxxb	xxxb
3	xxxb	xxxc	xxxc	xxxc
4	xxxa	xxxa	xxxa	xxxa
5	zzzz	zzzz	zzzz	zzzz
6	NULL	NULL	xxxa	xxxa
7	zxxx	zxxx	zxxx	zxxx
8	axxx	axxx	axxx	axxx
9	zaaz	zaaz	zaaz	zaaz
10	zbbz	zbbz	zbbz	zbbz
replace into t1 values(1,'aaaa','aaaa','aaaa','aaaa'),(2,'xxxc','xxxb','xxxb','xxxb'),(3,'xxxb','xxxc','xxxc','xxxc'),(4,'xxxa','xxxa','xxxa','xxxa'),(5,'zzzz','zzzz','zzzz','zzzz'),(6,NULL,NULL,'xxxa','xxxa'),(7,'zxxx','zxxx','zxxx','zxxx'),(8,'axxx','axxx','axxx','axxx'),(9,'zaaz','zaaz','zaaz','zaaz'),(10,'zbbz','zbbz','zbbz','zbbz');
DELETE FROM t1 WHERE 'xxx'||b like 'xxxxxx%' ESCAPE 'x' LIMIT 2;
SELECT * FROM t1;
a	b	c	d	e
1	aaaa	aaaa	aaaa	aaaa
4	xxxa	xxxa	xxxa	xxxa
5	zzzz	zzzz	zzzz	zzzz
6	NULL	NULL	xxxa	xxxa
7	zxxx	zxxx	zxxx	zxxx
8	axxx	axxx	axxx	axxx
9	zaaz	zaaz	zaaz	zaaz
10	zbbz	zbbz	zbbz	zbbz
replace into t1 values(1,'aaaa','aaaa','aaaa','aaaa'),(2,'xxxc','xxxb','xxxb','xxxb'),(3,'xxxb','xxxc','xxxc','xxxc'),(4,'xxxa','xxxa','xxxa','xxxa'),(5,'zzzz','zzzz','zzzz','zzzz'),(6,NULL,NULL,'xxxa','xxxa'),(7,'zxxx','zxxx','zxxx','zxxx'),(8,'axxx','axxx','axxx','axxx'),(9,'zaaz','zaaz','zaaz','zaaz'),(10,'zbbz','zbbz','zbbz','zbbz');
DELETE FROM t1 WHERE 'xxx'||b like 'xxxxxx%' ESCAPE 'a' LIMIT 2;
SELECT * FROM t1;
a	b	c	d	e
1	aaaa	aaaa	aaaa	aaaa
2	xxxc	xxxb	xxxb	xxxb
3	xxxb	xxxc	xxxc	xxxc
4	xxxa	xxxa	xxxa	xxxa
5	zzzz	zzzz	zzzz	zzzz
6	NULL	NULL	xxxa	xxxa
7	zxxx	zxxx	zxxx	zxxx
8	axxx	axxx	axxx	axxx
9	zaaz	zaaz	zaaz	zaaz
10	zbbz	zbbz	zbbz	zbbz
replace into t1 values(1,'aaaa','aaaa','aaaa','aaaa'),(2,'xxxc','xxxb','xxxb','xxxb'),(3,'xxxb','xxxc','xxxc','xxxc'),(4,'xxxa','xxxa','xxxa','xxxa'),(5,'zzzz','zzzz','zzzz','zzzz'),(6,NULL,NULL,'xxxa','xxxa'),(7,'zxxx','zxxx','zxxx','zxxx'),(8,'axxx','axxx','axxx','axxx'),(9,'zaaz','zaaz','zaaz','zaaz'),(10,'zbbz','zbbz','zbbz','zbbz');
DELETE FROM t1 WHERE 'xxx'||b NOT like 'xxxxxx%' LIMIT 2;
SELECT * FROM t1;
a	b	c	d	e
3	xxxb	xxxc	xxxc	xxxc
4	xxxa	xxxa	xxxa	xxxa
5	zzzz	zzzz	zzzz	zzzz
6	NULL	NULL	xxxa	xxxa
7	zxxx	zxxx	zxxx	zxxx
8	axxx	axxx	axxx	axxx
9	zaaz	zaaz	zaaz	zaaz
10	zbbz	zbbz	zbbz	zbbz
replace into t1 values(1,'aaaa','aaaa','aaaa','aaaa'),(2,'xxxc','xxxb','xxxb','xxxb'),(3,'xxxb','xxxc','xxxc','xxxc'),(4,'xxxa','xxxa','xxxa','xxxa'),(5,'zzzz','zzzz','zzzz','zzzz'),(6,NULL,NULL,'xxxa','xxxa'),(7,'zxxx','zxxx','zxxx','zxxx'),(8,'axxx','axxx','axxx','axxx'),(9,'zaaz','zaaz','zaaz','zaaz'),(10,'zbbz','zbbz','zbbz','zbbz');
DELETE FROM t1 WHERE 'xxx'||b NOT like 'xxxxxx%' ESCAPE 'x' LIMIT 2;
SELECT * FROM t1;
a	b	c	d	e
2	xxxc	xxxb	xxxb	xxxb
3	xxxb	xxxc	xxxc	xxxc
4	xxxa	xxxa	xxxa	xxxa
6	NULL	NULL	xxxa	xxxa
7	zxxx	zxxx	zxxx	zxxx
8	axxx	axxx	axxx	axxx
9	zaaz	zaaz	zaaz	zaaz
10	zbbz	zbbz	zbbz	zbbz
replace into t1 values(1,'aaaa','aaaa','aaaa','aaaa'),(2,'xxxc','xxxb','xxxb','xxxb'),(3,'xxxb','xxxc','xxxc','xxxc'),(4,'xxxa','xxxa','xxxa','xxxa'),(5,'zzzz','zzzz','zzzz','zzzz'),(6,NULL,NULL,'xxxa','xxxa'),(7,'zxxx','zxxx','zxxx','zxxx'),(8,'axxx','axxx','axxx','axxx'),(9,'zaaz','zaaz','zaaz','zaaz'),(10,'zbbz','zbbz','zbbz','zbbz');
DELETE FROM t1 WHERE 'xxx'||b NOT like 'xxxxxx%' ESCAPE 'a' LIMIT 2;
SELECT * FROM t1;
a	b	c	d	e
3	xxxb	xxxc	xxxc	xxxc
4	xxxa	xxxa	xxxa	xxxa
5	zzzz	zzzz	zzzz	zzzz
6	NULL	NULL	xxxa	xxxa
7	zxxx	zxxx	zxxx	zxxx
8	axxx	axxx	axxx	axxx
9	zaaz	zaaz	zaaz	zaaz
10	zbbz	zbbz	zbbz	zbbz
-- col like col_str2中col_str2是concat、substr、upper、lower等字符串函数的输出
replace into t1 values(1,'aaaa','aaaa','aaaa','aaaa'),(2,'xxxc','xxxb','xxxb','xxxb'),(3,'xxxb','xxxc','xxxc','xxxc'),(4,'xxxa','xxxa','xxxa','xxxa'),(5,'zzzz','zzzz','zzzz','zzzz'),(6,NULL,NULL,'xxxa','xxxa'),(7,'zxxx','zxxx','zxxx','zxxx'),(8,'axxx','axxx','axxx','axxx'),(9,'zaaz','zaaz','zaaz','zaaz'),(10,'zbbz','zbbz','zbbz','zbbz');
DELETE FROM t1 WHERE CONCAT(b,'ccc') like 'xxx%' LIMIT 2;
SELECT * FROM t1;
a	b	c	d	e
1	aaaa	aaaa	aaaa	aaaa
4	xxxa	xxxa	xxxa	xxxa
5	zzzz	zzzz	zzzz	zzzz
6	NULL	NULL	xxxa	xxxa
7	zxxx	zxxx	zxxx	zxxx
8	axxx	axxx	axxx	axxx
9	zaaz	zaaz	zaaz	zaaz
10	zbbz	zbbz	zbbz	zbbz
replace into t1 values(1,'aaaa','aaaa','aaaa','aaaa'),(2,'xxxc','xxxb','xxxb','xxxb'),(3,'xxxb','xxxc','xxxc','xxxc'),(4,'xxxa','xxxa','xxxa','xxxa'),(5,'zzzz','zzzz','zzzz','zzzz'),(6,NULL,NULL,'xxxa','xxxa'),(7,'zxxx','zxxx','zxxx','zxxx'),(8,'axxx','axxx','axxx','axxx'),(9,'zaaz','zaaz','zaaz','zaaz'),(10,'zbbz','zbbz','zbbz','zbbz');
DELETE FROM t1 WHERE REPEAT(b,5) like 'xxx%' ESCAPE 'x' LIMIT 2;
SELECT * FROM t1;
a	b	c	d	e
1	aaaa	aaaa	aaaa	aaaa
2	xxxc	xxxb	xxxb	xxxb
3	xxxb	xxxc	xxxc	xxxc
4	xxxa	xxxa	xxxa	xxxa
5	zzzz	zzzz	zzzz	zzzz
6	NULL	NULL	xxxa	xxxa
7	zxxx	zxxx	zxxx	zxxx
8	axxx	axxx	axxx	axxx
9	zaaz	zaaz	zaaz	zaaz
10	zbbz	zbbz	zbbz	zbbz
replace into t1 values(1,'aaaa','aaaa','aaaa','aaaa'),(2,'xxxc','xxxb','xxxb','xxxb'),(3,'xxxb','xxxc','xxxc','xxxc'),(4,'xxxa','xxxa','xxxa','xxxa'),(5,'zzzz','zzzz','zzzz','zzzz'),(6,NULL,NULL,'xxxa','xxxa'),(7,'zxxx','zxxx','zxxx','zxxx'),(8,'axxx','axxx','axxx','axxx'),(9,'zaaz','zaaz','zaaz','zaaz'),(10,'zbbz','zbbz','zbbz','zbbz');
DELETE FROM t1 WHERE LOWER(b) like 'xxx%' ESCAPE 'a' LIMIT 2;
SELECT * FROM t1;
a	b	c	d	e
1	aaaa	aaaa	aaaa	aaaa
4	xxxa	xxxa	xxxa	xxxa
5	zzzz	zzzz	zzzz	zzzz
6	NULL	NULL	xxxa	xxxa
7	zxxx	zxxx	zxxx	zxxx
8	axxx	axxx	axxx	axxx
9	zaaz	zaaz	zaaz	zaaz
10	zbbz	zbbz	zbbz	zbbz
replace into t1 values(1,'aaaa','aaaa','aaaa','aaaa'),(2,'xxxc','xxxb','xxxb','xxxb'),(3,'xxxb','xxxc','xxxc','xxxc'),(4,'xxxa','xxxa','xxxa','xxxa'),(5,'zzzz','zzzz','zzzz','zzzz'),(6,NULL,NULL,'xxxa','xxxa'),(7,'zxxx','zxxx','zxxx','zxxx'),(8,'axxx','axxx','axxx','axxx'),(9,'zaaz','zaaz','zaaz','zaaz'),(10,'zbbz','zbbz','zbbz','zbbz');
DELETE FROM t1 WHERE SUBSTR(b,1,4) like 'xxx%' ESCAPE 'a' LIMIT 2;
SELECT * FROM t1;
a	b	c	d	e
1	aaaa	aaaa	aaaa	aaaa
4	xxxa	xxxa	xxxa	xxxa
5	zzzz	zzzz	zzzz	zzzz
6	NULL	NULL	xxxa	xxxa
7	zxxx	zxxx	zxxx	zxxx
8	axxx	axxx	axxx	axxx
9	zaaz	zaaz	zaaz	zaaz
10	zbbz	zbbz	zbbz	zbbz
replace into t1 values(1,'aaaa','aaaa','aaaa','aaaa'),(2,'xxxc','xxxb','xxxb','xxxb'),(3,'xxxb','xxxc','xxxc','xxxc'),(4,'xxxa','xxxa','xxxa','xxxa'),(5,'zzzz','zzzz','zzzz','zzzz'),(6,NULL,NULL,'xxxa','xxxa'),(7,'zxxx','zxxx','zxxx','zxxx'),(8,'axxx','axxx','axxx','axxx'),(9,'zaaz','zaaz','zaaz','zaaz'),(10,'zbbz','zbbz','zbbz','zbbz');
DELETE FROM t1 WHERE b like CONCAT('xxx' , '%') LIMIT 2;
SELECT * FROM t1;
a	b	c	d	e
1	aaaa	aaaa	aaaa	aaaa
4	xxxa	xxxa	xxxa	xxxa
5	zzzz	zzzz	zzzz	zzzz
6	NULL	NULL	xxxa	xxxa
7	zxxx	zxxx	zxxx	zxxx
8	axxx	axxx	axxx	axxx
9	zaaz	zaaz	zaaz	zaaz
10	zbbz	zbbz	zbbz	zbbz
replace into t1 values(1,'aaaa','aaaa','aaaa','aaaa'),(2,'xxxc','xxxb','xxxb','xxxb'),(3,'xxxb','xxxc','xxxc','xxxc'),(4,'xxxa','xxxa','xxxa','xxxa'),(5,'zzzz','zzzz','zzzz','zzzz'),(6,NULL,NULL,'xxxa','xxxa'),(7,'zxxx','zxxx','zxxx','zxxx'),(8,'axxx','axxx','axxx','axxx'),(9,'zaaz','zaaz','zaaz','zaaz'),(10,'zbbz','zbbz','zbbz','zbbz');
EXPLAIN DELETE FROM t1 WHERE b like REPEAT('x' , 3) LIMIT 2;
SELECT * FROM t1;
a	b	c	d	e
1	aaaa	aaaa	aaaa	aaaa
2	xxxc	xxxb	xxxb	xxxb
3	xxxb	xxxc	xxxc	xxxc
4	xxxa	xxxa	xxxa	xxxa
5	zzzz	zzzz	zzzz	zzzz
6	NULL	NULL	xxxa	xxxa
7	zxxx	zxxx	zxxx	zxxx
8	axxx	axxx	axxx	axxx
9	zaaz	zaaz	zaaz	zaaz
10	zbbz	zbbz	zbbz	zbbz
replace into t1 values(1,'aaaa','aaaa','aaaa','aaaa'),(2,'xxxc','xxxb','xxxb','xxxb'),(3,'xxxb','xxxc','xxxc','xxxc'),(4,'xxxa','xxxa','xxxa','xxxa'),(5,'zzzz','zzzz','zzzz','zzzz'),(6,NULL,NULL,'xxxa','xxxa'),(7,'zxxx','zxxx','zxxx','zxxx'),(8,'axxx','axxx','axxx','axxx'),(9,'zaaz','zaaz','zaaz','zaaz'),(10,'zbbz','zbbz','zbbz','zbbz');
EXPLAIN DELETE FROM t1 WHERE b like SUBSTR('%xxx%',2,4) LIMIT 2;
SELECT * FROM t1;
a	b	c	d	e
1	aaaa	aaaa	aaaa	aaaa
2	xxxc	xxxb	xxxb	xxxb
3	xxxb	xxxc	xxxc	xxxc
4	xxxa	xxxa	xxxa	xxxa
5	zzzz	zzzz	zzzz	zzzz
6	NULL	NULL	xxxa	xxxa
7	zxxx	zxxx	zxxx	zxxx
8	axxx	axxx	axxx	axxx
9	zaaz	zaaz	zaaz	zaaz
10	zbbz	zbbz	zbbz	zbbz
replace into t1 values(1,'aaaa','aaaa','aaaa','aaaa'),(2,'xxxc','xxxb','xxxb','xxxb'),(3,'xxxb','xxxc','xxxc','xxxc'),(4,'xxxa','xxxa','xxxa','xxxa'),(5,'zzzz','zzzz','zzzz','zzzz'),(6,NULL,NULL,'xxxa','xxxa'),(7,'zxxx','zxxx','zxxx','zxxx'),(8,'axxx','axxx','axxx','axxx'),(9,'zaaz','zaaz','zaaz','zaaz'),(10,'zbbz','zbbz','zbbz','zbbz');
EXPLAIN DELETE FROM t1 WHERE b like UPPER('xxx%') LIMIT 2;
SELECT * FROM t1;
a	b	c	d	e
1	aaaa	aaaa	aaaa	aaaa
2	xxxc	xxxb	xxxb	xxxb
3	xxxb	xxxc	xxxc	xxxc
4	xxxa	xxxa	xxxa	xxxa
5	zzzz	zzzz	zzzz	zzzz
6	NULL	NULL	xxxa	xxxa
7	zxxx	zxxx	zxxx	zxxx
8	axxx	axxx	axxx	axxx
9	zaaz	zaaz	zaaz	zaaz
10	zbbz	zbbz	zbbz	zbbz
replace into t1 values(1,'aaaa','aaaa','aaaa','aaaa'),(2,'xxxc','xxxb','xxxb','xxxb'),(3,'xxxb','xxxc','xxxc','xxxc'),(4,'xxxa','xxxa','xxxa','xxxa'),(5,'zzzz','zzzz','zzzz','zzzz'),(6,NULL,NULL,'xxxa','xxxa'),(7,'zxxx','zxxx','zxxx','zxxx'),(8,'axxx','axxx','axxx','axxx'),(9,'zaaz','zaaz','zaaz','zaaz'),(10,'zbbz','zbbz','zbbz','zbbz');
EXPLAIN DELETE FROM t1 WHERE b like LOWER('XXX%') LIMIT 2;
SELECT * FROM t1;
a	b	c	d	e
1	aaaa	aaaa	aaaa	aaaa
2	xxxc	xxxb	xxxb	xxxb
3	xxxb	xxxc	xxxc	xxxc
4	xxxa	xxxa	xxxa	xxxa
5	zzzz	zzzz	zzzz	zzzz
6	NULL	NULL	xxxa	xxxa
7	zxxx	zxxx	zxxx	zxxx
8	axxx	axxx	axxx	axxx
9	zaaz	zaaz	zaaz	zaaz
10	zbbz	zbbz	zbbz	zbbz
-- 通过and/or连接多个like表达式
replace into t1 values(1,'aaaa','aaaa','aaaa','aaaa'),(2,'xxxc','xxxb','xxxb','xxxb'),(3,'xxxb','xxxc','xxxc','xxxc'),(4,'xxxa','xxxa','xxxa','xxxa'),(5,'zzzz','zzzz','zzzz','zzzz'),(6,NULL,NULL,'xxxa','xxxa'),(7,'zxxx','zxxx','zxxx','zxxx'),(8,'axxx','axxx','axxx','axxx'),(9,'zaaz','zaaz','zaaz','zaaz'),(10,'zbbz','zbbz','zbbz','zbbz');
DELETE FROM t1 WHERE b like 'xxx%' and b like 'yyy%' LIMIT 2;
SELECT * FROM t1;
a	b	c	d	e
1	aaaa	aaaa	aaaa	aaaa
2	xxxc	xxxb	xxxb	xxxb
3	xxxb	xxxc	xxxc	xxxc
4	xxxa	xxxa	xxxa	xxxa
5	zzzz	zzzz	zzzz	zzzz
6	NULL	NULL	xxxa	xxxa
7	zxxx	zxxx	zxxx	zxxx
8	axxx	axxx	axxx	axxx
9	zaaz	zaaz	zaaz	zaaz
10	zbbz	zbbz	zbbz	zbbz
replace into t1 values(1,'aaaa','aaaa','aaaa','aaaa'),(2,'xxxc','xxxb','xxxb','xxxb'),(3,'xxxb','xxxc','xxxc','xxxc'),(4,'xxxa','xxxa','xxxa','xxxa'),(5,'zzzz','zzzz','zzzz','zzzz'),(6,NULL,NULL,'xxxa','xxxa'),(7,'zxxx','zxxx','zxxx','zxxx'),(8,'axxx','axxx','axxx','axxx'),(9,'zaaz','zaaz','zaaz','zaaz'),(10,'zbbz','zbbz','zbbz','zbbz');
DELETE FROM t1 WHERE b like 'xxx%' ESCAPE 'x' or b like 'xxx%' LIMIT 2;
SELECT * FROM t1;
a	b	c	d	e
1	aaaa	aaaa	aaaa	aaaa
4	xxxa	xxxa	xxxa	xxxa
5	zzzz	zzzz	zzzz	zzzz
6	NULL	NULL	xxxa	xxxa
7	zxxx	zxxx	zxxx	zxxx
8	axxx	axxx	axxx	axxx
9	zaaz	zaaz	zaaz	zaaz
10	zbbz	zbbz	zbbz	zbbz
replace into t1 values(1,'aaaa','aaaa','aaaa','aaaa'),(2,'xxxc','xxxb','xxxb','xxxb'),(3,'xxxb','xxxc','xxxc','xxxc'),(4,'xxxa','xxxa','xxxa','xxxa'),(5,'zzzz','zzzz','zzzz','zzzz'),(6,NULL,NULL,'xxxa','xxxa'),(7,'zxxx','zxxx','zxxx','zxxx'),(8,'axxx','axxx','axxx','axxx'),(9,'zaaz','zaaz','zaaz','zaaz'),(10,'zbbz','zbbz','zbbz','zbbz');
DELETE FROM t1 WHERE b like 'xxx%' ESCAPE 'a' or b like 'xxx%' and b not like 'yyy%' LIMIT 2;
SELECT * FROM t1;
a	b	c	d	e
1	aaaa	aaaa	aaaa	aaaa
4	xxxa	xxxa	xxxa	xxxa
5	zzzz	zzzz	zzzz	zzzz
6	NULL	NULL	xxxa	xxxa
7	zxxx	zxxx	zxxx	zxxx
8	axxx	axxx	axxx	axxx
9	zaaz	zaaz	zaaz	zaaz
10	zbbz	zbbz	zbbz	zbbz
replace into t1 values(1,'aaaa','aaaa','aaaa','aaaa'),(2,'xxxc','xxxb','xxxb','xxxb'),(3,'xxxb','xxxc','xxxc','xxxc'),(4,'xxxa','xxxa','xxxa','xxxa'),(5,'zzzz','zzzz','zzzz','zzzz'),(6,NULL,NULL,'xxxa','xxxa'),(7,'zxxx','zxxx','zxxx','zxxx'),(8,'axxx','axxx','axxx','axxx'),(9,'zaaz','zaaz','zaaz','zaaz'),(10,'zbbz','zbbz','zbbz','zbbz');
DELETE FROM t1 WHERE b != 'xxxx' and b like 'xxx%' LIMIT 2;
SELECT * FROM t1;
a	b	c	d	e
1	aaaa	aaaa	aaaa	aaaa
4	xxxa	xxxa	xxxa	xxxa
5	zzzz	zzzz	zzzz	zzzz
6	NULL	NULL	xxxa	xxxa
7	zxxx	zxxx	zxxx	zxxx
8	axxx	axxx	axxx	axxx
9	zaaz	zaaz	zaaz	zaaz
10	zbbz	zbbz	zbbz	zbbz
replace into t1 values(1,'aaaa','aaaa','aaaa','aaaa'),(2,'xxxc','xxxb','xxxb','xxxb'),(3,'xxxb','xxxc','xxxc','xxxc'),(4,'xxxa','xxxa','xxxa','xxxa'),(5,'zzzz','zzzz','zzzz','zzzz'),(6,NULL,NULL,'xxxa','xxxa'),(7,'zxxx','zxxx','zxxx','zxxx'),(8,'axxx','axxx','axxx','axxx'),(9,'zaaz','zaaz','zaaz','zaaz'),(10,'zbbz','zbbz','zbbz','zbbz');
DELETE FROM t1 WHERE b = 'xxxx' or b like 'xxx%' LIMIT 2;
SELECT * FROM t1;
a	b	c	d	e
1	aaaa	aaaa	aaaa	aaaa
4	xxxa	xxxa	xxxa	xxxa
5	zzzz	zzzz	zzzz	zzzz
6	NULL	NULL	xxxa	xxxa
7	zxxx	zxxx	zxxx	zxxx
8	axxx	axxx	axxx	axxx
9	zaaz	zaaz	zaaz	zaaz
10	zbbz	zbbz	zbbz	zbbz
-- c1上建索引i1，c2上建索引i2 c1 like '' and c2 = ''
replace into t1 values(1,'aaaa','aaaa','aaaa','aaaa'),(2,'xxxc','xxxb','xxxb','xxxb'),(3,'xxxb','xxxc','xxxc','xxxc'),(4,'xxxa','xxxa','xxxa','xxxa'),(5,'zzzz','zzzz','zzzz','zzzz'),(6,NULL,NULL,'xxxa','xxxa'),(7,'zxxx','zxxx','zxxx','zxxx'),(8,'axxx','axxx','axxx','axxx'),(9,'zaaz','zaaz','zaaz','zaaz'),(10,'zbbz','zbbz','zbbz','zbbz');
DELETE FROM t1 WHERE b like 'xxx%' LIMIT 2;
SELECT * FROM t1;
a	b	c	d	e
1	aaaa	aaaa	aaaa	aaaa
2	xxxc	xxxb	xxxb	xxxb
5	zzzz	zzzz	zzzz	zzzz
6	NULL	NULL	xxxa	xxxa
7	zxxx	zxxx	zxxx	zxxx
8	axxx	axxx	axxx	axxx
9	zaaz	zaaz	zaaz	zaaz
10	zbbz	zbbz	zbbz	zbbz
replace into t1 values(1,'aaaa','aaaa','aaaa','aaaa'),(2,'xxxc','xxxb','xxxb','xxxb'),(3,'xxxb','xxxc','xxxc','xxxc'),(4,'xxxa','xxxa','xxxa','xxxa'),(5,'zzzz','zzzz','zzzz','zzzz'),(6,NULL,NULL,'xxxa','xxxa'),(7,'zxxx','zxxx','zxxx','zxxx'),(8,'axxx','axxx','axxx','axxx'),(9,'zaaz','zaaz','zaaz','zaaz'),(10,'zbbz','zbbz','zbbz','zbbz');
EXPLAIN DELETE FROM t1 WHERE c = 'zzzz' LIMIT 2;
SELECT * FROM t1;
a	b	c	d	e
1	aaaa	aaaa	aaaa	aaaa
2	xxxc	xxxb	xxxb	xxxb
3	xxxb	xxxc	xxxc	xxxc
4	xxxa	xxxa	xxxa	xxxa
5	zzzz	zzzz	zzzz	zzzz
6	NULL	NULL	xxxa	xxxa
7	zxxx	zxxx	zxxx	zxxx
8	axxx	axxx	axxx	axxx
9	zaaz	zaaz	zaaz	zaaz
10	zbbz	zbbz	zbbz	zbbz
replace into t1 values(1,'aaaa','aaaa','aaaa','aaaa'),(2,'xxxc','xxxb','xxxb','xxxb'),(3,'xxxb','xxxc','xxxc','xxxc'),(4,'xxxa','xxxa','xxxa','xxxa'),(5,'zzzz','zzzz','zzzz','zzzz'),(6,NULL,NULL,'xxxa','xxxa'),(7,'zxxx','zxxx','zxxx','zxxx'),(8,'axxx','axxx','axxx','axxx'),(9,'zaaz','zaaz','zaaz','zaaz'),(10,'zbbz','zbbz','zbbz','zbbz');
DELETE FROM t1 WHERE b like 'xxx%' and c like 'xxx%' LIMIT 2;
SELECT * FROM t1;
a	b	c	d	e
1	aaaa	aaaa	aaaa	aaaa
4	xxxa	xxxa	xxxa	xxxa
5	zzzz	zzzz	zzzz	zzzz
6	NULL	NULL	xxxa	xxxa
7	zxxx	zxxx	zxxx	zxxx
8	axxx	axxx	axxx	axxx
9	zaaz	zaaz	zaaz	zaaz
10	zbbz	zbbz	zbbz	zbbz
replace into t1 values(1,'aaaa','aaaa','aaaa','aaaa'),(2,'xxxc','xxxb','xxxb','xxxb'),(3,'xxxb','xxxc','xxxc','xxxc'),(4,'xxxa','xxxa','xxxa','xxxa'),(5,'zzzz','zzzz','zzzz','zzzz'),(6,NULL,NULL,'xxxa','xxxa'),(7,'zxxx','zxxx','zxxx','zxxx'),(8,'axxx','axxx','axxx','axxx'),(9,'zaaz','zaaz','zaaz','zaaz'),(10,'zbbz','zbbz','zbbz','zbbz');
DELETE FROM t1 WHERE b like 'xxx%' or c like 'xxx%' LIMIT 2;
SELECT * FROM t1;
a	b	c	d	e
1	aaaa	aaaa	aaaa	aaaa
4	xxxa	xxxa	xxxa	xxxa
5	zzzz	zzzz	zzzz	zzzz
6	NULL	NULL	xxxa	xxxa
7	zxxx	zxxx	zxxx	zxxx
8	axxx	axxx	axxx	axxx
9	zaaz	zaaz	zaaz	zaaz
10	zbbz	zbbz	zbbz	zbbz
replace into t1 values(1,'aaaa','aaaa','aaaa','aaaa'),(2,'xxxc','xxxb','xxxb','xxxb'),(3,'xxxb','xxxc','xxxc','xxxc'),(4,'xxxa','xxxa','xxxa','xxxa'),(5,'zzzz','zzzz','zzzz','zzzz'),(6,NULL,NULL,'xxxa','xxxa'),(7,'zxxx','zxxx','zxxx','zxxx'),(8,'axxx','axxx','axxx','axxx'),(9,'zaaz','zaaz','zaaz','zaaz'),(10,'zbbz','zbbz','zbbz','zbbz');
DELETE FROM t1 WHERE b = 'xxxc' and c like 'xxx%' LIMIT 2;
SELECT * FROM t1;
a	b	c	d	e
1	aaaa	aaaa	aaaa	aaaa
3	xxxb	xxxc	xxxc	xxxc
4	xxxa	xxxa	xxxa	xxxa
5	zzzz	zzzz	zzzz	zzzz
6	NULL	NULL	xxxa	xxxa
7	zxxx	zxxx	zxxx	zxxx
8	axxx	axxx	axxx	axxx
9	zaaz	zaaz	zaaz	zaaz
10	zbbz	zbbz	zbbz	zbbz
replace into t1 values(1,'aaaa','aaaa','aaaa','aaaa'),(2,'xxxc','xxxb','xxxb','xxxb'),(3,'xxxb','xxxc','xxxc','xxxc'),(4,'xxxa','xxxa','xxxa','xxxa'),(5,'zzzz','zzzz','zzzz','zzzz'),(6,NULL,NULL,'xxxa','xxxa'),(7,'zxxx','zxxx','zxxx','zxxx'),(8,'axxx','axxx','axxx','axxx'),(9,'zaaz','zaaz','zaaz','zaaz'),(10,'zbbz','zbbz','zbbz','zbbz');
DELETE FROM t1 WHERE b = 'xxxc' or c like 'xxx%' LIMIT 2;
SELECT * FROM t1;
a	b	c	d	e
1	aaaa	aaaa	aaaa	aaaa
4	xxxa	xxxa	xxxa	xxxa
5	zzzz	zzzz	zzzz	zzzz
6	NULL	NULL	xxxa	xxxa
7	zxxx	zxxx	zxxx	zxxx
8	axxx	axxx	axxx	axxx
9	zaaz	zaaz	zaaz	zaaz
10	zbbz	zbbz	zbbz	zbbz
replace into t1 values(1,'aaaa','aaaa','aaaa','aaaa'),(2,'xxxc','xxxb','xxxb','xxxb'),(3,'xxxb','xxxc','xxxc','xxxc'),(4,'xxxa','xxxa','xxxa','xxxa'),(5,'zzzz','zzzz','zzzz','zzzz'),(6,NULL,NULL,'xxxa','xxxa'),(7,'zxxx','zxxx','zxxx','zxxx'),(8,'axxx','axxx','axxx','axxx'),(9,'zaaz','zaaz','zaaz','zaaz'),(10,'zbbz','zbbz','zbbz','zbbz');
DELETE FROM t1 WHERE b like 'xxx%' and c = 'zzzz' LIMIT 2;
SELECT * FROM t1;
a	b	c	d	e
1	aaaa	aaaa	aaaa	aaaa
2	xxxc	xxxb	xxxb	xxxb
3	xxxb	xxxc	xxxc	xxxc
4	xxxa	xxxa	xxxa	xxxa
5	zzzz	zzzz	zzzz	zzzz
6	NULL	NULL	xxxa	xxxa
7	zxxx	zxxx	zxxx	zxxx
8	axxx	axxx	axxx	axxx
9	zaaz	zaaz	zaaz	zaaz
10	zbbz	zbbz	zbbz	zbbz
replace into t1 values(1,'aaaa','aaaa','aaaa','aaaa'),(2,'xxxc','xxxb','xxxb','xxxb'),(3,'xxxb','xxxc','xxxc','xxxc'),(4,'xxxa','xxxa','xxxa','xxxa'),(5,'zzzz','zzzz','zzzz','zzzz'),(6,NULL,NULL,'xxxa','xxxa'),(7,'zxxx','zxxx','zxxx','zxxx'),(8,'axxx','axxx','axxx','axxx'),(9,'zaaz','zaaz','zaaz','zaaz'),(10,'zbbz','zbbz','zbbz','zbbz');
DELETE FROM t1 WHERE b like 'xxx%' or c = 'zzzz' LIMIT 2;
SELECT * FROM t1;
a	b	c	d	e
1	aaaa	aaaa	aaaa	aaaa
4	xxxa	xxxa	xxxa	xxxa
5	zzzz	zzzz	zzzz	zzzz
6	NULL	NULL	xxxa	xxxa
7	zxxx	zxxx	zxxx	zxxx
8	axxx	axxx	axxx	axxx
9	zaaz	zaaz	zaaz	zaaz
10	zbbz	zbbz	zbbz	zbbz
-- col like 'xxx%'中，col用别名，以及表使用别名
replace into t1 values(1,'aaaa','aaaa','aaaa','aaaa'),(2,'xxxc','xxxb','xxxb','xxxb'),(3,'xxxb','xxxc','xxxc','xxxc'),(4,'xxxa','xxxa','xxxa','xxxa'),(5,'zzzz','zzzz','zzzz','zzzz'),(6,NULL,NULL,'xxxa','xxxa'),(7,'zxxx','zxxx','zxxx','zxxx'),(8,'axxx','axxx','axxx','axxx'),(9,'zaaz','zaaz','zaaz','zaaz'),(10,'zbbz','zbbz','zbbz','zbbz');
SELECT a,b as b2,c,d,e FROM t1 HAVING b2 like 'xxx%' LIMIT 2;
a	b2	c	d	e
2	xxxc	xxxb	xxxb	xxxb
3	xxxb	xxxc	xxxc	xxxc
SELECT * FROM t1;
a	b	c	d	e
1	aaaa	aaaa	aaaa	aaaa
2	xxxc	xxxb	xxxb	xxxb
3	xxxb	xxxc	xxxc	xxxc
4	xxxa	xxxa	xxxa	xxxa
5	zzzz	zzzz	zzzz	zzzz
6	NULL	NULL	xxxa	xxxa
7	zxxx	zxxx	zxxx	zxxx
8	axxx	axxx	axxx	axxx
9	zaaz	zaaz	zaaz	zaaz
10	zbbz	zbbz	zbbz	zbbz
replace into t1 values(1,'aaaa','aaaa','aaaa','aaaa'),(2,'xxxc','xxxb','xxxb','xxxb'),(3,'xxxb','xxxc','xxxc','xxxc'),(4,'xxxa','xxxa','xxxa','xxxa'),(5,'zzzz','zzzz','zzzz','zzzz'),(6,NULL,NULL,'xxxa','xxxa'),(7,'zxxx','zxxx','zxxx','zxxx'),(8,'axxx','axxx','axxx','axxx'),(9,'zaaz','zaaz','zaaz','zaaz'),(10,'zbbz','zbbz','zbbz','zbbz');
SELECT a,b as b2,c,d,e FROM t1 HAVING b2 like 'xxx%' ESCAPE 'x' LIMIT 2;
a	b2	c	d	e
SELECT * FROM t1;
a	b	c	d	e
1	aaaa	aaaa	aaaa	aaaa
2	xxxc	xxxb	xxxb	xxxb
3	xxxb	xxxc	xxxc	xxxc
4	xxxa	xxxa	xxxa	xxxa
5	zzzz	zzzz	zzzz	zzzz
6	NULL	NULL	xxxa	xxxa
7	zxxx	zxxx	zxxx	zxxx
8	axxx	axxx	axxx	axxx
9	zaaz	zaaz	zaaz	zaaz
10	zbbz	zbbz	zbbz	zbbz
replace into t1 values(1,'aaaa','aaaa','aaaa','aaaa'),(2,'xxxc','xxxb','xxxb','xxxb'),(3,'xxxb','xxxc','xxxc','xxxc'),(4,'xxxa','xxxa','xxxa','xxxa'),(5,'zzzz','zzzz','zzzz','zzzz'),(6,NULL,NULL,'xxxa','xxxa'),(7,'zxxx','zxxx','zxxx','zxxx'),(8,'axxx','axxx','axxx','axxx'),(9,'zaaz','zaaz','zaaz','zaaz'),(10,'zbbz','zbbz','zbbz','zbbz');
SELECT a,b as b2,c,d,e FROM t1 HAVING b2 like 'xxx%' ESCAPE 'a' LIMIT 2;
a	b2	c	d	e
2	xxxc	xxxb	xxxb	xxxb
3	xxxb	xxxc	xxxc	xxxc
SELECT * FROM t1;
a	b	c	d	e
1	aaaa	aaaa	aaaa	aaaa
2	xxxc	xxxb	xxxb	xxxb
3	xxxb	xxxc	xxxc	xxxc
4	xxxa	xxxa	xxxa	xxxa
5	zzzz	zzzz	zzzz	zzzz
6	NULL	NULL	xxxa	xxxa
7	zxxx	zxxx	zxxx	zxxx
8	axxx	axxx	axxx	axxx
9	zaaz	zaaz	zaaz	zaaz
10	zbbz	zbbz	zbbz	zbbz
replace into t1 values(1,'aaaa','aaaa','aaaa','aaaa'),(2,'xxxc','xxxb','xxxb','xxxb'),(3,'xxxb','xxxc','xxxc','xxxc'),(4,'xxxa','xxxa','xxxa','xxxa'),(5,'zzzz','zzzz','zzzz','zzzz'),(6,NULL,NULL,'xxxa','xxxa'),(7,'zxxx','zxxx','zxxx','zxxx'),(8,'axxx','axxx','axxx','axxx'),(9,'zaaz','zaaz','zaaz','zaaz'),(10,'zbbz','zbbz','zbbz','zbbz');
SELECT a,b as b2,c,d,e FROM t1 HAVING b2 NOT like 'xxx%' LIMIT 2;
a	b2	c	d	e
1	aaaa	aaaa	aaaa	aaaa
5	zzzz	zzzz	zzzz	zzzz
SELECT * FROM t1;
a	b	c	d	e
1	aaaa	aaaa	aaaa	aaaa
2	xxxc	xxxb	xxxb	xxxb
3	xxxb	xxxc	xxxc	xxxc
4	xxxa	xxxa	xxxa	xxxa
5	zzzz	zzzz	zzzz	zzzz
6	NULL	NULL	xxxa	xxxa
7	zxxx	zxxx	zxxx	zxxx
8	axxx	axxx	axxx	axxx
9	zaaz	zaaz	zaaz	zaaz
10	zbbz	zbbz	zbbz	zbbz
replace into t1 values(1,'aaaa','aaaa','aaaa','aaaa'),(2,'xxxc','xxxb','xxxb','xxxb'),(3,'xxxb','xxxc','xxxc','xxxc'),(4,'xxxa','xxxa','xxxa','xxxa'),(5,'zzzz','zzzz','zzzz','zzzz'),(6,NULL,NULL,'xxxa','xxxa'),(7,'zxxx','zxxx','zxxx','zxxx'),(8,'axxx','axxx','axxx','axxx'),(9,'zaaz','zaaz','zaaz','zaaz'),(10,'zbbz','zbbz','zbbz','zbbz');
SELECT a,b as b2,c,d,e FROM t1 HAVING b2 NOT like 'xxx%' ESCAPE 'x' LIMIT 2;
a	b2	c	d	e
1	aaaa	aaaa	aaaa	aaaa
2	xxxc	xxxb	xxxb	xxxb
SELECT * FROM t1;
a	b	c	d	e
1	aaaa	aaaa	aaaa	aaaa
2	xxxc	xxxb	xxxb	xxxb
3	xxxb	xxxc	xxxc	xxxc
4	xxxa	xxxa	xxxa	xxxa
5	zzzz	zzzz	zzzz	zzzz
6	NULL	NULL	xxxa	xxxa
7	zxxx	zxxx	zxxx	zxxx
8	axxx	axxx	axxx	axxx
9	zaaz	zaaz	zaaz	zaaz
10	zbbz	zbbz	zbbz	zbbz
replace into t1 values(1,'aaaa','aaaa','aaaa','aaaa'),(2,'xxxc','xxxb','xxxb','xxxb'),(3,'xxxb','xxxc','xxxc','xxxc'),(4,'xxxa','xxxa','xxxa','xxxa'),(5,'zzzz','zzzz','zzzz','zzzz'),(6,NULL,NULL,'xxxa','xxxa'),(7,'zxxx','zxxx','zxxx','zxxx'),(8,'axxx','axxx','axxx','axxx'),(9,'zaaz','zaaz','zaaz','zaaz'),(10,'zbbz','zbbz','zbbz','zbbz');
SELECT a,b as b2,c,d,e FROM t1 HAVING b2 NOT like 'xxx%' ESCAPE 'a' LIMIT 2;
a	b2	c	d	e
1	aaaa	aaaa	aaaa	aaaa
5	zzzz	zzzz	zzzz	zzzz
SELECT * FROM t1;
a	b	c	d	e
1	aaaa	aaaa	aaaa	aaaa
2	xxxc	xxxb	xxxb	xxxb
3	xxxb	xxxc	xxxc	xxxc
4	xxxa	xxxa	xxxa	xxxa
5	zzzz	zzzz	zzzz	zzzz
6	NULL	NULL	xxxa	xxxa
7	zxxx	zxxx	zxxx	zxxx
8	axxx	axxx	axxx	axxx
9	zaaz	zaaz	zaaz	zaaz
10	zbbz	zbbz	zbbz	zbbz
-- like匹配的字符串中含有特殊字符
replace into t1 values(1,'aaaa','aaaa','aaaa','aaaa'),(2,'xxxc','xxxb','xxxb','xxxb'),(3,'xxxb','xxxc','xxxc','xxxc'),(4,'xxxa','xxxa','xxxa','xxxa'),(5,'zzzz','zzzz','zzzz','zzzz'),(6,NULL,NULL,'xxxa','xxxa'),(7,'zxxx','zxxx','zxxx','zxxx'),(8,'axxx','axxx','axxx','axxx'),(9,'zaaz','zaaz','zaaz','zaaz'),(10,'zbbz','zbbz','zbbz','zbbz');
DELETE FROM t1 WHERE b like '\0%' LIMIT 2;
SELECT * FROM t1;
a	b	c	d	e
1	aaaa	aaaa	aaaa	aaaa
2	xxxc	xxxb	xxxb	xxxb
3	xxxb	xxxc	xxxc	xxxc
4	xxxa	xxxa	xxxa	xxxa
5	zzzz	zzzz	zzzz	zzzz
6	NULL	NULL	xxxa	xxxa
7	zxxx	zxxx	zxxx	zxxx
8	axxx	axxx	axxx	axxx
9	zaaz	zaaz	zaaz	zaaz
10	zbbz	zbbz	zbbz	zbbz
replace into t1 values(1,'aaaa','aaaa','aaaa','aaaa'),(2,'xxxc','xxxb','xxxb','xxxb'),(3,'xxxb','xxxc','xxxc','xxxc'),(4,'xxxa','xxxa','xxxa','xxxa'),(5,'zzzz','zzzz','zzzz','zzzz'),(6,NULL,NULL,'xxxa','xxxa'),(7,'zxxx','zxxx','zxxx','zxxx'),(8,'axxx','axxx','axxx','axxx'),(9,'zaaz','zaaz','zaaz','zaaz'),(10,'zbbz','zbbz','zbbz','zbbz');
DELETE FROM t1 WHERE b like '\t%' ESCAPE 'x' LIMIT 2;
SELECT * FROM t1;
a	b	c	d	e
1	aaaa	aaaa	aaaa	aaaa
2	xxxc	xxxb	xxxb	xxxb
3	xxxb	xxxc	xxxc	xxxc
4	xxxa	xxxa	xxxa	xxxa
5	zzzz	zzzz	zzzz	zzzz
6	NULL	NULL	xxxa	xxxa
7	zxxx	zxxx	zxxx	zxxx
8	axxx	axxx	axxx	axxx
9	zaaz	zaaz	zaaz	zaaz
10	zbbz	zbbz	zbbz	zbbz
replace into t1 values(1,'aaaa','aaaa','aaaa','aaaa'),(2,'xxxc','xxxb','xxxb','xxxb'),(3,'xxxb','xxxc','xxxc','xxxc'),(4,'xxxa','xxxa','xxxa','xxxa'),(5,'zzzz','zzzz','zzzz','zzzz'),(6,NULL,NULL,'xxxa','xxxa'),(7,'zxxx','zxxx','zxxx','zxxx'),(8,'axxx','axxx','axxx','axxx'),(9,'zaaz','zaaz','zaaz','zaaz'),(10,'zbbz','zbbz','zbbz','zbbz');
DELETE FROM t1 WHERE b like '\n%' ESCAPE 'a' LIMIT 2;
SELECT * FROM t1;
a	b	c	d	e
1	aaaa	aaaa	aaaa	aaaa
2	xxxc	xxxb	xxxb	xxxb
3	xxxb	xxxc	xxxc	xxxc
4	xxxa	xxxa	xxxa	xxxa
5	zzzz	zzzz	zzzz	zzzz
6	NULL	NULL	xxxa	xxxa
7	zxxx	zxxx	zxxx	zxxx
8	axxx	axxx	axxx	axxx
9	zaaz	zaaz	zaaz	zaaz
10	zbbz	zbbz	zbbz	zbbz
replace into t1 values(1,'aaaa','aaaa','aaaa','aaaa'),(2,'xxxc','xxxb','xxxb','xxxb'),(3,'xxxb','xxxc','xxxc','xxxc'),(4,'xxxa','xxxa','xxxa','xxxa'),(5,'zzzz','zzzz','zzzz','zzzz'),(6,NULL,NULL,'xxxa','xxxa'),(7,'zxxx','zxxx','zxxx','zxxx'),(8,'axxx','axxx','axxx','axxx'),(9,'zaaz','zaaz','zaaz','zaaz'),(10,'zbbz','zbbz','zbbz','zbbz');
DELETE FROM t1 WHERE b NOT like '%%' LIMIT 2;
SELECT * FROM t1;
a	b	c	d	e
1	aaaa	aaaa	aaaa	aaaa
2	xxxc	xxxb	xxxb	xxxb
3	xxxb	xxxc	xxxc	xxxc
4	xxxa	xxxa	xxxa	xxxa
5	zzzz	zzzz	zzzz	zzzz
6	NULL	NULL	xxxa	xxxa
7	zxxx	zxxx	zxxx	zxxx
8	axxx	axxx	axxx	axxx
9	zaaz	zaaz	zaaz	zaaz
10	zbbz	zbbz	zbbz	zbbz
replace into t1 values(1,'aaaa','aaaa','aaaa','aaaa'),(2,'xxxc','xxxb','xxxb','xxxb'),(3,'xxxb','xxxc','xxxc','xxxc'),(4,'xxxa','xxxa','xxxa','xxxa'),(5,'zzzz','zzzz','zzzz','zzzz'),(6,NULL,NULL,'xxxa','xxxa'),(7,'zxxx','zxxx','zxxx','zxxx'),(8,'axxx','axxx','axxx','axxx'),(9,'zaaz','zaaz','zaaz','zaaz'),(10,'zbbz','zbbz','zbbz','zbbz');
DELETE FROM t1 WHERE b NOT like '_%' ESCAPE 'x' LIMIT 2;
SELECT * FROM t1;
a	b	c	d	e
1	aaaa	aaaa	aaaa	aaaa
2	xxxc	xxxb	xxxb	xxxb
3	xxxb	xxxc	xxxc	xxxc
4	xxxa	xxxa	xxxa	xxxa
5	zzzz	zzzz	zzzz	zzzz
6	NULL	NULL	xxxa	xxxa
7	zxxx	zxxx	zxxx	zxxx
8	axxx	axxx	axxx	axxx
9	zaaz	zaaz	zaaz	zaaz
10	zbbz	zbbz	zbbz	zbbz
replace into t1 values(1,'aaaa','aaaa','aaaa','aaaa'),(2,'xxxc','xxxb','xxxb','xxxb'),(3,'xxxb','xxxc','xxxc','xxxc'),(4,'xxxa','xxxa','xxxa','xxxa'),(5,'zzzz','zzzz','zzzz','zzzz'),(6,NULL,NULL,'xxxa','xxxa'),(7,'zxxx','zxxx','zxxx','zxxx'),(8,'axxx','axxx','axxx','axxx'),(9,'zaaz','zaaz','zaaz','zaaz'),(10,'zbbz','zbbz','zbbz','zbbz');
DELETE FROM t1 WHERE b NOT like '!%' ESCAPE 'a' LIMIT 2;
SELECT * FROM t1;
a	b	c	d	e
3	xxxb	xxxc	xxxc	xxxc
4	xxxa	xxxa	xxxa	xxxa
5	zzzz	zzzz	zzzz	zzzz
6	NULL	NULL	xxxa	xxxa
7	zxxx	zxxx	zxxx	zxxx
8	axxx	axxx	axxx	axxx
9	zaaz	zaaz	zaaz	zaaz
10	zbbz	zbbz	zbbz	zbbz
-- 匹配字符串偏长的情况
replace into t1 values(1,'aaaa','aaaa','aaaa','aaaa'),(2,'xxxc','xxxb','xxxb','xxxb'),(3,'xxxb','xxxc','xxxc','xxxc'),(4,'xxxa','xxxa','xxxa','xxxa'),(5,'zzzz','zzzz','zzzz','zzzz'),(6,NULL,NULL,'xxxa','xxxa'),(7,'zxxx','zxxx','zxxx','zxxx'),(8,'axxx','axxx','axxx','axxx'),(9,'zaaz','zaaz','zaaz','zaaz'),(10,'zbbz','zbbz','zbbz','zbbz');
DELETE FROM t1 WHERE b like 'xxx%%%%%%%%%%%%%%%%%%%%%%%%%%%%%%%%%%%%' LIMIT 2;
SELECT * FROM t1;
a	b	c	d	e
1	aaaa	aaaa	aaaa	aaaa
2	xxxc	xxxb	xxxb	xxxb
5	zzzz	zzzz	zzzz	zzzz
6	NULL	NULL	xxxa	xxxa
7	zxxx	zxxx	zxxx	zxxx
8	axxx	axxx	axxx	axxx
9	zaaz	zaaz	zaaz	zaaz
10	zbbz	zbbz	zbbz	zbbz
replace into t1 values(1,'aaaa','aaaa','aaaa','aaaa'),(2,'xxxc','xxxb','xxxb','xxxb'),(3,'xxxb','xxxc','xxxc','xxxc'),(4,'xxxa','xxxa','xxxa','xxxa'),(5,'zzzz','zzzz','zzzz','zzzz'),(6,NULL,NULL,'xxxa','xxxa'),(7,'zxxx','zxxx','zxxx','zxxx'),(8,'axxx','axxx','axxx','axxx'),(9,'zaaz','zaaz','zaaz','zaaz'),(10,'zbbz','zbbz','zbbz','zbbz');
DELETE FROM t1 WHERE b like 'xxx_%%%%%%%%%%%%%%%%%%%%%%%%%%%%%%%%%%%' ESCAPE 'x' LIMIT 2;
SELECT * FROM t1;
a	b	c	d	e
1	aaaa	aaaa	aaaa	aaaa
2	xxxc	xxxb	xxxb	xxxb
3	xxxb	xxxc	xxxc	xxxc
4	xxxa	xxxa	xxxa	xxxa
5	zzzz	zzzz	zzzz	zzzz
6	NULL	NULL	xxxa	xxxa
7	zxxx	zxxx	zxxx	zxxx
8	axxx	axxx	axxx	axxx
9	zaaz	zaaz	zaaz	zaaz
10	zbbz	zbbz	zbbz	zbbz
replace into t1 values(1,'aaaa','aaaa','aaaa','aaaa'),(2,'xxxc','xxxb','xxxb','xxxb'),(3,'xxxb','xxxc','xxxc','xxxc'),(4,'xxxa','xxxa','xxxa','xxxa'),(5,'zzzz','zzzz','zzzz','zzzz'),(6,NULL,NULL,'xxxa','xxxa'),(7,'zxxx','zxxx','zxxx','zxxx'),(8,'axxx','axxx','axxx','axxx'),(9,'zaaz','zaaz','zaaz','zaaz'),(10,'zbbz','zbbz','zbbz','zbbz');
DELETE FROM t1 WHERE b like '%%%%%%%%%%%%%%%%%%%%%%%%%%%%%%%%%%%xxx%' ESCAPE 'a' LIMIT 2;
SELECT * FROM t1;
a	b	c	d	e
1	aaaa	aaaa	aaaa	aaaa
2	xxxc	xxxb	xxxb	xxxb
3	xxxb	xxxc	xxxc	xxxc
5	zzzz	zzzz	zzzz	zzzz
6	NULL	NULL	xxxa	xxxa
7	zxxx	zxxx	zxxx	zxxx
9	zaaz	zaaz	zaaz	zaaz
10	zbbz	zbbz	zbbz	zbbz
replace into t1 values(1,'aaaa','aaaa','aaaa','aaaa'),(2,'xxxc','xxxb','xxxb','xxxb'),(3,'xxxb','xxxc','xxxc','xxxc'),(4,'xxxa','xxxa','xxxa','xxxa'),(5,'zzzz','zzzz','zzzz','zzzz'),(6,NULL,NULL,'xxxa','xxxa'),(7,'zxxx','zxxx','zxxx','zxxx'),(8,'axxx','axxx','axxx','axxx'),(9,'zaaz','zaaz','zaaz','zaaz'),(10,'zbbz','zbbz','zbbz','zbbz');
DELETE FROM t1 WHERE b NOT like 'xxyyyyyyyyyyyyyyyyyyyyyyyyyyyyyyyyyyy%' LIMIT 2;
SELECT * FROM t1;
a	b	c	d	e
3	xxxb	xxxc	xxxc	xxxc
4	xxxa	xxxa	xxxa	xxxa
5	zzzz	zzzz	zzzz	zzzz
6	NULL	NULL	xxxa	xxxa
7	zxxx	zxxx	zxxx	zxxx
8	axxx	axxx	axxx	axxx
9	zaaz	zaaz	zaaz	zaaz
10	zbbz	zbbz	zbbz	zbbz
replace into t1 values(1,'aaaa','aaaa','aaaa','aaaa'),(2,'xxxc','xxxb','xxxb','xxxb'),(3,'xxxb','xxxc','xxxc','xxxc'),(4,'xxxa','xxxa','xxxa','xxxa'),(5,'zzzz','zzzz','zzzz','zzzz'),(6,NULL,NULL,'xxxa','xxxa'),(7,'zxxx','zxxx','zxxx','zxxx'),(8,'axxx','axxx','axxx','axxx'),(9,'zaaz','zaaz','zaaz','zaaz'),(10,'zbbz','zbbz','zbbz','zbbz');
DELETE FROM t1 WHERE b NOT like 'xxxyyyyyyyyyyyyyyyyyyyyyyyyyyyyyyyyyy%' ESCAPE 'x' LIMIT 2;
SELECT * FROM t1;
a	b	c	d	e
3	xxxb	xxxc	xxxc	xxxc
4	xxxa	xxxa	xxxa	xxxa
5	zzzz	zzzz	zzzz	zzzz
6	NULL	NULL	xxxa	xxxa
7	zxxx	zxxx	zxxx	zxxx
8	axxx	axxx	axxx	axxx
9	zaaz	zaaz	zaaz	zaaz
10	zbbz	zbbz	zbbz	zbbz
replace into t1 values(1,'aaaa','aaaa','aaaa','aaaa'),(2,'xxxc','xxxb','xxxb','xxxb'),(3,'xxxb','xxxc','xxxc','xxxc'),(4,'xxxa','xxxa','xxxa','xxxa'),(5,'zzzz','zzzz','zzzz','zzzz'),(6,NULL,NULL,'xxxa','xxxa'),(7,'zxxx','zxxx','zxxx','zxxx'),(8,'axxx','axxx','axxx','axxx'),(9,'zaaz','zaaz','zaaz','zaaz'),(10,'zbbz','zbbz','zbbz','zbbz');
DELETE FROM t1 WHERE b NOT like 'xxxyyyyyyyyyyyyyyyyyyyyyyyyyyyyyyyyyyyy%' ESCAPE 'a' LIMIT 2;
SELECT * FROM t1;
a	b	c	d	e
3	xxxb	xxxc	xxxc	xxxc
4	xxxa	xxxa	xxxa	xxxa
5	zzzz	zzzz	zzzz	zzzz
6	NULL	NULL	xxxa	xxxa
7	zxxx	zxxx	zxxx	zxxx
8	axxx	axxx	axxx	axxx
9	zaaz	zaaz	zaaz	zaaz
10	zbbz	zbbz	zbbz	zbbz
-- 涉及类型转换
replace into t1 values(1,'aaaa','aaaa','aaaa','aaaa'),(2,'xxxc','xxxb','xxxb','xxxb'),(3,'xxxb','xxxc','xxxc','xxxc'),(4,'xxxa','xxxa','xxxa','xxxa'),(5,'zzzz','zzzz','zzzz','zzzz'),(6,NULL,NULL,'xxxa','xxxa'),(7,'zxxx','zxxx','zxxx','zxxx'),(8,'axxx','axxx','axxx','axxx'),(9,'zaaz','zaaz','zaaz','zaaz'),(10,'zbbz','zbbz','zbbz','zbbz');
DELETE FROM t1 WHERE a like 'xxx%' LIMIT 2;
SELECT * FROM t1;
a	b	c	d	e
1	aaaa	aaaa	aaaa	aaaa
2	xxxc	xxxb	xxxb	xxxb
3	xxxb	xxxc	xxxc	xxxc
4	xxxa	xxxa	xxxa	xxxa
5	zzzz	zzzz	zzzz	zzzz
6	NULL	NULL	xxxa	xxxa
7	zxxx	zxxx	zxxx	zxxx
8	axxx	axxx	axxx	axxx
9	zaaz	zaaz	zaaz	zaaz
10	zbbz	zbbz	zbbz	zbbz
replace into t1 values(1,'aaaa','aaaa','aaaa','aaaa'),(2,'xxxc','xxxb','xxxb','xxxb'),(3,'xxxb','xxxc','xxxc','xxxc'),(4,'xxxa','xxxa','xxxa','xxxa'),(5,'zzzz','zzzz','zzzz','zzzz'),(6,NULL,NULL,'xxxa','xxxa'),(7,'zxxx','zxxx','zxxx','zxxx'),(8,'axxx','axxx','axxx','axxx'),(9,'zaaz','zaaz','zaaz','zaaz'),(10,'zbbz','zbbz','zbbz','zbbz');
DELETE FROM t1 WHERE b like 12345 LIMIT 2;
SELECT * FROM t1;
a	b	c	d	e
1	aaaa	aaaa	aaaa	aaaa
2	xxxc	xxxb	xxxb	xxxb
3	xxxb	xxxc	xxxc	xxxc
4	xxxa	xxxa	xxxa	xxxa
5	zzzz	zzzz	zzzz	zzzz
6	NULL	NULL	xxxa	xxxa
7	zxxx	zxxx	zxxx	zxxx
8	axxx	axxx	axxx	axxx
9	zaaz	zaaz	zaaz	zaaz
10	zbbz	zbbz	zbbz	zbbz
-- having语句中测试like ‘xxx%’走索引
-- 边界值测试
replace into t1 values(1,'aaaa','aaaa','aaaa','aaaa'),(2,'xxxc','xxxb','xxxb','xxxb'),(3,'xxxb','xxxc','xxxc','xxxc'),(4,'xxxa','xxxa','xxxa','xxxa'),(5,'zzzz','zzzz','zzzz','zzzz'),(6,NULL,NULL,'xxxa','xxxa'),(7,'zxxx','zxxx','zxxx','zxxx'),(8,'axxx','axxx','axxx','axxx'),(9,'zaaz','zaaz','zaaz','zaaz'),(10,'zbbz','zbbz','zbbz','zbbz');
DELETE FROM t1 WHERE b like hex('xxx%') LIMIT 2;
SELECT * FROM t1;
a	b	c	d	e
1	aaaa	aaaa	aaaa	aaaa
2	xxxc	xxxb	xxxb	xxxb
3	xxxb	xxxc	xxxc	xxxc
4	xxxa	xxxa	xxxa	xxxa
5	zzzz	zzzz	zzzz	zzzz
6	NULL	NULL	xxxa	xxxa
7	zxxx	zxxx	zxxx	zxxx
8	axxx	axxx	axxx	axxx
9	zaaz	zaaz	zaaz	zaaz
10	zbbz	zbbz	zbbz	zbbz
replace into t1 values(1,'aaaa','aaaa','aaaa','aaaa'),(2,'xxxc','xxxb','xxxb','xxxb'),(3,'xxxb','xxxc','xxxc','xxxc'),(4,'xxxa','xxxa','xxxa','xxxa'),(5,'zzzz','zzzz','zzzz','zzzz'),(6,NULL,NULL,'xxxa','xxxa'),(7,'zxxx','zxxx','zxxx','zxxx'),(8,'axxx','axxx','axxx','axxx'),(9,'zaaz','zaaz','zaaz','zaaz'),(10,'zbbz','zbbz','zbbz','zbbz');
DELETE FROM t1 WHERE b like hex('xxx%') ESCAPE 'x' LIMIT 2;
SELECT * FROM t1;
a	b	c	d	e
1	aaaa	aaaa	aaaa	aaaa
2	xxxc	xxxb	xxxb	xxxb
3	xxxb	xxxc	xxxc	xxxc
4	xxxa	xxxa	xxxa	xxxa
5	zzzz	zzzz	zzzz	zzzz
6	NULL	NULL	xxxa	xxxa
7	zxxx	zxxx	zxxx	zxxx
8	axxx	axxx	axxx	axxx
9	zaaz	zaaz	zaaz	zaaz
10	zbbz	zbbz	zbbz	zbbz
replace into t1 values(1,'aaaa','aaaa','aaaa','aaaa'),(2,'xxxc','xxxb','xxxb','xxxb'),(3,'xxxb','xxxc','xxxc','xxxc'),(4,'xxxa','xxxa','xxxa','xxxa'),(5,'zzzz','zzzz','zzzz','zzzz'),(6,NULL,NULL,'xxxa','xxxa'),(7,'zxxx','zxxx','zxxx','zxxx'),(8,'axxx','axxx','axxx','axxx'),(9,'zaaz','zaaz','zaaz','zaaz'),(10,'zbbz','zbbz','zbbz','zbbz');
DELETE FROM t1 WHERE b like hex('xxx%') ESCAPE 'a' LIMIT 2;
SELECT * FROM t1;
a	b	c	d	e
1	aaaa	aaaa	aaaa	aaaa
2	xxxc	xxxb	xxxb	xxxb
3	xxxb	xxxc	xxxc	xxxc
4	xxxa	xxxa	xxxa	xxxa
5	zzzz	zzzz	zzzz	zzzz
6	NULL	NULL	xxxa	xxxa
7	zxxx	zxxx	zxxx	zxxx
8	axxx	axxx	axxx	axxx
9	zaaz	zaaz	zaaz	zaaz
10	zbbz	zbbz	zbbz	zbbz
replace into t1 values(1,'aaaa','aaaa','aaaa','aaaa'),(2,'xxxc','xxxb','xxxb','xxxb'),(3,'xxxb','xxxc','xxxc','xxxc'),(4,'xxxa','xxxa','xxxa','xxxa'),(5,'zzzz','zzzz','zzzz','zzzz'),(6,NULL,NULL,'xxxa','xxxa'),(7,'zxxx','zxxx','zxxx','zxxx'),(8,'axxx','axxx','axxx','axxx'),(9,'zaaz','zaaz','zaaz','zaaz'),(10,'zbbz','zbbz','zbbz','zbbz');
DELETE FROM t1 WHERE b NOT like hex('xxx%') LIMIT 2;
SELECT * FROM t1;
a	b	c	d	e
3	xxxb	xxxc	xxxc	xxxc
4	xxxa	xxxa	xxxa	xxxa
5	zzzz	zzzz	zzzz	zzzz
6	NULL	NULL	xxxa	xxxa
7	zxxx	zxxx	zxxx	zxxx
8	axxx	axxx	axxx	axxx
9	zaaz	zaaz	zaaz	zaaz
10	zbbz	zbbz	zbbz	zbbz
replace into t1 values(1,'aaaa','aaaa','aaaa','aaaa'),(2,'xxxc','xxxb','xxxb','xxxb'),(3,'xxxb','xxxc','xxxc','xxxc'),(4,'xxxa','xxxa','xxxa','xxxa'),(5,'zzzz','zzzz','zzzz','zzzz'),(6,NULL,NULL,'xxxa','xxxa'),(7,'zxxx','zxxx','zxxx','zxxx'),(8,'axxx','axxx','axxx','axxx'),(9,'zaaz','zaaz','zaaz','zaaz'),(10,'zbbz','zbbz','zbbz','zbbz');
DELETE FROM t1 WHERE b NOT like hex('xxx%') ESCAPE 'x' LIMIT 2;
SELECT * FROM t1;
a	b	c	d	e
3	xxxb	xxxc	xxxc	xxxc
4	xxxa	xxxa	xxxa	xxxa
5	zzzz	zzzz	zzzz	zzzz
6	NULL	NULL	xxxa	xxxa
7	zxxx	zxxx	zxxx	zxxx
8	axxx	axxx	axxx	axxx
9	zaaz	zaaz	zaaz	zaaz
10	zbbz	zbbz	zbbz	zbbz
replace into t1 values(1,'aaaa','aaaa','aaaa','aaaa'),(2,'xxxc','xxxb','xxxb','xxxb'),(3,'xxxb','xxxc','xxxc','xxxc'),(4,'xxxa','xxxa','xxxa','xxxa'),(5,'zzzz','zzzz','zzzz','zzzz'),(6,NULL,NULL,'xxxa','xxxa'),(7,'zxxx','zxxx','zxxx','zxxx'),(8,'axxx','axxx','axxx','axxx'),(9,'zaaz','zaaz','zaaz','zaaz'),(10,'zbbz','zbbz','zbbz','zbbz');
DELETE FROM t1 WHERE b NOT like hex('xxx%') ESCAPE 'a' LIMIT 2;
SELECT * FROM t1;
a	b	c	d	e
3	xxxb	xxxc	xxxc	xxxc
4	xxxa	xxxa	xxxa	xxxa
5	zzzz	zzzz	zzzz	zzzz
6	NULL	NULL	xxxa	xxxa
7	zxxx	zxxx	zxxx	zxxx
8	axxx	axxx	axxx	axxx
9	zaaz	zaaz	zaaz	zaaz
10	zbbz	zbbz	zbbz	zbbz
replace into t1 values(1,'aaaa','aaaa','aaaa','aaaa'),(2,'xxxc','xxxb','xxxb','xxxb'),(3,'xxxb','xxxc','xxxc','xxxc'),(4,'xxxa','xxxa','xxxa','xxxa'),(5,'zzzz','zzzz','zzzz','zzzz'),(6,NULL,NULL,'xxxa','xxxa'),(7,'zxxx','zxxx','zxxx','zxxx'),(8,'axxx','axxx','axxx','axxx'),(9,'zaaz','zaaz','zaaz','zaaz'),(10,'zbbz','zbbz','zbbz','zbbz');
DELETE FROM t1 WHERE b like X'78787825' ESCAPE X'0f' LIMIT 2;
replace into t1 values(1,'aaaa','aaaa','aaaa','aaaa'),(2,'xxxc','xxxb','xxxb','xxxb'),(3,'xxxb','xxxc','xxxc','xxxc'),(4,'xxxa','xxxa','xxxa','xxxa'),(5,'zzzz','zzzz','zzzz','zzzz'),(6,NULL,NULL,'xxxa','xxxa'),(7,'zxxx','zxxx','zxxx','zxxx'),(8,'axxx','axxx','axxx','axxx'),(9,'zaaz','zaaz','zaaz','zaaz'),(10,'zbbz','zbbz','zbbz','zbbz');
DELETE FROM t1 WHERE b like X'78787825' ESCAPE X'00' LIMIT 2;
replace into t1 values(1,'aaaa','aaaa','aaaa','aaaa'),(2,'xxxc','xxxb','xxxb','xxxb'),(3,'xxxb','xxxc','xxxc','xxxc'),(4,'xxxa','xxxa','xxxa','xxxa'),(5,'zzzz','zzzz','zzzz','zzzz'),(6,NULL,NULL,'xxxa','xxxa'),(7,'zxxx','zxxx','zxxx','zxxx'),(8,'axxx','axxx','axxx','axxx'),(9,'zaaz','zaaz','zaaz','zaaz'),(10,'zbbz','zbbz','zbbz','zbbz');
DELETE FROM t1 WHERE b like X'78787825' ESCAPE X'ff' LIMIT 2;
replace into t1 values(1,'aaaa','aaaa','aaaa','aaaa'),(2,'xxxc','xxxb','xxxb','xxxb'),(3,'xxxb','xxxc','xxxc','xxxc'),(4,'xxxa','xxxa','xxxa','xxxa'),(5,'zzzz','zzzz','zzzz','zzzz'),(6,NULL,NULL,'xxxa','xxxa'),(7,'zxxx','zxxx','zxxx','zxxx'),(8,'axxx','axxx','axxx','axxx'),(9,'zaaz','zaaz','zaaz','zaaz'),(10,'zbbz','zbbz','zbbz','zbbz');
DELETE FROM t1 WHERE b like X'78787825' ESCAPE X'78' LIMIT 2;
replace into t1 values(1,'aaaa','aaaa','aaaa','aaaa'),(2,'xxxc','xxxb','xxxb','xxxb'),(3,'xxxb','xxxc','xxxc','xxxc'),(4,'xxxa','xxxa','xxxa','xxxa'),(5,'zzzz','zzzz','zzzz','zzzz'),(6,NULL,NULL,'xxxa','xxxa'),(7,'zxxx','zxxx','zxxx','zxxx'),(8,'axxx','axxx','axxx','axxx'),(9,'zaaz','zaaz','zaaz','zaaz'),(10,'zbbz','zbbz','zbbz','zbbz');
DELETE FROM t1 WHERE b like X'78787825' ESCAPE X'25' LIMIT 2;
replace into t1 values(1,'aaaa','aaaa','aaaa','aaaa'),(2,'xxxc','xxxb','xxxb','xxxb'),(3,'xxxb','xxxc','xxxc','xxxc'),(4,'xxxa','xxxa','xxxa','xxxa'),(5,'zzzz','zzzz','zzzz','zzzz'),(6,NULL,NULL,'xxxa','xxxa'),(7,'zxxx','zxxx','zxxx','zxxx'),(8,'axxx','axxx','axxx','axxx'),(9,'zaaz','zaaz','zaaz','zaaz'),(10,'zbbz','zbbz','zbbz','zbbz');
DELETE FROM t1 WHERE b like X'0000' ESCAPE '0' LIMIT 2;
SELECT * FROM t1;
a	b	c	d	e
1	aaaa	aaaa	aaaa	aaaa
2	xxxc	xxxb	xxxb	xxxb
3	xxxb	xxxc	xxxc	xxxc
4	xxxa	xxxa	xxxa	xxxa
5	zzzz	zzzz	zzzz	zzzz
6	NULL	NULL	xxxa	xxxa
7	zxxx	zxxx	zxxx	zxxx
8	axxx	axxx	axxx	axxx
9	zaaz	zaaz	zaaz	zaaz
10	zbbz	zbbz	zbbz	zbbz
replace into t1 values(1,'aaaa','aaaa','aaaa','aaaa'),(2,'xxxc','xxxb','xxxb','xxxb'),(3,'xxxb','xxxc','xxxc','xxxc'),(4,'xxxa','xxxa','xxxa','xxxa'),(5,'zzzz','zzzz','zzzz','zzzz'),(6,NULL,NULL,'xxxa','xxxa'),(7,'zxxx','zxxx','zxxx','zxxx'),(8,'axxx','axxx','axxx','axxx'),(9,'zaaz','zaaz','zaaz','zaaz'),(10,'zbbz','zbbz','zbbz','zbbz');
DELETE FROM t1 WHERE b like X'00000000' ESCAPE '0' LIMIT 2;
SELECT * FROM t1;
a	b	c	d	e
1	aaaa	aaaa	aaaa	aaaa
2	xxxc	xxxb	xxxb	xxxb
3	xxxb	xxxc	xxxc	xxxc
4	xxxa	xxxa	xxxa	xxxa
5	zzzz	zzzz	zzzz	zzzz
6	NULL	NULL	xxxa	xxxa
7	zxxx	zxxx	zxxx	zxxx
8	axxx	axxx	axxx	axxx
9	zaaz	zaaz	zaaz	zaaz
10	zbbz	zbbz	zbbz	zbbz
replace into t1 values(1,'aaaa','aaaa','aaaa','aaaa'),(2,'xxxc','xxxb','xxxb','xxxb'),(3,'xxxb','xxxc','xxxc','xxxc'),(4,'xxxa','xxxa','xxxa','xxxa'),(5,'zzzz','zzzz','zzzz','zzzz'),(6,NULL,NULL,'xxxa','xxxa'),(7,'zxxx','zxxx','zxxx','zxxx'),(8,'axxx','axxx','axxx','axxx'),(9,'zaaz','zaaz','zaaz','zaaz'),(10,'zbbz','zbbz','zbbz','zbbz');
DELETE FROM t1 WHERE b like X'ffff' ESCAPE 'f' LIMIT 2;
SELECT * FROM t1;
a	b	c	d	e
1	aaaa	aaaa	aaaa	aaaa
2	xxxc	xxxb	xxxb	xxxb
3	xxxb	xxxc	xxxc	xxxc
4	xxxa	xxxa	xxxa	xxxa
5	zzzz	zzzz	zzzz	zzzz
6	NULL	NULL	xxxa	xxxa
7	zxxx	zxxx	zxxx	zxxx
8	axxx	axxx	axxx	axxx
9	zaaz	zaaz	zaaz	zaaz
10	zbbz	zbbz	zbbz	zbbz
replace into t1 values(1,'aaaa','aaaa','aaaa','aaaa'),(2,'xxxc','xxxb','xxxb','xxxb'),(3,'xxxb','xxxc','xxxc','xxxc'),(4,'xxxa','xxxa','xxxa','xxxa'),(5,'zzzz','zzzz','zzzz','zzzz'),(6,NULL,NULL,'xxxa','xxxa'),(7,'zxxx','zxxx','zxxx','zxxx'),(8,'axxx','axxx','axxx','axxx'),(9,'zaaz','zaaz','zaaz','zaaz'),(10,'zbbz','zbbz','zbbz','zbbz');
DELETE FROM t1 WHERE b like X'ffffffff' ESCAPE 'f' LIMIT 2;
SELECT * FROM t1;
a	b	c	d	e
1	aaaa	aaaa	aaaa	aaaa
2	xxxc	xxxb	xxxb	xxxb
3	xxxb	xxxc	xxxc	xxxc
4	xxxa	xxxa	xxxa	xxxa
5	zzzz	zzzz	zzzz	zzzz
6	NULL	NULL	xxxa	xxxa
7	zxxx	zxxx	zxxx	zxxx
8	axxx	axxx	axxx	axxx
9	zaaz	zaaz	zaaz	zaaz
10	zbbz	zbbz	zbbz	zbbz
replace into t1 values(1,'aaaa','aaaa','aaaa','aaaa'),(2,'xxxc','xxxb','xxxb','xxxb'),(3,'xxxb','xxxc','xxxc','xxxc'),(4,'xxxa','xxxa','xxxa','xxxa'),(5,'zzzz','zzzz','zzzz','zzzz'),(6,NULL,NULL,'xxxa','xxxa'),(7,'zxxx','zxxx','zxxx','zxxx'),(8,'axxx','axxx','axxx','axxx'),(9,'zaaz','zaaz','zaaz','zaaz'),(10,'zbbz','zbbz','zbbz','zbbz');
DELETE FROM t1 WHERE b like X'ff0000ff' ESCAPE 'f' LIMIT 2;
SELECT * FROM t1;
a	b	c	d	e
1	aaaa	aaaa	aaaa	aaaa
2	xxxc	xxxb	xxxb	xxxb
3	xxxb	xxxc	xxxc	xxxc
4	xxxa	xxxa	xxxa	xxxa
5	zzzz	zzzz	zzzz	zzzz
6	NULL	NULL	xxxa	xxxa
7	zxxx	zxxx	zxxx	zxxx
8	axxx	axxx	axxx	axxx
9	zaaz	zaaz	zaaz	zaaz
10	zbbz	zbbz	zbbz	zbbz
replace into t1 values(1,'aaaa','aaaa','aaaa','aaaa'),(2,'xxxc','xxxb','xxxb','xxxb'),(3,'xxxb','xxxc','xxxc','xxxc'),(4,'xxxa','xxxa','xxxa','xxxa'),(5,'zzzz','zzzz','zzzz','zzzz'),(6,NULL,NULL,'xxxa','xxxa'),(7,'zxxx','zxxx','zxxx','zxxx'),(8,'axxx','axxx','axxx','axxx'),(9,'zaaz','zaaz','zaaz','zaaz'),(10,'zbbz','zbbz','zbbz','zbbz');
DELETE FROM t1 WHERE b like X'78787825' ESCAPE 'f' LIMIT 2;
SELECT * FROM t1;
a	b	c	d	e
1	aaaa	aaaa	aaaa	aaaa
2	xxxc	xxxb	xxxb	xxxb
5	zzzz	zzzz	zzzz	zzzz
6	NULL	NULL	xxxa	xxxa
7	zxxx	zxxx	zxxx	zxxx
8	axxx	axxx	axxx	axxx
9	zaaz	zaaz	zaaz	zaaz
10	zbbz	zbbz	zbbz	zbbz
replace into t1 values(1,'aaaa','aaaa','aaaa','aaaa'),(2,'xxxc','xxxb','xxxb','xxxb'),(3,'xxxb','xxxc','xxxc','xxxc'),(4,'xxxa','xxxa','xxxa','xxxa'),(5,'zzzz','zzzz','zzzz','zzzz'),(6,NULL,NULL,'xxxa','xxxa'),(7,'zxxx','zxxx','zxxx','zxxx'),(8,'axxx','axxx','axxx','axxx'),(9,'zaaz','zaaz','zaaz','zaaz'),(10,'zbbz','zbbz','zbbz','zbbz');
DELETE FROM t1 WHERE b like X'78787825' ESCAPE '0' LIMIT 2;
SELECT * FROM t1;
a	b	c	d	e
1	aaaa	aaaa	aaaa	aaaa
2	xxxc	xxxb	xxxb	xxxb
5	zzzz	zzzz	zzzz	zzzz
6	NULL	NULL	xxxa	xxxa
7	zxxx	zxxx	zxxx	zxxx
8	axxx	axxx	axxx	axxx
9	zaaz	zaaz	zaaz	zaaz
10	zbbz	zbbz	zbbz	zbbz
replace into t1 values(1,'aaaa','aaaa','aaaa','aaaa'),(2,'xxxc','xxxb','xxxb','xxxb'),(3,'xxxb','xxxc','xxxc','xxxc'),(4,'xxxa','xxxa','xxxa','xxxa'),(5,'zzzz','zzzz','zzzz','zzzz'),(6,NULL,NULL,'xxxa','xxxa'),(7,'zxxx','zxxx','zxxx','zxxx'),(8,'axxx','axxx','axxx','axxx'),(9,'zaaz','zaaz','zaaz','zaaz'),(10,'zbbz','zbbz','zbbz','zbbz');
DELETE FROM t1 WHERE b like X'78787825' ESCAPE 'f' LIMIT 2;
SELECT * FROM t1;
a	b	c	d	e
1	aaaa	aaaa	aaaa	aaaa
2	xxxc	xxxb	xxxb	xxxb
5	zzzz	zzzz	zzzz	zzzz
6	NULL	NULL	xxxa	xxxa
7	zxxx	zxxx	zxxx	zxxx
8	axxx	axxx	axxx	axxx
9	zaaz	zaaz	zaaz	zaaz
10	zbbz	zbbz	zbbz	zbbz
replace into t1 values(1,'aaaa','aaaa','aaaa','aaaa'),(2,'xxxc','xxxb','xxxb','xxxb'),(3,'xxxb','xxxc','xxxc','xxxc'),(4,'xxxa','xxxa','xxxa','xxxa'),(5,'zzzz','zzzz','zzzz','zzzz'),(6,NULL,NULL,'xxxa','xxxa'),(7,'zxxx','zxxx','zxxx','zxxx'),(8,'axxx','axxx','axxx','axxx'),(9,'zaaz','zaaz','zaaz','zaaz'),(10,'zbbz','zbbz','zbbz','zbbz');
DELETE FROM t1 WHERE b like X'78787825' ESCAPE '8' LIMIT 2;
SELECT * FROM t1;
a	b	c	d	e
1	aaaa	aaaa	aaaa	aaaa
2	xxxc	xxxb	xxxb	xxxb
5	zzzz	zzzz	zzzz	zzzz
6	NULL	NULL	xxxa	xxxa
7	zxxx	zxxx	zxxx	zxxx
8	axxx	axxx	axxx	axxx
9	zaaz	zaaz	zaaz	zaaz
10	zbbz	zbbz	zbbz	zbbz
replace into t1 values(1,'aaaa','aaaa','aaaa','aaaa'),(2,'xxxc','xxxb','xxxb','xxxb'),(3,'xxxb','xxxc','xxxc','xxxc'),(4,'xxxa','xxxa','xxxa','xxxa'),(5,'zzzz','zzzz','zzzz','zzzz'),(6,NULL,NULL,'xxxa','xxxa'),(7,'zxxx','zxxx','zxxx','zxxx'),(8,'axxx','axxx','axxx','axxx'),(9,'zaaz','zaaz','zaaz','zaaz'),(10,'zbbz','zbbz','zbbz','zbbz');
DELETE FROM t1 WHERE b like X'78787825' ESCAPE '5' LIMIT 2;
SELECT * FROM t1;
a	b	c	d	e
1	aaaa	aaaa	aaaa	aaaa
2	xxxc	xxxb	xxxb	xxxb
5	zzzz	zzzz	zzzz	zzzz
6	NULL	NULL	xxxa	xxxa
7	zxxx	zxxx	zxxx	zxxx
8	axxx	axxx	axxx	axxx
9	zaaz	zaaz	zaaz	zaaz
10	zbbz	zbbz	zbbz	zbbz
replace into t1 values(1,'aaaa','aaaa','aaaa','aaaa'),(2,'xxxc','xxxb','xxxb','xxxb'),(3,'xxxb','xxxc','xxxc','xxxc'),(4,'xxxa','xxxa','xxxa','xxxa'),(5,'zzzz','zzzz','zzzz','zzzz'),(6,NULL,NULL,'xxxa','xxxa'),(7,'zxxx','zxxx','zxxx','zxxx'),(8,'axxx','axxx','axxx','axxx'),(9,'zaaz','zaaz','zaaz','zaaz'),(10,'zbbz','zbbz','zbbz','zbbz');
DELETE FROM t1 WHERE b NOT like X'0000' ESCAPE '0' LIMIT 2;
SELECT * FROM t1;
a	b	c	d	e
3	xxxb	xxxc	xxxc	xxxc
4	xxxa	xxxa	xxxa	xxxa
5	zzzz	zzzz	zzzz	zzzz
6	NULL	NULL	xxxa	xxxa
7	zxxx	zxxx	zxxx	zxxx
8	axxx	axxx	axxx	axxx
9	zaaz	zaaz	zaaz	zaaz
10	zbbz	zbbz	zbbz	zbbz
replace into t1 values(1,'aaaa','aaaa','aaaa','aaaa'),(2,'xxxc','xxxb','xxxb','xxxb'),(3,'xxxb','xxxc','xxxc','xxxc'),(4,'xxxa','xxxa','xxxa','xxxa'),(5,'zzzz','zzzz','zzzz','zzzz'),(6,NULL,NULL,'xxxa','xxxa'),(7,'zxxx','zxxx','zxxx','zxxx'),(8,'axxx','axxx','axxx','axxx'),(9,'zaaz','zaaz','zaaz','zaaz'),(10,'zbbz','zbbz','zbbz','zbbz');
DELETE FROM t1 WHERE b NOT like X'00000000' ESCAPE '0' LIMIT 2;
SELECT * FROM t1;
a	b	c	d	e
3	xxxb	xxxc	xxxc	xxxc
4	xxxa	xxxa	xxxa	xxxa
5	zzzz	zzzz	zzzz	zzzz
6	NULL	NULL	xxxa	xxxa
7	zxxx	zxxx	zxxx	zxxx
8	axxx	axxx	axxx	axxx
9	zaaz	zaaz	zaaz	zaaz
10	zbbz	zbbz	zbbz	zbbz
replace into t1 values(1,'aaaa','aaaa','aaaa','aaaa'),(2,'xxxc','xxxb','xxxb','xxxb'),(3,'xxxb','xxxc','xxxc','xxxc'),(4,'xxxa','xxxa','xxxa','xxxa'),(5,'zzzz','zzzz','zzzz','zzzz'),(6,NULL,NULL,'xxxa','xxxa'),(7,'zxxx','zxxx','zxxx','zxxx'),(8,'axxx','axxx','axxx','axxx'),(9,'zaaz','zaaz','zaaz','zaaz'),(10,'zbbz','zbbz','zbbz','zbbz');
DELETE FROM t1 WHERE b NOT like X'ffff' ESCAPE 'f' LIMIT 2;
SELECT * FROM t1;
a	b	c	d	e
3	xxxb	xxxc	xxxc	xxxc
4	xxxa	xxxa	xxxa	xxxa
5	zzzz	zzzz	zzzz	zzzz
6	NULL	NULL	xxxa	xxxa
7	zxxx	zxxx	zxxx	zxxx
8	axxx	axxx	axxx	axxx
9	zaaz	zaaz	zaaz	zaaz
10	zbbz	zbbz	zbbz	zbbz
replace into t1 values(1,'aaaa','aaaa','aaaa','aaaa'),(2,'xxxc','xxxb','xxxb','xxxb'),(3,'xxxb','xxxc','xxxc','xxxc'),(4,'xxxa','xxxa','xxxa','xxxa'),(5,'zzzz','zzzz','zzzz','zzzz'),(6,NULL,NULL,'xxxa','xxxa'),(7,'zxxx','zxxx','zxxx','zxxx'),(8,'axxx','axxx','axxx','axxx'),(9,'zaaz','zaaz','zaaz','zaaz'),(10,'zbbz','zbbz','zbbz','zbbz');
DELETE FROM t1 WHERE b NOT like X'ffffffff' ESCAPE 'f' LIMIT 2;
SELECT * FROM t1;
a	b	c	d	e
3	xxxb	xxxc	xxxc	xxxc
4	xxxa	xxxa	xxxa	xxxa
5	zzzz	zzzz	zzzz	zzzz
6	NULL	NULL	xxxa	xxxa
7	zxxx	zxxx	zxxx	zxxx
8	axxx	axxx	axxx	axxx
9	zaaz	zaaz	zaaz	zaaz
10	zbbz	zbbz	zbbz	zbbz
replace into t1 values(1,'aaaa','aaaa','aaaa','aaaa'),(2,'xxxc','xxxb','xxxb','xxxb'),(3,'xxxb','xxxc','xxxc','xxxc'),(4,'xxxa','xxxa','xxxa','xxxa'),(5,'zzzz','zzzz','zzzz','zzzz'),(6,NULL,NULL,'xxxa','xxxa'),(7,'zxxx','zxxx','zxxx','zxxx'),(8,'axxx','axxx','axxx','axxx'),(9,'zaaz','zaaz','zaaz','zaaz'),(10,'zbbz','zbbz','zbbz','zbbz');
DELETE FROM t1 WHERE b NOT like X'ff0000ff' ESCAPE 'f' LIMIT 2;
SELECT * FROM t1;
a	b	c	d	e
3	xxxb	xxxc	xxxc	xxxc
4	xxxa	xxxa	xxxa	xxxa
5	zzzz	zzzz	zzzz	zzzz
6	NULL	NULL	xxxa	xxxa
7	zxxx	zxxx	zxxx	zxxx
8	axxx	axxx	axxx	axxx
9	zaaz	zaaz	zaaz	zaaz
10	zbbz	zbbz	zbbz	zbbz
replace into t1 values(1,'aaaa','aaaa','aaaa','aaaa'),(2,'xxxc','xxxb','xxxb','xxxb'),(3,'xxxb','xxxc','xxxc','xxxc'),(4,'xxxa','xxxa','xxxa','xxxa'),(5,'zzzz','zzzz','zzzz','zzzz'),(6,NULL,NULL,'xxxa','xxxa'),(7,'zxxx','zxxx','zxxx','zxxx'),(8,'axxx','axxx','axxx','axxx'),(9,'zaaz','zaaz','zaaz','zaaz'),(10,'zbbz','zbbz','zbbz','zbbz');
DELETE FROM t1 WHERE b NOT like X'78787825' ESCAPE '0' LIMIT 2;
SELECT * FROM t1;
a	b	c	d	e
2	xxxc	xxxb	xxxb	xxxb
3	xxxb	xxxc	xxxc	xxxc
4	xxxa	xxxa	xxxa	xxxa
6	NULL	NULL	xxxa	xxxa
7	zxxx	zxxx	zxxx	zxxx
8	axxx	axxx	axxx	axxx
9	zaaz	zaaz	zaaz	zaaz
10	zbbz	zbbz	zbbz	zbbz
replace into t1 values(1,'aaaa','aaaa','aaaa','aaaa'),(2,'xxxc','xxxb','xxxb','xxxb'),(3,'xxxb','xxxc','xxxc','xxxc'),(4,'xxxa','xxxa','xxxa','xxxa'),(5,'zzzz','zzzz','zzzz','zzzz'),(6,NULL,NULL,'xxxa','xxxa'),(7,'zxxx','zxxx','zxxx','zxxx'),(8,'axxx','axxx','axxx','axxx'),(9,'zaaz','zaaz','zaaz','zaaz'),(10,'zbbz','zbbz','zbbz','zbbz');
DELETE FROM t1 WHERE b NOT like X'78787825' ESCAPE 'f' LIMIT 2;
SELECT * FROM t1;
a	b	c	d	e
2	xxxc	xxxb	xxxb	xxxb
3	xxxb	xxxc	xxxc	xxxc
4	xxxa	xxxa	xxxa	xxxa
6	NULL	NULL	xxxa	xxxa
7	zxxx	zxxx	zxxx	zxxx
8	axxx	axxx	axxx	axxx
9	zaaz	zaaz	zaaz	zaaz
10	zbbz	zbbz	zbbz	zbbz
replace into t1 values(1,'aaaa','aaaa','aaaa','aaaa'),(2,'xxxc','xxxb','xxxb','xxxb'),(3,'xxxb','xxxc','xxxc','xxxc'),(4,'xxxa','xxxa','xxxa','xxxa'),(5,'zzzz','zzzz','zzzz','zzzz'),(6,NULL,NULL,'xxxa','xxxa'),(7,'zxxx','zxxx','zxxx','zxxx'),(8,'axxx','axxx','axxx','axxx'),(9,'zaaz','zaaz','zaaz','zaaz'),(10,'zbbz','zbbz','zbbz','zbbz');
DELETE FROM t1 WHERE b like X'78787825252525252525252525' ESCAPE 'f' LIMIT 2;
SELECT * FROM t1;
a	b	c	d	e
1	aaaa	aaaa	aaaa	aaaa
2	xxxc	xxxb	xxxb	xxxb
5	zzzz	zzzz	zzzz	zzzz
6	NULL	NULL	xxxa	xxxa
7	zxxx	zxxx	zxxx	zxxx
8	axxx	axxx	axxx	axxx
9	zaaz	zaaz	zaaz	zaaz
10	zbbz	zbbz	zbbz	zbbz
replace into t1 values(1,'aaaa','aaaa','aaaa','aaaa'),(2,'xxxc','xxxb','xxxb','xxxb'),(3,'xxxb','xxxc','xxxc','xxxc'),(4,'xxxa','xxxa','xxxa','xxxa'),(5,'zzzz','zzzz','zzzz','zzzz'),(6,NULL,NULL,'xxxa','xxxa'),(7,'zxxx','zxxx','zxxx','zxxx'),(8,'axxx','axxx','axxx','axxx'),(9,'zaaz','zaaz','zaaz','zaaz'),(10,'zbbz','zbbz','zbbz','zbbz');
DELETE FROM t1 WHERE b NOT like X'78787825252525252525252525' ESCAPE 'f' LIMIT 2;
SELECT * FROM t1;
a	b	c	d	e
2	xxxc	xxxb	xxxb	xxxb
3	xxxb	xxxc	xxxc	xxxc
4	xxxa	xxxa	xxxa	xxxa
6	NULL	NULL	xxxa	xxxa
7	zxxx	zxxx	zxxx	zxxx
8	axxx	axxx	axxx	axxx
9	zaaz	zaaz	zaaz	zaaz
10	zbbz	zbbz	zbbz	zbbz
replace into t1 values(1,'aaaa','aaaa','aaaa','aaaa'),(2,'xxxc','xxxb','xxxb','xxxb'),(3,'xxxb','xxxc','xxxc','xxxc'),(4,'xxxa','xxxa','xxxa','xxxa'),(5,'zzzz','zzzz','zzzz','zzzz'),(6,NULL,NULL,'xxxa','xxxa'),(7,'zxxx','zxxx','zxxx','zxxx'),(8,'axxx','axxx','axxx','axxx'),(9,'zaaz','zaaz','zaaz','zaaz'),(10,'zbbz','zbbz','zbbz','zbbz');
DELETE FROM t1 WHERE b like 'xxx%%%%%%%%%%' ESCAPE 'f' LIMIT 2;
SELECT * FROM t1;
a	b	c	d	e
1	aaaa	aaaa	aaaa	aaaa
2	xxxc	xxxb	xxxb	xxxb
5	zzzz	zzzz	zzzz	zzzz
6	NULL	NULL	xxxa	xxxa
7	zxxx	zxxx	zxxx	zxxx
8	axxx	axxx	axxx	axxx
9	zaaz	zaaz	zaaz	zaaz
10	zbbz	zbbz	zbbz	zbbz
replace into t1 values(1,'aaaa','aaaa','aaaa','aaaa'),(2,'xxxc','xxxb','xxxb','xxxb'),(3,'xxxb','xxxc','xxxc','xxxc'),(4,'xxxa','xxxa','xxxa','xxxa'),(5,'zzzz','zzzz','zzzz','zzzz'),(6,NULL,NULL,'xxxa','xxxa'),(7,'zxxx','zxxx','zxxx','zxxx'),(8,'axxx','axxx','axxx','axxx'),(9,'zaaz','zaaz','zaaz','zaaz'),(10,'zbbz','zbbz','zbbz','zbbz');
DELETE FROM t1 WHERE b NOT like 'xxx%%%%%%%%%%' ESCAPE 'f' LIMIT 2;
SELECT * FROM t1;
a	b	c	d	e
2	xxxc	xxxb	xxxb	xxxb
3	xxxb	xxxc	xxxc	xxxc
4	xxxa	xxxa	xxxa	xxxa
6	NULL	NULL	xxxa	xxxa
7	zxxx	zxxx	zxxx	zxxx
8	axxx	axxx	axxx	axxx
9	zaaz	zaaz	zaaz	zaaz
10	zbbz	zbbz	zbbz	zbbz
replace into t1 values(1,'aaaa','aaaa','aaaa','aaaa'),(2,'xxxc','xxxb','xxxb','xxxb'),(3,'xxxb','xxxc','xxxc','xxxc'),(4,'xxxa','xxxa','xxxa','xxxa'),(5,'zzzz','zzzz','zzzz','zzzz'),(6,NULL,NULL,'xxxa','xxxa'),(7,'zxxx','zxxx','zxxx','zxxx'),(8,'axxx','axxx','axxx','axxx'),(9,'zaaz','zaaz','zaaz','zaaz'),(10,'zbbz','zbbz','zbbz','zbbz');
DELETE FROM t1 WHERE b like 'xxx_%%%%%%%%%' ESCAPE 'f' LIMIT 2;
SELECT * FROM t1;
a	b	c	d	e
1	aaaa	aaaa	aaaa	aaaa
2	xxxc	xxxb	xxxb	xxxb
5	zzzz	zzzz	zzzz	zzzz
6	NULL	NULL	xxxa	xxxa
7	zxxx	zxxx	zxxx	zxxx
8	axxx	axxx	axxx	axxx
9	zaaz	zaaz	zaaz	zaaz
10	zbbz	zbbz	zbbz	zbbz
replace into t1 values(1,'aaaa','aaaa','aaaa','aaaa'),(2,'xxxc','xxxb','xxxb','xxxb'),(3,'xxxb','xxxc','xxxc','xxxc'),(4,'xxxa','xxxa','xxxa','xxxa'),(5,'zzzz','zzzz','zzzz','zzzz'),(6,NULL,NULL,'xxxa','xxxa'),(7,'zxxx','zxxx','zxxx','zxxx'),(8,'axxx','axxx','axxx','axxx'),(9,'zaaz','zaaz','zaaz','zaaz'),(10,'zbbz','zbbz','zbbz','zbbz');
DELETE FROM t1 WHERE b NOT like 'xxx_%%%%%%%%%' ESCAPE 'f' LIMIT 2;
SELECT * FROM t1;
a	b	c	d	e
2	xxxc	xxxb	xxxb	xxxb
3	xxxb	xxxc	xxxc	xxxc
4	xxxa	xxxa	xxxa	xxxa
6	NULL	NULL	xxxa	xxxa
7	zxxx	zxxx	zxxx	zxxx
8	axxx	axxx	axxx	axxx
9	zaaz	zaaz	zaaz	zaaz
10	zbbz	zbbz	zbbz	zbbz
-- Cover 0x00-FF in like str
EXPLAIN DELETE FROM t1 WHERE b like 0x000102030405060708090A0B0C0D0E0F101112131415161718191A1B1C1D0E1F202122232425262728292A2B2C2D0E2F303132333435363738393A3B3C3D0E3F404142434445464748494A4B4C4D0E4F505152535455565758595A5B5C5D0E5F606162636465666768696A6B6C6D0E6F707172737475767778797A7B7C7D0E7F808182838485868788898A8B8C8D0E8F909192939495969798999A9B9C9D0E9FA0A1A2A3A4A5A6A7A8A9AAABACAD0EAFB0B1B2B3B4B5B6B7B8B9BABBBCBD0EBFC0C1C2C3C4C5C6C7C8C9CACBCCCD0ECFD0D1D2D3D4D5D6D7D8D9DADBDCDD0EDFE0E1E2E3E4E5E6E7E8E9EAEBECED0EEFF0F1F2F3F4F5F6F7F8F9FAFBFCFD0EFF  ESCAPE '&' LIMIT 2;
EXPLAIN DELETE FROM t1 WHERE b like 0x000102030405060708090A0B0C0D0E0F101112131415161718191A1B1C1D0E1F202122232425262728292A2B2C2D0E2F303132333435363738393A3B3C3D0E3F404142434445464748494A4B4C4D0E4F505152535455565758595A5B5C5D0E5F606162636465666768696A6B6C6D0E6F707172737475767778797A7B7C7D0E7F808182838485868788898A8B8C8D0E8F909192939495969798999A9B9C9D0E9FA0A1A2A3A4A5A6A7A8A9AAABACAD0EAFB0B1B2B3B4B5B6B7B8B9BABBBCBD0EBFC0C1C2C3C4C5C6C7C8C9CACBCCCD0ECFD0D1D2D3D4D5D6D7D8D9DADBDCDD0EDFE0E1E2E3E4E5E6E7E8E9EAEBECED0EEFF0F1F2F3F4F5F6F7F8F9FAFBFCFD0EFF LIMIT 2;
EXPLAIN DELETE FROM t1 WHERE b like x'000102030405060708090A0B0C0D0E0F101112131415161718191A1B1C1D0E1F202122232425262728292A2B2C2D0E2F303132333435363738393A3B3C3D0E3F404142434445464748494A4B4C4D0E4F505152535455565758595A5B5C5D0E5F606162636465666768696A6B6C6D0E6F707172737475767778797A7B7C7D0E7F808182838485868788898A8B8C8D0E8F909192939495969798999A9B9C9D0E9FA0A1A2A3A4A5A6A7A8A9AAABACAD0EAFB0B1B2B3B4B5B6B7B8B9BABBBCBD0EBFC0C1C2C3C4C5C6C7C8C9CACBCCCD0ECFD0D1D2D3D4D5D6D7D8D9DADBDCDD0EDFE0E1E2E3E4E5E6E7E8E9EAEBECED0EEFF0F1F2F3F4F5F6F7F8F9FAFBFCFD0EFF'  ESCAPE '&' LIMIT 2;
EXPLAIN DELETE FROM t1 WHERE b like x'000102030405060708090A0B0C0D0E0F101112131415161718191A1B1C1D0E1F202122232425262728292A2B2C2D0E2F303132333435363738393A3B3C3D0E3F404142434445464748494A4B4C4D0E4F505152535455565758595A5B5C5D0E5F606162636465666768696A6B6C6D0E6F707172737475767778797A7B7C7D0E7F808182838485868788898A8B8C8D0E8F909192939495969798999A9B9C9D0E9FA0A1A2A3A4A5A6A7A8A9AAABACAD0EAFB0B1B2B3B4B5B6B7B8B9BABBBCBD0EBFC0C1C2C3C4C5C6C7C8C9CACBCCCD0ECFD0D1D2D3D4D5D6D7D8D9DADBDCDD0EDFE0E1E2E3E4E5E6E7E8E9EAEBECED0EEFF0F1F2F3F4F5F6F7F8F9FAFBFCFD0EFF' LIMIT 2;
EXPLAIN DELETE FROM t1 WHERE b like X'000102030405060708090A0B0C0D0E0F101112131415161718191A1B1C1D0E1F202122232425262728292A2B2C2D0E2F303132333435363738393A3B3C3D0E3F404142434445464748494A4B4C4D0E4F505152535455565758595A5B5C5D0E5F606162636465666768696A6B6C6D0E6F707172737475767778797A7B7C7D0E7F808182838485868788898A8B8C8D0E8F909192939495969798999A9B9C9D0E9FA0A1A2A3A4A5A6A7A8A9AAABACAD0EAFB0B1B2B3B4B5B6B7B8B9BABBBCBD0EBFC0C1C2C3C4C5C6C7C8C9CACBCCCD0ECFD0D1D2D3D4D5D6D7D8D9DADBDCDD0EDFE0E1E2E3E4E5E6E7E8E9EAEBECED0EEFF0F1F2F3F4F5F6F7F8F9FAFBFCFD0EFF'  ESCAPE '&' LIMIT 2;
EXPLAIN DELETE FROM t1 WHERE b like X'000102030405060708090A0B0C0D0E0F101112131415161718191A1B1C1D0E1F202122232425262728292A2B2C2D0E2F303132333435363738393A3B3C3D0E3F404142434445464748494A4B4C4D0E4F505152535455565758595A5B5C5D0E5F606162636465666768696A6B6C6D0E6F707172737475767778797A7B7C7D0E7F808182838485868788898A8B8C8D0E8F909192939495969798999A9B9C9D0E9FA0A1A2A3A4A5A6A7A8A9AAABACAD0EAFB0B1B2B3B4B5B6B7B8B9BABBBCBD0EBFC0C1C2C3C4C5C6C7C8C9CACBCCCD0ECFD0D1D2D3D4D5D6D7D8D9DADBDCDD0EDFE0E1E2E3E4E5E6E7E8E9EAEBECED0EEFF0F1F2F3F4F5F6F7F8F9FAFBFCFD0EFF' LIMIT 2;
DELETE FROM t1 WHERE b like 0x000102030405060708090A0B0C0D0E0F101112131415161718191A1B1C1D0E1F202122232425262728292A2B2C2D0E2F303132333435363738393A3B3C3D0E3F404142434445464748494A4B4C4D0E4F505152535455565758595A5B5C5D0E5F606162636465666768696A6B6C6D0E6F707172737475767778797A7B7C7D0E7F808182838485868788898A8B8C8D0E8F909192939495969798999A9B9C9D0E9FA0A1A2A3A4A5A6A7A8A9AAABACAD0EAFB0B1B2B3B4B5B6B7B8B9BABBBCBD0EBFC0C1C2C3C4C5C6C7C8C9CACBCCCD0ECFD0D1D2D3D4D5D6D7D8D9DADBDCDD0EDFE0E1E2E3E4E5E6E7E8E9EAEBECED0EEFF0F1F2F3F4F5F6F7F8F9FAFBFCFD0EFF  ESCAPE '&' LIMIT 2;
DELETE FROM t1 WHERE b like 0x000102030405060708090A0B0C0D0E0F101112131415161718191A1B1C1D0E1F202122232425262728292A2B2C2D0E2F303132333435363738393A3B3C3D0E3F404142434445464748494A4B4C4D0E4F505152535455565758595A5B5C5D0E5F606162636465666768696A6B6C6D0E6F707172737475767778797A7B7C7D0E7F808182838485868788898A8B8C8D0E8F909192939495969798999A9B9C9D0E9FA0A1A2A3A4A5A6A7A8A9AAABACAD0EAFB0B1B2B3B4B5B6B7B8B9BABBBCBD0EBFC0C1C2C3C4C5C6C7C8C9CACBCCCD0ECFD0D1D2D3D4D5D6D7D8D9DADBDCDD0EDFE0E1E2E3E4E5E6E7E8E9EAEBECED0EEFF0F1F2F3F4F5F6F7F8F9FAFBFCFD0EFF LIMIT 2;
DELETE FROM t1 WHERE b like x'000102030405060708090A0B0C0D0E0F101112131415161718191A1B1C1D0E1F202122232425262728292A2B2C2D0E2F303132333435363738393A3B3C3D0E3F404142434445464748494A4B4C4D0E4F505152535455565758595A5B5C5D0E5F606162636465666768696A6B6C6D0E6F707172737475767778797A7B7C7D0E7F808182838485868788898A8B8C8D0E8F909192939495969798999A9B9C9D0E9FA0A1A2A3A4A5A6A7A8A9AAABACAD0EAFB0B1B2B3B4B5B6B7B8B9BABBBCBD0EBFC0C1C2C3C4C5C6C7C8C9CACBCCCD0ECFD0D1D2D3D4D5D6D7D8D9DADBDCDD0EDFE0E1E2E3E4E5E6E7E8E9EAEBECED0EEFF0F1F2F3F4F5F6F7F8F9FAFBFCFD0EFF'  ESCAPE '&' LIMIT 2;
DELETE FROM t1 WHERE b like x'000102030405060708090A0B0C0D0E0F101112131415161718191A1B1C1D0E1F202122232425262728292A2B2C2D0E2F303132333435363738393A3B3C3D0E3F404142434445464748494A4B4C4D0E4F505152535455565758595A5B5C5D0E5F606162636465666768696A6B6C6D0E6F707172737475767778797A7B7C7D0E7F808182838485868788898A8B8C8D0E8F909192939495969798999A9B9C9D0E9FA0A1A2A3A4A5A6A7A8A9AAABACAD0EAFB0B1B2B3B4B5B6B7B8B9BABBBCBD0EBFC0C1C2C3C4C5C6C7C8C9CACBCCCD0ECFD0D1D2D3D4D5D6D7D8D9DADBDCDD0EDFE0E1E2E3E4E5E6E7E8E9EAEBECED0EEFF0F1F2F3F4F5F6F7F8F9FAFBFCFD0EFF' LIMIT 2;
DELETE FROM t1 WHERE b like X'000102030405060708090A0B0C0D0E0F101112131415161718191A1B1C1D0E1F202122232425262728292A2B2C2D0E2F303132333435363738393A3B3C3D0E3F404142434445464748494A4B4C4D0E4F505152535455565758595A5B5C5D0E5F606162636465666768696A6B6C6D0E6F707172737475767778797A7B7C7D0E7F808182838485868788898A8B8C8D0E8F909192939495969798999A9B9C9D0E9FA0A1A2A3A4A5A6A7A8A9AAABACAD0EAFB0B1B2B3B4B5B6B7B8B9BABBBCBD0EBFC0C1C2C3C4C5C6C7C8C9CACBCCCD0ECFD0D1D2D3D4D5D6D7D8D9DADBDCDD0EDFE0E1E2E3E4E5E6E7E8E9EAEBECED0EEFF0F1F2F3F4F5F6F7F8F9FAFBFCFD0EFF'  ESCAPE '&' LIMIT 2;
DELETE FROM t1 WHERE b like X'000102030405060708090A0B0C0D0E0F101112131415161718191A1B1C1D0E1F202122232425262728292A2B2C2D0E2F303132333435363738393A3B3C3D0E3F404142434445464748494A4B4C4D0E4F505152535455565758595A5B5C5D0E5F606162636465666768696A6B6C6D0E6F707172737475767778797A7B7C7D0E7F808182838485868788898A8B8C8D0E8F909192939495969798999A9B9C9D0E9FA0A1A2A3A4A5A6A7A8A9AAABACAD0EAFB0B1B2B3B4B5B6B7B8B9BABBBCBD0EBFC0C1C2C3C4C5C6C7C8C9CACBCCCD0ECFD0D1D2D3D4D5D6D7D8D9DADBDCDD0EDFE0E1E2E3E4E5E6E7E8E9EAEBECED0EEFF0F1F2F3F4F5F6F7F8F9FAFBFCFD0EFF' LIMIT 2;
EXPLAIN DELETE FROM t1 WHERE b not like 0x000102030405060708090A0B0C0D0E0F101112131415161718191A1B1C1D0E1F202122232425262728292A2B2C2D0E2F303132333435363738393A3B3C3D0E3F404142434445464748494A4B4C4D0E4F505152535455565758595A5B5C5D0E5F606162636465666768696A6B6C6D0E6F707172737475767778797A7B7C7D0E7F808182838485868788898A8B8C8D0E8F909192939495969798999A9B9C9D0E9FA0A1A2A3A4A5A6A7A8A9AAABACAD0EAFB0B1B2B3B4B5B6B7B8B9BABBBCBD0EBFC0C1C2C3C4C5C6C7C8C9CACBCCCD0ECFD0D1D2D3D4D5D6D7D8D9DADBDCDD0EDFE0E1E2E3E4E5E6E7E8E9EAEBECED0EEFF0F1F2F3F4F5F6F7F8F9FAFBFCFD0EFF  ESCAPE '&' LIMIT 2;
EXPLAIN DELETE FROM t1 WHERE b not like 0x000102030405060708090A0B0C0D0E0F101112131415161718191A1B1C1D0E1F202122232425262728292A2B2C2D0E2F303132333435363738393A3B3C3D0E3F404142434445464748494A4B4C4D0E4F505152535455565758595A5B5C5D0E5F606162636465666768696A6B6C6D0E6F707172737475767778797A7B7C7D0E7F808182838485868788898A8B8C8D0E8F909192939495969798999A9B9C9D0E9FA0A1A2A3A4A5A6A7A8A9AAABACAD0EAFB0B1B2B3B4B5B6B7B8B9BABBBCBD0EBFC0C1C2C3C4C5C6C7C8C9CACBCCCD0ECFD0D1D2D3D4D5D6D7D8D9DADBDCDD0EDFE0E1E2E3E4E5E6E7E8E9EAEBECED0EEFF0F1F2F3F4F5F6F7F8F9FAFBFCFD0EFF LIMIT 2;
EXPLAIN DELETE FROM t1 WHERE b not like x'000102030405060708090A0B0C0D0E0F101112131415161718191A1B1C1D0E1F202122232425262728292A2B2C2D0E2F303132333435363738393A3B3C3D0E3F404142434445464748494A4B4C4D0E4F505152535455565758595A5B5C5D0E5F606162636465666768696A6B6C6D0E6F707172737475767778797A7B7C7D0E7F808182838485868788898A8B8C8D0E8F909192939495969798999A9B9C9D0E9FA0A1A2A3A4A5A6A7A8A9AAABACAD0EAFB0B1B2B3B4B5B6B7B8B9BABBBCBD0EBFC0C1C2C3C4C5C6C7C8C9CACBCCCD0ECFD0D1D2D3D4D5D6D7D8D9DADBDCDD0EDFE0E1E2E3E4E5E6E7E8E9EAEBECED0EEFF0F1F2F3F4F5F6F7F8F9FAFBFCFD0EFF'  ESCAPE '&' LIMIT 2;
EXPLAIN DELETE FROM t1 WHERE b not like x'000102030405060708090A0B0C0D0E0F101112131415161718191A1B1C1D0E1F202122232425262728292A2B2C2D0E2F303132333435363738393A3B3C3D0E3F404142434445464748494A4B4C4D0E4F505152535455565758595A5B5C5D0E5F606162636465666768696A6B6C6D0E6F707172737475767778797A7B7C7D0E7F808182838485868788898A8B8C8D0E8F909192939495969798999A9B9C9D0E9FA0A1A2A3A4A5A6A7A8A9AAABACAD0EAFB0B1B2B3B4B5B6B7B8B9BABBBCBD0EBFC0C1C2C3C4C5C6C7C8C9CACBCCCD0ECFD0D1D2D3D4D5D6D7D8D9DADBDCDD0EDFE0E1E2E3E4E5E6E7E8E9EAEBECED0EEFF0F1F2F3F4F5F6F7F8F9FAFBFCFD0EFF' LIMIT 2;
EXPLAIN DELETE FROM t1 WHERE b not like X'000102030405060708090A0B0C0D0E0F101112131415161718191A1B1C1D0E1F202122232425262728292A2B2C2D0E2F303132333435363738393A3B3C3D0E3F404142434445464748494A4B4C4D0E4F505152535455565758595A5B5C5D0E5F606162636465666768696A6B6C6D0E6F707172737475767778797A7B7C7D0E7F808182838485868788898A8B8C8D0E8F909192939495969798999A9B9C9D0E9FA0A1A2A3A4A5A6A7A8A9AAABACAD0EAFB0B1B2B3B4B5B6B7B8B9BABBBCBD0EBFC0C1C2C3C4C5C6C7C8C9CACBCCCD0ECFD0D1D2D3D4D5D6D7D8D9DADBDCDD0EDFE0E1E2E3E4E5E6E7E8E9EAEBECED0EEFF0F1F2F3F4F5F6F7F8F9FAFBFCFD0EFF'  ESCAPE '&' LIMIT 2;
EXPLAIN DELETE FROM t1 WHERE b not like X'000102030405060708090A0B0C0D0E0F101112131415161718191A1B1C1D0E1F202122232425262728292A2B2C2D0E2F303132333435363738393A3B3C3D0E3F404142434445464748494A4B4C4D0E4F505152535455565758595A5B5C5D0E5F606162636465666768696A6B6C6D0E6F707172737475767778797A7B7C7D0E7F808182838485868788898A8B8C8D0E8F909192939495969798999A9B9C9D0E9FA0A1A2A3A4A5A6A7A8A9AAABACAD0EAFB0B1B2B3B4B5B6B7B8B9BABBBCBD0EBFC0C1C2C3C4C5C6C7C8C9CACBCCCD0ECFD0D1D2D3D4D5D6D7D8D9DADBDCDD0EDFE0E1E2E3E4E5E6E7E8E9EAEBECED0EEFF0F1F2F3F4F5F6F7F8F9FAFBFCFD0EFF' LIMIT 2;
DELETE FROM t1 WHERE b not like 0x000102030405060708090A0B0C0D0E0F101112131415161718191A1B1C1D0E1F202122232425262728292A2B2C2D0E2F303132333435363738393A3B3C3D0E3F404142434445464748494A4B4C4D0E4F505152535455565758595A5B5C5D0E5F606162636465666768696A6B6C6D0E6F707172737475767778797A7B7C7D0E7F808182838485868788898A8B8C8D0E8F909192939495969798999A9B9C9D0E9FA0A1A2A3A4A5A6A7A8A9AAABACAD0EAFB0B1B2B3B4B5B6B7B8B9BABBBCBD0EBFC0C1C2C3C4C5C6C7C8C9CACBCCCD0ECFD0D1D2D3D4D5D6D7D8D9DADBDCDD0EDFE0E1E2E3E4E5E6E7E8E9EAEBECED0EEFF0F1F2F3F4F5F6F7F8F9FAFBFCFD0EFF  ESCAPE '&' LIMIT 2;
DELETE FROM t1 WHERE b not like 0x000102030405060708090A0B0C0D0E0F101112131415161718191A1B1C1D0E1F202122232425262728292A2B2C2D0E2F303132333435363738393A3B3C3D0E3F404142434445464748494A4B4C4D0E4F505152535455565758595A5B5C5D0E5F606162636465666768696A6B6C6D0E6F707172737475767778797A7B7C7D0E7F808182838485868788898A8B8C8D0E8F909192939495969798999A9B9C9D0E9FA0A1A2A3A4A5A6A7A8A9AAABACAD0EAFB0B1B2B3B4B5B6B7B8B9BABBBCBD0EBFC0C1C2C3C4C5C6C7C8C9CACBCCCD0ECFD0D1D2D3D4D5D6D7D8D9DADBDCDD0EDFE0E1E2E3E4E5E6E7E8E9EAEBECED0EEFF0F1F2F3F4F5F6F7F8F9FAFBFCFD0EFF LIMIT 2;
DELETE FROM t1 WHERE b not like x'000102030405060708090A0B0C0D0E0F101112131415161718191A1B1C1D0E1F202122232425262728292A2B2C2D0E2F303132333435363738393A3B3C3D0E3F404142434445464748494A4B4C4D0E4F505152535455565758595A5B5C5D0E5F606162636465666768696A6B6C6D0E6F707172737475767778797A7B7C7D0E7F808182838485868788898A8B8C8D0E8F909192939495969798999A9B9C9D0E9FA0A1A2A3A4A5A6A7A8A9AAABACAD0EAFB0B1B2B3B4B5B6B7B8B9BABBBCBD0EBFC0C1C2C3C4C5C6C7C8C9CACBCCCD0ECFD0D1D2D3D4D5D6D7D8D9DADBDCDD0EDFE0E1E2E3E4E5E6E7E8E9EAEBECED0EEFF0F1F2F3F4F5F6F7F8F9FAFBFCFD0EFF'  ESCAPE '&' LIMIT 2;
DELETE FROM t1 WHERE b not like x'000102030405060708090A0B0C0D0E0F101112131415161718191A1B1C1D0E1F202122232425262728292A2B2C2D0E2F303132333435363738393A3B3C3D0E3F404142434445464748494A4B4C4D0E4F505152535455565758595A5B5C5D0E5F606162636465666768696A6B6C6D0E6F707172737475767778797A7B7C7D0E7F808182838485868788898A8B8C8D0E8F909192939495969798999A9B9C9D0E9FA0A1A2A3A4A5A6A7A8A9AAABACAD0EAFB0B1B2B3B4B5B6B7B8B9BABBBCBD0EBFC0C1C2C3C4C5C6C7C8C9CACBCCCD0ECFD0D1D2D3D4D5D6D7D8D9DADBDCDD0EDFE0E1E2E3E4E5E6E7E8E9EAEBECED0EEFF0F1F2F3F4F5F6F7F8F9FAFBFCFD0EFF' LIMIT 2;
DELETE FROM t1 WHERE b not like X'000102030405060708090A0B0C0D0E0F101112131415161718191A1B1C1D0E1F202122232425262728292A2B2C2D0E2F303132333435363738393A3B3C3D0E3F404142434445464748494A4B4C4D0E4F505152535455565758595A5B5C5D0E5F606162636465666768696A6B6C6D0E6F707172737475767778797A7B7C7D0E7F808182838485868788898A8B8C8D0E8F909192939495969798999A9B9C9D0E9FA0A1A2A3A4A5A6A7A8A9AAABACAD0EAFB0B1B2B3B4B5B6B7B8B9BABBBCBD0EBFC0C1C2C3C4C5C6C7C8C9CACBCCCD0ECFD0D1D2D3D4D5D6D7D8D9DADBDCDD0EDFE0E1E2E3E4E5E6E7E8E9EAEBECED0EEFF0F1F2F3F4F5F6F7F8F9FAFBFCFD0EFF'  ESCAPE '&' LIMIT 2;
DELETE FROM t1 WHERE b not like X'000102030405060708090A0B0C0D0E0F101112131415161718191A1B1C1D0E1F202122232425262728292A2B2C2D0E2F303132333435363738393A3B3C3D0E3F404142434445464748494A4B4C4D0E4F505152535455565758595A5B5C5D0E5F606162636465666768696A6B6C6D0E6F707172737475767778797A7B7C7D0E7F808182838485868788898A8B8C8D0E8F909192939495969798999A9B9C9D0E9FA0A1A2A3A4A5A6A7A8A9AAABACAD0EAFB0B1B2B3B4B5B6B7B8B9BABBBCBD0EBFC0C1C2C3C4C5C6C7C8C9CACBCCCD0ECFD0D1D2D3D4D5D6D7D8D9DADBDCDD0EDFE0E1E2E3E4E5E6E7E8E9EAEBECED0EEFF0F1F2F3F4F5F6F7F8F9FAFBFCFD0EFF' LIMIT 2;
set sql_mode="strict_all_tables";
