drop database if exists db1;
drop database if exists alias;
create database db1 CHARACTER set 'utf8' ;
create database alias;
use db1;
create table db1t1(c1 int primary key, c2 int);
insert into db1t1 values(1,2);
drop database db1;
select * from db1t1;
ERROR 3D000: No database selected
use db1;
ERROR 42000: Unknown database 'db1'
select * from db1t1;
ERROR 3D000: No database selected
create database db1;
use db1;
create table db1t1(c1 int primary key, c2 int);
select * from db1t1;
c1	c2
use alias;
DROP TABLE IF EXISTS a1,a2;
create table a1(rowkey_suffix int primary key, price int);
insert into a1 (rowkey_suffix, price) values (5, 1000);
insert into a1 (rowkey_suffix, price) values (6, 1001);
insert into a1 (rowkey_suffix, price) values (7, 1002);
insert into a1 (rowkey_suffix, price) values (8, 1003);
create table a2(rowkey_suffix2 int primary key, price int, count int);
insert into a2 (rowkey_suffix2, price, count) values (8, 1003, 4);
insert into a2 (rowkey_suffix2, price, count) values (6, 1002, 1);
insert into a2 (rowkey_suffix2, price, count) values (7, 1005, 2);
insert into a2 (rowkey_suffix2, price, count) values (5, 1001, 3);
drop database if exists namespace;
create database namespace;
use namespace;
select price from alias.a1;
price
1000
1001
1002
1003
select a1.price from alias.a1;
price
1000
1001
1002
1003
select .a1.price from alias.a1;
price
1000
1001
1002
1003
insert into alias.a1 (rowkey_suffix, price) values(1, 1);
insert into alias.a1 (rowkey_suffix, price) values(2, -1);
update alias.a1 set price=price+1 where rowkey_suffix>0;
delete from alias.a1 where price = 0;
use alias;
select rowkey_suffix, a2.price as rowkey_suffix from a1, a2 order by rowkey_suffix;
ERROR 23000: Column 'rowkey_suffix' in order clause is ambiguous
select rowkey_suffix, a2.price as rowkey_suffix from a1, a2 group by rowkey_suffix;
ERROR 23000: Column 'rowkey_suffix' in group statement is ambiguous
select rowkey_suffix, a2.price as cost from a1, a2 where cost > 0;
ERROR 42S22: Unknown column 'cost' in 'where clause'
select rowkey_suffix, a2.price as rowkey_suffix from a1, a2 where rowkey_suffix > 0 order by 1, 2;
rowkey_suffix	rowkey_suffix
1	1001
1	1002
1	1003
1	1005
5	1001
5	1002
5	1003
5	1005
6	1001
6	1002
6	1003
6	1005
7	1001
7	1002
7	1003
7	1005
8	1001
8	1002
8	1003
8	1005
select a1.price, a2.price as rowkey_suffix from a1,a2 where rowkey_suffix > 6 order by 1, 2;
price	rowkey_suffix
1003	1001
1003	1002
1003	1003
1003	1005
1004	1001
1004	1002
1004	1003
1004	1005
select a1.price, a2.price as rowkey_suffix from a1,a2 group by rowkey_suffix order by 1, 2;
price	rowkey_suffix
2	1001
1001	1001
1002	1001
1003	1001
1004	1001
select a2.price as rowkey_suffix from a1,a2 order by rowkey_suffix desc;
rowkey_suffix
1005
1005
1005
1005
1005
1003
1003
1003
1003
1003
1002
1002
1002
1002
1002
1001
1001
1001
1001
1001
drop database namespace;
drop database alias;
drop database db1;
