drop table if exists t1;
create table t1 (a int, key (a));
insert into t1 values (NULL), (0), (1), (2), (3), (4), (5), (6), (7), (8), (9),
(10), (11), (12), (13), (14), (15), (16), (17), (18), (19);
explain basic select * from t1 where not(not(a));
Query Plan
=========================
|ID|OPERATOR       |NAME|
-------------------------
|0 |TABLE FULL SCAN|t1  |
=========================
Outputs & filters:
-------------------------------------
  0 - output([t1.a]), filter([t1.a]), rowset=256
      access([t1.a]), partitions(p0)
      is_index_back=false, is_global_index=false, filter_before_indexback[false], 
      range_key([t1.__pk_increment]), range(MIN ; MAX)always true
select * from t1 where not(not(a));
a
1
2
3
4
5
6
7
8
9
10
11
12
13
14
15
16
17
18
19
explain basic select * from t1 where not(not(not(a > 10)));
Query Plan
===========================
|ID|OPERATOR        |NAME |
---------------------------
|0 |TABLE RANGE SCAN|t1(a)|
===========================
Outputs & filters:
-------------------------------------
  0 - output([t1.a]), filter(nil), rowset=16
      access([t1.a]), partitions(p0)
      is_index_back=false, is_global_index=false, 
      range_key([t1.a], [t1.__pk_increment]), range(NULL,MAX ; 10,MAX), 
      range_cond([t1.a <= 10])
select * from t1 where not(not(not(a > 10)));
a
0
1
2
3
4
5
6
7
8
9
10
explain basic select * from t1 where not(not(not(a < 5) and not(a > 10)));
Query Plan
===========================
|ID|OPERATOR        |NAME |
---------------------------
|0 |TABLE RANGE SCAN|t1(a)|
===========================
Outputs & filters:
-------------------------------------
  0 - output([t1.a]), filter(nil), rowset=16
      access([t1.a]), partitions(p0)
      is_index_back=false, is_global_index=false, 
      range_key([t1.a], [t1.__pk_increment]), range(5,MIN ; 10,MAX), 
      range_cond([t1.a >= 5], [t1.a <= 10])
select * from t1 where not(not(not(a < 5) and not(a > 10)));
a
5
6
7
8
9
10
explain basic select * from t1 where not(a = 10);
Query Plan
===========================
|ID|OPERATOR        |NAME |
---------------------------
|0 |TABLE RANGE SCAN|t1(a)|
===========================
Outputs & filters:
-------------------------------------
  0 - output([t1.a]), filter(nil), rowset=256
      access([t1.a]), partitions(p0)
      is_index_back=false, is_global_index=false, 
      range_key([t1.a], [t1.__pk_increment]), range(NULL,MAX ; 10,MIN), (10,MAX ; MAX,MAX), 
      range_cond([t1.a != 10])
select * from t1 where not(a = 10);
a
0
1
2
3
4
5
6
7
8
9
11
12
13
14
15
16
17
18
19
explain basic select * from t1 where not(a != 10);
Query Plan
===========================
|ID|OPERATOR        |NAME |
---------------------------
|0 |TABLE RANGE SCAN|t1(a)|
===========================
Outputs & filters:
-------------------------------------
  0 - output([t1.a]), filter(nil), rowset=16
      access([t1.a]), partitions(p0)
      is_index_back=false, is_global_index=false, 
      range_key([t1.a], [t1.__pk_increment]), range(10,MIN ; 10,MAX), 
      range_cond([t1.a = 10])
select * from t1 where not(a != 1);
a
1
explain basic select * from t1 where not(a < 10);
Query Plan
===========================
|ID|OPERATOR        |NAME |
---------------------------
|0 |TABLE RANGE SCAN|t1(a)|
===========================
Outputs & filters:
-------------------------------------
  0 - output([t1.a]), filter(nil), rowset=16
      access([t1.a]), partitions(p0)
      is_index_back=false, is_global_index=false, 
      range_key([t1.a], [t1.__pk_increment]), range(10,MIN ; MAX,MAX), 
      range_cond([t1.a >= 10])
select * from t1 where not(a < 10);
a
10
11
12
13
14
15
16
17
18
19
explain basic select * from t1 where not(a >= 10);
Query Plan
===========================
|ID|OPERATOR        |NAME |
---------------------------
|0 |TABLE RANGE SCAN|t1(a)|
===========================
Outputs & filters:
-------------------------------------
  0 - output([t1.a]), filter(nil), rowset=16
      access([t1.a]), partitions(p0)
      is_index_back=false, is_global_index=false, 
      range_key([t1.a], [t1.__pk_increment]), range(NULL,MAX ; 10,MIN), 
      range_cond([t1.a < 10])
select * from t1 where not(a >= 10);
a
0
1
2
3
4
5
6
7
8
9
explain basic select * from t1 where not(a > 10);
Query Plan
===========================
|ID|OPERATOR        |NAME |
---------------------------
|0 |TABLE RANGE SCAN|t1(a)|
===========================
Outputs & filters:
-------------------------------------
  0 - output([t1.a]), filter(nil), rowset=16
      access([t1.a]), partitions(p0)
      is_index_back=false, is_global_index=false, 
      range_key([t1.a], [t1.__pk_increment]), range(NULL,MAX ; 10,MAX), 
      range_cond([t1.a <= 10])
select * from t1 where not(a > 10);
a
0
1
2
3
4
5
6
7
8
9
10
explain basic select * from t1 where not(a <= 10);
Query Plan
===========================
|ID|OPERATOR        |NAME |
---------------------------
|0 |TABLE RANGE SCAN|t1(a)|
===========================
Outputs & filters:
-------------------------------------
  0 - output([t1.a]), filter(nil), rowset=16
      access([t1.a]), partitions(p0)
      is_index_back=false, is_global_index=false, 
      range_key([t1.a], [t1.__pk_increment]), range(10,MAX ; MAX,MAX), 
      range_cond([t1.a > 10])
select * from t1 where not(a <= 10);
a
11
12
13
14
15
16
17
18
19
explain basic select * from t1 where not(a is null);
Query Plan
=========================
|ID|OPERATOR       |NAME|
-------------------------
|0 |TABLE FULL SCAN|t1  |
=========================
Outputs & filters:
-------------------------------------
  0 - output([t1.a]), filter([t1.a IS NOT NULL]), rowset=256
      access([t1.a]), partitions(p0)
      is_index_back=false, is_global_index=false, filter_before_indexback[false], 
      range_key([t1.__pk_increment]), range(MIN ; MAX)always true
select * from t1 where not(a is null);
a
0
1
2
3
4
5
6
7
8
9
10
11
12
13
14
15
16
17
18
19
explain basic select * from t1 where not(a is not null);
Query Plan
===========================
|ID|OPERATOR        |NAME |
---------------------------
|0 |TABLE RANGE SCAN|t1(a)|
===========================
Outputs & filters:
-------------------------------------
  0 - output([t1.a]), filter(nil), rowset=16
      access([t1.a]), partitions(p0)
      is_index_back=false, is_global_index=false, 
      range_key([t1.a], [t1.__pk_increment]), range(NULL,MIN ; NULL,MAX), 
      range_cond([t1.a IS NULL])
select * from t1 where not(a is not null);
a
NULL
explain basic select * from t1 where not(a < 5 or a > 15);
Query Plan
===========================
|ID|OPERATOR        |NAME |
---------------------------
|0 |TABLE RANGE SCAN|t1(a)|
===========================
Outputs & filters:
-------------------------------------
  0 - output([t1.a]), filter(nil), rowset=16
      access([t1.a]), partitions(p0)
      is_index_back=false, is_global_index=false, 
      range_key([t1.a], [t1.__pk_increment]), range(5,MIN ; 15,MAX), 
      range_cond([t1.a >= 5], [t1.a <= 15])
select * from t1 where not(a < 5 or a > 15);
a
5
6
7
8
9
10
11
12
13
14
15
explain basic select * from t1 where not(a < 15 and a > 5);
Query Plan
===========================
|ID|OPERATOR        |NAME |
---------------------------
|0 |TABLE RANGE SCAN|t1(a)|
===========================
Outputs & filters:
-------------------------------------
  0 - output([t1.a]), filter(nil), rowset=16
      access([t1.a]), partitions(p0)
      is_index_back=false, is_global_index=false, 
      range_key([t1.a], [t1.__pk_increment]), range(NULL,MAX ; 5,MAX), (15,MIN ; MAX,MAX), 
      range_cond([t1.a >= 15 OR t1.a <= 5])
select * from t1 where not(a < 15 and a > 5);
a
0
1
2
3
4
5
15
16
17
18
19
explain basic select * from t1 where a = 2 or not(a < 10);
Query Plan
===========================
|ID|OPERATOR        |NAME |
---------------------------
|0 |TABLE RANGE SCAN|t1(a)|
===========================
Outputs & filters:
-------------------------------------
  0 - output([t1.a]), filter(nil), rowset=16
      access([t1.a]), partitions(p0)
      is_index_back=false, is_global_index=false, 
      range_key([t1.a], [t1.__pk_increment]), range(2,MIN ; 2,MAX), (10,MIN ; MAX,MAX), 
      range_cond([t1.a = 2 OR t1.a >= 10])
select * from t1 where a = 2 or not(a < 10);
a
2
10
11
12
13
14
15
16
17
18
19
explain basic select * from t1 where a > 5 and not(a > 10);
Query Plan
===========================
|ID|OPERATOR        |NAME |
---------------------------
|0 |TABLE RANGE SCAN|t1(a)|
===========================
Outputs & filters:
-------------------------------------
  0 - output([t1.a]), filter(nil), rowset=16
      access([t1.a]), partitions(p0)
      is_index_back=false, is_global_index=false, 
      range_key([t1.a], [t1.__pk_increment]), range(5,MAX ; 10,MAX), 
      range_cond([t1.a > 5], [t1.a <= 10])
select * from t1 where a > 5 and not(a > 10);
a
6
7
8
9
10
explain basic select * from t1 where a = 2 or not(a < 5 or a > 15);
Query Plan
===========================
|ID|OPERATOR        |NAME |
---------------------------
|0 |TABLE RANGE SCAN|t1(a)|
===========================
Outputs & filters:
-------------------------------------
  0 - output([t1.a]), filter(nil), rowset=16
      access([t1.a]), partitions(p0)
      is_index_back=false, is_global_index=false, 
      range_key([t1.a], [t1.__pk_increment]), range(2,MIN ; 2,MAX), (5,MIN ; 15,MAX), 
      range_cond([t1.a = 2 OR t1.a >= 5 AND t1.a <= 15])
select * from t1 where a = 2 or not(a < 5 or a > 15);
a
2
5
6
7
8
9
10
11
12
13
14
15
explain basic select * from t1 where a = 7 or not(a < 15 and a > 5);
Query Plan
===========================
|ID|OPERATOR        |NAME |
---------------------------
|0 |TABLE RANGE SCAN|t1(a)|
===========================
Outputs & filters:
-------------------------------------
  0 - output([t1.a]), filter(nil), rowset=16
      access([t1.a]), partitions(p0)
      is_index_back=false, is_global_index=false, 
      range_key([t1.a], [t1.__pk_increment]), range(NULL,MAX ; 5,MAX), (7,MIN ; 7,MAX), (15,MIN ; MAX,MAX), 
      range_cond([(T_OP_OR, t1.a = 7, t1.a >= 15, t1.a <= 5)])
select * from t1 where a = 7 or not(a < 15 and a > 5);
a
0
1
2
3
4
5
7
15
16
17
18
19
explain basic select * from t1 where NULL or not(a < 15 and a > 5);
Query Plan
===========================
|ID|OPERATOR        |NAME |
---------------------------
|0 |TABLE RANGE SCAN|t1(a)|
===========================
Outputs & filters:
-------------------------------------
  0 - output([t1.a]), filter(nil), rowset=16
      access([t1.a]), partitions(p0)
      is_index_back=false, is_global_index=false, 
      range_key([t1.a], [t1.__pk_increment]), range(NULL,MAX ; 5,MAX), (15,MIN ; MAX,MAX), 
      range_cond([t1.a >= 15 OR t1.a <= 5])
select * from t1 where NULL or not(a < 15 and a > 5);
a
0
1
2
3
4
5
15
16
17
18
19
explain basic select * from t1 where not(NULL and a > 5);
Query Plan
===========================
|ID|OPERATOR        |NAME |
---------------------------
|0 |TABLE RANGE SCAN|t1(a)|
===========================
Outputs & filters:
-------------------------------------
  0 - output([t1.a]), filter(nil), rowset=16
      access([t1.a]), partitions(p0)
      is_index_back=false, is_global_index=false, 
      range_key([t1.a], [t1.__pk_increment]), range(NULL,MAX ; 5,MAX), 
      range_cond([t1.a <= 5])
select * from t1 where not(NULL and a > 5);
a
0
1
2
3
4
5
explain basic select * from t1 where not(NULL or a);
Query Plan
=========================
|ID|OPERATOR       |NAME|
-------------------------
|0 |TABLE FULL SCAN|t1  |
=========================
Outputs & filters:
-------------------------------------
  0 - output([t1.a]), filter(nil), startup_filter([0]), rowset=16
      access([t1.a]), partitions(p0)
      is_index_back=false, is_global_index=false, 
      range_key([t1.__pk_increment]), range(MIN ; MAX)always true
select * from t1 where not(NULL or a);
a
explain basic select * from t1 where not(NULL and a);
Query Plan
=========================
|ID|OPERATOR       |NAME|
-------------------------
|0 |TABLE FULL SCAN|t1  |
=========================
Outputs & filters:
-------------------------------------
  0 - output([t1.a]), filter([(T_OP_NOT, t1.a)]), rowset=16
      access([t1.a]), partitions(p0)
      is_index_back=false, is_global_index=false, filter_before_indexback[false], 
      range_key([t1.__pk_increment]), range(MIN ; MAX)always true
select * from t1 where not(NULL and a);
a
0
explain basic select * from t1 where not((a < 5 or a < 10) and (not(a > 16) or a > 17));
Query Plan
===========================
|ID|OPERATOR        |NAME |
---------------------------
|0 |TABLE RANGE SCAN|t1(a)|
===========================
Outputs & filters:
-------------------------------------
  0 - output([t1.a]), filter(nil), rowset=16
      access([t1.a]), partitions(p0)
      is_index_back=false, is_global_index=false, 
      range_key([t1.a], [t1.__pk_increment]), range(10,MIN ; MAX,MAX), 
      range_cond([t1.a >= 5 AND t1.a >= 10 OR t1.a > 16 AND t1.a <= 17])
select * from t1 where not((a < 5 or a < 10) and (not(a > 16) or a > 17));
a
10
11
12
13
14
15
16
17
18
19
explain basic select * from t1 where not((a < 5 and a < 10) and (not(a > 16) or a > 17));
Query Plan
===========================
|ID|OPERATOR        |NAME |
---------------------------
|0 |TABLE RANGE SCAN|t1(a)|
===========================
Outputs & filters:
-------------------------------------
  0 - output([t1.a]), filter(nil), rowset=16
      access([t1.a]), partitions(p0)
      is_index_back=false, is_global_index=false, 
      range_key([t1.a], [t1.__pk_increment]), range(5,MIN ; MAX,MAX), 
      range_cond([(T_OP_OR, t1.a >= 5, t1.a >= 10, t1.a > 16 AND t1.a <= 17)])
select * from t1 where not((a < 5 and a < 10) and (not(a > 16) or a > 17));
a
5
6
7
8
9
10
11
12
13
14
15
16
17
18
19
explain basic select * from t1 where ((a between 5 and 15) and (not(a like 10)));
Query Plan
===========================
|ID|OPERATOR        |NAME |
---------------------------
|0 |TABLE RANGE SCAN|t1(a)|
===========================
Outputs & filters:
-------------------------------------
  0 - output([t1.a]), filter([(T_OP_NOT, (T_OP_LIKE, cast(t1.a, VARCHAR(1048576)), cast(10, VARCHAR(1048576)), '\\'))]), rowset=16
      access([t1.a]), partitions(p0)
      is_index_back=false, is_global_index=false, filter_before_indexback[false], 
      range_key([t1.a], [t1.__pk_increment]), range(5,MIN ; 15,MAX), 
      range_cond([t1.a >= 5], [t1.a <= 15])
select * from t1 where ((a between 5 and 15) and (not(a like 10)));
a
5
6
7
8
9
11
12
13
14
15
delete from t1 where a > 3;
select a, not(not(a)) from t1;
a	not(not(a))
NULL	NULL
0	0
1	1
2	1
3	1
explain basic select a, not(not(a)), not(a <= 2 and not(a)), not(a not like "1"), not (a not in (1,2)), not(a != 2) from t1 where not(not(a)) having not(not(a));
Query Plan
=========================
|ID|OPERATOR       |NAME|
-------------------------
|0 |TABLE FULL SCAN|t1  |
=========================
Outputs & filters:
-------------------------------------
  0 - output([t1.a], [(T_OP_NOT, (T_OP_NOT, t1.a))], [(T_OP_NOT, t1.a <= 2 AND (T_OP_NOT, t1.a))], [(T_OP_NOT, (T_OP_NOT, (T_OP_LIKE, cast(t1.a, VARCHAR(1048576)),
       '1', '\\')))], [(T_OP_NOT, (T_OP_NOT_IN, t1.a, (1, 2)))], [(T_OP_NOT, t1.a != 2)]), filter([t1.a]), rowset=16
      access([t1.a]), partitions(p0)
      is_index_back=false, is_global_index=false, filter_before_indexback[false], 
      range_key([t1.__pk_increment]), range(MIN ; MAX)always true
drop table t1;
