result_format: 4
use test;

drop table if exists t1,t2,t3,t4;
create table t1 (id char(16) not null default '', data int not null);
create table t2 (s char(16), i int, d double);


#### Case 1: Subselect arguments
insert into t2 values ("a", 1, 1.1), ("b", 2, 1.2), ("c", 3, 1.3)|

drop procedure if exists sub1|
drop procedure if exists sub2|
drop procedure if exists sub3|
create procedure sub1(id char(16), x int)
  insert into test.t1 values (id, x)|

create procedure sub2(id char(16))
begin
  declare x int;
  set x = (select sum(t.i) from test.t2 t);
  insert into test.t1 values (id, x);
end|
Warnings:
Warning	-1	Resolve error

create function sub3(i int) returns int deterministic
  return i+1|

select sub3((select max(i) from t2))|
+-------------------------------+
| sub3((select max(i) from t2)) |
+-------------------------------+
|                             4 |
+-------------------------------+

drop procedure sub1|
drop procedure sub2|
drop function sub3|
delete from t1|
delete from t2|

#### Case 2: A minimal, constant FUNCTION
drop function if exists e|
drop function if exists inc|
drop function if exists mul|
drop function if exists append|
drop function if exists fac|
drop function if exists fun|
create function e() returns double
  return 2.7182818284590452354|

set @e = e()|
select e(), @e|
+-------------------+-------------------+
| e()               | @e                |
+-------------------+-------------------+
| 2.718281828459045 | 2.718281828459045 |
+-------------------+-------------------+

create function inc(i int) returns int
  return i+1|
select inc(1), inc(99), inc(-71)|
+--------+---------+----------+
| inc(1) | inc(99) | inc(-71) |
+--------+---------+----------+
|      2 |     100 |      -70 |
+--------+---------+----------+

create function mul(x int, y int) returns int
  return x*y|
select mul(1,1), mul(3,5), mul(4711, 666)|
+----------+----------+----------------+
| mul(1,1) | mul(3,5) | mul(4711, 666) |
+----------+----------+----------------+
|        1 |       15 |        3137526 |
+----------+----------+----------------+

create function append(s1 char(8), s2 char(8)) returns char(16)
  return concat(s1, s2)|
select append("foo", "bar")|
+----------------------+
| append("foo", "bar") |
+----------------------+
| foobar               |
+----------------------+

create function fac(n int unsigned) returns bigint unsigned
begin
  declare f bigint unsigned default 1;
  while n > 1 do
    set f = f * n;
    set n = n - 1;
  end while;
  return f;
end|
select fac(1), fac(2), fac(5), fac(10)|
+--------+--------+--------+---------+
| fac(1) | fac(2) | fac(5) | fac(10) |
+--------+--------+--------+---------+
|      1 |      2 |    120 | 3628800 |
+--------+--------+--------+---------+

create function fun(d double, i int, u int unsigned) returns double
  return mul(inc(i), fac(u)) / e()|
select fun(2.3, 3, 5)|
+--------------------+
| fun(2.3, 3, 5)     |
+--------------------+
| 176.58213176229233 |
+--------------------+

insert into t2 values (append("xxx", "yyy"), mul(4,3), e())|
insert into t2 values (append("a", "b"), mul(2,mul(3,4)), fun(1.7, 4, 6))|

select * from t2 where s = append("a", "b")|
+------+------+--------------------+
| s    | i    | d                  |
+------+------+--------------------+
| ab   |   24 | 1324.3659882171924 |
+------+------+--------------------+
select * from t2 where i = mul(4,3) or i = mul(mul(3,4),2) order by i|
+--------+------+--------------------+
| s      | i    | d                  |
+--------+------+--------------------+
| xxxyyy |   12 |  2.718281828459045 |
| ab     |   24 | 1324.3659882171924 |
+--------+------+--------------------+
select * from t2 where d = e()|
+--------+------+-------------------+
| s      | i    | d                 |
+--------+------+-------------------+
| xxxyyy |   12 | 2.718281828459045 |
+--------+------+-------------------+
select * from t2 order by i|
+--------+------+--------------------+
| s      | i    | d                  |
+--------+------+--------------------+
| xxxyyy |   12 |  2.718281828459045 |
| ab     |   24 | 1324.3659882171924 |
+--------+------+--------------------+
delete from t2|

drop function e|
drop function inc|
drop function mul|
drop function append|
drop function fun|
drop function fac|

#### Case 3: The few characteristics we parse
drop procedure if exists chistics|
create procedure chistics()
    language sql
    modifies sql data
    not deterministic
    sql security definer
    comment 'Characteristics procedure test'
  insert into t1 values ("chistics", 1)|

show create procedure chistics|
Procedure	sql_mode	Create Procedure	character_set_client	collation_connection	Database Collation
chistics	STRICT_ALL_TABLES	CREATE PROCEDURE `chistics` (

) insert into t1 values ("chistics", 1)	utf8mb4	utf8mb4_general_ci	utf8mb4_general_ci
call chistics()|
select * from t1|
+----------+------+
| id       | data |
+----------+------+
| chistics |    1 |
+----------+------+
delete from t1|
## TODO: 未支持alter procedure
## alter procedure chistics sql security invoker|
## show create procedure chistics|
drop procedure chistics|

drop function if exists chistics|
create function chistics() returns int
    language sql
    deterministic
    sql security invoker
    comment 'Characteristics procedure test'
  return 42|

show create function chistics|
Function	sql_mode	Create Function	character_set_client	collation_connection	Database Collation
chistics	STRICT_ALL_TABLES	CREATE FUNCTION `chistics` (

) RETURNS int(11)return 42	utf8mb4	utf8mb4_general_ci	utf8mb4_general_ci
select chistics()|
+------------+
| chistics() |
+------------+
|         42 |
+------------+
## alter function chistics no sql comment 'Characteristics function test'|
show create function chistics|
Function	sql_mode	Create Function	character_set_client	collation_connection	Database Collation
chistics	STRICT_ALL_TABLES	CREATE FUNCTION `chistics` (

) RETURNS int(11)return 42	utf8mb4	utf8mb4_general_ci	utf8mb4_general_ci
drop function chistics|

#### Case 4: backticks
drop function if exists foo|
create function `foo` () returns int
  return 5|
select `foo` ()|
+----------+
| `foo` () |
+----------+
|        5 |
+----------+
drop function `foo`|

#### Case 5:
drop function if exists t1max|
create function t1max() returns int
begin
  declare x int;
  select max(data) from t1 into x;
  return x;
end|

insert into t1 values ("foo", 3), ("bar", 2), ("zip", 5), ("zap", 1)|
select t1max()|
+---------+
| t1max() |
+---------+
|       5 |
+---------+
drop function t1max|

drop table if exists t3|
create table t3 (
  v char(16) not null primary key,
  c int unsigned not null
)|

drop function if exists getcount|
create function getcount(s char(16)) returns int
begin
  declare x int;
  select count(*) from t3 where v = s into x;
  if x = 0 then
    insert into t3 values (s, 1);
  else
    update t3 set c = c+1 where v = s;
  end if;
  return x;
end|
## TODO: 嵌套事务
## select * from t1 where data = getcount("bar")|
select * from t3|
+---+---+
| v | c |
+---+---+
+---+---+
select getcount("zip")|
+-----------------+
| getcount("zip") |
+-----------------+
|               0 |
+-----------------+
select getcount("zip")|
+-----------------+
| getcount("zip") |
+-----------------+
|               1 |
+-----------------+
select * from t3|
+-----+---+
| v   | c |
+-----+---+
| zip | 2 |
+-----+---+
## select getcount(id) from t1 where data = 3|
## select getcount(id) from t1 where data = 5|
select * from t3|
+-----+---+
| v   | c |
+-----+---+
| zip | 2 |
+-----+---+
drop table t3|
drop function getcount|

#### Case 6: 
drop procedure if exists bug2267_4|
drop function if exists bug2267_4|
create procedure bug2267_4()
begin
  show create function bug2267_4;
end|

create function bug2267_4() returns int return 100|
call bug2267_4()|

drop procedure bug2267_4|
drop function bug2267_4|

#### Case 7:
drop function if exists bug2674|
create function bug2674() returns int
  return @@query_cache_size|

set @osbs = @@query_cache_size|
set global query_cache_size = 262000|
select bug2674()|
+-----------+
| bug2674() |
+-----------+
|    262000 |
+-----------+
drop function bug2674|
set global query_cache_size = @osbs|

#### Case 8:
drop function if exists bug2772|
create function bug2772() returns char(10) character set utf8
  return 'a'|

select bug2772()|
+-----------+
| bug2772() |
+-----------+
| a         |
+-----------+
drop function bug2772|

#### Case 9:
set @@sql_mode = ''|
drop procedure if exists bug2564_1|
create procedure bug2564_1()
    comment 'Joe''s procedure'
  insert into `t1` values ("foo", 1)|

set @@sql_mode = ''$
drop function if exists bug2564_3$
create function bug2564_3(x int, y int) returns int
  return x || y$

set @@sql_mode = default$
drop function if exists bug2564_4$
create function bug2564_4(x int, y int) returns int
  return x || y$

set @@sql_mode = ''|
show create procedure bug2564_1|
Procedure	sql_mode	Create Procedure	character_set_client	collation_connection	Database Collation
bug2564_1		CREATE PROCEDURE `bug2564_1` (

) insert into `t1` values ("foo", 1)	utf8mb4	utf8mb4_general_ci	utf8mb4_general_ci
show create function bug2564_3|
Function	sql_mode	Create Function	character_set_client	collation_connection	Database Collation
bug2564_3		CREATE FUNCTION `bug2564_3` (
  `x` int(11) DEFAULT NULL,
  `y` int(11) DEFAULT NULL
) RETURNS int(11)return x || y	utf8mb4	utf8mb4_general_ci	utf8mb4_general_ci
show create function bug2564_4|
Function	sql_mode	Create Function	character_set_client	collation_connection	Database Collation
bug2564_4	STRICT_ALL_TABLES	CREATE FUNCTION `bug2564_4` (
  `x` int(11) DEFAULT NULL,
  `y` int(11) DEFAULT NULL
) RETURNS int(11)return x || y	utf8mb4	utf8mb4_general_ci	utf8mb4_general_ci

drop procedure bug2564_1|
drop function bug2564_3|
drop function bug2564_4|

#### Case 10:
drop procedure if exists bug3788|
create function bug3788() returns date return cast("2005-03-04" as date)|
select bug3788()|
+------------+
| bug3788()  |
+------------+
| 2005-03-04 |
+------------+
drop function bug3788|

#### Case 11:
create function bug3788() returns binary(1) return 5|
select bug3788()|
+-----------+
| bug3788() |
+-----------+
| 5         |
+-----------+
drop function bug3788|

#### Case 12:
drop function if exists bug4487|
create function bug4487() returns char
begin
  declare v char;
  return v;
end|
select bug4487()|
+-----------+
| bug4487() |
+-----------+
|           |
+-----------+
drop function bug4487|

#### Case 13:
drop function if exists bug5240|
create function bug5240 () returns int
begin
  declare x int;
  declare c cursor for select data from t1 limit 1;
  open c;
  fetch c into x;
  close c;
  return x;
end|
delete from t1|
insert into t1 values ("answer", 42)|
select bug5240()|
+-----------+
| bug5240() |
+-----------+
|        42 |
+-----------+
drop function bug5240|

#### Case 14:
drop procedure if exists bug9902|
create function bug9902() returns int(11)
begin
  set @x = @x + 1;
  return @x;
end|

set @qcs1 = @@query_cache_size|
set global query_cache_size = 102400|
set @x = 1|
insert into t1 values ("qc", 42)|
select bug9902() from t1|
+-----------+
| bug9902() |
+-----------+
|         2 |
|         3 |
+-----------+
select bug9902() from t1|
+-----------+
| bug9902() |
+-----------+
|         4 |
|         5 |
+-----------+
select @x|
+------+
| @x   |
+------+
|    5 |
+------+

set global query_cache_size = @qcs1|
delete from t1|
drop function bug9902|

#### Case 15:
drop function if exists bug7648|
create function bug7648() returns bit(8) return 'a'|
select bug7648()|
+-----------+
| bug7648() |
+-----------+
| a         |
+-----------+
drop function bug7648|

#### Case 16:
drop function if exists bug8861|
create function bug8861(v1 int) returns year return v1|
select bug8861(05)|
+-------------+
| bug8861(05) |
+-------------+
|        2005 |
+-------------+
set @x = bug8861(05)|
select @x|
+------+
| @x   |
+------+
| 2005 |
+------+
drop function bug8861|

#### Case 17: user variables
drop function if exists my_func|
create function my_func()
  returns int
begin
  set @y1 = 123;
  return @y1;
end|

select my_func()|
+-----------+
| my_func() |
+-----------+
|       123 |
+-----------+
drop function my_func|

create function my_func()
  returns double
begin
  set @y2 = 6/4;
  return @y2;
end|
select my_func()|
+-----------+
| my_func() |
+-----------+
|       1.5 |
+-----------+
drop function my_func|

create function my_func()
  returns varchar(20)
begin
  set @y3 = 'my_func';
  return @y3;
end|
select my_func()|
+-----------+
| my_func() |
+-----------+
| my_func   |
+-----------+
drop function my_func|

create function my_func()
  returns varchar(20)
begin
  set @y4 = 6/4;
  return @y4;
end|
select my_func()|
+-----------+
| my_func() |
+-----------+
| 1.5       |
+-----------+
drop function my_func|

#### Case 18:
drop function if exists bug10055|
create function bug10055(v char(255)) returns char(255) return lower(v)|
select
  t.column_name,
  bug10055(t.column_name)
    from information_schema.columns as t
          where t.table_schema = 'test' and t.table_name = 't1'|
+-------------+-------------------------+
| column_name | bug10055(t.column_name) |
+-------------+-------------------------+
| id          | id                      |
| data        | data                    |
+-------------+-------------------------+
drop function bug10055|

#### Case 19:
drop function if exists f_bug11247|
drop procedure if exists p_bug11247|
create function f_bug11247(param int)
  returns int
return param + 1|

create procedure p_bug11247(lim int)
begin
  declare v int default 0;
  while v < lim do
    set v = f_bug11247(v);
  end while;
end|

call p_bug11247(10)|
drop function f_bug11247|
drop procedure p_bug11247|

#### Case 20:
drop function if exists bug9048|
create function bug9048(f1 char binary) returns char
begin
  set f1 = concat( 'hello', f1 );
  return f1;
end|
select bug9048('1')|
+--------------+
| bug9048('1') |
+--------------+
| h            |
+--------------+
drop function bug9048|

#### Case 22:
drop procedure if exists bug131333|
drop function if exists bug131333|
create procedure bug131333()
begin
  begin
    declare a int;
    select a;
    set a = 1;
    select a;
  end;
  begin
    declare b int;
    select b;
  end;
end|

create function bug131333()
  returns int
begin
  begin
    declare a int;
    set a = 1;
  end;
  begin
    declare b int;
    return b;
  end;
end|

call bug131333()|
select bug131333()|
+-------------+
| bug131333() |
+-------------+
|           0 |
+-------------+

drop procedure bug131333|
drop function bug131333|

#### Case 23:
drop function if exists bug12379|
drop procedure if exists bug12379_1|
drop procedure if exists bug12379_2|
drop procedure if exists bug12379_3|
drop table if exists t3|
create table t3 (c1 char(1) primary key not null)|

create function bug12379()
  returns integer
begin
   insert into t3 values('X');
   insert into t3 values('X');
   return 0;
end|

create procedure bug12379_1()
begin
   declare exit handler for sqlexception select 42;

   select bug12379();
END|
create procedure bug12379_2()
begin
   declare exit handler for sqlexception begin end;

   select bug12379();
end|
create procedure bug12379_3()
begin
   select bug12379();
end|

select bug12379()|
ERROR 23000: Duplicate entry 'X' for key 'PRIMARY'
select 1|
+---+
| 1 |
+---+
| 1 |
+---+

call bug12379_1()|
select 2|
+---+
| 2 |
+---+
| 2 |
+---+
call bug12379_2()|

select 3|
+---+
| 3 |
+---+
| 3 |
+---+

call bug12379_3()|
ERROR 23000: Duplicate entry 'X' for key 'PRIMARY'
select 4|
+---+
| 4 |
+---+
| 4 |
+---+

drop function bug12379|
drop procedure bug12379_1|
drop procedure bug12379_2|
drop procedure bug12379_3|
drop table t3|

#### Case 24:
drop table if exists t3|
drop procedure if exists bug7049_1|
drop procedure if exists bug7049_2|
drop procedure if exists bug7049_3|
drop procedure if exists bug7049_4|
drop function if exists bug7049_1|
drop function if exists bug7049_2|
create table t3 ( x int unique )|

create procedure bug7049_1()
begin
  insert into t3 values (42);
  insert into t3 values (42);
end|

create procedure bug7049_2()
begin
  declare exit handler for sqlexception
    select 'Caught it' as 'Result';

  call bug7049_1();
  select 'Missed it' as 'Result';
end|

create procedure bug7049_3()
  call bug7049_1()|

create procedure bug7049_4()
begin
  declare exit handler for sqlexception
    select 'Caught it' as 'Result';

  call bug7049_3();
  select 'Missed it' as 'Result';
end|

create function bug7049_1()
  returns int
begin
  insert into t3 values (42);
  insert into t3 values (42);
  return 42;
end|

create function bug7049_2()
  returns int
begin
  declare x int default 0;
  declare continue handler for sqlexception
  set x = 1;
  set x = bug7049_1();
  return x;
end|

call bug7049_2()|
select * from t3|
+------+
| x    |
+------+
|   42 |
+------+
delete from t3|
call bug7049_4()|
select * from t3|
+------+
| x    |
+------+
|   42 |
+------+

select bug7049_2()|
+-------------+
| bug7049_2() |
+-------------+
|           1 |
+-------------+

drop table t3|
drop procedure bug7049_1|
drop procedure bug7049_2|
drop procedure bug7049_3|
drop procedure bug7049_4|
drop function bug7049_1|
drop function bug7049_2|

#### Case 25:
drop function if exists bug10100f|
drop procedure if exists bug10100p|
drop procedure if exists bug10100t|
drop procedure if exists bug10100pt|
drop procedure if exists bug10100pv|
## drop procedure if exists bug10100pd|
drop procedure if exists bug10100pc|
create function bug10100f(prm int) returns int
begin
  if prm > 1 then
    return prm * bug10100f(prm - 1);
  end if;
  return 1;
end|
create procedure bug10100p(prm int, inout res int)
begin
  set res = res * prm;
  if prm > 1 then
    call bug10100p(prm - 1, res);  
  end if;
end|
create procedure bug10100t(prm int)
begin
  declare res int;
  set res = 1;
  call bug10100p(prm, res);
  select res;
end|

drop table if exists t3|
drop view if exists v1|
create table t3 (a int)|
insert into t3 values (0)|

create view v1 as select a from t3|

create procedure bug10100pt(level int, lim int)
  begin
  if level < lim then
    update t3 set a=level;
    call bug10100pt(level+1, lim);
  else
    select * from t3;
  end if;
end|

create procedure bug10100pv(level int, lim int)
begin
  if level < lim then
    update v1 set a=level;
    call bug10100pv(level+1, lim);
  else
    select * from v1;
  end if;
end|

create procedure bug10100pc(level int, lim int)
begin
  declare lv int;
  declare c cursor for select a from t3;
  open c;
  if level < lim then
    select level;
    fetch c into lv;
    select lv;
    update t3 set a=level+lv;
    call bug10100pc(level+1, lim);
  else
    select * from t3;
  end if;
  close c;
end|

set @@max_sp_recursion_depth=4|
select @@max_sp_recursion_depth|
+--------------------------+
| @@max_sp_recursion_depth |
+--------------------------+
|                        4 |
+--------------------------+
select bug10100f(3)|
ERROR HY000: Recursive stored functions are not allowed.
select bug10100f(6)|
ERROR HY000: Recursive stored functions are not allowed.
call bug10100t(5)|
call bug10100pt(1,5)|
call bug10100pv(1,5)|
ERROR 0A000: DML operation with View/Virtual Table/Temporary Table not supported
update t3 set a=1|
select * from t3|
+------+
| a    |
+------+
|    1 |
+------+
update t3 set a=1|
call bug10100pc(1,5)|
select * from t3|
+------+
| a    |
+------+
|   11 |
+------+
set @@max_sp_recursion_depth=0|
select @@max_sp_recursion_depth|
+--------------------------+
| @@max_sp_recursion_depth |
+--------------------------+
|                        0 |
+--------------------------+
call bug10100t(5)|
ERROR HY000: Recursive limit 0 (as set by the max_sp_recursion_depth variable) was exceeded for routine

drop function bug10100f|
drop procedure bug10100p|
drop procedure bug10100t|
drop procedure bug10100pt|
drop procedure bug10100pv|
drop procedure bug10100pc|
drop view v1|

#### Case 26:
drop function if exists bug15728|
drop table if exists t3|
create table t3 (
  id int not null auto_increment,
  primary key (id)
)|
create function bug15728() returns int(11)
  return last_insert_id()|

insert into t3 values (0)|
select last_insert_id()|
+------------------+
| last_insert_id() |
+------------------+
|                1 |
+------------------+
select bug15728()|
+------------+
| bug15728() |
+------------+
|          0 |
+------------+

drop function bug15728|
drop table t3|

#### Case 27:
DROP FUNCTION IF EXISTS bug18037_f1|
DROP PROCEDURE IF EXISTS bug18037_p1|
DROP PROCEDURE IF EXISTS bug18037_p2|
CREATE FUNCTION bug18037_f1() RETURNS INT
BEGIN
  RETURN @@identity;
END|

CREATE PROCEDURE bug18037_p1()
BEGIN
  DECLARE v INT DEFAULT @@identity;
END|

CREATE PROCEDURE bug18037_p2()
BEGIN
  CASE @@identity
  WHEN -1 THEN
    SELECT 0;
  ELSE
    SELECT 1;
  END CASE;
END|

SELECT bug18037_f1()|
+---------------+
| bug18037_f1() |
+---------------+
|             1 |
+---------------+
CALL bug18037_p1()|
CALL bug18037_p2()|

DROP FUNCTION bug18037_f1|
DROP PROCEDURE bug18037_p1|
DROP PROCEDURE bug18037_p2|

#### Case 28:
use test|
create table t3 (i int)|
insert into t3 values (1), (2)|
drop database if exists mysqltest1|
create database mysqltest1|
use mysqltest1|
create function bug17199() returns varchar(2) deterministic return 'ok'|
use test|
select *, mysqltest1.bug17199() from t3|
+------+-----------------------+
| i    | mysqltest1.bug17199() |
+------+-----------------------+
|    1 | ok                    |
|    2 | ok                    |
+------+-----------------------+
use mysqltest1|
create function bug18444(i int) returns int
-- no sql
deterministic return i + 1|
use test|
select mysqltest1.bug18444(i) from t3|
+------------------------+
| mysqltest1.bug18444(i) |
+------------------------+
|                      2 |
|                      3 |
+------------------------+
drop database if exists mysqltest1|
create database mysqltest1 charset=utf8|
drop database if exists mysqltest2|
create database mysqltest2 charset=utf8|
## TODO: not support DDL
create procedure mysqltest1.p1()
begin
  -- alter database mysqltest1 character set utf8;
end|
use mysqltest1|
call p1()|
alter database mysqltest1 character set utf8|
use mysqltest2|
call mysqltest1.p1()|
use test|
drop database mysqltest1|
drop database mysqltest2|

#### Case 29:
use test|
drop procedure if exists bug19862|
CREATE TABLE t11 (a INT)|
CREATE TABLE t12 (a INT)|
CREATE FUNCTION bug19862(x INT) RETURNS INT
  BEGIN
    INSERT INTO t11 VALUES (x);
    RETURN x+1;
  END|
INSERT INTO t12 VALUES (1), (2)|
## TODO: 嵌套事务
## SELECT bug19862(a) FROM t12 ORDER BY 1|
SELECT * FROM t11|
+------+
| a    |
+------+
+------+
DROP TABLE t11, t12|
DROP FUNCTION bug19862|

#### Case 30:
DROP TABLE IF EXISTS t3|
CREATE TABLE t3 (
  Member_ID varchar(15) NOT NULL,
  PRIMARY KEY (Member_ID)
)|
DROP TABLE IF EXISTS t4|
CREATE TABLE t4 (
  ID int(10) unsigned NOT NULL auto_increment,
  Member_ID varchar(15) NOT NULL default '',
  Action varchar(12) NOT NULL,
  Action_Date datetime NOT NULL,
  Track varchar(15) default NULL,
  User varchar(12) default NULL,
  Date_Updated timestamp NOT NULL default CURRENT_TIMESTAMP on update
    CURRENT_TIMESTAMP,
  PRIMARY KEY (ID),
  KEY Action (Action),
  KEY Action_Date (Action_Date)
)|

INSERT INTO t3(Member_ID) VALUES
  ('111111'), ('222222'), ('333333'), ('444444'), ('555555'), ('666666')|

INSERT INTO t4(Member_ID, Action, Action_Date, Track) VALUES
  ('111111', 'Disenrolled', '2006-03-01', 'CAD' ),
  ('111111', 'Enrolled', '2006-03-01', 'CAD' ),
  ('111111', 'Disenrolled', '2006-07-03', 'CAD' ),
  ('222222', 'Enrolled', '2006-03-07', 'CAD' ),
  ('222222', 'Enrolled', '2006-03-07', 'CHF' ),
  ('222222', 'Disenrolled', '2006-08-02', 'CHF' ),
  ('333333', 'Enrolled', '2006-03-01', 'CAD' ),
  ('333333', 'Disenrolled', '2006-03-01', 'CAD' ),
  ('444444', 'Enrolled', '2006-03-01', 'CAD' ),
  ('555555', 'Disenrolled', '2006-03-01', 'CAD' ),
  ('555555', 'Enrolled', '2006-07-21', 'CAD' ),
  ('555555', 'Disenrolled', '2006-03-01', 'CHF' ),
  ('666666', 'Enrolled', '2006-02-09', 'CAD' ),
  ('666666', 'Enrolled', '2006-05-12', 'CHF' ),
  ('666666', 'Disenrolled', '2006-06-01', 'CAD' )|

DROP FUNCTION IF EXISTS bug21493|

CREATE FUNCTION bug21493(paramMember VARCHAR(15)) RETURNS varchar(45)
BEGIN
DECLARE tracks VARCHAR(45);
SELECT GROUP_CONCAT(Track SEPARATOR ', ') FROM t4
  WHERE Member_ID=paramMember AND Action='Enrolled' AND 
        (Track,Action_Date) IN (SELECT Track, MAX(Action_Date) FROM t4
                                  WHERE Member_ID=paramMember GROUP BY Track)
                                  INTO tracks;
RETURN tracks;
END|
SELECT bug21493('111111')|
+--------------------+
| bug21493('111111') |
+--------------------+
| NULL               |
+--------------------+
SELECT bug21493('222222')|
+--------------------+
| bug21493('222222') |
+--------------------+
| CAD                |
+--------------------+
## TODO: 嵌套事务
## SELECT bug21493(Member_ID) FROM t3|
DROP FUNCTION bug21493|
DROP TABLE t3,t4|

#### Case 31:
drop function if exists func_20028_a|
drop function if exists func_20028_b|
drop function if exists func_20028_c|
drop procedure if exists proc_20028_a|
drop procedure if exists proc_20028_b|
drop procedure if exists proc_20028_c|
drop table if exists table_20028|
create table table_20028 (i int)|
SET @save_sql_mode=@@sql_mode|
SET @@sql_mode=''|
create function func_20028_a() returns integer
begin
  declare temp integer;
  select i from table_20028 limit 1 into temp;
  return ifnull(temp, 0);
end|
create function func_20028_b() returns integer
begin
  return func_20028_a();
end|
create function func_20028_c() returns integer
begin
  declare div_zero integer;
  set @@SQL_MODE='STRICT_ALL_TABLES';
  select 1/0 into div_zero;
  return div_zero;
end|
create procedure proc_20028_a()
begin
  declare temp integer;
  select i from table_20028 limit 1 into temp;
end|
create procedure proc_20028_b()
begin
  call proc_20028_a();
end|
create procedure proc_20028_c()
begin
  declare div_zero integer;
  set @@SQL_MODE='STRICT_ALL_TABLES';
  select 1/0 into div_zero;
end|
select func_20028_a()|
+----------------+
| func_20028_a() |
+----------------+
|              0 |
+----------------+
select func_20028_b()|
+----------------+
| func_20028_b() |
+----------------+
|              0 |
+----------------+
select func_20028_c()|
+----------------+
| func_20028_c() |
+----------------+
|           NULL |
+----------------+
call proc_20028_a()|
call proc_20028_b()|

call proc_20028_c()|

SET @@sql_mode='STRICT_ALL_TABLES'|

drop function func_20028_a|
drop function func_20028_b|
drop function func_20028_c|
drop procedure proc_20028_a|
drop procedure proc_20028_b|
drop procedure proc_20028_c|

create function func_20028_a() returns integer
begin
  declare temp integer;
  select i from table_20028 limit 1 into temp;
  return ifnull(temp, 0);
end|

create function func_20028_b() returns integer
begin
  return func_20028_a();
end|

create function func_20028_c() returns integer
begin
  declare div_zero integer;
  set @@SQL_MODE='';
  select 1/0 into div_zero;
  return div_zero;
end|

create procedure proc_20028_a()
begin
  declare temp integer;
  select i from table_20028 limit 1 into temp;
end|

create procedure proc_20028_b()
begin
  call proc_20028_a();
end|

create procedure proc_20028_c()
begin
  declare div_zero integer;
  set @@SQL_MODE='';
  select 1/0 into div_zero;
end|

select func_20028_a()|
+----------------+
| func_20028_a() |
+----------------+
|              0 |
+----------------+
select func_20028_b()|
+----------------+
| func_20028_b() |
+----------------+
|              0 |
+----------------+
select func_20028_c()|
+----------------+
| func_20028_c() |
+----------------+
|           NULL |
+----------------+
call proc_20028_a()|
call proc_20028_b()|
call proc_20028_c()|

SET @@sql_mode=@save_sql_mode|

drop function func_20028_a|
drop function func_20028_b|
drop function func_20028_c|
drop procedure proc_20028_a|
drop procedure proc_20028_b|
drop procedure proc_20028_c|
drop table table_20028|

#### Case 32:
drop function if exists pi;
create function pi() returns varchar(50)
return "pie, my favorite desert.";
SET @save_sql_mode=@@sql_mode;
SET @@SQL_MODE='';
select pi(), pi ();
+--------------------------+--------------------------+
| pi()                     | pi ()                    |
+--------------------------+--------------------------+
| pie, my favorite desert. | pie, my favorite desert. |
+--------------------------+--------------------------+
select test.pi(), test.pi ();
+--------------------------+--------------------------+
| test.pi()                | test.pi ()               |
+--------------------------+--------------------------+
| pie, my favorite desert. | pie, my favorite desert. |
+--------------------------+--------------------------+
SET @@SQL_MODE='';
select pi(), pi ();
+--------------------------+--------------------------+
| pi()                     | pi ()                    |
+--------------------------+--------------------------+
| pie, my favorite desert. | pie, my favorite desert. |
+--------------------------+--------------------------+
select test.pi(), test.pi ();
+--------------------------+--------------------------+
| test.pi()                | test.pi ()               |
+--------------------------+--------------------------+
| pie, my favorite desert. | pie, my favorite desert. |
+--------------------------+--------------------------+
SET @@sql_mode=@save_sql_mode;
drop function pi;

#### Case 33:
DROP TABLE IF EXISTS bug23760|
DROP TABLE IF EXISTS bug23760_log|
DROP PROCEDURE IF EXISTS bug23760_update_log|
DROP PROCEDURE IF EXISTS bug23760_test_row_count|
DROP FUNCTION IF EXISTS bug23760_rc_test|
CREATE TABLE bug23760 (
  id INT NOT NULL AUTO_INCREMENT ,
  num INT NOT NULL ,
  PRIMARY KEY ( id ) 
)|
CREATE TABLE bug23760_log (
 id INT NOT NULL AUTO_INCREMENT ,
 reason VARCHAR(50)NULL ,
 ammount INT NOT NULL ,
  PRIMARY KEY ( id ) 
)|
CREATE PROCEDURE bug23760_update_log(r Varchar(50), a INT)
BEGIN
  INSERT INTO bug23760_log (reason, ammount) VALUES(r, a);
END|
CREATE PROCEDURE bug23760_test_row_count()
BEGIN
  UPDATE bug23760 SET num = num + 1;
  CALL bug23760_update_log('Test is working', ROW_COUNT());
  UPDATE bug23760 SET num = num - 1;
END|
CREATE PROCEDURE bug23760_test_row_count2(level INT)
BEGIN
  IF level THEN
    UPDATE bug23760 SET num = num + 1;
    CALL bug23760_update_log('Test2 is working', ROW_COUNT());
    CALL bug23760_test_row_count2(level - 1);
  END IF;
END|
CREATE FUNCTION bug23760_rc_test(in_var INT) RETURNS INT RETURN in_var|

INSERT INTO bug23760 (num) VALUES (0), (1), (1), (2), (3), (5), (8)|
SELECT ROW_COUNT()|
+-------------+
| ROW_COUNT() |
+-------------+
|           7 |
+-------------+

CALL bug23760_test_row_count()|
SELECT * FROM bug23760_log ORDER BY id|
+----+-----------------+---------+
| id | reason          | ammount |
+----+-----------------+---------+
|  1 | Test is working |       7 |
+----+-----------------+---------+

SET @save_max_sp_recursion= @@max_sp_recursion_depth|
SELECT @save_max_sp_recursion|
+------------------------+
| @save_max_sp_recursion |
+------------------------+
|                      0 |
+------------------------+
SET max_sp_recursion_depth= 5|
SELECT @@max_sp_recursion_depth|
+--------------------------+
| @@max_sp_recursion_depth |
+--------------------------+
|                        5 |
+--------------------------+
CALL bug23760_test_row_count2(2)|
SELECT ROW_COUNT()|
+-------------+
| ROW_COUNT() |
+-------------+
|           0 |
+-------------+
SELECT * FROM bug23760_log ORDER BY id|
+----+------------------+---------+
| id | reason           | ammount |
+----+------------------+---------+
|  1 | Test is working  |       7 |
|  2 | Test2 is working |       7 |
|  3 | Test2 is working |       7 |
+----+------------------+---------+
SELECT * FROM bug23760 ORDER by ID|
+----+-----+
| id | num |
+----+-----+
|  1 |   2 |
|  2 |   3 |
|  3 |   3 |
|  4 |   4 |
|  5 |   5 |
|  6 |   7 |
|  7 |  10 |
+----+-----+
SET max_sp_recursion_depth= @save_max_sp_recursion|

SELECT bug23760_rc_test(123)|
+-----------------------+
| bug23760_rc_test(123) |
+-----------------------+
|                   123 |
+-----------------------+
INSERT INTO bug23760 (num) VALUES (13), (21), (34), (55)|

SELECT bug23760_rc_test(ROW_COUNT())|
+-------------------------------+
| bug23760_rc_test(ROW_COUNT()) |
+-------------------------------+
|                             4 |
+-------------------------------+

DROP TABLE bug23760, bug23760_log|
DROP PROCEDURE bug23760_update_log|
DROP PROCEDURE bug23760_test_row_count|
DROP PROCEDURE bug23760_test_row_count2|
DROP FUNCTION bug23760_rc_test|

#### Case 34:
drop function if exists func_8407_a|
drop function if exists func_8407_b|
create function func_8407_a() returns int
begin
  declare x int;
  declare continue handler for sqlexception
  begin
  end;
  select 1 from no_such_view limit 1 into x;
  return x;
end|

create function func_8407_b() returns int
begin
  declare x int default 0;
  declare continue handler for sqlstate '42S02'
  begin
    set x= x+1000;
  end;
  case (select 1 from no_such_view limit 1)
    when 1 then set x= x+1;
    when 2 then set x= x+2;
    else set x= x+100;
  end case;
  set x=x + 500;
  return x;
end|
Warnings:
Warning	-1	Resolve error

## TODO: handle exception
## select func_8407_a()|
## TODO: subquery
## select func_8407_b()|
drop function func_8407_a|
drop function func_8407_b|

#### Case 35:
DROP FUNCTION IF EXISTS bug25373|
CREATE FUNCTION bug25373(p1 INTEGER) RETURNS INTEGER
-- LANGUAGE SQL
DETERMINISTIC
RETURN p1;|
CREATE TABLE t3 (f1 INT, f2 FLOAT)|
INSERT INTO t3 VALUES (1, 3.4), (1, 2), (1, 0.9), (2, 8), (2, 7)|
SELECT SUM(f2), bug25373(f1) FROM t3 GROUP BY bug25373(f1) WITH ROLLUP|
+--------------------+--------------+
| SUM(f2)            | bug25373(f1) |
+--------------------+--------------+
|  6.300000071525574 |            1 |
|                 15 |            2 |
| 21.300000071525574 |            1 |
+--------------------+--------------+
DROP FUNCTION bug25373|
DROP TABLE t3|

#### Case 36:
drop function if exists bug20777|
drop table if exists examplebug20777|
create function bug20777(f1 bigint unsigned) returns bigint unsigned
begin
  set f1 = (f1 - 10); set f1 = (f1 + 10);
return f1;
end|
select bug20777(9223372036854775803) as '9223372036854775803   2**63-5';
+-------------------------------+
| 9223372036854775803   2**63-5 |
+-------------------------------+
|           9223372036854775803 |
+-------------------------------+
select bug20777(9223372036854775804) as '9223372036854775804   2**63-4';
+-------------------------------+
| 9223372036854775804   2**63-4 |
+-------------------------------+
|           9223372036854775804 |
+-------------------------------+
select bug20777(9223372036854775805) as '9223372036854775805   2**63-3';
+-------------------------------+
| 9223372036854775805   2**63-3 |
+-------------------------------+
|           9223372036854775805 |
+-------------------------------+
select bug20777(9223372036854775806) as '9223372036854775806   2**63-2';
+-------------------------------+
| 9223372036854775806   2**63-2 |
+-------------------------------+
|           9223372036854775806 |
+-------------------------------+
select bug20777(9223372036854775807) as '9223372036854775807   2**63-1';
+-------------------------------+
| 9223372036854775807   2**63-1 |
+-------------------------------+
|           9223372036854775807 |
+-------------------------------+
select bug20777(9223372036854775808) as '9223372036854775808   2**63+0';
+-------------------------------+
| 9223372036854775808   2**63+0 |
+-------------------------------+
|           9223372036854775808 |
+-------------------------------+
select bug20777(9223372036854775809) as '9223372036854775809   2**63+1';
+-------------------------------+
| 9223372036854775809   2**63+1 |
+-------------------------------+
|           9223372036854775809 |
+-------------------------------+
select bug20777(9223372036854775810) as '9223372036854775810   2**63+2';
+-------------------------------+
| 9223372036854775810   2**63+2 |
+-------------------------------+
|           9223372036854775810 |
+-------------------------------+
select bug20777(-9223372036854775808) as 'lower bounds signed bigint';
ERROR 22003: BIGINT UNSIGNED value is out of range in ''(0 - 10)''
select bug20777(9223372036854775807) as 'upper bounds signed bigint';
+----------------------------+
| upper bounds signed bigint |
+----------------------------+
|        9223372036854775807 |
+----------------------------+
select bug20777(0) as 'lower bounds unsigned bigint';
ERROR 22003: BIGINT UNSIGNED value is out of range in ''(0 - 10)''
select bug20777(18446744073709551615) as 'upper bounds unsigned bigint';
+------------------------------+
| upper bounds unsigned bigint |
+------------------------------+
|         18446744073709551615 |
+------------------------------+
select bug20777(18446744073709551616) as 'upper bounds unsigned bigint + 1';
+----------------------------------+
| upper bounds unsigned bigint + 1 |
+----------------------------------+
|             18446744073709551615 |
+----------------------------------+
select bug20777(-1) as 'lower bounds unsigned bigint - 1';
ERROR 22003: BIGINT UNSIGNED value is out of range in ''(0 - 10)''

select bug20777(18446744073709551613)+1;
+----------------------------------+
| bug20777(18446744073709551613)+1 |
+----------------------------------+
|             18446744073709551614 |
+----------------------------------+
drop function bug20777;

#### Case 37:
DROP FUNCTION IF EXISTS bug5274_f1|
DROP FUNCTION IF EXISTS bug5274_f2|
CREATE FUNCTION bug5274_f1(p1 CHAR) RETURNS CHAR
  RETURN CONCAT(p1, p1)|

CREATE FUNCTION bug5274_f2() RETURNS CHAR
BEGIN
  DECLARE v1 INT DEFAULT 0;
  DECLARE v2 CHAR DEFAULT 'x';
  WHILE v1 < 30 DO
    SET v1 = v1 + 1;
    SET v2 = bug5274_f1(v2);
  END WHILE;
  RETURN v2;
END|

SELECT bug5274_f2()|
+--------------+
| bug5274_f2() |
+--------------+
| x            |
+--------------+

DROP FUNCTION bug5274_f1|
DROP FUNCTION bug5274_f2|

#### Case 38:
drop table t1,t2;
CREATE TABLE t1 (a int auto_increment primary key) engine=MyISAM;
Warnings:
Warning	1286	Unknown storage engine 'MyISAM'
CREATE TABLE t2 (a int auto_increment primary key, b int) engine=innodb;
Warnings:
Warning	1286	Unknown storage engine 'innodb'
set @a=0;
CREATE function bug27354() RETURNS int not deterministic
begin
insert into t1 values (null);
set @a=@a+1;
return @a;
end|
update t2 set b=1 where a=bug27354();
select count(t_1.a),count(t_2.a) from t1 as t_1, t2 as t_2 /* must be 0,0 */;
+--------------+--------------+
| count(t_1.a) | count(t_2.a) |
+--------------+--------------+
|            0 |            0 |
+--------------+--------------+
insert into t2 values (1,1),(2,2),(3,3);
## TODO: 嵌套事务
## update t2 set b=-b where a=bug27354();
select * from t2 /* must return 1,-1 ... */;
+---+------+
| a | b    |
+---+------+
| 1 |    1 |
| 2 |    2 |
| 3 |    3 |
+---+------+
select count(*) from t1 /* must be 3 */;
+----------+
| count(*) |
+----------+
|        0 |
+----------+

drop table t1,t2;
drop function bug27354;

#### Case 39:
DROP TABLE IF EXISTS t1;
DROP FUNCTION IF EXISTS metered;
DROP VIEW IF EXISTS v1;
CREATE TABLE t1 (a INT);
INSERT INTO t1 VALUES (1),(2);

CREATE FUNCTION metered(a INT) RETURNS INT RETURN 12;

CREATE VIEW v1 AS SELECT metered(a) as metered FROM t1;

SHOW CREATE VIEW v1;
View	Create View	character_set_client	collation_connection
v1	CREATE VIEW `v1` AS select test.metered(`test`.`t1`.`a`) AS `metered` from `test`.`t1`	utf8mb4	utf8mb4_general_ci

DROP VIEW v1;
DROP FUNCTION metered;
DROP TABLE t1;

#### Case 40:
DROP FUNCTION IF EXISTS f1;
DROP FUNCTION IF EXISTS f2;
DROP TABLE IF EXISTS t1;
DROP TABLE IF EXISTS v1;
CREATE FUNCTION f1() RETURNS INT DETERMINISTIC RETURN 2;
CREATE FUNCTION f2(I INT) RETURNS INT DETERMINISTIC RETURN 3;
CREATE TABLE t1 (c1 INT, INDEX(c1));
INSERT INTO t1 VALUES (1), (2), (3), (4), (5);
CREATE VIEW v1 AS SELECT c1 FROM t1;

EXPLAIN SELECT * FROM t1 WHERE c1=1;
Query Plan
=====================================
|ID|OPERATOR  |NAME  |EST. ROWS|COST|
-------------------------------------
|0 |TABLE SCAN|t1(c1)|1        |36  |
=====================================

Outputs & filters: 
-------------------------------------
  0 - output([t1.c1]), filter(nil), 
      access([t1.c1]), partitions(p0)

EXPLAIN SELECT * FROM t1 WHERE c1=f1();
Query Plan
=====================================
|ID|OPERATOR  |NAME  |EST. ROWS|COST|
-------------------------------------
|0 |TABLE SCAN|t1(c1)|1        |36  |
=====================================

Outputs & filters: 
-------------------------------------
  0 - output([t1.c1]), filter([t1.c1 = test.f1()]), 
      access([t1.c1]), partitions(p0)

EXPLAIN SELECT * FROM v1 WHERE c1=1;
Query Plan
=====================================
|ID|OPERATOR  |NAME  |EST. ROWS|COST|
-------------------------------------
|0 |TABLE SCAN|t1(c1)|1        |36  |
=====================================

Outputs & filters: 
-------------------------------------
  0 - output([t1.c1]), filter(nil), 
      access([t1.c1]), partitions(p0)

EXPLAIN SELECT * FROM v1 WHERE c1=f1();
Query Plan
=====================================
|ID|OPERATOR  |NAME  |EST. ROWS|COST|
-------------------------------------
|0 |TABLE SCAN|t1(c1)|1        |36  |
=====================================

Outputs & filters: 
-------------------------------------
  0 - output([t1.c1]), filter([t1.c1 = test.f1()]), 
      access([t1.c1]), partitions(p0)

EXPLAIN SELECT * FROM t1 WHERE c1=f2(10);
Query Plan
===================================
|ID|OPERATOR  |NAME|EST. ROWS|COST|
-----------------------------------
|0 |TABLE SCAN|t1  |1        |38  |
===================================

Outputs & filters: 
-------------------------------------
  0 - output([t1.c1]), filter([t1.c1 = test.f2(10)]), 
      access([t1.c1]), partitions(p0)

EXPLAIN SELECT * FROM t1 WHERE c1=f2(c1);
Query Plan
===================================
|ID|OPERATOR  |NAME|EST. ROWS|COST|
-----------------------------------
|0 |TABLE SCAN|t1  |1        |38  |
===================================

Outputs & filters: 
-------------------------------------
  0 - output([t1.c1]), filter([t1.c1 = test.f2(t1.c1)]), 
      access([t1.c1]), partitions(p0)

EXPLAIN SELECT * FROM t1 WHERE c1=f2(rand());
Query Plan
===================================
|ID|OPERATOR  |NAME|EST. ROWS|COST|
-----------------------------------
|0 |TABLE SCAN|t1  |5        |37  |
===================================

Outputs & filters: 
-------------------------------------
  0 - output([t1.c1]), filter([t1.c1 = test.f2(rand())]), 
      access([t1.c1]), partitions(p0)


DROP VIEW v1;
DROP FUNCTION f1;
DROP FUNCTION f2;
DROP TABLE t1;

#### Case 41:
drop function if exists f1|
drop view if exists v1|
create function f1()
    returns int(11)
not deterministic
-- contains sql
-- sql security definer
comment ''
begin
  declare x int(11);
  set x=-1;
   return x;
end|
create view v1 as select 1 as one, f1() as days;
show create view test.v1;
View	Create View	character_set_client	collation_connection
v1	CREATE VIEW `v1` AS select 1 AS `one`,test.f1() AS `days`	utf8mb4	utf8mb4_general_ci
select column_name from information_schema.columns where table_name='v1' and table_schema='test';
+-------------+
| column_name |
+-------------+
+-------------+
drop view v1;
drop function f1;

#### Case 42:
DROP TABLE IF EXISTS t1;
DROP FUNCTION IF EXISTS f1;
DROP FUNCTION IF EXISTS f2;
DROP FUNCTION IF EXISTS f3;
DROP FUNCTION IF EXISTS f4;
CREATE TABLE t1(c1 INT);
INSERT INTO t1 VALUES (1), (2), (3);
CREATE FUNCTION f1()
  RETURNS INT
  NOT DETERMINISTIC
    RETURN 1;
CREATE FUNCTION f2(p INT)
  RETURNS INT
  NOT DETERMINISTIC
    RETURN 1;
CREATE FUNCTION f3()
  RETURNS INT
  DETERMINISTIC
    RETURN 1;
CREATE FUNCTION f4(p INT)
  RETURNS INT
  DETERMINISTIC
    RETURN 1;
SELECT f1() AS a FROM t1 GROUP BY a;
+------+
| a    |
+------+
|    1 |
+------+
SELECT f2(@a) AS a FROM t1 GROUP BY a;
+------+
| a    |
+------+
|    1 |
+------+
SELECT f3() AS a FROM t1 GROUP BY a;
+------+
| a    |
+------+
|    1 |
+------+
SELECT f4(0) AS a FROM t1 GROUP BY a;
+------+
| a    |
+------+
|    1 |
+------+
SELECT f4(@a) AS a FROM t1 GROUP BY a;
+------+
| a    |
+------+
|    1 |
+------+
DROP TABLE t1;
DROP FUNCTION f1;
DROP FUNCTION f2;
DROP FUNCTION f3;
DROP FUNCTION f4;

#### Case 43:
DROP TABLE IF EXISTS t1;
DROP TABLE IF EXISTS t2;
DROP FUNCTION IF EXISTS f1;
CREATE TABLE t1 (
   id INT(10) UNSIGNED NOT NULL AUTO_INCREMENT,
   barcode INT(8) UNSIGNED ZEROFILL nOT NULL,
   PRIMARY KEY  (id),
   UNIQUE KEY barcode (barcode)
);
INSERT INTO t1 (id, barcode) VALUES (1, 12345678);
INSERT INTO t1 (id, barcode) VALUES (2, 12345679);
CREATE TABLE test.t2 (
   id INT(10) UNSIGNED NOT NULL AUTO_INCREMENT,
   barcode BIGINT(11) UNSIGNED ZEROFILL NOT NULL,
   PRIMARY KEY  (id)
);
INSERT INTO test.t2 (id, barcode) VALUES (1, 12345106708);
INSERT INTO test.t2 (id, barcode) VALUES (2, 12345106709);
CREATE FUNCTION f1(p INT(8))
  RETURNS BIGINT(11) UNSIGNED
  -- READS SQL DATA
    RETURN FLOOR(p/1000)*1000000 + 100000 + FLOOR((p MOD 1000)/10)*100 + (p MOD 10);
SELECT DISTINCT t1.barcode, f1(t1.barcode) FROM t1 INNER JOIN t2 ON f1(t1.barcode) = t2.barcode WHERE t1.barcode=12345678;
+----------+----------------+
| barcode  | f1(t1.barcode) |
+----------+----------------+
| 12345678 |    12345106708 |
+----------+----------------+
DROP TABLE t1;
DROP TABLE t2;
DROP FUNCTION f1;

#### Case 44:
DROP TABLE IF EXISTS t1;
DROP FUNCTION IF EXISTS f1;
CREATE TABLE t1(id INT);
INSERT INTO t1 VALUES (1), (2), (3);
CREATE FUNCTION f1()
  RETURNS DATETIME
  NOT DETERMINISTIC
  -- NO SQL
    RETURN CAST('1970-01-01' AS DATETIME);
SELECT f1() FROM t1 GROUP BY 1;
+---------------------+
| f1()                |
+---------------------+
| 1970-01-01 00:00:00 |
+---------------------+
DROP TABLE t1;
DROP FUNCTION f1;

#### Case 45:
use test;
drop function if exists func30787;
create table t1(f1 int);
insert into t1 values(1),(2);
create function func30787(p1 int) returns int
begin
  return p1;
end |
select (select func30787(f1)) as ttt from t1;
+------+
| ttt  |
+------+
|    1 |
|    2 |
+------+
drop function func30787;
drop table t1;

#### Case 46:
drop table if exists t1;
drop function if exists f1;
drop view if exists v1;
drop procedure if exists p1;
create table t1(c1 INT);
create function f1(p1 int) returns varchar(32)
  return 'aaa';
create view v1 as select f1(c1) as parent_control_name from t1;
create procedure p1()
begin
    select parent_control_name as c1 from v1;
end //
call p1();
call p1();
drop procedure p1;
drop function f1;
drop view v1;
drop table t1;

#### Case 47:
DROP VIEW IF EXISTS v1;
DROP VIEW IF EXISTS v2;
DROP FUNCTION IF EXISTS f1;
DROP FUNCTION IF EXISTS f2;
CREATE FUNCTION f1() RETURNS VARCHAR(65525) RETURN 'Hello';
CREATE FUNCTION f2() RETURNS TINYINT RETURN 1;
CREATE VIEW v1 AS SELECT f1();
CREATE VIEW v2 AS SELECT f2();
SELECT DATA_TYPE FROM INFORMATION_SCHEMA.COLUMNS WHERE TABLE_NAME = 'v1';
+-----------+
| DATA_TYPE |
+-----------+
+-----------+
SELECT DATA_TYPE FROM INFORMATION_SCHEMA.COLUMNS WHERE TABLE_NAME = 'v2';
+-----------+
| DATA_TYPE |
+-----------+
+-----------+

DROP FUNCTION f1;
DROP FUNCTION f2;
DROP VIEW v1;
DROP VIEW v2;

#### Case 48:
drop table if exists t1;
drop table if exists t2;
CREATE TABLE t1 (a INT, b INT, KEY(b));
CREATE TABLE t2 (c INT, d INT, KEY(c));
INSERT INTO t1 VALUES (1,1),(1,1),(1,2);
INSERT INTO t2 VALUES (1,1),(1,2);

CREATE FUNCTION f1() RETURNS INT DETERMINISTIC
BEGIN
  DECLARE a int;
  -- SQL statement inside
  SELECT 1 INTO a;
  RETURN a;
END $

SELECT COUNT(DISTINCT d) FROM t1, t2  WHERE a = c AND b = f1();
+-------------------+
| COUNT(DISTINCT d) |
+-------------------+
|                 2 |
+-------------------+
DROP FUNCTION f1;
DROP TABLE t1, t2;

#### Case 49:
DROP FUNCTION IF EXISTS f1;
DROP TABLE IF EXISTS t_non_existing;
DROP TABLE IF EXISTS t1;
CREATE FUNCTION f1() RETURNS INT
BEGIN
   DECLARE v INT;
   SELECT a FROM t_non_existing INTO v;
   RETURN 1;
END|

CREATE TABLE t1 (a INT) ENGINE = myisam;
Warnings:
Warning	1286	Unknown storage engine 'myisam'
INSERT INTO t1 VALUES (1);

SELECT * FROM t1 WHERE a = f1();
ERROR 42S02: Table 'test.t_non_existing' doesn't exist

DROP FUNCTION f1;
DROP TABLE t1;

#### Case 50:
DROP PROCEDURE IF EXISTS p1;
DROP PROCEDURE IF EXISTS p2;
DROP PROCEDURE IF EXISTS p3;
DROP PROCEDURE IF EXISTS p4;
CREATE PROCEDURE p1()
  CALL p2()|
CREATE PROCEDURE p2()
  CALL p3()|
CREATE PROCEDURE p3()
  CALL p4()|
CREATE PROCEDURE p4()
BEGIN
  SELECT 1;
  SELECT CAST('10 ' as UNSIGNED INTEGER);
END|

CALL p1();

DROP PROCEDURE p1;
DROP PROCEDURE p2;
DROP PROCEDURE p3;
DROP PROCEDURE p4;

DROP FUNCTION IF EXISTS f1;
DROP FUNCTION IF EXISTS f2;
DROP FUNCTION IF EXISTS f3;
DROP FUNCTION IF EXISTS f4;
DROP TABLE IF EXISTS t1;
CREATE TABLE t1 (a CHAR(2));

INSERT INTO t1 VALUES ('aa');

CREATE FUNCTION f1() RETURNS CHAR
  RETURN (SELECT f2())|
Warnings:
Warning	-1	Resolve error
CREATE FUNCTION f2() RETURNS CHAR
  RETURN (SELECT f3())|
Warnings:
Warning	-1	Resolve error
CREATE FUNCTION f3() RETURNS CHAR
  RETURN (SELECT f4())|
Warnings:
Warning	-1	Resolve error
CREATE FUNCTION f4() RETURNS CHAR
BEGIN
  RETURN (SELECT a FROM t1);
END|
Warnings:
Warning	-1	Resolve error

## TODO: subquery
## SELECT f1();
DROP FUNCTION f1;
DROP FUNCTION f2;
DROP FUNCTION f3;
DROP FUNCTION f4;
DROP TABLE t1;

#### Case 51:
DROP FUNCTION IF EXISTS f1;
CREATE FUNCTION f1() RETURNS INT
BEGIN
  DECLARE CONTINUE HANDLER FOR SQLEXCEPTION BEGIN END;
  BEGIN
    DECLARE CONTINUE HANDLER FOR SQLEXCEPTION RETURN f1();
    BEGIN
     DECLARE CONTINUE HANDLER FOR SQLEXCEPTION RETURN f1();
     RETURN f1();
    END;
  END;
RETURN 1;
END $

## TODO: handle exception
## SELECT f1();
DROP FUNCTION f1;

#### Case 52:
DROP FUNCTION if exists f1;
CREATE FUNCTION f1 (p_value INT) RETURNS INT DETERMINISTIC RETURN x;
Warnings:
Warning	-1	Resolve error
SELECT f1(1);
ERROR 42000: Undeclared variable: x
DROP FUNCTION f1;

#### Case 53:
DROP FUNCTION IF EXISTS f1;
DROP FUNCTION IF EXISTS f2;
DROP FUNCTION IF EXISTS f3;
DROP FUNCTION IF EXISTS f4;

CREATE FUNCTION f1() RETURNS VARCHAR(1)
BEGIN RETURN 'X'; END;/

CREATE FUNCTION f2() RETURNS CHAR(1)
BEGIN RETURN 'X'; END;/

CREATE FUNCTION f3() RETURNS VARCHAR(1)
BEGIN RETURN NULL; END;/

CREATE FUNCTION f4() RETURNS CHAR(1)
BEGIN RETURN NULL; END;/


SELECT f1() IS NULL;
+--------------+
| f1() IS NULL |
+--------------+
|            0 |
+--------------+
SELECT f2() IS NULL;
+--------------+
| f2() IS NULL |
+--------------+
|            0 |
+--------------+
SELECT f3() IS NULL;
+--------------+
| f3() IS NULL |
+--------------+
|            1 |
+--------------+
SELECT f4() IS NULL;
+--------------+
| f4() IS NULL |
+--------------+
|            1 |
+--------------+

DROP FUNCTION f1;
DROP FUNCTION f2;
DROP FUNCTION f3;
DROP FUNCTION f4;

#### Case 54:
CREATE DATABASE bug22222013;
USE bug22222013;
CREATE FUNCTION f1() RETURNS INT RETURN (1);
CREATE FUNCTION f21(p1 CHAR) RETURNS CHAR RETURN (p1);
SELECT sql_data_access FROM information_schema.routines WHERE specific_name like 'bug22222013' and routine_schema=0;
+-----------------+
| sql_data_access |
+-----------------+
+-----------------+
USE TEST;
DROP DATABASE bug22222013;

#### Case 55:
drop function if exists my_func;
drop table if exists t1;
drop table if exists t2;
create function my_func(val1 int, val2 int) returns int return val1 + val2;
create table t1(col1 int);
create table t2(col2 int);
insert into t1 values(1);
insert into t2 values(1);

select my_func(col1, 0) from t1;
+------------------+
| my_func(col1, 0) |
+------------------+
|                1 |
+------------------+
select col1 from t1 where my_func(col1, 0) = 1;
+------+
| col1 |
+------+
|    1 |
+------+
select my_func(col1, 0), col1 from t1;
+------------------+------+
| my_func(col1, 0) | col1 |
+------------------+------+
|                1 |    1 |
+------------------+------+

select /*+use_nl(t1 t2)*/col1, col2 from t1 join t2 on my_func(col1, col2) = my_func(col2, col1);
+------+------+
| col1 | col2 |
+------+------+
|    1 |    1 |
+------+------+
select col1, col2 from t1 left join t2 on my_func(col1, 0);
+------+------+
| col1 | col2 |
+------+------+
|    1 |    1 |
+------+------+

select col1, col2 from t1 right join t2 on my_func(col1, 0) = col2;
+------+------+
| col1 | col2 |
+------+------+
|    1 |    1 |
+------+------+
select col1, col2 from t1 full outer join t2 on my_func(col1, 0) = col2;
+------+------+
| col1 | col2 |
+------+------+
|    1 |    1 |
+------+------+
select col1, col2 from t1 join t2 on col1 = col2 and my_func(1, 0);
+------+------+
| col1 | col2 |
+------+------+
|    1 |    1 |
+------+------+
select my_func(col1, 0) from t1 group by my_func(col1, 0);
+------------------+
| my_func(col1, 0) |
+------------------+
|                1 |
+------------------+
select * from t1 where exists (select col2 from t2) or my_func(1, 0) = 1;
+------+
| col1 |
+------+
|    1 |
+------+
select * from t1 where col1 in (select col2 from t2 where my_func(col2, 0) = 1);
+------+
| col1 |
+------+
|    1 |
+------+
select my_func(1, 2) from t1 where my_func(col1, 0);
+---------------+
| my_func(1, 2) |
+---------------+
|             3 |
+---------------+
select /*+use_nl(t1 t2)*/ * from t1 join t2 where my_func(col1, col2);
+------+------+
| col1 | col2 |
+------+------+
|    1 |    1 |
+------+------+
select * from t1 join t2 where my_func(col1, col2);
+------+------+
| col1 | col2 |
+------+------+
|    1 |    1 |
+------+------+
select /*+topk(my_func(1,1) 6)*/  col1 from t1 where my_func(col1, col1);
+------+
| col1 |
+------+
|    1 |
+------+
select /*+topk(20 6)*/  col1 from t1 where my_func(col1, col1);
+------+
| col1 |
+------+
|    1 |
+------+

drop table if exists ttt1;
create table ttt1(pk int, full_name varchar(1000), primary key(pk), fulltext index i1(full_name) ctxcat(full_name));
explain select * from ttt1 where match (full_name) against ("支付宝") and my_func(pk, pk);
Query Plan
=========================================================
|ID|OPERATOR            |NAME            |EST. ROWS|COST|
---------------------------------------------------------
|0 |DOMAIN INDEX LOOK UP|ttt1            |250      |622 |
|1 | TABLE SCAN         |DOMAIN_INDEX(i1)|0        |0   |
=========================================================

Outputs & filters: 
-------------------------------------
  0 - output([ttt1.pk], [ttt1.full_name]), filter(nil), 
      access([ttt1.full_name], [ttt1.pk]), partitions(p0)
  1 - output([ttt1.pk]), filter([TEST.my_func(ttt1.pk, ttt1.pk)]), 
      access([ttt1.__word_segment_17], [ttt1.pk]), partitions(p0)


drop table ttt1;
drop table t1;
drop table t2;
drop function my_func;

#### Case 56: test recursion call
drop function if exists my_func|
create function my_func(val int)
returns int
begin
  if (val > 1) then
    set val = my_func(val - 1);
  end if;
  return val;
end|

select my_func(1);
+------------+
| my_func(1) |
+------------+
|          1 |
+------------+
select my_func(2);
ERROR HY000: Recursive stored functions are not allowed.

drop function my_func|
create function my_func(val int)
returns int
begin
  if (val > 0) then
    set val = val - 1;
    call my_proc(val);
  end if;
  return val;
end|

drop procedure if exists my_proc|
create procedure my_proc(val int)
begin
  if (val > 0) then
    set val = my_func(val);
  end if;
end|

set max_sp_recursion_depth = 0|
call my_proc(1)|
ERROR HY000: Recursive limit 0 (as set by the max_sp_recursion_depth variable) was exceeded for routine
set max_sp_recursion_depth = 10|
call my_proc(1)|
set max_sp_recursion_depth = 0|

drop function my_func;
drop procedure my_proc;

DROP FUNCTION IF EXISTS f1;
drop function if exists f1|
CREATE FUNCTION f1() RETURNS INT
BEGIN
  DECLARE CONTINUE HANDLER FOR SQLEXCEPTION BEGIN END;
  BEGIN
    DECLARE CONTINUE HANDLER FOR SQLEXCEPTION RETURN f1();
    BEGIN
     DECLARE CONTINUE HANDLER FOR SQLEXCEPTION RETURN f1();
     RETURN f1();
    END;
  END;
RETURN 1;
END |
select f1();
+------+
| f1() |
+------+
|    1 |
+------+
drop function f1;

#### Case 57: not exists function
select not_exists();
ERROR 42000: FUNCTION not_exists does not exist

#### Case 58: no database selected
DROP DATABASE IF EXISTS my_db;
CREATE DATABASE my_db;
USE my_db;
DROP DATABASE my_db;
DROP FUNCTION IF EXISTS no_such_func;
Warnings:
Warning	1305	FUNCTION (UDF) .no_such_func does not exist
SHOW warnings;
Level	Code	Message
Warning	1305	FUNCTION (UDF) .no_such_func does not exist
DROP FUNCTION no_such_func;
ERROR 42000: FUNCTION (UDF) .no_such_func does not exist
DROP PROCEDURE IF EXISTS no_such_proc;
ERROR 3D000: No database selected
DROP PROCEDURE no_such_proc;
ERROR 3D000: No database selected
SELECT no_such_func();
ERROR 3D000: No database selected
CALL no_such_proc();
ERROR 3D000: No database selected
USE TEST;

#### Case 59: no function/procedure exists
DROP DATABASE IF EXISTS my_db;
CREATE DATABASE my_db;
USE my_db;

DROP FUNCTION IF EXISTS my_func;
CREATE FUNCTION my_func() RETURNS INT
BEGIN
  RETURN no_such_func();
END|

SELECT my_func();
ERROR 42000: FUNCTION no_such_func does not exist

DROP FUNCTION my_func;


CREATE FUNCTION f2 () RETURNS INTEGER
BEGIN
   DECLARE CONTINUE HANDLER FOR SQLSTATE '42000' SET @aux = 1;
   RETURN f_not_exists () ;
END|

CREATE FUNCTION my_func() RETURNS INT
BEGIN
  DECLARE v INT DEFAULT 0;
  DECLARE CONTINUE HANDLER FOR SQLSTATE '42000' SET v=1;
  RETURN no_such_func();
  RETURN v;
END|

SELECT my_func();
+-----------+
| my_func() |
+-----------+
|         1 |
+-----------+

DROP FUNCTION IF EXISTS no_such_func;
CREATE FUNCTION no_such_func() RETURNS INT RETURN 3;
SELECT my_func();
+-----------+
| my_func() |
+-----------+
|         3 |
+-----------+

DROP FUNCTION no_such_func;
DROP FUNCTION my_func;

CREATE FUNCTION my_func() RETURNS INT
BEGIN
  DECLARE v INT DEFAULT 0;
  DECLARE CONTINUE HANDLER FOR SQLSTATE '42000' SET v = no_such_func();
  RETURN v;
END|
SELECT my_func();
+-----------+
| my_func() |
+-----------+
|         0 |
+-----------+

DROP FUNCTION my_func;

DROP PROCEDURE IF EXISTS my_proc;
CREATE PROCEDURE my_proc()
BEGIN
  CALL no_such_proc();
END|
CALL my_proc();
ERROR 42000: procedure .no_such_proc does not exist

DROP PROCEDURE IF EXISTS no_such_proc;
CREATE PROCEDURE no_such_proc()
BEGIN END;

CALL my_proc();

DROP PROCEDURE no_such_proc;
DROP PROCEDURE my_proc;

CREATE PROCEDURE my_proc()
BEGIN
  DECLARE CONTINUE HANDLER FOR SQLSTATE '42000'
  CALL no_such_proc();
END|
CALL my_proc();
DROP PROCEDURE my_proc;

USE TEST;
DROP DATABASE my_db;

#### Case 60: procedure function dependency test
DROP PROCEDURE IF EXISTS my_proc;
DROP PROCEDURE IF EXISTS my_proc1;
DROP FUNCTION IF EXISTS my_func;
DROP FUNCTION IF EXISTS my_func1;
create procedure my_proc() begin call my_proc1(my_func()); end;|
create procedure my_proc1(v int) begin set v = 2; end;|
create function my_func() returns int return 1;|
call my_proc()|
drop function my_func|
create function my_func() returns int return 1;|
call my_proc()|

drop function my_func|
drop procedure my_proc|
drop procedure my_proc1|

create procedure my_proc() begin declare v int; set v = my_func(); end|
create function my_func() returns int return 1;|
call my_proc()|
drop function my_func|
create function my_func() returns int return 1;|
call my_proc()|

drop procedure my_proc|
drop function my_func|

create function my_func() returns int begin declare v int; set v = my_func1(); return v; end;|
create function my_func1() returns int return 1;|
drop function my_func1|
create function my_func1() returns int return 1;|
select my_func()|
+-----------+
| my_func() |
+-----------+
|         1 |
+-----------+
drop function my_func1|
create function my_func1() returns int return 1;|
select my_func()|
+-----------+
| my_func() |
+-----------+
|         1 |
+-----------+

drop function my_func|
drop function my_func1|

create function my_func() returns int
begin
  declare v int default 1;
  call my_proc(v); return v;
end|
create procedure my_proc(OUT v int) begin set v = 2; end;|
select my_func()|
+-----------+
| my_func() |
+-----------+
|         2 |
+-----------+
drop procedure my_proc|
create procedure my_proc(OUT v int) begin set v = 3; end;|
select my_func()|
+-----------+
| my_func() |
+-----------+
|         3 |
+-----------+

drop function my_func|
drop procedure my_proc|

create function my_func() returns int
begin
  call my_proc(my_func1());
  return 1;
end;|
create procedure my_proc(v int) begin set v = my_func1(); end;|
create function my_func1() returns int return 1;|
select my_func()|
+-----------+
| my_func() |
+-----------+
|         1 |
+-----------+
drop function my_func1|
create function my_func1() returns int return 2;|
select my_func()|
+-----------+
| my_func() |
+-----------+
|         1 |
+-----------+

drop function my_func|
drop function my_func1|
drop procedure my_proc|











