drop table if exists t1;
create table t1(pk varchar(20) primary key, sc int, sex varchar(2));
insert into t1 values('jun',90,'m'),('yu',90,'f'),('yang',90,'f'),('yi',90,'m'),('xuan',90,'f'),('?',50,'m');
set autocommit=0;
set autocommit=0;
set autocommit=0;
select sum(sc) as total from t1;
total
500
update t1 set sc=90 where pk='?';
select sum(sc) as total from t1 ;
total
500
select avg(sc) as average from t1 group by sex;
average
76.6667
90.0000
insert into  t1 values('v1',0,'m');
replace into  t1 values('v2',0,'f');
delete from t1 where pk='?';
update t1 set sc=sc/2 where pk='?';
select avg(sc) as average from t1 group by sex;
average
76.6667
90.0000
commit;
commit;
select * from t1;
pk	sc	sex
jun	90	m
v1	0	m
v2	0	f
xuan	90	f
yang	90	f
yi	90	m
yu	90	f
select sum(sc) as total from t1;
total
450
select avg(sc) as average from t1 group by sex;
average
60.0000
67.5000
commit;
drop table t1;
