connect(con1, localhost, hualong@tenant_test,,test);
create user hualong;
grant CREATE, SELECT, INSERT, DROP on *.* to hualong;
use test;
drop table if exists t1, t2;
connection con1root;
set @@global.read_only = off;
connection con1;
use test;
create table t1 (a int);
insert into t1 values(1);
connection con1root;
set @@global.read_only = on;
show variables like 'read_only';
Variable_name	Value
read_only	ON
show global variables like 'read_only';
Variable_name	Value
read_only	ON
select @@global.read_only;
@@global.read_only
1
show tenant status;
Tenant	Status
sys	read only
create table t2 (a int primary key, b int);
insert into t2 values (1,1),(2,2),(3,3),(4,4);
select * from t2;
a	b
1	1
2	2
3	3
4	4
update t2 set b = 11 where a = 1;
replace into t2 values (2,22);
drop table t2;
connection con1;
show variables like 'read_only';
Variable_name	Value
read_only	ON
show global variables like 'read_only';
Variable_name	Value
read_only	ON
select @@global.read_only;
@@global.read_only
1
show tenant status;
Tenant	Status
sys	read only
set @@global.read_only = off;
ERROR 42501: Access denied; you need (at least one of) the SUPER or ALTER SYSTEM privilege(s) for this operation
create table t3(a int);
ERROR HY000: The MySQL server is running with the --read-only option so it cannot execute this statement
insert into t1 values(1);
ERROR HY000: The MySQL server is running with the --read-only option so it cannot execute this statement
update t1 set a = 1 where 1 = 0;
ERROR HY000: The MySQL server is running with the --read-only option so it cannot execute this statement
delete from t1 where a = 1;
ERROR HY000: The MySQL server is running with the --read-only option so it cannot execute this statement
alter table t1 add column b int default 10;
ERROR HY000: The MySQL server is running with the --read-only option so it cannot execute this statement
select * from t1;
a
1
desc t1;
Field	Type	Null	Key	Default	Extra
a	int(11)	YES		NULL	
connection con1root;
set @@global.read_only = on;
BEGIN;
connection con1;
BEGIN;
connection con1root;
set @@global.read_only = off;
ERROR HY000: Can't execute the given command because you have active locked tables or an active transaction
ROLLBACK;
set @@global.read_only = off;
show global variables like 'read_only';
Variable_name	Value
read_only	OFF
show variables like 'read_only';
Variable_name	Value
read_only	OFF
show tenant status;
Tenant	Status
sys	read write
select @@global.read_only;
@@global.read_only
0
conection con1;
select @@global.read_only;
@@global.read_only
0
show global variables like 'read_only';
Variable_name	Value
read_only	OFF
show variables like 'read_only';
Variable_name	Value
read_only	OFF
show tenant status;
Tenant	Status
sys	read write
ROLLBACK;
#
# WL#5968 Implement START TRANSACTION READ (WRITE|ONLY);
#
#
# Test interaction with read_only system variable.
DROP TABLE IF EXISTS t1;
CREATE TABLE t1(a INT);
INSERT INTO t1 VALUES (1), (2);
set @@global.read_only = on;
show global variables like 'read_only';
Variable_name	Value
read_only	ON
show variables like 'read_only';
Variable_name	Value
read_only	ON
show tenant status;
Tenant	Status
sys	read only
select @@global.read_only;
@@global.read_only
1
# All allowed with super privilege
START TRANSACTION;
COMMIT;
START TRANSACTION READ ONLY;
COMMIT;
START TRANSACTION READ WRITE;
COMMIT;
# We allow implicit RW transaction without super privilege
# for compatibility reasons
show global variables like 'read_only';
Variable_name	Value
read_only	ON
show variables like 'read_only';
Variable_name	Value
read_only	ON
show tenant status;
Tenant	Status
sys	read only
select @@global.read_only;
@@global.read_only
1
START TRANSACTION;
# Check that table updates are still disallowed.
INSERT INTO t1 VALUES (3);
ERROR HY000: The MySQL server is running with the --read-only option so it cannot execute this statement
UPDATE t1 SET a= 1;
ERROR HY000: The MySQL server is running with the --read-only option so it cannot execute this statement
DELETE FROM t1;
ERROR HY000: The MySQL server is running with the --read-only option so it cannot execute this statement
COMMIT;
START TRANSACTION READ ONLY;
COMMIT;
# Explicit RW trans is not allowed without super privilege
START TRANSACTION READ WRITE;
ERROR HY000: The MySQL server is running with the --read-only option so it cannot execute this statement
COMMIT;
connection con1root;
set @@global.read_only = off;
drop database if exists hualong;
create database hualong;
grant all on hualong.* to hualong;
show databases like 'hualong';
Database (hualong)
hualong
show databases status like 'hualong';
Database (hualong)	Status
hualong	read write
alter database hualong read only;
show databases status like 'hualong';
Database (hualong)	Status
hualong	read only
create table hualong.t1 (c1 int primary key, c2 int);
insert into hualong.t1 values(1,2);
alter table hualong.t1 add column c3 int default 3;
select * from hualong.t1;
c1	c2	c3
1	2	3
connection con1;
show databases status like 'hualong';
Database (hualong)	Status
hualong	read only
alter database hualong read write;
ERROR HY000: The database 'hualong' is read only so it cannot execute this statement
create table hualong.t2 (c1 int primary key, c2 int);
ERROR HY000: The database 'hualong' is read only so it cannot execute this statement
select * from hualong.t1;
c1	c2	c3
1	2	3
show tables from hualong;
Tables_in_hualong
t1
connection con1root;
alter database hualong read write;
show databases status like 'hualong';
Database (hualong)	Status
hualong	read write
connection con1;
insert into hualong.t1 values(2,4,6);
update hualong.t1 set c3 = 10 where c1 = 2;
connection con1root
set @@global.read_only = on;
connection con1;
insert into hualong.t1 values (3,6,9);
ERROR HY000: The MySQL server is running with the --read-only option so it cannot execute this statement
select * from hualong.t1;
c1	c2	c3
1	2	3
2	4	10
connection con1root
set @@global.read_only = off;
alter database hualong read write;
alter table hualong.t1 read only;
insert into hualong.t1 values (3,6,9);
alter table hualong.t1 add index idx1 (c2,c3);
connection con1
show databases status like 'hualong';
Database (hualong)	Status
hualong	read write
insert into hualong.t1 values (4,8,12);
ERROR HY000: The table 'hualong.t1' is read only so it cannot execute this statement
select * from hualong.t1;
c1	c2	c3
1	2	3
2	4	10
3	6	9
alter table hualong.t1 read write;
ERROR HY000: The table 'hualong.t1' is read only so it cannot execute this statement
connection con1root to create jx_user, jx_db, jx_t1
create database jx_db;
use jx_db;
create table jx_t1(c1 int primary key) read only;
insert into jx_t1 values(1);
insert into jx_t1 values(2);
insert into jx_t1 values(3);
insert into jx_t1 values(4);
create user jx_user;
grant all privileges on jx_db.* to jx_user;
use jx_db;
select * from jx_t1;
c1
1
2
3
4
insert into jx_t1 values(5);
ERROR HY000: The table 'jx_db.jx_t1' is read only so it cannot execute this statement
show databases status like 'jx_db';
Database (jx_db)	Status
jx_db	read write
show create table jx_t1;
Table	Create Table
jx_t1	CREATE TABLE `jx_t1` (
  `c1` int(11) NOT NULL,
  PRIMARY KEY (`c1`)
) ORGANIZATION INDEX DEFAULT CHARSET = utf8mb4 COMPRESSION = 'lz4_1.0' REPLICA_NUM = NUM BLOCK_SIZE = SIZE USE_BLOOM_FILTER = FALSE ENABLE_MACRO_BLOCK_BLOOM_FILTER = FALSE TABLET_SIZE = SIZE PCTFREE = 10 READ ONLY
use jx_db;
alter table jx_t1 read write;
use jx_db;
show create table jx_t1;
Table	Create Table
jx_t1	CREATE TABLE `jx_t1` (
  `c1` int(11) NOT NULL,
  PRIMARY KEY (`c1`)
) ORGANIZATION INDEX DEFAULT CHARSET = utf8mb4 COMPRESSION = 'lz4_1.0' REPLICA_NUM = NUM BLOCK_SIZE = SIZE USE_BLOOM_FILTER = FALSE ENABLE_MACRO_BLOCK_BLOOM_FILTER = FALSE TABLET_SIZE = SIZE PCTFREE = 10
insert into jx_t1 values(5);
select * from jx_t1;
c1
1
2
3
4
5
connection con1root
drop database hualong;
drop database jx_db;
drop user hualong;
drop user jx_user;
set @@global.read_only = off;
