set @c = repeat(' ', 256);
select @c;
@c
                                                                                                                                                                                                                                                                
select cast(repeat('1',5) as signed int);
cast(repeat('1',5) as signed int)
11111
select cast(repeat('1',10) as signed int);
cast(repeat('1',10) as signed int)
1111111111
select length(repeat('a',100000000)),length(repeat('a',1000*64));
ERROR HY000: Result of repeat() was larger than max_allowed_packet (16777216) - truncated
select length(repeat('a',10000)),length(repeat('a',100*64)),length(repeat('a',65535));
length(repeat('a',10000))	length(repeat('a',100*64))	length(repeat('a',65535))
10000	6400	65535
select length(repeat('a',1000)),length(concat(repeat('a',320),repeat('b',32000)));
length(repeat('a',1000))	length(concat(repeat('a',320),repeat('b',32000)))
1000	32320
select repeat('hello', -1);
repeat('hello', -1)

select repeat('hello', -2);
repeat('hello', -2)

select repeat('hello', -100);
repeat('hello', -100)

select repeat('hello', 0);
repeat('hello', 0)

select repeat('hello', -4294967295);
repeat('hello', -4294967295)

select repeat('hello', 4294967295);
ERROR HY000: Result of repeat() was larger than max_allowed_packet (16777216) - truncated
select length(repeat('h', 65535));
length(repeat('h', 65535))
65535
select length(repeat('h', 65536));
length(repeat('h', 65536))
65536
select length(repeat('h', 65537));
length(repeat('h', 65537))
65537
select repeat('h', 10.1);
repeat('h', 10.1)
hhhhhhhhhh
select repeat('h', -10.1);
repeat('h', -10.1)

select repeat('h', 1.1);
repeat('h', 1.1)
h
select repeat('h', 'abc');
repeat('h', 'abc')

Warnings:
Warning	1292	Truncated incorrect INTEGER value: 'abc'
select repeat(1,10);
repeat(1,10)
1111111111
select repeat(substr('abcd',2),1);
repeat(substr('abcd',2),1)
bcd
select repeat(substr('abcd',2),2);
repeat(substr('abcd',2),2)
bcdbcd
select repeat(substr('abcd',1,2),2);
repeat(substr('abcd',1,2),2)
abab
select length(repeat(0xa1,215)), length(repeat(0x1a, 310));
length(repeat(0xa1,215))	length(repeat(0x1a, 310))
215	310
select repeat('ab',5+5),repeat('ab',-1),repeat('a',0);
repeat('ab',5+5)	repeat('ab',-1)	repeat('a',0)
abababababababababab		
select repeat('a',3*10+3-2);
repeat('a',3*10+3-2)
aaaaaaaaaaaaaaaaaaaaaaaaaaaaaaa
select length(repeat('a',3*10+3-2));
length(repeat('a',3*10+3-2))
31
select repeat(null,1);
repeat(null,1)
NULL
select repeat(null,2);
repeat(null,2)
NULL
select repeat(null,3);
repeat(null,3)
NULL
select repeat(3,null);
repeat(3,null)
NULL
select repeat(null,null);
repeat(null,null)
NULL
drop table if exists t1;
CREATE TABLE t1 (a int auto_increment primary key not null, b varchar(20000)) ;
select a,length(b) from t1 limit 1;
a	length(b)
1	200
DELETE FROM t1 WHERE a=1 or a=5;
select * from t1 WHERE a=1 or a=5;
a	b
INSERT INTO t1 values(500,repeat('a',600));
UPDATE t1 SET b=repeat('a', 800) where a=10;
select length(b) from t1  where a=10;
length(b)
800
DELETE FROM t1 WHERE a=2 or a=6;
select *  FROM t1 WHERE a=2 or a=6;
a	b
UPDATE t1 SET b=repeat('a', 600) where a=11;
select a,length(b) from t1 where a=11;
a	length(b)
11	600
select count(*) from t1 where b=repeat('a',200);
count(*)
297
select count(*) from t1 where b=repeat('a',600);
count(*)
2
select count(*) from t1 where b=repeat('a',800);
count(*)
1
select a,length(b)  from t1 where b in (repeat('a',800),repeat('a',600));
a	length(b)
10	800
11	600
500	600
delete from t1;
INSERT INTO t1 values(6,'adgafdgafdg'),(7,'agfadgfdgadgf'),(1,'ab'),(2,'cd');
select repeat(b,3) from t1 ;
repeat(b,3)
ababab
cdcdcd
adgafdgafdgadgafdgafdgadgafdgafdg
agfadgfdgadgfagfadgfdgadgfagfadgfdgadgf
select repeat(b,1) from t1 ;
repeat(b,1)
ab
cd
adgafdgafdg
agfadgfdgadgf
select repeat(b,1) as abc from t1 order by abc;
abc
ab
adgafdgafdg
agfadgfdgadgf
cd
select concat(repeat(b,2),'abcd') from t1 ;
concat(repeat(b,2),'abcd')
abababcd
cdcdabcd
adgafdgafdgadgafdgafdgabcd
agfadgfdgadgfagfadgfdgadgfabcd
select length(b),a from t1;
length(b)	a
2	1
2	2
11	6
13	7
select repeat(b,a) as abc from t1;
abc
ab
cdcd
adgafdgafdgadgafdgafdgadgafdgafdgadgafdgafdgadgafdgafdgadgafdgafdg
agfadgfdgadgfagfadgfdgadgfagfadgfdgadgfagfadgfdgadgfagfadgfdgadgfagfadgfdgadgfagfadgfdgadgf
select length(repeat(b,a)) as abc from t1;
abc
2
4
66
91
select length(repeat(b,a)) as abc from t1 order by abc;
abc
2
4
66
91
select length(repeat(b,a+10)) as abc from t1 order by abc;
abc
22
24
176
221
drop table if exists t2;
CREATE TABLE t2 (a int  primary key not null, b varchar(256)) ;
iNSERT INTO t2 VALUES (0,REPEAT('a', 1024));
ERROR 22001: Data too long for column 'b' at row 1
iNSERT INTO t2 VALUES (2,REPEAT('a', 256));
select length(b),a from t2;
length(b)	a
256	2
insert into t2 values (1, concat(repeat('1', 200), '2'));
select length(b),a from t2;
length(b)	a
201	1
256	2
select length(repeat(b,a)) as abc from t2;
abc
201
512
select length(repeat(b,a)) as abc from t2 order by abc;
abc
201
512
drop table t1;
drop table t2;
create table t1 (
col_varchar    varchar(1),
col_varbinary  varbinary(1),
col_char       char(1), 
col_binary     binary(1),
col_tinytext   tinytext,
col_tinyblob   tinyblob,
col_mediumtext mediumtext,
col_mediumblob mediumblob,
col_text       text,
col_blob       blob,
col_count      bigint);
insert into t1 values ('a', 'a', 'a', 'a', 'a', 'a', 'a', 'a', 'a', 'a', 1048576);
create table t2 as
select repeat('a',    512),
repeat('a',    513),
repeat('a',  21845),
repeat('a',  21846),
repeat(col_varchar, '512'),
repeat(col_varchar, '513'),
repeat(col_varchar, 65535),
repeat(col_varchar, 65536),
repeat(col_varbinary, '512'),
repeat(col_varbinary, '513'),
repeat(col_varbinary, 65535),
repeat(col_varbinary, 65536),
repeat(col_char, '512'),
repeat(col_char, '513'),
repeat(col_char, 65535),
repeat(col_char, 65536),
repeat(col_binary, '512'),
repeat(col_binary, '513'),
repeat(col_binary, 65535),
repeat(col_binary, 65536),
repeat(col_tinytext,   2),
repeat(col_tinytext,   3),
repeat(col_tinytext, 257),
repeat(col_tinytext, 258),
repeat(col_tinyblob,   2),
repeat(col_tinyblob,   3),
repeat(col_tinyblob, 257),
repeat(col_tinyblob, 258),
repeat(col_mediumtext, 1),
repeat(col_mediumblob, 1),
repeat(col_text, 1),
repeat(col_text, 2),
repeat(col_blob, 1),
repeat(col_blob, 2),
repeat('a', col_count),
repeat(col_varchar, col_count),
repeat(col_varbinary, col_count),
repeat(col_char, col_count),
repeat(col_binary, col_count),
repeat(col_tinytext, col_count),
repeat(col_tinyblob, col_count),
repeat(col_mediumtext, col_count),
repeat(col_mediumblob, col_count),
repeat(col_text, col_count),
repeat(col_blob, col_count),
repeat(NULL,NULL),
repeat('aa', NULL),
repeat(NULL, 1),
repeat('aa', 1),
repeat(col_char, NULL),
repeat(col_binary, NULL),
repeat(col_varchar, NULL),
repeat(col_varbinary, NULL),
repeat(col_tinytext, NULL),
repeat(col_tinyblob, NULL),
repeat(col_mediumtext, NULL),
repeat(col_mediumblob, NULL),
repeat(col_text, NULL),
repeat(col_blob, NULL),
repeat(NULL, col_count)
from t1;
desc t2;
Field	Type	Null	Key	Default	Extra
repeat('a',    512)	varchar(512)	YES		NULL	
repeat('a',    513)	text	YES		NULL	
repeat('a',  21845)	text	YES		NULL	
repeat('a',  21846)	text	YES		NULL	
repeat(col_varchar, '512')	varchar(512)	YES		NULL	
repeat(col_varchar, '513')	text	YES		NULL	
repeat(col_varchar, 65535)	text	YES		NULL	
repeat(col_varchar, 65536)	longtext	YES		NULL	
repeat(col_varbinary, '512')	varbinary(512)	YES		NULL	
repeat(col_varbinary, '513')	blob	YES		NULL	
repeat(col_varbinary, 65535)	blob	YES		NULL	
repeat(col_varbinary, 65536)	longblob	YES		NULL	
repeat(col_char, '512')	varchar(512)	YES		NULL	
repeat(col_char, '513')	text	YES		NULL	
repeat(col_char, 65535)	text	YES		NULL	
repeat(col_char, 65536)	longtext	YES		NULL	
repeat(col_binary, '512')	varbinary(512)	YES		NULL	
repeat(col_binary, '513')	blob	YES		NULL	
repeat(col_binary, 65535)	blob	YES		NULL	
repeat(col_binary, 65536)	longblob	YES		NULL	
repeat(col_tinytext,   2)	varchar(512)	YES		NULL	
repeat(col_tinytext,   3)	text	YES		NULL	
repeat(col_tinytext, 257)	text	YES		NULL	
repeat(col_tinytext, 258)	longtext	YES		NULL	
repeat(col_tinyblob,   2)	varbinary(512)	YES		NULL	
repeat(col_tinyblob,   3)	blob	YES		NULL	
repeat(col_tinyblob, 257)	blob	YES		NULL	
repeat(col_tinyblob, 258)	longblob	YES		NULL	
repeat(col_mediumtext, 1)	longtext	YES		NULL	
repeat(col_mediumblob, 1)	longblob	YES		NULL	
repeat(col_text, 1)	text	YES		NULL	
repeat(col_text, 2)	longtext	YES		NULL	
repeat(col_blob, 1)	blob	YES		NULL	
repeat(col_blob, 2)	longblob	YES		NULL	
repeat('a', col_count)	longtext	YES		NULL	
repeat(col_varchar, col_count)	longtext	YES		NULL	
repeat(col_varbinary, col_count)	longblob	YES		NULL	
repeat(col_char, col_count)	longtext	YES		NULL	
repeat(col_binary, col_count)	longblob	YES		NULL	
repeat(col_tinytext, col_count)	longtext	YES		NULL	
repeat(col_tinyblob, col_count)	longblob	YES		NULL	
repeat(col_mediumtext, col_count)	longtext	YES		NULL	
repeat(col_mediumblob, col_count)	longblob	YES		NULL	
repeat(col_text, col_count)	longtext	YES		NULL	
repeat(col_blob, col_count)	longblob	YES		NULL	
repeat(NULL,NULL)	longblob	YES		NULL	
repeat('aa', NULL)	longtext	YES		NULL	
repeat(NULL, 1)	varbinary(512)	YES		NULL	
repeat('aa', 1)	varchar(512)	YES		NULL	
repeat(col_char, NULL)	longtext	YES		NULL	
repeat(col_binary, NULL)	longblob	YES		NULL	
repeat(col_varchar, NULL)	longtext	YES		NULL	
repeat(col_varbinary, NULL)	longblob	YES		NULL	
repeat(col_tinytext, NULL)	longtext	YES		NULL	
repeat(col_tinyblob, NULL)	longblob	YES		NULL	
repeat(col_mediumtext, NULL)	longtext	YES		NULL	
repeat(col_mediumblob, NULL)	longblob	YES		NULL	
repeat(col_text, NULL)	longtext	YES		NULL	
repeat(col_blob, NULL)	longblob	YES		NULL	
repeat(NULL, col_count)	varbinary(512)	YES		NULL	
drop table t1;
drop table t2;
