drop table if exists t1;
alter system set _lcl_op_interval = '0ms';
create table t1(pk1 int , pk2 varchar(1024), pk3 datetime(6), a int, b varchar(1024), c datetime(6), primary key(pk1,pk2,pk3));
insert into t1 values(1,'s1','2012-12-12 12:00:00',100, 's100','2013-12-12 12:00:00' );
insert into t1 values(2,'s2','2012-12-12 12:00:00',200, 's200','2013-12-12 12:00:00' );
select * from t1 where a = 100 and b = 's100' and c = '2012-12-12 12:00:00' for update wait 1;
pk1	pk2	pk3	a	b	c
select * from t1 t where t.a = 100 and t.b = 's100' and t.c = '2012-12-12 12:00:00' for update wait 1;
pk1	pk2	pk3	a	b	c
select * from t1 where pk1 = 1 and pk2 = 's1' and c = '2012-12-12 12:00:00' for update wait 1;
pk1	pk2	pk3	a	b	c
select * from t1 t where t.pk1 = 1 and t.pk2 = 's1' and t.c = '2012-12-12 12:00:00' for update wait 1;
pk1	pk2	pk3	a	b	c
select * from t1 where a = 100 and b = 's100' and c = '2012-12-12 12:00:00' for update nowait;
pk1	pk2	pk3	a	b	c
select * from t1 t where t.a = 100 and t.b = 's100' and t.c = '2012-12-12 12:00:00' for update nowait;
pk1	pk2	pk3	a	b	c
select * from t1 where pk1 = 1 and pk2 = 's1' and c = '2012-12-12 12:00:00' for update nowait;
pk1	pk2	pk3	a	b	c
select * from t1 t where t.pk1 = 1 and t.pk2 = 's1' and t.c = '2012-12-12 12:00:00' for update nowait;
pk1	pk2	pk3	a	b	c
select * from t1 where a = 100 and b = 's100' and c = '2012-12-12 12:00:00' for update no_wait;
pk1	pk2	pk3	a	b	c
select * from t1 t where t.a = 100 and t.b = 's100' and t.c = '2012-12-12 12:00:00' for update no_wait;
pk1	pk2	pk3	a	b	c
select * from t1 where pk1 = 1 and pk2 = 's1' and c = '2012-12-12 12:00:00' for update no_wait;
pk1	pk2	pk3	a	b	c
select * from t1 t where t.pk1 = 1 and t.pk2 = 's1' and t.c = '2012-12-12 12:00:00' for update no_wait;
pk1	pk2	pk3	a	b	c
select * from t1 where pk1 = 1 and pk2 = 's1' and pk3= '2012-12-12 12:00:00' for update wait -1;
ERROR 42000: You have an error in your SQL syntax; check the manual that corresponds to your OceanBase version for the right syntax to use near '-1' at line 1
select * from t1 where pk1 = 1 and pk2 = 's1' and pk3= '2012-12-12 12:00:00' for update wait 0;
pk1	pk2	pk3	a	b	c
1	s1	2012-12-12 12:00:00.000000	100	s100	2013-12-12 12:00:00.000000
select * from t1 t where t.pk1 = 1 and t.pk2 = 's1' and t.pk3= '2012-12-12 12:00:00' for update wait 0;
pk1	pk2	pk3	a	b	c
1	s1	2012-12-12 12:00:00.000000	100	s100	2013-12-12 12:00:00.000000
select * from t1 where pk1 = 1 and pk2 = 's1' and pk3= '2012-12-12 12:00:00' for update wait;
ERROR 42000: You have an error in your SQL syntax; check the manual that corresponds to your OceanBase version for the right syntax to use near 'wait' at line 1
select * from t1 where pk1 = 1 and pk2 = 's1' and pk3= '2012-12-12 12:00:00' for update wait 0.0000001;
ERROR HY000: Incorrect arguments to extract usec from string
select * from t1 t where t.pk1 = 1 and t.pk2 = 's1' and t.pk3= '2012-12-12 12:00:00' for update wait 0.0000001;
ERROR HY000: Incorrect arguments to extract usec from string
select * from t1 where pk1 = 1 and pk2 = 's1' and pk3= '2012-12-12 12:00:00' for update wait 0.00000000000000000;
ERROR HY000: Incorrect arguments to extract usec from string
select * from t1 t where t.pk1 = 1 and t.pk2 = 's1' and t.pk3= '2012-12-12 12:00:00' for update wait 0.00000000000000000;
ERROR HY000: Incorrect arguments to extract usec from string
select * from t1 where pk1 = 1 and pk2 = 's1' and pk3= '2012-12-12 12:00:00' for update wait 1.00000000000000000;
ERROR HY000: Incorrect arguments to extract usec from string
select * from t1 where pk1 = 1 and pk2 = 's1' and pk3= '2012-12-12 12:00:00' for update wait 0.0.0.0;
ERROR 42000: You have an error in your SQL syntax; check the manual that corresponds to your OceanBase version for the right syntax to use near '.0.0' at line 1
select * from t1 where pk1 = 1 and pk2 = 's1' and pk3= '2012-12-12 12:00:00' for update wait 1.0.0.0;
ERROR 42000: You have an error in your SQL syntax; check the manual that corresponds to your OceanBase version for the right syntax to use near '.0.0' at line 1
select * from t1 where pk1 = 1 and pk2 = 's1' and pk3= '2012-12-12 12:00:00' for update nowait -1;
ERROR 42000: You have an error in your SQL syntax; check the manual that corresponds to your OceanBase version for the right syntax to use near '-1' at line 1
select * from t1 where pk1 = 1 and pk2 = 's1' and pk3= '2012-12-12 12:00:00' for update nowait 0;
ERROR 42000: You have an error in your SQL syntax; check the manual that corresponds to your OceanBase version for the right syntax to use near '0' at line 1
select * from t1 where pk1 = 1 and pk2 = 's1' and pk3= '2012-12-12 12:00:00' for update nowait 1;
ERROR 42000: You have an error in your SQL syntax; check the manual that corresponds to your OceanBase version for the right syntax to use near '1' at line 1
select * from t1 where pk1 = 1 and pk2 = 's1' and pk3= '2012-12-12 12:00:00' for update no_wait -1;
ERROR 42000: You have an error in your SQL syntax; check the manual that corresponds to your OceanBase version for the right syntax to use near '-1' at line 1
select * from t1 where pk1 = 1 and pk2 = 's1' and pk3= '2012-12-12 12:00:00' for update no_wait 0;
ERROR 42000: You have an error in your SQL syntax; check the manual that corresponds to your OceanBase version for the right syntax to use near '0' at line 1
select * from t1 where pk1 = 1 and pk2 = 's1' and pk3= '2012-12-12 12:00:00' for update no_wait 1;
ERROR 42000: You have an error in your SQL syntax; check the manual that corresponds to your OceanBase version for the right syntax to use near '1' at line 1
select * from t1 where pk1 = 1 and pk2 = 's1' and pk3= '2012-12-12 12:00:00' for update wait 1.000000;
pk1	pk2	pk3	a	b	c
1	s1	2012-12-12 12:00:00.000000	100	s100	2013-12-12 12:00:00.000000
select * from t1 where pk1 = 1 and pk2 = 's1' and pk3= '2012-12-12 12:00:00' for update wait 0.00003;
pk1	pk2	pk3	a	b	c
1	s1	2012-12-12 12:00:00.000000	100	s100	2013-12-12 12:00:00.000000
select * from t1 where pk1 = 1 and pk2 = 's1' and pk3= '2012-12-12 12:00:00' for update wait 0.000001;
pk1	pk2	pk3	a	b	c
1	s1	2012-12-12 12:00:00.000000	100	s100	2013-12-12 12:00:00.000000
select * from t1 where pk1 = 1 and pk2 = 's1' and pk3= '2012-12-12 12:00:00' for update nowait;
pk1	pk2	pk3	a	b	c
1	s1	2012-12-12 12:00:00.000000	100	s100	2013-12-12 12:00:00.000000
select * from t1 where pk1 = 1 and pk2 = 's1' and pk3= '2012-12-12 12:00:00' for update no_wait;
pk1	pk2	pk3	a	b	c
1	s1	2012-12-12 12:00:00.000000	100	s100	2013-12-12 12:00:00.000000
begin;
select * from t1 where pk1 = 1 and pk2 = 's1' and pk3= '2012-12-12 12:00:00' for update wait -1;
ERROR 42000: You have an error in your SQL syntax; check the manual that corresponds to your OceanBase version for the right syntax to use near '-1' at line 1
select * from t1 where pk1 = 1 and pk2 = 's1' and pk3= '2012-12-12 12:00:00' for update wait 0;
pk1	pk2	pk3	a	b	c
1	s1	2012-12-12 12:00:00.000000	100	s100	2013-12-12 12:00:00.000000
select * from t1 where pk1 = 1 and pk2 = 's1' and pk3= '2012-12-12 12:00:00' for update wait;
ERROR 42000: You have an error in your SQL syntax; check the manual that corresponds to your OceanBase version for the right syntax to use near 'wait' at line 1
select * from t1 where pk1 = 1 and pk2 = 's1' and pk3= '2012-12-12 12:00:00' for update wait 0.0000001;
ERROR HY000: Incorrect arguments to extract usec from string
select * from t1 where pk1 = 1 and pk2 = 's1' and pk3= '2012-12-12 12:00:00' for update wait 0.00000000000000000;
ERROR HY000: Incorrect arguments to extract usec from string
select * from t1 where pk1 = 1 and pk2 = 's1' and pk3= '2012-12-12 12:00:00' for update wait 1.00000000000000000;
ERROR HY000: Incorrect arguments to extract usec from string
select * from t1 where pk1 = 1 and pk2 = 's1' and pk3= '2012-12-12 12:00:00' for update wait 0.0.0.0;
ERROR 42000: You have an error in your SQL syntax; check the manual that corresponds to your OceanBase version for the right syntax to use near '.0.0' at line 1
select * from t1 where pk1 = 1 and pk2 = 's1' and pk3= '2012-12-12 12:00:00' for update wait 1.0.0.0;
ERROR 42000: You have an error in your SQL syntax; check the manual that corresponds to your OceanBase version for the right syntax to use near '.0.0' at line 1
select * from t1 where pk1 = 1 and pk2 = 's1' and pk3= '2012-12-12 12:00:00' for update nowait -1;
ERROR 42000: You have an error in your SQL syntax; check the manual that corresponds to your OceanBase version for the right syntax to use near '-1' at line 1
select * from t1 t where t.pk1 = 1 and t.pk2 = 's1' and t.pk3= '2012-12-12 12:00:00' for update nowait -1;
ERROR 42000: You have an error in your SQL syntax; check the manual that corresponds to your OceanBase version for the right syntax to use near '-1' at line 1
select * from t1 where pk1 = 1 and pk2 = 's1' and pk3= '2012-12-12 12:00:00' for update nowait 0;
ERROR 42000: You have an error in your SQL syntax; check the manual that corresponds to your OceanBase version for the right syntax to use near '0' at line 1
select * from t1 where pk1 = 1 and pk2 = 's1' and pk3= '2012-12-12 12:00:00' for update nowait 1;
ERROR 42000: You have an error in your SQL syntax; check the manual that corresponds to your OceanBase version for the right syntax to use near '1' at line 1
select * from t1 where pk1 = 1 and pk2 = 's1' and pk3= '2012-12-12 12:00:00' for update wait 1.000;
pk1	pk2	pk3	a	b	c
1	s1	2012-12-12 12:00:00.000000	100	s100	2013-12-12 12:00:00.000000
select * from t1 where pk1 = 1 and pk2 = 's1' and pk3= '2012-12-12 12:00:00' for update wait 0.0003;
pk1	pk2	pk3	a	b	c
1	s1	2012-12-12 12:00:00.000000	100	s100	2013-12-12 12:00:00.000000
select * from t1 where pk1 = 1 and pk2 = 's1' and pk3= '2012-12-12 12:00:00' for update wait 0.000001;
pk1	pk2	pk3	a	b	c
1	s1	2012-12-12 12:00:00.000000	100	s100	2013-12-12 12:00:00.000000
select * from t1 where pk1 = 1 and pk2 = 's1' and pk3= '2012-12-12 12:00:00' for update nowait;
pk1	pk2	pk3	a	b	c
1	s1	2012-12-12 12:00:00.000000	100	s100	2013-12-12 12:00:00.000000
commit;
select * from t1 where pk1 = 1 and pk2 = 's1' and pk3= '2012-12-12 12:00:00' for update wait 1.000;
pk1	pk2	pk3	a	b	c
1	s1	2012-12-12 12:00:00.000000	100	s100	2013-12-12 12:00:00.000000
begin;
select * from t1 where pk1 = 1 and pk2 = 's1' and pk3= '2012-12-12 12:00:00' for update wait 0.3;
pk1	pk2	pk3	a	b	c
1	s1	2012-12-12 12:00:00.000000	100	s100	2013-12-12 12:00:00.000000
select * from t1 t where t.pk1 = 1 and t.pk2 = 's1' and t.pk3= '2012-12-12 12:00:00' for update wait 0.3;
pk1	pk2	pk3	a	b	c
1	s1	2012-12-12 12:00:00.000000	100	s100	2013-12-12 12:00:00.000000
select * from t1 where pk1 = 1 and pk2 = 's1' and pk3= '2012-12-12 12:00:00' for update nowait;
pk1	pk2	pk3	a	b	c
1	s1	2012-12-12 12:00:00.000000	100	s100	2013-12-12 12:00:00.000000
select * from t1 t where t.pk1 = 1 and t.pk2 = 's1' and t.pk3= '2012-12-12 12:00:00' for update nowait;
pk1	pk2	pk3	a	b	c
1	s1	2012-12-12 12:00:00.000000	100	s100	2013-12-12 12:00:00.000000
commit;
begin;
select * from t1 where pk1 = 1 and pk2 = 's1' and pk3= '2012-12-12 12:00:00' for update wait 0.0001;
pk1	pk2	pk3	a	b	c
1	s1	2012-12-12 12:00:00.000000	100	s100	2013-12-12 12:00:00.000000
select * from t1 where pk1 = 1 and pk2 = 's1' and pk3= '2012-12-12 12:00:00' for update wait 0.0001;
pk1	pk2	pk3	a	b	c
1	s1	2012-12-12 12:00:00.000000	100	s100	2013-12-12 12:00:00.000000
select * from t1 where pk1 = 1 and pk2 = 's1' and pk3= '2012-12-12 12:00:00' for update nowait;
pk1	pk2	pk3	a	b	c
1	s1	2012-12-12 12:00:00.000000	100	s100	2013-12-12 12:00:00.000000
select * from t1 where pk1 = 1 and pk2 = 's1' and pk3= '2012-12-12 12:00:00' for update nowait;
pk1	pk2	pk3	a	b	c
1	s1	2012-12-12 12:00:00.000000	100	s100	2013-12-12 12:00:00.000000
commit;
begin;
select * from t1 where pk1 = 1 and pk2 = 's1' and pk3= '2012-12-12 12:00:00' for update wait 0.05;
pk1	pk2	pk3	a	b	c
1	s1	2012-12-12 12:00:00.000000	100	s100	2013-12-12 12:00:00.000000
select * from t1 where pk1 = 1 and pk2 = 's1' and pk3= '2012-12-12 12:00:00' for update wait 0.03;
Got one of the listed errors
commit;
begin;
select * from t1 where pk1 = 1 and pk2 = 's1' and pk3= '2012-12-12 12:00:00' for update wait 0.03;
pk1	pk2	pk3	a	b	c
1	s1	2012-12-12 12:00:00.000000	100	s100	2013-12-12 12:00:00.000000
begin;
select * from t1 where pk1 = 1 and pk2 = 's1' and pk3= '2012-12-12 12:00:00' for update wait 0.03;
Got one of the listed errors
select * from t1 t where t.pk1 = 1 and t.pk2 = 's1' and t.pk3= '2012-12-12 12:00:00' for update wait 0.03;
Got one of the listed errors
commit;
commit;
begin;
select * from t1 where pk1 = 1 and pk2 = 's1' and pk3= '2012-12-12 12:00:00' for update wait 0.03;
pk1	pk2	pk3	a	b	c
1	s1	2012-12-12 12:00:00.000000	100	s100	2013-12-12 12:00:00.000000
update t1 set b='s300' where pk1 = 1 and pk2 = 's1' and pk3 = '2012-12-12 12:00:00';
select * from t1 where pk1 = 1 and pk2 = 's1' and pk3 = '2012-12-12 12:00:00';
pk1	pk2	pk3	a	b	c
1	s1	2012-12-12 12:00:00.000000	100	s300	2013-12-12 12:00:00.000000
select * from t1 where pk1 = 1 and pk2 = 's1' and pk3= '2012-12-12 12:00:00' for update nowait;
pk1	pk2	pk3	a	b	c
1	s1	2012-12-12 12:00:00.000000	100	s300	2013-12-12 12:00:00.000000
update t1 set b='s400' where pk1 = 1 and pk2 = 's1' and pk3 = '2012-12-12 12:00:00';
select * from t1 where pk1 = 1 and pk2 = 's1' and pk3 = '2012-12-12 12:00:00';
pk1	pk2	pk3	a	b	c
1	s1	2012-12-12 12:00:00.000000	100	s400	2013-12-12 12:00:00.000000
begin;
select * from t1 where pk1 = 1 and pk2 = 's1' and pk3= '2012-12-12 12:00:00' for update nowait;
Got one of the listed errors
select * from t1 where pk1 = 1 and pk2 = 's1' and pk3= '2012-12-12 12:00:00' for update wait 0.5;
commit;
update t1 set b='s100' where pk1 = 1 and pk2 = 's1' and pk3 = '2012-12-12 12:00:00';
select * from t1 where pk1 = 1 and pk2 = 's1' and pk3 = '2012-12-12 12:00:00';
pk1	pk2	pk3	a	b	c
1	s1	2012-12-12 12:00:00.000000	100	s100	2013-12-12 12:00:00.000000
commit;
select * from t1;
pk1	pk2	pk3	a	b	c
1	s1	2012-12-12 12:00:00.000000	100	s100	2013-12-12 12:00:00.000000
2	s2	2012-12-12 12:00:00.000000	200	s200	2013-12-12 12:00:00.000000
begin;
select * from t1 where pk1 = 1 and pk2 = 's1' and pk3= '2012-12-12 12:00:00' for update wait 0.09;
pk1	pk2	pk3	a	b	c
1	s1	2012-12-12 12:00:00.000000	100	s100	2013-12-12 12:00:00.000000
update t1 set b='s300' where pk1 = 1 and pk2 = 's1' and pk3 = '2012-12-12 12:00:00';
select * from t1 where pk1 = 1 and pk2 = 's1' and pk3 = '2012-12-12 12:00:00';
pk1	pk2	pk3	a	b	c
1	s1	2012-12-12 12:00:00.000000	100	s300	2013-12-12 12:00:00.000000
select * from t1 where pk1 = 1 and pk2 = 's1' and pk3= '2012-12-12 12:00:00' for update nowait;
pk1	pk2	pk3	a	b	c
1	s1	2012-12-12 12:00:00.000000	100	s300	2013-12-12 12:00:00.000000
update t1 set b='s400' where pk1 = 1 and pk2 = 's1' and pk3 = '2012-12-12 12:00:00';
select * from t1 where pk1 = 1 and pk2 = 's1' and pk3 = '2012-12-12 12:00:00';
pk1	pk2	pk3	a	b	c
1	s1	2012-12-12 12:00:00.000000	100	s400	2013-12-12 12:00:00.000000
commit;
begin;
select * from t1 where pk1 = 1 and pk2 = 's1' and pk3= '2012-12-12 12:00:00' for update nowait;
pk1	pk2	pk3	a	b	c
1	s1	2012-12-12 12:00:00.000000	100	s400	2013-12-12 12:00:00.000000
update t1 set b='s500' where pk1 = 1 and pk2 = 's1' and pk3 = '2012-12-12 12:00:00';
select * from t1 where pk1 = 1 and pk2 = 's1' and pk3 = '2012-12-12 12:00:00';
pk1	pk2	pk3	a	b	c
1	s1	2012-12-12 12:00:00.000000	100	s500	2013-12-12 12:00:00.000000
select * from t1 where pk1 = 1 and pk2 = 's1' and pk3= '2012-12-12 12:00:00' for update wait 0.03;
pk1	pk2	pk3	a	b	c
1	s1	2012-12-12 12:00:00.000000	100	s500	2013-12-12 12:00:00.000000
update t1 set b='s100' where pk1 = 1 and pk2 = 's1' and pk3 = '2012-12-12 12:00:00';
select * from t1 where pk1 = 1 and pk2 = 's1' and pk3 = '2012-12-12 12:00:00';
pk1	pk2	pk3	a	b	c
1	s1	2012-12-12 12:00:00.000000	100	s100	2013-12-12 12:00:00.000000
commit;
select * from t1;
pk1	pk2	pk3	a	b	c
1	s1	2012-12-12 12:00:00.000000	100	s100	2013-12-12 12:00:00.000000
2	s2	2012-12-12 12:00:00.000000	200	s200	2013-12-12 12:00:00.000000
begin;
select * from t1 where pk1 = 1 and pk2 = 's1' and pk3= '2012-12-12 12:00:00' for update wait 0.03;
pk1	pk2	pk3	a	b	c
1	s1	2012-12-12 12:00:00.000000	100	s100	2013-12-12 12:00:00.000000
update t1 set b='s300' where pk1 = 1 and pk2 = 's1' and pk3 = '2012-12-12 12:00:00';
select * from t1 where pk1 = 1 and pk2 = 's1' and pk3 = '2012-12-12 12:00:00';
pk1	pk2	pk3	a	b	c
1	s1	2012-12-12 12:00:00.000000	100	s300	2013-12-12 12:00:00.000000
select * from t1 where pk1 = 1 and pk2 = 's1' and pk3= '2012-12-12 12:00:00' for update nowait;
pk1	pk2	pk3	a	b	c
1	s1	2012-12-12 12:00:00.000000	100	s300	2013-12-12 12:00:00.000000
update t1 set b='s400' where pk1 = 1 and pk2 = 's1' and pk3 = '2012-12-12 12:00:00';
select * from t1 where pk1 = 1 and pk2 = 's1' and pk3 = '2012-12-12 12:00:00';
pk1	pk2	pk3	a	b	c
1	s1	2012-12-12 12:00:00.000000	100	s400	2013-12-12 12:00:00.000000
begin;
select * from t1 where pk1 = 1 and pk2 = 's1' and pk3= '2012-12-12 12:00:00' for update nowait;
Got one of the listed errors
select * from t1 where pk1 = 1 and pk2 = 's1' and pk3= '2012-12-12 12:00:00' for update wait 0.5;
commit;
pk1	pk2	pk3	a	b	c
1	s1	2012-12-12 12:00:00.000000	100	s400	2013-12-12 12:00:00.000000
update t1 set b='s100' where pk1 = 1 and pk2 = 's1' and pk3 = '2012-12-12 12:00:00';
commit;
select * from t1;
pk1	pk2	pk3	a	b	c
1	s1	2012-12-12 12:00:00.000000	100	s100	2013-12-12 12:00:00.000000
2	s2	2012-12-12 12:00:00.000000	200	s200	2013-12-12 12:00:00.000000
begin;
select * from t1 where pk1 = 1 and pk2 = 's1' and pk3= '2012-12-12 12:00:00' for update wait 0.03;
pk1	pk2	pk3	a	b	c
1	s1	2012-12-12 12:00:00.000000	100	s100	2013-12-12 12:00:00.000000
update t1 set b='s300' where pk1 = 1 and pk2 = 's1' and pk3 = '2012-12-12 12:00:00';
select * from t1 where pk1 = 1 and pk2 = 's1' and pk3 = '2012-12-12 12:00:00';
pk1	pk2	pk3	a	b	c
1	s1	2012-12-12 12:00:00.000000	100	s300	2013-12-12 12:00:00.000000
select * from t1 where pk1 = 1 and pk2 = 's1' and pk3= '2012-12-12 12:00:00' for update nowait;
pk1	pk2	pk3	a	b	c
1	s1	2012-12-12 12:00:00.000000	100	s300	2013-12-12 12:00:00.000000
update t1 set b='s400' where pk1 = 1 and pk2 = 's1' and pk3 = '2012-12-12 12:00:00';
select * from t1 where pk1 = 1 and pk2 = 's1' and pk3 = '2012-12-12 12:00:00';
pk1	pk2	pk3	a	b	c
1	s1	2012-12-12 12:00:00.000000	100	s400	2013-12-12 12:00:00.000000
begin;
select * from t1 where pk1 = 1 and pk2 = 's1' and pk3= '2012-12-12 12:00:00' for update nowait;
Got one of the listed errors
select * from t1 where pk1 = 1 and pk2 = 's1' and pk3= '2012-12-12 12:00:00' for update wait 0.5;
rollback;
update t1 set b='s100' where pk1 = 1 and pk2 = 's1' and pk3 = '2012-12-12 12:00:00';
select * from t1 where pk1 = 1 and pk2 = 's1' and pk3 = '2012-12-12 12:00:00';
pk1	pk2	pk3	a	b	c
1	s1	2012-12-12 12:00:00.000000	100	s100	2013-12-12 12:00:00.000000
commit;
select * from t1;
pk1	pk2	pk3	a	b	c
1	s1	2012-12-12 12:00:00.000000	100	s100	2013-12-12 12:00:00.000000
2	s2	2012-12-12 12:00:00.000000	200	s200	2013-12-12 12:00:00.000000
begin;
select * from t1 where pk1 = 1 and pk2 = 's1' and pk3= '2012-12-12 12:00:00' for update wait 0.03;
pk1	pk2	pk3	a	b	c
1	s1	2012-12-12 12:00:00.000000	100	s100	2013-12-12 12:00:00.000000
update t1 set b='s300' where pk1 = 1 and pk2 = 's1' and pk3 = '2012-12-12 12:00:00';
select * from t1 where pk1 = 1 and pk2 = 's1' and pk3 = '2012-12-12 12:00:00';
pk1	pk2	pk3	a	b	c
1	s1	2012-12-12 12:00:00.000000	100	s300	2013-12-12 12:00:00.000000
select * from t1 where pk1 = 1 and pk2 = 's1' and pk3= '2012-12-12 12:00:00' for update nowait;
pk1	pk2	pk3	a	b	c
1	s1	2012-12-12 12:00:00.000000	100	s300	2013-12-12 12:00:00.000000
update t1 set b='s400' where pk1 = 1 and pk2 = 's1' and pk3 = '2012-12-12 12:00:00';
select * from t1 where pk1 = 1 and pk2 = 's1' and pk3 = '2012-12-12 12:00:00';
pk1	pk2	pk3	a	b	c
1	s1	2012-12-12 12:00:00.000000	100	s400	2013-12-12 12:00:00.000000
rollback;
begin;
select * from t1 where pk1 = 1 and pk2 = 's1' and pk3= '2012-12-12 12:00:00' for update nowait;
pk1	pk2	pk3	a	b	c
1	s1	2012-12-12 12:00:00.000000	100	s100	2013-12-12 12:00:00.000000
update t1 set b='s500' where pk1 = 1 and pk2 = 's1' and pk3 = '2012-12-12 12:00:00';
select * from t1 where pk1 = 1 and pk2 = 's1' and pk3 = '2012-12-12 12:00:00';
pk1	pk2	pk3	a	b	c
1	s1	2012-12-12 12:00:00.000000	100	s500	2013-12-12 12:00:00.000000
select * from t1 where pk1 = 1 and pk2 = 's1' and pk3= '2012-12-12 12:00:00' for update wait 0.03;
pk1	pk2	pk3	a	b	c
1	s1	2012-12-12 12:00:00.000000	100	s500	2013-12-12 12:00:00.000000
update t1 set b='s100' where pk1 = 1 and pk2 = 's1' and pk3 = '2012-12-12 12:00:00';
select * from t1 where pk1 = 1 and pk2 = 's1' and pk3 = '2012-12-12 12:00:00';
pk1	pk2	pk3	a	b	c
1	s1	2012-12-12 12:00:00.000000	100	s100	2013-12-12 12:00:00.000000
commit;
select * from t1;
pk1	pk2	pk3	a	b	c
1	s1	2012-12-12 12:00:00.000000	100	s100	2013-12-12 12:00:00.000000
2	s2	2012-12-12 12:00:00.000000	200	s200	2013-12-12 12:00:00.000000
begin;
select * from t1 where pk1 = 1 and pk2 = 's1' and pk3= '2012-12-12 12:00:00' for update wait 0.03;
pk1	pk2	pk3	a	b	c
1	s1	2012-12-12 12:00:00.000000	100	s100	2013-12-12 12:00:00.000000
update t1 set b='s300' where pk1 = 1 and pk2 = 's1' and pk3 = '2012-12-12 12:00:00';
select * from t1 where pk1 = 1 and pk2 = 's1' and pk3 = '2012-12-12 12:00:00';
pk1	pk2	pk3	a	b	c
1	s1	2012-12-12 12:00:00.000000	100	s300	2013-12-12 12:00:00.000000
select * from t1 where pk1 = 1 and pk2 = 's1' and pk3= '2012-12-12 12:00:00' for update nowait;
pk1	pk2	pk3	a	b	c
1	s1	2012-12-12 12:00:00.000000	100	s300	2013-12-12 12:00:00.000000
update t1 set b='s400' where pk1 = 1 and pk2 = 's1' and pk3 = '2012-12-12 12:00:00';
select * from t1 where pk1 = 1 and pk2 = 's1' and pk3 = '2012-12-12 12:00:00';
pk1	pk2	pk3	a	b	c
1	s1	2012-12-12 12:00:00.000000	100	s400	2013-12-12 12:00:00.000000
begin;
select * from t1 where pk1 = 1 and pk2 = 's1' and pk3= '2012-12-12 12:00:00' for update nowait;
Got one of the listed errors
select * from t1 where pk1 = 1 and pk2 = 's1' and pk3= '2012-12-12 12:00:00' for update wait 0.5;
rollback;
pk1	pk2	pk3	a	b	c
1	s1	2012-12-12 12:00:00.000000	100	s100	2013-12-12 12:00:00.000000
update t1 set b='s100' where pk1 = 1 and pk2 = 's1' and pk3 = '2012-12-12 12:00:00';
commit;
select * from t1;
pk1	pk2	pk3	a	b	c
1	s1	2012-12-12 12:00:00.000000	100	s100	2013-12-12 12:00:00.000000
2	s2	2012-12-12 12:00:00.000000	200	s200	2013-12-12 12:00:00.000000
begin;
select * from t1 where pk1 = 1 and pk2 = 's1' and pk3= '2012-12-12 12:00:00' for update nowait;
pk1	pk2	pk3	a	b	c
1	s1	2012-12-12 12:00:00.000000	100	s100	2013-12-12 12:00:00.000000
begin;
select * from t1 where pk1 = 2 and pk2 = 's2' and pk3= '2012-12-12 12:00:00' for update nowait;
pk1	pk2	pk3	a	b	c
2	s2	2012-12-12 12:00:00.000000	200	s200	2013-12-12 12:00:00.000000
select * from t1 where pk1 = 2 and pk2 = 's2' and pk3= '2012-12-12 12:00:00' for update wait 1;
select * from t1 where pk1 = 1 and pk2 = 's1' and pk3= '2012-12-12 12:00:00' for update wait 1;
Got one of the listed errors
Got one of the listed errors
commit;
commit;
begin;
select * from t1 t where t.pk1 = 1 and t.pk2 = 's1' and t.pk3= '2012-12-12 12:00:00' for update wait 0.03;
pk1	pk2	pk3	a	b	c
1	s1	2012-12-12 12:00:00.000000	100	s100	2013-12-12 12:00:00.000000
update t1 set b='s300' where pk1 = 1 and pk2 = 's1' and pk3 = '2012-12-12 12:00:00';
select * from t1 where pk1 = 1 and pk2 = 's1' and pk3 = '2012-12-12 12:00:00';
pk1	pk2	pk3	a	b	c
1	s1	2012-12-12 12:00:00.000000	100	s300	2013-12-12 12:00:00.000000
select * from t1 t where t.pk1 = 1 and t.pk2 = 's1' and t.pk3= '2012-12-12 12:00:00' for update nowait;
pk1	pk2	pk3	a	b	c
1	s1	2012-12-12 12:00:00.000000	100	s300	2013-12-12 12:00:00.000000
update t1 set b='s400' where pk1 = 1 and pk2 = 's1' and pk3 = '2012-12-12 12:00:00';
select * from t1 where pk1 = 1 and pk2 = 's1' and pk3 = '2012-12-12 12:00:00';
pk1	pk2	pk3	a	b	c
1	s1	2012-12-12 12:00:00.000000	100	s400	2013-12-12 12:00:00.000000
commit;
drop table if exists testalias;
create table testalias(a int primary key,b varchar(20));
a	b
1	abcd
2	abcd
3	abcd
4	abcd
5	abcd
6	abcd
7	abcd
8	abcd
9	abcd
10	abcd
11	abcd
12	abcd
13	abcd
14	abcd
15	abcd
16	abcd
17	abcd
18	abcd
19	abcd
20	abcd
21	abcd
22	abcd
23	abcd
24	abcd
25	abcd
26	abcd
27	abcd
28	abcd
29	abcd
30	abcd
31	abcd
32	abcd
33	abcd
34	abcd
35	abcd
36	abcd
37	abcd
38	abcd
39	abcd
40	abcd
41	abcd
42	abcd
43	abcd
44	abcd
45	abcd
46	abcd
47	abcd
48	abcd
49	abcd
50	abcd
a	b
1	abcd
2	abcd
3	abcd
4	abcd
5	abcd
6	abcd
7	abcd
8	abcd
9	abcd
10	abcd
11	abcd
12	abcd
13	abcd
14	abcd
15	abcd
16	abcd
17	abcd
18	abcd
19	abcd
20	abcd
21	abcd
22	abcd
23	abcd
24	abcd
25	abcd
26	abcd
27	abcd
28	abcd
29	abcd
30	abcd
31	abcd
32	abcd
33	abcd
34	abcd
35	abcd
36	abcd
37	abcd
38	abcd
39	abcd
40	abcd
41	abcd
42	abcd
43	abcd
44	abcd
45	abcd
46	abcd
47	abcd
48	abcd
49	abcd
50	abcd
a	b
10	abcd
a	b
10	abcd
11	abcd
12	abcd
13	abcd
14	abcd
15	abcd
16	abcd
17	abcd
18	abcd
19	abcd
20	abcd
