show variables like 'ob_query_timeout';
Variable_name	Value
ob_query_timeout	10000000
drop table if exists t1,t2;
create table t1(pk1 int , pk2 varchar(1024), pk3 datetime(6), a int, b varchar(1024), c datetime(6), primary key(pk1,pk2,pk3));
insert into t1 values(1,'conn1','2012-12-12 12:00:00',100, 'r100','2013-12-12 12:00:00' );
insert into t1 values(2,'conn2','2012-12-12 12:00:00',200, 'r200','2013-12-12 12:00:00' );
begin;
select *  from t1 where pk1=1 and pk2='conn1' and pk3='2012-12-12 12:00:00' for update;
pk1	pk2	pk3	a	b	c
1	conn1	2012-12-12 12:00:00.000000	100	r100	2013-12-12 12:00:00.000000
update t1 set a=a+1 where pk1=1 and pk2='conn1' and pk3='2012-12-12 12:00:00';
begin;
select *  from t1 where pk1=1 and pk2='conn1' and pk3='2012-12-12 12:00:00' for update;
commit;
pk1	pk2	pk3	a	b	c
1	conn1	2012-12-12 12:00:00.000000	101	r100	2013-12-12 12:00:00.000000
update t1 set b='abc' where pk1 = 1 and pk2 = 'conn1' and pk3 = '2012-12-12 12:00:00';
commit;
select * from t1;
pk1	pk2	pk3	a	b	c
1	conn1	2012-12-12 12:00:00.000000	101	abc	2013-12-12 12:00:00.000000
2	conn2	2012-12-12 12:00:00.000000	200	r200	2013-12-12 12:00:00.000000
replace into t1 values(1,'conn1','2012-12-12 12:00:00',100, 'r100','2013-12-12 12:00:00' );
replace into t1 values(2,'conn2','2012-12-12 12:00:00',200, 'r200','2013-12-12 12:00:00' );
begin;
select *  from t1 where pk1=1 and pk2='conn1' and pk3='2012-12-12 12:00:00' for update;
pk1	pk2	pk3	a	b	c
1	conn1	2012-12-12 12:00:00.000000	100	r100	2013-12-12 12:00:00.000000
update t1 set b = 'r2000' where pk1 = 1 and pk2 = 'conn1' and pk3 = '2012-12-12 12:00:00';
begin;
update t1 set b = 'r2000' where pk1 = 2 and pk2 = 'conn2' and pk3 = '2012-12-12 12:00:00';
delete from t1 where pk1 = 2 and pk2 = 'conn2' and pk3 = '2012-12-12 12:00:00';
insert into t1 values(2,'conn2','2012-12-12 12:00:00',200, 'nr200','2013-12-12 12:00:00' );
update t1 set b = 'r20000' where pk1 = 1 and pk2 = 'conn1' and pk3 = '2012-12-12 12:00:00';
commit;
commit;
select * from t1;
pk1	pk2	pk3	a	b	c
1	conn1	2012-12-12 12:00:00.000000	100	r20000	2013-12-12 12:00:00.000000
2	conn2	2012-12-12 12:00:00.000000	200	nr200	2013-12-12 12:00:00.000000
replace into t1 values(1,'conn1','2012-12-12 12:00:00',100, 'r100','2013-12-12 12:00:00' );
replace into t1 values(2,'conn2','2012-12-12 12:00:00',200, 'r200','2013-12-12 12:00:00' );
begin;
select *  from t1 where pk1=1 and pk2='conn1' and pk3='2012-12-12 12:00:00' for update;
pk1	pk2	pk3	a	b	c
1	conn1	2012-12-12 12:00:00.000000	100	r100	2013-12-12 12:00:00.000000
delete from t1 where pk1=1 and pk2='conn1' and pk3='2012-12-12 12:00:00';
begin;
select *  from t1 where pk1=1 and pk2='conn1' and pk3='2012-12-12 12:00:00' for update;
rollback;
pk1	pk2	pk3	a	b	c
1	conn1	2012-12-12 12:00:00.000000	100	r100	2013-12-12 12:00:00.000000
update t1 set b='abc' where pk1 = 1 and pk2 = 'conn1' and pk3 = '2012-12-12 12:00:00';
commit;
select * from t1;
pk1	pk2	pk3	a	b	c
1	conn1	2012-12-12 12:00:00.000000	100	abc	2013-12-12 12:00:00.000000
2	conn2	2012-12-12 12:00:00.000000	200	r200	2013-12-12 12:00:00.000000
replace into t1 values(1,'conn1','2012-12-12 12:00:00',100, 'r100','2013-12-12 12:00:00' );
replace into t1 values(2,'conn2','2012-12-12 12:00:00',200, 'r200','2013-12-12 12:00:00' );
begin;
select *  from t1 where pk1=1 and pk2='conn1' and pk3='2012-12-12 12:00:00' for update;
pk1	pk2	pk3	a	b	c
1	conn1	2012-12-12 12:00:00.000000	100	r100	2013-12-12 12:00:00.000000
delete from t1 where pk1 = 1 and pk2 = 'conn1' and pk3 = '2012-12-12 12:00:00';
begin;
update t1 set b = 'r2000' where pk1 = 2 and pk2 = 'conn2' and pk3 = '2012-12-12 12:00:00';
delete from t1 where pk1 = 2 and pk2 = 'conn2' and pk3 = '2012-12-12 12:00:00';
insert into t1 values(2,'conn2','2012-12-12 12:00:00',200, 'nr200','2013-12-12 12:00:00' );
update t1 set b = 'r20000' where pk1 = 1 and pk2 = 'conn1' and pk3 = '2012-12-12 12:00:00';
rollback;
commit;
select * from t1;
pk1	pk2	pk3	a	b	c
1	conn1	2012-12-12 12:00:00.000000	100	r20000	2013-12-12 12:00:00.000000
2	conn2	2012-12-12 12:00:00.000000	200	nr200	2013-12-12 12:00:00.000000
replace into t1 values(1,'conn1','2012-12-12 12:00:00',100, 'r100','2013-12-12 12:00:00' );
replace into t1 values(2,'conn2','2012-12-12 12:00:00',200, 'r200','2013-12-12 12:00:00' );
begin;
update t1 set b='r1000' where pk1 = 1 and pk2 = 'conn1' and pk3 = '2012-12-12 12:00:00';
select * from t1 where pk1 = 1 and pk2 = 'conn1' and pk3 = '2012-12-12 12:00:00' for update;
pk1	pk2	pk3	a	b	c
1	conn1	2012-12-12 12:00:00.000000	100	r1000	2013-12-12 12:00:00.000000
update t1 set b='r1000_2' where pk1 = 1 and pk2 = 'conn1' and pk3 = '2012-12-12 12:00:00';
commit;
commit;
select * from t1;
pk1	pk2	pk3	a	b	c
1	conn1	2012-12-12 12:00:00.000000	100	r1000_2	2013-12-12 12:00:00.000000
2	conn2	2012-12-12 12:00:00.000000	200	r200	2013-12-12 12:00:00.000000
