drop table if exists tbl1,tbl2;
create table tbl1 (pk int,i1 int, v2 varchar(80), i3 char(20),i4 float, d4 datetime(6),i5 decimal(5,3),i6 bool, primary key(pk));
insert into tbl1 values(1,1,'abc12','1agc',1.25,'2014-01-01 12:00:00',23.23,1),
(2,10,'23abc12','4agc1',-0.25,'2015-11-01 12:00:00',-23.230,0),
(3,201,'xx23abc12','cagc1',-2.25,'2015-11-21 11:20:10',3.231,1),
(4,80,'zx23abc12','zcagc1',2.25,'2013-01-21 11:20:10',-3.231,1),
(5,53,'cx23abc12','rcagc1',109.25,'2016-01-22 11:20:10',-13.131,0);
create index idx1 on tbl1(i3);
insert into tbl1 values (6,78,'tx23abc12','icagc1',-109.25,'2014-09-16 16:24:00',-13.531,1),(8,50,'vx23abc12','wcagc1',-85.85,'2014-09-10 16:20:21',93.131,1),(9,610,'ukx23abc12','pecagc1',-1.85,'2014-09-19 16:20:21',99.131,0),(10,42,'kx23abc12','ecagc1',-85.86,'2014-09-18 16:20:21',-99.131,1),(11,null,null,null,null,null,null,null);
set autocommit=0;
set autocommit=0;
select 1  from tbl1  where pk=null for update;
1
insert into  tbl1 values(100,102,'abdggc12','1agc1d',1.215,'2014-01-01 12:00:10',33.23,1);
commit;
commit;
update tbl1 set pk=12 where pk is null;
commit;
select  *  from tbl1  where pk is null for update;
pk	i1	v2	i3	i4	d4	i5	i6
insert into  tbl1 values(2015,104,'abdgsdgc12','as1agc1d',1.1215,'2016-01-01 12:00:10',43.123,1);
commit;
commit;
select    *  from tbl1  where pk in (1,100,2,200,null) for update;
pk	i1	v2	i3	i4	d4	i5	i6
1	1	abc12	1agc	1.25	2014-01-01 12:00:00.000000	23.230	1
2	10	23abc12	4agc1	-0.25	2015-11-01 12:00:00.000000	-23.230	0
100	102	abdggc12	1agc1d	1.215	2014-01-01 12:00:10.000000	33.230	1
update tbl1 set pk=200 where pk=100;
Got one of the listed errors
delete  from tbl1 where pk is null;
update tbl1 set pk=21 where pk=2;
Got one of the listed errors
commit;
commit;
select  *  from tbl1  where i5 is not null and pk>=5 and i1>500 for update;
pk	i1	v2	i3	i4	d4	i5	i6
9	610	ukx23abc12	pecagc1	-1.85	2014-09-19 16:20:21.000000	99.131	0
insert into  tbl1 values(401,108,'adaadbdgsdgc12','abass1agc1d',1.6215,'2018-01-01 12:10:10',-63.123,1);
update tbl1 set pk=29 where pk in (9,-9,-90,-100);
Got one of the listed errors
select * from tbl1 where pk=29 for update;
pk	i1	v2	i3	i4	d4	i5	i6
commit;
commit;
select * from tbl1;
pk	i1	v2	i3	i4	d4	i5	i6
1	1	abc12	1agc	1.25	2014-01-01 12:00:00.000000	23.230	1
2	10	23abc12	4agc1	-0.25	2015-11-01 12:00:00.000000	-23.230	0
3	201	xx23abc12	cagc1	-2.25	2015-11-21 11:20:10.000000	3.231	1
4	80	zx23abc12	zcagc1	2.25	2013-01-21 11:20:10.000000	-3.231	1
5	53	cx23abc12	rcagc1	109.25	2016-01-22 11:20:10.000000	-13.131	0
6	78	tx23abc12	icagc1	-109.25	2014-09-16 16:24:00.000000	-13.531	1
8	50	vx23abc12	wcagc1	-85.85	2014-09-10 16:20:21.000000	93.131	1
9	610	ukx23abc12	pecagc1	-1.85	2014-09-19 16:20:21.000000	99.131	0
10	42	kx23abc12	ecagc1	-85.86	2014-09-18 16:20:21.000000	-99.131	1
11	NULL	NULL	NULL	NULL	NULL	NULL	NULL
100	102	abdggc12	1agc1d	1.215	2014-01-01 12:00:10.000000	33.230	1
401	108	adaadbdgsdgc12	abass1agc1d	1.6215	2018-01-01 12:10:10.000000	-63.123	1
2015	104	abdgsdgc12	as1agc1d	1.1215	2016-01-01 12:00:10.000000	43.123	1
select  *  from tbl1  where pk is not null and pk in (-9,-90,-100,1,2,7,8,9) and i1>500 for update;
pk	i1	v2	i3	i4	d4	i5	i6
9	610	ukx23abc12	pecagc1	-1.85	2014-09-19 16:20:21.000000	99.131	0
insert into  tbl1 values(405,108,'adaadbdgsdgc12','abass1agc1d',1.6215,'2018-01-01 12:10:10',-63.123,1);
update tbl1 set pk=30 where pk in (10,-9,-90,-100);
update tbl1 set pk=31 where pk in (1,9,-90,-100);
Got one of the listed errors
select * from tbl1 where pk=30;
pk	i1	v2	i3	i4	d4	i5	i6
30	42	kx23abc12	ecagc1	-85.86	2014-09-18 16:20:21.000000	-99.131	1
select * from tbl1 where pk=31;
pk	i1	v2	i3	i4	d4	i5	i6
commit;
commit;
select * from tbl1;
pk	i1	v2	i3	i4	d4	i5	i6
1	1	abc12	1agc	1.25	2014-01-01 12:00:00.000000	23.230	1
2	10	23abc12	4agc1	-0.25	2015-11-01 12:00:00.000000	-23.230	0
3	201	xx23abc12	cagc1	-2.25	2015-11-21 11:20:10.000000	3.231	1
4	80	zx23abc12	zcagc1	2.25	2013-01-21 11:20:10.000000	-3.231	1
5	53	cx23abc12	rcagc1	109.25	2016-01-22 11:20:10.000000	-13.131	0
6	78	tx23abc12	icagc1	-109.25	2014-09-16 16:24:00.000000	-13.531	1
8	50	vx23abc12	wcagc1	-85.85	2014-09-10 16:20:21.000000	93.131	1
9	610	ukx23abc12	pecagc1	-1.85	2014-09-19 16:20:21.000000	99.131	0
11	NULL	NULL	NULL	NULL	NULL	NULL	NULL
30	42	kx23abc12	ecagc1	-85.86	2014-09-18 16:20:21.000000	-99.131	1
100	102	abdggc12	1agc1d	1.215	2014-01-01 12:00:10.000000	33.230	1
401	108	adaadbdgsdgc12	abass1agc1d	1.6215	2018-01-01 12:10:10.000000	-63.123	1
405	108	adaadbdgsdgc12	abass1agc1d	1.6215	2018-01-01 12:10:10.000000	-63.123	1
2015	104	abdgsdgc12	as1agc1d	1.1215	2016-01-01 12:00:10.000000	43.123	1
