alter system set enable_sql_audit='false' server_type=mergeserver;
drop table if exists t1,t2,t3,t4;
create user 'user4' identified by 'user4';
create user 'user5' identified by 'user5';
create user 'user6' identified by 'user6';
alter system set enable_sql_audit='True' server_type=mergeserver;
insert into __all_server (cluster_id, svr_type, svr_ip, svr_port, inner_port) values (9, 'type', '127.0.0.1', 1234, 1234);
update __all_server set svr_ip='255.255.255.255' where cluster_id=9;
select count(*) from __all_server;
count(*)
5
delete from __all_server where svr_type='type';
begin;
insert into __all_server (cluster_id, svr_type, svr_ip, svr_port, inner_port) values (9, 'type', '127.0.0.1', 1234, 1234);
update __all_server set svr_ip='255.255.255.255' where cluster_id=9;
select count(*) from __all_server;
count(*)
5
delete from __all_server where svr_type='type';
rollback;
create table t1(c1 int primary key);
drop table t1;
select username, sql, params, request_type, status, affected_row from __all_audit_statement where request_type != 129 and request_type != 130 order by request_timestamp;
username	sql	params	request_type	status	affected_row
admin	select @@version_comment limit 1		3	0	1
admin	alter system set enable_sql_audit='false' server_type=mergeserver		3	0	0
create table t1 (c1 int primary key);
insert into t1 values(1);
update t1 set c1 = 2;
select * from t1;
c1
2
delete from t1;
begin;
insert into t1 values(1);
update t1 set c1 = 2;
select * from t1;
c1
2
delete from t1;
commit;
drop table t1;
select username, sql, params, request_type, status, affected_row from __all_audit_statement where request_type != 129 and request_type != 130 order by request_timestamp;
username	sql	params	request_type	status	affected_row
admin	select @@version_comment limit 1		3	0	1
admin	alter system set enable_sql_audit='false' server_type=mergeserver		3	0	0
admin	drop table t1		3	0	0
create table t1 (c1 int primary key);
ssss;
master;
user;
select username, sql, params, request_type, status, affected_row from __all_audit_statement where request_type != 129 and request_type != 130 order by request_timestamp;
username	sql	params	request_type	status	affected_row
admin	select @@version_comment limit 1		3	0	1
admin	alter system set enable_sql_audit='false' server_type=mergeserver		3	0	0
admin	drop table t1		3	0	0
admin	select username, sql, params, request_type, status, affected_row from __all_audit_statement where request_type != 129 and request_type != 130 order by request_timestamp		3	0	3
admin	create table t1 (c1 int primary key)		3	0	0
admin	ssss		3	1	0
admin	master		3	1	0
admin	user		3	1	0
create table t2 (c1 int primary key);
select username, sql, params, request_type, status, affected_row from __all_audit_statement order by request_timestamp desc limit 1;
username	sql	params	request_type	status	affected_row
admin	create table t2 (c1 int primary key)		3	0	0
help 'alter table';
select username, sql, params, request_type, status, affected_row from __all_audit_statement order by request_timestamp desc limit 1;
username	sql	params	request_type	status	affected_row
admin	help 'alter table'		3	0	1
alter table t2 rename to t3;
select username, sql, params, request_type, status, affected_row from __all_audit_statement order by request_timestamp desc limit 1;
username	sql	params	request_type	status	affected_row
admin	alter table t2 rename to t3		3	0	0
alter table t3 set COMPRESSION = 'none';
select username, sql, params, request_type, status, affected_row from __all_audit_statement order by request_timestamp desc limit 1;
username	sql	params	request_type	status	affected_row
admin	alter table t3 set COMPRESSION = 'none'		3	0	0
alter system switch rootserver master;
select username, sql, params, request_type, status, affected_row from __all_audit_statement order by request_timestamp desc limit 1;
username	sql	params	request_type	status	affected_row
admin	alter system switch rootserver master		3	0	0
alter system reload cluster;
select username, sql, params, request_type, status, affected_row from __all_audit_statement order by request_timestamp desc limit 1;
username	sql	params	request_type	status	affected_row
admin	alter system reload cluster		3	0	0
insert into t1 values(1),(1);
select username, sql, params, request_type, status, affected_row from __all_audit_statement order by request_timestamp desc limit 1;
username	sql	params	request_type	status	affected_row
admin	insert into t1 values(1),(1)		3	1	0
select * from t1,t3;
select username, sql, params, request_type, status, affected_row from __all_audit_statement order by request_timestamp desc limit 1;
username	sql	params	request_type	status	affected_row
admin	select * from t1,t3		3	1	0
select t1 from t1;
select username, sql, params, request_type, status, affected_row from __all_audit_statement order by request_timestamp desc limit 1;
username	sql	params	request_type	status	affected_row
admin	select t1 from t1		3	1	0
insert into t3 values (1);
select username, sql, params, request_type, status, affected_row from __all_audit_statement order by request_timestamp desc limit 1;
username	sql	params	request_type	status	affected_row
admin	insert into t3 values (1)		3	0	1
update t3 set c1=2 where c1=1;
select username, sql, params, request_type, status, affected_row from __all_audit_statement order by request_timestamp desc limit 1;
username	sql	params	request_type	status	affected_row
admin	update t3 set c1=2 where c1=1		3	0	1
grant all privileges on t3 to 'user4';
select username, sql, params, request_type, status, affected_row from __all_audit_statement order by request_timestamp desc limit 1;
username	sql	params	request_type	status	affected_row
admin	grant all privileges on t3 to 'user4'		3	0	0
grant all privileges on t3 to 'user5';
select username, sql, params, request_type, status, affected_row from __all_audit_statement order by request_timestamp desc limit 1;
username	sql	params	request_type	status	affected_row
admin	grant all privileges on t3 to 'user5'		3	0	0
begin;
select * from t3 where c1=2 for update wait 5;
c1
2
begin;
update t3 set c1=3 where c1=2;
rollback;
commit;
select * from t3;
c1
3
select username, sql, params, request_type, status, affected_row from __all_audit_statement order by request_timestamp desc limit 7;
username	sql	params	request_type	status	affected_row
admin	select * from t3		3	0	1
user5	commit		3	0	0
user5	update t3 set c1=3 where c1=2		3	0	1
user4	rollback		3	0	0
user5	begin		3	0	0
user4	select * from t3 where c1=2 for update wait 5		3	0	1
user4	begin		3	0	0
prepare stmt from select ?;
set @a=1;
execute stmt using @a;
?
1
select username, sql, params, request_type, status, affected_row from __all_audit_statement order by request_timestamp desc limit 3;
username	sql	params	request_type	status	affected_row
admin	select ?	[{"int":1}]	3	0	1
admin	set @a=1		3	0	0
admin	prepare stmt from select ?		3	0	0
