drop database if exists jx_db;
create database jx_db;
use jx_db;
drop table if exists t1, t2, test_truncate_doudouge;
purge recyclebin;
set @@recyclebin = on;
create table t1 (a integer, b integer,c1 CHAR(10));
insert into t1 (a) values (1),(2);
truncate table t1;
select count(*) from t1;
count(*)
0
insert into t1 values(1,2,"test");
select count(*) from t1;
count(*)
1
delete from t1;
select * from t1;
a	b	c1
drop table t1;
select count(*) from t1;
ERROR 42S02: Table 'jx_db.t1' doesn't exist
create table t1 (a integer auto_increment primary key);
insert into t1 (a) values (NULL),(NULL);
truncate table t1;
insert into t1 (a) values (NULL),(NULL);
SELECT * from t1;
a
1
2
delete from t1;
insert into t1 (a) values (NULL),(NULL);
SELECT * from t1;
a
3
4
drop table t1;
create table t1 (s1 int);
insert into t1 (s1) values (1), (2), (3), (4), (5);
drop view if exists v1;
create view v1 as select * from t1;
truncate table v1;
ERROR 42S02: Table 'jx_db.v1' doesn't exist
drop view v1;
drop table t1;
#
# Bug#20667 - Truncate table fails for a write locked table
#
CREATE TABLE t1 (c1 INT);
INSERT INTO t1 VALUES (1);
SELECT * FROM t1;
c1
1
CREATE TABLE t2 (c1 INT);
TRUNCATE TABLE t1;
CREATE VIEW v1 AS SELECT t1.c1 FROM t1,t2 WHERE t1.c1 = t2.c1;
INSERT INTO t1 VALUES (1), (2), (3);
INSERT INTO t2 VALUES (1), (3), (4);
SELECT * FROM v1;
c1
1
3
TRUNCATE table v1;
ERROR 42S02: Table 'jx_db.v1' doesn't exist
SELECT * FROM v1;
c1
1
3
DROP VIEW v1;
DROP TABLE t1, t2;
SELECT count(*) FROM oceanbase.DBA_RECYCLEBIN;
count(*)
7
CREATE TABLE t1(id int primary key);
TRUNCATE TABLE t1;

SELECT count(*) FROM oceanbase.DBA_RECYCLEBIN;
count(*)
7
set @@ob_enable_truncate_flashback = off;
TRUNCATE TABLE t1;

SELECT count(*) FROM oceanbase.DBA_RECYCLEBIN;
count(*)
7
DROP TABLE t1;

use test;
set @@ob_enable_truncate_flashback = on;
drop table if exists test_truncate_doudouge;
purge recyclebin;
CREATE TABLE test_truncate_doudouge(c1 int primary key, c2 int, c3 int);
CREATE INDEX test_index on test_truncate_doudouge(c2, c3);
SHOW INDEX FROM test_truncate_doudouge;
Table	Non_unique	Key_name	Seq_in_index	Column_name	Collation	Cardinality	Sub_part	Packed	Null	Index_type	Comment	Index_comment	Visible	Expression
test_truncate_doudouge	0	PRIMARY	1	c1	A	NULL	NULL	NULL		BTREE	available		YES	NULL
test_truncate_doudouge	1	test_index	1	c2	A	NULL	NULL	NULL	YES	BTREE	available		YES	NULL
test_truncate_doudouge	1	test_index	2	c3	A	NULL	NULL	NULL	YES	BTREE	available		YES	NULL
TRUNCATE TABLE test_truncate_doudouge;
select count(*) FROM oceanbase.DBA_RECYCLEBIN where type='table' and original_name = 'test_truncate_doudouge' order by createtime desc;
count(*)
0
drop table test_truncate_doudouge;
purge recyclebin;
set @@recyclebin = off;
set @@ob_enable_truncate_flashback = on;
create table test_truncate_doudouge(c1 int);
truncate table test_truncate_doudouge;
SELECT count(*) FROM oceanbase.DBA_RECYCLEBIN;
count(*)
0
set @@ob_enable_truncate_flashback = off;
drop table test_truncate_doudouge;
drop database jx_db;
purge recyclebin;
purge recyclebin;
select count(*) from oceanbase.__all_virtual_recyclebin where tenant_id=1;
count(*)
0
drop table if exists test1;
create table test1(c1 decimal(40,10), c2 double, c3 bigint, c4 decimal);
insert into test1 values(20191203060000, 6.5, 6, 6);
insert into test1 values(20191203060000, 6.5, 7, 7);
select c3,c4,truncate(c1, c2), truncate(c1, c3), truncate(c1, c4) from test1;
c3	c4	truncate(c1, c2)	truncate(c1, c3)	truncate(c1, c4)
6	6	20191203060000.0000000000	20191203060000.0000000000	20191203060000.0000000000
7	7	20191203060000.0000000000	20191203060000.0000000000	20191203060000.0000000000
