drop table if exists t1;
create table t1(pk int , c1 int primary key);
set autocommit=0;
set autocommit=0;
insert into t1 values(1,1);
insert into t1 values(2,2);
replace into t1 values(1,2);
select * from t1;
pk	c1
1	2
update t1 set c1=c1+1 where pk=1;
update t1 set c1=c1+1 where pk in (1,3,5);
update t1 set c1=c1+1 where pk>=1 and pk<=5 ;
select * from t1;
pk	c1
1	5
insert into t1 values(2,2);
update t1 set c1=c1+2 where pk=2;
select * from t1;
pk	c1
2	4
1	5
update t1 set c1=c1+2 where c1 in (1,3,5);
select * from t1;
pk	c1
2	4
1	7
update t1 set c1=c1+2;
select * from t1;
pk	c1
2	6
1	9
delete from t1 where c1=1;
delete from t1 where pk=1;
delete from t1 where pk=1;
insert into t1 values(2,2);
Got one of the listed errors
insert into t1 values(3,3);
Got one of the listed errors
update t1 set pk=4 where pk<=5;
select * from t1;
pk	c1
select * from t1 where pk in (1,2,3,4,5);
pk	c1
update t1 set c1=c1+1 where pk=1;
update t1 set c1=c1+1 where pk=3;
update t1 set c1=c1+1 where pk=4;
update t1 set c1=c1+1 where pk<5;
update t1 set c1=c1+1 where pk in (1,3,5);
select * from t1;
pk	c1
2	7
replace into t1 values(3,3),(1,1);
Got one of the listed errors
select * from t1 where pk in (1,2,3,4,5);
pk	c1
2	7
select * from t1;
pk	c1
select * from t1 where pk in (1,2,3,4,5);
pk	c1
commit;
select * from t1;
pk	c1
2	7
select * from t1 where pk in (1,2,3,4,5);
pk	c1
2	7
update t1 set c1=c1+1 where pk in (1,3,4,5);
select * from t1 where pk in (1,2,3,4,5);
pk	c1
2	7
commit;
update t1 set pk=5 where pk=4;
update t1 set pk=5 where pk=4;
update t1 set pk=5 where c1=4;
rollback;
select * from t1 where pk in (1,2,3,4,5);
pk	c1
2	7
select * from t1 ;
pk	c1
2	7
update t1 set pk=5 where pk=4;
select * from t1 where pk in (4,5) ;
pk	c1
commit;
select * from t1 ;
pk	c1
2	7
insert into t1 values(null,10);
insert into t1 values(null,30);
update t1 set pk=10 where pk is null;
replace into t1 values(null,30);
delete from  t1 where pk is null;
select * from t1 where pk is null;
pk	c1
commit;
select * from t1 where pk is null;
pk	c1
NULL	10
update t1 set pk=10 where pk is null;
select * from t1;
pk	c1
2	7
10	10
commit;
