drop table if exists t1;
create table t1(pk1 int, pk2 int, c1 int, c2 int, primary key(pk1,pk2));
insert into t1(pk1,pk2,c1,c2) values(1,1,1,1);
insert into t1(pk1,pk2,c1,c2) values(2,2,1,1);
insert into t1(pk1,pk2,c1,c2) values(3,3,1,1);
insert into t1(pk1,pk2,c1,c2) values(4,4,1,1);
insert into t1(pk1,pk2,c1,c2) values(5,5,1,1);
insert into t1(pk1,pk2,c1,c2) values(6,6,1,1);
insert into t1(pk1,pk2,c1,c2) values(7,7,1,1);
insert into t1(pk1,pk2,c1,c2) values(8,8,1,1);
select * from t1;
pk1	pk2	c1	c2
1	1	1	1
2	2	1	1
3	3	1	1
4	4	1	1
5	5	1	1
6	6	1	1
7	7	1	1
8	8	1	1
set autocommit=0;
delete from t1 where (pk1,pk2)>(0,0) and (pk1,pk2)<=(2,2);
select * from t1;
pk1	pk2	c1	c2
3	3	1	1
4	4	1	1
5	5	1	1
6	6	1	1
7	7	1	1
8	8	1	1
update t1 set c1=2, c2=2 where (pk1,pk2)>=(1,1) and (pk1,pk2)<=(4,4);
select * from t1;
pk1	pk2	c1	c2
3	3	2	2
4	4	2	2
5	5	1	1
6	6	1	1
7	7	1	1
8	8	1	1
set autocommit=0;
update t1 set c1=c1+1, c2=c2+1 where (pk1,pk2)>=(3,3) and (pk1,pk2)<(9,9);
Got one of the listed errors
select * from t1;
pk1	pk2	c1	c2
1	1	1	1
2	2	1	1
3	3	1	1
4	4	1	1
5	5	1	1
6	6	1	1
7	7	1	1
8	8	1	1
delete from t1 where (pk1,pk2)>(0,0) and (pk1,pk2)<=(2,2);
Got one of the listed errors
select * from t1;
pk1	pk2	c1	c2
1	1	1	1
2	2	1	1
3	3	1	1
4	4	1	1
5	5	1	1
6	6	1	1
7	7	1	1
8	8	1	1
delete from t1 where (pk1,pk2)>(4,4);
select * from t1;
pk1	pk2	c1	c2
1	1	1	1
2	2	1	1
3	3	1	1
4	4	1	1
select * from t1;
pk1	pk2	c1	c2
3	3	2	2
4	4	2	2
5	5	1	1
6	6	1	1
7	7	1	1
8	8	1	1
update t1 set c1=c1+1, c2=c2+1 where (pk1,pk2)>(6,6);
Got one of the listed errors
select * from t1;
pk1	pk2	c1	c2
3	3	2	2
4	4	2	2
5	5	1	1
6	6	1	1
7	7	1	1
8	8	1	1
commit;
select * from t1;
pk1	pk2	c1	c2
3	3	2	2
4	4	2	2
commit;
select * from t1;
pk1	pk2	c1	c2
3	3	2	2
4	4	2	2
commit;
delete from t1;
replace into t1(pk1,pk2,c1,c2) values (1,1,1,1),(2,2,1,1),(3,3,1,1),(4,4,1,1),(5,5,1,1),(6,6,1,1),(7,7,1,1),(8,8,1,1);
select * from t1;
pk1	pk2	c1	c2
1	1	1	1
2	2	1	1
3	3	1	1
4	4	1	1
5	5	1	1
6	6	1	1
7	7	1	1
8	8	1	1
update t1 set c1=c1+1, c2=c2+1 where (pk1,pk2)<=(4,4) or (pk1,pk2)>=(1,1);
select * from t1;
pk1	pk2	c1	c2
1	1	2	2
2	2	2	2
3	3	2	2
4	4	2	2
5	5	2	2
6	6	2	2
7	7	2	2
8	8	2	2
update t1 set c1=c1+1, c2=c2+1 where (pk1,pk2)>=(1,1) and (pk1,pk2)<=(4,4);
select * from t1;
pk1	pk2	c1	c2
1	1	3	3
2	2	3	3
3	3	3	3
4	4	3	3
5	5	2	2
6	6	2	2
7	7	2	2
8	8	2	2
commit;
select * from t1;
pk1	pk2	c1	c2
1	1	3	3
2	2	3	3
3	3	3	3
4	4	3	3
5	5	2	2
6	6	2	2
7	7	2	2
8	8	2	2
select * from t1;
pk1	pk2	c1	c2
1	1	3	3
2	2	3	3
3	3	3	3
4	4	3	3
5	5	2	2
6	6	2	2
7	7	2	2
8	8	2	2
update t1 set c1=c1+1, c2=c2+1 where (pk1,pk2)>=(1,1);
select * from t1;
pk1	pk2	c1	c2
1	1	4	4
2	2	4	4
3	3	4	4
4	4	4	4
5	5	3	3
6	6	3	3
7	7	3	3
8	8	3	3
delete from t1 where (pk1,pk2)>(4,4);
commit;
select * from t1;
pk1	pk2	c1	c2
1	1	4	4
2	2	4	4
3	3	4	4
4	4	4	4
commit;
delete from t1;
replace into t1(pk1,pk2,c1,c2) values (1,1,1,1),(2,2,1,1),(3,3,1,1),(4,4,1,1),(5,5,1,1),(6,6,1,1),(7,7,1,1),(8,8,1,1);
select * from t1;
pk1	pk2	c1	c2
1	1	1	1
2	2	1	1
3	3	1	1
4	4	1	1
5	5	1	1
6	6	1	1
7	7	1	1
8	8	1	1
update t1 set c1=c1+1, c2=c2+1 where (pk1,pk2)=(1,1);
delete from t1 where (pk1,pk2)=(2,2);
update t1 set c1=c1+1, c2=c2+1 where (pk1,pk2)=(3,3);
delete from t1 where (pk1,pk2)=(4,4);
update t1 set c1=c1+1, c2=c2+1 where (pk1,pk2)>(4,4);
delete from t1 where (pk1,pk2)>(6,6);
select * from t1;
pk1	pk2	c1	c2
1	1	1	1
2	2	1	1
3	3	2	2
5	5	2	2
6	6	2	2
commit;
select * from t1;
pk1	pk2	c1	c2
1	1	2	2
3	3	2	2
5	5	2	2
6	6	2	2
commit;
set autocommit=1;
set autocommit=1;
drop table t1;
