drop table if exists t1;
create table t1(pk1 int, pk2 int, c1 int, c2 int, primary key(pk1,pk2));
insert into t1(pk1,pk2,c1,c2) values(1,1,1,1);
insert into t1(pk1,pk2,c1,c2) values(2,2,2,1);
insert into t1(pk1,pk2,c1,c2) values(3,3,3,1);
insert into t1(pk1,pk2,c1,c2) values(4,4,4,1);
insert into t1(pk1,pk2,c1,c2) values(5,5,5,1);
insert into t1(pk1,pk2,c1,c2) values(6,6,6,1);
insert into t1(pk1,pk2,c1,c2) values(7,7,7,1);
insert into t1(pk1,pk2,c1,c2) values(8,8,8,1);
select * from t1;
pk1	pk2	c1	c2
1	1	1	1
2	2	2	1
3	3	3	1
4	4	4	1
5	5	5	1
6	6	6	1
7	7	7	1
8	8	8	1
set autocommit=0;
set autocommit=0;
update t1 set c2=c2+1 where c1 in (1,2,3,4);
select * from t1;
pk1	pk2	c1	c2
1	1	1	2
2	2	2	2
3	3	3	2
4	4	4	2
5	5	5	1
6	6	6	1
7	7	7	1
8	8	8	1
delete from t1 where c1 in (5,6);
select * from t1;
pk1	pk2	c1	c2
1	1	1	2
2	2	2	2
3	3	3	2
4	4	4	2
7	7	7	1
8	8	8	1
select * from t1;
pk1	pk2	c1	c2
1	1	1	1
2	2	2	1
3	3	3	1
4	4	4	1
5	5	5	1
6	6	6	1
7	7	7	1
8	8	8	1
update t1 set c2=c2+1 where pk1 in (1,2,3,4,5,6,7,8);
Got one of the listed errors
select * from t1;
pk1	pk2	c1	c2
1	1	1	1
2	2	2	1
3	3	3	1
4	4	4	1
5	5	5	1
6	6	6	1
7	7	7	1
8	8	8	1
delete from t1 where pk1 in (5,6,7,8);
Got one of the listed errors
delete from t1 where pk1 in (7,8);
select * from t1;
pk1	pk2	c1	c2
1	1	1	1
2	2	2	1
3	3	3	1
4	4	4	1
5	5	5	1
6	6	6	1
commit;
select * from t1;
pk1	pk2	c1	c2
1	1	1	2
2	2	2	2
3	3	3	2
4	4	4	2
update t1 set c2=c2+1 where pk1 in (1,2,3,4,5,6,7,8);
select * from t1;
pk1	pk2	c1	c2
1	1	1	3
2	2	2	3
3	3	3	3
4	4	4	3
commit;
select * from t1;
pk1	pk2	c1	c2
1	1	1	3
2	2	2	3
3	3	3	3
4	4	4	3
commit;
select * from t1;
pk1	pk2	c1	c2
1	1	1	3
2	2	2	3
3	3	3	3
4	4	4	3
update t1 set c2=c2+1 where c1 in (1,2,3,4,5,6,7,8);
select * from t1;
pk1	pk2	c1	c2
1	1	1	4
2	2	2	4
3	3	3	4
4	4	4	4
update t1 set c2=c2+1 where pk2 in (1,2,3,4,5,6,7,8);
select * from t1;
pk1	pk2	c1	c2
1	1	1	5
2	2	2	5
3	3	3	5
4	4	4	5
commit;
select * from t1;
pk1	pk2	c1	c2
1	1	1	5
2	2	2	5
3	3	3	5
4	4	4	5
commit;
replace into t1(pk1,pk2,c1,c2) values (1,1,1,1),(2,2,1,2),(3,3,1,1),(4,4,1,2),(5,5,1,1),(6,6,1,2),(7,7,1,2),(8,8,1,2);
select * from t1;
pk1	pk2	c1	c2
1	1	1	1
2	2	1	2
3	3	1	1
4	4	1	2
5	5	1	1
6	6	1	2
7	7	1	2
8	8	1	2
update t1 set c2=c2+1 where (c1,c2) in ((1,1),(2,2));
select * from t1;
pk1	pk2	c1	c2
1	1	1	2
2	2	1	2
3	3	1	2
4	4	1	2
5	5	1	2
6	6	1	2
7	7	1	2
8	8	1	2
update t1 set c2=c2+1 where (c1,c2) in ((1,1),(1,2));
Got one of the listed errors
select * from t1;
pk1	pk2	c1	c2
1	1	1	1
2	2	1	2
3	3	1	1
4	4	1	2
5	5	1	1
6	6	1	2
7	7	1	2
8	8	1	2
delete from t1 where (c1,c2) in ((1,1),(1,2));
Got one of the listed errors
select * from t1;
pk1	pk2	c1	c2
1	1	1	1
2	2	1	2
3	3	1	1
4	4	1	2
5	5	1	1
6	6	1	2
7	7	1	2
8	8	1	2
commit;
select * from t1;
pk1	pk2	c1	c2
1	1	1	2
2	2	1	2
3	3	1	2
4	4	1	2
5	5	1	2
6	6	1	2
7	7	1	2
8	8	1	2
update t1 set c2=c2+1 where (c1,c2) in ((1,1),(1,2),(1,3));
select * from t1;
pk1	pk2	c1	c2
1	1	1	3
2	2	1	3
3	3	1	3
4	4	1	3
5	5	1	3
6	6	1	3
7	7	1	3
8	8	1	3
commit;
select * from t1;
pk1	pk2	c1	c2
1	1	1	3
2	2	1	3
3	3	1	3
4	4	1	3
5	5	1	3
6	6	1	3
7	7	1	3
8	8	1	3
update t1 set c2=c2+1 where (c1,c2) in ((1,1));
select * from t1;
pk1	pk2	c1	c2
1	1	1	3
2	2	1	3
3	3	1	3
4	4	1	3
5	5	1	3
6	6	1	3
7	7	1	3
8	8	1	3
delete from t1 where (c1,c2) in ((1,1));
select * from t1;
pk1	pk2	c1	c2
1	1	1	3
2	2	1	3
3	3	1	3
4	4	1	3
5	5	1	3
6	6	1	3
7	7	1	3
8	8	1	3
commit;
select * from t1;
pk1	pk2	c1	c2
1	1	1	3
2	2	1	3
3	3	1	3
4	4	1	3
5	5	1	3
6	6	1	3
7	7	1	3
8	8	1	3
commit;
replace into t1(pk1,pk2,c1,c2) values (1,1,1,NULL),(2,2,1,1),(3,3,1,NULL),(4,4,1,1),(5,5,1,NULL),(6,6,1,1),(7,7,1,NULL),(8,8,1,1);
select * from t1;
pk1	pk2	c1	c2
1	1	1	NULL
2	2	1	1
3	3	1	NULL
4	4	1	1
5	5	1	NULL
6	6	1	1
7	7	1	NULL
8	8	1	1
update t1 set c1=c1+1, c2=c2+1 where (pk1,c1) in ((1,1),(2,1),(3,1),(4,1)) and c2 is not null;
select * from t1;
pk1	pk2	c1	c2
1	1	1	NULL
2	2	2	2
3	3	1	NULL
4	4	2	2
5	5	1	NULL
6	6	1	1
7	7	1	NULL
8	8	1	1
delete from t1 where (pk1,c1) in ((5,1),(6,1),(7,1),(8,1)) and c2 is null;
select * from t1;
pk1	pk2	c1	c2
1	1	1	NULL
2	2	2	2
3	3	1	NULL
4	4	2	2
6	6	1	1
8	8	1	1
update t1 set c1=c1+1, c2=c2+1 where (pk1,c1) in ((1,1),(2,1),(3,1),(4,1)) and c2 is not null;
Got one of the listed errors
select * from t1;
pk1	pk2	c1	c2
1	1	1	NULL
2	2	1	1
3	3	1	NULL
4	4	1	1
5	5	1	NULL
6	6	1	1
7	7	1	NULL
8	8	1	1
delete from t1 where (pk1,c1) in ((5,1),(6,1),(7,1),(8,1)) and c2 is null;
Got one of the listed errors
select * from t1;
pk1	pk2	c1	c2
1	1	1	NULL
2	2	1	1
3	3	1	NULL
4	4	1	1
5	5	1	NULL
6	6	1	1
7	7	1	NULL
8	8	1	1
select * from t1;
pk1	pk2	c1	c2
1	1	1	NULL
2	2	2	2
3	3	1	NULL
4	4	2	2
6	6	1	1
8	8	1	1
commit;
update t1 set c1=c1+1, c2=c2+1 where (pk1,c1) in ((1,2),(2,2),(3,2),(4,2));
select * from t1;
pk1	pk2	c1	c2
1	1	1	NULL
2	2	3	3
3	3	1	NULL
4	4	3	3
6	6	1	1
8	8	1	1
delete from t1 where (pk1,c1) in ((1,2),(3,2),(6,1),(8,1));
select * from t1;
pk1	pk2	c1	c2
1	1	1	NULL
2	2	2	2
3	3	1	NULL
4	4	2	2
commit;
select * from t1;
pk1	pk2	c1	c2
1	1	1	NULL
2	2	2	2
3	3	1	NULL
4	4	2	2
commit;
select * from t1;
pk1	pk2	c1	c2
1	1	1	NULL
2	2	3	3
3	3	1	NULL
4	4	3	3
commit;
select * from t1;
pk1	pk2	c1	c2
1	1	1	NULL
2	2	3	3
3	3	1	NULL
4	4	3	3
commit;
