drop table if exists t1;
create table t1(pk1 int, pk2 int, c1 int, c2 int, primary key(pk1,pk2));
insert into t1(pk1,pk2,c1,c2) values(1,1,1,1);
insert into t1(pk1,pk2,c1,c2) values(2,2,2,1);
insert into t1(pk1,pk2,c1,c2) values(3,3,3,1);
insert into t1(pk1,pk2,c1,c2) values(4,4,4,1);
insert into t1(pk1,pk2,c1,c2) values(5,5,5,1);
insert into t1(pk1,pk2,c1,c2) values(6,6,6,1);
insert into t1(pk1,pk2,c1,c2) values(7,7,7,1);
insert into t1(pk1,pk2,c1,c2) values(8,8,8,1);
select * from t1;
pk1	pk2	c1	c2
1	1	1	1
2	2	2	1
3	3	3	1
4	4	4	1
5	5	5	1
6	6	6	1
7	7	7	1
8	8	8	1
set autocommit=0;
delete from t1 where pk1=1 or pk1=2;
select * from t1;
pk1	pk2	c1	c2
3	3	3	1
4	4	4	1
5	5	5	1
6	6	6	1
7	7	7	1
8	8	8	1
update t1 set c2=c2+1 where pk1=1 or pk1=2 or pk1=3 or pk1=4;
select * from t1;
pk1	pk2	c1	c2
3	3	3	2
4	4	4	2
5	5	5	1
6	6	6	1
7	7	7	1
8	8	8	1
set autocommit=0;
select * from t1;
pk1	pk2	c1	c2
1	1	1	1
2	2	2	1
3	3	3	1
4	4	4	1
5	5	5	1
6	6	6	1
7	7	7	1
8	8	8	1
update t1 set c2=c2+1 where pk2=1 or pk2=2 or pk2=3 or pk2=4;
Got one of the listed errors
select * from t1;
pk1	pk2	c1	c2
1	1	1	1
2	2	2	1
3	3	3	1
4	4	4	1
5	5	5	1
6	6	6	1
7	7	7	1
8	8	8	1
delete from t1 where pk2=1 or pk2=2 or pk2=3 or pk2=4;
Got one of the listed errors
delete from t1 where pk1=5 or pk1=6;
select * from t1;
pk1	pk2	c1	c2
1	1	1	1
2	2	2	1
3	3	3	1
4	4	4	1
7	7	7	1
8	8	8	1
update t1 set c2=c2+1 where pk2=5 or pk2=6 or pk2=7 or pk2=8;
select * from t1;
pk1	pk2	c1	c2
1	1	1	1
2	2	2	1
3	3	3	1
4	4	4	1
7	7	7	2
8	8	8	2
commit;
select * from t1;
pk1	pk2	c1	c2
1	1	1	1
2	2	2	1
3	3	3	1
4	4	4	1
7	7	7	2
8	8	8	2
commit;
select * from t1;
pk1	pk2	c1	c2
3	3	3	2
4	4	4	2
7	7	7	2
8	8	8	2
update t1 set c2=c2+1 where pk2=5 or pk2=6 or pk2=7 or pk2=8;
select * from t1;
pk1	pk2	c1	c2
3	3	3	2
4	4	4	2
7	7	7	3
8	8	8	3
commit;
select * from t1;
pk1	pk2	c1	c2
3	3	3	2
4	4	4	2
7	7	7	3
8	8	8	3
commit;
replace into t1(pk1,pk2,c1,c2) values (1,1,1,1),(2,2,2,1),(3,3,3,1),(4,4,4,1),(5,5,5,1),(6,6,6,1),(7,7,7,1),(8,8,8,1);
select * from t1;
pk1	pk2	c1	c2
1	1	1	1
2	2	2	1
3	3	3	1
4	4	4	1
5	5	5	1
6	6	6	1
7	7	7	1
8	8	8	1
delete from t1 where (pk1,c1)=(1,1) or (pk1,c1)=(2,2);
select * from t1;
pk1	pk2	c1	c2
3	3	3	1
4	4	4	1
5	5	5	1
6	6	6	1
7	7	7	1
8	8	8	1
update t1 set c2=c2+1 where (pk1,c1)=(1,1) or (pk1,c1)=(2,2) or (pk1,c1)=(3,3) or (pk1,c1)=(4,4);
select * from t1;
pk1	pk2	c1	c2
3	3	3	2
4	4	4	2
5	5	5	1
6	6	6	1
7	7	7	1
8	8	8	1
delete from t1 where (pk1,c1)=(1,1) or (pk1,c1)=(2,2) or (pk1,c1)=(5,5) or (pk1,c1)=(6,6);
Got one of the listed errors
select * from t1;
pk1	pk2	c1	c2
1	1	1	1
2	2	2	1
3	3	3	1
4	4	4	1
5	5	5	1
6	6	6	1
7	7	7	1
8	8	8	1
delete from t1 where (pk2,c1)=(1,1) or (pk2,c1)=(2,2) or (pk2,c1)=(5,5) or (pk2,c1)=(6,6);
Got one of the listed errors
select * from t1;
pk1	pk2	c1	c2
1	1	1	1
2	2	2	1
3	3	3	1
4	4	4	1
5	5	5	1
6	6	6	1
7	7	7	1
8	8	8	1
delete from t1 where (pk1,c1)=(3,3) or (pk1,c1)=(4,4) or (pk1,c1)=(5,5) or (pk1,c1)=(6,6);
Got one of the listed errors
select * from t1;
pk1	pk2	c1	c2
1	1	1	1
2	2	2	1
3	3	3	1
4	4	4	1
5	5	5	1
6	6	6	1
7	7	7	1
8	8	8	1
update t1 set c2=c2+1 where (pk1,c1)=(1,1) or (pk1,c1)=(2,2) or (pk1,c1)=(5,5) or (pk1,c1)=(6,6);
Got one of the listed errors
select * from t1;
pk1	pk2	c1	c2
1	1	1	1
2	2	2	1
3	3	3	1
4	4	4	1
5	5	5	1
6	6	6	1
7	7	7	1
8	8	8	1
update t1 set c2=c2+1 where (pk1,c1)=(5,5) or (pk1,c1)=(6,6) or (pk1,c1)=(7,7) or (pk1,c1)=(8,8);
select * from t1;
pk1	pk2	c1	c2
1	1	1	1
2	2	2	1
3	3	3	1
4	4	4	1
5	5	5	2
6	6	6	2
7	7	7	2
8	8	8	2
delete from t1 where (pk1,c1)=(5,5) or (pk1,c1)=(6,6);
select * from t1;
pk1	pk2	c1	c2
1	1	1	1
2	2	2	1
3	3	3	1
4	4	4	1
7	7	7	2
8	8	8	2
select * from t1;
pk1	pk2	c1	c2
3	3	3	2
4	4	4	2
5	5	5	1
6	6	6	1
7	7	7	1
8	8	8	1
delete from t1 where (pk1,c1)=(5,5) or (pk1,c1)=(6,6);
Got one of the listed errors
select * from t1;
pk1	pk2	c1	c2
3	3	3	2
4	4	4	2
5	5	5	1
6	6	6	1
7	7	7	1
8	8	8	1
delete from t1 where (pk2,c1)=(7,7) or (pk2,c1)=(8,8);
Got one of the listed errors
select * from t1;
pk1	pk2	c1	c2
3	3	3	2
4	4	4	2
5	5	5	1
6	6	6	1
7	7	7	1
8	8	8	1
update t1 set c2=c2+1 where (pk1,c1)=(1,1) or (pk1,c1)=(2,2) or (pk1,c1)=(5,5) or (pk1,c1)=(6,6);
Got one of the listed errors
select * from t1;
pk1	pk2	c1	c2
3	3	3	2
4	4	4	2
5	5	5	1
6	6	6	1
7	7	7	1
8	8	8	1
commit;
select * from t1;
pk1	pk2	c1	c2
3	3	3	2
4	4	4	2
5	5	5	1
6	6	6	1
7	7	7	1
8	8	8	1
commit;
select * from t1;
pk1	pk2	c1	c2
3	3	3	2
4	4	4	2
7	7	7	2
8	8	8	2
commit;
select * from t1;
pk1	pk2	c1	c2
3	3	3	2
4	4	4	2
7	7	7	2
8	8	8	2
commit;
replace into t1(pk1,pk2,c1,c2) values (1,1,1,1),(2,2,2,1),(3,3,3,1),(4,4,4,1),(5,5,5,1),(6,6,6,1),(7,7,7,1),(8,8,8,1);
select * from t1;
pk1	pk2	c1	c2
1	1	1	1
2	2	2	1
3	3	3	1
4	4	4	1
5	5	5	1
6	6	6	1
7	7	7	1
8	8	8	1
update t1 set c2=c2+1 where ( (pk1,c1) in ((1,1),(2,2),(3,3),(4,4)) and  pk2 in (1,2) ) or (pk1,c1)=(5,5) or (pk1,c1)=(6,6);
select * from t1;
pk1	pk2	c1	c2
1	1	1	2
2	2	2	2
3	3	3	1
4	4	4	1
5	5	5	2
6	6	6	2
7	7	7	1
8	8	8	1
delete from t1 where ( (pk1,c1) in ((1,1),(2,2),(3,3),(4,4)) and  pk2 in (3,4) ) or (pk1,c1)=(7,7) or (pk1,c1)=(8,8);
select * from t1;
pk1	pk2	c1	c2
1	1	1	2
2	2	2	2
5	5	5	2
6	6	6	2
update t1 set c1=c1+1, c2=c2+1 where pk2=1 or pk2=2 or pk2=3 or pk2=4 or pk2=5 or pk2=6;
Got one of the listed errors
select * from t1;
pk1	pk2	c1	c2
1	1	1	1
2	2	2	1
3	3	3	1
4	4	4	1
5	5	5	1
6	6	6	1
7	7	7	1
8	8	8	1
delete from t1 where pk2=1 or pk2=2 or pk2=3 or pk2=4 or pk2=5 or pk2=6;
Got one of the listed errors
select * from t1;
pk1	pk2	c1	c2
1	1	1	1
2	2	2	1
3	3	3	1
4	4	4	1
5	5	5	1
6	6	6	1
7	7	7	1
8	8	8	1
select * from t1;
pk1	pk2	c1	c2
1	1	1	2
2	2	2	2
5	5	5	2
6	6	6	2
commit;
delete from t1 where ( (pk1,c1) in ((1,1),(2,2),(3,3),(4,4)) and  pk2 in (3,4) ) or (pk1,c1)=(7,7) or (pk1,c1)=(8,8);
select * from t1;
pk1	pk2	c1	c2
1	1	1	2
2	2	2	2
5	5	5	2
6	6	6	2
select * from t1;
pk1	pk2	c1	c2
1	1	1	2
2	2	2	2
5	5	5	2
6	6	6	2
delete from t1 where ( (pk1,c1) in ((1,1),(2,2),(3,3),(4,4)) and  pk2 in (3,4) ) or (pk1,c1)=(7,7) or (pk1,c1)=(8,8);
select * from t1;
pk1	pk2	c1	c2
1	1	1	2
2	2	2	2
5	5	5	2
6	6	6	2
commit;
select * from t1;
pk1	pk2	c1	c2
1	1	1	2
2	2	2	2
5	5	5	2
6	6	6	2
commit;
select * from t1;
pk1	pk2	c1	c2
1	1	1	2
2	2	2	2
5	5	5	2
6	6	6	2
commit;
