create table obupdaterowkey(pk1 int, pk2 int, pk3 int, pksum int, pksum_grp int, c1 varchar(1024), gmt_create createtime, gmt_modify modifytime, primary key(pk1, pk2, pk3)) TABLET_MAX_SIZE=2000000;
create index obupdaterowkey1 on obupdaterowkey(pk3);
create index obupdaterowkey2 on obupdaterowkey(pksum);
create index obupdaterowkey3 on obupdaterowkey(pk1, pk2);
select count(*) from obupdaterowkey;
count(*)
10
set autocommit=0;
update obupdaterowkey set pk1=3, pk3=1 where pk1=5 and pk2=-4 and pk3 in (1,-1);
update obupdaterowkey set pk1=4, pk3=1 where pk1=6 and pk2=-5 and pk3 in (1,-1);
update obupdaterowkey set pk1=5, pk3=1 where pk1=7 and pk2=-6 and pk3 in (1,-1);
update obupdaterowkey set pk1=6, pk3=1 where pk1=8 and pk2=-7 and pk3 in (1,-1);
update obupdaterowkey set pk1=7, pk3=1 where pk1=9 and pk2=-8 and pk3 in (1,-1);
select count(*) from obupdaterowkey;
count(*)
10
commit;
select count(*) from obupdaterowkey;
count(*)
10
commit;
update obupdaterowkey set pk1=5, pk3=-1 where pk1=3 and pk2=-4 and pk3 in (1,-1);
update obupdaterowkey set pk1=6, pk3=-1 where pk1=4 and pk2=-5 and pk3 in (1,-1);
update obupdaterowkey set pk1=7, pk3=-1 where pk1=5 and pk2=-6 and pk3 in (1,-1);
update obupdaterowkey set pk1=8, pk3=-1 where pk1=6 and pk2=-7 and pk3 in (1,-1);
update obupdaterowkey set pk1=9, pk3=-1 where pk1=7 and pk2=-8 and pk3 in (1,-1);
select count(*) from obupdaterowkey;
count(*)
10
commit;
select count(*) from obupdaterowkey;
count(*)
10
commit;
