drop table if exists t1,t2,t3,t4;
create table t1(i1 int primary key, v1 varchar(20));
insert into t1 values(1,'a'),(2,'b');
update t1 set i1=3 where i1=1;
select * from t1;
i1	v1
2	b
3	a
create table t2(v1 varchar(20) primary key,i1 int);
insert into t2 values('a',1),('b',2);
update t2 set v1='c' where v1='a';
select * from t1;
i1	v1
2	b
3	a
create table t3(n1 numeric primary key, n2 numeric);
insert into t3 values(12345,67890);
update t3 set n1=22222 where n1='12345';
select * from t1;
i1	v1
2	b
3	a
create table t4(t1 timestamp primary key, i1 int);
insert into t4 values('2014-03-03 12:12:12', 1);
update t4 set t1='2014-03-04 12:12:12' where t1='2014-03-03 12:12:12';
select * from t1;
i1	v1
2	b
3	a
drop table t1,t2,t3,t4;
create table t1 (i1 int primary key, v1 varchar(20),v2 varchar(20));
insert into t1 values(1,'1a','1aa'),(2,'2b','2bb'),(3,'3c','3cc');
update t1 set i1=4 where i1=1;
update t1 set i1=5,v1='5e' where i1=2;
select * from t1;
i1	v1	v2
3	3c	3cc
4	1a	1aa
5	5e	2bb
update t1 set i1=4 where i1=3;
ERROR 23000: Duplicate entry '3' for key 'PRIMARY'
ERROR 23000: Duplicate entry '3' for key 'PRIMARY'
update t1 set i1=5, v1='4f' where i1=3;
ERROR 23000: Duplicate entry '3' for key 'PRIMARY'
ERROR 23000: Duplicate entry '3' for key 'PRIMARY'
update t1 set i1=3 where i1=3;
select * from t1;
i1	v1	v2
3	3c	3cc
4	1a	1aa
5	5e	2bb
update t1 set i1=6 where i1=6;
update t1 set i1=8,v1='8g' where i1=8;
select * from t1;
i1	v1	v2
3	3c	3cc
4	1a	1aa
5	5e	2bb
update t1 set i1=10 where i1>9 and i1<11;
update t1 set i1=12  where i1>11 and i1<14;
update t1 set i1=3 where i1>1 and i1<4;
update t1 set i1=3 where i1>2 and i1<4;
select * from t1;
i1	v1	v2
3	3c	3cc
4	1a	1aa
5	5e	2bb
drop table t1;
create table t2(i1 int, v1 varchar(20), i2 int, v2 varchar(20), primary key(i1,v1));
insert into t2 values(1,'a',1,'a'),(2,'a',2,'a'),(3,'b',3,'b'),(3,'d',3,'d'),(4,'aa',4,'bb'),(5,'bb',5,'cc'),(6,'dd',6,'ee');
update t2 set i1=14,v1='14aa' where i1=4 and v1='aa';
update t2 set i1=15,v1='15bb',i2=15 where i1=5 and v1='bb';
update t2 set i1=7,v1='7c' where i1=3;
ERROR 23000: Duplicate entry '3-d' for key 'PRIMARY'
ERROR 23000: Duplicate entry '3-d' for key 'PRIMARY'
update t2 set i1=8,v1='8d' where i1=6;
update t2 set i1=11,v1='11a' where v1='a';
ERROR 23000: Duplicate entry '2-a' for key 'PRIMARY'
ERROR 23000: Duplicate entry '2-a' for key 'PRIMARY'
update t2 set i1=9,v1='9dd' where v1='8d';
select * from t2;
i1	v1	i2	v2
1	a	1	a
2	a	2	a
3	b	3	b
3	d	3	d
9	9dd	6	ee
14	14aa	4	bb
15	15bb	15	cc
drop table t2;
create table t2(i1 int, v1 varchar(20), i2 int, v2 varchar(20), primary key(i1,v1));
insert into t2 values(1,'a',1,'a'),(2,'a',2,'a'),(3,'b',3,'b'),(3,'d',3,'d'),(4,'aa',4,'bb'),(5,'bb',5,'cc'),(6,'dd',6,'ee');
update t2 set v1='1a' where i1=1 and v1='a';
update t2 set v1='1a',v2='1b' where i1=2 and v1='a';
update t2 set i1=4 where i1=3 and v1='b';
update t2 set i1=4,i2=4 where i1=3 and v1='d';
update t2 set v1='3c' where i1=3;
update t2 set i1=11 where v1='a';
select * from t2;
i1	v1	i2	v2
1	1a	1	a
2	1a	2	1b
4	aa	4	bb
4	b	3	b
4	d	4	d
5	bb	5	cc
6	dd	6	ee
drop table t2;
create table t2(i1 int, v1 varchar(20), i2 int, v2 varchar(20), primary key(i1,v1));
replace into t2 values(1,'a',1,'a'),(2,'a',2,'a'),(3,'b',3,'b'),(3,'d',3,'d'),(4,'aa',4,'bb'),(5,'bb',5,'cc'),(6,'dd',6,'ee');
update t2 set v2='b' where i1>=1 and i2<3;
update t2 set i1=13 where v1>='b' and v1<'e';
update t2 set v2='c', i2=11 where i1>=1 and i2<3;
update t2 set i1=23, i2=23 where v1>='b' and v1<'e';
update t2 set i1=33 where i1>=1 and i1<4 and v1>'a' and v1<='c';
update t2 set i1=33,v1='bb' where i1>=1 and i1<4 and v1>'a' and v1<='c';
update t2 set i1=33,i2=33 where i1>=1 and i1<4 and v1>'a' and v1<='c';
update t2 set i1=34 where i1>=1 and i1<4 and v1>='a' and v1<'c';
ERROR 23000: Duplicate entry '2-a' for key 'PRIMARY'
ERROR 23000: Duplicate entry '2-a' for key 'PRIMARY'
update t2 set i1=33,v1='bb' where i1>=1 and i1<4 and v1>='a' and v1<'c';
ERROR 23000: Duplicate entry '2-a' for key 'PRIMARY'
ERROR 23000: Duplicate entry '2-a' for key 'PRIMARY'
update t2 set i1=33,i2=33 where i1>=1 and i1<4 and v1>='a' and v1<'c';
ERROR 23000: Duplicate entry '2-a' for key 'PRIMARY'
ERROR 23000: Duplicate entry '2-a' for key 'PRIMARY'
update t2 set i1=7 where i1>6 and i1<8 and v1>'a' and v1<'c';
update t2 set i1=8 where i1>7 and i1<9 and v1>'a' and v1<'c';
select * from t2;
i1	v1	i2	v2
1	a	11	c
2	a	11	c
4	aa	4	bb
23	b	23	b
23	bb	23	cc
23	d	23	d
23	dd	23	ee
drop table t2;
create table t3(i1 int, v1 varchar(20), i2 int, primary key(i1));
insert into t3 values(1,'a',1),(2,'b',2),(3,'c',2),(4,'d',4),(5,'e',5);
update t3 set i1=6 where i2=1;
update t3 set i1=7 where i2=2;
ERROR 23000: Duplicate entry '3' for key 'PRIMARY'
ERROR 23000: Duplicate entry '3' for key 'PRIMARY'
update t3 set i1=5 where i2=4;
ERROR 23000: Duplicate entry '4' for key 'PRIMARY'
ERROR 23000: Duplicate entry '4' for key 'PRIMARY'
update t3 set i1=8 where i2>=2 and i2<5;
ERROR 23000: Duplicate entry '3' for key 'PRIMARY'
ERROR 23000: Duplicate entry '3' for key 'PRIMARY'
update t3 set i1=9 where i2>2 and i2<5;
drop table t3;
create table t4(pk1 int, pk2 int, pk3 int, i1 int,  primary key(pk1,pk2,pk3));
insert into t4 values(1,1,1,1),(2,1,NULL,1),(3,NULL,1,1),(NULL,3,1,1);
update t4 set pk1=1 where pk2=1 and pk3=1;
update t4 set pk2=3 where pk1=3 and pk3=1;
update t4 set pk3=2 where pk1=2 and pk2=1;
select * from t4;
pk1	pk2	pk3	i1
NULL	3	1	1
1	1	1	1
2	1	2	1
3	3	1	1
replace into t4 values(11,1,1,1),(12,1,NULL,1),(13,NULL,1,1),(NULL,2,1,1);
update t4 set pk2=NULL where pk1=12 and pk2=1;
update t4 set pk1=NULL where pk1=11 and pk2=1;
update t4 set pk3=NULL where pk1=13 and pk2 is NULL;
select * from t4;
pk1	pk2	pk3	i1
NULL	1	1	1
NULL	2	1	1
NULL	3	1	1
1	1	1	1
2	1	2	1
3	3	1	1
12	NULL	NULL	1
13	NULL	NULL	1
replace into t4 values(21,3,1,1),(22,1,NULL,1),(23,NULL,1,1),(NULL,3,1,1);
update t4 set pk1=21 where pk2=3 and pk3=1;
ERROR 23000: Duplicate entry 'null-3-1' for key 'PRIMARY'
ERROR 23000: Duplicate entry 'null-3-1' for key 'PRIMARY'
update t4 set pk2=1, pk3=NULL where pk1=23;
select * from t4;
pk1	pk2	pk3	i1
NULL	1	1	1
NULL	2	1	1
NULL	3	1	1
1	1	1	1
2	1	2	1
3	3	1	1
12	NULL	NULL	1
13	NULL	NULL	1
21	3	1	1
22	1	NULL	1
23	1	NULL	1
drop table t4;
create table t4(pk1 int, pk2 int, pk3 int, i1 int, i2 int, primary key(pk1,pk2,pk3));
insert into t4 values(1,1,1,1,1),(2,2,2,2,2),(3,3,3,3,3),(4,4,4,4,4),(4,4,5,4,5);
update t4 set pk1=2 where (pk2,pk3,i1) in ((1,1,1),(1,1,2),(2,2,2),(2,2,3),(2,4,2));
update t4 set pk2=5 where (pk1,pk3,i1) in ((1,1,1),(2,1,3),(3,3,3),(4,4,-1),(5,5,5));
update t4 set pk3=-1 where (pk1,pk2,i2) in ((1,1,1),(2,-1,3),(4,4,5));
update t4 set pk1=3 where (pk2,pk3,i1) in ((1,1,1),(1,1,2),(2,2,2),(2,2,3),(2,4,2),(1,1,1),(1,1,2),(2,2,3),(3,2,3),(3,2,3));
delete from t4 where pk1<10;
insert into t4 values(1,1,1,1,1),(2,2,2,2,2),(2,2,3,3,3),(4,4,4,4,4),(4,4,5,4,5);
update t4 set pk1=-1,pk2=-1,pk3=-1 where pk1=1 and pk2=1 and pk3 in (1,-1);
update t4 set pk1=-2 where pk1=2 and pk2 in (2,-2) and pk3 in (2,-2,3);
update t4 set pk1=-3 where pk1 in (-3,3) and pk2 in(-3,-4,3) and pk3 in (-3,3);
update t4 set pk1=-4 where (pk1,i1) in ((4,4),(4,-4)) and pk3 in (-4,5) and pk2 in (4,-4);
select * from t4;
pk1	pk2	pk3	i1	i2
-4	4	5	4	5
-2	2	2	2	2
-2	2	3	3	3
-1	-1	-1	1	1
4	4	4	4	4
