set ob_enable_index_direct_select=1;
set ob_enable_index_direct_select=1;
alter system set merger_check_interval = '10s' tenant sys;
alter system set merger_check_interval = '10s' tenant all_user;
alter system set merger_check_interval = '10s' tenant all_meta;
drop table if exists testupdate;
create table testupdate(pk int primary key,c1 int) partition by hash(pk) partitions 5;
create index idx on testupdate(c1);
insert into testupdate values(1,1);
update testupdate set pk=3 where pk=1;
update testupdate set pk=4,c1=c1+1 where pk=3;
select * from testupdate;
pk	c1
4	2
drop table if exists testupdate;
create table testupdate(pk int primary key,c1 int) partition by hash(pk) partitions 5;
create index idx1 on testupdate(c1);
insert into testupdate values(1,1);
update testupdate set pk=3 where pk=1;
update testupdate set pk=4,c1=c1+1 where pk=3;
select * from testupdate;
pk	c1
4	2
pk	c1
4	2
drop table if exists testupdate;
create table testupdate(pk int primary key,c1 int) partition by hash(pk) partitions 5;
create unique index idx1 on testupdate(c1) global;
insert into testupdate values(1,1);
update testupdate set pk=3 where pk=1;
update testupdate set pk=4,c1=c1+1 where pk=3;
select * from testupdate;
pk	c1
4	2
pk	c1
4	2
set ob_enable_index_direct_select=0;
