drop table if exists t1;
create table t1(pk int primary key, i1 int, v1 varchar(20));
replace into t1 values(1,1,'a'),(2,2,'b'),(3,3,'c'),(4,4,'d'),(5,5,'e');
set autocommit=0;
update t1 set pk=11 where pk=1;
select * from t1;
pk	i1	v1
2	2	b
3	3	c
4	4	d
5	5	e
11	1	a
update t1 set i1=11,v1='11a' where pk=11;
commit;
select * from t1;
pk	i1	v1
2	2	b
3	3	c
4	4	d
5	5	e
11	11	11a
set autocommit=1;
set autocommit=0;
update t1 set pk=12 where pk=2;
select * from t1;
pk	i1	v1
3	3	c
4	4	d
5	5	e
11	11	11a
12	2	b
update t1 set i1=12,v1='12a' where pk=12;
rollback;
select * from t1;
pk	i1	v1
2	2	b
3	3	c
4	4	d
5	5	e
11	11	11a
set autocommit=1;
set autocommit=0;
update t1 set pk=4 where pk=3;
ERROR 23000: Duplicate entry '4' for key 'PRIMARY'
delete from t1 where pk=4;
select * from t1;
pk	i1	v1
2	2	b
3	3	c
5	5	e
11	11	11a
update t1 set pk=4 where pk=3;
update t1 set i1=4,v1='4d' where pk=4;
commit;
select * from t1;
pk	i1	v1
2	2	b
4	4	4d
5	5	e
11	11	11a
set autocommit=1;
set autocommit=0;
update t1 set pk=5 where pk=4;
ERROR 23000: Duplicate entry '5' for key 'PRIMARY'
delete from t1 where pk=5;
select * from t1;
pk	i1	v1
2	2	b
4	4	4d
11	11	11a
update t1 set pk=5 where pk=4;
update t1 set i1=5,v1='5e' where pk=5;
rollback;
select * from t1;
pk	i1	v1
2	2	b
4	4	4d
5	5	e
11	11	11a
set autocommit=1;
delete from t1 where pk<20;
replace into t1 values(1,1,'a'),(2,2,'b'),(3,3,'c'),(4,4,'d'),(5,5,'e');
set autocommit=0;
update t1 set pk=11 where pk=1;
set autocommit=0;
update t1 set i1=2,v1='aa' where pk=1;
Got one of the listed errors
commit;
set autocommit=1;
commit;
set autocommit=1;
select * from t1;
pk	i1	v1
2	2	b
3	3	c
4	4	d
5	5	e
11	1	a
delete from t1 where pk<20;
replace into t1 values(1,1,'a'),(2,2,'b'),(3,3,'c'),(4,4,'d'),(5,5,'e');
set autocommit=0;
update t1 set pk=11 where pk=1;
set autocommit=0;
update t1 set i1=2,v1='aa' where pk=1;
Got one of the listed errors
rollback;
set autocommit=1;
commit;
set autocommit=1;
select * from t1;
pk	i1	v1
1	1	a
2	2	b
3	3	c
4	4	d
5	5	e
delete from t1 where pk<20;
replace into t1 values(1,1,'a'),(2,2,'b'),(3,3,'c'),(4,4,'d'),(5,5,'e');
set autocommit=0;
update t1 set pk=11 where pk=1;
set autocommit=0;
update t1 set i1=2,v1='aa' where pk=1;
Got one of the listed errors
commit;
set autocommit=1;
commit;
set autocommit=1;
select * from t1;
pk	i1	v1
2	2	b
3	3	c
4	4	d
5	5	e
11	1	a
delete from t1 where pk<20;
replace into t1 values(1,1,'a'),(2,2,'b'),(3,3,'c'),(4,4,'d'),(5,5,'e');
set autocommit=0;
update t1 set pk=11 where pk=1;
set autocommit=0;
update t1 set i1=2,v1='aa' where pk=1;
Got one of the listed errors
rollback;
set autocommit=1;
commit;
set autocommit=1;
select * from t1;
pk	i1	v1
2	2	b
3	3	c
4	4	d
5	5	e
11	1	a
delete from t1 where pk<20;
replace into t1 values(1,1,'a'),(2,2,'b'),(3,3,'c'),(4,4,'d'),(5,5,'e');
set autocommit=0;
update t1 set pk=11 where pk=1;
set autocommit=0;
delete from t1 where pk=1;
Got one of the listed errors
commit;
set autocommit=1;
commit;
set autocommit=1;
select * from t1;
pk	i1	v1
2	2	b
3	3	c
4	4	d
5	5	e
11	1	a
delete from t1 where pk<20;
replace into t1 values(1,1,'a'),(2,2,'b'),(3,3,'c'),(4,4,'d'),(5,5,'e');
set autocommit=0;
update t1 set pk=11 where pk=1;
set autocommit=0;
delete from t1 where pk=1;
Got one of the listed errors
rollback;
set autocommit=1;
commit;
set autocommit=1;
select * from t1;
pk	i1	v1
1	1	a
2	2	b
3	3	c
4	4	d
5	5	e
delete from t1 where pk<20;
replace into t1 values(1,1,'a'),(2,2,'b'),(3,3,'c'),(4,4,'d'),(5,5,'e');
set autocommit=0;
update t1 set pk=11 where pk=1;
set autocommit=0;
delete from t1 where pk=11;
commit;
set autocommit=1;
commit;
set autocommit=1;
select * from t1;
pk	i1	v1
2	2	b
3	3	c
4	4	d
5	5	e
11	1	a
delete from t1 where pk<20;
replace into t1 values(1,1,'a'),(2,2,'b'),(3,3,'c'),(4,4,'d'),(5,5,'e');
set autocommit=0;
update t1 set pk=11 where pk=1;
set autocommit=0;
delete from t1 where pk=11;
commit;
set autocommit=1;
commit;
set autocommit=1;
select * from t1;
pk	i1	v1
2	2	b
3	3	c
4	4	d
5	5	e
11	1	a
delete from t1 where pk<20;
replace into t1 values(1,1,'a'),(2,2,'b'),(3,3,'c'),(4,4,'d'),(5,5,'e');
set autocommit=0;
update t1 set pk=11 where pk=1;
set autocommit=0;
delete from t1 where pk=11;
commit;
set autocommit=1;
rollback;
set autocommit=1;
select * from t1;
pk	i1	v1
2	2	b
3	3	c
4	4	d
5	5	e
11	1	a
delete from t1 where pk<20;
replace into t1 values(1,1,'a'),(2,2,'b'),(3,3,'c'),(4,4,'d'),(5,5,'e');
set autocommit=0;
update t1 set pk=12 where pk=2;
set autocommit=0;
update t1 set i1=22,v1='bb' where pk=2;
commit;
set autocommit=1;
commit;
set autocommit=1;
select * from t1;
pk	i1	v1
1	1	a
3	3	c
4	4	d
5	5	e
12	2	b
delete from t1 where pk<20;
replace into t1 values(1,1,'a'),(2,2,'b'),(3,3,'c'),(4,4,'d'),(5,5,'e');
set autocommit=0;
update t1 set pk=12 where pk=2;
set autocommit=0;
update t1 set i1=22,v1='bb' where pk=2;
rollback;
set autocommit=1;
commit;
set autocommit=1;
select * from t1;
pk	i1	v1
1	1	a
2	22	bb
3	3	c
4	4	d
5	5	e
delete from t1 where pk<20;
replace into t1 values(1,1,'a'),(2,2,'b'),(3,3,'c'),(4,4,'d'),(5,5,'e');
set autocommit=0;
update t1 set pk=12 where pk=2;
set autocommit=0;
delete from t1 where pk=2;
Got one of the listed errors
commit;
set autocommit=1;
update t1 set i1=12,v1='12b' where pk=12;
commit;
set autocommit=1;
select * from t1;
pk	i1	v1
1	1	a
3	3	c
4	4	d
5	5	e
12	12	12b
delete from t1 where pk<20;
replace into t1 values(1,1,'a'),(2,2,'b'),(3,3,'c'),(4,4,'d'),(5,5,'e');
set autocommit=0;
update t1 set pk=12 where pk=2;
set autocommit=0;
delete from t1 where pk=2;
Got one of the listed errors
rollback;
set autocommit=1;
update t1 set i1=12,v1='12b' where pk=12;
commit;
set autocommit=1;
select * from t1;
pk	i1	v1
1	1	a
2	2	b
3	3	c
4	4	d
5	5	e
delete from t1 where pk<20;
replace into t1 values(1,1,'a'),(2,2,'b'),(3,3,'c'),(4,4,'d'),(5,5,'e');
set autocommit=0;
insert into t1 values(6,6,'f');
update t1 set pk=7 where pk=6 ;
set autocommit=0;
insert into t1 values(6,6,'f');
commit;
set autocommit=1;
commit;
set autocommit=1;
select * from t1;
pk	i1	v1
1	1	a
2	2	b
3	3	c
4	4	d
5	5	e
6	6	f
7	6	f
delete from t1 where pk<20;
replace into t1 values(1,1,'a'),(2,2,'b'),(3,3,'c'),(4,4,'d'),(5,5,'e');
select * from t1;
pk	i1	v1
1	1	a
2	2	b
3	3	c
4	4	d
5	5	e
set autocommit=0;
insert into t1 values(6,6,'f');
update t1 set pk=7 where pk=6;
select * from t1;
pk	i1	v1
1	1	a
2	2	b
3	3	c
4	4	d
5	5	e
set autocommit=0;
insert into t1 values(6,6,'f');
rollback;
set autocommit=1;
insert into t1 values(7,7,'g');
commit;
set autocommit=1;
select * from t1;
pk	i1	v1
1	1	a
2	2	b
3	3	c
4	4	d
5	5	e
6	6	f
7	7	g
delete from t1 where pk<20;
replace into t1 values(1,1,'a'),(2,2,'b'),(3,3,'c'),(4,4,'d'),(5,5,'e');
set autocommit=0;
insert into t1 values(6,6,'f');
update t1 set pk=7 where pk=5;
set autocommit=0;
update t1 set pk=6 where pk=7;
insert into t1 values(7,7,'f');
commit;
set autocommit=1;
ERROR 23000: Duplicate entry '7' for key 'PRIMARY'
commit;
set autocommit=1;
select * from t1;
pk	i1	v1
1	1	a
2	2	b
3	3	c
4	4	d
6	6	f
7	5	e
