use test;
drop table if exists sb,sc,sd,se,sf,sg,sh,si,sj;
create table sb (a int primary key, b int);
insert into sb values(1,100);
insert into sb values(2,101);
insert into sb values(3,1003);
insert into sb values(4,1004);
insert into sb values(5,300000);
set @a=2;
set @b=3;
select @a:=@a+@b+b from sb;
@a:=@a+@b+b
105
209
1215
2222
302225
select @a;
@a
302225
create table sc(a int primary key, b varchar(123), c int, d double);
set @a:=2;
set @b:="helloworld";
set @c=2.5;
insert into sc values(1,@b,@a,@c);
insert into sc values(2,@b,@c,@a);
insert into sc values(3,concat(@b,"helloworld"),@a,@c);
select * from sc;
a	b	c	d
1	helloworld	2	2.5
2	helloworld	3	2
3	helloworldhelloworld	2	2.5
update sc set c=@a;
update sc set d=@c;
select * from sc;
a	b	c	d
1	helloworld	2	2.5
2	helloworld	2	2.5
3	helloworldhelloworld	2	2.5
select coalesce(@b);
coalesce(@b)
helloworld
select cast(@c as signed int);
cast(@c as signed int)
3
create table sd(a int);
insert into sd values(5),(4),(4),(3),(2),(2),(2),(1);
insert into sd values(@ghost:=12345);
select @ghost;
@ghost
12345
select * from sd;
a
5
4
4
3
2
2
2
1
12345
create table se(a int primary key, b timestamp,c datetime(5));
set @a = timestamp'2003-01-01 23:00:00';
select @b:= cast('2003-01-01 23:00:00' as datetime);
@b:= cast('2003-01-01 23:00:00' as datetime)
2003-01-01 23:00:00
insert into se values(1,@a,@b);
select * from se;
a	b	c
1	2003-01-01 23:00:00	2003-01-01 23:00:00.00000
create table sf(a decimal(31,21));
insert into sf values(0);
select (@v:=a) <> (@v:=1) from sf;
(@v:=a) <> (@v:=1)
1
create table sg(a int);
insert into sg values (1), (2);
select distinct @a:=min(sg.a) from sg, sg as t2
group by @b:=(select count(*) > t2.a);
@a:=min(sg.a)
1
set @a = timestamp'2003-01-01 24:00:00';
ERROR HY000: Incorrect DATETIME value: '2003-01-01 24:00:00'
set @a = time'99:99:99';
ERROR HY000: Incorrect TIME value: '99:99:99'
create table si (a int primary key) partition by hash(a) partitions 2;
insert into si values(0);
insert into si values(1);
insert into si values(2);
select a, @uv from si order by a;
a	@uv
0	NULL
1	NULL
2	NULL
set @uv = 9;
select a, @uv from si order by a;
a	@uv
0	9
1	9
2	9
select @helloworld, coercibility(@helloworld);
@helloworld	coercibility(@helloworld)
NULL	2
set @v1=null, @v2=1, @v3=1.1, @v4=now();
select coercibility(@v1),coercibility(@v2),coercibility(@v3),coercibility(@v4);
coercibility(@v1)	coercibility(@v2)	coercibility(@v3)	coercibility(@v4)
2	5	5	2
select @v1:=null, @v2:=1, @v3:=1.1;
@v1:=null	@v2:=1	@v3:=1.1
NULL	1	1.1
select coercibility(@v1),coercibility(@v2),coercibility(@v3),coercibility(@v4:=now());
coercibility(@v1)	coercibility(@v2)	coercibility(@v3)	coercibility(@v4:=now())
2	2	2	2
select coercibility(@v1:=null),coercibility(@v2:=1),coercibility(@v3:=1.1),coercibility(@v4:=now());
coercibility(@v1:=null)	coercibility(@v2:=1)	coercibility(@v3:=1.1)	coercibility(@v4:=now())
2	5	5	2
create table sj(a bigint,b decimal(5,3),c datetime, d time);
insert into sj values(1,2.5,"2010-01-01 11:11:11", "12:34:45.5");
select @v1:=a, @v2:=b, @v3:=c, @v4:=d from sj;
@v1:=a	@v2:=b	@v3:=c	@v4:=d
1	2.500	2010-01-01 11:11:11	12:34:46
select coercibility(@v1),coercibility(@v2),coercibility(@v3),coercibility(@v4);
coercibility(@v1)	coercibility(@v2)	coercibility(@v3)	coercibility(@v4)
2	2	2	2
drop table if exists sb,sc,sd,se,sf,sg,si,sj;
set @a.b=1, @c_d=2, @e$f=3;
select @a.b, @c_d, @e$f;
@a.b	@c_d	@e$f
1	2	3
set @a~b=1;
ERROR 42000: You have an error in your SQL syntax; check the manual that corresponds to your OceanBase version for the right syntax to use near '~b=1' at line 1
set @a@b=1;
ERROR 42000: You have an error in your SQL syntax; check the manual that corresponds to your OceanBase version for the right syntax to use near '@b=1' at line 1
set @a!b=1;
ERROR 42000: You have an error in your SQL syntax; check the manual that corresponds to your OceanBase version for the right syntax to use near '!b=1' at line 1
set @a%b=1;
ERROR 42000: You have an error in your SQL syntax; check the manual that corresponds to your OceanBase version for the right syntax to use near '%b=1' at line 1
set @a^b=1;
ERROR 42000: You have an error in your SQL syntax; check the manual that corresponds to your OceanBase version for the right syntax to use near '^b=1' at line 1
set @a&b=1;
ERROR 42000: You have an error in your SQL syntax; check the manual that corresponds to your OceanBase version for the right syntax to use near '&b=1' at line 1
set @a*b=1;
ERROR 42000: You have an error in your SQL syntax; check the manual that corresponds to your OceanBase version for the right syntax to use near '*b=1' at line 1
set @a-b=1;
ERROR 42000: You have an error in your SQL syntax; check the manual that corresponds to your OceanBase version for the right syntax to use near '-b=1' at line 1
set @a+b=1;
ERROR 42000: You have an error in your SQL syntax; check the manual that corresponds to your OceanBase version for the right syntax to use near '+b=1' at line 1
set @a/b=1;
ERROR 42000: You have an error in your SQL syntax; check the manual that corresponds to your OceanBase version for the right syntax to use near '/b=1' at line 1
set @a=b=1;
ERROR 42S22: Unknown column 'b' in 'field_list'
set @a[b=1;
ERROR 42000: You have an error in your SQL syntax; check the manual that corresponds to your OceanBase version for the right syntax to use near '[b=1' at line 1
set @a(b=1;
ERROR 42000: You have an error in your SQL syntax; check the manual that corresponds to your OceanBase version for the right syntax to use near '(b=1' at line 1
set @a{b=1;
ERROR 42000: You have an error in your SQL syntax; check the manual that corresponds to your OceanBase version for the right syntax to use near '{b=1' at line 1
set @a|b=1;
ERROR 42000: You have an error in your SQL syntax; check the manual that corresponds to your OceanBase version for the right syntax to use near '|b=1' at line 1
set @a<b=1;
ERROR 42000: You have an error in your SQL syntax; check the manual that corresponds to your OceanBase version for the right syntax to use near '<b=1' at line 1
select @'a/b', @'a%b', @'a"b', @'a`b', @"a'b";
@'a/b'	@'a%b'	@'a"b'	@'a`b'	@"a'b"
NULL	NULL	NULL	NULL	NULL
set @'a/b'=1, @'a%b'=2, @'a"b'=3, @'a`b'=4, @"a'b"=5;
select @'a/b', @'a%b', @'a"b', @'a`b', @"a'b";
@'a/b'	@'a%b'	@'a"b'	@'a`b'	@"a'b"
1	2	3	4	5
select @a1, @'a1', @"a1", @`a1`, @a2, @'a2', @"a2", @`a2`, @a3, @'a3', @"a3", @`a3`, @a4,@'a4', @"a4", @`a4`;
@a1	@'a1'	@"a1"	@`a1`	@a2	@'a2'	@"a2"	@`a2`	@a3	@'a3'	@"a3"	@`a3`	@a4	@'a4'	@"a4"	@`a4`
NULL	NULL	NULL	NULL	NULL	NULL	NULL	NULL	NULL	NULL	NULL	NULL	NULL	NULL	NULL	NULL
set @a1=1, @'a2'=2, @"a3"=3, @`a4`=4;
select @a1, @'a1', @"a1", @`a1`, @a2, @'a2', @"a2", @`a2`, @a3, @'a3', @"a3", @`a3`, @a4,@'a4', @"a4", @`a4`;
@a1	@'a1'	@"a1"	@`a1`	@a2	@'a2'	@"a2"	@`a2`	@a3	@'a3'	@"a3"	@`a3`	@a4	@'a4'	@"a4"	@`a4`
1	1	1	1	2	2	2	2	3	3	3	3	4	4	4	4
