drop table if exists t1,t2;
set @a := foo;
ERROR 42S22: Unknown column 'foo' in 'field_list'
set @a := connection_id() + 3;
select @a - connection_id();
@a - connection_id()
3
set @b := 1;
select @b;
@b
1
CREATE TABLE t1 ( i int not null, v int not null,index (i));
insert into t1 values (1,1),(1,3),(2,1);
create table t2 (i int not null, unique (i));
insert into t2 select distinct i from t1;
select * from t2;
i
1
2
select @vv1,i,v from t1 where i=@vv1;
@vv1	i	v
drop table t1,t2;
set @a=0,@b=0;
select @a:=10,   @b:=1,   @a > @b, @a < @b;
@a:=10	@b:=1	@a > @b	@a < @b
10	1	1	0
select @a:="10", @b:="1", @a > @b, @a < @b;
@a:="10"	@b:="1"	@a > @b	@a < @b
10	1	1	0
select @a:=10,   @b:=2,   @a > @b, @a < @b;
@a:=10	@b:=2	@a > @b	@a < @b
10	2	0	1
select @a:="10", @b:="2", @a > @b, @a < @b;
@a:="10"	@b:="2"	@a > @b	@a < @b
10	2	1	0
select @a:=1;
@a:=1
1
select @a, @a:=1;
@a	@a:=1
1	1
set @$x=0;
select @$x;
@$x
0
set @.x=0;
select @.x;
@.x
0
set @_x=0;
select @_x;
@_x
0
set @$$._x=0;
select @$$._x;
@$$._x
0
create table t1 (id int, d double, c char(10));
insert into t1 values (1,2.0, "test");
select @c:=0;
@c:=0
0
update t1 SET id=(@c:=@c+1);
select @c;
@c
1
select @c:=0;
@c:=0
0
update t1 set id=(@c:=@c+1);
select @c;
@c
1
select @c:=0;
@c:=0
0
select @c:=@c+1;
@c:=@c+1
1
set @g=1;
select @d:=id, @e:=id, @f:=id, @g:=@id from t1;
@d:=id	@e:=id	@f:=id	@g:=@id
1	1	1	NULL
select @c, @d, @e, @f, @g;
@c	@d	@e	@f	@g
1	1	1	1	NULL
drop table t1;
select @a:=10, @b:=2, @a>@b, @a:="10", @b:="2", @a>@b, @a:=10, @b:=2, @a>@b, @a:="10", @b:="2", @a>@b;
@a:=10	@b:=2	@a>@b	@a:="10"	@b:="2"	@a>@b	@a:=10	@b:=2	@a>@b	@a:="10"	@b:="2"	@a>@b
10	2	1	10	2	1	10	2	1	10	2	1
create table t1 (i int not null);
insert t1 values (1),(2),(2),(3),(3),(3);
select @a:=0;
@a:=0
0
set @a=0;
drop table t1;
set @a=_utf8mb4'test';
select charset(@a),collation(@a),coercibility(@a);
charset(@a)	collation(@a)	coercibility(@a)
utf8mb4	utf8mb4_general_ci	2
select @a=_utf8mb4'TEST';
@a=_utf8mb4'TEST'
1
select @a=_utf8mb4'TEST' collate utf8mb4_bin;
@a=_utf8mb4'TEST' collate utf8mb4_bin
0
set @a=_utf8mb4'test' collate utf8mb4_general_ci;
select charset(@a),collation(@a),coercibility(@a);
charset(@a)	collation(@a)	coercibility(@a)
utf8mb4	utf8mb4_general_ci	2
select @a=_utf8mb4'TEST';
@a=_utf8mb4'TEST'
1
select @a=_utf8mb4'TEST' collate utf8mb4_bin;
@a=_utf8mb4'TEST' collate utf8mb4_bin
0
select charset(@a:=_utf8mb4'test');
charset(@a:=_utf8mb4'test')
utf8mb4
select collation(@a:=_utf8mb4'test');
collation(@a:=_utf8mb4'test')
utf8mb4_general_ci
select coercibility(@a:=_utf8mb4'test');
coercibility(@a:=_utf8mb4'test')
2
select collation(@a:=_utf8mb4'test' collate utf8mb4_bin);
collation(@a:=_utf8mb4'test' collate utf8mb4_bin)
utf8mb4_bin
select coercibility(@a:=_utf8mb4'test' collate utf8mb4_bin);
coercibility(@a:=_utf8mb4'test' collate utf8mb4_bin)
2
select (@a:=_utf8mb4'test' collate utf8mb4_bin) = _utf8mb4'TEST';
(@a:=_utf8mb4'test' collate utf8mb4_bin) = _utf8mb4'TEST'
0
select charset(@a),collation(@a),coercibility(@a);
charset(@a)	collation(@a)	coercibility(@a)
utf8mb4	utf8mb4_bin	2
set @var= NULL ;
select FIELD( @var,'1it','Hit') as my_column;
my_column
0
select @v, coercibility(@v);
@v	coercibility(@v)
NULL	2
set @v1=null, @v2=1, @v3=1.1, @v4=now();
select coercibility(@v1),coercibility(@v2),coercibility(@v3),coercibility(@v4);
coercibility(@v1)	coercibility(@v2)	coercibility(@v3)	coercibility(@v4)
2	2	2	2
set session @honk=99;
ERROR 42000: You have an error in your SQL syntax; check the manual that corresponds to your OceanBase version for the right syntax to use near '@honk=99' at line 1
select @@local.max_allowed_packet;
@@local.max_allowed_packet
#
select @@session.max_allowed_packet;
@@session.max_allowed_packet
#
select @@global.max_allowed_packet;
@@global.max_allowed_packet
#
select @@max_allowed_packet;
@@max_allowed_packet
#
select @@Max_Allowed_Packet;
@@Max_Allowed_Packet
#
select @@version;
@@version
#
select @@global.version;
@@global.version
#
End of 4.1 tests
set @a=18446744071710965857;
select @a;
@a
18446744071710965857
create table t1(f1 int, f2 int);
insert into t1 values (1,2),(2,3),(3,1);
select /*+use_hash_aggregation*/ @var:=f2 from t1 group by f1 order by f2 desc limit 1;
@var:=f2
3
select @var;
@var
3
drop table t1;
insert into city 'blah';
ERROR 42000: You have an error in your SQL syntax; check the manual that corresponds to your OceanBase version for the right syntax to use near ''blah'' at line 1
SHOW COUNT(*) WARNINGS;
@@session.warning_count
1
SHOW COUNT(*) ERRORS;
@@session.error_count
1
create table t1(f1 int, f2 varchar(2), f3 float, f4 decimal(2,1));
insert into t1 values
(1, "a", 1.5, 1.6), (1, "a", 1.5, 1.6), (2, "b", 2.5, 2.6),
(3, "c", 3.5, 3.6), (4, "d", 4.5, 4.6), (1, "a", 1.5, 1.6),
(3, "c", 3.5, 3.6), (1, "a", 1.5, 1.6);
select @a:=f1, count(f1) from t1 group by 1 desc;
@a:=f1	count(f1)
4	1
3	2
2	1
1	4
select @a:=f1, count(f1) from t1 group by 1 asc;
@a:=f1	count(f1)
1	4
2	1
3	2
4	1
select @a:=f3, count(f3) from t1 group by 1 desc;
@a:=f3	count(f3)
4.5	1
3.5	2
2.5	1
1.5	4
select @a:=f4, count(f4) from t1 group by 1 desc;
@a:=f4	count(f4)
4.6	1
3.6	2
2.6	1
1.6	4
drop table t1;
create table t1 (f1 int);
insert into t1 values (2), (1);
select @i := f1 as j from t1 order by 1;
j
1
2
Warnings:
Warning	1287	Setting user variables within expressions is deprecated and will be removed in a future release. Please use 'SET variable=expression, ... or SELECT expression(s) INTO variables(s)' instead
drop table t1;
create table t1(a int);
insert into t1 values(5),(4),(4),(3),(2),(2),(2),(1);
set @rownum := 0;
set @rank := 0;
set @prev_score := NULL;
select @rownum := @rownum + 1 as row,
@rank := IF(@prev_score!=a, @rownum, @rank) as rank,
@prev_score := a as score
from t1 order by score desc;
drop table t1;
create table t1(b bigint);
insert into t1 (b) values (10), (30), (10);
set @var := 0;
drop table t1;
create table t1 (id int);
insert into t1 values (2), (3), (3), (4);
set @lastid=-1;
drop table t1;
create table t1 (id bigint);
insert into t1 values (2), (3), (3), (4);
set @lastid=-1;
drop table t1;
drop table if exists t1,t2,t3;
CREATE TABLE t1 (f1 int(11) default NULL, f2 int(11) default NULL);
CREATE TABLE t2 (f1 int(11) default NULL, f2 int(11) default NULL, foo int(11));
CREATE TABLE t3 (f1 int(11) default NULL, f2 int(11) default NULL);
INSERT INTO t1 VALUES(10, 10);
INSERT INTO t1 VALUES(10, 10);
INSERT INTO t2 VALUES(10, 10, 10);
INSERT INTO t2 VALUES(10, 10, 10);
INSERT INTO t3 VALUES(10, 10);
INSERT INTO t3 VALUES(10, 10);
SELECT MIN(t2.f1),
@bar:= (SELECT MIN(t3.f2) FROM t3 WHERE t3.f2 > foo)
FROM t1,t2 WHERE t1.f1 = t2.f1 ORDER BY t2.f1;
MIN(t2.f1)	@bar:= (SELECT MIN(t3.f2) FROM t3 WHERE t3.f2 > foo)
10	NULL
DROP TABLE t1, t2, t3;
End of 5.0 tests
CREATE TABLE t1(a INT);
INSERT INTO t1 VALUES (0),(0);
# BUG#55564 : should not crash
SELECT IF(
@v:=LEAST((SELECT 1 FROM t1 t2 LEFT JOIN t1 ON (@v) GROUP BY t1.a), a),
count(*), 1)
FROM t1 GROUP BY a LIMIT 1;
IF(
@v:=LEAST((SELECT 1 FROM t1 t2 LEFT JOIN t1 ON (@v) GROUP BY t1.a), a),
count(*), 1)
1
DROP TABLE t1;
select @v:=@v:=sum(1) from dual;
@v:=@v:=sum(1)
1
CREATE TABLE t1(a DECIMAL(31,21));
INSERT INTO t1 VALUES (0);
SELECT (@v:=a) <> (@v:=1) FROM t1;
(@v:=a) <> (@v:=1)
1
DROP TABLE t1;
End of 5.1 tests
DROP TABLE IF EXISTS t1;
CREATE TABLE t1(f1 INT AUTO_INCREMENT, PRIMARY KEY(f1));
INSERT INTO t1 SET f1 = NULL ;
SET @aux = NULL ;
INSERT INTO t1 SET f1 = @aux ;
SET @aux1 = 0.123E-1;
SET @aux1 = NULL;
INSERT INTO t1 SET f1 = @aux1 ;
SELECT * FROM t1;
f1
1
2
3
DROP TABLE t1;
CREATE TABLE t1(f1 VARCHAR(257) , f2 INT, PRIMARY KEY(f2));
SET @aux = 1;
SET @aux = NULL;
INSERT INTO test.t1 (f1, f2) VALUES (1, 1), (@aux, 2);
SET @aux = 'text';
SET @aux = NULL;
INSERT INTO t1(f1, f2) VALUES (1, 3), (@aux, 4);
SELECT f1, f2 FROM t1 ORDER BY f2;
f1	f2
1	1
NULL	2
1	3
NULL	4
DROP TABLE t1;
#
# Bug #12408412: GROUP_CONCAT + ORDER BY + INPUT/OUTPUT
#   SAME USER VARIABLE = CRASH
#
End of 5.5 tests
CREATE TABLE t1(a int);
INSERT INTO t1 VALUES (1), (2);
SELECT DISTINCT @a:=MIN(t1.a) FROM t1, t1 AS t2
GROUP BY @b:=(SELECT COUNT(*) > t2.a);
@a:=MIN(t1.a)
1
DROP TABLE t1;
CREATE TABLE t1(a INT);
INSERT INTO t1 VALUES (0);
SELECT DISTINCT POW(COUNT(*), @a:=(SELECT 1 FROM t1 LEFT JOIN t1 AS t2 ON @a))
AS b FROM t1 GROUP BY a;
b
1
SELECT @a;
@a
1
DROP TABLE t1;
CREATE TABLE t1(f1 INT, f2 INT);
INSERT INTO t1 VALUES (1,2),(2,3),(3,1);
CREATE TABLE t2(a INT);
INSERT INTO t2 VALUES (1);
SET @var=NULL;
SELECT @var:=(SELECT f2 FROM t2 WHERE @var) FROM t1 GROUP BY f1 ORDER BY f2 DESC
LIMIT 1;
@var:=(SELECT f2 FROM t2 WHERE @var)
NULL
SELECT @var;
@var
NULL
DROP TABLE t1, t2;
CREATE TABLE t1(a INT);
INSERT INTO t1 VALUES (1), (2), (3), (4), (5), (6), (7), (8), (9), (10);
CREATE TABLE t2(a INT);
INSERT INTO t2 VALUES (1), (3), (5), (7), (9);
CREATE TABLE t3(a INT);
INSERT INTO t3 VALUES (1), (4), (7), (10);
SET @var1 = 6;
SELECT t1.a, t2.a, t3.a, (@var1:= @var1+0) AS var
FROM t1
LEFT JOIN t2 ON t1.a=t2.a AND t2.a < @var1
LEFT JOIN t3 ON t1.a=t3.a AND t3.a < @var1;
a	a	a	var
1	1	1	6
10	NULL	NULL	6
2	NULL	NULL	6
3	3	NULL	6
4	NULL	4	6
5	5	NULL	6
6	NULL	NULL	6
7	NULL	NULL	6
8	NULL	NULL	6
9	NULL	NULL	6
DROP TABLE t1, t2, t3;
set @var='abc';
SET collation_connection='gbk_bin';
SET @@character_set_client = gbk;
set @var2='cde';
select @var union select @var2;
@var
abc
cde
set @c='';
set @i=cast(1 as number);
explain select '' as c1 union select 1 as c1;
Query Plan
==============================================================
|ID|OPERATOR             |NAME         |EST.ROWS|EST.TIME(us)|
--------------------------------------------------------------
|0 |HASH DISTINCT        |             |2       |1           |
|1 |+-VALUES TABLE ACCESS|VALUES_TABLE1|2       |1           |
==============================================================
Outputs & filters:
-------------------------------------
  0 - output([VALUES_TABLE1.column_0]), filter(nil), rowset=16
      distinct([VALUES_TABLE1.column_0])
  1 - output([VALUES_TABLE1.column_0]), filter(nil)
      access([VALUES_TABLE1.column_0])
select '' as c1 union select 1 as c1;
c1

1
explain select @c as c1 union select @i as c1;
Query Plan
====================================================
|ID|OPERATOR            |NAME|EST.ROWS|EST.TIME(us)|
----------------------------------------------------
|0 |MERGE UNION DISTINCT|    |2       |1           |
|1 ||-EXPRESSION        |    |1       |1           |
|2 |+-EXPRESSION        |    |1       |1           |
====================================================
Outputs & filters:
-------------------------------------
  0 - output([UNION([1])]), filter(nil), rowset=16
  1 - output([cast(('c'), VARCHAR(1048576))]), filter(nil)
      values({cast(('c'), VARCHAR(1048576))})
  2 - output([cast(('i'), VARCHAR(1048576))]), filter(nil)
      values({cast(('i'), VARCHAR(1048576))})
select @c as c1 union select @i as c1;
c1

1
