drop table if exists test;
create table test(c1 int primary key, c2 int);
insert into test values(1,2);
select values(c1) from test;
values(c1)
NULL
update test set c1 = values(c1);
ERROR 23000: Column 'c1' cannot be null
update test set c2 = values(c2);
select * from test;
c1	c2
1	NULL
insert into test values(1,3) on duplicate key  update c2 = values(c2);
select * from test;
c1	c2
1	3
