alter system set weak_read_version_refresh_interval = '50ms';
alter system set enable_monotonic_weak_read = true tenant = sys;
alter system set enable_monotonic_weak_read = true tenant = all_user;
alter system set enable_monotonic_weak_read = true tenant = all_meta;
use test;
drop table if exists t1;
create table t1(a int, b int);
insert into t1 values(1,0);
select /*+read_consistency(weak)*/ * from t1 where a = 1;
a	b
1	0
alter system set enable_monotonic_weak_read = false tenant = sys;
alter system set enable_monotonic_weak_read = false tenant = all_user;
alter system set enable_monotonic_weak_read = false tenant = all_meta;
use test;
update t1 set b = 1 where a = 1;
select /*+read_consistency(weak)*/ * from t1 where a = 1;
a	b
1	1
alter system set weak_read_version_refresh_interval = '50ms';
use test;
select /*+read_consistency(weak)*/ * from t1 where a = 1;
a	b
1	1
drop table if exists t1;
