create table t1(idx int, pk int, c1 int, c2 int, primary key(pk));
create table t2(idx int, pk int, c1 int, c2 int, primary key(pk));
create index i1 on t1(idx);
create index i2 on t2(idx) storing(c1,c2);
insert into t1(idx,pk,c1,c2) values(0,0,0,0),(0,1,0,0),(0,2,0,0),(0,3,0,0),(1,4,0,0),(1,5,0,0),(1,6,0,0),(1,7,0,0);
insert into t2(idx,pk,c1,c2) values(0,0,0,0),(0,1,0,0),(0,2,0,0),(0,3,0,0),(1,4,0,0),(1,5,0,0),(1,6,0,0),(1,7,0,0);
alter system major freeze tenant = sys;
alter system major freeze tenant = all_user;
alter system major freeze tenant = all_meta;
select c1,c2 from t1 where idx=1 when row_count(update t1 set c1=c1+1, c2=c2+1 where idx=1)=1;
ERROR 23000: Number 1 When filter failed, ret=-5064, func 1: ROW_COUNT()=4
select * from t1;
idx	pk	c1	c2
0	0	0	0
0	1	0	0
0	2	0	0
0	3	0	0
1	4	0	0
1	5	0	0
1	6	0	0
1	7	0	0
idx	pk
0	0
0	1
0	2
0	3
1	4
1	5
1	6
1	7
select * from t1 when row_count(update t1 set c1=c1+1, c2=c2+1 where idx=0)=4;
idx	pk	c1	c2
0	0	1	1
0	1	1	1
0	2	1	1
0	3	1	1
1	4	0	0
1	5	0	0
1	6	0	0
1	7	0	0
select c1,c2 from t1 where idx=1 when row_count(update t1 set c1=c1+1, c2=c2+1 where idx=1)=4;
c1	c2
1	1
1	1
1	1
1	1
select * from t1;
idx	pk	c1	c2
0	0	1	1
0	1	1	1
0	2	1	1
0	3	1	1
1	4	1	1
1	5	1	1
1	6	1	1
1	7	1	1
idx	pk
0	0
0	1
0	2
0	3
1	4
1	5
1	6
1	7
replace into t1(idx,pk,c1,c2) values(0,0,0,0),(0,1,0,0),(0,2,0,0),(0,3,0,0),(1,4,0,0),(1,5,0,0),(1,6,0,0),(1,7,0,0);
select * from t1 where idx=1 when row_count(update t1 set c1=c1+1, c2=c2+1 where idx=1 when row_count(update t1 set c1=c1+1, c2=c2+1 where idx=1)=4)=4;
idx	pk	c1	c2
1	4	2	2
1	5	2	2
1	6	2	2
1	7	2	2
select c1,c2 from t1 where idx=0 when row_count(update t1 set c1=c1+1, c2=c2+1 where idx=0 when row_count(update t1 set c1=c1+1, c2=c2+1 where idx=0)=4)=4;
c1	c2
2	2
2	2
2	2
2	2
select * from t1;
idx	pk	c1	c2
0	0	2	2
0	1	2	2
0	2	2	2
0	3	2	2
1	4	2	2
1	5	2	2
1	6	2	2
1	7	2	2
idx	pk
0	0
0	1
0	2
0	3
1	4
1	5
1	6
1	7
select * from t1 where idx=1 when row_count(update t1 set c1=c1+1, c2=c2+1 where idx=1 when row_count(update t1 set c1=c1+1, c2=c2+1 where idx=1)=3)=4;
ERROR 23000: Number 1 When filter failed, ret=-5064, func 1: ROW_COUNT()=4
select * from t1 where idx=1 when row_count(update t1 set c1=c1+1, c2=c2+1 where idx=1 when row_count(update t1 set c1=c1+1, c2=c2+1 where idx=1)=4)=3;
ERROR 23000: Number 2 When filter failed, ret=-5064, func 1: ROW_COUNT()=4
select * from t1;
idx	pk	c1	c2
0	0	2	2
0	1	2	2
0	2	2	2
0	3	2	2
1	4	2	2
1	5	2	2
1	6	2	2
1	7	2	2
idx	pk
0	0
0	1
0	2
0	3
1	4
1	5
1	6
1	7
replace into t1(idx,pk,c1,c2) values(0,0,0,0),(0,1,0,0),(0,2,0,0),(0,3,0,0),(1,4,0,0),(1,5,0,0),(1,6,0,0),(1,7,0,0);
select * from t1 where idx=0 when row_count(update t2 set c1=c1+1, c2=c2+1 where idx=0 when row_count(update t1 set c1=c1+1, c2=c2+1 where idx=0)=4)=4;
idx	pk	c1	c2
0	0	1	1
0	1	1	1
0	2	1	1
0	3	1	1
select * from t1;
idx	pk	c1	c2
0	0	1	1
0	1	1	1
0	2	1	1
0	3	1	1
1	4	0	0
1	5	0	0
1	6	0	0
1	7	0	0
idx	pk
0	0
0	1
0	2
0	3
1	4
1	5
1	6
1	7
select * from t2;
idx	pk	c1	c2
0	0	1	1
0	1	1	1
0	2	1	1
0	3	1	1
1	4	0	0
1	5	0	0
1	6	0	0
1	7	0	0
idx	pk	c1	c2
0	0	1	1
0	1	1	1
0	2	1	1
0	3	1	1
1	4	0	0
1	5	0	0
1	6	0	0
1	7	0	0
select c1,c2 from t2 where idx=1 when row_count(update t2 set c1=c1+1, c2=c2+1 where idx=1 when row_count(update t1 set c1=c1+1, c2=c2+1 where idx=1)=4)=4;
c1	c2
1	1
1	1
1	1
1	1
select * from t1;
idx	pk	c1	c2
0	0	1	1
0	1	1	1
0	2	1	1
0	3	1	1
1	4	1	1
1	5	1	1
1	6	1	1
1	7	1	1
idx	pk
0	0
0	1
0	2
0	3
1	4
1	5
1	6
1	7
select * from t2;
idx	pk	c1	c2
0	0	1	1
0	1	1	1
0	2	1	1
0	3	1	1
1	4	1	1
1	5	1	1
1	6	1	1
1	7	1	1
idx	pk	c1	c2
0	0	1	1
0	1	1	1
0	2	1	1
0	3	1	1
1	4	1	1
1	5	1	1
1	6	1	1
1	7	1	1
select * from t1 where idx=1 when row_count(update t2 set c1=c1+1, c2=c2+1 where idx=1 when row_count(update t1 set c1=c1+1, c2=c2+1 where idx=1)=4)=1;
ERROR 23000: Number 2 When filter failed, ret=-5064, func 1: ROW_COUNT()=4
select * from t1 where idx=1 when row_count(update t2 set c1=c1+1, c2=c2+1 where idx=1 when row_count(update t1 set c1=c1+1, c2=c2+1 where idx=1)=1)=4;
ERROR 23000: Number 1 When filter failed, ret=-5064, func 1: ROW_COUNT()=4
select * from t1;
idx	pk	c1	c2
0	0	1	1
0	1	1	1
0	2	1	1
0	3	1	1
1	4	1	1
1	5	1	1
1	6	1	1
1	7	1	1
idx	pk
0	0
0	1
0	2
0	3
1	4
1	5
1	6
1	7
select * from t2;
idx	pk	c1	c2
0	0	1	1
0	1	1	1
0	2	1	1
0	3	1	1
1	4	1	1
1	5	1	1
1	6	1	1
1	7	1	1
idx	pk	c1	c2
0	0	1	1
0	1	1	1
0	2	1	1
0	3	1	1
1	4	1	1
1	5	1	1
1	6	1	1
1	7	1	1
replace into t1(idx,pk,c1,c2) values(0,0,0,0),(0,1,0,0),(0,2,0,0),(0,3,0,0),(1,4,0,0),(1,5,0,0),(1,6,0,0),(1,7,0,0);
replace into t2(idx,pk,c1,c2) values(0,0,0,0),(0,1,0,0),(0,2,0,0),(0,3,0,0),(1,4,0,0),(1,5,0,0),(1,6,0,0),(1,7,0,0);
select c1, c2 from t1 when row_count(update t1 set c1=c1+1, c2=c2+1 where idx=1 when row_count(delete from t1 where idx=0)=4)=1;
ERROR 23000: Number 2 When filter failed, ret=-5064, func 1: ROW_COUNT()=4
select c1, c2 from t1 when row_count(update t1 set c1=c1+1, c2=c2+1 where idx=1 when row_count(delete from t1 where idx=0)=1)=4;
ERROR 23000: Number 1 When filter failed, ret=-5064, func 1: ROW_COUNT()=4
select c1, c2 from t1 when row_count(update t1 set c1=c1+1, c2=c2+1 where idx=1 when row_count(delete from t2 where idx=0)=4)=1;
ERROR 23000: Number 2 When filter failed, ret=-5064, func 1: ROW_COUNT()=4
select c1, c2 from t1 when row_count(update t1 set c1=c1+1, c2=c2+1 where idx=1 when row_count(delete from t2 where idx=0)=1)=4;
ERROR 23000: Number 1 When filter failed, ret=-5064, func 1: ROW_COUNT()=4
select * from t1;
idx	pk	c1	c2
0	0	0	0
0	1	0	0
0	2	0	0
0	3	0	0
1	4	0	0
1	5	0	0
1	6	0	0
1	7	0	0
idx	pk
0	0
0	1
0	2
0	3
1	4
1	5
1	6
1	7
select * from t2;
idx	pk	c1	c2
0	0	0	0
0	1	0	0
0	2	0	0
0	3	0	0
1	4	0	0
1	5	0	0
1	6	0	0
1	7	0	0
idx	pk	c1	c2
0	0	0	0
0	1	0	0
0	2	0	0
0	3	0	0
1	4	0	0
1	5	0	0
1	6	0	0
1	7	0	0
select c1, c2 from t1 where idx=0 when row_count(update t1 set c1=c1+1, c2=c2+1 where idx=0 when row_count(delete from t2 where idx=0)=4)=4;
c1	c2
1	1
1	1
1	1
1	1
select * from t1;
idx	pk	c1	c2
0	0	1	1
0	1	1	1
0	2	1	1
0	3	1	1
1	4	0	0
1	5	0	0
1	6	0	0
1	7	0	0
idx	pk
0	0
0	1
0	2
0	3
1	4
1	5
1	6
1	7
select * from t2;
idx	pk	c1	c2
1	4	0	0
1	5	0	0
1	6	0	0
1	7	0	0
idx	pk	c1	c2
1	4	0	0
1	5	0	0
1	6	0	0
1	7	0	0
select idx, pk, c1, c2 from t1 where idx=0 when row_count(update t1 set c1=c1+1, c2=c2+1 where idx=0 when row_count(delete from t2 where idx=1)=4)=4;
idx	pk	c1	c2
0	0	2	2
0	1	2	2
0	2	2	2
0	3	2	2
select * from t1;
idx	pk	c1	c2
0	0	2	2
0	1	2	2
0	2	2	2
0	3	2	2
1	4	0	0
1	5	0	0
1	6	0	0
1	7	0	0
idx	pk
0	0
0	1
0	2
0	3
1	4
1	5
1	6
1	7
select * from t2;
idx	pk	c1	c2
idx	pk	c1	c2
select * from t1 where idx=1 when row_count(update t1 set c1=c1+1, c2=c2+1 where idx=1 when row_count(delete from t1 where idx=0)=4)=4;
idx	pk	c1	c2
1	4	1	1
1	5	1	1
1	6	1	1
1	7	1	1
select * from t1;
idx	pk	c1	c2
1	4	1	1
1	5	1	1
1	6	1	1
1	7	1	1
idx	pk
1	4
1	5
1	6
1	7
select * from t2;
idx	pk	c1	c2
idx	pk	c1	c2
replace into t1(idx,pk,c1,c2) values(0,0,0,0),(0,1,0,0),(0,2,0,0),(0,3,0,0),(1,4,0,0),(1,5,0,0),(1,6,0,0),(1,7,0,0);
replace into t2(idx,pk,c1,c2) values(0,0,0,0),(0,1,0,0),(0,2,0,0),(0,3,0,0),(1,4,0,0),(1,5,0,0),(1,6,0,0),(1,7,0,0);
update t1 set c1=3, c2=3 where idx=2 when row_count(insert into t1(idx,pk,c1,c2) values(2,0,0,0),(2,1,0,0))=2;
ERROR 23000: Duplicate entry '0' for key 'PRIMARY'
update t2 set c1=4, c2=4 where idx=2 when row_count(insert into t1(idx,pk,c1,c2) values(2,2,0,0),(2,3,0,0))=2;
ERROR 23000: Duplicate entry '2' for key 'PRIMARY'
update t1 set c1=5, c2=5 where idx=3 when row_count(insert into t1(idx,pk,c1,c2) values(2,8,0,0))=2;
ERROR 23000: Number 1 When filter failed, ret=-5064, func 1: ROW_COUNT()=1
select * from t1;
idx	pk	c1	c2
0	0	0	0
0	1	0	0
0	2	0	0
0	3	0	0
1	4	0	0
1	5	0	0
1	6	0	0
1	7	0	0
idx	pk
0	0
0	1
0	2
0	3
1	4
1	5
1	6
1	7
select * from t2;
idx	pk	c1	c2
0	0	0	0
0	1	0	0
0	2	0	0
0	3	0	0
1	4	0	0
1	5	0	0
1	6	0	0
1	7	0	0
idx	pk	c1	c2
0	0	0	0
0	1	0	0
0	2	0	0
0	3	0	0
1	4	0	0
1	5	0	0
1	6	0	0
1	7	0	0
update t1 set c1=2, c2=2 where idx=2 when row_count(insert into t1(idx,pk,c1,c2) values(2,8,0,0))=1;
update t2 set c1=2, c2=2 where idx=2 when row_count(replace into t1(idx,pk,c1,c2) values(2,9,0,0))=1;
select * from t1;
idx	pk	c1	c2
0	0	0	0
0	1	0	0
0	2	0	0
0	3	0	0
1	4	0	0
1	5	0	0
1	6	0	0
1	7	0	0
2	8	0	0
2	9	0	0
idx	pk
0	0
0	1
0	2
0	3
1	4
1	5
1	6
1	7
2	8
2	9
select * from t2;
idx	pk	c1	c2
0	0	0	0
0	1	0	0
0	2	0	0
0	3	0	0
1	4	0	0
1	5	0	0
1	6	0	0
1	7	0	0
idx	pk	c1	c2
0	0	0	0
0	1	0	0
0	2	0	0
0	3	0	0
1	4	0	0
1	5	0	0
1	6	0	0
1	7	0	0
update t1 set c1=6, c2=6 where idx=0 when row_count(insert into t1(idx,pk,c1,c2) values(2,10,0,0),(2,11,0,0))=1;
ERROR 23000: Number 1 When filter failed, ret=-5064, func 1: ROW_COUNT()=2
update t1 set c1=7, c2=7 where idx=1 when row_count(replace into t1(idx,pk,c1,c2) values(3,12,0,0),(3,13,0,0))=1;
ERROR 23000: Number 1 When filter failed, ret=-5064, func 1: ROW_COUNT()=2
update t1 set c1=8, c2=8 where idx=0 when row_count(insert into t2(idx,pk,c1,c2) values(2,8,0,0),(2,9,0,0))=1;
ERROR 23000: Number 1 When filter failed, ret=-5064, func 1: ROW_COUNT()=2
update t1 set c1=9, c2=9 where idx=1 when row_count(replace into t2(idx,pk,c1,c2) values(2,10,0,0),(2,11,0,0))=1;
ERROR 23000: Number 1 When filter failed, ret=-5064, func 1: ROW_COUNT()=2
select * from t1;
idx	pk	c1	c2
0	0	0	0
0	1	0	0
0	2	0	0
0	3	0	0
1	4	0	0
1	5	0	0
1	6	0	0
1	7	0	0
2	8	0	0
2	9	0	0
idx	pk
0	0
0	1
0	2
0	3
1	4
1	5
1	6
1	7
2	8
2	9
select * from t2;
idx	pk	c1	c2
0	0	0	0
0	1	0	0
0	2	0	0
0	3	0	0
1	4	0	0
1	5	0	0
1	6	0	0
1	7	0	0
idx	pk	c1	c2
0	0	0	0
0	1	0	0
0	2	0	0
0	3	0	0
1	4	0	0
1	5	0	0
1	6	0	0
1	7	0	0
update t1 set c1=6, c2=6 where idx=0 when row_count(insert into t1(idx,pk,c1,c2) values(2,10,0,0),(2,11,0,0))=2;
update t1 set c1=7, c2=7 where idx=1 when row_count(replace into t1(idx,pk,c1,c2) values(3,12,0,0),(3,13,0,0))=2;
select * from t1;
idx	pk	c1	c2
0	0	6	6
0	1	6	6
0	2	6	6
0	3	6	6
1	4	7	7
1	5	7	7
1	6	7	7
1	7	7	7
2	8	0	0
2	9	0	0
2	10	0	0
2	11	0	0
3	12	0	0
3	13	0	0
idx	pk
0	0
0	1
0	2
0	3
1	4
1	5
1	6
1	7
2	8
2	9
2	10
2	11
3	12
3	13
update t1 set c1=8, c2=8 where idx=0 when row_count(insert into t2(idx,pk,c1,c2) values(2,8,0,0),(2,9,0,0))=2;
update t1 set c1=9, c2=9 where idx=1 when row_count(replace into t2(idx,pk,c1,c2) values(2,10,0,0),(2,11,0,0))=2;
select * from t1;
idx	pk	c1	c2
0	0	8	8
0	1	8	8
0	2	8	8
0	3	8	8
1	4	9	9
1	5	9	9
1	6	9	9
1	7	9	9
2	8	0	0
2	9	0	0
2	10	0	0
2	11	0	0
3	12	0	0
3	13	0	0
idx	pk
0	0
0	1
0	2
0	3
1	4
1	5
1	6
1	7
2	8
2	9
2	10
2	11
3	12
3	13
select * from t2;
idx	pk	c1	c2
0	0	0	0
0	1	0	0
0	2	0	0
0	3	0	0
1	4	0	0
1	5	0	0
1	6	0	0
1	7	0	0
2	8	0	0
2	9	0	0
2	10	0	0
2	11	0	0
idx	pk	c1	c2
0	0	0	0
0	1	0	0
0	2	0	0
0	3	0	0
1	4	0	0
1	5	0	0
1	6	0	0
1	7	0	0
2	8	0	0
2	9	0	0
2	10	0	0
2	11	0	0
delete from t1;
delete from t2;
replace into t1(idx,pk,c1,c2) values(0,0,0,0),(0,1,0,0),(0,2,0,0),(0,3,0,0),(1,4,0,0),(1,5,0,0),(1,6,0,0),(1,7,0,0);
replace into t2(idx,pk,c1,c2) values(0,0,0,0),(0,1,0,0),(0,2,0,0),(0,3,0,0),(1,4,0,0),(1,5,0,0),(1,6,0,0),(1,7,0,0);
update t1 set c1=c1+1, c2=c2+1 where idx=1 when row_count(update t1 set c1=c1+1, c2=c2+1 where idx=0)=4;
select * from t1;
idx	pk	c1	c2
0	0	1	1
0	1	1	1
0	2	1	1
0	3	1	1
1	4	1	1
1	5	1	1
1	6	1	1
1	7	1	1
idx	pk
0	0
0	1
0	2
0	3
1	4
1	5
1	6
1	7
update t1 set c1=c1+1, c2=c2+1 where idx=0 when row_count(update t1 set c1=c1+1, c2=c2+1 where idx=0)=4;
select * from t1;
idx	pk	c1	c2
0	0	3	3
0	1	3	3
0	2	3	3
0	3	3	3
1	4	1	1
1	5	1	1
1	6	1	1
1	7	1	1
idx	pk
0	0
0	1
0	2
0	3
1	4
1	5
1	6
1	7
update t1 set c1=c1+1, c2=c2+1 where idx=0 when row_count(update t1 set c1=c1+1, c2=c2+1 where idx=0)=0;
ERROR 23000: Number 1 When filter failed, ret=-5064, func 1: ROW_COUNT()=4
update t1 set c1=c1+1, c2=c2+1 where idx=1 when row_count(update t1 set c1=c1+1, c2=c2+1 where idx=0)=0;
ERROR 23000: Number 1 When filter failed, ret=-5064, func 1: ROW_COUNT()=4
select * from t1;
idx	pk	c1	c2
0	0	3	3
0	1	3	3
0	2	3	3
0	3	3	3
1	4	1	1
1	5	1	1
1	6	1	1
1	7	1	1
idx	pk
0	0
0	1
0	2
0	3
1	4
1	5
1	6
1	7
replace into t1(idx,pk,c1,c2) values(0,0,0,0),(0,1,0,0),(0,2,0,0),(0,3,0,0),(1,4,0,0),(1,5,0,0),(1,6,0,0),(1,7,0,0);
replace into t2(idx,pk,c1,c2) values(0,0,0,0),(0,1,0,0),(0,2,0,0),(0,3,0,0),(1,4,0,0),(1,5,0,0),(1,6,0,0),(1,7,0,0);
update t1 set c1=c1+1, c2=c2+1 where idx=0 when row_count(delete from t1 where idx=1)=1;
ERROR 23000: Number 1 When filter failed, ret=-5064, func 1: ROW_COUNT()=4
update t1 set c1=c1+1, c2=c2+1 where idx=0 when row_count(delete from t2 where idx=1)=1;
ERROR 23000: Number 1 When filter failed, ret=-5064, func 1: ROW_COUNT()=4
select * from t1;
idx	pk	c1	c2
0	0	0	0
0	1	0	0
0	2	0	0
0	3	0	0
1	4	0	0
1	5	0	0
1	6	0	0
1	7	0	0
idx	pk
0	0
0	1
0	2
0	3
1	4
1	5
1	6
1	7
select * from t2;
idx	pk	c1	c2
0	0	0	0
0	1	0	0
0	2	0	0
0	3	0	0
1	4	0	0
1	5	0	0
1	6	0	0
1	7	0	0
idx	pk	c1	c2
0	0	0	0
0	1	0	0
0	2	0	0
0	3	0	0
1	4	0	0
1	5	0	0
1	6	0	0
1	7	0	0
update t1 set c1=c1+1, c2=c2+1 where idx=0 when row_count(delete from t1 where idx=1)=4;
select * from t1;
idx	pk	c1	c2
0	0	1	1
0	1	1	1
0	2	1	1
0	3	1	1
idx	pk
0	0
0	1
0	2
0	3
update t1 set c1=c1+1, c2=c2+1 where idx=0 when row_count(delete from t2 where idx=1)=4;
select * from t1;
idx	pk	c1	c2
0	0	2	2
0	1	2	2
0	2	2	2
0	3	2	2
idx	pk
0	0
0	1
0	2
0	3
select * from t2;
idx	pk	c1	c2
0	0	0	0
0	1	0	0
0	2	0	0
0	3	0	0
idx	pk	c1	c2
0	0	0	0
0	1	0	0
0	2	0	0
0	3	0	0
update t1 set c1=c1+1, c2=c2+1 where idx=0 when row_count(delete from t1 where idx=0)=4;
select * from t1;
idx	pk	c1	c2
idx	pk
replace into t1(idx,pk,c1,c2) values(0,0,0,0),(0,1,0,0),(0,2,0,0),(0,3,0,0),(1,4,0,0),(1,5,0,0),(1,6,0,0),(1,7,0,0);
replace into t2(idx,pk,c1,c2) values(0,0,0,0),(0,1,0,0),(0,2,0,0),(0,3,0,0),(1,4,0,0),(1,5,0,0),(1,6,0,0),(1,7,0,0);
select * from t1 when row_count(delete from t1 where idx=0)=0;
ERROR 23000: Number 1 When filter failed, ret=-5064, func 1: ROW_COUNT()=4
select * from t1;
idx	pk	c1	c2
0	0	0	0
0	1	0	0
0	2	0	0
0	3	0	0
1	4	0	0
1	5	0	0
1	6	0	0
1	7	0	0
idx	pk
0	0
0	1
0	2
0	3
1	4
1	5
1	6
1	7
select * from t1 when row_count(delete from t1 where idx=0)=4;
idx	pk	c1	c2
1	4	0	0
1	5	0	0
1	6	0	0
1	7	0	0
select * from t1;
idx	pk	c1	c2
1	4	0	0
1	5	0	0
1	6	0	0
1	7	0	0
idx	pk
1	4
1	5
1	6
1	7
select c1,c2 from t1 where idx=1 when row_count(delete from t1 where idx=1)=4;
c1	c2
select * from t1;
idx	pk	c1	c2
idx	pk
select idx,pk, c1, c2 from t2 when row_count(delete from t2 where idx=0)=4;
idx	pk	c1	c2
1	4	0	0
1	5	0	0
1	6	0	0
1	7	0	0
select * from t2;
idx	pk	c1	c2
1	4	0	0
1	5	0	0
1	6	0	0
1	7	0	0
idx	pk	c1	c2
1	4	0	0
1	5	0	0
1	6	0	0
1	7	0	0
select * from t2 where idx=1 when row_count(delete from t2 where idx=1)=4;
idx	pk	c1	c2
select * from t2;
idx	pk	c1	c2
idx	pk	c1	c2
replace into t1(idx,pk,c1,c2) values(0,0,0,0),(0,1,0,0),(0,2,0,0),(0,3,0,0),(1,4,0,0),(1,5,0,0),(1,6,0,0),(1,7,0,0);
replace into t2(idx,pk,c1,c2) values(0,0,0,0),(0,1,0,0),(0,2,0,0),(0,3,0,0),(1,4,0,0),(1,5,0,0),(1,6,0,0),(1,7,0,0);
select * from t1 when row_count(delete from t1 where idx=1 when row_count(delete from t1 where idx=0)=1)=4;
ERROR 23000: Number 1 When filter failed, ret=-5064, func 1: ROW_COUNT()=4
select * from t2 when row_count(delete from t1 where idx=1 when row_count(delete from t1 where idx=0)=4)=1;
ERROR 23000: Number 2 When filter failed, ret=-5064, func 1: ROW_COUNT()=4
select * from t1;
idx	pk	c1	c2
0	0	0	0
0	1	0	0
0	2	0	0
0	3	0	0
1	4	0	0
1	5	0	0
1	6	0	0
1	7	0	0
idx	pk
0	0
0	1
0	2
0	3
1	4
1	5
1	6
1	7
select idx,pk, c1, c2 from t2 when row_count(delete from t2 where idx=0)=4;
idx	pk	c1	c2
1	4	0	0
1	5	0	0
1	6	0	0
1	7	0	0
select * from t2;
idx	pk	c1	c2
1	4	0	0
1	5	0	0
1	6	0	0
1	7	0	0
idx	pk	c1	c2
1	4	0	0
1	5	0	0
1	6	0	0
1	7	0	0
select * from t1 when row_count(delete from t1 where idx=1 when row_count(delete from t1 where idx=0)=4)=4;
idx	pk	c1	c2
select * from t1 when row_count(delete from t2 where idx=1 when row_count(delete from t1 where idx=1)=0)=4;
idx	pk	c1	c2
select * from t1;
idx	pk	c1	c2
idx	pk
select idx, pk, c1, c2 from t2 when row_count(delete from t2 where idx=0)=0;
idx	pk	c1	c2
select * from t2;
idx	pk	c1	c2
idx	pk	c1	c2
replace into t1(idx,pk,c1,c2) values(0,0,0,0),(0,1,0,0),(0,2,0,0),(0,3,0,0),(1,4,0,0),(1,5,0,0),(1,6,0,0),(1,7,0,0);
replace into t2(idx,pk,c1,c2) values(0,0,0,0),(0,1,0,0),(0,2,0,0),(0,3,0,0),(1,4,0,0),(1,5,0,0),(1,6,0,0),(1,7,0,0);
select c1, c2 from t1 where idx=0 when row_count(delete from t1 where idx=1 when row_count(delete from t2 where idx=0)=4)=4;
c1	c2
0	0
0	0
0	0
0	0
select * from t1;
idx	pk	c1	c2
0	0	0	0
0	1	0	0
0	2	0	0
0	3	0	0
idx	pk
0	0
0	1
0	2
0	3
select idx, pk, c1, c2 from t2 when row_count(delete from t2 where idx=0)=0;
idx	pk	c1	c2
1	4	0	0
1	5	0	0
1	6	0	0
1	7	0	0
select c1, c2 from t1 where idx=0 when row_count(delete from t2 where idx=1 when row_count(delete from t2 where idx=0)=4)=0;
ERROR 23000: Number 1 When filter failed, ret=-5064, func 1: ROW_COUNT()=0
select * from t2;
idx	pk	c1	c2
1	4	0	0
1	5	0	0
1	6	0	0
1	7	0	0
idx	pk	c1	c2
1	4	0	0
1	5	0	0
1	6	0	0
1	7	0	0
replace into t1(idx,pk,c1,c2) values(0,0,0,0),(0,1,0,0),(0,2,0,0),(0,3,0,0),(1,4,0,0),(1,5,0,0),(1,6,0,0),(1,7,0,0);
replace into t2(idx,pk,c1,c2) values(0,0,0,0),(0,1,0,0),(0,2,0,0),(0,3,0,0),(1,4,0,0),(1,5,0,0),(1,6,0,0),(1,7,0,0);
select c1,c2 from t1 when row_count(delete from t1 where idx=0 when row_count(update t1 set c1=c1+1, c2=c2+1 where idx=1)=4)=1;
ERROR 23000: Number 2 When filter failed, ret=-5064, func 1: ROW_COUNT()=4
select c1,c2 from t1 when row_count(delete from t1 where idx=0 when row_count(update t1 set c1=c1+1, c2=c2+1 where idx=1)=1)=4;
ERROR 23000: Number 1 When filter failed, ret=-5064, func 1: ROW_COUNT()=4
select c1,c2 from t1 when row_count(delete from t2 where idx=0 when row_count(update t1 set c1=c1+1, c2=c2+1 where idx=1)=4)=1;
ERROR 23000: Number 2 When filter failed, ret=-5064, func 1: ROW_COUNT()=4
select c1,c2 from t1 when row_count(delete from t2 where idx=0 when row_count(update t1 set c1=c1+1, c2=c2+1 where idx=1)=1)=4;
ERROR 23000: Number 1 When filter failed, ret=-5064, func 1: ROW_COUNT()=4
select * from t1;
idx	pk	c1	c2
0	0	0	0
0	1	0	0
0	2	0	0
0	3	0	0
1	4	0	0
1	5	0	0
1	6	0	0
1	7	0	0
idx	pk
0	0
0	1
0	2
0	3
1	4
1	5
1	6
1	7
select * from t2;
idx	pk	c1	c2
0	0	0	0
0	1	0	0
0	2	0	0
0	3	0	0
1	4	0	0
1	5	0	0
1	6	0	0
1	7	0	0
idx	pk	c1	c2
0	0	0	0
0	1	0	0
0	2	0	0
0	3	0	0
1	4	0	0
1	5	0	0
1	6	0	0
1	7	0	0
select c1,c2 from t1 when row_count(delete from t1 where idx=0 when row_count(update t1 set c1=c1+1, c2=c2+1 where idx=1)=4)=4;
c1	c2
1	1
1	1
1	1
1	1
select * from t1;
idx	pk	c1	c2
1	4	1	1
1	5	1	1
1	6	1	1
1	7	1	1
idx	pk
1	4
1	5
1	6
1	7
select idx, pk, c1,c2 from t1 when row_count(delete from t2 where idx=0 when row_count(update t1 set c1=c1+1, c2=c2+1 where idx=1)=4)=4;
idx	pk	c1	c2
1	4	2	2
1	5	2	2
1	6	2	2
1	7	2	2
select * from t1;
idx	pk	c1	c2
1	4	2	2
1	5	2	2
1	6	2	2
1	7	2	2
idx	pk
1	4
1	5
1	6
1	7
select * from t2;
idx	pk	c1	c2
1	4	0	0
1	5	0	0
1	6	0	0
1	7	0	0
idx	pk	c1	c2
1	4	0	0
1	5	0	0
1	6	0	0
1	7	0	0
select idx, pk, c1,c2 from t2 when row_count(delete from t2 where idx=1 when row_count(update t2 set c1=c1+1, c2=c2+1 where idx=1)=4)=4;
idx	pk	c1	c2
select * from t1;
idx	pk	c1	c2
1	4	2	2
1	5	2	2
1	6	2	2
1	7	2	2
idx	pk
1	4
1	5
1	6
1	7
select * from t2;
idx	pk	c1	c2
idx	pk	c1	c2
replace into t1(idx,pk,c1,c2) values(0,0,0,0),(0,1,0,0),(0,2,0,0),(0,3,0,0),(1,4,0,0),(1,5,0,0),(1,6,0,0),(1,7,0,0);
replace into t2(idx,pk,c1,c2) values(0,0,0,0),(0,1,0,0),(0,2,0,0),(0,3,0,0),(1,4,0,0),(1,5,0,0),(1,6,0,0),(1,7,0,0);
delete from t1 where idx=2 when row_count(replace into t1(idx,pk,c1,c2) values(2,8,0,0),(2,9,0,0))=0;
ERROR 23000: Number 1 When filter failed, ret=-5064, func 1: ROW_COUNT()=2
delete from t1 where idx=2 when row_count(insert into t1(idx,pk,c1,c2) values(2,8,0,0),(2,9,0,0))=0;
ERROR 23000: Number 1 When filter failed, ret=-5064, func 1: ROW_COUNT()=2
select * from t1;
idx	pk	c1	c2
0	0	0	0
0	1	0	0
0	2	0	0
0	3	0	0
1	4	0	0
1	5	0	0
1	6	0	0
1	7	0	0
idx	pk
0	0
0	1
0	2
0	3
1	4
1	5
1	6
1	7
delete from t1 where idx=2 when row_count(insert into t1(idx,pk,c1,c2) values(2,8,0,0),(2,9,0,0),(3,12,0,0))=3;
select * from t1;
idx	pk	c1	c2
0	0	0	0
0	1	0	0
0	2	0	0
0	3	0	0
1	4	0	0
1	5	0	0
1	6	0	0
1	7	0	0
2	8	0	0
2	9	0	0
3	12	0	0
idx	pk
0	0
0	1
0	2
0	3
1	4
1	5
1	6
1	7
2	8
2	9
3	12
delete from t1 where idx=2 when row_count(replace into t1(idx,pk,c1,c2) values(2,10,0,0),(2,11,0,0),(3,13,0,0))=3;
select * from t1;
idx	pk	c1	c2
0	0	0	0
0	1	0	0
0	2	0	0
0	3	0	0
1	4	0	0
1	5	0	0
1	6	0	0
1	7	0	0
2	10	0	0
2	11	0	0
3	12	0	0
3	13	0	0
idx	pk
0	0
0	1
0	2
0	3
1	4
1	5
1	6
1	7
2	10
2	11
3	12
3	13
delete from t1 where idx=0 when row_count(insert into t1(idx,pk,c1,c2) values(3,14,0,0))=0;
ERROR 23000: Number 1 When filter failed, ret=-5064, func 1: ROW_COUNT()=1
delete from t2 where idx=0 when row_count(insert into t1(idx,pk,c1,c2) values(3,15,0,0))=0;
ERROR 23000: Number 1 When filter failed, ret=-5064, func 1: ROW_COUNT()=1
select * from t1;
idx	pk	c1	c2
0	0	0	0
0	1	0	0
0	2	0	0
0	3	0	0
1	4	0	0
1	5	0	0
1	6	0	0
1	7	0	0
2	10	0	0
2	11	0	0
3	12	0	0
3	13	0	0
idx	pk
0	0
0	1
0	2
0	3
1	4
1	5
1	6
1	7
2	10
2	11
3	12
3	13
select * from t2;
idx	pk	c1	c2
0	0	0	0
0	1	0	0
0	2	0	0
0	3	0	0
1	4	0	0
1	5	0	0
1	6	0	0
1	7	0	0
idx	pk	c1	c2
0	0	0	0
0	1	0	0
0	2	0	0
0	3	0	0
1	4	0	0
1	5	0	0
1	6	0	0
1	7	0	0
delete from t1 where idx=0 when row_count(insert into t1(idx,pk,c1,c2) values(3,14,0,0))=1;
select * from t1;
idx	pk	c1	c2
1	4	0	0
1	5	0	0
1	6	0	0
1	7	0	0
2	10	0	0
2	11	0	0
3	12	0	0
3	13	0	0
3	14	0	0
idx	pk
1	4
1	5
1	6
1	7
2	10
2	11
3	12
3	13
3	14
delete from t2 where idx=0 when row_count(replace into t1(idx,pk,c1,c2) values(3,15,0,0))=1;
select * from t1;
idx	pk	c1	c2
1	4	0	0
1	5	0	0
1	6	0	0
1	7	0	0
2	10	0	0
2	11	0	0
3	12	0	0
3	13	0	0
3	14	0	0
3	15	0	0
idx	pk
1	4
1	5
1	6
1	7
2	10
2	11
3	12
3	13
3	14
3	15
delete from t2 where idx=0 when row_count(insert into t1(idx,pk,c1,c2) values(4,16,0,0))=1;
select * from t1;
idx	pk	c1	c2
1	4	0	0
1	5	0	0
1	6	0	0
1	7	0	0
2	10	0	0
2	11	0	0
3	12	0	0
3	13	0	0
3	14	0	0
3	15	0	0
4	16	0	0
idx	pk
1	4
1	5
1	6
1	7
2	10
2	11
3	12
3	13
3	14
3	15
4	16
select * from t2;
idx	pk	c1	c2
1	4	0	0
1	5	0	0
1	6	0	0
1	7	0	0
idx	pk	c1	c2
1	4	0	0
1	5	0	0
1	6	0	0
1	7	0	0
delete from t2 where idx=1 when row_count(replace into t1(idx,pk,c1,c2) values(4,17,0,0))=1;
select * from t1;
idx	pk	c1	c2
1	4	0	0
1	5	0	0
1	6	0	0
1	7	0	0
2	10	0	0
2	11	0	0
3	12	0	0
3	13	0	0
3	14	0	0
3	15	0	0
4	16	0	0
4	17	0	0
idx	pk
1	4
1	5
1	6
1	7
2	10
2	11
3	12
3	13
3	14
3	15
4	16
4	17
select * from t2;
idx	pk	c1	c2
idx	pk	c1	c2
delete from t1;
delete from t2;
replace into t1(idx,pk,c1,c2) values(0,0,0,0),(0,1,0,0),(0,2,0,0),(0,3,0,0),(1,4,0,0),(1,5,0,0),(1,6,0,0),(1,7,0,0);
replace into t2(idx,pk,c1,c2) values(0,0,0,0),(0,1,0,0),(0,2,0,0),(0,3,0,0),(1,4,0,0),(1,5,0,0),(1,6,0,0),(1,7,0,0);
delete from t1 where idx=1 when row_count(delete from t1 where idx=0)=1;
ERROR 23000: Number 1 When filter failed, ret=-5064, func 1: ROW_COUNT()=4
delete from t2 where idx=1 when row_count(delete from t1 where idx=0)=1;
ERROR 23000: Number 1 When filter failed, ret=-5064, func 1: ROW_COUNT()=4
select * from t1;
idx	pk	c1	c2
0	0	0	0
0	1	0	0
0	2	0	0
0	3	0	0
1	4	0	0
1	5	0	0
1	6	0	0
1	7	0	0
idx	pk
0	0
0	1
0	2
0	3
1	4
1	5
1	6
1	7
select * from t2;
idx	pk	c1	c2
0	0	0	0
0	1	0	0
0	2	0	0
0	3	0	0
1	4	0	0
1	5	0	0
1	6	0	0
1	7	0	0
idx	pk	c1	c2
0	0	0	0
0	1	0	0
0	2	0	0
0	3	0	0
1	4	0	0
1	5	0	0
1	6	0	0
1	7	0	0
delete from t1 where idx=0 when row_count(delete from t1 where idx=0)=4;
select * from t1;
idx	pk	c1	c2
1	4	0	0
1	5	0	0
1	6	0	0
1	7	0	0
idx	pk
1	4
1	5
1	6
1	7
delete from t1 where idx=1 when row_count(delete from t1 where idx=0)=0;
select * from t1;
idx	pk	c1	c2
idx	pk
delete from t2 where idx=1 when row_count(delete from t2 where idx=0)=4;
select * from t1;
idx	pk	c1	c2
idx	pk
select * from t2;
idx	pk	c1	c2
idx	pk	c1	c2
replace into t2(idx,pk,c1,c2) values(0,0,0,0),(0,1,0,0),(0,2,0,0),(0,3,0,0),(1,4,0,0),(1,5,0,0),(1,6,0,0),(1,7,0,0);
delete from t2 where idx=1 when row_count(delete from t1 where idx=0)=0;
select * from t1;
idx	pk	c1	c2
idx	pk
select * from t2;
idx	pk	c1	c2
0	0	0	0
0	1	0	0
0	2	0	0
0	3	0	0
idx	pk	c1	c2
0	0	0	0
0	1	0	0
0	2	0	0
0	3	0	0
replace into t1(idx,pk,c1,c2) values(0,0,0,0),(0,1,0,0),(0,2,0,0),(0,3,0,0),(1,4,0,0),(1,5,0,0),(1,6,0,0),(1,7,0,0);
replace into t2(idx,pk,c1,c2) values(0,0,0,0),(0,1,0,0),(0,2,0,0),(0,3,0,0),(1,4,0,0),(1,5,0,0),(1,6,0,0),(1,7,0,0);
delete from t1 where idx=1 when row_count(update t1 set c1=c1+1, c2=c2+1 where idx=0)=3;
ERROR 23000: Number 1 When filter failed, ret=-5064, func 1: ROW_COUNT()=4
delete from t2 where idx=1 when row_count(update t1 set c1=c1+1, c2=c2+1 where idx=0)=3;
ERROR 23000: Number 1 When filter failed, ret=-5064, func 1: ROW_COUNT()=4
select * from t1;
idx	pk	c1	c2
0	0	0	0
0	1	0	0
0	2	0	0
0	3	0	0
1	4	0	0
1	5	0	0
1	6	0	0
1	7	0	0
idx	pk
0	0
0	1
0	2
0	3
1	4
1	5
1	6
1	7
select * from t2;
idx	pk	c1	c2
0	0	0	0
0	1	0	0
0	2	0	0
0	3	0	0
1	4	0	0
1	5	0	0
1	6	0	0
1	7	0	0
idx	pk	c1	c2
0	0	0	0
0	1	0	0
0	2	0	0
0	3	0	0
1	4	0	0
1	5	0	0
1	6	0	0
1	7	0	0
delete from t1 where idx=1 when row_count(update t1 set c1=c1+1, c2=c2+1 where idx=0)=4;
select * from t1;
idx	pk	c1	c2
0	0	1	1
0	1	1	1
0	2	1	1
0	3	1	1
idx	pk
0	0
0	1
0	2
0	3
delete from t2 where idx=1 when row_count(update t1 set c1=c1+1, c2=c2+1 where idx=0)=4;
select * from t1;
idx	pk	c1	c2
0	0	2	2
0	1	2	2
0	2	2	2
0	3	2	2
idx	pk
0	0
0	1
0	2
0	3
select * from t2;
idx	pk	c1	c2
0	0	0	0
0	1	0	0
0	2	0	0
0	3	0	0
idx	pk	c1	c2
0	0	0	0
0	1	0	0
0	2	0	0
0	3	0	0
replace into t1(idx,pk,c1,c2) values(0,0,0,0),(0,1,0,0),(0,2,0,0),(0,3,0,0),(1,4,0,0),(1,5,0,0),(1,6,0,0),(1,7,0,0);
select sum(c1+c2), avg(c2), avg(idx+pk) from t1 where idx=0 when row_count(update t1 set c1=c1+1, c2=c2+1 where idx=0)=4;
ERROR 0A000: This select statement is not allowed by implement
select sum(c1), avg(c1+c2), sum(idx+pk) from t1 where idx=1 when row_count(update t1 set c1=c1+1, c2=c2+1 where pk>=0)=8;
ERROR 0A000: This select statement is not allowed by implement
select * from t1;
idx	pk	c1	c2
0	0	0	0
0	1	0	0
0	2	0	0
0	3	0	0
1	4	0	0
1	5	0	0
1	6	0	0
1	7	0	0
idx	pk
0	0
0	1
0	2
0	3
1	4
1	5
1	6
1	7
drop table t1,t2;
