create table t1(pk int, idx int, c1 int, c2 int, primary key(pk));
create table t2(pk int, idx int, c1 int, c2 int, primary key(pk));
create index i1 on t1(idx,c1);
create index i2 on t2(idx,c1);
insert into t1(idx,pk,c1,c2) values(0,0,0,0),(0,1,0,0),(0,2,0,0),(0,3,0,0),(1,4,0,0),(1,5,0,0),(1,6,0,0),(1,7,0,0);
insert into t2(idx,pk,c1,c2) values(0,0,0,0),(0,1,0,0),(0,2,0,0),(0,3,0,0),(1,4,0,0),(1,5,0,0),(1,6,0,0),(1,7,0,0);
alter system major freeze tenant = sys;
alter system major freeze tenant = all_user;
alter system major freeze tenant = all_meta;
select c1,c2 from t1 where idx=1 when row_count(update t1 set c1=c1+1, c2=c2+1 where idx=1)=1;
ERROR 23000: Number 1 When filter failed, ret=-5064, func 1: ROW_COUNT()=4
select * from t1;
pk	idx	c1	c2
0	0	0	0
1	0	0	0
2	0	0	0
3	0	0	0
4	1	0	0
5	1	0	0
6	1	0	0
7	1	0	0
pk	idx	c1
0	0	0
1	0	0
2	0	0
3	0	0
4	1	0
5	1	0
6	1	0
7	1	0
select * from t1 when row_count(update t1 set c1=c1+1, c2=c2+1 where idx=0)=4;
pk	idx	c1	c2
0	0	1	1
1	0	1	1
2	0	1	1
3	0	1	1
4	1	0	0
5	1	0	0
6	1	0	0
7	1	0	0
select c1,c2 from t1 where idx=1 when row_count(update t1 set c1=c1+1, c2=c2+1 where idx=1)=4;
c1	c2
1	1
1	1
1	1
1	1
select * from t1;
pk	idx	c1	c2
0	0	1	1
1	0	1	1
2	0	1	1
3	0	1	1
4	1	1	1
5	1	1	1
6	1	1	1
7	1	1	1
pk	idx	c1
0	0	1
1	0	1
2	0	1
3	0	1
4	1	1
5	1	1
6	1	1
7	1	1
replace into t1(idx,pk,c1,c2) values(0,0,0,0),(0,1,0,0),(0,2,0,0),(0,3,0,0),(1,4,0,0),(1,5,0,0),(1,6,0,0),(1,7,0,0);
select * from t1 where idx=1 when row_count(update t1 set c1=c1+1, c2=c2+1 where idx=1 when row_count(update t1 set c1=c1+1, c2=c2+1 where idx=1)=4)=4;
pk	idx	c1	c2
4	1	2	2
5	1	2	2
6	1	2	2
7	1	2	2
select c1,c2 from t1 where idx=0 when row_count(update t1 set c1=c1+1, c2=c2+1 where idx=0 when row_count(update t1 set c1=c1+1, c2=c2+1 where idx=0)=4)=4;
c1	c2
2	2
2	2
2	2
2	2
select * from t1;
pk	idx	c1	c2
0	0	2	2
1	0	2	2
2	0	2	2
3	0	2	2
4	1	2	2
5	1	2	2
6	1	2	2
7	1	2	2
pk	idx	c1
0	0	2
1	0	2
2	0	2
3	0	2
4	1	2
5	1	2
6	1	2
7	1	2
select * from t1 where idx=1 when row_count(update t1 set c1=c1+1, c2=c2+1 where idx=1 when row_count(update t1 set c1=c1+1, c2=c2+1 where idx=1)=3)=4;
ERROR 23000: Number 1 When filter failed, ret=-5064, func 1: ROW_COUNT()=4
select * from t1 where idx=1 when row_count(update t1 set c1=c1+1, c2=c2+1 where idx=1 when row_count(update t1 set c1=c1+1, c2=c2+1 where idx=1)=4)=3;
ERROR 23000: Number 2 When filter failed, ret=-5064, func 1: ROW_COUNT()=4
select * from t1;
pk	idx	c1	c2
0	0	2	2
1	0	2	2
2	0	2	2
3	0	2	2
4	1	2	2
5	1	2	2
6	1	2	2
7	1	2	2
pk	idx	c1
0	0	2
1	0	2
2	0	2
3	0	2
4	1	2
5	1	2
6	1	2
7	1	2
replace into t1(idx,pk,c1,c2) values(0,0,0,0),(0,1,0,0),(0,2,0,0),(0,3,0,0),(1,4,0,0),(1,5,0,0),(1,6,0,0),(1,7,0,0);
select * from t1 where idx=0 when row_count(update t2 set c1=c1+1, c2=c2+1 where idx=0 when row_count(update t1 set c1=c1+1, c2=c2+1 where idx=0)=4)=4;
pk	idx	c1	c2
0	0	1	1
1	0	1	1
2	0	1	1
3	0	1	1
select * from t1;
pk	idx	c1	c2
0	0	1	1
1	0	1	1
2	0	1	1
3	0	1	1
4	1	0	0
5	1	0	0
6	1	0	0
7	1	0	0
pk	idx	c1
0	0	1
1	0	1
2	0	1
3	0	1
4	1	0
5	1	0
6	1	0
7	1	0
pk	idx	c1	c2
0	0	1	1
1	0	1	1
2	0	1	1
3	0	1	1
4	1	0	0
5	1	0	0
6	1	0	0
7	1	0	0
pk	idx	c1
0	0	1
1	0	1
2	0	1
3	0	1
4	1	0
5	1	0
6	1	0
7	1	0
select c1,c2 from t2 where idx=1 when row_count(update t2 set c1=c1+1, c2=c2+1 where idx=1 when row_count(update t1 set c1=c1+1, c2=c2+1 where idx=1)=4)=4;
c1	c2
1	1
1	1
1	1
1	1
select * from t1;
pk	idx	c1	c2
0	0	1	1
1	0	1	1
2	0	1	1
3	0	1	1
4	1	1	1
5	1	1	1
6	1	1	1
7	1	1	1
pk	idx	c1
0	0	1
1	0	1
2	0	1
3	0	1
4	1	1
5	1	1
6	1	1
7	1	1
select * from t2;
pk	idx	c1	c2
0	0	1	1
1	0	1	1
2	0	1	1
3	0	1	1
4	1	1	1
5	1	1	1
6	1	1	1
7	1	1	1
pk	idx	c1
0	0	1
1	0	1
2	0	1
3	0	1
4	1	1
5	1	1
6	1	1
7	1	1
select * from t1 where idx=1 when row_count(update t2 set c1=c1+1, c2=c2+1 where idx=1 when row_count(update t1 set c1=c1+1, c2=c2+1 where idx=1)=4)=1;
ERROR 23000: Number 2 When filter failed, ret=-5064, func 1: ROW_COUNT()=4
select * from t1 where idx=1 when row_count(update t2 set c1=c1+1, c2=c2+1 where idx=1 when row_count(update t1 set c1=c1+1, c2=c2+1 where idx=1)=1)=4;
ERROR 23000: Number 1 When filter failed, ret=-5064, func 1: ROW_COUNT()=4
select * from t1;
pk	idx	c1	c2
0	0	1	1
1	0	1	1
2	0	1	1
3	0	1	1
4	1	1	1
5	1	1	1
6	1	1	1
7	1	1	1
pk	idx	c1
0	0	1
1	0	1
2	0	1
3	0	1
4	1	1
5	1	1
6	1	1
7	1	1
select * from t2;
pk	idx	c1	c2
0	0	1	1
1	0	1	1
2	0	1	1
3	0	1	1
4	1	1	1
5	1	1	1
6	1	1	1
7	1	1	1
pk	idx	c1
0	0	1
1	0	1
2	0	1
3	0	1
4	1	1
5	1	1
6	1	1
7	1	1
replace into t1(idx,pk,c1,c2) values(0,0,0,0),(0,1,0,0),(0,2,0,0),(0,3,0,0),(1,4,0,0),(1,5,0,0),(1,6,0,0),(1,7,0,0);
replace into t2(idx,pk,c1,c2) values(0,0,0,0),(0,1,0,0),(0,2,0,0),(0,3,0,0),(1,4,0,0),(1,5,0,0),(1,6,0,0),(1,7,0,0);
select c1, c2 from t1 when row_count(update t1 set c1=c1+1, c2=c2+1 where idx=1 when row_count(delete from t1 where idx=0)=4)=1;
ERROR 23000: Number 2 When filter failed, ret=-5064, func 1: ROW_COUNT()=4
select c1, c2 from t1 when row_count(update t1 set c1=c1+1, c2=c2+1 where idx=1 when row_count(delete from t1 where idx=0)=1)=4;
ERROR 23000: Number 1 When filter failed, ret=-5064, func 1: ROW_COUNT()=4
select c1, c2 from t1 when row_count(update t1 set c1=c1+1, c2=c2+1 where idx=1 when row_count(delete from t2 where idx=0)=4)=1;
ERROR 23000: Number 2 When filter failed, ret=-5064, func 1: ROW_COUNT()=4
select c1, c2 from t1 when row_count(update t1 set c1=c1+1, c2=c2+1 where idx=1 when row_count(delete from t2 where idx=0)=1)=4;
ERROR 23000: Number 1 When filter failed, ret=-5064, func 1: ROW_COUNT()=4
select * from t1;
pk	idx	c1	c2
0	0	0	0
1	0	0	0
2	0	0	0
3	0	0	0
4	1	0	0
5	1	0	0
6	1	0	0
7	1	0	0
pk	idx	c1
0	0	0
1	0	0
2	0	0
3	0	0
4	1	0
5	1	0
6	1	0
7	1	0
select * from t2;
pk	idx	c1	c2
0	0	0	0
1	0	0	0
2	0	0	0
3	0	0	0
4	1	0	0
5	1	0	0
6	1	0	0
7	1	0	0
pk	idx	c1
0	0	0
1	0	0
2	0	0
3	0	0
4	1	0
5	1	0
6	1	0
7	1	0
select c1, c2 from t1 where idx=0 when row_count(update t1 set c1=c1+1, c2=c2+1 where idx=0 when row_count(delete from t2 where idx=0)=4)=4;
c1	c2
1	1
1	1
1	1
1	1
select * from t1;
pk	idx	c1	c2
0	0	1	1
1	0	1	1
2	0	1	1
3	0	1	1
4	1	0	0
5	1	0	0
6	1	0	0
7	1	0	0
pk	idx	c1
0	0	1
1	0	1
2	0	1
3	0	1
4	1	0
5	1	0
6	1	0
7	1	0
select * from t2;
pk	idx	c1	c2
4	1	0	0
5	1	0	0
6	1	0	0
7	1	0	0
pk	idx	c1
4	1	0
5	1	0
6	1	0
7	1	0
select idx, pk, c1, c2 from t1 where idx=0 when row_count(update t1 set c1=c1+1, c2=c2+1 where idx=0 when row_count(delete from t2 where idx=1)=4)=4;
idx	pk	c1	c2
0	0	2	2
0	1	2	2
0	2	2	2
0	3	2	2
select * from t1;
pk	idx	c1	c2
0	0	2	2
1	0	2	2
2	0	2	2
3	0	2	2
4	1	0	0
5	1	0	0
6	1	0	0
7	1	0	0
pk	idx	c1
0	0	2
1	0	2
2	0	2
3	0	2
4	1	0
5	1	0
6	1	0
7	1	0
select * from t2;
pk	idx	c1	c2
pk	idx	c1
select * from t1 where idx=1 when row_count(update t1 set c1=c1+1, c2=c2+1 where idx=1 when row_count(delete from t1 where idx=0)=4)=4;
pk	idx	c1	c2
4	1	1	1
5	1	1	1
6	1	1	1
7	1	1	1
select * from t1;
pk	idx	c1	c2
4	1	1	1
5	1	1	1
6	1	1	1
7	1	1	1
pk	idx	c1
4	1	1
5	1	1
6	1	1
7	1	1
select * from t2;
pk	idx	c1	c2
pk	idx	c1
replace into t1(idx,pk,c1,c2) values(0,0,0,0),(0,1,0,0),(0,2,0,0),(0,3,0,0),(1,4,0,0),(1,5,0,0),(1,6,0,0),(1,7,0,0);
replace into t2(idx,pk,c1,c2) values(0,0,0,0),(0,1,0,0),(0,2,0,0),(0,3,0,0),(1,4,0,0),(1,5,0,0),(1,6,0,0),(1,7,0,0);
update t1 set c1=4, c2=4 where idx=2 when row_count(insert into t1(idx,pk,c1,c2) values(2,0,0,0),(2,1,0,0))=2;
ERROR 23000: Duplicate entry '0' for key 'PRIMARY'
update t1 set c1=3, c2=3 where idx=2 when row_count(insert into t1(idx,pk,c1,c2) values(2,2,0,0),(2,3,0,0))=2;
ERROR 23000: Duplicate entry '2' for key 'PRIMARY'
update t1 set c1=5, c2=5 where idx=3 when row_count(insert into t1(idx,pk,c1,c2) values(2,8,0,0),(2,9,0,0))=1;
ERROR 23000: Number 1 When filter failed, ret=-5064, func 1: ROW_COUNT()=2
select * from t1;
pk	idx	c1	c2
0	0	0	0
1	0	0	0
2	0	0	0
3	0	0	0
4	1	0	0
5	1	0	0
6	1	0	0
7	1	0	0
pk	idx	c1
0	0	0
1	0	0
2	0	0
3	0	0
4	1	0
5	1	0
6	1	0
7	1	0
update t1 set c1=2, c2=2 where idx=2 when row_count(insert into t1(idx,pk,c1,c2) values(2,8,0,0),(2,9,0,0))=2;
update t1 set c1=3, c2=3 where idx=2 when row_count(replace into t1(idx,pk,c1,c2) values(2,10,0,0),(2,11,0,0))=2;
select * from t1;
pk	idx	c1	c2
0	0	0	0
1	0	0	0
2	0	0	0
3	0	0	0
4	1	0	0
5	1	0	0
6	1	0	0
7	1	0	0
8	2	3	3
9	2	3	3
10	2	0	0
11	2	0	0
pk	idx	c1
0	0	0
1	0	0
2	0	0
3	0	0
4	1	0
5	1	0
6	1	0
7	1	0
10	2	0
11	2	0
8	2	3
9	2	3
update t1 set c1=6, c2=6 where idx=0 when row_count(insert into t1(idx,pk,c1,c2) values(3,12,0,0),(3,13,0,0))=1;
ERROR 23000: Number 1 When filter failed, ret=-5064, func 1: ROW_COUNT()=2
update t1 set c1=7, c2=7 where idx=1 when row_count(replace into t1(idx,pk,c1,c2) values(3,14,0,0),(3,15,0,0))=1;
ERROR 23000: Number 1 When filter failed, ret=-5064, func 1: ROW_COUNT()=2
update t1 set c1=8, c2=8 where idx=0 when row_count(insert into t2(idx,pk,c1,c2) values(2,8,0,0),(2,9,0,0))=1;
ERROR 23000: Number 1 When filter failed, ret=-5064, func 1: ROW_COUNT()=2
update t1 set c1=9, c2=9 where idx=1 when row_count(replace into t2(idx,pk,c1,c2) values(2,10,0,0),(2,11,0,0))=1;
ERROR 23000: Number 1 When filter failed, ret=-5064, func 1: ROW_COUNT()=2
select * from t1;
pk	idx	c1	c2
0	0	0	0
1	0	0	0
2	0	0	0
3	0	0	0
4	1	0	0
5	1	0	0
6	1	0	0
7	1	0	0
8	2	3	3
9	2	3	3
10	2	0	0
11	2	0	0
pk	idx	c1
0	0	0
1	0	0
2	0	0
3	0	0
4	1	0
5	1	0
6	1	0
7	1	0
10	2	0
11	2	0
8	2	3
9	2	3
select * from t2;
pk	idx	c1	c2
0	0	0	0
1	0	0	0
2	0	0	0
3	0	0	0
4	1	0	0
5	1	0	0
6	1	0	0
7	1	0	0
pk	idx	c1
0	0	0
1	0	0
2	0	0
3	0	0
4	1	0
5	1	0
6	1	0
7	1	0
update t1 set c1=6, c2=6 where idx=0 when row_count(insert into t1(idx,pk,c1,c2) values(3,12,0,0),(3,13,0,0))=2;
update t1 set c1=7, c2=7 where idx=1 when row_count(replace into t1(idx,pk,c1,c2) values(3,14,0,0),(3,15,0,0))=2;
select * from t1;
pk	idx	c1	c2
0	0	6	6
1	0	6	6
2	0	6	6
3	0	6	6
4	1	7	7
5	1	7	7
6	1	7	7
7	1	7	7
8	2	3	3
9	2	3	3
10	2	0	0
11	2	0	0
12	3	0	0
13	3	0	0
14	3	0	0
15	3	0	0
pk	idx	c1
0	0	6
1	0	6
2	0	6
3	0	6
4	1	7
5	1	7
6	1	7
7	1	7
10	2	0
11	2	0
8	2	3
9	2	3
12	3	0
13	3	0
14	3	0
15	3	0
update t1 set c1=8, c2=8 where idx=0 when row_count(insert into t2(idx,pk,c1,c2) values(2,8,0,0),(2,9,0,0))=2;
update t1 set c1=9, c2=9 where idx=1 when row_count(replace into t2(idx,pk,c1,c2) values(2,10,0,0),(2,11,0,0))=2;
select * from t1;
pk	idx	c1	c2
0	0	8	8
1	0	8	8
2	0	8	8
3	0	8	8
4	1	9	9
5	1	9	9
6	1	9	9
7	1	9	9
8	2	3	3
9	2	3	3
10	2	0	0
11	2	0	0
12	3	0	0
13	3	0	0
14	3	0	0
15	3	0	0
pk	idx	c1
0	0	8
1	0	8
2	0	8
3	0	8
4	1	9
5	1	9
6	1	9
7	1	9
10	2	0
11	2	0
8	2	3
9	2	3
12	3	0
13	3	0
14	3	0
15	3	0
select * from t2;
pk	idx	c1	c2
0	0	0	0
1	0	0	0
2	0	0	0
3	0	0	0
4	1	0	0
5	1	0	0
6	1	0	0
7	1	0	0
8	2	0	0
9	2	0	0
10	2	0	0
11	2	0	0
pk	idx	c1
0	0	0
1	0	0
2	0	0
3	0	0
4	1	0
5	1	0
6	1	0
7	1	0
8	2	0
9	2	0
10	2	0
11	2	0
delete from t1;
delete from t2;
replace into t1(idx,pk,c1,c2) values(0,0,0,0),(0,1,0,0),(0,2,0,0),(0,3,0,0),(1,4,0,0),(1,5,0,0),(1,6,0,0),(1,7,0,0);
replace into t2(idx,pk,c1,c2) values(0,0,0,0),(0,1,0,0),(0,2,0,0),(0,3,0,0),(1,4,0,0),(1,5,0,0),(1,6,0,0),(1,7,0,0);
update t1 set c1=c1+1, c2=c2+1 where idx=1 when row_count(update t1 set c1=c1+1, c2=c2+1 where idx=0)=4;
select * from t1;
pk	idx	c1	c2
0	0	1	1
1	0	1	1
2	0	1	1
3	0	1	1
4	1	1	1
5	1	1	1
6	1	1	1
7	1	1	1
pk	idx	c1
0	0	1
1	0	1
2	0	1
3	0	1
4	1	1
5	1	1
6	1	1
7	1	1
update t1 set c1=c1+1, c2=c2+1 where idx=0 when row_count(update t1 set c1=c1+1, c2=c2+1 where idx=0)=4;
select * from t1;
pk	idx	c1	c2
0	0	3	3
1	0	3	3
2	0	3	3
3	0	3	3
4	1	1	1
5	1	1	1
6	1	1	1
7	1	1	1
pk	idx	c1
0	0	3
1	0	3
2	0	3
3	0	3
4	1	1
5	1	1
6	1	1
7	1	1
update t1 set c1=c1+1, c2=c2+1 where idx=0 when row_count(update t1 set c1=c1+1, c2=c2+1 where idx=0)=0;
ERROR 23000: Number 1 When filter failed, ret=-5064, func 1: ROW_COUNT()=4
update t1 set c1=c1+1, c2=c2+1 where idx=1 when row_count(update t1 set c1=c1+1, c2=c2+1 where idx=0)=0;
ERROR 23000: Number 1 When filter failed, ret=-5064, func 1: ROW_COUNT()=4
select * from t1;
pk	idx	c1	c2
0	0	3	3
1	0	3	3
2	0	3	3
3	0	3	3
4	1	1	1
5	1	1	1
6	1	1	1
7	1	1	1
pk	idx	c1
0	0	3
1	0	3
2	0	3
3	0	3
4	1	1
5	1	1
6	1	1
7	1	1
replace into t1(idx,pk,c1,c2) values(0,0,0,0),(0,1,0,0),(0,2,0,0),(0,3,0,0),(1,4,0,0),(1,5,0,0),(1,6,0,0),(1,7,0,0);
replace into t2(idx,pk,c1,c2) values(0,0,0,0),(0,1,0,0),(0,2,0,0),(0,3,0,0),(1,4,0,0),(1,5,0,0),(1,6,0,0),(1,7,0,0);
update t1 set c1=c1+1, c2=c2+1 where idx=0 when row_count(delete from t1 where idx=1)=1;
ERROR 23000: Number 1 When filter failed, ret=-5064, func 1: ROW_COUNT()=4
update t1 set c1=c1+1, c2=c2+1 where idx=0 when row_count(delete from t2 where idx=1)=1;
ERROR 23000: Number 1 When filter failed, ret=-5064, func 1: ROW_COUNT()=4
select * from t1;
pk	idx	c1	c2
0	0	0	0
1	0	0	0
2	0	0	0
3	0	0	0
4	1	0	0
5	1	0	0
6	1	0	0
7	1	0	0
pk	idx	c1
0	0	0
1	0	0
2	0	0
3	0	0
4	1	0
5	1	0
6	1	0
7	1	0
select * from t2;
pk	idx	c1	c2
0	0	0	0
1	0	0	0
2	0	0	0
3	0	0	0
4	1	0	0
5	1	0	0
6	1	0	0
7	1	0	0
pk	idx	c1
0	0	0
1	0	0
2	0	0
3	0	0
4	1	0
5	1	0
6	1	0
7	1	0
update t1 set c1=c1+1, c2=c2+1 where idx=0 when row_count(delete from t1 where idx=1)=4;
select * from t1;
pk	idx	c1	c2
0	0	1	1
1	0	1	1
2	0	1	1
3	0	1	1
pk	idx	c1
0	0	1
1	0	1
2	0	1
3	0	1
update t1 set c1=c1+1, c2=c2+1 where idx=0 when row_count(delete from t2 where idx=1)=4;
select * from t1;
pk	idx	c1	c2
0	0	2	2
1	0	2	2
2	0	2	2
3	0	2	2
pk	idx	c1
0	0	2
1	0	2
2	0	2
3	0	2
select * from t2;
pk	idx	c1	c2
0	0	0	0
1	0	0	0
2	0	0	0
3	0	0	0
pk	idx	c1
0	0	0
1	0	0
2	0	0
3	0	0
update t1 set c1=c1+1, c2=c2+1 where idx=0 when row_count(delete from t1 where idx=0)=4;
select * from t1;
pk	idx	c1	c2
pk	idx	c1
delete from t1;
delete from t2;
replace into t1(idx,pk,c1,c2) values(0,0,0,0),(0,1,0,0),(0,2,0,0),(0,3,0,0),(1,4,0,0),(1,5,0,0),(1,6,0,0),(1,7,0,0);
replace into t2(idx,pk,c1,c2) values(0,0,0,0),(0,1,0,0),(0,2,0,0),(0,3,0,0),(1,4,0,0),(1,5,0,0),(1,6,0,0),(1,7,0,0);
select * from t1 when row_count(delete from t1 where idx=0)=0;
ERROR 23000: Number 1 When filter failed, ret=-5064, func 1: ROW_COUNT()=4
select * from t1;
pk	idx	c1	c2
0	0	0	0
1	0	0	0
2	0	0	0
3	0	0	0
4	1	0	0
5	1	0	0
6	1	0	0
7	1	0	0
pk	idx	c1
0	0	0
1	0	0
2	0	0
3	0	0
4	1	0
5	1	0
6	1	0
7	1	0
select * from t1 when row_count(delete from t1 where idx=0)=4;
pk	idx	c1	c2
4	1	0	0
5	1	0	0
6	1	0	0
7	1	0	0
select * from t1;
pk	idx	c1	c2
4	1	0	0
5	1	0	0
6	1	0	0
7	1	0	0
pk	idx	c1
4	1	0
5	1	0
6	1	0
7	1	0
select c1,c2 from t1 where idx=1 when row_count(delete from t1 where idx=1)=4;
c1	c2
select * from t1;
pk	idx	c1	c2
pk	idx	c1
select idx,pk, c1, c2 from t2 when row_count(delete from t2 where idx=0)=4;
idx	pk	c1	c2
1	4	0	0
1	5	0	0
1	6	0	0
1	7	0	0
select * from t2;
pk	idx	c1	c2
4	1	0	0
5	1	0	0
6	1	0	0
7	1	0	0
pk	idx	c1
4	1	0
5	1	0
6	1	0
7	1	0
select * from t2 where idx=1 when row_count(delete from t2 where idx=1)=4;
pk	idx	c1	c2
select * from t2;
pk	idx	c1	c2
pk	idx	c1
replace into t1(idx,pk,c1,c2) values(0,0,0,0),(0,1,0,0),(0,2,0,0),(0,3,0,0),(1,4,0,0),(1,5,0,0),(1,6,0,0),(1,7,0,0);
replace into t2(idx,pk,c1,c2) values(0,0,0,0),(0,1,0,0),(0,2,0,0),(0,3,0,0),(1,4,0,0),(1,5,0,0),(1,6,0,0),(1,7,0,0);
select * from t1 when row_count(delete from t1 where idx=1 when row_count(delete from t1 where idx=0)=1)=4;
ERROR 23000: Number 1 When filter failed, ret=-5064, func 1: ROW_COUNT()=4
select * from t2 when row_count(delete from t1 where idx=1 when row_count(delete from t1 where idx=0)=4)=1;
ERROR 23000: Number 2 When filter failed, ret=-5064, func 1: ROW_COUNT()=4
select * from t1;
pk	idx	c1	c2
0	0	0	0
1	0	0	0
2	0	0	0
3	0	0	0
4	1	0	0
5	1	0	0
6	1	0	0
7	1	0	0
pk	idx	c1
0	0	0
1	0	0
2	0	0
3	0	0
4	1	0
5	1	0
6	1	0
7	1	0
select idx,pk, c1, c2 from t2 when row_count(delete from t2 where idx=0)=4;
idx	pk	c1	c2
1	4	0	0
1	5	0	0
1	6	0	0
1	7	0	0
select * from t2;
pk	idx	c1	c2
4	1	0	0
5	1	0	0
6	1	0	0
7	1	0	0
pk	idx	c1
4	1	0
5	1	0
6	1	0
7	1	0
select * from t1 when row_count(delete from t1 where idx=1 when row_count(delete from t1 where idx=0)=4)=4;
pk	idx	c1	c2
select * from t1 when row_count(delete from t2 where idx=1 when row_count(delete from t1 where idx=1)=0)=4;
pk	idx	c1	c2
select * from t1;
pk	idx	c1	c2
pk	idx	c1
select idx,pk, c1, c2 from t2 when row_count(delete from t2 where idx=0)=0;
idx	pk	c1	c2
select * from t2;
pk	idx	c1	c2
pk	idx	c1
replace into t1(idx,pk,c1,c2) values(0,0,0,0),(0,1,0,0),(0,2,0,0),(0,3,0,0),(1,4,0,0),(1,5,0,0),(1,6,0,0),(1,7,0,0);
replace into t2(idx,pk,c1,c2) values(0,0,0,0),(0,1,0,0),(0,2,0,0),(0,3,0,0),(1,4,0,0),(1,5,0,0),(1,6,0,0),(1,7,0,0);
select c1, c2 from t1 where idx=0 when row_count(delete from t1 where idx=1 when row_count(delete from t2 where idx=0)=4)=4;
c1	c2
0	0
0	0
0	0
0	0
select * from t1;
pk	idx	c1	c2
0	0	0	0
1	0	0	0
2	0	0	0
3	0	0	0
pk	idx	c1
0	0	0
1	0	0
2	0	0
3	0	0
select idx,pk, c1, c2 from t2 when row_count(delete from t2 where idx=1)=4;
idx	pk	c1	c2
select c1, c2 from t1 where idx=0 when row_count(delete from t2 where idx=1 when row_count(delete from t2 where idx=0)=4)=0;
ERROR 23000: Number 1 When filter failed, ret=-5064, func 1: ROW_COUNT()=0
select * from t2;
pk	idx	c1	c2
pk	idx	c1
replace into t1(idx,pk,c1,c2) values(0,0,0,0),(0,1,0,0),(0,2,0,0),(0,3,0,0),(1,4,0,0),(1,5,0,0),(1,6,0,0),(1,7,0,0);
replace into t2(idx,pk,c1,c2) values(0,0,0,0),(0,1,0,0),(0,2,0,0),(0,3,0,0),(1,4,0,0),(1,5,0,0),(1,6,0,0),(1,7,0,0);
select c1,c2 from t1 when row_count(delete from t1 where idx=0 when row_count(update t1 set c1=c1+1, c2=c2+1 where idx=1)=4)=1;
ERROR 23000: Number 2 When filter failed, ret=-5064, func 1: ROW_COUNT()=4
select c1,c2 from t1 when row_count(delete from t1 where idx=0 when row_count(update t1 set c1=c1+1, c2=c2+1 where idx=1)=1)=4;
ERROR 23000: Number 1 When filter failed, ret=-5064, func 1: ROW_COUNT()=4
select c1,c2 from t1 when row_count(delete from t2 where idx=0 when row_count(update t1 set c1=c1+1, c2=c2+1 where idx=1)=4)=1;
ERROR 23000: Number 2 When filter failed, ret=-5064, func 1: ROW_COUNT()=4
select c1,c2 from t1 when row_count(delete from t2 where idx=0 when row_count(update t1 set c1=c1+1, c2=c2+1 where idx=1)=1)=4;
ERROR 23000: Number 1 When filter failed, ret=-5064, func 1: ROW_COUNT()=4
select * from t1;
pk	idx	c1	c2
0	0	0	0
1	0	0	0
2	0	0	0
3	0	0	0
4	1	0	0
5	1	0	0
6	1	0	0
7	1	0	0
pk	idx	c1
0	0	0
1	0	0
2	0	0
3	0	0
4	1	0
5	1	0
6	1	0
7	1	0
select * from t2;
pk	idx	c1	c2
0	0	0	0
1	0	0	0
2	0	0	0
3	0	0	0
4	1	0	0
5	1	0	0
6	1	0	0
7	1	0	0
pk	idx	c1
0	0	0
1	0	0
2	0	0
3	0	0
4	1	0
5	1	0
6	1	0
7	1	0
select c1,c2 from t1 when row_count(delete from t1 where idx=0 when row_count(update t1 set c1=c1+1, c2=c2+1 where idx=1)=4)=4;
c1	c2
1	1
1	1
1	1
1	1
select * from t1;
pk	idx	c1	c2
4	1	1	1
5	1	1	1
6	1	1	1
7	1	1	1
pk	idx	c1
4	1	1
5	1	1
6	1	1
7	1	1
select idx, pk, c1,c2 from t1 when row_count(delete from t2 where idx=0 when row_count(update t1 set c1=c1+1, c2=c2+1 where idx=1)=4)=4;
idx	pk	c1	c2
1	4	2	2
1	5	2	2
1	6	2	2
1	7	2	2
select * from t1;
pk	idx	c1	c2
4	1	2	2
5	1	2	2
6	1	2	2
7	1	2	2
pk	idx	c1
4	1	2
5	1	2
6	1	2
7	1	2
select * from t2;
pk	idx	c1	c2
4	1	0	0
5	1	0	0
6	1	0	0
7	1	0	0
pk	idx	c1
4	1	0
5	1	0
6	1	0
7	1	0
select idx, pk, c1,c2 from t2 when row_count(delete from t2 where idx=1 when row_count(update t2 set c1=c1+1, c2=c2+1 where idx=1)=4)=4;
idx	pk	c1	c2
select * from t1;
pk	idx	c1	c2
4	1	2	2
5	1	2	2
6	1	2	2
7	1	2	2
pk	idx	c1
4	1	2
5	1	2
6	1	2
7	1	2
select * from t2;
pk	idx	c1	c2
pk	idx	c1
replace into t1(idx,pk,c1,c2) values(0,0,0,0),(0,1,0,0),(0,2,0,0),(0,3,0,0),(1,4,0,0),(1,5,0,0),(1,6,0,0),(1,7,0,0);
replace into t2(idx,pk,c1,c2) values(0,0,0,0),(0,1,0,0),(0,2,0,0),(0,3,0,0),(1,4,0,0),(1,5,0,0),(1,6,0,0),(1,7,0,0);
delete from t1 where idx=2 when row_count(insert into t1(idx,pk,c1,c2) values(2,0,0,0))=0;
ERROR 23000: Duplicate entry '0' for key 'PRIMARY'
delete from t1 where idx=2 when row_count(insert into t2(idx,pk,c1,c2) values(2,8,0,0))=0;
ERROR 23000: Number 1 When filter failed, ret=-5064, func 1: ROW_COUNT()=1
select * from t1;
pk	idx	c1	c2
0	0	0	0
1	0	0	0
2	0	0	0
3	0	0	0
4	1	0	0
5	1	0	0
6	1	0	0
7	1	0	0
pk	idx	c1
0	0	0
1	0	0
2	0	0
3	0	0
4	1	0
5	1	0
6	1	0
7	1	0
delete from t1 where idx=2 when row_count(insert into t1(idx,pk,c1,c2) values(2,8,0,0),(2,9,0,0),(3,12,0,0))=3;
delete from t1 where idx=2 when row_count(replace into t1(idx,pk,c1,c2) values(2,10,0,0),(2,11,0,0),(3,13,0,0))=3;
select * from t1;
pk	idx	c1	c2
0	0	0	0
1	0	0	0
2	0	0	0
3	0	0	0
4	1	0	0
5	1	0	0
6	1	0	0
7	1	0	0
10	2	0	0
11	2	0	0
12	3	0	0
13	3	0	0
pk	idx	c1
0	0	0
1	0	0
2	0	0
3	0	0
4	1	0
5	1	0
6	1	0
7	1	0
10	2	0
11	2	0
12	3	0
13	3	0
delete from t1 where idx=0 when row_count(insert into t1(idx,pk,c1,c2) values(2,8,0,0))=0;
ERROR 23000: Number 1 When filter failed, ret=-5064, func 1: ROW_COUNT()=1
delete from t2 where idx=0 when row_count(insert into t1(idx,pk,c1,c2) values(2,9,0,0))=0;
ERROR 23000: Number 1 When filter failed, ret=-5064, func 1: ROW_COUNT()=1
select * from t1;
pk	idx	c1	c2
0	0	0	0
1	0	0	0
2	0	0	0
3	0	0	0
4	1	0	0
5	1	0	0
6	1	0	0
7	1	0	0
10	2	0	0
11	2	0	0
12	3	0	0
13	3	0	0
pk	idx	c1
0	0	0
1	0	0
2	0	0
3	0	0
4	1	0
5	1	0
6	1	0
7	1	0
10	2	0
11	2	0
12	3	0
13	3	0
select * from t2;
pk	idx	c1	c2
0	0	0	0
1	0	0	0
2	0	0	0
3	0	0	0
4	1	0	0
5	1	0	0
6	1	0	0
7	1	0	0
pk	idx	c1
0	0	0
1	0	0
2	0	0
3	0	0
4	1	0
5	1	0
6	1	0
7	1	0
delete from t1 where idx=0 when row_count(insert into t1(idx,pk,c1,c2) values(2,8,0,0))=1;
select * from t1;
pk	idx	c1	c2
4	1	0	0
5	1	0	0
6	1	0	0
7	1	0	0
8	2	0	0
10	2	0	0
11	2	0	0
12	3	0	0
13	3	0	0
pk	idx	c1
4	1	0
5	1	0
6	1	0
7	1	0
8	2	0
10	2	0
11	2	0
12	3	0
13	3	0
delete from t1 where idx=1 when row_count(insert into t1(idx,pk,c1,c2) values(2,9,0,0))=1;
select * from t1;
pk	idx	c1	c2
8	2	0	0
9	2	0	0
10	2	0	0
11	2	0	0
12	3	0	0
13	3	0	0
pk	idx	c1
8	2	0
9	2	0
10	2	0
11	2	0
12	3	0
13	3	0
delete from t2 where idx=0 when row_count(replace into t1(idx,pk,c1,c2) values(2,10,1,1))=1;
select * from t1;
pk	idx	c1	c2
8	2	0	0
9	2	0	0
10	2	1	1
11	2	0	0
12	3	0	0
13	3	0	0
pk	idx	c1
8	2	0
9	2	0
11	2	0
10	2	1
12	3	0
13	3	0
select * from t2;
pk	idx	c1	c2
4	1	0	0
5	1	0	0
6	1	0	0
7	1	0	0
pk	idx	c1
4	1	0
5	1	0
6	1	0
7	1	0
delete from t2 where idx=1 when row_count(replace into t1(idx,pk,c1,c2) values(2,11,1,1))=1;
select * from t1;
pk	idx	c1	c2
8	2	0	0
9	2	0	0
10	2	1	1
11	2	1	1
12	3	0	0
13	3	0	0
pk	idx	c1
8	2	0
9	2	0
10	2	1
11	2	1
12	3	0
13	3	0
select * from t2;
pk	idx	c1	c2
pk	idx	c1
delete from t1;
delete from t2;
replace into t1(idx,pk,c1,c2) values(0,0,0,0),(0,1,0,0),(0,2,0,0),(0,3,0,0),(1,4,0,0),(1,5,0,0),(1,6,0,0),(1,7,0,0);
replace into t2(idx,pk,c1,c2) values(0,0,0,0),(0,1,0,0),(0,2,0,0),(0,3,0,0),(1,4,0,0),(1,5,0,0),(1,6,0,0),(1,7,0,0);
delete from t1 where idx=1 when row_count(delete from t1 where idx=0)=1;
ERROR 23000: Number 1 When filter failed, ret=-5064, func 1: ROW_COUNT()=4
delete from t2 where idx=1 when row_count(delete from t1 where idx=0)=1;
ERROR 23000: Number 1 When filter failed, ret=-5064, func 1: ROW_COUNT()=4
select * from t1;
pk	idx	c1	c2
0	0	0	0
1	0	0	0
2	0	0	0
3	0	0	0
4	1	0	0
5	1	0	0
6	1	0	0
7	1	0	0
pk	idx	c1
0	0	0
1	0	0
2	0	0
3	0	0
4	1	0
5	1	0
6	1	0
7	1	0
select * from t2;
pk	idx	c1	c2
0	0	0	0
1	0	0	0
2	0	0	0
3	0	0	0
4	1	0	0
5	1	0	0
6	1	0	0
7	1	0	0
pk	idx	c1
0	0	0
1	0	0
2	0	0
3	0	0
4	1	0
5	1	0
6	1	0
7	1	0
delete from t1 where idx=0 when row_count(delete from t1 where idx=0)=4;
select * from t1;
pk	idx	c1	c2
4	1	0	0
5	1	0	0
6	1	0	0
7	1	0	0
pk	idx	c1
4	1	0
5	1	0
6	1	0
7	1	0
delete from t1 where idx=1 when row_count(delete from t1 where idx=0)=0;
select * from t1;
pk	idx	c1	c2
pk	idx	c1
delete from t2 where idx=1 when row_count(delete from t2 where idx=0)=4;
select * from t1;
pk	idx	c1	c2
pk	idx	c1
select * from t2;
pk	idx	c1	c2
pk	idx	c1
replace into t2(idx,pk,c1,c2) values(0,0,0,0),(0,1,0,0),(0,2,0,0),(0,3,0,0),(1,4,0,0),(1,5,0,0),(1,6,0,0),(1,7,0,0);
delete from t2 where idx=1 when row_count(delete from t1 where idx=0)=0;
select * from t1;
pk	idx	c1	c2
pk	idx	c1
select * from t2;
pk	idx	c1	c2
0	0	0	0
1	0	0	0
2	0	0	0
3	0	0	0
pk	idx	c1
0	0	0
1	0	0
2	0	0
3	0	0
replace into t1(idx,pk,c1,c2) values(0,0,0,0),(0,1,0,0),(0,2,0,0),(0,3,0,0),(1,4,0,0),(1,5,0,0),(1,6,0,0),(1,7,0,0);
replace into t2(idx,pk,c1,c2) values(0,0,0,0),(0,1,0,0),(0,2,0,0),(0,3,0,0),(1,4,0,0),(1,5,0,0),(1,6,0,0),(1,7,0,0);
delete from t1 where idx=1 when row_count(update t1 set c1=c1+1, c2=c2+1 where idx=0)=3;
ERROR 23000: Number 1 When filter failed, ret=-5064, func 1: ROW_COUNT()=4
delete from t2 where idx=1 when row_count(update t1 set c1=c1+1, c2=c2+1 where idx=0)=3;
ERROR 23000: Number 1 When filter failed, ret=-5064, func 1: ROW_COUNT()=4
select * from t1;
pk	idx	c1	c2
0	0	0	0
1	0	0	0
2	0	0	0
3	0	0	0
4	1	0	0
5	1	0	0
6	1	0	0
7	1	0	0
pk	idx	c1
0	0	0
1	0	0
2	0	0
3	0	0
4	1	0
5	1	0
6	1	0
7	1	0
select * from t2;
pk	idx	c1	c2
0	0	0	0
1	0	0	0
2	0	0	0
3	0	0	0
4	1	0	0
5	1	0	0
6	1	0	0
7	1	0	0
pk	idx	c1
0	0	0
1	0	0
2	0	0
3	0	0
4	1	0
5	1	0
6	1	0
7	1	0
delete from t1 where idx=1 when row_count(update t1 set c1=c1+1, c2=c2+1 where idx=0)=4;
select * from t1;
pk	idx	c1	c2
0	0	1	1
1	0	1	1
2	0	1	1
3	0	1	1
pk	idx	c1
0	0	1
1	0	1
2	0	1
3	0	1
delete from t2 where idx=1 when row_count(update t1 set c1=c1+1, c2=c2+1 where idx=0)=4;
select * from t1;
pk	idx	c1	c2
0	0	2	2
1	0	2	2
2	0	2	2
3	0	2	2
pk	idx	c1
0	0	2
1	0	2
2	0	2
3	0	2
select * from t2;
pk	idx	c1	c2
0	0	0	0
1	0	0	0
2	0	0	0
3	0	0	0
pk	idx	c1
0	0	0
1	0	0
2	0	0
3	0	0
drop table t1,t2;
