create table test(pk int primary key, c1 int);
create unique index i1 on test(c1);
insert into test(pk, c1) values(0,1),(1,2);
select * from test;
pk	c1
0	1
1	2
set autocommit=0;
update test set c1=3 where pk=0;
select * from test;
pk	c1
0	3
1	2
set autocommit=0;
set session ob_query_timeout=500000000;
update test set c1=3 where pk=1;
select * from test;
pk	c1
0	3
1	2
commit;
ERROR 23000: Duplicate entry '3' for key 'i1'
select * from test;
pk	c1
0	3
1	2
commit;
select * from test;
pk	c1
0	3
1	2
select /*+index(test i1)*/ * from test;
pk	c1
1	2
0	3
commit;
replace into test(pk, c1) values(0,1),(1,2);
commit;
set autocommit=0;
update test set c1=3 where pk=0;
select * from test;
pk	c1
0	3
1	2
set autocommit=0;
set session ob_query_timeout=500000000;
update test set c1=4 where pk=0;
commit;
select * from test;
pk	c1
0	4
1	2
commit;
select * from test;
pk	c1
0	4
1	2
select /*+index(test i1)*/ * from test;
pk	c1
1	2
0	4
commit;
delete from test;
replace into test(pk, c1) values(0,1),(1,2);
commit;
set autocommit=0;
update test set pk=3 where c1=1;
select * from test;
pk	c1
1	2
3	1
set autocommit=0;
set session ob_query_timeout=500000000;
update test set pk=3 where c1=2;
commit;
ERROR 23000: Duplicate entry '3' for key 'PRIMARY'
commit;
select * from test;
pk	c1
1	2
3	1
select /*+index(test i1)*/ * from test;
pk	c1
3	1
1	2
commit;
delete from test;
replace into test(pk, c1) values(0,1),(1,2);
commit;
set autocommit=0;
update test set pk=3 where c1=1;
select * from test;
pk	c1
1	2
3	1
set autocommit=0;
set session ob_query_timeout=500000000;
update test set pk=4 where c1=1;
commit;
commit;
select * from test;
pk	c1
1	2
4	1
select /*+index(test i1)*/ * from test;
pk	c1
4	1
1	2
commit;
