set @@recyclebin = off;
drop database if exists jx_db;
set the session variable
set @@recyclebin = on;
show session variables like 'recyclebin';
Variable_name	Value
recyclebin	ON
create database jx_db;
use jx_db;
create table t1(c1 int primary key, c2 int, c3 int, index idx1(c2), index idx2(c2, c3));
CREATE INDEX test_index on t1(c2, c3);
drop table t1;
select 1 from oceanbase.__all_virtual_recyclebin where object_name in (select concat("__recycle_$_", 1, "_", 1, "_", schema_version) from oceanbase.__all_virtual_ddl_operation where ddl_stmt_str != '' order by schema_version desc limit 1) order by gmt_create desc limit 1;
1
1
select a.table_name from oceanbase.__all_virtual_table a left join oceanbase.__all_virtual_ddl_operation b on a.table_id = b.table_id where b.ddl_stmt_str != '' order by b.schema_version desc limit 1;
table_name
t1
show index from t1;
Table	Non_unique	Key_name	Seq_in_index	Column_name	Collation	Cardinality	Sub_part	Packed	Null	Index_type	Comment	Index_comment	Visible
t1	0	PRIMARY	1	c1	A	NULL	NULL	NULL		BTREE	available		YES
t1	1	idx1	1	c2	A	NULL	NULL	NULL	YES	BTREE	available		YES
t1	1	idx2	1	c2	A	NULL	NULL	NULL	YES	BTREE	available		YES
t1	1	idx2	2	c3	A	NULL	NULL	NULL	YES	BTREE	available		YES
t1	1	test_index	1	c2	A	NULL	NULL	NULL	YES	BTREE	unavailable		YES
t1	1	test_index	2	c3	A	NULL	NULL	NULL	YES	BTREE	unavailable		YES
create table trun_t1(c1 int primary key, c2 int, c3 int, index(c2), index(c2, c3));
truncate table trun_t1;
select 1 from oceanbase.__all_virtual_recyclebin where object_name in (select concat("__recycle_$_", 1, "_", 1, "_", schema_version) from oceanbase.__all_virtual_ddl_operation where ddl_stmt_str != '' order by schema_version desc limit 1) order by gmt_create desc limit 1;
1
ERROR 42S01: Table 'trun_t1' already exists
select a.table_name from oceanbase.__all_virtual_table a left join oceanbase.__all_virtual_ddl_operation b on a.table_id = b.table_id where b.ddl_stmt_str != '' order by b.schema_version desc limit 1;
table_name
new_trun_t1
show index from trun_t1;
Table	Non_unique	Key_name	Seq_in_index	Column_name	Collation	Cardinality	Sub_part	Packed	Null	Index_type	Comment	Index_comment	Visible
trun_t1	0	PRIMARY	1	c1	A	NULL	NULL	NULL		BTREE	available		YES
trun_t1	1	c2	1	c2	A	NULL	NULL	NULL	YES	BTREE	available		YES
trun_t1	1	c2_2	1	c2	A	NULL	NULL	NULL	YES	BTREE	available		YES
trun_t1	1	c2_2	2	c3	A	NULL	NULL	NULL	YES	BTREE	available		YES
show index from new_trun_t1;
Table	Non_unique	Key_name	Seq_in_index	Column_name	Collation	Cardinality	Sub_part	Packed	Null	Index_type	Comment	Index_comment	Visible
new_trun_t1	0	PRIMARY	1	c1	A	NULL	NULL	NULL		BTREE	available		YES
new_trun_t1	1	c2	1	c2	A	NULL	NULL	NULL	YES	BTREE	available		YES
new_trun_t1	1	c2_2	1	c2	A	NULL	NULL	NULL	YES	BTREE	available		YES
new_trun_t1	1	c2_2	2	c3	A	NULL	NULL	NULL	YES	BTREE	available		YES
create table t2(c1 int primary key, c2 int, c3 int, index(c2), index(c2, c3));
create view v2 as select * from t2;
drop view v2;
select 1 from oceanbase.__all_virtual_recyclebin where object_name in (select concat("__recycle_$_", 1, "_", 1, "_", schema_version) from oceanbase.__all_virtual_ddl_operation where ddl_stmt_str != '' order by schema_version desc limit 1) order by gmt_create desc limit 1;
1
1
select a.table_name from oceanbase.__all_virtual_table a left join oceanbase.__all_virtual_ddl_operation b on a.table_id = b.table_id where b.ddl_stmt_str != '' order by b.schema_version desc limit 1;
table_name
v2
drop database jx_db;
select 1 from oceanbase.__all_virtual_recyclebin where object_name in (select concat("__recycle_$_", 1, "_", 1, "_", schema_version) from oceanbase.__all_virtual_ddl_operation where ddl_stmt_str != '' order by schema_version desc limit 1) order by gmt_create desc limit 1;
1
1
select a.database_name from oceanbase.__all_virtual_database a left join oceanbase.__all_virtual_ddl_operation b on a.database_id = b.database_id where b.ddl_stmt_str != '' order by b.schema_version desc limit 1;
database_name
jx_db
use jx_db;
show tables;
Tables_in_jx_db
new_trun_t1
t1
t2
trun_t1
v2
set @@recyclebin = on;
drop database jx_db;
create user if not exists __oceanbase_inner_drc_user;
grant all privileges on *.* to __oceanbase_inner_drc_user;
purge recyclebin;
delete from oceanbase.__all_ddl_id;
drop database if exists jx_drc;
create database jx_drc;
use jx_drc;
set @__oceanbase_ddl_id = '1_1_123456710';
create table t1(c1 int primary key, c2 int, c3 int, index idx1(c2), index idx2(c2, c3));
set @__oceanbase_ddl_id = '1_1_123456711';
CREATE INDEX test_index on t1(c2, c3);
set @__oceanbase_ddl_id = '1_1_123456716';
drop table t1;
select object_name from oceanbase.__all_virtual_recyclebin where object_name = '__recycle_$_1_1_123456716';
object_name
__recycle_$_1_1_123456716
__recycle_$_1_1_123456716
set @__oceanbase_ddl_id = '1_1_123456717';
flashback table __recycle_$_1_1_123456716 to before drop;
select a.table_name from oceanbase.__all_virtual_table a left join oceanbase.__all_virtual_ddl_operation b on a.table_id = b.table_id where b.ddl_stmt_str != '' order by b.schema_version desc limit 1;
table_name
t1
show index from t1;
Table	Non_unique	Key_name	Seq_in_index	Column_name	Collation	Cardinality	Sub_part	Packed	Null	Index_type	Comment	Index_comment	Visible
t1	0	PRIMARY	1	c1	A	NULL	NULL	NULL		BTREE	available		YES
t1	1	idx1	1	c2	A	NULL	NULL	NULL	YES	BTREE	available		YES
t1	1	idx2	1	c2	A	NULL	NULL	NULL	YES	BTREE	available		YES
t1	1	idx2	2	c3	A	NULL	NULL	NULL	YES	BTREE	available		YES
t1	1	test_index	1	c2	A	NULL	NULL	NULL	YES	BTREE	unavailable		YES
t1	1	test_index	2	c3	A	NULL	NULL	NULL	YES	BTREE	unavailable		YES
set @__oceanbase_ddl_id = '1_1_123456721';
create table trun_t1(c1 int primary key, c2 int, c3 int, index(c2), index(c2, c3));
set @__oceanbase_ddl_id = '1_1_123456722';
truncate table trun_t1;
select object_name from oceanbase.__all_virtual_recyclebin where object_name = '__recycle_$_1_1_123456722';
object_name
__recycle_$_1_1_123456722
__recycle_$_1_1_123456722
set @__oceanbase_ddl_id = '1_1_123456723';
flashback table __recycle_$_1_1_123456722 to before drop;
ERROR 42S01: Table 'trun_t1' already exists
set @__oceanbase_ddl_id = '1_1_123456724';
flashback table __recycle_$_1_1_123456722 to before drop rename to new_trun_t1;
select a.table_name from oceanbase.__all_virtual_table a left join oceanbase.__all_virtual_ddl_operation b on a.table_id = b.table_id where b.ddl_stmt_str != '' order by b.schema_version desc limit 1;
table_name
new_trun_t1
show index from trun_t1;
Table	Non_unique	Key_name	Seq_in_index	Column_name	Collation	Cardinality	Sub_part	Packed	Null	Index_type	Comment	Index_comment	Visible
trun_t1	0	PRIMARY	1	c1	A	NULL	NULL	NULL		BTREE	available		YES
trun_t1	1	c2	1	c2	A	NULL	NULL	NULL	YES	BTREE	available		YES
trun_t1	1	c2_2	1	c2	A	NULL	NULL	NULL	YES	BTREE	available		YES
trun_t1	1	c2_2	2	c3	A	NULL	NULL	NULL	YES	BTREE	available		YES
show index from new_trun_t1;
Table	Non_unique	Key_name	Seq_in_index	Column_name	Collation	Cardinality	Sub_part	Packed	Null	Index_type	Comment	Index_comment	Visible
new_trun_t1	0	PRIMARY	1	c1	A	NULL	NULL	NULL		BTREE	available		YES
new_trun_t1	1	c2	1	c2	A	NULL	NULL	NULL	YES	BTREE	available		YES
new_trun_t1	1	c2_2	1	c2	A	NULL	NULL	NULL	YES	BTREE	available		YES
new_trun_t1	1	c2_2	2	c3	A	NULL	NULL	NULL	YES	BTREE	available		YES
set @__oceanbase_ddl_id = '1_1_123456731';
create table t2(c1 int primary key, c2 int, c3 int, index(c2), index(c2, c3));
set @__oceanbase_ddl_id = '1_1_123456732';
create view v2 as select * from t2;
set @__oceanbase_ddl_id = '1_1_123456733';
drop view v2;
select object_name from oceanbase.__all_virtual_recyclebin where object_name = '__recycle_$_1_1_123456733';
object_name
__recycle_$_1_1_123456733
__recycle_$_1_1_123456733
set @__oceanbase_ddl_id = '1_1_123456734';
flashback table __recycle_$_1_1_123456733 to before drop;
select a.table_name from oceanbase.__all_virtual_table a left join oceanbase.__all_virtual_ddl_operation b on a.table_id = b.table_id where b.ddl_stmt_str != '' order by b.schema_version desc limit 1;
table_name
v2
set @__oceanbase_ddl_id = '1_1_123456741';
drop database jx_drc;
select object_name from oceanbase.__all_virtual_recyclebin where object_name = '__recycle_$_1_1_123456741';
object_name
__recycle_$_1_1_123456741
__recycle_$_1_1_123456741
set @__oceanbase_ddl_id = '1_1_123456742';
flashback database __recycle_$_1_1_123456741 to before drop;
select a.database_name from oceanbase.__all_virtual_database a left join oceanbase.__all_virtual_ddl_operation b on a.database_id = b.database_id where b.ddl_stmt_str != '' order by b.schema_version desc limit 1;
database_name
jx_drc
set @__oceanbase_ddl_id = '1_1_123456743';
use jx_drc;
show tables;
Tables_in_jx_drc
new_trun_t1
t1
t2
trun_t1
v2
set @@recyclebin = on;
set @__oceanbase_ddl_id = '1_1_123456744';
drop database jx_drc;
