set ob_trx_timeout = 10000000000;
set ob_query_timeout = 10000000000;
drop database IF EXISTS nxa;
create database nxa  character set utf8;
use nxa;
#建表
#create table like
drop table if exists t1;
Warnings:
Note	1051	Unknown table 'nxa.t1'
drop table if exists t2;
Warnings:
Note	1051	Unknown table 'nxa.t2'
CREATE TABLE  t2(
logindate DATE,
uid VARCHAR(225),
new_user INT,
PRIMARY KEY(logindate,uid)
);
CREATE TABLE   t1(c1 int primary key auto_increment,
c2 DATE unique,
c3 DATETIME default'2022-12-12 12:12:12',
c4 int not null default'1',
uid VARCHAR(225),
money FLOAT,index(c1,c2),unique(c3,c4),unique index (c3),
FOREIGN KEY(c2,uid) REFERENCES t2(logindate,uid)
);
drop table if exists t1s;
Warnings:
Note	1051	Unknown table 'nxa.t1s'
CREATE TABLE  t1s like t1;
ALTER TABLE t1s  rename column money to uid,rename column uid to money,rename column c1 to c3,rename column c3 to c1;
desc  t1s;
Field	Type	Null	Key	Default	Extra
c3	int(11)	NO	PRI	NULL	auto_increment
c2	date	YES	UNI	NULL	
c1	datetime	YES	UNI	2022-12-12 12:12:12	
c4	int(11)	NO		1	
money	varchar(225)	YES		NULL	
uid	float	YES		NULL	
drop table if exists t1a;
Warnings:
Note	1051	Unknown table 'nxa.t1a'
CREATE TABLE  t1a like t1s;
desc  t1a;
Field	Type	Null	Key	Default	Extra
c3	int(11)	NO	PRI	NULL	auto_increment
c2	date	YES	UNI	NULL	
c1	datetime	YES	UNI	2022-12-12 12:12:12	
c4	int(11)	NO		1	
money	varchar(225)	YES		NULL	
uid	float	YES		NULL	
#create table as select 
drop table if exists t1;
drop table if exists t2;
CREATE TABLE  t2(
logindate DATE,
uid VARCHAR(225),
new_user INT,
PRIMARY KEY(logindate,uid)
);
CREATE TABLE   t1(c1 int primary key auto_increment,
c2 DATE unique,
c3 DATETIME default'2022-12-12 12:12:12',
c4 int not null default'1',
uid VARCHAR(225),
money FLOAT,index(c1,c2),unique(c3,c4),unique index (c3),
FOREIGN KEY(c2,uid) REFERENCES t2(logindate,uid)
);
drop table if exists t1s;
CREATE TABLE  t1s as select c1,c2,c3,c4,uid,money from t1;
ALTER TABLE t1s  rename column money to uid,rename column uid to money,rename column c1 to c3,rename column c3 to c1;
desc  t1s;
Field	Type	Null	Key	Default	Extra
c3	int(11)	NO		NULL	
c2	date	YES		NULL	
c1	datetime	YES		2022-12-12 12:12:12	
c4	int(11)	NO		1	
money	varchar(225)	YES		NULL	
uid	float	YES		NULL	
drop table if exists t1a;
CREATE TABLE  t1a like t1s;
desc  t1a;
Field	Type	Null	Key	Default	Extra
c3	int(11)	NO		NULL	
c2	date	YES		NULL	
c1	datetime	YES		2022-12-12 12:12:12	
c4	int(11)	NO		1	
money	varchar(225)	YES		NULL	
uid	float	YES		NULL	
#视图(改名后查询视图均报错1356)
drop table if exists test;
Warnings:
Note	1051	Unknown table 'nxa.test'
CREATE TABLE test (ii int primary key,c1 blob);
insert into test values(2,5);
drop view  if exists  vv;
Warnings:
Note	1051	Unknown table 'nxa.vv'
create view vv as select ii id from test;
select * from vv;
id
2
alter table test rename column ii to id;
select * from vv;
ERROR 42S22: View 'nxa.vv' references invalid table(s) or column(s) or function(s) or definer/invoker of view lack rights to use them
#循环rename视图可以继续使用
drop table if exists test;
CREATE TABLE test (id int primary key,c1 blob);
insert into test values(2,5);
drop view  if exists vv;
create view vv as select id c1,c1 id from test;
select * from vv;
c1	id
2	5
alter table test rename column c1 to id,rename column id to c1;
select * from vv;
c1	id
5	2
#修改视图
alter view vv as select c1,id from test;
select * from vv;
c1	id
2	5
desc  vv;
Field	Type	Null	Key	Default	Extra
c1	int(11)	NO		NULL	
id	blob	YES		NULL	
#外键在rename时候，不支持change其他列,ob支持
drop table if exists child;
Warnings:
Note	1051	Unknown table 'nxa.child'
drop table if exists parent;
Warnings:
Note	1051	Unknown table 'nxa.parent'
CREATE TABLE parent (
id INT NOT NULL,
zz int,
PRIMARY KEY (id)
);
CREATE TABLE child (z0 int,
id INT,
parent_id INT,
INDEX par_ind (parent_id),
FOREIGN KEY (parent_id)
REFERENCES parent(id)
ON DELETE CASCADE
) ;
alter table child rename column id to parent_id,rename column parent_id to id,change z0 zz varchar(200);
desc  parent;
Field	Type	Null	Key	Default	Extra
id	int(11)	NO	PRI	NULL	
zz	int(11)	YES		NULL	
desc  child;
Field	Type	Null	Key	Default	Extra
zz	varchar(200)	YES		NULL	
parent_id	int(11)	YES		NULL	
id	int(11)	YES	MUL	NULL	
#表类型
#带分区的表
drop table if exists t1;
CREATE TABLE t1 (c1 INT PRIMARY KEY, c2 INT) PARTITION BY HASH(c1) PARTITIONS 8;
alter table t1 rename column c1 to c4__6_;
ERROR HY000: Column 'c1' has a partitioning function dependency and cannot be dropped or renamed.
#50993220- 【mysql_rename_column】rename分区列为原来相同的列名，ob成功，mysql禁止
drop table if exists t1;
CREATE TABLE t1 (c1 INT PRIMARY KEY, c2 INT) PARTITION BY HASH(c1) PARTITIONS 8;
alter table t1 rename column c1 to c1;
ERROR HY000: Column 'c1' has a partitioning function dependency and cannot be dropped or renamed.
desc  t1;
Field	Type	Null	Key	Default	Extra
c1	int(11)	NO	PRI	NULL	
c2	int(11)	YES		NULL	
drop table if exists t1;
CREATE TABLE t1(col1 date,col2 INT) 
PARTITION BY RANGE (year(col1))
(PARTITION p0 VALUES LESS THAN(100),
PARTITION p1 VALUES LESS THAN(200),
PARTITION p2 VALUES LESS THAN(300)
);
alter table t1 rename column col1 to col2,rename column col2 to col1;
ERROR HY000: Column 'col1' has a partitioning function dependency and cannot be dropped or renamed.
drop table if exists t1;
CREATE TABLE t1 (col1 INT,col2 DATE)
PARTITION BY LIST(col1)
(PARTITION p0 VALUES IN (100),
PARTITION p1 VALUES IN (200)
);
alter table t1 rename column col1 to col1,rename column col2 to col2;
ERROR HY000: Column 'col1' has a partitioning function dependency and cannot be dropped or renamed.
desc  t1;
Field	Type	Null	Key	Default	Extra
col1	int(11)	YES		NULL	
col2	date	YES		NULL	
#二级分区
drop table if exists t1;
CREATE TABLE t1 (c1 INT, c2 INT, c3 INT) PARTITION BY RANGE COLUMNS(c1) 
SUBPARTITION BY KEY(c2, c3) SUBPARTITIONS 5
(PARTITION p0 VALUES LESS THAN(0), PARTITION p1 VALUES LESS THAN(100));
alter table t1 rename column c2 to c3,rename column c3 to c2;
ERROR HY000: Column 'c2' has a partitioning function dependency and cannot be dropped or renamed.
#字符集gbk
drop table if exists t1;
CREATE TABLE t1 (c1 VARCHAR(10),
飞鸽 VARCHAR(10) CHARSET GBK COLLATE gbk_bin)
DEFAULT CHARSET utf8 COLLATE utf8_general_ci;
insert into t1 values('个人风格','认同感');
alter table t1 rename column 飞鸽 to 鸽;
desc  t1;
Field	Type	Null	Key	Default	Extra
c1	varchar(10)	YES		NULL	
鸽	varchar(10)	YES		NULL	
select * from t1;
c1	鸽
个人风格	认同感
#开启 Encoding 并使用 zstd 压缩，宏块保留空间为 5%
drop table if exists t1;
CREATE TABLE t1 (c1 INT, c2 INT, c3 VARCHAR(64))
COMPRESSION 'zstd_1.0'
      ROW_FORMAT DYNAMIC
PCTFREE 5;
alter table t1 rename column c2 to c1,rename column c1 to c3,rename column c3 to c2;
desc  t1;
Field	Type	Null	Key	Default	Extra
c3	int(11)	YES		NULL	
c1	int(11)	YES		NULL	
c2	varchar(64)	YES		NULL	
#创建表 t1，并设置并行度为 3 。
drop table if exists t1;
CREATE TABLE t1(c1 INT PRIMARY KEY, c2 INT) PARALLEL 3;
alter table t1 rename column c2 to c1,rename column c1 to c2;
desc  t1;
Field	Type	Null	Key	Default	Extra
c2	int(11)	NO	PRI	NULL	
c1	int(11)	YES		NULL	
#临时表
drop table if exists t1;
CREATE TABLE t1 (c1_a INT PRIMARY KEY, c2_b INT default null, c3_c INT,c5_e VARCHAR(312),c4_d int);
drop TEMPORARY table new_tl;
ERROR 42S02: Unknown table 'nxa.new_tl'
#1235 (0A000): MySQL compatible temporary table not supported
CREATE TEMPORARY TABLE new_tl SELECT * FROM t1 LIMIT 1;
ERROR 0A000: MySQL compatible temporary table not supported
#更改TABLEGROUP中的表
purge recyclebin;
drop table  myt1;
drop tableGROUP  myTableGroup1;
CREATE TABLEGROUP myTableGroup1;
CREATE TABLE myt1 (c1 int primary key, c2 varchar(200),c4 int ,unique index(c1,c2(20)) ) TABLEGROUP = myTableGroup1;
alter table myt1 add c3 int after c2,rename column c1 to c2,rename column c2 to c4,drop column c4;
ERROR 42S21: Duplicate column name 'c4'
desc  myt1;
Field	Type	Null	Key	Default	Extra
c1	int(11)	NO	PRI	NULL	
c2	varchar(200)	YES		NULL	
c4	int(11)	YES		NULL	
drop table  myt1;
drop tableGROUP  myTableGroup1;
#更改informtion_schema 库中表
#改其他库的表
drop database nxa1;
ERROR HY000: Can't drop database 'nxa1'; database doesn't exist
create database nxa1;
drop table if exists nxa1.t2;
Warnings:
Note	1051	Unknown table 'nxa1.t2'
CREATE TABLE nxa1.t2 (c1_a INT PRIMARY KEY, c2_b INT, c3_c INT,c5_e VARCHAR(312),c4_d int);
alter table nxa1.t2  rename column c1_a to c2_b,rename column c2_b to c3_c,
rename column c3_c to c1_a,rename COLUMN c5_e TO c5_E,rename COLUMN c4_D TO c4;
desc  nxa1.t2;
Field	Type	Null	Key	Default	Extra
c2_b	int(11)	NO	PRI	NULL	
c3_c	int(11)	YES		NULL	
c1_a	int(11)	YES		NULL	
c5_E	varchar(312)	YES		NULL	
c4	int(11)	YES		NULL	
drop database nxa1;
#事务
set autocommit = 0;
drop table if exists users;
Warnings:
Note	1051	Unknown table 'nxa.users'
CREATE TABLE `users`
 (
`ID` BIGINT(20) UNSIGNED NOT NULL AUTO_INCREMENT,
`user_name` VARCHAR(60),
`user_pass` VARCHAR(64),
PRIMARY KEY (`ID`)
);
drop table if exists test;
CREATE TABLE test (id int primary key,c1 varchar(20));
insert into test values(2,'zzz');
INSERT INTO users VALUES(null,'sheng','sheng123'),
(null,'yu','yu123'),
(null,'ling','ling123');
alter table test rename column c1 to id,rename column id to c1;
savepoint a2;
UPDATE users SET user_name=(select c1 from test);
SELECT * FROM users ;
ID	user_name	user_pass
1	2	sheng123
2	2	yu123
3	2	ling123
rollback to a2;
SELECT * FROM users ;
ID	user_name	user_pass
1	sheng	sheng123
2	yu	yu123
3	ling	ling123
UPDATE users SET user_name=(select c1 from test);
alter table test rename column c1 to id,rename column id to c1;
rollback;
SELECT * FROM users ;
ID	user_name	user_pass
1	2	sheng123
2	2	yu123
3	2	ling123
#ddl隐式提交
#均无法rollback
set autocommit = 0;
drop table if exists t1;
drop table if exists users;
CREATE TABLE `users`
 (
`ID` BIGINT(20) UNSIGNED NOT NULL AUTO_INCREMENT,
`user_name` VARCHAR(60),
`user_pass` VARCHAR(64),
PRIMARY KEY (`ID`)
);
drop table if exists test;
CREATE TABLE test (id int primary key,c1 varchar(20));
insert into test values(2,'zzz');
INSERT INTO users VALUES(null,'sheng','sheng123'),
(null,'yu','yu123'),
(null,'ling','ling123');
drop PROCEDURE pro_users//
ERROR 42000: PROCEDURE nxa.pro_users does not exist
CREATE PROCEDURE pro_users()
BEGIN
UPDATE users SET user_name=(select id from test);
alter table test rename column c1 to c4,rename column id to num;
rollback;
END //
call pro_users() //
desc  test;//
Field	Type	Null	Key	Default	Extra
num	int(11)	NO	PRI	NULL	
c4	varchar(20)	YES		NULL	
SELECT * FROM users //
ID	user_name	user_pass
1	2	sheng123
2	2	yu123
3	2	ling123
#PREPARE+EXECUTE
DEALLOCATE PREPARE stmt1;
DEALLOCATE PREPARE stmt2;
DEALLOCATE PREPARE stmt3;
SET @colname = lpad('hello',3,'ya') ;
SET @a = CONCAT('drop table if exists t1');
SET @b = CONCAT('CREATE TABLE t1 (c1_a INT PRIMARY KEY, c2_b INT, c3_c INT,c5_e VARCHAR(312),c4_d int)');
SET @s = CONCAT('alter table t1 rename column c1_a to ', @colname);
PREPARE stmt1 FROM @a;
PREPARE stmt2 FROM @b;
EXECUTE stmt1;
Warnings:
Note	1051	Unknown table 'nxa.t1'
EXECUTE stmt2;
PREPARE stmt3 FROM @s;
EXECUTE stmt3;
desc  t1;
Field	Type	Null	Key	Default	Extra
hel	int(11)	NO	PRI	NULL	
c2_b	int(11)	YES		NULL	
c3_c	int(11)	YES		NULL	
c5_e	varchar(312)	YES		NULL	
c4_d	int(11)	YES		NULL	
DEALLOCATE PREPARE stmt1;
DEALLOCATE PREPARE stmt2;
DEALLOCATE PREPARE stmt3;
SET @colname1 = 'c1_a' ;
SET @colname2 = 'c1_b' ;
SET @a = 'drop table if exists t1';
SET @b = 'CREATE TABLE t1 (c1_a INT PRIMARY KEY, c2_b INT, c3_c INT,c5_e VARCHAR(312),c4_d int)';
SET @s = CONCAT(CONCAT('alter table t1 rename column ',@colname1),CONCAT(' to ', @colname2));
PREPARE stmt1 FROM @a;
PREPARE stmt2 FROM @b;
EXECUTE stmt1;
EXECUTE stmt2;
PREPARE stmt3 FROM @s;
EXECUTE stmt3;
desc  t1;
Field	Type	Null	Key	Default	Extra
c1_b	int(11)	NO	PRI	NULL	
c2_b	int(11)	YES		NULL	
c3_c	int(11)	YES		NULL	
c5_e	varchar(312)	YES		NULL	
c4_d	int(11)	YES		NULL	
SET @colname1 = 'c1_a' ;
SET @colname2 = 'c1_b' ;
SET @a = 'drop table if exists t1';
SET @b = 'CREATE TABLE t1 (c1_a INT PRIMARY KEY, c2_b INT, c3_c INT,c5_e VARCHAR(312),c4_d int)';
SET @s = 'alter table t1 rename column c1_a to c2_b,rename column c2_b to c5_e,rename column c5_e to c1_a';
PREPARE stmt1 FROM @a;
PREPARE stmt2 FROM @b;
EXECUTE stmt1;
EXECUTE stmt2;
PREPARE stmt3 FROM @s;
EXECUTE stmt3;
desc  t1;
Field	Type	Null	Key	Default	Extra
c2_b	int(11)	NO	PRI	NULL	
c5_e	int(11)	YES		NULL	
c3_c	int(11)	YES		NULL	
c1_a	varchar(312)	YES		NULL	
c4_d	int(11)	YES		NULL	
#表锁
#目前ob表锁没生效
drop table if exists t1;
CREATE TABLE t1(c1 INT PRIMARY KEY auto_increment, c2 bigINT, c3 bigINT, c4 bigINT, INDEX k1(c2,c3));
lock table t1 read;
alter table t1 rename column c1 to col1;
UNLOCK TABLES;
alter table t1 rename column c2 to col2;
desc  t1;
Field	Type	Null	Key	Default	Extra
col1	int(11)	NO	PRI	NULL	auto_increment
col2	bigint(20)	YES	MUL	NULL	
c3	bigint(20)	YES		NULL	
c4	bigint(20)	YES		NULL	
drop table if exists t1;
CREATE TABLE t1(c1 INT PRIMARY KEY auto_increment, c2 bigINT, c3 bigINT, c4 bigINT, INDEX k1(c2,c3));
lock table t1 write;
alter table t1 rename column c1 to col1;
UNLOCK TABLES;
alter table t1 rename column c2 to col2;
desc  t1;
Field	Type	Null	Key	Default	Extra
col1	int(11)	NO	PRI	NULL	auto_increment
col2	bigint(20)	YES	MUL	NULL	
c3	bigint(20)	YES		NULL	
c4	bigint(20)	YES		NULL	
#dml
drop table if exists t1;
CREATE TABLE t1(c1 INT PRIMARY KEY auto_increment, c2 bigINT, c3 bigINT, c4 bigINT, INDEX k1(c2,c3));
INSERT INTO t1 (c2,c3,c4 )VALUES(  15245668215,2259478113654872164,202012121212);
INSERT INTO t1 (c2,c3,c4 )VALUES(  1524566,2259478113654872164,202012121212);
alter table t1 rename column c1 to a,rename column c2 to b,rename column c3 to c4,rename column c4 to c3;
select a, b,c3,c4 from t1;
a	b	c3	c4
1	15245668215	202012121212	2259478113654872164
2	1524566	202012121212	2259478113654872164
select a c1, b c2,c3 ,c4 from t1;
c1	c2	c3	c4
1	15245668215	202012121212	2259478113654872164
2	1524566	202012121212	2259478113654872164
select a from t1 where c4 = c3;
a
select a from t1 where c4 in (c3);
a
update t1 set c3 = c4/c3;
update t1 set c4 = b/a;
UPDATE t1 SET b = a + 1 WHERE b in(b) ORDER BY a aSC ;
select * from t1;
a	b	c4	c3
1	2	15245668215	11184864
2	3	762283	11184864
insert into t1(b,c3,c4) values(9,9,9);
insert into t1(b,c3,c4) select b,c3,c4 from t1;
INSERT INTO t1 (b,c3,c4) VALUES (10,2,3)ON DUPLICATE KEY UPDATE c4=c4+1;
select * from t1;
a	b	c4	c3
1	2	15245668215	11184864
2	3	762283	11184864
3	9	9	9
4	2	15245668215	11184864
5	3	762283	11184864
6	9	9	9
7	10	3	2
REPLACE INTO t1 ( a, b, c3, c4 )VALUES( '1', 1, 1, 1 ), ( '700', 2, 2, 2 );
SELECT * FROM t1 WHERE a in(1,700) ;
a	b	c4	c3
1	1	1	1
700	2	2	2
drop user nxa;
purge recyclebin;
