# create table for test
result_format: 4
drop table t1;
create table t1(c1 varchar(100) charset utf8mb4, c2 varchar(100) generated always as (c1)) CHARACTER SET = latin1;
insert into t1 (c1) values ('汉字');
ERROR HY000: Incorrect string value

drop table t2;
create table t2(uid int auto_increment,data varchar(10) character set gbk,primary key(uid))DEFAULT CHARACTER SET = latin1;
insert into t2 values (NULL,'沈阳');
insert into t2 values (NULL,'日本');
alter table t2 add user_name varchar(20) generated always as (data);
insert into t2 (uid,data) values (NULL,'沈阳产');
ERROR HY000: Incorrect string value
select * from t2;
+-----+--------+-----------+
| uid | data   | user_name |
+-----+--------+-----------+
|   1 | 沈阳   | ??        |
|   2 | 日本   | ??        |
+-----+--------+-----------+

drop table t3;
create table t3(c1 varchar(100) charset latin1, c2 varchar(100) charset utf8mb4);
insert into t3 values(NULL, '你');
update t3 set c1 = c2;
ERROR HY000: Incorrect string value
set sql_mode='';
update t3 set c1 = c2;
select * from t3;
+------+------+
| c1   | c2   |
+------+------+
| ?    | 你   |
+------+------+
