result_format: 4
set names gb18030;

select '中文字符' as '中文字符' from dual;
+----------+
| 中文字符 |
+----------+
| 中文字符 |
+----------+
select '中文字符' as 中文字符 from dual;
+----------+
| 中文字符 |
+----------+
| 中文字符 |
+----------+

drop table if exists t1;
create table t1(
sex varchar(10) comment '注释',
CONSTRAINT t1_cons CHECK(sex='男' or sex='女')
);
show create table t1;
Table	Create Table
t1	CREATE TABLE `t1` (
  `sex` varchar(10) DEFAULT NULL COMMENT '注释',
  CONSTRAINT `t1_cons` CHECK (((`sex` = '男') or (`sex` = '女')))
) ORGANIZATION INDEX DEFAULT CHARSET = utf8mb4 ROW_FORMAT = DYNAMIC COMPRESSION = 'zstd_1.3.8' REPLICA_NUM = 1 BLOCK_SIZE = 16384 USE_BLOOM_FILTER = FALSE ENABLE_MACRO_BLOCK_BLOOM_FILTER = FALSE TABLET_SIZE = 134217728 PCTFREE = 0
insert into t1 values ('女');
insert into t1 values ('男');
insert into t1 values (NULL);
select * from t1;
+------+
| sex  |
+------+
| 女   |
| 男   |
| NULL |
+------+
update t1 set sex = '男' where sex is null;
select * from t1;
+------+
| sex  |
+------+
| 女   |
| 男   |
| 男   |
+------+

drop table t1;

drop table if exists cast_test_table2;
set character_set_database = 'gb18030';
set character_set_server = 'gb18030';
show session variables like '%collation%';
Variable_name	Value
collation_connection	gb18030_chinese_ci
collation_database	gb18030_chinese_ci
collation_server	gb18030_chinese_ci
default_collation_for_utf8mb4	utf8mb4_general_ci
show variables like 'character%';
Variable_name	Value
character_sets_dir	
character_set_client	gb18030
character_set_connection	gb18030
character_set_database	gb18030
character_set_filesystem	binary
character_set_results	gb18030
character_set_server	gb18030
character_set_system	utf8mb4

create table cast_test_table2(name varchar(10));
show create table cast_test_table2;
Table	Create Table
cast_test_table2	CREATE TABLE `cast_test_table2` (
  `name` varchar(10) DEFAULT NULL
) ORGANIZATION INDEX DEFAULT CHARSET = utf8mb4 ROW_FORMAT = DYNAMIC COMPRESSION = 'zstd_1.3.8' REPLICA_NUM = 1 BLOCK_SIZE = 16384 USE_BLOOM_FILTER = FALSE ENABLE_MACRO_BLOCK_BLOOM_FILTER = FALSE TABLET_SIZE = 134217728 PCTFREE = 0
drop table cast_test_table2;

drop table if exists t4,t5;
CREATE TABLE t4(c1 VARCHAR(10) CHARACTER SET gb18030, c2 VARCHAR(10)CHARACTER SET gbk, c3 VARCHAR(10) as (concat(c1, c2)));
ERROR HY000: Illegal mix of collations (gb18030_chinese_ci,IMPLICIT), (gbk_chinese_ci,IMPLICIT)

CREATE TABLE t5(c1 VARCHAR(10) CHARACTER SET gb18030, c2 VARCHAR(10)CHARACTER SET gb18030_2022, c3 VARCHAR(10) as (concat(c1, c2)));
ERROR HY000: Illegal mix of collations (gb18030_chinese_ci,IMPLICIT), (gb18030_2022_chinese_ci,IMPLICIT)

set character_set_database = 'utf8mb4';
set character_set_server = 'utf8mb4';

