SET @old_character_set_client= @@character_set_client;
SET @old_character_set_connection= @@character_set_connection;
SET @old_character_set_results= @@character_set_results;
SET character_set_client= 'utf8mb3';
SET character_set_connection= 'utf8mb3';
SET character_set_results= 'utf8mb3';
drop table if exists t1;
select _euckr 'abcd';
abcd
abcd
CREATE TABLE t1 (
id INT AUTO_INCREMENT PRIMARY KEY,
text_column VARCHAR(255) CHARACTER SET euckr
);
INSERT INTO t1 (text_column) VALUES
('This is a plain string'),
('This is a string with special characters'),
(''),
('Another string with special characters');
INSERT INTO t1 (text_column) VALUES(0xA141F);
select length(text_column), char_length(text_column) from t1;
length(text_column)	char_length(text_column)
22	22
40	40
0	0
38	38
3	3
select substr(text_column, 2, 3) from t1;
substr(text_column, 2, 3)
his
his

not

drop table t1;
drop table if exists t1;
SET @test_character_set= 'euckr';
SET @test_collation= 'euckr_korean_ci';
SET @safe_character_set_server= @@character_set_server;
SET @safe_collation_server= @@collation_server;
SET @safe_character_set_client= @@character_set_client;
SET @safe_character_set_results= @@character_set_results;
SET character_set_server= @test_character_set;
SET collation_server= @test_collation;
CREATE DATABASE d1;
USE d1;
CREATE TABLE t1 (c CHAR(10), KEY(c));
SHOW FULL COLUMNS FROM t1;
Field	Type	Collation	Null	Key	Default	Extra	Privileges	Comment
c	char(10)	euckr_korean_ci	YES	MUL	NULL		SELECT,INSERT,UPDATE,REFERENCES	
INSERT INTO t1 VALUES ('aaa'),('aaaa'),('aaaaa');
SELECT c as want3results FROM t1 WHERE c LIKE 'aaa%';
want3results
aaa
aaaa
aaaaa
DROP TABLE t1;
CREATE TABLE t1 (c1 varchar(15), KEY c1 (c1(2)));
SHOW FULL COLUMNS FROM t1;
Field	Type	Collation	Null	Key	Default	Extra	Privileges	Comment
c1	varchar(15)	euckr_korean_ci	YES		NULL		SELECT,INSERT,UPDATE,REFERENCES	
INSERT INTO t1 VALUES ('location'),('loberge'),('lotre'),('boabab');
SELECT c1 as want3results from t1 where c1 like 'l%';
want3results
location
loberge
lotre
SELECT c1 as want3results from t1 where c1 like 'lo%';
want3results
location
loberge
lotre
SELECT c1 as want1result  from t1 where c1 like 'loc%';
want1result
location
SELECT c1 as want1result  from t1 where c1 like 'loca%';
want1result
location
SELECT c1 as want1result  from t1 where c1 like 'locat%';
want1result
location
SELECT c1 as want1result  from t1 where c1 like 'locati%';
want1result
location
SELECT c1 as want1result  from t1 where c1 like 'locatio%';
want1result
location
SELECT c1 as want1result  from t1 where c1 like 'location%';
want1result
location
DROP TABLE t1;
create table t1 (a set('a') not null);
insert ignore into t1 values (),();
Warnings:
Warning	1364	Field 'a' doesn't have a default value
Warning	1364	Field 'a' doesn't have a default value
select cast(a as char(1)) from t1;
cast(a as char(1))


select a sounds like a from t1;
a sounds like a
1
1
select 1 from t1 order by cast(a as char(1));
1
1
1
drop table t1;
set names utf8;
create table t1 (
name varchar(10),
level smallint unsigned);
insert into t1 values ('string',1);
select concat(name,space(level)), concat(name, repeat(' ',level)) from t1;
concat(name,space(level))	concat(name, repeat(' ',level))
string 	string 
drop table t1;
DROP DATABASE d1;
USE test;
SET character_set_server= @safe_character_set_server;
SET collation_server= @safe_collation_server;
SET character_set_client= @safe_character_set_client;
SET character_set_results= @safe_character_set_results;
SET NAMES euckr;
SET collation_connection='euckr_korean_ci';
create table t1 select repeat('a',4000) a;
delete from t1;
insert into t1 values ('a'), ('a '), ('a\t');
select collation(a),hex(a) from t1 order by a;
collation(a)	hex(a)
euckr_korean_ci	6109
euckr_korean_ci	61
euckr_korean_ci	6120
drop table t1;
create table t1 engine=innodb select repeat('a',50) as c1;
alter table t1 add index(c1(5));
insert into t1 values ('abcdefg'),('abcde100'),('abcde110'),('abcde111');
select collation(c1) from t1 limit 1;
collation(c1)
euckr_korean_ci
select c1 from t1 where c1 like 'abcdef%' order by c1;
c1
abcdefg
select c1 from t1 where c1 like 'abcde1%' order by c1;
c1
abcde100
abcde110
abcde111
select c1 from t1 where c1 like 'abcde11%' order by c1;
c1
abcde110
abcde111
select c1 from t1 where c1 like 'abcde111%' order by c1;
c1
abcde111
drop table t1;
select @@collation_connection;
@@collation_connection
euckr_korean_ci
create table t1 ROW_FORMAT=DYNAMIC select repeat('a',50) as c1 ;
insert into t1 values('abcdef');
insert into t1 values('_bcdef');
insert into t1 values('a_cdef');
insert into t1 values('ab_def');
insert into t1 values('abc_ef');
insert into t1 values('abcd_f');
insert into t1 values('abcde_');
select c1 as c1u from t1 where c1 like 'ab\_def';
c1u
ab_def
select c1 as c2h from t1 where c1 like 'ab#_def' escape '#';
c2h
ab_def
drop table t1;
SET collation_connection='euckr_bin';
create table t1 select repeat('a',4000) a;
delete from t1;
insert into t1 values ('a'), ('a '), ('a\t');
select collation(a),hex(a) from t1 order by a;
collation(a)	hex(a)
euckr_bin	6109
euckr_bin	61
euckr_bin	6120
drop table t1;
create table t1 engine=innodb select repeat('a',50) as c1;
alter table t1 add index(c1(5));
insert into t1 values ('abcdefg'),('abcde100'),('abcde110'),('abcde111');
select collation(c1) from t1 limit 1;
collation(c1)
euckr_bin
select c1 from t1 where c1 like 'abcdef%' order by c1;
c1
abcdefg
select c1 from t1 where c1 like 'abcde1%' order by c1;
c1
abcde100
abcde110
abcde111
select c1 from t1 where c1 like 'abcde11%' order by c1;
c1
abcde110
abcde111
select c1 from t1 where c1 like 'abcde111%' order by c1;
c1
abcde111
drop table t1;
select @@collation_connection;
@@collation_connection
euckr_bin
create table t1 ROW_FORMAT=DYNAMIC select repeat('a',50) as c1 ;
insert into t1 values('abcdef');
insert into t1 values('_bcdef');
insert into t1 values('a_cdef');
insert into t1 values('ab_def');
insert into t1 values('abc_ef');
insert into t1 values('abcd_f');
insert into t1 values('abcde_');
select c1 as c1u from t1 where c1 like 'ab\_def';
c1u
ab_def
select c1 as c2h from t1 where c1 like 'ab#_def' escape '#';
c2h
ab_def
drop table t1;
SET NAMES euckr;
CREATE TABLE t1 (a text) character set euckr;
INSERT INTO t1 VALUES (0xA2E6),(0xFEF7);
SELECT hex(a) FROM t1 ORDER BY a;
hex(a)
A2E6
FEF7
DROP TABLE t1;
create table t1 (s1 varchar(5) character set euckr);
insert into t1 values (0xA141);
insert into t1 values (0xA15A);
insert into t1 values (0xA161);
insert into t1 values (0xA17A);
insert into t1 values (0xA181);
insert into t1 values (0xA1FE);
insert into t1 values (0xA140);
ERROR HY000: Incorrect string value
insert into t1 values (0xA15B);
ERROR HY000: Incorrect string value
insert into t1 values (0xA160);
ERROR HY000: Incorrect string value
insert into t1 values (0xA17B);
ERROR HY000: Incorrect string value
insert into t1 values (0xA180);
ERROR HY000: Incorrect string value
insert into t1 values (0xA1FF);
ERROR HY000: Incorrect string value
select hex(s1), hex(convert(s1 using utf8mb3)) from t1 order by binary s1;
hex(s1)	hex(convert(s1 using utf8mb3))
A141	ECA2A5
A15A	ECA381
A161	ECA382
A17A	ECA3A5
A181	ECA3A6
A1FE	EFBFA2
drop table t1;
SET NAMES utf8mb3;
CREATE TABLE t1 (a varchar(10) character set euckr);
INSERT INTO t1 VALUES (0xA2E6), (0xA2E7);
SELECT hex(a), hex(@utf8mb3:=convert(a using utf8mb3)), hex(convert(@utf8mb3 using euckr)) FROM t1;
hex(a)	hex(@utf8mb3:=convert(a using utf8mb3))	hex(convert(@utf8mb3 using euckr))
A2E6	E282AC	NULL
A2E7	C2AE	C2AE
Warnings:
Warning	1300	Invalid euckr character string: 'AC'
SELECT hex(a), hex(@utf8mb3:=convert(a using utf8mb3)), hex(convert(@utf8mb3 using euckr)) FROM t1;
hex(a)	hex(@utf8mb3:=convert(a using utf8mb3))	hex(convert(@utf8mb3 using euckr))
A2E6	E282AC	A2E6
A2E7	C2AE	A2E7
DROP TABLE t1;
#
# WL#3332 Korean Enhancements
# euckr valid codes are now [81..FE][41..5A,61..7A,81..FE]
#
CREATE TABLE t1 (a binary(1), key(a));
DROP table if exists t2;
Warnings:
Note	1051	Unknown table 'test.t2'
CREATE TABLE t2 (s VARCHAR(4), a VARCHAR(1) CHARACTER SET euckr);
INSERT INTO t2
SELECT hex(concat(t11.a, t12.a)), concat(t11.a, t12.a)
FROM t1 t11, t1 t12
WHERE t11.a >= 0x81 AND t11.a <= 0xFE
AND   t12.a >= 0x41 AND t12.a <= 0xFE
ORDER BY t11.a, t12.a;
ERROR HY000: Incorrect string value
SELECT s as bad_code FROM t2 WHERE a='' ORDER BY s;
bad_code
DELETE FROM t2 WHERE a='';
ALTER TABLE t2 ADD u VARCHAR(1) CHARACTER SET utf8mb3, ADD a2 VARCHAR(1) CHARACTER SET euckr;
UPDATE t2 SET u=a, a2=u;
SELECT s as unassigned_code FROM t2 WHERE u='?';
unassigned_code
DELETE FROM t2 WHERE u='?';
SELECT count(*) as roundtrip_problem_chars FROM t2 WHERE hex(a) <> hex(a2);
roundtrip_problem_chars
0
SELECT s, hex(a), hex(u), hex(a2) FROM t2 ORDER BY s;
s	hex(a)	hex(u)	hex(a2)
DROP TABLE t1, t2;
SET sql_mode = default;
End of 5.4 tests
SET sql_mode = 'NO_ENGINE_SUBSTITUTION';
SET NAMES utf8mb3;
SET collation_connection=euckr_korean_ci;
CREATE TABLE t1 (b VARCHAR(2));
INSERT INTO t1 VALUES ('0'),('1'),('2'),('3'),('4'),('5'),('6'),('7');
INSERT INTO t1 VALUES ('8'),('9'),('A'),('B'),('C'),('D'),('E'),('F');
DROP table if exists head, tail;
Warnings:
Note	1051	Unknown table 'test.head'
Note	1051	Unknown table 'test.tail'
CREATE TABLE head AS SELECT CONCAT(b1.b, b2.b) AS head FROM t1 b1, t1 b2;
CREATE TABLE tail AS SELECT CONCAT(b1.b, b2.b) AS tail FROM t1 b1, t1 b2;
DROP TABLE t1;
CREATE TABLE t1 AS
SELECT concat(head, tail) AS code, ' ' AS a
FROM head, tail
WHERE (head BETWEEN '80' AND 'FF') AND (tail BETWEEN '20' AND 'FF')
ORDER BY head, tail;
DROP TABLE head, tail;
SHOW CREATE TABLE t1;
Table	Create Table
t1	CREATE TABLE `t1` (
  `code` varchar(8) DEFAULT NULL,
  `a` varchar(1) CHARACTER SET euckr NOT NULL DEFAULT ''
) ORGANIZATION INDEX DEFAULT CHARSET = utf8mb4 ROW_FORMAT = DYNAMIC COMPRESSION = 'zstd_1.3.8' REPLICA_NUM = 1 BLOCK_SIZE = 16384 USE_BLOOM_FILTER = FALSE ENABLE_MACRO_BLOCK_BLOOM_FILTER = FALSE TABLET_SIZE = 134217728 PCTFREE = 0
SELECT COUNT(*) FROM t1 WHERE a<>'';
COUNT(*)
0
SELECT code, hex(upper(a)), hex(lower(a)),a, upper(a), lower(a) FROM t1 WHERE hex(a)<>hex(upper(a)) OR hex(a)<>hex(lower(a));
code	hex(upper(a))	hex(lower(a))	a	upper(a)	lower(a)
SELECT * FROM t1
WHERE HEX(CAST(LOWER(a) AS CHAR CHARACTER SET utf8mb3)) <>
HEX(LOWER(CAST(a AS CHAR CHARACTER SET utf8mb3))) ORDER BY code;
code	a
SELECT * FROM t1
WHERE HEX(CAST(UPPER(a) AS CHAR CHARACTER SET utf8mb3)) <>
HEX(UPPER(CAST(a AS CHAR CHARACTER SET utf8mb3))) ORDER BY code;
code	a
DROP TABLE t1;
SET sql_mode = default;
drop table if exists `table1`;
drop table if exists `table2`;
drop table if exists `table3`;
CREATE TABLE `table1` (`col` char(100), INDEX(`col`)) DEFAULT CHARSET = euckr engine = innodb;
CREATE TABLE `table2` (`col` char(100), INDEX(`col`)) DEFAULT CHARSET = euckr engine = myisam;
CREATE TABLE `table3` (`col` char(100), INDEX(`col`)) DEFAULT CHARSET = euckr engine = MEMORY;
LOAD DATA INFILE 'data_for_mysqltest_direct_loaddata/general.dat' INTO TABLE `table1` CHARACTER SET euckr;
LOAD DATA INFILE 'data_for_mysqltest_direct_loaddata/general.dat' INTO TABLE `table2` CHARACTER SET euckr;
LOAD DATA INFILE 'data_for_mysqltest_direct_loaddata/general.dat' INTO TABLE `table3` CHARACTER SET euckr;
select * from `table1`;
col
 !"#$%&'()*+,-./
0123456789:;<=>?
@ABCDEFGHIJKLMNO
PQRSTUVWXYZ[\]^_
abcdefghijklmno
pqrstuvwxyz{|}~
select * from `table2`;
col
 !"#$%&'()*+,-./
0123456789:;<=>?
@ABCDEFGHIJKLMNO
PQRSTUVWXYZ[\]^_
abcdefghijklmno
pqrstuvwxyz{|}~
select * from `table3`;
col
 !"#$%&'()*+,-./
0123456789:;<=>?
@ABCDEFGHIJKLMNO
PQRSTUVWXYZ[\]^_
abcdefghijklmno
pqrstuvwxyz{|}~
drop table `table1`;
drop table `table2`;
drop table `table3`;
select _euckr 'abcd_ｶ' collate euckr_bin;
_euckr 'abcd_節' collate euckr_bin
abcd_節
Warnings:
Warning	1300	Invalid euckr character string: 'B6'
select _euckr 'abcd_ｶ' collate euckr_korean_ci;
_euckr 'abcd_節' collate euckr_korean_ci
abcd_節
Warnings:
Warning	1300	Invalid euckr character string: 'B6'
drop table if exists t1, t2;
set names utf8mb4;
CREATE TABLE t1 (
s1 CHAR(5) CHARACTER SET euckr
);
INSERT INTO t1 VALUES
('ㅏ'), ('ㅑ'), ('ㅓ'), ('ㅕ'), ('ㅗ'), ('ㅛ'), ('ㅜ'), ('ㅠ'), ('ㅡ'), ('ㅣ'),
('ㅐ'), ('ㅒ'), ('ㅔ'), ('ㅖ'), ('ㅚ'), ('ㅟ'), ('ㅢ'),
('ㄱ'), ('ㄲ'), ('ㄳ'), ('ㄴ'), ('ㄷ'), ('ㄸ'), ('ㄹ'), ('ㅁ'), ('ㅂ'), ('ㅃ'), ('ㅅ'), ('ㅆ'), ('ㅇ'), ('ㅈ'), ('ㅉ'), ('ㅊ'), ('ㅋ'), ('ㅌ'), ('ㅍ'), ('ㅎ');
INSERT INTO t1 VALUES
('가'), ('각'), ('간'), ('갑'), ('가스'), ('가시'), ('가장'), ('가주'), ('가중'), ('가치');
SELECT DISTINCT s1 FROM t1;
s1
ㅏ
ㅑ
ㅓ
ㅕ
ㅗ
ㅛ
ㅜ
ㅠ
ㅡ
ㅣ
ㅐ
ㅒ
ㅔ
ㅖ
ㅚ
ㅟ
ㅢ
ㄱ
ㄲ
ㄳ
ㄴ
ㄷ
ㄸ
ㄹ
ㅁ
ㅂ
ㅃ
ㅅ
ㅆ
ㅇ
ㅈ
ㅉ
ㅊ
ㅋ
ㅌ
ㅍ
ㅎ
가
각
간
갑
가스
가시
가장
가주
가중
가치
SELECT s1,COUNT(*) FROM t1 GROUP BY s1;
s1	COUNT(*)
ㅏ	1
ㅑ	1
ㅓ	1
ㅕ	1
ㅗ	1
ㅛ	1
ㅜ	1
ㅠ	1
ㅡ	1
ㅣ	1
ㅐ	1
ㅒ	1
ㅔ	1
ㅖ	1
ㅚ	1
ㅟ	1
ㅢ	1
ㄱ	1
ㄲ	1
ㄳ	1
ㄴ	1
ㄷ	1
ㄸ	1
ㄹ	1
ㅁ	1
ㅂ	1
ㅃ	1
ㅅ	1
ㅆ	1
ㅇ	1
ㅈ	1
ㅉ	1
ㅊ	1
ㅋ	1
ㅌ	1
ㅍ	1
ㅎ	1
가	1
각	1
간	1
갑	1
가스	1
가시	1
가장	1
가주	1
가중	1
가치	1
SELECT COUNT(DISTINCT s1) FROM t1;
COUNT(DISTINCT s1)
47
SELECT FIELD('ᄀ',s1), FIELD('ᇠ',s1), s1='ᄀ', s1='ᇠ' FROM t1;
FIELD('ᄀ',s1)	FIELD('ᇠ',s1)	s1='ᄀ'	s1='ᇠ'
0	0	0	0
0	0	0	0
0	0	0	0
0	0	0	0
0	0	0	0
0	0	0	0
0	0	0	0
0	0	0	0
0	0	0	0
0	0	0	0
0	0	0	0
0	0	0	0
0	0	0	0
0	0	0	0
0	0	0	0
0	0	0	0
0	0	0	0
0	0	0	0
0	0	0	0
0	0	0	0
0	0	0	0
0	0	0	0
0	0	0	0
0	0	0	0
0	0	0	0
0	0	0	0
0	0	0	0
0	0	0	0
0	0	0	0
0	0	0	0
0	0	0	0
0	0	0	0
0	0	0	0
0	0	0	0
0	0	0	0
0	0	0	0
0	0	0	0
0	0	0	0
0	0	0	0
0	0	0	0
0	0	0	0
0	0	0	0
0	0	0	0
0	0	0	0
0	0	0	0
0	0	0	0
0	0	0	0
DROP TABLE t1;
create table t1 (a char (20) not null, b int not null primary key auto_increment, index (a,b)) character set euckr collate euckr_bin;
insert into t1 (a) values ('가'), ('각'), ('간'), ('갑'), ('가스'), ('가시'), ('가장'), ('가주'), ('가중'), ('가치');
select a,b from t1 order by a,b;
a	b
가	1
가스	5
가시	6
가장	7
가주	8
가중	9
가치	10
각	2
간	3
갑	4
select a from t1 order by a desc,b;
a
갑
간
각
가치
가중
가주
가장
가시
가스
가
drop table t1;
create table t1 (a varchar (20) not null, b int not null primary key auto_increment, index (a,b)) character set euckr collate euckr_bin;
insert into t1 (a) values ('가'), ('각'), ('간'), ('갑'), ('가스'), ('가시'), ('가장'), ('가주'), ('가중'), ('가치');
select a,b from t1 order by a,b;
a	b
가	1
가스	5
가시	6
가장	7
가주	8
가중	9
가치	10
각	2
간	3
갑	4
select a from t1 order by a desc,b;
a
갑
간
각
가치
가중
가주
가장
가시
가스
가
drop table t1;
create table t2 (a varchar (20) not null, b int not null primary key auto_increment, index (a,b)) character set euckr collate euckr_korean_ci;
insert into t2 (a) values ('가'), ('각'), ('간'), ('갑'), ('가스'), ('가시'), ('가장'), ('가주'), ('가중'), ('가치');
select a,b from t2 order by a,b;
a	b
가	1
가스	5
가시	6
가장	7
가주	8
가중	9
가치	10
각	2
간	3
갑	4
select a from t2 order by a desc,b;
a
갑
간
각
가치
가중
가주
가장
가시
가스
가
drop table t2;
create table t2 (a varchar (20) not null, b int not null primary key auto_increment, index (a,b)) character set euckr collate euckr_korean_ci;
insert into t2 (a) values ('가'), ('각'), ('간'), ('갑'), ('가스'), ('가시'), ('가장'), ('가주'), ('가중'), ('가치');
select a,b from t2 order by a,b;
a	b
가	1
가스	5
가시	6
가장	7
가주	8
가중	9
가치	10
각	2
간	3
갑	4
select a from t2 order by a desc,b;
a
갑
간
각
가치
가중
가주
가장
가시
가스
가
drop table t2;
SELECT HEX(weight_string('가' as char(1)));
HEX(weight_string('가' as char(1)))
AC00
SELECT HEX(weight_string('각' as char(1)));
HEX(weight_string('각' as char(1)))
AC01
SELECT HEX(weight_string('간' as char(1)));
HEX(weight_string('간' as char(1)))
AC04
SELECT HEX(weight_string('갑' as char(1)));
HEX(weight_string('갑' as char(1)))
AC11
SELECT HEX(weight_string('가스' as char(2)));
HEX(weight_string('가스' as char(2)))
AC00C2A4
SELECT HEX(weight_string('가시' as char(2)));
HEX(weight_string('가시' as char(2)))
AC00C2DC
SELECT HEX(weight_string('가장' as char(2)));
HEX(weight_string('가장' as char(2)))
AC00C7A5
SELECT HEX(weight_string('가주' as char(2)));
HEX(weight_string('가주' as char(2)))
AC00C8FC
SELECT HEX(weight_string('가중' as char(2)));
HEX(weight_string('가중' as char(2)))
AC00C911
SELECT HEX(weight_string('가치' as char(2)));
HEX(weight_string('가치' as char(2)))
AC00CE58
create table t1 (a varchar (20) not null, b int not null primary key auto_increment, index (a,b)) character set euckr collate euckr_korean_ci;
insert into t1 (a) values ('가'), ('각'), ('간'), ('갑'), ('가스'), ('가시'), ('가장'), ('가주'), ('가중'), ('가치');
select * from t1 where a like "가%";
a	b
가	1
가스	5
가시	6
가장	7
가주	8
가중	9
가치	10
select * from t1 where a like binary "%갑%";
a	b
select * from t1 where a like "%장%";
a	b
가장	7
select * from t1 where a like "%주%";
a	b
가주	8
select * from t1 where a like "%가%";
a	b
가	1
가스	5
가시	6
가장	7
가주	8
가중	9
가치	10
drop table t1;
create table t1 (a varchar (20) not null, b int not null primary key auto_increment, index (a,b)) character set euckr collate euckr_bin;
insert into t1 (a) values ('가'), ('각'), ('간'), ('갑'), ('가스'), ('가시'), ('가장'), ('가주'), ('가중'), ('가치');
select * from t1 where a like "가%";
a	b
가	1
가스	5
가시	6
가장	7
가주	8
가중	9
가치	10
select * from t1 where a like binary "%갑%";
a	b
select * from t1 where a like "%장%";
a	b
가장	7
select * from t1 where a like "%주%";
a	b
가주	8
select * from t1 where a like "%가%";
a	b
가	1
가스	5
가시	6
가장	7
가주	8
가중	9
가치	10
drop table t1;
DROP TABLE IF EXISTS t1;
Warnings:
Note	1051	Unknown table 'test.t1'
CREATE TABLE t1 (
id INT AUTO_INCREMENT PRIMARY KEY,
str VARCHAR(255) CHARACTER SET euckr COLLATE euckr_korean_ci NOT NULL
);
INSERT INTO t1 (str) VALUES
('This is a test string with some special characters: 가,각,간,갑,가스,가시,가장,가주,가중,가치'),
('Just another string without special chars: ㅏ,ㅑ,ㅓ,ㅕ,ㅗ,ㅛ,ㅜ,ㅠ,ㅡ,ㅣ');
SELECT LOCATE('가', str) AS position FROM t1 WHERE id = 1;
position
53
SELECT LOCATE('각', str) AS position FROM t1 WHERE id = 1;
position
55
SELECT LOCATE('간', str) AS position FROM t1 WHERE id = 1;
position
57
SELECT LOCATE('갑', str) AS position FROM t1 WHERE id = 1;
position
59
SELECT LOCATE('ㅏ', str) AS position FROM t1 WHERE id = 1;
position
0
SELECT LOCATE('ㅡ', str) AS position FROM t1 WHERE id = 1;
position
0
SELECT LOCATE('가스', str) AS position FROM t1 WHERE id = 1;
position
61
SELECT LOCATE('가시', str) AS position FROM t1 WHERE id = 1;
position
64
SELECT LOCATE('가장', str) AS position FROM t1 WHERE id = 1;
position
67
SELECT LOCATE('가주', str) AS position FROM t1 WHERE id = 1;
position
70
SELECT LOCATE('가중', str) AS position FROM t1 WHERE id = 1;
position
73
SELECT LOCATE('가치', str) AS position FROM t1 WHERE id = 1;
position
76
SELECT id, LOCATE('xyz', str) FROM t1;
id	LOCATE('xyz', str)
1	0
2	0
SELECT id, LOCATE('This', str) FROM t1;
id	LOCATE('This', str)
1	1
2	0
DROP TABLE t1;
CREATE TABLE t1 (
id INT AUTO_INCREMENT PRIMARY KEY,
str VARCHAR(255) CHARACTER SET euckr COLLATE euckr_bin NOT NULL
);
INSERT INTO t1 (str) VALUES
('This is a test string with some special characters: 가,각,간,갑,가스,가시,가장,가주,가중,가치'),
('Just another string without special chars: ㅏ,ㅑ,ㅓ,ㅕ,ㅗ,ㅛ,ㅜ,ㅠ,ㅡ,ㅣ');
SELECT LOCATE('가', str) AS position FROM t1 WHERE id = 1;
position
53
SELECT LOCATE('각', str) AS position FROM t1 WHERE id = 1;
position
55
SELECT LOCATE('간', str) AS position FROM t1 WHERE id = 1;
position
57
SELECT LOCATE('갑', str) AS position FROM t1 WHERE id = 1;
position
59
SELECT LOCATE('ㅏ', str) AS position FROM t1 WHERE id = 1;
position
0
SELECT LOCATE('ㅡ', str) AS position FROM t1 WHERE id = 1;
position
0
SELECT LOCATE('가스', str) AS position FROM t1 WHERE id = 1;
position
61
SELECT LOCATE('가시', str) AS position FROM t1 WHERE id = 1;
position
64
SELECT LOCATE('가장', str) AS position FROM t1 WHERE id = 1;
position
67
SELECT LOCATE('가주', str) AS position FROM t1 WHERE id = 1;
position
70
SELECT LOCATE('가중', str) AS position FROM t1 WHERE id = 1;
position
73
SELECT LOCATE('가치', str) AS position FROM t1 WHERE id = 1;
position
76
SELECT id, LOCATE('xyz', str) FROM t1;
id	LOCATE('xyz', str)
1	0
2	0
SELECT id, LOCATE('This', str) FROM t1;
id	LOCATE('This', str)
1	1
2	0
DROP TABLE t1;
CREATE TABLE t1 (
id INT AUTO_INCREMENT PRIMARY KEY,
category VARCHAR(255) NOT NULL,
char_value VARCHAR(255) CHARACTER SET euckr COLLATE euckr_korean_ci NOT NULL
);
INSERT INTO t1 (category, char_value) VALUES
('元音', 'ㅏ'),
('元音', 'ㅑ'),
('元音', 'ㅓ'),
('元音', 'ㅕ'),
('元音', 'ㅗ'),
('元音', 'ㅛ'),
('元音', 'ㅜ'),
('元音', 'ㅠ'),
('元音', 'ㅡ'),
('元音', 'ㅣ');
INSERT INTO t1 (category, char_value) VALUES
('双元音', 'ㅐ'),
('双元音', 'ㅒ'),
('双元音', 'ㅔ'),
('双元音', 'ㅖ'),
('双元音', 'ㅚ'),
('双元音', 'ㅟ'),
('双元音', 'ㅢ');
INSERT INTO t1 (category, char_value) VALUES
('辅音', 'ㄱ'),
('辅音', 'ㄲ'),
('辅音', 'ㄴ'),
('辅音', 'ㄷ'),
('辅音', 'ㄸ'),
('辅音', 'ㄹ'),
('辅音', 'ㅁ'),
('辅音', 'ㅂ'),
('辅音', 'ㅃ'),
('辅音', 'ㅅ'),
('辅音', 'ㅆ'),
('辅音', 'ㅇ'),
('辅音', 'ㅈ'),
('辅音', 'ㅉ'),
('辅音', 'ㅊ'),
('辅音', 'ㅋ'),
('辅音', 'ㅌ'),
('辅音', 'ㅍ'),
('辅音', 'ㅎ');
INSERT INTO t1 (category, char_value) VALUES
('终声', 'ㄱ'),
('终声', 'ㄲ'),
('终声', 'ㄳ'),
('终声', 'ㄴ'),
('终声', 'ㄵ'),
('终声', 'ㄶ'),
('终声', 'ㄷ'),
('终声', 'ㄹ'),
('终声', 'ㄺ'),
('终声', 'ㄻ'),
('终声', 'ㄼ'),
('终声', 'ㄽ'),
('终声', 'ㄾ'),
('终声', 'ㄿ'),
('终声', 'ㅀ'),
('终声', 'ㅁ'),
('终声', 'ㅂ'),
('终声', 'ㅄ'),
('终声', 'ㅅ'),
('终声', 'ㅆ'),
('终声', 'ㅇ'),
('终声', 'ㅈ'),
('终声', 'ㅊ'),
('终声', 'ㅋ'),
('终声', 'ㅌ'),
('终声', 'ㅍ'),
('终声', 'ㅎ');
INSERT INTO t1 (category, char_value) VALUES
('特殊字符', '!'),
('特殊字符', '?'),
('特殊字符', '@'),
('特殊字符', '#'),
('特殊字符', '$'),
('特殊字符', '%'),
('特殊字符', '^'),
('特殊字符', '&'),
('特殊字符', '*'),
('特殊字符', '('),
('特殊字符', ')'),
('特殊字符', '-'),
('特殊字符', '+'),
('特殊字符', '='),
('特殊字符', '_'),
('特殊字符', '|'),
('特殊字符', ':'),
('特殊字符', ';'),
('特殊字符', '"'),
('特殊字符', '\''),
('特殊字符', '<'),
('特殊字符', '>'),
('特殊字符', ','),
('特殊字符', '.'),
('特殊字符', '/'),
('特殊字符', '~');
SELECT category, COUNT(*) as char_count
FROM t1
GROUP BY category;
category	char_count
元音	10
双元音	7
辅音	19
终声	27
特殊字符	26
DROP TABLE t1;
SET @@character_set_client= @old_character_set_client;
SET @@character_set_connection= @old_character_set_connection;
SET @@character_set_results= @old_character_set_results;
