drop table if exists t1;
#
# Start of 5.5 tests
#
set names utf8mb4;
select right(_utf8mb4 0xD0B0D0B2D0B2,1);
right(_utf8mb4 0xD0B0D0B2D0B2,1)
в
select locate('he','hello');
locate('he','hello')
1
select locate('he','hello',2);
locate('he','hello',2)
0
select locate('lo','hello',2);
locate('lo','hello',2)
4
select locate('HE','hello');
locate('HE','hello')
1
select locate('HE','hello',2);
locate('HE','hello',2)
0
select locate('LO','hello',2);
locate('LO','hello',2)
4
select locate('HE','hello' collate utf8mb4_bin);
locate('HE','hello' collate utf8mb4_bin)
0
select locate('HE','hello' collate utf8mb4_bin,2);
locate('HE','hello' collate utf8mb4_bin,2)
0
select locate('LO','hello' collate utf8mb4_bin,2);
locate('LO','hello' collate utf8mb4_bin,2)
0
select locate(_utf8mb4 0xD0B1, _utf8mb4 0xD0B0D0B1D0B2);
locate(_utf8mb4 0xD0B1, _utf8mb4 0xD0B0D0B1D0B2)
2
select locate(_utf8mb4 0xD091, _utf8mb4 0xD0B0D0B1D0B2);
locate(_utf8mb4 0xD091, _utf8mb4 0xD0B0D0B1D0B2)
2
select locate(_utf8mb4 0xD0B1, _utf8mb4 0xD0B0D091D0B2);
locate(_utf8mb4 0xD0B1, _utf8mb4 0xD0B0D091D0B2)
2
select locate(_utf8mb4 0xD091, _utf8mb4 0xD0B0D0B1D0B2 collate utf8mb4_bin);
locate(_utf8mb4 0xD091, _utf8mb4 0xD0B0D0B1D0B2 collate utf8mb4_bin)
0
select locate(_utf8mb4 0xD0B1, _utf8mb4 0xD0B0D091D0B2 collate utf8mb4_bin);
locate(_utf8mb4 0xD0B1, _utf8mb4 0xD0B0D091D0B2 collate utf8mb4_bin)
0
select length(_utf8mb4 0xD0B1);
length(_utf8mb4 0xD0B1)
2
select 'a' like 'a';
'a' like 'a'
1
select 'A' like 'a';
'A' like 'a'
1
select 'A' like 'a' collate utf8mb4_bin;
'A' like 'a' collate utf8mb4_bin
0
select _utf8mb4 0xD0B0D0B1D0B2 like concat(_utf8mb4'%',_utf8mb4 0xD0B1,_utf8mb4 '%');
_utf8mb4 0xD0B0D0B1D0B2 like concat(_utf8mb4'%',_utf8mb4 0xD0B1,_utf8mb4 '%')
1
select 'a' collate utf8mb4_general_ci like 'A' collate utf8mb4_general_ci;
'a' collate utf8mb4_general_ci like 'A' collate utf8mb4_general_ci
1
SELECT 'a' = 'a ';
'a' = 'a '
1
SELECT 'a\0' < 'a';
'a\0' < 'a'
1
SELECT 'a\0' < 'a ';
'a\0' < 'a '
1
SELECT 'a\t' < 'a';
'a\t' < 'a'
1
SELECT 'a\t' < 'a ';
'a\t' < 'a '
1
SELECT 'a' = 'a ' collate utf8mb4_bin;
'a' = 'a ' collate utf8mb4_bin
1
SELECT 'a\0' < 'a' collate utf8mb4_bin;
'a\0' < 'a' collate utf8mb4_bin
1
SELECT 'a\0' < 'a ' collate utf8mb4_bin;
'a\0' < 'a ' collate utf8mb4_bin
1
SELECT 'a\t' < 'a' collate utf8mb4_bin;
'a\t' < 'a' collate utf8mb4_bin
1
SELECT 'a\t' < 'a ' collate utf8mb4_bin;
'a\t' < 'a ' collate utf8mb4_bin
1
CREATE TABLE t1 (a char(10) character set utf8mb4 not null);
INSERT INTO t1 VALUES ('a'),('a\0'),('a\t'),('a ');
DROP TABLE t1;
set names utf8mb4;
set names utf8mb4;
create table t1 (s1 char(1) character set utf8mb4);
insert into t1 values (_utf8mb4'aa');
ERROR 22001: Data too long for column 's1' at row 1
select s1 from t1;
s1
drop table t1;
CREATE TABLE t1 ( a varchar(10) ) CHARACTER SET utf8mb4;
INSERT INTO t1 VALUES ( 'test' );
SELECT a.a, b.a FROM t1 a, t1 b WHERE a.a = b.a;
a	a
test	test
SELECT a.a, b.a FROM t1 a, t1 b WHERE a.a = 'test' and b.a = 'test';
a	a
test	test
SELECT a.a, b.a FROM t1 a, t1 b WHERE a.a = b.a and a.a = 'test';
a	a
test	test
DROP TABLE t1;
create table t1 (a char(255) character set utf8mb4);
insert into t1 values('b'),('b');
select * from t1 where a = 'b';
a
b
b
select * from t1 where a = 'b' and a = 'b';
a
b
b
select * from t1 where a = 'b' and a != 'b';
a
drop table t1;
set names utf8mb4;
select  'вася'  rlike '[[:<:]]вася[[:>:]]';
ERROR 42000: Got error 'U_REGEX_PROPERTY_SYNTAX' from regexp
select  'вася ' rlike '[[:<:]]вася[[:>:]]';
ERROR 42000: Got error 'U_REGEX_PROPERTY_SYNTAX' from regexp
select ' вася'  rlike '[[:<:]]вася[[:>:]]';
ERROR 42000: Got error 'U_REGEX_PROPERTY_SYNTAX' from regexp
select ' вася ' rlike '[[:<:]]вася[[:>:]]';
ERROR 42000: Got error 'U_REGEX_PROPERTY_SYNTAX' from regexp
select  'васяz' rlike '[[:<:]]вася[[:>:]]';
ERROR 42000: Got error 'U_REGEX_PROPERTY_SYNTAX' from regexp
select 'zвася'  rlike '[[:<:]]вася[[:>:]]';
ERROR 42000: Got error 'U_REGEX_PROPERTY_SYNTAX' from regexp
select 'zвасяz' rlike '[[:<:]]вася[[:>:]]';
ERROR 42000: Got error 'U_REGEX_PROPERTY_SYNTAX' from regexp
SET NAMES utf8mb4;
CREATE TABLE t1 (
subject varchar(255) character set utf8mb4 collate utf8mb4_general_ci,
p varchar(15) character set utf8mb4
) DEFAULT CHARSET=utf8mb4;
INSERT INTO t1 VALUES ('谷川俊二と申しますが、インターネット予約の会員登録をしましたところ、メールアドレスを間違えてしまい会員ＩＤが受け取ることが出来ませんでした。間違えアドレスはtani-shun@n.vodafone.ne.jpを書き込みました。どうすればよいですか？ その他、住所等は間違えありません。連絡ください。よろしくお願いします。m(__)m','040312-000057');
INSERT INTO t1 VALUES ('aaa','bbb');
SELECT length(subject) FROM t1;
length(subject)
432
3
SELECT length(subject) FROM t1 ORDER BY 1;
length(subject)
3
432
DROP TABLE t1;
select 'c' like '\_' as want0;
want0
0
SELECT SUBSTR('вася',-2);
SUBSTR('вася',-2)
ся
CREATE TABLE t1 (
user varchar(255) NOT NULL default ''
)  DEFAULT CHARSET=utf8;
INSERT INTO t1 VALUES ('one'),('two');
SELECT CHARSET('a');
CHARSET('a')
utf8mb4
SELECT user, CONCAT('<', user, '>') AS c FROM t1;
user	c
one	<one>
two	<two>
DROP TABLE t1;
create table t1 (f1 varchar(1) not null) default charset utf8mb4;
insert into t1 values (''), ('');
select concat(concat(_utf8'->',f1),_utf8'<-') from t1;
concat(concat(_utf8'->',f1),_utf8'<-')
-><-
-><-
drop table t1;
set names utf8mb4;
create table t1 (s1 char(5) character set utf8mb4 collate utf8mb4_general_ci);
insert into t1 values ('I'),('K'),('Y');
select * from t1 where s1 < 'K' and s1 = 'Y';
s1
select * from t1 where 'K' > s1 and s1 = 'Y';
s1
drop table t1;
create table t1 (s1 char(5) character set utf8mb4 collate utf8mb4_general_ci);
insert into t1 values ('c'),('d'),('h'),('ch'),('CH'),('cH'),('Ch'),('i');
select * from t1 where s1 > 'd' and s1 = 'CH';
s1
select * from t1 where 'd' < s1 and s1 = 'CH';
s1
select * from t1 where s1 = 'cH' and s1 <> 'ch';
s1
select * from t1 where 'cH' = s1 and s1 <> 'ch';
s1
drop table t1;
create table t1 (a varchar(255)) default character set utf8mb4;
insert into t1 values (1.0);
drop table t1;
create table t1 (
id int not null,
city varchar(20) not null,
key (city,id)
) character set=utf8mb4;
insert into t1 values (1,'Durban North');
insert into t1 values (2,'Durban');
select * from t1 where city = 'Durban';
id	city
2	Durban
select * from t1 where city = 'Durban ';
id	city
2	Durban
drop table t1;
SET NAMES UTF8;
CREATE TABLE t1 (
`id` int(20) NOT NULL auto_increment,
`country` varchar(100) NOT NULL default '',
`shortcode` varchar(100) NOT NULL default '',
`operator` varchar(100) NOT NULL default '',
`momid` varchar(30) NOT NULL default '',
`keyword` varchar(160) NOT NULL default '',
`content` varchar(160) NOT NULL default '',
`second_token` varchar(160) default NULL,
`gateway_id` int(11) NOT NULL default '0',
`created` datetime NOT NULL default '0000-00-00 00:00:00',
`msisdn` varchar(15) NOT NULL default '',
PRIMARY KEY  (`id`),
UNIQUE KEY `MSCCSPK_20030521130957121` (`momid`),
KEY `IX_mobile_originated_message_keyword` (`keyword`),
KEY `IX_mobile_originated_message_created` (`created`),
KEY `IX_mobile_originated_message_support` (`msisdn`,`momid`,`keyword`,`gateway_id`,`created`)
) DEFAULT CHARSET=utf8mb4;
INSERT INTO t1 VALUES 
(1,'blah','464','aaa','fkc1c9ilc20x0hgae7lx6j09','ERR','ERR Имри.Афимим.Аеимимримдмримрмрирор имримримримр имридм ирбднримрфмририримрфмфмим.Ад.Д имдимримрад.Адимримримрмдиримримримр м.Дадимфшьмримд им.Адимимрн имадми','ИМРИ.АФИМИМ.АЕИМИМРИМДМРИМРМРИРОР',3,'2005-06-01 17:30:43','1234567890'),
(2,'blah','464','aaa','haxpl2ilc20x00bj4tt2m5ti','11','11 g','G',3,'2005-06-02 22:43:10','1234567890');
drop  table if exists t2;
CREATE TABLE t2 (
`msisdn` varchar(15) NOT NULL default '',
`operator_id` int(11) NOT NULL default '0',
`created` datetime NOT NULL default '0000-00-00 00:00:00',
UNIQUE KEY `PK_user` (`msisdn`)
)  DEFAULT CHARSET=utf8mb4;
INSERT INTO t2 VALUES ('1234567890',2,'2005-05-24 13:53:25');
SELECT content, t2.msisdn FROM t1, t2 WHERE t1.msisdn = '1234567890';
content	msisdn
ERR Имри.Афимим.Аеимимримдмримрмрирор имримримримр имридм ирбднримрфмририримрфмфмим.Ад.Д имдимримрад.Адимримримрмдиримримримр м.Дадимфшьмримд им.Адимимрн имадми	1234567890
11 g	1234567890
DROP TABLE t1,t2;
set names utf8mb4;
select 'andre%' like 'andreñ%' escape 'ñ';
'andre%' like 'andreñ%' escape 'ñ'
1
set names utf8mb4;
select 'a\\' like 'a\\';
'a\\' like 'a\\'
1
select 'aa\\' like 'a%\\';
'aa\\' like 'a%\\'
1
create table t1 (a char(10), key(a)) character set utf8mb4;
insert into t1 values ("a"),("abc"),("abcd"),("hello"),("test");
select * from t1 where a like "abc%";
a
abc
abcd
select * from t1 where a like concat("abc","%");
a
abc
abcd
select * from t1 where a like "ABC%";
a
abc
abcd
select * from t1 where a like "test%";
a
test
select * from t1 where a like "te_t";
a
test
select * from t1 where a like "%a%";
a
a
abc
abcd
select * from t1 where a like "%abcd%";
a
abcd
select * from t1 where a like "%abc\d%";
a
abcd
drop table t1;
set names utf8mb4;
create table t1 (s1 char(5) character set utf8mb4);
insert into t1 values
('a'),('b'),(null),('ペテルグル'),('ü'),('Y');
create index it1 on t1 (s1);
select s1 as before_delete_general_ci from t1 where s1 like 'ペテ%';
before_delete_general_ci
ペテルグル
delete from t1 where s1 = 'Y';
select s1 as after_delete_general_ci from t1 where s1 like 'ペテ%';
after_delete_general_ci
ペテルグル
drop table t1;
set names utf8mb4;
create table t1 (s1 char(5) character set utf8mb4 collate utf8mb4_general_ci);
insert into t1 values
('a'),('b'),(null),('ペテルグル'),('ü'),('Y');
create index it1 on t1 (s1);
select s1 as before_delete_general_ci from t1 where s1 like 'ペテ%';
before_delete_general_ci
ペテルグル
delete from t1 where s1 = 'Y';
select s1 as after_delete_general_ci from t1 where s1 like 'ペテ%';
after_delete_general_ci
ペテルグル
drop table t1;
set names utf8mb4;
create table t1 (s1 char(5) character set utf8mb4 collate utf8mb4_bin);
insert into t1 values
('a'),('b'),(null),('ペテルグル'),('ü'),('Y');
create index it1 on t1 (s1);
select s1 as before_delete_bin from t1 where s1 like 'ペテ%';
before_delete_bin
ペテルグル
delete from t1 where s1 = 'Y';
select s1 as after_delete_bin from t1 where s1 like 'ペテ%';
after_delete_bin
ペテルグル
drop table t1;
set names utf8mb4;
create table t1 (a varchar(30) not null primary key)  default character set utf8mb4, collate utf8mb4_general_ci;
insert into t1 values ('あいうえおかきくけこさしすせそ');
insert into t1 values ('さしすせそかきくけこあいうえお');
select a as gci1 from t1 where a like 'さしすせそかきくけこあいうえお%';
gci1
さしすせそかきくけこあいうえお
select a as gci2 from t1 where a like 'あいうえおかきくけこさしすせそ';
gci2
あいうえおかきくけこさしすせそ
drop table t1;
set names utf8mb4;
create table t1 (a varchar(30) not null primary key) default character set utf8mb4, collate utf8mb4_general_ci;
insert into t1 values ('あいうえおかきくけこさしすせそ');
insert into t1 values ('さしすせそかきくけこあいうえお');
select a as uci1 from t1 where a like 'さしすせそかきくけこあいうえお%';
uci1
さしすせそかきくけこあいうえお
select a as uci2 from t1 where a like 'あいうえおかきくけこさしすせそ';
uci2
あいうえおかきくけこさしすせそ
drop table t1;
set names utf8mb4;
create table t1 (a varchar(30) not null primary key) default character set utf8mb4, collate utf8mb4_bin;
insert into t1 values ('あいうえおかきくけこさしすせそ');
insert into t1 values ('さしすせそかきくけこあいうえお');
select a as bin1 from t1 where a like 'さしすせそかきくけこあいうえお%';
bin1
さしすせそかきくけこあいうえお
select a as bin2 from t1 where a like 'あいうえおかきくけこさしすせそ';
bin2
あいうえおかきくけこさしすせそ
drop table t1;
SET NAMES utf8mb4;
CREATE TABLE t1 (
a CHAR(13) DEFAULT '',
INDEX(a)
) DEFAULT CHARSET=utf8mb4, COLLATE=utf8mb4_general_ci;
INSERT INTO t1 VALUES 
('Käli Käli 2-4'), ('Käli Käli 2-4'),
('Käli Käli 2+4'), ('Käli Käli 2+4'),
('Käli Käli 2-6'), ('Käli Käli 2-6');
SELECT * FROM t1;
a
Käli Käli 2-4
Käli Käli 2-4
Käli Käli 2+4
Käli Käli 2+4
Käli Käli 2-6
Käli Käli 2-6
SELECT a FROM t1 WHERE a LIKE 'Käli Käli 2+4';
a
Käli Käli 2+4
Käli Käli 2+4
DROP TABLE t1;
create table t1(a char(10)) default charset utf8mb4;
insert into t1 values ('123'), ('456');
select substr(Z.a,-1), Z.a from t1 as Y join t1 as Z on Y.a=Z.a order by 1;
substr(Z.a,-1)	a
3	123
6	456
drop table t1;
CREATE TABLE t1(id varchar(20) NOT NULL) DEFAULT CHARSET=utf8mb4;
INSERT INTO t1 VALUES ('xxx'), ('aa'), ('yyy'), ('aa');
SELECT id FROM t1;
id
xxx
aa
yyy
aa
SELECT DISTINCT id FROM t1;
id
xxx
aa
yyy
SELECT DISTINCT id FROM t1 ORDER BY id;
id
aa
xxx
yyy
DROP TABLE t1;
create table t1 (
a varchar(26) not null
) default character set utf8mb4;
insert into t1 (a) values ('abcdefghijklmnopqrstuvwxyz');
select * from t1;
a
abcdefghijklmnopqrstuvwxyz
alter table t1 change a a varchar(27) character set utf8mb4 not null;
select * from t1;
a
abcdefghijklmnopqrstuvwxyz
alter table t1 change a a varchar(50) character set utf8mb4 not null;
select * from t1;
a
abcdefghijklmnopqrstuvwxyz
drop table t1;
create table t1 (
a varchar(4000) not null
) default character set utf8mb4;
insert into t1 values (repeat('a',4000));
alter table t1 change a a varchar(4500) character set utf8mb4 not null;
select length(a) from t1;
length(a)
4000
drop table t1;
set names utf8mb4;
create table t1 (a char(1)) default character set utf8mb4;
create table t2 (a char(1)) default character set utf8mb4;
insert into t1 values('a'),('a'),(0xE38182),(0xE38182);
insert into t1 values('i'),('i'),(0xE38184),(0xE38184);
select * from t1 union distinct select * from t2;
a
a
i
あ
い
drop table t1,t2;
SELECT 'н1234567890' UNION SELECT _binary '1';
н1234567890
н1234567890
1
SELECT 'н1234567890' UNION SELECT 1;
н1234567890
н1234567890
1
SELECT '1' UNION SELECT 'н1234567890';
1
1
н1234567890
CREATE TABLE t1 (c VARCHAR(11)) CHARACTER SET utf8mb4;
CREATE TABLE t2 (b CHAR(1) CHARACTER SET binary, i INT);
INSERT INTO t1 (c) VALUES ('н1234567890');
INSERT INTO t2 (b, i) VALUES ('1', 1);
SELECT c FROM t1 UNION SELECT b FROM t2;
c
н1234567890
1
SELECT c FROM t1 UNION SELECT i FROM t2;
c
н1234567890
1
SELECT b FROM t2 UNION SELECT c FROM t1;
b
1
н1234567890
DROP TABLE t1, t2;
#
# Check strnxfrm() with odd length
#
create table t1 (a varchar(128) character set utf8mb4 collate utf8mb4_general_ci);
insert into t1 values ('a'),('b'),('c');
select * from t1 order by a;
a
a
b
c
select * from t1 order by a;
a
a
b
c
drop table t1;
#
# Testing 4-byte values.
#
DROP TABLE IF EXISTS t1;
CREATE TABLE t1 (
u_decimal int NOT NULL,
utf8mb4_encoding VARCHAR(10) NOT NULL
) CHARACTER SET utf8mb4;
INSERT INTO t1 VALUES (119040, x'f09d8480'),
(119070, x'f09d849e'),
(119134, x'f09d859e'),
(119247, x'f09d878f'),
(120607, x'f09d9c9f'),
(120735, x'f09d9e9f'),
(1114111, x'f48fbfbf'),
(917999, x'f3a087af');
INSERT INTO t1 VALUES (119070, x'f09d849ef09d859ef09d859ef09d8480f09d859ff09d859ff09d859ff09d85a0f09d85a0f09d8480');
INSERT INTO t1 VALUES (65131, x'efb9abf09d849ef09d859ef09d859ef09d8480f09d859fefb9abefb9abf09d85a0efb9ab');
SELECT u_decimal, hex(utf8mb4_encoding) FROM t1 ORDER BY utf8mb4_encoding COLLATE utf8mb4_general_ci, BINARY utf8mb4_encoding;
u_decimal	hex(utf8mb4_encoding)
65131	EFB9ABF09D849EF09D859EF09D859EF09D8480F09D859FEFB9ABEFB9ABF09D85A0EFB9AB
119040	F09D8480
119070	F09D849E
119134	F09D859E
119247	F09D878F
120607	F09D9C9F
120735	F09D9E9F
917999	F3A087AF
1114111	F48FBFBF
119070	F09D849EF09D859EF09D859EF09D8480F09D859FF09D859FF09D859FF09D85A0F09D85A0F09D8480
SELECT character_maximum_length, character_octet_length FROM information_schema.columns WHERE
table_name= 't1' AND column_name= 'utf8mb4_encoding';
character_maximum_length	character_octet_length
10	40
DROP TABLE IF EXISTS t2;
CREATE TABLE t2 (
u_decimal int NOT NULL,
utf8mb3_encoding VARCHAR(10) NOT NULL
) CHARACTER SET utf8mb4;
INSERT INTO t2 VALUES (42856, x'ea9da8');
INSERT INTO t2 VALUES (65131, x'efb9ab');
INSERT INTO t2 VALUES (1114111, x'f48fbfbf');
SELECT character_maximum_length, character_octet_length FROM information_schema.columns WHERE
table_name= 't2' AND column_name= 'utf8mb3_encoding';
character_maximum_length	character_octet_length
10	40
UPDATE t2 SET utf8mb3_encoding= x'f48fbfbd' where u_decimal= 42856;
UPDATE t2 SET utf8mb3_encoding= _utf8mb4 x'ea9da8' where u_decimal= 42856;
SELECT HEX(CONCAT(utf8mb4_encoding, _utf8 x'ea9da8')) FROM t1;
HEX(CONCAT(utf8mb4_encoding, _utf8 x'ea9da8'))
F09D8480EA9DA8
F09D849EEA9DA8
F09D859EEA9DA8
F09D878FEA9DA8
F09D9C9FEA9DA8
F09D9E9FEA9DA8
F48FBFBFEA9DA8
F3A087AFEA9DA8
F09D849EF09D859EF09D859EF09D8480F09D859FF09D859FF09D859FF09D85A0F09D85A0F09D8480EA9DA8
EFB9ABF09D849EF09D859EF09D859EF09D8480F09D859FEFB9ABEFB9ABF09D85A0EFB9ABEA9DA8
SELECT HEX(CONCAT(utf8mb4_encoding, utf8mb3_encoding)) FROM t1,t2;
HEX(CONCAT(utf8mb4_encoding, utf8mb3_encoding))
F09D8480EA9DA8
F09D8480EFB9AB
F09D8480F48FBFBF
F09D849EEA9DA8
F09D849EEFB9AB
F09D849EF48FBFBF
F09D859EEA9DA8
F09D859EEFB9AB
F09D859EF48FBFBF
F09D878FEA9DA8
F09D878FEFB9AB
F09D878FF48FBFBF
F09D9C9FEA9DA8
F09D9C9FEFB9AB
F09D9C9FF48FBFBF
F09D9E9FEA9DA8
F09D9E9FEFB9AB
F09D9E9FF48FBFBF
F48FBFBFEA9DA8
F48FBFBFEFB9AB
F48FBFBFF48FBFBF
F3A087AFEA9DA8
F3A087AFEFB9AB
F3A087AFF48FBFBF
F09D849EF09D859EF09D859EF09D8480F09D859FF09D859FF09D859FF09D85A0F09D85A0F09D8480EA9DA8
F09D849EF09D859EF09D859EF09D8480F09D859FF09D859FF09D859FF09D85A0F09D85A0F09D8480EFB9AB
F09D849EF09D859EF09D859EF09D8480F09D859FF09D859FF09D859FF09D85A0F09D85A0F09D8480F48FBFBF
EFB9ABF09D849EF09D859EF09D859EF09D8480F09D859FEFB9ABEFB9ABF09D85A0EFB9ABEA9DA8
EFB9ABF09D849EF09D859EF09D859EF09D8480F09D859FEFB9ABEFB9ABF09D85A0EFB9ABEFB9AB
EFB9ABF09D849EF09D859EF09D859EF09D8480F09D859FEFB9ABEFB9ABF09D85A0EFB9ABF48FBFBF
SELECT count(*) FROM t1, t2
WHERE t1.utf8mb4_encoding > t2.utf8mb3_encoding;
count(*)
21
ALTER TABLE t1 MODIFY utf8mb4_encoding VARCHAR(10) CHARACTER SET utf8mb4;
show create table t1;
Table	Create Table
t1	CREATE TABLE `t1` (
  `u_decimal` int(11) NOT NULL,
  `utf8mb4_encoding` varchar(10) DEFAULT NULL
) ORGANIZATION INDEX DEFAULT CHARSET = utf8mb4 COMPRESSION = 'lz4_1.0' REPLICA_NUM = NUM BLOCK_SIZE = SIZE USE_BLOOM_FILTER = FALSE ENABLE_MACRO_BLOCK_BLOOM_FILTER = FALSE TABLET_SIZE = SIZE PCTFREE = 10
SELECT u_decimal,hex(utf8mb4_encoding) FROM t1;
u_decimal	hex(utf8mb4_encoding)
119040	F09D8480
119070	F09D849E
119134	F09D859E
119247	F09D878F
120607	F09D9C9F
120735	F09D9E9F
1114111	F48FBFBF
917999	F3A087AF
119070	F09D849EF09D859EF09D859EF09D8480F09D859FF09D859FF09D859FF09D85A0F09D85A0F09D8480
65131	EFB9ABF09D849EF09D859EF09D859EF09D8480F09D859FEFB9ABEFB9ABF09D85A0EFB9AB
DROP TABLE t1;
#
# Testing that mixing utf8 and utf8mb4 collations returns utf8mb4
#
SELECT CHARSET(CONCAT(_utf8mb4'a',_utf8'b'));
CHARSET(CONCAT(_utf8mb4'a',_utf8'b'))
utf8mb4
CREATE TABLE t1 (utf8mb4 VARCHAR(10) CHARACTER SET utf8mb4 NOT NULL);
INSERT INTO t1 VALUES (x'ea9da8'),(x'f48fbfbf');
SELECT CONCAT(utf8mb4, _utf8 x'ea9da8') FROM t1 LIMIT 0;
CONCAT(utf8mb4, _utf8 x'ea9da8')
DROP TABLE t1;
