drop database if exists 一深;
create database 一深;
use 一深;
create table 哈a哈(v1 int);
create table a哈哈(v1 int);
show tables;
Tables_in_一深
a哈哈
哈a哈
create table 蚂蚁金服(工号 int, 部门 varchar(10), 入职日期 date);
insert into 蚂蚁金服 values(10000, 'oceanbase', '2018-7-1');
insert into 蚂蚁金服 values(1024, '风控', '2018-1-1');
create table 阿里巴巴(工号 int, 岗位 varchar(20));
insert into 阿里巴巴 values(10000, '产品经理');
select 工号 from 蚂蚁金服;
工号
10000
1024
select 部门 from 蚂蚁金服;
部门
oceanbase
风控
select 入职日期 from 蚂蚁金服;
入职日期
2018-07-01
2018-01-01
alter table 蚂蚁金服 add column 年龄 int;
alter table 蚂蚁金服 drop column 年龄;
select 支付宝.入职日期, 淘宝.岗位 from 蚂蚁金服 支付宝, 阿里巴巴 淘宝 where 支付宝.工号 = 淘宝.工号;
入职日期	岗位
2018-07-01	产品经理
update 蚂蚁金服 set 工号=1025 where 工号=1024;
alter table 阿里巴巴 alter column 岗位 set default '开发';
create table таблица (столбец int, Второй int);
insert into таблица values (1, 1);
select (select 1 from таблица order by столбец) from таблица;
(select 1 from таблица order by столбец)
1
select столбец from таблица where 1 in (select 1 from таблица order by столбец) ;
столбец
1
insert into таблица values(1, 1);
select столбец+1 嘿嘿, Второй+1 哈哈 from таблица;
嘿嘿	哈哈
2	2
2	2
create table 테이블 (번째 int);
select * from 테이블 order by 번째;
번째
insert into 테이블 values(1);
select 번째+10 from 테이블;
번째+10
11
create table ｱｱｱ(ｷｷｷ int);
insert into ｱｱｱ values(1);
insert into ｱｱｱ values(2);
insert into ｱｱｱ values(3);
select あああ.ｷｷｷ from ｱｱｱ あああ;
ｷｷｷ
1
2
3
show tables;
Tables_in_一深
a哈哈
таблица
哈a哈
蚂蚁金服
阿里巴巴
테이블
ｱｱｱ
