drop table if exists t1,t2,t3,t4;
create table t1 (c1 int auto_increment primary key, c2 int);
create table t3 (c1 int);
create table t4 (c1 int);
create index idx1 on t1(c2);
select last_insert_id(0) from dual;
last_insert_id(0)
0
insert into t1 (c2) values (3);
insert into t1 (c2) values (2);
insert into t3 values(1);
insert into t4 values(1);
select * from t1;
c1	c2
1	3
2	2
select last_insert_id(0) from dual;
last_insert_id(0)
0
explain select * from t1 where c2 = last_insert_id();
Query Plan
====================================================
|ID|OPERATOR        |NAME    |EST.ROWS|EST.TIME(us)|
----------------------------------------------------
|0 |TABLE RANGE SCAN|t1(idx1)|1       |3           |
====================================================
Outputs & filters:
-------------------------------------
  0 - output([t1.c1], [t1.c2]), filter(nil), rowset=16
      access([t1.c1], [t1.c2]), partitions(p0)
      is_index_back=false, is_global_index=false, 
      range_key([t1.c2], [t1.c1]), range(0,MIN ; 0,MAX), 
      range_cond([t1.c2 = last_insert_id()])
select * from t1 where c2 = last_insert_id();
c1	c2
alter system flush plan cache global;
explain select * from t1 where 1 = last_insert_id();
Query Plan
===============================================
|ID|OPERATOR       |NAME|EST.ROWS|EST.TIME(us)|
-----------------------------------------------
|0 |TABLE FULL SCAN|t1  |0       |3           |
===============================================
Outputs & filters:
-------------------------------------
  0 - output([t1.c1], [t1.c2]), filter(nil), startup_filter([0]), rowset=16
      access([t1.c1], [t1.c2]), partitions(p0)
      is_index_back=false, is_global_index=false, 
      range_key([t1.c1]), range(MIN ; MAX)always true
explain select * from t1 where 2 = last_insert_id();
Query Plan
===============================================
|ID|OPERATOR       |NAME|EST.ROWS|EST.TIME(us)|
-----------------------------------------------
|0 |TABLE FULL SCAN|t1  |0       |3           |
===============================================
Outputs & filters:
-------------------------------------
  0 - output([t1.c1], [t1.c2]), filter(nil), startup_filter([0]), rowset=16
      access([t1.c1], [t1.c2]), partitions(p0)
      is_index_back=false, is_global_index=false, 
      range_key([t1.c1]), range(MIN ; MAX)always true
select * from t1 where 1 = last_insert_id();
c1	c2
select * from t1 where 2 = last_insert_id();
c1	c2
insert into t1 (c2) values (1);
select * from t1 where 2 = last_insert_id();
c1	c2
select query_sql, hit_count from oceanbase.gv$ob_plan_cache_plan_stat where query_sql like "select * from t1 where 1 = last_insert_id%";
query_sql	hit_count
select * from t1 where 1 = last_insert_id()	2
select query_sql, hit_count from oceanbase.gv$ob_plan_cache_plan_stat where query_sql like "select * from t1 where 2 = last_insert_id%";
query_sql	hit_count
select * from t1 where 3 = last_insert_id();
c1	c2
1	3
2	2
3	1
select query_sql, hit_count from oceanbase.gv$ob_plan_cache_plan_stat where query_sql like "select * from t1 where 1 = last_insert_id%";
query_sql	hit_count
select * from t1 where 1 = last_insert_id()	2
select query_sql, hit_count from oceanbase.gv$ob_plan_cache_plan_stat where query_sql like "select * from t1 where 2 = last_insert_id%";
query_sql	hit_count
explain select * from t1 where c2 = last_insert_id(2);
Query Plan
====================================================
|ID|OPERATOR        |NAME    |EST.ROWS|EST.TIME(us)|
----------------------------------------------------
|0 |TABLE RANGE SCAN|t1(idx1)|1       |3           |
====================================================
Outputs & filters:
-------------------------------------
  0 - output([t1.c1], [t1.c2]), filter([2 = last_insert_id(2)]), rowset=16
      access([t1.c1], [t1.c2]), partitions(p0)
      is_index_back=false, is_global_index=false, filter_before_indexback[false], 
      range_key([t1.c2], [t1.c1]), range(2,MIN ; 2,MAX), 
      range_cond([t1.c2 = 2])
select * from t1 where c2 = last_insert_id(2);
c1	c2
2	2
explain select * from t1 where c2 = last_insert_id(2) + 1;
Query Plan
====================================================
|ID|OPERATOR        |NAME    |EST.ROWS|EST.TIME(us)|
----------------------------------------------------
|0 |TABLE RANGE SCAN|t1(idx1)|1       |3           |
====================================================
Outputs & filters:
-------------------------------------
  0 - output([t1.c1], [t1.c2]), filter([2 + 1 = last_insert_id(2) + 1]), rowset=16
      access([t1.c1], [t1.c2]), partitions(p0)
      is_index_back=false, is_global_index=false, filter_before_indexback[false], 
      range_key([t1.c2], [t1.c1]), range(3,MIN ; 3,MAX), 
      range_cond([t1.c2 = 2 + 1])
select * from t1 where c2 = last_insert_id(2) + 1;
c1	c2
1	3
explain select * from t1 where c2 = last_insert_id(2) + rand();
Query Plan
===============================================
|ID|OPERATOR       |NAME|EST.ROWS|EST.TIME(us)|
-----------------------------------------------
|0 |TABLE FULL SCAN|t1  |3       |3           |
===============================================
Outputs & filters:
-------------------------------------
  0 - output([t1.c1], [t1.c2]), filter([cast(t1.c2, DOUBLE(-1, -1)) = cast(last_insert_id(2), DOUBLE(-1, -1)) + rand()]), rowset=16
      access([t1.c1], [t1.c2]), partitions(p0)
      is_index_back=false, is_global_index=false, filter_before_indexback[false], 
      range_key([t1.c1]), range(MIN ; MAX)always true
select * from t1 where c2 = last_insert_id(2) + rand();
c1	c2
explain select * from t1 where c2 = last_insert_id(c2);
Query Plan
===============================================
|ID|OPERATOR       |NAME|EST.ROWS|EST.TIME(us)|
-----------------------------------------------
|0 |TABLE FULL SCAN|t1  |3       |3           |
===============================================
Outputs & filters:
-------------------------------------
  0 - output([t1.c1], [t1.c2]), filter([t1.c2 = last_insert_id(t1.c2)]), rowset=16
      access([t1.c1], [t1.c2]), partitions(p0)
      is_index_back=false, is_global_index=false, filter_before_indexback[false], 
      range_key([t1.c1]), range(MIN ; MAX)always true
select * from t1 where c2 = last_insert_id(c2);
c1	c2
1	3
2	2
3	1
explain select * from t1 where c2 = last_insert_id(1) + c1;
Query Plan
===============================================
|ID|OPERATOR       |NAME|EST.ROWS|EST.TIME(us)|
-----------------------------------------------
|0 |TABLE FULL SCAN|t1  |3       |3           |
===============================================
Outputs & filters:
-------------------------------------
  0 - output([t1.c1], [t1.c2]), filter([t1.c2 = last_insert_id(1) + t1.c1]), rowset=16
      access([t1.c1], [t1.c2]), partitions(p0)
      is_index_back=false, is_global_index=false, filter_before_indexback[false], 
      range_key([t1.c1]), range(MIN ; MAX)always true
select * from t1 where c2 = last_insert_id(1) + c1;
c1	c2
explain select * from t1 group by c2 having c2 = last_insert_id(2);
Query Plan
======================================================
|ID|OPERATOR          |NAME    |EST.ROWS|EST.TIME(us)|
------------------------------------------------------
|0 |MERGE GROUP BY    |        |1       |3           |
|1 |└─TABLE RANGE SCAN|t1(idx1)|1       |3           |
======================================================
Outputs & filters:
-------------------------------------
  0 - output([t1.c1], [t1.c2]), filter(nil), rowset=16
      group(nil), agg_func(nil)
  1 - output([t1.c1], [t1.c2]), filter([2 = last_insert_id(2)]), rowset=16
      access([t1.c1], [t1.c2]), partitions(p0)
      is_index_back=false, is_global_index=false, filter_before_indexback[false], 
      range_key([t1.c2], [t1.c1]), range(2,MIN ; 2,MAX), 
      range_cond([t1.c2 = 2])
select * from t1 group by c2 having c2 = last_insert_id(2);
c1	c2
2	2
explain select * from t1 join t3 on t1.c2=t3.c1 and t1.c2 = last_insert_id(2);
Query Plan
===============================================================
|ID|OPERATOR                   |NAME    |EST.ROWS|EST.TIME(us)|
---------------------------------------------------------------
|0 |NESTED-LOOP JOIN CARTESIAN |        |1       |5           |
|1 |├─TABLE FULL SCAN          |t3      |1       |3           |
|2 |└─MATERIAL                 |        |1       |3           |
|3 |  └─TABLE RANGE SCAN       |t1(idx1)|1       |3           |
===============================================================
Outputs & filters:
-------------------------------------
  0 - output([t1.c1], [t1.c2], [t3.c1]), filter(nil), rowset=16
      conds(nil), nl_params_(nil), use_batch=false
  1 - output([t3.c1]), filter([t3.c1 = 2]), rowset=16
      access([t3.c1]), partitions(p0)
      is_index_back=false, is_global_index=false, filter_before_indexback[false], 
      range_key([t3.__pk_increment]), range(MIN ; MAX)always true
  2 - output([t1.c1], [t1.c2]), filter(nil), rowset=16
  3 - output([t1.c1], [t1.c2]), filter([2 = last_insert_id(2)]), rowset=16
      access([t1.c1], [t1.c2]), partitions(p0)
      is_index_back=false, is_global_index=false, filter_before_indexback[false], 
      range_key([t1.c2], [t1.c1]), range(2,MIN ; 2,MAX), 
      range_cond([t1.c2 = 2])
select * from t1 join t3 on t1.c2=t3.c1 and t1.c2 = last_insert_id(2);
c1	c2	c1
explain select * from t3 join t4 on t3.c1= t4.c1 join t1 on t1.c2=t3.c1 and t1.c2 = last_insert_id(2) ;
Query Plan
=================================================================
|ID|OPERATOR                     |NAME    |EST.ROWS|EST.TIME(us)|
-----------------------------------------------------------------
|0 |NESTED-LOOP JOIN CARTESIAN   |        |1       |7           |
|1 |├─NESTED-LOOP JOIN CARTESIAN |        |1       |5           |
|2 |│ ├─TABLE RANGE SCAN         |t1(idx1)|1       |3           |
|3 |│ └─MATERIAL                 |        |1       |3           |
|4 |│   └─TABLE FULL SCAN        |t3      |1       |3           |
|5 |└─MATERIAL                   |        |1       |3           |
|6 |  └─TABLE FULL SCAN          |t4      |1       |3           |
=================================================================
Outputs & filters:
-------------------------------------
  0 - output([t3.c1], [t4.c1], [t1.c1], [t1.c2]), filter(nil), rowset=16
      conds(nil), nl_params_(nil), use_batch=false
  1 - output([t3.c1], [t1.c1], [t1.c2]), filter(nil), rowset=16
      conds(nil), nl_params_(nil), use_batch=false
  2 - output([t1.c1], [t1.c2]), filter(nil), rowset=16
      access([t1.c1], [t1.c2]), partitions(p0)
      is_index_back=false, is_global_index=false, 
      range_key([t1.c2], [t1.c1]), range(2,MIN ; 2,MAX), 
      range_cond([t1.c2 = 2])
  3 - output([t3.c1]), filter(nil), rowset=16
  4 - output([t3.c1]), filter([2 = last_insert_id(2)], [t3.c1 = 2]), rowset=16
      access([t3.c1]), partitions(p0)
      is_index_back=false, is_global_index=false, filter_before_indexback[false,false], 
      range_key([t3.__pk_increment]), range(MIN ; MAX)always true
  5 - output([t4.c1]), filter(nil), rowset=16
  6 - output([t4.c1]), filter([t4.c1 = 2]), rowset=16
      access([t4.c1]), partitions(p0)
      is_index_back=false, is_global_index=false, filter_before_indexback[false], 
      range_key([t4.__pk_increment]), range(MIN ; MAX)always true
explain select * from t1 where t1.c2 = length(last_insert_id('1'));
Query Plan
====================================================
|ID|OPERATOR        |NAME    |EST.ROWS|EST.TIME(us)|
----------------------------------------------------
|0 |TABLE RANGE SCAN|t1(idx1)|1       |3           |
====================================================
Outputs & filters:
-------------------------------------
  0 - output([t1.c1], [t1.c2]), filter([length(cast(cast('1', BIGINT UNSIGNED(-1, 0)), VARCHAR(1048576))) = length(cast(last_insert_id(cast('1', BIGINT 
      UNSIGNED(-1, 0))), VARCHAR(1048576)))]), rowset=16
      access([t1.c1], [t1.c2]), partitions(p0)
      is_index_back=false, is_global_index=false, filter_before_indexback[false], 
      range_key([t1.c2], [t1.c1]), range(1,MIN ; 1,MAX), 
      range_cond([t1.c2 = length(cast(cast('1', BIGINT UNSIGNED(-1, 0)), VARCHAR(1048576)))])
select * from t1 where t1.c2 = length(last_insert_id('1'));
c1	c2
3	1
explain update t1 set c1 = c1+1 where c2 = last_insert_id(1);
Query Plan
======================================================
|ID|OPERATOR          |NAME    |EST.ROWS|EST.TIME(us)|
------------------------------------------------------
|0 |UPDATE            |        |1       |27          |
|1 |└─TABLE RANGE SCAN|t1(idx1)|1       |3           |
======================================================
Outputs & filters:
-------------------------------------
  0 - output(nil), filter(nil)
      table_columns([{t1: ({t1: (t1.c1, t1.c2)})}]),
      update([t1.c1=column_conv(INT,PS:(11,0),NOT NULL,cast(t1.c1 + 1, INT(-1, 0)))])
  1 - output([t1.c1], [t1.c2]), filter([1 = last_insert_id(1)]), rowset=16
      access([t1.c1], [t1.c2]), partitions(p0)
      is_index_back=false, is_global_index=false, filter_before_indexback[false], 
      range_key([t1.c2], [t1.c1]), range(1,MIN ; 1,MAX), 
      range_cond([t1.c2 = 1])
update t1 set c1 = c1+1 where c2 = last_insert_id(1);
explain delete from t1 where c2 = last_insert_id(1);
Query Plan
======================================================
|ID|OPERATOR          |NAME    |EST.ROWS|EST.TIME(us)|
------------------------------------------------------
|0 |DELETE            |        |1       |9           |
|1 |└─TABLE RANGE SCAN|t1(idx1)|1       |3           |
======================================================
Outputs & filters:
-------------------------------------
  0 - output(nil), filter(nil)
      table_columns([{t1: ({t1: (t1.c1, t1.c2)})}])
  1 - output([t1.c1], [t1.c2]), filter([1 = last_insert_id(1)]), rowset=16
      access([t1.c1], [t1.c2]), partitions(p0)
      is_index_back=false, is_global_index=false, filter_before_indexback[false], 
      range_key([t1.c2], [t1.c1]), range(1,MIN ; 1,MAX), 
      range_cond([t1.c2 = 1])
delete from t1 where c2 = last_insert_id(1);
select last_insert_id(0);
last_insert_id(0)
0
create table t2 (c1 int auto_increment primary key, c2 int) partition by range(c1) partitions 3 (
partition p0 values less than (3),
partition p1 values less than (5),
partition p2 values less than MAXVALUE
);
insert into t2 (c2) values(1);
insert into t2 (c2) values(2);
insert into t2 (c2) values(3);
insert into t2 (c2) values(7);
select * from t2;
c1	c2
1	1
2	2
3	3
4	7
select last_insert_id();
last_insert_id()
4
explain select * from t2 where c1 = last_insert_id();
Query Plan
=========================================
|ID|OPERATOR |NAME|EST.ROWS|EST.TIME(us)|
-----------------------------------------
|0 |TABLE GET|t2  |1       |5           |
=========================================
Outputs & filters:
-------------------------------------
  0 - output([t2.c1], [t2.c2]), filter(nil), rowset=16
      access([t2.c1], [t2.c2]), partitions(p1)
      is_index_back=false, is_global_index=false, 
      range_key([t2.c1]), range[4 ; 4], 
      range_cond([t2.c1 = last_insert_id()])
select * from t2 where c1 = last_insert_id();
c1	c2
4	7
select last_insert_id(1);
last_insert_id(1)
1
explain select * from t2 where c1 = last_insert_id();
Query Plan
=========================================
|ID|OPERATOR |NAME|EST.ROWS|EST.TIME(us)|
-----------------------------------------
|0 |TABLE GET|t2  |1       |5           |
=========================================
Outputs & filters:
-------------------------------------
  0 - output([t2.c1], [t2.c2]), filter(nil), rowset=16
      access([t2.c1], [t2.c2]), partitions(p0)
      is_index_back=false, is_global_index=false, 
      range_key([t2.c1]), range[1 ; 1], 
      range_cond([t2.c1 = last_insert_id()])
select * from t2 where c1 = last_insert_id();
c1	c2
1	1
explain select * from t2 where c2 = last_insert_id(2);
Query Plan
=============================================================
|ID|OPERATOR                 |NAME    |EST.ROWS|EST.TIME(us)|
-------------------------------------------------------------
|0 |PX COORDINATOR           |        |1       |8           |
|1 |└─EXCHANGE OUT DISTR     |:EX10000|1       |8           |
|2 |  └─PX PARTITION ITERATOR|        |1       |7           |
|3 |    └─TABLE FULL SCAN    |t2      |1       |7           |
=============================================================
Outputs & filters:
-------------------------------------
  0 - output([INTERNAL_FUNCTION(t2.c1, t2.c2)]), filter(nil), rowset=16
  1 - output([INTERNAL_FUNCTION(t2.c1, t2.c2)]), filter(nil), rowset=16
      dop=1
  2 - output([t2.c1], [t2.c2]), filter(nil), rowset=16
      force partition granule
  3 - output([t2.c1], [t2.c2]), filter([t2.c2 = last_insert_id(2)]), rowset=16
      access([t2.c1], [t2.c2]), partitions(p[0-2])
      is_index_back=false, is_global_index=false, filter_before_indexback[false], 
      range_key([t2.c1]), range(MIN ; MAX)always true
select * from t2 where c2 = last_insert_id(2);
c1	c2
2	2
explain select * from t2 where c1 = last_insert_id(2);
Query Plan
=========================================
|ID|OPERATOR |NAME|EST.ROWS|EST.TIME(us)|
-----------------------------------------
|0 |TABLE GET|t2  |1       |5           |
=========================================
Outputs & filters:
-------------------------------------
  0 - output([t2.c1], [t2.c2]), filter([2 = last_insert_id(2)]), rowset=16
      access([t2.c1], [t2.c2]), partitions(p0)
      is_index_back=false, is_global_index=false, filter_before_indexback[false], 
      range_key([t2.c1]), range[2 ; 2], 
      range_cond([t2.c1 = 2])
select * from t2 where c1 = last_insert_id(2);
c1	c2
2	2
explain select * from t2 where c1 = last_insert_id(3);
Query Plan
=========================================
|ID|OPERATOR |NAME|EST.ROWS|EST.TIME(us)|
-----------------------------------------
|0 |TABLE GET|t2  |1       |5           |
=========================================
Outputs & filters:
-------------------------------------
  0 - output([t2.c1], [t2.c2]), filter([3 = last_insert_id(3)]), rowset=16
      access([t2.c1], [t2.c2]), partitions(p1)
      is_index_back=false, is_global_index=false, filter_before_indexback[false], 
      range_key([t2.c1]), range[3 ; 3], 
      range_cond([t2.c1 = 3])
select * from t2 where c1 = last_insert_id(3);
c1	c2
3	3
explain select * from t2 where c2 = last_insert_id(1) + 1;
Query Plan
=============================================================
|ID|OPERATOR                 |NAME    |EST.ROWS|EST.TIME(us)|
-------------------------------------------------------------
|0 |PX COORDINATOR           |        |1       |8           |
|1 |└─EXCHANGE OUT DISTR     |:EX10000|1       |8           |
|2 |  └─PX PARTITION ITERATOR|        |1       |7           |
|3 |    └─TABLE FULL SCAN    |t2      |1       |7           |
=============================================================
Outputs & filters:
-------------------------------------
  0 - output([INTERNAL_FUNCTION(t2.c1, t2.c2)]), filter(nil), rowset=16
  1 - output([INTERNAL_FUNCTION(t2.c1, t2.c2)]), filter(nil), rowset=16
      dop=1
  2 - output([t2.c1], [t2.c2]), filter(nil), rowset=16
      force partition granule
  3 - output([t2.c1], [t2.c2]), filter([t2.c2 = last_insert_id(1) + 1]), rowset=16
      access([t2.c1], [t2.c2]), partitions(p[0-2])
      is_index_back=false, is_global_index=false, filter_before_indexback[false], 
      range_key([t2.c1]), range(MIN ; MAX)always true
select * from t2 where c2 = last_insert_id(1) + 1;
c1	c2
2	2
explain select * from t2 where c1 = last_insert_id(1) + 1;
Query Plan
=========================================
|ID|OPERATOR |NAME|EST.ROWS|EST.TIME(us)|
-----------------------------------------
|0 |TABLE GET|t2  |1       |5           |
=========================================
Outputs & filters:
-------------------------------------
  0 - output([t2.c1], [t2.c2]), filter([1 + 1 = last_insert_id(1) + 1]), rowset=16
      access([t2.c1], [t2.c2]), partitions(p0)
      is_index_back=false, is_global_index=false, filter_before_indexback[false], 
      range_key([t2.c1]), range[2 ; 2], 
      range_cond([t2.c1 = 1 + 1])
select * from t2 where c1 = last_insert_id(1) + 1;
c1	c2
2	2
select last_insert_id();
last_insert_id()
1
explain select * from t2 where c2 = last_insert_id(c1);
Query Plan
=============================================================
|ID|OPERATOR                 |NAME    |EST.ROWS|EST.TIME(us)|
-------------------------------------------------------------
|0 |PX COORDINATOR           |        |4       |11          |
|1 |└─EXCHANGE OUT DISTR     |:EX10000|4       |10          |
|2 |  └─PX PARTITION ITERATOR|        |4       |7           |
|3 |    └─TABLE FULL SCAN    |t2      |4       |7           |
=============================================================
Outputs & filters:
-------------------------------------
  0 - output([INTERNAL_FUNCTION(t2.c1, t2.c2)]), filter(nil), rowset=16
  1 - output([INTERNAL_FUNCTION(t2.c1, t2.c2)]), filter(nil), rowset=16
      dop=1
  2 - output([t2.c1], [t2.c2]), filter(nil), rowset=16
      force partition granule
  3 - output([t2.c1], [t2.c2]), filter([t2.c2 = last_insert_id(t2.c1)]), rowset=16
      access([t2.c1], [t2.c2]), partitions(p[0-2])
      is_index_back=false, is_global_index=false, filter_before_indexback[false], 
      range_key([t2.c1]), range(MIN ; MAX)always true
select * from t2 where c2 = last_insert_id(c1);
c1	c2
1	1
2	2
3	3
explain select * from t2 where c1 = last_insert_id(c1);
Query Plan
=============================================================
|ID|OPERATOR                 |NAME    |EST.ROWS|EST.TIME(us)|
-------------------------------------------------------------
|0 |PX COORDINATOR           |        |4       |11          |
|1 |└─EXCHANGE OUT DISTR     |:EX10000|4       |10          |
|2 |  └─PX PARTITION ITERATOR|        |4       |7           |
|3 |    └─TABLE FULL SCAN    |t2      |4       |7           |
=============================================================
Outputs & filters:
-------------------------------------
  0 - output([INTERNAL_FUNCTION(t2.c1, t2.c2)]), filter(nil), rowset=16
  1 - output([INTERNAL_FUNCTION(t2.c1, t2.c2)]), filter(nil), rowset=16
      dop=1
  2 - output([t2.c1], [t2.c2]), filter(nil), rowset=16
      force partition granule
  3 - output([t2.c1], [t2.c2]), filter([t2.c1 = last_insert_id(t2.c1)]), rowset=16
      access([t2.c1], [t2.c2]), partitions(p[0-2])
      is_index_back=false, is_global_index=false, filter_before_indexback[false], 
      range_key([t2.c1]), range(MIN ; MAX)always true
select * from t2 where c1 = last_insert_id(c1);
c1	c2
1	1
2	2
3	3
4	7
select last_insert_id();
last_insert_id()
1
explain update t2 set c2 = c1+1 where c1 = last_insert_id(1);
Query Plan
===========================================
|ID|OPERATOR   |NAME|EST.ROWS|EST.TIME(us)|
-------------------------------------------
|0 |UPDATE     |    |1       |29          |
|1 |└─TABLE GET|t2  |1       |5           |
===========================================
Outputs & filters:
-------------------------------------
  0 - output(nil), filter(nil)
      table_columns([{t2: ({t2: (t2.c1, t2.c2)})}]),
      update([t2.c2=column_conv(INT,PS:(11,0),NULL,cast(cast(1, INT(11, 0)) + 1, INT(-1, 0)))])
  1 - output([t2.c1], [t2.c2]), filter([1 = last_insert_id(1)]), rowset=16
      access([t2.c1], [t2.c2]), partitions(p0)
      is_index_back=false, is_global_index=false, filter_before_indexback[false], 
      range_key([t2.c1]), range[1 ; 1], 
      range_cond([t2.c1 = 1])
explain update t2 set c2 = c1+1 where c1 = last_insert_id(4);
Query Plan
===========================================
|ID|OPERATOR   |NAME|EST.ROWS|EST.TIME(us)|
-------------------------------------------
|0 |UPDATE     |    |1       |29          |
|1 |└─TABLE GET|t2  |1       |5           |
===========================================
Outputs & filters:
-------------------------------------
  0 - output(nil), filter(nil)
      table_columns([{t2: ({t2: (t2.c1, t2.c2)})}]),
      update([t2.c2=column_conv(INT,PS:(11,0),NULL,cast(cast(4, INT(11, 0)) + 1, INT(-1, 0)))])
  1 - output([t2.c1], [t2.c2]), filter([4 = last_insert_id(4)]), rowset=16
      access([t2.c1], [t2.c2]), partitions(p1)
      is_index_back=false, is_global_index=false, filter_before_indexback[false], 
      range_key([t2.c1]), range[4 ; 4], 
      range_cond([t2.c1 = 4])
update t2 set c2 = c1+1 where c1 = last_insert_id(1);
explain delete from t2 where c1 = last_insert_id(1);
Query Plan
===========================================
|ID|OPERATOR   |NAME|EST.ROWS|EST.TIME(us)|
-------------------------------------------
|0 |DELETE     |    |1       |11          |
|1 |└─TABLE GET|t2  |1       |5           |
===========================================
Outputs & filters:
-------------------------------------
  0 - output(nil), filter(nil)
      table_columns([{t2: ({t2: (t2.c1, t2.c2)})}])
  1 - output([t2.c1], [t2.c2]), filter([1 = last_insert_id(1)]), rowset=16
      access([t2.c1], [t2.c2]), partitions(p0)
      is_index_back=false, is_global_index=false, filter_before_indexback[false], 
      range_key([t2.c1]), range[1 ; 1], 
      range_cond([t2.c1 = 1])
explain delete from t2 where c1 = last_insert_id(4);
Query Plan
===========================================
|ID|OPERATOR   |NAME|EST.ROWS|EST.TIME(us)|
-------------------------------------------
|0 |DELETE     |    |1       |11          |
|1 |└─TABLE GET|t2  |1       |5           |
===========================================
Outputs & filters:
-------------------------------------
  0 - output(nil), filter(nil)
      table_columns([{t2: ({t2: (t2.c1, t2.c2)})}])
  1 - output([t2.c1], [t2.c2]), filter([4 = last_insert_id(4)]), rowset=16
      access([t2.c1], [t2.c2]), partitions(p1)
      is_index_back=false, is_global_index=false, filter_before_indexback[false], 
      range_key([t2.c1]), range[4 ; 4], 
      range_cond([t2.c1 = 4])
delete from t2 where c1 = last_insert_id(1);
drop table t1,t2,t3,t4;
