drop table if exists a1, a2,t1,t2;
select CASE 'b' when 'a' then 1 when 'b' then 2 END;
CASE 'b' when 'a' then 1 when 'b' then 2 END
2
select CASE 'c' when 'a' then 1 when 'b' then 2 END;
CASE 'c' when 'a' then 1 when 'b' then 2 END
NULL
select CASE 'c' when 'a' then 1 when 'b' then 2 ELSE 3 END;
CASE 'c' when 'a' then 1 when 'b' then 2 ELSE 3 END
3
select CASE concat('a','b') when concat('ab','') then 'a' when 'b' then 'b' end;
CASE concat('a','b') when concat('ab','') then 'a' when 'b' then 'b' end
a
select CASE when 1=0 then 'true' else 'false' END;
CASE when 1=0 then 'true' else 'false' END
false
select CASE 1 when 1 then 'one' WHEN 2 then 'two' ELSE 'more' END;
CASE 1 when 1 then 'one' WHEN 2 then 'two' ELSE 'more' END
one
explain basic select CASE 1 when 1 then 'one' WHEN 2 then 'two' ELSE 'more' END;
Query Plan
====================
|ID|OPERATOR  |NAME|
--------------------
|0 |EXPRESSION|    |
====================
Outputs & filters:
-------------------------------------
  0 - output([CASE WHEN 1 = 1 THEN 'one' WHEN 1 = 2 THEN 'two' ELSE 'more' END]), filter(nil)
      values({CASE WHEN 1 = 1 THEN 'one' WHEN 1 = 2 THEN 'two' ELSE 'more' END})
select CASE 2.0 when 1 then 'one' WHEN 2.0 then 'two' ELSE 'more' END;
CASE 2.0 when 1 then 'one' WHEN 2.0 then 'two' ELSE 'more' END
two
select (CASE 'two' when 'one' then 1.00 WHEN 'two' then 2.00 END) +0.0;
(CASE 'two' when 'one' then 1.00 WHEN 'two' then 2.00 END) +0.0
2.00
select case 1/0 when 'a' then 'true' else 'false' END;
case 1/0 when 'a' then 'true' else 'false' END
false
select case 1/0 when 'a' then 'true' END;
case 1/0 when 'a' then 'true' END
NULL
select case 1/0 when 'a' then 'true' when NULL then 'ok' else 'false' END;
case 1/0 when 'a' then 'true' when NULL then 'ok' else 'false' END
false
select (case 1/0 when 'a' then 'true' END) + 0.0;
(case 1/0 when 'a' then 'true' END) + 0.0
NULL
select case when 1>0 then 'TRUE' else 'FALSE' END;
case when 1>0 then 'TRUE' else 'FALSE' END
TRUE
select case when 1<0 then 'TRUE' else 'FALSE' END;
case when 1<0 then 'TRUE' else 'FALSE' END
FALSE
select case when 1<0 then 'TRUE' else 'FALSE' END;
case when 1<0 then 'TRUE' else 'FALSE' END
FALSE
create table a1 (rowkey_suffix int primary key, price int);
insert into a1(rowkey_suffix, price) values(1,1);
insert into a1(rowkey_suffix, price) values(2,2);
insert into a1(rowkey_suffix, price) values(3,3);
insert into a1(rowkey_suffix, price) values(4,4);
select case price when 1 then 2 when 2 then 3 else 0 end as fcase, count(*) from a1 group by fcase order by fcase;
fcase	count(*)
0	2
2	1
3	1
explain basic select case price when 1 then 2 when 2 then 3 else 0 end as fcase, count(*) from a1 group by price;
Query Plan
===========================
|ID|OPERATOR         |NAME|
---------------------------
|0 |HASH GROUP BY    |    |
|1 |└─TABLE FULL SCAN|a1  |
===========================
Outputs & filters:
-------------------------------------
  0 - output([CASE WHEN a1.price = 1 THEN 2 WHEN a1.price = 2 THEN 3 ELSE 0 END], [T_FUN_COUNT(*)]), filter(nil), rowset=16
      group([a1.price]), agg_func([T_FUN_COUNT(*)])
  1 - output([a1.price]), filter(nil), rowset=16
      access([a1.price]), partitions(p0)
      is_index_back=false, is_global_index=false, 
      range_key([a1.rowkey_suffix]), range(MIN ; MAX)always true
select case price when 1 then 'one' when 2 then 'two' else 'nothing' end as fcase, count(*) from a1 group by fcase;
fcase	count(*)
one	1
two	1
nothing	2
drop table a1;
create table a1 (rowkey_suffix int primary key, price int);
select max(case price when 1 then rowkey_suffix else null end) as color from a1 group by price;
color
drop table a1;
create table t1(a float , b int primary key);
insert into t1 (a,b) values (2,1), (11,3), (8,2);
select min(a), min(case when 1=1 then a else NULL end),
min(case when 1!=1 then NULL else a end)
from t1 where b=3 group by b;
min(a)	min(case when 1=1 then a else NULL end)	min(case when 1!=1 then NULL else a end)
11	11	11
drop table t1;
create table t1 (a int primary key, b int);
create table t2 (c int primary key, d int);
insert into t1 (a, b) values (1,2147483648), (2,2147483648),(3,2147483649);
ERROR 22003: Out of range value for column 'b' at row 1
insert into t1 (a, b) values (1,2147483647), (2,2147483647),(3,2147483647);
insert into t2 (c) values (1), (2), (3);
select t1.a, (case t1.a when 0 then 0 else t1.b end) d from t1
join t2 on t1.a=t2.c order by d;
a	d
1	2147483647
2	2147483647
3	2147483647
select t1.a, (case t1.a when 0 then 0 else t1.b end) d from t1
join t2 on t1.a=t2.c where b=2147483648 order by d;
a	d
select t1.a, (case t1.a when 0 then 0 else t1.b end) d from t1
join t2 on t1.a=t2.c where b=2147483649 order by d;
a	d
drop table t1, t2;
End of 5.0 tests
drop table if exists t1,t2;
create table t1(f1 char(10),b int primary key);
insert into t1 values ('a',1),('b',2),('1',3),('123',4),('3',5);
create index t1f1_idx on t1(f1);
select * from t1 ;
f1	b
a	1
b	2
1	3
123	4
3	5
select * from t1 where f1>2;
f1	b
123	4
3	5
Warnings:
Warning	1292	Truncated incorrect DECIMAL value: 'a'
Warning	1292	Truncated incorrect DECIMAL value: 'b'
select * from t1 where f1>1;
f1	b
123	4
3	5
Warnings:
Warning	1292	Truncated incorrect DECIMAL value: 'a'
Warning	1292	Truncated incorrect DECIMAL value: 'b'
select * from t1 where f1<3;
f1	b
a	1
b	2
1	3
Warnings:
Warning	1292	Truncated incorrect DECIMAL value: 'a'
Warning	1292	Truncated incorrect DECIMAL value: 'b'
select * from t1 where f1=3;
f1	b
3	5
Warnings:
Warning	1292	Truncated incorrect DECIMAL value: 'a'
Warning	1292	Truncated incorrect DECIMAL value: 'b'
select * from t1 where f1=3 or f1=1;
f1	b
1	3
3	5
Warnings:
Warning	1292	Truncated incorrect DECIMAL value: 'a'
Warning	1292	Truncated incorrect DECIMAL value: 'a'
Warning	1292	Truncated incorrect DECIMAL value: 'b'
Warning	1292	Truncated incorrect DECIMAL value: 'b'
delete from t1;
insert into t1 values ('212',1),('22',2),('1',3),('123',4),('113',5);
select * from t1 where f1>2;
f1	b
212	1
22	2
123	4
113	5
select * from t1 where f1>1;
f1	b
212	1
22	2
123	4
113	5
select * from t1 where f1<3;
f1	b
1	3
select * from t1 where f1=3 or f1=1;
f1	b
1	3
select * from t1 where f1 in(1,123,113);
f1	b
1	3
123	4
113	5
SELECT 'case+union+test' UNION SELECT CASE LOWER('1') WHEN LOWER('2') THEN 'BUG' ELSE 'nobug' END;
case+union+test
case+union+test
nobug
SELECT CASE LOWER('1') WHEN LOWER('2') THEN 'BUG' ELSE 'nobug' END;
CASE LOWER('1') WHEN LOWER('2') THEN 'BUG' ELSE 'nobug' END
nobug
SELECT 'case+union+test' UNION SELECT CASE '1' WHEN '2' THEN 'BUG' ELSE 'nobug' END;
case+union+test
case+union+test
nobug
drop table if exists t1,t2;
create table t1(a float, b int default 3);
insert into t1 (a) values (2), (11), (8);
select min(a), min(case when 1=1 then a else NULL end),min(case when 1!=1 then NULL else a end) from t1 where b=3 group by b;
min(a)	min(case when 1=1 then a else NULL end)	min(case when 1!=1 then NULL else a end)
2	2	2
drop table t1;
drop table if exists t1,t2;
CREATE TABLE t1 (EMPNUM INT);
INSERT INTO t1 VALUES (0), (2);
CREATE TABLE t2 (EMPNUM DECIMAL (4, 2));
INSERT INTO t2 VALUES (0.0), (9.0);
SELECT COALESCE(t2.EMPNUM,t1.EMPNUM) AS CEMPNUM,
t1.EMPNUM AS EMPMUM1, t2.EMPNUM AS EMPNUM2
FROM t1 LEFT JOIN t2 ON t1.EMPNUM=t2.EMPNUM;
CEMPNUM	EMPMUM1	EMPNUM2
0.00	0	0.00
2.00	2	NULL
SELECT IFNULL(t2.EMPNUM,t1.EMPNUM) AS CEMPNUM,
t1.EMPNUM AS EMPMUM1, t2.EMPNUM AS EMPNUM2
FROM t1 LEFT JOIN t2 ON t1.EMPNUM=t2.EMPNUM;
CEMPNUM	EMPMUM1	EMPNUM2
0.00	0	0.00
2.00	2	NULL
DROP TABLE t1,t2;
create table t1 (a int, b bigint unsigned);
create table t2 (c int);
insert into t1 (a, b) values (1,4572794622775114594), (2,18196094287899841997), (3,11120436154190595086);
insert into t2 (c) values (1), (2), (3);
select t1.a, (case t1.a when 0 then 0 else t1.b end) d from t1 join t2 on t1.a = t2.c order by d;
a	d
1	4572794622775114594
3	11120436154190595086
2	18196094287899841997
select t1.a, (case t1.a when 0 then 0 else t1.b end) d from t1 join t2 on t1.a = t2.c where b = 11120436154190595086 order by d;
a	d
3	11120436154190595086
drop table t1, t2;
CREATE TABLE t1(a int);
insert into t1 values(1);
SELECT 1 FROM t1 WHERE a=1 AND CASE 1 WHEN a THEN 1 ELSE 1 END;
1
1
DROP TABLE t1;
SELECT CASE timestamp '2015-01-01 01:01:01' WHEN ROUND( -1 ) THEN 1 END ;
CASE timestamp '2015-01-01 01:01:01' WHEN ROUND( -1 ) THEN 1 END
NULL
SELECT CASE timestamp '2015-01-01 01:01:01' WHEN -1  THEN 1 END ;
CASE timestamp '2015-01-01 01:01:01' WHEN -1  THEN 1 END
NULL
create table t1(a varchar(10) collate utf8mb4_general_ci, 
cond1 varchar(10) collate utf8mb4_bin, 
cond2 varchar(10) collate utf8mb4_general_ci, 
val1 varchar(10) collate utf8mb4_bin,
val2 varchar(10) collate utf8mb4_bin);
insert into t1 values ('cond', 'COND', 'cond', 'hello', 'world');
insert into t1 values ('cond', 'cond', 'COND', 'hello', 'world');
insert into t1 values ('cond', 'COND', 'COND', 'hello', 'world');
insert into t1 values ('cond', 'cond', 'cond', 'hello', 'world');
insert into t1 values ('cond', 'bar', 'foo', 'hello', 'world');
select a, collation(a) from (select (case a when cond1 then val1 when cond2 then val2 else 'default_val' collate utf8mb4_bin end) as a from t1) tmp;
a	collation(a)
world	utf8mb4_bin
hello	utf8mb4_bin
default_val	utf8mb4_bin
hello	utf8mb4_bin
default_val	utf8mb4_bin
select a, collation(a) from (select (case a when cond1 then val1 when cond2 then val2 end) as a from t1) tmp;
a	collation(a)
world	utf8mb4_bin
hello	utf8mb4_bin
NULL	utf8mb4_bin
hello	utf8mb4_bin
NULL	utf8mb4_bin
drop table t1;
create table t1(a varchar(10) collate utf8mb4_general_ci, cond varchar(10) collate utf8mb4_general_ci, val varchar(10) collate utf8mb4_bin);
insert into t1 values ('cond', 'COND', 'val');
select a, collation(a) from (select (case a when cond then val else 'def_val' collate utf8mb4_bin end) as a from t1) tmp;
a	collation(a)
val	utf8mb4_bin
drop table t1;
create table t1(a varchar(10) collate utf8mb4_general_ci, 
cond1 varchar(10) collate utf8mb4_bin, 
cond2 varchar(10) collate utf8mb4_general_ci, 
val1 varchar(10) collate utf8mb4_general_ci,
val2 varchar(10) collate utf8mb4_bin);
insert into t1 values ('cond', 'cond', 'COND', 'hello', 'world');
insert into t1 values ('cond', 'COND', 'cond', 'hello', 'world');
insert into t1 values ('cond', 'COND', 'COND', 'hello', 'world');
insert into t1 values ('cond', 'cond', 'cond', 'hello', 'world');
insert into t1 values ('cond', 'bar', 'foo', 'hello', 'world');
select a, collation(a) from (select (case a when cond1 then val1 when cond2 then val2 else 'default_val' collate utf8mb4_bin end) as a from t1) tmp;
a	collation(a)
hello	utf8mb4_bin
world	utf8mb4_bin
default_val	utf8mb4_bin
hello	utf8mb4_bin
default_val	utf8mb4_bin
select a, collation(a) from (select (case a when cond1 then val1 when cond2 then val2 end) as a from t1) tmp;
a	collation(a)
hello	utf8mb4_bin
world	utf8mb4_bin
NULL	utf8mb4_bin
hello	utf8mb4_bin
NULL	utf8mb4_bin
drop table t1;

// case when expr to type use conn collation, should use collation of result_type_
DROP TABLE if exists `cu_configfile`;
CREATE TABLE `cu_configfile` (
`cpid` varchar(20) COLLATE utf8mb4_bin NOT NULL,
`cuid` varchar(30) COLLATE utf8mb4_bin NOT NULL,
`configfilename` varchar(50) COLLATE utf8mb4_bin NOT NULL,
`comments` varchar(100) COLLATE utf8mb4_bin DEFAULT NULL,
`format` varchar(1) COLLATE utf8mb4_bin DEFAULT NULL,
`configtype` varchar(1) COLLATE utf8mb4_bin DEFAULT NULL,
PRIMARY KEY (`cpid`, `cuid`, `configfilename`)
);
select( case when a.cpid = '' then null else a.cpid end ) cpid from cu_configfile a 
union select( case when a.cpid = '' then null else a.cpid end ) cpid from cu_configfile a;
cpid
case when with BIT type.
DROP TABLE if exists t, t1;
create table t(c1 bit(50));
insert into t values('123');
select * from t;
c1
    123
select cast(if( 0 , ref_0.c1 , ref_0.c1 ) as char) from t as ref_0;
cast(if( 0 , ref_0.c1 , ref_0.c1 ) as char)
    123
select length(case when 1 = 1 then c1 else c1 end) from t;
length(case when 1 = 1 then c1 else c1 end)
7
select length(coalesce(c1, c1)) from t;
length(coalesce(c1, c1))
7
create table t1 as select case when 1 = 1 then c1 else c1 end c1 from t;
desc t1;
Field	Type	Null	Key	Default	Extra
c1	bit(50)	YES		NULL	
drop table t;
drop table if exists t0;
drop table if exists t1;
drop table if exists t2;
drop table if exists t3;
drop table if exists t4;
drop table if exists t5;
drop table if exists t6;
drop table if exists t7;
drop table if exists t8;
drop table if exists t9;
drop table if exists t10;
create table t0(c0 double);
insert into t0 values(1),(-1),(null);
select c0,1|c0, (IF(FALSE, (NOT (c0 >= 1)), 1 | c0)) >= 0  from t0;
c0	1|c0	(IF(FALSE, (NOT (c0 >= 1)), 1 | c0)) >= 0
1	1	1
-1	18446744073709551615	1
NULL	NULL	NULL
select * from t0 where (IF(FALSE, (NOT (c0 >= 1)), 1 | c0)) >= 0;
c0
1
-1
drop table t0;
create table t(c1 tinyint, c2 smallint, c3 mediumint, c4 int, c5 bigint, c6 tinyint unsigned, c7 smallint unsigned, c8 mediumint unsigned, c9 int unsigned, c10 bigint unsigned);
insert into t values(-1, -1, -1, -1, -1, 255, 65535, 16777215, 4294967295, 18446744073709551615);
create table t1 as select case when 0 then c1 else c1 end c1_1, case when 0 then c1 else c2 end c1_2, case when 0 then c1 else c3 end c1_3, case when 0 then c1 else c4 end c1_4, case when 0 then c1 else c5 end c1_5, case when 0 then c1 else c6 end c1_6, case when 0 then c1 else c7 end c1_7, case when 0 then c1 else c8 end c1_8, case when 0 then c1 else c9 end c1_9, case when 0 then c1 else c10 end c1_10 from t;
desc t1;
Field	Type	Null	Key	Default	Extra
c1_1	int(4)	YES		NULL	
c1_2	int(6)	YES		NULL	
c1_3	int(9)	YES		NULL	
c1_4	int(11)	YES		NULL	
c1_5	bigint(20)	YES		NULL	
c1_6	int(4)	YES		NULL	
c1_7	int(5)	YES		NULL	
c1_8	int(8)	YES		NULL	
c1_9	bigint(10)	YES		NULL	
c1_10	decimal(20,0)	YES		NULL	
create table t2 as select case when 0 then c2 else c1 end c2_1, case when 0 then c2 else c2 end c2_2, case when 0 then c2 else c3 end c2_3, case when 0 then c2 else c4 end c2_4, case when 0 then c2 else c5 end c2_5, case when 0 then c2 else c6 end c2_6, case when 0 then c2 else c7 end c2_7, case when 0 then c2 else c8 end c2_8, case when 0 then c2 else c9 end c2_9, case when 0 then c2 else c10 end c2_10 from t;
desc t2;
Field	Type	Null	Key	Default	Extra
c2_1	int(6)	YES		NULL	
c2_2	int(6)	YES		NULL	
c2_3	int(9)	YES		NULL	
c2_4	int(11)	YES		NULL	
c2_5	bigint(20)	YES		NULL	
c2_6	int(6)	YES		NULL	
c2_7	int(6)	YES		NULL	
c2_8	int(8)	YES		NULL	
c2_9	bigint(10)	YES		NULL	
c2_10	decimal(20,0)	YES		NULL	
create table t3 as select case when 0 then c3 else c1 end c3_1, case when 0 then c3 else c2 end c3_2, case when 0 then c3 else c3 end c3_3, case when 0 then c3 else c4 end c3_4, case when 0 then c3 else c5 end c3_5, case when 0 then c3 else c6 end c3_6, case when 0 then c3 else c7 end c3_7, case when 0 then c3 else c8 end c3_8, case when 0 then c3 else c9 end c3_9, case when 0 then c3 else c10 end c3_10 from t;
desc t3;
Field	Type	Null	Key	Default	Extra
c3_1	int(9)	YES		NULL	
c3_2	int(9)	YES		NULL	
c3_3	int(9)	YES		NULL	
c3_4	int(11)	YES		NULL	
c3_5	bigint(20)	YES		NULL	
c3_6	int(9)	YES		NULL	
c3_7	int(9)	YES		NULL	
c3_8	int(9)	YES		NULL	
c3_9	bigint(10)	YES		NULL	
c3_10	decimal(20,0)	YES		NULL	
create table t4 as select case when 0 then c4 else c1 end c4_1, case when 0 then c4 else c2 end c4_2, case when 0 then c4 else c3 end c4_3, case when 0 then c4 else c4 end c4_4, case when 0 then c4 else c5 end c4_5, case when 0 then c4 else c6 end c4_6, case when 0 then c4 else c7 end c4_7, case when 0 then c4 else c8 end c4_8, case when 0 then c4 else c9 end c4_9, case when 0 then c4 else c10 end c4_10 from t;
desc t4;
Field	Type	Null	Key	Default	Extra
c4_1	int(11)	YES		NULL	
c4_2	int(11)	YES		NULL	
c4_3	int(11)	YES		NULL	
c4_4	int(11)	YES		NULL	
c4_5	bigint(20)	YES		NULL	
c4_6	int(11)	YES		NULL	
c4_7	int(11)	YES		NULL	
c4_8	int(11)	YES		NULL	
c4_9	bigint(11)	YES		NULL	
c4_10	decimal(20,0)	YES		NULL	
create table t5 as select case when 0 then c5 else c1 end c5_1, case when 0 then c5 else c2 end c5_2, case when 0 then c5 else c3 end c5_3, case when 0 then c5 else c4 end c5_4, case when 0 then c5 else c5 end c5_5, case when 0 then c5 else c6 end c5_6, case when 0 then c5 else c7 end c5_7, case when 0 then c5 else c8 end c5_8, case when 0 then c5 else c9 end c5_9, case when 0 then c5 else c10 end c5_10 from t;
desc t5;
Field	Type	Null	Key	Default	Extra
c5_1	bigint(20)	YES		NULL	
c5_2	bigint(20)	YES		NULL	
c5_3	bigint(20)	YES		NULL	
c5_4	bigint(20)	YES		NULL	
c5_5	bigint(20)	YES		NULL	
c5_6	bigint(20)	YES		NULL	
c5_7	bigint(20)	YES		NULL	
c5_8	bigint(20)	YES		NULL	
c5_9	bigint(20)	YES		NULL	
c5_10	decimal(20,0)	YES		NULL	
create table t6 as select case when 0 then c6 else c1 end c6_1, case when 0 then c6 else c2 end c6_2, case when 0 then c6 else c3 end c6_3, case when 0 then c6 else c4 end c6_4, case when 0 then c6 else c5 end c6_5, case when 0 then c6 else c6 end c6_6, case when 0 then c6 else c7 end c6_7, case when 0 then c6 else c8 end c6_8, case when 0 then c6 else c9 end c6_9, case when 0 then c6 else c10 end c6_10 from t;
desc t6;
Field	Type	Null	Key	Default	Extra
c6_1	int(4)	YES		NULL	
c6_2	int(6)	YES		NULL	
c6_3	int(9)	YES		NULL	
c6_4	int(11)	YES		NULL	
c6_5	bigint(20)	YES		NULL	
c6_6	int(3) unsigned	YES		NULL	
c6_7	int(5) unsigned	YES		NULL	
c6_8	int(8) unsigned	YES		NULL	
c6_9	int(10) unsigned	YES		NULL	
c6_10	bigint(20) unsigned	YES		NULL	
create table t7 as select case when 0 then c7 else c1 end c7_1, case when 0 then c7 else c2 end c7_2, case when 0 then c7 else c3 end c7_3, case when 0 then c7 else c4 end c7_4, case when 0 then c7 else c5 end c7_5, case when 0 then c7 else c6 end c7_6, case when 0 then c7 else c7 end c7_7, case when 0 then c7 else c8 end c7_8, case when 0 then c7 else c9 end c7_9, case when 0 then c7 else c10 end c7_10 from t;
desc t7;
Field	Type	Null	Key	Default	Extra
c7_1	int(5)	YES		NULL	
c7_2	int(6)	YES		NULL	
c7_3	int(9)	YES		NULL	
c7_4	int(11)	YES		NULL	
c7_5	bigint(20)	YES		NULL	
c7_6	int(5) unsigned	YES		NULL	
c7_7	int(5) unsigned	YES		NULL	
c7_8	int(8) unsigned	YES		NULL	
c7_9	int(10) unsigned	YES		NULL	
c7_10	bigint(20) unsigned	YES		NULL	
create table t8 as select case when 0 then c8 else c1 end c8_1, case when 0 then c8 else c2 end c8_2, case when 0 then c8 else c3 end c8_3, case when 0 then c8 else c4 end c8_4, case when 0 then c8 else c5 end c8_5, case when 0 then c8 else c6 end c8_6, case when 0 then c8 else c7 end c8_7, case when 0 then c8 else c8 end c8_8, case when 0 then c8 else c9 end c8_9, case when 0 then c8 else c10 end c8_10 from t;
desc t8;
Field	Type	Null	Key	Default	Extra
c8_1	int(8)	YES		NULL	
c8_2	int(8)	YES		NULL	
c8_3	int(9)	YES		NULL	
c8_4	int(11)	YES		NULL	
c8_5	bigint(20)	YES		NULL	
c8_6	int(8) unsigned	YES		NULL	
c8_7	int(8) unsigned	YES		NULL	
c8_8	int(8) unsigned	YES		NULL	
c8_9	int(10) unsigned	YES		NULL	
c8_10	bigint(20) unsigned	YES		NULL	
create table t9 as select case when 1 then c9 else c1 end c9_1, case when 1 then c9 else c2 end c9_2, case when 1 then c9 else c3 end c9_3, case when 1 then c9 else c4 end c9_4, case when 1 then c9 else c5 end c9_5, case when 1 then c9 else c6 end c9_6, case when 1 then c9 else c7 end c9_7, case when 1 then c9 else c8 end c9_8, case when 1 then c9 else c9 end c9_9, case when 1 then c9 else c10 end c9_10 from t;
desc t9;
Field	Type	Null	Key	Default	Extra
c9_1	bigint(10)	YES		NULL	
c9_2	bigint(10)	YES		NULL	
c9_3	bigint(10)	YES		NULL	
c9_4	bigint(11)	YES		NULL	
c9_5	bigint(20)	YES		NULL	
c9_6	int(10) unsigned	YES		NULL	
c9_7	int(10) unsigned	YES		NULL	
c9_8	int(10) unsigned	YES		NULL	
c9_9	int(10) unsigned	YES		NULL	
c9_10	bigint(20) unsigned	YES		NULL	
create table t10 as select case when 1 then c10 else c1 end c10_1, case when 1 then c10 else c2 end c10_2, case when 1 then c10 else c3 end c10_3, case when 1 then c10 else c4 end c10_4, case when 1 then c10 else c5 end c10_5, case when 1 then c10 else c6 end c10_6, case when 1 then c10 else c7 end c10_7, case when 1 then c10 else c8 end c10_8, case when 1 then c10 else c9 end c10_9, case when 1 then c10 else c10 end c10_10 from t;
desc t10;
Field	Type	Null	Key	Default	Extra
c10_1	decimal(20,0)	YES		NULL	
c10_2	decimal(20,0)	YES		NULL	
c10_3	decimal(20,0)	YES		NULL	
c10_4	decimal(20,0)	YES		NULL	
c10_5	decimal(20,0)	YES		NULL	
c10_6	bigint(20) unsigned	YES		NULL	
c10_7	bigint(20) unsigned	YES		NULL	
c10_8	bigint(20) unsigned	YES		NULL	
c10_9	bigint(20) unsigned	YES		NULL	
c10_10	bigint(20) unsigned	YES		NULL	
drop table if exists t1;
drop table if exists t2;
drop table if exists t3;
drop table if exists t4;
drop table if exists t5;
drop table if exists t6;
drop table if exists t7;
drop table if exists t8;
drop table if exists t9;
drop table if exists t10;
drop table if exists t;
drop table if exists t1;
create table t(c1 tinyint, c2 smallint, c3 mediumint, c4 int, c5 bigint, c6 tinyint unsigned, c7 smallint unsigned, c8 mediumint unsigned, c9 int unsigned, c10 bigint unsigned);
insert into t values(-1, -1, -1, -1, -1, 255, 65535, 16777215, 4294967295, 18446744073709551615);
create table t1 as select case when 0 then c1 else NULL end c1_1, case when 0 then c2 else NULL end c1_2, case when 0 then c3 else NULL end c1_3, case when 0 then c4 else NULL end c1_4, case when 0 then c5 else NULL end c1_5, case when 0 then c6 else NULL end c1_6, case when 0 then c7 else NULL end c1_7, case when 0 then c8 else NULL end c1_8, case when 0 then c9 else NULL end c1_9, case when 0 then c10 else NULL end c1_10 from t;
desc t1;
Field	Type	Null	Key	Default	Extra
c1_1	int(4)	YES		NULL	
c1_2	int(6)	YES		NULL	
c1_3	int(9)	YES		NULL	
c1_4	int(11)	YES		NULL	
c1_5	bigint(20)	YES		NULL	
c1_6	int(3) unsigned	YES		NULL	
c1_7	int(5) unsigned	YES		NULL	
c1_8	int(8) unsigned	YES		NULL	
c1_9	int(10) unsigned	YES		NULL	
c1_10	bigint(20) unsigned	YES		NULL	
drop table t1;
create table t1 as select case when 0 then NULL else c1 end c1_1, case when 0 then NULL else c2 end c1_2, case when 0 then NULL else c3 end c1_3, case when 0 then NULL else c4 end c1_4, case when 0 then NULL else c5 end c1_5, case when 0 then NULL else c6 end c1_6, case when 0 then NULL else c7 end c1_7, case when 0 then NULL else c8 end c1_8, case when 0 then NULL else c9 end c1_9, case when 0 then NULL else c10 end c1_10 from t;
desc t1;
Field	Type	Null	Key	Default	Extra
c1_1	int(4)	YES		NULL	
c1_2	int(6)	YES		NULL	
c1_3	int(9)	YES		NULL	
c1_4	int(11)	YES		NULL	
c1_5	bigint(20)	YES		NULL	
c1_6	int(3) unsigned	YES		NULL	
c1_7	int(5) unsigned	YES		NULL	
c1_8	int(8) unsigned	YES		NULL	
c1_9	int(10) unsigned	YES		NULL	
c1_10	bigint(20) unsigned	YES		NULL	
drop table t1;
create table t1 as select lead(c1,0,NULL) OVER() c1_1, lead(c2, 0, NULL) OVER() c1_2, lead(c3, 0, NULL) OVER() c1_3, lead(c4, 0, NULL) OVER() c1_4, lead(c5, 0, NULL) OVER() c1_5, lead(c6, 0, NULL) OVER() c1_6, lead(c7, 0, NULL) OVER() c1_7, lead(c8, 0, NULL) OVER() c1_8, lead(c9, 0, NULL) OVER() c1_9, lead(c10, 0, NULL) OVER() c1_10 from t;
desc t1;
Field	Type	Null	Key	Default	Extra
c1_1	int(4)	YES		NULL	
c1_2	int(6)	YES		NULL	
c1_3	int(9)	YES		NULL	
c1_4	int(11)	YES		NULL	
c1_5	bigint(20)	YES		NULL	
c1_6	int(3) unsigned	YES		NULL	
c1_7	int(5) unsigned	YES		NULL	
c1_8	int(8) unsigned	YES		NULL	
c1_9	int(10) unsigned	YES		NULL	
c1_10	bigint(20) unsigned	YES		NULL	
drop table t1;
create table t1 as select lag(NULL,0,c1) OVER() c1_1, lag(NULL,0,c2) OVER() c1_2, lag(NULL,0,c3) OVER() c1_3, lag(NULL,0,c4) OVER() c1_4, lag(NULL,0,c5) OVER() c1_5, lag(NULL,0,c6) OVER() c1_6, lag(NULL,0,c7) OVER() c1_7, lag(NULL,0,c8) OVER() c1_8, lag(NULL,0,c9) OVER() c1_9, lag(NULL,0,c10) OVER() c1_10 from t;
desc t1;
Field	Type	Null	Key	Default	Extra
c1_1	int(4)	YES		NULL	
c1_2	int(6)	YES		NULL	
c1_3	int(9)	YES		NULL	
c1_4	int(11)	YES		NULL	
c1_5	bigint(20)	YES		NULL	
c1_6	int(3) unsigned	YES		NULL	
c1_7	int(5) unsigned	YES		NULL	
c1_8	int(8) unsigned	YES		NULL	
c1_9	int(10) unsigned	YES		NULL	
c1_10	bigint(20) unsigned	YES		NULL	
drop table t1;
drop table if exists t;
drop table if exists store_car_bd_0;
CREATE TABLE `store_car_bd_0` (
`useyears` decimal(19,0),
`d4_amount` decimal(16,2)
);
insert into store_car_bd_0 (useyears, d4_amount) values (0, 12.0), (1, 13.12), (0, 14.0), (1, 15.0);
select 1 union all 
select floor(case when ta.useyears=0 then ta.d4_amount else 0 end) as xin_car_cnt from store_car_bd_0 ta;
1
1
12
0
14
0
select 1 union all 
select floor(sum(case when ta.useyears=0 then ta.d4_amount else 0 end)) as xin_car_cnt from store_car_bd_0 ta;
1
1
26
alter system set _enable_decimal_int_type = false;
drop table if exists store_car_bd_0;
CREATE TABLE `store_car_bd_0` (
`useyears` decimal(19,0),
`d4_amount` decimal(16,2)
);
insert into store_car_bd_0 (useyears, d4_amount) values (0, 12.0), (1, 13.12), (0, 14.0), (1, 15.0);
select 1 union all 
select floor(case when ta.useyears=0 then ta.d4_amount else 0 end) as xin_car_cnt from store_car_bd_0 ta;
1
1
12
0
14
0
select 1 union all 
select floor(sum(case when ta.useyears=0 then ta.d4_amount else 0 end)) as xin_car_cnt from store_car_bd_0 ta;
1
1
26
alter system set _enable_decimal_int_type = true;
