set timestamp = 1600000000;
bugfix: 
cast time to date
drop table if exists t0;
bugfix: 
CREATE TABLE t0(z0_test0 DATE);
select cast(111.11111 as date);
cast(111.11111 as date)
2000-01-11
INSERT INTO t0 (z0_test0)values(111.11111);
ERROR 22007: Incorrect datetime value for column 'z0_test0' at row 1
drop table t0;
CREATE TABLE t0(z0_test0 TIME, z0_test1 char(50), z0_test2 date);
INSERT INTO t0 (z0_test0,z0_test1)values(NULL,NULL);
INSERT INTO t0 (z0_test0,z0_test1)values(111,222);
INSERT INTO t0 (z0_test0,z0_test1)values(111.1111,222);
select cast(z0_test0 as date) from t0;
cast(z0_test0 as date)
NULL
2020-09-13
2020-09-13
update t0 set z0_test2 = z0_test0;
select * from t0;
z0_test0	z0_test1	z0_test2
NULL	NULL	NULL
00:01:11	222	2020-09-13
00:01:11	222	2020-09-13
drop table t0;
cast year to date
create table t0(c1 year, c2 date);
insert into t0(c1) values(0);
select cast(c1 as date) from t0;
cast(c1 as date)
0000-00-00
update t0 set c2 = c1;
select * from t0;
c1	c2
0000	0000-00-00
delete from t0;
insert into t0(c1) values(1);
select cast(c1 as date) from t0;
cast(c1 as date)
NULL
update t0 set c2 = c1;
ERROR 22007: Incorrect datetime value for column 'c2' at row 1
delete from t0;
insert into t0(c1) values(100);
ERROR 22003: Out of range value for column 'c1' at row 1
insert into t0(c1) values(2000);
select cast(c1 as date) from t0;
cast(c1 as date)
NULL
update t0 set c2 = c1;
ERROR 22007: Incorrect datetime value for column 'c2' at row 1
drop table t0;
