select CAST(1-2 AS UNSIGNED);
CAST(1-2 AS UNSIGNED)
18446744073709551615
select CAST(CAST(1-2 AS UNSIGNED) AS SIGNED INTEGER);
CAST(CAST(1-2 AS UNSIGNED) AS SIGNED INTEGER)
-1
select CAST('10 ' as unsigned integer);
CAST('10 ' as unsigned integer)
10
Warnings:
Warning	1292	Truncated incorrect INTEGER value: '10 '
select cast(-5 as unsigned) | 1, cast(-5 as unsigned) & -1;
cast(-5 as unsigned) | 1	cast(-5 as unsigned) & -1
18446744073709551611	18446744073709551611
select cast(-5 as unsigned) -1, cast(-5 as unsigned) + 1;
cast(-5 as unsigned) -1	cast(-5 as unsigned) + 1
18446744073709551610	18446744073709551612
select ~5, cast(~5 as signed);
~5	cast(~5 as signed)
18446744073709551610	-6
select cast(5 as unsigned) -6.0;
cast(5 as unsigned) -6.0
-1.0
select cast(NULL as signed), cast(1/0 as signed);
cast(NULL as signed)	cast(1/0 as signed)
NULL	NULL
select cast(NULL as unsigned), cast(1/0 as unsigned);
cast(NULL as unsigned)	cast(1/0 as unsigned)
NULL	NULL
select cast("A" as binary) = "a", cast(BINARY "a" as CHAR) = "A";
cast("A" as binary) = "a"	cast(BINARY "a" as CHAR) = "A"
0	1
select cast("2001-1-1" as DATE), cast("2001-1-1" as DATETIME);
cast("2001-1-1" as DATE)	cast("2001-1-1" as DATETIME)
2001-01-01	2001-01-01 00:00:00
select cast("1:2:3" as TIME);
cast("1:2:3" as TIME)
01:02:03
select CONVERT("2004-01-22 21:45:33",DATE);
CONVERT("2004-01-22 21:45:33",DATE)
2004-01-22
select 10+'10';
10+'10'
20
select 10.0+'10';
10.0+'10'
20
select 10E+0+'10';
10E+0+'10'
20
SELECT CONVERT(TIMESTAMP "2004-01-22 21:45:33", CHAR);
CONVERT(TIMESTAMP "2004-01-22 21:45:33", CHAR)
2004-01-22 21:45:33
SELECT CONVERT(TIMESTAMP "2004-01-22 21:45:33", CHAR(4));
CONVERT(TIMESTAMP "2004-01-22 21:45:33", CHAR(4))
2004
SELECT CONVERT(TIMESTAMP "2004-01-22 21:45:33", BINARY(4));
CONVERT(TIMESTAMP "2004-01-22 21:45:33", BINARY(4))
2004
select CAST(TIMESTAMP "2004-01-22 21:45:33" AS BINARY(4));
CAST(TIMESTAMP "2004-01-22 21:45:33" AS BINARY(4))
2004
select CAST(0xb3 as signed);
CAST(0xb3 as signed)
179
select CAST(0x8fffffffffffffff as signed);
CAST(0x8fffffffffffffff as signed)
-8070450532247928833
select CAST(0xffffffffffffffff as unsigned);
CAST(0xffffffffffffffff as unsigned)
18446744073709551615
select CAST(0xfffffffffffffffe as signed);
CAST(0xfffffffffffffffe as signed)
-2
select cast('-10a' as signed integer);
cast('-10a' as signed integer)
-10
Warnings:
Warning	1292	Truncated incorrect INTEGER value: '-10a'
select cast('a10' as unsigned integer);
cast('a10' as unsigned integer)
0
Warnings:
Warning	1292	Truncated incorrect INTEGER value: 'a10'
select 10+'a';
10+'a'
10
Warnings:
Warning	1292	Truncated incorrect DOUBLE value: 'a'
select 10.0+cast('a' as decimal);
10.0+cast('a' as decimal)
10.0
Warnings:
Warning	1292	Truncated incorrect DECIMAL value: 'a'
select 10E+0+'a';
10E+0+'a'
10
Warnings:
Warning	1292	Truncated incorrect DOUBLE value: 'a'
select cast('18446744073709551616' as unsigned);
cast('18446744073709551616' as unsigned)
18446744073709551615
select cast('9223372036854775809' as signed);
cast('9223372036854775809' as signed)
9223372036854775807
select cast('abc' as signed);
cast('abc' as signed)
0
Warnings:
Warning	1292	Truncated incorrect INTEGER value: 'abc'
select cast('1a' as signed);
cast('1a' as signed)
1
Warnings:
Warning	1292	Truncated incorrect INTEGER value: '1a'
select cast('' as signed);
cast('' as signed)
0
Warnings:
Warning	1292	Truncated incorrect INTEGER value: ''
select cast(1000 as CHAR(3));
cast(1000 as CHAR(3))
100
select cast("2001-1-1" as date) = "2001-01-01";
cast("2001-1-1" as date) = "2001-01-01"
1
select cast("2001-1-1" as datetime) = "2001-01-01 00:00:00";
cast("2001-1-1" as datetime) = "2001-01-01 00:00:00"
1
select cast("1:2:3" as TIME) = "1:02:03";
cast("1:2:3" as TIME) = "1:02:03"
1
select cast(NULL as DATE);
cast(NULL as DATE)
NULL
select cast(NULL as BINARY);
cast(NULL as BINARY)
NULL
select date_add(cast('2004-12-30 12:00:00' as date), interval 0 hour);
date_add(cast('2004-12-30 12:00:00' as date), interval 0 hour)
2004-12-30 00:00:00
select timediff(cast('2004-12-30 12:00:00' as time), '12:00:00');
timediff(cast('2004-12-30 12:00:00' as time), '12:00:00')
00:00:00
select timediff(cast('1 12:00:00' as time), '12:00:00');
timediff(cast('1 12:00:00' as time), '12:00:00')
24:00:00
select cast(18446744073709551615 as unsigned);
cast(18446744073709551615 as unsigned)
18446744073709551615
select cast('18446744073709551615' as unsigned);
cast('18446744073709551615' as unsigned)
18446744073709551615
select cast('9223372036854775807' as signed);
cast('9223372036854775807' as signed)
9223372036854775807
select cast(concat('184467440','73709551615') as unsigned);
cast(concat('184467440','73709551615') as unsigned)
18446744073709551615
select cast(repeat('1',20) as unsigned);
cast(repeat('1',20) as unsigned)
11111111111111111111
select cast(1.0e+300 as signed int);
cast(1.0e+300 as signed int)
9223372036854775807
drop table if exists t1;
CREATE TABLE t1 (f1 double);
INSERT INTO t1 SET f1 = -1.0e+30 ;
INSERT INTO t1 SET f1 = +1.0e+30 ;
SELECT f1 AS double_val, CAST(f1 AS SIGNED INT) AS cast_val FROM t1;
double_val	cast_val
-1e30	-9223372036854775808
1e30	9223372036854775807
DROP TABLE t1;
select isnull(date(NULL)), isnull(cast(NULL as DATE));
isnull(date(NULL))	isnull(cast(NULL as DATE))
1	1
SELECT CAST(cast('01-01-01' as date) AS UNSIGNED);
CAST(cast('01-01-01' as date) AS UNSIGNED)
20010101
SELECT CAST(cast('01-01-01' as date) AS SIGNED);
CAST(cast('01-01-01' as date) AS SIGNED)
20010101
select cast('1.2' as decimal(3,2));
cast('1.2' as decimal(3,2))
1.20
select 1e18 * cast('1.2' as decimal(3,2));
1e18 * cast('1.2' as decimal(3,2))
1.2e18
select cast(cast('1.2' as decimal(3,2)) as signed);
cast(cast('1.2' as decimal(3,2)) as signed)
1
set @v1=1e18;
select cast(@v1 as decimal(22, 2));
cast(@v1 as decimal(22, 2))
1000000000000000000.00
select cast(-1e18 as decimal(22,2));
cast(-1e18 as decimal(22,2))
-1000000000000000000.00
create table t1(s1 time);
insert into t1 values ('11:11:11');
select cast(s1 as decimal(7,2)) from t1;
cast(s1 as decimal(7,2))
99999.99
drop table t1;
select cast(NULL as decimal(6)) as t1;
t1
NULL
select hex(cast('a' as char(2) binary));
hex(cast('a' as char(2) binary))
61
CREATE TABLE t1 (d1 datetime);
INSERT INTO t1(d1) VALUES ('2007-07-19 08:30:00'), (NULL),
('2007-07-19 08:34:00'), (NULL), ('2007-07-19 08:36:00');
SELECT cast(date(d1) as signed) FROM t1;
cast(date(d1) as signed)
20070719
NULL
20070719
NULL
20070719
drop table t1;
CREATE TABLE t1 (f1 DATE);
INSERT INTO t1 VALUES ('2007-07-19'), (NULL);
SELECT month(f1) FROM t1;
month(f1)
7
NULL
SELECT month(CAST('2007-07-19' AS DATE));
month(CAST('2007-07-19' AS DATE))
7
SELECT month(CAST(NULL AS DATE));
month(CAST(NULL AS DATE))
NULL
SELECT month(NULL);
month(NULL)
NULL
DROP TABLE t1;
SELECT HEX(CONVERT('a', BINARY(2049)));
HEX(CONVERT('a', BINARY(2049)))
610000000000000000000000000000000000000000000000000000000000000000000000000000000000000000000000000000000000000000000000000000000000000000000000000000000000000000000000000000000000000000000000000000000000000000000000000000000000000000000000000000000000000000000000000000000000000000000000000000000000000000000000000000000000000000000000000000000000000000000000000000000000000000000000000000000000000000000000000000000000000000000000000000000000000000000000000000000000000000000000000000000000000000000000000000000000000000000000000000000000000000000000000000000000000000000000000000000000000000000000000000000000000000000000000000000000000000000000000000000000000000000000000000000000000000000000000000000000000000000000000000000000000000000000000000000000000000000000000000000000000000000000000000000000000000000000000000000000000000000000000000000000000000000000000000000000000000000000000000000000000000000000000000000000000000000000000000000000000000000000000000000000000000000000000000000000000000000000000000000000000000000000000000000000000000000000000000000000000000000000000000000000000000000000000000000000000000000000000000000000000000000000000000000000000000000000000000000000000000000000000000000000000000000000000000000000000000000000000000000000000000000000000000000000000000000000000000000000000000000000000000000000000000000000000000000000000000000000000000000000000000000000000000000000000000000000000000000000000000000000000000000000000000000000000000000000000000000000000000000000000000000000000000000000000000000000000000000000000000000000000000000000000000000000000000000000000000000000000000000000000000000000000000000000000000000000000000000000000000000000000000000000000000000000000000000000000000000000000000000000000000000000000000000000000000000000000000000000000000000000000000000000000000000000000000000000000000000000000000000000000000000000000000000000000000000000000000000000000000000000000000000000000000000000000000000000000000000000000000000000000000000000000000000000000000000000000000000000000000000000000000000000000000000000000000000000000000000000000000000000000000000000000000000000000000000000000000000000000000000000000000000000000000000000000000000000000000000000000000000000000000000000000000000000000000000000000000000000000000000000000000000000000000000000000000000000000000000000000000000000000000000000000000000000000000000000000000000000000000000000000000000000000000000000000000000000000000000000000000000000000000000000000000000000000000000000000000000000000000000000000000000000000000000000000000000000000000000000000000000000000000000000000000000000000000000000000000000000000000000000000000000000000000000000000000000000000000000000000000000000000000000000000000000000000000000000000000000000000000000000000000000000000000000000000000000000000000000000000000000000000000000000000000000000000000000000000000000000000000000000000000000000000000000000000000000000000000000000000000000000000000000000000000000000000000000000000000000000000000000000000000000000000000000000000000000000000000000000000000000000000000000000000000000000000000000000000000000000000000000000000000000000000000000000000000000000000000000000000000000000000000000000000000000000000000000000000000000000000000000000000000000000000000000000000000000000000000000000000000000000000000000000000000000000000000000000000000000000000000000000000000000000000000000000000000000000000000000000000000000000000000000000000000000000000000000000000000000000000000000000000000000000000000000000000000000000000000000000000000000000000000000000000000000000000000000000000000000000000000000000000000000000000000000000000000000000000000000000000000000000000000000000000000000000000000000000000000000000000000000000000000000000000000000000000000000000000000000000000000000000000000000000000000000000000000000000000000000000000000000000000000000000000000000000000000000000000000000000000000000000000000000000000000000000000000000000000000000000000000000000000000000000000000000000000000000000000000000000000000000000000000000000000000000000000000000000000000000000000000000000000000000000000000
SELECT CONVERT('a', CHAR(2049));
CONVERT('a', CHAR(2049))
a
select cast(1 as decimal(3,100000));
ERROR 42000: For float(M,D), double(M,D) or decimal(M,D), M must be >= D (column '1').
select convert(1, decimal(3,100000));
ERROR 42000: For float(M,D), double(M,D) or decimal(M,D), M must be >= D (column '1').
select cast(1 as decimal(100000, 3));
ERROR 42000: Too big precision 32738 specified for column '1'. Maximum is 65.
select convert(1, decimal(100000, 3));
ERROR 42000: Too big precision 32738 specified for column '1'. Maximum is 65.
select convert(1, decimal(100000,100000));
ERROR 42000: Too big precision 32738 specified for column '1'. Maximum is 65.
select cast(1 as decimal(100000, 100000));
ERROR 42000: Too big precision 32738 specified for column '1'. Maximum is 65.
drop table if exists t1;
create table t1(c1 timestamp);
insert into t1 values('2016-01-01 01:01:01');
select case c1 when 0.00000 then '' end from t1;
case c1 when 0.00000 then '' end
NULL
select collation(cast('a' as binary(10)));
collation(cast('a' as binary(10)))
binary
select collation(cast('a' as char(10)));
collation(cast('a' as char(10)))
utf8mb4_general_ci
select length(cast('a' as binary(10)));
length(cast('a' as binary(10)))
10
select length(cast('a' as char(10)));
length(cast('a' as char(10)))
1
drop table if exists t1;
drop table if exists t2;
CREATE TABLE t1 (c1 int(80) DEFAULT NULL) ;
CREATE TABLE t2 (c2 varbinary(60) NOT NULL) ;
insert into t2 values ('hello'),('oceanbase');
select c1, length(c1) from ((select c1 from t1 ) union (select c2 from t2)) a;
c1	length(c1)
hello	5
oceanbase	9
drop table if exists t1;
drop table if exists t2;
CREATE TABLE t1 (c1 varchar(10), c2 char(10) DEFAULT NULL) ;
insert into t1 (c1) values(cast('abced' as binary(2)));
ERROR 22007: Incorrect value
insert into t1 (c1) values(cast('abced' as char(2)));
ERROR 22007: Incorrect value
insert into t1 (c1) values(cast('abced' as binary(5)));
insert into t1 values(cast('abced' as binary(5)), cast('a' as binary(0)));
ERROR 22007: Incorrect value
insert into t1 values(cast('abced' as binary(5)), cast('a' as char(0)));
ERROR 22007: Incorrect value
select * from t1;
c1	c2
abced	NULL
drop table if exists t1;
SELECT CAST(1 AS TIME(100));
ERROR 42000: Too big precision 100 specified for column 'CAST'. Maximum is 6.
SELECT CAST(1 AS DATETIME(100));
ERROR 42000: Too big precision 100 specified for column 'CAST'. Maximum is 6.
SELECT CAST(1 AS TIME(0));
CAST(1 AS TIME(0))
00:00:01
SELECT CAST(1 AS DATETIME(0));
CAST(1 AS DATETIME(0))
NULL
SELECT CAST(1 AS TIME(6));
CAST(1 AS TIME(6))
00:00:01.000000
SELECT CAST(1 AS DATETIME(6));
CAST(1 AS DATETIME(6))
NULL
select cast(1 as decimal(0));
cast(1 as decimal(0))
1
select cast(123 as decimal(0));
cast(123 as decimal(0))
123
select cast(1234567891 as decimal(0));
cast(1234567891 as decimal(0))
1234567891
select cast(12345678910 as decimal(0));
cast(12345678910 as decimal(0))
9999999999
select cast('9999-12-31 23:59:59.998' as datetime);
cast('9999-12-31 23:59:59.998' as datetime)
NULL
select cast('9999-12-31 23:59:59.998' as datetime(6));
cast('9999-12-31 23:59:59.998' as datetime(6))
9999-12-31 23:59:59.998000
DROP TABLE if exists t1;
CREATE TABLE t1 (a VARCHAR(32));
INSERT INTO t1 VALUES('9999-12-31 23:59:59.0000009'), ('9999-12-31 23:59:59.9'),('2001-01-01 10:10:10.9999994'), ('2001-01-01 10:10:10.9999995');
SELECT a, CAST(a AS DATETIME) FROM t1;
a	CAST(a AS DATETIME)
9999-12-31 23:59:59.0000009	9999-12-31 23:59:59
9999-12-31 23:59:59.9	NULL
2001-01-01 10:10:10.9999994	2001-01-01 10:10:11
2001-01-01 10:10:10.9999995	2001-01-01 10:10:11
DROP TABLE if exists t1;
result_format: 4
select length(cast('a' as binary(-1))) as a from dual;
ERROR 42000: You have an error in your SQL syntax; check the manual that corresponds to your OceanBase version for the right syntax to use near '-1))) as a from dual' at line 1
select length(cast('a' as binary(0))) as a from dual;
+---+
| a |
+---+
| 0 |
+---+
select length(cast('a' as binary(4194304))) as a from dual;
+---------+
| a       |
+---------+
| 4194304 |
+---------+
select length(cast('a' as binary(4194305))) as a from dual;
+---+
| a |
+---+
| NULL |
+---+
Warnings:
Warning	1301	Result of cast() was larger than max_allowed_packet (4194304) - truncated
select length(cast('a' as binary(2147483647))) as a from dual;
+---+
| a |
+---+
| NULL |
+---+
Warnings:
Warning	1301	Result of cast() was larger than max_allowed_packet (4194304) - truncated
select length(cast('a' as binary(2147483648))) as a from dual;
+---+
| a |
+---+
| 1 |
+---+
select length(cast('a' as binary(4294967295))) as a from dual;
+---+
| a |
+---+
| 1 |
+---+
select length(cast('a' as binary(4294967296))) as a from dual;
ERROR 42000: Display width out of range for column 'cast of char' (max = 4294967295)

select length(cast('阿' as binary(1))) as a from dual;
+---+
| a |
+---+
| 1 |
+---+
select length(cast('阿' as binary(2))) as a from dual;
+---+
| a |
+---+
| 2 |
+---+
select length(cast('阿' as binary(3))) as a from dual;
+---+
| a |
+---+
| 3 |
+---+
select length(cast('阿' as binary(4))) as a from dual;
+---+
| a |
+---+
| 4 |
+---+
select length(cast('阿' as binary(5))) as a from dual;
+---+
| a |
+---+
| 5 |
+---+

select length(cast('阿斯蒂芬' as binary(1))) as a from dual;
+---+
| a |
+---+
| 1 |
+---+
select length(cast('阿斯蒂芬' as binary(2))) as a from dual;
+---+
| a |
+---+
| 2 |
+---+
select length(cast('阿斯蒂芬' as binary(3))) as a from dual;
+---+
| a |
+---+
| 3 |
+---+
select length(cast('阿斯蒂芬' as binary(4))) as a from dual;
+---+
| a |
+---+
| 4 |
+---+
select length(cast('阿斯蒂芬' as binary(5))) as a from dual;
+---+
| a |
+---+
| 5 |
+---+

drop table if exists t2;
create table t2(c1 decimal(65, 30));
insert into t2 values
(0.92345678901234567890123), (0.92), (0.12), (0.1234567890123456789012),
(10.92345678901234567890123), (10.92), (10.12), (10.1234567890123456789012),
(-0.92345678901234567890123), (-0.92), (-0.12), (-0.1234567890123456789012),
(-10.92345678901234567890123), (-10.92), (-10.12), (-10.1234567890123456789012);
select c1, cast(c1 as signed) from t2;
+------------------------------------+--------------------+
| c1                                 | cast(c1 as signed) |
+------------------------------------+--------------------+
|   0.923456789012345678901230000000 |                  1 |
|   0.920000000000000000000000000000 |                  1 |
|   0.120000000000000000000000000000 |                  0 |
|   0.123456789012345678901200000000 |                  0 |
|  10.923456789012345678901230000000 |                 11 |
|  10.920000000000000000000000000000 |                 11 |
|  10.120000000000000000000000000000 |                 10 |
|  10.123456789012345678901200000000 |                 10 |
|  -0.923456789012345678901230000000 |                 -1 |
|  -0.920000000000000000000000000000 |                 -1 |
|  -0.120000000000000000000000000000 |                  0 |
|  -0.123456789012345678901200000000 |                  0 |
| -10.923456789012345678901230000000 |                -11 |
| -10.920000000000000000000000000000 |                -11 |
| -10.120000000000000000000000000000 |                -10 |
| -10.123456789012345678901200000000 |                -10 |
+------------------------------------+--------------------+
select c1, cast(c1 as unsigned) from t2;
+------------------------------------+----------------------+
| c1                                 | cast(c1 as unsigned) |
+------------------------------------+----------------------+
|   0.923456789012345678901230000000 |                    1 |
|   0.920000000000000000000000000000 |                    1 |
|   0.120000000000000000000000000000 |                    0 |
|   0.123456789012345678901200000000 |                    0 |
|  10.923456789012345678901230000000 |                   11 |
|  10.920000000000000000000000000000 |                   11 |
|  10.120000000000000000000000000000 |                   10 |
|  10.123456789012345678901200000000 |                   10 |
|  -0.923456789012345678901230000000 |                    0 |
|  -0.920000000000000000000000000000 |                    0 |
|  -0.120000000000000000000000000000 |                    0 |
|  -0.123456789012345678901200000000 |                    0 |
| -10.923456789012345678901230000000 |                    0 |
| -10.920000000000000000000000000000 |                    0 |
| -10.120000000000000000000000000000 |                    0 |
| -10.123456789012345678901200000000 |                    0 |
+------------------------------------+----------------------+

drop table if exists t1;
create table t1 (pk int , c1 bigint);
insert into t1 values(1, 140);
select c1, cast(c1/COALESCE(142,2377,99) as signed)from t1 where c1=140;
+------+------------------------------------------+
| c1   | cast(c1/COALESCE(142,2377,99) as signed) |
+------+------------------------------------------+
|  140 |                                        1 |
+------+------------------------------------------+
select 140, cast(140/COALESCE( 142 , 23773 , 99 ) as signed);
+-----+--------------------------------------------------+
| 140 | cast(140/COALESCE( 142 , 23773 , 99 ) as signed) |
+-----+--------------------------------------------------+
| 140 |                                                1 |
+-----+--------------------------------------------------+
select c1, cast(c1/COALESCE(142,2377,99) as unsigned)from t1 where c1=140;
+------+--------------------------------------------+
| c1   | cast(c1/COALESCE(142,2377,99) as unsigned) |
+------+--------------------------------------------+
|  140 |                                          1 |
+------+--------------------------------------------+
select 140, cast(140/COALESCE( 142 , 23773 , 99 ) as unsigned);
+-----+----------------------------------------------------+
| 140 | cast(140/COALESCE( 142 , 23773 , 99 ) as unsigned) |
+-----+----------------------------------------------------+
| 140 |                                                  1 |
+-----+----------------------------------------------------+

drop table t1;
create table t1(c1 decimal(65, 1));
insert into t1 values(11111111111111111111111111111111);
insert into t1 values(-11111111111111111111111111111111);
select cast(c1 as signed) from t1;
+----------------------+
| cast(c1 as signed)   |
+----------------------+
|  9223372036854775807 |
| -9223372036854775808 |
+----------------------+
select cast(c1 as unsigned) from t1;
+----------------------+
| cast(c1 as unsigned) |
+----------------------+
| 18446744073709551615 |
|                    0 |
+----------------------+


bugfix: 
## test cast float to int
drop table t1;
create table t1(c1 float, c2 tinyint, c3 smallint, c4 mediumint, c5 int, c6 bigint);
insert into t1(c1) values(0.5);
insert into t1(c1) values(1.5);
insert into t1(c1) values(2.5);
insert into t1(c1) values(3.5);
insert into t1(c1) values(99.5);
insert into t1(c1) values(100.5);
insert into t1(c1) values(127);
insert into t1 select -c1, c2, c3, c4, c5, c6 from t1;
insert into t1(c1) values(127.4);
insert into t1(c1) values(-128.4);
insert into t1(c1) values(-128.5);
### 127.4和-128.5可以cast到tinyint范围内, 即[-128, 127]
update t1 set c2 = c1;
### 127.5和-128.50001 cast到tinyint以后超出范围
insert into t1(c1) values(127.5);
update t1 set c2 = c1;
ERROR 22003: Out of range value for column 'c2' at row 18
insert into t1(c1) values(-128.50001);
update t1 set c2 = c1 where c1 < 0;
ERROR 22003: Out of range value for column 'c2' at row 10

insert into t1(c1) values(32765.5);
insert into t1(c1) values(32766.5);
insert into t1(c1) values(32767);
insert into t1(c1) values(32767.4);
insert into t1 select -c1, c2, c3, c4, c5, c6 from t1 where c1 > 129;
insert into t1 (c1) values(-32768);
insert into t1 (c1) values(-32768.4);
insert into t1 (c1) values(-32768.5);
insert into t1(c1) values(-32768.501);
### 32767.4和-32768.501可以cast到smallint范围内, 即[-32768, 32767]
update t1 set c3 = c1;
### 32767.5和-32768.51 cast到smallint以后超出范围
insert into t1(c1) values(32767.5);
update t1 set c3 = c1;
ERROR 22003: Out of range value for column 'c3' at row 32
insert into t1(c1) values(-32768.51);
update t1 set c3 = c1 where c1 < 0;
ERROR 22003: Out of range value for column 'c3' at row 19

insert into t1(c1) values(8388605.5);
insert into t1(c1) values(8388606.5);
insert into t1(c1) values(8388607);
insert into t1(c1) values(8388607.2);
insert into t1 select -c1, c2, c3, c4, c5, c6 from t1 where c1 > 32770;
insert into t1 (c1) values(-8388608);
insert into t1 (c1) values(-8388608.4);
insert into t1 (c1) values(-8388608.5);
### 8388607.2和-8388608.5可以cast到mediumint范围内, 即[-8388608, 8388607]
update t1 set c4 = c1;
### 8388607.3和-8388608.50001 cast到mediumint以后超出范围
insert into t1(c1) values(8388607.3);
update t1 set c4 = c1;
ERROR 22003: Out of range value for column 'c4' at row 45
insert into t1(c1) values(-8388608.50001);
update t1 set c4 = c1 where c1 < 0;
ERROR 22003: Out of range value for column 'c4' at row 27

insert into t1(c1) values(2147483581.5);
insert into t1(c1) values(2147483582.5);
insert into t1(c1) values(2147483583.5);
insert into t1(c1) values(-2147483773.5);
insert into t1(c1) values(-2147483774.5);
insert into t1(c1) values(-2147483775.5);
insert into t1(c1) values(-2147483776);
### 2147483583和-2147483776可以cast到int范围内, 即[-2147483648, 2147483647]
update t1 set c5 = c1;
### 2147483584和-2147483777 cast到int以后超出范围
insert into t1(c1) values(2147483584);
update t1 set c5 = c1;
ERROR 22003: Out of range value for column 'c5' at row 54
insert into t1(c1) values(-2147483777);
update t1 set c5 = c1 where c1 < 0;
ERROR 22003: Out of range value for column 'c5' at row 32

insert into t1(c1) values(9223372586610590719.5);
insert into t1(c1) values(-9223372586610590719.5);
### 9223372586610590719.5和-9223372586610590719.5可以cast到bigint范围内, 即[-9223372036854775808, 9223372036854775807]
update t1 set c6 = c1;
### 9223372586610590720.5和-9223372586610590720.5 cast到bigint以后超出范围
insert into t1(c1) values(9223372586610590720.5);
update t1 set c6 = c1;
ERROR 22003: Out of range value for column 'c6' at row 58
insert into t1(c1) values(-9223372586610590720.5);
update t1 set c6 = c1 where c1 < 0;
ERROR 22003: Out of range value for column 'c6' at row 34

insert into t1(c1) values(10223372586610590720.5);
insert into t1(c1) values(-10223372586610590720.5);
select c1, c2, c3, c4, c5, c6, cast(c1 as signed) from t1;
+-------------+------+--------+----------+-------------+----------------------+----------------------+
| c1          | c2   | c3     | c4       | c5          | c6                   | cast(c1 as signed)   |
+-------------+------+--------+----------+-------------+----------------------+----------------------+
|         0.5 |    0 |      0 |        0 |           0 |                    0 |                    0 |
|         1.5 |    2 |      2 |        2 |           2 |                    2 |                    2 |
|         2.5 |    2 |      2 |        2 |           2 |                    2 |                    2 |
|         3.5 |    4 |      4 |        4 |           4 |                    4 |                    4 |
|        99.5 |  100 |    100 |      100 |         100 |                  100 |                  100 |
|       100.5 |  100 |    100 |      100 |         100 |                  100 |                  100 |
|         127 |  127 |    127 |      127 |         127 |                  127 |                  127 |
|        -0.5 |    0 |      0 |        0 |           0 |                    0 |                    0 |
|        -1.5 |   -2 |     -2 |       -2 |          -2 |                   -2 |                   -2 |
|        -2.5 |   -2 |     -2 |       -2 |          -2 |                   -2 |                   -2 |
|        -3.5 |   -4 |     -4 |       -4 |          -4 |                   -4 |                   -4 |
|       -99.5 | -100 |   -100 |     -100 |        -100 |                 -100 |                 -100 |
|      -100.5 | -100 |   -100 |     -100 |        -100 |                 -100 |                 -100 |
|        -127 | -127 |   -127 |     -127 |        -127 |                 -127 |                 -127 |
|       127.4 |  127 |    127 |      127 |         127 |                  127 |                  127 |
|      -128.4 | -128 |   -128 |     -128 |        -128 |                 -128 |                 -128 |
|      -128.5 | -128 |   -128 |     -128 |        -128 |                 -128 |                 -128 |
|       127.5 | NULL |    128 |      128 |         128 |                  128 |                  128 |
|      -128.5 | NULL |   -129 |     -129 |        -129 |                 -129 |                 -129 |
|     32765.5 | NULL |  32766 |    32766 |       32766 |                32766 |                32766 |
|     32766.5 | NULL |  32766 |    32766 |       32766 |                32766 |                32766 |
|       32767 | NULL |  32767 |    32767 |       32767 |                32767 |                32767 |
|     32767.4 | NULL |  32767 |    32767 |       32767 |                32767 |                32767 |
|    -32765.5 | NULL | -32766 |   -32766 |      -32766 |               -32766 |               -32766 |
|    -32766.5 | NULL | -32766 |   -32766 |      -32766 |               -32766 |               -32766 |
|      -32767 | NULL | -32767 |   -32767 |      -32767 |               -32767 |               -32767 |
|    -32767.4 | NULL | -32767 |   -32767 |      -32767 |               -32767 |               -32767 |
|      -32768 | NULL | -32768 |   -32768 |      -32768 |               -32768 |               -32768 |
|    -32768.4 | NULL | -32768 |   -32768 |      -32768 |               -32768 |               -32768 |
|    -32768.5 | NULL | -32768 |   -32768 |      -32768 |               -32768 |               -32768 |
|    -32768.5 | NULL | -32768 |   -32768 |      -32768 |               -32768 |               -32768 |
|     32767.5 | NULL |   NULL |    32768 |       32768 |                32768 |                32768 |
|    -32768.5 | NULL |   NULL |   -32769 |      -32769 |               -32769 |               -32769 |
|     8388610 | NULL |   NULL |  8388606 |     8388606 |              8388606 |              8388606 |
|     8388610 | NULL |   NULL |  8388606 |     8388606 |              8388606 |              8388606 |
|     8388610 | NULL |   NULL |  8388607 |     8388607 |              8388607 |              8388607 |
|     8388610 | NULL |   NULL |  8388607 |     8388607 |              8388607 |              8388607 |
|    -8388610 | NULL |   NULL | -8388606 |    -8388606 |             -8388606 |             -8388606 |
|    -8388610 | NULL |   NULL | -8388606 |    -8388606 |             -8388606 |             -8388606 |
|    -8388610 | NULL |   NULL | -8388607 |    -8388607 |             -8388607 |             -8388607 |
|    -8388610 | NULL |   NULL | -8388607 |    -8388607 |             -8388607 |             -8388607 |
|    -8388610 | NULL |   NULL | -8388608 |    -8388608 |             -8388608 |             -8388608 |
|    -8388610 | NULL |   NULL | -8388608 |    -8388608 |             -8388608 |             -8388608 |
|    -8388610 | NULL |   NULL | -8388608 |    -8388608 |             -8388608 |             -8388608 |
|     8388610 | NULL |   NULL |     NULL |     8388608 |              8388608 |              8388608 |
|    -8388610 | NULL |   NULL |     NULL |    -8388609 |             -8388609 |             -8388609 |
|  2147480000 | NULL |   NULL |     NULL |  2147483520 |           2147483520 |           2147483520 |
|  2147480000 | NULL |   NULL |     NULL |  2147483520 |           2147483520 |           2147483520 |
|  2147480000 | NULL |   NULL |     NULL |  2147483520 |           2147483520 |           2147483520 |
| -2147480000 | NULL |   NULL |     NULL | -2147483648 |          -2147483648 |          -2147483648 |
| -2147480000 | NULL |   NULL |     NULL | -2147483648 |          -2147483648 |          -2147483648 |
| -2147480000 | NULL |   NULL |     NULL | -2147483648 |          -2147483648 |          -2147483648 |
| -2147480000 | NULL |   NULL |     NULL | -2147483648 |          -2147483648 |          -2147483648 |
|  2147480000 | NULL |   NULL |     NULL |        NULL |           2147483648 |           2147483648 |
| -2147480000 | NULL |   NULL |     NULL |        NULL |          -2147483904 |          -2147483904 |
|  9.22337e18 | NULL |   NULL |     NULL |        NULL |  9223372036854775807 | -9223372036854775808 |
| -9.22337e18 | NULL |   NULL |     NULL |        NULL | -9223372036854775808 | -9223372036854775808 |
|  9.22337e18 | NULL |   NULL |     NULL |        NULL |                 NULL | -9223372036854775808 |
| -9.22337e18 | NULL |   NULL |     NULL |        NULL |                 NULL | -9223372036854775808 |
|  1.02234e19 | NULL |   NULL |     NULL |        NULL |                 NULL | -9223372036854775808 |
| -1.02234e19 | NULL |   NULL |     NULL |        NULL |                 NULL | -9223372036854775808 |
+-------------+------+--------+----------+-------------+----------------------+----------------------+


## test cast float to unsigned int
drop table t1;
create table t1(c1 float, c2 tinyint unsigned, c3 smallint unsigned, c4 mediumint unsigned, c5 int unsigned, c6 bigint unsigned);
insert into t1(c1) values(-0.5);
insert into t1(c1) values(0);
insert into t1(c1) values(0.5);
insert into t1(c1) values(1.5);
insert into t1(c1) values(2.5);
insert into t1(c1) values(3.5);
insert into t1(c1) values(99.5);
insert into t1(c1) values(100.5);
insert into t1(c1) values(255);
insert into t1(c1) values(255.4);
### -0.5和255.4可以cast到tinyint unsigned范围内, 即[0, 255]
update t1 set c2 = c1;
### -0.50001和255.5 cast到tinyint以后超出范围
insert into t1(c1) values(-0.50001);
update t1 set c2 = c1;
ERROR 22003: Out of range value for column 'c2' at row 11
select c1, c2, c3, c4, c5, c6, cast(c1 as unsigned) from t1;
+----------+------+------+------+------+------+----------------------+
| c1       | c2   | c3   | c4   | c5   | c6   | cast(c1 as unsigned) |
+----------+------+------+------+------+------+----------------------+
|     -0.5 |    0 | NULL | NULL | NULL | NULL |                    0 |
|        0 |    0 | NULL | NULL | NULL | NULL |                    0 |
|      0.5 |    0 | NULL | NULL | NULL | NULL |                    0 |
|      1.5 |    2 | NULL | NULL | NULL | NULL |                    2 |
|      2.5 |    2 | NULL | NULL | NULL | NULL |                    2 |
|      3.5 |    4 | NULL | NULL | NULL | NULL |                    4 |
|     99.5 |  100 | NULL | NULL | NULL | NULL |                  100 |
|    100.5 |  100 | NULL | NULL | NULL | NULL |                  100 |
|      255 |  255 | NULL | NULL | NULL | NULL |                  255 |
|    255.4 |  255 | NULL | NULL | NULL | NULL |                  255 |
| -0.50001 | NULL | NULL | NULL | NULL | NULL | 18446744073709551615 |
+----------+------+------+------+------+------+----------------------+
delete from t1;
insert into t1(c1) values(255.5);
update t1 set c2 = c1;
ERROR 22003: Out of range value for column 'c2' at row 1

delete from t1;
insert into t1(c1) values(-0.5);
insert into t1(c1) values(0);
insert into t1(c1) values(0.5);
insert into t1(c1) values(1.5);
insert into t1(c1) values(2.5);
insert into t1(c1) values(3.5);
insert into t1(c1) values(99.5);
insert into t1(c1) values(100.5);
insert into t1(c1) values(65535);
insert into t1(c1) values(65535.4);
### -0.5和65535.4可以cast到smallint unsigned范围内, 即[0, 65535]
update t1 set c3 = c1;
### -0.50001和65535.5 cast到smallint unsigned以后超出范围
insert into t1(c1) values(-0.50001);
update t1 set c3 = c1;
ERROR 22003: Out of range value for column 'c3' at row 11
select c1, c2, c3, c4, c5, c6, cast(c1 as unsigned) from t1;
+----------+------+-------+------+------+------+----------------------+
| c1       | c2   | c3    | c4   | c5   | c6   | cast(c1 as unsigned) |
+----------+------+-------+------+------+------+----------------------+
|     -0.5 | NULL |     0 | NULL | NULL | NULL |                    0 |
|        0 | NULL |     0 | NULL | NULL | NULL |                    0 |
|      0.5 | NULL |     0 | NULL | NULL | NULL |                    0 |
|      1.5 | NULL |     2 | NULL | NULL | NULL |                    2 |
|      2.5 | NULL |     2 | NULL | NULL | NULL |                    2 |
|      3.5 | NULL |     4 | NULL | NULL | NULL |                    4 |
|     99.5 | NULL |   100 | NULL | NULL | NULL |                  100 |
|    100.5 | NULL |   100 | NULL | NULL | NULL |                  100 |
|    65535 | NULL | 65535 | NULL | NULL | NULL |                65535 |
|  65535.4 | NULL | 65535 | NULL | NULL | NULL |                65535 |
| -0.50001 | NULL |  NULL | NULL | NULL | NULL | 18446744073709551615 |
+----------+------+-------+------+------+------+----------------------+
delete from t1;
insert into t1(c1) values(65535.5);
update t1 set c3 = c1;
ERROR 22003: Out of range value for column 'c3' at row 1

delete from t1;
insert into t1(c1) values(-0.5);
insert into t1(c1) values(0);
insert into t1(c1) values(0.5);
insert into t1(c1) values(1.5);
insert into t1(c1) values(2.5);
insert into t1(c1) values(3.5);
insert into t1(c1) values(99.5);
insert into t1(c1) values(100.5);
insert into t1(c1) values(16777215);
insert into t1(c1) values(16777215.4);
### -0.5和16777215.4可以cast到mediumint unsigned范围内, 即[0, 16777215]
update t1 set c4 = c1;
### -0.50001和16777215.5 cast到mediumint unsigned以后超出范围
insert into t1(c1) values(-0.50001);
update t1 set c4 = c1;
ERROR 22003: Out of range value for column 'c4' at row 11
select c1, c2, c3, c4, c5, c6, cast(c1 as unsigned) from t1;
+----------+------+------+----------+------+------+----------------------+
| c1       | c2   | c3   | c4       | c5   | c6   | cast(c1 as unsigned) |
+----------+------+------+----------+------+------+----------------------+
|     -0.5 | NULL | NULL |        0 | NULL | NULL |                    0 |
|        0 | NULL | NULL |        0 | NULL | NULL |                    0 |
|      0.5 | NULL | NULL |        0 | NULL | NULL |                    0 |
|      1.5 | NULL | NULL |        2 | NULL | NULL |                    2 |
|      2.5 | NULL | NULL |        2 | NULL | NULL |                    2 |
|      3.5 | NULL | NULL |        4 | NULL | NULL |                    4 |
|     99.5 | NULL | NULL |      100 | NULL | NULL |                  100 |
|    100.5 | NULL | NULL |      100 | NULL | NULL |                  100 |
| 16777200 | NULL | NULL | 16777215 | NULL | NULL |             16777215 |
| 16777200 | NULL | NULL | 16777215 | NULL | NULL |             16777215 |
| -0.50001 | NULL | NULL |     NULL | NULL | NULL | 18446744073709551615 |
+----------+------+------+----------+------+------+----------------------+
delete from t1;
insert into t1(c1) values(16777215.5);
update t1 set c4 = c1;
ERROR 22003: Out of range value for column 'c4' at row 1


delete from t1;
insert into t1(c1) values(-0.5);
insert into t1(c1) values(0);
insert into t1(c1) values(0.5);
insert into t1(c1) values(1.5);
insert into t1(c1) values(2.5);
insert into t1(c1) values(3.5);
insert into t1(c1) values(99.5);
insert into t1(c1) values(100.5);
insert into t1(c1) values(4294967167);
### -0.4294967167可以cast到int unsigned范围内, 即[0, 4294967295]
update t1 set c5 = c1;
### -0.50001和4294967168 cast到int unsigned以后超出范围
insert into t1(c1) values(-0.50001);
update t1 set c5 = c1;
ERROR 22003: Out of range value for column 'c5' at row 10
select c1, c2, c3, c4, c5, c6, cast(c1 as unsigned) from t1;
+------------+------+------+------+------------+------+----------------------+
| c1         | c2   | c3   | c4   | c5         | c6   | cast(c1 as unsigned) |
+------------+------+------+------+------------+------+----------------------+
|       -0.5 | NULL | NULL | NULL |          0 | NULL |                    0 |
|          0 | NULL | NULL | NULL |          0 | NULL |                    0 |
|        0.5 | NULL | NULL | NULL |          0 | NULL |                    0 |
|        1.5 | NULL | NULL | NULL |          2 | NULL |                    2 |
|        2.5 | NULL | NULL | NULL |          2 | NULL |                    2 |
|        3.5 | NULL | NULL | NULL |          4 | NULL |                    4 |
|       99.5 | NULL | NULL | NULL |        100 | NULL |                  100 |
|      100.5 | NULL | NULL | NULL |        100 | NULL |                  100 |
| 4294970000 | NULL | NULL | NULL | 4294967040 | NULL |           4294967040 |
|   -0.50001 | NULL | NULL | NULL |       NULL | NULL | 18446744073709551615 |
+------------+------+------+------+------------+------+----------------------+
delete from t1;
insert into t1(c1) values(4294967168);
update t1 set c5 = c1;
ERROR 22003: Out of range value for column 'c5' at row 1

delete from t1;
insert into t1(c1) values(-0.5);
insert into t1(c1) values(0);
insert into t1(c1) values(0.5);
insert into t1(c1) values(1.5);
insert into t1(c1) values(2.5);
insert into t1(c1) values(3.5);
insert into t1(c1) values(99.5);
insert into t1(c1) values(100.5);
insert into t1(c1) values(18446743523953736703);
### -0.5和18446743523953736703可以cast到bigint unsigned范围内, 即[0, 18446744073709551615]
update t1 set c6 = c1;
### -0.50001和18446743523953736704 cast到bigint unsigned以后超出范围
insert into t1(c1) values(-0.50001);
update t1 set c6 = c1;
ERROR 22003: Out of range value for column 'c6' at row 10
select c1, c2, c3, c4, c5, c6, cast(c1 as unsigned) from t1;
+------------+------+------+------+------+----------------------+----------------------+
| c1         | c2   | c3   | c4   | c5   | c6                   | cast(c1 as unsigned) |
+------------+------+------+------+------+----------------------+----------------------+
|       -0.5 | NULL | NULL | NULL | NULL |                    0 |                    0 |
|          0 | NULL | NULL | NULL | NULL |                    0 |                    0 |
|        0.5 | NULL | NULL | NULL | NULL |                    0 |                    0 |
|        1.5 | NULL | NULL | NULL | NULL |                    2 |                    2 |
|        2.5 | NULL | NULL | NULL | NULL |                    2 |                    2 |
|        3.5 | NULL | NULL | NULL | NULL |                    4 |                    4 |
|       99.5 | NULL | NULL | NULL | NULL |                  100 |                  100 |
|      100.5 | NULL | NULL | NULL | NULL |                  100 |                  100 |
| 1.84467e19 | NULL | NULL | NULL | NULL | 18446742974197923840 |  9223372036854775808 |
|   -0.50001 | NULL | NULL | NULL | NULL |                 NULL | 18446744073709551615 |
+------------+------+------+------+------+----------------------+----------------------+
delete from t1;
insert into t1(c1) values(18446743523953736704);
update t1 set c6 = c1;
ERROR 22003: Out of range value for column 'c6' at row 1

insert into t1(c1) values(10223372586610590720.5);

select c1, c2, c3, c4, c5, c6, cast(c1 as unsigned) from t1;
+------------+------+------+------+------+------+----------------------+
| c1         | c2   | c3   | c4   | c5   | c6   | cast(c1 as unsigned) |
+------------+------+------+------+------+------+----------------------+
| 1.84467e19 | NULL | NULL | NULL | NULL | NULL |  9223372036854775808 |
| 1.02234e19 | NULL | NULL | NULL | NULL | NULL |  9223372036854775808 |
+------------+------+------+------+------+------+----------------------+


## test cast double to int
drop table t1;
create table t1(c1 double, c2 tinyint, c3 smallint, c4 mediumint, c5 int, c6 bigint);
insert into t1(c1) values(0.5);
insert into t1(c1) values(1.5);
insert into t1(c1) values(2.5);
insert into t1(c1) values(3.5);
insert into t1(c1) values(99.5);
insert into t1(c1) values(100.5);
insert into t1(c1) values(127);
insert into t1 select -c1, c2, c3, c4, c5, c6 from t1;
insert into t1(c1) values(127.4);
insert into t1(c1) values(-128.4);
insert into t1(c1) values(-128.5);
### 127.4和-128.5可以cast到tinyint范围内, 即[-128, 127]
update t1 set c2 = c1;
### 127.5和-128.50001 cast到tinyint以后超出范围
insert into t1(c1) values(127.5);
update t1 set c2 = c1;
ERROR 22003: Out of range value for column 'c2' at row 18
insert into t1(c1) values(-128.50001);
update t1 set c2 = c1 where c1 < 0;
ERROR 22003: Out of range value for column 'c2' at row 10

insert into t1(c1) values(32765.5);
insert into t1(c1) values(32766.5);
insert into t1(c1) values(32767);
insert into t1(c1) values(32767.4);
insert into t1 select -c1, c2, c3, c4, c5, c6 from t1 where c1 > 129;
insert into t1 (c1) values(-32768);
insert into t1 (c1) values(-32768.4);
insert into t1 (c1) values(-32768.5);
### 32767.4和-32768.5可以cast到smallint范围内, 即[-32768, 32767]
update t1 set c3 = c1;
### 32767.5和-32768.5001 cast到smallint以后超出范围
insert into t1(c1) values(32767.5);
update t1 set c3 = c1;
ERROR 22003: Out of range value for column 'c3' at row 31
insert into t1(c1) values(-32768.5001);
update t1 set c3 = c1 where c1 < 0;
ERROR 22003: Out of range value for column 'c3' at row 18

insert into t1(c1) values(8388605.5);
insert into t1(c1) values(8388606.5);
insert into t1(c1) values(8388607);
insert into t1(c1) values(8388607.4);
insert into t1 select -c1, c2, c3, c4, c5, c6 from t1 where c1 > 32770;
insert into t1 (c1) values(-8388608);
insert into t1 (c1) values(-8388608.4);
insert into t1 (c1) values(-8388608.5);
### 8388607.4和-8388608.5可以cast到mediumint范围内, 即[-8388608, 8388607]
update t1 set c4 = c1;
### 8388607.5和-8388608.50001 cast到mediumint以后超出范围
insert into t1(c1) values(8388607.5);
update t1 set c4 = c1;
ERROR 22003: Out of range value for column 'c4' at row 44
insert into t1(c1) values(-8388608.50001);
update t1 set c4 = c1 where c1 < 0;
ERROR 22003: Out of range value for column 'c4' at row 26

insert into t1(c1) values(2147473123.5);
insert into t1(c1) values(2147481111.5);
insert into t1(c1) values(2147483647);
insert into t1(c1) values(-2147472314);
insert into t1(c1) values(-2147483641);
insert into t1(c1) values(-2147483647.5);
insert into t1(c1) values(-2147483648);
### 2147483647和-2147483648可以cast到int范围内, 即[-2147483648, 2147483647]
update t1 set c5 = c1;
### 2147483648和-2147483649 cast到int以后超出范围
insert into t1(c1) values(2147483648);
update t1 set c5 = c1;
ERROR 22003: Out of range value for column 'c5' at row 53
insert into t1(c1) values(-2147483649);
update t1 set c5 = c1 where c1 < 0;
ERROR 22003: Out of range value for column 'c5' at row 31

insert into t1(c1) values(8223372036854776832);
insert into t1(c1) values(9223372036854776832);
insert into t1(c1) values(-8223372036854776832);
insert into t1(c1) values(-9223372036854776832);
### 9223372036854776832和-9223372036854776832可以cast到bigint范围内, 即[-9223372036854775808, 9223372036854775807]
update t1 set c6 = c1;
### 9223372036854776833和-9223372036854776833 cast到bigint以后超出范围
insert into t1(c1) values(9223372036854776833);
update t1 set c6 = c1;
ERROR 22003: Out of range value for column 'c6' at row 59
insert into t1(c1) values(-9223372036854776833);
update t1 set c6 = c1 where c1 < 0;
ERROR 22003: Out of range value for column 'c6' at row 34

select c1, c2, c3, c4, c5, c6, cast(c1 as signed) from t1;
+-----------------------+------+--------+----------+-------------+----------------------+----------------------+
| c1                    | c2   | c3     | c4       | c5          | c6                   | cast(c1 as signed)   |
+-----------------------+------+--------+----------+-------------+----------------------+----------------------+
|                   0.5 |    0 |      0 |        0 |           0 |                    0 |                    0 |
|                   1.5 |    2 |      2 |        2 |           2 |                    2 |                    2 |
|                   2.5 |    2 |      2 |        2 |           2 |                    2 |                    2 |
|                   3.5 |    4 |      4 |        4 |           4 |                    4 |                    4 |
|                  99.5 |  100 |    100 |      100 |         100 |                  100 |                  100 |
|                 100.5 |  100 |    100 |      100 |         100 |                  100 |                  100 |
|                   127 |  127 |    127 |      127 |         127 |                  127 |                  127 |
|                  -0.5 |    0 |      0 |        0 |           0 |                    0 |                    0 |
|                  -1.5 |   -2 |     -2 |       -2 |          -2 |                   -2 |                   -2 |
|                  -2.5 |   -2 |     -2 |       -2 |          -2 |                   -2 |                   -2 |
|                  -3.5 |   -4 |     -4 |       -4 |          -4 |                   -4 |                   -4 |
|                 -99.5 | -100 |   -100 |     -100 |        -100 |                 -100 |                 -100 |
|                -100.5 | -100 |   -100 |     -100 |        -100 |                 -100 |                 -100 |
|                  -127 | -127 |   -127 |     -127 |        -127 |                 -127 |                 -127 |
|                 127.4 |  127 |    127 |      127 |         127 |                  127 |                  127 |
|                -128.4 | -128 |   -128 |     -128 |        -128 |                 -128 |                 -128 |
|                -128.5 | -128 |   -128 |     -128 |        -128 |                 -128 |                 -128 |
|                 127.5 | NULL |    128 |      128 |         128 |                  128 |                  128 |
|            -128.50001 | NULL |   -129 |     -129 |        -129 |                 -129 |                 -129 |
|               32765.5 | NULL |  32766 |    32766 |       32766 |                32766 |                32766 |
|               32766.5 | NULL |  32766 |    32766 |       32766 |                32766 |                32766 |
|                 32767 | NULL |  32767 |    32767 |       32767 |                32767 |                32767 |
|               32767.4 | NULL |  32767 |    32767 |       32767 |                32767 |                32767 |
|              -32765.5 | NULL | -32766 |   -32766 |      -32766 |               -32766 |               -32766 |
|              -32766.5 | NULL | -32766 |   -32766 |      -32766 |               -32766 |               -32766 |
|                -32767 | NULL | -32767 |   -32767 |      -32767 |               -32767 |               -32767 |
|              -32767.4 | NULL | -32767 |   -32767 |      -32767 |               -32767 |               -32767 |
|                -32768 | NULL | -32768 |   -32768 |      -32768 |               -32768 |               -32768 |
|              -32768.4 | NULL | -32768 |   -32768 |      -32768 |               -32768 |               -32768 |
|              -32768.5 | NULL | -32768 |   -32768 |      -32768 |               -32768 |               -32768 |
|               32767.5 | NULL |   NULL |    32768 |       32768 |                32768 |                32768 |
|           -32768.5001 | NULL |   NULL |   -32769 |      -32769 |               -32769 |               -32769 |
|             8388605.5 | NULL |   NULL |  8388606 |     8388606 |              8388606 |              8388606 |
|             8388606.5 | NULL |   NULL |  8388606 |     8388606 |              8388606 |              8388606 |
|               8388607 | NULL |   NULL |  8388607 |     8388607 |              8388607 |              8388607 |
|             8388607.4 | NULL |   NULL |  8388607 |     8388607 |              8388607 |              8388607 |
|            -8388605.5 | NULL |   NULL | -8388606 |    -8388606 |             -8388606 |             -8388606 |
|            -8388606.5 | NULL |   NULL | -8388606 |    -8388606 |             -8388606 |             -8388606 |
|              -8388607 | NULL |   NULL | -8388607 |    -8388607 |             -8388607 |             -8388607 |
|            -8388607.4 | NULL |   NULL | -8388607 |    -8388607 |             -8388607 |             -8388607 |
|              -8388608 | NULL |   NULL | -8388608 |    -8388608 |             -8388608 |             -8388608 |
|            -8388608.4 | NULL |   NULL | -8388608 |    -8388608 |             -8388608 |             -8388608 |
|            -8388608.5 | NULL |   NULL | -8388608 |    -8388608 |             -8388608 |             -8388608 |
|             8388607.5 | NULL |   NULL |     NULL |     8388608 |              8388608 |              8388608 |
|        -8388608.50001 | NULL |   NULL |     NULL |    -8388609 |             -8388609 |             -8388609 |
|          2147473123.5 | NULL |   NULL |     NULL |  2147473124 |           2147473124 |           2147473124 |
|          2147481111.5 | NULL |   NULL |     NULL |  2147481112 |           2147481112 |           2147481112 |
|            2147483647 | NULL |   NULL |     NULL |  2147483647 |           2147483647 |           2147483647 |
|           -2147472314 | NULL |   NULL |     NULL | -2147472314 |          -2147472314 |          -2147472314 |
|           -2147483641 | NULL |   NULL |     NULL | -2147483641 |          -2147483641 |          -2147483641 |
|         -2147483647.5 | NULL |   NULL |     NULL | -2147483648 |          -2147483648 |          -2147483648 |
|           -2147483648 | NULL |   NULL |     NULL | -2147483648 |          -2147483648 |          -2147483648 |
|            2147483648 | NULL |   NULL |     NULL |        NULL |           2147483648 |           2147483648 |
|           -2147483649 | NULL |   NULL |     NULL |        NULL |          -2147483649 |          -2147483649 |
|  8.223372036854777e18 | NULL |   NULL |     NULL |        NULL |  8223372036854776832 |  8223372036854776832 |
|  9.223372036854776e18 | NULL |   NULL |     NULL |        NULL |  9223372036854775807 |  9223372036854775807 |
| -8.223372036854777e18 | NULL |   NULL |     NULL |        NULL | -8223372036854776832 | -8223372036854776832 |
| -9.223372036854776e18 | NULL |   NULL |     NULL |        NULL | -9223372036854775808 | -9223372036854775808 |
|  9.223372036854778e18 | NULL |   NULL |     NULL |        NULL |                 NULL |  9223372036854775807 |
| -9.223372036854778e18 | NULL |   NULL |     NULL |        NULL |                 NULL | -9223372036854775808 |
+-----------------------+------+--------+----------+-------------+----------------------+----------------------+



## test cast double to unsigned int
drop table t1;
create table t1(c1 double, c2 tinyint unsigned, c3 smallint unsigned, c4 mediumint unsigned, c5 int unsigned, c6 bigint unsigned);
insert into t1(c1) values(-0.5);
insert into t1(c1) values(0);
insert into t1(c1) values(0.5);
insert into t1(c1) values(1.5);
insert into t1(c1) values(2.5);
insert into t1(c1) values(3.5);
insert into t1(c1) values(99.5);
insert into t1(c1) values(100.5);
insert into t1(c1) values(255);
insert into t1(c1) values(255.4);
### -0.5和255.4可以cast到tinyint unsigned范围内, 即[0, 255]
update t1 set c2 = c1;
### -0.50001和255.5 cast到tinyint以后超出范围
insert into t1(c1) values(-0.50001);
update t1 set c2 = c1;
ERROR 22003: Out of range value for column 'c2' at row 11
select c1, c2, c3, c4, c5, c6, cast(c1 as unsigned) from t1;
+----------+------+------+------+------+------+----------------------+
| c1       | c2   | c3   | c4   | c5   | c6   | cast(c1 as unsigned) |
+----------+------+------+------+------+------+----------------------+
|     -0.5 |    0 | NULL | NULL | NULL | NULL |                    0 |
|        0 |    0 | NULL | NULL | NULL | NULL |                    0 |
|      0.5 |    0 | NULL | NULL | NULL | NULL |                    0 |
|      1.5 |    2 | NULL | NULL | NULL | NULL |                    2 |
|      2.5 |    2 | NULL | NULL | NULL | NULL |                    2 |
|      3.5 |    4 | NULL | NULL | NULL | NULL |                    4 |
|     99.5 |  100 | NULL | NULL | NULL | NULL |                  100 |
|    100.5 |  100 | NULL | NULL | NULL | NULL |                  100 |
|      255 |  255 | NULL | NULL | NULL | NULL |                  255 |
|    255.4 |  255 | NULL | NULL | NULL | NULL |                  255 |
| -0.50001 | NULL | NULL | NULL | NULL | NULL | 18446744073709551615 |
+----------+------+------+------+------+------+----------------------+
delete from t1;
insert into t1(c1) values(255.5);
update t1 set c2 = c1;
ERROR 22003: Out of range value for column 'c2' at row 1

delete from t1;
insert into t1(c1) values(-0.5);
insert into t1(c1) values(0);
insert into t1(c1) values(0.5);
insert into t1(c1) values(1.5);
insert into t1(c1) values(2.5);
insert into t1(c1) values(3.5);
insert into t1(c1) values(99.5);
insert into t1(c1) values(100.5);
insert into t1(c1) values(65535);
insert into t1(c1) values(65535.4);
### -0.5和65535.4可以cast到smallint unsigned范围内, 即[0, 65535]
update t1 set c3 = c1;
### -0.50001和65535.5 cast到smallint unsigned以后超出范围
insert into t1(c1) values(-0.50001);
update t1 set c3 = c1;
ERROR 22003: Out of range value for column 'c3' at row 11
select c1, c2, c3, c4, c5, c6, cast(c1 as unsigned) from t1;
+----------+------+-------+------+------+------+----------------------+
| c1       | c2   | c3    | c4   | c5   | c6   | cast(c1 as unsigned) |
+----------+------+-------+------+------+------+----------------------+
|     -0.5 | NULL |     0 | NULL | NULL | NULL |                    0 |
|        0 | NULL |     0 | NULL | NULL | NULL |                    0 |
|      0.5 | NULL |     0 | NULL | NULL | NULL |                    0 |
|      1.5 | NULL |     2 | NULL | NULL | NULL |                    2 |
|      2.5 | NULL |     2 | NULL | NULL | NULL |                    2 |
|      3.5 | NULL |     4 | NULL | NULL | NULL |                    4 |
|     99.5 | NULL |   100 | NULL | NULL | NULL |                  100 |
|    100.5 | NULL |   100 | NULL | NULL | NULL |                  100 |
|    65535 | NULL | 65535 | NULL | NULL | NULL |                65535 |
|  65535.4 | NULL | 65535 | NULL | NULL | NULL |                65535 |
| -0.50001 | NULL |  NULL | NULL | NULL | NULL | 18446744073709551615 |
+----------+------+-------+------+------+------+----------------------+
delete from t1;
insert into t1(c1) values(65535.5);
update t1 set c3 = c1;
ERROR 22003: Out of range value for column 'c3' at row 1

delete from t1;
insert into t1(c1) values(-0.5);
insert into t1(c1) values(0);
insert into t1(c1) values(0.5);
insert into t1(c1) values(1.5);
insert into t1(c1) values(2.5);
insert into t1(c1) values(3.5);
insert into t1(c1) values(99.5);
insert into t1(c1) values(100.5);
insert into t1(c1) values(16777215);
insert into t1(c1) values(16777215.4);
### -0.5和16777215.4可以cast到mediumint unsigned范围内, 即[0, 16777215]
update t1 set c4 = c1;
### -0.50001和16777215.5 cast到mediumint unsigned以后超出范围
insert into t1(c1) values(-0.50001);
update t1 set c4 = c1;
ERROR 22003: Out of range value for column 'c4' at row 11
select c1, c2, c3, c4, c5, c6, cast(c1 as unsigned) from t1;
+------------+------+------+----------+------+------+----------------------+
| c1         | c2   | c3   | c4       | c5   | c6   | cast(c1 as unsigned) |
+------------+------+------+----------+------+------+----------------------+
|       -0.5 | NULL | NULL |        0 | NULL | NULL |                    0 |
|          0 | NULL | NULL |        0 | NULL | NULL |                    0 |
|        0.5 | NULL | NULL |        0 | NULL | NULL |                    0 |
|        1.5 | NULL | NULL |        2 | NULL | NULL |                    2 |
|        2.5 | NULL | NULL |        2 | NULL | NULL |                    2 |
|        3.5 | NULL | NULL |        4 | NULL | NULL |                    4 |
|       99.5 | NULL | NULL |      100 | NULL | NULL |                  100 |
|      100.5 | NULL | NULL |      100 | NULL | NULL |                  100 |
|   16777215 | NULL | NULL | 16777215 | NULL | NULL |             16777215 |
| 16777215.4 | NULL | NULL | 16777215 | NULL | NULL |             16777215 |
|   -0.50001 | NULL | NULL |     NULL | NULL | NULL | 18446744073709551615 |
+------------+------+------+----------+------+------+----------------------+
delete from t1;
insert into t1(c1) values(16777215.5);
update t1 set c4 = c1;
ERROR 22003: Out of range value for column 'c4' at row 1


delete from t1;
insert into t1(c1) values(-0.5);
insert into t1(c1) values(0);
insert into t1(c1) values(0.5);
insert into t1(c1) values(1.5);
insert into t1(c1) values(2.5);
insert into t1(c1) values(3.5);
insert into t1(c1) values(99.5);
insert into t1(c1) values(100.5);
insert into t1(c1) values(4294967295);
### -0.5和4294967295可以cast到int unsigned范围内, 即[0, 4294967295]
update t1 set c5 = c1;
### -0.50001和4294967296 cast到int unsigned以后超出范围
insert into t1(c1) values(-0.50001);
update t1 set c5 = c1;
ERROR 22003: Out of range value for column 'c5' at row 10
select c1, c2, c3, c4, c5, c6, cast(c1 as unsigned) from t1;
+------------+------+------+------+------------+------+----------------------+
| c1         | c2   | c3   | c4   | c5         | c6   | cast(c1 as unsigned) |
+------------+------+------+------+------------+------+----------------------+
|       -0.5 | NULL | NULL | NULL |          0 | NULL |                    0 |
|          0 | NULL | NULL | NULL |          0 | NULL |                    0 |
|        0.5 | NULL | NULL | NULL |          0 | NULL |                    0 |
|        1.5 | NULL | NULL | NULL |          2 | NULL |                    2 |
|        2.5 | NULL | NULL | NULL |          2 | NULL |                    2 |
|        3.5 | NULL | NULL | NULL |          4 | NULL |                    4 |
|       99.5 | NULL | NULL | NULL |        100 | NULL |                  100 |
|      100.5 | NULL | NULL | NULL |        100 | NULL |                  100 |
| 4294967295 | NULL | NULL | NULL | 4294967295 | NULL |           4294967295 |
|   -0.50001 | NULL | NULL | NULL |       NULL | NULL | 18446744073709551615 |
+------------+------+------+------+------------+------+----------------------+
delete from t1;
insert into t1(c1) values(4294967296);
update t1 set c5 = c1;
ERROR 22003: Out of range value for column 'c5' at row 1

delete from t1;
insert into t1(c1) values(-0.5);
insert into t1(c1) values(0);
insert into t1(c1) values(0.5);
insert into t1(c1) values(1.5);
insert into t1(c1) values(2.5);
insert into t1(c1) values(3.5);
insert into t1(c1) values(99.5);
insert into t1(c1) values(100.5);
insert into t1(c1) values(18446744073709550591);
### -0.5和18446744073709550591可以cast到bigint unsigned范围内, 即[0, 18446744073709551615]
update t1 set c6 = c1;
### -0.50001和18446744073709550591 cast到bigint unsigned以后超出范围
insert into t1(c1) values(-0.50001);
update t1 set c6 = c1;
ERROR 22003: Out of range value for column 'c6' at row 10
select c1, c2, c3, c4, c5, c6, cast(c1 as unsigned) from t1;
+----------------------+------+------+------+------+----------------------+----------------------+
| c1                   | c2   | c3   | c4   | c5   | c6                   | cast(c1 as unsigned) |
+----------------------+------+------+------+------+----------------------+----------------------+
|                 -0.5 | NULL | NULL | NULL | NULL |                    0 |                    0 |
|                    0 | NULL | NULL | NULL | NULL |                    0 |                    0 |
|                  0.5 | NULL | NULL | NULL | NULL |                    0 |                    0 |
|                  1.5 | NULL | NULL | NULL | NULL |                    2 |                    2 |
|                  2.5 | NULL | NULL | NULL | NULL |                    2 |                    2 |
|                  3.5 | NULL | NULL | NULL | NULL |                    4 |                    4 |
|                 99.5 | NULL | NULL | NULL | NULL |                  100 |                  100 |
|                100.5 | NULL | NULL | NULL | NULL |                  100 |                  100 |
| 1.844674407370955e19 | NULL | NULL | NULL | NULL | 18446744073709549568 |  9223372036854775807 |
|             -0.50001 | NULL | NULL | NULL | NULL |                 NULL | 18446744073709551615 |
+----------------------+------+------+------+------+----------------------+----------------------+
delete from t1;
insert into t1(c1) values(18446744073709550592);
update t1 set c6 = c1;
ERROR 22003: Out of range value for column 'c6' at row 1

select c1, c2, c3, c4, c5, c6, cast(c1 as unsigned) from t1;
+-----------------------+------+------+------+------+------+----------------------+
| c1                    | c2   | c3   | c4   | c5   | c6   | cast(c1 as unsigned) |
+-----------------------+------+------+------+------+------+----------------------+
| 1.8446744073709552e19 | NULL | NULL | NULL | NULL | NULL |  9223372036854775807 |
+-----------------------+------+------+------+------+------+----------------------+
drop table t1;

## float转int时，如果超过LLONG_MAX应该trunc成LLONG_MIN，而double转int时超过LLONG_MAX应该trunc成LLONG_MAX
drop table if exists t0;
create table t0(c1 float, c2 double, c3 bigint unsigned, c4 bigint unsigned);
insert into t0(c1,c2) values(8223372036854775809,8223372036854775809);
insert into t0(c1,c2) values(9223372036854775807,9223372036854775807);
insert into t0(c1,c2) values(9223372036854775808,9223372036854775808);
insert into t0(c1,c2) values(9223372036854775809,9223372036854775809);
insert into t0(c1,c2) values(11223372036854775809,11223372036854775809);
insert into t0(c1,c2) values(17446744073709551615,17446744073709551615);
update t0 set c3 = c1, c4 = c2;
select c1, c2, c3, c4 from t0;
+------------+-----------------------+----------------------+----------------------+
| c1         | c2                    | c3                   | c4                   |
+------------+-----------------------+----------------------+----------------------+
| 8.22337e18 |  8.223372036854776e18 |  8223372258706456576 |  8223372036854775808 |
| 9.22337e18 |  9.223372036854776e18 |  9223372036854775808 |  9223372036854775808 |
| 9.22337e18 |  9.223372036854776e18 |  9223372036854775808 |  9223372036854775808 |
| 9.22337e18 |  9.223372036854776e18 |  9223372036854775808 |  9223372036854775808 |
| 1.12234e19 | 1.1223372036854776e19 | 11223371593151414272 | 11223372036854775808 |
| 1.74467e19 | 1.7446744073709552e19 | 17446743745805418496 | 17446744073709551616 |
+------------+-----------------------+----------------------+----------------------+

insert into t0(c1,c2) values(18446744073709551614,18446744073709551614);
insert into t0(c1,c2) values(18446744073709551615,18446744073709551615);
insert into t0(c1,c2) values(18446744073709551616,18446744073709551616);
insert into t0(c1,c2) values(19446744073709551615,19446744073709551615);

insert into t0(c1,c2) values(-10,-10);
insert into t0(c1,c2) values(-123.5, -123.5);
insert into t0(c1,c2) values(-123456.5, -123456.5);
insert into t0(c1,c2) values(-8223372036854775809,-8223372036854775809);
insert into t0(c1,c2) values(-9223372036854775807,-9223372036854775807);
insert into t0(c1,c2) values(-9223372036854775808,-9223372036854775808);
insert into t0(c1,c2) values(-9223372036854775809,-9223372036854775809);
insert into t0(c1,c2) values(-11223372036854775809,-11223372036854775809);
insert into t0(c1,c2) values(-17446744073709551615,-17446744073709551615);
insert into t0(c1,c2) values(-17446744073709551615,-17446744073709551615);
insert into t0(c1,c2) values(-19446744073709551615,-19446744073709551615);

select c1, cast(c1 as signed), c2, cast(c2 as signed) from t0;
+-------------+----------------------+------------------------+----------------------+
| c1          | cast(c1 as signed)   | c2                     | cast(c2 as signed)   |
+-------------+----------------------+------------------------+----------------------+
|  8.22337e18 |  8223372258706456576 |   8.223372036854776e18 |  8223372036854775808 |
|  9.22337e18 | -9223372036854775808 |   9.223372036854776e18 |  9223372036854775807 |
|  9.22337e18 | -9223372036854775808 |   9.223372036854776e18 |  9223372036854775807 |
|  9.22337e18 | -9223372036854775808 |   9.223372036854776e18 |  9223372036854775807 |
|  1.12234e19 | -9223372036854775808 |  1.1223372036854776e19 |  9223372036854775807 |
|  1.74467e19 | -9223372036854775808 |  1.7446744073709552e19 |  9223372036854775807 |
|  1.84467e19 | -9223372036854775808 |  1.8446744073709552e19 |  9223372036854775807 |
|  1.84467e19 | -9223372036854775808 |  1.8446744073709552e19 |  9223372036854775807 |
|  1.84467e19 | -9223372036854775808 |  1.8446744073709552e19 |  9223372036854775807 |
|  1.94467e19 | -9223372036854775808 |   1.944674407370955e19 |  9223372036854775807 |
|         -10 |                  -10 |                    -10 |                  -10 |
|      -123.5 |                 -124 |                 -123.5 |                 -124 |
|     -123456 |              -123456 |              -123456.5 |              -123456 |
| -8.22337e18 | -8223372258706456576 |  -8.223372036854776e18 | -8223372036854775808 |
| -9.22337e18 | -9223372036854775808 |  -9.223372036854776e18 | -9223372036854775808 |
| -9.22337e18 | -9223372036854775808 |  -9.223372036854776e18 | -9223372036854775808 |
| -9.22337e18 | -9223372036854775808 |  -9.223372036854776e18 | -9223372036854775808 |
| -1.12234e19 | -9223372036854775808 | -1.1223372036854776e19 | -9223372036854775808 |
| -1.74467e19 | -9223372036854775808 | -1.7446744073709552e19 | -9223372036854775808 |
| -1.74467e19 | -9223372036854775808 | -1.7446744073709552e19 | -9223372036854775808 |
| -1.94467e19 | -9223372036854775808 |  -1.944674407370955e19 | -9223372036854775808 |
+-------------+----------------------+------------------------+----------------------+
select c1, cast(c1 as unsigned), c2, cast(c2 as unsigned) from t0;
+-------------+----------------------+------------------------+----------------------+
| c1          | cast(c1 as unsigned) | c2                     | cast(c2 as unsigned) |
+-------------+----------------------+------------------------+----------------------+
|  8.22337e18 |  8223372258706456576 |   8.223372036854776e18 |  8223372036854775808 |
|  9.22337e18 |  9223372036854775808 |   9.223372036854776e18 |  9223372036854775807 |
|  9.22337e18 |  9223372036854775808 |   9.223372036854776e18 |  9223372036854775807 |
|  9.22337e18 |  9223372036854775808 |   9.223372036854776e18 |  9223372036854775807 |
|  1.12234e19 |  9223372036854775808 |  1.1223372036854776e19 |  9223372036854775807 |
|  1.74467e19 |  9223372036854775808 |  1.7446744073709552e19 |  9223372036854775807 |
|  1.84467e19 |  9223372036854775808 |  1.8446744073709552e19 |  9223372036854775807 |
|  1.84467e19 |  9223372036854775808 |  1.8446744073709552e19 |  9223372036854775807 |
|  1.84467e19 |  9223372036854775808 |  1.8446744073709552e19 |  9223372036854775807 |
|  1.94467e19 |  9223372036854775808 |   1.944674407370955e19 |  9223372036854775807 |
|         -10 | 18446744073709551606 |                    -10 | 18446744073709551606 |
|      -123.5 | 18446744073709551492 |                 -123.5 | 18446744073709551492 |
|     -123456 | 18446744073709428160 |              -123456.5 | 18446744073709428160 |
| -8.22337e18 | 10223371815003095040 |  -8.223372036854776e18 | 10223372036854775808 |
| -9.22337e18 |  9223372036854775808 |  -9.223372036854776e18 |  9223372036854775808 |
| -9.22337e18 |  9223372036854775808 |  -9.223372036854776e18 |  9223372036854775808 |
| -9.22337e18 |  9223372036854775808 |  -9.223372036854776e18 |  9223372036854775808 |
| -1.12234e19 |  9223372036854775808 | -1.1223372036854776e19 |  9223372036854775808 |
| -1.74467e19 |  9223372036854775808 | -1.7446744073709552e19 |  9223372036854775808 |
| -1.74467e19 |  9223372036854775808 | -1.7446744073709552e19 |  9223372036854775808 |
| -1.94467e19 |  9223372036854775808 |  -1.944674407370955e19 |  9223372036854775808 |
+-------------+----------------------+------------------------+----------------------+
drop table t0;

bugfix: 
select cast('0' as datetime);
+-----------------------+
| cast('0' as datetime) |
+-----------------------+
| NULL                  |
+-----------------------+
select cast('1' as datetime);
+-----------------------+
| cast('1' as datetime) |
+-----------------------+
| NULL                  |
+-----------------------+

select cast('00' as datetime);
+------------------------+
| cast('00' as datetime) |
+------------------------+
| NULL                   |
+------------------------+
select cast('11' as datetime);
+------------------------+
| cast('11' as datetime) |
+------------------------+
| NULL                   |
+------------------------+

select cast('000' as datetime);
+-------------------------+
| cast('000' as datetime) |
+-------------------------+
| NULL                    |
+-------------------------+
select cast('111' as datetime);
+-------------------------+
| cast('111' as datetime) |
+-------------------------+
| NULL                    |
+-------------------------+

select cast('0000' as datetime);
+--------------------------+
| cast('0000' as datetime) |
+--------------------------+
| NULL                     |
+--------------------------+
select cast('0001' as datetime);
+--------------------------+
| cast('0001' as datetime) |
+--------------------------+
| NULL                     |
+--------------------------+
select cast('1111' as datetime);
+--------------------------+
| cast('1111' as datetime) |
+--------------------------+
| NULL                     |
+--------------------------+

select cast('00000' as datetime);
+---------------------------+
| cast('00000' as datetime) |
+---------------------------+
| 0000-00-00 00:00:00       |
+---------------------------+
select cast('00001' as datetime);
+---------------------------+
| cast('00001' as datetime) |
+---------------------------+
| 2000-00-01 00:00:00       |
+---------------------------+
select cast('00011' as datetime);
+---------------------------+
| cast('00011' as datetime) |
+---------------------------+
| 2000-01-01 00:00:00       |
+---------------------------+
select cast('11111' as datetime);
+---------------------------+
| cast('11111' as datetime) |
+---------------------------+
| 2011-11-01 00:00:00       |
+---------------------------+

select cast('000000' as datetime);
+----------------------------+
| cast('000000' as datetime) |
+----------------------------+
| 0000-00-00 00:00:00        |
+----------------------------+
select cast('000101' as datetime);
+----------------------------+
| cast('000101' as datetime) |
+----------------------------+
| 2000-01-01 00:00:00        |
+----------------------------+
select cast('111111' as datetime);
+----------------------------+
| cast('111111' as datetime) |
+----------------------------+
| 2011-11-11 00:00:00        |
+----------------------------+

select cast('0000000' as datetime);
+-----------------------------+
| cast('0000000' as datetime) |
+-----------------------------+
| 0000-00-00 00:00:00         |
+-----------------------------+
select cast('0001101' as datetime);
+-----------------------------+
| cast('0001101' as datetime) |
+-----------------------------+
| 2000-01-10 01:00:00         |
+-----------------------------+
select cast('1111111' as datetime);
+-----------------------------+
| cast('1111111' as datetime) |
+-----------------------------+
| 2011-11-11 01:00:00         |
+-----------------------------+

select cast('00000000' as datetime);
+------------------------------+
| cast('00000000' as datetime) |
+------------------------------+
| 0000-00-00 00:00:00          |
+------------------------------+
select cast('00010101' as datetime);
+------------------------------+
| cast('00010101' as datetime) |
+------------------------------+
| 0001-01-01 00:00:00          |
+------------------------------+
select cast('11111111' as datetime);
+------------------------------+
| cast('11111111' as datetime) |
+------------------------------+
| 1111-11-11 00:00:00          |
+------------------------------+

select cast('000000000' as datetime);
+-------------------------------+
| cast('000000000' as datetime) |
+-------------------------------+
| 0000-00-00 00:00:00           |
+-------------------------------+
select cast('000101012' as datetime);
+-------------------------------+
| cast('000101012' as datetime) |
+-------------------------------+
| 2000-01-01 01:02:00           |
+-------------------------------+
select cast('111111111' as datetime);
+-------------------------------+
| cast('111111111' as datetime) |
+-------------------------------+
| 2011-11-11 11:01:00           |
+-------------------------------+

select cast('0000000000' as datetime);
+--------------------------------+
| cast('0000000000' as datetime) |
+--------------------------------+
| 0000-00-00 00:00:00            |
+--------------------------------+
select cast('0001010112' as datetime);
+--------------------------------+
| cast('0001010112' as datetime) |
+--------------------------------+
| 2000-01-01 01:12:00            |
+--------------------------------+
select cast('1111111111' as datetime);
+--------------------------------+
| cast('1111111111' as datetime) |
+--------------------------------+
| 2011-11-11 11:11:00            |
+--------------------------------+

bugfix: 
create table t0(a mediumint);
insert into t0 values(4663),(-5656),(null);
select cast(a as time) from t0;
+-----------------+
| cast(a as time) |
+-----------------+
| NULL            |
| -00:56:56       |
| NULL            |
+-----------------+
drop table t0;

##bugfix: 
select cast(1e199 as datetime);
+-------------------------+
| cast(1e199 as datetime) |
+-------------------------+
| NULL                    |
+-------------------------+
create table t0(c1 datetime);
insert into t0 values(1e199);
ERROR 22007: Incorrect datetime value for column 'c1' at row 1
set @@sql_mode = '';
insert into t0 values(1e199);
select * from t0;
+---------------------+
| c1                  |
+---------------------+
| 0000-00-00 00:00:00 |
+---------------------+
drop table t0;
set @@sql_mode = 'STRICT_ALL_TABLES,NO_ZERO_IN_DATE,NO_AUTO_CREATE_USER';


// old engine, expect max/min value(99999 or -99999 9的个数取决与prec/scale)
bug:31068411
select cast('1e500' as decimal);
+--------------------------+
| cast('1e500' as decimal) |
+--------------------------+
|               9999999999 |
+--------------------------+
select cast('1e500' as decimal(5, 1));
+--------------------------------+
| cast('1e500' as decimal(5, 1)) |
+--------------------------------+
|                         9999.9 |
+--------------------------------+
select cast('-1e500' as decimal);
+---------------------------+
| cast('-1e500' as decimal) |
+---------------------------+
|               -9999999999 |
+---------------------------+
select cast('-1e500' as decimal(5, 1));
+---------------------------------+
| cast('-1e500' as decimal(5, 1)) |
+---------------------------------+
|                         -9999.9 |
+---------------------------------+
select cast('--1e500' as decimal);
+----------------------------+
| cast('--1e500' as decimal) |
+----------------------------+
|                          0 |
+----------------------------+
Warnings:
Warning	1292	Truncated incorrect DECIMAL value: '--1e500'
select cast('--1e500' as decimal(5, 1));
+----------------------------------+
| cast('--1e500' as decimal(5, 1)) |
+----------------------------------+
|                              0.0 |
+----------------------------------+
Warnings:
Warning	1292	Truncated incorrect DECIMAL value: '--1e500'
select cast('+1e500' as decimal);
+---------------------------+
| cast('+1e500' as decimal) |
+---------------------------+
|                9999999999 |
+---------------------------+
select cast('+1e500' as decimal(5, 1));
+---------------------------------+
| cast('+1e500' as decimal(5, 1)) |
+---------------------------------+
|                          9999.9 |
+---------------------------------+

bugfix: 
create table t0(c1 varchar(100), c2 decimal(10,0), c3 decimal);
insert into t0 values('5e45', 0, 0);
insert into t0 values('5e451', 0, 0);
insert into t0 values('5e451nA*7zV2]9u', 0, 0);
SELECT '5e451nA*7zV2]9u' IS TRUE from t0;
+---------------------------+
| '5e451nA*7zV2]9u' IS TRUE |
+---------------------------+
|                         1 |
|                         1 |
|                         1 |
+---------------------------+
select * FROM t0 WHERE '5e451nA*7zV2]9u';
+-----------------+------+------+
| c1              | c2   | c3   |
+-----------------+------+------+
| 5e45            |    0 |    0 |
| 5e451           |    0 |    0 |
| 5e451nA*7zV2]9u |    0 |    0 |
+-----------------+------+------+
select c1, c1 is true  from t0;
+-----------------+------------+
| c1              | c1 is true |
+-----------------+------------+
| 5e45            |          1 |
| 5e451           |          1 |
| 5e451nA*7zV2]9u |          1 |
+-----------------+------------+
select * from t0 where c1;
+-----------------+------+------+
| c1              | c2   | c3   |
+-----------------+------+------+
| 5e45            |    0 |    0 |
| 5e451           |    0 |    0 |
| 5e451nA*7zV2]9u |    0 |    0 |
+-----------------+------+------+
select * from t0 where c1 is true;
+-----------------+------+------+
| c1              | c2   | c3   |
+-----------------+------+------+
| 5e45            |    0 |    0 |
| 5e451           |    0 |    0 |
| 5e451nA*7zV2]9u |    0 |    0 |
+-----------------+------+------+
insert into t0 values('', '5e45', 0);
ERROR 22003: Out of range value for column 'c2' at row 1
insert into t0 values('', '5e451', 0);
ERROR 22003: Result value was out of range when casting varchar to number
insert into t0 values('', 0, '5e45');
ERROR 22003: Out of range value for column 'c3' at row 1
insert into t0 values('', 0, '5e451');
ERROR 22003: Result value was out of range when casting varchar to number
set @@sql_mode = '';
insert into t0 values('', '5e45', '5e45');
insert into t0 values('', '5e451', '5e451');
select * from t0;
+-----------------+------------+------------+
| c1              | c2         | c3         |
+-----------------+------------+------------+
| 5e45            |          0 |          0 |
| 5e451           |          0 |          0 |
| 5e451nA*7zV2]9u |          0 |          0 |
|                 | 9999999999 | 9999999999 |
|                 | 9999999999 | 9999999999 |
+-----------------+------------+------------+
set @@sql_mode = 'STRICT_ALL_TABLES,NO_ZERO_IN_DATE,NO_AUTO_CREATE_USER';
drop table t0;


// new engine, expect max/min value(99999 or -99999 9的个数取决与prec/scale)
bug:31068411
select cast('1e500' as decimal);
+--------------------------+
| cast('1e500' as decimal) |
+--------------------------+
|               9999999999 |
+--------------------------+
select cast('1e500' as decimal(5, 1));
+--------------------------------+
| cast('1e500' as decimal(5, 1)) |
+--------------------------------+
|                         9999.9 |
+--------------------------------+
select cast('-1e500' as decimal);
+---------------------------+
| cast('-1e500' as decimal) |
+---------------------------+
|               -9999999999 |
+---------------------------+
select cast('-1e500' as decimal(5, 1));
+---------------------------------+
| cast('-1e500' as decimal(5, 1)) |
+---------------------------------+
|                         -9999.9 |
+---------------------------------+
select cast('--1e500' as decimal);
+----------------------------+
| cast('--1e500' as decimal) |
+----------------------------+
|                          0 |
+----------------------------+
Warnings:
Warning	1292	Truncated incorrect DECIMAL value: '--1e500'
select cast('--1e500' as decimal(5, 1));
+----------------------------------+
| cast('--1e500' as decimal(5, 1)) |
+----------------------------------+
|                              0.0 |
+----------------------------------+
Warnings:
Warning	1292	Truncated incorrect DECIMAL value: '--1e500'
select cast('+1e500' as decimal);
+---------------------------+
| cast('+1e500' as decimal) |
+---------------------------+
|                9999999999 |
+---------------------------+
select cast('+1e500' as decimal(5, 1));
+---------------------------------+
| cast('+1e500' as decimal(5, 1)) |
+---------------------------------+
|                          9999.9 |
+---------------------------------+

bugfix: 
create table t0(c1 varchar(100), c2 decimal(10,0), c3 decimal);
insert into t0 values('5e45', 0, 0);
insert into t0 values('5e451', 0, 0);
insert into t0 values('5e451nA*7zV2]9u', 0, 0);
SELECT '5e451nA*7zV2]9u' IS TRUE from t0;
+---------------------------+
| '5e451nA*7zV2]9u' IS TRUE |
+---------------------------+
|                         1 |
|                         1 |
|                         1 |
+---------------------------+
select * FROM t0 WHERE '5e451nA*7zV2]9u';
+-----------------+------+------+
| c1              | c2   | c3   |
+-----------------+------+------+
| 5e45            |    0 |    0 |
| 5e451           |    0 |    0 |
| 5e451nA*7zV2]9u |    0 |    0 |
+-----------------+------+------+
select c1, c1 is true  from t0;
+-----------------+------------+
| c1              | c1 is true |
+-----------------+------------+
| 5e45            |          1 |
| 5e451           |          1 |
| 5e451nA*7zV2]9u |          1 |
+-----------------+------------+
select * from t0 where c1;
+-----------------+------+------+
| c1              | c2   | c3   |
+-----------------+------+------+
| 5e45            |    0 |    0 |
| 5e451           |    0 |    0 |
| 5e451nA*7zV2]9u |    0 |    0 |
+-----------------+------+------+
select * from t0 where c1 is true;
+-----------------+------+------+
| c1              | c2   | c3   |
+-----------------+------+------+
| 5e45            |    0 |    0 |
| 5e451           |    0 |    0 |
| 5e451nA*7zV2]9u |    0 |    0 |
+-----------------+------+------+
insert into t0 values('', '5e45', 0);
ERROR 22003: Out of range value for column 'c2' at row 1
insert into t0 values('', '5e451', 0);
ERROR 22003: Result value was out of range when casting varchar to number
insert into t0 values('', 0, '5e45');
ERROR 22003: Out of range value for column 'c3' at row 1
insert into t0 values('', 0, '5e451');
ERROR 22003: Result value was out of range when casting varchar to number
set @@sql_mode = '';
insert into t0 values('', '5e45', '5e45');
insert into t0 values('', '5e451', '5e451');
select * from t0;
+-----------------+------------+------------+
| c1              | c2         | c3         |
+-----------------+------------+------------+
| 5e45            |          0 |          0 |
| 5e451           |          0 |          0 |
| 5e451nA*7zV2]9u |          0 |          0 |
|                 | 9999999999 | 9999999999 |
|                 | 9999999999 | 9999999999 |
+-----------------+------------+------------+
set @@sql_mode = 'STRICT_ALL_TABLES,NO_ZERO_IN_DATE,NO_AUTO_CREATE_USER';
drop table t0;

bugfix: 
drop table if exists t0;
CREATE TABLE t0(c0 FLOAT ZEROFILL PRIMARY KEY);
REPLACE INTO t0(c0) VALUES(0.0);
SELECT /*+ NO_MERGE (t0) */ ALL t0.c0 AS ref0 FROM t0 WHERE (NOT (BIT_COUNT(LEAST( EXISTS (SELECT 1 from dual wHERE FALSE), -705681661,  EXISTS (SELECT 1 from dual wHERE FALSE), t0.c0))));
+------+
| ref0 |
+------+
+------+

bugfix: 
drop table if exists t1;
drop table if exists t2;
create table t1(c1 int, ch char(8));
create table t2(c1 int);
insert into t1 values(1, '20210103');
insert into t1 values(2, '20210132');
select /*+use_px parallel(5)*/ c1 from t1 where DATE_FORMAT( ch, '%Y-%m-%d' ) >= DATE_FORMAT( '20210102', '%Y-%m-%d');
+------+
| c1   |
+------+
|    1 |
+------+
insert into t2 select c1 from t1 where DATE_FORMAT( ch, '%Y-%m-%d' ) >= DATE_FORMAT( '20210102', '%Y-%m-%d');
ERROR 22007: Incorrect value
