drop table if exists t1,t2;
set ob_enable_index_direct_select=1;
alter system set merger_check_interval = '10s' tenant sys;
alter system set merger_check_interval = '10s' tenant all_user;
alter system set merger_check_interval = '10s' tenant all_meta;
create table t1(
a1 char(3) primary key,
a2 int,
a3 char(3),
a4 float,
a5 datetime
);
insert into t1 values('AME',0,'SEA',0.100,date'1942-02-19');
insert into t1 values('HBR',1,'SEA',0.085,date'1948-03-05');
insert into t1 values('BOT',-2,'SEA',-0.085,date'1951-11-29');
insert into t1 values('BMC',3,'SEA',-0.085,date'1958-09-08');
insert into t1 values('TWU',+0,'LAX',-0.080,date'1969-10-05');
insert into t1 values('BDL',-0,'DEN',-0.080,date'1960-11-27');
insert into t1 values('DTX',1,'NYC',0.080,date'1961-05-04');
insert into t1 values('PLS',-1,'WDC',-0.075,date'1949-01-02');
insert into t1 values('ZAJ',2,'CHI',-0.075,date'1960-06-15');
insert into t1 values('VVV',-2,'MON',0.075,date'1959-06-28');
insert into t1 values('GTM',3,'DAL',-0.070,date'1977-09-23');
insert into t1 values('SSJ',null,'CHI',null,date'1974-03-19');
insert into t1 values('KKK',-3,'ATL',null,null);
insert into t1 values('XXX',null,'MIN',null,null);
insert into t1 values('WWW',1,'LED',null,null);
insert into t1 values('GG3',-3,'DD3',-0.051,date'1974-03-19');
insert into t1 values('GG2',-3,'DD2',0.052,date'1974-03-19');
insert into t1 values('GG1',3,'DD1',0.053,date'1974-03-19');
select * from t1;
a1	a2	a3	a4	a5
AME	0	SEA	0.1	timestamp
BDL	0	DEN	-0.08	timestamp
BMC	3	SEA	-0.085	timestamp
BOT	-2	SEA	-0.085	timestamp
DTX	1	NYC	0.08	timestamp
GG1	3	DD1	0.053	timestamp
GG2	-3	DD2	0.052	timestamp
GG3	-3	DD3	-0.051	timestamp
GTM	3	DAL	-0.07	timestamp
HBR	1	SEA	0.085	timestamp
KKK	-3	ATL	NULL	timestamp
PLS	-1	WDC	-0.075	timestamp
SSJ	NULL	CHI	NULL	timestamp
TWU	0	LAX	-0.08	timestamp
VVV	-2	MON	0.075	timestamp
WWW	1	LED	NULL	timestamp
XXX	NULL	MIN	NULL	timestamp
ZAJ	2	CHI	-0.075	timestamp
select sign(100) , sign(-100) , sign(-0.17) , sign(0.0000000001) , sign(0) , sign(0.00) , sign(+0) , sign(-0);
sign(100)	sign(-100)	sign(-0.17)	sign(0.0000000001)	sign(0)	sign(0.00)	sign(+0)	sign(-0)
1	-1	-1	1	0	0	0	0
select sign('100') , sign('-100') , sign('+0') , sign('-0.000001') , sign('-0.0000000');
sign('100')	sign('-100')	sign('+0')	sign('-0.000001')	sign('-0.0000000')
1	-1	0	-1	0
select sign('2014.11.11');
sign('2014.11.11')
1
Warnings:
Warning	1292	Truncated incorrect DOUBLE value: '2014.11.11'
select sign('abc');
sign('abc')
0
Warnings:
Warning	1292	Truncated incorrect DOUBLE value: 'abc'
select sign(true);
sign(true)
1
select sign(1>0);
sign(1>0)
1
select sign(null);
sign(null)
NULL
select sign( row(1,2) );
ERROR 21000: Operand should contain 1 column(s)
select sign( '2.1' > 1 AND 1 < 2 AND 1 <> 2 AND 1 != 2 AND 3 between 1 and 4 AND 5 not between 1 and 3 AND 1 in (1,2,3) AND 4 not in (1,2,3) );
sign( '2.1' > 1 AND 1 < 2 AND 1 <> 2 AND 1 != 2 AND 3 between 1 and 4 AND 5 not between 1 and 3 AND 1 in (1,2,3) AND 4 not in (1,2,3) )
1
select sign( NOT ( 1 < 2 ) );
sign( NOT ( 1 < 2 ) )
0
select sign( 1 < 2 OR false );
sign( 1 < 2 OR false )
1
select sign( row(1,2) <= row(2,3) );
sign( row(1,2) <= row(2,3) )
1
select sign( 1.1 + 1.1 - 1.1 * 1.1 / 1.1 - 4%3 );
sign( 1.1 + 1.1 - 1.1 * 1.1 / 1.1 - 4%3 )
1
select sign( length('abc') );
sign( length('abc') )
1
select sign( 'abc' like 'a%c' AND 'abc' not like 'cde' );
sign( 'abc' like 'a%c' AND 'abc' not like 'cde' )
1
select sign( concat( 'a', 'bc' ) );
sign( concat( 'a', 'bc' ) )
0
Warnings:
Warning	1292	Truncated incorrect DOUBLE value: 'abc'
select sign( trim('   aaa  ') );
sign( trim('   aaa  ') )
0
Warnings:
Warning	1292	Truncated incorrect DOUBLE value: 'aaa'
select sign( substr('abc',1,2) );
sign( substr('abc',1,2) )
0
Warnings:
Warning	1292	Truncated incorrect DOUBLE value: 'ab'
select sign( sign( sign(0.0000000000000000000000000000000) ) );
sign( sign( sign(0.0000000000000000000000000000000) ) )
0
select sign( sign( sign(0.0000000000000000000000000000001) ) );
sign( sign( sign(0.0000000000000000000000000000001) ) )
1
select sign( sign( sign(-0.0000000000000000000000000000001) ) );
sign( sign( sign(-0.0000000000000000000000000000001) ) )
-1
select sign( sign( neg( sign( sign(0.0000000000000000000000000000000) ) ) ) );
sign( sign( neg( sign( sign(0.0000000000000000000000000000000) ) ) ) )
0
select sign( sign( neg( sign( sign(0.0000000000000000000000000000001) ) ) ) );
sign( sign( neg( sign( sign(0.0000000000000000000000000000001) ) ) ) )
-1
select sign( sign( neg( sign( sign(-0.0000000000000000000000000000001) ) ) ) );
sign( sign( neg( sign( sign(-0.0000000000000000000000000000001) ) ) ) )
1
select sign( sign('1.1') + sign(0.1) );
sign( sign('1.1') + sign(0.1) )
1
select sign( nvl( 1, 'r' ) );
sign( nvl( 1, 'r' ) )
1
select sign( nvl(null, 'r') );
sign( nvl(null, 'r') )
0
Warnings:
Warning	1292	Truncated incorrect DOUBLE value: 'r'
select sign( nvl(null, 100) );
sign( nvl(null, 100) )
1
select sign(a1) from t1;
sign(a1)
0
0
0
0
0
0
0
0
0
0
0
0
0
0
0
0
0
0
Warnings:
Warning	1292	Truncated incorrect DOUBLE value: 'AME'
Warning	1292	Truncated incorrect DOUBLE value: 'BDL'
Warning	1292	Truncated incorrect DOUBLE value: 'BMC'
Warning	1292	Truncated incorrect DOUBLE value: 'BOT'
Warning	1292	Truncated incorrect DOUBLE value: 'DTX'
Warning	1292	Truncated incorrect DOUBLE value: 'GG1'
Warning	1292	Truncated incorrect DOUBLE value: 'GG2'
Warning	1292	Truncated incorrect DOUBLE value: 'GG3'
Warning	1292	Truncated incorrect DOUBLE value: 'GTM'
Warning	1292	Truncated incorrect DOUBLE value: 'HBR'
Warning	1292	Truncated incorrect DOUBLE value: 'KKK'
Warning	1292	Truncated incorrect DOUBLE value: 'PLS'
Warning	1292	Truncated incorrect DOUBLE value: 'SSJ'
Warning	1292	Truncated incorrect DOUBLE value: 'TWU'
Warning	1292	Truncated incorrect DOUBLE value: 'VVV'
Warning	1292	Truncated incorrect DOUBLE value: 'WWW'
Warning	1292	Truncated incorrect DOUBLE value: 'XXX'
Warning	1292	Truncated incorrect DOUBLE value: 'ZAJ'
select sign(a3) from t1;
sign(a3)
0
0
0
0
0
0
0
0
0
0
0
0
0
0
0
0
0
0
Warnings:
Warning	1292	Truncated incorrect DOUBLE value: 'SEA'
Warning	1292	Truncated incorrect DOUBLE value: 'DEN'
Warning	1292	Truncated incorrect DOUBLE value: 'SEA'
Warning	1292	Truncated incorrect DOUBLE value: 'SEA'
Warning	1292	Truncated incorrect DOUBLE value: 'NYC'
Warning	1292	Truncated incorrect DOUBLE value: 'DD1'
Warning	1292	Truncated incorrect DOUBLE value: 'DD2'
Warning	1292	Truncated incorrect DOUBLE value: 'DD3'
Warning	1292	Truncated incorrect DOUBLE value: 'DAL'
Warning	1292	Truncated incorrect DOUBLE value: 'SEA'
Warning	1292	Truncated incorrect DOUBLE value: 'ATL'
Warning	1292	Truncated incorrect DOUBLE value: 'WDC'
Warning	1292	Truncated incorrect DOUBLE value: 'CHI'
Warning	1292	Truncated incorrect DOUBLE value: 'LAX'
Warning	1292	Truncated incorrect DOUBLE value: 'MON'
Warning	1292	Truncated incorrect DOUBLE value: 'LED'
Warning	1292	Truncated incorrect DOUBLE value: 'MIN'
Warning	1292	Truncated incorrect DOUBLE value: 'CHI'
select sign(a1),a2 from t1;
sign(a1)	a2
0	0
0	0
0	3
0	-2
0	1
0	3
0	-3
0	-3
0	3
0	1
0	-3
0	-1
0	NULL
0	0
0	-2
0	1
0	NULL
0	2
Warnings:
Warning	1292	Truncated incorrect DOUBLE value: 'AME'
Warning	1292	Truncated incorrect DOUBLE value: 'BDL'
Warning	1292	Truncated incorrect DOUBLE value: 'BMC'
Warning	1292	Truncated incorrect DOUBLE value: 'BOT'
Warning	1292	Truncated incorrect DOUBLE value: 'DTX'
Warning	1292	Truncated incorrect DOUBLE value: 'GG1'
Warning	1292	Truncated incorrect DOUBLE value: 'GG2'
Warning	1292	Truncated incorrect DOUBLE value: 'GG3'
Warning	1292	Truncated incorrect DOUBLE value: 'GTM'
Warning	1292	Truncated incorrect DOUBLE value: 'HBR'
Warning	1292	Truncated incorrect DOUBLE value: 'KKK'
Warning	1292	Truncated incorrect DOUBLE value: 'PLS'
Warning	1292	Truncated incorrect DOUBLE value: 'SSJ'
Warning	1292	Truncated incorrect DOUBLE value: 'TWU'
Warning	1292	Truncated incorrect DOUBLE value: 'VVV'
Warning	1292	Truncated incorrect DOUBLE value: 'WWW'
Warning	1292	Truncated incorrect DOUBLE value: 'XXX'
Warning	1292	Truncated incorrect DOUBLE value: 'ZAJ'
select sign(a2) from t1 where sign(a4) >= 0;
sign(a2)
0
1
1
-1
1
-1
select sign(a4) from t1 where sign(a2) <=0 AND a2 < 2;
sign(a4)
1
-1
-1
1
-1
NULL
-1
-1
1
select * from t1 group by sign(a2);
a1	a2	a3	a4	a5
AME	0	SEA	0.1	timestamp
BMC	3	SEA	-0.085	timestamp
BOT	-2	SEA	-0.085	timestamp
SSJ	NULL	CHI	NULL	timestamp
select * from t1 order by sign(a4) ;
a1	a2	a3	a4	a5
XXX	NULL	MIN	NULL	timestamp
WWW	1	LED	NULL	timestamp
SSJ	NULL	CHI	NULL	timestamp
KKK	-3	ATL	NULL	timestamp
BDL	0	DEN	-0.08	timestamp
ZAJ	2	CHI	-0.075	timestamp
TWU	0	LAX	-0.08	timestamp
PLS	-1	WDC	-0.075	timestamp
GTM	3	DAL	-0.07	timestamp
GG3	-3	DD3	-0.051	timestamp
BOT	-2	SEA	-0.085	timestamp
BMC	3	SEA	-0.085	timestamp
HBR	1	SEA	0.085	timestamp
GG2	-3	DD2	0.052	timestamp
GG1	3	DD1	0.053	timestamp
DTX	1	NYC	0.08	timestamp
VVV	-2	MON	0.075	timestamp
AME	0	SEA	0.1	timestamp
select * from t1 order by sign(a4) , a4 ;
a1	a2	a3	a4	a5
XXX	NULL	MIN	NULL	timestamp
WWW	1	LED	NULL	timestamp
SSJ	NULL	CHI	NULL	timestamp
KKK	-3	ATL	NULL	timestamp
BMC	3	SEA	-0.085	timestamp
BOT	-2	SEA	-0.085	timestamp
BDL	0	DEN	-0.08	timestamp
TWU	0	LAX	-0.08	timestamp
ZAJ	2	CHI	-0.075	timestamp
PLS	-1	WDC	-0.075	timestamp
GTM	3	DAL	-0.07	timestamp
GG3	-3	DD3	-0.051	timestamp
GG2	-3	DD2	0.052	timestamp
GG1	3	DD1	0.053	timestamp
VVV	-2	MON	0.075	timestamp
DTX	1	NYC	0.08	timestamp
HBR	1	SEA	0.085	timestamp
AME	0	SEA	0.1	timestamp
select * from t1 order by sign(a4) , a1 ;
a1	a2	a3	a4	a5
KKK	-3	ATL	NULL	timestamp
SSJ	NULL	CHI	NULL	timestamp
WWW	1	LED	NULL	timestamp
XXX	NULL	MIN	NULL	timestamp
BDL	0	DEN	-0.08	timestamp
BMC	3	SEA	-0.085	timestamp
BOT	-2	SEA	-0.085	timestamp
GG3	-3	DD3	-0.051	timestamp
GTM	3	DAL	-0.07	timestamp
PLS	-1	WDC	-0.075	timestamp
TWU	0	LAX	-0.08	timestamp
ZAJ	2	CHI	-0.075	timestamp
AME	0	SEA	0.1	timestamp
DTX	1	NYC	0.08	timestamp
GG1	3	DD1	0.053	timestamp
GG2	-3	DD2	0.052	timestamp
HBR	1	SEA	0.085	timestamp
VVV	-2	MON	0.075	timestamp
select abs(a2) , sum(a4) from t1 group by abs(a2) having sum(sign(a4)) > 0;
abs(a2)	sum(a4)
1	0.08999999612569809
select * from t1 where a2 = sign ( floor(1.5) - ceil(1.5) + round(1.5) - abs(-1.5) + neg(-1) );
a1	a2	a3	a4	a5
DTX	1	NYC	0.08	timestamp
HBR	1	SEA	0.085	timestamp
WWW	1	LED	NULL	timestamp
select sign( sum(a2) ) , sign( sum(a4) ) from t1;
sign( sum(a2) )	sign( sum(a4) )
0	-1
select sign( avg(a2) ) , sign( avg(a4) ) from t1;
sign( avg(a2) )	sign( avg(a4) )
0	-1
select sign( max(a2) ) , sign( min(a4) ) from t1;
sign( max(a2) )	sign( min(a4) )
1	-1
select sign(count(*)) from t1;
sign(count(*))
1
select * from t1 where sign( length(a1) ) = 1;
a1	a2	a3	a4	a5
AME	0	SEA	0.1	timestamp
BDL	0	DEN	-0.08	timestamp
BMC	3	SEA	-0.085	timestamp
BOT	-2	SEA	-0.085	timestamp
DTX	1	NYC	0.08	timestamp
GG1	3	DD1	0.053	timestamp
GG2	-3	DD2	0.052	timestamp
GG3	-3	DD3	-0.051	timestamp
GTM	3	DAL	-0.07	timestamp
HBR	1	SEA	0.085	timestamp
KKK	-3	ATL	NULL	timestamp
PLS	-1	WDC	-0.075	timestamp
SSJ	NULL	CHI	NULL	timestamp
TWU	0	LAX	-0.08	timestamp
VVV	-2	MON	0.075	timestamp
WWW	1	LED	NULL	timestamp
XXX	NULL	MIN	NULL	timestamp
ZAJ	2	CHI	-0.075	timestamp
select sign( cast(a1 as char(1024)) ) , sign( cast(a3 as char(1024)) ) from t1;
sign( cast(a1 as char(1024)) )	sign( cast(a3 as char(1024)) )
0	0
0	0
0	0
0	0
0	0
0	0
0	0
0	0
0	0
0	0
0	0
0	0
0	0
0	0
0	0
0	0
0	0
0	0
Warnings:
Warning	1292	Truncated incorrect DOUBLE value: 'AME'
Warning	1292	Truncated incorrect DOUBLE value: 'SEA'
Warning	1292	Truncated incorrect DOUBLE value: 'BDL'
Warning	1292	Truncated incorrect DOUBLE value: 'DEN'
Warning	1292	Truncated incorrect DOUBLE value: 'BMC'
Warning	1292	Truncated incorrect DOUBLE value: 'SEA'
Warning	1292	Truncated incorrect DOUBLE value: 'BOT'
Warning	1292	Truncated incorrect DOUBLE value: 'SEA'
Warning	1292	Truncated incorrect DOUBLE value: 'DTX'
Warning	1292	Truncated incorrect DOUBLE value: 'NYC'
Warning	1292	Truncated incorrect DOUBLE value: 'GG1'
Warning	1292	Truncated incorrect DOUBLE value: 'DD1'
Warning	1292	Truncated incorrect DOUBLE value: 'GG2'
Warning	1292	Truncated incorrect DOUBLE value: 'DD2'
Warning	1292	Truncated incorrect DOUBLE value: 'GG3'
Warning	1292	Truncated incorrect DOUBLE value: 'DD3'
Warning	1292	Truncated incorrect DOUBLE value: 'GTM'
Warning	1292	Truncated incorrect DOUBLE value: 'DAL'
Warning	1292	Truncated incorrect DOUBLE value: 'HBR'
Warning	1292	Truncated incorrect DOUBLE value: 'SEA'
Warning	1292	Truncated incorrect DOUBLE value: 'KKK'
Warning	1292	Truncated incorrect DOUBLE value: 'ATL'
Warning	1292	Truncated incorrect DOUBLE value: 'PLS'
Warning	1292	Truncated incorrect DOUBLE value: 'WDC'
Warning	1292	Truncated incorrect DOUBLE value: 'SSJ'
Warning	1292	Truncated incorrect DOUBLE value: 'CHI'
Warning	1292	Truncated incorrect DOUBLE value: 'TWU'
Warning	1292	Truncated incorrect DOUBLE value: 'LAX'
Warning	1292	Truncated incorrect DOUBLE value: 'VVV'
Warning	1292	Truncated incorrect DOUBLE value: 'MON'
Warning	1292	Truncated incorrect DOUBLE value: 'WWW'
Warning	1292	Truncated incorrect DOUBLE value: 'LED'
Warning	1292	Truncated incorrect DOUBLE value: 'XXX'
Warning	1292	Truncated incorrect DOUBLE value: 'MIN'
Warning	1292	Truncated incorrect DOUBLE value: 'ZAJ'
Warning	1292	Truncated incorrect DOUBLE value: 'CHI'
select sign( cast(a2 as char(1024)) ) , sign( cast(a4 as char(1024)) ) from t1;
sign( cast(a2 as char(1024)) )	sign( cast(a4 as char(1024)) )
0	1
0	-1
1	-1
-1	-1
1	1
1	1
-1	1
-1	-1
1	-1
1	1
-1	NULL
-1	-1
NULL	NULL
0	-1
-1	1
1	NULL
NULL	NULL
1	-1
select * from t1 as t11 join t1 as t12 on sign(t11.a2) = sign(t12.a4);
a1	a2	a3	a4	a5	a1	a2	a3	a4	a5
ZAJ	2	CHI	-0.075	1960-06-15 00:00:00	AME	0	SEA	0.1	1942-02-19 00:00:00
WWW	1	LED	NULL	NULL	AME	0	SEA	0.1	1942-02-19 00:00:00
HBR	1	SEA	0.085	1948-03-05 00:00:00	AME	0	SEA	0.1	1942-02-19 00:00:00
GTM	3	DAL	-0.07	1977-09-23 00:00:00	AME	0	SEA	0.1	1942-02-19 00:00:00
GG1	3	DD1	0.053	1974-03-19 00:00:00	AME	0	SEA	0.1	1942-02-19 00:00:00
DTX	1	NYC	0.08	1961-05-04 00:00:00	AME	0	SEA	0.1	1942-02-19 00:00:00
BMC	3	SEA	-0.085	1958-09-08 00:00:00	AME	0	SEA	0.1	1942-02-19 00:00:00
VVV	-2	MON	0.075	1959-06-28 00:00:00	BDL	0	DEN	-0.08	1960-11-27 00:00:00
PLS	-1	WDC	-0.075	1949-01-02 00:00:00	BDL	0	DEN	-0.08	1960-11-27 00:00:00
KKK	-3	ATL	NULL	NULL	BDL	0	DEN	-0.08	1960-11-27 00:00:00
GG3	-3	DD3	-0.051	1974-03-19 00:00:00	BDL	0	DEN	-0.08	1960-11-27 00:00:00
GG2	-3	DD2	0.052	1974-03-19 00:00:00	BDL	0	DEN	-0.08	1960-11-27 00:00:00
BOT	-2	SEA	-0.085	1951-11-29 00:00:00	BDL	0	DEN	-0.08	1960-11-27 00:00:00
VVV	-2	MON	0.075	1959-06-28 00:00:00	BMC	3	SEA	-0.085	1958-09-08 00:00:00
PLS	-1	WDC	-0.075	1949-01-02 00:00:00	BMC	3	SEA	-0.085	1958-09-08 00:00:00
KKK	-3	ATL	NULL	NULL	BMC	3	SEA	-0.085	1958-09-08 00:00:00
GG3	-3	DD3	-0.051	1974-03-19 00:00:00	BMC	3	SEA	-0.085	1958-09-08 00:00:00
GG2	-3	DD2	0.052	1974-03-19 00:00:00	BMC	3	SEA	-0.085	1958-09-08 00:00:00
BOT	-2	SEA	-0.085	1951-11-29 00:00:00	BMC	3	SEA	-0.085	1958-09-08 00:00:00
VVV	-2	MON	0.075	1959-06-28 00:00:00	BOT	-2	SEA	-0.085	1951-11-29 00:00:00
PLS	-1	WDC	-0.075	1949-01-02 00:00:00	BOT	-2	SEA	-0.085	1951-11-29 00:00:00
KKK	-3	ATL	NULL	NULL	BOT	-2	SEA	-0.085	1951-11-29 00:00:00
GG3	-3	DD3	-0.051	1974-03-19 00:00:00	BOT	-2	SEA	-0.085	1951-11-29 00:00:00
GG2	-3	DD2	0.052	1974-03-19 00:00:00	BOT	-2	SEA	-0.085	1951-11-29 00:00:00
BOT	-2	SEA	-0.085	1951-11-29 00:00:00	BOT	-2	SEA	-0.085	1951-11-29 00:00:00
ZAJ	2	CHI	-0.075	1960-06-15 00:00:00	DTX	1	NYC	0.08	1961-05-04 00:00:00
WWW	1	LED	NULL	NULL	DTX	1	NYC	0.08	1961-05-04 00:00:00
HBR	1	SEA	0.085	1948-03-05 00:00:00	DTX	1	NYC	0.08	1961-05-04 00:00:00
GTM	3	DAL	-0.07	1977-09-23 00:00:00	DTX	1	NYC	0.08	1961-05-04 00:00:00
GG1	3	DD1	0.053	1974-03-19 00:00:00	DTX	1	NYC	0.08	1961-05-04 00:00:00
DTX	1	NYC	0.08	1961-05-04 00:00:00	DTX	1	NYC	0.08	1961-05-04 00:00:00
BMC	3	SEA	-0.085	1958-09-08 00:00:00	DTX	1	NYC	0.08	1961-05-04 00:00:00
ZAJ	2	CHI	-0.075	1960-06-15 00:00:00	GG1	3	DD1	0.053	1974-03-19 00:00:00
WWW	1	LED	NULL	NULL	GG1	3	DD1	0.053	1974-03-19 00:00:00
HBR	1	SEA	0.085	1948-03-05 00:00:00	GG1	3	DD1	0.053	1974-03-19 00:00:00
GTM	3	DAL	-0.07	1977-09-23 00:00:00	GG1	3	DD1	0.053	1974-03-19 00:00:00
GG1	3	DD1	0.053	1974-03-19 00:00:00	GG1	3	DD1	0.053	1974-03-19 00:00:00
DTX	1	NYC	0.08	1961-05-04 00:00:00	GG1	3	DD1	0.053	1974-03-19 00:00:00
BMC	3	SEA	-0.085	1958-09-08 00:00:00	GG1	3	DD1	0.053	1974-03-19 00:00:00
ZAJ	2	CHI	-0.075	1960-06-15 00:00:00	GG2	-3	DD2	0.052	1974-03-19 00:00:00
WWW	1	LED	NULL	NULL	GG2	-3	DD2	0.052	1974-03-19 00:00:00
HBR	1	SEA	0.085	1948-03-05 00:00:00	GG2	-3	DD2	0.052	1974-03-19 00:00:00
GTM	3	DAL	-0.07	1977-09-23 00:00:00	GG2	-3	DD2	0.052	1974-03-19 00:00:00
GG1	3	DD1	0.053	1974-03-19 00:00:00	GG2	-3	DD2	0.052	1974-03-19 00:00:00
DTX	1	NYC	0.08	1961-05-04 00:00:00	GG2	-3	DD2	0.052	1974-03-19 00:00:00
BMC	3	SEA	-0.085	1958-09-08 00:00:00	GG2	-3	DD2	0.052	1974-03-19 00:00:00
VVV	-2	MON	0.075	1959-06-28 00:00:00	GG3	-3	DD3	-0.051	1974-03-19 00:00:00
PLS	-1	WDC	-0.075	1949-01-02 00:00:00	GG3	-3	DD3	-0.051	1974-03-19 00:00:00
KKK	-3	ATL	NULL	NULL	GG3	-3	DD3	-0.051	1974-03-19 00:00:00
GG3	-3	DD3	-0.051	1974-03-19 00:00:00	GG3	-3	DD3	-0.051	1974-03-19 00:00:00
GG2	-3	DD2	0.052	1974-03-19 00:00:00	GG3	-3	DD3	-0.051	1974-03-19 00:00:00
BOT	-2	SEA	-0.085	1951-11-29 00:00:00	GG3	-3	DD3	-0.051	1974-03-19 00:00:00
VVV	-2	MON	0.075	1959-06-28 00:00:00	GTM	3	DAL	-0.07	1977-09-23 00:00:00
PLS	-1	WDC	-0.075	1949-01-02 00:00:00	GTM	3	DAL	-0.07	1977-09-23 00:00:00
KKK	-3	ATL	NULL	NULL	GTM	3	DAL	-0.07	1977-09-23 00:00:00
GG3	-3	DD3	-0.051	1974-03-19 00:00:00	GTM	3	DAL	-0.07	1977-09-23 00:00:00
GG2	-3	DD2	0.052	1974-03-19 00:00:00	GTM	3	DAL	-0.07	1977-09-23 00:00:00
BOT	-2	SEA	-0.085	1951-11-29 00:00:00	GTM	3	DAL	-0.07	1977-09-23 00:00:00
ZAJ	2	CHI	-0.075	1960-06-15 00:00:00	HBR	1	SEA	0.085	1948-03-05 00:00:00
WWW	1	LED	NULL	NULL	HBR	1	SEA	0.085	1948-03-05 00:00:00
HBR	1	SEA	0.085	1948-03-05 00:00:00	HBR	1	SEA	0.085	1948-03-05 00:00:00
GTM	3	DAL	-0.07	1977-09-23 00:00:00	HBR	1	SEA	0.085	1948-03-05 00:00:00
GG1	3	DD1	0.053	1974-03-19 00:00:00	HBR	1	SEA	0.085	1948-03-05 00:00:00
DTX	1	NYC	0.08	1961-05-04 00:00:00	HBR	1	SEA	0.085	1948-03-05 00:00:00
BMC	3	SEA	-0.085	1958-09-08 00:00:00	HBR	1	SEA	0.085	1948-03-05 00:00:00
VVV	-2	MON	0.075	1959-06-28 00:00:00	PLS	-1	WDC	-0.075	1949-01-02 00:00:00
PLS	-1	WDC	-0.075	1949-01-02 00:00:00	PLS	-1	WDC	-0.075	1949-01-02 00:00:00
KKK	-3	ATL	NULL	NULL	PLS	-1	WDC	-0.075	1949-01-02 00:00:00
GG3	-3	DD3	-0.051	1974-03-19 00:00:00	PLS	-1	WDC	-0.075	1949-01-02 00:00:00
GG2	-3	DD2	0.052	1974-03-19 00:00:00	PLS	-1	WDC	-0.075	1949-01-02 00:00:00
BOT	-2	SEA	-0.085	1951-11-29 00:00:00	PLS	-1	WDC	-0.075	1949-01-02 00:00:00
VVV	-2	MON	0.075	1959-06-28 00:00:00	TWU	0	LAX	-0.08	1969-10-05 00:00:00
PLS	-1	WDC	-0.075	1949-01-02 00:00:00	TWU	0	LAX	-0.08	1969-10-05 00:00:00
KKK	-3	ATL	NULL	NULL	TWU	0	LAX	-0.08	1969-10-05 00:00:00
GG3	-3	DD3	-0.051	1974-03-19 00:00:00	TWU	0	LAX	-0.08	1969-10-05 00:00:00
GG2	-3	DD2	0.052	1974-03-19 00:00:00	TWU	0	LAX	-0.08	1969-10-05 00:00:00
BOT	-2	SEA	-0.085	1951-11-29 00:00:00	TWU	0	LAX	-0.08	1969-10-05 00:00:00
ZAJ	2	CHI	-0.075	1960-06-15 00:00:00	VVV	-2	MON	0.075	1959-06-28 00:00:00
WWW	1	LED	NULL	NULL	VVV	-2	MON	0.075	1959-06-28 00:00:00
HBR	1	SEA	0.085	1948-03-05 00:00:00	VVV	-2	MON	0.075	1959-06-28 00:00:00
GTM	3	DAL	-0.07	1977-09-23 00:00:00	VVV	-2	MON	0.075	1959-06-28 00:00:00
GG1	3	DD1	0.053	1974-03-19 00:00:00	VVV	-2	MON	0.075	1959-06-28 00:00:00
DTX	1	NYC	0.08	1961-05-04 00:00:00	VVV	-2	MON	0.075	1959-06-28 00:00:00
BMC	3	SEA	-0.085	1958-09-08 00:00:00	VVV	-2	MON	0.075	1959-06-28 00:00:00
VVV	-2	MON	0.075	1959-06-28 00:00:00	ZAJ	2	CHI	-0.075	1960-06-15 00:00:00
PLS	-1	WDC	-0.075	1949-01-02 00:00:00	ZAJ	2	CHI	-0.075	1960-06-15 00:00:00
KKK	-3	ATL	NULL	NULL	ZAJ	2	CHI	-0.075	1960-06-15 00:00:00
GG3	-3	DD3	-0.051	1974-03-19 00:00:00	ZAJ	2	CHI	-0.075	1960-06-15 00:00:00
GG2	-3	DD2	0.052	1974-03-19 00:00:00	ZAJ	2	CHI	-0.075	1960-06-15 00:00:00
BOT	-2	SEA	-0.085	1951-11-29 00:00:00	ZAJ	2	CHI	-0.075	1960-06-15 00:00:00
select tmp.a1 , sign(tmp.a2) , tmp.a3 , sign(tmp.a4) from t1 as tmp;
a1	sign(tmp.a2)	a3	sign(tmp.a4)
AME	0	SEA	1
BDL	0	DEN	-1
BMC	1	SEA	-1
BOT	-1	SEA	-1
DTX	1	NYC	1
GG1	1	DD1	1
GG2	-1	DD2	1
GG3	-1	DD3	-1
GTM	1	DAL	-1
HBR	1	SEA	1
KKK	-1	ATL	NULL
PLS	-1	WDC	-1
SSJ	NULL	CHI	NULL
TWU	0	LAX	-1
VVV	-1	MON	1
WWW	1	LED	NULL
XXX	NULL	MIN	NULL
ZAJ	1	CHI	-1
select sign(a2) from t1 where sign(a4) >= 0 for update;
sign(a2)
0
1
1
-1
1
-1
select sign(a4) from t1 where sign(a2) <=0 AND a2 < 2 for update;
sign(a4)
1
-1
-1
1
-1
NULL
-1
-1
1
select * from t1 group by sign(a2) for update;
a1	a2	a3	a4	a5
AME	0	SEA	0.1	1942-02-19 00:00:00
BMC	3	SEA	-0.085	1958-09-08 00:00:00
BOT	-2	SEA	-0.085	1951-11-29 00:00:00
SSJ	NULL	CHI	NULL	1974-03-19 00:00:00
select * from t1 order by sign(a4) for update;
a1	a2	a3	a4	a5
XXX	NULL	MIN	NULL	NULL
WWW	1	LED	NULL	NULL
SSJ	NULL	CHI	NULL	1974-03-19 00:00:00
KKK	-3	ATL	NULL	NULL
BDL	0	DEN	-0.08	1960-11-27 00:00:00
ZAJ	2	CHI	-0.075	1960-06-15 00:00:00
TWU	0	LAX	-0.08	1969-10-05 00:00:00
PLS	-1	WDC	-0.075	1949-01-02 00:00:00
GTM	3	DAL	-0.07	1977-09-23 00:00:00
GG3	-3	DD3	-0.051	1974-03-19 00:00:00
BOT	-2	SEA	-0.085	1951-11-29 00:00:00
BMC	3	SEA	-0.085	1958-09-08 00:00:00
HBR	1	SEA	0.085	1948-03-05 00:00:00
GG2	-3	DD2	0.052	1974-03-19 00:00:00
GG1	3	DD1	0.053	1974-03-19 00:00:00
DTX	1	NYC	0.08	1961-05-04 00:00:00
VVV	-2	MON	0.075	1959-06-28 00:00:00
AME	0	SEA	0.1	1942-02-19 00:00:00
select abs(a2) , sum(a4) from t1 group by abs(a2) having sum(sign(a4)) > 0 for update;
abs(a2)	sum(a4)
1	0.08999999612569809
select * from t1 where a2 = sign ( floor(1.5) - ceil(1.5) + round(1.5) - abs(-1.5) + neg(-1) ) for update;
a1	a2	a3	a4	a5
DTX	1	NYC	0.08	timestamp
HBR	1	SEA	0.085	timestamp
WWW	1	LED	NULL	timestamp
select sign( sum(a2) ) , sign( sum(a4) ) from t1 for update;
sign( sum(a2) )	sign( sum(a4) )
0	-1
select sign( avg(a2) ) , sign( avg(a4) ) from t1 for update;
sign( avg(a2) )	sign( avg(a4) )
0	-1
select sign( max(a2) ) , sign( min(a4) ) from t1 for update;
sign( max(a2) )	sign( min(a4) )
1	-1
select sign(count(*)) from t1 for update;
sign(count(*))
1
select * from t1 where sign( length(a1) ) = 1 for update;
a1	a2	a3	a4	a5
AME	0	SEA	0.1	timestamp
BDL	0	DEN	-0.08	timestamp
BMC	3	SEA	-0.085	timestamp
BOT	-2	SEA	-0.085	timestamp
DTX	1	NYC	0.08	timestamp
GG1	3	DD1	0.053	timestamp
GG2	-3	DD2	0.052	timestamp
GG3	-3	DD3	-0.051	timestamp
GTM	3	DAL	-0.07	timestamp
HBR	1	SEA	0.085	timestamp
KKK	-3	ATL	NULL	timestamp
PLS	-1	WDC	-0.075	timestamp
SSJ	NULL	CHI	NULL	timestamp
TWU	0	LAX	-0.08	timestamp
VVV	-2	MON	0.075	timestamp
WWW	1	LED	NULL	timestamp
XXX	NULL	MIN	NULL	timestamp
ZAJ	2	CHI	-0.075	timestamp
select sign( cast(a1 as char(1024)) ) , sign( cast(a3 as char(1024)) ) from t1 for update;
sign( cast(a1 as char(1024)) )	sign( cast(a3 as char(1024)) )
0	0
0	0
0	0
0	0
0	0
0	0
0	0
0	0
0	0
0	0
0	0
0	0
0	0
0	0
0	0
0	0
0	0
0	0
Warnings:
Warning	1292	Truncated incorrect DOUBLE value: 'AME'
Warning	1292	Truncated incorrect DOUBLE value: 'SEA'
Warning	1292	Truncated incorrect DOUBLE value: 'BDL'
Warning	1292	Truncated incorrect DOUBLE value: 'DEN'
Warning	1292	Truncated incorrect DOUBLE value: 'BMC'
Warning	1292	Truncated incorrect DOUBLE value: 'SEA'
Warning	1292	Truncated incorrect DOUBLE value: 'BOT'
Warning	1292	Truncated incorrect DOUBLE value: 'SEA'
Warning	1292	Truncated incorrect DOUBLE value: 'DTX'
Warning	1292	Truncated incorrect DOUBLE value: 'NYC'
Warning	1292	Truncated incorrect DOUBLE value: 'GG1'
Warning	1292	Truncated incorrect DOUBLE value: 'DD1'
Warning	1292	Truncated incorrect DOUBLE value: 'GG2'
Warning	1292	Truncated incorrect DOUBLE value: 'DD2'
Warning	1292	Truncated incorrect DOUBLE value: 'GG3'
Warning	1292	Truncated incorrect DOUBLE value: 'DD3'
Warning	1292	Truncated incorrect DOUBLE value: 'GTM'
Warning	1292	Truncated incorrect DOUBLE value: 'DAL'
Warning	1292	Truncated incorrect DOUBLE value: 'HBR'
Warning	1292	Truncated incorrect DOUBLE value: 'SEA'
Warning	1292	Truncated incorrect DOUBLE value: 'KKK'
Warning	1292	Truncated incorrect DOUBLE value: 'ATL'
Warning	1292	Truncated incorrect DOUBLE value: 'PLS'
Warning	1292	Truncated incorrect DOUBLE value: 'WDC'
Warning	1292	Truncated incorrect DOUBLE value: 'SSJ'
Warning	1292	Truncated incorrect DOUBLE value: 'CHI'
Warning	1292	Truncated incorrect DOUBLE value: 'TWU'
Warning	1292	Truncated incorrect DOUBLE value: 'LAX'
Warning	1292	Truncated incorrect DOUBLE value: 'VVV'
Warning	1292	Truncated incorrect DOUBLE value: 'MON'
Warning	1292	Truncated incorrect DOUBLE value: 'WWW'
Warning	1292	Truncated incorrect DOUBLE value: 'LED'
Warning	1292	Truncated incorrect DOUBLE value: 'XXX'
Warning	1292	Truncated incorrect DOUBLE value: 'MIN'
Warning	1292	Truncated incorrect DOUBLE value: 'ZAJ'
Warning	1292	Truncated incorrect DOUBLE value: 'CHI'
select sign( cast(a2 as char(1024)) ) , sign( cast(a4 as char(1024)) ) from t1 for update;
sign( cast(a2 as char(1024)) )	sign( cast(a4 as char(1024)) )
0	1
0	-1
1	-1
-1	-1
1	1
1	1
-1	1
-1	-1
1	-1
1	1
-1	NULL
-1	-1
NULL	NULL
0	-1
-1	1
1	NULL
NULL	NULL
1	-1
insert into t1(a1, a2) values('III' , sign(0.1) );
replace into t1(a1, a2) values('RRR' , sign(0.1) );
select * from t1;
a1	a2	a3	a4	a5
AME	0	SEA	0.1	timestamp
BDL	0	DEN	-0.08	timestamp
BMC	3	SEA	-0.085	timestamp
BOT	-2	SEA	-0.085	timestamp
DTX	1	NYC	0.08	timestamp
GG1	3	DD1	0.053	timestamp
GG2	-3	DD2	0.052	timestamp
GG3	-3	DD3	-0.051	timestamp
GTM	3	DAL	-0.07	timestamp
HBR	1	SEA	0.085	timestamp
III	1	NULL	NULL	timestamp
KKK	-3	ATL	NULL	timestamp
PLS	-1	WDC	-0.075	timestamp
RRR	1	NULL	NULL	timestamp
SSJ	NULL	CHI	NULL	timestamp
TWU	0	LAX	-0.08	timestamp
VVV	-2	MON	0.075	timestamp
WWW	1	LED	NULL	timestamp
XXX	NULL	MIN	NULL	timestamp
ZAJ	2	CHI	-0.075	timestamp
update t1 set a4 = a4 + sign(a4) where a1 > 'SSS';
select * from t1;
a1	a2	a3	a4	a5
AME	0	SEA	0.1	timestamp
BDL	0	DEN	-0.08	timestamp
BMC	3	SEA	-0.085	timestamp
BOT	-2	SEA	-0.085	timestamp
DTX	1	NYC	0.08	timestamp
GG1	3	DD1	0.053	timestamp
GG2	-3	DD2	0.052	timestamp
GG3	-3	DD3	-0.051	timestamp
GTM	3	DAL	-0.07	timestamp
HBR	1	SEA	0.085	timestamp
III	1	NULL	NULL	timestamp
KKK	-3	ATL	NULL	timestamp
PLS	-1	WDC	-0.075	timestamp
RRR	1	NULL	NULL	timestamp
SSJ	NULL	CHI	NULL	timestamp
TWU	0	LAX	-1.08	timestamp
VVV	-2	MON	1.075	timestamp
WWW	1	LED	NULL	timestamp
XXX	NULL	MIN	NULL	timestamp
ZAJ	2	CHI	-1.075	timestamp
update t1 set a2 = 10 + sign(a2) where sign(a4) > 0;
select * from t1;
a1	a2	a3	a4	a5
AME	10	SEA	0.1	timestamp
BDL	0	DEN	-0.08	timestamp
BMC	3	SEA	-0.085	timestamp
BOT	-2	SEA	-0.085	timestamp
DTX	11	NYC	0.08	timestamp
GG1	11	DD1	0.053	timestamp
GG2	9	DD2	0.052	timestamp
GG3	-3	DD3	-0.051	timestamp
GTM	3	DAL	-0.07	timestamp
HBR	11	SEA	0.085	timestamp
III	1	NULL	NULL	timestamp
KKK	-3	ATL	NULL	timestamp
PLS	-1	WDC	-0.075	timestamp
RRR	1	NULL	NULL	timestamp
SSJ	NULL	CHI	NULL	timestamp
TWU	0	LAX	-1.08	timestamp
VVV	9	MON	1.075	timestamp
WWW	1	LED	NULL	timestamp
XXX	NULL	MIN	NULL	timestamp
ZAJ	2	CHI	-1.075	timestamp
delete from t1 where sign(a2) = 0;
select * from t1;
a1	a2	a3	a4	a5
AME	10	SEA	0.1	timestamp
BMC	3	SEA	-0.085	timestamp
BOT	-2	SEA	-0.085	timestamp
DTX	11	NYC	0.08	timestamp
GG1	11	DD1	0.053	timestamp
GG2	9	DD2	0.052	timestamp
GG3	-3	DD3	-0.051	timestamp
GTM	3	DAL	-0.07	timestamp
HBR	11	SEA	0.085	timestamp
III	1	NULL	NULL	timestamp
KKK	-3	ATL	NULL	timestamp
PLS	-1	WDC	-0.075	timestamp
RRR	1	NULL	NULL	timestamp
SSJ	NULL	CHI	NULL	timestamp
VVV	9	MON	1.075	timestamp
WWW	1	LED	NULL	timestamp
XXX	NULL	MIN	NULL	timestamp
ZAJ	2	CHI	-1.075	timestamp
delete from t1 where sign(a2) is null;
select * from t1;
a1	a2	a3	a4	a5
AME	10	SEA	0.1	timestamp
BMC	3	SEA	-0.085	timestamp
BOT	-2	SEA	-0.085	timestamp
DTX	11	NYC	0.08	timestamp
GG1	11	DD1	0.053	timestamp
GG2	9	DD2	0.052	timestamp
GG3	-3	DD3	-0.051	timestamp
GTM	3	DAL	-0.07	timestamp
HBR	11	SEA	0.085	timestamp
III	1	NULL	NULL	timestamp
KKK	-3	ATL	NULL	timestamp
PLS	-1	WDC	-0.075	timestamp
RRR	1	NULL	NULL	timestamp
VVV	9	MON	1.075	timestamp
WWW	1	LED	NULL	timestamp
ZAJ	2	CHI	-1.075	timestamp
