result_format: 4
drop table if exists t_div_zero_select, t_div_zero_insert, t_div_zero_update, t_div_zero_replace;
drop table if exists t_div_zero_partition;
drop procedure if exists p_div_zero;

############################# sql_mode with ERROR_FOR_DIVISION_BY_ZERO ############################
set sql_mode = 'STRICT_ALL_TABLES,ERROR_FOR_DIVISION_BY_ZERO';

############## test select ############
create table t_div_zero_select(c int);
insert into t_div_zero_select values(1);
insert into t_div_zero_select values(null);
select * from t_div_zero_select;
+------+
| c    |
+------+
|    1 |
| NULL |
+------+

select mod(c,0) from t_div_zero_select;
+----------+
| mod(c,0) |
+----------+
|     NULL |
|     NULL |
+----------+
select mod(c,-0) from t_div_zero_select;
+-----------+
| mod(c,-0) |
+-----------+
|      NULL |
|      NULL |
+-----------+
select mod(c,0.0) from t_div_zero_select;
+------------+
| mod(c,0.0) |
+------------+
|       NULL |
|       NULL |
+------------+
select mod(c,'0') from t_div_zero_select;
+------------+
| mod(c,'0') |
+------------+
|       NULL |
|       NULL |
+------------+
select mod(c,1-1) from t_div_zero_select;
+------------+
| mod(c,1-1) |
+------------+
|       NULL |
|       NULL |
+------------+
select * from t_div_zero_select where c > mod(1,0);
+------+
| c    |
+------+
+------+
select * from t_div_zero_select where c > mod(1,-0);
+------+
| c    |
+------+
+------+
select * from t_div_zero_select where c > mod(1,0.0);
+------+
| c    |
+------+
+------+
select * from t_div_zero_select where c > mod(1,'0');
+------+
| c    |
+------+
+------+
select * from t_div_zero_select where c > mod(1,1-1);
+------+
| c    |
+------+
+------+
select * from t_div_zero_select;
+------+
| c    |
+------+
|    1 |
| NULL |
+------+


############## test insert ############
create table t_div_zero_insert(c int);

insert into t_div_zero_insert values(mod(1,0));
ERROR 22012: Divided by zero
insert into t_div_zero_insert values(mod(1,-0));
ERROR 22012: Divided by zero
insert into t_div_zero_insert values(mod(1,0.0));
ERROR 22012: Divided by zero
insert into t_div_zero_insert values(mod(1,'0'));
ERROR 22012: Divided by zero
insert into t_div_zero_insert values(mod(1,1-1));
ERROR 22012: Divided by zero
select * from t_div_zero_insert;
+------+
| c    |
+------+
+------+

insert ignore into t_div_zero_insert values(mod(1,0));
insert ignore into t_div_zero_insert values(mod(1,-0));
insert ignore into t_div_zero_insert values(mod(1,0.0));
insert ignore into t_div_zero_insert values(mod(1,'0'));
insert ignore into t_div_zero_insert values(mod(1,1-1));
select * from t_div_zero_insert;
+------+
| c    |
+------+
| NULL |
| NULL |
| NULL |
| NULL |
| NULL |
+------+


############## test update ############
create table t_div_zero_update(c int);
insert into t_div_zero_update values(1);

update t_div_zero_update set c = mod(1,0);
ERROR 22012: Divided by zero
update t_div_zero_update set c = mod(1,-0);
ERROR 22012: Divided by zero
update t_div_zero_update set c = mod(1,0.0);
ERROR 22012: Divided by zero
update t_div_zero_update set c = mod(1,'0');
ERROR 22012: Divided by zero
update t_div_zero_update set c = mod(1,1-1);
ERROR 22012: Divided by zero
select * from t_div_zero_update;
+------+
| c    |
+------+
|    1 |
+------+

update ignore t_div_zero_update set c = mod(1,0);
update ignore t_div_zero_update set c = mod(1,-0);
update ignore t_div_zero_update set c = mod(1,0.0);
update ignore t_div_zero_update set c = mod(1,'0');
update ignore t_div_zero_update set c = mod(1,1-1);
select * from t_div_zero_update;
+------+
| c    |
+------+
| NULL |
+------+


############## test replace ###########
create table t_div_zero_replace(c int);

replace into t_div_zero_replace values(mod(1,0));
ERROR 22012: Divided by zero
replace into t_div_zero_replace values(mod(1,-0));
ERROR 22012: Divided by zero
replace into t_div_zero_replace values(mod(1,0.0));
ERROR 22012: Divided by zero
replace into t_div_zero_replace values(mod(1,'0'));
ERROR 22012: Divided by zero
replace into t_div_zero_replace values(mod(1,1-1));
ERROR 22012: Divided by zero
select * from t_div_zero_replace;
+------+
| c    |
+------+
+------+


############## test partition table ###
create table t_div_zero_partition(c int)
partition by list (mod(1,c)) (
  partition p0 values in (null),
  partition p1 values in (1)
);
insert into t_div_zero_partition values(0);
ERROR 22012: Divided by zero


############## test procedure #########
create procedure p_div_zero()
begin
drop table if exists p_t;
create table p_t(c int);
insert into p_t values(1);
select mod(c,0) from p_t;
insert into p_t values(mod(1,0));
end |

call p_div_zero();
+----------+
| mod(c,0) |
+----------+
|     NULL |
+----------+
ERROR 22012: Divided by zero


############## drop table #############
drop table if exists t_div_zero_select, t_div_zero_insert, t_div_zero_update, t_div_zero_replace;
drop table if exists t_div_zero_partition;
drop procedure if exists p_div_zero;


############################# sql_mode without ERROR_FOR_DIVISION_BY_ZERO #########################
set sql_mode = 'STRICT_ALL_TABLES';

############## test select ############
create table t_div_zero_select(c int);
insert into t_div_zero_select values(1);
insert into t_div_zero_select values(null);
select * from t_div_zero_select;
+------+
| c    |
+------+
|    1 |
| NULL |
+------+

select mod(c,0) from t_div_zero_select;
+----------+
| mod(c,0) |
+----------+
|     NULL |
|     NULL |
+----------+
select mod(c,-0) from t_div_zero_select;
+-----------+
| mod(c,-0) |
+-----------+
|      NULL |
|      NULL |
+-----------+
select mod(c,0.0) from t_div_zero_select;
+------------+
| mod(c,0.0) |
+------------+
|       NULL |
|       NULL |
+------------+
select mod(c,'0') from t_div_zero_select;
+------------+
| mod(c,'0') |
+------------+
|       NULL |
|       NULL |
+------------+
select mod(c,1-1) from t_div_zero_select;
+------------+
| mod(c,1-1) |
+------------+
|       NULL |
|       NULL |
+------------+
select * from t_div_zero_select where c > mod(1,0);
+------+
| c    |
+------+
+------+
select * from t_div_zero_select where c > mod(1,-0);
+------+
| c    |
+------+
+------+
select * from t_div_zero_select where c > mod(1,0.0);
+------+
| c    |
+------+
+------+
select * from t_div_zero_select where c > mod(1,'0');
+------+
| c    |
+------+
+------+
select * from t_div_zero_select where c > mod(1,1-1);
+------+
| c    |
+------+
+------+
select * from t_div_zero_select;
+------+
| c    |
+------+
|    1 |
| NULL |
+------+


############## test insert ############
create table t_div_zero_insert(c int);

insert into t_div_zero_insert values(mod(1,0));
insert into t_div_zero_insert values(mod(1,-0));
insert into t_div_zero_insert values(mod(1,0.0));
insert into t_div_zero_insert values(mod(1,'0'));
insert into t_div_zero_insert values(mod(1,1-1));
select * from t_div_zero_insert;
+------+
| c    |
+------+
| NULL |
| NULL |
| NULL |
| NULL |
| NULL |
+------+

insert ignore into t_div_zero_insert values(mod(1,0));
insert ignore into t_div_zero_insert values(mod(1,-0));
insert ignore into t_div_zero_insert values(mod(1,0.0));
insert ignore into t_div_zero_insert values(mod(1,'0'));
insert ignore into t_div_zero_insert values(mod(1,1-1));
select * from t_div_zero_insert;
+------+
| c    |
+------+
| NULL |
| NULL |
| NULL |
| NULL |
| NULL |
| NULL |
| NULL |
| NULL |
| NULL |
| NULL |
+------+


############## test update ############
create table t_div_zero_update(c int);
insert into t_div_zero_update values(1);

update t_div_zero_update set c = mod(1,0);
update t_div_zero_update set c = mod(1,-0);
update t_div_zero_update set c = mod(1,0.0);
update t_div_zero_update set c = mod(1,'0');
update t_div_zero_update set c = mod(1,1-1);
select * from t_div_zero_update;
+------+
| c    |
+------+
| NULL |
+------+

update ignore t_div_zero_update set c = mod(1,0);
update ignore t_div_zero_update set c = mod(1,-0);
update ignore t_div_zero_update set c = mod(1,0.0);
update ignore t_div_zero_update set c = mod(1,'0');
update ignore t_div_zero_update set c = mod(1,1-1);
select * from t_div_zero_update;
+------+
| c    |
+------+
| NULL |
+------+


############## test replace ###########
create table t_div_zero_replace(c int);

replace into t_div_zero_replace values(mod(1,0));
replace into t_div_zero_replace values(mod(1,-0));
replace into t_div_zero_replace values(mod(1,0.0));
replace into t_div_zero_replace values(mod(1,'0'));
replace into t_div_zero_replace values(mod(1,1-1));
select * from t_div_zero_replace;
+------+
| c    |
+------+
| NULL |
| NULL |
| NULL |
| NULL |
| NULL |
+------+


############## test partition table ###
create table t_div_zero_partition(c int)
partition by list (mod(1,c)) (
  partition p0 values in (null),
  partition p1 values in (1)
);
insert into t_div_zero_partition values(0);


############## test procedure #########
create procedure p_div_zero()
begin
drop table if exists p_t;
create table p_t(c int);
insert into p_t values(1);
select mod(c,0) from p_t;
insert into p_t values(mod(1,0));
end |

call p_div_zero();
+----------+
| mod(c,0) |
+----------+
|     NULL |
+----------+


############## drop table #############
drop table if exists t_div_zero_select, t_div_zero_insert, t_div_zero_update, t_div_zero_replace;
drop table if exists t_div_zero_partition;
drop procedure if exists p_div_zero;


############################# sql_mode without STRICT_ALL_TABLES ##################################
set sql_mode = 'ERROR_FOR_DIVISION_BY_ZERO';

############## test select ############
create table t_div_zero_select(c int);
insert into t_div_zero_select values(1);
insert into t_div_zero_select values(null);
select * from t_div_zero_select;
+------+
| c    |
+------+
|    1 |
| NULL |
+------+

select mod(c,0) from t_div_zero_select;
+----------+
| mod(c,0) |
+----------+
|     NULL |
|     NULL |
+----------+
select mod(c,-0) from t_div_zero_select;
+-----------+
| mod(c,-0) |
+-----------+
|      NULL |
|      NULL |
+-----------+
select mod(c,0.0) from t_div_zero_select;
+------------+
| mod(c,0.0) |
+------------+
|       NULL |
|       NULL |
+------------+
select mod(c,'0') from t_div_zero_select;
+------------+
| mod(c,'0') |
+------------+
|       NULL |
|       NULL |
+------------+
select mod(c,1-1) from t_div_zero_select;
+------------+
| mod(c,1-1) |
+------------+
|       NULL |
|       NULL |
+------------+
select * from t_div_zero_select where c > mod(1,0);
+------+
| c    |
+------+
+------+
select * from t_div_zero_select where c > mod(1,-0);
+------+
| c    |
+------+
+------+
select * from t_div_zero_select where c > mod(1,0.0);
+------+
| c    |
+------+
+------+
select * from t_div_zero_select where c > mod(1,'0');
+------+
| c    |
+------+
+------+
select * from t_div_zero_select where c > mod(1,1-1);
+------+
| c    |
+------+
+------+
select * from t_div_zero_select;
+------+
| c    |
+------+
|    1 |
| NULL |
+------+


############## test insert ############
create table t_div_zero_insert(c int);

insert into t_div_zero_insert values(mod(1,0));
insert into t_div_zero_insert values(mod(1,-0));
insert into t_div_zero_insert values(mod(1,0.0));
insert into t_div_zero_insert values(mod(1,'0'));
insert into t_div_zero_insert values(mod(1,1-1));
select * from t_div_zero_insert;
+------+
| c    |
+------+
| NULL |
| NULL |
| NULL |
| NULL |
| NULL |
+------+

insert ignore into t_div_zero_insert values(mod(1,0));
insert ignore into t_div_zero_insert values(mod(1,-0));
insert ignore into t_div_zero_insert values(mod(1,0.0));
insert ignore into t_div_zero_insert values(mod(1,'0'));
insert ignore into t_div_zero_insert values(mod(1,1-1));
select * from t_div_zero_insert;
+------+
| c    |
+------+
| NULL |
| NULL |
| NULL |
| NULL |
| NULL |
| NULL |
| NULL |
| NULL |
| NULL |
| NULL |
+------+


############## test update ############
create table t_div_zero_update(c int);
insert into t_div_zero_update values(1);

update t_div_zero_update set c = mod(1,0);
update t_div_zero_update set c = mod(1,-0);
update t_div_zero_update set c = mod(1,0.0);
update t_div_zero_update set c = mod(1,'0');
update t_div_zero_update set c = mod(1,1-1);
select * from t_div_zero_update;
+------+
| c    |
+------+
| NULL |
+------+

update ignore t_div_zero_update set c = mod(1,0);
update ignore t_div_zero_update set c = mod(1,-0);
update ignore t_div_zero_update set c = mod(1,0.0);
update ignore t_div_zero_update set c = mod(1,'0');
update ignore t_div_zero_update set c = mod(1,1-1);
select * from t_div_zero_update;
+------+
| c    |
+------+
| NULL |
+------+


############## test replace ###########
create table t_div_zero_replace(c int);

replace into t_div_zero_replace values(mod(1,0));
replace into t_div_zero_replace values(mod(1,-0));
replace into t_div_zero_replace values(mod(1,0.0));
replace into t_div_zero_replace values(mod(1,'0'));
replace into t_div_zero_replace values(mod(1,1-1));
select * from t_div_zero_replace;
+------+
| c    |
+------+
| NULL |
| NULL |
| NULL |
| NULL |
| NULL |
+------+


############## test partition table ###
create table t_div_zero_partition(c int)
partition by list (mod(1,c)) (
  partition p0 values in (null),
  partition p1 values in (1)
);
insert into t_div_zero_partition values(0);


############## test procedure #########
create procedure p_div_zero()
begin
drop table if exists p_t;
create table p_t(c int);
insert into p_t values(1);
select mod(c,0) from p_t;
insert into p_t values(mod(1,0));
end |

call p_div_zero();
+----------+
| mod(c,0) |
+----------+
|     NULL |
+----------+


############## drop table #############
drop table if exists t_div_zero_select, t_div_zero_insert, t_div_zero_update, t_div_zero_replace;
drop table if exists t_div_zero_partition;
drop procedure if exists p_div_zero;


#################################### reset sql mode ###############################################
set sql_mode = 'STRICT_ALL_TABLES,NO_ZERO_IN_DATE';
