#Environmental cleaning
drop user longpy@'%';
create user longpy identified by 'longpy';
grant all on *.* to longpy WITH GRANT OPTION;
DROP TABLE t1;
DROP TABLE t2;
DROP TABLE t3;
CREATE TABLE t1(id int,consumer char(20), brand varchar(20),sal int);
INSERT INTO t1 VALUES(1,'书局','apple',5000);
INSERT INTO t1 VALUES(2,'微山','xiaomi',4000);
INSERT INTO t1 VALUES(3,'深咖','oppo',3000);
INSERT INTO t1 VALUES(4,'流苏','huawei',6000);
CREATE TABLE t2(id int,model varchar(200),Price int);
INSERT INTO t2 VALUES(1,'apple 12',7000);
INSERT INTO t2 VALUES(2,'xiaomi 9',5000);
INSERT INTO t2 VALUES(3,'oppo findx',6000);
INSERT INTO t2 VALUES(4,'huawei mata30',8000);
obmysql-LEAST-3
obmysql-LEAST-3-1
SELECT LEAST(e.id,e.consumer,e.brand,e.sal) FROM t1 e;
LEAST(e.id,e.consumer,e.brand,e.sal)
0
0
0
0
SELECT LEAST(e.consumer,e.id,e.brand,e.sal) FROM t1 e;
LEAST(e.consumer,e.id,e.brand,e.sal)
0
0
0
0
SELECT LEAST(e.sal,p.price) money,LEAST(e.brand,p.model) model FROM t1 e LEFT JOIN t2 p ON e.id = p.id ORDER BY e.id DESC;
money	model
6000	huawei
3000	oppo
4000	xiaomi
5000	apple
SELECT LEAST(e.sal,p.price) money,LEAST(e.brand,p.model) model FROM t1 e RIGHT JOIN t2 p ON e.id = p.id ORDER BY e.id DESC;
money	model
6000	huawei
3000	oppo
4000	xiaomi
5000	apple
SELECT LEAST(e.sal,p.price) money,LEAST(e.brand,p.model) model FROM t1 e INNER JOIN t2 p ON e.id = p.id ORDER BY e.id DESC;
money	model
6000	huawei
3000	oppo
4000	xiaomi
5000	apple
SELECT * FROM (SELECT e.id,LEAST(e.sal,p.price) price,LEAST(e.brand,p.model)model FROM t1 e LEFT JOIN t2 p ON e.id = p.id ) e ORDER BY e.id;
id	price	model
1	5000	apple
2	4000	xiaomi
3	3000	oppo
4	6000	huawei
SELECT *  FROM t1 e WHERE LEAST(e.id,e.sal) = ANY (SELECT LEAST(p.id,p.price) FROM t2 p ) ORDER BY e.id;
id	consumer	brand	sal
1	书局	apple	5000
2	微山	xiaomi	4000
3	深咖	oppo	3000
4	流苏	huawei	6000
SELECT *  FROM t1 e WHERE LEAST(e.id,e.sal) < ANY (SELECT LEAST(p.id,p.price) FROM t2 p) ORDER BY e.id;
id	consumer	brand	sal
1	书局	apple	5000
2	微山	xiaomi	4000
3	深咖	oppo	3000
SELECT *  FROM t1 e WHERE LEAST(e.consumer,e.brand,e.sal) > ANY (SELECT LEAST(p.model,p.price) FROM t2 p) ORDER BY e.id;
id	consumer	brand	sal
SELECT *  FROM t1 e WHERE LEAST(e.id,e.sal) < ALL (SELECT LEAST(p.id,p.price) FROM t2 p) ORDER BY e.id;
id	consumer	brand	sal
SELECT *  FROM t1 e WHERE LEAST(e.consumer,e.brand,e.sal) > ALL (SELECT LEAST(p.model,p.price) FROM t2 p) ORDER BY e.id;
id	consumer	brand	sal
SELECT *  FROM t1 e WHERE LEAST(e.id,e.sal) = ALL (SELECT LEAST(p.id,p.price) FROM t2 p WHERE p.model = 'oppo findx') ORDER BY e.id;
id	consumer	brand	sal
3	深咖	oppo	3000
SELECT *  FROM t1 e WHERE EXISTS (SELECT LEAST(p.id,p.price) FROM t2 p ) ORDER BY e.id;
id	consumer	brand	sal
1	书局	apple	5000
2	微山	xiaomi	4000
3	深咖	oppo	3000
4	流苏	huawei	6000
SELECT *  FROM t1 e WHERE EXISTS (SELECT LEAST(p.model,p.price) FROM t2 p) ORDER BY e.id;
id	consumer	brand	sal
1	书局	apple	5000
2	微山	xiaomi	4000
3	深咖	oppo	3000
4	流苏	huawei	6000
SELECT *  FROM t1 e WHERE EXISTS (SELECT LEAST(p.model,p.id,p.price) FROM t2 p) ORDER BY e.id;
id	consumer	brand	sal
1	书局	apple	5000
2	微山	xiaomi	4000
3	深咖	oppo	3000
4	流苏	huawei	6000
SELECT LEAST(e.consumer,e.brand,e.sal)  FROM t1 e WHERE NOT EXISTS (SELECT p.id,p.price FROM t2 p WHERE LEAST(p.id,p.price) = 7500 ) ORDER BY e.id;
LEAST(e.consumer,e.brand,e.sal)
0
0
0
0
SELECT LEAST(e.consumer,e.brand,e.sal)  FROM t1 e WHERE NOT EXISTS (SELECT p.id,p.price FROM t2 p WHERE LEAST(p.model,p.price) = 'apple 12' ) ORDER BY e.id;
LEAST(e.consumer,e.brand,e.sal)
SELECT LEAST(e.consumer,e.brand,e.sal)  FROM t1 e WHERE NOT EXISTS (SELECT p.id,p.price FROM t2 p WHERE LEAST(p.model,p.price) = 'apple 12 ' ) ORDER BY e.id;
LEAST(e.consumer,e.brand,e.sal)
CREATE TABLE t3 AS SELECT LEAST(e.consumer,e.brand)  FROM t1 e WHERE LEAST(e.id,e.sal) = 1;
select * from t3;
LEAST(e.consumer,e.brand)
apple
drop table t3;
CREATE TABLE t3 AS SELECT LEAST(e.consumer,e.brand)name  FROM t1 e WHERE LEAST(e.id,e.sal) = 2;
SELECT *  FROM t3;
name
xiaomi
SELECT LEAST(e.brand,e.consumer) FROM t1 e WHERE LEAST(e.brand,e.consumer) LIKE '%a%';
LEAST(e.brand,e.consumer)
apple
xiaomi
huawei
SELECT LEAST(e.sal,p.price) FROM t1 e LEFT JOIN t2 p ON e.id = p.id WHERE LEAST(e.sal,p.price) LIKE '%00%';
LEAST(e.sal,p.price)
5000
4000
3000
6000
SELECT * FROM t1 e WHERE LEAST(e.consumer,e.brand) = 'apple';
id	consumer	brand	sal
1	书局	apple	5000
SELECT * FROM t1 e WHERE LEAST(e.consumer,e.brand) = 'apple                ';
id	consumer	brand	sal
1	书局	apple	5000
SELECT * FROM t1 e WHERE LEAST(e.id,e.sal) > 3 ORDER BY e.id;
id	consumer	brand	sal
4	流苏	huawei	6000
SELECT * FROM t1 e WHERE LEAST(e.id,e.sal) < 2 ORDER BY e.id;
id	consumer	brand	sal
1	书局	apple	5000
SELECT * FROM t1 e WHERE LEAST(e.id,e.sal) = 1 ORDER BY e.id;
id	consumer	brand	sal
1	书局	apple	5000
SELECT e.id,LEAST(e.brand,e.consumer) FROM t1 e WHERE LEAST(e.id,e.sal) > 2 ORDER BY LEAST(e.id,e.sal);
id	LEAST(e.brand,e.consumer)
3	oppo
4	huawei
SELECT e.id,LEAST(e.brand,e.consumer) FROM t1 e WHERE LEAST(e.id,e.sal) > 2 ORDER BY LEAST(e.id,e.sal) DESC;
id	LEAST(e.brand,e.consumer)
4	huawei
3	oppo
SELECT e.id,LEAST(e.brand,e.consumer) FROM t1 e WHERE LEAST(e.id,e.sal) > 2 ORDER BY LEAST(e.brand,e.consumer);
id	LEAST(e.brand,e.consumer)
4	huawei
3	oppo
SELECT e.id,LEAST(e.brand,e.consumer) FROM t1 e WHERE LEAST(e.id,e.sal) > 2 ORDER BY LEAST(e.brand,e.consumer) DESC;
id	LEAST(e.brand,e.consumer)
3	oppo
4	huawei
SELECT SUM(LEAST(e.sal,p.price)) FROM t1 e LEFT JOIN t2 p ON e.id = p.id GROUP BY LEAST(e.sal,p.price),e.id ORDER BY e.id ;
SUM(LEAST(e.sal,p.price))
5000
4000
3000
6000
SELECT SUM(LEAST(e.sal,p.price)) FROM t1 e LEFT JOIN t2 p ON e.id = p.id GROUP BY LEAST(e.sal,p.price),e.id HAVING SUM(LEAST(e.sal,p.price)) > 4000 ORDER BY e.id;
SUM(LEAST(e.sal,p.price))
5000
6000
SELECT id,LEAST(consumer,brand,CASE WHEN sal < 4000 THEN NULL ELSE sal END) name FROM t1 ORDER BY id;
id	name
1	0
2	0
3	NULL
4	0
SELECT id,CASE LEAST(id,sal) WHEN 3000 THEN '低' WHEN 4000 THEN '一般' ELSE '高' END FROM t1 ORDER BY id;
id	CASE LEAST(id,sal) WHEN 3000 THEN '低' WHEN 4000 THEN '一般' ELSE '高' END
1	高
2	高
3	高
4	高
SELECT (CASE LEAST(id,sal) WHEN 3000 THEN '低' WHEN 4000 THEN '一般' ELSE '高' END) FROM t1 GROUP BY (CASE LEAST(id,sal) WHEN 3000 THEN '低' WHEN 4000 THEN '一般' ELSE '高' END),id ORDER BY id ;
(CASE LEAST(id,sal) WHEN 3000 THEN '低' WHEN 4000 THEN '一般' ELSE '高' END)
高
高
高
高
obmysql-LEAST-3-2
INSERT INTO t2 SELECT *  FROM t2 WHERE LEAST(id,price) = 1;
SELECT COUNT(*) FROM t2;
COUNT(*)
5
INSERT INTO t2 SELECT *  FROM t2 WHERE LEAST(id,price) > 2;
SELECT COUNT(*) FROM t2;
COUNT(*)
7
INSERT INTO t3 SELECT LEAST(model,price) FROM t2 WHERE price > 7000 ORDER BY LEAST(model,price) DESC;
SELECT *  FROM  t3;
name
xiaomi
obmysql-LEAST-3-3
UPDATE t2 SET MODEL = 'xiaomi 10' WHERE LEAST(id,price) = 5000;
SELECT model FROM t2;
model
apple 12
xiaomi 9
oppo findx
huawei mata30
apple 12
oppo findx
huawei mata30
UPDATE t2 SET price = '9000' WHERE LEAST(id,price) < 7000;
SELECT price FROM t2;
price
9000
9000
9000
9000
9000
9000
9000
UPDATE t2 SET price = (SELECT LEAST(id,sal) FROM t1 WHERE LEAST(id,sal) > 5000) WHERE id = 1 ;
SELECT price FROM t2;
price
NULL
9000
9000
9000
NULL
9000
9000
obmysql-LEAST-3-4
DELETE FROM t2 WHERE LEAST(model,price) = 'oppo findx';
SELECT COUNT(*) FROM t2;
COUNT(*)
7
DELETE FROM t2 WHERE LEAST(id,price) = 2;
SELECT COUNT(*) FROM t2;
COUNT(*)
6
DELETE FROM t2 WHERE LEAST(id,price) <= 5 ;
SELECT COUNT(*) FROM t2;
COUNT(*)
2
DROP TABLE t1;
DROP TABLE t2;
DROP TABLE t3;
obmysql-LEAST-5
obmysql-LEAST-5-1
DROP TABLE t1;
DROP TABLE t2;
DROP TABLE t3;
DROP VIEW t1_view;
DROP VIEW t2_view;
CREATE TABLE t1(id int,consumer char(20), brand varchar(20),sal int);
INSERT INTO t1 VALUES(1,'书局','apple',5000);
INSERT INTO t1 VALUES(2,'微山','xiaomi',4000);
INSERT INTO t1 VALUES(3,'深咖','oppo',3000);
INSERT INTO t1 VALUES(4,'流苏','huawei',6000);
CREATE TABLE t2(id int,model varchar(200),Price int);
INSERT INTO t2 VALUES(1,'apple 12',7000);
INSERT INTO t2 VALUES(2,'xiaomi 9',5000);
INSERT INTO t2 VALUES(3,'oppo findx',6000);
INSERT INTO t2 VALUES(4,'huawei mata30',8000);
CREATE VIEW t1_view AS SELECT *  FROM t1;
CREATE VIEW t2_view AS SELECT *  FROM t2;
SELECT LEAST(e.id,e.consumer,e.brand,e.sal) FROM t1_view e;
LEAST(e.id,e.consumer,e.brand,e.sal)
0
0
0
0
SELECT LEAST(e.consumer,e.id,e.brand,e.sal) FROM t1_view e;
LEAST(e.consumer,e.id,e.brand,e.sal)
0
0
0
0
SELECT LEAST(e.sal,p.price) money,LEAST(e.brand,p.model) model FROM t1_view e LEFT JOIN t2_view p ON e.id = p.id ORDER BY e.id DESC;
money	model
6000	huawei
3000	oppo
4000	xiaomi
5000	apple
SELECT LEAST(e.sal,p.price) money,LEAST(e.brand,p.model) model FROM t1_view e RIGHT JOIN t2_view p ON e.id = p.id ORDER BY e.id DESC;
money	model
6000	huawei
3000	oppo
4000	xiaomi
5000	apple
SELECT LEAST(e.sal,p.price) money,LEAST(e.brand,p.model) model FROM t1_view e INNER JOIN t2_view p ON e.id = p.id ORDER BY e.id DESC;
money	model
6000	huawei
3000	oppo
4000	xiaomi
5000	apple
SELECT * FROM (SELECT e.id,LEAST(e.sal,p.price) price,LEAST(e.brand,p.model)model FROM t1_view e LEFT JOIN t2_view p ON e.id = p.id ) e ORDER BY e.id;
id	price	model
1	5000	apple
2	4000	xiaomi
3	3000	oppo
4	6000	huawei
SELECT *  FROM t1_view e WHERE LEAST(e.id,e.sal) < ANY (SELECT LEAST(p.id,p.price) FROM t2_view p) ORDER BY e.id;
id	consumer	brand	sal
1	书局	apple	5000
2	微山	xiaomi	4000
3	深咖	oppo	3000
SELECT *  FROM t1_view e WHERE LEAST(e.id,e.sal) = ANY (SELECT LEAST(p.id,p.price) FROM t2_view p ) ORDER BY e.id;
id	consumer	brand	sal
1	书局	apple	5000
2	微山	xiaomi	4000
3	深咖	oppo	3000
4	流苏	huawei	6000
SELECT *  FROM t1_view e WHERE LEAST(e.consumer,e.brand,e.sal) > ANY (SELECT LEAST(p.model,p.price) FROM t2_view p) ORDER BY e.id;
id	consumer	brand	sal
SELECT *  FROM t1_view e WHERE LEAST(e.id,e.sal) < ALL (SELECT LEAST(p.id,p.price) FROM t2_view p) ORDER BY e.id;
id	consumer	brand	sal
SELECT *  FROM t1_view e WHERE LEAST(e.consumer,e.brand,e.sal) > ALL (SELECT LEAST(p.model,p.price) FROM t2_view p) ORDER BY e.id;
id	consumer	brand	sal
SELECT *  FROM t1_view e WHERE LEAST(e.id,e.sal) = ALL (SELECT LEAST(p.id,p.price) FROM t2_view p WHERE p.model = 'oppo findx') ORDER BY e.id;
id	consumer	brand	sal
3	深咖	oppo	3000
SELECT *  FROM t1_view e WHERE EXISTS (SELECT LEAST(p.id,p.price) FROM t2_view p ) ORDER BY e.id;
id	consumer	brand	sal
1	书局	apple	5000
2	微山	xiaomi	4000
3	深咖	oppo	3000
4	流苏	huawei	6000
SELECT *  FROM t1_view e WHERE EXISTS (SELECT LEAST(p.model,p.price) FROM t2_view p) ORDER BY e.id;
id	consumer	brand	sal
1	书局	apple	5000
2	微山	xiaomi	4000
3	深咖	oppo	3000
4	流苏	huawei	6000
SELECT *  FROM t1_view e WHERE EXISTS (SELECT LEAST(p.model,p.id,p.price) FROM t2_view p) ORDER BY e.id;
id	consumer	brand	sal
1	书局	apple	5000
2	微山	xiaomi	4000
3	深咖	oppo	3000
4	流苏	huawei	6000
SELECT LEAST(e.consumer,e.brand,e.sal)  FROM t1_view e WHERE NOT EXISTS (SELECT p.id,p.price FROM t2_view p WHERE LEAST(p.id,p.price) = 7500 ) ORDER BY e.id;
LEAST(e.consumer,e.brand,e.sal)
0
0
0
0
SELECT LEAST(e.consumer,e.brand,e.sal)  FROM t1_view e WHERE NOT EXISTS (SELECT p.id,p.price FROM t2_view p WHERE LEAST(p.model,p.price) = 'apple 12' ) ORDER BY e.id;
LEAST(e.consumer,e.brand,e.sal)
SELECT LEAST(e.consumer,e.brand,e.sal)  FROM t1_view e WHERE NOT EXISTS (SELECT p.id,p.price FROM t2_view p WHERE LEAST(p.model,p.price) = 'apple 12 ' ) ORDER BY e.id;
LEAST(e.consumer,e.brand,e.sal)
CREATE TABLE t3 AS SELECT LEAST(e.consumer,e.brand)  FROM t1_view e WHERE LEAST(e.id,e.sal) = 2;
SELECT *  FROM t3;
LEAST(e.consumer,e.brand)
xiaomi
drop table t3;
CREATE TABLE t3 AS SELECT LEAST(e.consumer,e.brand)name  FROM t1_view e WHERE LEAST(e.id,e.sal) = 3;
SELECT *  FROM t3;
name
oppo
SELECT LEAST(e.brand,e.consumer) FROM t1_view e WHERE LEAST(e.brand,e.consumer) LIKE '%a%';
LEAST(e.brand,e.consumer)
apple
xiaomi
huawei
SELECT LEAST(e.sal,p.price) FROM t1_view e LEFT JOIN t2_view p ON e.id = p.id WHERE LEAST(e.sal,p.price) LIKE '%00%';
LEAST(e.sal,p.price)
5000
4000
3000
6000
SELECT * FROM t1_view e WHERE LEAST(e.consumer,e.brand) = 'apple';
id	consumer	brand	sal
1	书局	apple	5000
SELECT * FROM t1_view e WHERE LEAST(e.consumer,e.brand) = 'apple                ';
id	consumer	brand	sal
1	书局	apple	5000
SELECT * FROM t1_view e WHERE LEAST(e.id,e.sal) > 3 ORDER BY e.id;
id	consumer	brand	sal
4	流苏	huawei	6000
SELECT * FROM t1_view e WHERE LEAST(e.id,e.sal) < 2 ORDER BY e.id;
id	consumer	brand	sal
1	书局	apple	5000
SELECT * FROM t1_view e WHERE LEAST(e.id,e.sal) = 3 ORDER BY e.id;
id	consumer	brand	sal
3	深咖	oppo	3000
SELECT e.id,LEAST(e.brand,e.consumer) FROM t1_view e WHERE LEAST(e.id,e.sal) > 2 ORDER BY LEAST(e.id,e.sal);
id	LEAST(e.brand,e.consumer)
3	oppo
4	huawei
SELECT e.id,LEAST(e.brand,e.consumer) FROM t1_view e WHERE LEAST(e.id,e.sal) > 2 ORDER BY LEAST(e.id,e.sal) DESC;
id	LEAST(e.brand,e.consumer)
4	huawei
3	oppo
SELECT e.id,LEAST(e.brand,e.consumer) FROM t1_view e WHERE LEAST(e.id,e.sal) > 2 ORDER BY LEAST(e.brand,e.consumer);
id	LEAST(e.brand,e.consumer)
4	huawei
3	oppo
SELECT e.id,LEAST(e.brand,e.consumer) FROM t1_view e WHERE LEAST(e.id,e.sal) > 2 ORDER BY LEAST(e.brand,e.consumer) DESC;
id	LEAST(e.brand,e.consumer)
3	oppo
4	huawei
SELECT SUM(LEAST(e.sal,p.price)) FROM t1_view e LEFT JOIN t2_view p ON e.id = p.id GROUP BY LEAST(e.sal,p.price),e.id ORDER BY e.id;
SUM(LEAST(e.sal,p.price))
5000
4000
3000
6000
SELECT SUM(LEAST(e.sal,p.price)) FROM t1_view e LEFT JOIN t2_view p ON e.id = p.id GROUP BY LEAST(e.sal,p.price),e.id HAVING SUM(LEAST(e.sal,p.price)) > 2 ORDER BY e.id;
SUM(LEAST(e.sal,p.price))
5000
4000
3000
6000
SELECT id,LEAST(consumer,brand,CASE WHEN sal < 4000 THEN NULL ELSE sal END) name FROM t1_view ORDER BY id;
id	name
1	0
2	0
3	NULL
4	0
SELECT id,CASE LEAST(id,sal) WHEN 3000 THEN '低' WHEN 4000 THEN '一般' ELSE '高' END FROM t1_view ORDER BY id;
id	CASE LEAST(id,sal) WHEN 3000 THEN '低' WHEN 4000 THEN '一般' ELSE '高' END
1	高
2	高
3	高
4	高
SELECT (CASE LEAST(id,sal) WHEN 3000 THEN '低' WHEN 4000 THEN '一般' ELSE '高' END) FROM t1_view GROUP BY (CASE LEAST(id,sal) WHEN 3000 THEN '低' WHEN 4000 THEN '一般' ELSE '高' END),id ORDER BY id;
(CASE LEAST(id,sal) WHEN 3000 THEN '低' WHEN 4000 THEN '一般' ELSE '高' END)
高
高
高
高
INSERT INTO t2 SELECT *  FROM t2_view WHERE LEAST(id,price) = 2;
SELECT COUNT(*) FROM t2;
COUNT(*)
5
INSERT INTO t2 SELECT *  FROM t2_view WHERE LEAST(id,price) > 2;
SELECT COUNT(*) FROM t2;
COUNT(*)
7
UPDATE t2_view SET MODEL = 'xiaomi 10' WHERE LEAST(id,price) = 1;
SELECT model FROM t2_view;
model
xiaomi 10
xiaomi 9
oppo findx
huawei mata30
xiaomi 9
oppo findx
huawei mata30
UPDATE t2_view SET price = '9000' WHERE LEAST(id,price) < 2;
SELECT price FROM t2_view;
price
9000
5000
6000
8000
5000
6000
8000
UPDATE t2_view SET price = (SELECT LEAST(id,sal) FROM t1 WHERE LEAST(id,sal) > 5000) WHERE id = 1 ;
SELECT price FROM t2_view;
price
NULL
5000
6000
8000
5000
6000
8000
DELETE FROM t2_view WHERE LEAST(model,price) = 'oppo findx';
SELECT COUNT(*) FROM t2_view;
COUNT(*)
7
DELETE FROM t2_view WHERE LEAST(id,price) = 2;
SELECT COUNT(*) FROM t2_view;
COUNT(*)
5
DELETE FROM t2_view WHERE LEAST(id,price) <= 3 ;
SELECT COUNT(*) FROM t2_view;
COUNT(*)
3
obmysql-LEAST-5-2
DROP TABLE t1;
CREATE TABLE t1(id int,consumer char(20), price varchar(20),sal int,datetime1 DATE,datetime2 bigint);
INSERT INTO t1 VALUES(1,'书局','7000',5000,'2020-09-22',20200923121200);
INSERT INTO t1 VALUES(2,'微山','3000',4000,'2020-09-21',20200921101159);
INSERT INTO t1 VALUES(3,'深咖','5000',3000,'2020-08-21',20190821101159);
INSERT INTO t1 VALUES(4,'流苏','9111',10000,'2020-02-29',20200228101159);
CREATE INDEX index_test ON t1(sal);
CREATE INDEX index_test1 ON t1(price);
CREATE INDEX index_test2 ON t1(consumer);
CREATE INDEX index_test3 ON t1(datetime1);
CREATE INDEX index_test4 ON t1(datetime2);
SELECT LEAST(consumer,datetime1,datetime2)name,LEAST(price,sal)sal FROM t1;
name	sal
0	5000
0	3000
0	3000
0	9111
SELECT id,consumer,LEAST(price,sal) FROM t1 WHERE LEAST(price,sal) = 5000 ORDER BY id DESC;
id	consumer	LEAST(price,sal)
1	书局	5000
SELECT id,consumer,LEAST(price,sal) FROM t1 WHERE LEAST(price,sal) > 5000 ORDER BY LEAST(price,sal);
id	consumer	LEAST(price,sal)
4	流苏	9111
SELECT id,SUM(LEAST(price,sal)) FROM t1 WHERE  LEAST(price,sal) > 5000 GROUP BY id HAVING SUM(LEAST(price,sal)) > 5000 ORDER BY id;
id	SUM(LEAST(price,sal))
4	9111
UPDATE t1 SET sal = LEAST(1000,5665,9000,7000) WHERE LEAST(price,sal) = 5000 ;
SELECT sal FROM t1 order by sal;
sal
1000
3000
4000
10000
INSERT INTO t1 SELECT *  FROM t1 WHERE LEAST(price,sal) = 3000;
SELECT COUNT(*) FROM t1;
COUNT(*)
6
INSERT INTO t1 VALUES(8,'流苏','9111',LEAST(555,6789,7988),'2020-02-29 10:11:59',20200228101159);
INSERT INTO t1 VALUES(7,LEAST('化火凤凰','哈哈哈','咳咳咳'),'5000',3000,'2020-08-21 10:11:59',20190821101159);
SELECT COUNT(*)  FROM t1;
COUNT(*)
8
DELETE FROM t1 WHERE LEAST(price,sal) = 3000;
SELECT COUNT(*)  FROM t1;
COUNT(*)
3
obmysql-LEAST-5-3
DROP TABLE t1;
CREATE TABLE t1(id int PRIMARY KEY,consumer char(20) NOT NULL, price varchar(20),sal int  ,datetime1 DATE,datetime2 bigint,CONSTRAINT t1_name_uk UNIQUE(price));
INSERT INTO t1 VALUES(1,'书局','7000',5000,'2020-09-22 12:11:59',20200923121200);
INSERT INTO t1 VALUES(2,'微山','3000',4000,'2020-09-21 10:11:59',20200921101159);
INSERT INTO t1 VALUES(3,'深咖','5000',3000,'2020-08-21 10:11:59',20190821101159);
INSERT INTO t1 VALUES(4,'流苏','9111',10000,'2020-02-29 10:11:59',20200228101159);
SELECT LEAST(id,price,sal),LEAST(consumer,datetime1,datetime2) FROM t1;
LEAST(id,price,sal)	LEAST(consumer,datetime1,datetime2)
1	0
2	0
3	0
4	0
SELECT LEAST(consumer,datetime1,datetime2)name,LEAST(price,sal)sal FROM t1;
name	sal
0	5000
0	3000
0	3000
0	9111
SELECT id,consumer,LEAST(price,sal) FROM t1 WHERE LEAST(price,sal) = 3000 ORDER BY id DESC;
id	consumer	LEAST(price,sal)
3	深咖	3000
2	微山	3000
SELECT id,consumer,LEAST(price,sal) FROM t1 WHERE LEAST(price,sal) > 5000 ORDER BY LEAST(price,sal);
id	consumer	LEAST(price,sal)
4	流苏	9111
SELECT id,SUM(LEAST(price,sal)) FROM t1 WHERE  LEAST(price,sal) > 5000 GROUP BY id HAVING SUM(LEAST(price,sal)) > 5000 ORDER BY id;
id	SUM(LEAST(price,sal))
4	9111
UPDATE t1 SET sal = LEAST(1000,5665,9000,7000) WHERE LEAST(price,sal) = 3000 ;
SELECT sal FROM t1;
sal
5000
1000
1000
10000
INSERT INTO t1 VALUES(8,'流苏','8111',LEAST(555,6789,7988),'2020-02-29 10:11:59',20200228101159);
INSERT INTO t1 VALUES(7,LEAST('化火凤凰','哈哈哈','咳咳咳'),'11110',3000,'2020-08-21 10:11:59',20190821101159);
SELECT COUNT(*)  FROM t1;
COUNT(*)
6
DELETE FROM t1 WHERE LEAST(price,sal) = 3000;
SELECT COUNT(*)  FROM t1;
COUNT(*)
5
DROP VIEW t2_view;
DROP VIEW t1_view;
DROP TABLE t1;
DROP TABLE t2;
DROP TABLE t3;
DROP TABLE t1;
CREATE TABLE t1(id int,consumer char(20), price varchar(20),sal int,datetime1 DATE,datetime2 bigint);
INSERT INTO t1 VALUES(1,'书局','7000',5000,'2020-09-22 12:11:59',20200923121200);
INSERT INTO t1 VALUES(2,'微山','3000',4000,'2020-09-21 10:11:59',20200921101159);
INSERT INTO t1 VALUES(3,'深咖','5000',3000,'2020-08-21 10:11:59',20190821101159);
INSERT INTO t1 VALUES(4,'流苏','9111',10000,'2020-02-29 10:11:59',20200228101159);
obmysql-LEAST-6
obmysql-LEAST-6-1
SELECT LEAST(LEAST(consumer,price),datetime1) FROM t1;
LEAST(LEAST(consumer,price),datetime1)
7000
3000
5000
9111
SELECT LEAST(LEAST(LEAST(consumer,price),datetime1),datetime2) FROM t1;
LEAST(LEAST(LEAST(consumer,price),datetime1),datetime2)
7000
3000
5000
9111
SELECT SUM(LEAST(price,sal)) FROM t1 ORDER BY id;
SUM(LEAST(price,sal))
20111
SELECT LEAST(sal,SUM(price)) FROM t1 ORDER BY id;
LEAST(sal,SUM(price))
5000
SELECT LEAST(SUM(sal),SUM(price)) FROM t1 ORDER BY id;
LEAST(SUM(sal),SUM(price))
22000
SELECT COUNT(LEAST(price,sal)) FROM t1 ORDER BY id;
COUNT(LEAST(price,sal))
4
SELECT LEAST(COUNT(sal),COUNT(price)) FROM t1 ORDER BY id;
LEAST(COUNT(sal),COUNT(price))
4
SELECT MAX(LEAST(price,sal)) FROM t1 ORDER BY id;
MAX(LEAST(price,sal))
9111
SELECT LEAST(MAX(sal),MAX(price)) FROM t1 ORDER BY id;
LEAST(MAX(sal),MAX(price))
9111
SELECT MIN(LEAST(price,sal)) FROM t1 ORDER BY id;
MIN(LEAST(price,sal))
3000
SELECT LEAST(MIN(sal),MIN(price)) FROM t1 ORDER BY id;
LEAST(MIN(sal),MIN(price))
3000
SELECT AVG(LEAST(price,sal)) FROM t1 ORDER BY id;
AVG(LEAST(price,sal))
5027.75
SELECT LEAST(AVG(sal),AVG(price)) FROM t1 ORDER BY id;
LEAST(AVG(sal),AVG(price))
5500
SELECT ABS(LEAST(price,sal)) FROM t1 ORDER BY id;
ABS(LEAST(price,sal))
5000
3000
3000
9111
SELECT LEAST(ABS(sal),ABS(price)) FROM t1 ORDER BY id;
LEAST(ABS(sal),ABS(price))
5000
3000
3000
9111
SELECT CEIL(LEAST(price,sal)) FROM t1 ORDER BY id;
CEIL(LEAST(price,sal))
5000
3000
3000
9111
SELECT LEAST(CEIL(sal),CEIL(price)) FROM t1 ORDER BY id;
LEAST(CEIL(sal),CEIL(price))
5000
3000
3000
9111
SELECT FLOOR(LEAST(price,sal)) FROM t1 ORDER BY id;
FLOOR(LEAST(price,sal))
5000
3000
3000
9111
SELECT LEAST(FLOOR(sal),FLOOR(price)) FROM t1 ORDER BY id;
LEAST(FLOOR(sal),FLOOR(price))
5000
3000
3000
9111
SELECT MOD(LEAST(price,sal),33) FROM t1 ORDER BY id;
MOD(LEAST(price,sal),33)
17
30
30
3
SELECT LEAST(MOD(sal,3),MOD(price,7)) FROM t1 ORDER BY id;
LEAST(MOD(sal,3),MOD(price,7))
0
1
0
1
SELECT LENGTH(LEAST(consumer,datetime1)) FROM t1;
LENGTH(LEAST(consumer,datetime1))
6
6
6
6
SELECT LEAST(LENGTH(consumer),LENGTH(datetime1)) FROM t1;
LEAST(LENGTH(consumer),LENGTH(datetime1))
6
6
6
6
SELECT INSTR(LEAST(consumer,datetime1),'书') FROM t1;
INSTR(LEAST(consumer,datetime1),'书')
1
0
0
0
SELECT LEAST(INSTR(consumer,'书'),INSTR(datetime1,'2')) FROM t1;
LEAST(INSTR(consumer,'书'),INSTR(datetime1,'2'))
1
0
0
0
SELECT LEAST(consumer,CAST(datetime1 AS CHAR(200))) FROM t1;
LEAST(consumer,CAST(datetime1 AS CHAR(200)))
2020-09-22
2020-09-21
2020-08-21
2020-02-29
SELECT CAST(LEAST(consumer,datetime1) AS CHAR(200)) FROM t1;
CAST(LEAST(consumer,datetime1) AS CHAR(200))
书局
微山
深咖
流苏
obmysql-LEAST-7
obmysql-LEAST-7-1
SELECT LEAST(price * 10,sal / 21) FROM t1;
LEAST(price * 10,sal / 21)
238.095238095
190.476190476
142.857142857
476.19047619
SELECT LEAST(price + 1500,sal - 1000) FROM t1;
LEAST(price + 1500,sal - 1000)
4000
3000
2000
9000
SELECT LEAST(price + 1500 * 10,sal - 1000 *20) FROM t1;
LEAST(price + 1500 * 10,sal - 1000 *20)
-15000
-16000
-17000
-10000
SELECT LEAST(price * 10 - 10000,sal / 21 + 1000) FROM t1;
LEAST(price * 10 - 10000,sal / 21 + 1000)
1238.095238095
1190.476190476
1142.857142857
1476.19047619
SELECT LEAST(consumer||price, datetime1 || datetime2) FROM t1;
LEAST(consumer||price, datetime1 || datetime2)
1
1
1
1
obmysql-LEAST-7-2
SELECT LEAST(price,sal) FROM t1;
LEAST(price,sal)
5000
3000
3000
9111
SELECT LEAST(consumer,datetime1) FROM t1;
LEAST(consumer,datetime1)
书局
微山
深咖
流苏
SELECT id,sal,datetime1 FROM t1 WHERE LEAST(price,sal) = 3000;
id	sal	datetime1
2	4000	2020-09-21
3	3000	2020-08-21
SELECT id,sal,datetime1 FROM t1 WHERE LEAST(price,sal) < 7000;
id	sal	datetime1
1	5000	2020-09-22
2	4000	2020-09-21
3	3000	2020-08-21
SELECT id,sal,datetime1 FROM t1 WHERE LEAST(price,sal) > 7000;
id	sal	datetime1
4	10000	2020-02-29
SELECT id,sal,datetime1 FROM t1 WHERE LEAST(price,sal) >= 7000;
id	sal	datetime1
4	10000	2020-02-29
SELECT id,sal,datetime1 FROM t1 WHERE LEAST(price,sal) <= 7000;
id	sal	datetime1
1	5000	2020-09-22
2	4000	2020-09-21
3	3000	2020-08-21
SELECT id,sal,datetime1 FROM t1 WHERE LEAST(price,sal) != 7000;
id	sal	datetime1
1	5000	2020-09-22
2	4000	2020-09-21
3	3000	2020-08-21
4	10000	2020-02-29
SELECT id,sal,datetime1 FROM t1 WHERE LEAST(price,sal) <> 7000;
id	sal	datetime1
1	5000	2020-09-22
2	4000	2020-09-21
3	3000	2020-08-21
4	10000	2020-02-29
obmysql-LEAST-7-3
select LEAST(consumer,datetime1),LEAST(price,sal) from t1;
LEAST(consumer,datetime1)	LEAST(price,sal)
书局	5000
微山	3000
深咖	3000
流苏	9111
SELECT id,sal,datetime1 FROM t1 WHERE LEAST(price,sal) = 7000 OR  LEAST(consumer,datetime1) = '深咖                ';
id	sal	datetime1
3	3000	2020-08-21
SELECT id,sal,datetime1 FROM t1 WHERE LEAST(price,sal) = 5000 AND LEAST(consumer,datetime1) = '书局                ';
id	sal	datetime1
1	5000	2020-09-22
SELECT id,sal,datetime1 FROM t1 WHERE LEAST(price,sal) = 5000  OR  LEAST(consumer,datetime1) = '深咖                ' AND LEAST(consumer,datetime1) = '书局                ';
id	sal	datetime1
1	5000	2020-09-22
drop table t1;
# Clean up users
drop user longpy@'%' ;
