create table test_row_store (k int primary key, v1 int, v2 int);
insert into test_row_store values (1, 1, 1);
insert into test_row_store values (2, 2, 2);
insert into test_row_store values (3, 3, 3);
select * from test_row_store order by k;
k	v1	v2
1	1	1
2	2	2
3	3	3
select count(*) from GV$OB_SSTABLES where tablet_id = (select tablet_id from __all_virtual_table where table_name = 'test_row_store') and TABLE_TYPE = 'CO_MAJOR';
count(*)
0
alter system major freeze tenant = sys;
select count(*) from GV$OB_SSTABLES where tablet_id = (select tablet_id from __all_virtual_table where table_name = 'test_row_store') and TABLE_TYPE = 'CO_MAJOR';
count(*)
0
select * from CDB_OB_TABLET_CHECKSUM_ERROR_INFO ;
TABLET_ID
insert into test_row_store values (4, 4, 4);
insert into test_row_store values (5, 5, 5);
select * from test_row_store order by k;
k	v1	v2
1	1	1
2	2	2
3	3	3
4	4	4
5	5	5
select count(*) from GV$OB_SSTABLES where tablet_id = (select tablet_id from __all_virtual_table where table_name = 'test_row_store') and TABLE_TYPE = 'CO_MAJOR';
count(*)
0
select * from CDB_OB_TABLET_CHECKSUM_ERROR_INFO ;
TABLET_ID
alter system major freeze tenant = sys;
select count(*) from GV$OB_SSTABLES where tablet_id = (select tablet_id from __all_virtual_table where table_name = 'test_row_store') and TABLE_TYPE = 'CO_MAJOR';
count(*)
0
select * from CDB_OB_TABLET_CHECKSUM_ERROR_INFO ;
TABLET_ID
select count(*) from test_row_store order by k;
count(*)
5
select /*+READ_CONSISTENCY(WEAK)+*/ count(*) from test_row_store order by k;
count(*)
5
select * from test_row_store order by k;
k	v1	v2
1	1	1
2	2	2
3	3	3
4	4	4
5	5	5
select k, v1 from test_row_store order by k;
k	v1
1	1
2	2
3	3
4	4
5	5
select avg(k), avg(v1), avg(v2) from test_row_store;
avg(k)	avg(v1)	avg(v2)
3.0000	3.0000	3.0000
select /*+READ_CONSISTENCY(WEAK)+*/ * from test_row_store order by k;
k	v1	v2
1	1	1
2	2	2
3	3	3
4	4	4
5	5	5
select /*+READ_CONSISTENCY(WEAK)+*/ k, v1 from test_row_store order by k;
k	v1
1	1
2	2
3	3
4	4
5	5
select /*+READ_CONSISTENCY(WEAK)+*/ avg(k), avg(v1), avg(v2) from test_row_store;
avg(k)	avg(v1)	avg(v2)
3.0000	3.0000	3.0000
select /*+READ_CONSISTENCY(WEAK)+*/ * from test_row_store order by k;
k	v1	v2
1	1	1
2	2	2
3	3	3
4	4	4
5	5	5
select /*+READ_CONSISTENCY(WEAK)+*/ k, v1 from test_row_store order by k;
k	v1
1	1
2	2
3	3
4	4
5	5
select /*+READ_CONSISTENCY(WEAK)+*/ avg(k), avg(v1), avg(v2) from test_row_store;
avg(k)	avg(v1)	avg(v2)
3.0000	3.0000	3.0000
insert into test_row_store values (6, 6, 6);
delete from test_row_store where k = 1;
update test_row_store set v1 = v2 * 10 where k > 1;
select * from test_row_store order by k;
k	v1	v2
2	20	2
3	30	3
4	40	4
5	50	5
6	60	6
select k, v1 from test_row_store order by k;
k	v1
2	20
3	30
4	40
5	50
6	60
select avg(k), avg(v1), avg(v2) from test_row_store;
avg(k)	avg(v1)	avg(v2)
4.0000	40.0000	4.0000
select /*+READ_CONSISTENCY(WEAK)+*/ * from test_row_store order by k;
k	v1	v2
2	20	2
3	30	3
4	40	4
5	50	5
6	60	6
select /*+READ_CONSISTENCY(WEAK)+*/ k, v1 from test_row_store order by k;
k	v1
2	20
3	30
4	40
5	50
6	60
select /*+READ_CONSISTENCY(WEAK)+*/ avg(k), avg(v1), avg(v2) from test_row_store;
avg(k)	avg(v1)	avg(v2)
4.0000	40.0000	4.0000
select /*+READ_CONSISTENCY(WEAK)+*/ * from test_row_store order by k;
k	v1	v2
2	20	2
3	30	3
4	40	4
5	50	5
6	60	6
select /*+READ_CONSISTENCY(WEAK)+*/ k, v1 from test_row_store order by k;
k	v1
2	20
3	30
4	40
5	50
6	60
select /*+READ_CONSISTENCY(WEAK)+*/ avg(k), avg(v1), avg(v2) from test_row_store;
avg(k)	avg(v1)	avg(v2)
4.0000	40.0000	4.0000
alter table test_row_store add column v3 int default 10086;
select * from test_row_store order by k;
k	v1	v2	v3
2	20	2	10086
3	30	3	10086
4	40	4	10086
5	50	5	10086
6	60	6	10086
select k, v1 from test_row_store order by k;
k	v1
2	20
3	30
4	40
5	50
6	60
select avg(k), avg(v1), avg(v2) from test_row_store;
avg(k)	avg(v1)	avg(v2)
4.0000	40.0000	4.0000
select /*+READ_CONSISTENCY(WEAK)+*/ * from test_row_store order by k;
k	v1	v2	v3
2	20	2	10086
3	30	3	10086
4	40	4	10086
5	50	5	10086
6	60	6	10086
select /*+READ_CONSISTENCY(WEAK)+*/ k, v1 from test_row_store order by k;
k	v1
2	20
3	30
4	40
5	50
6	60
select /*+READ_CONSISTENCY(WEAK)+*/ avg(k), avg(v1), avg(v2) from test_row_store;
avg(k)	avg(v1)	avg(v2)
4.0000	40.0000	4.0000
select /*+READ_CONSISTENCY(WEAK)+*/ * from test_row_store order by k;
k	v1	v2	v3
2	20	2	10086
3	30	3	10086
4	40	4	10086
5	50	5	10086
6	60	6	10086
select /*+READ_CONSISTENCY(WEAK)+*/ k, v1 from test_row_store order by k;
k	v1
2	20
3	30
4	40
5	50
6	60
select /*+READ_CONSISTENCY(WEAK)+*/ avg(k), avg(v1), avg(v2) from test_row_store;
avg(k)	avg(v1)	avg(v2)
4.0000	40.0000	4.0000
insert into test_row_store values (7, 7, 7, 7);
delete from test_row_store where k = 1;
update test_row_store set v1 = v2 * 10 where k > 2;
select * from test_row_store order by k;
k	v1	v2	v3
2	20	2	10086
3	30	3	10086
4	40	4	10086
5	50	5	10086
6	60	6	10086
7	70	7	7
select k, v1 from test_row_store order by k;
k	v1
2	20
3	30
4	40
5	50
6	60
7	70
select avg(k), avg(v1), avg(v2) from test_row_store;
avg(k)	avg(v1)	avg(v2)
4.5000	45.0000	4.5000
select /*+READ_CONSISTENCY(WEAK)+*/ * from test_row_store order by k;
k	v1	v2	v3
2	20	2	10086
3	30	3	10086
4	40	4	10086
5	50	5	10086
6	60	6	10086
7	70	7	7
select /*+READ_CONSISTENCY(WEAK)+*/ k, v1 from test_row_store order by k;
k	v1
2	20
3	30
4	40
5	50
6	60
7	70
select /*+READ_CONSISTENCY(WEAK)+*/ avg(k), avg(v1), avg(v2) from test_row_store;
avg(k)	avg(v1)	avg(v2)
4.5000	45.0000	4.5000
select /*+READ_CONSISTENCY(WEAK)+*/ * from test_row_store order by k;
k	v1	v2	v3
2	20	2	10086
3	30	3	10086
4	40	4	10086
5	50	5	10086
6	60	6	10086
7	70	7	7
select /*+READ_CONSISTENCY(WEAK)+*/ k, v1 from test_row_store order by k;
k	v1
2	20
3	30
4	40
5	50
6	60
7	70
select /*+READ_CONSISTENCY(WEAK)+*/ avg(k), avg(v1), avg(v2) from test_row_store;
avg(k)	avg(v1)	avg(v2)
4.5000	45.0000	4.5000
select "Finish";
Finish
Finish
