create table test_row_store (k int primary key, v1 int, v2 int);
insert into test_row_store values (1, 1, 1);
insert into test_row_store values (2, 2, 2);
insert into test_row_store values (3, 3, 3);
select * from test_row_store order by k;
k	v1	v2
1	1	1
2	2	2
3	3	3
alter table test_row_store modify v1 decimal(10, 1);
select count(*) from test_row_store order by k;
count(*)
3
set ob_route_policy=COLUMN_STORE_ONLY;
select * from test_row_store order by k;
k	v1	v2
1	1.0	1
2	2.0	2
3	3.0	3
select k, v1 from test_row_store order by k;
k	v1
1	1.0
2	2.0
3	3.0
select avg(k), avg(v1), avg(v2) from test_row_store;
avg(k)	avg(v1)	avg(v2)
2.0000	2.00000	2.0000
set ob_route_policy=COLUMN_STORE_ONLY;
set ob_route_policy=READONLY_ZONE_FIRST;
insert into test_row_store values (6, 6, 6);
delete from test_row_store where k = 1;
update test_row_store set v1 = v2 * 10 where k > 1;
select * from test_row_store order by k;
k	v1	v2
2	20.0	2
3	30.0	3
6	60.0	6
select k, v1 from test_row_store order by k;
k	v1
2	20.0
3	30.0
6	60.0
select avg(k), avg(v1), avg(v2) from test_row_store;
avg(k)	avg(v1)	avg(v2)
3.6667	36.66667	3.6667
alter table test_row_store add column v3 int default 10086;
select * from test_row_store order by k;
k	v1	v2	v3
2	20.0	2	10086
3	30.0	3	10086
6	60.0	6	10086
select k, v1 from test_row_store order by k;
k	v1
2	20.0
3	30.0
6	60.0
select avg(k), avg(v1), avg(v2) from test_row_store;
avg(k)	avg(v1)	avg(v2)
3.6667	36.66667	3.6667
set ob_route_policy=COLUMN_STORE_ONLY;
set ob_route_policy=READONLY_ZONE_FIRST;
insert into test_row_store values (7, 7, 7, 7);
delete from test_row_store where k = 1;
update test_row_store set v1 = v2 * 10 where k > 2;
select * from test_row_store order by k;
k	v1	v2	v3
2	20.0	2	10086
3	30.0	3	10086
6	60.0	6	10086
7	70.0	7	7
select k, v1 from test_row_store order by k;
k	v1
2	20.0
3	30.0
6	60.0
7	70.0
select avg(k), avg(v1), avg(v2) from test_row_store;
avg(k)	avg(v1)	avg(v2)
4.5000	45.00000	4.5000
set ob_route_policy=COLUMN_STORE_ONLY;
Finish
Finish
