drop table t1;
drop table t2;
drop table t3;
result_format: 4
create table t1 (c1 int, c2 int, c3 int);
create table t2 (c1 int, c2 int, c3 int);
create table t3 (c1 int, c2 int, c3 int);
insert into t1 values (1, 1, 1);
insert into t1 values (2, 2, 2);
insert into t1 values (2, 2, 2);
insert into t1 values (3, 3, 3);
insert into t1 values (3, 3, 3);
insert into t1 values (4, 4, 4);
insert into t2 values (1, 1, 1);
insert into t2 values (2, 2, 2);
insert into t2 values (3, 3, 3);
insert into t2 values (4, 4, 4);
insert into t3 values (1, 1, 1);
insert into t3 values (2, 2, 2);
insert into t3 values (3, 3, 3);
insert into t3 values (4, 4, 4);

set autocommit = 0;
## 无法支持带出事务信息
explain update (select * from t1 where c2 > 3 order by c1)v set v.c1 = 100;
Query Plan
=========================================================
|ID|OPERATOR                 |NAME|EST.ROWS|EST.TIME(us)|
---------------------------------------------------------
|0 |EXCHANGE IN REMOTE       |    |1       |33          |
|1 |└─EXCHANGE OUT REMOTE    |    |1       |32          |
|2 |  └─UPDATE               |    |1       |31          |
|3 |    └─SUBPLAN SCAN       |V   |1       |2           |
|4 |      └─SORT             |    |1       |2           |
|5 |        └─TABLE FULL SCAN|T1  |1       |2           |
=========================================================
Outputs & filters:
-------------------------------------
  0 - output(nil), filter(nil)
  1 - output(nil), filter(nil)
  2 - output(nil), filter(nil)
      table_columns([{V: ({T1: (V.T1.__pk_increment, V.C1, V.C2, V.C3)})}]),
      update([V.C1=column_conv(NUMBER,PS:(-1,0),NULL,100)])
  3 - output([V.C1], [V.C2], [V.C3], [V.T1.__pk_increment]), filter(nil), rowset=256
      access([V.C1], [V.C2], [V.C3], [V.T1.__pk_increment])
  4 - output([T1.C1], [T1.C2], [T1.C3], [T1.__pk_increment]), filter(nil), rowset=256
      sort_keys([T1.C1, ASC])
  5 - output([T1.__pk_increment], [T1.C2], [T1.C1], [T1.C3]), filter([T1.C2 > 3]), rowset=256
      access([T1.__pk_increment], [T1.C2], [T1.C1], [T1.C3]), partitions(p0)
      is_index_back=false, is_global_index=false, filter_before_indexback[false], 
      range_key([T1.__pk_increment]), range(MIN ; MAX)always true
explain update (select * from t1)v set v.c1 = 100 where c1 in (select c1 from t2);
Query Plan
===========================================================
|ID|OPERATOR                   |NAME|EST.ROWS|EST.TIME(us)|
-----------------------------------------------------------
|0 |EXCHANGE IN REMOTE         |    |4       |61          |
|1 |└─EXCHANGE OUT REMOTE      |    |4       |61          |
|2 |  └─UPDATE                 |    |4       |60          |
|3 |    └─HASH RIGHT SEMI JOIN |    |4       |6           |
|4 |      ├─TABLE FULL SCAN    |T2  |4       |2           |
|5 |      └─TABLE FULL SCAN    |T1  |6       |3           |
===========================================================
Outputs & filters:
-------------------------------------
  0 - output(nil), filter(nil)
  1 - output(nil), filter(nil)
  2 - output(nil), filter(nil)
      table_columns([{T1: ({T1: (T1.__pk_increment, T1.C1, T1.C2, T1.C3)})}]),
      update([T1.C1=column_conv(NUMBER,PS:(-1,0),NULL,100)])
  3 - output([T1.__pk_increment], [T1.C1], [T1.C2], [T1.C3]), filter(nil), rowset=256
      equal_conds([T1.C1 = T2.C1]), other_conds(nil)
  4 - output([T2.C1]), filter(nil), rowset=256
      access([T2.C1]), partitions(p0)
      is_index_back=false, is_global_index=false, 
      range_key([T2.__pk_increment]), range(MIN ; MAX)always true
  5 - output([T1.__pk_increment], [T1.C1], [T1.C2], [T1.C3]), filter(nil), rowset=256
      access([T1.__pk_increment], [T1.C1], [T1.C2], [T1.C3]), partitions(p0)
      is_index_back=false, is_global_index=false, 
      range_key([T1.__pk_increment]), range(MIN ; MAX)always true
update (select * from t1)v set v.c1 = 100 where c1 in (select c1 from t2);
select * from t1;
+------+------+------+
| C1   | C2   | C3   |
+------+------+------+
|  100 |    1 |    1 |
|  100 |    2 |    2 |
|  100 |    2 |    2 |
|  100 |    3 |    3 |
|  100 |    3 |    3 |
|  100 |    4 |    4 |
+------+------+------+
select * from t2;
+------+------+------+
| C1   | C2   | C3   |
+------+------+------+
|    1 |    1 |    1 |
|    2 |    2 |    2 |
|    3 |    3 |    3 |
|    4 |    4 |    4 |
+------+------+------+
rollback;

explain update (select * from t1)v set v.c1 = 100 where rownum <= 2;
Query Plan
=====================================================
|ID|OPERATOR             |NAME|EST.ROWS|EST.TIME(us)|
-----------------------------------------------------
|0 |EXCHANGE IN REMOTE   |    |1       |37          |
|1 |└─EXCHANGE OUT REMOTE|    |1       |36          |
|2 |  └─UPDATE           |    |1       |34          |
|3 |    └─TABLE FULL SCAN|T1  |1       |2           |
=====================================================
Outputs & filters:
-------------------------------------
  0 - output(nil), filter(nil)
  1 - output(nil), filter(nil)
  2 - output(nil), filter(nil)
      table_columns([{T1: ({T1: (T1.__pk_increment, T1.C1, T1.C2, T1.C3)})}]),
      update([T1.C1=column_conv(NUMBER,PS:(-1,0),NULL,100)])
  3 - output([T1.__pk_increment], [T1.C1], [T1.C2], [T1.C3]), filter(nil), rowset=256
      access([T1.__pk_increment], [T1.C1], [T1.C2], [T1.C3]), partitions(p0)
      limit(cast(FLOOR(2), BIGINT(-1, 0))), offset(nil), is_index_back=false, is_global_index=false, 
      range_key([T1.__pk_increment]), range(MIN ; MAX)always true
explain update (select * from t1 where c1 in (select c1 from t2))v set v.c1 = 100 where rownum <= 2;
Query Plan
=============================================================
|ID|OPERATOR                     |NAME|EST.ROWS|EST.TIME(us)|
-------------------------------------------------------------
|0 |EXCHANGE IN REMOTE           |    |1       |36          |
|1 |└─EXCHANGE OUT REMOTE        |    |1       |36          |
|2 |  └─UPDATE                   |    |1       |36          |
|3 |    └─LIMIT                  |    |1       |4           |
|4 |      └─HASH RIGHT SEMI JOIN |    |1       |4           |
|5 |        ├─TABLE FULL SCAN    |T2  |1       |2           |
|6 |        └─TABLE FULL SCAN    |T1  |1       |2           |
=============================================================
Outputs & filters:
-------------------------------------
  0 - output(nil), filter(nil)
  1 - output(nil), filter(nil)
  2 - output(nil), filter(nil)
      table_columns([{T1: ({T1: (T1.__pk_increment, T1.C1, T1.C2, T1.C3)})}]),
      update([T1.C1=column_conv(NUMBER,PS:(-1,0),NULL,100)])
  3 - output([T1.__pk_increment], [T1.C1], [T1.C2], [T1.C3]), filter(nil), rowset=256
      limit(cast(FLOOR(2), BIGINT(-1, 0))), offset(nil)
  4 - output([T1.__pk_increment], [T1.C1], [T1.C2], [T1.C3]), filter(nil), rowset=256
      equal_conds([T1.C1 = T2.C1]), other_conds(nil)
  5 - output([T2.C1]), filter(nil), rowset=256
      access([T2.C1]), partitions(p0)
      is_index_back=false, is_global_index=false, 
      range_key([T2.__pk_increment]), range(MIN ; MAX)always true
  6 - output([T1.__pk_increment], [T1.C1], [T1.C2], [T1.C3]), filter(nil), rowset=256
      access([T1.__pk_increment], [T1.C1], [T1.C2], [T1.C3]), partitions(p0)
      is_index_back=false, is_global_index=false, 
      range_key([T1.__pk_increment]), range(MIN ; MAX)always true
update (select * from t1 where c1 in (select c1 from t2))v set v.c1 = 100 where rownum <= 2;
select * from t1;
+------+------+------+
| C1   | C2   | C3   |
+------+------+------+
+------+------+------+
rollback;

explain update (select * from t1)v set v.c1 = (select c1 + 100 from t2 where c1 in (select c1 from t3) and rownum <= 1);
Query Plan
===========================================================
|ID|OPERATOR                   |NAME|EST.ROWS|EST.TIME(us)|
-----------------------------------------------------------
|0 |EXCHANGE IN REMOTE         |    |1       |40          |
|1 |└─EXCHANGE OUT REMOTE      |    |1       |40          |
|2 |  └─UPDATE                 |    |1       |38          |
|3 |    └─SUBPLAN FILTER       |    |1       |6           |
|4 |      ├─TABLE FULL SCAN    |T1  |1       |2           |
|5 |      └─LIMIT              |    |1       |4           |
|6 |        └─HASH SEMI JOIN   |    |1       |4           |
|7 |          ├─TABLE FULL SCAN|T2  |1       |2           |
|8 |          └─TABLE FULL SCAN|T3  |1       |2           |
===========================================================
Outputs & filters:
-------------------------------------
  0 - output(nil), filter(nil)
  1 - output(nil), filter(nil)
  2 - output(nil), filter(nil)
      table_columns([{T1: ({T1: (T1.__pk_increment, T1.C1, T1.C2, T1.C3)})}]),
      update([T1.C1=column_conv(NUMBER,PS:(-1,0),NULL,:0)])
  3 - output([T1.__pk_increment], [T1.C1], [T1.C2], [T1.C3], [:0]), filter(nil), rowset=256
      exec_params_(nil), onetime_exprs_([subquery(1)(:0)]), init_plan_idxs_(nil), use_batch=false
  4 - output([T1.__pk_increment], [T1.C1], [T1.C2], [T1.C3]), filter(nil), rowset=256
      access([T1.__pk_increment], [T1.C1], [T1.C2], [T1.C3]), partitions(p0)
      is_index_back=false, is_global_index=false, 
      range_key([T1.__pk_increment]), range(MIN ; MAX)always true
  5 - output([T2.C1 + 100]), filter(nil), rowset=256
      limit(cast(FLOOR(1), BIGINT(-1, 0))), offset(nil)
  6 - output([T2.C1]), filter(nil), rowset=256
      equal_conds([T2.C1 = T3.C1]), other_conds(nil)
  7 - output([T2.C1]), filter(nil), rowset=256
      access([T2.C1]), partitions(p0)
      is_index_back=false, is_global_index=false, 
      range_key([T2.__pk_increment]), range(MIN ; MAX)always true
  8 - output([T3.C1]), filter(nil), rowset=256
      access([T3.C1]), partitions(p0)
      is_index_back=false, is_global_index=false, 
      range_key([T3.__pk_increment]), range(MIN ; MAX)always true
update (select * from t1)v set v.c1 = (select c1 + 100 from t2 where c1 in (select c1 from t3) and rownum <= 1);
select * from t1;
+------+------+------+
| C1   | C2   | C3   |
+------+------+------+
+------+------+------+
rollback;

explain update (select c1,c2 from t1)v set (v.c1,v.c2) = (select c1 + 100, c2 + 100 from t2 where rownum <= 1);
Query Plan
=======================================================
|ID|OPERATOR               |NAME|EST.ROWS|EST.TIME(us)|
-------------------------------------------------------
|0 |EXCHANGE IN REMOTE     |    |1       |39          |
|1 |└─EXCHANGE OUT REMOTE  |    |1       |38          |
|2 |  └─UPDATE             |    |1       |36          |
|3 |    └─SUBPLAN FILTER   |    |1       |4           |
|4 |      ├─TABLE FULL SCAN|T1  |1       |2           |
|5 |      └─TABLE FULL SCAN|T2  |1       |2           |
=======================================================
Outputs & filters:
-------------------------------------
  0 - output(nil), filter(nil)
  1 - output(nil), filter(nil)
  2 - output(nil), filter(nil)
      table_columns([{T1: ({T1: (T1.__pk_increment, T1.C1, T1.C2, T1.C3)})}]),
      update([T1.C1=column_conv(NUMBER,PS:(-1,0),NULL,T2.C1 + 100)], [T1.C2=column_conv(NUMBER,PS:(-1,0),NULL,T2.C2 + 100)])
  3 - output([T1.__pk_increment], [T1.C1], [T1.C2], [T1.C3], [T2.C1 + 100], [T2.C2 + 100]), filter(nil)
      exec_params_(nil), onetime_exprs_(nil), init_plan_idxs_([1]), use_batch=false
  4 - output([T1.__pk_increment], [T1.C1], [T1.C2], [T1.C3]), filter(nil)
      access([T1.__pk_increment], [T1.C1], [T1.C2], [T1.C3]), partitions(p0)
      is_index_back=false, is_global_index=false, 
      range_key([T1.__pk_increment]), range(MIN ; MAX)always true
  5 - output([T2.C1 + 100], [T2.C2 + 100]), filter(nil)
      access([T2.C1], [T2.C2]), partitions(p0)
      limit(cast(FLOOR(1), BIGINT(-1, 0))), offset(nil), is_index_back=false, is_global_index=false, 
      range_key([T2.__pk_increment]), range(MIN ; MAX)always true
update (select c1,c2 from t1)v set (v.c1,v.c2) = (select c1 + 100, c2 + 100 from t2 where rownum <= 1);
select * from t1;
+------+------+------+
| C1   | C2   | C3   |
+------+------+------+
+------+------+------+
rollback;

explain update (select * from t1 where c2 > 3)v set (v.c1,v.c2,v.c3) = (select c1 + 100, c2 + 100, c3 + 100 from t2 where c1 in (select c1 from t3) and rownum <= 1);
Query Plan
===============================================================
|ID|OPERATOR                       |NAME|EST.ROWS|EST.TIME(us)|
---------------------------------------------------------------
|0 |EXCHANGE IN REMOTE             |    |1       |31          |
|1 |└─EXCHANGE OUT REMOTE          |    |1       |31          |
|2 |  └─UPDATE                     |    |1       |31          |
|3 |    └─SUBPLAN FILTER           |    |1       |6           |
|4 |      ├─TABLE FULL SCAN        |T1  |1       |2           |
|5 |      └─LIMIT                  |    |1       |4           |
|6 |        └─HASH RIGHT SEMI JOIN |    |1       |4           |
|7 |          ├─TABLE FULL SCAN    |T3  |1       |2           |
|8 |          └─TABLE FULL SCAN    |T2  |1       |2           |
===============================================================
Outputs & filters:
-------------------------------------
  0 - output(nil), filter(nil)
  1 - output(nil), filter(nil)
  2 - output(nil), filter(nil)
      table_columns([{T1: ({T1: (T1.__pk_increment, T1.C1, T1.C2, T1.C3)})}]),
      update([T1.C1=column_conv(NUMBER,PS:(-1,0),NULL,T2.C1 + 100)], [T1.C2=column_conv(NUMBER,PS:(-1,0),NULL,T2.C2 + 100)], [T1.C3=column_conv(NUMBER,PS:(-1,
      0),NULL,T2.C3 + 100)])
  3 - output([T1.__pk_increment], [T1.C1], [T1.C2], [T1.C3], [T2.C1 + 100], [T2.C2 + 100], [T2.C3 + 100]), filter(nil)
      exec_params_(nil), onetime_exprs_(nil), init_plan_idxs_([1]), use_batch=false
  4 - output([T1.__pk_increment], [T1.C2], [T1.C1], [T1.C3]), filter([T1.C2 > 3])
      access([T1.__pk_increment], [T1.C2], [T1.C1], [T1.C3]), partitions(p0)
      is_index_back=false, is_global_index=false, filter_before_indexback[false], 
      range_key([T1.__pk_increment]), range(MIN ; MAX)always true
  5 - output([T2.C1 + 100], [T2.C2 + 100], [T2.C3 + 100]), filter(nil)
      limit(cast(FLOOR(1), BIGINT(-1, 0))), offset(nil)
  6 - output([T2.C1], [T2.C2], [T2.C3]), filter(nil)
      equal_conds([T2.C1 = T3.C1]), other_conds(nil)
  7 - output([T3.C1]), filter(nil)
      access([T3.C1]), partitions(p0)
      is_index_back=false, is_global_index=false, 
      range_key([T3.__pk_increment]), range(MIN ; MAX)always true
  8 - output([T2.C1], [T2.C2], [T2.C3]), filter(nil)
      access([T2.C1], [T2.C2], [T2.C3]), partitions(p0)
      is_index_back=false, is_global_index=false, 
      range_key([T2.__pk_increment]), range(MIN ; MAX)always true
select * from t1;
+------+------+------+
| C1   | C2   | C3   |
+------+------+------+
+------+------+------+
rollback;

explain update (select c1,c3 from t1 order by c1)v set (v.c1,v.c3) = (select c1 + 100, c3 + 100 from t3 where rownum <= 1) where rownum <= 2;
Query Plan
=============================================================
|ID|OPERATOR                     |NAME|EST.ROWS|EST.TIME(us)|
-------------------------------------------------------------
|0 |EXCHANGE IN REMOTE           |    |1       |39          |
|1 |└─EXCHANGE OUT REMOTE        |    |1       |38          |
|2 |  └─UPDATE                   |    |1       |36          |
|3 |    └─SUBPLAN FILTER         |    |1       |4           |
|4 |      ├─LIMIT                |    |1       |2           |
|5 |      │ └─SUBPLAN SCAN       |V   |1       |2           |
|6 |      │   └─SORT             |    |1       |2           |
|7 |      │     └─TABLE FULL SCAN|T1  |1       |2           |
|8 |      └─TABLE FULL SCAN      |T3  |1       |2           |
=============================================================
Outputs & filters:
-------------------------------------
  0 - output(nil), filter(nil)
  1 - output(nil), filter(nil)
  2 - output(nil), filter(nil)
      table_columns([{V: ({T1: (V.T1.__pk_increment, V.C1, V.T1.C2, V.C3)})}]),
      update([V.C1=column_conv(NUMBER,PS:(-1,0),NULL,T3.C1 + 100)], [V.C3=column_conv(NUMBER,PS:(-1,0),NULL,T3.C3 + 100)])
  3 - output([V.T1.__pk_increment], [V.C1], [V.T1.C2], [V.C3], [T3.C1 + 100], [T3.C3 + 100]), filter(nil)
      exec_params_(nil), onetime_exprs_(nil), init_plan_idxs_([1]), use_batch=false
  4 - output([V.T1.__pk_increment], [V.C1], [V.T1.C2], [V.C3]), filter(nil)
      limit(cast(FLOOR(2), BIGINT(-1, 0))), offset(nil)
  5 - output([V.C1], [V.C3], [V.T1.__pk_increment], [V.T1.C2]), filter(nil)
      access([V.C1], [V.C3], [V.T1.__pk_increment], [V.T1.C2])
  6 - output([T1.C1], [T1.C3], [T1.__pk_increment], [T1.C2]), filter(nil)
      sort_keys([T1.C1, ASC])
  7 - output([T1.__pk_increment], [T1.C1], [T1.C3], [T1.C2]), filter(nil)
      access([T1.__pk_increment], [T1.C1], [T1.C3], [T1.C2]), partitions(p0)
      is_index_back=false, is_global_index=false, 
      range_key([T1.__pk_increment]), range(MIN ; MAX)always true
  8 - output([T3.C1 + 100], [T3.C3 + 100]), filter(nil)
      access([T3.C1], [T3.C3]), partitions(p0)
      limit(cast(FLOOR(1), BIGINT(-1, 0))), offset(nil), is_index_back=false, is_global_index=false, 
      range_key([T3.__pk_increment]), range(MIN ; MAX)always true

explain update t1 set (t1.c1,t1.c3) = (select c1 + 100, c3 + 100 from t3 where rownum <= 1) where rownum <= 2 and (t1.c1,t1.c3) in (select c1,c3 from t2);
Query Plan
===============================================================
|ID|OPERATOR                       |NAME|EST.ROWS|EST.TIME(us)|
---------------------------------------------------------------
|0 |EXCHANGE IN REMOTE             |    |1       |38          |
|1 |└─EXCHANGE OUT REMOTE          |    |1       |38          |
|2 |  └─UPDATE                     |    |1       |38          |
|3 |    └─SUBPLAN FILTER           |    |1       |6           |
|4 |      ├─LIMIT                  |    |1       |4           |
|5 |      │ └─HASH RIGHT SEMI JOIN |    |1       |4           |
|6 |      │   ├─TABLE FULL SCAN    |T2  |1       |2           |
|7 |      │   └─TABLE FULL SCAN    |T1  |1       |2           |
|8 |      └─TABLE FULL SCAN        |T3  |1       |2           |
===============================================================
Outputs & filters:
-------------------------------------
  0 - output(nil), filter(nil)
  1 - output(nil), filter(nil)
  2 - output(nil), filter(nil)
      table_columns([{T1: ({T1: (T1.__pk_increment, T1.C1, T1.C2, T1.C3)})}]),
      update([T1.C1=column_conv(NUMBER,PS:(-1,0),NULL,T3.C1 + 100)], [T1.C3=column_conv(NUMBER,PS:(-1,0),NULL,T3.C3 + 100)])
  3 - output([T1.__pk_increment], [T1.C1], [T1.C2], [T1.C3], [T3.C1 + 100], [T3.C3 + 100]), filter(nil)
      exec_params_(nil), onetime_exprs_(nil), init_plan_idxs_([1]), use_batch=false
  4 - output([T1.__pk_increment], [T1.C1], [T1.C2], [T1.C3]), filter(nil)
      limit(cast(FLOOR(2), BIGINT(-1, 0))), offset(nil)
  5 - output([T1.__pk_increment], [T1.C1], [T1.C2], [T1.C3]), filter(nil)
      equal_conds([T1.C1 = T2.C1], [T1.C3 = T2.C3]), other_conds(nil)
  6 - output([T2.C1], [T2.C3]), filter(nil)
      access([T2.C1], [T2.C3]), partitions(p0)
      is_index_back=false, is_global_index=false, 
      range_key([T2.__pk_increment]), range(MIN ; MAX)always true
  7 - output([T1.__pk_increment], [T1.C1], [T1.C3], [T1.C2]), filter(nil)
      access([T1.__pk_increment], [T1.C1], [T1.C3], [T1.C2]), partitions(p0)
      is_index_back=false, is_global_index=false, 
      range_key([T1.__pk_increment]), range(MIN ; MAX)always true
  8 - output([T3.C1 + 100], [T3.C3 + 100]), filter(nil)
      access([T3.C1], [T3.C3]), partitions(p0)
      limit(cast(FLOOR(1), BIGINT(-1, 0))), offset(nil), is_index_back=false, is_global_index=false, 
      range_key([T3.__pk_increment]), range(MIN ; MAX)always true
update t1 set (t1.c1,t1.c3) = (select c1 + 100, c3 + 100 from t3 where rownum <= 1) where rownum <= 2 and (t1.c1,t1.c3) in (select c1,c3 from t2);
select * from t1;
+------+------+------+
| C1   | C2   | C3   |
+------+------+------+
+------+------+------+
rollback;

explain update (select c1,c2 from t1 where c1 in (select c1 from t2))v set v.c1 = (select c1 + 100 from t3 where rownum <= 1) where v.c2 >any (select c2 from t3);
Query Plan
================================================================
|ID|OPERATOR                        |NAME|EST.ROWS|EST.TIME(us)|
----------------------------------------------------------------
|0 |EXCHANGE IN REMOTE              |    |1       |34          |
|1 |└─EXCHANGE OUT REMOTE           |    |1       |34          |
|2 |  └─UPDATE                      |    |1       |34          |
|3 |    └─SUBPLAN FILTER            |    |1       |8           |
|4 |      ├─HASH SEMI JOIN          |    |1       |6           |
|5 |      │ ├─NESTED-LOOP SEMI JOIN |    |1       |4           |
|6 |      │ │ ├─TABLE FULL SCAN     |T1  |1       |2           |
|7 |      │ │ └─MATERIAL            |    |1       |2           |
|8 |      │ │   └─TABLE FULL SCAN   |T3  |1       |2           |
|9 |      │ └─TABLE FULL SCAN       |T2  |1       |2           |
|10|      └─TABLE FULL SCAN         |T3  |1       |2           |
================================================================
Outputs & filters:
-------------------------------------
  0 - output(nil), filter(nil)
  1 - output(nil), filter(nil)
  2 - output(nil), filter(nil)
      table_columns([{T1: ({T1: (T1.__pk_increment, T1.C1, T1.C2, T1.C3)})}]),
      update([T1.C1=column_conv(NUMBER,PS:(-1,0),NULL,:0)])
  3 - output([T1.__pk_increment], [T1.C1], [T1.C2], [T1.C3], [:0]), filter(nil), rowset=256
      exec_params_(nil), onetime_exprs_([subquery(1)(:0)]), init_plan_idxs_(nil), use_batch=false
  4 - output([T1.__pk_increment], [T1.C1], [T1.C2], [T1.C3]), filter(nil), rowset=256
      equal_conds([T1.C1 = T2.C1]), other_conds(nil)
  5 - output([T1.__pk_increment], [T1.C1], [T1.C2], [T1.C3]), filter(nil), rowset=256
      conds([T1.C2 > T3.C2]), nl_params_(nil), use_batch=false
  6 - output([T1.__pk_increment], [T1.C1], [T1.C2], [T1.C3]), filter(nil), rowset=256
      access([T1.__pk_increment], [T1.C1], [T1.C2], [T1.C3]), partitions(p0)
      is_index_back=false, is_global_index=false, 
      range_key([T1.__pk_increment]), range(MIN ; MAX)always true
  7 - output([T3.C2]), filter(nil), rowset=256
  8 - output([T3.C2]), filter(nil), rowset=256
      access([T3.C2]), partitions(p0)
      is_index_back=false, is_global_index=false, 
      range_key([T3.__pk_increment]), range(MIN ; MAX)always true
  9 - output([T2.C1]), filter(nil), rowset=256
      access([T2.C1]), partitions(p0)
      is_index_back=false, is_global_index=false, 
      range_key([T2.__pk_increment]), range(MIN ; MAX)always true
 10 - output([T3.C1 + 100]), filter(nil), rowset=256
      access([T3.C1]), partitions(p0)
      limit(cast(FLOOR(1), BIGINT(-1, 0))), offset(nil), is_index_back=false, is_global_index=false, 
      range_key([T3.__pk_increment]), range(MIN ; MAX)always true
update (select c1,c2 from t1 where c1 in (select c1 from t2))v set v.c1 = (select c1 + 100 from t3 where rownum <= 1) where v.c2 >any (select c2 from t3);
select * from t1;
+------+------+------+
| C1   | C2   | C3   |
+------+------+------+
+------+------+------+
rollback;

explain update (select c1,c2 from t1 where c1 > 2 and c2 > 2 order by c2)v set v.c1 = 100 where v.c2 in (select c1 from t2) and rownum <= 3;
Query Plan
============================================================
|ID|OPERATOR                   |NAME |EST.ROWS|EST.TIME(us)|
------------------------------------------------------------
|0 |EXCHANGE IN REMOTE         |     |1       |28          |
|1 |└─EXCHANGE OUT REMOTE      |     |1       |28          |
|2 |  └─UPDATE                 |     |1       |28          |
|3 |    └─LIMIT                |     |1       |4           |
|4 |      └─HASH SEMI JOIN     |     |1       |4           |
|5 |        ├─TABLE FULL SCAN  |T1   |1       |2           |
|6 |        └─SUBPLAN SCAN     |VIEW1|1       |2           |
|7 |          └─TABLE FULL SCAN|T2   |1       |2           |
============================================================
Outputs & filters:
-------------------------------------
  0 - output(nil), filter(nil)
  1 - output(nil), filter(nil)
  2 - output(nil), filter(nil)
      table_columns([{T1: ({T1: (T1.__pk_increment, T1.C1, T1.C2, T1.C3)})}]),
      update([T1.C1=column_conv(NUMBER,PS:(-1,0),NULL,100)])
  3 - output([T1.__pk_increment], [T1.C1], [T1.C2], [T1.C3]), filter(nil), rowset=256
      limit(cast(FLOOR(3), BIGINT(-1, 0))), offset(nil)
  4 - output([T1.__pk_increment], [T1.C1], [T1.C2], [T1.C3]), filter(nil), rowset=256
      equal_conds([T1.C2 = VIEW1.C1]), other_conds(nil)
  5 - output([T1.__pk_increment], [T1.C1], [T1.C2], [T1.C3]), filter([T1.C1 > 2], [T1.C2 > 2]), rowset=256
      access([T1.__pk_increment], [T1.C1], [T1.C2], [T1.C3]), partitions(p0)
      is_index_back=false, is_global_index=false, filter_before_indexback[false,false], 
      range_key([T1.__pk_increment]), range(MIN ; MAX)always true
  6 - output([VIEW1.C1]), filter(nil), rowset=256
      access([VIEW1.C1])
  7 - output([T2.C1]), filter([T2.C1 > 2]), rowset=256
      access([T2.C1]), partitions(p0)
      is_index_back=false, is_global_index=false, filter_before_indexback[false], 
      range_key([T2.__pk_increment]), range(MIN ; MAX)always true
update (select c1,c2 from t1 where c1 > 2 and c2 > 2 order by c2)v set v.c1 = 100 where v.c2 in (select c1 from t2) and rownum <= 3;
select * from t1;
+------+------+------+
| C1   | C2   | C3   |
+------+------+------+
+------+------+------+
rollback;

drop table t1;
drop table t2;
drop table t3;

## 测试多分区更新
create table t1 (c1 int , c2 char(5 char), c22 char(5 byte), c3 timestamp, c4 int, primary key(c1,c4)) partition by hash(c4) partitions 4;
insert into t1 values(1, 'li', 'li', current_timestamp, 1);
insert into t1 values(2, 'bi', 'li', current_timestamp, 2);
insert into t1 values(3, 'fi', 'li', current_timestamp, 3);
insert into t1 values(4, 'zi', 'li', current_timestamp, 4);
insert into t1 values(5,'li', 'li', current_timestamp, 5);
insert into t1 values(9, 'li', 'li', current_timestamp, 9);
insert into t1 values(13, 'li', 'li', current_timestamp, 13);
insert into t1 values(6,'li', 'li', current_timestamp, 6);
insert into t1 values(10, 'li', 'li', current_timestamp, 10);
insert into t1 values(14, 'li', 'li', current_timestamp, 14);
insert into t1 values(7,'li', 'li', current_timestamp, 7);
insert into t1 values(11, 'li', 'li', current_timestamp, 11);
insert into t1 values(15, 'li', 'li', current_timestamp, 15);
insert into t1 values(8,'li', 'li', current_timestamp, 8);
insert into t1 values(12, 'li', 'li', current_timestamp, 12);
insert into t1 values(16, 'li', 'li', current_timestamp, 16);
create table t2(c1 int);
insert into t2 values(1);
insert into t2 values(2);
insert into t2 values(4);

explain update t1 set c4 = 21 where c1 in (select * from t2) and c4 = 17;
Query Plan
=============================================================
|ID|OPERATOR                 |NAME    |EST.ROWS|EST.TIME(us)|
-------------------------------------------------------------
|0 |DISTRIBUTED UPDATE       |        |1       |36          |
|1 |└─PX COORDINATOR         |        |1       |5           |
|2 |  └─EXCHANGE OUT DISTR   |:EX10000|1       |5           |
|3 |    └─MERGE SEMI JOIN    |        |1       |5           |
|4 |      ├─TABLE FULL SCAN  |T1      |1       |2           |
|5 |      └─SORT             |        |3       |3           |
|6 |        └─TABLE FULL SCAN|T2      |3       |2           |
=============================================================
Outputs & filters:
-------------------------------------
  0 - output(nil), filter(nil)
      table_columns([{T1: ({T1: (T1.C1, T1.C4, T1.C2, T1.C22, T1.C3)})}]),
      update([T1.C4=column_conv(NUMBER,PS:(-1,0),NOT NULL,21)])
  1 - output([T1.C1], [T1.C4], [T1.C2], [T1.C22], [T1.C3]), filter(nil), rowset=256
  2 - output([T1.C1], [T1.C4], [T1.C2], [T1.C22], [T1.C3]), filter(nil), rowset=256
      is_single, dop=1
  3 - output([T1.C1], [T1.C4], [T1.C2], [T1.C22], [T1.C3]), filter(nil), rowset=256
      equal_conds([T1.C1 = T2.C1]), other_conds(nil)
      merge_directions([ASC])
  4 - output([T1.C1], [T1.C4], [T1.C2], [T1.C22], [T1.C3]), filter([T1.C4 = 17]), rowset=256
      access([T1.C1], [T1.C4], [T1.C2], [T1.C22], [T1.C3]), partitions(p3)
      is_index_back=false, is_global_index=false, filter_before_indexback[false], 
      range_key([T1.C1], [T1.C4]), range(MIN,MIN ; MAX,MAX)always true
  5 - output([T2.C1]), filter(nil), rowset=256
      sort_keys([T2.C1, ASC])
  6 - output([T2.C1]), filter(nil), rowset=256
      access([T2.C1]), partitions(p0)
      is_index_back=false, is_global_index=false, 
      range_key([T2.__pk_increment]), range(MIN ; MAX)always true
update t1 set c4 = 21 where c1 in (select * from t2) and c4 = 17;
select c1, c2, c22, c4 from t1;
+----+-------+-------+----+
| C1 | C2    | C22   | C4 |
+----+-------+-------+----+
|  2 | bi    | li    |  2 |
|  7 | li    | li    |  7 |
|  1 | li    | li    |  1 |
|  4 | zi    | li    |  4 |
|  8 | li    | li    |  8 |
| 13 | li    | li    | 13 |
|  3 | fi    | li    |  3 |
|  5 | li    | li    |  5 |
| 10 | li    | li    | 10 |
| 11 | li    | li    | 11 |
| 12 | li    | li    | 12 |
| 14 | li    | li    | 14 |
| 15 | li    | li    | 15 |
|  6 | li    | li    |  6 |
|  9 | li    | li    |  9 |
| 16 | li    | li    | 16 |
+----+-------+-------+----+
drop table t1;
drop table t2;

set autocommit= 1;
alter system set _enable_defensive_check = '1';
alter system set_tp tp_no = 308, error_code = 0, frequency = 1;

