purge recyclebin;
drop database IF EXISTS oblrp;
create database oblrp;
use oblrp;
set timestamp = 1600000000;
set ob_trx_timeout = 10000000000;
set ob_query_timeout = 10000000000;
result_format: 4
obmysql-sequence-5-1-2-1-1
drop table t1;
create table tt1(id int);
insert into tt1 values(1);
drop table a;
create table a (id int, name varchar(30), pk_id int);
insert into a values(1,'name01',1);
insert into a values(2,'name02',1);
insert into a values(3,'name03',2);
insert into a values(4,'name04',3);
insert into a values(5,'name05',3);
insert into a values(6,'name06',3);
drop table b;
create table b (id int, name varchar(30));
insert into b values(1,'name01');
insert into b values(2,'name02');
insert into b values(3,'name03');
drop sequence seq_test1;
create sequence seq_test1;
drop sequence seq_test2;
create sequence seq_test2 INCREMENT BY 1 start with 1 minvalue 1 maxvalue 5 cycle noorder cache 3;
drop sequence seq_test3;
create sequence seq_test3 INCREMENT BY 1 start with 1 minvalue 1 maxvalue 5 nocycle noorder nocache;
select seq_test1.currval from a where id =0;
+---------+
| currval |
+---------+
+---------+
select seq_test1.nextval from a where id =0;
+---------+
| nextval |
+---------+
+---------+
select seq_test1.currval from a;
ERROR HY000: sequence is not yet defined in this session
select seq_test1.nextval , id ,name from a ;
+---------+------+--------+
| nextval | id   | name   |
+---------+------+--------+
|       1 |    1 | name01 |
|       2 |    2 | name02 |
|       3 |    3 | name03 |
|       4 |    4 | name04 |
|       5 |    5 | name05 |
|       6 |    6 | name06 |
+---------+------+--------+
select seq_test1.currval c ,seq_test1.nextval b from a;
+----+----+
| c  | b  |
+----+----+
|  7 |  7 |
|  8 |  8 |
|  9 |  9 |
| 10 | 10 |
| 11 | 11 |
| 12 | 12 |
+----+----+
select seq_test2.currval c ,seq_test2.nextval b from a;
+---+---+
| c | b |
+---+---+
| 1 | 1 |
| 2 | 2 |
| 3 | 3 |
| 4 | 4 |
| 5 | 5 |
| 1 | 1 |
+---+---+
select seq_test3.currval c ,seq_test3.nextval b from a;
ERROR HY000: sequence exceeds MAXVALUE and cannot be instantiated
select seq_test1.currval c ,seq_test1.nextval b from a where pk_id =1;
+----+----+
| c  | b  |
+----+----+
| 13 | 13 |
| 14 | 14 |
+----+----+
select seq_test1.currval c ,seq_test1.nextval b from a where pk_id >1;
+----+----+
| c  | b  |
+----+----+
| 15 | 15 |
| 16 | 16 |
| 17 | 17 |
| 18 | 18 |
+----+----+
select seq_test1.currval c ,seq_test1.nextval b from a where pk_id <1;
+---+---+
| c | b |
+---+---+
+---+---+
select seq_test1.currval c ,seq_test1.nextval b from a where pk_id <3;
+----+----+
| c  | b  |
+----+----+
| 19 | 19 |
| 20 | 20 |
| 21 | 21 |
+----+----+
select seq_test1.currval c ,seq_test1.nextval b from a where pk_id <=2;
+----+----+
| c  | b  |
+----+----+
| 22 | 22 |
| 23 | 23 |
| 24 | 24 |
+----+----+
select seq_test1.currval c ,seq_test1.nextval b,id ,name from a where pk_id>=2;
+----+----+------+--------+
| c  | b  | id   | name   |
+----+----+------+--------+
| 25 | 25 |    3 | name03 |
| 26 | 26 |    4 | name04 |
| 27 | 27 |    5 | name05 |
| 28 | 28 |    6 | name06 |
+----+----+------+--------+
select seq_test2.currval c ,seq_test2.nextval b,id ,name from a where pk_id>=1;
+---+---+------+--------+
| c | b | id   | name   |
+---+---+------+--------+
| 2 | 2 |    1 | name01 |
| 3 | 3 |    2 | name02 |
| 4 | 4 |    3 | name03 |
| 5 | 5 |    4 | name04 |
| 1 | 1 |    5 | name05 |
| 2 | 2 |    6 | name06 |
+---+---+------+--------+
select seq_test1.currval c ,seq_test1.nextval b ,a.* from a a where id <>1;
+----+----+------+--------+-------+
| c  | b  | id   | name   | pk_id |
+----+----+------+--------+-------+
| 29 | 29 |    2 | name02 |     1 |
| 30 | 30 |    3 | name03 |     2 |
| 31 | 31 |    4 | name04 |     3 |
| 32 | 32 |    5 | name05 |     3 |
| 33 | 33 |    6 | name06 |     3 |
+----+----+------+--------+-------+
select seq_test3.currval c ,seq_test3.nextval b,id ,name from a where pk_id=3;
ERROR HY000: sequence exceeds MAXVALUE and cannot be instantiated
select seq_test1.currval c ,seq_test1.nextval b,id ,name from a where pk_id>=2 and id=3;
+----+----+------+--------+
| c  | b  | id   | name   |
+----+----+------+--------+
| 34 | 34 |    3 | name03 |
+----+----+------+--------+
select seq_test2.currval c ,seq_test2.nextval b,id ,name from a where pk_id>=2 or id=3;
+---+---+------+--------+
| c | b | id   | name   |
+---+---+------+--------+
| 3 | 3 |    3 | name03 |
| 4 | 4 |    4 | name04 |
| 5 | 5 |    5 | name05 |
| 1 | 1 |    6 | name06 |
+---+---+------+--------+
select seq_test1.currval c ,seq_test2.nextval b ,a.* from a a where id between  2 and 3;
+----+---+------+--------+-------+
| c  | b | id   | name   | pk_id |
+----+---+------+--------+-------+
| 34 | 2 |    2 | name02 |     1 |
| 34 | 3 |    3 | name03 |     2 |
+----+---+------+--------+-------+
select seq_test1.currval c ,seq_test2.nextval b, seq_test2.currval ,a.* from a where name like '%name%';
+----+---+---------+------+--------+-------+
| c  | b | currval | id   | name   | pk_id |
+----+---+---------+------+--------+-------+
| 34 | 4 |       4 |    1 | name01 |     1 |
| 34 | 5 |       5 |    2 | name02 |     1 |
| 34 | 1 |       1 |    3 | name03 |     2 |
| 34 | 2 |       2 |    4 | name04 |     3 |
| 34 | 3 |       3 |    5 | name05 |     3 |
| 34 | 4 |       4 |    6 | name06 |     3 |
+----+---+---------+------+--------+-------+
select seq_test1.currval c ,seq_test2.nextval b, seq_test2.currval ,a.* from a where name not like '%name%';
+---+---+---------+------+------+-------+
| c | b | currval | id   | name | pk_id |
+---+---+---------+------+------+-------+
+---+---+---------+------+------+-------+
select seq_test1.currval c ,seq_test2.nextval b, seq_test2.currval ,a.* from a where exists (select * from b);
+----+---+---------+------+--------+-------+
| c  | b | currval | id   | name   | pk_id |
+----+---+---------+------+--------+-------+
| 34 | 5 |       5 |    1 | name01 |     1 |
| 34 | 1 |       1 |    2 | name02 |     1 |
| 34 | 2 |       2 |    3 | name03 |     2 |
| 34 | 3 |       3 |    4 | name04 |     3 |
| 34 | 4 |       4 |    5 | name05 |     3 |
| 34 | 5 |       5 |    6 | name06 |     3 |
+----+---+---------+------+--------+-------+
select seq_test1.currval c ,seq_test2.nextval b, seq_test2.currval ,a.* from a where id >any (select id from b);
+----+---+---------+------+--------+-------+
| c  | b | currval | id   | name   | pk_id |
+----+---+---------+------+--------+-------+
| 34 | 1 |       1 |    2 | name02 |     1 |
| 34 | 2 |       2 |    3 | name03 |     2 |
| 34 | 3 |       3 |    4 | name04 |     3 |
| 34 | 4 |       4 |    5 | name05 |     3 |
| 34 | 5 |       5 |    6 | name06 |     3 |
+----+---+---------+------+--------+-------+
select seq_test1.currval c ,seq_test2.nextval b, seq_test2.currval ,a.* from a where id >all (select id from b);
+----+---+---------+------+--------+-------+
| c  | b | currval | id   | name   | pk_id |
+----+---+---------+------+--------+-------+
| 34 | 1 |       1 |    4 | name04 |     3 |
| 34 | 2 |       2 |    5 | name05 |     3 |
| 34 | 3 |       3 |    6 | name06 |     3 |
+----+---+---------+------+--------+-------+
select seq_test1.currval c ,seq_test2.nextval b, seq_test2.currval ,a.* from a where id in (select id from b where name ='name02');
+----+---+---------+------+--------+-------+
| c  | b | currval | id   | name   | pk_id |
+----+---+---------+------+--------+-------+
| 34 | 4 |       4 |    2 | name02 |     1 |
+----+---+---------+------+--------+-------+
select seq_test1.currval c ,seq_test2.nextval b, seq_test2.currval ,a.* from a left join b b on a.pk_id =b.id;
+----+---+---------+------+--------+-------+
| c  | b | currval | id   | name   | pk_id |
+----+---+---------+------+--------+-------+
| 34 | 5 |       5 |    1 | name01 |     1 |
| 34 | 1 |       1 |    2 | name02 |     1 |
| 34 | 2 |       2 |    3 | name03 |     2 |
| 34 | 3 |       3 |    4 | name04 |     3 |
| 34 | 4 |       4 |    5 | name05 |     3 |
| 34 | 5 |       5 |    6 | name06 |     3 |
+----+---+---------+------+--------+-------+
select seq_test1.currval c ,seq_test2.nextval b, seq_test2.currval ,a.* from a full join b b on a.pk_id =b.id;
+----+---+---------+------+--------+-------+
| c  | b | currval | id   | name   | pk_id |
+----+---+---------+------+--------+-------+
| 34 | 1 |       1 |    1 | name01 |     1 |
| 34 | 2 |       2 |    2 | name02 |     1 |
| 34 | 3 |       3 |    3 | name03 |     2 |
| 34 | 4 |       4 |    4 | name04 |     3 |
| 34 | 5 |       5 |    5 | name05 |     3 |
| 34 | 1 |       1 |    6 | name06 |     3 |
+----+---+---------+------+--------+-------+
select seq_test1.currval c ,seq_test2.nextval b, seq_test2.currval ,a.* from a right join b b on a.pk_id =b.id;
+----+---+---------+------+--------+-------+
| c  | b | currval | id   | name   | pk_id |
+----+---+---------+------+--------+-------+
| 34 | 2 |       2 |    1 | name01 |     1 |
| 34 | 3 |       3 |    2 | name02 |     1 |
| 34 | 4 |       4 |    3 | name03 |     2 |
| 34 | 5 |       5 |    4 | name04 |     3 |
| 34 | 1 |       1 |    5 | name05 |     3 |
| 34 | 2 |       2 |    6 | name06 |     3 |
+----+---+---------+------+--------+-------+
select seq_test1.currval c ,seq_test2.nextval b, seq_test2.currval ,a.* from a inner join b b on a.pk_id =b.id;
+----+---+---------+------+--------+-------+
| c  | b | currval | id   | name   | pk_id |
+----+---+---------+------+--------+-------+
| 34 | 3 |       3 |    1 | name01 |     1 |
| 34 | 4 |       4 |    2 | name02 |     1 |
| 34 | 5 |       5 |    3 | name03 |     2 |
| 34 | 1 |       1 |    4 | name04 |     3 |
| 34 | 2 |       2 |    5 | name05 |     3 |
| 34 | 3 |       3 |    6 | name06 |     3 |
+----+---+---------+------+--------+-------+
ob支持sequence,oracle不支持报2287
with tmp as(select seq_test1.currval,seq_test1.nextval from a) select * from tmp;
+---------+---------+
| currval | nextval |
+---------+---------+
|      35 |      35 |
|      36 |      36 |
|      37 |      37 |
|      38 |      38 |
|      39 |      39 |
|      40 |      40 |
+---------+---------+
ob支持sequence,oracle不支持报2287
with tmp as(select seq_test1.currval,seq_test1.nextval from a where id =2) select * from tmp;
+---------+---------+
| currval | nextval |
+---------+---------+
|      41 |      41 |
+---------+---------+
select  (case id when 1 then seq_test1.nextval
when 2 then seq_test2.nextval
else seq_test1.currval end )  e from a;
+----+
| e  |
+----+
| 42 |
|  5 |
| 44 |
| 45 |
| 46 |
| 47 |
+----+
select  (case id when seq_test1.nextval then 1
when  seq_test1.currval then 2
else 3 end )  e from a;
+---+
| e |
+---+
| 3 |
| 3 |
| 3 |
| 3 |
| 3 |
| 3 |
+---+
select * from a group by id,seq_test1.nexval;
ERROR 42S22: Unknown column 'seq_test1.nexval' in 'group statement'
select * from a order by id,seq_test1.nextval;
ERROR HY000: sequence number not allowed here
select * from a where seq_test1.nextval>2;
ERROR HY000: sequence number not allowed here
select * from a where seq_test1.currval>2;
ERROR HY000: sequence number not allowed here
select seq_test1.currval+1 from a;
+---------------------+
| seq_test1.currval+1 |
+---------------------+
|                  54 |
|                  54 |
|                  54 |
|                  54 |
|                  54 |
|                  54 |
+---------------------+
select seq_test1.nextval+1 from a;
+---------------------+
| seq_test1.nextval+1 |
+---------------------+
|                  55 |
|                  56 |
|                  57 |
|                  58 |
|                  59 |
|                  60 |
+---------------------+
select seq_test1.currval+seq_test1.nextval from a;
+-------------------------------------+
| seq_test1.currval+seq_test1.nextval |
+-------------------------------------+
|                                 120 |
|                                 122 |
|                                 124 |
|                                 126 |
|                                 128 |
|                                 130 |
+-------------------------------------+
select seq_test1.nextval+abs(-1) from a;
+---------------------------+
| seq_test1.nextval+abs(-1) |
+---------------------------+
|                        67 |
|                        68 |
|                        69 |
|                        70 |
|                        71 |
|                        72 |
+---------------------------+
select seq_test1.currval+abs(-1) from a;
+---------------------------+
| seq_test1.currval+abs(-1) |
+---------------------------+
|                        72 |
|                        72 |
|                        72 |
|                        72 |
|                        72 |
|                        72 |
+---------------------------+
select seq_test1.nextval*2 from a;
+---------------------+
| seq_test1.nextval*2 |
+---------------------+
|                 144 |
|                 146 |
|                 148 |
|                 150 |
|                 152 |
|                 154 |
+---------------------+
select seq_test1.currval*2 from a;
+---------------------+
| seq_test1.currval*2 |
+---------------------+
|                 154 |
|                 154 |
|                 154 |
|                 154 |
|                 154 |
|                 154 |
+---------------------+
select seq_test1.nextval-2 from a;
+---------------------+
| seq_test1.nextval-2 |
+---------------------+
|                  76 |
|                  77 |
|                  78 |
|                  79 |
|                  80 |
|                  81 |
+---------------------+
select seq_test1.currval-2 from a;
+---------------------+
| seq_test1.currval-2 |
+---------------------+
|                  81 |
|                  81 |
|                  81 |
|                  81 |
|                  81 |
|                  81 |
+---------------------+
select seq_test1.nextval/3 from a;
+---------------------+
| seq_test1.nextval/3 |
+---------------------+
|             28.0000 |
|             28.3333 |
|             28.6667 |
|             29.0000 |
|             29.3333 |
|             29.6667 |
+---------------------+
select seq_test1.currval/3 from a;
+---------------------+
| seq_test1.currval/3 |
+---------------------+
|             29.6667 |
|             29.6667 |
|             29.6667 |
|             29.6667 |
|             29.6667 |
|             29.6667 |
+---------------------+
select seq_test1.currval mod seq_test1.nextval from a;
+-----------------------------------------+
| seq_test1.currval mod seq_test1.nextval |
+-----------------------------------------+
|                                       0 |
|                                       0 |
|                                       0 |
|                                       0 |
|                                       0 |
|                                       0 |
+-----------------------------------------+
select seq_test1.nextval div seq_test1.currval from a;
+-----------------------------------------+
| seq_test1.nextval div seq_test1.currval |
+-----------------------------------------+
|                                       1 |
|                                       1 |
|                                       1 |
|                                       1 |
|                                       1 |
|                                       1 |
+-----------------------------------------+
select -seq_test1.currval from a;
+--------------------+
| -seq_test1.currval |
+--------------------+
|               -101 |
|               -101 |
|               -101 |
|               -101 |
|               -101 |
|               -101 |
+--------------------+
select -seq_test1.nextval from a;
+--------------------+
| -seq_test1.nextval |
+--------------------+
|               -102 |
|               -103 |
|               -104 |
|               -105 |
|               -106 |
|               -107 |
+--------------------+
select +seq_test1.nextval from a;
+---------+
| nextval |
+---------+
|     108 |
|     109 |
|     110 |
|     111 |
|     112 |
|     113 |
+---------+
select +seq_test1.currval from a;
+---------+
| currval |
+---------+
|     113 |
|     113 |
|     113 |
|     113 |
|     113 |
|     113 |
+---------+
create table  c as select seq_test1.currval,seq_test1.nextval from a;
explain select seq_test1.currval,seq_test1.nextval from a;
select concat( seq_test1.currval,seq_test1.nextval) from a;
+----------------------------------------------+
| concat( seq_test1.currval,seq_test1.nextval) |
+----------------------------------------------+
| 120120                                       |
| 121121                                       |
| 122122                                       |
| 123123                                       |
| 124124                                       |
| 125125                                       |
+----------------------------------------------+
select ascii(seq_test1.nextval) from a;
+--------------------------+
| ascii(seq_test1.nextval) |
+--------------------------+
|                       49 |
|                       49 |
|                       49 |
|                       49 |
|                       49 |
|                       49 |
+--------------------------+
select length(seq_test1.currval) from a;
+---------------------------+
| length(seq_test1.currval) |
+---------------------------+
|                         3 |
|                         3 |
|                         3 |
|                         3 |
|                         3 |
|                         3 |
+---------------------------+
select acos(seq_test1.currval) from a;
+-------------------------+
| acos(seq_test1.currval) |
+-------------------------+
|                    NULL |
|                    NULL |
|                    NULL |
|                    NULL |
|                    NULL |
|                    NULL |
+-------------------------+
select pow(seq_test1.nextval,seq_test1.currval) from a;
+------------------------------------------+
| pow(seq_test1.nextval,seq_test1.currval) |
+------------------------------------------+
|                     8.23680755382935e279 |
|                   2.9666632286057294e282 |
|                    1.076571753588774e285 |
|                   3.9360331440417385e287 |
|                   1.4497447287989163e290 |
|                    5.379200107366758e292 |
+------------------------------------------+
select cast(seq_test1.currval as time) from a;
+---------------------------------+
| cast(seq_test1.currval as time) |
+---------------------------------+
| 00:01:37                        |
| 00:01:37                        |
| 00:01:37                        |
| 00:01:37                        |
| 00:01:37                        |
| 00:01:37                        |
+---------------------------------+
select isnull(seq_test1.nextval) from a;
+---------------------------+
| isnull(seq_test1.nextval) |
+---------------------------+
|                         0 |
|                         0 |
|                         0 |
|                         0 |
|                         0 |
|                         0 |
+---------------------------+
select CURRENT_TIME(seq_test1.nextval) from a;
ERROR 42000: You have an error in your SQL syntax; check the manual that corresponds to your OceanBase version for the right syntax to use near 'seq_test1.nextval) from a' at line 1
obmysql-sequence-5-1-2-1-1
drop sequence seq_test1;
create sequence seq_test1 nocache;
drop table test2;
create table test2(a char(50));
select seq_test1.nextval from tt1;
+---------+
| nextval |
+---------+
|       1 |
+---------+
insert into test2 values(seq_test1.nextval);
走proxy0,currval总是会变,为保证数据稳定，currval注释
update test2 set  a=seq_test1.nextval;
select * from test2 order by a;
+------+
| a    |
+------+
| 3    |
+------+
insert into test2 values(char(seq_test1.nextval));
select * from test2 order by a;
+------+
| a    |
+------+
|     |
| 3    |
+------+
update test2 set  a=char(seq_test1.nextval);
drop table test2;
drop table test3;
create table test3(a varchar(50));
select seq_test1.nextval from tt1;
+---------+
| nextval |
+---------+
|       7 |
+---------+
insert into test3 values(seq_test1.nextval);
select * from test3 order by a;
+------+
| a    |
+------+
| 8    |
+------+
update test3 set  a=seq_test1.nextval;
insert into test3 values(GREATEST(SEQ_TEST1.nextval,SEQ_TEST1.currval));
update test3 set  a=GREATEST(SEQ_TEST1.nextval,SEQ_TEST1.currval);
insert into test3 values(ora_decode(SEQ_TEST1.nextval,SEQ_TEST1.currval,SEQ_TEST1.nextval,3));
update test3 set  a=ora_decode(SEQ_TEST1.nextval,SEQ_TEST1.nextval,SEQ_TEST1.nextval,3);
update test3 set  a=ora_decode(SEQ_TEST1.currval,SEQ_TEST1.nextval,SEQ_TEST1.currval,3);
drop table test3;
drop table test4;
create table test4(a binary(50));
insert into test4 values(seq_test1.nextval);
update test4 set  a=seq_test1.nextval;
drop table test4;
drop table test4;
create table test4(a VARBINARY(50));
insert into test4 values(seq_test1.nextval);
select * from test4 order by a;
+------+
| a    |
+------+
| 22   |
+------+
update test4 set  a=seq_test1.nextval;
drop table test4;
drop table test6;
create table test6(a tinyint);
insert into test6 values(seq_test1.nextval);
select * from test6;
+------+
| a    |
+------+
|   24 |
+------+
update test6 set  a=seq_test1.nextval;
drop table test6;
drop table test6;
create table test6(a bool);
insert into test6 values(seq_test1.nextval);
select * from test6 order by a;
+------+
| a    |
+------+
|   26 |
+------+
update test6 set  a=seq_test1.nextval;
drop table test6;
drop table test6;
create table test6(a boolean);
insert into test6 values(seq_test1.nextval);
update test6 set  a=seq_test1.nextval;
drop table test6;
drop table test6;
create table test6(a smallint);
insert into test6 values(seq_test1.nextval);
update test6 set  a=seq_test1.nextval;
drop table test6;
drop table test6;
create table test6(a mediumint);
insert into test6 values(seq_test1.nextval);
update test6 set  a=seq_test1.nextval;
drop table test6;
drop table test6;
create table test6(a int);
insert into test6 values(seq_test1.nextval);
update test6 set  a=seq_test1.nextval;
drop table test6;
drop table test6;
create table test6(a integer);
insert into test6 values(seq_test1.nextval);
update test6 set  a=seq_test1.nextval;
drop table test6;
drop table test6;
create table test6(a bigint);
insert into test6 values(seq_test1.nextval);
update test6 set  a=seq_test1.nextval;
drop table test6;
drop table test6;
create table test6(a DECIMAL(5, 2));
insert into test6 values(seq_test1.nextval);
update test6 set  a=seq_test1.nextval;
drop table test6;
drop table test7;
create table test7(a FLOAT);
insert into test7 values(seq_test1.nextval);
update test7 set  a=seq_test1.nextval;
drop table test7;
drop table test7;
create table test7(a double);
insert into test7 values(seq_test1.nextval);
update test7 set  a=seq_test1.nextval;
drop table test7;
drop table test7;
create table test7(a bit(64));
insert into test7 values(seq_test1.nextval);
update test7 set  a=seq_test1.nextval;
drop table test7;
drop table test8;
create table test8(a DATE);
insert into test8 values('2010-10-10');
insert into test8 values(seq_test1.nextval);
ERROR 22007: Incorrect datetime value for column 'a' at row 1
update test8 set  a=seq_test1.nextval;
ERROR 22007: Incorrect datetime value for column 'a' at row 1
drop table test8;
drop table test9;
create table test9(a datetime);
insert into test9 values('2010-10-10 10:10:10');
insert into test9 values(seq_test1.nextval);
ERROR 22007: Incorrect datetime value for column 'a' at row 1
update test9 set  a=seq_test1.nextval;
ERROR 22007: Incorrect datetime value for column 'a' at row 1
update test9 set  a=seq_test1.nextval;
ERROR 22007: Incorrect datetime value for column 'a' at row 1
drop table test9;
drop table test10;
create table test10(a timestamp);
insert into test10 values('2010-10-10 10:10:10');
insert into test10 values(seq_test1.nextval);
ERROR 22007: Incorrect datetime value for column 'a' at row 1
update test10 set  a=seq_test1.nextval;
ERROR 22007: Incorrect datetime value for column 'a' at row 1
update test10 set  a=seq_test1.nextval;
ERROR 22007: Incorrect datetime value for column 'a' at row 1
drop table test10;
drop table test10;
create table test10(a year);
insert into test10 values(seq_test1.nextval);
update test10 set  a=seq_test1.nextval;
update test10 set  a=seq_test1.nextval;
drop table test10;
drop table test12;
create table test12(a blob);
insert into test12 values(seq_test1.nextval);
update test12 set  a=seq_test1.nextval;
update test12 set  a=seq_test1.nextval;
drop table test12;
drop table test13;
create table test13(a text);
insert into test13 values(seq_test1.nextval);
update test13 set  a=seq_test1.nextval;
drop table test13;
drop table test14;
create table test14(a enum('1','2','3'));
insert into test14 values(1);
insert into test14 values(seq_test1.nextval);
ERROR 01000: Data truncated for column 'a' at row 1
update test14 set  a=seq_test1.nextval;
ERROR 01000: Data truncated for column 'a' at row 1
drop table test14;
drop table test15;
create table test15(a set('5','6','7'));
insert into test15 values(6);
insert into test15 values(seq_test1.nextval);
ERROR 01000: Data truncated for column 'a' at row 1
update test15 set  a=seq_test1.nextval;
ERROR 01000: Data truncated for column 'a' at row 1
drop table test15;
drop sequence seq_test1;
create sequence seq_test1;
drop table test17;
create table test17(a int, b varchar(30));
insert into test17 select seq_test1.currval,seq_test1.nextval  from a where id>=1;
insert into test17 select seq_test1.nextval,seq_test1.currval  from a where id<=2;
insert into test17 select seq_test1.currval, seq_test1.nextval from a where pk_id>=2 and id=3;
insert into test17 select seq_test1.currval c ,seq_test1.nextval from a where pk_id>=2 or id=3;
insert into test17 select seq_test1.currval c ,seq_test1.nextval b from a a where id between  2 and 3;
insert into test17 select seq_test1.currval c ,seq_test1.nextval b from a a where name like '%name%';
insert into test17 select seq_test1.currval c ,seq_test1.nextval b from a a where name not like '%name%';
insert into test17 select seq_test1.currval c ,seq_test1.nextval b  from a a where exists (select * from b);
insert into test17 select seq_test1.currval c ,seq_test1.nextval b  from a a where id >any (select id from b);
insert into test17 select seq_test1.currval c ,seq_test1.nextval b  from a a where id >all (select id from b);
insert into test17 select seq_test1.currval c ,seq_test1.nextval b  from a a where id in (select id from b where name ='name02');
insert into test17 select seq_test1.currval c ,seq_test1.nextval b from a a left join b b on a.pk_id =b.id;
insert into test17 select seq_test1.currval c ,seq_test1.nextval b  from a a full join b b on a.pk_id =b.id;
insert into test17 select seq_test1.currval c ,seq_test1.nextval b  from a a right join b b on a.pk_id =b.id;
insert into test17 select seq_test1.currval c ,seq_test1.nextval b from a a inner join b b on a.pk_id =b.id;
insert into test17 values(seq_test1.nextval+1,seq_test1.currval+1),(seq_test1.nextval+1,seq_test1.currval+1);
insert into test17 values(seq_test1.currval+1,seq_test1.currval+1);
insert into test17 values(seq_test1.nextval+1,seq_test1.nextval+1);
insert into test17 values(seq_test1.nextval+seq_test1.currval,seq_test1.nextval+seq_test1.currval);
insert into test17 values(seq_test1.nextval-1,seq_test1.currval-1);
insert into test17 values(seq_test1.currval-1,seq_test1.nextval-1);
insert into test17 values(seq_test1.nextval-seq_test1.currval,seq_test1.nextval-seq_test1.currval);
insert into test17 values(seq_test1.nextval/2,seq_test1.currval/2);
insert into test17 values(seq_test1.currval/2,seq_test1.nextval mod 2);
insert into test17 values(seq_test1.nextval div seq_test1.currval,seq_test1.nextval/seq_test1.currval);
insert into test17 values(seq_test1.nextval*2,seq_test1.currval*2);
insert into test17 values(seq_test1.currval*2,seq_test1.nextval*2);
insert into test17 values(seq_test1.nextval*seq_test1.currval,seq_test1.nextval*seq_test1.currval);
insert into test17 values(-seq_test1.nextval,-seq_test1.currval);
insert into test17 values(+seq_test1.currval,+seq_test1.nextval);
select * from test17 order by a desc ,b asc;
insert into test17 values(abs(seq_test1.currval) ,abs(seq_test1.currval));
insert into test17 values(abs(seq_test1.nextval) ,abs(seq_test1.nextval));
insert into test17 values(abs(seq_test1.currval) ,abs(seq_test1.currval));
insert into test17 values(abs(seq_test1.currval) ,abs(seq_test1.nextval));
insert into test17 values(ACOS(seq_test1.currval) ,abs(seq_test1.nextval));
insert into test17 values(LN(seq_test1.currval),ln(seq_test1.nextval));
insert into test17 values(ASCII(seq_test1.currval),ASCII(seq_test1.nextval));
select * from test17 order by a desc ,b asc;
explain insert into test17 values(seq_test1.currval,seq_test1.nextval);
drop sequence s0609;
create sequence s0609;
drop table test0609;
create table test0609(a int, b varchar(30));
insert into test0609 values((select s0609.currval from dual),(select s0609.nextval from dual));
ERROR HY000: sequence number not allowed here
insert into test0609 select s0609.currval,s0609.nextval  from a where id>=1;
insert into test0609 select s0609.nextval,s0609.currval  from a where id<=2;
insert into test0609 select s0609.currval, s0609.nextval from a where pk_id>=2 and id=3;
insert into test0609 select s0609.currval c ,s0609.nextval from a where pk_id>=2 or id=3;
insert into test0609 select s0609.currval c ,s0609.nextval b from a a where id between  2 and 3;
insert into test0609 select s0609.currval c ,s0609.nextval b from a a where name like '%name%';
insert into test0609 select s0609.currval c ,s0609.nextval b from a a where name not like '%name%';
insert into test0609 select s0609.currval c ,s0609.nextval b  from a a where exists (select * from b);
insert into test0609 select s0609.currval c ,s0609.nextval b  from a a where id >any (select id from b);
insert into test0609 select s0609.currval c ,s0609.nextval b  from a a where id >all (select id from b);
insert into test0609 select s0609.currval c ,s0609.nextval b  from a a where id in (select id from b where name ='name02');
insert into test0609 select s0609.currval c ,s0609.nextval b from a a left join b b on a.pk_id =b.id;
insert into test0609 select s0609.currval c ,s0609.nextval b  from a a full join b b on a.pk_id =b.id;
insert into test0609 select s0609.currval c ,s0609.nextval b  from a a right join b b on a.pk_id =b.id;
insert into test0609 select s0609.currval c ,s0609.nextval b from a a inner join b b on a.pk_id =b.id;
insert into test0609 values(s0609.nextval+1,s0609.currval+1);
insert into test0609 values(s0609.nextval+1,s0609.nextval+1);
insert into test0609 values(s0609.nextval+s0609.currval,s0609.nextval+s0609.currval);
insert into test0609 values(s0609.nextval-1,s0609.currval-1);
insert into test0609 values(s0609.currval-1,s0609.nextval-1);
insert into test0609 values(s0609.nextval-s0609.currval,s0609.nextval-s0609.currval);
insert into test0609 values(s0609.nextval/2,s0609.currval/2);
insert into test0609 values(s0609.currval/2,s0609.nextval/2);
insert into test0609 values(s0609.nextval/s0609.currval,s0609.nextval/s0609.currval);
insert into test0609 values(s0609.nextval*2,s0609.currval*2);
insert into test0609 values(s0609.currval*2,s0609.nextval*2);
insert into test0609 values(s0609.nextval*s0609.currval,s0609.nextval*s0609.currval);
insert into test0609 values(-s0609.nextval,-s0609.currval);
insert into test0609 values(+s0609.currval,+s0609.nextval);
insert into test0609 values(s0609.nextval div s0609.currval,s0609.nextval div s0609.currval);
insert into test0609 values(s0609.nextval mod s0609.currval,s0609.nextval mod s0609.currval);
drop sequence s0609;
drop table test0609;
obmysql-sequence-5-1-2-1-3
update a set id =seq_test1.nextval , pk_id =seq_test1.nextval;
update a set id =seq_test1.currval , pk_id =seq_test1.nextval where id >=1;
update a set id =seq_test1.currval , pk_id =seq_test1.nextval where id<=2;
update a set id =seq_test1.currval , pk_id =seq_test1.nextval where pk_id>=2 and id=3;
update a set id =seq_test1.currval , pk_id =seq_test1.nextval where pk_id>=2 or id=3;
update a set id =seq_test1.currval , pk_id =seq_test1.nextval where id between  2 and 3;
update a set id =seq_test1.currval , pk_id =seq_test1.nextval where name like '%name%';
update a set id =seq_test1.currval , pk_id =seq_test1.nextval where name not like '%name%';
update a set id =seq_test1.currval , pk_id =seq_test1.nextval where exists (select * from b);
update a set id =seq_test1.currval , pk_id =seq_test1.nextval where id >any (select id from b);
update a set id =seq_test1.currval , pk_id =seq_test1.nextval where id >all (select id from b);
update a set id =seq_test1.currval , pk_id =seq_test1.nextval where id in (select id from b where name ='name02');
update a set id =seq_test1.currval+seq_test1.nextval;
update a set id =seq_test1.currval-seq_test1.nextval;
update a set id =seq_test1.currval*seq_test1.nextval;
update a set id =seq_test1.currval/seq_test1.nextval;
update a set id =seq_test1.currval*seq_test1.nextval;
update a set id =-seq_test1.nextval;
update a set id =+seq_test1.nextval;
update a set id =-seq_test1.currval;
update a set id =+seq_test1.currval;
update a set pk_id =abs(+seq_test1.currval);
update a set pk_id =abs(-seq_test1.nextval);
drop table e0604;
create table e0604(id int ,name varchar(20));
drop sequence s0604;
create sequence s0604;
insert into e0604 values(2,'test');
update e0604 set id =s0604.nextval;
select s0604.currval from tt1;
+---------+
| currval |
+---------+
|       1 |
+---------+
drop table e0604;
drop sequence s0604;
drop table test18;
drop table test19;
drop sequence seq_test1;
create sequence seq_test1;
select seq_test1.nextval from tt1;
+---------+
| nextval |
+---------+
|       1 |
+---------+
create table test18(name varchar(seq_test1.nextval));
ERROR 42000: You have an error in your SQL syntax; check the manual that corresponds to your OceanBase version for the right syntax to use near 'seq_test1.nextval))' at line 1
#bug34846999序列作为创建表的默认值，ob报错，oracle 11报错，oracle 12能正常创建
create table test18 (id int default seq_test1.currval);
ERROR 42000: You have an error in your SQL syntax; check the manual that corresponds to your OceanBase version for the right syntax to use near 'seq_test1.currval)' at line 1
#bug34846999序列作为创建表的默认值，ob报错，oracle 11报错，oracle 12能正常创建
create table test19 (id int default seq_test1.nextval);
ERROR 42000: You have an error in your SQL syntax; check the manual that corresponds to your OceanBase version for the right syntax to use near 'seq_test1.nextval)' at line 1
drop table test20;
create table test20 (id int,name varchar(50));
#bug34846999序列作为创建表的默认值，ob报错，oracle 11报错，oracle 12能正常创建
alter table test20 add (id01 int default seq_test1.currval);
ERROR 42000: You have an error in your SQL syntax; check the manual that corresponds to your OceanBase version for the right syntax to use near 'seq_test1.currval)' at line 1
drop table test20;
obmysql-sequence-5-1-2-3 约束
drop sequence seq_test0608;
create sequence seq_test0608;
drop table test21;
create table test21(id int PRIMARY KEY ,name varchar(20));
insert into test21 values(seq_test0608.nextval,'xiaolai');
insert into test21 values(seq_test0608.nextval-1,'xiaolai');
ERROR 23000: Duplicate entry '1' for key 'PRIMARY'
update test21 set id = seq_test0608.nextval where name='xiaolai';
update test21 set id = seq_test0608.nextval where name ='xiaolai';
drop sequence seq_test0608;
create sequence seq_test0608;
drop table test21;
drop table test22;
create table test22(id int not null ,name varchar(20),constraint constraint_name unique(id));
insert into test22 values(seq_test0608.nextval,'xiaolai');
insert into test22 values(seq_test0608.nextval-1,'xiaolai');
ERROR 23000: Duplicate entry '1' for key 'constraint_name'
update test22 set id = seq_test0608.nextval where name='xiaolai';
update test22 set id = seq_test0608.nextval where name ='xiaolai';
drop table test22;
drop sequence seq_test0608;
drop sequence seq_test10;
create sequence seq_test10;
drop table test23;
drop table test24;
create table test24 (id int primary key, name varchar(30));
create table test23 (id int, name varchar(30), pk_id int,constraint fk_name foreign key (pk_id) references test24(id));
insert into test24 values(1,'name01');
insert into test24 values(2,'name02');
insert into test24 values(3,'name03');
insert into test23 values(1,'name01',1);
insert into test23 values(2,'name02',1);
insert into test23 values(3,'name03',2);
insert into test23 values(4,'name04',3);
insert into test23 values(5,'name05',3);
insert into test23 values(6,'name06',3);
select seq_test10.nextval;
+---------+
| nextval |
+---------+
|       1 |
+---------+
insert into test23 values(7,'name07',seq_test10.nextval);
insert into test23 values(7,'name07',seq_test10.nextval);
insert into test23 values(7,'name07',seq_test10.nextval);
ERROR 23000: Cannot add or update a child row: a foreign key constraint fails
drop sequence seq_test11;
create sequence seq_test11;
insert into test23 values(seq_test11.nextval,'name04','1');
select seq_test11.currval from tt1;
+---------+
| currval |
+---------+
|       1 |
+---------+
drop sequence seq_test10;
drop table test23;
drop table test24;
drop sequence seq_test11;
drop table t1;
drop sequence s;
create sequence s;
drop table t1;
create table t1 (id int primary key, user_val int) partition by hash(id) partitions 3;
insert into t1 values (s.nextval, 1);
insert into t1 values (s.nextval, 2);
explain insert into t1 select s.nextval, s.nextval from t1;
explain insert into t1 select s.nextval, s.currval from t1;
select s.nextval from tt1;
update t1 set id =s.currval where user_val=1;
update t1 set id =s.nextval where user_val=2;
insert into t1 values (s.nextval, s.currval);
insert into t1 values (s.nextval, s.nextval);
update t1 set id =s.currval, user_val=s.currval where user_val=1;
update t1 set id =s.nextval ,user_val=s.nextval where user_val=2;
update t1 set id =s.nextval ,user_val=s.currval where user_val=2;
update t1 set  user_val=s.nextval where user_val=1;
drop table t1;
drop sequence s;
drop table t2;
create table t2(id int ,name varchar(30));
drop sequence s1;
create sequence s1;
##关闭自动提交
set session autocommit = 0;
savepoint t1;
insert into t2 values(s1.nextval,'xiaolai');
insert into t2 values(s1.nextval,'xiaolai02');
select s1.nextval from tt1;
+---------+
| nextval |
+---------+
|       3 |
+---------+
select s1.nextval from t2;
+---------+
| nextval |
+---------+
|       4 |
|       5 |
+---------+
update t2 set id= s1.nextval where name='xiaolai02';
rollback to  t1;
insert into t2 values(s1.nextval,'xiaolai');
insert into t2 values(s1.nextval,'xiaolai02');
select s1.nextval from tt1;
+---------+
| nextval |
+---------+
|       9 |
+---------+
select s1.nextval from t2;
+---------+
| nextval |
+---------+
|      10 |
|      11 |
+---------+
update t2 set id= s1.nextval where name='xiaolai02';
commit;
##开启自动提交
set session autocommit = 1;
drop sequence s1;
create sequence s1;
##关闭自动提交
set session autocommit = 0;
savepoint t1;
select s1.nextval;
+---------+
| nextval |
+---------+
|       1 |
+---------+
rollback to  t1;
select s1.nextval,s1.currval from tt1;
+---------+---------+
| nextval | currval |
+---------+---------+
|       2 |       2 |
+---------+---------+
select s1.nextval;
+---------+
| nextval |
+---------+
|       3 |
+---------+
select s1.currval from tt1;
+---------+
| currval |
+---------+
|       3 |
+---------+
commit;
##开启自动提交
set session autocommit = 1;
select s1.currval from tt1;
+---------+
| currval |
+---------+
|       3 |
+---------+
drop sequence s1;
obmysql-sequence-5-1-2-2 视图
drop table v_a;
create table v_a(v_id int,v_name varchar(30),pk_id int);
drop table v_b;
create table v_b(v_id int ,v_name varchar(30));
drop sequence seq_test12;
create sequence seq_test12 INCREMENT BY 1 start with 1 minvalue 1 maxvalue 3 cycle noorder cache 2;
drop view v_test;
create view v_test as select seq_test12.currval ,seq_test12.nextval from dual;
ERROR HY000: sequence number not allowed here
create view v_test as select * from v_b;
insert into v_test values(1,'name01');
insert into v_test values(2,'name02');
insert into v_test values(3,'name03');
insert into v_test values(4,'name04');
insert into v_test values(5,'name05');
insert into v_test values(6,'name06');
select seq_test12.currval ,seq_test12.nextval from v_test;
+---------+---------+
| currval | nextval |
+---------+---------+
|       1 |       1 |
|       2 |       2 |
|       3 |       3 |
|       1 |       1 |
|       2 |       2 |
|       3 |       3 |
+---------+---------+
select seq_test12.currval ,seq_test12.nextval from v_test where v_id =1;
+---------+---------+
| currval | nextval |
+---------+---------+
|       1 |       1 |
+---------+---------+
select seq_test12.currval ,seq_test12.nextval from v_test where v_id =1 or v_id>4;
+---------+---------+
| currval | nextval |
+---------+---------+
|       2 |       2 |
|       3 |       3 |
|       1 |       1 |
+---------+---------+
select seq_test12.currval ,seq_test12.nextval from v_test where v_id between 1 and 4;
+---------+---------+
| currval | nextval |
+---------+---------+
|       2 |       2 |
|       3 |       3 |
|       1 |       1 |
|       2 |       2 |
+---------+---------+
select seq_test12.currval ,seq_test12.nextval from v_test where v_name like '%name%';
+---------+---------+
| currval | nextval |
+---------+---------+
|       3 |       3 |
|       1 |       1 |
|       2 |       2 |
|       3 |       3 |
|       1 |       1 |
|       2 |       2 |
+---------+---------+
select seq_test12.currval ,seq_test12.nextval from v_test where v_id in(2,3);
+---------+---------+
| currval | nextval |
+---------+---------+
|       3 |       3 |
|       1 |       1 |
+---------+---------+
select seq_test12.currval+1 ,seq_test12.nextval-1 from v_test;
+----------------------+----------------------+
| seq_test12.currval+1 | seq_test12.nextval-1 |
+----------------------+----------------------+
|                    3 |                    1 |
|                    4 |                    2 |
|                    2 |                    0 |
|                    3 |                    1 |
|                    4 |                    2 |
|                    2 |                    0 |
+----------------------+----------------------+
select seq_test12.currval/2 ,seq_test12.nextval*2 from v_test;
+----------------------+----------------------+
| seq_test12.currval/2 | seq_test12.nextval*2 |
+----------------------+----------------------+
|               1.0000 |                    4 |
|               1.5000 |                    6 |
|               0.5000 |                    2 |
|               1.0000 |                    4 |
|               1.5000 |                    6 |
|               0.5000 |                    2 |
+----------------------+----------------------+
select -seq_test12.currval from v_test;
+---------------------+
| -seq_test12.currval |
+---------------------+
|                  -1 |
|                  -1 |
|                  -1 |
|                  -1 |
|                  -1 |
|                  -1 |
+---------------------+
select +seq_test12.currval from v_test;
+---------+
| currval |
+---------+
|       1 |
|       1 |
|       1 |
|       1 |
|       1 |
|       1 |
+---------+
select +seq_test12.nextval from v_test;
+---------+
| nextval |
+---------+
|       2 |
|       3 |
|       1 |
|       2 |
|       3 |
|       1 |
+---------+
select -seq_test12.nextval from v_test;
+---------------------+
| -seq_test12.nextval |
+---------------------+
|                  -2 |
|                  -3 |
|                  -1 |
|                  -2 |
|                  -3 |
|                  -1 |
+---------------------+
select abs(seq_test12.nextval) from v_test;
+-------------------------+
| abs(seq_test12.nextval) |
+-------------------------+
|                       2 |
|                       3 |
|                       1 |
|                       2 |
|                       3 |
|                       1 |
+-------------------------+
select SIGN(seq_test12.currval) from v_test;
+--------------------------+
| SIGN(seq_test12.currval) |
+--------------------------+
|                        1 |
|                        1 |
|                        1 |
|                        1 |
|                        1 |
|                        1 |
+--------------------------+
insert into v_test values(seq_test12.nextval,seq_test12.nextval);
insert into v_test values(seq_test12.currval,seq_test12.currval);
insert into v_test values(POWER(seq_test12.currval,seq_test12.currval),seq_test12.currval);
insert into v_test values(POWER(seq_test12.nextval,seq_test12.nextval),seq_test12.nextval);
insert into v_test values(seq_test12.nextval+1,seq_test12.nextval-1);
insert into v_test values(seq_test12.nextval*1,seq_test12.nextval/1);
insert into v_test values(+seq_test12.nextval,-seq_test12.nextval);
insert into v_test values(-seq_test12.nextval,-seq_test12.currval);
insert into v_test values(-seq_test12.nextval||seq_test12.currval,'xiaolai');
select * from v_test order by v_id;
+------+---------+
| v_id | v_name  |
+------+---------+
|   -1 | -1      |
|    1 | name01  |
|    1 | xiaolai |
|    2 | name02  |
|    2 | 2       |
|    2 | 2       |
|    2 | 0       |
|    2 | 2.0000  |
|    3 | name03  |
|    3 | -3      |
|    4 | name04  |
|    4 | 2       |
|    5 | name05  |
|    6 | name06  |
|   27 | 3       |
+------+---------+
update v_test set v_id = seq_test12.nextval where v_id = 1;
update v_test set v_id = seq_test12.nextval where v_id between 1 and 2;
update v_test set v_id = seq_test12.currval+1;
update v_test set v_id = seq_test12.nextval-1;
update v_test set v_id = seq_test12.currval*1;
update v_test set v_id = seq_test12.nextval/1;
update v_test set v_id = +seq_test12.currval;
update v_test set v_id = -seq_test12.nextval;
update v_test set v_id = seq_test12.nextval||seq_test12.currval;
update v_test set v_id=abs(+seq_test12.currval);
update v_test set v_id=abs(+seq_test12.nextval);
update v_test set v_id=seq_test12.currval,v_name=seq_test12.nextval;
explain
drop sequence s1;
drop sequence s2;
drop table t1;
drop table t2;
drop table t3;
create sequence s1 start with 1 increment by 1 cache 30;
create sequence s2 start with 4;
create table t1 (i int primary key, j int);
create table t2 (i int primary key, j int) partition by hash(i) partitions 3;
## test: insert
explain insert into t1 values (s1.nextval, s1.nextval);
Query Plan
==================================================
|ID|OPERATOR          |NAME|EST.ROWS|EST.TIME(us)|
--------------------------------------------------
|0 |DISTRIBUTED INSERT|    |1       |13          |
|1 |└─EXPRESSION      |    |1       |1           |
|2 |  └─SEQUENCE      |    |0       |1           |
==================================================
Outputs & filters:
-------------------------------------
  0 - output(nil), filter(nil)
      columns([{t1: ({t1: (t1.i, t1.j)})}]), 
      column_values([column_conv(INT,PS:(11,0),NOT NULL,__values.i)], [column_conv(INT,PS:(11,0),NULL,__values.j)])
  1 - output([__values.i], [__values.j]), filter(nil)
      values({s1.nextval, s1.nextval})
  2 - output(nil), filter(nil)
explain insert into t1 values (1000, s1.nextval);
Query Plan
==================================================
|ID|OPERATOR          |NAME|EST.ROWS|EST.TIME(us)|
--------------------------------------------------
|0 |DISTRIBUTED INSERT|    |1       |13          |
|1 |└─EXPRESSION      |    |1       |1           |
|2 |  └─SEQUENCE      |    |0       |1           |
==================================================
Outputs & filters:
-------------------------------------
  0 - output(nil), filter(nil)
      columns([{t1: ({t1: (t1.i, t1.j)})}]), 
      column_values([column_conv(INT,PS:(11,0),NOT NULL,__values.i)], [column_conv(INT,PS:(11,0),NULL,__values.j)])
  1 - output([__values.i], [__values.j]), filter(nil)
      values({1000, s1.nextval})
  2 - output(nil), filter(nil)
explain insert into t1 values (s1.nextval, 1000);
Query Plan
==================================================
|ID|OPERATOR          |NAME|EST.ROWS|EST.TIME(us)|
--------------------------------------------------
|0 |DISTRIBUTED INSERT|    |1       |13          |
|1 |└─EXPRESSION      |    |1       |1           |
|2 |  └─SEQUENCE      |    |0       |1           |
==================================================
Outputs & filters:
-------------------------------------
  0 - output(nil), filter(nil)
      columns([{t1: ({t1: (t1.i, t1.j)})}]), 
      column_values([column_conv(INT,PS:(11,0),NOT NULL,__values.i)], [column_conv(INT,PS:(11,0),NULL,__values.j)])
  1 - output([__values.i], [__values.j]), filter(nil)
      values({s1.nextval, 1000})
  2 - output(nil), filter(nil)
insert into t1 values (s1.nextval, s1.nextval);
insert into t1 values (1000, s1.nextval);
insert into t1 values (s1.nextval, 1000);
explain insert into t2 values (s1.nextval, s2.nextval);
Query Plan
==================================================
|ID|OPERATOR          |NAME|EST.ROWS|EST.TIME(us)|
--------------------------------------------------
|0 |DISTRIBUTED INSERT|    |1       |13          |
|1 |└─EXPRESSION      |    |1       |1           |
|2 |  └─SEQUENCE      |    |0       |1           |
==================================================
Outputs & filters:
-------------------------------------
  0 - output(nil), filter(nil)
      columns([{t2: ({t2: (t2.i, t2.j)})}]), 
      column_values([column_conv(INT,PS:(11,0),NOT NULL,__values.i)], [column_conv(INT,PS:(11,0),NULL,__values.j)])
  1 - output([__values.i], [__values.j]), filter(nil)
      values({s1.nextval, s2.nextval})
  2 - output([s1.nextval]), filter(nil)
explain insert into t2 values (1000, s2.nextval);
Query Plan
==================================================
|ID|OPERATOR          |NAME|EST.ROWS|EST.TIME(us)|
--------------------------------------------------
|0 |DISTRIBUTED INSERT|    |1       |13          |
|1 |└─EXPRESSION      |    |1       |1           |
|2 |  └─SEQUENCE      |    |0       |1           |
==================================================
Outputs & filters:
-------------------------------------
  0 - output(nil), filter(nil)
      columns([{t2: ({t2: (t2.i, t2.j)})}]), 
      column_values([column_conv(INT,PS:(11,0),NOT NULL,__values.i)], [column_conv(INT,PS:(11,0),NULL,__values.j)])
  1 - output([__values.i], [__values.j]), filter(nil)
      values({1000, s2.nextval})
  2 - output(nil), filter(nil)
explain insert into t2 values (s1.nextval, 1000);
Query Plan
==================================================
|ID|OPERATOR          |NAME|EST.ROWS|EST.TIME(us)|
--------------------------------------------------
|0 |DISTRIBUTED INSERT|    |1       |13          |
|1 |└─EXPRESSION      |    |1       |1           |
|2 |  └─SEQUENCE      |    |0       |1           |
==================================================
Outputs & filters:
-------------------------------------
  0 - output(nil), filter(nil)
      columns([{t2: ({t2: (t2.i, t2.j)})}]), 
      column_values([column_conv(INT,PS:(11,0),NOT NULL,__values.i)], [column_conv(INT,PS:(11,0),NULL,__values.j)])
  1 - output([__values.i], [__values.j]), filter(nil)
      values({s1.nextval, 1000})
  2 - output([s1.nextval]), filter(nil)
insert into t2 values (s1.nextval, s2.nextval);
insert into t2 values (1000, s2.nextval);
insert into t2 values (s1.nextval, 1000);
## test: update
explain update t1 set j = s1.nextval where i > 0;
Query Plan
====================================================
|ID|OPERATOR            |NAME|EST.ROWS|EST.TIME(us)|
----------------------------------------------------
|0 |UPDATE              |    |3       |49          |
|1 |└─SEQUENCE          |    |3       |3           |
|2 |  └─TABLE RANGE SCAN|t1  |3       |3           |
====================================================
Outputs & filters:
-------------------------------------
  0 - output(nil), filter(nil)
      table_columns([{t1: ({t1: (t1.i, t1.j)})}]),
      update([t1.j=column_conv(INT,PS:(11,0),NULL,cast(s1.nextval, INT(-1, 0)))])
  1 - output([t1.i], [t1.j], [s1.nextval]), filter(nil)
  2 - output([t1.i], [t1.j]), filter(nil), rowset=16
      access([t1.i], [t1.j]), partitions(p0)
      is_index_back=false, is_global_index=false, 
      range_key([t1.i]), range(0 ; MAX), 
      range_cond([t1.i > 0])
explain update t1 set j = s1.nextval where i = 10;
Query Plan
=============================================
|ID|OPERATOR     |NAME|EST.ROWS|EST.TIME(us)|
---------------------------------------------
|0 |UPDATE       |    |1       |37          |
|1 |└─SEQUENCE   |    |1       |5           |
|2 |  └─TABLE GET|t1  |1       |5           |
=============================================
Outputs & filters:
-------------------------------------
  0 - output(nil), filter(nil)
      table_columns([{t1: ({t1: (t1.i, t1.j)})}]),
      update([t1.j=column_conv(INT,PS:(11,0),NULL,cast(s1.nextval, INT(-1, 0)))])
  1 - output([t1.i], [t1.j], [s1.nextval]), filter(nil)
  2 - output([t1.i], [t1.j]), filter(nil), rowset=16
      access([t1.i], [t1.j]), partitions(p0)
      is_index_back=false, is_global_index=false, 
      range_key([t1.i]), range[10 ; 10], 
      range_cond([t1.i = 10])
explain update t1 set j = s1.nextval where i > 10;
Query Plan
====================================================
|ID|OPERATOR            |NAME|EST.ROWS|EST.TIME(us)|
----------------------------------------------------
|0 |UPDATE              |    |1       |34          |
|1 |└─SEQUENCE          |    |1       |3           |
|2 |  └─TABLE RANGE SCAN|t1  |1       |3           |
====================================================
Outputs & filters:
-------------------------------------
  0 - output(nil), filter(nil)
      table_columns([{t1: ({t1: (t1.i, t1.j)})}]),
      update([t1.j=column_conv(INT,PS:(11,0),NULL,cast(s1.nextval, INT(-1, 0)))])
  1 - output([t1.i], [t1.j], [s1.nextval]), filter(nil)
  2 - output([t1.i], [t1.j]), filter(nil), rowset=16
      access([t1.i], [t1.j]), partitions(p0)
      is_index_back=false, is_global_index=false, 
      range_key([t1.i]), range(10 ; MAX), 
      range_cond([t1.i > 10])
explain update t2 set j = s1.nextval where i > 0;
Query Plan
=================================================================
|ID|OPERATOR                     |NAME    |EST.ROWS|EST.TIME(us)|
-----------------------------------------------------------------
|0 |DISTRIBUTED UPDATE           |        |3       |57          |
|1 |└─SEQUENCE                   |        |3       |10          |
|2 |  └─PX COORDINATOR           |        |3       |10          |
|3 |    └─EXCHANGE OUT DISTR     |:EX10000|3       |9           |
|4 |      └─PX PARTITION ITERATOR|        |3       |7           |
|5 |        └─TABLE RANGE SCAN   |t2      |3       |7           |
=================================================================
Outputs & filters:
-------------------------------------
  0 - output(nil), filter(nil)
      table_columns([{t2: ({t2: (t2.i, t2.j)})}]),
      update([t2.j=column_conv(INT,PS:(11,0),NULL,cast(s1.nextval, INT(-1, 0)))])
  1 - output([t2.i], [t2.j], [s1.nextval]), filter(nil)
  2 - output([t2.i], [t2.j]), filter(nil), rowset=16
  3 - output([t2.i], [t2.j]), filter(nil), rowset=16
      dop=1
  4 - output([t2.i], [t2.j]), filter(nil), rowset=16
      force partition granule
  5 - output([t2.i], [t2.j]), filter(nil), rowset=16
      access([t2.i], [t2.j]), partitions(p[0-2])
      is_index_back=false, is_global_index=false, 
      range_key([t2.i]), range(0 ; MAX), 
      range_cond([t2.i > 0])
explain update t2 set j = s1.nextval where i = 10;
Query Plan
=============================================
|ID|OPERATOR     |NAME|EST.ROWS|EST.TIME(us)|
---------------------------------------------
|0 |UPDATE       |    |1       |37          |
|1 |└─SEQUENCE   |    |1       |5           |
|2 |  └─TABLE GET|t2  |1       |5           |
=============================================
Outputs & filters:
-------------------------------------
  0 - output(nil), filter(nil)
      table_columns([{t2: ({t2: (t2.i, t2.j)})}]),
      update([t2.j=column_conv(INT,PS:(11,0),NULL,cast(s1.nextval, INT(-1, 0)))])
  1 - output([t2.i], [t2.j], [s1.nextval]), filter(nil)
  2 - output([t2.i], [t2.j]), filter(nil), rowset=16
      access([t2.i], [t2.j]), partitions(p1)
      is_index_back=false, is_global_index=false, 
      range_key([t2.i]), range[10 ; 10], 
      range_cond([t2.i = 10])
explain update t2 set j = s1.nextval where i > 10;
Query Plan
=================================================================
|ID|OPERATOR                     |NAME    |EST.ROWS|EST.TIME(us)|
-----------------------------------------------------------------
|0 |DISTRIBUTED UPDATE           |        |1       |39          |
|1 |└─SEQUENCE                   |        |1       |8           |
|2 |  └─PX COORDINATOR           |        |1       |8           |
|3 |    └─EXCHANGE OUT DISTR     |:EX10000|1       |8           |
|4 |      └─PX PARTITION ITERATOR|        |1       |7           |
|5 |        └─TABLE RANGE SCAN   |t2      |1       |7           |
=================================================================
Outputs & filters:
-------------------------------------
  0 - output(nil), filter(nil)
      table_columns([{t2: ({t2: (t2.i, t2.j)})}]),
      update([t2.j=column_conv(INT,PS:(11,0),NULL,cast(s1.nextval, INT(-1, 0)))])
  1 - output([t2.i], [t2.j], [s1.nextval]), filter(nil)
  2 - output([t2.i], [t2.j]), filter(nil), rowset=16
  3 - output([t2.i], [t2.j]), filter(nil), rowset=16
      dop=1
  4 - output([t2.i], [t2.j]), filter(nil), rowset=16
      force partition granule
  5 - output([t2.i], [t2.j]), filter(nil), rowset=16
      access([t2.i], [t2.j]), partitions(p[0-2])
      is_index_back=false, is_global_index=false, 
      range_key([t2.i]), range(10 ; MAX), 
      range_cond([t2.i > 10])
## test: select
explain select s1.nextval, s1.currval from t1 where i > 0;
Query Plan
==================================================
|ID|OPERATOR          |NAME|EST.ROWS|EST.TIME(us)|
--------------------------------------------------
|0 |SEQUENCE          |    |3       |3           |
|1 |└─TABLE RANGE SCAN|t1  |3       |3           |
==================================================
Outputs & filters:
-------------------------------------
  0 - output([s1.nextval], [s1.currval]), filter(nil)
  1 - output(nil), filter(nil), rowset=16
      access(nil), partitions(p0)
      is_index_back=false, is_global_index=false, 
      range_key([t1.i]), range(0 ; MAX), 
      range_cond([t1.i > 0])
select s1.nextval, s1.currval from t1 where i > 0;
+---------+---------+
| nextval | currval |
+---------+---------+
|       6 |       6 |
|       7 |       7 |
|       8 |       8 |
+---------+---------+
explain select s1.nextval + 3, s1.currval * s1.nextval from t1 where i > 0;
Query Plan
==================================================
|ID|OPERATOR          |NAME|EST.ROWS|EST.TIME(us)|
--------------------------------------------------
|0 |SEQUENCE          |    |3       |3           |
|1 |└─TABLE RANGE SCAN|t1  |3       |3           |
==================================================
Outputs & filters:
-------------------------------------
  0 - output([s1.nextval + cast(3, DECIMAL(4, 0))], [s1.currval * s1.nextval]), filter(nil)
  1 - output(nil), filter(nil), rowset=16
      access(nil), partitions(p0)
      is_index_back=false, is_global_index=false, 
      range_key([t1.i]), range(0 ; MAX), 
      range_cond([t1.i > 0])
select s1.nextval + 3, s1.currval * s1.nextval from t1 where i > 0;
+----------------+-------------------------+
| s1.nextval + 3 | s1.currval * s1.nextval |
+----------------+-------------------------+
|             12 |                      81 |
|             13 |                     100 |
|             14 |                     121 |
+----------------+-------------------------+
explain select s1.nextval, s1.currval from t2 where i > 0;
Query Plan
===============================================================
|ID|OPERATOR                   |NAME    |EST.ROWS|EST.TIME(us)|
---------------------------------------------------------------
|0 |SEQUENCE                   |        |3       |8           |
|1 |└─PX COORDINATOR           |        |3       |8           |
|2 |  └─EXCHANGE OUT DISTR     |:EX10000|3       |8           |
|3 |    └─PX PARTITION ITERATOR|        |3       |7           |
|4 |      └─TABLE RANGE SCAN   |t2      |3       |7           |
===============================================================
Outputs & filters:
-------------------------------------
  0 - output([s1.nextval], [s1.currval]), filter(nil)
  1 - output(nil), filter(nil), rowset=16
  2 - output(nil), filter(nil), rowset=16
      dop=1
  3 - output(nil), filter(nil), rowset=16
      force partition granule
  4 - output(nil), filter(nil), rowset=16
      access(nil), partitions(p[0-2])
      is_index_back=false, is_global_index=false, 
      range_key([t2.i]), range(0 ; MAX), 
      range_cond([t2.i > 0])
select s1.nextval, s1.currval from t2 where i > 0;
+---------+---------+
| nextval | currval |
+---------+---------+
|      12 |      12 |
|      13 |      13 |
|      14 |      14 |
+---------+---------+
explain select s1.nextval + 3, s1.currval * s1.nextval from t2 where i > 0;
Query Plan
===============================================================
|ID|OPERATOR                   |NAME    |EST.ROWS|EST.TIME(us)|
---------------------------------------------------------------
|0 |SEQUENCE                   |        |3       |8           |
|1 |└─PX COORDINATOR           |        |3       |8           |
|2 |  └─EXCHANGE OUT DISTR     |:EX10000|3       |8           |
|3 |    └─PX PARTITION ITERATOR|        |3       |7           |
|4 |      └─TABLE RANGE SCAN   |t2      |3       |7           |
===============================================================
Outputs & filters:
-------------------------------------
  0 - output([s1.nextval + cast(3, DECIMAL(4, 0))], [s1.currval * s1.nextval]), filter(nil)
  1 - output(nil), filter(nil), rowset=16
  2 - output(nil), filter(nil), rowset=16
      dop=1
  3 - output(nil), filter(nil), rowset=16
      force partition granule
  4 - output(nil), filter(nil), rowset=16
      access(nil), partitions(p[0-2])
      is_index_back=false, is_global_index=false, 
      range_key([t2.i]), range(0 ; MAX), 
      range_cond([t2.i > 0])
select s1.nextval + 3, s1.currval * s1.nextval from t2 where i > 0;
+----------------+-------------------------+
| s1.nextval + 3 | s1.currval * s1.nextval |
+----------------+-------------------------+
|             18 |                     225 |
|             19 |                     256 |
|             20 |                     289 |
+----------------+-------------------------+
## test join select
explain select s1.nextval from t1, t2;
Query Plan
===================================================================
|ID|OPERATOR                       |NAME    |EST.ROWS|EST.TIME(us)|
-------------------------------------------------------------------
|0 |SEQUENCE                       |        |9       |9           |
|1 |└─NESTED-LOOP JOIN CARTESIAN   |        |9       |9           |
|2 |  ├─TABLE FULL SCAN            |t1      |3       |3           |
|3 |  └─MATERIAL                   |        |3       |7           |
|4 |    └─PX COORDINATOR           |        |3       |7           |
|5 |      └─EXCHANGE OUT DISTR     |:EX10000|3       |7           |
|6 |        └─PX PARTITION ITERATOR|        |3       |7           |
|7 |          └─TABLE FULL SCAN    |t2      |3       |7           |
===================================================================
Outputs & filters:
-------------------------------------
  0 - output([s1.nextval]), filter(nil)
  1 - output(nil), filter(nil), rowset=16
      conds(nil), nl_params_(nil), use_batch=false
  2 - output(nil), filter(nil), rowset=16
      access(nil), partitions(p0)
      is_index_back=false, is_global_index=false, 
      range_key([t1.i]), range(MIN ; MAX)always true
  3 - output(nil), filter(nil), rowset=16
  4 - output(nil), filter(nil), rowset=16
  5 - output(nil), filter(nil), rowset=16
      dop=1
  6 - output(nil), filter(nil), rowset=16
      force partition granule
  7 - output(nil), filter(nil), rowset=16
      access(nil), partitions(p[0-2])
      is_index_back=false, is_global_index=false, 
      range_key([t2.i]), range(MIN ; MAX)always true
## test: insert into select
create table t3 (i int primary key, j int);
insert into t3 values (999, 0);
insert into t3 values (1000, 1);
insert into t3 values (1001, 2);
explain insert into t1 (i, j)  select i, j from t3;
Query Plan
==============================================================
|ID|OPERATOR           |NAME           |EST.ROWS|EST.TIME(us)|
--------------------------------------------------------------
|0 |INSERT             |               |3       |28          |
|1 |└─SUBPLAN SCAN     |ANONYMOUS_VIEW1|3       |3           |
|2 |  └─TABLE FULL SCAN|t3             |3       |3           |
==============================================================
Outputs & filters:
-------------------------------------
  0 - output(nil), filter(nil)
      columns([{t1: ({t1: (t1.i, t1.j)})}]), partitions(p0), 
      column_values([column_conv(INT,PS:(11,0),NOT NULL,ANONYMOUS_VIEW1.i)], [column_conv(INT,PS:(11,0),NULL,ANONYMOUS_VIEW1.j)])
  1 - output([ANONYMOUS_VIEW1.i], [ANONYMOUS_VIEW1.j]), filter(nil), rowset=16
      access([ANONYMOUS_VIEW1.i], [ANONYMOUS_VIEW1.j])
  2 - output([t3.i], [t3.j]), filter(nil), rowset=16
      access([t3.i], [t3.j]), partitions(p0)
      is_index_back=false, is_global_index=false, 
      range_key([t3.i]), range(MIN ; MAX)always true
explain insert into t1 (i, j)  select s1.currval, s1.nextval from t3;
Query Plan
================================================================
|ID|OPERATOR             |NAME           |EST.ROWS|EST.TIME(us)|
----------------------------------------------------------------
|0 |INSERT               |               |3       |28          |
|1 |└─SUBPLAN SCAN       |ANONYMOUS_VIEW1|3       |3           |
|2 |  └─SEQUENCE         |               |3       |3           |
|3 |    └─TABLE FULL SCAN|t3             |3       |3           |
================================================================
Outputs & filters:
-------------------------------------
  0 - output(nil), filter(nil)
      columns([{t1: ({t1: (t1.i, t1.j)})}]), partitions(p0), 
      column_values([column_conv(INT,PS:(11,0),NOT NULL,cast(ANONYMOUS_VIEW1.currval, INT(-1, 0)))], [column_conv(INT,PS:(11,0),NULL,cast(ANONYMOUS_VIEW1.nextval,
       INT(-1, 0)))])
  1 - output([ANONYMOUS_VIEW1.currval], [ANONYMOUS_VIEW1.nextval]), filter(nil), rowset=16
      access([ANONYMOUS_VIEW1.currval], [ANONYMOUS_VIEW1.nextval])
  2 - output([s1.currval], [s1.nextval]), filter(nil)
  3 - output(nil), filter(nil), rowset=16
      access(nil), partitions(p0)
      is_index_back=false, is_global_index=false, 
      range_key([t3.i]), range(MIN ; MAX)always true
explain insert into t1 (i, j)  select s1.currval, s1.currval from t3;
Query Plan
================================================================
|ID|OPERATOR             |NAME           |EST.ROWS|EST.TIME(us)|
----------------------------------------------------------------
|0 |INSERT               |               |3       |28          |
|1 |└─SUBPLAN SCAN       |ANONYMOUS_VIEW1|3       |3           |
|2 |  └─SEQUENCE         |               |3       |3           |
|3 |    └─TABLE FULL SCAN|t3             |3       |3           |
================================================================
Outputs & filters:
-------------------------------------
  0 - output(nil), filter(nil)
      columns([{t1: ({t1: (t1.i, t1.j)})}]), partitions(p0), 
      column_values([column_conv(INT,PS:(11,0),NOT NULL,cast(ANONYMOUS_VIEW1.currval, INT(-1, 0)))], [column_conv(INT,PS:(11,0),NULL,cast(ANONYMOUS_VIEW1.currval,
       INT(-1, 0)))])
  1 - output([ANONYMOUS_VIEW1.currval], [ANONYMOUS_VIEW1.currval]), filter(nil), rowset=16
      access([ANONYMOUS_VIEW1.currval], [ANONYMOUS_VIEW1.currval])
  2 - output([s1.currval], [s1.currval]), filter(nil)
  3 - output(nil), filter(nil), rowset=16
      access(nil), partitions(p0)
      is_index_back=false, is_global_index=false, 
      range_key([t3.i]), range(MIN ; MAX)always true
explain insert into t1 (i, j)  select s1.nextval, s1.currval from t3;
Query Plan
================================================================
|ID|OPERATOR             |NAME           |EST.ROWS|EST.TIME(us)|
----------------------------------------------------------------
|0 |INSERT               |               |3       |28          |
|1 |└─SUBPLAN SCAN       |ANONYMOUS_VIEW1|3       |3           |
|2 |  └─SEQUENCE         |               |3       |3           |
|3 |    └─TABLE FULL SCAN|t3             |3       |3           |
================================================================
Outputs & filters:
-------------------------------------
  0 - output(nil), filter(nil)
      columns([{t1: ({t1: (t1.i, t1.j)})}]), partitions(p0), 
      column_values([column_conv(INT,PS:(11,0),NOT NULL,cast(ANONYMOUS_VIEW1.nextval, INT(-1, 0)))], [column_conv(INT,PS:(11,0),NULL,cast(ANONYMOUS_VIEW1.currval,
       INT(-1, 0)))])
  1 - output([ANONYMOUS_VIEW1.nextval], [ANONYMOUS_VIEW1.currval]), filter(nil), rowset=16
      access([ANONYMOUS_VIEW1.nextval], [ANONYMOUS_VIEW1.currval])
  2 - output([s1.nextval], [s1.currval]), filter(nil)
  3 - output(nil), filter(nil), rowset=16
      access(nil), partitions(p0)
      is_index_back=false, is_global_index=false, 
      range_key([t3.i]), range(MIN ; MAX)always true
explain insert into t2 (i, j)  select s1.currval, s1.currval;
Query Plan
=============================================================
|ID|OPERATOR          |NAME           |EST.ROWS|EST.TIME(us)|
-------------------------------------------------------------
|0 |DISTRIBUTED INSERT|               |1       |13          |
|1 |└─SUBPLAN SCAN    |ANONYMOUS_VIEW1|1       |1           |
|2 |  └─SEQUENCE      |               |1       |1           |
|3 |    └─EXPRESSION  |               |1       |1           |
=============================================================
Outputs & filters:
-------------------------------------
  0 - output(nil), filter(nil)
      columns([{t2: ({t2: (t2.i, t2.j)})}]), partitions(p[0-2]), 
      column_values([column_conv(INT,PS:(11,0),NOT NULL,cast(ANONYMOUS_VIEW1.currval, INT(-1, 0)))], [column_conv(INT,PS:(11,0),NULL,cast(ANONYMOUS_VIEW1.currval,
       INT(-1, 0)))])
  1 - output([ANONYMOUS_VIEW1.currval], [ANONYMOUS_VIEW1.currval]), filter(nil), rowset=16
      access([ANONYMOUS_VIEW1.currval], [ANONYMOUS_VIEW1.currval])
  2 - output([s1.currval], [s1.currval]), filter(nil)
  3 - output([1]), filter(nil)
      values({1})
explain insert into t2 (i, j)  select i, j from t3;
Query Plan
==============================================================
|ID|OPERATOR           |NAME           |EST.ROWS|EST.TIME(us)|
--------------------------------------------------------------
|0 |DISTRIBUTED INSERT |               |3       |28          |
|1 |└─SUBPLAN SCAN     |ANONYMOUS_VIEW1|3       |3           |
|2 |  └─TABLE FULL SCAN|t3             |3       |3           |
==============================================================
Outputs & filters:
-------------------------------------
  0 - output(nil), filter(nil)
      columns([{t2: ({t2: (t2.i, t2.j)})}]), partitions(p[0-2]), 
      column_values([column_conv(INT,PS:(11,0),NOT NULL,ANONYMOUS_VIEW1.i)], [column_conv(INT,PS:(11,0),NULL,ANONYMOUS_VIEW1.j)])
  1 - output([ANONYMOUS_VIEW1.i], [ANONYMOUS_VIEW1.j]), filter(nil), rowset=16
      access([ANONYMOUS_VIEW1.i], [ANONYMOUS_VIEW1.j])
  2 - output([t3.i], [t3.j]), filter(nil), rowset=16
      access([t3.i], [t3.j]), partitions(p0)
      is_index_back=false, is_global_index=false, 
      range_key([t3.i]), range(MIN ; MAX)always true
explain insert into t2 (i, j)  select s1.currval, s1.nextval from t3;
Query Plan
================================================================
|ID|OPERATOR             |NAME           |EST.ROWS|EST.TIME(us)|
----------------------------------------------------------------
|0 |DISTRIBUTED INSERT   |               |3       |28          |
|1 |└─SUBPLAN SCAN       |ANONYMOUS_VIEW1|3       |3           |
|2 |  └─SEQUENCE         |               |3       |3           |
|3 |    └─TABLE FULL SCAN|t3             |3       |3           |
================================================================
Outputs & filters:
-------------------------------------
  0 - output(nil), filter(nil)
      columns([{t2: ({t2: (t2.i, t2.j)})}]), partitions(p[0-2]), 
      column_values([column_conv(INT,PS:(11,0),NOT NULL,cast(ANONYMOUS_VIEW1.currval, INT(-1, 0)))], [column_conv(INT,PS:(11,0),NULL,cast(ANONYMOUS_VIEW1.nextval,
       INT(-1, 0)))])
  1 - output([ANONYMOUS_VIEW1.currval], [ANONYMOUS_VIEW1.nextval]), filter(nil), rowset=16
      access([ANONYMOUS_VIEW1.currval], [ANONYMOUS_VIEW1.nextval])
  2 - output([s1.currval], [s1.nextval]), filter(nil)
  3 - output(nil), filter(nil), rowset=16
      access(nil), partitions(p0)
      is_index_back=false, is_global_index=false, 
      range_key([t3.i]), range(MIN ; MAX)always true
explain insert into t2 (i, j)  select s1.nextval, s1.currval from t3;
Query Plan
================================================================
|ID|OPERATOR             |NAME           |EST.ROWS|EST.TIME(us)|
----------------------------------------------------------------
|0 |DISTRIBUTED INSERT   |               |3       |28          |
|1 |└─SUBPLAN SCAN       |ANONYMOUS_VIEW1|3       |3           |
|2 |  └─SEQUENCE         |               |3       |3           |
|3 |    └─TABLE FULL SCAN|t3             |3       |3           |
================================================================
Outputs & filters:
-------------------------------------
  0 - output(nil), filter(nil)
      columns([{t2: ({t2: (t2.i, t2.j)})}]), partitions(p[0-2]), 
      column_values([column_conv(INT,PS:(11,0),NOT NULL,cast(ANONYMOUS_VIEW1.nextval, INT(-1, 0)))], [column_conv(INT,PS:(11,0),NULL,cast(ANONYMOUS_VIEW1.currval,
       INT(-1, 0)))])
  1 - output([ANONYMOUS_VIEW1.nextval], [ANONYMOUS_VIEW1.currval]), filter(nil), rowset=16
      access([ANONYMOUS_VIEW1.nextval], [ANONYMOUS_VIEW1.currval])
  2 - output([s1.nextval], [s1.currval]), filter(nil)
  3 - output(nil), filter(nil), rowset=16
      access(nil), partitions(p0)
      is_index_back=false, is_global_index=false, 
      range_key([t3.i]), range(MIN ; MAX)always true
select * from t3;
+------+------+
| i    | j    |
+------+------+
|  999 |    0 |
| 1000 |    1 |
| 1001 |    2 |
+------+------+
select * from t1;
+------+------+
| i    | j    |
+------+------+
|    1 |    1 |
|    3 | 1000 |
| 1000 |    2 |
+------+------+
drop sequence s1;
drop table t1;
drop table t2;
create sequence s1;
CREATE TABLE t1 ( i int NOT NULL, j number(11) DEFAULT NULL, PRIMARY KEY (i) ) partition by hash(i) partitions 3;
CREATE TABLE t2 ( i int NOT NULL, j number(11) DEFAULT NULL, PRIMARY KEY (i) ) partition by hash(i) partitions 4;
insert into t1 values (1,1);
insert into t1 values (2,2);
insert into t2 values (3,3);
explain basic select s1.nextval, t1.*, t2.* from t1, t2;
Query Plan
=============================================
|ID|OPERATOR                       |NAME    |
---------------------------------------------
|0 |SEQUENCE                       |        |
|1 |└─NESTED-LOOP JOIN CARTESIAN   |        |
|2 |  ├─PX COORDINATOR             |        |
|3 |  │ └─EXCHANGE OUT DISTR       |:EX10000|
|4 |  │   └─PX PARTITION ITERATOR  |        |
|5 |  │     └─TABLE FULL SCAN      |t1      |
|6 |  └─MATERIAL                   |        |
|7 |    └─PX COORDINATOR           |        |
|8 |      └─EXCHANGE OUT DISTR     |:EX20000|
|9 |        └─PX PARTITION ITERATOR|        |
|10|          └─TABLE FULL SCAN    |t2      |
=============================================
Outputs & filters:
-------------------------------------
  0 - output([s1.nextval], [t1.i], [t1.j], [t2.i], [t2.j]), filter(nil)
  1 - output([t1.i], [t1.j], [t2.i], [t2.j]), filter(nil), rowset=16
      conds(nil), nl_params_(nil), use_batch=false
  2 - output([t1.i], [t1.j]), filter(nil), rowset=16
  3 - output([t1.i], [t1.j]), filter(nil), rowset=16
      dop=1
  4 - output([t1.i], [t1.j]), filter(nil), rowset=16
      force partition granule
  5 - output([t1.i], [t1.j]), filter(nil), rowset=16
      access([t1.i], [t1.j]), partitions(p[0-2])
      is_index_back=false, is_global_index=false, 
      range_key([t1.i]), range(MIN ; MAX)always true
  6 - output([t2.i], [t2.j]), filter(nil), rowset=16
  7 - output([t2.i], [t2.j]), filter(nil), rowset=16
  8 - output([t2.i], [t2.j]), filter(nil), rowset=16
      dop=1
  9 - output([t2.i], [t2.j]), filter(nil), rowset=16
      force partition granule
 10 - output([t2.i], [t2.j]), filter(nil), rowset=16
      access([t2.i], [t2.j]), partitions(p[0-3])
      is_index_back=false, is_global_index=false, 
      range_key([t2.i]), range(MIN ; MAX)always true
select s1.nextval, t1.*, t2.* from t1, t2;
+---------+---+------+---+------+
| nextval | i | j    | i | j    |
+---------+---+------+---+------+
|       1 | 1 |    1 | 3 |    3 |
|       2 | 2 |    2 | 3 |    3 |
+---------+---+------+---+------+
分区表
drop sequence s1;
create sequence s1;
drop table employees;
CREATE TABLE employees (
     id INT NOT NULL ,
     store_id INT NOT NULL
)
PARTITION BY RANGE (store_id) (
     PARTITION p0 VALUES LESS THAN (6),
     PARTITION p1 VALUES LESS THAN (11),
     PARTITION p2 VALUES LESS THAN (16),
     PARTITION p3 VALUES LESS THAN MAXVALUE
);
insert into employees values(s1.currval,s1.nextval);
insert into employees values(s1.currval,s1.nextval);
insert into employees values(s1.currval,s1.nextval);
insert into employees values(s1.currval,s1.nextval);
insert into employees values(s1.currval,s1.nextval);
insert into employees values(s1.currval,s1.nextval);
insert into employees values(s1.currval,s1.nextval);
insert into employees values(s1.currval,s1.nextval);
insert into employees values(s1.currval,s1.nextval);
insert into employees values(s1.currval,s1.nextval);
update employees set store_id=s1.nextval;
drop table t1;
create table t1(id int);
insert into t1 values(1);
drop sequence s1;
create sequence s1;
select s1.nextval from t1;
+---------+
| nextval |
+---------+
|       1 |
+---------+
drop table employees;
CREATE TABLE employees (
     id INT NOT NULL ,
     store_id INT
)
PARTITION BY LIST(store_id)(
     PARTITION pNorth VALUES IN (3,5,6,9,17),
     PARTITION pEast VALUES IN (1,2,10,11,19,20),
     PARTITION pWest VALUES IN (4,12,13,14,18),
     PARTITION pCentral VALUES IN (7,8,15,16)
);
insert into employees values(s1.currval,s1.nextval);
insert into employees values(s1.currval,s1.nextval);
insert into employees values(s1.currval,s1.nextval);
insert into employees values(s1.currval,s1.nextval);
insert into employees values(s1.currval,s1.nextval);
insert into employees values(s1.currval,s1.nextval);
insert into employees values(s1.currval,s1.nextval);
insert into employees values(s1.currval,s1.nextval);
insert into employees values(s1.currval,s1.nextval);
update employees set store_id=s1.nextval;
drop sequence s1;
create sequence s1;
drop table employees;
CREATE TABLE employees (
     id INT NOT NULL ,
     store_id INT
)
partition by key(ID)
Partitions 5;
insert into employees values(s1.currval,s1.nextval);
insert into employees values(s1.currval,s1.nextval);
insert into employees values(s1.nextval,s1.currval);
insert into employees values(s1.currval,s1.nextval);
insert into employees values(s1.currval,s1.nextval);
insert into employees values(s1.nextval,s1.currval);
insert into employees values(s1.currval,s1.nextval);
insert into employees values(s1.currval,s1.nextval);
insert into employees values(s1.currval,s1.nextval);
insert into employees values(s1.currval,s1.nextval);
update employees set store_id=s1.nextval;
update employees set id=s1.nextval;
drop sequence s1;
create sequence s1;
drop table employees;
CREATE TABLE employees (
     id INT NOT NULL ,
     store_id INT
)
PARTITION BY RANGE COLUMNS(store_id) (   
  PARTITION a VALUES LESS THAN (10),    
 PARTITION b VALUES LESS THAN (20),    
 PARTITION c VALUES LESS THAN (30),    
 PARTITION d VALUES LESS THAN (40),   
 PARTITION e VALUES LESS THAN MAXVALUE );
insert into employees values(s1.currval,s1.nextval);
insert into employees values(s1.currval,s1.nextval);
insert into employees values(s1.nextval,s1.currval);
insert into employees values(s1.currval,s1.nextval);
insert into employees values(s1.currval,s1.nextval);
insert into employees values(s1.nextval,s1.currval);
insert into employees values(s1.currval,s1.nextval);
insert into employees values(s1.currval,s1.nextval);
insert into employees values(s1.currval,s1.nextval);
insert into employees values(s1.currval,s1.nextval);
update employees set store_id=s1.nextval;
update employees set id=s1.nextval;
drop sequence s1;
create sequence s1;
drop table employees;
CREATE TABLE employees (
     id INT NOT NULL ,
     store_id INT
)
PARTITION BY RANGE( id )  
SUBPARTITION BY HASH( store_id ) ( 
  PARTITION p0 VALUES LESS THAN (10) 
   ( SUBPARTITION s0, SUBPARTITION s1 ),  
  PARTITION p1 VALUES LESS THAN (20) 
   ( SUBPARTITION s2, SUBPARTITION s3 ), 
  PARTITION p2 VALUES LESS THAN MAXVALUE 
   ( SUBPARTITION s4, SUBPARTITION s5 ) );
insert into employees values(s1.currval,s1.nextval);
insert into employees values(s1.currval,s1.nextval);
insert into employees values(s1.nextval,s1.currval);
insert into employees values(s1.currval,s1.nextval);
insert into employees values(s1.currval,s1.nextval);
insert into employees values(s1.nextval,s1.currval);
insert into employees values(s1.currval,s1.nextval);
insert into employees values(s1.currval,s1.nextval);
insert into employees values(s1.currval,s1.nextval);
insert into employees values(s1.currval,s1.nextval);
update employees set store_id=s1.nextval;
update employees set id=s1.nextval;
drop table tt1;
create table tt1(id int);
insert into tt1 values(1);
obmysql-sequence-5-1-2-4 运算符
drop sequence seq_test4;
create sequence seq_test4;
drop sequence seq_test5;
create sequence seq_test5 INCREMENT BY 1 start with 1 minvalue 1 maxvalue 3 cycle noorder cache 2;
drop sequence seq_test6;
create sequence seq_test6 INCREMENT BY 1 start with 1 minvalue 1 maxvalue 3 nocycle noorder nocache;
select seq_test5.currval+1 from tt1;
ERROR HY000: sequence is not yet defined in this session
select seq_test5.currval-1 from tt1;
ERROR HY000: sequence is not yet defined in this session
select seq_test5.currval*2 from tt1;
ERROR HY000: sequence is not yet defined in this session
select seq_test5.currval/2 from tt1;
ERROR HY000: sequence is not yet defined in this session
select +seq_test5.currval from tt1;
ERROR HY000: sequence is not yet defined in this session
select -seq_test5.currval from tt1;
ERROR HY000: sequence is not yet defined in this session
select seq_test5.currval DIV 12 from tt1;
ERROR HY000: sequence is not yet defined in this session
select -seq_test5.nextval  from tt1;
+--------------------+
| -seq_test5.nextval |
+--------------------+
|                 -1 |
+--------------------+
select +seq_test4.nextval  from tt1;
+---------+
| nextval |
+---------+
|       1 |
+---------+
select seq_test6.nextval  from tt1;
+---------+
| nextval |
+---------+
|       1 |
+---------+
select +seq_test5.currval+1 from tt1;
+----------------------+
| +seq_test5.currval+1 |
+----------------------+
|                    2 |
+----------------------+
select -seq_test5.currval from tt1;
+--------------------+
| -seq_test5.currval |
+--------------------+
|                 -1 |
+--------------------+
select seq_test5.currval+100000000000000000000000000000 from tt1;
+--------------------------------------------------+
| seq_test5.currval+100000000000000000000000000000 |
+--------------------------------------------------+
|                   100000000000000000000000000001 |
+--------------------------------------------------+
select seq_test5.currval+seq_test4.currval+seq_test6.currval from tt1;
+-------------------------------------------------------+
| seq_test5.currval+seq_test4.currval+seq_test6.currval |
+-------------------------------------------------------+
|                                                     3 |
+-------------------------------------------------------+
select seq_test5.currval+seq_test4.currval+seq_test5.nextval+seq_test4.nextval from tt1;
+-------------------------------------------------------------------------+
| seq_test5.currval+seq_test4.currval+seq_test5.nextval+seq_test4.nextval |
+-------------------------------------------------------------------------+
|                                                                       8 |
+-------------------------------------------------------------------------+
select seq_test5.currval+6.2 from tt1;
+-----------------------+
| seq_test5.currval+6.2 |
+-----------------------+
|                   8.2 |
+-----------------------+
select seq_test5.currval+null from tt1;
+------------------------+
| seq_test5.currval+null |
+------------------------+
|                   NULL |
+------------------------+
select seq_test5.currval+'a' from tt1;
+-----------------------+
| seq_test5.currval+'a' |
+-----------------------+
|                     2 |
+-----------------------+
Warnings:
Warning	1292	Truncated incorrect DOUBLE value: 'a'
select seq_test5.currval+abs(-1) from tt1;
+---------------------------+
| seq_test5.currval+abs(-1) |
+---------------------------+
|                         3 |
+---------------------------+
select seq_test5.currval+acos(-1) from tt1;
+----------------------------+
| seq_test5.currval+acos(-1) |
+----------------------------+
|          5.141592653589793 |
+----------------------------+
select seq_test5.currval+asin(1) from tt1;
+---------------------------+
| seq_test5.currval+asin(1) |
+---------------------------+
|        3.5707963267948966 |
+---------------------------+
select seq_test5.currval+ceil(2.3) from tt1;
+-----------------------------+
| seq_test5.currval+ceil(2.3) |
+-----------------------------+
|                           5 |
+-----------------------------+
select seq_test5.currval+exp(2) from tt1;
+--------------------------+
| seq_test5.currval+exp(2) |
+--------------------------+
|         9.38905609893065 |
+--------------------------+
select seq_test5.currval+floor(3.2) from tt1;
+------------------------------+
| seq_test5.currval+floor(3.2) |
+------------------------------+
|                            5 |
+------------------------------+
select seq_test5.currval+ln(3.2) from tt1;
+---------------------------+
| seq_test5.currval+ln(3.2) |
+---------------------------+
|         3.163150809805681 |
+---------------------------+
select seq_test5.currval+log(2,8) from tt1;
+----------------------------+
| seq_test5.currval+log(2,8) |
+----------------------------+
|                          5 |
+----------------------------+
select seq_test5.currval+mod(8,2) from tt1;
+----------------------------+
| seq_test5.currval+mod(8,2) |
+----------------------------+
|                          2 |
+----------------------------+
select seq_test5.currval+power(8,2) from tt1;
+------------------------------+
| seq_test5.currval+power(8,2) |
+------------------------------+
|                           66 |
+------------------------------+
select seq_test5.currval+round(8,2) from tt1;
+------------------------------+
| seq_test5.currval+round(8,2) |
+------------------------------+
|                           10 |
+------------------------------+
select seq_test5.currval+sign(8) from tt1;
+---------------------------+
| seq_test5.currval+sign(8) |
+---------------------------+
|                         3 |
+---------------------------+
select seq_test5.currval div sign(8) from tt1;
+-------------------------------+
| seq_test5.currval div sign(8) |
+-------------------------------+
|                             2 |
+-------------------------------+
select seq_test5.currval+sqrt(8) from tt1;
+---------------------------+
| seq_test5.currval+sqrt(8) |
+---------------------------+
|          4.82842712474619 |
+---------------------------+
select seq_test5.currval+TRUNCATE(5555.66666, 2.1) from tt1;
+---------------------------------------------+
| seq_test5.currval+TRUNCATE(5555.66666, 2.1) |
+---------------------------------------------+
|                                     5557.66 |
+---------------------------------------------+
select seq_test5.currval+ASCII('A') from tt1;
+------------------------------+
| seq_test5.currval+ASCII('A') |
+------------------------------+
|                           67 |
+------------------------------+
select seq_test5.currval+LENGTH('北京市海锭区') from tt1;
+------------------------------------------------+
| seq_test5.currval+LENGTH('北京市海锭区')       |
+------------------------------------------------+
|                                             20 |
+------------------------------------------------+
select seq_test5.currval+current_date from tt1;
+--------------------------------+
| seq_test5.currval+current_date |
+--------------------------------+
|                       20200915 |
+--------------------------------+
select seq_test5.currval+current_timestamp from tt1;
+-------------------------------------+
| seq_test5.currval+current_timestamp |
+-------------------------------------+
|                      20200913202642 |
+-------------------------------------+
select seq_test5.currval+EXTRACT(HOUR FROM TIMESTAMP '2001-2-16 2:38:40 ');
+---------------------------------------------------------------------+
| seq_test5.currval+EXTRACT(HOUR FROM TIMESTAMP '2001-2-16 2:38:40 ') |
+---------------------------------------------------------------------+
|                                                                   4 |
+---------------------------------------------------------------------+
select seq_test5.currval+LAST_DAY('2020-03-28 08:00:00');
+---------------------------------------------------+
| seq_test5.currval+LAST_DAY('2020-03-28 08:00:00') |
+---------------------------------------------------+
|                                          20200333 |
+---------------------------------------------------+
select seq_test5.currval+LOCALTIMESTAMP from tt1;
+----------------------------------+
| seq_test5.currval+LOCALTIMESTAMP |
+----------------------------------+
|                   20200913202642 |
+----------------------------------+
select seq_test5.currval+GREATEST (1, '3.935', '2.4');
+------------------------------------------------+
| seq_test5.currval+GREATEST (1, '3.935', '2.4') |
+------------------------------------------------+
|                             5.9350000000000005 |
+------------------------------------------------+
select seq_test5.currval+LEAST (1, '3.925', '2.4');
+---------------------------------------------+
| seq_test5.currval+LEAST (1, '3.925', '2.4') |
+---------------------------------------------+
|                                           3 |
+---------------------------------------------+
select seq_test5.currval-1 from tt1;
+---------------------+
| seq_test5.currval-1 |
+---------------------+
|                   1 |
+---------------------+
select seq_test5.currval-100000000000000000000000000000 from tt1;
+--------------------------------------------------+
| seq_test5.currval-100000000000000000000000000000 |
+--------------------------------------------------+
|                   -99999999999999999999999999998 |
+--------------------------------------------------+
select seq_test5.currval-seq_test4.currval from tt1;
+-------------------------------------+
| seq_test5.currval-seq_test4.currval |
+-------------------------------------+
|                                   0 |
+-------------------------------------+
select seq_test5.currval-seq_test4.currval-seq_test5.nextval-seq_test4.nextval from tt1;
+-------------------------------------------------------------------------+
| seq_test5.currval-seq_test4.currval-seq_test5.nextval-seq_test4.nextval |
+-------------------------------------------------------------------------+
|                                                                      -6 |
+-------------------------------------------------------------------------+
select seq_test5.currval-6.2 from tt1;
+-----------------------+
| seq_test5.currval-6.2 |
+-----------------------+
|                  -3.2 |
+-----------------------+
select seq_test5.currval-null from tt1;
+------------------------+
| seq_test5.currval-null |
+------------------------+
|                   NULL |
+------------------------+
select seq_test5.currval-'a' from tt1;
+-----------------------+
| seq_test5.currval-'a' |
+-----------------------+
|                     3 |
+-----------------------+
Warnings:
Warning	1292	Truncated incorrect DOUBLE value: 'a'
select seq_test5.currval-abs(-1) from tt1;
+---------------------------+
| seq_test5.currval-abs(-1) |
+---------------------------+
|                         2 |
+---------------------------+
select seq_test5.currval-acos(-1) from tt1;
+----------------------------+
| seq_test5.currval-acos(-1) |
+----------------------------+
|       -0.14159265358979312 |
+----------------------------+
select seq_test5.currval-ceil(2.3) from tt1;
+-----------------------------+
| seq_test5.currval-ceil(2.3) |
+-----------------------------+
|                           0 |
+-----------------------------+
select seq_test5.currval-exp(2) from tt1;
+--------------------------+
| seq_test5.currval-exp(2) |
+--------------------------+
|        -4.38905609893065 |
+--------------------------+
select seq_test5.currval-floor(3.2) from tt1;
+------------------------------+
| seq_test5.currval-floor(3.2) |
+------------------------------+
|                            0 |
+------------------------------+
select seq_test5.currval-ln(3.2) from tt1;
+---------------------------+
| seq_test5.currval-ln(3.2) |
+---------------------------+
|        1.8368491901943191 |
+---------------------------+
select seq_test5.currval-log(2,8) from tt1;
+----------------------------+
| seq_test5.currval-log(2,8) |
+----------------------------+
|                          0 |
+----------------------------+
select seq_test5.currval-mod(8,2) from tt1;
+----------------------------+
| seq_test5.currval-mod(8,2) |
+----------------------------+
|                          3 |
+----------------------------+
select seq_test5.currval mod mod(8,2) from tt1;
+--------------------------------+
| seq_test5.currval mod mod(8,2) |
+--------------------------------+
|                           NULL |
+--------------------------------+
select seq_test5.currval-power(8,2) from tt1;
+------------------------------+
| seq_test5.currval-power(8,2) |
+------------------------------+
|                          -61 |
+------------------------------+
select seq_test5.currval-round(8,2) from tt1;
+------------------------------+
| seq_test5.currval-round(8,2) |
+------------------------------+
|                           -5 |
+------------------------------+
select seq_test5.currval-sign(8) from tt1;
+---------------------------+
| seq_test5.currval-sign(8) |
+---------------------------+
|                         2 |
+---------------------------+
select seq_test5.currval-sqrt(8) from tt1;
+---------------------------+
| seq_test5.currval-sqrt(8) |
+---------------------------+
|        0.1715728752538097 |
+---------------------------+
select seq_test5.currval-ASCII('A') from tt1;
+------------------------------+
| seq_test5.currval-ASCII('A') |
+------------------------------+
|                          -62 |
+------------------------------+
select seq_test5.currval-LENGTH('北京市海锭区') from tt1;
+------------------------------------------------+
| seq_test5.currval-LENGTH('北京市海锭区')       |
+------------------------------------------------+
|                                            -15 |
+------------------------------------------------+
select current_date-seq_test5.currval from tt1;
+--------------------------------+
| current_date-seq_test5.currval |
+--------------------------------+
|                       20200910 |
+--------------------------------+
select current_timestamp-seq_test5.currval from tt1;
+-------------------------------------+
| current_timestamp-seq_test5.currval |
+-------------------------------------+
|                      20200913202637 |
+-------------------------------------+
select EXTRACT(HOUR FROM TIMESTAMP '2001-2-16 2:38:40 ')-seq_test5.currval from tt1;
+---------------------------------------------------------------------+
| EXTRACT(HOUR FROM TIMESTAMP '2001-2-16 2:38:40 ')-seq_test5.currval |
+---------------------------------------------------------------------+
|                                                                  -1 |
+---------------------------------------------------------------------+
select LOCALTIMESTAMP-seq_test5.currval from tt1;
+----------------------------------+
| LOCALTIMESTAMP-seq_test5.currval |
+----------------------------------+
|                   20200913202637 |
+----------------------------------+
select GREATEST (1, '3.935', '2.4')-seq_test5.currval from tt1;
+------------------------------------------------+
| GREATEST (1, '3.935', '2.4')-seq_test5.currval |
+------------------------------------------------+
|                                          0.935 |
+------------------------------------------------+
select LEAST (1, '3.925', '2.4')-seq_test5.currval from tt1;
+---------------------------------------------+
| LEAST (1, '3.925', '2.4')-seq_test5.currval |
+---------------------------------------------+
|                                          -2 |
+---------------------------------------------+
select seq_test5.currval*1 from tt1;
+---------------------+
| seq_test5.currval*1 |
+---------------------+
|                   3 |
+---------------------+
select seq_test5.currval*100000000000000000000000000000 from tt1;
+--------------------------------------------------+
| seq_test5.currval*100000000000000000000000000000 |
+--------------------------------------------------+
|                   300000000000000000000000000000 |
+--------------------------------------------------+
select seq_test5.currval*seq_test4.currval from tt1;
+-------------------------------------+
| seq_test5.currval*seq_test4.currval |
+-------------------------------------+
|                                   9 |
+-------------------------------------+
select seq_test5.currval*seq_test4.currval*seq_test5.nextval*seq_test4.nextval from tt1;
+-------------------------------------------------------------------------+
| seq_test5.currval*seq_test4.currval*seq_test5.nextval*seq_test4.nextval |
+-------------------------------------------------------------------------+
|                                                                      16 |
+-------------------------------------------------------------------------+
select seq_test5.currval*6.2 from tt1;
+-----------------------+
| seq_test5.currval*6.2 |
+-----------------------+
|                   6.2 |
+-----------------------+
select seq_test5.currval*null from tt1;
+------------------------+
| seq_test5.currval*null |
+------------------------+
|                   NULL |
+------------------------+
select seq_test5.currval*'a' from tt1;
+-----------------------+
| seq_test5.currval*'a' |
+-----------------------+
|                     0 |
+-----------------------+
Warnings:
Warning	1292	Truncated incorrect DOUBLE value: 'a'
select seq_test5.currval*abs(-1) from tt1;
+---------------------------+
| seq_test5.currval*abs(-1) |
+---------------------------+
|                         1 |
+---------------------------+
select seq_test5.currval*acos(-1) from tt1;
+----------------------------+
| seq_test5.currval*acos(-1) |
+----------------------------+
|          3.141592653589793 |
+----------------------------+
select seq_test5.currval*ceil(2.3) from tt1;
+-----------------------------+
| seq_test5.currval*ceil(2.3) |
+-----------------------------+
|                           3 |
+-----------------------------+
select seq_test5.currval*exp(2) from tt1;
+--------------------------+
| seq_test5.currval*exp(2) |
+--------------------------+
|         7.38905609893065 |
+--------------------------+
select seq_test5.currval*floor(3.2) from tt1;
+------------------------------+
| seq_test5.currval*floor(3.2) |
+------------------------------+
|                            3 |
+------------------------------+
select seq_test5.currval*ln(3.2) from tt1;
+---------------------------+
| seq_test5.currval*ln(3.2) |
+---------------------------+
|        1.1631508098056809 |
+---------------------------+
select seq_test5.currval*log(2,8) from tt1;
+----------------------------+
| seq_test5.currval*log(2,8) |
+----------------------------+
|                          3 |
+----------------------------+
select seq_test5.currval*mod(8,2) from tt1;
+----------------------------+
| seq_test5.currval*mod(8,2) |
+----------------------------+
|                          0 |
+----------------------------+
select seq_test5.currval*power(8,2) from tt1;
+------------------------------+
| seq_test5.currval*power(8,2) |
+------------------------------+
|                           64 |
+------------------------------+
select seq_test5.currval*round(8,2) from tt1;
+------------------------------+
| seq_test5.currval*round(8,2) |
+------------------------------+
|                            8 |
+------------------------------+
select seq_test5.currval*sign(8) from tt1;
+---------------------------+
| seq_test5.currval*sign(8) |
+---------------------------+
|                         1 |
+---------------------------+
select seq_test5.currval*sqrt(8) from tt1;
+---------------------------+
| seq_test5.currval*sqrt(8) |
+---------------------------+
|        2.8284271247461903 |
+---------------------------+
select seq_test5.currval*ASCII('A') from tt1;
+------------------------------+
| seq_test5.currval*ASCII('A') |
+------------------------------+
|                           65 |
+------------------------------+
select seq_test5.currval*LENGTH('北京市海锭区') from tt1;
+------------------------------------------------+
| seq_test5.currval*LENGTH('北京市海锭区')       |
+------------------------------------------------+
|                                             18 |
+------------------------------------------------+
select current_date*seq_test5.currval from tt1;
+--------------------------------+
| current_date*seq_test5.currval |
+--------------------------------+
|                       20200913 |
+--------------------------------+
select current_timestamp*seq_test5.currval from tt1;
+-------------------------------------+
| current_timestamp*seq_test5.currval |
+-------------------------------------+
|                      20200913202640 |
+-------------------------------------+
select GREATEST (1, '3.935', '2.4')*seq_test5.currval from tt1;
+------------------------------------------------+
| GREATEST (1, '3.935', '2.4')*seq_test5.currval |
+------------------------------------------------+
|                                          3.935 |
+------------------------------------------------+
select LEAST (1, '3.925', '2.4')*seq_test5.currval from tt1;
+---------------------------------------------+
| LEAST (1, '3.925', '2.4')*seq_test5.currval |
+---------------------------------------------+
|                                           1 |
+---------------------------------------------+
select seq_test5.currval/nvl(1,2);
+----------------------------+
| seq_test5.currval/nvl(1,2) |
+----------------------------+
|                     1.0000 |
+----------------------------+
select seq_test5.currval div nvl(1,2);
+--------------------------------+
| seq_test5.currval div nvl(1,2) |
+--------------------------------+
|                              1 |
+--------------------------------+
select seq_test5.currval/1 from tt1;
+---------------------+
| seq_test5.currval/1 |
+---------------------+
|              1.0000 |
+---------------------+
select seq_test5.currval/100000000000000000000000000000 from tt1;
+--------------------------------------------------+
| seq_test5.currval/100000000000000000000000000000 |
+--------------------------------------------------+
|                                           0.0000 |
+--------------------------------------------------+
select seq_test5.currval/seq_test4.currval from tt1;
+-------------------------------------+
| seq_test5.currval/seq_test4.currval |
+-------------------------------------+
|                              0.2500 |
+-------------------------------------+
select seq_test5.currval/seq_test4.currval/seq_test5.nextval/seq_test4.nextval from tt1;
+-------------------------------------------------------------------------+
| seq_test5.currval/seq_test4.currval/seq_test5.nextval/seq_test4.nextval |
+-------------------------------------------------------------------------+
|                                                          0.040000000000 |
+-------------------------------------------------------------------------+
select seq_test5.currval/6.2 from tt1;
+-----------------------+
| seq_test5.currval/6.2 |
+-----------------------+
|                0.3226 |
+-----------------------+
select seq_test5.currval mod 6.2 from tt1;
+---------------------------+
| seq_test5.currval mod 6.2 |
+---------------------------+
|                       2.0 |
+---------------------------+
select seq_test5.currval/null from tt1;
+------------------------+
| seq_test5.currval/null |
+------------------------+
|                   NULL |
+------------------------+
select seq_test5.currval/'a' from tt1;
+-----------------------+
| seq_test5.currval/'a' |
+-----------------------+
|                  NULL |
+-----------------------+
Warnings:
Warning	1292	Truncated incorrect DOUBLE value: 'a'
select seq_test5.currval/abs(-1) from tt1;
+---------------------------+
| seq_test5.currval/abs(-1) |
+---------------------------+
|                    2.0000 |
+---------------------------+
select seq_test5.currval/acos(-1) from tt1;
+----------------------------+
| seq_test5.currval/acos(-1) |
+----------------------------+
|         0.6366197723675814 |
+----------------------------+
select seq_test5.currval/ceil(2.3) from tt1;
+-----------------------------+
| seq_test5.currval/ceil(2.3) |
+-----------------------------+
|                      0.6667 |
+-----------------------------+
select seq_test5.currval/exp(2) from tt1;
+--------------------------+
| seq_test5.currval/exp(2) |
+--------------------------+
|       0.2706705664732254 |
+--------------------------+
select seq_test5.currval/floor(3.2) from tt1;
+------------------------------+
| seq_test5.currval/floor(3.2) |
+------------------------------+
|                       0.6667 |
+------------------------------+
select seq_test5.currval/ln(3.2) from tt1;
+---------------------------+
| seq_test5.currval/ln(3.2) |
+---------------------------+
|         1.719467487052797 |
+---------------------------+
select seq_test5.currval/log(2,8) from tt1;
+----------------------------+
| seq_test5.currval/log(2,8) |
+----------------------------+
|         0.6666666666666666 |
+----------------------------+
select seq_test5.currval/mod(8,2) from tt1;
+----------------------------+
| seq_test5.currval/mod(8,2) |
+----------------------------+
|                       NULL |
+----------------------------+
select seq_test5.currval/power(8,2) from tt1;
+------------------------------+
| seq_test5.currval/power(8,2) |
+------------------------------+
|                      0.03125 |
+------------------------------+
select seq_test5.currval/round(8,2) from tt1;
+------------------------------+
| seq_test5.currval/round(8,2) |
+------------------------------+
|                       0.2500 |
+------------------------------+
select seq_test5.currval/sign(8) from tt1;
+---------------------------+
| seq_test5.currval/sign(8) |
+---------------------------+
|                    2.0000 |
+---------------------------+
select seq_test5.currval/sqrt(8) from tt1;
+---------------------------+
| seq_test5.currval/sqrt(8) |
+---------------------------+
|        0.7071067811865475 |
+---------------------------+
select seq_test5.currval/ASCII('A') from tt1;
+------------------------------+
| seq_test5.currval/ASCII('A') |
+------------------------------+
|                       0.0308 |
+------------------------------+
select seq_test5.currval/LENGTH('北京市海锭区') from tt1;
+------------------------------------------------+
| seq_test5.currval/LENGTH('北京市海锭区')       |
+------------------------------------------------+
|                                         0.1111 |
+------------------------------------------------+
select current_date/seq_test5.currval from tt1;
+--------------------------------+
| current_date/seq_test5.currval |
+--------------------------------+
|                  10100456.5000 |
+--------------------------------+
select current_timestamp/seq_test5.currval from tt1;
+-------------------------------------+
| current_timestamp/seq_test5.currval |
+-------------------------------------+
|                 10100456601320.0000 |
+-------------------------------------+
select EXTRACT(HOUR FROM TIMESTAMP '2001-2-16 2:38:40 ')/seq_test5.currval from tt1;
+---------------------------------------------------------------------+
| EXTRACT(HOUR FROM TIMESTAMP '2001-2-16 2:38:40 ')/seq_test5.currval |
+---------------------------------------------------------------------+
|                                                              1.0000 |
+---------------------------------------------------------------------+
select LAST_DAY('2020-03-28 08:00:00')/seq_test5.currval from tt1;
+---------------------------------------------------+
| LAST_DAY('2020-03-28 08:00:00')/seq_test5.currval |
+---------------------------------------------------+
|                                     10100165.5000 |
+---------------------------------------------------+
select LOCALTIMESTAMP/seq_test5.currval from tt1;
+----------------------------------+
| LOCALTIMESTAMP/seq_test5.currval |
+----------------------------------+
|              10100456601320.0000 |
+----------------------------------+
select GREATEST (1, '3.935', '2.4')/seq_test5.currval from tt1;
+------------------------------------------------+
| GREATEST (1, '3.935', '2.4')/seq_test5.currval |
+------------------------------------------------+
|                                         1.9675 |
+------------------------------------------------+
select LEAST (1, '3.925', '2.4')/seq_test5.currval from tt1;
+---------------------------------------------+
| LEAST (1, '3.925', '2.4')/seq_test5.currval |
+---------------------------------------------+
|                                         0.5 |
+---------------------------------------------+
select +seq_test5.nextval+1 from tt1;
+----------------------+
| +seq_test5.nextval+1 |
+----------------------+
|                    4 |
+----------------------+
select seq_test5.nextval+100000000000000000000000000000 from tt1;
+--------------------------------------------------+
| seq_test5.nextval+100000000000000000000000000000 |
+--------------------------------------------------+
|                   100000000000000000000000000001 |
+--------------------------------------------------+
select seq_test5.nextval+seq_test4.nextval+seq_test6.nextval from tt1;
+-------------------------------------------------------+
| seq_test5.nextval+seq_test4.nextval+seq_test6.nextval |
+-------------------------------------------------------+
|                                                    10 |
+-------------------------------------------------------+
select seq_test5.nextval+seq_test4.nextval+seq_test5.nextval+seq_test4.nextval from tt1;
+-------------------------------------------------------------------------+
| seq_test5.nextval+seq_test4.nextval+seq_test5.nextval+seq_test4.nextval |
+-------------------------------------------------------------------------+
|                                                                      20 |
+-------------------------------------------------------------------------+
select seq_test5.nextval+6.2 from tt1;
+-----------------------+
| seq_test5.nextval+6.2 |
+-----------------------+
|                   7.2 |
+-----------------------+
select seq_test5.nextval+null from tt1;
+------------------------+
| seq_test5.nextval+null |
+------------------------+
|                   NULL |
+------------------------+
select seq_test5.nextval+'a' from tt1;
+-----------------------+
| seq_test5.nextval+'a' |
+-----------------------+
|                     3 |
+-----------------------+
Warnings:
Warning	1292	Truncated incorrect DOUBLE value: 'a'
select seq_test5.nextval+abs(-1) from tt1;
+---------------------------+
| seq_test5.nextval+abs(-1) |
+---------------------------+
|                         2 |
+---------------------------+
select seq_test5.nextval+acos(-1) from tt1;
+----------------------------+
| seq_test5.nextval+acos(-1) |
+----------------------------+
|          5.141592653589793 |
+----------------------------+
select seq_test5.nextval+ceil(2.3) from tt1;
+-----------------------------+
| seq_test5.nextval+ceil(2.3) |
+-----------------------------+
|                           6 |
+-----------------------------+
select seq_test5.nextval+exp(2) from tt1;
+--------------------------+
| seq_test5.nextval+exp(2) |
+--------------------------+
|         8.38905609893065 |
+--------------------------+
select seq_test5.nextval+floor(3.2) from tt1;
+------------------------------+
| seq_test5.nextval+floor(3.2) |
+------------------------------+
|                            5 |
+------------------------------+
select seq_test5.nextval+ln(3.2) from tt1;
+---------------------------+
| seq_test5.nextval+ln(3.2) |
+---------------------------+
|         4.163150809805681 |
+---------------------------+
select seq_test5.nextval+log(2,8) from tt1;
+----------------------------+
| seq_test5.nextval+log(2,8) |
+----------------------------+
|                          4 |
+----------------------------+
select seq_test5.nextval+mod(8,2) from tt1;
+----------------------------+
| seq_test5.nextval+mod(8,2) |
+----------------------------+
|                          2 |
+----------------------------+
select seq_test5.nextval+power(8,2) from tt1;
+------------------------------+
| seq_test5.nextval+power(8,2) |
+------------------------------+
|                           67 |
+------------------------------+
select seq_test5.nextval+round(8,2) from tt1;
+------------------------------+
| seq_test5.nextval+round(8,2) |
+------------------------------+
|                            9 |
+------------------------------+
select seq_test5.nextval+sign(8) from tt1;
+---------------------------+
| seq_test5.nextval+sign(8) |
+---------------------------+
|                         3 |
+---------------------------+
select seq_test5.nextval+sqrt(8) from tt1;
+---------------------------+
| seq_test5.nextval+sqrt(8) |
+---------------------------+
|          5.82842712474619 |
+---------------------------+
select seq_test5.nextval+ASCII('A') from tt1;
+------------------------------+
| seq_test5.nextval+ASCII('A') |
+------------------------------+
|                           66 |
+------------------------------+
select seq_test5.nextval+LENGTH('北京市海锭区') from tt1;
+------------------------------------------------+
| seq_test5.nextval+LENGTH('北京市海锭区')       |
+------------------------------------------------+
|                                             20 |
+------------------------------------------------+
select seq_test5.nextval+current_date from tt1;
+--------------------------------+
| seq_test5.nextval+current_date |
+--------------------------------+
|                       20200916 |
+--------------------------------+
select seq_test5.nextval+current_timestamp from tt1;
+-------------------------------------+
| seq_test5.nextval+current_timestamp |
+-------------------------------------+
|                      20200913202641 |
+-------------------------------------+
select seq_test5.nextval+EXTRACT(HOUR FROM TIMESTAMP '2001-2-16 2:38:40 ') from tt1;
+---------------------------------------------------------------------+
| seq_test5.nextval+EXTRACT(HOUR FROM TIMESTAMP '2001-2-16 2:38:40 ') |
+---------------------------------------------------------------------+
|                                                                   4 |
+---------------------------------------------------------------------+
select seq_test5.nextval+LAST_DAY('2020-03-28 08:00:00') from tt1;
+---------------------------------------------------+
| seq_test5.nextval+LAST_DAY('2020-03-28 08:00:00') |
+---------------------------------------------------+
|                                          20200334 |
+---------------------------------------------------+
select seq_test5.nextval+LOCALTIMESTAMP from tt1;
+----------------------------------+
| seq_test5.nextval+LOCALTIMESTAMP |
+----------------------------------+
|                   20200913202641 |
+----------------------------------+
select seq_test5.nextval+GREATEST (1, '3.935', '2.4');
+------------------------------------------------+
| seq_test5.nextval+GREATEST (1, '3.935', '2.4') |
+------------------------------------------------+
|                             5.9350000000000005 |
+------------------------------------------------+
select seq_test5.nextval+LEAST (1, '3.925', '2.4');
+---------------------------------------------+
| seq_test5.nextval+LEAST (1, '3.925', '2.4') |
+---------------------------------------------+
|                                           4 |
+---------------------------------------------+
select seq_test5.nextval-1 from tt1;
+---------------------+
| seq_test5.nextval-1 |
+---------------------+
|                   0 |
+---------------------+
select seq_test5.nextval-100000000000000000000000000000 from tt1;
+--------------------------------------------------+
| seq_test5.nextval-100000000000000000000000000000 |
+--------------------------------------------------+
|                   -99999999999999999999999999998 |
+--------------------------------------------------+
select seq_test5.nextval-seq_test4.nextval from tt1;
+-------------------------------------+
| seq_test5.nextval-seq_test4.nextval |
+-------------------------------------+
|                                  -5 |
+-------------------------------------+
select seq_test5.nextval-seq_test4.nextval-seq_test5.nextval-seq_test4.nextval from tt1;
+-------------------------------------------------------------------------+
| seq_test5.nextval-seq_test4.nextval-seq_test5.nextval-seq_test4.nextval |
+-------------------------------------------------------------------------+
|                                                                     -18 |
+-------------------------------------------------------------------------+
select seq_test5.nextval-6.2 from tt1;
+-----------------------+
| seq_test5.nextval-6.2 |
+-----------------------+
|                  -4.2 |
+-----------------------+
select seq_test5.nextval-null from tt1;
+------------------------+
| seq_test5.nextval-null |
+------------------------+
|                   NULL |
+------------------------+
select seq_test5.nextval-'a' from tt1;
+-----------------------+
| seq_test5.nextval-'a' |
+-----------------------+
|                     1 |
+-----------------------+
Warnings:
Warning	1292	Truncated incorrect DOUBLE value: 'a'
select seq_test5.nextval-abs(-1) from tt1;
+---------------------------+
| seq_test5.nextval-abs(-1) |
+---------------------------+
|                         1 |
+---------------------------+
select seq_test5.nextval-acos(-1) from tt1;
+----------------------------+
| seq_test5.nextval-acos(-1) |
+----------------------------+
|       -0.14159265358979312 |
+----------------------------+
select seq_test5.nextval-ceil(2.3) from tt1;
+-----------------------------+
| seq_test5.nextval-ceil(2.3) |
+-----------------------------+
|                          -2 |
+-----------------------------+
select seq_test5.nextval-exp(2) from tt1;
+--------------------------+
| seq_test5.nextval-exp(2) |
+--------------------------+
|        -5.38905609893065 |
+--------------------------+
select seq_test5.nextval-floor(3.2) from tt1;
+------------------------------+
| seq_test5.nextval-floor(3.2) |
+------------------------------+
|                            0 |
+------------------------------+
select seq_test5.nextval-ln(3.2) from tt1;
+---------------------------+
| seq_test5.nextval-ln(3.2) |
+---------------------------+
|      -0.16315080980568086 |
+---------------------------+
select seq_test5.nextval-log(2,8) from tt1;
+----------------------------+
| seq_test5.nextval-log(2,8) |
+----------------------------+
|                         -1 |
+----------------------------+
select seq_test5.nextval-mod(8,2) from tt1;
+----------------------------+
| seq_test5.nextval-mod(8,2) |
+----------------------------+
|                          3 |
+----------------------------+
select seq_test5.nextval-power(8,2) from tt1;
+------------------------------+
| seq_test5.nextval-power(8,2) |
+------------------------------+
|                          -63 |
+------------------------------+
select seq_test5.nextval-round(8,2) from tt1;
+------------------------------+
| seq_test5.nextval-round(8,2) |
+------------------------------+
|                           -6 |
+------------------------------+
select seq_test5.nextval-sign(8) from tt1;
+---------------------------+
| seq_test5.nextval-sign(8) |
+---------------------------+
|                         2 |
+---------------------------+
select seq_test5.nextval-sqrt(8) from tt1;
+---------------------------+
| seq_test5.nextval-sqrt(8) |
+---------------------------+
|       -1.8284271247461903 |
+---------------------------+
select seq_test5.nextval-ASCII('A') from tt1;
+------------------------------+
| seq_test5.nextval-ASCII('A') |
+------------------------------+
|                          -63 |
+------------------------------+
select seq_test5.nextval-LENGTH('北京市海锭区') from tt1;
+------------------------------------------------+
| seq_test5.nextval-LENGTH('北京市海锭区')       |
+------------------------------------------------+
|                                            -15 |
+------------------------------------------------+
select current_date-seq_test5.nextval from tt1;
+--------------------------------+
| current_date-seq_test5.nextval |
+--------------------------------+
|                       20200912 |
+--------------------------------+
select current_timestamp-seq_test5.nextval from tt1;
+-------------------------------------+
| current_timestamp-seq_test5.nextval |
+-------------------------------------+
|                      20200913202638 |
+-------------------------------------+
select EXTRACT(HOUR FROM TIMESTAMP '2001-2-16 2:38:40 ')-seq_test5.nextval from tt1;
+---------------------------------------------------------------------+
| EXTRACT(HOUR FROM TIMESTAMP '2001-2-16 2:38:40 ')-seq_test5.nextval |
+---------------------------------------------------------------------+
|                                                                  -1 |
+---------------------------------------------------------------------+
select LAST_DAY('2020-03-28 08:00:00')-seq_test5.nextval from tt1;
+---------------------------------------------------+
| LAST_DAY('2020-03-28 08:00:00')-seq_test5.nextval |
+---------------------------------------------------+
|                                          20200330 |
+---------------------------------------------------+
select LOCALTIMESTAMP-seq_test5.nextval from tt1;
+----------------------------------+
| LOCALTIMESTAMP-seq_test5.nextval |
+----------------------------------+
|                   20200913202638 |
+----------------------------------+
select GREATEST (1, '3.935', '2.4')-seq_test5.nextval from tt1;
+------------------------------------------------+
| GREATEST (1, '3.935', '2.4')-seq_test5.nextval |
+------------------------------------------------+
|                                          0.935 |
+------------------------------------------------+
select LEAST (1, '3.925', '2.4')-seq_test5.nextval from tt1;
+---------------------------------------------+
| LEAST (1, '3.925', '2.4')-seq_test5.nextval |
+---------------------------------------------+
|                                           0 |
+---------------------------------------------+
select seq_test5.nextval*1 from tt1;
+---------------------+
| seq_test5.nextval*1 |
+---------------------+
|                   2 |
+---------------------+
select seq_test5.nextval*100000000000000000000000000000 from tt1;
+--------------------------------------------------+
| seq_test5.nextval*100000000000000000000000000000 |
+--------------------------------------------------+
|                   300000000000000000000000000000 |
+--------------------------------------------------+
select seq_test5.nextval*seq_test4.nextval from tt1;
+-------------------------------------+
| seq_test5.nextval*seq_test4.nextval |
+-------------------------------------+
|                                  10 |
+-------------------------------------+
select seq_test5.nextval*seq_test4.nextval*seq_test5.nextval*seq_test4.nextval from tt1;
+-------------------------------------------------------------------------+
| seq_test5.nextval*seq_test4.nextval*seq_test5.nextval*seq_test4.nextval |
+-------------------------------------------------------------------------+
|                                                                     484 |
+-------------------------------------------------------------------------+
select seq_test5.nextval*6.2 from tt1;
+-----------------------+
| seq_test5.nextval*6.2 |
+-----------------------+
|                  18.6 |
+-----------------------+
select seq_test5.nextval*null from tt1;
+------------------------+
| seq_test5.nextval*null |
+------------------------+
|                   NULL |
+------------------------+
select seq_test5.nextval*'a' from tt1;
+-----------------------+
| seq_test5.nextval*'a' |
+-----------------------+
|                     0 |
+-----------------------+
Warnings:
Warning	1292	Truncated incorrect DOUBLE value: 'a'
select seq_test5.nextval*abs(-1) from tt1;
+---------------------------+
| seq_test5.nextval*abs(-1) |
+---------------------------+
|                         3 |
+---------------------------+
select seq_test5.nextval*acos(-1) from tt1;
+----------------------------+
| seq_test5.nextval*acos(-1) |
+----------------------------+
|          3.141592653589793 |
+----------------------------+
select seq_test5.nextval*ceil(2.3) from tt1;
+-----------------------------+
| seq_test5.nextval*ceil(2.3) |
+-----------------------------+
|                           6 |
+-----------------------------+
select seq_test5.nextval*exp(2) from tt1;
+--------------------------+
| seq_test5.nextval*exp(2) |
+--------------------------+
|        22.16716829679195 |
+--------------------------+
select seq_test5.nextval*floor(3.2) from tt1;
+------------------------------+
| seq_test5.nextval*floor(3.2) |
+------------------------------+
|                            3 |
+------------------------------+
select seq_test5.nextval*ln(3.2) from tt1;
+---------------------------+
| seq_test5.nextval*ln(3.2) |
+---------------------------+
|        2.3263016196113617 |
+---------------------------+
select seq_test5.nextval*log(2,8) from tt1;
+----------------------------+
| seq_test5.nextval*log(2,8) |
+----------------------------+
|                          9 |
+----------------------------+
select seq_test5.nextval*mod(8,2) from tt1;
+----------------------------+
| seq_test5.nextval*mod(8,2) |
+----------------------------+
|                          0 |
+----------------------------+
select seq_test5.nextval*power(8,2) from tt1;
+------------------------------+
| seq_test5.nextval*power(8,2) |
+------------------------------+
|                          128 |
+------------------------------+
select seq_test5.nextval*round(8,2) from tt1;
+------------------------------+
| seq_test5.nextval*round(8,2) |
+------------------------------+
|                           24 |
+------------------------------+
select seq_test5.nextval*sign(8) from tt1;
+---------------------------+
| seq_test5.nextval*sign(8) |
+---------------------------+
|                         1 |
+---------------------------+
select seq_test5.nextval*sqrt(8) from tt1;
+---------------------------+
| seq_test5.nextval*sqrt(8) |
+---------------------------+
|         5.656854249492381 |
+---------------------------+
select seq_test5.nextval*ASCII('A') from tt1;
+------------------------------+
| seq_test5.nextval*ASCII('A') |
+------------------------------+
|                          195 |
+------------------------------+
select seq_test5.nextval*LENGTH('北京市海锭区') from tt1;
+------------------------------------------------+
| seq_test5.nextval*LENGTH('北京市海锭区')       |
+------------------------------------------------+
|                                             18 |
+------------------------------------------------+
select current_date*seq_test5.nextval from tt1;
+--------------------------------+
| current_date*seq_test5.nextval |
+--------------------------------+
|                       40401826 |
+--------------------------------+
select current_timestamp*seq_test5.nextval from tt1;
+-------------------------------------+
| current_timestamp*seq_test5.nextval |
+-------------------------------------+
|                      60602739607920 |
+-------------------------------------+
select EXTRACT(HOUR FROM TIMESTAMP '2001-2-16 2:38:40 ')*seq_test5.nextval from tt1;
+---------------------------------------------------------------------+
| EXTRACT(HOUR FROM TIMESTAMP '2001-2-16 2:38:40 ')*seq_test5.nextval |
+---------------------------------------------------------------------+
|                                                                   2 |
+---------------------------------------------------------------------+
select LAST_DAY('2020-03-28 08:00:00')*seq_test5.nextval from tt1;
+---------------------------------------------------+
| LAST_DAY('2020-03-28 08:00:00')*seq_test5.nextval |
+---------------------------------------------------+
|                                          40400662 |
+---------------------------------------------------+
select LOCALTIMESTAMP*seq_test5.nextval from tt1;
+----------------------------------+
| LOCALTIMESTAMP*seq_test5.nextval |
+----------------------------------+
|                   60602739607920 |
+----------------------------------+
select GREATEST (1, '3.935', '2.4')*seq_test5.nextval from tt1;
+------------------------------------------------+
| GREATEST (1, '3.935', '2.4')*seq_test5.nextval |
+------------------------------------------------+
|                                          3.935 |
+------------------------------------------------+
select LEAST (1, '3.925', '2.4')*seq_test5.nextval from tt1;
+---------------------------------------------+
| LEAST (1, '3.925', '2.4')*seq_test5.nextval |
+---------------------------------------------+
|                                           2 |
+---------------------------------------------+
select seq_test5.nextval/1 from tt1;
+---------------------+
| seq_test5.nextval/1 |
+---------------------+
|              3.0000 |
+---------------------+
select seq_test5.nextval/100000000000000000000000000000 from tt1;
+--------------------------------------------------+
| seq_test5.nextval/100000000000000000000000000000 |
+--------------------------------------------------+
|                                           0.0000 |
+--------------------------------------------------+
select seq_test5.nextval/seq_test4.nextval from tt1;
+-------------------------------------+
| seq_test5.nextval/seq_test4.nextval |
+-------------------------------------+
|                              0.1667 |
+-------------------------------------+
select seq_test5.nextval/seq_test4.nextval/seq_test5.nextval/seq_test4.nextval from tt1;
+-------------------------------------------------------------------------+
| seq_test5.nextval/seq_test4.nextval/seq_test5.nextval/seq_test4.nextval |
+-------------------------------------------------------------------------+
|                                                          0.005917159692 |
+-------------------------------------------------------------------------+
select seq_test5.nextval/6.2 from tt1;
+-----------------------+
| seq_test5.nextval/6.2 |
+-----------------------+
|                0.1613 |
+-----------------------+
select seq_test5.nextval/null from tt1;
+------------------------+
| seq_test5.nextval/null |
+------------------------+
|                   NULL |
+------------------------+
select seq_test5.nextval/'a' from tt1;
+-----------------------+
| seq_test5.nextval/'a' |
+-----------------------+
|                  NULL |
+-----------------------+
Warnings:
Warning	1292	Truncated incorrect DOUBLE value: 'a'
select seq_test5.nextval MOD abs(-1) from tt1;
+-------------------------------+
| seq_test5.nextval MOD abs(-1) |
+-------------------------------+
|                             0 |
+-------------------------------+
select seq_test5.nextval DIV acos(-1) from tt1;
+--------------------------------+
| seq_test5.nextval DIV acos(-1) |
+--------------------------------+
|                              0 |
+--------------------------------+
select seq_test5.nextval/ceil(2.3) from tt1;
+-----------------------------+
| seq_test5.nextval/ceil(2.3) |
+-----------------------------+
|                      1.0000 |
+-----------------------------+
select seq_test5.nextval/exp(2) from tt1;
+--------------------------+
| seq_test5.nextval/exp(2) |
+--------------------------+
|       0.1353352832366127 |
+--------------------------+
select seq_test5.nextval/floor(3.2) from tt1;
+------------------------------+
| seq_test5.nextval/floor(3.2) |
+------------------------------+
|                       0.6667 |
+------------------------------+
select seq_test5.nextval/ln(3.2) from tt1;
+---------------------------+
| seq_test5.nextval/ln(3.2) |
+---------------------------+
|        2.5792012305791956 |
+---------------------------+
select seq_test5.nextval/log(2,8) from tt1;
+----------------------------+
| seq_test5.nextval/log(2,8) |
+----------------------------+
|         0.3333333333333333 |
+----------------------------+
select seq_test5.nextval/mod(8,2) from tt1;
+----------------------------+
| seq_test5.nextval/mod(8,2) |
+----------------------------+
|                       NULL |
+----------------------------+
select seq_test5.nextval MOD power(8,2) from tt1;
+----------------------------------+
| seq_test5.nextval MOD power(8,2) |
+----------------------------------+
|                                3 |
+----------------------------------+
select seq_test5.currval MOD power(8,2) from tt1;
+----------------------------------+
| seq_test5.currval MOD power(8,2) |
+----------------------------------+
|                                3 |
+----------------------------------+
select seq_test5.nextval/round(8,2) from tt1;
+------------------------------+
| seq_test5.nextval/round(8,2) |
+------------------------------+
|                       0.1250 |
+------------------------------+
select seq_test5.nextval/sign(8) from tt1;
+---------------------------+
| seq_test5.nextval/sign(8) |
+---------------------------+
|                    2.0000 |
+---------------------------+
select seq_test5.nextval DIV sqrt(8) from tt1;
+-------------------------------+
| seq_test5.nextval DIV sqrt(8) |
+-------------------------------+
|                             1 |
+-------------------------------+
select seq_test5.currval DIV sqrt(8) from tt1;
+-------------------------------+
| seq_test5.currval DIV sqrt(8) |
+-------------------------------+
|                             1 |
+-------------------------------+
select seq_test5.nextval/ASCII('A') from tt1;
+------------------------------+
| seq_test5.nextval/ASCII('A') |
+------------------------------+
|                       0.0154 |
+------------------------------+
select seq_test5.nextval MOD LENGTH('北京市海锭区') from tt1;
+----------------------------------------------------+
| seq_test5.nextval MOD LENGTH('北京市海锭区')       |
+----------------------------------------------------+
|                                                  2 |
+----------------------------------------------------+
select seq_test5.currval MOD LENGTH('北京市海锭区') from tt1;
+----------------------------------------------------+
| seq_test5.currval MOD LENGTH('北京市海锭区')       |
+----------------------------------------------------+
|                                                  2 |
+----------------------------------------------------+
select current_date DIV seq_test5.nextval from tt1;
+------------------------------------+
| current_date DIV seq_test5.nextval |
+------------------------------------+
|                            6733637 |
+------------------------------------+
select current_timestamp/seq_test5.nextval from tt1;
+-------------------------------------+
| current_timestamp/seq_test5.nextval |
+-------------------------------------+
|                 20200913202640.0000 |
+-------------------------------------+
select EXTRACT(HOUR FROM TIMESTAMP '2001-2-16 2:38:40 ')/seq_test5.nextval from tt1;
+---------------------------------------------------------------------+
| EXTRACT(HOUR FROM TIMESTAMP '2001-2-16 2:38:40 ')/seq_test5.nextval |
+---------------------------------------------------------------------+
|                                                              1.0000 |
+---------------------------------------------------------------------+
select LAST_DAY('2020-03-28 08:00:00')/seq_test5.nextval from tt1;
+---------------------------------------------------+
| LAST_DAY('2020-03-28 08:00:00')/seq_test5.nextval |
+---------------------------------------------------+
|                                      6733443.6667 |
+---------------------------------------------------+
select LOCALTIMESTAMP/seq_test5.nextval from tt1;
+----------------------------------+
| LOCALTIMESTAMP/seq_test5.nextval |
+----------------------------------+
|              20200913202640.0000 |
+----------------------------------+
select GREATEST (1, '3.935', '2.4')/seq_test5.nextval from tt1;
+------------------------------------------------+
| GREATEST (1, '3.935', '2.4')/seq_test5.nextval |
+------------------------------------------------+
|                                         1.9675 |
+------------------------------------------------+
select LEAST (1, '3.925', '2.4')/seq_test5.nextval from tt1;
+---------------------------------------------+
| LEAST (1, '3.925', '2.4')/seq_test5.nextval |
+---------------------------------------------+
|                          0.3333333333333333 |
+---------------------------------------------+
obmysql-sequence-5-1-2-6-1 函数
drop sequence seq_test7;
create sequence seq_test7;
select abs(seq_test7.currval) from tt1;
ERROR HY000: sequence is not yet defined in this session
select seq_test7.nextval from tt1;
+---------+
| nextval |
+---------+
|       1 |
+---------+
select abs(seq_test7.currval) from tt1;
+------------------------+
| abs(seq_test7.currval) |
+------------------------+
|                      1 |
+------------------------+
select ACOS(seq_test7.currval) from tt1;
+-------------------------+
| ACOS(seq_test7.currval) |
+-------------------------+
|                       0 |
+-------------------------+
select ACOS(seq_test7.nextval-1) from tt1;
+---------------------------+
| ACOS(seq_test7.nextval-1) |
+---------------------------+
|                         0 |
+---------------------------+
select ASIN(seq_test7.currval-1) from tt1;
+---------------------------+
| ASIN(seq_test7.currval-1) |
+---------------------------+
|        1.5707963267948966 |
+---------------------------+
select ASIN(seq_test7.nextval-2) from tt1;
+---------------------------+
| ASIN(seq_test7.nextval-2) |
+---------------------------+
|        1.5707963267948966 |
+---------------------------+
select ATAN(seq_test7.currval) from tt1;
+-------------------------+
| ATAN(seq_test7.currval) |
+-------------------------+
|      1.2490457723982544 |
+-------------------------+
select ATAN(seq_test7.nextval) from tt1;
+-------------------------+
| ATAN(seq_test7.nextval) |
+-------------------------+
|      1.3258176636680326 |
+-------------------------+
select ATAN2(seq_test7.currval,seq_test7.nextval) from tt1;
+--------------------------------------------+
| ATAN2(seq_test7.currval,seq_test7.nextval) |
+--------------------------------------------+
|                         0.7853981633974483 |
+--------------------------------------------+
select ATAN2(seq_test7.nextval,seq_test7.currval) from tt1;
+--------------------------------------------+
| ATAN2(seq_test7.nextval,seq_test7.currval) |
+--------------------------------------------+
|                         0.7853981633974483 |
+--------------------------------------------+
select bit_count(seq_test7.currval) from tt1;
+------------------------------+
| bit_count(seq_test7.currval) |
+------------------------------+
|                            2 |
+------------------------------+
select bit_count(seq_test7.nextval) from tt1;
+------------------------------+
| bit_count(seq_test7.nextval) |
+------------------------------+
|                            3 |
+------------------------------+
select ceil(seq_test7.currval) from tt1;
+-------------------------+
| ceil(seq_test7.currval) |
+-------------------------+
|                       7 |
+-------------------------+
select ceil(seq_test7.nextval) from tt1;
+-------------------------+
| ceil(seq_test7.nextval) |
+-------------------------+
|                       8 |
+-------------------------+
select ceiling(seq_test7.currval) from tt1;
+----------------------------+
| ceiling(seq_test7.currval) |
+----------------------------+
|                          8 |
+----------------------------+
select ceiling(seq_test7.nextval) from tt1;
+----------------------------+
| ceiling(seq_test7.nextval) |
+----------------------------+
|                          9 |
+----------------------------+
select conv(seq_test7.currval,seq_test7.currval,seq_test7.currval) from tt1;
+-------------------------------------------------------------+
| conv(seq_test7.currval,seq_test7.currval,seq_test7.currval) |
+-------------------------------------------------------------+
| 0                                                           |
+-------------------------------------------------------------+
select conv(seq_test7.nextval,seq_test7.nextval,seq_test7.nextval) from tt1;
+-------------------------------------------------------------+
| conv(seq_test7.nextval,seq_test7.nextval,seq_test7.nextval) |
+-------------------------------------------------------------+
| 10                                                          |
+-------------------------------------------------------------+
select cos(seq_test7.currval) from tt1;
+------------------------+
| cos(seq_test7.currval) |
+------------------------+
|    -0.8390715290764524 |
+------------------------+
select cos(seq_test7.nextval) from tt1;
+------------------------+
| cos(seq_test7.nextval) |
+------------------------+
|   0.004425697988050785 |
+------------------------+
select cot(seq_test7.currval) from tt1;
+------------------------+
| cot(seq_test7.currval) |
+------------------------+
| -0.0044257413313241135 |
+------------------------+
select cot(seq_test7.nextval) from tt1;
+------------------------+
| cot(seq_test7.nextval) |
+------------------------+
|    -1.5726734063976893 |
+------------------------+
select exp(seq_test7.currval) from tt1;
+------------------------+
| exp(seq_test7.currval) |
+------------------------+
|     162754.79141900392 |
+------------------------+
select exp(seq_test7.nextval) from tt1;
+------------------------+
| exp(seq_test7.nextval) |
+------------------------+
|      442413.3920089205 |
+------------------------+
select floor(seq_test7.currval) from tt1;
+--------------------------+
| floor(seq_test7.currval) |
+--------------------------+
|                       13 |
+--------------------------+
select floor(seq_test7.nextval) from tt1;
+--------------------------+
| floor(seq_test7.nextval) |
+--------------------------+
|                       14 |
+--------------------------+
select LN(seq_test7.currval) from tt1;
+-----------------------+
| LN(seq_test7.currval) |
+-----------------------+
|    2.6390573296152584 |
+-----------------------+
select LN(seq_test7.nextval) from tt1;
+-----------------------+
| LN(seq_test7.nextval) |
+-----------------------+
|      2.70805020110221 |
+-----------------------+
select LOG(seq_test7.currval) from tt1;
+------------------------+
| LOG(seq_test7.currval) |
+------------------------+
|       2.70805020110221 |
+------------------------+
select LOG(seq_test7.nextval) from tt1;
+------------------------+
| LOG(seq_test7.nextval) |
+------------------------+
|      2.772588722239781 |
+------------------------+
select LOG10(seq_test7.currval) from tt1;
+--------------------------+
| LOG10(seq_test7.currval) |
+--------------------------+
|       1.2041199826559248 |
+--------------------------+
select LOG10(seq_test7.nextval) from tt1;
+--------------------------+
| LOG10(seq_test7.nextval) |
+--------------------------+
|       1.2304489213782739 |
+--------------------------+
select LOG2(seq_test7.currval) from tt1;
+-------------------------+
| LOG2(seq_test7.currval) |
+-------------------------+
|        4.08746284125034 |
+-------------------------+
select LOG2(seq_test7.nextval) from tt1;
+-------------------------+
| LOG2(seq_test7.nextval) |
+-------------------------+
|       4.169925001442312 |
+-------------------------+
select MOD(seq_test7.currval,seq_test7.NEXTVAL) from tt1;
+------------------------------------------+
| MOD(seq_test7.currval,seq_test7.NEXTVAL) |
+------------------------------------------+
|                                        0 |
+------------------------------------------+
select MOD(seq_test7.NEXTVAL,seq_test7.CURRVAL) from tt1;
+------------------------------------------+
| MOD(seq_test7.NEXTVAL,seq_test7.CURRVAL) |
+------------------------------------------+
|                                        0 |
+------------------------------------------+
select NEG(seq_test7.currval) from tt1;
+------------------------+
| NEG(seq_test7.currval) |
+------------------------+
|                    -20 |
+------------------------+
select NEG(seq_test7.nextval) from tt1;
+------------------------+
| NEG(seq_test7.nextval) |
+------------------------+
|                    -21 |
+------------------------+
select POWER (seq_test7.currval,seq_test7.NEXTVAL) from tt1;
+---------------------------------------------+
| POWER (seq_test7.currval,seq_test7.NEXTVAL) |
+---------------------------------------------+
|                       3.4142787736421956e29 |
+---------------------------------------------+
select POWER (seq_test7.NEXTVAL,seq_test7.CURRVAL) from tt1;
+---------------------------------------------+
| POWER (seq_test7.NEXTVAL,seq_test7.CURRVAL) |
+---------------------------------------------+
|                        2.088046799984791e31 |
+---------------------------------------------+
select RADIANS(seq_test7.currval) from tt1;
+----------------------------+
| RADIANS(seq_test7.currval) |
+----------------------------+
|         0.4014257279586958 |
+----------------------------+
select RADIANS(seq_test7.nextval) from tt1;
+----------------------------+
| RADIANS(seq_test7.nextval) |
+----------------------------+
|         0.4188790204786391 |
+----------------------------+
select ROUND(seq_test7.NEXTVAL) from tt1;
+--------------------------+
| ROUND(seq_test7.NEXTVAL) |
+--------------------------+
|                       25 |
+--------------------------+
select ROUND(seq_test7.currval) from tt1;
+--------------------------+
| ROUND(seq_test7.currval) |
+--------------------------+
|                       25 |
+--------------------------+
select ROUND(seq_test7.NEXTVAL,-seq_test7.currval) from tt1;
+---------------------------------------------+
| ROUND(seq_test7.NEXTVAL,-seq_test7.currval) |
+---------------------------------------------+
|                                           0 |
+---------------------------------------------+
select SIGN(seq_test7.currval) from tt1;
+-------------------------+
| SIGN(seq_test7.currval) |
+-------------------------+
|                       1 |
+-------------------------+
select SIGN(seq_test7.NEXTVAL) from tt1;
+-------------------------+
| SIGN(seq_test7.NEXTVAL) |
+-------------------------+
|                       1 |
+-------------------------+
select SIN(seq_test7.currval) from tt1;
+------------------------+
| SIN(seq_test7.currval) |
+------------------------+
|      0.956375928404503 |
+------------------------+
select SIN(seq_test7.NEXTVAL) from tt1;
+------------------------+
| SIN(seq_test7.NEXTVAL) |
+------------------------+
|    0.27090578830786904 |
+------------------------+
select SQRT(seq_test7.currval) from tt1;
+-------------------------+
| SQRT(seq_test7.currval) |
+-------------------------+
|       5.291502622129181 |
+-------------------------+
select SQRT(seq_test7.NEXTVAL) from tt1;
+-------------------------+
| SQRT(seq_test7.NEXTVAL) |
+-------------------------+
|       5.385164807134504 |
+-------------------------+
select TAN(seq_test7.currval) from tt1;
+------------------------+
| TAN(seq_test7.currval) |
+------------------------+
|     0.8871428437982151 |
+------------------------+
select TAN(seq_test7.NEXTVAL) from tt1;
+------------------------+
| TAN(seq_test7.NEXTVAL) |
+------------------------+
|     -6.405331196646276 |
+------------------------+
select TRUNCATE(seq_test7.currval,seq_test7.NEXTVAL) from tt1;
+-----------------------------------------------+
| TRUNCATE(seq_test7.currval,seq_test7.NEXTVAL) |
+-----------------------------------------------+
|                                            31 |
+-----------------------------------------------+
select TRUNCATE(seq_test7.NEXTVAL,seq_test7.currval) from tt1;
+-----------------------------------------------+
| TRUNCATE(seq_test7.NEXTVAL,seq_test7.currval) |
+-----------------------------------------------+
|                                            32 |
+-----------------------------------------------+
字符串函数
drop sequence seq_test7;
create sequence seq_test7;
select seq_test7.NEXTVAL from tt1;
+---------+
| NEXTVAL |
+---------+
|       1 |
+---------+
select ASCII(seq_test7.currval) from tt1;
+--------------------------+
| ASCII(seq_test7.currval) |
+--------------------------+
|                       49 |
+--------------------------+
select ASCII(seq_test7.NEXTVAL) from tt1;
+--------------------------+
| ASCII(seq_test7.NEXTVAL) |
+--------------------------+
|                       50 |
+--------------------------+
select BIN(seq_test7.currval) from tt1;
+------------------------+
| BIN(seq_test7.currval) |
+------------------------+
| 10                     |
+------------------------+
select BIN(seq_test7.NEXTVAL) from tt1;
+------------------------+
| BIN(seq_test7.NEXTVAL) |
+------------------------+
| 11                     |
+------------------------+
select BIT_LENGTH(seq_test7.currval) from tt1;
+-------------------------------+
| BIT_LENGTH(seq_test7.currval) |
+-------------------------------+
|                             8 |
+-------------------------------+
select BIT_LENGTH(seq_test7.NEXTVAL) from tt1;
+-------------------------------+
| BIT_LENGTH(seq_test7.NEXTVAL) |
+-------------------------------+
|                             8 |
+-------------------------------+
select CHAR(seq_test7.currval) from tt1;
+-------------------------+
| CHAR(seq_test7.currval) |
+-------------------------+
|                        |
+-------------------------+
select CHAR(seq_test7.NEXTVAL USING UTF8MB4) from tt1;
+---------------------------------------+
| CHAR(seq_test7.NEXTVAL USING UTF8MB4) |
+---------------------------------------+
|                                      |
+---------------------------------------+
select CHAR_LENGTH(seq_test7.currval) from tt1;
+--------------------------------+
| CHAR_LENGTH(seq_test7.currval) |
+--------------------------------+
|                              1 |
+--------------------------------+
select CHAR_LENGTH(seq_test7.NEXTVAL) from tt1;
+--------------------------------+
| CHAR_LENGTH(seq_test7.NEXTVAL) |
+--------------------------------+
|                              1 |
+--------------------------------+
select CONCAT(seq_test7.currval,seq_test7.NEXTVAL) from tt1;
+---------------------------------------------+
| CONCAT(seq_test7.currval,seq_test7.NEXTVAL) |
+---------------------------------------------+
| 77                                          |
+---------------------------------------------+
select CONCAT(seq_test7.currval,seq_test7.NEXTVAL) from tt1;
+---------------------------------------------+
| CONCAT(seq_test7.currval,seq_test7.NEXTVAL) |
+---------------------------------------------+
| 88                                          |
+---------------------------------------------+
select CONCAT_WS('-',seq_test7.currval,seq_test7.NEXTVAL) from tt1;
+----------------------------------------------------+
| CONCAT_WS('-',seq_test7.currval,seq_test7.NEXTVAL) |
+----------------------------------------------------+
| 9-9                                                |
+----------------------------------------------------+
select CONCAT_WS('-',seq_test7.NEXTVAL,seq_test7.CURRVAL) from tt1;
+----------------------------------------------------+
| CONCAT_WS('-',seq_test7.NEXTVAL,seq_test7.CURRVAL) |
+----------------------------------------------------+
| 10-10                                              |
+----------------------------------------------------+
select ELT(seq_test7.currval,seq_test7.currval,seq_test7.NEXTVAL) from tt1;
+------------------------------------------------------------+
| ELT(seq_test7.currval,seq_test7.currval,seq_test7.NEXTVAL) |
+------------------------------------------------------------+
| NULL                                                       |
+------------------------------------------------------------+
select ELT(seq_test7.NEXTVAL,seq_test7.NEXTVAL,seq_test7.CURRVAL) from tt1;
+------------------------------------------------------------+
| ELT(seq_test7.NEXTVAL,seq_test7.NEXTVAL,seq_test7.CURRVAL) |
+------------------------------------------------------------+
| NULL                                                       |
+------------------------------------------------------------+
select FIELD(seq_test7.currval,seq_test7.currval,seq_test7.NEXTVAL) from tt1;
+--------------------------------------------------------------+
| FIELD(seq_test7.currval,seq_test7.currval,seq_test7.NEXTVAL) |
+--------------------------------------------------------------+
|                                                            1 |
+--------------------------------------------------------------+
select FIELD(seq_test7.NEXTVAL,seq_test7.NEXTVAL,seq_test7.CURRVAL) from tt1;
+--------------------------------------------------------------+
| FIELD(seq_test7.NEXTVAL,seq_test7.NEXTVAL,seq_test7.CURRVAL) |
+--------------------------------------------------------------+
|                                                            1 |
+--------------------------------------------------------------+
select FORMAT(seq_test7.currval,seq_test7.NEXTVAL) from tt1;
+---------------------------------------------+
| FORMAT(seq_test7.currval,seq_test7.NEXTVAL) |
+---------------------------------------------+
| 15.000000000000000                          |
+---------------------------------------------+
select FORMAT(seq_test7.NEXTVAL,seq_test7.CURRVAL) from tt1;
+---------------------------------------------+
| FORMAT(seq_test7.NEXTVAL,seq_test7.CURRVAL) |
+---------------------------------------------+
| 16.0000000000000000                         |
+---------------------------------------------+
select HEX(seq_test7.currval) from tt1;
+------------------------+
| HEX(seq_test7.currval) |
+------------------------+
| 10                     |
+------------------------+
select HEX(seq_test7.NEXTVAL) from tt1;
+------------------------+
| HEX(seq_test7.NEXTVAL) |
+------------------------+
| 11                     |
+------------------------+
select INT2IP(seq_test7.currval) from tt1;
+---------------------------+
| INT2IP(seq_test7.currval) |
+---------------------------+
| 0.0.0.17                  |
+---------------------------+
select INT2IP(seq_test7.NEXTVAL) from tt1;
+---------------------------+
| INT2IP(seq_test7.NEXTVAL) |
+---------------------------+
| 0.0.0.18                  |
+---------------------------+
select LEFT('oceanbase',seq_test7.currval) from tt1;
+-------------------------------------+
| LEFT('oceanbase',seq_test7.currval) |
+-------------------------------------+
| oceanbase                           |
+-------------------------------------+
select LEFT('oceanbase',seq_test7.NEXTVAL) from tt1;
+-------------------------------------+
| LEFT('oceanbase',seq_test7.NEXTVAL) |
+-------------------------------------+
| oceanbase                           |
+-------------------------------------+
select length(seq_test7.currval) from tt1;
+---------------------------+
| length(seq_test7.currval) |
+---------------------------+
|                         2 |
+---------------------------+
select length(seq_test7.NEXTVAL) from tt1;
+---------------------------+
| length(seq_test7.NEXTVAL) |
+---------------------------+
|                         2 |
+---------------------------+
select lower(seq_test7.currval) from tt1;
+--------------------------+
| lower(seq_test7.currval) |
+--------------------------+
| 20                       |
+--------------------------+
select lower(seq_test7.NEXTVAL) from tt1;
+--------------------------+
| lower(seq_test7.NEXTVAL) |
+--------------------------+
| 21                       |
+--------------------------+
select ltrim(seq_test7.currval) from tt1;
+--------------------------+
| ltrim(seq_test7.currval) |
+--------------------------+
| 21                       |
+--------------------------+
select ltrim(seq_test7.NEXTVAL) from tt1;
+--------------------------+
| ltrim(seq_test7.NEXTVAL) |
+--------------------------+
| 22                       |
+--------------------------+
select md5(seq_test7.currval) from tt1;
+----------------------------------+
| md5(seq_test7.currval)           |
+----------------------------------+
| b6d767d2f8ed5d21a44b0e5886680cb9 |
+----------------------------------+
select md5(seq_test7.NEXTVAL) from tt1;
+----------------------------------+
| md5(seq_test7.NEXTVAL)           |
+----------------------------------+
| 37693cfc748049e45d87b8c7d8b9aacd |
+----------------------------------+
SELECT MID('OceanBase',seq_test7.currval) from tt1;
+------------------------------------+
| MID('OceanBase',seq_test7.currval) |
+------------------------------------+
|                                    |
+------------------------------------+
SELECT MID('OceanBase',seq_test7.nextval) from tt1;
+------------------------------------+
| MID('OceanBase',seq_test7.nextval) |
+------------------------------------+
|                                    |
+------------------------------------+
SELECT oct(seq_test7.currval) from tt1;
+------------------------+
| oct(seq_test7.currval) |
+------------------------+
| 30                     |
+------------------------+
SELECT oct(seq_test7.nextval) from tt1;
+------------------------+
| oct(seq_test7.nextval) |
+------------------------+
| 31                     |
+------------------------+
SELECT ord(seq_test7.currval) from tt1;
+------------------------+
| ord(seq_test7.currval) |
+------------------------+
|                     50 |
+------------------------+
SELECT ord(seq_test7.nextval) from tt1;
+------------------------+
| ord(seq_test7.nextval) |
+------------------------+
|                     50 |
+------------------------+
SELECT reverse(seq_test7.currval) from tt1;
+----------------------------+
| reverse(seq_test7.currval) |
+----------------------------+
| 62                         |
+----------------------------+
SELECT reverse(seq_test7.nextval) from tt1;
+----------------------------+
| reverse(seq_test7.nextval) |
+----------------------------+
| 72                         |
+----------------------------+
SELECT right('OceanBase',seq_test7.currval) from tt1;
+--------------------------------------+
| right('OceanBase',seq_test7.currval) |
+--------------------------------------+
| OceanBase                            |
+--------------------------------------+
SELECT right('OceanBase',seq_test7.nextval) from tt1;
+--------------------------------------+
| right('OceanBase',seq_test7.nextval) |
+--------------------------------------+
| OceanBase                            |
+--------------------------------------+
SELECT RPAD('hi',seq_test7.currval,'?') from tt1;
+----------------------------------+
| RPAD('hi',seq_test7.currval,'?') |
+----------------------------------+
| hi??????????????????????????     |
+----------------------------------+
SELECT RPAD('hi',seq_test7.nextval,'?') from tt1;
+----------------------------------+
| RPAD('hi',seq_test7.nextval,'?') |
+----------------------------------+
| hi???????????????????????????    |
+----------------------------------+
SELECT rtrim(seq_test7.currval) from tt1;
+--------------------------+
| rtrim(seq_test7.currval) |
+--------------------------+
| 29                       |
+--------------------------+
SELECT rtrim(seq_test7.nextval) from tt1;
+--------------------------+
| rtrim(seq_test7.nextval) |
+--------------------------+
| 30                       |
+--------------------------+
SELECT space(seq_test7.currval) from tt1;
+--------------------------------+
| space(seq_test7.currval)       |
+--------------------------------+
|                                |
+--------------------------------+
SELECT space(seq_test7.nextval) from tt1;
+---------------------------------+
| space(seq_test7.nextval)        |
+---------------------------------+
|                                 |
+---------------------------------+
SELECT strcmp(seq_test7.currval,seq_test7.currval) from tt1;
+---------------------------------------------+
| strcmp(seq_test7.currval,seq_test7.currval) |
+---------------------------------------------+
|                                           0 |
+---------------------------------------------+
SELECT strcmp(seq_test7.nextval,seq_test7.nextval) from tt1;
+---------------------------------------------+
| strcmp(seq_test7.nextval,seq_test7.nextval) |
+---------------------------------------------+
|                                           0 |
+---------------------------------------------+
SELECT substr('OceanBase',seq_test7.currval) from tt1;
+---------------------------------------+
| substr('OceanBase',seq_test7.currval) |
+---------------------------------------+
|                                       |
+---------------------------------------+
SELECT substr('OceanBase',seq_test7.nextval) from tt1;
+---------------------------------------+
| substr('OceanBase',seq_test7.nextval) |
+---------------------------------------+
|                                       |
+---------------------------------------+
SELECT ucase(seq_test7.currval) from tt1;
+--------------------------+
| ucase(seq_test7.currval) |
+--------------------------+
| 33                       |
+--------------------------+
SELECT ucase(seq_test7.nextval) from tt1;
+--------------------------+
| ucase(seq_test7.nextval) |
+--------------------------+
| 34                       |
+--------------------------+
SELECT left('OceanBase',seq_test7.currval) from tt1;
+-------------------------------------+
| left('OceanBase',seq_test7.currval) |
+-------------------------------------+
| OceanBase                           |
+-------------------------------------+
SELECT left('OceanBase',seq_test7.nextval) from tt1;
+-------------------------------------+
| left('OceanBase',seq_test7.nextval) |
+-------------------------------------+
| OceanBase                           |
+-------------------------------------+
SELECT unhex(seq_test7.currval) from tt1;
+--------------------------+
| unhex(seq_test7.currval) |
+--------------------------+
| 5                        |
+--------------------------+
SELECT unhex(seq_test7.nextval) from tt1;
+--------------------------+
| unhex(seq_test7.nextval) |
+--------------------------+
| 6                        |
+--------------------------+
SELECT upper(seq_test7.currval) from tt1;
+--------------------------+
| upper(seq_test7.currval) |
+--------------------------+
| 36                       |
+--------------------------+
SELECT upper(seq_test7.nextval) from tt1;
+--------------------------+
| upper(seq_test7.nextval) |
+--------------------------+
| 37                       |
+--------------------------+
SELECT cast(seq_test7.currval as signed) from tt1;
+-----------------------------------+
| cast(seq_test7.currval as signed) |
+-----------------------------------+
|                                37 |
+-----------------------------------+
SELECT cast(seq_test7.nextval as decimal) from tt1;
+------------------------------------+
| cast(seq_test7.nextval as decimal) |
+------------------------------------+
|                                 38 |
+------------------------------------+
SELECT convert(seq_test7.currval using binary) from tt1;
+-----------------------------------------+
| convert(seq_test7.currval using binary) |
+-----------------------------------------+
| 38                                      |
+-----------------------------------------+
SELECT convert(seq_test7.nextval ,char) from tt1;
+----------------------------------+
| convert(seq_test7.nextval ,char) |
+----------------------------------+
| 39                               |
+----------------------------------+
SELECT greatest(seq_test7.currval,seq_test7.nextval) from tt1;
+-----------------------------------------------+
| greatest(seq_test7.currval,seq_test7.nextval) |
+-----------------------------------------------+
|                                            40 |
+-----------------------------------------------+
SELECT greatest(seq_test7.nextval,seq_test7.currval) from tt1;
+-----------------------------------------------+
| greatest(seq_test7.nextval,seq_test7.currval) |
+-----------------------------------------------+
|                                            41 |
+-----------------------------------------------+
SELECT interval(seq_test7.currval,seq_test7.nextval,seq_test7.currval) from tt1;
+-----------------------------------------------------------------+
| interval(seq_test7.currval,seq_test7.nextval,seq_test7.currval) |
+-----------------------------------------------------------------+
|                                                               2 |
+-----------------------------------------------------------------+
SELECT interval(seq_test7.nextval,seq_test7.nextval,seq_test7.currval) from tt1;
+-----------------------------------------------------------------+
| interval(seq_test7.nextval,seq_test7.nextval,seq_test7.currval) |
+-----------------------------------------------------------------+
|                                                               2 |
+-----------------------------------------------------------------+
SELECT isnull(seq_test7.currval) from tt1;
+---------------------------+
| isnull(seq_test7.currval) |
+---------------------------+
|                         0 |
+---------------------------+
SELECT isnull(seq_test7.nextval) from tt1;
+---------------------------+
| isnull(seq_test7.nextval) |
+---------------------------+
|                         0 |
+---------------------------+
SELECT least(seq_test7.currval,seq_test7.nextval) from tt1;
+--------------------------------------------+
| least(seq_test7.currval,seq_test7.nextval) |
+--------------------------------------------+
|                                         45 |
+--------------------------------------------+
SELECT least(seq_test7.nextval,seq_test7.currval) from tt1;
+--------------------------------------------+
| least(seq_test7.nextval,seq_test7.currval) |
+--------------------------------------------+
|                                         46 |
+--------------------------------------------+
SELECT CASE seq_test7.currval WHEN seq_test7.currval THEN seq_test7.currval WHEN seq_test7.nextval THEN seq_test7.nextval END from tt1;
+------------------------------------------------------------------------------------------------------------------------+
| CASE seq_test7.currval WHEN seq_test7.currval THEN seq_test7.currval WHEN seq_test7.nextval THEN seq_test7.nextval END |
+------------------------------------------------------------------------------------------------------------------------+
|                                                                                                                     47 |
+------------------------------------------------------------------------------------------------------------------------+
SELECT CASE seq_test7.currval WHEN seq_test7.nextval THEN seq_test7.currval WHEN seq_test7.nextval THEN seq_test7.nextval END from tt1;
+------------------------------------------------------------------------------------------------------------------------+
| CASE seq_test7.currval WHEN seq_test7.nextval THEN seq_test7.currval WHEN seq_test7.nextval THEN seq_test7.nextval END |
+------------------------------------------------------------------------------------------------------------------------+
|                                                                                                                     48 |
+------------------------------------------------------------------------------------------------------------------------+
SELECT if(seq_test7.currval,seq_test7.nextval,seq_test7.currval) from tt1;
+-----------------------------------------------------------+
| if(seq_test7.currval,seq_test7.nextval,seq_test7.currval) |
+-----------------------------------------------------------+
|                                                        49 |
+-----------------------------------------------------------+
SELECT if(seq_test7.nextval,seq_test7.nextval,seq_test7.currval) from tt1;
+-----------------------------------------------------------+
| if(seq_test7.nextval,seq_test7.nextval,seq_test7.currval) |
+-----------------------------------------------------------+
|                                                        50 |
+-----------------------------------------------------------+
SELECT ifnull(seq_test7.currval,seq_test7.nextval) from tt1;
+---------------------------------------------+
| ifnull(seq_test7.currval,seq_test7.nextval) |
+---------------------------------------------+
|                                          51 |
+---------------------------------------------+
SELECT ifnull(seq_test7.nextval,seq_test7.currval) from tt1;
+---------------------------------------------+
| ifnull(seq_test7.nextval,seq_test7.currval) |
+---------------------------------------------+
|                                          52 |
+---------------------------------------------+
SELECT nullif(seq_test7.currval,seq_test7.nextval) from tt1;
+---------------------------------------------+
| nullif(seq_test7.currval,seq_test7.nextval) |
+---------------------------------------------+
|                                        NULL |
+---------------------------------------------+
SELECT nullif(seq_test7.nextval,seq_test7.currval) from tt1;
+---------------------------------------------+
| nullif(seq_test7.nextval,seq_test7.currval) |
+---------------------------------------------+
|                                        NULL |
+---------------------------------------------+
SELECT charset(seq_test7.currval) from tt1;
+----------------------------+
| charset(seq_test7.currval) |
+----------------------------+
| binary                     |
+----------------------------+
SELECT charset(seq_test7.nextval) from tt1;
+----------------------------+
| charset(seq_test7.nextval) |
+----------------------------+
| binary                     |
+----------------------------+
SELECT COERCIBILITY(seq_test7.currval) from tt1;
+---------------------------------+
| COERCIBILITY(seq_test7.currval) |
+---------------------------------+
|                               5 |
+---------------------------------+
SELECT COERCIBILITY(seq_test7.nextval) from tt1;
+---------------------------------+
| COERCIBILITY(seq_test7.nextval) |
+---------------------------------+
|                               5 |
+---------------------------------+
SELECT COLLATION(seq_test7.currval) from tt1;
+------------------------------+
| COLLATION(seq_test7.currval) |
+------------------------------+
| binary                       |
+------------------------------+
SELECT COLLATION(seq_test7.nextval) from tt1;
+------------------------------+
| COLLATION(seq_test7.nextval) |
+------------------------------+
| binary                       |
+------------------------------+
SELECT COALESCE(seq_test7.currval) from tt1;
+-----------------------------+
| COALESCE(seq_test7.currval) |
+-----------------------------+
|                          57 |
+-----------------------------+
SELECT COALESCE(seq_test7.nextval) from tt1;
+-----------------------------+
| COALESCE(seq_test7.nextval) |
+-----------------------------+
|                          58 |
+-----------------------------+
SELECT nvl(null,seq_test7.currval) from tt1;
+-----------------------------+
| nvl(null,seq_test7.currval) |
+-----------------------------+
|                          58 |
+-----------------------------+
SELECT nvl(null,seq_test7.nextval) from tt1;
+-----------------------------+
| nvl(null,seq_test7.nextval) |
+-----------------------------+
|                          59 |
+-----------------------------+
时间日期
drop sequence s1;
create sequence s1;
select s1.nextval,s1.nextval from tt1;
+---------+---------+
| nextval | nextval |
+---------+---------+
|       1 |       1 |
+---------+---------+
select s1.currval,s1.currval from tt1;
+---------+---------+
| currval | currval |
+---------+---------+
|       1 |       1 |
+---------+---------+
SELECT ADDDATE('2021-08-01', INTERVAL s1.currval DAY) from tt1;
+------------------------------------------------+
| ADDDATE('2021-08-01', INTERVAL s1.currval DAY) |
+------------------------------------------------+
| 2021-08-02                                     |
+------------------------------------------------+
SELECT ADDDATE('2021-08-01', INTERVAL s1.nextval DAY) from tt1;
+------------------------------------------------+
| ADDDATE('2021-08-01', INTERVAL s1.nextval DAY) |
+------------------------------------------------+
| 2021-08-03                                     |
+------------------------------------------------+
SELECT DATE_ADD(NOW(), INTERVAL s1.currval DAY) from tt1;
+------------------------------------------+
| DATE_ADD(NOW(), INTERVAL s1.currval DAY) |
+------------------------------------------+
| 2020-09-15 20:26:40                      |
+------------------------------------------+
SELECT DATE_ADD(NOW(), INTERVAL s1.nextval DAY) from tt1;
+------------------------------------------+
| DATE_ADD(NOW(), INTERVAL s1.nextval DAY) |
+------------------------------------------+
| 2020-09-16 20:26:40                      |
+------------------------------------------+
SELECT DATE_SUB(NOW(), INTERVAL s1.currval DAY) from tt1;
+------------------------------------------+
| DATE_SUB(NOW(), INTERVAL s1.currval DAY) |
+------------------------------------------+
| 2020-09-10 20:26:40                      |
+------------------------------------------+
SELECT DATE_SUB(NOW(), INTERVAL s1.nextval DAY) from tt1;
+------------------------------------------+
| DATE_SUB(NOW(), INTERVAL s1.nextval DAY) |
+------------------------------------------+
| 2020-09-09 20:26:40                      |
+------------------------------------------+
SELECT FROM_DAYS(s1.currval), FROM_DAYS(s1.nextval) from tt1;
+-----------------------+-----------------------+
| FROM_DAYS(s1.currval) | FROM_DAYS(s1.nextval) |
+-----------------------+-----------------------+
| 0000-00-00            | 0000-00-00            |
+-----------------------+-----------------------+
SELECT MAKEDATE(2011,s1.currval), MAKEDATE(2011,s1.nextval) from tt1;
+---------------------------+---------------------------+
| MAKEDATE(2011,s1.currval) | MAKEDATE(2011,s1.nextval) |
+---------------------------+---------------------------+
| 2011-01-06                | 2011-01-06                |
+---------------------------+---------------------------+
SELECT MAKETIME(s1.currval,s1.currval,s1.currval) from tt1;
+--------------------------------------------+
| MAKETIME(s1.currval,s1.currval,s1.currval) |
+--------------------------------------------+
| 06:06:06.000000                            |
+--------------------------------------------+
SELECT MAKETIME(s1.nextval,s1.nextval,s1.nextval) from tt1;
+--------------------------------------------+
| MAKETIME(s1.nextval,s1.nextval,s1.nextval) |
+--------------------------------------------+
| 07:07:07.000000                            |
+--------------------------------------------+
SELECT PERIOD_ADD(s1.nextval,s1.nextval) from tt1;
+-----------------------------------+
| PERIOD_ADD(s1.nextval,s1.nextval) |
+-----------------------------------+
|                            200104 |
+-----------------------------------+
SELECT PERIOD_ADD(s1.currval,s1.currval) from tt1;
+-----------------------------------+
| PERIOD_ADD(s1.currval,s1.currval) |
+-----------------------------------+
|                            200104 |
+-----------------------------------+
SELECT PERIOD_DIFF(s1.nextval,s1.nextval) from tt1;
+------------------------------------+
| PERIOD_DIFF(s1.nextval,s1.nextval) |
+------------------------------------+
|                                  0 |
+------------------------------------+
SELECT PERIOD_DIFF(s1.currval,s1.currval) from tt1;
+------------------------------------+
| PERIOD_DIFF(s1.currval,s1.currval) |
+------------------------------------+
|                                  0 |
+------------------------------------+
SELECT SEC_TO_TIME(s1.currval),SEC_TO_TIME(s1.nextval) from tt1;
+-------------------------+-------------------------+
| SEC_TO_TIME(s1.currval) | SEC_TO_TIME(s1.nextval) |
+-------------------------+-------------------------+
| 00:00:10                | 00:00:10                |
+-------------------------+-------------------------+
SELECT SUBDATE('2022-01-02', INTERVAL s1.currval DAY) from tt1;
+------------------------------------------------+
| SUBDATE('2022-01-02', INTERVAL s1.currval DAY) |
+------------------------------------------------+
| 2021-12-23                                     |
+------------------------------------------------+
SELECT SUBDATE('2022-01-02', INTERVAL s1.nextval DAY) from tt1;
+------------------------------------------------+
| SUBDATE('2022-01-02', INTERVAL s1.nextval DAY) |
+------------------------------------------------+
| 2021-12-22                                     |
+------------------------------------------------+
SELECT TIMESTAMPADD(DAY, -s1.currval, '2010-01-01 00:00:00') from tt1;
+-------------------------------------------------------+
| TIMESTAMPADD(DAY, -s1.currval, '2010-01-01 00:00:00') |
+-------------------------------------------------------+
| 2009-12-21 00:00:00                                   |
+-------------------------------------------------------+
SELECT TIMESTAMPADD(DAY, s1.nextval, '2010-01-01 00:00:00') from tt1;
+------------------------------------------------------+
| TIMESTAMPADD(DAY, s1.nextval, '2010-01-01 00:00:00') |
+------------------------------------------------------+
| 2010-01-13 00:00:00                                  |
+------------------------------------------------------+
SELECT TO_SECONDS(s1.currval),TO_SECONDS(s1.nextval) from tt1;
+------------------------+------------------------+
| TO_SECONDS(s1.currval) | TO_SECONDS(s1.nextval) |
+------------------------+------------------------+
|                   NULL |                   NULL |
+------------------------+------------------------+
SELECT USEC_TO_TIME(s1.currval),usec_TO_time(s1.nextval) from tt1;
+----------------------------+----------------------------+
| USEC_TO_TIME(s1.currval)   | usec_TO_time(s1.nextval)   |
+----------------------------+----------------------------+
| 1970-01-01 08:00:00.000014 | 1970-01-01 08:00:00.000014 |
+----------------------------+----------------------------+
SELECT WEEK('2021-01-01',s1.nextval) from tt1;
+-------------------------------+
| WEEK('2021-01-01',s1.nextval) |
+-------------------------------+
|                            52 |
+-------------------------------+
SELECT WEEK('2021-01-01',s1.currval) from tt1;
+-------------------------------+
| WEEK('2021-01-01',s1.currval) |
+-------------------------------+
|                            52 |
+-------------------------------+
SELECT YEARWEEK('2021-01-01',s1.nextval) from tt1;
+-----------------------------------+
| YEARWEEK('2021-01-01',s1.nextval) |
+-----------------------------------+
|                            202052 |
+-----------------------------------+
SELECT YEARWEEK('2021-01-01',s1.currval) from tt1;
+-----------------------------------+
| YEARWEEK('2021-01-01',s1.currval) |
+-----------------------------------+
|                            202052 |
+-----------------------------------+
obmysql-sequence-5-1-2-7
drop table ind_test;
create table ind_test(id int , name varchar(20));
drop sequence seq01;
create sequence seq01;
drop index index01 on ind_test;
create index index01 on ind_test(id);
insert into ind_test values(seq01.nextval,'test');
select * from ind_test where id =1;
+------+------+
| id   | name |
+------+------+
|    1 | test |
+------+------+
select seq01.nextval from tt1;
+---------+
| nextval |
+---------+
|       2 |
+---------+
drop table tt1;
drop index index01 on ind_test;
drop table test17;
drop table a;
drop table b;
drop sequence seq_test1;
drop sequence seq_test2;
########清空回收站，删除测试数据库，表等 ##########
drop database  IF EXISTS  oblrp;
purge recyclebin;
