purge recyclebin;
result_format: 4
drop database IF EXISTS oblrp;
create database oblrp;
use oblrp;
set timestamp = 1600000000;
set ob_trx_timeout = 10000000000;
set ob_query_timeout = 10000000000;
create sequence SFDA_EAI_VIRACCNOSEQ
minvalue 1
maxvalue 999999999999
start with 100000000000
increment by 1
cache 20
cycle;
create sequence SFDA_EI_ENTERPRISESEQ
minvalue 1
maxvalue 9999
start with 1000
increment by 1
cache 20
cycle;
create sequence SFDA_UI_USERSEQ
minvalue 1
maxvalue 9999999999
start with 1000000000
increment by 1
cache 20
cycle;
create sequence SEQ_GOODSINFO
minvalue 1
maxvalue 9999999999
start with 1
increment by 1
cache 20;
create sequence SFDA_MI_MERCHANTSEQ
minvalue 1
maxvalue 99999999
start with 10000000
increment by 1
cache 20
cycle;
create sequence SFDA_CI_CUSTOMERSEQ
minvalue 1
maxvalue 9999999999
start with 1000000000
increment by 1
cache 20
cycle;
create sequence SFDA_MSF_MSGSEQ
minvalue 1
maxvalue 99999999
start with 10000000
increment by 1
cache 20
cycle;
create sequence SFDA_SA_ADDRESSSEQ
minvalue 100000
maxvalue 999999
start with 100000
increment by 1
cache 20
cycle;
create sequence SFDA_OF_ORDERFLOWSEQ
minvalue 10000000
maxvalue 99999999
start with 10000000
increment by 1
cache 20
cycle
order;
create sequence SFDA_OI_ORDERSEQ
minvalue 10000000
maxvalue 99999999
start with 10000000
increment by 1
cache 20
cycle
order;
create sequence SFDA_AF_ACCFLOWNOSEQ
minvalue 1
maxvalue 9999999999
start with 10002040
increment by 1
cache 20;
create sequence SFDA_CRF_ACCCHECKSEQ
minvalue 10000000
maxvalue 99999999
start with 10000000
increment by 1
cache 20
cycle;
create sequence SFDA_CVI_VIRACCNOSEQ
minvalue 1
maxvalue 99999999999
start with 10000160
increment by 1
cache 20;
create sequence SFDA_TFI_TRANFLOWNOSEQ
minvalue 1
maxvalue 999999999999
start with 10000840
increment by 1
cache 20;
drop sequence prefetch_sequence;
create sequence prefetch_sequence start with 1 increment by 3 cache 30;
select prefetch_sequence.nextval ;
+---------+
| nextval |
+---------+
|       1 |
+---------+
select prefetch_sequence.nextval ;
+---------+
| nextval |
+---------+
|       4 |
+---------+
select prefetch_sequence.nextval ;
+---------+
| nextval |
+---------+
|       7 |
+---------+
select prefetch_sequence.nextval ;
+---------+
| nextval |
+---------+
|      10 |
+---------+
select prefetch_sequence.nextval ;
+---------+
| nextval |
+---------+
|      13 |
+---------+
select prefetch_sequence.nextval ;
+---------+
| nextval |
+---------+
|      16 |
+---------+
select prefetch_sequence.nextval ;
+---------+
| nextval |
+---------+
|      19 |
+---------+
alter sequence prefetch_sequence increment by 4;
select prefetch_sequence.nextval ;
+---------+
| nextval |
+---------+
|      23 |
+---------+
select prefetch_sequence.nextval ;
+---------+
| nextval |
+---------+
|      27 |
+---------+
select prefetch_sequence.nextval ;
+---------+
| nextval |
+---------+
|      31 |
+---------+
select prefetch_sequence.nextval ;
+---------+
| nextval |
+---------+
|      35 |
+---------+
select prefetch_sequence.nextval ;
+---------+
| nextval |
+---------+
|      39 |
+---------+
select prefetch_sequence.nextval ;
+---------+
| nextval |
+---------+
|      43 |
+---------+
select prefetch_sequence.nextval ;
+---------+
| nextval |
+---------+
|      47 |
+---------+
drop sequence s1;
drop sequence s2;
drop table t1;
drop table t2;
create sequence s1 start with 1 increment by 1 cache 30;
create sequence s2 start with 4;
create table t1 (i int primary key, j int);
create table t2 (i int primary key, j int) partition by hash(i) partitions 3;
select * from t1 where i = s1.nextval;
ERROR HY000: sequence number not allowed here
select s1.nextval from t1 group by j;
ERROR HY000: sequence number not allowed here
select s1.nextval from t1 order by i;
ERROR HY000: sequence number not allowed here
select distinct i, s1.nextval from t1;
ERROR HY000: sequence number not allowed here
select i, s1.nextval from t1 union select i, j from t2;
ERROR HY000: sequence number not allowed here
select s1.nextval  union all select 1;
ERROR HY000: sequence number not allowed here
select * from (select s1.nextval from t2) a, t2 b;
ERROR HY000: sequence number not allowed here
select * from t1 where not exists (select s1.nextval from t2);
ERROR HY000: sequence number not allowed here
drop sequence mqq;
create sequence mqq start with 1 minvalue 1 maxvalue 9 increment by 3 cycle nocache;
select mqq.nextval ;
+---------+
| nextval |
+---------+
|       1 |
+---------+
select mqq.nextval ;
+---------+
| nextval |
+---------+
|       4 |
+---------+
alter sequence mqq increment by 7;
select mqq.nextval ;
+---------+
| nextval |
+---------+
|       1 |
+---------+
select mqq.nextval ;
+---------+
| nextval |
+---------+
|       8 |
+---------+
select mqq.nextval ;
+---------+
| nextval |
+---------+
|       1 |
+---------+
select mqq.nextval ;
+---------+
| nextval |
+---------+
|       8 |
+---------+
select mqq.nextval ;
+---------+
| nextval |
+---------+
|       1 |
+---------+
select mqq.nextval ;
+---------+
| nextval |
+---------+
|       8 |
+---------+
select mqq.nextval ;
+---------+
| nextval |
+---------+
|       1 |
+---------+
alter sequence mqq increment by 3;
select mqq.nextval ;
+---------+
| nextval |
+---------+
|       4 |
+---------+
select mqq.nextval ;
+---------+
| nextval |
+---------+
|       7 |
+---------+
select mqq.nextval ;
+---------+
| nextval |
+---------+
|       1 |
+---------+
select mqq.nextval ;
+---------+
| nextval |
+---------+
|       4 |
+---------+
alter sequence mqq increment by 8;
select mqq.nextval ;
+---------+
| nextval |
+---------+
|       1 |
+---------+
select mqq.nextval ;
+---------+
| nextval |
+---------+
|       9 |
+---------+
create sequence seq1 order cache 100;
alter sequence seq1 noorder cache 30;
drop sequence seq1;
#########  error test ##########
create sequence testx nomaxvalue maxvalue 1;
ERROR HY000: conflicting MAXVALUE/NOMAXVALUE specifications
create sequence testx nominvalue minvalue 1;
ERROR HY000: conflicting MINVALUE/NOMINVALUE specifications
create sequence testx cycle nocycle;
ERROR HY000: conflicting CYCLE/NOCYCLE specifications
create sequence testx cache 20 nocache;
ERROR HY000: conflicting CACHE/NOCACHE specifications
create sequence testx order noorder;
ERROR HY000: conflicting ORDER/NOORDER specifications
create sequence testx cache 20 cache 30;
ERROR HY000: duplicate CACHE/NOCACHE specifications
create sequence testx nocache nocache;
ERROR HY000: duplicate CACHE/NOCACHE specifications
create sequence testx nocache noorder noorder;
ERROR HY000: duplicate ORDER/NOORDER specifications
create sequence testx noorder noorder cache 10;
ERROR HY000: duplicate ORDER/NOORDER specifications
create sequence testx increment by 1 increment by 2;
ERROR HY000: duplicate INCREMENT BY specifications
create sequence testx start with 1 start with 2;
ERROR HY000: duplicate START WITH specifications
drop sequence s1;
create sequence s1 minvalue 100 maxvalue 100;
ERROR HY000: MINVALUE must be less than MAXVALUE
create sequence s1  maxvalue -30  increment by 1;
ERROR HY000: MINVALUE must be less than MAXVALUE
create sequence s1  maxvalue 0  increment by 1;
ERROR HY000: MINVALUE must be less than MAXVALUE
create sequence s1  maxvalue 1  increment by 1;
ERROR HY000: MINVALUE must be less than MAXVALUE
create sequence s1  minvalue 3 increment by -1;
ERROR HY000: MINVALUE must be less than MAXVALUE
create sequence s1  minvalue 1 increment by -1;
ERROR HY000: MINVALUE must be less than MAXVALUE
create sequence s1  minvalue -1 increment by -1;
ERROR HY000: MINVALUE must be less than MAXVALUE
create sequence s1  maxvalue -30;
ERROR HY000: MINVALUE must be less than MAXVALUE
create sequence s1  maxvalue -30 nominvalue;
ERROR HY000: MINVALUE must be less than MAXVALUE
create sequence s1  maxvalue 1 nominvalue;
ERROR HY000: MINVALUE must be less than MAXVALUE
create sequence s1  minvalue -1 increment by -1 start with 10;
ERROR HY000: MINVALUE must be less than MAXVALUE
create sequence s1 minvalue 1 maxvalue 10 start with 1 increment by 10;
ERROR HY000: INCREMENT must be less than MAXVALUE minus MINVALUE
create sequence s1 minvalue 1 maxvalue 10 start with 1 increment by 11;
ERROR HY000: INCREMENT must be less than MAXVALUE minus MINVALUE
create sequence s1 minvalue 1 maxvalue 10 start with 1 increment by -10;
ERROR HY000: INCREMENT must be less than MAXVALUE minus MINVALUE
create sequence s1 minvalue 1 maxvalue 10 start with 1 increment by -11;
ERROR HY000: INCREMENT must be less than MAXVALUE minus MINVALUE
create sequence s1 increment by 0;
ERROR HY000: INCREMENT must be a nonzero integer
create sequence a4 minvalue -3 cycle increment by -1;
ERROR HY000: number to CACHE must be less than one cycle
create sequence a4 nominvalue cycle increment by -1;
ERROR HY000: descending sequences that CYCLE must specify MINVALUE
create sequence a4 minvalue -3 cycle increment by 1 cache 2;
ERROR HY000: ascending sequences that CYCLE must specify MAXVALUE
create sequence a4 start with 10 minvalue 11;
ERROR HY000: START WITH cannot be less than MINVALUE
create sequence a4 start with 10 maxvalue 9;
ERROR HY000: START WITH cannot be more than MAXVALUE
create sequence a4 minvalue 0 maxvalue 10 cache -1;
ERROR HY000: the number of values to CACHE must be greater than 1
create sequence ok start with 1 cache 1 minvalue 0 maxvalue 100;
ERROR HY000: the number of values to CACHE must be greater than 1
create sequence ok start with 1 nocache minvalue 0 maxvalue 100;
create table t_s (i int primary key, j int);
create table t_p (i int primary key, j int) partition by hash(i) partitions 3;
######### select error test ##########
select ok.nextval, ok.currval, ok.nextval from t_s order by 1;
ERROR HY000: sequence number not allowed here
select * from t_s order by ok.nextval;
ERROR HY000: sequence number not allowed here
select * from t_s where i = ok.nextval;
ERROR HY000: sequence number not allowed here
select * from t_s group by i + ok.nextval;
ERROR HY000: sequence number not allowed here
select * from t_s where i in (select ok.nextval from t_p);
ERROR HY000: sequence number not allowed here
create view nextval_view as select ok.nextval ;
ERROR HY000: sequence number not allowed here
#########  OK test ##########
insert into t_s values (ok.nextval, 1);
insert into t_s values (ok.nextval, 2);
insert into t_p values (ok.nextval, 1);
insert into t_p values (ok.nextval, 2);
insert into t_p values (100, ok.nextval);
insert into t_p values (101, ok.nextval);
update t_s set i = ok.nextval, j = ok.currval;
update t_p set i = ok.nextval, j = ok.currval;
select * from t_s order by 1;
+---+------+
| i | j    |
+---+------+
| 7 |    7 |
| 8 |    8 |
+---+------+
select * from t_p order by 1;
+----+------+
| i  | j    |
+----+------+
|  9 |    9 |
| 10 |   10 |
| 11 |   11 |
| 12 |   12 |
+----+------+
select ok.nextval ;
+---------+
| nextval |
+---------+
|      13 |
+---------+
select ok.nextval ;
+---------+
| nextval |
+---------+
|      14 |
+---------+
select ok.nextval ;
+---------+
| nextval |
+---------+
|      15 |
+---------+
select ok.nextval, ok.currval, ok.nextval ;
+---------+---------+---------+
| nextval | currval | nextval |
+---------+---------+---------+
|      16 |      16 |      16 |
+---------+---------+---------+
select ok.nextval from t_s;
+---------+
| nextval |
+---------+
|      17 |
|      18 |
+---------+
######### quick explain test ##########
explain basic select ok.nextval, i from t_p;
Query Plan
=========================================
|ID|OPERATOR                   |NAME    |
-----------------------------------------
|0 |SEQUENCE                   |        |
|1 |└─PX COORDINATOR           |        |
|2 |  └─EXCHANGE OUT DISTR     |:EX10000|
|3 |    └─PX PARTITION ITERATOR|        |
|4 |      └─TABLE FULL SCAN    |t_p     |
=========================================
Outputs & filters:
-------------------------------------
  0 - output([ok.nextval], [t_p.i]), filter(nil)
  1 - output([t_p.i]), filter(nil), rowset=16
  2 - output([t_p.i]), filter(nil), rowset=16
      dop=1
  3 - output([t_p.i]), filter(nil), rowset=16
      force partition granule
  4 - output([t_p.i]), filter(nil), rowset=16
      access([t_p.i]), partitions(p[0-2])
      is_index_back=false, is_global_index=false, 
      range_key([t_p.i]), range(MIN ; MAX)always true
explain basic select ok.currval, i from t_p;
Query Plan
=========================================
|ID|OPERATOR                   |NAME    |
-----------------------------------------
|0 |SEQUENCE                   |        |
|1 |└─PX COORDINATOR           |        |
|2 |  └─EXCHANGE OUT DISTR     |:EX10000|
|3 |    └─PX PARTITION ITERATOR|        |
|4 |      └─TABLE FULL SCAN    |t_p     |
=========================================
Outputs & filters:
-------------------------------------
  0 - output([ok.currval], [t_p.i]), filter(nil)
  1 - output([t_p.i]), filter(nil), rowset=16
  2 - output([t_p.i]), filter(nil), rowset=16
      dop=1
  3 - output([t_p.i]), filter(nil), rowset=16
      force partition granule
  4 - output([t_p.i]), filter(nil), rowset=16
      access([t_p.i]), partitions(p[0-2])
      is_index_back=false, is_global_index=false, 
      range_key([t_p.i]), range(MIN ; MAX)always true
drop sequence large_seq_fail;
drop sequence large_seq1;
drop sequence large_seq2;
create sequence large_seq_fail minvalue 4611686018427387904 maxvalue 4611686018427387935;
drop sequence large_seq_fail;
create sequence large_seq_fail minvalue -4611686018427387905 increment by -1;
drop sequence large_seq_fail;
create sequence large_seq_fail maxvalue 4611686018427387904 increment by 1;
drop sequence large_seq_fail;
create sequence large_seq1 minvalue -4611686018427387904 increment by -1;
create sequence large_seq2 maxvalue 4611686018427387903 increment by 1;
alter sequence large_seq1 minvalue -4611686018427387904 increment by -1;
alter sequence large_seq2 maxvalue 4611686018427387903 increment by 1;
drop sequence large_seq2;
drop sequence large_seq1;
########清空回收站，删除测试数据库，表等 ##########
drop database  IF EXISTS  oblrp;
purge recyclebin;
