drop database if exists pi1;
create database pi1;
use pi1;
#pi-1-1 有参数
select pi(1);
ERROR 42000: Incorrect parameter count in the call to native function 'pi'
select pi('a');
ERROR 42000: Incorrect parameter count in the call to native function 'pi'
select pi('*');
ERROR 42000: Incorrect parameter count in the call to native function 'pi'
#pi-1-2 无参数
select pi();
pi()
3.141593
#pi-2-1-1 select 精准位数查询
select     pi()    +    0.000000;
pi()    +    0.000000
3.141593
select     pi()    +    0.0000000;
pi()    +    0.0000000
3.1415927
select     pi()    +    0.00000000;
pi()    +    0.00000000
3.14159265
select     pi()    +    0.000000000;
pi()    +    0.000000000
3.141592654
select     pi()    +    0.0000000000;
pi()    +    0.0000000000
3.1415926536
#最高到11位
select     pi()    +    0.00000000000;
pi()    +    0.00000000000
3.14159265359
create table t1 (id int,name char(20),yy double);
insert into t1 values (1,'zhangsan',pi()),(1,'lisi',3.13999),(2,'wangwu',3.15000),(2,'maliu',3);
insert into t1 values (3,'zhangsan',3.5),(3,'lisi',pi()),(4,'wangwu',pi()),(4,'maliu',pi());
insert into t1 values (5,'zhangsan',3.00),(5,'lisi',3.15),(6,'wangwu',pi()),(6,'maliu',2.9999);
# pi-2-1-2  where
select   *   from   t1   where   yy   =    pi()  order  by  pi()  desc limit 0,1;
id	name	yy
1	zhangsan	3.141592653589793
select   *   from   t1   where   yy   >    pi()  order  by  pi()  asc  limit 1,3;
id	name	yy
3	zhangsan	3.5
5	lisi	3.15
select   *   from   t1   where   yy   >=   pi()  order  by  pi()  desc limit 0,10;
id	name	yy
1	zhangsan	3.141592653589793
2	wangwu	3.15
3	zhangsan	3.5
3	lisi	3.141592653589793
4	wangwu	3.141592653589793
4	maliu	3.141592653589793
5	lisi	3.15
6	wangwu	3.141592653589793
select   *   from   t1   where   yy   <    pi()  order  by  pi()  desc limit 0,5;
id	name	yy
1	lisi	3.13999
2	maliu	3
5	zhangsan	3
6	maliu	2.9999
select   *   from   t1   where   yy   <=   pi()  order  by  pi()  asc  limit 1,2;
id	name	yy
1	lisi	3.13999
2	maliu	3
select   *   from   t1   where   yy   !=   pi()  order  by  pi()  desc limit 0,3;
id	name	yy
1	lisi	3.13999
2	wangwu	3.15
2	maliu	3
select   *   from   t1   where   yy   <>   pi()  order  by  pi()  asc  limit 0,2;
id	name	yy
1	lisi	3.13999
2	wangwu	3.15
# pi-2-1-3  order by
select * from t1 where yy != pi() and id >1 order by pi() asc limit 0,4;
id	name	yy
2	wangwu	3.15
2	maliu	3
3	zhangsan	3.5
5	zhangsan	3
select * from t1 where yy != pi() order by pi() desc limit 0,5;
id	name	yy
1	lisi	3.13999
2	wangwu	3.15
2	maliu	3
3	zhangsan	3.5
5	zhangsan	3
# pi-2-1-4 group by
select * from t1 where id > 1 group by pi();
id	name	yy
2	wangwu	3.15
select name,yy,id from t1 group by pi() order by yy asc;
name	yy	id
zhangsan	3.141592653589793	1
select * from t1 where yy > pi() group by id order by pi();
id	name	yy
2	wangwu	3.15
3	zhangsan	3.5
5	lisi	3.15
# pi-2-1-5 group by having
select name,yy,id from t1 group by id having yy!=pi() order by yy;
name	yy	id
zhangsan	3	5
wangwu	3.15	2
zhangsan	3.5	3
select * from t1 where  yy !=  pi()  group by id having yy<pi() order by pi();
id	name	yy
1	lisi	3.13999
5	zhangsan	3
6	maliu	2.9999
# pi-2-1-6 like
select   *   from   t1   where   yy   like  '3.%'  order  by  pi()  asc  limit 1,1;
id	name	yy
1	lisi	3.13999
select   *   from   t1   where   yy   like  '%14%' order  by  pi()  desc limit 0,5;
id	name	yy
1	zhangsan	3.141592653589793
3	lisi	3.141592653589793
4	wangwu	3.141592653589793
4	maliu	3.141592653589793
6	wangwu	3.141592653589793
select   *   from   t1   where   yy   like  'pi()' order  by  pi()  asc  limit 1,3;
id	name	yy
drop table t1;
# case when
create table t1(c1 int,c2 double,c3 float);
insert into t1 values(1,pi(),3.1),(2,3.1415,pi()),(3,2.9999,3.1415),(4,pi(),pi());
select c1,c2,c3,case c3 when pi() then 3.15159 else pi() end as new_c3 from  t1;
c1	c2	c3	new_c3
1	3.141592653589793	3.1	3.141593
2	3.1415	3.14159	3.141593
3	2.9999	3.1415	3.141593
4	3.141592653589793	3.14159	3.141593
select c1,c2,c3,case when c2=pi() then 1 else 0 end as new_c2 from t1;
c1	c2	c3	new_c2
1	3.141592653589793	3.1	1
2	3.1415	3.14159	0
3	2.9999	3.1415	0
4	3.141592653589793	3.14159	1
select c1,c2,c3,case when c3>=pi() and c3<3.1416 then 1 else 0 end as new_c3 from t1;
c1	c2	c3	new_c3
1	3.141592653589793	3.1	0
2	3.1415	3.14159	1
3	2.9999	3.1415	0
4	3.141592653589793	3.14159	1
drop table t1;
# pi-2-2-1 insert int 类型
create   table   t1   (a int);
insert   into    t1   values   (pi());
select    *      from    t1;
a
3
drop     table   t1;
# pi-2-2-2  double 类型
create   table   t1   (a double);
insert   into    t1   VALUES   (pi());
SELECT    *      FROM    t1;
a
3.141592653589793
drop     table   t1;
# pi-2-2-3  float 类型
create   table   t1   (a float);
insert   into    t1   VALUES   (pi());
SELECT    *      FROM    t1;
a
3.14159
drop     table   t1;
# pi-2-2-4  char类型 BUG 
# pi-2-2-5  varchar类型 BUG 
# pi-2-2-6  date类型
create   table   t1   (a date);
insert   into    t1   VALUES  (pi());
ERROR 22007: Incorrect datetime value for column 'a' at row 1
drop     table   t1;
# pi-2-2-7  time类型
create   table   t1   (a time);
insert   into    t1   VALUES   (pi());
SELECT    *      FROM    t1;
a
00:00:03
drop     table   t1;
# datatime类型
create   table   t1   (a datetime);
insert   into    t1   VALUES  (pi());
ERROR 22007: Incorrect datetime value for column 'a' at row 1
drop     table   t1;
# timestamp类型
create   table   t1   (a timestamp);
insert   into    t1   VALUES  (pi());
ERROR 22007: Incorrect datetime value for column 'a' at row 1
drop     table   t1;
# year类型
create   table   t1   (a timestamp);
insert   into    t1   VALUES  (pi());
ERROR 22007: Incorrect datetime value for column 'a' at row 1
drop     table   t1;
#  bit类型
create   table   t1   (a bit);
insert   into    t1   VALUES  (pi());
ERROR 22001: Data too long for column 'a' at row 1
drop     table   t1;
create table t1(id int,name char(20),yy double);
insert into t1 values (1,'zhangsan',pi()),(1,'lisi',pi()),(2,'wangwu',pi()),(2,'maliu',pi());
select  *  from  t1;
id	name	yy
1	zhangsan	3.141592653589793
1	lisi	3.141592653589793
2	wangwu	3.141592653589793
2	maliu	3.141592653589793
#pi-2-3-1    update 单列
update   t1  set   yy  =  3  where  yy  =  pi() limit 1;
select * from t1;
id	name	yy
1	zhangsan	3
1	lisi	3.141592653589793
2	wangwu	3.141592653589793
2	maliu	3.141592653589793
update   t1  set   yy  =  3  where  yy  =  pi()  and  name  =  'zhangsan';
select  *  from  t1;
id	name	yy
1	zhangsan	3
1	lisi	3.141592653589793
2	wangwu	3.141592653589793
2	maliu	3.141592653589793
# pi-2-3-2    多列
update   t1  set   yy  = 3;
select * from  t1;
id	name	yy
1	zhangsan	3
1	lisi	3
2	wangwu	3
2	maliu	3
update   t1  set   yy  =  pi();
select  *  from  t1;
id	name	yy
1	zhangsan	3.141592653589793
1	lisi	3.141592653589793
2	wangwu	3.141592653589793
2	maliu	3.141592653589793
# pi-2-4-1    delete 单行
delete   from  t1  where  yy  =  pi() and name = 'maliu';
select  *  from  t1;
id	name	yy
1	zhangsan	3.141592653589793
1	lisi	3.141592653589793
2	wangwu	3.141592653589793
# pi-2-4-2    多行
delete   from  t1  where  yy  =  pi();
select  *  from  t1;
id	name	yy
# pi-2-5      truncate
insert into t1 values (1,'zhangsan',pi()),(1,'lisi',pi()),(2,'wangwu',pi()),(2,'maliu',pi());
truncate t1;
select   *   from   t1;
id	name	yy
desc  t1;
Field	Type	Null	Key	Default	Extra
id	int(11)	YES		NULL	
name	char(20)	YES		NULL	
yy	double	YES		NULL	
# pi-2-6      replace
replace   into  t1  values  (1,'zhangsan',pi());
replace   into  t1  (id,name,yy)  values  (1,'zhangsan',pi());
drop table  t1;
#   pi-3-1视图  select 
create   table  t1  (id int,name char(20),yy double);
create   view   v1   as   select   *   from   t1;
insert   into   v1   values   (1,'zhangsan',pi()),(1,'lisi',3.13999),(2,'wangwu',3.15000),(2,'maliu',3);
select    *     from   v1;
id	name	yy
1	zhangsan	3.141592653589793
1	lisi	3.13999
2	wangwu	3.15
2	maliu	3
#  pi-3-1-2    where
select   *   from   v1   where   yy   =   pi() order  by  yy  desc limit 0,1;
id	name	yy
1	zhangsan	3.141592653589793
select   *   from   v1   where   yy   >   pi() order  by  yy  asc  limit 0,5 ;
id	name	yy
2	wangwu	3.15
select   *   from   v1   where   yy   <   pi() order  by  yy  asc  limit 1,3;
id	name	yy
1	lisi	3.13999
select   *   from   v1   where   yy   !=  pi() order  by  yy  desc limit 0,2;
id	name	yy
2	wangwu	3.15
1	lisi	3.13999
# pi-3-1-3    order by
select * from v1 where yy != pi() order by pi() asc limit 0,10;
id	name	yy
1	lisi	3.13999
2	wangwu	3.15
2	maliu	3
select * from v1 where yy != pi() order by pi() desc limit 1,5;
id	name	yy
2	wangwu	3.15
2	maliu	3
# pi-2-1-4 group by
select name,yy,id from v1 group by id order by pi() asc limit 0,2;
name	yy	id
zhangsan	3.141592653589793	1
wangwu	3.15	2
# pi-2-1-5 group by having
select name,yy,id from v1 group by id having yy!=pi() order by pi();
name	yy	id
wangwu	3.15	2
# pi-2-1-6 like
select   *   from   v1   where   yy   like  '3.%'  order  by  pi()  desc limit 0,1;
id	name	yy
1	zhangsan	3.141592653589793
select   *   from   v1   where   yy   like  '%14%' order  by  pi()  asc limit 0,10;
id	name	yy
1	zhangsan	3.141592653589793
select   *   from   v1   where   yy   like  'pi()' order  by  pi()  desc limit 1,3;
id	name	yy
drop   table   t1;
drop   view    v1;
# pi-3-2-1     int类型
create   table   t1   (a int , b int , c int );
create   view    v1   as   select  *  from  t1;
insert   into    v1   values   (pi(),pi()+pi(),pi()*pi()-pi());
select    *      from    v1;
a	b	c
3	6	7
drop     table   t1;
drop     view    v1;
#  pi-3-2-2    double  类型
create   table   t1   (a double , b double ,c double);
create   view    v1   as   select  *  from  t1;
insert   into    v1   values   (pi(), pi()/pi(),pi()/pi()+pi());
select    *      from    v1;
a	b	c
3.141592653589793	1	4.141592653589793
drop     table   t1;
drop     view    v1;
#  pi-3-2-3     float  类型
create   table   t1   (a float , b float , c float);
create   view    v1   as   select  *  from  t1;
insert   into    v1   values   (1-pi(),pi(),2*pi());
select    *      from    v1;
a	b	c
-2.14159	3.14159	6.28319
drop     table   t1;
drop     view    v1;
#  pi-3-2-4      char类型
create   table   t1   (a char(30) , b char(30), c char(30));
create   view    v1   as   select  *  from  t1;
insert   into    v1   values   (pi(),'1+pi()','a+pi()');
select    *      from    v1;
a	b	c
3.141593	1+pi()	a+pi()
drop     table   t1;
drop     view    v1;
#  pi-3-2-5      varchar类型
create   table   t1   (a varchar(60),b varchar(60),c varchar(60));
create   view    v1   as   select  *  from  t1;
insert   into    v1   values   (pi()+pi(),pi(),'pi()+pi()');
select    *      from    v1;
a	b	c
6.283185	3.141593	pi()+pi()
drop     table   t1;
drop     view    v1;
#  pi-3-2-6      date类型
create   table   t1   (a date);
create   view    v1   as   select  *  from  t1;
insert   into    v1   values   (pi());
ERROR 22007: Incorrect datetime value for column 'a' at row 1
drop     table   t1;
drop     view    v1;
#  pi-3-2-7      time类型
create   table   t1   (a time);
create   view    v1   as   select  *  from  t1;
insert   into    v1   values   (pi());
select    *      from    v1;
a
00:00:03
drop     table   t1;
drop     view    v1;
create table t1(id int,name char(20),yy double);
create view  v1 as select * from t1;
insert into v1 values (1,'zhangsan',pi()),(1,'lisi',pi()),(2,'wangwu',3.14),(2,'maliu',pi());
select  *  from  v1;
id	name	yy
1	zhangsan	3.141592653589793
1	lisi	3.141592653589793
2	wangwu	3.14
2	maliu	3.141592653589793
# pi-3-3-1 update   单列
update   v1  set   yy  =  3  where  yy  =  pi()  and  name  =  'zhangsan';
select  *  from  v1;
id	name	yy
1	zhangsan	3
1	lisi	3.141592653589793
2	wangwu	3.14
2	maliu	3.141592653589793
# pi-3-3-2  多列
update   v1  set   yy  =  pi();
select  *  from  v1;
id	name	yy
1	zhangsan	3.141592653589793
1	lisi	3.141592653589793
2	wangwu	3.141592653589793
2	maliu	3.141592653589793
# pi-3-4-1    delete 单行
delete   from  v1  where  yy  =  pi() and name = 'maliu';
select  *  from  v1;
id	name	yy
1	zhangsan	3.141592653589793
1	lisi	3.141592653589793
2	wangwu	3.141592653589793
# pi-3-4-2    多行
delete   from  v1  where  yy  =  pi();
select  *  from  v1;
id	name	yy
# pi-3-5      truncate
insert into v1 values (1,'zhangsan',pi()),(1,'lisi',pi()),(2,'wangwu',pi()),(2,'maliu',pi());
truncate v1;
ERROR 42S02: Table 'pi1.v1' doesn't exist
select   *   from   v1;
id	name	yy
1	zhangsan	3.141592653589793
1	lisi	3.141592653589793
2	wangwu	3.141592653589793
2	maliu	3.141592653589793
desc  v1;
Field	Type	Null	Key	Default	Extra
id	int(11)	YES		NULL	
name	char(20)	YES		NULL	
yy	double	YES		NULL	
# pi-3-6      replace
replace   into  v1  values  (1,'zhangsan',pi());
replace   into  v1  (id,name,yy)  values  (1,'zhangsan',pi());
drop  table  t1;
drop  view   v1;
create   table t1   (id int,yy double);
insert   into  t1   values(1,pi()),(2,3.1415),(3,3.1399),(4,3),(5,pi());
create   table t2   (tid int,name char(20));
insert   into  t2   values(1,'zhangsan'),(2,'wangwu'),(3,'maliu'),(4,'tianqi');
select * from t1,t2 where t1.id=t2.tid;
id	yy	tid	name
1	3.141592653589793	1	zhangsan
2	3.1415	2	wangwu
3	3.1399	3	maliu
4	3	4	tianqi
# pi-3-7 多表查询  3-7-1 join on
select * from t1 inner join t2 on t1.id = t2.tid;
id	yy	tid	name
1	3.141592653589793	1	zhangsan
2	3.1415	2	wangwu
3	3.1399	3	maliu
4	3	4	tianqi
select * from t1 inner join t2 on t1.id = t2.tid order by pi();
id	yy	tid	name
1	3.141592653589793	1	zhangsan
2	3.1415	2	wangwu
3	3.1399	3	maliu
4	3	4	tianqi
select * from t1 inner join t2 on t1.id = t2.tid where yy<pi() order by pi() asc;
id	yy	tid	name
2	3.1415	2	wangwu
3	3.1399	3	maliu
4	3	4	tianqi
select * from t1 inner join t2 on t1.id = t2.tid group by pi() order by pi() desc;
id	yy	tid	name
1	3.141592653589793	1	zhangsan
select * from t1 inner join t2 on t1.id = t2.tid where yy!=pi() group by pi() order by pi() asc;
id	yy	tid	name
2	3.1415	2	wangwu
select * from t1 inner join t2 on t1.id = t2.tid where id<pi() group by id having yy<pi() order by pi() desc;
id	yy	tid	name
2	3.1415	2	wangwu
3	3.1399	3	maliu
#  pi-3-7-2    left join
select * from t1 left join t2 on t1.id = t2.tid;
id	yy	tid	name
1	3.141592653589793	1	zhangsan
2	3.1415	2	wangwu
3	3.1399	3	maliu
4	3	4	tianqi
5	3.141592653589793	NULL	NULL
select * from t1 left join t2 on t1.id = t2.tid order by pi();
id	yy	tid	name
1	3.141592653589793	1	zhangsan
2	3.1415	2	wangwu
3	3.1399	3	maliu
4	3	4	tianqi
5	3.141592653589793	NULL	NULL
select * from t1 left join t2 on t1.id = t2.tid where id<pi() order by pi() asc;
id	yy	tid	name
1	3.141592653589793	1	zhangsan
2	3.1415	2	wangwu
3	3.1399	3	maliu
select * from t1 left join t2 on t1.id = t2.tid group by pi() order by pi() desc;
id	yy	tid	name
1	3.141592653589793	1	zhangsan
select * from t1 left join t2 on t1.id = t2.tid where yy<>pi() group by pi() order by pi() asc;
id	yy	tid	name
2	3.1415	2	wangwu
select * from t1 left join t2 on t1.id = t2.tid where yy<pi() group by id having yy<pi() order by pi() desc;
id	yy	tid	name
2	3.1415	2	wangwu
3	3.1399	3	maliu
4	3	4	tianqi
#  pi-3-7-3    right join
select * from t1 right join t2 on t1.id = t2.tid;
id	yy	tid	name
1	3.141592653589793	1	zhangsan
2	3.1415	2	wangwu
3	3.1399	3	maliu
4	3	4	tianqi
select * from t1 right join t2 on t1.id = t2.tid order by pi();
id	yy	tid	name
1	3.141592653589793	1	zhangsan
2	3.1415	2	wangwu
3	3.1399	3	maliu
4	3	4	tianqi
select * from t1 right join t2 on t1.id = t2.tid where yy<pi() order by pi() asc;
id	yy	tid	name
2	3.1415	2	wangwu
3	3.1399	3	maliu
4	3	4	tianqi
select * from t1 right join t2 on t1.id = t2.tid group by pi() order by pi() desc;
id	yy	tid	name
1	3.141592653589793	1	zhangsan
select * from t1 right join t2 on t1.id = t2.tid where yy!=pi() group by pi() order by pi() asc;
id	yy	tid	name
2	3.1415	2	wangwu
select * from t1 right join t2 on t1.id = t2.tid where id<pi() group by id having yy<>pi() order by pi() desc;
id	yy	tid	name
2	3.1415	2	wangwu
3	3.1399	3	maliu
#  pi-3-7-4    full join  #mysql不支持 ob支持
select * from t1 full  join t2 on t1.id = t2.tid;
id	yy	tid	name
1	3.141592653589793	1	zhangsan
2	3.1415	2	wangwu
3	3.1399	3	maliu
4	3	4	tianqi
5	3.141592653589793	NULL	NULL
drop tables t1,t2;
create table t1(id int,yy double);
insert into t1 values(1,pi()),(2,3.6),(3,3.1399);
create table t2(tid int,name char(20));
insert into t2 values(1,'zhangsan'),(2,'wangwu'),(3,'maliu');
#  pi-3-8 子查询 3-8-1  带in关键字子查询
select  *  from  t2  where  tid  in (select  id  from  t1  where  yy  <  pi());
tid	name
3	maliu
#  pi-3-8-2   带比较运算符的子查询
select  name  from  t2  where  tid  =   (select  id  from  t1  where  yy  =  pi()) order by tid desc limit 0,1;
name
zhangsan
select  name  from  t2  where  tid  >   (select  id  from  t1  where  yy  >  pi()) order by tid asc limit 0,3 ;
name
maliu
select  name  from  t2  where  tid  <   (select  id  from  t1  where  yy  <  pi()) order by tid desc limit 0,1 ;
name
wangwu
select  name  from  t2  where  tid  >=  (select  id  from  t1  where  yy  <  pi()) order by tid desc limit 0,4;
name
maliu
select  name  from  t2  where  tid  <=  (select  id  from  t1  where  yy  >  pi()) order by tid asc  limit 0,1;
name
zhangsan
select  name  from  t2  where  tid  !=  (select  id  from  t1  where  yy  =  pi()) order by tid asc limit 0,1;
name
wangwu
select  name  from  t2  where  tid  <>  (select  id  from  t1  where  yy  =  pi()) order by tid desc limit 0,2;
name
maliu
wangwu
#  pi-3-8-3   带exists的子查询
select  *  from  t2  where  exists (select  id  from  t1  where yy  <  pi()) order by tid desc limit 0,2;
tid	name
3	maliu
2	wangwu
#  pi-3-8-4   带any的子查询
select  *  from  t2  where  tid  >  any  (select  id  from  t1  where  yy  <  pi()) order by tid asc limit 0,1;
tid	name
drop tables t1,t2;
#  pi-4 函数嵌套  4-1 concat
select  concat  (pi(),atan(1));
concat  (pi(),atan(1))
3.1415930.7853981633974483
select  concat  (pi(),'abc');
concat  (pi(),'abc')
3.141593abc
select  concat  (pi(),123);
concat  (pi(),123)
3.141593123
select  concat  (pi(),'++');
concat  (pi(),'++')
3.141593++
select  concat  (pi(),'张');
concat  (pi(),'张')
3.141593张
select  concat  (pi()+pi()*1000,atan(1)+floor(pi()));
concat  (pi()+pi()*1000,atan(1)+floor(pi()))
3144.73424624338263.7853981633974483
select  concat  (pi()+atan(1)+123,'abc'+'张');
concat  (pi()+atan(1)+123,'abc'+'张')
126.926990816987240
Warnings:
Warning	1292	Truncated incorrect DOUBLE value: 'abc'
Warning	1292	Truncated incorrect DOUBLE value: '张'
#  pi-4-3 ceil
select  ceil(pi());
ceil(pi())
4
select  ceil(pi()+atan(pi()));
ceil(pi()+atan(pi()))
5
select  ceil(pi()*pi()*1000%pi()-pi()+pi());
ceil(pi()*pi()*1000%pi()-pi()+pi())
2
select  ceil(concat  (pi()+pi()*1000,atan(1)+floor(pi())));
ceil(concat  (pi()+pi()*1000,atan(1)+floor(pi())))
3145
Warnings:
Warning	1292	Truncated incorrect DOUBLE value: '3144.73424624338263.7853981633974483'
#  pi-4-4 round
select  round(pi());
round(pi())
3
select  round(pi()+ceil(pi()));
round(pi()+ceil(pi()))
7
select  round(pi()*atan(pi())*10000+pi()%pi()-pi());
round(pi()*atan(pi())*10000+pi()%pi()-pi())
39663
select  round(concat  (pi()+atan(1)+123,'abc'+'张'));
round(concat  (pi()+atan(1)+123,'abc'+'张'))
127
Warnings:
Warning	1292	Truncated incorrect DOUBLE value: 'abc'
Warning	1292	Truncated incorrect DOUBLE value: '张'
#  pi-4-5 floor
select  floor(pi());
floor(pi())
3
select  floor(pi()+ceil(pi())-round(pi()));
floor(pi()+ceil(pi())-round(pi()))
4
select  floor(pi()*ceil(pi())+atan(pi())*pi()-pi()%round(pi()));
floor(pi()*ceil(pi())+atan(pi())*pi()-pi()%round(pi()))
16
select  floor(concat((pi()*pi()*1000%pi()-pi()+pi()),(pi()*atan(pi())*10000+pi()%pi()-pi())));
floor(concat((pi()*pi()*1000%pi()-pi()+pi()),(pi()*atan(pi())*10000+pi()%pi()-pi())))
1
Warnings:
Warning	1292	Truncated incorrect DOUBLE value: '1.861876163818184439663.46351397751'
#  pi-4-6 cast
select  cast(pi() as int);
ERROR 42000: You have an error in your SQL syntax; check the manual that corresponds to your OceanBase version for the right syntax to use near 'int)' at line 1
#mysql执行结果报错,OB执行成功
select  cast(pi() as double);
cast(pi() as double)
3.141592653589793
select  cast(pi() as float);
cast(pi() as float)
3.14159
select  cast(pi() as varchar);
ERROR 42000: You have an error in your SQL syntax; check the manual that corresponds to your OceanBase version for the right syntax to use near 'varchar)' at line 1
select  cast(pi() as char);
cast(pi() as char)
3.141593
select  cast(pi()+pi()*pi()*10000 as char);
cast(pi()+pi()*pi()*10000 as char)
98699.18560354716
select  cast(pi() as date);
cast(pi() as date)
NULL
select  cast(pi() as datetime);
cast(pi() as datetime)
NULL
select  cast(pi() as timestamp);
ERROR 42000: You have an error in your SQL syntax; check the manual that corresponds to your OceanBase version for the right syntax to use near 'timestamp)' at line 1
select  cast(pi() as year);
cast(pi() as year)
2003
select  cast(pi() as bit);
ERROR 42000: You have an error in your SQL syntax; check the manual that corresponds to your OceanBase version for the right syntax to use near 'bit)' at line 1
select  cast(pi() as decimal);
cast(pi() as decimal)
3
select  cast(pi()*atan(pi())+floor(pi()) as date);
cast(pi()*atan(pi())+floor(pi()) as date)
NULL
select  cast(pi() as time);
cast(pi() as time)
00:00:03
select  cast(pi()+concat  (pi()+pi()*1000,atan(1)+floor(pi())) as time);
cast(pi()+concat  (pi()+pi()*1000,atan(1)+floor(pi())) as time)
00:31:48
Warnings:
Warning	1292	Truncated incorrect DOUBLE value: '3144.73424624338263.7853981633974483'
#  pi-4-7 abs
select  abs(pi());
abs(pi())
3.141593
select  abs(pi()-pi()-pi());
abs(pi()-pi()-pi())
3.141593
select  abs(-pi());
abs(-pi())
3.141593
select  abs(cast(pi()+pi()*pi()*10000 as char));
abs(cast(pi()+pi()*pi()*10000 as char))
98699.18560354716
select  abs(-ceil(concat  (pi()+pi()*1000,atan(1)+floor(pi()))));
abs(-ceil(concat  (pi()+pi()*1000,atan(1)+floor(pi()))))
3145
Warnings:
Warning	1292	Truncated incorrect DOUBLE value: '3144.73424624338263.7853981633974483'
select  abs(-floor(concat((pi()*pi()*1000%pi()-pi()+pi()),(pi()*atan(pi())*10000+pi()%pi()-pi()))));
abs(-floor(concat((pi()*pi()*1000%pi()-pi()+pi()),(pi()*atan(pi())*10000+pi()%pi()-pi()))))
1
Warnings:
Warning	1292	Truncated incorrect DOUBLE value: '1.861876163818184439663.46351397751'
#  pi-4-8 
select substr(pi(),6);
substr(pi(),6)
593
select substr(pi()+abs(-ceil(concat  (pi()+pi()*1000,atan(1)+floor(pi())))),10);
substr(pi()+abs(-ceil(concat  (pi()+pi()*1000,atan(1)+floor(pi())))),10)
93
Warnings:
Warning	1292	Truncated incorrect DOUBLE value: '3144.73424624338263.7853981633974483'
select substr(pi(),3,6);
substr(pi(),3,6)
141593
select substr(pi()*cast(pi()+concat  (pi()+pi()*1000,atan(1)+floor(pi())) as time),1,100);
substr(pi()*cast(pi()+concat  (pi()+pi()*1000,atan(1)+floor(pi())) as time),1,100)
9889.733673500668
Warnings:
Warning	1292	Truncated incorrect DOUBLE value: '3144.73424624338263.7853981633974483'
select substr(floor(concat((pi()*pi()*1000%pi()-pi()+pi()),(pi()*atan(pi())*10000+pi()%pi()-pi()))),1);
substr(floor(concat((pi()*pi()*1000%pi()-pi()+pi()),(pi()*atan(pi())*10000+pi()%pi()-pi()))),1)
1
Warnings:
Warning	1292	Truncated incorrect DOUBLE value: '1.861876163818184439663.46351397751'
#  pi-4-9
select hex(pi());
hex(pi())
3
select mod(pi(),3);
mod(pi(),3)
0.141593
create  table  t1  (c1  int,c2 char(20),c3 double);
insert  into  t1  values  (1,'abc',pi()),(2,'张',pi()*ceil(pi())),(3,'123',pi()*1000),(4,'a1b2c3',abs(-pi()*atan(pi()))),(5,'a王1',pi());
#  pi4-10 聚合函数 4-10-1  sum
select  sum(c1),sum(c2),sum(c3)   from  t1;
sum(c1)	sum(c2)	sum(c3)
15	123	3164.4088700219945
Warnings:
Warning	1292	Truncated incorrect DOUBLE value: 'abc'
Warning	1292	Truncated incorrect DOUBLE value: '张'
Warning	1292	Truncated incorrect DOUBLE value: 'a1b2c3'
Warning	1292	Truncated incorrect DOUBLE value: 'a王1'
select  sum(c1+c2+c3) from t1;
sum(c1+c2+c3)
3302.4088700219945
Warnings:
Warning	1292	Truncated incorrect DOUBLE value: 'abc'
Warning	1292	Truncated incorrect DOUBLE value: '张'
Warning	1292	Truncated incorrect DOUBLE value: 'a1b2c3'
Warning	1292	Truncated incorrect DOUBLE value: 'a王1'
select  sum(pi()) from t1;
sum(pi())
15.707963
select  sum(pi()+ceil(pi())+atan(pi())+floor(pi()));
sum(pi()+ceil(pi())+atan(pi())+floor(pi()))
11.404219909268704
select  sum(floor(concat((pi()*pi()*1000%pi()-pi()+pi())+(pi()*atan(pi())*10000+pi()%pi()-pi()))));
sum(floor(concat((pi()*pi()*1000%pi()-pi()+pi())+(pi()*atan(pi())*10000+pi()%pi()-pi()))))
39665
#  pi4-10-2 avg
select  avg(c1),avg(c2),avg(c3) from t1;
avg(c1)	avg(c2)	avg(c3)
3.0000	24.6	632.881774004399
Warnings:
Warning	1292	Truncated incorrect DOUBLE value: 'abc'
Warning	1292	Truncated incorrect DOUBLE value: '张'
Warning	1292	Truncated incorrect DOUBLE value: 'a1b2c3'
Warning	1292	Truncated incorrect DOUBLE value: 'a王1'
select  avg(pi()) from t1;
avg(pi())
3.1415926536
select  avg(pi()+atan(pi())+ceil(pi())+floor(pi()));
avg(pi()+atan(pi())+ceil(pi())+floor(pi()))
11.404219909268704
select  avg(abs(-floor(concat((pi()*pi()*1000%pi()-pi()+pi()),(pi()*atan(pi())*10000+pi()%pi()-pi())))));
avg(abs(-floor(concat((pi()*pi()*1000%pi()-pi()+pi()),(pi()*atan(pi())*10000+pi()%pi()-pi())))))
1.0000
Warnings:
Warning	1292	Truncated incorrect DOUBLE value: '1.861876163818184439663.46351397751'
Warning	1292	Truncated incorrect DOUBLE value: '1.861876163818184439663.46351397751'
#  pi4-10-3 max
select  max(c1),max(c2),max(c3) from t1;
max(c1)	max(c2)	max(c3)
5	张	3141.592653589793
select  max(pi()) from t1;
max(pi())
3.141593
select  max(pi()+atan(pi())+ceil(pi())+floor(pi()));
max(pi()+atan(pi())+ceil(pi())+floor(pi()))
11.404219909268704
select  max(substr(pi(),3,6)+floor(pi()*ceil(pi())+atan(pi())*pi()-pi()%round(pi())));
max(substr(pi(),3,6)+floor(pi()*ceil(pi())+atan(pi())*pi()-pi()%round(pi())))
141609
#  pi4-10-4 min
select  min(c1),min(c2),min(c3) from t1;
min(c1)	min(c2)	min(c3)
1	123	3.141592653589793
select  min(pi()) from t1;
min(pi())
3.141593
select  min(pi()+ceil(pi())+round(pi())+floor(pi()));
min(pi()+ceil(pi())+round(pi())+floor(pi()))
13.141593
select  min(ceil(pi()*pi()*1000%pi()-pi()+pi())+round(pi()*atan(pi())*10000+pi()%pi()-pi()));
min(ceil(pi()*pi()*1000%pi()-pi()+pi())+round(pi()*atan(pi())*10000+pi()%pi()-pi()))
39665
#  pi4-10-5 count
select count(c1),count(c2),count(c3) from t1;
count(c1)	count(c2)	count(c3)
5	5	5
select count(pi()) from t1;
count(pi())
5
select count(pi()+ceil(pi())+round(pi())+floor(pi()));
count(pi()+ceil(pi())+round(pi())+floor(pi()))
1
select count(ceil(pi()*pi()*1000%pi()-pi()+pi())+round(pi()*atan(pi())*10000+pi()%pi()-pi()));
count(ceil(pi()*pi()*1000%pi()-pi()+pi())+round(pi()*atan(pi())*10000+pi()%pi()-pi()))
1
drop    table   t1;
#  pi-5运算符   5-1算术运算符  5-1-1  +
select  pi() +  pi();
pi() +  pi()
6.283185
select  pi() +  atan(1);
pi() +  atan(1)
3.9269908169872414
select  pi() +  1111111;
pi() +  1111111
1111114.141593
select  pi() +  'aaaaaa';
pi() +  'aaaaaa'
3.141592653589793
Warnings:
Warning	1292	Truncated incorrect DOUBLE value: 'aaaaaa'
select  pi() +  '中';
pi() +  '中'
3.141592653589793
Warnings:
Warning	1292	Truncated incorrect DOUBLE value: '中'
select  pi() +  0;
pi() +  0
3.141593
select  pi() +  null;
pi() +  null
NULL
#  pi5-1-2   -
select  pi()  -  pi();
pi()  -  pi()
0.000000
select  pi()  -  floor(pi());
pi()  -  floor(pi())
0.141593
select  pi()  -  3333333;
pi()  -  3333333
-3333329.858407
select  pi()  -  'qwertyu';
pi()  -  'qwertyu'
3.141592653589793
Warnings:
Warning	1292	Truncated incorrect DOUBLE value: 'qwertyu'
select  pi()  -  '前';
pi()  -  '前'
3.141592653589793
Warnings:
Warning	1292	Truncated incorrect DOUBLE value: '前'
select  pi()  -  0;
pi()  -  0
3.141593
select  pi()  -  null;
pi()  -  null
NULL
#  pi5-1-3   *
select  pi()  *  pi();
pi()  *  pi()
9.869604
select  pi()  *  ceil(pi());
pi()  *  ceil(pi())
12.566371
select  pi()  *  100000;
pi()  *  100000
314159.265359
select  pi()  *  'zxcvbn';
pi()  *  'zxcvbn'
0
Warnings:
Warning	1292	Truncated incorrect DOUBLE value: 'zxcvbn'
select  pi()  *  '后';
pi()  *  '后'
0
Warnings:
Warning	1292	Truncated incorrect DOUBLE value: '后'
select  pi()  *  0;
pi()  *  0
0.000000
select  pi()  *  null;
pi()  *  null
NULL
#  pi5-1-4   /
select  pi()  /  pi();
pi()  /  pi()
1.0000000000
select  pi()  /  round(pi());
pi()  /  round(pi())
1.0471975512
select  pi()  /  0.31415926;
pi()  /  0.31415926
10.000000170582
select  pi()  /  'asdfgh';
pi()  /  'asdfgh'
NULL
Warnings:
Warning	1292	Truncated incorrect DOUBLE value: 'asdfgh'
select  pi()  /  '左';
pi()  /  '左'
NULL
Warnings:
Warning	1292	Truncated incorrect DOUBLE value: '左'
select  pi()  /  0;
pi()  /  0
NULL
select  pi()  /  null;
pi()  /  null
NULL
#  pi5-1-5   %
select  pi()*100000000  %  pi();
pi()*100000000  %  pi()
3.141593
select  pi()  %  length(pi());
pi()  %  length(pi())
3.141593
select  pi()  %  1;
pi()  %  1
0.141593
select  pi()  %  'a';
pi()  %  'a'
NULL
Warnings:
Warning	1292	Truncated incorrect DOUBLE value: 'a'
select  pi()  %  '右';
pi()  %  '右'
NULL
Warnings:
Warning	1292	Truncated incorrect DOUBLE value: '右'
select  pi()  %  0;
pi()  %  0
NULL
select  pi()  %  null;
pi()  %  null
NULL
# mod
select  pi()*1000  mod  pi();
pi()*1000  mod  pi()
3.141593
select  pi()  mod  length(pi());
pi()  mod  length(pi())
3.141593
select  pi()  mod  1;
pi()  mod  1
0.141593
select  pi()  mod  'a';
pi()  mod  'a'
NULL
Warnings:
Warning	1292	Truncated incorrect DOUBLE value: 'a'
select  pi()  mod  '右';
pi()  mod  '右'
NULL
Warnings:
Warning	1292	Truncated incorrect DOUBLE value: '右'
select  pi()  mod  0;
pi()  mod  0
NULL
select  pi()  mod  null;
pi()  mod  null
NULL
select  pi()*pi()/pi()*1000000%pi()-pi()+pi()%1 mod pi();
pi()*pi()/pi()*1000000%pi()-pi()+pi()%1 mod pi()
0.1415926535
select  pi()*length(pi())/round(pi())+ceil(pi())-floor(pi())%1 mod pi();
pi()*length(pi())/round(pi())+ceil(pi())-floor(pi())%1 mod pi()
12.3775804096
#  pi5-2  逻辑运算符  5-2-1 not
select  not   pi();
not   pi()
0
#  pi5-2-2   and
select  pi()  and  pi();
pi()  and  pi()
1
select  pi()  and  1;
pi()  and  1
1
select  pi()  and  'a';
pi()  and  'a'
0
Warnings:
Warning	1292	Truncated incorrect DOUBLE value: 'a'
select  pi()  and  '/';
pi()  and  '/'
0
Warnings:
Warning	1292	Truncated incorrect DOUBLE value: '/'
select  pi()  and  '州';
pi()  and  '州'
0
Warnings:
Warning	1292	Truncated incorrect DOUBLE value: '州'
select  pi()  and  null;
pi()  and  null
NULL
#  pi5-2-3   or
select  pi()  or   pi();
pi()  or   pi()
1
select  pi()  or   1;
pi()  or   1
1
select  pi()  or   'a';
pi()  or   'a'
1
select  pi()  or   '/';
pi()  or   '/'
1
select  pi()  or   '州';
pi()  or   '州'
1
select  pi()  or   null;
pi()  or   null
1
#  pi5-2-4  xor
select  pi()  xor  pi();
pi()  xor  pi()
0
select  pi()  xor  1;
pi()  xor  1
0
select  pi()  xor  'a';
pi()  xor  'a'
1
Warnings:
Warning	1292	Truncated incorrect DOUBLE value: 'a'
select  pi()  xor  '/';
pi()  xor  '/'
1
Warnings:
Warning	1292	Truncated incorrect DOUBLE value: '/'
select  pi()  xor  '州';
pi()  xor  '州'
1
Warnings:
Warning	1292	Truncated incorrect DOUBLE value: '州'
select  pi()  xor  null;
pi()  xor  null
NULL
#  pi5-3  比较运算符  5-3-1 =
select  pi()   =   pi();
pi()   =   pi()
1
#OB与MYSQL 执行结果不一致 BUG 
select  pi()   =   null;
pi()   =   null
NULL
#  pi5-3-2  >
select  pi()   >   pi();
pi()   >   pi()
0
select  pi()   >   3.141593;
pi()   >   3.141593
0
select  pi()   >   floor(pi());
pi()   >   floor(pi())
1
select  pi()   >   'a';
pi()   >   'a'
1
Warnings:
Warning	1292	Truncated incorrect DOUBLE value: 'a'
select  pi()   >   '一';
pi()   >   '一'
1
Warnings:
Warning	1292	Truncated incorrect DOUBLE value: '一'
select  pi()   >   '+';
pi()   >   '+'
1
Warnings:
Warning	1292	Truncated incorrect DOUBLE value: '+'
select  pi()   >   null;
pi()   >   null
NULL
#  pi5-3-3  >=
select  pi()   >=   pi();
pi()   >=   pi()
1
#OB与MYSQL 执行结果不一致
select  pi()   >=   floor(pi());
pi()   >=   floor(pi())
1
select  pi()   >=   'a';
pi()   >=   'a'
1
Warnings:
Warning	1292	Truncated incorrect DOUBLE value: 'a'
select  pi()   >=   '二';
pi()   >=   '二'
1
Warnings:
Warning	1292	Truncated incorrect DOUBLE value: '二'
select  pi()   >=   '+';
pi()   >=   '+'
1
Warnings:
Warning	1292	Truncated incorrect DOUBLE value: '+'
select  pi()   >=   null;
pi()   >=   null
NULL
#  pi5-3-4  <
select  pi()   <   pi();
pi()   <   pi()
0
#OB与MYSQL 执行结果不一致
select  pi()   <   round(pi());
pi()   <   round(pi())
0
select  pi()   <   'a';
pi()   <   'a'
0
Warnings:
Warning	1292	Truncated incorrect DOUBLE value: 'a'
select  pi()   <   '三';
pi()   <   '三'
0
Warnings:
Warning	1292	Truncated incorrect DOUBLE value: '三'
select  pi()   <   '+';
pi()   <   '+'
0
Warnings:
Warning	1292	Truncated incorrect DOUBLE value: '+'
select  pi()   <   null;
pi()   <   null
NULL
#  pi5-3-5  <=
select  pi()   <=   pi();
pi()   <=   pi()
1
select  pi()   <=   3.141593;
pi()   <=   3.141593
1
select  pi()   <=   round(pi());
pi()   <=   round(pi())
0
select  pi()   <=   'a';
pi()   <=   'a'
0
Warnings:
Warning	1292	Truncated incorrect DOUBLE value: 'a'
select  pi()   <=   '四';
pi()   <=   '四'
0
Warnings:
Warning	1292	Truncated incorrect DOUBLE value: '四'
select  pi()   <=   '+';
pi()   <=   '+'
0
Warnings:
Warning	1292	Truncated incorrect DOUBLE value: '+'
select  pi()   <=   null;
pi()   <=   null
NULL
#  pi5-3-6  !=
select  pi()   !=   pi();
pi()   !=   pi()
0
#OB与MYSQL 执行结果不一致
select  pi()   !=   round(pi());
pi()   !=   round(pi())
1
select  pi()   !=   'a';
pi()   !=   'a'
1
Warnings:
Warning	1292	Truncated incorrect DOUBLE value: 'a'
select  pi()   !=   '五';
pi()   !=   '五'
1
Warnings:
Warning	1292	Truncated incorrect DOUBLE value: '五'
select  pi()   !=   '+';
pi()   !=   '+'
1
Warnings:
Warning	1292	Truncated incorrect DOUBLE value: '+'
select  pi()   !=   null;
pi()   !=   null
NULL
#  pi5-3-7  <>
select  pi()   <>   pi();
pi()   <>   pi()
0
#OB与MYSQL 执行结果不一致
select  pi()   <>   round(pi());
pi()   <>   round(pi())
1
select  pi()   <>   'a';
pi()   <>   'a'
1
Warnings:
Warning	1292	Truncated incorrect DOUBLE value: 'a'
select  pi()   <>   '六';
pi()   <>   '六'
1
Warnings:
Warning	1292	Truncated incorrect DOUBLE value: '六'
select  pi()   <>   '+';
pi()   <>   '+'
1
Warnings:
Warning	1292	Truncated incorrect DOUBLE value: '+'
select  pi()   <>   null;
pi()   <>   null
NULL
drop database pi1;
