drop table if exists test;
result_format: 4
create table test(c1 int, c2 int, c3 int);
insert into test values(1,1,1),(2,2,2),(3,3,3);
select * from test;
+------+------+------+
| c1   | c2   | c3   |
+------+------+------+
|    1 |    1 |    1 |
|    2 |    2 |    2 |
|    3 |    3 |    3 |
+------+------+------+

drop table test;
create table test(c1 int primary key, c2 int, c3 int);
insert into test values(1,1,1),(2,2,2),(3,3,3);
select * from test;
+----+------+------+
| c1 | c2   | c3   |
+----+------+------+
|  1 |    1 |    1 |
|  2 |    2 |    2 |
|  3 |    3 |    3 |
+----+------+------+
insert into test values(1,1,1),(2,2,2),(3,3,3) on duplicate key update c2 = values(c1)+ values(c3),
      c3 = values(c1) + values(c3) + values(c2);
select * from test;
+----+------+------+
| c1 | c2   | c3   |
+----+------+------+
|  1 |    2 |    3 |
|  2 |    4 |    6 |
|  3 |    6 |    9 |
+----+------+------+

insert into test values(4, c1+1, c1+2), (5, c1 + c2, c2+c1+c3), (6,c1+c2, c2+c1+c3);
select * from test;
+----+------+------+
| c1 | c2   | c3   |
+----+------+------+
|  1 |    2 |    3 |
|  2 |    4 |    6 |
|  3 |    6 |    9 |
|  4 |    5 |    6 |
|  5 | NULL | NULL |
|  6 | NULL | NULL |
+----+------+------+
insert into test values(4, c1+1, c1+2), (5, c1 + c2, c2+c1+c3), (6,c1+c2, c2+c1+c3) on duplicate key
update c2 = values(c1)+ values(c3), c3 = values(c1) + values(c3) + values(c2);
select * from test;
+----+------+------+
| c1 | c2   | c3   |
+----+------+------+
|  1 |    2 |    3 |
|  2 |    4 |    6 |
|  3 |    6 |    9 |
|  4 |   10 |   15 |
|  5 | NULL | NULL |
|  6 | NULL | NULL |
+----+------+------+

insert into test set c1 = 7, c2=c1+5, c3=c1+c2;
insert into test set c1 = 8, c2=c1+5, c3=c1+c2 + c3;
select * from test;
+----+------+------+
| c1 | c2   | c3   |
+----+------+------+
|  1 |    2 |    3 |
|  2 |    4 |    6 |
|  3 |    6 |    9 |
|  4 |   10 |   15 |
|  5 | NULL | NULL |
|  6 | NULL | NULL |
|  7 |   12 |   19 |
|  8 |   13 | NULL |
+----+------+------+
insert into test set c1 = 7, c2=c1+5, c3=c1+c2 on duplicate key update c2 = values(c1)+ values(c3),
       c3 = values(c1) + values(c3) + values(c2);
insert into test set c1 = 8, c2=c1+5, c3=c1+c2 + c3 on duplicate key update c2 = values(c1)+ values(c3), c3 = values(c1) + values(c3) + values(c2);
select * from test;
+----+------+------+
| c1 | c2   | c3   |
+----+------+------+
|  1 |    2 |    3 |
|  2 |    4 |    6 |
|  3 |    6 |    9 |
|  4 |   10 |   15 |
|  5 | NULL | NULL |
|  6 | NULL | NULL |
|  7 |   26 |   38 |
|  8 | NULL | NULL |
+----+------+------+

########
########
drop table test;
create table test(c1 int primary key auto_increment, c2 int, c3 int);
insert into test values(1,1,1),(2,2,2),(3,3,3);
select * from test;
+----+------+------+
| c1 | c2   | c3   |
+----+------+------+
|  1 |    1 |    1 |
|  2 |    2 |    2 |
|  3 |    3 |    3 |
+----+------+------+
insert into test values(1,1,1),(2,2,2),(3,3,3) on duplicate key update c2 = values(c1)+ values(c3),
      c3 = values(c1) + values(c3) + values(c2);
select * from test;
+----+------+------+
| c1 | c2   | c3   |
+----+------+------+
|  1 |    2 |    3 |
|  2 |    4 |    6 |
|  3 |    6 |    9 |
+----+------+------+

insert into test values(4, c1+1, c1+2), (5, c1 + c2, c2+c1+c3), (6,c1+c2, c2+c1+c3);
select * from test;
+----+------+------+
| c1 | c2   | c3   |
+----+------+------+
|  1 |    2 |    3 |
|  2 |    4 |    6 |
|  3 |    6 |    9 |
|  4 |    5 |    6 |
|  5 | NULL | NULL |
|  6 | NULL | NULL |
+----+------+------+
insert into test values(4, c1+1, c1+2), (5, c1 + c2, c2+c1+c3), (6,c1+c2, c2+c1+c3) on duplicate key
update c2 = values(c1)+ values(c3), c3 = values(c1) + values(c3) + values(c2);
select * from test;
+----+------+------+
| c1 | c2   | c3   |
+----+------+------+
|  1 |    2 |    3 |
|  2 |    4 |    6 |
|  3 |    6 |    9 |
|  4 |   10 |   15 |
|  5 | NULL | NULL |
|  6 | NULL | NULL |
+----+------+------+

insert into test set c1 = 7, c2=c1+5, c3=c1+c2;
insert into test set c1 = 8, c2=c1+5, c3=c1+c2 + c3;
select * from test;
+----+------+------+
| c1 | c2   | c3   |
+----+------+------+
|  1 |    2 |    3 |
|  2 |    4 |    6 |
|  3 |    6 |    9 |
|  4 |   10 |   15 |
|  5 | NULL | NULL |
|  6 | NULL | NULL |
|  7 |   12 |   19 |
|  8 |   13 | NULL |
+----+------+------+
insert into test set c1 = 7, c2=c1+5, c3=c1+c2 on duplicate key update c2 = values(c1)+ values(c3),
       c3 = values(c1) + values(c3) + values(c2);
insert into test set c1 = 8, c2=c1+5, c3=c1+c2 + c3 on duplicate key update c2 = values(c1)+ values(c3), c3 = values(c1) + values(c3) + values(c2);
select * from test;
+----+------+------+
| c1 | c2   | c3   |
+----+------+------+
|  1 |    2 |    3 |
|  2 |    4 |    6 |
|  3 |    6 |    9 |
|  4 |   10 |   15 |
|  5 | NULL | NULL |
|  6 | NULL | NULL |
|  7 |   26 |   38 |
|  8 | NULL | NULL |
+----+------+------+

delete from test;
insert into test(c2,c3) values(c1+1, c1+2), (c1 + c2, c2+c1+c3), (c1+c2, c2+c1+c3);
select * from test;
+----+------+------+
| c1 | c2   | c3   |
+----+------+------+
|  9 |    1 |    2 |
| 10 | NULL | NULL |
| 11 | NULL | NULL |
+----+------+------+
insert into test (c2,c3)values(c1+1, c1+2), (c1 + c2, c2+c1+c3), (c1+c2, c2+c1+c3) on duplicate key
update c2 = values(c1)+ values(c3), c3 = values(c1) + values(c3) + values(c2);
select * from test;
+----+------+------+
| c1 | c2   | c3   |
+----+------+------+
|  9 |    1 |    2 |
| 10 | NULL | NULL |
| 11 | NULL | NULL |
| 12 |    1 |    2 |
| 13 | NULL | NULL |
| 14 | NULL | NULL |
+----+------+------+

insert into test set c2=c1+5, c3=c1+c2;
insert into test set c2=c1+5, c3=c1+c2 + c3;
select * from test;
+----+------+------+
| c1 | c2   | c3   |
+----+------+------+
|  9 |    1 |    2 |
| 10 | NULL | NULL |
| 11 | NULL | NULL |
| 12 |    1 |    2 |
| 13 | NULL | NULL |
| 14 | NULL | NULL |
| 15 |    5 |    5 |
| 16 |    5 | NULL |
+----+------+------+
insert into test set c1 = 2, c2=c1+5, c3=c1+c2 on duplicate key update c2 = values(c1)+ values(c3),
       c3 = values(c1) + values(c3) + values(c2);
insert into test set c1 = 3, c2=c1+5, c3=c1+c2 + c3 on duplicate key update c2 = values(c1)+ values(c3), c3 = values(c1) + values(c3) + values(c2);
select * from test;
+----+------+------+
| c1 | c2   | c3   |
+----+------+------+
|  2 |    7 |    9 |
|  3 |    8 | NULL |
|  9 |    1 |    2 |
| 10 | NULL | NULL |
| 11 | NULL | NULL |
| 12 |    1 |    2 |
| 13 | NULL | NULL |
| 14 | NULL | NULL |
| 15 |    5 |    5 |
| 16 |    5 | NULL |
+----+------+------+

#########
#########
drop table test;
create table test(c1 int primary key, c2 char(5), c3 char(8));
insert into test values(1, 'sbc    ', concat(c2, 'd'));
select * from test;
+----+------+------+
| c1 | c2   | c3   |
+----+------+------+
|  1 | sbc  | sbcd |
+----+------+------+
set @@sql_mode='';
insert into test values(1, 'deeeeee', concat(c2, 'de')), (2, 'eeee22aa', 'eeff')on duplicate key update c3 = values(c2);
Warnings:
Warning	1265	Data truncated for column '"test"."test"."c2"' at row 1
Warning	1265	Data truncated for column '"test"."test"."c2"' at row 1
Warning	1265	Data truncated for column '"test"."test"."c2"' at row 2
select * from test;
+----+-------+-------+
| c1 | c2    | c3    |
+----+-------+-------+
|  1 | sbc   | deeee |
|  2 | eeee2 | eeff  |
+----+-------+-------+
insert into test values(1, 'deeeeee', concat(c2, 'de')), (2, 'eeee22aa', 'eeff')on duplicate key update c3 = values(c2);
Warnings:
Warning	1265	Data truncated for column '"test"."test"."c2"' at row 1
Warning	1265	Data truncated for column '"test"."test"."c2"' at row 1
Warning	1265	Data truncated for column '"test"."test"."c2"' at row 2
select * from test;
+----+-------+-------+
| c1 | c2    | c3    |
+----+-------+-------+
|  1 | sbc   | deeee |
|  2 | eeee2 | eeee2 |
+----+-------+-------+
set @@sql_mode ='pad_char_to_full_length';
insert into test values(1, 'dee', concat(c2, 'de')), (2, 'eeee22aa', 'eeff')on duplicate key update c3 = values(c2);
Warnings:
Warning	1265	Data truncated for column '"test"."test"."c2"' at row 2
select * from test;
+----+-------+----------+
| c1 | c2    | c3       |
+----+-------+----------+
|  1 | sbc   | dee      |
|  2 | eeee2 | eeee2    |
+----+-------+----------+
insert into test values(1, 'dee', concat(c2, 'de')), (2, 'eeee22aa', 'eeff')on duplicate key update c3 = values(c2);
Warnings:
Warning	1265	Data truncated for column '"test"."test"."c2"' at row 2
select * from test;
+----+-------+----------+
| c1 | c2    | c3       |
+----+-------+----------+
|  1 | sbc   | dee      |
|  2 | eeee2 | eeee2    |
+----+-------+----------+

#######
#######
drop table test;
create table test(c1 int default 3, c2 int);
insert into test values(1, values(c2));
insert into test values(2, values(c1));
insert into test values(values(c1), 3);
insert into test values(values(c2), 4);
insert into test values(values(c2), values(c1));
select * from test;
+------+------+
| c1   | c2   |
+------+------+
|    1 | NULL |
|    2 | NULL |
| NULL |    3 |
| NULL |    4 |
| NULL | NULL |
+------+------+
drop table test;

###binary类型的列
create table test(c1 binary(4), c2 binary(5));
insert into test values(4, c1 + 1);
Warnings:
Warning	1292	Truncated incorrect DOUBLE value: '4'
insert into test values(4, concat(c1,1));
select hex(c1),hex(c2) from test;
+----------+------------+
| hex(c1)  | hex(c2)    |
+----------+------------+
| 34000000 | 3500000000 |
| 34000000 | 3400000031 |
+----------+------------+
drop table test;

create table test(id int primary key, name varchar(10), telephone varchar(10)) partition by range(id) (partition p0 values less than(10), partition p1 values less than(20), partition pmax values less than(MAXVALUE));
create index idx on test(telephone) partition by key(telephone) partitions 2;
insert into test partition(p0) values(200, 'abc', '123456');
ERROR HY000: Found a row not matching the given partition set
drop table test;

DROP TABLE IF EXISTS t_high_avaiable_test;
CREATE TABLE t_high_avaiable_test (
    id int(11) NOT NULL,
    name varchar(20) DEFAULT NULL,
    code int(11) NOT NULL,
    insert_time datetime default current_timestamp,
    constraint pk_t_high_avaiable_test PRIMARY KEY (id, code)
    )
  partition by list (code)
  (
   partition p1 values in (1),
   partition p2 values in (2),
   partition p3 values in (3)
  );

explain_protocol: 1
EXPLAIN BASIC insert into t_high_avaiable_test(id, name, code) value(1,'aa',floor(rand()*3)+1);
Query Plan
============================
|ID|OPERATOR          |NAME|
----------------------------
|0 |DISTRIBUTED INSERT|    |
|1 |└─EXPRESSION      |    |
============================
Outputs & filters:
-------------------------------------
  0 - output(nil), filter(nil)
      columns([{t_high_avaiable_test: ({t_high_avaiable_test: (t_high_avaiable_test.id, t_high_avaiable_test.code, t_high_avaiable_test.name, t_high_avaiable_test.insert_time)})}]),
       
      column_values([column_conv(INT,PS:(11,0),NOT NULL,__values.id)], [column_conv(INT,PS:(11,0),NOT NULL,__values.code)], [column_conv(VARCHAR,utf8mb4_general_ci,
      length:20,NULL,__values.name)], [column_conv(MYSQL_DATETIME,PS:(19,0),NULL,current_timestamp())])
  1 - output([__values.id], [__values.name], [__values.code]), filter(nil)
      values({1, 'aa', floor(rand() * cast(3, DOUBLE(-1, -1))) + cast(1, DOUBLE(-1, -1))})
insert into t_high_avaiable_test(id, name, code) value(1,'aa',floor(rand()*3)+1);
EXPLAIN BASIC insert into t_high_avaiable_test(id, name, code) value(2,'aa',floor(rand()*3)+1);
Query Plan
============================
|ID|OPERATOR          |NAME|
----------------------------
|0 |DISTRIBUTED INSERT|    |
|1 |└─EXPRESSION      |    |
============================
Outputs & filters:
-------------------------------------
  0 - output(nil), filter(nil)
      columns([{t_high_avaiable_test: ({t_high_avaiable_test: (t_high_avaiable_test.id, t_high_avaiable_test.code, t_high_avaiable_test.name, t_high_avaiable_test.insert_time)})}]),
       
      column_values([column_conv(INT,PS:(11,0),NOT NULL,__values.id)], [column_conv(INT,PS:(11,0),NOT NULL,__values.code)], [column_conv(VARCHAR,utf8mb4_general_ci,
      length:20,NULL,__values.name)], [column_conv(MYSQL_DATETIME,PS:(19,0),NULL,current_timestamp())])
  1 - output([__values.id], [__values.name], [__values.code]), filter(nil)
      values({2, 'aa', floor(rand() * cast(3, DOUBLE(-1, -1))) + cast(1, DOUBLE(-1, -1))})
insert into t_high_avaiable_test(id, name, code) value(2,'aa',floor(rand()*3)+1);
EXPLAIN BASIC insert into t_high_avaiable_test(id, name, code) value(3,'aa',floor(rand()*3)+1);
Query Plan
============================
|ID|OPERATOR          |NAME|
----------------------------
|0 |DISTRIBUTED INSERT|    |
|1 |└─EXPRESSION      |    |
============================
Outputs & filters:
-------------------------------------
  0 - output(nil), filter(nil)
      columns([{t_high_avaiable_test: ({t_high_avaiable_test: (t_high_avaiable_test.id, t_high_avaiable_test.code, t_high_avaiable_test.name, t_high_avaiable_test.insert_time)})}]),
       
      column_values([column_conv(INT,PS:(11,0),NOT NULL,__values.id)], [column_conv(INT,PS:(11,0),NOT NULL,__values.code)], [column_conv(VARCHAR,utf8mb4_general_ci,
      length:20,NULL,__values.name)], [column_conv(MYSQL_DATETIME,PS:(19,0),NULL,current_timestamp())])
  1 - output([__values.id], [__values.name], [__values.code]), filter(nil)
      values({3, 'aa', floor(rand() * cast(3, DOUBLE(-1, -1))) + cast(1, DOUBLE(-1, -1))})
insert into t_high_avaiable_test(id, name, code) value(3,'aa',floor(rand()*3)+1);

EXPLAIN BASIC select count(1) from t_high_avaiable_test;
Query Plan
=======================================================
|ID|OPERATOR                     |NAME                |
-------------------------------------------------------
|0 |SCALAR GROUP BY              |                    |
|1 |└─PX COORDINATOR             |                    |
|2 |  └─EXCHANGE OUT DISTR       |:EX10000            |
|3 |    └─MERGE GROUP BY         |                    |
|4 |      └─PX PARTITION ITERATOR|                    |
|5 |        └─TABLE FULL SCAN    |t_high_avaiable_test|
=======================================================
Outputs & filters:
-------------------------------------
  0 - output([T_FUN_COUNT_SUM(T_FUN_COUNT_SUM(T_FUN_COUNT(*)))]), filter(nil), rowset=16
      group(nil), agg_func([T_FUN_COUNT_SUM(T_FUN_COUNT_SUM(T_FUN_COUNT(*)))])
  1 - output([T_FUN_COUNT_SUM(T_FUN_COUNT(*))]), filter(nil), rowset=16
  2 - output([T_FUN_COUNT_SUM(T_FUN_COUNT(*))]), filter(nil), rowset=16
      dop=1
  3 - output([T_FUN_COUNT_SUM(T_FUN_COUNT(*))]), filter(nil), rowset=16
      group(nil), agg_func([T_FUN_COUNT_SUM(T_FUN_COUNT(*))])
  4 - output([T_FUN_COUNT(*)]), filter(nil), rowset=16
      force partition granule
  5 - output([T_FUN_COUNT(*)]), filter(nil), rowset=16
      access(nil), partitions(p[0-2])
      is_index_back=false, is_global_index=false, 
      range_key([t_high_avaiable_test.id], [t_high_avaiable_test.code]), range(MIN,MIN ; MAX,MAX)always true, 
      pushdown_aggregation([T_FUN_COUNT(*)])
select count(1) from t_high_avaiable_test;
+----------+
| count(1) |
+----------+
|        3 |
+----------+
drop table t_high_avaiable_test;

explain_protocol: 0
create table test(a int primary key, b int) partition by hash(a) partitions 3;
insert into test values(1, 1), (2, 2), (3, 3);
insert into test select 4, 4 union select 5, 5 union select 6, 6;
##test rely consistent snapshot sql
insert into test select * from test t;
ERROR 23000: Duplicate entry 'xxx' for key 'PRIMARY'
update test set b=1 where a>=3;
select * from test order by a;
+---+------+
| a | b    |
+---+------+
| 1 |    1 |
| 2 |    2 |
| 3 |    1 |
| 4 |    1 |
| 5 |    1 |
| 6 |    1 |
+---+------+
## oracle 模式下，普通SQL不支持 insert + ref 
drop table test;
create table test(a int, b int);
insert into test values rec1;
Got one of the listed errors
drop table test;

drop table if exists table0_key_pk_parts_1_bigint;
CREATE TABLE table0_key_pk_parts_1_bigint (
col_char_20_index char(20),
col_timestamp_6 timestamp(6) NULL DEFAULT NULL,
col_bigint bigint,
col_bigint_index bigint,
pk bigint,
col_char_20 char(20),
col_timestamp_6_index timestamp(6) NULL DEFAULT NULL,
/*Indices*/
index idx3(pk, col_char_20_index ) global,
index idx1(pk, col_bigint_index ) global,
primary key (pk) ,
index idx5(pk, col_timestamp_6_index ) global) PARTITION BY key (pk) partitions 1;

INSERT INTO `table0_key_pk_parts_1_bigint` VALUES ('grk','2018-06-15 01:00:00.000003',6,-99999,-99999,NULL,NULL),(NULL,NULL,6,-24649,-24649,NULL,'2017-06-15 01:00:00.000003'),(NULL,NULL,6,0,-24612,NULL,NULL),('liljelia',NULL,6,-11784,-11784,NULL,NULL),(NULL,'2018-06-15 01:00:00.000003',6,-3948,-3948,NULL,'2017-06-15 01:00:00.000003'),(NULL,NULL,6,-2930,-2930,NULL,NULL),(NULL,NULL,6,-906,-906,NULL,NULL),(NULL,'2018-06-15 01:00:00.000003',6,-640,-640,'',NULL),(NULL,NULL,5,-100,-100,NULL,'2017-06-15 01:00:00.000003'),(NULL,'2018-06-15 01:00:00.000003',6,0,0,NULL,NULL),(NULL,NULL,6,1,1,NULL,'2017-06-15 01:00:00.000003'),(NULL,'2018-06-15 01:00:00.000003',6,2,2,NULL,NULL),(NULL,NULL,6,5,5,NULL,NULL),(NULL,'2018-06-19 00:59:59.999999',6,7,7,NULL,NULL),(NULL,'2021-06-19 01:00:00.000003',6,8,8,NULL,NULL),('4444444','2016-06-12 14:49:49.999998',6,6666666666,20,NULL,NULL),(NULL,NULL,6,25,25,'',NULL),(NULL,NULL,6,34,34,'nwnx','2020-06-15 01:00:00.000003'),('JZDQM','2015-06-14 05:00:05.000002',6,44,44,NULL,NULL),(NULL,NULL,6,53,53,NULL,NULL),(NULL,NULL,6,57,57,'',NULL),(NULL,NULL,6,66,66,'726475',NULL),('26',NULL,6,2,78,NULL,NULL),(NULL,NULL,6,82,82,'',NULL),(NULL,NULL,6,95,95,'msxp',NULL),(NULL,NULL,6,142,10,NULL,NULL),('ay',NULL,6,130,130,NULL,NULL),('l',NULL,6,135,135,NULL,NULL),(NULL,NULL,6,140,140,'',NULL),(NULL,NULL,6,159,159,NULL,NULL),(NULL,NULL,6,182,182,'head12320185',NULL),('j',NULL,6,NULL,232,NULL,NULL),('al',NULL,6,2,239,NULL,NULL),(NULL,NULL,6,555,555,NULL,NULL),('ZMZCJ',NULL,6,2,666,NULL,'2020-06-15 01:05:05.000008'),('88888888',NULL,6,2,4748,NULL,NULL),('7',NULL,6,2,6988,NULL,NULL),(NULL,NULL,6,7397,7397,NULL,NULL),('7770',NULL,6,9246,9246,NULL,NULL),(NULL,NULL,6,13923,13923,'uheadcccccccccctail',NULL),('h',NULL,6,17596,17596,NULL,NULL),(NULL,NULL,6,19193,19193,'',NULL),('kj',NULL,6,19945,19945,NULL,NULL),('00',NULL,6,23393,23393,NULL,NULL),('4444444',NULL,6,23519,23519,NULL,NULL),(NULL,'2015-06-19 10:00:00.000001',6,31420,31420,'smkgokrfnb',NULL),('g','2015-06-19 10:00:00.000001',6,2,99999,NULL,'2017-06-15 01:00:00.000003'),('g','2015-06-19 10:00:00.000001',6,4444444,4444444,NULL,NULL),('g','2015-06-19 10:00:00.000001',6,99999,77777777,NULL,NULL),('g','2015-06-19 10:00:00.000001',6,99999,99999999,NULL,NULL),('ta',NULL,6,2,99,NULL,NULL),(NULL,'2018-06-15 01:00:00.000003',6,-10,-10,NULL,NULL);
select * from table0_key_pk_parts_1_bigint where pk in (99,-10,10,176);
+----------------------+----------------------------+------------+------------------+-----+-------------+-----------------------+
| col_char_20_index    | col_timestamp_6            | col_bigint | col_bigint_index | pk  | col_char_20 | col_timestamp_6_index |
+----------------------+----------------------------+------------+------------------+-----+-------------+-----------------------+
| NULL                 | 2018-06-15 01:00:00.000003 |          6 |              -10 | -10 | NULL        | NULL                  |
| NULL                 | NULL                       |          6 |              142 |  10 | NULL        | NULL                  |
| ta                   | NULL                       |          6 |                2 |  99 | NULL        | NULL                  |
+----------------------+----------------------------+------------+------------------+-----+-------------+-----------------------+
INSERT INTO table0_key_pk_parts_1_bigint ( pk , col_char_20_index ) VALUES ( -10 , TRIM( SUBSTR( CONCAT(SUBSTR( HEX( SUBSTR( 'weh' , 1, 20) ) , 1, 20) , SUBSTR( 'mwehexq' , 1, 20) ) , 1 , 20 ) ) ) , ( 10 , SUBSTR( 'vmw' , 1, 20) ) , ( 99 , TRIM( SUBSTR( CONCAT(SUBSTR( 'uvmwe' , 1, 20) , HEX( TRIM( SUBSTR( SUBSTR( 'guvmwe' , 1, 20) , 1 , 20 ) ) ) ) , 1 , 20 ) ) ) , ( 176 , SUBSTR( 'j' , 1, 20) ) ON DUPLICATE KEY UPDATE pk = 99 ;
ERROR 23000: Duplicate entry '99' for key 'PRIMARY'
select * from table0_key_pk_parts_1_bigint where pk in (99,-10,10,176);
+----------------------+----------------------------+------------+------------------+-----+-------------+-----------------------+
| col_char_20_index    | col_timestamp_6            | col_bigint | col_bigint_index | pk  | col_char_20 | col_timestamp_6_index |
+----------------------+----------------------------+------------+------------------+-----+-------------+-----------------------+
| NULL                 | 2018-06-15 01:00:00.000003 |          6 |              -10 | -10 | NULL        | NULL                  |
| NULL                 | NULL                       |          6 |              142 |  10 | NULL        | NULL                  |
| ta                   | NULL                       |          6 |                2 |  99 | NULL        | NULL                  |
+----------------------+----------------------------+------------+------------------+-----+-------------+-----------------------+
drop table table0_key_pk_parts_1_bigint;

drop table if exists t1;
create table t1(a int primary key, b int, c int, index i1(b) global) partition by hash(a) partitions 1;
insert into t1 values(1, 1, 1), (1, 2, 2) on duplicate key update a=3;
select * from t1;
+---+------+------+
| a | b    | c    |
+---+------+------+
| 3 |    1 |    1 |
+---+------+------+
drop table t1;

DROP TABLE IF EXISTS `table2_key_pk_parts_1_bigint`;
CREATE TABLE `table2_key_pk_parts_1_bigint` (
  `col_char_20` char(20) DEFAULT NULL,
  `col_bigint_index` bigint(20) DEFAULT NULL,
  `pk` bigint(20) NOT NULL,
  `col_timestamp_6` timestamp(6) NULL DEFAULT NULL,
  `col_char_20_index` char(20) DEFAULT NULL,
  `col_timestamp_6_index` timestamp(6) NULL DEFAULT NULL,
  `col_bigint` bigint(20) DEFAULT NULL,
  PRIMARY KEY (`pk`),
  KEY `idx1` (`pk`, `col_bigint_index`),
  KEY `idx3` (`pk`, `col_char_20_index`) ,
  KEY `idx5` (`pk`, `col_timestamp_6_index`)
) DEFAULT CHARSET = utf8mb4  partition by key(pk) partitions 1;
INSERT INTO `table2_key_pk_parts_1_bigint` VALUES (NULL,5,-99999,NULL,NULL,NULL,10),(NULL,5,-11736,NULL,'10',NULL,10),(NULL,5,-6565,'2018-06-15 01:00:00.000003',NULL,NULL,NULL),('nl',NULL,-10,NULL,NULL,NULL,NULL),('56474A4344',NULL,0,NULL,NULL,NULL,2),('',29008,1,'2002-07-22 21:47:11.009098','','2002-07-22 21:47:11.009098',18027),('i',8923882661634637824,2,'2009-07-05 09:22:39.021204','i','2009-07-05 09:22:39.021204',4),(NULL,NULL,3,NULL,NULL,NULL,10),('0',122,10,NULL,NULL,NULL,NULL),(NULL,10,12,NULL,'',NULL,NULL),('6E6E6E6E6E6E6E6E6E',NULL,99,NULL,NULL,NULL,NULL),(NULL,NULL,100,NULL,'nqhrgeoTue',NULL,NULL),('22222',NULL,146,NULL,NULL,NULL,2222222222),(NULL,NULL,152,NULL,NULL,NULL,NULL),(NULL,NULL,188,NULL,NULL,NULL,NULL),(NULL,NULL,218,NULL,NULL,NULL,888),('6666666666',255,255,NULL,NULL,NULL,NULL),(NULL,NULL,8326,NULL,NULL,'2017-06-13 20:00:00.000003',NULL),('70726362x',12903,12903,NULL,NULL,NULL,NULL),(NULL,22222,22222,NULL,NULL,NULL,NULL),(NULL,NULL,22698,NULL,'n',NULL,NULL),('',27854,27854,NULL,NULL,NULL,333),('787773767A6C',9999,99999,NULL,'nnn',NULL,NULL);
select * from table2_key_pk_parts_1_bigint where pk in (99,58);
+----------------------+------------------+----+-----------------+-------------------+-----------------------+------------+
| col_char_20          | col_bigint_index | pk | col_timestamp_6 | col_char_20_index | col_timestamp_6_index | col_bigint |
+----------------------+------------------+----+-----------------+-------------------+-----------------------+------------+
| 6E6E6E6E6E6E6E6E6E   |             NULL | 99 | NULL            | NULL              | NULL                  |       NULL |
+----------------------+------------------+----+-----------------+-------------------+-----------------------+------------+
INSERT INTO table2_key_pk_parts_1_bigint ( pk , col_bigint_index, col_char_20_index ) VALUES ( 99 , -99999 , '77777777'),( 99 , 201 , '3' ) ON DUPLICATE KEY UPDATE  pk = 58 , col_bigint_index = -5;
select * from table2_key_pk_parts_1_bigint where pk in (99,58);
+----------------------+------------------+----+-----------------+----------------------+-----------------------+------------+
| col_char_20          | col_bigint_index | pk | col_timestamp_6 | col_char_20_index    | col_timestamp_6_index | col_bigint |
+----------------------+------------------+----+-----------------+----------------------+-----------------------+------------+
| 6E6E6E6E6E6E6E6E6E   |               -5 | 58 | NULL            | NULL                 | NULL                  |       NULL |
| NULL                 |              201 | 99 | NULL            | 3                    | NULL                  |       NULL |
+----------------------+------------------+----+-----------------+----------------------+-----------------------+------------+
DROP TABLE `table2_key_pk_parts_1_bigint`;

DROP TABLE IF EXISTS `table1_key_pk_parts_1_bigint`;
CREATE TABLE table1_key_pk_parts_1_bigint (
col_bigint_index bigint,
col_bigint bigint,
col_timestamp_6 timestamp(6) NULL DEFAULT NULL,
col_timestamp_6_index timestamp(6) NULL DEFAULT NULL,
col_char_20_index char(20),
pk bigint,
col_char_20 char(20),
/*Indices*/
index idx1(pk, col_bigint_index ) global,
index idx5(pk, col_timestamp_6_index ) global,
index idx3(pk, col_char_20_index ) global,
primary key (pk) )  PARTITION BY key (pk) partitions 1 ;
INSERT INTO `table1_key_pk_parts_1_bigint` VALUES (NULL,NULL,NULL,NULL,NULL,-99999,'vxvsmpmc'),(NULL,NULL,NULL,NULL,NULL,-10,NULL),(5,NULL,NULL,NULL,'euheadtututututu',0,NULL),(7,-120,'2003-02-14 19:08:35.041296','2015-06-15 10:00:00.000001',NULL,1,''),(99,NULL,NULL,NULL,NULL,10,'a'),(NULL,NULL,NULL,NULL,NULL,99,'lyb'),(NULL,NULL,NULL,NULL,NULL,391,'71796Ctq'),(0,NULL,NULL,NULL,NULL,5555,NULL),(NULL,NULL,NULL,NULL,NULL,8853,NULL);
select * from table1_key_pk_parts_1_bigint order by pk;
+------------------+------------+----------------------------+----------------------------+----------------------+--------+----------------------+
| col_bigint_index | col_bigint | col_timestamp_6            | col_timestamp_6_index      | col_char_20_index    | pk     | col_char_20          |
+------------------+------------+----------------------------+----------------------------+----------------------+--------+----------------------+
|             NULL |       NULL | NULL                       | NULL                       | NULL                 | -99999 | vxvsmpmc             |
|             NULL |       NULL | NULL                       | NULL                       | NULL                 |    -10 | NULL                 |
|                5 |       NULL | NULL                       | NULL                       | euheadtututututu     |      0 | NULL                 |
|                7 |       -120 | 2003-02-14 19:08:35.041296 | 2015-06-15 10:00:00.000001 | NULL                 |      1 |                      |
|               99 |       NULL | NULL                       | NULL                       | NULL                 |     10 | a                    |
|             NULL |       NULL | NULL                       | NULL                       | NULL                 |     99 | lyb                  |
|             NULL |       NULL | NULL                       | NULL                       | NULL                 |    391 | 71796Ctq             |
|                0 |       NULL | NULL                       | NULL                       | NULL                 |   5555 | NULL                 |
|             NULL |       NULL | NULL                       | NULL                       | NULL                 |   8853 | NULL                 |
+------------------+------------+----------------------------+----------------------------+----------------------+--------+----------------------+
INSERT INTO table1_key_pk_parts_1_bigint ( pk , col_bigint_index, col_char_20_index ) VALUES ( 0 , 2317 , SUBSTR( 'cx' , 1, 20) ) , ( -100 , LENGTH( SUBSTR( 'u' , 1, 20) ) , SUBSTR( 'xu' , 1, 20) ) , ( -100 , 189 , TRIM( SUBSTR( SUBSTR( TRIM( BOTH SUBSTR( 'l' , 1, 20) FROM SUBSTR( 'xl' , 1, 20) ) , 6 ) , 1 , 20 ) ) ) ON DUPLICATE KEY UPDATE pk = LENGTH('FKXGN') ;
ERROR 23000: Duplicate entry '5' for key 'PRIMARY'
select * from table1_key_pk_parts_1_bigint order by pk;
+------------------+------------+----------------------------+----------------------------+----------------------+--------+----------------------+
| col_bigint_index | col_bigint | col_timestamp_6            | col_timestamp_6_index      | col_char_20_index    | pk     | col_char_20          |
+------------------+------------+----------------------------+----------------------------+----------------------+--------+----------------------+
|             NULL |       NULL | NULL                       | NULL                       | NULL                 | -99999 | vxvsmpmc             |
|             NULL |       NULL | NULL                       | NULL                       | NULL                 |    -10 | NULL                 |
|                5 |       NULL | NULL                       | NULL                       | euheadtututututu     |      0 | NULL                 |
|                7 |       -120 | 2003-02-14 19:08:35.041296 | 2015-06-15 10:00:00.000001 | NULL                 |      1 |                      |
|               99 |       NULL | NULL                       | NULL                       | NULL                 |     10 | a                    |
|             NULL |       NULL | NULL                       | NULL                       | NULL                 |     99 | lyb                  |
|             NULL |       NULL | NULL                       | NULL                       | NULL                 |    391 | 71796Ctq             |
|                0 |       NULL | NULL                       | NULL                       | NULL                 |   5555 | NULL                 |
|             NULL |       NULL | NULL                       | NULL                       | NULL                 |   8853 | NULL                 |
+------------------+------------+----------------------------+----------------------------+----------------------+--------+----------------------+

drop table if exists v0;
CREATE TABLE v0 ( v2 INTEGER DEFAULT 10 , v1 INTEGER ) ;
INSERT INTO v0 VALUES ( 17 , 56 ) ON DUPLICATE KEY UPDATE v1 = v1 > ( ( v2 , 'x' ) IN ( SELECT * FROM v0 WHERE CASE -1 WHEN FALSE THEN FALSE WHEN 73 THEN 'x' ELSE -1 END ^ v1 ) AND NOT ( FALSE OR TRUE ) ) ;
ERROR 0A000: update values contain non onetime subquery not supported

drop table if exists v0;
CREATE TABLE v0 ( v2 INTEGER , v1 INTEGER , STATUS INTEGER ) ;
INSERT INTO v0 SELECT * FROM v0 WHERE v2 = v0 . v1 AND v2 = v0 . v2 AND v1 <= v0 . v1 ;
INSERT INTO v0 VALUES ( 81 , 68 , 16 + ( v1 NOT IN ( SELECT ( NULL + 99 ) FROM v0 WHERE v1 > -1 ) ) ) ;
ERROR 0A000: insert values contain non onetime subquery not supported
INSERT INTO v0 VALUES ( 81 , 68 , 16 + ( ( SELECT ( NULL + 99 ) FROM v0 WHERE v1 > -1 ) ) ) ;
