drop table if exists t1,t2,t3,t4,test;
result_format: 4
create table t1(c1 int primary key, c2 int);
create table t2(c1 int, c2 int);
create table t3(c1 int primary key, c2 int, c3 int);
create table t4(c1 int primary key, c2 int) partition by hash(c1) partitions 3;
create table test(c1 int primary key auto_increment, c2 int);
insert into t1 values(1, 1), (2, 2);
insert into t2 values(3, 3), (4, 4);
insert into t1 select * from t2;
select * from t1;
+----+------+
| c1 | c2   |
+----+------+
|  1 |    1 |
|  2 |    2 |
|  3 |    3 |
|  4 |    4 |
+----+------+
insert into t2 select * from t1;
select * from t2;
+------+------+
| c1   | c2   |
+------+------+
|    3 |    3 |
|    4 |    4 |
|    1 |    1 |
|    2 |    2 |
|    3 |    3 |
|    4 |    4 |
+------+------+
insert into t2(c2) select c2 from t2;
select * from t2;
+------+------+
| c1   | c2   |
+------+------+
|    3 |    3 |
|    4 |    4 |
|    1 |    1 |
|    2 |    2 |
|    3 |    3 |
|    4 |    4 |
| NULL |    3 |
| NULL |    4 |
| NULL |    1 |
| NULL |    2 |
| NULL |    3 |
| NULL |    4 |
+------+------+
insert into t1 select * from t1;
ERROR 23000: Duplicate entry '1' for key 'PRIMARY'
insert into t2 select * from t2;
select * from t2;
+------+------+
| c1   | c2   |
+------+------+
|    3 |    3 |
|    4 |    4 |
|    1 |    1 |
|    2 |    2 |
|    3 |    3 |
|    4 |    4 |
| NULL |    3 |
| NULL |    4 |
| NULL |    1 |
| NULL |    2 |
| NULL |    3 |
| NULL |    4 |
|    3 |    3 |
|    4 |    4 |
|    1 |    1 |
|    2 |    2 |
|    3 |    3 |
|    4 |    4 |
| NULL |    3 |
| NULL |    4 |
| NULL |    1 |
| NULL |    2 |
| NULL |    3 |
| NULL |    4 |
+------+------+
insert into t2 select c1, c2 from t3;
select * from t2;
+------+------+
| c1   | c2   |
+------+------+
|    3 |    3 |
|    4 |    4 |
|    1 |    1 |
|    2 |    2 |
|    3 |    3 |
|    4 |    4 |
| NULL |    3 |
| NULL |    4 |
| NULL |    1 |
| NULL |    2 |
| NULL |    3 |
| NULL |    4 |
|    3 |    3 |
|    4 |    4 |
|    1 |    1 |
|    2 |    2 |
|    3 |    3 |
|    4 |    4 |
| NULL |    3 |
| NULL |    4 |
| NULL |    1 |
| NULL |    2 |
| NULL |    3 |
| NULL |    4 |
+------+------+
insert into t3 select distinct c1, c2, c1 from t2 where c1 is not null;
select * from t3;
+----+------+------+
| c1 | c2   | c3   |
+----+------+------+
|  1 |    1 |    1 |
|  2 |    2 |    2 |
|  3 |    3 |    3 |
|  4 |    4 |    4 |
+----+------+------+
insert into t1 select * from t4;
insert into t1 select t3.c1, t3.c2 from t3 join t4 using(c1);
insert into t1 select * from (select c1, c2 from t3 union select c1, c2 from t4) tt;
ERROR 23000: Duplicate entry '1' for key 'PRIMARY'

delete from t2;
insert into t2 (c1) select c1 from t1;
select * from t2;
+------+------+
| c1   | c2   |
+------+------+
|    1 | NULL |
|    2 | NULL |
|    3 | NULL |
|    4 | NULL |
+------+------+
insert into test(c2) select c1 from t1;
select * from test;
+----+------+
| c1 | c2   |
+----+------+
|  1 |    1 |
|  2 |    2 |
|  3 |    3 |
|  4 |    4 |
+----+------+
insert into test(c2) select c1 from t1;
select * from test;
+----+------+
| c1 | c2   |
+----+------+
|  1 |    1 |
|  2 |    2 |
|  3 |    3 |
|  4 |    4 |
|  8 |    1 |
|  9 |    2 |
| 10 |    3 |
| 11 |    4 |
+----+------+

drop table t1, t2, t3, t4;
####insert select update
create table t1(c1 int primary key, c2 int, d int default 5);
create table t2(c3 int primary key, c4 int, d int);
insert into t2 values(1,2,3),(3,3,4);
insert into t1 select * from t2 on duplicate key update t1.c1 = t1.c1 + 1;
insert into t1 select * from t2 on duplicate key update t1.c1 = t1.c1 + 1;
select * from t1;
+----+------+------+
| c1 | c2   | d    |
+----+------+------+
|  2 |    2 |    3 |
|  4 |    3 |    4 |
+----+------+------+
insert into t1 select * from t2 on duplicate key update t1.c1 = t1.c1 + 1 + values(c1), c2 = c1 + 3;
delete from t1;
insert into t1(c1) select c3 from t2 on duplicate key update t1.c1 = t1.c1 + 1;
insert into t1(c1) select c3 from t2 on duplicate key update t1.c1 = t1.c1 + 1;
insert into t1(c1) select c3 from t2 on duplicate key update c1 = t1.c1 + 1 + values(c1), c2 = c1 + 3;
select * from t1;
+----+------+------+
| c1 | c2   | d    |
+----+------+------+
|  1 | NULL |    5 |
|  2 | NULL |    5 |
|  3 | NULL |    5 |
|  4 | NULL |    5 |
+----+------+------+
drop table t1,t2;
####insert select update 带自增列
create table t1(c1 int primary key auto_increment, c2 int, c3 int);
create table t2(c4 int primary key, c5 int, c6 int);
insert into t2 values(1,2,3), (3,3,4);
insert into t1(c2,c3) select c4,c5 from t2;
insert into t1(c2,c3) select c4,c5 from t2 on duplicate key update t1.c2 = values(t1.c2) + values(t1.c3);
select * from t1;
+----+------+------+
| c1 | c2   | c3   |
+----+------+------+
|  1 |    1 |    2 |
|  2 |    3 |    3 |
|  4 |    1 |    2 |
|  5 |    3 |    3 |
+----+------+------+
drop table t1;
drop table t2;
create table t2(c1 enum('a','b','c'), c2 enum('a','b','c'));
insert into t2 select c1 ,c1 from t2;
insert into t2 select c1 ,c1 from t2;
select * from t2;
+------+------+
| c1   | c2   |
+------+------+
| a    | a    |
| a    | a    |
| a    | a    |
| a    | a    |
+------+------+
drop table t2;
create table t1 (c1 int, c2 int, primary key(c1));
create table t2 (k1 int, k2 int);
insert into t2 values(1, 1);
explain insert into t1(c1, c2) select k1, k2 from t2 on duplicate key update c1 = c1 - k1;
Query Plan
==============================================================
|ID|OPERATOR           |NAME           |EST.ROWS|EST.TIME(us)|
--------------------------------------------------------------
|0 |INSERT_UP          |               |1       |16          |
|1 |└─SUBPLAN SCAN     |ANONYMOUS_VIEW1|1       |3           |
|2 |  └─TABLE FULL SCAN|t2             |1       |3           |
==============================================================
Outputs & filters:
-------------------------------------
  0 - output(nil), filter(nil)
      columns([{t1: ({t1: (t1.c1, t1.c2)})}]), partitions(p0), 
      column_values([column_conv(INT,PS:(11,0),NOT NULL,ANONYMOUS_VIEW1.k1)], [column_conv(INT,PS:(11,0),NULL,ANONYMOUS_VIEW1.k2)]),
      update([t1.c1=column_conv(INT,PS:(11,0),NOT NULL,cast(t1.c1 - ANONYMOUS_VIEW1.k1, INT(-1, 0)))])
  1 - output([ANONYMOUS_VIEW1.k1], [ANONYMOUS_VIEW1.k2]), filter(nil), rowset=16
      access([ANONYMOUS_VIEW1.k1], [ANONYMOUS_VIEW1.k2])
  2 - output([t2.k1], [t2.k2]), filter(nil), rowset=16
      access([t2.k1], [t2.k2]), partitions(p0)
      is_index_back=false, is_global_index=false, 
      range_key([t2.__pk_increment]), range(MIN ; MAX)always true
insert into t1(c1, c2) select k1, k2 from t2 on duplicate key update c1 = c1 - k1;
select * from t1;
+----+------+
| c1 | c2   |
+----+------+
|  1 |    1 |
+----+------+
insert into t1(c1, c2) select k1, k2 from t2 on duplicate key update c1 = c1 - k1;
select * from t1;
+----+------+
| c1 | c2   |
+----+------+
|  0 |    1 |
+----+------+
insert into t1(c1, c2) select k1, k2 from t2 on duplicate key update c1 = c1 - k1;
select * from t1;
+----+------+
| c1 | c2   |
+----+------+
|  0 |    1 |
|  1 |    1 |
+----+------+
insert into t1(c1, c2) select k1, k2 from t2 on duplicate key update c1 = c1 - k1;
ERROR 23000: Duplicate entry '0' for key 'PRIMARY'
delete from t1;
explain insert into t1(c1, c2) select 1, k2 from t2 on duplicate key update c1 = c1 - k1;
Query Plan
==============================================================
|ID|OPERATOR           |NAME           |EST.ROWS|EST.TIME(us)|
--------------------------------------------------------------
|0 |INSERT_UP          |               |1       |16          |
|1 |└─SUBPLAN SCAN     |ANONYMOUS_VIEW1|1       |3           |
|2 |  └─TABLE FULL SCAN|t2             |1       |3           |
==============================================================
Outputs & filters:
-------------------------------------
  0 - output(nil), filter(nil)
      columns([{t1: ({t1: (t1.c1, t1.c2)})}]), partitions(p0), 
      column_values([column_conv(INT,PS:(11,0),NOT NULL,cast(ANONYMOUS_VIEW1.1, INT(-1, 0)))], [column_conv(INT,PS:(11,0),NULL,ANONYMOUS_VIEW1.k2)]),
      update([t1.c1=column_conv(INT,PS:(11,0),NOT NULL,cast(t1.c1 - ANONYMOUS_VIEW1.k1, INT(-1, 0)))])
  1 - output([ANONYMOUS_VIEW1.1], [ANONYMOUS_VIEW1.k2], [ANONYMOUS_VIEW1.k1]), filter(nil), rowset=16
      access([ANONYMOUS_VIEW1.1], [ANONYMOUS_VIEW1.k2], [ANONYMOUS_VIEW1.k1])
  2 - output([1], [t2.k2], [t2.k1]), filter(nil), rowset=16
      access([t2.k2], [t2.k1]), partitions(p0)
      is_index_back=false, is_global_index=false, 
      range_key([t2.__pk_increment]), range(MIN ; MAX)always true
insert into t1(c1, c2) select 1, k2 from t2 on duplicate key update c1 = c1 - k1;
select * from t1;
+----+------+
| c1 | c2   |
+----+------+
|  1 |    1 |
+----+------+
insert into t1(c1, c2) select 1, k2 from t2 on duplicate key update c1 = c1 - k1;
select * from t1;
+----+------+
| c1 | c2   |
+----+------+
|  0 |    1 |
+----+------+
insert into t1(c1, c2) select 1, k2 from t2 on duplicate key update c1 = c1 - k1;
select * from t1;
+----+------+
| c1 | c2   |
+----+------+
|  0 |    1 |
|  1 |    1 |
+----+------+
insert into t1(c1, c2) select 1, k2 from t2 on duplicate key update c1 = c1 - k1;
ERROR 23000: Duplicate entry '0' for key 'PRIMARY'
drop table t1;
drop table t2;
create table t1 (c1 int, c2 int, primary key(c1));
create index idx on t1(c2) partition by hash(c2) partitions 2;
create table t2 (k1 int, k2 int);
insert into t2 values(1, 2);
explain insert into t1(c1, c2) select k1, k2 from t2 on duplicate key update c1 = c1 - k1;
Query Plan
================================================================
|ID|OPERATOR             |NAME           |EST.ROWS|EST.TIME(us)|
----------------------------------------------------------------
|0 |DISTRIBUTED INSERT_UP|               |1       |22          |
|1 |└─SUBPLAN SCAN       |ANONYMOUS_VIEW1|1       |3           |
|2 |  └─TABLE FULL SCAN  |t2             |1       |3           |
================================================================
Outputs & filters:
-------------------------------------
  0 - output(nil), filter(nil)
      columns([{t1: ({t1: (t1.c1, t1.c2)}, {idx: (t1.c2, t1.c1)})}]), partitions(p0), 
      column_values([column_conv(INT,PS:(11,0),NOT NULL,ANONYMOUS_VIEW1.k1)], [column_conv(INT,PS:(11,0),NULL,ANONYMOUS_VIEW1.k2)]),
      update([t1.c1=column_conv(INT,PS:(11,0),NOT NULL,cast(t1.c1 - ANONYMOUS_VIEW1.k1, INT(-1, 0)))])
  1 - output([ANONYMOUS_VIEW1.k1], [ANONYMOUS_VIEW1.k2]), filter(nil), rowset=16
      access([ANONYMOUS_VIEW1.k1], [ANONYMOUS_VIEW1.k2])
  2 - output([t2.k1], [t2.k2]), filter(nil), rowset=16
      access([t2.k1], [t2.k2]), partitions(p0)
      is_index_back=false, is_global_index=false, 
      range_key([t2.__pk_increment]), range(MIN ; MAX)always true
insert into t1(c1, c2) select k1, k2 from t2 on duplicate key update c1 = c1 - k1;
select * from t1;
+----+------+
| c1 | c2   |
+----+------+
|  1 |    2 |
+----+------+
insert into t1(c1, c2) select k1, k2 from t2 on duplicate key update c1 = c1 - k1;
select * from t1;
+----+------+
| c1 | c2   |
+----+------+
|  0 |    2 |
+----+------+
insert into t1(c1, c2) select k1, k2 from t2 on duplicate key update c1 = c1 - k1;
select * from t1;
+----+------+
| c1 | c2   |
+----+------+
|  0 |    2 |
|  1 |    2 |
+----+------+
insert into t1(c1, c2) select k1, k2 from t2 on duplicate key update c1 = c1 - k1;
ERROR 23000: Duplicate entry '0' for key 'PRIMARY'
delete from t1;
explain insert into t1(c1, c2) select 1, k2 from t2 on duplicate key update c1 = c1 - k1;
Query Plan
================================================================
|ID|OPERATOR             |NAME           |EST.ROWS|EST.TIME(us)|
----------------------------------------------------------------
|0 |DISTRIBUTED INSERT_UP|               |1       |22          |
|1 |└─SUBPLAN SCAN       |ANONYMOUS_VIEW1|1       |3           |
|2 |  └─TABLE FULL SCAN  |t2             |1       |3           |
================================================================
Outputs & filters:
-------------------------------------
  0 - output(nil), filter(nil)
      columns([{t1: ({t1: (t1.c1, t1.c2)}, {idx: (t1.c2, t1.c1)})}]), partitions(p0), 
      column_values([column_conv(INT,PS:(11,0),NOT NULL,cast(ANONYMOUS_VIEW1.1, INT(-1, 0)))], [column_conv(INT,PS:(11,0),NULL,ANONYMOUS_VIEW1.k2)]),
      update([t1.c1=column_conv(INT,PS:(11,0),NOT NULL,cast(t1.c1 - ANONYMOUS_VIEW1.k1, INT(-1, 0)))])
  1 - output([ANONYMOUS_VIEW1.1], [ANONYMOUS_VIEW1.k2], [ANONYMOUS_VIEW1.k1]), filter(nil), rowset=16
      access([ANONYMOUS_VIEW1.1], [ANONYMOUS_VIEW1.k2], [ANONYMOUS_VIEW1.k1])
  2 - output([1], [t2.k2], [t2.k1]), filter(nil), rowset=16
      access([t2.k2], [t2.k1]), partitions(p0)
      is_index_back=false, is_global_index=false, 
      range_key([t2.__pk_increment]), range(MIN ; MAX)always true
insert into t1(c1, c2) select 1, k2 from t2 on duplicate key update c1 = c1 - k1;
select * from t1;
+----+------+
| c1 | c2   |
+----+------+
|  1 |    2 |
+----+------+
insert into t1(c1, c2) select 1, k2 from t2 on duplicate key update c1 = c1 - k1;
select * from t1;
+----+------+
| c1 | c2   |
+----+------+
|  0 |    2 |
+----+------+
insert into t1(c1, c2) select 1, k2 from t2 on duplicate key update c1 = c1 - k1;
select * from t1;
+----+------+
| c1 | c2   |
+----+------+
|  0 |    2 |
|  1 |    2 |
+----+------+
insert into t1(c1, c2) select 1, k2 from t2 on duplicate key update c1 = c1 - k1;
ERROR 23000: Duplicate entry '0' for key 'PRIMARY'
drop table t1;
drop table t2;

CREATE TABLE `t1` (
  `aid` char(2) NOT NULL,
  `avalue` decimal(12,0) NOT NULL,
  PRIMARY KEY (`aid`)
) partition by key(aid) partitions 2;
CREATE TABLE `t2` (
  `id` bigint(20) NOT NULL AUTO_INCREMENT,
  `aid` char(2) NOT NULL,
  `bvalue` decimal(12,0) DEFAULT NULL
) partition by key(aid) partitions 2;
insert into t2 (aid,bvalue) values('1',1000),('1',-100),('1',-100),('1',-100),('1',-100),('1',-100);
insert into t1(aid,avalue) select t2.aid, t2.bvalue from t2 on duplicate key update avalue=avalue+bvalue;
select * from t1;
+-----+--------+
| aid | avalue |
+-----+--------+
| 1   |    500 |
+-----+--------+
select * from t2;
+----+-----+--------+
| id | aid | bvalue |
+----+-----+--------+
|  1 | 1   |   1000 |
|  2 | 1   |   -100 |
|  3 | 1   |   -100 |
|  4 | 1   |   -100 |
|  5 | 1   |   -100 |
|  6 | 1   |   -100 |
+----+-----+--------+
drop table t1, t2;

create table t1(a int primary key, b int) partition by hash(a) partitions 2;
create table t2(a int primary key, b int) partition by hash(a) partitions 2;
insert into t1 values(1, 1), (2, 2);
insert into t2 partition(p0) select * from t1 partition(p1) on duplicate key update a=0;
ERROR HY000: Found a row not matching the given partition set
insert into t2 partition(p0) select * from t1 partition(p0) on duplicate key update a=1;
select * from t2;
+---+------+
| a | b    |
+---+------+
| 2 |    2 |
+---+------+
insert into t2 partition(p0) select * from t1 partition(p0) on duplicate key update a=1;
ERROR HY000: Found a row not matching the given partition set
replace into t2 partition(p0) select * from t1 partition(p0);
select * from t2;
+---+------+
| a | b    |
+---+------+
| 2 |    2 |
+---+------+
replace into t2 partition(p0) select * from t1 partition(p1);
ERROR HY000: Found a row not matching the given partition set
delete from t2;
insert into t2 partition(p0) select * from t1 partition(p0);
select * from t2;
+---+------+
| a | b    |
+---+------+
| 2 |    2 |
+---+------+
insert into t2 partition(p1) select * from t1 partition(p0);
ERROR HY000: Found a row not matching the given partition set
delete from t2;
insert into t2 select * from t1 partition(p0);
select * from t2;
+---+------+
| a | b    |
+---+------+
| 2 |    2 |
+---+------+
insert into t2 partition(p0) select * from t1 where a=1;
ERROR HY000: Found a row not matching the given partition set
select * from t2;
+---+------+
| a | b    |
+---+------+
| 2 |    2 |
+---+------+
insert into t2 partition(p1) select * from t1 where a=2;
ERROR HY000: Found a row not matching the given partition set
insert into t2 partition(p0) select * from t1 where a=2;
ERROR 23000: Duplicate entry '2' for key 'PRIMARY'
select * from t2;
+---+------+
| a | b    |
+---+------+
| 2 |    2 |
+---+------+
drop table t1, t2;

create table t1 (c1 varchar(10)) partition by key (c1) partitions 3;
create table t2 (c1 varchar(10)) partition by key (c1) partitions 3;
insert into t1 values ('001'), ('002'), ('003'), ('004');
insert into t2 partition (p0) select * from t1 partition (p0);
insert into t2 partition (p1) select * from t1 partition (p1);
insert into t2 partition (p2) select * from t1 partition (p2);
select * from t2 order by c1;
+------+
| c1   |
+------+
| 001  |
| 002  |
| 003  |
| 004  |
+------+
delete from t2;
insert into t2 partition (p0) select * from t1 where c1 = '001';
insert into t2 partition (p1) select * from t1 where c1 = '004';
insert into t2 partition (p2) select * from t1 where c1 in ('002', '003');
select * from t2 order by c1;
+------+
| c1   |
+------+
| 001  |
| 002  |
| 003  |
| 004  |
+------+
drop table t1, t2;

##insert null value to not null column in px insert
create table t1(a int primary key, b int not null, c int) partition by hash(a) partitions 2;
create table t2(a int primary key, b int, c int) partition by hash(a) partitions 2;
insert into t2 values(1, null, 1), (2, null, 2), (3, null, 3);
select * from t2;
+---+------+------+
| a | b    | c    |
+---+------+------+
| 2 | NULL |    2 |
| 1 | NULL |    1 |
| 3 | NULL |    3 |
+---+------+------+
explain basic insert /*+parallel(2)*/ into t1 select * from t2;
Query Plan
==============================================
|ID|OPERATOR                 |NAME           |
----------------------------------------------
|0 |PX COORDINATOR           |               |
|1 |└─EXCHANGE OUT DISTR     |:EX10000       |
|2 |  └─PX PARTITION ITERATOR|               |
|3 |    └─INSERT             |               |
|4 |      └─SUBPLAN SCAN     |ANONYMOUS_VIEW1|
|5 |        └─TABLE FULL SCAN|t2             |
==============================================
Outputs & filters:
-------------------------------------
  0 - output(nil), filter(nil), rowset=16
  1 - output(nil), filter(nil), rowset=16
      dop=2
  2 - output(nil), filter(nil), rowset=16
      partition wise, force partition granule
  3 - output(nil), filter(nil)
      columns([{t1: ({t1: (t1.a, t1.b, t1.c)})}]), partitions(p[0-1]), 
      column_values([column_conv(INT,PS:(11,0),NOT NULL,ANONYMOUS_VIEW1.a)], [column_conv(INT,PS:(11,0),NOT NULL,ANONYMOUS_VIEW1.b)], [column_conv(INT,PS:(11,
      0),NULL,ANONYMOUS_VIEW1.c)])
  4 - output([ANONYMOUS_VIEW1.a], [ANONYMOUS_VIEW1.b], [ANONYMOUS_VIEW1.c]), filter(nil), rowset=16
      access([ANONYMOUS_VIEW1.a], [ANONYMOUS_VIEW1.b], [ANONYMOUS_VIEW1.c])
  5 - output([t2.a], [t2.b], [t2.c]), filter(nil), rowset=16
      access([t2.a], [t2.b], [t2.c]), partitions(p[0-1])
      is_index_back=false, is_global_index=false, 
      range_key([t2.a]), range(MIN ; MAX)always true
##expected not null error
insert /*+parallel(2)*/ into t1 select * from t2;
ERROR 23000: Column 'b' cannot be null
update t2 set b=2;
insert /*+parallel(2)*/ into t1 select * from t2;
select * from t1;
+---+---+------+
| a | b | c    |
+---+---+------+
| 2 | 2 |    2 |
| 1 | 2 |    1 |
| 3 | 2 |    3 |
+---+---+------+
drop table t1, t2;
