drop table if exists test;
'insert + strict mode + not null'
create table test (c1 int auto_increment primary key, c2 int not null, c3 int not null default 3,
c4 char(10) not null, c5 char(10) not null default 'hello',
c6 timestamp default '1998-09-23 12:34:12' not null, c7 timestamp not null default '1998-09-23 12:34:12',
c8 time not null, c9 time not null default '12:23:23',
c10 datetime not null, c11 datetime not null default '1998-09-23 12:34:12');
'check column which not give values, but has default values'
insert into test(c1,c2,c4,c6,c8,c10) values(1, 1, 'yes', '2013-02-21 12:23:12', '04:31:12', '2013-02-21 12:23:12');
select * from test;
c1	c2	c3	c4	c5	c6	c7	c8	c9	c10	c11
1	1	3	yes	hello	2013-02-21 12:23:12	1998-09-23 12:34:12	04:31:12	12:23:23	2013-02-21 12:23:12	1998-09-23 12:34:12
delete from test;
'check column which not give values, but has no default values'
insert into test() values();
Got one of the listed errors
insert into test(c1,c2) values(1,1);
Got one of the listed errors
insert into test(c1,c2,c4) values(1,1,'a');
Got one of the listed errors
insert into test(c1,c2,c4,c8) values(1,1,'a','04:31:12');
Got one of the listed errors
insert into test(c1,c2,c4,c8,c10) values(1,1,'a','04:31:12','2013-02-21 12:23:12');
select * from test;
c1	c2	c3	c4	c5	c6	c7	c8	c9	c10	c11
1	1	3	a	hello	1998-09-23 12:34:12	1998-09-23 12:34:12	04:31:12	12:23:23	2013-02-21 12:23:12	1998-09-23 12:34:12
'strict + not null + c1'
delete from test;
insert into test values(1,c2,c3,c4,c5,c6,c7,c8,c9,c10,c11);
select * from test;
c1	c2	c3	c4	c5	c6	c7	c8	c9	c10	c11
1	0	3		hello	1998-09-23 12:34:12	1998-09-23 12:34:12	00:00:00	12:23:23	0000-00-00 00:00:00	1998-09-23 12:34:12
'strict + not null + default'
delete from test;
insert into test(c1,c2,c3,c4,c5,c6,c7,c8,c9,c10,c11) values(default,
default,default,default,default,default,default,default,default,default,default);
ERROR HY000: Field doesn't have a default value
insert into test(c1,c2,c3,c4,c5,c6,c7,c8,c9,c10,c11) values(default,1,default,default,default,default,default,default,default,default,default);
ERROR HY000: Field doesn't have a default value
insert into test(c1,c2,c3,c4,c5,c6,c7,c8,c9,c10,c11) values(default,1,default,2,default,default,default,default,default,default,default);
ERROR HY000: Field doesn't have a default value
insert into test(c1,c2,c3,c4,c5,c6,c7,c8,c9,c10,c11) values(default,1,default,2,default,default,default,'2015-12-12 12:23:12',default,default,default);
ERROR HY000: Field doesn't have a default value
insert into test(c1,c2,c3,c4,c5,c6,c7,c8,c9,c10,c11) values(default,1,default,2,default,default,default,'2015-12-12 12:23:12',default, '2015-12-12 12:23:12',default);
select * from test;
c1	c2	c3	c4	c5	c6	c7	c8	c9	c10	c11
2	1	3	2	hello	1998-09-23 12:34:12	1998-09-23 12:34:12	12:23:12	12:23:23	2015-12-12 12:23:12	1998-09-23 12:34:12
'strict + not null +default(c)'
delete from test;
insert into test(c1,c2,c3,c4,c5,c6,c7,c8,c9,c10,c11)
values(default(c1),default(c2),default(c3),default(c4),default(c5),default(c6),default(c7),default(c8),default(c9),default(c10),default(c11));
ERROR HY000: Field 'c2' doesn't have a default value
insert into test(c1,c2,c3,c4,c5,c6,c7,c8,c9,c10,c11)   values(default(c1),2,default(c3),default(c4),'u',default(c6),default(c7),default(c8),default(c9),default(c10),default(c11));
ERROR HY000: Field 'c4' doesn't have a default value
insert into test(c1,c2,c3,c4,c5,c6,c7,c8,c9,c10,c11)   values(default(c1),2,default(c3),'u',default(c5),default(c6),default(c7),default(c8),default(c9),default(c10),default(c11));
ERROR HY000: Field 'c8' doesn't have a default value
insert into test(c1,c2,c3,c4,c5,c6,c7,c8,c9,c10,c11)   values(default(c1),2,default(c3),'u',default(c5),default(c6),default(c7),'12:23:12',default(c9),default(c10),default(c11));
ERROR HY000: Field 'c10' doesn't have a default value
insert into test(c1,c2,c3,c4,c5,c6,c7,c8,c9,c10,c11)   values(default(c1),2,default(c3),'u',default(c5),default(c6),default(c7),'12:23:12',default(c9),'2015-12-12 12:23:12',default(c11));
drop table test;
'insert + strict mode + null'
create table test (c1 int auto_increment primary key, c2 int  , c3 int   default 3,
c4 char(10)  , c5 char(10)   default 'hello',
c6 timestamp default '1998-09-23 12:34:12'  , c7 timestamp   default '1998-09-23 12:34:12',
c8 time  , c9 time   default '12:23:23',
c10 datetime  , c11 datetime   default '1998-09-23 12:34:12');
'check column which not give values, but has default values'
insert into test(c1,c2,c4,c6,c8,c10) values(1, 1, 'yes', '2013-02-21 12:23:12', '04:31:12', '2013-02-21 12:23:12');
select * from test;
c1	c2	c3	c4	c5	c6	c7	c8	c9	c10	c11
1	1	3	yes	hello	2013-02-21 12:23:12	1998-09-23 12:34:12	04:31:12	12:23:23	2013-02-21 12:23:12	1998-09-23 12:34:12
delete from test;
'check column which not give values, but has no default values'
insert into test values();
select * from test;
c1	c2	c3	c4	c5	c6	c7	c8	c9	c10	c11
2	NULL	3	NULL	hello	1998-09-23 12:34:12	1998-09-23 12:34:12	NULL	12:23:23	NULL	1998-09-23 12:34:12
'strict + not null + c1'
delete from test;
insert into test values(1,c2,c3,c4,c5,c6,c7,c8,c9,c10,c11);
select * from test;
c1	c2	c3	c4	c5	c6	c7	c8	c9	c10	c11
1	NULL	3	NULL	hello	1998-09-23 12:34:12	1998-09-23 12:34:12	NULL	12:23:23	NULL	1998-09-23 12:34:12
'strict + not null + default'
delete from test;
insert into test(c1,c2,c3,c4,c5,c6,c7,c8,c9,c10,c11) values(default,
default,default,default,default,default,default,default,default,default,default);
'strict + not null +default(c)'
delete from test;
insert into test(c1,c2,c3,c4,c5,c6,c7,c8,c9,c10,c11)
values(default(c1),default(c2),default(c3),default(c4),default(c5),default(c6),default(c7),default(c8),default(c9),default(c10),default(c11));
drop table test;
'insert + not strict + not null'
set sql_mode='';
create table test (c1 int auto_increment primary key, c2 int not null, c3 int not null default 3,
c4 char(10) not null, c5 char(10) not null default 'hello',
c6 timestamp default '1998-09-23 12:34:12' not null, c7 timestamp not null default '1998-09-23 12:34:12',
c8 time not null, c9 time not null default '12:23:23',
c10 datetime not null, c11 datetime not null default '1998-09-23 12:34:12');
'check column which not give values, but has default values'
insert into test(c1,c2,c4,c6,c8,c10) values(1, 1, 'yes', '2013-02-21 12:23:12', '04:31:12', '2013-02-21 12:23:12');
select * from test;
c1	c2	c3	c4	c5	c6	c7	c8	c9	c10	c11
1	1	3	yes	hello	2013-02-21 12:23:12	1998-09-23 12:34:12	04:31:12	12:23:23	2013-02-21 12:23:12	1998-09-23 12:34:12
delete from test;
'check column which not give values, but has no default values'
insert into test() values();
Warnings:
Warning	1364	Field 'c2' doesn't have a default value
Warning	1364	Field 'c4' doesn't have a default value
Warning	1364	Field 'c8' doesn't have a default value
Warning	1364	Field 'c10' doesn't have a default value
select * from test;
c1	c2	c3	c4	c5	c6	c7	c8	c9	c10	c11
2	0	3		hello	1998-09-23 12:34:12	1998-09-23 12:34:12	00:00:00	12:23:23	0000-00-00 00:00:00	1998-09-23 12:34:12
'not strict + not null + c1'
delete from test;
insert into test values(1,c2,c3,c4,c5,c6,c7,c8,c9,c10,c11);
select * from test;
c1	c2	c3	c4	c5	c6	c7	c8	c9	c10	c11
1	0	3		hello	1998-09-23 12:34:12	1998-09-23 12:34:12	00:00:00	12:23:23	0000-00-00 00:00:00	1998-09-23 12:34:12
'not strict + not null + default'
delete from test;
insert into test(c1,c2,c3,c4,c5,c6,c7,c8,c9,c10,c11) values(default,
default,default,default,default,default,default,default,default,default,default);
'not strict + not null +default(c)'
delete from test;
insert into test(c1,c2,c3,c4,c5,c6,c7,c8,c9,c10,c11)
values(default(c1),default(c2),default(c3),default(c4),default(c5),default(c6),default(c7),default(c8),default(c9),default(c10),default(c11));
ERROR HY000: Field 'c2' doesn't have a default value
insert into test(c1,c2,c3,c4,c5,c6,c7,c8,c9,c10,c11)   values(default(c1),2,default(c3),default(c4),'u',default(c6),default(c7),default(c8),default(c9),default(c10),default(c11));
ERROR HY000: Field 'c4' doesn't have a default value
insert into test(c1,c2,c3,c4,c5,c6,c7,c8,c9,c10,c11)   values(default(c1),2,default(c3),'u',default(c5),default(c6),default(c7),default(c8),default(c9),default(c10),default(c11));
ERROR HY000: Field 'c8' doesn't have a default value
insert into test(c1,c2,c3,c4,c5,c6,c7,c8,c9,c10,c11)   values(default(c1),2,default(c3),'u',default(c5),default(c6),default(c7),'12:23:12',default(c9),default(c10),default(c11));
ERROR HY000: Field 'c10' doesn't have a default value
insert into test(c1,c2,c3,c4,c5,c6,c7,c8,c9,c10,c11)  
values(default(c1),2,default(c3),'u',default(c5),default(c6),default(c7),'12:23:12',default(c9),'2015-12-12 12:23:12',default(c11));
drop table test;
'not strict + null + ..'
create table test (c1 int auto_increment primary key, c2 int  , c3 int   default 3,
c4 char(10)  , c5 char(10)   default 'hello',
c6 timestamp default '1998-09-23 12:34:12'  , c7 timestamp   default '1998-09-23 12:34:12',
c8 time  , c9 time   default '12:23:23',
c10 datetime  , c11 datetime   default '1998-09-23 12:34:12');
'check column which not give values, but has default values'
insert into test(c1,c2,c4,c6,c8,c10) values(1, 1, 'yes', '2013-02-21 12:23:12', '04:31:12', '2013-02-21 12:23:12');
select * from test;
c1	c2	c3	c4	c5	c6	c7	c8	c9	c10	c11
1	1	3	yes	hello	2013-02-21 12:23:12	1998-09-23 12:34:12	04:31:12	12:23:23	2013-02-21 12:23:12	1998-09-23 12:34:12
delete from test;
'check column which not give values, but has no default values'
insert into test values();
select * from test;
c1	c2	c3	c4	c5	c6	c7	c8	c9	c10	c11
2	NULL	3	NULL	hello	1998-09-23 12:34:12	1998-09-23 12:34:12	NULL	12:23:23	NULL	1998-09-23 12:34:12
'strict + not null + c1'
delete from test;
insert into test values(1,c2,c3,c4,c5,c6,c7,c8,c9,c10,c11);
select * from test;
c1	c2	c3	c4	c5	c6	c7	c8	c9	c10	c11
1	NULL	3	NULL	hello	1998-09-23 12:34:12	1998-09-23 12:34:12	NULL	12:23:23	NULL	1998-09-23 12:34:12
'strict + not null + default'
delete from test;
insert into test(c1,c2,c3,c4,c5,c6,c7,c8,c9,c10,c11) values(default,
default,default,default,default,default,default,default,default,default,default);
select * from test;
c1	c2	c3	c4	c5	c6	c7	c8	c9	c10	c11
3	NULL	3	NULL	hello	1998-09-23 12:34:12	1998-09-23 12:34:12	NULL	12:23:23	NULL	1998-09-23 12:34:12
'strict + not null +default(c)'
delete from test;
insert into test(c1,c2,c3,c4,c5,c6,c7,c8,c9,c10,c11)
values(default(c1),default(c2),default(c3),default(c4),default(c5),default(c6),default(c7),default(c8),default(c9),default(c10),default(c11));
select * from test;
c1	c2	c3	c4	c5	c6	c7	c8	c9	c10	c11
4	NULL	3	NULL	hello	1998-09-23 12:34:12	1998-09-23 12:34:12	NULL	12:23:23	NULL	1998-09-23 12:34:12
drop table test;
create table test (c1 int auto_increment primary key, c2 int not null, c3 int not null default 3,
c4 char(10) not null, c5 char(10) not null default 'hello',
c6 timestamp default '1998-09-23 12:34:12' not null, c7 timestamp not null default '1998-09-23 12:34:12',
c8 time not null, c9 time not null default '12:23:23',
c10 datetime not null, c11 datetime not null default '1998-09-23 12:34:12');
set @@sql_mode='strict_all_tables,strict_trans_tables';
'strict + not null'
insert into test(c1,c2,c3,c4,c5,c6,c7,c8,c9,c10,c11) values(1, 100, 100,'y','y','1999-09-09 12:09:09', '1999-09-09 12:09:09',
'12:12:12','12:12:12', '1999-09-09 12:09:09', '1999-09-09 12:09:09');
update test set c2=default,c3=default,c4=default,c5=default,c6=default,c7=default,c8=default,c9=default,c10=default,c11=default;
ERROR HY000: Field doesn't have a default value
update test set c3=default,c4=default,c5=default,c6=default,c7=default,c8=default,c9=default,c10=default,c11=default;
ERROR HY000: Field doesn't have a default value
update test set c3=default,c5=default,c6=default,c7=default,c8=default,c9=default,c10=default,c11=default;
ERROR HY000: Field doesn't have a default value
update test set c3=default,c5=default,c6=default,c7=default,c9=default,c10=default,c11=default;
ERROR HY000: Field doesn't have a default value
update test set c3=default,c5=default,c6=default,c7=default,c9=default,c11=default;
delete from test;
insert into test(c1,c2,c3,c4,c5,c6,c7,c8,c9,c10,c11) values(1, 100, 100,'y','y','1999-09-09 12:09:09', '1999-09-09 12:09:09',
'12:12:12','12:12:12', '1999-09-09 12:09:09', '1999-09-09 12:09:09');
update test set c2=default(c2),c3=default(c3),c4=default(c4),c5=default(c5),c6=default(c6),c7=default(c7),
c8=default(c8),c9=default(c9),c10=default(c10),c11=default(c11);
ERROR HY000: Field 'c2' doesn't have a default value
update test set c3=default(c3),c4=default(c4),c5=default(c5),c6=default(c6),c7=default(c7),
c8=default(c8),c9=default(c9),c10=default(c10),c11=default(c11);
ERROR HY000: Field 'c4' doesn't have a default value
update test set c3=default(c3),c5=default(c5),c6=default(c6),c7=default(c7),
c8=default(c8),c9=default(c9),c10=default(c10),c11=default(c11);
ERROR HY000: Field 'c8' doesn't have a default value
update test set c3=default(c3),c5=default(c5),c6=default(c6),c7=default(c7),
c9=default(c9),c10=default(c10),c11=default(c11);
ERROR HY000: Field 'c10' doesn't have a default value
update test set c3=default(c3),c5=default(c5),c6=default(c6),c7=default(c7),
c9=default(c9),c11=default(c11);
'strict + null'
drop table test;
create table test (c1 int auto_increment primary key, c2 int  , c3 int   default 3,
c4 char(10)  , c5 char(10)   default 'hello',
c6 timestamp default '1998-09-23 12:34:12'  , c7 timestamp   default '1998-09-23 12:34:12',
c8 time  , c9 time   default '12:23:23',
c10 datetime  , c11 datetime   default '1998-09-23 12:34:12');
insert into test(c1,c2,c3,c4,c5,c6,c7,c8,c9,c10,c11) values(1, 100, 100,'y','y','1999-09-09 12:09:09', '1999-09-09 12:09:09',
'12:12:12','12:12:12', '1999-09-09 12:09:09', '1999-09-09 12:09:09');
update test set c2=default,c3=default,c4=default,c5=default,c6=default,c7=default,c8=default,c9=default,c10=default,c11=default;
select * from test;
c1	c2	c3	c4	c5	c6	c7	c8	c9	c10	c11
1	NULL	3	NULL	hello	1998-09-23 12:34:12	1998-09-23 12:34:12	NULL	12:23:23	NULL	1998-09-23 12:34:12
delete from test;
insert into test(c1,c2,c3,c4,c5,c6,c7,c8,c9,c10,c11) values(1, 100, 100,'y','y','1999-09-09 12:09:09', '1999-09-09 12:09:09',
'12:12:12','12:12:12', '1999-09-09 12:09:09', '1999-09-09 12:09:09');
update test set c2=default(c2),c3=default(c3),c4=default(c4),c5=default(c5),c6=default(c6),c7=default(c7),
c8=default(c8),c9=default(c9),c10=default(c10),c11=default(c11);
select * from test;
c1	c2	c3	c4	c5	c6	c7	c8	c9	c10	c11
1	NULL	3	NULL	hello	1998-09-23 12:34:12	1998-09-23 12:34:12	NULL	12:23:23	NULL	1998-09-23 12:34:12
set @@sql_mode='';
delete from test;
insert into test(c1,c2,c3,c4,c5,c6,c7,c8,c9,c10,c11) values(1, 100, 100,'y','y','1999-09-09 12:09:09', '1999-09-09 12:09:09',
'12:12:12','12:12:12', '1999-09-09 12:09:09', '1999-09-09 12:09:09');
update test set c2=default,c3=default,c4=default,c5=default,c6=default,c7=default,c8=default,c9=default,c10=default,c11=default;
select * from test;
c1	c2	c3	c4	c5	c6	c7	c8	c9	c10	c11
1	NULL	3	NULL	hello	1998-09-23 12:34:12	1998-09-23 12:34:12	NULL	12:23:23	NULL	1998-09-23 12:34:12
delete from test;
insert into test(c1,c2,c3,c4,c5,c6,c7,c8,c9,c10,c11) values(1, 100, 100,'y','y','1999-09-09 12:09:09', '1999-09-09 12:09:09',
'12:12:12','12:12:12', '1999-09-09 12:09:09', '1999-09-09 12:09:09');
update test set c2=default(c2),c3=default(c3),c4=default(c4),c5=default(c5),c6=default(c6),c7=default(c7),
c8=default(c8),c9=default(c9),c10=default(c10),c11=default(c11);
select * from test;
c1	c2	c3	c4	c5	c6	c7	c8	c9	c10	c11
1	NULL	3	NULL	hello	1998-09-23 12:34:12	1998-09-23 12:34:12	NULL	12:23:23	NULL	1998-09-23 12:34:12
drop table test;
'not strict + not null'
create table test (c1 int auto_increment primary key, c2 int not null, c3 int not null default 3,
c4 char(10) not null, c5 char(10) not null default 'hello',
c6 timestamp default '1998-09-23 12:34:12' not null, c7 timestamp not null default '1998-09-23 12:34:12',
c8 time not null, c9 time not null default '12:23:23',
c10 datetime not null, c11 datetime not null default '1998-09-23 12:34:12');
insert into test(c1,c2,c3,c4,c5,c6,c7,c8,c9,c10,c11) values(1, 100, 100,'y','y','1999-09-09 12:09:09', '1999-09-09 12:09:09',
'12:12:12','12:12:12', '1999-09-09 12:09:09', '1999-09-09 12:09:09');
update test set c2=default,c3=default,c4=default,c5=default,c6=default,c7=default,c8=default,c9=default,c10=default,c11=default;
select * from test;
c1	c2	c3	c4	c5	c6	c7	c8	c9	c10	c11
1	0	3		hello	1998-09-23 12:34:12	1998-09-23 12:34:12	00:00:00	12:23:23	0000-00-00 00:00:00	1998-09-23 12:34:12
delete from test;
insert into test(c1,c2,c3,c4,c5,c6,c7,c8,c9,c10,c11) values(1, 100, 100,'y','y','1999-09-09 12:09:09', '1999-09-09 12:09:09',
'12:12:12','12:12:12', '1999-09-09 12:09:09', '1999-09-09 12:09:09');
update test set c2=default(c2),c3=default(c3),c4=default(c4),c5=default(c5),c6=default(c6),c7=default(c7),
c8=default(c8),c9=default(c9),c10=default(c10),c11=default(c11);
ERROR HY000: Field 'c2' doesn't have a default value
select * from test;
c1	c2	c3	c4	c5	c6	c7	c8	c9	c10	c11
1	100	100	y	y	1999-09-09 12:09:09	1999-09-09 12:09:09	12:12:12	12:12:12	1999-09-09 12:09:09	1999-09-09 12:09:09
update test set c3=default(c3),c4=default(c4),c5=default(c5),c6=default(c6),c7=default(c7),
c8=default(c8),c9=default(c9),c10=default(c10),c11=default(c11);
ERROR HY000: Field 'c4' doesn't have a default value
update test set c3=default(c3),c5=default(c5),c6=default(c6),c7=default(c7),
c8=default(c8),c9=default(c9),c10=default(c10),c11=default(c11);
ERROR HY000: Field 'c8' doesn't have a default value
update test set c3=default(c3),c5=default(c5),c6=default(c6),c7=default(c7),
c9=default(c9),c10=default(c10),c11=default(c11);
ERROR HY000: Field 'c10' doesn't have a default value
update test set c3=default(c3),c5=default(c5),c6=default(c6),c7=default(c7),
c9=default(c9),c11=default(c11);
