drop table if exists test;
'insert + strict mode + not null'
create table test (c1 int auto_increment primary key, c2 int not null, c3 int not null default 3,
c4 char(10) not null, c5 char(10) not null default 'hello',
c6 timestamp not null, c7 timestamp not null default '1998-09-23 12:34:12',
c8 time not null, c9 time not null default '12:23:23',
c10 datetime not null, c11 datetime not null default '1998-09-23 12:34:12');
insert into test set c1 = 1,c2=c2,c3=c3,c4=c4,c5=c5,c6=c6,c7=c7,c8=c8,c9=c9,c10=c10,c11=c11;
select * from test;
c1	c2	c3	c4	c5	c6	c7	c8	c9	c10	c11
1	0	3		hello	0000-00-00 00:00:00	1998-09-23 12:34:12	00:00:00	12:23:23	0000-00-00 00:00:00	1998-09-23 12:34:12
'strict + not null + default'
delete from test;
insert into test set c1= default,
c2=default,c3=default,c4=default,c5=default,c6=default,c7=default,c8=default,c9=default,c10=default,c11=default;
ERROR HY000: Field doesn't have a default value
insert into test set c1= default,
c2=1,c3=default,c4=default,c5=default,c6=default,c7=default,c8=default,c9=default,c10=default,c11=default;
ERROR HY000: Field doesn't have a default value
insert into test set c1= default,
c2=1,c3=default,c4='ese',c5=default,c6=default,c7=default,c8=default,c9=default,c10=default,c11=default;
ERROR HY000: Field doesn't have a default value
insert into test set c1= default,
c2=1,c3=default,c4='ese',c5=default,c6=default,c7=default,c8='12:23:12',c9=default,c10=default,c11=default;
ERROR HY000: Field doesn't have a default value
insert into test set c1= default,
c2=1,c3=default,c4='ese',c5=default,c6=default,c7=default,c8='12:23:12',c9=default,c10='1998-09-23 12:34:12',c11=default;
select c1,c2,c3,c4,c5,c7,c8,c9,c10,c11 from test;
c1	c2	c3	c4	c5	c7	c8	c9	c10	c11
6	1	3	ese	hello	1998-09-23 12:34:12	12:23:12	12:23:23	1998-09-23 12:34:12	1998-09-23 12:34:12
'strict + not null + default(c1)'
delete from test;
insert into test set c1 = default(c1), c2 = default(c2),c3=default(c3),c4=default(c4),
c5=default(c5),c6=default(c6),c7=default(c7),c8=default(c8),c9=default(c9),c10=default(c10),c11=default(c11);
ERROR HY000: Field 'c2' doesn't have a default value
insert into test set c1 = default(c1), c2 = 100,c3=default(c3),c4=default(c4),
c5=default(c5),c6=default(c6),c7=default(c7),c8=default(c8),c9=default(c9),c10=default(c10),c11=default(c11);
ERROR HY000: Field 'c4' doesn't have a default value
insert into test set c1 = default(c1), c2 = 100,c3=default(c3),c4='yes3',
c5=default(c5),c6=default(c6),c7=default(c7),c8=default(c8),c9=default(c9),c10=default(c10),c11=default(c11);
ERROR HY000: Field 'c8' doesn't have a default value
insert into test set c1 = default(c1), c2 = 100,c3=default(c3),c4='yes3',
c5=default(c5),c6=default(c6),c7=default(c7),c8='12:23:12',c9=default(c9),c10=default(c10),c11=default(c11);
ERROR HY000: Field 'c10' doesn't have a default value
insert into test set c1 = default(c1), c2 = 100,c3=default(c3),c4='yes3',
c5=default(c5),c6=default(c6),c7=default(c7),c8='12:23:12',c9=default(c9),c10='2013-02-12 23:22:22',c11=default(c11);
'strict + not null + 不带'
delete from test;
insert into test set c1 = 5;
Got one of the listed errors
insert into test set c1 = 5, c2 = 100;
Got one of the listed errors
insert into test set c1 = 5, c2 = 100, c4='no';
Got one of the listed errors
insert into test set c1 = 5, c2 = 100, c4='no',c8='12:23:12';
Got one of the listed errors
insert into test set c1 = 5, c2 = 100, c4='no',c8='12:23:12', c10='2013-02-12 23:22:22';
set @@sql_mode='';
'not strict + not null'
delete from test;
insert into test set c1 = 1,c2=c2,c3=c3,c4=c4,c5=c5,c6=c6,c7=c7,c8=c8,c9=c9,c10=c10,c11=c11;
select c1,c2,c3,c4,c5,c7,c8,c9,c10,c11 from test;
c1	c2	c3	c4	c5	c7	c8	c9	c10	c11
1	0	3		hello	1998-09-23 12:34:12	00:00:00	12:23:23	0000-00-00 00:00:00	1998-09-23 12:34:12
'not strict + not null + default'
delete from test;
insert into test set c1= default,
c2=default,c3=default,c4=default,c5=default,c6=default,c7=default,c8=default,c9=default,c10=default,c11=default;
select c1,c2,c3,c4,c5,c7,c8,c9,c10,c11 from test;
c1	c2	c3	c4	c5	c7	c8	c9	c10	c11
8	0	3		hello	1998-09-23 12:34:12	00:00:00	12:23:23	0000-00-00 00:00:00	1998-09-23 12:34:12
'strict + not null + default(c1)'
delete from test;
insert into test set c1 = default(c1), c2 = default(c2),c3=default(c3),c4=default(c4),
c5=default(c5),c6=default(c6),c7=default(c7),c8=default(c8),c9=default(c9),c10=default(c10),c11=default(c11);
ERROR HY000: Field 'c2' doesn't have a default value
insert into test set c1 = default(c1), c2 = 100,c3=default(c3),c4=default(c4),
c5=default(c5),c6=default(c6),c7=default(c7),c8=default(c8),c9=default(c9),c10=default(c10),c11=default(c11);
ERROR HY000: Field 'c4' doesn't have a default value
insert into test set c1 = default(c1), c2 = 100,c3=default(c3),c4='yes3',
c5=default(c5),c6=default(c6),c7=default(c7),c8=default(c8),c9=default(c9),c10=default(c10),c11=default(c11);
ERROR HY000: Field 'c8' doesn't have a default value
insert into test set c1 = default(c1), c2 = 100,c3=default(c3),c4='yes3',
c5=default(c5),c6=default(c6),c7=default(c7),c8='12:23:12',c9=default(c9),c10=default(c10),c11=default(c11);
ERROR HY000: Field 'c10' doesn't have a default value
insert into test set c1 = default(c1), c2 = 100,c3=default(c3),c4='yes3',
c5=default(c5),c6=default(c6),c7=default(c7),c8='12:23:12',c9=default(c9),c10='2013-02-12 23:22:22',c11=default(c11);
'strict + not null + 不带'
delete from test;
insert /*+USE_PLAN_CACHE(NONE)*/ into test set c1 = 5;
Warnings:
Warning	1364	Field 'c2' doesn't have a default value
Warning	1364	Field 'c4' doesn't have a default value
Warning	1364	Field 'c8' doesn't have a default value
Warning	1364	Field 'c10' doesn't have a default value
select c1,c2,c3,c4,c5,c7,c8,c9,c10,c11 from test;
c1	c2	c3	c4	c5	c7	c8	c9	c10	c11
5	0	3		hello	1998-09-23 12:34:12	00:00:00	12:23:23	0000-00-00 00:00:00	1998-09-23 12:34:12
drop table test;
'insert + strict mode +  '
create table test (c1 int auto_increment primary key, c2 int  , c3 int   default 3,
c4 char(10)  , c5 char(10)   default 'hello',
c6 timestamp  , c7 timestamp   default '1998-09-23 12:34:12',
c8 time  , c9 time   default '12:23:23',
c10 datetime  , c11 datetime   default '1998-09-23 12:34:12');
insert into test set c1 = 1,c2=c2,c3=c3,c4=c4,c5=c5,c6=c6,c7=c7,c8=c8,c9=c9,c10=c10,c11=c11;
select * from test;
c1	c2	c3	c4	c5	c6	c7	c8	c9	c10	c11
1	NULL	3	NULL	hello	0000-00-00 00:00:00	1998-09-23 12:34:12	NULL	12:23:23	NULL	1998-09-23 12:34:12
'strict +   + default'
delete from test;
insert into test set c1= default,
c2=default,c3=default,c4=default,c5=default,c6=default,c7=default,c8=default,c9=default,c10=default,c11=default;
select c1,c2,c3,c4,c5,c7,c8,c9,c10,c11 from test;
c1	c2	c3	c4	c5	c7	c8	c9	c10	c11
2	NULL	3	NULL	hello	1998-09-23 12:34:12	NULL	12:23:23	NULL	1998-09-23 12:34:12
'strict +   + default(c1)'
delete from test;
insert into test set c1 = default(c1), c2 = default(c2),c3=default(c3),c4=default(c4),
c5=default(c5),c6=default(c6),c7=default(c7),c8=default(c8),c9=default(c9),c10=default(c10),c11=default(c11);
select * from test;
c1	c2	c3	c4	c5	c6	c7	c8	c9	c10	c11
3	NULL	3	NULL	hello	0000-00-00 00:00:00	1998-09-23 12:34:12	NULL	12:23:23	NULL	1998-09-23 12:34:12
'strict +   + 不带'
delete from test;
insert into test set c1 = 5;
select c1,c2,c3,c4,c5,c7,c8,c9,c10,c11 from test;
c1	c2	c3	c4	c5	c7	c8	c9	c10	c11
5	NULL	3	NULL	hello	1998-09-23 12:34:12	NULL	12:23:23	NULL	1998-09-23 12:34:12
set @@sql_mode='';
'not strict +  '
insert into test set c1 = 1,c2=c2,c3=c3,c4=c4,c5=c5,c6=c6,c7=c7,c8=c8,c9=c9,c10=c10,c11=c11;
select c1,c2,c3,c4,c5,c7,c8,c9,c10,c11 from test;
c1	c2	c3	c4	c5	c7	c8	c9	c10	c11
1	NULL	3	NULL	hello	1998-09-23 12:34:12	NULL	12:23:23	NULL	1998-09-23 12:34:12
5	NULL	3	NULL	hello	1998-09-23 12:34:12	NULL	12:23:23	NULL	1998-09-23 12:34:12
'not strict +   + default'
delete from test;
insert into test set c1= default,
c2=default,c3=default,c4=default,c5=default,c6=default,c7=default,c8=default,c9=default,c10=default,c11=default;
select c1,c2,c3,c4,c5,c7,c8,c9,c10,c11 from test;
c1	c2	c3	c4	c5	c7	c8	c9	c10	c11
6	NULL	3	NULL	hello	1998-09-23 12:34:12	NULL	12:23:23	NULL	1998-09-23 12:34:12
'strict +   + default(c1)'
delete from test;
insert into test set c1 = default(c1), c2 = default(c2),c3=default(c3),c4=default(c4),
c5=default(c5),c6=default(c6),c7=default(c7),c8=default(c8),c9=default(c9),c10=default(c10),c11=default(c11);
select * from test;
c1	c2	c3	c4	c5	c6	c7	c8	c9	c10	c11
7	NULL	3	NULL	hello	0000-00-00 00:00:00	1998-09-23 12:34:12	NULL	12:23:23	NULL	1998-09-23 12:34:12
'strict +   + 不带'
delete from test;
insert into test set c1 = 5;
select c1,c2,c3,c4,c5,c7,c8,c9,c10,c11 from test;
c1	c2	c3	c4	c5	c7	c8	c9	c10	c11
5	NULL	3	NULL	hello	1998-09-23 12:34:12	NULL	12:23:23	NULL	1998-09-23 12:34:12
drop table test;
create table test (c1 decimal, c2 decimal(65, 30));
explain insert into test set c1 = 1 * c2;
Query Plan
==================================================
|ID|OPERATOR          |NAME|EST.ROWS|EST.TIME(us)|
--------------------------------------------------
|0 |DISTRIBUTED INSERT|    |1       |13          |
|1 |└─EXPRESSION      |    |1       |1           |
==================================================
Outputs & filters:
-------------------------------------
  0 - output(nil), filter(nil)
      columns([{test: ({test: (test.__pk_increment, test.c1, test.c2)})}]), 
      column_values([T_HIDDEN_PK], [column_conv(DECIMAL_INT,PS:(10,0),NULL,__values.c1)], [column_conv(DECIMAL_INT,PS:(65,30),NULL,cast(NULL, DECIMAL_INT(65,
       30)))])
  1 - output([__values.c1]), filter(nil)
      values({column_conv(DECIMAL_INT,PS:(10,0),NULL,cast(cast(1, DECIMAL_INT(81, 0)) * cast(cast(NULL, DECIMAL_INT(65, 30)), DECIMAL_INT(81, 30)), DECIMAL_INT(10,
       0)))})
insert into test set c1 = 1 * c2;
explain insert into test set c1 = 1.1 * c2;
Query Plan
==================================================
|ID|OPERATOR          |NAME|EST.ROWS|EST.TIME(us)|
--------------------------------------------------
|0 |DISTRIBUTED INSERT|    |1       |13          |
|1 |└─EXPRESSION      |    |1       |1           |
==================================================
Outputs & filters:
-------------------------------------
  0 - output(nil), filter(nil)
      columns([{test: ({test: (test.__pk_increment, test.c1, test.c2)})}]), 
      column_values([T_HIDDEN_PK], [column_conv(DECIMAL_INT,PS:(10,0),NULL,__values.c1)], [column_conv(DECIMAL_INT,PS:(65,30),NULL,cast(NULL, DECIMAL_INT(65,
       30)))])
  1 - output([__values.c1]), filter(nil)
      values({column_conv(DECIMAL_INT,PS:(10,0),NULL,cast(cast(1.1, DECIMAL_INT(67, 1)) * cast(NULL, DECIMAL_INT(65, 30)), DECIMAL_INT(10, 0)))})
insert into test set c1 = 1.1 * c2;
explain insert into test set c1 = '1.1' * c2;
Query Plan
==================================================
|ID|OPERATOR          |NAME|EST.ROWS|EST.TIME(us)|
--------------------------------------------------
|0 |DISTRIBUTED INSERT|    |1       |13          |
|1 |└─EXPRESSION      |    |1       |1           |
==================================================
Outputs & filters:
-------------------------------------
  0 - output(nil), filter(nil)
      columns([{test: ({test: (test.__pk_increment, test.c1, test.c2)})}]), 
      column_values([T_HIDDEN_PK], [column_conv(DECIMAL_INT,PS:(10,0),NULL,__values.c1)], [column_conv(DECIMAL_INT,PS:(65,30),NULL,cast(NULL, DECIMAL_INT(65,
       30)))])
  1 - output([__values.c1]), filter(nil)
      values({column_conv(DECIMAL_INT,PS:(10,0),NULL,cast(cast('1.1', DOUBLE(-1, -1)) * cast(cast(NULL, DECIMAL_INT(65, 30)), DOUBLE(65, 30)), DECIMAL_INT(10,
       0)))})
insert into test set c1 = '1.1' * c2;
select * from test;
c1	c2
NULL	NULL
NULL	NULL
NULL	NULL
drop table test;
