ob1=OBI(cluster=1:1:1, proxy_num=0);
ob1.z1.obs0.set extra_config=$extra_conf;
ob1.z2.obs0.set extra_config=$extra_conf;
ob1.z3.obs0.set extra_config=$extra_conf;
ob1.reboot;
set @@session.ob_query_timeout = 1000000000;
CREATE RESOURCE UNIT unit_1 MAX_CPU 1, MEMORY_SIZE '2G', MAX_IOPS 100000, LOG_DISK_SIZE '2G';
CREATE RESOURCE POOL pool_1 UNIT = 'unit_1', UNIT_NUM = 1, zone_list = ('z1', 'z2', 'z3');;
CREATE TENANT mysql RESOURCE_POOL_LIST = ('pool_1'), primary_zone='z1;z2' set ob_tcp_invited_nodes='%';
ob1.check_until_timeout select count(*) as cnt from oceanbase.__all_virtual_server_schema_info as a join oceanbase.__all_virtual_server_schema_info as b on a.tenant_id = b.tenant_id  where a.refreshed_schema_version != b.refreshed_schema_version, 0, 60;
ob1.check_until_timeout select count(*) from __all_virtual_ls_meta_table where tenant_id = '$mysql_tenant_id' and ls_id = 1001 and role = 1, 1, 60;
ob1.check_until_timeout select count(*) from __all_virtual_ls_meta_table where tenant_id = '$mysql_tenant_id' and ls_id = 1001 and role = 1 and svr_ip = '$z3_ip' and svr_port = '$z3_port', 0, 60;
alter system set log_transport_compress_all= 'True';
alter system set log_transport_compress_func= 'lz4_1.0';
create table t1 (c1 int primary key, c2 int);
ob1.check_until_timeout select count(*) as cnt from oceanbase.__all_virtual_server_schema_info as a join oceanbase.__all_virtual_server_schema_info as b on a.tenant_id = b.tenant_id  where a.refreshed_schema_version != b.refreshed_schema_version, 0, 60;
insert into t1 values(1, 11);
insert into t1 values(2, 22);
insert into t1 values(3, 33);
insert into t1 values(4, 44);
insert into t1 values(5, 55);
update t1 set c2=2222 where c1=2;
delete from t1 where c2<100;
select * from t1 where c1 != 5;
c1	c2
2	2222
ob1.check_until_timeout select count(*) as cnt from oceanbase.__all_virtual_server_schema_info as a join oceanbase.__all_virtual_server_schema_info as b on a.tenant_id = b.tenant_id  where a.refreshed_schema_version != b.refreshed_schema_version, 0, 60;
alter system switch replica leader ls=1001 server='11.124.5.20:42325' tenant='mysql';
ob1.check_until_timeout select count(*) from __all_virtual_ls_meta_table where tenant_id = '$mysql_tenant_id' and concat(svr_ip,':',svr_port) = '$follower_ip_port_1' and ls_id = 1001 and role = 1, 1, 60;
ob1.z1.obs0.force_stop;
ob1.z1.obs0.nstart;
ob1.check_until_timeout select count(*) as cnt from oceanbase.__all_virtual_server_schema_info as a join oceanbase.__all_virtual_server_schema_info as b on a.tenant_id = b.tenant_id  where a.refreshed_schema_version != b.refreshed_schema_version, 0, 60;
ob1.check_until_timeout select count(*) from __all_virtual_log_stat where tenant_id = $mysql_tenant_id and ls_id = 1001 and role = 'LEADER', 1, 120;
select count(*) from t1;
count(*)
196
drop table if exists t1;
alter system set log_transport_compress_func= 'zstd_1.0';
create table t1 (c1 int primary key, c2 int);
ob1.check_until_timeout select count(*) as cnt from oceanbase.__all_virtual_server_schema_info as a join oceanbase.__all_virtual_server_schema_info as b on a.tenant_id = b.tenant_id  where a.refreshed_schema_version != b.refreshed_schema_version, 0, 60;
insert into t1 values(1, 11);
insert into t1 values(2, 22);
insert into t1 values(3, 33);
insert into t1 values(4, 44);
insert into t1 values(5, 55);
update t1 set c2=2222 where c1=2;
delete from t1 where c2<100;
select * from t1 where c1 != 5;
c1	c2
2	2222
ob1.check_until_timeout select count(*) as cnt from oceanbase.__all_virtual_server_schema_info as a join oceanbase.__all_virtual_server_schema_info as b on a.tenant_id = b.tenant_id  where a.refreshed_schema_version != b.refreshed_schema_version, 0, 60;
alter system switch replica leader ls=1001 server='11.124.5.20:42325' tenant='mysql';
ob1.check_until_timeout select count(*) from __all_virtual_ls_meta_table where tenant_id = '$mysql_tenant_id' and concat(svr_ip,':',svr_port) = '$follower_ip_port_1' and ls_id = 1001 and role = 1, 1, 60;
ob1.z1.obs0.force_stop;
ob1.z1.obs0.nstart;
ob1.check_until_timeout select count(*) as cnt from oceanbase.__all_virtual_server_schema_info as a join oceanbase.__all_virtual_server_schema_info as b on a.tenant_id = b.tenant_id  where a.refreshed_schema_version != b.refreshed_schema_version, 0, 60;
ob1.check_until_timeout select count(*) from __all_virtual_log_stat where tenant_id = $mysql_tenant_id and ls_id = 1001 and role = 'LEADER', 1, 120;
select count(*) from t1;
count(*)
196
drop table if exists t1;
alter system set log_transport_compress_func= 'zstd_1.3.8';
create table t1 (c1 int primary key, c2 int);
ob1.check_until_timeout select count(*) as cnt from oceanbase.__all_virtual_server_schema_info as a join oceanbase.__all_virtual_server_schema_info as b on a.tenant_id = b.tenant_id  where a.refreshed_schema_version != b.refreshed_schema_version, 0, 60;
insert into t1 values(1, 11);
insert into t1 values(2, 22);
insert into t1 values(3, 33);
insert into t1 values(4, 44);
insert into t1 values(5, 55);
update t1 set c2=2222 where c1=2;
delete from t1 where c2<100;
select * from t1 where c1 != 5;
c1	c2
2	2222
ob1.check_until_timeout select count(*) as cnt from oceanbase.__all_virtual_server_schema_info as a join oceanbase.__all_virtual_server_schema_info as b on a.tenant_id = b.tenant_id  where a.refreshed_schema_version != b.refreshed_schema_version, 0, 60;
alter system switch replica leader ls=1001 server='11.124.5.20:42325' tenant='mysql';
ob1.check_until_timeout select count(*) from __all_virtual_ls_meta_table where tenant_id = '$mysql_tenant_id' and concat(svr_ip,':',svr_port) = '$follower_ip_port_1' and ls_id = 1001 and role = 1, 1, 60;
ob1.z1.obs0.force_stop;
ob1.z1.obs0.nstart;
ob1.check_until_timeout select count(*) as cnt from oceanbase.__all_virtual_server_schema_info as a join oceanbase.__all_virtual_server_schema_info as b on a.tenant_id = b.tenant_id  where a.refreshed_schema_version != b.refreshed_schema_version, 0, 60;
ob1.check_until_timeout select count(*) from __all_virtual_log_stat where tenant_id = $mysql_tenant_id and ls_id = 1001 and role = 'LEADER', 1, 120;
select count(*) from t1;
count(*)
196
drop table if exists t1;
