DROP TABLE abs_table1;
DROP TABLE abs_table2;
DROP TABLE abs_table3;
abs-select-1
CREATE TABLE abs_table1(num INT,food char(20),price varchar(200));
INSERT INTO abs_table1 VALUES(1,'面包',-5.12315);
INSERT INTO abs_table1 VALUES(2,'牛奶','');
INSERT INTO abs_table1 VALUES(3,'大面包',-0.13545);
INSERT INTO abs_table1 VALUES(4,'奶牛奶',-1200);
INSERT INTO abs_table1 VALUES(5,'奶奶牛',NULL);
INSERT INTO abs_table1 VALUES(6,'牛奶奶',10);
INSERT INTO abs_table1 VALUES(7,'牛奶奶',-10);
CREATE TABLE abs_table2(num INT,name varchar(200),money varchar(200));
INSERT INTO abs_table2 VALUES(1,'Bing',-100);
INSERT INTO abs_table2 VALUES(2,'Bob',+10);
INSERT INTO abs_table2 VALUES(3,'Reachl',-0.23566000);
INSERT INTO abs_table2 VALUES(4,'Ross',NULL);
INSERT INTO abs_table2 VALUES(5,'friends','');
abs-select-1-1 where、join 
select SUM(abs(price)) FROM abs_table1 WHERE num = 1;
SUM(abs(price))
5.12315
select abs(price),abs(money),abs(price)+abs(money) from abs_table1 t1 left join abs_table2 t2 ON t1.num = t2.num;
abs(price)	abs(money)	abs(price)+abs(money)
5.12315	100	105.12315
0	10	10
0.13545	0.23566	0.37111
1200	NULL	NULL
NULL	0	NULL
10	NULL	NULL
10	NULL	NULL
select abs(price),abs(money),abs(price)+abs(money) from abs_table1 t1 RIGHT join abs_table2 t2 ON t1.num = t2.num;
abs(price)	abs(money)	abs(price)+abs(money)
5.12315	100	105.12315
0	10	10
0.13545	0.23566	0.37111
1200	NULL	NULL
NULL	0	NULL
select abs(price),abs(money),abs(price)+abs(money) from abs_table1 t1 INNER join abs_table2 t2 ON t1.num = t2.num;
abs(price)	abs(money)	abs(price)+abs(money)
5.12315	100	105.12315
0	10	10
0.13545	0.23566	0.37111
1200	NULL	NULL
NULL	0	NULL
select abs(price),abs(money),abs(price)+abs(money) from abs_table1 t1 left join abs_table2 t2 ON t1.num = t2.num ORDER BY t1.price DESC;
abs(price)	abs(money)	abs(price)+abs(money)
10	NULL	NULL
5.12315	100	105.12315
1200	NULL	NULL
10	NULL	NULL
0.13545	0.23566	0.37111
0	10	10
NULL	0	NULL
abs-select-1-2 any、all、exists
SELECT * FROM abs_table1 WHERE abs(price) = ANY(SELECT price FROM abs_table1);
num	food	price
2	牛奶	
6	牛奶奶	10
7	牛奶奶	-10
SELECT * FROM abs_table1 WHERE abs(price) > ANY(SELECT price FROM abs_table1);
num	food	price
1	面包	-5.12315
2	牛奶	
3	大面包	-0.13545
4	奶牛奶	-1200
6	牛奶奶	10
7	牛奶奶	-10
SELECT * FROM abs_table1 WHERE abs(price) < ANY(SELECT price FROM abs_table1);
num	food	price
1	面包	-5.12315
2	牛奶	
3	大面包	-0.13545
SELECT * FROM abs_table1 WHERE abs(price) = ALL(SELECT price FROM abs_table1);
num	food	price
SELECT * FROM abs_table1 WHERE abs(price) > ALL(SELECT price FROM abs_table1);
num	food	price
SELECT * FROM abs_table1 WHERE abs(price) < ALL(SELECT price FROM abs_table1 WHERE abs(price) > 1200);
num	food	price
1	面包	-5.12315
2	牛奶	
3	大面包	-0.13545
4	奶牛奶	-1200
5	奶奶牛	NULL
6	牛奶奶	10
7	牛奶奶	-10
SELECT * FROM abs_table1 WHERE abs(price) > ALL(SELECT price FROM abs_table1 WHERE abs(price) < 1200);
num	food	price
4	奶牛奶	-1200
SELECT * FROM abs_table1 WHERE EXISTS (SELECT * FROM abs_table2 WHERE ABS(money)>1);
num	food	price
1	面包	-5.12315
2	牛奶	
3	大面包	-0.13545
4	奶牛奶	-1200
5	奶奶牛	NULL
6	牛奶奶	10
7	牛奶奶	-10
SELECT * FROM abs_table1 WHERE NOT EXISTS (SELECT * FROM abs_table2 WHERE ABS(money)<0);
num	food	price
1	面包	-5.12315
2	牛奶	
3	大面包	-0.13545
4	奶牛奶	-1200
5	奶奶牛	NULL
6	牛奶奶	10
7	牛奶奶	-10
abs-select-1-3 create as 
CREATE TABLE abs_table3 AS SELECT ABS(price) pr FROM abs_table1;
SELECT * FROM abs_table3;
pr
5.12315
0
0.13545
1200
NULL
10
10
abs-select-1-4 distinct、cast
SELECT DISTINCT ABS(price) FROM abs_table1;
ABS(price)
5.12315
0
0.13545
1200
NULL
10
SELECT  ABS(DISTINCT price) FROM abs_table1;
ERROR 42000: You have an error in your SQL syntax; check the manual that corresponds to your OceanBase version for the right syntax to use near 'DISTINCT price) FROM abs_table1' at line 1
SELECT ABS(CAST(price AS char(10))) FROM abs_table1;
ABS(CAST(price AS char(10)))
5.12315
0
0.13545
1200
NULL
10
10
SELECT CAST(ABS(price) AS char(10)) FROM abs_table1;
CAST(ABS(price) AS char(10))
5.12315
0
0.13545
1200
NULL
10
10
abs-select-1-5 group by having
SELECT t1.num,SUM(ABS(money)+ABS(price)) FROM abs_table1 t1 
LEFT JOIN abs_table2 t2 
ON t1.num = t2.num 
GROUP BY t1.num;
num	SUM(ABS(money)+ABS(price))
1	105.12315
2	10
3	0.37111
4	NULL
5	NULL
6	NULL
7	NULL
SELECT t1.price FROM abs_table1 t1 
GROUP BY t1.price
HAVING ABS(t1.price) > 10 ;
price
-1200
abs-select-1-6 case when
SELECT num, CASE WHEN ABS(price)>10 THEN 1 ELSE 0 END FROM abs_table1;
num	CASE WHEN ABS(price)>10 THEN 1 ELSE 0 END
1	0
2	0
3	0
4	1
5	0
6	0
7	0
SELECT num, CASE WHEN price < 0 THEN ABS(PRICE) WHEN PRICE = NULL THEN 1 ELSE 0 END FROM abs_table1;
num	CASE WHEN price < 0 THEN ABS(PRICE) WHEN PRICE = NULL THEN 1 ELSE 0 END
1	5.12315
2	0
3	0.13545
4	1200
5	0
6	0
7	10
abs-insert-2-1 insert
INSERT INTO abs_table1 VALUES(8,'abc',abs(-10));
SELECT * FROM abs_table1;
num	food	price
1	面包	-5.12315
2	牛奶	
3	大面包	-0.13545
4	奶牛奶	-1200
5	奶奶牛	NULL
6	牛奶奶	10
7	牛奶奶	-10
8	abc	10
INSERT INTO abs_table1 SELECT * FROM abs_table1 WHERE ABS(price) > 1;
SELECT * FROM abs_table1;
num	food	price
1	面包	-5.12315
2	牛奶	
3	大面包	-0.13545
4	奶牛奶	-1200
5	奶奶牛	NULL
6	牛奶奶	10
7	牛奶奶	-10
8	abc	10
1	面包	-5.12315
4	奶牛奶	-1200
6	牛奶奶	10
7	牛奶奶	-10
8	abc	10
abs-update-3-1 update
UPDATE abs_table1 SET food = '奶奶奶' WHERE ABS(price) > 0.1;
SELECT * FROM abs_table1;
num	food	price
1	奶奶奶	-5.12315
2	牛奶	
3	奶奶奶	-0.13545
4	奶奶奶	-1200
5	奶奶牛	NULL
6	奶奶奶	10
7	奶奶奶	-10
8	奶奶奶	10
1	奶奶奶	-5.12315
4	奶奶奶	-1200
6	奶奶奶	10
7	奶奶奶	-10
8	奶奶奶	10
UPDATE abs_table1 SET food = (SELECT ABS(money) FROM abs_table2 WHERE num = 3) WHERE ABS(price) > 0.1;
SELECT * FROM abs_table1;
num	food	price
1	0.23566	-5.12315
2	牛奶	
3	0.23566	-0.13545
4	0.23566	-1200
5	奶奶牛	NULL
6	0.23566	10
7	0.23566	-10
8	0.23566	10
1	0.23566	-5.12315
4	0.23566	-1200
6	0.23566	10
7	0.23566	-10
8	0.23566	10
abs-update-4-1 delete
DELETE FROM abs_table1 WHERE ABS(price) < 1 ;
SELECT * FROM abs_table1;
num	food	price
1	0.23566	-5.12315
4	0.23566	-1200
5	奶奶牛	NULL
6	0.23566	10
7	0.23566	-10
8	0.23566	10
1	0.23566	-5.12315
4	0.23566	-1200
6	0.23566	10
7	0.23566	-10
8	0.23566	10
DROP TABLE abs_table1;
DROP TABLE abs_table2;
DROP TABLE abs_table3;
