result_format: 4
DROP MATERIALIZED VIEW LOG ON ZC_T8;
DROP MATERIALIZED VIEW LOG ON ZC_T6;
DROP MATERIALIZED VIEW LOG ON ZC_T5;
DROP MATERIALIZED VIEW LOG ON ZC_T4;
DROP MATERIALIZED VIEW LOG ON ZC_T3;
DROP MATERIALIZED VIEW LOG ON ZC_T2;
DROP MATERIALIZED VIEW LOG ON ZC_T1;
DROP TABLE ZC_T8;
DROP TABLE ZC_T6;
DROP TABLE ZC_T5;
DROP TABLE ZC_T4;
DROP TABLE ZC_T3;
DROP TABLE ZC_T2;
DROP TABLE ZC_T1;
DROP MATERIALIZED VIEW LOG ON ZC_MV1;
DROP materialized view ZC_MV1;
DROP materialized view ZC_MV2;
DROP materialized view ZC_MV3;
DROP materialized view ZC_MV4;
DROP materialized view ZC_MV6;
DROP materialized view ZC_MV7;
DROP materialized view ZC_MV8;
DROP materialized view ZC_MV9;
####不同表结构创建rtmv####
####TABLE####
###have PRIMARY###
CREATE TABLE ZC_T1(pk int primary key, c1 int, c2 int, c3 int);
CREATE MATERIALIZED VIEW LOG ON ZC_T1 parallel 2 WITH PRIMARY KEY,ROWID,SEQUENCE(c1,c2,c3) INCLUDING NEW VALUES;
create materialized view ZC_MV1 REFRESH FAST ON DEMAND enable on query computation AS
select ZT1.c1 as c1,ZT1.PK AS PK,ZT1.C2 AS C2,count(*) as cnt
from ZC_T1 ZT1
group by ZT1.c1,ZT1.C2,ZT1.PK;
INSERT INTO ZC_T1 VALUES(1,1,1,1);
SELECT * FROM ZC_T1;
+----+------+------+------+
| pk | c1   | c2   | c3   |
+----+------+------+------+
|  1 |    1 |    1 |    1 |
+----+------+------+------+
SELECT * FROM ZC_MV1;
+------+------+------+------+
| c1   | PK   | C2   | cnt  |
+------+------+------+------+
|    1 |    1 |    1 |    1 |
+------+------+------+------+
SELECT /*+fresh_mv*/* FROM ZC_MV1;
+------+------+------+------+
| c1   | PK   | C2   | cnt  |
+------+------+------+------+
|    1 |    1 |    1 |    1 |
+------+------+------+------+
###have INDEX###
CREATE TABLE ZC_T2(pk int , c1 int, c2 int, c3 int);
CREATE INDEX inzt2 ON zc_t2(pk,c1);
CREATE MATERIALIZED VIEW LOG ON ZC_T2 parallel 2 WITH ROWID,SEQUENCE(pk,c1,c2,c3) INCLUDING NEW VALUES;
create materialized view ZC_MV2 REFRESH FAST ON DEMAND enable on query computation AS
select ZT2.c1 as c1,ZT2.PK AS PK,ZT2.C2 AS C2,count(*) as cnt
from ZC_T2 ZT2
group by ZT2.c1,ZT2.C2,ZT2.PK;
INSERT INTO ZC_T2 VALUES(2,2,2,2);
SELECT * FROM ZC_T2;
+------+------+------+------+
| pk   | c1   | c2   | c3   |
+------+------+------+------+
|    2 |    2 |    2 |    2 |
+------+------+------+------+
SELECT * FROM ZC_MV2;
+------+------+------+------+
| c1   | PK   | C2   | cnt  |
+------+------+------+------+
|    2 |    2 |    2 |    1 |
+------+------+------+------+
SELECT /*+fresh_mv*/* FROM ZC_MV2;
+------+------+------+------+
| c1   | PK   | C2   | cnt  |
+------+------+------+------+
|    2 |    2 |    2 |    1 |
+------+------+------+------+
###have UNIQUE###
CREATE TABLE ZC_T3(pk int UNIQUE, c1 int, c2 int, c3 int);
CREATE MATERIALIZED VIEW LOG ON ZC_T3 parallel 2 WITH ROWID,SEQUENCE(pk,c1,c2,c3) INCLUDING NEW VALUES;
create materialized view ZC_MV3 REFRESH FAST ON DEMAND enable on query computation AS
select ZT3.c1 as c1,ZT3.PK AS PK,ZT3.C2 AS C2,count(*) as cnt
from ZC_T3 ZT3
group by ZT3.c1,ZT3.C2,ZT3.PK;
INSERT INTO ZC_T3 VALUES(3,3,3,3);
SELECT * FROM ZC_T3;
+------+------+------+------+
| pk   | c1   | c2   | c3   |
+------+------+------+------+
|    3 |    3 |    3 |    3 |
+------+------+------+------+
SELECT * FROM ZC_MV3;
+------+------+------+------+
| c1   | PK   | C2   | cnt  |
+------+------+------+------+
|    3 |    3 |    3 |    1 |
+------+------+------+------+
SELECT /*+fresh_mv*/* FROM ZC_MV3;
+------+------+------+------+
| c1   | PK   | C2   | cnt  |
+------+------+------+------+
|    3 |    3 |    3 |    1 |
+------+------+------+------+
###have FOREIGN KEY###
CREATE TABLE ZC_T4(pk int, c1 int, c2 int, c3 int, FOREIGN KEY(pk) REFERENCES zc_t1(pk) );
CREATE MATERIALIZED VIEW LOG ON ZC_T4 parallel 2 WITH ROWID,SEQUENCE(pk,c1,c2,c3) INCLUDING NEW VALUES;
create materialized view ZC_MV4 REFRESH FAST ON DEMAND enable on query computation AS
select ZT4.c1 as c1,ZT4.PK AS PK,ZT4.C2 AS C2,count(*) as cnt
from ZC_T4 ZT4
group by ZT4.c1,ZT4.C2,ZT4.PK;
INSERT INTO ZC_T4 VALUES(1,1,1,1);
SELECT * FROM ZC_T4;
+------+------+------+------+
| pk   | c1   | c2   | c3   |
+------+------+------+------+
|    1 |    1 |    1 |    1 |
+------+------+------+------+
SELECT * FROM ZC_MV4;
+------+------+------+------+
| c1   | PK   | C2   | cnt  |
+------+------+------+------+
|    1 |    1 |    1 |    1 |
+------+------+------+------+
SELECT /*+fresh_mv*/* FROM ZC_MV4;
+------+------+------+------+
| c1   | PK   | C2   | cnt  |
+------+------+------+------+
|    1 |    1 |    1 |    1 |
+------+------+------+------+
####VIEW####(NOT supported)
CREATE or replace VIEW zc_v1 as SELECT * from zc_t1;
CREATE MATERIALIZED VIEW LOG ON ZC_v1 parallel 2 WITH ROWID,SEQUENCE(pk,c1,c2,c3) INCLUDING NEW VALUES;
Got one of the listed errors
##oracle可以创建##
create materialized view ZC_MV5 REFRESH FAST ON DEMAND enable on query computation AS
select ZV1.c1 as c1,ZV1.PK AS PK,ZV1.C2 AS C2,count(*) as cnt
from ZC_V1 ZV1
group by ZV1.c1,ZV1.C2,ZV1.PK;
ERROR HY000: Table type is not valid, the definition of materialized view can only reference user tables or other materialized views
####mv####
CREATE MATERIALIZED VIEW LOG ON ZC_MV1 parallel 2 WITH ROWID,SEQUENCE(pk,c1,c2) INCLUDING NEW VALUES;
####系统表####(NOT supported)
select OWNER , MVIEW_NAME , CONTAINER_NAME , QUERY from oceanbase.DBA_MVIEWS;
+-------+------------+----------------+-------------------------------------------------------------------------------------------------------------------------------------------------------+
| OWNER | MVIEW_NAME | CONTAINER_NAME | QUERY                                                                                                                                                 |
+-------+------------+----------------+-------------------------------------------------------------------------------------------------------------------------------------------------------+
| test  | zc_mv1     | zc_mv1         | select `ZT1`.`c1` AS `c1`,`ZT1`.`pk` AS `PK`,`ZT1`.`c2` AS `C2`,count(*) AS `cnt` from `test`.`zc_t1` `ZT1` group by `ZT1`.`c1`,`ZT1`.`c2`,`ZT1`.`pk` |
| test  | zc_mv2     | zc_mv2         | select `ZT2`.`c1` AS `c1`,`ZT2`.`pk` AS `PK`,`ZT2`.`c2` AS `C2`,count(*) AS `cnt` from `test`.`zc_t2` `ZT2` group by `ZT2`.`c1`,`ZT2`.`c2`,`ZT2`.`pk` |
| test  | zc_mv3     | zc_mv3         | select `ZT3`.`c1` AS `c1`,`ZT3`.`pk` AS `PK`,`ZT3`.`c2` AS `C2`,count(*) AS `cnt` from `test`.`zc_t3` `ZT3` group by `ZT3`.`c1`,`ZT3`.`c2`,`ZT3`.`pk` |
| test  | zc_mv4     | zc_mv4         | select `ZT4`.`c1` AS `c1`,`ZT4`.`pk` AS `PK`,`ZT4`.`c2` AS `C2`,count(*) AS `cnt` from `test`.`zc_t4` `ZT4` group by `ZT4`.`c1`,`ZT4`.`c2`,`ZT4`.`pk` |
+-------+------------+----------------+-------------------------------------------------------------------------------------------------------------------------------------------------------+
CREATE MATERIALIZED VIEW LOG ON oceanbase.DBA_MVIEWS parallel 2 WITH ROWID,SEQUENCE(OWNER,MVIEW_NAME,CONTAINER_NAME,REFRESH_MODE) INCLUDING NEW VALUES;
Got one of the listed errors
####分区表####
CREATE TABLE ZC_T6(pk int PRIMARY KEY, c1 int, c2 int, c3 int) PARTITION by RANGE(pk)
(PARTITION p0 VALUES less THAN (10),
 PARTITION p1 VALUES less THAN (20),
 PARTITION p2 VALUES less THAN (30),
 PARTITION p3 VALUES less THAN (MAXVALUE));
CREATE MATERIALIZED VIEW LOG ON ZC_T6 parallel 2 WITH PRIMARY KEY,ROWID,SEQUENCE(c1,c2,c3) INCLUDING NEW VALUES;
create materialized view ZC_MV6 REFRESH FAST ON DEMAND enable on query computation AS
select ZT6.c1 as c1,ZT6.PK AS PK,ZT6.C2 AS C2,count(*) as cnt
from ZC_T6 ZT6
group by ZT6.c1,ZT6.C2,ZT6.PK;
INSERT INTO ZC_T6 VALUES(6,6,6,6);
INSERT INTO ZC_T6 VALUES(66,66,66,66);
SELECT * FROM ZC_T6;
+----+------+------+------+
| pk | c1   | c2   | c3   |
+----+------+------+------+
|  6 |    6 |    6 |    6 |
| 66 |   66 |   66 |   66 |
+----+------+------+------+
SELECT * FROM ZC_MV6;
+------+------+------+------+
| c1   | PK   | C2   | cnt  |
+------+------+------+------+
|    6 |    6 |    6 |    1 |
|   66 |   66 |   66 |    1 |
+------+------+------+------+
SELECT /*+fresh_mv*/* FROM ZC_MV6;
+------+------+------+------+
| c1   | PK   | C2   | cnt  |
+------+------+------+------+
|    6 |    6 |    6 |    1 |
|   66 |   66 |   66 |    1 |
+------+------+------+------+
####指定分区建实时物化视图(oracle无法创建)
create materialized view ZC_MV7 REFRESH FAST ON DEMAND enable on query computation AS
select ZT6.c1 as c1,ZT6.PK AS PK,ZT6.C2 AS C2,count(*) as cnt
from ZC_T6 PARTITION(p0) ZT6
group by ZT6.c1,ZT6.C2,ZT6.PK;
ERROR HY000: cannot ENABLE ON QUERY COMPUTATION for the materialized view zc_mv7: query with partition specification for table is not supported
INSERT INTO ZC_T6 VALUES(7,7,7,7);
SELECT * FROM ZC_T6 PARTITION(p0);
+----+------+------+------+
| pk | c1   | c2   | c3   |
+----+------+------+------+
|  6 |    6 |    6 |    6 |
|  7 |    7 |    7 |    7 |
+----+------+------+------+
####subpartition
CREATE TABLE ZC_T8(pk int PRIMARY KEY, c1 int, c2 int, c3 int) PARTITION by RANGE(PK) subpartition by hash(PK) subpartitions 2
(PARTITION p0 values less THAN (10),
 PARTITION p1 values less THAN (50),
 PARTITION p2 values less THAN (MAXVALUE));
CREATE MATERIALIZED VIEW LOG ON ZC_T8 parallel 2 WITH PRIMARY KEY,ROWID,SEQUENCE(c1,c2,c3) INCLUDING NEW VALUES;
create materialized view ZC_MV8 PARTITION BY RANGE(C3)(PARTITION P0 VALUES LESS THAN (10),PARTITION P1 VALUES LESS THAN(MAXVALUE))  REFRESH FAST ON DEMAND enable on query computation AS
select ZT8.c1 as c1,ZT8.C2 AS C2,ZT8.PK AS C3,count(*) as C4
from ZC_T8 ZT8
group by ZT8.c1,ZT8.C2,ZT8.PK;
INSERT INTO ZC_T8 VALUES(8,8,8,8);
INSERT INTO ZC_T8 VALUES(88,88,88,88);
##ob不支持指定partition
SELECT * FROM ZC_MV8 PARTITION(p0);
Got one of the listed errors
SELECT * FROM ZC_MV8;
+------+------+------+------+
| c1   | C2   | C3   | C4   |
+------+------+------+------+
|    8 |    8 |    8 |    1 |
|   88 |   88 |   88 |    1 |
+------+------+------+------+
SELECT /*+fresh_mv*/* FROM ZC_MV8;
+------+------+------+------+
| c1   | C2   | C3   | C4   |
+------+------+------+------+
|    8 |    8 |    8 |    1 |
|   88 |   88 |   88 |    1 |
+------+------+------+------+
create materialized view ZC_MV9
PARTITION BY RANGE(C3) subpartition by hash(C1)subpartitions 2 (PARTITION P0 VALUES LESS THAN (10),PARTITION P1 VALUES LESS THAN(MAXVALUE))
REFRESH FAST ON DEMAND enable on query computation AS
select ZT8.c1 as c1,ZT8.C2 AS C2,ZT8.PK AS C3,count(*) as C4
from ZC_T8 ZT8
group by ZT8.c1,ZT8.C2,ZT8.PK;
INSERT INTO ZC_T8 VALUES(9,9,9,9);
INSERT INTO ZC_T8 VALUES(99,99,99,99);
SELECT * FROM ZC_MV9;
+------+------+------+------+
| c1   | C2   | C3   | C4   |
+------+------+------+------+
|    8 |    8 |    8 |    1 |
|    9 |    9 |    9 |    1 |
|   88 |   88 |   88 |    1 |
|   99 |   99 |   99 |    1 |
+------+------+------+------+
SELECT /*+fresh_mv*/* FROM ZC_MV9;
+------+------+------+------+
| c1   | C2   | C3   | C4   |
+------+------+------+------+
|    8 |    8 |    8 |    1 |
|    9 |    9 |    9 |    1 |
|   88 |   88 |   88 |    1 |
|   99 |   99 |   99 |    1 |
+------+------+------+------+
####subquery####(NOT supported)
DROP MATERIALIZED VIEW LOG ON ZC_MV1;
DROP materialized view ZC_MV1;
create materialized view ZC_MV1 REFRESH COMPLETE ON DEMAND enable on query computation AS
select ZT1.c1 as c1,ZT1.PK AS PK,ZT1.C2 AS C2,count(*) as cnt
from (SELECT c1,c2,pk from ZC_T1) ZT1
group by ZT1.c1,ZT1.C2,ZT1.PK;
Got one of the listed errors
####REFRESH####
create materialized view ZC_MV1 REFRESH FORCE ON DEMAND enable on query computation AS
select ZT1.c1 as c1,ZT1.PK AS PK,ZT1.C2 AS C2,count(*) as cnt
from ZC_T1 ZT1
group by ZT1.c1,ZT1.C2,ZT1.PK;
INSERT INTO ZC_T1 VALUES(3,3,3,3);
call DBMS_MVIEW.REFRESH('ZC_MV1');
SELECT * FROM ZC_T1;
+----+------+------+------+
| pk | c1   | c2   | c3   |
+----+------+------+------+
|  1 |    1 |    1 |    1 |
|  3 |    3 |    3 |    3 |
+----+------+------+------+
SELECT * FROM ZC_MV1;
+------+------+------+------+
| c1   | PK   | C2   | cnt  |
+------+------+------+------+
|    1 |    1 |    1 |    1 |
|    3 |    3 |    3 |    1 |
+------+------+------+------+
SELECT /*+fresh_mv*/* FROM ZC_MV1;
+------+------+------+------+
| c1   | PK   | C2   | cnt  |
+------+------+------+------+
|    1 |    1 |    1 |    1 |
|    3 |    3 |    3 |    1 |
+------+------+------+------+
INSERT INTO ZC_T1 VALUES(4,4,4,4);
call DBMS_MVIEW.REFRESH('ZC_MV1');
DELETE FROM zc_t1 WHERE pk = 4;
SELECT * FROM ZC_T1;
+----+------+------+------+
| pk | c1   | c2   | c3   |
+----+------+------+------+
|  1 |    1 |    1 |    1 |
|  3 |    3 |    3 |    3 |
+----+------+------+------+
SELECT * FROM ZC_MV1;
+------+------+------+------+
| c1   | PK   | C2   | cnt  |
+------+------+------+------+
|    1 |    1 |    1 |    1 |
|    3 |    3 |    3 |    1 |
+------+------+------+------+
SELECT /*+fresh_mv*/* FROM ZC_MV1;
+------+------+------+------+
| c1   | PK   | C2   | cnt  |
+------+------+------+------+
|    1 |    1 |    1 |    1 |
|    3 |    3 |    3 |    1 |
+------+------+------+------+
INSERT INTO ZC_T1 VALUES(4,4,4,4);
call DBMS_MVIEW.REFRESH('ZC_MV1');
UPDATE zc_t1 set pk = 5 ,c1  = 5 , c2 = 5 , c3 = 5 WHERE pk =4;
SELECT * FROM ZC_T1;
+----+------+------+------+
| pk | c1   | c2   | c3   |
+----+------+------+------+
|  1 |    1 |    1 |    1 |
|  3 |    3 |    3 |    3 |
|  5 |    5 |    5 |    5 |
+----+------+------+------+
SELECT * FROM ZC_MV1;
+------+------+------+------+
| c1   | PK   | C2   | cnt  |
+------+------+------+------+
|    1 |    1 |    1 |    1 |
|    3 |    3 |    3 |    1 |
|    5 |    5 |    5 |    1 |
+------+------+------+------+
SELECT /*+fresh_mv*/* FROM ZC_MV1;
+------+------+------+------+
| c1   | PK   | C2   | cnt  |
+------+------+------+------+
|    1 |    1 |    1 |    1 |
|    3 |    3 |    3 |    1 |
|    5 |    5 |    5 |    1 |
+------+------+------+------+
call DBMS_MVIEW.REFRESH('ZC_MV1');
DELETE FROM zc_t1 WHERE pk = 5;
SELECT * FROM ZC_T1;
+----+------+------+------+
| pk | c1   | c2   | c3   |
+----+------+------+------+
|  1 |    1 |    1 |    1 |
|  3 |    3 |    3 |    3 |
+----+------+------+------+
SELECT * FROM ZC_MV1;
+------+------+------+------+
| c1   | PK   | C2   | cnt  |
+------+------+------+------+
|    1 |    1 |    1 |    1 |
|    3 |    3 |    3 |    1 |
+------+------+------+------+
SELECT /*+fresh_mv*/* FROM ZC_MV1;
+------+------+------+------+
| c1   | PK   | C2   | cnt  |
+------+------+------+------+
|    1 |    1 |    1 |    1 |
|    3 |    3 |    3 |    1 |
+------+------+------+------+
####WHERE####
##<##
DROP materialized view ZC_MV1;
create materialized view ZC_MV1 REFRESH FAST ON DEMAND enable on query computation AS
select count(*) as cnt
from ZC_T1 ZT1
WHERE zt1.pk < 2;
SELECT * FROM ZC_T1;
+----+------+------+------+
| pk | c1   | c2   | c3   |
+----+------+------+------+
|  1 |    1 |    1 |    1 |
|  3 |    3 |    3 |    3 |
+----+------+------+------+
SELECT * FROM ZC_MV1;
+------+
| cnt  |
+------+
|    1 |
+------+
SELECT /*+fresh_mv*/* FROM ZC_MV1;
+------+
| cnt  |
+------+
|    1 |
+------+
INSERT INTO ZC_T1 VALUES(4,4,4,4);
SELECT * FROM ZC_T1;
+----+------+------+------+
| pk | c1   | c2   | c3   |
+----+------+------+------+
|  1 |    1 |    1 |    1 |
|  3 |    3 |    3 |    3 |
|  4 |    4 |    4 |    4 |
+----+------+------+------+
SELECT * FROM ZC_MV1;
+------+
| cnt  |
+------+
|    1 |
+------+
##这里oracle有bug会断连
SELECT /*+fresh_mv*/* FROM ZC_MV1;
+------+
| cnt  |
+------+
|    1 |
+------+
UPDATE zc_t1 set pk = -1 ,c1  = -1 , c2 = -1 , c3 = -1 WHERE pk =4;
SELECT * FROM ZC_T1;
+----+------+------+------+
| pk | c1   | c2   | c3   |
+----+------+------+------+
|  1 |    1 |    1 |    1 |
|  3 |    3 |    3 |    3 |
| -1 |   -1 |   -1 |   -1 |
+----+------+------+------+
SELECT * FROM ZC_MV1;
+------+
| cnt  |
+------+
|    2 |
+------+
SELECT /*+fresh_mv*/* FROM ZC_MV1;
+------+
| cnt  |
+------+
|    2 |
+------+
DELETE FROM zc_t1 WHERE pk = -1;
SELECT * FROM ZC_T1;
+----+------+------+------+
| pk | c1   | c2   | c3   |
+----+------+------+------+
|  1 |    1 |    1 |    1 |
|  3 |    3 |    3 |    3 |
+----+------+------+------+
SELECT * FROM ZC_MV1;
+------+
| cnt  |
+------+
|    1 |
+------+
SELECT /*+fresh_mv*/* FROM ZC_MV1;
+------+
| cnt  |
+------+
|    1 |
+------+
DROP materialized view ZC_MV1;
create materialized view ZC_MV1 REFRESH FAST ON DEMAND enable on query computation AS
select SUM(pk) AS su,COUNT(pk) as cnt
from ZC_T1 ZT1
WHERE zt1.pk = 0;
SELECT * FROM ZC_T1;
+----+------+------+------+
| pk | c1   | c2   | c3   |
+----+------+------+------+
|  1 |    1 |    1 |    1 |
|  3 |    3 |    3 |    3 |
+----+------+------+------+
SELECT * FROM ZC_MV1;
+------+------+
| su   | cnt  |
+------+------+
| NULL |    0 |
+------+------+
SELECT /*+fresh_mv*/* FROM ZC_MV1;
+------+------+
| su   | cnt  |
+------+------+
| NULL |    0 |
+------+------+
INSERT INTO ZC_T1 VALUES(4,4,4,4);
SELECT * FROM ZC_T1;
+----+------+------+------+
| pk | c1   | c2   | c3   |
+----+------+------+------+
|  1 |    1 |    1 |    1 |
|  3 |    3 |    3 |    3 |
|  4 |    4 |    4 |    4 |
+----+------+------+------+
SELECT * FROM ZC_MV1;
+------+------+
| su   | cnt  |
+------+------+
| NULL |    0 |
+------+------+
SELECT /*+fresh_mv*/* FROM ZC_MV1;
+------+------+
| su   | cnt  |
+------+------+
| NULL |    0 |
+------+------+
UPDATE zc_t1 set pk = 0 ,c1  = 0 , c2 = 0 , c3 = 0 WHERE pk =4;
SELECT * FROM ZC_T1;
+----+------+------+------+
| pk | c1   | c2   | c3   |
+----+------+------+------+
|  0 |    0 |    0 |    0 |
|  1 |    1 |    1 |    1 |
|  3 |    3 |    3 |    3 |
+----+------+------+------+
SELECT * FROM ZC_MV1;
+------+------+
| su   | cnt  |
+------+------+
|    0 |    1 |
+------+------+
SELECT /*+fresh_mv*/* FROM ZC_MV1;
+------+------+
| su   | cnt  |
+------+------+
|    0 |    1 |
+------+------+
DELETE FROM zc_t1 WHERE pk = 0;
SELECT * FROM ZC_T1;
+----+------+------+------+
| pk | c1   | c2   | c3   |
+----+------+------+------+
|  1 |    1 |    1 |    1 |
|  3 |    3 |    3 |    3 |
+----+------+------+------+
SELECT * FROM ZC_MV1;
+------+------+
| su   | cnt  |
+------+------+
| NULL |    0 |
+------+------+
SELECT /*+fresh_mv*/* FROM ZC_MV1;
+------+------+
| su   | cnt  |
+------+------+
| NULL |    0 |
+------+------+
##=/<=>/<> / !=##
DELETE from ZC_t4;
DELETE from ZC_t1;
DROP materialized view ZC_MV1;
create materialized view ZC_MV1 REFRESH FAST ON DEMAND enable on query computation AS
select SUM(pk) AS su,COUNT(pk) as cnt
from ZC_T1 ZT1
WHERE zt1.pk != 1 ;
INSERT INTO zc_t1 (pk, c1, c2, c3) VALUES (0,NULL,NULL,NULL);
INSERT INTO zc_t1 (pk, c1, c2, c3) VALUES (68,-52,45,-86);
INSERT INTO zc_t1 (pk, c1, c2, c3) VALUES (51,27,-6,-8);
INSERT INTO zc_t1 (pk, c1, c2, c3) VALUES (-13,47,-47,26);
INSERT INTO zc_t1 (pk, c1, c2, c3) VALUES (-24,82,75,-10);
INSERT INTO zc_t1 (pk, c1, c2, c3) VALUES (-67,-86,72,62);
INSERT INTO zc_t1 (pk, c1, c2, c3) VALUES (18,41,-77,-12);
INSERT INTO zc_t1 (pk, c1, c2, c3) VALUES (14,-15,-53,65);
INSERT INTO zc_t1 (pk, c1, c2, c3) VALUES (39,-29,65,-62);
INSERT INTO zc_t1 (pk, c1, c2, c3) VALUES (89,18,93,-75);
INSERT INTO zc_t1 (pk, c1, c2, c3) VALUES (88,-99,9,35);
UPDATE zc_t1 SET pk = 10, c1 = 20, c2 = 30, c3 = 40 WHERE pk = (SELECT MIN(pk) FROM zc_t1);
UPDATE zc_t1 SET c1 = 92 WHERE MOD(pk, 2) = 0;
DELETE FROM zc_t1 WHERE c1 > 50 AND c1 < 70;
UPDATE zc_t1 SET c2 = c2 + 15;
UPDATE zc_t1 SET c3 = pk, c1 = c2 WHERE pk < c3;
INSERT INTO zc_t1 (pk, c1, c2, c3) VALUES (25, 50, 75, 100);
UPDATE zc_t1 SET pk = 83, c1 = 54, c2 = 39, c3 = 22 WHERE pk = (SELECT MAX(pk) FROM zc_t1);
DELETE FROM zc_t1 WHERE pk BETWEEN 10 AND 20;
select SUM(pk) AS su,COUNT(pk) as cnt
from ZC_T1 ZT1
WHERE zt1.pk != 1 ;
+-----+------+
| su  | cnt  |
+-----+------+
| 317 |    9 |
+-----+------+
SELECT * FROM ZC_MV1;
+------+------+
| su   | cnt  |
+------+------+
|  317 |    9 |
+------+------+
SELECT /*+fresh_mv*/* FROM ZC_MV1;
+------+------+
| su   | cnt  |
+------+------+
|  317 |    9 |
+------+------+
DELETE from ZC_t1;
DROP materialized view ZC_MV1;
create materialized view ZC_MV1 REFRESH FAST ON DEMAND enable on query computation AS
select SUM(pk) AS su,COUNT(pk) as cnt
from ZC_T1 ZT1
WHERE zt1.pk <> 0 ;
INSERT INTO zc_t1 (pk, c1, c2, c3) VALUES (0,NULL,NULL,NULL);
INSERT INTO zc_t1 (pk, c1, c2, c3) VALUES (68,-52,45,-86);
INSERT INTO zc_t1 (pk, c1, c2, c3) VALUES (51,27,-6,-8);
INSERT INTO zc_t1 (pk, c1, c2, c3) VALUES (-13,47,-47,26);
INSERT INTO zc_t1 (pk, c1, c2, c3) VALUES (-24,82,75,-10);
INSERT INTO zc_t1 (pk, c1, c2, c3) VALUES (-67,-86,72,62);
INSERT INTO zc_t1 (pk, c1, c2, c3) VALUES (18,41,-77,-12);
INSERT INTO zc_t1 (pk, c1, c2, c3) VALUES (14,-15,-53,65);
INSERT INTO zc_t1 (pk, c1, c2, c3) VALUES (39,-29,65,-62);
INSERT INTO zc_t1 (pk, c1, c2, c3) VALUES (89,18,93,-75);
INSERT INTO zc_t1 (pk, c1, c2, c3) VALUES (88,-99,9,35);
UPDATE zc_t1 SET pk = 10, c1 = 20, c2 = 30, c3 = 40 WHERE pk = (SELECT MIN(pk) FROM zc_t1);
UPDATE zc_t1 SET c1 = 92 WHERE MOD(pk, 2) = 0;
DELETE FROM zc_t1 WHERE c1 > 50 AND c1 < 70;
UPDATE zc_t1 SET c2 = c2 + 15;
UPDATE zc_t1 SET c3 = pk, c1 = c2 WHERE pk < c3;
INSERT INTO zc_t1 (pk, c1, c2, c3) VALUES (25, 50, 75, 100);
UPDATE zc_t1 SET pk = 83, c1 = 54, c2 = 39, c3 = 22 WHERE pk = (SELECT MAX(pk) FROM zc_t1);
DELETE FROM zc_t1 WHERE pk BETWEEN 10 AND 20;
select SUM(pk) AS su,COUNT(pk) as cnt
from ZC_T1 ZT1
WHERE zt1.pk <>0 ;
+-----+------+
| su  | cnt  |
+-----+------+
| 317 |    8 |
+-----+------+
SELECT * FROM ZC_MV1;
+------+------+
| su   | cnt  |
+------+------+
|  317 |    8 |
+------+------+
SELECT /*+fresh_mv*/* FROM ZC_MV1;
+------+------+
| su   | cnt  |
+------+------+
|  317 |    8 |
+------+------+
DELETE from ZC_t1;
DROP materialized view ZC_MV1;
create materialized view ZC_MV1 REFRESH FAST ON DEMAND enable on query computation AS
select SUM(pk) AS su,COUNT(pk) as cnt
from ZC_T1 ZT1
WHERE zt1.pk <=> 0 ;
INSERT INTO zc_t1 (pk, c1, c2, c3) VALUES (0,NULL,NULL,NULL);
INSERT INTO zc_t1 (pk, c1, c2, c3) VALUES (68,-52,45,-86);
INSERT INTO zc_t1 (pk, c1, c2, c3) VALUES (51,27,-6,-8);
INSERT INTO zc_t1 (pk, c1, c2, c3) VALUES (-13,47,-47,26);
INSERT INTO zc_t1 (pk, c1, c2, c3) VALUES (-24,82,75,-10);
INSERT INTO zc_t1 (pk, c1, c2, c3) VALUES (-67,-86,72,62);
INSERT INTO zc_t1 (pk, c1, c2, c3) VALUES (18,41,-77,-12);
INSERT INTO zc_t1 (pk, c1, c2, c3) VALUES (14,-15,-53,65);
INSERT INTO zc_t1 (pk, c1, c2, c3) VALUES (39,-29,65,-62);
INSERT INTO zc_t1 (pk, c1, c2, c3) VALUES (89,18,93,-75);
INSERT INTO zc_t1 (pk, c1, c2, c3) VALUES (88,-99,9,35);
UPDATE zc_t1 SET pk = 10, c1 = 20, c2 = 30, c3 = 40 WHERE pk = (SELECT MIN(pk) FROM zc_t1);
UPDATE zc_t1 SET c1 = 92 WHERE MOD(pk, 2) = 0;
DELETE FROM zc_t1 WHERE c1 > 50 AND c1 < 70;
UPDATE zc_t1 SET c2 = c2 + 15;
UPDATE zc_t1 SET c3 = pk, c1 = c2 WHERE pk < c3;
INSERT INTO zc_t1 (pk, c1, c2, c3) VALUES (25, 50, 75, 100);
UPDATE zc_t1 SET pk = 83, c1 = 54, c2 = 39, c3 = 22 WHERE pk = (SELECT MAX(pk) FROM zc_t1);
DELETE FROM zc_t1 WHERE pk BETWEEN 10 AND 20;
select SUM(pk) AS su,COUNT(pk) as cnt
from ZC_T1 ZT1
WHERE zt1.pk <=>0 ;
+----+------+
| su | cnt  |
+----+------+
|  0 |    1 |
+----+------+
SELECT * FROM ZC_MV1;
+------+------+
| su   | cnt  |
+------+------+
|    0 |    1 |
+------+------+
SELECT /*+fresh_mv*/* FROM ZC_MV1;
+------+------+
| su   | cnt  |
+------+------+
|    0 |    1 |
+------+------+
##>/>=/</<=##
DELETE from ZC_t1;
DROP materialized view ZC_MV1;
create materialized view ZC_MV1 REFRESH FAST ON DEMAND enable on query computation AS
select SUM(pk) AS su,COUNT(pk) as cnt,SUM(c1) AS su1,COUNT(c1) as cnt1,SUM(c2) AS su2,COUNT(c2) as cnt2,COUNT(c3) as cnt3
from ZC_T1 ZT1
WHERE zt1.pk <= 50 AND zt1.c1 >= -50 ;
INSERT INTO zc_t1 (pk, c1, c2, c3) VALUES (0,NULL,NULL,NULL);
INSERT INTO zc_t1 (pk, c1, c2, c3) VALUES (68,-52,45,-86);
INSERT INTO zc_t1 (pk, c1, c2, c3) VALUES (51,27,-6,-8);
INSERT INTO zc_t1 (pk, c1, c2, c3) VALUES (-13,47,-47,26);
INSERT INTO zc_t1 (pk, c1, c2, c3) VALUES (-24,82,75,-10);
INSERT INTO zc_t1 (pk, c1, c2, c3) VALUES (-67,-86,72,62);
INSERT INTO zc_t1 (pk, c1, c2, c3) VALUES (18,41,-77,-12);
INSERT INTO zc_t1 (pk, c1, c2, c3) VALUES (14,-15,-53,65);
INSERT INTO zc_t1 (pk, c1, c2, c3) VALUES (39,-29,65,-62);
INSERT INTO zc_t1 (pk, c1, c2, c3) VALUES (89,18,93,-75);
INSERT INTO zc_t1 (pk, c1, c2, c3) VALUES (88,-99,9,35);
UPDATE zc_t1 SET pk = 10, c1 = 20, c2 = 30, c3 = 40 WHERE pk = (SELECT MIN(pk) FROM zc_t1);
UPDATE zc_t1 SET c1 = 92 WHERE MOD(pk, 2) = 0;
DELETE FROM zc_t1 WHERE c1 > 50 AND c1 < 70;
UPDATE zc_t1 SET c2 = c2 + 15;
UPDATE zc_t1 SET c3 = pk, c1 = c2 WHERE pk < c3;
INSERT INTO zc_t1 (pk, c1, c2, c3) VALUES (25, 50, 75, 100);
UPDATE zc_t1 SET pk = 83, c1 = 54, c2 = 39, c3 = 22 WHERE pk = (SELECT MAX(pk) FROM zc_t1);
DELETE FROM zc_t1 WHERE pk BETWEEN 10 AND 20;
select SUM(pk) AS su,COUNT(pk) as cnt,SUM(c1) AS su1,COUNT(c1) as cnt1,SUM(c2) AS su2,COUNT(c2) as cnt2,COUNT(c3) as cnt3
from ZC_T1 ZT1
WHERE zt1.pk <= 50 AND zt1.c1 >= -50 ;
+----+------+------+------+------+------+------+
| su | cnt  | su1  | cnt1 | su2  | cnt2 | cnt3 |
+----+------+------+------+------+------+------+
| 27 |    5 |  171 |    5 |  213 |    4 |    4 |
+----+------+------+------+------+------+------+
SELECT * FROM ZC_MV1;
+------+------+------+------+------+------+------+
| su   | cnt  | su1  | cnt1 | su2  | cnt2 | cnt3 |
+------+------+------+------+------+------+------+
|   27 |    5 |  171 |    5 |  213 |    4 |    4 |
+------+------+------+------+------+------+------+
SELECT /*+fresh_mv*/* FROM ZC_MV1;
+------+------+------+------+------+------+------+
| su   | cnt  | su1  | cnt1 | su2  | cnt2 | cnt3 |
+------+------+------+------+------+------+------+
|   27 |    5 |  171 |    5 |  213 |    4 |    4 |
+------+------+------+------+------+------+------+
##in/not in##
DELETE from ZC_t1;
DROP materialized view ZC_MV1;
create materialized view ZC_MV1 REFRESH FAST ON DEMAND enable on query computation AS
select SUM(pk) AS su,COUNT(pk) as cnt,SUM(c1) AS su1,COUNT(c1) as cnt1,SUM(c2) AS su2,COUNT(c2) as cnt2,COUNT(c3) as cnt3
from ZC_T1 ZT1
WHERE zt1.pk IN(10,20,30,40,50) OR zt1.c1 NOT IN(10,20,30,40,50) ;
INSERT INTO zc_t1 (pk, c1, c2, c3) VALUES (0,NULL,NULL,NULL);
INSERT INTO zc_t1 (pk, c1, c2, c3) VALUES (68,-52,45,-86);
INSERT INTO zc_t1 (pk, c1, c2, c3) VALUES (51,27,-6,-8);
INSERT INTO zc_t1 (pk, c1, c2, c3) VALUES (-13,47,-47,26);
INSERT INTO zc_t1 (pk, c1, c2, c3) VALUES (-24,82,75,-10);
INSERT INTO zc_t1 (pk, c1, c2, c3) VALUES (-67,-86,72,62);
INSERT INTO zc_t1 (pk, c1, c2, c3) VALUES (18,41,-77,-12);
INSERT INTO zc_t1 (pk, c1, c2, c3) VALUES (14,-15,-53,65);
INSERT INTO zc_t1 (pk, c1, c2, c3) VALUES (39,-29,65,-62);
INSERT INTO zc_t1 (pk, c1, c2, c3) VALUES (89,18,93,-75);
INSERT INTO zc_t1 (pk, c1, c2, c3) VALUES (88,-99,9,35);
UPDATE zc_t1 SET pk = 10, c1 = 20, c2 = 30, c3 = 40 WHERE pk = (SELECT MIN(pk) FROM zc_t1);
UPDATE zc_t1 SET c1 = 92 WHERE MOD(pk, 2) = 0;
DELETE FROM zc_t1 WHERE c1 > 50 AND c1 < 70;
UPDATE zc_t1 SET c2 = c2 + 15;
UPDATE zc_t1 SET c3 = pk, c1 = c2 WHERE pk < c3;
INSERT INTO zc_t1 (pk, c1, c2, c3) VALUES (25, 50, 75, 100);
UPDATE zc_t1 SET pk = 83, c1 = 54, c2 = 39, c3 = 22 WHERE pk = (SELECT MAX(pk) FROM zc_t1);
DELETE FROM zc_t1 WHERE pk BETWEEN 10 AND 20;
select SUM(pk) AS su,COUNT(pk) as cnt,SUM(c1) AS su1,COUNT(c1) as cnt1,SUM(c2) AS su2,COUNT(c2) as cnt2,COUNT(c3) as cnt3
from ZC_T1 ZT1
WHERE zt1.pk IN(10,20,30,40,50) OR zt1.c1 NOT IN(10,20,30,40,50) ;
+-----+------+------+------+------+------+------+
| su  | cnt  | su1  | cnt1 | su2  | cnt2 | cnt3 |
+-----+------+------+------+------+------+------+
| 292 |    8 |  386 |    8 |  270 |    7 |    7 |
+-----+------+------+------+------+------+------+
SELECT * FROM ZC_MV1;
+------+------+------+------+------+------+------+
| su   | cnt  | su1  | cnt1 | su2  | cnt2 | cnt3 |
+------+------+------+------+------+------+------+
|  292 |    8 |  386 |    8 |  270 |    7 |    7 |
+------+------+------+------+------+------+------+
SELECT /*+fresh_mv*/* FROM ZC_MV1;
+------+------+------+------+------+------+------+
| su   | cnt  | su1  | cnt1 | su2  | cnt2 | cnt3 |
+------+------+------+------+------+------+------+
|  292 |    8 |  386 |    8 |  270 |    7 |    7 |
+------+------+------+------+------+------+------+
##BETWEEN AND##
DELETE from ZC_t1;
DROP materialized view ZC_MV1;
create materialized view ZC_MV1 REFRESH FAST ON DEMAND enable on query computation AS
select SUM(pk) AS su,COUNT(pk) as cnt,SUM(c1) AS su1,COUNT(c1) as cnt1,SUM(c2) AS su2,COUNT(c2) as cnt2,COUNT(c3) as cnt3
from ZC_T1 ZT1
WHERE zt1.pk BETWEEN -50 AND 50 OR zt1.c1 NOT BETWEEN -50 AND 50;
INSERT INTO zc_t1 (pk, c1, c2, c3) VALUES (0,NULL,NULL,NULL);
INSERT INTO zc_t1 (pk, c1, c2, c3) VALUES (68,-52,45,-86);
INSERT INTO zc_t1 (pk, c1, c2, c3) VALUES (51,27,-6,-8);
INSERT INTO zc_t1 (pk, c1, c2, c3) VALUES (-13,47,-47,26);
INSERT INTO zc_t1 (pk, c1, c2, c3) VALUES (-24,82,75,-10);
INSERT INTO zc_t1 (pk, c1, c2, c3) VALUES (-67,-86,72,62);
INSERT INTO zc_t1 (pk, c1, c2, c3) VALUES (18,41,-77,-12);
INSERT INTO zc_t1 (pk, c1, c2, c3) VALUES (14,-15,-53,65);
INSERT INTO zc_t1 (pk, c1, c2, c3) VALUES (39,-29,65,-62);
INSERT INTO zc_t1 (pk, c1, c2, c3) VALUES (89,18,93,-75);
INSERT INTO zc_t1 (pk, c1, c2, c3) VALUES (88,-99,9,35);
UPDATE zc_t1 SET pk = 10, c1 = 20, c2 = 30, c3 = 40 WHERE pk = (SELECT MIN(pk) FROM zc_t1);
UPDATE zc_t1 SET c1 = 92 WHERE MOD(pk, 2) = 0;
DELETE FROM zc_t1 WHERE c1 > 50 AND c1 < 70;
UPDATE zc_t1 SET c2 = c2 + 15;
UPDATE zc_t1 SET c3 = pk, c1 = c2 WHERE pk < c3;
INSERT INTO zc_t1 (pk, c1, c2, c3) VALUES (25, 50, 75, 100);
UPDATE zc_t1 SET pk = 83, c1 = 54, c2 = 39, c3 = 22 WHERE pk = (SELECT MAX(pk) FROM zc_t1);
DELETE FROM zc_t1 WHERE pk BETWEEN 10 AND 20;
select SUM(pk) AS su,COUNT(pk) as cnt,SUM(c1) AS su1,COUNT(c1) as cnt1,SUM(c2) AS su2,COUNT(c2) as cnt2,COUNT(c3) as cnt3
from ZC_T1 ZT1
WHERE zt1.pk BETWEEN -50 AND 50 OR zt1.c1 NOT BETWEEN -50 AND 50;
+-----+------+------+------+------+------+------+
| su  | cnt  | su1  | cnt1 | su2  | cnt2 | cnt3 |
+-----+------+------+------+------+------+------+
| 266 |    8 |  409 |    8 |  336 |    7 |    7 |
+-----+------+------+------+------+------+------+
SELECT * FROM ZC_MV1;
+------+------+------+------+------+------+------+
| su   | cnt  | su1  | cnt1 | su2  | cnt2 | cnt3 |
+------+------+------+------+------+------+------+
|  266 |    8 |  409 |    8 |  336 |    7 |    7 |
+------+------+------+------+------+------+------+
SELECT /*+fresh_mv*/* FROM ZC_MV1;
+------+------+------+------+------+------+------+
| su   | cnt  | su1  | cnt1 | su2  | cnt2 | cnt3 |
+------+------+------+------+------+------+------+
|  266 |    8 |  409 |    8 |  336 |    7 |    7 |
+------+------+------+------+------+------+------+
##LIKE##
DELETE from ZC_t1;
DROP materialized view ZC_MV1;
create materialized view ZC_MV1 REFRESH FAST ON DEMAND enable on query computation AS
select SUM(pk) AS su,COUNT(pk) as cnt,SUM(c1) AS su1,COUNT(c1) as cnt1,SUM(c2) AS su2,COUNT(c2) as cnt2,COUNT(c3) as cnt3
from ZC_T1 ZT1
WHERE zt1.pk LIKE '%5%' OR zt1.c1 NOT LIKE '%5%';
INSERT INTO zc_t1 (pk, c1, c2, c3) VALUES (0,NULL,NULL,NULL);
INSERT INTO zc_t1 (pk, c1, c2, c3) VALUES (68,-52,45,-86);
INSERT INTO zc_t1 (pk, c1, c2, c3) VALUES (51,27,-6,-8);
INSERT INTO zc_t1 (pk, c1, c2, c3) VALUES (-13,47,-47,26);
INSERT INTO zc_t1 (pk, c1, c2, c3) VALUES (-24,82,75,-10);
INSERT INTO zc_t1 (pk, c1, c2, c3) VALUES (-67,-86,72,62);
INSERT INTO zc_t1 (pk, c1, c2, c3) VALUES (18,41,-77,-12);
INSERT INTO zc_t1 (pk, c1, c2, c3) VALUES (14,-15,-53,65);
INSERT INTO zc_t1 (pk, c1, c2, c3) VALUES (39,-29,65,-62);
INSERT INTO zc_t1 (pk, c1, c2, c3) VALUES (89,18,93,-75);
INSERT INTO zc_t1 (pk, c1, c2, c3) VALUES (88,-99,9,35);
UPDATE zc_t1 SET pk = 10, c1 = 20, c2 = 30, c3 = 40 WHERE pk = (SELECT MIN(pk) FROM zc_t1);
UPDATE zc_t1 SET c1 = 92 WHERE MOD(pk, 2) = 0;
DELETE FROM zc_t1 WHERE c1 > 50 AND c1 < 70;
UPDATE zc_t1 SET c2 = c2 + 15;
UPDATE zc_t1 SET c3 = pk, c1 = c2 WHERE pk < c3;
INSERT INTO zc_t1 (pk, c1, c2, c3) VALUES (25, 50, 75, 100);
UPDATE zc_t1 SET pk = 83, c1 = 54, c2 = 39, c3 = 22 WHERE pk = (SELECT MAX(pk) FROM zc_t1);
DELETE FROM zc_t1 WHERE pk BETWEEN 10 AND 20;
select SUM(pk) AS su,COUNT(pk) as cnt,SUM(c1) AS su1,COUNT(c1) as cnt1,SUM(c2) AS su2,COUNT(c2) as cnt2,COUNT(c3) as cnt3
from ZC_T1 ZT1
WHERE zt1.pk LIKE '%5%' OR zt1.c1 NOT LIKE '%5%';
+-----+------+------+------+------+------+------+
| su  | cnt  | su1  | cnt1 | su2  | cnt2 | cnt3 |
+-----+------+------+------+------+------+------+
| 234 |    8 |  382 |    8 |  306 |    7 |    7 |
+-----+------+------+------+------+------+------+
SELECT * FROM ZC_MV1;
+------+------+------+------+------+------+------+
| su   | cnt  | su1  | cnt1 | su2  | cnt2 | cnt3 |
+------+------+------+------+------+------+------+
|  234 |    8 |  382 |    8 |  306 |    7 |    7 |
+------+------+------+------+------+------+------+
SELECT /*+fresh_mv*/* FROM ZC_MV1;
+------+------+------+------+------+------+------+
| su   | cnt  | su1  | cnt1 | su2  | cnt2 | cnt3 |
+------+------+------+------+------+------+------+
|  234 |    8 |  382 |    8 |  306 |    7 |    7 |
+------+------+------+------+------+------+------+
##TRUE/FALSE##(mysql)
DELETE from ZC_t1;
DROP materialized view ZC_MV1;
create materialized view ZC_MV1 REFRESH FAST ON DEMAND enable on query computation AS
select SUM(pk) AS su,COUNT(pk) as cnt,SUM(c1) AS su1,COUNT(c1) as cnt1,SUM(c2) AS su2,COUNT(c2) as cnt2,COUNT(c3) as cnt3
from ZC_T1 ZT1
WHERE zt1.pk IS TRUE OR zt1.c1 IS NOT TRUE OR zt1.c2 IS FALSE OR zt1.c3 IS NOT FALSE;
INSERT INTO zc_t1 (pk, c1, c2, c3) VALUES (0,NULL,NULL,NULL);
INSERT INTO zc_t1 (pk, c1, c2, c3) VALUES (68,-52,45,-86);
INSERT INTO zc_t1 (pk, c1, c2, c3) VALUES (51,27,-6,-8);
INSERT INTO zc_t1 (pk, c1, c2, c3) VALUES (-13,47,-47,26);
INSERT INTO zc_t1 (pk, c1, c2, c3) VALUES (-24,82,75,-10);
INSERT INTO zc_t1 (pk, c1, c2, c3) VALUES (-67,-86,72,62);
INSERT INTO zc_t1 (pk, c1, c2, c3) VALUES (18,41,-77,-12);
INSERT INTO zc_t1 (pk, c1, c2, c3) VALUES (14,-15,-53,65);
INSERT INTO zc_t1 (pk, c1, c2, c3) VALUES (39,-29,65,-62);
INSERT INTO zc_t1 (pk, c1, c2, c3) VALUES (89,18,93,-75);
INSERT INTO zc_t1 (pk, c1, c2, c3) VALUES (88,-99,9,35);
UPDATE zc_t1 SET pk = 10, c1 = 20, c2 = 30, c3 = 40 WHERE pk = (SELECT MIN(pk) FROM zc_t1);
UPDATE zc_t1 SET c1 = 92 WHERE MOD(pk, 2) = 0;
DELETE FROM zc_t1 WHERE c1 > 50 AND c1 < 70;
UPDATE zc_t1 SET c2 = c2 + 15;
UPDATE zc_t1 SET c3 = pk, c1 = c2 WHERE pk < c3;
INSERT INTO zc_t1 (pk, c1, c2, c3) VALUES (25, 50, 75, 100);
UPDATE zc_t1 SET pk = 83, c1 = 54, c2 = 39, c3 = 22 WHERE pk = (SELECT MAX(pk) FROM zc_t1);
DELETE FROM zc_t1 WHERE pk BETWEEN 10 AND 20;
select SUM(pk) AS su,COUNT(pk) as cnt,SUM(c1) AS su1,COUNT(c1) as cnt1,SUM(c2) AS su2,COUNT(c2) as cnt2,COUNT(c3) as cnt3
from ZC_T1 ZT1
WHERE zt1.pk IS TRUE OR zt1.c1 IS NOT TRUE OR zt1.c2 IS FALSE OR zt1.c3 IS NOT FALSE;
+-----+------+------+------+------+------+------+
| su  | cnt  | su1  | cnt1 | su2  | cnt2 | cnt3 |
+-----+------+------+------+------+------+------+
| 317 |    9 |  436 |    9 |  345 |    8 |    8 |
+-----+------+------+------+------+------+------+
SELECT * FROM ZC_MV1;
+------+------+------+------+------+------+------+
| su   | cnt  | su1  | cnt1 | su2  | cnt2 | cnt3 |
+------+------+------+------+------+------+------+
|  317 |    9 |  436 |    9 |  345 |    8 |    8 |
+------+------+------+------+------+------+------+
SELECT /*+fresh_mv*/* FROM ZC_MV1;
+------+------+------+------+------+------+------+
| su   | cnt  | su1  | cnt1 | su2  | cnt2 | cnt3 |
+------+------+------+------+------+------+------+
|  317 |    9 |  436 |    9 |  345 |    8 |    8 |
+------+------+------+------+------+------+------+
##NULL##
DELETE from ZC_t1;
DROP materialized view ZC_MV1;
create materialized view ZC_MV1 REFRESH FAST ON DEMAND enable on query computation AS
select SUM(pk) AS su,COUNT(pk) as cnt,SUM(c1) AS su1,COUNT(c1) as cnt1,SUM(c2) AS su2,COUNT(c2) as cnt2,COUNT(c3) as cnt3
from ZC_T1 ZT1
WHERE zt1.pk IS NULL OR zt1.c1 IS NOT NULL ;
INSERT INTO zc_t1 (pk, c1, c2, c3) VALUES (0,NULL,NULL,NULL);
INSERT INTO zc_t1 (pk, c1, c2, c3) VALUES (68,-52,45,-86);
INSERT INTO zc_t1 (pk, c1, c2, c3) VALUES (51,27,-6,-8);
INSERT INTO zc_t1 (pk, c1, c2, c3) VALUES (-13,47,-47,26);
INSERT INTO zc_t1 (pk, c1, c2, c3) VALUES (-24,82,75,-10);
INSERT INTO zc_t1 (pk, c1, c2, c3) VALUES (-67,-86,72,62);
INSERT INTO zc_t1 (pk, c1, c2, c3) VALUES (18,41,-77,-12);
INSERT INTO zc_t1 (pk, c1, c2, c3) VALUES (14,-15,-53,65);
INSERT INTO zc_t1 (pk, c1, c2, c3) VALUES (39,-29,65,-62);
INSERT INTO zc_t1 (pk, c1, c2, c3) VALUES (89,18,93,-75);
INSERT INTO zc_t1 (pk, c1, c2, c3) VALUES (88,-99,9,35);
UPDATE zc_t1 SET pk = 10, c1 = 20, c2 = 30, c3 = 40 WHERE pk = (SELECT MIN(pk) FROM zc_t1);
UPDATE zc_t1 SET c1 = 92 WHERE MOD(pk, 2) = 0;
DELETE FROM zc_t1 WHERE c1 > 50 AND c1 < 70;
UPDATE zc_t1 SET c2 = c2 + 15;
UPDATE zc_t1 SET c3 = pk, c1 = c2 WHERE pk < c3;
INSERT INTO zc_t1 (pk, c1, c2, c3) VALUES (25, 50, 75, 100);
UPDATE zc_t1 SET pk = 83, c1 = 54, c2 = 39, c3 = 22 WHERE pk = (SELECT MAX(pk) FROM zc_t1);
DELETE FROM zc_t1 WHERE pk BETWEEN 10 AND 20;
select SUM(pk) AS su,COUNT(pk) as cnt,SUM(c1) AS su1,COUNT(c1) as cnt1,SUM(c2) AS su2,COUNT(c2) as cnt2,COUNT(c3) as cnt3
from ZC_T1 ZT1
WHERE zt1.pk IS NULL OR zt1.c1 IS NOT NULL ;
+-----+------+------+------+------+------+------+
| su  | cnt  | su1  | cnt1 | su2  | cnt2 | cnt3 |
+-----+------+------+------+------+------+------+
| 317 |    9 |  436 |    9 |  345 |    8 |    8 |
+-----+------+------+------+------+------+------+
SELECT * FROM ZC_MV1;
+------+------+------+------+------+------+------+
| su   | cnt  | su1  | cnt1 | su2  | cnt2 | cnt3 |
+------+------+------+------+------+------+------+
|  317 |    9 |  436 |    9 |  345 |    8 |    8 |
+------+------+------+------+------+------+------+
SELECT /*+fresh_mv*/* FROM ZC_MV1;
+------+------+------+------+------+------+------+
| su   | cnt  | su1  | cnt1 | su2  | cnt2 | cnt3 |
+------+------+------+------+------+------+------+
|  317 |    9 |  436 |    9 |  345 |    8 |    8 |
+------+------+------+------+------+------+------+
##AND/OR##
DELETE from ZC_t1;
DROP materialized view ZC_MV1;
create materialized view ZC_MV1 REFRESH FAST ON DEMAND enable on query computation AS
select SUM(pk) AS su,COUNT(pk) as cnt,SUM(c1) AS su1,COUNT(c1) as cnt1,SUM(c2) AS su2,COUNT(c2) as cnt2,COUNT(c3) as cnt3
from ZC_T1 ZT1
WHERE zt1.pk IS NULL AND zt1.c1 IS NOT NULL OR zt1.pk < 2 AND zt1.pk = 0 OR zt1.pk != 1 AND zt1.pk <> 0 OR zt1.pk <= 50 AND zt1.c1 >= -50 AND zt1.pk IN(10,20,30,40,50) OR zt1.c1 NOT IN(10,20,30,40,50) OR zt1.pk BETWEEN -50 AND 50 OR zt1.c1 NOT BETWEEN -50 AND 50 AND zt1.pk LIKE '%5%' OR zt1.c1 NOT LIKE '%5%' OR zt1.pk IS NULL OR zt1.c1 IS NOT NULL ;
INSERT INTO zc_t1 (pk, c1, c2, c3) VALUES (0,NULL,NULL,NULL);
INSERT INTO zc_t1 (pk, c1, c2, c3) VALUES (68,-52,45,-86);
INSERT INTO zc_t1 (pk, c1, c2, c3) VALUES (51,27,-6,-8);
INSERT INTO zc_t1 (pk, c1, c2, c3) VALUES (-13,47,-47,26);
INSERT INTO zc_t1 (pk, c1, c2, c3) VALUES (-24,82,75,-10);
INSERT INTO zc_t1 (pk, c1, c2, c3) VALUES (-67,-86,72,62);
INSERT INTO zc_t1 (pk, c1, c2, c3) VALUES (18,41,-77,-12);
INSERT INTO zc_t1 (pk, c1, c2, c3) VALUES (14,-15,-53,65);
INSERT INTO zc_t1 (pk, c1, c2, c3) VALUES (39,-29,65,-62);
INSERT INTO zc_t1 (pk, c1, c2, c3) VALUES (89,18,93,-75);
INSERT INTO zc_t1 (pk, c1, c2, c3) VALUES (88,-99,9,35);
UPDATE zc_t1 SET pk = 10, c1 = 20, c2 = 30, c3 = 40 WHERE pk = (SELECT MIN(pk) FROM zc_t1);
UPDATE zc_t1 SET c1 = 92 WHERE MOD(pk, 2) = 0;
DELETE FROM zc_t1 WHERE c1 > 50 AND c1 < 70;
UPDATE zc_t1 SET c2 = c2 + 15;
UPDATE zc_t1 SET c3 = pk, c1 = c2 WHERE pk < c3;
INSERT INTO zc_t1 (pk, c1, c2, c3) VALUES (25, 50, 75, 100);
UPDATE zc_t1 SET pk = 83, c1 = 54, c2 = 39, c3 = 22 WHERE pk = (SELECT MAX(pk) FROM zc_t1);
DELETE FROM zc_t1 WHERE pk BETWEEN 10 AND 20;
select SUM(pk) AS su,COUNT(pk) as cnt,SUM(c1) AS su1,COUNT(c1) as cnt1,SUM(c2) AS su2,COUNT(c2) as cnt2,COUNT(c3) as cnt3
from ZC_T1 ZT1
WHERE zt1.pk IS NULL AND zt1.c1 IS NOT NULL OR zt1.pk < 2 AND zt1.pk = 0 OR zt1.pk != 1 AND zt1.pk <> 0 OR zt1.pk <= 50 AND zt1.c1 >= -50 AND zt1.pk IN(10,20,30,40,50) OR zt1.c1 NOT IN(10,20,30,40,50) OR zt1.pk BETWEEN -50 AND 50 OR zt1.c1 NOT BETWEEN -50 AND 50 AND zt1.pk LIKE '%5%' OR zt1.c1 NOT LIKE '%5%' OR zt1.pk IS NULL OR zt1.c1 IS NOT NULL ;
+-----+------+------+------+------+------+------+
| su  | cnt  | su1  | cnt1 | su2  | cnt2 | cnt3 |
+-----+------+------+------+------+------+------+
| 317 |    9 |  436 |    9 |  345 |    8 |    8 |
+-----+------+------+------+------+------+------+
SELECT * FROM ZC_MV1;
+------+------+------+------+------+------+------+
| su   | cnt  | su1  | cnt1 | su2  | cnt2 | cnt3 |
+------+------+------+------+------+------+------+
|  317 |    9 |  436 |    9 |  345 |    8 |    8 |
+------+------+------+------+------+------+------+
SELECT /*+fresh_mv*/* FROM ZC_MV1;
+------+------+------+------+------+------+------+
| su   | cnt  | su1  | cnt1 | su2  | cnt2 | cnt3 |
+------+------+------+------+------+------+------+
|  317 |    9 |  436 |    9 |  345 |    8 |    8 |
+------+------+------+------+------+------+------+
##subquery##(NOT supported)
DELETE from ZC_t1;
DROP materialized view ZC_MV1;
create materialized view ZC_MV1 REFRESH FAST ON DEMAND enable on query computation AS
select SUM(pk) AS su,COUNT(pk) as cnt,SUM(c1) AS su1,COUNT(c1) as cnt1,SUM(c2) AS su2,COUNT(c2) as cnt2,COUNT(c3) as cnt3
from ZC_T1 ZT1
WHERE zt1.pk IN (SELECT c1 FROM zc_t1 a WHERE a.pk>0 ) ;
Got one of the listed errors
##HAVING##(NOT supported)
create materialized view ZC_MV1 REFRESH FAST ON DEMAND enable on query computation AS
select ZT1.c1 as c1,ZT1.PK AS PK,ZT1.C2 AS C2,count(*) as cnt
from ZC_T1 ZT1
group by ZT1.c1,ZT1.C2,ZT1.PK HAVING zt1.pk > 0;
Got one of the listed errors
####GROUP BY####
create materialized view ZC_MV1 REFRESH FAST ON DEMAND enable on query computation AS
select ROUND(ZT1.c1) as c1,ZT1.PK AS PK,ZT1.C2 AS C2,count(*) as cnt
from ZC_T1 ZT1
group by ROUND(ZT1.c1),ZT1.C2,ZT1.PK;
INSERT INTO zc_t1 (pk, c1, c2, c3) VALUES (0,NULL,NULL,NULL);
INSERT INTO zc_t1 (pk, c1, c2, c3) VALUES (68,-52,45,-86);
INSERT INTO zc_t1 (pk, c1, c2, c3) VALUES (51,27,-6,-8);
INSERT INTO zc_t1 (pk, c1, c2, c3) VALUES (-13,47,-47,26);
INSERT INTO zc_t1 (pk, c1, c2, c3) VALUES (-24,82,75,-10);
INSERT INTO zc_t1 (pk, c1, c2, c3) VALUES (-67,-86,72,62);
INSERT INTO zc_t1 (pk, c1, c2, c3) VALUES (18,41,-77,-12);
INSERT INTO zc_t1 (pk, c1, c2, c3) VALUES (14,-15,-53,65);
INSERT INTO zc_t1 (pk, c1, c2, c3) VALUES (39,-29,65,-62);
INSERT INTO zc_t1 (pk, c1, c2, c3) VALUES (89,18,93,-75);
INSERT INTO zc_t1 (pk, c1, c2, c3) VALUES (88,-99,9,35);
UPDATE zc_t1 SET pk = 10, c1 = 20, c2 = 30, c3 = 40 WHERE pk = (SELECT MIN(pk) FROM zc_t1);
UPDATE zc_t1 SET c1 = 92 WHERE MOD(pk, 2) = 0;
DELETE FROM zc_t1 WHERE c1 > 50 AND c1 < 70;
UPDATE zc_t1 SET c2 = c2 + 15;
UPDATE zc_t1 SET c3 = pk, c1 = c2 WHERE pk < c3;
INSERT INTO zc_t1 (pk, c1, c2, c3) VALUES (25, 50, 75, 100);
UPDATE zc_t1 SET pk = 83, c1 = 54, c2 = 39, c3 = 22 WHERE pk = (SELECT MAX(pk) FROM zc_t1);
DELETE FROM zc_t1 WHERE pk BETWEEN 10 AND 20;
select ROUND(ZT1.c1) as c1,ZT1.PK AS PK,ZT1.C2 AS C2,count(*) as cnt
from ZC_T1 ZT1
group by ROUND(ZT1.c1),ZT1.C2,ZT1.PK ORDER by pk;
+------+-----+------+------+
| c1   | PK  | C2   | cnt  |
+------+-----+------+------+
|   27 |  51 |    9 |    1 |
|   50 |  25 |   75 |    1 |
|   54 |  83 |   39 |    1 |
|   90 | -24 |   90 |    1 |
|   92 |   0 | NULL |    1 |
|   92 |  68 |   60 |    1 |
|   92 |  88 |   24 |    1 |
|  -29 |  39 |   80 |    1 |
|  -32 | -13 |  -32 |    1 |
+------+-----+------+------+
SELECT * FROM ZC_MV1 ORDER by pk;
+------+------+------+------+
| c1   | PK   | C2   | cnt  |
+------+------+------+------+
|   27 |   51 |    9 |    1 |
|   50 |   25 |   75 |    1 |
|   54 |   83 |   39 |    1 |
|   90 |  -24 |   90 |    1 |
|   92 |    0 | NULL |    1 |
|   92 |   68 |   60 |    1 |
|   92 |   88 |   24 |    1 |
|  -29 |   39 |   80 |    1 |
|  -32 |  -13 |  -32 |    1 |
+------+------+------+------+
SELECT /*+fresh_mv*/* FROM ZC_MV1 order by pk;
+------+------+------+------+
| c1   | PK   | C2   | cnt  |
+------+------+------+------+
|   27 |   51 |    9 |    1 |
|   50 |   25 |   75 |    1 |
|   54 |   83 |   39 |    1 |
|   90 |  -24 |   90 |    1 |
|   92 |    0 | NULL |    1 |
|   92 |   68 |   60 |    1 |
|   92 |   88 |   24 |    1 |
|  -29 |   39 |   80 |    1 |
|  -32 |  -13 |  -32 |    1 |
+------+------+------+------+
##FUNCTION##
DELETE from ZC_t1;
DROP materialized view ZC_MV1;
create materialized view ZC_MV1 REFRESH FAST ON DEMAND enable on query computation AS
select ROUND(ZT1.c1) as c1,LENGTH(ZT1.PK) AS PK,ABS(ZT1.C2) AS C2,count(*) as cnt
from ZC_T1 ZT1
group by ROUND(ZT1.c1),ABS(ZT1.C2),LENGTH(ZT1.PK) ;
INSERT INTO zc_t1 (pk, c1, c2, c3) VALUES (0,NULL,NULL,NULL);
INSERT INTO zc_t1 (pk, c1, c2, c3) VALUES (68,-52,45,-86);
INSERT INTO zc_t1 (pk, c1, c2, c3) VALUES (51,27,-6,-8);
INSERT INTO zc_t1 (pk, c1, c2, c3) VALUES (-13,47,-47,26);
INSERT INTO zc_t1 (pk, c1, c2, c3) VALUES (-24,82,75,-10);
INSERT INTO zc_t1 (pk, c1, c2, c3) VALUES (-67,-86,72,62);
INSERT INTO zc_t1 (pk, c1, c2, c3) VALUES (18,41,-77,-12);
INSERT INTO zc_t1 (pk, c1, c2, c3) VALUES (14,-15,-53,65);
INSERT INTO zc_t1 (pk, c1, c2, c3) VALUES (39,-29,65,-62);
INSERT INTO zc_t1 (pk, c1, c2, c3) VALUES (89,18,93,-75);
INSERT INTO zc_t1 (pk, c1, c2, c3) VALUES (88,-99,9,35);
UPDATE zc_t1 SET pk = 10, c1 = 20, c2 = 30, c3 = 40 WHERE pk = (SELECT MIN(pk) FROM zc_t1);
UPDATE zc_t1 SET c1 = 92 WHERE MOD(pk, 2) = 0;
DELETE FROM zc_t1 WHERE c1 > 50 AND c1 < 70;
UPDATE zc_t1 SET c2 = c2 + 15;
UPDATE zc_t1 SET c3 = pk, c1 = c2 WHERE pk < c3;
INSERT INTO zc_t1 (pk, c1, c2, c3) VALUES (25, 50, 75, 100);
UPDATE zc_t1 SET pk = 83, c1 = 54, c2 = 39, c3 = 22 WHERE pk = (SELECT MAX(pk) FROM zc_t1);
DELETE FROM zc_t1 WHERE pk BETWEEN 10 AND 20;
select ROUND(ZT1.c1) as c1,LENGTH(ZT1.PK) AS PK,ABS(ZT1.C2) AS C2,count(*) as cnt
from ZC_T1 ZT1
group by ROUND(ZT1.c1),ABS(ZT1.C2),LENGTH(ZT1.PK) ORDER by pk;
+------+----+------+------+
| c1   | PK | C2   | cnt  |
+------+----+------+------+
|   27 |  2 |    9 |    1 |
|   50 |  2 |   75 |    1 |
|   54 |  2 |   39 |    1 |
|   90 |  3 |   90 |    1 |
|   92 |  1 | NULL |    1 |
|   92 |  2 |   24 |    1 |
|   92 |  2 |   60 |    1 |
|  -29 |  2 |   80 |    1 |
|  -32 |  3 |   32 |    1 |
+------+----+------+------+
SELECT * FROM ZC_MV1 ORDER by c1;
+------+------+------+------+
| c1   | PK   | C2   | cnt  |
+------+------+------+------+
|   27 |    2 |    9 |    1 |
|   50 |    2 |   75 |    1 |
|   54 |    2 |   39 |    1 |
|   90 |    3 |   90 |    1 |
|   92 |    1 | NULL |    1 |
|   92 |    2 |   24 |    1 |
|   92 |    2 |   60 |    1 |
|  -29 |    2 |   80 |    1 |
|  -32 |    3 |   32 |    1 |
+------+------+------+------+
SELECT /*+fresh_mv*/* FROM ZC_MV1 order by c1;
+------+------+------+------+
| c1   | PK   | C2   | cnt  |
+------+------+------+------+
|   27 |    2 |    9 |    1 |
|   50 |    2 |   75 |    1 |
|   54 |    2 |   39 |    1 |
|   90 |    3 |   90 |    1 |
|   92 |    1 | NULL |    1 |
|   92 |    2 |   24 |    1 |
|   92 |    2 |   60 |    1 |
|  -29 |    2 |   80 |    1 |
|  -32 |    3 |   32 |    1 |
+------+------+------+------+
##distinct##
DELETE from ZC_t1;
DROP materialized view ZC_MV1;
create materialized view ZC_MV1 REFRESH FAST ON DEMAND enable on query computation AS
select DISTINCT zt1.pk AS PK,zt1.c1 as c1,count(*) as cnt
from ZC_T1 ZT1
group by ZT1.c1,ZT1.pk ;
INSERT INTO zc_t1 (pk, c1, c2, c3) VALUES (0,NULL,NULL,NULL);
INSERT INTO zc_t1 (pk, c1, c2, c3) VALUES (68,-52,45,-86);
INSERT INTO zc_t1 (pk, c1, c2, c3) VALUES (51,27,-6,-8);
INSERT INTO zc_t1 (pk, c1, c2, c3) VALUES (-13,47,-47,26);
INSERT INTO zc_t1 (pk, c1, c2, c3) VALUES (-24,82,75,-10);
INSERT INTO zc_t1 (pk, c1, c2, c3) VALUES (-67,-86,72,62);
INSERT INTO zc_t1 (pk, c1, c2, c3) VALUES (18,41,-77,-12);
INSERT INTO zc_t1 (pk, c1, c2, c3) VALUES (14,-15,-53,65);
INSERT INTO zc_t1 (pk, c1, c2, c3) VALUES (39,-29,65,-62);
INSERT INTO zc_t1 (pk, c1, c2, c3) VALUES (89,18,93,-75);
INSERT INTO zc_t1 (pk, c1, c2, c3) VALUES (88,-99,9,35);
UPDATE zc_t1 SET pk = 10, c1 = 20, c2 = 30, c3 = 40 WHERE pk = (SELECT MIN(pk) FROM zc_t1);
UPDATE zc_t1 SET c1 = 92 WHERE MOD(pk, 2) = 0;
DELETE FROM zc_t1 WHERE c1 > 50 AND c1 < 70;
UPDATE zc_t1 SET c2 = c2 + 15;
UPDATE zc_t1 SET c3 = pk, c1 = c2 WHERE pk < c3;
INSERT INTO zc_t1 (pk, c1, c2, c3) VALUES (25, 50, 75, 100);
UPDATE zc_t1 SET pk = 83, c1 = 54, c2 = 39, c3 = 22 WHERE pk = (SELECT MAX(pk) FROM zc_t1);
DELETE FROM zc_t1 WHERE pk BETWEEN 10 AND 20;
select DISTINCT zt1.pk AS PK,zt1.c1 as c1,count(*) as cnt
from ZC_T1 ZT1
group by ZT1.c1,ZT1.pk ORDER by pk;
+-----+------+------+
| PK  | c1   | cnt  |
+-----+------+------+
|   0 |   92 |    1 |
|  25 |   50 |    1 |
|  39 |  -29 |    1 |
|  51 |   27 |    1 |
|  68 |   92 |    1 |
|  83 |   54 |    1 |
|  88 |   92 |    1 |
| -13 |  -32 |    1 |
| -24 |   90 |    1 |
+-----+------+------+
SELECT * FROM ZC_MV1 ORDER by pk;
+------+------+------+
| PK   | c1   | cnt  |
+------+------+------+
|    0 |   92 |    1 |
|   25 |   50 |    1 |
|   39 |  -29 |    1 |
|   51 |   27 |    1 |
|   68 |   92 |    1 |
|   83 |   54 |    1 |
|   88 |   92 |    1 |
|  -13 |  -32 |    1 |
|  -24 |   90 |    1 |
+------+------+------+
SELECT /*+fresh_mv*/* FROM ZC_MV1 order by pk;
+------+------+------+
| PK   | c1   | cnt  |
+------+------+------+
|    0 |   92 |    1 |
|   25 |   50 |    1 |
|   39 |  -29 |    1 |
|   51 |   27 |    1 |
|   68 |   92 |    1 |
|   83 |   54 |    1 |
|   88 |   92 |    1 |
|  -13 |  -32 |    1 |
|  -24 |   90 |    1 |
+------+------+------+
##SELECT item##
DELETE from ZC_t1;
DROP materialized view ZC_MV1;
create materialized view ZC_MV1 REFRESH FAST ON DEMAND enable on query computation AS
select DISTINCT zt1.pk AS PK,zt1.c1 as c1,count(*) as cnt,ROUND(ZT1.c1) as f1,LENGTH(ZT1.PK) AS f2,ABS(ZT1.C2) AS f3
from ZC_T1 ZT1
group by ZT1.c1,ZT1.pk,ROUND(ZT1.c1),LENGTH(ZT1.PK),ABS(ZT1.C2);
INSERT INTO zc_t1 (pk, c1, c2, c3) VALUES (0,NULL,NULL,NULL);
INSERT INTO zc_t1 (pk, c1, c2, c3) VALUES (68,-52,45,-86);
INSERT INTO zc_t1 (pk, c1, c2, c3) VALUES (51,27,-6,-8);
INSERT INTO zc_t1 (pk, c1, c2, c3) VALUES (-13,47,-47,26);
INSERT INTO zc_t1 (pk, c1, c2, c3) VALUES (-24,82,75,-10);
INSERT INTO zc_t1 (pk, c1, c2, c3) VALUES (-67,-86,72,62);
INSERT INTO zc_t1 (pk, c1, c2, c3) VALUES (18,41,-77,-12);
INSERT INTO zc_t1 (pk, c1, c2, c3) VALUES (14,-15,-53,65);
INSERT INTO zc_t1 (pk, c1, c2, c3) VALUES (39,-29,65,-62);
INSERT INTO zc_t1 (pk, c1, c2, c3) VALUES (89,18,93,-75);
INSERT INTO zc_t1 (pk, c1, c2, c3) VALUES (88,-99,9,35);
UPDATE zc_t1 SET pk = 10, c1 = 20, c2 = 30, c3 = 40 WHERE pk = (SELECT MIN(pk) FROM zc_t1);
UPDATE zc_t1 SET c1 = 92 WHERE MOD(pk, 2) = 0;
DELETE FROM zc_t1 WHERE c1 > 50 AND c1 < 70;
UPDATE zc_t1 SET c2 = c2 + 15;
UPDATE zc_t1 SET c3 = pk, c1 = c2 WHERE pk < c3;
INSERT INTO zc_t1 (pk, c1, c2, c3) VALUES (25, 50, 75, 100);
UPDATE zc_t1 SET pk = 83, c1 = 54, c2 = 39, c3 = 22 WHERE pk = (SELECT MAX(pk) FROM zc_t1);
DELETE FROM zc_t1 WHERE pk BETWEEN 10 AND 20;
select DISTINCT zt1.pk AS PK,zt1.c1 as c1,count(*) as cnt,ROUND(ZT1.c1) as f1,LENGTH(ZT1.PK) AS f2,ABS(ZT1.C2) AS f3
from ZC_T1 ZT1
group by ZT1.c1,ZT1.pk,ROUND(ZT1.c1),LENGTH(ZT1.PK),ABS(ZT1.C2) ORDER by pk;
+-----+------+------+------+----+------+
| PK  | c1   | cnt  | f1   | f2 | f3   |
+-----+------+------+------+----+------+
|   0 |   92 |    1 |   92 |  1 | NULL |
|  25 |   50 |    1 |   50 |  2 |   75 |
|  39 |  -29 |    1 |  -29 |  2 |   80 |
|  51 |   27 |    1 |   27 |  2 |    9 |
|  68 |   92 |    1 |   92 |  2 |   60 |
|  83 |   54 |    1 |   54 |  2 |   39 |
|  88 |   92 |    1 |   92 |  2 |   24 |
| -13 |  -32 |    1 |  -32 |  3 |   32 |
| -24 |   90 |    1 |   90 |  3 |   90 |
+-----+------+------+------+----+------+
SELECT * FROM ZC_MV1 ORDER by pk;
+------+------+------+------+------+------+
| PK   | c1   | cnt  | f1   | f2   | f3   |
+------+------+------+------+------+------+
|    0 |   92 |    1 |   92 |    1 | NULL |
|   25 |   50 |    1 |   50 |    2 |   75 |
|   39 |  -29 |    1 |  -29 |    2 |   80 |
|   51 |   27 |    1 |   27 |    2 |    9 |
|   68 |   92 |    1 |   92 |    2 |   60 |
|   83 |   54 |    1 |   54 |    2 |   39 |
|   88 |   92 |    1 |   92 |    2 |   24 |
|  -13 |  -32 |    1 |  -32 |    3 |   32 |
|  -24 |   90 |    1 |   90 |    3 |   90 |
+------+------+------+------+------+------+
SELECT /*+fresh_mv*/* FROM ZC_MV1 order by pk;
+------+------+------+------+------+------+
| PK   | c1   | cnt  | f1   | f2   | f3   |
+------+------+------+------+------+------+
|    0 |   92 |    1 |   92 |    1 | NULL |
|   25 |   50 |    1 |   50 |    2 |   75 |
|   39 |  -29 |    1 |  -29 |    2 |   80 |
|   51 |   27 |    1 |   27 |    2 |    9 |
|   68 |   92 |    1 |   92 |    2 |   60 |
|   83 |   54 |    1 |   54 |    2 |   39 |
|   88 |   92 |    1 |   92 |    2 |   24 |
|  -13 |  -32 |    1 |  -32 |    3 |   32 |
|  -24 |   90 |    1 |   90 |    3 |   90 |
+------+------+------+------+------+------+
DELETE from ZC_t1;
DROP materialized view ZC_MV1;
create materialized view ZC_MV1 REFRESH FAST ON DEMAND enable on query computation AS
select DISTINCT zt1.pk AS PK,zt1.c1 as c1,count(*) as cnt,count(zt1.c1) as cnt1,SUM(ZT1.c1) as f1,avg(ZT1.c1) AS f2,STDDEV(ZT1.C1) AS f3,SUM(ZT1.C1*ZT1.C1) AS f4,VARIANCE(zt1.c1) AS f5
from ZC_T1 ZT1
group by ZT1.c1,ZT1.pk;
INSERT INTO zc_t1 (pk, c1, c2, c3) VALUES (0,NULL,NULL,NULL);
INSERT INTO zc_t1 (pk, c1, c2, c3) VALUES (68,-52,45,-86);
INSERT INTO zc_t1 (pk, c1, c2, c3) VALUES (51,27,-6,-8);
INSERT INTO zc_t1 (pk, c1, c2, c3) VALUES (-13,47,-47,26);
INSERT INTO zc_t1 (pk, c1, c2, c3) VALUES (-24,82,75,-10);
INSERT INTO zc_t1 (pk, c1, c2, c3) VALUES (-67,-86,72,62);
INSERT INTO zc_t1 (pk, c1, c2, c3) VALUES (18,41,-77,-12);
INSERT INTO zc_t1 (pk, c1, c2, c3) VALUES (14,-15,-53,65);
INSERT INTO zc_t1 (pk, c1, c2, c3) VALUES (39,-29,65,-62);
INSERT INTO zc_t1 (pk, c1, c2, c3) VALUES (89,18,93,-75);
INSERT INTO zc_t1 (pk, c1, c2, c3) VALUES (88,-99,9,35);
UPDATE zc_t1 SET pk = 10, c1 = 20, c2 = 30, c3 = 40 WHERE pk = (SELECT MIN(pk) FROM zc_t1);
UPDATE zc_t1 SET c1 = 92 WHERE MOD(pk, 2) = 0;
DELETE FROM zc_t1 WHERE c1 > 50 AND c1 < 70;
UPDATE zc_t1 SET c2 = c2 + 15;
UPDATE zc_t1 SET c3 = pk, c1 = c2 WHERE pk < c3;
INSERT INTO zc_t1 (pk, c1, c2, c3) VALUES (25, 50, 75, 100);
UPDATE zc_t1 SET pk = 83, c1 = 54, c2 = 39, c3 = 22 WHERE pk = (SELECT MAX(pk) FROM zc_t1);
DELETE FROM zc_t1 WHERE pk BETWEEN 10 AND 20;
select DISTINCT zt1.pk AS PK,zt1.c1 as c1,count(*) as cnt,count(zt1.c1) as cnt1,SUM(ZT1.c1) as f1,avg(ZT1.c1) AS f2,STDDEV(ZT1.C1) AS f3,SUM(ZT1.C1*ZT1.C1) AS f4,VARIANCE(zt1.c1) AS f5
from ZC_T1 ZT1
group by ZT1.c1,ZT1.pk ORDER by pk;
+-----+------+------+------+------+----------+------+------+------+
| PK  | c1   | cnt  | cnt1 | f1   | f2       | f3   | f4   | f5   |
+-----+------+------+------+------+----------+------+------+------+
|   0 |   92 |    1 |    1 |   92 |  92.0000 |    0 | 8464 |    0 |
|  25 |   50 |    1 |    1 |   50 |  50.0000 |    0 | 2500 |    0 |
|  39 |  -29 |    1 |    1 |  -29 | -29.0000 |    0 |  841 |    0 |
|  51 |   27 |    1 |    1 |   27 |  27.0000 |    0 |  729 |    0 |
|  68 |   92 |    1 |    1 |   92 |  92.0000 |    0 | 8464 |    0 |
|  83 |   54 |    1 |    1 |   54 |  54.0000 |    0 | 2916 |    0 |
|  88 |   92 |    1 |    1 |   92 |  92.0000 |    0 | 8464 |    0 |
| -13 |  -32 |    1 |    1 |  -32 | -32.0000 |    0 | 1024 |    0 |
| -24 |   90 |    1 |    1 |   90 |  90.0000 |    0 | 8100 |    0 |
+-----+------+------+------+------+----------+------+------+------+
SELECT * FROM ZC_MV1 ORDER by pk;
+------+------+------+------+------+----------+------+------+------+
| PK   | c1   | cnt  | cnt1 | f1   | f2       | f3   | f4   | f5   |
+------+------+------+------+------+----------+------+------+------+
|    0 |   92 |    1 |    1 |   92 |  92.0000 |    0 | 8464 |    0 |
|   25 |   50 |    1 |    1 |   50 |  50.0000 |    0 | 2500 |    0 |
|   39 |  -29 |    1 |    1 |  -29 | -29.0000 |    0 |  841 |    0 |
|   51 |   27 |    1 |    1 |   27 |  27.0000 |    0 |  729 |    0 |
|   68 |   92 |    1 |    1 |   92 |  92.0000 |    0 | 8464 |    0 |
|   83 |   54 |    1 |    1 |   54 |  54.0000 |    0 | 2916 |    0 |
|   88 |   92 |    1 |    1 |   92 |  92.0000 |    0 | 8464 |    0 |
|  -13 |  -32 |    1 |    1 |  -32 | -32.0000 |    0 | 1024 |    0 |
|  -24 |   90 |    1 |    1 |   90 |  90.0000 |    0 | 8100 |    0 |
+------+------+------+------+------+----------+------+------+------+
SELECT /*+fresh_mv*/* FROM ZC_MV1 order by pk;
+------+------+------+------+------+----------+------+------+------+
| PK   | c1   | cnt  | cnt1 | f1   | f2       | f3   | f4   | f5   |
+------+------+------+------+------+----------+------+------+------+
|    0 |   92 |    1 |    1 |   92 |  92.0000 |    0 | 8464 |    0 |
|   25 |   50 |    1 |    1 |   50 |  50.0000 |    0 | 2500 |    0 |
|   39 |  -29 |    1 |    1 |  -29 | -29.0000 |    0 |  841 |    0 |
|   51 |   27 |    1 |    1 |   27 |  27.0000 |    0 |  729 |    0 |
|   68 |   92 |    1 |    1 |   92 |  92.0000 |    0 | 8464 |    0 |
|   83 |   54 |    1 |    1 |   54 |  54.0000 |    0 | 2916 |    0 |
|   88 |   92 |    1 |    1 |   92 |  92.0000 |    0 | 8464 |    0 |
|  -13 |  -32 |    1 |    1 |  -32 | -32.0000 |    0 | 1024 |    0 |
|  -24 |   90 |    1 |    1 |   90 |  90.0000 |    0 | 8100 |    0 |
+------+------+------+------+------+----------+------+------+------+
##NULL##
DELETE from ZC_t1;
DROP materialized view ZC_MV1;
create materialized view ZC_MV1 REFRESH FAST ON DEMAND enable on query computation AS
select DISTINCT zt1.pk AS PK,zt1.c1 as c1,count(*) as cnt,NULL as n
from ZC_T1 ZT1
group by ZT1.c1,ZT1.pk;
ERROR 0A000: Not supported feature or function
create materialized view ZC_MV1 REFRESH FAST ON DEMAND enable on query computation AS
select DISTINCT zt1.pk AS PK,zt1.c1 as c1,count(*) as cnt,1 as a
from ZC_T1 ZT1
group by ZT1.c1,ZT1.pk;
INSERT INTO zc_t1 (pk, c1, c2, c3) VALUES (0,NULL,NULL,NULL);
INSERT INTO zc_t1 (pk, c1, c2, c3) VALUES (68,-52,45,-86);
INSERT INTO zc_t1 (pk, c1, c2, c3) VALUES (51,27,-6,-8);
INSERT INTO zc_t1 (pk, c1, c2, c3) VALUES (-13,47,-47,26);
INSERT INTO zc_t1 (pk, c1, c2, c3) VALUES (-24,82,75,-10);
INSERT INTO zc_t1 (pk, c1, c2, c3) VALUES (-67,-86,72,62);
INSERT INTO zc_t1 (pk, c1, c2, c3) VALUES (18,41,-77,-12);
INSERT INTO zc_t1 (pk, c1, c2, c3) VALUES (14,-15,-53,65);
INSERT INTO zc_t1 (pk, c1, c2, c3) VALUES (39,-29,65,-62);
INSERT INTO zc_t1 (pk, c1, c2, c3) VALUES (89,18,93,-75);
INSERT INTO zc_t1 (pk, c1, c2, c3) VALUES (88,-99,9,35);
UPDATE zc_t1 SET pk = 10, c1 = 20, c2 = 30, c3 = 40 WHERE pk = (SELECT MIN(pk) FROM zc_t1);
UPDATE zc_t1 SET c1 = 92 WHERE MOD(pk, 2) = 0;
DELETE FROM zc_t1 WHERE c1 > 50 AND c1 < 70;
UPDATE zc_t1 SET c2 = c2 + 15;
UPDATE zc_t1 SET c3 = pk, c1 = c2 WHERE pk < c3;
INSERT INTO zc_t1 (pk, c1, c2, c3) VALUES (25, 50, 75, 100);
UPDATE zc_t1 SET pk = 83, c1 = 54, c2 = 39, c3 = 22 WHERE pk = (SELECT MAX(pk) FROM zc_t1);
DELETE FROM zc_t1 WHERE pk BETWEEN 10 AND 20;
select DISTINCT zt1.pk AS PK,zt1.c1 as c1,count(*) as cnt,1 as a
from ZC_T1 ZT1
group by ZT1.c1,ZT1.pk;
+-----+------+------+---+
| PK  | c1   | cnt  | a |
+-----+------+------+---+
|   0 |   92 |    1 | 1 |
|  25 |   50 |    1 | 1 |
|  39 |  -29 |    1 | 1 |
|  51 |   27 |    1 | 1 |
|  68 |   92 |    1 | 1 |
|  83 |   54 |    1 | 1 |
|  88 |   92 |    1 | 1 |
| -13 |  -32 |    1 | 1 |
| -24 |   90 |    1 | 1 |
+-----+------+------+---+
SELECT * FROM ZC_MV1 ORDER by pk;
+------+------+------+------+
| PK   | c1   | cnt  | a    |
+------+------+------+------+
|    0 |   92 |    1 |    1 |
|   25 |   50 |    1 |    1 |
|   39 |  -29 |    1 |    1 |
|   51 |   27 |    1 |    1 |
|   68 |   92 |    1 |    1 |
|   83 |   54 |    1 |    1 |
|   88 |   92 |    1 |    1 |
|  -13 |  -32 |    1 |    1 |
|  -24 |   90 |    1 |    1 |
+------+------+------+------+
SELECT /*+fresh_mv*/* FROM ZC_MV1 order by pk;
+------+------+------+------+
| PK   | c1   | cnt  | a    |
+------+------+------+------+
|    0 |   92 |    1 |    1 |
|   25 |   50 |    1 |    1 |
|   39 |  -29 |    1 |    1 |
|   51 |   27 |    1 |    1 |
|   68 |   92 |    1 |    1 |
|   83 |   54 |    1 |    1 |
|   88 |   92 |    1 |    1 |
|  -13 |  -32 |    1 |    1 |
|  -24 |   90 |    1 |    1 |
+------+------+------+------+
##subquery##(NOT supported)
DELETE from ZC_t1;
DROP materialized view ZC_MV1;
create materialized view ZC_MV1 REFRESH FAST ON DEMAND enable on query computation AS
select zt1.pk AS PK,zt1.c1 as c1,count(*) as cnt,(SELECT pk FROM zc_t1 WHERE pk=25) as sub
from ZC_T1 ZT1
group by ZT1.c1,ZT1.pk;
Got one of the listed errors
####mjv####
DELETE from ZC_t1;
create materialized view ZC_MV1 REFRESH FAST ON DEMAND enable on query computation AS
select zt1.pk AS c1,zt2.pk as c2
from ZC_T1 ZT1 ,ZC_T1 ZT2 WHERE zt1.pk = zt2.pk;
INSERT INTO zc_t1 (pk, c1, c2, c3) VALUES (0,NULL,NULL,NULL);
INSERT INTO zc_t1 (pk, c1, c2, c3) VALUES (68,-52,45,-86);
INSERT INTO zc_t1 (pk, c1, c2, c3) VALUES (51,27,-6,-8);
INSERT INTO zc_t1 (pk, c1, c2, c3) VALUES (-13,47,-47,26);
INSERT INTO zc_t1 (pk, c1, c2, c3) VALUES (-24,82,75,-10);
INSERT INTO zc_t1 (pk, c1, c2, c3) VALUES (-67,-86,72,62);
INSERT INTO zc_t1 (pk, c1, c2, c3) VALUES (18,41,-77,-12);
INSERT INTO zc_t1 (pk, c1, c2, c3) VALUES (14,-15,-53,65);
INSERT INTO zc_t1 (pk, c1, c2, c3) VALUES (39,-29,65,-62);
INSERT INTO zc_t1 (pk, c1, c2, c3) VALUES (89,18,93,-75);
INSERT INTO zc_t1 (pk, c1, c2, c3) VALUES (88,-99,9,35);
UPDATE zc_t1 SET pk = 10, c1 = 20, c2 = 30, c3 = 40 WHERE pk = (SELECT MIN(pk) FROM zc_t1);
UPDATE zc_t1 SET c1 = 92 WHERE MOD(pk, 2) = 0;
DELETE FROM zc_t1 WHERE c1 > 50 AND c1 < 70;
UPDATE zc_t1 SET c2 = c2 + 15;
UPDATE zc_t1 SET c3 = pk, c1 = c2 WHERE pk < c3;
INSERT INTO zc_t1 (pk, c1, c2, c3) VALUES (25, 50, 75, 100);
UPDATE zc_t1 SET pk = 83, c1 = 54, c2 = 39, c3 = 22 WHERE pk = (SELECT MAX(pk) FROM zc_t1);
DELETE FROM zc_t1 WHERE pk BETWEEN 10 AND 20;
select zt1.pk AS c1,zt2.pk as c2
from ZC_T1 ZT1 ,ZC_T1 ZT2 WHERE zt1.pk = zt2.pk;
+-----+-----+
| c1  | c2  |
+-----+-----+
|   0 |   0 |
|  25 |  25 |
|  39 |  39 |
|  51 |  51 |
|  68 |  68 |
|  83 |  83 |
|  88 |  88 |
| -13 | -13 |
| -24 | -24 |
+-----+-----+
SELECT * FROM ZC_MV1 ;
+------+------+
| c1   | c2   |
+------+------+
|    0 |    0 |
|   25 |   25 |
|   39 |   39 |
|   51 |   51 |
|   68 |   68 |
|   83 |   83 |
|   88 |   88 |
|  -13 |  -13 |
|  -24 |  -24 |
+------+------+
SELECT /*+fresh_mv*/* FROM ZC_MV1;
+------+------+
| c1   | c2   |
+------+------+
|    0 |    0 |
|   25 |   25 |
|   39 |   39 |
|   51 |   51 |
|   68 |   68 |
|   83 |   83 |
|   88 |   88 |
|  -13 |  -13 |
|  -24 |  -24 |
+------+------+
DELETE from ZC_t1;
DROP materialized view ZC_MV1;
##5张表
create materialized view ZC_MV1 REFRESH FAST ON DEMAND enable on query computation AS
select zt1.pk AS c1,zt2.pk as c2,zt3.pk as c3,zt4.pk as c4,zt5.pk as c5
from ZC_T1 ZT1 ,ZC_T1 ZT2,ZC_T1 ZT3,ZC_T1 ZT4,ZC_T1 ZT5 WHERE zt1.pk = zt2.pk AND zt2.pk = zt3.pk AND zt3.pk = zt4.pk AND zt4.pk = zt5.pk;
INSERT INTO zc_t1 (pk, c1, c2, c3) VALUES (0,NULL,NULL,NULL);
INSERT INTO zc_t1 (pk, c1, c2, c3) VALUES (68,-52,45,-86);
INSERT INTO zc_t1 (pk, c1, c2, c3) VALUES (51,27,-6,-8);
INSERT INTO zc_t1 (pk, c1, c2, c3) VALUES (-13,47,-47,26);
INSERT INTO zc_t1 (pk, c1, c2, c3) VALUES (-24,82,75,-10);
INSERT INTO zc_t1 (pk, c1, c2, c3) VALUES (-67,-86,72,62);
INSERT INTO zc_t1 (pk, c1, c2, c3) VALUES (18,41,-77,-12);
INSERT INTO zc_t1 (pk, c1, c2, c3) VALUES (14,-15,-53,65);
INSERT INTO zc_t1 (pk, c1, c2, c3) VALUES (39,-29,65,-62);
INSERT INTO zc_t1 (pk, c1, c2, c3) VALUES (89,18,93,-75);
INSERT INTO zc_t1 (pk, c1, c2, c3) VALUES (88,-99,9,35);
UPDATE zc_t1 SET pk = 10, c1 = 20, c2 = 30, c3 = 40 WHERE pk = (SELECT MIN(pk) FROM zc_t1);
UPDATE zc_t1 SET c1 = 92 WHERE MOD(pk, 2) = 0;
DELETE FROM zc_t1 WHERE c1 > 50 AND c1 < 70;
UPDATE zc_t1 SET c2 = c2 + 15;
UPDATE zc_t1 SET c3 = pk, c1 = c2 WHERE pk < c3;
INSERT INTO zc_t1 (pk, c1, c2, c3) VALUES (25, 50, 75, 100);
UPDATE zc_t1 SET pk = 83, c1 = 54, c2 = 39, c3 = 22 WHERE pk = (SELECT MAX(pk) FROM zc_t1);
DELETE FROM zc_t1 WHERE pk BETWEEN 10 AND 20;
select zt1.pk AS c1,zt2.pk as c2,zt3.pk as c3,zt4.pk as c4,zt5.pk as c5
from ZC_T1 ZT1 ,ZC_T1 ZT2,ZC_T1 ZT3,ZC_T1 ZT4,ZC_T1 ZT5 WHERE zt1.pk = zt2.pk AND zt2.pk = zt3.pk AND zt3.pk = zt4.pk AND zt4.pk = zt5.pk ORDER by c1;
+-----+-----+-----+-----+-----+
| c1  | c2  | c3  | c4  | c5  |
+-----+-----+-----+-----+-----+
|   0 |   0 |   0 |   0 |   0 |
|  25 |  25 |  25 |  25 |  25 |
|  39 |  39 |  39 |  39 |  39 |
|  51 |  51 |  51 |  51 |  51 |
|  68 |  68 |  68 |  68 |  68 |
|  83 |  83 |  83 |  83 |  83 |
|  88 |  88 |  88 |  88 |  88 |
| -13 | -13 | -13 | -13 | -13 |
| -24 | -24 | -24 | -24 | -24 |
+-----+-----+-----+-----+-----+
SELECT * FROM ZC_MV1 ORDER by c1;
+------+------+------+------+------+
| c1   | c2   | c3   | c4   | c5   |
+------+------+------+------+------+
|    0 |    0 |    0 |    0 |    0 |
|   25 |   25 |   25 |   25 |   25 |
|   39 |   39 |   39 |   39 |   39 |
|   51 |   51 |   51 |   51 |   51 |
|   68 |   68 |   68 |   68 |   68 |
|   83 |   83 |   83 |   83 |   83 |
|   88 |   88 |   88 |   88 |   88 |
|  -13 |  -13 |  -13 |  -13 |  -13 |
|  -24 |  -24 |  -24 |  -24 |  -24 |
+------+------+------+------+------+
SELECT /*+fresh_mv*/* FROM ZC_MV1;
+------+------+------+------+------+
| c1   | c2   | c3   | c4   | c5   |
+------+------+------+------+------+
|    0 |    0 |    0 |    0 |    0 |
|   25 |   25 |   25 |   25 |   25 |
|   39 |   39 |   39 |   39 |   39 |
|   51 |   51 |   51 |   51 |   51 |
|   68 |   68 |   68 |   68 |   68 |
|   83 |   83 |   83 |   83 |   83 |
|   88 |   88 |   88 |   88 |   88 |
|  -13 |  -13 |  -13 |  -13 |  -13 |
|  -24 |  -24 |  -24 |  -24 |  -24 |
+------+------+------+------+------+
DELETE from ZC_t1;
DROP materialized view ZC_MV1;
create materialized view ZC_MV1 REFRESH FAST ON DEMAND enable on query computation AS
select zt1.pk AS c1,zt2.pk as c2,zt3.pk as c3,zt4.pk as c4,zt5.pk as c5,zt6.pk as c6
from ZC_T1 ZT1 ,ZC_T1 ZT2,ZC_T1 ZT3,ZC_T1 ZT4,ZC_T1 ZT5,ZC_T1 ZT6 WHERE zt1.pk = zt2.pk AND zt2.pk = zt3.pk AND zt3.pk = zt4.pk AND zt4.pk = zt5.pk AND zt5.pk = zt6.pk;
DROP materialized view ZC_MV1;
##inner join
DELETE from ZC_t1;
create materialized view ZC_MV1 REFRESH FAST ON DEMAND enable on query computation AS
select zt1.pk AS c1,zt2.pk as c2
from ZC_T1 ZT1 inner join ZC_T1 ZT2 ON zt1.pk = zt2.pk;
INSERT INTO zc_t1 (pk, c1, c2, c3) VALUES (0,NULL,NULL,NULL);
INSERT INTO zc_t1 (pk, c1, c2, c3) VALUES (68,-52,45,-86);
INSERT INTO zc_t1 (pk, c1, c2, c3) VALUES (51,27,-6,-8);
INSERT INTO zc_t1 (pk, c1, c2, c3) VALUES (-13,47,-47,26);
INSERT INTO zc_t1 (pk, c1, c2, c3) VALUES (-24,82,75,-10);
INSERT INTO zc_t1 (pk, c1, c2, c3) VALUES (-67,-86,72,62);
INSERT INTO zc_t1 (pk, c1, c2, c3) VALUES (18,41,-77,-12);
INSERT INTO zc_t1 (pk, c1, c2, c3) VALUES (14,-15,-53,65);
INSERT INTO zc_t1 (pk, c1, c2, c3) VALUES (39,-29,65,-62);
INSERT INTO zc_t1 (pk, c1, c2, c3) VALUES (89,18,93,-75);
INSERT INTO zc_t1 (pk, c1, c2, c3) VALUES (88,-99,9,35);
UPDATE zc_t1 SET pk = 10, c1 = 20, c2 = 30, c3 = 40 WHERE pk = (SELECT MIN(pk) FROM zc_t1);
UPDATE zc_t1 SET c1 = 92 WHERE MOD(pk, 2) = 0;
DELETE FROM zc_t1 WHERE c1 > 50 AND c1 < 70;
UPDATE zc_t1 SET c2 = c2 + 15;
UPDATE zc_t1 SET c3 = pk, c1 = c2 WHERE pk < c3;
INSERT INTO zc_t1 (pk, c1, c2, c3) VALUES (25, 50, 75, 100);
UPDATE zc_t1 SET pk = 83, c1 = 54, c2 = 39, c3 = 22 WHERE pk = (SELECT MAX(pk) FROM zc_t1);
DELETE FROM zc_t1 WHERE pk BETWEEN 10 AND 20;
select zt1.pk AS c1,zt2.pk as c2
from ZC_T1 ZT1 inner join ZC_T1 ZT2 ON zt1.pk = zt2.pk ORDER by c1;
+-----+-----+
| c1  | c2  |
+-----+-----+
|   0 |   0 |
|  25 |  25 |
|  39 |  39 |
|  51 |  51 |
|  68 |  68 |
|  83 |  83 |
|  88 |  88 |
| -13 | -13 |
| -24 | -24 |
+-----+-----+
SELECT * FROM ZC_MV1 ORDER by c1;
+------+------+
| c1   | c2   |
+------+------+
|    0 |    0 |
|   25 |   25 |
|   39 |   39 |
|   51 |   51 |
|   68 |   68 |
|   83 |   83 |
|   88 |   88 |
|  -13 |  -13 |
|  -24 |  -24 |
+------+------+
SELECT /*+fresh_mv*/* FROM ZC_MV1;
+------+------+
| c1   | c2   |
+------+------+
|    0 |    0 |
|   25 |   25 |
|   39 |   39 |
|   51 |   51 |
|   68 |   68 |
|   83 |   83 |
|   88 |   88 |
|  -13 |  -13 |
|  -24 |  -24 |
+------+------+
DELETE from ZC_t1;
DROP materialized view ZC_MV1;
create materialized view ZC_MV1 REFRESH FAST ON DEMAND enable on query computation AS
select zt1.pk AS c1,zt2.pk as c2
from ZC_T1 ZT1,ZC_T1 ZT2 WHERE zt1.pk < 2;
INSERT INTO zc_t1 (pk, c1, c2, c3) VALUES (0,NULL,NULL,NULL);
INSERT INTO zc_t1 (pk, c1, c2, c3) VALUES (68,-52,45,-86);
INSERT INTO zc_t1 (pk, c1, c2, c3) VALUES (51,27,-6,-8);
INSERT INTO zc_t1 (pk, c1, c2, c3) VALUES (-13,47,-47,26);
INSERT INTO zc_t1 (pk, c1, c2, c3) VALUES (-24,82,75,-10);
INSERT INTO zc_t1 (pk, c1, c2, c3) VALUES (-67,-86,72,62);
INSERT INTO zc_t1 (pk, c1, c2, c3) VALUES (18,41,-77,-12);
INSERT INTO zc_t1 (pk, c1, c2, c3) VALUES (14,-15,-53,65);
INSERT INTO zc_t1 (pk, c1, c2, c3) VALUES (39,-29,65,-62);
INSERT INTO zc_t1 (pk, c1, c2, c3) VALUES (89,18,93,-75);
INSERT INTO zc_t1 (pk, c1, c2, c3) VALUES (88,-99,9,35);
UPDATE zc_t1 SET pk = 10, c1 = 20, c2 = 30, c3 = 40 WHERE pk = (SELECT MIN(pk) FROM zc_t1);
UPDATE zc_t1 SET c1 = 92 WHERE MOD(pk, 2) = 0;
DELETE FROM zc_t1 WHERE c1 > 50 AND c1 < 70;
UPDATE zc_t1 SET c2 = c2 + 15;
UPDATE zc_t1 SET c3 = pk, c1 = c2 WHERE pk < c3;
INSERT INTO zc_t1 (pk, c1, c2, c3) VALUES (25, 50, 75, 100);
UPDATE zc_t1 SET pk = 83, c1 = 54, c2 = 39, c3 = 22 WHERE pk = (SELECT MAX(pk) FROM zc_t1);
DELETE FROM zc_t1 WHERE pk BETWEEN 10 AND 20;
select zt1.pk AS c1,zt2.pk as c2
from ZC_T1 ZT1,ZC_T1 ZT2 WHERE zt1.pk < 2 ORDER by c2;
+-----+-----+
| c1  | c2  |
+-----+-----+
|   0 |   0 |
|   0 |  25 |
|   0 |  39 |
|   0 |  51 |
|   0 |  68 |
|   0 |  83 |
|   0 |  88 |
|   0 | -13 |
|   0 | -24 |
| -13 |   0 |
| -13 |  25 |
| -13 |  39 |
| -13 |  51 |
| -13 |  68 |
| -13 |  83 |
| -13 |  88 |
| -13 | -13 |
| -13 | -24 |
| -24 |   0 |
| -24 |  25 |
| -24 |  39 |
| -24 |  51 |
| -24 |  68 |
| -24 |  83 |
| -24 |  88 |
| -24 | -13 |
| -24 | -24 |
+-----+-----+
SELECT * FROM ZC_MV1 ORDER by c2;
+------+------+
| c1   | c2   |
+------+------+
|    0 |    0 |
|    0 |   25 |
|    0 |   39 |
|    0 |   51 |
|    0 |   68 |
|    0 |   83 |
|    0 |   88 |
|    0 |  -13 |
|    0 |  -24 |
|  -13 |    0 |
|  -13 |   25 |
|  -13 |   39 |
|  -13 |   51 |
|  -13 |   68 |
|  -13 |   83 |
|  -13 |   88 |
|  -13 |  -13 |
|  -13 |  -24 |
|  -24 |    0 |
|  -24 |   25 |
|  -24 |   39 |
|  -24 |   51 |
|  -24 |   68 |
|  -24 |   83 |
|  -24 |   88 |
|  -24 |  -13 |
|  -24 |  -24 |
+------+------+
SELECT /*+fresh_mv*/* FROM ZC_MV1;
+------+------+
| c1   | c2   |
+------+------+
|    0 |    0 |
|    0 |   25 |
|    0 |   39 |
|    0 |   51 |
|    0 |   68 |
|    0 |   83 |
|    0 |   88 |
|    0 |  -13 |
|    0 |  -24 |
|  -13 |    0 |
|  -13 |   25 |
|  -13 |   39 |
|  -13 |   51 |
|  -13 |   68 |
|  -13 |   83 |
|  -13 |   88 |
|  -13 |  -13 |
|  -13 |  -24 |
|  -24 |    0 |
|  -24 |   25 |
|  -24 |   39 |
|  -24 |   51 |
|  -24 |   68 |
|  -24 |   83 |
|  -24 |   88 |
|  -24 |  -13 |
|  -24 |  -24 |
+------+------+
DELETE from ZC_t1;
DROP materialized view ZC_MV1;
create materialized view ZC_MV1 REFRESH FAST ON DEMAND enable on query computation AS
select zt1.pk AS c1,zt2.pk as c2
from ZC_T1 ZT1,ZC_T1 ZT2
WHERE zt1.pk IS NULL AND zt2.pk IS NOT NULL OR zt1.c1 < 2 AND zt2.c1 = 0 OR zt1.c2 != 1 AND zt2.c2 <> 0 OR zt1.c3 <= 50 AND zt2.c3 >= -50 AND zt2.c1 IN(10,20,30,40,50) OR zt2.c2 NOT IN(10,20,30,40,50) OR zt1.pk BETWEEN -50 AND 50 OR zt2.c1 NOT BETWEEN -50 AND 50 AND zt2.pk LIKE '%5%' OR zt1.c1 NOT LIKE '%5%' OR zt1.pk IS NULL OR zt2.c1 IS NOT NULL;
INSERT INTO zc_t1 (pk, c1, c2, c3) VALUES (0,NULL,NULL,NULL);
INSERT INTO zc_t1 (pk, c1, c2, c3) VALUES (68,-52,45,-86);
INSERT INTO zc_t1 (pk, c1, c2, c3) VALUES (51,27,-6,-8);
INSERT INTO zc_t1 (pk, c1, c2, c3) VALUES (-13,47,-47,26);
INSERT INTO zc_t1 (pk, c1, c2, c3) VALUES (-24,82,75,-10);
INSERT INTO zc_t1 (pk, c1, c2, c3) VALUES (-67,-86,72,62);
INSERT INTO zc_t1 (pk, c1, c2, c3) VALUES (18,41,-77,-12);
INSERT INTO zc_t1 (pk, c1, c2, c3) VALUES (14,-15,-53,65);
INSERT INTO zc_t1 (pk, c1, c2, c3) VALUES (39,-29,65,-62);
INSERT INTO zc_t1 (pk, c1, c2, c3) VALUES (89,18,93,-75);
INSERT INTO zc_t1 (pk, c1, c2, c3) VALUES (88,-99,9,35);
UPDATE zc_t1 SET pk = 10, c1 = 20, c2 = 30, c3 = 40 WHERE pk = (SELECT MIN(pk) FROM zc_t1);
UPDATE zc_t1 SET c1 = 92 WHERE MOD(pk, 2) = 0;
DELETE FROM zc_t1 WHERE c1 > 50 AND c1 < 70;
UPDATE zc_t1 SET c2 = c2 + 15;
UPDATE zc_t1 SET c3 = pk, c1 = c2 WHERE pk < c3;
INSERT INTO zc_t1 (pk, c1, c2, c3) VALUES (25, 50, 75, 100);
UPDATE zc_t1 SET pk = 83, c1 = 54, c2 = 39, c3 = 22 WHERE pk = (SELECT MAX(pk) FROM zc_t1);
DELETE FROM zc_t1 WHERE pk BETWEEN 10 AND 20;
select zt1.pk AS c1,zt2.pk as c2
from ZC_T1 ZT1,ZC_T1 ZT2
WHERE zt1.pk IS NULL AND zt2.pk IS NOT NULL OR zt1.c1 < 2 AND zt2.c1 = 0 OR zt1.c2 != 1 AND zt2.c2 <> 0 OR zt1.c3 <= 50 AND zt2.c3 >= -50 AND zt2.c1 IN(10,20,30,40,50) OR zt2.c2 NOT IN(10,20,30,40,50) OR zt1.pk BETWEEN -50 AND 50 OR zt2.c1 NOT BETWEEN -50 AND 50 AND zt2.pk LIKE '%5%' OR zt1.c1 NOT LIKE '%5%' OR zt1.pk IS NULL OR zt2.c1 IS NOT NULL ORDER by c2;
+-----+-----+
| c1  | c2  |
+-----+-----+
|   0 |   0 |
|   0 |  25 |
|   0 |  39 |
|   0 |  51 |
|   0 |  68 |
|   0 |  83 |
|   0 |  88 |
|   0 | -13 |
|   0 | -24 |
|  25 |   0 |
|  25 |  25 |
|  25 |  39 |
|  25 |  51 |
|  25 |  68 |
|  25 |  83 |
|  25 |  88 |
|  25 | -13 |
|  25 | -24 |
|  39 |   0 |
|  39 |  25 |
|  39 |  39 |
|  39 |  51 |
|  39 |  68 |
|  39 |  83 |
|  39 |  88 |
|  39 | -13 |
|  39 | -24 |
|  51 |   0 |
|  51 |  25 |
|  51 |  39 |
|  51 |  51 |
|  51 |  68 |
|  51 |  83 |
|  51 |  88 |
|  51 | -13 |
|  51 | -24 |
|  68 |   0 |
|  68 |  25 |
|  68 |  39 |
|  68 |  51 |
|  68 |  68 |
|  68 |  83 |
|  68 |  88 |
|  68 | -13 |
|  68 | -24 |
|  83 |   0 |
|  83 |  25 |
|  83 |  39 |
|  83 |  51 |
|  83 |  68 |
|  83 |  83 |
|  83 |  88 |
|  83 | -13 |
|  83 | -24 |
|  88 |   0 |
|  88 |  25 |
|  88 |  39 |
|  88 |  51 |
|  88 |  68 |
|  88 |  83 |
|  88 |  88 |
|  88 | -13 |
|  88 | -24 |
| -13 |   0 |
| -13 |  25 |
| -13 |  39 |
| -13 |  51 |
| -13 |  68 |
| -13 |  83 |
| -13 |  88 |
| -13 | -13 |
| -13 | -24 |
| -24 |   0 |
| -24 |  25 |
| -24 |  39 |
| -24 |  51 |
| -24 |  68 |
| -24 |  83 |
| -24 |  88 |
| -24 | -13 |
| -24 | -24 |
+-----+-----+
SELECT * FROM ZC_MV1 ORDER by c2;
+------+------+
| c1   | c2   |
+------+------+
|    0 |    0 |
|    0 |   25 |
|    0 |   39 |
|    0 |   51 |
|    0 |   68 |
|    0 |   83 |
|    0 |   88 |
|    0 |  -13 |
|    0 |  -24 |
|   25 |    0 |
|   25 |   25 |
|   25 |   39 |
|   25 |   51 |
|   25 |   68 |
|   25 |   83 |
|   25 |   88 |
|   25 |  -13 |
|   25 |  -24 |
|   39 |    0 |
|   39 |   25 |
|   39 |   39 |
|   39 |   51 |
|   39 |   68 |
|   39 |   83 |
|   39 |   88 |
|   39 |  -13 |
|   39 |  -24 |
|   51 |    0 |
|   51 |   25 |
|   51 |   39 |
|   51 |   51 |
|   51 |   68 |
|   51 |   83 |
|   51 |   88 |
|   51 |  -13 |
|   51 |  -24 |
|   68 |    0 |
|   68 |   25 |
|   68 |   39 |
|   68 |   51 |
|   68 |   68 |
|   68 |   83 |
|   68 |   88 |
|   68 |  -13 |
|   68 |  -24 |
|   83 |    0 |
|   83 |   25 |
|   83 |   39 |
|   83 |   51 |
|   83 |   68 |
|   83 |   83 |
|   83 |   88 |
|   83 |  -13 |
|   83 |  -24 |
|   88 |    0 |
|   88 |   25 |
|   88 |   39 |
|   88 |   51 |
|   88 |   68 |
|   88 |   83 |
|   88 |   88 |
|   88 |  -13 |
|   88 |  -24 |
|  -13 |    0 |
|  -13 |   25 |
|  -13 |   39 |
|  -13 |   51 |
|  -13 |   68 |
|  -13 |   83 |
|  -13 |   88 |
|  -13 |  -13 |
|  -13 |  -24 |
|  -24 |    0 |
|  -24 |   25 |
|  -24 |   39 |
|  -24 |   51 |
|  -24 |   68 |
|  -24 |   83 |
|  -24 |   88 |
|  -24 |  -13 |
|  -24 |  -24 |
+------+------+
SELECT /*+fresh_mv*/* FROM ZC_MV1;
+------+------+
| c1   | c2   |
+------+------+
|    0 |    0 |
|    0 |   25 |
|    0 |   39 |
|    0 |   51 |
|    0 |   68 |
|    0 |   83 |
|    0 |   88 |
|    0 |  -13 |
|    0 |  -24 |
|   25 |    0 |
|   25 |   25 |
|   25 |   39 |
|   25 |   51 |
|   25 |   68 |
|   25 |   83 |
|   25 |   88 |
|   25 |  -13 |
|   25 |  -24 |
|   39 |    0 |
|   39 |   25 |
|   39 |   39 |
|   39 |   51 |
|   39 |   68 |
|   39 |   83 |
|   39 |   88 |
|   39 |  -13 |
|   39 |  -24 |
|   51 |    0 |
|   51 |   25 |
|   51 |   39 |
|   51 |   51 |
|   51 |   68 |
|   51 |   83 |
|   51 |   88 |
|   51 |  -13 |
|   51 |  -24 |
|   68 |    0 |
|   68 |   25 |
|   68 |   39 |
|   68 |   51 |
|   68 |   68 |
|   68 |   83 |
|   68 |   88 |
|   68 |  -13 |
|   68 |  -24 |
|   83 |    0 |
|   83 |   25 |
|   83 |   39 |
|   83 |   51 |
|   83 |   68 |
|   83 |   83 |
|   83 |   88 |
|   83 |  -13 |
|   83 |  -24 |
|   88 |    0 |
|   88 |   25 |
|   88 |   39 |
|   88 |   51 |
|   88 |   68 |
|   88 |   83 |
|   88 |   88 |
|   88 |  -13 |
|   88 |  -24 |
|  -13 |    0 |
|  -13 |   25 |
|  -13 |   39 |
|  -13 |   51 |
|  -13 |   68 |
|  -13 |   83 |
|  -13 |   88 |
|  -13 |  -13 |
|  -13 |  -24 |
|  -24 |    0 |
|  -24 |   25 |
|  -24 |   39 |
|  -24 |   51 |
|  -24 |   68 |
|  -24 |   83 |
|  -24 |   88 |
|  -24 |  -13 |
|  -24 |  -24 |
+------+------+
##SELECT item##
DELETE from ZC_t1;
DROP materialized view ZC_MV1;
create materialized view ZC_MV1 REFRESH FAST ON DEMAND enable on query computation AS
select DISTINCT zt1.pk AS c1,zt2.pk as c2,ROUND(ZT1.c1) as f1,LENGTH(ZT2.c1) AS f2,ABS(ZT2.C2) AS f3
from ZC_T1 ZT1,ZC_T1 ZT2
WHERE zt1.pk IS NULL AND zt2.pk IS NOT NULL OR zt1.c1 < 2 AND zt2.c1 = 0 OR zt1.c2 != 1 AND zt2.c2 <> 0 OR zt1.c3 <= 50 AND zt2.c3 >= -50 AND zt2.c1 IN(10,20,30,40,50) OR zt2.c2 NOT IN(10,20,30,40,50) OR zt1.pk BETWEEN -50 AND 50 OR zt2.c1 NOT BETWEEN -50 AND 50 AND zt2.pk LIKE '%5%' OR zt1.c1 NOT LIKE '%5%' OR zt1.pk IS NULL OR zt2.c1 IS NOT NULL;
INSERT INTO zc_t1 (pk, c1, c2, c3) VALUES (0,NULL,NULL,NULL);
INSERT INTO zc_t1 (pk, c1, c2, c3) VALUES (68,-52,45,-86);
INSERT INTO zc_t1 (pk, c1, c2, c3) VALUES (51,27,-6,-8);
INSERT INTO zc_t1 (pk, c1, c2, c3) VALUES (-13,47,-47,26);
INSERT INTO zc_t1 (pk, c1, c2, c3) VALUES (-24,82,75,-10);
INSERT INTO zc_t1 (pk, c1, c2, c3) VALUES (-67,-86,72,62);
INSERT INTO zc_t1 (pk, c1, c2, c3) VALUES (18,41,-77,-12);
INSERT INTO zc_t1 (pk, c1, c2, c3) VALUES (14,-15,-53,65);
INSERT INTO zc_t1 (pk, c1, c2, c3) VALUES (39,-29,65,-62);
INSERT INTO zc_t1 (pk, c1, c2, c3) VALUES (89,18,93,-75);
INSERT INTO zc_t1 (pk, c1, c2, c3) VALUES (88,-99,9,35);
UPDATE zc_t1 SET pk = 10, c1 = 20, c2 = 30, c3 = 40 WHERE pk = (SELECT MIN(pk) FROM zc_t1);
UPDATE zc_t1 SET c1 = 92 WHERE MOD(pk, 2) = 0;
DELETE FROM zc_t1 WHERE c1 > 50 AND c1 < 70;
UPDATE zc_t1 SET c2 = c2 + 15;
UPDATE zc_t1 SET c3 = pk, c1 = c2 WHERE pk < c3;
INSERT INTO zc_t1 (pk, c1, c2, c3) VALUES (25, 50, 75, 100);
UPDATE zc_t1 SET pk = 83, c1 = 54, c2 = 39, c3 = 22 WHERE pk = (SELECT MAX(pk) FROM zc_t1);
DELETE FROM zc_t1 WHERE pk BETWEEN 10 AND 20;
select DISTINCT zt1.pk AS c1,zt2.pk as c2,ROUND(ZT1.c1) as f1,LENGTH(ZT2.c1) AS f2,ABS(ZT2.C2) AS f3
from ZC_T1 ZT1,ZC_T1 ZT2
WHERE zt1.pk IS NULL AND zt2.pk IS NOT NULL OR zt1.c1 < 2 AND zt2.c1 = 0 OR zt1.c2 != 1 AND zt2.c2 <> 0 OR zt1.c3 <= 50 AND zt2.c3 >= -50 AND zt2.c1 IN(10,20,30,40,50) OR zt2.c2 NOT IN(10,20,30,40,50) OR zt1.pk BETWEEN -50 AND 50 OR zt2.c1 NOT BETWEEN -50 AND 50 AND zt2.pk LIKE '%5%' OR zt1.c1 NOT LIKE '%5%' OR zt1.pk IS NULL OR zt2.c1 IS NOT NULL ORDER by c1;
+-----+-----+------+------+------+
| c1  | c2  | f1   | f2   | f3   |
+-----+-----+------+------+------+
|   0 |   0 |   92 |    2 | NULL |
|   0 |  25 |   92 |    2 |   75 |
|   0 |  39 |   92 |    3 |   80 |
|   0 |  51 |   92 |    2 |    9 |
|   0 |  68 |   92 |    2 |   60 |
|   0 |  83 |   92 |    2 |   39 |
|   0 |  88 |   92 |    2 |   24 |
|   0 | -13 |   92 |    3 |   32 |
|   0 | -24 |   92 |    2 |   90 |
|  25 |   0 |   50 |    2 | NULL |
|  25 |  25 |   50 |    2 |   75 |
|  25 |  39 |   50 |    3 |   80 |
|  25 |  51 |   50 |    2 |    9 |
|  25 |  68 |   50 |    2 |   60 |
|  25 |  83 |   50 |    2 |   39 |
|  25 |  88 |   50 |    2 |   24 |
|  25 | -13 |   50 |    3 |   32 |
|  25 | -24 |   50 |    2 |   90 |
|  39 |   0 |  -29 |    2 | NULL |
|  39 |  25 |  -29 |    2 |   75 |
|  39 |  39 |  -29 |    3 |   80 |
|  39 |  51 |  -29 |    2 |    9 |
|  39 |  68 |  -29 |    2 |   60 |
|  39 |  83 |  -29 |    2 |   39 |
|  39 |  88 |  -29 |    2 |   24 |
|  39 | -13 |  -29 |    3 |   32 |
|  39 | -24 |  -29 |    2 |   90 |
|  51 |   0 |   27 |    2 | NULL |
|  51 |  25 |   27 |    2 |   75 |
|  51 |  39 |   27 |    3 |   80 |
|  51 |  51 |   27 |    2 |    9 |
|  51 |  68 |   27 |    2 |   60 |
|  51 |  83 |   27 |    2 |   39 |
|  51 |  88 |   27 |    2 |   24 |
|  51 | -13 |   27 |    3 |   32 |
|  51 | -24 |   27 |    2 |   90 |
|  68 |   0 |   92 |    2 | NULL |
|  68 |  25 |   92 |    2 |   75 |
|  68 |  39 |   92 |    3 |   80 |
|  68 |  51 |   92 |    2 |    9 |
|  68 |  68 |   92 |    2 |   60 |
|  68 |  83 |   92 |    2 |   39 |
|  68 |  88 |   92 |    2 |   24 |
|  68 | -13 |   92 |    3 |   32 |
|  68 | -24 |   92 |    2 |   90 |
|  83 |   0 |   54 |    2 | NULL |
|  83 |  25 |   54 |    2 |   75 |
|  83 |  39 |   54 |    3 |   80 |
|  83 |  51 |   54 |    2 |    9 |
|  83 |  68 |   54 |    2 |   60 |
|  83 |  83 |   54 |    2 |   39 |
|  83 |  88 |   54 |    2 |   24 |
|  83 | -13 |   54 |    3 |   32 |
|  83 | -24 |   54 |    2 |   90 |
|  88 |   0 |   92 |    2 | NULL |
|  88 |  25 |   92 |    2 |   75 |
|  88 |  39 |   92 |    3 |   80 |
|  88 |  51 |   92 |    2 |    9 |
|  88 |  68 |   92 |    2 |   60 |
|  88 |  83 |   92 |    2 |   39 |
|  88 |  88 |   92 |    2 |   24 |
|  88 | -13 |   92 |    3 |   32 |
|  88 | -24 |   92 |    2 |   90 |
| -13 |   0 |  -32 |    2 | NULL |
| -13 |  25 |  -32 |    2 |   75 |
| -13 |  39 |  -32 |    3 |   80 |
| -13 |  51 |  -32 |    2 |    9 |
| -13 |  68 |  -32 |    2 |   60 |
| -13 |  83 |  -32 |    2 |   39 |
| -13 |  88 |  -32 |    2 |   24 |
| -13 | -13 |  -32 |    3 |   32 |
| -13 | -24 |  -32 |    2 |   90 |
| -24 |   0 |   90 |    2 | NULL |
| -24 |  25 |   90 |    2 |   75 |
| -24 |  39 |   90 |    3 |   80 |
| -24 |  51 |   90 |    2 |    9 |
| -24 |  68 |   90 |    2 |   60 |
| -24 |  83 |   90 |    2 |   39 |
| -24 |  88 |   90 |    2 |   24 |
| -24 | -13 |   90 |    3 |   32 |
| -24 | -24 |   90 |    2 |   90 |
+-----+-----+------+------+------+
SELECT * FROM ZC_MV1 ORDER by c1;
+------+------+------+------+------+
| c1   | c2   | f1   | f2   | f3   |
+------+------+------+------+------+
|    0 |    0 |   92 |    2 | NULL |
|    0 |   25 |   92 |    2 |   75 |
|    0 |   39 |   92 |    3 |   80 |
|    0 |   51 |   92 |    2 |    9 |
|    0 |   68 |   92 |    2 |   60 |
|    0 |   83 |   92 |    2 |   39 |
|    0 |   88 |   92 |    2 |   24 |
|    0 |  -13 |   92 |    3 |   32 |
|    0 |  -24 |   92 |    2 |   90 |
|   25 |    0 |   50 |    2 | NULL |
|   25 |   25 |   50 |    2 |   75 |
|   25 |   39 |   50 |    3 |   80 |
|   25 |   51 |   50 |    2 |    9 |
|   25 |   68 |   50 |    2 |   60 |
|   25 |   83 |   50 |    2 |   39 |
|   25 |   88 |   50 |    2 |   24 |
|   25 |  -13 |   50 |    3 |   32 |
|   25 |  -24 |   50 |    2 |   90 |
|   39 |    0 |  -29 |    2 | NULL |
|   39 |   25 |  -29 |    2 |   75 |
|   39 |   39 |  -29 |    3 |   80 |
|   39 |   51 |  -29 |    2 |    9 |
|   39 |   68 |  -29 |    2 |   60 |
|   39 |   83 |  -29 |    2 |   39 |
|   39 |   88 |  -29 |    2 |   24 |
|   39 |  -13 |  -29 |    3 |   32 |
|   39 |  -24 |  -29 |    2 |   90 |
|   51 |    0 |   27 |    2 | NULL |
|   51 |   25 |   27 |    2 |   75 |
|   51 |   39 |   27 |    3 |   80 |
|   51 |   51 |   27 |    2 |    9 |
|   51 |   68 |   27 |    2 |   60 |
|   51 |   83 |   27 |    2 |   39 |
|   51 |   88 |   27 |    2 |   24 |
|   51 |  -13 |   27 |    3 |   32 |
|   51 |  -24 |   27 |    2 |   90 |
|   68 |    0 |   92 |    2 | NULL |
|   68 |   25 |   92 |    2 |   75 |
|   68 |   39 |   92 |    3 |   80 |
|   68 |   51 |   92 |    2 |    9 |
|   68 |   68 |   92 |    2 |   60 |
|   68 |   83 |   92 |    2 |   39 |
|   68 |   88 |   92 |    2 |   24 |
|   68 |  -13 |   92 |    3 |   32 |
|   68 |  -24 |   92 |    2 |   90 |
|   83 |    0 |   54 |    2 | NULL |
|   83 |   25 |   54 |    2 |   75 |
|   83 |   39 |   54 |    3 |   80 |
|   83 |   51 |   54 |    2 |    9 |
|   83 |   68 |   54 |    2 |   60 |
|   83 |   83 |   54 |    2 |   39 |
|   83 |   88 |   54 |    2 |   24 |
|   83 |  -13 |   54 |    3 |   32 |
|   83 |  -24 |   54 |    2 |   90 |
|   88 |    0 |   92 |    2 | NULL |
|   88 |   25 |   92 |    2 |   75 |
|   88 |   39 |   92 |    3 |   80 |
|   88 |   51 |   92 |    2 |    9 |
|   88 |   68 |   92 |    2 |   60 |
|   88 |   83 |   92 |    2 |   39 |
|   88 |   88 |   92 |    2 |   24 |
|   88 |  -13 |   92 |    3 |   32 |
|   88 |  -24 |   92 |    2 |   90 |
|  -13 |    0 |  -32 |    2 | NULL |
|  -13 |   25 |  -32 |    2 |   75 |
|  -13 |   39 |  -32 |    3 |   80 |
|  -13 |   51 |  -32 |    2 |    9 |
|  -13 |   68 |  -32 |    2 |   60 |
|  -13 |   83 |  -32 |    2 |   39 |
|  -13 |   88 |  -32 |    2 |   24 |
|  -13 |  -13 |  -32 |    3 |   32 |
|  -13 |  -24 |  -32 |    2 |   90 |
|  -24 |    0 |   90 |    2 | NULL |
|  -24 |   25 |   90 |    2 |   75 |
|  -24 |   39 |   90 |    3 |   80 |
|  -24 |   51 |   90 |    2 |    9 |
|  -24 |   68 |   90 |    2 |   60 |
|  -24 |   83 |   90 |    2 |   39 |
|  -24 |   88 |   90 |    2 |   24 |
|  -24 |  -13 |   90 |    3 |   32 |
|  -24 |  -24 |   90 |    2 |   90 |
+------+------+------+------+------+
SELECT /*+fresh_mv*/* FROM ZC_MV1;
+------+------+------+------+------+
| c1   | c2   | f1   | f2   | f3   |
+------+------+------+------+------+
|    0 |    0 |   92 |    2 | NULL |
|    0 |   25 |   92 |    2 |   75 |
|    0 |   39 |   92 |    3 |   80 |
|    0 |   51 |   92 |    2 |    9 |
|    0 |   68 |   92 |    2 |   60 |
|    0 |   83 |   92 |    2 |   39 |
|    0 |   88 |   92 |    2 |   24 |
|    0 |  -13 |   92 |    3 |   32 |
|    0 |  -24 |   92 |    2 |   90 |
|   25 |    0 |   50 |    2 | NULL |
|   25 |   25 |   50 |    2 |   75 |
|   25 |   39 |   50 |    3 |   80 |
|   25 |   51 |   50 |    2 |    9 |
|   25 |   68 |   50 |    2 |   60 |
|   25 |   83 |   50 |    2 |   39 |
|   25 |   88 |   50 |    2 |   24 |
|   25 |  -13 |   50 |    3 |   32 |
|   25 |  -24 |   50 |    2 |   90 |
|   39 |    0 |  -29 |    2 | NULL |
|   39 |   25 |  -29 |    2 |   75 |
|   39 |   39 |  -29 |    3 |   80 |
|   39 |   51 |  -29 |    2 |    9 |
|   39 |   68 |  -29 |    2 |   60 |
|   39 |   83 |  -29 |    2 |   39 |
|   39 |   88 |  -29 |    2 |   24 |
|   39 |  -13 |  -29 |    3 |   32 |
|   39 |  -24 |  -29 |    2 |   90 |
|   51 |    0 |   27 |    2 | NULL |
|   51 |   25 |   27 |    2 |   75 |
|   51 |   39 |   27 |    3 |   80 |
|   51 |   51 |   27 |    2 |    9 |
|   51 |   68 |   27 |    2 |   60 |
|   51 |   83 |   27 |    2 |   39 |
|   51 |   88 |   27 |    2 |   24 |
|   51 |  -13 |   27 |    3 |   32 |
|   51 |  -24 |   27 |    2 |   90 |
|   68 |    0 |   92 |    2 | NULL |
|   68 |   25 |   92 |    2 |   75 |
|   68 |   39 |   92 |    3 |   80 |
|   68 |   51 |   92 |    2 |    9 |
|   68 |   68 |   92 |    2 |   60 |
|   68 |   83 |   92 |    2 |   39 |
|   68 |   88 |   92 |    2 |   24 |
|   68 |  -13 |   92 |    3 |   32 |
|   68 |  -24 |   92 |    2 |   90 |
|   83 |    0 |   54 |    2 | NULL |
|   83 |   25 |   54 |    2 |   75 |
|   83 |   39 |   54 |    3 |   80 |
|   83 |   51 |   54 |    2 |    9 |
|   83 |   68 |   54 |    2 |   60 |
|   83 |   83 |   54 |    2 |   39 |
|   83 |   88 |   54 |    2 |   24 |
|   83 |  -13 |   54 |    3 |   32 |
|   83 |  -24 |   54 |    2 |   90 |
|   88 |    0 |   92 |    2 | NULL |
|   88 |   25 |   92 |    2 |   75 |
|   88 |   39 |   92 |    3 |   80 |
|   88 |   51 |   92 |    2 |    9 |
|   88 |   68 |   92 |    2 |   60 |
|   88 |   83 |   92 |    2 |   39 |
|   88 |   88 |   92 |    2 |   24 |
|   88 |  -13 |   92 |    3 |   32 |
|   88 |  -24 |   92 |    2 |   90 |
|  -13 |    0 |  -32 |    2 | NULL |
|  -13 |   25 |  -32 |    2 |   75 |
|  -13 |   39 |  -32 |    3 |   80 |
|  -13 |   51 |  -32 |    2 |    9 |
|  -13 |   68 |  -32 |    2 |   60 |
|  -13 |   83 |  -32 |    2 |   39 |
|  -13 |   88 |  -32 |    2 |   24 |
|  -13 |  -13 |  -32 |    3 |   32 |
|  -13 |  -24 |  -32 |    2 |   90 |
|  -24 |    0 |   90 |    2 | NULL |
|  -24 |   25 |   90 |    2 |   75 |
|  -24 |   39 |   90 |    3 |   80 |
|  -24 |   51 |   90 |    2 |    9 |
|  -24 |   68 |   90 |    2 |   60 |
|  -24 |   83 |   90 |    2 |   39 |
|  -24 |   88 |   90 |    2 |   24 |
|  -24 |  -13 |   90 |    3 |   32 |
|  -24 |  -24 |   90 |    2 |   90 |
+------+------+------+------+------+
####无法创建的mjv场景####
##其他join##
DELETE from ZC_t1;
DROP materialized view ZC_MV1;
create materialized view ZC_MV1 REFRESH FAST ON DEMAND enable on query computation AS
select zt1.pk AS c1,zt2.pk as c2
from ZC_T1 ZT1 left join ZC_T1 ZT2 ON zt1.pk = zt2.pk;
Got one of the listed errors
create materialized view ZC_MV1 REFRESH FAST ON DEMAND enable on query computation AS
select zt1.pk AS c1,zt2.pk as c2
from ZC_T1 ZT1 right join ZC_T1 ZT2 ON zt1.pk = zt2.pk;
Got one of the listed errors
create materialized view ZC_MV1 REFRESH FAST ON DEMAND enable on query computation AS
select zt1.pk AS c1,zt2.pk as c2
from ZC_T1 ZT1 FULL join ZC_T1 ZT2 ON zt1.pk = zt2.pk;
Got one of the listed errors
##基表无主键##
create materialized view ZC_MV1 REFRESH FAST ON DEMAND enable on query computation AS
select zt1.pk AS c1,zt2.pk as c2
from ZC_T1 ZT1 inner join ZC_T2 ZT2 ON zt1.pk = zt2.pk;
Got one of the listed errors
create materialized view ZC_MV1 REFRESH FAST ON DEMAND enable on query computation AS
select zt1.pk AS c1,zt2.pk as c2
from ZC_T1 ZT1 inner join ZC_T3 ZT2 ON zt1.pk = zt2.pk;
Got one of the listed errors
##主键不在select item中##
CREATE TABLE ZC_T5(pk int PRIMARY KEY, c1 VARCHAR(10));
CREATE MATERIALIZED VIEW LOG ON ZC_T5 parallel 2 WITH ROWID,SEQUENCE(c1) INCLUDING NEW VALUES;
create materialized view ZC_MV1 REFRESH FAST ON DEMAND enable on query computation AS
select zt1.pk AS c1,zt2.c1 as c2
from ZC_T1 ZT1 inner join ZC_T5 ZT2 ON zt1.pk = zt2.pk;
Got one of the listed errors
DELETE from ZC_t1;
create materialized view ZC_MV1 REFRESH FAST ON DEMAND enable on query computation AS
select zt1.pk AS c1,zt2.pk as c2,zt2.c1 as c3,zt1.c1 as c4
from ZC_T1 ZT1 inner join ZC_T5 ZT2 ON zt1.pk = zt2.pk;
INSERT INTO zc_t1 (pk, c1, c2, c3) VALUES (0,NULL,NULL,NULL);
INSERT INTO zc_t1 (pk, c1, c2, c3) VALUES (68,-52,45,-86);
INSERT INTO zc_t1 (pk, c1, c2, c3) VALUES (51,27,-6,-8);
INSERT INTO zc_t1 (pk, c1, c2, c3) VALUES (-13,47,-47,26);
INSERT INTO zc_t1 (pk, c1, c2, c3) VALUES (-24,82,75,-10);
INSERT INTO zc_t1 (pk, c1, c2, c3) VALUES (-67,-86,72,62);
INSERT INTO zc_t1 (pk, c1, c2, c3) VALUES (18,41,-77,-12);
INSERT INTO zc_t1 (pk, c1, c2, c3) VALUES (14,-15,-53,65);
INSERT INTO zc_t1 (pk, c1, c2, c3) VALUES (39,-29,65,-62);
INSERT INTO zc_t1 (pk, c1, c2, c3) VALUES (89,18,93,-75);
INSERT INTO zc_t1 (pk, c1, c2, c3) VALUES (88,-99,9,35);
UPDATE zc_t1 SET pk = 10, c1 = 20, c2 = 30, c3 = 40 WHERE pk = (SELECT MIN(pk) FROM zc_t1);
UPDATE zc_t1 SET c1 = 92 WHERE MOD(pk, 2) = 0;
DELETE FROM zc_t1 WHERE c1 > 50 AND c1 < 70;
UPDATE zc_t1 SET c2 = c2 + 15;
UPDATE zc_t1 SET c3 = pk, c1 = c2 WHERE pk < c3;
INSERT INTO zc_t1 (pk, c1, c2, c3) VALUES (25, 50, 75, 100);
UPDATE zc_t1 SET pk = 83, c1 = 54, c2 = 39, c3 = 22 WHERE pk = (SELECT MAX(pk) FROM zc_t1);
DELETE FROM zc_t1 WHERE pk BETWEEN 10 AND 20;
INSERT INTO ZC_T5 VALUES(0,NULL);
INSERT INTO ZC_T5 VALUES(1,'a');
INSERT INTO ZC_T5 VALUES(25,'b');
select zt1.pk AS c1,zt2.pk as c2,zt2.c1 as c3,zt1.c1 as c4
from ZC_T1 ZT1 inner join ZC_T5 ZT2 ON zt1.pk = zt2.pk ORDER by c1;
+----+----+------+------+
| c1 | c2 | c3   | c4   |
+----+----+------+------+
|  0 |  0 | NULL |   92 |
| 25 | 25 | b    |   50 |
+----+----+------+------+
SELECT * FROM ZC_MV1 ORDER by c1;
+------+------+------+------+
| c1   | c2   | c3   | c4   |
+------+------+------+------+
|    0 |    0 | NULL |   92 |
|   25 |   25 | b    |   50 |
+------+------+------+------+
SELECT /*+fresh_mv*/* FROM ZC_MV1;
+------+------+------+------+
| c1   | c2   | c3   | c4   |
+------+------+------+------+
|    0 |    0 | NULL |   92 |
|   25 |   25 | b    |   50 |
+------+------+------+------+
DROP MATERIALIZED VIEW LOG ON ZC_T8;
DROP MATERIALIZED VIEW LOG ON ZC_T6;
DROP MATERIALIZED VIEW LOG ON ZC_T5;
DROP MATERIALIZED VIEW LOG ON ZC_T4;
DROP MATERIALIZED VIEW LOG ON ZC_T3;
DROP MATERIALIZED VIEW LOG ON ZC_T2;
DROP MATERIALIZED VIEW LOG ON ZC_T1;
DROP TABLE ZC_T8;
DROP TABLE ZC_T6;
DROP TABLE ZC_T5;
DROP TABLE ZC_T4;
DROP TABLE ZC_T3;
DROP TABLE ZC_T2;
DROP TABLE ZC_T1;
DROP materialized view ZC_MV1;
DROP materialized view ZC_MV2;
DROP materialized view ZC_MV3;
DROP materialized view ZC_MV4;
DROP materialized view ZC_MV6;
DROP materialized view ZC_MV7;
DROP materialized view ZC_MV8;
DROP materialized view ZC_MV9;
