result_format: 4
PURGE RECYCLEBIN;
DROP MATERIALIZED VIEW LOG ON ZC_T1;
DROP TABLE ZC_T1;
DROP TABLE ZC_T2;
CREATE TABLE ZC_T1(pk int primary key, c1 int, c2 int, c3 int);
CREATE TABLE ZC_T2(c1 int, c2 int, c3 int);
CREATE MATERIALIZED VIEW LOG ON ZC_T1 parallel 2 WITH PRIMARY KEY,ROWID,SEQUENCE(c1,c2,c3) INCLUDING NEW VALUES;
create materialized view ZC_MV1 REFRESH FAST ON DEMAND enable on query computation AS
select ZT1.c1 as t1_c1,count(*) as cnt
from ZC_T1 ZT1
group by ZT1.c1;
INSERT INTO ZC_T1 VALUES(1,1,1,1);
SELECT * FROM ZC_T1;
+----+------+------+------+
| pk | c1   | c2   | c3   |
+----+------+------+------+
|  1 |    1 |    1 |    1 |
+----+------+------+------+
SELECT * FROM ZC_MV1;
+-------+------+
| t1_c1 | cnt  |
+-------+------+
|     1 |    1 |
+-------+------+
SELECT /*+fresh_mv*/* FROM ZC_MV1;
+-------+------+
| t1_c1 | cnt  |
+-------+------+
|     1 |    1 |
+-------+------+
####创建不同刷新模式的实时物化####
##COMPLETE##
create materialized view ZC_MV2 REFRESH COMPLETE ON DEMAND enable on query computation AS
select ZT1.c1 as t1_c1,count(*) as cnt
from ZC_T1 ZT1
group by ZT1.c1;
INSERT INTO ZC_T1 VALUES(2,2,2,2);
SELECT * FROM ZC_T1;
+----+------+------+------+
| pk | c1   | c2   | c3   |
+----+------+------+------+
|  1 |    1 |    1 |    1 |
|  2 |    2 |    2 |    2 |
+----+------+------+------+
SELECT * FROM ZC_MV2;
+-------+------+
| t1_c1 | cnt  |
+-------+------+
|     1 |    1 |
|     2 |    1 |
+-------+------+
SELECT /*+fresh_mv*/* FROM ZC_MV2;
+-------+------+
| t1_c1 | cnt  |
+-------+------+
|     1 |    1 |
|     2 |    1 |
+-------+------+
##FORCE##
create materialized view ZC_MV3 REFRESH FORCE ON DEMAND enable on query computation AS
select ZT1.c1 as t1_c1,count(*) as cnt
from ZC_T1 ZT1
group by ZT1.c1;
INSERT INTO ZC_T1 VALUES(3,3,3,3);
SELECT * FROM ZC_T1;
+----+------+------+------+
| pk | c1   | c2   | c3   |
+----+------+------+------+
|  1 |    1 |    1 |    1 |
|  2 |    2 |    2 |    2 |
|  3 |    3 |    3 |    3 |
+----+------+------+------+
SELECT * FROM ZC_MV3;
+-------+------+
| t1_c1 | cnt  |
+-------+------+
|     1 |    1 |
|     2 |    1 |
|     3 |    1 |
+-------+------+
SELECT /*+fresh_mv*/* FROM ZC_MV3;
+-------+------+
| t1_c1 | cnt  |
+-------+------+
|     1 |    1 |
|     2 |    1 |
|     3 |    1 |
+-------+------+
##NEVER REFRESH##
create materialized view ZC_MV4 NEVER REFRESH enable on query computation AS
select ZT1.c1 as t1_c1,count(*) as cnt
from ZC_T1 ZT1
group by ZT1.c1;
INSERT INTO ZC_T1 VALUES(4,4,4,4);
SELECT * FROM ZC_T1;
+----+------+------+------+
| pk | c1   | c2   | c3   |
+----+------+------+------+
|  1 |    1 |    1 |    1 |
|  2 |    2 |    2 |    2 |
|  3 |    3 |    3 |    3 |
|  4 |    4 |    4 |    4 |
+----+------+------+------+
SELECT * FROM ZC_MV4;
+-------+------+
| t1_c1 | cnt  |
+-------+------+
|     1 |    1 |
|     2 |    1 |
|     3 |    1 |
|     4 |    1 |
+-------+------+
SELECT /*+fresh_mv*/* FROM ZC_MV4;
+-------+------+
| t1_c1 | cnt  |
+-------+------+
|     1 |    1 |
|     2 |    1 |
|     3 |    1 |
|     4 |    1 |
+-------+------+
##指定时间##
create materialized view ZC_MV5 REFRESH FAST NEXT NOW() + INTERVAL 1 DAY enable on query computation AS
select ZT1.c1 as t1_c1,count(*) as cnt
from ZC_T1 ZT1
group by ZT1.c1;
INSERT INTO ZC_T1 VALUES(5,5,5,5);
SELECT * FROM ZC_T1;
+----+------+------+------+
| pk | c1   | c2   | c3   |
+----+------+------+------+
|  1 |    1 |    1 |    1 |
|  2 |    2 |    2 |    2 |
|  3 |    3 |    3 |    3 |
|  4 |    4 |    4 |    4 |
|  5 |    5 |    5 |    5 |
+----+------+------+------+
SELECT * FROM ZC_MV5;
+-------+------+
| t1_c1 | cnt  |
+-------+------+
|     1 |    1 |
|     2 |    1 |
|     3 |    1 |
|     4 |    1 |
|     5 |    1 |
+-------+------+
SELECT /*+fresh_mv*/* FROM ZC_MV5;
+-------+------+
| t1_c1 | cnt  |
+-------+------+
|     1 |    1 |
|     2 |    1 |
|     3 |    1 |
|     4 |    1 |
|     5 |    1 |
+-------+------+
#######
DELETE FROM ZC_T1;
SELECT * FROM ZC_T1;
+----+------+------+------+
| pk | c1   | c2   | c3   |
+----+------+------+------+
+----+------+------+------+
SELECT /*+fresh_mv*/* FROM ZC_MV1;
+-------+------+
| t1_c1 | cnt  |
+-------+------+
+-------+------+
SELECT /*+fresh_mv*/* FROM ZC_MV2;
+-------+------+
| t1_c1 | cnt  |
+-------+------+
+-------+------+
SELECT /*+fresh_mv*/* FROM ZC_MV3;
+-------+------+
| t1_c1 | cnt  |
+-------+------+
+-------+------+
SELECT /*+fresh_mv*/* FROM ZC_MV4;
+-------+------+
| t1_c1 | cnt  |
+-------+------+
+-------+------+
SELECT /*+fresh_mv*/* FROM ZC_MV5;
+-------+------+
| t1_c1 | cnt  |
+-------+------+
+-------+------+
DROP materialized view ZC_MV2;
DROP materialized view ZC_MV3;
DROP materialized view ZC_MV4;
DROP materialized view ZC_MV5;
####修改rtmv属性####(目前不支持)
create materialized view ZC_MV2 REFRESH FAST ON DEMAND AS
select ZT1.c1 as t1_c1,count(*) as cnt
from ZC_T1 ZT1
group by ZT1.c1;
DROP materialized view ZC_MV2;
####根据不同的mlog创建rtmv####
##WITH SEQUENCE##
DROP MATERIALIZED VIEW LOG ON ZC_T1;
CREATE MATERIALIZED VIEW LOG ON ZC_T1 parallel 2 WITH SEQUENCE(c1,c2,c3) INCLUDING NEW VALUES;
DESC mlog$_zc_t1;
+------------+------------+------+-----+---------+-------+
| Field      | Type       | Null | Key | Default | Extra |
+------------+------------+------+-----+---------+-------+
| DMLTYPE$$  | varchar(1) | YES  |     | NULL    |       |
| OLD_NEW$$  | varchar(1) | YES  |     | NULL    |       |
| SEQUENCE$$ | bigint(20) | NO   | PRI | NULL    |       |
| c1         | int(11)    | YES  |     | NULL    |       |
| c2         | int(11)    | YES  |     | NULL    |       |
| c3         | int(11)    | YES  |     | NULL    |       |
| pk         | int(11)    | NO   | PRI | NULL    |       |
+------------+------------+------+-----+---------+-------+
INSERT INTO ZC_T1 VALUES(1,1,1,1);
SELECT * FROM ZC_T1;
+----+------+------+------+
| pk | c1   | c2   | c3   |
+----+------+------+------+
|  1 |    1 |    1 |    1 |
+----+------+------+------+
SELECT /*+fresh_mv*/* FROM ZC_MV1;
ERROR HY000: Incorrect arguments to mlog query begin version which is more than tablet create commit version, materialized view need complete fresh
DROP materialized view ZC_MV1;
##oracle这里无法创建mv
create materialized view ZC_MV2 REFRESH COMPLETE ON DEMAND enable on query computation AS
select ZT1.c1 as t1_c1,count(*) as cnt
from ZC_T1 ZT1
group by ZT1.c1;
INSERT INTO ZC_T1 VALUES(2,2,2,2);
SELECT * FROM ZC_T1;
+----+------+------+------+
| pk | c1   | c2   | c3   |
+----+------+------+------+
|  1 |    1 |    1 |    1 |
|  2 |    2 |    2 |    2 |
+----+------+------+------+
SELECT /*+fresh_mv*/* FROM ZC_MV2;
+-------+------+
| t1_c1 | cnt  |
+-------+------+
|     1 |    1 |
|     2 |    1 |
+-------+------+
DROP materialized view ZC_MV2;
##WITH ROWID##
DROP MATERIALIZED VIEW LOG ON ZC_T1;
CREATE MATERIALIZED VIEW LOG ON ZC_T1 parallel 2 WITH ROWID,SEQUENCE(c1,c2) INCLUDING NEW VALUES;
create materialized view ZC_MV1 REFRESH FAST ON DEMAND enable on query computation AS
select ZT1.c1 as t1_c1,count(*) as cnt
from ZC_T1 ZT1
group by ZT1.c1;
INSERT INTO ZC_T1 VALUES(3,3,3,3);
SELECT * FROM ZC_T1;
+----+------+------+------+
| pk | c1   | c2   | c3   |
+----+------+------+------+
|  1 |    1 |    1 |    1 |
|  2 |    2 |    2 |    2 |
|  3 |    3 |    3 |    3 |
+----+------+------+------+
SELECT /*+fresh_mv*/* FROM ZC_MV1;
+-------+------+
| t1_c1 | cnt  |
+-------+------+
|     1 |    1 |
|     2 |    1 |
|     3 |    1 |
+-------+------+
DROP materialized view ZC_MV1;
##WITH PRIMARY KEY##
DROP MATERIALIZED VIEW LOG ON ZC_T1;
CREATE MATERIALIZED VIEW LOG ON ZC_T1 parallel 2 WITH PRIMARY KEY,SEQUENCE(c1) INCLUDING NEW VALUES;
##oracle这里无法创建mv
create materialized view ZC_MV1 REFRESH FAST ON DEMAND enable on query computation AS
select ZT1.c1 as t1_c1,count(*) as cnt
from ZC_T1 ZT1
group by ZT1.c1;
INSERT INTO ZC_T1 VALUES(4,4,4,4);
SELECT * FROM ZC_T1;
+----+------+------+------+
| pk | c1   | c2   | c3   |
+----+------+------+------+
|  1 |    1 |    1 |    1 |
|  2 |    2 |    2 |    2 |
|  3 |    3 |    3 |    3 |
|  4 |    4 |    4 |    4 |
+----+------+------+------+
SELECT /*+fresh_mv*/* FROM ZC_MV1;
+-------+------+
| t1_c1 | cnt  |
+-------+------+
|     1 |    1 |
|     2 |    1 |
|     3 |    1 |
|     4 |    1 |
+-------+------+
DROP materialized view ZC_MV1;
##无mlog创建rtmv预期报错##
DROP MATERIALIZED VIEW LOG ON ZC_T1;
create materialized view ZC_MV1 REFRESH FAST ON DEMAND enable on query computation AS
select ZT1.c1 as t1_c1,count(*) as cnt
from ZC_T1 ZT1
group by ZT1.c1;
Got one of the listed errors
##创建含有不确定结果的rtmv预期报错##
CREATE MATERIALIZED VIEW LOG ON ZC_T1 parallel 2 WITH PRIMARY KEY,ROWID,SEQUENCE(c1,c2,c3) INCLUDING NEW VALUES;
create materialized view ZC_MV1 REFRESH FAST ON DEMAND enable on query computation AS
select ZT1.c1 as t1_c1,count(*) as cnt,random() as t1_c2
from ZC_T1 ZT1
group by ZT1.c1;
Got one of the listed errors
####clean####
DROP MATERIALIZED VIEW LOG ON ZC_T1;
DROP TABLE ZC_T1;
DROP TABLE ZC_T2;
