set session ob_query_timeout=1000000000;
drop materialized view basic_mv_1;
drop table if exists t1,t2;
create table t1(c1 int primary key, c2 int, c3 varchar(64)) partition by hash(c1) partitions 8;
create table t2(c1 int primary key, c2 int) duplicate_scope = 'cluster' duplicate_read_consistency = 'weak';
CREATE MATERIALIZED VIEW basic_mv_1 (
PRIMARY KEY (c1)
) partition by hash(c1) partitions 8
refresh fast enable query rewrite enable on query computation
AS
SELECT 
a.c1 AS c1,
b.c1 AS b_c1,
a.c2 AS a_c2,
b.c2 AS b_c2,
a.c3 AS a_c3
FROM 
t1 a join t2 b on a.c1 = b.c1;
select * from basic_mv_1;
c1	b_c1	a_c2	b_c2	a_c3
insert into t1 values(1,1,repeat('a',64));
select * from basic_mv_1;
c1	b_c1	a_c2	b_c2	a_c3
insert into t2 values(0,0);
select * from basic_mv_1;
c1	b_c1	a_c2	b_c2	a_c3
insert into t2 values(1,1);
select * from basic_mv_1;
c1	b_c1	a_c2	b_c2	a_c3
1	1	1	1	aaaaaaaaaaaaaaaaaaaaaaaaaaaaaaaaaaaaaaaaaaaaaaaaaaaaaaaaaaaaaaaa
insert into t2 values(2,2);
insert into t1 values(2,2,repeat('b',64));
select * from basic_mv_1;
c1	b_c1	a_c2	b_c2	a_c3
1	1	1	1	aaaaaaaaaaaaaaaaaaaaaaaaaaaaaaaaaaaaaaaaaaaaaaaaaaaaaaaaaaaaaaaa
2	2	2	2	bbbbbbbbbbbbbbbbbbbbbbbbbbbbbbbbbbbbbbbbbbbbbbbbbbbbbbbbbbbbbbbb
update t1 set c2 = 11,c3 = repeat('ab',32) where c1 = 1;
select * from basic_mv_1;
c1	b_c1	a_c2	b_c2	a_c3
1	1	11	1	abababababababababababababababababababababababababababababababab
2	2	2	2	bbbbbbbbbbbbbbbbbbbbbbbbbbbbbbbbbbbbbbbbbbbbbbbbbbbbbbbbbbbbbbbb
update t1 set c2 = 111,c3 = repeat('abc',20) where c1 = 1;
select * from basic_mv_1;
c1	b_c1	a_c2	b_c2	a_c3
1	1	111	1	abcabcabcabcabcabcabcabcabcabcabcabcabcabcabcabcabcabcabcabc
2	2	2	2	bbbbbbbbbbbbbbbbbbbbbbbbbbbbbbbbbbbbbbbbbbbbbbbbbbbbbbbbbbbbbbbb
insert into t1 values(3,3,repeat('c',64)),(4,4,repeat('d',64)),(5,5,repeat('e',64));
insert into t2 values(3,3),(4,4),(5,5),(6,6);
select * from basic_mv_1;
c1	b_c1	a_c2	b_c2	a_c3
1	1	111	1	abcabcabcabcabcabcabcabcabcabcabcabcabcabcabcabcabcabcabcabc
2	2	2	2	bbbbbbbbbbbbbbbbbbbbbbbbbbbbbbbbbbbbbbbbbbbbbbbbbbbbbbbbbbbbbbbb
3	3	3	3	cccccccccccccccccccccccccccccccccccccccccccccccccccccccccccccccc
4	4	4	4	dddddddddddddddddddddddddddddddddddddddddddddddddddddddddddddddd
5	5	5	5	eeeeeeeeeeeeeeeeeeeeeeeeeeeeeeeeeeeeeeeeeeeeeeeeeeeeeeeeeeeeeeee
update t1 set c2 = 444,c3 = repeat('abcd',10) where c1 = 4;
update t2 set c2 = 44 where c1 = 4;
select * from basic_mv_1;
c1	b_c1	a_c2	b_c2	a_c3
1	1	111	1	abcabcabcabcabcabcabcabcabcabcabcabcabcabcabcabcabcabcabcabc
2	2	2	2	bbbbbbbbbbbbbbbbbbbbbbbbbbbbbbbbbbbbbbbbbbbbbbbbbbbbbbbbbbbbbbbb
3	3	3	3	cccccccccccccccccccccccccccccccccccccccccccccccccccccccccccccccc
4	4	444	44	abcdabcdabcdabcdabcdabcdabcdabcdabcdabcd
5	5	5	5	eeeeeeeeeeeeeeeeeeeeeeeeeeeeeeeeeeeeeeeeeeeeeeeeeeeeeeeeeeeeeeee
delete from t1 where c1 = 1;
select * from basic_mv_1;
c1	b_c1	a_c2	b_c2	a_c3
2	2	2	2	bbbbbbbbbbbbbbbbbbbbbbbbbbbbbbbbbbbbbbbbbbbbbbbbbbbbbbbbbbbbbbbb
3	3	3	3	cccccccccccccccccccccccccccccccccccccccccccccccccccccccccccccccc
4	4	444	44	abcdabcdabcdabcdabcdabcdabcdabcdabcdabcd
5	5	5	5	eeeeeeeeeeeeeeeeeeeeeeeeeeeeeeeeeeeeeeeeeeeeeeeeeeeeeeeeeeeeeeee
select * from basic_mv_1 where c1 in (1,2,3,4,5,6);
c1	b_c1	a_c2	b_c2	a_c3
2	2	2	2	bbbbbbbbbbbbbbbbbbbbbbbbbbbbbbbbbbbbbbbbbbbbbbbbbbbbbbbbbbbbbbbb
3	3	3	3	cccccccccccccccccccccccccccccccccccccccccccccccccccccccccccccccc
4	4	444	44	abcdabcdabcdabcdabcdabcdabcdabcdabcdabcd
5	5	5	5	eeeeeeeeeeeeeeeeeeeeeeeeeeeeeeeeeeeeeeeeeeeeeeeeeeeeeeeeeeeeeeee
delete from t2 where c2 = 2;
insert into t2 values(22,2);
select * from basic_mv_1;
c1	b_c1	a_c2	b_c2	a_c3
3	3	3	3	cccccccccccccccccccccccccccccccccccccccccccccccccccccccccccccccc
4	4	444	44	abcdabcdabcdabcdabcdabcdabcdabcdabcdabcd
5	5	5	5	eeeeeeeeeeeeeeeeeeeeeeeeeeeeeeeeeeeeeeeeeeeeeeeeeeeeeeeeeeeeeeee
alter system minor freeze;
select * from basic_mv_1;
c1	b_c1	a_c2	b_c2	a_c3
3	3	3	3	cccccccccccccccccccccccccccccccccccccccccccccccccccccccccccccccc
4	4	444	44	abcdabcdabcdabcdabcdabcdabcdabcdabcdabcd
5	5	5	5	eeeeeeeeeeeeeeeeeeeeeeeeeeeeeeeeeeeeeeeeeeeeeeeeeeeeeeeeeeeeeeee
insert into t1 values(1,1,repeat('a',64));
select * from basic_mv_1;
c1	b_c1	a_c2	b_c2	a_c3
1	1	1	1	aaaaaaaaaaaaaaaaaaaaaaaaaaaaaaaaaaaaaaaaaaaaaaaaaaaaaaaaaaaaaaaa
3	3	3	3	cccccccccccccccccccccccccccccccccccccccccccccccccccccccccccccccc
4	4	444	44	abcdabcdabcdabcdabcdabcdabcdabcdabcdabcd
5	5	5	5	eeeeeeeeeeeeeeeeeeeeeeeeeeeeeeeeeeeeeeeeeeeeeeeeeeeeeeeeeeeeeeee
select * from basic_mv_1 where c1 in (1,2,3,4,5,6);
c1	b_c1	a_c2	b_c2	a_c3
1	1	1	1	aaaaaaaaaaaaaaaaaaaaaaaaaaaaaaaaaaaaaaaaaaaaaaaaaaaaaaaaaaaaaaaa
3	3	3	3	cccccccccccccccccccccccccccccccccccccccccccccccccccccccccccccccc
4	4	444	44	abcdabcdabcdabcdabcdabcdabcdabcdabcdabcd
5	5	5	5	eeeeeeeeeeeeeeeeeeeeeeeeeeeeeeeeeeeeeeeeeeeeeeeeeeeeeeeeeeeeeeee
delete from t1 where c1 = 1;
insert into t1 values(33,33,repeat('c',64));
update t2 set c2 = 33 where c1 = 3;
select * from basic_mv_1;
c1	b_c1	a_c2	b_c2	a_c3
3	3	3	33	cccccccccccccccccccccccccccccccccccccccccccccccccccccccccccccccc
4	4	444	44	abcdabcdabcdabcdabcdabcdabcdabcdabcdabcd
5	5	5	5	eeeeeeeeeeeeeeeeeeeeeeeeeeeeeeeeeeeeeeeeeeeeeeeeeeeeeeeeeeeeeeee
alter system major freeze;
wait last refresh scn refresh failed
select * from basic_mv_1;
c1	b_c1	a_c2	b_c2	a_c3
3	3	3	33	cccccccccccccccccccccccccccccccccccccccccccccccccccccccccccccccc
4	4	444	44	abcdabcdabcdabcdabcdabcdabcdabcdabcdabcd
5	5	5	5	eeeeeeeeeeeeeeeeeeeeeeeeeeeeeeeeeeeeeeeeeeeeeeeeeeeeeeeeeeeeeeee
insert into t1 values(11,11,repeat('a',64)),(12,12,repeat('b',64));
insert into t2 values(11,11),(12,12),(13,13);
select * from basic_mv_1;
c1	b_c1	a_c2	b_c2	a_c3
11	11	11	11	aaaaaaaaaaaaaaaaaaaaaaaaaaaaaaaaaaaaaaaaaaaaaaaaaaaaaaaaaaaaaaaa
12	12	12	12	bbbbbbbbbbbbbbbbbbbbbbbbbbbbbbbbbbbbbbbbbbbbbbbbbbbbbbbbbbbbbbbb
3	3	3	33	cccccccccccccccccccccccccccccccccccccccccccccccccccccccccccccccc
4	4	444	44	abcdabcdabcdabcdabcdabcdabcdabcdabcdabcd
5	5	5	5	eeeeeeeeeeeeeeeeeeeeeeeeeeeeeeeeeeeeeeeeeeeeeeeeeeeeeeeeeeeeeeee
delete from t1 where c1 in (2,5);
select * from basic_mv_1;
c1	b_c1	a_c2	b_c2	a_c3
11	11	11	11	aaaaaaaaaaaaaaaaaaaaaaaaaaaaaaaaaaaaaaaaaaaaaaaaaaaaaaaaaaaaaaaa
12	12	12	12	bbbbbbbbbbbbbbbbbbbbbbbbbbbbbbbbbbbbbbbbbbbbbbbbbbbbbbbbbbbbbbbb
3	3	3	33	cccccccccccccccccccccccccccccccccccccccccccccccccccccccccccccccc
4	4	444	44	abcdabcdabcdabcdabcdabcdabcdabcdabcdabcd
update t1 set c2=1333,c3=repeat('h',64) where c1 = 33;
update t1 set c2 = 1111 where c1 = 11;
select * from basic_mv_1;
c1	b_c1	a_c2	b_c2	a_c3
11	11	1111	11	aaaaaaaaaaaaaaaaaaaaaaaaaaaaaaaaaaaaaaaaaaaaaaaaaaaaaaaaaaaaaaaa
12	12	12	12	bbbbbbbbbbbbbbbbbbbbbbbbbbbbbbbbbbbbbbbbbbbbbbbbbbbbbbbbbbbbbbbb
3	3	3	33	cccccccccccccccccccccccccccccccccccccccccccccccccccccccccccccccc
4	4	444	44	abcdabcdabcdabcdabcdabcdabcdabcdabcdabcd
alter system minor freeze;
select * from basic_mv_1;
c1	b_c1	a_c2	b_c2	a_c3
11	11	1111	11	aaaaaaaaaaaaaaaaaaaaaaaaaaaaaaaaaaaaaaaaaaaaaaaaaaaaaaaaaaaaaaaa
12	12	12	12	bbbbbbbbbbbbbbbbbbbbbbbbbbbbbbbbbbbbbbbbbbbbbbbbbbbbbbbbbbbbbbbb
3	3	3	33	cccccccccccccccccccccccccccccccccccccccccccccccccccccccccccccccc
4	4	444	44	abcdabcdabcdabcdabcdabcdabcdabcdabcdabcd
delete from t2 where 1=1;
select * from basic_mv_1;
c1	b_c1	a_c2	b_c2	a_c3
alter system minor freeze;
select * from basic_mv_1;
c1	b_c1	a_c2	b_c2	a_c3
drop materialized view basic_mv_1;
drop table t1,t2;
