set session ob_query_timeout=1000000000;
drop table if exists old_new_t1;
create table old_new_t1(c1 int primary key, c2 int, c3 varchar(64)) partition by hash(c1) partitions 4;
select ora_rowscn into @r1_scn from old_new_t1 where c1 = 55;
update old_new_t1 set c2 = c2 + 100 where c1 = 55;
select *,old_new$$ from old_new_t1 where c1 = 55 and old_new$$ = 'O' and ora_rowscn > @r1_scn;
ERROR 42S22: Unknown column 'OLD_NEW$$' in 'where clause'
select/*+opt_param('hidden_column_visible','true')*/ *,old_new$$ from old_new_t1 where c1 = 55 and old_new$$ = 'O' and ora_rowscn > @r1_scn;
c1	c2	c3	old_new$$
select/*+opt_param('hidden_column_visible','true')*/ *,old_new$$ from old_new_t1 where c1 = 55 and old_new$$ = 'N' and ora_rowscn > @r1_scn;
c1	c2	c3	old_new$$
55	155	55abc	N
select/*+opt_param('hidden_column_visible','true')*/ *,old_new$$ from old_new_t1 where c1 = 55 and old_new$$ = 'F' and ora_rowscn > @r1_scn;
c1	c2	c3	old_new$$
select/*+opt_param('hidden_column_visible','true')*/ count(*) from old_new_t1 where old_new$$ = 'O' and ora_rowscn > @r1_scn;
count(*)
0
select/*+opt_param('hidden_column_visible','true')*/ count(*) from old_new_t1 where old_new$$ = 'N' and ora_rowscn > @r1_scn;
count(*)
46
select/*+opt_param('hidden_column_visible','true')*/ count(*) from old_new_t1 where old_new$$ = 'F' and ora_rowscn > @r1_scn;
count(*)
0
select ora_rowscn into @r2_scn from old_new_t1 where c1 = 80;
update old_new_t1 set c2 = c2 + 100 where c1 > 70 and c1 <= 80;
select/*+opt_param('hidden_column_visible','true')*/ *,old_new$$ from old_new_t1 where c1 > 70 and c1 <= 80 and old_new$$ = 'O' and ora_rowscn > @r2_scn;
c1	c2	c3	old_new$$
select/*+opt_param('hidden_column_visible','true')*/ *,old_new$$ from old_new_t1 where c1 > 70 and c1 <= 80 and old_new$$ = 'N' and ora_rowscn > @r2_scn;
c1	c2	c3	old_new$$
71	171	71abc	N
72	172	72abc	N
73	173	73abc	N
74	174	74abc	N
75	175	75abc	N
76	176	76abc	N
77	177	77abc	N
78	178	78abc	N
79	179	79abc	N
80	180	80abc	N
select/*+opt_param('hidden_column_visible','true')*/ *,old_new$$ from old_new_t1 where c1 > 70 and c1 <= 80 and old_new$$ = 'F' and ora_rowscn > @r2_scn;
c1	c2	c3	old_new$$
select ora_rowscn into @r3_scn from old_new_t1 where c1 = 20;
update old_new_t1 set c2 = c2 + 100 where c1 in (1,5,10,20);
select/*+opt_param('hidden_column_visible','true')*/ *,old_new$$ from old_new_t1 where c1 in (1,5,10,20) and old_new$$ = 'O' and ora_rowscn > @r3_scn;
c1	c2	c3	old_new$$
select/*+opt_param('hidden_column_visible','true')*/ *,old_new$$ from old_new_t1 where c1 in (1,5,10,20) and old_new$$ = 'N' and ora_rowscn > @r3_scn;
c1	c2	c3	old_new$$
1	101	1abc	N
10	110	10abc	N
20	120	20abc	N
5	105	5abc	N
select/*+opt_param('hidden_column_visible','true')*/ *,old_new$$ from old_new_t1 where c1 in (1,5,10,20) and old_new$$ = 'F' and ora_rowscn > @r3_scn;
c1	c2	c3	old_new$$
select ora_rowscn into @r4_scn from old_new_t1 where c1 = 50;
update old_new_t1 set c2 = c2 + 100 where (c1 > 30 and c1 <= 40 or (c1 > 45 and c1 <= 50));
select/*+opt_param('hidden_column_visible','true')*/ *,old_new$$ from old_new_t1 where (c1 > 30 and c1 <= 40 or (c1 > 45 and c1 <= 50)) and old_new$$ = 'O' and ora_rowscn > @r4_scn;
c1	c2	c3	old_new$$
select/*+opt_param('hidden_column_visible','true')*/ *,old_new$$ from old_new_t1 where (c1 > 30 and c1 <= 40 or (c1 > 45 and c1 <= 50)) and old_new$$ = 'N' and ora_rowscn > @r4_scn;
c1	c2	c3	old_new$$
31	131	31abc	N
32	132	32abc	N
33	133	33abc	N
34	134	34abc	N
35	135	35abc	N
36	136	36abc	N
37	137	37abc	N
38	138	38abc	N
39	139	39abc	N
40	140	40abc	N
46	146	46abc	N
47	147	47abc	N
48	148	48abc	N
49	149	49abc	N
50	150	50abc	N
select/*+opt_param('hidden_column_visible','true')*/ *,old_new$$ from old_new_t1 where (c1 > 30 and c1 <= 40 or (c1 > 45 and c1 <= 50)) and old_new$$ = 'F' and ora_rowscn > @r4_scn;
c1	c2	c3	old_new$$
alter system minor freeze;
select/*+opt_param('hidden_column_visible','true')*/ *,old_new$$ from old_new_t1 where c1 = 55 and old_new$$ = 'O' and ora_rowscn > @r1_scn;
c1	c2	c3	old_new$$
select/*+opt_param('hidden_column_visible','true')*/ *,old_new$$ from old_new_t1 where c1 = 55 and old_new$$ = 'N' and ora_rowscn > @r1_scn;
c1	c2	c3	old_new$$
55	155	55abc	N
select/*+opt_param('hidden_column_visible','true')*/ *,old_new$$ from old_new_t1 where c1 = 55 and old_new$$ = 'F' and ora_rowscn > @r1_scn;
c1	c2	c3	old_new$$
select/*+opt_param('hidden_column_visible','true')*/ *,old_new$$ from old_new_t1 where c1 > 70 and c1 <= 80 and old_new$$ = 'O' and ora_rowscn > @r2_scn;
c1	c2	c3	old_new$$
select/*+opt_param('hidden_column_visible','true')*/ *,old_new$$ from old_new_t1 where c1 > 70 and c1 <= 80 and old_new$$ = 'N' and ora_rowscn > @r2_scn;
c1	c2	c3	old_new$$
71	171	71abc	N
72	172	72abc	N
73	173	73abc	N
74	174	74abc	N
75	175	75abc	N
76	176	76abc	N
77	177	77abc	N
78	178	78abc	N
79	179	79abc	N
80	180	80abc	N
select/*+opt_param('hidden_column_visible','true')*/ *,old_new$$ from old_new_t1 where c1 > 70 and c1 <= 80 and old_new$$ = 'F' and ora_rowscn > @r2_scn;
c1	c2	c3	old_new$$
select/*+opt_param('hidden_column_visible','true')*/ *,old_new$$ from old_new_t1 where c1 in (1,5,10,20) and old_new$$ = 'O' and ora_rowscn > @r3_scn;
c1	c2	c3	old_new$$
select/*+opt_param('hidden_column_visible','true')*/ *,old_new$$ from old_new_t1 where c1 in (1,5,10,20) and old_new$$ = 'N' and ora_rowscn > @r3_scn;
c1	c2	c3	old_new$$
1	101	1abc	N
10	110	10abc	N
20	120	20abc	N
5	105	5abc	N
select/*+opt_param('hidden_column_visible','true')*/ *,old_new$$ from old_new_t1 where c1 in (1,5,10,20) and old_new$$ = 'F' and ora_rowscn > @r3_scn;
c1	c2	c3	old_new$$
select/*+opt_param('hidden_column_visible','true')*/ *,old_new$$ from old_new_t1 where (c1 > 30 and c1 <= 40 or (c1 > 45 and c1 <= 50)) and old_new$$ = 'O' and ora_rowscn > @r4_scn;
c1	c2	c3	old_new$$
select/*+opt_param('hidden_column_visible','true')*/ *,old_new$$ from old_new_t1 where (c1 > 30 and c1 <= 40 or (c1 > 45 and c1 <= 50)) and old_new$$ = 'N' and ora_rowscn > @r4_scn;
c1	c2	c3	old_new$$
31	131	31abc	N
32	132	32abc	N
33	133	33abc	N
34	134	34abc	N
35	135	35abc	N
36	136	36abc	N
37	137	37abc	N
38	138	38abc	N
39	139	39abc	N
40	140	40abc	N
46	146	46abc	N
47	147	47abc	N
48	148	48abc	N
49	149	49abc	N
50	150	50abc	N
select/*+opt_param('hidden_column_visible','true')*/ *,old_new$$ from old_new_t1 where (c1 > 30 and c1 <= 40 or (c1 > 45 and c1 <= 50)) and old_new$$ = 'F' and ora_rowscn > @r4_scn;
c1	c2	c3	old_new$$
select ora_rowscn into @r1_scn from old_new_t1 where c1 = 55;
update old_new_t1 set c2 = c2 + 100, c3 = repeat('a',16) where c1 = 55;
select/*+opt_param('hidden_column_visible','true')*/ *,old_new$$ from old_new_t1 where c1 = 55 and old_new$$ = 'O' and ora_rowscn > @r1_scn;
c1	c2	c3	old_new$$
select/*+opt_param('hidden_column_visible','true')*/ *,old_new$$ from old_new_t1 where c1 = 55 and old_new$$ = 'N' and ora_rowscn > @r1_scn;
c1	c2	c3	old_new$$
55	255	aaaaaaaaaaaaaaaa	N
select/*+opt_param('hidden_column_visible','true')*/ *,old_new$$ from old_new_t1 where c1 = 55 and old_new$$ = 'F' and ora_rowscn > @r1_scn;
c1	c2	c3	old_new$$
select ora_rowscn into @r2_scn from old_new_t1 where c1 = 80;
update old_new_t1 set c2 = c2 + 100,c3 = repeat('b', 32) where c1 > 70 and c1 <= 80;
select/*+opt_param('hidden_column_visible','true')*/ *,old_new$$ from old_new_t1 where c1 > 70 and c1 <= 80 and old_new$$ = 'O' and ora_rowscn > @r2_scn;
c1	c2	c3	old_new$$
select/*+opt_param('hidden_column_visible','true')*/ *,old_new$$ from old_new_t1 where c1 > 70 and c1 <= 80 and old_new$$ = 'N' and ora_rowscn > @r2_scn;
c1	c2	c3	old_new$$
71	271	bbbbbbbbbbbbbbbbbbbbbbbbbbbbbbbb	N
72	272	bbbbbbbbbbbbbbbbbbbbbbbbbbbbbbbb	N
73	273	bbbbbbbbbbbbbbbbbbbbbbbbbbbbbbbb	N
74	274	bbbbbbbbbbbbbbbbbbbbbbbbbbbbbbbb	N
75	275	bbbbbbbbbbbbbbbbbbbbbbbbbbbbbbbb	N
76	276	bbbbbbbbbbbbbbbbbbbbbbbbbbbbbbbb	N
77	277	bbbbbbbbbbbbbbbbbbbbbbbbbbbbbbbb	N
78	278	bbbbbbbbbbbbbbbbbbbbbbbbbbbbbbbb	N
79	279	bbbbbbbbbbbbbbbbbbbbbbbbbbbbbbbb	N
80	280	bbbbbbbbbbbbbbbbbbbbbbbbbbbbbbbb	N
select/*+opt_param('hidden_column_visible','true')*/ *,old_new$$ from old_new_t1 where c1 > 70 and c1 <= 80 and old_new$$ = 'F' and ora_rowscn > @r2_scn;
c1	c2	c3	old_new$$
select ora_rowscn into @r3_scn from old_new_t1 where c1 = 20;
update old_new_t1 set c2 = c2 + 100,c3 = repeat('c', 48) where c1 in (1,5,10,20);
select/*+opt_param('hidden_column_visible','true')*/ *,old_new$$ from old_new_t1 where c1 in (1,5,10,20) and old_new$$ = 'O' and ora_rowscn > @r3_scn;
c1	c2	c3	old_new$$
select/*+opt_param('hidden_column_visible','true')*/ *,old_new$$ from old_new_t1 where c1 in (1,5,10,20) and old_new$$ = 'N' and ora_rowscn > @r3_scn;
c1	c2	c3	old_new$$
1	201	cccccccccccccccccccccccccccccccccccccccccccccccc	N
10	210	cccccccccccccccccccccccccccccccccccccccccccccccc	N
20	220	cccccccccccccccccccccccccccccccccccccccccccccccc	N
5	205	cccccccccccccccccccccccccccccccccccccccccccccccc	N
select/*+opt_param('hidden_column_visible','true')*/ *,old_new$$ from old_new_t1 where c1 in (1,5,10,20) and old_new$$ = 'F' and ora_rowscn > @r3_scn;
c1	c2	c3	old_new$$
select ora_rowscn into @r4_scn from old_new_t1 where c1 = 50;
update old_new_t1 set c2 = c2 + 100,c3 = repeat('d', 64) where (c1 > 30 and c1 <= 40 or (c1 > 45 and c1 <= 50));
select/*+opt_param('hidden_column_visible','true')*/ *,old_new$$ from old_new_t1 where (c1 > 30 and c1 <= 40 or (c1 > 45 and c1 <= 50)) and old_new$$ = 'O' and ora_rowscn > @r4_scn;
c1	c2	c3	old_new$$
select/*+opt_param('hidden_column_visible','true')*/ *,old_new$$ from old_new_t1 where (c1 > 30 and c1 <= 40 or (c1 > 45 and c1 <= 50)) and old_new$$ = 'N' and ora_rowscn > @r4_scn;
c1	c2	c3	old_new$$
31	231	dddddddddddddddddddddddddddddddddddddddddddddddddddddddddddddddd	N
32	232	dddddddddddddddddddddddddddddddddddddddddddddddddddddddddddddddd	N
33	233	dddddddddddddddddddddddddddddddddddddddddddddddddddddddddddddddd	N
34	234	dddddddddddddddddddddddddddddddddddddddddddddddddddddddddddddddd	N
35	235	dddddddddddddddddddddddddddddddddddddddddddddddddddddddddddddddd	N
36	236	dddddddddddddddddddddddddddddddddddddddddddddddddddddddddddddddd	N
37	237	dddddddddddddddddddddddddddddddddddddddddddddddddddddddddddddddd	N
38	238	dddddddddddddddddddddddddddddddddddddddddddddddddddddddddddddddd	N
39	239	dddddddddddddddddddddddddddddddddddddddddddddddddddddddddddddddd	N
40	240	dddddddddddddddddddddddddddddddddddddddddddddddddddddddddddddddd	N
46	246	dddddddddddddddddddddddddddddddddddddddddddddddddddddddddddddddd	N
47	247	dddddddddddddddddddddddddddddddddddddddddddddddddddddddddddddddd	N
48	248	dddddddddddddddddddddddddddddddddddddddddddddddddddddddddddddddd	N
49	249	dddddddddddddddddddddddddddddddddddddddddddddddddddddddddddddddd	N
50	250	dddddddddddddddddddddddddddddddddddddddddddddddddddddddddddddddd	N
select/*+opt_param('hidden_column_visible','true')*/ *,old_new$$ from old_new_t1 where (c1 > 30 and c1 <= 40 or (c1 > 45 and c1 <= 50)) and old_new$$ = 'F' and ora_rowscn > @r4_scn;
c1	c2	c3	old_new$$
select ora_rowscn into @r1_scn from old_new_t1 where c1 = 55;
delete from old_new_t1 where c1 = 55;
select/*+opt_param('hidden_column_visible','true')*/ *,old_new$$ from old_new_t1 where c1 = 55 and old_new$$ = 'O' and ora_rowscn > @r1_scn;
c1	c2	c3	old_new$$
55	255	aaaaaaaaaaaaaaaa	O
select/*+opt_param('hidden_column_visible','true')*/ *,old_new$$ from old_new_t1 where c1 = 55 and old_new$$ = 'N' and ora_rowscn > @r1_scn;
c1	c2	c3	old_new$$
select/*+opt_param('hidden_column_visible','true')*/ *,old_new$$ from old_new_t1 where c1 = 55 and old_new$$ = 'F' and ora_rowscn > @r1_scn;
c1	c2	c3	old_new$$
select ora_rowscn into @r2_scn from old_new_t1 where c1 = 80;
delete from old_new_t1 where c1 > 70 and c1 <= 80;
select/*+opt_param('hidden_column_visible','true')*/ *,old_new$$ from old_new_t1 where c1 > 70 and c1 <= 80 and old_new$$ = 'O' and ora_rowscn > @r2_scn;
c1	c2	c3	old_new$$
71	271	bbbbbbbbbbbbbbbbbbbbbbbbbbbbbbbb	O
72	272	bbbbbbbbbbbbbbbbbbbbbbbbbbbbbbbb	O
73	273	bbbbbbbbbbbbbbbbbbbbbbbbbbbbbbbb	O
74	274	bbbbbbbbbbbbbbbbbbbbbbbbbbbbbbbb	O
75	275	bbbbbbbbbbbbbbbbbbbbbbbbbbbbbbbb	O
76	276	bbbbbbbbbbbbbbbbbbbbbbbbbbbbbbbb	O
77	277	bbbbbbbbbbbbbbbbbbbbbbbbbbbbbbbb	O
78	278	bbbbbbbbbbbbbbbbbbbbbbbbbbbbbbbb	O
79	279	bbbbbbbbbbbbbbbbbbbbbbbbbbbbbbbb	O
80	280	bbbbbbbbbbbbbbbbbbbbbbbbbbbbbbbb	O
select/*+opt_param('hidden_column_visible','true')*/ *,old_new$$ from old_new_t1 where c1 > 70 and c1 <= 80 and old_new$$ = 'N' and ora_rowscn > @r2_scn;
c1	c2	c3	old_new$$
select/*+opt_param('hidden_column_visible','true')*/ *,old_new$$ from old_new_t1 where c1 > 70 and c1 <= 80 and old_new$$ = 'F' and ora_rowscn > @r2_scn;
c1	c2	c3	old_new$$
select ora_rowscn into @r3_scn from old_new_t1 where c1 = 20;
delete from old_new_t1 where c1 in (1,5,10,20);
select/*+opt_param('hidden_column_visible','true')*/ *,old_new$$ from old_new_t1 where c1 in (1,5,10,20) and old_new$$ = 'O' and ora_rowscn > @r3_scn;
c1	c2	c3	old_new$$
1	201	cccccccccccccccccccccccccccccccccccccccccccccccc	O
10	210	cccccccccccccccccccccccccccccccccccccccccccccccc	O
20	220	cccccccccccccccccccccccccccccccccccccccccccccccc	O
5	205	cccccccccccccccccccccccccccccccccccccccccccccccc	O
select/*+opt_param('hidden_column_visible','true')*/ *,old_new$$ from old_new_t1 where c1 in (1,5,10,20) and old_new$$ = 'N' and ora_rowscn > @r3_scn;
c1	c2	c3	old_new$$
select/*+opt_param('hidden_column_visible','true')*/ *,old_new$$ from old_new_t1 where c1 in (1,5,10,20) and old_new$$ = 'F' and ora_rowscn > @r3_scn;
c1	c2	c3	old_new$$
select ora_rowscn into @r4_scn from old_new_t1 where c1 = 50;
delete from old_new_t1 where (c1 > 30 and c1 <= 40 or (c1 > 45 and c1 <= 50));
select/*+opt_param('hidden_column_visible','true')*/ *,old_new$$ from old_new_t1 where (c1 > 30 and c1 <= 40 or (c1 > 45 and c1 <= 50)) and old_new$$ = 'O' and ora_rowscn > @r4_scn;
c1	c2	c3	old_new$$
31	231	dddddddddddddddddddddddddddddddddddddddddddddddddddddddddddddddd	O
32	232	dddddddddddddddddddddddddddddddddddddddddddddddddddddddddddddddd	O
33	233	dddddddddddddddddddddddddddddddddddddddddddddddddddddddddddddddd	O
34	234	dddddddddddddddddddddddddddddddddddddddddddddddddddddddddddddddd	O
35	235	dddddddddddddddddddddddddddddddddddddddddddddddddddddddddddddddd	O
36	236	dddddddddddddddddddddddddddddddddddddddddddddddddddddddddddddddd	O
37	237	dddddddddddddddddddddddddddddddddddddddddddddddddddddddddddddddd	O
38	238	dddddddddddddddddddddddddddddddddddddddddddddddddddddddddddddddd	O
39	239	dddddddddddddddddddddddddddddddddddddddddddddddddddddddddddddddd	O
40	240	dddddddddddddddddddddddddddddddddddddddddddddddddddddddddddddddd	O
46	246	dddddddddddddddddddddddddddddddddddddddddddddddddddddddddddddddd	O
47	247	dddddddddddddddddddddddddddddddddddddddddddddddddddddddddddddddd	O
48	248	dddddddddddddddddddddddddddddddddddddddddddddddddddddddddddddddd	O
49	249	dddddddddddddddddddddddddddddddddddddddddddddddddddddddddddddddd	O
50	250	dddddddddddddddddddddddddddddddddddddddddddddddddddddddddddddddd	O
select/*+opt_param('hidden_column_visible','true')*/ *,old_new$$ from old_new_t1 where (c1 > 30 and c1 <= 40 or (c1 > 45 and c1 <= 50)) and old_new$$ = 'N' and ora_rowscn > @r4_scn;
c1	c2	c3	old_new$$
select/*+opt_param('hidden_column_visible','true')*/ *,old_new$$ from old_new_t1 where (c1 > 30 and c1 <= 40 or (c1 > 45 and c1 <= 50)) and old_new$$ = 'F' and ora_rowscn > @r4_scn;
c1	c2	c3	old_new$$
alter system major freeze;
select/*+opt_param('hidden_column_visible','true')*/ *,old_new$$ from old_new_t1 where c1 = 55 and old_new$$ = 'O' and ora_rowscn > @r1_scn;
c1	c2	c3	old_new$$
55	255	aaaaaaaaaaaaaaaa	O
select/*+opt_param('hidden_column_visible','true')*/ *,old_new$$ from old_new_t1 where c1 = 55 and old_new$$ = 'N' and ora_rowscn > @r1_scn;
c1	c2	c3	old_new$$
select/*+opt_param('hidden_column_visible','true')*/ *,old_new$$ from old_new_t1 where c1 = 55 and old_new$$ = 'F' and ora_rowscn > @r1_scn;
c1	c2	c3	old_new$$
select/*+opt_param('hidden_column_visible','true')*/ *,old_new$$ from old_new_t1 where c1 > 70 and c1 <= 80 and old_new$$ = 'O' and ora_rowscn > @r2_scn;
c1	c2	c3	old_new$$
71	271	bbbbbbbbbbbbbbbbbbbbbbbbbbbbbbbb	O
72	272	bbbbbbbbbbbbbbbbbbbbbbbbbbbbbbbb	O
73	273	bbbbbbbbbbbbbbbbbbbbbbbbbbbbbbbb	O
74	274	bbbbbbbbbbbbbbbbbbbbbbbbbbbbbbbb	O
75	275	bbbbbbbbbbbbbbbbbbbbbbbbbbbbbbbb	O
76	276	bbbbbbbbbbbbbbbbbbbbbbbbbbbbbbbb	O
77	277	bbbbbbbbbbbbbbbbbbbbbbbbbbbbbbbb	O
78	278	bbbbbbbbbbbbbbbbbbbbbbbbbbbbbbbb	O
79	279	bbbbbbbbbbbbbbbbbbbbbbbbbbbbbbbb	O
80	280	bbbbbbbbbbbbbbbbbbbbbbbbbbbbbbbb	O
select/*+opt_param('hidden_column_visible','true')*/ *,old_new$$ from old_new_t1 where c1 > 70 and c1 <= 80 and old_new$$ = 'N' and ora_rowscn > @r2_scn;
c1	c2	c3	old_new$$
select/*+opt_param('hidden_column_visible','true')*/ *,old_new$$ from old_new_t1 where c1 > 70 and c1 <= 80 and old_new$$ = 'F' and ora_rowscn > @r2_scn;
c1	c2	c3	old_new$$
select/*+opt_param('hidden_column_visible','true')*/ *,old_new$$ from old_new_t1 where c1 in (1,5,10,20) and old_new$$ = 'O' and ora_rowscn > @r3_scn;
c1	c2	c3	old_new$$
1	201	cccccccccccccccccccccccccccccccccccccccccccccccc	O
10	210	cccccccccccccccccccccccccccccccccccccccccccccccc	O
20	220	cccccccccccccccccccccccccccccccccccccccccccccccc	O
5	205	cccccccccccccccccccccccccccccccccccccccccccccccc	O
select/*+opt_param('hidden_column_visible','true')*/ *,old_new$$ from old_new_t1 where c1 in (1,5,10,20) and old_new$$ = 'N' and ora_rowscn > @r3_scn;
c1	c2	c3	old_new$$
select/*+opt_param('hidden_column_visible','true')*/ *,old_new$$ from old_new_t1 where c1 in (1,5,10,20) and old_new$$ = 'F' and ora_rowscn > @r3_scn;
c1	c2	c3	old_new$$
select/*+opt_param('hidden_column_visible','true')*/ *,old_new$$ from old_new_t1 where (c1 > 30 and c1 <= 40 or (c1 > 45 and c1 <= 50)) and old_new$$ = 'O' and ora_rowscn > @r4_scn;
c1	c2	c3	old_new$$
31	231	dddddddddddddddddddddddddddddddddddddddddddddddddddddddddddddddd	O
32	232	dddddddddddddddddddddddddddddddddddddddddddddddddddddddddddddddd	O
33	233	dddddddddddddddddddddddddddddddddddddddddddddddddddddddddddddddd	O
34	234	dddddddddddddddddddddddddddddddddddddddddddddddddddddddddddddddd	O
35	235	dddddddddddddddddddddddddddddddddddddddddddddddddddddddddddddddd	O
36	236	dddddddddddddddddddddddddddddddddddddddddddddddddddddddddddddddd	O
37	237	dddddddddddddddddddddddddddddddddddddddddddddddddddddddddddddddd	O
38	238	dddddddddddddddddddddddddddddddddddddddddddddddddddddddddddddddd	O
39	239	dddddddddddddddddddddddddddddddddddddddddddddddddddddddddddddddd	O
40	240	dddddddddddddddddddddddddddddddddddddddddddddddddddddddddddddddd	O
46	246	dddddddddddddddddddddddddddddddddddddddddddddddddddddddddddddddd	O
47	247	dddddddddddddddddddddddddddddddddddddddddddddddddddddddddddddddd	O
48	248	dddddddddddddddddddddddddddddddddddddddddddddddddddddddddddddddd	O
49	249	dddddddddddddddddddddddddddddddddddddddddddddddddddddddddddddddd	O
50	250	dddddddddddddddddddddddddddddddddddddddddddddddddddddddddddddddd	O
select/*+opt_param('hidden_column_visible','true')*/ *,old_new$$ from old_new_t1 where (c1 > 30 and c1 <= 40 or (c1 > 45 and c1 <= 50)) and old_new$$ = 'N' and ora_rowscn > @r4_scn;
c1	c2	c3	old_new$$
select/*+opt_param('hidden_column_visible','true')*/ *,old_new$$ from old_new_t1 where (c1 > 30 and c1 <= 40 or (c1 > 45 and c1 <= 50)) and old_new$$ = 'F' and ora_rowscn > @r4_scn;
c1	c2	c3	old_new$$
drop table old_new_t1;
