alter system set _enable_add_fulltext_index_to_existing_table = true;
drop table if exists t200;
create table t200(id int, age int, name varchar(50), js json, primary key(id));
insert into t200 values
(1,12,'mali', '{"score":[11,22]}'),
(2,12,'yang', '{"score":[44,33]}'),
(3,15,'chang', '{"score":[66,55]}');
create index scores on t200((CAST(js->'$.score' as unsigned array)));
drop view if exists t200_v1;
drop view if exists t200_v2;
drop view if exists t200_v3;
create view t200_v1 as select * from t200;
create view t200_v2 as select id,js from t200;
create view t200_v3 as select id,js->'$.score' as js from t200;
select * from t200_v1 order by id;
id	age	name	js
1	12	mali	{"score": [11, 22]}
2	12	yang	{"score": [44, 33]}
3	15	chang	{"score": [66, 55]}
select * from t200_v2 order by id;
id	js
1	{"score": [11, 22]}
2	{"score": [44, 33]}
3	{"score": [66, 55]}
select * from t200_v3 order by id;
id	js
1	[11, 22]
2	[44, 33]
3	[66, 55]
insert into t200 values (4,19,'meng', '{"score":[100]}');
update t200 set js = '{"score":[77,88]}' where id = 3;
select * from t200_v1 order by id;
id	age	name	js
1	12	mali	{"score": [11, 22]}
2	12	yang	{"score": [44, 33]}
3	15	chang	{"score": [77, 88]}
4	19	meng	{"score": [100]}
select * from t200_v2 order by id;
id	js
1	{"score": [11, 22]}
2	{"score": [44, 33]}
3	{"score": [77, 88]}
4	{"score": [100]}
select * from t200_v3 order by id;
id	js
1	[11, 22]
2	[44, 33]
3	[77, 88]
4	[100]
update t200_v1 set js = '{"score":[11,22]}';
update t200_v2 set js = '{"score":[500]}' where id = 2;
update t200_v3 set js = '[1000]' where id = 3;
ERROR HY000: Column 'js' is not updatable
select * from t200 order by id;
id	age	name	js
1	12	mali	{"score": [11, 22]}
2	12	yang	{"score": [500]}
3	15	chang	{"score": [11, 22]}
4	19	meng	{"score": [11, 22]}
select * from t200_v1 order by id;
id	age	name	js
1	12	mali	{"score": [11, 22]}
2	12	yang	{"score": [500]}
3	15	chang	{"score": [11, 22]}
4	19	meng	{"score": [11, 22]}
select * from t200_v2 order by id;
id	js
1	{"score": [11, 22]}
2	{"score": [500]}
3	{"score": [11, 22]}
4	{"score": [11, 22]}
select * from t200_v3 order by id;
id	js
1	[11, 22]
2	[500]
3	[11, 22]
4	[11, 22]
delete from t200_v1 where id = 1;
delete from t200_v2 where id = 2;
delete from t200_v3 where id = 3;
select * from t200 order by id;
id	age	name	js
4	19	meng	{"score": [11, 22]}
select * from t200_v1 order by id;
id	age	name	js
4	19	meng	{"score": [11, 22]}
select * from t200_v2 order by id;
id	js
4	{"score": [11, 22]}
select * from t200_v3 order by id;
id	js
4	[11, 22]
drop view if exists t200_v1;
drop view if exists t200_v2;
drop view if exists t200_v3;
drop table if exists t200;
drop table if exists t202;
create table t202(id int, age int, name varchar(50),date1 date, js json, primary key(id, date1))
partition by range columns (date1)
subpartition by hash(id) SUBPARTITIONS 5
(partition p202401 values less than('20240101'),
partition p202402 values less than('20240201'),
partition p202403 values less than('20240301'),
partition p202404 values less than('20240401'),
partition p202405 values less than('20240501')
);
insert into t202 values
(1,12,'mali','20240115', '{"score":[11]}'),
(2,12,'yang','20240215', '{"score":[22]}'),
(3,15,'chang','20240315', '{"score":[33]}'),
(4,16,'zheng','20240415', '{"score":[44]}');
create index scores on t202((CAST(js->'$.score' as unsigned array)));
drop view if exists t202_v1;
drop view if exists t202_v2;
drop view if exists t202_v3;
create view t202_v1 as select * from t202;
create view t202_v2 as select id,js from t202;
create view t202_v3 as select id,js->'$.score' as js from t202;
update t202_v1 set js = '{"score":[11,22]}';
update t202_v2 set js = '{"score":[500]}' where id = 2;
update t202_v3 set js = '[1000]' where id = 3;
ERROR HY000: Column 'js' is not updatable
select * from t202 order by id;
id	age	name	date1	js
1	12	mali	2024-01-15	{"score": [11, 22]}
2	12	yang	2024-02-15	{"score": [500]}
3	15	chang	2024-03-15	{"score": [11, 22]}
4	16	zheng	2024-04-15	{"score": [11, 22]}
select * from t202_v1 order by id;
id	age	name	date1	js
1	12	mali	2024-01-15	{"score": [11, 22]}
2	12	yang	2024-02-15	{"score": [500]}
3	15	chang	2024-03-15	{"score": [11, 22]}
4	16	zheng	2024-04-15	{"score": [11, 22]}
select * from t202_v2 order by id;
id	js
1	{"score": [11, 22]}
2	{"score": [500]}
3	{"score": [11, 22]}
4	{"score": [11, 22]}
select * from t202_v3 order by id;
id	js
1	[11, 22]
2	[500]
3	[11, 22]
4	[11, 22]
delete from t202_v1 where id = 1;
delete from t202_v2 where id = 2;
delete from t202_v3 where id = 3;
select * from t202 order by id;
id	age	name	date1	js
4	16	zheng	2024-04-15	{"score": [11, 22]}
select * from t202_v1 order by id;
id	age	name	date1	js
4	16	zheng	2024-04-15	{"score": [11, 22]}
select * from t202_v2 order by id;
id	js
4	{"score": [11, 22]}
select * from t202_v3 order by id;
id	js
4	[11, 22]
drop view if exists t202_v1;
drop view if exists t202_v2;
drop view if exists t202_v3;
drop table if exists t202;
drop table if exists t203;
create table t203(id int, age int, name varchar(50),date1 date, js json, primary key(id, date1))
partition by range columns (date1)
subpartition by hash(id) SUBPARTITIONS 5
(partition p202401 values less than('20240101'),
partition p202402 values less than('20240201'),
partition p202403 values less than('20240301'),
partition p202404 values less than('20240401'),
partition p202405 values less than('20240501')
);
create index scores on t203((CAST(js->'$.score' as unsigned array)));
insert into t203 values
(1,12,'mali','20240115', '{"score":[11]}'),
(2,12,'yang','20240215', '{"score":[22]}'),
(3,15,'chang','20240315', '{"score":[33]}'),
(4,16,'zheng','20240415', '{"score":[44]}');
drop MATERIALIZED VIEW if exists t203_mv1;
create MATERIALIZED VIEW t203_mv1(id,name,js) as select id,name,js from t203;
drop MATERIALIZED VIEW if exists t203_mv2;
create MATERIALIZED VIEW t203_mv2(id,name,js,primary key(id)) as select id,name,js from t203;
drop MATERIALIZED VIEW if exists t203_mv3;
create MATERIALIZED VIEW t203_mv3(id,name,js,primary key(id))
PARALLEL 5
PARTITION BY HASH(id) PARTITIONS 8
as select id,name,js
from t203;
create unique index index_mv3_1 on t203_mv3 (name);
ERROR HY000: A UNIQUE INDEX must include all columns in the table's partitioning function
create index index_mv3_2 on t203_mv3 ((cast(js->'$.score' as unsigned array)));
ERROR 0A000: use functional index on materialized view not supported
drop MATERIALIZED VIEW if exists LOG;
CREATE MATERIALIZED VIEW LOG ON t203 WITH PRIMARY KEY, ROWID, SEQUENCE (id,js) INCLUDING NEW VALUES;
ERROR 42S21: Duplicate column name 'id'
drop MATERIALIZED VIEW if exists t203_mv4;
create MATERIALIZED VIEW t203_mv4
ENABLE ON QUERY COMPUTATION
as select id,js from t203;
ERROR HY000: cannot ENABLE ON QUERY COMPUTATION for the materialized view t203_mv4: primary keys of all base tables are required in the select item list
SELECT MVIEW_NAME, ON_QUERY_COMPUTATION FROM oceanbase.DBA_MVIEWS WHERE MVIEW_NAME = 't203_mv4';
MVIEW_NAME	ON_QUERY_COMPUTATION
insert into t203 values (5,14,'lili','20240112', '{"score":[55]}');
insert into t203 values (6,13,'liu','20240212', '{"score":[66]}');
update t203 set js = '{"score":[77]}' where id = 4;
delete from t203 where id = 3;
select * from t203 order by id;
id	age	name	date1	js
1	12	mali	2024-01-15	{"score": [11]}
2	12	yang	2024-02-15	{"score": [22]}
4	16	zheng	2024-04-15	{"score": [77]}
5	14	lili	2024-01-12	{"score": [55]}
6	13	liu	2024-02-12	{"score": [66]}
select * from t203_mv1 order by id;
id	name	js
1	mali	{"score": [11]}
2	yang	{"score": [22]}
3	chang	{"score": [33]}
4	zheng	{"score": [44]}
select * from t203_mv2 order by id;
id	name	js
1	mali	{"score": [11]}
2	yang	{"score": [22]}
3	chang	{"score": [33]}
4	zheng	{"score": [44]}
select * from t203_mv3 order by id;
id	name	js
1	mali	{"score": [11]}
2	yang	{"score": [22]}
3	chang	{"score": [33]}
4	zheng	{"score": [44]}
