alter system set _enable_add_fulltext_index_to_existing_table = true;
drop table if exists t50;
Warnings:
Note	1051	Unknown table 'test.t50'
create table t50(id int primary key,name varchar(50),age int ,js json);
create unique index scores on t50 (name,(CAST(js->'$.score' AS UNSIGNED ARRAY)));
insert into t50 values
(1,'lili',12,'{"score":[11,22]}'),
(2,'mali',12,'{"score":[33,44]}'),
(3,'daici',12,'{"score":[55,66]}'),
(4,'chujin',12,'{"score":[77,88]}'),
(5,'nani',12,'{"score":[10]}');
show create table t50;
Table	Create Table
t50	CREATE TABLE `t50` (
  `id` int(11) NOT NULL,
  `name` varchar(50) DEFAULT NULL,
  `age` int(11) DEFAULT NULL,
  `js` json DEFAULT NULL,
  PRIMARY KEY (`id`),
  UNIQUE  INDEX `scores` (`name`, (json_query(`js`,'$.score' RETURNING unsigned WITHOUT ARRAY WRAPPER asis error on error null on empty null on mismatch))) BLOCK_SIZE 16384
) ORGANIZATION INDEX DEFAULT CHARSET = utf8mb4 ROW_FORMAT = DYNAMIC COMPRESSION = 'zstd_1.3.8' REPLICA_NUM = 1 BLOCK_SIZE = 16384 USE_BLOOM_FILTER = FALSE ENABLE_MACRO_BLOCK_BLOOM_FILTER = FALSE TABLET_SIZE = 134217728 PCTFREE = 0
select * from t50;
id	name	age	js
1	lili	12	{"score": [11, 22]}
2	mali	12	{"score": [33, 44]}
3	daici	12	{"score": [55, 66]}
4	chujin	12	{"score": [77, 88]}
5	nani	12	{"score": [10]}
explain select * from t50 where name = 'lili' and  11 member of(js->>'$.score');
Query Plan
===============================================
|ID|OPERATOR       |NAME|EST.ROWS|EST.TIME(us)|
-----------------------------------------------
|0 |TABLE FULL SCAN|t50 |1       |63          |
===============================================
Outputs & filters:
-------------------------------------
  0 - output([t50.id], [t50.name], [t50.age], [t50.js]), filter([t50.name = 'lili'], [JSON_MEMBER_OF(11, JSON_UNQUOTE(JSON_EXTRACT(t50.js, '$.score')))]), rowset=16
      access([t50.id], [t50.js], [t50.name], [t50.age]), partitions(p0)
      is_index_back=false, is_global_index=false, filter_before_indexback[false,false], 
      range_key([t50.id]), range(MIN ; MAX)always true
drop index scores on t50;
drop table if exists t50;
drop table if exists t51;
create table t51(id int primary key,name varchar(50),age int ,js json);
insert into t51 values
(1,'lili',12,'{"score":[11,22]}'),
(2,'mali',12,'{"score":[33,44]}'),
(3,'daici',12,'{"score":[55,66]}'),
(4,'chujin',12,'{"score":[77,88]}'),
(5,'nani',12,'{"score":[10]}');
create unique index scores on t51 (name,(CAST(js->'$.score' AS UNSIGNED ARRAY)));
show create table t51;
Table	Create Table
t51	CREATE TABLE `t51` (
  `id` int(11) NOT NULL,
  `name` varchar(50) DEFAULT NULL,
  `age` int(11) DEFAULT NULL,
  `js` json DEFAULT NULL,
  PRIMARY KEY (`id`),
  UNIQUE  INDEX `scores` (`name`, (json_query(`js`,'$.score' RETURNING unsigned WITHOUT ARRAY WRAPPER asis error on error null on empty null on mismatch))) BLOCK_SIZE 16384
) ORGANIZATION INDEX DEFAULT CHARSET = utf8mb4 ROW_FORMAT = DYNAMIC COMPRESSION = 'zstd_1.3.8' REPLICA_NUM = 1 BLOCK_SIZE = 16384 USE_BLOOM_FILTER = FALSE ENABLE_MACRO_BLOCK_BLOOM_FILTER = FALSE TABLET_SIZE = 134217728 PCTFREE = 0
select * from t51;
id	name	age	js
1	lili	12	{"score": [11, 22]}
2	mali	12	{"score": [33, 44]}
3	daici	12	{"score": [55, 66]}
4	chujin	12	{"score": [77, 88]}
5	nani	12	{"score": [10]}
explain select * from t51 where name = 'lili' and  11 member of(js->>'$.score');
Query Plan
===============================================
|ID|OPERATOR       |NAME|EST.ROWS|EST.TIME(us)|
-----------------------------------------------
|0 |TABLE FULL SCAN|t51 |1       |63          |
===============================================
Outputs & filters:
-------------------------------------
  0 - output([t51.id], [t51.name], [t51.age], [t51.js]), filter([t51.name = 'lili'], [JSON_MEMBER_OF(11, JSON_UNQUOTE(JSON_EXTRACT(t51.js, '$.score')))]), rowset=16
      access([t51.id], [t51.js], [t51.name], [t51.age]), partitions(p0)
      is_index_back=false, is_global_index=false, filter_before_indexback[false,false], 
      range_key([t51.id]), range(MIN ; MAX)always true
drop table if exists t52;
create table t52(id int primary key,name varchar(50),age int ,js json);
insert into t52 values
(1,'lili',12,'{"score":[11,22]}'),
(2,'lili',12,'{"score":[11,22]}'),
(3,'daici',12,'{"score":[55,66]}'),
(4,'chujin',12,'{"score":[77,88]}'),
(5,'nani',12,'{"score":[10]}');
create unique index scores on t52 (name,(CAST(js->'$.score' AS UNSIGNED ARRAY)));
ERROR 23000: Duplicated primary key
show create table t52;
Table	Create Table
t52	CREATE TABLE `t52` (
  `id` int(11) NOT NULL,
  `name` varchar(50) DEFAULT NULL,
  `age` int(11) DEFAULT NULL,
  `js` json DEFAULT NULL,
  PRIMARY KEY (`id`)
) ORGANIZATION INDEX DEFAULT CHARSET = utf8mb4 ROW_FORMAT = DYNAMIC COMPRESSION = 'zstd_1.3.8' REPLICA_NUM = 1 BLOCK_SIZE = 16384 USE_BLOOM_FILTER = FALSE ENABLE_MACRO_BLOCK_BLOOM_FILTER = FALSE TABLET_SIZE = 134217728 PCTFREE = 0
show index from t52;
Table	Non_unique	Key_name	Seq_in_index	Column_name	Collation	Cardinality	Sub_part	Packed	Null	Index_type	Comment	Index_comment	Visible	Expression
t52	0	PRIMARY	1	id	A	NULL	NULL	NULL		BTREE	available		YES	NULL
drop table if exists t52;
create table t52(id int primary key,name varchar(50),age int ,js json);
insert into t52 values
(1,'lili',12,'{"score":[11,22]}'),
(2,'lili',12,'{"score":[11,55]}'),
(3,'daici',12,'{"score":[55,66]}'),
(4,'chujin',12,'{"score":[77,88]}'),
(5,'nani',12,'{"score":[10]}');
create unique index scores on t52 (name,(CAST(js->'$.score' AS UNSIGNED ARRAY)));
ERROR 23000: Duplicated primary key
show create table t52;
Table	Create Table
t52	CREATE TABLE `t52` (
  `id` int(11) NOT NULL,
  `name` varchar(50) DEFAULT NULL,
  `age` int(11) DEFAULT NULL,
  `js` json DEFAULT NULL,
  PRIMARY KEY (`id`)
) ORGANIZATION INDEX DEFAULT CHARSET = utf8mb4 ROW_FORMAT = DYNAMIC COMPRESSION = 'zstd_1.3.8' REPLICA_NUM = 1 BLOCK_SIZE = 16384 USE_BLOOM_FILTER = FALSE ENABLE_MACRO_BLOCK_BLOOM_FILTER = FALSE TABLET_SIZE = 134217728 PCTFREE = 0
show index from t52;
Table	Non_unique	Key_name	Seq_in_index	Column_name	Collation	Cardinality	Sub_part	Packed	Null	Index_type	Comment	Index_comment	Visible	Expression
t52	0	PRIMARY	1	id	A	NULL	NULL	NULL		BTREE	available		YES	NULL
drop table  if exists t52;
create table t52(id int primary key,name varchar(50),age int ,js json);
insert into t52 values
(1,'lili',12,'{"score":[11,22]}'),
(2,'lili',12,'{"score":[11,100]}'),
(3,'daici',12,'{"score":[55,66]}'),
(4,'chujin',12,'{"score":[77,88]}'),
(5,'nani',12,'{"score":[10]}');
create unique index scores on t52 (name,(CAST(js->'$.score' AS UNSIGNED ARRAY)));
ERROR 23000: Duplicated primary key
show create table t52;
Table	Create Table
t52	CREATE TABLE `t52` (
  `id` int(11) NOT NULL,
  `name` varchar(50) DEFAULT NULL,
  `age` int(11) DEFAULT NULL,
  `js` json DEFAULT NULL,
  PRIMARY KEY (`id`)
) ORGANIZATION INDEX DEFAULT CHARSET = utf8mb4 ROW_FORMAT = DYNAMIC COMPRESSION = 'zstd_1.3.8' REPLICA_NUM = 1 BLOCK_SIZE = 16384 USE_BLOOM_FILTER = FALSE ENABLE_MACRO_BLOCK_BLOOM_FILTER = FALSE TABLET_SIZE = 134217728 PCTFREE = 0
show index from t52;
Table	Non_unique	Key_name	Seq_in_index	Column_name	Collation	Cardinality	Sub_part	Packed	Null	Index_type	Comment	Index_comment	Visible	Expression
t52	0	PRIMARY	1	id	A	NULL	NULL	NULL		BTREE	available		YES	NULL
drop table if exists t52;
create table t52(id int primary key,name varchar(50),age int ,js json);
insert into t52 values
(1,'lili',12,'{"score":[11,22]}'),
(2,'lili',12,'{"score":[33,44]}'),
(3,'daici',12,'{"score":[55,66]}'),
(4,'chujin',12,'{"score":[77,88]}'),
(5,'mili',12,'{"score":[33,44]}');
create unique index scores on t52 (name,(CAST(js->'$.score' AS UNSIGNED ARRAY)));
show create table t52;
Table	Create Table
t52	CREATE TABLE `t52` (
  `id` int(11) NOT NULL,
  `name` varchar(50) DEFAULT NULL,
  `age` int(11) DEFAULT NULL,
  `js` json DEFAULT NULL,
  PRIMARY KEY (`id`),
  UNIQUE  INDEX `scores` (`name`, (json_query(`js`,'$.score' RETURNING unsigned WITHOUT ARRAY WRAPPER asis error on error null on empty null on mismatch))) BLOCK_SIZE 16384
) ORGANIZATION INDEX DEFAULT CHARSET = utf8mb4 ROW_FORMAT = DYNAMIC COMPRESSION = 'zstd_1.3.8' REPLICA_NUM = 1 BLOCK_SIZE = 16384 USE_BLOOM_FILTER = FALSE ENABLE_MACRO_BLOCK_BLOOM_FILTER = FALSE TABLET_SIZE = 134217728 PCTFREE = 0
show index from t52;
Table	Non_unique	Key_name	Seq_in_index	Column_name	Collation	Cardinality	Sub_part	Packed	Null	Index_type	Comment	Index_comment	Visible	Expression
t52	0	PRIMARY	1	id	A	NULL	NULL	NULL		BTREE	available		YES	NULL
t52	0	scores	1	name	A	NULL	NULL	NULL	YES	BTREE	available		YES	NULL
t52	0	scores	2	SYS_NC_mvi_21	A	NULL	NULL	NULL	YES	BTREE	available		YES	json_query(`js`,'$.score' RETURNING unsigned WITHOUT ARRAY WRAPPER asis error on error null on empty null on mismatch)
drop table if exists t52;
create table t52(id int primary key,name varchar(50),age int ,js json);
insert into t52 values
(1,'lili',12,'{"score":[11,22]}'),
(2,'mali',12,'{"score":[44,33]}');
create unique index scores on t52 (name,(CAST(js->'$.score' AS UNSIGNED ARRAY)));
insert into t52 values (3,'shuxue',12,'{"score":[55,66]}') on duplicate key update name = 'ma',js = '{"score":[77,88]}';
delete from t52 where id = 3;
select * from t52;
id	name	age	js
1	lili	12	{"score": [11, 22]}
2	mali	12	{"score": [44, 33]}
drop table if exists t52;
create table t52(id int primary key,name varchar(50),age int ,js json);
insert into t52 values
(1,'lili',12,'{"score":[11,22]}'),
(2,'mali',12,'{"score":[44,33]}');
create unique index scores on t52 (name,(CAST(js->'$.score' AS UNSIGNED ARRAY)));
insert into t52 values (1,'yuwen',12,'{"score":[55,66]}') on duplicate key update name = 'ma',js = '{"score":[77,88]}';
select * from t52;
id	name	age	js
1	ma	12	{"score": [77, 88]}
2	mali	12	{"score": [44, 33]}
insert into t52 values (1,'yuwen',12,'{"score":[11,66]}') on duplicate key update name = 'ma',js = '{"score":[77,88]}';
select * from t52;
id	name	age	js
1	ma	12	{"score": [77, 88]}
2	mali	12	{"score": [44, 33]}
drop table if exists t52;
create table t52(id int primary key,name varchar(50),age int ,js json);
insert into t52 values
(1,'lili',12,'{"score":[11,22]}'),
(2,'mali',12,'{"score":[44,33]}');
create unique index scores on t52 (name,(CAST(js->'$.score' AS UNSIGNED ARRAY)));
insert into t52 values (1,'yuwen',12,'{"score":[55,66]}') on duplicate key update name = 'ma',js = '{"score":[77,88]}';
select * from t52;
id	name	age	js
1	ma	12	{"score": [77, 88]}
2	mali	12	{"score": [44, 33]}
drop table if exists t52;
create table t52(id int primary key,name varchar(50),age int ,js json);
insert into t52 values
(1,'lili',12,'{"score":[11,22]}'),
(2,'mali',12,'{"score":[44,33]}');
create unique index scores on t52 (name,(CAST(js->'$.score' AS UNSIGNED ARRAY)));
insert into t52 values (3,'lili',12,'{"score":[11,22]}') on duplicate key update name = 'ma',js = '{"score":[77,88]}';
select * from t52;
id	name	age	js
1	ma	12	{"score": [77, 88]}
2	mali	12	{"score": [44, 33]}
drop table if exists t52;
create table t52(id int primary key,name varchar(50),age int ,js json);
insert into t52 values
(1,'lili',12,'{"score":[11,22]}'),
(2,'mali',12,'{"score":[44,33]}');
create unique index scores on t52 (name,(CAST(js->'$.score' AS UNSIGNED ARRAY)));
insert into t52 values (3,'lili',12,'{"score":[11,22]}') on duplicate key update id = values(id), name = 'ssss';
select * from t52;
id	name	age	js
2	mali	12	{"score": [44, 33]}
3	ssss	12	{"score": [11, 22]}
drop table if exists t52;
create table t52(id int primary key,name varchar(50),age int ,js json);
insert into t52 values
(1,'lili',12,'{"score":[11,22]}'),
(2,'mali',12,'{"score":[44,33]}');
create unique index scores on t52 (name,(CAST(js->'$.score' AS UNSIGNED ARRAY)));
insert into t52 values (2,'lili',12,'{"score":[11,22]}') on duplicate key update name = 'ssss';
select * from t52;
id	name	age	js
1	lili	12	{"score": [11, 22]}
2	ssss	12	{"score": [44, 33]}
drop table if exists t52;
create table t52(id int primary key,name varchar(50),age int ,js json);
insert into t52 values
(1,'lili',12,'{"score":[11,22]}'),
(2,'mali',12,'{"score":[44,33]}');
create unique index scores on t52 (name,(CAST(js->'$.score' AS UNSIGNED ARRAY)));
replace into t52(id, name, age, js) values (3,'ma', 13, '{"score":[55,66]}');
select * from t52;
id	name	age	js
1	lili	12	{"score": [11, 22]}
2	mali	12	{"score": [44, 33]}
3	ma	13	{"score": [55, 66]}
drop table if exists t52;
create table t52(id int primary key,name varchar(50),age int ,js json);
insert into t52 values
(1,'lili',12,'{"score":[11,22]}'),
(2,'mali',12,'{"score":[44,33]}');
create unique index scores on t52 (name,(CAST(js->'$.score' AS UNSIGNED ARRAY)));
replace into t52(id, name, age, js) values (3,'lili', 13, '{"score":[11,66]}');
ERROR 23000: Duplicate entry 'lili-11' for key 'scores'
select * from t52;
id	name	age	js
1	lili	12	{"score": [11, 22]}
2	mali	12	{"score": [44, 33]}
drop table if exists t52;
create table t52(id int primary key,name varchar(50),age int ,js json);
insert into t52 values
(1,'lili',12,'{"score":[11,22]}'),
(2,'mali',12,'{"score":[44,33]}');
create unique index scores on t52 (name,(CAST(js->'$.score' AS UNSIGNED ARRAY)));
replace into t52(id, name, age, js) values (3,'lili', 13, '{"score":[11,22]}');
select * from t52;
id	name	age	js
2	mali	12	{"score": [44, 33]}
3	lili	13	{"score": [11, 22]}
drop table if exists t52;
create table t52(id int primary key,name varchar(50),age int ,js json);
insert into t52 values
(1,'lili',12,'{"score":[11,22]}'),
(2,'mali',12,'{"score":[44,33]}');
create unique index scores on t52 (name,(CAST(js->'$.score' AS UNSIGNED ARRAY)));
replace into t52(id, name, age, js) values (1,'lili', 15, '{"score":[11,22]}');
select * from t52;
id	name	age	js
1	lili	15	{"score": [11, 22]}
2	mali	12	{"score": [44, 33]}
drop table if exists t52;
create table t52(id int primary key,name varchar(50),age int ,js json);
insert into t52 values
(1,'lili',12,'{"score":[11,22]}'),
(2,'mali',12,'{"score":[44,33]}');
create unique index scores on t52 (name,(CAST(js->'$.score' AS UNSIGNED ARRAY)));
replace into t52(id, name, age, js) values (2,'lili', 15, '{"score":[11,22]}');
select * from t52;
id	name	age	js
2	lili	15	{"score": [11, 22]}
