alter system set _enable_add_fulltext_index_to_existing_table = true;
drop table if exists t1;
create table t1 (id int primary key,js json);
create index idx1 on t1 ((cast(js->'$[*]' as unsigned array)));
insert into t1 (id ,js) values (1,null);
insert into t1 (id ,js) values (2,'null');
insert into t1 (id ,js) values (3,true);
ERROR 22032: Invalid JSON text.
insert into t1 (id ,js) values (4,12312);
ERROR 22032: Invalid JSON text.
insert into t1 (id ,js) values (5,'[]');
insert into t1 (id ,js) values (6,'{}');
insert into t1 (id ,js) values (7,'{"miao":[12312,1231]}');
insert into t1 (id ,js) values (8,'["miao","zheng"]');
ERROR 42000: Invalid JSON value for CAST for functional index.
insert into t1 (id ,js) values (9,'["zheng", true,2131]');
ERROR 42000: Invalid JSON value for CAST for functional index.
insert into t1 (id ,js) values (10,'[123,456,789]');
insert into t1 (id ,js) values (11,null) on duplicate  key update js = values (js);
insert into t1 (id ,js) values (12,'null') on duplicate  key update js = values (js);
insert into t1 (id ,js) values (13,true) on duplicate  key update js = values (js);
ERROR 22032: Invalid JSON text.
insert into t1 (id ,js) values (14,12312) on duplicate  key update js = values (js);
ERROR 22032: Invalid JSON text.
insert into t1 (id ,js) values (15,'[]') on duplicate  key update js = values (js);
insert into t1 (id ,js) values (16,'{}') on duplicate  key update js = values (js);
insert into t1 (id ,js) values (17,'{"miao":[12312,1231]}') on duplicate  key update js = values (js);
insert into t1 (id ,js) values (18,'["miao","zheng"]') on duplicate  key update js = values (js);
ERROR 42000: Invalid JSON value for CAST for functional index.
insert into t1 (id ,js) values (19,'["zheng", true,2131]') on duplicate  key update js = values (js);
ERROR 42000: Invalid JSON value for CAST for functional index.
insert into t1 (id ,js) values (20,'[123,456,789]') on duplicate  key update js = values (js);
replace into t1 (id ,js) values (21,null);
replace into t1 (id ,js) values (22,'null');
replace into t1 (id ,js) values (23,true);
ERROR 22032: Invalid JSON text.
replace into t1 (id ,js) values (24,12312);
ERROR 22032: Invalid JSON text.
replace into t1 (id ,js) values (25,'[]');
replace into t1 (id ,js) values (26,'{}');
replace into t1 (id ,js) values (27,'{"miao":[12312,1231]}');
replace into t1 (id ,js) values (28,'["miao","zheng"]');
ERROR 42000: Invalid JSON value for CAST for functional index.
replace into t1 (id ,js) values (29,'["zheng", true, 2131]');
ERROR 42000: Invalid JSON value for CAST for functional index.
replace into t1 (id ,js) values (30,'[123,456,789]');
update t1 set js = null where id = 1;
update t1 set js = 'null'where id = 1;
update t1 set js = true where id = 1;
ERROR 22032: Invalid JSON text.
update t1 set js = 12312 where id = 1;
ERROR 22032: Invalid JSON text.
update t1 set js = '[]' where id = 1;
update t1 set js = '{}' where id = 1;
update t1 set js = '{"miao":[12312,1231]}' where id = 1;
update t1 set js = '["miao","zheng"]' where id = 1;
ERROR 42000: Invalid JSON value for CAST for functional index.
update t1 set js = '["zheng", true,2131]' where id = 1;
ERROR 42000: Invalid JSON value for CAST for functional index.
update t1 set js = '[123,333,444]' where 123 member of(js->'$[*]');
explain update t1 set js = '[123,222,333,444]' where 123 member of(js->'$[*]');
Query Plan
======================================================
|ID|OPERATOR          |NAME    |EST.ROWS|EST.TIME(us)|
------------------------------------------------------
|0 |UPDATE            |        |2       |297         |
|1 |└─TABLE RANGE SCAN|t1(idx1)|2       |261         |
======================================================
Outputs & filters:
-------------------------------------
  0 - output(nil), filter(nil)
      table_columns([{t1: ({t1: (t1.id, t1.js, t1.regex
      update([t1.js=column_conv(JSON,PS:(-1,-1),NULL,'[123,222,333,444]')], [t1.SYS_NC_mvi_19=json_query(column_conv(JSON,PS:(-1,-1),NULL,'[123,222,333,
      444]'), '$[*]', 2949130, 0, 2, 0, 0, 1, 1, 0, 1, 1, 0)], [t1.SYS_NC_mvi_arr_20=json_query(column_conv(JSON,PS:(-1,-1),NULL,'[123,222,333,444]'), '$[*]',
       2949130, 0, 2, 0, 0, 1, 1, 0, 1, 1, 1)])
  1 - output([t1.id], [t1.js], [json_query(t1.js, '$[*]', 2949130, 0, 2, 0, 0, 1, 1, 0, 1, 1, 0)], [json_query(t1.js, '$[*]', 2949130, 0, 2, 0, 0, 1, 1,
       0, 1, 1, 1)], [t1.regex
      access([t1.id], [t1.js], [t1.regex
      is_index_back=true, is_global_index=false, with_domain_id(doc_id), filter_before_indexback[false], 
      range_key([t1.SYS_NC_mvi_19], [t1.id], [t1.regex
update /*+ index(t1 idx1)*/ t1 set js = '[123,333,444]' where 123 member of(js->'$[*]');
explain update /*+ index(t1 idx1)*/ t1 set js = '[123,222,333,444]' where 123 member of(js->'$[*]');
Query Plan
======================================================
|ID|OPERATOR          |NAME    |EST.ROWS|EST.TIME(us)|
------------------------------------------------------
|0 |UPDATE            |        |2       |297         |
|1 |└─TABLE RANGE SCAN|t1(idx1)|2       |261         |
======================================================
Outputs & filters:
-------------------------------------
  0 - output(nil), filter(nil)
      table_columns([{t1: ({t1: (t1.id, t1.js, t1.regex
      update([t1.js=column_conv(JSON,PS:(-1,-1),NULL,'[123,222,333,444]')], [t1.SYS_NC_mvi_19=json_query(column_conv(JSON,PS:(-1,-1),NULL,'[123,222,333,
      444]'), '$[*]', 2949130, 0, 2, 0, 0, 1, 1, 0, 1, 1, 0)], [t1.SYS_NC_mvi_arr_20=json_query(column_conv(JSON,PS:(-1,-1),NULL,'[123,222,333,444]'), '$[*]',
       2949130, 0, 2, 0, 0, 1, 1, 0, 1, 1, 1)])
  1 - output([t1.id], [t1.js], [json_query(t1.js, '$[*]', 2949130, 0, 2, 0, 0, 1, 1, 0, 1, 1, 0)], [json_query(t1.js, '$[*]', 2949130, 0, 2, 0, 0, 1, 1,
       0, 1, 1, 1)], [t1.regex
      access([t1.id], [t1.js], [t1.regex
      is_index_back=true, is_global_index=false, with_domain_id(doc_id), filter_before_indexback[false], 
      range_key([t1.SYS_NC_mvi_19], [t1.id], [t1.regex
delete from t1 where id = 1;
delete from t1 where 222 member of (js->'$[*]');
explain delete from t1 where 222 member of (js->'$[*]');
Query Plan
======================================================
|ID|OPERATOR          |NAME    |EST.ROWS|EST.TIME(us)|
------------------------------------------------------
|0 |DELETE            |        |1       |99          |
|1 |└─TABLE RANGE SCAN|t1(idx1)|1       |90          |
======================================================
Outputs & filters:
-------------------------------------
  0 - 123
      123
  1 - 123
       2949130, 0, 2, 0, 0, 1, 1, 0, 1, 1, 1)]), filter([JSON_MEMBER_OF(222, JSON_EXTRACT(t1.js, '$[*]'))])
      123
      is_index_back=true, is_global_index=false, with_domain_id(doc_id), filter_before_indexback[false], 
      regex
delete /*+ index(t1 idx1) */ from t1 where 222 member of (js->'$[*]');
explain delete /*+ index(t1 idx1) */ from t1 where 222 member of (js->'$[*]');
Query Plan
======================================================
|ID|OPERATOR          |NAME    |EST.ROWS|EST.TIME(us)|
------------------------------------------------------
|0 |DELETE            |        |1       |99          |
|1 |└─TABLE RANGE SCAN|t1(idx1)|1       |90          |
======================================================
Outputs & filters:
-------------------------------------
  0 - 123
      123
  1 - 123
       2949130, 0, 2, 0, 0, 1, 1, 0, 1, 1, 1)]), filter([JSON_MEMBER_OF(222, JSON_EXTRACT(t1.js, '$[*]'))])
      123
      is_index_back=true, is_global_index=false, with_domain_id(doc_id), filter_before_indexback[false], 
      regex
select * from t1 order by id;
id	js
2	null
5	[]
6	{}
7	{"miao": [12312, 1231]}
10	[123, 333, 444]
11	NULL
12	null
15	[]
16	{}
17	{"miao": [12312, 1231]}
20	[123, 333, 444]
21	NULL
22	null
25	[]
26	{}
27	{"miao": [12312, 1231]}
30	[123, 333, 444]
drop table if exists t1;
create table t1 (id int primary key, js json);
alter table t1 add index idx1((cast(js->'$.score' as char(10) array)));
insert into t1 (id ,js) values (1,null);
insert into t1 (id ,js) values (2,'null');
insert into t1 (id ,js) values (3,true);
ERROR 22032: Invalid JSON text.
insert into t1 (id ,js) values (4,12312);
ERROR 22032: Invalid JSON text.
insert into t1 (id ,js) values (5,'[]');
insert into t1 (id ,js) values (6,'{}');
insert into t1 (id ,js) values (7,'{"miao":[12312,1231]}');
insert into t1 (id ,js) values (8,'["miao","zheng"]');
insert into t1 (id ,js) values (9,'{"score":"miao"}');
insert into t1 (id ,js) values (10,'{"score":123}');
insert into t1 (id ,js) values (12,'{"score":true}');
ERROR 42000: This version of MySQL doesn't yet support CAST-ing JSON BOOLEAN type to array
insert into t1 (id ,js) values (13,'{"score":{"miao":12321}}');
ERROR 42000: This version of MySQL doesn't yet support CAST-ing JSON OBJECT type to array
insert into t1 (id ,js) values (14,'{"score":["liu", "zhao"]}');
insert into t1 (id ,js) values (21,null) on duplicate  key update js = values (js);
insert into t1 (id ,js) values (22,'null') on duplicate  key update js = values (js);
insert into t1 (id ,js) values (23,true) on duplicate  key update js = values (js);
ERROR 22032: Invalid JSON text.
insert into t1 (id ,js) values (24,12312) on duplicate  key update js = values (js);
ERROR 22032: Invalid JSON text.
insert into t1 (id ,js) values (25,'[]') on duplicate  key update js = values (js);
insert into t1 (id ,js) values (26,'{}') on duplicate  key update js = values (js);
insert into t1 (id ,js) values (27,'{"miao":[12312,1231]}') on duplicate  key update js = values (js);
insert into t1 (id ,js) values (28,'["miao","zheng"]') on duplicate  key update js = values (js);
insert into t1 (id ,js) values (29,'{"score":"miao"}') on duplicate  key update js = values (js);
insert into t1 (id ,js) values (30,'{"score":123}') on duplicate  key update js = values (js);
insert into t1 (id ,js) values (32,'{"score":true}') on duplicate  key update js = values (js);
ERROR 42000: This version of MySQL doesn't yet support CAST-ing JSON BOOLEAN type to array
insert into t1 (id ,js) values (33,'{"score":{"miao":12321}}') on duplicate  key update js = values (js);
ERROR 42000: This version of MySQL doesn't yet support CAST-ing JSON OBJECT type to array
insert into t1 (id ,js) values (34,'{"score":["liu", "zhao"]}') on duplicate  key update js = values (js);
replace into t1 (id ,js) values (41,null);
replace into t1 (id ,js) values (42,'null');
replace into t1 (id ,js) values (43,true);
ERROR 22032: Invalid JSON text.
replace into t1 (id ,js) values (44,12312);
ERROR 22032: Invalid JSON text.
replace into t1 (id ,js) values (45,'[]');
replace into t1 (id ,js) values (46,'{}');
replace into t1 (id ,js) values (47,'{"miao":[12312,1231]}');
replace into t1 (id ,js) values (48,'["miao","zheng"]');
replace into t1 (id ,js) values (49,'{"score":"miao"}');
replace into t1 (id ,js) values (50,'{"score":123}');
replace into t1 (id ,js) values (52,'{"score":true}');
ERROR 42000: This version of MySQL doesn't yet support CAST-ing JSON BOOLEAN type to array
replace into t1 (id ,js) values (53,'{"score":{"miao":12321}}');
ERROR 42000: This version of MySQL doesn't yet support CAST-ing JSON OBJECT type to array
replace into t1 (id ,js) values (54,'{"score":["liu", "zhao"]}');
update t1 set js = null where id = 1 ;
update t1 set js = 'null' where id = 1 ;
update t1 set js = true where id = 1 ;
ERROR 22032: Invalid JSON text.
update t1 set js = 12312 where id = 1 ;
ERROR 22032: Invalid JSON text.
update t1 set js = '[]' where id = 1 ;
update t1 set js = '{}' where id = 1 ;
update t1 set js = '{"miao":[12312,1231]}' where id = 1 ;
update t1 set js = '["miao","zheng"]' where id = 1 ;
update t1 set js = '{"score":"miao"}' where id = 1 ;
update t1 set js = '{"score":123}' where id = 1 ;
update t1 set js = '{"score":true}' where id = 1 ;
ERROR 42000: This version of MySQL doesn't yet support CAST-ing JSON BOOLEAN type to array
update t1 set js = '{"score":{"miao":12321}}' where id = 1 ;
ERROR 42000: This version of MySQL doesn't yet support CAST-ing JSON OBJECT type to array
update t1 set js = '{"score":["liu", "zhao"]}' where id = 1 ;
update t1 set js = '{"score":["liu", "zhao","zheng"]}' where JSON_CONTAINS(js->'$.score',CAST('["liu"]' AS JSON));
explain update t1 set js = '{"score":["liu", "zhao","zheng"]}' where JSON_CONTAINS(js->'$.score',CAST('["liu"]' AS JSON));
Query Plan
======================================================
|ID|OPERATOR          |NAME    |EST.ROWS|EST.TIME(us)|
------------------------------------------------------
|0 |UPDATE            |        |2       |386         |
|1 |└─TABLE RANGE SCAN|t1(idx1)|2       |347         |
======================================================
Outputs & filters:
-------------------------------------
  0 - output(nil), filter(nil)
      table_columns([{t1: ({t1: (t1.id, t1.js, t1.regex
      update([t1.js=column_conv(JSON,PS:(-1,-1),NULL,'{\"score\":[\"liu\", \"zhao\",\"zheng\"]}')], [t1.SYS_NC_mvi_19=json_query(column_conv(JSON,PS:(-1,
      -1),NULL,'{\"score\":[\"liu\", \"zhao\",\"zheng\"]}'), '$.score', 42952622103, 0, 2, 0, 0, 1, 1, 0, 1, 1, 0)], [t1.SYS_NC_mvi_arr_20=json_query(column_conv(JSON,
      PS:(-1,-1),NULL,'{\"score\":[\"liu\", \"zhao\",\"zheng\"]}'), '$.score', 42952622103, 0, 2, 0, 0, 1, 1, 0, 1, 1, 1)])
  1 - output([t1.id], [t1.js], [json_query(t1.js, '$.score', 42952622103, 0, 2, 0, 0, 1, 1, 0, 1, 1, 0)], [json_query(t1.js, '$.score', 42952622103, 0, 
      2, 0, 0, 1, 1, 0, 1, 1, 1)], [t1.regex
      access([t1.id], [t1.js], [t1.regex
      is_index_back=true, is_global_index=false, with_domain_id(doc_id), filter_before_indexback[false], 
      range_key([t1.SYS_NC_mvi_19], [t1.id], [t1.regex
update /*+ index(t1 idx1)*/t1 set js = '{"score":["liu", "zhao","zheng"]}' where JSON_CONTAINS(js->'$.score',CAST('["liu"]' AS JSON));
explain update /*+ index(t1 idx1)*/t1 set js = '{"score":["liu", "zhao","zheng"]}' where JSON_CONTAINS(js->'$.score',CAST('["liu"]' AS JSON));
Query Plan
======================================================
|ID|OPERATOR          |NAME    |EST.ROWS|EST.TIME(us)|
------------------------------------------------------
|0 |UPDATE            |        |2       |386         |
|1 |└─TABLE RANGE SCAN|t1(idx1)|2       |347         |
======================================================
Outputs & filters:
-------------------------------------
  0 - output(nil), filter(nil)
      table_columns([{t1: ({t1: (t1.id, t1.js, t1.regex
      update([t1.js=column_conv(JSON,PS:(-1,-1),NULL,'{\"score\":[\"liu\", \"zhao\",\"zheng\"]}')], [t1.SYS_NC_mvi_19=json_query(column_conv(JSON,PS:(-1,
      -1),NULL,'{\"score\":[\"liu\", \"zhao\",\"zheng\"]}'), '$.score', 42952622103, 0, 2, 0, 0, 1, 1, 0, 1, 1, 0)], [t1.SYS_NC_mvi_arr_20=json_query(column_conv(JSON,
      PS:(-1,-1),NULL,'{\"score\":[\"liu\", \"zhao\",\"zheng\"]}'), '$.score', 42952622103, 0, 2, 0, 0, 1, 1, 0, 1, 1, 1)])
  1 - output([t1.id], [t1.js], [json_query(t1.js, '$.score', 42952622103, 0, 2, 0, 0, 1, 1, 0, 1, 1, 0)], [json_query(t1.js, '$.score', 42952622103, 0, 
      2, 0, 0, 1, 1, 0, 1, 1, 1)], [t1.regex
      access([t1.id], [t1.js], [t1.regex
      is_index_back=true, is_global_index=false, with_domain_id(doc_id), filter_before_indexback[false], 
      range_key([t1.SYS_NC_mvi_19], [t1.id], [t1.regex
explain select * from t1 where JSON_CONTAINS(js->'$.score',CAST('["liu"]' AS JSON));
Query Plan
====================================================
|ID|OPERATOR        |NAME    |EST.ROWS|EST.TIME(us)|
----------------------------------------------------
|0 |TABLE RANGE SCAN|t1(idx1)|2       |273         |
====================================================
Outputs & filters:
-------------------------------------
  0 - output([t1.id], [t1.js]), filter([JSON_CONTAINS(JSON_EXTRACT(t1.js, '$.score'), cast('[\"liu\"]', JSON(536870911)))])
      access([t1.id], [t1.js]), partitions(p0)
      is_index_back=true, is_global_index=false, filter_before_indexback[false], 
      range_key([t1.SYS_NC_mvi_19], [t1.id], [t1.regex
delete from t1 where JSON_CONTAINS(js->'$.score',CAST('["liu"]' AS JSON));
select * from t1;
id	js
2	null
5	[]
6	{}
7	{"miao": [12312, 1231]}
8	["miao", "zheng"]
9	{"score": "miao"}
10	{"score": 123}
21	NULL
22	null
25	[]
26	{}
27	{"miao": [12312, 1231]}
28	["miao", "zheng"]
29	{"score": "miao"}
30	{"score": 123}
41	NULL
42	null
45	[]
46	{}
47	{"miao": [12312, 1231]}
48	["miao", "zheng"]
49	{"score": "miao"}
50	{"score": 123}
drop table if exists t1;
create table t1 (id int , js json);
insert into t1 (id, js) values (1, null);
create index idx1 on t1 ((cast(js->'$[*][*]' as unsigned array)));
truncate table t1;
drop index idx1 on t1;
insert into t1 (id ,js) values (2,'null');
create index idx1 on t1 ((cast(js->'$[*][*]' as unsigned array)));
truncate table t1;
drop index idx1 on t1;
insert into t1 (id ,js) values (3,true);
ERROR 22032: Invalid JSON text.
create index idx1 on t1 ((cast(js->'$[*][*]' as unsigned array)));
truncate table t1;
drop index idx1 on t1;
insert into t1 (id ,js) values (4,12312);
ERROR 22032: Invalid JSON text.
create index idx1 on t1 ((cast(js->'$[*][*]' as unsigned array)));
truncate table t1;
drop index idx1 on t1;
insert into t1 (id ,js) values (5,'[]');
create index idx1 on t1 ((cast(js->'$[*][*]' as unsigned array)));
truncate table t1;
drop index idx1 on t1;
insert into t1 (id ,js) values (6,'{}');
create index idx1 on t1 ((cast(js->'$[*][*]' as unsigned array)));
truncate table t1;
drop index idx1 on t1;
insert into t1 (id ,js) values (7,'[{}]');
create index idx1 on t1 ((cast(js->'$[*][*]' as unsigned array)));
truncate table t1;
drop index idx1 on t1;
insert into t1 (id ,js) values (8,'["miao"]');
create index idx1 on t1 ((cast(js->'$[*][*]' as unsigned array)));
truncate table t1;
drop index idx1 on t1;
insert into t1 (id ,js) values (9,'[["miao"]]');
create index idx1 on t1 ((cast(js->'$[*][*]' as unsigned array)));
Got one of the listed errors
truncate table t1;
drop index idx1 on t1;
ERROR 42000: Can't DROP 'idx1'; check that column/key exists
insert into t1 (id ,js) values (10,'[[1232],[23,343],[123]]');
create index idx1 on t1 ((cast(js->'$[*][*]' as unsigned array)));
truncate table t1;
drop index idx1 on t1;
drop table if exists t1;
create table t1 (id int , js json);
insert into t1 (id, js) values (1,'[[111],[222,333]]') ,(2,'[[444],[555,666]]'),(3,'[[777],[888,999]]'),(4,'[[1234]]');
alter table t1 add index idx1((cast(js->'$[1]' as unsigned array)));
insert into t1 values (5,'[[123]]'),(6,'[[222],[32423]]');
insert into t1 values (7,'[[3453],[263]]') on duplicate key update js = values(js);
replace into t1 values (8,'[[111],[222]]');
select * from t1;
id	js
1	[[111], [222, 333]]
2	[[444], [555, 666]]
3	[[777], [888, 999]]
4	[[1234]]
5	[[123]]
6	[[222], [32423]]
7	[[3453], [263]]
8	[[111], [222]]
select * from t1 where JSON_OVERLAPS(js->>'$[1]', '[333]');
id	js
1	[[111], [222, 333]]
select * from t1 where JSON_OVERLAPS(js->>'$[1]', '[444]');
id	js
update t1 set js = '[[111]]' where id = 1;
update t1 set js = '[[111],[222,333]]' where id = 1;
delete from t1 limit 1;
delete from t1 where id = 2;
delete from t1 where JSON_OVERLAPS(js->>'$[1]', '[]');
drop table if exists t1;
create table t1 (id int AUTO_INCREMENT primary key, js json);
insert into t1 (id,js) values (1,'{"score":["2023-01-01","2024-01-01"]}'),(2,'{"score":["2023-02-01","2024-02-01"]}'),(3,'{"score":["2023-03-01","2024-03-01"]}'),(4,'{"score":["2023-04-01","2024-04-01"]}');
create /*+ ENABLE_PARALLEL_DML parallel(8) */index idx1 on t1((cast(js->'$.score' as date array)));
insert into t1(id,js) values (5,'{"score":["2025-01-01","2025-01-01"]}'),(6,'{"score":["2026-06-06","2026-06-07"]}');
insert into t1(id,js) values (5,'{"score":["2025-07-07"]}') on duplicate key update js = values(js);
insert into t1(id,js) values (7,'{"score":["2027-07-07","2027-06-07"]}') on duplicate key update js = values(js);
replace into t1 (id,js) values (6,'{"score":["2027-07-07"]}');
replace into t1 (id,js) values (8,'{"score":["2028-08-08","2028-08-09"]}');
select * from t1;
id	js
1	{"score": ["2023-01-01", "2024-01-01"]}
2	{"score": ["2023-02-01", "2024-02-01"]}
3	{"score": ["2023-03-01", "2024-03-01"]}
4	{"score": ["2023-04-01", "2024-04-01"]}
5	{"score": ["2025-07-07"]}
6	{"score": ["2027-07-07"]}
7	{"score": ["2027-07-07", "2027-06-07"]}
8	{"score": ["2028-08-08", "2028-08-09"]}
update t1 set js = '{"score":["2011-11-11"]}' where id = 1;
update t1 set js = json_set(js,'$.score[0]',"2011-11-11") where id = 2;
update t1 set js = json_set(js,'$.score[0]',"2011-11-11") where JSON_OVERLAPS(js->>'$.score', '["2023-03-01"]');
delete  from t1 where JSON_OVERLAPS(js->>'$.score', '["2023-04-01"]');
delete from t1 where id = 5;
select * from t1;
id	js
1	{"score": ["2011-11-11"]}
2	{"score": ["2011-11-11", "2024-02-01"]}
3	{"score": ["2011-11-11", "2024-03-01"]}
6	{"score": ["2027-07-07"]}
7	{"score": ["2027-07-07", "2027-06-07"]}
8	{"score": ["2028-08-08", "2028-08-09"]}
drop table if exists t1;
create table t1 (id int AUTO_INCREMENT primary key, js json);
insert into t1 (id, js) values (1,'[["11"],["12"],["13"]]'), (2,'[["21"],["22"],["23"]]'),(3,'[["31"],["32"],["33"]]');
alter /*+ ENABLE_PARALLEL_DML parallel(8) */ table t1 add index idx1((cast(js->'$[1 to 2]' as char(5) array)));
Got one of the listed errors
alter table t1 add index idx1((cast(js->'$[1 to 2]' as char(5) array)));
Got one of the listed errors
drop table if exists t1;
create table t1 (id int AUTO_INCREMENT primary key, js json);
insert into t1 (id, js) values (1,'{"score":["11"]}'), (2,'{"score":["22"]}'),(3,'{"score":["33"]}');
alter /*+ ENABLE_PARALLEL_DML parallel(8) */ table t1 add index idx1((cast(js->'$.score' as char(5) array)));
insert into t1 (id,js) values (4,'{"score":["44"]}'), (5,'{"score":["55"]}');
insert into t1 (id,js) values (4,'{"score":["66"]}') on duplicate key update js = values(js);
insert into t1 (id,js) values (6,'{"score":["66"]}') on duplicate key update js = values(js);
replace into t1 (id,js) values (5,'{"score":["77"]}');
replace into t1 (id,js) values (7,'{"score":["77"]}');
update t1 set js = '{"score":["100"]}' where JSON_CONTAINS(js->'$.score',CAST('["11"]' AS JSON));
update t1 set js = '{"score":["100"]}' where json_overlaps(js->'$.score', '["22"]');
update t1 set js = '{"score":["100"]}' where 33 member of(js->'$.score');
select /*+read_consistency(weak) */ * from t1;
id	js
1	{"score": ["100"]}
2	{"score": ["100"]}
3	{"score": ["33"]}
4	{"score": ["66"]}
5	{"score": ["77"]}
6	{"score": ["66"]}
7	{"score": ["77"]}
delete from t1 where JSON_CONTAINS(js->'$.score',CAST('["100"]' AS JSON));
delete from t1 where json_overlaps(js->'$.score', '["66"]');
delete from t1 where 77 member of(js->'$.score');
select /*+read_consistency(weak) */ * from t1;
id	js
3	{"score": ["33"]}
5	{"score": ["77"]}
7	{"score": ["77"]}
drop table if exists t1;
create table t1 (id int, name char(10), date1 date, js json, index idx1 (date1), unique index idx2(name));
insert into t1 (id, name , date1, js) values (1,"祭城超市", "2024-01-01", '["火锅丸子","酸奶"]'),(2,"金庄超市", "2025-01-01", '["火锅丸子","饼干"]'),(3,"庙张超市", "2026-01-01", '["辣条","水果"]');
create index idx3 on t1((cast(js->'$' as char(10) array)));
insert into t1 (id, name , date1, js) values (4,"文化产业大厦",'2024-03-01', '["可乐","雪碧"]'), (5,"绿地新都会",'2024-03-01', '["可乐","雪碧"]');
insert into t1 (id, name , date1, js) values (4,"文化产业大厦",'2024-03-01', '["果冻","馍片"]') on duplicate key update js = values(js);
insert into t1 (id, name , date1, js) values (6,"回忆银河里",'2024-03-01', '["果冻","馍片"]') on duplicate key update js = values(js);
replace into t1 (id, name , date1, js) values (5,"绿地新都会",'2024-03-01', '["果冻","馍片"]') ;
replace into t1 (id, name , date1, js) values (7,"郑州东站",'2024-03-01', '["果冻","馍片"]') ;
select /*+read_consistency(weak) */ * from t1;
id	name	date1	js
1	祭城超市	2024-01-01	["火锅丸子", "酸奶"]
2	金庄超市	2025-01-01	["火锅丸子", "饼干"]
3	庙张超市	2026-01-01	["辣条", "水果"]
4	文化产业大厦	2024-03-01	["果冻", "馍片"]
6	回忆银河里	2024-03-01	["果冻", "馍片"]
5	绿地新都会	2024-03-01	["果冻", "馍片"]
7	郑州东站	2024-03-01	["果冻", "馍片"]
update t1 set js = '["橙汁","茶"]' where JSON_CONTAINS(js->'$',CAST('["酸奶"]' AS JSON));
update t1 set js = '["橙汁","茶"]' where json_overlaps(js->'$', '["火锅丸子"]');
update t1 set js = '["橙汁","茶"]' where json_overlaps(js, '["辣条"]');
select /*+read_consistency(weak) */ * from t1;
id	name	date1	js
1	祭城超市	2024-01-01	["橙汁", "茶"]
2	金庄超市	2025-01-01	["橙汁", "茶"]
3	庙张超市	2026-01-01	["橙汁", "茶"]
4	文化产业大厦	2024-03-01	["果冻", "馍片"]
6	回忆银河里	2024-03-01	["果冻", "馍片"]
5	绿地新都会	2024-03-01	["果冻", "馍片"]
7	郑州东站	2024-03-01	["果冻", "馍片"]
delete from t1 where JSON_CONTAINS(js->'$',CAST('["果冻"]' AS JSON));
delete from t1 where json_overlaps(js->'$', '["橙汁","饮料"]');
select /*+read_consistency(weak) */ * from t1;
id	name	date1	js
drop table if exists t1;
create table t1 (id int AUTO_INCREMENT primary key, name char(10),js json, unique index idx2(name));
insert into t1 (id,name,js) values (1,'祭城超市','[11,12]'),(2,'文化产业大厦','[21,2888888]'),(3,'回忆银河里','[31,39999999]'),(4,'郑州东站','[4263526362,41]');
alter table t1 add index idx1((cast(js->'$' as unsigned array)));
insert into t1 (id,name,js) values (5,'绿地新都会','[51,55]'),(6,'七里河站','[66,676766]'),(7,'八里沟','[76,76666666]'),(8,'省骨科医院','[87,800000]');
insert into t1 (id, name,js) values (9,'石林', '[913213]') on duplicate key update js = values(js);
insert into t1 (id, name ,js) values (5,'安阳', '[51253512]')  on duplicate key update js = values(js);
insert into t1 (id, name ,js) values (6,'驻马店', '[62354623456]')  on duplicate key update js = (js);
insert into t1 (id, name ,js) values (7,'滑县', '[62354623456]')  on duplicate key update js = '[62354623456]';
insert into t1 (id, name ,js) values (1,'橙汁', '[121312312]')  on duplicate key update js = '["miao"]';
ERROR 42000: Invalid JSON value for CAST for functional index.
update t1 set js = '["miao"]' where name = '文化产业大厦';
ERROR 42000: Invalid JSON value for CAST for functional index.
explain select * from t1 where JSON_CONTAINS(js->'$',CAST('[39999999]' AS JSON));
Query Plan
====================================================
|ID|OPERATOR        |NAME    |EST.ROWS|EST.TIME(us)|
----------------------------------------------------
|0 |TABLE RANGE SCAN|t1(idx1)|1       |72          |
====================================================
Outputs & filters:
-------------------------------------
  0 - output([t1.id], [t1.name], [t1.js]), filter([JSON_CONTAINS(JSON_EXTRACT(t1.js, '$'), cast('[39999999]', JSON(536870911)))])
      access([t1.id], [t1.js], [t1.name]), partitions(p0)
      is_index_back=true, is_global_index=false, filter_before_indexback[false], 
      123
explain select * from t1 where json_overlaps(js->'$', '[4263526362]');
Query Plan
====================================================
|ID|OPERATOR        |NAME    |EST.ROWS|EST.TIME(us)|
----------------------------------------------------
|0 |TABLE RANGE SCAN|t1(idx1)|1       |72          |
====================================================
Outputs & filters:
-------------------------------------
  0 - output([t1.id], [t1.name], [t1.js]), filter([json_overlaps(JSON_EXTRACT(t1.js, '$'), '[4263526362]')])
      access([t1.id], [t1.js], [t1.name]), partitions(p0)
      is_index_back=true, is_global_index=false, filter_before_indexback[false], 
      123
explain select * from t1 where json_overlaps(js, '["辣条"]');
Query Plan
===============================================
|ID|OPERATOR       |NAME|EST.ROWS|EST.TIME(us)|
-----------------------------------------------
|0 |TABLE FULL SCAN|t1  |5       |221         |
===============================================
Outputs & filters:
-------------------------------------
  0 - output([t1.id], [t1.name], [t1.js]), filter([json_overlaps(t1.js, '[\"辣条\"]')]), rowset=16
      access([t1.id], [t1.js], [t1.name]), partitions(p0)
      is_index_back=false, is_global_index=false, filter_before_indexback[false], 
      range_key([t1.id]), range(MIN ; MAX)always true
drop table if exists t1;
create table t1 (id int AUTO_INCREMENT primary key, name char(10),js json, unique index idx2(name));
insert into t1 (id,name,js) values (1,'祭城超市','[11,12]'),(2,'文化产业大厦','[21,2888888]'),(3,'回忆银河里','[31,39999999]'),(4,'郑州东站','[4263526362,41]');
alter table t1 add index idx1((cast(js->'$' as unsigned array)));
insert into t1 (id,name,js) values (5,'绿地新都会','[51,55]'),(6,'七里河站','[66,676766]'),(7,'八里沟','[76,76666666]'),(8,'省骨科医院','[87,800000]');
insert into t1 (id, name ,js) values (9,'绿地新都会', '[51253512]')  on duplicate key update js = values(js);
insert into t1 (id, name ,js) values (10,'七里河站', '[62354623456]')  on duplicate key update js = (js);
insert into t1 (id, name ,js) values (11,'八里沟', '[112312312321]')  on duplicate key update js = '[34423423]';
insert into t1 (id, name ,js) values (12,'省骨科医院', '[62354623456]')  on duplicate key update js = '["maio"]';
ERROR 42000: Invalid JSON value for CAST for functional index.
explain delete from t1 where JSON_CONTAINS(js->'$',CAST('[62354623456]' AS JSON));
Query Plan
======================================================
|ID|OPERATOR          |NAME    |EST.ROWS|EST.TIME(us)|
------------------------------------------------------
|0 |DELETE            |        |1       |99          |
|1 |└─TABLE RANGE SCAN|t1(idx1)|1       |90          |
======================================================
Outputs & filters:
-------------------------------------
  0 - 123
      123
  1 - 123
       '$', 2949130, 0, 2, 0, 0, 1, 1, 0, 1, 1, 1)]), filter([JSON_CONTAINS(JSON_EXTRACT(t1.js, '$'), cast('[62354623456]', JSON(536870911)))])
      123
      is_index_back=true, is_global_index=false, with_domain_id(doc_id), filter_before_indexback[false], 
      123
delete from t1 where JSON_CONTAINS(js->'$',CAST('[62354623456]' AS JSON));
explain delete /*+ index(t1 idx1)*/ from t1 where JSON_CONTAINS(js->'$',CAST('[2888888]' AS JSON));
Query Plan
======================================================
|ID|OPERATOR          |NAME    |EST.ROWS|EST.TIME(us)|
------------------------------------------------------
|0 |DELETE            |        |1       |99          |
|1 |└─TABLE RANGE SCAN|t1(idx1)|1       |90          |
======================================================
Outputs & filters:
-------------------------------------
  0 - 123
      123
  1 - 123
       '$', 2949130, 0, 2, 0, 0, 1, 1, 0, 1, 1, 1)]), filter([JSON_CONTAINS(JSON_EXTRACT(t1.js, '$'), cast('[2888888]', JSON(536870911)))])
      123
      is_index_back=true, is_global_index=false, with_domain_id(doc_id), filter_before_indexback[false], 
      123
delete /*+ index(t1 idx1)*/ from t1 where JSON_CONTAINS(js->'$',CAST('[2888888]' AS JSON));
select /*+read_consistency(weak) */ * from t1;
id	name	js
1	祭城超市	[11, 12]
3	回忆银河里	[31, 39999999]
4	郑州东站	[4263526362, 41]
5	绿地新都会	[51253512]
6	七里河站	[66, 676766]
7	八里沟	[34423423]
8	省骨科医院	[87, 800000]
drop table if exists t1;
create table t1 (id int AUTO_INCREMENT primary key, name char(10),js json, unique index idx2(name));
insert into t1 (id,name,js) values (1,'祭城超市','[11,12]'),(2,'文化产业大厦','[21,2888888]'),(3,'回忆银河里','[31,39999999]'),(4,'郑州东站','[4263526362,41]');
alter table t1 add index idx1((cast(js->'$' as unsigned array)));
insert into t1 (id,name,js) values (5,'绿地新都会','[51,55]'),(6,'七里河站','[66,676766]'),(7,'八里沟','[76,76666666]'),(8,'省骨科医院','[87,800000]');
insert into t1 (id, name ,js) values (1,'祭城超市', '[21312312]')  on duplicate key update js = values(js);
insert into t1 (id, name ,js) values (2,'回忆银河里', '[1231313]')  on duplicate key update js = values(js);
insert into t1 (id, name ,js) values (4,'郑州东站', '[1231313]')  on duplicate key update js = '["miao"]';
ERROR 42000: Invalid JSON value for CAST for functional index.
select /*+read_consistency(weak) */ * from t1;
id	name	js
1	祭城超市	[21312312]
2	文化产业大厦	[1231313]
3	回忆银河里	[31, 39999999]
4	郑州东站	[4263526362, 41]
5	绿地新都会	[51, 55]
6	七里河站	[66, 676766]
7	八里沟	[76, 76666666]
8	省骨科医院	[87, 800000]
