alter system set _enable_add_fulltext_index_to_existing_table = true;
drop table if exists t1;
create table t1(id int AUTO_INCREMENT primary key ,name varchar(10),js json);
create index scores on t1((CAST(js->'$.score' AS UNSIGNED ARRAY)));
alter table t1 add index scores2((CAST(js->'$.score' AS UNSIGNED ARRAY)));
create unique index score3 on t1((CAST(js->'$.score' AS UNSIGNED ARRAY)));
alter table t1 add unique index score4 ((CAST(js->'$.score' AS UNSIGNED ARRAY)));
create  index score5 on t1(name,(CAST(js->'$.score' AS UNSIGNED ARRAY)));
alter table t1 add  index score6 (name,(CAST(js->'$.score' AS UNSIGNED ARRAY)));
create unique index score7 on t1(name,(CAST(js->'$.score' AS UNSIGNED ARRAY)));
alter table t1 add unique index score8 (name,(CAST(js->'$.score' AS UNSIGNED ARRAY)));
insert into t1(id,name,js) values (1,'li','{"score":[123,345]}'),(2,'mi','{"score":[88,99]}'),(3,'lc','{"score":[73467,0]}'),(4,'z','{"score":[273463,888]}');
show create table t1;
Table	Create Table
t1	CREATE TABLE `t1` (
  `id` int(11) NOT NULL AUTO_INCREMENT,
  `name` varchar(10) DEFAULT NULL,
  `js` json DEFAULT NULL,
  PRIMARY KEY (`id`),
  UNIQUE  INDEX `score3` ((json_query(`js`,'$.score' RETURNING unsigned WITHOUT ARRAY WRAPPER asis error on error null on empty null on mismatch))) BLOCK_SIZE 16384,
  UNIQUE  INDEX `score4` ((json_query(`js`,'$.score' RETURNING unsigned WITHOUT ARRAY WRAPPER asis error on error null on empty null on mismatch))) BLOCK_SIZE 16384,
  UNIQUE  INDEX `score7` (`name`, (json_query(`js`,'$.score' RETURNING unsigned WITHOUT ARRAY WRAPPER asis error on error null on empty null on mismatch))) BLOCK_SIZE 16384,
  UNIQUE  INDEX `score8` (`name`, (json_query(`js`,'$.score' RETURNING unsigned WITHOUT ARRAY WRAPPER asis error on error null on empty null on mismatch))) BLOCK_SIZE 16384,
  INDEX `scores` ((json_query(`js`,'$.score' RETURNING unsigned WITHOUT ARRAY WRAPPER asis error on error null on empty null on mismatch))) BLOCK_SIZE 16384,
  INDEX `scores2` ((json_query(`js`,'$.score' RETURNING unsigned WITHOUT ARRAY WRAPPER asis error on error null on empty null on mismatch))) BLOCK_SIZE 16384,
  INDEX `score5` (`name`, (json_query(`js`,'$.score' RETURNING unsigned WITHOUT ARRAY WRAPPER asis error on error null on empty null on mismatch))) BLOCK_SIZE 16384,
  INDEX `score6` (`name`, (json_query(`js`,'$.score' RETURNING unsigned WITHOUT ARRAY WRAPPER asis error on error null on empty null on mismatch))) BLOCK_SIZE 16384
) ORGANIZATION INDEX AUTO_INCREMENT = 5 AUTO_INCREMENT_MODE = 'ORDER' DEFAULT CHARSET = utf8mb4 ROW_FORMAT = DYNAMIC COMPRESSION = 'zstd_1.3.8' REPLICA_NUM = 1 BLOCK_SIZE = 16384 USE_BLOOM_FILTER = FALSE ENABLE_MACRO_BLOCK_BLOOM_FILTER = FALSE TABLET_SIZE = 134217728 PCTFREE = 0
drop table if exists t1;
create table t1(id int AUTO_INCREMENT primary key ,name varchar(10),js json);
insert into t1(id,name,js) values (1,'li','{"score":[123,345]}'),(2,'mi','{"score":[88,99]}'),(3,'lc','{"score":[73467,0]}'),(4,'z','{"score":[273463,888]}');
create index scores on t1((CAST(js->'$.score' AS UNSIGNED ARRAY)));
alter table t1 add index scores2((CAST(js->'$.score' AS UNSIGNED ARRAY)));
create unique index score3 on t1((CAST(js->'$.score' AS UNSIGNED ARRAY)));
alter table t1 add unique index score4 ((CAST(js->'$.score' AS UNSIGNED ARRAY)));
create  index score5 on t1(name,(CAST(js->'$.score' AS UNSIGNED ARRAY)));
alter table t1 add  index score6 (name,(CAST(js->'$.score' AS UNSIGNED ARRAY)));
create unique index score7 on t1(name,(CAST(js->'$.score' AS UNSIGNED ARRAY)));
alter table t1 add unique index score8 (name,(CAST(js->'$.score' AS UNSIGNED ARRAY)));
select id,js from t1 where JSON_CONTAINS(js->'$.score',CAST('[123]' AS JSON));
id	js
1	{"score": [123, 345]}
select id,js from t1 where JSON_CONTAINS(js->'$.score',CAST('[123,678]' AS JSON));
id	js
explain select id,js from t1 where JSON_CONTAINS(js->'$.score',CAST('[123,678]' AS JSON));
Query Plan
===============================================
|ID|OPERATOR       |NAME|EST.ROWS|EST.TIME(us)|
-----------------------------------------------
|0 |TABLE FULL SCAN|t1  |2       |100         |
===============================================
Outputs & filters:
-------------------------------------
  0 - output([t1.id], [t1.js]), filter([JSON_CONTAINS(JSON_EXTRACT(t1.js, '$.score'), cast('[123,678]', JSON(536870911)))]), rowset=16
      access([t1.id], [t1.js]), partitions(p0)
      is_index_back=false, is_global_index=false, filter_before_indexback[false], 
      123(MIN ; MAX)always true
drop table if exists t1;
create table t1(id int AUTO_INCREMENT primary key ,js json);
alter table t1 add index scores2((CAST(js->'$.score' AS DECIMAL ARRAY)));
create index scores on t1((CAST(js->'$.score' AS DECIMAL ARRAY)));
insert into t1(id,js) values (1,'{"score":[123.45,345]}'),(2,'{"score":[88,99]}'),(3,'{"score":[73467,0]}'),(4,'{"score":[273463,888]}');
show create table t1;
Table	Create Table
t1	CREATE TABLE `t1` (
  `id` int(11) NOT NULL AUTO_INCREMENT,
  `js` json DEFAULT NULL,
  PRIMARY KEY (`id`),
  INDEX `scores2` ((json_query(`js`,'$.score' RETURNING number(10,0) WITHOUT ARRAY WRAPPER asis error on error null on empty null on mismatch))) BLOCK_SIZE 16384,
  INDEX `scores` ((json_query(`js`,'$.score' RETURNING number(10,0) WITHOUT ARRAY WRAPPER asis error on error null on empty null on mismatch))) BLOCK_SIZE 16384
) ORGANIZATION INDEX AUTO_INCREMENT = 5 AUTO_INCREMENT_MODE = 'ORDER' DEFAULT CHARSET = utf8mb4 ROW_FORMAT = DYNAMIC COMPRESSION = 'zstd_1.3.8' REPLICA_NUM = 1 BLOCK_SIZE = 16384 USE_BLOOM_FILTER = FALSE ENABLE_MACRO_BLOCK_BLOOM_FILTER = FALSE TABLET_SIZE = 134217728 PCTFREE = 0
drop table if exists t1;
create table t1(id int AUTO_INCREMENT primary key ,js json);
insert into t1(id,js) values (1,'{"score":[123.45,345]}'),(2,'{"score":[88,99]}'),(3,'{"score":[73467,0]}'),(4,'{"score":[273463,888]}');
create index scores on t1((CAST(js->'$.score' AS DECIMAL ARRAY)));
alter table t1 add index scores2((CAST(js->'$.score' AS DECIMAL ARRAY)));
select id,js from t1 where JSON_CONTAINS(js->'$.score',CAST('[345]' AS JSON));
id	js
1	{"score": [123.45, 345]}
select id,js from t1 where JSON_CONTAINS(js->'$.score',CAST('[123.45]' AS JSON));
id	js
1	{"score": [123.45, 345]}
select id,js from t1 where JSON_CONTAINS(js->'$.score',CAST('[123,345]' AS JSON));
id	js
explain select id,js from t1 where JSON_CONTAINS(js->'$.score',CAST('[345,678]' AS JSON));
Query Plan
===============================================
|ID|OPERATOR       |NAME|EST.ROWS|EST.TIME(us)|
-----------------------------------------------
|0 |TABLE FULL SCAN|t1  |2       |100         |
===============================================
Outputs & filters:
-------------------------------------
  0 - output([t1.id], [t1.js]), filter([JSON_CONTAINS(JSON_EXTRACT(t1.js, '$.score'), cast('[345,678]', JSON(536870911)))]), rowset=16
      access([t1.id], [t1.js]), partitions(p0)
      is_index_back=false, is_global_index=false, filter_before_indexback[false], 
      123(MIN ; MAX)always true
drop table if exists t1;
create table t1(id int AUTO_INCREMENT primary key ,js json);
create index scores on t1((CAST(js->'$.score' AS DOUBLE ARRAY)));
alter table t1 add index scores2 ((CAST(js->'$.score' AS DOUBLE ARRAY)));
insert into t1(js) values ('{"score":[123,345.12]}');
show create table t1;
Table	Create Table
t1	CREATE TABLE `t1` (
  `id` int(11) NOT NULL AUTO_INCREMENT,
  `js` json DEFAULT NULL,
  PRIMARY KEY (`id`),
  INDEX `scores` ((json_query(`js`,'$.score' RETURNING double WITHOUT ARRAY WRAPPER asis error on error null on empty null on mismatch))) BLOCK_SIZE 16384,
  INDEX `scores2` ((json_query(`js`,'$.score' RETURNING double WITHOUT ARRAY WRAPPER asis error on error null on empty null on mismatch))) BLOCK_SIZE 16384
) ORGANIZATION INDEX AUTO_INCREMENT = 2 AUTO_INCREMENT_MODE = 'ORDER' DEFAULT CHARSET = utf8mb4 ROW_FORMAT = DYNAMIC COMPRESSION = 'zstd_1.3.8' REPLICA_NUM = 1 BLOCK_SIZE = 16384 USE_BLOOM_FILTER = FALSE ENABLE_MACRO_BLOCK_BLOOM_FILTER = FALSE TABLET_SIZE = 134217728 PCTFREE = 0
drop table if exists t1;
create table t1(id int AUTO_INCREMENT primary key ,js json);
insert into t1(js) values ('{"score":[123,345.12]}');
alter table t1 add index scores2 ((CAST(js->'$.score' AS DOUBLE ARRAY)));
create index scores on t1((CAST(js->'$.score' AS DOUBLE ARRAY)));
select id,js from t1 where JSON_CONTAINS(js->'$.score',CAST('[123]' AS JSON));
id	js
1	{"score": [123, 345.12]}
select id,js from t1 where JSON_CONTAINS(js->'$.score',CAST('[345.12]' AS JSON));
id	js
1	{"score": [123, 345.12]}
select id,js from t1 where JSON_CONTAINS(js->'$.score',CAST('[123,678]' AS JSON));
id	js
explain select id,js from t1 where JSON_CONTAINS(js->'$.score',CAST('[123,678]' AS JSON));
Query Plan
===============================================
|ID|OPERATOR       |NAME|EST.ROWS|EST.TIME(us)|
-----------------------------------------------
|0 |TABLE FULL SCAN|t1  |1       |27          |
===============================================
Outputs & filters:
-------------------------------------
  0 - output([t1.id], [t1.js]), filter([JSON_CONTAINS(JSON_EXTRACT(t1.js, '$.score'), cast('[123,678]', JSON(536870911)))]), rowset=16
      access([t1.id], [t1.js]), partitions(p0)
      is_index_back=false, is_global_index=false, filter_before_indexback[false], 
      123(MIN ; MAX)always true
drop table if exists t2;
create table t2(id int AUTO_INCREMENT primary key ,js json);
alter table t2 add index scores2((CAST(js->'$.score' AS DATE ARRAY)));
create index scores on t2((CAST(js->'$.score' AS DATE ARRAY)));
insert into t2(js) values ('{"score":["2024-01-01"]}'),('{"score":["2024-02-01"]}'), ('{"score":["2024-03-01"]}'), ('{"score":["2024-04-01"]}');
show create table t2;
Table	Create Table
t2	CREATE TABLE `t2` (
  `id` int(11) NOT NULL AUTO_INCREMENT,
  `js` json DEFAULT NULL,
  PRIMARY KEY (`id`),
  INDEX `scores2` ((json_query(`js`,'$.score' RETURNING date WITHOUT ARRAY WRAPPER asis error on error null on empty null on mismatch))) BLOCK_SIZE 16384,
  INDEX `scores` ((json_query(`js`,'$.score' RETURNING date WITHOUT ARRAY WRAPPER asis error on error null on empty null on mismatch))) BLOCK_SIZE 16384
) ORGANIZATION INDEX AUTO_INCREMENT = 5 AUTO_INCREMENT_MODE = 'ORDER' DEFAULT CHARSET = utf8mb4 ROW_FORMAT = DYNAMIC COMPRESSION = 'zstd_1.3.8' REPLICA_NUM = 1 BLOCK_SIZE = 16384 USE_BLOOM_FILTER = FALSE ENABLE_MACRO_BLOCK_BLOOM_FILTER = FALSE TABLET_SIZE = 134217728 PCTFREE = 0
drop table if exists t2;
create table t2(id int AUTO_INCREMENT primary key ,js json);
insert into t2(js) values ('{"score":["2024-01-01"]}'),('{"score":["2024-02-01"]}'), ('{"score":["2024-03-01"]}'), ('{"score":["2024-04-01"]}');
create index scores on t2((CAST(js->'$.score' AS DATE ARRAY)));
alter table t2 add index scores2((CAST(js->'$.score' AS DATE ARRAY)));
select id,js from t2 where JSON_CONTAINS(js->'$.score',CAST('["2024-01-01"]' AS JSON));
id	js
1	{"score": ["2024-01-01"]}
drop table if exists t2;
create table t2(id int AUTO_INCREMENT primary key ,js json);
create index scores on t2((CAST(js->'$.score' AS char(50) ARRAY)));
alter table t2 add index scores2((CAST(js->'$.score' AS char(50) ARRAY)));
show create table t2;
Table	Create Table
t2	CREATE TABLE `t2` (
  `id` int(11) NOT NULL AUTO_INCREMENT,
  `js` json DEFAULT NULL,
  PRIMARY KEY (`id`),
  INDEX `scores` ((json_query(`js`,'$.score' RETURNING char(50) charset utf8mb4 WITHOUT ARRAY WRAPPER asis error on error null on empty null on mismatch))) BLOCK_SIZE 16384,
  INDEX `scores2` ((json_query(`js`,'$.score' RETURNING char(50) charset utf8mb4 WITHOUT ARRAY WRAPPER asis error on error null on empty null on mismatch))) BLOCK_SIZE 16384
) ORGANIZATION INDEX AUTO_INCREMENT = 1 AUTO_INCREMENT_MODE = 'ORDER' DEFAULT CHARSET = utf8mb4 ROW_FORMAT = DYNAMIC COMPRESSION = 'zstd_1.3.8' REPLICA_NUM = 1 BLOCK_SIZE = 16384 USE_BLOOM_FILTER = FALSE ENABLE_MACRO_BLOCK_BLOOM_FILTER = FALSE TABLET_SIZE = 134217728 PCTFREE = 0
drop table if exists t2;
create table t2(id int AUTO_INCREMENT primary key ,js json);
insert into t2(js) values ('{"score":["miao","zhuang"]}'),('{"score":["liu","xue"]}'),('{"score":["wen","zshy"]}');
alter table t2 add index scores2((CAST(js->'$.score' AS char(50) ARRAY)));
create index scores on t2((CAST(js->'$.score' AS char(50) ARRAY)));
select id,js from t2 where JSON_CONTAINS(js->'$.score',CAST('["miao"]' AS JSON));
id	js
1	{"score": ["miao", "zhuang"]}
select id,js from t2 where JSON_CONTAINS(js->'$.score',CAST('["zhuang","liu"]' AS JSON));
id	js
select id,js from t2 where JSON_CONTAINS(js->'$.score',CAST('["miao","zhuang"]' AS JSON));
id	js
1	{"score": ["miao", "zhuang"]}
explain select id,js from t2 where JSON_CONTAINS(js->'$.score',CAST('["miao","zhuang"]' AS JSON));
Query Plan
===============================================
|ID|OPERATOR       |NAME|EST.ROWS|EST.TIME(us)|
-----------------------------------------------
|0 |TABLE FULL SCAN|t2  |2       |75          |
===============================================
Outputs & filters:
-------------------------------------
  0 - output([t2.id], [t2.js]), filter([JSON_CONTAINS(JSON_EXTRACT(t2.js, '$.score'), cast('[\"miao\",\"zhuang\"]', JSON(536870911)))]), rowset=16
      access([t2.id], [t2.js]), partitions(p0)
      is_index_back=false, is_global_index=false, filter_before_indexback[false], 
      123(MIN ; MAX)always true
drop table if exists t2;
create table t2(id int AUTO_INCREMENT primary key ,js json);
alter table t2 add index scores2((CAST(js->'$.score' AS BINARY(500) ARRAY)));
create index scores on t2((CAST(js->'$.score' AS BINARY(500) ARRAY)));
show create table t2;
Table	Create Table
t2	CREATE TABLE `t2` (
  `id` int(11) NOT NULL AUTO_INCREMENT,
  `js` json DEFAULT NULL,
  PRIMARY KEY (`id`),
  INDEX `scores2` ((json_query(`js`,'$.score' RETURNING char(500) charset binary WITHOUT ARRAY WRAPPER asis error on error null on empty null on mismatch))) BLOCK_SIZE 16384,
  INDEX `scores` ((json_query(`js`,'$.score' RETURNING char(500) charset binary WITHOUT ARRAY WRAPPER asis error on error null on empty null on mismatch))) BLOCK_SIZE 16384
) ORGANIZATION INDEX AUTO_INCREMENT = 1 AUTO_INCREMENT_MODE = 'ORDER' DEFAULT CHARSET = utf8mb4 ROW_FORMAT = DYNAMIC COMPRESSION = 'zstd_1.3.8' REPLICA_NUM = 1 BLOCK_SIZE = 16384 USE_BLOOM_FILTER = FALSE ENABLE_MACRO_BLOCK_BLOOM_FILTER = FALSE TABLET_SIZE = 134217728 PCTFREE = 0
drop table if exists t2;
create table t2(id int AUTO_INCREMENT primary key ,js json);
insert into t2(js) values ('{"score":["miao","zhuang"]}'),('{"score":["zu","liu"]}'),('{"score":[12312,true]}');
create index scores on t2((CAST(js->'$.score' AS BINARY(500) ARRAY)));
alter table t2 add index scores2((CAST(js->'$.score' AS BINARY(500) ARRAY)));
select id,js from t2 where JSON_CONTAINS(js->'$.score',CAST('["miao"]' AS JSON));
id	js
1	{"score": ["miao", "zhuang"]}
select id,js from t2 where JSON_CONTAINS(js->'$.score',CAST('["zhuang","liu"]' AS JSON));
id	js
select id,js from t2 where JSON_CONTAINS(js->'$.score',CAST('["miao","zhuang"]' AS JSON));
id	js
1	{"score": ["miao", "zhuang"]}
explain select id,js from t2 where JSON_CONTAINS(js->'$.score',CAST('["miao","zhuang"]' AS JSON));
Query Plan
===============================================
|ID|OPERATOR       |NAME|EST.ROWS|EST.TIME(us)|
-----------------------------------------------
|0 |TABLE FULL SCAN|t2  |2       |75          |
===============================================
Outputs & filters:
-------------------------------------
  0 - output([t2.id], [t2.js]), filter([JSON_CONTAINS(JSON_EXTRACT(t2.js, '$.score'), cast('[\"miao\",\"zhuang\"]', JSON(536870911)))]), rowset=16
      access([t2.id], [t2.js]), partitions(p0)
      is_index_back=false, is_global_index=false, filter_before_indexback[false], 
      123(MIN ; MAX)always true
drop table if exists t4;
create table t4(id int AUTO_INCREMENT primary key ,js json);
insert into t4(js) values ('{"socre":[1,2,3,4,5]}');
create index scores on t4((CAST(js->'$.score' AS UNSIGNED ARRAY)));
alter table t4 drop index scores;
insert into t4(js) values ('{"score":{"miao":123}}');
drop table if exists t5;
create table t5(id int AUTO_INCREMENT primary key ,js json);
insert into t5(js) values ('{"socre":[]}');
create index scores on t5((CAST(js->'$.score' AS UNSIGNED ARRAY)));
show create table t5;
Table	Create Table
t5	CREATE TABLE `t5` (
  `id` int(11) NOT NULL AUTO_INCREMENT,
  `js` json DEFAULT NULL,
  PRIMARY KEY (`id`),
  INDEX `scores` ((json_query(`js`,'$.score' RETURNING unsigned WITHOUT ARRAY WRAPPER asis error on error null on empty null on mismatch))) BLOCK_SIZE 16384
) ORGANIZATION INDEX AUTO_INCREMENT = 2 AUTO_INCREMENT_MODE = 'ORDER' DEFAULT CHARSET = utf8mb4 ROW_FORMAT = DYNAMIC COMPRESSION = 'zstd_1.3.8' REPLICA_NUM = 1 BLOCK_SIZE = 16384 USE_BLOOM_FILTER = FALSE ENABLE_MACRO_BLOCK_BLOOM_FILTER = FALSE TABLET_SIZE = 134217728 PCTFREE = 0
drop table if exists t6;
create table t6(id int AUTO_INCREMENT primary key ,js json);
insert into t6(js) values ('{"score":{}}');
BUG 提示不明显
create index scores on t6((CAST(js->'$.score' AS UNSIGNED ARRAY)));
Got one of the listed errors
drop table if exists t7;
create table t7(id int AUTO_INCREMENT primary key ,js json);
insert into t7(js) values ('{"score":{"miao":123}}');
BUG 提示不明显
create index scores on t7((CAST(js->'$.score' AS UNSIGNED ARRAY)));
Got one of the listed errors
drop table if exists t8;
create table t8(id int AUTO_INCREMENT primary key ,js json);
insert into t8(js) values ('{"score":true}');
不兼容mysql
create index scores on t8((CAST(js->'$.score' AS UNSIGNED ARRAY)));
drop table if exists t9;
create table t9(id int AUTO_INCREMENT primary key ,js json);
insert into t9(js) values ('123');
create index scores on t9((CAST(js->'$.score' AS UNSIGNED ARRAY)));
drop table if exists t9;
create table t9(id int AUTO_INCREMENT primary key ,js json);
insert into t9(js) values ('"miao"');
create index scores on t9((CAST(js->'$.score' AS UNSIGNED ARRAY)));
drop table if exists t10;
create table t10 (id int AUTO_INCREMENT primary key , js json);
insert into t10(js) values ('"miao"');
create index scores on t10((CAST(js->'$.score' AS UNSIGNED ARRAY)));
truncate table t10;
drop index scores on t10;
insert into t10(js) values ('1234');
alter table t10 add index scores((CAST(js->'$.score' AS UNSIGNED ARRAY)));
truncate table t10;
drop index scores on t10;
insert into t10(js) values ('{}');
create index scores on t10((CAST(js->'$.score' AS UNSIGNED ARRAY)));
truncate table t10;
alter table t10 drop index scores;
insert into t10(js) values ( '{"score":123}');
alter table t10 add index scores((CAST(js->'$.score' AS UNSIGNED ARRAY)));
truncate table t10;
drop index scores on t10;
insert into t10(js) values ( '{"score":"maio"}');
BUG 提示不明显
create index scores on t10((CAST(js->'$.score' AS UNSIGNED ARRAY)));
Got one of the listed errors
truncate table t10;
insert into t10(js) values ( '{"key":123}');
alter table t10 add index scores((CAST(js->'$.score' AS UNSIGNED ARRAY)));
truncate table t10;
drop index scores on t10;
insert into t10(js) values ( '[]');
create index scores on t10((CAST(js->'$.score' AS UNSIGNED ARRAY)));
truncate table t10;
alter table t10 drop index scores;
insert into t10(js) values ( '[123,234]');
alter table t10 add index scores((CAST(js->'$.score' AS UNSIGNED ARRAY)));
truncate table t10;
drop index scores on t10;
insert into t10(js) values ('true');
create index scores on t10((CAST(js->'$.score' AS UNSIGNED ARRAY)));
truncate table t10;
drop index scores on t10;
drop table if exists t11;
create table t11(id int AUTO_INCREMENT primary key , js json);
create index scores1 on t11((CAST(js->'$.*' AS UNSIGNED ARRAY)));
insert into t11(js) values ('{1,344}');
ERROR 22032: Invalid JSON text.
insert into t11(js) values ('{}');
insert into t11(js) values ('[]');
insert into t11(js) values ('{"miao"}');
ERROR 22032: Invalid JSON text.
insert into t11(js) values ('[123]');
insert into t11(js) values ('{"miao":"miao"}');
ERROR 42000: Invalid JSON value for CAST for functional index.
insert into t11(js) values ('{"miao":1111,"zhuang":234,"hua":238}');
explain select * from t11 where 1111 member of(js->'$.*');
Query Plan
========================================================
|ID|OPERATOR        |NAME        |EST.ROWS|EST.TIME(us)|
--------------------------------------------------------
|0 |TABLE RANGE SCAN|t11(scores1)|1       |72          |
========================================================
Outputs & filters:
-------------------------------------
  0 - output([t11.id], [t11.js]), filter([JSON_MEMBER_OF(1111, JSON_EXTRACT(t11.js, '$.*'))])
      access([t11.id], [t11.js]), partitions(p0)
      is_index_back=true, is_global_index=false, filter_before_indexback[false], 
      123(1111,MIN,MIN ; 1111,MAX,MAX)
insert into t11(js) values ('{"score":[]}');
ERROR 42000: Cannot store an array or an object in a scalar key part of the index.
insert into t11(js) values ('{"score":[1111,2222]}');
ERROR 42000: Cannot store an array or an object in a scalar key part of the index.
drop table if exists t11;
create table t11(id int AUTO_INCREMENT primary key , js json);
create index scores2 on t11((CAST(js->'$.score' AS UNSIGNED ARRAY)));
insert into t11(js) values (null);
insert into t11(js) values ('{}');
insert into t11(js) values ('[]');
insert into t11(js) values ('[1234,344]');
insert into t11(js) values ('{"tags":123}');
insert into t11(js) values ('{"score":"miao"}');
ERROR 42000: Invalid JSON value for CAST for functional index.
insert into t11(js) values ('{"score":{}}');
ERROR 42000: This version of MySQL doesn't yet support CAST-ing JSON OBJECT type to array
insert into t11(js) values ('{"score":[]}');
insert into t11(js) values ('{"score":{"zheng":123}}');
ERROR 42000: This version of MySQL doesn't yet support CAST-ing JSON OBJECT type to array
insert into t11(js) values ('{"score":[1111,2222]}');
explain select * from t11 where 1111 member of(js->'$.score');
Query Plan
========================================================
|ID|OPERATOR        |NAME        |EST.ROWS|EST.TIME(us)|
--------------------------------------------------------
|0 |TABLE RANGE SCAN|t11(scores2)|1       |72          |
========================================================
Outputs & filters:
-------------------------------------
  0 - output([t11.id], [t11.js]), filter([JSON_MEMBER_OF(1111, JSON_EXTRACT(t11.js, '$.score'))])
      access([t11.id], [t11.js]), partitions(p0)
      is_index_back=true, is_global_index=false, filter_before_indexback[false], 
      123(1111,MIN,MIN ; 1111,MAX,MAX)
drop table if exists t11;
create table t11(id int AUTO_INCREMENT primary key , js json);
create index scores2 on t11((CAST(js->'$[*]' AS UNSIGNED ARRAY)));
insert into t11(js) values (null);
insert into t11(js) values ('{}');
insert into t11(js) values ('[]');
insert into t11(js) values ('["miao", true,12312]');
ERROR 42000: Invalid JSON value for CAST for functional index.
insert into t11(js) values ('[ true,12312]');
insert into t11(js) values ('[ 23432,12312]');
insert into t11(js) values ('123123');
insert into t11(js) values ('"miao"');
insert into t11(js) values ('123123');
insert into t11(js) values ('true');
explain select * from t11 where 23432 member of(js->'$[*]');
Query Plan
========================================================
|ID|OPERATOR        |NAME        |EST.ROWS|EST.TIME(us)|
--------------------------------------------------------
|0 |TABLE RANGE SCAN|t11(scores2)|1       |72          |
========================================================
Outputs & filters:
-------------------------------------
  0 - output([t11.id], [t11.js]), filter([JSON_MEMBER_OF(23432, JSON_EXTRACT(t11.js, '$[*]'))])
      access([t11.id], [t11.js]), partitions(p0)
      is_index_back=true, is_global_index=false, filter_before_indexback[false], 
      123(23432,MIN,MIN ; 23432,MAX,MAX)
drop table if exists t11;
create table t11(id int AUTO_INCREMENT primary key , js json);
create index scores3 on t11((CAST(js->'$[*][*]' AS UNSIGNED ARRAY)));
insert into t11(js) values ('null');
insert into t11(js) values ('{}');
insert into t11(js) values ('[]');
insert into t11(js) values ('true');
insert into t11(js) values ('12321');
insert into t11(js) values ('"miao"');
insert into t11(js) values ('{"miao":12312}');
insert into t11(js) values ('[12312,"miao", true]');
insert into t11(js) values ('[12312,[21312,32121], true]');
insert into t11(js) values ('[12312,["miao","zheng"], true]');
ERROR 42000: Invalid JSON value for CAST for functional index.
explain select * from t11 where 23432 member of(js->'$[*]');
Query Plan
===============================================
|ID|OPERATOR       |NAME|EST.ROWS|EST.TIME(us)|
-----------------------------------------------
|0 |TABLE FULL SCAN|t11 |5       |221         |
===============================================
Outputs & filters:
-------------------------------------
  0 - output([t11.id], [t11.js]), filter([JSON_MEMBER_OF(23432, JSON_EXTRACT(t11.js, '$[*]'))]), rowset=16
      access([t11.id], [t11.js]), partitions(p0)
      is_index_back=false, is_global_index=false, filter_before_indexback[false], 
      123(MIN ; MAX)always true
explain select * from t11 where 23432 member of(js->'$[*][*]');
Query Plan
========================================================
|ID|OPERATOR        |NAME        |EST.ROWS|EST.TIME(us)|
--------------------------------------------------------
|0 |TABLE RANGE SCAN|t11(scores3)|1       |72          |
========================================================
Outputs & filters:
-------------------------------------
  0 - output([t11.id], [t11.js]), filter([JSON_MEMBER_OF(23432, JSON_EXTRACT(t11.js, '$[*][*]'))])
      access([t11.id], [t11.js]), partitions(p0)
      is_index_back=true, is_global_index=false, filter_before_indexback[false], 
      123(23432,MIN,MIN ; 23432,MAX,MAX)
drop table if exists t11;
create table t11(id int AUTO_INCREMENT primary key , js json);
create index scores2 on t11((CAST(js->'$[1]' AS UNSIGNED ARRAY)));
insert into t11(js) values ('null');
insert into t11(js) values ('{}');
insert into t11(js) values ('[]');
insert into t11(js) values ('[[12312],[123123,12312], [1212]]');
insert into t11(js) values ('[122212]');
explain select * from t11 where 23432 member of(js->'$[0]');
Query Plan
===============================================
|ID|OPERATOR       |NAME|EST.ROWS|EST.TIME(us)|
-----------------------------------------------
|0 |TABLE FULL SCAN|t11 |3       |124         |
===============================================
Outputs & filters:
-------------------------------------
  0 - output([t11.id], [t11.js]), filter([JSON_MEMBER_OF(23432, JSON_EXTRACT(t11.js, '$[0]'))]), rowset=16
      access([t11.id], [t11.js]), partitions(p0)
      is_index_back=false, is_global_index=false, filter_before_indexback[false], 
      range_key([t11.id]), range(MIN ; MAX)always true
explain select * from t11 where 23432 member of(js->'$[1]');
Query Plan
========================================================
|ID|OPERATOR        |NAME        |EST.ROWS|EST.TIME(us)|
--------------------------------------------------------
|0 |TABLE RANGE SCAN|t11(scores2)|1       |72          |
========================================================
Outputs & filters:
-------------------------------------
  0 - output([t11.id], [t11.js]), filter([JSON_MEMBER_OF(23432, JSON_EXTRACT(t11.js, '$[1]'))])
      access([t11.id], [t11.js]), partitions(p0)
      is_index_back=true, is_global_index=false, filter_before_indexback[false], 
      123(23432,MIN,MIN ; 23432,MAX,MAX)
explain select * from t11 where 23432 member of(js->'$[*]');
Query Plan
===============================================
|ID|OPERATOR       |NAME|EST.ROWS|EST.TIME(us)|
-----------------------------------------------
|0 |TABLE FULL SCAN|t11 |3       |124         |
===============================================
Outputs & filters:
-------------------------------------
  0 - output([t11.id], [t11.js]), filter([JSON_MEMBER_OF(23432, JSON_EXTRACT(t11.js, '$[*]'))]), rowset=16
      access([t11.id], [t11.js]), partitions(p0)
      is_index_back=false, is_global_index=false, filter_before_indexback[false], 
      range_key([t11.id]), range(MIN ; MAX)always true
drop table if exists t1;
create table t1 (id int primary key, name char(10), js1 json,js2 json);
insert into t1 (id,name,js1,js2) values (1,'祭城超市','[1232332,173467623]','["橙汁","可乐"]'),(2,'金庄超市','[1232332,173467623]','["薯片","饼干"]'),(3,'庙张超市','[32736,31823672]','["橙汁","可乐"]');
create unique index idx1 on t1 ((cast(js1->'$[*]' as unsigned array)));
ERROR 23000: Duplicated primary key
alter table t1 add unique index idx2 ((cast(js2->'$[*]' as char(10) array)));
ERROR 23000: Duplicated primary key
drop table if exists t1;
create table t1 (id int primary key, name char(10), date1 date, js1 json,js2 json,js3 json,js4 json);
insert into t1 (id,name ,date1,js1,js2,js3,js4) values (1,'祭城超市',"2021-04-04", '[12312,12342343]','["橙汁","可乐"]','{"score":["2024-04-04"]}','[[-10,10]]');
insert into t1 (id,name ,date1,js1,js2,js3,js4) values (2,'金庄超市',"2022-04-04", '[2127362,271263]','["薯片","饼干"]','{"score":["2025-05-05"]}','[[-20,20]]');
insert into t1 (id,name ,date1,js1,js2,js3,js4) values (3,'庙张超市',"2023-04-04", '[312,3723622323]','["茶叶","咖啡"]','{"score":["2026-06-06"]}','[[-30,30]]');
create index idx1 on t1 ((cast(js1->'$' as unsigned array)));
alter table t1 add index idx2(date1,(cast(js2->'$[*]' as char(10) array)));
create unique index idx3 on t1 ((cast(js3->'$.score' as date array)));
alter table t1 add unique index idx4(name , (cast(js4->'$[*][*]' as signed array)));
insert into t1 (id,name ,date1,js1,js2,js3,js4) values (4,'郑州东站',"2024-04-04", '[42343112,43]','["汽车","客车"]','{"score":["2027-05-05"]}','[[-50,50]]');
insert into t1 (id,name ,date1,js1,js2,js3,js4) values (5,'火车站',"2025-04-04", '[5123412,54]','["挂车","大挂"]','{"score":["2028-06-06"]}','[[-60,60]]') on duplicate key update js1 = '[5123412,54]',js2 = '["挂车","大挂"]',js3 = '{"score":["2026-06-06"]}',js4 = '[[-60,60]]';
insert into t1 (id,name ,date1,js1,js2,js3,js4) values (1,'折扣牛',"2026-04-04", '[6123412,64]','["挂车","大挂"]','{"score":["2029-06-06"]}','[[-60,60]]') on duplicate key update js1 = '[5374673,54]',js2 = '["加湿器","苹果"]',js3 = values(js3),js4 = js4;
replace into t1 (id,name ,date1,js1,js2,js3,js4) values (6,'折扣牛',"2027-04-04", '[6123412,64]','["挂车","大挂"]','{"score":["2026-06-06"]}','[[-60,60]]');
replace into t1 (id,name ,date1,js1,js2,js3,js4) values (2,'折扣牛',"2028-04-04", '[6123412,64]','["挂车","大挂"]','{"score":["2026-06-06"]}','[[-60,60]]');
select /*+read_consistency(weak) */ * from t1;
id	name	date1	js1	js2	js3	js4
1	祭城超市	2021-04-04	[5374673, 54]	["加湿器", "苹果"]	{"score": ["2029-06-06"]}	[[-10, 10]]
2	折扣牛	2028-04-04	[6123412, 64]	["挂车", "大挂"]	{"score": ["2026-06-06"]}	[[-60, 60]]
4	郑州东站	2024-04-04	[42343112, 43]	["汽车", "客车"]	{"score": ["2027-05-05"]}	[[-50, 50]]
5	火车站	2025-04-04	[5123412, 54]	["挂车", "大挂"]	{"score": ["2028-06-06"]}	[[-60, 60]]
update t1 set js1 = values(js1),js2 = js1,js3 = values(js2),js4 = '[[-100],[100]]' where id = 3;
update t1 set js1 = values(js1),js2 = js1,js3 = values(js2),js4 = '[[-100],[100]]' where JSON_CONTAINS(js1->'$[*]',CAST('["6123412"]' AS JSON));
update t1 set js1 = '[26153512,12763612]',js2 = js2,js3 = values(js3),js4 = '[[-100],[100]]' where json_overlaps(js2->'$', '["挂车"]');
update t1 set js1 = '[26153512,12763612]',js2 = js2,js3 = values(js3),js4 = '[[-100],[100]]' where "2026-06-06" member of (js3->'$.score');
select /*+read_consistency(weak) */ * from t1;
id	name	date1	js1	js2	js3	js4
1	祭城超市	2021-04-04	[5374673, 54]	["加湿器", "苹果"]	{"score": ["2029-06-06"]}	[[-10, 10]]
2	折扣牛	2028-04-04	[26153512, 12763612]	["挂车", "大挂"]	NULL	[[-100], [100]]
4	郑州东站	2024-04-04	[42343112, 43]	["汽车", "客车"]	{"score": ["2027-05-05"]}	[[-50, 50]]
5	火车站	2025-04-04	[26153512, 12763612]	["挂车", "大挂"]	NULL	[[-100], [100]]
delete  from t1 where JSON_CONTAINS(js1->'$[*]',CAST('["42343112"]' AS JSON));
delete  from t1 where json_overlaps(js2->'$', '["加湿器"]');
select /*+read_consistency(weak) */ * from t1;
id	name	date1	js1	js2	js3	js4
2	折扣牛	2028-04-04	[26153512, 12763612]	["挂车", "大挂"]	NULL	[[-100], [100]]
4	郑州东站	2024-04-04	[42343112, 43]	["汽车", "客车"]	{"score": ["2027-05-05"]}	[[-50, 50]]
5	火车站	2025-04-04	[26153512, 12763612]	["挂车", "大挂"]	NULL	[[-100], [100]]
drop table if exists t1;
create table t1 (id int , name char(10), js1 json,js2 json);
insert into t1 (id,name,js1,js2) values (1,'祭城超市','[1232332,173467623]','["橙汁","可乐"]'),(2,'金庄超市','[2634,2743353]','["薯片","饼干"]'),(3,'庙张超市','[32736,31823672]','["泡面","卤蛋"]');
create index idx1 on t1 ((cast(js1->'$' as unsigned array)));
alter table t1 add index idx2(name,(cast(js2->'$[*]' as char(10) array)));
insert into t1 (id,name,js1,js2) values (4,'郑州东站','[4263,48263712]','["锅盔","炸鸡"]');
insert into t1 (id,name,js1,js2) values (5,'洛阳东站','[512732,5123]','["蚂蚱","笔记"]') on duplicate key update name = '鹤壁东站', js1 = '[112732,1123]',js2 = '["锅盔","炸鸡"]';
insert into t1 (id,name,js1,js2) values (1,'开封东站','[512731232,51223]','["蚂蚱","笔记"]') on duplicate key update name = values(name),js1 = values(js1),js2 = values(js2);
select /*+read_consistency(weak) */ * from t1;
id	name	js1	js2
1	祭城超市	[1232332, 173467623]	["橙汁", "可乐"]
2	金庄超市	[2634, 2743353]	["薯片", "饼干"]
3	庙张超市	[32736, 31823672]	["泡面", "卤蛋"]
4	郑州东站	[4263, 48263712]	["锅盔", "炸鸡"]
5	洛阳东站	[512732, 5123]	["蚂蚱", "笔记"]
1	开封东站	[512731232, 51223]	["蚂蚱", "笔记"]
replace into t1 (id,name,js1,js2) values (6,'西安东站','[621543512,621534512]','["蚂蚱","笔记"]');
replace into t1 (id,name,js1,js2) values (2,'东蚂蚱站','[7125312,7263521]','["蚂蚱","笔记"]');
select /*+read_consistency(weak) */ * from t1;
id	name	js1	js2
1	祭城超市	[1232332, 173467623]	["橙汁", "可乐"]
2	金庄超市	[2634, 2743353]	["薯片", "饼干"]
3	庙张超市	[32736, 31823672]	["泡面", "卤蛋"]
4	郑州东站	[4263, 48263712]	["锅盔", "炸鸡"]
5	洛阳东站	[512732, 5123]	["蚂蚱", "笔记"]
1	开封东站	[512731232, 51223]	["蚂蚱", "笔记"]
6	西安东站	[621543512, 621534512]	["蚂蚱", "笔记"]
2	东蚂蚱站	[7125312, 7263521]	["蚂蚱", "笔记"]
select * from t1  where json_overlaps(js1->'$', '["173467623"]');
id	name	js1	js2
select * from t1  where json_overlaps(js1->'$', cast('["173467623"]' as json));
id	name	js1	js2
select * from t1  where json_overlaps(js1->'$[*]', cast('["173467623"]' as json));
id	name	js1	js2
select * from t1  where json_overlaps(js1->'$', '[173467623]');
id	name	js1	js2
1	祭城超市	[1232332, 173467623]	["橙汁", "可乐"]
select * from t1  where json_overlaps(js1->'$', cast('[173467623]' as json));
id	name	js1	js2
1	祭城超市	[1232332, 173467623]	["橙汁", "可乐"]
select * from t1  where json_overlaps(js1->'$[*]', cast('[173467623]' as json));
id	name	js1	js2
1	祭城超市	[1232332, 173467623]	["橙汁", "可乐"]
select * from t1 where json_contains(js1->'$', '["173467623"]');
id	name	js1	js2
select * from t1  where json_contains(js1->'$', cast('["173467623"]' as json));
id	name	js1	js2
select * from t1  where json_contains(js1->'$[*]', cast('["173467623"]' as json));
id	name	js1	js2
select * from t1 where json_contains(js1->'$', '[173467623]');
id	name	js1	js2
1	祭城超市	[1232332, 173467623]	["橙汁", "可乐"]
select * from t1  where json_contains(js1->'$', cast('[173467623]' as json));
id	name	js1	js2
1	祭城超市	[1232332, 173467623]	["橙汁", "可乐"]
select * from t1  where json_contains(js1->'$[*]', cast('[173467623]' as json));
id	name	js1	js2
1	祭城超市	[1232332, 173467623]	["橙汁", "可乐"]
select * from t1 where "173467623" member of (js1->'$');
id	name	js1	js2
select * from t1 where '["173467623"]' member of (js1->'$');
id	name	js1	js2
select * from t1 where cast('["173467623"]' as json) member of (js1->'$');
id	name	js1	js2
select * from t1 where 173467623 member of (js1->'$');
id	name	js1	js2
1	祭城超市	[1232332, 173467623]	["橙汁", "可乐"]
select * from t1 where '[173467623]' member of (js1->'$');
id	name	js1	js2
select * from t1 where cast('[173467623]' as json) member of (js1->'$');
id	name	js1	js2
update t1 set name = '洛阳东站', js1 = '[512732,5123]', js2 = '["锅盔","炸鸡"]' where name = '金庄超市'  and JSON_CONTAINS(js2->'$[*]',CAST('["薯片"]' AS JSON));
update t1 set name = '西安东站', js1 = '[621543512,621534512]', js2 = '["蚂蚱","笔记"]' where json_overlaps(js1->'$', '["173467623"]');
select /*+read_consistency(weak) */ * from t1;
id	name	js1	js2
1	祭城超市	[1232332, 173467623]	["橙汁", "可乐"]
2	洛阳东站	[512732, 5123]	["锅盔", "炸鸡"]
3	庙张超市	[32736, 31823672]	["泡面", "卤蛋"]
4	郑州东站	[4263, 48263712]	["锅盔", "炸鸡"]
5	洛阳东站	[512732, 5123]	["蚂蚱", "笔记"]
1	开封东站	[512731232, 51223]	["蚂蚱", "笔记"]
6	西安东站	[621543512, 621534512]	["蚂蚱", "笔记"]
2	东蚂蚱站	[7125312, 7263521]	["蚂蚱", "笔记"]
update t1 set name = '西安东站', js1 = '[621543512,621534512]', js2 = '["蚂蚱","笔记"]' where json_overlaps(js1->'$', '[173467623]');
select /*+read_consistency(weak) */ * from t1;
id	name	js1	js2
1	西安东站	[621543512, 621534512]	["蚂蚱", "笔记"]
2	洛阳东站	[512732, 5123]	["锅盔", "炸鸡"]
3	庙张超市	[32736, 31823672]	["泡面", "卤蛋"]
4	郑州东站	[4263, 48263712]	["锅盔", "炸鸡"]
5	洛阳东站	[512732, 5123]	["蚂蚱", "笔记"]
1	开封东站	[512731232, 51223]	["蚂蚱", "笔记"]
6	西安东站	[621543512, 621534512]	["蚂蚱", "笔记"]
2	东蚂蚱站	[7125312, 7263521]	["蚂蚱", "笔记"]
delete from t1 where name = '郑州东站'  and JSON_CONTAINS(js2->'$[*]',CAST('["锅盔"]' AS JSON));
delete from t1 where json_overlaps(js1->'$', '[621543512]');
select /*+read_consistency(weak) */ * from t1;
id	name	js1	js2
2	洛阳东站	[512732, 5123]	["锅盔", "炸鸡"]
3	庙张超市	[32736, 31823672]	["泡面", "卤蛋"]
5	洛阳东站	[512732, 5123]	["蚂蚱", "笔记"]
1	开封东站	[512731232, 51223]	["蚂蚱", "笔记"]
2	东蚂蚱站	[7125312, 7263521]	["蚂蚱", "笔记"]
drop table if exists t1;
create table t1 (id int , name char(10), js1 json,js2 json);
insert into t1 (id,name,js1,js2) values (1,'祭城超市','[1232332,173467623]','["橙汁","可乐"]'),(2,'金庄超市','[2634,2743353]','["薯片","饼干"]'),(3,'庙张超市','[32736,31823672]','["泡面","卤蛋"]');
create unique index idx1 on t1 ((cast(js1->'$' as unsigned array)));
insert into t1 (id,name,js1,js2) values (4,'郑州东站','[41231231,413123]','["橙汁","可乐"]');
insert into t1 (id,name,js1,js2) values (5,'洛阳东站','[542323,413123]','["橙汁","可乐"]');
ERROR 23000: Duplicate entry '413123' for key 'idx1'
insert into t1 (id,name,js1,js2) values (6,'洛阳东站','[1232332,173467623]','["橙汁","可乐"]');
ERROR 23000: Duplicate entry '173467623' for key 'idx1'
insert into t1 (id,name,js1,js2) values (7,'洛阳东站','[1232332,7216532]','["橙汁","可乐"]');
ERROR 23000: Duplicate entry '1232332' for key 'idx1'
insert into t1 (id,name,js1,js2) values (8,'洛阳东站','[812635126,8263]','["橙汁","可乐"]') on duplicate key update js1 = '[1232332,173467623 ]';
insert into t1 (id,name,js1,js2) values (9,'开封东站','[1232332,912732]','["橙汁","可乐"]') on duplicate key update js1 = '[91273217,91273612 ]';
ERROR 23000: Duplicate entry '1232332' for key 'idx1'
insert into t1 (id,name,js1,js2) values (9,'开封东站','[1232332,912732]','["橙汁","可乐"]') on duplicate key update js1 = '[91273217,91273612 ]';
ERROR 23000: Duplicate entry '1232332' for key 'idx1'
insert into t1 (id,name,js1,js2) values (10,'开封东站','[2634,2743353]','["橙汁","可乐"]') on duplicate key update js1 = '[2634]';
insert into t1 (id,name,js1,js2) values (11,'开封东站','[32736,31823672]','["橙汁","可乐"]') on duplicate key update js1 = '[41231231]';
ERROR 23000: Duplicate entry '41231231' for key 'idx1'
replace into t1 (id,name,js1,js2) values (12,'开封东站','[12222342,1225685]','["橙汁","可乐"]');
select /*+read_consistency(weak) */ * from t1;
id	name	js1	js2
1	祭城超市	[1232332, 173467623]	["橙汁", "可乐"]
2	金庄超市	[2634]	["薯片", "饼干"]
3	庙张超市	[32736, 31823672]	["泡面", "卤蛋"]
4	郑州东站	[41231231, 413123]	["橙汁", "可乐"]
8	洛阳东站	[812635126, 8263]	["橙汁", "可乐"]
12	开封东站	[12222342, 1225685]	["橙汁", "可乐"]
replace into t1 (id,name,js1,js2) values (13,'开封东站','[41231231,13334584]','["橙汁","可乐"]');
ERROR 23000: Duplicate entry '41231231' for key 'idx1'
select /*+read_consistency(weak) */ * from t1;
id	name	js1	js2
1	祭城超市	[1232332, 173467623]	["橙汁", "可乐"]
2	金庄超市	[2634]	["薯片", "饼干"]
3	庙张超市	[32736, 31823672]	["泡面", "卤蛋"]
4	郑州东站	[41231231, 413123]	["橙汁", "可乐"]
8	洛阳东站	[812635126, 8263]	["橙汁", "可乐"]
12	开封东站	[12222342, 1225685]	["橙汁", "可乐"]
replace into t1 (id,name,js1,js2) values (14,'开封东站','[812635126,8263]','["橙汁","可乐"]');
select /*+read_consistency(weak) */ * from t1;
id	name	js1	js2
1	祭城超市	[1232332, 173467623]	["橙汁", "可乐"]
2	金庄超市	[2634]	["薯片", "饼干"]
3	庙张超市	[32736, 31823672]	["泡面", "卤蛋"]
4	郑州东站	[41231231, 413123]	["橙汁", "可乐"]
12	开封东站	[12222342, 1225685]	["橙汁", "可乐"]
14	开封东站	[812635126, 8263]	["橙汁", "可乐"]
replace into t1 (id,name,js1,js2) values (14,'开封东站','[14443847823,8263]','["橙汁","可乐"]');
select /*+read_consistency(weak) */ * from t1;
id	name	js1	js2
1	祭城超市	[1232332, 173467623]	["橙汁", "可乐"]
2	金庄超市	[2634]	["薯片", "饼干"]
3	庙张超市	[32736, 31823672]	["泡面", "卤蛋"]
4	郑州东站	[41231231, 413123]	["橙汁", "可乐"]
12	开封东站	[12222342, 1225685]	["橙汁", "可乐"]
14	开封东站	[14443847823, 8263]	["橙汁", "可乐"]
insert into t1 (id,name,js1,js2) values (14,'开封东站','[14443847823,8263]','["橙汁","可乐"]');
ERROR 23000: Duplicate entry '14443847823' for key 'idx1'
drop table if exists t1;
create table t1 (id int , name char(10), js1 json,js2 json);
insert into t1 (id,name,js1,js2) values (1,'祭城超市','[1232332,173467623]','["橙汁","可乐"]'),(2,'金庄超市','[2634,2743353]','["薯片","饼干"]'),(3,'庙张超市','[32736,31823672]','["泡面","卤蛋"]');
alter table t1 add unique idx1 (name,(cast(js2->'$' as char(10) array)));
insert into t1 (id,name,js1,js2) values (1,'祭城超市','[1232332,173467623]','["橙汁","可乐"]');
ERROR 23000: Duplicate entry '祭城超市-橙汁' for key 'idx1'
insert into t1 (id,name,js1,js2) values (1,'祭城超市','[1232332,173467623]','["橙汁","可乐"]') on duplicate key update js2 = '["跑车"]';
insert into t1 (id,name,js1,js2) values (1,'祭城超市','[1232332,437237]','["薯片","超市"]') on duplicate key update js2 = '["绵羊"]';
insert into t1 (id,name,js1,js2) values (1,'祭城超市','[1232332,437237]','["黑马","薯片"]') on duplicate key update js2 = '["绵羊"]';
ERROR 23000: Duplicate entry '祭城超市-薯片' for key 'idx1'
drop table if exists t1;
create table t1 (id int primary key, name char(10), js1 json,js2 json);
insert into t1 (id,name,js1,js2) values (1,'祭城超市','[1232332,173467623]','["橙汁","可乐"]'),(2,'金庄超市','[2634,2743353]','["薯片","饼干"]'),(3,'庙张超市','[32736,31823672]','["泡面","卤蛋"]');
create index idx1 on t1 ((cast(js1->'$' as unsigned array)));
alter table t1 add index idx2(name,(cast(js2->'$[*]' as char(10) array)));
insert into t1 (id,name,js1,js2) values (4,'郑州东站','[4263,48263712]','["锅盔","炸鸡"]');
insert into t1 (id,name,js1,js2) values (5,'洛阳东站','[512732,5123]','["蚂蚱","笔记"]') on duplicate key update name = '鹤壁东站', js1 = '[112732,1123]',js2 = '["锅盔","炸鸡"]';
insert into t1 (id,name,js1,js2) values (1,'开封东站','[512731232,51223]','["蚂蚱","笔记"]') on duplicate key update name = values(name),js1 = values(js1),js2 = values(js2);
replace into t1 (id,name,js1,js2) values (6,'西安东站','[621543512,621534512]','["蚂蚱","笔记"]');
replace into t1 (id,name,js1,js2) values (2,'东蚂蚱站','[7125312,7263521]','["蚂蚱","笔记"]');
select /*+read_consistency(weak) */ * from t1;
id	name	js1	js2
1	开封东站	[512731232, 51223]	["蚂蚱", "笔记"]
2	东蚂蚱站	[7125312, 7263521]	["蚂蚱", "笔记"]
3	庙张超市	[32736, 31823672]	["泡面", "卤蛋"]
4	郑州东站	[4263, 48263712]	["锅盔", "炸鸡"]
5	洛阳东站	[512732, 5123]	["蚂蚱", "笔记"]
6	西安东站	[621543512, 621534512]	["蚂蚱", "笔记"]
update t1 set name = '洛阳东站', js1 = '[512732,5123]', js2 = '["锅盔","炸鸡"]' where name = ''  and JSON_CONTAINS(js1->'$[*]',CAST('["42343112"]' AS JSON));
update t1 set name = '西安东站', js1 = '[621543512,621534512]', js2 = '["蚂蚱","笔记"]' where json_overlaps(js2->'$', '["加湿器"]');
select /*+read_consistency(weak) */ * from t1;
id	name	js1	js2
1	开封东站	[512731232, 51223]	["蚂蚱", "笔记"]
2	东蚂蚱站	[7125312, 7263521]	["蚂蚱", "笔记"]
3	庙张超市	[32736, 31823672]	["泡面", "卤蛋"]
4	郑州东站	[4263, 48263712]	["锅盔", "炸鸡"]
5	洛阳东站	[512732, 5123]	["蚂蚱", "笔记"]
6	西安东站	[621543512, 621534512]	["蚂蚱", "笔记"]
delete from t1 where name = '洛阳东站'  and JSON_CONTAINS(js2->'$[*]',CAST('["锅盔"]' AS JSON));
delete from t1 where json_overlaps(js1->'$', '[621543512]');
select /*+read_consistency(weak) */ * from t1;
id	name	js1	js2
1	开封东站	[512731232, 51223]	["蚂蚱", "笔记"]
2	东蚂蚱站	[7125312, 7263521]	["蚂蚱", "笔记"]
3	庙张超市	[32736, 31823672]	["泡面", "卤蛋"]
4	郑州东站	[4263, 48263712]	["锅盔", "炸鸡"]
5	洛阳东站	[512732, 5123]	["蚂蚱", "笔记"]
drop table if exists t1;
create table t1 (id int primary key, name char(10), js1 json,js2 json);
insert into t1 (id,name,js1,js2) values (1,'祭城超市','[1232332,173467623]','["橙汁","可乐"]'),(2,'金庄超市','[2634,2743353]','["薯片","饼干"]'),(3,'庙张超市','[32736,31823672]','["泡面","卤蛋"]');
alter table t1 add unique index idx1 ((cast(js1->'$' as unsigned array)));
insert into t1 (id,name,js1,js2) values (1,'祭城超市','[1232332,173467623]','["橙汁","可乐"]');
ERROR 23000: Duplicate entry '1' for key 'PRIMARY'
insert into t1 (id,name,js1,js2) values (4,'祭城超市','[1232332,173467623]','["橙汁","可乐"]');
ERROR 23000: Duplicate entry '173467623' for key 'idx1'
insert into t1 (id,name,js1,js2) values (4,'祭城超市','[1232332,173467623]','["橙汁","可乐"]') on duplicate key update js1 = '[4231,45656756]';
insert into t1 (id,name,js1,js2) values (5,'祭城超市','[2634,5142312]','["橙汁","可乐"]') on duplicate key update js1 = '[5412342,54213412]';
ERROR 23000: Duplicate entry '2634' for key 'idx1'
insert into t1 (id,name,js1,js2) values (5,'祭城超市','[2634,5142312]','["橙汁","可乐"]') on duplicate key update js1 = '[5412342,54213412]';
ERROR 23000: Duplicate entry '2634' for key 'idx1'
drop table if exists t1;
create table t1 (id int primary key, name char(10), js1 json,js2 json);
insert into t1 (id,name,js1,js2) values (1,'祭城超市','[1232332,173467623]','["橙汁","可乐"]'),(2,'金庄超市','[2634,2743353]','["薯片","饼干"]'),(3,'庙张超市','[32736,31823672]','["泡面","卤蛋"]');
create unique index idx1 on t1 (name, (cast(js1->'$' as unsigned array)));
insert into t1 (id,name,js1,js2) values (1,'祭城超市','[1232332,173467623]','["橙汁","可乐"]');
ERROR 23000: Duplicate entry '1' for key 'PRIMARY'
replace into t1 (id,name,js1,js2) values (1,'祭城超市','[1232332,173467623]','["橙汁","可乐"]');
replace into t1 (id,name,js1,js2) values (1,'祭城超市','[4125312,4123612]','["橙汁","可乐"]');
replace into t1 (id,name,js1,js2) values (5,'祭城超市','[1232332,4123612]','["橙汁","可乐"]');
drop table if exists t1;
create table t1 (id int, name char(10), date1 date, js json, index idx1 (date1), unique index idx2(name));
alter table t1 CONVERT TO CHARACTER SET gbk;
insert into t1 (id, name , date1, js) values (1,"祭城超市", "2024-01-01", '["火锅丸子","酸奶"]'),(2,"金庄超市", "2025-01-01", '["火锅丸子","饼干"]'),(3,"庙张超市", "2026-01-01", '["辣条","水果"]');
create index idx3 on t1((cast(js->'$' as char(10) array)));
insert into t1 (id, name , date1, js) values (4,"文化产业大厦",'2024-03-01', '["可乐","雪碧"]'), (5,"绿地新都会",'2024-03-01', '["可乐","雪碧"]');
replace into t1 (id, name , date1, js) values (5,"绿地新都会",'2024-03-01', '["果冻","馍片"]') ;
update t1 set js = '["橙汁","茶"]' where JSON_CONTAINS(js->'$',CAST('["酸奶"]' AS JSON));
delete from t1 where JSON_CONTAINS(js->'$',CAST('["果冻"]' AS JSON));
select /*+read_consistency(weak) */ * from t1;
id	name	date1	js
1	祭城超市	2024-01-01	["橙汁", "茶"]
2	金庄超市	2025-01-01	["火锅丸子", "饼干"]
3	庙张超市	2026-01-01	["辣条", "水果"]
4	文化产业大厦	2024-03-01	["可乐", "雪碧"]
drop table if exists t1;
create table t1 (c1 char(50), c2 json, primary key(c1), index zips((cast(c2->'$.key' as unsigned array))));
insert into t1 (c1,c2)values ('aaaaaaaaaaaaaaaaaaaaaaaaaaaaaaaaaaaaaaaaaaaaaaaaaa', '{"key":[1,2,3,4,5,6]}');
