alter system set _enable_add_fulltext_index_to_existing_table = true;
drop table if exists t20;
create table t20 (id int primary key , name varchar(50), age int ,js json);
insert into t20 values
(1,'mary',12,'{"score":[123,345,567,90]}'),
(2,'lili',13,'{"score":[100,23,456,678]}'),
(3,'mali',11,'{"score":[678,89,90,789]}'),
(4,'defu',14,'{"score":[123,90,45,99]}');
create index scores on t20(name,age,(CAST(js->'$.score' AS UNSIGNED ARRAY)));
show create table t20;
Table	Create Table
t20	CREATE TABLE `t20` (
  `id` int(11) NOT NULL,
  `name` varchar(50) DEFAULT NULL,
  `age` int(11) DEFAULT NULL,
  `js` json DEFAULT NULL,
  PRIMARY KEY (`id`),
  INDEX `scores` (`name`, `age`, (json_query(`js`,'$.score' RETURNING unsigned WITHOUT ARRAY WRAPPER asis error on error null on empty null on mismatch))) BLOCK_SIZE 16384
) ORGANIZATION INDEX DEFAULT CHARSET = utf8mb4 ROW_FORMAT = DYNAMIC COMPRESSION = 'zstd_1.3.8' REPLICA_NUM = 1 BLOCK_SIZE = 16384 USE_BLOOM_FILTER = FALSE ENABLE_MACRO_BLOCK_BLOOM_FILTER = FALSE TABLET_SIZE = 134217728 PCTFREE = 0
explain
select * from t20 where name='mary' and age =12 and 90 member of(js->>'$.score');
id	name	age	js
1	mary	12	{"score": [123, 345, 567, 90]}
explain select * from t20 where name='mary' and age =12 and 90 member of(js->>'$.score');
Query Plan
===============================================
|ID|OPERATOR       |NAME|EST.ROWS|EST.TIME(us)|
-----------------------------------------------
|0 |TABLE FULL SCAN|t20 |1       |46          |
===============================================
Outputs & filters:
-------------------------------------
  0 - output([t20.id], [t20.name], [t20.age], [t20.js]), filter([t20.name = 'mary'], [t20.age = 12], [JSON_MEMBER_OF(90, JSON_UNQUOTE(JSON_EXTRACT(t20.js,
       '$.score')))]), rowset=16
      access([t20.id], [t20.js], [t20.name], [t20.age]), partitions(p0)
      is_index_back=false, is_global_index=false, filter_before_indexback[false,false,false], 
      123
explain select * from t20 where name='mary' and 90 member of(js->>'$.score') and age =12;
Query Plan
===============================================
|ID|OPERATOR       |NAME|EST.ROWS|EST.TIME(us)|
-----------------------------------------------
|0 |TABLE FULL SCAN|t20 |1       |50          |
===============================================
Outputs & filters:
-------------------------------------
  0 - output([t20.id], [t20.name], [t20.age], [t20.js]), filter([t20.name = 'mary'], [t20.age = 12], [JSON_MEMBER_OF(90, JSON_UNQUOTE(JSON_EXTRACT(t20.js,
       '$.score')))]), rowset=16
      access([t20.id], [t20.js], [t20.name], [t20.age]), partitions(p0)
      is_index_back=false, is_global_index=false, filter_before_indexback[false,false,false], 
      123
explain select * from t20 where  90 member of(js->>'$.score') and age =12 and name='mary' ;
Query Plan
===============================================
|ID|OPERATOR       |NAME|EST.ROWS|EST.TIME(us)|
-----------------------------------------------
|0 |TABLE FULL SCAN|t20 |1       |85          |
===============================================
Outputs & filters:
-------------------------------------
  0 - output([t20.id], [t20.name], [t20.age], [t20.js]), filter([t20.age = 12], [t20.name = 'mary'], [JSON_MEMBER_OF(90, JSON_UNQUOTE(JSON_EXTRACT(t20.js,
       '$.score')))]), rowset=16
      access([t20.id], [t20.js], [t20.age], [t20.name]), partitions(p0)
      is_index_back=false, is_global_index=false, filter_before_indexback[false,false,false], 
      123
select id,js from t20 where JSON_CONTAINS(js->'$.score',CAST('[90]' AS JSON)) and age =12 and name='mary';
id	js
1	{"score": [123, 345, 567, 90]}
explain select id,js from t20 where JSON_CONTAINS(js->'$.score',CAST('[90]' AS JSON)) and age =12 and name='mary';
Query Plan
===============================================
|ID|OPERATOR       |NAME|EST.ROWS|EST.TIME(us)|
-----------------------------------------------
|0 |TABLE FULL SCAN|t20 |1       |85          |
===============================================
Outputs & filters:
-------------------------------------
  0 - output([t20.id], [t20.js]), filter([t20.age = 12], [t20.name = 'mary'], [JSON_CONTAINS(JSON_EXTRACT(t20.js, '$.score'), cast('[90]', JSON(536870911)))]), rowset=16
      access([t20.id], [t20.js], [t20.age], [t20.name]), partitions(p0)
      is_index_back=false, is_global_index=false, filter_before_indexback[false,false,false], 
      123
select id,js FROM t20 WHERE JSON_OVERLAPS(js->>'$.score', '[90, 345]') and age =12 and name='mary';
id	js
1	{"score": [123, 345, 567, 90]}
explain select id,js FROM t20 WHERE JSON_OVERLAPS(js->>'$.score', '[90, 345]') and age =12 and name='mary';
Query Plan
===============================================
|ID|OPERATOR       |NAME|EST.ROWS|EST.TIME(us)|
-----------------------------------------------
|0 |TABLE FULL SCAN|t20 |1       |85          |
===============================================
Outputs & filters:
-------------------------------------
  0 - output([t20.id], [t20.js]), filter([t20.age = 12], [t20.name = 'mary'], [JSON_OVERLAPS(JSON_UNQUOTE(JSON_EXTRACT(t20.js, '$.score')), '[90, 345]')]), rowset=16
      access([t20.id], [t20.js], [t20.age], [t20.name]), partitions(p0)
      is_index_back=false, is_global_index=false, filter_before_indexback[false,false,false], 
      123
insert into on duplicate
insert into t20 (id, js) values (4,'{"score":[1,2,34]}') on duplicate key update js = values(js);
select * from t20;
id	name	age	js
1	mary	12	{"score": [123, 345, 567, 90]}
2	lili	13	{"score": [100, 23, 456, 678]}
3	mali	11	{"score": [678, 89, 90, 789]}
4	defu	14	{"score": [1, 2, 34]}
insert into t20 (id, js) values (5,'{"score":[1,2,34]}') on duplicate key update js = values(js);
select * from t20;
id	name	age	js
1	mary	12	{"score": [123, 345, 567, 90]}
2	lili	13	{"score": [100, 23, 456, 678]}
3	mali	11	{"score": [678, 89, 90, 789]}
4	defu	14	{"score": [1, 2, 34]}
5	NULL	NULL	{"score": [1, 2, 34]}
replace into
replace into t20 set id=4,js='{"score": [555, 999]}';
select * from t20;
id	name	age	js
1	mary	12	{"score": [123, 345, 567, 90]}
2	lili	13	{"score": [100, 23, 456, 678]}
3	mali	11	{"score": [678, 89, 90, 789]}
4	NULL	NULL	{"score": [555, 999]}
5	NULL	NULL	{"score": [1, 2, 34]}
replace into t20 values(4,'mali',15,'{"score":[123,567]}');
select * from t20;
id	name	age	js
1	mary	12	{"score": [123, 345, 567, 90]}
2	lili	13	{"score": [100, 23, 456, 678]}
3	mali	11	{"score": [678, 89, 90, 789]}
4	mali	15	{"score": [123, 567]}
5	NULL	NULL	{"score": [1, 2, 34]}
replace into t20 set id=7,js='{"score": [555, 999]}';
select * from t20;
id	name	age	js
1	mary	12	{"score": [123, 345, 567, 90]}
2	lili	13	{"score": [100, 23, 456, 678]}
3	mali	11	{"score": [678, 89, 90, 789]}
4	mali	15	{"score": [123, 567]}
5	NULL	NULL	{"score": [1, 2, 34]}
7	NULL	NULL	{"score": [555, 999]}
replace into t20 values(9,'mali',15,'{"score":[123,567]}');
select * from t20;
id	name	age	js
1	mary	12	{"score": [123, 345, 567, 90]}
2	lili	13	{"score": [100, 23, 456, 678]}
3	mali	11	{"score": [678, 89, 90, 789]}
4	mali	15	{"score": [123, 567]}
5	NULL	NULL	{"score": [1, 2, 34]}
7	NULL	NULL	{"score": [555, 999]}
9	mali	15	{"score": [123, 567]}
update join
drop table if exists t21;
create table t21 (id int primary key ,name varchar(50),age int ,js json);
insert into t21 values
(1,'mary',12,'{"score":[1234,3456,5678,900]}'),
(2,'lili',13,'{"score":[1000,230,4560,6780]}'),
(3,'mali',11,'{"score":[6780,890,900,7890]}'),
(4,'defu',14,'{"score":[1203,900,450,990]}');
update t20 join t21 on t20.id = t21.id set t20.js = t21.js;
view
drop view if exists v1_t20;
drop view if exists v2_t20;
drop view if exists v3_t20;
create view v1_t20 as select * from t20;
create view v2_t20 as select js from t20;
create view v3_t20 as select json_value(js,'$.score') from t20;
select * from v1_t20;
id	name	age	js
1	mary	12	{"score": [1234, 3456, 5678, 900]}
2	lili	13	{"score": [1000, 230, 4560, 6780]}
3	mali	11	{"score": [6780, 890, 900, 7890]}
4	mali	15	{"score": [1203, 900, 450, 990]}
5	NULL	NULL	{"score": [1, 2, 34]}
7	NULL	NULL	{"score": [555, 999]}
9	mali	15	{"score": [123, 567]}
select * from v2_t20;
js
{"score": [1234, 3456, 5678, 900]}
{"score": [1000, 230, 4560, 6780]}
{"score": [6780, 890, 900, 7890]}
{"score": [1203, 900, 450, 990]}
{"score": [1, 2, 34]}
{"score": [555, 999]}
{"score": [123, 567]}
select * from v3_t20;
json_value(js,'$.score')
[1234, 3456, 5678, 900]
[1000, 230, 4560, 6780]
[6780, 890, 900, 7890]
[1203, 900, 450, 990]
[1, 2, 34]
[555, 999]
[123, 567]
select * from t20;
id	name	age	js
1	mary	12	{"score": [1234, 3456, 5678, 900]}
2	lili	13	{"score": [1000, 230, 4560, 6780]}
3	mali	11	{"score": [6780, 890, 900, 7890]}
4	mali	15	{"score": [1203, 900, 450, 990]}
5	NULL	NULL	{"score": [1, 2, 34]}
7	NULL	NULL	{"score": [555, 999]}
9	mali	15	{"score": [123, 567]}
update v1_t20 set js = '{"score":[1,999]}';
update v1_t20 set js = '{"score":{}}';
ERROR 42000: This version of MySQL doesn't yet support CAST-ing JSON OBJECT type to array
update v1_t20 set js = '{"score":[]}';
update v1_t20 set js = '{"score":"ttt"}';
ERROR 42000: Invalid JSON value for CAST for functional index.
update v1_t20 set js = '{"score":true}';
update v2_t20 set js = '{"score":[1,999]}';
update v2_t20 set js = '{"score":{}}';
ERROR 42000: This version of MySQL doesn't yet support CAST-ing JSON OBJECT type to array
索引ddl
alter table t20 rename index scores to scores2;
create index scores on t20(name,age);
show create table t20;
Table	Create Table
t20	CREATE TABLE `t20` (
  `id` int(11) NOT NULL,
  `name` varchar(50) DEFAULT NULL,
  `age` int(11) DEFAULT NULL,
  `js` json DEFAULT NULL,
  PRIMARY KEY (`id`),
  INDEX `scores2` (`name`, `age`, (json_query(`js`,'$.score' RETURNING unsigned WITHOUT ARRAY WRAPPER asis error on error null on empty null on mismatch))) BLOCK_SIZE 16384,
  KEY `scores` (`name`, `age`) BLOCK_SIZE 16384 LOCAL
) ORGANIZATION INDEX DEFAULT CHARSET = utf8mb4 ROW_FORMAT = DYNAMIC COMPRESSION = 'zstd_1.3.8' REPLICA_NUM = 1 BLOCK_SIZE = 16384 USE_BLOOM_FILTER = FALSE ENABLE_MACRO_BLOCK_BLOOM_FILTER = FALSE TABLET_SIZE = 134217728 PCTFREE = 0
create index score2 on t20(name,age,(cast(js->'$.score' as unsigned array)));
show create table t20;
Table	Create Table
t20	CREATE TABLE `t20` (
  `id` int(11) NOT NULL,
  `name` varchar(50) DEFAULT NULL,
  `age` int(11) DEFAULT NULL,
  `js` json DEFAULT NULL,
  PRIMARY KEY (`id`),
  INDEX `scores2` (`name`, `age`, (json_query(`js`,'$.score' RETURNING unsigned WITHOUT ARRAY WRAPPER asis error on error null on empty null on mismatch))) BLOCK_SIZE 16384,
  KEY `scores` (`name`, `age`) BLOCK_SIZE 16384 LOCAL,
  INDEX `score2` (`name`, `age`, (json_query(`js`,'$.score' RETURNING unsigned WITHOUT ARRAY WRAPPER asis error on error null on empty null on mismatch))) BLOCK_SIZE 16384
) ORGANIZATION INDEX DEFAULT CHARSET = utf8mb4 ROW_FORMAT = DYNAMIC COMPRESSION = 'zstd_1.3.8' REPLICA_NUM = 1 BLOCK_SIZE = 16384 USE_BLOOM_FILTER = FALSE ENABLE_MACRO_BLOCK_BLOOM_FILTER = FALSE TABLET_SIZE = 134217728 PCTFREE = 0
create index score4 on t20((cast(js->'$.score' as unsigned array)));
show create table t20;
Table	Create Table
t20	CREATE TABLE `t20` (
  `id` int(11) NOT NULL,
  `name` varchar(50) DEFAULT NULL,
  `age` int(11) DEFAULT NULL,
  `js` json DEFAULT NULL,
  PRIMARY KEY (`id`),
  INDEX `scores2` (`name`, `age`, (json_query(`js`,'$.score' RETURNING unsigned WITHOUT ARRAY WRAPPER asis error on error null on empty null on mismatch))) BLOCK_SIZE 16384,
  KEY `scores` (`name`, `age`) BLOCK_SIZE 16384 LOCAL,
  INDEX `score2` (`name`, `age`, (json_query(`js`,'$.score' RETURNING unsigned WITHOUT ARRAY WRAPPER asis error on error null on empty null on mismatch))) BLOCK_SIZE 16384,
  INDEX `score4` ((json_query(`js`,'$.score' RETURNING unsigned WITHOUT ARRAY WRAPPER asis error on error null on empty null on mismatch))) BLOCK_SIZE 16384
) ORGANIZATION INDEX DEFAULT CHARSET = utf8mb4 ROW_FORMAT = DYNAMIC COMPRESSION = 'zstd_1.3.8' REPLICA_NUM = 1 BLOCK_SIZE = 16384 USE_BLOOM_FILTER = FALSE ENABLE_MACRO_BLOCK_BLOOM_FILTER = FALSE TABLET_SIZE = 134217728 PCTFREE = 0
alter table t20 drop index scores2;
show create table t20;
Table	Create Table
t20	CREATE TABLE `t20` (
  `id` int(11) NOT NULL,
  `name` varchar(50) DEFAULT NULL,
  `age` int(11) DEFAULT NULL,
  `js` json DEFAULT NULL,
  PRIMARY KEY (`id`),
  KEY `scores` (`name`, `age`) BLOCK_SIZE 16384 LOCAL,
  INDEX `score2` (`name`, `age`, (json_query(`js`,'$.score' RETURNING unsigned WITHOUT ARRAY WRAPPER asis error on error null on empty null on mismatch))) BLOCK_SIZE 16384,
  INDEX `score4` ((json_query(`js`,'$.score' RETURNING unsigned WITHOUT ARRAY WRAPPER asis error on error null on empty null on mismatch))) BLOCK_SIZE 16384
) ORGANIZATION INDEX DEFAULT CHARSET = utf8mb4 ROW_FORMAT = DYNAMIC COMPRESSION = 'zstd_1.3.8' REPLICA_NUM = 1 BLOCK_SIZE = 16384 USE_BLOOM_FILTER = FALSE ENABLE_MACRO_BLOCK_BLOOM_FILTER = FALSE TABLET_SIZE = 134217728 PCTFREE = 0
explain select id,js from t20 where JSON_CONTAINS(js->'$.score',CAST('[90]' AS JSON)) and age =12 and name='mary';
Query Plan
=======================================================
|ID|OPERATOR        |NAME       |EST.ROWS|EST.TIME(us)|
-------------------------------------------------------
|0 |TABLE RANGE SCAN|t20(scores)|1       |85          |
=======================================================
Outputs & filters:
-------------------------------------
  0 - output([t20.id], [t20.js]), filter([JSON_CONTAINS(JSON_EXTRACT(t20.js, '$.score'), cast('[90]', JSON(536870911)))]), rowset=16
      access([t20.id], [t20.js]), partitions(p0)
      is_index_back=true, is_global_index=false, filter_before_indexback[false], 
      123
      range_cond([t20.age = 12], [t20.name = 'mary'])
create index scores on t20(name,age,(CAST(js->'$.score' AS UNSIGNED ARRAY)));
ERROR 42000: Duplicate key name 'scores'
create index scores2 on t20(name,age,(CAST(js->'$.score' AS UNSIGNED ARRAY)));
alter table t20 change column js js varchar(100);
ERROR 0A000: Alter non string type not supported
alter table t20 drop js;
ERROR HY000: Column 'js' has a functional index dependency and cannot be dropped or renamed.
DESCRIBE t20;
Field	Type	Null	Key	Default	Extra
id	int(11)	NO	PRI	NULL	
name	varchar(50)	YES	MUL	NULL	
age	int(11)	YES		NULL	
js	json	YES		NULL	
truncate table t20;
insert into t20 values
(11,'mary',12,'{"score":[1234,3452,5671,909]}'),
(12,'lili',13,'{"score":[1001,234,4563,6786]}'),
(13,'mali',11,'{"score":[67,894,930,7389]}'),
(14,'defu',14,'{"score":[1223,920,415,919]}');
insert into t20 (id, js) values (14,'{"score":[1,2,34]}') on duplicate key update js = values(js);
select * from t20;
id	name	age	js
11	mary	12	{"score": [1234, 3452, 5671, 909]}
12	lili	13	{"score": [1001, 234, 4563, 6786]}
13	mali	11	{"score": [67, 894, 930, 7389]}
14	defu	14	{"score": [1, 2, 34]}
insert into t20 (id, js) values (15,'{"score":[1,2,34]}') on duplicate key update js = values(js);
select * from t20;
id	name	age	js
11	mary	12	{"score": [1234, 3452, 5671, 909]}
12	lili	13	{"score": [1001, 234, 4563, 6786]}
13	mali	11	{"score": [67, 894, 930, 7389]}
14	defu	14	{"score": [1, 2, 34]}
15	NULL	NULL	{"score": [1, 2, 34]}
replace into
replace into t20 set id=14,js='{"score": [555, 999]}';
select * from t20;
id	name	age	js
11	mary	12	{"score": [1234, 3452, 5671, 909]}
12	lili	13	{"score": [1001, 234, 4563, 6786]}
13	mali	11	{"score": [67, 894, 930, 7389]}
14	NULL	NULL	{"score": [555, 999]}
15	NULL	NULL	{"score": [1, 2, 34]}
replace into t20 set id=17,js='{"score": [555, 999]}';
select * from t20;
id	name	age	js
11	mary	12	{"score": [1234, 3452, 5671, 909]}
12	lili	13	{"score": [1001, 234, 4563, 6786]}
13	mali	11	{"score": [67, 894, 930, 7389]}
14	NULL	NULL	{"score": [555, 999]}
15	NULL	NULL	{"score": [1, 2, 34]}
17	NULL	NULL	{"score": [555, 999]}
show create table t20;
Table	Create Table
t20	CREATE TABLE `t20` (
  `id` int(11) NOT NULL,
  `name` varchar(50) DEFAULT NULL,
  `age` int(11) DEFAULT NULL,
  `js` json DEFAULT NULL,
  PRIMARY KEY (`id`),
  KEY `scores` (`name`, `age`) BLOCK_SIZE 16384 LOCAL,
  INDEX `score2` (`name`, `age`, (json_query(`js`,'$.score' RETURNING unsigned WITHOUT ARRAY WRAPPER asis error on error null on empty null on mismatch))) BLOCK_SIZE 16384,
  INDEX `score4` ((json_query(`js`,'$.score' RETURNING unsigned WITHOUT ARRAY WRAPPER asis error on error null on empty null on mismatch))) BLOCK_SIZE 16384,
  INDEX `scores2` (`name`, `age`, (json_query(`js`,'$.score' RETURNING unsigned WITHOUT ARRAY WRAPPER asis error on error null on empty null on mismatch))) BLOCK_SIZE 16384
) ORGANIZATION INDEX DEFAULT CHARSET = utf8mb4 ROW_FORMAT = DYNAMIC COMPRESSION = 'zstd_1.3.8' REPLICA_NUM = 1 BLOCK_SIZE = 16384 USE_BLOOM_FILTER = FALSE ENABLE_MACRO_BLOCK_BLOOM_FILTER = FALSE TABLET_SIZE = 134217728 PCTFREE = 0
select * from t20 where name='mary' and age =12 and 909 member of(js->>'$.score');
id	name	age	js
11	mary	12	{"score": [1234, 3452, 5671, 909]}
explain select * from t20 where name='mary' and age =12 and 909 member of(js->>'$.score');
Query Plan
=======================================================
|ID|OPERATOR        |NAME       |EST.ROWS|EST.TIME(us)|
-------------------------------------------------------
|0 |TABLE RANGE SCAN|t20(scores)|1       |85          |
=======================================================
Outputs & filters:
-------------------------------------
  0 - output([t20.id], [t20.name], [t20.age], [t20.js]), filter([JSON_MEMBER_OF(909, JSON_UNQUOTE(JSON_EXTRACT(t20.js, '$.score')))]), rowset=16
      access([t20.id], [t20.js], [t20.name], [t20.age]), partitions(p0)
      is_index_back=true, is_global_index=false, filter_before_indexback[false], 
      123
      range_cond([t20.name = 'mary'], [t20.age = 12])
drop table if exists t20;
select * from v1_t20;
ERROR 42S22: View 'test.v1_t20' references invalid table(s) or column(s) or function(s) or definer/invoker of view lack rights to use them
select * from v2_t20;
ERROR 42S22: View 'test.v2_t20' references invalid table(s) or column(s) or function(s) or definer/invoker of view lack rights to use them
select * from v3_t20;
ERROR 42S22: View 'test.v3_t20' references invalid table(s) or column(s) or function(s) or definer/invoker of view lack rights to use them
drop view v1_t20;
drop view v2_t20;
drop view v3_t20;
