call DBMS_AI_SERVICE.DROP_AI_MODEL_ENDPOINT ('ob_embed_endpoint');
call DBMS_AI_SERVICE.DROP_AI_MODEL ('ob_embed');
call DBMS_AI_SERVICE.CREATE_AI_MODEL(
'ob_embed', '{
    "type": "dense_embedding",
    "model_name": "qwen3-embedding"
  }');
alter system set ob_vector_memory_limit_percentage=40;
set ob_enable_index_direct_select = 1;
drop table if exists t1;
create table t1 (id int PRIMARY KEY, 
doc varchar(100),
VECTOR INDEX hybrid_index(doc) WITH (distance=L2,type=hnsw, dim=1024,model=ob_embed, sync_mode=async, sync_interval=3s));
call dbms_vector.refresh_index('hybrid_index','t1','doc', 0);
select 0 = 0;
0 = 0
1
select 200 = 200;
200 = 200
1
select 200 = 200;
200 = 200
1
drop table t1;
create table t1 (id int PRIMARY KEY, 
doc varchar(100),
VECTOR INDEX hybrid_index(doc) WITH (distance=L2,type=hnsw, dim=1024,model=guiji_embed, sync_mode=manual));
call dbms_vector.refresh_index('hybrid_index','t1','doc', 0);
update t1 set doc = 'sss' where id < 100;
call dbms_vector.refresh_index('hybrid_index','t1','doc', 0);
select 0 = 0;
0 = 0
1
select 400 = 400;
400 = 400
1
select 200 = 200;
200 = 200
1
drop table t1;
create table t1 (id int PRIMARY KEY, 
doc varchar(100),
VECTOR INDEX hybrid_index(doc) WITH (distance=L2,type=hnsw, dim=1024,model=guiji_embed, sync_mode=manual));
call dbms_vector.refresh_index('hybrid_index','t1','doc', 0);
delete from t1 where id < 100;
call dbms_vector.refresh_index('hybrid_index','t1','doc', 0);
select 0 = 0;
0 = 0
1
select 300 = 300;
300 = 300
1
select 100 = 100;
100 = 100
1
drop table t1;
create table t1 (id int PRIMARY KEY, 
doc varchar(100),
VECTOR INDEX hybrid_index(doc) WITH (distance=L2,type=hnsw, dim=1024,model=guiji_embed, sync_mode=manual));
call dbms_vector.refresh_index('hybrid_index','t1','doc', 0);
update t1 set doc = 'sss' where id < 100;
call dbms_vector.refresh_index('hybrid_index','t1','doc', 0);
select 0 = 0;
0 = 0
1
select 400 = 400;
400 = 400
1
select 200 = 200;
200 = 200
1
drop table t1;
create table t1 (id int PRIMARY KEY, 
doc varchar(100),
VECTOR INDEX hybrid_index(doc) WITH (distance=L2,type=hnsw, dim=1024,model=guiji_embed, sync_mode=manual));
call dbms_vector.refresh_index('hybrid_index','t1','doc', 0);
delete from t1 where id < 100;
call dbms_vector.refresh_index('hybrid_index','t1','doc', 0);
select 0 = 0;
0 = 0
1
select 300 = 300;
300 = 300
1
select 100 = 100;
100 = 100
1
drop table t1;
create table t1 (id int PRIMARY KEY, 
doc varchar(100),
VECTOR INDEX hybrid_index(doc) WITH (distance=L2,type=hnsw, dim=1024,model=ob_embed, sync_mode=manual));
call dbms_vector.refresh_index('hybrid_index','t1','doc', 0);
update t1 set doc = 'sss' where id < 100;
call dbms_vector.refresh_index('hybrid_index','t1','doc', 0);
select 0 = 0;
0 = 0
1
select 400 = 400;
400 = 400
1
select 200 = 200;
200 = 200
1
drop table t1;
create table t1 (id int PRIMARY KEY, 
doc varchar(100),
VECTOR INDEX hybrid_index(doc) WITH (distance=L2,type=hnsw, dim=1024,model=ob_embed, sync_mode=manual));
call dbms_vector.refresh_index('hybrid_index','t1','doc', 0);
delete from t1 where id < 100;
call dbms_vector.refresh_index('hybrid_index','t1','doc', 0);
select 0 = 0;
0 = 0
1
select 300 = 300;
300 = 300
1
select 100 = 100;
100 = 100
1
drop table t1;
create table t1 (id int PRIMARY KEY, 
doc varchar(100),
VECTOR INDEX hybrid_index(doc) WITH (distance=L2,type=hnsw, dim=1024,model=ob_embed, sync_mode=manual));
call dbms_vector.refresh_index('hybrid_index','t1','doc', 0);
update t1 set doc = 'sss' where id < 100;
call dbms_vector.refresh_index('hybrid_index','t1','doc', 0);
select 0 = 0;
0 = 0
1
select 400 = 400;
400 = 400
1
select 200 = 200;
200 = 200
1
drop table t1;
create table t1 (id int PRIMARY KEY, 
doc varchar(100),
VECTOR INDEX hybrid_index(doc) WITH (distance=L2,type=hnsw, dim=1024,model=ob_embed, sync_mode=manual));
call dbms_vector.refresh_index('hybrid_index','t1','doc', 0);
delete from t1 where id < 100;
call dbms_vector.refresh_index('hybrid_index','t1','doc', 0);
select 0 = 0;
0 = 0
1
select 300 = 300;
300 = 300
1
select 100 = 100;
100 = 100
1
drop table t1;
create table t1 (id int PRIMARY KEY, 
doc varchar(100),
VECTOR INDEX hybrid_index(doc) WITH (distance=L2,type=hnsw, dim=1024,model=ob_embed, sync_mode=async, sync_interval=3s)) partition by hash(id) partitions 6;
call dbms_vector.refresh_index('hybrid_index','t1','doc', 0);
select 6 = 6;
6 = 6
1
select 0 = 0;
0 = 0
1
select 200 = 200;
200 = 200
1
select 200 = 200;
200 = 200
1
drop table t1;
create table t1 (id int PRIMARY KEY, 
doc varchar(100),
VECTOR INDEX hybrid_index(doc) WITH (distance=L2,type=hnsw, dim=1024, extra_info_max_size=1, model=ob_embed, sync_mode=async, sync_interval=3s));
select 0 = 0;
0 = 0
1
select 200 = 200;
200 = 200
1
select 200 = 200;
200 = 200
1
drop table t1;
create table t1 (id int PRIMARY KEY, 
doc varchar(100),
VECTOR INDEX hybrid_index(doc) WITH (distance=L2,type=hnsw, extra_info_max_size=1, dim=1024,model=ob_embed, sync_mode=async, sync_interval=3s)) partition by hash(id) partitions 6;
call dbms_vector.refresh_index('hybrid_index','t1','doc', 0);
select 6 = 6;
6 = 6
1
select 0 = 0;
0 = 0
1
select 200 = 200;
200 = 200
1
select 200 = 200;
200 = 200
1
drop table t1;
create table t1 (id int PRIMARY KEY, 
doc varchar(100),
VECTOR INDEX hybrid_index(doc) WITH (distance=L2,type=hnsw, dim=1024,model=ob_embed, sync_mode=async, sync_interval=3s));
call dbms_vector.rebuild_index('hybrid_index','t1','doc', 0);
select 0 = 0;
0 = 0
1
select 0 = 0;
0 = 0
1
select 1 = 1;
1 = 1
1
drop table t1;
create table t1 (id int PRIMARY KEY, 
doc varchar(100),
VECTOR INDEX hybrid_index(doc) WITH (distance=L2,type=hnsw, dim=1024,model=guiji_embed, sync_mode=manual));
insert into t1 values(1,'abc');
insert into t1 values(2,'abc');
call dbms_vector.refresh_index('hybrid_index','t1','doc', 0);
select * from t1 order by semantic_distance(doc, 'monkey')  approximate limit 3;
id	doc
1	abc
2	abc
select 0 = 0;
0 = 0
1
select 0 = 0;
0 = 0
1
select 1 = 1;
1 = 1
1
drop table t1;
create table t1 (id int PRIMARY KEY, 
doc varchar(100),
VECTOR INDEX hybrid_index(doc) WITH (distance=L2,type=hnsw, dim=1024,model=guiji_embed, sync_mode=manual));
insert into t1 values(1,'abc');
insert into t1 values(2,'abc');
call dbms_vector.refresh_index('hybrid_index','t1','doc', 0);
select * from t1 order by semantic_distance(doc, 'monkey')  approximate limit 3;
id	doc
1	abc
2	abc
select 0 = 0;
0 = 0
1
select 0 = 0;
0 = 0
1
select 1 = 1;
1 = 1
1
drop table t1;
create table t1 (id int PRIMARY KEY, 
doc varchar(100),
VECTOR INDEX hybrid_index(doc) WITH (distance=L2,type=hnsw, dim=1024,model=ob_embed, sync_mode=manual));
insert into t1 values(1,'abc');
insert into t1 values(2,'abc');
call dbms_vector.refresh_index('hybrid_index','t1','doc', 0);
select * from t1 order by semantic_distance(doc, 'monkey')  approximate limit 3;
id	doc
1	abc
2	abc
select 0 = 0;
0 = 0
1
select 0 = 0;
0 = 0
1
select 1 = 1;
1 = 1
1
drop table t1;
create table t1 (id int PRIMARY KEY, 
doc varchar(100),
VECTOR INDEX hybrid_index(doc) WITH (distance=L2,type=hnsw, dim=1024,model=ob_embed, sync_mode=manual));
insert into t1 values(1,'abc');
insert into t1 values(2,'abc');
call dbms_vector.refresh_index('hybrid_index','t1','doc', 0);
select * from t1 order by semantic_distance(doc, 'monkey')  approximate limit 3;
id	doc
1	abc
2	abc
select 0 = 0;
0 = 0
1
select 0 = 0;
0 = 0
1
select 1 = 1;
1 = 1
1
drop table t1;
create table t1 (id int PRIMARY KEY, 
doc varchar(100),
VECTOR INDEX hybrid_index(doc) WITH (distance=L2,type=hnsw, dim=1024,model=ob_embed, sync_mode=async, sync_interval=3s)) partition by hash(id) partitions 6;
call dbms_vector.rebuild_index('hybrid_index','t1','doc', 0);
select 6 = 6;
6 = 6
1
select 0 = 0;
0 = 0
1
select 0 = 0;
0 = 0
1
select 1 = 1;
1 = 1
1
drop table t1;
create table t1 (id int PRIMARY KEY, 
doc varchar(100),
VECTOR INDEX hybrid_index(doc) WITH (distance=L2,type=hnsw, dim=1024, extra_info_max_size=1, model=ob_embed, sync_mode=async, sync_interval=3s));
call dbms_vector.rebuild_index('hybrid_index','t1','doc', 0);
select 0 = 0;
0 = 0
1
select 0 = 0;
0 = 0
1
select 1 = 1;
1 = 1
1
drop table t1;
create table t1 (id int PRIMARY KEY, 
doc varchar(100),
VECTOR INDEX hybrid_index(doc) WITH (distance=L2,type=hnsw, extra_info_max_size=1, dim=1024,model=ob_embed, sync_mode=async, sync_interval=3s)) partition by hash(id) partitions 6;
call dbms_vector.rebuild_index('hybrid_index','t1','doc', 0);
select 6 = 6;
6 = 6
1
select 0 = 0;
0 = 0
1
select 0 = 0;
0 = 0
1
select 1 = 1;
1 = 1
1
drop table t1;
create table t1 (id int PRIMARY KEY, 
doc varchar(100),
VECTOR INDEX hybrid_index(doc) WITH (distance=L2,type=hnsw, dim=1024,model=ob_embed,sync_mode=IMMEDIATE));
select 0 = 0;
0 = 0
1
select 200 = 200;
200 = 200
1
select 200 = 200;
200 = 200
1
drop table t1;
create table t1 (id int PRIMARY KEY, 
doc varchar(100),
VECTOR INDEX hybrid_index(doc) WITH (distance=L2,type=hnsw, dim=1024,model=ob_embed,sync_mode=IMMEDIATE)) partition by hash(id) partitions 6;
call dbms_vector.refresh_index('hybrid_index','t1','doc', 0);
select 6 = 6;
6 = 6
1
select 0 = 0;
0 = 0
1
select 200 = 200;
200 = 200
1
select 200 = 200;
200 = 200
1
drop table t1;
create table t1 (id int PRIMARY KEY, 
doc varchar(100),
VECTOR INDEX hybrid_index(doc) WITH (distance=L2,type=hnsw, dim=1024, extra_info_max_size=1, model=ob_embed,sync_mode=IMMEDIATE));
select 0 = 0;
0 = 0
1
select 200 = 200;
200 = 200
1
select 200 = 200;
200 = 200
1
drop table t1;
create table t1 (id int PRIMARY KEY, 
doc varchar(100),
VECTOR INDEX hybrid_index(doc) WITH (distance=L2,type=hnsw, extra_info_max_size=1, dim=1024,model=ob_embed,sync_mode=IMMEDIATE)) partition by hash(id) partitions 6;
call dbms_vector.refresh_index('hybrid_index','t1','doc', 0);
select 6 = 6;
6 = 6
1
select 0 = 0;
0 = 0
1
select 200 = 200;
200 = 200
1
select 200 = 200;
200 = 200
1
drop table t1;
create table t1 (id int PRIMARY KEY, 
doc varchar(100),
VECTOR INDEX hybrid_index(doc) WITH (distance=L2,type=hnsw, dim=1024,model=ob_embed,sync_mode=IMMEDIATE));
call dbms_vector.rebuild_index('hybrid_index','t1','doc', 0);
select 0 = 0;
0 = 0
1
select 0 = 0;
0 = 0
1
select 1 = 1;
1 = 1
1
drop table t1;
create table t1 (id int PRIMARY KEY, 
doc varchar(100),
VECTOR INDEX hybrid_index(doc) WITH (distance=L2,type=hnsw, dim=1024,model=ob_embed,sync_mode=IMMEDIATE)) partition by hash(id) partitions 6;
call dbms_vector.rebuild_index('hybrid_index','t1','doc', 0);
select 6 = 6;
6 = 6
1
select 0 = 0;
0 = 0
1
select 0 = 0;
0 = 0
1
select 1 = 1;
1 = 1
1
drop table t1;
create table t1 (id int PRIMARY KEY, 
doc varchar(100),
VECTOR INDEX hybrid_index(doc) WITH (distance=L2,type=hnsw, dim=1024, extra_info_max_size=1, model=ob_embed,sync_mode=IMMEDIATE));
call dbms_vector.rebuild_index('hybrid_index','t1','doc', 0);
select 0 = 0;
0 = 0
1
select 0 = 0;
0 = 0
1
select 1 = 1;
1 = 1
1
drop table t1;
create table t1 (id int PRIMARY KEY, 
doc varchar(100),
VECTOR INDEX hybrid_index(doc) WITH (distance=L2,type=hnsw, extra_info_max_size=1, dim=1024,model=ob_embed,sync_mode=IMMEDIATE)) partition by hash(id) partitions 6;
call dbms_vector.rebuild_index('hybrid_index','t1','doc', 0);
select 6 = 6;
6 = 6
1
select 0 = 0;
0 = 0
1
select 0 = 0;
0 = 0
1
select 1 = 1;
1 = 1
1
drop table t1;
create table t1 (id int not null default 3, 
doc varchar(100),
VECTOR INDEX hybrid_index(doc) WITH (distance=L2,type=hnsw, dim=1024,model=guiji_embed,sync_mode=async, sync_interval=3s)) partition by hash(id) partitions 6;
alter table t1 alter column id drop default;
insert into t1 values(1,'ab');
call dbms_vector.refresh_index('hybrid_index','t1','doc', 0);
drop table t1;
create table t1 (id int primary key, 
doc varchar(100),
VECTOR INDEX hybrid_index(doc) WITH (distance=L2,type=hnsw, dim=1024,model=guiji_embed,sync_mode=manual)) partition by hash(id) partitions 22;
call dbms_vector.refresh_index('hybrid_index','t1','doc', 0);
select 6 = 22;
6 = 22
0
create table t1 (id int primary key, 
doc varchar(100),
VECTOR INDEX hybrid_index(doc) WITH (distance=L2,type=hnsw, dim=1024,model=ob_embed,sync_mode=manual)) partition by hash(id) partitions 22;
call dbms_vector.refresh_index('hybrid_index','t1','doc', 0);
select 6 = 22;
6 = 22
0
call DBMS_AI_SERVICE.DROP_AI_MODEL_ENDPOINT ('ob_embed_endpoint');
call DBMS_AI_SERVICE.DROP_AI_MODEL ('ob_embed');
alter system set ob_vector_memory_limit_percentage=0;
