alter system set ob_vector_memory_limit_percentage = 20;
set global max_allowed_packet=1073741824;
call DBMS_AI_SERVICE.DROP_AI_MODEL_ENDPOINT ('ob_embed_endpoint');
call DBMS_AI_SERVICE.DROP_AI_MODEL ('ob_embed');
call DBMS_AI_SERVICE.CREATE_AI_MODEL(
'ob_embed', '{
    "type": "dense_embedding",
    "model_name": "qwen3-embedding"
  }');
alter system set _enable_semantic_index=true;
set ob_trx_timeout=100000000;
set ob_query_timeout=1000000000;
drop table if exists t1;
create table t1(
pk int primary key, 
tiny_text tinytext, 
tiny_blob tinyblob, 
text_type text, 
blob_type blob, 
medium_text mediumtext, 
medium_blob mediumblob, 
long_text longtext, 
long_blob longblob,
doc_content varchar(1000),
vector index idx_doc(doc_content) with (distance=l2, type=hnsw, model=ob_embed, dim=1024, sync_mode=immediate)
);
insert into t1 values (1, NULL, NULL, NULL, NULL, NULL, NULL, NULL, NULL, NULL);
insert into t1 values (2, "", "", "", "", "", "", "", "", "");
select md5(tiny_text) from t1 where pk = 2;
md5(tiny_text)
d41d8cd98f00b204e9800998ecf8427e
set global max_allowed_packet=1073741824;
insert into t1 values (3, repeat('1', 255), repeat('2', 255), repeat('3', 65535), repeat('4', 65535), repeat('5', 16777215), repeat('6', 16777215), "", "", 'This is a test document for vector search with LOB data');
select md5(tiny_text), md5(tiny_blob), md5(text_type), md5(blob_type), md5(medium_text), md5(medium_blob), md5(long_text), md5(long_blob) from t1 where pk = 3;
md5(tiny_text)	md5(tiny_blob)	md5(text_type)	md5(blob_type)	md5(medium_text)	md5(medium_blob)	md5(long_text)	md5(long_blob)
b6bda3916ddcc9d08f100bbcc7f3f7b9	a9a38db89b522c94ff36bdc72080e9d3	689ec8b6622b2e707a25ac6fe45fece5	aab8cc7112b8386e3d2f73eb9f29d36e	68eb0c52dcd8bea786ce2b43890d488d	f991f305c222d49f989f5cd0633b0cce	d41d8cd98f00b204e9800998ecf8427e	d41d8cd98f00b204e9800998ecf8427e
insert into t1 values (4, "", "", "", "", "", "", repeat('a', 50331647), repeat('b', 11534336), 'Large LOB document with vector search capabilities for similarity matching');
select md5(long_text), md5(long_blob)  from t1 where pk = 4;
md5(long_text)	md5(long_blob)
c57d4c3741dc0eb85d767497f9736503	2c935e46cfdb63ec4d3dc7c05351aa7f
insert into t1 values (5, "", "", "", "", "", "", repeat('c',11534336), repeat('d', 50331647), 'Another large document for testing hybrid vector index with LOB fields');
select md5(long_text), md5(long_blob)  from t1 where pk = 5;
md5(long_text)	md5(long_blob)
4cf1a6c97de72dee3c22318050c0d533	508756eedf9e262f4cb7bb4140b5c01e
update t1 set long_text=repeat('d', 50331647), long_blob=repeat('c', 11534336), doc_content='Updated document content for vector search testing' where pk = 5;
select md5(long_text), md5(long_blob) from t1 where pk = 5;
md5(long_text)	md5(long_blob)
508756eedf9e262f4cb7bb4140b5c01e	4cf1a6c97de72dee3c22318050c0d533
update t1 set medium_text=repeat('e', 11534336), medium_blob=repeat('f', 16777215), long_text=repeat('g', 16777215), long_blob=repeat('h', 16777215), doc_content='Modified document with updated LOB data and vector content' where pk=5;
select md5(medium_text), md5(medium_blob), md5(long_text), md5(long_blob) from t1 where pk = 5;
md5(medium_text)	md5(medium_blob)	md5(long_text)	md5(long_blob)
06247e1a56b142ec268db9b3f386fe3f	c2692c60eecd0a043304ba5022b9aa94	302a43721d74c0442eda8741a016aaef	a7b4226ebb0fa205ca75600f44c395e1
begin;
insert into t1 values (100, NULL, NULL, NULL, NULL, NULL, NULL, NULL, NULL, 'Small document for transaction testing');
update t1 set long_blob=repeat('1', 2097152), doc_content='Updated with large LOB data in transaction' where pk = 100;
select md5(long_blob) from t1 where pk = 100;
md5(long_blob)
b4fc0c467a8d5b04868d12a0d3f43a92
insert into t1 (pk, text_type, doc_content) values (200, repeat('2', 16384), 'Medium size document with text LOB field');
select md5(text_type) from t1 where pk = 200;
md5(text_type)
f49f763496f52447cf31360dd8287701
update t1 set medium_text=repeat('3', 8388608), doc_content='Large medium text document for vector search' where pk = 200;
select md5(medium_text) from t1 where pk = 200;
md5(medium_text)
0a3db809cf76aca529fbda3a53b72144
update t1 set long_text=repeat('4', 50331647), doc_content='Very large document with maximum LOB size for comprehensive testing' where pk = 200;
select md5(long_text) from t1 where pk = 200;
md5(long_text)
8478458ec2df0f69dfe700d6a7e0ca4f
commit;
delete from t1;
create table t2(
pk int primary key, 
tiny_text tinytext, 
tiny_blob tinyblob, 
text_type text, 
blob_type blob, 
medium_text mediumtext, 
medium_blob mediumblob, 
long_text longtext, 
long_blob longblob,
doc_content varchar(1000),
vector index idx_doc2(doc_content) with (distance=l2, type=hnsw, model=ob_embed, dim=1024, sync_mode=immediate)
);
begin;
insert into t1 (pk, doc_content) values (1, 'Simple document for distributed transaction');
insert into t2 (pk, doc_content) values (1, 'Simple document in second table');
insert into t1 values (2, repeat('1', 255), repeat('2', 255), repeat('3', 65535), repeat('4', 65535), repeat('5', 1048576), repeat('6', 1048576), "", "", 'Distributed transaction document with LOB data');
insert into t2 values (2, repeat('1', 255), repeat('2', 255), repeat('3', 65535), repeat('4', 65535), repeat('5', 1048576), repeat('6', 1048576), "", "", 'Second table document with LOB data');
select md5(tiny_text),  md5(tiny_blob), md5(text_type), md5(blob_type), md5(medium_text), md5(medium_blob), md5(long_text), md5(long_blob) from t1 where pk = 2;
md5(tiny_text)	md5(tiny_blob)	md5(text_type)	md5(blob_type)	md5(medium_text)	md5(medium_blob)	md5(long_text)	md5(long_blob)
b6bda3916ddcc9d08f100bbcc7f3f7b9	a9a38db89b522c94ff36bdc72080e9d3	689ec8b6622b2e707a25ac6fe45fece5	aab8cc7112b8386e3d2f73eb9f29d36e	803b29bfaaec2d131d49d0a3a5161bd3	99952049d5e6088d8a3db1846c04d444	d41d8cd98f00b204e9800998ecf8427e	d41d8cd98f00b204e9800998ecf8427e
insert into t1 values (3, 'a', 'bb', 'ccc', 'dddd', 'eeee', 'fffff', 'gggggg', 'hhhhhhh', 'Normal document with small LOB fields');
insert into t2 values (3, 'a', 'bb', 'ccc', 'dddd', 'eeee', 'fffff', 'gggggg', 'hhhhhhh', 'Normal document in second table');
select md5(tiny_text),  md5(tiny_blob), md5(text_type), md5(blob_type), md5(medium_text), md5(medium_blob), md5(long_text), md5(long_blob) from t1 where pk = 3;
md5(tiny_text)	md5(tiny_blob)	md5(text_type)	md5(blob_type)	md5(medium_text)	md5(medium_blob)	md5(long_text)	md5(long_blob)
0cc175b9c0f1b6a831c399e269772661	21ad0bd836b90d08f4cf640b4c298e7c	9df62e693988eb4e1e1444ece0578579	11ddbaf3386aea1f2974eee984542152	670da91be64127c92faac35c8300e814	a98f6f64e6cdfac22ab2ffd15a7241e3	9cafeef08db2dd477098a0293e71f90a	b5c75e6bbcfcd0e6520b5f1419ded614
insert into t1 values (4, repeat('1', 255), repeat('2', 255), repeat('3', 65535), repeat('4', 65535), repeat('5', 1048576), repeat('6', 1048576), repeat('7', 6291456), repeat('8', 6291456), 'Large LOB document for distributed transaction testing');
insert into t2 values (4, repeat('1', 255), repeat('2', 255), repeat('3', 65535), repeat('4', 65535), repeat('5', 1048576), repeat('6', 1048576), repeat('7', 6291456), repeat('8', 6291456), 'Large LOB document in second table');
select md5(tiny_text),  md5(tiny_blob), md5(text_type), md5(blob_type), md5(medium_text), md5(medium_blob), md5(long_text), md5(long_blob) from t1 where pk = 4;
md5(tiny_text)	md5(tiny_blob)	md5(text_type)	md5(blob_type)	md5(medium_text)	md5(medium_blob)	md5(long_text)	md5(long_blob)
b6bda3916ddcc9d08f100bbcc7f3f7b9	a9a38db89b522c94ff36bdc72080e9d3	689ec8b6622b2e707a25ac6fe45fece5	aab8cc7112b8386e3d2f73eb9f29d36e	803b29bfaaec2d131d49d0a3a5161bd3	99952049d5e6088d8a3db1846c04d444	d6dc533b969c7c6622fce46fb33926f4	f0382b245dd979c9f24486f3b164b60d
insert into t1 values (5, repeat('1', 255), repeat('2', 255), repeat('3', 65535), repeat('4', 65535), repeat('5', 16777215), repeat('6', 16777215), repeat('7', 13631488), repeat('8', 13631488), 'Maximum size LOB document for comprehensive distributed transaction testing');
insert into t2 values (5, repeat('1', 255), repeat('2', 255), repeat('3', 65535), repeat('4', 65535), repeat('5', 16777215), repeat('6', 16777215), repeat('7', 13631488), repeat('8', 13631488), 'Maximum size LOB document in second table');
select md5(tiny_text),  md5(tiny_blob), md5(text_type), md5(blob_type), md5(medium_text), md5(medium_blob), md5(long_text), md5(long_blob) from t1 where pk = 5;
md5(tiny_text)	md5(tiny_blob)	md5(text_type)	md5(blob_type)	md5(medium_text)	md5(medium_blob)	md5(long_text)	md5(long_blob)
b6bda3916ddcc9d08f100bbcc7f3f7b9	a9a38db89b522c94ff36bdc72080e9d3	689ec8b6622b2e707a25ac6fe45fece5	aab8cc7112b8386e3d2f73eb9f29d36e	68eb0c52dcd8bea786ce2b43890d488d	f991f305c222d49f989f5cd0633b0cce	01ec5ac3b20b67f5a7e361ad003be80a	c38cfc9065746da60c28833e89808d01
commit;
begin;
update t1 set long_blob="clear longblob", doc_content='Cleared LOB with updated vector content' where pk = 1;
select md5(long_blob) from t1 where pk = 1;
md5(long_blob)
49214d7046f5120b291cb68f1f12a455
update t2 set medium_blob="clear mediumblob", doc_content='Cleared medium blob in second table' where pk = 1;
select md5(medium_blob) from t2 where pk = 1;
md5(medium_blob)
f417980c2bf6f26bdf9d741d55929e27
update t2 set medium_blob="clear mediumblob", doc_content='Updated medium blob again' where pk = 1;
select md5(medium_blob) from t2 where pk = 1;
md5(medium_blob)
f417980c2bf6f26bdf9d741d55929e27
update t1 set pk = 6, doc_content='Updated primary key with new vector content' where pk = 5;
commit;
begin;
delete from t1 where pk = 1;
delete from t1 where pk = 4;
delete from t1 where pk = 3;
delete from t2 where pk = 2;
delete from t2 where pk = 5;
commit;
create table lob_t1(
a int primary key, 
c2 longtext,
doc_content varchar(1000),
vector index idx_lob_doc(doc_content) with (distance=l2, type=hnsw, model=ob_embed, dim=1024, sync_mode=immediate)
) merge_engine = delete_insert;
insert into lob_t1 values(123456, repeat('1', 1024*10), 'Merge engine document with LOB data');
update lob_t1 set c2 = repeat('2', 1024*10), doc_content='Updated merge engine document' where a = 123456;
CREATE TABLE t1_json(
pk int primary key, 
json_col_1 JSON,
doc_content varchar(1000),
vector index idx_json_doc(doc_content) with (distance=l2, type=hnsw, model=ob_embed, dim=1024, sync_mode=immediate)
) merge_engine = delete_insert;
SET @a:=CONCAT('[',REPEAT('"a",',200000),'"a"]');
INSERT INTO t1_json VALUES(3, @a, 'JSON document with large array for vector search testing');
select md5(json_col_1) from t1_json where pk = 3;
md5(json_col_1)
fb40a1efd15a961c607b7e9d3169b13e
SET @b:=CONCAT('[',REPEAT('"b",',200000),'"b"]');
update t1_json set json_col_1 = @b, doc_content='Updated JSON document with new array data' where pk = 3;
select md5(json_col_1) from t1_json where pk = 3;
md5(json_col_1)
29c9699a10efa5f60eae88b4a89b3211
添加新的LOB列
alter table t1 add column new_text text, add column new_blob blob;
show create table t1;
Table	Create Table
t1	CREATE TABLE `t1` (
  `pk` int(11) NOT NULL,
  `tiny_text` tinytext DEFAULT NULL,
  `tiny_blob` tinyblob DEFAULT NULL,
  `text_type` text DEFAULT NULL,
  `blob_type` blob DEFAULT NULL,
  `medium_text` mediumtext DEFAULT NULL,
  `medium_blob` mediumblob DEFAULT NULL,
  `long_text` longtext DEFAULT NULL,
  `long_blob` longblob DEFAULT NULL,
  `doc_content` varchar(1000) DEFAULT NULL,
  `new_text` text DEFAULT NULL,
  `new_blob` blob DEFAULT NULL,
  PRIMARY KEY (`pk`),
  VECTOR KEY `idx_doc` (`doc_content`) WITH (DISTANCE=L2, TYPE=HNSW, MODEL=OB_EMBED, DIM=1024, SYNC_MODE=IMMEDIATE, LIB=VSAG, M=16, EF_CONSTRUCTION=200, EF_SEARCH=64, SYNC_INTERVAL=10s) BLOCK_SIZE 16384
) ORGANIZATION INDEX DEFAULT CHARSET = utf8mb4 ROW_FORMAT = DYNAMIC COMPRESSION = 'zstd_1.3.8' REPLICA_NUM = 1 BLOCK_SIZE = 16384 USE_BLOOM_FILTER = FALSE ENABLE_MACRO_BLOCK_BLOOM_FILTER = FALSE TABLET_SIZE = 134217728 PCTFREE = 0
insert into t1 values (10, 'test', 'test', 'test', 'test', 'test', 'test', 'test', 'test', 'New LOB columns test document', 'new_text_content', 'new_blob_content');
select md5(new_text), md5(new_blob) from t1 where pk = 10;
md5(new_text)	md5(new_blob)
8de959f311c9434be65b5b856246ef8d	9cc6a080e6e551271f393f5ab43fb4df
修改LOB列类型
alter table t1 modify column new_text mediumtext, modify column new_blob mediumblob;
show create table t1;
Table	Create Table
t1	CREATE TABLE `t1` (
  `pk` int(11) NOT NULL,
  `tiny_text` tinytext DEFAULT NULL,
  `tiny_blob` tinyblob DEFAULT NULL,
  `text_type` text DEFAULT NULL,
  `blob_type` blob DEFAULT NULL,
  `medium_text` mediumtext DEFAULT NULL,
  `medium_blob` mediumblob DEFAULT NULL,
  `long_text` longtext DEFAULT NULL,
  `long_blob` longblob DEFAULT NULL,
  `doc_content` varchar(1000) DEFAULT NULL,
  `new_text` mediumtext DEFAULT NULL,
  `new_blob` mediumblob DEFAULT NULL,
  PRIMARY KEY (`pk`),
  VECTOR KEY `idx_doc` (`doc_content`) WITH (DISTANCE=L2, TYPE=HNSW, MODEL=OB_EMBED, DIM=1024, SYNC_MODE=IMMEDIATE, LIB=VSAG, M=16, EF_CONSTRUCTION=200, EF_SEARCH=64, SYNC_INTERVAL=10s) BLOCK_SIZE 16384
) ORGANIZATION INDEX DEFAULT CHARSET = utf8mb4 ROW_FORMAT = DYNAMIC COMPRESSION = 'zstd_1.3.8' REPLICA_NUM = 1 BLOCK_SIZE = 16384 USE_BLOOM_FILTER = FALSE ENABLE_MACRO_BLOCK_BLOOM_FILTER = FALSE TABLET_SIZE = 134217728 PCTFREE = 0
update t1 set new_text=repeat('medium_text', 1000), new_blob=repeat('medium_blob', 1000), doc_content='Updated with medium LOB types' where pk = 10;
select md5(new_text), md5(new_blob) from t1 where pk = 10;
md5(new_text)	md5(new_blob)
83c1d0c4568c6cfa6549ef355de79d60	91ef9139b0d293a32f1fea75413af0b4
重命名LOB列
alter table t1 rename column new_text to renamed_text, rename column new_blob to renamed_blob;
show create table t1;
Table	Create Table
t1	CREATE TABLE `t1` (
  `pk` int(11) NOT NULL,
  `tiny_text` tinytext DEFAULT NULL,
  `tiny_blob` tinyblob DEFAULT NULL,
  `text_type` text DEFAULT NULL,
  `blob_type` blob DEFAULT NULL,
  `medium_text` mediumtext DEFAULT NULL,
  `medium_blob` mediumblob DEFAULT NULL,
  `long_text` longtext DEFAULT NULL,
  `long_blob` longblob DEFAULT NULL,
  `doc_content` varchar(1000) DEFAULT NULL,
  `renamed_text` mediumtext DEFAULT NULL,
  `renamed_blob` mediumblob DEFAULT NULL,
  PRIMARY KEY (`pk`),
  VECTOR KEY `idx_doc` (`doc_content`) WITH (DISTANCE=L2, TYPE=HNSW, MODEL=OB_EMBED, DIM=1024, SYNC_MODE=IMMEDIATE, LIB=VSAG, M=16, EF_CONSTRUCTION=200, EF_SEARCH=64, SYNC_INTERVAL=10s) BLOCK_SIZE 16384
) ORGANIZATION INDEX DEFAULT CHARSET = utf8mb4 ROW_FORMAT = DYNAMIC COMPRESSION = 'zstd_1.3.8' REPLICA_NUM = 1 BLOCK_SIZE = 16384 USE_BLOOM_FILTER = FALSE ENABLE_MACRO_BLOCK_BLOOM_FILTER = FALSE TABLET_SIZE = 134217728 PCTFREE = 0
update t1 set renamed_text=repeat('renamed_text', 2000), renamed_blob=repeat('renamed_blob', 2000), doc_content='Updated with renamed LOB columns' where pk = 10;
select md5(renamed_text), md5(renamed_blob) from t1 where pk = 10;
md5(renamed_text)	md5(renamed_blob)
c4dcd33c361a37bb93803efe9b2c2e79	ad25c42cc804e705fa9faf2745107724
删除LOB列
alter table t1 drop column renamed_text, drop column renamed_blob;
show create table t1;
Table	Create Table
t1	CREATE TABLE `t1` (
  `pk` int(11) NOT NULL,
  `tiny_text` tinytext DEFAULT NULL,
  `tiny_blob` tinyblob DEFAULT NULL,
  `text_type` text DEFAULT NULL,
  `blob_type` blob DEFAULT NULL,
  `medium_text` mediumtext DEFAULT NULL,
  `medium_blob` mediumblob DEFAULT NULL,
  `long_text` longtext DEFAULT NULL,
  `long_blob` longblob DEFAULT NULL,
  `doc_content` varchar(1000) DEFAULT NULL,
  PRIMARY KEY (`pk`),
  VECTOR KEY `idx_doc` (`doc_content`) WITH (DISTANCE=L2, TYPE=HNSW, MODEL=OB_EMBED, DIM=1024, SYNC_MODE=IMMEDIATE, LIB=VSAG, M=16, EF_CONSTRUCTION=200, EF_SEARCH=64, SYNC_INTERVAL=10s) BLOCK_SIZE 16384
) ORGANIZATION INDEX DEFAULT CHARSET = utf8mb4 ROW_FORMAT = DYNAMIC COMPRESSION = 'zstd_1.3.8' REPLICA_NUM = 1 BLOCK_SIZE = 16384 USE_BLOOM_FILTER = FALSE ENABLE_MACRO_BLOCK_BLOOM_FILTER = FALSE TABLET_SIZE = 134217728 PCTFREE = 0
update t1 set doc_content='Updated after dropping LOB columns' where pk = 10;
=== 测试hybrid vector index相关的DDL操作 ===
添加新的hybrid vector index
alter table t1 add column doc_content2 varchar(1000);
show create table t1;
Table	Create Table
t1	CREATE TABLE `t1` (
  `pk` int(11) NOT NULL,
  `tiny_text` tinytext DEFAULT NULL,
  `tiny_blob` tinyblob DEFAULT NULL,
  `text_type` text DEFAULT NULL,
  `blob_type` blob DEFAULT NULL,
  `medium_text` mediumtext DEFAULT NULL,
  `medium_blob` mediumblob DEFAULT NULL,
  `long_text` longtext DEFAULT NULL,
  `long_blob` longblob DEFAULT NULL,
  `doc_content` varchar(1000) DEFAULT NULL,
  `doc_content2` varchar(1000) DEFAULT NULL,
  PRIMARY KEY (`pk`),
  VECTOR KEY `idx_doc` (`doc_content`) WITH (DISTANCE=L2, TYPE=HNSW, MODEL=OB_EMBED, DIM=1024, SYNC_MODE=IMMEDIATE, LIB=VSAG, M=16, EF_CONSTRUCTION=200, EF_SEARCH=64, SYNC_INTERVAL=10s) BLOCK_SIZE 16384
) ORGANIZATION INDEX DEFAULT CHARSET = utf8mb4 ROW_FORMAT = DYNAMIC COMPRESSION = 'zstd_1.3.8' REPLICA_NUM = 1 BLOCK_SIZE = 16384 USE_BLOOM_FILTER = FALSE ENABLE_MACRO_BLOCK_BLOOM_FILTER = FALSE TABLET_SIZE = 134217728 PCTFREE = 0
insert into t1 values (11, 'test', 'test', 'test', 'test', 'test', 'test', 'test', 'test', 'Original vector content', 'Second vector content');
重命名hybrid vector index
alter table t1 rename index idx_doc to renamed_vector_idx;
show create table t1;
Table	Create Table
t1	CREATE TABLE `t1` (
  `pk` int(11) NOT NULL,
  `tiny_text` tinytext DEFAULT NULL,
  `tiny_blob` tinyblob DEFAULT NULL,
  `text_type` text DEFAULT NULL,
  `blob_type` blob DEFAULT NULL,
  `medium_text` mediumtext DEFAULT NULL,
  `medium_blob` mediumblob DEFAULT NULL,
  `long_text` longtext DEFAULT NULL,
  `long_blob` longblob DEFAULT NULL,
  `doc_content` varchar(1000) DEFAULT NULL,
  `doc_content2` varchar(1000) DEFAULT NULL,
  PRIMARY KEY (`pk`),
  VECTOR KEY `renamed_vector_idx` (`doc_content`) WITH (DISTANCE=L2, TYPE=HNSW, MODEL=OB_EMBED, DIM=1024, SYNC_MODE=IMMEDIATE, LIB=VSAG, M=16, EF_CONSTRUCTION=200, EF_SEARCH=64, SYNC_INTERVAL=10s) BLOCK_SIZE 16384
) ORGANIZATION INDEX DEFAULT CHARSET = utf8mb4 ROW_FORMAT = DYNAMIC COMPRESSION = 'zstd_1.3.8' REPLICA_NUM = 1 BLOCK_SIZE = 16384 USE_BLOOM_FILTER = FALSE ENABLE_MACRO_BLOCK_BLOOM_FILTER = FALSE TABLET_SIZE = 134217728 PCTFREE = 0
删除hybrid vector index
alter table t1 drop index renamed_vector_idx;
show create table t1;
Table	Create Table
t1	CREATE TABLE `t1` (
  `pk` int(11) NOT NULL,
  `tiny_text` tinytext DEFAULT NULL,
  `tiny_blob` tinyblob DEFAULT NULL,
  `text_type` text DEFAULT NULL,
  `blob_type` blob DEFAULT NULL,
  `medium_text` mediumtext DEFAULT NULL,
  `medium_blob` mediumblob DEFAULT NULL,
  `long_text` longtext DEFAULT NULL,
  `long_blob` longblob DEFAULT NULL,
  `doc_content` varchar(1000) DEFAULT NULL,
  `doc_content2` varchar(1000) DEFAULT NULL,
  PRIMARY KEY (`pk`)
) ORGANIZATION INDEX DEFAULT CHARSET = utf8mb4 ROW_FORMAT = DYNAMIC COMPRESSION = 'zstd_1.3.8' REPLICA_NUM = 1 BLOCK_SIZE = 16384 USE_BLOOM_FILTER = FALSE ENABLE_MACRO_BLOCK_BLOOM_FILTER = FALSE TABLET_SIZE = 134217728 PCTFREE = 0
重新添加hybrid vector index
alter table t1 add vector index idx_doc2(doc_content2) with (distance=ip, type=hnsw, model=ob_embed, dim=1024, sync_mode=async, sync_interval=5s);
ERROR 42000: You have an error in your SQL syntax; check the manual that corresponds to your OceanBase version for the right syntax to use near 'index idx_doc2(doc_content2) with (distance=ip, type=hnsw, model=ob_embed, dim=1' at line 1
show create table t1;
Table	Create Table
t1	CREATE TABLE `t1` (
  `pk` int(11) NOT NULL,
  `tiny_text` tinytext DEFAULT NULL,
  `tiny_blob` tinyblob DEFAULT NULL,
  `text_type` text DEFAULT NULL,
  `blob_type` blob DEFAULT NULL,
  `medium_text` mediumtext DEFAULT NULL,
  `medium_blob` mediumblob DEFAULT NULL,
  `long_text` longtext DEFAULT NULL,
  `long_blob` longblob DEFAULT NULL,
  `doc_content` varchar(1000) DEFAULT NULL,
  `doc_content2` varchar(1000) DEFAULT NULL,
  PRIMARY KEY (`pk`)
) ORGANIZATION INDEX DEFAULT CHARSET = utf8mb4 ROW_FORMAT = DYNAMIC COMPRESSION = 'zstd_1.3.8' REPLICA_NUM = 1 BLOCK_SIZE = 16384 USE_BLOOM_FILTER = FALSE ENABLE_MACRO_BLOCK_BLOOM_FILTER = FALSE TABLET_SIZE = 134217728 PCTFREE = 0
=== 测试表级别的DDL操作 ===
添加普通索引
alter table t1 add index idx_pk(pk);
show create table t1;
Table	Create Table
t1	CREATE TABLE `t1` (
  `pk` int(11) NOT NULL,
  `tiny_text` tinytext DEFAULT NULL,
  `tiny_blob` tinyblob DEFAULT NULL,
  `text_type` text DEFAULT NULL,
  `blob_type` blob DEFAULT NULL,
  `medium_text` mediumtext DEFAULT NULL,
  `medium_blob` mediumblob DEFAULT NULL,
  `long_text` longtext DEFAULT NULL,
  `long_blob` longblob DEFAULT NULL,
  `doc_content` varchar(1000) DEFAULT NULL,
  `doc_content2` varchar(1000) DEFAULT NULL,
  PRIMARY KEY (`pk`),
  KEY `idx_pk` (`pk`) BLOCK_SIZE 16384 LOCAL
) ORGANIZATION INDEX DEFAULT CHARSET = utf8mb4 ROW_FORMAT = DYNAMIC COMPRESSION = 'zstd_1.3.8' REPLICA_NUM = 1 BLOCK_SIZE = 16384 USE_BLOOM_FILTER = FALSE ENABLE_MACRO_BLOCK_BLOOM_FILTER = FALSE TABLET_SIZE = 134217728 PCTFREE = 0
添加唯一索引
alter table t1 add unique index idx_doc_content(doc_content);
show create table t1;
Table	Create Table
t1	CREATE TABLE `t1` (
  `pk` int(11) NOT NULL,
  `tiny_text` tinytext DEFAULT NULL,
  `tiny_blob` tinyblob DEFAULT NULL,
  `text_type` text DEFAULT NULL,
  `blob_type` blob DEFAULT NULL,
  `medium_text` mediumtext DEFAULT NULL,
  `medium_blob` mediumblob DEFAULT NULL,
  `long_text` longtext DEFAULT NULL,
  `long_blob` longblob DEFAULT NULL,
  `doc_content` varchar(1000) DEFAULT NULL,
  `doc_content2` varchar(1000) DEFAULT NULL,
  PRIMARY KEY (`pk`),
  UNIQUE KEY `idx_doc_content` (`doc_content`) BLOCK_SIZE 16384 LOCAL,
  KEY `idx_pk` (`pk`) BLOCK_SIZE 16384 LOCAL
) ORGANIZATION INDEX DEFAULT CHARSET = utf8mb4 ROW_FORMAT = DYNAMIC COMPRESSION = 'zstd_1.3.8' REPLICA_NUM = 1 BLOCK_SIZE = 16384 USE_BLOOM_FILTER = FALSE ENABLE_MACRO_BLOCK_BLOOM_FILTER = FALSE TABLET_SIZE = 134217728 PCTFREE = 0
删除普通索引
alter table t1 drop index idx_pk;
show create table t1;
Table	Create Table
t1	CREATE TABLE `t1` (
  `pk` int(11) NOT NULL,
  `tiny_text` tinytext DEFAULT NULL,
  `tiny_blob` tinyblob DEFAULT NULL,
  `text_type` text DEFAULT NULL,
  `blob_type` blob DEFAULT NULL,
  `medium_text` mediumtext DEFAULT NULL,
  `medium_blob` mediumblob DEFAULT NULL,
  `long_text` longtext DEFAULT NULL,
  `long_blob` longblob DEFAULT NULL,
  `doc_content` varchar(1000) DEFAULT NULL,
  `doc_content2` varchar(1000) DEFAULT NULL,
  PRIMARY KEY (`pk`),
  UNIQUE KEY `idx_doc_content` (`doc_content`) BLOCK_SIZE 16384 LOCAL
) ORGANIZATION INDEX DEFAULT CHARSET = utf8mb4 ROW_FORMAT = DYNAMIC COMPRESSION = 'zstd_1.3.8' REPLICA_NUM = 1 BLOCK_SIZE = 16384 USE_BLOOM_FILTER = FALSE ENABLE_MACRO_BLOCK_BLOOM_FILTER = FALSE TABLET_SIZE = 134217728 PCTFREE = 0
修改表注释
alter table t1 comment='Table with LOB fields and hybrid vector index for DDL testing';
show create table t1;
Table	Create Table
t1	CREATE TABLE `t1` (
  `pk` int(11) NOT NULL,
  `tiny_text` tinytext DEFAULT NULL,
  `tiny_blob` tinyblob DEFAULT NULL,
  `text_type` text DEFAULT NULL,
  `blob_type` blob DEFAULT NULL,
  `medium_text` mediumtext DEFAULT NULL,
  `medium_blob` mediumblob DEFAULT NULL,
  `long_text` longtext DEFAULT NULL,
  `long_blob` longblob DEFAULT NULL,
  `doc_content` varchar(1000) DEFAULT NULL,
  `doc_content2` varchar(1000) DEFAULT NULL,
  PRIMARY KEY (`pk`),
  UNIQUE KEY `idx_doc_content` (`doc_content`) BLOCK_SIZE 16384 LOCAL
) ORGANIZATION INDEX DEFAULT CHARSET = utf8mb4 ROW_FORMAT = DYNAMIC COMPRESSION = 'zstd_1.3.8' REPLICA_NUM = 1 BLOCK_SIZE = 16384 USE_BLOOM_FILTER = FALSE ENABLE_MACRO_BLOCK_BLOOM_FILTER = FALSE TABLET_SIZE = 134217728 PCTFREE = 0 COMMENT = 'Table with LOB fields and hybrid vector index for DDL testing'
修改列注释
alter table t1 modify column doc_content varchar(1000) comment='Document content for vector search';
ERROR 42000: You have an error in your SQL syntax; check the manual that corresponds to your OceanBase version for the right syntax to use near '='Document content for vector search'' at line 1
show create table t1;
Table	Create Table
t1	CREATE TABLE `t1` (
  `pk` int(11) NOT NULL,
  `tiny_text` tinytext DEFAULT NULL,
  `tiny_blob` tinyblob DEFAULT NULL,
  `text_type` text DEFAULT NULL,
  `blob_type` blob DEFAULT NULL,
  `medium_text` mediumtext DEFAULT NULL,
  `medium_blob` mediumblob DEFAULT NULL,
  `long_text` longtext DEFAULT NULL,
  `long_blob` longblob DEFAULT NULL,
  `doc_content` varchar(1000) DEFAULT NULL,
  `doc_content2` varchar(1000) DEFAULT NULL,
  PRIMARY KEY (`pk`),
  UNIQUE KEY `idx_doc_content` (`doc_content`) BLOCK_SIZE 16384 LOCAL
) ORGANIZATION INDEX DEFAULT CHARSET = utf8mb4 ROW_FORMAT = DYNAMIC COMPRESSION = 'zstd_1.3.8' REPLICA_NUM = 1 BLOCK_SIZE = 16384 USE_BLOOM_FILTER = FALSE ENABLE_MACRO_BLOCK_BLOOM_FILTER = FALSE TABLET_SIZE = 134217728 PCTFREE = 0 COMMENT = 'Table with LOB fields and hybrid vector index for DDL testing'
=== 测试分区表DDL操作 ===
创建分区表
create table t_partitioned(
pk int primary key,
doc_content varchar(1000),
long_text longtext,
vector index idx_part_doc(doc_content) with (distance=l2, type=hnsw, model=ob_embed, dim=1024, sync_mode=immediate)
) partition by range(pk) (
partition p0 values less than (100),
partition p1 values less than (200),
partition p2 values less than maxvalue
);
show create table t_partitioned;
Table	Create Table
t_partitioned	CREATE TABLE `t_partitioned` (
  `pk` int(11) NOT NULL,
  `doc_content` varchar(1000) DEFAULT NULL,
  `long_text` longtext DEFAULT NULL,
  PRIMARY KEY (`pk`),
  VECTOR KEY `idx_part_doc` (`doc_content`) WITH (DISTANCE=L2, TYPE=HNSW, MODEL=OB_EMBED, DIM=1024, SYNC_MODE=IMMEDIATE, LIB=VSAG, M=16, EF_CONSTRUCTION=200, EF_SEARCH=64, SYNC_INTERVAL=10s) BLOCK_SIZE 16384
) ORGANIZATION INDEX DEFAULT CHARSET = utf8mb4 ROW_FORMAT = DYNAMIC COMPRESSION = 'zstd_1.3.8' REPLICA_NUM = 1 BLOCK_SIZE = 16384 USE_BLOOM_FILTER = FALSE ENABLE_MACRO_BLOCK_BLOOM_FILTER = FALSE TABLET_SIZE = 134217728 PCTFREE = 0
 partition by range(pk)
(partition `p0` values less than (100),
partition `p1` values less than (200),
partition `p2` values less than (MAXVALUE))
insert into t_partitioned values (50, 'Partition 0 document', repeat('partition0', 1000));
insert into t_partitioned values (150, 'Partition 1 document', repeat('partition1', 2000));
insert into t_partitioned values (250, 'Partition 2 document', repeat('partition2', 3000));
添加分区
alter table t_partitioned add partition (partition p3 values less than (300));
ERROR HY000: VALUES LESS THAN value must be strictly increasing for each partition
show create table t_partitioned;
Table	Create Table
t_partitioned	CREATE TABLE `t_partitioned` (
  `pk` int(11) NOT NULL,
  `doc_content` varchar(1000) DEFAULT NULL,
  `long_text` longtext DEFAULT NULL,
  PRIMARY KEY (`pk`),
  VECTOR KEY `idx_part_doc` (`doc_content`) WITH (DISTANCE=L2, TYPE=HNSW, MODEL=OB_EMBED, DIM=1024, SYNC_MODE=IMMEDIATE, LIB=VSAG, M=16, EF_CONSTRUCTION=200, EF_SEARCH=64, SYNC_INTERVAL=10s) BLOCK_SIZE 16384
) ORGANIZATION INDEX DEFAULT CHARSET = utf8mb4 ROW_FORMAT = DYNAMIC COMPRESSION = 'zstd_1.3.8' REPLICA_NUM = 1 BLOCK_SIZE = 16384 USE_BLOOM_FILTER = FALSE ENABLE_MACRO_BLOCK_BLOOM_FILTER = FALSE TABLET_SIZE = 134217728 PCTFREE = 0
 partition by range(pk)
(partition `p0` values less than (100),
partition `p1` values less than (200),
partition `p2` values less than (MAXVALUE))
删除分区
alter table t_partitioned drop partition p0;
show create table t_partitioned;
Table	Create Table
t_partitioned	CREATE TABLE `t_partitioned` (
  `pk` int(11) NOT NULL,
  `doc_content` varchar(1000) DEFAULT NULL,
  `long_text` longtext DEFAULT NULL,
  PRIMARY KEY (`pk`),
  VECTOR KEY `idx_part_doc` (`doc_content`) WITH (DISTANCE=L2, TYPE=HNSW, MODEL=OB_EMBED, DIM=1024, SYNC_MODE=IMMEDIATE, LIB=VSAG, M=16, EF_CONSTRUCTION=200, EF_SEARCH=64, SYNC_INTERVAL=10s) BLOCK_SIZE 16384
) ORGANIZATION INDEX DEFAULT CHARSET = utf8mb4 ROW_FORMAT = DYNAMIC COMPRESSION = 'zstd_1.3.8' REPLICA_NUM = 1 BLOCK_SIZE = 16384 USE_BLOOM_FILTER = FALSE ENABLE_MACRO_BLOCK_BLOOM_FILTER = FALSE TABLET_SIZE = 134217728 PCTFREE = 0
 partition by range(pk)
(partition `p1` values less than (200),
partition `p2` values less than (MAXVALUE))
截断分区
alter table t_partitioned truncate partition p1;
show create table t_partitioned;
Table	Create Table
t_partitioned	CREATE TABLE `t_partitioned` (
  `pk` int(11) NOT NULL,
  `doc_content` varchar(1000) DEFAULT NULL,
  `long_text` longtext DEFAULT NULL,
  PRIMARY KEY (`pk`),
  VECTOR KEY `idx_part_doc` (`doc_content`) WITH (DISTANCE=L2, TYPE=HNSW, MODEL=OB_EMBED, DIM=1024, SYNC_MODE=IMMEDIATE, LIB=VSAG, M=16, EF_CONSTRUCTION=200, EF_SEARCH=64, SYNC_INTERVAL=10s) BLOCK_SIZE 16384
) ORGANIZATION INDEX DEFAULT CHARSET = utf8mb4 ROW_FORMAT = DYNAMIC COMPRESSION = 'zstd_1.3.8' REPLICA_NUM = 1 BLOCK_SIZE = 16384 USE_BLOOM_FILTER = FALSE ENABLE_MACRO_BLOCK_BLOOM_FILTER = FALSE TABLET_SIZE = 134217728 PCTFREE = 0
 partition by range(pk)
(partition `p1` values less than (200),
partition `p2` values less than (MAXVALUE))
=== 测试TRUNCATE TABLE操作 ===
截断表
truncate table t_partitioned;
show create table t_partitioned;
Table	Create Table
t_partitioned	CREATE TABLE `t_partitioned` (
  `pk` int(11) NOT NULL,
  `doc_content` varchar(1000) DEFAULT NULL,
  `long_text` longtext DEFAULT NULL,
  PRIMARY KEY (`pk`),
  VECTOR KEY `idx_part_doc` (`doc_content`) WITH (DISTANCE=L2, TYPE=HNSW, MODEL=OB_EMBED, DIM=1024, SYNC_MODE=IMMEDIATE, LIB=VSAG, M=16, EF_CONSTRUCTION=200, EF_SEARCH=64, SYNC_INTERVAL=10s) BLOCK_SIZE 16384
) ORGANIZATION INDEX DEFAULT CHARSET = utf8mb4 ROW_FORMAT = DYNAMIC COMPRESSION = 'zstd_1.3.8' REPLICA_NUM = 1 BLOCK_SIZE = 16384 USE_BLOOM_FILTER = FALSE ENABLE_MACRO_BLOCK_BLOOM_FILTER = FALSE TABLET_SIZE = 134217728 PCTFREE = 0
 partition by range(pk)
(partition `p1` values less than (200),
partition `p2` values less than (MAXVALUE))
insert into t_partitioned values (100, 'After truncate document', repeat('after_truncate', 1000));
=== 测试复杂的DDL组合操作 ===
多列同时操作
alter table t1 add column temp_text text, add column temp_blob blob, modify column doc_content2 varchar(2000);
show create table t1;
Table	Create Table
t1	CREATE TABLE `t1` (
  `pk` int(11) NOT NULL,
  `tiny_text` tinytext DEFAULT NULL,
  `tiny_blob` tinyblob DEFAULT NULL,
  `text_type` text DEFAULT NULL,
  `blob_type` blob DEFAULT NULL,
  `medium_text` mediumtext DEFAULT NULL,
  `medium_blob` mediumblob DEFAULT NULL,
  `long_text` longtext DEFAULT NULL,
  `long_blob` longblob DEFAULT NULL,
  `doc_content` varchar(1000) DEFAULT NULL,
  `doc_content2` varchar(2000) DEFAULT NULL,
  `temp_text` text DEFAULT NULL,
  `temp_blob` blob DEFAULT NULL,
  PRIMARY KEY (`pk`),
  UNIQUE KEY `idx_doc_content` (`doc_content`) BLOCK_SIZE 16384 LOCAL
) ORGANIZATION INDEX DEFAULT CHARSET = utf8mb4 ROW_FORMAT = DYNAMIC COMPRESSION = 'zstd_1.3.8' REPLICA_NUM = 1 BLOCK_SIZE = 16384 USE_BLOOM_FILTER = FALSE ENABLE_MACRO_BLOCK_BLOOM_FILTER = FALSE TABLET_SIZE = 134217728 PCTFREE = 0 COMMENT = 'Table with LOB fields and hybrid vector index for DDL testing'
insert into t1 values (12, 'test', 'test', 'test', 'test', 'test', 'test', 'test', 'test', 'Complex DDL test document', 'Updated doc_content2', 'temp_text_content', 'temp_blob_content');
同时操作索引和列
alter table t1 drop column temp_text, drop column temp_blob, add index idx_doc_content2(doc_content2);
ERROR 0A000: drop column and add index in single statment not supported
show create table t1;
Table	Create Table
t1	CREATE TABLE `t1` (
  `pk` int(11) NOT NULL,
  `tiny_text` tinytext DEFAULT NULL,
  `tiny_blob` tinyblob DEFAULT NULL,
  `text_type` text DEFAULT NULL,
  `blob_type` blob DEFAULT NULL,
  `medium_text` mediumtext DEFAULT NULL,
  `medium_blob` mediumblob DEFAULT NULL,
  `long_text` longtext DEFAULT NULL,
  `long_blob` longblob DEFAULT NULL,
  `doc_content` varchar(1000) DEFAULT NULL,
  `doc_content2` varchar(2000) DEFAULT NULL,
  `temp_text` text DEFAULT NULL,
  `temp_blob` blob DEFAULT NULL,
  PRIMARY KEY (`pk`),
  UNIQUE KEY `idx_doc_content` (`doc_content`) BLOCK_SIZE 16384 LOCAL
) ORGANIZATION INDEX DEFAULT CHARSET = utf8mb4 ROW_FORMAT = DYNAMIC COMPRESSION = 'zstd_1.3.8' REPLICA_NUM = 1 BLOCK_SIZE = 16384 USE_BLOOM_FILTER = FALSE ENABLE_MACRO_BLOCK_BLOOM_FILTER = FALSE TABLET_SIZE = 134217728 PCTFREE = 0 COMMENT = 'Table with LOB fields and hybrid vector index for DDL testing'
最终验证所有DDL操作
select count(*) as total_rows from t1;
total_rows
5
select count(*) as partitioned_rows from t_partitioned;
partitioned_rows
1
drop table t_partitioned;
drop table if exists t1, t2, lob_t1, t1_json;
create table t1_async(
pk int primary key,
doc_content varchar(1000),
long_text longtext,
vector index idx_async_doc(doc_content) with (distance=l2, type=hnsw, model=ob_embed, dim=1024, sync_mode=async, sync_interval=10s)
);
insert into t1_async values(1, 'Async sync document 1', repeat('async1', 1000));
insert into t1_async values(2, 'Async sync document 2', repeat('async2', 2000));
insert into t1_async values(3, 'Async sync document 3', repeat('async3', 3000));
update t1_async set doc_content='Updated async document', long_text=repeat('updated_async', 1500) where pk = 1;
delete from t1_async where pk = 2;
drop table t1_async;
alter system set _enable_semantic_index=false;
call DBMS_AI_SERVICE.DROP_AI_MODEL_ENDPOINT ('ob_embed_endpoint');
call DBMS_AI_SERVICE.DROP_AI_MODEL ('ob_embed');
