1. with different index types
alter system set ob_vector_memory_limit_percentage = 34;
DROP TABLE IF EXISTS vec_t1;
DROP TABLE IF EXISTS vec_t2;
create table vec_t1 (c1 int AUTO_INCREMENT, c2 vector(10), c3 vector(10), c4 varchar(10), c5 int UNIQUE, c6 int,
PRIMARY KEY(c1, c4),
INDEX (c5, c6));
create vector index idx1 on vec_t1 (c2) with (distance=l2, type=ivf_sq8, nlist=2, sample_per_nlist=3);
create vector index idx2 on vec_t1 (c3) with (distance=l2, type=ivf_sq8, nlist=2, sample_per_nlist=3);
insert into vec_t1(c5, c6, c4, c2, c3) values(11, 2, "row11", '[0.237072,0.690586,0.755902,0.524142,0.086226,0.583865,0.111322,0.958013,0.824064,0.971327]', '[0.701504,0.840166,0.786345,0.323074,0.209918,0.972802,0.121533,0.467813,0.498118,0.600434]') on duplicate key update c2 = '[0.692623,0.816816,0.418483,0.393929,0.061058,0.402308,0.564665,0.406696,0.628286,0.250843]';
insert into vec_t1(c1, c5, c6, c4, c2, c3) values(10, 1, 2, "row11", '[0.237072,0.690586,0.755902,0.524142,0.086226,0.583865,0.111322,0.958013,0.824064,0.971327]', '[0.701504,0.840166,0.786345,0.323074,0.209918,0.972802,0.121533,0.467813,0.498118,0.600434]') on duplicate key update c2 = '[0.692623,0.816816,0.418483,0.393929,0.061058,0.402308,0.564665,0.406696,0.628286,0.250843]';
insert into vec_t1(c1, c5, c6, c4, c2, c3) values(10, 1, 2, "row11", '[0.237072,0.690586,0.755902,0.524142,0.086226,0.583865,0.111322,0.958013,0.824064,0.971327]', '[0.701504,0.840166,0.786345,0.323074,0.209918,0.972802,0.121533,0.467813,0.498118,0.600434]') on duplicate key update c1 = c1 + 10;
insert ignore into vec_t1(c1, c5, c6, c4, c2, c3) values(10, 12, 2, "row10", '[0.237072,0.690586,0.755902,0.524142,0.086226,0.583865,0.111322,0.958013,0.824064,0.971327]', '[0.701504,0.840166,0.786345,0.323074,0.209918,0.972802,0.121533,0.467813,0.498118,0.600434]');
insert ignore into vec_t1(c1, c5, c6, c4, c2, c3) values(10, 12, 2, "row10", '[0.237072,0.690586,0.755902,0.524142,0.086226,0.583865,0.111322,0.958013,0.824064,0.971327]', '[0.701504,0.840166,0.786345,0.323074,0.209918,0.972802,0.121533,0.467813,0.498118,0.600434]');
create table vec_t2 (c1 int AUTO_INCREMENT, c2 vector(10), c3 vector(10), c4 varchar(10), c5 int UNIQUE, c6 int,
PRIMARY KEY(c1, c4),
INDEX (c5, c6));
insert into vec_t2 (c1, c5, c6, c4, c2, c3) values(100, 200, 100, 'row200', '[0.707352,0.537032,0.433431,0.727523,0.293137,0.990979,0.967610,0.895034,0.479304,0.205645]', null);
insert into vec_t2 (c1, c5, c6, c4, c2, c3) values(101, 201, 100, 'row201', '[0.234391,0.660406,0.370087,0.860388,0.586119,0.668096,0.122285,0.670929,0.997141,0.177069]', '[0.958113,0.424453,0.091372,0.726940,0.173619,0.023668,0.220956,0.260019,0.402649,0.175887]');
insert into vec_t1 select * from vec_t2;
replace into vec_t1 (c1, c5, c6, c4, c2, c3) values(10, 1, 2, "row11", '[0.237072,0.690586,0.755902,0.524142,0.086226,0.583865,0.111322,0.958013,0.824064,0.971327]', '[0.701504,0.840166,0.786345,0.323074,0.209918,0.972802,0.121533,0.467813,0.498118,0.600434]');
replace into vec_t1 (c1, c5, c6, c4, c2, c3) values(10, 1, 2, "row11", '[0.237072,0.690586,0.755902,0.524142,0.086226,0.583865,0.111322,0.958013,0.824064,0.971327]', '[0.701504,0.840166,0.786345,0.323074,0.209918,0.972802,0.121533,0.467813,0.498118,0.600434]');
update vec_t1 set c2 = '[0.692623,0.816816,0.418483,0.393929,0.061058,0.402308,0.564665,0.406696,0.628286,0.250843]' where c1 = 100;
update vec_t1 set c3 = '[0.692623,0.816816,0.418483,0.393929,0.061058,0.402308,0.564665,0.406696,0.628286,0.250843]' where c1 = 2;
update vec_t1 set c2 = c3 order by c1;
delete from vec_t1 where c1 = 2;
delete from vec_t1 where c1 <= 5;
select distinct c6 from vec_t1;
c6
2
6
7
8
9
10
11
12
13
14
15
16
17
18
19
20
21
22
23
24
25
26
27
28
29
30
31
32
33
34
35
36
37
38
39
40
41
42
43
44
45
46
47
48
49
50
51
52
53
54
55
56
57
58
59
60
61
62
63
64
65
66
67
68
69
70
71
72
73
74
75
76
77
78
79
80
81
82
83
84
85
86
87
88
89
90
91
92
93
94
95
96
97
98
99
100
drop table vec_t1, vec_t2;
2. 一级分区表后建索引
create table vec_t1 (c1 int AUTO_INCREMENT, c2 vector(10), c3 vector(10), c4 varchar(10), c5 int, c6 int,
PRIMARY KEY(c1, c4),
INDEX (c5, c6))
PARTITION BY RANGE COLUMNS(c1)
(
PARTITION p0 VALUES LESS THAN(20),
PARTITION p1 VALUES LESS THAN(40),
PARTITION p2 VALUES LESS THAN(60),
PARTITION p3 VALUES LESS THAN(80),
PARTITION p4 VALUES LESS THAN MAXVALUE
);
create vector index idx1 on vec_t1 (c2) with (distance=l2, type=ivf_sq8, nlist=2, sample_per_nlist=3);
create vector index idx2 on vec_t1 (c3) with (distance=l2, type=ivf_sq8, nlist=2, sample_per_nlist=3);
insert into vec_t1(c5, c6, c4, c2, c3) values(11, 2, "row11", '[0.237072,0.690586,0.755902,0.524142,0.086226,0.583865,0.111322,0.958013,0.824064,0.971327]', '[0.701504,0.840166,0.786345,0.323074,0.209918,0.972802,0.121533,0.467813,0.498118,0.600434]') on duplicate key update c5 = '[0.692623,0.816816,0.418483,0.393929,0.061058,0.402308,0.564665,0.406696,0.628286,0.250843]';
insert into vec_t1(c1, c5, c6, c4, c2, c3) values(10, 1, 2, "row11", '[0.237072,0.690586,0.755902,0.524142,0.086226,0.583865,0.111322,0.958013,0.824064,0.971327]', '[0.701504,0.840166,0.786345,0.323074,0.209918,0.972802,0.121533,0.467813,0.498118,0.600434]') on duplicate key update c5 = '[0.692623,0.816816,0.418483,0.393929,0.061058,0.402308,0.564665,0.406696,0.628286,0.250843]';
insert into vec_t1(c1, c5, c6, c4, c2, c3) values(10, 1, 2, "row11", '[0.237072,0.690586,0.755902,0.524142,0.086226,0.583865,0.111322,0.958013,0.824064,0.971327]', '[0.701504,0.840166,0.786345,0.323074,0.209918,0.972802,0.121533,0.467813,0.498118,0.600434]') on duplicate key update c1 = c1 + 10;
insert ignore into vec_t1(c1, c5, c6, c4, c2, c3) values(10, 12, 2, "row10", '[0.237072,0.690586,0.755902,0.524142,0.086226,0.583865,0.111322,0.958013,0.824064,0.971327]', '[0.701504,0.840166,0.786345,0.323074,0.209918,0.972802,0.121533,0.467813,0.498118,0.600434]');
insert ignore into vec_t1(c1, c5, c6, c4, c2, c3) values(10, 12, 2, "row10", '[0.237072,0.690586,0.755902,0.524142,0.086226,0.583865,0.111322,0.958013,0.824064,0.971327]', '[0.701504,0.840166,0.786345,0.323074,0.209918,0.972802,0.121533,0.467813,0.498118,0.600434]');
create table vec_t2 (c1 int AUTO_INCREMENT, c2 vector(10), c3 vector(10), c4 varchar(10), c5 int UNIQUE, c6 int,
PRIMARY KEY(c1, c4),
INDEX (c5, c6));
insert into vec_t2 (c1, c5, c6, c4, c2, c3) values(99, 199, 99, 'row199', '[0.234391,0.660406,0.370087,0.860388,0.586119,0.668096,0.122285,0.670929,0.997141,0.177069]', '[0.958113,0.424453,0.091372,0.726940,0.173619,0.023668,0.220956,0.260019,0.402649,0.175887]');
insert into vec_t2 (c1, c5, c6, c4, c2, c3) values(100, 200, 100, 'row200', '[0.707352,0.537032,0.433431,0.727523,0.293137,0.990979,0.967610,0.895034,0.479304,0.205645]', null);
insert into vec_t1 select * from vec_t2;
replace into vec_t1 (c1, c5, c6, c4, c2, c3) values(10, 1, 2, "row11", '[0.237072,0.690586,0.755902,0.524142,0.086226,0.583865,0.111322,0.958013,0.824064,0.971327]', '[0.701504,0.840166,0.786345,0.323074,0.209918,0.972802,0.121533,0.467813,0.498118,0.600434]');
replace into vec_t1 (c1, c5, c6, c4, c2, c3) values(10, 1, 2, "row11", '[0.237072,0.690586,0.755902,0.524142,0.086226,0.583865,0.111322,0.958013,0.824064,0.971327]', '[0.701504,0.840166,0.786345,0.323074,0.209918,0.972802,0.121533,0.467813,0.498118,0.600434]');
update vec_t1 set c2 = '[0.692623,0.816816,0.418483,0.393929,0.061058,0.402308,0.564665,0.406696,0.628286,0.250843]' where c1 = 100;
update vec_t1 set c3 = '[0.692623,0.816816,0.418483,0.393929,0.061058,0.402308,0.564665,0.406696,0.628286,0.250843]' where c1 = 2;
update vec_t1 set c2 = c3 order by c1;
delete from vec_t1 where c1 = 2;
delete from vec_t1 where c1 <= 5;
select distinct c6 from vec_t1;
c6
2
6
7
8
9
10
11
12
13
14
15
16
17
18
19
20
21
22
23
24
25
26
27
28
29
30
31
32
33
34
35
36
37
38
39
40
41
42
43
44
45
46
47
48
49
50
51
52
53
54
55
56
57
58
59
60
61
62
63
64
65
66
67
68
69
70
71
72
73
74
75
76
77
78
79
80
81
82
83
84
85
86
87
88
89
90
91
92
93
94
95
96
97
98
99
100
drop table vec_t1, vec_t2;
drop table if exists vec_t1;
drop table if exists vec_t2;
3. 二级分区表随表建索引
create table vec_t1 (c1 int AUTO_INCREMENT, c2 vector(10), c3 vector(10), c4 varchar(10), c5 int, c6 int,
PRIMARY KEY(c1, c5),
INDEX (c5, c6),
VECTOR INDEX idx1(c2)
WITH (distance=l2, type=ivf_sq8),
VECTOR INDEX idx2(c3)
WITH (distance=l2, type=ivf_sq8))
PARTITION BY RANGE COLUMNS(c1)
SUBPARTITION BY RANGE COLUMNS(c5)
SUBPARTITION TEMPLATE
(
SUBPARTITION mp0 VALUES LESS THAN(30),
SUBPARTITION mp1 VALUES LESS THAN(60),
SUBPARTITION mp2 VALUES LESS THAN(90),
SUBPARTITION mp3 VALUES LESS THAN MAXVALUE
)
(
PARTITION p0 VALUES LESS THAN(20),
PARTITION p1 VALUES LESS THAN(40),
PARTITION p2 VALUES LESS THAN(60),
PARTITION p3 VALUES LESS THAN(80),
PARTITION p4 VALUES LESS THAN MAXVALUE
);
insert into vec_t1(c5, c6, c4, c2, c3) values(11, 200, "row11", '[0.237072,0.690586,0.755902,0.524142,0.086226,0.583865,0.111322,0.958013,0.824064,0.971327]', '[0.701504,0.840166,0.786345,0.323074,0.209918,0.972802,0.121533,0.467813,0.498118,0.600434]') on duplicate key update c5 = '[0.692623,0.816816,0.418483,0.393929,0.061058,0.402308,0.564665,0.406696,0.628286,0.250843]';
insert into vec_t1(c1, c5, c6, c4, c2, c3) values(10, 1, 201, "row11", '[0.237072,0.690586,0.755902,0.524142,0.086226,0.583865,0.111322,0.958013,0.824064,0.971327]', '[0.701504,0.840166,0.786345,0.323074,0.209918,0.972802,0.121533,0.467813,0.498118,0.600434]') on duplicate key update c5 = '[0.692623,0.816816,0.418483,0.393929,0.061058,0.402308,0.564665,0.406696,0.628286,0.250843]';
insert into vec_t1(c1, c5, c6, c4, c2, c3) values(10, 1, 202, "row11", '[0.237072,0.690586,0.755902,0.524142,0.086226,0.583865,0.111322,0.958013,0.824064,0.971327]', '[0.701504,0.840166,0.786345,0.323074,0.209918,0.972802,0.121533,0.467813,0.498118,0.600434]') on duplicate key update c1 = c1 + 10;
insert ignore into vec_t1(c1, c5, c6, c4, c2, c3) values(10, 12, 203, "row10", '[0.237072,0.690586,0.755902,0.524142,0.086226,0.583865,0.111322,0.958013,0.824064,0.971327]', '[0.701504,0.840166,0.786345,0.323074,0.209918,0.972802,0.121533,0.467813,0.498118,0.600434]');
insert ignore into vec_t1(c1, c5, c6, c4, c2, c3) values(10, 12, 204, "row10", '[0.237072,0.690586,0.755902,0.524142,0.086226,0.583865,0.111322,0.958013,0.824064,0.971327]', '[0.701504,0.840166,0.786345,0.323074,0.209918,0.972802,0.121533,0.467813,0.498118,0.600434]');
create table vec_t2 (c1 int AUTO_INCREMENT, c2 vector(10), c3 vector(10), c4 varchar(10), c5 int UNIQUE, c6 int,
PRIMARY KEY(c1, c4),
INDEX (c5, c6));
insert into vec_t2 (c1, c5, c6, c4, c2, c3) values(99, 20, 205, 'row99', '[0.234391,0.660406,0.370087,0.860388,0.586119,0.668096,0.122285,0.670929,0.997141,0.177069]', '[0.958113,0.424453,0.091372,0.726940,0.173619,0.023668,0.220956,0.260019,0.402649,0.175887]');
insert into vec_t2 (c1, c5, c6, c4, c2, c3) values(100, 6, 206, 'row100', '[0.707352,0.537032,0.433431,0.727523,0.293137,0.990979,0.967610,0.895034,0.479304,0.205645]', null);
insert into vec_t1 select * from vec_t2;
replace into vec_t1 (c1, c5, c6, c4, c2, c3) values(10, 1, 207, "row11", '[0.237072,0.690586,0.755902,0.524142,0.086226,0.583865,0.111322,0.958013,0.824064,0.971327]', '[0.701504,0.840166,0.786345,0.323074,0.209918,0.972802,0.121533,0.467813,0.498118,0.600434]');
replace into vec_t1 (c1, c5, c6, c4, c2, c3) values(10, 1, 208, "row11", '[0.237072,0.690586,0.755902,0.524142,0.086226,0.583865,0.111322,0.958013,0.824064,0.971327]', '[0.701504,0.840166,0.786345,0.323074,0.209918,0.972802,0.121533,0.467813,0.498118,0.600434]');
update vec_t1 set c2 = '[0.692623,0.816816,0.418483,0.393929,0.061058,0.402308,0.564665,0.406696,0.628286,0.250843]' where c1 = 100;
update vec_t1 set c3 = '[0.692623,0.816816,0.418483,0.393929,0.061058,0.402308,0.564665,0.406696,0.628286,0.250843]' where c1 = 2;
update vec_t1 set c5 = 16 where c1 < 5;
update vec_t1 set c5 = c6 order by c1;
delete from vec_t1 where c1 = 2;
delete from vec_t1 where c1 <= 5;
select distinct c6 from vec_t1;
c6
6
7
8
9
10
11
12
13
14
15
16
17
18
19
203
208
20
21
22
23
24
25
26
27
28
29
30
31
32
33
34
35
36
37
38
39
201
40
41
42
43
44
45
46
47
48
49
50
51
52
53
54
55
56
57
58
59
60
61
62
63
64
65
66
67
68
69
70
71
72
73
74
75
76
77
78
79
80
81
82
83
84
85
86
87
88
89
90
91
92
93
94
95
96
97
98
99
205
100
206
200
drop table vec_t1, vec_t2;
drop table if exists vec_t1;
drop table if exists vec_t2;
4. 二级分区表后建索引
create table vec_t1 (c1 int AUTO_INCREMENT, c2 vector(10), c3 vector(10), c4 varchar(10), c5 int, c6 int,
PRIMARY KEY(c1, c5),
INDEX (c5, c6))
PARTITION BY RANGE COLUMNS(c1)
SUBPARTITION BY RANGE COLUMNS(c5)
SUBPARTITION TEMPLATE
(
SUBPARTITION mp0 VALUES LESS THAN(30),
SUBPARTITION mp1 VALUES LESS THAN(60),
SUBPARTITION mp2 VALUES LESS THAN(90),
SUBPARTITION mp3 VALUES LESS THAN MAXVALUE
)
(
PARTITION p0 VALUES LESS THAN(20),
PARTITION p1 VALUES LESS THAN(40),
PARTITION p2 VALUES LESS THAN(60),
PARTITION p3 VALUES LESS THAN(80),
PARTITION p4 VALUES LESS THAN MAXVALUE
);
create vector index idx1 on vec_t1 (c2) with (distance=l2, type=ivf_sq8, nlist=2, sample_per_nlist=3);
create vector index idx2 on vec_t1 (c3) with (distance=l2, type=ivf_sq8, nlist=2, sample_per_nlist=3);
insert into vec_t1(c5, c6, c4, c2, c3) values(11, 2, "row11", '[0.237072,0.690586,0.755902,0.524142,0.086226,0.583865,0.111322,0.958013,0.824064,0.971327]', '[0.701504,0.840166,0.786345,0.323074,0.209918,0.972802,0.121533,0.467813,0.498118,0.600434]') on duplicate key update c5 = '[0.692623,0.816816,0.418483,0.393929,0.061058,0.402308,0.564665,0.406696,0.628286,0.250843]';
insert into vec_t1(c1, c5, c6, c4, c2, c3) values(10, 1, 2, "row11", '[0.237072,0.690586,0.755902,0.524142,0.086226,0.583865,0.111322,0.958013,0.824064,0.971327]', '[0.701504,0.840166,0.786345,0.323074,0.209918,0.972802,0.121533,0.467813,0.498118,0.600434]') on duplicate key update c5 = '[0.692623,0.816816,0.418483,0.393929,0.061058,0.402308,0.564665,0.406696,0.628286,0.250843]';
insert into vec_t1(c1, c5, c6, c4, c2, c3) values(10, 1, 2, "row11", '[0.237072,0.690586,0.755902,0.524142,0.086226,0.583865,0.111322,0.958013,0.824064,0.971327]', '[0.701504,0.840166,0.786345,0.323074,0.209918,0.972802,0.121533,0.467813,0.498118,0.600434]') on duplicate key update c1 = c1 + 10;
insert ignore into vec_t1(c1, c5, c6, c4, c2, c3) values(10, 12, 2, "row10", '[0.237072,0.690586,0.755902,0.524142,0.086226,0.583865,0.111322,0.958013,0.824064,0.971327]', '[0.701504,0.840166,0.786345,0.323074,0.209918,0.972802,0.121533,0.467813,0.498118,0.600434]');
insert ignore into vec_t1(c1, c5, c6, c4, c2, c3) values(10, 12, 2, "row10", '[0.237072,0.690586,0.755902,0.524142,0.086226,0.583865,0.111322,0.958013,0.824064,0.971327]', '[0.701504,0.840166,0.786345,0.323074,0.209918,0.972802,0.121533,0.467813,0.498118,0.600434]');
create table vec_t2 (c1 int AUTO_INCREMENT, c2 vector(10), c3 vector(10), c4 varchar(10), c5 int UNIQUE, c6 int,
PRIMARY KEY(c1, c4),
INDEX (c5, c6));
insert into vec_t2 (c1, c5, c6, c4, c2, c3) values(99, 20, 99, 'row99', '[0.234391,0.660406,0.370087,0.860388,0.586119,0.668096,0.122285,0.670929,0.997141,0.177069]', '[0.958113,0.424453,0.091372,0.726940,0.173619,0.023668,0.220956,0.260019,0.402649,0.175887]');
insert into vec_t2 (c1, c5, c6, c4, c2, c3) values(100, 6, 100, 'row100', '[0.707352,0.537032,0.433431,0.727523,0.293137,0.990979,0.967610,0.895034,0.479304,0.205645]', null);
insert into vec_t1 select * from vec_t2;
replace into vec_t1 (c1, c5, c6, c4, c2, c3) values(10, 1, 2, "row11", '[0.237072,0.690586,0.755902,0.524142,0.086226,0.583865,0.111322,0.958013,0.824064,0.971327]', '[0.701504,0.840166,0.786345,0.323074,0.209918,0.972802,0.121533,0.467813,0.498118,0.600434]');
replace into vec_t1 (c1, c5, c6, c4, c2, c3) values(10, 1, 2, "row11", '[0.237072,0.690586,0.755902,0.524142,0.086226,0.583865,0.111322,0.958013,0.824064,0.971327]', '[0.701504,0.840166,0.786345,0.323074,0.209918,0.972802,0.121533,0.467813,0.498118,0.600434]');
update vec_t1 set c2 = '[0.692623,0.816816,0.418483,0.393929,0.061058,0.402308,0.564665,0.406696,0.628286,0.250843]' where c1 = 100;
update vec_t1 set c3 = '[0.692623,0.816816,0.418483,0.393929,0.061058,0.402308,0.564665,0.406696,0.628286,0.250843]' where c1 = 2;
update vec_t1 set c5 = 16 where c1 < 5;
update vec_t1 set c6 = c6 order by c1;
delete from vec_t1 where c1 = 2;
delete from vec_t1 where c1 <= 5;
select distinct c6 from vec_t1;
c6
2
6
7
8
9
10
11
12
13
14
15
16
17
18
19
20
21
22
23
24
25
26
27
28
29
30
31
32
33
34
35
36
37
38
39
40
41
42
43
44
45
46
47
48
49
50
51
52
53
54
55
56
57
58
59
60
61
62
63
64
65
66
67
68
69
70
71
72
73
74
75
76
77
78
79
100
99
80
81
82
83
84
85
86
87
88
89
90
91
92
93
94
95
96
97
98
drop table vec_t1, vec_t2;
drop table if exists vec_t1;
drop table if exists vec_t2;
drop table if exists vec_t3;
drop procedure if exists vec_proc;
5. 一级分区表后建
create table vec_t1 (c1 int AUTO_INCREMENT, c2 vector(10), c3 vector(10), c4 varchar(10), c5 int, c6 int,
PRIMARY KEY(c1, c4),
INDEX (c5, c6))
PARTITION BY RANGE(c1) (
PARTITION p0 VALUES less than(30),
PARTITION p1 VALUES less than(60),
PARTITION p2 VALUES less than(MAXVALUE)
);
create vector index idx1 on vec_t1 (c2) with (distance=l2, type=ivf_sq8, nlist=2, sample_per_nlist=3);
create vector index idx2 on vec_t1 (c3) with (distance=l2, type=ivf_sq8, nlist=2, sample_per_nlist=3);
create table vec_t2 (c1 int AUTO_INCREMENT, c2 vector(10), c3 vector(10), c4 varchar(10), c5 int UNIQUE, c6 int,
PRIMARY KEY(c1, c4),
INDEX (c5, c6));
insert into vec_t2 (c1, c5, c6, c4, c2, c3) values(50, 150, 50, 'row198', '[0.234391,0.660406,0.370087,0.860388,0.586119,0.668096,0.122285,0.670929,0.997141,0.177069]', '[0.958113,0.424453,0.091372,0.726940,0.173619,0.023668,0.220956,0.260019,0.402649,0.175887]');
insert into vec_t2 (c1, c5, c6, c4, c2, c3) values(98, 199, 99, 'row199', '[0.234391,0.660406,0.370087,0.860388,0.586119,0.668096,0.122285,0.670929,0.997141,0.177069]', '[0.958113,0.424453,0.091372,0.726940,0.173619,0.023668,0.220956,0.260019,0.402649,0.175887]');
insert into vec_t2 (c1, c5, c6, c4, c2, c3) values(101, 200, 100, 'row200', '[0.707352,0.537032,0.433431,0.727523,0.293137,0.990979,0.967610,0.895034,0.479304,0.205645]', null);
alter system set direct_load_allow_fallback=TRUE;
insert /*+ direct(true, 0) enable_parallel_dml parallel(2) */ into vec_t1 select * from vec_t2;
insert into vec_t2 (c1, c5, c6, c4, c2, c3) values(500, 500, 500, '111', '[0.022470,0.178305,0.813060,0.463923,0.276312,0.330019,0.043964,0.830623,0.266355,0.886212]', '[0.612456,0.419102,0.939437,0.701895,0.475109,0.334464,0.876076,0.120166,0.537638,0.117534]');
insert into vec_t2 (c1, c5, c6, c4, c2, c3) values(501, 501, 1, '111', '[0.637985,0.435922,0.507803,0.173239,0.731558,0.475490,0.137246,0.659436,0.887185,0.237127]', '[0.261976,0.930429,0.471947,0.405530,0.324696,0.734540,0.014641,0.351016,0.500687,0.521748]');
insert into vec_t2 (c1, c5, c6, c4, c2, c3) values(502, 3, 3, 'row8', '[0.019532,0.482579,0.978059,0.180159,0.529910,0.638184,0.080544,0.862590,0.296779,0.514347]', '[0.620133,0.953822,0.820692,0.200903,0.382887,0.589525,0.848620,0.660047,0.848600,0.643394]');
insert into vec_t2 (c1, c5, c6, c4, c2, c3) values(503, 4, 4, 'row9', '[0.456015,0.692266,0.896331,0.782146,0.070535,0.338547,0.635440,0.135370,0.200973,0.648648]', '[0.661974,0.050978,0.300594,0.309149,0.589825,0.455377,0.160762,0.713093,0.326418,0.624236]');
insert into vec_t2 (c1, c5, c6, c4, c2, c3) values(504, 5, 5, 'row10', '[0.269763,0.342426,0.800285,0.910017,0.817684,0.551279,0.411955,0.685510,0.706911,0.667069]', '[0.141073,0.986008,0.033824,0.416001,0.251765,0.227110,0.177887,0.734944,0.606629,0.235345]');
insert into vec_t2 (c1, c5, c6, c4, c2, c3) values(505, 6, 6, '111', '[0.419407,0.620409,0.127571,0.393134,0.865850,0.634016,0.484868,0.354855,0.393209,0.576745]', '[0.041515,0.507417,0.404863,0.659963,0.584645,0.893935,0.574154,0.356759,0.969593,0.524461]');
insert into vec_t2 (c1, c5, c6, c4, c2, c3) values(506, 7, 6, '111', '[0.240333,0.126798,0.810217,0.020918,0.026532,0.342625,0.184299,0.807100,0.101946,0.325436]', '[0.320389,0.752659,0.642094,0.510712,0.892990,0.391960,0.240862,0.351762,0.448939,0.695005]');
insert into vec_t2 (c1, c5, c6, c4, c2, c3) values(507, 8, 6, '111', '[0.189038,0.534414,0.478418,0.224103,0.749363,0.003588,0.041515,0.937407,0.849911,0.022840]', '[0.337841,0.885516,0.017209,0.749467,0.690601,0.649319,0.683582,0.994471,0.206399,0.764540]');
insert into vec_t2 (c1, c5, c6, c4, c2, c3) values(508, 9, 6, '111', '[0.206516,0.781337,0.798483,0.549615,0.845935,0.990020,0.765809,0.442750,0.262689,0.197060]', '[0.449608,0.990015,0.577008,0.180818,0.273332,0.254307,0.074669,0.364649,0.434206,0.994659]');
insert /*+ direct(true, 100, 'inc_replace') enable_parallel_dml parallel(2) */ into vec_t1 select * from vec_t2;
ERROR 23000: Duplicate entry '50-row198' for key 'PRIMARY'
create table vec_t3 (c1 int AUTO_INCREMENT, c2 vector(10), c3 vector(10), c4 varchar(10), c5 int UNIQUE, c6 int,
PRIMARY KEY(c1, c4),
INDEX (c5, c6));
insert into vec_t3 (c1, c5, c6, c4, c2, c3) values(500, 500, 500, '111', '[0.022470,0.178305,0.813060,0.463923,0.276312,0.330019,0.043964,0.830623,0.266355,0.886212]', '[0.612456,0.419102,0.939437,0.701895,0.475109,0.334464,0.876076,0.120166,0.537638,0.117534]');
insert into vec_t3 (c1, c5, c6, c4, c2, c3) values(501, 501, 1, '111', '[0.637985,0.435922,0.507803,0.173239,0.731558,0.475490,0.137246,0.659436,0.887185,0.237127]', '[0.261976,0.930429,0.471947,0.405530,0.324696,0.734540,0.014641,0.351016,0.500687,0.521748]');
insert into vec_t3 (c1, c5, c6, c4, c2, c3) values(502, 3, 3, 'row3', '[0.019532,0.482579,0.978059,0.180159,0.529910,0.638184,0.080544,0.862590,0.296779,0.514347]', '[0.620133,0.953822,0.820692,0.200903,0.382887,0.589525,0.848620,0.660047,0.848600,0.643394]');
insert into vec_t3 (c1, c5, c6, c4, c2, c3) values(503, 4, 4, 'row4', '[0.456015,0.692266,0.896331,0.782146,0.070535,0.338547,0.635440,0.135370,0.200973,0.648648]', '[0.661974,0.050978,0.300594,0.309149,0.589825,0.455377,0.160762,0.713093,0.326418,0.624236]');
insert into vec_t3 (c1, c5, c6, c4, c2, c3) values(504, 5, 5, '111', '[0.269763,0.342426,0.800285,0.910017,0.817684,0.551279,0.411955,0.685510,0.706911,0.667069]', '[0.141073,0.986008,0.033824,0.416001,0.251765,0.227110,0.177887,0.734944,0.606629,0.235345]');
insert into vec_t3 (c1, c5, c6, c4, c2, c3) values(505, 6, 6, '111', '[0.419407,0.620409,0.127571,0.393134,0.865850,0.634016,0.484868,0.354855,0.393209,0.576745]', '[0.041515,0.507417,0.404863,0.659963,0.584645,0.893935,0.574154,0.356759,0.969593,0.524461]');
insert into vec_t3 (c1, c5, c6, c4, c2, c3) values(506, 7, 6, '111', '[0.240333,0.126798,0.810217,0.020918,0.026532,0.342625,0.184299,0.807100,0.101946,0.325436]', '[0.320389,0.752659,0.642094,0.510712,0.892990,0.391960,0.240862,0.351762,0.448939,0.695005]');
insert into vec_t3 (c1, c5, c6, c4, c2, c3) values(507, 8, 6, '111', '[0.189038,0.534414,0.478418,0.224103,0.749363,0.003588,0.041515,0.937407,0.849911,0.022840]', '[0.337841,0.885516,0.017209,0.749467,0.690601,0.649319,0.683582,0.994471,0.206399,0.764540]');
insert into vec_t3 (c1, c5, c6, c4, c2, c3) values(508, 9, 6, '111', '[0.206516,0.781337,0.798483,0.549615,0.845935,0.990020,0.765809,0.442750,0.262689,0.197060]', '[0.449608,0.990015,0.577008,0.180818,0.273332,0.254307,0.074669,0.364649,0.434206,0.994659]');
insert into vec_t1(c1, c5, c6, c4, c2, c3)
select vec_t2.c1, vec_t2.c5, vec_t2.c6, vec_t2.c4, vec_t3.c2, vec_t3.c3
from vec_t2
join vec_t3 on vec_t2.c1 = vec_t3.c1
where vec_t2.c6 = 500;
insert into vec_t1(c1, c5, c6, c4, c2, c3)
select vec_t3.c1, sum(vec_t3.c5), vec_t3.c6, vec_t3.c4, vec_t3.c2, vec_t3.c3
from vec_t2
join vec_t3 on vec_t2.c1 = vec_t3.c1
where vec_t3.c6 < 6
group by vec_t3.c5;
insert into vec_t1(c1, c5, c6, c4, c2, c3)
values (20, 20, 20, '222',
(select c2 from vec_t2 where c1 = 500),
(select vec_t2.c3 from vec_t2 join vec_t3 on vec_t2.c1 = vec_t3.c1 where vec_t3.c1 = 501));
update vec_t1
set vec_t1.c3 = (select vec_t2.c3 from vec_t2 where vec_t2.c1 = vec_t1.c1 and vec_t2.c1 = 100)
where vec_t1.c1 in (select vec_t3.c5 from vec_t3 where vec_t3.c1 = 502);
update vec_t1
join vec_t2 on vec_t1.c1 = vec_t2.c1
set vec_t1.c3 = vec_t2.c3 + '[0.692623,0.816816,0.418483,0.393929,0.061058,0.402308,0.564665,0.406696,0.628286,0.250843]'
where vec_t2.c5 < 5;
update vec_t1
set c2 = case
when c1 = 201 then c3 + '[0.692623,0.816816,0.418483,0.393929,0.061058,0.402308,0.564665,0.406696,0.628286,0.250843]'
            when c1 = 401 then c3 - '[0.692623,0.816816,0.418483,0.393929,0.061058,0.402308,0.564665,0.406696,0.628286,0.250843]'
            else c2
end
where c1 < 500;
with cte as (
select c5, c2 from vec_t2 where c5 = (select vec_t3.c5 from vec_t3 where vec_t3.c1 = 504)
)
update vec_t1
set c2 = (select c2 from cte)
where c1 = (select c5 from cte);
delete from vec_t1
where vec_t1.c1 in (
select vec_t2.c5
from vec_t2
join vec_t3 on vec_t2.c5 = vec_t3.c5
where vec_t2.c6 = 6
);
delete vec_t1
from vec_t1
join vec_t2 on vec_t1.c1 = vec_t2.c5
where vec_t2.c6 <= 3;
START TRANSACTION;
delete from vec_t1
where vec_t1.c1 in (
select c1 from vec_t2
);
update vec_t1
set c2 = c2 + '[0.656600,0.774219,0.219927,0.338169,0.076971,0.765809,0.457919,0.319581,0.684450,0.978672]'
where c1 > 10009;
insert into vec_t1 (c1, c5, c6, c4, c2, c3) values(30, 30, 30, '333', '[0.334026,0.043526,0.929846,0.894381,0.519075,0.139456,0.786002,0.261313,0.717511,0.513035]', '[0.539490,0.940232,0.715131,0.831306,0.785149,0.052129,0.019936,0.751876,0.862698,0.887735]');
COMMIT;
create procedure vec_proc(IN inc1 INT, IN inc2 INT)
begin
DECLARE t2c2 INT;
select c5 into t2c2
from vec_t2
where c1 = inc1;
if t2c2 = inc2 then
update vec_t1
set c2 = c2 + '[0.656600,0.774219,0.219927,0.338169,0.076971,0.765809,0.457919,0.319581,0.684450,0.978672]'
        where c1 > 10000;
else
insert into vec_t1 select * from vec_t2 where vec_t2.c1 >= 505;
end if;
end;
//
CALL vec_proc(500, 500);
CALL vec_proc(500, 501);
drop procedure vec_proc;
=================== clear ===================
drop table vec_t1, vec_t2, vec_t3;
alter system set ob_vector_memory_limit_percentage = 0;
