DROP TABLE IF EXISTS sq_vec_table;
alter system set ob_vector_memory_limit_percentage = 40;
====================== test #1 =======================
create ivf sq8 vec index on existing table
CREATE TABLE sq_vec_table (
id int,
c2 vector(10));
create vector index vec_idx1 on sq_vec_table(c2) with (distance=l2, type=ivf_sq8, lib=OB);
===== ivf sq8 sq_vec_table columns =============
column_id	column_name
1	__pk_increment
16	id
17	c*
18	__ivf_center_id_*_*
19	__ivf_center_vector_*_*
20	__ivf_meta_id_*_*
21	__ivf_meta_vector_*_*
22	__ivf_data_vector_*_*
===== ivf sq8 index aux tables =====
table_name
__idx_DATA_TABLE_ID_vec_idx1
__idx_DATA_TABLE_ID_vec_idx1_ivf_sq_meta
__idx_DATA_TABLE_ID_vec_idx1_ivf_cid_vector
__idx_DATA_TABLE_ID_vec_idx1_ivf_rowkey_cid
===== sq_vec_table vec_idx1 cols ===
column_id	column_name
18	__ivf_center_id_*_*
19	__ivf_center_vector_*_*
===== sq_vec_table vec_idx1_ivf_sq_meta cols ===
column_id	column_name
20	__ivf_meta_id_*_*
21	__ivf_meta_vector_*_*
===== sq_vec_table vec_idx1_ivf_cid_vector cols ======
column_id	column_name
1	__pk_increment
18	__ivf_center_id_*_*
22	__ivf_data_vector_*_*
===== sq_vec_table vec_idx1_ivf_rowkey_cid cols ===
column_id	column_name
1	__pk_increment
18	__ivf_center_id_*_*
clear
alter system set ob_vector_memory_limit_percentage = 0;
alter system set ob_vector_memory_limit_percentage = 20;
set ob_enable_index_direct_select = 1;
drop database if exists post_create_vec;
create database post_create_vec;
use post_create_vec;


"=========================================== __all_ddl_operation ==========================================="
drop table if exists vec_table;
CREATE TABLE vec_table (
id int,
c2 vector(10));
CREATE VECTOR INDEX VEC_IDX1 ON vec_table(c2) with (distance=l2, type=ivf_sq8, lib=OB);
select operation_type, ddl_stmt_str from oceanbase.__all_ddl_operation 
where database_id = (select database_id from oceanbase.__all_database where database_name='post_create_vec') 
and ddl_stmt_str != '' order by schema_version;
operation_type	ddl_stmt_str
202	create database post_create_vec
4	CREATE TABLE vec_table (
id int,
c2 vector(10))
drop table vec_table;


"=========================================== 索引名有转义字符 ================================================="
drop table if exists t_vec;
create table t_vec(c1 int, c2 vector(3), primary key(c1));
create vector index `idx\n1` ON t_vec(c2) with (distance=l2, type=ivf_sq8, lib=OB);
drop table t_vec;


"=========================================== 索引名有大小写 ==================================================="
drop table if exists t_vec;
create table t_vec(c1 int, c2 vector(3), primary key(c1));
create vector index iDx1 ON t_vec(c2) with (distance=l2, type=ivf_sq8, lib=OB);
drop table t_vec;


"========================================== 索引名有特殊字符 001 ==============================================="
drop table if exists t_vec;
create table t_vec(c1 int, c2 vector(3), primary key(c1));
create vector index iDx$1 ON t_vec(c2) with (distance=l2, type=ivf_sq8, lib=OB);
drop table t_vec;


"========================================== 索引名有特殊字符 002 ==============================================="
drop table if exists t_vec;
create table t_vec(c1 int, c2 vector(3), primary key(c1));
create vector index café ON t_vec(c2) with (distance=l2, type=ivf_sq8, lib=OB);
drop table t_vec;


"========================================== 索引名有特殊字符 003 ==============================================="
drop table if exists t_vec;
create table t_vec(c1 int, c2 vector(3), c3 vector(3), primary key(c1));
create vector index café ON t_vec(c2) with (distance=l2, type=ivf_sq8, lib=OB);
create vector index cafe ON t_vec(c3) with (distance=l2, type=ivf_sq8, lib=OB);
ERROR 42000: Duplicate key name 'cafe'
drop table t_vec;
drop table if exists vec_tmp;
create table vec_tmp(c1 int, c2 vector(10));
insert into vec_tmp values(1, '[0.748479,0.276979,0.555195,0.145492,0.045639,0.924278,0.696082,0.841479,0.742934,0.953073]');
create unique index idx1 on vec_tmp(c2) with (distance=l2, type=ivf_sq8, lib=OB);
ERROR 0A000: create index on vector or array column is not supported
create vector index idx1 on vec_tmp(c5) with (distance=l2, type=ivf_sq8, lib=OB);
ERROR 42000: Key column 'c5' doesn't exist in table
create vector index idx1 on vec_tmp(c1) with (distance=l2, type=ivf_sq8, lib=OB);
ERROR HY000: Column 'c1' cannot be part of VECTOR index
create vector index idx1 on vec_tmp(c2);
ERROR 0A000: vector index params not set is not supported
create vector index idx1 on vec_tmp(c2) with (distance=l2);
ERROR 0A000: vector index params not set distance and type is not supported
create vector index idx1 on vec_tmp(c2) with (distance=l2, lib=OB);
ERROR 0A000: the vector index params of distance or type not set is not supported
create vector index idx1 on vec_tmp(c2) with (distance=l2, lib=vs);
ERROR 0A000: this type of vector index lib is not supported
CREATE VECTOR INDEX IDX1 ON vec_tmp(c2) with (distance=l2, type=ivf_sq8, lib=OB);
drop table vec_tmp;
====================== test #2 =================================
============= create vec index on existing table with data ===========
DROP TABLE IF EXISTS vec_t1;
DROP VIEW IF EXISTS view_liyao;
create table vec_t1 (c1 int AUTO_INCREMENT, c2 vector(10), c3 vector(10), c4 varchar(10), c5 int UNIQUE, c6 int,
PRIMARY KEY(c1, c4),
INDEX (c5, c6));
alter system set ob_vector_memory_limit_percentage = 20;
# 指定nlist和samples_per_nlist
create vector index idx1 on vec_t1(c2) WITH (distance=l2, type=ivf_sq8, lib=OB, nlist=5, sample_per_nlist=15);
create view view_liyao as select * from vec_t1;
# 查询索引表
count(*)
5
count(*)
100
count(*)
100
count(*)
3
# 默认参数
create vector index idx2 on vec_t1(c3) WITH (distance=l2, type=ivf_sq8, lib=OB);
# 查询索引表
count(*)
100
count(*)
100
count(*)
100
count(*)
3
# 分区表
DROP TABLE IF EXISTS vec_t1;
DROP VIEW IF EXISTS view_liyao;
create table vec_t1 (c1 int AUTO_INCREMENT, c2 vector(10), c3 vector(10), c4 varchar(10), c5 int, c6 int,
PRIMARY KEY(c1, c4),
INDEX (c5, c6))
PARTITION BY RANGE(c1) (
PARTITION p0 VALUES less than(30),
PARTITION p1 VALUES less than(60),
PARTITION p2 VALUES less than(MAXVALUE)
);
# 指定nlist和samples_per_nlist
create vector index idx1 on vec_t1(c2) WITH (distance=l2, type=ivf_sq8, lib=OB, nlist=5, sample_per_nlist=15);
create view view_liyao as select * from vec_t1;
# 查询索引表
count(*)
15
count(*)
100
count(*)
100
count(*)
9
# 默认参数
create vector index idx2 on vec_t1(c3) WITH (distance=l2, type=ivf_sq8, lib=OB);
# 查询索引表
count(*)
100
count(*)
100
count(*)
100
count(*)
9
drop table vec_t1;
drop view view_liyao;
====================== test #3 =================================
============= use dataset with dml ===========
drop table if exists t1;
create table t1 (id int primary key, wine_type int, wine_data vector(13), iris_type varchar(20), iris_data vector(4), data vector(3));
create vector index idx1 on t1 (wine_data) with (distance=l2, type=ivf_sq8, nlist=3, sample_per_nlist=50);
create vector index idx2 on t1 (iris_data) with (distance=l2, type=ivf_sq8, nlist=3, sample_per_nlist=50);
create vector index idx3 on t1 (data) with (distance=l2, type=hnsw, lib=vsag, m=10, ef_construction=11, ef_search=40);
show create table t1;
Table	Create Table
t1	CREATE TABLE `t1` (
  `id` int(11) NOT NULL,
  `wine_type` int(11) DEFAULT NULL,
  `wine_data` VECTOR(13) DEFAULT NULL,
  `iris_type` varchar(20) DEFAULT NULL,
  `iris_data` VECTOR(4) DEFAULT NULL,
  `data` VECTOR(3) DEFAULT NULL,
  PRIMARY KEY (`id`),
  VECTOR KEY `idx1` (`wine_data`) WITH (DISTANCE=L2, TYPE=IVF_SQ8, NLIST=3, SAMPLE_PER_NLIST=50, LIB=OB) BLOCK_SIZE 16384,
  VECTOR KEY `idx2` (`iris_data`) WITH (DISTANCE=L2, TYPE=IVF_SQ8, NLIST=3, SAMPLE_PER_NLIST=50, LIB=OB) BLOCK_SIZE 16384,
  VECTOR KEY `idx3` (`data`) WITH (DISTANCE=L2, TYPE=HNSW, LIB=VSAG, M=10, EF_CONSTRUCTION=11, EF_SEARCH=40) BLOCK_SIZE 16384
) ORGANIZATION INDEX DEFAULT CHARSET = utf8mb4 ROW_FORMAT = DYNAMIC COMPRESSION = 'zstd_1.3.8' REPLICA_NUM = replica_num BLOCK_SIZE = 16384 USE_BLOOM_FILTER = FALSE ENABLE_MACRO_BLOCK_BLOOM_FILTER = FALSE TABLET_SIZE = 134217728 PCTFREE = 0
select count(*) from t1;
count(*)
628
# 查询索引表
count(*)
3
count(*)
628
count(*)
628
count(*)
3
count(*)
3
count(*)
628
count(*)
628
count(*)
3
update t1 set wine_data = '[14.23,1.71,2.43,15.6,127,2.8,3.06,0.28,2.29,5.64,1.04,3.92,1065]' where id = 201;
update t1 set wine_data = '[11.61,1.35,2.7,20,94,2.74,2.92,0.29,2.49,2.65,0.96,3.26,680]' where id = 202;
insert into t1(id, wine_type, wine_data) values(203, 1, '[13.2,1.78,2.14,11.2,100,2.65,2.76,0.26,1.28,4.38,1.05,3.4,1050]') ON DUPLICATE KEY UPDATE wine_data = '[13.2,1.78,2.14,11.2,100,2.65,2.76,0.26,1.28,4.38,1.05,3.4,1050]';
insert into t1(id, wine_type, wine_data) values(179, 3,'[14.13,4.1,2.74,24.5,96,2.05,0.76,0.56,1.35,9.2,0.61,1.6,560]') ON DUPLICATE KEY UPDATE wine_data = '[13.2,1.78,2.14,11.2,100,2.65,2.76,0.26,1.28,4.38,1.05,3.4,1050]';
delete from t1 where id = 178;
replace into t1(id, wine_type, wine_data) values(180, 3,'[13.17,2.59,2.37,20,120,1.65,0.68,0.53,1.46,9.3,0.6,1.62,840]');
select count(*) from t1;
count(*)
629
# 查询索引表
count(*)
3
count(*)
629
count(*)
629
count(*)
3
count(*)
3
count(*)
629
count(*)
629
count(*)
3
drop table t1;
=================== clear ===================
drop database post_create_vec;
alter system set ob_vector_memory_limit_percentage = 0;
