alter system set ob_vector_memory_limit_percentage = 34;
# 单分区先建索引
drop table if exists vec_t1;
CREATE TABLE vec_t1 (c1 int primary key, c2 varchar(30),c3 vector(3) ,c4 vector(10),
VECTOR INDEX idx1(c4)
WITH (distance=l2, type=ivf_pq, m=5));
insert into vec_t1(c1,c2,c3,c4) values(1,'[1,1,2]','[2,2,3]','[0.692623,0.816816,0.418483,0.393929,0.061058,0.402308,0.564665,0.406696,0.628286,0.250843]');
insert into vec_t1(c1,c2,c3,c4) values(2,'[2,1,2]','[2,2,2]','[0.125866,0.428902,0.214633,0.208882,0.435422,0.045606,0.915596,0.065899,0.523299,0.352734]');
insert into vec_t1(c1,c2,c3,c4) values(3,'[3,1,2]','[3,2,2]','[0.904051,0.864011,0.292710,0.748016,0.307713,0.820417,0.735923,0.839659,0.742446,0.146719]');
insert into vec_t1(c1,c2,c3,c4) values(4,'[4,1,2]','[5,2,3]','[0.234391,0.660406,0.370087,0.860388,0.586119,0.668096,0.122285,0.670929,0.997141,0.177069]');
insert into vec_t1(c1,c2,c3,c4) values(5,'[5,1,2]','[5,2,3]','[0.958113,0.424453,0.091372,0.726940,0.173619,0.023668,0.220956,0.260019,0.402649,0.175887]');
insert into vec_t1(c1,c2,c3,c4) values(6,'[1,1,2]','[2,2,3]','[0.361888,0.645381,0.156383,0.099361,0.565967,0.848600,0.445232,0.616518,0.345585,0.636063]');
insert into vec_t1(c1,c2,c3,c4) values(7,'[2,1,2]','[2,2,2]','[0.279319,0.570040,0.217214,0.826609,0.337557,0.718166,0.431902,0.670941,0.330390,0.138255]');
insert into vec_t1(c1,c2,c3,c4) values(8,'[3,1,2]','[3,2,2]','[0.201525,0.342033,0.391054,0.393511,0.708165,0.654430,0.936382,0.402074,0.487789,0.838557]');
insert into vec_t1(c1,c2,c3,c4) values(9,'[4,1,2]','[5,2,3]','[0.531002,0.850454,0.513266,0.833590,0.771357,0.659888,0.980127,0.607635,0.315216,0.932509]');
insert into vec_t1(c1,c2,c3,c4) values(0,'[5,1,2]','[5,2,3]','[0.612456,0.419102,0.939437,0.701895,0.475109,0.334464,0.876076,0.120166,0.537638,0.117534]');
set ob_enable_index_direct_select = 1;
# 查询索引表
count(*)
0
count(*)
0
count(*)
10
count(*)
10
update vec_t1 set c4 = '[0.019532,0.482579,0.978059,0.180159,0.529910,0.638184,0.080544,0.862590,0.296779,0.514347]' where c1 = 2;
insert into vec_t1(c1,c2,c3,c4) values(2,'[2,1,2]','[2,2,2]','[0.456015,0.692266,0.896331,0.782146,0.070535,0.338547,0.635440,0.135370,0.200973,0.648648]') ON DUPLICATE KEY UPDATE c4 = '[0.125866,0.428902,0.214633,0.208882,0.435422,0.045606,0.915596,0.065899,0.523299,0.352734]';
delete from vec_t1 where c1 = 3;
insert into vec_t1(c1,c2,c3,c4) values(3,'[2,1,2]','[2,2,2]','[0.456015,0.692266,0.896331,0.782146,0.070535,0.338547,0.635440,0.135370,0.200973,0.648648]') ON DUPLICATE KEY UPDATE c3 = '[1,1,1]';
update vec_t1 set c4 = '[0.661974,0.050978,0.300594,0.309149,0.589825,0.455377,0.160762,0.713093,0.326418,0.624236]' where c1 = 1;
# 查询索引表
count(*)
0
count(*)
0
count(*)
10
count(*)
10
drop table vec_t1;
# 多分区先建索引
drop table if exists vec_t1;
CREATE TABLE vec_t1 (c1 int primary key, c4 vector(10),
VECTOR INDEX idx1(c4)
WITH (distance=l2, type=ivf_pq, m=5))
PARTITION BY RANGE(c1) (
PARTITION p0 VALUES less than(10),
PARTITION p1 VALUES less than(20),
PARTITION p2 VALUES less than(MAXVALUE)
);
insert into vec_t1(c1,c4) values(1,'[0.692623,0.816816,0.418483,0.393929,0.061058,0.402308,0.564665,0.406696,0.628286,0.250843]');
insert into vec_t1(c1,c4) values(2,'[0.125866,0.428902,0.214633,0.208882,0.435422,0.045606,0.915596,0.065899,0.523299,0.352734]');
insert into vec_t1(c1,c4) values(3,'[0.904051,0.864011,0.292710,0.748016,0.307713,0.820417,0.735923,0.839659,0.742446,0.146719]');
insert into vec_t1(c1,c4) values(4,'[0.234391,0.660406,0.370087,0.860388,0.586119,0.668096,0.122285,0.670929,0.997141,0.177069]');
insert into vec_t1(c1,c4) values(5,'[0.958113,0.424453,0.091372,0.726940,0.173619,0.023668,0.220956,0.260019,0.402649,0.175887]');
insert into vec_t1(c1,c4) values(6,'[0.361888,0.645381,0.156383,0.099361,0.565967,0.848600,0.445232,0.616518,0.345585,0.636063]');
insert into vec_t1(c1,c4) values(7,'[0.279319,0.570040,0.217214,0.826609,0.337557,0.718166,0.431902,0.670941,0.330390,0.138255]');
insert into vec_t1(c1,c4) values(8,'[0.201525,0.342033,0.391054,0.393511,0.708165,0.654430,0.936382,0.402074,0.487789,0.838557]');
insert into vec_t1(c1,c4) values(9,'[0.531002,0.850454,0.513266,0.833590,0.771357,0.659888,0.980127,0.607635,0.315216,0.932509]');
insert into vec_t1(c1,c4) values(0,'[0.707352,0.537032,0.433431,0.727523,0.293137,0.990979,0.967610,0.895034,0.479304,0.205645]');
insert into vec_t1(c1,c4) values(10,'[0.022470,0.178305,0.813060,0.463923,0.276312,0.330019,0.043964,0.830623,0.266355,0.886212]');
insert into vec_t1(c1,c4) values(11,'[0.612456,0.419102,0.939437,0.701895,0.475109,0.334464,0.876076,0.120166,0.537638,0.117534]');
insert into vec_t1(c1,c4) values(12,'[0.637985,0.435922,0.507803,0.173239,0.731558,0.475490,0.137246,0.659436,0.887185,0.237127]');
insert into vec_t1(c1,c4) values(13,'[0.261976,0.930429,0.471947,0.405530,0.324696,0.734540,0.014641,0.351016,0.500687,0.521748]');
insert into vec_t1(c1,c4) values(14,'[0.019532,0.482579,0.978059,0.180159,0.529910,0.638184,0.080544,0.862590,0.296779,0.514347]');
insert into vec_t1(c1,c4) values(15,'[0.620133,0.953822,0.820692,0.200903,0.382887,0.589525,0.848620,0.660047,0.848600,0.643394]');
insert into vec_t1(c1,c4) values(16,'[0.456015,0.692266,0.896331,0.782146,0.070535,0.338547,0.635440,0.135370,0.200973,0.648648]');
insert into vec_t1(c1,c4) values(17,'[0.661974,0.050978,0.300594,0.309149,0.589825,0.455377,0.160762,0.713093,0.326418,0.624236]');
insert into vec_t1(c1,c4) values(18,'[0.269763,0.342426,0.800285,0.910017,0.817684,0.551279,0.411955,0.685510,0.706911,0.667069]');
insert into vec_t1(c1,c4) values(19,'[0.141073,0.986008,0.033824,0.416001,0.251765,0.227110,0.177887,0.734944,0.606629,0.235345]');
insert into vec_t1(c1,c4) values(20,'[0.022470,0.178305,0.813060,0.463923,0.276312,0.330019,0.043964,0.830623,0.266355,0.886212]');
insert into vec_t1(c1,c4) values(21,'[0.612456,0.419102,0.939437,0.701895,0.475109,0.334464,0.876076,0.120166,0.537638,0.117534]');
insert into vec_t1(c1,c4) values(22,'[0.637985,0.435922,0.507803,0.173239,0.731558,0.475490,0.137246,0.659436,0.887185,0.237127]');
insert into vec_t1(c1,c4) values(23,'[0.261976,0.930429,0.471947,0.405530,0.324696,0.734540,0.014641,0.351016,0.500687,0.521748]');
insert into vec_t1(c1,c4) values(24,'[0.019532,0.482579,0.978059,0.180159,0.529910,0.638184,0.080544,0.862590,0.296779,0.514347]');
insert into vec_t1(c1,c4) values(25,'[0.620133,0.953822,0.820692,0.200903,0.382887,0.589525,0.848620,0.660047,0.848600,0.643394]');
insert into vec_t1(c1,c4) values(26,'[0.456015,0.692266,0.896331,0.782146,0.070535,0.338547,0.635440,0.135370,0.200973,0.648648]');
insert into vec_t1(c1,c4) values(27,'[0.661974,0.050978,0.300594,0.309149,0.589825,0.455377,0.160762,0.713093,0.326418,0.624236]');
insert into vec_t1(c1,c4) values(28,'[0.269763,0.342426,0.800285,0.910017,0.817684,0.551279,0.411955,0.685510,0.706911,0.667069]');
insert into vec_t1(c1,c4) values(29,'[0.141073,0.986008,0.033824,0.416001,0.251765,0.227110,0.177887,0.734944,0.606629,0.235345]');
# 查询索引表
count(*)
0
count(*)
0
count(*)
30
count(*)
30
update vec_t1 set c4 = '[0.022470,0.178305,0.813060,0.463923,0.276312,0.330019,0.043964,0.830623,0.266355,0.886212]' where c1 = 2;
insert into vec_t1(c1,c4) values(2,'[0.456015,0.692266,0.896331,0.782146,0.070535,0.338547,0.635440,0.135370,0.200973,0.648648]') ON DUPLICATE KEY UPDATE c4 = '[0.692623,0.816816,0.418483,0.393929,0.061058,0.402308,0.564665,0.406696,0.628286,0.250843]';
delete from vec_t1 where c1 = 3;
insert into vec_t1(c1,c4) values(3,'[0.456015,0.692266,0.896331,0.782146,0.070535,0.338547,0.635440,0.135370,0.200973,0.648648]') ON DUPLICATE KEY UPDATE c4 = '[1,1,1]';
update vec_t1 set c4 = '[0.612456,0.419102,0.939437,0.701895,0.475109,0.334464,0.876076,0.120166,0.537638,0.117534]' where c1 = 1;
# 查询索引表
count(*)
0
count(*)
0
count(*)
30
count(*)
30
drop table vec_t1;
################# complex dml operation ##################
DROP TABLE IF EXISTS vec;
DROP TABLE IF EXISTS normal;
DROP VIEW IF EXISTS vec_view;
create table vec(c1 int, c2 vector(10), primary key(c1), vector index idx1(c2) with (distance=l2, type=ivf_pq, m=5));
create table normal(c1 int, c2 vector(10), primary key(c1));
CREATE VIEW vec_view as select * from vec;
INSERT INTO vec values (1, '[0.692623,0.816816,0.418483,0.393929,0.061058,0.402308,0.564665,0.406696,0.628286,0.250843]'), (2, '[0.125866,0.428902,0.214633,0.208882,0.435422,0.045606,0.915596,0.065899,0.523299,0.352734]');
INSERT INTO normal values (1, '[0.692623,0.816816,0.418483,0.393929,0.061058,0.402308,0.564665,0.406696,0.628286,0.250843]'), (2, '[0.125866,0.428902,0.214633,0.208882,0.435422,0.045606,0.915596,0.065899,0.523299,0.352734]');
insert into vec values (1, '[0.692623,0.816816,0.418483,0.393929,0.061058,0.402308,0.564665,0.406696,0.628286,0.250843]') ON DUPLICATE KEY UPDATE c2 = '[0.692623,0.816816,0.418483,0.393929,0.061058,0.402308,0.564665,0.406696,0.628286,0.250843]';
insert into normal values (1, '[0.692623,0.816816,0.418483,0.393929,0.061058,0.402308,0.564665,0.406696,0.628286,0.250843]') ON DUPLICATE KEY UPDATE c2 = '[0.692623,0.816816,0.418483,0.393929,0.061058,0.402308,0.564665,0.406696,0.628286,0.250843]';
replace into vec (c1, c2) values (1, '[0.692623,0.816816,0.418483,0.393929,0.061058,0.402308,0.564665,0.406696,0.628286,0.250843]');
replace into normal (c1, c2) values (1, '[0.692623,0.816816,0.418483,0.393929,0.061058,0.402308,0.564665,0.406696,0.628286,0.250843]');
insert into vec_view values (3, '[0.707352,0.537032,0.433431,0.727523,0.293137,0.990979,0.967610,0.895034,0.479304,0.205645]'), (4, '[0.904051,0.864011,0.292710,0.748016,0.307713,0.820417,0.735923,0.839659,0.742446,0.146719]');
insert into normal (c1, c2) values (3, '[0.692623,0.816816,0.418483,0.393929,0.061058,0.402308,0.564665,0.406696,0.628286,0.250843]');
select * from vec_view;
c1	c2
1	[0.692623,0.816816,0.418483,0.393929,0.061058,0.402308,0.564665,0.406696,0.628286,0.250843]
2	[0.125866,0.428902,0.214633,0.208882,0.435422,0.045606,0.915596,0.065899,0.523299,0.352734]
3	[0.707352,0.537032,0.433431,0.727523,0.293137,0.990979,0.96761,0.895034,0.479304,0.205645]
4	[0.904051,0.864011,0.29271,0.748016,0.307713,0.820417,0.735923,0.839659,0.742446,0.146719]
select * from normal;
c1	c2
1	[0.692623,0.816816,0.418483,0.393929,0.061058,0.402308,0.564665,0.406696,0.628286,0.250843]
2	[0.125866,0.428902,0.214633,0.208882,0.435422,0.045606,0.915596,0.065899,0.523299,0.352734]
3	[0.692623,0.816816,0.418483,0.393929,0.061058,0.402308,0.564665,0.406696,0.628286,0.250843]
update vec join normal on vec.c1 = normal.c1 set vec.c2 = '[0.904051,0.864011,0.292710,0.748016,0.307713,0.820417,0.735923,0.839659,0.742446,0.146719]', normal.c2 = '[0.234391,0.660406,0.370087,0.860388,0.586119,0.668096,0.122285,0.670929,0.997141,0.177069]';
select * from vec_view;
c1	c2
1	[0.904051,0.864011,0.29271,0.748016,0.307713,0.820417,0.735923,0.839659,0.742446,0.146719]
2	[0.904051,0.864011,0.29271,0.748016,0.307713,0.820417,0.735923,0.839659,0.742446,0.146719]
3	[0.904051,0.864011,0.29271,0.748016,0.307713,0.820417,0.735923,0.839659,0.742446,0.146719]
4	[0.904051,0.864011,0.29271,0.748016,0.307713,0.820417,0.735923,0.839659,0.742446,0.146719]
select * from normal;
c1	c2
1	[0.234391,0.660406,0.370087,0.860388,0.586119,0.668096,0.122285,0.670929,0.997141,0.177069]
2	[0.234391,0.660406,0.370087,0.860388,0.586119,0.668096,0.122285,0.670929,0.997141,0.177069]
3	[0.234391,0.660406,0.370087,0.860388,0.586119,0.668096,0.122285,0.670929,0.997141,0.177069]
update vec join normal on vec.c1 = normal.c1 set vec.c2 = '[0.904051,0.864011,0.292710,0.748016,0.307713,0.820417,0.735923,0.839659,0.742446,0.146719]';
update vec join normal on vec.c1 = normal.c1 set normal.c2 = vec.c2;
select * from normal;
c1	c2
1	[0.904051,0.864011,0.29271,0.748016,0.307713,0.820417,0.735923,0.839659,0.742446,0.146719]
2	[0.904051,0.864011,0.29271,0.748016,0.307713,0.820417,0.735923,0.839659,0.742446,0.146719]
3	[0.904051,0.864011,0.29271,0.748016,0.307713,0.820417,0.735923,0.839659,0.742446,0.146719]
select * from vec;
c1	c2
1	[0.904051,0.864011,0.29271,0.748016,0.307713,0.820417,0.735923,0.839659,0.742446,0.146719]
2	[0.904051,0.864011,0.29271,0.748016,0.307713,0.820417,0.735923,0.839659,0.742446,0.146719]
3	[0.904051,0.864011,0.29271,0.748016,0.307713,0.820417,0.735923,0.839659,0.742446,0.146719]
4	[0.904051,0.864011,0.29271,0.748016,0.307713,0.820417,0.735923,0.839659,0.742446,0.146719]
update vec_view join normal on vec_view.c1 = normal.c1 set vec_view.c2 = '[0.904051,0.864011,0.292710,0.748016,0.307713,0.820417,0.735923,0.839659,0.742446,0.146719]', normal.c2 = '[0.234391,0.660406,0.370087,0.860388,0.586119,0.668096,0.122285,0.670929,0.997141,0.177069]';
update vec_view set c2 = '[0.904051,0.864011,0.292710,0.748016,0.307713,0.820417,0.735923,0.839659,0.742446,0.146719]';
select * from vec;
c1	c2
1	[0.904051,0.864011,0.29271,0.748016,0.307713,0.820417,0.735923,0.839659,0.742446,0.146719]
2	[0.904051,0.864011,0.29271,0.748016,0.307713,0.820417,0.735923,0.839659,0.742446,0.146719]
3	[0.904051,0.864011,0.29271,0.748016,0.307713,0.820417,0.735923,0.839659,0.742446,0.146719]
4	[0.904051,0.864011,0.29271,0.748016,0.307713,0.820417,0.735923,0.839659,0.742446,0.146719]
select * from vec_view;
c1	c2
1	[0.904051,0.864011,0.29271,0.748016,0.307713,0.820417,0.735923,0.839659,0.742446,0.146719]
2	[0.904051,0.864011,0.29271,0.748016,0.307713,0.820417,0.735923,0.839659,0.742446,0.146719]
3	[0.904051,0.864011,0.29271,0.748016,0.307713,0.820417,0.735923,0.839659,0.742446,0.146719]
4	[0.904051,0.864011,0.29271,0.748016,0.307713,0.820417,0.735923,0.839659,0.742446,0.146719]
delete vec, normal from vec join normal on vec.c1 = normal.c1;
delete vec from vec join normal on vec.c1 = normal.c1;
delete vec from vec join normal on vec.c1 = normal.c1;
delete normal from vec_view join normal on vec_view.c1 = normal.c1 and 1=0;
delete from vec_view where c2 = '[0.904051,0.864011,0.292710,0.748016,0.307713,0.820417,0.735923,0.839659,0.742446,0.146719]';
drop table vec;
drop table normal;
drop view vec_view;
drop table if exists vec_t1;
CREATE TABLE vec_t1 (c1 int primary key, c2 vector(10),c3 vector(3) ,c4 vector(3),
VECTOR INDEX vector_idx(c2) 
WITH (distance=l2, type=ivf_pq, m=5));
insert into vec_t1 values(1,'[0.692623,0.816816,0.418483,0.393929,0.061058,0.402308,0.564665,0.406696,0.628286,0.250843]','[2,2,3]','[1,3,2]');
insert into vec_t1 values(2,'[0.125866,0.428902,0.214633,0.208882,0.435422,0.045606,0.915596,0.065899,0.523299,0.352734]','[1,0,3]','[2,3,2]');
insert into vec_t1 values(3,'[0.904051,0.864011,0.292710,0.748016,0.307713,0.820417,0.735923,0.839659,0.742446,0.146719]','[-3,2,3]','[4,3,3]');
insert into vec_t1 values(4,'[0.234391,0.660406,0.370087,0.860388,0.586119,0.668096,0.122285,0.670929,0.997141,0.177069]','[-4,2,3]',null);
insert into vec_t1 values(5,'[0.958113,0.424453,0.091372,0.726940,0.173619,0.023668,0.220956,0.260019,0.402649,0.175887]',null,'[2,3,1]');
update vec_t1 set c1 = 10 where c3 is null;
drop table vec_t1;
drop table if exists vec_t1;
create table vec_t1(c1 int, c2 vector(10) not null, primary key(c1));
insert ignore into vec_t1 values(1, null);
ERROR 23000: Column 'c2' cannot be null
drop table vec_t1;
drop table if exists vec_t1;
create table vec_t1(c1 int, c2 vector(10), primary key(c1), vector index idx1(c2) with (distance=L2, type=ivf_pq, m=5));
insert into vec_t1 values(1, [0.958113,0.424453,0.091372,0.726940,0.173619,0.023668,0.220956,0.260019,0.402649,0.175887]);
select c2,123 from vec_t1 for update;
c2	123
[0.958113,0.424453,0.091372,0.72694,0.173619,0.023668,0.220956,0.260019,0.402649,0.175887]	123
select /*+ opt_param('rowsets_enabled', 'false') */ c2,123 from vec_t1 for update;
c2	123
[0.958113,0.424453,0.091372,0.72694,0.173619,0.023668,0.220956,0.260019,0.402649,0.175887]	123
drop table vec_t1;
# 单分区先建混合向量索引
drop table if exists vec_t1;
CREATE TABLE vec_t1 (c1 int primary key, c2 varchar(30),c3 vector(3) ,c4 vector(10),
VECTOR INDEX idx1(c4)
WITH (distance=l2, type=ivf_pq, m=5),
VECTOR INDEX idx2(c3)
WITH (distance=l2, type=hnsw));
insert into vec_t1(c1,c2,c3,c4) values(1,'[1,1,2]','[2,2,3]','[0.692623,0.816816,0.418483,0.393929,0.061058,0.402308,0.564665,0.406696,0.628286,0.250843]');
insert into vec_t1(c1,c2,c3,c4) values(2,'[2,1,2]','[2,2,2]','[0.125866,0.428902,0.214633,0.208882,0.435422,0.045606,0.915596,0.065899,0.523299,0.352734]');
insert into vec_t1(c1,c2,c3,c4) values(3,'[3,1,2]','[3,2,2]','[0.904051,0.864011,0.292710,0.748016,0.307713,0.820417,0.735923,0.839659,0.742446,0.146719]');
insert into vec_t1(c1,c2,c3,c4) values(4,'[4,1,2]','[5,2,3]','[0.234391,0.660406,0.370087,0.860388,0.586119,0.668096,0.122285,0.670929,0.997141,0.177069]');
insert into vec_t1(c1,c2,c3,c4) values(5,'[5,1,2]','[5,2,3]','[0.958113,0.424453,0.091372,0.726940,0.173619,0.023668,0.220956,0.260019,0.402649,0.175887]');
insert ignore into vec_t1(c1,c2,c3,c4) values(5,'[5,1,2]','[4,3,2]','[0.361888,0.645381,0.156383,0.099361,0.565967,0.848600,0.445232,0.616518,0.345585,0.636063]');
update vec_t1 set c4 = '[0.022470,0.178305,0.813060,0.463923,0.276312,0.330019,0.043964,0.830623,0.266355,0.886212]' where c1 = 2;
insert into vec_t1(c1,c2,c3,c4) values(2,'[2,1,2]','[2,2,2]','[0.361888,0.645381,0.156383,0.099361,0.565967,0.848600,0.445232,0.616518,0.345585,0.636063]') ON DUPLICATE KEY UPDATE c4 = '[0.904051,0.864011,0.292710,0.748016,0.307713,0.820417,0.735923,0.839659,0.742446,0.146719]';
delete from vec_t1 where c1 = 3;
insert into vec_t1(c1,c2,c3,c4) values(3,'[2,1,2]','[2,2,2]','[0.361888,0.645381,0.156383,0.099361,0.565967,0.848600,0.445232,0.616518,0.345585,0.636063]') ON DUPLICATE KEY UPDATE c3 = '[1,1,1]';
update vec_t1 set c4 = '[0.361888,0.645381,0.156383,0.099361,0.565967,0.848600,0.445232,0.616518,0.345585,0.636063]' where c1 = 1;
drop table vec_t1;
# 多分区先建混合向量索引
drop table if exists vec_t1;
drop table if exists normal;
drop view if exists vec_view;
CREATE TABLE vec_t1 (c1 int primary key, c3 vector(3) ,c4 vector(10),
VECTOR INDEX idx1(c4)
WITH (distance=l2, type=ivf_pq, m=5),
VECTOR INDEX idx2(c3)
WITH (distance=l2, type=hnsw))
PARTITION BY RANGE(c1) (
PARTITION p0 VALUES less than(10),
PARTITION p1 VALUES less than(20),
PARTITION p2 VALUES less than(MAXVALUE)
);
insert into vec_t1(c1,c3,c4) values(1,'[1,3,2]','[0.692623,0.816816,0.418483,0.393929,0.061058,0.402308,0.564665,0.406696,0.628286,0.250843]');
insert into vec_t1(c1,c3,c4) values(2,'[1,3,2]','[0.125866,0.428902,0.214633,0.208882,0.435422,0.045606,0.915596,0.065899,0.523299,0.352734]');
insert into vec_t1(c1,c3,c4) values(3,'[1,3,2]','[0.904051,0.864011,0.292710,0.748016,0.307713,0.820417,0.735923,0.839659,0.742446,0.146719]');
insert into vec_t1(c1,c3,c4) values(4,'[1,3,2]','[0.234391,0.660406,0.370087,0.860388,0.586119,0.668096,0.122285,0.670929,0.997141,0.177069]');
insert into vec_t1(c1,c3,c4) values(5,'[1,3,2]','[0.958113,0.424453,0.091372,0.726940,0.173619,0.023668,0.220956,0.260019,0.402649,0.175887]');
insert into vec_t1(c1,c3,c4) values(6,'[1,3,2]','[0.361888,0.645381,0.156383,0.099361,0.565967,0.848600,0.445232,0.616518,0.345585,0.636063]');
insert into vec_t1(c1,c3,c4) values(7,'[1,3,2]','[0.279319,0.570040,0.217214,0.826609,0.337557,0.718166,0.431902,0.670941,0.330390,0.138255]');
insert into vec_t1(c1,c3,c4) values(8,'[1,3,2]','[0.201525,0.342033,0.391054,0.393511,0.708165,0.654430,0.936382,0.402074,0.487789,0.838557]');
insert into vec_t1(c1,c3,c4) values(9,'[1,3,2]','[0.531002,0.850454,0.513266,0.833590,0.771357,0.659888,0.980127,0.607635,0.315216,0.932509]');
insert into vec_t1(c1,c3,c4) values(0,'[1,3,2]','[0.707352,0.537032,0.433431,0.727523,0.293137,0.990979,0.967610,0.895034,0.479304,0.205645]');
insert into vec_t1(c1,c3,c4) values(10,'[9,9,4]','[0.022470,0.178305,0.813060,0.463923,0.276312,0.330019,0.043964,0.830623,0.266355,0.886212]');
insert into vec_t1(c1,c3,c4) values(11,'[9,9,4]','[0.612456,0.419102,0.939437,0.701895,0.475109,0.334464,0.876076,0.120166,0.537638,0.117534]');
insert into vec_t1(c1,c3,c4) values(12,'[9,9,4]','[0.637985,0.435922,0.507803,0.173239,0.731558,0.475490,0.137246,0.659436,0.887185,0.237127]');
insert into vec_t1(c1,c3,c4) values(13,'[9,9,4]','[0.261976,0.930429,0.471947,0.405530,0.324696,0.734540,0.014641,0.351016,0.500687,0.521748]');
insert into vec_t1(c1,c3,c4) values(14,'[9,9,4]','[0.019532,0.482579,0.978059,0.180159,0.529910,0.638184,0.080544,0.862590,0.296779,0.514347]');
insert into vec_t1(c1,c3,c4) values(15,'[9,9,4]','[0.620133,0.953822,0.820692,0.200903,0.382887,0.589525,0.848620,0.660047,0.848600,0.643394]');
insert into vec_t1(c1,c3,c4) values(16,'[9,9,4]','[0.456015,0.692266,0.896331,0.782146,0.070535,0.338547,0.635440,0.135370,0.200973,0.648648]');
insert into vec_t1(c1,c3,c4) values(17,'[9,9,4]','[0.661974,0.050978,0.300594,0.309149,0.589825,0.455377,0.160762,0.713093,0.326418,0.624236]');
insert into vec_t1(c1,c3,c4) values(18,'[9,9,4]','[0.269763,0.342426,0.800285,0.910017,0.817684,0.551279,0.411955,0.685510,0.706911,0.667069]');
insert into vec_t1(c1,c3,c4) values(19,'[9,9,4]','[0.141073,0.986008,0.033824,0.416001,0.251765,0.227110,0.177887,0.734944,0.606629,0.235345]');
insert into vec_t1(c1,c3,c4) values(20,'[2,3,2]','[0.022470,0.178305,0.813060,0.463923,0.276312,0.330019,0.043964,0.830623,0.266355,0.886212]');
insert into vec_t1(c1,c3,c4) values(21,'[2,3,2]','[0.612456,0.419102,0.939437,0.701895,0.475109,0.334464,0.876076,0.120166,0.537638,0.117534]');
insert into vec_t1(c1,c3,c4) values(22,'[2,3,2]','[0.637985,0.435922,0.507803,0.173239,0.731558,0.475490,0.137246,0.659436,0.887185,0.237127]');
insert into vec_t1(c1,c3,c4) values(23,'[2,3,2]','[0.261976,0.930429,0.471947,0.405530,0.324696,0.734540,0.014641,0.351016,0.500687,0.521748]');
insert into vec_t1(c1,c3,c4) values(24,'[2,3,2]','[0.019532,0.482579,0.978059,0.180159,0.529910,0.638184,0.080544,0.862590,0.296779,0.514347]');
insert into vec_t1(c1,c3,c4) values(25,'[2,3,2]','[0.620133,0.953822,0.820692,0.200903,0.382887,0.589525,0.848620,0.660047,0.848600,0.643394]');
insert into vec_t1(c1,c3,c4) values(26,'[2,3,2]','[0.456015,0.692266,0.896331,0.782146,0.070535,0.338547,0.635440,0.135370,0.200973,0.648648]');
insert into vec_t1(c1,c3,c4) values(27,'[2,3,2]','[0.661974,0.050978,0.300594,0.309149,0.589825,0.455377,0.160762,0.713093,0.326418,0.624236]');
insert into vec_t1(c1,c3,c4) values(28,'[2,3,2]','[0.269763,0.342426,0.800285,0.910017,0.817684,0.551279,0.411955,0.685510,0.706911,0.667069]');
insert into vec_t1(c1,c3,c4) values(29,'[2,3,2]','[0.141073,0.986008,0.033824,0.416001,0.251765,0.227110,0.177887,0.734944,0.606629,0.235345]');
create table normal(c1 int, c3 vector(3), c4 vector(10), primary key(c1));
CREATE VIEW vec_view as select * from vec_t1;
INSERT INTO normal select * from vec_t1 where c1 % 2 = 0;
update vec_t1 set c4 = '[0.022470,0.178305,0.813060,0.463923,0.276312,0.330019,0.043964,0.830623,0.266355,0.886212]' where c1 = 2;
insert into vec_t1 values (3, '[2,3,4]', '[0.279319,0.570040,0.217214,0.826609,0.337557,0.718166,0.431902,0.670941,0.330390,0.138255]') ON DUPLICATE KEY UPDATE c3 = '[1,2,3]';
select * from vec_t1 where c1 = 3;
c1	c3	c4
3	[1,2,3]	[0.904051,0.864011,0.29271,0.748016,0.307713,0.820417,0.735923,0.839659,0.742446,0.146719]
replace into vec_t1 (c1, c3, c4) values (21, '[1,2,3]', '[0.022470,0.178305,0.813060,0.463923,0.276312,0.330019,0.043964,0.830623,0.266355,0.886212]');
select * from vec_t1 where c1 = 21;
c1	c3	c4
21	[1,2,3]	[0.02247,0.178305,0.81306,0.463923,0.276312,0.330019,0.043964,0.830623,0.266355,0.886212]
insert into vec_view values (30, '[1,2,3]', '[0.234391,0.660406,0.370087,0.860388,0.586119,0.668096,0.122285,0.670929,0.997141,0.177069]');
insert ignore into vec_view values (30, '[1,2,3]', '[0.234391,0.660406,0.370087,0.860388,0.586119,0.668096,0.122285,0.670929,0.997141,0.177069]');
select count(*) from vec_view;
count(*)
31
update vec_t1 join normal on vec_t1.c1 = normal.c1 set vec_t1.c4 = '[0.261976,0.930429,0.471947,0.405530,0.324696,0.734540,0.014641,0.351016,0.500687,0.521748]', normal.c4 = '[0.269763,0.342426,0.800285,0.910017,0.817684,0.551279,0.411955,0.685510,0.706911,0.667069]';
select * from vec_view;
c1	c3	c4
0	[1,3,2]	[0.261976,0.930429,0.471947,0.40553,0.324696,0.73454,0.014641,0.351016,0.500687,0.521748]
1	[1,3,2]	[0.692623,0.816816,0.418483,0.393929,0.061058,0.402308,0.564665,0.406696,0.628286,0.250843]
2	[1,3,2]	[0.261976,0.930429,0.471947,0.40553,0.324696,0.73454,0.014641,0.351016,0.500687,0.521748]
3	[1,2,3]	[0.904051,0.864011,0.29271,0.748016,0.307713,0.820417,0.735923,0.839659,0.742446,0.146719]
4	[1,3,2]	[0.261976,0.930429,0.471947,0.40553,0.324696,0.73454,0.014641,0.351016,0.500687,0.521748]
5	[1,3,2]	[0.958113,0.424453,0.091372,0.72694,0.173619,0.023668,0.220956,0.260019,0.402649,0.175887]
6	[1,3,2]	[0.261976,0.930429,0.471947,0.40553,0.324696,0.73454,0.014641,0.351016,0.500687,0.521748]
7	[1,3,2]	[0.279319,0.57004,0.217214,0.826609,0.337557,0.718166,0.431902,0.670941,0.33039,0.138255]
8	[1,3,2]	[0.261976,0.930429,0.471947,0.40553,0.324696,0.73454,0.014641,0.351016,0.500687,0.521748]
9	[1,3,2]	[0.531002,0.850454,0.513266,0.83359,0.771357,0.659888,0.980127,0.607635,0.315216,0.932509]
10	[9,9,4]	[0.261976,0.930429,0.471947,0.40553,0.324696,0.73454,0.014641,0.351016,0.500687,0.521748]
11	[9,9,4]	[0.612456,0.419102,0.939437,0.701895,0.475109,0.334464,0.876076,0.120166,0.537638,0.117534]
12	[9,9,4]	[0.261976,0.930429,0.471947,0.40553,0.324696,0.73454,0.014641,0.351016,0.500687,0.521748]
13	[9,9,4]	[0.261976,0.930429,0.471947,0.40553,0.324696,0.73454,0.014641,0.351016,0.500687,0.521748]
14	[9,9,4]	[0.261976,0.930429,0.471947,0.40553,0.324696,0.73454,0.014641,0.351016,0.500687,0.521748]
15	[9,9,4]	[0.620133,0.953822,0.820692,0.200903,0.382887,0.589525,0.84862,0.660047,0.8486,0.643394]
16	[9,9,4]	[0.261976,0.930429,0.471947,0.40553,0.324696,0.73454,0.014641,0.351016,0.500687,0.521748]
17	[9,9,4]	[0.661974,0.050978,0.300594,0.309149,0.589825,0.455377,0.160762,0.713093,0.326418,0.624236]
18	[9,9,4]	[0.261976,0.930429,0.471947,0.40553,0.324696,0.73454,0.014641,0.351016,0.500687,0.521748]
19	[9,9,4]	[0.141073,0.986008,0.033824,0.416001,0.251765,0.22711,0.177887,0.734944,0.606629,0.235345]
20	[2,3,2]	[0.261976,0.930429,0.471947,0.40553,0.324696,0.73454,0.014641,0.351016,0.500687,0.521748]
21	[1,2,3]	[0.02247,0.178305,0.81306,0.463923,0.276312,0.330019,0.043964,0.830623,0.266355,0.886212]
22	[2,3,2]	[0.261976,0.930429,0.471947,0.40553,0.324696,0.73454,0.014641,0.351016,0.500687,0.521748]
23	[2,3,2]	[0.261976,0.930429,0.471947,0.40553,0.324696,0.73454,0.014641,0.351016,0.500687,0.521748]
24	[2,3,2]	[0.261976,0.930429,0.471947,0.40553,0.324696,0.73454,0.014641,0.351016,0.500687,0.521748]
25	[2,3,2]	[0.620133,0.953822,0.820692,0.200903,0.382887,0.589525,0.84862,0.660047,0.8486,0.643394]
26	[2,3,2]	[0.261976,0.930429,0.471947,0.40553,0.324696,0.73454,0.014641,0.351016,0.500687,0.521748]
27	[2,3,2]	[0.661974,0.050978,0.300594,0.309149,0.589825,0.455377,0.160762,0.713093,0.326418,0.624236]
28	[2,3,2]	[0.261976,0.930429,0.471947,0.40553,0.324696,0.73454,0.014641,0.351016,0.500687,0.521748]
29	[2,3,2]	[0.141073,0.986008,0.033824,0.416001,0.251765,0.22711,0.177887,0.734944,0.606629,0.235345]
30	[1,2,3]	[0.234391,0.660406,0.370087,0.860388,0.586119,0.668096,0.122285,0.670929,0.997141,0.177069]
select * from normal;
c1	c3	c4
0	[1,3,2]	[0.269763,0.342426,0.800285,0.910017,0.817684,0.551279,0.411955,0.68551,0.706911,0.667069]
2	[1,3,2]	[0.269763,0.342426,0.800285,0.910017,0.817684,0.551279,0.411955,0.68551,0.706911,0.667069]
4	[1,3,2]	[0.269763,0.342426,0.800285,0.910017,0.817684,0.551279,0.411955,0.68551,0.706911,0.667069]
6	[1,3,2]	[0.269763,0.342426,0.800285,0.910017,0.817684,0.551279,0.411955,0.68551,0.706911,0.667069]
8	[1,3,2]	[0.269763,0.342426,0.800285,0.910017,0.817684,0.551279,0.411955,0.68551,0.706911,0.667069]
10	[9,9,4]	[0.269763,0.342426,0.800285,0.910017,0.817684,0.551279,0.411955,0.68551,0.706911,0.667069]
12	[9,9,4]	[0.269763,0.342426,0.800285,0.910017,0.817684,0.551279,0.411955,0.68551,0.706911,0.667069]
14	[9,9,4]	[0.269763,0.342426,0.800285,0.910017,0.817684,0.551279,0.411955,0.68551,0.706911,0.667069]
16	[9,9,4]	[0.269763,0.342426,0.800285,0.910017,0.817684,0.551279,0.411955,0.68551,0.706911,0.667069]
18	[9,9,4]	[0.269763,0.342426,0.800285,0.910017,0.817684,0.551279,0.411955,0.68551,0.706911,0.667069]
20	[2,3,2]	[0.269763,0.342426,0.800285,0.910017,0.817684,0.551279,0.411955,0.68551,0.706911,0.667069]
22	[2,3,2]	[0.269763,0.342426,0.800285,0.910017,0.817684,0.551279,0.411955,0.68551,0.706911,0.667069]
24	[2,3,2]	[0.269763,0.342426,0.800285,0.910017,0.817684,0.551279,0.411955,0.68551,0.706911,0.667069]
26	[2,3,2]	[0.269763,0.342426,0.800285,0.910017,0.817684,0.551279,0.411955,0.68551,0.706911,0.667069]
28	[2,3,2]	[0.269763,0.342426,0.800285,0.910017,0.817684,0.551279,0.411955,0.68551,0.706911,0.667069]
update vec_t1 join normal on vec_t1.c1 = normal.c1 set vec_t1.c3 = '[7,8,9]';
update vec_t1 join normal on vec_t1.c1 = normal.c1 set normal.c3 = vec_t1.c3;
select * from normal;
c1	c3	c4
0	[7,8,9]	[0.269763,0.342426,0.800285,0.910017,0.817684,0.551279,0.411955,0.68551,0.706911,0.667069]
2	[7,8,9]	[0.269763,0.342426,0.800285,0.910017,0.817684,0.551279,0.411955,0.68551,0.706911,0.667069]
4	[7,8,9]	[0.269763,0.342426,0.800285,0.910017,0.817684,0.551279,0.411955,0.68551,0.706911,0.667069]
6	[7,8,9]	[0.269763,0.342426,0.800285,0.910017,0.817684,0.551279,0.411955,0.68551,0.706911,0.667069]
8	[7,8,9]	[0.269763,0.342426,0.800285,0.910017,0.817684,0.551279,0.411955,0.68551,0.706911,0.667069]
10	[7,8,9]	[0.269763,0.342426,0.800285,0.910017,0.817684,0.551279,0.411955,0.68551,0.706911,0.667069]
12	[7,8,9]	[0.269763,0.342426,0.800285,0.910017,0.817684,0.551279,0.411955,0.68551,0.706911,0.667069]
14	[7,8,9]	[0.269763,0.342426,0.800285,0.910017,0.817684,0.551279,0.411955,0.68551,0.706911,0.667069]
16	[7,8,9]	[0.269763,0.342426,0.800285,0.910017,0.817684,0.551279,0.411955,0.68551,0.706911,0.667069]
18	[7,8,9]	[0.269763,0.342426,0.800285,0.910017,0.817684,0.551279,0.411955,0.68551,0.706911,0.667069]
20	[7,8,9]	[0.269763,0.342426,0.800285,0.910017,0.817684,0.551279,0.411955,0.68551,0.706911,0.667069]
22	[7,8,9]	[0.269763,0.342426,0.800285,0.910017,0.817684,0.551279,0.411955,0.68551,0.706911,0.667069]
24	[7,8,9]	[0.269763,0.342426,0.800285,0.910017,0.817684,0.551279,0.411955,0.68551,0.706911,0.667069]
26	[7,8,9]	[0.269763,0.342426,0.800285,0.910017,0.817684,0.551279,0.411955,0.68551,0.706911,0.667069]
28	[7,8,9]	[0.269763,0.342426,0.800285,0.910017,0.817684,0.551279,0.411955,0.68551,0.706911,0.667069]
select * from vec_t1;
c1	c3	c4
0	[7,8,9]	[0.261976,0.930429,0.471947,0.40553,0.324696,0.73454,0.014641,0.351016,0.500687,0.521748]
1	[1,3,2]	[0.692623,0.816816,0.418483,0.393929,0.061058,0.402308,0.564665,0.406696,0.628286,0.250843]
2	[7,8,9]	[0.261976,0.930429,0.471947,0.40553,0.324696,0.73454,0.014641,0.351016,0.500687,0.521748]
3	[1,2,3]	[0.904051,0.864011,0.29271,0.748016,0.307713,0.820417,0.735923,0.839659,0.742446,0.146719]
4	[7,8,9]	[0.261976,0.930429,0.471947,0.40553,0.324696,0.73454,0.014641,0.351016,0.500687,0.521748]
5	[1,3,2]	[0.958113,0.424453,0.091372,0.72694,0.173619,0.023668,0.220956,0.260019,0.402649,0.175887]
6	[7,8,9]	[0.261976,0.930429,0.471947,0.40553,0.324696,0.73454,0.014641,0.351016,0.500687,0.521748]
7	[1,3,2]	[0.279319,0.57004,0.217214,0.826609,0.337557,0.718166,0.431902,0.670941,0.33039,0.138255]
8	[7,8,9]	[0.261976,0.930429,0.471947,0.40553,0.324696,0.73454,0.014641,0.351016,0.500687,0.521748]
9	[1,3,2]	[0.531002,0.850454,0.513266,0.83359,0.771357,0.659888,0.980127,0.607635,0.315216,0.932509]
10	[7,8,9]	[0.261976,0.930429,0.471947,0.40553,0.324696,0.73454,0.014641,0.351016,0.500687,0.521748]
11	[9,9,4]	[0.612456,0.419102,0.939437,0.701895,0.475109,0.334464,0.876076,0.120166,0.537638,0.117534]
12	[7,8,9]	[0.261976,0.930429,0.471947,0.40553,0.324696,0.73454,0.014641,0.351016,0.500687,0.521748]
13	[9,9,4]	[0.261976,0.930429,0.471947,0.40553,0.324696,0.73454,0.014641,0.351016,0.500687,0.521748]
14	[7,8,9]	[0.261976,0.930429,0.471947,0.40553,0.324696,0.73454,0.014641,0.351016,0.500687,0.521748]
15	[9,9,4]	[0.620133,0.953822,0.820692,0.200903,0.382887,0.589525,0.84862,0.660047,0.8486,0.643394]
16	[7,8,9]	[0.261976,0.930429,0.471947,0.40553,0.324696,0.73454,0.014641,0.351016,0.500687,0.521748]
17	[9,9,4]	[0.661974,0.050978,0.300594,0.309149,0.589825,0.455377,0.160762,0.713093,0.326418,0.624236]
18	[7,8,9]	[0.261976,0.930429,0.471947,0.40553,0.324696,0.73454,0.014641,0.351016,0.500687,0.521748]
19	[9,9,4]	[0.141073,0.986008,0.033824,0.416001,0.251765,0.22711,0.177887,0.734944,0.606629,0.235345]
20	[7,8,9]	[0.261976,0.930429,0.471947,0.40553,0.324696,0.73454,0.014641,0.351016,0.500687,0.521748]
21	[1,2,3]	[0.02247,0.178305,0.81306,0.463923,0.276312,0.330019,0.043964,0.830623,0.266355,0.886212]
22	[7,8,9]	[0.261976,0.930429,0.471947,0.40553,0.324696,0.73454,0.014641,0.351016,0.500687,0.521748]
23	[2,3,2]	[0.261976,0.930429,0.471947,0.40553,0.324696,0.73454,0.014641,0.351016,0.500687,0.521748]
24	[7,8,9]	[0.261976,0.930429,0.471947,0.40553,0.324696,0.73454,0.014641,0.351016,0.500687,0.521748]
25	[2,3,2]	[0.620133,0.953822,0.820692,0.200903,0.382887,0.589525,0.84862,0.660047,0.8486,0.643394]
26	[7,8,9]	[0.261976,0.930429,0.471947,0.40553,0.324696,0.73454,0.014641,0.351016,0.500687,0.521748]
27	[2,3,2]	[0.661974,0.050978,0.300594,0.309149,0.589825,0.455377,0.160762,0.713093,0.326418,0.624236]
28	[7,8,9]	[0.261976,0.930429,0.471947,0.40553,0.324696,0.73454,0.014641,0.351016,0.500687,0.521748]
29	[2,3,2]	[0.141073,0.986008,0.033824,0.416001,0.251765,0.22711,0.177887,0.734944,0.606629,0.235345]
30	[1,2,3]	[0.234391,0.660406,0.370087,0.860388,0.586119,0.668096,0.122285,0.670929,0.997141,0.177069]
update vec_view join normal on vec_view.c1 = normal.c1 set vec_view.c4 = '[0.261976,0.930429,0.471947,0.405530,0.324696,0.734540,0.014641,0.351016,0.500687,0.521748]', normal.c4 = '[0.269763,0.342426,0.800285,0.910017,0.817684,0.551279,0.411955,0.685510,0.706911,0.667069]';
update vec_view set c4 = '[0.269763,0.342426,0.800285,0.910017,0.817684,0.551279,0.411955,0.685510,0.706911,0.667069]';
select * from vec_t1;
c1	c3	c4
0	[7,8,9]	[0.269763,0.342426,0.800285,0.910017,0.817684,0.551279,0.411955,0.68551,0.706911,0.667069]
1	[1,3,2]	[0.269763,0.342426,0.800285,0.910017,0.817684,0.551279,0.411955,0.68551,0.706911,0.667069]
2	[7,8,9]	[0.269763,0.342426,0.800285,0.910017,0.817684,0.551279,0.411955,0.68551,0.706911,0.667069]
3	[1,2,3]	[0.269763,0.342426,0.800285,0.910017,0.817684,0.551279,0.411955,0.68551,0.706911,0.667069]
4	[7,8,9]	[0.269763,0.342426,0.800285,0.910017,0.817684,0.551279,0.411955,0.68551,0.706911,0.667069]
5	[1,3,2]	[0.269763,0.342426,0.800285,0.910017,0.817684,0.551279,0.411955,0.68551,0.706911,0.667069]
6	[7,8,9]	[0.269763,0.342426,0.800285,0.910017,0.817684,0.551279,0.411955,0.68551,0.706911,0.667069]
7	[1,3,2]	[0.269763,0.342426,0.800285,0.910017,0.817684,0.551279,0.411955,0.68551,0.706911,0.667069]
8	[7,8,9]	[0.269763,0.342426,0.800285,0.910017,0.817684,0.551279,0.411955,0.68551,0.706911,0.667069]
9	[1,3,2]	[0.269763,0.342426,0.800285,0.910017,0.817684,0.551279,0.411955,0.68551,0.706911,0.667069]
10	[7,8,9]	[0.269763,0.342426,0.800285,0.910017,0.817684,0.551279,0.411955,0.68551,0.706911,0.667069]
11	[9,9,4]	[0.269763,0.342426,0.800285,0.910017,0.817684,0.551279,0.411955,0.68551,0.706911,0.667069]
12	[7,8,9]	[0.269763,0.342426,0.800285,0.910017,0.817684,0.551279,0.411955,0.68551,0.706911,0.667069]
13	[9,9,4]	[0.269763,0.342426,0.800285,0.910017,0.817684,0.551279,0.411955,0.68551,0.706911,0.667069]
14	[7,8,9]	[0.269763,0.342426,0.800285,0.910017,0.817684,0.551279,0.411955,0.68551,0.706911,0.667069]
15	[9,9,4]	[0.269763,0.342426,0.800285,0.910017,0.817684,0.551279,0.411955,0.68551,0.706911,0.667069]
16	[7,8,9]	[0.269763,0.342426,0.800285,0.910017,0.817684,0.551279,0.411955,0.68551,0.706911,0.667069]
17	[9,9,4]	[0.269763,0.342426,0.800285,0.910017,0.817684,0.551279,0.411955,0.68551,0.706911,0.667069]
18	[7,8,9]	[0.269763,0.342426,0.800285,0.910017,0.817684,0.551279,0.411955,0.68551,0.706911,0.667069]
19	[9,9,4]	[0.269763,0.342426,0.800285,0.910017,0.817684,0.551279,0.411955,0.68551,0.706911,0.667069]
20	[7,8,9]	[0.269763,0.342426,0.800285,0.910017,0.817684,0.551279,0.411955,0.68551,0.706911,0.667069]
21	[1,2,3]	[0.269763,0.342426,0.800285,0.910017,0.817684,0.551279,0.411955,0.68551,0.706911,0.667069]
22	[7,8,9]	[0.269763,0.342426,0.800285,0.910017,0.817684,0.551279,0.411955,0.68551,0.706911,0.667069]
23	[2,3,2]	[0.269763,0.342426,0.800285,0.910017,0.817684,0.551279,0.411955,0.68551,0.706911,0.667069]
24	[7,8,9]	[0.269763,0.342426,0.800285,0.910017,0.817684,0.551279,0.411955,0.68551,0.706911,0.667069]
25	[2,3,2]	[0.269763,0.342426,0.800285,0.910017,0.817684,0.551279,0.411955,0.68551,0.706911,0.667069]
26	[7,8,9]	[0.269763,0.342426,0.800285,0.910017,0.817684,0.551279,0.411955,0.68551,0.706911,0.667069]
27	[2,3,2]	[0.269763,0.342426,0.800285,0.910017,0.817684,0.551279,0.411955,0.68551,0.706911,0.667069]
28	[7,8,9]	[0.269763,0.342426,0.800285,0.910017,0.817684,0.551279,0.411955,0.68551,0.706911,0.667069]
29	[2,3,2]	[0.269763,0.342426,0.800285,0.910017,0.817684,0.551279,0.411955,0.68551,0.706911,0.667069]
30	[1,2,3]	[0.269763,0.342426,0.800285,0.910017,0.817684,0.551279,0.411955,0.68551,0.706911,0.667069]
select * from vec_view;
c1	c3	c4
0	[7,8,9]	[0.269763,0.342426,0.800285,0.910017,0.817684,0.551279,0.411955,0.68551,0.706911,0.667069]
1	[1,3,2]	[0.269763,0.342426,0.800285,0.910017,0.817684,0.551279,0.411955,0.68551,0.706911,0.667069]
2	[7,8,9]	[0.269763,0.342426,0.800285,0.910017,0.817684,0.551279,0.411955,0.68551,0.706911,0.667069]
3	[1,2,3]	[0.269763,0.342426,0.800285,0.910017,0.817684,0.551279,0.411955,0.68551,0.706911,0.667069]
4	[7,8,9]	[0.269763,0.342426,0.800285,0.910017,0.817684,0.551279,0.411955,0.68551,0.706911,0.667069]
5	[1,3,2]	[0.269763,0.342426,0.800285,0.910017,0.817684,0.551279,0.411955,0.68551,0.706911,0.667069]
6	[7,8,9]	[0.269763,0.342426,0.800285,0.910017,0.817684,0.551279,0.411955,0.68551,0.706911,0.667069]
7	[1,3,2]	[0.269763,0.342426,0.800285,0.910017,0.817684,0.551279,0.411955,0.68551,0.706911,0.667069]
8	[7,8,9]	[0.269763,0.342426,0.800285,0.910017,0.817684,0.551279,0.411955,0.68551,0.706911,0.667069]
9	[1,3,2]	[0.269763,0.342426,0.800285,0.910017,0.817684,0.551279,0.411955,0.68551,0.706911,0.667069]
10	[7,8,9]	[0.269763,0.342426,0.800285,0.910017,0.817684,0.551279,0.411955,0.68551,0.706911,0.667069]
11	[9,9,4]	[0.269763,0.342426,0.800285,0.910017,0.817684,0.551279,0.411955,0.68551,0.706911,0.667069]
12	[7,8,9]	[0.269763,0.342426,0.800285,0.910017,0.817684,0.551279,0.411955,0.68551,0.706911,0.667069]
13	[9,9,4]	[0.269763,0.342426,0.800285,0.910017,0.817684,0.551279,0.411955,0.68551,0.706911,0.667069]
14	[7,8,9]	[0.269763,0.342426,0.800285,0.910017,0.817684,0.551279,0.411955,0.68551,0.706911,0.667069]
15	[9,9,4]	[0.269763,0.342426,0.800285,0.910017,0.817684,0.551279,0.411955,0.68551,0.706911,0.667069]
16	[7,8,9]	[0.269763,0.342426,0.800285,0.910017,0.817684,0.551279,0.411955,0.68551,0.706911,0.667069]
17	[9,9,4]	[0.269763,0.342426,0.800285,0.910017,0.817684,0.551279,0.411955,0.68551,0.706911,0.667069]
18	[7,8,9]	[0.269763,0.342426,0.800285,0.910017,0.817684,0.551279,0.411955,0.68551,0.706911,0.667069]
19	[9,9,4]	[0.269763,0.342426,0.800285,0.910017,0.817684,0.551279,0.411955,0.68551,0.706911,0.667069]
20	[7,8,9]	[0.269763,0.342426,0.800285,0.910017,0.817684,0.551279,0.411955,0.68551,0.706911,0.667069]
21	[1,2,3]	[0.269763,0.342426,0.800285,0.910017,0.817684,0.551279,0.411955,0.68551,0.706911,0.667069]
22	[7,8,9]	[0.269763,0.342426,0.800285,0.910017,0.817684,0.551279,0.411955,0.68551,0.706911,0.667069]
23	[2,3,2]	[0.269763,0.342426,0.800285,0.910017,0.817684,0.551279,0.411955,0.68551,0.706911,0.667069]
24	[7,8,9]	[0.269763,0.342426,0.800285,0.910017,0.817684,0.551279,0.411955,0.68551,0.706911,0.667069]
25	[2,3,2]	[0.269763,0.342426,0.800285,0.910017,0.817684,0.551279,0.411955,0.68551,0.706911,0.667069]
26	[7,8,9]	[0.269763,0.342426,0.800285,0.910017,0.817684,0.551279,0.411955,0.68551,0.706911,0.667069]
27	[2,3,2]	[0.269763,0.342426,0.800285,0.910017,0.817684,0.551279,0.411955,0.68551,0.706911,0.667069]
28	[7,8,9]	[0.269763,0.342426,0.800285,0.910017,0.817684,0.551279,0.411955,0.68551,0.706911,0.667069]
29	[2,3,2]	[0.269763,0.342426,0.800285,0.910017,0.817684,0.551279,0.411955,0.68551,0.706911,0.667069]
30	[1,2,3]	[0.269763,0.342426,0.800285,0.910017,0.817684,0.551279,0.411955,0.68551,0.706911,0.667069]
delete vec_t1, normal from vec_t1 join normal on vec_t1.c1 = normal.c1;
delete vec_t1 from vec_t1 join normal on vec_t1.c1 = normal.c1;
delete vec_t1 from vec_t1 join normal on vec_t1.c1 = normal.c1;
delete normal from vec_view join normal on vec_view.c1 = normal.c1 and 1=0;
delete from vec_view where c3 = '[7,8,9]';
select * from vec_t1;
c1	c3	c4
1	[1,3,2]	[0.269763,0.342426,0.800285,0.910017,0.817684,0.551279,0.411955,0.68551,0.706911,0.667069]
3	[1,2,3]	[0.269763,0.342426,0.800285,0.910017,0.817684,0.551279,0.411955,0.68551,0.706911,0.667069]
5	[1,3,2]	[0.269763,0.342426,0.800285,0.910017,0.817684,0.551279,0.411955,0.68551,0.706911,0.667069]
7	[1,3,2]	[0.269763,0.342426,0.800285,0.910017,0.817684,0.551279,0.411955,0.68551,0.706911,0.667069]
9	[1,3,2]	[0.269763,0.342426,0.800285,0.910017,0.817684,0.551279,0.411955,0.68551,0.706911,0.667069]
11	[9,9,4]	[0.269763,0.342426,0.800285,0.910017,0.817684,0.551279,0.411955,0.68551,0.706911,0.667069]
13	[9,9,4]	[0.269763,0.342426,0.800285,0.910017,0.817684,0.551279,0.411955,0.68551,0.706911,0.667069]
15	[9,9,4]	[0.269763,0.342426,0.800285,0.910017,0.817684,0.551279,0.411955,0.68551,0.706911,0.667069]
17	[9,9,4]	[0.269763,0.342426,0.800285,0.910017,0.817684,0.551279,0.411955,0.68551,0.706911,0.667069]
19	[9,9,4]	[0.269763,0.342426,0.800285,0.910017,0.817684,0.551279,0.411955,0.68551,0.706911,0.667069]
21	[1,2,3]	[0.269763,0.342426,0.800285,0.910017,0.817684,0.551279,0.411955,0.68551,0.706911,0.667069]
23	[2,3,2]	[0.269763,0.342426,0.800285,0.910017,0.817684,0.551279,0.411955,0.68551,0.706911,0.667069]
25	[2,3,2]	[0.269763,0.342426,0.800285,0.910017,0.817684,0.551279,0.411955,0.68551,0.706911,0.667069]
27	[2,3,2]	[0.269763,0.342426,0.800285,0.910017,0.817684,0.551279,0.411955,0.68551,0.706911,0.667069]
29	[2,3,2]	[0.269763,0.342426,0.800285,0.910017,0.817684,0.551279,0.411955,0.68551,0.706911,0.667069]
30	[1,2,3]	[0.269763,0.342426,0.800285,0.910017,0.817684,0.551279,0.411955,0.68551,0.706911,0.667069]
select * from vec_view;
c1	c3	c4
1	[1,3,2]	[0.269763,0.342426,0.800285,0.910017,0.817684,0.551279,0.411955,0.68551,0.706911,0.667069]
3	[1,2,3]	[0.269763,0.342426,0.800285,0.910017,0.817684,0.551279,0.411955,0.68551,0.706911,0.667069]
5	[1,3,2]	[0.269763,0.342426,0.800285,0.910017,0.817684,0.551279,0.411955,0.68551,0.706911,0.667069]
7	[1,3,2]	[0.269763,0.342426,0.800285,0.910017,0.817684,0.551279,0.411955,0.68551,0.706911,0.667069]
9	[1,3,2]	[0.269763,0.342426,0.800285,0.910017,0.817684,0.551279,0.411955,0.68551,0.706911,0.667069]
11	[9,9,4]	[0.269763,0.342426,0.800285,0.910017,0.817684,0.551279,0.411955,0.68551,0.706911,0.667069]
13	[9,9,4]	[0.269763,0.342426,0.800285,0.910017,0.817684,0.551279,0.411955,0.68551,0.706911,0.667069]
15	[9,9,4]	[0.269763,0.342426,0.800285,0.910017,0.817684,0.551279,0.411955,0.68551,0.706911,0.667069]
17	[9,9,4]	[0.269763,0.342426,0.800285,0.910017,0.817684,0.551279,0.411955,0.68551,0.706911,0.667069]
19	[9,9,4]	[0.269763,0.342426,0.800285,0.910017,0.817684,0.551279,0.411955,0.68551,0.706911,0.667069]
21	[1,2,3]	[0.269763,0.342426,0.800285,0.910017,0.817684,0.551279,0.411955,0.68551,0.706911,0.667069]
23	[2,3,2]	[0.269763,0.342426,0.800285,0.910017,0.817684,0.551279,0.411955,0.68551,0.706911,0.667069]
25	[2,3,2]	[0.269763,0.342426,0.800285,0.910017,0.817684,0.551279,0.411955,0.68551,0.706911,0.667069]
27	[2,3,2]	[0.269763,0.342426,0.800285,0.910017,0.817684,0.551279,0.411955,0.68551,0.706911,0.667069]
29	[2,3,2]	[0.269763,0.342426,0.800285,0.910017,0.817684,0.551279,0.411955,0.68551,0.706911,0.667069]
30	[1,2,3]	[0.269763,0.342426,0.800285,0.910017,0.817684,0.551279,0.411955,0.68551,0.706911,0.667069]
set ob_enable_index_direct_select = 0;
drop table vec_t1;
drop table normal;
drop view vec_view;
drop table if exists vec;
create table vec(c1 int, c2 vector(10), primary key(c1), vector index idx1(c2) with (distance=l2, type=ivf_pq, m=5)) LOB_INROW_THRESHOLD = 0;
ERROR 0A000: create ivf index on column with outrow lob data is not supported
drop table if exists vec_t1;
drop view if exists vec_v1;
CREATE TABLE vec_t1 (c1 int primary key, c2 vector(3),c3 vector(3) ,c4 vector(10),
VECTOR INDEX vector_idx1(c3) 
WITH (distance=l2, lib=vsag, type=hnsw, m=10, ef_construction=12, ef_search=40),
VECTOR INDEX vector_idx2(c4)
WITH (distance=l2, type=ivf_pq,m=5));
create view vec_v1 as select * from vec_t1;
replace into vec_v1 values(1,'[1,1,2]','[2,2,3]','[0.692623,0.816816,0.418483,0.393929,0.061058,0.402308,0.564665,0.406696,0.628286,0.250843]');
replace into vec_v1 values(1,'[1,1,2]','[2,2,3]','[0.692623,0.816816,0.418483,0.393929,0.061058,0.402308,0.564665,0.406696,0.628286,0.250843]');
select * from vec_v1;
c1	c2	c3	c4
1	[1,1,2]	[2,2,3]	[0.692623,0.816816,0.418483,0.393929,0.061058,0.402308,0.564665,0.406696,0.628286,0.250843]
select * from vec_t1;
c1	c2	c3	c4
1	[1,1,2]	[2,2,3]	[0.692623,0.816816,0.418483,0.393929,0.061058,0.402308,0.564665,0.406696,0.628286,0.250843]
drop view vec_v1;
drop table vec_t1;
drop table if exists vec_t1;
drop view if exists vec_v1;
CREATE TABLE vec_t1 (c1 int primary key, c2 VARCHAR(30),c3 vector(3) ,c4 vector(10),
VECTOR INDEX vector_idx1(c3) 
WITH (distance=l2, lib=vsag, type=hnsw, m=10, ef_construction=12, ef_search=40),
VECTOR INDEX vector_idx2(c4)
WITH (distance=l2, type=ivf_pq, m=5)) partition by list columns (c1)(
PARTITION p0 VALUES in(10),
PARTITION p1 VALUES in(50)
);
create view vec_v1 as select * from vec_t1;
replace into vec_v1 values(1,'[1,1,2]','[2,2,3]','[0.692623,0.816816,0.418483,0.393929,0.061058,0.402308,0.564665,0.406696,0.628286,0.250843]');
ERROR HY000: Table has no partition for value
replace into vec_v1 values(10,'[1,1,2]','[2,2,3]','[0.692623,0.816816,0.418483,0.393929,0.061058,0.402308,0.564665,0.406696,0.628286,0.250843]');
replace into vec_v1 values(10,'[1,1,2]','[2,2,3]','[0.692623,0.816816,0.418483,0.393929,0.061058,0.402308,0.564665,0.406696,0.628286,0.250843]');
select * from vec_v1;
c1	c2	c3	c4
10	[1,1,2]	[2,2,3]	[0.692623,0.816816,0.418483,0.393929,0.061058,0.402308,0.564665,0.406696,0.628286,0.250843]
select * from vec_t1;
c1	c2	c3	c4
10	[1,1,2]	[2,2,3]	[0.692623,0.816816,0.418483,0.393929,0.061058,0.402308,0.564665,0.406696,0.628286,0.250843]
drop view vec_v1;
drop table vec_t1;
drop table if exists tv;
create table tv (c1 int, vec vector(2000), vector index idv(vec) with(distance=l2, type=ivf_pq, m=400)) LOB_INROW_THRESHOLD=8000;
drop table if exists tv;
create table tv (c1 int, vec vector(2000), vector index idv(vec) with(distance=l2, type=ivf_flat)) LOB_INROW_THRESHOLD=8000;
drop table tv;
set ob_default_lob_inrow_threshold=8000;
drop table if exists tv;
create table tv (c1 int, vec vector(2000), vector index idv(vec) with(distance=l2, type=ivf_pq, m=400));
drop table if exists tv;
create table tv (c1 int, vec vector(2000), vector index idv(vec) with(distance=l2, type=ivf_flat));
drop table tv;
create table tv (c1 int, vec vector(2000));
create vector index idx1 on tv (vec) with (distance=l2, type=ivf_pq, m=400);
create vector index idx1 on tv (vec) with (distance=l2, type=ivf_flat);
ERROR 0A000: create vector index on column has vector index is not supported
drop table tv;
alter system set ob_vector_memory_limit_percentage = 0;
