alter system set ob_vector_memory_limit_percentage = 34;
# 单分区先建索引
drop table if exists vec_t1;
CREATE TABLE vec_t1 (c1 int primary key, c2 varchar(30),c3 vector(3) ,c4 vector(3),
VECTOR INDEX idx1(c4)
WITH (distance=l2, type=ivf_sq8));
insert into vec_t1(c1,c2,c3,c4) values(1,'[1,1,2]','[2,2,3]','[1,3,2]');
insert into vec_t1(c1,c2,c3,c4) values(2,'[2,1,2]','[2,2,2]','[2,3,2]');
insert into vec_t1(c1,c2,c3,c4) values(3,'[3,1,2]','[3,2,2]','[3,3,2]');
insert into vec_t1(c1,c2,c3,c4) values(4,'[4,1,2]','[5,2,3]','[4,4,4]');
insert into vec_t1(c1,c2,c3,c4) values(5,'[5,1,2]','[5,2,3]','[5,5,5]');
insert into vec_t1(c1,c2,c3,c4) values(6,'[1,1,2]','[2,2,3]','[6,3,2]');
insert into vec_t1(c1,c2,c3,c4) values(7,'[2,1,2]','[2,2,2]','[4,7,4]');
insert into vec_t1(c1,c2,c3,c4) values(8,'[3,1,2]','[3,2,2]','[8,3,4]');
insert into vec_t1(c1,c2,c3,c4) values(9,'[4,1,2]','[5,2,3]','[9,9,4]');
insert into vec_t1(c1,c2,c3,c4) values(0,'[5,1,2]','[5,2,3]','[10,10,10]');
set ob_enable_index_direct_select = 1;
# 查询索引表
count(*)
0
count(*)
10
count(*)
10
count(*)
0
update vec_t1 set c4 = '[2,2,2]' where c1 = 2;
insert into vec_t1(c1,c2,c3,c4) values(2,'[2,1,2]','[2,2,2]','[2,3,2]') ON DUPLICATE KEY UPDATE c4 = '[9,8,7]';
delete from vec_t1 where c1 = 3;
insert into vec_t1(c1,c2,c3,c4) values(3,'[2,1,2]','[2,2,2]','[2,3,2]') ON DUPLICATE KEY UPDATE c3 = '[1,1,1]';
update vec_t1 set c4 = '[1,2,3]' where c1 = 1;
# 查询索引表
count(*)
0
count(*)
10
count(*)
10
count(*)
0
drop table vec_t1;
# 多分区先建索引
drop table if exists vec_t1;
CREATE TABLE vec_t1 (c1 int primary key, c4 vector(3),
VECTOR INDEX idx1(c4)
WITH (distance=l2, type=ivf_sq8))
PARTITION BY RANGE(c1) (
PARTITION p0 VALUES less than(10),
PARTITION p1 VALUES less than(20),
PARTITION p2 VALUES less than(MAXVALUE)
);
insert into vec_t1(c1,c4) values(1,'[1,3,2]');
insert into vec_t1(c1,c4) values(2,'[2,3,2]');
insert into vec_t1(c1,c4) values(3,'[3,3,2]');
insert into vec_t1(c1,c4) values(4,'[4,4,4]');
insert into vec_t1(c1,c4) values(5,'[5,5,5]');
insert into vec_t1(c1,c4) values(6,'[6,3,2]');
insert into vec_t1(c1,c4) values(7,'[4,7,4]');
insert into vec_t1(c1,c4) values(8,'[8,3,4]');
insert into vec_t1(c1,c4) values(9,'[9,9,4]');
insert into vec_t1(c1,c4) values(0,'[10,10,10]');
insert into vec_t1(c1,c4) values(10,'[1,3,2]');
insert into vec_t1(c1,c4) values(11,'[2,3,2]');
insert into vec_t1(c1,c4) values(12,'[3,3,2]');
insert into vec_t1(c1,c4) values(13,'[4,4,4]');
insert into vec_t1(c1,c4) values(14,'[5,5,5]');
insert into vec_t1(c1,c4) values(15,'[6,3,2]');
insert into vec_t1(c1,c4) values(16,'[4,7,4]');
insert into vec_t1(c1,c4) values(17,'[8,3,4]');
insert into vec_t1(c1,c4) values(18,'[9,9,4]');
insert into vec_t1(c1,c4) values(19,'[10,10,10]');
insert into vec_t1(c1,c4) values(20,'[1,3,2]');
insert into vec_t1(c1,c4) values(21,'[2,3,2]');
insert into vec_t1(c1,c4) values(22,'[3,3,2]');
insert into vec_t1(c1,c4) values(23,'[4,4,4]');
insert into vec_t1(c1,c4) values(24,'[5,5,5]');
insert into vec_t1(c1,c4) values(25,'[6,3,2]');
insert into vec_t1(c1,c4) values(26,'[4,7,4]');
insert into vec_t1(c1,c4) values(27,'[8,3,4]');
insert into vec_t1(c1,c4) values(28,'[9,9,4]');
insert into vec_t1(c1,c4) values(29,'[10,10,10]');
# 查询索引表
count(*)
0
count(*)
30
count(*)
30
update vec_t1 set c4 = '[2,2,2]' where c1 = 2;
insert into vec_t1(c1,c4) values(2,'[2,3,2]') ON DUPLICATE KEY UPDATE c4 = '[9,8,7]';
delete from vec_t1 where c1 = 3;
insert into vec_t1(c1,c4) values(3,'[2,3,2]') ON DUPLICATE KEY UPDATE c4 = '[1,1,1]';
update vec_t1 set c4 = '[1,2,3]' where c1 = 1;
# 查询索引表
count(*)
0
count(*)
30
count(*)
30
drop table vec_t1;
################# complex dml operation ##################
DROP TABLE IF EXISTS vec;
DROP TABLE IF EXISTS normal;
DROP VIEW IF EXISTS vec_view;
create table vec(c1 int, c2 vector(3), primary key(c1), vector index idx1(c2) with (distance=l2, type=ivf_sq8));
create table normal(c1 int, c2 vector(3), primary key(c1));
CREATE VIEW vec_view as select * from vec;
INSERT INTO vec values (1, '[1,2,3]'), (2, '[3,4,5]');
INSERT INTO normal values (1, '[1,2,3]'), (2, '[3,4,5]');
insert into vec values (1, '[1,2,3]') ON DUPLICATE KEY UPDATE c2 = '[1,2,3]';
insert into normal values (1, '[1,2,3]') ON DUPLICATE KEY UPDATE c2 = '[1,2,3]';
replace into vec (c1, c2) values (1, '[1,2,3]');
replace into normal (c1, c2) values (1, '[1,2,3]');
insert into vec_view values (3, '[5,6,7]'), (4, '[7,8,9]');
insert into normal (c1, c2) values (3, '[1,2,3]');
select * from vec_view;
c1	c2
1	[1,2,3]
2	[3,4,5]
3	[5,6,7]
4	[7,8,9]
select * from normal;
c1	c2
1	[1,2,3]
2	[3,4,5]
3	[1,2,3]
ERROR 22000: Invalid data type for the operation
update vec join normal on vec.c1 = normal.c1 set vec.c2 = '[7,8,9]', normal.c2 = '[9,10,11]';
select * from vec_view;
c1	c2
1	[7,8,9]
2	[7,8,9]
3	[7,8,9]
4	[7,8,9]
select * from normal;
c1	c2
1	[9,10,11]
2	[9,10,11]
3	[9,10,11]
ERROR 22000: Invalid data type for the operation
update vec join normal on vec.c1 = normal.c1 set vec.c2 = '[7,8,9]';
update vec join normal on vec.c1 = normal.c1 set normal.c2 = vec.c2;
select * from normal;
c1	c2
1	[7,8,9]
2	[7,8,9]
3	[7,8,9]
select * from vec;
c1	c2
1	[7,8,9]
2	[7,8,9]
3	[7,8,9]
4	[7,8,9]
ERROR 22000: Invalid data type for the operation
update vec_view join normal on vec_view.c1 = normal.c1 set vec_view.c2 = '[7,8,9]', normal.c2 = '[9,10,11]';
update vec_view set c2 = '[7,8,9]';
select * from vec;
c1	c2
1	[7,8,9]
2	[7,8,9]
3	[7,8,9]
4	[7,8,9]
select * from vec_view;
c1	c2
1	[7,8,9]
2	[7,8,9]
3	[7,8,9]
4	[7,8,9]
ERROR 22000: Invalid data type for the operation
delete vec, normal from vec join normal on vec.c1 = normal.c1;
delete vec from vec join normal on vec.c1 = normal.c1;
delete vec from vec join normal on vec.c1 = normal.c1;
delete normal from vec_view join normal on vec_view.c1 = normal.c1 and 1=0;
delete from vec_view where c2 = '[7,8,9]';
drop table vec;
drop table normal;
drop view vec_view;
drop table if exists vec_t1;
CREATE TABLE vec_t1 (c1 int primary key, c2 vector(3),c3 vector(3) ,c4 vector(3),
VECTOR INDEX vector_idx(c2) 
WITH (distance=l2, type=ivf_sq8));
insert into vec_t1 values(1,'[1,1,2]','[2,2,3]','[1,3,2]');
insert into vec_t1 values(2,'[1,0,3]','[1,0,3]','[2,3,2]');
insert into vec_t1 values(3,'[-1,2,2]','[-3,2,3]','[4,3,3]');
insert into vec_t1 values(4,'[-1,-2,-2]','[-4,2,3]',null);
insert into vec_t1 values(5,'[-1,-3,-2]',null,'[2,3,1]');
update vec_t1 set c1 = 10 where c3 is null;
drop table vec_t1;
drop table if exists vec_t1;
create table vec_t1(c1 int, c2 vector(10) not null, primary key(c1));
insert ignore into vec_t1 values(1, null);
ERROR 23000: Column 'c2' cannot be null
drop table vec_t1;
drop table if exists vec_t1;
create table vec_t1(c1 int, c2 vector(3), primary key(c1), vector index idx1(c2) with (distance=L2, type=ivf_sq8));
insert into vec_t1 values(1, [1,1,1]);
select c2,123 from vec_t1 for update;
c2	123
[1,1,1]	123
select /*+ opt_param('rowsets_enabled', 'false') */ c2,123 from vec_t1 for update;
c2	123
[1,1,1]	123
drop table vec_t1;
# 单分区先建混合向量索引
drop table if exists vec_t1;
CREATE TABLE vec_t1 (c1 int primary key, c2 varchar(30),c3 vector(3) ,c4 vector(3),
VECTOR INDEX idx1(c4)
WITH (distance=l2, type=ivf_sq8),
VECTOR INDEX idx2(c3)
WITH (distance=l2, type=hnsw));
insert into vec_t1(c1,c2,c3,c4) values(1,'[1,1,2]','[2,2,3]','[1,3,2]');
insert into vec_t1(c1,c2,c3,c4) values(2,'[2,1,2]','[2,2,2]','[2,3,2]');
insert into vec_t1(c1,c2,c3,c4) values(3,'[3,1,2]','[3,2,2]','[3,3,2]');
insert into vec_t1(c1,c2,c3,c4) values(4,'[4,1,2]','[5,2,3]','[4,4,4]');
insert into vec_t1(c1,c2,c3,c4) values(5,'[5,1,2]','[5,2,3]','[5,5,5]');
insert ignore into vec_t1(c1,c2,c3,c4) values(5,'[5,1,2]','[4,3,2]','[5,5,5]');
update vec_t1 set c4 = '[2,2,2]' where c1 = 2;
insert into vec_t1(c1,c2,c3,c4) values(2,'[2,1,2]','[2,2,2]','[2,3,2]') ON DUPLICATE KEY UPDATE c4 = '[9,8,7]';
delete from vec_t1 where c1 = 3;
insert into vec_t1(c1,c2,c3,c4) values(3,'[2,1,2]','[2,2,2]','[2,3,2]') ON DUPLICATE KEY UPDATE c3 = '[1,1,1]';
update vec_t1 set c4 = '[1,2,3]' where c1 = 1;
drop table vec_t1;
# 多分区先建混合向量索引
drop table if exists vec_t1;
drop table if exists normal;
drop view if exists vec_view;
CREATE TABLE vec_t1 (c1 int primary key, c3 vector(3) ,c4 vector(3),
VECTOR INDEX idx1(c4)
WITH (distance=l2, type=ivf_sq8),
VECTOR INDEX idx2(c3)
WITH (distance=l2, type=hnsw))
PARTITION BY RANGE(c1) (
PARTITION p0 VALUES less than(10),
PARTITION p1 VALUES less than(20),
PARTITION p2 VALUES less than(MAXVALUE)
);
insert into vec_t1(c1,c3,c4) values(1,'[1,3,2]','[1,3,2]');
insert into vec_t1(c1,c3,c4) values(2,'[2,3,2]','[2,3,2]');
insert into vec_t1(c1,c3,c4) values(3,'[3,3,2]','[3,3,2]');
insert into vec_t1(c1,c3,c4) values(4,'[4,4,4]','[4,4,4]');
insert into vec_t1(c1,c3,c4) values(5,'[5,5,5]','[5,5,5]');
insert into vec_t1(c1,c3,c4) values(6,'[6,3,2]','[6,3,2]');
insert into vec_t1(c1,c3,c4) values(7,'[4,7,4]','[4,7,4]');
insert into vec_t1(c1,c3,c4) values(8,'[8,3,4]','[8,3,4]');
insert into vec_t1(c1,c3,c4) values(9,'[9,9,4]','[9,9,4]');
insert into vec_t1(c1,c3,c4) values(0,'[10,10,10]','[10,10,10]');
insert into vec_t1(c1,c3,c4) values(10,'[1,3,2]','[1,3,2]');
insert into vec_t1(c1,c3,c4) values(12,'[2,3,2]','[2,3,2]');
insert into vec_t1(c1,c3,c4) values(13,'[3,3,2]','[3,3,2]');
insert into vec_t1(c1,c3,c4) values(14,'[4,4,4]','[4,4,4]');
insert into vec_t1(c1,c3,c4) values(15,'[5,5,5]','[5,5,5]');
insert into vec_t1(c1,c3,c4) values(16,'[6,3,2]','[6,3,2]');
insert into vec_t1(c1,c3,c4) values(17,'[4,7,4]','[4,7,4]');
insert into vec_t1(c1,c3,c4) values(18,'[8,3,4]','[8,3,4]');
insert into vec_t1(c1,c3,c4) values(19,'[9,9,4]','[9,9,4]');
insert into vec_t1(c1,c3,c4) values(11,'[10,10,10]','[10,10,10]');
insert into vec_t1(c1,c3,c4) values(20,'[1,3,2]','[1,3,2]');
insert into vec_t1(c1,c3,c4) values(22,'[2,3,2]','[2,3,2]');
insert into vec_t1(c1,c3,c4) values(23,'[3,3,2]','[3,3,2]');
insert into vec_t1(c1,c3,c4) values(24,'[4,4,4]','[4,4,4]');
insert into vec_t1(c1,c3,c4) values(25,'[5,5,5]','[5,5,5]');
insert into vec_t1(c1,c3,c4) values(26,'[6,3,2]','[6,3,2]');
insert into vec_t1(c1,c3,c4) values(27,'[4,7,4]','[4,7,4]');
insert into vec_t1(c1,c3,c4) values(28,'[8,3,4]','[8,3,4]');
insert into vec_t1(c1,c3,c4) values(29,'[9,9,4]','[9,9,4]');
insert into vec_t1(c1,c3,c4) values(21,'[10,10,10]','[10,10,10]');
create table normal(c1 int, c3 vector(3), c4 vector(3), primary key(c1));
CREATE VIEW vec_view as select * from vec_t1;
INSERT INTO normal select * from vec_t1 where c1 % 2 = 0;
update vec_t1 set c4 = '[2,2,2]' where c1 = 2;
insert into vec_t1 values (3, '[2,3,4]', '[1,2,3]') ON DUPLICATE KEY UPDATE c3 = '[1,2,3]';
select * from vec_t1 where c1 = 3;
c1	c3	c4
3	[1,2,3]	[3,3,2]
replace into vec_t1 (c1, c3, c4) values (21, '[1,2,3]', '[1,2,3]');
select * from vec_t1 where c1 = 21;
c1	c3	c4
21	[1,2,3]	[1,2,3]
insert into vec_view values (30, '[1,2,3]', '[5,6,7]');
insert ignore into vec_view values (30, '[1,2,3]', '[5,6,7]');
select count(*) from vec_view;
count(*)
31
update vec_t1 join normal on vec_t1.c1 = normal.c1 set vec_t1.c4 = '[7,8,9]', normal.c4 = '[9,10,11]';
select * from vec_view;
c1	c3	c4
0	[10,10,10]	[7,8,9]
1	[1,3,2]	[1,3,2]
2	[2,3,2]	[7,8,9]
3	[1,2,3]	[3,3,2]
4	[4,4,4]	[7,8,9]
5	[5,5,5]	[5,5,5]
6	[6,3,2]	[7,8,9]
7	[4,7,4]	[4,7,4]
8	[8,3,4]	[7,8,9]
9	[9,9,4]	[9,9,4]
10	[1,3,2]	[7,8,9]
11	[10,10,10]	[10,10,10]
12	[2,3,2]	[7,8,9]
13	[3,3,2]	[3,3,2]
14	[4,4,4]	[7,8,9]
15	[5,5,5]	[5,5,5]
16	[6,3,2]	[7,8,9]
17	[4,7,4]	[4,7,4]
18	[8,3,4]	[7,8,9]
19	[9,9,4]	[9,9,4]
20	[1,3,2]	[7,8,9]
21	[1,2,3]	[1,2,3]
22	[2,3,2]	[7,8,9]
23	[3,3,2]	[3,3,2]
24	[4,4,4]	[7,8,9]
25	[5,5,5]	[5,5,5]
26	[6,3,2]	[7,8,9]
27	[4,7,4]	[4,7,4]
28	[8,3,4]	[7,8,9]
29	[9,9,4]	[9,9,4]
30	[1,2,3]	[5,6,7]
select * from normal;
c1	c3	c4
0	[10,10,10]	[9,10,11]
2	[2,3,2]	[9,10,11]
4	[4,4,4]	[9,10,11]
6	[6,3,2]	[9,10,11]
8	[8,3,4]	[9,10,11]
10	[1,3,2]	[9,10,11]
12	[2,3,2]	[9,10,11]
14	[4,4,4]	[9,10,11]
16	[6,3,2]	[9,10,11]
18	[8,3,4]	[9,10,11]
20	[1,3,2]	[9,10,11]
22	[2,3,2]	[9,10,11]
24	[4,4,4]	[9,10,11]
26	[6,3,2]	[9,10,11]
28	[8,3,4]	[9,10,11]
update vec_t1 join normal on vec_t1.c1 = normal.c1 set vec_t1.c3 = '[7,8,9]';
update vec_t1 join normal on vec_t1.c1 = normal.c1 set normal.c3 = vec_t1.c3;
select * from normal;
c1	c3	c4
0	[7,8,9]	[9,10,11]
2	[7,8,9]	[9,10,11]
4	[7,8,9]	[9,10,11]
6	[7,8,9]	[9,10,11]
8	[7,8,9]	[9,10,11]
10	[7,8,9]	[9,10,11]
12	[7,8,9]	[9,10,11]
14	[7,8,9]	[9,10,11]
16	[7,8,9]	[9,10,11]
18	[7,8,9]	[9,10,11]
20	[7,8,9]	[9,10,11]
22	[7,8,9]	[9,10,11]
24	[7,8,9]	[9,10,11]
26	[7,8,9]	[9,10,11]
28	[7,8,9]	[9,10,11]
select * from vec_t1;
c1	c3	c4
0	[7,8,9]	[7,8,9]
1	[1,3,2]	[1,3,2]
2	[7,8,9]	[7,8,9]
3	[1,2,3]	[3,3,2]
4	[7,8,9]	[7,8,9]
5	[5,5,5]	[5,5,5]
6	[7,8,9]	[7,8,9]
7	[4,7,4]	[4,7,4]
8	[7,8,9]	[7,8,9]
9	[9,9,4]	[9,9,4]
10	[7,8,9]	[7,8,9]
11	[10,10,10]	[10,10,10]
12	[7,8,9]	[7,8,9]
13	[3,3,2]	[3,3,2]
14	[7,8,9]	[7,8,9]
15	[5,5,5]	[5,5,5]
16	[7,8,9]	[7,8,9]
17	[4,7,4]	[4,7,4]
18	[7,8,9]	[7,8,9]
19	[9,9,4]	[9,9,4]
20	[7,8,9]	[7,8,9]
21	[1,2,3]	[1,2,3]
22	[7,8,9]	[7,8,9]
23	[3,3,2]	[3,3,2]
24	[7,8,9]	[7,8,9]
25	[5,5,5]	[5,5,5]
26	[7,8,9]	[7,8,9]
27	[4,7,4]	[4,7,4]
28	[7,8,9]	[7,8,9]
29	[9,9,4]	[9,9,4]
30	[1,2,3]	[5,6,7]
update vec_view join normal on vec_view.c1 = normal.c1 set vec_view.c4 = '[7,8,9]', normal.c4 = '[9,10,11]';
update vec_view set c4 = '[7,8,9]';
select * from vec_t1;
c1	c3	c4
0	[7,8,9]	[7,8,9]
1	[1,3,2]	[7,8,9]
2	[7,8,9]	[7,8,9]
3	[1,2,3]	[7,8,9]
4	[7,8,9]	[7,8,9]
5	[5,5,5]	[7,8,9]
6	[7,8,9]	[7,8,9]
7	[4,7,4]	[7,8,9]
8	[7,8,9]	[7,8,9]
9	[9,9,4]	[7,8,9]
10	[7,8,9]	[7,8,9]
11	[10,10,10]	[7,8,9]
12	[7,8,9]	[7,8,9]
13	[3,3,2]	[7,8,9]
14	[7,8,9]	[7,8,9]
15	[5,5,5]	[7,8,9]
16	[7,8,9]	[7,8,9]
17	[4,7,4]	[7,8,9]
18	[7,8,9]	[7,8,9]
19	[9,9,4]	[7,8,9]
20	[7,8,9]	[7,8,9]
21	[1,2,3]	[7,8,9]
22	[7,8,9]	[7,8,9]
23	[3,3,2]	[7,8,9]
24	[7,8,9]	[7,8,9]
25	[5,5,5]	[7,8,9]
26	[7,8,9]	[7,8,9]
27	[4,7,4]	[7,8,9]
28	[7,8,9]	[7,8,9]
29	[9,9,4]	[7,8,9]
30	[1,2,3]	[7,8,9]
select * from vec_view;
c1	c3	c4
0	[7,8,9]	[7,8,9]
1	[1,3,2]	[7,8,9]
2	[7,8,9]	[7,8,9]
3	[1,2,3]	[7,8,9]
4	[7,8,9]	[7,8,9]
5	[5,5,5]	[7,8,9]
6	[7,8,9]	[7,8,9]
7	[4,7,4]	[7,8,9]
8	[7,8,9]	[7,8,9]
9	[9,9,4]	[7,8,9]
10	[7,8,9]	[7,8,9]
11	[10,10,10]	[7,8,9]
12	[7,8,9]	[7,8,9]
13	[3,3,2]	[7,8,9]
14	[7,8,9]	[7,8,9]
15	[5,5,5]	[7,8,9]
16	[7,8,9]	[7,8,9]
17	[4,7,4]	[7,8,9]
18	[7,8,9]	[7,8,9]
19	[9,9,4]	[7,8,9]
20	[7,8,9]	[7,8,9]
21	[1,2,3]	[7,8,9]
22	[7,8,9]	[7,8,9]
23	[3,3,2]	[7,8,9]
24	[7,8,9]	[7,8,9]
25	[5,5,5]	[7,8,9]
26	[7,8,9]	[7,8,9]
27	[4,7,4]	[7,8,9]
28	[7,8,9]	[7,8,9]
29	[9,9,4]	[7,8,9]
30	[1,2,3]	[7,8,9]
delete vec_t1, normal from vec_t1 join normal on vec_t1.c1 = normal.c1;
delete vec_t1 from vec_t1 join normal on vec_t1.c1 = normal.c1;
delete vec_t1 from vec_t1 join normal on vec_t1.c1 = normal.c1;
delete normal from vec_view join normal on vec_view.c1 = normal.c1 and 1=0;
delete from vec_view where c3 = '[7,8,9]';
select * from vec_t1;
c1	c3	c4
1	[1,3,2]	[7,8,9]
3	[1,2,3]	[7,8,9]
5	[5,5,5]	[7,8,9]
7	[4,7,4]	[7,8,9]
9	[9,9,4]	[7,8,9]
11	[10,10,10]	[7,8,9]
13	[3,3,2]	[7,8,9]
15	[5,5,5]	[7,8,9]
17	[4,7,4]	[7,8,9]
19	[9,9,4]	[7,8,9]
21	[1,2,3]	[7,8,9]
23	[3,3,2]	[7,8,9]
25	[5,5,5]	[7,8,9]
27	[4,7,4]	[7,8,9]
29	[9,9,4]	[7,8,9]
30	[1,2,3]	[7,8,9]
select * from vec_view;
c1	c3	c4
1	[1,3,2]	[7,8,9]
3	[1,2,3]	[7,8,9]
5	[5,5,5]	[7,8,9]
7	[4,7,4]	[7,8,9]
9	[9,9,4]	[7,8,9]
11	[10,10,10]	[7,8,9]
13	[3,3,2]	[7,8,9]
15	[5,5,5]	[7,8,9]
17	[4,7,4]	[7,8,9]
19	[9,9,4]	[7,8,9]
21	[1,2,3]	[7,8,9]
23	[3,3,2]	[7,8,9]
25	[5,5,5]	[7,8,9]
27	[4,7,4]	[7,8,9]
29	[9,9,4]	[7,8,9]
30	[1,2,3]	[7,8,9]
set ob_enable_index_direct_select = 0;
drop table vec_t1;
drop table normal;
drop view vec_view;
drop table if exists vec;
create table vec(c1 int, c2 vector(3), primary key(c1), vector index idx1(c2) with (distance=l2, type=ivf_sq8)) LOB_INROW_THRESHOLD = 0;
ERROR 0A000: create ivf index on column with outrow lob data is not supported
drop table if exists vec_t1;
drop view if exists vec_v1;
CREATE TABLE vec_t1 (c1 int primary key, c2 vector(3),c3 vector(3) ,c4 vector(3),
VECTOR INDEX vector_idx1(c3) 
WITH (distance=l2, lib=vsag, type=hnsw, m=10, ef_construction=12, ef_search=40),
VECTOR INDEX vector_idx2(c4)
WITH (distance=l2, type=ivf_sq8));
create view vec_v1 as select * from vec_t1;
replace into vec_v1 values(1,'[1,1,2]','[2,2,3]','[1,3,2]');
replace into vec_v1 values(1,'[1,1,2]','[2,2,3]','[1,3,2]');
select * from vec_v1;
c1	c2	c3	c4
1	[1,1,2]	[2,2,3]	[1,3,2]
select * from vec_t1;
c1	c2	c3	c4
1	[1,1,2]	[2,2,3]	[1,3,2]
drop view vec_v1;
drop table vec_t1;
drop table if exists vec_t1;
drop view if exists vec_v1;
CREATE TABLE vec_t1 (c1 int primary key, c2 VARCHAR(30),c3 vector(3) ,c4 vector(3),
VECTOR INDEX vector_idx1(c3) 
WITH (distance=l2, lib=vsag, type=hnsw, m=10, ef_construction=12, ef_search=40),
VECTOR INDEX vector_idx2(c4)
WITH (distance=l2, type=ivf_sq8)) partition by list columns (c1)(
PARTITION p0 VALUES in(10),
PARTITION p1 VALUES in(50)
);
create view vec_v1 as select * from vec_t1;
replace into vec_v1 values(1,'[1,1,2]','[2,2,3]','[1,3,2]');
ERROR HY000: Table has no partition for value
replace into vec_v1 values(10,'[1,1,2]','[2,2,3]','[1,3,2]');
replace into vec_v1 values(10,'[1,1,2]','[2,2,3]','[1,3,2]');
select * from vec_v1;
c1	c2	c3	c4
10	[1,1,2]	[2,2,3]	[1,3,2]
select * from vec_t1;
c1	c2	c3	c4
10	[1,1,2]	[2,2,3]	[1,3,2]
drop view vec_v1;
drop table vec_t1;
alter system set ob_vector_memory_limit_percentage = 0;
