# ----------------------------------------------------------------------
# Test of sparse vector index
# ----------------------------------------------------------------------
drop database if exists sparse_dml;
create database sparse_dml;
use sparse_dml;
alter system set ob_vector_memory_limit_percentage =44;
set ob_enable_index_direct_select = 1;
set ob_query_timeout=100000000;
============= basic test ==============
CREATE TABLE t1 (
c1 int primary key,
c2 sparsevector
);
insert into t1 values(1, '{1:0.1,2:0.2, 3:0.3}');
insert into t1 values(2, '{3:0.3, 2:0.2, 4:0.4}');
insert into t1 values(3, '{3:0.3, 4:0.4, 5:0.5}');
insert into t1 values(4, '{5:0.5, 4:0.4, 6:0.6}');
insert into t1 values(5, '{5:0.5, 6:0.6, 7:0.7}');
insert into t1 values(6, '{7:0.7, 6:0.6, 8:0.8}');
insert into t1 values(7, '{7:0.7, 8:0.8, 9:0.9}');
insert into t1 values(8, '{9:0.9, 8:0.8, 10:1.0}');
insert into t1 values(9, '{9:0.9, 10:1.0, 11:1.1}');
create vector index idx1 on t1(c2) with (lib=vsag, type=sindi, distance=inner_product);
insert into t1 values(10, '{11:1.1, 10:1.0, 12:1.2}');
count(*)
1
insert into t1 values(11, '{11:1.1, 10:1.0, 12:1.2}');
insert into t1 values(12, '{}');
count(*)
3
delete from t1 where c1=1;
count(*)
4
delete from t1 where c1<=5;
count(*)
8
update t1 set c2='{6:0.6}' where c1=6;
count(*)
10
update t1 set c2='{}' where c1=7;
replace into t1(c1, c2) values(8, '{8:0.8}');
replace into t1(c1, c2) values(13, '{13:1.3}');
count(*)
15
select * from t1;
c1	c2
6	{6:0.6}
7	{}
8	{8:0.8}
9	{9:0.9,10:1,11:1.1}
10	{10:1,11:1.1,12:1.2}
11	{10:1,11:1.1,12:1.2}
12	{}
13	{13:1.3}
select * from t1 order by negative_inner_product(c2, '{5:1, 6:1}') approx limit 2;
c1	c2
6	{6:0.6}
drop table if exists t1;
CREATE TABLE t1 (c1 int primary key, c2 sparsevector, c3 sparsevector, c4 sparsevector, 
vector index inx1(c2) with (lib=vsag, type=sindi, distance=inner_product));
insert into t1 values(1, '{1:0.1,2:0.2, 3:0.3}', '{1:0.1,2:0.2, 3:0.3}', '{1:0.1,2:0.2, 3:0.3}');
insert into t1 values(2, '{3:0.3, 2:0.2, 4:0.4}', '{3:0.3, 2:0.2, 4:0.4}', '{3:0.3, 2:0.2, 4:0.4}');
insert into t1 values(3, '{3:0.3, 4:0.4, 5:0.5}', '{3:0.3, 4:0.4, 5:0.5}', '{3:0.3, 4:0.4, 5:0.5}');
insert into t1 values(4, '{5:0.5, 4:0.4, 6:0.6}', '{5:0.5, 4:0.4, 6:0.6}', '{5:0.5, 4:0.4, 6:0.6}');
insert into t1 values(5, '{5:0.5, 6:0.6, 7:0.7}', '{5:0.5, 6:0.6, 7:0.7}', '{5:0.5, 6:0.6, 7:0.7}');
insert into t1 values(6, '{7:0.7, 6:0.6, 8:0.8}', '{7:0.7, 6:0.6, 8:0.8}', '{7:0.7, 6:0.6, 8:0.8}');
count(*)
6
count(*)
8
count(*)
9
count(*)
12
count(*)
14
count(*)
19
select * from t1;
c1	c2	c3	c4
5	{5:0.5}	{5:0.5,6:0.6,7:0.7}	{5:0.5,6:0.6,7:0.7}
6	{}	{6:0.6,7:0.7,8:0.8}	{6:0.6,7:0.7,8:0.8}
11	{8:0.8}	NULL	NULL
12	{}	{}	{}
13	{13:1.3}	NULL	NULL
select * from t1 order by negative_inner_product(c2, '{5:1, 6:1}') approx limit 2;
c1	c2	c3	c4
5	{5:0.5}	{5:0.5,6:0.6,7:0.7}	{5:0.5,6:0.6,7:0.7}
drop table if exists t1;
============= 分区表 ==============
CREATE TABLE t1 (
c1 int primary key,
c2 sparsevector,
vector index idx1(c2) with (lib=vsag, type=sindi, distance=inner_product)
) partition by hash(c1) partitions 3;
insert into t1 values(1, '{1:0.1,2:0.2, 3:0.3}');
insert into t1 values(2, '{3:0.3, 2:0.2, 4:0.4}');
insert into t1 values(3, '{3:0.3, 4:0.4, 5:0.5}');
insert into t1 values(4, '{5:0.5, 4:0.4, 6:0.6}');
insert into t1 values(5, '{5:0.5, 6:0.6, 7:0.7}');
insert into t1 values(6, '{7:0.7, 6:0.6, 8:0.8}');
insert into t1 values(7, '{7:0.7, 8:0.8, 9:0.9}');
insert into t1 values(8, '{9:0.9, 8:0.8, 10:1.0}');
insert into t1 values(9, '{9:0.9, 10:1.0, 11:1.1}');
insert into t1 values(10, '{11:1.1, 10:1.0, 12:1.2}');
count(*)
10
count(*)
12
count(*)
13
count(*)
17
count(*)
19
count(*)
24
select * from t1;
c1	c2
6	{6:0.6}
9	{9:0.9,10:1,11:1.1}
12	{}
7	{}
10	{10:1,11:1.1,12:1.2}
13	{13:1.3}
8	{8:0.8}
11	{10:1,11:1.1,12:1.2}
select * from t1 order by negative_inner_product(c2, '{5:1, 6:1}') approx limit 2;
c1	c2
6	{6:0.6}
drop table if exists t1;
============= 事务 ==============
CREATE TABLE t1 (c1 int primary key, c2 sparsevector);
insert into t1 values(1, '{1:0.1,2:0.2, 3:0.3}');
insert into t1 values(2, '{3:0.3, 2:0.2, 4:0.4}');
insert into t1 values(3, '{3:0.3, 4:0.4, 5:0.5}');
insert into t1 values(4, '{5:0.5, 4:0.4, 6:0.6}');
create vector index idx1 on t1(c2) with (lib=vsag, type=sindi, distance=inner_product);
insert into t1 values(10, '{11:1.1, 10:1.0, 12:1.2}');
start transaction;
count(*)
1
insert into t1 values(11, '{11:1.1, 10:1.0, 12:1.2}');
insert into t1 values(12, '{}');
count(*)
3
delete from t1 where c1=1;
count(*)
4
delete from t1 where c1<=5;
count(*)
7
update t1 set c2='{6:0.6}' where c1=6;
count(*)
7
update t1 set c2='{}' where c1=7;
replace into t1(c1, c2) values(8, '{8:0.8}');
replace into t1(c1, c2) values(13, '{13:1.3}');
count(*)
9
commit;
select * from t1;
c1	c2
8	{8:0.8}
10	{10:1,11:1.1,12:1.2}
11	{10:1,11:1.1,12:1.2}
12	{}
13	{13:1.3}
select * from t1 order by negative_inner_product(c2, '{5:1, 6:1}') approx limit 2;
c1	c2
============= 存储过程 ==============
create procedure process(IN id1 INT, IN id2 INT)
begin
delete from t1 where c1=id1;
update t1 set c2='{}' where c1=id2;
end;
//
CALL process(8, 13);
drop procedure process;
select * from t1;
c1	c2
10	{10:1,11:1.1,12:1.2}
11	{10:1,11:1.1,12:1.2}
12	{}
13	{}
drop table if exists t1;
alter system set vector_index_optimize_duty_time='[24:00:00, 24:00:00]';
create table test_sparse_vec_tbl (
id int, c1 bool, c2 int, c3 decimal, c4 float, c5 bit, 
c6 date, c7 varchar(10), c8 text, c9 json, c10 GEOMETRY,
c11 array(int), c12 vector(5), c13 vector(5), c14 vector(5), c15 map(int, int), c16 sparsevector, vector index idx1(c16) with (distance=inner_product, type=sindi, lib=vsag));
# ----------------------------------------------------------------------
# Test of sparse vector index
# ----------------------------------------------------------------------
insert into test_sparse_vec_tbl values(1, true, 1, 1, 1.3, 1, '2020-01-01', 'abc', 'abc', '{"a":1}', ST_GeomFromText('POINT(1 1)'), [1,2,3,4,5], [1,2,3,4,5], [1,2,3,4,5], [1,2,3,4,5], '{1:123, 4:345}', '{1:123, 2:456}');
insert into test_sparse_vec_tbl values(2, true, 1, 1, 1.3, 1, '2020-01-01', 'abc', 'abc', '{"a":1}', ST_GeomFromText('POINT(1 1)'), [1,2,3,4,5], [1,2,3,4,5], [1,2,3,4,5], [1,2,3,4,5], '{1:123, 4:345}', '{1:123, 2:456}');
select id, c1, c11, c13, c16 from test_sparse_vec_tbl order by id;
id	c1	c11	c13	c16
1	1	[1,2,3,4,5]	[1,2,3,4,5]	{1:123,2:456}
2	1	[1,2,3,4,5]	[1,2,3,4,5]	{1:123,2:456}
insert into test_sparse_vec_tbl values(1, true, 1, 1, 1.3, 1, '2020-01-01', 'abc', 'abc', '{"a":1}', ST_GeomFromText('POINT(1 1)'), [1,2,3,4,5], [1,2,3,4,5], [1,2,3,4,5], [1,2,3,4,5], '{1:123, 4:345}', '{1:123, 2:456}') on duplicate key update c1 = false;
insert into test_sparse_vec_tbl values(1, true, 1, 1, 1.3, 1, '2020-01-01', 'abc', 'abc', '{"a":1}', ST_GeomFromText('POINT(1 1)'), [1,2,3,4,5], [1,2,3,4,5], [1,2,3,4,5], [1,2,3,4,5], '{1:123, 4:345}', '{1:123, 2:456}') on duplicate key update c16 = null;
insert into test_sparse_vec_tbl values(1, true, 1, 1, 1.3, 1, '2020-01-01', 'abc', 'abc', '{"a":1}', ST_GeomFromText('POINT(1 1)'), [1,2,3,4,5], [1,2,3,4,5], [1,2,3,4,5], [1,2,3,4,5], '{1:123, 4:345}', '{1:123, 2:456}') on duplicate key update c16 = '{1:3.4, 5:4.5}';
select id, c1, c11, c13, c16 from test_sparse_vec_tbl order by id;
id	c1	c11	c13	c16
1	1	[1,2,3,4,5]	[1,2,3,4,5]	{1:123,2:456}
1	1	[1,2,3,4,5]	[1,2,3,4,5]	{1:123,2:456}
1	1	[1,2,3,4,5]	[1,2,3,4,5]	{1:123,2:456}
1	1	[1,2,3,4,5]	[1,2,3,4,5]	{1:123,2:456}
2	1	[1,2,3,4,5]	[1,2,3,4,5]	{1:123,2:456}
insert IGNORE into test_sparse_vec_tbl values(1, true, 1, 1, 1.3, 1, '2020-01-01', 'abc', 'abc', '{"a":1}', ST_GeomFromText('POINT(1 1)'), [1,2,4,4,5], [1,2,4,4,5], [1,2,4,4,5], [1,2,4,4,5], '{1:123, 4:345}', '{1:123, 2:456}');
select id, c1, c11, c13, c16 from test_sparse_vec_tbl order by id;
id	c1	c11	c13	c16
1	1	[1,2,3,4,5]	[1,2,3,4,5]	{1:123,2:456}
1	1	[1,2,3,4,5]	[1,2,3,4,5]	{1:123,2:456}
1	1	[1,2,3,4,5]	[1,2,3,4,5]	{1:123,2:456}
1	1	[1,2,3,4,5]	[1,2,3,4,5]	{1:123,2:456}
1	1	[1,2,4,4,5]	[1,2,4,4,5]	{1:123,2:456}
2	1	[1,2,3,4,5]	[1,2,3,4,5]	{1:123,2:456}
replace into test_sparse_vec_tbl values(1, true, 1, 1, 1.3, 1, '2020-01-01', 'abc', 'abc', '{"a":1}', ST_GeomFromText('POINT(1 1)'), [1,2,3,4,5], [1,2,3,4,5], [1,2,3,4,5], [1,2,3,4,5], '{1:123, 4:345}', '{1:123, 2:456}');
replace into test_sparse_vec_tbl values(3, true, 1, 1, 1.3, 1, '2020-01-01', 'abc', 'abc', '{"a":1}', ST_GeomFromText('POINT(1 1)'), [1,2,3,4,5], [1,2,3,4,5], [1,2,3,4,5], [1,2,3,4,5], '{1:123, 4:345}', '{60:1.23, 80:4.56}');
select id, c1, c11, c13, c16 from test_sparse_vec_tbl order by id;
id	c1	c11	c13	c16
1	1	[1,2,3,4,5]	[1,2,3,4,5]	{1:123,2:456}
1	1	[1,2,3,4,5]	[1,2,3,4,5]	{1:123,2:456}
1	1	[1,2,3,4,5]	[1,2,3,4,5]	{1:123,2:456}
1	1	[1,2,3,4,5]	[1,2,3,4,5]	{1:123,2:456}
1	1	[1,2,4,4,5]	[1,2,4,4,5]	{1:123,2:456}
1	1	[1,2,3,4,5]	[1,2,3,4,5]	{1:123,2:456}
2	1	[1,2,3,4,5]	[1,2,3,4,5]	{1:123,2:456}
3	1	[1,2,3,4,5]	[1,2,3,4,5]	{60:1.23,80:4.56}
select /*+read_consistency(weak) */ id, c11, c13, c16 from test_sparse_vec_tbl order by id;
id	c11	c13	c16
1	[1,2,3,4,5]	[1,2,3,4,5]	{1:123,2:456}
1	[1,2,3,4,5]	[1,2,3,4,5]	{1:123,2:456}
1	[1,2,3,4,5]	[1,2,3,4,5]	{1:123,2:456}
1	[1,2,3,4,5]	[1,2,3,4,5]	{1:123,2:456}
1	[1,2,4,4,5]	[1,2,4,4,5]	{1:123,2:456}
1	[1,2,3,4,5]	[1,2,3,4,5]	{1:123,2:456}
2	[1,2,3,4,5]	[1,2,3,4,5]	{1:123,2:456}
3	[1,2,3,4,5]	[1,2,3,4,5]	{60:1.23,80:4.56}
drop table if exists test_sparse_vec_tbl_2;
create table test_sparse_vec_tbl_2 (
id int, c1 bool, c2 int, c3 decimal, c4 float, c5 bit, 
c6 date, c7 varchar(10), c8 text, c9 json, c10 GEOMETRY,
c11 array(int), c12 vector(5), c13 vector(5), c14 vector(5), c15 map(int, int), c16 sparsevector, 
vector index idx1(c16) with (distance=inner_product, type=sindi, lib=vsag));
insert into test_sparse_vec_tbl_2 select * from test_sparse_vec_tbl;
select id, c1, c11, c13, c16 from test_sparse_vec_tbl_2 order by id;
id	c1	c11	c13	c16
1	1	[1,2,3,4,5]	[1,2,3,4,5]	{1:123,2:456}
1	1	[1,2,3,4,5]	[1,2,3,4,5]	{1:123,2:456}
1	1	[1,2,3,4,5]	[1,2,3,4,5]	{1:123,2:456}
1	1	[1,2,3,4,5]	[1,2,3,4,5]	{1:123,2:456}
1	1	[1,2,4,4,5]	[1,2,4,4,5]	{1:123,2:456}
1	1	[1,2,3,4,5]	[1,2,3,4,5]	{1:123,2:456}
2	1	[1,2,3,4,5]	[1,2,3,4,5]	{1:123,2:456}
3	1	[1,2,3,4,5]	[1,2,3,4,5]	{60:1.23,80:4.56}
delete from test_sparse_vec_tbl_2;
alter system set direct_load_allow_fallback=FALSE;
insert /*+ direct(true,100) enable_parallel_dml parallel(2) append*/ into test_sparse_vec_tbl_2 select * from test_sparse_vec_tbl;
ERROR 0A000: direct-load does not support table with vector index
insert /*+ direct(true,100,'inc') enable_parallel_dml parallel(2)*/  into test_sparse_vec_tbl_2 select * from test_sparse_vec_tbl;
ERROR 0A000: direct-load does not support table with vector index
alter system set direct_load_allow_fallback=TRUE;
insert /*+ direct(true,100) enable_parallel_dml parallel(2) append*/ into test_sparse_vec_tbl_2 select * from test_sparse_vec_tbl;
select id, c1, c11, c13, c16 from test_sparse_vec_tbl_2 order by id;
id	c1	c11	c13	c16
1	1	[1,2,3,4,5]	[1,2,3,4,5]	{1:123,2:456}
1	1	[1,2,3,4,5]	[1,2,3,4,5]	{1:123,2:456}
1	1	[1,2,3,4,5]	[1,2,3,4,5]	{1:123,2:456}
1	1	[1,2,3,4,5]	[1,2,3,4,5]	{1:123,2:456}
1	1	[1,2,3,4,5]	[1,2,3,4,5]	{1:123,2:456}
1	1	[1,2,4,4,5]	[1,2,4,4,5]	{1:123,2:456}
2	1	[1,2,3,4,5]	[1,2,3,4,5]	{1:123,2:456}
3	1	[1,2,3,4,5]	[1,2,3,4,5]	{60:1.23,80:4.56}
delete from test_sparse_vec_tbl_2;
insert /*+ direct(true,100,'inc') enable_parallel_dml parallel(2)*/  into test_sparse_vec_tbl_2 select * from test_sparse_vec_tbl;
select id, c1, c11, c13, c16 from test_sparse_vec_tbl_2 order by id;
id	c1	c11	c13	c16
1	1	[1,2,3,4,5]	[1,2,3,4,5]	{1:123,2:456}
1	1	[1,2,3,4,5]	[1,2,3,4,5]	{1:123,2:456}
1	1	[1,2,3,4,5]	[1,2,3,4,5]	{1:123,2:456}
1	1	[1,2,3,4,5]	[1,2,3,4,5]	{1:123,2:456}
1	1	[1,2,3,4,5]	[1,2,3,4,5]	{1:123,2:456}
1	1	[1,2,4,4,5]	[1,2,4,4,5]	{1:123,2:456}
2	1	[1,2,3,4,5]	[1,2,3,4,5]	{1:123,2:456}
3	1	[1,2,3,4,5]	[1,2,3,4,5]	{60:1.23,80:4.56}
drop table if exists test_sparse_vec_tbl_2;
alter system major freeze;
select id, c1, c11, c13, c16 from test_sparse_vec_tbl order by id;
id	c1	c11	c13	c16
1	1	[1,2,3,4,5]	[1,2,3,4,5]	{1:123,2:456}
1	1	[1,2,3,4,5]	[1,2,3,4,5]	{1:123,2:456}
1	1	[1,2,3,4,5]	[1,2,3,4,5]	{1:123,2:456}
1	1	[1,2,3,4,5]	[1,2,3,4,5]	{1:123,2:456}
1	1	[1,2,4,4,5]	[1,2,4,4,5]	{1:123,2:456}
1	1	[1,2,3,4,5]	[1,2,3,4,5]	{1:123,2:456}
2	1	[1,2,3,4,5]	[1,2,3,4,5]	{1:123,2:456}
3	1	[1,2,3,4,5]	[1,2,3,4,5]	{60:1.23,80:4.56}
update test_sparse_vec_tbl set c16 = '{1:1.5, 2:3, 5:6, 100:10}' where id = 1;
select id, c1, c11, c13, c16 from test_sparse_vec_tbl order by id;
id	c1	c11	c13	c16
1	1	[1,2,3,4,5]	[1,2,3,4,5]	{1:1.5,2:3,5:6,100:10}
1	1	[1,2,3,4,5]	[1,2,3,4,5]	{1:1.5,2:3,5:6,100:10}
1	1	[1,2,3,4,5]	[1,2,3,4,5]	{1:1.5,2:3,5:6,100:10}
1	1	[1,2,3,4,5]	[1,2,3,4,5]	{1:1.5,2:3,5:6,100:10}
1	1	[1,2,4,4,5]	[1,2,4,4,5]	{1:1.5,2:3,5:6,100:10}
1	1	[1,2,3,4,5]	[1,2,3,4,5]	{1:1.5,2:3,5:6,100:10}
2	1	[1,2,3,4,5]	[1,2,3,4,5]	{1:123,2:456}
3	1	[1,2,3,4,5]	[1,2,3,4,5]	{60:1.23,80:4.56}
delete from test_sparse_vec_tbl where id < 4;
delete /*+ ENABLE_PARALLEL_DML parallel(2) */ from test_sparse_vec_tbl where id < 6;
select id, c1, c11, c13, c16 from test_sparse_vec_tbl;
id	c1	c11	c13	c16
delete from test_sparse_vec_tbl where c16 is null;
delete from test_sparse_vec_tbl where c16 is not null;
select id, c1, c11, c13, c16 from test_sparse_vec_tbl;
id	c1	c11	c13	c16
insert into test_sparse_vec_tbl values(1, true, 1, 1, 1.3, 1, '2020-01-01', 'abc', 'abc', '{"a":1}', ST_GeomFromText('POINT(1 1)'), [1,2,3,4,5], [1,2,3,4,5], [1,2,3,4,5], [1,2,3,4,5], '{1:123, 4:345}', '{1:123, 2:456}');
insert into test_sparse_vec_tbl values(2, true, 1, 1, 1.3, 1, '2020-01-01', 'abc', 'abc', '{"a":1}', ST_GeomFromText('POINT(1 1)'), [1,2,3,4,5], [1,2,3,4,5], [1,2,3,4,5], [1,2,3,4,5], '{1:123, 4:345}', null);
select id, c1, c11, c13, c16 from test_sparse_vec_tbl order by id;
id	c1	c11	c13	c16
1	1	[1,2,3,4,5]	[1,2,3,4,5]	{1:123,2:456}
2	1	[1,2,3,4,5]	[1,2,3,4,5]	NULL
truncate table test_sparse_vec_tbl;
drop table if exists test_sparse_vec_tbl;
create table test_sparse_vec_tbl (
id int primary key, c1 bool, c2 int, c3 decimal, c4 float, c5 bit, 
c6 date, c7 varchar(10), c8 text, c9 json, c10 GEOMETRY,
c11 array(int), c12 vector(5), c13 vector(5), c14 vector(5), c15 map(int, int), c16 sparsevector, vector index idx1(c16) with (distance=inner_product, type=sindi, lib=vsag));
# ----------------------------------------------------------------------
# Test of sparse vector index
# ----------------------------------------------------------------------
insert into test_sparse_vec_tbl values(1, true, 1, 1, 1.3, 1, '2020-01-01', 'abc', 'abc', '{"a":1}', ST_GeomFromText('POINT(1 1)'), [1,2,3,4,5], [1,2,3,4,5], [1,2,3,4,5], [1,2,3,4,5], '{1:123, 4:345}', '{1:123, 2:456}');
insert into test_sparse_vec_tbl values(2, true, 1, 1, 1.3, 1, '2020-01-01', 'abc', 'abc', '{"a":1}', ST_GeomFromText('POINT(1 1)'), [1,2,3,4,5], [1,2,3,4,5], [1,2,3,4,5], [1,2,3,4,5], '{1:123, 4:345}', '{1:123, 2:456}');
select id, c1, c11, c13, c16 from test_sparse_vec_tbl order by id;
id	c1	c11	c13	c16
1	1	[1,2,3,4,5]	[1,2,3,4,5]	{1:123,2:456}
2	1	[1,2,3,4,5]	[1,2,3,4,5]	{1:123,2:456}
insert into test_sparse_vec_tbl values(1, true, 1, 1, 1.3, 1, '2020-01-01', 'abc', 'abc', '{"a":1}', ST_GeomFromText('POINT(1 1)'), [1,2,3,4,5], [1,2,3,4,5], [1,2,3,4,5], [1,2,3,4,5], '{1:123, 4:345}', '{1:123, 2:456}') on duplicate key update c1 = false;
insert into test_sparse_vec_tbl values(1, true, 1, 1, 1.3, 1, '2020-01-01', 'abc', 'abc', '{"a":1}', ST_GeomFromText('POINT(1 1)'), [1,2,3,4,5], [1,2,3,4,5], [1,2,3,4,5], [1,2,3,4,5], '{1:123, 4:345}', '{1:123, 2:456}') on duplicate key update c16 = null;
insert into test_sparse_vec_tbl values(1, true, 1, 1, 1.3, 1, '2020-01-01', 'abc', 'abc', '{"a":1}', ST_GeomFromText('POINT(1 1)'), [1,2,3,4,5], [1,2,3,4,5], [1,2,3,4,5], [1,2,3,4,5], '{1:123, 4:345}', '{1:123, 2:456}') on duplicate key update c16 = '{1:3.4, 5:4.5}';
select id, c1, c11, c13, c16 from test_sparse_vec_tbl order by id;
id	c1	c11	c13	c16
1	0	[1,2,3,4,5]	[1,2,3,4,5]	{1:3.4,5:4.5}
2	1	[1,2,3,4,5]	[1,2,3,4,5]	{1:123,2:456}
insert IGNORE into test_sparse_vec_tbl values(1, true, 1, 1, 1.3, 1, '2020-01-01', 'abc', 'abc', '{"a":1}', ST_GeomFromText('POINT(1 1)'), [1,2,4,4,5], [1,2,4,4,5], [1,2,4,4,5], [1,2,4,4,5], '{1:123, 4:345}', '{1:123, 2:456}');
select id, c1, c11, c13, c16 from test_sparse_vec_tbl order by id;
id	c1	c11	c13	c16
1	0	[1,2,3,4,5]	[1,2,3,4,5]	{1:3.4,5:4.5}
2	1	[1,2,3,4,5]	[1,2,3,4,5]	{1:123,2:456}
replace into test_sparse_vec_tbl values(1, true, 1, 1, 1.3, 1, '2020-01-01', 'abc', 'abc', '{"a":1}', ST_GeomFromText('POINT(1 1)'), [1,2,3,4,5], [1,2,3,4,5], [1,2,3,4,5], [1,2,3,4,5], '{1:123, 4:345}', '{1:123, 2:456}');
replace into test_sparse_vec_tbl values(3, true, 1, 1, 1.3, 1, '2020-01-01', 'abc', 'abc', '{"a":1}', ST_GeomFromText('POINT(1 1)'), [1,2,3,4,5], [1,2,3,4,5], [1,2,3,4,5], [1,2,3,4,5], '{1:123, 4:345}', '{60:1.23, 80:4.56}');
select id, c1, c11, c13, c16 from test_sparse_vec_tbl order by id;
id	c1	c11	c13	c16
1	1	[1,2,3,4,5]	[1,2,3,4,5]	{1:123,2:456}
2	1	[1,2,3,4,5]	[1,2,3,4,5]	{1:123,2:456}
3	1	[1,2,3,4,5]	[1,2,3,4,5]	{60:1.23,80:4.56}
select /*+read_consistency(weak) */ id, c11, c13, c16 from test_sparse_vec_tbl order by id;
id	c11	c13	c16
1	[1,2,3,4,5]	[1,2,3,4,5]	{1:123,2:456}
2	[1,2,3,4,5]	[1,2,3,4,5]	{1:123,2:456}
3	[1,2,3,4,5]	[1,2,3,4,5]	{60:1.23,80:4.56}
drop table if exists test_sparse_vec_tbl_2;
create table test_sparse_vec_tbl_2 (
id int, c1 bool, c2 int, c3 decimal, c4 float, c5 bit, 
c6 date, c7 varchar(10), c8 text, c9 json, c10 GEOMETRY,
c11 array(int), c12 vector(5), c13 vector(5), c14 vector(5), c15 map(int, int), c16 sparsevector, 
vector index idx1(c16) with (distance=inner_product, type=sindi, lib=vsag));
insert into test_sparse_vec_tbl_2 select * from test_sparse_vec_tbl;
select id, c1, c11, c13, c16 from test_sparse_vec_tbl_2 order by id;
id	c1	c11	c13	c16
1	1	[1,2,3,4,5]	[1,2,3,4,5]	{1:123,2:456}
2	1	[1,2,3,4,5]	[1,2,3,4,5]	{1:123,2:456}
3	1	[1,2,3,4,5]	[1,2,3,4,5]	{60:1.23,80:4.56}
delete from test_sparse_vec_tbl_2;
alter system set direct_load_allow_fallback=FALSE;
insert /*+ direct(true,100) enable_parallel_dml parallel(2) append*/ into test_sparse_vec_tbl_2 select * from test_sparse_vec_tbl;
ERROR 0A000: direct-load does not support table with vector index
insert /*+ direct(true,100,'inc') enable_parallel_dml parallel(2)*/  into test_sparse_vec_tbl_2 select * from test_sparse_vec_tbl;
ERROR 0A000: direct-load does not support table with vector index
alter system set direct_load_allow_fallback=TRUE;
insert /*+ direct(true,100) enable_parallel_dml parallel(2) append*/ into test_sparse_vec_tbl_2 select * from test_sparse_vec_tbl;
select id, c1, c11, c13, c16 from test_sparse_vec_tbl_2 order by id;
id	c1	c11	c13	c16
1	1	[1,2,3,4,5]	[1,2,3,4,5]	{1:123,2:456}
2	1	[1,2,3,4,5]	[1,2,3,4,5]	{1:123,2:456}
3	1	[1,2,3,4,5]	[1,2,3,4,5]	{60:1.23,80:4.56}
delete from test_sparse_vec_tbl_2;
insert /*+ direct(true,100,'inc') enable_parallel_dml parallel(2)*/  into test_sparse_vec_tbl_2 select * from test_sparse_vec_tbl;
select id, c1, c11, c13, c16 from test_sparse_vec_tbl_2 order by id;
id	c1	c11	c13	c16
1	1	[1,2,3,4,5]	[1,2,3,4,5]	{1:123,2:456}
2	1	[1,2,3,4,5]	[1,2,3,4,5]	{1:123,2:456}
3	1	[1,2,3,4,5]	[1,2,3,4,5]	{60:1.23,80:4.56}
drop table if exists test_sparse_vec_tbl_2;
alter system major freeze;
select id, c1, c11, c13, c16 from test_sparse_vec_tbl order by id;
id	c1	c11	c13	c16
1	1	[1,2,3,4,5]	[1,2,3,4,5]	{1:123,2:456}
2	1	[1,2,3,4,5]	[1,2,3,4,5]	{1:123,2:456}
3	1	[1,2,3,4,5]	[1,2,3,4,5]	{60:1.23,80:4.56}
update test_sparse_vec_tbl set c16 = '{1:1.5, 2:3, 5:6, 100:10}' where id = 1;
select id, c1, c11, c13, c16 from test_sparse_vec_tbl order by id;
id	c1	c11	c13	c16
1	1	[1,2,3,4,5]	[1,2,3,4,5]	{1:1.5,2:3,5:6,100:10}
2	1	[1,2,3,4,5]	[1,2,3,4,5]	{1:123,2:456}
3	1	[1,2,3,4,5]	[1,2,3,4,5]	{60:1.23,80:4.56}
delete from test_sparse_vec_tbl where id < 4;
delete /*+ ENABLE_PARALLEL_DML parallel(2) */ from test_sparse_vec_tbl where id < 6;
select id, c1, c11, c13, c16 from test_sparse_vec_tbl;
id	c1	c11	c13	c16
delete from test_sparse_vec_tbl where c16 is null;
delete from test_sparse_vec_tbl where c16 is not null;
select id, c1, c11, c13, c16 from test_sparse_vec_tbl;
id	c1	c11	c13	c16
insert into test_sparse_vec_tbl values(1, true, 1, 1, 1.3, 1, '2020-01-01', 'abc', 'abc', '{"a":1}', ST_GeomFromText('POINT(1 1)'), [1,2,3,4,5], [1,2,3,4,5], [1,2,3,4,5], [1,2,3,4,5], '{1:123, 4:345}', '{1:123, 2:456}');
insert into test_sparse_vec_tbl values(2, true, 1, 1, 1.3, 1, '2020-01-01', 'abc', 'abc', '{"a":1}', ST_GeomFromText('POINT(1 1)'), [1,2,3,4,5], [1,2,3,4,5], [1,2,3,4,5], [1,2,3,4,5], '{1:123, 4:345}', null);
select id, c1, c11, c13, c16 from test_sparse_vec_tbl order by id;
id	c1	c11	c13	c16
1	1	[1,2,3,4,5]	[1,2,3,4,5]	{1:123,2:456}
2	1	[1,2,3,4,5]	[1,2,3,4,5]	NULL
truncate table test_sparse_vec_tbl;
drop table if exists test_sparse_vec_tbl;
create table test_sparse_vec_tbl (
id int primary key, c1 bool, c2 int, c3 decimal, c4 float, c5 bit, 
c6 date, c7 varchar(10), c8 text, c9 json, c10 GEOMETRY,
c11 array(int), c12 vector(5), c13 vector(5), c14 vector(5), c15 map(int, int), c16 sparsevector, 
vector index idx1(c16) with (distance=inner_product, type=sindi, lib=vsag),
vector index idx_c12(c12) with (distance=l2, type=hnsw));
create vector index idx_c13 on test_sparse_vec_tbl(c13) with (distance=l2, type=hnsw);
create vector index idx_c14 on test_sparse_vec_tbl(c14) with (distance=l2, type=hnsw);
# ----------------------------------------------------------------------
# Test of sparse vector index
# ----------------------------------------------------------------------
insert into test_sparse_vec_tbl values(1, true, 1, 1, 1.3, 1, '2020-01-01', 'abc', 'abc', '{"a":1}', ST_GeomFromText('POINT(1 1)'), [1,2,3,4,5], [1,2,3,4,5], [1,2,3,4,5], [1,2,3,4,5], '{1:123, 4:345}', '{1:123, 2:456}');
insert into test_sparse_vec_tbl values(2, true, 1, 1, 1.3, 1, '2020-01-01', 'abc', 'abc', '{"a":1}', ST_GeomFromText('POINT(1 1)'), [1,2,3,4,5], [1,2,3,4,5], [1,2,3,4,5], [1,2,3,4,5], '{1:123, 4:345}', '{1:123, 2:456}');
select id, c1, c11, c13, c16 from test_sparse_vec_tbl order by id;
id	c1	c11	c13	c16
1	1	[1,2,3,4,5]	[1,2,3,4,5]	{1:123,2:456}
2	1	[1,2,3,4,5]	[1,2,3,4,5]	{1:123,2:456}
insert into test_sparse_vec_tbl values(1, true, 1, 1, 1.3, 1, '2020-01-01', 'abc', 'abc', '{"a":1}', ST_GeomFromText('POINT(1 1)'), [1,2,3,4,5], [1,2,3,4,5], [1,2,3,4,5], [1,2,3,4,5], '{1:123, 4:345}', '{1:123, 2:456}') on duplicate key update c1 = false;
insert into test_sparse_vec_tbl values(1, true, 1, 1, 1.3, 1, '2020-01-01', 'abc', 'abc', '{"a":1}', ST_GeomFromText('POINT(1 1)'), [1,2,3,4,5], [1,2,3,4,5], [1,2,3,4,5], [1,2,3,4,5], '{1:123, 4:345}', '{1:123, 2:456}') on duplicate key update c16 = null;
insert into test_sparse_vec_tbl values(1, true, 1, 1, 1.3, 1, '2020-01-01', 'abc', 'abc', '{"a":1}', ST_GeomFromText('POINT(1 1)'), [1,2,3,4,5], [1,2,3,4,5], [1,2,3,4,5], [1,2,3,4,5], '{1:123, 4:345}', '{1:123, 2:456}') on duplicate key update c16 = '{1:3.4, 5:4.5}';
select id, c1, c11, c13, c16 from test_sparse_vec_tbl order by id;
id	c1	c11	c13	c16
1	0	[1,2,3,4,5]	[1,2,3,4,5]	{1:3.4,5:4.5}
2	1	[1,2,3,4,5]	[1,2,3,4,5]	{1:123,2:456}
insert IGNORE into test_sparse_vec_tbl values(1, true, 1, 1, 1.3, 1, '2020-01-01', 'abc', 'abc', '{"a":1}', ST_GeomFromText('POINT(1 1)'), [1,2,4,4,5], [1,2,4,4,5], [1,2,4,4,5], [1,2,4,4,5], '{1:123, 4:345}', '{1:123, 2:456}');
select id, c1, c11, c13, c16 from test_sparse_vec_tbl order by id;
id	c1	c11	c13	c16
1	0	[1,2,3,4,5]	[1,2,3,4,5]	{1:3.4,5:4.5}
2	1	[1,2,3,4,5]	[1,2,3,4,5]	{1:123,2:456}
replace into test_sparse_vec_tbl values(1, true, 1, 1, 1.3, 1, '2020-01-01', 'abc', 'abc', '{"a":1}', ST_GeomFromText('POINT(1 1)'), [1,2,3,4,5], [1,2,3,4,5], [1,2,3,4,5], [1,2,3,4,5], '{1:123, 4:345}', '{1:123, 2:456}');
replace into test_sparse_vec_tbl values(3, true, 1, 1, 1.3, 1, '2020-01-01', 'abc', 'abc', '{"a":1}', ST_GeomFromText('POINT(1 1)'), [1,2,3,4,5], [1,2,3,4,5], [1,2,3,4,5], [1,2,3,4,5], '{1:123, 4:345}', '{60:1.23, 80:4.56}');
select id, c1, c11, c13, c16 from test_sparse_vec_tbl order by id;
id	c1	c11	c13	c16
1	1	[1,2,3,4,5]	[1,2,3,4,5]	{1:123,2:456}
2	1	[1,2,3,4,5]	[1,2,3,4,5]	{1:123,2:456}
3	1	[1,2,3,4,5]	[1,2,3,4,5]	{60:1.23,80:4.56}
select /*+read_consistency(weak) */ id, c11, c13, c16 from test_sparse_vec_tbl order by id;
id	c11	c13	c16
1	[1,2,3,4,5]	[1,2,3,4,5]	{1:123,2:456}
2	[1,2,3,4,5]	[1,2,3,4,5]	{1:123,2:456}
3	[1,2,3,4,5]	[1,2,3,4,5]	{60:1.23,80:4.56}
drop table if exists test_sparse_vec_tbl_2;
create table test_sparse_vec_tbl_2 (
id int, c1 bool, c2 int, c3 decimal, c4 float, c5 bit, 
c6 date, c7 varchar(10), c8 text, c9 json, c10 GEOMETRY,
c11 array(int), c12 vector(5), c13 vector(5), c14 vector(5), c15 map(int, int), c16 sparsevector, 
vector index idx1(c16) with (distance=inner_product, type=sindi, lib=vsag));
insert into test_sparse_vec_tbl_2 select * from test_sparse_vec_tbl;
select id, c1, c11, c13, c16 from test_sparse_vec_tbl_2 order by id;
id	c1	c11	c13	c16
1	1	[1,2,3,4,5]	[1,2,3,4,5]	{1:123,2:456}
2	1	[1,2,3,4,5]	[1,2,3,4,5]	{1:123,2:456}
3	1	[1,2,3,4,5]	[1,2,3,4,5]	{60:1.23,80:4.56}
delete from test_sparse_vec_tbl_2;
alter system set direct_load_allow_fallback=FALSE;
insert /*+ direct(true,100) enable_parallel_dml parallel(2) append*/ into test_sparse_vec_tbl_2 select * from test_sparse_vec_tbl;
ERROR 0A000: direct-load does not support table with vector index
insert /*+ direct(true,100,'inc') enable_parallel_dml parallel(2)*/  into test_sparse_vec_tbl_2 select * from test_sparse_vec_tbl;
ERROR 0A000: direct-load does not support table with vector index
alter system set direct_load_allow_fallback=TRUE;
insert /*+ direct(true,100) enable_parallel_dml parallel(2) append*/ into test_sparse_vec_tbl_2 select * from test_sparse_vec_tbl;
select id, c1, c11, c13, c16 from test_sparse_vec_tbl_2 order by id;
id	c1	c11	c13	c16
1	1	[1,2,3,4,5]	[1,2,3,4,5]	{1:123,2:456}
2	1	[1,2,3,4,5]	[1,2,3,4,5]	{1:123,2:456}
3	1	[1,2,3,4,5]	[1,2,3,4,5]	{60:1.23,80:4.56}
delete from test_sparse_vec_tbl_2;
insert /*+ direct(true,100,'inc') enable_parallel_dml parallel(2)*/  into test_sparse_vec_tbl_2 select * from test_sparse_vec_tbl;
select id, c1, c11, c13, c16 from test_sparse_vec_tbl_2 order by id;
id	c1	c11	c13	c16
1	1	[1,2,3,4,5]	[1,2,3,4,5]	{1:123,2:456}
2	1	[1,2,3,4,5]	[1,2,3,4,5]	{1:123,2:456}
3	1	[1,2,3,4,5]	[1,2,3,4,5]	{60:1.23,80:4.56}
drop table if exists test_sparse_vec_tbl_2;
alter system major freeze;
select id, c1, c11, c13, c16 from test_sparse_vec_tbl order by id;
id	c1	c11	c13	c16
1	1	[1,2,3,4,5]	[1,2,3,4,5]	{1:123,2:456}
2	1	[1,2,3,4,5]	[1,2,3,4,5]	{1:123,2:456}
3	1	[1,2,3,4,5]	[1,2,3,4,5]	{60:1.23,80:4.56}
update test_sparse_vec_tbl set c16 = '{1:1.5, 2:3, 5:6, 100:10}' where id = 1;
select id, c1, c11, c13, c16 from test_sparse_vec_tbl order by id;
id	c1	c11	c13	c16
1	1	[1,2,3,4,5]	[1,2,3,4,5]	{1:1.5,2:3,5:6,100:10}
2	1	[1,2,3,4,5]	[1,2,3,4,5]	{1:123,2:456}
3	1	[1,2,3,4,5]	[1,2,3,4,5]	{60:1.23,80:4.56}
delete from test_sparse_vec_tbl where id < 4;
delete /*+ ENABLE_PARALLEL_DML parallel(2) */ from test_sparse_vec_tbl where id < 6;
select id, c1, c11, c13, c16 from test_sparse_vec_tbl;
id	c1	c11	c13	c16
delete from test_sparse_vec_tbl where c16 is null;
delete from test_sparse_vec_tbl where c16 is not null;
select id, c1, c11, c13, c16 from test_sparse_vec_tbl;
id	c1	c11	c13	c16
insert into test_sparse_vec_tbl values(1, true, 1, 1, 1.3, 1, '2020-01-01', 'abc', 'abc', '{"a":1}', ST_GeomFromText('POINT(1 1)'), [1,2,3,4,5], [1,2,3,4,5], [1,2,3,4,5], [1,2,3,4,5], '{1:123, 4:345}', '{1:123, 2:456}');
insert into test_sparse_vec_tbl values(2, true, 1, 1, 1.3, 1, '2020-01-01', 'abc', 'abc', '{"a":1}', ST_GeomFromText('POINT(1 1)'), [1,2,3,4,5], [1,2,3,4,5], [1,2,3,4,5], [1,2,3,4,5], '{1:123, 4:345}', null);
select id, c1, c11, c13, c16 from test_sparse_vec_tbl order by id;
id	c1	c11	c13	c16
1	1	[1,2,3,4,5]	[1,2,3,4,5]	{1:123,2:456}
2	1	[1,2,3,4,5]	[1,2,3,4,5]	NULL
truncate table test_sparse_vec_tbl;
drop table if exists test_sparse_vec_tbl;
create table test_sparse_vec_tbl (
id int primary key, c1 bool, c2 int, c3 decimal, c4 float, c5 bit, 
c6 date, c7 varchar(10), c8 text, c9 json, c10 GEOMETRY,
c11 array(int), c12 vector(5), c13 vector(5), c14 vector(5), c15 map(int, int), c16 sparsevector, 
vector index idx1(c16) with (distance=inner_product, type=sindi, lib=vsag),
vector index idx_c12(c12) with (distance=l2, type=ivf_pq, nlist=2, sample_per_nlist=3, m=5));
create vector index idx_c13 on test_sparse_vec_tbl(c13) with (distance=l2, type=ivf_sq8, nlist=2, sample_per_nlist=3);
create vector index idx_c14 on test_sparse_vec_tbl(c14) with (distance=l2, type=ivf_flat, nlist=2, sample_per_nlist=3);
# ----------------------------------------------------------------------
# Test of sparse vector index
# ----------------------------------------------------------------------
insert into test_sparse_vec_tbl values(1, true, 1, 1, 1.3, 1, '2020-01-01', 'abc', 'abc', '{"a":1}', ST_GeomFromText('POINT(1 1)'), [1,2,3,4,5], [1,2,3,4,5], [1,2,3,4,5], [1,2,3,4,5], '{1:123, 4:345}', '{1:123, 2:456}');
insert into test_sparse_vec_tbl values(2, true, 1, 1, 1.3, 1, '2020-01-01', 'abc', 'abc', '{"a":1}', ST_GeomFromText('POINT(1 1)'), [1,2,3,4,5], [1,2,3,4,5], [1,2,3,4,5], [1,2,3,4,5], '{1:123, 4:345}', '{1:123, 2:456}');
select id, c1, c11, c13, c16 from test_sparse_vec_tbl order by id;
id	c1	c11	c13	c16
1	1	[1,2,3,4,5]	[1,2,3,4,5]	{1:123,2:456}
2	1	[1,2,3,4,5]	[1,2,3,4,5]	{1:123,2:456}
insert into test_sparse_vec_tbl values(1, true, 1, 1, 1.3, 1, '2020-01-01', 'abc', 'abc', '{"a":1}', ST_GeomFromText('POINT(1 1)'), [1,2,3,4,5], [1,2,3,4,5], [1,2,3,4,5], [1,2,3,4,5], '{1:123, 4:345}', '{1:123, 2:456}') on duplicate key update c1 = false;
insert into test_sparse_vec_tbl values(1, true, 1, 1, 1.3, 1, '2020-01-01', 'abc', 'abc', '{"a":1}', ST_GeomFromText('POINT(1 1)'), [1,2,3,4,5], [1,2,3,4,5], [1,2,3,4,5], [1,2,3,4,5], '{1:123, 4:345}', '{1:123, 2:456}') on duplicate key update c16 = null;
insert into test_sparse_vec_tbl values(1, true, 1, 1, 1.3, 1, '2020-01-01', 'abc', 'abc', '{"a":1}', ST_GeomFromText('POINT(1 1)'), [1,2,3,4,5], [1,2,3,4,5], [1,2,3,4,5], [1,2,3,4,5], '{1:123, 4:345}', '{1:123, 2:456}') on duplicate key update c16 = '{1:3.4, 5:4.5}';
select id, c1, c11, c13, c16 from test_sparse_vec_tbl order by id;
id	c1	c11	c13	c16
1	0	[1,2,3,4,5]	[1,2,3,4,5]	{1:3.4,5:4.5}
2	1	[1,2,3,4,5]	[1,2,3,4,5]	{1:123,2:456}
insert IGNORE into test_sparse_vec_tbl values(1, true, 1, 1, 1.3, 1, '2020-01-01', 'abc', 'abc', '{"a":1}', ST_GeomFromText('POINT(1 1)'), [1,2,4,4,5], [1,2,4,4,5], [1,2,4,4,5], [1,2,4,4,5], '{1:123, 4:345}', '{1:123, 2:456}');
select id, c1, c11, c13, c16 from test_sparse_vec_tbl order by id;
id	c1	c11	c13	c16
1	0	[1,2,3,4,5]	[1,2,3,4,5]	{1:3.4,5:4.5}
2	1	[1,2,3,4,5]	[1,2,3,4,5]	{1:123,2:456}
replace into test_sparse_vec_tbl values(1, true, 1, 1, 1.3, 1, '2020-01-01', 'abc', 'abc', '{"a":1}', ST_GeomFromText('POINT(1 1)'), [1,2,3,4,5], [1,2,3,4,5], [1,2,3,4,5], [1,2,3,4,5], '{1:123, 4:345}', '{1:123, 2:456}');
replace into test_sparse_vec_tbl values(3, true, 1, 1, 1.3, 1, '2020-01-01', 'abc', 'abc', '{"a":1}', ST_GeomFromText('POINT(1 1)'), [1,2,3,4,5], [1,2,3,4,5], [1,2,3,4,5], [1,2,3,4,5], '{1:123, 4:345}', '{60:1.23, 80:4.56}');
select id, c1, c11, c13, c16 from test_sparse_vec_tbl order by id;
id	c1	c11	c13	c16
1	1	[1,2,3,4,5]	[1,2,3,4,5]	{1:123,2:456}
2	1	[1,2,3,4,5]	[1,2,3,4,5]	{1:123,2:456}
3	1	[1,2,3,4,5]	[1,2,3,4,5]	{60:1.23,80:4.56}
select /*+read_consistency(weak) */ id, c11, c13, c16 from test_sparse_vec_tbl order by id;
id	c11	c13	c16
1	[1,2,3,4,5]	[1,2,3,4,5]	{1:123,2:456}
2	[1,2,3,4,5]	[1,2,3,4,5]	{1:123,2:456}
3	[1,2,3,4,5]	[1,2,3,4,5]	{60:1.23,80:4.56}
drop table if exists test_sparse_vec_tbl_2;
create table test_sparse_vec_tbl_2 (
id int, c1 bool, c2 int, c3 decimal, c4 float, c5 bit, 
c6 date, c7 varchar(10), c8 text, c9 json, c10 GEOMETRY,
c11 array(int), c12 vector(5), c13 vector(5), c14 vector(5), c15 map(int, int), c16 sparsevector, 
vector index idx1(c16) with (distance=inner_product, type=sindi, lib=vsag));
insert into test_sparse_vec_tbl_2 select * from test_sparse_vec_tbl;
select id, c1, c11, c13, c16 from test_sparse_vec_tbl_2 order by id;
id	c1	c11	c13	c16
1	1	[1,2,3,4,5]	[1,2,3,4,5]	{1:123,2:456}
2	1	[1,2,3,4,5]	[1,2,3,4,5]	{1:123,2:456}
3	1	[1,2,3,4,5]	[1,2,3,4,5]	{60:1.23,80:4.56}
delete from test_sparse_vec_tbl_2;
alter system set direct_load_allow_fallback=FALSE;
insert /*+ direct(true,100) enable_parallel_dml parallel(2) append*/ into test_sparse_vec_tbl_2 select * from test_sparse_vec_tbl;
ERROR 0A000: direct-load does not support table with vector index
insert /*+ direct(true,100,'inc') enable_parallel_dml parallel(2)*/  into test_sparse_vec_tbl_2 select * from test_sparse_vec_tbl;
ERROR 0A000: direct-load does not support table with vector index
alter system set direct_load_allow_fallback=TRUE;
insert /*+ direct(true,100) enable_parallel_dml parallel(2) append*/ into test_sparse_vec_tbl_2 select * from test_sparse_vec_tbl;
select id, c1, c11, c13, c16 from test_sparse_vec_tbl_2 order by id;
id	c1	c11	c13	c16
1	1	[1,2,3,4,5]	[1,2,3,4,5]	{1:123,2:456}
2	1	[1,2,3,4,5]	[1,2,3,4,5]	{1:123,2:456}
3	1	[1,2,3,4,5]	[1,2,3,4,5]	{60:1.23,80:4.56}
delete from test_sparse_vec_tbl_2;
insert /*+ direct(true,100,'inc') enable_parallel_dml parallel(2)*/  into test_sparse_vec_tbl_2 select * from test_sparse_vec_tbl;
select id, c1, c11, c13, c16 from test_sparse_vec_tbl_2 order by id;
id	c1	c11	c13	c16
1	1	[1,2,3,4,5]	[1,2,3,4,5]	{1:123,2:456}
2	1	[1,2,3,4,5]	[1,2,3,4,5]	{1:123,2:456}
3	1	[1,2,3,4,5]	[1,2,3,4,5]	{60:1.23,80:4.56}
drop table if exists test_sparse_vec_tbl_2;
alter system major freeze;
select id, c1, c11, c13, c16 from test_sparse_vec_tbl order by id;
id	c1	c11	c13	c16
1	1	[1,2,3,4,5]	[1,2,3,4,5]	{1:123,2:456}
2	1	[1,2,3,4,5]	[1,2,3,4,5]	{1:123,2:456}
3	1	[1,2,3,4,5]	[1,2,3,4,5]	{60:1.23,80:4.56}
update test_sparse_vec_tbl set c16 = '{1:1.5, 2:3, 5:6, 100:10}' where id = 1;
select id, c1, c11, c13, c16 from test_sparse_vec_tbl order by id;
id	c1	c11	c13	c16
1	1	[1,2,3,4,5]	[1,2,3,4,5]	{1:1.5,2:3,5:6,100:10}
2	1	[1,2,3,4,5]	[1,2,3,4,5]	{1:123,2:456}
3	1	[1,2,3,4,5]	[1,2,3,4,5]	{60:1.23,80:4.56}
delete from test_sparse_vec_tbl where id < 4;
delete /*+ ENABLE_PARALLEL_DML parallel(2) */ from test_sparse_vec_tbl where id < 6;
select id, c1, c11, c13, c16 from test_sparse_vec_tbl;
id	c1	c11	c13	c16
delete from test_sparse_vec_tbl where c16 is null;
delete from test_sparse_vec_tbl where c16 is not null;
select id, c1, c11, c13, c16 from test_sparse_vec_tbl;
id	c1	c11	c13	c16
insert into test_sparse_vec_tbl values(1, true, 1, 1, 1.3, 1, '2020-01-01', 'abc', 'abc', '{"a":1}', ST_GeomFromText('POINT(1 1)'), [1,2,3,4,5], [1,2,3,4,5], [1,2,3,4,5], [1,2,3,4,5], '{1:123, 4:345}', '{1:123, 2:456}');
insert into test_sparse_vec_tbl values(2, true, 1, 1, 1.3, 1, '2020-01-01', 'abc', 'abc', '{"a":1}', ST_GeomFromText('POINT(1 1)'), [1,2,3,4,5], [1,2,3,4,5], [1,2,3,4,5], [1,2,3,4,5], '{1:123, 4:345}', null);
select id, c1, c11, c13, c16 from test_sparse_vec_tbl order by id;
id	c1	c11	c13	c16
1	1	[1,2,3,4,5]	[1,2,3,4,5]	{1:123,2:456}
2	1	[1,2,3,4,5]	[1,2,3,4,5]	NULL
truncate table test_sparse_vec_tbl;
drop table if exists test_sparse_vec_tbl;
create table test_sparse_vec_tbl (
id int primary key, c1 bool, c2 int, c3 decimal, c4 float, c5 bit, 
c6 date, c7 varchar(10), c8 text, c9 json, c10 GEOMETRY,
c11 array(int), c12 vector(5), c13 vector(5), c14 vector(5), c15 map(int, int), c16 sparsevector, 
vector index idx1(c16) with (distance=inner_product, type=sindi, lib=vsag)) partition by hash(id) partitions 3;
# ----------------------------------------------------------------------
# Test of sparse vector index
# ----------------------------------------------------------------------
insert into test_sparse_vec_tbl values(1, true, 1, 1, 1.3, 1, '2020-01-01', 'abc', 'abc', '{"a":1}', ST_GeomFromText('POINT(1 1)'), [1,2,3,4,5], [1,2,3,4,5], [1,2,3,4,5], [1,2,3,4,5], '{1:123, 4:345}', '{1:123, 2:456}');
insert into test_sparse_vec_tbl values(2, true, 1, 1, 1.3, 1, '2020-01-01', 'abc', 'abc', '{"a":1}', ST_GeomFromText('POINT(1 1)'), [1,2,3,4,5], [1,2,3,4,5], [1,2,3,4,5], [1,2,3,4,5], '{1:123, 4:345}', '{1:123, 2:456}');
select id, c1, c11, c13, c16 from test_sparse_vec_tbl order by id;
id	c1	c11	c13	c16
1	1	[1,2,3,4,5]	[1,2,3,4,5]	{1:123,2:456}
2	1	[1,2,3,4,5]	[1,2,3,4,5]	{1:123,2:456}
insert into test_sparse_vec_tbl values(1, true, 1, 1, 1.3, 1, '2020-01-01', 'abc', 'abc', '{"a":1}', ST_GeomFromText('POINT(1 1)'), [1,2,3,4,5], [1,2,3,4,5], [1,2,3,4,5], [1,2,3,4,5], '{1:123, 4:345}', '{1:123, 2:456}') on duplicate key update c1 = false;
insert into test_sparse_vec_tbl values(1, true, 1, 1, 1.3, 1, '2020-01-01', 'abc', 'abc', '{"a":1}', ST_GeomFromText('POINT(1 1)'), [1,2,3,4,5], [1,2,3,4,5], [1,2,3,4,5], [1,2,3,4,5], '{1:123, 4:345}', '{1:123, 2:456}') on duplicate key update c16 = null;
insert into test_sparse_vec_tbl values(1, true, 1, 1, 1.3, 1, '2020-01-01', 'abc', 'abc', '{"a":1}', ST_GeomFromText('POINT(1 1)'), [1,2,3,4,5], [1,2,3,4,5], [1,2,3,4,5], [1,2,3,4,5], '{1:123, 4:345}', '{1:123, 2:456}') on duplicate key update c16 = '{1:3.4, 5:4.5}';
select id, c1, c11, c13, c16 from test_sparse_vec_tbl order by id;
id	c1	c11	c13	c16
1	0	[1,2,3,4,5]	[1,2,3,4,5]	{1:3.4,5:4.5}
2	1	[1,2,3,4,5]	[1,2,3,4,5]	{1:123,2:456}
insert IGNORE into test_sparse_vec_tbl values(1, true, 1, 1, 1.3, 1, '2020-01-01', 'abc', 'abc', '{"a":1}', ST_GeomFromText('POINT(1 1)'), [1,2,4,4,5], [1,2,4,4,5], [1,2,4,4,5], [1,2,4,4,5], '{1:123, 4:345}', '{1:123, 2:456}');
select id, c1, c11, c13, c16 from test_sparse_vec_tbl order by id;
id	c1	c11	c13	c16
1	0	[1,2,3,4,5]	[1,2,3,4,5]	{1:3.4,5:4.5}
2	1	[1,2,3,4,5]	[1,2,3,4,5]	{1:123,2:456}
replace into test_sparse_vec_tbl values(1, true, 1, 1, 1.3, 1, '2020-01-01', 'abc', 'abc', '{"a":1}', ST_GeomFromText('POINT(1 1)'), [1,2,3,4,5], [1,2,3,4,5], [1,2,3,4,5], [1,2,3,4,5], '{1:123, 4:345}', '{1:123, 2:456}');
replace into test_sparse_vec_tbl values(3, true, 1, 1, 1.3, 1, '2020-01-01', 'abc', 'abc', '{"a":1}', ST_GeomFromText('POINT(1 1)'), [1,2,3,4,5], [1,2,3,4,5], [1,2,3,4,5], [1,2,3,4,5], '{1:123, 4:345}', '{60:1.23, 80:4.56}');
select id, c1, c11, c13, c16 from test_sparse_vec_tbl order by id;
id	c1	c11	c13	c16
1	1	[1,2,3,4,5]	[1,2,3,4,5]	{1:123,2:456}
2	1	[1,2,3,4,5]	[1,2,3,4,5]	{1:123,2:456}
3	1	[1,2,3,4,5]	[1,2,3,4,5]	{60:1.23,80:4.56}
select /*+read_consistency(weak) */ id, c11, c13, c16 from test_sparse_vec_tbl order by id;
id	c11	c13	c16
1	[1,2,3,4,5]	[1,2,3,4,5]	{1:123,2:456}
2	[1,2,3,4,5]	[1,2,3,4,5]	{1:123,2:456}
3	[1,2,3,4,5]	[1,2,3,4,5]	{60:1.23,80:4.56}
drop table if exists test_sparse_vec_tbl_2;
create table test_sparse_vec_tbl_2 (
id int, c1 bool, c2 int, c3 decimal, c4 float, c5 bit, 
c6 date, c7 varchar(10), c8 text, c9 json, c10 GEOMETRY,
c11 array(int), c12 vector(5), c13 vector(5), c14 vector(5), c15 map(int, int), c16 sparsevector, 
vector index idx1(c16) with (distance=inner_product, type=sindi, lib=vsag));
insert into test_sparse_vec_tbl_2 select * from test_sparse_vec_tbl;
select id, c1, c11, c13, c16 from test_sparse_vec_tbl_2 order by id;
id	c1	c11	c13	c16
1	1	[1,2,3,4,5]	[1,2,3,4,5]	{1:123,2:456}
2	1	[1,2,3,4,5]	[1,2,3,4,5]	{1:123,2:456}
3	1	[1,2,3,4,5]	[1,2,3,4,5]	{60:1.23,80:4.56}
delete from test_sparse_vec_tbl_2;
alter system set direct_load_allow_fallback=FALSE;
insert /*+ direct(true,100) enable_parallel_dml parallel(2) append*/ into test_sparse_vec_tbl_2 select * from test_sparse_vec_tbl;
ERROR 0A000: direct-load does not support table with vector index
insert /*+ direct(true,100,'inc') enable_parallel_dml parallel(2)*/  into test_sparse_vec_tbl_2 select * from test_sparse_vec_tbl;
ERROR 0A000: direct-load does not support table with vector index
alter system set direct_load_allow_fallback=TRUE;
insert /*+ direct(true,100) enable_parallel_dml parallel(2) append*/ into test_sparse_vec_tbl_2 select * from test_sparse_vec_tbl;
select id, c1, c11, c13, c16 from test_sparse_vec_tbl_2 order by id;
id	c1	c11	c13	c16
1	1	[1,2,3,4,5]	[1,2,3,4,5]	{1:123,2:456}
2	1	[1,2,3,4,5]	[1,2,3,4,5]	{1:123,2:456}
3	1	[1,2,3,4,5]	[1,2,3,4,5]	{60:1.23,80:4.56}
delete from test_sparse_vec_tbl_2;
insert /*+ direct(true,100,'inc') enable_parallel_dml parallel(2)*/  into test_sparse_vec_tbl_2 select * from test_sparse_vec_tbl;
select id, c1, c11, c13, c16 from test_sparse_vec_tbl_2 order by id;
id	c1	c11	c13	c16
1	1	[1,2,3,4,5]	[1,2,3,4,5]	{1:123,2:456}
2	1	[1,2,3,4,5]	[1,2,3,4,5]	{1:123,2:456}
3	1	[1,2,3,4,5]	[1,2,3,4,5]	{60:1.23,80:4.56}
drop table if exists test_sparse_vec_tbl_2;
alter system major freeze;
select id, c1, c11, c13, c16 from test_sparse_vec_tbl order by id;
id	c1	c11	c13	c16
1	1	[1,2,3,4,5]	[1,2,3,4,5]	{1:123,2:456}
2	1	[1,2,3,4,5]	[1,2,3,4,5]	{1:123,2:456}
3	1	[1,2,3,4,5]	[1,2,3,4,5]	{60:1.23,80:4.56}
update test_sparse_vec_tbl set c16 = '{1:1.5, 2:3, 5:6, 100:10}' where id = 1;
select id, c1, c11, c13, c16 from test_sparse_vec_tbl order by id;
id	c1	c11	c13	c16
1	1	[1,2,3,4,5]	[1,2,3,4,5]	{1:1.5,2:3,5:6,100:10}
2	1	[1,2,3,4,5]	[1,2,3,4,5]	{1:123,2:456}
3	1	[1,2,3,4,5]	[1,2,3,4,5]	{60:1.23,80:4.56}
delete from test_sparse_vec_tbl where id < 4;
delete /*+ ENABLE_PARALLEL_DML parallel(2) */ from test_sparse_vec_tbl where id < 6;
select id, c1, c11, c13, c16 from test_sparse_vec_tbl;
id	c1	c11	c13	c16
delete from test_sparse_vec_tbl where c16 is null;
delete from test_sparse_vec_tbl where c16 is not null;
select id, c1, c11, c13, c16 from test_sparse_vec_tbl;
id	c1	c11	c13	c16
insert into test_sparse_vec_tbl values(1, true, 1, 1, 1.3, 1, '2020-01-01', 'abc', 'abc', '{"a":1}', ST_GeomFromText('POINT(1 1)'), [1,2,3,4,5], [1,2,3,4,5], [1,2,3,4,5], [1,2,3,4,5], '{1:123, 4:345}', '{1:123, 2:456}');
insert into test_sparse_vec_tbl values(2, true, 1, 1, 1.3, 1, '2020-01-01', 'abc', 'abc', '{"a":1}', ST_GeomFromText('POINT(1 1)'), [1,2,3,4,5], [1,2,3,4,5], [1,2,3,4,5], [1,2,3,4,5], '{1:123, 4:345}', null);
select id, c1, c11, c13, c16 from test_sparse_vec_tbl order by id;
id	c1	c11	c13	c16
1	1	[1,2,3,4,5]	[1,2,3,4,5]	{1:123,2:456}
2	1	[1,2,3,4,5]	[1,2,3,4,5]	NULL
truncate table test_sparse_vec_tbl;
drop table if exists test_sparse_vec_tbl;
create table test_sparse_vec_tbl (
id int primary key, c1 bool, c2 int, c3 decimal, c4 float, c5 bit, 
c6 date, c7 varchar(10), c8 text, c9 json, c10 GEOMETRY,
c11 array(int), c12 vector(5), c13 vector(5), c14 vector(5), c15 map(int, int), c16 sparsevector,
vector index idx1(c16) with (distance=inner_product, type=sindi, lib=vsag)) duplicate_scope='cluster';
# ----------------------------------------------------------------------
# Test of sparse vector index
# ----------------------------------------------------------------------
insert into test_sparse_vec_tbl values(1, true, 1, 1, 1.3, 1, '2020-01-01', 'abc', 'abc', '{"a":1}', ST_GeomFromText('POINT(1 1)'), [1,2,3,4,5], [1,2,3,4,5], [1,2,3,4,5], [1,2,3,4,5], '{1:123, 4:345}', '{1:123, 2:456}');
insert into test_sparse_vec_tbl values(2, true, 1, 1, 1.3, 1, '2020-01-01', 'abc', 'abc', '{"a":1}', ST_GeomFromText('POINT(1 1)'), [1,2,3,4,5], [1,2,3,4,5], [1,2,3,4,5], [1,2,3,4,5], '{1:123, 4:345}', '{1:123, 2:456}');
select id, c1, c11, c13, c16 from test_sparse_vec_tbl order by id;
id	c1	c11	c13	c16
1	1	[1,2,3,4,5]	[1,2,3,4,5]	{1:123,2:456}
2	1	[1,2,3,4,5]	[1,2,3,4,5]	{1:123,2:456}
insert into test_sparse_vec_tbl values(1, true, 1, 1, 1.3, 1, '2020-01-01', 'abc', 'abc', '{"a":1}', ST_GeomFromText('POINT(1 1)'), [1,2,3,4,5], [1,2,3,4,5], [1,2,3,4,5], [1,2,3,4,5], '{1:123, 4:345}', '{1:123, 2:456}') on duplicate key update c1 = false;
insert into test_sparse_vec_tbl values(1, true, 1, 1, 1.3, 1, '2020-01-01', 'abc', 'abc', '{"a":1}', ST_GeomFromText('POINT(1 1)'), [1,2,3,4,5], [1,2,3,4,5], [1,2,3,4,5], [1,2,3,4,5], '{1:123, 4:345}', '{1:123, 2:456}') on duplicate key update c16 = null;
insert into test_sparse_vec_tbl values(1, true, 1, 1, 1.3, 1, '2020-01-01', 'abc', 'abc', '{"a":1}', ST_GeomFromText('POINT(1 1)'), [1,2,3,4,5], [1,2,3,4,5], [1,2,3,4,5], [1,2,3,4,5], '{1:123, 4:345}', '{1:123, 2:456}') on duplicate key update c16 = '{1:3.4, 5:4.5}';
select id, c1, c11, c13, c16 from test_sparse_vec_tbl order by id;
id	c1	c11	c13	c16
1	0	[1,2,3,4,5]	[1,2,3,4,5]	{1:3.4,5:4.5}
2	1	[1,2,3,4,5]	[1,2,3,4,5]	{1:123,2:456}
insert IGNORE into test_sparse_vec_tbl values(1, true, 1, 1, 1.3, 1, '2020-01-01', 'abc', 'abc', '{"a":1}', ST_GeomFromText('POINT(1 1)'), [1,2,4,4,5], [1,2,4,4,5], [1,2,4,4,5], [1,2,4,4,5], '{1:123, 4:345}', '{1:123, 2:456}');
select id, c1, c11, c13, c16 from test_sparse_vec_tbl order by id;
id	c1	c11	c13	c16
1	0	[1,2,3,4,5]	[1,2,3,4,5]	{1:3.4,5:4.5}
2	1	[1,2,3,4,5]	[1,2,3,4,5]	{1:123,2:456}
replace into test_sparse_vec_tbl values(1, true, 1, 1, 1.3, 1, '2020-01-01', 'abc', 'abc', '{"a":1}', ST_GeomFromText('POINT(1 1)'), [1,2,3,4,5], [1,2,3,4,5], [1,2,3,4,5], [1,2,3,4,5], '{1:123, 4:345}', '{1:123, 2:456}');
replace into test_sparse_vec_tbl values(3, true, 1, 1, 1.3, 1, '2020-01-01', 'abc', 'abc', '{"a":1}', ST_GeomFromText('POINT(1 1)'), [1,2,3,4,5], [1,2,3,4,5], [1,2,3,4,5], [1,2,3,4,5], '{1:123, 4:345}', '{60:1.23, 80:4.56}');
select id, c1, c11, c13, c16 from test_sparse_vec_tbl order by id;
id	c1	c11	c13	c16
1	1	[1,2,3,4,5]	[1,2,3,4,5]	{1:123,2:456}
2	1	[1,2,3,4,5]	[1,2,3,4,5]	{1:123,2:456}
3	1	[1,2,3,4,5]	[1,2,3,4,5]	{60:1.23,80:4.56}
select /*+read_consistency(weak) */ id, c11, c13, c16 from test_sparse_vec_tbl order by id;
id	c11	c13	c16
1	[1,2,3,4,5]	[1,2,3,4,5]	{1:123,2:456}
2	[1,2,3,4,5]	[1,2,3,4,5]	{1:123,2:456}
3	[1,2,3,4,5]	[1,2,3,4,5]	{60:1.23,80:4.56}
drop table if exists test_sparse_vec_tbl_2;
create table test_sparse_vec_tbl_2 (
id int, c1 bool, c2 int, c3 decimal, c4 float, c5 bit, 
c6 date, c7 varchar(10), c8 text, c9 json, c10 GEOMETRY,
c11 array(int), c12 vector(5), c13 vector(5), c14 vector(5), c15 map(int, int), c16 sparsevector, 
vector index idx1(c16) with (distance=inner_product, type=sindi, lib=vsag));
insert into test_sparse_vec_tbl_2 select * from test_sparse_vec_tbl;
select id, c1, c11, c13, c16 from test_sparse_vec_tbl_2 order by id;
id	c1	c11	c13	c16
1	1	[1,2,3,4,5]	[1,2,3,4,5]	{1:123,2:456}
2	1	[1,2,3,4,5]	[1,2,3,4,5]	{1:123,2:456}
3	1	[1,2,3,4,5]	[1,2,3,4,5]	{60:1.23,80:4.56}
delete from test_sparse_vec_tbl_2;
alter system set direct_load_allow_fallback=FALSE;
insert /*+ direct(true,100) enable_parallel_dml parallel(2) append*/ into test_sparse_vec_tbl_2 select * from test_sparse_vec_tbl;
ERROR 0A000: direct-load does not support table with vector index
insert /*+ direct(true,100,'inc') enable_parallel_dml parallel(2)*/  into test_sparse_vec_tbl_2 select * from test_sparse_vec_tbl;
ERROR 0A000: direct-load does not support table with vector index
alter system set direct_load_allow_fallback=TRUE;
insert /*+ direct(true,100) enable_parallel_dml parallel(2) append*/ into test_sparse_vec_tbl_2 select * from test_sparse_vec_tbl;
select id, c1, c11, c13, c16 from test_sparse_vec_tbl_2 order by id;
id	c1	c11	c13	c16
1	1	[1,2,3,4,5]	[1,2,3,4,5]	{1:123,2:456}
2	1	[1,2,3,4,5]	[1,2,3,4,5]	{1:123,2:456}
3	1	[1,2,3,4,5]	[1,2,3,4,5]	{60:1.23,80:4.56}
delete from test_sparse_vec_tbl_2;
insert /*+ direct(true,100,'inc') enable_parallel_dml parallel(2)*/  into test_sparse_vec_tbl_2 select * from test_sparse_vec_tbl;
select id, c1, c11, c13, c16 from test_sparse_vec_tbl_2 order by id;
id	c1	c11	c13	c16
1	1	[1,2,3,4,5]	[1,2,3,4,5]	{1:123,2:456}
2	1	[1,2,3,4,5]	[1,2,3,4,5]	{1:123,2:456}
3	1	[1,2,3,4,5]	[1,2,3,4,5]	{60:1.23,80:4.56}
drop table if exists test_sparse_vec_tbl_2;
alter system major freeze;
select id, c1, c11, c13, c16 from test_sparse_vec_tbl order by id;
id	c1	c11	c13	c16
1	1	[1,2,3,4,5]	[1,2,3,4,5]	{1:123,2:456}
2	1	[1,2,3,4,5]	[1,2,3,4,5]	{1:123,2:456}
3	1	[1,2,3,4,5]	[1,2,3,4,5]	{60:1.23,80:4.56}
update test_sparse_vec_tbl set c16 = '{1:1.5, 2:3, 5:6, 100:10}' where id = 1;
select id, c1, c11, c13, c16 from test_sparse_vec_tbl order by id;
id	c1	c11	c13	c16
1	1	[1,2,3,4,5]	[1,2,3,4,5]	{1:1.5,2:3,5:6,100:10}
2	1	[1,2,3,4,5]	[1,2,3,4,5]	{1:123,2:456}
3	1	[1,2,3,4,5]	[1,2,3,4,5]	{60:1.23,80:4.56}
delete from test_sparse_vec_tbl where id < 4;
delete /*+ ENABLE_PARALLEL_DML parallel(2) */ from test_sparse_vec_tbl where id < 6;
select id, c1, c11, c13, c16 from test_sparse_vec_tbl;
id	c1	c11	c13	c16
delete from test_sparse_vec_tbl where c16 is null;
delete from test_sparse_vec_tbl where c16 is not null;
select id, c1, c11, c13, c16 from test_sparse_vec_tbl;
id	c1	c11	c13	c16
insert into test_sparse_vec_tbl values(1, true, 1, 1, 1.3, 1, '2020-01-01', 'abc', 'abc', '{"a":1}', ST_GeomFromText('POINT(1 1)'), [1,2,3,4,5], [1,2,3,4,5], [1,2,3,4,5], [1,2,3,4,5], '{1:123, 4:345}', '{1:123, 2:456}');
insert into test_sparse_vec_tbl values(2, true, 1, 1, 1.3, 1, '2020-01-01', 'abc', 'abc', '{"a":1}', ST_GeomFromText('POINT(1 1)'), [1,2,3,4,5], [1,2,3,4,5], [1,2,3,4,5], [1,2,3,4,5], '{1:123, 4:345}', null);
select id, c1, c11, c13, c16 from test_sparse_vec_tbl order by id;
id	c1	c11	c13	c16
1	1	[1,2,3,4,5]	[1,2,3,4,5]	{1:123,2:456}
2	1	[1,2,3,4,5]	[1,2,3,4,5]	NULL
truncate table test_sparse_vec_tbl;
drop table if exists test_sparse_vec_tbl;
