alter system set debug_sync_timeout = '100s';
set ob_global_debug_sync = 'reset';
set ob_global_debug_sync = 'now signal continue_signal';
alter system set ob_vector_memory_limit_percentage = 30;


"========================= basic test of none partition table =========================="
set ob_global_debug_sync = 'reset';
set ob_global_debug_sync = 'HANDLE_VECTOR_INDEX_ASYNC_TASK wait_for continue_signal execute 10000';
drop table if exists t_async_task;
create table t_async_task(c1 int, c2 vector(3), primary key(c1));
create vector index idx_async_task on t_async_task(c2) with (distance=l2, type=hnsw);
insert into t_async_task values (1, '[1,1,1]'), (3, '[2,1,1]'), (11, '[3,1,1]');
select * from t_async_task order by l2_distance(c2, '[2,1,1]') approximate limit 1;
c1	c2
3	[2,1,1]
trigger_type	task_type	status	ret_code
0	1	1	-1
trigger_type	task_type	status	ret_code
USER	1	RUNNING	-1
trigger_type	task_type	status	ret_code
0	1	1	-1
trigger_type	task_type	status	ret_code
USER	1	RUNNING	-1
set ob_global_debug_sync = 'reset';
set ob_global_debug_sync = 'now signal continue_signal';
trigger_type	task_type	status	ret_code
0	1	3	0
trigger_type	task_type	status	ret_code
AUTO	1	FINISHED	0
trigger_type	task_type	status	ret_code
0	1	3	0
trigger_type	task_type	status	ret_code
AUTO	1	FINISHED	0
drop table t_async_task;
trigger_type	task_type	status	ret_code
AUTO	1	FINISHED	0
set ob_global_debug_sync = 'reset';
set ob_global_debug_sync = 'HANDLE_VECTOR_INDEX_ASYNC_TASK wait_for continue_signal execute 10000';
drop table if exists t_async_task;
create table t_async_task(c1 int, c2 vector(3), primary key(c1));
insert into t_async_task values (1, '[1,1,1]'), (3, '[2,1,1]'), (11, '[3,1,1]');
create vector index idx_async_task on t_async_task(c2) with (distance=l2, type=hnsw);
delete from t_async_task where c1=1;
select * from t_async_task order by l2_distance(c2, '[2,1,1]') approximate limit 1;
c1	c2
3	[2,1,1]
trigger_type	task_type	status	ret_code
0	1	1	-1
trigger_type	task_type	status	ret_code
USER	1	RUNNING	-1
trigger_type	task_type	status	ret_code
0	1	1	-1
trigger_type	task_type	status	ret_code
USER	1	RUNNING	-1
set ob_global_debug_sync = 'reset';
set ob_global_debug_sync = 'now signal continue_signal';
trigger_type	task_type	status	ret_code
0	1	3	0
trigger_type	task_type	status	ret_code
AUTO	1	FINISHED	0
trigger_type	task_type	status	ret_code
0	1	3	0
trigger_type	task_type	status	ret_code
AUTO	1	FINISHED	0
drop table t_async_task;
trigger_type	task_type	status	ret_code
AUTO	1	FINISHED	0


"========================= basic test of partition table =========================="
set ob_global_debug_sync = 'reset';
set ob_global_debug_sync = 'HANDLE_VECTOR_INDEX_ASYNC_TASK wait_for continue_signal execute 10000';
create table t_async_task(c1 int, c2 vector(3), primary key(c1)) partition by range(c1) (partition p0 values less than (5), partition p1 values less than (10));
create vector index idx_async_task on t_async_task(c2) with (distance=l2, type=hnsw);
insert into t_async_task values (1, '[1,1,1]'), (2, '[2,1,1]'), (3, '[3,1,1]');
insert into t_async_task values (6, '[6,1,1]'), (7, '[7,1,1]'), (8, '[8,1,1]');
select * from t_async_task order by l2_distance(c2, '[2,1,1]') approximate limit 1;
c1	c2
2	[2,1,1]
trigger_type	task_type	status	ret_code
0	1	1	-1
0	1	1	-1
trigger_type	task_type	status	ret_code
USER	1	RUNNING	-1
USER	1	RUNNING	-1
trigger_type	task_type	status	ret_code
0	1	1	-1
0	1	1	-1
trigger_type	task_type	status	ret_code
USER	1	RUNNING	-1
USER	1	RUNNING	-1
set ob_global_debug_sync = 'reset';
set ob_global_debug_sync = 'now signal continue_signal';
trigger_type	task_type	status	ret_code
0	1	3	0
0	1	3	0
trigger_type	task_type	status	ret_code
AUTO	1	FINISHED	0
AUTO	1	FINISHED	0
trigger_type	task_type	status	ret_code
0	1	3	0
0	1	3	0
trigger_type	task_type	status	ret_code
AUTO	1	FINISHED	0
AUTO	1	FINISHED	0
drop table t_async_task;
trigger_type	task_type	status	ret_code
AUTO	1	FINISHED	0
AUTO	1	FINISHED	0
set ob_global_debug_sync = 'reset';
set ob_global_debug_sync = 'HANDLE_VECTOR_INDEX_ASYNC_TASK wait_for continue_signal execute 10000';
create table t_async_task(c1 int, c2 vector(3), primary key(c1)) partition by range(c1) (partition p0 values less than (5), partition p1 values less than (10));
insert into t_async_task values (1, '[1,1,1]'), (2, '[2,1,1]'), (3, '[3,1,1]');
insert into t_async_task values (6, '[6,1,1]'), (7, '[7,1,1]'), (8, '[8,1,1]');
create vector index idx_async_task on t_async_task(c2) with (distance=l2, type=hnsw);
delete from t_async_task where c1=1;
delete from t_async_task where c1=6;
select * from t_async_task order by l2_distance(c2, '[2,1,1]') approximate limit 1;
c1	c2
2	[2,1,1]
trigger_type	task_type	status	ret_code
0	1	1	-1
0	1	1	-1
trigger_type	task_type	status	ret_code
USER	1	RUNNING	-1
USER	1	RUNNING	-1
trigger_type	task_type	status	ret_code
0	1	1	-1
0	1	1	-1
trigger_type	task_type	status	ret_code
USER	1	RUNNING	-1
USER	1	RUNNING	-1
set ob_global_debug_sync = 'reset';
set ob_global_debug_sync = 'now signal continue_signal';
trigger_type	task_type	status	ret_code
0	1	3	0
0	1	3	0
trigger_type	task_type	status	ret_code
AUTO	1	FINISHED	0
AUTO	1	FINISHED	0
trigger_type	task_type	status	ret_code
0	1	3	0
0	1	3	0
trigger_type	task_type	status	ret_code
AUTO	1	FINISHED	0
AUTO	1	FINISHED	0
drop table t_async_task;
trigger_type	task_type	status	ret_code
AUTO	1	FINISHED	0
AUTO	1	FINISHED	0


"========================= abnormal test of none partition table =========================="
set ob_global_debug_sync = 'reset';
set ob_global_debug_sync = 'HANDLE_VECTOR_INDEX_ASYNC_TASK wait_for continue_signal execute 10000';
drop table if exists t_async_task;
create table t_async_task(c1 int, c2 vector(3), primary key(c1));
create vector index idx_async_task on t_async_task(c2) with (distance=l2, type=hnsw);
insert into t_async_task values (1, '[1,1,1]'), (3, '[2,1,1]'), (11, '[3,1,1]');
delete from t_async_task where c1=1;
select * from t_async_task order by l2_distance(c2, '[2,1,1]') approximate limit 1;
c1	c2
3	[2,1,1]
trigger_type	task_type	status	ret_code
0	1	1	-1
trigger_type	task_type	status	ret_code
USER	1	RUNNING	-1
drop table t_async_task;
trigger_type	task_type	status	ret_code
0	1	1	-1
trigger_type	task_type	status	ret_code
USER	1	RUNNING	-1
set ob_global_debug_sync = 'reset';
set ob_global_debug_sync = 'now signal continue_signal';
trigger_type	task_type	status	ret_code
0	1	3	-4002
trigger_type	task_type	status	ret_code
AUTO	1	FINISHED	-4002
trigger_type	task_type	status	ret_code
0	1	3	-4002
trigger_type	task_type	status	ret_code
AUTO	1	FINISHED	-4002


"========================= abnormal test of partition table =========================="
set ob_global_debug_sync = 'reset';
set ob_global_debug_sync = 'HANDLE_VECTOR_INDEX_ASYNC_TASK wait_for continue_signal execute 10000';
create table t_async_task(c1 int, c2 vector(3), primary key(c1)) partition by range(c1) (partition p0 values less than (5), partition p1 values less than (10));
create vector index idx_async_task on t_async_task(c2) with (distance=l2, type=hnsw);
insert into t_async_task values (1, '[1,1,1]'), (2, '[2,1,1]'), (3, '[3,1,1]');
insert into t_async_task values (6, '[6,1,1]'), (7, '[7,1,1]'), (8, '[8,1,1]');
delete from t_async_task where c1=1;
delete from t_async_task where c1=6;
select * from t_async_task order by l2_distance(c2, '[2,1,1]') approximate limit 1;
c1	c2
2	[2,1,1]
trigger_type	task_type	status	ret_code
0	1	1	-1
0	1	1	-1
trigger_type	task_type	status	ret_code
USER	1	RUNNING	-1
USER	1	RUNNING	-1
drop table t_async_task;
trigger_type	task_type	status	ret_code
0	1	1	-1
0	1	1	-1
trigger_type	task_type	status	ret_code
USER	1	RUNNING	-1
USER	1	RUNNING	-1
set ob_global_debug_sync = 'reset';
set ob_global_debug_sync = 'now signal continue_signal';
trigger_type	task_type	status	ret_code
0	1	3	-4002
0	1	3	-4201
trigger_type	task_type	status	ret_code
AUTO	1	FINISHED	-4002
AUTO	1	FINISHED	-4201
trigger_type	task_type	status	ret_code
0	1	3	-4002
0	1	3	-4201
trigger_type	task_type	status	ret_code
AUTO	1	FINISHED	-4002
AUTO	1	FINISHED	-4201


"========================= clean all data test of none partition table =========================="
set ob_global_debug_sync = 'reset';
set ob_global_debug_sync = 'HANDLE_VECTOR_INDEX_ASYNC_TASK wait_for continue_signal execute 10000';
drop table if exists t_async_task;
create table t_async_task(c1 int, c2 vector(3), primary key(c1));
insert into t_async_task values (1, '[1,1,1]'), (3, '[2,1,1]'), (11, '[3,1,1]');
create vector index idx_async_task on t_async_task(c2) with (distance=l2, type=hnsw);
delete from t_async_task;
select * from t_async_task order by l2_distance(c2, '[2,1,1]') approximate limit 1;
c1	c2
trigger_type	task_type	status	ret_code
0	1	1	-1
trigger_type	task_type	status	ret_code
USER	1	RUNNING	-1
trigger_type	task_type	status	ret_code
0	1	1	-1
trigger_type	task_type	status	ret_code
USER	1	RUNNING	-1
set ob_global_debug_sync = 'reset';
set ob_global_debug_sync = 'now signal continue_signal';
trigger_type	task_type	status	ret_code
0	1	3	0
trigger_type	task_type	status	ret_code
AUTO	1	FINISHED	0
trigger_type	task_type	status	ret_code
0	1	3	0
trigger_type	task_type	status	ret_code
AUTO	1	FINISHED	0
drop table t_async_task;
trigger_type	task_type	status	ret_code
AUTO	1	FINISHED	0


"========================= clean all data test of partition table =========================="
set ob_global_debug_sync = 'reset';
set ob_global_debug_sync = 'HANDLE_VECTOR_INDEX_ASYNC_TASK wait_for continue_signal execute 10000';
create table t_async_task(c1 int, c2 vector(3), primary key(c1)) partition by range(c1) (partition p0 values less than (5), partition p1 values less than (10));
insert into t_async_task values (1, '[1,1,1]'), (2, '[2,1,1]'), (3, '[3,1,1]');
insert into t_async_task values (6, '[6,1,1]'), (7, '[7,1,1]'), (8, '[8,1,1]');
create vector index idx_async_task on t_async_task(c2) with (distance=l2, type=hnsw);
delete from t_async_task;
select * from t_async_task order by l2_distance(c2, '[2,1,1]') approximate limit 1;
c1	c2
trigger_type	task_type	status	ret_code
0	1	1	-1
0	1	1	-1
trigger_type	task_type	status	ret_code
USER	1	RUNNING	-1
USER	1	RUNNING	-1
trigger_type	task_type	status	ret_code
0	1	1	-1
0	1	1	-1
trigger_type	task_type	status	ret_code
USER	1	RUNNING	-1
USER	1	RUNNING	-1
set ob_global_debug_sync = 'reset';
set ob_global_debug_sync = 'now signal continue_signal';
trigger_type	task_type	status	ret_code
0	1	3	0
0	1	3	0
trigger_type	task_type	status	ret_code
AUTO	1	FINISHED	0
AUTO	1	FINISHED	0
trigger_type	task_type	status	ret_code
0	1	3	0
0	1	3	0
trigger_type	task_type	status	ret_code
AUTO	1	FINISHED	0
AUTO	1	FINISHED	0
drop table t_async_task;
trigger_type	task_type	status	ret_code
AUTO	1	FINISHED	0
AUTO	1	FINISHED	0


"========================= abnormal test of none partition table (drop index when task in execution) =========================="
set ob_global_debug_sync = 'reset';
set ob_global_debug_sync = 'HANDLE_VECTOR_INDEX_ASYNC_TASK wait_for continue_signal execute 10000';
drop table if exists t_async_task;
create table t_async_task(c1 int, c2 vector(3), primary key(c1));
create vector index idx_async_task on t_async_task(c2) with (distance=l2, type=hnsw);
insert into t_async_task values (1, '[1,1,1]'), (3, '[2,1,1]'), (11, '[3,1,1]');
delete from t_async_task where c1=1;
select * from t_async_task order by l2_distance(c2, '[2,1,1]') approximate limit 1;
c1	c2
3	[2,1,1]
trigger_type	task_type	status	ret_code
0	1	1	-1
trigger_type	task_type	status	ret_code
USER	1	RUNNING	-1
drop index idx_async_task on t_async_task;
trigger_type	task_type	status	ret_code
0	1	1	-1
trigger_type	task_type	status	ret_code
USER	1	RUNNING	-1
set ob_global_debug_sync = 'reset';
set ob_global_debug_sync = 'now signal continue_signal';
trigger_type	task_type	status	ret_code
0	1	3	-4016
trigger_type	task_type	status	ret_code
AUTO	1	FINISHED	-4016
trigger_type	task_type	status	ret_code
0	1	3	-4016
trigger_type	task_type	status	ret_code
AUTO	1	FINISHED	-4016
drop table t_async_task;
trigger_type	task_type	status	ret_code
AUTO	1	FINISHED	-4016


"========================= abnormal test of partition table (drop index when task in execution) =========================="
set ob_global_debug_sync = 'reset';
set ob_global_debug_sync = 'HANDLE_VECTOR_INDEX_ASYNC_TASK wait_for continue_signal execute 10000';
create table t_async_task(c1 int, c2 vector(3), primary key(c1)) partition by range(c1) (partition p0 values less than (5), partition p1 values less than (10));
create vector index idx_async_task on t_async_task(c2) with (distance=l2, type=hnsw);
insert into t_async_task values (1, '[1,1,1]'), (2, '[2,1,1]'), (3, '[3,1,1]');
insert into t_async_task values (6, '[6,1,1]'), (7, '[7,1,1]'), (8, '[8,1,1]');
delete from t_async_task where c1=1;
delete from t_async_task where c1=6;
select * from t_async_task order by l2_distance(c2, '[2,1,1]') approximate limit 1;
c1	c2
2	[2,1,1]
trigger_type	task_type	status	ret_code
0	1	1	-1
0	1	1	-1
trigger_type	task_type	status	ret_code
USER	1	RUNNING	-1
USER	1	RUNNING	-1
drop index idx_async_task on t_async_task;
trigger_type	task_type	status	ret_code
0	1	1	-1
0	1	1	-1
trigger_type	task_type	status	ret_code
USER	1	RUNNING	-1
USER	1	RUNNING	-1
set ob_global_debug_sync = 'reset';
set ob_global_debug_sync = 'now signal continue_signal';
trigger_type	task_type	status	ret_code
0	1	3	-4016
0	1	3	-4016
trigger_type	task_type	status	ret_code
AUTO	1	FINISHED	-4016
AUTO	1	FINISHED	-4016
trigger_type	task_type	status	ret_code
0	1	3	-4016
0	1	3	-4016
trigger_type	task_type	status	ret_code
AUTO	1	FINISHED	-4016
AUTO	1	FINISHED	-4016
drop table t_async_task;
trigger_type	task_type	status	ret_code
AUTO	1	FINISHED	-4016
AUTO	1	FINISHED	-4016


"========================= abnormal test of none partition table (rebuild index when task in execution) =========================="
set ob_global_debug_sync = 'reset';
set ob_global_debug_sync = 'HANDLE_VECTOR_INDEX_ASYNC_TASK wait_for continue_signal execute 10000';
drop table if exists t_async_task;
create table t_async_task(c1 int, c2 vector(3), primary key(c1));
create vector index idx_async_task on t_async_task(c2) with (distance=l2, type=hnsw);
insert into t_async_task values (1, '[1,1,1]'), (3, '[2,1,1]'), (11, '[3,1,1]');
delete from t_async_task where c1=1;
select * from t_async_task order by l2_distance(c2, '[2,1,1]') approximate limit 1;
c1	c2
3	[2,1,1]
trigger_type	task_type	status	ret_code
0	1	1	-1
trigger_type	task_type	status	ret_code
USER	1	RUNNING	-1
call dbms_vector.rebuild_index('idx_async_task', 't_async_task');
trigger_type	task_type	status	ret_code
0	1	1	-1
trigger_type	task_type	status	ret_code
USER	1	RUNNING	-1
set ob_global_debug_sync = 'reset';
set ob_global_debug_sync = 'now signal continue_signal';
trigger_type	task_type	status	ret_code
0	1	3	-4201
trigger_type	task_type	status	ret_code
AUTO	1	FINISHED	-4201
trigger_type	task_type	status	ret_code
0	1	3	-4201
trigger_type	task_type	status	ret_code
AUTO	1	FINISHED	-4201
drop table t_async_task;
trigger_type	task_type	status	ret_code
AUTO	1	FINISHED	-4201


"========================= abnormal test of partition table (rebuild index when task in execution) =========================="
set ob_global_debug_sync = 'reset';
set ob_global_debug_sync = 'HANDLE_VECTOR_INDEX_ASYNC_TASK wait_for continue_signal execute 10000';
create table t_async_task(c1 int, c2 vector(3), primary key(c1)) partition by range(c1) (partition p0 values less than (5), partition p1 values less than (10));
create vector index idx_async_task on t_async_task(c2) with (distance=l2, type=hnsw);
insert into t_async_task values (1, '[1,1,1]'), (2, '[2,1,1]'), (3, '[3,1,1]');
insert into t_async_task values (6, '[6,1,1]'), (7, '[7,1,1]'), (8, '[8,1,1]');
delete from t_async_task where c1=1;
delete from t_async_task where c1=6;
select * from t_async_task order by l2_distance(c2, '[2,1,1]') approximate limit 1;
c1	c2
2	[2,1,1]
trigger_type	task_type	status	ret_code
0	1	1	-1
0	1	1	-1
trigger_type	task_type	status	ret_code
USER	1	RUNNING	-1
USER	1	RUNNING	-1
call dbms_vector.rebuild_index('idx_async_task', 't_async_task');
trigger_type	task_type	status	ret_code
0	1	1	-1
0	1	1	-1
trigger_type	task_type	status	ret_code
USER	1	RUNNING	-1
USER	1	RUNNING	-1
set ob_global_debug_sync = 'reset';
set ob_global_debug_sync = 'now signal continue_signal';
trigger_type	task_type	status	ret_code
0	1	3	-4201
0	1	3	-4201
trigger_type	task_type	status	ret_code
AUTO	1	FINISHED	-4201
AUTO	1	FINISHED	-4201
trigger_type	task_type	status	ret_code
0	1	3	-4201
0	1	3	-4201
trigger_type	task_type	status	ret_code
AUTO	1	FINISHED	-4201
AUTO	1	FINISHED	-4201
drop table t_async_task;
trigger_type	task_type	status	ret_code
AUTO	1	FINISHED	-4201
AUTO	1	FINISHED	-4201


"========================= abnormal test of none partition table (dml when task in execution) =========================="
set ob_global_debug_sync = 'reset';
set ob_global_debug_sync = 'HANDLE_VECTOR_INDEX_ASYNC_TASK wait_for continue_signal execute 10000';
drop table if exists t_async_task;
create table t_async_task(c1 int, c2 vector(3), primary key(c1));
create vector index idx_async_task on t_async_task(c2) with (distance=l2, type=hnsw);
insert into t_async_task values (1, '[1,1,1]'), (3, '[2,1,1]'), (11, '[3,1,1]');
delete from t_async_task where c1=1;
select * from t_async_task order by l2_distance(c2, '[2,1,1]') approximate limit 1;
c1	c2
3	[2,1,1]
trigger_type	task_type	status	ret_code
0	1	1	-1
trigger_type	task_type	status	ret_code
USER	1	RUNNING	-1
insert into t_async_task values (2, '[3,97,1]'), (4, '[2,2,1]'), (99, '[7,1,8]');
trigger_type	task_type	status	ret_code
0	1	1	-1
trigger_type	task_type	status	ret_code
USER	1	RUNNING	-1
set ob_global_debug_sync = 'reset';
set ob_global_debug_sync = 'now signal continue_signal';
trigger_type	task_type	status	ret_code
0	1	3	0
trigger_type	task_type	status	ret_code
AUTO	1	FINISHED	0
trigger_type	task_type	status	ret_code
0	1	3	0
trigger_type	task_type	status	ret_code
AUTO	1	FINISHED	0
select * from t_async_task order by l2_distance(c2, '[2,1,1]') approximate limit 20;
c1	c2
3	[2,1,1]
4	[2,2,1]
11	[3,1,1]
99	[7,1,8]
2	[3,97,1]
drop table t_async_task;
trigger_type	task_type	status	ret_code
AUTO	1	FINISHED	0


"========================= abnormal test of partition table (dml when task in execution) =========================="
set ob_global_debug_sync = 'reset';
set ob_global_debug_sync = 'HANDLE_VECTOR_INDEX_ASYNC_TASK wait_for continue_signal execute 10000';
create table t_async_task(c1 int, c2 vector(3), primary key(c1)) partition by range(c1) (partition p0 values less than (5), partition p1 values less than (1000));
create vector index idx_async_task on t_async_task(c2) with (distance=l2, type=hnsw);
insert into t_async_task values (1, '[1,1,1]'), (2, '[2,1,1]'), (3, '[3,1,1]');
insert into t_async_task values (6, '[6,1,1]'), (7, '[7,1,1]'), (8, '[8,1,1]');
delete from t_async_task where c1=1;
delete from t_async_task where c1=6;
select * from t_async_task order by l2_distance(c2, '[2,1,1]') approximate limit 1;
c1	c2
2	[2,1,1]
trigger_type	task_type	status	ret_code
0	1	1	-1
0	1	1	-1
trigger_type	task_type	status	ret_code
USER	1	RUNNING	-1
USER	1	RUNNING	-1
insert into t_async_task values (0, '[3,97,1]'), (4, '[2,2,1]'), (99, '[7,1,8]');
trigger_type	task_type	status	ret_code
0	1	1	-1
0	1	1	-1
trigger_type	task_type	status	ret_code
USER	1	RUNNING	-1
USER	1	RUNNING	-1
set ob_global_debug_sync = 'reset';
set ob_global_debug_sync = 'now signal continue_signal';
trigger_type	task_type	status	ret_code
0	1	3	0
0	1	3	0
trigger_type	task_type	status	ret_code
AUTO	1	FINISHED	0
AUTO	1	FINISHED	0
trigger_type	task_type	status	ret_code
0	1	3	0
0	1	3	0
trigger_type	task_type	status	ret_code
AUTO	1	FINISHED	0
AUTO	1	FINISHED	0
select * from t_async_task order by l2_distance(c2, '[2,1,1]') approximate limit 20;
c1	c2
2	[2,1,1]
4	[2,2,1]
3	[3,1,1]
7	[7,1,1]
8	[8,1,1]
99	[7,1,8]
0	[3,97,1]
drop table t_async_task;
trigger_type	task_type	status	ret_code
AUTO	1	FINISHED	0
AUTO	1	FINISHED	0


"================================== clear ==================================="
alter system change tenant sys;
delete from oceanbase.__all_vector_index_task_history;
drop table if exists t_async_task;
alter system set ob_vector_memory_limit_percentage = 0;
PURGE RECYCLEBIN;
