# Vector Index with FTS Test
alter system set ob_vector_memory_limit_percentage = 44;
drop table if exists t1;
create table t1 (c1 int primary key, c2 vector(3), c3 varchar(4096), vector index idx1(c2) with (type=hnsw, distance=l2), fulltext index idx2(c3));
insert into t1 values(1, '[0.203846,0.205289,0.880265]', "Gerard A. Gerry Salton (8 March 1927 – 28 August 1995) was a professor of Computer Science at Cornell University. Salton was perhaps the leading computer scientist working in the field of information retrieval during his time, and the father of Information Retrieval");
insert into t1 values(2, '[0.735541,0.670776,0.903237]', "Edgar Frank Ted Codd (19 August 1923 – 18 April 2003) was an English computer scientist who, while working for IBM, invented the relational model for database management, the theoretical basis for relational databases and relational database management systems. ");
insert into t1 values(3, '[0.327936,0.048756,0.084670]', "Michael Ralph Stonebraker (born October 11, 1943[6]) is a computer scientist specializing in database systems. Through a series of academic prototypes and commercial startups, Stonebraker's research and products are central to many relational databases. ");
insert into t1 values(4, '[0.148869,0.878546,0.028024]', "Geoffrey Everest Hinton CC FRS FRSC (born 6 December 1947) is a British-Canadian computer scientist and cognitive psychologist, most noted for his work on artificial neural networks.");
insert into t1 values(5, '[0.334970,0.857377,0.886132]', "Yann André LeCun[1] (born 8 July 1960) is a Turing Award winning French computer scientist working primarily in the fields of machine learning, computer vision, mobile robotics and computational neuroscience.");
insert into t1 values(6, '[0.117582,0.302352,0.471198]', "Kenneth Lane Thompson (born February 4, 1943) is an American pioneer of computer science. Thompson worked at Bell Labs for most of his career where he designed and implemented the original Unix operating system. ");
insert into t1 values(7, '[0.551185,0.231134,0.075354]', "Gordon David Plotkin, FRS FRSE MAE (born 9 September 1946) is a theoretical computer scientist in the School of Informatics at the University of Edinburgh. Plotkin is probably best known for his introduction of structural operational semantics (SOS) and his work on denotational semantics.");
insert into t1 values(8, '[0.185221,0.315131,0.558301]', "Leslie B. Lamport (born February 7, 1941) is an American computer scientist and mathematician. Lamport is best known for his seminal work in distributed systems, and as the initial developer of the document preparation system LaTeX");
insert into t1 values(9, '[0.928764,0.254038,0.272721]', "asdavoiajf oweirjweoifjsofmcspodkow cmdowm owejocwpe fowecofow ow weor pksdkm foe owei");
insert into t1 values(10, '[0.345999,0.254102,0.950869]', "pqowepqo pweuijkfn dmclsjrqowep kdlsnvkfdjh oweifj oqfj oewijfpqwo kpew jfpqokd wpqkc owq");
select * from t1 order by l2_distance(c2, [0,0,0]) limit 5;
c1	c2	c3
3	[0.327936,0.048756,0.08467]	Michael Ralph Stonebraker (born October 11, 1943[6]) is a computer scientist specializing in database systems. Through a series of academic prototypes and commercial startups, Stonebraker's research and products are central to many relational databases. 
6	[0.117582,0.302352,0.471198]	Kenneth Lane Thompson (born February 4, 1943) is an American pioneer of computer science. Thompson worked at Bell Labs for most of his career where he designed and implemented the original Unix operating system. 
7	[0.551185,0.231134,0.075354]	Gordon David Plotkin, FRS FRSE MAE (born 9 September 1946) is a theoretical computer scientist in the School of Informatics at the University of Edinburgh. Plotkin is probably best known for his introduction of structural operational semantics (SOS) and his work on denotational semantics.
8	[0.185221,0.315131,0.558301]	Leslie B. Lamport (born February 7, 1941) is an American computer scientist and mathematician. Lamport is best known for his seminal work in distributed systems, and as the initial developer of the document preparation system LaTeX
4	[0.148869,0.878546,0.028024]	Geoffrey Everest Hinton CC FRS FRSC (born 6 December 1947) is a British-Canadian computer scientist and cognitive psychologist, most noted for his work on artificial neural networks.
select * from t1 order by l2_distance(c2, [0,0,0]) approx limit 5;
c1	c2	c3
3	[0.327936,0.048756,0.08467]	Michael Ralph Stonebraker (born October 11, 1943[6]) is a computer scientist specializing in database systems. Through a series of academic prototypes and commercial startups, Stonebraker's research and products are central to many relational databases. 
6	[0.117582,0.302352,0.471198]	Kenneth Lane Thompson (born February 4, 1943) is an American pioneer of computer science. Thompson worked at Bell Labs for most of his career where he designed and implemented the original Unix operating system. 
7	[0.551185,0.231134,0.075354]	Gordon David Plotkin, FRS FRSE MAE (born 9 September 1946) is a theoretical computer scientist in the School of Informatics at the University of Edinburgh. Plotkin is probably best known for his introduction of structural operational semantics (SOS) and his work on denotational semantics.
8	[0.185221,0.315131,0.558301]	Leslie B. Lamport (born February 7, 1941) is an American computer scientist and mathematician. Lamport is best known for his seminal work in distributed systems, and as the initial developer of the document preparation system LaTeX
4	[0.148869,0.878546,0.028024]	Geoffrey Everest Hinton CC FRS FRSC (born 6 December 1947) is a British-Canadian computer scientist and cognitive psychologist, most noted for his work on artificial neural networks.
select c1,c3 from t1 where match (c3) against ("distributed database");
c1	c3
8	Leslie B. Lamport (born February 7, 1941) is an American computer scientist and mathematician. Lamport is best known for his seminal work in distributed systems, and as the initial developer of the document preparation system LaTeX
2	Edgar Frank Ted Codd (19 August 1923 – 18 April 2003) was an English computer scientist who, while working for IBM, invented the relational model for database management, the theoretical basis for relational databases and relational database management systems. 
3	Michael Ralph Stonebraker (born October 11, 1943[6]) is a computer scientist specializing in database systems. Through a series of academic prototypes and commercial startups, Stonebraker's research and products are central to many relational databases. 
select c1,c3 from t1 where match (c3) against ("database");
c1	c3
2	Edgar Frank Ted Codd (19 August 1923 – 18 April 2003) was an English computer scientist who, while working for IBM, invented the relational model for database management, the theoretical basis for relational databases and relational database management systems. 
3	Michael Ralph Stonebraker (born October 11, 1943[6]) is a computer scientist specializing in database systems. Through a series of academic prototypes and commercial startups, Stonebraker's research and products are central to many relational databases. 
select c1,c3 from t1 where match (c3) against ("computer");
c1	c3
5	Yann André LeCun[1] (born 8 July 1960) is a Turing Award winning French computer scientist working primarily in the fields of machine learning, computer vision, mobile robotics and computational neuroscience.
1	Gerard A. Gerry Salton (8 March 1927 – 28 August 1995) was a professor of Computer Science at Cornell University. Salton was perhaps the leading computer scientist working in the field of information retrieval during his time, and the father of Information Retrieval
4	Geoffrey Everest Hinton CC FRS FRSC (born 6 December 1947) is a British-Canadian computer scientist and cognitive psychologist, most noted for his work on artificial neural networks.
6	Kenneth Lane Thompson (born February 4, 1943) is an American pioneer of computer science. Thompson worked at Bell Labs for most of his career where he designed and implemented the original Unix operating system. 
8	Leslie B. Lamport (born February 7, 1941) is an American computer scientist and mathematician. Lamport is best known for his seminal work in distributed systems, and as the initial developer of the document preparation system LaTeX
3	Michael Ralph Stonebraker (born October 11, 1943[6]) is a computer scientist specializing in database systems. Through a series of academic prototypes and commercial startups, Stonebraker's research and products are central to many relational databases. 
2	Edgar Frank Ted Codd (19 August 1923 – 18 April 2003) was an English computer scientist who, while working for IBM, invented the relational model for database management, the theoretical basis for relational databases and relational database management systems. 
7	Gordon David Plotkin, FRS FRSE MAE (born 9 September 1946) is a theoretical computer scientist in the School of Informatics at the University of Edinburgh. Plotkin is probably best known for his introduction of structural operational semantics (SOS) and his work on denotational semantics.
select c1,c3 from t1 where match (c3) against (1943);
c1	c3
6	Kenneth Lane Thompson (born February 4, 1943) is an American pioneer of computer science. Thompson worked at Bell Labs for most of his career where he designed and implemented the original Unix operating system. 
3	Michael Ralph Stonebraker (born October 11, 1943[6]) is a computer scientist specializing in database systems. Through a series of academic prototypes and commercial startups, Stonebraker's research and products are central to many relational databases. 
select c1,c3 from t1 where match (c3) against (0xFF);
c1	c3
update t1 set c3 = "abcdefghijklmn iasoqw opqoweq nkqndk qjwkjq" where c1 = 1;
update t1 set c2=[2,3,4],c3="qiweobkcjncoaijdoiqj odqwij o" where c1=2;
update t1 set c2=[5,6,7] where c1=3;
update t1 set c2=[1,1,1];
update t1 set c3="oqijeoi jaiofj oijd qoij oqi qoi qp dpq jdpq p";
delete from t1;
drop table t1;
drop table if exists t1;
create table t1 (c1 int primary key, c2 vector(3), c3 varchar(4096), vector index idx1(c2) with (type=hnsw, distance=l2), fulltext index idx2(c3));
insert into t1 values(1, '[0.203846,0.205289,0.880265]', "Gerard A. Gerry Salton (8 March 1927 – 28 August 1995) was a professor of Computer Science at Cornell University. Salton was perhaps the leading computer scientist working in the field of information retrieval during his time, and the father of Information Retrieval");
insert into t1 values(2, '[0.735541,0.670776,0.903237]', "Edgar Frank Ted Codd (19 August 1923 – 18 April 2003) was an English computer scientist who, while working for IBM, invented the relational model for database management, the theoretical basis for relational databases and relational database management systems. ");
insert into t1 values(3, '[0.327936,0.048756,0.084670]', "Michael Ralph Stonebraker (born October 11, 1943[6]) is a computer scientist specializing in database systems. Through a series of academic prototypes and commercial startups, Stonebraker's research and products are central to many relational databases. ");
insert into t1 values(4, '[0.148869,0.878546,0.028024]', "Geoffrey Everest Hinton CC FRS FRSC (born 6 December 1947) is a British-Canadian computer scientist and cognitive psychologist, most noted for his work on artificial neural networks.");
insert into t1 values(5, '[0.334970,0.857377,0.886132]', "Yann André LeCun[1] (born 8 July 1960) is a Turing Award winning French computer scientist working primarily in the fields of machine learning, computer vision, mobile robotics and computational neuroscience.");
insert into t1 values(6, '[0.117582,0.302352,0.471198]', "Kenneth Lane Thompson (born February 4, 1943) is an American pioneer of computer science. Thompson worked at Bell Labs for most of his career where he designed and implemented the original Unix operating system. ");
insert into t1 values(7, '[0.551185,0.231134,0.075354]', "Gordon David Plotkin, FRS FRSE MAE (born 9 September 1946) is a theoretical computer scientist in the School of Informatics at the University of Edinburgh. Plotkin is probably best known for his introduction of structural operational semantics (SOS) and his work on denotational semantics.");
insert into t1 values(8, '[0.185221,0.315131,0.558301]', "Leslie B. Lamport (born February 7, 1941) is an American computer scientist and mathematician. Lamport is best known for his seminal work in distributed systems, and as the initial developer of the document preparation system LaTeX");
insert into t1 values(9, '[0.928764,0.254038,0.272721]', "asdavoiajf oweirjweoifjsofmcspodkow cmdowm owejocwpe fowecofow ow weor pksdkm foe owei");
insert into t1 values(10, '[0.345999,0.254102,0.950869]', "pqowepqo pweuijkfn dmclsjrqowep kdlsnvkfdjh oweifj oqfj oewijfpqwo kpew jfpqokd wpqkc owq");
insert into t1(c1,c2,c3) values(11, '[1,1,1]', "aldno wjdoi wodj owi jodi") ON DUPLICATE KEY UPDATE c2='[1,9,3]';
insert into t1(c1,c2,c3) values(1, '[1,1,1]', "aldno wjdoi wodj owi jodi") ON DUPLICATE KEY UPDATE c2='[1,9,3]';
insert into t1(c1,c2,c3) values(1, '[1,1,1]', "aldno wjdoi wodj owi jodi") ON DUPLICATE KEY UPDATE c3="aldno wjdoi wodj owi jodi";
insert into t1(c1,c2,c3) values(1, '[1,1,1]', "aldno wjdoi wodj owi jodi") ON DUPLICATE KEY UPDATE c2='[3,3,3]',c3="aldno wjdoi wodj owi jodi kwdnowi o ioi";
delete from t1;
drop table t1;
drop table if exists t1;
create table t1 (c1 int primary key, c2 vector(3), c3 varchar(4096));
create fulltext index idx1 on t1(c3);
create vector index idx2 on t1(c2) with (type=hnsw, distance=l2);
drop table t1;
create table t1 (c1 int primary key, c2 vector(3), c3 varchar(4096));
create vector index idx2 on t1(c2) with (type=hnsw, distance=l2);
create fulltext index idx1 on t1(c3);
drop table t1;
drop table if exists t1;
create table t1 (c1 int primary key, c2 vector(3), c3 varchar(4096));
insert into t1 values(1, '[0.203846,0.205289,0.880265]', "Gerard A. Gerry Salton (8 March 1927 – 28 August 1995) was a professor of Computer Science at Cornell University. Salton was perhaps the leading computer scientist working in the field of information retrieval during his time, and the father of Information Retrieval");
insert into t1 values(2, '[0.735541,0.670776,0.903237]', "Edgar Frank Ted Codd (19 August 1923 – 18 April 2003) was an English computer scientist who, while working for IBM, invented the relational model for database management, the theoretical basis for relational databases and relational database management systems. ");
insert into t1 values(3, '[0.327936,0.048756,0.084670]', "Michael Ralph Stonebraker (born October 11, 1943[6]) is a computer scientist specializing in database systems. Through a series of academic prototypes and commercial startups, Stonebraker's research and products are central to many relational databases. ");
insert into t1 values(4, '[0.148869,0.878546,0.028024]', "Geoffrey Everest Hinton CC FRS FRSC (born 6 December 1947) is a British-Canadian computer scientist and cognitive psychologist, most noted for his work on artificial neural networks.");
insert into t1 values(5, '[0.334970,0.857377,0.886132]', "Yann André LeCun[1] (born 8 July 1960) is a Turing Award winning French computer scientist working primarily in the fields of machine learning, computer vision, mobile robotics and computational neuroscience.");
insert into t1 values(6, '[0.117582,0.302352,0.471198]', "Kenneth Lane Thompson (born February 4, 1943) is an American pioneer of computer science. Thompson worked at Bell Labs for most of his career where he designed and implemented the original Unix operating system. ");
insert into t1 values(7, '[0.551185,0.231134,0.075354]', "Gordon David Plotkin, FRS FRSE MAE (born 9 September 1946) is a theoretical computer scientist in the School of Informatics at the University of Edinburgh. Plotkin is probably best known for his introduction of structural operational semantics (SOS) and his work on denotational semantics.");
insert into t1 values(8, '[0.185221,0.315131,0.558301]', "Leslie B. Lamport (born February 7, 1941) is an American computer scientist and mathematician. Lamport is best known for his seminal work in distributed systems, and as the initial developer of the document preparation system LaTeX");
insert into t1 values(9, '[0.928764,0.254038,0.272721]', "asdavoiajf oweirjweoifjsofmcspodkow cmdowm owejocwpe fowecofow ow weor pksdkm foe owei");
insert into t1 values(10, '[0.345999,0.254102,0.950869]', "pqowepqo pweuijkfn dmclsjrqowep kdlsnvkfdjh oweifj oqfj oewijfpqwo kpew jfpqokd wpqkc owq");
create fulltext index idx1 on t1(c3);
create vector index idx2 on t1(c2) with (type=hnsw, distance=l2);
drop table t1;
create table t1 (c1 int primary key, c2 vector(3), c3 varchar(4096));
insert into t1 values(1, '[0.203846,0.205289,0.880265]', "Gerard A. Gerry Salton (8 March 1927 – 28 August 1995) was a professor of Computer Science at Cornell University. Salton was perhaps the leading computer scientist working in the field of information retrieval during his time, and the father of Information Retrieval");
insert into t1 values(2, '[0.735541,0.670776,0.903237]', "Edgar Frank Ted Codd (19 August 1923 – 18 April 2003) was an English computer scientist who, while working for IBM, invented the relational model for database management, the theoretical basis for relational databases and relational database management systems. ");
insert into t1 values(3, '[0.327936,0.048756,0.084670]', "Michael Ralph Stonebraker (born October 11, 1943[6]) is a computer scientist specializing in database systems. Through a series of academic prototypes and commercial startups, Stonebraker's research and products are central to many relational databases. ");
insert into t1 values(4, '[0.148869,0.878546,0.028024]', "Geoffrey Everest Hinton CC FRS FRSC (born 6 December 1947) is a British-Canadian computer scientist and cognitive psychologist, most noted for his work on artificial neural networks.");
insert into t1 values(5, '[0.334970,0.857377,0.886132]', "Yann André LeCun[1] (born 8 July 1960) is a Turing Award winning French computer scientist working primarily in the fields of machine learning, computer vision, mobile robotics and computational neuroscience.");
insert into t1 values(6, '[0.117582,0.302352,0.471198]', "Kenneth Lane Thompson (born February 4, 1943) is an American pioneer of computer science. Thompson worked at Bell Labs for most of his career where he designed and implemented the original Unix operating system. ");
insert into t1 values(7, '[0.551185,0.231134,0.075354]', "Gordon David Plotkin, FRS FRSE MAE (born 9 September 1946) is a theoretical computer scientist in the School of Informatics at the University of Edinburgh. Plotkin is probably best known for his introduction of structural operational semantics (SOS) and his work on denotational semantics.");
insert into t1 values(8, '[0.185221,0.315131,0.558301]', "Leslie B. Lamport (born February 7, 1941) is an American computer scientist and mathematician. Lamport is best known for his seminal work in distributed systems, and as the initial developer of the document preparation system LaTeX");
insert into t1 values(9, '[0.928764,0.254038,0.272721]', "asdavoiajf oweirjweoifjsofmcspodkow cmdowm owejocwpe fowecofow ow weor pksdkm foe owei");
insert into t1 values(10, '[0.345999,0.254102,0.950869]', "pqowepqo pweuijkfn dmclsjrqowep kdlsnvkfdjh oweifj oqfj oewijfpqwo kpew jfpqokd wpqkc owq");
create vector index idx2 on t1(c2) with (type=hnsw, distance=l2);
create fulltext index idx1 on t1(c3);
drop table t1;
drop table if exists t1;
create table t1 (c1 int primary key, c2 vector(3), c3 varchar(4096));
insert into t1 values(1, '[0.203846,0.205289,0.880265]', "Gerard A. Gerry Salton (8 March 1927 – 28 August 1995) was a professor of Computer Science at Cornell University. Salton was perhaps the leading computer scientist working in the field of information retrieval during his time, and the father of Information Retrieval");
insert into t1 values(2, '[0.735541,0.670776,0.903237]', "Edgar Frank Ted Codd (19 August 1923 – 18 April 2003) was an English computer scientist who, while working for IBM, invented the relational model for database management, the theoretical basis for relational databases and relational database management systems. ");
insert into t1 values(3, '[0.327936,0.048756,0.084670]', "Michael Ralph Stonebraker (born October 11, 1943[6]) is a computer scientist specializing in database systems. Through a series of academic prototypes and commercial startups, Stonebraker's research and products are central to many relational databases. ");
insert into t1 values(4, '[0.148869,0.878546,0.028024]', "Geoffrey Everest Hinton CC FRS FRSC (born 6 December 1947) is a British-Canadian computer scientist and cognitive psychologist, most noted for his work on artificial neural networks.");
insert into t1 values(5, '[0.334970,0.857377,0.886132]', "Yann André LeCun[1] (born 8 July 1960) is a Turing Award winning French computer scientist working primarily in the fields of machine learning, computer vision, mobile robotics and computational neuroscience.");
insert into t1 values(6, '[0.117582,0.302352,0.471198]', "Kenneth Lane Thompson (born February 4, 1943) is an American pioneer of computer science. Thompson worked at Bell Labs for most of his career where he designed and implemented the original Unix operating system. ");
insert into t1 values(7, '[0.551185,0.231134,0.075354]', "Gordon David Plotkin, FRS FRSE MAE (born 9 September 1946) is a theoretical computer scientist in the School of Informatics at the University of Edinburgh. Plotkin is probably best known for his introduction of structural operational semantics (SOS) and his work on denotational semantics.");
insert into t1 values(8, '[0.185221,0.315131,0.558301]', "Leslie B. Lamport (born February 7, 1941) is an American computer scientist and mathematician. Lamport is best known for his seminal work in distributed systems, and as the initial developer of the document preparation system LaTeX");
insert into t1 values(9, '[0.928764,0.254038,0.272721]', "asdavoiajf oweirjweoifjsofmcspodkow cmdowm owejocwpe fowecofow ow weor pksdkm foe owei");
insert into t1 values(10, '[0.345999,0.254102,0.950869]', "pqowepqo pweuijkfn dmclsjrqowep kdlsnvkfdjh oweifj oqfj oewijfpqwo kpew jfpqokd wpqkc owq");
create vector index idx2 on t1(c2) with (type=hnsw, distance=l2);
create fulltext index idx1 on t1(c3);
alter table t1 drop index idx1;
alter table t1 drop index idx2;
create fulltext index idx1 on t1(c3);
create vector index idx2 on t1(c2) with (type=hnsw, distance=l2);
alter table t1 drop index idx2;
create vector index idx2 on t1(c2) with (type=hnsw, distance=l2);
alter table t1 drop index idx1;
create fulltext index idx1 on t1(c3);
drop table t1;
drop table if exists t1;
create table t1 (c1 int primary key, c2 vector(3), c3 varchar(4096), c4 vector(4), c5 varchar(1000));
create fulltext index idx1 on t1(c3);
create vector index idx2 on t1(c2) with (type=hnsw, distance=l2);
create vector index idx3 on t1(c4) with (type=hnsw, distance=l2);
create fulltext index idx4 on t1(c5);
drop table t1;
drop table if exists t1;
drop view if exists v1;
create table t1 (c1 int primary key, c2 vector(3), c3 varchar(4096), vector index idx1(c2) with (type=hnsw, distance=l2), fulltext index idx2(c3));
insert into t1 values(1, '[0.203846,0.205289,0.880265]', "Gerard A. Gerry Salton (8 March 1927 – 28 August 1995) was a professor of Computer Science at Cornell University. Salton was perhaps the leading computer scientist working in the field of information retrieval during his time, and the father of Information Retrieval");
insert into t1 values(2, '[0.735541,0.670776,0.903237]', "Edgar Frank Ted Codd (19 August 1923 – 18 April 2003) was an English computer scientist who, while working for IBM, invented the relational model for database management, the theoretical basis for relational databases and relational database management systems. ");
insert into t1 values(3, '[0.327936,0.048756,0.084670]', "Michael Ralph Stonebraker (born October 11, 1943[6]) is a computer scientist specializing in database systems. Through a series of academic prototypes and commercial startups, Stonebraker's research and products are central to many relational databases. ");
insert into t1 values(4, '[0.148869,0.878546,0.028024]', "Geoffrey Everest Hinton CC FRS FRSC (born 6 December 1947) is a British-Canadian computer scientist and cognitive psychologist, most noted for his work on artificial neural networks.");
insert into t1 values(5, '[0.334970,0.857377,0.886132]', "Yann André LeCun[1] (born 8 July 1960) is a Turing Award winning French computer scientist working primarily in the fields of machine learning, computer vision, mobile robotics and computational neuroscience.");
insert into t1 values(6, '[0.117582,0.302352,0.471198]', "Kenneth Lane Thompson (born February 4, 1943) is an American pioneer of computer science. Thompson worked at Bell Labs for most of his career where he designed and implemented the original Unix operating system. ");
insert into t1 values(7, '[0.551185,0.231134,0.075354]', "Gordon David Plotkin, FRS FRSE MAE (born 9 September 1946) is a theoretical computer scientist in the School of Informatics at the University of Edinburgh. Plotkin is probably best known for his introduction of structural operational semantics (SOS) and his work on denotational semantics.");
insert into t1 values(8, '[0.185221,0.315131,0.558301]', "Leslie B. Lamport (born February 7, 1941) is an American computer scientist and mathematician. Lamport is best known for his seminal work in distributed systems, and as the initial developer of the document preparation system LaTeX");
insert into t1 values(9, '[0.928764,0.254038,0.272721]', "asdavoiajf oweirjweoifjsofmcspodkow cmdowm owejocwpe fowecofow ow weor pksdkm foe owei");
insert into t1 values(10, '[0.345999,0.254102,0.950869]', "pqowepqo pweuijkfn dmclsjrqowep kdlsnvkfdjh oweifj oqfj oewijfpqwo kpew jfpqokd wpqkc owq");
create view v1 as select * from t1;
select * from v1;
c1	c2	c3
1	[0.203846,0.205289,0.880265]	Gerard A. Gerry Salton (8 March 1927 – 28 August 1995) was a professor of Computer Science at Cornell University. Salton was perhaps the leading computer scientist working in the field of information retrieval during his time, and the father of Information Retrieval
2	[0.735541,0.670776,0.903237]	Edgar Frank Ted Codd (19 August 1923 – 18 April 2003) was an English computer scientist who, while working for IBM, invented the relational model for database management, the theoretical basis for relational databases and relational database management systems. 
3	[0.327936,0.048756,0.08467]	Michael Ralph Stonebraker (born October 11, 1943[6]) is a computer scientist specializing in database systems. Through a series of academic prototypes and commercial startups, Stonebraker's research and products are central to many relational databases. 
4	[0.148869,0.878546,0.028024]	Geoffrey Everest Hinton CC FRS FRSC (born 6 December 1947) is a British-Canadian computer scientist and cognitive psychologist, most noted for his work on artificial neural networks.
5	[0.33497,0.857377,0.886132]	Yann André LeCun[1] (born 8 July 1960) is a Turing Award winning French computer scientist working primarily in the fields of machine learning, computer vision, mobile robotics and computational neuroscience.
6	[0.117582,0.302352,0.471198]	Kenneth Lane Thompson (born February 4, 1943) is an American pioneer of computer science. Thompson worked at Bell Labs for most of his career where he designed and implemented the original Unix operating system. 
7	[0.551185,0.231134,0.075354]	Gordon David Plotkin, FRS FRSE MAE (born 9 September 1946) is a theoretical computer scientist in the School of Informatics at the University of Edinburgh. Plotkin is probably best known for his introduction of structural operational semantics (SOS) and his work on denotational semantics.
8	[0.185221,0.315131,0.558301]	Leslie B. Lamport (born February 7, 1941) is an American computer scientist and mathematician. Lamport is best known for his seminal work in distributed systems, and as the initial developer of the document preparation system LaTeX
9	[0.928764,0.254038,0.272721]	asdavoiajf oweirjweoifjsofmcspodkow cmdowm owejocwpe fowecofow ow weor pksdkm foe owei
10	[0.345999,0.254102,0.950869]	pqowepqo pweuijkfn dmclsjrqowep kdlsnvkfdjh oweifj oqfj oewijfpqwo kpew jfpqokd wpqkc owq
insert into v1(c1,c2,c3) values(1, '[1,1,1]', "aldno wjdoi wodj owi jodi") ON DUPLICATE KEY UPDATE c2='[1,9,3]';
update t1 set c2='[1,5,6]' where match (c3) against ("distributed database");
delete from t1 where match (c3) against ("distributed database");
drop view v1;
drop table t1;
alter system set ob_vector_memory_limit_percentage = 0;
