drop database  IF EXISTS  ob100x;
create database ob100x  character set utf8;
use ob100x;
select database();
database()
ob100x
exp-1参数
exp-1-1-1   一个参数
select    exp(3)    from dual;
exp(3)
20.085536923187668
select    exp(0)   from dual;
exp(0)
1
select    exp(-3)  from dual;
exp(-3)
0.049787068367863944
select    exp('')  from dual;
exp('')
1
select    exp('   ')  from dual;
exp('   ')
1
select    exp(null)  from dual;
exp(null)
NULL
select    exp(3-3)  from dual;
exp(3-3)
1
select    exp(3+3)  from dual;
exp(3+3)
403.4287934927351
select    exp(10/3)  from dual;
exp(10/3)
28.031624885182264
select    exp(0/3)  from dual;
exp(0/3)
1
select    exp(3/0)  from dual;
exp(3/0)
NULL
select    exp(291)    from dual;
exp(291)
2.3971446088951858e126
select    exp(-100)    from dual;
exp(-100)
3.720075976020836e-44
select    exp(-20091)    from dual;
exp(-20091)
0
exp-1-1-2   两个参数
select    exp(0,-3)  from dual;
select    exp(0,0)  from dual;
exp-1-1-3   0个参数
select    exp()    from dual;
exp-1-1-4   边界值
select    exp(709)    from dual;
exp(709)
8.218407461554972e307
select    exp(710)     from dual;
select    exp(710/0)  from dual;
exp(710/0)
NULL
select    exp(0)        from dual;
exp(0)
1
select    exp(0)/0     from dual;
exp(0)/0
NULL
select    exp(-710)    from dual;
exp(-710)
4.47628622567513e-309
select    exp(-7100)  from dual;
exp(-7100)
0
select    exp(exp(exp(exp(exp(exp(exp(exp(exp(exp(exp(exp(exp(exp(exp(exp(2)/10))/3000)/3000)/3000)/3000)/2.71)/3000)/3000)))/9000))/8000))    from dual;
exp(exp(exp(exp(exp(exp(exp(exp(exp(exp(exp(exp(exp(exp(exp(exp(2)/10))/3000)/3000)/3000)/3000)/2.71)/3000)/3000)))/9000))/8000))
2.719207334713845
select    exp(exp(e.aa))  from   (select    exp(exp(0)/exp(0))  aa   from dual)e;
exp(exp(e.aa))
3814279.104760214
select    exp(0.123456789123456789)/exp(10)*exp(1.999)   from dual;
exp(0.123456789123456789)/exp(10)*exp(1.999)
0.0003791634380499831
exp-2  数据类型测试
exp-2-1
drop table if exists exp_table001;
create table exp_table001(a char(2));
insert into exp_table001 values('3');
SELECT exp(e.a),exp(e.a+e.a) FROM exp_table001 e;
exp(e.a)	exp(e.a+e.a)
20.085536923187668	403.4287934927351
exp-2-2
drop table if exists exp_table001;
create table exp_table001(a VARCHAR(20));
insert into exp_table001 values('10');
SELECT exp(e.a) FROM exp_table001 e;
exp(e.a)
22026.465794806718
exp-2-3
drop table if exists exp_table001;
drop table if exists exp_table001;
create table exp_table001(a tinytext);
insert into exp_table001 values('10');
SELECT exp(e.a) FROM exp_table001 e;
exp(e.a)
22026.465794806718
exp-2-4
drop table if exists exp_table001;
create table exp_table001(a text);
insert into exp_table001 values('10');
SELECT exp(e.a) FROM exp_table001 e;
exp(e.a)
22026.465794806718
exp-2-5
drop table if exists exp_table001;
create table exp_table001(a date);
insert into exp_table001 values('1983-11-23 00:00:00');
SELECT exp(e.a) FROM exp_table001 e;
exp-2-6
drop table if exists exp_table001;
drop table if exists exp_table001;
create table exp_table001(a tinyint);
insert into exp_table001 values(5);
SELECT exp(e.a) FROM exp_table001 e;
exp(e.a)
148.4131591025766
drop table if exists exp_table001;
create table exp_table001(a smallint);
insert into exp_table001 values(5);
SELECT exp(e.a) FROM exp_table001 e;
exp(e.a)
148.4131591025766
drop table if exists exp_table001;
create table exp_table001(a mediumint);
insert into exp_table001 values(5);
SELECT exp(e.a) FROM exp_table001 e;
exp(e.a)
148.4131591025766
drop table if exists exp_table001;
create table exp_table001(a int);
insert into exp_table001 values(5);
SELECT exp(e.a) FROM exp_table001 e;
exp(e.a)
148.4131591025766
drop table if exists exp_table001;
create table exp_table001(a bigint);
insert into exp_table001 values(5);
SELECT exp(e.a) FROM exp_table001 e;
exp(e.a)
148.4131591025766
exp-2-7
drop table if exists exp_table001;
create table exp_table001(a float);
insert into exp_table001 values(5.123654);
SELECT exp(e.a) FROM exp_table001 e;
exp(e.a)
167.94791283854403
exp-2-8
drop table if exists exp_table001;
create table exp_table001(a double);
insert into exp_table001 values(5.32326545454);
SELECT exp(e.a) FROM exp_table001 e;
exp(e.a)
205.05237914783345
exp-2-9
drop table if exists exp_table001;
create table exp_table001(a mediumtext);
insert into exp_table001 values('10');
SELECT exp(e.a) FROM exp_table001 e;
exp(e.a)
22026.465794806718
exp-2-10
drop table if exists exp_table001;
create table exp_table001(a longtext);
insert into exp_table001 values('10');
SELECT exp(e.a) FROM exp_table001 e;
exp(e.a)
22026.465794806718
exp-2-11
exp-2-12
exp-2-13
exp-2-14
drop table if exists exp_table001;
create table exp_table001(a DECIMAL);
insert into exp_table001 values('10');
SELECT exp(e.a) FROM exp_table001 e;
exp(e.a)
22026.465794806718
exp-2-15
drop table if exists exp_table001;
create table exp_table001(a INTEGER);
insert into exp_table001 values('10');
SELECT exp(e.a) FROM exp_table001 e;
exp(e.a)
22026.465794806718
exp-2-16
drop table if exists exp_table001;
create table exp_table001(a FLOAT);
insert into exp_table001 values('10');
SELECT exp(e.a) FROM exp_table001 e;
exp(e.a)
22026.465794806718
exp-2-17
常用的sql语句
DROP table if exists  invbasdoc;
create table invbasdoc(monkey00   int not null,monkey01   INTEGER not null,monkey02   int,monkey03   decimal(8,4) not null,monkey04   FLOAT,monkey05   DOUBLE,monkey06   NUMERIC(6,2),
monkey07   SMALLINT,monkey08   FLOAT(20),monkey09   int,monkey10   char(50),monkey11   varchar(100),monkey12   varchar(100),GRADE int);
INSERT INTO invbasdoc VALUES(1,8524,0,-3211.2132,0,4.339851,9636.99,80,1.11,123.89,'100','1000','7452',10);
INSERT INTO invbasdoc VALUES(2,8524,0,-3211.2132,0,4.339851,9636.99,80,1.11,123.89,'100','1000','7452',10);
INSERT INTO invbasdoc VALUES(3,8524,0,-3211.2132,0,4.339851,9636.99,80,1.11,123.89,'100','1000','7452',10);
INSERT INTO invbasdoc VALUES(4,8524,0,-3211.2132,0,4.339851,9636.99,80,1.11,123.89,'100','1000','7452',10);
INSERT INTO invbasdoc VALUES(5,8524,0,-3211.2132,0,4.339851,9636.99,80,1.11,123.89,'100','1000','7452',10);
INSERT INTO invbasdoc VALUES(6,8524,0,-3211.2132,0,4.339851,9636.99,80,1.11,123.89,'100','1000','7452',10);
INSERT INTO invbasdoc VALUES(7,8524,0,-3211.2132,0,4.339851,9636.99,80,1.11,123.89,'100','1000','7452',10);
INSERT INTO invbasdoc VALUES(8,8524,0,-3211.2132,0,4.339851,9636.99,80,1.11,123.89,'100','1000','7452',10);
INSERT INTO invbasdoc VALUES(9,8524,0,-3211.2132,0,4.339851,9636.99,80,1.11,123.89,'100','1000','7452',10);
INSERT INTO invbasdoc VALUES(10,8524,0,-3211.2132,0,4.339851,9636.99,80,1.11,123.89,'100','1000','7452',10);
DROP TABLE   if exists  EMP;
CREATE TABLE emp(EMPNO int,ENAME VARCHAR(200),JOB VARCHAR(200),MGR int,HIREDATE DATE,SAL BIGINT,COMM int,DEPTNO int);
INSERT INTO emp VALUES(1,'SMITH','CLERK',7902,'1983-11-23 00:00:00',800,10,20);
INSERT INTO emp VALUES(2,'SMITH','CLERK',7902,'1983-11-23 00:00:00',0,NULL,20);
INSERT INTO emp VALUES(3,'SMITH','CLERK',7902,'1983-11-23 00:00:00',null,NULL,20);
INSERT INTO emp VALUES(4,'SMITH','CLERK',7902,'1983-11-23 00:00:00',0,NULL,20);
INSERT INTO emp VALUES(5,'SMITH','CLERK',7902,'1983-11-23 00:00:00',9,50,20);
INSERT INTO emp VALUES(6,'SMITH','CLERK',7902,'1983-11-23 00:00:00',10,NULL,20);
INSERT INTO emp VALUES(7,'SMITH','CLERK',7902,'1983-11-23 00:00:00',800,NULL,20);
INSERT INTO emp VALUES(8,'SMITH','CLERK',7902,'1983-11-23 00:00:00',800,NULL,20);
INSERT INTO emp VALUES(9,'SMITH','CLERK',7902,'1983-11-23 00:00:00',800,30,20);
INSERT INTO emp VALUES(10,'SMITH','CLERK',7902,'1983-11-23 00:00:00',800,10,20);
drop procedure if exists mayitest;//
create procedure mayitest()
begin
declare tablename001 varchar(100);
declare dropname002 varchar(100);
declare tablename003 varchar(100);
declare dropname004 varchar(100);
set  @dropname002= 'DROP  TABLE if exists  EMP001;';
set  @tablename001= 'create table EMP001 as select * from EMP where 1=1;';
set  @dropname004= 'DROP  TABLE if exists  invbasdoc001;';
set  @tablename003= 'create table invbasdoc001 as select * from invbasdoc where 1=1;';
prepare step001 from @dropname002;
execute step001;
prepare step002 from @tablename001;
execute step002;
prepare step003 from @dropname004;
execute step003;
prepare step004 from @tablename003;
execute step004;
end
//
call mayitest();
exp-3-1-1  select
SELECT  EXP(e.monkey00/EXP(10))   FROM   invbasdoc001 e;
EXP(e.monkey00/EXP(10))
1.000045400960355
1.000090803981957
1.0001362090649
1.0001816162092771
1.0002270254151824
1.0002724366827092
1.000317850011951
1.0003632654030017
1.0004086828559549
1.0004541023709037
SELECT  EXP(e.DEPTNO)   FROM   emp001  e;
EXP(e.DEPTNO)
485165195.4097903
485165195.4097903
485165195.4097903
485165195.4097903
485165195.4097903
485165195.4097903
485165195.4097903
485165195.4097903
485165195.4097903
485165195.4097903
SELECT  EXP(e.sal/100000)+EXP(e.comm/999)   FROM   emp001  e;
EXP(e.sal/100000)+EXP(e.comm/999)
2.0180923632412178
NULL
NULL
NULL
2.0514137178612595
NULL
NULL
NULL
2.038517564472082
2.0180923632412178
exp-3-1-2  select嵌套                    
SELECT  EXP(EXP(e.DEPTNO/99)),exp(EXP(EXP(e.DEPTNO/99))/9)  FROM   emp001  e;
EXP(EXP(e.DEPTNO/99))	exp(EXP(EXP(e.DEPTNO/99))/9)
3.400330839211124	1.459092311150233
3.400330839211124	1.459092311150233
3.400330839211124	1.459092311150233
3.400330839211124	1.459092311150233
3.400330839211124	1.459092311150233
3.400330839211124	1.459092311150233
3.400330839211124	1.459092311150233
3.400330839211124	1.459092311150233
3.400330839211124	1.459092311150233
3.400330839211124	1.459092311150233
exp-3-1-3   别名                     
SELECT  EXP(EXP(e.DEPTNO/99))   hello   FROM   emp001  e;
hello
3.400330839211124
3.400330839211124
3.400330839211124
3.400330839211124
3.400330839211124
3.400330839211124
3.400330839211124
3.400330839211124
3.400330839211124
3.400330839211124
SELECT  EXP(EXP(e.DEPTNO/99))   hello你好世界   FROM   emp001  e;
hello你好世界
3.400330839211124
3.400330839211124
3.400330839211124
3.400330839211124
3.400330839211124
3.400330839211124
3.400330839211124
3.400330839211124
3.400330839211124
3.400330839211124
exp-3-1-4   where 子句
SELECT  EXP(e.DEPTNO)   FROM   emp001  e  WHERE  e.SAL<1000;
EXP(e.DEPTNO)
485165195.4097903
485165195.4097903
485165195.4097903
485165195.4097903
485165195.4097903
485165195.4097903
485165195.4097903
485165195.4097903
485165195.4097903
exp-3-1-5   order by 子句  GROUP BY和ORDER BY 的字段要统一
SELECT  EXP(e.DEPTNO)   FROM   emp001  e ORDER BY e.sal;
EXP(e.DEPTNO)
485165195.4097903
485165195.4097903
485165195.4097903
485165195.4097903
485165195.4097903
485165195.4097903
485165195.4097903
485165195.4097903
485165195.4097903
485165195.4097903
SELECT  EXP(e.DEPTNO)   FROM   emp001  e GROUP BY DEPTNO   ORDER BY e.DEPTNO;
EXP(e.DEPTNO)
485165195.4097903
exp-3-1-6   having子句   having要放在order by前面
SELECT  EXP(e.DEPTNO)   FROM   emp001  e GROUP BY DEPTNO HAVING e.DEPTNO>20   ORDER BY e.DEPTNO ;
EXP(e.DEPTNO)
exp-3-1-7   insert into的values         
INSERT INTO EMP001 VALUES(EXP(3),'MILLER','CLERK',EXP(4),'1983-11-23 00:00:00',EXP(5),NULL,EXP(10));
SELECT  *    FROM   emp001  e   WHERE e.EMPNO=floor(EXP(3));
EMPNO	ENAME	JOB	MGR	HIREDATE	SAL	COMM	DEPTNO
20	MILLER	CLERK	55	1983-11-23	148	NULL	22026
exp-3-1-8   update的set                   
UPDATE   EMP001  SET   sal = EXP(30);
SELECT  sal   FROM   emp001  e;
sal
10686474581524
10686474581524
10686474581524
10686474581524
10686474581524
10686474581524
10686474581524
10686474581524
10686474581524
10686474581524
10686474581524
exp-3-1-9        聚合函数                       
SELECT max(EXP(e.mgr/88))    FROM   emp001  e;
max(EXP(e.mgr/88))
9.946502792294937e38
SELECT EXP(e.mgr/88)  FROM   emp001  e;
EXP(e.mgr/88)
9.946502792294937e38
9.946502792294937e38
9.946502792294937e38
9.946502792294937e38
9.946502792294937e38
9.946502792294937e38
9.946502792294937e38
9.946502792294937e38
9.946502792294937e38
9.946502792294937e38
1.8682459574322223
exp-3-2-1   select            
CALL mayitest();
SELECT EXP(r.DEPTNO/100005),exp(r.COMM/5000)   FROM   emp001  r   WHERE   sal > (SELECT  exp(sal/1000)    FROM   emp001   e   WHERE    e.EMPNO=2) ;
EXP(r.DEPTNO/100005)	exp(r.COMM/5000)
1.0002000099993333	1.0020020013340003
1.0002000099993333	1.010050167084168
1.0002000099993333	NULL
1.0002000099993333	NULL
1.0002000099993333	NULL
1.0002000099993333	1.006018036054065
1.0002000099993333	1.0020020013340003
SELECT EXP(r.DEPTNO/100005),exp(r.COMM/5000)   FROM   emp001  r   WHERE   sal < (SELECT  exp(sal/1000)    FROM   emp001   e   WHERE    e.EMPNO=3) ;
EXP(r.DEPTNO/100005)	exp(r.COMM/5000)
CALL mayitest();
SELECT EXP(r.DEPTNO/100005),exp(r.COMM/5000)   FROM   emp001  r   WHERE   sal < (SELECT  exp(sal/1000)    FROM   emp001   e   WHERE    e.EMPNO=4) ;
EXP(r.DEPTNO/100005)	exp(r.COMM/5000)
1.0002000099993333	NULL
1.0002000099993333	NULL
exp-3-2-2   exists，any，all
select    *   from   emp001 e  WHERE   exists(select  exp(sal/100)   from emp001 r where  exp(r.sal/100)>exp(e.COMM/100)) ;
EMPNO	ENAME	JOB	MGR	HIREDATE	SAL	COMM	DEPTNO
1	SMITH	CLERK	7902	1983-11-23	800	10	20
5	SMITH	CLERK	7902	1983-11-23	9	50	20
9	SMITH	CLERK	7902	1983-11-23	800	30	20
10	SMITH	CLERK	7902	1983-11-23	800	10	20
SELECT *  FROM emp001 e  WHERE  EXP(e.DEPTNO)  > any(select exp(r.COMM/5) from emp001 r where r.DEPTNO>10);
EMPNO	ENAME	JOB	MGR	HIREDATE	SAL	COMM	DEPTNO
1	SMITH	CLERK	7902	1983-11-23	800	10	20
2	SMITH	CLERK	7902	1983-11-23	0	NULL	20
3	SMITH	CLERK	7902	1983-11-23	NULL	NULL	20
4	SMITH	CLERK	7902	1983-11-23	0	NULL	20
5	SMITH	CLERK	7902	1983-11-23	9	50	20
6	SMITH	CLERK	7902	1983-11-23	10	NULL	20
7	SMITH	CLERK	7902	1983-11-23	800	NULL	20
8	SMITH	CLERK	7902	1983-11-23	800	NULL	20
9	SMITH	CLERK	7902	1983-11-23	800	30	20
10	SMITH	CLERK	7902	1983-11-23	800	10	20
SELECT *  FROM emp001 e  WHERE  EXP(e.DEPTNO)  > some(select exp(r.COMM/5) from emp001 r where r.DEPTNO>10);
EMPNO	ENAME	JOB	MGR	HIREDATE	SAL	COMM	DEPTNO
1	SMITH	CLERK	7902	1983-11-23	800	10	20
2	SMITH	CLERK	7902	1983-11-23	0	NULL	20
3	SMITH	CLERK	7902	1983-11-23	NULL	NULL	20
4	SMITH	CLERK	7902	1983-11-23	0	NULL	20
5	SMITH	CLERK	7902	1983-11-23	9	50	20
6	SMITH	CLERK	7902	1983-11-23	10	NULL	20
7	SMITH	CLERK	7902	1983-11-23	800	NULL	20
8	SMITH	CLERK	7902	1983-11-23	800	NULL	20
9	SMITH	CLERK	7902	1983-11-23	800	30	20
10	SMITH	CLERK	7902	1983-11-23	800	10	20
exp-3-2-3   create as                   
DROP TABLE   if exists   test001;
create table test001  as select * from EMP001;
DROP TABLE   if exists   test001;
create TABLE  test001  as    SELECT   *   from   EMP001  e  WHERE   e.DEPTNO IN(SELECT  DEPTNO from   EMP001 r  WHERE r.SAL>EXP(5));
SELECT count(*)  FROM  test001;
count(*)
10
exp-3-2-4    insert into as                              
INSERT    INTO   test001   SELECT   *   from   EMP001  e  WHERE   e.DEPTNO IN(SELECT  DEPTNO from   EMP001 r  WHERE r.SAL>EXP(5));
SELECT  count(*) FROM  test001;
count(*)
20
exp-3-2-5   update set                          
UPDATE   test001   e   SET  e.COMM=exp(10)  WHERE   e.DEPTNO  IN(SELECT  DEPTNO from   EMP001 r  WHERE r.SAL>EXP(5));
SELECT  * FROM  test001;
EMPNO	ENAME	JOB	MGR	HIREDATE	SAL	COMM	DEPTNO
1	SMITH	CLERK	7902	1983-11-23	800	22026	20
2	SMITH	CLERK	7902	1983-11-23	0	22026	20
3	SMITH	CLERK	7902	1983-11-23	NULL	22026	20
4	SMITH	CLERK	7902	1983-11-23	0	22026	20
5	SMITH	CLERK	7902	1983-11-23	9	22026	20
6	SMITH	CLERK	7902	1983-11-23	10	22026	20
7	SMITH	CLERK	7902	1983-11-23	800	22026	20
8	SMITH	CLERK	7902	1983-11-23	800	22026	20
9	SMITH	CLERK	7902	1983-11-23	800	22026	20
10	SMITH	CLERK	7902	1983-11-23	800	22026	20
1	SMITH	CLERK	7902	1983-11-23	800	22026	20
2	SMITH	CLERK	7902	1983-11-23	0	22026	20
3	SMITH	CLERK	7902	1983-11-23	NULL	22026	20
4	SMITH	CLERK	7902	1983-11-23	0	22026	20
5	SMITH	CLERK	7902	1983-11-23	9	22026	20
6	SMITH	CLERK	7902	1983-11-23	10	22026	20
7	SMITH	CLERK	7902	1983-11-23	800	22026	20
8	SMITH	CLERK	7902	1983-11-23	800	22026	20
9	SMITH	CLERK	7902	1983-11-23	800	22026	20
10	SMITH	CLERK	7902	1983-11-23	800	22026	20
exp-3-2-6   with as的select        
exp-4-1   算术运算符               
SELECT    exp(e.deptno/10)+exp(comm/10)  FROM   emp001  e;
exp(e.deptno/10)+exp(comm/10)
10.107337927389695
NULL
NULL
NULL
155.80221520150724
NULL
NULL
NULL
27.47459302211832
10.107337927389695
SELECT    exp(e.deptno/10)-exp(comm/10)  FROM   emp001  e;
exp(e.deptno/10)-exp(comm/10)
4.670774270471606
NULL
NULL
NULL
-141.02410300364596
NULL
NULL
NULL
-12.696480824257018
4.670774270471606
SELECT    exp(e.deptno/10)*exp(comm/10)  FROM   emp001  e;
exp(e.deptno/10)*exp(comm/10)
20.085536923187668
NULL
NULL
NULL
1096.6331584284585
NULL
NULL
NULL
148.4131591025766
20.085536923187668
SELECT    exp(e.deptno/10)/exp(comm/10)  FROM   emp001  e;
exp(e.deptno/10)/exp(comm/10)
2.7182818284590455
NULL
NULL
NULL
0.049787068367863944
NULL
NULL
NULL
0.36787944117144233
2.7182818284590455
exp-4-2   比较运算符              
select ename,job,sal,comm from emp where job = 'SALESMAN' or sal > exp(comm/10);
ename	job	sal	comm
SMITH	CLERK	800	10
SMITH	CLERK	800	30
SMITH	CLERK	800	10
select ename,job,sal,comm from emp where job = 'SALESMAN' or sal < exp(comm/10);
ename	job	sal	comm
SMITH	CLERK	9	50
select ename,job,sal,comm from emp where job = 'SALESMAN' or job = 'PRESIDENT' and sal <>exp(comm/10);
ename	job	sal	comm
exp-4-3  逻辑运算符              
select ename,job,sal,comm from emp where job = 'SALESMAN' AND  sal > exp(comm/10);
ename	job	sal	comm
select ename,job,sal,comm from emp where comm < exp(10)  AND  sal > exp(comm/10);
ename	job	sal	comm
SMITH	CLERK	800	10
SMITH	CLERK	800	30
SMITH	CLERK	800	10
exp-4-4   位运算符                               
exp-4-5   连接运算符               
SELECT    exp(e.deptno/10)||exp(comm/10)  FROM   emp001  e;
exp(e.deptno/10)||exp(comm/10)
1
1
1
1
1
1
1
1
1
1
select  exp(10)||exp(5) from dual;
exp(10)||exp(5)
1
常用函数
exp-5-1   concat
select EXP(concat('1','1')) from dual;
EXP(concat('1','1'))
59874.14171519782
SELECT  EXP(concat(e.empno,sal)/10000000)   from    emp001 e;
EXP(concat(e.empno,sal)/10000000)
1.000180016200972
1.000002000002
NULL
1.000004000008
1.000005900017405
1.0000610018605378
1.0007803042791075
1.0008803873136036
1.0009804803569038
1.0010805834100087
exp-5-2   instr
select  EXP(instr('Hello World!','o')) from dual;
EXP(instr('Hello World!','o'))
148.4131591025766
exp-5-3   length
select    EXP(length('Hello World!')) from dual;
EXP(length('Hello World!'))
162754.79141900392
SELECT  EXP(length('张三')) from dual;
EXP(length('张三'))
403.4287934927351
SELECT  EXP(length(e.ename)) from emp001 e  WHERE sal <1000;
EXP(length(e.ename))
148.4131591025766
148.4131591025766
148.4131591025766
148.4131591025766
148.4131591025766
148.4131591025766
148.4131591025766
148.4131591025766
148.4131591025766
exp-5-4   nvl
exp-5-5   replace
select EXP(replace('1','1','10')) from dual;
EXP(replace('1','1','10'))
22026.465794806718
exp-5-6  abs(value)
select EXP(abs(-10)) from dual;
EXP(abs(-10))
22026.465794806718
exp-5-7  ceil(value)
select EXP(ceil(2.3)) from dual;
EXP(ceil(2.3))
20.085536923187668
exp-5-8  floor(value)
select  EXP(floor(2.3)) from dual;
EXP(floor(2.3))
7.38905609893065
exp-5-9  trunc
exp-5-10  round
select  EXP(round(555.666)/5) from dual;
EXP(round(555.666)/5)
1.9658319428099256e48
select EXP(round(555.666,2)/5) from dual;
EXP(round(555.666,2)/5)
1.8402759556747235e48
select EXP(round(555.666,-2)/5) from dual;
EXP(round(555.666,-2)/5)
1.3041808783936323e52
exp-5-11  to_char
exp-5-12  to_number
exp-5-13  cast
视图和同义词
CALL mayitest();
create or replace view    view_emp   AS  select   *    from    emp001;
exp-6-1-1  select语句
SELECT   EXP(e.empno/100)  FROM   view_emp e;
EXP(e.empno/100)
1.010050167084168
1.0202013400267558
1.030454533953517
1.0408107741923882
1.0512710963760241
1.0618365465453596
1.0725081812542165
1.0832870676749586
1.0941742837052104
1.1051709180756477
SELECT   EXP(EXP(EXP(e.empno/10000)))  FROM   view_emp e;
EXP(EXP(EXP(e.empno/10000)))
15.158382569057835
15.162504841447165
15.166629059830758
15.170755225393004
15.174883339319134
15.179013402795276
15.18314541700842
15.187279383146416
15.191415302398013
15.195553175952812
exp-6-1-2  group by having子句   查询字段不是group字段   则要是聚合函数修饰的字段。
SELECT   EXP(sum(e.comm)/100)  FROM   view_emp e  GROUP BY e.deptno HAVING  e.deptno>10;
EXP(sum(e.comm)/100)
2.718281828459045
exp-6-1-3  order by子句
SELECT   EXP(sum(e.comm)/100)  FROM   view_emp e  GROUP BY e.deptno HAVING e.deptno>10  ORDER BY EXP(e.deptno);
EXP(sum(e.comm)/100)
2.718281828459045
exp-6-1-4    case when
SELECT  CASE  WHEN sal<1000 THEN exp(comm/100)  WHEN sal<2000 THEN exp(comm/100)  WHEN sal<3000 THEN exp(sal/100)
ELSE  exp(comm/100+10)   END sal    FROM view_emp;
sal
1.1051709180756477
NULL
NULL
NULL
1.6487212707001282
NULL
NULL
NULL
1.3498588075760032
1.1051709180756477
SELECT  CASE  WHEN sal<1000 THEN exp(comm/100)  WHEN sal<2000 THEN exp(comm/100)  WHEN sal<3000 THEN exp(sal/100) ELSE  exp(comm/100+10)   END sal    FROM view_emp e  group BY e.sal ;
sal
1.1051709180756477
NULL
NULL
1.6487212707001282
NULL
exp-6-1-5    case when
SELECT  EXP(COUNT(DISTINCT(e.deptno)))  FROM    view_emp e;
EXP(COUNT(DISTINCT(e.deptno)))
2.718281828459045
exp-6-1-6   with as          
exp-6-2
INSERT INTO view_emp VALUES(EXP(10),'MILLER','CLERK',7782,'2009-06-08 23:53:17',1300,NULL,EXP(10));
SELECT  EXP(e.empno/EXP(20))  FROM    view_emp e WHERE e.job='CLERK';
EXP(e.empno/EXP(20))
1.0000000020611537
1.0000000041223072
1.0000000061834609
1.0000000082446145
1.0000000103057682
1.0000000123669217
1.0000000144280754
1.000000016489229
1.0000000185503828
1.0000000206115365
1.0000454000002366
exp-6-3-1
UPDATE  view_emp e   SET  e.COMM=exp(9)   WHERE  e.EMPNO=7369;
SELECT   COMM  FROM    view_emp;
COMM
10
NULL
NULL
NULL
50
NULL
NULL
NULL
30
10
NULL
exp-6-3-2-1
create or replace view    view_emp   AS  select   *    from    emp001;
UPDATE  view_emp   SET  COMM=exp((SELECT  sum(sal)     FROM  view_emp    GROUP BY DEPTNO   HAVING  DEPTNO>30)/10000)    WHERE  EMPNO=1;
SELECT   COMM  FROM    view_emp;
COMM
1
NULL
NULL
NULL
50
NULL
NULL
NULL
30
10
NULL
exp-6-3-2-2
SELECT   COMM  FROM    view_emp;
COMM
1
NULL
NULL
NULL
50
NULL
NULL
NULL
30
10
NULL
CALL mayitest();
create or replace view    view_emp   AS  select   *    from    emp001;
exp-6-4-1
DELETE   FROM   view_emp   WHERE   deptno< exp(1)+10;
exp-6-4-2-1  嵌套group by having子句
DELETE   FROM   view_emp   WHERE   deptno< exp((SELECT   sum(ggg.aaa)   FROM    (SELECT  sum(t.sal)  aaa    FROM  view_emp t    GROUP BY  DEPTNO) ggg)/1000);
create or replace view    view_emp   AS  select   *    from    emp001;
exp-6-4-2-2   嵌套order by子句
CALL mayitest();
create or replace view    view_emp   AS  select   *    from    emp001;
DELETE   FROM   view_emp   WHERE   deptno< exp((SELECT   sum(ggg.aaa)   FROM    (SELECT  sum(t.sal)  aaa    FROM  view_emp t    GROUP BY  DEPTNO ORDER BY deptno) ggg)/1000);
exp-7   pl/sql                 
DROP TABLE if exists  student001;
create table  student001(name varchar(200),city varchar(200),age BIGINT,salary BIGINT,mon BIGINT);
INSERT INTO student001  VALUES('Kebi','1000',20,3000,100);
INSERT INTO student001  VALUES('James','2000',21,4000,100);
INSERT INTO student001  VALUES('Denglun','3000',22,5000,100);
INSERT INTO student001  VALUES('Yangmi','4000',21,2500,100);
INSERT INTO student001  VALUES('Nana','5000',22,1000,100);
INSERT INTO student001  VALUES('Sunli','6000',20,3000,100);
INSERT INTO student001  VALUES('Dengchao','7000',22,1500,100);
INSERT INTO student001  VALUES('Huge','8000',20,2800,100);
INSERT INTO student001  VALUES('Pengyuyan','9000',24,4500,100);
INSERT INTO student001  VALUES('Baoluo','6000',25,8500,100);
INSERT INTO student001  VALUES('Huting','9000',25,3000,100);
INSERT INTO student001  VALUES('Hurenxiang','5000',23,2500,100);
drop procedure if exists studentwbmlc;//
create procedure studentwbmlc()
begin
declare tablename001 varchar(100);
declare dropname002 varchar(100);
set  @dropname002= 'DROP  TABLE if exists  student;';
set  @tablename001= 'create table student as select * from  student001  where  1=1;';
prepare step001 from @dropname002;
execute step001;
prepare step002 from @tablename001;
execute step002;
end
//
call studentwbmlc();//
SELECT  *  FROM  student;//
name	city	age	salary	mon
Kebi	1000	20	3000	100
James	2000	21	4000	100
Denglun	3000	22	5000	100
Yangmi	4000	21	2500	100
Nana	5000	22	1000	100
Sunli	6000	20	3000	100
Dengchao	7000	22	1500	100
Huge	8000	20	2800	100
Pengyuyan	9000	24	4500	100
Baoluo	6000	25	8500	100
Huting	9000	25	3000	100
Hurenxiang	5000	23	2500	100
exp-7-1-1  无参数的存储过程
drop procedure if exists pl_test;//
create  procedure pl_test()  
begin
declare  i  BIGINT;              
declare  a BIGINT;
declare  b BIGINT;
declare  c BIGINT;
SELECT   EXP(e.age)  into  a FROM student e WHERE  e.NAME='Kebi';
SELECT   EXP(e.SALARY/1000)   into  b FROM   student  e WHERE  e.NAME='Kebi';
SELECT   EXP(e.mon/10000)  into  c FROM   student  e WHERE  e.NAME='Kebi';
set i=0;
loop_label:loop
INSERT INTO student  VALUES('Kebi',a,20,3000,100);
INSERT INTO student  VALUES('James','2000',21,b,100);
INSERT INTO student  VALUES('Denglun','3000',22,c,100);
set i=i+1;
if  i>=100 then
leave loop_label;
end if;
end loop;
end;
//
select  count(*)  from student;//
count(*)
12
call  pl_test();//
select  count(*)  from student;//
count(*)
312
SELECT   DISTINCT(EXP(e.age))  FROM student e WHERE  e.NAME='Kebi';//
(EXP(e.age))
485165195.4097903
exp-7-1-2  只有一个 in 参数的存储过程  :  ---begin 里面使用的变量必须在begin上面定义过。
call studentwbmlc();//
drop procedure if exists pl_test;//
create  procedure pl_test (in numb int)
begin
declare  i BIGINT;
declare  a BIGINT;
declare  b BIGINT;
declare  c BIGINT;
SELECT   EXP(e.age)  INTO a FROM student e WHERE  e.NAME='Kebi';
SELECT   EXP(e.SALARY/1000)    INTO b FROM   student  e WHERE  e.NAME='Kebi';
SELECT   EXP(e.mon/900)    INTO c FROM   student  e WHERE  e.NAME='Kebi';
set i:=1;
REPEAT
INSERT INTO student  VALUES('Kebi',a,20,3000,100);
INSERT INTO student  VALUES('James','2000',21,b,100);
INSERT INTO student  VALUES('Denglun','3000',22,c,100);
set i := i + 1;
until  i >= 100 END REPEAT;
end;
//
call   pl_test(100);//
SELECT   DISTINCT(EXP(e.age))  FROM student e WHERE  e.NAME='Kebi';//
(EXP(e.age))
485165195.4097903
exp-7-1-3   包含 out 
CALL studentwbmlc();//
drop procedure if exists pl_test;//
CREATE   PROCEDURE pl_test( OUT p1  int,OUT p2  int, OUT p3  int)
BEGIN
declare  i BIGINT;
SELECT   EXP(e.age)  INTO p1 FROM student e WHERE  e.NAME='Kebi';
SELECT   EXP(e.SALARY/1000)    INTO p2 FROM   student  e WHERE  e.NAME='Kebi';
SELECT   EXP(e.mon/50)    INTO p3 FROM   student  e WHERE  e.NAME='Kebi';
set i:=1;
WHILE i <= 5 DO
INSERT INTO student  VALUES('Kebi',p1*i,20,3000,100);
INSERT INTO student  VALUES('James','2000',p2+i,5000,100);
INSERT INTO student  VALUES('Denglun','3000',22,p3+i,100);
set i := i + 1;
END WHILE;
END;
//
call pl_test(@p1,@p2,@p3);//
SELECT count(*) FROM   student;//
count(*)
27
SELECT   DISTINCT(EXP(e.age))  FROM student e WHERE  e.NAME='Kebi';//
(EXP(e.age))
485165195.4097903
exp-7-1-4 包含 inout 参数的存储过程,in需要穿参数   out的传变量，in  out 的作in使用就按照in处理 作out使用就按照out处理   
CALL studentwbmlc();//
drop procedure if exists pl_test;//
CREATE  PROCEDURE pl_test(OUT p1   int ,in  p2   int, inout p3 int)
BEGIN	
declare  i BIGINT;
SELECT   EXP(e.age)  INTO p1 FROM student e WHERE  e.NAME='Kebi';
SELECT   EXP(e.mon/100)    INTO p3 FROM   student  e WHERE  e.NAME='Kebi';
set i:=1;
WHILE i <= 10 DO
INSERT INTO student  VALUES('Kebi',p1*i,20,3000,100);
INSERT INTO student  VALUES('James','2000',p2,5000,100);
INSERT INTO student  VALUES('Denglun','3000',22,p3+i,100);
set i := i + 1;
END WHILE;
END;
//
call pl_test(@p1,100,@p3);//
SELECT count(*) FROM   student;//
count(*)
42
SELECT   DISTINCT(EXP(e.age))  FROM student e WHERE  e.NAME='Kebi';//
(EXP(e.age))
485165195.4097903
exp-7-1-5    存储过程用循环      
CALL studentwbmlc();//
drop procedure if exists pl_test;//
CREATE PROCEDURE pl_test(in p1 int)
BEGIN	
declare  i BIGINT;
set i:=1;
while i <= 100 do
INSERT INTO student  VALUES('Kebi',p1*i,20,3000,100);
INSERT INTO student  VALUES('James','2000',p1,5000,100);
INSERT INTO student  VALUES('Denglun','3000',22,p1+i,100);
set i := i + 1;
END WHILE;
END;
//
CALL  pl_test(EXP(10));//
SELECT count(*) FROM   student;//
count(*)
312
SELECT   DISTINCT(EXP(e.age/10))  FROM student e WHERE  e.NAME='Kebi';//
(EXP(e.age/10))
7.38905609893065
SELECT   DISTINCT(EXP(e.age/-1000))  FROM student e WHERE  e.NAME='Kebi';//
(EXP(e.age/-1000))
0.9801986733067553
exp-7-1-6   存储过程和函数的结果作为参数传递
CALL studentwbmlc();//
drop function  IF EXISTS fun_test;//
create  function fun_test()  returns BIGINT   
begin
DECLARE ag BIGINT DEFAULT 0;
select exp(sum(salary)/10000) into ag from student;   
return ag;  
end//
select  fun_test()  from  dual//
fun_test()
62
drop procedure if exists pl_test;//
CREATE  PROCEDURE pl_test( in p1 int)
BEGIN	
declare  i BIGINT DEFAULT 0;
while i <= 10 do
INSERT INTO student  VALUES('Kebi',p1*i,20,3000,100);
INSERT INTO student  VALUES('James','2000',p1,5000,100);
INSERT INTO student  VALUES('Denglun','3000',22,p1+i,100);
set i := i + 1;
END WHILE;
end
//
CALL  pl_test(fun_test());//
SELECT count(*) FROM   student;//
count(*)
45
SELECT   DISTINCT(EXP(e.age/1000))  FROM student e WHERE  e.NAME='Kebi';//
(EXP(e.age/1000))
1.0202013400267558
函数function                  
exp-7-2-1  无参数的自定义函数
CALL studentwbmlc();//
drop function  IF EXISTS fun_test;//
create  function fun_test() returns int
begin
declare  i BIGINT DEFAULT 0;
select EXP(salary/1000) into i from student e WHERE  e.NAME='Kebi'; 
return i;
end;
//
select  fun_test()  from  dual;//
fun_test()
20
exp-7-2-2   自定义函数  有参数
drop function  IF EXISTS fun_test;//
create  function fun_test(empname1  varchar(20),empname2  varchar(20)) returns BIGINT
begin   
declare  a BIGINT DEFAULT 0;
declare  b  BIGINT DEFAULT 0;
select EXP(salary/1000) into a from student e WHERE  e.NAME=empname1; 
select EXP(salary/exp(10)) into b from student e WHERE  e.NAME=empname2; 
return(a*b);   
end;
//
select  fun_test('Kebi','Denglun')  from dual;//
fun_test('Kebi','Denglun')
20
exp-7-2-3 自定义函数使用循环    
drop function  IF EXISTS fun_test;//
create   function fun_test(empname  varchar(20))returns int
BEGIN
declare  a BIGINT DEFAULT 0;
declare  b  BIGINT DEFAULT 0;
declare  i  BIGINT DEFAULT 0;
SELECT  EXP(salary/1000) into a  from student  where  name =empname;
SELECT   EXP(age/10.00) into b   from student where  name =empname;
while i <= 100 do
INSERT INTO student  VALUES('Kebi',200,a,3000,100);
INSERT INTO student  VALUES('James','2000',b,5000,100);
INSERT INTO student  VALUES('Denglun','3000',22,a,b);
set i := i + 1;
END WHILE;
return(a*b);   
end;
//
select  fun_test('Kebi')  from dual;//
fun_test('Kebi')
140
exp-7-3     游标   在begin 后 添加一行 代码：            
drop table  IF EXISTS  store;//
CREATE TABLE IF NOT EXISTS store(
id    int(11) NOT NULL AUTO_INCREMENT,
name  varchar(20) NOT NULL,
count int(11) NOT NULL DEFAULT '1',PRIMARY KEY (id)
)DEFAULT CHARSET=gbk AUTO_INCREMENT=9;//
INSERT INTO store(id, name, count) VALUES(1, 'android', 15),(2, 'iphone', 14),(3, 'iphone', 20),(4, 'android', 5),(5, 'android', 13),(6, 'iphone', 13),(7, 'iphonee', 15),(8, 'iphone9', 19);//
select   *  from  store;//
id	name	count
1	android	15
2	iphone	14
3	iphone	20
4	android	5
5	android	13
6	iphone	13
7	iphonee	15
8	iphone9	19
drop procedure if exists fun_test//
CREATE PROCEDURE fun_test()
begin	
# 创建接收游标数据的变量
declare c int;         #获取单条纪录的数量
declare n varchar(20); #获取名称
# 创建总数变量
declare total BIGINT default 0;
# 创建结束标志变量
declare done int default false;
# 创建游标 获取name和count的集合
declare cur cursor for select name,exp(count) from store where name = 'iphone';
# 指定游标循环结束时的返回值
declare continue HANDLER for not found set done = true;
# set赋值全局变量时 写在declare的下面。
set @total002 := 100;
# 设置初始值：set后的变量要么是前面已经定义过的局部变量，要么set后的变量前面加@定义成系统变量
set total = 0;#这里是否设置初始值都可以，上面定义变量时已经设置了默认值
# 打开游标
open cur;
# 开始循环游标里的数据
read_loop:loop
# 根据游标当前指向的一条数据 插入到上面申明的局部变量中
fetch cur into n,c;#右边循环结束时会给done赋值
# 判断游标的循环是否结束
if done then
leave read_loop;	# 跳出游标循环
end if;
# 获取一条数据时，将count值进行累加操作，这里可以做任意你想做的操作，
set @totaldone := total + exp(c/100000000);# 每次循环都设置一个新变量@totaldone，
set total := total + c;     #total为历次循环的综合
# 有loop 就一定要有end loop
end loop;
# 关闭游标
close cur; 
# 输出结果
select total;
END//
call fun_test();//
total
486810212
select @totaldone;//
@totaldone
486367800.00443393
drop database  IF EXISTS  ob100x;//
