drop database if exists db_lob_src;
drop database if exists db_lob_fork;
SET wait_timeout=30000000;
SET ob_trx_timeout = 100000000;
SET ob_query_timeout = 100000000;
============================================
1. Fork含TEXT字段的数据库
============================================
create database db_lob_src;
use db_lob_src;
# 创建含TEXT字段的表
create table t_text (
id int primary key,
name varchar(50),
content text,
description longtext
);
# 创建含BLOB字段的表
create table t_blob (
id int primary key,
name varchar(50),
data blob,
large_data longblob
);
# 插入数据
insert into t_text values (1, 'Text1', repeat('A', 1000), repeat('B', 5000));
insert into t_text values (2, 'Text2', repeat('C', 2000), repeat('D', 10000));
insert into t_blob values (1, 'Blob1', repeat('X', 1000), repeat('Y', 5000));
insert into t_blob values (2, 'Blob2', repeat('Z', 2000), repeat('W', 10000));
# Fork数据库
fork database db_lob_src to db_lob_fork;
============================================
2. 验证Fork库中LOB数据
============================================
use db_lob_fork;
# 验证TEXT数据长度
select id, name, length(content) as content_len, length(description) as desc_len from t_text order by id;
id	name	content_len	desc_len
1	Text1	1000	5000
2	Text2	2000	10000
# 验证BLOB数据长度
select id, name, length(data) as data_len, length(large_data) as large_len from t_blob order by id;
id	name	data_len	large_len
1	Blob1	1000	5000
2	Blob2	2000	10000
# 验证TEXT数据内容正确
select id, left(content, 10) as content_preview, left(description, 10) as desc_preview from t_text order by id;
id	content_preview	desc_preview
1	AAAAAAAAAA	BBBBBBBBBB
2	CCCCCCCCCC	DDDDDDDDDD
============================================
3. 验证LOB数据隔离
============================================
# 修改Fork库中的LOB数据
update db_lob_fork.t_text set content = repeat('FORK', 500) where id = 1;
# 验证Fork库数据已修改
select id, left(content, 10) as fork_content, length(content) as len from db_lob_fork.t_text where id = 1;
id	fork_content	len
1	FORKFORKFO	2000
# 验证源库数据未受影响
select id, left(content, 10) as src_content, length(content) as len from db_lob_src.t_text where id = 1;
id	src_content	len
1	AAAAAAAAAA	1000
# 在Fork库中插入新的大LOB数据
insert into db_lob_fork.t_text values (3, 'Fork_New', repeat('NEW', 3000), repeat('LONG', 20000));
select id, name, length(content), length(description) from db_lob_fork.t_text where id = 3;
id	name	length(content)	length(description)
3	Fork_New	9000	80000
# 验证源库无此数据
select count(*) as cnt from db_lob_src.t_text where id = 3;
cnt
0
============================================
4. 清理
============================================
drop database if exists db_lob_src;
drop database if exists db_lob_fork;
