ob1=OBI(cluster=1:1:1, proxy_num=1,init_unit_cpu=5);
ob1.reboot;
ob1.mysql alter system set enable_auto_leader_switch=false;
drop table if exists test01;
drop table if exists test02;
drop table if exists test03;
create table test01 (c1 int primary key, c2 int) primary_zone='z1';
create table test02 (c1 int primary key, c2 int) primary_zone='z1';
create table test03 (c1 int primary key, c2 int) partition by hash(c1 % 3) partitions 3;
ob1.z1.obs0.switch_partition obtest:test:test03:0;
ob1.z2.obs0.switch_partition obtest:test:test03:1;
ob1.z3.obs0.switch_partition obtest:test:test03:2;
set autocommit=0;
insert into test01 values(1, 1);
insert into test01 values(2, 2);
insert into test02 values(1, 1);
insert into test02 values(2, 2);
commit;
begin;
select * from test01;
c1	c2
1	1
2	2
select * from test02;
c1	c2
1	1
2	2
commit;
set autocommit=1;
4
set autocommit=0;
insert into test03 values(0, 1);
insert into test03 values(1, 1);
insert into test03 values(2, 1);
commit;
set autocommit = 1;
select * from test03;
c1	c2
0	1
1	1
2	1
set autocommit=1;
3
set autocommit=1;
update test01 set c2 = 0 where c1 = 1;
update test02 set c2 = 0 where c1 = 1;
set autocommit=0;
select * from test01;
c1	c2
1	0
2	2
select * from test02;
c1	c2
1	0
2	2
commit;
set autocommit=1;
correct result in local transaction, 0, 0
set autocommit=1;
update test03 set c2 = 0 where c1 = 1;
update test03 set c2 = 0 where c1 = 2;
select * from test03;
c1	c2
0	1
1	0
2	0
set autocommit=1;
correct result in distribute transaction, 0, 0
