# Test of CAST(literal AS JSON)
select json_type(cast(cast('2014-11-25 18:00' as datetime) as json));
json_type(cast(cast('2014-11-25 18:00' as datetime) as json))
DATETIME
select json_type(cast(cast('2014-11-25' as date) as json));
json_type(cast(cast('2014-11-25' as date) as json))
DATE
select json_type(cast(cast('18:00:59' as time) as json));
json_type(cast(cast('18:00:59' as time) as json))
TIME
select json_type(cast(127 as json));
json_type(cast(127 as json))
INTEGER
select json_type(cast(255 as json));
json_type(cast(255 as json))
INTEGER
select json_type(cast(32767 as json));
json_type(cast(32767 as json))
INTEGER
select json_type(cast(65535 as json));
json_type(cast(65535 as json))
INTEGER
select json_type(cast(8388607 as json));
json_type(cast(8388607 as json))
INTEGER
select json_type(cast(16777215 as json));
json_type(cast(16777215 as json))
INTEGER
select json_type(cast(2147483647 as json));
json_type(cast(2147483647 as json))
INTEGER
select json_type(cast(4294967295 as json));
json_type(cast(4294967295 as json))
INTEGER
select json_type(cast(9223372036854775807 as json));
json_type(cast(9223372036854775807 as json))
INTEGER
select json_type(cast(18446744073709551615 as json));
json_type(cast(18446744073709551615 as json))
UNSIGNED INTEGER
select json_type(cast(true as json));
json_type(cast(true as json))
BOOLEAN
select json_type(cast(b'10101' as json));
json_type(cast(b'10101' as json))
BLOB
select json_type(cast(cast(3.14 as decimal(5,2)) as json));
json_type(cast(cast(3.14 as decimal(5,2)) as json))
DECIMAL
select json_type(cast(3.14 as json));
json_type(cast(3.14 as json))
DECIMAL
select json_type(cast(3.14E30 as json));
json_type(cast(3.14E30 as json))
DOUBLE
select json_type(cast(cast('10101abcde' as binary) as json));
json_type(cast(cast('10101abcde' as binary) as json))
BLOB
select json_type(cast(null as json));
json_type(cast(null as json))
NULL
select json_type(cast(null as json)) is null;
json_type(cast(null as json)) is null
1
select json_type(null) is null;
json_type(null) is null
1
select cast(cast('2014-11-25 18:00' as datetime) as json);
cast(cast('2014-11-25 18:00' as datetime) as json)
"2014-11-25 18:00:00.000000"
select cast(cast('2014-11-25' as date) as json);
cast(cast('2014-11-25' as date) as json)
"2014-11-25"
select cast(cast('18:00:59' as time) as json);
cast(cast('18:00:59' as time) as json)
"18:00:59.000000"
select cast(127 as json);
cast(127 as json)
127
select cast(255 as json);
cast(255 as json)
255
select cast(32767 as json);
cast(32767 as json)
32767
select cast(65535 as json);
cast(65535 as json)
65535
select cast(8388607 as json);
cast(8388607 as json)
8388607
select cast(16777215 as json);
cast(16777215 as json)
16777215
select cast(2147483647 as json);
cast(2147483647 as json)
2147483647
select cast(4294967295 as json);
cast(4294967295 as json)
4294967295
select cast(9223372036854775807 as json);
cast(9223372036854775807 as json)
9223372036854775807
select cast(18446744073709551615 as json);
cast(18446744073709551615 as json)
18446744073709551615
select cast(true as json);
cast(true as json)
true
select cast(b'10101' as json);
cast(b'10101' as json)
"base64:type15:FQ=="
select cast(1 as json) or NULL;
cast(1 as json) or NULL
1
select cast(0 as json) or NULL;
cast(0 as json) or NULL
NULL
select json_array(0) or NULL;
json_array(0) or NULL
1
select cast(cast(3.14 as decimal(5,2)) as json);
cast(cast(3.14 as decimal(5,2)) as json)
3.14
select cast(3.14 as json);
cast(3.14 as json)
3.14
select cast(3.14e0 as json);
cast(3.14e0 as json)
3.14
select cast(cast('10101abcde' as binary) as json);
cast(cast('10101abcde' as binary) as json)
"base64:type253:MTAxMDFhYmNkZQ=="
select cast(null as json);
cast(null as json)
NULL
select cast(null as json) is null;
cast(null as json) is null
1
# ----------------------------------------------------------------------
# Test of CAST(<column> AS JSON)
# ----------------------------------------------------------------------
drop table if exists t1;
create table t1(dati datetime, da date,
tim time, ts timestamp,
y year,
ti tinyint,   tiu tinyint unsigned,
si smallint,  siu smallint unsigned,
mi mediumint, miu mediumint unsigned,
i  int,       iu  int unsigned,
bi bigint,    biu bigint unsigned,
boo boolean,
dc decimal(5,2),
n numeric(5,2),
f float, d double,
bitt bit(10),
blb blob,
bin binary(10),
js json
);
insert into t1 values('2014-11-25 18:00', '2014-11-25',
'18:00:59', '2014-11-25 18:00',
'1999',
127, 255,
32767, 65535,
8388607, 16777215, -- 3 bytes
2147483647, 4294967295, -- 4 bytes
9223372036854775807, 18446744073709551615,
true,
3.14,
3.14,
3.14, 3.14,
b'10101',
'10101abcde',
'10101abcde',
'[123]'
                      );
select json_type(cast(dati as json)) from t1;
json_type(cast(dati as json))
DATETIME
select json_type(cast(da as json)) from t1;
json_type(cast(da as json))
DATE
select json_type(cast(tim as json)) from t1;
json_type(cast(tim as json))
TIME
select json_type(cast(ts as json)) from t1;
json_type(cast(ts as json))
TIMESTAMP
select json_type(cast(y as json)) from t1;
json_type(cast(y as json))
INTEGER
select json_type(cast(ti as json)) from t1;
json_type(cast(ti as json))
INTEGER
select json_type(cast(tiu as json)) from t1;
json_type(cast(tiu as json))
UNSIGNED INTEGER
select json_type(cast(si as json)) from t1;
json_type(cast(si as json))
INTEGER
select json_type(cast(siu as json)) from t1;
json_type(cast(siu as json))
UNSIGNED INTEGER
select json_type(cast(mi as json)) from t1;
json_type(cast(mi as json))
INTEGER
select json_type(cast(miu as json)) from t1;
json_type(cast(miu as json))
UNSIGNED INTEGER
select json_type(cast(i as json)) from t1;
json_type(cast(i as json))
INTEGER
select json_type(cast(iu as json)) from t1;
json_type(cast(iu as json))
UNSIGNED INTEGER
select json_type(cast(bi as json)) from t1;
json_type(cast(bi as json))
INTEGER
select json_type(cast(biu as json)) from t1;
json_type(cast(biu as json))
UNSIGNED INTEGER
select json_type(cast(boo as json)) from t1;
json_type(cast(boo as json))
INTEGER
select json_type(cast(dc as json)) from t1;
json_type(cast(dc as json))
DECIMAL
select json_type(cast(f as json)) from t1;
json_type(cast(f as json))
DOUBLE
select json_type(cast(d as json)) from t1;
json_type(cast(d as json))
DOUBLE
select json_type(cast(bitt as json)) from t1;
json_type(cast(bitt as json))
BIT
select json_type(cast(blb as json)) from t1;
json_type(cast(blb as json))
BLOB
select json_type(cast(bin as json)) from t1;
json_type(cast(bin as json))
BLOB
select json_type(cast(js as json)) from t1;
json_type(cast(js as json))
ARRAY
select cast(dati as json) from t1;
cast(dati as json)
"2014-11-25 18:00:00.000000"
select cast(da as json) from t1;
cast(da as json)
"2014-11-25"
select cast(tim as json) from t1;
cast(tim as json)
"18:00:59.000000"
select cast(ts as json) from t1;
cast(ts as json)
"2014-11-25 18:00:00.000000"
select cast(y as json) from t1;
cast(y as json)
1999
select cast(ti as json) from t1;
cast(ti as json)
127
select cast(tiu as json) from t1;
cast(tiu as json)
255
select cast(si as json) from t1;
cast(si as json)
32767
select cast(siu as json) from t1;
cast(siu as json)
65535
select cast(mi as json) from t1;
cast(mi as json)
8388607
select cast(miu as json) from t1;
cast(miu as json)
16777215
select cast(i as json) from t1;
cast(i as json)
2147483647
select cast(iu as json) from t1;
cast(iu as json)
4294967295
select cast(bi as json) from t1;
cast(bi as json)
9223372036854775807
select cast(biu as json) from t1;
cast(biu as json)
18446744073709551615
select cast(boo as json) from t1;
cast(boo as json)
1
select cast(dc as json) from t1;
cast(dc as json)
3.14
select cast(f as json) from t1;
cast(f as json)
3.140000104904175
select cast(d as json) from t1;
cast(d as json)
3.14
select cast(bitt as json) from t1;
cast(bitt as json)
"base64:type16:ABU="
select cast(blb as json) from t1;
cast(blb as json)
"base64:type252:MTAxMDFhYmNkZQ=="
select cast(bin as json) from t1;
cast(bin as json)
"base64:type254:MTAxMDFhYmNkZQ=="
select cast(js as json) from t1;
cast(js as json)
[123]
#
# Bug#21442878 INCORRECT RETURN STATUS FROM
#              ITEM_JSON_TYPECAST::VAL_JSON() ON PARSE ERRORS
#
drop table t1;
create table t1 ( c1 varchar(200) character set 'gbk',
c2 varchar(200) character set 'utf8' );
insert into t1 values ('[1,2]',  # legal json, but not utf-8
'[1,2 ');
select cast(c1 as json) from t1;
cast(c1 as json)
[1, 2]
select cast(c2 as json) from t1;
ERROR 22032: Invalid JSON text in argument.
select cast(c2 as json) is null from t1;
ERROR 22032: Invalid JSON text in argument.
drop table t1;
drop table if exists t2;
create table t2(x int);
insert into t2 values (1), (2);
select x, cast(y as json) from (select x, cast(x as json) as y from t2) s order by x;
x	cast(y as json)
1	1
2	2
select x, cast(y as json) from (select x, cast(cast(x as json) as char) as y from t2) s order by x;
x	cast(y as json)
1	1
2	2
drop table t2;
# ----------------------------------------------------------------------
# Test of CAST(<select> AS JSON)
# ----------------------------------------------------------------------
select cast((select 1) as json);
cast((select 1) as json)
1
drop table if exists t;
create table t(i int, j json, c char(10) character set 'utf8');
insert into t values (5, '6', '{}');
select cast((select i from t) as json);
cast((select i from t) as json)
5
select cast((select j from t) as json);
cast((select j from t) as json)
6
select cast((select c from t) as json);
cast((select c from t) as json)
{}
select cast((select cast(i as json) from t) as json);
cast((select cast(i as json) from t) as json)
5
select cast((select cast(j as json) from t) as json);
cast((select cast(j as json) from t) as json)
6
select cast((select cast(c as json) from t) as json);
cast((select cast(c as json) from t) as json)
{}
insert into t values (7, '8', '[]');
select cast((select i from t) as json);
ERROR 21000: Subquery returns more than 1 row
delete from t;
insert into t values (null, null, null);
select cast((select i from t) as json);
cast((select i from t) as json)
NULL
select cast((select j from t) as json);
cast((select j from t) as json)
NULL
select cast((select cast(i as json) from t) as json);
cast((select cast(i as json) from t) as json)
NULL
select cast((select cast(j as json) from t) as json);
cast((select cast(j as json) from t) as json)
NULL
select cast((select cast(c as json) from t) as json);
cast((select cast(c as json) from t) as json)
NULL
select cast((select i,i from t) as json);
ERROR 21000: Operand should contain 1 column(s)
select cast((select * from t) as json);
ERROR 21000: Operand should contain 1 column(s)
drop table t;
SELECT JSON_EXTRACT('{"id": 14, "name": "Aztalan"}', '$.name')+JSON_EXTRACT('{"id": 14, "name": "zhangsan"}', '$.name');
JSON_EXTRACT('{"id": 14, "name": "Aztalan"}', '$.name')+JSON_EXTRACT('{"id": 14, "name": "zhangsan"}', '$.name')
0
#bug:
drop table if exists t;
Warnings:
Note	1051	Unknown table 'test.t'
CREATE TABLE t(id INT, j JSON, gc INT GENERATED ALWAYS AS (JSON_EXTRACT(j, '$[0]')));
INSERT INTO t(id, j) VALUES (0, '"5"'), (1, '[]'), (2, '[1,2]'), (3, '5');
INSERT INTO t(j) VALUES ('{}');
ERROR 22018: Invalid JSON value for CAST
drop table t;
create table t1 (c1 int primary key, c2 json);
insert into t1 values(1,'true');
insert into t1 values(2,'123');
insert into t1 values(3,'"asdf"');
select * from t1 where c2 = JSON_PRETTY('true');
c1	c2
select * from t1 where c2 = JSON_PRETTY('123');
c1	c2
select * from t1 where c2 = JSON_PRETTY('"asdf"');
c1	c2
drop table t1;
#bug:
DROP TABLE IF EXISTS t;
CREATE TABLE t(h1 TIMESTAMP);
INSERT INTO t values('2021-01-01 00:00:00');
SELECT CAST(h1 AS json) FROM t;
CAST(h1 AS json)
"2021-01-01 00:00:00.000000"
DROP TABLE t;
#bug:
select CAST( b'10001010' AS JSON );
CAST( b'10001010' AS JSON )
"base64:type15:ig=="
DROP TABLE IF EXISTS t;
Warnings:
Note	1051	Unknown table 'test.t'
create table t(c BLOB);
insert into t values('10');
select cast(c as json) from t;
cast(c as json)
"base64:type252:MTA="
drop table t;
#bug:
drop table if exists t;
Warnings:
Note	1051	Unknown table 'test.t'
create table t(h1 int auto_increment primary key,h2 set('"张三"','"李四"','"王五"'));
insert into t(h2) values(1),(2),(3),(4),(5),(6),(7);
SELECT cast(h2 as json) from t ORDER by h1 asc;
cast(h2 as json)
"\"张三\""
"\"李四\""
"\"张三\",\"李四\""
"\"王五\""
"\"张三\",\"王五\""
"\"李四\",\"王五\""
"\"张三\",\"李四\",\"王五\""
#bug:
create table t1(dati datetime, da date, tim time, ts timestamp,
y year,ti tinyint,   tiu tinyint unsigned,
si smallint,  siu smallint unsigned,
mi mediumint, miu mediumint unsigned,
i  int, iu  int unsigned,bi bigint,
biu bigint unsigned, boo boolean,
dc decimal(5,2), n numeric(5,2),
f float, d double, bitt bit(10),
blb blob, bin binary(10), js json);
insert into t1 values('2014-11-25 18:00', '2014-11-25','18:00:59', '2014-11-25 18:00',
'1999',127, 255,
32767, 65535,
8388607, 16777215,
2147483647, 4294967295, 9223372036854775807,
18446744073709551615, true,
3.14,3.14,3.14,3.14,b'10101', 
'10101abcde','10101abcde', '[123]');
select json_type(cast(ts as json)) from t1;
json_type(cast(ts as json))
TIMESTAMP
select json_type(cast(dati as json)) from t1;
json_type(cast(dati as json))
DATETIME
drop table t1;
#bug:
#bug:
#bug:
drop table if exists obkv_document;
create table obkv_document (coll_id int not null comment '集合id',
doc_id varbinary(32) not null comment 'doc id',
doc_data json not null comment 'doc的数据',
last_modified bigint not null comment '最近修改时间',
primary key(coll_id, doc_id),
index idx_collid_lastmodified(coll_id, last_modified)
) partition by key(coll_id) partitions 100;
insert into obkv_document(coll_id, doc_id, doc_data, last_modified) values (1, '001', '{ "item" : "canvas", "qty" : 100, "tags" : ["cotton"], "size" : { "h" : 28, "w" : 35.5, "uom" : "cm" }}',1000);
insert into obkv_document(coll_id, doc_id, doc_data, last_modified) values (1, '002', '{ "item": "journal", "qty": 25, "size": { "h": 14, "w": 21, "uom": "cm" }, "status": "A" }', 1000),
(1, '003', '{ "item": "notebook", "qty": 50, "size": { "h": 8.5, "w": 11, "uom": "in" }, "status": "A" }', 1000),
(1, '004', '{ "item": "paper", "qty": 100, "size": { "h": 8.5, "w": 11, "uom": "in" }, "status": "D" }', 1000),
(1, '005', '{ "item": "planner", "qty": 75, "size": { "h": 22.85, "w": 30, "uom": "cm" }, "status": "D" }', 1000),
(1, '006', '{ "item": "postcard", "qty": 45, "size": { "h": 10, "w": 15.25, "uom": "cm" }, "status": "A" }', 1000);
insert into obkv_document(coll_id, doc_id, doc_data, last_modified) values (1, '008', '{ "item" : "canvas", "qty" : 100, "tags" : ["cotton"], "size" : { "h" : 2001, "w" : 35.5, "uom" : "cm" }}',1000);
insert into obkv_document(coll_id, doc_id, doc_data, last_modified) values (1, '009', '{ "item" : "canvas", "qty" : 100, "tags" : ["cotton"], "size" : { "h" : 1900, "w" : 35.5, "uom" : "cm" }}',1000);
insert into obkv_document(coll_id, doc_id, doc_data, last_modified) values (1, '010', '{ "item" : "canvas", "qty" : 100, "tags" : ["cotton"], "size" : { "h" : 1901, "w" : 35.5, "uom" : "cm" }}',1000);
select json_value(doc_data,'$.size.h' returning year) from obkv_document;
json_value(doc_data,'$.size.h' returning year)
NULL
NULL
NULL
NULL
NULL
NULL
2001
NULL
1901
select json_value(doc_data,'$.size' returning float) from obkv_document;
json_value(doc_data,'$.size' returning float)
NULL
NULL
NULL
NULL
NULL
NULL
NULL
NULL
NULL
select json_value(doc_data,'$.size.h' returning float) from obkv_document;
json_value(doc_data,'$.size.h' returning float)
28
14
8.5
8.5
22.85
10
2001
1900
1901
select json_value(doc_data,'$.size.h' returning float(23)) from obkv_document;
json_value(doc_data,'$.size.h' returning float(23))
28
14
8.5
8.5
22.85
10
2001
1900
1901
select json_value(doc_data,'$.size.h' returning float(53)) from obkv_document;
json_value(doc_data,'$.size.h' returning float(53))
28
14
8.5
8.5
22.85
10
2001
1900
1901
select json_value(doc_data,'$.size.h' returning float(55)) from obkv_document;
ERROR 42000: Too big precision 55 specified for column 'CAST'. Maximum is 53.
select cast(100.1 as float(0));
cast(100.1 as float(0))
100.1
select cast(100.1 as float(23));
cast(100.1 as float(23))
100.1
select cast(100.1 as float(53));
cast(100.1 as float(53))
100.1
select cast(100.1 as float(55));
ERROR 42000: Too big precision 55 specified for column 'CAST'. Maximum is 53.
select cast(cast(20 as json) as year);
cast(cast(20 as json) as year)
2020
select cast(cast(cast(20 as year) as json) as year);
cast(cast(cast(20 as year) as json) as year)
2020
select cast(cast(true as json) as year);
cast(cast(true as json) as year)
2001
select cast(cast('"abc"' as json) as year);
cast(cast('"abc"' as json) as year)
0000
select cast(cast('"100"' as json) as year);
cast(cast('"100"' as json) as year)
0000
select cast(cast('"1990"' as json) as year);
cast(cast('"1990"' as json) as year)
1990
select cast(cast('"1990-1-1"' as json) as year);
cast(cast('"1990-1-1"' as json) as year)
1990
select cast(cast("1990-1-1" as date) as json);
cast(cast("1990-1-1" as date) as json)
"1990-01-01"
select cast(cast(cast("1990-1-1" as date) as json) as year);
cast(cast(cast("1990-1-1" as date) as json) as year)
0000
select cast(cast(28.5 as json) as year);
cast(cast(28.5 as json) as year)
2029
drop table if exists test1;
CREATE TABLE test1(h1 json);
insert into test1 VALUES('[100, 0, -100, 100.11, -12.11, 10.22e2, -10.22e2]');
SELECT cast(h1 as FLOAT) from test1;
cast(h1 as FLOAT)
0
drop table test1;
drop table if exists t1;
create table t1 (pk bigint, col_char_20 char(20), col_json json, primary key (pk));
insert into t1 values (1, 'zvv', 'false');
SELECT pk ,col_json FROM t1 WHERE col_json = 'false';
pk	col_json
SELECT pk ,col_json FROM t1 WHERE col_json in ('false');
pk	col_json
drop table t1;
#bug:
drop table if exists t;
create table t(c decimal(10, 2));
insert into t values(10);
select cast(c as json) from t;
cast(c as json)
10.00
drop table t;
create table t(c1 set('Alice', 'Bob'), c2 json);
select * from t where c1=c2;
c1	c2
drop table t;
# bugfix: 
drop table if exists t1;
drop table if exists t2;
create table t1(col_4 json not null);
create table t2(col_44 set('Alice', 'Bob') collate utf8mb4_unicode_ci not null default 'Alice');
select t1.col_4,t2.col_44 from t1 join t2 where t1.col_4 = t2.col_44;
col_4	col_44
drop table t1;
drop table t2;
# bugfix: 
drop table if exists t1;
drop table if exists t2;
create table t1 ( c1 enum('Alice','Bob','Charlie','David') DEFAULT NULL);
create table t2 (c1 json NOT NULL);
select t1.c1,t2.c1 from t1 join t2 where t1.c1 = t2.c1;
c1	c1
insert into t1 values('Alice');
insert into t2 values('"Alice"');
select t1.c1,t2.c1 from t1 join t2 where t1.c1 = t2.c1;
c1	c1
drop table t1;
drop table t2;
create table t1(j json);
insert into t1 values('{"key": "123"}');
select json_extract(j, '$.key') = '123' from t1;
json_extract(j, '$.key') = '123'
1
select j from t1 where json_extract(j, '$.key') = '123';
j
{"key": "123"}
drop table t1;
drop table if exists ttt;
Warnings:
Note	1051	Unknown table 'test.ttt'
create table ttt(c1 int, c2 json);
insert into ttt values(1, '{"page": "0"}');
insert into ttt values(1, '{"page": "1"}');
insert into ttt values(1, '{"page": "2"}');
select * from ttt where c2->'$.page' = '1';
c1	c2
1	{"page": "1"}
select * from ttt where c2->'$.page' <> '1';
c1	c2
1	{"page": "0"}
1	{"page": "2"}
select * from ttt where c2->'$.page' in ('1');
c1	c2
1	{"page": "1"}
select * from ttt where c2->'$.page' in ('1', '2');
c1	c2
1	{"page": "1"}
1	{"page": "2"}
select * from ttt where c2->'$.page' not in ('1');
c1	c2
1	{"page": "0"}
1	{"page": "2"}
select * from ttt where c2->'$.page' not in ('1', '2');
c1	c2
1	{"page": "0"}
select * from ttt where (c1, c2->'$.page') in ((1, '1'));
c1	c2
1	{"page": "1"}
select * from ttt where (c1, c2->'$.page') in ((1, '1'), (1,'2'));
c1	c2
1	{"page": "1"}
1	{"page": "2"}
select * from ttt where (c1, c2->'$.page') not in ((1, '1'));
c1	c2
1	{"page": "0"}
1	{"page": "2"}
select * from ttt where (c1, c2->'$.page') not in ((1, '1'), (1,'2'));
c1	c2
1	{"page": "0"}
drop table if exists ttt;
drop table if exists t1;
Warnings:
Note	1051	Unknown table 'test.t1'
CREATE TABLE t1 (c1 int primary key,c4 json)partition by hash(c1) partitions 8;
insert into t1 values(7,'{"name": "刘德华","age": 60,"email": "john.doe@example.com"}');
select * from t1 where c4 = '{"name": "刘德华","age": 60,"email": "john.doe@example.com"}';
c1	c4
select * from t1 where c4 <> '{"name": "刘德华","age": 60,"email": "john.doe@example.com"}';
c1	c4
7	{"age": 60, "name": "刘德华", "email": "john.doe@example.com"}
select * from t1 where c4 in ('{"name": "刘德华","age": 60,"email": "john.doe@example.com"}');
c1	c4
select * from t1 where c4 not in ('{"name": "刘德华","age": 60,"email": "john.doe@example.com"}');
c1	c4
7	{"age": 60, "name": "刘德华", "email": "john.doe@example.com"}
drop table if exists t1;
drop table if exists t1;
Warnings:
Note	1051	Unknown table 'test.t1'
create table t1(c1 json, c2 json not null);
insert into t1 values('12121212.1212121212', '12121212.1212121212');
alter table t1 modify c2 FLOAT(10,2)  not null;
insert into t1 values('1',10000);
select * from t1 order by c1;
c1	c2
1	10000.00
12121212.12121212	12121212.00
drop table if exists t1;
create table t1(c1 json, c2 varchar(64) not null);
insert into t1 values('12121212.1212121212', '12121212.1212121212');
alter table t1 modify c2 FLOAT(10,2)  not null;
insert into t1 values('1',10000);
select * from t1 order by c1;
c1	c2
1	10000.00
12121212.12121212	12121212.00
drop table if exists t1;
create table t1(c1 json, c2 json not null);
insert into t1 values('12121212.1212121212', '121212.1212');
alter table t1 modify c2 FLOAT  not null;
insert into t1 values('1',10000);
select * from t1 order by c1;
c1	c2
1	10000
12121212.12121212	121212
drop table if exists t1;
CREATE TABLE `t1` (`a` JSON);
INSERT INTO `t1` VALUES ('{"key1": null}');
SELECT CASE JSON_EXTRACT(t1.a, '$.key1') WHEN 'null' THEN NULL WHEN true THEN true ELSE false END FROM t1;
CASE JSON_EXTRACT(t1.a, '$.key1') WHEN 'null' THEN NULL WHEN true THEN true ELSE false END
NULL
drop table t1;
set sql_mode = '';
drop table if exists test;
create table test(c1 json, c2 json not null);
insert into test values('12121212.1212121212', '12121212.1212121212');
alter table test modify c2 year not null;
select * from test;
c1	c2
12121212.12121212	0000
drop table test;
drop table if exists table_json;
create table table_json(k1 INT, v1 json);
insert /*+append*/ into table_json value 
(0,'{"Registered" : false}'),
(1,'[false]'),(1,'[false]'),
(5, '{"name": "Eve", "phone": null}'),
(6, '{"name": "Frank", "is_employed": true}'),
(2, '{"name": "Bob", "hobbies": ["reading", "gaming"]}'),
(3, '{"name": "Charlie", "address": {"city": "New York", "zip": "10001"}}'),
(4, '{"name": "Dana", "isStudent": true, "degree": null}'),
(5, '{\n       "name": "Eve",\n       "contacts": {\n           "email": "eve@example.com",\n           "phone": "123-456-7890"\n       },\n       "projects": [\n           {"name": "Project A", "status": "completed"},\n           {"name": "Project B", "status": "ongoing"}\n       ]\n   }'),
(1, '{"name": "Alice", "age": 30}'),
(8, '{"name": "Hank", "birthdate": "1990-01-01"}'),
(10, '{}'),(2,'[0]'),(3,'1'),(4,'0'),(4,'0'),
(5,'false'),(5,'false'),(6,'true'),
(7,null),(7,null),(17,null);
SELECT * FROM table_json where v1 not BETWEEN  '' and  '[false]' order by k1,v1;
k1	v1
0	{"Registered": false}
1	{"age": 30, "name": "Alice"}
1	[false]
1	[false]
2	{"name": "Bob", "hobbies": ["reading", "gaming"]}
2	[0]
3	1
3	{"name": "Charlie", "address": {"zip": "10001", "city": "New York"}}
4	0
4	0
4	{"name": "Dana", "degree": null, "isStudent": true}
5	{"name": "Eve", "phone": null}
5	{"name": "Eve", "contacts": {"email": "eve@example.com", "phone": "123-456-7890"}, "projects": [{"name": "Project A", "status": "completed"}, {"name": "Project B", "status": "ongoing"}]}
5	false
5	false
6	{"name": "Frank", "is_employed": true}
6	true
8	{"name": "Hank", "birthdate": "1990-01-01"}
10	{}
SELECT * FROM table_json where v1 not BETWEEN  null and  '[false]' order by k1,v1;
k1	v1
5	false
5	false
6	true
SELECT /*+ MONITOR */ * FROM table_json where v1 not BETWEEN  '{"name": "Bob", "hobbies": ["reading", "gaming"]}' and  '{"name": "Bob", "hobbies": ["reading", "gaming"]}' order by k1,v1;
k1	v1
0	{"Registered": false}
1	{"age": 30, "name": "Alice"}
1	[false]
1	[false]
2	{"name": "Bob", "hobbies": ["reading", "gaming"]}
2	[0]
3	1
3	{"name": "Charlie", "address": {"zip": "10001", "city": "New York"}}
4	0
4	0
4	{"name": "Dana", "degree": null, "isStudent": true}
5	{"name": "Eve", "phone": null}
5	{"name": "Eve", "contacts": {"email": "eve@example.com", "phone": "123-456-7890"}, "projects": [{"name": "Project A", "status": "completed"}, {"name": "Project B", "status": "ongoing"}]}
5	false
5	false
6	{"name": "Frank", "is_employed": true}
6	true
8	{"name": "Hank", "birthdate": "1990-01-01"}
10	{}
drop table table_json;
create table table_json (c1 json, c2 varchar(20));
insert into table_json values('"abc"', 'abc');
insert into table_json values(null, null);
select ifnull(c1, c2) a1, ifnull(c2, c1) a2 from table_json;
a1	a2
"abc"	abc
NULL	NULL
select ifnull(c1, '') a1, ifnull(c2, '') a2 from table_json;
a1	a2
"abc"	abc
	
select nvl(c1, c2) a1, nvl(c2, c1) a2 from table_json;
a1	a2
"abc"	abc
NULL	NULL
select nvl(c1, '') a1, nvl(c2, '') a2 from table_json;
a1	a2
"abc"	abc
	
select case c1 is null when true then cast('' as char(10)) else c1 end from table_json;
case c1 is null when true then cast('' as char(10)) else c1 end
"abc"

drop table table_json;
