# ----------------------------------------------------------------------
# Test of MEMBER OF and -> function.
# ----------------------------------------------------------------------
drop table if exists t1;
CREATE TABLE t1(c1 JSON);
INSERT INTO t1 VALUES ('["a", "b"]'), ('["b", "c"]'), ('["c", "a"]');
SELECT * FROM t1 WHERE 'a' MEMBER OF (c1 -> '$');
c1
["a", "b"]
["c", "a"]
DROP TABLE t1;
SELECT 17 MEMBER OF('[23, "abc", 17, "ab", 10]');
17 MEMBER OF('[23, "abc", 17, "ab", 10]')
1
SELECT 'ab' MEMBER OF('[23, "abc", 17, "ab", 10]');
'ab' MEMBER OF('[23, "abc", 17, "ab", 10]')
1
SELECT 7 MEMBER OF('[23, "abc", 17, "ab", 10]');
7 MEMBER OF('[23, "abc", 17, "ab", 10]')
0
SELECT 'a' MEMBER OF('[23, "abc", 17, "ab", 10]');
'a' MEMBER OF('[23, "abc", 17, "ab", 10]')
0
SELECT 17 MEMBER OF('[23, "abc", "17", "ab", 10]');
17 MEMBER OF('[23, "abc", "17", "ab", 10]')
0
SELECT "17" MEMBER OF('[23, "abc", 17, "ab", 10]');
"17" MEMBER OF('[23, "abc", 17, "ab", 10]')
0
SELECT CAST('[4,5]' AS JSON) MEMBER OF('[[3,4],[4,5]]');
CAST('[4,5]' AS JSON) MEMBER OF('[[3,4],[4,5]]')
1
SELECT JSON_ARRAY(4,5) MEMBER OF('[[3,4],[4,5]]');
JSON_ARRAY(4,5) MEMBER OF('[[3,4],[4,5]]')
1
CREATE TABLE t1 (id INT NOT NULL KEY AUTO_INCREMENT, f1 JSON);
INSERT INTO t1(f1) VALUES(CAST('["11.11", "22.22", "33.33", "44.44", "55.55", "66.66", "77.77", "88.88", "99.99"]' AS JSON));
SELECT * FROM t1;
id	f1
1	["11.11", "22.22", "33.33", "44.44", "55.55", "66.66", "77.77", "88.88", "99.99"]
SELECT * FROM t1 WHERE 11.11 MEMBER OF (f1->'$[*]');
id	f1
SELECT * FROM t1 WHERE 22.22 MEMBER OF (f1->'$[*]');
id	f1
SELECT * FROM t1 WHERE 33.33 MEMBER OF (f1->'$[*]');
id	f1
SELECT * FROM t1 WHERE 44.44 MEMBER OF (f1->'$[*]');
id	f1
SELECT * FROM t1 WHERE 55.55 MEMBER OF (f1->'$[*]');
id	f1
SELECT * FROM t1 WHERE 66.66 MEMBER OF (f1->'$[*]');
id	f1
SELECT * FROM t1 WHERE 77.77 MEMBER OF (f1->'$[*]');
id	f1
SELECT * FROM t1 WHERE 88.88 MEMBER OF (f1->'$[*]');
id	f1
SELECT * FROM t1 WHERE 99.99 MEMBER OF (f1->'$[*]');
id	f1
TRUNCATE TABLE t1;
INSERT INTO t1(f1) VALUES(CAST('["13.33","13.21"]' AS JSON));
INSERT INTO t1(f1) VALUES(CAST('["15.67","18.55"]' AS JSON));
SELECT * FROM t1 WHERE 13.33 MEMBER OF (f1->'$[*]');
id	f1
SELECT * FROM t1 WHERE 13.21 MEMBER OF (f1->'$[*]');
id	f1
SELECT * FROM t1 WHERE 15.67 MEMBER OF (f1->'$[*]');
id	f1
SELECT * FROM t1 WHERE 18.55 MEMBER OF (f1->'$[*]');
id	f1
SELECT * FROM t1 WHERE "13.33" MEMBER OF (f1->'$[*]');
id	f1
1	["13.33", "13.21"]
SELECT * FROM t1 WHERE "13.21" MEMBER OF (f1->'$[*]');
id	f1
1	["13.33", "13.21"]
SELECT * FROM t1 WHERE "15.67" MEMBER OF (f1->'$[*]');
id	f1
2	["15.67", "18.55"]
SELECT * FROM t1 WHERE "18.55" MEMBER OF (f1->'$[*]');
id	f1
2	["15.67", "18.55"]
DELETE FROM t1;
SELECT * FROM t1 WHERE 13.33 MEMBER OF (f1->'$[*]');
id	f1
SELECT * FROM t1 WHERE 13.21 MEMBER OF (f1->'$[*]');
id	f1
SELECT * FROM t1 WHERE 15.67 MEMBER OF (f1->'$[*]');
id	f1
SELECT * FROM t1 WHERE 18.55 MEMBER OF (f1->'$[*]');
id	f1
SELECT * FROM t1 WHERE "13.33" MEMBER OF (f1->'$[*]');
id	f1
SELECT * FROM t1 WHERE "13.21" MEMBER OF (f1->'$[*]');
id	f1
SELECT * FROM t1 WHERE "15.67" MEMBER OF (f1->'$[*]');
id	f1
SELECT * FROM t1 WHERE "18.55" MEMBER OF (f1->'$[*]');
id	f1
INSERT INTO t1(f1) VALUES(CAST('["13.33","13.21","13.45"]' AS JSON));
INSERT INTO t1(f1) VALUES(CAST('["15.67","18.55","19.32"]' AS JSON));
UPDATE t1 SET f1 = CAST('["98.76","87.65","76.54"]' AS JSON) WHERE 13.33 MEMBER OF (f1->'$[*]');
SELECT * FROM t1;
id	f1
3	["13.33", "13.21", "13.45"]
4	["15.67", "18.55", "19.32"]
SELECT * FROM t1 WHERE 98.76 MEMBER OF (f1->'$[*]');
id	f1
SELECT * FROM t1 WHERE 87.65 MEMBER OF (f1->'$[*]');
id	f1
SELECT * FROM t1 WHERE 76.54 MEMBER OF (f1->'$[*]');
id	f1
SELECT * FROM t1 WHERE 15.67 MEMBER OF (f1->'$[*]');
id	f1
SELECT * FROM t1 WHERE 18.55 MEMBER OF (f1->'$[*]');
id	f1
SELECT * FROM t1 WHERE 19.32 MEMBER OF (f1->'$[*]');
id	f1
SELECT * FROM t1 WHERE 13.45 MEMBER OF (f1->'$[*]');
id	f1
SELECT * FROM t1 WHERE 13.21 MEMBER OF (f1->'$[*]');
id	f1
SELECT * FROM t1 WHERE 13.33 MEMBER OF (f1->'$[*]');
id	f1
SELECT * FROM t1 WHERE "98.76" MEMBER OF (f1->'$[*]');
id	f1
SELECT * FROM t1 WHERE "87.65" MEMBER OF (f1->'$[*]');
id	f1
SELECT * FROM t1 WHERE "76.54" MEMBER OF (f1->'$[*]');
id	f1
SELECT * FROM t1 WHERE "15.67" MEMBER OF (f1->'$[*]');
id	f1
4	["15.67", "18.55", "19.32"]
SELECT * FROM t1 WHERE "18.55" MEMBER OF (f1->'$[*]');
id	f1
4	["15.67", "18.55", "19.32"]
SELECT * FROM t1 WHERE "19.32" MEMBER OF (f1->'$[*]');
id	f1
4	["15.67", "18.55", "19.32"]
SELECT * FROM t1 WHERE "13.45" MEMBER OF (f1->'$[*]');
id	f1
3	["13.33", "13.21", "13.45"]
SELECT * FROM t1 WHERE "13.21" MEMBER OF (f1->'$[*]');
id	f1
3	["13.33", "13.21", "13.45"]
SELECT * FROM t1 WHERE "13.33" MEMBER OF (f1->'$[*]');
id	f1
3	["13.33", "13.21", "13.45"]
UPDATE t1 SET f1 = CAST('["11.11","22.22","33.33"]' AS JSON) WHERE "18.55" MEMBER OF (f1->'$[*]');
SELECT * FROM t1;
id	f1
3	["13.33", "13.21", "13.45"]
4	["11.11", "22.22", "33.33"]
SELECT * FROM t1 WHERE 98.76 MEMBER OF (f1->'$[*]');
id	f1
SELECT * FROM t1 WHERE 87.65 MEMBER OF (f1->'$[*]');
id	f1
SELECT * FROM t1 WHERE 76.54 MEMBER OF (f1->'$[*]');
id	f1
SELECT * FROM t1 WHERE 11.11 MEMBER OF (f1->'$[*]');
id	f1
SELECT * FROM t1 WHERE 22.22 MEMBER OF (f1->'$[*]');
id	f1
SELECT * FROM t1 WHERE 33.33 MEMBER OF (f1->'$[*]');
id	f1
SELECT * FROM t1 WHERE 19.32 MEMBER OF (f1->'$[*]');
id	f1
SELECT * FROM t1 WHERE 15.67 MEMBER OF (f1->'$[*]');
id	f1
SELECT * FROM t1 WHERE 18.55 MEMBER OF (f1->'$[*]');
id	f1
SELECT * FROM t1 WHERE "98.76" MEMBER OF (f1->'$[*]');
id	f1
SELECT * FROM t1 WHERE "87.65" MEMBER OF (f1->'$[*]');
id	f1
SELECT * FROM t1 WHERE "76.54" MEMBER OF (f1->'$[*]');
id	f1
SELECT * FROM t1 WHERE "11.11" MEMBER OF (f1->'$[*]');
id	f1
4	["11.11", "22.22", "33.33"]
SELECT * FROM t1 WHERE "22.22" MEMBER OF (f1->'$[*]');
id	f1
4	["11.11", "22.22", "33.33"]
SELECT * FROM t1 WHERE "33.33" MEMBER OF (f1->'$[*]');
id	f1
4	["11.11", "22.22", "33.33"]
SELECT * FROM t1 WHERE "19.32" MEMBER OF (f1->'$[*]');
id	f1
SELECT * FROM t1 WHERE "15.67" MEMBER OF (f1->'$[*]');
id	f1
SELECT * FROM t1 WHERE "18.55" MEMBER OF (f1->'$[*]');
id	f1
DELETE FROM t1;
INSERT INTO t1(f1) VALUES(CAST('["13.33","13.21","13.45"]' AS JSON));
INSERT INTO t1(f1) VALUES(CAST('["15.67","18.55","19.32"]' AS JSON));
UPDATE t1 SET f1 = CAST('["98.76","87.65","76.54"]' AS JSON) WHERE 13.33 MEMBER OF (f1->'$[*]');
SELECT * FROM t1;
id	f1
5	["13.33", "13.21", "13.45"]
6	["15.67", "18.55", "19.32"]
SELECT * FROM t1 WHERE 98.76 MEMBER OF (f1->'$[*]');
id	f1
SELECT * FROM t1 WHERE 87.65 MEMBER OF (f1->'$[*]');
id	f1
SELECT * FROM t1 WHERE 76.54 MEMBER OF (f1->'$[*]');
id	f1
SELECT * FROM t1 WHERE 15.67 MEMBER OF (f1->'$[*]');
id	f1
SELECT * FROM t1 WHERE 18.55 MEMBER OF (f1->'$[*]');
id	f1
SELECT * FROM t1 WHERE 19.32 MEMBER OF (f1->'$[*]');
id	f1
SELECT * FROM t1 WHERE 13.45 MEMBER OF (f1->'$[*]');
id	f1
SELECT * FROM t1 WHERE 13.21 MEMBER OF (f1->'$[*]');
id	f1
SELECT * FROM t1 WHERE 13.33 MEMBER OF (f1->'$[*]');
id	f1
SELECT * FROM t1 WHERE "98.76" MEMBER OF (f1->'$[*]');
id	f1
SELECT * FROM t1 WHERE "87.65" MEMBER OF (f1->'$[*]');
id	f1
SELECT * FROM t1 WHERE "76.54" MEMBER OF (f1->'$[*]');
id	f1
SELECT * FROM t1 WHERE "15.67" MEMBER OF (f1->'$[*]');
id	f1
6	["15.67", "18.55", "19.32"]
SELECT * FROM t1 WHERE "18.55" MEMBER OF (f1->'$[*]');
id	f1
6	["15.67", "18.55", "19.32"]
SELECT * FROM t1 WHERE "19.32" MEMBER OF (f1->'$[*]');
id	f1
6	["15.67", "18.55", "19.32"]
SELECT * FROM t1 WHERE "13.45" MEMBER OF (f1->'$[*]');
id	f1
5	["13.33", "13.21", "13.45"]
SELECT * FROM t1 WHERE "13.21" MEMBER OF (f1->'$[*]');
id	f1
5	["13.33", "13.21", "13.45"]
SELECT * FROM t1 WHERE "13.33" MEMBER OF (f1->'$[*]');
id	f1
5	["13.33", "13.21", "13.45"]
UPDATE t1 SET f1 = CAST('["11.11","22.22","33.33"]' AS JSON) WHERE "18.55" MEMBER OF (f1->'$[*]');
SELECT * FROM t1;
id	f1
5	["13.33", "13.21", "13.45"]
6	["11.11", "22.22", "33.33"]
SELECT * FROM t1 WHERE 98.76 MEMBER OF (f1->'$[*]');
id	f1
SELECT * FROM t1 WHERE 87.65 MEMBER OF (f1->'$[*]');
id	f1
SELECT * FROM t1 WHERE 76.54 MEMBER OF (f1->'$[*]');
id	f1
SELECT * FROM t1 WHERE 11.11 MEMBER OF (f1->'$[*]');
id	f1
SELECT * FROM t1 WHERE 22.22 MEMBER OF (f1->'$[*]');
id	f1
SELECT * FROM t1 WHERE 33.33 MEMBER OF (f1->'$[*]');
id	f1
SELECT * FROM t1 WHERE 19.32 MEMBER OF (f1->'$[*]');
id	f1
SELECT * FROM t1 WHERE 15.67 MEMBER OF (f1->'$[*]');
id	f1
SELECT * FROM t1 WHERE 18.55 MEMBER OF (f1->'$[*]');
id	f1
SELECT * FROM t1 WHERE "98.76" MEMBER OF (f1->'$[*]');
id	f1
SELECT * FROM t1 WHERE "87.65" MEMBER OF (f1->'$[*]');
id	f1
SELECT * FROM t1 WHERE "76.54" MEMBER OF (f1->'$[*]');
id	f1
SELECT * FROM t1 WHERE "11.11" MEMBER OF (f1->'$[*]');
id	f1
6	["11.11", "22.22", "33.33"]
SELECT * FROM t1 WHERE "22.22" MEMBER OF (f1->'$[*]');
id	f1
6	["11.11", "22.22", "33.33"]
SELECT * FROM t1 WHERE "33.33" MEMBER OF (f1->'$[*]');
id	f1
6	["11.11", "22.22", "33.33"]
SELECT * FROM t1 WHERE "19.32" MEMBER OF (f1->'$[*]');
id	f1
SELECT * FROM t1 WHERE "15.67" MEMBER OF (f1->'$[*]');
id	f1
SELECT * FROM t1 WHERE "18.55" MEMBER OF (f1->'$[*]');
id	f1
DELETE FROM t1;
DROP TABLE t1;
CREATE TABLE t1(id INT NOT NULL PRIMARY KEY AUTO_INCREMENT, f1 JSON);
INSERT INTO t1(f1) VALUES (CAST('[1,3]' AS JSON));
INSERT INTO t1(f1) VALUES (CAST('[1,3,9,8]' AS JSON));
INSERT INTO t1(f1) VALUES (CAST('[1,3,9,8,10,11,20,30]' AS JSON));
SELECT * FROM t1 WHERE 9 MEMBER OF (f1->'$[*]');
id	f1
2	[1, 3, 9, 8]
3	[1, 3, 9, 8, 10, 11, 20, 30]
SELECT * FROM t1 WHERE 11 MEMBER OF (f1->'$[*]');
id	f1
3	[1, 3, 9, 8, 10, 11, 20, 30]
SELECT * FROM t1 WHERE 30 MEMBER OF (f1->'$[*]');
id	f1
3	[1, 3, 9, 8, 10, 11, 20, 30]
DROP TABLE t1;
CREATE TABLE t1 (
i INT NOT NULL PRIMARY KEY,
j JSON );
INSERT INTO t1 VALUES(1, CAST('["HelloWorld", "Hello"]' AS JSON));
INSERT INTO t1 VALUES(2, CAST('["HelloMySQL", "Hello"]' AS JSON));
SELECT * FROM t1 WHERE "HelloMySQL" MEMBER OF (j->'$[*]');
i	j
2	["HelloMySQL", "Hello"]
SELECT * FROM t1 WHERE "Hello" MEMBER OF (j->'$[*]');
i	j
1	["HelloWorld", "Hello"]
2	["HelloMySQL", "Hello"]
DELETE FROM t1;
START TRANSACTION;
INSERT INTO t1 VALUES(1, CAST('["HelloMySQL", "Hello"]' AS JSON));
SELECT * FROM t1 WHERE "HelloMySQL" MEMBER OF (j->'$[*]');
i	j
1	["HelloMySQL", "Hello"]
SELECT * FROM t1 WHERE "Hello" MEMBER OF (j->'$[*]');
i	j
1	["HelloMySQL", "Hello"]
ROLLBACK;
SELECT * FROM t1 WHERE "HelloMySQL" MEMBER OF (j->'$[*]');
i	j
SELECT * FROM t1 WHERE "Hello" MEMBER OF (j->'$[*]');
i	j
DROP TABLE t1;
CREATE TABLE t1(a INT PRIMARY KEY, b INT, f1 JSON);
INSERT INTO t1 VALUES(1, 1, CAST('["1111", "2222"]' AS JSON));
INSERT INTO t1 VALUES(2, 2, CAST('["11111", "2222", "22222", "3333"]' AS JSON));
INSERT INTO t1 VALUES(3, 3, CAST('["1111", "2222", "22222", "3333", "444"]' AS JSON));
INSERT INTO t1 VALUES(4, 4, CAST('["22222", "3333", "444", "5555"]' AS JSON));
INSERT INTO t1 VALUES(5, 5, CAST('["2222", "5555"]' AS JSON));
DELETE FROM t1 WHERE "444" MEMBER OF (f1->"$[*]");
INSERT INTO t1 VALUES(6, 6, CAST('["1111", "444"]' AS JSON));
UPDATE t1 SET f1 = CAST('["11111", "2222"]' AS JSON) WHERE a = 1;
UPDATE t1 SET f1 = CAST('["11111", "22222", "33333", "44444"]' AS JSON) WHERE a = 3;
UPDATE t1 SET f1 = CAST('["2222", "5555", "6666"]' AS JSON) WHERE a = 5;
SELECT * FROM t1;
a	b	f1
1	1	["11111", "2222"]
2	2	["11111", "2222", "22222", "3333"]
5	5	["2222", "5555", "6666"]
6	6	["1111", "444"]
SELECT * FROM t1 WHERE "1111" MEMBER OF (f1->"$[*]");
a	b	f1
6	6	["1111", "444"]
SELECT * FROM t1 WHERE "5555" MEMBER OF (f1->"$[*]");
a	b	f1
5	5	["2222", "5555", "6666"]
SELECT * FROM t1 WHERE "444" MEMBER OF (f1->"$[*]");
a	b	f1
6	6	["1111", "444"]
SELECT * FROM t1 WHERE "11111" MEMBER OF (f1->"$[*]");
a	b	f1
1	1	["11111", "2222"]
2	2	["11111", "2222", "22222", "3333"]
SELECT * FROM t1 WHERE "22222" MEMBER OF (f1->"$[*]");
a	b	f1
2	2	["11111", "2222", "22222", "3333"]
INSERT INTO t1 VALUES(7, 7, CAST('["6666", "1111"]' AS JSON));
DELETE FROM t1 WHERE "22222" MEMBER OF (f1->"$[*]");
INSERT INTO t1 VALUES(8, 8, CAST('["1111", "3333", "444", "6666"]' AS JSON));
UPDATE t1 SET f1 = CAST('["5555", "2222", "6666", "777"]' AS JSON) WHERE a = 5;
UPDATE t1 SET f1 = CAST('["666", "777", "6666", "7777"]' AS JSON) WHERE a = 6;
SELECT * FROM t1;
a	b	f1
1	1	["11111", "2222"]
5	5	["5555", "2222", "6666", "777"]
6	6	["666", "777", "6666", "7777"]
7	7	["6666", "1111"]
8	8	["1111", "3333", "444", "6666"]
SELECT * FROM t1 WHERE "1111" MEMBER OF (f1->"$[*]");
a	b	f1
7	7	["6666", "1111"]
8	8	["1111", "3333", "444", "6666"]
SELECT * FROM t1 WHERE "5555" MEMBER OF (f1->"$[*]");
a	b	f1
5	5	["5555", "2222", "6666", "777"]
SELECT * FROM t1 WHERE "444" MEMBER OF (f1->"$[*]");
a	b	f1
8	8	["1111", "3333", "444", "6666"]
SELECT * FROM t1 WHERE "11111" MEMBER OF (f1->"$[*]");
a	b	f1
1	1	["11111", "2222"]
SELECT * FROM t1 WHERE "22222" MEMBER OF (f1->"$[*]");
a	b	f1
SELECT * FROM t1 WHERE "666" MEMBER OF (f1->"$[*]");
a	b	f1
6	6	["666", "777", "6666", "7777"]
SELECT * FROM t1 WHERE "6666" MEMBER OF (f1->"$[*]");
a	b	f1
5	5	["5555", "2222", "6666", "777"]
6	6	["666", "777", "6666", "7777"]
7	7	["6666", "1111"]
8	8	["1111", "3333", "444", "6666"]
SELECT * FROM t1 WHERE "777" MEMBER OF (f1->"$[*]");
a	b	f1
5	5	["5555", "2222", "6666", "777"]
6	6	["666", "777", "6666", "7777"]
SELECT * FROM t1 WHERE "7777" MEMBER OF (f1->"$[*]");
a	b	f1
6	6	["666", "777", "6666", "7777"]
SELECT * FROM t1 WHERE "3333" MEMBER OF (f1->"$[*]");
a	b	f1
8	8	["1111", "3333", "444", "6666"]
DROP TABLE t1;
CREATE TABLE t1 ( col_int INT) ;
INSERT INTO t1 VALUES (1);
INSERT INTO t1 VALUES (2);
INSERT INTO t1 VALUES (3);
INSERT INTO t1 VALUES (4);
SELECT col_int FROM t1 WHERE col_int MEMBER OF('[1,2]');
col_int
1
2
DROP TABLE t1;
CREATE TABLE t1 (id INT AUTO_INCREMENT KEY, f1 JSON);
INSERT INTO t1(f1) VALUES(JSON_ARRAY(_utf8mb4 0xE284AB, _utf8mb4 0xc385));
SELECT * FROM t1 WHERE _utf8mb4 0xE284AB MEMBER OF (f1->"$[*]");
id	f1
1	["Å", "Å"]
SELECT * FROM t1 WHERE _utf8mb4 0xc385 MEMBER OF (f1->"$[*]");
id	f1
1	["Å", "Å"]
DELETE FROM t1;
INSERT INTO t1(f1) VALUES(JSON_ARRAY( _utf8mb4 0xc385, _utf8mb4 0xE284AB));
SELECT * FROM t1 WHERE _utf8mb4 0xE284AB MEMBER OF (f1->"$[*]");
id	f1
2	["Å", "Å"]
SELECT * FROM t1 WHERE _utf8mb4 0xc385 MEMBER OF (f1->"$[*]");
id	f1
2	["Å", "Å"]
DELETE FROM t1;
INSERT INTO t1(f1) VALUES(JSON_ARRAY(_utf8mb4 0xE284AB));
SELECT * FROM t1 WHERE _utf8mb4 0xE284AB MEMBER OF (f1->"$[*]");
id	f1
3	["Å"]
SELECT * FROM t1 WHERE _utf8mb4 0xc385 MEMBER OF (f1->"$[*]");
id	f1
DELETE FROM t1;
INSERT INTO t1(f1) VALUES(JSON_ARRAY( _utf8mb4 0xc385));
SELECT * FROM t1 WHERE _utf8mb4 0xE284AB MEMBER OF (f1->"$[*]");
id	f1
SELECT * FROM t1 WHERE _utf8mb4 0xc385 MEMBER OF (f1->"$[*]");
id	f1
4	["Å"]
DROP TABLE t1;
CREATE TABLE t1 (
j3 JSON);
INSERT INTO t1 SELECT * FROM t1 WHERE null MEMBER OF ( j3 -> '$[*]' ) ;
DROP TABLE t1;
CREATE TABLE t1 (f1 JSON);
INSERT INTO t1(f1) VALUES(CAST('["abc", "abc "]' AS JSON));
SELECT * FROM t1 WHERE "abc" MEMBER OF (f1->"$[*]");
f1
["abc", "abc "]
SELECT * FROM t1 WHERE "abc " MEMBER OF (f1->"$[*]");
f1
["abc", "abc "]
DELETE FROM t1;
INSERT INTO t1(f1) VALUES(CAST('["abc"]' AS JSON));
INSERT INTO t1(f1) VALUES(CAST('["abc "]' AS JSON));
DROP TABLE t1;
CREATE TABLE t1 ( col_int INT) ;
INSERT INTO t1 VALUES (1);
SELECT col_int FROM t1 WHERE col_int MEMBER OF('[98989,67976]');
col_int
SELECT col_int FROM t1 WHERE col_int MEMBER OF('sdf');
ERROR 22032: Invalid JSON text in argument.
DROP TABLE t1;
CREATE TABLE t1 (
col_int_key int(11) DEFAULT NULL,
col_jsonn json DEFAULT NULL
);
INSERT INTO t1 VALUES (NULL,'[1]'), (4,'[1]'), (1,'[2]');
CREATE TABLE t2(col_int int(11));
INSERT INTO t2 VALUES (1), (2), (3), (11), (12);
SELECT t1.col_int_key AS field1, t2.col_int AS field2 FROM t2 LEFT
JOIN t1 ON 1 WHERE (CAST("1" AS JSON) MEMBER OF( t1.col_jsonn->'$[*]'));
field1	field2
NULL	1
4	1
NULL	2
4	2
NULL	3
4	3
NULL	11
4	11
NULL	12
4	12
DROP TABLE t1,t2;
CREATE TABLE t1 (doc JSON,_id VARBINARY(32)
GENERATED ALWAYS AS (JSON_UNQUOTE(JSON_EXTRACT(doc, '$._id'))) );
INSERT INTO t1 (doc) VALUES
('{"dateField":["2019-1-1","2019-2-1","2019-3-1"],
  "datetimeField":["2019-12-29 23:59:59","2019-12-30 23:59:59",
    "2019-12-31 23:59:59"],
  "timeField":["10:10","11:10","12:10"],
  "_id": "00005cd4075c0000000000000087"}'),
('{"dateField":["2019-1-2","2019-2-2","2019-3-2"],
  "datetimeField":["2018-12-29 23:59:59","2018-12-30 23:59:59",
    "2018-12-31 23:59:59"],
  "timeField":["10:11","11:11","12:11"],
  "_id": "00005cd4075c0000000000000088"}'),
('{"dateField":["2019-1-3","2019-2-3","2019-3-3"],
  "datetimeField":["2017-12-29 23:59:59","2017-12-30 23:59:59",
    "2017-12-31 23:59:59"],
  "timeField":["10:12","11:12","12:12"],
  "_id": "00005cd4075c0000000000000089"}');
SELECT doc->'$.dateField' FROM t1 WHERE
'2019-2-1' MEMBER OF (doc->'$.dateField');
doc->'$.dateField'
["2019-1-1", "2019-2-1", "2019-3-1"]
SELECT doc->'$.dateField' FROM t1 WHERE
DATE'2019-2-1' MEMBER OF (doc->'$.dateField');
doc->'$.dateField'
SELECT doc->'$.dateField' FROM t1 WHERE
'asd2019' MEMBER OF (doc->'$.dateField');
doc->'$.dateField'
SELECT doc->'$.datetimeField' FROM t1 WHERE
'2017-12-29 23:59:59' MEMBER OF (doc->'$.datetimeField');
doc->'$.datetimeField'
["2017-12-29 23:59:59", "2017-12-30 23:59:59", "2017-12-31 23:59:59"]
SELECT doc->'$.datetimeField' FROM t1 WHERE
TIMESTAMP'2017-12-29 23:59:59' MEMBER OF (doc->'$.datetimeField');
doc->'$.datetimeField'
SELECT doc->'$.timeField' FROM t1 WHERE
'11:11' MEMBER OF (doc->'$.timeField');
doc->'$.timeField'
["10:11", "11:11", "12:11"]
SELECT doc->'$.timeField' FROM t1 WHERE
TIME'11:11' MEMBER OF (doc->'$.timeField');
doc->'$.timeField'
DROP TABLE if exists t1;
drop table if exists json_test1;
Warnings:
Note	1051	Unknown table 'test.json_test1'
CREATE TABLE json_test1( 
c1 int primary key, 
c2 JSON);
insert into json_test1 values(1,'["abc", null, true, false]');
select null MEMBER OF(c2) from json_test1;
null MEMBER OF(c2)
NULL
select true MEMBER OF(c2) from json_test1;
true MEMBER OF(c2)
1
select false MEMBER OF(c2) from json_test1;
false MEMBER OF(c2)
1
SELECT null MEMBER OF('[23, "abc", 17, "ab", 10]');
null MEMBER OF('[23, "abc", 17, "ab", 10]')
NULL
DROP TABLE json_test1;
create table t1 (
pk bigint,
col_bigint bigint,
col_json json,
primary key (pk) );
insert into t1 values (1, 0, 'false');
insert into t1 values (2, 0, '{"test": "abc"}');
insert into t1 values (3, 0, '[]');
insert into t1 values (4, 0, '"sadf"');
insert into t1 values (5, 0, '100000');
insert into t1 values (6, 0, 'null');
select col_json,col_json MEMBER OF('false') from t1;
col_json	col_json MEMBER OF('false')
false	1
{"test": "abc"}	0
[]	0
"sadf"	0
100000	0
null	0
select col_json,col_json MEMBER OF('null') from t1;
col_json	col_json MEMBER OF('null')
false	0
{"test": "abc"}	0
[]	0
"sadf"	0
100000	0
null	1
select col_json,col_json MEMBER OF('"sadf"') from t1;
col_json	col_json MEMBER OF('"sadf"')
false	0
{"test": "abc"}	0
[]	0
"sadf"	1
100000	0
null	0
select col_json,col_json MEMBER OF('[]') from t1;
col_json	col_json MEMBER OF('[]')
false	0
{"test": "abc"}	0
[]	0
"sadf"	0
100000	0
null	0
drop table  t1;
create table t1 (
pk bigint,
col_bigint bigint,
col_json json,
primary key (pk) );
insert into t1 values (5, -2, '100000');
insert into t1 values (6, 3, 'null');
insert into t1 values (7, 3, '["abc", 10, null, true, {"b": [1, 2]}, [3, 4]]');
select JSON_REMOVE(null,'$[1]') member of(col_json) as a,col_json from t1;
a	col_json
NULL	100000
NULL	null
NULL	["abc", 10, null, true, {"b": [1, 2]}, [3, 4]]
select JSON_EXTRACT('1','$[10]') MEMBER OF(col_json) as a ,col_json from t1;
a	col_json
NULL	100000
NULL	null
NULL	["abc", 10, null, true, {"b": [1, 2]}, [3, 4]]
select JSON_EXTRACT(NULL,'$[10]') MEMBER OF(col_json) as a ,col_json from t1;
a	col_json
NULL	100000
NULL	null
NULL	["abc", 10, null, true, {"b": [1, 2]}, [3, 4]]
SELECT LN(-4) MEMBER OF(LN('[-4]'));
LN(-4) MEMBER OF(LN('[-4]'))
NULL
SELECT max(null+2-1*3/4) MEMBER OF(max('[null+2-1*3/4]')) from dual;
max(null+2-1*3/4) MEMBER OF(max('[null+2-1*3/4]'))
NULL
drop table t1;
