# Test JSON FUNCTION --- JSON_TYPE
# ----------------------------------------------------------------------
# Test of JSON_TYPE
# ----------------------------------------------------------------------
BUG# binary cast json fail
SELECT JSON_TYPE(CAST(CAST('abcd' AS BINARY) AS JSON));
JSON_TYPE(CAST(CAST('abcd' AS BINARY) AS JSON))
BLOB
drop table if exists t;
CREATE TABLE t (bn BINARY(5), vb VARBINARY(5),
tb TINYBLOB, mb MEDIUMBLOB, bb BLOB, lb LONGBLOB);
INSERT INTO t (bn) VALUES (x'cafe');
UPDATE t SET vb = bn, tb = bn, mb = bn, bb = bn, lb = bn;
SELECT JSON_TYPE(CAST(bn AS JSON)) AS bn, JSON_TYPE(CAST(vb AS JSON)) AS vb,
JSON_TYPE(CAST(tb AS JSON)) AS tb, JSON_TYPE(CAST(mb AS JSON)) AS mb,
JSON_TYPE(CAST(bb AS JSON)) AS bb, JSON_TYPE(CAST(lb AS JSON)) AS lb
FROM t;
bn	vb	tb	mb	bb	lb
BLOB	BLOB	BLOB	BLOB	BLOB	BLOB
DROP TABLE t;
CREATE TABLE T_WITH_NULLS(i INT, j JSON);
INSERT INTO T_WITH_NULLS VALUES
(0, NULL),
(1, '[1]'),
(2, NULL),
(3, '{"a":"b"}'),
(4, NULL),
(5, '"abc"');
SELECT JSON_TYPE(j) from T_WITH_NULLS;
JSON_TYPE(j)
NULL
ARRAY
NULL
OBJECT
NULL
STRING
DROP TABLE T_WITH_NULLS;
################# json text input
expect 'NULL'
SELECT JSON_TYPE('null');
JSON_TYPE('null')
NULL
SELECT JSON_TYPE('hahaha');
ERROR 22032: Invalid JSON text.
expect 'INTEGER'
SELECT JSON_TYPE('123');
JSON_TYPE('123')
INTEGER
expect 'UNSIGNED INTEGER'
SELECT JSON_TYPE('12333333333333333333');
JSON_TYPE('12333333333333333333')
UNSIGNED INTEGER
expect 'OBJECT'
SELECT JSON_TYPE('{}');
JSON_TYPE('{}')
OBJECT
expect 'ARRAY'
SELECT JSON_TYPE('[]');
JSON_TYPE('[]')
ARRAY
expect 'DOUBLE'
SELECT JSON_TYPE('3.14');
JSON_TYPE('3.14')
DOUBLE
expect 'BOOLEAN'
SELECT JSON_TYPE('true');
JSON_TYPE('true')
BOOLEAN
expect 'DECIMAL'
select json_type(cast(cast(1 as decimal) as json));
json_type(cast(cast(1 as decimal) as json))
DECIMAL
expect 'DATE'
select json_type(cast(date '2015-4-15 09:22:07' as json));
json_type(cast(date '2015-4-15 09:22:07' as json))
DATE
expect 'TIME'
select json_type(cast(time '2015-4-15 09:22:07' as json));
json_type(cast(time '2015-4-15 09:22:07' as json))
TIME
expect 'DATETIME'
select json_type(cast(cast('2015-4-15 09:22:07' as datetime) as json));
json_type(cast(cast('2015-4-15 09:22:07' as datetime) as json))
DATETIME
expect 'DATETIME'
select json_type(cast(timestamp '2015-4-15 09:22:07' as json));
json_type(cast(timestamp '2015-4-15 09:22:07' as json))
DATETIME
select json_type('abc');
ERROR 22032: Invalid JSON text.
select json_type('{"a": 2}');
json_type('{"a": 2}')
OBJECT
select json_type('[1,2]');
json_type('[1,2]')
ARRAY
select json_type('"scalar string"');
json_type('"scalar string"')
STRING
select json_type('true');
json_type('true')
BOOLEAN
select json_type('false');
json_type('false')
BOOLEAN
select json_type('null');
json_type('null')
NULL
select json_type('1');
json_type('1')
INTEGER
select json_type('-0');
json_type('-0')
INTEGER
select json_type('-0.0');
json_type('-0.0')
DOUBLE
SELECT JSON_TYPE(SUBSTR("zhangsan", 0, 3)) from dual;
ERROR 22032: Invalid JSON text.
SELECT JSON_TYPE(SUBSTR("zhangsan", -3, -1)) from dual;
ERROR 22032: Invalid JSON text.
SELECT JSON_TYPE(SUBSTRING("zhangsan", 0, 3)) from dual;
ERROR 22032: Invalid JSON text.
SELECT JSON_TYPE(SUBSTRING("zhangsan", -3, -1)) from dual;
ERROR 22032: Invalid JSON text.
SELECT JSON_TYPE(REPEAT("1", -1)) from dual;
ERROR 22032: Invalid JSON text.
SELECT JSON_TYPE(SPACE("n")) from dual;
ERROR 22032: Invalid JSON text.
SELECT JSON_TYPE(LPAD("san",0,"zhang")) from dual;
ERROR 22032: Invalid JSON text.
SELECT JSON_TYPE(RPAD("zhang",0,"san")) from dual;
ERROR 22032: Invalid JSON text.
SELECT JSON_TYPE(SUBSTR("abcdefg",3,-2)) from dual;
ERROR 22032: Invalid JSON text.
SELECT JSON_TYPE(SUBSTR("abcdefg",-1,-4)) from dual;
ERROR 22032: Invalid JSON text.
select json_type('');
ERROR 22032: Invalid JSON text.
select json_type(-1);
ERROR 22032: Invalid data type for JSON data in argument 1 to function json_type; a JSON string or JSON type is required.
select json_type(CAST(1 AS UNSIGNED));
ERROR 22032: Invalid data type for JSON data in argument 1 to function json_type; a JSON string or JSON type is required.
select json_type('32767');
json_type('32767')
INTEGER
select json_type(PI());
ERROR 22032: Invalid data type for JSON data in argument 1 to function json_type; a JSON string or JSON type is required.
select json_type('3.14');
json_type('3.14')
DOUBLE
select json_type(CAST(CAST('2015-01-15' AS DATE) as CHAR));
ERROR 22032: Invalid JSON text.
# ----------------------------------------------------------------------
# Test of CAST(literal AS JSON)
# ----------------------------------------------------------------------
select json_type(cast(cast('2014-11-25 18:00' as datetime) as json));
json_type(cast(cast('2014-11-25 18:00' as datetime) as json))
DATETIME
select json_type(cast(cast('2014-11-25' as date) as json));
json_type(cast(cast('2014-11-25' as date) as json))
DATE
select json_type(cast(cast('18:00:59' as time) as json));
json_type(cast(cast('18:00:59' as time) as json))
TIME
select json_type(cast(127 as json));
json_type(cast(127 as json))
INTEGER
select json_type(cast(255 as json));
json_type(cast(255 as json))
INTEGER
select json_type(cast(32767 as json));
json_type(cast(32767 as json))
INTEGER
select json_type(cast(65535 as json));
json_type(cast(65535 as json))
INTEGER
select json_type(cast(8388607 as json));
json_type(cast(8388607 as json))
INTEGER
select json_type(cast(16777215 as json));
json_type(cast(16777215 as json))
INTEGER
select json_type(cast(2147483647 as json));
json_type(cast(2147483647 as json))
INTEGER
select json_type(cast(4294967295 as json));
json_type(cast(4294967295 as json))
INTEGER
select json_type(cast(9223372036854775807 as json));
json_type(cast(9223372036854775807 as json))
INTEGER
select json_type(cast(18446744073709551615 as json));
json_type(cast(18446744073709551615 as json))
UNSIGNED INTEGER
select json_type(cast(true as json));
json_type(cast(true as json))
BOOLEAN
select json_type(cast(b'10101' as json));
json_type(cast(b'10101' as json))
BLOB
select json_type(cast(cast(3.14 as decimal(5,2)) as json));
json_type(cast(cast(3.14 as decimal(5,2)) as json))
DECIMAL
select json_type(cast(3.14 as json));
json_type(cast(3.14 as json))
DECIMAL
select json_type(cast(3.14E30 as json));
json_type(cast(3.14E30 as json))
DOUBLE
select json_type(cast(cast('10101abcde' as binary) as json));
json_type(cast(cast('10101abcde' as binary) as json))
BLOB
select json_type(cast(null as json));
json_type(cast(null as json))
NULL
select json_type(cast(null as json)) is null;
json_type(cast(null as json)) is null
1
select json_type(null) is null;
json_type(null) is null
1
select json_type(UNHEX(""));
ERROR 22032: Cannot create a JSON value from a string.
SELECT JSON_TYPE('[]') LIKE 'a%';
JSON_TYPE('[]') LIKE 'a%'
0
SELECT JSON_TYPE('[]') LIKE 'A%';
JSON_TYPE('[]') LIKE 'A%'
1
SELECT true WHERE (CAST(NULL AS JSON)) IS NOT true;
true
1
SELECT true WHERE (CAST(NULL AS JSON)) IS NOT false;
true
1
