# Test JSON FUNCTION --- JSON_VALID
# ----------------------------------------------------------------------
# Test of JSON_VALID
# ----------------------------------------------------------------------
# Table - Json string column - utf-8, NULL
Note: 'utf8' is a subset of internal 'utf8mb4'

drop table if exists utf8_t;
Warnings:
Note	1051	Unknown table 'test.utf8_t'
create table if not exists utf8_t (c varchar(20)) CHARACTER SET 'utf8';
insert into utf8_t values (NULL);
# Expect NULL:
select JSON_VALID(c) from utf8_t;
JSON_VALID(c)
NULL
delete from utf8_t;

# Table - Json string column - utf-8, valid
insert into utf8_t values ('[123]');
select JSON_VALID(c) from utf8_t;
JSON_VALID(c)
1
delete from utf8_t;

# Table - Json string column - utf-8, non-utf8
insert into utf8_t values ('[123');
expect 0 (false)
select JSON_VALID(c) from utf8_t;
JSON_VALID(c)
0
delete from utf8_t;

# Table - Try to extract JSON from TIMESTAMP column
ALTER TABLE utf8_t ADD d TIMESTAMP;
# Should give false; not string or JSON type
# and we do not convert automatically from TIMESTAMP to JSON
insert into utf8_t values (NULL, '2014-11-25 18:00');
select JSON_VALID(d) from utf8_t;
JSON_VALID(d)
0
# Explicit cast to a character data type
# allows MySQL to parse this is a JSON text
# The string isn't a legal JSON document, tho, so not valid.
select JSON_VALID(CAST(d as CHAR)) from utf8_t;
JSON_VALID(CAST(d as CHAR))
0
# Should give true
select JSON_VALID(CONCAT( CONCAT('"', CAST(d as CHAR)), '"')) from utf8_t;
JSON_VALID(CONCAT( CONCAT('"', CAST(d as CHAR)), '"'))
1
delete from utf8_t;
drop table utf8_t;

# Table - JSON type; should give true by definition
create table if not exists json_t(t json);
insert into json_t values ('[123]');
select json_VALID(t) from json_t;
json_VALID(t)
1

# Function result - JSON
select JSON_VALID( JSON_ARRAY(t, t) ) from json_t;
JSON_VALID( JSON_ARRAY(t, t) )
1
drop table json_t;

# String literal - valid JSON
select JSON_VALID('123');
JSON_VALID('123')
1
select JSON_VALID('-123');
JSON_VALID('-123')
1
select JSON_VALID('5000000000');
JSON_VALID('5000000000')
1
select JSON_VALID('-5000000000');
JSON_VALID('-5000000000')
1
select JSON_VALID('1.23');
JSON_VALID('1.23')
1
select JSON_VALID('"123"');
JSON_VALID('"123"')
1
select JSON_VALID('true');
JSON_VALID('true')
1
select JSON_VALID('false');
JSON_VALID('false')
1
select JSON_VALID('null');
JSON_VALID('null')
1
select JSON_VALID('{"address": "Trondheim"}');
JSON_VALID('{"address": "Trondheim"}')
1

# expect 0
select JSON_VALID("");
JSON_VALID("")
0

# String literal - not valid JSON
select JSON_VALID('12 3');
JSON_VALID('12 3')
0

# Json expression
select JSON_VALID(cast('[123]' as JSON ));
JSON_VALID(cast('[123]' as JSON ))
1

# Json expression NULL
select JSON_VALID(cast(NULL as JSON ));
JSON_VALID(cast(NULL as JSON ))
NULL

# Bare NULL
select JSON_VALID( NULL );
JSON_VALID( NULL )
NULL

# Function result - string
select JSON_VALID( UPPER('"abc"') );
JSON_VALID( UPPER('"abc"') )
1

# Function result - date, not valid as JSON without CAST
select JSON_VALID( CAST('2015-01-15' AS DATE) );
JSON_VALID( CAST('2015-01-15' AS DATE) )
0

# The date string doesn't parse as JSON text, so wrong:
select JSON_VALID( CAST(CAST('2015-01-15' AS DATE) as CHAR) );
JSON_VALID( CAST(CAST('2015-01-15' AS DATE) as CHAR) )
0
# OK, though:
select JSON_VALID( CAST(CURDATE() as JSON) );
JSON_VALID( CAST(CURDATE() as JSON) )
1

# TODO::BUG:Function result - NULL
select JSON_VALID( UPPER(NULL) );
JSON_VALID( UPPER(NULL) )
NULL
select JSON_VALID( UPPER(CAST(NULL as CHAR)) );
JSON_VALID( UPPER(CAST(NULL as CHAR)) )
NULL
SELECT JSON_VALID( '{ "firstName" : "Fred", "lastName" : "Flintstone" }' );
JSON_VALID( '{ "firstName" : "Fred", "lastName" : "Flintstone" }' )
1
SELECT JSON_VALID( '3' );
JSON_VALID( '3' )
1
SELECT JSON_VALID( null );
JSON_VALID( null )
NULL
SELECT JSON_VALID(REPEAT('[', 100000));
ERROR 22032: The JSON document exceeds the maximum depth.
SELECT JSON_VALID(REPEAT('{"a":', 100000));
ERROR 22032: The JSON document exceeds the maximum depth.
SELECT JSON_VALID(REPEAT('{"a":[', 100000));
ERROR 22032: The JSON document exceeds the maximum depth.
SELECT JSON_VALID(REPEAT('[{"a":', 100000));
ERROR 22032: The JSON document exceeds the maximum depth.
SELECT JSON_VALID(EXTRACT(HOUR FROM 2021-11-11)) from dual;
JSON_VALID(EXTRACT(HOUR FROM 2021-11-11))
0
SELECT JSON_VALID(CASE WHEN 1 THEN NULL ELSE NULL END);
JSON_VALID(CASE WHEN 1 THEN NULL ELSE NULL END)
NULL
SELECT JSON_VALID(UNHEX("39393939393939393939")) from dual;
JSON_VALID(UNHEX("39393939393939393939"))
0
