SET sql_mode='STRICT_TRANS_TABLES,STRICT_ALL_TABLES';
SELECT @@sql_mode;
@@sql_mode
STRICT_TRANS_TABLES,STRICT_ALL_TABLES

DROP TABLE IF EXISTS Z0CASE;
general_list_update  utf8mb4/utf8mb4_general_ci --> utf16/utf16_unicode_ci
char
CREATE TABLE Z0CASE(T1 CHAR(50)) DEFAULT charset= utf8mb4 DEFAULT collate = utf8mb4_general_ci with column group (all columns, each column);
INSERT INTO Z0CASE VALUES(123);
INSERT INTO Z0CASE VALUES('%^&*[];//\\');
INSERT INTO Z0CASE VALUES(NULL);
INSERT INTO Z0CASE VALUES('abc');
INSERT INTO Z0CASE VALUES('中文');
SELECT * FROM Z0CASE;
T1
123
%^&*[];//\
NULL
abc
中文
SELECT table_name,column_type,COLLATION_NAME,CHARACTER_SET_NAME FROM information_schema.columns WHERE table_name='Z0CASE';
table_name	column_type	COLLATION_NAME	CHARACTER_SET_NAME
z0case	char(50)	utf8mb4_general_ci	utf8mb4
SHOW CREATE TABLE Z0CASE;
Table	Create Table
z0case	CREATE TABLE `z0case` (
  `T1` char(50) DEFAULT NULL
) ORGANIZATION INDEX DEFAULT CHARSET = utf8mb4 ROW_FORMAT = DYNAMIC COMPRESSION = 'zstd_1.3.8' REPLICA_NUM = replica_num BLOCK_SIZE = 16384 USE_BLOOM_FILTER = FALSE ENABLE_MACRO_BLOCK_BLOOM_FILTER = FALSE TABLET_SIZE = 134217728 PCTFREE = 0 WITH COLUMN GROUP(all columns, each column)
ALTER TABLE Z0CASE CONVERT TO CHARACTER SET 'utf16' COLLATE 'utf16_unicode_ci';
SHOW CREATE TABLE Z0CASE;
Table	Create Table
z0case	CREATE TABLE `z0case` (
  `T1` char(50) COLLATE utf16_unicode_ci DEFAULT NULL
) ORGANIZATION INDEX DEFAULT CHARSET = utf16 COLLATE = utf16_unicode_ci ROW_FORMAT = DYNAMIC COMPRESSION = 'zstd_1.3.8' REPLICA_NUM = replica_num BLOCK_SIZE = 16384 USE_BLOOM_FILTER = FALSE ENABLE_MACRO_BLOCK_BLOOM_FILTER = FALSE TABLET_SIZE = 134217728 PCTFREE = 0 WITH COLUMN GROUP(all columns, each column)
SELECT * FROM Z0CASE;
T1
123
%^&*[];//\
NULL
abc
中文
insert
INSERT INTO Z0CASE VALUES(111);
INSERT INTO Z0CASE VALUES('2001');
INSERT INTO Z0CASE VALUES('!*?< >aB12 中文');
INSERT INTO Z0CASE VALUES(b'0101101');
INSERT INTO Z0CASE VALUES('2021-10-01 12:23:35.54');
INSERT INTO Z0CASE VALUES('2011-11-01');
INSERT INTO Z0CASE VALUES('22:22:35');
INSERT INTO Z0CASE VALUES(12.345);
INSERT INTO Z0CASE VALUES(null);
SELECT table_name,column_type,COLLATION_NAME,CHARACTER_SET_NAME FROM information_schema.columns WHERE table_name='Z0CASE';
table_name	column_type	COLLATION_NAME	CHARACTER_SET_NAME
z0case	char(50)	utf16_unicode_ci	utf16
SHOW CREATE TABLE Z0CASE;
Table	Create Table
z0case	CREATE TABLE `z0case` (
  `T1` char(50) COLLATE utf16_unicode_ci DEFAULT NULL
) ORGANIZATION INDEX DEFAULT CHARSET = utf16 COLLATE = utf16_unicode_ci ROW_FORMAT = DYNAMIC COMPRESSION = 'zstd_1.3.8' REPLICA_NUM = replica_num BLOCK_SIZE = 16384 USE_BLOOM_FILTER = FALSE ENABLE_MACRO_BLOCK_BLOOM_FILTER = FALSE TABLET_SIZE = 134217728 PCTFREE = 0 WITH COLUMN GROUP(all columns, each column)
SELECT * FROM Z0CASE;
T1
123
%^&*[];//\
NULL
abc
中文
111
2001
!*?< >aB12 中文
-
2021-10-01 12:23:35.54
2011-11-01
22:22:35
12.345
NULL
update
UPDATE Z0CASE SET T1=NULL WHERE T1='111';
UPDATE Z0CASE SET T1='12:31:56' WHERE T1=2001;
ERROR 22007: Truncated incorrect DECIMAL value: '%^&*[];//\'
UPDATE Z0CASE SET T1=1221.34 WHERE T1='2011-11-01';
UPDATE Z0CASE SET T1='Aa1$< >中文' WHERE T1='12.345';
UPDATE Z0CASE SET T1=b'0101101' WHERE T1='abc';
SELECT table_name,column_type,COLLATION_NAME,CHARACTER_SET_NAME FROM information_schema.columns WHERE table_name='Z0CASE';
table_name	column_type	COLLATION_NAME	CHARACTER_SET_NAME
z0case	char(50)	utf16_unicode_ci	utf16
SHOW CREATE TABLE Z0CASE;
Table	Create Table
z0case	CREATE TABLE `z0case` (
  `T1` char(50) COLLATE utf16_unicode_ci DEFAULT NULL
) ORGANIZATION INDEX DEFAULT CHARSET = utf16 COLLATE = utf16_unicode_ci ROW_FORMAT = DYNAMIC COMPRESSION = 'zstd_1.3.8' REPLICA_NUM = replica_num BLOCK_SIZE = 16384 USE_BLOOM_FILTER = FALSE ENABLE_MACRO_BLOCK_BLOOM_FILTER = FALSE TABLET_SIZE = 134217728 PCTFREE = 0 WITH COLUMN GROUP(all columns, each column)
SELECT * FROM Z0CASE;
T1
123
%^&*[];//\
NULL
-
中文
NULL
2001
!*?< >aB12 中文
-
2021-10-01 12:23:35.54
1221.34
22:22:35
Aa1$< >中文
NULL
delete
DELETE FROM Z0CASE WHERE T1=1221.34;
ERROR 22007: Truncated incorrect DECIMAL value: '%^&*[];//\'
DELETE FROM Z0CASE WHERE T1='2021-10-01 12:23:35.54';
DELETE FROM Z0CASE WHERE T1 IS NULL;
DELETE FROM Z0CASE WHERE T1=b'0101101';
SELECT * FROM Z0CASE;
T1
123
%^&*[];//\
中文
2001
!*?< >aB12 中文
1221.34
22:22:35
Aa1$< >中文
varchar
DROP TABLE Z0CASE;
CREATE TABLE Z0CASE(T1 VARCHAR(50)) DEFAULT charset= utf8mb4 DEFAULT collate = utf8mb4_general_ci with column group (all columns, each column);
INSERT INTO Z0CASE VALUES(123);
INSERT INTO Z0CASE VALUES('%^&*[];//\\');
INSERT INTO Z0CASE VALUES(NULL);
INSERT INTO Z0CASE VALUES('abc');
INSERT INTO Z0CASE VALUES('中文');
SELECT * FROM Z0CASE;
T1
123
%^&*[];//\
NULL
abc
中文
SELECT table_name,column_type,COLLATION_NAME,CHARACTER_SET_NAME FROM information_schema.columns WHERE table_name='Z0CASE';
table_name	column_type	COLLATION_NAME	CHARACTER_SET_NAME
z0case	varchar(50)	utf8mb4_general_ci	utf8mb4
SHOW CREATE TABLE Z0CASE;
Table	Create Table
z0case	CREATE TABLE `z0case` (
  `T1` varchar(50) DEFAULT NULL
) ORGANIZATION INDEX DEFAULT CHARSET = utf8mb4 ROW_FORMAT = DYNAMIC COMPRESSION = 'zstd_1.3.8' REPLICA_NUM = replica_num BLOCK_SIZE = 16384 USE_BLOOM_FILTER = FALSE ENABLE_MACRO_BLOCK_BLOOM_FILTER = FALSE TABLET_SIZE = 134217728 PCTFREE = 0 WITH COLUMN GROUP(all columns, each column)
ALTER TABLE Z0CASE CONVERT TO CHARACTER SET 'utf16' COLLATE 'utf16_unicode_ci';
SHOW CREATE TABLE Z0CASE;
Table	Create Table
z0case	CREATE TABLE `z0case` (
  `T1` varchar(50) COLLATE utf16_unicode_ci DEFAULT NULL
) ORGANIZATION INDEX DEFAULT CHARSET = utf16 COLLATE = utf16_unicode_ci ROW_FORMAT = DYNAMIC COMPRESSION = 'zstd_1.3.8' REPLICA_NUM = replica_num BLOCK_SIZE = 16384 USE_BLOOM_FILTER = FALSE ENABLE_MACRO_BLOCK_BLOOM_FILTER = FALSE TABLET_SIZE = 134217728 PCTFREE = 0 WITH COLUMN GROUP(all columns, each column)
SELECT * FROM Z0CASE;
T1
123
%^&*[];//\
NULL
abc
中文
insert
INSERT INTO Z0CASE VALUES(111);
INSERT INTO Z0CASE VALUES('2001');
INSERT INTO Z0CASE VALUES('!*?< >aB12 中文');
INSERT INTO Z0CASE VALUES(b'0101101');
INSERT INTO Z0CASE VALUES('2021-10-01 12:23:35.54');
INSERT INTO Z0CASE VALUES('2011-11-01');
INSERT INTO Z0CASE VALUES('22:22:35');
INSERT INTO Z0CASE VALUES(12.345);
INSERT INTO Z0CASE VALUES(null);
SELECT table_name,column_type,COLLATION_NAME,CHARACTER_SET_NAME FROM information_schema.columns WHERE table_name='Z0CASE';
table_name	column_type	COLLATION_NAME	CHARACTER_SET_NAME
z0case	varchar(50)	utf16_unicode_ci	utf16
SHOW CREATE TABLE Z0CASE;
Table	Create Table
z0case	CREATE TABLE `z0case` (
  `T1` varchar(50) COLLATE utf16_unicode_ci DEFAULT NULL
) ORGANIZATION INDEX DEFAULT CHARSET = utf16 COLLATE = utf16_unicode_ci ROW_FORMAT = DYNAMIC COMPRESSION = 'zstd_1.3.8' REPLICA_NUM = replica_num BLOCK_SIZE = 16384 USE_BLOOM_FILTER = FALSE ENABLE_MACRO_BLOCK_BLOOM_FILTER = FALSE TABLET_SIZE = 134217728 PCTFREE = 0 WITH COLUMN GROUP(all columns, each column)
SELECT * FROM Z0CASE;
T1
123
%^&*[];//\
NULL
abc
中文
111
2001
!*?< >aB12 中文
-
2021-10-01 12:23:35.54
2011-11-01
22:22:35
12.345
NULL
update
UPDATE Z0CASE SET T1=NULL WHERE T1='111';
UPDATE Z0CASE SET T1='12:31:56' WHERE T1=2001;
ERROR 22007: Truncated incorrect DECIMAL value: '%^&*[];//\'
UPDATE Z0CASE SET T1=1221.34 WHERE T1='2011-11-01';
UPDATE Z0CASE SET T1='Aa1$< >中文' WHERE T1='12.345';
UPDATE Z0CASE SET T1=b'0101101' WHERE T1='abc';
SELECT table_name,column_type,COLLATION_NAME,CHARACTER_SET_NAME FROM information_schema.columns WHERE table_name='Z0CASE';
table_name	column_type	COLLATION_NAME	CHARACTER_SET_NAME
z0case	varchar(50)	utf16_unicode_ci	utf16
SHOW CREATE TABLE Z0CASE;
Table	Create Table
z0case	CREATE TABLE `z0case` (
  `T1` varchar(50) COLLATE utf16_unicode_ci DEFAULT NULL
) ORGANIZATION INDEX DEFAULT CHARSET = utf16 COLLATE = utf16_unicode_ci ROW_FORMAT = DYNAMIC COMPRESSION = 'zstd_1.3.8' REPLICA_NUM = replica_num BLOCK_SIZE = 16384 USE_BLOOM_FILTER = FALSE ENABLE_MACRO_BLOCK_BLOOM_FILTER = FALSE TABLET_SIZE = 134217728 PCTFREE = 0 WITH COLUMN GROUP(all columns, each column)
SELECT * FROM Z0CASE;
T1
123
%^&*[];//\
NULL
-
中文
NULL
2001
!*?< >aB12 中文
-
2021-10-01 12:23:35.54
1221.34
22:22:35
Aa1$< >中文
NULL
delete
DELETE FROM Z0CASE WHERE T1=1221.34;
ERROR 22007: Truncated incorrect DECIMAL value: '%^&*[];//\'
DELETE FROM Z0CASE WHERE T1='2021-10-01 12:23:35.54';
DELETE FROM Z0CASE WHERE T1 IS NULL;
DELETE FROM Z0CASE WHERE T1=b'0101101';
SELECT * FROM Z0CASE;
T1
123
%^&*[];//\
中文
2001
!*?< >aB12 中文
1221.34
22:22:35
Aa1$< >中文
TEXT
DROP TABLE Z0CASE;
CREATE TABLE Z0CASE(T1 TEXT) DEFAULT charset= utf8mb4 DEFAULT collate = utf8mb4_general_ci with column group (all columns, each column);
INSERT INTO Z0CASE VALUES(123);
INSERT INTO Z0CASE VALUES('%^&*[];//\\');
INSERT INTO Z0CASE VALUES(NULL);
INSERT INTO Z0CASE VALUES('abc');
INSERT INTO Z0CASE VALUES('中文');
SELECT * FROM Z0CASE;
T1
123
%^&*[];//\
NULL
abc
中文
SELECT table_name,column_type,COLLATION_NAME,CHARACTER_SET_NAME FROM information_schema.columns WHERE table_name='Z0CASE';
table_name	column_type	COLLATION_NAME	CHARACTER_SET_NAME
z0case	text	utf8mb4_general_ci	utf8mb4
SHOW CREATE TABLE Z0CASE;
Table	Create Table
z0case	CREATE TABLE `z0case` (
  `T1` text DEFAULT NULL
) ORGANIZATION INDEX DEFAULT CHARSET = utf8mb4 ROW_FORMAT = DYNAMIC COMPRESSION = 'zstd_1.3.8' REPLICA_NUM = replica_num BLOCK_SIZE = 16384 USE_BLOOM_FILTER = FALSE ENABLE_MACRO_BLOCK_BLOOM_FILTER = FALSE TABLET_SIZE = 134217728 PCTFREE = 0 WITH COLUMN GROUP(all columns, each column)
ALTER TABLE Z0CASE CONVERT TO CHARACTER SET 'utf16' COLLATE 'utf16_unicode_ci';
SHOW CREATE TABLE Z0CASE;
Table	Create Table
z0case	CREATE TABLE `z0case` (
  `T1` text COLLATE utf16_unicode_ci DEFAULT NULL
) ORGANIZATION INDEX DEFAULT CHARSET = utf16 COLLATE = utf16_unicode_ci ROW_FORMAT = DYNAMIC COMPRESSION = 'zstd_1.3.8' REPLICA_NUM = replica_num BLOCK_SIZE = 16384 USE_BLOOM_FILTER = FALSE ENABLE_MACRO_BLOCK_BLOOM_FILTER = FALSE TABLET_SIZE = 134217728 PCTFREE = 0 WITH COLUMN GROUP(all columns, each column)
SELECT * FROM Z0CASE;
T1
123
%^&*[];//\
NULL
abc
中文
insert
INSERT INTO Z0CASE VALUES(111);
INSERT INTO Z0CASE VALUES('2001');
INSERT INTO Z0CASE VALUES('!*?< >aB12 中文');
INSERT INTO Z0CASE VALUES(b'0101101');
INSERT INTO Z0CASE VALUES('2021-10-01 12:23:35.54');
INSERT INTO Z0CASE VALUES('2011-11-01');
INSERT INTO Z0CASE VALUES('22:22:35');
INSERT INTO Z0CASE VALUES(12.345);
INSERT INTO Z0CASE VALUES(null);
SELECT table_name,column_type,COLLATION_NAME,CHARACTER_SET_NAME FROM information_schema.columns WHERE table_name='Z0CASE';
table_name	column_type	COLLATION_NAME	CHARACTER_SET_NAME
z0case	text	utf16_unicode_ci	utf16
SHOW CREATE TABLE Z0CASE;
Table	Create Table
z0case	CREATE TABLE `z0case` (
  `T1` text COLLATE utf16_unicode_ci DEFAULT NULL
) ORGANIZATION INDEX DEFAULT CHARSET = utf16 COLLATE = utf16_unicode_ci ROW_FORMAT = DYNAMIC COMPRESSION = 'zstd_1.3.8' REPLICA_NUM = replica_num BLOCK_SIZE = 16384 USE_BLOOM_FILTER = FALSE ENABLE_MACRO_BLOCK_BLOOM_FILTER = FALSE TABLET_SIZE = 134217728 PCTFREE = 0 WITH COLUMN GROUP(all columns, each column)
SELECT * FROM Z0CASE;
T1
123
%^&*[];//\
NULL
abc
中文
111
2001
!*?< >aB12 中文
-
2021-10-01 12:23:35.54
2011-11-01
22:22:35
12.345
NULL
update
UPDATE Z0CASE SET T1=NULL WHERE T1='111';
UPDATE Z0CASE SET T1='12:31:56' WHERE T1=2001;
ERROR 22007: Truncated incorrect DECIMAL value: '%^&*[];//\'
UPDATE Z0CASE SET T1=1221.34 WHERE T1='2011-11-01';
UPDATE Z0CASE SET T1='Aa1$< >中文' WHERE T1='12.345';
UPDATE Z0CASE SET T1=b'0101101' WHERE T1='abc';
SELECT table_name,column_type,COLLATION_NAME,CHARACTER_SET_NAME FROM information_schema.columns WHERE table_name='Z0CASE';
table_name	column_type	COLLATION_NAME	CHARACTER_SET_NAME
z0case	text	utf16_unicode_ci	utf16
SHOW CREATE TABLE Z0CASE;
Table	Create Table
z0case	CREATE TABLE `z0case` (
  `T1` text COLLATE utf16_unicode_ci DEFAULT NULL
) ORGANIZATION INDEX DEFAULT CHARSET = utf16 COLLATE = utf16_unicode_ci ROW_FORMAT = DYNAMIC COMPRESSION = 'zstd_1.3.8' REPLICA_NUM = replica_num BLOCK_SIZE = 16384 USE_BLOOM_FILTER = FALSE ENABLE_MACRO_BLOCK_BLOOM_FILTER = FALSE TABLET_SIZE = 134217728 PCTFREE = 0 WITH COLUMN GROUP(all columns, each column)
SELECT * FROM Z0CASE;
T1
123
%^&*[];//\
NULL
-
中文
NULL
2001
!*?< >aB12 中文
-
2021-10-01 12:23:35.54
1221.34
22:22:35
Aa1$< >中文
NULL
delete
DELETE FROM Z0CASE WHERE T1=1221.34;
ERROR 22007: Truncated incorrect DECIMAL value: '%^&*[];//\'
DELETE FROM Z0CASE WHERE T1='2021-10-01 12:23:35.54';
DELETE FROM Z0CASE WHERE T1 IS NULL;
DELETE FROM Z0CASE WHERE T1=b'0101101';
SELECT * FROM Z0CASE;
T1
123
%^&*[];//\
中文
2001
!*?< >aB12 中文
1221.34
22:22:35
Aa1$< >中文
LONGTEXT
DROP TABLE Z0CASE;
CREATE TABLE Z0CASE(T1 LONGTEXT) DEFAULT charset= utf8mb4 DEFAULT collate = utf8mb4_general_ci with column group (all columns, each column);
INSERT INTO Z0CASE VALUES(123);
INSERT INTO Z0CASE VALUES('%^&*[];//\\');
INSERT INTO Z0CASE VALUES(NULL);
INSERT INTO Z0CASE VALUES('abc');
INSERT INTO Z0CASE VALUES('中文');
SELECT * FROM Z0CASE;
T1
123
%^&*[];//\
NULL
abc
中文
SELECT table_name,column_type,COLLATION_NAME,CHARACTER_SET_NAME FROM information_schema.columns WHERE table_name='Z0CASE';
table_name	column_type	COLLATION_NAME	CHARACTER_SET_NAME
z0case	longtext	utf8mb4_general_ci	utf8mb4
SHOW CREATE TABLE Z0CASE;
Table	Create Table
z0case	CREATE TABLE `z0case` (
  `T1` longtext DEFAULT NULL
) ORGANIZATION INDEX DEFAULT CHARSET = utf8mb4 ROW_FORMAT = DYNAMIC COMPRESSION = 'zstd_1.3.8' REPLICA_NUM = replica_num BLOCK_SIZE = 16384 USE_BLOOM_FILTER = FALSE ENABLE_MACRO_BLOCK_BLOOM_FILTER = FALSE TABLET_SIZE = 134217728 PCTFREE = 0 WITH COLUMN GROUP(all columns, each column)
ALTER TABLE Z0CASE CONVERT TO CHARACTER SET 'utf16' COLLATE 'utf16_unicode_ci';
SHOW CREATE TABLE Z0CASE;
Table	Create Table
z0case	CREATE TABLE `z0case` (
  `T1` longtext COLLATE utf16_unicode_ci DEFAULT NULL
) ORGANIZATION INDEX DEFAULT CHARSET = utf16 COLLATE = utf16_unicode_ci ROW_FORMAT = DYNAMIC COMPRESSION = 'zstd_1.3.8' REPLICA_NUM = replica_num BLOCK_SIZE = 16384 USE_BLOOM_FILTER = FALSE ENABLE_MACRO_BLOCK_BLOOM_FILTER = FALSE TABLET_SIZE = 134217728 PCTFREE = 0 WITH COLUMN GROUP(all columns, each column)
SELECT * FROM Z0CASE;
T1
123
%^&*[];//\
NULL
abc
中文
insert
INSERT INTO Z0CASE VALUES(111);
INSERT INTO Z0CASE VALUES('2001');
INSERT INTO Z0CASE VALUES('!*?< >aB12 中文');
INSERT INTO Z0CASE VALUES(b'0101101');
INSERT INTO Z0CASE VALUES('2021-10-01 12:23:35.54');
INSERT INTO Z0CASE VALUES('2011-11-01');
INSERT INTO Z0CASE VALUES('22:22:35');
INSERT INTO Z0CASE VALUES(12.345);
INSERT INTO Z0CASE VALUES(null);
SELECT table_name,column_type,COLLATION_NAME,CHARACTER_SET_NAME FROM information_schema.columns WHERE table_name='Z0CASE';
table_name	column_type	COLLATION_NAME	CHARACTER_SET_NAME
z0case	longtext	utf16_unicode_ci	utf16
SHOW CREATE TABLE Z0CASE;
Table	Create Table
z0case	CREATE TABLE `z0case` (
  `T1` longtext COLLATE utf16_unicode_ci DEFAULT NULL
) ORGANIZATION INDEX DEFAULT CHARSET = utf16 COLLATE = utf16_unicode_ci ROW_FORMAT = DYNAMIC COMPRESSION = 'zstd_1.3.8' REPLICA_NUM = replica_num BLOCK_SIZE = 16384 USE_BLOOM_FILTER = FALSE ENABLE_MACRO_BLOCK_BLOOM_FILTER = FALSE TABLET_SIZE = 134217728 PCTFREE = 0 WITH COLUMN GROUP(all columns, each column)
SELECT * FROM Z0CASE;
T1
123
%^&*[];//\
NULL
abc
中文
111
2001
!*?< >aB12 中文
-
2021-10-01 12:23:35.54
2011-11-01
22:22:35
12.345
NULL
update
UPDATE Z0CASE SET T1=NULL WHERE T1='111';
UPDATE Z0CASE SET T1='12:31:56' WHERE T1=2001;
ERROR 22007: Truncated incorrect DECIMAL value: '%^&*[];//\'
UPDATE Z0CASE SET T1=1221.34 WHERE T1='2011-11-01';
UPDATE Z0CASE SET T1='Aa1$< >中文' WHERE T1='12.345';
UPDATE Z0CASE SET T1=b'0101101' WHERE T1='abc';
SELECT table_name,column_type,COLLATION_NAME,CHARACTER_SET_NAME FROM information_schema.columns WHERE table_name='Z0CASE';
table_name	column_type	COLLATION_NAME	CHARACTER_SET_NAME
z0case	longtext	utf16_unicode_ci	utf16
SHOW CREATE TABLE Z0CASE;
Table	Create Table
z0case	CREATE TABLE `z0case` (
  `T1` longtext COLLATE utf16_unicode_ci DEFAULT NULL
) ORGANIZATION INDEX DEFAULT CHARSET = utf16 COLLATE = utf16_unicode_ci ROW_FORMAT = DYNAMIC COMPRESSION = 'zstd_1.3.8' REPLICA_NUM = replica_num BLOCK_SIZE = 16384 USE_BLOOM_FILTER = FALSE ENABLE_MACRO_BLOCK_BLOOM_FILTER = FALSE TABLET_SIZE = 134217728 PCTFREE = 0 WITH COLUMN GROUP(all columns, each column)
SELECT * FROM Z0CASE;
T1
123
%^&*[];//\
NULL
-
中文
NULL
2001
!*?< >aB12 中文
-
2021-10-01 12:23:35.54
1221.34
22:22:35
Aa1$< >中文
NULL
delete
DELETE FROM Z0CASE WHERE T1=1221.34;
ERROR 22007: Truncated incorrect DECIMAL value: '%^&*[];//\'
DELETE FROM Z0CASE WHERE T1='2021-10-01 12:23:35.54';
DELETE FROM Z0CASE WHERE T1 IS NULL;
DELETE FROM Z0CASE WHERE T1=b'0101101';
SELECT * FROM Z0CASE;
T1
123
%^&*[];//\
中文
2001
!*?< >aB12 中文
1221.34
22:22:35
Aa1$< >中文
BLOB
DROP TABLE Z0CASE;
CREATE TABLE Z0CASE(T1 BLOB) DEFAULT charset= utf8mb4 DEFAULT collate = utf8mb4_general_ci with column group (all columns, each column);
INSERT INTO Z0CASE VALUES(123);
INSERT INTO Z0CASE VALUES('%^&*[];//\\');
INSERT INTO Z0CASE VALUES(NULL);
INSERT INTO Z0CASE VALUES('abc');
INSERT INTO Z0CASE VALUES('中文');
SELECT * FROM Z0CASE;
T1
123
%^&*[];//\
NULL
abc
中文
SELECT table_name,column_type,COLLATION_NAME,CHARACTER_SET_NAME FROM information_schema.columns WHERE table_name='Z0CASE';
table_name	column_type	COLLATION_NAME	CHARACTER_SET_NAME
z0case	blob	NULL	NULL
SHOW CREATE TABLE Z0CASE;
Table	Create Table
z0case	CREATE TABLE `z0case` (
  `T1` blob DEFAULT NULL
) ORGANIZATION INDEX DEFAULT CHARSET = utf8mb4 ROW_FORMAT = DYNAMIC COMPRESSION = 'zstd_1.3.8' REPLICA_NUM = replica_num BLOCK_SIZE = 16384 USE_BLOOM_FILTER = FALSE ENABLE_MACRO_BLOCK_BLOOM_FILTER = FALSE TABLET_SIZE = 134217728 PCTFREE = 0 WITH COLUMN GROUP(all columns, each column)
ALTER TABLE Z0CASE CONVERT TO CHARACTER SET 'utf16' COLLATE 'utf16_unicode_ci';
SHOW CREATE TABLE Z0CASE;
Table	Create Table
z0case	CREATE TABLE `z0case` (
  `T1` blob DEFAULT NULL
) ORGANIZATION INDEX DEFAULT CHARSET = utf16 COLLATE = utf16_unicode_ci ROW_FORMAT = DYNAMIC COMPRESSION = 'zstd_1.3.8' REPLICA_NUM = replica_num BLOCK_SIZE = 16384 USE_BLOOM_FILTER = FALSE ENABLE_MACRO_BLOCK_BLOOM_FILTER = FALSE TABLET_SIZE = 134217728 PCTFREE = 0 WITH COLUMN GROUP(all columns, each column)
SELECT * FROM Z0CASE;
T1
123
%^&*[];//\
NULL
abc
中文
insert
INSERT INTO Z0CASE VALUES(111);
INSERT INTO Z0CASE VALUES('2001');
INSERT INTO Z0CASE VALUES('!*?< >aB12 中文');
INSERT INTO Z0CASE VALUES(b'0101101');
INSERT INTO Z0CASE VALUES('2021-10-01 12:23:35.54');
INSERT INTO Z0CASE VALUES('2011-11-01');
INSERT INTO Z0CASE VALUES('22:22:35');
INSERT INTO Z0CASE VALUES(12.345);
INSERT INTO Z0CASE VALUES(null);
SELECT table_name,column_type,COLLATION_NAME,CHARACTER_SET_NAME FROM information_schema.columns WHERE table_name='Z0CASE';
table_name	column_type	COLLATION_NAME	CHARACTER_SET_NAME
z0case	blob	NULL	NULL
SHOW CREATE TABLE Z0CASE;
Table	Create Table
z0case	CREATE TABLE `z0case` (
  `T1` blob DEFAULT NULL
) ORGANIZATION INDEX DEFAULT CHARSET = utf16 COLLATE = utf16_unicode_ci ROW_FORMAT = DYNAMIC COMPRESSION = 'zstd_1.3.8' REPLICA_NUM = replica_num BLOCK_SIZE = 16384 USE_BLOOM_FILTER = FALSE ENABLE_MACRO_BLOCK_BLOOM_FILTER = FALSE TABLET_SIZE = 134217728 PCTFREE = 0 WITH COLUMN GROUP(all columns, each column)
SELECT * FROM Z0CASE;
T1
123
%^&*[];//\
NULL
abc
中文
111
2001
!*?< >aB12 中文
-
2021-10-01 12:23:35.54
2011-11-01
22:22:35
12.345
NULL
update
UPDATE Z0CASE SET T1=NULL WHERE T1='111';
UPDATE Z0CASE SET T1='12:31:56' WHERE T1=2001;
ERROR 22007: Truncated incorrect DECIMAL value: '%^&*[];//\'
UPDATE Z0CASE SET T1=1221.34 WHERE T1='2011-11-01';
UPDATE Z0CASE SET T1='Aa1$< >中文' WHERE T1='12.345';
UPDATE Z0CASE SET T1=b'0101101' WHERE T1='abc';
SELECT table_name,column_type,COLLATION_NAME,CHARACTER_SET_NAME FROM information_schema.columns WHERE table_name='Z0CASE';
table_name	column_type	COLLATION_NAME	CHARACTER_SET_NAME
z0case	blob	NULL	NULL
SHOW CREATE TABLE Z0CASE;
Table	Create Table
z0case	CREATE TABLE `z0case` (
  `T1` blob DEFAULT NULL
) ORGANIZATION INDEX DEFAULT CHARSET = utf16 COLLATE = utf16_unicode_ci ROW_FORMAT = DYNAMIC COMPRESSION = 'zstd_1.3.8' REPLICA_NUM = replica_num BLOCK_SIZE = 16384 USE_BLOOM_FILTER = FALSE ENABLE_MACRO_BLOCK_BLOOM_FILTER = FALSE TABLET_SIZE = 134217728 PCTFREE = 0 WITH COLUMN GROUP(all columns, each column)
SELECT * FROM Z0CASE;
T1
123
%^&*[];//\
NULL
-
中文
NULL
2001
!*?< >aB12 中文
-
2021-10-01 12:23:35.54
1221.34
22:22:35
Aa1$< >中文
NULL
delete
DELETE FROM Z0CASE WHERE T1=1221.34;
ERROR 22007: Truncated incorrect DECIMAL value: '%^&*[];//\'
DELETE FROM Z0CASE WHERE T1='2021-10-01 12:23:35.54';
DELETE FROM Z0CASE WHERE T1 IS NULL;
DELETE FROM Z0CASE WHERE T1=b'0101101';
SELECT * FROM Z0CASE;
T1
123
%^&*[];//\
中文
2001
!*?< >aB12 中文
1221.34
22:22:35
Aa1$< >中文
BINARY
DROP TABLE Z0CASE;
CREATE TABLE Z0CASE(T1 BINARY(50)) DEFAULT charset= utf8mb4 DEFAULT collate = utf8mb4_general_ci with column group (all columns, each column);
INSERT INTO Z0CASE VALUES(123);
INSERT INTO Z0CASE VALUES('%^&*[];//\\');
INSERT INTO Z0CASE VALUES(NULL);
INSERT INTO Z0CASE VALUES('abc');
INSERT INTO Z0CASE VALUES('中文');
SELECT * FROM Z0CASE;
T1
123                                               
%^&*[];//\                                        
NULL
abc                                               
中文                                            
SELECT table_name,column_type,COLLATION_NAME,CHARACTER_SET_NAME FROM information_schema.columns WHERE table_name='Z0CASE';
table_name	column_type	COLLATION_NAME	CHARACTER_SET_NAME
z0case	binary(50)	NULL	NULL
SHOW CREATE TABLE Z0CASE;
Table	Create Table
z0case	CREATE TABLE `z0case` (
  `T1` binary(50) DEFAULT NULL
) ORGANIZATION INDEX DEFAULT CHARSET = utf8mb4 ROW_FORMAT = DYNAMIC COMPRESSION = 'zstd_1.3.8' REPLICA_NUM = replica_num BLOCK_SIZE = 16384 USE_BLOOM_FILTER = FALSE ENABLE_MACRO_BLOCK_BLOOM_FILTER = FALSE TABLET_SIZE = 134217728 PCTFREE = 0 WITH COLUMN GROUP(all columns, each column)
ALTER TABLE Z0CASE CONVERT TO CHARACTER SET 'utf16' COLLATE 'utf16_unicode_ci';
SHOW CREATE TABLE Z0CASE;
Table	Create Table
z0case	CREATE TABLE `z0case` (
  `T1` binary(50) DEFAULT NULL
) ORGANIZATION INDEX DEFAULT CHARSET = utf16 COLLATE = utf16_unicode_ci ROW_FORMAT = DYNAMIC COMPRESSION = 'zstd_1.3.8' REPLICA_NUM = replica_num BLOCK_SIZE = 16384 USE_BLOOM_FILTER = FALSE ENABLE_MACRO_BLOCK_BLOOM_FILTER = FALSE TABLET_SIZE = 134217728 PCTFREE = 0 WITH COLUMN GROUP(all columns, each column)
SELECT * FROM Z0CASE;
T1
123                                               
%^&*[];//\                                        
NULL
abc                                               
中文                                            
insert
INSERT INTO Z0CASE VALUES(111);
INSERT INTO Z0CASE VALUES('2001');
INSERT INTO Z0CASE VALUES('!*?< >aB12 中文');
INSERT INTO Z0CASE VALUES(b'0101101');
INSERT INTO Z0CASE VALUES('2021-10-01 12:23:35.54');
INSERT INTO Z0CASE VALUES('2011-11-01');
INSERT INTO Z0CASE VALUES('22:22:35');
INSERT INTO Z0CASE VALUES(12.345);
INSERT INTO Z0CASE VALUES(null);
SELECT table_name,column_type,COLLATION_NAME,CHARACTER_SET_NAME FROM information_schema.columns WHERE table_name='Z0CASE';
table_name	column_type	COLLATION_NAME	CHARACTER_SET_NAME
z0case	binary(50)	NULL	NULL
SHOW CREATE TABLE Z0CASE;
Table	Create Table
z0case	CREATE TABLE `z0case` (
  `T1` binary(50) DEFAULT NULL
) ORGANIZATION INDEX DEFAULT CHARSET = utf16 COLLATE = utf16_unicode_ci ROW_FORMAT = DYNAMIC COMPRESSION = 'zstd_1.3.8' REPLICA_NUM = replica_num BLOCK_SIZE = 16384 USE_BLOOM_FILTER = FALSE ENABLE_MACRO_BLOCK_BLOOM_FILTER = FALSE TABLET_SIZE = 134217728 PCTFREE = 0 WITH COLUMN GROUP(all columns, each column)
SELECT * FROM Z0CASE;
T1
123                                               
%^&*[];//\                                        
NULL
abc                                               
中文                                            
111                                               
2001                                              
!*?< >aB12 中文                                 
-                                                 
2021-10-01 12:23:35.54                            
2011-11-01                                        
22:22:35                                          
12.345                                            
NULL
update
UPDATE Z0CASE SET T1=NULL WHERE T1='111';
UPDATE Z0CASE SET T1='12:31:56' WHERE T1=2001;
ERROR 22007: Truncated incorrect DECIMAL value: '123'
UPDATE Z0CASE SET T1=1221.34 WHERE T1='2011-11-01';
UPDATE Z0CASE SET T1='Aa1$< >中文' WHERE T1='12.345';
UPDATE Z0CASE SET T1=b'0101101' WHERE T1='abc';
SELECT table_name,column_type,COLLATION_NAME,CHARACTER_SET_NAME FROM information_schema.columns WHERE table_name='Z0CASE';
table_name	column_type	COLLATION_NAME	CHARACTER_SET_NAME
z0case	binary(50)	NULL	NULL
SHOW CREATE TABLE Z0CASE;
Table	Create Table
z0case	CREATE TABLE `z0case` (
  `T1` binary(50) DEFAULT NULL
) ORGANIZATION INDEX DEFAULT CHARSET = utf16 COLLATE = utf16_unicode_ci ROW_FORMAT = DYNAMIC COMPRESSION = 'zstd_1.3.8' REPLICA_NUM = replica_num BLOCK_SIZE = 16384 USE_BLOOM_FILTER = FALSE ENABLE_MACRO_BLOCK_BLOOM_FILTER = FALSE TABLET_SIZE = 134217728 PCTFREE = 0 WITH COLUMN GROUP(all columns, each column)
SELECT * FROM Z0CASE;
T1
123                                               
%^&*[];//\                                        
NULL
abc                                               
中文                                            
111                                               
2001                                              
!*?< >aB12 中文                                 
-                                                 
2021-10-01 12:23:35.54                            
2011-11-01                                        
22:22:35                                          
12.345                                            
NULL
delete
DELETE FROM Z0CASE WHERE T1=1221.34;
ERROR 22007: Truncated incorrect DECIMAL value: '123'
DELETE FROM Z0CASE WHERE T1='2021-10-01 12:23:35.54';
DELETE FROM Z0CASE WHERE T1 IS NULL;
DELETE FROM Z0CASE WHERE T1=b'0101101';
SELECT * FROM Z0CASE;
T1
123                                               
%^&*[];//\                                        
abc                                               
中文                                            
111                                               
2001                                              
!*?< >aB12 中文                                 
-                                                 
2021-10-01 12:23:35.54                            
2011-11-01                                        
22:22:35                                          
12.345                                            
ENUM
DROP TABLE Z0CASE;
CREATE TABLE Z0CASE(T1 ENUM('123','abc','中文','%^&*[];//\\','111','2021-10-01 12:23:35.54','2011-11-01','12.345',b'0101101')) DEFAULT charset= utf8mb4 DEFAULT collate = utf8mb4_general_ci with column group (all columns, each column);
INSERT INTO Z0CASE VALUES('123');
INSERT INTO Z0CASE VALUES('%^&*[];//\\');
INSERT INTO Z0CASE VALUES(NULL);
INSERT INTO Z0CASE VALUES('abc');
INSERT INTO Z0CASE VALUES('中文');
SELECT * FROM Z0CASE;
T1
123
%^&*[];//\
NULL
abc
中文
SELECT table_name,column_type,COLLATION_NAME,CHARACTER_SET_NAME FROM information_schema.columns WHERE table_name='Z0CASE';
table_name	column_type	COLLATION_NAME	CHARACTER_SET_NAME
z0case	enum('123','abc','中文','%^&*[];//\','111','2021-10-01 12:23:35.54','2011-11-01','12.345','-')	utf8mb4_general_ci	utf8mb4
SHOW CREATE TABLE Z0CASE;
Table	Create Table
z0case	CREATE TABLE `z0case` (
  `T1` enum('123','abc','中文','%^&*[];//\','111','2021-10-01 12:23:35.54','2011-11-01','12.345','-') DEFAULT NULL
) ORGANIZATION INDEX DEFAULT CHARSET = utf8mb4 ROW_FORMAT = DYNAMIC COMPRESSION = 'zstd_1.3.8' REPLICA_NUM = replica_num BLOCK_SIZE = 16384 USE_BLOOM_FILTER = FALSE ENABLE_MACRO_BLOCK_BLOOM_FILTER = FALSE TABLET_SIZE = 134217728 PCTFREE = 0 WITH COLUMN GROUP(all columns, each column)
ALTER TABLE Z0CASE CONVERT TO CHARACTER SET 'utf16' COLLATE 'utf16_unicode_ci';
BIT
DROP TABLE Z0CASE;
CREATE TABLE Z0CASE(T1 BIT(20)) DEFAULT charset= utf8mb4 DEFAULT collate = utf8mb4_general_ci with column group (all columns, each column);
INSERT INTO Z0CASE VALUES(b'0101001');
INSERT INTO Z0CASE VALUES(b'111010101010100');
INSERT INTO Z0CASE VALUES(NULL);
SELECT BIN(T1) FROM Z0CASE;
BIN(T1)
101001
111010101010100
NULL
SELECT table_name,column_type,COLLATION_NAME,CHARACTER_SET_NAME FROM information_schema.columns WHERE table_name='Z0CASE';
table_name	column_type	COLLATION_NAME	CHARACTER_SET_NAME
z0case	bit(20)	NULL	NULL
SHOW CREATE TABLE Z0CASE;
Table	Create Table
z0case	CREATE TABLE `z0case` (
  `T1` bit(20) DEFAULT NULL
) ORGANIZATION INDEX DEFAULT CHARSET = utf8mb4 ROW_FORMAT = DYNAMIC COMPRESSION = 'zstd_1.3.8' REPLICA_NUM = replica_num BLOCK_SIZE = 16384 USE_BLOOM_FILTER = FALSE ENABLE_MACRO_BLOCK_BLOOM_FILTER = FALSE TABLET_SIZE = 134217728 PCTFREE = 0 WITH COLUMN GROUP(all columns, each column)
ALTER TABLE Z0CASE CONVERT TO CHARACTER SET 'utf16' COLLATE 'utf16_unicode_ci';
SHOW CREATE TABLE Z0CASE;
Table	Create Table
z0case	CREATE TABLE `z0case` (
  `T1` bit(20) DEFAULT NULL
) ORGANIZATION INDEX DEFAULT CHARSET = utf16 COLLATE = utf16_unicode_ci ROW_FORMAT = DYNAMIC COMPRESSION = 'zstd_1.3.8' REPLICA_NUM = replica_num BLOCK_SIZE = 16384 USE_BLOOM_FILTER = FALSE ENABLE_MACRO_BLOCK_BLOOM_FILTER = FALSE TABLET_SIZE = 134217728 PCTFREE = 0 WITH COLUMN GROUP(all columns, each column)
SELECT BIN(T1) FROM Z0CASE;
BIN(T1)
101001
111010101010100
NULL
insert
INSERT INTO Z0CASE VALUES(111);
INSERT INTO Z0CASE VALUES(b'010110100');
INSERT INTO Z0CASE VALUES(12.345);
INSERT INTO Z0CASE VALUES(null);
SELECT BIN(T1) FROM Z0CASE;
BIN(T1)
101001
111010101010100
NULL
1101111
10110100
1100
NULL
INSERT INTO Z0CASE VALUES('2001');
ERROR 22001: Data too long for column 'T1' at row 1
INSERT INTO Z0CASE VALUES('!*?< >aB12 中文');
ERROR 22001: Data too long for column 'T1' at row 1
INSERT INTO Z0CASE VALUES('2021-10-01 12:23:35.54');
ERROR 22001: Data too long for column 'T1' at row 1
INSERT INTO Z0CASE VALUES('2011-11-01');
ERROR 22001: Data too long for column 'T1' at row 1
INSERT INTO Z0CASE VALUES('22:22:35');
ERROR 22001: Data too long for column 'T1' at row 1
SELECT table_name,column_type,COLLATION_NAME,CHARACTER_SET_NAME FROM information_schema.columns WHERE table_name='Z0CASE';
table_name	column_type	COLLATION_NAME	CHARACTER_SET_NAME
z0case	bit(20)	NULL	NULL
SHOW CREATE TABLE Z0CASE;
Table	Create Table
z0case	CREATE TABLE `z0case` (
  `T1` bit(20) DEFAULT NULL
) ORGANIZATION INDEX DEFAULT CHARSET = utf16 COLLATE = utf16_unicode_ci ROW_FORMAT = DYNAMIC COMPRESSION = 'zstd_1.3.8' REPLICA_NUM = replica_num BLOCK_SIZE = 16384 USE_BLOOM_FILTER = FALSE ENABLE_MACRO_BLOCK_BLOOM_FILTER = FALSE TABLET_SIZE = 134217728 PCTFREE = 0 WITH COLUMN GROUP(all columns, each column)
SELECT BIN(T1) FROM Z0CASE;
BIN(T1)
101001
111010101010100
NULL
1101111
10110100
1100
NULL
update
UPDATE Z0CASE SET T1=NULL WHERE T1=b'0101001';
UPDATE Z0CASE SET T1='22:22:35' WHERE T1=b'111010101010100';
ERROR 22001: Data too long for column 'T1' at row 1
UPDATE Z0CASE SET T1=12.345 WHERE T1=b'111010101010100';
UPDATE Z0CASE SET T1=b'0101101' WHERE T1=b'111010101010100';
SELECT table_name,column_type,COLLATION_NAME,CHARACTER_SET_NAME FROM information_schema.columns WHERE table_name='Z0CASE';
table_name	column_type	COLLATION_NAME	CHARACTER_SET_NAME
z0case	bit(20)	NULL	NULL
SHOW CREATE TABLE Z0CASE;
Table	Create Table
z0case	CREATE TABLE `z0case` (
  `T1` bit(20) DEFAULT NULL
) ORGANIZATION INDEX DEFAULT CHARSET = utf16 COLLATE = utf16_unicode_ci ROW_FORMAT = DYNAMIC COMPRESSION = 'zstd_1.3.8' REPLICA_NUM = replica_num BLOCK_SIZE = 16384 USE_BLOOM_FILTER = FALSE ENABLE_MACRO_BLOCK_BLOOM_FILTER = FALSE TABLET_SIZE = 134217728 PCTFREE = 0 WITH COLUMN GROUP(all columns, each column)
SELECT BIN(T1) FROM Z0CASE;
BIN(T1)
NULL
1100
NULL
1101111
10110100
1100
NULL
delete
DELETE FROM Z0CASE WHERE T1 IS NULL;
DELETE FROM Z0CASE WHERE T1=b'111010101010100';
SELECT BIN(T1) FROM Z0CASE;
BIN(T1)
1100
1101111
10110100
1100
INT
DROP TABLE Z0CASE;
CREATE TABLE Z0CASE(T1 INT) DEFAULT charset= utf8mb4 DEFAULT collate = utf8mb4_general_ci with column group (all columns, each column);
INSERT INTO Z0CASE VALUES(123);
INSERT INTO Z0CASE VALUES(123.3445);
INSERT INTO Z0CASE VALUES(NULL);
SELECT * FROM Z0CASE;
T1
123
123
NULL
SELECT table_name,column_type,COLLATION_NAME,CHARACTER_SET_NAME FROM information_schema.columns WHERE table_name='Z0CASE';
table_name	column_type	COLLATION_NAME	CHARACTER_SET_NAME
z0case	int(11)	NULL	NULL
SHOW CREATE TABLE Z0CASE;
Table	Create Table
z0case	CREATE TABLE `z0case` (
  `T1` int(11) DEFAULT NULL
) ORGANIZATION INDEX DEFAULT CHARSET = utf8mb4 ROW_FORMAT = DYNAMIC COMPRESSION = 'zstd_1.3.8' REPLICA_NUM = replica_num BLOCK_SIZE = 16384 USE_BLOOM_FILTER = FALSE ENABLE_MACRO_BLOCK_BLOOM_FILTER = FALSE TABLET_SIZE = 134217728 PCTFREE = 0 WITH COLUMN GROUP(all columns, each column)
ALTER TABLE Z0CASE CONVERT TO CHARACTER SET 'utf16' COLLATE 'utf16_unicode_ci';
SHOW CREATE TABLE Z0CASE;
Table	Create Table
z0case	CREATE TABLE `z0case` (
  `T1` int(11) DEFAULT NULL
) ORGANIZATION INDEX DEFAULT CHARSET = utf16 COLLATE = utf16_unicode_ci ROW_FORMAT = DYNAMIC COMPRESSION = 'zstd_1.3.8' REPLICA_NUM = replica_num BLOCK_SIZE = 16384 USE_BLOOM_FILTER = FALSE ENABLE_MACRO_BLOCK_BLOOM_FILTER = FALSE TABLET_SIZE = 134217728 PCTFREE = 0 WITH COLUMN GROUP(all columns, each column)
SELECT * FROM Z0CASE;
T1
123
123
NULL
insert
INSERT INTO Z0CASE VALUES(111);
INSERT INTO Z0CASE VALUES('2001');
INSERT INTO Z0CASE VALUES('!*?< >aB12 中文');
ERROR HY000: Incorrect integer value for column 'T1' at row 1
INSERT INTO Z0CASE VALUES(b'0101101');
INSERT INTO Z0CASE VALUES('2021-10-01 12:23:35.54');
ERROR 01000: Data truncated for column 'T1' at row 1
INSERT INTO Z0CASE VALUES('2011-11-01');
ERROR 01000: Data truncated for column 'T1' at row 1
INSERT INTO Z0CASE VALUES('22:22:35');
ERROR 01000: Data truncated for column 'T1' at row 1
INSERT INTO Z0CASE VALUES(12.345);
INSERT INTO Z0CASE VALUES(null);
SELECT table_name,column_type,COLLATION_NAME,CHARACTER_SET_NAME FROM information_schema.columns WHERE table_name='Z0CASE';
table_name	column_type	COLLATION_NAME	CHARACTER_SET_NAME
z0case	int(11)	NULL	NULL
SHOW CREATE TABLE Z0CASE;
Table	Create Table
z0case	CREATE TABLE `z0case` (
  `T1` int(11) DEFAULT NULL
) ORGANIZATION INDEX DEFAULT CHARSET = utf16 COLLATE = utf16_unicode_ci ROW_FORMAT = DYNAMIC COMPRESSION = 'zstd_1.3.8' REPLICA_NUM = replica_num BLOCK_SIZE = 16384 USE_BLOOM_FILTER = FALSE ENABLE_MACRO_BLOCK_BLOOM_FILTER = FALSE TABLET_SIZE = 134217728 PCTFREE = 0 WITH COLUMN GROUP(all columns, each column)
SELECT * FROM Z0CASE;
T1
123
123
NULL
111
2001
45
12
NULL
update
UPDATE Z0CASE SET T1=NULL WHERE T1='111';
UPDATE Z0CASE SET T1='12:31:56' WHERE T1=2001;
ERROR 01000: Data truncated for column 'T1' at row 1
UPDATE Z0CASE SET T1=1221.34 WHERE T1=2001;
UPDATE Z0CASE SET T1='Aa1$< >中文' WHERE T1='111';
UPDATE Z0CASE SET T1=b'0101101' WHERE T1=111;
SELECT table_name,column_type,COLLATION_NAME,CHARACTER_SET_NAME FROM information_schema.columns WHERE table_name='Z0CASE';
table_name	column_type	COLLATION_NAME	CHARACTER_SET_NAME
z0case	int(11)	NULL	NULL
SHOW CREATE TABLE Z0CASE;
Table	Create Table
z0case	CREATE TABLE `z0case` (
  `T1` int(11) DEFAULT NULL
) ORGANIZATION INDEX DEFAULT CHARSET = utf16 COLLATE = utf16_unicode_ci ROW_FORMAT = DYNAMIC COMPRESSION = 'zstd_1.3.8' REPLICA_NUM = replica_num BLOCK_SIZE = 16384 USE_BLOOM_FILTER = FALSE ENABLE_MACRO_BLOCK_BLOOM_FILTER = FALSE TABLET_SIZE = 134217728 PCTFREE = 0 WITH COLUMN GROUP(all columns, each column)
SELECT * FROM Z0CASE;
T1
123
123
NULL
NULL
1221
45
12
NULL
delete
DELETE FROM Z0CASE WHERE T1=1221.34;
DELETE FROM Z0CASE WHERE T1 IS NULL;
SELECT * FROM Z0CASE;
T1
123
123
1221
45
12
FLOAT
DROP TABLE Z0CASE;
CREATE TABLE Z0CASE(T1 FLOAT(20,0)) DEFAULT charset= utf8mb4 DEFAULT collate = utf8mb4_general_ci with column group (all columns, each column);
INSERT INTO Z0CASE VALUES(123);
INSERT INTO Z0CASE VALUES('123.3445');
INSERT INTO Z0CASE VALUES(641231122123.5445);
INSERT INTO Z0CASE VALUES(NULL);
SELECT * FROM Z0CASE;
T1
123
123
641231093760
NULL
SELECT table_name,column_type,COLLATION_NAME,CHARACTER_SET_NAME FROM information_schema.columns WHERE table_name='Z0CASE';
table_name	column_type	COLLATION_NAME	CHARACTER_SET_NAME
z0case	float(20,0)	NULL	NULL
SHOW CREATE TABLE Z0CASE;
Table	Create Table
z0case	CREATE TABLE `z0case` (
  `T1` float(20,0) DEFAULT NULL
) ORGANIZATION INDEX DEFAULT CHARSET = utf8mb4 ROW_FORMAT = DYNAMIC COMPRESSION = 'zstd_1.3.8' REPLICA_NUM = replica_num BLOCK_SIZE = 16384 USE_BLOOM_FILTER = FALSE ENABLE_MACRO_BLOCK_BLOOM_FILTER = FALSE TABLET_SIZE = 134217728 PCTFREE = 0 WITH COLUMN GROUP(all columns, each column)
ALTER TABLE Z0CASE CONVERT TO CHARACTER SET 'utf16' COLLATE 'utf16_unicode_ci';
SHOW CREATE TABLE Z0CASE;
Table	Create Table
z0case	CREATE TABLE `z0case` (
  `T1` float(20,0) DEFAULT NULL
) ORGANIZATION INDEX DEFAULT CHARSET = utf16 COLLATE = utf16_unicode_ci ROW_FORMAT = DYNAMIC COMPRESSION = 'zstd_1.3.8' REPLICA_NUM = replica_num BLOCK_SIZE = 16384 USE_BLOOM_FILTER = FALSE ENABLE_MACRO_BLOCK_BLOOM_FILTER = FALSE TABLET_SIZE = 134217728 PCTFREE = 0 WITH COLUMN GROUP(all columns, each column)
SELECT * FROM Z0CASE;
T1
123
123
641231093760
NULL
insert
INSERT INTO Z0CASE VALUES(111);
INSERT INTO Z0CASE VALUES('2001');
INSERT INTO Z0CASE VALUES('!*?< >aB12 中文');
ERROR 01000: Data truncated for column 'T1' at row 1
INSERT INTO Z0CASE VALUES(b'0101101');
INSERT INTO Z0CASE VALUES('2021-10-01 12:23:35.54');
ERROR 01000: Data truncated for column 'T1' at row 1
INSERT INTO Z0CASE VALUES('2011-11-01');
ERROR 01000: Data truncated for column 'T1' at row 1
INSERT INTO Z0CASE VALUES('22:22:35');
ERROR 01000: Data truncated for column 'T1' at row 1
INSERT INTO Z0CASE VALUES(12.3456);
INSERT INTO Z0CASE VALUES(null);
SELECT table_name,column_type,COLLATION_NAME,CHARACTER_SET_NAME FROM information_schema.columns WHERE table_name='Z0CASE';
table_name	column_type	COLLATION_NAME	CHARACTER_SET_NAME
z0case	float(20,0)	NULL	NULL
SHOW CREATE TABLE Z0CASE;
Table	Create Table
z0case	CREATE TABLE `z0case` (
  `T1` float(20,0) DEFAULT NULL
) ORGANIZATION INDEX DEFAULT CHARSET = utf16 COLLATE = utf16_unicode_ci ROW_FORMAT = DYNAMIC COMPRESSION = 'zstd_1.3.8' REPLICA_NUM = replica_num BLOCK_SIZE = 16384 USE_BLOOM_FILTER = FALSE ENABLE_MACRO_BLOCK_BLOOM_FILTER = FALSE TABLET_SIZE = 134217728 PCTFREE = 0 WITH COLUMN GROUP(all columns, each column)
SELECT * FROM Z0CASE;
T1
123
123
641231093760
NULL
111
2001
45
12
NULL
update
UPDATE Z0CASE SET T1=NULL WHERE T1='111';
UPDATE Z0CASE SET T1='12:31:56' WHERE T1=2001;
ERROR 01000: Data truncated for column 'T1' at row 1
UPDATE Z0CASE SET T1=1221.34 WHERE T1=2001;
UPDATE Z0CASE SET T1='Aa1$< >中文' WHERE T1=111;
UPDATE Z0CASE SET T1=b'0101101' WHERE T1=111;
SELECT table_name,column_type,COLLATION_NAME,CHARACTER_SET_NAME FROM information_schema.columns WHERE table_name='Z0CASE';
table_name	column_type	COLLATION_NAME	CHARACTER_SET_NAME
z0case	float(20,0)	NULL	NULL
SHOW CREATE TABLE Z0CASE;
Table	Create Table
z0case	CREATE TABLE `z0case` (
  `T1` float(20,0) DEFAULT NULL
) ORGANIZATION INDEX DEFAULT CHARSET = utf16 COLLATE = utf16_unicode_ci ROW_FORMAT = DYNAMIC COMPRESSION = 'zstd_1.3.8' REPLICA_NUM = replica_num BLOCK_SIZE = 16384 USE_BLOOM_FILTER = FALSE ENABLE_MACRO_BLOCK_BLOOM_FILTER = FALSE TABLET_SIZE = 134217728 PCTFREE = 0 WITH COLUMN GROUP(all columns, each column)
SELECT * FROM Z0CASE;
T1
123
123
641231093760
NULL
NULL
1221
45
12
NULL
delete
DELETE FROM Z0CASE WHERE T1=1221.34;
DELETE FROM Z0CASE WHERE T1 IS NULL;
SELECT * FROM Z0CASE;
T1
123
123
641231093760
1221
45
12
DATE
DROP TABLE Z0CASE;
CREATE TABLE Z0CASE(T1 DATE) DEFAULT charset= utf8mb4 DEFAULT collate = utf8mb4_general_ci with column group (all columns, each column);
INSERT INTO Z0CASE VALUES('20210321');
INSERT INTO Z0CASE VALUES('2020-11-21');
INSERT INTO Z0CASE VALUES('2021-01-21 11:58:39.456');
INSERT INTO Z0CASE VALUES(NULL);
SELECT * FROM Z0CASE;
T1
2021-03-21
2020-11-21
2021-01-21
NULL
SELECT table_name,column_type,COLLATION_NAME,CHARACTER_SET_NAME FROM information_schema.columns WHERE table_name='Z0CASE';
table_name	column_type	COLLATION_NAME	CHARACTER_SET_NAME
z0case	date	NULL	NULL
SHOW CREATE TABLE Z0CASE;
Table	Create Table
z0case	CREATE TABLE `z0case` (
  `T1` date DEFAULT NULL
) ORGANIZATION INDEX DEFAULT CHARSET = utf8mb4 ROW_FORMAT = DYNAMIC COMPRESSION = 'zstd_1.3.8' REPLICA_NUM = replica_num BLOCK_SIZE = 16384 USE_BLOOM_FILTER = FALSE ENABLE_MACRO_BLOCK_BLOOM_FILTER = FALSE TABLET_SIZE = 134217728 PCTFREE = 0 WITH COLUMN GROUP(all columns, each column)
ALTER TABLE Z0CASE CONVERT TO CHARACTER SET 'utf16' COLLATE 'utf16_unicode_ci';
SHOW CREATE TABLE Z0CASE;
Table	Create Table
z0case	CREATE TABLE `z0case` (
  `T1` date DEFAULT NULL
) ORGANIZATION INDEX DEFAULT CHARSET = utf16 COLLATE = utf16_unicode_ci ROW_FORMAT = DYNAMIC COMPRESSION = 'zstd_1.3.8' REPLICA_NUM = replica_num BLOCK_SIZE = 16384 USE_BLOOM_FILTER = FALSE ENABLE_MACRO_BLOCK_BLOOM_FILTER = FALSE TABLET_SIZE = 134217728 PCTFREE = 0 WITH COLUMN GROUP(all columns, each column)
SELECT * FROM Z0CASE;
T1
2021-03-21
2020-11-21
2021-01-21
NULL
insert
INSERT INTO Z0CASE VALUES(111);
INSERT INTO Z0CASE VALUES('2001');
ERROR 22007: Incorrect datetime value for column 'T1' at row 1
INSERT INTO Z0CASE VALUES('!*?< >aB12 中文');
ERROR 22007: Incorrect datetime value for column 'T1' at row 1
INSERT INTO Z0CASE VALUES(b'0101101');
ERROR 22007: Incorrect datetime value for column 'T1' at row 1
INSERT INTO Z0CASE VALUES('2021-10-01 12:23:35.54');
INSERT INTO Z0CASE VALUES('2011-11-01');
INSERT INTO Z0CASE VALUES('22:22:35');
ERROR 22007: Incorrect datetime value for column 'T1' at row 1
INSERT INTO Z0CASE VALUES(12.3456);
ERROR 22007: Incorrect datetime value for column 'T1' at row 1
INSERT INTO Z0CASE VALUES(null);
SELECT table_name,column_type,COLLATION_NAME,CHARACTER_SET_NAME FROM information_schema.columns WHERE table_name='Z0CASE';
table_name	column_type	COLLATION_NAME	CHARACTER_SET_NAME
z0case	date	NULL	NULL
SHOW CREATE TABLE Z0CASE;
Table	Create Table
z0case	CREATE TABLE `z0case` (
  `T1` date DEFAULT NULL
) ORGANIZATION INDEX DEFAULT CHARSET = utf16 COLLATE = utf16_unicode_ci ROW_FORMAT = DYNAMIC COMPRESSION = 'zstd_1.3.8' REPLICA_NUM = replica_num BLOCK_SIZE = 16384 USE_BLOOM_FILTER = FALSE ENABLE_MACRO_BLOCK_BLOOM_FILTER = FALSE TABLET_SIZE = 134217728 PCTFREE = 0 WITH COLUMN GROUP(all columns, each column)
SELECT * FROM Z0CASE;
T1
2021-03-21
2020-11-21
2021-01-21
NULL
2000-01-11
2021-10-01
2011-11-01
NULL
update
UPDATE Z0CASE SET T1=NULL WHERE T1='2020-11-21';
UPDATE Z0CASE SET T1='12:31:56' WHERE T1='2021-01-21';
ERROR 22007: Incorrect datetime value for column 'T1' at row 1
UPDATE Z0CASE SET T1=1221.34 WHERE T1='2021-01-21';
ERROR 22007: Incorrect datetime value for column 'T1' at row 1
UPDATE Z0CASE SET T1='Aa1$< >中文' WHERE T1='2021-01-21';
ERROR 22007: Incorrect datetime value for column 'T1' at row 1
UPDATE Z0CASE SET T1=b'0101101' WHERE T1='2021-01-21';
ERROR 22007: Incorrect datetime value for column 'T1' at row 1
UPDATE Z0CASE SET T1='2011-11-11' WHERE T1='2021-01-21';
UPDATE Z0CASE SET T1='2012-12-21 09:10:21' WHERE T1='2011-11-11';
SELECT table_name,column_type,COLLATION_NAME,CHARACTER_SET_NAME FROM information_schema.columns WHERE table_name='Z0CASE';
table_name	column_type	COLLATION_NAME	CHARACTER_SET_NAME
z0case	date	NULL	NULL
SHOW CREATE TABLE Z0CASE;
Table	Create Table
z0case	CREATE TABLE `z0case` (
  `T1` date DEFAULT NULL
) ORGANIZATION INDEX DEFAULT CHARSET = utf16 COLLATE = utf16_unicode_ci ROW_FORMAT = DYNAMIC COMPRESSION = 'zstd_1.3.8' REPLICA_NUM = replica_num BLOCK_SIZE = 16384 USE_BLOOM_FILTER = FALSE ENABLE_MACRO_BLOCK_BLOOM_FILTER = FALSE TABLET_SIZE = 134217728 PCTFREE = 0 WITH COLUMN GROUP(all columns, each column)
SELECT * FROM Z0CASE;
T1
2021-03-21
NULL
2012-12-21
NULL
2000-01-11
2021-10-01
2011-11-01
NULL
delete
DELETE FROM Z0CASE WHERE T1='2012-12-21';
DELETE FROM Z0CASE WHERE T1 IS NULL;
SELECT * FROM Z0CASE;
T1
2021-03-21
2000-01-11
2021-10-01
2011-11-01
TIME
DROP TABLE Z0CASE;
CREATE TABLE Z0CASE(T1 TIME) DEFAULT charset= utf8mb4 DEFAULT collate = utf8mb4_general_ci with column group (all columns, each column);
INSERT INTO Z0CASE VALUES('2020-11-21');
INSERT INTO Z0CASE VALUES('2021-01-21 11:58:39.456');
INSERT INTO Z0CASE VALUES('21:28:33.556');
INSERT INTO Z0CASE VALUES('2001');
INSERT INTO Z0CASE VALUES(NULL);
SELECT * FROM Z0CASE;
T1
00:20:20
11:58:39
21:28:34
00:20:01
NULL
SELECT table_name,column_type,COLLATION_NAME,CHARACTER_SET_NAME FROM information_schema.columns WHERE table_name='Z0CASE';
table_name	column_type	COLLATION_NAME	CHARACTER_SET_NAME
z0case	time	NULL	NULL
SHOW CREATE TABLE Z0CASE;
Table	Create Table
z0case	CREATE TABLE `z0case` (
  `T1` time DEFAULT NULL
) ORGANIZATION INDEX DEFAULT CHARSET = utf8mb4 ROW_FORMAT = DYNAMIC COMPRESSION = 'zstd_1.3.8' REPLICA_NUM = replica_num BLOCK_SIZE = 16384 USE_BLOOM_FILTER = FALSE ENABLE_MACRO_BLOCK_BLOOM_FILTER = FALSE TABLET_SIZE = 134217728 PCTFREE = 0 WITH COLUMN GROUP(all columns, each column)
ALTER TABLE Z0CASE CONVERT TO CHARACTER SET 'utf16' COLLATE 'utf16_unicode_ci';
SHOW CREATE TABLE Z0CASE;
Table	Create Table
z0case	CREATE TABLE `z0case` (
  `T1` time DEFAULT NULL
) ORGANIZATION INDEX DEFAULT CHARSET = utf16 COLLATE = utf16_unicode_ci ROW_FORMAT = DYNAMIC COMPRESSION = 'zstd_1.3.8' REPLICA_NUM = replica_num BLOCK_SIZE = 16384 USE_BLOOM_FILTER = FALSE ENABLE_MACRO_BLOCK_BLOOM_FILTER = FALSE TABLET_SIZE = 134217728 PCTFREE = 0 WITH COLUMN GROUP(all columns, each column)
SELECT * FROM Z0CASE;
T1
00:20:20
11:58:39
21:28:34
00:20:01
NULL
insert
INSERT INTO Z0CASE VALUES(71);
ERROR 22007: Incorrect datetime value for column 'T1' at row 1
INSERT INTO Z0CASE VALUES('2001');
INSERT INTO Z0CASE VALUES('!*?< >aB12 中文');
ERROR 22007: Incorrect value
INSERT INTO Z0CASE VALUES(b'0101101');
INSERT INTO Z0CASE VALUES('2021-10-01 12:23:35.54');
INSERT INTO Z0CASE VALUES('2011-11-01');
INSERT INTO Z0CASE VALUES('22:22:35');
INSERT INTO Z0CASE VALUES(72.7476);
ERROR 22007: Incorrect datetime value for column 'T1' at row 1
INSERT INTO Z0CASE VALUES(null);
SELECT table_name,column_type,COLLATION_NAME,CHARACTER_SET_NAME FROM information_schema.columns WHERE table_name='Z0CASE';
table_name	column_type	COLLATION_NAME	CHARACTER_SET_NAME
z0case	time	NULL	NULL
SHOW CREATE TABLE Z0CASE;
Table	Create Table
z0case	CREATE TABLE `z0case` (
  `T1` time DEFAULT NULL
) ORGANIZATION INDEX DEFAULT CHARSET = utf16 COLLATE = utf16_unicode_ci ROW_FORMAT = DYNAMIC COMPRESSION = 'zstd_1.3.8' REPLICA_NUM = replica_num BLOCK_SIZE = 16384 USE_BLOOM_FILTER = FALSE ENABLE_MACRO_BLOCK_BLOOM_FILTER = FALSE TABLET_SIZE = 134217728 PCTFREE = 0 WITH COLUMN GROUP(all columns, each column)
SELECT * FROM Z0CASE;
T1
00:20:20
11:58:39
21:28:34
00:20:01
NULL
00:20:01
00:00:00
12:23:36
00:20:11
22:22:35
NULL
update
UPDATE Z0CASE SET T1=NULL WHERE T1='22:22:35';
UPDATE Z0CASE SET T1='12:31:56' WHERE T1='21:28:34';
UPDATE Z0CASE SET T1=1221.34 WHERE T1='12:31:56';
UPDATE Z0CASE SET T1='Aa1$< >中文' WHERE T1='12:31:56';
UPDATE Z0CASE SET T1=b'0101101' WHERE T1='12:31:56';
UPDATE Z0CASE SET T1='2011-11-11' WHERE T1='12:31:56';
UPDATE Z0CASE SET T1='2012-12-21 09:10:21' WHERE T1='12:31:56';
SELECT table_name,column_type,COLLATION_NAME,CHARACTER_SET_NAME FROM information_schema.columns WHERE table_name='Z0CASE';
table_name	column_type	COLLATION_NAME	CHARACTER_SET_NAME
z0case	time	NULL	NULL
SHOW CREATE TABLE Z0CASE;
Table	Create Table
z0case	CREATE TABLE `z0case` (
  `T1` time DEFAULT NULL
) ORGANIZATION INDEX DEFAULT CHARSET = utf16 COLLATE = utf16_unicode_ci ROW_FORMAT = DYNAMIC COMPRESSION = 'zstd_1.3.8' REPLICA_NUM = replica_num BLOCK_SIZE = 16384 USE_BLOOM_FILTER = FALSE ENABLE_MACRO_BLOCK_BLOOM_FILTER = FALSE TABLET_SIZE = 134217728 PCTFREE = 0 WITH COLUMN GROUP(all columns, each column)
SELECT * FROM Z0CASE;
T1
00:20:20
11:58:39
00:12:21
00:20:01
NULL
00:20:01
00:00:00
12:23:36
00:20:11
NULL
NULL
delete
DELETE FROM Z0CASE WHERE T1='09:10:21';
DELETE FROM Z0CASE WHERE T1 IS NULL;
SELECT * FROM Z0CASE;
T1
00:20:20
11:58:39
00:12:21
00:20:01
00:20:01
00:00:00
12:23:36
00:20:11
general_list_update  utf8mb4/utf8mb4_general_ci --> gb18030/gb18030_chinese_ci
char
DROP TABLE Z0CASE;
CREATE TABLE Z0CASE(T1 CHAR(50)) DEFAULT charset= utf8mb4 DEFAULT collate = utf8mb4_general_ci with column group (all columns, each column);
INSERT INTO Z0CASE VALUES(123);
INSERT INTO Z0CASE VALUES('%^&*[];//\\');
INSERT INTO Z0CASE VALUES(NULL);
INSERT INTO Z0CASE VALUES('abc');
INSERT INTO Z0CASE VALUES('中文');
SELECT * FROM Z0CASE;
T1
123
%^&*[];//\
NULL
abc
中文
SELECT table_name,column_type,COLLATION_NAME,CHARACTER_SET_NAME FROM information_schema.columns WHERE table_name='Z0CASE';
table_name	column_type	COLLATION_NAME	CHARACTER_SET_NAME
z0case	char(50)	utf8mb4_general_ci	utf8mb4
SHOW CREATE TABLE Z0CASE;
Table	Create Table
z0case	CREATE TABLE `z0case` (
  `T1` char(50) DEFAULT NULL
) ORGANIZATION INDEX DEFAULT CHARSET = utf8mb4 ROW_FORMAT = DYNAMIC COMPRESSION = 'zstd_1.3.8' REPLICA_NUM = replica_num BLOCK_SIZE = 16384 USE_BLOOM_FILTER = FALSE ENABLE_MACRO_BLOCK_BLOOM_FILTER = FALSE TABLET_SIZE = 134217728 PCTFREE = 0 WITH COLUMN GROUP(all columns, each column)
ALTER TABLE Z0CASE CONVERT TO CHARACTER SET 'gb18030' COLLATE 'gb18030_chinese_ci';
SHOW CREATE TABLE Z0CASE;
Table	Create Table
z0case	CREATE TABLE `z0case` (
  `T1` char(50) DEFAULT NULL
) ORGANIZATION INDEX DEFAULT CHARSET = gb18030 ROW_FORMAT = DYNAMIC COMPRESSION = 'zstd_1.3.8' REPLICA_NUM = replica_num BLOCK_SIZE = 16384 USE_BLOOM_FILTER = FALSE ENABLE_MACRO_BLOCK_BLOOM_FILTER = FALSE TABLET_SIZE = 134217728 PCTFREE = 0 WITH COLUMN GROUP(all columns, each column)
SELECT * FROM Z0CASE;
T1
123
%^&*[];//\
NULL
abc
中文
insert
INSERT INTO Z0CASE VALUES(111);
INSERT INTO Z0CASE VALUES('2001');
INSERT INTO Z0CASE VALUES('!*?< >aB12 中文');
INSERT INTO Z0CASE VALUES(b'0101101');
INSERT INTO Z0CASE VALUES('2021-10-01 12:23:35.54');
INSERT INTO Z0CASE VALUES('2011-11-01');
INSERT INTO Z0CASE VALUES('22:22:35');
INSERT INTO Z0CASE VALUES(12.345);
INSERT INTO Z0CASE VALUES(null);
SELECT table_name,column_type,COLLATION_NAME,CHARACTER_SET_NAME FROM information_schema.columns WHERE table_name='Z0CASE';
table_name	column_type	COLLATION_NAME	CHARACTER_SET_NAME
z0case	char(50)	gb18030_chinese_ci	gb18030
SHOW CREATE TABLE Z0CASE;
Table	Create Table
z0case	CREATE TABLE `z0case` (
  `T1` char(50) DEFAULT NULL
) ORGANIZATION INDEX DEFAULT CHARSET = gb18030 ROW_FORMAT = DYNAMIC COMPRESSION = 'zstd_1.3.8' REPLICA_NUM = replica_num BLOCK_SIZE = 16384 USE_BLOOM_FILTER = FALSE ENABLE_MACRO_BLOCK_BLOOM_FILTER = FALSE TABLET_SIZE = 134217728 PCTFREE = 0 WITH COLUMN GROUP(all columns, each column)
SELECT * FROM Z0CASE;
T1
123
%^&*[];//\
NULL
abc
中文
111
2001
!*?< >aB12 中文
-
2021-10-01 12:23:35.54
2011-11-01
22:22:35
12.345
NULL
update
UPDATE Z0CASE SET T1=NULL WHERE T1='111';
UPDATE Z0CASE SET T1='12:31:56' WHERE T1=2001;
ERROR 22007: Truncated incorrect DECIMAL value: '%^&*[];//\'
UPDATE Z0CASE SET T1=1221.34 WHERE T1='2011-11-01';
UPDATE Z0CASE SET T1='Aa1$< >中文' WHERE T1='12.345';
UPDATE Z0CASE SET T1=b'0101101' WHERE T1='abc';
SELECT table_name,column_type,COLLATION_NAME,CHARACTER_SET_NAME FROM information_schema.columns WHERE table_name='Z0CASE';
table_name	column_type	COLLATION_NAME	CHARACTER_SET_NAME
z0case	char(50)	gb18030_chinese_ci	gb18030
SHOW CREATE TABLE Z0CASE;
Table	Create Table
z0case	CREATE TABLE `z0case` (
  `T1` char(50) DEFAULT NULL
) ORGANIZATION INDEX DEFAULT CHARSET = gb18030 ROW_FORMAT = DYNAMIC COMPRESSION = 'zstd_1.3.8' REPLICA_NUM = replica_num BLOCK_SIZE = 16384 USE_BLOOM_FILTER = FALSE ENABLE_MACRO_BLOCK_BLOOM_FILTER = FALSE TABLET_SIZE = 134217728 PCTFREE = 0 WITH COLUMN GROUP(all columns, each column)
SELECT * FROM Z0CASE;
T1
123
%^&*[];//\
NULL
-
中文
NULL
2001
!*?< >aB12 中文
-
2021-10-01 12:23:35.54
1221.34
22:22:35
Aa1$< >中文
NULL
delete
DELETE FROM Z0CASE WHERE T1=1221.34;
ERROR 22007: Truncated incorrect DECIMAL value: '%^&*[];//\'
DELETE FROM Z0CASE WHERE T1='2021-10-01 12:23:35.54';
DELETE FROM Z0CASE WHERE T1 IS NULL;
DELETE FROM Z0CASE WHERE T1=b'0101101';
SELECT * FROM Z0CASE;
T1
123
%^&*[];//\
中文
2001
!*?< >aB12 中文
1221.34
22:22:35
Aa1$< >中文
varchar
DROP TABLE Z0CASE;
CREATE TABLE Z0CASE(T1 VARCHAR(50)) DEFAULT charset= utf8mb4 DEFAULT collate = utf8mb4_general_ci with column group (all columns, each column);
INSERT INTO Z0CASE VALUES(123);
INSERT INTO Z0CASE VALUES('%^&*[];//\\');
INSERT INTO Z0CASE VALUES(NULL);
INSERT INTO Z0CASE VALUES('abc');
INSERT INTO Z0CASE VALUES('中文');
SELECT * FROM Z0CASE;
T1
123
%^&*[];//\
NULL
abc
中文
SELECT table_name,column_type,COLLATION_NAME,CHARACTER_SET_NAME FROM information_schema.columns WHERE table_name='Z0CASE';
table_name	column_type	COLLATION_NAME	CHARACTER_SET_NAME
z0case	varchar(50)	utf8mb4_general_ci	utf8mb4
SHOW CREATE TABLE Z0CASE;
Table	Create Table
z0case	CREATE TABLE `z0case` (
  `T1` varchar(50) DEFAULT NULL
) ORGANIZATION INDEX DEFAULT CHARSET = utf8mb4 ROW_FORMAT = DYNAMIC COMPRESSION = 'zstd_1.3.8' REPLICA_NUM = replica_num BLOCK_SIZE = 16384 USE_BLOOM_FILTER = FALSE ENABLE_MACRO_BLOCK_BLOOM_FILTER = FALSE TABLET_SIZE = 134217728 PCTFREE = 0 WITH COLUMN GROUP(all columns, each column)
ALTER TABLE Z0CASE CONVERT TO CHARACTER SET 'gb18030' COLLATE 'gb18030_chinese_ci';
SHOW CREATE TABLE Z0CASE;
Table	Create Table
z0case	CREATE TABLE `z0case` (
  `T1` varchar(50) DEFAULT NULL
) ORGANIZATION INDEX DEFAULT CHARSET = gb18030 ROW_FORMAT = DYNAMIC COMPRESSION = 'zstd_1.3.8' REPLICA_NUM = replica_num BLOCK_SIZE = 16384 USE_BLOOM_FILTER = FALSE ENABLE_MACRO_BLOCK_BLOOM_FILTER = FALSE TABLET_SIZE = 134217728 PCTFREE = 0 WITH COLUMN GROUP(all columns, each column)
SELECT * FROM Z0CASE;
T1
123
%^&*[];//\
NULL
abc
中文
insert
INSERT INTO Z0CASE VALUES(111);
INSERT INTO Z0CASE VALUES('2001');
INSERT INTO Z0CASE VALUES('!*?< >aB12 中文');
INSERT INTO Z0CASE VALUES(b'0101101');
INSERT INTO Z0CASE VALUES('2021-10-01 12:23:35.54');
INSERT INTO Z0CASE VALUES('2011-11-01');
INSERT INTO Z0CASE VALUES('22:22:35');
INSERT INTO Z0CASE VALUES(12.345);
INSERT INTO Z0CASE VALUES(null);
SELECT table_name,column_type,COLLATION_NAME,CHARACTER_SET_NAME FROM information_schema.columns WHERE table_name='Z0CASE';
table_name	column_type	COLLATION_NAME	CHARACTER_SET_NAME
z0case	varchar(50)	gb18030_chinese_ci	gb18030
SHOW CREATE TABLE Z0CASE;
Table	Create Table
z0case	CREATE TABLE `z0case` (
  `T1` varchar(50) DEFAULT NULL
) ORGANIZATION INDEX DEFAULT CHARSET = gb18030 ROW_FORMAT = DYNAMIC COMPRESSION = 'zstd_1.3.8' REPLICA_NUM = replica_num BLOCK_SIZE = 16384 USE_BLOOM_FILTER = FALSE ENABLE_MACRO_BLOCK_BLOOM_FILTER = FALSE TABLET_SIZE = 134217728 PCTFREE = 0 WITH COLUMN GROUP(all columns, each column)
SELECT * FROM Z0CASE;
T1
123
%^&*[];//\
NULL
abc
中文
111
2001
!*?< >aB12 中文
-
2021-10-01 12:23:35.54
2011-11-01
22:22:35
12.345
NULL
update
UPDATE Z0CASE SET T1=NULL WHERE T1='111';
UPDATE Z0CASE SET T1='12:31:56' WHERE T1=2001;
ERROR 22007: Truncated incorrect DECIMAL value: '%^&*[];//\'
UPDATE Z0CASE SET T1=1221.34 WHERE T1='2011-11-01';
UPDATE Z0CASE SET T1='Aa1$< >中文' WHERE T1='12.345';
UPDATE Z0CASE SET T1=b'0101101' WHERE T1='abc';
SELECT table_name,column_type,COLLATION_NAME,CHARACTER_SET_NAME FROM information_schema.columns WHERE table_name='Z0CASE';
table_name	column_type	COLLATION_NAME	CHARACTER_SET_NAME
z0case	varchar(50)	gb18030_chinese_ci	gb18030
SHOW CREATE TABLE Z0CASE;
Table	Create Table
z0case	CREATE TABLE `z0case` (
  `T1` varchar(50) DEFAULT NULL
) ORGANIZATION INDEX DEFAULT CHARSET = gb18030 ROW_FORMAT = DYNAMIC COMPRESSION = 'zstd_1.3.8' REPLICA_NUM = replica_num BLOCK_SIZE = 16384 USE_BLOOM_FILTER = FALSE ENABLE_MACRO_BLOCK_BLOOM_FILTER = FALSE TABLET_SIZE = 134217728 PCTFREE = 0 WITH COLUMN GROUP(all columns, each column)
SELECT * FROM Z0CASE;
T1
123
%^&*[];//\
NULL
-
中文
NULL
2001
!*?< >aB12 中文
-
2021-10-01 12:23:35.54
1221.34
22:22:35
Aa1$< >中文
NULL
delete
DELETE FROM Z0CASE WHERE T1=1221.34;
ERROR 22007: Truncated incorrect DECIMAL value: '%^&*[];//\'
DELETE FROM Z0CASE WHERE T1='2021-10-01 12:23:35.54';
DELETE FROM Z0CASE WHERE T1 IS NULL;
DELETE FROM Z0CASE WHERE T1=b'0101101';
SELECT * FROM Z0CASE;
T1
123
%^&*[];//\
中文
2001
!*?< >aB12 中文
1221.34
22:22:35
Aa1$< >中文
TEXT
DROP TABLE Z0CASE;
CREATE TABLE Z0CASE(T1 TEXT) DEFAULT charset= utf8mb4 DEFAULT collate = utf8mb4_general_ci with column group (all columns, each column);
INSERT INTO Z0CASE VALUES(123);
INSERT INTO Z0CASE VALUES('%^&*[];//\\');
INSERT INTO Z0CASE VALUES(NULL);
INSERT INTO Z0CASE VALUES('abc');
INSERT INTO Z0CASE VALUES('中文');
SELECT * FROM Z0CASE;
T1
123
%^&*[];//\
NULL
abc
中文
SELECT table_name,column_type,COLLATION_NAME,CHARACTER_SET_NAME FROM information_schema.columns WHERE table_name='Z0CASE';
table_name	column_type	COLLATION_NAME	CHARACTER_SET_NAME
z0case	text	utf8mb4_general_ci	utf8mb4
SHOW CREATE TABLE Z0CASE;
Table	Create Table
z0case	CREATE TABLE `z0case` (
  `T1` text DEFAULT NULL
) ORGANIZATION INDEX DEFAULT CHARSET = utf8mb4 ROW_FORMAT = DYNAMIC COMPRESSION = 'zstd_1.3.8' REPLICA_NUM = replica_num BLOCK_SIZE = 16384 USE_BLOOM_FILTER = FALSE ENABLE_MACRO_BLOCK_BLOOM_FILTER = FALSE TABLET_SIZE = 134217728 PCTFREE = 0 WITH COLUMN GROUP(all columns, each column)
ALTER TABLE Z0CASE CONVERT TO CHARACTER SET 'gb18030' COLLATE 'gb18030_chinese_ci';
SHOW CREATE TABLE Z0CASE;
Table	Create Table
z0case	CREATE TABLE `z0case` (
  `T1` text DEFAULT NULL
) ORGANIZATION INDEX DEFAULT CHARSET = gb18030 ROW_FORMAT = DYNAMIC COMPRESSION = 'zstd_1.3.8' REPLICA_NUM = replica_num BLOCK_SIZE = 16384 USE_BLOOM_FILTER = FALSE ENABLE_MACRO_BLOCK_BLOOM_FILTER = FALSE TABLET_SIZE = 134217728 PCTFREE = 0 WITH COLUMN GROUP(all columns, each column)
SELECT * FROM Z0CASE;
T1
123
%^&*[];//\
NULL
abc
中文
insert
INSERT INTO Z0CASE VALUES(111);
INSERT INTO Z0CASE VALUES('2001');
INSERT INTO Z0CASE VALUES('!*?< >aB12 中文');
INSERT INTO Z0CASE VALUES(b'0101101');
INSERT INTO Z0CASE VALUES('2021-10-01 12:23:35.54');
INSERT INTO Z0CASE VALUES('2011-11-01');
INSERT INTO Z0CASE VALUES('22:22:35');
INSERT INTO Z0CASE VALUES(12.345);
INSERT INTO Z0CASE VALUES(null);
SELECT table_name,column_type,COLLATION_NAME,CHARACTER_SET_NAME FROM information_schema.columns WHERE table_name='Z0CASE';
table_name	column_type	COLLATION_NAME	CHARACTER_SET_NAME
z0case	text	gb18030_chinese_ci	gb18030
SHOW CREATE TABLE Z0CASE;
Table	Create Table
z0case	CREATE TABLE `z0case` (
  `T1` text DEFAULT NULL
) ORGANIZATION INDEX DEFAULT CHARSET = gb18030 ROW_FORMAT = DYNAMIC COMPRESSION = 'zstd_1.3.8' REPLICA_NUM = replica_num BLOCK_SIZE = 16384 USE_BLOOM_FILTER = FALSE ENABLE_MACRO_BLOCK_BLOOM_FILTER = FALSE TABLET_SIZE = 134217728 PCTFREE = 0 WITH COLUMN GROUP(all columns, each column)
SELECT * FROM Z0CASE;
T1
123
%^&*[];//\
NULL
abc
中文
111
2001
!*?< >aB12 中文
-
2021-10-01 12:23:35.54
2011-11-01
22:22:35
12.345
NULL
update
UPDATE Z0CASE SET T1=NULL WHERE T1='111';
UPDATE Z0CASE SET T1='12:31:56' WHERE T1=2001;
ERROR 22007: Truncated incorrect DECIMAL value: '%^&*[];//\'
UPDATE Z0CASE SET T1=1221.34 WHERE T1='2011-11-01';
UPDATE Z0CASE SET T1='Aa1$< >中文' WHERE T1='12.345';
UPDATE Z0CASE SET T1=b'0101101' WHERE T1='abc';
SELECT table_name,column_type,COLLATION_NAME,CHARACTER_SET_NAME FROM information_schema.columns WHERE table_name='Z0CASE';
table_name	column_type	COLLATION_NAME	CHARACTER_SET_NAME
z0case	text	gb18030_chinese_ci	gb18030
SHOW CREATE TABLE Z0CASE;
Table	Create Table
z0case	CREATE TABLE `z0case` (
  `T1` text DEFAULT NULL
) ORGANIZATION INDEX DEFAULT CHARSET = gb18030 ROW_FORMAT = DYNAMIC COMPRESSION = 'zstd_1.3.8' REPLICA_NUM = replica_num BLOCK_SIZE = 16384 USE_BLOOM_FILTER = FALSE ENABLE_MACRO_BLOCK_BLOOM_FILTER = FALSE TABLET_SIZE = 134217728 PCTFREE = 0 WITH COLUMN GROUP(all columns, each column)
SELECT * FROM Z0CASE;
T1
123
%^&*[];//\
NULL
-
中文
NULL
2001
!*?< >aB12 中文
-
2021-10-01 12:23:35.54
1221.34
22:22:35
Aa1$< >中文
NULL
delete
DELETE FROM Z0CASE WHERE T1=1221.34;
ERROR 22007: Truncated incorrect DECIMAL value: '%^&*[];//\'
DELETE FROM Z0CASE WHERE T1='2021-10-01 12:23:35.54';
DELETE FROM Z0CASE WHERE T1 IS NULL;
DELETE FROM Z0CASE WHERE T1=b'0101101';
SELECT * FROM Z0CASE;
T1
123
%^&*[];//\
中文
2001
!*?< >aB12 中文
1221.34
22:22:35
Aa1$< >中文
LONGTEXT
DROP TABLE Z0CASE;
CREATE TABLE Z0CASE(T1 LONGTEXT) DEFAULT charset= utf8mb4 DEFAULT collate = utf8mb4_general_ci with column group (all columns, each column);
INSERT INTO Z0CASE VALUES(123);
INSERT INTO Z0CASE VALUES('%^&*[];//\\');
INSERT INTO Z0CASE VALUES(NULL);
INSERT INTO Z0CASE VALUES('abc');
INSERT INTO Z0CASE VALUES('中文');
SELECT * FROM Z0CASE;
T1
123
%^&*[];//\
NULL
abc
中文
SELECT table_name,column_type,COLLATION_NAME,CHARACTER_SET_NAME FROM information_schema.columns WHERE table_name='Z0CASE';
table_name	column_type	COLLATION_NAME	CHARACTER_SET_NAME
z0case	longtext	utf8mb4_general_ci	utf8mb4
SHOW CREATE TABLE Z0CASE;
Table	Create Table
z0case	CREATE TABLE `z0case` (
  `T1` longtext DEFAULT NULL
) ORGANIZATION INDEX DEFAULT CHARSET = utf8mb4 ROW_FORMAT = DYNAMIC COMPRESSION = 'zstd_1.3.8' REPLICA_NUM = replica_num BLOCK_SIZE = 16384 USE_BLOOM_FILTER = FALSE ENABLE_MACRO_BLOCK_BLOOM_FILTER = FALSE TABLET_SIZE = 134217728 PCTFREE = 0 WITH COLUMN GROUP(all columns, each column)
ALTER TABLE Z0CASE CONVERT TO CHARACTER SET 'gb18030' COLLATE 'gb18030_chinese_ci';
SHOW CREATE TABLE Z0CASE;
Table	Create Table
z0case	CREATE TABLE `z0case` (
  `T1` longtext DEFAULT NULL
) ORGANIZATION INDEX DEFAULT CHARSET = gb18030 ROW_FORMAT = DYNAMIC COMPRESSION = 'zstd_1.3.8' REPLICA_NUM = replica_num BLOCK_SIZE = 16384 USE_BLOOM_FILTER = FALSE ENABLE_MACRO_BLOCK_BLOOM_FILTER = FALSE TABLET_SIZE = 134217728 PCTFREE = 0 WITH COLUMN GROUP(all columns, each column)
SELECT * FROM Z0CASE;
T1
123
%^&*[];//\
NULL
abc
中文
insert
INSERT INTO Z0CASE VALUES(111);
INSERT INTO Z0CASE VALUES('2001');
INSERT INTO Z0CASE VALUES('!*?< >aB12 中文');
INSERT INTO Z0CASE VALUES(b'0101101');
INSERT INTO Z0CASE VALUES('2021-10-01 12:23:35.54');
INSERT INTO Z0CASE VALUES('2011-11-01');
INSERT INTO Z0CASE VALUES('22:22:35');
INSERT INTO Z0CASE VALUES(12.345);
INSERT INTO Z0CASE VALUES(null);
SELECT table_name,column_type,COLLATION_NAME,CHARACTER_SET_NAME FROM information_schema.columns WHERE table_name='Z0CASE';
table_name	column_type	COLLATION_NAME	CHARACTER_SET_NAME
z0case	longtext	gb18030_chinese_ci	gb18030
SHOW CREATE TABLE Z0CASE;
Table	Create Table
z0case	CREATE TABLE `z0case` (
  `T1` longtext DEFAULT NULL
) ORGANIZATION INDEX DEFAULT CHARSET = gb18030 ROW_FORMAT = DYNAMIC COMPRESSION = 'zstd_1.3.8' REPLICA_NUM = replica_num BLOCK_SIZE = 16384 USE_BLOOM_FILTER = FALSE ENABLE_MACRO_BLOCK_BLOOM_FILTER = FALSE TABLET_SIZE = 134217728 PCTFREE = 0 WITH COLUMN GROUP(all columns, each column)
SELECT * FROM Z0CASE;
T1
123
%^&*[];//\
NULL
abc
中文
111
2001
!*?< >aB12 中文
-
2021-10-01 12:23:35.54
2011-11-01
22:22:35
12.345
NULL
update
UPDATE Z0CASE SET T1=NULL WHERE T1='111';
UPDATE Z0CASE SET T1='12:31:56' WHERE T1=2001;
ERROR 22007: Truncated incorrect DECIMAL value: '%^&*[];//\'
UPDATE Z0CASE SET T1=1221.34 WHERE T1='2011-11-01';
UPDATE Z0CASE SET T1='Aa1$< >中文' WHERE T1='12.345';
UPDATE Z0CASE SET T1=b'0101101' WHERE T1='abc';
SELECT table_name,column_type,COLLATION_NAME,CHARACTER_SET_NAME FROM information_schema.columns WHERE table_name='Z0CASE';
table_name	column_type	COLLATION_NAME	CHARACTER_SET_NAME
z0case	longtext	gb18030_chinese_ci	gb18030
SHOW CREATE TABLE Z0CASE;
Table	Create Table
z0case	CREATE TABLE `z0case` (
  `T1` longtext DEFAULT NULL
) ORGANIZATION INDEX DEFAULT CHARSET = gb18030 ROW_FORMAT = DYNAMIC COMPRESSION = 'zstd_1.3.8' REPLICA_NUM = replica_num BLOCK_SIZE = 16384 USE_BLOOM_FILTER = FALSE ENABLE_MACRO_BLOCK_BLOOM_FILTER = FALSE TABLET_SIZE = 134217728 PCTFREE = 0 WITH COLUMN GROUP(all columns, each column)
SELECT * FROM Z0CASE;
T1
123
%^&*[];//\
NULL
-
中文
NULL
2001
!*?< >aB12 中文
-
2021-10-01 12:23:35.54
1221.34
22:22:35
Aa1$< >中文
NULL
delete
DELETE FROM Z0CASE WHERE T1=1221.34;
ERROR 22007: Truncated incorrect DECIMAL value: '%^&*[];//\'
DELETE FROM Z0CASE WHERE T1='2021-10-01 12:23:35.54';
DELETE FROM Z0CASE WHERE T1 IS NULL;
DELETE FROM Z0CASE WHERE T1=b'0101101';
SELECT * FROM Z0CASE;
T1
123
%^&*[];//\
中文
2001
!*?< >aB12 中文
1221.34
22:22:35
Aa1$< >中文
BLOB
DROP TABLE Z0CASE;
CREATE TABLE Z0CASE(T1 BLOB) DEFAULT charset= utf8mb4 DEFAULT collate = utf8mb4_general_ci with column group (all columns, each column);
INSERT INTO Z0CASE VALUES(123);
INSERT INTO Z0CASE VALUES('%^&*[];//\\');
INSERT INTO Z0CASE VALUES(NULL);
INSERT INTO Z0CASE VALUES('abc');
INSERT INTO Z0CASE VALUES('中文');
SELECT * FROM Z0CASE;
T1
123
%^&*[];//\
NULL
abc
中文
SELECT table_name,column_type,COLLATION_NAME,CHARACTER_SET_NAME FROM information_schema.columns WHERE table_name='Z0CASE';
table_name	column_type	COLLATION_NAME	CHARACTER_SET_NAME
z0case	blob	NULL	NULL
SHOW CREATE TABLE Z0CASE;
Table	Create Table
z0case	CREATE TABLE `z0case` (
  `T1` blob DEFAULT NULL
) ORGANIZATION INDEX DEFAULT CHARSET = utf8mb4 ROW_FORMAT = DYNAMIC COMPRESSION = 'zstd_1.3.8' REPLICA_NUM = replica_num BLOCK_SIZE = 16384 USE_BLOOM_FILTER = FALSE ENABLE_MACRO_BLOCK_BLOOM_FILTER = FALSE TABLET_SIZE = 134217728 PCTFREE = 0 WITH COLUMN GROUP(all columns, each column)
ALTER TABLE Z0CASE CONVERT TO CHARACTER SET 'gb18030' COLLATE 'gb18030_chinese_ci';
SHOW CREATE TABLE Z0CASE;
Table	Create Table
z0case	CREATE TABLE `z0case` (
  `T1` blob DEFAULT NULL
) ORGANIZATION INDEX DEFAULT CHARSET = gb18030 ROW_FORMAT = DYNAMIC COMPRESSION = 'zstd_1.3.8' REPLICA_NUM = replica_num BLOCK_SIZE = 16384 USE_BLOOM_FILTER = FALSE ENABLE_MACRO_BLOCK_BLOOM_FILTER = FALSE TABLET_SIZE = 134217728 PCTFREE = 0 WITH COLUMN GROUP(all columns, each column)
SELECT * FROM Z0CASE;
T1
123
%^&*[];//\
NULL
abc
中文
insert
INSERT INTO Z0CASE VALUES(111);
INSERT INTO Z0CASE VALUES('2001');
INSERT INTO Z0CASE VALUES('!*?< >aB12 中文');
INSERT INTO Z0CASE VALUES(b'0101101');
INSERT INTO Z0CASE VALUES('2021-10-01 12:23:35.54');
INSERT INTO Z0CASE VALUES('2011-11-01');
INSERT INTO Z0CASE VALUES('22:22:35');
INSERT INTO Z0CASE VALUES(12.345);
INSERT INTO Z0CASE VALUES(null);
SELECT table_name,column_type,COLLATION_NAME,CHARACTER_SET_NAME FROM information_schema.columns WHERE table_name='Z0CASE';
table_name	column_type	COLLATION_NAME	CHARACTER_SET_NAME
z0case	blob	NULL	NULL
SHOW CREATE TABLE Z0CASE;
Table	Create Table
z0case	CREATE TABLE `z0case` (
  `T1` blob DEFAULT NULL
) ORGANIZATION INDEX DEFAULT CHARSET = gb18030 ROW_FORMAT = DYNAMIC COMPRESSION = 'zstd_1.3.8' REPLICA_NUM = replica_num BLOCK_SIZE = 16384 USE_BLOOM_FILTER = FALSE ENABLE_MACRO_BLOCK_BLOOM_FILTER = FALSE TABLET_SIZE = 134217728 PCTFREE = 0 WITH COLUMN GROUP(all columns, each column)
SELECT * FROM Z0CASE;
T1
123
%^&*[];//\
NULL
abc
中文
111
2001
!*?< >aB12 中文
-
2021-10-01 12:23:35.54
2011-11-01
22:22:35
12.345
NULL
update
UPDATE Z0CASE SET T1=NULL WHERE T1='111';
UPDATE Z0CASE SET T1='12:31:56' WHERE T1=2001;
ERROR 22007: Truncated incorrect DECIMAL value: '%^&*[];//\'
UPDATE Z0CASE SET T1=1221.34 WHERE T1='2011-11-01';
UPDATE Z0CASE SET T1='Aa1$< >中文' WHERE T1='12.345';
UPDATE Z0CASE SET T1=b'0101101' WHERE T1='abc';
SELECT table_name,column_type,COLLATION_NAME,CHARACTER_SET_NAME FROM information_schema.columns WHERE table_name='Z0CASE';
table_name	column_type	COLLATION_NAME	CHARACTER_SET_NAME
z0case	blob	NULL	NULL
SHOW CREATE TABLE Z0CASE;
Table	Create Table
z0case	CREATE TABLE `z0case` (
  `T1` blob DEFAULT NULL
) ORGANIZATION INDEX DEFAULT CHARSET = gb18030 ROW_FORMAT = DYNAMIC COMPRESSION = 'zstd_1.3.8' REPLICA_NUM = replica_num BLOCK_SIZE = 16384 USE_BLOOM_FILTER = FALSE ENABLE_MACRO_BLOCK_BLOOM_FILTER = FALSE TABLET_SIZE = 134217728 PCTFREE = 0 WITH COLUMN GROUP(all columns, each column)
SELECT * FROM Z0CASE;
T1
123
%^&*[];//\
NULL
-
中文
NULL
2001
!*?< >aB12 中文
-
2021-10-01 12:23:35.54
1221.34
22:22:35
Aa1$< >中文
NULL
delete
DELETE FROM Z0CASE WHERE T1=1221.34;
ERROR 22007: Truncated incorrect DECIMAL value: '%^&*[];//\'
DELETE FROM Z0CASE WHERE T1='2021-10-01 12:23:35.54';
DELETE FROM Z0CASE WHERE T1 IS NULL;
DELETE FROM Z0CASE WHERE T1=b'0101101';
SELECT * FROM Z0CASE;
T1
123
%^&*[];//\
中文
2001
!*?< >aB12 中文
1221.34
22:22:35
Aa1$< >中文
BINARY
DROP TABLE Z0CASE;
CREATE TABLE Z0CASE(T1 BINARY(50)) DEFAULT charset= utf8mb4 DEFAULT collate = utf8mb4_general_ci with column group (all columns, each column);
INSERT INTO Z0CASE VALUES(123);
INSERT INTO Z0CASE VALUES('%^&*[];//\\');
INSERT INTO Z0CASE VALUES(NULL);
INSERT INTO Z0CASE VALUES('abc');
INSERT INTO Z0CASE VALUES('中文');
SELECT * FROM Z0CASE;
T1
123                                               
%^&*[];//\                                        
NULL
abc                                               
中文                                            
SELECT table_name,column_type,COLLATION_NAME,CHARACTER_SET_NAME FROM information_schema.columns WHERE table_name='Z0CASE';
table_name	column_type	COLLATION_NAME	CHARACTER_SET_NAME
z0case	binary(50)	NULL	NULL
SHOW CREATE TABLE Z0CASE;
Table	Create Table
z0case	CREATE TABLE `z0case` (
  `T1` binary(50) DEFAULT NULL
) ORGANIZATION INDEX DEFAULT CHARSET = utf8mb4 ROW_FORMAT = DYNAMIC COMPRESSION = 'zstd_1.3.8' REPLICA_NUM = replica_num BLOCK_SIZE = 16384 USE_BLOOM_FILTER = FALSE ENABLE_MACRO_BLOCK_BLOOM_FILTER = FALSE TABLET_SIZE = 134217728 PCTFREE = 0 WITH COLUMN GROUP(all columns, each column)
ALTER TABLE Z0CASE CONVERT TO CHARACTER SET 'gb18030' COLLATE 'gb18030_chinese_ci';
SHOW CREATE TABLE Z0CASE;
Table	Create Table
z0case	CREATE TABLE `z0case` (
  `T1` binary(50) DEFAULT NULL
) ORGANIZATION INDEX DEFAULT CHARSET = gb18030 ROW_FORMAT = DYNAMIC COMPRESSION = 'zstd_1.3.8' REPLICA_NUM = replica_num BLOCK_SIZE = 16384 USE_BLOOM_FILTER = FALSE ENABLE_MACRO_BLOCK_BLOOM_FILTER = FALSE TABLET_SIZE = 134217728 PCTFREE = 0 WITH COLUMN GROUP(all columns, each column)
SELECT * FROM Z0CASE;
T1
123                                               
%^&*[];//\                                        
NULL
abc                                               
中文                                            
insert
INSERT INTO Z0CASE VALUES(111);
INSERT INTO Z0CASE VALUES('2001');
INSERT INTO Z0CASE VALUES('!*?< >aB12 中文');
INSERT INTO Z0CASE VALUES(b'0101101');
INSERT INTO Z0CASE VALUES('2021-10-01 12:23:35.54');
INSERT INTO Z0CASE VALUES('2011-11-01');
INSERT INTO Z0CASE VALUES('22:22:35');
INSERT INTO Z0CASE VALUES(12.345);
INSERT INTO Z0CASE VALUES(null);
SELECT table_name,column_type,COLLATION_NAME,CHARACTER_SET_NAME FROM information_schema.columns WHERE table_name='Z0CASE';
table_name	column_type	COLLATION_NAME	CHARACTER_SET_NAME
z0case	binary(50)	NULL	NULL
SHOW CREATE TABLE Z0CASE;
Table	Create Table
z0case	CREATE TABLE `z0case` (
  `T1` binary(50) DEFAULT NULL
) ORGANIZATION INDEX DEFAULT CHARSET = gb18030 ROW_FORMAT = DYNAMIC COMPRESSION = 'zstd_1.3.8' REPLICA_NUM = replica_num BLOCK_SIZE = 16384 USE_BLOOM_FILTER = FALSE ENABLE_MACRO_BLOCK_BLOOM_FILTER = FALSE TABLET_SIZE = 134217728 PCTFREE = 0 WITH COLUMN GROUP(all columns, each column)
SELECT * FROM Z0CASE;
T1
123                                               
%^&*[];//\                                        
NULL
abc                                               
中文                                            
111                                               
2001                                              
!*?< >aB12 中文                                 
-                                                 
2021-10-01 12:23:35.54                            
2011-11-01                                        
22:22:35                                          
12.345                                            
NULL
update
UPDATE Z0CASE SET T1=NULL WHERE T1='111';
UPDATE Z0CASE SET T1='12:31:56' WHERE T1=2001;
ERROR 22007: Truncated incorrect DECIMAL value: '123'
UPDATE Z0CASE SET T1=1221.34 WHERE T1='2011-11-01';
UPDATE Z0CASE SET T1='Aa1$< >中文' WHERE T1='12.345';
UPDATE Z0CASE SET T1=b'0101101' WHERE T1='abc';
SELECT table_name,column_type,COLLATION_NAME,CHARACTER_SET_NAME FROM information_schema.columns WHERE table_name='Z0CASE';
table_name	column_type	COLLATION_NAME	CHARACTER_SET_NAME
z0case	binary(50)	NULL	NULL
SHOW CREATE TABLE Z0CASE;
Table	Create Table
z0case	CREATE TABLE `z0case` (
  `T1` binary(50) DEFAULT NULL
) ORGANIZATION INDEX DEFAULT CHARSET = gb18030 ROW_FORMAT = DYNAMIC COMPRESSION = 'zstd_1.3.8' REPLICA_NUM = replica_num BLOCK_SIZE = 16384 USE_BLOOM_FILTER = FALSE ENABLE_MACRO_BLOCK_BLOOM_FILTER = FALSE TABLET_SIZE = 134217728 PCTFREE = 0 WITH COLUMN GROUP(all columns, each column)
SELECT * FROM Z0CASE;
T1
123                                               
%^&*[];//\                                        
NULL
abc                                               
中文                                            
111                                               
2001                                              
!*?< >aB12 中文                                 
-                                                 
2021-10-01 12:23:35.54                            
2011-11-01                                        
22:22:35                                          
12.345                                            
NULL
delete
DELETE FROM Z0CASE WHERE T1=1221.34;
ERROR 22007: Truncated incorrect DECIMAL value: '123'
DELETE FROM Z0CASE WHERE T1='2021-10-01 12:23:35.54';
DELETE FROM Z0CASE WHERE T1 IS NULL;
DELETE FROM Z0CASE WHERE T1=b'0101101';
SELECT * FROM Z0CASE;
T1
123                                               
%^&*[];//\                                        
abc                                               
中文                                            
111                                               
2001                                              
!*?< >aB12 中文                                 
-                                                 
2021-10-01 12:23:35.54                            
2011-11-01                                        
22:22:35                                          
12.345                                            
ENUM
DROP TABLE Z0CASE;
CREATE TABLE Z0CASE(T1 ENUM('123','abc','中文','%^&*[];//\\','111','2021-10-01 12:23:35.54','2011-11-01','12.345',b'0101101')) DEFAULT charset= utf8mb4 DEFAULT collate = utf8mb4_general_ci with column group (all columns, each column);
INSERT INTO Z0CASE VALUES('123');
INSERT INTO Z0CASE VALUES('%^&*[];//\\');
INSERT INTO Z0CASE VALUES(NULL);
INSERT INTO Z0CASE VALUES('abc');
INSERT INTO Z0CASE VALUES('中文');
SELECT * FROM Z0CASE;
T1
123
%^&*[];//\
NULL
abc
中文
SELECT table_name,column_type,COLLATION_NAME,CHARACTER_SET_NAME FROM information_schema.columns WHERE table_name='Z0CASE';
table_name	column_type	COLLATION_NAME	CHARACTER_SET_NAME
z0case	enum('123','abc','中文','%^&*[];//\','111','2021-10-01 12:23:35.54','2011-11-01','12.345','-')	utf8mb4_general_ci	utf8mb4
SHOW CREATE TABLE Z0CASE;
Table	Create Table
z0case	CREATE TABLE `z0case` (
  `T1` enum('123','abc','中文','%^&*[];//\','111','2021-10-01 12:23:35.54','2011-11-01','12.345','-') DEFAULT NULL
) ORGANIZATION INDEX DEFAULT CHARSET = utf8mb4 ROW_FORMAT = DYNAMIC COMPRESSION = 'zstd_1.3.8' REPLICA_NUM = replica_num BLOCK_SIZE = 16384 USE_BLOOM_FILTER = FALSE ENABLE_MACRO_BLOCK_BLOOM_FILTER = FALSE TABLET_SIZE = 134217728 PCTFREE = 0 WITH COLUMN GROUP(all columns, each column)
ALTER TABLE Z0CASE CONVERT TO CHARACTER SET 'gb18030' COLLATE 'gb18030_chinese_ci';
BIT
DROP TABLE Z0CASE;
CREATE TABLE Z0CASE(T1 BIT(20)) DEFAULT charset= utf8mb4 DEFAULT collate = utf8mb4_general_ci with column group (all columns, each column);
INSERT INTO Z0CASE VALUES(b'0101001');
INSERT INTO Z0CASE VALUES(b'111010101010100');
INSERT INTO Z0CASE VALUES(NULL);
SELECT BIN(T1) FROM Z0CASE;
BIN(T1)
101001
111010101010100
NULL
SELECT table_name,column_type,COLLATION_NAME,CHARACTER_SET_NAME FROM information_schema.columns WHERE table_name='Z0CASE';
table_name	column_type	COLLATION_NAME	CHARACTER_SET_NAME
z0case	bit(20)	NULL	NULL
SHOW CREATE TABLE Z0CASE;
Table	Create Table
z0case	CREATE TABLE `z0case` (
  `T1` bit(20) DEFAULT NULL
) ORGANIZATION INDEX DEFAULT CHARSET = utf8mb4 ROW_FORMAT = DYNAMIC COMPRESSION = 'zstd_1.3.8' REPLICA_NUM = replica_num BLOCK_SIZE = 16384 USE_BLOOM_FILTER = FALSE ENABLE_MACRO_BLOCK_BLOOM_FILTER = FALSE TABLET_SIZE = 134217728 PCTFREE = 0 WITH COLUMN GROUP(all columns, each column)
ALTER TABLE Z0CASE CONVERT TO CHARACTER SET 'gb18030' COLLATE 'gb18030_chinese_ci';
SHOW CREATE TABLE Z0CASE;
Table	Create Table
z0case	CREATE TABLE `z0case` (
  `T1` bit(20) DEFAULT NULL
) ORGANIZATION INDEX DEFAULT CHARSET = gb18030 ROW_FORMAT = DYNAMIC COMPRESSION = 'zstd_1.3.8' REPLICA_NUM = replica_num BLOCK_SIZE = 16384 USE_BLOOM_FILTER = FALSE ENABLE_MACRO_BLOCK_BLOOM_FILTER = FALSE TABLET_SIZE = 134217728 PCTFREE = 0 WITH COLUMN GROUP(all columns, each column)
SELECT BIN(T1) FROM Z0CASE;
BIN(T1)
101001
111010101010100
NULL
insert
INSERT INTO Z0CASE VALUES(111);
INSERT INTO Z0CASE VALUES(b'010110100');
INSERT INTO Z0CASE VALUES(12.345);
INSERT INTO Z0CASE VALUES(null);
SELECT BIN(T1) FROM Z0CASE;
BIN(T1)
101001
111010101010100
NULL
1101111
10110100
1100
NULL
INSERT INTO Z0CASE VALUES('2001');
ERROR 22001: Data too long for column 'T1' at row 1
INSERT INTO Z0CASE VALUES('!*?< >aB12 中文');
ERROR 22001: Data too long for column 'T1' at row 1
INSERT INTO Z0CASE VALUES('2021-10-01 12:23:35.54');
ERROR 22001: Data too long for column 'T1' at row 1
INSERT INTO Z0CASE VALUES('2011-11-01');
ERROR 22001: Data too long for column 'T1' at row 1
INSERT INTO Z0CASE VALUES('22:22:35');
ERROR 22001: Data too long for column 'T1' at row 1
SELECT table_name,column_type,COLLATION_NAME,CHARACTER_SET_NAME FROM information_schema.columns WHERE table_name='Z0CASE';
table_name	column_type	COLLATION_NAME	CHARACTER_SET_NAME
z0case	bit(20)	NULL	NULL
SHOW CREATE TABLE Z0CASE;
Table	Create Table
z0case	CREATE TABLE `z0case` (
  `T1` bit(20) DEFAULT NULL
) ORGANIZATION INDEX DEFAULT CHARSET = gb18030 ROW_FORMAT = DYNAMIC COMPRESSION = 'zstd_1.3.8' REPLICA_NUM = replica_num BLOCK_SIZE = 16384 USE_BLOOM_FILTER = FALSE ENABLE_MACRO_BLOCK_BLOOM_FILTER = FALSE TABLET_SIZE = 134217728 PCTFREE = 0 WITH COLUMN GROUP(all columns, each column)
SELECT BIN(T1) FROM Z0CASE;
BIN(T1)
101001
111010101010100
NULL
1101111
10110100
1100
NULL
update
UPDATE Z0CASE SET T1=NULL WHERE T1=b'0101001';
UPDATE Z0CASE SET T1='22:22:35' WHERE T1=b'111010101010100';
ERROR 22001: Data too long for column 'T1' at row 1
UPDATE Z0CASE SET T1=12.345 WHERE T1=b'111010101010100';
UPDATE Z0CASE SET T1=b'0101101' WHERE T1=b'111010101010100';
SELECT table_name,column_type,COLLATION_NAME,CHARACTER_SET_NAME FROM information_schema.columns WHERE table_name='Z0CASE';
table_name	column_type	COLLATION_NAME	CHARACTER_SET_NAME
z0case	bit(20)	NULL	NULL
SHOW CREATE TABLE Z0CASE;
Table	Create Table
z0case	CREATE TABLE `z0case` (
  `T1` bit(20) DEFAULT NULL
) ORGANIZATION INDEX DEFAULT CHARSET = gb18030 ROW_FORMAT = DYNAMIC COMPRESSION = 'zstd_1.3.8' REPLICA_NUM = replica_num BLOCK_SIZE = 16384 USE_BLOOM_FILTER = FALSE ENABLE_MACRO_BLOCK_BLOOM_FILTER = FALSE TABLET_SIZE = 134217728 PCTFREE = 0 WITH COLUMN GROUP(all columns, each column)
SELECT BIN(T1) FROM Z0CASE;
BIN(T1)
NULL
1100
NULL
1101111
10110100
1100
NULL
delete
DELETE FROM Z0CASE WHERE T1 IS NULL;
DELETE FROM Z0CASE WHERE T1=b'111010101010100';
SELECT BIN(T1) FROM Z0CASE;
BIN(T1)
1100
1101111
10110100
1100
INT
DROP TABLE Z0CASE;
CREATE TABLE Z0CASE(T1 INT) DEFAULT charset= utf8mb4 DEFAULT collate = utf8mb4_general_ci with column group (all columns, each column);
INSERT INTO Z0CASE VALUES(123);
INSERT INTO Z0CASE VALUES(123.3445);
INSERT INTO Z0CASE VALUES(NULL);
SELECT * FROM Z0CASE;
T1
123
123
NULL
SELECT table_name,column_type,COLLATION_NAME,CHARACTER_SET_NAME FROM information_schema.columns WHERE table_name='Z0CASE';
table_name	column_type	COLLATION_NAME	CHARACTER_SET_NAME
z0case	int(11)	NULL	NULL
SHOW CREATE TABLE Z0CASE;
Table	Create Table
z0case	CREATE TABLE `z0case` (
  `T1` int(11) DEFAULT NULL
) ORGANIZATION INDEX DEFAULT CHARSET = utf8mb4 ROW_FORMAT = DYNAMIC COMPRESSION = 'zstd_1.3.8' REPLICA_NUM = replica_num BLOCK_SIZE = 16384 USE_BLOOM_FILTER = FALSE ENABLE_MACRO_BLOCK_BLOOM_FILTER = FALSE TABLET_SIZE = 134217728 PCTFREE = 0 WITH COLUMN GROUP(all columns, each column)
ALTER TABLE Z0CASE CONVERT TO CHARACTER SET 'gb18030' COLLATE 'gb18030_chinese_ci';
SHOW CREATE TABLE Z0CASE;
Table	Create Table
z0case	CREATE TABLE `z0case` (
  `T1` int(11) DEFAULT NULL
) ORGANIZATION INDEX DEFAULT CHARSET = gb18030 ROW_FORMAT = DYNAMIC COMPRESSION = 'zstd_1.3.8' REPLICA_NUM = replica_num BLOCK_SIZE = 16384 USE_BLOOM_FILTER = FALSE ENABLE_MACRO_BLOCK_BLOOM_FILTER = FALSE TABLET_SIZE = 134217728 PCTFREE = 0 WITH COLUMN GROUP(all columns, each column)
SELECT * FROM Z0CASE;
T1
123
123
NULL
insert
INSERT INTO Z0CASE VALUES(111);
INSERT INTO Z0CASE VALUES('2001');
INSERT INTO Z0CASE VALUES('!*?< >aB12 中文');
ERROR HY000: Incorrect integer value for column 'T1' at row 1
INSERT INTO Z0CASE VALUES(b'0101101');
INSERT INTO Z0CASE VALUES('2021-10-01 12:23:35.54');
ERROR 01000: Data truncated for column 'T1' at row 1
INSERT INTO Z0CASE VALUES('2011-11-01');
ERROR 01000: Data truncated for column 'T1' at row 1
INSERT INTO Z0CASE VALUES('22:22:35');
ERROR 01000: Data truncated for column 'T1' at row 1
INSERT INTO Z0CASE VALUES(12.345);
INSERT INTO Z0CASE VALUES(null);
SELECT table_name,column_type,COLLATION_NAME,CHARACTER_SET_NAME FROM information_schema.columns WHERE table_name='Z0CASE';
table_name	column_type	COLLATION_NAME	CHARACTER_SET_NAME
z0case	int(11)	NULL	NULL
SHOW CREATE TABLE Z0CASE;
Table	Create Table
z0case	CREATE TABLE `z0case` (
  `T1` int(11) DEFAULT NULL
) ORGANIZATION INDEX DEFAULT CHARSET = gb18030 ROW_FORMAT = DYNAMIC COMPRESSION = 'zstd_1.3.8' REPLICA_NUM = replica_num BLOCK_SIZE = 16384 USE_BLOOM_FILTER = FALSE ENABLE_MACRO_BLOCK_BLOOM_FILTER = FALSE TABLET_SIZE = 134217728 PCTFREE = 0 WITH COLUMN GROUP(all columns, each column)
SELECT * FROM Z0CASE;
T1
123
123
NULL
111
2001
45
12
NULL
update
UPDATE Z0CASE SET T1=NULL WHERE T1='111';
UPDATE Z0CASE SET T1='12:31:56' WHERE T1=2001;
ERROR 01000: Data truncated for column 'T1' at row 1
UPDATE Z0CASE SET T1=1221.34 WHERE T1=2001;
UPDATE Z0CASE SET T1='Aa1$< >中文' WHERE T1='111';
UPDATE Z0CASE SET T1=b'0101101' WHERE T1=111;
SELECT table_name,column_type,COLLATION_NAME,CHARACTER_SET_NAME FROM information_schema.columns WHERE table_name='Z0CASE';
table_name	column_type	COLLATION_NAME	CHARACTER_SET_NAME
z0case	int(11)	NULL	NULL
SHOW CREATE TABLE Z0CASE;
Table	Create Table
z0case	CREATE TABLE `z0case` (
  `T1` int(11) DEFAULT NULL
) ORGANIZATION INDEX DEFAULT CHARSET = gb18030 ROW_FORMAT = DYNAMIC COMPRESSION = 'zstd_1.3.8' REPLICA_NUM = replica_num BLOCK_SIZE = 16384 USE_BLOOM_FILTER = FALSE ENABLE_MACRO_BLOCK_BLOOM_FILTER = FALSE TABLET_SIZE = 134217728 PCTFREE = 0 WITH COLUMN GROUP(all columns, each column)
SELECT * FROM Z0CASE;
T1
123
123
NULL
NULL
1221
45
12
NULL
delete
DELETE FROM Z0CASE WHERE T1=1221.34;
DELETE FROM Z0CASE WHERE T1 IS NULL;
SELECT * FROM Z0CASE;
T1
123
123
1221
45
12
FLOAT
DROP TABLE Z0CASE;
CREATE TABLE Z0CASE(T1 FLOAT(20,0)) DEFAULT charset= utf8mb4 DEFAULT collate = utf8mb4_general_ci with column group (all columns, each column);
INSERT INTO Z0CASE VALUES(123);
INSERT INTO Z0CASE VALUES('123.3445');
INSERT INTO Z0CASE VALUES(641231122123.5445);
INSERT INTO Z0CASE VALUES(NULL);
SELECT * FROM Z0CASE;
T1
123
123
641231093760
NULL
SELECT table_name,column_type,COLLATION_NAME,CHARACTER_SET_NAME FROM information_schema.columns WHERE table_name='Z0CASE';
table_name	column_type	COLLATION_NAME	CHARACTER_SET_NAME
z0case	float(20,0)	NULL	NULL
SHOW CREATE TABLE Z0CASE;
Table	Create Table
z0case	CREATE TABLE `z0case` (
  `T1` float(20,0) DEFAULT NULL
) ORGANIZATION INDEX DEFAULT CHARSET = utf8mb4 ROW_FORMAT = DYNAMIC COMPRESSION = 'zstd_1.3.8' REPLICA_NUM = replica_num BLOCK_SIZE = 16384 USE_BLOOM_FILTER = FALSE ENABLE_MACRO_BLOCK_BLOOM_FILTER = FALSE TABLET_SIZE = 134217728 PCTFREE = 0 WITH COLUMN GROUP(all columns, each column)
ALTER TABLE Z0CASE CONVERT TO CHARACTER SET 'gb18030' COLLATE 'gb18030_chinese_ci';
SHOW CREATE TABLE Z0CASE;
Table	Create Table
z0case	CREATE TABLE `z0case` (
  `T1` float(20,0) DEFAULT NULL
) ORGANIZATION INDEX DEFAULT CHARSET = gb18030 ROW_FORMAT = DYNAMIC COMPRESSION = 'zstd_1.3.8' REPLICA_NUM = replica_num BLOCK_SIZE = 16384 USE_BLOOM_FILTER = FALSE ENABLE_MACRO_BLOCK_BLOOM_FILTER = FALSE TABLET_SIZE = 134217728 PCTFREE = 0 WITH COLUMN GROUP(all columns, each column)
SELECT * FROM Z0CASE;
T1
123
123
641231093760
NULL
insert
INSERT INTO Z0CASE VALUES(111);
INSERT INTO Z0CASE VALUES('2001');
INSERT INTO Z0CASE VALUES('!*?< >aB12 中文');
ERROR 01000: Data truncated for column 'T1' at row 1
INSERT INTO Z0CASE VALUES(b'0101101');
INSERT INTO Z0CASE VALUES('2021-10-01 12:23:35.54');
ERROR 01000: Data truncated for column 'T1' at row 1
INSERT INTO Z0CASE VALUES('2011-11-01');
ERROR 01000: Data truncated for column 'T1' at row 1
INSERT INTO Z0CASE VALUES('22:22:35');
ERROR 01000: Data truncated for column 'T1' at row 1
INSERT INTO Z0CASE VALUES(12.3456);
INSERT INTO Z0CASE VALUES(null);
SELECT table_name,column_type,COLLATION_NAME,CHARACTER_SET_NAME FROM information_schema.columns WHERE table_name='Z0CASE';
table_name	column_type	COLLATION_NAME	CHARACTER_SET_NAME
z0case	float(20,0)	NULL	NULL
SHOW CREATE TABLE Z0CASE;
Table	Create Table
z0case	CREATE TABLE `z0case` (
  `T1` float(20,0) DEFAULT NULL
) ORGANIZATION INDEX DEFAULT CHARSET = gb18030 ROW_FORMAT = DYNAMIC COMPRESSION = 'zstd_1.3.8' REPLICA_NUM = replica_num BLOCK_SIZE = 16384 USE_BLOOM_FILTER = FALSE ENABLE_MACRO_BLOCK_BLOOM_FILTER = FALSE TABLET_SIZE = 134217728 PCTFREE = 0 WITH COLUMN GROUP(all columns, each column)
SELECT * FROM Z0CASE;
T1
123
123
641231093760
NULL
111
2001
45
12
NULL
update
UPDATE Z0CASE SET T1=NULL WHERE T1='111';
UPDATE Z0CASE SET T1='12:31:56' WHERE T1=2001;
ERROR 01000: Data truncated for column 'T1' at row 1
UPDATE Z0CASE SET T1=1221.34 WHERE T1=2001;
UPDATE Z0CASE SET T1='Aa1$< >中文' WHERE T1=111;
UPDATE Z0CASE SET T1=b'0101101' WHERE T1=111;
SELECT table_name,column_type,COLLATION_NAME,CHARACTER_SET_NAME FROM information_schema.columns WHERE table_name='Z0CASE';
table_name	column_type	COLLATION_NAME	CHARACTER_SET_NAME
z0case	float(20,0)	NULL	NULL
SHOW CREATE TABLE Z0CASE;
Table	Create Table
z0case	CREATE TABLE `z0case` (
  `T1` float(20,0) DEFAULT NULL
) ORGANIZATION INDEX DEFAULT CHARSET = gb18030 ROW_FORMAT = DYNAMIC COMPRESSION = 'zstd_1.3.8' REPLICA_NUM = replica_num BLOCK_SIZE = 16384 USE_BLOOM_FILTER = FALSE ENABLE_MACRO_BLOCK_BLOOM_FILTER = FALSE TABLET_SIZE = 134217728 PCTFREE = 0 WITH COLUMN GROUP(all columns, each column)
SELECT * FROM Z0CASE;
T1
123
123
641231093760
NULL
NULL
1221
45
12
NULL
delete
DELETE FROM Z0CASE WHERE T1=1221.34;
DELETE FROM Z0CASE WHERE T1 IS NULL;
SELECT * FROM Z0CASE;
T1
123
123
641231093760
1221
45
12
DATE
DROP TABLE Z0CASE;
CREATE TABLE Z0CASE(T1 DATE) DEFAULT charset= utf8mb4 DEFAULT collate = utf8mb4_general_ci with column group (all columns, each column);
INSERT INTO Z0CASE VALUES('20210321');
INSERT INTO Z0CASE VALUES('2020-11-21');
INSERT INTO Z0CASE VALUES('2021-01-21 11:58:39.456');
INSERT INTO Z0CASE VALUES(NULL);
SELECT * FROM Z0CASE;
T1
2021-03-21
2020-11-21
2021-01-21
NULL
SELECT table_name,column_type,COLLATION_NAME,CHARACTER_SET_NAME FROM information_schema.columns WHERE table_name='Z0CASE';
table_name	column_type	COLLATION_NAME	CHARACTER_SET_NAME
z0case	date	NULL	NULL
SHOW CREATE TABLE Z0CASE;
Table	Create Table
z0case	CREATE TABLE `z0case` (
  `T1` date DEFAULT NULL
) ORGANIZATION INDEX DEFAULT CHARSET = utf8mb4 ROW_FORMAT = DYNAMIC COMPRESSION = 'zstd_1.3.8' REPLICA_NUM = replica_num BLOCK_SIZE = 16384 USE_BLOOM_FILTER = FALSE ENABLE_MACRO_BLOCK_BLOOM_FILTER = FALSE TABLET_SIZE = 134217728 PCTFREE = 0 WITH COLUMN GROUP(all columns, each column)
ALTER TABLE Z0CASE CONVERT TO CHARACTER SET 'gb18030' COLLATE 'gb18030_chinese_ci';
SHOW CREATE TABLE Z0CASE;
Table	Create Table
z0case	CREATE TABLE `z0case` (
  `T1` date DEFAULT NULL
) ORGANIZATION INDEX DEFAULT CHARSET = gb18030 ROW_FORMAT = DYNAMIC COMPRESSION = 'zstd_1.3.8' REPLICA_NUM = replica_num BLOCK_SIZE = 16384 USE_BLOOM_FILTER = FALSE ENABLE_MACRO_BLOCK_BLOOM_FILTER = FALSE TABLET_SIZE = 134217728 PCTFREE = 0 WITH COLUMN GROUP(all columns, each column)
SELECT * FROM Z0CASE;
T1
2021-03-21
2020-11-21
2021-01-21
NULL
insert
INSERT INTO Z0CASE VALUES(111);
INSERT INTO Z0CASE VALUES('2001');
ERROR 22007: Incorrect datetime value for column 'T1' at row 1
INSERT INTO Z0CASE VALUES('!*?< >aB12 中文');
ERROR 22007: Incorrect datetime value for column 'T1' at row 1
INSERT INTO Z0CASE VALUES(b'0101101');
ERROR 22007: Incorrect datetime value for column 'T1' at row 1
INSERT INTO Z0CASE VALUES('2021-10-01 12:23:35.54');
INSERT INTO Z0CASE VALUES('2011-11-01');
INSERT INTO Z0CASE VALUES('22:22:35');
ERROR 22007: Incorrect datetime value for column 'T1' at row 1
INSERT INTO Z0CASE VALUES(12.3456);
ERROR 22007: Incorrect datetime value for column 'T1' at row 1
INSERT INTO Z0CASE VALUES(null);
SELECT table_name,column_type,COLLATION_NAME,CHARACTER_SET_NAME FROM information_schema.columns WHERE table_name='Z0CASE';
table_name	column_type	COLLATION_NAME	CHARACTER_SET_NAME
z0case	date	NULL	NULL
SHOW CREATE TABLE Z0CASE;
Table	Create Table
z0case	CREATE TABLE `z0case` (
  `T1` date DEFAULT NULL
) ORGANIZATION INDEX DEFAULT CHARSET = gb18030 ROW_FORMAT = DYNAMIC COMPRESSION = 'zstd_1.3.8' REPLICA_NUM = replica_num BLOCK_SIZE = 16384 USE_BLOOM_FILTER = FALSE ENABLE_MACRO_BLOCK_BLOOM_FILTER = FALSE TABLET_SIZE = 134217728 PCTFREE = 0 WITH COLUMN GROUP(all columns, each column)
SELECT * FROM Z0CASE;
T1
2021-03-21
2020-11-21
2021-01-21
NULL
2000-01-11
2021-10-01
2011-11-01
NULL
update
UPDATE Z0CASE SET T1=NULL WHERE T1='2020-11-21';
UPDATE Z0CASE SET T1='12:31:56' WHERE T1='2021-01-21';
ERROR 22007: Incorrect datetime value for column 'T1' at row 1
UPDATE Z0CASE SET T1=1221.34 WHERE T1='2021-01-21';
ERROR 22007: Incorrect datetime value for column 'T1' at row 1
UPDATE Z0CASE SET T1='Aa1$< >中文' WHERE T1='2021-01-21';
ERROR 22007: Incorrect datetime value for column 'T1' at row 1
UPDATE Z0CASE SET T1=b'0101101' WHERE T1='2021-01-21';
ERROR 22007: Incorrect datetime value for column 'T1' at row 1
UPDATE Z0CASE SET T1='2011-11-11' WHERE T1='2021-01-21';
UPDATE Z0CASE SET T1='2012-12-21 09:10:21' WHERE T1='2011-11-11';
SELECT table_name,column_type,COLLATION_NAME,CHARACTER_SET_NAME FROM information_schema.columns WHERE table_name='Z0CASE';
table_name	column_type	COLLATION_NAME	CHARACTER_SET_NAME
z0case	date	NULL	NULL
SHOW CREATE TABLE Z0CASE;
Table	Create Table
z0case	CREATE TABLE `z0case` (
  `T1` date DEFAULT NULL
) ORGANIZATION INDEX DEFAULT CHARSET = gb18030 ROW_FORMAT = DYNAMIC COMPRESSION = 'zstd_1.3.8' REPLICA_NUM = replica_num BLOCK_SIZE = 16384 USE_BLOOM_FILTER = FALSE ENABLE_MACRO_BLOCK_BLOOM_FILTER = FALSE TABLET_SIZE = 134217728 PCTFREE = 0 WITH COLUMN GROUP(all columns, each column)
SELECT * FROM Z0CASE;
T1
2021-03-21
NULL
2012-12-21
NULL
2000-01-11
2021-10-01
2011-11-01
NULL
delete
DELETE FROM Z0CASE WHERE T1='2012-12-21';
DELETE FROM Z0CASE WHERE T1 IS NULL;
SELECT * FROM Z0CASE;
T1
2021-03-21
2000-01-11
2021-10-01
2011-11-01
TIME
DROP TABLE Z0CASE;
CREATE TABLE Z0CASE(T1 TIME) DEFAULT charset= utf8mb4 DEFAULT collate = utf8mb4_general_ci with column group (all columns, each column);
INSERT INTO Z0CASE VALUES('2020-11-21');
INSERT INTO Z0CASE VALUES('2021-01-21 11:58:39.456');
INSERT INTO Z0CASE VALUES('21:28:33.556');
INSERT INTO Z0CASE VALUES('2001');
INSERT INTO Z0CASE VALUES(NULL);
SELECT * FROM Z0CASE;
T1
00:20:20
11:58:39
21:28:34
00:20:01
NULL
SELECT table_name,column_type,COLLATION_NAME,CHARACTER_SET_NAME FROM information_schema.columns WHERE table_name='Z0CASE';
table_name	column_type	COLLATION_NAME	CHARACTER_SET_NAME
z0case	time	NULL	NULL
SHOW CREATE TABLE Z0CASE;
Table	Create Table
z0case	CREATE TABLE `z0case` (
  `T1` time DEFAULT NULL
) ORGANIZATION INDEX DEFAULT CHARSET = utf8mb4 ROW_FORMAT = DYNAMIC COMPRESSION = 'zstd_1.3.8' REPLICA_NUM = replica_num BLOCK_SIZE = 16384 USE_BLOOM_FILTER = FALSE ENABLE_MACRO_BLOCK_BLOOM_FILTER = FALSE TABLET_SIZE = 134217728 PCTFREE = 0 WITH COLUMN GROUP(all columns, each column)
ALTER TABLE Z0CASE CONVERT TO CHARACTER SET 'gb18030' COLLATE 'gb18030_chinese_ci';
SHOW CREATE TABLE Z0CASE;
Table	Create Table
z0case	CREATE TABLE `z0case` (
  `T1` time DEFAULT NULL
) ORGANIZATION INDEX DEFAULT CHARSET = gb18030 ROW_FORMAT = DYNAMIC COMPRESSION = 'zstd_1.3.8' REPLICA_NUM = replica_num BLOCK_SIZE = 16384 USE_BLOOM_FILTER = FALSE ENABLE_MACRO_BLOCK_BLOOM_FILTER = FALSE TABLET_SIZE = 134217728 PCTFREE = 0 WITH COLUMN GROUP(all columns, each column)
SELECT * FROM Z0CASE;
T1
00:20:20
11:58:39
21:28:34
00:20:01
NULL
insert
INSERT INTO Z0CASE VALUES(71);
ERROR 22007: Incorrect datetime value for column 'T1' at row 1
INSERT INTO Z0CASE VALUES('2001');
INSERT INTO Z0CASE VALUES('!*?< >aB12 中文');
ERROR 22007: Incorrect value
INSERT INTO Z0CASE VALUES(b'0101101');
INSERT INTO Z0CASE VALUES('2021-10-01 12:23:35.54');
INSERT INTO Z0CASE VALUES('2011-11-01');
INSERT INTO Z0CASE VALUES('22:22:35');
INSERT INTO Z0CASE VALUES(72.7476);
ERROR 22007: Incorrect datetime value for column 'T1' at row 1
INSERT INTO Z0CASE VALUES(null);
SELECT table_name,column_type,COLLATION_NAME,CHARACTER_SET_NAME FROM information_schema.columns WHERE table_name='Z0CASE';
table_name	column_type	COLLATION_NAME	CHARACTER_SET_NAME
z0case	time	NULL	NULL
SHOW CREATE TABLE Z0CASE;
Table	Create Table
z0case	CREATE TABLE `z0case` (
  `T1` time DEFAULT NULL
) ORGANIZATION INDEX DEFAULT CHARSET = gb18030 ROW_FORMAT = DYNAMIC COMPRESSION = 'zstd_1.3.8' REPLICA_NUM = replica_num BLOCK_SIZE = 16384 USE_BLOOM_FILTER = FALSE ENABLE_MACRO_BLOCK_BLOOM_FILTER = FALSE TABLET_SIZE = 134217728 PCTFREE = 0 WITH COLUMN GROUP(all columns, each column)
SELECT * FROM Z0CASE;
T1
00:20:20
11:58:39
21:28:34
00:20:01
NULL
00:20:01
00:00:00
12:23:36
00:20:11
22:22:35
NULL
update
UPDATE Z0CASE SET T1=NULL WHERE T1='22:22:35';
UPDATE Z0CASE SET T1='12:31:56' WHERE T1='21:28:34';
UPDATE Z0CASE SET T1=1221.34 WHERE T1='12:31:56';
UPDATE Z0CASE SET T1='Aa1$< >中文' WHERE T1='12:31:56';
UPDATE Z0CASE SET T1=b'0101101' WHERE T1='12:31:56';
UPDATE Z0CASE SET T1='2011-11-11' WHERE T1='12:31:56';
UPDATE Z0CASE SET T1='2012-12-21 09:10:21' WHERE T1='12:31:56';
SELECT table_name,column_type,COLLATION_NAME,CHARACTER_SET_NAME FROM information_schema.columns WHERE table_name='Z0CASE';
table_name	column_type	COLLATION_NAME	CHARACTER_SET_NAME
z0case	time	NULL	NULL
SHOW CREATE TABLE Z0CASE;
Table	Create Table
z0case	CREATE TABLE `z0case` (
  `T1` time DEFAULT NULL
) ORGANIZATION INDEX DEFAULT CHARSET = gb18030 ROW_FORMAT = DYNAMIC COMPRESSION = 'zstd_1.3.8' REPLICA_NUM = replica_num BLOCK_SIZE = 16384 USE_BLOOM_FILTER = FALSE ENABLE_MACRO_BLOCK_BLOOM_FILTER = FALSE TABLET_SIZE = 134217728 PCTFREE = 0 WITH COLUMN GROUP(all columns, each column)
SELECT * FROM Z0CASE;
T1
00:20:20
11:58:39
00:12:21
00:20:01
NULL
00:20:01
00:00:00
12:23:36
00:20:11
NULL
NULL
delete
DELETE FROM Z0CASE WHERE T1='09:10:21';
DELETE FROM Z0CASE WHERE T1 IS NULL;
SELECT * FROM Z0CASE;
T1
00:20:20
11:58:39
00:12:21
00:20:01
00:20:01
00:00:00
12:23:36
00:20:11
general_list_update  utf8mb4/utf8mb4_general_ci --> gb18030/gb18030_bin
char
DROP TABLE Z0CASE;
CREATE TABLE Z0CASE(T1 CHAR(50)) DEFAULT charset= utf8mb4 DEFAULT collate = utf8mb4_general_ci with column group (all columns, each column);
INSERT INTO Z0CASE VALUES(123);
INSERT INTO Z0CASE VALUES('%^&*[];//\\');
INSERT INTO Z0CASE VALUES(NULL);
INSERT INTO Z0CASE VALUES('abc');
INSERT INTO Z0CASE VALUES('中文');
SELECT * FROM Z0CASE;
T1
123
%^&*[];//\
NULL
abc
中文
SELECT table_name,column_type,COLLATION_NAME,CHARACTER_SET_NAME FROM information_schema.columns WHERE table_name='Z0CASE';
table_name	column_type	COLLATION_NAME	CHARACTER_SET_NAME
z0case	char(50)	utf8mb4_general_ci	utf8mb4
SHOW CREATE TABLE Z0CASE;
Table	Create Table
z0case	CREATE TABLE `z0case` (
  `T1` char(50) DEFAULT NULL
) ORGANIZATION INDEX DEFAULT CHARSET = utf8mb4 ROW_FORMAT = DYNAMIC COMPRESSION = 'zstd_1.3.8' REPLICA_NUM = replica_num BLOCK_SIZE = 16384 USE_BLOOM_FILTER = FALSE ENABLE_MACRO_BLOCK_BLOOM_FILTER = FALSE TABLET_SIZE = 134217728 PCTFREE = 0 WITH COLUMN GROUP(all columns, each column)
ALTER TABLE Z0CASE CONVERT TO CHARACTER SET 'gb18030' COLLATE 'gb18030_bin';
SHOW CREATE TABLE Z0CASE;
Table	Create Table
z0case	CREATE TABLE `z0case` (
  `T1` char(50) COLLATE gb18030_bin DEFAULT NULL
) ORGANIZATION INDEX DEFAULT CHARSET = gb18030 COLLATE = gb18030_bin ROW_FORMAT = DYNAMIC COMPRESSION = 'zstd_1.3.8' REPLICA_NUM = replica_num BLOCK_SIZE = 16384 USE_BLOOM_FILTER = FALSE ENABLE_MACRO_BLOCK_BLOOM_FILTER = FALSE TABLET_SIZE = 134217728 PCTFREE = 0 WITH COLUMN GROUP(all columns, each column)
SELECT * FROM Z0CASE;
T1
123
%^&*[];//\
NULL
abc
中文
insert
INSERT INTO Z0CASE VALUES(111);
INSERT INTO Z0CASE VALUES('2001');
INSERT INTO Z0CASE VALUES('!*?< >aB12 中文');
INSERT INTO Z0CASE VALUES(b'0101101');
INSERT INTO Z0CASE VALUES('2021-10-01 12:23:35.54');
INSERT INTO Z0CASE VALUES('2011-11-01');
INSERT INTO Z0CASE VALUES('22:22:35');
INSERT INTO Z0CASE VALUES(12.345);
INSERT INTO Z0CASE VALUES(null);
SELECT table_name,column_type,COLLATION_NAME,CHARACTER_SET_NAME FROM information_schema.columns WHERE table_name='Z0CASE';
table_name	column_type	COLLATION_NAME	CHARACTER_SET_NAME
z0case	char(50)	gb18030_bin	gb18030
SHOW CREATE TABLE Z0CASE;
Table	Create Table
z0case	CREATE TABLE `z0case` (
  `T1` char(50) COLLATE gb18030_bin DEFAULT NULL
) ORGANIZATION INDEX DEFAULT CHARSET = gb18030 COLLATE = gb18030_bin ROW_FORMAT = DYNAMIC COMPRESSION = 'zstd_1.3.8' REPLICA_NUM = replica_num BLOCK_SIZE = 16384 USE_BLOOM_FILTER = FALSE ENABLE_MACRO_BLOCK_BLOOM_FILTER = FALSE TABLET_SIZE = 134217728 PCTFREE = 0 WITH COLUMN GROUP(all columns, each column)
SELECT * FROM Z0CASE;
T1
123
%^&*[];//\
NULL
abc
中文
111
2001
!*?< >aB12 中文
-
2021-10-01 12:23:35.54
2011-11-01
22:22:35
12.345
NULL
update
UPDATE Z0CASE SET T1=NULL WHERE T1='111';
UPDATE Z0CASE SET T1='12:31:56' WHERE T1=2001;
ERROR 22007: Truncated incorrect DECIMAL value: '%^&*[];//\'
UPDATE Z0CASE SET T1=1221.34 WHERE T1='2011-11-01';
UPDATE Z0CASE SET T1='Aa1$< >中文' WHERE T1='12.345';
UPDATE Z0CASE SET T1=b'0101101' WHERE T1='abc';
SELECT table_name,column_type,COLLATION_NAME,CHARACTER_SET_NAME FROM information_schema.columns WHERE table_name='Z0CASE';
table_name	column_type	COLLATION_NAME	CHARACTER_SET_NAME
z0case	char(50)	gb18030_bin	gb18030
SHOW CREATE TABLE Z0CASE;
Table	Create Table
z0case	CREATE TABLE `z0case` (
  `T1` char(50) COLLATE gb18030_bin DEFAULT NULL
) ORGANIZATION INDEX DEFAULT CHARSET = gb18030 COLLATE = gb18030_bin ROW_FORMAT = DYNAMIC COMPRESSION = 'zstd_1.3.8' REPLICA_NUM = replica_num BLOCK_SIZE = 16384 USE_BLOOM_FILTER = FALSE ENABLE_MACRO_BLOCK_BLOOM_FILTER = FALSE TABLET_SIZE = 134217728 PCTFREE = 0 WITH COLUMN GROUP(all columns, each column)
SELECT * FROM Z0CASE;
T1
123
%^&*[];//\
NULL
-
中文
NULL
2001
!*?< >aB12 中文
-
2021-10-01 12:23:35.54
1221.34
22:22:35
Aa1$< >中文
NULL
delete
DELETE FROM Z0CASE WHERE T1=1221.34;
ERROR 22007: Truncated incorrect DECIMAL value: '%^&*[];//\'
DELETE FROM Z0CASE WHERE T1='2021-10-01 12:23:35.54';
DELETE FROM Z0CASE WHERE T1 IS NULL;
DELETE FROM Z0CASE WHERE T1=b'0101101';
SELECT * FROM Z0CASE;
T1
123
%^&*[];//\
中文
2001
!*?< >aB12 中文
1221.34
22:22:35
Aa1$< >中文
varchar
DROP TABLE Z0CASE;
CREATE TABLE Z0CASE(T1 VARCHAR(50)) DEFAULT charset= utf8mb4 DEFAULT collate = utf8mb4_general_ci with column group (all columns, each column);
INSERT INTO Z0CASE VALUES(123);
INSERT INTO Z0CASE VALUES('%^&*[];//\\');
INSERT INTO Z0CASE VALUES(NULL);
INSERT INTO Z0CASE VALUES('abc');
INSERT INTO Z0CASE VALUES('中文');
SELECT * FROM Z0CASE;
T1
123
%^&*[];//\
NULL
abc
中文
SELECT table_name,column_type,COLLATION_NAME,CHARACTER_SET_NAME FROM information_schema.columns WHERE table_name='Z0CASE';
table_name	column_type	COLLATION_NAME	CHARACTER_SET_NAME
z0case	varchar(50)	utf8mb4_general_ci	utf8mb4
SHOW CREATE TABLE Z0CASE;
Table	Create Table
z0case	CREATE TABLE `z0case` (
  `T1` varchar(50) DEFAULT NULL
) ORGANIZATION INDEX DEFAULT CHARSET = utf8mb4 ROW_FORMAT = DYNAMIC COMPRESSION = 'zstd_1.3.8' REPLICA_NUM = replica_num BLOCK_SIZE = 16384 USE_BLOOM_FILTER = FALSE ENABLE_MACRO_BLOCK_BLOOM_FILTER = FALSE TABLET_SIZE = 134217728 PCTFREE = 0 WITH COLUMN GROUP(all columns, each column)
ALTER TABLE Z0CASE CONVERT TO CHARACTER SET 'gb18030' COLLATE 'gb18030_bin';
SHOW CREATE TABLE Z0CASE;
Table	Create Table
z0case	CREATE TABLE `z0case` (
  `T1` varchar(50) COLLATE gb18030_bin DEFAULT NULL
) ORGANIZATION INDEX DEFAULT CHARSET = gb18030 COLLATE = gb18030_bin ROW_FORMAT = DYNAMIC COMPRESSION = 'zstd_1.3.8' REPLICA_NUM = replica_num BLOCK_SIZE = 16384 USE_BLOOM_FILTER = FALSE ENABLE_MACRO_BLOCK_BLOOM_FILTER = FALSE TABLET_SIZE = 134217728 PCTFREE = 0 WITH COLUMN GROUP(all columns, each column)
SELECT * FROM Z0CASE;
T1
123
%^&*[];//\
NULL
abc
中文
insert
INSERT INTO Z0CASE VALUES(111);
INSERT INTO Z0CASE VALUES('2001');
INSERT INTO Z0CASE VALUES('!*?< >aB12 中文');
INSERT INTO Z0CASE VALUES(b'0101101');
INSERT INTO Z0CASE VALUES('2021-10-01 12:23:35.54');
INSERT INTO Z0CASE VALUES('2011-11-01');
INSERT INTO Z0CASE VALUES('22:22:35');
INSERT INTO Z0CASE VALUES(12.345);
INSERT INTO Z0CASE VALUES(null);
SELECT table_name,column_type,COLLATION_NAME,CHARACTER_SET_NAME FROM information_schema.columns WHERE table_name='Z0CASE';
table_name	column_type	COLLATION_NAME	CHARACTER_SET_NAME
z0case	varchar(50)	gb18030_bin	gb18030
SHOW CREATE TABLE Z0CASE;
Table	Create Table
z0case	CREATE TABLE `z0case` (
  `T1` varchar(50) COLLATE gb18030_bin DEFAULT NULL
) ORGANIZATION INDEX DEFAULT CHARSET = gb18030 COLLATE = gb18030_bin ROW_FORMAT = DYNAMIC COMPRESSION = 'zstd_1.3.8' REPLICA_NUM = replica_num BLOCK_SIZE = 16384 USE_BLOOM_FILTER = FALSE ENABLE_MACRO_BLOCK_BLOOM_FILTER = FALSE TABLET_SIZE = 134217728 PCTFREE = 0 WITH COLUMN GROUP(all columns, each column)
SELECT * FROM Z0CASE;
T1
123
%^&*[];//\
NULL
abc
中文
111
2001
!*?< >aB12 中文
-
2021-10-01 12:23:35.54
2011-11-01
22:22:35
12.345
NULL
update
UPDATE Z0CASE SET T1=NULL WHERE T1='111';
UPDATE Z0CASE SET T1='12:31:56' WHERE T1=2001;
ERROR 22007: Truncated incorrect DECIMAL value: '%^&*[];//\'
UPDATE Z0CASE SET T1=1221.34 WHERE T1='2011-11-01';
UPDATE Z0CASE SET T1='Aa1$< >中文' WHERE T1='12.345';
UPDATE Z0CASE SET T1=b'0101101' WHERE T1='abc';
SELECT table_name,column_type,COLLATION_NAME,CHARACTER_SET_NAME FROM information_schema.columns WHERE table_name='Z0CASE';
table_name	column_type	COLLATION_NAME	CHARACTER_SET_NAME
z0case	varchar(50)	gb18030_bin	gb18030
SHOW CREATE TABLE Z0CASE;
Table	Create Table
z0case	CREATE TABLE `z0case` (
  `T1` varchar(50) COLLATE gb18030_bin DEFAULT NULL
) ORGANIZATION INDEX DEFAULT CHARSET = gb18030 COLLATE = gb18030_bin ROW_FORMAT = DYNAMIC COMPRESSION = 'zstd_1.3.8' REPLICA_NUM = replica_num BLOCK_SIZE = 16384 USE_BLOOM_FILTER = FALSE ENABLE_MACRO_BLOCK_BLOOM_FILTER = FALSE TABLET_SIZE = 134217728 PCTFREE = 0 WITH COLUMN GROUP(all columns, each column)
SELECT * FROM Z0CASE;
T1
123
%^&*[];//\
NULL
-
中文
NULL
2001
!*?< >aB12 中文
-
2021-10-01 12:23:35.54
1221.34
22:22:35
Aa1$< >中文
NULL
delete
DELETE FROM Z0CASE WHERE T1=1221.34;
ERROR 22007: Truncated incorrect DECIMAL value: '%^&*[];//\'
DELETE FROM Z0CASE WHERE T1='2021-10-01 12:23:35.54';
DELETE FROM Z0CASE WHERE T1 IS NULL;
DELETE FROM Z0CASE WHERE T1=b'0101101';
SELECT * FROM Z0CASE;
T1
123
%^&*[];//\
中文
2001
!*?< >aB12 中文
1221.34
22:22:35
Aa1$< >中文
TEXT
DROP TABLE Z0CASE;
CREATE TABLE Z0CASE(T1 TEXT) DEFAULT charset= utf8mb4 DEFAULT collate = utf8mb4_general_ci with column group (all columns, each column);
INSERT INTO Z0CASE VALUES(123);
INSERT INTO Z0CASE VALUES('%^&*[];//\\');
INSERT INTO Z0CASE VALUES(NULL);
INSERT INTO Z0CASE VALUES('abc');
INSERT INTO Z0CASE VALUES('中文');
SELECT * FROM Z0CASE;
T1
123
%^&*[];//\
NULL
abc
中文
SELECT table_name,column_type,COLLATION_NAME,CHARACTER_SET_NAME FROM information_schema.columns WHERE table_name='Z0CASE';
table_name	column_type	COLLATION_NAME	CHARACTER_SET_NAME
z0case	text	utf8mb4_general_ci	utf8mb4
SHOW CREATE TABLE Z0CASE;
Table	Create Table
z0case	CREATE TABLE `z0case` (
  `T1` text DEFAULT NULL
) ORGANIZATION INDEX DEFAULT CHARSET = utf8mb4 ROW_FORMAT = DYNAMIC COMPRESSION = 'zstd_1.3.8' REPLICA_NUM = replica_num BLOCK_SIZE = 16384 USE_BLOOM_FILTER = FALSE ENABLE_MACRO_BLOCK_BLOOM_FILTER = FALSE TABLET_SIZE = 134217728 PCTFREE = 0 WITH COLUMN GROUP(all columns, each column)
ALTER TABLE Z0CASE CONVERT TO CHARACTER SET 'gb18030' COLLATE 'gb18030_bin';
SHOW CREATE TABLE Z0CASE;
Table	Create Table
z0case	CREATE TABLE `z0case` (
  `T1` text COLLATE gb18030_bin DEFAULT NULL
) ORGANIZATION INDEX DEFAULT CHARSET = gb18030 COLLATE = gb18030_bin ROW_FORMAT = DYNAMIC COMPRESSION = 'zstd_1.3.8' REPLICA_NUM = replica_num BLOCK_SIZE = 16384 USE_BLOOM_FILTER = FALSE ENABLE_MACRO_BLOCK_BLOOM_FILTER = FALSE TABLET_SIZE = 134217728 PCTFREE = 0 WITH COLUMN GROUP(all columns, each column)
SELECT * FROM Z0CASE;
T1
123
%^&*[];//\
NULL
abc
中文
insert
INSERT INTO Z0CASE VALUES(111);
INSERT INTO Z0CASE VALUES('2001');
INSERT INTO Z0CASE VALUES('!*?< >aB12 中文');
INSERT INTO Z0CASE VALUES(b'0101101');
INSERT INTO Z0CASE VALUES('2021-10-01 12:23:35.54');
INSERT INTO Z0CASE VALUES('2011-11-01');
INSERT INTO Z0CASE VALUES('22:22:35');
INSERT INTO Z0CASE VALUES(12.345);
INSERT INTO Z0CASE VALUES(null);
SELECT table_name,column_type,COLLATION_NAME,CHARACTER_SET_NAME FROM information_schema.columns WHERE table_name='Z0CASE';
table_name	column_type	COLLATION_NAME	CHARACTER_SET_NAME
z0case	text	gb18030_bin	gb18030
SHOW CREATE TABLE Z0CASE;
Table	Create Table
z0case	CREATE TABLE `z0case` (
  `T1` text COLLATE gb18030_bin DEFAULT NULL
) ORGANIZATION INDEX DEFAULT CHARSET = gb18030 COLLATE = gb18030_bin ROW_FORMAT = DYNAMIC COMPRESSION = 'zstd_1.3.8' REPLICA_NUM = replica_num BLOCK_SIZE = 16384 USE_BLOOM_FILTER = FALSE ENABLE_MACRO_BLOCK_BLOOM_FILTER = FALSE TABLET_SIZE = 134217728 PCTFREE = 0 WITH COLUMN GROUP(all columns, each column)
SELECT * FROM Z0CASE;
T1
123
%^&*[];//\
NULL
abc
中文
111
2001
!*?< >aB12 中文
-
2021-10-01 12:23:35.54
2011-11-01
22:22:35
12.345
NULL
update
UPDATE Z0CASE SET T1=NULL WHERE T1='111';
UPDATE Z0CASE SET T1='12:31:56' WHERE T1=2001;
ERROR 22007: Truncated incorrect DECIMAL value: '%^&*[];//\'
UPDATE Z0CASE SET T1=1221.34 WHERE T1='2011-11-01';
UPDATE Z0CASE SET T1='Aa1$< >中文' WHERE T1='12.345';
UPDATE Z0CASE SET T1=b'0101101' WHERE T1='abc';
SELECT table_name,column_type,COLLATION_NAME,CHARACTER_SET_NAME FROM information_schema.columns WHERE table_name='Z0CASE';
table_name	column_type	COLLATION_NAME	CHARACTER_SET_NAME
z0case	text	gb18030_bin	gb18030
SHOW CREATE TABLE Z0CASE;
Table	Create Table
z0case	CREATE TABLE `z0case` (
  `T1` text COLLATE gb18030_bin DEFAULT NULL
) ORGANIZATION INDEX DEFAULT CHARSET = gb18030 COLLATE = gb18030_bin ROW_FORMAT = DYNAMIC COMPRESSION = 'zstd_1.3.8' REPLICA_NUM = replica_num BLOCK_SIZE = 16384 USE_BLOOM_FILTER = FALSE ENABLE_MACRO_BLOCK_BLOOM_FILTER = FALSE TABLET_SIZE = 134217728 PCTFREE = 0 WITH COLUMN GROUP(all columns, each column)
SELECT * FROM Z0CASE;
T1
123
%^&*[];//\
NULL
-
中文
NULL
2001
!*?< >aB12 中文
-
2021-10-01 12:23:35.54
1221.34
22:22:35
Aa1$< >中文
NULL
delete
DELETE FROM Z0CASE WHERE T1=1221.34;
ERROR 22007: Truncated incorrect DECIMAL value: '%^&*[];//\'
DELETE FROM Z0CASE WHERE T1='2021-10-01 12:23:35.54';
DELETE FROM Z0CASE WHERE T1 IS NULL;
DELETE FROM Z0CASE WHERE T1=b'0101101';
SELECT * FROM Z0CASE;
T1
123
%^&*[];//\
中文
2001
!*?< >aB12 中文
1221.34
22:22:35
Aa1$< >中文
LONGTEXT
DROP TABLE Z0CASE;
CREATE TABLE Z0CASE(T1 LONGTEXT) DEFAULT charset= utf8mb4 DEFAULT collate = utf8mb4_general_ci with column group (all columns, each column);
INSERT INTO Z0CASE VALUES(123);
INSERT INTO Z0CASE VALUES('%^&*[];//\\');
INSERT INTO Z0CASE VALUES(NULL);
INSERT INTO Z0CASE VALUES('abc');
INSERT INTO Z0CASE VALUES('中文');
SELECT * FROM Z0CASE;
T1
123
%^&*[];//\
NULL
abc
中文
SELECT table_name,column_type,COLLATION_NAME,CHARACTER_SET_NAME FROM information_schema.columns WHERE table_name='Z0CASE';
table_name	column_type	COLLATION_NAME	CHARACTER_SET_NAME
z0case	longtext	utf8mb4_general_ci	utf8mb4
SHOW CREATE TABLE Z0CASE;
Table	Create Table
z0case	CREATE TABLE `z0case` (
  `T1` longtext DEFAULT NULL
) ORGANIZATION INDEX DEFAULT CHARSET = utf8mb4 ROW_FORMAT = DYNAMIC COMPRESSION = 'zstd_1.3.8' REPLICA_NUM = replica_num BLOCK_SIZE = 16384 USE_BLOOM_FILTER = FALSE ENABLE_MACRO_BLOCK_BLOOM_FILTER = FALSE TABLET_SIZE = 134217728 PCTFREE = 0 WITH COLUMN GROUP(all columns, each column)
ALTER TABLE Z0CASE CONVERT TO CHARACTER SET 'gb18030' COLLATE 'gb18030_bin';
SHOW CREATE TABLE Z0CASE;
Table	Create Table
z0case	CREATE TABLE `z0case` (
  `T1` longtext COLLATE gb18030_bin DEFAULT NULL
) ORGANIZATION INDEX DEFAULT CHARSET = gb18030 COLLATE = gb18030_bin ROW_FORMAT = DYNAMIC COMPRESSION = 'zstd_1.3.8' REPLICA_NUM = replica_num BLOCK_SIZE = 16384 USE_BLOOM_FILTER = FALSE ENABLE_MACRO_BLOCK_BLOOM_FILTER = FALSE TABLET_SIZE = 134217728 PCTFREE = 0 WITH COLUMN GROUP(all columns, each column)
SELECT * FROM Z0CASE;
T1
123
%^&*[];//\
NULL
abc
中文
insert
INSERT INTO Z0CASE VALUES(111);
INSERT INTO Z0CASE VALUES('2001');
INSERT INTO Z0CASE VALUES('!*?< >aB12 中文');
INSERT INTO Z0CASE VALUES(b'0101101');
INSERT INTO Z0CASE VALUES('2021-10-01 12:23:35.54');
INSERT INTO Z0CASE VALUES('2011-11-01');
INSERT INTO Z0CASE VALUES('22:22:35');
INSERT INTO Z0CASE VALUES(12.345);
INSERT INTO Z0CASE VALUES(null);
SELECT table_name,column_type,COLLATION_NAME,CHARACTER_SET_NAME FROM information_schema.columns WHERE table_name='Z0CASE';
table_name	column_type	COLLATION_NAME	CHARACTER_SET_NAME
z0case	longtext	gb18030_bin	gb18030
SHOW CREATE TABLE Z0CASE;
Table	Create Table
z0case	CREATE TABLE `z0case` (
  `T1` longtext COLLATE gb18030_bin DEFAULT NULL
) ORGANIZATION INDEX DEFAULT CHARSET = gb18030 COLLATE = gb18030_bin ROW_FORMAT = DYNAMIC COMPRESSION = 'zstd_1.3.8' REPLICA_NUM = replica_num BLOCK_SIZE = 16384 USE_BLOOM_FILTER = FALSE ENABLE_MACRO_BLOCK_BLOOM_FILTER = FALSE TABLET_SIZE = 134217728 PCTFREE = 0 WITH COLUMN GROUP(all columns, each column)
SELECT * FROM Z0CASE;
T1
123
%^&*[];//\
NULL
abc
中文
111
2001
!*?< >aB12 中文
-
2021-10-01 12:23:35.54
2011-11-01
22:22:35
12.345
NULL
update
UPDATE Z0CASE SET T1=NULL WHERE T1='111';
UPDATE Z0CASE SET T1='12:31:56' WHERE T1=2001;
ERROR 22007: Truncated incorrect DECIMAL value: '%^&*[];//\'
UPDATE Z0CASE SET T1=1221.34 WHERE T1='2011-11-01';
UPDATE Z0CASE SET T1='Aa1$< >中文' WHERE T1='12.345';
UPDATE Z0CASE SET T1=b'0101101' WHERE T1='abc';
SELECT table_name,column_type,COLLATION_NAME,CHARACTER_SET_NAME FROM information_schema.columns WHERE table_name='Z0CASE';
table_name	column_type	COLLATION_NAME	CHARACTER_SET_NAME
z0case	longtext	gb18030_bin	gb18030
SHOW CREATE TABLE Z0CASE;
Table	Create Table
z0case	CREATE TABLE `z0case` (
  `T1` longtext COLLATE gb18030_bin DEFAULT NULL
) ORGANIZATION INDEX DEFAULT CHARSET = gb18030 COLLATE = gb18030_bin ROW_FORMAT = DYNAMIC COMPRESSION = 'zstd_1.3.8' REPLICA_NUM = replica_num BLOCK_SIZE = 16384 USE_BLOOM_FILTER = FALSE ENABLE_MACRO_BLOCK_BLOOM_FILTER = FALSE TABLET_SIZE = 134217728 PCTFREE = 0 WITH COLUMN GROUP(all columns, each column)
SELECT * FROM Z0CASE;
T1
123
%^&*[];//\
NULL
-
中文
NULL
2001
!*?< >aB12 中文
-
2021-10-01 12:23:35.54
1221.34
22:22:35
Aa1$< >中文
NULL
delete
DELETE FROM Z0CASE WHERE T1=1221.34;
ERROR 22007: Truncated incorrect DECIMAL value: '%^&*[];//\'
DELETE FROM Z0CASE WHERE T1='2021-10-01 12:23:35.54';
DELETE FROM Z0CASE WHERE T1 IS NULL;
DELETE FROM Z0CASE WHERE T1=b'0101101';
SELECT * FROM Z0CASE;
T1
123
%^&*[];//\
中文
2001
!*?< >aB12 中文
1221.34
22:22:35
Aa1$< >中文
BLOB
DROP TABLE Z0CASE;
CREATE TABLE Z0CASE(T1 BLOB) DEFAULT charset= utf8mb4 DEFAULT collate = utf8mb4_general_ci with column group (all columns, each column);
INSERT INTO Z0CASE VALUES(123);
INSERT INTO Z0CASE VALUES('%^&*[];//\\');
INSERT INTO Z0CASE VALUES(NULL);
INSERT INTO Z0CASE VALUES('abc');
INSERT INTO Z0CASE VALUES('中文');
SELECT * FROM Z0CASE;
T1
123
%^&*[];//\
NULL
abc
中文
SELECT table_name,column_type,COLLATION_NAME,CHARACTER_SET_NAME FROM information_schema.columns WHERE table_name='Z0CASE';
table_name	column_type	COLLATION_NAME	CHARACTER_SET_NAME
z0case	blob	NULL	NULL
SHOW CREATE TABLE Z0CASE;
Table	Create Table
z0case	CREATE TABLE `z0case` (
  `T1` blob DEFAULT NULL
) ORGANIZATION INDEX DEFAULT CHARSET = utf8mb4 ROW_FORMAT = DYNAMIC COMPRESSION = 'zstd_1.3.8' REPLICA_NUM = replica_num BLOCK_SIZE = 16384 USE_BLOOM_FILTER = FALSE ENABLE_MACRO_BLOCK_BLOOM_FILTER = FALSE TABLET_SIZE = 134217728 PCTFREE = 0 WITH COLUMN GROUP(all columns, each column)
ALTER TABLE Z0CASE CONVERT TO CHARACTER SET 'gb18030' COLLATE 'gb18030_bin';
SHOW CREATE TABLE Z0CASE;
Table	Create Table
z0case	CREATE TABLE `z0case` (
  `T1` blob DEFAULT NULL
) ORGANIZATION INDEX DEFAULT CHARSET = gb18030 COLLATE = gb18030_bin ROW_FORMAT = DYNAMIC COMPRESSION = 'zstd_1.3.8' REPLICA_NUM = replica_num BLOCK_SIZE = 16384 USE_BLOOM_FILTER = FALSE ENABLE_MACRO_BLOCK_BLOOM_FILTER = FALSE TABLET_SIZE = 134217728 PCTFREE = 0 WITH COLUMN GROUP(all columns, each column)
SELECT * FROM Z0CASE;
T1
123
%^&*[];//\
NULL
abc
中文
insert
INSERT INTO Z0CASE VALUES(111);
INSERT INTO Z0CASE VALUES('2001');
INSERT INTO Z0CASE VALUES('!*?< >aB12 中文');
INSERT INTO Z0CASE VALUES(b'0101101');
INSERT INTO Z0CASE VALUES('2021-10-01 12:23:35.54');
INSERT INTO Z0CASE VALUES('2011-11-01');
INSERT INTO Z0CASE VALUES('22:22:35');
INSERT INTO Z0CASE VALUES(12.345);
INSERT INTO Z0CASE VALUES(null);
SELECT table_name,column_type,COLLATION_NAME,CHARACTER_SET_NAME FROM information_schema.columns WHERE table_name='Z0CASE';
table_name	column_type	COLLATION_NAME	CHARACTER_SET_NAME
z0case	blob	NULL	NULL
SHOW CREATE TABLE Z0CASE;
Table	Create Table
z0case	CREATE TABLE `z0case` (
  `T1` blob DEFAULT NULL
) ORGANIZATION INDEX DEFAULT CHARSET = gb18030 COLLATE = gb18030_bin ROW_FORMAT = DYNAMIC COMPRESSION = 'zstd_1.3.8' REPLICA_NUM = replica_num BLOCK_SIZE = 16384 USE_BLOOM_FILTER = FALSE ENABLE_MACRO_BLOCK_BLOOM_FILTER = FALSE TABLET_SIZE = 134217728 PCTFREE = 0 WITH COLUMN GROUP(all columns, each column)
SELECT * FROM Z0CASE;
T1
123
%^&*[];//\
NULL
abc
中文
111
2001
!*?< >aB12 中文
-
2021-10-01 12:23:35.54
2011-11-01
22:22:35
12.345
NULL
update
UPDATE Z0CASE SET T1=NULL WHERE T1='111';
UPDATE Z0CASE SET T1='12:31:56' WHERE T1=2001;
ERROR 22007: Truncated incorrect DECIMAL value: '%^&*[];//\'
UPDATE Z0CASE SET T1=1221.34 WHERE T1='2011-11-01';
UPDATE Z0CASE SET T1='Aa1$< >中文' WHERE T1='12.345';
UPDATE Z0CASE SET T1=b'0101101' WHERE T1='abc';
SELECT table_name,column_type,COLLATION_NAME,CHARACTER_SET_NAME FROM information_schema.columns WHERE table_name='Z0CASE';
table_name	column_type	COLLATION_NAME	CHARACTER_SET_NAME
z0case	blob	NULL	NULL
SHOW CREATE TABLE Z0CASE;
Table	Create Table
z0case	CREATE TABLE `z0case` (
  `T1` blob DEFAULT NULL
) ORGANIZATION INDEX DEFAULT CHARSET = gb18030 COLLATE = gb18030_bin ROW_FORMAT = DYNAMIC COMPRESSION = 'zstd_1.3.8' REPLICA_NUM = replica_num BLOCK_SIZE = 16384 USE_BLOOM_FILTER = FALSE ENABLE_MACRO_BLOCK_BLOOM_FILTER = FALSE TABLET_SIZE = 134217728 PCTFREE = 0 WITH COLUMN GROUP(all columns, each column)
SELECT * FROM Z0CASE;
T1
123
%^&*[];//\
NULL
-
中文
NULL
2001
!*?< >aB12 中文
-
2021-10-01 12:23:35.54
1221.34
22:22:35
Aa1$< >中文
NULL
delete
DELETE FROM Z0CASE WHERE T1=1221.34;
ERROR 22007: Truncated incorrect DECIMAL value: '%^&*[];//\'
DELETE FROM Z0CASE WHERE T1='2021-10-01 12:23:35.54';
DELETE FROM Z0CASE WHERE T1 IS NULL;
DELETE FROM Z0CASE WHERE T1=b'0101101';
SELECT * FROM Z0CASE;
T1
123
%^&*[];//\
中文
2001
!*?< >aB12 中文
1221.34
22:22:35
Aa1$< >中文
BINARY
DROP TABLE Z0CASE;
CREATE TABLE Z0CASE(T1 BINARY(50)) DEFAULT charset= utf8mb4 DEFAULT collate = utf8mb4_general_ci with column group (all columns, each column);
INSERT INTO Z0CASE VALUES(123);
INSERT INTO Z0CASE VALUES('%^&*[];//\\');
INSERT INTO Z0CASE VALUES(NULL);
INSERT INTO Z0CASE VALUES('abc');
INSERT INTO Z0CASE VALUES('中文');
SELECT * FROM Z0CASE;
T1
123                                               
%^&*[];//\                                        
NULL
abc                                               
中文                                            
SELECT table_name,column_type,COLLATION_NAME,CHARACTER_SET_NAME FROM information_schema.columns WHERE table_name='Z0CASE';
table_name	column_type	COLLATION_NAME	CHARACTER_SET_NAME
z0case	binary(50)	NULL	NULL
SHOW CREATE TABLE Z0CASE;
Table	Create Table
z0case	CREATE TABLE `z0case` (
  `T1` binary(50) DEFAULT NULL
) ORGANIZATION INDEX DEFAULT CHARSET = utf8mb4 ROW_FORMAT = DYNAMIC COMPRESSION = 'zstd_1.3.8' REPLICA_NUM = replica_num BLOCK_SIZE = 16384 USE_BLOOM_FILTER = FALSE ENABLE_MACRO_BLOCK_BLOOM_FILTER = FALSE TABLET_SIZE = 134217728 PCTFREE = 0 WITH COLUMN GROUP(all columns, each column)
ALTER TABLE Z0CASE CONVERT TO CHARACTER SET 'gb18030' COLLATE 'gb18030_bin';
SHOW CREATE TABLE Z0CASE;
Table	Create Table
z0case	CREATE TABLE `z0case` (
  `T1` binary(50) DEFAULT NULL
) ORGANIZATION INDEX DEFAULT CHARSET = gb18030 COLLATE = gb18030_bin ROW_FORMAT = DYNAMIC COMPRESSION = 'zstd_1.3.8' REPLICA_NUM = replica_num BLOCK_SIZE = 16384 USE_BLOOM_FILTER = FALSE ENABLE_MACRO_BLOCK_BLOOM_FILTER = FALSE TABLET_SIZE = 134217728 PCTFREE = 0 WITH COLUMN GROUP(all columns, each column)
SELECT * FROM Z0CASE;
T1
123                                               
%^&*[];//\                                        
NULL
abc                                               
中文                                            
insert
INSERT INTO Z0CASE VALUES(111);
INSERT INTO Z0CASE VALUES('2001');
INSERT INTO Z0CASE VALUES('!*?< >aB12 中文');
INSERT INTO Z0CASE VALUES(b'0101101');
INSERT INTO Z0CASE VALUES('2021-10-01 12:23:35.54');
INSERT INTO Z0CASE VALUES('2011-11-01');
INSERT INTO Z0CASE VALUES('22:22:35');
INSERT INTO Z0CASE VALUES(12.345);
INSERT INTO Z0CASE VALUES(null);
SELECT table_name,column_type,COLLATION_NAME,CHARACTER_SET_NAME FROM information_schema.columns WHERE table_name='Z0CASE';
table_name	column_type	COLLATION_NAME	CHARACTER_SET_NAME
z0case	binary(50)	NULL	NULL
SHOW CREATE TABLE Z0CASE;
Table	Create Table
z0case	CREATE TABLE `z0case` (
  `T1` binary(50) DEFAULT NULL
) ORGANIZATION INDEX DEFAULT CHARSET = gb18030 COLLATE = gb18030_bin ROW_FORMAT = DYNAMIC COMPRESSION = 'zstd_1.3.8' REPLICA_NUM = replica_num BLOCK_SIZE = 16384 USE_BLOOM_FILTER = FALSE ENABLE_MACRO_BLOCK_BLOOM_FILTER = FALSE TABLET_SIZE = 134217728 PCTFREE = 0 WITH COLUMN GROUP(all columns, each column)
SELECT * FROM Z0CASE;
T1
123                                               
%^&*[];//\                                        
NULL
abc                                               
中文                                            
111                                               
2001                                              
!*?< >aB12 中文                                 
-                                                 
2021-10-01 12:23:35.54                            
2011-11-01                                        
22:22:35                                          
12.345                                            
NULL
update
UPDATE Z0CASE SET T1=NULL WHERE T1='111';
UPDATE Z0CASE SET T1='12:31:56' WHERE T1=2001;
ERROR 22007: Truncated incorrect DECIMAL value: '123'
UPDATE Z0CASE SET T1=1221.34 WHERE T1='2011-11-01';
UPDATE Z0CASE SET T1='Aa1$< >中文' WHERE T1='12.345';
UPDATE Z0CASE SET T1=b'0101101' WHERE T1='abc';
SELECT table_name,column_type,COLLATION_NAME,CHARACTER_SET_NAME FROM information_schema.columns WHERE table_name='Z0CASE';
table_name	column_type	COLLATION_NAME	CHARACTER_SET_NAME
z0case	binary(50)	NULL	NULL
SHOW CREATE TABLE Z0CASE;
Table	Create Table
z0case	CREATE TABLE `z0case` (
  `T1` binary(50) DEFAULT NULL
) ORGANIZATION INDEX DEFAULT CHARSET = gb18030 COLLATE = gb18030_bin ROW_FORMAT = DYNAMIC COMPRESSION = 'zstd_1.3.8' REPLICA_NUM = replica_num BLOCK_SIZE = 16384 USE_BLOOM_FILTER = FALSE ENABLE_MACRO_BLOCK_BLOOM_FILTER = FALSE TABLET_SIZE = 134217728 PCTFREE = 0 WITH COLUMN GROUP(all columns, each column)
SELECT * FROM Z0CASE;
T1
123                                               
%^&*[];//\                                        
NULL
abc                                               
中文                                            
111                                               
2001                                              
!*?< >aB12 中文                                 
-                                                 
2021-10-01 12:23:35.54                            
2011-11-01                                        
22:22:35                                          
12.345                                            
NULL
delete
DELETE FROM Z0CASE WHERE T1=1221.34;
ERROR 22007: Truncated incorrect DECIMAL value: '123'
DELETE FROM Z0CASE WHERE T1='2021-10-01 12:23:35.54';
DELETE FROM Z0CASE WHERE T1 IS NULL;
DELETE FROM Z0CASE WHERE T1=b'0101101';
SELECT * FROM Z0CASE;
T1
123                                               
%^&*[];//\                                        
abc                                               
中文                                            
111                                               
2001                                              
!*?< >aB12 中文                                 
-                                                 
2021-10-01 12:23:35.54                            
2011-11-01                                        
22:22:35                                          
12.345                                            
ENUM
DROP TABLE Z0CASE;
CREATE TABLE Z0CASE(T1 ENUM('123','abc','中文','%^&*[];//\\','111','2021-10-01 12:23:35.54','2011-11-01','12.345',b'0101101')) DEFAULT charset= utf8mb4 DEFAULT collate = utf8mb4_general_ci with column group (all columns, each column);
INSERT INTO Z0CASE VALUES('123');
INSERT INTO Z0CASE VALUES('%^&*[];//\\');
INSERT INTO Z0CASE VALUES(NULL);
INSERT INTO Z0CASE VALUES('abc');
INSERT INTO Z0CASE VALUES('中文');
SELECT * FROM Z0CASE;
T1
123
%^&*[];//\
NULL
abc
中文
SELECT table_name,column_type,COLLATION_NAME,CHARACTER_SET_NAME FROM information_schema.columns WHERE table_name='Z0CASE';
table_name	column_type	COLLATION_NAME	CHARACTER_SET_NAME
z0case	enum('123','abc','中文','%^&*[];//\','111','2021-10-01 12:23:35.54','2011-11-01','12.345','-')	utf8mb4_general_ci	utf8mb4
SHOW CREATE TABLE Z0CASE;
Table	Create Table
z0case	CREATE TABLE `z0case` (
  `T1` enum('123','abc','中文','%^&*[];//\','111','2021-10-01 12:23:35.54','2011-11-01','12.345','-') DEFAULT NULL
) ORGANIZATION INDEX DEFAULT CHARSET = utf8mb4 ROW_FORMAT = DYNAMIC COMPRESSION = 'zstd_1.3.8' REPLICA_NUM = replica_num BLOCK_SIZE = 16384 USE_BLOOM_FILTER = FALSE ENABLE_MACRO_BLOCK_BLOOM_FILTER = FALSE TABLET_SIZE = 134217728 PCTFREE = 0 WITH COLUMN GROUP(all columns, each column)
ALTER TABLE Z0CASE CONVERT TO CHARACTER SET 'gb18030' COLLATE 'gb18030_bin';
BIT
DROP TABLE Z0CASE;
CREATE TABLE Z0CASE(T1 BIT(20)) DEFAULT charset= utf8mb4 DEFAULT collate = utf8mb4_general_ci with column group (all columns, each column);
INSERT INTO Z0CASE VALUES(b'0101001');
INSERT INTO Z0CASE VALUES(b'111010101010100');
INSERT INTO Z0CASE VALUES(NULL);
SELECT BIN(T1) FROM Z0CASE;
BIN(T1)
101001
111010101010100
NULL
SELECT table_name,column_type,COLLATION_NAME,CHARACTER_SET_NAME FROM information_schema.columns WHERE table_name='Z0CASE';
table_name	column_type	COLLATION_NAME	CHARACTER_SET_NAME
z0case	bit(20)	NULL	NULL
SHOW CREATE TABLE Z0CASE;
Table	Create Table
z0case	CREATE TABLE `z0case` (
  `T1` bit(20) DEFAULT NULL
) ORGANIZATION INDEX DEFAULT CHARSET = utf8mb4 ROW_FORMAT = DYNAMIC COMPRESSION = 'zstd_1.3.8' REPLICA_NUM = replica_num BLOCK_SIZE = 16384 USE_BLOOM_FILTER = FALSE ENABLE_MACRO_BLOCK_BLOOM_FILTER = FALSE TABLET_SIZE = 134217728 PCTFREE = 0 WITH COLUMN GROUP(all columns, each column)
ALTER TABLE Z0CASE CONVERT TO CHARACTER SET 'gb18030' COLLATE 'gb18030_bin';
SHOW CREATE TABLE Z0CASE;
Table	Create Table
z0case	CREATE TABLE `z0case` (
  `T1` bit(20) DEFAULT NULL
) ORGANIZATION INDEX DEFAULT CHARSET = gb18030 COLLATE = gb18030_bin ROW_FORMAT = DYNAMIC COMPRESSION = 'zstd_1.3.8' REPLICA_NUM = replica_num BLOCK_SIZE = 16384 USE_BLOOM_FILTER = FALSE ENABLE_MACRO_BLOCK_BLOOM_FILTER = FALSE TABLET_SIZE = 134217728 PCTFREE = 0 WITH COLUMN GROUP(all columns, each column)
SELECT BIN(T1) FROM Z0CASE;
BIN(T1)
101001
111010101010100
NULL
insert
INSERT INTO Z0CASE VALUES(111);
INSERT INTO Z0CASE VALUES(b'010110100');
INSERT INTO Z0CASE VALUES(12.345);
INSERT INTO Z0CASE VALUES(null);
SELECT BIN(T1) FROM Z0CASE;
BIN(T1)
101001
111010101010100
NULL
1101111
10110100
1100
NULL
INSERT INTO Z0CASE VALUES('2001');
ERROR 22001: Data too long for column 'T1' at row 1
INSERT INTO Z0CASE VALUES('!*?< >aB12 中文');
ERROR 22001: Data too long for column 'T1' at row 1
INSERT INTO Z0CASE VALUES('2021-10-01 12:23:35.54');
ERROR 22001: Data too long for column 'T1' at row 1
INSERT INTO Z0CASE VALUES('2011-11-01');
ERROR 22001: Data too long for column 'T1' at row 1
INSERT INTO Z0CASE VALUES('22:22:35');
ERROR 22001: Data too long for column 'T1' at row 1
SELECT table_name,column_type,COLLATION_NAME,CHARACTER_SET_NAME FROM information_schema.columns WHERE table_name='Z0CASE';
table_name	column_type	COLLATION_NAME	CHARACTER_SET_NAME
z0case	bit(20)	NULL	NULL
SHOW CREATE TABLE Z0CASE;
Table	Create Table
z0case	CREATE TABLE `z0case` (
  `T1` bit(20) DEFAULT NULL
) ORGANIZATION INDEX DEFAULT CHARSET = gb18030 COLLATE = gb18030_bin ROW_FORMAT = DYNAMIC COMPRESSION = 'zstd_1.3.8' REPLICA_NUM = replica_num BLOCK_SIZE = 16384 USE_BLOOM_FILTER = FALSE ENABLE_MACRO_BLOCK_BLOOM_FILTER = FALSE TABLET_SIZE = 134217728 PCTFREE = 0 WITH COLUMN GROUP(all columns, each column)
SELECT BIN(T1) FROM Z0CASE;
BIN(T1)
101001
111010101010100
NULL
1101111
10110100
1100
NULL
update
UPDATE Z0CASE SET T1=NULL WHERE T1=b'0101001';
UPDATE Z0CASE SET T1='22:22:35' WHERE T1=b'111010101010100';
ERROR 22001: Data too long for column 'T1' at row 1
UPDATE Z0CASE SET T1=12.345 WHERE T1=b'111010101010100';
UPDATE Z0CASE SET T1=b'0101101' WHERE T1=b'111010101010100';
SELECT table_name,column_type,COLLATION_NAME,CHARACTER_SET_NAME FROM information_schema.columns WHERE table_name='Z0CASE';
table_name	column_type	COLLATION_NAME	CHARACTER_SET_NAME
z0case	bit(20)	NULL	NULL
SHOW CREATE TABLE Z0CASE;
Table	Create Table
z0case	CREATE TABLE `z0case` (
  `T1` bit(20) DEFAULT NULL
) ORGANIZATION INDEX DEFAULT CHARSET = gb18030 COLLATE = gb18030_bin ROW_FORMAT = DYNAMIC COMPRESSION = 'zstd_1.3.8' REPLICA_NUM = replica_num BLOCK_SIZE = 16384 USE_BLOOM_FILTER = FALSE ENABLE_MACRO_BLOCK_BLOOM_FILTER = FALSE TABLET_SIZE = 134217728 PCTFREE = 0 WITH COLUMN GROUP(all columns, each column)
SELECT BIN(T1) FROM Z0CASE;
BIN(T1)
NULL
1100
NULL
1101111
10110100
1100
NULL
delete
DELETE FROM Z0CASE WHERE T1 IS NULL;
DELETE FROM Z0CASE WHERE T1=b'111010101010100';
SELECT BIN(T1) FROM Z0CASE;
BIN(T1)
1100
1101111
10110100
1100
INT
DROP TABLE Z0CASE;
CREATE TABLE Z0CASE(T1 INT) DEFAULT charset= utf8mb4 DEFAULT collate = utf8mb4_general_ci with column group (all columns, each column);
INSERT INTO Z0CASE VALUES(123);
INSERT INTO Z0CASE VALUES(123.3445);
INSERT INTO Z0CASE VALUES(NULL);
SELECT * FROM Z0CASE;
T1
123
123
NULL
SELECT table_name,column_type,COLLATION_NAME,CHARACTER_SET_NAME FROM information_schema.columns WHERE table_name='Z0CASE';
table_name	column_type	COLLATION_NAME	CHARACTER_SET_NAME
z0case	int(11)	NULL	NULL
SHOW CREATE TABLE Z0CASE;
Table	Create Table
z0case	CREATE TABLE `z0case` (
  `T1` int(11) DEFAULT NULL
) ORGANIZATION INDEX DEFAULT CHARSET = utf8mb4 ROW_FORMAT = DYNAMIC COMPRESSION = 'zstd_1.3.8' REPLICA_NUM = replica_num BLOCK_SIZE = 16384 USE_BLOOM_FILTER = FALSE ENABLE_MACRO_BLOCK_BLOOM_FILTER = FALSE TABLET_SIZE = 134217728 PCTFREE = 0 WITH COLUMN GROUP(all columns, each column)
ALTER TABLE Z0CASE CONVERT TO CHARACTER SET 'gb18030' COLLATE 'gb18030_bin';
SHOW CREATE TABLE Z0CASE;
Table	Create Table
z0case	CREATE TABLE `z0case` (
  `T1` int(11) DEFAULT NULL
) ORGANIZATION INDEX DEFAULT CHARSET = gb18030 COLLATE = gb18030_bin ROW_FORMAT = DYNAMIC COMPRESSION = 'zstd_1.3.8' REPLICA_NUM = replica_num BLOCK_SIZE = 16384 USE_BLOOM_FILTER = FALSE ENABLE_MACRO_BLOCK_BLOOM_FILTER = FALSE TABLET_SIZE = 134217728 PCTFREE = 0 WITH COLUMN GROUP(all columns, each column)
SELECT * FROM Z0CASE;
T1
123
123
NULL
insert
INSERT INTO Z0CASE VALUES(111);
INSERT INTO Z0CASE VALUES('2001');
INSERT INTO Z0CASE VALUES('!*?< >aB12 中文');
ERROR HY000: Incorrect integer value for column 'T1' at row 1
INSERT INTO Z0CASE VALUES(b'0101101');
INSERT INTO Z0CASE VALUES('2021-10-01 12:23:35.54');
ERROR 01000: Data truncated for column 'T1' at row 1
INSERT INTO Z0CASE VALUES('2011-11-01');
ERROR 01000: Data truncated for column 'T1' at row 1
INSERT INTO Z0CASE VALUES('22:22:35');
ERROR 01000: Data truncated for column 'T1' at row 1
INSERT INTO Z0CASE VALUES(12.345);
INSERT INTO Z0CASE VALUES(null);
SELECT table_name,column_type,COLLATION_NAME,CHARACTER_SET_NAME FROM information_schema.columns WHERE table_name='Z0CASE';
table_name	column_type	COLLATION_NAME	CHARACTER_SET_NAME
z0case	int(11)	NULL	NULL
SHOW CREATE TABLE Z0CASE;
Table	Create Table
z0case	CREATE TABLE `z0case` (
  `T1` int(11) DEFAULT NULL
) ORGANIZATION INDEX DEFAULT CHARSET = gb18030 COLLATE = gb18030_bin ROW_FORMAT = DYNAMIC COMPRESSION = 'zstd_1.3.8' REPLICA_NUM = replica_num BLOCK_SIZE = 16384 USE_BLOOM_FILTER = FALSE ENABLE_MACRO_BLOCK_BLOOM_FILTER = FALSE TABLET_SIZE = 134217728 PCTFREE = 0 WITH COLUMN GROUP(all columns, each column)
SELECT * FROM Z0CASE;
T1
123
123
NULL
111
2001
45
12
NULL
update
UPDATE Z0CASE SET T1=NULL WHERE T1='111';
UPDATE Z0CASE SET T1='12:31:56' WHERE T1=2001;
ERROR 01000: Data truncated for column 'T1' at row 1
UPDATE Z0CASE SET T1=1221.34 WHERE T1=2001;
UPDATE Z0CASE SET T1='Aa1$< >中文' WHERE T1='111';
UPDATE Z0CASE SET T1=b'0101101' WHERE T1=111;
SELECT table_name,column_type,COLLATION_NAME,CHARACTER_SET_NAME FROM information_schema.columns WHERE table_name='Z0CASE';
table_name	column_type	COLLATION_NAME	CHARACTER_SET_NAME
z0case	int(11)	NULL	NULL
SHOW CREATE TABLE Z0CASE;
Table	Create Table
z0case	CREATE TABLE `z0case` (
  `T1` int(11) DEFAULT NULL
) ORGANIZATION INDEX DEFAULT CHARSET = gb18030 COLLATE = gb18030_bin ROW_FORMAT = DYNAMIC COMPRESSION = 'zstd_1.3.8' REPLICA_NUM = replica_num BLOCK_SIZE = 16384 USE_BLOOM_FILTER = FALSE ENABLE_MACRO_BLOCK_BLOOM_FILTER = FALSE TABLET_SIZE = 134217728 PCTFREE = 0 WITH COLUMN GROUP(all columns, each column)
SELECT * FROM Z0CASE;
T1
123
123
NULL
NULL
1221
45
12
NULL
delete
DELETE FROM Z0CASE WHERE T1=1221.34;
DELETE FROM Z0CASE WHERE T1 IS NULL;
SELECT * FROM Z0CASE;
T1
123
123
1221
45
12
FLOAT
DROP TABLE Z0CASE;
CREATE TABLE Z0CASE(T1 FLOAT(20,0)) DEFAULT charset= utf8mb4 DEFAULT collate = utf8mb4_general_ci with column group (all columns, each column);
INSERT INTO Z0CASE VALUES(123);
INSERT INTO Z0CASE VALUES('123.3445');
INSERT INTO Z0CASE VALUES(641231122123.5445);
INSERT INTO Z0CASE VALUES(NULL);
SELECT * FROM Z0CASE;
T1
123
123
641231093760
NULL
SELECT table_name,column_type,COLLATION_NAME,CHARACTER_SET_NAME FROM information_schema.columns WHERE table_name='Z0CASE';
table_name	column_type	COLLATION_NAME	CHARACTER_SET_NAME
z0case	float(20,0)	NULL	NULL
SHOW CREATE TABLE Z0CASE;
Table	Create Table
z0case	CREATE TABLE `z0case` (
  `T1` float(20,0) DEFAULT NULL
) ORGANIZATION INDEX DEFAULT CHARSET = utf8mb4 ROW_FORMAT = DYNAMIC COMPRESSION = 'zstd_1.3.8' REPLICA_NUM = replica_num BLOCK_SIZE = 16384 USE_BLOOM_FILTER = FALSE ENABLE_MACRO_BLOCK_BLOOM_FILTER = FALSE TABLET_SIZE = 134217728 PCTFREE = 0 WITH COLUMN GROUP(all columns, each column)
ALTER TABLE Z0CASE CONVERT TO CHARACTER SET 'gb18030' COLLATE 'gb18030_bin';
SHOW CREATE TABLE Z0CASE;
Table	Create Table
z0case	CREATE TABLE `z0case` (
  `T1` float(20,0) DEFAULT NULL
) ORGANIZATION INDEX DEFAULT CHARSET = gb18030 COLLATE = gb18030_bin ROW_FORMAT = DYNAMIC COMPRESSION = 'zstd_1.3.8' REPLICA_NUM = replica_num BLOCK_SIZE = 16384 USE_BLOOM_FILTER = FALSE ENABLE_MACRO_BLOCK_BLOOM_FILTER = FALSE TABLET_SIZE = 134217728 PCTFREE = 0 WITH COLUMN GROUP(all columns, each column)
SELECT * FROM Z0CASE;
T1
123
123
641231093760
NULL
insert
INSERT INTO Z0CASE VALUES(111);
INSERT INTO Z0CASE VALUES('2001');
INSERT INTO Z0CASE VALUES('!*?< >aB12 中文');
ERROR 01000: Data truncated for column 'T1' at row 1
INSERT INTO Z0CASE VALUES(b'0101101');
INSERT INTO Z0CASE VALUES('2021-10-01 12:23:35.54');
ERROR 01000: Data truncated for column 'T1' at row 1
INSERT INTO Z0CASE VALUES('2011-11-01');
ERROR 01000: Data truncated for column 'T1' at row 1
INSERT INTO Z0CASE VALUES('22:22:35');
ERROR 01000: Data truncated for column 'T1' at row 1
INSERT INTO Z0CASE VALUES(12.3456);
INSERT INTO Z0CASE VALUES(null);
SELECT table_name,column_type,COLLATION_NAME,CHARACTER_SET_NAME FROM information_schema.columns WHERE table_name='Z0CASE';
table_name	column_type	COLLATION_NAME	CHARACTER_SET_NAME
z0case	float(20,0)	NULL	NULL
SHOW CREATE TABLE Z0CASE;
Table	Create Table
z0case	CREATE TABLE `z0case` (
  `T1` float(20,0) DEFAULT NULL
) ORGANIZATION INDEX DEFAULT CHARSET = gb18030 COLLATE = gb18030_bin ROW_FORMAT = DYNAMIC COMPRESSION = 'zstd_1.3.8' REPLICA_NUM = replica_num BLOCK_SIZE = 16384 USE_BLOOM_FILTER = FALSE ENABLE_MACRO_BLOCK_BLOOM_FILTER = FALSE TABLET_SIZE = 134217728 PCTFREE = 0 WITH COLUMN GROUP(all columns, each column)
SELECT * FROM Z0CASE;
T1
123
123
641231093760
NULL
111
2001
45
12
NULL
update
UPDATE Z0CASE SET T1=NULL WHERE T1='111';
UPDATE Z0CASE SET T1='12:31:56' WHERE T1=2001;
ERROR 01000: Data truncated for column 'T1' at row 1
UPDATE Z0CASE SET T1=1221.34 WHERE T1=2001;
UPDATE Z0CASE SET T1='Aa1$< >中文' WHERE T1=111;
UPDATE Z0CASE SET T1=b'0101101' WHERE T1=111;
SELECT table_name,column_type,COLLATION_NAME,CHARACTER_SET_NAME FROM information_schema.columns WHERE table_name='Z0CASE';
table_name	column_type	COLLATION_NAME	CHARACTER_SET_NAME
z0case	float(20,0)	NULL	NULL
SHOW CREATE TABLE Z0CASE;
Table	Create Table
z0case	CREATE TABLE `z0case` (
  `T1` float(20,0) DEFAULT NULL
) ORGANIZATION INDEX DEFAULT CHARSET = gb18030 COLLATE = gb18030_bin ROW_FORMAT = DYNAMIC COMPRESSION = 'zstd_1.3.8' REPLICA_NUM = replica_num BLOCK_SIZE = 16384 USE_BLOOM_FILTER = FALSE ENABLE_MACRO_BLOCK_BLOOM_FILTER = FALSE TABLET_SIZE = 134217728 PCTFREE = 0 WITH COLUMN GROUP(all columns, each column)
SELECT * FROM Z0CASE;
T1
123
123
641231093760
NULL
NULL
1221
45
12
NULL
delete
DELETE FROM Z0CASE WHERE T1=1221.34;
DELETE FROM Z0CASE WHERE T1 IS NULL;
SELECT * FROM Z0CASE;
T1
123
123
641231093760
1221
45
12
DATE
DROP TABLE Z0CASE;
CREATE TABLE Z0CASE(T1 DATE) DEFAULT charset= utf8mb4 DEFAULT collate = utf8mb4_general_ci with column group (all columns, each column);
INSERT INTO Z0CASE VALUES('20210321');
INSERT INTO Z0CASE VALUES('2020-11-21');
INSERT INTO Z0CASE VALUES('2021-01-21 11:58:39.456');
INSERT INTO Z0CASE VALUES(NULL);
SELECT * FROM Z0CASE;
T1
2021-03-21
2020-11-21
2021-01-21
NULL
SELECT table_name,column_type,COLLATION_NAME,CHARACTER_SET_NAME FROM information_schema.columns WHERE table_name='Z0CASE';
table_name	column_type	COLLATION_NAME	CHARACTER_SET_NAME
z0case	date	NULL	NULL
SHOW CREATE TABLE Z0CASE;
Table	Create Table
z0case	CREATE TABLE `z0case` (
  `T1` date DEFAULT NULL
) ORGANIZATION INDEX DEFAULT CHARSET = utf8mb4 ROW_FORMAT = DYNAMIC COMPRESSION = 'zstd_1.3.8' REPLICA_NUM = replica_num BLOCK_SIZE = 16384 USE_BLOOM_FILTER = FALSE ENABLE_MACRO_BLOCK_BLOOM_FILTER = FALSE TABLET_SIZE = 134217728 PCTFREE = 0 WITH COLUMN GROUP(all columns, each column)
ALTER TABLE Z0CASE CONVERT TO CHARACTER SET 'gb18030' COLLATE 'gb18030_bin';
SHOW CREATE TABLE Z0CASE;
Table	Create Table
z0case	CREATE TABLE `z0case` (
  `T1` date DEFAULT NULL
) ORGANIZATION INDEX DEFAULT CHARSET = gb18030 COLLATE = gb18030_bin ROW_FORMAT = DYNAMIC COMPRESSION = 'zstd_1.3.8' REPLICA_NUM = replica_num BLOCK_SIZE = 16384 USE_BLOOM_FILTER = FALSE ENABLE_MACRO_BLOCK_BLOOM_FILTER = FALSE TABLET_SIZE = 134217728 PCTFREE = 0 WITH COLUMN GROUP(all columns, each column)
SELECT * FROM Z0CASE;
T1
2021-03-21
2020-11-21
2021-01-21
NULL
insert
INSERT INTO Z0CASE VALUES(111);
INSERT INTO Z0CASE VALUES('2001');
ERROR 22007: Incorrect datetime value for column 'T1' at row 1
INSERT INTO Z0CASE VALUES('!*?< >aB12 中文');
ERROR 22007: Incorrect datetime value for column 'T1' at row 1
INSERT INTO Z0CASE VALUES(b'0101101');
ERROR 22007: Incorrect datetime value for column 'T1' at row 1
INSERT INTO Z0CASE VALUES('2021-10-01 12:23:35.54');
INSERT INTO Z0CASE VALUES('2011-11-01');
INSERT INTO Z0CASE VALUES('22:22:35');
ERROR 22007: Incorrect datetime value for column 'T1' at row 1
INSERT INTO Z0CASE VALUES(12.3456);
ERROR 22007: Incorrect datetime value for column 'T1' at row 1
INSERT INTO Z0CASE VALUES(null);
SELECT table_name,column_type,COLLATION_NAME,CHARACTER_SET_NAME FROM information_schema.columns WHERE table_name='Z0CASE';
table_name	column_type	COLLATION_NAME	CHARACTER_SET_NAME
z0case	date	NULL	NULL
SHOW CREATE TABLE Z0CASE;
Table	Create Table
z0case	CREATE TABLE `z0case` (
  `T1` date DEFAULT NULL
) ORGANIZATION INDEX DEFAULT CHARSET = gb18030 COLLATE = gb18030_bin ROW_FORMAT = DYNAMIC COMPRESSION = 'zstd_1.3.8' REPLICA_NUM = replica_num BLOCK_SIZE = 16384 USE_BLOOM_FILTER = FALSE ENABLE_MACRO_BLOCK_BLOOM_FILTER = FALSE TABLET_SIZE = 134217728 PCTFREE = 0 WITH COLUMN GROUP(all columns, each column)
SELECT * FROM Z0CASE;
T1
2021-03-21
2020-11-21
2021-01-21
NULL
2000-01-11
2021-10-01
2011-11-01
NULL
update
UPDATE Z0CASE SET T1=NULL WHERE T1='2020-11-21';
UPDATE Z0CASE SET T1='12:31:56' WHERE T1='2021-01-21';
ERROR 22007: Incorrect datetime value for column 'T1' at row 1
UPDATE Z0CASE SET T1=1221.34 WHERE T1='2021-01-21';
ERROR 22007: Incorrect datetime value for column 'T1' at row 1
UPDATE Z0CASE SET T1='Aa1$< >中文' WHERE T1='2021-01-21';
ERROR 22007: Incorrect datetime value for column 'T1' at row 1
UPDATE Z0CASE SET T1=b'0101101' WHERE T1='2021-01-21';
ERROR 22007: Incorrect datetime value for column 'T1' at row 1
UPDATE Z0CASE SET T1='2011-11-11' WHERE T1='2021-01-21';
UPDATE Z0CASE SET T1='2012-12-21 09:10:21' WHERE T1='2011-11-11';
SELECT table_name,column_type,COLLATION_NAME,CHARACTER_SET_NAME FROM information_schema.columns WHERE table_name='Z0CASE';
table_name	column_type	COLLATION_NAME	CHARACTER_SET_NAME
z0case	date	NULL	NULL
SHOW CREATE TABLE Z0CASE;
Table	Create Table
z0case	CREATE TABLE `z0case` (
  `T1` date DEFAULT NULL
) ORGANIZATION INDEX DEFAULT CHARSET = gb18030 COLLATE = gb18030_bin ROW_FORMAT = DYNAMIC COMPRESSION = 'zstd_1.3.8' REPLICA_NUM = replica_num BLOCK_SIZE = 16384 USE_BLOOM_FILTER = FALSE ENABLE_MACRO_BLOCK_BLOOM_FILTER = FALSE TABLET_SIZE = 134217728 PCTFREE = 0 WITH COLUMN GROUP(all columns, each column)
SELECT * FROM Z0CASE;
T1
2021-03-21
NULL
2012-12-21
NULL
2000-01-11
2021-10-01
2011-11-01
NULL
delete
DELETE FROM Z0CASE WHERE T1='2012-12-21';
DELETE FROM Z0CASE WHERE T1 IS NULL;
SELECT * FROM Z0CASE;
T1
2021-03-21
2000-01-11
2021-10-01
2011-11-01
TIME
DROP TABLE Z0CASE;
CREATE TABLE Z0CASE(T1 TIME) DEFAULT charset= utf8mb4 DEFAULT collate = utf8mb4_general_ci with column group (all columns, each column);
INSERT INTO Z0CASE VALUES('2020-11-21');
INSERT INTO Z0CASE VALUES('2021-01-21 11:58:39.456');
INSERT INTO Z0CASE VALUES('21:28:33.556');
INSERT INTO Z0CASE VALUES('2001');
INSERT INTO Z0CASE VALUES(NULL);
SELECT * FROM Z0CASE;
T1
00:20:20
11:58:39
21:28:34
00:20:01
NULL
SELECT table_name,column_type,COLLATION_NAME,CHARACTER_SET_NAME FROM information_schema.columns WHERE table_name='Z0CASE';
table_name	column_type	COLLATION_NAME	CHARACTER_SET_NAME
z0case	time	NULL	NULL
SHOW CREATE TABLE Z0CASE;
Table	Create Table
z0case	CREATE TABLE `z0case` (
  `T1` time DEFAULT NULL
) ORGANIZATION INDEX DEFAULT CHARSET = utf8mb4 ROW_FORMAT = DYNAMIC COMPRESSION = 'zstd_1.3.8' REPLICA_NUM = replica_num BLOCK_SIZE = 16384 USE_BLOOM_FILTER = FALSE ENABLE_MACRO_BLOCK_BLOOM_FILTER = FALSE TABLET_SIZE = 134217728 PCTFREE = 0 WITH COLUMN GROUP(all columns, each column)
ALTER TABLE Z0CASE CONVERT TO CHARACTER SET 'gb18030' COLLATE 'gb18030_bin';
SHOW CREATE TABLE Z0CASE;
Table	Create Table
z0case	CREATE TABLE `z0case` (
  `T1` time DEFAULT NULL
) ORGANIZATION INDEX DEFAULT CHARSET = gb18030 COLLATE = gb18030_bin ROW_FORMAT = DYNAMIC COMPRESSION = 'zstd_1.3.8' REPLICA_NUM = replica_num BLOCK_SIZE = 16384 USE_BLOOM_FILTER = FALSE ENABLE_MACRO_BLOCK_BLOOM_FILTER = FALSE TABLET_SIZE = 134217728 PCTFREE = 0 WITH COLUMN GROUP(all columns, each column)
SELECT * FROM Z0CASE;
T1
00:20:20
11:58:39
21:28:34
00:20:01
NULL
insert
INSERT INTO Z0CASE VALUES(71);
ERROR 22007: Incorrect datetime value for column 'T1' at row 1
INSERT INTO Z0CASE VALUES('2001');
INSERT INTO Z0CASE VALUES('!*?< >aB12 中文');
ERROR 22007: Incorrect value
INSERT INTO Z0CASE VALUES(b'0101101');
INSERT INTO Z0CASE VALUES('2021-10-01 12:23:35.54');
INSERT INTO Z0CASE VALUES('2011-11-01');
INSERT INTO Z0CASE VALUES('22:22:35');
INSERT INTO Z0CASE VALUES(72.7476);
ERROR 22007: Incorrect datetime value for column 'T1' at row 1
INSERT INTO Z0CASE VALUES(null);
SELECT table_name,column_type,COLLATION_NAME,CHARACTER_SET_NAME FROM information_schema.columns WHERE table_name='Z0CASE';
table_name	column_type	COLLATION_NAME	CHARACTER_SET_NAME
z0case	time	NULL	NULL
SHOW CREATE TABLE Z0CASE;
Table	Create Table
z0case	CREATE TABLE `z0case` (
  `T1` time DEFAULT NULL
) ORGANIZATION INDEX DEFAULT CHARSET = gb18030 COLLATE = gb18030_bin ROW_FORMAT = DYNAMIC COMPRESSION = 'zstd_1.3.8' REPLICA_NUM = replica_num BLOCK_SIZE = 16384 USE_BLOOM_FILTER = FALSE ENABLE_MACRO_BLOCK_BLOOM_FILTER = FALSE TABLET_SIZE = 134217728 PCTFREE = 0 WITH COLUMN GROUP(all columns, each column)
SELECT * FROM Z0CASE;
T1
00:20:20
11:58:39
21:28:34
00:20:01
NULL
00:20:01
00:00:00
12:23:36
00:20:11
22:22:35
NULL
update
UPDATE Z0CASE SET T1=NULL WHERE T1='22:22:35';
UPDATE Z0CASE SET T1='12:31:56' WHERE T1='21:28:34';
UPDATE Z0CASE SET T1=1221.34 WHERE T1='12:31:56';
UPDATE Z0CASE SET T1='Aa1$< >中文' WHERE T1='12:31:56';
UPDATE Z0CASE SET T1=b'0101101' WHERE T1='12:31:56';
UPDATE Z0CASE SET T1='2011-11-11' WHERE T1='12:31:56';
UPDATE Z0CASE SET T1='2012-12-21 09:10:21' WHERE T1='12:31:56';
SELECT table_name,column_type,COLLATION_NAME,CHARACTER_SET_NAME FROM information_schema.columns WHERE table_name='Z0CASE';
table_name	column_type	COLLATION_NAME	CHARACTER_SET_NAME
z0case	time	NULL	NULL
SHOW CREATE TABLE Z0CASE;
Table	Create Table
z0case	CREATE TABLE `z0case` (
  `T1` time DEFAULT NULL
) ORGANIZATION INDEX DEFAULT CHARSET = gb18030 COLLATE = gb18030_bin ROW_FORMAT = DYNAMIC COMPRESSION = 'zstd_1.3.8' REPLICA_NUM = replica_num BLOCK_SIZE = 16384 USE_BLOOM_FILTER = FALSE ENABLE_MACRO_BLOCK_BLOOM_FILTER = FALSE TABLET_SIZE = 134217728 PCTFREE = 0 WITH COLUMN GROUP(all columns, each column)
SELECT * FROM Z0CASE;
T1
00:20:20
11:58:39
00:12:21
00:20:01
NULL
00:20:01
00:00:00
12:23:36
00:20:11
NULL
NULL
delete
DELETE FROM Z0CASE WHERE T1='09:10:21';
DELETE FROM Z0CASE WHERE T1 IS NULL;
SELECT * FROM Z0CASE;
T1
00:20:20
11:58:39
00:12:21
00:20:01
00:20:01
00:00:00
12:23:36
00:20:11
DROP TABLE Z0CASE;
