drop table if exists t1,t2;
create table t1 (a float not null, primary key(a))  partition by key (a) partitions 4;
show create table t1;
Table	Create Table
t1	CREATE TABLE `t1` (
  `a` float NOT NULL,
  PRIMARY KEY (`a`)
) ORGANIZATION INDEX DEFAULT CHARSET = utf8mb4 COMPRESSION = 'lz4_1.0' REPLICA_NUM = 1 BLOCK_SIZE = 16384 USE_BLOOM_FILTER = FALSE ENABLE_MACRO_BLOCK_BLOOM_FILTER = FALSE TABLET_SIZE = 134217728 PCTFREE = 10
 partition by key(a)
(partition `p0`,
partition `p1`,
partition `p2`,
partition `p3`)
insert into t1 values (-3.402823466E+38);
insert into t1 values (3.402823466E+38);
insert into t1 values (-1.5);
insert into t1 values (-1);
insert into t1 values (0);
insert into t1 values (1);
insert into t1 values (1.5);
select * from t1;
a
-3.40282e38
-1
0
1
1.5
3.40282e38
-1.5
select * from t1 where a=1.5;
a
1.5
delete from t1 where a=1.5;
select * from t1;
a
-3.40282e38
-1
0
1
3.40282e38
-1.5
drop table t1;
create table t2 (a float not null, primary key(a))  partition by key (a) partitions 10;
show create table t2;
Table	Create Table
t2	CREATE TABLE `t2` (
  `a` float NOT NULL,
  PRIMARY KEY (`a`)
) ORGANIZATION INDEX DEFAULT CHARSET = utf8mb4 COMPRESSION = 'lz4_1.0' REPLICA_NUM = 1 BLOCK_SIZE = 16384 USE_BLOOM_FILTER = FALSE ENABLE_MACRO_BLOCK_BLOOM_FILTER = FALSE TABLET_SIZE = 134217728 PCTFREE = 10
 partition by key(a)
(partition `p0`,
partition `p1`,
partition `p2`,
partition `p3`,
partition `p4`,
partition `p5`,
partition `p6`,
partition `p7`,
partition `p8`,
partition `p9`)
insert into t2 values (-3.402823466E+38);
insert into t2 values (-3.402823466E+37);
insert into t2 values (-123.456);
insert into t2 values (0);
insert into t2 values (1234546.789);
insert into t2 values (123.456);
insert into t2 values (1.5);
select * from t2;
a
0
-3.40282e37
123.456
1234550
-123.456
1.5
-3.40282e38
select * from t2 where a=123.456;
a
delete from t2 where a=123.456;
select * from t2;
a
0
-3.40282e37
123.456
1234550
-123.456
1.5
-3.40282e38
select * from t2 where a=1.5;
a
1.5
delete from t2 where a=1.5;
select * from t2;
a
0
-3.40282e37
123.456
1234550
-123.456
-3.40282e38
delete from t2;
1024*3 inserts;
select count(*) from t2;
count(*)
3072
drop table t2;
drop table if exists t1,t2;
create table t1 (a double not null, primary key(a))  partition by key (a) partitions 4;
show create table t1;
Table	Create Table
t1	CREATE TABLE `t1` (
  `a` double NOT NULL,
  PRIMARY KEY (`a`)
) ORGANIZATION INDEX DEFAULT CHARSET = utf8mb4 COMPRESSION = 'lz4_1.0' REPLICA_NUM = 1 BLOCK_SIZE = 16384 USE_BLOOM_FILTER = FALSE ENABLE_MACRO_BLOCK_BLOOM_FILTER = FALSE TABLET_SIZE = 134217728 PCTFREE = 10
 partition by key(a)
(partition `p0`,
partition `p1`,
partition `p2`,
partition `p3`)
insert into t1 values (-2.2250738585072014E+208);
insert into t1 values (-2.2250738585072014E-208);
insert into t1 values (-1.5);
insert into t1 values (-1);
insert into t1 values (0);
insert into t1 values (1.5);
insert into t1 values (1234.567);
insert into t1 values (2.2250738585072014E+208);
select * from t1;
a
1234.567
-2.2250738585072016e208
-1
-2.2250738585072014e-208
0
2.2250738585072016e208
1.5
-1.5
select * from t1 where a=1.5;
a
1.5
delete from t1 where a=1.5;
select * from t1;
a
1234.567
-2.2250738585072016e208
-1
-2.2250738585072014e-208
0
2.2250738585072016e208
-1.5
drop table t1;
create table t2 (a double not null, primary key(a))  partition by key (a) partitions 10;
show create table t2;
Table	Create Table
t2	CREATE TABLE `t2` (
  `a` double NOT NULL,
  PRIMARY KEY (`a`)
) ORGANIZATION INDEX DEFAULT CHARSET = utf8mb4 COMPRESSION = 'lz4_1.0' REPLICA_NUM = 1 BLOCK_SIZE = 16384 USE_BLOOM_FILTER = FALSE ENABLE_MACRO_BLOCK_BLOOM_FILTER = FALSE TABLET_SIZE = 134217728 PCTFREE = 10
 partition by key(a)
(partition `p0`,
partition `p1`,
partition `p2`,
partition `p3`,
partition `p4`,
partition `p5`,
partition `p6`,
partition `p7`,
partition `p8`,
partition `p9`)
insert into t2 values (-2.2250738585072014E+208);
insert into t2 values (-2.2250738585072014E-208);
insert into t2 values (-1.5);
insert into t2 values (-1);
insert into t2 values (0);
insert into t2 values (1.5);
insert into t2 values (1234.567);
insert into t2 values (2.2250738585072014E+208);
select * from t2;
a
1234.567
-1.5
0
2.2250738585072016e208
-2.2250738585072016e208
-1
-2.2250738585072014e-208
1.5
select * from t2 where a=1234.567;
a
1234.567
delete from t2 where a=1234.567;
select * from t2;
a
-1.5
0
2.2250738585072016e208
-2.2250738585072016e208
-1
-2.2250738585072014e-208
1.5
delete from t2;
1024*3 inserts;
select count(*) from t2;
count(*)
3072
drop table t2;
