drop table if exists t1,t2;
create table t1 (a decimal(10,4) not null, primary key(a))  
partition by key (a) ;
show create table t1;
Table	Create Table
t1	CREATE TABLE `t1` (
  `a` decimal(10,4) NOT NULL,
  PRIMARY KEY (`a`)
) ORGANIZATION INDEX DEFAULT CHARSET = utf8mb4 COMPRESSION = 'lz4_1.0' REPLICA_NUM = 1 BLOCK_SIZE = 16384 USE_BLOOM_FILTER = FALSE ENABLE_MACRO_BLOCK_BLOOM_FILTER = FALSE TABLET_SIZE = 134217728 PCTFREE = 10
 partition by key(a)
(partition `p0`)
insert into t1 values (999999.9999), (-999999.9999), (123456.7899), (-123456.7899), (-1.5), (1), (0), (-1), (1.5), (1234.567), (-1234.567);
select * from t1 order by a;
a
-999999.9999
-123456.7899
-1234.5670
-1.5000
-1.0000
0.0000
1.0000
1.5000
1234.5670
123456.7899
999999.9999
select * from t1 where a=1234.567;
a
1234.5670
delete from t1 where a=1234.567;
select * from t1 order by a;
a
-999999.9999
-123456.7899
-1234.5670
-1.5000
-1.0000
0.0000
1.0000
1.5000
123456.7899
999999.9999
drop table t1;
create table t2 (a decimal(18,9) not null, primary key(a))  
partition by key (a) partitions 10;
show create table t2;
Table	Create Table
t2	CREATE TABLE `t2` (
  `a` decimal(18,9) NOT NULL,
  PRIMARY KEY (`a`)
) ORGANIZATION INDEX DEFAULT CHARSET = utf8mb4 COMPRESSION = 'lz4_1.0' REPLICA_NUM = 1 BLOCK_SIZE = 16384 USE_BLOOM_FILTER = FALSE ENABLE_MACRO_BLOCK_BLOOM_FILTER = FALSE TABLET_SIZE = 134217728 PCTFREE = 10
 partition by key(a)
(partition `p0`,
partition `p1`,
partition `p2`,
partition `p3`,
partition `p4`,
partition `p5`,
partition `p6`,
partition `p7`,
partition `p8`,
partition `p9`)
insert into t2 values (999999999.999999999);
insert into t2 values (-999999999.999999999);
insert into t2 values (-1.5);
insert into t2 values (-1);
insert into t2 values (0);
insert into t2 values (1.5);
insert into t2 values (1234.567);
insert into t2 values (-1234.567);
select * from t2 order by a;
a
-999999999.999999999
-1234.567000000
-1.500000000
-1.000000000
0.000000000
1.500000000
1234.567000000
999999999.999999999
select * from t2 where a=1234.567;
a
1234.567000000
delete from t2 where a=1234.567;
select * from t2 order by a;
a
-999999999.999999999
-1234.567000000
-1.500000000
-1.000000000
0.000000000
1.500000000
999999999.999999999
delete from t2;
1024*3 inserts;
select count(*) from t2;
count(*)
3072
select * from t2 order by a;
a
1.000000000
1.333333333
1.755555555
2.000000000
2.333333333
2.755555555
3.000000000
3.333333333
3.755555555
4.000000000
4.333333333
4.755555555
5.000000000
5.333333333
5.755555555
6.000000000
6.333333333
6.755555555
7.000000000
7.333333333
7.755555555
8.000000000
8.333333333
8.755555555
9.000000000
9.333333333
9.755555555
10.000000000
10.333333333
10.755555555
11.000000000
11.333333333
11.755555555
12.000000000
12.333333333
12.755555555
13.000000000
13.333333333
13.755555555
14.000000000
14.333333333
14.755555555
15.000000000
15.333333333
15.755555555
16.000000000
16.333333333
16.755555555
17.000000000
17.333333333
17.755555555
18.000000000
18.333333333
18.755555555
19.000000000
19.333333333
19.755555555
20.000000000
20.333333333
20.755555555
21.000000000
21.333333333
21.755555555
22.000000000
22.333333333
22.755555555
23.000000000
23.333333333
23.755555555
24.000000000
24.333333333
24.755555555
25.000000000
25.333333333
25.755555555
26.000000000
26.333333333
26.755555555
27.000000000
27.333333333
27.755555555
28.000000000
28.333333333
28.755555555
29.000000000
29.333333333
29.755555555
30.000000000
30.333333333
30.755555555
31.000000000
31.333333333
31.755555555
32.000000000
32.333333333
32.755555555
33.000000000
33.333333333
33.755555555
34.000000000
34.333333333
34.755555555
35.000000000
35.333333333
35.755555555
36.000000000
36.333333333
36.755555555
37.000000000
37.333333333
37.755555555
38.000000000
38.333333333
38.755555555
39.000000000
39.333333333
39.755555555
40.000000000
40.333333333
40.755555555
41.000000000
41.333333333
41.755555555
42.000000000
42.333333333
42.755555555
43.000000000
43.333333333
43.755555555
44.000000000
44.333333333
44.755555555
45.000000000
45.333333333
45.755555555
46.000000000
46.333333333
46.755555555
47.000000000
47.333333333
47.755555555
48.000000000
48.333333333
48.755555555
49.000000000
49.333333333
49.755555555
50.000000000
50.333333333
50.755555555
51.000000000
51.333333333
51.755555555
52.000000000
52.333333333
52.755555555
53.000000000
53.333333333
53.755555555
54.000000000
54.333333333
54.755555555
55.000000000
55.333333333
55.755555555
56.000000000
56.333333333
56.755555555
57.000000000
57.333333333
57.755555555
58.000000000
58.333333333
58.755555555
59.000000000
59.333333333
59.755555555
60.000000000
60.333333333
60.755555555
61.000000000
61.333333333
61.755555555
62.000000000
62.333333333
62.755555555
63.000000000
63.333333333
63.755555555
64.000000000
64.333333333
64.755555555
65.000000000
65.333333333
65.755555555
66.000000000
66.333333333
66.755555555
67.000000000
67.333333333
67.755555555
68.000000000
68.333333333
68.755555555
69.000000000
69.333333333
69.755555555
70.000000000
70.333333333
70.755555555
71.000000000
71.333333333
71.755555555
72.000000000
72.333333333
72.755555555
73.000000000
73.333333333
73.755555555
74.000000000
74.333333333
74.755555555
75.000000000
75.333333333
75.755555555
76.000000000
76.333333333
76.755555555
77.000000000
77.333333333
77.755555555
78.000000000
78.333333333
78.755555555
79.000000000
79.333333333
79.755555555
80.000000000
80.333333333
80.755555555
81.000000000
81.333333333
81.755555555
82.000000000
82.333333333
82.755555555
83.000000000
83.333333333
83.755555555
84.000000000
84.333333333
84.755555555
85.000000000
85.333333333
85.755555555
86.000000000
86.333333333
86.755555555
87.000000000
87.333333333
87.755555555
88.000000000
88.333333333
88.755555555
89.000000000
89.333333333
89.755555555
90.000000000
90.333333333
90.755555555
91.000000000
91.333333333
91.755555555
92.000000000
92.333333333
92.755555555
93.000000000
93.333333333
93.755555555
94.000000000
94.333333333
94.755555555
95.000000000
95.333333333
95.755555555
96.000000000
96.333333333
96.755555555
97.000000000
97.333333333
97.755555555
98.000000000
98.333333333
98.755555555
99.000000000
99.333333333
99.755555555
100.000000000
100.333333333
100.755555555
101.000000000
101.333333333
101.755555555
102.000000000
102.333333333
102.755555555
103.000000000
103.333333333
103.755555555
104.000000000
104.333333333
104.755555555
105.000000000
105.333333333
105.755555555
106.000000000
106.333333333
106.755555555
107.000000000
107.333333333
107.755555555
108.000000000
108.333333333
108.755555555
109.000000000
109.333333333
109.755555555
110.000000000
110.333333333
110.755555555
111.000000000
111.333333333
111.755555555
112.000000000
112.333333333
112.755555555
113.000000000
113.333333333
113.755555555
114.000000000
114.333333333
114.755555555
115.000000000
115.333333333
115.755555555
116.000000000
116.333333333
116.755555555
117.000000000
117.333333333
117.755555555
118.000000000
118.333333333
118.755555555
119.000000000
119.333333333
119.755555555
120.000000000
120.333333333
120.755555555
121.000000000
121.333333333
121.755555555
122.000000000
122.333333333
122.755555555
123.000000000
123.333333333
123.755555555
124.000000000
124.333333333
124.755555555
125.000000000
125.333333333
125.755555555
126.000000000
126.333333333
126.755555555
127.000000000
127.333333333
127.755555555
128.000000000
128.333333333
128.755555555
129.000000000
129.333333333
129.755555555
130.000000000
130.333333333
130.755555555
131.000000000
131.333333333
131.755555555
132.000000000
132.333333333
132.755555555
133.000000000
133.333333333
133.755555555
134.000000000
134.333333333
134.755555555
135.000000000
135.333333333
135.755555555
136.000000000
136.333333333
136.755555555
137.000000000
137.333333333
137.755555555
138.000000000
138.333333333
138.755555555
139.000000000
139.333333333
139.755555555
140.000000000
140.333333333
140.755555555
141.000000000
141.333333333
141.755555555
142.000000000
142.333333333
142.755555555
143.000000000
143.333333333
143.755555555
144.000000000
144.333333333
144.755555555
145.000000000
145.333333333
145.755555555
146.000000000
146.333333333
146.755555555
147.000000000
147.333333333
147.755555555
148.000000000
148.333333333
148.755555555
149.000000000
149.333333333
149.755555555
150.000000000
150.333333333
150.755555555
151.000000000
151.333333333
151.755555555
152.000000000
152.333333333
152.755555555
153.000000000
153.333333333
153.755555555
154.000000000
154.333333333
154.755555555
155.000000000
155.333333333
155.755555555
156.000000000
156.333333333
156.755555555
157.000000000
157.333333333
157.755555555
158.000000000
158.333333333
158.755555555
159.000000000
159.333333333
159.755555555
160.000000000
160.333333333
160.755555555
161.000000000
161.333333333
161.755555555
162.000000000
162.333333333
162.755555555
163.000000000
163.333333333
163.755555555
164.000000000
164.333333333
164.755555555
165.000000000
165.333333333
165.755555555
166.000000000
166.333333333
166.755555555
167.000000000
167.333333333
167.755555555
168.000000000
168.333333333
168.755555555
169.000000000
169.333333333
169.755555555
170.000000000
170.333333333
170.755555555
171.000000000
171.333333333
171.755555555
172.000000000
172.333333333
172.755555555
173.000000000
173.333333333
173.755555555
174.000000000
174.333333333
174.755555555
175.000000000
175.333333333
175.755555555
176.000000000
176.333333333
176.755555555
177.000000000
177.333333333
177.755555555
178.000000000
178.333333333
178.755555555
179.000000000
179.333333333
179.755555555
180.000000000
180.333333333
180.755555555
181.000000000
181.333333333
181.755555555
182.000000000
182.333333333
182.755555555
183.000000000
183.333333333
183.755555555
184.000000000
184.333333333
184.755555555
185.000000000
185.333333333
185.755555555
186.000000000
186.333333333
186.755555555
187.000000000
187.333333333
187.755555555
188.000000000
188.333333333
188.755555555
189.000000000
189.333333333
189.755555555
190.000000000
190.333333333
190.755555555
191.000000000
191.333333333
191.755555555
192.000000000
192.333333333
192.755555555
193.000000000
193.333333333
193.755555555
194.000000000
194.333333333
194.755555555
195.000000000
195.333333333
195.755555555
196.000000000
196.333333333
196.755555555
197.000000000
197.333333333
197.755555555
198.000000000
198.333333333
198.755555555
199.000000000
199.333333333
199.755555555
200.000000000
200.333333333
200.755555555
201.000000000
201.333333333
201.755555555
202.000000000
202.333333333
202.755555555
203.000000000
203.333333333
203.755555555
204.000000000
204.333333333
204.755555555
205.000000000
205.333333333
205.755555555
206.000000000
206.333333333
206.755555555
207.000000000
207.333333333
207.755555555
208.000000000
208.333333333
208.755555555
209.000000000
209.333333333
209.755555555
210.000000000
210.333333333
210.755555555
211.000000000
211.333333333
211.755555555
212.000000000
212.333333333
212.755555555
213.000000000
213.333333333
213.755555555
214.000000000
214.333333333
214.755555555
215.000000000
215.333333333
215.755555555
216.000000000
216.333333333
216.755555555
217.000000000
217.333333333
217.755555555
218.000000000
218.333333333
218.755555555
219.000000000
219.333333333
219.755555555
220.000000000
220.333333333
220.755555555
221.000000000
221.333333333
221.755555555
222.000000000
222.333333333
222.755555555
223.000000000
223.333333333
223.755555555
224.000000000
224.333333333
224.755555555
225.000000000
225.333333333
225.755555555
226.000000000
226.333333333
226.755555555
227.000000000
227.333333333
227.755555555
228.000000000
228.333333333
228.755555555
229.000000000
229.333333333
229.755555555
230.000000000
230.333333333
230.755555555
231.000000000
231.333333333
231.755555555
232.000000000
232.333333333
232.755555555
233.000000000
233.333333333
233.755555555
234.000000000
234.333333333
234.755555555
235.000000000
235.333333333
235.755555555
236.000000000
236.333333333
236.755555555
237.000000000
237.333333333
237.755555555
238.000000000
238.333333333
238.755555555
239.000000000
239.333333333
239.755555555
240.000000000
240.333333333
240.755555555
241.000000000
241.333333333
241.755555555
242.000000000
242.333333333
242.755555555
243.000000000
243.333333333
243.755555555
244.000000000
244.333333333
244.755555555
245.000000000
245.333333333
245.755555555
246.000000000
246.333333333
246.755555555
247.000000000
247.333333333
247.755555555
248.000000000
248.333333333
248.755555555
249.000000000
249.333333333
249.755555555
250.000000000
250.333333333
250.755555555
251.000000000
251.333333333
251.755555555
252.000000000
252.333333333
252.755555555
253.000000000
253.333333333
253.755555555
254.000000000
254.333333333
254.755555555
255.000000000
255.333333333
255.755555555
256.000000000
256.333333333
256.755555555
257.000000000
257.333333333
257.755555555
258.000000000
258.333333333
258.755555555
259.000000000
259.333333333
259.755555555
260.000000000
260.333333333
260.755555555
261.000000000
261.333333333
261.755555555
262.000000000
262.333333333
262.755555555
263.000000000
263.333333333
263.755555555
264.000000000
264.333333333
264.755555555
265.000000000
265.333333333
265.755555555
266.000000000
266.333333333
266.755555555
267.000000000
267.333333333
267.755555555
268.000000000
268.333333333
268.755555555
269.000000000
269.333333333
269.755555555
270.000000000
270.333333333
270.755555555
271.000000000
271.333333333
271.755555555
272.000000000
272.333333333
272.755555555
273.000000000
273.333333333
273.755555555
274.000000000
274.333333333
274.755555555
275.000000000
275.333333333
275.755555555
276.000000000
276.333333333
276.755555555
277.000000000
277.333333333
277.755555555
278.000000000
278.333333333
278.755555555
279.000000000
279.333333333
279.755555555
280.000000000
280.333333333
280.755555555
281.000000000
281.333333333
281.755555555
282.000000000
282.333333333
282.755555555
283.000000000
283.333333333
283.755555555
284.000000000
284.333333333
284.755555555
285.000000000
285.333333333
285.755555555
286.000000000
286.333333333
286.755555555
287.000000000
287.333333333
287.755555555
288.000000000
288.333333333
288.755555555
289.000000000
289.333333333
289.755555555
290.000000000
290.333333333
290.755555555
291.000000000
291.333333333
291.755555555
292.000000000
292.333333333
292.755555555
293.000000000
293.333333333
293.755555555
294.000000000
294.333333333
294.755555555
295.000000000
295.333333333
295.755555555
296.000000000
296.333333333
296.755555555
297.000000000
297.333333333
297.755555555
298.000000000
298.333333333
298.755555555
299.000000000
299.333333333
299.755555555
300.000000000
300.333333333
300.755555555
301.000000000
301.333333333
301.755555555
302.000000000
302.333333333
302.755555555
303.000000000
303.333333333
303.755555555
304.000000000
304.333333333
304.755555555
305.000000000
305.333333333
305.755555555
306.000000000
306.333333333
306.755555555
307.000000000
307.333333333
307.755555555
308.000000000
308.333333333
308.755555555
309.000000000
309.333333333
309.755555555
310.000000000
310.333333333
310.755555555
311.000000000
311.333333333
311.755555555
312.000000000
312.333333333
312.755555555
313.000000000
313.333333333
313.755555555
314.000000000
314.333333333
314.755555555
315.000000000
315.333333333
315.755555555
316.000000000
316.333333333
316.755555555
317.000000000
317.333333333
317.755555555
318.000000000
318.333333333
318.755555555
319.000000000
319.333333333
319.755555555
320.000000000
320.333333333
320.755555555
321.000000000
321.333333333
321.755555555
322.000000000
322.333333333
322.755555555
323.000000000
323.333333333
323.755555555
324.000000000
324.333333333
324.755555555
325.000000000
325.333333333
325.755555555
326.000000000
326.333333333
326.755555555
327.000000000
327.333333333
327.755555555
328.000000000
328.333333333
328.755555555
329.000000000
329.333333333
329.755555555
330.000000000
330.333333333
330.755555555
331.000000000
331.333333333
331.755555555
332.000000000
332.333333333
332.755555555
333.000000000
333.333333333
333.755555555
334.000000000
334.333333333
334.755555555
335.000000000
335.333333333
335.755555555
336.000000000
336.333333333
336.755555555
337.000000000
337.333333333
337.755555555
338.000000000
338.333333333
338.755555555
339.000000000
339.333333333
339.755555555
340.000000000
340.333333333
340.755555555
341.000000000
341.333333333
341.755555555
342.000000000
342.333333333
342.755555555
343.000000000
343.333333333
343.755555555
344.000000000
344.333333333
344.755555555
345.000000000
345.333333333
345.755555555
346.000000000
346.333333333
346.755555555
347.000000000
347.333333333
347.755555555
348.000000000
348.333333333
348.755555555
349.000000000
349.333333333
349.755555555
350.000000000
350.333333333
350.755555555
351.000000000
351.333333333
351.755555555
352.000000000
352.333333333
352.755555555
353.000000000
353.333333333
353.755555555
354.000000000
354.333333333
354.755555555
355.000000000
355.333333333
355.755555555
356.000000000
356.333333333
356.755555555
357.000000000
357.333333333
357.755555555
358.000000000
358.333333333
358.755555555
359.000000000
359.333333333
359.755555555
360.000000000
360.333333333
360.755555555
361.000000000
361.333333333
361.755555555
362.000000000
362.333333333
362.755555555
363.000000000
363.333333333
363.755555555
364.000000000
364.333333333
364.755555555
365.000000000
365.333333333
365.755555555
366.000000000
366.333333333
366.755555555
367.000000000
367.333333333
367.755555555
368.000000000
368.333333333
368.755555555
369.000000000
369.333333333
369.755555555
370.000000000
370.333333333
370.755555555
371.000000000
371.333333333
371.755555555
372.000000000
372.333333333
372.755555555
373.000000000
373.333333333
373.755555555
374.000000000
374.333333333
374.755555555
375.000000000
375.333333333
375.755555555
376.000000000
376.333333333
376.755555555
377.000000000
377.333333333
377.755555555
378.000000000
378.333333333
378.755555555
379.000000000
379.333333333
379.755555555
380.000000000
380.333333333
380.755555555
381.000000000
381.333333333
381.755555555
382.000000000
382.333333333
382.755555555
383.000000000
383.333333333
383.755555555
384.000000000
384.333333333
384.755555555
385.000000000
385.333333333
385.755555555
386.000000000
386.333333333
386.755555555
387.000000000
387.333333333
387.755555555
388.000000000
388.333333333
388.755555555
389.000000000
389.333333333
389.755555555
390.000000000
390.333333333
390.755555555
391.000000000
391.333333333
391.755555555
392.000000000
392.333333333
392.755555555
393.000000000
393.333333333
393.755555555
394.000000000
394.333333333
394.755555555
395.000000000
395.333333333
395.755555555
396.000000000
396.333333333
396.755555555
397.000000000
397.333333333
397.755555555
398.000000000
398.333333333
398.755555555
399.000000000
399.333333333
399.755555555
400.000000000
400.333333333
400.755555555
401.000000000
401.333333333
401.755555555
402.000000000
402.333333333
402.755555555
403.000000000
403.333333333
403.755555555
404.000000000
404.333333333
404.755555555
405.000000000
405.333333333
405.755555555
406.000000000
406.333333333
406.755555555
407.000000000
407.333333333
407.755555555
408.000000000
408.333333333
408.755555555
409.000000000
409.333333333
409.755555555
410.000000000
410.333333333
410.755555555
411.000000000
411.333333333
411.755555555
412.000000000
412.333333333
412.755555555
413.000000000
413.333333333
413.755555555
414.000000000
414.333333333
414.755555555
415.000000000
415.333333333
415.755555555
416.000000000
416.333333333
416.755555555
417.000000000
417.333333333
417.755555555
418.000000000
418.333333333
418.755555555
419.000000000
419.333333333
419.755555555
420.000000000
420.333333333
420.755555555
421.000000000
421.333333333
421.755555555
422.000000000
422.333333333
422.755555555
423.000000000
423.333333333
423.755555555
424.000000000
424.333333333
424.755555555
425.000000000
425.333333333
425.755555555
426.000000000
426.333333333
426.755555555
427.000000000
427.333333333
427.755555555
428.000000000
428.333333333
428.755555555
429.000000000
429.333333333
429.755555555
430.000000000
430.333333333
430.755555555
431.000000000
431.333333333
431.755555555
432.000000000
432.333333333
432.755555555
433.000000000
433.333333333
433.755555555
434.000000000
434.333333333
434.755555555
435.000000000
435.333333333
435.755555555
436.000000000
436.333333333
436.755555555
437.000000000
437.333333333
437.755555555
438.000000000
438.333333333
438.755555555
439.000000000
439.333333333
439.755555555
440.000000000
440.333333333
440.755555555
441.000000000
441.333333333
441.755555555
442.000000000
442.333333333
442.755555555
443.000000000
443.333333333
443.755555555
444.000000000
444.333333333
444.755555555
445.000000000
445.333333333
445.755555555
446.000000000
446.333333333
446.755555555
447.000000000
447.333333333
447.755555555
448.000000000
448.333333333
448.755555555
449.000000000
449.333333333
449.755555555
450.000000000
450.333333333
450.755555555
451.000000000
451.333333333
451.755555555
452.000000000
452.333333333
452.755555555
453.000000000
453.333333333
453.755555555
454.000000000
454.333333333
454.755555555
455.000000000
455.333333333
455.755555555
456.000000000
456.333333333
456.755555555
457.000000000
457.333333333
457.755555555
458.000000000
458.333333333
458.755555555
459.000000000
459.333333333
459.755555555
460.000000000
460.333333333
460.755555555
461.000000000
461.333333333
461.755555555
462.000000000
462.333333333
462.755555555
463.000000000
463.333333333
463.755555555
464.000000000
464.333333333
464.755555555
465.000000000
465.333333333
465.755555555
466.000000000
466.333333333
466.755555555
467.000000000
467.333333333
467.755555555
468.000000000
468.333333333
468.755555555
469.000000000
469.333333333
469.755555555
470.000000000
470.333333333
470.755555555
471.000000000
471.333333333
471.755555555
472.000000000
472.333333333
472.755555555
473.000000000
473.333333333
473.755555555
474.000000000
474.333333333
474.755555555
475.000000000
475.333333333
475.755555555
476.000000000
476.333333333
476.755555555
477.000000000
477.333333333
477.755555555
478.000000000
478.333333333
478.755555555
479.000000000
479.333333333
479.755555555
480.000000000
480.333333333
480.755555555
481.000000000
481.333333333
481.755555555
482.000000000
482.333333333
482.755555555
483.000000000
483.333333333
483.755555555
484.000000000
484.333333333
484.755555555
485.000000000
485.333333333
485.755555555
486.000000000
486.333333333
486.755555555
487.000000000
487.333333333
487.755555555
488.000000000
488.333333333
488.755555555
489.000000000
489.333333333
489.755555555
490.000000000
490.333333333
490.755555555
491.000000000
491.333333333
491.755555555
492.000000000
492.333333333
492.755555555
493.000000000
493.333333333
493.755555555
494.000000000
494.333333333
494.755555555
495.000000000
495.333333333
495.755555555
496.000000000
496.333333333
496.755555555
497.000000000
497.333333333
497.755555555
498.000000000
498.333333333
498.755555555
499.000000000
499.333333333
499.755555555
500.000000000
500.333333333
500.755555555
501.000000000
501.333333333
501.755555555
502.000000000
502.333333333
502.755555555
503.000000000
503.333333333
503.755555555
504.000000000
504.333333333
504.755555555
505.000000000
505.333333333
505.755555555
506.000000000
506.333333333
506.755555555
507.000000000
507.333333333
507.755555555
508.000000000
508.333333333
508.755555555
509.000000000
509.333333333
509.755555555
510.000000000
510.333333333
510.755555555
511.000000000
511.333333333
511.755555555
512.000000000
512.333333333
512.755555555
513.000000000
513.333333333
513.755555555
514.000000000
514.333333333
514.755555555
515.000000000
515.333333333
515.755555555
516.000000000
516.333333333
516.755555555
517.000000000
517.333333333
517.755555555
518.000000000
518.333333333
518.755555555
519.000000000
519.333333333
519.755555555
520.000000000
520.333333333
520.755555555
521.000000000
521.333333333
521.755555555
522.000000000
522.333333333
522.755555555
523.000000000
523.333333333
523.755555555
524.000000000
524.333333333
524.755555555
525.000000000
525.333333333
525.755555555
526.000000000
526.333333333
526.755555555
527.000000000
527.333333333
527.755555555
528.000000000
528.333333333
528.755555555
529.000000000
529.333333333
529.755555555
530.000000000
530.333333333
530.755555555
531.000000000
531.333333333
531.755555555
532.000000000
532.333333333
532.755555555
533.000000000
533.333333333
533.755555555
534.000000000
534.333333333
534.755555555
535.000000000
535.333333333
535.755555555
536.000000000
536.333333333
536.755555555
537.000000000
537.333333333
537.755555555
538.000000000
538.333333333
538.755555555
539.000000000
539.333333333
539.755555555
540.000000000
540.333333333
540.755555555
541.000000000
541.333333333
541.755555555
542.000000000
542.333333333
542.755555555
543.000000000
543.333333333
543.755555555
544.000000000
544.333333333
544.755555555
545.000000000
545.333333333
545.755555555
546.000000000
546.333333333
546.755555555
547.000000000
547.333333333
547.755555555
548.000000000
548.333333333
548.755555555
549.000000000
549.333333333
549.755555555
550.000000000
550.333333333
550.755555555
551.000000000
551.333333333
551.755555555
552.000000000
552.333333333
552.755555555
553.000000000
553.333333333
553.755555555
554.000000000
554.333333333
554.755555555
555.000000000
555.333333333
555.755555555
556.000000000
556.333333333
556.755555555
557.000000000
557.333333333
557.755555555
558.000000000
558.333333333
558.755555555
559.000000000
559.333333333
559.755555555
560.000000000
560.333333333
560.755555555
561.000000000
561.333333333
561.755555555
562.000000000
562.333333333
562.755555555
563.000000000
563.333333333
563.755555555
564.000000000
564.333333333
564.755555555
565.000000000
565.333333333
565.755555555
566.000000000
566.333333333
566.755555555
567.000000000
567.333333333
567.755555555
568.000000000
568.333333333
568.755555555
569.000000000
569.333333333
569.755555555
570.000000000
570.333333333
570.755555555
571.000000000
571.333333333
571.755555555
572.000000000
572.333333333
572.755555555
573.000000000
573.333333333
573.755555555
574.000000000
574.333333333
574.755555555
575.000000000
575.333333333
575.755555555
576.000000000
576.333333333
576.755555555
577.000000000
577.333333333
577.755555555
578.000000000
578.333333333
578.755555555
579.000000000
579.333333333
579.755555555
580.000000000
580.333333333
580.755555555
581.000000000
581.333333333
581.755555555
582.000000000
582.333333333
582.755555555
583.000000000
583.333333333
583.755555555
584.000000000
584.333333333
584.755555555
585.000000000
585.333333333
585.755555555
586.000000000
586.333333333
586.755555555
587.000000000
587.333333333
587.755555555
588.000000000
588.333333333
588.755555555
589.000000000
589.333333333
589.755555555
590.000000000
590.333333333
590.755555555
591.000000000
591.333333333
591.755555555
592.000000000
592.333333333
592.755555555
593.000000000
593.333333333
593.755555555
594.000000000
594.333333333
594.755555555
595.000000000
595.333333333
595.755555555
596.000000000
596.333333333
596.755555555
597.000000000
597.333333333
597.755555555
598.000000000
598.333333333
598.755555555
599.000000000
599.333333333
599.755555555
600.000000000
600.333333333
600.755555555
601.000000000
601.333333333
601.755555555
602.000000000
602.333333333
602.755555555
603.000000000
603.333333333
603.755555555
604.000000000
604.333333333
604.755555555
605.000000000
605.333333333
605.755555555
606.000000000
606.333333333
606.755555555
607.000000000
607.333333333
607.755555555
608.000000000
608.333333333
608.755555555
609.000000000
609.333333333
609.755555555
610.000000000
610.333333333
610.755555555
611.000000000
611.333333333
611.755555555
612.000000000
612.333333333
612.755555555
613.000000000
613.333333333
613.755555555
614.000000000
614.333333333
614.755555555
615.000000000
615.333333333
615.755555555
616.000000000
616.333333333
616.755555555
617.000000000
617.333333333
617.755555555
618.000000000
618.333333333
618.755555555
619.000000000
619.333333333
619.755555555
620.000000000
620.333333333
620.755555555
621.000000000
621.333333333
621.755555555
622.000000000
622.333333333
622.755555555
623.000000000
623.333333333
623.755555555
624.000000000
624.333333333
624.755555555
625.000000000
625.333333333
625.755555555
626.000000000
626.333333333
626.755555555
627.000000000
627.333333333
627.755555555
628.000000000
628.333333333
628.755555555
629.000000000
629.333333333
629.755555555
630.000000000
630.333333333
630.755555555
631.000000000
631.333333333
631.755555555
632.000000000
632.333333333
632.755555555
633.000000000
633.333333333
633.755555555
634.000000000
634.333333333
634.755555555
635.000000000
635.333333333
635.755555555
636.000000000
636.333333333
636.755555555
637.000000000
637.333333333
637.755555555
638.000000000
638.333333333
638.755555555
639.000000000
639.333333333
639.755555555
640.000000000
640.333333333
640.755555555
641.000000000
641.333333333
641.755555555
642.000000000
642.333333333
642.755555555
643.000000000
643.333333333
643.755555555
644.000000000
644.333333333
644.755555555
645.000000000
645.333333333
645.755555555
646.000000000
646.333333333
646.755555555
647.000000000
647.333333333
647.755555555
648.000000000
648.333333333
648.755555555
649.000000000
649.333333333
649.755555555
650.000000000
650.333333333
650.755555555
651.000000000
651.333333333
651.755555555
652.000000000
652.333333333
652.755555555
653.000000000
653.333333333
653.755555555
654.000000000
654.333333333
654.755555555
655.000000000
655.333333333
655.755555555
656.000000000
656.333333333
656.755555555
657.000000000
657.333333333
657.755555555
658.000000000
658.333333333
658.755555555
659.000000000
659.333333333
659.755555555
660.000000000
660.333333333
660.755555555
661.000000000
661.333333333
661.755555555
662.000000000
662.333333333
662.755555555
663.000000000
663.333333333
663.755555555
664.000000000
664.333333333
664.755555555
665.000000000
665.333333333
665.755555555
666.000000000
666.333333333
666.755555555
667.000000000
667.333333333
667.755555555
668.000000000
668.333333333
668.755555555
669.000000000
669.333333333
669.755555555
670.000000000
670.333333333
670.755555555
671.000000000
671.333333333
671.755555555
672.000000000
672.333333333
672.755555555
673.000000000
673.333333333
673.755555555
674.000000000
674.333333333
674.755555555
675.000000000
675.333333333
675.755555555
676.000000000
676.333333333
676.755555555
677.000000000
677.333333333
677.755555555
678.000000000
678.333333333
678.755555555
679.000000000
679.333333333
679.755555555
680.000000000
680.333333333
680.755555555
681.000000000
681.333333333
681.755555555
682.000000000
682.333333333
682.755555555
683.000000000
683.333333333
683.755555555
684.000000000
684.333333333
684.755555555
685.000000000
685.333333333
685.755555555
686.000000000
686.333333333
686.755555555
687.000000000
687.333333333
687.755555555
688.000000000
688.333333333
688.755555555
689.000000000
689.333333333
689.755555555
690.000000000
690.333333333
690.755555555
691.000000000
691.333333333
691.755555555
692.000000000
692.333333333
692.755555555
693.000000000
693.333333333
693.755555555
694.000000000
694.333333333
694.755555555
695.000000000
695.333333333
695.755555555
696.000000000
696.333333333
696.755555555
697.000000000
697.333333333
697.755555555
698.000000000
698.333333333
698.755555555
699.000000000
699.333333333
699.755555555
700.000000000
700.333333333
700.755555555
701.000000000
701.333333333
701.755555555
702.000000000
702.333333333
702.755555555
703.000000000
703.333333333
703.755555555
704.000000000
704.333333333
704.755555555
705.000000000
705.333333333
705.755555555
706.000000000
706.333333333
706.755555555
707.000000000
707.333333333
707.755555555
708.000000000
708.333333333
708.755555555
709.000000000
709.333333333
709.755555555
710.000000000
710.333333333
710.755555555
711.000000000
711.333333333
711.755555555
712.000000000
712.333333333
712.755555555
713.000000000
713.333333333
713.755555555
714.000000000
714.333333333
714.755555555
715.000000000
715.333333333
715.755555555
716.000000000
716.333333333
716.755555555
717.000000000
717.333333333
717.755555555
718.000000000
718.333333333
718.755555555
719.000000000
719.333333333
719.755555555
720.000000000
720.333333333
720.755555555
721.000000000
721.333333333
721.755555555
722.000000000
722.333333333
722.755555555
723.000000000
723.333333333
723.755555555
724.000000000
724.333333333
724.755555555
725.000000000
725.333333333
725.755555555
726.000000000
726.333333333
726.755555555
727.000000000
727.333333333
727.755555555
728.000000000
728.333333333
728.755555555
729.000000000
729.333333333
729.755555555
730.000000000
730.333333333
730.755555555
731.000000000
731.333333333
731.755555555
732.000000000
732.333333333
732.755555555
733.000000000
733.333333333
733.755555555
734.000000000
734.333333333
734.755555555
735.000000000
735.333333333
735.755555555
736.000000000
736.333333333
736.755555555
737.000000000
737.333333333
737.755555555
738.000000000
738.333333333
738.755555555
739.000000000
739.333333333
739.755555555
740.000000000
740.333333333
740.755555555
741.000000000
741.333333333
741.755555555
742.000000000
742.333333333
742.755555555
743.000000000
743.333333333
743.755555555
744.000000000
744.333333333
744.755555555
745.000000000
745.333333333
745.755555555
746.000000000
746.333333333
746.755555555
747.000000000
747.333333333
747.755555555
748.000000000
748.333333333
748.755555555
749.000000000
749.333333333
749.755555555
750.000000000
750.333333333
750.755555555
751.000000000
751.333333333
751.755555555
752.000000000
752.333333333
752.755555555
753.000000000
753.333333333
753.755555555
754.000000000
754.333333333
754.755555555
755.000000000
755.333333333
755.755555555
756.000000000
756.333333333
756.755555555
757.000000000
757.333333333
757.755555555
758.000000000
758.333333333
758.755555555
759.000000000
759.333333333
759.755555555
760.000000000
760.333333333
760.755555555
761.000000000
761.333333333
761.755555555
762.000000000
762.333333333
762.755555555
763.000000000
763.333333333
763.755555555
764.000000000
764.333333333
764.755555555
765.000000000
765.333333333
765.755555555
766.000000000
766.333333333
766.755555555
767.000000000
767.333333333
767.755555555
768.000000000
768.333333333
768.755555555
769.000000000
769.333333333
769.755555555
770.000000000
770.333333333
770.755555555
771.000000000
771.333333333
771.755555555
772.000000000
772.333333333
772.755555555
773.000000000
773.333333333
773.755555555
774.000000000
774.333333333
774.755555555
775.000000000
775.333333333
775.755555555
776.000000000
776.333333333
776.755555555
777.000000000
777.333333333
777.755555555
778.000000000
778.333333333
778.755555555
779.000000000
779.333333333
779.755555555
780.000000000
780.333333333
780.755555555
781.000000000
781.333333333
781.755555555
782.000000000
782.333333333
782.755555555
783.000000000
783.333333333
783.755555555
784.000000000
784.333333333
784.755555555
785.000000000
785.333333333
785.755555555
786.000000000
786.333333333
786.755555555
787.000000000
787.333333333
787.755555555
788.000000000
788.333333333
788.755555555
789.000000000
789.333333333
789.755555555
790.000000000
790.333333333
790.755555555
791.000000000
791.333333333
791.755555555
792.000000000
792.333333333
792.755555555
793.000000000
793.333333333
793.755555555
794.000000000
794.333333333
794.755555555
795.000000000
795.333333333
795.755555555
796.000000000
796.333333333
796.755555555
797.000000000
797.333333333
797.755555555
798.000000000
798.333333333
798.755555555
799.000000000
799.333333333
799.755555555
800.000000000
800.333333333
800.755555555
801.000000000
801.333333333
801.755555555
802.000000000
802.333333333
802.755555555
803.000000000
803.333333333
803.755555555
804.000000000
804.333333333
804.755555555
805.000000000
805.333333333
805.755555555
806.000000000
806.333333333
806.755555555
807.000000000
807.333333333
807.755555555
808.000000000
808.333333333
808.755555555
809.000000000
809.333333333
809.755555555
810.000000000
810.333333333
810.755555555
811.000000000
811.333333333
811.755555555
812.000000000
812.333333333
812.755555555
813.000000000
813.333333333
813.755555555
814.000000000
814.333333333
814.755555555
815.000000000
815.333333333
815.755555555
816.000000000
816.333333333
816.755555555
817.000000000
817.333333333
817.755555555
818.000000000
818.333333333
818.755555555
819.000000000
819.333333333
819.755555555
820.000000000
820.333333333
820.755555555
821.000000000
821.333333333
821.755555555
822.000000000
822.333333333
822.755555555
823.000000000
823.333333333
823.755555555
824.000000000
824.333333333
824.755555555
825.000000000
825.333333333
825.755555555
826.000000000
826.333333333
826.755555555
827.000000000
827.333333333
827.755555555
828.000000000
828.333333333
828.755555555
829.000000000
829.333333333
829.755555555
830.000000000
830.333333333
830.755555555
831.000000000
831.333333333
831.755555555
832.000000000
832.333333333
832.755555555
833.000000000
833.333333333
833.755555555
834.000000000
834.333333333
834.755555555
835.000000000
835.333333333
835.755555555
836.000000000
836.333333333
836.755555555
837.000000000
837.333333333
837.755555555
838.000000000
838.333333333
838.755555555
839.000000000
839.333333333
839.755555555
840.000000000
840.333333333
840.755555555
841.000000000
841.333333333
841.755555555
842.000000000
842.333333333
842.755555555
843.000000000
843.333333333
843.755555555
844.000000000
844.333333333
844.755555555
845.000000000
845.333333333
845.755555555
846.000000000
846.333333333
846.755555555
847.000000000
847.333333333
847.755555555
848.000000000
848.333333333
848.755555555
849.000000000
849.333333333
849.755555555
850.000000000
850.333333333
850.755555555
851.000000000
851.333333333
851.755555555
852.000000000
852.333333333
852.755555555
853.000000000
853.333333333
853.755555555
854.000000000
854.333333333
854.755555555
855.000000000
855.333333333
855.755555555
856.000000000
856.333333333
856.755555555
857.000000000
857.333333333
857.755555555
858.000000000
858.333333333
858.755555555
859.000000000
859.333333333
859.755555555
860.000000000
860.333333333
860.755555555
861.000000000
861.333333333
861.755555555
862.000000000
862.333333333
862.755555555
863.000000000
863.333333333
863.755555555
864.000000000
864.333333333
864.755555555
865.000000000
865.333333333
865.755555555
866.000000000
866.333333333
866.755555555
867.000000000
867.333333333
867.755555555
868.000000000
868.333333333
868.755555555
869.000000000
869.333333333
869.755555555
870.000000000
870.333333333
870.755555555
871.000000000
871.333333333
871.755555555
872.000000000
872.333333333
872.755555555
873.000000000
873.333333333
873.755555555
874.000000000
874.333333333
874.755555555
875.000000000
875.333333333
875.755555555
876.000000000
876.333333333
876.755555555
877.000000000
877.333333333
877.755555555
878.000000000
878.333333333
878.755555555
879.000000000
879.333333333
879.755555555
880.000000000
880.333333333
880.755555555
881.000000000
881.333333333
881.755555555
882.000000000
882.333333333
882.755555555
883.000000000
883.333333333
883.755555555
884.000000000
884.333333333
884.755555555
885.000000000
885.333333333
885.755555555
886.000000000
886.333333333
886.755555555
887.000000000
887.333333333
887.755555555
888.000000000
888.333333333
888.755555555
889.000000000
889.333333333
889.755555555
890.000000000
890.333333333
890.755555555
891.000000000
891.333333333
891.755555555
892.000000000
892.333333333
892.755555555
893.000000000
893.333333333
893.755555555
894.000000000
894.333333333
894.755555555
895.000000000
895.333333333
895.755555555
896.000000000
896.333333333
896.755555555
897.000000000
897.333333333
897.755555555
898.000000000
898.333333333
898.755555555
899.000000000
899.333333333
899.755555555
900.000000000
900.333333333
900.755555555
901.000000000
901.333333333
901.755555555
902.000000000
902.333333333
902.755555555
903.000000000
903.333333333
903.755555555
904.000000000
904.333333333
904.755555555
905.000000000
905.333333333
905.755555555
906.000000000
906.333333333
906.755555555
907.000000000
907.333333333
907.755555555
908.000000000
908.333333333
908.755555555
909.000000000
909.333333333
909.755555555
910.000000000
910.333333333
910.755555555
911.000000000
911.333333333
911.755555555
912.000000000
912.333333333
912.755555555
913.000000000
913.333333333
913.755555555
914.000000000
914.333333333
914.755555555
915.000000000
915.333333333
915.755555555
916.000000000
916.333333333
916.755555555
917.000000000
917.333333333
917.755555555
918.000000000
918.333333333
918.755555555
919.000000000
919.333333333
919.755555555
920.000000000
920.333333333
920.755555555
921.000000000
921.333333333
921.755555555
922.000000000
922.333333333
922.755555555
923.000000000
923.333333333
923.755555555
924.000000000
924.333333333
924.755555555
925.000000000
925.333333333
925.755555555
926.000000000
926.333333333
926.755555555
927.000000000
927.333333333
927.755555555
928.000000000
928.333333333
928.755555555
929.000000000
929.333333333
929.755555555
930.000000000
930.333333333
930.755555555
931.000000000
931.333333333
931.755555555
932.000000000
932.333333333
932.755555555
933.000000000
933.333333333
933.755555555
934.000000000
934.333333333
934.755555555
935.000000000
935.333333333
935.755555555
936.000000000
936.333333333
936.755555555
937.000000000
937.333333333
937.755555555
938.000000000
938.333333333
938.755555555
939.000000000
939.333333333
939.755555555
940.000000000
940.333333333
940.755555555
941.000000000
941.333333333
941.755555555
942.000000000
942.333333333
942.755555555
943.000000000
943.333333333
943.755555555
944.000000000
944.333333333
944.755555555
945.000000000
945.333333333
945.755555555
946.000000000
946.333333333
946.755555555
947.000000000
947.333333333
947.755555555
948.000000000
948.333333333
948.755555555
949.000000000
949.333333333
949.755555555
950.000000000
950.333333333
950.755555555
951.000000000
951.333333333
951.755555555
952.000000000
952.333333333
952.755555555
953.000000000
953.333333333
953.755555555
954.000000000
954.333333333
954.755555555
955.000000000
955.333333333
955.755555555
956.000000000
956.333333333
956.755555555
957.000000000
957.333333333
957.755555555
958.000000000
958.333333333
958.755555555
959.000000000
959.333333333
959.755555555
960.000000000
960.333333333
960.755555555
961.000000000
961.333333333
961.755555555
962.000000000
962.333333333
962.755555555
963.000000000
963.333333333
963.755555555
964.000000000
964.333333333
964.755555555
965.000000000
965.333333333
965.755555555
966.000000000
966.333333333
966.755555555
967.000000000
967.333333333
967.755555555
968.000000000
968.333333333
968.755555555
969.000000000
969.333333333
969.755555555
970.000000000
970.333333333
970.755555555
971.000000000
971.333333333
971.755555555
972.000000000
972.333333333
972.755555555
973.000000000
973.333333333
973.755555555
974.000000000
974.333333333
974.755555555
975.000000000
975.333333333
975.755555555
976.000000000
976.333333333
976.755555555
977.000000000
977.333333333
977.755555555
978.000000000
978.333333333
978.755555555
979.000000000
979.333333333
979.755555555
980.000000000
980.333333333
980.755555555
981.000000000
981.333333333
981.755555555
982.000000000
982.333333333
982.755555555
983.000000000
983.333333333
983.755555555
984.000000000
984.333333333
984.755555555
985.000000000
985.333333333
985.755555555
986.000000000
986.333333333
986.755555555
987.000000000
987.333333333
987.755555555
988.000000000
988.333333333
988.755555555
989.000000000
989.333333333
989.755555555
990.000000000
990.333333333
990.755555555
991.000000000
991.333333333
991.755555555
992.000000000
992.333333333
992.755555555
993.000000000
993.333333333
993.755555555
994.000000000
994.333333333
994.755555555
995.000000000
995.333333333
995.755555555
996.000000000
996.333333333
996.755555555
997.000000000
997.333333333
997.755555555
998.000000000
998.333333333
998.755555555
999.000000000
999.333333333
999.755555555
1000.000000000
1000.333333333
1000.755555555
1001.000000000
1001.333333333
1001.755555555
1002.000000000
1002.333333333
1002.755555555
1003.000000000
1003.333333333
1003.755555555
1004.000000000
1004.333333333
1004.755555555
1005.000000000
1005.333333333
1005.755555555
1006.000000000
1006.333333333
1006.755555555
1007.000000000
1007.333333333
1007.755555555
1008.000000000
1008.333333333
1008.755555555
1009.000000000
1009.333333333
1009.755555555
1010.000000000
1010.333333333
1010.755555555
1011.000000000
1011.333333333
1011.755555555
1012.000000000
1012.333333333
1012.755555555
1013.000000000
1013.333333333
1013.755555555
1014.000000000
1014.333333333
1014.755555555
1015.000000000
1015.333333333
1015.755555555
1016.000000000
1016.333333333
1016.755555555
1017.000000000
1017.333333333
1017.755555555
1018.000000000
1018.333333333
1018.755555555
1019.000000000
1019.333333333
1019.755555555
1020.000000000
1020.333333333
1020.755555555
1021.000000000
1021.333333333
1021.755555555
1022.000000000
1022.333333333
1022.755555555
1023.000000000
1023.333333333
1023.755555555
1024.000000000
1024.333333333
1024.755555555
drop table t2;
