drop table if exists t1,t2;
create table t1 (a timestamp not null, primary key(a))  
partition by key (a) ;
show create table t1;
Table	Create Table
t1	CREATE TABLE `t1` (
  `a` timestamp NOT NULL DEFAULT CURRENT_TIMESTAMP ON UPDATE CURRENT_TIMESTAMP,
  PRIMARY KEY (`a`)
) ORGANIZATION INDEX DEFAULT CHARSET = utf8mb4 COMPRESSION = 'lz4_1.0' REPLICA_NUM = 1 BLOCK_SIZE = 16384 USE_BLOOM_FILTER = FALSE ENABLE_MACRO_BLOCK_BLOOM_FILTER = FALSE TABLET_SIZE = 134217728 PCTFREE = 10
 partition by key(a)
(partition `p0`)
insert into t1 values ('1975-01-01 21:21:21'), ('2020-12-31 12:10:30'), ('1980-10-14 03:03'), ('2000-06-15 23:59');
select * from t1;
a
1975-01-01 21:21:21
1980-10-14 03:03:00
2000-06-15 23:59:00
2020-12-31 12:10:30
select * from t1 where a=19801014030300;
a
1980-10-14 03:03:00
delete from t1 where a=19801014030300;
select * from t1;
a
1975-01-01 21:21:21
2000-06-15 23:59:00
2020-12-31 12:10:30
drop table t1;
create table t2 (a timestamp not null, primary key(a))  
partition by key (a) partitions 12;
show create table t2;
Table	Create Table
t2	CREATE TABLE `t2` (
  `a` timestamp NOT NULL DEFAULT CURRENT_TIMESTAMP ON UPDATE CURRENT_TIMESTAMP,
  PRIMARY KEY (`a`)
) ORGANIZATION INDEX DEFAULT CHARSET = utf8mb4 COMPRESSION = 'lz4_1.0' REPLICA_NUM = 1 BLOCK_SIZE = 16384 USE_BLOOM_FILTER = FALSE ENABLE_MACRO_BLOCK_BLOOM_FILTER = FALSE TABLET_SIZE = 134217728 PCTFREE = 10
 partition by key(a)
(partition `p0`,
partition `p1`,
partition `p2`,
partition `p3`,
partition `p4`,
partition `p5`,
partition `p6`,
partition `p7`,
partition `p8`,
partition `p9`,
partition `p10`,
partition `p11`)
insert into t2 values ('1975-01-01 0:1:1');
insert into t2 values ('2020-12-31 10:11:12');
insert into t2 values ('1980-10-14 13:14:15');
insert into t2 values ('2000-06-15 14:15:16');
select * from t2 order by a;
a
1975-01-01 00:01:01
1980-10-14 13:14:15
2000-06-15 14:15:16
2020-12-31 10:11:12
select * from t2 where a='1980-10-14 13:14:15';
a
1980-10-14 13:14:15
delete from t2 where a='1980-10-14 13:14:15';
select * from t2 order by a;
a
1975-01-01 00:01:01
2000-06-15 14:15:16
2020-12-31 10:11:12
delete from t2;
drop table t2;
create table t2 (a timestamp not null, primary key(a))  
partition by key (a) partitions 12;
59 inserts;
insert into t2 values (19710101000000+59);
insert into t2 values (19710101000000+58);
insert into t2 values (19710101000000+57);
insert into t2 values (19710101000000+56);
insert into t2 values (19710101000000+55);
insert into t2 values (19710101000000+54);
insert into t2 values (19710101000000+53);
insert into t2 values (19710101000000+52);
insert into t2 values (19710101000000+51);
insert into t2 values (19710101000000+50);
insert into t2 values (19710101000000+49);
insert into t2 values (19710101000000+48);
insert into t2 values (19710101000000+47);
insert into t2 values (19710101000000+46);
insert into t2 values (19710101000000+45);
insert into t2 values (19710101000000+44);
insert into t2 values (19710101000000+43);
insert into t2 values (19710101000000+42);
insert into t2 values (19710101000000+41);
insert into t2 values (19710101000000+40);
insert into t2 values (19710101000000+39);
insert into t2 values (19710101000000+38);
insert into t2 values (19710101000000+37);
insert into t2 values (19710101000000+36);
insert into t2 values (19710101000000+35);
insert into t2 values (19710101000000+34);
insert into t2 values (19710101000000+33);
insert into t2 values (19710101000000+32);
insert into t2 values (19710101000000+31);
insert into t2 values (19710101000000+30);
insert into t2 values (19710101000000+29);
insert into t2 values (19710101000000+28);
insert into t2 values (19710101000000+27);
insert into t2 values (19710101000000+26);
insert into t2 values (19710101000000+25);
insert into t2 values (19710101000000+24);
insert into t2 values (19710101000000+23);
insert into t2 values (19710101000000+22);
insert into t2 values (19710101000000+21);
insert into t2 values (19710101000000+20);
insert into t2 values (19710101000000+19);
insert into t2 values (19710101000000+18);
insert into t2 values (19710101000000+17);
insert into t2 values (19710101000000+16);
insert into t2 values (19710101000000+15);
insert into t2 values (19710101000000+14);
insert into t2 values (19710101000000+13);
insert into t2 values (19710101000000+12);
insert into t2 values (19710101000000+11);
insert into t2 values (19710101000000+10);
insert into t2 values (19710101000000+9);
insert into t2 values (19710101000000+8);
insert into t2 values (19710101000000+7);
insert into t2 values (19710101000000+6);
insert into t2 values (19710101000000+5);
insert into t2 values (19710101000000+4);
insert into t2 values (19710101000000+3);
insert into t2 values (19710101000000+2);
insert into t2 values (19710101000000+1);
select count(*) from t2;
count(*)
59
select * from t2 order by a;
a
1971-01-01 00:00:01
1971-01-01 00:00:02
1971-01-01 00:00:03
1971-01-01 00:00:04
1971-01-01 00:00:05
1971-01-01 00:00:06
1971-01-01 00:00:07
1971-01-01 00:00:08
1971-01-01 00:00:09
1971-01-01 00:00:10
1971-01-01 00:00:11
1971-01-01 00:00:12
1971-01-01 00:00:13
1971-01-01 00:00:14
1971-01-01 00:00:15
1971-01-01 00:00:16
1971-01-01 00:00:17
1971-01-01 00:00:18
1971-01-01 00:00:19
1971-01-01 00:00:20
1971-01-01 00:00:21
1971-01-01 00:00:22
1971-01-01 00:00:23
1971-01-01 00:00:24
1971-01-01 00:00:25
1971-01-01 00:00:26
1971-01-01 00:00:27
1971-01-01 00:00:28
1971-01-01 00:00:29
1971-01-01 00:00:30
1971-01-01 00:00:31
1971-01-01 00:00:32
1971-01-01 00:00:33
1971-01-01 00:00:34
1971-01-01 00:00:35
1971-01-01 00:00:36
1971-01-01 00:00:37
1971-01-01 00:00:38
1971-01-01 00:00:39
1971-01-01 00:00:40
1971-01-01 00:00:41
1971-01-01 00:00:42
1971-01-01 00:00:43
1971-01-01 00:00:44
1971-01-01 00:00:45
1971-01-01 00:00:46
1971-01-01 00:00:47
1971-01-01 00:00:48
1971-01-01 00:00:49
1971-01-01 00:00:50
1971-01-01 00:00:51
1971-01-01 00:00:52
1971-01-01 00:00:53
1971-01-01 00:00:54
1971-01-01 00:00:55
1971-01-01 00:00:56
1971-01-01 00:00:57
1971-01-01 00:00:58
1971-01-01 00:00:59
drop table t2;
create table t1 (a date not null, primary key(a))  
partition by key (a);
show create table t1;
Table	Create Table
t1	CREATE TABLE `t1` (
  `a` date NOT NULL,
  PRIMARY KEY (`a`)
) ORGANIZATION INDEX DEFAULT CHARSET = utf8mb4 COMPRESSION = 'lz4_1.0' REPLICA_NUM = 1 BLOCK_SIZE = 16384 USE_BLOOM_FILTER = FALSE ENABLE_MACRO_BLOCK_BLOOM_FILTER = FALSE TABLET_SIZE = 134217728 PCTFREE = 10
 partition by key(a)
(partition `p0`)
insert into t1 values ('1975-01-01'), ('2020-12-31'), ('1980-10-14'), ('2000-06-15');
select * from t1;
a
1975-01-01
1980-10-14
2000-06-15
2020-12-31
select * from t1 where a=19801014;
a
1980-10-14
delete from t1 where a=19801014;
select * from t1;
a
1975-01-01
2000-06-15
2020-12-31
drop table t1;
create table t2 (a date not null, primary key(a))  
partition by key (a) partitions 12;
show create table t2;
Table	Create Table
t2	CREATE TABLE `t2` (
  `a` date NOT NULL,
  PRIMARY KEY (`a`)
) ORGANIZATION INDEX DEFAULT CHARSET = utf8mb4 COMPRESSION = 'lz4_1.0' REPLICA_NUM = 1 BLOCK_SIZE = 16384 USE_BLOOM_FILTER = FALSE ENABLE_MACRO_BLOCK_BLOOM_FILTER = FALSE TABLET_SIZE = 134217728 PCTFREE = 10
 partition by key(a)
(partition `p0`,
partition `p1`,
partition `p2`,
partition `p3`,
partition `p4`,
partition `p5`,
partition `p6`,
partition `p7`,
partition `p8`,
partition `p9`,
partition `p10`,
partition `p11`)
insert into t2 values ('1975-01-01');
insert into t2 values ('2020-12-31');
insert into t2 values ('1980-10-14');
insert into t2 values ('2000-06-15');
select * from t2 order by a;
a
1975-01-01
1980-10-14
2000-06-15
2020-12-31
select * from t2 where a='1980-10-14';
a
1980-10-14
delete from t2 where a='1980-10-14';
select * from t2 order by a;
a
1975-01-01
2000-06-15
2020-12-31
delete from t2;
drop table t2;
create table t2 (a date not null, primary key(a))  
partition by key (a) partitions 12;
28 inserts;
insert into t2 values (19700101+28-1);
insert into t2 values (19700201+28-1);
insert into t2 values (19700301+28-1);
insert into t2 values (19700101+27-1);
insert into t2 values (19700201+27-1);
insert into t2 values (19700301+27-1);
insert into t2 values (19700101+26-1);
insert into t2 values (19700201+26-1);
insert into t2 values (19700301+26-1);
insert into t2 values (19700101+25-1);
insert into t2 values (19700201+25-1);
insert into t2 values (19700301+25-1);
insert into t2 values (19700101+24-1);
insert into t2 values (19700201+24-1);
insert into t2 values (19700301+24-1);
insert into t2 values (19700101+23-1);
insert into t2 values (19700201+23-1);
insert into t2 values (19700301+23-1);
insert into t2 values (19700101+22-1);
insert into t2 values (19700201+22-1);
insert into t2 values (19700301+22-1);
insert into t2 values (19700101+21-1);
insert into t2 values (19700201+21-1);
insert into t2 values (19700301+21-1);
insert into t2 values (19700101+20-1);
insert into t2 values (19700201+20-1);
insert into t2 values (19700301+20-1);
insert into t2 values (19700101+19-1);
insert into t2 values (19700201+19-1);
insert into t2 values (19700301+19-1);
insert into t2 values (19700101+18-1);
insert into t2 values (19700201+18-1);
insert into t2 values (19700301+18-1);
insert into t2 values (19700101+17-1);
insert into t2 values (19700201+17-1);
insert into t2 values (19700301+17-1);
insert into t2 values (19700101+16-1);
insert into t2 values (19700201+16-1);
insert into t2 values (19700301+16-1);
insert into t2 values (19700101+15-1);
insert into t2 values (19700201+15-1);
insert into t2 values (19700301+15-1);
insert into t2 values (19700101+14-1);
insert into t2 values (19700201+14-1);
insert into t2 values (19700301+14-1);
insert into t2 values (19700101+13-1);
insert into t2 values (19700201+13-1);
insert into t2 values (19700301+13-1);
insert into t2 values (19700101+12-1);
insert into t2 values (19700201+12-1);
insert into t2 values (19700301+12-1);
insert into t2 values (19700101+11-1);
insert into t2 values (19700201+11-1);
insert into t2 values (19700301+11-1);
insert into t2 values (19700101+10-1);
insert into t2 values (19700201+10-1);
insert into t2 values (19700301+10-1);
insert into t2 values (19700101+9-1);
insert into t2 values (19700201+9-1);
insert into t2 values (19700301+9-1);
insert into t2 values (19700101+8-1);
insert into t2 values (19700201+8-1);
insert into t2 values (19700301+8-1);
insert into t2 values (19700101+7-1);
insert into t2 values (19700201+7-1);
insert into t2 values (19700301+7-1);
insert into t2 values (19700101+6-1);
insert into t2 values (19700201+6-1);
insert into t2 values (19700301+6-1);
insert into t2 values (19700101+5-1);
insert into t2 values (19700201+5-1);
insert into t2 values (19700301+5-1);
insert into t2 values (19700101+4-1);
insert into t2 values (19700201+4-1);
insert into t2 values (19700301+4-1);
insert into t2 values (19700101+3-1);
insert into t2 values (19700201+3-1);
insert into t2 values (19700301+3-1);
insert into t2 values (19700101+2-1);
insert into t2 values (19700201+2-1);
insert into t2 values (19700301+2-1);
insert into t2 values (19700101+1-1);
insert into t2 values (19700201+1-1);
insert into t2 values (19700301+1-1);
select count(*) from t2;
count(*)
84
select * from t2 order by a;
a
1970-01-01
1970-01-02
1970-01-03
1970-01-04
1970-01-05
1970-01-06
1970-01-07
1970-01-08
1970-01-09
1970-01-10
1970-01-11
1970-01-12
1970-01-13
1970-01-14
1970-01-15
1970-01-16
1970-01-17
1970-01-18
1970-01-19
1970-01-20
1970-01-21
1970-01-22
1970-01-23
1970-01-24
1970-01-25
1970-01-26
1970-01-27
1970-01-28
1970-02-01
1970-02-02
1970-02-03
1970-02-04
1970-02-05
1970-02-06
1970-02-07
1970-02-08
1970-02-09
1970-02-10
1970-02-11
1970-02-12
1970-02-13
1970-02-14
1970-02-15
1970-02-16
1970-02-17
1970-02-18
1970-02-19
1970-02-20
1970-02-21
1970-02-22
1970-02-23
1970-02-24
1970-02-25
1970-02-26
1970-02-27
1970-02-28
1970-03-01
1970-03-02
1970-03-03
1970-03-04
1970-03-05
1970-03-06
1970-03-07
1970-03-08
1970-03-09
1970-03-10
1970-03-11
1970-03-12
1970-03-13
1970-03-14
1970-03-15
1970-03-16
1970-03-17
1970-03-18
1970-03-19
1970-03-20
1970-03-21
1970-03-22
1970-03-23
1970-03-24
1970-03-25
1970-03-26
1970-03-27
1970-03-28
drop table t2;
create table t1 (a time not null, primary key(a))  
partition by key (a);
show create table t1;
Table	Create Table
t1	CREATE TABLE `t1` (
  `a` time NOT NULL,
  PRIMARY KEY (`a`)
) ORGANIZATION INDEX DEFAULT CHARSET = utf8mb4 COMPRESSION = 'lz4_1.0' REPLICA_NUM = 1 BLOCK_SIZE = 16384 USE_BLOOM_FILTER = FALSE ENABLE_MACRO_BLOCK_BLOOM_FILTER = FALSE TABLET_SIZE = 134217728 PCTFREE = 10
 partition by key(a)
(partition `p0`)
insert into t1 values ('21:21:21'), ('12:10:30'), ('03:03:03'), ('23:59');
select * from t1;
a
03:03:03
12:10:30
21:21:21
23:59:00
select * from t1 where a=030303;
a
03:03:03
delete from t1 where a=030303;
select * from t1;
a
12:10:30
21:21:21
23:59:00
drop table t1;
create table t2 (a time not null, primary key(a))  
partition by key (a) partitions 12;
show create table t2;
Table	Create Table
t2	CREATE TABLE `t2` (
  `a` time NOT NULL,
  PRIMARY KEY (`a`)
) ORGANIZATION INDEX DEFAULT CHARSET = utf8mb4 COMPRESSION = 'lz4_1.0' REPLICA_NUM = 1 BLOCK_SIZE = 16384 USE_BLOOM_FILTER = FALSE ENABLE_MACRO_BLOCK_BLOOM_FILTER = FALSE TABLET_SIZE = 134217728 PCTFREE = 10
 partition by key(a)
(partition `p0`,
partition `p1`,
partition `p2`,
partition `p3`,
partition `p4`,
partition `p5`,
partition `p6`,
partition `p7`,
partition `p8`,
partition `p9`,
partition `p10`,
partition `p11`)
insert into t2 values ('0:1:1');
insert into t2 values('10:11:12');
insert into t2 values('13:14:15');
insert into t2 values('14:15:16');
select * from t2 order by a;
a
00:01:01
10:11:12
13:14:15
14:15:16
select * from t2 where a='13:14:15';
a
13:14:15
delete from t2 where a='13:14:15';
select * from t2;
a
10:11:12
14:15:16
00:01:01
delete from t2 where a='0:1:1';
delete from t2;
drop table t2;
create table t2 (a time not null, primary key(a))  
partition by key (a) partitions 12;
59 inserts;
insert into t2 values (000100+59);
insert into t2 values (000100+58);
insert into t2 values (000100+57);
insert into t2 values (000100+56);
insert into t2 values (000100+55);
insert into t2 values (000100+54);
insert into t2 values (000100+53);
insert into t2 values (000100+52);
insert into t2 values (000100+51);
insert into t2 values (000100+50);
insert into t2 values (000100+49);
insert into t2 values (000100+48);
insert into t2 values (000100+47);
insert into t2 values (000100+46);
insert into t2 values (000100+45);
insert into t2 values (000100+44);
insert into t2 values (000100+43);
insert into t2 values (000100+42);
insert into t2 values (000100+41);
insert into t2 values (000100+40);
insert into t2 values (000100+39);
insert into t2 values (000100+38);
insert into t2 values (000100+37);
insert into t2 values (000100+36);
insert into t2 values (000100+35);
insert into t2 values (000100+34);
insert into t2 values (000100+33);
insert into t2 values (000100+32);
insert into t2 values (000100+31);
insert into t2 values (000100+30);
insert into t2 values (000100+29);
insert into t2 values (000100+28);
insert into t2 values (000100+27);
insert into t2 values (000100+26);
insert into t2 values (000100+25);
insert into t2 values (000100+24);
insert into t2 values (000100+23);
insert into t2 values (000100+22);
insert into t2 values (000100+21);
insert into t2 values (000100+20);
insert into t2 values (000100+19);
insert into t2 values (000100+18);
insert into t2 values (000100+17);
insert into t2 values (000100+16);
insert into t2 values (000100+15);
insert into t2 values (000100+14);
insert into t2 values (000100+13);
insert into t2 values (000100+12);
insert into t2 values (000100+11);
insert into t2 values (000100+10);
insert into t2 values (000100+9);
insert into t2 values (000100+8);
insert into t2 values (000100+7);
insert into t2 values (000100+6);
insert into t2 values (000100+5);
insert into t2 values (000100+4);
insert into t2 values (000100+3);
insert into t2 values (000100+2);
insert into t2 values (000100+1);
select count(*) from t2;
count(*)
59
select * from t2 order by a;
a
00:01:01
00:01:02
00:01:03
00:01:04
00:01:05
00:01:06
00:01:07
00:01:08
00:01:09
00:01:10
00:01:11
00:01:12
00:01:13
00:01:14
00:01:15
00:01:16
00:01:17
00:01:18
00:01:19
00:01:20
00:01:21
00:01:22
00:01:23
00:01:24
00:01:25
00:01:26
00:01:27
00:01:28
00:01:29
00:01:30
00:01:31
00:01:32
00:01:33
00:01:34
00:01:35
00:01:36
00:01:37
00:01:38
00:01:39
00:01:40
00:01:41
00:01:42
00:01:43
00:01:44
00:01:45
00:01:46
00:01:47
00:01:48
00:01:49
00:01:50
00:01:51
00:01:52
00:01:53
00:01:54
00:01:55
00:01:56
00:01:57
00:01:58
00:01:59
drop table t2;
create table t1 (a datetime not null, primary key(a))  
partition by key (a) ;
show create table t1;
Table	Create Table
t1	CREATE TABLE `t1` (
  `a` datetime NOT NULL,
  PRIMARY KEY (`a`)
) ORGANIZATION INDEX DEFAULT CHARSET = utf8mb4 COMPRESSION = 'lz4_1.0' REPLICA_NUM = 1 BLOCK_SIZE = 16384 USE_BLOOM_FILTER = FALSE ENABLE_MACRO_BLOCK_BLOOM_FILTER = FALSE TABLET_SIZE = 134217728 PCTFREE = 10
 partition by key(a)
(partition `p0`)
insert into t1 values ('1975-01-01 21:21:21'), ('2020-12-31 12:10:30'), ('1980-10-14 03:03'), ('2000-06-15 23:59');
select * from t1;
a
1975-01-01 21:21:21
1980-10-14 03:03:00
2000-06-15 23:59:00
2020-12-31 12:10:30
select * from t1 where a=19801014030300;
a
1980-10-14 03:03:00
delete from t1 where a=19801014030300;
select * from t1;
a
1975-01-01 21:21:21
2000-06-15 23:59:00
2020-12-31 12:10:30
drop table t1;
create table t2 (a datetime not null, primary key(a))  
partition by key (a) partitions 12;
show create table t2;
Table	Create Table
t2	CREATE TABLE `t2` (
  `a` datetime NOT NULL,
  PRIMARY KEY (`a`)
) ORGANIZATION INDEX DEFAULT CHARSET = utf8mb4 COMPRESSION = 'lz4_1.0' REPLICA_NUM = 1 BLOCK_SIZE = 16384 USE_BLOOM_FILTER = FALSE ENABLE_MACRO_BLOCK_BLOOM_FILTER = FALSE TABLET_SIZE = 134217728 PCTFREE = 10
 partition by key(a)
(partition `p0`,
partition `p1`,
partition `p2`,
partition `p3`,
partition `p4`,
partition `p5`,
partition `p6`,
partition `p7`,
partition `p8`,
partition `p9`,
partition `p10`,
partition `p11`)
insert into t2 values ('1975-01-01 0:1:1');
insert into t2 values('2020-12-31 10:11:12');
insert into t2 values('1980-10-14 13:14:15');
insert into t2 values('2000-06-15 14:15:16');
select * from t2 order by a;
a
1975-01-01 00:01:01
1980-10-14 13:14:15
2000-06-15 14:15:16
2020-12-31 10:11:12
select * from t2 where a='1980-10-14 13:14:15';
a
1980-10-14 13:14:15
delete from t2 where a='1980-10-14 13:14:15';
select * from t2 order by a;
a
1975-01-01 00:01:01
2000-06-15 14:15:16
2020-12-31 10:11:12
delete from t2;
drop table t2;
create table t2 (a datetime not null, primary key(a))  
partition by key (a) partitions 12;
59 inserts;
insert into t2 values (19700101000000+59);
insert into t2 values (19700101000000+58);
insert into t2 values (19700101000000+57);
insert into t2 values (19700101000000+56);
insert into t2 values (19700101000000+55);
insert into t2 values (19700101000000+54);
insert into t2 values (19700101000000+53);
insert into t2 values (19700101000000+52);
insert into t2 values (19700101000000+51);
insert into t2 values (19700101000000+50);
insert into t2 values (19700101000000+49);
insert into t2 values (19700101000000+48);
insert into t2 values (19700101000000+47);
insert into t2 values (19700101000000+46);
insert into t2 values (19700101000000+45);
insert into t2 values (19700101000000+44);
insert into t2 values (19700101000000+43);
insert into t2 values (19700101000000+42);
insert into t2 values (19700101000000+41);
insert into t2 values (19700101000000+40);
insert into t2 values (19700101000000+39);
insert into t2 values (19700101000000+38);
insert into t2 values (19700101000000+37);
insert into t2 values (19700101000000+36);
insert into t2 values (19700101000000+35);
insert into t2 values (19700101000000+34);
insert into t2 values (19700101000000+33);
insert into t2 values (19700101000000+32);
insert into t2 values (19700101000000+31);
insert into t2 values (19700101000000+30);
insert into t2 values (19700101000000+29);
insert into t2 values (19700101000000+28);
insert into t2 values (19700101000000+27);
insert into t2 values (19700101000000+26);
insert into t2 values (19700101000000+25);
insert into t2 values (19700101000000+24);
insert into t2 values (19700101000000+23);
insert into t2 values (19700101000000+22);
insert into t2 values (19700101000000+21);
insert into t2 values (19700101000000+20);
insert into t2 values (19700101000000+19);
insert into t2 values (19700101000000+18);
insert into t2 values (19700101000000+17);
insert into t2 values (19700101000000+16);
insert into t2 values (19700101000000+15);
insert into t2 values (19700101000000+14);
insert into t2 values (19700101000000+13);
insert into t2 values (19700101000000+12);
insert into t2 values (19700101000000+11);
insert into t2 values (19700101000000+10);
insert into t2 values (19700101000000+9);
insert into t2 values (19700101000000+8);
insert into t2 values (19700101000000+7);
insert into t2 values (19700101000000+6);
insert into t2 values (19700101000000+5);
insert into t2 values (19700101000000+4);
insert into t2 values (19700101000000+3);
insert into t2 values (19700101000000+2);
insert into t2 values (19700101000000+1);
select count(*) from t2;
count(*)
59
select * from t2 order by a;
a
1970-01-01 00:00:01
1970-01-01 00:00:02
1970-01-01 00:00:03
1970-01-01 00:00:04
1970-01-01 00:00:05
1970-01-01 00:00:06
1970-01-01 00:00:07
1970-01-01 00:00:08
1970-01-01 00:00:09
1970-01-01 00:00:10
1970-01-01 00:00:11
1970-01-01 00:00:12
1970-01-01 00:00:13
1970-01-01 00:00:14
1970-01-01 00:00:15
1970-01-01 00:00:16
1970-01-01 00:00:17
1970-01-01 00:00:18
1970-01-01 00:00:19
1970-01-01 00:00:20
1970-01-01 00:00:21
1970-01-01 00:00:22
1970-01-01 00:00:23
1970-01-01 00:00:24
1970-01-01 00:00:25
1970-01-01 00:00:26
1970-01-01 00:00:27
1970-01-01 00:00:28
1970-01-01 00:00:29
1970-01-01 00:00:30
1970-01-01 00:00:31
1970-01-01 00:00:32
1970-01-01 00:00:33
1970-01-01 00:00:34
1970-01-01 00:00:35
1970-01-01 00:00:36
1970-01-01 00:00:37
1970-01-01 00:00:38
1970-01-01 00:00:39
1970-01-01 00:00:40
1970-01-01 00:00:41
1970-01-01 00:00:42
1970-01-01 00:00:43
1970-01-01 00:00:44
1970-01-01 00:00:45
1970-01-01 00:00:46
1970-01-01 00:00:47
1970-01-01 00:00:48
1970-01-01 00:00:49
1970-01-01 00:00:50
1970-01-01 00:00:51
1970-01-01 00:00:52
1970-01-01 00:00:53
1970-01-01 00:00:54
1970-01-01 00:00:55
1970-01-01 00:00:56
1970-01-01 00:00:57
1970-01-01 00:00:58
1970-01-01 00:00:59
drop table t2;
create table t1 (a year not null, primary key(a))  
partition by key (a);
show create table t1;
Table	Create Table
t1	CREATE TABLE `t1` (
  `a` year(4) NOT NULL,
  PRIMARY KEY (`a`)
) ORGANIZATION INDEX DEFAULT CHARSET = utf8mb4 COMPRESSION = 'lz4_1.0' REPLICA_NUM = 1 BLOCK_SIZE = 16384 USE_BLOOM_FILTER = FALSE ENABLE_MACRO_BLOCK_BLOOM_FILTER = FALSE TABLET_SIZE = 134217728 PCTFREE = 10
 partition by key(a)
(partition `p0`)
insert into t1 values ('1975'), (2020), ('1980'), ('2000');
select * from t1;
a
1975
1980
2000
2020
select * from t1 where a=1980;
a
1980
delete from t1 where a=1980;
select * from t1;
a
1975
2000
2020
drop table t1;
create table t2 (a year not null, primary key(a))  
partition by key (a) partitions 12;
show create table t2;
Table	Create Table
t2	CREATE TABLE `t2` (
  `a` year(4) NOT NULL,
  PRIMARY KEY (`a`)
) ORGANIZATION INDEX DEFAULT CHARSET = utf8mb4 COMPRESSION = 'lz4_1.0' REPLICA_NUM = 1 BLOCK_SIZE = 16384 USE_BLOOM_FILTER = FALSE ENABLE_MACRO_BLOCK_BLOOM_FILTER = FALSE TABLET_SIZE = 134217728 PCTFREE = 10
 partition by key(a)
(partition `p0`,
partition `p1`,
partition `p2`,
partition `p3`,
partition `p4`,
partition `p5`,
partition `p6`,
partition `p7`,
partition `p8`,
partition `p9`,
partition `p10`,
partition `p11`)
insert into t2 values ('1975');
insert into t2 values ('2020');
insert into t2 values ('1980');
insert into t2 values ('2000');
select * from t2 order by a;
a
1975
1980
2000
2020
select * from t2 where a='1980';
a
1980
delete from t2 where a='1980';
select * from t2 order by a;
a
1975
2000
2020
delete from t2;
drop table t2;
create table t2 (a year not null, primary key(a))  
partition by key (a) partitions 12;
25 inserts;
select count(*) from t2;
count(*)
25
select * from t2 order by a;
a
1902
1903
1904
1905
1906
1907
1908
1909
1910
1911
1912
1913
1914
1915
1916
1917
1918
1919
1920
1921
1922
1923
1924
1925
1926
drop table t2;
