result_format: 4
set ob_query_timeout=300000000;
set ob_trx_timeout=300000000;

drop table if exists t1, t2;
#
# Bug#11765667: bug#58655: ASSERTION FAILED,
#                          SERVER CRASHES WITH MYSQLD GOT SIGNAL 6
#
CREATE TABLE t1 (
       id MEDIUMINT NOT NULL AUTO_INCREMENT,
       dt DATE, st VARCHAR(255), uid INT,
       id2nd VARCHAR(5000), filler VARCHAR(255), PRIMARY KEY(id, dt)
);
INSERT INTO t1 (dt, st, uid, id2nd, filler) VALUES
   ('1991-03-14', 'Initial Insert', 200, 1234567, 'No Data'),
   ('1991-02-26', 'Initial Insert', 201, 1234567, 'No Data'),
   ('1992-03-16', 'Initial Insert', 234, 1234567, 'No Data'),
   ('1992-07-02', 'Initial Insert', 287, 1234567, 'No Data'),
   ('1991-05-26', 'Initial Insert', 256, 1234567, 'No Data'),
   ('1991-04-25', 'Initial Insert', 222, 1234567, 'No Data'),
   ('1993-03-12', 'Initial Insert', 267, 1234567, 'No Data'),
   ('1993-03-14', 'Initial Insert', 291, 1234567, 'No Data'),
   ('1991-12-20', 'Initial Insert', 298, 1234567, 'No Data'),
   ('1994-10-31', 'Initial Insert', 220, 1234567, 'No Data');
INSERT INTO t1 (dt, st, uid, id2nd, filler) VALUES
   ('1991-07-14', 'After Partitioning Insert', 299, 1234567, 'Insert row');
UPDATE t1 SET filler='Updating the row' WHERE uid=298;

DROP TABLE t1;

#
# Bug#59297: Can't find record in 'tablename' on update inner join
#
CREATE TABLE t1 (
a char(2) NOT NULL,
b char(2) NOT NULL,
c int(10) unsigned NOT NULL,
d varchar(255) DEFAULT NULL,
e varchar(1000) DEFAULT NULL,
PRIMARY KEY (a, b, c),
KEY (a),
KEY (a, b)
)
/*!50100 PARTITION BY KEY (a)
PARTITIONS 20 */;

INSERT INTO t1 (a, b, c, d, e) VALUES
('07', '03', 343, '1', '07_03_343'),
('01', '04', 343, '2', '01_04_343'),
('01', '06', 343, '3', '01_06_343'),
('01', '07', 343, '4', '01_07_343'),
('01', '08', 343, '5', '01_08_343'),
('01', '09', 343, '6', '01_09_343'),
('03', '03', 343, '7', '03_03_343'),
('03', '06', 343, '8', '03_06_343'),
('03', '07', 343, '9', '03_07_343'),
('04', '03', 343, '10', '04_03_343'),
('04', '06', 343, '11', '04_06_343'),
('05', '03', 343, '12', '05_03_343'),
('11', '03', 343, '13', '11_03_343'),
('11', '04', 343, '14', '11_04_343')
;

DROP TABLE t1;

#
# Bug#59503: explain extended crash in get_mm_leaf
#
CREATE TABLE t1 (a VARCHAR(51) CHARACTER SET utf8mb4)

PARTITION BY KEY (a) PARTITIONS 1;
INSERT INTO t1 VALUES ('a'),('b'),('c');
EXPLAIN BASIC SELECT 1 FROM t1 WHERE a > 1;
DROP TABLE t1;

#
# Bug#57778: failed primary key add to partitioned innodb table
#            inconsistent and crashes
#
CREATE TABLE t1 (a INT NOT NULL, b INT NOT NULL)
PARTITION BY KEY (a) PARTITIONS 2;
INSERT INTO t1 VALUES (0,1), (0,2);
ALTER TABLE t1 ADD PRIMARY KEY (a);
ERROR 23000: Duplicated primary key
SHOW CREATE TABLE t1;
Table	Create Table
t1	CREATE TABLE `t1` (
  `a` int(11) NOT NULL,
  `b` int(11) NOT NULL
) ORGANIZATION INDEX DEFAULT CHARSET = utf8mb4 COMPRESSION = 'lz4_1.0' REPLICA_NUM = 1 BLOCK_SIZE = 16384 USE_BLOOM_FILTER = FALSE ENABLE_MACRO_BLOCK_BLOOM_FILTER = FALSE TABLET_SIZE = 134217728 PCTFREE = 10
 partition by key(a)
(partition `p0`,
partition `p1`)
SELECT * FROM t1;
+---+---+
| a | b |
+---+---+
| 0 | 1 |
| 0 | 2 |
+---+---+
UPDATE t1 SET a = 7, b = 1 WHERE a = 0 AND b = 2;
SELECT * FROM t1;
+---+---+
| a | b |
+---+---+
| 0 | 1 |
| 7 | 1 |
+---+---+
SELECT * FROM t1;
+---+---+
| a | b |
+---+---+
| 0 | 1 |
| 7 | 1 |
+---+---+
DROP TABLE t1;

#
# Bug#57113: ha_partition::extra(ha_extra_function):
#            Assertion `m_extra_cache' failed
CREATE TABLE t1
(id INT NOT NULL PRIMARY KEY,
 name VARCHAR(16) NOT NULL,
 year YEAR,
 INDEX name (name) LOCAL
)
PARTITION BY HASH(id) PARTITIONS 2;

INSERT INTO t1 VALUES ( 1, 'FooBar', '1924' );

CREATE TABLE t2 (id INT);

INSERT INTO t2 VALUES (1),(2);

DROP TABLE t1, t2;

#
# Bug#55458: Partitioned MyISAM table gets crashed by multi-table update
#
CREATE TABLE t1 (
  `id` int NOT NULL,
  `user_num` int DEFAULT NULL,
  PRIMARY KEY (`id`)
)  CHARSET=utf8mb4;
INSERT INTO t1 VALUES (1,8601);
INSERT INTO t1 VALUES (2,8601);
INSERT INTO t1 VALUES (3,8601);
INSERT INTO t1 VALUES (4,8601);
CREATE TABLE t2 (
  `id` int(11) NOT NULL,
  `user_num` int DEFAULT NULL,
  `name` varchar(64) NOT NULL,
  PRIMARY KEY (`id`)
)  CHARSET=utf8mb4
PARTITION BY HASH (id)
PARTITIONS 2;
INSERT INTO t2 VALUES (1,8601,'John');
INSERT INTO t2 VALUES (2,8601,'JS');
INSERT INTO t2 VALUES (3,8601,'John S');

DROP TABLE t1, t2;

##
## Bug#48276: can't add column if subpartition exists
CREATE TABLE t1 (
  a int NOT NULL,
  b int NOT NULL);

CREATE TABLE t2 (
  a int NOT NULL,
  b int NOT NULL,
  INDEX(b) LOCAL
)
PARTITION BY HASH(a) PARTITIONS 2;

INSERT INTO t1 VALUES (399, 22);
INSERT INTO t2 VALUES (1, 22), (1, 42);

INSERT INTO t2 SELECT 1, 399 FROM t2, t1 WHERE t1.b = t2.b;

DROP TABLE t1, t2;

CREATE TABLE t1 (
  a timestamp NOT NULL DEFAULT CURRENT_TIMESTAMP,
  b varchar(10),
  PRIMARY KEY (a)
)
PARTITION BY RANGE (UNIX_TIMESTAMP(a)) (
 PARTITION p1 VALUES LESS THAN (1199134800),
 PARTITION pmax VALUES LESS THAN MAXVALUE
);

DROP TABLE t1;

##
## Bug#45904: Error when CHARSET=utf8 and subpartitioning
##
##
## Bug#44059: rec_per_key on empty partition gives weird optimiser results
##
create table t1 (a int primary key)
partition by hash (a);
create index i on t1 (a);
insert into t1 values (1);
create index i on t1 (a);
ERROR 42000: Duplicate key name 'i'
create index i2 on t1 (a);
drop table t1;

##
## Bug#36001: Partitions: spelling and using some error messages
##
CREATE TABLE t1 (
  pk INT NOT NULL AUTO_INCREMENT,
  PRIMARY KEY (pk)
)
/*!50100 PARTITION BY HASH (pk)
PARTITIONS 2 */;
INSERT INTO t1 VALUES (NULL);
INSERT INTO t1 VALUES (NULL);
INSERT INTO t1 VALUES (NULL);
SELECT * FROM t1 WHERE pk < 0 ORDER BY pk;
+----+
| pk |
+----+
+----+
DROP TABLE t1;

##
## Bug#35765: ALTER TABLE produces wrong error when non-existent storage engine
## used
## OK to only specify one partitions engine, since it is already assigned at
## table level (after create, it is specified on all levels and all parts).
## OK to only specify one partitions engine, since it is already assigned at
## table level (after create, it is specified on all levels and all parts).
##
## Bug#40494: Crash MYSQL server crashes on range access with partitioning
##            and order by
##
##
## Bug35931: Index search may return duplicates
##
## Bug#37327 Range scan on partitioned table returns duplicate rows
## (Duplicate of Bug#35931)
## Bug#37329 Range scan on partitioned tables shows higher Handler_read_next
## (marked as duplicate of Bug#35931)
CREATE TABLE t1 (
    d DATE NOT NULL
)
PARTITION BY RANGE( YEAR(d) ) (
    PARTITION p0 VALUES LESS THAN (1960),
    PARTITION p1 VALUES LESS THAN (1970),
    PARTITION p2 VALUES LESS THAN (1980),
    PARTITION p3 VALUES LESS THAN (1990)
);

##--exec sed 's/APSTART \\/APSTART  /' var/master-data/test/t1.frm > tmpt1.frm && mv tmpt1.frm var/master-data/test/t1.frm
##--error ER_PARSE_ERROR
DROP TABLE t1;
##
## Bug 30878: crashing when alter an auto_increment non partitioned
##            table to partitioned
create table t1 (a int)
partition by key(a)
partitions 0.2+e1;
ERROR 42000: You have an error in your SQL syntax; check the manual that corresponds to your OceanBase version for the right syntax to use near '0.2+e1' at line 3
create table t1 (a int)
partition by key(a)
partitions -1;
ERROR 42000: You have an error in your SQL syntax; check the manual that corresponds to your OceanBase version for the right syntax to use near '-1' at line 3
create table t1 (a int)
partition by key(a)
partitions 1.5;
ERROR 42000: You have an error in your SQL syntax; check the manual that corresponds to your OceanBase version for the right syntax to use near '1.5' at line 3
create table t1 (a int)
partition by key(a)
partitions 1e+300;
ERROR 42000: You have an error in your SQL syntax; check the manual that corresponds to your OceanBase version for the right syntax to use near '1e+300' at line 3

##
## Bug 19309 Partitions: Crash if double procedural alter
##
##
## BUG 16002: Handle unsigned integer functions properly
##
create table t1 (a bigint)
partition by range (a)
(partition p0 values less than (0xFFFFFFFFFFFFFFFF),
 partition p1 values less than (10));
ERROR HY000: VALUES value for partition 'p0' must have type INT
create table t1 (a bigint unsigned)
partition by range (a)
(partition p0 values less than (100),
 partition p1 values less than MAXVALUE);
insert into t1 values (1);
drop table t1;

create table t1 (a bigint unsigned)
partition by hash (a);
insert into t1 values (0xFFFFFFFFFFFFFFFD);
insert into t1 values (0xFFFFFFFFFFFFFFFE);
select * from t1 where (a + 1) < 10;
+------+
| a    |
+------+
+------+
select * from t1 where (a + 1) > 10;
+----------------------+
| a                    |
+----------------------+
| 18446744073709551613 |
| 18446744073709551614 |
+----------------------+
drop table t1;

create table t1 (a int)
partition by key(a);
drop table t1;

##
## BUG 19067 ALTER TABLE .. ADD PARTITION for subpartitioned table crashes
##
CREATE TABLE t1 (
a int not null,
b int not null,
c int not null,
primary key(a,b))
partition by key (a);

select count(*) from t1;
+----------+
| count(*) |
+----------+
|        0 |
+----------+

show create table t1;
Table	Create Table
t1	CREATE TABLE `t1` (
  `a` int(11) NOT NULL,
  `b` int(11) NOT NULL,
  `c` int(11) NOT NULL,
  PRIMARY KEY (`a`, `b`)
) ORGANIZATION INDEX DEFAULT CHARSET = utf8mb4 COMPRESSION = 'lz4_1.0' REPLICA_NUM = NUM BLOCK_SIZE = SIZE USE_BLOOM_FILTER = FALSE ENABLE_MACRO_BLOCK_BLOOM_FILTER = FALSE TABLET_SIZE = SIZE PCTFREE = 10
 partition by key(a)
(partition `p0`)

drop table t1;
CREATE TABLE t1 (
a int not null,
b int not null,
c int not null,
primary key(a,b))
partition by key (a, b);

drop table t1;
CREATE TABLE t1 (
a int not null,
b int not null,
c int not null,
primary key(a,b))
partition by key (a)
partitions 3
;
drop table t1;
CREATE TABLE t1 (
a int not null,
b int not null,
c int not null,
primary key(a,b))
partition by key (a)
partitions 3;
drop table t1;
CREATE TABLE t1 (
a int not null,
b int not null,
c int not null,
primary key(a,b))
partition by key (a)
partitions 3;
drop table t1;
CREATE TABLE t1 (
a int not null,
b int not null,
c int not null,
primary key(a,b))
partition by key (a)
partitions 3;
CREATE TABLE t2 LIKE t1;

drop table t2;
drop table t1;

##
## Partition by key list, basic
##
##
## Partition by key list, list function
##
##
## Partition by key list, list function, no spec of #partitions
##
CREATE TABLE t1 (
a int not null)
partition by key(a);

insert into t1 values (1);
insert into t1 values (2);
insert into t1 values (3);
insert into t1 values (4);
drop table t1;

##
## Bug #13644 DROP PARTITION NULL's DATE column
##
##
## Bug #13442; Truncate Partitioned table doesn't work
##
CREATE TABLE t1 (a int, b int, primary key(a,b))
PARTITION BY KEY(b,a) PARTITIONS 4;

insert into t1 values (0,0),(1,1),(2,2),(3,3),(4,4),(5,5),(6,6);
select * from t1 where a = 4;
+---+---+
| a | b |
+---+---+
| 4 | 4 |
+---+---+

drop table t1;

CREATE TABLE t1 (c1 INT, c2 INT)
  PARTITION BY KEY(c2,c1) PARTITIONS 4;

INSERT INTO t1 VALUES (0,0),(1,1),(2,2),(3,3),(4,4),(5,5),(6,6);
SELECT * FROM t1 WHERE c1 = 4;
+------+------+
| c1   | c2   |
+------+------+
|    4 |    4 |
+------+------+
DROP TABLE t1;

##
## Bug #13438: Engine clause in PARTITION clause causes crash
##
##
## Bug #13440: REPLACE causes crash in partitioned table
##
##
## Bug #14365: Crash if value too small in list partitioned table
##
CREATE TABLE t1 (a int)
PARTITION BY HASH(a)
PARTITIONS 5;

SHOW CREATE TABLE t1;
Table	Create Table
t1	CREATE TABLE `t1` (
  `a` int(11) DEFAULT NULL
) ORGANIZATION INDEX DEFAULT CHARSET = utf8mb4 COMPRESSION = 'lz4_1.0' REPLICA_NUM = 1 BLOCK_SIZE = 16384 USE_BLOOM_FILTER = FALSE ENABLE_MACRO_BLOCK_BLOOM_FILTER = FALSE TABLET_SIZE = 134217728 PCTFREE = 10
 partition by hash(a)
(partition `p0`,
partition `p1`,
partition `p2`,
partition `p3`,
partition `p4`)

drop table t1;

CREATE TABLE t1 (a int)
PARTITION BY RANGE (a)
(PARTITION x1 VALUES LESS THAN (2));

drop table t1;
##
## Bug #13441: Analyze on partitioned table didn't work
##
create table t1
(a int)
partition by range (a)
  ( partition p0 values less than(10),
    partition p1 values less than (20),
    partition p2 values less than (25));

drop table t1;

CREATE TABLE t1 (a int, b int)
PARTITION BY RANGE (a)
(PARTITION x0 VALUES LESS THAN (2),
 PARTITION x1 VALUES LESS THAN (4),
 PARTITION x2 VALUES LESS THAN (6),
 PARTITION x3 VALUES LESS THAN (8),
 PARTITION x4 VALUES LESS THAN (10),
 PARTITION x5 VALUES LESS THAN (12),
 PARTITION x6 VALUES LESS THAN (14),
 PARTITION x7 VALUES LESS THAN (16),
 PARTITION x8 VALUES LESS THAN (18),
 PARTITION x9 VALUES LESS THAN (20));

drop table t1;
## Testcase for BUG#15819
##
## Bug#16901 Partitions: crash, SELECT, column of part.
##           function=first column of primary key
##
##
## Bug #16907 Partitions: crash, SELECT goes into last partition, UNIQUE INDEX
##
##
## Bug #16775: Wrong engine type stored for subpartition
##
create table t1 (f_int1 integer, f_int2 integer, primary key (f_int1))
  partition by hash(f_int1) partitions 2;
insert into t1 values (1,1),(2,2);
drop table t1;

##
## Bug #17169: Partitions: out of memory if add partition and unique
##
create table t1 (a int)
partition by key(a)
partitions 2;
show create table t1;
Table	Create Table
t1	CREATE TABLE `t1` (
  `a` int(11) DEFAULT NULL
) ORGANIZATION INDEX DEFAULT CHARSET = utf8mb4 COMPRESSION = 'lz4_1.0' REPLICA_NUM = NUM BLOCK_SIZE = SIZE USE_BLOOM_FILTER = FALSE ENABLE_MACRO_BLOCK_BLOOM_FILTER = FALSE TABLET_SIZE = SIZE PCTFREE = 10
 partition by key(a)
(partition `p0`,
partition `p1`)

alter table t1;
show create table t1;
Table	Create Table
t1	CREATE TABLE `t1` (
  `a` int(11) DEFAULT NULL
) ORGANIZATION INDEX DEFAULT CHARSET = utf8mb4 COMPRESSION = 'lz4_1.0' REPLICA_NUM = NUM BLOCK_SIZE = SIZE USE_BLOOM_FILTER = FALSE ENABLE_MACRO_BLOCK_BLOOM_FILTER = FALSE TABLET_SIZE = SIZE PCTFREE = 10
 partition by key(a)
(partition `p0`,
partition `p1`)

drop table t1;

create table t1 (a int)
partition by key(a)
partitions 2;
show create table t1;
Table	Create Table
t1	CREATE TABLE `t1` (
  `a` int(11) DEFAULT NULL
) ORGANIZATION INDEX DEFAULT CHARSET = utf8mb4 COMPRESSION = 'lz4_1.0' REPLICA_NUM = NUM BLOCK_SIZE = SIZE USE_BLOOM_FILTER = FALSE ENABLE_MACRO_BLOCK_BLOOM_FILTER = FALSE TABLET_SIZE = SIZE PCTFREE = 10
 partition by key(a)
(partition `p0`,
partition `p1`)
drop table t1;

## Bug #17432: Partition functions containing NULL values should return
##             LONGLONG_MIN
##
##
## Bug 17430: Crash when SELECT * from t1 where field IS NULL
##
##
## Bug#14363 Partitions: failure if create in stored procedure
##
##
## Bug #15447  Partitions: NULL is treated as zero
##
## NULL for RANGE partition
## NULL for LIST partition
##
## BUG 17947 Crash with REBUILD PARTITION
##
##
## BUG 15253 Insert that should fail doesn't
##
##
## BUG #16370 Subpartitions names not shown in SHOW CREATE TABLE output
##
create table t1 (a int)
partition by key (a);

show create table t1;
Table	Create Table
t1	CREATE TABLE `t1` (
  `a` int(11) DEFAULT NULL
) ORGANIZATION INDEX DEFAULT CHARSET = utf8mb4 COMPRESSION = 'lz4_1.0' REPLICA_NUM = NUM BLOCK_SIZE = SIZE USE_BLOOM_FILTER = FALSE ENABLE_MACRO_BLOCK_BLOOM_FILTER = FALSE TABLET_SIZE = SIZE PCTFREE = 10
 partition by key(a)
(partition `p0`)
drop table t1;

##
## BUG 15407 Crash with subpartition
##
##
## Bug 46354 Crash with subpartition
##

create table t1 (a int)
partition by hash (a);
drop table t1;

create table t1 (a int)
partition by range (a)
(partition p0 values less than (1));

drop table t1;

create table t1 (a int)
partition by hash (a);
drop table t1;

##
## BUG 17947 Crash with REBUILD PARTITION
##
##
## Bug #14526: Partitions: indexed searches fail
##
create table t1 (a int) partition by hash(a);
drop table t1;

##
## Bug #17097: Partitions: failing ADD PRIMARY KEY leads to temporary rotten
## metadata,crash
##
############################################
############################################
create table t1 (a int unsigned not null auto_increment primary key)
partition by key(a);
alter table t1 rename t2, add c char(10), comment "no comment";
show create table t2;
Table	Create Table
t2	CREATE TABLE `t2` (
  `a` int(10) unsigned NOT NULL AUTO_INCREMENT,
  `c` char(10) DEFAULT NULL,
  PRIMARY KEY (`a`)
) ORGANIZATION INDEX AUTO_INCREMENT = 1 AUTO_INCREMENT_MODE = 'ORDER' DEFAULT CHARSET = utf8mb4 ROW_FORMAT = DYNAMIC COMPRESSION = 'zstd_1.3.8' REPLICA_NUM = 1 BLOCK_SIZE = 16384 USE_BLOOM_FILTER = FALSE ENABLE_MACRO_BLOCK_BLOOM_FILTER = FALSE TABLET_SIZE = 134217728 PCTFREE = 0 COMMENT = 'no comment'
 partition by key(a)
(partition `p0`)
drop table t2;

create table t1 (f1 int) partition by hash (f1) as select 1;
drop table t1;

##
## bug #14350 Partitions: crash if prepared statement
##
##
## bug 17290 SP with delete, create and rollback to save point causes MySQLD core
##
CREATE TABLE t1 (a int not null)
partition by key(a);
drop table t1;

CREATE TABLE t1 (`a b` int not null)
partition by key(`a b`);
drop table t1;

CREATE TABLE t1 (`a b` int not null)
partition by hash(`a b`);
drop table t1;

##
## Bug#18053 Partitions: crash if null
## Bug#18070 Partitions: wrong result on WHERE ... IS NULL
##
##
##Bug# 17631 SHOW TABLE STATUS reports wrong engine
##
##
##BUG 16002 Erroneus handling of unsigned partition functions
##
##
##BUG 18750 Problems with partition names
##
##
## BUG 18752 SHOW CREATE TABLE doesn't show NULL value in SHOW CREATE TABLE
##
##
## Bug#18753 Partitions: auto_increment fails
##
create table t1 (a int primary key)
partition by key(a);
insert into t1 values (1);
create index inx1 on t1(a);
drop table t1;

create table t1 (a int)
PARTITION BY KEY (a);
#支持no_table_options
set session sql_mode='no_table_options';
show create table t1;
Table	Create Table
t1	CREATE TABLE `t1` (
  `a` int(11) DEFAULT NULL
)
 partition by key(a)
(partition `p0`)
set session sql_mode='';
drop table t1;

create table t1 (a int)
partition by key (a);
drop table t1;
##
## BUG 19062 Partition clause ignored if CREATE TABLE ... AS SELECT ...;
##
CREATE TABLE t1 (a int) PARTITION BY KEY(a);
INSERT into t1 values (1), (2);
SHOW TABLE STATUS WHERE name = 't1';
Name	Engine	Version	Row_format	Rows	Avg_row_length	Data_length	Max_data_length	Index_length	Data_free	Auto_increment	Create_time	Update_time	Check_time	Collation	Checksum	Create_options	Comment
t1	oceanbase	version	DYNAMIC	0	0	0	NULL	0	NULL	NULL	NULL	NULL	NULL	utf8mb4_general_ci	0	REPLICA_NUM	
DELETE from t1 where a = 1;
SHOW TABLE STATUS WHERE name = 't1';
Name	Engine	Version	Row_format	Rows	Avg_row_length	Data_length	Max_data_length	Index_length	Data_free	Auto_increment	Create_time	Update_time	Check_time	Collation	Checksum	Create_options	Comment
t1	oceanbase	version	DYNAMIC	0	0	0	NULL	0	NULL	NULL	NULL	NULL	NULL	utf8mb4_general_ci	0	REPLICA_NUM	
SHOW TABLE STATUS WHERE name = 't1';
Name	Engine	Version	Row_format	Rows	Avg_row_length	Data_length	Max_data_length	Index_length	Data_free	Auto_increment	Create_time	Update_time	Check_time	Collation	Checksum	Create_options	Comment
t1	oceanbase	version	DYNAMIC	0	0	0	NULL	NULL	NULL	NULL	NULL	NULL	NULL	utf8mb4_general_ci	0	REPLICA_NUM	
DROP TABLE t1;

CREATE TABLE t1 (a int primary key, index(a)) PARTITION BY KEY(a);
DROP TABLE t1;

create table t1 (a int)
partition by key (a);

drop table t1;

##
##BUG 17138 Problem with stored procedure and analyze partition
##
create table t1 (a int primary key, index(a))
partition by hash(a);
insert into t1 values (1),(2);
select * from t1 ORDER BY a DESC;
+---+
| a |
+---+
| 2 |
| 1 |
+---+
drop table t1;

create table t1 (a bigint unsigned not null, primary key(a))
partition by key (a)
partitions 10;

show create table t1;
Table	Create Table
t1	CREATE TABLE `t1` (
  `a` bigint(20) unsigned NOT NULL,
  PRIMARY KEY (`a`)
) ORGANIZATION INDEX DEFAULT CHARSET = utf8mb4 COMPRESSION = 'lz4_1.0' REPLICA_NUM = NUM BLOCK_SIZE = SIZE USE_BLOOM_FILTER = FALSE ENABLE_MACRO_BLOCK_BLOOM_FILTER = FALSE TABLET_SIZE = SIZE PCTFREE = 10
 partition by key(a)
(partition `p0`,
partition `p1`,
partition `p2`,
partition `p3`,
partition `p4`,
partition `p5`,
partition `p6`,
partition `p7`,
partition `p8`,
partition `p9`)
insert into t1 values (18446744073709551615);
insert into t1 values (0xFFFFFFFFFFFFFFFE);
insert into t1 values (18446744073709551613);
insert into t1 values (18446744073709551612);
select * from t1;
+----------------------+
| a                    |
+----------------------+
| 18446744073709551612 |
| 18446744073709551614 |
| 18446744073709551613 |
| 18446744073709551615 |
+----------------------+
select * from t1 where a = 18446744073709551615;
+----------------------+
| a                    |
+----------------------+
| 18446744073709551615 |
+----------------------+
delete from t1 where a = 18446744073709551615;
select * from t1;
+----------------------+
| a                    |
+----------------------+
| 18446744073709551612 |
| 18446744073709551614 |
| 18446744073709551613 |
+----------------------+
drop table t1;

##
## Bug 24502 reorganize partition closes connection
##
##
## Bug #24186 (nested query across partitions returns fewer records)
##
create table t1 (c1 varchar(255),c2 tinyint,primary key(c1))
   partition by key (c1) partitions 10 ;
insert into t1 values ('aaa','1') on duplicate key update c2 = c2 + 1;
insert into t1 values ('aaa','1') on duplicate key update c2 = c2 + 1;
select * from t1;
+-----+------+
| c1  | c2   |
+-----+------+
| aaa |    2 |
+-----+------+
drop table t1;

##
## Bug #28005 Partitions: can't use -9223372036854775808
##
create table t1(a int auto_increment, b int, primary key (b, a))
  partition by hash(b) partitions 2;
insert into t1 values (null, 1);
drop table t1;

create table t1(a int auto_increment primary key)
  partition by key(a) partitions 2;
insert into t1 values (null), (null), (null);
drop table t1;
##
## Bug #30484: Partitions: crash with self-referencing trigger
##
##
## Bug #27084 partitioning by list seems failing when using case
## BUG #18198: Case no longer supported, test case removed
##
create table t1
 (s1 timestamp on update current_timestamp, s2 int)
 partition by key(s1) partitions 3;

insert into t1 values (null,null);
drop table t1;

create table t1 (
  c0 int,
  c1 bigint,
  c2 char(20),
  key (c2,c1,c0) LOCAL,
  key(c0) LOCAL
) partition by hash (c0) partitions 5;

insert into t1 set c0 = -6502262, c1 = 3992917, c2 = 35019;
insert into t1 set c0 = 241221, c1 = -6862346, c2 = 56644;
select c1 from t1 group by (select c0 from t1 limit 1);
+----------+
| c1       |
+----------+
| -6862346 |
+----------+
drop table t1;

## Bug #30495: optimize table t1,t2,t3 extended errors
## (added more maintenace commands for Bug#20129
##
## Bug #29258: Partitions: search fails for maximum unsigned bigint
##
CREATE TABLE t1
(int_column INT, char_column CHAR(5),
PRIMARY KEY(char_column,int_column))
PARTITION BY KEY(char_column,int_column)
PARTITIONS 101;
INSERT INTO t1 (int_column, char_column) VALUES
(      39868 ,'zZZRW');
INSERT INTO t1 (int_column, char_column) VALUES(     545592 ,'zZzSD');
INSERT INTO t1 (int_column, char_column) VALUES(       4936 ,'zzzsT');
INSERT INTO t1 (int_column, char_column) VALUES(       9274 ,'ZzZSX');
INSERT INTO t1 (int_column, char_column) VALUES(     970185 ,'ZZzTN');
INSERT INTO t1 (int_column, char_column) VALUES(     786036 ,'zZzTO');
INSERT INTO t1 (int_column, char_column) VALUES(      37240 ,'zZzTv');
INSERT INTO t1 (int_column, char_column) VALUES(     313801 ,'zzzUM');
INSERT INTO t1 (int_column, char_column) VALUES(     782427 ,'ZZZva');
INSERT INTO t1 (int_column, char_column) VALUES(     907955 ,'zZZvP');
INSERT INTO t1 (int_column, char_column) VALUES(     453491 ,'zzZWV');
INSERT INTO t1 (int_column, char_column) VALUES(     756594 ,'ZZZXU');
INSERT INTO t1 (int_column, char_column) VALUES(     718061 ,'ZZzZH');
SELECT * FROM t1 ORDER BY char_column DESC;
+------------+-------------+
| int_column | char_column |
+------------+-------------+
|     718061 | ZZzZH       |
|     756594 | ZZZXU       |
|     453491 | zzZWV       |
|     907955 | zZZvP       |
|     782427 | ZZZva       |
|     313801 | zzzUM       |
|      37240 | zZzTv       |
|     786036 | zZzTO       |
|     970185 | ZZzTN       |
|       9274 | ZzZSX       |
|       4936 | zzzsT       |
|     545592 | zZzSD       |
|      39868 | zZZRW       |
+------------+-------------+
DROP TABLE t1;

##
## Bug #32247 Test reports wrong value of "AUTO_INCREMENT" (on a partitioned InnoDB table)
##
##
## Bug #38272 timestamps fields incorrectly defaulted on update accross partitions.
##
##
## Bug #38083 Error-causing row inserted into partitioned table despite error
##

create table t1 (s1 int) partition by hash(s1) partitions 2;
create index i on t1 (s1) LOCAL;
insert into t1 values (1);
insert into t1 select s1 from t1;
insert into t1 select s1 from t1 order by s1 desc;
select * from t1;
+------+
| s1   |
+------+
|    1 |
|    1 |
|    1 |
|    1 |
+------+
drop table t1;

CREATE TABLE t1 ( a INT, b INT, c INT, KEY bc(b, c) LOCAL )
PARTITION BY KEY (a, b) PARTITIONS 3
;

INSERT INTO t1 VALUES
(17, 1, -8);
INSERT INTO t1 VALUES(3,  1, -7);
INSERT INTO t1 VALUES(23, 1, -6);
INSERT INTO t1 VALUES(22, 1, -5);
INSERT INTO t1 VALUES(11, 1, -4);
INSERT INTO t1 VALUES(21, 1, -3);
INSERT INTO t1 VALUES(19, 1, -2);
INSERT INTO t1 VALUES(30, 1, -1);
INSERT INTO t1 VALUES(20, 1, 1);
INSERT INTO t1 VALUES(16, 1, 2);
INSERT INTO t1 VALUES(18, 1, 3);
INSERT INTO t1 VALUES(9,  1, 4);
INSERT INTO t1 VALUES(15, 1, 5);
INSERT INTO t1 VALUES(28, 1, 6);
INSERT INTO t1 VALUES(29, 1, 7);
INSERT INTO t1 VALUES(25, 1, 8);
INSERT INTO t1 VALUES(10, 1, 9);
INSERT INTO t1 VALUES(13, 1, 10);
INSERT INTO t1 VALUES(27, 1, 11);
INSERT INTO t1 VALUES(24, 1, 12);
INSERT INTO t1 VALUES(12, 1, 13);
INSERT INTO t1 VALUES(26, 1, 14);
INSERT INTO t1 VALUES(14, 1, 15)
;

SELECT b, c FROM t1 WHERE b = 1 GROUP BY b, c;
+------+------+
| b    | c    |
+------+------+
|    1 |   -8 |
|    1 |   -7 |
|    1 |   -6 |
|    1 |   -5 |
|    1 |   -4 |
|    1 |   -3 |
|    1 |   -2 |
|    1 |   -1 |
|    1 |    1 |
|    1 |    2 |
|    1 |    3 |
|    1 |    4 |
|    1 |    5 |
|    1 |    6 |
|    1 |    7 |
|    1 |    8 |
|    1 |    9 |
|    1 |   10 |
|    1 |   11 |
|    1 |   12 |
|    1 |   13 |
|    1 |   14 |
|    1 |   15 |
+------+------+

EXPLAIN BASIC
SELECT b, c FROM t1 WHERE b = 1 GROUP BY b, c;
Query Plan
================================================
|ID|OPERATOR                          |NAME    |
------------------------------------------------
|0 |PX COORDINATOR                    |        |
|1 |└─EXCHANGE OUT DISTR              |:EX10001|
|2 |  └─MERGE DISTINCT                |        |
|3 |    └─EXCHANGE IN MERGE SORT DISTR|        |
|4 |      └─EXCHANGE OUT DISTR (HASH) |:EX10000|
|5 |        └─PX PARTITION ITERATOR   |        |
|6 |          └─MERGE DISTINCT        |        |
|7 |            └─TABLE RANGE SCAN    |t1(bc)  |
================================================
Outputs & filters:
-------------------------------------
  0 - output([INTERNAL_FUNCTION(t1.b, t1.c)]), filter(nil), rowset=256
  1 - output([INTERNAL_FUNCTION(t1.b, t1.c)]), filter(nil), rowset=256
      dop=1
  2 - output([t1.c], [t1.b]), filter(nil), rowset=256
      distinct([t1.c])
  3 - output([t1.c], [t1.b]), filter(nil), rowset=256
      sort_keys([t1.c, ASC]), Local Order
  4 - output([t1.c], [t1.b]), filter(nil), rowset=256
      (#keys=1, [t1.c]), dop=1
  5 - output([t1.c], [t1.b]), filter(nil), rowset=256
      force partition granule
  6 - output([t1.c], [t1.b]), filter(nil), rowset=256
      distinct([t1.c])
  7 - output([t1.b], [t1.c]), filter(nil), rowset=256
      access([t1.b], [t1.c]), partitions(p[0-2])
      is_index_back=false, is_global_index=false, 
      range_key([t1.b], [t1.c], [t1.__pk_increment]), range(1,MIN,MIN ; 1,MAX,MAX), 
      range_cond([t1.b = 1])

DROP TABLE t1;

#
# Bug #45807: crash accessing partitioned table and sql_mode
#   contains ONLY_FULL_GROUP_BY
# Bug#46923: select count(*) from partitioned table fails with
# ONLY_FULL_GROUP_BY
#
SET SESSION SQL_MODE='ONLY_FULL_GROUP_BY';
CREATE TABLE t1(id INT,KEY(id) LOCAL)
  PARTITION BY HASH(id) PARTITIONS 2;
SELECT COUNT(*) FROM t1;
+----------+
| COUNT(*) |
+----------+
|        0 |
+----------+
DROP TABLE t1;
SET SESSION SQL_MODE=DEFAULT;

#
# Bug#46198: Hang after failed ALTER TABLE on partitioned table.
#
DROP TABLE IF EXISTS t1;
CREATE TABLE t1 (s1 INT PRIMARY KEY) PARTITION BY HASH(s1);

SELECT * FROM t1;
+----+
| s1 |
+----+
+----+

DROP TABLE t1;

CREATE TABLE t1 (s1 VARCHAR(5) PRIMARY KEY) PARTITION BY KEY(s1);

SELECT * FROM t1;
+----+
| s1 |
+----+
+----+

DROP TABLE t1;

#
# BUG#51868 - crash with myisam_use_mmap and partitioned myisam tables
#
CREATE TABLE t1(a INT) PARTITION BY HASH(a) PARTITIONS 1;
INSERT INTO t1 VALUES(0);
INSERT INTO t1 VALUES(0);
DROP TABLE t1;
End of 5.1 tests
# Start of 5.5 tests
## Cleanup
##
## Bug #12330344 Crash and/or valgrind errors in free_io_cache with join, view,
## partitioned table
##
#
# Bug#13580775 ASSERTION FAILED: RECORD_LENGTH == M_RECORD_LENGTH,
# FILE FILESORT_UTILS.CC
#
CREATE TABLE t1 (
  a INT PRIMARY KEY,
  b INT,
  c CHAR(1),
  d INT,
  KEY (c,d)
) PARTITION BY KEY () PARTITIONS 1;

INSERT INTO t1 VALUES (1,1,'a',1), (2,2,'a',1);

SELECT 1 FROM t1 WHERE 1 IN
(SELECT  group_concat(b)
 FROM t1
 WHERE c > geomfromtext('point(1 1)')
 GROUP BY b
);
ERROR 42000: FUNCTION geomfromtext does not exist

DROP TABLE t1;

#
# WL#5855 (EXPLAIN FORMAT=JSON) partition test
#
