set @@sql_mode='STRICT_ALL_TABLES';
# The results where created without innodb persistent stats.
# Original tests for WL#4443
# Must have InnoDB as engine to get the same statistics results.
# embedded uses MyISAM as default. CREATE SELECT uses the default engine.
DROP TABLE IF EXISTS t1,t2,t3;
CREATE TABLE t1 (a int PRIMARY KEY, b varchar(128), KEY (b) LOCAL) PARTITION BY HASH (a) PARTITIONS 13;
CREATE TABLE t2 (a int PRIMARY KEY, b varchar(128)) PARTITION BY HASH (a) PARTITIONS 13;
#
#
# Test how INSERT prune locks
# First test, no defaults
#
INSERT INTO t1 VALUES (1, 'First row, p1');
SELECT * FROM INFORMATION_SCHEMA.SESSION_STATUS WHERE VARIABLE_NAME LIKE 'HANDLER_%' AND VARIABLE_VALUE > 0;
VARIABLE_NAME	VARIABLE_VALUE
# 4 locks (table + partition lock/unlock)
# 1 commit
INSERT INTO t1 VALUES (1, 'First row, duplicate');
ERROR 23000: Duplicate entry '1' for key 'PRIMARY'
SELECT * FROM INFORMATION_SCHEMA.SESSION_STATUS WHERE VARIABLE_NAME LIKE 'HANDLER_%' AND VARIABLE_VALUE > 0;
VARIABLE_NAME	VARIABLE_VALUE
# 4 locks (table + partition lock/unlock)
# 1 rollback
INSERT INTO t1 VALUES (0, 'First row, p0');
INSERT INTO t1 VALUES (2, 'First row, p2');
INSERT INTO t1 VALUES (3, 'First row, p3');
INSERT INTO t1 VALUES (4, 'First row, p4');
SELECT * FROM INFORMATION_SCHEMA.SESSION_STATUS WHERE VARIABLE_NAME LIKE 'HANDLER_%' AND VARIABLE_VALUE > 0;
VARIABLE_NAME	VARIABLE_VALUE
# 10 locks (table + 4 partition * lock/unlock)
# 1 commit
INSERT INTO t1 VALUES (1 * 13, 'Second row, p0'), (2 * 13, 'Third row, p0'),
(3 * 13, 'Fourth row, p0'), (4 * 13, 'Fifth row, p0');
SELECT * FROM INFORMATION_SCHEMA.SESSION_STATUS WHERE VARIABLE_NAME LIKE 'HANDLER_%' AND VARIABLE_VALUE > 0;
VARIABLE_NAME	VARIABLE_VALUE
# 4 locks (table + 1 partition lock/unlock)
# 1 commit
#
# INSERT with auto increment, lock pruning
#
INSERT INTO t2 VALUES (1, 'First auto-inc row');
SELECT * FROM INFORMATION_SCHEMA.SESSION_STATUS WHERE VARIABLE_NAME LIKE 'HANDLER_%' AND VARIABLE_VALUE > 0;
VARIABLE_NAME	VARIABLE_VALUE
# Auto increment value is not known until write.
# 28 locks (table + 13 partition lock/unlock)
# 1 commit
INSERT INTO t2  VALUES (2, 'Second auto-inc row');
SELECT * FROM INFORMATION_SCHEMA.SESSION_STATUS WHERE VARIABLE_NAME LIKE 'HANDLER_%' AND VARIABLE_VALUE > 0;
VARIABLE_NAME	VARIABLE_VALUE
# Auto increment value is not known until write.
# 28 locks (table + 13 partition lock/unlock)
# 1 commit
INSERT INTO t2 VALUES (10, "First row, p10");
SELECT * FROM INFORMATION_SCHEMA.SESSION_STATUS WHERE VARIABLE_NAME LIKE 'HANDLER_%' AND VARIABLE_VALUE > 0;
VARIABLE_NAME	VARIABLE_VALUE
# Insert pruning on tables with auto increment is not yet supported
# 28 locks (table + 13 partition lock/unlock)
# 1 commit
#
# UPDATE with auto increment, lock pruning
#
UPDATE t2 SET b = CONCAT(b, ", UPDATED") WHERE a = 10;
SELECT * FROM INFORMATION_SCHEMA.SESSION_STATUS WHERE VARIABLE_NAME LIKE 'HANDLER_%' AND VARIABLE_VALUE > 0;
VARIABLE_NAME	VARIABLE_VALUE
# 4 locks (table + 1 partition lock/unlock)
# 1 read_key + 1 update + 1 commit
#
# Test of pruning with secondary column auto_inc INSERT
#
CREATE TABLE t3 (a INT, b INT AUTO_INCREMENT, PRIMARY KEY (a, b))
PARTITION BY HASH (a) PARTITIONS 5;
INSERT INTO t3 VALUES (1, 1);
SELECT * FROM INFORMATION_SCHEMA.SESSION_STATUS WHERE VARIABLE_NAME LIKE 'HANDLER_%' AND VARIABLE_VALUE > 0;
VARIABLE_NAME	VARIABLE_VALUE
# 4 locks (table + partition lock/unlock)
# No commits, since MyISAM!
INSERT INTO t3 VALUES (1, NULL);
SELECT * FROM INFORMATION_SCHEMA.SESSION_STATUS WHERE VARIABLE_NAME LIKE 'HANDLER_%' AND VARIABLE_VALUE > 0;
VARIABLE_NAME	VARIABLE_VALUE
# 4 locks (table + partition lock/unlock)
SELECT @@sql_mode;
@@sql_mode
STRICT_ALL_TABLES
SET @old_sql_mode = @@sql_mode;
SET @@sql_mode = 'NO_AUTO_VALUE_ON_ZERO';
SELECT @@sql_mode;
@@sql_mode
NO_AUTO_VALUE_ON_ZERO
INSERT INTO t3 VALUES (1, 0);
SELECT * FROM INFORMATION_SCHEMA.SESSION_STATUS WHERE VARIABLE_NAME LIKE 'HANDLER_%' AND VARIABLE_VALUE > 0;
VARIABLE_NAME	VARIABLE_VALUE
# 4 locks (table + partition lock/unlock)
SET @@sql_mode = @old_sql_mode;
SELECT @@sql_mode;
@@sql_mode
STRICT_ALL_TABLES
INSERT INTO t3 VALUES (1, 0);
SELECT * FROM INFORMATION_SCHEMA.SESSION_STATUS WHERE VARIABLE_NAME LIKE 'HANDLER_%' AND VARIABLE_VALUE > 0;
VARIABLE_NAME	VARIABLE_VALUE
# 4 locks (table + partition lock/unlock)
SELECT * FROM t3;
a	b
1	0
1	1
1	2
1	3
DROP TABLE t3;
#
# Test handling of INSERT INTO <table> VALUES (<all fields specified>)
#
CREATE TABLE t3 (a INT, b CHAR(10)) PARTITION BY HASH (a) PARTITIONS 2;
INSERT INTO t3 VALUES (1, "Test 1");
SELECT * FROM INFORMATION_SCHEMA.SESSION_STATUS WHERE VARIABLE_NAME LIKE 'HANDLER_%' AND VARIABLE_VALUE > 0;
VARIABLE_NAME	VARIABLE_VALUE
# 4 locks (1 table, 1 partition lock/unlock)
INSERT INTO t3 VALUES (2, "Test 2");
INSERT INTO t3 VALUES  (3, "Test 3");
INSERT INTO t3 VALUES  (4, "Test 4");
SELECT * FROM INFORMATION_SCHEMA.SESSION_STATUS WHERE VARIABLE_NAME LIKE 'HANDLER_%' AND VARIABLE_VALUE > 0;
VARIABLE_NAME	VARIABLE_VALUE
# 6 locks (1 table, 2 partition lock/unlock)
INSERT INTO t3 VALUES (6, "Test 6");
INSERT INTO t3 VALUES  (8, "Test 8");
INSERT INTO t3 VALUES  (10, "Test 10");
SELECT * FROM INFORMATION_SCHEMA.SESSION_STATUS WHERE VARIABLE_NAME LIKE 'HANDLER_%' AND VARIABLE_VALUE > 0;
VARIABLE_NAME	VARIABLE_VALUE
# 4 locks (1 table, 1 partition lock/unlock)
INSERT INTO t3 VALUES (5, "Test 5");
INSERT INTO t3 VALUES  (7, "Test 7");
INSERT INTO t3 VALUES  (9, "Test 9");
SELECT * FROM INFORMATION_SCHEMA.SESSION_STATUS WHERE VARIABLE_NAME LIKE 'HANDLER_%' AND VARIABLE_VALUE > 0;
VARIABLE_NAME	VARIABLE_VALUE
# 4 locks (1 table, 1 partition lock/unlock)
INSERT INTO t3 VALUES (0, "Test 0");
SELECT * FROM INFORMATION_SCHEMA.SESSION_STATUS WHERE VARIABLE_NAME LIKE 'HANDLER_%' AND VARIABLE_VALUE > 0;
VARIABLE_NAME	VARIABLE_VALUE
# 4 locks (1 table, 1 partition lock/unlock)
INSERT INTO t3 (a, b) VALUES (1, "Test 1");
SELECT * FROM INFORMATION_SCHEMA.SESSION_STATUS WHERE VARIABLE_NAME LIKE 'HANDLER_%' AND VARIABLE_VALUE > 0;
VARIABLE_NAME	VARIABLE_VALUE
# 4 locks (1 table, 1 partition lock/unlock)
INSERT INTO t3 (a, b) VALUES (2, "Test 2");
INSERT INTO t3 (a, b) VALUES  (3, "Test 3");
INSERT INTO t3 (a, b) VALUES  (4, "Test 4");
SELECT * FROM INFORMATION_SCHEMA.SESSION_STATUS WHERE VARIABLE_NAME LIKE 'HANDLER_%' AND VARIABLE_VALUE > 0;
VARIABLE_NAME	VARIABLE_VALUE
# 6 locks (1 table, 2 partition lock/unlock)
INSERT INTO t3 (a, b) VALUES (6, "Test 6");
INSERT INTO t3 (a, b) VALUES  (8, "Test 8");
INSERT INTO t3 (a, b) VALUES (10, "Test 10");
SELECT * FROM INFORMATION_SCHEMA.SESSION_STATUS WHERE VARIABLE_NAME LIKE 'HANDLER_%' AND VARIABLE_VALUE > 0;
VARIABLE_NAME	VARIABLE_VALUE
# 4 locks (1 table, 1 partition lock/unlock)
INSERT INTO t3 (a, b) VALUES (5, "Test 5");
INSERT INTO t3 (a, b) VALUES  (7, "Test 7");
INSERT INTO t3 (a, b) VALUES  (9, "Test 9");
SELECT * FROM INFORMATION_SCHEMA.SESSION_STATUS WHERE VARIABLE_NAME LIKE 'HANDLER_%' AND VARIABLE_VALUE > 0;
VARIABLE_NAME	VARIABLE_VALUE
# 4 locks (1 table, 1 partition lock/unlock)
INSERT INTO t3 (a, b) VALUES (0, "Test 0");
SELECT * FROM INFORMATION_SCHEMA.SESSION_STATUS WHERE VARIABLE_NAME LIKE 'HANDLER_%' AND VARIABLE_VALUE > 0;
VARIABLE_NAME	VARIABLE_VALUE
# 4 locks (1 table, 1 partition lock/unlock)
#
# Test handling of
# INSERT INTO <table> VALUES (<not all fields specified>)
#
INSERT INTO t3 (a) VALUES (1);
SELECT * FROM INFORMATION_SCHEMA.SESSION_STATUS WHERE VARIABLE_NAME LIKE 'HANDLER_%' AND VARIABLE_VALUE > 0;
VARIABLE_NAME	VARIABLE_VALUE
# 4 locks (1 table, 1 partition lock/unlock)
INSERT INTO t3 (a) VALUES (2);
INSERT INTO t3 (a) VALUES  (3);
INSERT INTO t3 (a) VALUES  (4);
SELECT * FROM INFORMATION_SCHEMA.SESSION_STATUS WHERE VARIABLE_NAME LIKE 'HANDLER_%' AND VARIABLE_VALUE > 0;
VARIABLE_NAME	VARIABLE_VALUE
# 6 locks (1 table, 2 partition lock/unlock)
INSERT INTO t3 (a) VALUES (6), (8), (10);
SELECT * FROM INFORMATION_SCHEMA.SESSION_STATUS WHERE VARIABLE_NAME LIKE 'HANDLER_%' AND VARIABLE_VALUE > 0;
VARIABLE_NAME	VARIABLE_VALUE
# 4 locks (1 table, 1 partition lock/unlock)
INSERT INTO t3 (a) VALUES (5), (7), (9);
SELECT * FROM INFORMATION_SCHEMA.SESSION_STATUS WHERE VARIABLE_NAME LIKE 'HANDLER_%' AND VARIABLE_VALUE > 0;
VARIABLE_NAME	VARIABLE_VALUE
# 4 locks (1 table, 1 partition lock/unlock)
INSERT INTO t3 (b) VALUES ("Only b 1");
SELECT * FROM INFORMATION_SCHEMA.SESSION_STATUS WHERE VARIABLE_NAME LIKE 'HANDLER_%' AND VARIABLE_VALUE > 0;
VARIABLE_NAME	VARIABLE_VALUE
# 4 locks (1 table, 1 partition lock/unlock)
INSERT INTO t3 (b) VALUES ("Only b 2"), ("Only b 3");
SELECT * FROM INFORMATION_SCHEMA.SESSION_STATUS WHERE VARIABLE_NAME LIKE 'HANDLER_%' AND VARIABLE_VALUE > 0;
VARIABLE_NAME	VARIABLE_VALUE
# 4 locks (1 table, 1 partition lock/unlock)
SELECT * FROM t3 ORDER BY a, b;
a	b
NULL	Only b 1
NULL	Only b 2
NULL	Only b 3
0	Test 0
0	Test 0
1	NULL
1	Test 1
1	Test 1
2	NULL
2	Test 2
2	Test 2
3	NULL
3	Test 3
3	Test 3
4	NULL
4	Test 4
4	Test 4
5	NULL
5	Test 5
5	Test 5
6	NULL
6	Test 6
6	Test 6
7	NULL
7	Test 7
7	Test 7
8	NULL
8	Test 8
8	Test 8
9	NULL
9	Test 9
9	Test 9
10	NULL
10	Test 10
10	Test 10
DROP TABLE t3;
#
# Test INSERT with timestamp column NO default function
#
SELECT UNIX_TIMESTAMP('2011-01-01 00:00:00') as time_t, UNIX_TIMESTAMP('2011-01-01 00:00:00') % 3 as part, 1234567890 % 3 as part2;
time_t	part	part2
1293811200	0	0
CREATE TABLE t3
(a timestamp DEFAULT 0,
b char(10),
PRIMARY KEY (a))
PARTITION BY HASH (UNIX_TIMESTAMP(a)) PARTITIONS 3;
SHOW CREATE TABLE t3;
Table	Create Table
t3	CREATE TABLE `t3` (
  `a` timestamp NOT NULL DEFAULT '0000-00-00 00:00:00',
  `b` char(10) DEFAULT NULL,
  PRIMARY KEY (`a`)
) ORGANIZATION INDEX DEFAULT CHARSET = utf8mb4 COMPRESSION = 'lz4_1.0' REPLICA_NUM = 1 BLOCK_SIZE = 16384 USE_BLOOM_FILTER = FALSE ENABLE_MACRO_BLOCK_BLOOM_FILTER = FALSE TABLET_SIZE = 134217728 PCTFREE = 10
 partition by hash(unix_timestamp(a))
(partition `p0`,
partition `p1`,
partition `p2`)
SELECT * FROM INFORMATION_SCHEMA.SESSION_STATUS WHERE VARIABLE_NAME LIKE 'HANDLER_%' AND VARIABLE_VALUE > 0;
VARIABLE_NAME	VARIABLE_VALUE
# 4 locks (1 table, 1 partition lock/unlock)
INSERT INTO t3 (a) VALUES ('2011-01-01 00:00:00');
SELECT * FROM INFORMATION_SCHEMA.SESSION_STATUS WHERE VARIABLE_NAME LIKE 'HANDLER_%' AND VARIABLE_VALUE > 0;
VARIABLE_NAME	VARIABLE_VALUE
# 4 locks (1 table, 1 partition lock/unlock)
INSERT INTO t3 (a) VALUES ('2011-01-01 00:00:01');
SELECT * FROM INFORMATION_SCHEMA.SESSION_STATUS WHERE VARIABLE_NAME LIKE 'HANDLER_%' AND VARIABLE_VALUE > 0;
VARIABLE_NAME	VARIABLE_VALUE
# 4 locks (1 table, 1 partition lock/unlock)
INSERT INTO t3 (a) VALUES ('2011-01-01 00:00:02');
INSERT INTO t3 (a) VALUES ('2011-01-01 00:00:03');
SELECT * FROM INFORMATION_SCHEMA.SESSION_STATUS WHERE VARIABLE_NAME LIKE 'HANDLER_%' AND VARIABLE_VALUE > 0;
VARIABLE_NAME	VARIABLE_VALUE
# 6 locks (1 table, 2 partition lock/unlock)
# 2 writes
SELECT * FROM INFORMATION_SCHEMA.SESSION_STATUS WHERE VARIABLE_NAME LIKE 'HANDLER_%' AND VARIABLE_VALUE > 0;
VARIABLE_NAME	VARIABLE_VALUE
INSERT INTO t3 (a) VALUES ('2011-01-01 00:00:01')
ON DUPLICATE KEY UPDATE a = '2011-01-01 00:00:05', b = "DUP_KEY2";
SELECT * FROM INFORMATION_SCHEMA.SESSION_STATUS WHERE VARIABLE_NAME LIKE 'HANDLER_%' AND VARIABLE_VALUE > 0;
VARIABLE_NAME	VARIABLE_VALUE
# 8 locks (1 table, 3 partition lock/unlock)
# No pruning due to updating partitioning field.
# 1 read_key + 1 delete + 2 write (1 failed + 1 ok)
# 1 delete + 1 write due to moved to different partition
SELECT * FROM INFORMATION_SCHEMA.SESSION_STATUS WHERE VARIABLE_NAME LIKE 'HANDLER_%' AND VARIABLE_VALUE > 0;
VARIABLE_NAME	VARIABLE_VALUE
REPLACE INTO t3 VALUES ('2011-01-01 00:00:04', 'Replace1');
SELECT * FROM INFORMATION_SCHEMA.SESSION_STATUS WHERE VARIABLE_NAME LIKE 'HANDLER_%' AND VARIABLE_VALUE > 0;
VARIABLE_NAME	VARIABLE_VALUE
# 4 locks (1 table, 1 partition lock/unlock)
REPLACE INTO t3 VALUES ('2011-01-01 00:00:04', 'Replace2');
SELECT * FROM INFORMATION_SCHEMA.SESSION_STATUS WHERE VARIABLE_NAME LIKE 'HANDLER_%' AND VARIABLE_VALUE > 0;
VARIABLE_NAME	VARIABLE_VALUE
# 4 locks (1 table, 1 partition lock/unlock)
# 1 read_key + 1 update + 1 failed write
#
# Test of replace of default PK (delete might be needed first)
#
DELETE FROM t3 WHERE a = 0;
SELECT * FROM INFORMATION_SCHEMA.SESSION_STATUS WHERE VARIABLE_NAME LIKE 'HANDLER_%' AND VARIABLE_VALUE > 0;
VARIABLE_NAME	VARIABLE_VALUE
# 4 locks (1 table, 1 partition lock/unlock)
SELECT * FROM INFORMATION_SCHEMA.SESSION_STATUS WHERE VARIABLE_NAME LIKE 'HANDLER_%' AND VARIABLE_VALUE > 0;
VARIABLE_NAME	VARIABLE_VALUE
# 4 locks (1 table, 1 partition lock/unlock)
# 1 read_key + 1 update + 1 failed write
SELECT * FROM t3;
a	b
2011-01-01 00:00:00	NULL
2011-01-01 00:00:03	NULL
2011-01-01 00:00:04	Replace2
2011-01-01 00:00:02	NULL
2011-01-01 00:00:05	DUP_KEY2
DROP TABLE t3;
#
# Test INSERT with timestamp column DEFAULT INSERT + UPDATE
#
CREATE TABLE t3
(a timestamp DEFAULT CURRENT_TIMESTAMP ON UPDATE CURRENT_TIMESTAMP,
b char(10),
PRIMARY KEY (a))
PARTITION BY HASH (UNIX_TIMESTAMP(a)) PARTITIONS 3;
SHOW CREATE TABLE t3;
Table	Create Table
t3	CREATE TABLE `t3` (
  `a` timestamp NOT NULL DEFAULT CURRENT_TIMESTAMP ON UPDATE CURRENT_TIMESTAMP,
  `b` char(10) DEFAULT NULL,
  PRIMARY KEY (`a`)
) ORGANIZATION INDEX DEFAULT CHARSET = utf8mb4 COMPRESSION = 'lz4_1.0' REPLICA_NUM = 1 BLOCK_SIZE = 16384 USE_BLOOM_FILTER = FALSE ENABLE_MACRO_BLOCK_BLOOM_FILTER = FALSE TABLET_SIZE = 134217728 PCTFREE = 10
 partition by hash(unix_timestamp(a))
(partition `p0`,
partition `p1`,
partition `p2`)
SELECT * FROM INFORMATION_SCHEMA.SESSION_STATUS WHERE VARIABLE_NAME LIKE 'HANDLER_%' AND VARIABLE_VALUE > 0;
VARIABLE_NAME	VARIABLE_VALUE
# 4 locks (1 table, 1 partition lock/unlock)
INSERT INTO t3 (a) VALUES ('2011-01-01 00:00:00');
SELECT * FROM INFORMATION_SCHEMA.SESSION_STATUS WHERE VARIABLE_NAME LIKE 'HANDLER_%' AND VARIABLE_VALUE > 0;
VARIABLE_NAME	VARIABLE_VALUE
# 4 locks (1 table, 1 partition lock/unlock)
INSERT INTO t3 (a) VALUES ('2011-01-01 00:00:01');
SELECT * FROM INFORMATION_SCHEMA.SESSION_STATUS WHERE VARIABLE_NAME LIKE 'HANDLER_%' AND VARIABLE_VALUE > 0;
VARIABLE_NAME	VARIABLE_VALUE
# 4 locks (1 table, 1 partition lock/unlock)
INSERT INTO t3 (a) VALUES ('2011-01-01 00:00:02');
INSERT INTO t3 (a) VALUES ('2011-01-01 00:00:03');
SELECT * FROM INFORMATION_SCHEMA.SESSION_STATUS WHERE VARIABLE_NAME LIKE 'HANDLER_%' AND VARIABLE_VALUE > 0;
VARIABLE_NAME	VARIABLE_VALUE
# 6 locks (1 table, 2 partition lock/unlock)
# 2 writes
SELECT * FROM INFORMATION_SCHEMA.SESSION_STATUS WHERE VARIABLE_NAME LIKE 'HANDLER_%' AND VARIABLE_VALUE > 0;
VARIABLE_NAME	VARIABLE_VALUE
INSERT INTO t3 (a) VALUES ('2011-01-01 00:00:01')
ON DUPLICATE KEY UPDATE a = '2011-01-01 00:00:05', b = "DUP_KEY2";
SELECT * FROM INFORMATION_SCHEMA.SESSION_STATUS WHERE VARIABLE_NAME LIKE 'HANDLER_%' AND VARIABLE_VALUE > 0;
VARIABLE_NAME	VARIABLE_VALUE
# 8 locks (1 table, 3 partition lock/unlock)
# No pruning due to updating partitioning field.
# 1 read_key + 1 delete + 2 write (1 failed + 1 ok)
# 1 delete + 1 write due to moved to different partition
SELECT * FROM INFORMATION_SCHEMA.SESSION_STATUS WHERE VARIABLE_NAME LIKE 'HANDLER_%' AND VARIABLE_VALUE > 0;
VARIABLE_NAME	VARIABLE_VALUE
REPLACE INTO t3 VALUES ('2011-01-01 00:00:04', 'Replace1');
SELECT * FROM INFORMATION_SCHEMA.SESSION_STATUS WHERE VARIABLE_NAME LIKE 'HANDLER_%' AND VARIABLE_VALUE > 0;
VARIABLE_NAME	VARIABLE_VALUE
# 4 locks (1 table, 1 partition lock/unlock)
REPLACE INTO t3 VALUES ('2011-01-01 00:00:04', 'Replace2');
SELECT * FROM INFORMATION_SCHEMA.SESSION_STATUS WHERE VARIABLE_NAME LIKE 'HANDLER_%' AND VARIABLE_VALUE > 0;
VARIABLE_NAME	VARIABLE_VALUE
# 4 locks (1 table, 1 partition lock/unlock)
# 1 read_key + 1 update + 1 failed write
#
# Test of replace of default PK (delete might be needed first)
#
DELETE FROM t3 WHERE a = 0;
SELECT * FROM INFORMATION_SCHEMA.SESSION_STATUS WHERE VARIABLE_NAME LIKE 'HANDLER_%' AND VARIABLE_VALUE > 0;
VARIABLE_NAME	VARIABLE_VALUE
# 4 locks (1 table, 1 partition lock/unlock)
SELECT * FROM INFORMATION_SCHEMA.SESSION_STATUS WHERE VARIABLE_NAME LIKE 'HANDLER_%' AND VARIABLE_VALUE > 0;
VARIABLE_NAME	VARIABLE_VALUE
# 4 locks (1 table, 1 partition lock/unlock)
# 1 read_key + 1 update + 1 failed write
SELECT * FROM t3;
a	b
2011-01-01 00:00:00	NULL
2011-01-01 00:00:03	NULL
2011-01-01 00:00:04	Replace2
2011-01-01 00:00:02	NULL
2011-01-01 00:00:05	DUP_KEY2
DROP TABLE t3;
#
# Test INSERT with timestamp column DEFAULT UPDATE
#
CREATE TABLE t3
(a timestamp DEFAULT 0 ON UPDATE CURRENT_TIMESTAMP,
b char(10),
PRIMARY KEY (a))
PARTITION BY HASH (UNIX_TIMESTAMP(a)) PARTITIONS 3;
SHOW CREATE TABLE t3;
Table	Create Table
t3	CREATE TABLE `t3` (
  `a` timestamp NOT NULL DEFAULT '0000-00-00 00:00:00' ON UPDATE CURRENT_TIMESTAMP,
  `b` char(10) DEFAULT NULL,
  PRIMARY KEY (`a`)
) ORGANIZATION INDEX DEFAULT CHARSET = utf8mb4 COMPRESSION = 'lz4_1.0' REPLICA_NUM = 1 BLOCK_SIZE = 16384 USE_BLOOM_FILTER = FALSE ENABLE_MACRO_BLOCK_BLOOM_FILTER = FALSE TABLET_SIZE = 134217728 PCTFREE = 10
 partition by hash(unix_timestamp(a))
(partition `p0`,
partition `p1`,
partition `p2`)
SELECT * FROM INFORMATION_SCHEMA.SESSION_STATUS WHERE VARIABLE_NAME LIKE 'HANDLER_%' AND VARIABLE_VALUE > 0;
VARIABLE_NAME	VARIABLE_VALUE
# 4 locks (1 table, 1 partition lock/unlock)
INSERT INTO t3 (a) VALUES ('2011-01-01 00:00:00');
SELECT * FROM INFORMATION_SCHEMA.SESSION_STATUS WHERE VARIABLE_NAME LIKE 'HANDLER_%' AND VARIABLE_VALUE > 0;
VARIABLE_NAME	VARIABLE_VALUE
# 4 locks (1 table, 1 partition lock/unlock)
INSERT INTO t3 (a) VALUES ('2011-01-01 00:00:01');
SELECT * FROM INFORMATION_SCHEMA.SESSION_STATUS WHERE VARIABLE_NAME LIKE 'HANDLER_%' AND VARIABLE_VALUE > 0;
VARIABLE_NAME	VARIABLE_VALUE
# 4 locks (1 table, 1 partition lock/unlock)
INSERT INTO t3 (a) VALUES ('2011-01-01 00:00:02');
INSERT INTO t3 (a) VALUES ('2011-01-01 00:00:03');
SELECT * FROM INFORMATION_SCHEMA.SESSION_STATUS WHERE VARIABLE_NAME LIKE 'HANDLER_%' AND VARIABLE_VALUE > 0;
VARIABLE_NAME	VARIABLE_VALUE
# 6 locks (1 table, 2 partition lock/unlock)
# 2 writes
SELECT * FROM INFORMATION_SCHEMA.SESSION_STATUS WHERE VARIABLE_NAME LIKE 'HANDLER_%' AND VARIABLE_VALUE > 0;
VARIABLE_NAME	VARIABLE_VALUE
INSERT INTO t3 (a) VALUES ('2011-01-01 00:00:01')
ON DUPLICATE KEY UPDATE a = '2011-01-01 00:00:05', b = "DUP_KEY2";
SELECT * FROM INFORMATION_SCHEMA.SESSION_STATUS WHERE VARIABLE_NAME LIKE 'HANDLER_%' AND VARIABLE_VALUE > 0;
VARIABLE_NAME	VARIABLE_VALUE
# 8 locks (1 table, 3 partition lock/unlock)
# No pruning due to updating partitioning field.
# 1 read_key + 1 delete + 2 write (1 failed + 1 ok)
# 1 delete + 1 write due to moved to different partition
SELECT * FROM INFORMATION_SCHEMA.SESSION_STATUS WHERE VARIABLE_NAME LIKE 'HANDLER_%' AND VARIABLE_VALUE > 0;
VARIABLE_NAME	VARIABLE_VALUE
REPLACE INTO t3 VALUES ('2011-01-01 00:00:04', 'Replace1');
SELECT * FROM INFORMATION_SCHEMA.SESSION_STATUS WHERE VARIABLE_NAME LIKE 'HANDLER_%' AND VARIABLE_VALUE > 0;
VARIABLE_NAME	VARIABLE_VALUE
# 4 locks (1 table, 1 partition lock/unlock)
REPLACE INTO t3 VALUES ('2011-01-01 00:00:04', 'Replace2');
SELECT * FROM INFORMATION_SCHEMA.SESSION_STATUS WHERE VARIABLE_NAME LIKE 'HANDLER_%' AND VARIABLE_VALUE > 0;
VARIABLE_NAME	VARIABLE_VALUE
# 4 locks (1 table, 1 partition lock/unlock)
# 1 read_key + 1 update + 1 failed write
#
# Test of replace of default PK (delete might be needed first)
#
DELETE FROM t3 WHERE a = 0;
SELECT * FROM INFORMATION_SCHEMA.SESSION_STATUS WHERE VARIABLE_NAME LIKE 'HANDLER_%' AND VARIABLE_VALUE > 0;
VARIABLE_NAME	VARIABLE_VALUE
# 4 locks (1 table, 1 partition lock/unlock)
SELECT * FROM INFORMATION_SCHEMA.SESSION_STATUS WHERE VARIABLE_NAME LIKE 'HANDLER_%' AND VARIABLE_VALUE > 0;
VARIABLE_NAME	VARIABLE_VALUE
# 4 locks (1 table, 1 partition lock/unlock)
# 1 read_key + 1 update + 1 failed write
SELECT * FROM t3;
a	b
2011-01-01 00:00:00	NULL
2011-01-01 00:00:03	NULL
2011-01-01 00:00:04	Replace2
2011-01-01 00:00:02	NULL
2011-01-01 00:00:05	DUP_KEY2
DROP TABLE t3;
#
# Test INSERT with timestamp column DEFAULT INSERT
#
CREATE TABLE t3
(a timestamp DEFAULT CURRENT_TIMESTAMP,
b char(10),
PRIMARY KEY (a))
PARTITION BY HASH (UNIX_TIMESTAMP(a)) PARTITIONS 3;
SHOW CREATE TABLE t3;
Table	Create Table
t3	CREATE TABLE `t3` (
  `a` timestamp NOT NULL DEFAULT CURRENT_TIMESTAMP,
  `b` char(10) DEFAULT NULL,
  PRIMARY KEY (`a`)
) ORGANIZATION INDEX DEFAULT CHARSET = utf8mb4 COMPRESSION = 'lz4_1.0' REPLICA_NUM = 1 BLOCK_SIZE = 16384 USE_BLOOM_FILTER = FALSE ENABLE_MACRO_BLOCK_BLOOM_FILTER = FALSE TABLET_SIZE = 134217728 PCTFREE = 10
 partition by hash(unix_timestamp(a))
(partition `p0`,
partition `p1`,
partition `p2`)
SELECT * FROM INFORMATION_SCHEMA.SESSION_STATUS WHERE VARIABLE_NAME LIKE 'HANDLER_%' AND VARIABLE_VALUE > 0;
VARIABLE_NAME	VARIABLE_VALUE
# 4 locks (1 table, 1 partition lock/unlock)
INSERT INTO t3 (a) VALUES ('2011-01-01 00:00:00');
SELECT * FROM INFORMATION_SCHEMA.SESSION_STATUS WHERE VARIABLE_NAME LIKE 'HANDLER_%' AND VARIABLE_VALUE > 0;
VARIABLE_NAME	VARIABLE_VALUE
# 4 locks (1 table, 1 partition lock/unlock)
INSERT INTO t3 (a) VALUES ('2011-01-01 00:00:01');
SELECT * FROM INFORMATION_SCHEMA.SESSION_STATUS WHERE VARIABLE_NAME LIKE 'HANDLER_%' AND VARIABLE_VALUE > 0;
VARIABLE_NAME	VARIABLE_VALUE
# 4 locks (1 table, 1 partition lock/unlock)
INSERT INTO t3 (a) VALUES ('2011-01-01 00:00:02');
INSERT INTO t3 (a) VALUES ('2011-01-01 00:00:03');
SELECT * FROM INFORMATION_SCHEMA.SESSION_STATUS WHERE VARIABLE_NAME LIKE 'HANDLER_%' AND VARIABLE_VALUE > 0;
VARIABLE_NAME	VARIABLE_VALUE
# 6 locks (1 table, 2 partition lock/unlock)
# 2 writes
SELECT * FROM INFORMATION_SCHEMA.SESSION_STATUS WHERE VARIABLE_NAME LIKE 'HANDLER_%' AND VARIABLE_VALUE > 0;
VARIABLE_NAME	VARIABLE_VALUE
INSERT INTO t3 (a) VALUES ('2011-01-01 00:00:01')
ON DUPLICATE KEY UPDATE a = '2011-01-01 00:00:05', b = "DUP_KEY2";
SELECT * FROM INFORMATION_SCHEMA.SESSION_STATUS WHERE VARIABLE_NAME LIKE 'HANDLER_%' AND VARIABLE_VALUE > 0;
VARIABLE_NAME	VARIABLE_VALUE
# 8 locks (1 table, 3 partition lock/unlock)
# No pruning due to updating partitioning field.
# 1 read_key + 1 delete + 2 write (1 failed + 1 ok)
# 1 delete + 1 write due to moved to different partition
SELECT * FROM INFORMATION_SCHEMA.SESSION_STATUS WHERE VARIABLE_NAME LIKE 'HANDLER_%' AND VARIABLE_VALUE > 0;
VARIABLE_NAME	VARIABLE_VALUE
REPLACE INTO t3 VALUES ('2011-01-01 00:00:04', 'Replace1');
SELECT * FROM INFORMATION_SCHEMA.SESSION_STATUS WHERE VARIABLE_NAME LIKE 'HANDLER_%' AND VARIABLE_VALUE > 0;
VARIABLE_NAME	VARIABLE_VALUE
# 4 locks (1 table, 1 partition lock/unlock)
REPLACE INTO t3 VALUES ('2011-01-01 00:00:04', 'Replace2');
SELECT * FROM INFORMATION_SCHEMA.SESSION_STATUS WHERE VARIABLE_NAME LIKE 'HANDLER_%' AND VARIABLE_VALUE > 0;
VARIABLE_NAME	VARIABLE_VALUE
# 4 locks (1 table, 1 partition lock/unlock)
# 1 read_key + 1 update + 1 failed write
#
# Test of replace of default PK (delete might be needed first)
#
DELETE FROM t3 WHERE a = 0;
SELECT * FROM INFORMATION_SCHEMA.SESSION_STATUS WHERE VARIABLE_NAME LIKE 'HANDLER_%' AND VARIABLE_VALUE > 0;
VARIABLE_NAME	VARIABLE_VALUE
# 4 locks (1 table, 1 partition lock/unlock)
SELECT * FROM INFORMATION_SCHEMA.SESSION_STATUS WHERE VARIABLE_NAME LIKE 'HANDLER_%' AND VARIABLE_VALUE > 0;
VARIABLE_NAME	VARIABLE_VALUE
# 4 locks (1 table, 1 partition lock/unlock)
# 1 read_key + 1 update + 1 failed write
SELECT * FROM t3;
a	b
2011-01-01 00:00:00	NULL
2011-01-01 00:00:03	NULL
2011-01-01 00:00:04	Replace2
2011-01-01 00:00:02	NULL
2011-01-01 00:00:05	DUP_KEY2
DROP TABLE t3;
#
# Test INSERT with DATETIME column NO default function
#
CREATE TABLE t3
(a DATETIME DEFAULT 0,
b char(10),
PRIMARY KEY (a))
PARTITION BY KEY (a) PARTITIONS 3;
SHOW CREATE TABLE t3;
Table	Create Table
t3	CREATE TABLE `t3` (
  `a` datetime NOT NULL DEFAULT '0000-00-00 00:00:00',
  `b` char(10) DEFAULT NULL,
  PRIMARY KEY (`a`)
) ORGANIZATION INDEX DEFAULT CHARSET = utf8mb4 COMPRESSION = 'lz4_1.0' REPLICA_NUM = 1 BLOCK_SIZE = 16384 USE_BLOOM_FILTER = FALSE ENABLE_MACRO_BLOCK_BLOOM_FILTER = FALSE TABLET_SIZE = 134217728 PCTFREE = 10
 partition by key(a)
(partition `p0`,
partition `p1`,
partition `p2`)
SELECT * FROM INFORMATION_SCHEMA.SESSION_STATUS WHERE VARIABLE_NAME LIKE 'HANDLER_%' AND VARIABLE_VALUE > 0;
VARIABLE_NAME	VARIABLE_VALUE
# 4 locks (1 table, 1 partition lock/unlock)
INSERT INTO t3 (a) VALUES ('2011-01-01 00:00:00');
SELECT * FROM INFORMATION_SCHEMA.SESSION_STATUS WHERE VARIABLE_NAME LIKE 'HANDLER_%' AND VARIABLE_VALUE > 0;
VARIABLE_NAME	VARIABLE_VALUE
# 4 locks (1 table, 1 partition lock/unlock)
INSERT INTO t3 (a) VALUES ('2011-01-01 00:00:01');
SELECT * FROM INFORMATION_SCHEMA.SESSION_STATUS WHERE VARIABLE_NAME LIKE 'HANDLER_%' AND VARIABLE_VALUE > 0;
VARIABLE_NAME	VARIABLE_VALUE
# 4 locks (1 table, 1 partition lock/unlock)
INSERT INTO t3 (a) VALUES ('2011-01-01 00:00:02');
INSERT INTO t3 (a) VALUES ('2011-01-01 00:00:03');
SELECT * FROM INFORMATION_SCHEMA.SESSION_STATUS WHERE VARIABLE_NAME LIKE 'HANDLER_%' AND VARIABLE_VALUE > 0;
VARIABLE_NAME	VARIABLE_VALUE
# 6 locks (1 table, 2 partition lock/unlock)
# 2 writes
SELECT * FROM INFORMATION_SCHEMA.SESSION_STATUS WHERE VARIABLE_NAME LIKE 'HANDLER_%' AND VARIABLE_VALUE > 0;
VARIABLE_NAME	VARIABLE_VALUE
INSERT INTO t3 (a) VALUES ('2011-01-01 00:00:01')
ON DUPLICATE KEY UPDATE a = '2011-01-01 00:00:05', b = "DUP_KEY2";
SELECT * FROM INFORMATION_SCHEMA.SESSION_STATUS WHERE VARIABLE_NAME LIKE 'HANDLER_%' AND VARIABLE_VALUE > 0;
VARIABLE_NAME	VARIABLE_VALUE
# 8 locks (1 table, 3 partition lock/unlock)
# No pruning due to updating partitioning field.
# 1 read_key + 1 delete + 2 write (1 failed + 1 ok)
# 1 delete + 1 write due to moved to different partition
SELECT * FROM INFORMATION_SCHEMA.SESSION_STATUS WHERE VARIABLE_NAME LIKE 'HANDLER_%' AND VARIABLE_VALUE > 0;
VARIABLE_NAME	VARIABLE_VALUE
REPLACE INTO t3 VALUES ('2011-01-01 00:00:04', 'Replace1');
SELECT * FROM INFORMATION_SCHEMA.SESSION_STATUS WHERE VARIABLE_NAME LIKE 'HANDLER_%' AND VARIABLE_VALUE > 0;
VARIABLE_NAME	VARIABLE_VALUE
# 4 locks (1 table, 1 partition lock/unlock)
REPLACE INTO t3 VALUES ('2011-01-01 00:00:04', 'Replace2');
SELECT * FROM INFORMATION_SCHEMA.SESSION_STATUS WHERE VARIABLE_NAME LIKE 'HANDLER_%' AND VARIABLE_VALUE > 0;
VARIABLE_NAME	VARIABLE_VALUE
# 4 locks (1 table, 1 partition lock/unlock)
# 1 read_key + 1 update + 1 failed write
#
# Test of replace of default PK (delete might be needed first)
#
DELETE FROM t3 WHERE a = 0;
SELECT * FROM INFORMATION_SCHEMA.SESSION_STATUS WHERE VARIABLE_NAME LIKE 'HANDLER_%' AND VARIABLE_VALUE > 0;
VARIABLE_NAME	VARIABLE_VALUE
# 4 locks (1 table, 1 partition lock/unlock)
SELECT * FROM INFORMATION_SCHEMA.SESSION_STATUS WHERE VARIABLE_NAME LIKE 'HANDLER_%' AND VARIABLE_VALUE > 0;
VARIABLE_NAME	VARIABLE_VALUE
# 4 locks (1 table, 1 partition lock/unlock)
# 1 read_key + 1 update + 1 failed write
SELECT * FROM t3;
a	b
2011-01-01 00:00:00	NULL
2011-01-01 00:00:05	DUP_KEY2
2011-01-01 00:00:03	NULL
2011-01-01 00:00:04	Replace2
2011-01-01 00:00:02	NULL
DROP TABLE t3;
#
# Test INSERT with DATETIME column DEFAULT INSERT + UPDATE
#
CREATE TABLE t3
(a DATETIME DEFAULT CURRENT_TIMESTAMP ON UPDATE CURRENT_TIMESTAMP,
b char(10),
PRIMARY KEY (a))
PARTITION BY KEY (a) PARTITIONS 3;
SHOW CREATE TABLE t3;
Table	Create Table
t3	CREATE TABLE `t3` (
  `a` datetime NOT NULL DEFAULT CURRENT_TIMESTAMP ON UPDATE CURRENT_TIMESTAMP,
  `b` char(10) DEFAULT NULL,
  PRIMARY KEY (`a`)
) ORGANIZATION INDEX DEFAULT CHARSET = utf8mb4 COMPRESSION = 'lz4_1.0' REPLICA_NUM = 1 BLOCK_SIZE = 16384 USE_BLOOM_FILTER = FALSE ENABLE_MACRO_BLOCK_BLOOM_FILTER = FALSE TABLET_SIZE = 134217728 PCTFREE = 10
 partition by key(a)
(partition `p0`,
partition `p1`,
partition `p2`)
SELECT * FROM INFORMATION_SCHEMA.SESSION_STATUS WHERE VARIABLE_NAME LIKE 'HANDLER_%' AND VARIABLE_VALUE > 0;
VARIABLE_NAME	VARIABLE_VALUE
# 4 locks (1 table, 1 partition lock/unlock)
INSERT INTO t3 (a) VALUES ('2011-01-01 00:00:00');
SELECT * FROM INFORMATION_SCHEMA.SESSION_STATUS WHERE VARIABLE_NAME LIKE 'HANDLER_%' AND VARIABLE_VALUE > 0;
VARIABLE_NAME	VARIABLE_VALUE
# 4 locks (1 table, 1 partition lock/unlock)
INSERT INTO t3 (a) VALUES ('2011-01-01 00:00:01');
SELECT * FROM INFORMATION_SCHEMA.SESSION_STATUS WHERE VARIABLE_NAME LIKE 'HANDLER_%' AND VARIABLE_VALUE > 0;
VARIABLE_NAME	VARIABLE_VALUE
# 4 locks (1 table, 1 partition lock/unlock)
INSERT INTO t3 (a) VALUES ('2011-01-01 00:00:02');
INSERT INTO t3 (a) VALUES ('2011-01-01 00:00:03');
SELECT * FROM INFORMATION_SCHEMA.SESSION_STATUS WHERE VARIABLE_NAME LIKE 'HANDLER_%' AND VARIABLE_VALUE > 0;
VARIABLE_NAME	VARIABLE_VALUE
# 6 locks (1 table, 2 partition lock/unlock)
# 2 writes
SELECT * FROM INFORMATION_SCHEMA.SESSION_STATUS WHERE VARIABLE_NAME LIKE 'HANDLER_%' AND VARIABLE_VALUE > 0;
VARIABLE_NAME	VARIABLE_VALUE
INSERT INTO t3 (a) VALUES ('2011-01-01 00:00:01')
ON DUPLICATE KEY UPDATE a = '2011-01-01 00:00:05', b = "DUP_KEY2";
SELECT * FROM INFORMATION_SCHEMA.SESSION_STATUS WHERE VARIABLE_NAME LIKE 'HANDLER_%' AND VARIABLE_VALUE > 0;
VARIABLE_NAME	VARIABLE_VALUE
# 8 locks (1 table, 3 partition lock/unlock)
# No pruning due to updating partitioning field.
# 1 read_key + 1 delete + 2 write (1 failed + 1 ok)
# 1 delete + 1 write due to moved to different partition
SELECT * FROM INFORMATION_SCHEMA.SESSION_STATUS WHERE VARIABLE_NAME LIKE 'HANDLER_%' AND VARIABLE_VALUE > 0;
VARIABLE_NAME	VARIABLE_VALUE
REPLACE INTO t3 VALUES ('2011-01-01 00:00:04', 'Replace1');
SELECT * FROM INFORMATION_SCHEMA.SESSION_STATUS WHERE VARIABLE_NAME LIKE 'HANDLER_%' AND VARIABLE_VALUE > 0;
VARIABLE_NAME	VARIABLE_VALUE
# 4 locks (1 table, 1 partition lock/unlock)
REPLACE INTO t3 VALUES ('2011-01-01 00:00:04', 'Replace2');
SELECT * FROM INFORMATION_SCHEMA.SESSION_STATUS WHERE VARIABLE_NAME LIKE 'HANDLER_%' AND VARIABLE_VALUE > 0;
VARIABLE_NAME	VARIABLE_VALUE
# 4 locks (1 table, 1 partition lock/unlock)
# 1 read_key + 1 update + 1 failed write
#
# Test of replace of default PK (delete might be needed first)
#
DELETE FROM t3 WHERE a = 0;
SELECT * FROM INFORMATION_SCHEMA.SESSION_STATUS WHERE VARIABLE_NAME LIKE 'HANDLER_%' AND VARIABLE_VALUE > 0;
VARIABLE_NAME	VARIABLE_VALUE
# 4 locks (1 table, 1 partition lock/unlock)
SELECT * FROM INFORMATION_SCHEMA.SESSION_STATUS WHERE VARIABLE_NAME LIKE 'HANDLER_%' AND VARIABLE_VALUE > 0;
VARIABLE_NAME	VARIABLE_VALUE
# 4 locks (1 table, 1 partition lock/unlock)
# 1 read_key + 1 update + 1 failed write
SELECT * FROM t3;
a	b
2011-01-01 00:00:00	NULL
2011-01-01 00:00:05	DUP_KEY2
2011-01-01 00:00:03	NULL
2011-01-01 00:00:04	Replace2
2011-01-01 00:00:02	NULL
DROP TABLE t3;
#
# Test INSERT with DATETIME column DEFAULT UPDATE
#
CREATE TABLE t3
(a DATETIME DEFAULT 0 ON UPDATE CURRENT_TIMESTAMP,
b char(10),
PRIMARY KEY (a))
PARTITION BY KEY (a) PARTITIONS 3;
SHOW CREATE TABLE t3;
Table	Create Table
t3	CREATE TABLE `t3` (
  `a` datetime NOT NULL DEFAULT '0000-00-00 00:00:00' ON UPDATE CURRENT_TIMESTAMP,
  `b` char(10) DEFAULT NULL,
  PRIMARY KEY (`a`)
) ORGANIZATION INDEX DEFAULT CHARSET = utf8mb4 COMPRESSION = 'lz4_1.0' REPLICA_NUM = 1 BLOCK_SIZE = 16384 USE_BLOOM_FILTER = FALSE ENABLE_MACRO_BLOCK_BLOOM_FILTER = FALSE TABLET_SIZE = 134217728 PCTFREE = 10
 partition by key(a)
(partition `p0`,
partition `p1`,
partition `p2`)
SELECT * FROM INFORMATION_SCHEMA.SESSION_STATUS WHERE VARIABLE_NAME LIKE 'HANDLER_%' AND VARIABLE_VALUE > 0;
VARIABLE_NAME	VARIABLE_VALUE
# 4 locks (1 table, 1 partition lock/unlock)
INSERT INTO t3 (a) VALUES ('2011-01-01 00:00:00');
SELECT * FROM INFORMATION_SCHEMA.SESSION_STATUS WHERE VARIABLE_NAME LIKE 'HANDLER_%' AND VARIABLE_VALUE > 0;
VARIABLE_NAME	VARIABLE_VALUE
# 4 locks (1 table, 1 partition lock/unlock)
INSERT INTO t3 (a) VALUES ('2011-01-01 00:00:01');
SELECT * FROM INFORMATION_SCHEMA.SESSION_STATUS WHERE VARIABLE_NAME LIKE 'HANDLER_%' AND VARIABLE_VALUE > 0;
VARIABLE_NAME	VARIABLE_VALUE
# 4 locks (1 table, 1 partition lock/unlock)
INSERT INTO t3 (a) VALUES ('2011-01-01 00:00:02');
INSERT INTO t3 (a) VALUES ('2011-01-01 00:00:03');
SELECT * FROM INFORMATION_SCHEMA.SESSION_STATUS WHERE VARIABLE_NAME LIKE 'HANDLER_%' AND VARIABLE_VALUE > 0;
VARIABLE_NAME	VARIABLE_VALUE
# 6 locks (1 table, 2 partition lock/unlock)
# 2 writes
SELECT * FROM INFORMATION_SCHEMA.SESSION_STATUS WHERE VARIABLE_NAME LIKE 'HANDLER_%' AND VARIABLE_VALUE > 0;
VARIABLE_NAME	VARIABLE_VALUE
INSERT INTO t3 (a) VALUES ('2011-01-01 00:00:01')
ON DUPLICATE KEY UPDATE a = '2011-01-01 00:00:05', b = "DUP_KEY2";
SELECT * FROM INFORMATION_SCHEMA.SESSION_STATUS WHERE VARIABLE_NAME LIKE 'HANDLER_%' AND VARIABLE_VALUE > 0;
VARIABLE_NAME	VARIABLE_VALUE
# 8 locks (1 table, 3 partition lock/unlock)
# No pruning due to updating partitioning field.
# 1 read_key + 1 delete + 2 write (1 failed + 1 ok)
# 1 delete + 1 write due to moved to different partition
SELECT * FROM INFORMATION_SCHEMA.SESSION_STATUS WHERE VARIABLE_NAME LIKE 'HANDLER_%' AND VARIABLE_VALUE > 0;
VARIABLE_NAME	VARIABLE_VALUE
REPLACE INTO t3 VALUES ('2011-01-01 00:00:04', 'Replace1');
SELECT * FROM INFORMATION_SCHEMA.SESSION_STATUS WHERE VARIABLE_NAME LIKE 'HANDLER_%' AND VARIABLE_VALUE > 0;
VARIABLE_NAME	VARIABLE_VALUE
# 4 locks (1 table, 1 partition lock/unlock)
REPLACE INTO t3 VALUES ('2011-01-01 00:00:04', 'Replace2');
SELECT * FROM INFORMATION_SCHEMA.SESSION_STATUS WHERE VARIABLE_NAME LIKE 'HANDLER_%' AND VARIABLE_VALUE > 0;
VARIABLE_NAME	VARIABLE_VALUE
# 4 locks (1 table, 1 partition lock/unlock)
# 1 read_key + 1 update + 1 failed write
#
# Test of replace of default PK (delete might be needed first)
#
DELETE FROM t3 WHERE a = 0;
SELECT * FROM INFORMATION_SCHEMA.SESSION_STATUS WHERE VARIABLE_NAME LIKE 'HANDLER_%' AND VARIABLE_VALUE > 0;
VARIABLE_NAME	VARIABLE_VALUE
# 4 locks (1 table, 1 partition lock/unlock)
SELECT * FROM INFORMATION_SCHEMA.SESSION_STATUS WHERE VARIABLE_NAME LIKE 'HANDLER_%' AND VARIABLE_VALUE > 0;
VARIABLE_NAME	VARIABLE_VALUE
# 4 locks (1 table, 1 partition lock/unlock)
# 1 read_key + 1 update + 1 failed write
SELECT * FROM t3;
a	b
2011-01-01 00:00:00	NULL
2011-01-01 00:00:05	DUP_KEY2
2011-01-01 00:00:03	NULL
2011-01-01 00:00:04	Replace2
2011-01-01 00:00:02	NULL
DROP TABLE t3;
#
# Test INSERT with DATETIME column DEFAULT INSERT
#
CREATE TABLE t3
(a DATETIME DEFAULT CURRENT_TIMESTAMP,
b char(10),
PRIMARY KEY (a))
PARTITION BY KEY (a) PARTITIONS 3;
SHOW CREATE TABLE t3;
Table	Create Table
t3	CREATE TABLE `t3` (
  `a` datetime NOT NULL DEFAULT CURRENT_TIMESTAMP,
  `b` char(10) DEFAULT NULL,
  PRIMARY KEY (`a`)
) ORGANIZATION INDEX DEFAULT CHARSET = utf8mb4 COMPRESSION = 'lz4_1.0' REPLICA_NUM = 1 BLOCK_SIZE = 16384 USE_BLOOM_FILTER = FALSE ENABLE_MACRO_BLOCK_BLOOM_FILTER = FALSE TABLET_SIZE = 134217728 PCTFREE = 10
 partition by key(a)
(partition `p0`,
partition `p1`,
partition `p2`)
SELECT * FROM INFORMATION_SCHEMA.SESSION_STATUS WHERE VARIABLE_NAME LIKE 'HANDLER_%' AND VARIABLE_VALUE > 0;
VARIABLE_NAME	VARIABLE_VALUE
# 4 locks (1 table, 1 partition lock/unlock)
INSERT INTO t3 (a) VALUES ('2011-01-01 00:00:00');
SELECT * FROM INFORMATION_SCHEMA.SESSION_STATUS WHERE VARIABLE_NAME LIKE 'HANDLER_%' AND VARIABLE_VALUE > 0;
VARIABLE_NAME	VARIABLE_VALUE
# 4 locks (1 table, 1 partition lock/unlock)
INSERT INTO t3 (a) VALUES ('2011-01-01 00:00:01');
SELECT * FROM INFORMATION_SCHEMA.SESSION_STATUS WHERE VARIABLE_NAME LIKE 'HANDLER_%' AND VARIABLE_VALUE > 0;
VARIABLE_NAME	VARIABLE_VALUE
# 4 locks (1 table, 1 partition lock/unlock)
INSERT INTO t3 (a) VALUES ('2011-01-01 00:00:02');
INSERT INTO t3 (a) VALUES ('2011-01-01 00:00:03');
SELECT * FROM INFORMATION_SCHEMA.SESSION_STATUS WHERE VARIABLE_NAME LIKE 'HANDLER_%' AND VARIABLE_VALUE > 0;
VARIABLE_NAME	VARIABLE_VALUE
# 6 locks (1 table, 2 partition lock/unlock)
# 2 writes
SELECT * FROM INFORMATION_SCHEMA.SESSION_STATUS WHERE VARIABLE_NAME LIKE 'HANDLER_%' AND VARIABLE_VALUE > 0;
VARIABLE_NAME	VARIABLE_VALUE
INSERT INTO t3 (a) VALUES ('2011-01-01 00:00:01')
ON DUPLICATE KEY UPDATE a = '2011-01-01 00:00:05', b = "DUP_KEY2";
SELECT * FROM INFORMATION_SCHEMA.SESSION_STATUS WHERE VARIABLE_NAME LIKE 'HANDLER_%' AND VARIABLE_VALUE > 0;
VARIABLE_NAME	VARIABLE_VALUE
# 8 locks (1 table, 3 partition lock/unlock)
# No pruning due to updating partitioning field.
# 1 read_key + 1 delete + 2 write (1 failed + 1 ok)
# 1 delete + 1 write due to moved to different partition
SELECT * FROM INFORMATION_SCHEMA.SESSION_STATUS WHERE VARIABLE_NAME LIKE 'HANDLER_%' AND VARIABLE_VALUE > 0;
VARIABLE_NAME	VARIABLE_VALUE
REPLACE INTO t3 VALUES ('2011-01-01 00:00:04', 'Replace1');
SELECT * FROM INFORMATION_SCHEMA.SESSION_STATUS WHERE VARIABLE_NAME LIKE 'HANDLER_%' AND VARIABLE_VALUE > 0;
VARIABLE_NAME	VARIABLE_VALUE
# 4 locks (1 table, 1 partition lock/unlock)
REPLACE INTO t3 VALUES ('2011-01-01 00:00:04', 'Replace2');
SELECT * FROM INFORMATION_SCHEMA.SESSION_STATUS WHERE VARIABLE_NAME LIKE 'HANDLER_%' AND VARIABLE_VALUE > 0;
VARIABLE_NAME	VARIABLE_VALUE
# 4 locks (1 table, 1 partition lock/unlock)
# 1 read_key + 1 update + 1 failed write
#
# Test of replace of default PK (delete might be needed first)
#
DELETE FROM t3 WHERE a = 0;
SELECT * FROM INFORMATION_SCHEMA.SESSION_STATUS WHERE VARIABLE_NAME LIKE 'HANDLER_%' AND VARIABLE_VALUE > 0;
VARIABLE_NAME	VARIABLE_VALUE
# 4 locks (1 table, 1 partition lock/unlock)
SELECT * FROM INFORMATION_SCHEMA.SESSION_STATUS WHERE VARIABLE_NAME LIKE 'HANDLER_%' AND VARIABLE_VALUE > 0;
VARIABLE_NAME	VARIABLE_VALUE
# 4 locks (1 table, 1 partition lock/unlock)
# 1 read_key + 1 update + 1 failed write
SELECT * FROM t3;
a	b
2011-01-01 00:00:00	NULL
2011-01-01 00:00:05	DUP_KEY2
2011-01-01 00:00:03	NULL
2011-01-01 00:00:04	Replace2
2011-01-01 00:00:02	NULL
DROP TABLE t3;
#
# Test INSERT SELECT
#
SELECT * FROM INFORMATION_SCHEMA.SESSION_STATUS WHERE VARIABLE_NAME LIKE 'HANDLER_%' AND VARIABLE_VALUE > 0;
VARIABLE_NAME	VARIABLE_VALUE
# All partitions needs to be locked
# 28 locks (table + 13 partition lock/unlock)
# 1 commit
INSERT INTO t2 SELECT a, b FROM t1 WHERE a IN (1,4);
ERROR 23000: Duplicate entry '1' for key 'PRIMARY'
SELECT * FROM INFORMATION_SCHEMA.SESSION_STATUS WHERE VARIABLE_NAME LIKE 'HANDLER_%' AND VARIABLE_VALUE > 0;
VARIABLE_NAME	VARIABLE_VALUE
# All partitions in t2 needs to be locked (no propagation from t1 yet).
# 2 partitions in t1 needs to be locked (for 1 and 4)
# 34 locks (2 table + 15 partition lock/unlock)
# 2 read_first, read_key and read_next.
# 1 commit
#
# Test TRUNCATE PARTITION
#
SELECT * FROM INFORMATION_SCHEMA.SESSION_STATUS WHERE VARIABLE_NAME LIKE 'HANDLER_%' AND VARIABLE_VALUE > 0;
VARIABLE_NAME	VARIABLE_VALUE
# 4 locks (1 table, 1 partition lock/unlock)
SELECT * FROM INFORMATION_SCHEMA.SESSION_STATUS WHERE VARIABLE_NAME LIKE 'HANDLER_%' AND VARIABLE_VALUE > 0;
VARIABLE_NAME	VARIABLE_VALUE
# 32 locks (2 table + 13 + 1 partitions)
#
# Test insert on duplicated key update
#
INSERT INTO t1 VALUES (65, "No duplicate")
ON DUPLICATE KEY UPDATE b = CONCAT(b, ", INSERT_DUP_KEY_UPDATE");
SELECT * FROM INFORMATION_SCHEMA.SESSION_STATUS WHERE VARIABLE_NAME LIKE 'HANDLER_%' AND VARIABLE_VALUE > 0;
VARIABLE_NAME	VARIABLE_VALUE
# 4 lock (1 table + 1 partition lock/unlock)
# 1 write (insert)
# 1 commit
INSERT INTO t1 VALUES (65, "No duplicate")
ON DUPLICATE KEY UPDATE b = CONCAT(b, ", INSERT_DUP_KEY_UPDATE");
SELECT * FROM INFORMATION_SCHEMA.SESSION_STATUS WHERE VARIABLE_NAME LIKE 'HANDLER_%' AND VARIABLE_VALUE > 0;
VARIABLE_NAME	VARIABLE_VALUE
# 4 lock (1 table + 1 partition lock/unlock)
# 1 read_key
# 1 update
# 1 commit
INSERT INTO t1 VALUES (78, "No duplicate")
ON DUPLICATE KEY UPDATE a = a + 13, b = CONCAT(b, ", INSERT_DUP_KEY_UPDATE");
SELECT * FROM INFORMATION_SCHEMA.SESSION_STATUS WHERE VARIABLE_NAME LIKE 'HANDLER_%' AND VARIABLE_VALUE > 0;
VARIABLE_NAME	VARIABLE_VALUE
# If a partitioning column is updated, no pruning
# 28 lock (1 table + 13 partition lock/unlock)
# 1 write (insert)
# 1 commit
INSERT INTO t1 VALUES (78, "No duplicate")
ON DUPLICATE KEY UPDATE a = a + 13, b = CONCAT(b, ", INSERT_DUP_KEY_UPDATE");
SELECT * FROM INFORMATION_SCHEMA.SESSION_STATUS WHERE VARIABLE_NAME LIKE 'HANDLER_%' AND VARIABLE_VALUE > 0;
VARIABLE_NAME	VARIABLE_VALUE
# If partitioning column is updated, no pruning
# 28 lock (1 table + 13 partition lock/unlock)
# 1 read_key
# 1 update
# 1 commit
#
# Test of insert on duplicate key with failed update
#
INSERT INTO t1 VALUES (78, "No duplicate")
ON DUPLICATE KEY UPDATE a = a + 13,
b = CONCAT(b, ", INSERT_DUP_KEY_UPDATE third");
SELECT * FROM INFORMATION_SCHEMA.SESSION_STATUS WHERE VARIABLE_NAME LIKE 'HANDLER_%' AND VARIABLE_VALUE > 0;
VARIABLE_NAME	VARIABLE_VALUE
# If partitioning column is updated, no pruning
# 28 lock (1 table + 13 partition lock/unlock)
# 1 commit
INSERT INTO t1 VALUES (78, "No duplicate")
ON DUPLICATE KEY UPDATE a = a + 13,
b = CONCAT(b, ", INSERT_DUP_KEY_UPDATE fail?");
ERROR 23000: Duplicate entry '91' for key 'PRIMARY'
SELECT * FROM INFORMATION_SCHEMA.SESSION_STATUS WHERE VARIABLE_NAME LIKE 'HANDLER_%' AND VARIABLE_VALUE > 0;
VARIABLE_NAME	VARIABLE_VALUE
# If partitioning column is updated, no pruning
# 28 lock (1 table + 13 partition lock/unlock)
# 1 read_key
# 1 update
# 1 rollback
#
# Test of insert on duplicate key with update to different partition
#
INSERT INTO t1 VALUES (104, "No duplicate")
ON DUPLICATE KEY UPDATE a = a + 1;
SELECT * FROM INFORMATION_SCHEMA.SESSION_STATUS WHERE VARIABLE_NAME LIKE 'HANDLER_%' AND VARIABLE_VALUE > 0;
VARIABLE_NAME	VARIABLE_VALUE
# If partitioning column is updated, no pruning
# 28 lock (1 table + 13 partition lock/unlock)
# 1 write
# 1 commit
INSERT INTO t1 VALUES (104, "No duplicate")
ON DUPLICATE KEY UPDATE a = a + 1;
SELECT * FROM INFORMATION_SCHEMA.SESSION_STATUS WHERE VARIABLE_NAME LIKE 'HANDLER_%' AND VARIABLE_VALUE > 0;
VARIABLE_NAME	VARIABLE_VALUE
# If partitioning column is updated, no pruning
# 28 lock (1 table + 13 partition lock/unlock)
# 1 delete
# 1 write
# 1 read_key
# 1 commit
INSERT INTO t1 VALUES (104, "No duplicate 104")
ON DUPLICATE KEY UPDATE a = a + 1;
SELECT * FROM INFORMATION_SCHEMA.SESSION_STATUS WHERE VARIABLE_NAME LIKE 'HANDLER_%' AND VARIABLE_VALUE > 0;
VARIABLE_NAME	VARIABLE_VALUE
# If partitioning column is updated, no pruning
# 28 lock (1 table + 13 partition lock/unlock)
# 1 write
# 1 commit
#
# Test of insert on duplicate key with failed update to different
# partition
#
INSERT INTO t1 VALUES (104, "No duplicate 104 + 1")
ON DUPLICATE KEY UPDATE a = a + 1;
ERROR 23000: Duplicate entry '105' for key 'PRIMARY'
SELECT * FROM INFORMATION_SCHEMA.SESSION_STATUS WHERE VARIABLE_NAME LIKE 'HANDLER_%' AND VARIABLE_VALUE > 0;
VARIABLE_NAME	VARIABLE_VALUE
# If partitioning column is updated, no pruning
# 28 lock (1 table + 13 partition lock/unlock)
# 1 write
# 1 read_key
# 1 rollback
#
# Test replace
#
REPLACE INTO t1 VALUES (5, "REPLACE first");
SELECT * FROM INFORMATION_SCHEMA.SESSION_STATUS WHERE VARIABLE_NAME LIKE 'HANDLER_%' AND VARIABLE_VALUE > 0;
VARIABLE_NAME	VARIABLE_VALUE
# 4 lock (1 table + 1 partition lock/unlock)
# 1 write
# 1 commit
REPLACE INTO t1 VALUES (5, "REPLACE second");
SELECT * FROM INFORMATION_SCHEMA.SESSION_STATUS WHERE VARIABLE_NAME LIKE 'HANDLER_%' AND VARIABLE_VALUE > 0;
VARIABLE_NAME	VARIABLE_VALUE
# 4 lock (1 table + 1 partition lock/unlock)
# 1 write
# 1 read_key
# 1 update (NOTE: write_record() may cheat instead of delete/insert!)
# 1 rollback
#
# Test SELECT
#
SELECT * FROM t1 ORDER BY a;
a	b
0	First row, p0
1	First row, p1
2	First row, p2
3	First row, p3
4	First row, p4
5	REPLACE second
13	Second row, p0
26	Third row, p0
39	Fourth row, p0
52	Fifth row, p0
65	No duplicate, INSERT_DUP_KEY_UPDATE
78	No duplicate
91	No duplicate, INSERT_DUP_KEY_UPDATE
104	No duplicate 104
105	No duplicate
SELECT * FROM INFORMATION_SCHEMA.SESSION_STATUS WHERE VARIABLE_NAME LIKE 'HANDLER_%' AND VARIABLE_VALUE > 0;
VARIABLE_NAME	VARIABLE_VALUE
# 28 locks
# 13 read_first
# 13 read_key
# 15 read_next
SELECT * FROM t1 WHERE a IN (0, 1, 4) ORDER BY a;
a	b
0	First row, p0
1	First row, p1
4	First row, p4
SELECT * FROM INFORMATION_SCHEMA.SESSION_STATUS WHERE VARIABLE_NAME LIKE 'HANDLER_%' AND VARIABLE_VALUE > 0;
VARIABLE_NAME	VARIABLE_VALUE
# 8 locks (1 table + 3 partitions lock/unlock)
# 3 read_first, read_key
# 12 read_next
SELECT * FROM t1 WHERE a IN (13, 26, 39, 52);
a	b
13	Second row, p0
26	Third row, p0
39	Fourth row, p0
52	Fifth row, p0
SELECT * FROM INFORMATION_SCHEMA.SESSION_STATUS WHERE VARIABLE_NAME LIKE 'HANDLER_%' AND VARIABLE_VALUE > 0;
VARIABLE_NAME	VARIABLE_VALUE
# 4 locks (1 table + 1 partitions lock/unlock)
# 1 read_first, read_key
# 9 read_next
SELECT * FROM t1 WHERE a = 3;
a	b
3	First row, p3
SELECT * FROM INFORMATION_SCHEMA.SESSION_STATUS WHERE VARIABLE_NAME LIKE 'HANDLER_%' AND VARIABLE_VALUE > 0;
VARIABLE_NAME	VARIABLE_VALUE
# 4 locks
# 1 read_key
SELECT * FROM t1 WHERE b LIKE 'First%' ORDER BY a;
a	b
0	First row, p0
1	First row, p1
2	First row, p2
3	First row, p3
4	First row, p4
SELECT * FROM INFORMATION_SCHEMA.SESSION_STATUS WHERE VARIABLE_NAME LIKE 'HANDLER_%' AND VARIABLE_VALUE > 0;
VARIABLE_NAME	VARIABLE_VALUE
# 28 locks
# 13 read_key
# 5 read_next
#
# Test EXPLAIN BASIC SELECT
#
EXPLAIN BASIC SELECT * FROM t1;
Query Plan
=======================================
|ID|OPERATOR                 |NAME    |
---------------------------------------
|0 |PX COORDINATOR           |        |
|1 |└─EXCHANGE OUT DISTR     |:EX10000|
|2 |  └─PX PARTITION ITERATOR|        |
|3 |    └─TABLE FULL SCAN    |t1      |
=======================================
Outputs & filters:
-------------------------------------
  0 - output([INTERNAL_FUNCTION(t1.a, t1.b)]), filter(nil), rowset=256
  1 - output([INTERNAL_FUNCTION(t1.a, t1.b)]), filter(nil), rowset=256
      dop=1
  2 - output([t1.a], [t1.b]), filter(nil), rowset=256
      force partition granule
  3 - output([t1.a], [t1.b]), filter(nil), rowset=256
      access([t1.a], [t1.b]), partitions(p[0-12])
      is_index_back=false, is_global_index=false, 
      range_key([t1.a]), range(MIN ; MAX)always true
SELECT * FROM INFORMATION_SCHEMA.SESSION_STATUS WHERE VARIABLE_NAME LIKE 'HANDLER_%' AND VARIABLE_VALUE > 0;
VARIABLE_NAME	VARIABLE_VALUE
# 28 locks (1 table + 13 partition lock/unlock)
EXPLAIN BASIC SELECT * FROM t1 WHERE a IN (0, 1, 4) ORDER BY a;
Query Plan
=========================================
|ID|OPERATOR                   |NAME    |
-----------------------------------------
|0 |PX COORDINATOR MERGE SORT  |        |
|1 |└─EXCHANGE OUT DISTR       |:EX10000|
|2 |  └─SORT                   |        |
|3 |    └─PX PARTITION ITERATOR|        |
|4 |      └─TABLE GET          |t1      |
=========================================
Outputs & filters:
-------------------------------------
  0 - output([INTERNAL_FUNCTION(t1.a, t1.b)]), filter(nil), rowset=16
      sort_keys([t1.a, ASC])
  1 - output([t1.a], [INTERNAL_FUNCTION(t1.a, t1.b)]), filter(nil), rowset=16
      dop=1
  2 - output([t1.a], [t1.b]), filter(nil), rowset=16
      sort_keys([t1.a, ASC]), local merge sort
  3 - output([t1.a], [t1.b]), filter(nil), rowset=16
      force partition granule
  4 - output([t1.a], [t1.b]), filter(nil), rowset=16
      access([t1.a], [t1.b]), partitions(p[0-1], p4)
      is_index_back=false, is_global_index=false, 
      range_key([t1.a]), range[0 ; 0], [1 ; 1], [4 ; 4], 
      range_cond([t1.a IN (0, 1, 4)])
SELECT * FROM INFORMATION_SCHEMA.SESSION_STATUS WHERE VARIABLE_NAME LIKE 'HANDLER_%' AND VARIABLE_VALUE > 0;
VARIABLE_NAME	VARIABLE_VALUE
# 8 locks (1 table + 3 partition lock/unlock)
EXPLAIN BASIC SELECT * FROM t1 WHERE a IN (13, 26, 39, 52);
SELECT * FROM INFORMATION_SCHEMA.SESSION_STATUS WHERE VARIABLE_NAME LIKE 'HANDLER_%' AND VARIABLE_VALUE > 0;
VARIABLE_NAME	VARIABLE_VALUE
# 4 locks (1 table + 1 partition lock/unlock)
EXPLAIN BASIC SELECT * FROM t1 WHERE a = 3;
SELECT * FROM INFORMATION_SCHEMA.SESSION_STATUS WHERE VARIABLE_NAME LIKE 'HANDLER_%' AND VARIABLE_VALUE > 0;
VARIABLE_NAME	VARIABLE_VALUE
# 4 locks (1 table + 1 partition lock/unlock)
EXPLAIN BASIC SELECT * FROM t1 WHERE b LIKE 'First%' ORDER BY a;
Query Plan
=========================================
|ID|OPERATOR                   |NAME    |
-----------------------------------------
|0 |PX COORDINATOR MERGE SORT  |        |
|1 |└─EXCHANGE OUT DISTR       |:EX10000|
|2 |  └─SORT                   |        |
|3 |    └─PX PARTITION ITERATOR|        |
|4 |      └─TABLE RANGE SCAN   |t1(b)   |
=========================================
Outputs & filters:
-------------------------------------
  0 - output([INTERNAL_FUNCTION(t1.a, t1.b)]), filter(nil), rowset=16
      sort_keys([t1.a, ASC])
  1 - output([t1.a], [INTERNAL_FUNCTION(t1.a, t1.b)]), filter(nil), rowset=16
      dop=1
  2 - output([t1.a], [t1.b]), filter(nil), rowset=16
      sort_keys([t1.a, ASC])
  3 - output([t1.a], [t1.b]), filter(nil), rowset=16
      force partition granule
  4 - output([t1.a], [t1.b]), filter(nil), rowset=16
      access([t1.a], [t1.b]), partitions(p[0-12])
      is_index_back=false, is_global_index=false, 
      range_key([t1.b], [t1.a]), range(First,MIN ; First￿￿￿￿￿￿￿￿￿￿￿￿￿￿￿￿￿￿￿￿￿￿￿￿￿￿￿￿￿￿￿￿￿￿￿￿￿￿￿￿￿￿￿￿￿￿￿￿�
      ��￿￿￿￿￿￿￿￿￿￿￿￿￿￿￿￿￿￿￿￿￿￿￿￿￿￿￿￿￿￿￿￿￿￿￿￿￿￿￿￿￿￿￿￿￿￿￿￿￿￿￿￿￿￿￿￿￿￿￿￿￿￿￿￿￿￿�
      ��￿￿￿￿￿￿￿￿￿￿￿￿￿￿￿￿￿￿￿￿￿￿￿￿￿￿￿￿￿￿￿￿￿￿￿￿￿￿￿￿￿￿￿￿￿￿￿￿￿￿￿￿￿,
      MAX), 
      range_cond([(T_OP_LIKE, t1.b, 'First%', '\\')])
SELECT * FROM INFORMATION_SCHEMA.SESSION_STATUS WHERE VARIABLE_NAME LIKE 'HANDLER_%' AND VARIABLE_VALUE > 0;
VARIABLE_NAME	VARIABLE_VALUE
# 28 locks (1 table + 13 partition lock/unlock)
#
# Test pruning of non static values
# They will need to lock all partitions, but will allow scan pruning
# due to a second pruning call in optimize.
#
CREATE TABLE t3 (a INT);
INSERT INTO t3 VALUES (1);
SELECT * FROM t1 WHERE a = (SELECT a FROM t3);
a	b
1	First row, p1
SELECT * FROM INFORMATION_SCHEMA.SESSION_STATUS WHERE VARIABLE_NAME LIKE 'HANDLER_%' AND VARIABLE_VALUE > 0;
VARIABLE_NAME	VARIABLE_VALUE
# 30 locks (2 table + 13 partitions lock/unlock)
# 1 read_first (NOTE only reads from one partition!)
# 2 read_key
# 2 read_rnd_next
SELECT t1.a FROM t1 INNER JOIN t3 ON t1.a = t3.a;
a
1
SELECT * FROM INFORMATION_SCHEMA.SESSION_STATUS WHERE VARIABLE_NAME LIKE 'HANDLER_%' AND VARIABLE_VALUE > 0;
VARIABLE_NAME	VARIABLE_VALUE
# 30 locks (2 table + 13 partitions lock/unlock)
# 1 read_first (NOTE only reads from one partition!)
# 2 read_key
EXPLAIN BASIC SELECT t1.a, t1.b FROM t1 INNER JOIN t3 ON t1.a = t3.a;
SELECT * FROM INFORMATION_SCHEMA.SESSION_STATUS WHERE VARIABLE_NAME LIKE 'HANDLER_%' AND VARIABLE_VALUE > 0;
VARIABLE_NAME	VARIABLE_VALUE
# 30 locks (2 table + 13 partitions lock/unlock)
EXPLAIN BASIC SELECT * FROM t1 WHERE a = (SELECT a FROM t3);
SELECT * FROM INFORMATION_SCHEMA.SESSION_STATUS WHERE VARIABLE_NAME LIKE 'HANDLER_%' AND VARIABLE_VALUE > 0;
VARIABLE_NAME	VARIABLE_VALUE
# 30 locks (2 table + 13 partitions lock/unlock)
SELECT * FROM t1 WHERE a = 1;
a	b
1	First row, p1
SELECT * FROM INFORMATION_SCHEMA.SESSION_STATUS WHERE VARIABLE_NAME LIKE 'HANDLER_%' AND VARIABLE_VALUE > 0;
VARIABLE_NAME	VARIABLE_VALUE
# 4 locks
# 1 read_key
SELECT * FROM t1 WHERE a = (SELECT COUNT(*) FROM t3);
a	b
1	First row, p1
SELECT * FROM INFORMATION_SCHEMA.SESSION_STATUS WHERE VARIABLE_NAME LIKE 'HANDLER_%' AND VARIABLE_VALUE > 0;
VARIABLE_NAME	VARIABLE_VALUE
DROP TABLE t3;
#
# Test derived tables like SELECT * FROM (SELECT * FROM ...)
#
SELECT * FROM (SELECT * FROM t1 WHERE a IN (0,2,3,13,26)) t3;
a	b
0	First row, p0
13	Second row, p0
26	Third row, p0
2	First row, p2
3	First row, p3
SELECT * FROM INFORMATION_SCHEMA.SESSION_STATUS WHERE VARIABLE_NAME LIKE 'HANDLER_%' AND VARIABLE_VALUE > 0;
VARIABLE_NAME	VARIABLE_VALUE
# 8 locks (1 table + 3 partitions lock/unlock)
# 3 read_first, read_key
# 11 read_next
# 6 read_rnd_next (tmp table)
SELECT * FROM (SELECT * FROM (SELECT * FROM t1 WHERE a IN (0,2,3,13,26)) t3) t4;
a	b
0	First row, p0
13	Second row, p0
26	Third row, p0
2	First row, p2
3	First row, p3
SELECT * FROM INFORMATION_SCHEMA.SESSION_STATUS WHERE VARIABLE_NAME LIKE 'HANDLER_%' AND VARIABLE_VALUE > 0;
VARIABLE_NAME	VARIABLE_VALUE
# 8 locks (1 table + 3 partitions lock/unlock)
# 3 read_first, read_key
# 11 read_next
# 12 read_rnd_next (tmp table)
#
# Test EXPLAIN BASIC SELECT * FROM (SELECT * FROM ...)
#
EXPLAIN BASIC SELECT * FROM (SELECT * FROM t1 WHERE a IN (0,2,3,13,26)) t3;
Query Plan
=======================================
|ID|OPERATOR                 |NAME    |
---------------------------------------
|0 |PX COORDINATOR           |        |
|1 |└─EXCHANGE OUT DISTR     |:EX10000|
|2 |  └─PX PARTITION ITERATOR|        |
|3 |    └─TABLE GET          |t1      |
=======================================
Outputs & filters:
-------------------------------------
  0 - output([INTERNAL_FUNCTION(t1.a, t1.b)]), filter(nil), rowset=16
  1 - output([INTERNAL_FUNCTION(t1.a, t1.b)]), filter(nil), rowset=16
      dop=1
  2 - output([t1.a], [t1.b]), filter(nil), rowset=16
      force partition granule
  3 - output([t1.a], [t1.b]), filter(nil), rowset=16
      access([t1.a], [t1.b]), partitions(p0, p[2-3])
      is_index_back=false, is_global_index=false, 
      range_key([t1.a]), range[0 ; 0], [2 ; 2], [3 ; 3], [13 ; 13], [26 ; 26], 
      range_cond([t1.a IN (0, 2, 3, 13, 26)])
SELECT * FROM INFORMATION_SCHEMA.SESSION_STATUS WHERE VARIABLE_NAME LIKE 'HANDLER_%' AND VARIABLE_VALUE > 0;
VARIABLE_NAME	VARIABLE_VALUE
# 8 locks (1 table + 3 partitions lock/unlock)
EXPLAIN BASIC SELECT * FROM (SELECT * FROM (SELECT * FROM t1 WHERE a IN (0,2,3,13,26)) t3) t4;
Query Plan
=======================================
|ID|OPERATOR                 |NAME    |
---------------------------------------
|0 |PX COORDINATOR           |        |
|1 |└─EXCHANGE OUT DISTR     |:EX10000|
|2 |  └─PX PARTITION ITERATOR|        |
|3 |    └─TABLE GET          |t1      |
=======================================
Outputs & filters:
-------------------------------------
  0 - output([INTERNAL_FUNCTION(t1.a, t1.b)]), filter(nil), rowset=16
  1 - output([INTERNAL_FUNCTION(t1.a, t1.b)]), filter(nil), rowset=16
      dop=1
  2 - output([t1.a], [t1.b]), filter(nil), rowset=16
      force partition granule
  3 - output([t1.a], [t1.b]), filter(nil), rowset=16
      access([t1.a], [t1.b]), partitions(p0, p[2-3])
      is_index_back=false, is_global_index=false, 
      range_key([t1.a]), range[0 ; 0], [2 ; 2], [3 ; 3], [13 ; 13], [26 ; 26], 
      range_cond([t1.a IN (0, 2, 3, 13, 26)])
SELECT * FROM INFORMATION_SCHEMA.SESSION_STATUS WHERE VARIABLE_NAME LIKE 'HANDLER_%' AND VARIABLE_VALUE > 0;
VARIABLE_NAME	VARIABLE_VALUE
# 8 locks (1 table + 3 partitions lock/unlock)
#
# Test SELECT ... UNION SELECT ...
#
SELECT * FROM t1 UNION SELECT * FROM t2;
a	b
0	First row, p0
13	Second row, p0
26	Third row, p0
39	Fourth row, p0
52	Fifth row, p0
65	No duplicate, INSERT_DUP_KEY_UPDATE
78	No duplicate
91	No duplicate, INSERT_DUP_KEY_UPDATE
104	No duplicate 104
1	First auto-inc row
1	First row, p1
105	No duplicate
2	First row, p2
2	Second auto-inc row
3	First row, p3
4	First row, p4
5	REPLACE second
10	First row, p10, UPDATED
SELECT * FROM INFORMATION_SCHEMA.SESSION_STATUS WHERE VARIABLE_NAME LIKE 'HANDLER_%' AND VARIABLE_VALUE > 0;
VARIABLE_NAME	VARIABLE_VALUE
# 56 locks (2 tables + 26 partitions lock/unlock)
SELECT * FROM t1 WHERE a IN (0, 1, 13, 4) UNION SELECT * FROM t2;
a	b
0	First row, p0
13	Second row, p0
1	First row, p1
4	First row, p4
1	First auto-inc row
2	Second auto-inc row
10	First row, p10, UPDATED
SELECT * FROM INFORMATION_SCHEMA.SESSION_STATUS WHERE VARIABLE_NAME LIKE 'HANDLER_%' AND VARIABLE_VALUE > 0;
VARIABLE_NAME	VARIABLE_VALUE
# 36 locks (2 tables, 13 + 3 partitions lock/unlock)
SELECT * FROM (SELECT * FROM t1 WHERE a IN (0, 1, 13, 4)) t3 UNION SELECT * FROM t2;
a	b
0	First row, p0
13	Second row, p0
1	First row, p1
4	First row, p4
1	First auto-inc row
2	Second auto-inc row
10	First row, p10, UPDATED
SELECT * FROM INFORMATION_SCHEMA.SESSION_STATUS WHERE VARIABLE_NAME LIKE 'HANDLER_%' AND VARIABLE_VALUE > 0;
VARIABLE_NAME	VARIABLE_VALUE
# 36 locks (2 tables, 13 + 3 partitions lock/unlock)
SELECT * FROM (SELECT * FROM (SELECT * FROM t1 WHERE a IN (0, 1, 13, 4) UNION SELECT * FROM t2) t3) t4;
a	b
0	First row, p0
13	Second row, p0
1	First row, p1
4	First row, p4
1	First auto-inc row
2	Second auto-inc row
10	First row, p10, UPDATED
SELECT * FROM INFORMATION_SCHEMA.SESSION_STATUS WHERE VARIABLE_NAME LIKE 'HANDLER_%' AND VARIABLE_VALUE > 0;
VARIABLE_NAME	VARIABLE_VALUE
# 36 locks (2 tables, 13 + 3 partitions lock/unlock)
SELECT * FROM (SELECT * FROM (SELECT * FROM t1 WHERE a IN (0, 1, 13, 4)) t3 UNION SELECT * FROM t2) t4;
a	b
0	First row, p0
13	Second row, p0
1	First row, p1
4	First row, p4
1	First auto-inc row
2	Second auto-inc row
10	First row, p10, UPDATED
SELECT * FROM INFORMATION_SCHEMA.SESSION_STATUS WHERE VARIABLE_NAME LIKE 'HANDLER_%' AND VARIABLE_VALUE > 0;
VARIABLE_NAME	VARIABLE_VALUE
# 36 locks (2 tables, 13 + 3 partitions lock/unlock)
SELECT * FROM (SELECT * FROM (SELECT * FROM t1 WHERE a IN (0, 1, 13, 4)) t3) t4 UNION SELECT * FROM t2;
a	b
0	First row, p0
13	Second row, p0
1	First row, p1
4	First row, p4
1	First auto-inc row
2	Second auto-inc row
10	First row, p10, UPDATED
SELECT * FROM INFORMATION_SCHEMA.SESSION_STATUS WHERE VARIABLE_NAME LIKE 'HANDLER_%' AND VARIABLE_VALUE > 0;
VARIABLE_NAME	VARIABLE_VALUE
# 36 locks (2 tables, 13 + 3 partitions lock/unlock)
SELECT * FROM (SELECT * FROM (SELECT * FROM t1 WHERE a IN (0, 1, 13, 4)) t3 UNION SELECT * FROM t2 WHERE a = 1) t4;
a	b
0	First row, p0
13	Second row, p0
1	First row, p1
4	First row, p4
1	First auto-inc row
SELECT * FROM INFORMATION_SCHEMA.SESSION_STATUS WHERE VARIABLE_NAME LIKE 'HANDLER_%' AND VARIABLE_VALUE > 0;
VARIABLE_NAME	VARIABLE_VALUE
# 12 locks (2 tables, 3 + 1 partitions lock/unlock)
#
# Test EXPLAIN BASIC SELECT ... UNION SELECT ...
#
EXPLAIN BASIC SELECT * FROM t1 UNION SELECT * FROM t2;
Query Plan
========================================
|ID|OPERATOR                  |NAME    |
----------------------------------------
|0 |PX COORDINATOR            |        |
|1 |└─EXCHANGE OUT DISTR      |:EX10000|
|2 |  └─PX PARTITION ITERATOR |        |
|3 |    └─MERGE UNION DISTINCT|        |
|4 |      ├─TABLE FULL SCAN   |t1      |
|5 |      └─TABLE FULL SCAN   |t2      |
========================================
Outputs & filters:
-------------------------------------
  0 - output([INTERNAL_FUNCTION(UNION([1]), UNION([2]))]), filter(nil), rowset=256
  1 - output([INTERNAL_FUNCTION(UNION([1]), UNION([2]))]), filter(nil), rowset=256
      dop=1
  2 - output([UNION([1])], [UNION([2])]), filter(nil), rowset=256
      partition wise, force partition granule
  3 - output([UNION([1])], [UNION([2])]), filter(nil), rowset=256
  4 - output([t1.a], [t1.b]), filter(nil), rowset=256
      access([t1.a], [t1.b]), partitions(p[0-12])
      is_index_back=false, is_global_index=false, 
      range_key([t1.a]), range(MIN ; MAX)always true
  5 - output([t2.a], [t2.b]), filter(nil), rowset=256
      access([t2.a], [t2.b]), partitions(p[0-12])
      is_index_back=false, is_global_index=false, 
      range_key([t2.a]), range(MIN ; MAX)always true
SELECT * FROM INFORMATION_SCHEMA.SESSION_STATUS WHERE VARIABLE_NAME LIKE 'HANDLER_%' AND VARIABLE_VALUE > 0;
VARIABLE_NAME	VARIABLE_VALUE
# 56 locks
EXPLAIN BASIC SELECT * FROM t1 WHERE a IN (0, 1, 13, 4) UNION SELECT * FROM t2;
SELECT * FROM INFORMATION_SCHEMA.SESSION_STATUS WHERE VARIABLE_NAME LIKE 'HANDLER_%' AND VARIABLE_VALUE > 0;
VARIABLE_NAME	VARIABLE_VALUE
# 36 locks (2 tables, 13 + 3 partitions lock/unlock)
EXPLAIN BASIC SELECT * FROM (SELECT * FROM t1 WHERE a IN (0, 1, 13, 4)) t3 UNION SELECT * FROM t2;
SELECT * FROM INFORMATION_SCHEMA.SESSION_STATUS WHERE VARIABLE_NAME LIKE 'HANDLER_%' AND VARIABLE_VALUE > 0;
VARIABLE_NAME	VARIABLE_VALUE
# 36 locks (2 tables, 13 + 3 partitions lock/unlock)
EXPLAIN BASIC SELECT * FROM (SELECT * FROM (SELECT * FROM t1 WHERE a IN (0, 1, 13, 4) UNION SELECT * FROM t2) t3) t4;
SELECT * FROM INFORMATION_SCHEMA.SESSION_STATUS WHERE VARIABLE_NAME LIKE 'HANDLER_%' AND VARIABLE_VALUE > 0;
VARIABLE_NAME	VARIABLE_VALUE
# 36 locks (2 tables, 13 + 3 partitions lock/unlock)
EXPLAIN BASIC SELECT * FROM (SELECT * FROM (SELECT * FROM t1 WHERE a IN (0, 1, 13, 4)) t3 UNION SELECT * FROM t2) t4;
SELECT * FROM INFORMATION_SCHEMA.SESSION_STATUS WHERE VARIABLE_NAME LIKE 'HANDLER_%' AND VARIABLE_VALUE > 0;
VARIABLE_NAME	VARIABLE_VALUE
# 36 locks (2 tables, 13 + 3 partitions lock/unlock)
EXPLAIN BASIC SELECT * FROM (SELECT * FROM (SELECT * FROM t1 WHERE a IN (0, 1, 13, 4)) t3) t4 UNION SELECT * FROM t2;
SELECT * FROM INFORMATION_SCHEMA.SESSION_STATUS WHERE VARIABLE_NAME LIKE 'HANDLER_%' AND VARIABLE_VALUE > 0;
VARIABLE_NAME	VARIABLE_VALUE
# 36 locks (2 tables, 13 + 3 partitions lock/unlock)
EXPLAIN BASIC SELECT * FROM (SELECT * FROM (SELECT * FROM t1 WHERE a IN (0, 1, 13, 4)) t3 UNION SELECT * FROM t2 WHERE a = 1) t4;
SELECT * FROM INFORMATION_SCHEMA.SESSION_STATUS WHERE VARIABLE_NAME LIKE 'HANDLER_%' AND VARIABLE_VALUE > 0;
VARIABLE_NAME	VARIABLE_VALUE
# 12 locks (2 tables, 3 + 1 partitions lock/unlock)
#
# Test UPDATE
#
SELECT * FROM t1 ORDER BY a;
a	b
0	First row, p0
1	First row, p1
2	First row, p2
3	First row, p3
4	First row, p4
5	REPLACE second
13	Second row, p0
26	Third row, p0
39	Fourth row, p0
52	Fifth row, p0
65	No duplicate, INSERT_DUP_KEY_UPDATE
78	No duplicate
91	No duplicate, INSERT_DUP_KEY_UPDATE
104	No duplicate 104
105	No duplicate
# This should be prunable (does not change the partitioning key)
UPDATE t1 SET b = CONCAT(b, ", updated 1") WHERE a IN (13, 26, 39, 52);
SELECT * FROM INFORMATION_SCHEMA.SESSION_STATUS WHERE VARIABLE_NAME LIKE 'HANDLER_%' AND VARIABLE_VALUE > 0;
VARIABLE_NAME	VARIABLE_VALUE
# 4 locks (1 table + 1 partition lock/unlock)
# 4 read_key
# 4 update
#
# This should not be prunable (only after implementing 'update pruning')
# i.e if all changed partitioning field is set to constant values,
# set lock_partitions to be a union of read_partition and the matching
# partition for the constants. Easy if all partitioning fields are set,
# probably needs a second round of prune_partitions() with these fields
# set to see if possible to prune locks.
UPDATE t1 SET a = 99, b = CONCAT(b, ", updated 2 -> p8") WHERE a = 13;
SELECT * FROM INFORMATION_SCHEMA.SESSION_STATUS WHERE VARIABLE_NAME LIKE 'HANDLER_%' AND VARIABLE_VALUE > 0;
VARIABLE_NAME	VARIABLE_VALUE
# 28 locks (1 table + 13 partition lock/unlock)
# 2 read_key
# 1 read_rnd
# 1 delete (due to moved to another partition)
# 1 write
#
# This should use ha_update_row instead of ha_write_row + ha_delete_row
UPDATE t1 SET a = 13 + 99, b = CONCAT(b, ", updated 3") WHERE a = 99;
SELECT * FROM INFORMATION_SCHEMA.SESSION_STATUS WHERE VARIABLE_NAME LIKE 'HANDLER_%' AND VARIABLE_VALUE > 0;
VARIABLE_NAME	VARIABLE_VALUE
# 28 locks (1 table + 13 partition lock/unlock)
# 2 read_key
# 1 read_rnd
# 1 update
#
# This should not be prunable (only after implementing
# 'optimized update pruning', which will probably never happen, since
# it depends on which partitioning type is used (for this only hash is
# simple, but range and list is possible, key is very hard)
UPDATE t1 SET a = a + 1, b = CONCAT(b, ", updated 4 -> p9") WHERE a = 112;
SELECT * FROM INFORMATION_SCHEMA.SESSION_STATUS WHERE VARIABLE_NAME LIKE 'HANDLER_%' AND VARIABLE_VALUE > 0;
VARIABLE_NAME	VARIABLE_VALUE
# 28 locks (1 table + 13 partition lock/unlock)
# 2 read_key
# 1 read_rnd
# 1 delete (due to moved to another partition)
# 1 write
UPDATE t1 SET b = CONCAT(b, ", same as min(a) + 2 in t2") WHERE a = (SELECT MIN(a) + 2 FROM t2);
SELECT * FROM INFORMATION_SCHEMA.SESSION_STATUS WHERE VARIABLE_NAME LIKE 'HANDLER_%' AND VARIABLE_VALUE > 0;
VARIABLE_NAME	VARIABLE_VALUE
# 56 locks (2 tables, 13 + 13 partitions lock/unlock)
UPDATE t1 SET b = CONCAT(b, ", max(a) in t2: ", (SELECT MAX(a) FROM t2)) WHERE a = 5;
SELECT * FROM INFORMATION_SCHEMA.SESSION_STATUS WHERE VARIABLE_NAME LIKE 'HANDLER_%' AND VARIABLE_VALUE > 0;
VARIABLE_NAME	VARIABLE_VALUE
# 32 locks (2 tables, 1 + 13 partitions lock/unlock)
#
# Test multi table UPDATE
#
SELECT * FROM t1 ORDER BY a;
a	b
0	First row, p0
1	First row, p1
2	First row, p2
3	First row, p3, same as min(a) + 2 in t2
4	First row, p4
5	REPLACE second, max(a) in t2: 10
26	Third row, p0, updated 1
39	Fourth row, p0, updated 1
52	Fifth row, p0, updated 1
65	No duplicate, INSERT_DUP_KEY_UPDATE
78	No duplicate
91	No duplicate, INSERT_DUP_KEY_UPDATE
104	No duplicate 104
105	No duplicate
113	Second row, p0, updated 1, updated 2 -> p8, updated 3, updated 4 -> p9
SELECT * FROM t2 ORDER BY a;
a	b
1	First auto-inc row
2	Second auto-inc row
10	First row, p10, UPDATED
EXPLAIN BASIC UPDATE t1, t2
SET t1.b = CONCAT(t1.b, ", t2.b:", t2.b),
t2.b = CONCAT(t2.b, ", t1.b:", t1.b)
WHERE t2.b = t1.b and t2.a = 4;
Query Plan
===========================================
|ID|OPERATOR                     |NAME    |
-------------------------------------------
|0 |DISTRIBUTED UPDATE           |        |
|1 |└─HASH JOIN                  |        |
|2 |  ├─TABLE GET                |t2      |
|3 |  └─PX COORDINATOR           |        |
|4 |    └─EXCHANGE OUT DISTR     |:EX10000|
|5 |      └─PX PARTITION ITERATOR|        |
|6 |        └─TABLE FULL SCAN    |t1(b)   |
===========================================
Outputs & filters:
-------------------------------------
  0 - output(nil), filter(nil)
      table_columns([{t1: ({t1: (t1.a, t1.b)})}], [{t2: ({t2: (t2.a, t2.b)}), hash_distinct}]),
      update([t1.b=column_conv(VARCHAR,utf8mb4_general_ci,length:128,NULL,CONCAT(t1.b, ', t2.b:', t2.b))], [t2.b=column_conv(VARCHAR,utf8mb4_general_ci,
      length:128,NULL,CONCAT(t2.b, ', t1.b:', t1.b))])
  1 - output([t1.a], [t1.b], [t2.a], [t2.b]), filter(nil), rowset=16
      equal_conds([t2.b = t1.b]), other_conds(nil)
  2 - output([t2.a], [t2.b]), filter(nil), rowset=16
      access([t2.a], [t2.b]), partitions(p4)
      is_index_back=false, is_global_index=false, 
      range_key([t2.a]), range[4 ; 4], 
      range_cond([t2.a = 4])
  3 - output([t1.a], [t1.b]), filter(nil), rowset=16
  4 - output([t1.a], [t1.b]), filter(nil), rowset=16
      dop=1
  5 - output([t1.a], [t1.b]), filter(nil), rowset=16
      force partition granule
  6 - output([t1.a], [t1.b]), filter(nil), rowset=16
      access([t1.a], [t1.b]), partitions(p[0-12])
      is_index_back=false, is_global_index=false, 
      range_key([t1.b], [t1.a]), range(MIN,MIN ; MAX,MAX)always true
SELECT * FROM INFORMATION_SCHEMA.SESSION_STATUS WHERE VARIABLE_NAME LIKE 'HANDLER_%' AND VARIABLE_VALUE > 0;
VARIABLE_NAME	VARIABLE_VALUE
# 32 locks (2 table, 13 + 1 partitions lock/unlock)
EXPLAIN BASIC UPDATE t1, t2
SET t1.b = CONCAT(t1.b, ", t2.b:", t2.b),
t2.b = CONCAT(t2.b, ", t1.b:", t1.b)
WHERE t2.b = t1.b and t2.a = 4;
Query Plan
===========================================
|ID|OPERATOR                     |NAME    |
-------------------------------------------
|0 |DISTRIBUTED UPDATE           |        |
|1 |└─HASH JOIN                  |        |
|2 |  ├─TABLE GET                |t2      |
|3 |  └─PX COORDINATOR           |        |
|4 |    └─EXCHANGE OUT DISTR     |:EX10000|
|5 |      └─PX PARTITION ITERATOR|        |
|6 |        └─TABLE FULL SCAN    |t1(b)   |
===========================================
Outputs & filters:
-------------------------------------
  0 - output(nil), filter(nil)
      table_columns([{t1: ({t1: (t1.a, t1.b)})}], [{t2: ({t2: (t2.a, t2.b)}), hash_distinct}]),
      update([t1.b=column_conv(VARCHAR,utf8mb4_general_ci,length:128,NULL,CONCAT(t1.b, ', t2.b:', t2.b))], [t2.b=column_conv(VARCHAR,utf8mb4_general_ci,
      length:128,NULL,CONCAT(t2.b, ', t1.b:', t1.b))])
  1 - output([t1.a], [t1.b], [t2.a], [t2.b]), filter(nil), rowset=16
      equal_conds([t2.b = t1.b]), other_conds(nil)
  2 - output([t2.a], [t2.b]), filter(nil), rowset=16
      access([t2.a], [t2.b]), partitions(p4)
      is_index_back=false, is_global_index=false, 
      range_key([t2.a]), range[4 ; 4], 
      range_cond([t2.a = 4])
  3 - output([t1.a], [t1.b]), filter(nil), rowset=16
  4 - output([t1.a], [t1.b]), filter(nil), rowset=16
      dop=1
  5 - output([t1.a], [t1.b]), filter(nil), rowset=16
      force partition granule
  6 - output([t1.a], [t1.b]), filter(nil), rowset=16
      access([t1.a], [t1.b]), partitions(p[0-12])
      is_index_back=false, is_global_index=false, 
      range_key([t1.b], [t1.a]), range(MIN,MIN ; MAX,MAX)always true
SELECT * FROM INFORMATION_SCHEMA.SESSION_STATUS WHERE VARIABLE_NAME LIKE 'HANDLER_%' AND VARIABLE_VALUE > 0;
VARIABLE_NAME	VARIABLE_VALUE
# 32 locks (2 table, 13 + 1 partitions lock/unlock)
UPDATE t1, t2
SET t1.b = CONCAT(t1.b, ", t2.b:", t2.b),
t2.b = CONCAT(t2.b, ", t1.b:", t1.b)
WHERE t2.b = t1.b and t2.a = 4;
SELECT * FROM INFORMATION_SCHEMA.SESSION_STATUS WHERE VARIABLE_NAME LIKE 'HANDLER_%' AND VARIABLE_VALUE > 0;
VARIABLE_NAME	VARIABLE_VALUE
# 32 locks (2 table, 13 + 1 partitions lock/unlock)
# 15 read_key
# 1 read_next, read_rnd
# 2 rean_rnd_next
# 2 update
#
# Test of views
#
DROP VIEW IF EXISTS v1_25,v1_25_check,v1_9,v1_9_check,v1_all;
CREATE VIEW v1_25 AS SELECT a, b FROM t1 PARTITION (p2, p5);
SELECT * FROM INFORMATION_SCHEMA.SESSION_STATUS WHERE VARIABLE_NAME LIKE 'HANDLER_%' AND VARIABLE_VALUE > 0;
VARIABLE_NAME	VARIABLE_VALUE
# No locks!
CREATE VIEW v1_25_check AS SELECT a, b FROM t1 PARTITION (p2, p5) t1_alias;
SELECT * FROM INFORMATION_SCHEMA.SESSION_STATUS WHERE VARIABLE_NAME LIKE 'HANDLER_%' AND VARIABLE_VALUE > 0;
VARIABLE_NAME	VARIABLE_VALUE
# No locks!
CREATE VIEW v1_9 AS SELECT a, b FROM t1 WHERE a = 9;
SELECT * FROM INFORMATION_SCHEMA.SESSION_STATUS WHERE VARIABLE_NAME LIKE 'HANDLER_%' AND VARIABLE_VALUE > 0;
VARIABLE_NAME	VARIABLE_VALUE
# No locks!
CREATE VIEW v1_9_check AS SELECT a, b FROM t1 WHERE a = 9;
SELECT * FROM INFORMATION_SCHEMA.SESSION_STATUS WHERE VARIABLE_NAME LIKE 'HANDLER_%' AND VARIABLE_VALUE > 0;
VARIABLE_NAME	VARIABLE_VALUE
# No locks!
CREATE VIEW v1_all AS SELECT a, b FROM t1;
SELECT * FROM INFORMATION_SCHEMA.SESSION_STATUS WHERE VARIABLE_NAME LIKE 'HANDLER_%' AND VARIABLE_VALUE > 0;
VARIABLE_NAME	VARIABLE_VALUE
# No locks!
SELECT TABLE_NAME, CHECK_OPTION, IS_UPDATABLE, VIEW_DEFINITION
FROM INFORMATION_SCHEMA.VIEWS
WHERE TABLE_SCHEMA = 'test' AND TABLE_NAME LIKE 'v1_%';
TABLE_NAME	CHECK_OPTION	IS_UPDATABLE	VIEW_DEFINITION
v1_25	NONE	YES	select `test`.`t1`.`a` AS `a`,`test`.`t1`.`b` AS `b` from `test`.`t1` partition(`p2`,`p5`)
v1_25_check	NONE	YES	select `t1_alias`.`a` AS `a`,`t1_alias`.`b` AS `b` from `test`.`t1` partition(`p2`,`p5`) `t1_alias`
v1_9	NONE	YES	select `test`.`t1`.`a` AS `a`,`test`.`t1`.`b` AS `b` from `test`.`t1` where (`test`.`t1`.`a` = 9)
v1_9_check	NONE	YES	select `test`.`t1`.`a` AS `a`,`test`.`t1`.`b` AS `b` from `test`.`t1` where (`test`.`t1`.`a` = 9)
v1_all	NONE	YES	select `test`.`t1`.`a` AS `a`,`test`.`t1`.`b` AS `b` from `test`.`t1`
INSERT INTO v1_all VALUES (23, "Insert in v1_all");
SELECT * FROM INFORMATION_SCHEMA.SESSION_STATUS WHERE VARIABLE_NAME LIKE 'HANDLER_%' AND VARIABLE_VALUE > 0;
VARIABLE_NAME	VARIABLE_VALUE
# 4 locks (1 table, 1 partition lock/unlock)
INSERT INTO v1_25 VALUES (18, "Insert in v1_25");
SELECT * FROM INFORMATION_SCHEMA.SESSION_STATUS WHERE VARIABLE_NAME LIKE 'HANDLER_%' AND VARIABLE_VALUE > 0;
VARIABLE_NAME	VARIABLE_VALUE
# 4 locks (1 table, 1 partition lock/unlock)
INSERT INTO v1_25 VALUES (17, "Insert in v1_25 fail");
ERROR HY000: Found a row not matching the given partition set
SELECT * FROM INFORMATION_SCHEMA.SESSION_STATUS WHERE VARIABLE_NAME LIKE 'HANDLER_%' AND VARIABLE_VALUE > 0;
VARIABLE_NAME	VARIABLE_VALUE
# 2 locks (1 table, 0 partition lock/unlock)
INSERT INTO v1_25 VALUES (19, "Insert ignore in v1_25");
ERROR HY000: Found a row not matching the given partition set
SELECT * FROM INFORMATION_SCHEMA.SESSION_STATUS WHERE VARIABLE_NAME LIKE 'HANDLER_%' AND VARIABLE_VALUE > 0;
VARIABLE_NAME	VARIABLE_VALUE
# 2 locks (1 table, 0 partition lock/unlock)
INSERT INTO v1_25_check VALUES (31, "Insert in v1_25_check");
SELECT * FROM INFORMATION_SCHEMA.SESSION_STATUS WHERE VARIABLE_NAME LIKE 'HANDLER_%' AND VARIABLE_VALUE > 0;
VARIABLE_NAME	VARIABLE_VALUE
# 4 locks (1 table, 1 partition lock/unlock)
INSERT INTO v1_25_check VALUES (30, "Insert in v1_25_check fail");
ERROR HY000: Found a row not matching the given partition set
SELECT * FROM INFORMATION_SCHEMA.SESSION_STATUS WHERE VARIABLE_NAME LIKE 'HANDLER_%' AND VARIABLE_VALUE > 0;
VARIABLE_NAME	VARIABLE_VALUE
# 2 locks (1 table, 0 partition lock/unlock)
INSERT INTO v1_25_check VALUES (32, "Insert ignore in v1_25_check");
ERROR HY000: Found a row not matching the given partition set
SELECT * FROM INFORMATION_SCHEMA.SESSION_STATUS WHERE VARIABLE_NAME LIKE 'HANDLER_%' AND VARIABLE_VALUE > 0;
VARIABLE_NAME	VARIABLE_VALUE
# 2 locks (1 table, 0 partition lock/unlock)
INSERT INTO v1_9 VALUES (9, "Insert in v1_9");
SELECT * FROM INFORMATION_SCHEMA.SESSION_STATUS WHERE VARIABLE_NAME LIKE 'HANDLER_%' AND VARIABLE_VALUE > 0;
VARIABLE_NAME	VARIABLE_VALUE
# 4 locks (1 table, 1 partition lock/unlock)
INSERT INTO v1_9 VALUES (8, "Insert in v1_9 NO CHECK!");
SELECT * FROM INFORMATION_SCHEMA.SESSION_STATUS WHERE VARIABLE_NAME LIKE 'HANDLER_%' AND VARIABLE_VALUE > 0;
VARIABLE_NAME	VARIABLE_VALUE
# 4 locks (1 table, 1 partition lock/unlock)
SELECT * FROM t1 WHERE a = 8;
a	b
8	Insert in v1_9 NO CHECK!
# DELETE will not find row not in view
DELETE FROM v1_9_check WHERE a = 8;
SELECT * FROM INFORMATION_SCHEMA.SESSION_STATUS WHERE VARIABLE_NAME LIKE 'HANDLER_%' AND VARIABLE_VALUE > 0;
VARIABLE_NAME	VARIABLE_VALUE
# 0 locks, impossible where!
EXPLAIN BASIC DELETE FROM v1_9_check WHERE a = 8;
Query Plan
=====================
|ID|OPERATOR   |NAME|
---------------------
|0 |DELETE     |    |
|1 |└─TABLE GET|t1  |
=====================
Outputs & filters:
-------------------------------------
  0 - output(nil), filter(nil)
      table_columns([{t1: ({t1: (t1.a, t1.b)})}])
  1 - output([t1.a], [t1.b]), filter(nil), rowset=16
      access([t1.a], [t1.b]), partitions(p0)
      is_index_back=false, is_global_index=false, 
      range_key([t1.a]), range(MAX ; MIN)always false, 
      range_cond([t1.a = 8], [t1.a = 9])
EXPLAIN BASIC SELECT * FROM v1_9_check WHERE a = 8;
SELECT * FROM t1 WHERE a = 8;
a	b
8	Insert in v1_9 NO CHECK!
INSERT INTO v1_9_check VALUES (10, "Insert in v1_9_check fail");
SELECT * FROM INFORMATION_SCHEMA.SESSION_STATUS WHERE VARIABLE_NAME LIKE 'HANDLER_%' AND VARIABLE_VALUE > 0;
VARIABLE_NAME	VARIABLE_VALUE
# 4 locks (1 table, 1 partition lock/unlock)
SELECT * FROM t1 WHERE a = 9;
a	b
9	Insert in v1_9
DELETE FROM v1_9_check WHERE a = 9;
SELECT * FROM INFORMATION_SCHEMA.SESSION_STATUS WHERE VARIABLE_NAME LIKE 'HANDLER_%' AND VARIABLE_VALUE > 0;
VARIABLE_NAME	VARIABLE_VALUE
# 4 locks (1 table, 1 partition lock/unlock)
INSERT INTO v1_9_check VALUES (9, "Insert in v1_9_check");
SELECT * FROM INFORMATION_SCHEMA.SESSION_STATUS WHERE VARIABLE_NAME LIKE 'HANDLER_%' AND VARIABLE_VALUE > 0;
VARIABLE_NAME	VARIABLE_VALUE
SELECT * FROM v1_9;
a	b
9	Insert in v1_9_check
SELECT * FROM INFORMATION_SCHEMA.SESSION_STATUS WHERE VARIABLE_NAME LIKE 'HANDLER_%' AND VARIABLE_VALUE > 0;
VARIABLE_NAME	VARIABLE_VALUE
# 4 locks (1 table, 1 partition lock/unlock)
SELECT * FROM v1_25;
a	b
2	First row, p2
5	REPLACE second, max(a) in t2: 10
18	Insert in v1_25
31	Insert in v1_25_check
SELECT * FROM INFORMATION_SCHEMA.SESSION_STATUS WHERE VARIABLE_NAME LIKE 'HANDLER_%' AND VARIABLE_VALUE > 0;
VARIABLE_NAME	VARIABLE_VALUE
# 6 locks (1 table, 2 partition lock/unlock)
SELECT * FROM v1_all;
a	b
0	First row, p0
26	Third row, p0, updated 1
39	Fourth row, p0, updated 1
52	Fifth row, p0, updated 1
65	No duplicate, INSERT_DUP_KEY_UPDATE
78	No duplicate
91	No duplicate, INSERT_DUP_KEY_UPDATE
104	No duplicate 104
1	First row, p1
105	No duplicate
2	First row, p2
3	First row, p3, same as min(a) + 2 in t2
4	First row, p4
5	REPLACE second, max(a) in t2: 10
18	Insert in v1_25
31	Insert in v1_25_check
8	Insert in v1_9 NO CHECK!
9	Insert in v1_9_check
113	Second row, p0, updated 1, updated 2 -> p8, updated 3, updated 4 -> p9
10	Insert in v1_9_check fail
23	Insert in v1_all
SELECT * FROM INFORMATION_SCHEMA.SESSION_STATUS WHERE VARIABLE_NAME LIKE 'HANDLER_%' AND VARIABLE_VALUE > 0;
VARIABLE_NAME	VARIABLE_VALUE
# 28 locks (1 table, 13 partition lock/unlock)
DROP VIEW v1_all;
DROP VIEW v1_9, v1_9_check;
DROP VIEW v1_25, v1_25_check;
#
# Test EXPLAIN BASIC DELETE
#
SELECT * FROM t1 ORDER BY a;
a	b
0	First row, p0
1	First row, p1
2	First row, p2
3	First row, p3, same as min(a) + 2 in t2
4	First row, p4
5	REPLACE second, max(a) in t2: 10
8	Insert in v1_9 NO CHECK!
9	Insert in v1_9_check
10	Insert in v1_9_check fail
18	Insert in v1_25
23	Insert in v1_all
26	Third row, p0, updated 1
31	Insert in v1_25_check
39	Fourth row, p0, updated 1
52	Fifth row, p0, updated 1
65	No duplicate, INSERT_DUP_KEY_UPDATE
78	No duplicate
91	No duplicate, INSERT_DUP_KEY_UPDATE
104	No duplicate 104
105	No duplicate
113	Second row, p0, updated 1, updated 2 -> p8, updated 3, updated 4 -> p9
EXPLAIN BASIC DELETE FROM t1 WHERE a = 105;
SELECT * FROM INFORMATION_SCHEMA.SESSION_STATUS WHERE VARIABLE_NAME LIKE 'HANDLER_%' AND VARIABLE_VALUE > 0;
VARIABLE_NAME	VARIABLE_VALUE
# 4 locks (1 table + 1 partition lock/unlock)
EXPLAIN BASIC DELETE FROM t1 WHERE b = "No duplicate";
Query Plan
=======================================
|ID|OPERATOR                 |NAME    |
---------------------------------------
|0 |PX COORDINATOR           |        |
|1 |└─EXCHANGE OUT DISTR     |:EX10000|
|2 |  └─PX PARTITION ITERATOR|        |
|3 |    └─DELETE             |        |
|4 |      └─TABLE RANGE SCAN |t1(b)   |
=======================================
Outputs & filters:
-------------------------------------
  0 - output(nil), filter(nil), rowset=16
  1 - output(nil), filter(nil), rowset=16
      dop=1
  2 - output(nil), filter(nil), rowset=16
      partition wise, force partition granule
  3 - output(nil), filter(nil)
      table_columns([{t1: ({t1: (t1.a, t1.b)})}])
  4 - output([t1.a], [t1.b]), filter(nil), rowset=16
      access([t1.a], [t1.b]), partitions(p[0-12])
      is_index_back=false, is_global_index=false, 
      range_key([t1.b], [t1.a]), range(No duplicate,MIN ; No duplicate,MAX), 
      range_cond([t1.b = 'No duplicate'])
SELECT * FROM INFORMATION_SCHEMA.SESSION_STATUS WHERE VARIABLE_NAME LIKE 'HANDLER_%' AND VARIABLE_VALUE > 0;
VARIABLE_NAME	VARIABLE_VALUE
# 28 locks (1 table + 13 partition lock/unlock)
EXPLAIN BASIC DELETE FROM t1 WHERE a = 105;
SELECT * FROM INFORMATION_SCHEMA.SESSION_STATUS WHERE VARIABLE_NAME LIKE 'HANDLER_%' AND VARIABLE_VALUE > 0;
VARIABLE_NAME	VARIABLE_VALUE
# 4 locks (1 table + 1 partition lock/unlock)
EXPLAIN BASIC DELETE FROM t1 WHERE b = "No duplicate";
Query Plan
=======================================
|ID|OPERATOR                 |NAME    |
---------------------------------------
|0 |PX COORDINATOR           |        |
|1 |└─EXCHANGE OUT DISTR     |:EX10000|
|2 |  └─PX PARTITION ITERATOR|        |
|3 |    └─DELETE             |        |
|4 |      └─TABLE RANGE SCAN |t1(b)   |
=======================================
Outputs & filters:
-------------------------------------
  0 - output(nil), filter(nil), rowset=16
  1 - output(nil), filter(nil), rowset=16
      dop=1
  2 - output(nil), filter(nil), rowset=16
      partition wise, force partition granule
  3 - output(nil), filter(nil)
      table_columns([{t1: ({t1: (t1.a, t1.b)})}])
  4 - output([t1.a], [t1.b]), filter(nil), rowset=16
      access([t1.a], [t1.b]), partitions(p[0-12])
      is_index_back=false, is_global_index=false, 
      range_key([t1.b], [t1.a]), range(No duplicate,MIN ; No duplicate,MAX), 
      range_cond([t1.b = 'No duplicate'])
SELECT * FROM INFORMATION_SCHEMA.SESSION_STATUS WHERE VARIABLE_NAME LIKE 'HANDLER_%' AND VARIABLE_VALUE > 0;
VARIABLE_NAME	VARIABLE_VALUE
# 28 locks (1 table + 13 partition lock/unlock)
#
# Test DELETE
#
DELETE FROM t1 WHERE a = 105;
SELECT * FROM INFORMATION_SCHEMA.SESSION_STATUS WHERE VARIABLE_NAME LIKE 'HANDLER_%' AND VARIABLE_VALUE > 0;
VARIABLE_NAME	VARIABLE_VALUE
# 4 locks (1 table + 1 partition lock/unlock)
# 1 read_key
# 1 delete
DELETE FROM t1 WHERE b = "No duplicate";
SELECT * FROM INFORMATION_SCHEMA.SESSION_STATUS WHERE VARIABLE_NAME LIKE 'HANDLER_%' AND VARIABLE_VALUE > 0;
VARIABLE_NAME	VARIABLE_VALUE
# 28 locks (1 table + 13 partition lock/unlock)
# 13 read_key
# 1 read_next (if more matches after the first match)
# 1 delete
DELETE FROM t1 WHERE a = (SELECT a + 90 FROM t2 WHERE a = 1);
SELECT * FROM INFORMATION_SCHEMA.SESSION_STATUS WHERE VARIABLE_NAME LIKE 'HANDLER_%' AND VARIABLE_VALUE > 0;
VARIABLE_NAME	VARIABLE_VALUE
# 32 locks (2 table + 13 + 1 partition lock/unlock)
# 2 read_key
# 2 read_next (if more matches after the first match)
# 1 delete
EXPLAIN BASIC DELETE FROM t1 WHERE a = (SELECT a + 90 FROM t2 WHERE a = 1);
Query Plan
=======================================
|ID|OPERATOR                     |NAME|
---------------------------------------
|0 |DELETE                       |    |
|1 |└─NESTED-LOOP JOIN CARTESIAN |    |
|2 |  ├─TABLE GET                |t1  |
|3 |  └─TABLE GET                |t2  |
=======================================
Outputs & filters:
-------------------------------------
  0 - output(nil), filter(nil)
      table_columns([{t1: ({t1: (t1.a, t1.b)})}])
  1 - output([t1.a], [t1.b]), filter(nil), rowset=16
      conds(nil), nl_params_(nil), use_batch=false
  2 - output([t1.a], [t1.b]), filter(nil), rowset=16
      access([t1.a], [t1.b]), partitions(p0)
      is_index_back=false, is_global_index=false, 
      range_key([t1.a]), range[91 ; 91], 
      range_cond([t1.a = cast(1, INT(11, 0)) + 90])
  3 - output(nil), filter(nil), rowset=16
      access(nil), partitions(p1)
      is_index_back=false, is_global_index=false, 
      range_key([t2.a]), range[1 ; 1], 
      range_cond([t2.a = 1])
DELETE FROM t1 PARTITION (p0)
WHERE a = (SELECT a + 2 FROM t2 WHERE a = 1);
SELECT * FROM INFORMATION_SCHEMA.SESSION_STATUS WHERE VARIABLE_NAME LIKE 'HANDLER_%' AND VARIABLE_VALUE > 0;
VARIABLE_NAME	VARIABLE_VALUE
# Impossible delete, all partitions pruned away after locking!
# 8 locks (2 table + 1 PARTITION(p0) + 1 (a = 1) partition lock/unlock)
# 1 read_key
EXPLAIN BASIC DELETE FROM t1 PARTITION (p0)
WHERE a = (SELECT a + 2 FROM t2 WHERE a = 1);
#
# Test multi table DELETE
#
SELECT * FROM t1 ORDER BY a;
a	b
0	First row, p0
1	First row, p1
2	First row, p2
3	First row, p3, same as min(a) + 2 in t2
4	First row, p4
5	REPLACE second, max(a) in t2: 10
8	Insert in v1_9 NO CHECK!
9	Insert in v1_9_check
10	Insert in v1_9_check fail
18	Insert in v1_25
23	Insert in v1_all
26	Third row, p0, updated 1
31	Insert in v1_25_check
39	Fourth row, p0, updated 1
52	Fifth row, p0, updated 1
65	No duplicate, INSERT_DUP_KEY_UPDATE
104	No duplicate 104
113	Second row, p0, updated 1, updated 2 -> p8, updated 3, updated 4 -> p9
SELECT * FROM t2 ORDER BY a;
a	b
1	First auto-inc row
2	Second auto-inc row
10	First row, p10, UPDATED
EXPLAIN BASIC DELETE t1, t2 FROM t1, t2 WHERE t1.a = t2.a AND t1.b = 'First row, p1';
Query Plan
=========================================
|ID|OPERATOR                   |NAME    |
-----------------------------------------
|0 |DISTRIBUTED DELETE         |        |
|1 |└─PX COORDINATOR           |        |
|2 |  └─EXCHANGE OUT DISTR     |:EX10000|
|3 |    └─PX PARTITION ITERATOR|        |
|4 |      └─NESTED-LOOP JOIN   |        |
|5 |        ├─TABLE RANGE SCAN |t1(b)   |
|6 |        └─TABLE GET        |t2      |
=========================================
Outputs & filters:
-------------------------------------
  0 - output(nil), filter(nil)
      table_columns([{t1: ({t1: (t1.a, t1.b)})}], [{t2: ({t2: (t2.a, t2.b)})}])
  1 - output([t1.a], [t1.b], [t2.a], [t2.b]), filter(nil), rowset=16
  2 - output([t1.a], [t1.b], [t2.a], [t2.b]), filter(nil), rowset=16
      dop=1
  3 - output([t1.a], [t1.b], [t2.a], [t2.b]), filter(nil), rowset=16
      partition wise, force partition granule
  4 - output([t1.a], [t1.b], [t2.a], [t2.b]), filter(nil), rowset=16
      conds(nil), nl_params_([t1.a(:0)]), use_batch=true
  5 - output([t1.a], [t1.b]), filter(nil), rowset=16
      access([t1.a], [t1.b]), partitions(p[0-12])
      is_index_back=false, is_global_index=false, 
      range_key([t1.b], [t1.a]), range(First row, p1,MIN ; First row, p1,MAX), 
      range_cond([t1.b = 'First row, p1'])
  6 - output([t2.a], [t2.b]), filter(nil), rowset=16
      access([GROUP_ID], [t2.a], [t2.b]), partitions(p[0-12])
      is_index_back=false, is_global_index=false, 
      range_key([t2.a]), range(MIN ; MAX), 
      range_cond([:0 = t2.a])
SELECT * FROM INFORMATION_SCHEMA.SESSION_STATUS WHERE VARIABLE_NAME LIKE 'HANDLER_%' AND VARIABLE_VALUE > 0;
VARIABLE_NAME	VARIABLE_VALUE
# 56 locks (2 tables + 26 partitions lock/unlock)
EXPLAIN BASIC DELETE t1, t2 FROM t1, t2;
Query Plan
=============================================
|ID|OPERATOR                       |NAME    |
---------------------------------------------
|0 |DISTRIBUTED DELETE             |        |
|1 |└─NESTED-LOOP JOIN CARTESIAN   |        |
|2 |  ├─PX COORDINATOR             |        |
|3 |  │ └─EXCHANGE OUT DISTR       |:EX10000|
|4 |  │   └─PX PARTITION ITERATOR  |        |
|5 |  │     └─TABLE FULL SCAN      |t1      |
|6 |  └─MATERIAL                   |        |
|7 |    └─PX COORDINATOR           |        |
|8 |      └─EXCHANGE OUT DISTR     |:EX20000|
|9 |        └─PX PARTITION ITERATOR|        |
|10|          └─TABLE FULL SCAN    |t2      |
=============================================
Outputs & filters:
-------------------------------------
  0 - output(nil), filter(nil)
      table_columns([{t1: ({t1: (t1.a, t1.b)}), hash_distinct}], [{t2: ({t2: (t2.a, t2.b)}), hash_distinct}])
  1 - output([t1.a], [t1.b], [t2.a], [t2.b]), filter(nil), rowset=256
      conds(nil), nl_params_(nil), use_batch=false
  2 - output([t1.a], [t1.b]), filter(nil), rowset=256
  3 - output([t1.a], [t1.b]), filter(nil), rowset=256
      dop=1
  4 - output([t1.a], [t1.b]), filter(nil), rowset=256
      force partition granule
  5 - output([t1.a], [t1.b]), filter(nil), rowset=256
      access([t1.a], [t1.b]), partitions(p[0-12])
      is_index_back=false, is_global_index=false, 
      range_key([t1.a]), range(MIN ; MAX)always true
  6 - output([t2.a], [t2.b]), filter(nil), rowset=256
  7 - output([t2.a], [t2.b]), filter(nil), rowset=256
  8 - output([t2.a], [t2.b]), filter(nil), rowset=256
      dop=1
  9 - output([t2.a], [t2.b]), filter(nil), rowset=256
      force partition granule
 10 - output([t2.a], [t2.b]), filter(nil), rowset=256
      access([t2.a], [t2.b]), partitions(p[0-12])
      is_index_back=false, is_global_index=false, 
      range_key([t2.a]), range(MIN ; MAX)always true
EXPLAIN BASIC DELETE FROM t2, t1 USING t2, t1
WHERE t1.b = t2.b AND t2.a = 4;
Query Plan
===========================================
|ID|OPERATOR                     |NAME    |
-------------------------------------------
|0 |DISTRIBUTED DELETE           |        |
|1 |└─HASH JOIN                  |        |
|2 |  ├─TABLE GET                |t2      |
|3 |  └─PX COORDINATOR           |        |
|4 |    └─EXCHANGE OUT DISTR     |:EX10000|
|5 |      └─PX PARTITION ITERATOR|        |
|6 |        └─TABLE FULL SCAN    |t1(b)   |
===========================================
Outputs & filters:
-------------------------------------
  0 - output(nil), filter(nil)
      table_columns([{t2: ({t2: (t2.a, t2.b)}), hash_distinct}], [{t1: ({t1: (t1.a, t1.b)})}])
  1 - output([t2.a], [t2.b], [t1.a], [t1.b]), filter(nil), rowset=256
      equal_conds([t1.b = t2.b]), other_conds(nil)
  2 - output([t2.a], [t2.b]), filter(nil), rowset=256
      access([t2.a], [t2.b]), partitions(p4)
      is_index_back=false, is_global_index=false, 
      range_key([t2.a]), range[4 ; 4], 
      range_cond([t2.a = 4])
  3 - output([t1.a], [t1.b]), filter(nil), rowset=256
  4 - output([t1.a], [t1.b]), filter(nil), rowset=256
      dop=1
  5 - output([t1.a], [t1.b]), filter(nil), rowset=256
      force partition granule
  6 - output([t1.a], [t1.b]), filter(nil), rowset=256
      access([t1.a], [t1.b]), partitions(p[0-12])
      is_index_back=false, is_global_index=false, 
      range_key([t1.b], [t1.a]), range(MIN,MIN ; MAX,MAX)always true
SELECT * FROM INFORMATION_SCHEMA.SESSION_STATUS WHERE VARIABLE_NAME LIKE 'HANDLER_%' AND VARIABLE_VALUE > 0;
VARIABLE_NAME	VARIABLE_VALUE
# 32 locks (2 tables , 13 + 1 partition lock/unlock)
EXPLAIN BASIC DELETE t1, t2 FROM t1, t2
WHERE t1.a = t2.a AND t1.b = 'First row, p1';
Query Plan
=========================================
|ID|OPERATOR                   |NAME    |
-----------------------------------------
|0 |DISTRIBUTED DELETE         |        |
|1 |└─PX COORDINATOR           |        |
|2 |  └─EXCHANGE OUT DISTR     |:EX10000|
|3 |    └─PX PARTITION ITERATOR|        |
|4 |      └─NESTED-LOOP JOIN   |        |
|5 |        ├─TABLE RANGE SCAN |t1(b)   |
|6 |        └─TABLE GET        |t2      |
=========================================
Outputs & filters:
-------------------------------------
  0 - output(nil), filter(nil)
      table_columns([{t1: ({t1: (t1.a, t1.b)})}], [{t2: ({t2: (t2.a, t2.b)})}])
  1 - output([t1.a], [t1.b], [t2.a], [t2.b]), filter(nil), rowset=16
  2 - output([t1.a], [t1.b], [t2.a], [t2.b]), filter(nil), rowset=16
      dop=1
  3 - output([t1.a], [t1.b], [t2.a], [t2.b]), filter(nil), rowset=16
      partition wise, force partition granule
  4 - output([t1.a], [t1.b], [t2.a], [t2.b]), filter(nil), rowset=16
      conds(nil), nl_params_([t1.a(:0)]), use_batch=true
  5 - output([t1.a], [t1.b]), filter(nil), rowset=16
      access([t1.a], [t1.b]), partitions(p[0-12])
      is_index_back=false, is_global_index=false, 
      range_key([t1.b], [t1.a]), range(First row, p1,MIN ; First row, p1,MAX), 
      range_cond([t1.b = 'First row, p1'])
  6 - output([t2.a], [t2.b]), filter(nil), rowset=16
      access([GROUP_ID], [t2.a], [t2.b]), partitions(p[0-12])
      is_index_back=false, is_global_index=false, 
      range_key([t2.a]), range(MIN ; MAX), 
      range_cond([:0 = t2.a])
DELETE t1, t2 FROM t1, t2
WHERE t1.a = t2.a AND t1.b = 'First row, p1';
SELECT * FROM INFORMATION_SCHEMA.SESSION_STATUS WHERE VARIABLE_NAME LIKE 'HANDLER_%' AND VARIABLE_VALUE > 0;
VARIABLE_NAME	VARIABLE_VALUE
# 56 locks (2 tables + 26 partitions lock/unlock)
# 15 read_key
# 1 read_next, read_rnd
# 2 delete
DELETE FROM t2, t1 USING t2, t1
WHERE t1.b = t2.b AND t2.a = 4;
SELECT * FROM INFORMATION_SCHEMA.SESSION_STATUS WHERE VARIABLE_NAME LIKE 'HANDLER_%' AND VARIABLE_VALUE > 0;
VARIABLE_NAME	VARIABLE_VALUE
# 32 locks (2 tables , 13 + 1 partition lock/unlock)
# 15 read_key
# 1 read_next, read_rnd
# 2 delete
SELECT * FROM t1 ORDER BY a;
a	b
0	First row, p0
2	First row, p2
3	First row, p3, same as min(a) + 2 in t2
4	First row, p4
5	REPLACE second, max(a) in t2: 10
8	Insert in v1_9 NO CHECK!
9	Insert in v1_9_check
10	Insert in v1_9_check fail
18	Insert in v1_25
23	Insert in v1_all
26	Third row, p0, updated 1
31	Insert in v1_25_check
39	Fourth row, p0, updated 1
52	Fifth row, p0, updated 1
65	No duplicate, INSERT_DUP_KEY_UPDATE
104	No duplicate 104
113	Second row, p0, updated 1, updated 2 -> p8, updated 3, updated 4 -> p9
SELECT * FROM t2 ORDER BY a;
a	b
2	Second auto-inc row
10	First row, p10, UPDATED
#
# Test subquery IN expression
#
EXPLAIN BASIC SELECT count(*) FROM t1 p
WHERE a IN (1, 2, 9);
Query Plan
===========================================
|ID|OPERATOR                     |NAME    |
-------------------------------------------
|0 |SCALAR GROUP BY              |        |
|1 |└─PX COORDINATOR             |        |
|2 |  └─EXCHANGE OUT DISTR       |:EX10000|
|3 |    └─MERGE GROUP BY         |        |
|4 |      └─PX PARTITION ITERATOR|        |
|5 |        └─TABLE GET          |p       |
===========================================
Outputs & filters:
-------------------------------------
  0 - output([T_FUN_COUNT_SUM(T_FUN_COUNT(*))]), filter(nil), rowset=16
      group(nil), agg_func([T_FUN_COUNT_SUM(T_FUN_COUNT(*))])
  1 - output([T_FUN_COUNT(*)]), filter(nil), rowset=16
  2 - output([T_FUN_COUNT(*)]), filter(nil), rowset=16
      dop=1
  3 - output([T_FUN_COUNT(*)]), filter(nil), rowset=16
      group(nil), agg_func([T_FUN_COUNT(*)])
  4 - output(nil), filter(nil), rowset=16
      force partition granule
  5 - output(nil), filter(nil), rowset=16
      access(nil), partitions(p[1-2], p9)
      is_index_back=false, is_global_index=false, 
      range_key([p.a]), range[1 ; 1], [2 ; 2], [9 ; 9], 
      range_cond([p.a IN (1, 2, 9)])
SELECT * FROM INFORMATION_SCHEMA.SESSION_STATUS WHERE VARIABLE_NAME LIKE 'HANDLER_%' AND VARIABLE_VALUE > 0;
VARIABLE_NAME	VARIABLE_VALUE
# 8 locks (1 table, 3 partitions, lock/unlock)
EXPLAIN BASIC SELECT count(*) FROM t1 p
WHERE a IN
(SELECT a + 1 FROM t2 WHERE a = 4);
SELECT * FROM INFORMATION_SCHEMA.SESSION_STATUS WHERE VARIABLE_NAME LIKE 'HANDLER_%' AND VARIABLE_VALUE > 0;
VARIABLE_NAME	VARIABLE_VALUE
# 32 locks (2 table, 13 + 1 partitions, lock/unlock)
#
# Test triggers
# Tables used in triggers cannot be pruned for locks.
# Tables with triggers cannot be pruned for locks if
# BEFORE INSERT/UPDATE trigger uses any partitioning columns.
#
CREATE TABLE t3
(old_a int,
new_a int,
old_b varchar(255),
new_b varchar(255),
key (new_a, new_b) LOCAL,
key(new_b) LOCAL)
PARTITION BY HASH (new_a) PARTITIONS 5;
INSERT INTO t1 VALUES (2, "First row, p2")
ON DUPLICATE KEY UPDATE b = CONCAT(b, ", duplicate key 2");
SELECT * FROM INFORMATION_SCHEMA.SESSION_STATUS WHERE VARIABLE_NAME LIKE 'HANDLER_%' AND VARIABLE_VALUE > 0;
VARIABLE_NAME	VARIABLE_VALUE
# 28 locks (3 tables, 1 + 5 + 5 partition lock/unlock)
# (t1 to insert, t3 after insert trigger, t3 after update trigger)
SELECT * FROM t1 WHERE a = 2;
a	b
2	First row, p2, duplicate key 2
REPLACE INTO t1 VALUES (0, "First row, p0 REPLACED");
SELECT * FROM INFORMATION_SCHEMA.SESSION_STATUS WHERE VARIABLE_NAME LIKE 'HANDLER_%' AND VARIABLE_VALUE > 0;
VARIABLE_NAME	VARIABLE_VALUE
# 16 locks (2 tables, 1 + 5 partition lock/unlock)
# (t1 to replace, t3 after insert trigger)
# Note that since there is no delete trigger, REPLACE cheats by
# doing update instead of delete+insert!
SELECT * FROM t1 WHERE a = 0;
a	b
0	First row, p0 REPLACED
EXPLAIN BASIC UPDATE t1 SET b = CONCAT(b, ", UPDATED2") WHERE a = 3;
SELECT * FROM INFORMATION_SCHEMA.SESSION_STATUS WHERE VARIABLE_NAME LIKE 'HANDLER_%' AND VARIABLE_VALUE > 0;
VARIABLE_NAME	VARIABLE_VALUE
# 16 locks (2 tables, 1 + 5 partition lock/unlock)
# (t1 to insert, t3 after update trigger)
REPLACE INTO t1 VALUES (0, "First row, p0 REPLACED2");
SELECT * FROM INFORMATION_SCHEMA.SESSION_STATUS WHERE VARIABLE_NAME LIKE 'HANDLER_%' AND VARIABLE_VALUE > 0;
VARIABLE_NAME	VARIABLE_VALUE
# 28 locks (3 tables, 1 + 5 + 5 partition lock/unlock)
# (t1 to replace, t3 after insert trigger, t3 after delete trigger)
# Note that now it does delete+insert instead, due to delete trigger!
SELECT * FROM t1 WHERE a = 0;
a	b
0	First row, p0 REPLACED2
REPLACE INTO t1 VALUES (0, "First row, p0 REPLACED3");
SELECT * FROM INFORMATION_SCHEMA.SESSION_STATUS WHERE VARIABLE_NAME LIKE 'HANDLER_%' AND VARIABLE_VALUE > 0;
VARIABLE_NAME	VARIABLE_VALUE
# 40 locks (4 tables, 1 + 5 + 5 + 5 partition lock/unlock)
# (t1 to replace, t3 after insert trigger, t3 before delete trigger,
#  t3 after delete trigger)
SELECT * FROM t1 WHERE a = 0;
a	b
0	First row, p0 REPLACED3
INSERT INTO t1 VALUES (2, "First row, p2")
ON DUPLICATE KEY UPDATE b = CONCAT(b, ", duplicate key 2");
SELECT * FROM INFORMATION_SCHEMA.SESSION_STATUS WHERE VARIABLE_NAME LIKE 'HANDLER_%' AND VARIABLE_VALUE > 0;
VARIABLE_NAME	VARIABLE_VALUE
# No pruning possible, due to BEFORE UPDATE trigger
# 64 locks (4 tables, 13 + 5 + 5 + 5 partitions lock/unlock)
# t1, t3 after insert, t3 before update, t3 after update
SELECT * FROM t1 WHERE a = 2;
a	b
2	First row, p2, duplicate key 2, duplicate key 2
REPLACE INTO t1 VALUES (0, "First row, p0 REPLACED4");
SELECT * FROM INFORMATION_SCHEMA.SESSION_STATUS WHERE VARIABLE_NAME LIKE 'HANDLER_%' AND VARIABLE_VALUE > 0;
VARIABLE_NAME	VARIABLE_VALUE
# 40 locks (4 tables, 1 + 5 + 5 + 5 partition lock/unlock)
# t1, t3 after insert, t3 before delete, t3 after delete
SELECT * FROM t1 WHERE a = 0;
a	b
0	First row, p0 REPLACED4
EXPLAIN BASIC UPDATE t1 SET b = CONCAT(b, ", UPDATED2") WHERE a = 3;
SELECT * FROM INFORMATION_SCHEMA.SESSION_STATUS WHERE VARIABLE_NAME LIKE 'HANDLER_%' AND VARIABLE_VALUE > 0;
VARIABLE_NAME	VARIABLE_VALUE
# No pruning possible, due to BEFORE UPDATE trigger
# 52 locks (3 tables, 13 + 5 + 5 partition lock/unlock)
# t1, before update, after update
SELECT * FROM t1 WHERE a = 3;
a	b
3	First row, p3, same as min(a) + 2 in t2
UPDATE t1 SET b = CONCAT(b, ", UPDATED2") WHERE a = 3;
SELECT * FROM INFORMATION_SCHEMA.SESSION_STATUS WHERE VARIABLE_NAME LIKE 'HANDLER_%' AND VARIABLE_VALUE > 0;
VARIABLE_NAME	VARIABLE_VALUE
# 52 locks (3 tables, 13 + 5 + 5 partition lock/unlock)
# t1, before update, after update
SELECT * FROM t1 WHERE a = 3;
a	b
3	First row, p3, same as min(a) + 2 in t2, UPDATED2
EXPLAIN BASIC INSERT INTO t1 VALUES (12, "First row, p12");
INSERT INTO t1 VALUES (12, "First row, p12");
SELECT * FROM INFORMATION_SCHEMA.SESSION_STATUS WHERE VARIABLE_NAME LIKE 'HANDLER_%' AND VARIABLE_VALUE > 0;
VARIABLE_NAME	VARIABLE_VALUE
# 16 locks (2 table, 1 + 5 partition lock/unlock)
# t1, t3 after insert trigger
INSERT INTO t1 VALUES (11, "First row, p11");
SELECT * FROM INFORMATION_SCHEMA.SESSION_STATUS WHERE VARIABLE_NAME LIKE 'HANDLER_%' AND VARIABLE_VALUE > 0;
VARIABLE_NAME	VARIABLE_VALUE
# Nothing can be pruned, due to triggers.
# 52 locks (3 tables, 13 + 5 + 5 partition lock/unlock)
# t1, t3 before insert, t3 after insert.
EXPLAIN BASIC DELETE FROM t1 WHERE a = 98;
SELECT * FROM INFORMATION_SCHEMA.SESSION_STATUS WHERE VARIABLE_NAME LIKE 'HANDLER_%' AND VARIABLE_VALUE > 0;
VARIABLE_NAME	VARIABLE_VALUE
# 28 locks (3 tables, 1 + 5 + 5 partitions)
# t1, t3 before delete trigger, t3 after delete trigger
# part 7, part 0-4, part 0-4.
SELECT * FROM t1 ORDER BY a;
a	b
0	First row, p0 REPLACED4
2	First row, p2, duplicate key 2, duplicate key 2
3	First row, p3, same as min(a) + 2 in t2, UPDATED2
4	First row, p4
5	REPLACE second, max(a) in t2: 10
8	Insert in v1_9 NO CHECK!
9	Insert in v1_9_check
10	Insert in v1_9_check fail
11	First row, p11
12	First row, p12
18	Insert in v1_25
23	Insert in v1_all
26	Third row, p0, updated 1
31	Insert in v1_25_check
39	Fourth row, p0, updated 1
52	Fifth row, p0, updated 1
65	No duplicate, INSERT_DUP_KEY_UPDATE
104	No duplicate 104
113	Second row, p0, updated 1, updated 2 -> p8, updated 3, updated 4 -> p9
DELETE FROM t1 WHERE a = 98;
SELECT * FROM INFORMATION_SCHEMA.SESSION_STATUS WHERE VARIABLE_NAME LIKE 'HANDLER_%' AND VARIABLE_VALUE > 0;
VARIABLE_NAME	VARIABLE_VALUE
# 28 locks (3 tables, 1 + 5 + 5 partitions)
# t1, t3 before delete trigger, t3 after delete trigger
SELECT * FROM t1 ORDER BY a;
a	b
0	First row, p0 REPLACED4
2	First row, p2, duplicate key 2, duplicate key 2
3	First row, p3, same as min(a) + 2 in t2, UPDATED2
4	First row, p4
5	REPLACE second, max(a) in t2: 10
8	Insert in v1_9 NO CHECK!
9	Insert in v1_9_check
10	Insert in v1_9_check fail
11	First row, p11
12	First row, p12
18	Insert in v1_25
23	Insert in v1_all
26	Third row, p0, updated 1
31	Insert in v1_25_check
39	Fourth row, p0, updated 1
52	Fifth row, p0, updated 1
65	No duplicate, INSERT_DUP_KEY_UPDATE
104	No duplicate 104
113	Second row, p0, updated 1, updated 2 -> p8, updated 3, updated 4 -> p9
SELECT * FROM t2 ORDER BY a;
a	b
2	Second auto-inc row
10	First row, p10, UPDATED
SELECT * FROM t3 ORDER BY new_a;
old_a	new_a	old_b	new_b
TRUNCATE TABLE t1;
INSERT INTO t1 VALUES (0, "first row, p0");
SELECT * FROM INFORMATION_SCHEMA.SESSION_STATUS WHERE VARIABLE_NAME LIKE 'HANDLER_%' AND VARIABLE_VALUE > 0;
VARIABLE_NAME	VARIABLE_VALUE
# 28 locks (1 tables, 13 partitions lock/unlock)
INSERT INTO t1 VALUES (0, "Second row, p0")
ON DUPLICATE KEY UPDATE b = CONCAT(b, ", duplicate key");
SELECT * FROM INFORMATION_SCHEMA.SESSION_STATUS WHERE VARIABLE_NAME LIKE 'HANDLER_%' AND VARIABLE_VALUE > 0;
VARIABLE_NAME	VARIABLE_VALUE
# 28 locks (1 tables, 13 partitions lock/unlock)
UPDATE t1 SET b = CONCAT(b, ", Updated") WHERE a = 0;
SELECT * FROM INFORMATION_SCHEMA.SESSION_STATUS WHERE VARIABLE_NAME LIKE 'HANDLER_%' AND VARIABLE_VALUE > 0;
VARIABLE_NAME	VARIABLE_VALUE
# 4 locks (1 tables, 1 partitions lock/unlock)
UPDATE t1 SET a = 1, b = CONCAT(b, ", a was 0") WHERE a = 0;
SELECT * FROM INFORMATION_SCHEMA.SESSION_STATUS WHERE VARIABLE_NAME LIKE 'HANDLER_%' AND VARIABLE_VALUE > 0;
VARIABLE_NAME	VARIABLE_VALUE
# Updating partitioning column, no lock pruning
# 28 locks (1 tables, 13 partitions lock/unlock)
INSERT INTO t1 VALUES (0, "first row, p0");
SELECT * FROM INFORMATION_SCHEMA.SESSION_STATUS WHERE VARIABLE_NAME LIKE 'HANDLER_%' AND VARIABLE_VALUE > 0;
VARIABLE_NAME	VARIABLE_VALUE
# 4 locks (1 tables, 1 partitions lock/unlock)
INSERT INTO t1 VALUES (0, "Second row, p0")
ON DUPLICATE KEY UPDATE b = CONCAT(b, ", duplicate key");
SELECT * FROM INFORMATION_SCHEMA.SESSION_STATUS WHERE VARIABLE_NAME LIKE 'HANDLER_%' AND VARIABLE_VALUE > 0;
VARIABLE_NAME	VARIABLE_VALUE
# 4 locks (1 tables, 1 partitions lock/unlock)
UPDATE t1 SET b = CONCAT(b, ", Updated") WHERE a = 0;
SELECT * FROM INFORMATION_SCHEMA.SESSION_STATUS WHERE VARIABLE_NAME LIKE 'HANDLER_%' AND VARIABLE_VALUE > 0;
VARIABLE_NAME	VARIABLE_VALUE
# 4 locks (1 tables, 1 partitions lock/unlock)
UPDATE t1 SET a = 2, b = CONCAT(b, ", a was 0") WHERE a = 0;
SELECT * FROM INFORMATION_SCHEMA.SESSION_STATUS WHERE VARIABLE_NAME LIKE 'HANDLER_%' AND VARIABLE_VALUE > 0;
VARIABLE_NAME	VARIABLE_VALUE
# Updating partitioning column, no lock pruning
# 28 locks (1 tables, 13 partitions lock/unlock)
INSERT INTO t1 VALUES (0, "1st p0");
SELECT * FROM INFORMATION_SCHEMA.SESSION_STATUS WHERE VARIABLE_NAME LIKE 'HANDLER_%' AND VARIABLE_VALUE > 0;
VARIABLE_NAME	VARIABLE_VALUE
# 4 locks (1 tables, 1 partitions lock/unlock)
INSERT INTO t1 VALUES (0, "2nd p0")
ON DUPLICATE KEY UPDATE b = CONCAT(b, ", dup key");
SELECT * FROM INFORMATION_SCHEMA.SESSION_STATUS WHERE VARIABLE_NAME LIKE 'HANDLER_%' AND VARIABLE_VALUE > 0;
VARIABLE_NAME	VARIABLE_VALUE
# 4 locks (1 tables, 1 partitions lock/unlock)
UPDATE t1 SET b = CONCAT(b, ", Updated") WHERE a = 0;
SELECT * FROM INFORMATION_SCHEMA.SESSION_STATUS WHERE VARIABLE_NAME LIKE 'HANDLER_%' AND VARIABLE_VALUE > 0;
VARIABLE_NAME	VARIABLE_VALUE
# Lock pruning possible!
# 4 locks (1 tables, 1 partitions lock/unlock)
UPDATE t1 SET a = 3, b = CONCAT(b, ", a was 0") WHERE a = 0;
SELECT * FROM INFORMATION_SCHEMA.SESSION_STATUS WHERE VARIABLE_NAME LIKE 'HANDLER_%' AND VARIABLE_VALUE > 0;
VARIABLE_NAME	VARIABLE_VALUE
# Updating partitioning column, no lock pruning
# 28 locks (1 tables, 13 partitions lock/unlock)
INSERT INTO t1 VALUES (0, "1st p0");
SELECT * FROM INFORMATION_SCHEMA.SESSION_STATUS WHERE VARIABLE_NAME LIKE 'HANDLER_%' AND VARIABLE_VALUE > 0;
VARIABLE_NAME	VARIABLE_VALUE
# 4 locks (1 tables, 1 partitions lock/unlock)
INSERT INTO t1 VALUES (0, "2nd p0")
ON DUPLICATE KEY UPDATE b = CONCAT(b, ", dup key");
SELECT * FROM INFORMATION_SCHEMA.SESSION_STATUS WHERE VARIABLE_NAME LIKE 'HANDLER_%' AND VARIABLE_VALUE > 0;
VARIABLE_NAME	VARIABLE_VALUE
# 28 locks (1 tables, 13 partitions lock/unlock)
UPDATE t1 SET b = CONCAT(b, ", Updated") WHERE a = 0;
SELECT * FROM INFORMATION_SCHEMA.SESSION_STATUS WHERE VARIABLE_NAME LIKE 'HANDLER_%' AND VARIABLE_VALUE > 0;
VARIABLE_NAME	VARIABLE_VALUE
# 28 locks (1 tables, 13 partitions lock/unlock)
UPDATE t1 SET a = 4, b = CONCAT(b, ", a was 0") WHERE a = 0;
SELECT * FROM INFORMATION_SCHEMA.SESSION_STATUS WHERE VARIABLE_NAME LIKE 'HANDLER_%' AND VARIABLE_VALUE > 0;
VARIABLE_NAME	VARIABLE_VALUE
# Updating partitioning column, no lock pruning
# 28 locks (1 tables, 13 partitions lock/unlock)
INSERT INTO t1 VALUES (0, "1st p0");
SELECT * FROM INFORMATION_SCHEMA.SESSION_STATUS WHERE VARIABLE_NAME LIKE 'HANDLER_%' AND VARIABLE_VALUE > 0;
VARIABLE_NAME	VARIABLE_VALUE
# 4 locks (1 tables, 1 partitions lock/unlock)
INSERT INTO t1 VALUES (0, "2nd p0")
ON DUPLICATE KEY UPDATE b = CONCAT(b, ", dup key");
SELECT * FROM INFORMATION_SCHEMA.SESSION_STATUS WHERE VARIABLE_NAME LIKE 'HANDLER_%' AND VARIABLE_VALUE > 0;
VARIABLE_NAME	VARIABLE_VALUE
# 4 locks (1 tables, 1 partitions lock/unlock)
UPDATE t1 SET b = CONCAT(b, ", Updated") WHERE a = 0;
SELECT * FROM INFORMATION_SCHEMA.SESSION_STATUS WHERE VARIABLE_NAME LIKE 'HANDLER_%' AND VARIABLE_VALUE > 0;
VARIABLE_NAME	VARIABLE_VALUE
# 4 locks (1 tables, 1 partitions lock/unlock)
UPDATE t1 SET a = 5, b = CONCAT(b, ", a was 0") WHERE a = 0;
SELECT * FROM INFORMATION_SCHEMA.SESSION_STATUS WHERE VARIABLE_NAME LIKE 'HANDLER_%' AND VARIABLE_VALUE > 0;
VARIABLE_NAME	VARIABLE_VALUE
# Updating partitioning column, no lock pruning
# 28 locks (1 tables, 13 partitions lock/unlock)
SELECT * FROM t1 ORDER BY a;
a	b
1	first row, p0, duplicate key, Updated, a was 0
2	first row, p0, duplicate key, Updated, a was 0
3	1st p0, dup key, Updated, a was 0
4	1st p0, dup key, Updated, a was 0
5	1st p0, dup key, Updated, a was 0
DROP TABLE t1, t2, t3;
#
# Test of BEFORE UPDATE triggers and multi UPDATE
#
CREATE TABLE t1 (a int, b varchar(128), KEY (b) LOCAL)
PARTITION BY HASH (a) PARTITIONS 13;
CREATE TABLE t2 (a int PRIMARY KEY, b varchar(128))
PARTITION BY HASH (a) PARTITIONS 13;
INSERT INTO t1 VALUES (1, "MultiUpdate1");
INSERT INTO t1 VALUES (2, "MultiUpdate2");
INSERT INTO t2 VALUES (1, "MultiUpdate1");
INSERT INTO t2 VALUES (2, "MultiUpdate2");
EXPLAIN BASIC UPDATE t1, t2
SET t1.b = CONCAT(t1.b, ",(1) t2.b:", t2.b),
t2.b = CONCAT(t2.b, ",(1) t1.b:", t1.b)
WHERE t2.b = t1.b and t1.a = 1;
Query Plan
===========================================
|ID|OPERATOR                     |NAME    |
-------------------------------------------
|0 |DISTRIBUTED UPDATE           |        |
|1 |└─HASH JOIN                  |        |
|2 |  ├─TABLE FULL SCAN          |t1      |
|3 |  └─PX COORDINATOR           |        |
|4 |    └─EXCHANGE OUT DISTR     |:EX10000|
|5 |      └─PX PARTITION ITERATOR|        |
|6 |        └─TABLE FULL SCAN    |t2      |
===========================================
Outputs & filters:
-------------------------------------
  0 - output(nil), filter(nil)
      table_columns([{t1: ({t1: (t1.__pk_increment, t1.a, t1.b)}), hash_distinct}], [{t2: ({t2: (t2.a, t2.b)}), hash_distinct}]),
      update([t1.b=column_conv(VARCHAR,utf8mb4_general_ci,length:128,NULL,CONCAT(t1.b, ',(1) t2.b:', t2.b))], [t2.b=column_conv(VARCHAR,utf8mb4_general_ci,
      length:128,NULL,CONCAT(t2.b, ',(1) t1.b:', t1.b))])
  1 - output([t1.__pk_increment], [t1.a], [t1.b], [t2.a], [t2.b]), filter(nil), rowset=16
      equal_conds([t2.b = t1.b]), other_conds(nil)
  2 - output([t1.__pk_increment], [t1.a], [t1.b]), filter([t1.a = 1]), rowset=16
      access([t1.__pk_increment], [t1.a], [t1.b]), partitions(p1)
      is_index_back=false, is_global_index=false, filter_before_indexback[false], 
      range_key([t1.__pk_increment]), range(MIN ; MAX)always true
  3 - output([t2.a], [t2.b]), filter(nil), rowset=16
  4 - output([t2.a], [t2.b]), filter(nil), rowset=16
      dop=1
  5 - output([t2.a], [t2.b]), filter(nil), rowset=16
      force partition granule
  6 - output([t2.a], [t2.b]), filter(nil), rowset=16
      access([t2.a], [t2.b]), partitions(p[0-12])
      is_index_back=false, is_global_index=false, 
      range_key([t2.a]), range(MIN ; MAX)always true
SELECT * FROM INFORMATION_SCHEMA.SESSION_STATUS WHERE VARIABLE_NAME LIKE 'HANDLER_%' AND VARIABLE_VALUE > 0;
VARIABLE_NAME	VARIABLE_VALUE
# 32 locks (2 table, 13 + 1 partitions lock/unlock)
EXPLAIN BASIC UPDATE t1, t2
SET t1.b = CONCAT(t1.b, ",(1) t2.b:", t2.b),
t2.b = CONCAT(t2.b, ",(1) t1.b:", t1.b)
WHERE t2.b = t1.b and t1.a = 1;
Query Plan
===========================================
|ID|OPERATOR                     |NAME    |
-------------------------------------------
|0 |DISTRIBUTED UPDATE           |        |
|1 |└─HASH JOIN                  |        |
|2 |  ├─TABLE FULL SCAN          |t1      |
|3 |  └─PX COORDINATOR           |        |
|4 |    └─EXCHANGE OUT DISTR     |:EX10000|
|5 |      └─PX PARTITION ITERATOR|        |
|6 |        └─TABLE FULL SCAN    |t2      |
===========================================
Outputs & filters:
-------------------------------------
  0 - output(nil), filter(nil)
      table_columns([{t1: ({t1: (t1.__pk_increment, t1.a, t1.b)}), hash_distinct}], [{t2: ({t2: (t2.a, t2.b)}), hash_distinct}]),
      update([t1.b=column_conv(VARCHAR,utf8mb4_general_ci,length:128,NULL,CONCAT(t1.b, ',(1) t2.b:', t2.b))], [t2.b=column_conv(VARCHAR,utf8mb4_general_ci,
      length:128,NULL,CONCAT(t2.b, ',(1) t1.b:', t1.b))])
  1 - output([t1.__pk_increment], [t1.a], [t1.b], [t2.a], [t2.b]), filter(nil), rowset=16
      equal_conds([t2.b = t1.b]), other_conds(nil)
  2 - output([t1.__pk_increment], [t1.a], [t1.b]), filter([t1.a = 1]), rowset=16
      access([t1.__pk_increment], [t1.a], [t1.b]), partitions(p1)
      is_index_back=false, is_global_index=false, filter_before_indexback[false], 
      range_key([t1.__pk_increment]), range(MIN ; MAX)always true
  3 - output([t2.a], [t2.b]), filter(nil), rowset=16
  4 - output([t2.a], [t2.b]), filter(nil), rowset=16
      dop=1
  5 - output([t2.a], [t2.b]), filter(nil), rowset=16
      force partition granule
  6 - output([t2.a], [t2.b]), filter(nil), rowset=16
      access([t2.a], [t2.b]), partitions(p[0-12])
      is_index_back=false, is_global_index=false, 
      range_key([t2.a]), range(MIN ; MAX)always true
SELECT * FROM INFORMATION_SCHEMA.SESSION_STATUS WHERE VARIABLE_NAME LIKE 'HANDLER_%' AND VARIABLE_VALUE > 0;
VARIABLE_NAME	VARIABLE_VALUE
# 32 locks (2 table, 13 + 1 partitions lock/unlock)
UPDATE t1, t2
SET t1.b = CONCAT(t1.b, ",(1) t2.b:", t2.b),
t2.b = CONCAT(t2.b, ",(1) t1.b:", t1.b)
WHERE t2.b = t1.b and t1.a = 1;
SELECT * FROM INFORMATION_SCHEMA.SESSION_STATUS WHERE VARIABLE_NAME LIKE 'HANDLER_%' AND VARIABLE_VALUE > 0;
VARIABLE_NAME	VARIABLE_VALUE
# 32 locks (2 table, 13 + 1 partitions lock/unlock)
# 14 read_first
# 16 read_key
# 2 read_rnd
# 21 rean_rnd_next
# 2 update
EXPLAIN BASIC UPDATE t1, t2
SET t1.b = CONCAT(t1.b, ",(2) t2.b:", t2.b),
t2.b = CONCAT(t2.b, ",(2) t1.b:", t1.b)
WHERE t1.b = t2.b and t2.a = 2;
Query Plan
===========================================
|ID|OPERATOR                     |NAME    |
-------------------------------------------
|0 |DISTRIBUTED UPDATE           |        |
|1 |└─HASH JOIN                  |        |
|2 |  ├─TABLE GET                |t2      |
|3 |  └─PX COORDINATOR           |        |
|4 |    └─EXCHANGE OUT DISTR     |:EX10000|
|5 |      └─PX PARTITION ITERATOR|        |
|6 |        └─TABLE FULL SCAN    |t1      |
===========================================
Outputs & filters:
-------------------------------------
  0 - output(nil), filter(nil)
      table_columns([{t1: ({t1: (t1.__pk_increment, t1.a, t1.b)}), hash_distinct}], [{t2: ({t2: (t2.a, t2.b)}), hash_distinct}]),
      update([t1.b=column_conv(VARCHAR,utf8mb4_general_ci,length:128,NULL,CONCAT(t1.b, ',(2) t2.b:', t2.b))], [t2.b=column_conv(VARCHAR,utf8mb4_general_ci,
      length:128,NULL,CONCAT(t2.b, ',(2) t1.b:', t1.b))])
  1 - output([t1.__pk_increment], [t1.a], [t1.b], [t2.a], [t2.b]), filter(nil), rowset=16
      equal_conds([t1.b = t2.b]), other_conds(nil)
  2 - output([t2.a], [t2.b]), filter(nil), rowset=16
      access([t2.a], [t2.b]), partitions(p2)
      is_index_back=false, is_global_index=false, 
      range_key([t2.a]), range[2 ; 2], 
      range_cond([t2.a = 2])
  3 - output([t1.__pk_increment], [t1.a], [t1.b]), filter(nil), rowset=16
  4 - output([t1.__pk_increment], [t1.a], [t1.b]), filter(nil), rowset=16
      dop=1
  5 - output([t1.__pk_increment], [t1.a], [t1.b]), filter(nil), rowset=16
      force partition granule
  6 - output([t1.__pk_increment], [t1.a], [t1.b]), filter(nil), rowset=16
      access([t1.__pk_increment], [t1.a], [t1.b]), partitions(p[0-12])
      is_index_back=false, is_global_index=false, 
      range_key([t1.__pk_increment]), range(MIN ; MAX)always true
SELECT * FROM INFORMATION_SCHEMA.SESSION_STATUS WHERE VARIABLE_NAME LIKE 'HANDLER_%' AND VARIABLE_VALUE > 0;
VARIABLE_NAME	VARIABLE_VALUE
# Trigger touches partitioning column, unable to prune locks
# 56 locks (2 tables + 2 * 13 partitions lock/unlock)
EXPLAIN BASIC UPDATE t1, t2
SET t1.b = CONCAT(t1.b, ",(2) t2.b:", t2.b),
t2.b = CONCAT(t2.b, ",(2) t1.b:", t1.b)
WHERE t1.b = t2.b and t2.a = 2;
Query Plan
===========================================
|ID|OPERATOR                     |NAME    |
-------------------------------------------
|0 |DISTRIBUTED UPDATE           |        |
|1 |└─HASH JOIN                  |        |
|2 |  ├─TABLE GET                |t2      |
|3 |  └─PX COORDINATOR           |        |
|4 |    └─EXCHANGE OUT DISTR     |:EX10000|
|5 |      └─PX PARTITION ITERATOR|        |
|6 |        └─TABLE FULL SCAN    |t1      |
===========================================
Outputs & filters:
-------------------------------------
  0 - output(nil), filter(nil)
      table_columns([{t1: ({t1: (t1.__pk_increment, t1.a, t1.b)}), hash_distinct}], [{t2: ({t2: (t2.a, t2.b)}), hash_distinct}]),
      update([t1.b=column_conv(VARCHAR,utf8mb4_general_ci,length:128,NULL,CONCAT(t1.b, ',(2) t2.b:', t2.b))], [t2.b=column_conv(VARCHAR,utf8mb4_general_ci,
      length:128,NULL,CONCAT(t2.b, ',(2) t1.b:', t1.b))])
  1 - output([t1.__pk_increment], [t1.a], [t1.b], [t2.a], [t2.b]), filter(nil), rowset=16
      equal_conds([t1.b = t2.b]), other_conds(nil)
  2 - output([t2.a], [t2.b]), filter(nil), rowset=16
      access([t2.a], [t2.b]), partitions(p2)
      is_index_back=false, is_global_index=false, 
      range_key([t2.a]), range[2 ; 2], 
      range_cond([t2.a = 2])
  3 - output([t1.__pk_increment], [t1.a], [t1.b]), filter(nil), rowset=16
  4 - output([t1.__pk_increment], [t1.a], [t1.b]), filter(nil), rowset=16
      dop=1
  5 - output([t1.__pk_increment], [t1.a], [t1.b]), filter(nil), rowset=16
      force partition granule
  6 - output([t1.__pk_increment], [t1.a], [t1.b]), filter(nil), rowset=16
      access([t1.__pk_increment], [t1.a], [t1.b]), partitions(p[0-12])
      is_index_back=false, is_global_index=false, 
      range_key([t1.__pk_increment]), range(MIN ; MAX)always true
SELECT * FROM INFORMATION_SCHEMA.SESSION_STATUS WHERE VARIABLE_NAME LIKE 'HANDLER_%' AND VARIABLE_VALUE > 0;
VARIABLE_NAME	VARIABLE_VALUE
# Trigger touches partitioning column, unable to prune locks
# 56 locks (2 tables + 2 * 13 partitions lock/unlock)
UPDATE t1, t2
SET t1.b = CONCAT(t1.b, ",(2) t2.b:", t2.b),
t2.b = CONCAT(t2.b, ",(2) t1.b:", t1.b)
WHERE t1.b = t2.b and t2.a = 2;
SELECT * FROM INFORMATION_SCHEMA.SESSION_STATUS WHERE VARIABLE_NAME LIKE 'HANDLER_%' AND VARIABLE_VALUE > 0;
VARIABLE_NAME	VARIABLE_VALUE
# Due to the BEFORE UPDATE trigger on t2 that looks at 'a',
# no locks can be pruned.
# 56 locks (2 table, 2 * 13 partitions lock/unlock)
# 15 read_key
# 1 read_next, read_rnd
# 2 read_rnd_next
# 2 update
SELECT * FROM t1 ORDER BY a;
a	b
1	MultiUpdate1,(1) t2.b:MultiUpdate1
2	MultiUpdate2,(2) t2.b:MultiUpdate2
SELECT * FROM t2 ORDER BY a;
a	b
1	MultiUpdate1,(1) t1.b:MultiUpdate1
2	MultiUpdate2,(2) t1.b:MultiUpdate2
DROP TABLE t1, t2;
#
# DO is not supported by WL#4443 !!!
# Test of DO (eg. SELECT without returning values)
#
CREATE TABLE t1 (a INT, b VARCHAR(66))
PARTITION BY HASH (a) PARTITIONS 3;
INSERT INTO t1 VALUES (1, "One"), (2, "Two"), (3, "Three"), (4, "Four"), (5, "Five"), (6, "Six"), (0, "Zero");
SELECT * FROM INFORMATION_SCHEMA.SESSION_STATUS WHERE VARIABLE_NAME LIKE 'HANDLER_%' AND VARIABLE_VALUE > 0;
VARIABLE_NAME	VARIABLE_VALUE
# 8 locks (1 table + 3 partitions lock/unlock)
SELECT @x;
@x
NULL
SELECT * FROM INFORMATION_SCHEMA.SESSION_STATUS WHERE VARIABLE_NAME LIKE 'HANDLER_%' AND VARIABLE_VALUE > 0;
VARIABLE_NAME	VARIABLE_VALUE
# 8 locks (1 table + 3 partitions lock/unlock)
SELECT @x;
@x
NULL
#
# SET is not supported by WL#4443 !!!
# Test of SET (eg. SELECT only setting an internal variable from
# the returning value)
#
SET @x = (SELECT a FROM t1 WHERE a = 5);
SELECT * FROM INFORMATION_SCHEMA.SESSION_STATUS WHERE VARIABLE_NAME LIKE 'HANDLER_%' AND VARIABLE_VALUE > 0;
VARIABLE_NAME	VARIABLE_VALUE
# 8 locks (1 table + 3 partitions lock/unlock)
SELECT @x;
@x
5
SET @y = (SELECT @x:= b FROM t1 WHERE a = 5);
SELECT * FROM INFORMATION_SCHEMA.SESSION_STATUS WHERE VARIABLE_NAME LIKE 'HANDLER_%' AND VARIABLE_VALUE > 0;
VARIABLE_NAME	VARIABLE_VALUE
# 8 locks (1 table + 3 partitions lock/unlock)
SELECT @x, @y;
@x	@y
Five	Five
SET @y = (SELECT @x:= b FROM t1 WHERE a = 5 or a = 1 ORDER BY b LIMIT 1);
SELECT * FROM INFORMATION_SCHEMA.SESSION_STATUS WHERE VARIABLE_NAME LIKE 'HANDLER_%' AND VARIABLE_VALUE > 0;
VARIABLE_NAME	VARIABLE_VALUE
# 8 locks (1 table + 3 partitions lock/unlock)
SELECT @x, @y;
@x	@y
Five	Five
#
# LOAD DATA is not supported by WL#4443 !!!
#
SELECT * FROM INFORMATION_SCHEMA.SESSION_STATUS WHERE VARIABLE_NAME LIKE 'HANDLER_%' AND VARIABLE_VALUE > 0;
VARIABLE_NAME	VARIABLE_VALUE
# 4 locks (1 table + 1 partitions lock/unlock)
DELETE FROM t1 WHERE a IN (1, 4);
SELECT * FROM t1 ORDER BY a, b;
a	b
0	Zero
2	Two
3	Three
5	Five
6	Six
SELECT * FROM INFORMATION_SCHEMA.SESSION_STATUS WHERE VARIABLE_NAME LIKE 'HANDLER_%' AND VARIABLE_VALUE > 0;
VARIABLE_NAME	VARIABLE_VALUE
# 8 locks (1 table + 3 partitions lock/unlock)
SELECT * FROM t1 ORDER BY a, b;
a	b
0	Zero
2	Two
3	Three
5	Five
6	Six
DELETE FROM t1 WHERE a IN (1, 4);
SELECT * FROM t1 ORDER BY a, b;
a	b
0	Zero
2	Two
3	Three
5	Five
6	Six
# It is possible to avoid locking with explicit partitioning selection!
SELECT * FROM INFORMATION_SCHEMA.SESSION_STATUS WHERE VARIABLE_NAME LIKE 'HANDLER_%' AND VARIABLE_VALUE > 0;
VARIABLE_NAME	VARIABLE_VALUE
# 4 locks (1 table + 1 partitions lock/unlock)
SELECT * FROM t1 ORDER BY a, b;
a	b
0	Zero
2	Two
3	Three
5	Five
6	Six
DROP TABLE t1;
#
# Test EXCHANGE PARTITION to only lock exchanged partition
#
CREATE TABLE t1 (a INT, b VARCHAR(44));
CREATE TABLE t2 (a INT, b VARCHAR(44))
PARTITION BY HASH (a) PARTITIONS 3;
INSERT INTO t1 VALUES (10, "Ten"), (13, "Thirteen"), (16, "Sixteen");
INSERT INTO t2 VALUES (0, "Zero"), (1, "One"), (2, "Two"),
(3, "Three"), (4, "Four"), (5, "Five"),
(6, "Six"), (7, "Seven"), (8, "Eight");
SELECT * FROM INFORMATION_SCHEMA.SESSION_STATUS WHERE VARIABLE_NAME LIKE 'HANDLER_%' AND VARIABLE_VALUE > 0;
VARIABLE_NAME	VARIABLE_VALUE
# 6 locks (2 table + 1 partition lock/unlock)
SELECT * FROM t1 ORDER BY a;
a	b
10	Ten
13	Thirteen
16	Sixteen
SELECT * FROM t2 ORDER BY a;
a	b
0	Zero
1	One
2	Two
3	Three
4	Four
5	Five
6	Six
7	Seven
8	Eight
DROP TABLE t1, t2;
#
# Prepared statement
#
CREATE TABLE t1 (N int, M tinyint)
PARTITION BY HASH (N) PARTITIONS 3;
INSERT INTO t1 VALUES (1,0),(1,0),(2,0),(2,0),(3,0);
SELECT * FROM INFORMATION_SCHEMA.SESSION_STATUS WHERE VARIABLE_NAME LIKE 'HANDLER_%' AND VARIABLE_VALUE > 0;
VARIABLE_NAME	VARIABLE_VALUE
# 16 locks (2 table + 6 partition lock/unlock)
SELECT * FROM t1 ORDER BY N, M;
N	M
1	0
1	0
2	0
2	0
3	0
SELECT * FROM INFORMATION_SCHEMA.SESSION_STATUS WHERE VARIABLE_NAME LIKE 'HANDLER_%' AND VARIABLE_VALUE > 0;
VARIABLE_NAME	VARIABLE_VALUE
# 4 locks (1 table + 1 partition lock/unlock)
DROP TABLE t1;
# Check if we can infer from condition on partition fields that
# no records will match.
CREATE TABLE t1 ( a int NOT NULL) PARTITION BY HASH(a) PARTITIONS 2;
INSERT INTO t1 VALUES (1),(2),(3);
EXPLAIN BASIC SELECT * FROM t1 WHERE a=5 AND a=6;
SELECT * FROM INFORMATION_SCHEMA.SESSION_STATUS WHERE VARIABLE_NAME LIKE 'HANDLER_%' AND VARIABLE_VALUE > 0;
VARIABLE_NAME	VARIABLE_VALUE
# 2 locks (1 table + 0 partition lock/unlock)
SELECT * FROM t1 WHERE a=5 AND a=6;
a
SELECT * FROM INFORMATION_SCHEMA.SESSION_STATUS WHERE VARIABLE_NAME LIKE 'HANDLER_%' AND VARIABLE_VALUE > 0;
VARIABLE_NAME	VARIABLE_VALUE
# 2 locks (1 table + 0 partition lock/unlock)
DROP TABLE t1;
#
# Test of InnoDB INSERT TABLE with non existing table in trigger
#
CREATE TABLE t1 (a INT);
# Create a table to be used in a trigger on t1
CREATE TABLE t2 (a INT);
# Drop t2 to cause a failure when inserting into t1
DROP TABLE t2;
INSERT INTO t1 VALUES (1);
DROP TABLE t1;
CREATE TABLE t1 (a INT) PARTITION BY HASH (a) PARTITIONS 3;
INSERT INTO t1 VALUES (1), (3), (9), (2), (8), (7);
DROP TABLE t1;
#
# Test subqueries/stored functions with UPDATE/DELETE/SELECT
#
DROP TABLE IF EXISTS tq,tsq;
CREATE TABLE tq (id int PRIMARY KEY auto_increment, query varchar(255), not_select tinyint);
CREATE TABLE tsq (id int PRIMARY KEY auto_increment, subquery varchar(255), can_be_locked tinyint);
CREATE TABLE t1 (a int, b varchar(255), PRIMARY KEY (a), KEY (b) LOCAL)
PARTITION BY HASH (a) PARTITIONS 3;
CREATE TABLE t2 (a int, b varchar(255), PRIMARY KEY (a), KEY (b) LOCAL)
PARTITION BY HASH (a) PARTITIONS 3;
START TRANSACTION;
INSERT INTO t1 VALUES (1, "1");
INSERT INTO t1 VALUES (2, "2");
INSERT INTO t1 VALUES (8, "8");
INSERT INTO t2 VALUES (1, "1");
INSERT INTO t2 VALUES (2, "2");
INSERT INTO t2 VALUES (8, "8");
INSERT INTO tq (query, not_select) VALUES
("SELECT * FROM t2", 0),
("SELECT sf_add_1(a) - 1, sf_add_hello(b) FROM t2", 0),
("UPDATE t2 SET b = CONCAT('+', b)", 1),
("UPDATE t2 SET b = sf_add_hello(b)", 1),
("UPDATE t2 SET a = sf_add_1(a) + 4", 1),
("DELETE FROM t2", 1);
INSERT INTO tsq (subquery, can_be_locked) VALUES
("(SELECT a FROM t1 WHERE b = '1')", 1),
("7 + (SELECT a FROM t1 WHERE b = '1')", 1),
("sf_a_from_t1b('1')", 1),
("sf_a_from_t1b_d('1')", 1),
("7 + sf_a_from_t1b('1')", 1),
("7 + sf_a_from_t1b_d('1')", 1),
("sf_a_from_t1b('1') AND a = 2", 1),
("sf_a_from_t1b_d('1') AND a = 2", 1),
("(SELECT a FROM t1 WHERE b = '1') AND a = 2", 1),
("(SELECT a FROM t1 WHERE b = '1') OR a = 2", 1),
("(SELECT a FROM t1 WHERE b = '1') AND a = 2 OR a = 8 AND sf_a_from_t1b('2')", 0);
set @old_autocommit= @@autocommit;
set @@autocommit= @old_autocommit;
DROP TABLE tq, tsq, t1, t2;
