drop table if exists t1,t2,t3;
create table t1 (a tinyint unsigned not null, primary key(a))  
partition by key (a) ;
show create table t1;
Table	Create Table
t1	CREATE TABLE `t1` (
  `a` tinyint(3) unsigned NOT NULL,
  PRIMARY KEY (`a`)
) ORGANIZATION INDEX DEFAULT CHARSET = utf8mb4 COMPRESSION = 'lz4_1.0' REPLICA_NUM = 1 BLOCK_SIZE = 16384 USE_BLOOM_FILTER = FALSE ENABLE_MACRO_BLOCK_BLOOM_FILTER = FALSE TABLET_SIZE = 134217728 PCTFREE = 10
 partition by key(a)
(partition `p0`)
insert into t1 values (255);
insert into t1 values  (254);
insert into t1 values  (253);
insert into t1 values  (252);
insert into t1 values  (1);
insert into t1 values  (2);
insert into t1 values  (128);
select * from t1;
a
1
128
2
252
253
254
255
select * from t1 where a=253;
a
253
delete from t1 where a=253;
select * from t1;
a
1
128
2
252
254
255
drop table t1;
create table t2 (a tinyint unsigned not null, primary key(a))  
partition by key (a) partitions 8;
show create table t2;
Table	Create Table
t2	CREATE TABLE `t2` (
  `a` tinyint(3) unsigned NOT NULL,
  PRIMARY KEY (`a`)
) ORGANIZATION INDEX DEFAULT CHARSET = utf8mb4 COMPRESSION = 'lz4_1.0' REPLICA_NUM = 1 BLOCK_SIZE = 16384 USE_BLOOM_FILTER = FALSE ENABLE_MACRO_BLOCK_BLOOM_FILTER = FALSE TABLET_SIZE = 134217728 PCTFREE = 10
 partition by key(a)
(partition `p0`,
partition `p1`,
partition `p2`,
partition `p3`,
partition `p4`,
partition `p5`,
partition `p6`,
partition `p7`)
insert into t2 values (255);
insert into t2 values  (254);
insert into t2 values  (253);
insert into t2 values  (252);
select * from t2;
a
252
253
254
255
select * from t2 where a=253;
a
253
delete from t2 where a=253;
select * from t2;
a
252
254
255
delete from t2;
255 inserts;
select count(*) from t2;
count(*)
255
drop table t2;
create table t3 (a tinyint not null, primary key(a))  
partition by key (a) partitions 7;
show create table t3;
Table	Create Table
t3	CREATE TABLE `t3` (
  `a` tinyint(4) NOT NULL,
  PRIMARY KEY (`a`)
) ORGANIZATION INDEX DEFAULT CHARSET = utf8mb4 COMPRESSION = 'lz4_1.0' REPLICA_NUM = 1 BLOCK_SIZE = 16384 USE_BLOOM_FILTER = FALSE ENABLE_MACRO_BLOCK_BLOOM_FILTER = FALSE TABLET_SIZE = 134217728 PCTFREE = 10
 partition by key(a)
(partition `p0`,
partition `p1`,
partition `p2`,
partition `p3`,
partition `p4`,
partition `p5`,
partition `p6`)
insert into t3 values (127);
insert into t3 values  (126);
insert into t3 values  (125);
insert into t3 values  (124);
insert into t3 values  (-128);
insert into t3 values  (-127);
insert into t3 values  (1);
insert into t3 values  (-1);
insert into t3 values  (0);
select * from t3;
a
-1
-127
-128
0
1
124
125
126
127
select * from t3 where a=125;
a
125
delete from t3 where a=125;
select * from t3;
a
-1
-127
-128
0
1
124
126
127
drop table t3;
drop table if exists t1,t2,t3;
create table t1 (a smallint unsigned not null, primary key(a))  
partition by key (a) ;
show create table t1;
Table	Create Table
t1	CREATE TABLE `t1` (
  `a` smallint(5) unsigned NOT NULL,
  PRIMARY KEY (`a`)
) ORGANIZATION INDEX DEFAULT CHARSET = utf8mb4 COMPRESSION = 'lz4_1.0' REPLICA_NUM = 1 BLOCK_SIZE = 16384 USE_BLOOM_FILTER = FALSE ENABLE_MACRO_BLOCK_BLOOM_FILTER = FALSE TABLET_SIZE = 134217728 PCTFREE = 10
 partition by key(a)
(partition `p0`)
insert into t1 values (65535);
insert into t1 values  (65534);
insert into t1 values  (65533);
insert into t1 values  (65532);
insert into t1 values  (1);
insert into t1 values  (2);
insert into t1 values  (256);
select * from t1;
a
1
2
256
65532
65533
65534
65535
select * from t1 where a=65533;
a
65533
delete from t1 where a=65533;
select * from t1;
a
1
2
256
65532
65534
65535
drop table t1;
create table t2 (a smallint unsigned not null, primary key(a))  
partition by key (a) partitions 8;
show create table t2;
Table	Create Table
t2	CREATE TABLE `t2` (
  `a` smallint(5) unsigned NOT NULL,
  PRIMARY KEY (`a`)
) ORGANIZATION INDEX DEFAULT CHARSET = utf8mb4 COMPRESSION = 'lz4_1.0' REPLICA_NUM = 1 BLOCK_SIZE = 16384 USE_BLOOM_FILTER = FALSE ENABLE_MACRO_BLOCK_BLOOM_FILTER = FALSE TABLET_SIZE = 134217728 PCTFREE = 10
 partition by key(a)
(partition `p0`,
partition `p1`,
partition `p2`,
partition `p3`,
partition `p4`,
partition `p5`,
partition `p6`,
partition `p7`)
insert into t2 values (65535);
insert into t2 values  (65534);
insert into t2 values  (65533);
insert into t2 values  (65532);
select * from t2;
a
65532
65533
65534
65535
select * from t2 where a=65533;
a
65533
delete from t2 where a=65533;
select * from t2;
a
65532
65534
65535
delete from t2;
1024 inserts;
select count(*) from t2;
count(*)
1024
drop table t2;
create table t3 (a smallint not null, primary key(a))  
partition by key (a) partitions 7;
show create table t3;
Table	Create Table
t3	CREATE TABLE `t3` (
  `a` smallint(6) NOT NULL,
  PRIMARY KEY (`a`)
) ORGANIZATION INDEX DEFAULT CHARSET = utf8mb4 COMPRESSION = 'lz4_1.0' REPLICA_NUM = 1 BLOCK_SIZE = 16384 USE_BLOOM_FILTER = FALSE ENABLE_MACRO_BLOCK_BLOOM_FILTER = FALSE TABLET_SIZE = 134217728 PCTFREE = 10
 partition by key(a)
(partition `p0`,
partition `p1`,
partition `p2`,
partition `p3`,
partition `p4`,
partition `p5`,
partition `p6`)
insert into t3 values (32767);
insert into t3 values  (32766);
insert into t3 values  (32765);
insert into t3 values  (32764);
insert into t3 values  (-32768);
insert into t3 values  (-32767);
insert into t3 values  (1);
insert into t3 values  (-1);
insert into t3 values  (0);
select * from t3;
a
-1
-32767
-32768
0
1
32764
32765
32766
32767
select * from t3 where a=32765;
a
32765
delete from t3 where a=32765;
select * from t3;
a
-1
-32767
-32768
0
1
32764
32766
32767
drop table t3;
drop table if exists t1,t2,t3;
create table t1 (a int unsigned not null, primary key(a))  
partition by key (a);
show create table t1;
Table	Create Table
t1	CREATE TABLE `t1` (
  `a` int(10) unsigned NOT NULL,
  PRIMARY KEY (`a`)
) ORGANIZATION INDEX DEFAULT CHARSET = utf8mb4 COMPRESSION = 'lz4_1.0' REPLICA_NUM = 1 BLOCK_SIZE = 16384 USE_BLOOM_FILTER = FALSE ENABLE_MACRO_BLOCK_BLOOM_FILTER = FALSE TABLET_SIZE = 134217728 PCTFREE = 10
 partition by key(a)
(partition `p0`)
insert into t1 values (4294967295);
insert into t1 values  (4294967294);
insert into t1 values  (4294967293);
insert into t1 values  (4294967292);
insert into t1 values  (1);
insert into t1 values  (2);
insert into t1 values  (65535);
select * from t1;
a
1
2
4294967292
4294967293
4294967294
4294967295
65535
select * from t1 where a=4294967293;
a
4294967293
delete from t1 where a=4294967293;
select * from t1;
a
1
2
4294967292
4294967294
4294967295
65535
drop table t1;
create table t2 (a int unsigned not null, primary key(a))  
partition by key (a) partitions 8;
show create table t2;
Table	Create Table
t2	CREATE TABLE `t2` (
  `a` int(10) unsigned NOT NULL,
  PRIMARY KEY (`a`)
) ORGANIZATION INDEX DEFAULT CHARSET = utf8mb4 COMPRESSION = 'lz4_1.0' REPLICA_NUM = 1 BLOCK_SIZE = 16384 USE_BLOOM_FILTER = FALSE ENABLE_MACRO_BLOCK_BLOOM_FILTER = FALSE TABLET_SIZE = 134217728 PCTFREE = 10
 partition by key(a)
(partition `p0`,
partition `p1`,
partition `p2`,
partition `p3`,
partition `p4`,
partition `p5`,
partition `p6`,
partition `p7`)
insert into t2 values (4294967295);
insert into t2 values  (4294967294);
insert into t2 values  (4294967293);
insert into t2 values  (4294967292);
select * from t2;
a
4294967292
4294967293
4294967294
4294967295
select * from t2 where a=4294967293;
a
4294967293
delete from t2 where a=4294967293;
select * from t2;
a
4294967292
4294967294
4294967295
delete from t2;
1024 inserts;
select count(*) from t2;
count(*)
1024
drop table t2;
create table t3 (a int not null, primary key(a))  
partition by key (a) partitions 7;
show create table t3;
Table	Create Table
t3	CREATE TABLE `t3` (
  `a` int(11) NOT NULL,
  PRIMARY KEY (`a`)
) ORGANIZATION INDEX DEFAULT CHARSET = utf8mb4 COMPRESSION = 'lz4_1.0' REPLICA_NUM = 1 BLOCK_SIZE = 16384 USE_BLOOM_FILTER = FALSE ENABLE_MACRO_BLOCK_BLOOM_FILTER = FALSE TABLET_SIZE = 134217728 PCTFREE = 10
 partition by key(a)
(partition `p0`,
partition `p1`,
partition `p2`,
partition `p3`,
partition `p4`,
partition `p5`,
partition `p6`)
insert into t3 values (2147483647);
insert into t3 values  (2147483646);
insert into t3 values  (2147483645);
insert into t3 values  (2147483644);
insert into t3 values  (-2147483648);
insert into t3 values  (-2147483647);
insert into t3 values  (1);
insert into t3 values  (-1);
insert into t3 values  (0);
select * from t3;
a
-1
-2147483647
-2147483648
0
1
2147483644
2147483645
2147483646
2147483647
select * from t3 where a=2147483645;
a
2147483645
delete from t3 where a=2147483645;
select * from t3;
a
-1
-2147483647
-2147483648
0
1
2147483644
2147483646
2147483647
drop table t3;
drop table if exists t1,t2,t3;
create table t1 (a mediumint unsigned not null, primary key(a))  
partition by key (a) ;
show create table t1;
Table	Create Table
t1	CREATE TABLE `t1` (
  `a` mediumint(8) unsigned NOT NULL,
  PRIMARY KEY (`a`)
) ORGANIZATION INDEX DEFAULT CHARSET = utf8mb4 COMPRESSION = 'lz4_1.0' REPLICA_NUM = 1 BLOCK_SIZE = 16384 USE_BLOOM_FILTER = FALSE ENABLE_MACRO_BLOCK_BLOOM_FILTER = FALSE TABLET_SIZE = 134217728 PCTFREE = 10
 partition by key(a)
(partition `p0`)
insert into t1 values (16777215);
insert into t1 values  (16777214);
insert into t1 values  (16777213);
insert into t1 values  (16777212);
insert into t1 values  (1);
insert into t1 values  (2);
insert into t1 values  (65535);
select * from t1;
a
1
16777212
16777213
16777214
16777215
2
65535
select * from t1 where a=16777213;
a
16777213
delete from t1 where a=16777213;
select * from t1;
a
1
16777212
16777214
16777215
2
65535
drop table t1;
create table t2 (a mediumint unsigned not null, primary key(a))  
partition by key (a) partitions 8;
show create table t2;
Table	Create Table
t2	CREATE TABLE `t2` (
  `a` mediumint(8) unsigned NOT NULL,
  PRIMARY KEY (`a`)
) ORGANIZATION INDEX DEFAULT CHARSET = utf8mb4 COMPRESSION = 'lz4_1.0' REPLICA_NUM = 1 BLOCK_SIZE = 16384 USE_BLOOM_FILTER = FALSE ENABLE_MACRO_BLOCK_BLOOM_FILTER = FALSE TABLET_SIZE = 134217728 PCTFREE = 10
 partition by key(a)
(partition `p0`,
partition `p1`,
partition `p2`,
partition `p3`,
partition `p4`,
partition `p5`,
partition `p6`,
partition `p7`)
insert into t2 values (16777215);
insert into t2 values  (16777214);
insert into t2 values  (16777213);
insert into t2 values  (16777212);
select * from t2;
a
16777212
16777213
16777214
16777215
select * from t2 where a=16777213;
a
16777213
delete from t2 where a=16777213;
select * from t2;
a
16777212
16777214
16777215
delete from t2;
1024 inserts;
select count(*) from t2;
count(*)
1024
drop table t2;
create table t3 (a mediumint not null, primary key(a))  
partition by key (a) partitions 7;
show create table t3;
Table	Create Table
t3	CREATE TABLE `t3` (
  `a` mediumint(9) NOT NULL,
  PRIMARY KEY (`a`)
) ORGANIZATION INDEX DEFAULT CHARSET = utf8mb4 COMPRESSION = 'lz4_1.0' REPLICA_NUM = 1 BLOCK_SIZE = 16384 USE_BLOOM_FILTER = FALSE ENABLE_MACRO_BLOCK_BLOOM_FILTER = FALSE TABLET_SIZE = 134217728 PCTFREE = 10
 partition by key(a)
(partition `p0`,
partition `p1`,
partition `p2`,
partition `p3`,
partition `p4`,
partition `p5`,
partition `p6`)
insert into t3 values (8388607);
insert into t3 values  (8388606);
insert into t3 values  (8388605);
insert into t3 values  (8388604);
insert into t3 values  (-8388608);
insert into t3 values  (-8388607);
insert into t3 values  (1);
insert into t3 values  (-1);
insert into t3 values  (0);
select * from t3;
a
-1
-8388607
-8388608
0
1
8388604
8388605
8388606
8388607
select * from t3 where a=8388605;
a
8388605
delete from t3 where a=8388605;
select * from t3;
a
-1
-8388607
-8388608
0
1
8388604
8388606
8388607
drop table t3;
drop table if exists t1,t2,t3;
create table t1 (a bigint unsigned not null, primary key(a))
partition by key(a) ;
show create table t1;
Table	Create Table
t1	CREATE TABLE `t1` (
  `a` bigint(20) unsigned NOT NULL,
  PRIMARY KEY (`a`)
) ORGANIZATION INDEX DEFAULT CHARSET = utf8mb4 COMPRESSION = 'lz4_1.0' REPLICA_NUM = 1 BLOCK_SIZE = 16384 USE_BLOOM_FILTER = FALSE ENABLE_MACRO_BLOCK_BLOOM_FILTER = FALSE TABLET_SIZE = 134217728 PCTFREE = 10
 partition by key(a)
(partition `p0`)
insert into t1 values (18446744073709551615);
insert into t1 values  (0xFFFFFFFFFFFFFFFE);
insert into t1 values  (18446744073709551613);
insert into t1 values  (18446744073709551612);
insert into t1 values  (1);
insert into t1 values  (2);
insert into t1 values  (65535);
select * from t1;
a
1
18446744073709551612
18446744073709551613
18446744073709551614
18446744073709551615
2
65535
select * from t1 where a=-2;
a
delete from t1 where a=-2;
select * from t1;
a
1
18446744073709551612
18446744073709551613
18446744073709551614
18446744073709551615
2
65535
select * from t1 where a=18446744073709551615;
a
18446744073709551615
delete from t1 where a=18446744073709551615;
select * from t1;
a
1
18446744073709551612
18446744073709551613
18446744073709551614
2
65535
drop table t1;
create table t2 (a bigint unsigned not null, primary key(a))  
partition by key (a) partitions 8;
show create table t2;
Table	Create Table
t2	CREATE TABLE `t2` (
  `a` bigint(20) unsigned NOT NULL,
  PRIMARY KEY (`a`)
) ORGANIZATION INDEX DEFAULT CHARSET = utf8mb4 COMPRESSION = 'lz4_1.0' REPLICA_NUM = 1 BLOCK_SIZE = 16384 USE_BLOOM_FILTER = FALSE ENABLE_MACRO_BLOCK_BLOOM_FILTER = FALSE TABLET_SIZE = 134217728 PCTFREE = 10
 partition by key(a)
(partition `p0`,
partition `p1`,
partition `p2`,
partition `p3`,
partition `p4`,
partition `p5`,
partition `p6`,
partition `p7`)
insert into t2 values (18446744073709551615);
insert into t2 values  (0xFFFFFFFFFFFFFFFE);
insert into t2 values  (18446744073709551613);
insert into t2 values  (18446744073709551612);
select * from t2;
a
18446744073709551612
18446744073709551613
18446744073709551614
18446744073709551615
select * from t2 where a=18446744073709551615;
a
18446744073709551615
delete from t2 where a=18446744073709551615;
select * from t2;
a
18446744073709551612
18446744073709551613
18446744073709551614
delete from t2;
1024 inserts;
select count(*) from t2;
count(*)
1024
drop table t2;
create table t3 (a bigint not null, primary key(a))  
partition by key (a) partitions 7;
show create table t3;
Table	Create Table
t3	CREATE TABLE `t3` (
  `a` bigint(20) NOT NULL,
  PRIMARY KEY (`a`)
) ORGANIZATION INDEX DEFAULT CHARSET = utf8mb4 COMPRESSION = 'lz4_1.0' REPLICA_NUM = 1 BLOCK_SIZE = 16384 USE_BLOOM_FILTER = FALSE ENABLE_MACRO_BLOCK_BLOOM_FILTER = FALSE TABLET_SIZE = 134217728 PCTFREE = 10
 partition by key(a)
(partition `p0`,
partition `p1`,
partition `p2`,
partition `p3`,
partition `p4`,
partition `p5`,
partition `p6`)
insert into t3 values (9223372036854775807);
insert into t3 values  (9223372036854775806);
insert into t3 values  (9223372036854775805);
insert into t3 values  (9223372036854775804);
insert into t3 values  (-9223372036854775808);
insert into t3 values  (-9223372036854775807);
insert into t3 values  (1);
insert into t3 values  (-1);
insert into t3 values  (0);
select * from t3;
a
-1
-9223372036854775807
-9223372036854775808
0
1
9223372036854775804
9223372036854775805
9223372036854775806
9223372036854775807
select * from t3 where a=9223372036854775806;
a
9223372036854775806
delete from t3 where a=9223372036854775806;
select * from t3;
a
-1
-9223372036854775807
-9223372036854775808
0
1
9223372036854775804
9223372036854775805
9223372036854775807
drop table t3;
