set ob_query_timeout=600000000;
set ob_trx_timeout=600000000;
drop table if exists t2;
create table t2 (a int not null, primary key(a)) 
partition by hash (a) partitions 192;
show create table t2;
Table	Create Table
t2	CREATE TABLE `t2` (
  `a` int(11) NOT NULL,
  PRIMARY KEY (`a`)
) ORGANIZATION INDEX DEFAULT CHARSET = utf8mb4 COMPRESSION = 'lz4_1.0' REPLICA_NUM = 1 BLOCK_SIZE = 16384 USE_BLOOM_FILTER = FALSE ENABLE_MACRO_BLOCK_BLOOM_FILTER = FALSE TABLET_SIZE = 134217728 PCTFREE = 10
 partition by hash(a)
(partition `p0`,
partition `p1`,
partition `p2`,
partition `p3`,
partition `p4`,
partition `p5`,
partition `p6`,
partition `p7`,
partition `p8`,
partition `p9`,
partition `p10`,
partition `p11`,
partition `p12`,
partition `p13`,
partition `p14`,
partition `p15`,
partition `p16`,
partition `p17`,
partition `p18`,
partition `p19`,
partition `p20`,
partition `p21`,
partition `p22`,
partition `p23`,
partition `p24`,
partition `p25`,
partition `p26`,
partition `p27`,
partition `p28`,
partition `p29`,
partition `p30`,
partition `p31`,
partition `p32`,
partition `p33`,
partition `p34`,
partition `p35`,
partition `p36`,
partition `p37`,
partition `p38`,
partition `p39`,
partition `p40`,
partition `p41`,
partition `p42`,
partition `p43`,
partition `p44`,
partition `p45`,
partition `p46`,
partition `p47`,
partition `p48`,
partition `p49`,
partition `p50`,
partition `p51`,
partition `p52`,
partition `p53`,
partition `p54`,
partition `p55`,
partition `p56`,
partition `p57`,
partition `p58`,
partition `p59`,
partition `p60`,
partition `p61`,
partition `p62`,
partition `p63`,
partition `p64`,
partition `p65`,
partition `p66`,
partition `p67`,
partition `p68`,
partition `p69`,
partition `p70`,
partition `p71`,
partition `p72`,
partition `p73`,
partition `p74`,
partition `p75`,
partition `p76`,
partition `p77`,
partition `p78`,
partition `p79`,
partition `p80`,
partition `p81`,
partition `p82`,
partition `p83`,
partition `p84`,
partition `p85`,
partition `p86`,
partition `p87`,
partition `p88`,
partition `p89`,
partition `p90`,
partition `p91`,
partition `p92`,
partition `p93`,
partition `p94`,
partition `p95`,
partition `p96`,
partition `p97`,
partition `p98`,
partition `p99`,
partition `p100`,
partition `p101`,
partition `p102`,
partition `p103`,
partition `p104`,
partition `p105`,
partition `p106`,
partition `p107`,
partition `p108`,
partition `p109`,
partition `p110`,
partition `p111`,
partition `p112`,
partition `p113`,
partition `p114`,
partition `p115`,
partition `p116`,
partition `p117`,
partition `p118`,
partition `p119`,
partition `p120`,
partition `p121`,
partition `p122`,
partition `p123`,
partition `p124`,
partition `p125`,
partition `p126`,
partition `p127`,
partition `p128`,
partition `p129`,
partition `p130`,
partition `p131`,
partition `p132`,
partition `p133`,
partition `p134`,
partition `p135`,
partition `p136`,
partition `p137`,
partition `p138`,
partition `p139`,
partition `p140`,
partition `p141`,
partition `p142`,
partition `p143`,
partition `p144`,
partition `p145`,
partition `p146`,
partition `p147`,
partition `p148`,
partition `p149`,
partition `p150`,
partition `p151`,
partition `p152`,
partition `p153`,
partition `p154`,
partition `p155`,
partition `p156`,
partition `p157`,
partition `p158`,
partition `p159`,
partition `p160`,
partition `p161`,
partition `p162`,
partition `p163`,
partition `p164`,
partition `p165`,
partition `p166`,
partition `p167`,
partition `p168`,
partition `p169`,
partition `p170`,
partition `p171`,
partition `p172`,
partition `p173`,
partition `p174`,
partition `p175`,
partition `p176`,
partition `p177`,
partition `p178`,
partition `p179`,
partition `p180`,
partition `p181`,
partition `p182`,
partition `p183`,
partition `p184`,
partition `p185`,
partition `p186`,
partition `p187`,
partition `p188`,
partition `p189`,
partition `p190`,
partition `p191`)
500 inserts;
select count(*) from t2;
count(*)
500
select count(*) from t2 partition (p0);
count(*)
2
select count(*) from t2 partition (p10);
count(*)
3
select count(*) from t2 partition (p100);
count(*)
3
select count(*) from t2 partition (p191);
count(*)
2
select * from t2 partition (p0);
a
192
384
select * from t2 partition (p10);
a
10
202
394
select * from t2 partition (p100);
a
100
292
484
select * from t2 partition (p191);
a
191
383
delete from t2 partition (p191);
select * from t2 partition (p191);
a
insert into t2 partition (p191) values (191), (65471);
select * from t2 partition (p191);
a
191
65471
update t2 partition (p191) set a=192*10-1 where a= 191;
select * from t2 partition (p191);
a
1919
65471
select * from t2 partition (p191);
a
1919
65471
drop table t2;
