########## 处理测试环境 ##########
drop database if exists zh_db;
create database if not exists zh_db;
use zh_db;
drop user 'funkzz';
# 创建用户并使用
create user 'funkzz' IDENTIFIED BY 'funkzz';
grant all on *.* to 'funkzz' WITH GRANT OPTION;
set autocommit=1;
###########存储过程         标签   float/double 1-3
###########变量             标签   float/double 1-3-1
#####@a设置变量  设置数字
drop procedure if exists pro1//
create procedure pro1()
BEGIN
declare a double(20,3) default 0;
set @a = 30.00;
END//
CALL pro1()//
select @a//
@a
30.00
#####@a设置变量  设置字母
drop procedure if exists pro1//
create procedure pro1()
BEGIN
declare a double(20,3) default 0;
set @a = 'aaa';
END//
CALL pro1()//
select @a//
@a
aaa
#####@a设置变量  设置中文
drop procedure if exists pro1//
create procedure pro1()
BEGIN
declare a double(20,3) default 0;
set @a = '好好';
END//
CALL pro1()//
select @a//
@a
好好
#####select @a设置变量 
drop procedure if exists pro1//
create procedure pro1()
BEGIN
declare a double(20,3) default 0;
select @a := 30.00;
END//
CALL pro1()//
@a := 30.00
30.00
select @a//
@a
30.00
#####select @a设置字母
drop procedure if exists pro1//
create procedure pro1()
BEGIN
declare a double(20,3) default 0;
select @a := 'aaa';
END//
CALL pro1()//
@a := 'aaa'
aaa
select @a//
@a
aaa
#####select @a设置中文
drop procedure if exists pro1//
create procedure pro1()
BEGIN
declare a double(20,3) default 0;
select @a := '好好';
END//
CALL pro1()//
@a := '好好'
好好
select @a//
@a
好好
#####设置参数           标签     float/double 1-3-2
#####in 传入参数  传入数字
drop procedure if exists pro1//
create procedure pro1(in a double(20,2))
BEGIN
select a;
set a = 2;
select a;
END//
CALL pro1(1)//
a
a
1.00
2.00
#####in 传入参数  传入字母
drop procedure if exists pro1//
create procedure pro1(in a double(20,2))
BEGIN
select a;
set a = 2;
select a;
END//
set @a = 'aaa'//
CALL pro1()//
ERROR 42000: Incorrect number of arguments
#####in 传入参数  传入中文
drop procedure if exists pro1//
create procedure pro1(in a double(20,2))
BEGIN
select a;
set a = 2;
select a;
END//
set @a = '中文'//
CALL pro1()//
ERROR 42000: Incorrect number of arguments
#####out 传出参数  传入数字
drop procedure if exists pro1//
create procedure pro1(out a double(20,2))
BEGIN
select a;
set a = 2;
select a;
END//
set @a = 1//
CALL pro1(@a)//
a
a
NULL
2.00
select @a//
@a
2.00
#####out 传出参数  传入字母
drop procedure if exists pro1//
create procedure pro1(out a double(20,2))
BEGIN
select a;
set a = 2.22;
select a;
END//
set @a = 'aaa'//
CALL pro1(@a)//
a
a
NULL
2.22
select @a//
@a
2.22
#####out 传出参数  传入中文
drop procedure if exists pro1//
create procedure pro1(out a double(20,2))
BEGIN
select a;
set a = 2.11;
select a;
END//
set @a = '中文'//
CALL pro1(@a)//
a
a
NULL
2.11
select @a//
@a
2.11
#####inout 输入输出参数  传入数字
drop procedure if exists pro1//
create procedure pro1(inout a double(20,2))
BEGIN
select a;
set a = 2;
select a;
END//
set @a = 1//
CALL pro1(@a)//
a
a
1.00
2.00
select @a//
@a
2.00
#####inout 输入输出参数  传入字母
drop procedure if exists pro1//
create procedure pro1(inout a double(20,2))
BEGIN
select a;
set a = 2;
select a;
END//
set @a = 'aaa'//
CALL pro1(@a)//
ERROR 01000: Truncated incorrect DOUBLE value
select @a//
@a
aaa
#####inout 输入输出参数  传入中文
drop procedure if exists pro1//
create procedure pro1(inout a double(20,2))
BEGIN
select a;
set a = 2;
select a;
END//
set @a = '中文'//
CALL pro1(@a)//
ERROR 01000: Truncated incorrect DOUBLE value
select @a//
@a
中文
#####select into(变量)    标签   float/double 1-3-4
drop table if exists t1//
CREATE TABLE t1(a double(20,2),b char(25),class INT,score double(20,1))//
insert into t1 values(1,'select into(变量)',1101,97)//
insert into t1 values(2,'select into(变量)',1101,80.5)//
insert into t1 values(3,'select into(变量)',1102,70.5)//
insert into t1 values(4,'select into(变量)',1102,85.5)//
insert into t1 values(5,'select into(变量)',1102,90)//
insert into t1 values(6,'select into(变量)',1103,90.5)//
drop procedure if exists pro1//
create procedure pro1()
BEGIN
declare e double(20,2);
declare f char(25);
declare g INT;
declare h double(20,1);
select a,b,class,score into e,f,g,h from t1 where a = 2;
select e,f,g,h;
END//
CALL pro1()//
e	f	g	h
2.00	select into(变量)	1101	80.5
##########赋值        标签   float/double 1-3-5
drop procedure if exists pro1//
create procedure pro1()
BEGIN
declare e double(20,3);
set e = 1;
select e;
END//
CALL pro1()//
e
1.000
select @e//
@e
NULL
#####赋值 默认值
drop procedure if exists pro1//
create procedure pro1()
BEGIN
declare e double(20,3) default 97.77;
select e;
END//
CALL pro1()//
e
97.770
select @e//
@e
NULL
#####double变量的使用
drop table if exists t1//
CREATE TABLE t1(a double(20,2),b char(25),class INT,score double(20,1))//
insert into t1 values(1,'double变量',1101,97)//
insert into t1 values(2,'double变量',1101,80.5)//
insert into t1 values(3,'double变量',1102,70.5)//
insert into t1 values(4,'double变量',1102,85.5)//
insert into t1 values(5,'double变量',1102,90)//
insert into t1 values(6,'double变量',1103,90.5)//
drop procedure if exists pro1//
create procedure pro1()
BEGIN
declare e double(20,2);
declare f char(25);
declare g INT;
declare h double(20,1);
select a,b,class,score into e,f,g,h from t1 where a = 2;
select e,f,g,h;
END//
CALL pro1()//
e	f	g	h
2.00	double变量	1101	80.5
#####递归
drop procedure if exists factorial//
set @@session.max_sp_recursion_depth=99//
create procedure factorial (in n double(20,3), out b double(20,3))  
begin  
declare c_in double(20,3);
declare c_out double(20,3);
if n!=1 then 
set c_in := n-1;  
call factorial(c_in,c_out);  
set b:=n*c_out;  
else  
set b:=1;  
end if;  
end//
call factorial(6,@r)//
select @r//
@r
720.000
#######边界值           标签  float/double 1-3-9
#####传入参数in    double(M,D) M = 255
drop procedure if exists pro1//
create procedure pro1(in a double(255,2))
BEGIN
select a;
set a = 2;
select a;
END//
set @a = 1//
CALL pro1(@a)//
a
a
1.00
2.00
select @a//
@a
1
#####传入参数in    double(M,D) M = 256
drop procedure if exists pro1//
create procedure pro1(in a double(256,2))
BEGIN
select a;
set a = 2;
select a;
END//
ERROR 42000: Display width out of range for column 'a' (max = 255)
set @a = 1//
CALL pro1(@a)//
ERROR 42000: procedure zh_db.pro1 does not exist
select @a//
@a
1
#####传出参数out    double(M,D) M = 255
drop procedure if exists pro1//
create procedure pro1(out a double(255,2))
BEGIN
select a;
set a = 33;
select a;
END//
set @a = 22//
CALL pro1(@a)//
a
a
NULL
33.00
select @a//
@a
33.00
#####传出参数out   double(M,D) M = 256
drop procedure if exists pro1//
create procedure pro1(out a double(256,2))
BEGIN
select a;
set a = 33;
select a;
END//
ERROR 42000: Display width out of range for column 'a' (max = 255)
set @a = 22//
CALL pro1(@a)//
ERROR 42000: procedure zh_db.pro1 does not exist
select @a//
@a
22
#####传入传出参数inout   double(M,D) M = 255
drop procedure if exists pro1//
create procedure pro1(inout a double(255,2))
BEGIN
select a;
set a = 2;
select a;
END//
set @a = 1//
CALL pro1(@a)//
a
a
1.00
2.00
select @a//
@a
2.00
#####传入传出参数inout   double(M,D) M = 256
drop procedure if exists pro1//
create procedure pro1(inout a double(256,2))
BEGIN
select a;
set a = 2;
select a;
END//
ERROR 42000: Display width out of range for column 'a' (max = 255)
set @a = 1//
CALL pro1(@a)//
ERROR 42000: procedure zh_db.pro1 does not exist
select @a//
@a
1
#################函数        标签   float/double 1-4
##########abs函数
drop procedure if exists pro1//
create procedure pro1()
BEGIN
select abs(-1);
END//
CALL pro1()//
abs(-1)
1
##########abs函数小数
drop procedure if exists pro1//
create procedure pro1()
BEGIN
select abs(-1.5);
END//
CALL pro1()//
abs(-1.5)
1.5
##########abs函数小数
drop procedure if exists pro1//
create procedure pro1()
BEGIN
select abs(-15166666666666666666666666666666666666666666666666666666661512123123132123123132);
END//
CALL pro1()//
abs(-15166666666666666666666666666666666666666666666666666666661512123123132123123132)
15166666666666666666666666666666666666666666666666666666661512123123132123123132
##########acos函数
drop procedure if exists pro1//
create procedure pro1()
BEGIN
select acos(0.5);
END//
CALL pro1()//
acos(0.5)
1.0471975511965979
##########acos函数
drop procedure if exists pro1//
create procedure pro1()
BEGIN
select acos(π/2);
END//
CALL pro1()//
ERROR 42S22: Unknown column 'π' in 'field list'
##########cos函数
drop procedure if exists pro1//
create procedure pro1()
BEGIN
select cos(0.5);
END//
CALL pro1()//
cos(0.5)
0.8775825618903728
#########ceil函数
drop procedure if exists pro1//
create procedure pro1()
BEGIN
select ceil(1.23);
END//
CALL pro1()//
ceil(1.23)
2
#########floor函数
drop procedure if exists pro1//
create procedure pro1()
BEGIN
select floor(1.23);
END//
CALL pro1()//
floor(1.23)
1
drop procedure if exists pro2//
create procedure pro2()
BEGIN
select floor(-1.23);
END//
CALL pro2()//
floor(-1.23)
-2
#########log(x)函数
drop procedure if exists pro1//
create procedure pro1()
BEGIN
select log(30);
END//
CALL pro1()//
log(30)
3.4011973816621555
#########log(x,b)函数
drop procedure if exists pro1//
create procedure pro1()
BEGIN
select log(30,50);
END//
CALL pro1()//
log(30,50)
1.1501899379671847
#########mod(x,b)函数
drop procedure if exists pro1//
create procedure pro1()
BEGIN
select mod(64,5);
END//
CALL pro1()//
mod(64,5)
4
#########power(x,b)函数
drop procedure if exists pro1//
create procedure pro1()
BEGIN
select power(64,5);
END//
CALL pro1()//
power(64,5)
1073741824
#########power(x,b)函数
drop procedure if exists pro1//
create procedure pro1()
BEGIN
select power(2,3);
END//
CALL pro1()//
power(2,3)
8
#########round(x)函数
drop procedure if exists pro1//
create procedure pro1()
BEGIN
select round(33.3355);
END//
CALL pro1()//
round(33.3355)
33
#########round(x,1)函数
drop procedure if exists pro1//
create procedure pro1()
BEGIN
select round(33.3355,1);
END//
CALL pro1()//
round(33.3355,1)
33.3
#########round(x,2)函数
drop procedure if exists pro1//
create procedure pro1()
BEGIN
select round(33.3355,2);
END//
CALL pro1()//
round(33.3355,2)
33.34
#########sqrt(x)函数
drop procedure if exists pro1//
create procedure pro1()
BEGIN
select sqrt(16);
END//
CALL pro1()//
sqrt(16)
4
#########sqrt(x)函数
drop procedure if exists pro1//
create procedure pro1()
BEGIN
select sqrt(10);
END//
CALL pro1()//
sqrt(10)
3.1622776601683795
#########TRUNC(x)函数    mysql不支持不支持
drop procedure if exists pro1//
create procedure pro1()
BEGIN
select trunc(15.79,-1) from dual;
END//
CALL pro1()//
ERROR 42000: FUNCTION trunc does not exist
########数据类型转换        标签 float/double 1-5
#######隐式数据类型转换     标签float/double 1-5-1
#######insert      double类型转换char类型
drop table if exists t1//
CREATE TABLE t1(a_double double(20,2))//
drop procedure if exists pro1//
create procedure pro1()
BEGIN
declare a char(20);
set a = 'aa';
insert into t1 values(a);
END//
CALL pro1()//
ERROR 01000: Data truncated for column 'a_double' at row 1
select * from t1//
a_double
#######insert      double类型转换INT类型
drop table if exists t1//
CREATE TABLE t1(a_double double(20,2))//
drop procedure if exists pro1//
create procedure pro1()
BEGIN
declare a INT(20);
set a = 22;
insert into t1 values(a);
END//
CALL pro1()//
select * from t1//
a_double
22.00
#######insert      double类型转换double类型
drop table if exists t1//
CREATE TABLE t1(a_double double(20,2))//
drop procedure if exists pro1//
create procedure pro1()
BEGIN
declare a double(20,3);
set a = 22.222;
insert into t1 values(a);
END//
CALL pro1()//
select * from t1//
a_double
22.22
########update     转换char类型
drop table if exists t1//
CREATE TABLE t1(id INT,a_double double(20,2))//
insert into t1 values(1,22.53)//
drop procedure if exists pro1//
create procedure pro1()
BEGIN
declare a char(20);
set a = 'aaaa';
update t1 set a_double = a where id = 1;	
END//
CALL pro1()//
ERROR 01000: Data truncated for column 'a_double' at row 1
select * from t1//
id	a_double
1	22.53
########update    转换int类型
drop table if exists t1//
CREATE TABLE t1(id INT,a_double double(20,2))//
insert into t1 values(1,22.53)//
drop procedure if exists pro1//
create procedure pro1()
BEGIN
declare a INT;
set a = 20;
update t1 set a_double = a where id = 1;
END//
CALL pro1()//
select * from t1//
id	a_double
1	20.00
########update    转换double类型
drop table if exists t1//
CREATE TABLE t1(id INT,a_double double(20,2))//
insert into t1 values(1,22.53)//
drop procedure if exists pro1//
create procedure pro1()
BEGIN
declare a double(10,3);
set a = 20.222;
update t1 set a_double = a where id = 1;
END//
CALL pro1()//
select * from t1//
id	a_double
1	20.22
########select操作，与字符串类型比较
drop table if exists t1//
CREATE TABLE t1(id INT,a_double double(20,2))//
insert into t1 values(1,22.53)//
insert into t1 values(2,19.53)//
insert into t1 values(3,10.53)//
insert into t1 values(4,15.53)//
drop procedure if exists pro1//
create procedure pro1()
BEGIN
declare a char(20);
set a = 20;
select  * from t1 where a_double < a;
END//
CALL pro1()//
id	a_double
2	19.53
3	10.53
4	15.53
#####调用方法时与定义的变量不同类型
drop table if exists t1//
CREATE TABLE t1(id INT,a_double double(20,2))//
insert into t1 values(1,22.53)//
insert into t1 values(2,19.53)//
insert into t1 values(3,10.53)//
insert into t1 values(4,15.53)//
drop procedure if exists pro1//
create procedure pro1()
BEGIN
declare p_double char(20);
set p_double = 20;
select  * from t1 where a_double < p_double;
END//
CALL pro1()//
id	a_double
2	19.53
3	10.53
4	15.53
#####直接赋值   数字
drop table if exists t1//
CREATE TABLE t1(id INT,a_double double(20,2))//
drop procedure if exists pro1//
create procedure pro1()
BEGIN
declare a_double double(20,2);
declare p_char char(20);
set a_double = 20;
set p_char = 50;
insert into t1 values(1,a_double);
set a_double = p_char;
insert into t1 values(2,a_double);
END//
CALL pro1()//
select * from t1//
id	a_double
1	20.00
2	50.00
#####直接赋值   字符串         ob传入null值，mysql创建存储成功，调用失败
drop table if exists t1//
CREATE TABLE t1(id INT,a_double double(20,2))//
drop procedure if exists pro1//
create procedure pro1()
BEGIN
declare a_double double(20,2);
declare p_char char(20);
set a_double = 20;
set p_char = 'aa';
insert into t1 values(1,a_double);
set a_double = p_char;
insert into t1 values(2,a_double);
END//
CALL pro1()//
select * from t1//
id	a_double
1	20.00
2	NULL
#####算术运算 
drop table if exists t1//
CREATE TABLE t1(id INT,a_double double(20,2))//
drop procedure if exists pro1//
create procedure pro1()
BEGIN
declare p_char char(20);
set p_char = 20;
insert into t1 values(1,1+p_char);
END//
CALL pro1()//
select * from t1//
id	a_double
1	21.00
#####显式数据类型转换to_char       标签 float/double 1-5-2
drop table if exists t1//
CREATE TABLE t1(id INT,a_double double(20,2))//
drop procedure if exists pro1//
create procedure pro1()
BEGIN
declare p_char double(20,3);
set p_char = 20.22;
select to_char(p_char) from dual;
END//
CALL pro1()//
to_char(p_char)
20.22
#####显式数据类型转换cast    char类型转double类型
drop procedure if exists pro1//
create procedure pro1()
BEGIN
declare p_char char(20);
set p_char = 20.22;
select cast(p_char as double(10,1));
END//
ERROR 42000: You have an error in your SQL syntax; check the manual that corresponds to your OceanBase version for the right syntax to use near 'select cast(p_char as double(10,1))' at line 5
CALL pro1()//
ERROR 42000: procedure zh_db.pro1 does not exist
#####显式数据类型转换cast    double类型转char类型
drop procedure if exists pro1//
create procedure pro1()
BEGIN
declare p_double double(20,2);
set p_double = 20.22;
select cast(p_double as char(20));
END//
CALL pro1()//
cast(p_double as char(20))
20.22
#####显式数据类型转换cast    double类型转char类型
drop procedure if exists pro1//
create procedure pro1()
BEGIN
declare p_double double(20,2);
set p_double = 20.22;
select cast(p_double as INT);
END//
ERROR 42000: You have an error in your SQL syntax; check the manual that corresponds to your OceanBase version for the right syntax to use near 'select cast(p_double as INT)' at line 5
CALL pro1()//
ERROR 42000: procedure zh_db.pro1 does not exist
# 清理测试用户
drop user 'funkzz';
