#Environmental cleaning
drop user longpy@'%';
create user longpy identified by 'longpy';
grant all on *.* to longpy WITH GRANT OPTION;
obmysql-cast-5
obmysql-cast-5-1
drop table cast_table2;
drop table cast_table;
drop view cast_view;
create table cast_table(id int, order_id double, name varchar(40),date_time datetime);
insert into cast_table values(10,15.59,'kebi','2020-05-01 12:01:35'),(15,14.29,'maidi','2020-05-17 18:02:30'),(29,12.32,'yaoming','2020-05-23 23:59:59');
create table cast_table2(id int, sal double, order_number varchar(40),date_time datetime);
insert into cast_table2 values(10,3000.265 ,'10','2020-05-01 12:01:35'),(15,2100.25,'15.29','2020-05-17 18:02:30'),(29,1500.69,'12.32','2020-05-23 23:59:59');
select cast(e.order_id as char(4)) a,cast(e.name as char(4)) b from cast_table e;
a	b
15.5	kebi
14.2	maid
12.3	yaom
select p.a,p.b from (select cast(e.order_id as char(4)) a,cast(e.name as char(4)) b from cast_table e ) p ;
a	b
15.5	kebi
14.2	maid
12.3	yaom
select e.id,e.name,cast(p.sal as signed),p.date_time from cast_table e left join cast_table2 p on cast(p.order_number as signed) = e.id order by 1 desc;
id	name	cast(p.sal as signed)	date_time
29	yaoming	NULL	NULL
15	maidi	2100	2020-05-17 18:02:30
10	kebi	3000	2020-05-01 12:01:35
Warnings:
Warning	1292	Truncated incorrect INTEGER value: '15.29'
Warning	1292	Truncated incorrect INTEGER value: '12.32'
select e.id,e.name,cast(p.sal as signed),p.date_time from cast_table e right join cast_table2 p on cast(p.order_number as signed) = e.id order by 1 desc;
id	name	cast(p.sal as signed)	date_time
15	maidi	2100	2020-05-17 18:02:30
10	kebi	3000	2020-05-01 12:01:35
NULL	NULL	1501	2020-05-23 23:59:59
Warnings:
Warning	1292	Truncated incorrect INTEGER value: '15.29'
Warning	1292	Truncated incorrect INTEGER value: '12.32'
select e.id,e.name,cast(p.sal as signed),p.date_time from cast_table e inner join cast_table2 p on cast(p.order_number as signed) = e.id order by 1 desc;
id	name	cast(p.sal as signed)	date_time
15	maidi	2100	2020-05-17 18:02:30
10	kebi	3000	2020-05-01 12:01:35
Warnings:
Warning	1292	Truncated incorrect INTEGER value: '15.29'
Warning	1292	Truncated incorrect INTEGER value: '12.32'
select cast(e.order_id as char(4)) a,cast(e.name as char(4)) 姓名 from cast_table e;
a	姓名
15.5	kebi
14.2	maid
12.3	yaom
select cast(e.name as char(4)) collate utf8mb4_general_ci as 姓名 from cast_table e;
姓名
kebi
maid
yaom
select cast(e.name as char(4)) collate utf8mb4_general_ci  姓名 from cast_table e;
姓名
kebi
maid
yaom
select e.id,e.name from cast_table e where exists(select * from cast_table2 p where cast(p.order_number as signed) = e.id ) order by 1 desc;
id	name
15	maidi
10	kebi
Warnings:
Warning	1292	Truncated incorrect INTEGER value: '15.29'
Warning	1292	Truncated incorrect INTEGER value: '12.32'
select e.id,e.name from cast_table e where not exists(select * from cast_table2 p where cast(p.order_number as signed) = e.id ) order by 1 desc;
id	name
29	yaoming
Warnings:
Warning	1292	Truncated incorrect INTEGER value: '15.29'
Warning	1292	Truncated incorrect INTEGER value: '12.32'
select e.id,e.name from cast_table e where exists(select * from cast_table2 p where p.order_number = cast(e.id as char(20))) order by 1 desc;
id	name
10	kebi
select e.id,e.name from cast_table e where not exists(select * from cast_table2 p where p.order_number = cast(e.id as char(20)))order by 1 desc;
id	name
29	yaoming
15	maidi
select e.id,e.name from cast_table e where e.id > any(select avg(cast(p.order_number as signed )) from cast_table2 p);
id	name
15	maidi
29	yaoming
Warnings:
Warning	1292	Truncated incorrect INTEGER value: '15.29'
Warning	1292	Truncated incorrect INTEGER value: '12.32'
select e.id,e.name from cast_table e where e.id < any(select avg(cast(p.order_number as signed )) from cast_table2 p );
id	name
10	kebi
Warnings:
Warning	1292	Truncated incorrect INTEGER value: '15.29'
Warning	1292	Truncated incorrect INTEGER value: '12.32'
select e.id,e.name from cast_table e where e.id = any(select cast(p.order_number as signed ) from cast_table2 p );
id	name
10	kebi
15	maidi
Warnings:
Warning	1292	Truncated incorrect INTEGER value: '15.29'
Warning	1292	Truncated incorrect INTEGER value: '12.32'
select e.id,e.name from cast_table e where e.id > all(select cast(p.order_number as signed ) from cast_table2 p where p.id = 29);
id	name
15	maidi
29	yaoming
Warnings:
Warning	1292	Truncated incorrect INTEGER value: '12.32'
select e.id,e.name from cast_table e where e.id < all(select cast(p.order_number as signed ) from cast_table2 p where p.id = 29);
id	name
10	kebi
Warnings:
Warning	1292	Truncated incorrect INTEGER value: '12.32'
select e.id,e.name from cast_table e where e.id = all(select cast(p.order_number as signed ) from cast_table2 p where p.id = 10);
id	name
10	kebi
select *  from cast_table a  where cast(a.order_id as char(20)) like '%5%';
id	order_id	name	date_time
10	15.59	kebi	2020-05-01 12:01:35
select cast(a.name as  char(10))  from cast_table a where name like '%k%';
cast(a.name as  char(10))
kebi
select cast(e.sal as signed) aab from cast_table2 e;
aab
3000
2100
1501
select cast(e.sal as signed) aab工资 from cast_table2 e;
aab工资
3000
2100
1501
select e.id,e.sal from cast_table2 e where cast(e.sal as signed) > 2000 order by e.id;
id	sal
10	3000.265
15	2100.25
select e.id,e.sal from cast_table2 e where cast(e.sal as signed) > 2000  and cast(e.sal as signed) < 3000 order by e.id;
id	sal
15	2100.25
select e.id,e.sal from cast_table2 e where cast(e.sal as signed) > 2000  or cast(e.order_number as signed) > 15 order by e.id;
id	sal
10	3000.265
15	2100.25
Warnings:
Warning	1292	Truncated incorrect INTEGER value: '12.32'
select cast(e.sal as signed) from cast_table2 e where e.id>20 order by e.id desc;
cast(e.sal as signed)
1501
select e.id,e.name,p.sal from cast_table e left join cast_table2 p on e.id = p.id where cast(p.sal as signed) > 2000 order by cast(p.sal as signed) limit 2;
id	name	sal
15	maidi	2100.25
10	kebi	3000.265
select e.id,e.name,p.sal from cast_table e left join cast_table2 p on e.id = p.id where cast(p.sal as signed) > 2000 order by cast(p.sal as signed)desc limit 2;
id	name	sal
10	kebi	3000.265
15	maidi	2100.25
select e.id,sum(e.sal) from cast_table2 e where e.sal > 2000 group by 1 order by 1 desc;
id	sum(e.sal)
15	2100.25
10	3000.265
select e.id,sum(e.sal) from cast_table2 e where e.sal > 1000 group by 1 having sum(e.sal) > 2000 order by 1 desc;
id	sum(e.sal)
15	2100.25
10	3000.265
select e.id 编号,case when cast(e.sal as signed) < 2000 then '低' when cast(e.sal as signed) < 3000 then '一般' else '高' end '工资' from cast_table2 e ;
编号	工资
10	高
15	一般
29	低
select e.id 编号,case cast(e.sal as signed)  when  1501 then '低' when 2100 then '一般' else '高' end '工资' from cast_table2 e;
编号	工资
10	高
15	一般
29	低
insert into cast_table select *  from cast_table2 p where cast(p.sal as signed)  = 3000;
select *  from cast_table;
id	order_id	name	date_time
10	15.59	kebi	2020-05-01 12:01:35
15	14.29	maidi	2020-05-17 18:02:30
29	12.32	yaoming	2020-05-23 23:59:59
10	3000.265	10	2020-05-01 12:01:35
insert into cast_table select *  from cast_table2 p where cast(p.order_number as signed)  = 10;
select *  from cast_table;
id	order_id	name	date_time
10	15.59	kebi	2020-05-01 12:01:35
15	14.29	maidi	2020-05-17 18:02:30
29	12.32	yaoming	2020-05-23 23:59:59
10	3000.265	10	2020-05-01 12:01:35
update cast_table set name = 'zanms' where cast(order_id as signed) = 3000;
select *  from cast_table where name = 'zanms';
id	order_id	name	date_time
10	3000.265	zanms	2020-05-01 12:01:35
delete from cast_table2 where cast(sal as signed) = 3000 ;
select cast(sal as signed) from cast_table2;
cast(sal as signed)
2100
1501
create view cast_view as select e.id,e.name,p.sal,p.date_time from cast_table e left join cast_table2 p on e.id = p.id order by e.id desc;
select *  from cast_view;
id	name	sal	date_time
29	yaoming	1500.69	2020-05-23 23:59:59
15	maidi	2100.25	2020-05-17 18:02:30
10	zanms	NULL	NULL
10	kebi	NULL	NULL
select cast(e.sal as char(4)) a,cast(e.name as char(3)) b from cast_view e;
a	b
1500	yao
2100	mai
NULL	keb
NULL	zan
select p.a,p.b from (select cast(e.sal as char(4)) a,cast(e.name as char(4)) b from cast_view e ) p ;
a	b
1500	yaom
2100	maid
NULL	kebi
NULL	zanm
select e.id,e.name,cast(p.sal as signed),p.date_time from cast_view e left join cast_table2 p on cast(p.order_number as signed) = e.id order by 1 desc;
id	name	cast(p.sal as signed)	date_time
29	yaoming	NULL	NULL
15	maidi	2100	2020-05-17 18:02:30
10	zanms	NULL	NULL
10	kebi	NULL	NULL
Warnings:
Warning	1292	Truncated incorrect INTEGER value: '15.29'
Warning	1292	Truncated incorrect INTEGER value: '12.32'
select e.id,e.name,cast(p.sal as signed),p.date_time from cast_view e right join cast_table2 p on cast(p.order_number as signed) = e.id order by 1 desc;
id	name	cast(p.sal as signed)	date_time
15	maidi	2100	2020-05-17 18:02:30
NULL	NULL	1501	2020-05-23 23:59:59
Warnings:
Warning	1292	Truncated incorrect INTEGER value: '15.29'
Warning	1292	Truncated incorrect INTEGER value: '12.32'
select e.id,e.name,cast(p.sal as signed),p.date_time from cast_view e inner join cast_table2 p on cast(p.order_number as signed) = e.id order by 1 desc;
id	name	cast(p.sal as signed)	date_time
15	maidi	2100	2020-05-17 18:02:30
Warnings:
Warning	1292	Truncated incorrect INTEGER value: '15.29'
Warning	1292	Truncated incorrect INTEGER value: '12.32'
select cast(e.name as char(4)) a,cast(e.sal as char(4)) 姓名 from cast_view e;
a	姓名
yaom	1500
maid	2100
kebi	NULL
zanm	NULL
select cast(e.date_time as char(4)) collate utf8mb4_general_ci as 时间 from cast_view e;
时间
2020
2020
NULL
NULL
select cast(e.date_time as char(4)) collate utf8mb4_general_ci  时间 from cast_view e;
时间
2020
2020
NULL
NULL
select e.id,e.name from cast_table e where exists(select * from cast_view p where cast(p.id as signed) = e.id ) order by 1 desc;
id	name
29	yaoming
15	maidi
10	kebi
10	zanms
select e.id,e.name from cast_table e where not exists(select * from cast_view p where cast(p.id as signed) = e.order_id ) order by 1 desc;
id	name
29	yaoming
15	maidi
10	kebi
10	zanms
select e.id,e.name from cast_table e where exists(select * from cast_view p where p.id = cast(e.id as char(20))) order by 1 desc;
id	name
29	yaoming
15	maidi
10	kebi
10	zanms
select e.id,e.name from cast_table e where not exists(select * from cast_view p where p.id = cast(e.order_id as char(20)))order by 1 desc;
id	name
29	yaoming
15	maidi
10	kebi
10	zanms
select e.id,e.name from cast_table e where e.order_id > any(select cast(p.id as signed ) from cast_view p);
id	name
10	kebi
15	maidi
29	yaoming
10	zanms
select e.id,e.name from cast_table e where e.order_id < any(select cast(p.id as signed ) from cast_view p);
id	name
10	kebi
15	maidi
29	yaoming
select e.id,e.name from cast_table e where e.id = any(select cast(p.id as signed ) from cast_view p);
id	name
10	kebi
15	maidi
29	yaoming
10	zanms
select e.id,e.order_number from cast_table2 e where e.sal > all(select cast(p.sal as signed ) from cast_view p where p.id = 29);
id	order_number
15	15.29
select e.id,e.order_number from cast_table2 e where e.sal < all(select cast(p.sal as signed ) from cast_view p where p.id = 29);
id	order_number
29	12.32
select e.id,e.order_number from cast_table2 e where cast(e.sal as signed) = all(select cast(p.sal as signed ) from cast_view p where p.id = 10);
id	order_number
select *  from cast_view a  where cast(a.name as char(20)) like '%m%';
id	name	sal	date_time
29	yaoming	1500.69	2020-05-23 23:59:59
15	maidi	2100.25	2020-05-17 18:02:30
10	zanms	NULL	NULL
select cast(a.name as char(10))  from cast_view a where name like '%k%';
cast(a.name as char(10))
kebi
select cast(e.sal as signed) aab from cast_view e;
aab
1501
2100
NULL
NULL
select cast(e.sal as signed) aab工资 from cast_view e;
aab工资
1501
2100
NULL
NULL
select e.id,e.sal from cast_view e where cast(e.sal as signed) > 2000 order by e.id;
id	sal
15	2100.25
select e.id,e.sal from cast_view e where cast(e.sal as signed) > 2000  and cast(e.sal as signed) < 3000 order by e.id;
id	sal
15	2100.25
select e.id,e.sal from cast_view e where cast(e.sal as signed) > 2000  or cast(e.id as signed) > 15 order by e.id;
id	sal
15	2100.25
29	1500.69
select cast(e.sal as signed) from cast_view e where e.id>20 order by e.id desc;
cast(e.sal as signed)
1501
select e.id,e.name,p.sal from cast_table e left join cast_view p on e.id = p.id where cast(p.sal as signed) > 2000 order by cast(p.sal as signed) limit 2;
id	name	sal
15	maidi	2100.25
select e.id,e.name,p.sal from cast_table e left join cast_view p on e.id = p.id where cast(p.sal as signed) > 2000 order by cast(p.sal as signed)desc limit 2;
id	name	sal
15	maidi	2100.25
select e.id,sum(e.sal) from cast_view e where e.sal > 2000 group by 1 order by 1 desc;
id	sum(e.sal)
15	2100.25
select e.id,sum(e.sal) from cast_view e where e.sal > 1000 group by 1 having sum(e.sal) > 2000 order by 1 desc;
id	sum(e.sal)
15	2100.25
select e.id 编号,case when cast(e.sal as signed) < 2000 then '低' when cast(e.sal as signed) < 3000 then '一般' else '高' end '工资' from cast_view e ;
编号	工资
29	低
15	一般
10	高
10	高
select e.id 编号,case cast(e.sal as signed)  when  1501 then '低' when 2100 then '一般' else '高' end '工资' from cast_view e;
编号	工资
29	低
15	一般
10	高
10	高
drop table cast_table;
drop table cast_table2;
drop view cast_view;
create or replace  view v2 as select cast(1 as char(512)) from dual;
desc v2;
Field	Type	Null	Key	Default	Extra
cast(1 as char(512))	varchar(512)	NO			
create or replace  view v2 as select cast(1 as char(513)) from dual;
desc v2;
Field	Type	Null	Key	Default	Extra
cast(1 as char(513))	text	NO			
create or replace  view v2 as select cast(1 as char(16383)) from dual;
desc v2;
Field	Type	Null	Key	Default	Extra
cast(1 as char(16383))	text	NO			
create or replace  view v2 as select cast(1 as char(16384)) from dual;
desc v2;
Field	Type	Null	Key	Default	Extra
cast(1 as char(16384))	mediumtext	NO			
create or replace  view v2 as select cast(1 as char(4194303)) from dual;
desc v2;
Field	Type	Null	Key	Default	Extra
cast(1 as char(4194303))	mediumtext	NO			
create or replace  view v2 as select cast(1 as char(4194304)) from dual;
desc v2;
Field	Type	Null	Key	Default	Extra
cast(1 as char(4194304))	longtext	NO			
drop view v2;
# Clean up users
drop user longpy@'%' ;
