#Environmental cleaning
drop user longpy@'%';
create user longpy identified by 'longpy';
grant all on *.* to longpy WITH GRANT OPTION;
drop table cast_table;
create table cast_table(id int, sal double, name varchar(40),date_time datetime);
insert into cast_table values(10,3000.265 ,'kebi','2020-05-01 12:01:35'),(15,2100.25,'maidd','2020-05-17 18:02:30'),(29,1500.69,'yaoming','2020-05-23 23:59:59');
select e.id,e.name,cast(cast(e.sal as signed)as char(10)) from cast_table e order by e.id desc;
id	name	cast(cast(e.sal as signed)as char(10))
29	yaoming	1501
15	maidd	2100
10	kebi	3000
select e.id,e.name,cast(sum(e.sal) as signed) from cast_table e order by e.id desc;
id	name	cast(sum(e.sal) as signed)
10	kebi	6601
select e.id,e.name,sum(cast(e.sal as signed)) from cast_table e group by 1,2 having sum(cast(e.sal as signed)) > 2000 order by id desc;
id	name	sum(cast(e.sal as signed))
15	maidd	2100
10	kebi	3000
select e.id,e.name,cast(max(e.sal) as signed) from cast_table e order by e.id desc;
id	name	cast(max(e.sal) as signed)
10	kebi	3000
select e.id,e.name,max(cast(e.sal as signed)) from cast_table e group by 1,2 having sum(cast(e.sal as signed)) > 2000 order by id desc;
id	name	max(cast(e.sal as signed))
15	maidd	2100
10	kebi	3000
select e.id,e.name,cast(min(e.sal) as signed) from cast_table e order by e.id desc;
id	name	cast(min(e.sal) as signed)
10	kebi	1501
select e.id,e.name,min(cast(e.sal as signed)) from cast_table e group by 1,2 having sum(cast(e.sal as signed)) > 2000 order by id desc;
id	name	min(cast(e.sal as signed))
15	maidd	2100
10	kebi	3000
select e.id,e.name,cast(avg(e.sal) as signed) from cast_table e order by e.id desc;
id	name	cast(avg(e.sal) as signed)
10	kebi	2200
select e.id,e.name,avg(cast(e.sal as signed)) from cast_table e group by 1,2 having avg(cast(e.sal as signed)) > 2000 order by id desc;
id	name	avg(cast(e.sal as signed))
15	maidd	2100.0000
10	kebi	3000.0000
select e.id,e.name,cast(abs(e.sal) as signed) from cast_table e order by e.id desc;
id	name	cast(abs(e.sal) as signed)
29	yaoming	1501
15	maidd	2100
10	kebi	3000
select e.id,e.name,abs(cast(e.sal as signed)) from cast_table e group by 1,2  order by id desc limit 2;
id	name	abs(cast(e.sal as signed))
29	yaoming	1501
15	maidd	2100
select e.id,e.name,cast(ceil(e.sal) as signed) from cast_table e order by e.id desc;
id	name	cast(ceil(e.sal) as signed)
29	yaoming	1501
15	maidd	2101
10	kebi	3001
select e.id,e.name,ceil(cast(e.sal as signed)) from cast_table e group by 1,2  order by id desc limit 2;
id	name	ceil(cast(e.sal as signed))
29	yaoming	1501
15	maidd	2100
select e.id,e.name,cast(floor(e.sal) as signed) from cast_table e order by e.id desc;
id	name	cast(floor(e.sal) as signed)
29	yaoming	1500
15	maidd	2100
10	kebi	3000
select e.id,e.name,floor(cast(e.sal as signed)) from cast_table e group by 1,2  order by id desc limit 2;
id	name	floor(cast(e.sal as signed))
29	yaoming	1501
15	maidd	2100
select e.id,e.name,cast(mod(e.sal,7.8) as signed) from cast_table e order by e.id desc;
id	name	cast(mod(e.sal,7.8) as signed)
29	yaoming	3
15	maidd	2
10	kebi	5
select e.id,e.name,mod(cast(e.sal as signed),7.8) from cast_table e group by 1,2  order by id desc;
id	name	mod(cast(e.sal as signed),7.8)
29	yaoming	3.4
15	maidd	1.8
10	kebi	4.8
select e.id,e.name,cast(length(e.sal) as char(10)) from cast_table e order by e.id desc;
id	name	cast(length(e.sal) as char(10))
29	yaoming	7
15	maidd	7
10	kebi	8
select e.id,e.name,length(cast(e.sal as char(10))) from cast_table e group by 1,2  order by id desc;
id	name	length(cast(e.sal as char(10)))
29	yaoming	7
15	maidd	7
10	kebi	8
select e.id,instr(cast(e.name as char(4)),'i'),e.sal from cast_table e order by id desc;
id	instr(cast(e.name as char(4)),'i')	sal
29	0	1500.69
15	3	2100.25
10	4	3000.265
select e.id,cast(instr(e.name,'i') as char(4)),e.sal from cast_table e order by id desc;
id	cast(instr(e.name,'i') as char(4))	sal
29	5	1500.69
15	3	2100.25
10	4	3000.265
select e.id,e.name,cast(e.sal as signed)+100 from cast_table e ;
id	name	cast(e.sal as signed)+100
10	kebi	3100
15	maidd	2200
29	yaoming	1601
select e.id,e.name,cast(e.sal as signed)-100 from cast_table e ;
id	name	cast(e.sal as signed)-100
10	kebi	2900
15	maidd	2000
29	yaoming	1401
select e.id,e.name,cast(e.sal as signed)*100 from cast_table e ;
id	name	cast(e.sal as signed)*100
10	kebi	300000
15	maidd	210000
29	yaoming	150100
select e.id,e.name,cast(e.sal as signed)/100 from cast_table e ;
id	name	cast(e.sal as signed)/100
10	kebi	30.0000
15	maidd	21.0000
29	yaoming	15.0100
select e.id,e.name,e.sal from cast_table e where cast(e.sal as signed) > 1500 and cast(e.sal as signed) < 3000;
id	name	sal
15	maidd	2100.25
29	yaoming	1500.69
select e.id,e.name,e.sal from cast_table e where cast(e.sal as signed) > 2000 or e.id >20;
id	name	sal
10	kebi	3000.265
15	maidd	2100.25
29	yaoming	1500.69
select e.id,e.name,e.sal from cast_table e where not(cast(e.sal as signed)) < 1500;
id	name	sal
10	kebi	3000.265
15	maidd	2100.25
29	yaoming	1500.69
select e.id,e.name,e.sal from cast_table e where not(cast(e.sal as signed)) > 2000;
id	name	sal
29	yaoming	1500.69
select e.id,e.name,e.sal from cast_table e where cast(e.sal as signed) >= 2000;
id	name	sal
10	kebi	3000.265
15	maidd	2100.25
select e.id,e.name,e.sal from cast_table e where cast(e.sal as signed) <= 2000;
id	name	sal
29	yaoming	1500.69
select e.id,e.name,e.sal from cast_table e where cast(e.sal as signed)  = 1501;
id	name	sal
29	yaoming	1500.69
select e.id,e.name,e.sal from cast_table e where cast(e.sal as signed)  > 1501;
id	name	sal
10	kebi	3000.265
15	maidd	2100.25
select e.id,e.name,e.sal from cast_table e where cast(e.sal as signed)  < 1502;
id	name	sal
29	yaoming	1500.69
select e.id,e.name,e.sal from cast_table e where cast(e.sal as signed) <> 1501;
id	name	sal
10	kebi	3000.265
15	maidd	2100.25
select e.id,e.name,e.sal from cast_table e where cast(e.sal as signed) != 1501;
id	name	sal
10	kebi	3000.265
15	maidd	2100.25
create index cast_name on cast_table(id);
select cast(e.id as char(2)) from cast_table e;
cast(e.id as char(2))
10
15
29
select e.name,e.sal from cast_table e where cast(e.id as char(2)) = '10';
name	sal
kebi	3000.265
select e.name,e.sal from cast_table e where cast(e.id as char(2)) > '10' order by e.sal desc;
name	sal
maidd	2100.25
yaoming	1500.69
insert into cast_table  select * from cast_table e where cast(e.id as char(2)) = '10';
select * from cast_table;
id	sal	name	date_time
10	3000.265	kebi	2020-05-01 12:01:35
15	2100.25	maidd	2020-05-17 18:02:30
29	1500.69	yaoming	2020-05-23 23:59:59
10	3000.265	kebi	2020-05-01 12:01:35
update cast_table e set name = 'zanms' where cast(e.id as char(2)) = '10';
select * from cast_table;
id	sal	name	date_time
10	3000.265	zanms	2020-05-01 12:01:35
15	2100.25	maidd	2020-05-17 18:02:30
29	1500.69	yaoming	2020-05-23 23:59:59
10	3000.265	zanms	2020-05-01 12:01:35
delete from cast_table  where cast(id as char(2)) = '10' ;
select * from cast_table;
id	sal	name	date_time
15	2100.25	maidd	2020-05-17 18:02:30
29	1500.69	yaoming	2020-05-23 23:59:59
drop table cast_table;
create table cast_table(id int primary key, sal double unique, name varchar(40) not null,date_time datetime);
insert into cast_table values(10,3000.265 ,'kebi','2020-05-01 12:01:35'),(15,2100.25,'maidd','2020-05-17 18:02:30'),(29,1500.69,'yaoming','2020-05-23 23:59:59');
select cast(id as char(20)),cast(sal as signed),cast(name as char(20)) from cast_table;
cast(id as char(20))	cast(sal as signed)	cast(name as char(20))
10	3000	kebi
15	2100	maidd
29	1501	yaoming
select cast(id as char(20)),cast(sal as signed),cast(name as char(20)) from cast_table where cast(sal as signed) = 3000;
cast(id as char(20))	cast(sal as signed)	cast(name as char(20))
10	3000	kebi
select cast(id as char(20)),cast(sal as signed),cast(name as char(20)) from cast_table where cast(sal as signed) = 3000 order by id;
cast(id as char(20))	cast(sal as signed)	cast(name as char(20))
10	3000	kebi
insert into cast_table  select cast(id+1 as signed)id,cast(e.sal as signed),cast(e.name as char(20)),e.date_time from cast_table e where cast(e.sal as signed) = 3000 ;
select count(*) from cast_table;
count(*)
4
update cast_table  set name = 'zanms' where cast(sal as signed) = 3000;
select * from cast_table;
id	sal	name	date_time
10	3000.265	zanms	2020-05-01 12:01:35
11	3000	zanms	2020-05-01 12:01:35
15	2100.25	maidd	2020-05-17 18:02:30
29	1500.69	yaoming	2020-05-23 23:59:59
delete from cast_table  where cast(sal as signed) = 3000 ;
select count(*) from cast_table;
count(*)
2
drop table cast_table;
# Clean up users
drop user longpy@'%' ;
