#Environmental cleaning
drop user hal@'%';
create user hal identified by 'hal';
grant all on *.* to hal WITH GRANT OPTION;
# 索引 values-6
# 普通索引
drop table hal;
create table hal(
id int(10),
num1 int(10),
num2 int(10)
);
insert into hal(id,num1,num2) values(1,100,2020),(2,11,2300),(3,1111,2800);
select * from hal;
id	num1	num2
1	100	2020
2	11	2300
3	1111	2800
drop index hal_index on hal;
create index hal_index on hal(id);
select * from hal where id >0;
id	num1	num2
1	100	2020
2	11	2300
3	1111	2800
values row((select id from hal where id = 1));
column_0
1
select * from (
values row((select id from hal where id = 2))
)as c1;
column_0
2
# 普唯一索引
drop table hal;
create table hal(
id int(10),
num1 int(10),
num2 int(10)
);
insert into hal(id,num1,num2) values(1,100,2020),(2,11,2300),(3,1111,2800);
select * from hal;
id	num1	num2
1	100	2020
2	11	2300
3	1111	2800
drop index hal_index on hal;
create unique index hal_index on hal(num1);
select * from hal where num1 is not null;
id	num1	num2
1	100	2020
2	11	2300
3	1111	2800
values row((select id from hal where num1 = 100));
column_0
1
select * from (
values row((select id from hal where num1 = 11))
)as c1;
column_0
2
# 主键索引
drop table hal;
create table hal(
id int(10) PRIMARY KEY,
num1 int(10),
num2 int(10)
);
insert into hal(id,num1,num2) values(1,100,2020),(2,11,2300),(3,1111,2800);
select * from hal where id > 0;
id	num1	num2
1	100	2020
2	11	2300
3	1111	2800
drop index hal_index on hal;
create unique index hal_index on hal(id);
select * from hal where id> 0;
id	num1	num2
1	100	2020
2	11	2300
3	1111	2800
values row((select id from hal where id = 1));
column_0
1
select * from (
values row((select id from hal where id = 2))
)as c1;
column_0
2
# 复合索引
drop table hal;
create table hal(
id int(10) PRIMARY KEY,
num1 int(10),
num2 int(10)
);
insert into hal(id,num1,num2) values(1,100,2020),(2,11,2300),(3,1111,2800);
select * from hal where id > 0;
id	num1	num2
1	100	2020
2	11	2300
3	1111	2800
drop index hal_index on hal;
create unique index hal_index on hal(id,num1);
select * from hal where id> 0 and num1 is not null;
id	num1	num2
1	100	2020
2	11	2300
3	1111	2800
values row((select id from hal where id = 1));
column_0
1
values row((select id from hal where num1 = 100));
column_0
1
select * from (
values row((select id from hal where id = 2))
)as c1;
column_0
2
select * from (
values row((select id from hal where num2 = 1111))
)as c1;
column_0
NULL
# 排序索引
drop table hal;
create table hal(
id int(10) PRIMARY KEY,
num1 int(10),
num2 int(10)
);
insert into hal(id,num1,num2) values(1,100,2020),(2,11,2300),(3,1111,2800);
select * from hal where id > 0;
id	num1	num2
1	100	2020
2	11	2300
3	1111	2800
drop index hal_index on hal;
create unique index hal_index on hal(id asc);
select * from hal where id> 0 and num1 is not null;
id	num1	num2
1	100	2020
2	11	2300
3	1111	2800
values row((select id from hal where id = 1));
column_0
1
select * from (
values row((select id from hal where id = 2))
)as c1;
column_0
2
# 约束 values-7
# 主键
drop table hal;
create table hal(
id int(10) PRIMARY KEY,
num1 int(10),
num2 int(10)
);
insert into hal(id,num1,num2) values row(1,100,2020),row(2,11,2300),row(3,1111,2800);
insert into hal(id,num1,num2) values row(1,100,2020);
select * from hal where id > 0;
id	num1	num2
1	100	2020
2	11	2300
3	1111	2800
values row((select id from hal where id = 1));
column_0
1
select * from (
values row((select id from hal where id = 2))
)as c1;
column_0
2
# 非空
drop table hal;
create table hal(
id int(10) not null,
num1 int(10),
num2 int(10)
);
insert into hal(id,num1,num2) values row(1,100,2020),row(2,11,2300),row(3,1111,2800);
insert into hal(num1,num2) values row(100,2020);
select * from hal where id > 0;
id	num1	num2
1	100	2020
2	11	2300
3	1111	2800
values row((select id from hal where id = 1));
column_0
1
select * from (
values row((select id from hal where id = 2))
)as c1;
column_0
2
# 唯一
drop table hal;
create table hal(
id int(10) not null,
num1 int(10),
num2 int(10) unique
);
insert into hal(id,num1,num2) values row(1,100,2020),row(2,11,2300),row(3,1111,2800);
insert into hal(id,num1,num2) values row(4,11111,2020);
select * from hal where id > 0;
id	num1	num2
1	100	2020
2	11	2300
3	1111	2800
values row((select num2 from hal where num2 = 2020));
column_0
2020
select * from (
values row((select num2 from hal where num2 = 2020))
)as c1;
column_0
2020
# 范围check约束
drop table hal;
create table hal(
id int(10) not null,
num1 int(10),
num2 int(10),
CONSTRAINT num2_check CHECK (num2 >= 0 AND num2 <= 10000)
);
insert into hal(id,num1,num2) values row(1,100,2020),row(2,11,2300),row(3,1111,2800);
insert into hal(id,num1,num2) values row(4,11111,-100);
insert into hal(id,num1,num2) values row(5,11111,111110);
select * from hal where id > 0;
id	num1	num2
1	100	2020
2	11	2300
3	1111	2800
values row((select num2 from hal where num2 = 2020));
column_0
2020
select * from (
values row((select num2 from hal where num2 = 2020))
)as c1;
column_0
2020
# 外键约束
drop table hal;
drop table hal1;
create table hal1(
c_id int PRIMARY KEY,
username char(20)
);
insert into hal1 values row(1,'hal'),row(2,'haer'),row(3,'coco');
select * from hal1;
c_id	username
1	hal
2	haer
3	coco
CREATE TABLE hal(
v_id int,
num1 int,
num2 int,
CONSTRAINT fk_orders_customer_id FOREIGN KEY (v_id)
REFERENCES hal1 (c_id)
);
insert into hal(v_id,num1,num2) values row(1,100,2020),row(2,11,2300),row(3,1111,2800);
select * from hal;
v_id	num1	num2
1	100	2020
2	11	2300
3	1111	2800
insert into hal(id,num1,num2) values row(4,11111,-100);
insert into hal1(id,num1,num2) values row(4,'11111');
values row((select v_id from hal where v_id = 1));
column_0
1
select * from (
values row((select v_id from hal where v_id = 2))
)as c1;
column_0
2
values row((select c_id from hal1 where c_id = 1));
column_0
1
select * from (
values row((select c_id from hal1 where c_id = 2))
)as c1;
column_0
2
# default
drop table hal;
create table hal(
c_id int PRIMARY KEY,
username char(20) default 'aaaaaa'
);
insert into hal values row(1,'hal'),row(2,'haer'),row(3,'coco');
insert into hal(c_id) values row(4);
select * from hal;
c_id	username
1	hal
2	haer
3	coco
4	aaaaaa
values row((select username from hal1 where c_id = 1));
column_0
hal
select * from (
values row((select username from hal1 where c_id = 2))
)as c1;
column_0
haer
# 视图 values-8
# select
drop table hal;
create table hal(
c_id int PRIMARY KEY,
username char(20) default 'aaaaaa'
);
insert into hal values row(1,'hal'),row(2,'haer'),row(3,'coco');
select * from hal;
c_id	username
1	hal
2	haer
3	coco
drop view hal_view;
create view hal_view as (
select * from hal
);
select * from hal_view;
c_id	username
1	hal
2	haer
3	coco
insert into hal_view values row(4,'guy');
select * from hal_view;
c_id	username
1	hal
2	haer
3	coco
4	guy
select * from hal;
c_id	username
1	hal
2	haer
3	coco
4	guy
update hal_view set username='ggggg' where c_id = 4;
select * from hal_view;
c_id	username
1	hal
2	haer
3	coco
4	ggggg
select * from hal;
c_id	username
1	hal
2	haer
3	coco
4	ggggg
drop view hal1_view;
create view hal1_view as (
values row(1,2,3),
row(4,5,6)
);
select * from hal1_view;
column_0	column_1	column_2
1	2	3
4	5	6
select * from hal_view;
c_id	username
1	hal
2	haer
3	coco
4	ggggg
values row((select c_id from hal_view where c_id =1));
column_0
1
select * from (
values row((select c_id from hal where c_id =1))
)as c1;
column_0
1
# PL values-9
# PL 存储过程 values-9-1
# while
todo bugid:81079
drop procedure hal_procedure;
CREATE PROCEDURE hal_procedure()
BEGIN
DECLARE i INT DEFAULT 1;
WHILE i < 4
DO
values row(1,2,3);
SET i = i + 1;
END WHILE;
COMMIT;
END;
/
call hal_procedure;
todo bugid:81079
drop procedure hal_procedure;
CREATE PROCEDURE hal_procedure()
BEGIN
DECLARE i INT DEFAULT 1;
WHILE i < 4
DO
values row((select * from ((values row(2)))as c1));
SET i = i + 1;
END WHILE;
COMMIT;
END;
/
call hal_procedure;
drop procedure hal_procedure;
CREATE PROCEDURE hal_procedure()
BEGIN
DECLARE i INT DEFAULT 1;
WHILE i < 4
DO
select * from ((values row(1,2),row(11,22)))as c1;
SET i = i + 1;
END WHILE;
COMMIT;
END;
/
call hal_procedure;
column_0	column_1
column_0	column_1
column_0	column_1
1	2
11	22
1	2
11	22
1	2
11	22
# loop
todo bugid:81079
drop procedure hal_procedure;
CREATE PROCEDURE hal_procedure()
BEGIN
DECLARE i INT DEFAULT 1;
lp:loop
values row(1,2,3);
SET i = i + 1;
if i>3 then
leave lp;
end if;
end loop;
COMMIT;
END;
/
call hal_procedure;
todo bugid:81079
drop procedure hal_procedure;
CREATE PROCEDURE hal_procedure()
BEGIN
DECLARE i INT DEFAULT 1;
lp:loop
values row((select * from ((values row(2)))as c1));
SET i = i + 1;
if i>3 then
leave lp;
end if;
end loop;
COMMIT;
END;
/
call hal_procedure;
drop procedure hal_procedure;
CREATE PROCEDURE hal_procedure()
BEGIN
DECLARE i INT DEFAULT 1;
lp:loop
select * from ((values row(1,2),row(11,22)))as c1;
SET i = i + 1;
if i>3 then
leave lp;
end if;
end loop;
COMMIT;
END;
/
call hal_procedure;
column_0	column_1
column_0	column_1
column_0	column_1
1	2
11	22
1	2
11	22
1	2
11	22
# repeat
todo bugid:81079
drop procedure hal_procedure;
CREATE PROCEDURE hal_procedure()
BEGIN
DECLARE i INT DEFAULT 1;
repeat
values row(1,2,3);
SET i = i + 1;
until i>4
end repeat;
END;
/
call hal_procedure;
todo bugid:81079
drop procedure hal_procedure;
CREATE PROCEDURE hal_procedure()
BEGIN
DECLARE i INT DEFAULT 1;
repeat
values row((select * from ((values row(2)))as c1));
SET i = i + 1;
until i>4
end repeat;
END;
/
call hal_procedure;
drop procedure hal_procedure;
CREATE PROCEDURE hal_procedure()
BEGIN
DECLARE i INT DEFAULT 1;
repeat
select * from ((values row(1,2),row(11,22)))as c1;
SET i = i + 1;
until i>4
end repeat;
END;
/
call hal_procedure;
column_0	column_1
column_0	column_1
column_0	column_1
column_0	column_1
1	2
11	22
1	2
11	22
1	2
11	22
1	2
11	22
# 自定义函数values-9-2
# repeat
drop function hal_func;
CREATE FUNCTION hal_func()
RETURNS int DETERMINISTIC
BEGIN
RETURN (select * from ((values row(1,2),row(11,22)))as c1);
END;
/
select hal_func() from dual;
drop function hal_func;
CREATE FUNCTION hal_func()
RETURNS int DETERMINISTIC
BEGIN
RETURN (select * from ((values row(6)))as c1);
END;
/
select hal_func() from dual;
hal_func()
6
drop function hal_func;
CREATE FUNCTION hal_func()
RETURNS int DETERMINISTIC
BEGIN
RETURN (values row(1,2));
END;
/
select hal_func() from dual;
drop function hal_func;
CREATE FUNCTION hal_func()
RETURNS char(100) DETERMINISTIC
BEGIN
RETURN (values row('aaaaa'));
END;
/
select hal_func() from dual;
hal_func()
aaaaa
drop function hal_func;
CREATE FUNCTION hal_func()
RETURNS float DETERMINISTIC
BEGIN
RETURN (values row(100.11112));
END;
/
select hal_func() from dual;
hal_func()
100.111
drop function hal_func;
CREATE FUNCTION hal_func()
RETURNS double DETERMINISTIC
BEGIN
RETURN (values row(100.111120));
END;
/
select hal_func() from dual;
hal_func()
100.11112
# 触发器values-9-3
# insert
drop table hal;
create table hal(
id int,
num1 int,
num2 int
);
insert into hal values(1,111,2222);
select * from hal;
id	num1	num2
1	111	2222
drop table hal1;
create table hal1(
id int,
num1 int,
num2 int
);
insert into hal1 values(1,111,2222);
select * from hal1;
id	num1	num2
1	111	2222
DROP TRIGGER IF EXISTS hal_trigger;
Warnings:
Note	1360	Trigger does not exist
CREATE TRIGGER hal_trigger
AFTER insert ON hal1
FOR EACH ROW
BEGIN
insert into hal values row(2,666,888);
END;
/
insert into hal1 values(2,666,888);
select * from hal;
id	num1	num2
1	111	2222
2	666	888
select * from hal1;
id	num1	num2
1	111	2222
2	666	888
# update
drop table hal;
create table hal(
id int,
num1 int,
num2 int
);
insert into hal values(1,111,2222);
select * from hal;
id	num1	num2
1	111	2222
drop table hal1;
create table hal1(
id int,
num1 int,
num2 int
);
insert into hal1 values(1,111,2222);
select * from hal1;
id	num1	num2
1	111	2222
DROP TRIGGER IF EXISTS hal_trigger;
Warnings:
Note	1360	Trigger does not exist
CREATE TRIGGER hal_trigger
AFTER UPDATE ON hal1
FOR EACH ROW
BEGIN
UPDATE hal SET num1 = (values row(10086)) where id = 1;
END;
/
update hal1 set num1 = 10086 where id = 1;
select * from hal;
id	num1	num2
1	10086	2222
select * from hal1;
id	num1	num2
1	10086	2222
drop table hal;
create table hal(
id int,
num1 int,
num2 int
);
insert into hal values(1,111,2222);
select * from hal;
id	num1	num2
1	111	2222
drop table hal1;
create table hal1(
id int,
num1 int,
num2 int
);
insert into hal1 values(1,111,2222);
select * from hal1;
id	num1	num2
1	111	2222
DROP TRIGGER IF EXISTS hal_trigger;
Warnings:
Note	1360	Trigger does not exist
CREATE TRIGGER hal_trigger
AFTER UPDATE ON hal1
FOR EACH ROW
BEGIN
UPDATE hal SET num1 = (select * from ((values row(10086)))as c1) where id = 1;
END;
/
update hal1 set num1 = 10086 where id = 1;
select * from hal;
id	num1	num2
1	10086	2222
select * from hal1;
id	num1	num2
1	10086	2222
# delete
drop table hal;
create table hal(
id int,
num1 int,
num2 int
);
insert into hal values(1,111,2222),(2,111,2222);
select * from hal;
id	num1	num2
1	111	2222
2	111	2222
drop table hal1;
create table hal1(
id int,
num1 int,
num2 int
);
insert into hal1 values(1,111,2222),(2,111,2222);
select * from hal1;
id	num1	num2
1	111	2222
2	111	2222
DROP TRIGGER IF EXISTS hal_trigger;
Warnings:
Note	1360	Trigger does not exist
CREATE TRIGGER hal_trigger
AFTER delete ON hal1
FOR EACH ROW
BEGIN
delete from hal where id = values row(2);
END;
/
delete from hal1 where id = 2;
select * from hal;
id	num1	num2
1	111	2222
2	111	2222
select * from hal1;
id	num1	num2
1	111	2222
drop table hal;
create table hal(
id int,
num1 int,
num2 int
);
insert into hal values(1,111,2222),(2,111,2222);
select * from hal;
id	num1	num2
1	111	2222
2	111	2222
drop table hal1;
create table hal1(
id int,
num1 int,
num2 int
);
insert into hal1 values(1,111,2222),(2,111,2222);
select * from hal1;
id	num1	num2
1	111	2222
2	111	2222
DROP TRIGGER IF EXISTS hal_trigger;
Warnings:
Note	1360	Trigger does not exist
CREATE TRIGGER hal_trigger
AFTER delete ON hal1
FOR EACH ROW
BEGIN
delete from hal where id = (select * from (values row(2))as c1);
END;
/
delete from hal1 where id = 2;
select * from hal;
id	num1	num2
1	111	2222
select * from hal1;
id	num1	num2
1	111	2222
drop table hal;
create table hal(
id int,
num1 int,
num2 int
);
insert into hal values(1,111,2222),(2,111,2222);
select * from hal;
id	num1	num2
1	111	2222
2	111	2222
drop table hal1;
create table hal1(
id int,
num1 int,
num2 int
);
insert into hal1 values(1,111,2222),(2,111,2222);
select * from hal1;
id	num1	num2
1	111	2222
2	111	2222
DROP TRIGGER IF EXISTS hal_trigger;
Warnings:
Note	1360	Trigger does not exist
CREATE TRIGGER hal_trigger
AFTER delete ON hal1
FOR EACH ROW
BEGIN
delete from hal where id = (values row(2));
END;
/
delete from hal1 where id = 2;
select * from hal;
id	num1	num2
1	111	2222
select * from hal1;
id	num1	num2
1	111	2222
#########清空回收站,删除测试数据库,表等 ##########
drop user zcp@'%' ;
