#Environmental cleaning
drop user hal@'%';
create user hal identified by 'hal';
grant all on *.* to hal WITH GRANT OPTION;
# 表 values-3
# select values-3-1
# create as values
drop table hal;
create table hal as (select * from (values row(11,22)) as d);
select * from hal;
column_0	column_1
11	22
drop table hal;
create table hal as (
select * from (
values row(
convert('10086' , UNSIGNED INT),
convert('char' , char(10)),
convert(1001.22 , double)
)
)as c1
);
select * from hal;
column_0	column_1	column_2
10086	char	1001.22
drop table hal;
create table hal as (
select * from (
values row(
convert('10086' , UNSIGNED INT),
convert('char' , char(10))
)
)as c1
);
select * from hal;
column_0	column_1
10086	char
drop table hal;
create table hal as (
select * from (
values row(
convert('10086' , UNSIGNED INT)
)
)as c1
);
select * from hal;
column_0
10086
drop table hal;
create table hal as (
select * from (
values row(
convert('10086' , UNSIGNED INT),
convert('char' , char(10)),
convert(1001.22 , double)
),
row(
convert('10086' , UNSIGNED INT),
convert('char' , char(10)),
convert(1001.22 , double)
),
row(
convert('10086' , UNSIGNED INT),
convert('char' , char(10)),
convert(1001.22 , double)
)
)as c1
);
select * from hal;
column_0	column_1	column_2
10086	char	1001.22
10086	char	1001.22
10086	char	1001.22
select * from (
values row(
convert('10086' , UNSIGNED INT),
convert('char' , char(10)),
convert(1001.22 , double)
),
row(
convert('10086' , UNSIGNED INT),
convert('char' , char(10)),
convert(1001.22 , double)
),
row(
convert('10086' , UNSIGNED INT),
convert('char' , char(10)),
convert(1001.22 , double)
)
)as c1;
column_0	column_1	column_2
10086	char	1001.22
10086	char	1001.22
10086	char	1001.22
# 聚合函数
count(values row(100));
select count(column_0) from (values row(100,200),row(100,200),row(100,200))as c1;
count(column_0)
3
select count(column_0) from (select * from (values row(100,200),row(100,200),row(100,200))as c1)as c2;
count(column_0)
3
max(values row(100));
select max(column_0) from (values row(100,200),row(100,200),row(100,200))as c1;
max(column_0)
100
select max(column_0) from (select * from (values row(100,200),row(100,200),row(100,200))as c1)as c2;
max(column_0)
100
min(values row(100));
select min(column_0) from (values row(100,200),row(100,200),row(100,200))as c1;
min(column_0)
100
select min(column_0) from (select * from (values row(100,200),row(100,200),row(100,200))as c1)as c2;
min(column_0)
100
sum(values row(100));
select sum(column_0) from (values row(100,200),row(100,200),row(100,200))as c1;
sum(column_0)
300
select sum(column_0) from (select * from (values row(100,200),row(100,200),row(100,200))as c1)as c2;
sum(column_0)
300
avg(values row(100));
select avg(column_0) from (values row(100,200),row(100,200),row(100,200))as c1;
avg(column_0)
100.0000
select avg(column_0) from (select * from (values row(100,200),row(100,200),row(100,200))as c1)as c2;
avg(column_0)
100.0000
# where字句
values row(1,2,3) where column_0 > 1;
values row(1,2,3),row(10,20,30) where column_0 > 1;
select * from ((values row(1,2,3),row(10,20,30)))as c1 where column_0 >1;
column_0	column_1	column_2
10	20	30
values row(1,2,3) where column_0 = 1;
values row(1,2,3),row(10,20,30) where column_0 = 1;
select * from ((values row(1,2,3),row(10,20,30)))as c1 where column_0 =1;
column_0	column_1	column_2
1	2	3
values row(1,2,3) where column_0 < 1;
values row(1,2,3),row(10,20,30) where column_0 < 1;
select * from ((values row(1,2,3),row(10,20,30)))as c1 where column_0 < 100;
column_0	column_1	column_2
1	2	3
10	20	30
select * from ((values row(1,2,3),row(10,20,30)))as c1 where column_0 <= 100;
column_0	column_1	column_2
1	2	3
10	20	30
select * from ((values row(1,2,3),row(10,20,30)))as c1 where column_0 >= 0;
column_0	column_1	column_2
1	2	3
10	20	30
select * from ((values row(1,2,3),row(10,20,30)))as c1 where column_0 <> 100;
column_0	column_1	column_2
1	2	3
10	20	30
select * from ((values row(1,2,3),row(10,20,30)))as c1 where (column_0 >= 10 and column_1 >= 20) or column_2 > 20 ;
column_0	column_1	column_2
10	20	30
select * from ((values row(1,2,3),row(10,20,30)))as c1 where column_0 between 10 and 20;
column_0	column_1	column_2
10	20	30
select * from ((values row('aaa','abc','保时捷'),row('bbb','bfg','保时捷')))as c1 where column_0 like '%a%';
column_0	column_1	column_2
aaa	abc	保时捷
select * from ((values row('aaa','abc','保时捷'),row('bbb','bfg','保时捷')))as c1 where column_0 not like '%a%';
column_0	column_1	column_2
bbb	bfg	保时捷
select * from ((values row('aaa','abc','保时捷')))as c1 where exists (select * from dual);
column_0	column_1	column_2
aaa	abc	保时捷
select * from ((values row(10,2,3)))as c1
where column_0 > any
(select * from ((values row(1)))as c1);
column_0	column_1	column_2
10	2	3
select * from ((values row(10,2,3)))as c1
where column_0 > all
(select * from ((values row(1)))as c1);
column_0	column_1	column_2
10	2	3
select * from ((values row(10,2,3)))as c1 where column_0 in(10,20,30);
column_0	column_1	column_2
10	2	3
# 多表join
values row(10,2,3),row(10,2,3) inner join (values row(10,2,3));
select * from (values row(1,2,3),row(11,22,33))as c1 inner join (values row(11,222,333))as c2 on c1.column_0=c2.column_0;
column_0	column_1	column_2	column_0	column_1	column_2
11	22	33	11	222	333
select * from (values row(1,2,3),row(11,22,33))as c1 left join (values row(11,222,333))as c2 on c1.column_0=c2.column_0;
column_0	column_1	column_2	column_0	column_1	column_2
1	2	3	NULL	NULL	NULL
11	22	33	11	222	333
select * from (values row(1,2,3),row(11,22,33))as c1 right join (values row(11,222,333))as c2 on c1.column_0=c2.column_0;
column_0	column_1	column_2	column_0	column_1	column_2
11	22	33	11	222	333
select * from (values row(11,22,33))as c1 inner join (values row(1,2,3),row(11,222,333))as c2 on c1.column_0=c2.column_0;
column_0	column_1	column_2	column_0	column_1	column_2
11	22	33	11	222	333
select * from (values row(11,22,33))as c1 left join (values row(1,2,3),row(11,222,333))as c2 on c1.column_0=c2.column_0;
column_0	column_1	column_2	column_0	column_1	column_2
11	22	33	11	222	333
select * from (values row(11,22,33))as c1 right join (values row(1,2,3),row(11,222,333))as c2 on c1.column_0=c2.column_0;
column_0	column_1	column_2	column_0	column_1	column_2
11	22	33	11	222	333
NULL	NULL	NULL	1	2	3
select * from (values row(1,2,3),row(11,22,33))as c1 inner join (values row(11,222,333))as c2 ;
column_0	column_1	column_2	column_0	column_1	column_2
1	2	3	11	222	333
11	22	33	11	222	333
select * from (values row(1,2,3),row(11,22,33))as c1 left join (values row(11,222,333))as c2 ;
select * from (values row(1,2,3),row(11,22,33))as c1 right join (values row(11,222,333))as c2 ;
select * from ((values row(10,2,3)))as c1 ;
column_0	column_1	column_2
10	2	3
# with as
with hal_view as((values row(1,2,3)))
select * from hal_view;
column_0	column_1	column_2
1	2	3
with hal_view as(select * from((values row(1,2,3)))as c1)
select * from hal_view;
column_0	column_1	column_2
1	2	3
# 运算符
values row(1+1,2-2,3*3,4/2);
column_0	column_1	column_2	column_3
2	0	9	2.0000
select * from (values row(1+1,2-2,3*3,4/2))as c1;
column_0	column_1	column_2	column_3
2	0	9	2.0000
# distinct
select distinct column_0 from (values row(1,2,3),row(11,22,33),row(1,2,33))as c1;
column_0
1
11
select distinct(column_0),column_1,column_2 from (values row(1,2,3),row(11,22,33),row(1,2,33))as c1;
column_0	column_1	column_2
1	2	3
11	22	33
1	2	33
# group by
select * from (values row(1,2,3),row(11,22,33),row(1,2,33))as c1 group by column_0;
column_0	column_1	column_2
1	2	3
11	22	33
select * from (values row(1,2,3),row(11,22,33),row(1,2,33))as c1 group by column_0 ASC;
column_0	column_1	column_2
1	2	3
11	22	33
select * from (values row(1,2,3),row(11,22,33),row(1,2,33))as c1 group by column_0 desc;
column_0	column_1	column_2
11	22	33
1	2	3
select * from (values row(1,2,3),row(11,22,33),row(1,2,33))as c1 group by column_0 order by column_0;
column_0	column_1	column_2
1	2	3
11	22	33
select * from (values row(1,2,3),row(11,22,33),row(1,2,33))as c1 group by column_0 order by column_0 asc;
column_0	column_1	column_2
1	2	3
11	22	33
select * from (values row(1,2,3),row(11,22,33),row(1,2,33))as c1 group by column_0 order by column_0 desc;
column_0	column_1	column_2
11	22	33
1	2	3
# case when
select column_0,column_1,column_2,
(case column_1
when 2 then '第一个'
    when 22 then '第二个'
    else '第三个'
end)
from (values row(1,2,3),row(11,22,33),row(1,2,33))as c1;
column_0	column_1	column_2	(case column_1
when 2 then '第一个'
    when 22 then '第二个'
    else '第三个'
end)
1	2	3	第一个
11	22	33	第二个
1	2	33	第一个
# desc 其他场景以覆盖
# asc 其他场景以覆盖
# order by
select * from (
values row(
convert('10086' , UNSIGNED INT),
convert('char' , char(10)),
convert(1001.22 , double)
),
row(
convert('100861' , UNSIGNED INT),
convert('char' , char(10)),
convert(1001.22 , double)
),
row(
convert('1008611' , UNSIGNED INT),
convert('char' , char(10)),
convert(1001.22 , double)
)
)as c1 order by column_0 desc;
column_0	column_1	column_2
1008611	char	1001.22
100861	char	1001.22
10086	char	1001.22
select * from (
values row(
convert('10086' , UNSIGNED INT),
convert('char' , char(10)),
convert(1001.22 , double)
),
row(
convert('100861' , UNSIGNED INT),
convert('char' , char(10)),
convert(1001.22 , double)
),
row(
convert('1008611' , UNSIGNED INT),
convert('char' , char(10)),
convert(1001.22 , double)
)
)as c1 order by column_0;
column_0	column_1	column_2
10086	char	1001.22
100861	char	1001.22
1008611	char	1001.22
select * from (
values row(
convert('10086' , UNSIGNED INT),
convert('char' , char(10)),
convert(1001.22 , double)
),
row(
convert('100861' , UNSIGNED INT),
convert('char' , char(10)),
convert(1001.22 , double)
),
row(
convert('1008611' , UNSIGNED INT),
convert('char' , char(10)),
convert(1001.22 , double)
)
)as c1 order by column_0 asc;
column_0	column_1	column_2
10086	char	1001.22
100861	char	1001.22
1008611	char	1001.22
values
row(
convert('10086' , UNSIGNED INT),
convert('char' , char(10)),
convert(1001.22 , double)
),
row(
convert('100861' , UNSIGNED INT),
convert('char' , char(10)),
convert(1001.22 , double)
),
row(
convert('1008611' , UNSIGNED INT),
convert('char' , char(10)),
convert(1001.22 , double)
)order by column_0 asc;
column_0	column_1	column_2
10086	char	1001.22
100861	char	1001.22
1008611	char	1001.22
values
row(
convert('10086' , UNSIGNED INT),
convert('char' , char(10)),
convert(1001.22 , double)
),
row(
convert('100861' , UNSIGNED INT),
convert('char' , char(10)),
convert(1001.22 , double)
),
row(
convert('1008611' , UNSIGNED INT),
convert('char' , char(10)),
convert(1001.22 , double)
)order by column_0 desc;
column_0	column_1	column_2
1008611	char	1001.22
100861	char	1001.22
10086	char	1001.22
# limit
select * from (
values row(
convert('10086' , UNSIGNED INT),
convert('char' , char(10)),
convert(1001.22 , double)
),
row(
convert('100861' , UNSIGNED INT),
convert('char' , char(10)),
convert(1001.22 , double)
),
row(
convert('1008611' , UNSIGNED INT),
convert('char' , char(10)),
convert(1001.22 , double)
)
)as c1 limit 1;
column_0	column_1	column_2
10086	char	1001.22
select * from (
values row(
convert('10086' , UNSIGNED INT),
convert('char' , char(10)),
convert(1001.22 , double)
),
row(
convert('100861' , UNSIGNED INT),
convert('char' , char(10)),
convert(1001.22 , double)
),
row(
convert('1008611' , UNSIGNED INT),
convert('char' , char(10)),
convert(1001.22 , double)
)
)as c1 limit 2;
column_0	column_1	column_2
10086	char	1001.22
100861	char	1001.22
select * from (
values row(
convert('10086' , UNSIGNED INT),
convert('char' , char(10)),
convert(1001.22 , double)
),
row(
convert('100861' , UNSIGNED INT),
convert('char' , char(10)),
convert(1001.22 , double)
),
row(
convert('1008611' , UNSIGNED INT),
convert('char' , char(10)),
convert(1001.22 , double)
)
)as c1 limit 1;
column_0	column_1	column_2
10086	char	1001.22
values
row(
convert('10086' , UNSIGNED INT),
convert('char' , char(10)),
convert(1001.22 , double)
),
row(
convert('100861' , UNSIGNED INT),
convert('char' , char(10)),
convert(1001.22 , double)
),
row(
convert('1008611' , UNSIGNED INT),
convert('char' , char(10)),
convert(1001.22 , double)
) limit 1;
column_0	column_1	column_2
10086	char	1001.22
values
row(
convert('10086' , UNSIGNED INT),
convert('char' , char(10)),
convert(1001.22 , double)
),
row(
convert('100861' , UNSIGNED INT),
convert('char' , char(10)),
convert(1001.22 , double)
),
row(
convert('1008611' , UNSIGNED INT),
convert('char' , char(10)),
convert(1001.22 , double)
)limit 2;
column_0	column_1	column_2
10086	char	1001.22
100861	char	1001.22
# order by + limit
select * from (
values row(
convert('10086' , UNSIGNED INT),
convert('char' , char(10)),
convert(1001.22 , double)
),
row(
convert('100861' , UNSIGNED INT),
convert('char' , char(10)),
convert(1001.22 , double)
),
row(
convert('1008611' , UNSIGNED INT),
convert('char' , char(10)),
convert(1001.22 , double)
)
)as c1 order by column_0 desc limit 1;
column_0	column_1	column_2
1008611	char	1001.22
select * from (
values row(
convert('10086' , UNSIGNED INT),
convert('char' , char(10)),
convert(1001.22 , double)
),
row(
convert('100861' , UNSIGNED INT),
convert('char' , char(10)),
convert(1001.22 , double)
),
row(
convert('1008611' , UNSIGNED INT),
convert('char' , char(10)),
convert(1001.22 , double)
)
)as c1 order by column_0 desc limit 2;
column_0	column_1	column_2
1008611	char	1001.22
100861	char	1001.22
select * from (
values row(
convert('10086' , UNSIGNED INT),
convert('char' , char(10)),
convert(1001.22 , double)
),
row(
convert('100861' , UNSIGNED INT),
convert('char' , char(10)),
convert(1001.22 , double)
),
row(
convert('1008611' , UNSIGNED INT),
convert('char' , char(10)),
convert(1001.22 , double)
)
)as c1 order by column_0 desc limit 1;
column_0	column_1	column_2
1008611	char	1001.22
values
row(
convert('10086' , UNSIGNED INT),
convert('char' , char(10)),
convert(1001.22 , double)
),
row(
convert('100861' , UNSIGNED INT),
convert('char' , char(10)),
convert(1001.22 , double)
),
row(
convert('1008611' , UNSIGNED INT),
convert('char' , char(10)),
convert(1001.22 , double)
) order by column_0 desc limit 1;
column_0	column_1	column_2
1008611	char	1001.22
values
row(
convert('10086' , UNSIGNED INT),
convert('char' , char(10)),
convert(1001.22 , double)
),
row(
convert('100861' , UNSIGNED INT),
convert('char' , char(10)),
convert(1001.22 , double)
),
row(
convert('1008611' , UNSIGNED INT),
convert('char' , char(10)),
convert(1001.22 , double)
)order by column_0 desc limit 2;
column_0	column_1	column_2
1008611	char	1001.22
100861	char	1001.22
# 自查询
drop table hal;
create table hal as (
select * from (
values
row(11,12),
row(21,22),
row(31,32),
row(41,42),
row(51,52),
row(61,62)
) as dd
);
select * from hal;
column_0	column_1
11	12
21	22
31	32
41	42
51	52
61	62
select * from hal where column_0 in (
select * from(
values
row(11),
row(61)
) as dd
);
column_0	column_1
11	12
61	62
# 外连接
select c1.column_0,c1.column_1 from (
values
row(11,12),
row(21,22)
) as c1
inner join(
select c2.column_0,c2.column_1 from (
values
row(11,12),
row(21,22),
row(31,32)
) as c2
)as c22 on c1.column_0 = c22.column_0;
column_0	column_1
11	12
21	22
select c1.column_0,c1.column_1 from (
values
row(11,12),
row(21,22)
) as c1
left join(
select c2.column_0,c2.column_1 from (
values
row(11,12),
row(21,22),
row(31,32)
) as c2
)as c22 on c1.column_0 = c22.column_0;
column_0	column_1
11	12
21	22
select c1.column_0,c1.column_1 from (
values
row(11,12),
row(21,22)
) as c1
right join(
select c2.column_0,c2.column_1 from (
values
row(11,12),
row(21,22),
row(31,32)
) as c2
)as c22 on c22.column_0 = c1.column_0;
column_0	column_1
11	12
21	22
NULL	NULL
# union
values
row(11,12),
row(21,22),
row(31,32)
union
values
row(111,120);
column_0	column_1
11	12
21	22
31	32
111	120
select c1.column_0,c1.column_1 from (
values
row(11,12),
row(21,22),
row(31,32)
union
values
row(111,120)
) as c1;
column_0	column_1
11	12
21	22
31	32
111	120
# insert values-3-2
# 插入到不同的数据类型value
# 字符数据类型
# 数值数据类型
# 日期时间类型
# 大对象类型
# 运算符
drop table hal;
create table hal(
id int(10),
c_char char(100),
c_int int(10),
c_date date,
c_blob blob
);
insert into hal(id,c_char,c_int,c_date,c_blob)
values
row(1,'c_char',10086,'2022-10-10','c_blob');
select * from hal;
id	c_char	c_int	c_date	c_blob
1	c_char	10086	2022-10-10	c_blob
drop table hal;
create table hal(
id int(10),
c_char char(100),
c_int int(10),
c_date date,
c_blob blob
);
insert into hal(id,c_char,c_int,c_date,c_blob)
values
row(1,'c_char',10086,'2022-10-10','c_blob'),
row(2,'c_char',10086,'2022-10-10','c_blob'),
row(3,'c_char',10086,'2022-10-10','c_blob'),
row(4,'c_char',10086,'2022-10-10','c_blob')
limit 2;
select * from hal;
id	c_char	c_int	c_date	c_blob
1	c_char	10086	2022-10-10	c_blob
2	c_char	10086	2022-10-10	c_blob
drop table hal;
create table hal(
id int(10),
c_char char(100),
c_int int(10),
c_date date,
c_blob blob
);
insert into hal(id,c_char,c_int,c_date,c_blob)
values
row(1,'c_char',10086-1,'2022-10-10','c_blob'),
row(2,'c_char',10086+1,'2022-10-10','c_blob'),
row(3,'c_char',10086*2,'2022-10-10','c_blob'),
row(4,'c_char',10086/2,'2022-10-10','c_blob')
order by column_0 desc limit 2;
select * from hal;
id	c_char	c_int	c_date	c_blob
4	c_char	5043	2022-10-10	c_blob
3	c_char	20172	2022-10-10	c_blob
drop table hal;
create table hal(
id int(10),
c_char char(100),
c_int int(10),
c_date date,
c_blob blob
);
insert into hal(id,c_char,c_int,c_date,c_blob)
values(
(select * from (
(values row(1,'c_char',10086,'2022-10-10','c_blob'))
)as c1)
);
select * from hal;
id	c_char	c_int	c_date	c_blob
drop table hal;
create table hal(
id int
);
insert into hal(id)
values((select * from ((values row(1)))as c1));
select * from hal;
id
1
# update values-3-4
drop table hal;
create table hal(
id int(10),
c_char char(100),
c_int int(10),
c_date date,
c_blob blob
);
insert into hal(id,c_char,c_int,c_date,c_blob)
values
row(1,'c_char',10086,'2022-10-10','c_blob');
select * from hal;
id	c_char	c_int	c_date	c_blob
1	c_char	10086	2022-10-10	c_blob
update hal set c_char = (values row('c_char1')) where id = 1;
select * from hal;
id	c_char	c_int	c_date	c_blob
1	c_char1	10086	2022-10-10	c_blob
update hal set
c_int = (values row(10001)),
c_date = (values row('2024-10-10')),
c_blob = (values row('c_blob1'))
where id = 1;
select * from hal;
id	c_char	c_int	c_date	c_blob
1	c_char1	10001	2024-10-10	c_blob1
update hal set c_char = (select * from (values row('c_char2'))as c1) where id = 1;
select * from hal;
id	c_char	c_int	c_date	c_blob
1	c_char2	10001	2024-10-10	c_blob1
update hal set
c_int = (select * from (values row(88888-8))as c1),
c_date = (select * from (values row('2026-10-10'))as c2),
c_blob = (select * from (values row('c_blob2'))as c3)
where id = 1;
select * from hal;
id	c_char	c_int	c_date	c_blob
1	c_char2	88880	2026-10-10	c_blob2
# where字句
update hal set
c_int = (select * from (values row(88888-8))as c1)
where id <> 0;
select * from hal;
id	c_char	c_int	c_date	c_blob
1	c_char2	88880	2026-10-10	c_blob2
update hal set
c_int = (select * from (values row(88888-8))as c1)
where id = 0 and c_char = '';
select * from hal;
id	c_char	c_int	c_date	c_blob
1	c_char2	88880	2026-10-10	c_blob2
update hal set
c_int = (select * from (values row(88))as c1)
where c_char like '' or c_char like 'c_char';
select * from hal;
id	c_char	c_int	c_date	c_blob
1	c_char2	88880	2026-10-10	c_blob2
# delete values-3-5
drop table hal;
create table hal(
id int(10),
c_char char(100),
c_int int(10),
c_date date,
c_blob blob
);
insert into hal(id,c_char,c_int,c_date,c_blob)
values
row(1,'c_char',10086,'2022-10-10','c_blob22'),
row(2,'c_char2',100861,'2022-10-11','c_blob44'),
row(3,'c_char22',100862,'2022-10-12','c_blob66'),
row(4,'c_char222',100863,'2022-10-16','c_blob88'),
row(5,'c_char2222',100864,'2022-10-18','c_blob00');
select * from hal;
id	c_char	c_int	c_date	c_blob
1	c_char	10086	2022-10-10	c_blob22
2	c_char2	100861	2022-10-11	c_blob44
3	c_char22	100862	2022-10-12	c_blob66
4	c_char222	100863	2022-10-16	c_blob88
5	c_char2222	100864	2022-10-18	c_blob00
delete from hal where c_char = (values row('c_char2'));
select * from hal;
id	c_char	c_int	c_date	c_blob
1	c_char	10086	2022-10-10	c_blob22
3	c_char22	100862	2022-10-12	c_blob66
4	c_char222	100863	2022-10-16	c_blob88
5	c_char2222	100864	2022-10-18	c_blob00
delete from hal where
c_char = (values row('c_char'))
and
c_int = (values row(10086-2))
or
c_int = (values row(100861))
or
c_date = (values row('2022-10-12'))
or
c_blob = (values row('c_blob88'));
select * from hal;
id	c_char	c_int	c_date	c_blob
1	c_char	10086	2022-10-10	c_blob22
5	c_char2222	100864	2022-10-18	c_blob00
drop table hal;
create table hal(
id int(10),
c_char char(100),
c_int int(10),
c_date date,
c_blob blob
);
insert into hal(id,c_char,c_int,c_date,c_blob)
values
row(1,'c_char',10086,'2022-10-10','c_blob22'),
row(2,'c_char2',100861,'2022-10-11','c_blob44'),
row(3,'c_char22',100862,'2022-10-12','c_blob66'),
row(4,'c_char222',100863,'2022-10-16','c_blob88'),
row(5,'c_char2222',100864,'2022-10-18','c_blob00');
select * from hal;
id	c_char	c_int	c_date	c_blob
1	c_char	10086	2022-10-10	c_blob22
2	c_char2	100861	2022-10-11	c_blob44
3	c_char22	100862	2022-10-12	c_blob66
4	c_char222	100863	2022-10-16	c_blob88
5	c_char2222	100864	2022-10-18	c_blob00
delete from hal where c_char = (values row('c_char2'));
select * from hal;
id	c_char	c_int	c_date	c_blob
1	c_char	10086	2022-10-10	c_blob22
3	c_char22	100862	2022-10-12	c_blob66
4	c_char222	100863	2022-10-16	c_blob88
5	c_char2222	100864	2022-10-18	c_blob00
delete from hal where
c_char = (select * from (values row('c_char111'))as c1)
and
c_int = (select * from (values row(100861))as c2)
or
c_int = (select * from (values row(100862))as c3)
or
c_date = (select * from (values row('2022-10-12'))as c4)
or
c_blob = (select * from (values row('c_blob88'))as c5);
select * from hal;
id	c_char	c_int	c_date	c_blob
1	c_char	10086	2022-10-10	c_blob22
5	c_char2222	100864	2022-10-18	c_blob00
delete from hal where
c_char = (select * from (values row('c_char'))as c1);
select * from hal;
id	c_char	c_int	c_date	c_blob
5	c_char2222	100864	2022-10-18	c_blob00
# alter values-3-6
drop table hal;
create table hal(
id int(10),
username char(100)
);
insert into hal(id,username)
values(1,'c_char');
select * from hal;
id	username
1	c_char
alter table hal modify column username varchar(10);
# 虚拟生成列
select * from hal;
id	username
1	c_char
ALTER TABLE hal ADD COLUMN full_name VARCHAR(255) AS ('cha');
ALTER TABLE hal ADD COLUMN full_name VARCHAR(255) AS (value row('values row'));
ALTER TABLE hal ADD COLUMN full_name VARCHAR(255) AS (select * from (value row('values row'))as c1);
# 存储生成列
ALTER TABLE hal ADD COLUMN full_name2 VARCHAR(255) GENERATED ALWAYS AS ('ppppp') VIRTUAL;
ALTER TABLE hal ADD COLUMN full_name2 VARCHAR(255) GENERATED ALWAYS AS (value row('values row')) VIRTUAL;
ALTER TABLE hal ADD COLUMN full_name2 VARCHAR(255) GENERATED ALWAYS AS (select * from (value row('values row')) VIRTUAL;
select * from hal;
id	username	full_name	full_name2
1	c_char	cha	ppppp
insert into hal(id,username)
values row(2,'c_charc_charc_char');
select * from hal;
id	username	full_name	full_name2
1	c_char	cha	ppppp
# 运算符 values-4
# 运算符 values-4-1
drop table hal;
create table hal(
id int(10),
num int(10)
);
insert into hal(id,num) values(1,100);
select * from hal;
id	num
1	100
select * from hal where (
num > (values row(1))
);
id	num
1	100
select * from hal where (
num < (values row(1))
);
id	num
select * from hal where (
num <= (values row(1))
);
id	num
select * from hal where (
num >= (values row(1))
);
id	num
1	100
select * from hal where (
num = (values row(100))
);
id	num
1	100
select * from hal where (
num >= (values row(100))
);
id	num
1	100
select * from hal where (
num >= (values row(10))
);
id	num
1	100
drop table hal;
create table hal(
id int(10),
num int(10)
);
insert into hal(id,num) values(1,100);
insert into hal(id,num) values(2,1000);
insert into hal(id,num) values(3,10000);
select * from hal;
id	num
1	100
2	1000
3	10000
select * from hal where (
num > (values row(1))
);
id	num
1	100
2	1000
3	10000
select * from hal where (
num < (values row(1))
);
id	num
select * from hal where (
num <= (values row(1))
);
id	num
select * from hal where (
num >= (values row(1))
);
id	num
1	100
2	1000
3	10000
select * from hal where (
num = (values row(100))
);
id	num
1	100
select * from hal where (
num >= (values row(100))
);
id	num
1	100
2	1000
3	10000
select * from hal where (
num >= (values row(10))
) order by num desc ;
id	num
3	10000
2	1000
1	100
select * from hal where (
num >= (values row(10))
) limit 1 ;
id	num
1	100
select * from hal where (
num >= (values row(10))
) order by num desc limit 1 ;
id	num
3	10000
# 运算符 values-4-2
drop table hal;
create table hal(
id int(10),
num int(10)
);
insert into hal(id,num) values(1,100);
select * from hal;
id	num
1	100
values row(1+1);
column_0
2
values row(100001-1);
column_0
100000
values row(1000/1);
column_0
1000.0000
values row(1000*10);
column_0
10000
values row(1000%10);
column_0
0
values row(9%2);
column_0
1
values row(1+1);
column_0
2
values row(100001-100002);
column_0
-1
values row(1000/1100);
column_0
0.9091
values row(1000*0);
column_0
0
values row(1000%100000);
column_0
1000
values row(-10+1);
column_0
-9
values row((-10) + (-10));
column_0
-20
values row(100001+-100002);
column_0
-1
values row(100001+(-100002));
column_0
-1
values row(-1000/ -1100);
column_0
0.9091
values row(-1000/ (-1100));
column_0
0.9091
values row(-1000*0);
column_0
0
values row(-1000* -0);
column_0
0
values row(-1000%100000);
column_0
-1000
values row(1+1),row(100001-1),row(1000/1),row(1000*10),row(1000%10),row(9%2);
column_0
2.0000
100000.0000
1000.0000
10000.0000
0.0000
1.0000
values row(1+1,100001-100002,100001-100002,1000/1100,1000*0,1000%100000);
column_0	column_1	column_2	column_3	column_4	column_5
2	-1	-1	0.9091	0	1000
# 逻辑运算符 values-4-3 其他场景已覆盖
# 内置函数校验 values-5
# 日期函数 values-5-1
# CURRENT_TIME([scale])
values row(CURRENT_TIME());
values row(CURRENT_TIMESTAMP());
values row(DATE_FORMAT(now(), '%Y-%m-%d'));
values row(DATE_SUB(NOW(), INTERVAL 1 DAY));
values row(DATEDIFF('2022-01-01', '2021-12-01'));
values row(MONTH(NOW()));
values row(NOW());
select * from (
values row(TIME('2022-01-01 12:34:56'))
);
values row(RAND());
values row(uuid());
values row(EXTRACT(YEAR FROM NOW()));
values row(DATE_ADD('2022-01-01', INTERVAL 3 DAY));
column_0
2022-01-04
values row(DATE_ADD('2022-01-01', INTERVAL 3 month));
column_0
2022-04-01
values row(DATE_ADD('2022-01-01 03:00:00 ', INTERVAL 3 hour));
column_0
2022-01-01 06:00:00
values row(FROM_DAYS(737999));
column_0
2020-07-28
values row(FROM_UNIXTIME(1641427200, '%Y-%m-%d %H:%i:%s'));
column_0
2022-01-06 08:00:00
values row(PERIOD_DIFF(202201, 202112));
column_0
1
values row(STR_TO_DATE('2022-01-01', '%Y-%m-%d'));
column_0
2022-01-01
values row(TIME_TO_USEC('12:34:56'));
column_0
-9223372022400000000
values row(TIMEDIFF('2022-01-01 12:00:00', '2022-01-01 11:00:00'));
column_0
01:00:00
values row(TIMESTAMPDIFF(HOUR, '2022-01-01 12:00:00', '2021-12-01 11:00:00'));
column_0
-745
values row(TIME('2022-01-01 12:34:56'));
column_0
12:34:56.000000
# 字符串函数 values-5-2
values row(CONCAT('hello',' hal'));
column_0
hello hal
values row(SUBSTR('Hello World', 7, 5));
column_0
World
values row(CHAR_LENGTH('Hello World'));
column_0
11
values row(UPPER('Hello World'));
column_0
HELLO WORLD
values row(UPPER(Hello World));
values row(lower('Hello World'));
column_0
hello world
values row(CONCAT_WS(' ', 'John', 'Doe', 'Smith'));
column_0
John Doe Smith
values row(FORMAT(12345.6789, 2));
column_0
12,345.68
values row(SUBSTRING('Hello World', 7));
column_0
World
values row(TRIM('  Hello World  '));
column_0
Hello World
values row(LTRIM('  Hello World  '));
column_0
Hello World  
values row(RTRIM('  Hello World  '));
column_0
  Hello World
values row(ASCII('Hello World'));
column_0
72
values row(ORD('Hello World'));
column_0
72
values row(LENGTH('Hello World'));
column_0
11
values row(CHAR_LENGTH('Hello World'));
column_0
11
values row(UPPER('Hello World'));
column_0
HELLO WORLD
values row(HEX('Hello World'));
column_0
48656C6C6F20576F726C64
values row(MD5('Hello World'));
column_0
b10a8db164e0754105b7a99be72e3fe5
values row(INT2IP(2130706433));
column_0
127.0.0.1
# like 其他场景已覆盖
select * from (values row('JHON',2,3),row('HAL',2,3))as c1 where column_0 REGEXP '^J';
column_0	column_1	column_2
JHON	2	3
values row(REPEAT('Hello', 3));
column_0
HelloHelloHello
values row(SPACE(5));
column_0
     
values row(SUBSTRING_INDEX('ocean.example.base', '.', 2));
column_0
ocean.example
values row(LOCATE('World', 'Hello World'));
column_0
7
values row(POSITION('World' IN 'Hello World'));
column_0
7
values row(INSTR('Hello World', 'World'));
column_0
7
values row(REPLACE('Hello World', 'World', 'MySQL'));
column_0
Hello MySQL
values row(FIELD('MySQL', 'Oracle', 'MySQL', 'SQL Server'));
column_0
2
values row(ELT(FIELD('MySQL', 'Oracle', 'MySQL', 'SQL Server'), 'Oracle', 'MySQL', 'SQL Server'));
column_0
MySQL
values row(INSERT('Hello World', 7, 5, 'MySQL'));
column_0
Hello MySQL
values row(LPAD('Hello', 10, ' '));
column_0
     Hello
values row(RPAD('Hello', 10, ' '));
column_0
Hello     
values row(bin(10));
column_0
1010
values row(quote("It's a string"));
column_0
'It\'s a string'
values row(REGEXP_SUBSTR('John Smith (j.smith@example.com)', '[A-Za-z0-9._%+-]+@[A-Za-z0-9.-]+\.[A-Za-z]{2,}', 1, 1, 'i'));
column_0
j.smith@example.com
# 数学函数 values-5-4
values row(round(10086.11122,2));
column_0
10086.11
values row(round(10086.146,2));
column_0
10086.15
values row(round(10086.151,2));
column_0
10086.15
drop table hal;
create table hal(
id int(10),
num1 int(10),
num2 int(10)
);
insert into hal(id,num1,num2) values(1,100,2020),(2,11,2300),(3,1111,2800);
select * from hal;
id	num1	num2
1	100	2020
2	11	2300
3	1111	2800
values row(CEIL(111));
column_0
111
values row(
(select ceil(avg(num1)) from hal)
);
column_0
408
values row(SIGN(360));
column_0
1
values row(CONV('1010', 2, 10));
column_0
10
values row(MOD(100,2));
column_0
0
values row(POW(8,4));
column_0
4096
values row(FLOOR(2.9));
column_0
2
values row(ABS(-5));
column_0
5
values row(NEG(5));
column_0
-5
values row(POWER(2, 3));
column_0
8
values row(RAND(123));
column_0
0.9277428611440052
# 控制流函数
# case
select column_0 ,
case
when column_0 = 111 then 'value is 111'
        else 'NAN hal...'
    end
from ((values row(111,222,333)))as c1;
column_0	case
when column_0 = 111 then 'value is 111'
        else 'NAN hal...'
    end
111	value is 111
select column_0 ,
case
when column_0 = (values row(111)) then 'value is 111'
        else 'NAN hal...'
    end
from ((values row(111,222,333)))as c1;
column_0	case
when column_0 = (values row(111)) then 'value is 111'
        else 'NAN hal...'
    end
111	value is 111
select column_0 ,
case
when column_0 = (values row(111,1112)) then 'value is 111'
        else 'NAN hal...'
    end
from ((values row(111,222,333)))as c1;
# if
select column_0 ,
if (column_0 = (values row(1110)),'yes','NAN hal...')as column_if
from ((values row(1110,222,333)))as c1;
column_0	column_if
1110	yes
select column_0 ,
if (column_0 = (values row(111)),'yes','NAN hal...')as column_if
from ((values row(1110,222,333)))as c1;
column_0	column_if
1110	NAN hal...
# ifnull
select *,
IFNULL(column_1, 'value default null...')as if_null
from ((values row(1,'char1','varchar')))as c1;
column_0	column_1	column_2	if_null
1	char1	varchar	char1
select *,
IFNULL((values row(column_1)), (values row('value default null...')))as if_null
from ((values row(1,'char1','varchar')))as c1;
column_0	column_1	column_2	if_null
1	char1	varchar	char1
select *,
IFNULL((values row(column_1)), (values row('value default null...')))as if_null
from ((values row(2,'','varchar')))as c1;
column_0	column_1	column_2	if_null
2		varchar	
# nullif
select *,
NULLIF(column_1, column_2)as null_if
from ((values row(1,'char1','varchar')))as c1;
column_0	column_1	column_2	null_if
1	char1	varchar	char1
select *,
NULLIF((values row(column_1)), (values row(column_2)))as null_if
from ((values row(1,'char1','varchar')))as c1;
column_0	column_1	column_2	null_if
1	char1	varchar	char1
select *,
NULLIF((values row(column_1)), (values row(column_2)))as null_if
from ((values row(2,'varchar','varchar')))as c1;
column_0	column_1	column_2	null_if
2	varchar	varchar	NULL
# 比较函数
values row(GREATEST(5, 7, 9));
column_0
9
values row(LEAST(5, 7, 9));
column_0
5
values row(ISNULL(field, 'default value'));
select isnull(column_0,'kong') from(values row(11,22))as c1;
#########清空回收站,删除测试数据库,表等 ##########
drop user zcp@'%' ;
