create table t_col (c1 string) with column group(each column);
insert into t_col values("abc");
insert into t_col values(repeat("a", 16777215));
insert into t_col values(repeat("b", 16777216));
ERROR 22001: Data too long for column 'c1' at row 1
select count(*) from t_col;
count(*)
2
select char_length(c1) from t_col;
char_length(c1)
3
16777215
create table t_pr1 (c1 string primary key) with column group(each column);
insert into t_pr1 values("ab");
insert into t_pr1 values("cd");
insert into t_pr1 values(repeat("a", 8192));
insert into t_pr1 values(repeat("b", 10000));
insert into t_pr1 values(repeat("c", 16380));
insert into t_pr1 values(repeat("d", 16381));
ERROR 42000: Specified key was too long; max key length is 16384 bytes
update t_pr1 set c1 = "abc" where c1 = "ab";
update t_pr1 set c1 = repeat("e", 16380) where c1 = "abc";
update t_pr1 set c1 = repeat("f", 20000) where c1 = "cd";
ERROR 42000: Specified key was too long; max key length is 16384 bytes
select count(*) from t_pr1;
count(*)
5
select char_length(c1) from t_pr1;
char_length(c1)
8192
10000
16380
2
16380
create table t_pr2 (c1 varchar(3840), c2 string, primary key (c1, c2)) with column group(each column);
create index idx_c2 on t_pr2(c2);
insert into t_pr2 values(repeat("a", 3840), repeat("b", 12540));
update t_pr2 set c2 = "bbbb" where c1 = repeat("a", 3840);
insert into t_pr2 values(repeat("a", 3840), repeat("b", 12541));
ERROR 42000: Specified key was too long; max key length is 16384 bytes
select count(*) from t_pr2;
count(*)
1
select char_length(c1), char_length(c2) from t_pr2;
char_length(c1)	char_length(c2)
3840	4
create table t_idx1 (c1 string, c2 string) with column group(each column);
insert into t_idx1 values(null, null);
insert into t_idx1 values("ab", "cd");
create index idx_c1 on t_idx1(c1);
insert into t_idx1 values(repeat("a", 8192), repeat("b", 8192));
insert into t_idx1 values(repeat("c", 8193), "ddd");
ERROR 0A000: outrow lob in index table not supported
insert into t_idx1 values("eee", repeat("f", 8193));
update t_idx1 set c1 = repeat("g", 8192) where c2 = "cd";
update t_idx1 set c1 = repeat("f", 8193) where c2 = "cd";
ERROR 0A000: outrow lob in index table not supported
create index idx_c2 on t_idx1(c2) with column group(each column);
ERROR 42000: Specified key was too long
select count(*) from t_idx1;
count(*)
4
select char_length(c1), char_length(c2) from t_idx1;
char_length(c1)	char_length(c2)
NULL	NULL
8192	2
8192	8192
3	8193
create table t_idx2 (c1 varchar(3840), c2 string, index idx_c1_c2(c1, c2)) lob_inrow_threshold = 12541 with column group(each column);
insert into t_idx2 values(repeat("a", 3832), repeat("b", 12540));
insert into t_idx2 values(repeat("a", 3832), repeat("b", 12541));
ERROR 42000: Specified key was too long; max key length is 16384 bytes
select count(*) from t_idx2;
count(*)
1
select char_length(c1), char_length(c2) from t_idx2;
char_length(c1)	char_length(c2)
3832	12540
insert into t_idx1 values("ob", "oms");
create table t_idx3 (c1 string primary key, c2 string, key(c2)) lob_inrow_threshold = 0 with column group(each column);
insert into t_idx3 select * from t_idx1 where c1 = "ob";
ERROR 0A000: outrow lob in index table not supported
select count(*) from t_idx3;
count(*)
0
select char_length(c1), char_length(c2) from t_idx3;
char_length(c1)	char_length(c2)
create table t_g_idx1 (c1 int primary key, c2 string, c3 string) partition by range(c1) (partition p1 values less than (100), partition p2 values less than maxvalue) with column group(each column);
insert into t_g_idx1 values(1, null, null);
insert into t_g_idx1 values(2, "ab", "cd");
create index idx_c2 on t_g_idx1(c2) global;
insert into t_g_idx1 values(3, repeat("a", 8192), repeat("b", 8192));
insert into t_g_idx1 values(101, repeat("c", 8193), "ddd");
ERROR 0A000: outrow lob in index table not supported
insert into t_g_idx1 values(102, "eee", repeat("f", 8193));
update t_g_idx1 set c2 = repeat("g", 8192) where c3 = "cd";
update t_g_idx1 set c2 = repeat("f", 8193) where c3 = "cd";
ERROR 0A000: outrow lob in index table not supported
create index idx_c3 on t_g_idx1(c3) global;
ERROR 42000: Specified key was too long
select count(*) from t_g_idx1;
count(*)
4
select c1, char_length(c2), char_length(c3) from t_g_idx1;
c1	char_length(c2)	char_length(c3)
1	NULL	NULL
2	8192	2
3	8192	8192
102	3	8193
create table t_g_idx2 (c1 int, c2 string, c3 string, primary key(c1, c2)) partition by range(c1) (partition p1 values less than (100), partition p2 values less than maxvalue) with column group(each column);
create index idx_c2 on t_g_idx2(c2) global;
create index idx_c3 on t_g_idx2(c3) global;
insert into t_g_idx2 values (1, "hello", null);
insert into t_g_idx2 values (2, "ab", "cd");
insert into t_g_idx2 values (101, repeat("e", 8193), "ee");
insert into t_g_idx2 values (102, "ff", repeat("f", 8193));
ERROR 0A000: outrow lob in index table not supported
select count(*) from t_g_idx2;
count(*)
3
select c1, char_length(c2), char_length(c3) from t_g_idx2;
c1	char_length(c2)	char_length(c3)
1	5	NULL
2	2	2
101	8193	2
insert into t_g_idx1 values(103, "ob", "oms");
create table t_g_idx3 (c1 int, c2 string, c3 string, primary key (c1, c2), key(c3) global) lob_inrow_threshold = 0 partition by range(c1) (partition p1 values less than (100), partition p2 values less than maxvalue) with column group(each column);
insert into t_g_idx3 select * from t_g_idx1 where c1 = 103;
ERROR 0A000: outrow lob in index table not supported
select count(*) from t_g_idx3;
count(*)
0
select c1, char_length(c2), char_length(c3) from t_g_idx3;
c1	char_length(c2)	char_length(c3)
create table t_src (c1 string, c2 string) lob_inrow_threshold = 8192 with column group(each column);
create table t_dst (c1 string, key idx_c1(c1)) lob_inrow_threshold = 10000 with column group(each column);
create table t_dst_inc (c1 string primary key, c2 string, index idx_c2(c2) local) with column group(each column);
create table t_dst_full (c1 string primary key, c2 string, index idx_c2(c2)) with column group(each column);
create table t_dst_full1 (c1 varchar(100), c2 string, primary key(c1, c2)) with column group(each column);
create table t_dst_full2 (c1 varchar(100), c2 string, index idx_c1_c2(c1, c2)) lob_inrow_threshold = 16377 with column group(each column);
create table t_dst_heap (c1 string, c2 string) lob_inrow_threshold = 8192 with column group(each column);
insert into t_src values("aaa", "bbb");
insert into t_src values(repeat("c", 8193), "ddd");
insert into t_src values(repeat("e", 16381), "fff");
insert into t_src values("ggg", repeat("h", 8193));
insert into t_src values("hhhh", repeat("i", 16368));
insert into t_src values("iiii", repeat("j", 16376));
insert into t_src values("kkkk", repeat("l", 16377));
insert into t_dst select c2 from t_src where c1 = "aaa";
insert into t_dst select c2 from t_src where c1 = "ggg";
insert into t_dst select c1 from t_src where c2 = "fff";
ERROR 0A000: outrow lob in index table not supported
insert /*+direct(true, 0, 'inc') enable_parallel_dml parallel(4)*/ into t_dst_inc select c1, c2 from t_src where c1 = "aaa";
insert /*+direct(true, 0, 'inc') enable_parallel_dml parallel(4)*/ into t_dst_inc select c1, c2 from t_src where c1 = "aaa";
ERROR 23000: Duplicated primary key
insert /*+direct(true, 0, 'inc') enable_parallel_dml parallel(4)*/ into t_dst_inc select c1, c2 from t_src where c2 = "ddd";
ERROR 42000: Specified key was too long
insert /*+direct(true, 0, 'inc') enable_parallel_dml parallel(4)*/ into t_dst_inc select c1, c2 from t_src where c2 = "fff";
ERROR 42000: Specified key was too long; max key length is 16384 bytes
insert /*+direct(true, 0, 'inc') enable_parallel_dml parallel(4)*/ into t_dst_inc select c1, c2 from t_src where c1 = "ggg";
ERROR 42000: Specified key was too long
insert /*+direct(true, 0, 'full') enable_parallel_dml parallel(4)*/ into t_dst_full select c1, c2 from t_src where c1 = "aaa";
insert /*+direct(true, 0, 'full') enable_parallel_dml parallel(4)*/ into t_dst_full select c1, c2 from t_src where c2 = "ddd";
insert /*+direct(true, 0, 'full') enable_parallel_dml parallel(4)*/ into t_dst_full select c1, c2 from t_src where c2 = "fff";
ERROR 42000: Specified key was too long; max key length is 16384 bytes
insert /*+direct(true, 0, 'full') enable_parallel_dml parallel(4)*/ into t_dst_full select c1, c2 from t_src where c1 = "ggg";
ERROR 42000: Specified key was too long
insert /*+direct(true, 0, 'full') enable_parallel_dml parallel(4)*/ into t_dst_full1 select c1, c2 from t_src where c1 = "iiii";
insert /*+direct(true, 0, 'full') enable_parallel_dml parallel(4)*/ into t_dst_full1 select c1, c2 from t_src where c1 = "kkkk";
ERROR 42000: Specified key was too long; max key length is 16384 bytes
insert /*+direct(true, 0, 'full') enable_parallel_dml parallel(4)*/ into t_dst_full2 select c1, c2 from t_src where c1 = "hhhh";
insert /*+direct(true, 0, 'full') enable_parallel_dml parallel(4)*/ into t_dst_full2 select c1, c2 from t_src where c1 = "iiii";
ERROR 42000: Specified key was too long
insert /*+direct(true, 0, 'inc') enable_parallel_dml parallel(4)*/ into t_dst_heap select c1, c2 from t_src;
insert /*+direct(true, 0, 'full') enable_parallel_dml parallel(4)*/ into t_dst_heap select c1, c2 from t_src;
select count(*) from t_src;
count(*)
7
select char_length(c1), char_length(c2) from t_src;
char_length(c1)	char_length(c2)
3	3
8193	3
16381	3
3	8193
4	16368
4	16376
4	16377
select count(*) from t_dst;
count(*)
2
select char_length(c1) from t_dst;
char_length(c1)
3
8193
select count(*) from t_dst_inc;
count(*)
1
select char_length(c1), char_length(c2) from t_dst_inc;
char_length(c1)	char_length(c2)
3	3
select count(*) from t_dst_full;
count(*)
2
select char_length(c1), char_length(c2) from t_dst_full;
char_length(c1)	char_length(c2)
3	3
8193	3
select count(*) from t_dst_full1;
count(*)
1
select char_length(c1), char_length(c2) from t_dst_full1;
char_length(c1)	char_length(c2)
4	16376
select count(*) from t_dst_full2;
count(*)
1
select char_length(c1), char_length(c2) from t_dst_full2;
char_length(c1)	char_length(c2)
4	16368
select count(*) from t_dst_heap;
count(*)
14
select char_length(c1), char_length(c2) from t_dst_heap order by 1,2;
char_length(c1)	char_length(c2)
3	3
3	3
3	8193
3	8193
4	16368
4	16368
4	16376
4	16376
4	16377
4	16377
8193	3
8193	3
16381	3
16381	3
create table t_ld_inc (c1 string primary key, c2 int, c3 string, index idx_c3(c3) local) with column group(each column);
create table t_ld_full (c1 string primary key, c2 int, c3 string, index idx_c3(c3)) with column group(each column);
create table t_ld_heap (c1 string, c2 string, c3 string) with column group(each column);
ERROR 42000: Specified key was too long
ERROR 42000: Specified key was too long
ERROR 42000: Specified key was too long
ERROR 42000: Specified key was too long
select count(*) from t_ld_inc;
count(*)
2
select char_length(c1), c2, char_length(c3) from t_ld_inc;
char_length(c1)	c2	char_length(c3)
100	1	100
8193	2	4
select count(*) from t_ld_full;
count(*)
2
select char_length(c1), c2, char_length(c3) from t_ld_full;
char_length(c1)	c2	char_length(c3)
100	1	100
8193	2	4
select count(*) from t_ld_heap;
count(*)
8
select char_length(c1), c2, char_length(c3) from t_ld_heap order by 1,2,3;
char_length(c1)	c2	char_length(c3)
4	4	8193
4	4	8193
100	1	100
100	1	100
8193	2	4
8193	2	4
16373	3	4
16373	3	4
create table t1 (c1 int, c2 string, c3 char(10), primary key(c1, c2)) with column group(each column);
insert into t1 values (1, "hello", "world");
insert into t1 values (2, "ocean", "base");
select * from t1;
c1	c2	c3
1	hello	world
2	ocean	base
select c1 from t1;
c1
1
2
alter system major freeze;
select * from t1;
c1	c2	c3
1	hello	world
2	ocean	base
select c1 from t1;
c1
1
2
drop table t_col, t_pr1, t_pr2, t_idx1, t_idx2, t_idx3, t_g_idx1, t_g_idx2, t_g_idx3;
drop table  t_src, t_dst, t_dst_inc, t_dst_full, t_dst_full1, t_dst_full2, t_ld_inc, t_ld_full, t_dst_heap, t_ld_heap;
drop table t1;
