create table t_mod_col1(c1 string, c2 string, c3 string, c4 string, c5 string, c6 string, c7 string, c8 string);
create table t_mod_col2(c1 int, c2 char(20), c3 varchar(30), c4 binary(10), c5 mediumtext, c6 longtext, c7 text, c8 blob, c9 set('a','b','c'));
create table t_add_col1(c1 int);
insert into t_add_col1 values(1), (2), (3), (4);
alter table t_add_col1 add c2 string;
alter table t_add_col1 add c3 string not null;
create index idx_c2 on t_add_col1(c2);
create index idx_c3 on t_add_col1(c3);
create index idx_c1_c2 on t_add_col1(c1, c2);
create table t_add_col2(c1 int);
insert into t_add_col2 values(1), (2), (3), (4);
alter table t_add_col2 add c2 string;
alter table t_add_col2 add c3 string not null;
alter system minor freeze;
create index idx_c2 on t_add_col2(c2);
create index idx_c3 on t_add_col2(c3);
create index idx_c1_c2 on t_add_col2(c1, c2);
create table t_add_pk1 (c1 string, c2 varchar(262144), c3 varchar(126977));
create table t_add_pk2 (c1 string, c2 double, c3 string, c4 varchar(262144), c5 varchar(126976));
create table t_add_pk3 (c1 varchar(3969), c2 string);
create table t_alt_pk1 (c1 varchar(4096), c2 varchar(262144), c3 varchar(126976), primary key(c1));
create table t_alt_pk2 (c1 varchar(4095), c2 varchar(262144), c3 varchar(126977), primary key(c1));
create table t_alt_pk3 (c1 varchar(262144), c2 varchar(126976), c3 string, primary key(c3));
create table t_alt_pk4 (c1 varchar(262144), c2 string, c3 varchar(126976), c4 string,  primary key(c2, c4));
create table t_alt_pk5 (c1 varchar(3969), c2 varchar(127), c3 varchar(3), primary key(c1, c2));
alter system major freeze;
alter table t_mod_col1 modify column c1 int;
alter table t_mod_col1 modify column c2 char(10);
alter table t_mod_col1 modify column c3 varchar(10);
alter table t_mod_col1 modify column c4 binary(10);
alter table t_mod_col1 modify column c5 mediumtext;
alter table t_mod_col1 modify column c6 longtext;
alter table t_mod_col1 modify column c7 text;
alter table t_mod_col1 modify column c8 blob;
alter table t_mod_col1 rename column c2 to a1;
alter table t_mod_col1 rename column c1 to a1, rename column a1 to a2;
show create table t_mod_col1;
Table	Create Table
t_mod_col1	CREATE TABLE `t_mod_col1` (
  `a1` int(11) DEFAULT NULL,
  `a2` char(10) DEFAULT NULL,
  `c3` varchar(10) DEFAULT NULL,
  `c4` binary(10) DEFAULT NULL,
  `c5` mediumtext DEFAULT NULL,
  `c6` longtext DEFAULT NULL,
  `c7` text DEFAULT NULL,
  `c8` blob DEFAULT NULL
) ORGANIZATION INDEX DEFAULT CHARSET = utf8mb4 COMPRESSION = 'lz4_1.0' REPLICA_NUM = 1 BLOCK_SIZE = 16384 USE_BLOOM_FILTER = FALSE ENABLE_MACRO_BLOCK_BLOOM_FILTER = FALSE TABLET_SIZE = 134217728 PCTFREE = 10
select min(a1), max(a1), min(a2), max(a2), min(c3), max(c3), min(HEX(c4)), max(HEX(c4)), min(c5), max(c5), min(c6), max(c6), min(c7), max(c7), min(c8), max(c8) from t_mod_col1;
min(a1)	max(a1)	min(a2)	max(a2)	min(c3)	max(c3)	min(HEX(c4))	max(HEX(c4))	min(c5)	max(c5)	min(c6)	max(c6)	min(c7)	max(c7)	min(c8)	max(c8)
0	99	bb0	bb99	ccc0	ccc99	64646464300000000000	64646464393900000000	e0	e99	ff0	ff99	ggg0	ggg99	hhhh0	hhhh99
alter table t_mod_col1 modify column c5 string not null;
ERROR 22004: Invalid use of NULL value
update t_mod_col1 set c5 = "not null" where c5 is null;
alter table t_mod_col1 modify column c5 string not null;
insert into t_mod_col1 values (NULL, NULL, NULL, NULL, NULL, NULL, NULL, NULL);
ERROR 23000: Column 'c5' cannot be null
show create table t_mod_col1;
Table	Create Table
t_mod_col1	CREATE TABLE `t_mod_col1` (
  `a1` int(11) DEFAULT NULL,
  `a2` char(10) DEFAULT NULL,
  `c3` varchar(10) DEFAULT NULL,
  `c4` binary(10) DEFAULT NULL,
  `c5` string NOT NULL,
  `c6` longtext DEFAULT NULL,
  `c7` text DEFAULT NULL,
  `c8` blob DEFAULT NULL
) ORGANIZATION INDEX DEFAULT CHARSET = utf8mb4 COMPRESSION = 'lz4_1.0' REPLICA_NUM = 1 BLOCK_SIZE = 16384 USE_BLOOM_FILTER = FALSE ENABLE_MACRO_BLOCK_BLOOM_FILTER = FALSE TABLET_SIZE = 134217728 PCTFREE = 10
select min(a1), max(a1), min(a2), max(a2), min(c3), max(c3), min(HEX(c4)), max(HEX(c4)), min(c5), max(c5), min(c6), max(c6), min(c7), max(c7), min(c8), max(c8) from t_mod_col1;
min(a1)	max(a1)	min(a2)	max(a2)	min(c3)	max(c3)	min(HEX(c4))	max(HEX(c4))	min(c5)	max(c5)	min(c6)	max(c6)	min(c7)	max(c7)	min(c8)	max(c8)
0	99	bb0	bb99	ccc0	ccc99	64646464300000000000	64646464393900000000	e0	not null	ff0	ff99	ggg0	ggg99	hhhh0	hhhh99
alter table t_mod_col2 modify column c1 string;
alter table t_mod_col2 modify column c2 string;
alter table t_mod_col2 modify column c3 string;
alter table t_mod_col2 modify column c4 string;
alter table t_mod_col2 modify column c5 string;
alter table t_mod_col2 modify column c6 string;
alter table t_mod_col2 modify column c7 string;
alter table t_mod_col2 modify column c8 string;
alter table t_mod_col2 modify column c9 string;
show create table t_mod_col2;
Table	Create Table
t_mod_col2	CREATE TABLE `t_mod_col2` (
  `c1` string DEFAULT NULL,
  `c2` string DEFAULT NULL,
  `c3` string DEFAULT NULL,
  `c4` string DEFAULT NULL,
  `c5` string DEFAULT NULL,
  `c6` string DEFAULT NULL,
  `c7` string DEFAULT NULL,
  `c8` string DEFAULT NULL,
  `c9` string DEFAULT NULL
) ORGANIZATION INDEX DEFAULT CHARSET = utf8mb4 COMPRESSION = 'lz4_1.0' REPLICA_NUM = 1 BLOCK_SIZE = 16384 USE_BLOOM_FILTER = FALSE ENABLE_MACRO_BLOCK_BLOOM_FILTER = FALSE TABLET_SIZE = 134217728 PCTFREE = 10
select min(c1), max(c1), min(c2), max(c2), min(c3), max(c3), min(HEX(c4)), max(HEX(c4)), min(c5), max(c5), min(c6), max(c6), min(c7), max(c7), min(c8), max(c8), min(c9), max(c9) from t_mod_col2;
min(c1)	max(c1)	min(c2)	max(c2)	min(c3)	max(c3)	min(HEX(c4))	max(HEX(c4))	min(c5)	max(c5)	min(c6)	max(c6)	min(c7)	max(c7)	min(c8)	max(c8)	min(c9)	max(c9)
0	9	bb0	bb9	ccc0	ccc9	64646464300000000000	64646464390000000000	e0	e9	ff0	ff9	ggg0	ggg9	hhhh0	hhhh9	a	c
alter table t_add_pk1 add primary key(c1);
ERROR 42000: Row size too large
alter table t_add_pk2 add primary key(c1);
ERROR 42000: Row size too large
alter table t_add_pk2 add primary key(c1, c2, c3);
alter table t_add_pk3 modify c1 varchar(3968);
alter table t_add_pk3 add primary key (c1, c2);
alter table t_alt_pk1 modify c1 string;
alter table t_alt_pk2 modify c1 string;
ERROR 42000: Row size too large
alter table t_alt_pk3 modify c3 varchar(2048);
alter table t_alt_pk3 add column c4 varchar(2048);
alter table t_alt_pk4 modify c2 varchar(2048);
alter table t_alt_pk4 add column c5 varchar(2048);
ERROR 42000: Row size too large
alter table t_alt_pk5 modify c2 string;
alter table t_alt_pk5 modify c1 varchar(3968);
alter table t_alt_pk5 modify c2 string;
drop table t_add_pk1, t_add_pk2, t_add_pk3, t_alt_pk1, t_alt_pk2, t_alt_pk3, t_alt_pk4, t_alt_pk5;
drop table t_add_col1, t_add_col2, t_mod_col1, t_mod_col2;
