result_format: 4
create sequence s1 cache 100000 order;

create table t1 (c1 string, c2 int, c3 string, c4 string, c5 string, primary key(c1, c2)) row_format = redundant;
insert into t1(c1,c2,c3,c4,c5) select randstr(10, random(0)) c1, s1.nextval c2, randstr(10, random(1)) c3, randstr(10, random(2)) c4, randstr(50, random(3)) c5 from table(generator(100000));

create table t2 (c1 string primary key);
create table t2_fk (c1 string, constraint t1 foreign key (c1) references t2(c1) on update cascade on delete cascade);
insert into t2 values ("key1");
insert into t2_fk values ("key1");
insert into t2 values ("key2");
insert into t2_fk values ("key3");
ERROR 23000: Cannot add or update a child row: a foreign key constraint fails

select * from t2;
+------+
| c1   |
+------+
| key1 |
| key2 |
+------+
select * from t2_fk;
+------+
| c1   |
+------+
| key1 |
+------+

alter system major freeze;
select /*+parallel(2)*/ * from t1 where c2 > 2000 and c2 < 2020 order by c2;
+------------+------+------------+------------+----------------------------------------------------+
| c1         | c2   | c3         | c4         | c5                                                 |
+------------+------+------------+------------+----------------------------------------------------+
| YlAbMBcRgt | 2001 | fYDoJoboJa | FkpOvyZwpM | x4p8di9kXE7Y9ghsPAvgR0jq7AP4XS18lwF8dUDCbKZMtebwFO |
| z4XgzEzWLA | 2002 | R0hOfslg3c | IJedcVYhGn | RapAXAlwt6j0pgzyP0tCB0XadmzMf6Ryj8Fcva3OZUl8zGZMVm |
| UHaD8hW9uX | 2003 | pSVUFof4ng | zSNGVs9WvS | juRujKREj25wnqbGBmhgDQnGLOps76vi5yHahAL23yTyVsbw1K |
| 5Ubu3GtobE | 2004 | l65u9aL0dU | 4DUr4vGryn | EbSpuriB6L0PIVctG7itoPKTu9kzE7uR4LG3c9gx2f2bGpUf65 |
| FQfqxylePy | 2005 | g9oRGvsvQB | gnAFOjkzYD | tc14vwjWNkBUnwNKD2XkPszgPUFOXQZMx4R2TGnoH4tA56r0ta |
| yhcJorspav | 2006 | 1CLeH2nGLC | iLCPSBytAf | aNcbOXk7Gzm16T41uTKxmDiH2DobAlGHitw5efc3U5avG7mxWd |
| ATUhUTK5C5 | 2007 | JOZQvuvKJg | fAD8P8vKfi | evI3O7cxeHwLGZcJi5sbyTEVqRkZyX2l01G9CtGHqliZctctmH |
| V6FepWjyNk | 2008 | IDaRYLsxAD | hyJeDWJQjo | AbAXW1WpwdyhaJYJuFkbYvwtc3elO1ATMzulkroBwxoTwhMher |
| L4z8jkhMva | 2009 | Bm30RwpQBg | G76nCPYfyd | Zc5k3Spq7mxADGzqB6Xk9cFmHmnq54t2r6d052ZGHkXSj4TGN6 |
| jgbWnsjOVk | 2010 | tYTGPmzMtY | Fw5s9UPU1a | NixytCdYhmHQBsNSpI1cRMDqnczOvaBypAfyJSbUlAbmjm9EBa |
| Dy1sTgtyzu | 2011 | xu3yRaNM9w | itSFkxW7yH | pmZOJSxCfEHujUhmDWvWxstUFyPYvePMNQP0Helg7gnMNCPKhM |
| 98XIvgNQpI | 2012 | IFQpmFcXed | 6Tu3iR0rCp | atsNq7eBi5Q9SByvsjqtQDO98BO7o1g5Ibo3efcZ2FMdmHahgn |
| zGru7Wz2ra | 2013 | 2jenWTkP6b | NY7gPqNq5w | DovWbirqXinApepqpuXIbkzSJENehwp4LSnAZ8faTIf83MzqpA |
| NUFSBAl0bg | 2014 | Sfk3QJsbmP | Xe76ZAJ0Lw | Z8JORmp2D6RIdETGREfIfCP2ZY34DkTuZKXQ3khARSZ8fAZgDI |
| 2dWF8jkVyV | 2015 | axk34HujGv | OjKTgLeNyd | ZohApWfeb4PYzevYTAru1idw5GzSH2VATgzgRuJ6PiVufSbE3g |
| 6bG3YzCd4R | 2016 | RmTk1kLgP8 | ELa1OlCLqn | OZYFKryt8ZY7i3INMb8J6TqPKlID2Xwz6jcbmDiH0RujUNe5S3 |
| 01G7AX6f6X | 2017 | 5iHofQDihC | Dit0LS7sda | LeBMNONSJglI3y9WzKhCv8riBmNchcLmlULSNIL6XspAfafwHg |
| 1IbERk30NW | 2018 | CFKzYxGPAD | R2TkZo5uNw | kHUXAdilS9ShQjQ9GPCHwjU9qbyd8HGlOxmjW5q7sPUJgjGxaJ |
| 8xGRa1gboL | 2019 | K7ENeRkfyZ | zUf4NWvy7K | 1CziDmlCBqpenCzM1YjEz2DiZITmzo94tGrgRyBipqFGPI3kn4 |
+------------+------+------------+------------+----------------------------------------------------+
delete from t1 where c2 in (2011, 2012);
select /*+parallel(2)*/ * from t1 where c2 > 2000 and c2 < 2020 order by c2;
+------------+------+------------+------------+----------------------------------------------------+
| c1         | c2   | c3         | c4         | c5                                                 |
+------------+------+------------+------------+----------------------------------------------------+
| YlAbMBcRgt | 2001 | fYDoJoboJa | FkpOvyZwpM | x4p8di9kXE7Y9ghsPAvgR0jq7AP4XS18lwF8dUDCbKZMtebwFO |
| z4XgzEzWLA | 2002 | R0hOfslg3c | IJedcVYhGn | RapAXAlwt6j0pgzyP0tCB0XadmzMf6Ryj8Fcva3OZUl8zGZMVm |
| UHaD8hW9uX | 2003 | pSVUFof4ng | zSNGVs9WvS | juRujKREj25wnqbGBmhgDQnGLOps76vi5yHahAL23yTyVsbw1K |
| 5Ubu3GtobE | 2004 | l65u9aL0dU | 4DUr4vGryn | EbSpuriB6L0PIVctG7itoPKTu9kzE7uR4LG3c9gx2f2bGpUf65 |
| FQfqxylePy | 2005 | g9oRGvsvQB | gnAFOjkzYD | tc14vwjWNkBUnwNKD2XkPszgPUFOXQZMx4R2TGnoH4tA56r0ta |
| yhcJorspav | 2006 | 1CLeH2nGLC | iLCPSBytAf | aNcbOXk7Gzm16T41uTKxmDiH2DobAlGHitw5efc3U5avG7mxWd |
| ATUhUTK5C5 | 2007 | JOZQvuvKJg | fAD8P8vKfi | evI3O7cxeHwLGZcJi5sbyTEVqRkZyX2l01G9CtGHqliZctctmH |
| V6FepWjyNk | 2008 | IDaRYLsxAD | hyJeDWJQjo | AbAXW1WpwdyhaJYJuFkbYvwtc3elO1ATMzulkroBwxoTwhMher |
| L4z8jkhMva | 2009 | Bm30RwpQBg | G76nCPYfyd | Zc5k3Spq7mxADGzqB6Xk9cFmHmnq54t2r6d052ZGHkXSj4TGN6 |
| jgbWnsjOVk | 2010 | tYTGPmzMtY | Fw5s9UPU1a | NixytCdYhmHQBsNSpI1cRMDqnczOvaBypAfyJSbUlAbmjm9EBa |
| zGru7Wz2ra | 2013 | 2jenWTkP6b | NY7gPqNq5w | DovWbirqXinApepqpuXIbkzSJENehwp4LSnAZ8faTIf83MzqpA |
| NUFSBAl0bg | 2014 | Sfk3QJsbmP | Xe76ZAJ0Lw | Z8JORmp2D6RIdETGREfIfCP2ZY34DkTuZKXQ3khARSZ8fAZgDI |
| 2dWF8jkVyV | 2015 | axk34HujGv | OjKTgLeNyd | ZohApWfeb4PYzevYTAru1idw5GzSH2VATgzgRuJ6PiVufSbE3g |
| 6bG3YzCd4R | 2016 | RmTk1kLgP8 | ELa1OlCLqn | OZYFKryt8ZY7i3INMb8J6TqPKlID2Xwz6jcbmDiH0RujUNe5S3 |
| 01G7AX6f6X | 2017 | 5iHofQDihC | Dit0LS7sda | LeBMNONSJglI3y9WzKhCv8riBmNchcLmlULSNIL6XspAfafwHg |
| 1IbERk30NW | 2018 | CFKzYxGPAD | R2TkZo5uNw | kHUXAdilS9ShQjQ9GPCHwjU9qbyd8HGlOxmjW5q7sPUJgjGxaJ |
| 8xGRa1gboL | 2019 | K7ENeRkfyZ | zUf4NWvy7K | 1CziDmlCBqpenCzM1YjEz2DiZITmzo94tGrgRyBipqFGPI3kn4 |
+------------+------+------------+------------+----------------------------------------------------+

insert into t2_fk values ("key1");
insert into t2_fk values ("key2");
insert into t2_fk values ("key3");
ERROR 23000: Cannot add or update a child row: a foreign key constraint fails

select * from t2;
+------+
| c1   |
+------+
| key1 |
| key2 |
+------+
select * from t2_fk;
+------+
| c1   |
+------+
| key1 |
| key1 |
| key2 |
+------+

drop table t1, t2_fk, t2;
drop sequence s1;

