purge recyclebin;
result_format: 4
drop user whh@'%';
create user whh identified by 'whh';
grant all on *.* to whh WITH GRANT OPTION;


-----------------------------------------------------------------------------------------------------------------
------------------------- 语句摘要函数-statement_digest(statement)/statement_digest_text(statement)--------------
###### 标签：digest-2 statement_digest(statement)/statement_digest_text(statement) - 参数类型 
-----------------------------------------------------------------------------------------------------------------
######################### 标签：digest-2-1 参数类型 - 数值类型 #########################
DROP TABLE digest_table1;
CREATE TABLE digest_table1( 
  c1 tinyint, 
  c2 smallint,
  c3 mediumint, 
  c4 int, 
  c5 bigint, 
  c6 float, 
  c7 double, 
  c8 DECIMAL(5,2), 
  c9 bit(10)
);
## 没有插入数据场合
select statement_digest(c1) digest,statement_digest_text(c1) digest_text from digest_table1;
+--------+-------------+
| digest | digest_text |
+--------+-------------+
+--------+-------------+
select statement_digest(c2) digest,statement_digest_text(c2) digest_text from digest_table1;
+--------+-------------+
| digest | digest_text |
+--------+-------------+
+--------+-------------+
select statement_digest(c3) digest,statement_digest_text(c3) digest_text from digest_table1;
+--------+-------------+
| digest | digest_text |
+--------+-------------+
+--------+-------------+
select statement_digest(c4) digest,statement_digest_text(c4) digest_text from digest_table1;
+--------+-------------+
| digest | digest_text |
+--------+-------------+
+--------+-------------+
select statement_digest(c5) digest,statement_digest_text(c5) digest_text from digest_table1;
+--------+-------------+
| digest | digest_text |
+--------+-------------+
+--------+-------------+
select statement_digest(c6) digest,statement_digest_text(c6) digest_text from digest_table1;
+--------+-------------+
| digest | digest_text |
+--------+-------------+
+--------+-------------+
select statement_digest(c7) digest,statement_digest_text(c7) digest_text from digest_table1;
+--------+-------------+
| digest | digest_text |
+--------+-------------+
+--------+-------------+
select statement_digest(c8) digest,statement_digest_text(c8) digest_text from digest_table1;
+--------+-------------+
| digest | digest_text |
+--------+-------------+
+--------+-------------+
select statement_digest(c9) digest,statement_digest_text(c9) digest_text from digest_table1;
+--------+-------------+
| digest | digest_text |
+--------+-------------+
+--------+-------------+
## 插入数据 null 场合
delete from digest_table1;
insert into digest_table1 values(null,null,null,null,null,null,null,null,null);
select statement_digest(c1) digest,statement_digest_text(c1) digest_text from digest_table1;
+--------+-------------+
| digest | digest_text |
+--------+-------------+
| NULL   | NULL        |
+--------+-------------+
select statement_digest(c2) digest,statement_digest_text(c2) digest_text from digest_table1;
+--------+-------------+
| digest | digest_text |
+--------+-------------+
| NULL   | NULL        |
+--------+-------------+
select statement_digest(c3) digest,statement_digest_text(c3) digest_text from digest_table1;
+--------+-------------+
| digest | digest_text |
+--------+-------------+
| NULL   | NULL        |
+--------+-------------+
select statement_digest(c4) digest,statement_digest_text(c4) digest_text from digest_table1;
+--------+-------------+
| digest | digest_text |
+--------+-------------+
| NULL   | NULL        |
+--------+-------------+
select statement_digest(c5) digest,statement_digest_text(c5) digest_text from digest_table1;
+--------+-------------+
| digest | digest_text |
+--------+-------------+
| NULL   | NULL        |
+--------+-------------+
select statement_digest(c6) digest,statement_digest_text(c6) digest_text from digest_table1;
+--------+-------------+
| digest | digest_text |
+--------+-------------+
| NULL   | NULL        |
+--------+-------------+
select statement_digest(c7) digest,statement_digest_text(c7) digest_text from digest_table1;
+--------+-------------+
| digest | digest_text |
+--------+-------------+
| NULL   | NULL        |
+--------+-------------+
select statement_digest(c8) digest,statement_digest_text(c8) digest_text from digest_table1;
+--------+-------------+
| digest | digest_text |
+--------+-------------+
| NULL   | NULL        |
+--------+-------------+
select statement_digest(c9) digest,statement_digest_text(c9) digest_text from digest_table1;
+--------+-------------+
| digest | digest_text |
+--------+-------------+
| NULL   | NULL        |
+--------+-------------+
## 插入数据 0 场合
insert into digest_table1 values(0,0,0,0,0,0,0,0,0);
select statement_digest(c1) digest,statement_digest_text(c1) digest_text from digest_table1;
ERROR 42000: You have an error in your SQL syntax; check the manual that corresponds to your OceanBase version for the right syntax to use near '0' at line 1
select statement_digest(c2) digest,statement_digest_text(c2) digest_text from digest_table1;
ERROR 42000: You have an error in your SQL syntax; check the manual that corresponds to your OceanBase version for the right syntax to use near '0' at line 1
select statement_digest(c3) digest,statement_digest_text(c3) digest_text from digest_table1;
ERROR 42000: You have an error in your SQL syntax; check the manual that corresponds to your OceanBase version for the right syntax to use near '0' at line 1
select statement_digest(c4) digest,statement_digest_text(c4) digest_text from digest_table1;
ERROR 42000: You have an error in your SQL syntax; check the manual that corresponds to your OceanBase version for the right syntax to use near '0' at line 1
select statement_digest(c5) digest,statement_digest_text(c5) digest_text from digest_table1;
ERROR 42000: You have an error in your SQL syntax; check the manual that corresponds to your OceanBase version for the right syntax to use near '0' at line 1
select statement_digest(c6) digest,statement_digest_text(c6) digest_text from digest_table1;
ERROR 42000: You have an error in your SQL syntax; check the manual that corresponds to your OceanBase version for the right syntax to use near '0' at line 1
select statement_digest(c7) digest,statement_digest_text(c7) digest_text from digest_table1;
ERROR 42000: You have an error in your SQL syntax; check the manual that corresponds to your OceanBase version for the right syntax to use near '0' at line 1
select statement_digest(c8) digest,statement_digest_text(c8) digest_text from digest_table1;
ERROR 42000: You have an error in your SQL syntax; check the manual that corresponds to your OceanBase version for the right syntax to use near '0.00' at line 1
select statement_digest(c9) digest,statement_digest_text(c9) digest_text from digest_table1;
ERROR HY000: Incorrect arguments to digest function
## 插入数据 >0 场合
delete from digest_table1;
insert into digest_table1 values(127,32767,8388607,2147483647,12345678912345678,1.1111,123.1231123,1.1,b'1000001');
select statement_digest(c1) digest,statement_digest_text(c1) digest_text from digest_table1;
ERROR 42000: You have an error in your SQL syntax; check the manual that corresponds to your OceanBase version for the right syntax to use near '127' at line 1
select statement_digest(c2) digest,statement_digest_text(c2) digest_text from digest_table1;
ERROR 42000: You have an error in your SQL syntax; check the manual that corresponds to your OceanBase version for the right syntax to use near '32767' at line 1
select statement_digest(c3) digest,statement_digest_text(c3) digest_text from digest_table1;
ERROR 42000: You have an error in your SQL syntax; check the manual that corresponds to your OceanBase version for the right syntax to use near '8388607' at line 1
select statement_digest(c4) digest,statement_digest_text(c4) digest_text from digest_table1;
ERROR 42000: You have an error in your SQL syntax; check the manual that corresponds to your OceanBase version for the right syntax to use near '2147483647' at line 1
select statement_digest(c5) digest,statement_digest_text(c5) digest_text from digest_table1;
ERROR 42000: You have an error in your SQL syntax; check the manual that corresponds to your OceanBase version for the right syntax to use near '12345678912345678' at line 1
select statement_digest(c6) digest,statement_digest_text(c6) digest_text from digest_table1;
ERROR 42000: You have an error in your SQL syntax; check the manual that corresponds to your OceanBase version for the right syntax to use near '1.1111' at line 1
select statement_digest(c7) digest,statement_digest_text(c7) digest_text from digest_table1;
ERROR 42000: You have an error in your SQL syntax; check the manual that corresponds to your OceanBase version for the right syntax to use near '123.1231123' at line 1
select statement_digest(c8) digest,statement_digest_text(c8) digest_text from digest_table1;
ERROR 42000: You have an error in your SQL syntax; check the manual that corresponds to your OceanBase version for the right syntax to use near '1.10' at line 1
select statement_digest(c9) digest,statement_digest_text(c9) digest_text from digest_table1;
ERROR 42000: You have an error in your SQL syntax; check the manual that corresponds to your OceanBase version for the right syntax to use near '' at line 1
## 插入数据 <=0 场合
delete from digest_table1;
insert into digest_table1 values(-128,-32768,-8388608,-2147483648,-2147483648,0.0,0.00,0.0,b'0');
select statement_digest(c1) digest,statement_digest_text(c1) digest_text from digest_table1;
ERROR 42000: You have an error in your SQL syntax; check the manual that corresponds to your OceanBase version for the right syntax to use near '-128' at line 1
select statement_digest(c2) digest,statement_digest_text(c2) digest_text from digest_table1;
ERROR 42000: You have an error in your SQL syntax; check the manual that corresponds to your OceanBase version for the right syntax to use near '-32768' at line 1
select statement_digest(c3) digest,statement_digest_text(c3) digest_text from digest_table1;
ERROR 42000: You have an error in your SQL syntax; check the manual that corresponds to your OceanBase version for the right syntax to use near '-8388608' at line 1
select statement_digest(c4) digest,statement_digest_text(c4) digest_text from digest_table1;
ERROR 42000: You have an error in your SQL syntax; check the manual that corresponds to your OceanBase version for the right syntax to use near '-2147483648' at line 1
select statement_digest(c5) digest,statement_digest_text(c5) digest_text from digest_table1;
ERROR 42000: You have an error in your SQL syntax; check the manual that corresponds to your OceanBase version for the right syntax to use near '-2147483648' at line 1
select statement_digest(c6) digest,statement_digest_text(c6) digest_text from digest_table1;
ERROR 42000: You have an error in your SQL syntax; check the manual that corresponds to your OceanBase version for the right syntax to use near '0' at line 1
select statement_digest(c7) digest,statement_digest_text(c7) digest_text from digest_table1;
ERROR 42000: You have an error in your SQL syntax; check the manual that corresponds to your OceanBase version for the right syntax to use near '0' at line 1
select statement_digest(c8) digest,statement_digest_text(c8) digest_text from digest_table1;
ERROR 42000: You have an error in your SQL syntax; check the manual that corresponds to your OceanBase version for the right syntax to use near '0.00' at line 1
select statement_digest(c9) digest,statement_digest_text(c9) digest_text from digest_table1;
ERROR HY000: Incorrect arguments to digest function
######################### 标签：digest-2-2 参数类型 - 字符串类型 #########################
DROP TABLE digest_table1;
CREATE TABLE digest_table1( 
  c1 CHAR(200), 
  c2 VARCHAR(200), 
  c3 BLOB(200), 
  c4 TEXT, 
  c5 BINARY(200),
  c6 VARBINARY(200), 
  c7 ENUM('','INSERT INTO t1(col1,col2) VALUES(15,col1*2)', 'DELETE FROM t1 WHERE c1 = "jcole" ORDER BY c2 LIMIT 1', 'UPDATE t1 SET id = id + 1 ORDER BY id DESC LIMIT 10', 'SELECT * FROM tl WHERE id < 20 ORDER BY c1,c2 LIMIT 1,5'), 
  c8 SET('','INSERT INTO t2 VALUES(col1*3)','DELETE FROM t2 WHERE c1 = "jcole" ORDER BY c2 LIMIT 2','UPDATE t2 SET id = id + 3 ORDER BY id DESC LIMIT 20','SELECT * FROM t2 WHERE id >= 20 ORDER BY c1 LIMIT 5')
)default character set = 'utf8mb4';
## 没有插入数据场合
select statement_digest(c1) digest,statement_digest_text(c1) digest_text from digest_table1;
+--------+-------------+
| digest | digest_text |
+--------+-------------+
+--------+-------------+
select statement_digest(c2) digest,statement_digest_text(c2) digest_text from digest_table1;
+--------+-------------+
| digest | digest_text |
+--------+-------------+
+--------+-------------+
select statement_digest(c3) digest,statement_digest_text(c3) digest_text from digest_table1;
+--------+-------------+
| digest | digest_text |
+--------+-------------+
+--------+-------------+
select statement_digest(c4) digest,statement_digest_text(c4) digest_text from digest_table1;
+--------+-------------+
| digest | digest_text |
+--------+-------------+
+--------+-------------+
select statement_digest(c5) digest,statement_digest_text(c5) digest_text from digest_table1;
+--------+-------------+
| digest | digest_text |
+--------+-------------+
+--------+-------------+
select statement_digest(c6) digest,statement_digest_text(c6) digest_text from digest_table1;
+--------+-------------+
| digest | digest_text |
+--------+-------------+
+--------+-------------+
select statement_digest(c7) digest,statement_digest_text(c7) digest_text from digest_table1;
+--------+-------------+
| digest | digest_text |
+--------+-------------+
+--------+-------------+
select statement_digest(c8) digest,statement_digest_text(c8) digest_text from digest_table1;
+--------+-------------+
| digest | digest_text |
+--------+-------------+
+--------+-------------+
## 插入数据 null 场合
delete from digest_table1;
insert into digest_table1 values(null,null,null,null,null,null,null,null);
select statement_digest(c1) digest,statement_digest_text(c1) digest_text from digest_table1;
+--------+-------------+
| digest | digest_text |
+--------+-------------+
| NULL   | NULL        |
+--------+-------------+
select statement_digest(c2) digest,statement_digest_text(c2) digest_text from digest_table1;
+--------+-------------+
| digest | digest_text |
+--------+-------------+
| NULL   | NULL        |
+--------+-------------+
select statement_digest(c3) digest,statement_digest_text(c3) digest_text from digest_table1;
+--------+-------------+
| digest | digest_text |
+--------+-------------+
| NULL   | NULL        |
+--------+-------------+
select statement_digest(c4) digest,statement_digest_text(c4) digest_text from digest_table1;
+--------+-------------+
| digest | digest_text |
+--------+-------------+
| NULL   | NULL        |
+--------+-------------+
select statement_digest(c5) digest,statement_digest_text(c5) digest_text from digest_table1;
+--------+-------------+
| digest | digest_text |
+--------+-------------+
| NULL   | NULL        |
+--------+-------------+
select statement_digest(c6) digest,statement_digest_text(c6) digest_text from digest_table1;
+--------+-------------+
| digest | digest_text |
+--------+-------------+
| NULL   | NULL        |
+--------+-------------+
select statement_digest(c7) digest,statement_digest_text(c7) digest_text from digest_table1;
+--------+-------------+
| digest | digest_text |
+--------+-------------+
| NULL   | NULL        |
+--------+-------------+
select statement_digest(c8) digest,statement_digest_text(c8) digest_text from digest_table1;
+--------+-------------+
| digest | digest_text |
+--------+-------------+
| NULL   | NULL        |
+--------+-------------+
## 插入数据 '' 场合
insert into digest_table1 values('','','','','','','','');
select statement_digest(c1) digest,statement_digest_text(c1) digest_text from digest_table1;
ERROR 42000: Query was empty
select statement_digest(c2) digest,statement_digest_text(c2) digest_text from digest_table1;
ERROR 42000: Query was empty
select statement_digest(c3) digest,statement_digest_text(c3) digest_text from digest_table1;
ERROR 42000: Query was empty
select statement_digest(c4) digest,statement_digest_text(c4) digest_text from digest_table1;
ERROR 42000: Query was empty
select statement_digest(c5) digest,statement_digest_text(c5) digest_text from digest_table1;
ERROR 42000: You have an error in your SQL syntax; check the manual that corresponds to your OceanBase version for the right syntax to use near '' at line 1
select statement_digest(c6) digest,statement_digest_text(c6) digest_text from digest_table1;
ERROR 42000: Query was empty
select statement_digest(c7) digest,statement_digest_text(c7) digest_text from digest_table1;
ERROR 42000: Query was empty
select statement_digest(c8) digest,statement_digest_text(c8) digest_text from digest_table1;
ERROR 42000: Query was empty
## 插入一条数据 场合
delete from digest_table1;
insert into digest_table1 values(
'INSERT INTO t1(col1,col2) VALUES(15,col1*2)',
'DELETE FROM t1 WHERE c1 = "jcole" ORDER BY c2 LIMIT 1',
'UPDATE t1 SET id = id + 1 ORDER BY id DESC LIMIT 10',
'SELECT * FROM tl WHERE id < 20 ORDER BY c1,c2 LIMIT 5,10',
'SELECT SLEEP(5)',
'DROP DATABASE test_db1',
'INSERT INTO t1(col1,col2) VALUES(15,col1*2)',
'INSERT INTO t2 VALUES(col1*3)');
select statement_digest(c1) digest,statement_digest_text(c1) digest_text from digest_table1;
+----------------------------------+---------------------------------------------------------+
| digest                           | digest_text                                             |
+----------------------------------+---------------------------------------------------------+
| 07E12363E5475E5AEC1DA3EFEE6F2B8B | INSERT INTO T1 ( COL1 , COL2 ) VALUES ( ? , COL1 * ? )  |
+----------------------------------+---------------------------------------------------------+
select statement_digest(c2) digest,statement_digest_text(c2) digest_text from digest_table1;
+----------------------------------+--------------------------------------------------+
| digest                           | digest_text                                      |
+----------------------------------+--------------------------------------------------+
| 6B45C7E521D4182703BE53509A6731BC | DELETE FROM T1 WHERE C1 = ? ORDER BY C2 LIMIT ?  |
+----------------------------------+--------------------------------------------------+
select statement_digest(c3) digest,statement_digest_text(c3) digest_text from digest_table1;
+----------------------------------+-----------------------------------------------------+
| digest                           | digest_text                                         |
+----------------------------------+-----------------------------------------------------+
| 5FBBFF977811F90EEAFF001C2CE56851 | UPDATE t1 SET id = id + ? ORDER BY id DESC LIMIT ?  |
+----------------------------------+-----------------------------------------------------+
select statement_digest(c4) digest,statement_digest_text(c4) digest_text from digest_table1;
+----------------------------------+-------------------------------------------------------------+
| digest                           | digest_text                                                 |
+----------------------------------+-------------------------------------------------------------+
| 976130B3FF574FA174F8FB8A533D9D68 | SELECT * FROM TL WHERE ID < ? ORDER BY C1 , C2 LIMIT ? , ?  |
+----------------------------------+-------------------------------------------------------------+
select statement_digest(REPLACE(c5,'\0','')) digest,statement_digest_text(REPLACE(c5,'\0','')) digest_text from digest_table1;
+----------------------------------+---------------------+
| digest                           | digest_text         |
+----------------------------------+---------------------+
| BC6BB61A683C1D9B9AB98AAC8BF13C09 | SELECT SLEEP ( ? )  |
+----------------------------------+---------------------+
select statement_digest(c6) digest,statement_digest_text(c6) digest_text from digest_table1;
+----------------------------------+------------------------+
| digest                           | digest_text            |
+----------------------------------+------------------------+
| 3F33C9E4025D4FAAAD44C1396FD9C4F0 | DROP DATABASE test_db1 |
+----------------------------------+------------------------+
select statement_digest(c7) digest,statement_digest_text(c7) digest_text from digest_table1;
+----------------------------------+---------------------------------------------------------+
| digest                           | digest_text                                             |
+----------------------------------+---------------------------------------------------------+
| 07E12363E5475E5AEC1DA3EFEE6F2B8B | INSERT INTO T1 ( COL1 , COL2 ) VALUES ( ? , COL1 * ? )  |
+----------------------------------+---------------------------------------------------------+
select statement_digest(c8) digest,statement_digest_text(c8) digest_text from digest_table1;
+----------------------------------+-------------------------------------+
| digest                           | digest_text                         |
+----------------------------------+-------------------------------------+
| 0695F8B3C30CBB4EF26B9793C330F44A | INSERT INTO T2 VALUES ( COL1 * ? )  |
+----------------------------------+-------------------------------------+
## 插入多条数据 场合
delete from digest_table1;
insert into digest_table1 values('INSERT INTO t1(col1,col2) VALUES(15,col1*2)','DELETE FROM t1 WHERE c1 = "jcole" ORDER BY c2 LIMIT 1','UPDATE t1 SET id = id + 1 ORDER BY id DESC LIMIT 10','SELECT * FROM tl WHERE id < 20 ORDER BY c1 LIMIT 5,10','SELECT SLEEP(5)','DROP DATABASE test_db1','DELETE FROM t1 WHERE c1 = "jcole" ORDER BY c2 LIMIT 1','DELETE FROM t2 WHERE c1 = "jcole" ORDER BY c2 LIMIT 2');
insert into digest_table1 values('INSERT INTO t1(col1,col2) VALUES(16,col1*3)','DELETE FROM t1 WHERE c1 = "whh" ORDER BY c2,c3 LIMIT 10','UPDATE t1 SET id = id + 3 ORDER BY id DESC LIMIT 20','SELECT * FROM tl WHERE id > 20 ORDER BY c2 LIMIT 5,10','SELECT SLEEP(15)','DROP DATABASE test_db2','UPDATE t1 SET id = id + 1 ORDER BY id DESC LIMIT 10','UPDATE t2 SET id = id + 3 ORDER BY id DESC LIMIT 20');
insert into digest_table1 values('INSERT INTO t1(col1,col2) VALUES(17,col1*4)','DELETE FROM t1 WHERE c1 = "zhx" ORDER BY c1 LIMIT 20','UPDATE t1 SET id = id + 5 ORDER BY id DESC LIMIT 30','SELECT * FROM tl WHERE id = 20 ORDER BY c1,c2 LIMIT 5,10','SELECT SLEEP(20)','DROP DATABASE test_db3','SELECT * FROM tl WHERE id < 20 ORDER BY c1,c2 LIMIT 1,5','SELECT * FROM t2 WHERE id >= 20 ORDER BY c1 LIMIT 5');
select statement_digest(c1) digest,statement_digest_text(c1) digest_text from digest_table1;
+----------------------------------+---------------------------------------------------------+
| digest                           | digest_text                                             |
+----------------------------------+---------------------------------------------------------+
| 07E12363E5475E5AEC1DA3EFEE6F2B8B | INSERT INTO T1 ( COL1 , COL2 ) VALUES ( ? , COL1 * ? )  |
| 07E12363E5475E5AEC1DA3EFEE6F2B8B | INSERT INTO T1 ( COL1 , COL2 ) VALUES ( ? , COL1 * ? )  |
| 07E12363E5475E5AEC1DA3EFEE6F2B8B | INSERT INTO T1 ( COL1 , COL2 ) VALUES ( ? , COL1 * ? )  |
+----------------------------------+---------------------------------------------------------+
select statement_digest(c2) digest,statement_digest_text(c2) digest_text from digest_table1;
+----------------------------------+-------------------------------------------------------+
| digest                           | digest_text                                           |
+----------------------------------+-------------------------------------------------------+
| 6B45C7E521D4182703BE53509A6731BC | DELETE FROM T1 WHERE C1 = ? ORDER BY C2 LIMIT ?       |
| 74ECA6E13C4D6D77EFA9661784D3B7E0 | DELETE FROM T1 WHERE C1 = ? ORDER BY C2 , C3 LIMIT ?  |
| 97120425FA49A5EFCC5D6DFA463B0E94 | DELETE FROM T1 WHERE C1 = ? ORDER BY C1 LIMIT ?       |
+----------------------------------+-------------------------------------------------------+
select statement_digest(c3) digest,statement_digest_text(c3) digest_text from digest_table1;
+----------------------------------+-----------------------------------------------------+
| digest                           | digest_text                                         |
+----------------------------------+-----------------------------------------------------+
| 5FBBFF977811F90EEAFF001C2CE56851 | UPDATE t1 SET id = id + ? ORDER BY id DESC LIMIT ?  |
| 5FBBFF977811F90EEAFF001C2CE56851 | UPDATE t1 SET id = id + ? ORDER BY id DESC LIMIT ?  |
| 5FBBFF977811F90EEAFF001C2CE56851 | UPDATE t1 SET id = id + ? ORDER BY id DESC LIMIT ?  |
+----------------------------------+-----------------------------------------------------+
select statement_digest(c4) digest,statement_digest_text(c4) digest_text from digest_table1;
+----------------------------------+-------------------------------------------------------------+
| digest                           | digest_text                                                 |
+----------------------------------+-------------------------------------------------------------+
| CCFBF1EC734AB34F10079AB571617616 | SELECT * FROM TL WHERE ID < ? ORDER BY C1 LIMIT ? , ?       |
| 3468ECEA717CC70DF5819DC947C1659C | SELECT * FROM TL WHERE ID > ? ORDER BY C2 LIMIT ? , ?       |
| BFE7FC16510E369BC49AA7262F9D39E5 | SELECT * FROM TL WHERE ID = ? ORDER BY C1 , C2 LIMIT ? , ?  |
+----------------------------------+-------------------------------------------------------------+
select statement_digest(REPLACE(c5,'\0','')) digest,statement_digest_text(REPLACE(c5,'\0','')) digest_text from digest_table1;
+----------------------------------+---------------------+
| digest                           | digest_text         |
+----------------------------------+---------------------+
| BC6BB61A683C1D9B9AB98AAC8BF13C09 | SELECT SLEEP ( ? )  |
| BC6BB61A683C1D9B9AB98AAC8BF13C09 | SELECT SLEEP ( ? )  |
| BC6BB61A683C1D9B9AB98AAC8BF13C09 | SELECT SLEEP ( ? )  |
+----------------------------------+---------------------+
select statement_digest(c6) digest,statement_digest_text(c6) digest_text from digest_table1;
+----------------------------------+------------------------+
| digest                           | digest_text            |
+----------------------------------+------------------------+
| 3F33C9E4025D4FAAAD44C1396FD9C4F0 | DROP DATABASE test_db1 |
| 6D8D6A44C7A95377181EF609F60B363F | DROP DATABASE test_db2 |
| 4B62F55D83B1746EE0D0D748D8D5D55D | DROP DATABASE test_db3 |
+----------------------------------+------------------------+
select statement_digest(c7) digest,statement_digest_text(c7) digest_text from digest_table1;
+----------------------------------+-------------------------------------------------------------+
| digest                           | digest_text                                                 |
+----------------------------------+-------------------------------------------------------------+
| 6B45C7E521D4182703BE53509A6731BC | DELETE FROM T1 WHERE C1 = ? ORDER BY C2 LIMIT ?             |
| B8F4078AF9A9144A7156B3C49A5B245A | UPDATE T1 SET ID = ID + ? ORDER BY ID DESC LIMIT ?          |
| 976130B3FF574FA174F8FB8A533D9D68 | SELECT * FROM TL WHERE ID < ? ORDER BY C1 , C2 LIMIT ? , ?  |
+----------------------------------+-------------------------------------------------------------+
select statement_digest(c8) digest,statement_digest_text(c8) digest_text from digest_table1;
+----------------------------------+------------------------------------------------------+
| digest                           | digest_text                                          |
+----------------------------------+------------------------------------------------------+
| 2D4241E15AC130766D99F6142A0DDDBA | DELETE FROM T2 WHERE C1 = ? ORDER BY C2 LIMIT ?      |
| BA1AD1353EC09CFD72EF760091EDEFB6 | UPDATE T2 SET ID = ID + ? ORDER BY ID DESC LIMIT ?   |
| 9527D91194EA3DCE495775609C5468A5 | SELECT * FROM T2 WHERE ID > = ? ORDER BY C1 LIMIT ?  |
+----------------------------------+------------------------------------------------------+
######################### 标签：digest-2-3,digest-2-4 参数类型 - 日期时间类型 ,json #########################
DROP TABLE digest_table1;
CREATE TABLE digest_table1( 
  c1 date, 
  c2 time, 
  c3 year, 
  c4 datetime, 
  c5 timestamp, 
  c6 json
);
## 没有插入数据场合
select statement_digest(c1) digest,statement_digest_text(c1) digest_text from digest_table1;
+--------+-------------+
| digest | digest_text |
+--------+-------------+
+--------+-------------+
select statement_digest(c2) digest,statement_digest_text(c2) digest_text from digest_table1;
+--------+-------------+
| digest | digest_text |
+--------+-------------+
+--------+-------------+
select statement_digest(c3) digest,statement_digest_text(c3) digest_text from digest_table1;
+--------+-------------+
| digest | digest_text |
+--------+-------------+
+--------+-------------+
select statement_digest(c4) digest,statement_digest_text(c4) digest_text from digest_table1;
+--------+-------------+
| digest | digest_text |
+--------+-------------+
+--------+-------------+
select statement_digest(c5) digest,statement_digest_text(c5) digest_text from digest_table1;
+--------+-------------+
| digest | digest_text |
+--------+-------------+
+--------+-------------+
select statement_digest(c6) digest,statement_digest_text(c6) digest_text from digest_table1;
+--------+-------------+
| digest | digest_text |
+--------+-------------+
+--------+-------------+
## 插入数据 null 场合
delete from digest_table1;
insert into digest_table1 values(null,null,null,null,null,null);
select statement_digest(c1) digest,statement_digest_text(c1) digest_text from digest_table1;
+--------+-------------+
| digest | digest_text |
+--------+-------------+
| NULL   | NULL        |
+--------+-------------+
select statement_digest(c2) digest,statement_digest_text(c2) digest_text from digest_table1;
+--------+-------------+
| digest | digest_text |
+--------+-------------+
| NULL   | NULL        |
+--------+-------------+
select statement_digest(c3) digest,statement_digest_text(c3) digest_text from digest_table1;
+--------+-------------+
| digest | digest_text |
+--------+-------------+
| NULL   | NULL        |
+--------+-------------+
select statement_digest(c4) digest,statement_digest_text(c4) digest_text from digest_table1;
+--------+-------------+
| digest | digest_text |
+--------+-------------+
| NULL   | NULL        |
+--------+-------------+
select statement_digest(c5) digest,statement_digest_text(c5) digest_text from digest_table1;
+--------+-------------+
| digest | digest_text |
+--------+-------------+
| NULL   | NULL        |
+--------+-------------+
select statement_digest(c6) digest,statement_digest_text(c6) digest_text from digest_table1;
+--------+-------------+
| digest | digest_text |
+--------+-------------+
| NULL   | NULL        |
+--------+-------------+
## 插入数据 数据 场合
delete from digest_table1;
insert into digest_table1 values('9999-12-31','23:59:59.99999999','2022','2022-12-31 23:59:59.999999','2022-01-01 03:26:07.999999','{"SELECT * FROM tl WHERE id < 20":1,"SELECT * FROM tl WHERE id < 20":1}');
select statement_digest(c1) digest,statement_digest_text(c1) digest_text from digest_table1;
ERROR 42000: You have an error in your SQL syntax; check the manual that corresponds to your OceanBase version for the right syntax to use near '9999-12-31' at line 1
select statement_digest(c2) digest,statement_digest_text(c2) digest_text from digest_table1;
ERROR 42000: You have an error in your SQL syntax; check the manual that corresponds to your OceanBase version for the right syntax to use near '24:00:00' at line 1
select statement_digest(c3) digest,statement_digest_text(c3) digest_text from digest_table1;
ERROR 42000: You have an error in your SQL syntax; check the manual that corresponds to your OceanBase version for the right syntax to use near '2022' at line 1
select statement_digest(c4) digest,statement_digest_text(c4) digest_text from digest_table1;
ERROR 42000: You have an error in your SQL syntax; check the manual that corresponds to your OceanBase version for the right syntax to use near '2023-01-01 00:00:00' at line 1
select statement_digest(c5) digest,statement_digest_text(c5) digest_text from digest_table1;
ERROR 42000: You have an error in your SQL syntax; check the manual that corresponds to your OceanBase version for the right syntax to use near '2022-01-01 03:26:08' at line 1
select statement_digest(c6) digest,statement_digest_text(c6) digest_text from digest_table1;
ERROR 42000: You have an error in your SQL syntax; check the manual that corresponds to your OceanBase version for the right syntax to use near '{"SELECT * FROM tl WHERE id < 20": 1}' at line 1
-----------------------------------------------------------------------------------------------------------------
------------------------- 语句摘要函数-statement_digest(statement)/statement_digest_text(statement)--------------
###### 标签：digest-3 statement_digest(statement)/statement_digest_text(statement) - 字符集        
-----------------------------------------------------------------------------------------------------------------
drop table digest_table1;
create table digest_table1(
  c1 VARCHAR(200)
)default character set = 'utf8mb4';
insert into digest_table1 values(null),('INSERT INTO t1(col1,col2) VALUES(15,col1*2)'),('INSERT INTO t1 (col1,col2) VALUES(15,col1*2)    '),('INSERT INTO t1 (col1,col2) VALUES(15,col1*2);');
select statement_digest(c1) digest,statement_digest_text(c1) digest_text from digest_table1;
+----------------------------------+-----------------------------------------------------------+
| digest                           | digest_text                                               |
+----------------------------------+-----------------------------------------------------------+
| NULL                             | NULL                                                      |
| 07E12363E5475E5AEC1DA3EFEE6F2B8B | INSERT INTO T1 ( COL1 , COL2 ) VALUES ( ? , COL1 * ? )    |
| 07E12363E5475E5AEC1DA3EFEE6F2B8B | INSERT INTO T1 ( COL1 , COL2 ) VALUES ( ? , COL1 * ? )    |
| 6FBE408E38C79F6979435A049D7A8DEB | INSERT INTO T1 ( COL1 , COL2 ) VALUES ( ? , COL1 * ? ) ;  |
+----------------------------------+-----------------------------------------------------------+
drop table digest_table1;
create table digest_table1(
  c1 VARCHAR(200)
)default character set = 'gbk';
insert into digest_table1 values(null),('DELETE FROM t1 WHERE c1 = "jcole" ORDER BY c2 LIMIT 1'),('DELETE FROM t1 WHERE c1 = "jcole" ORDER BY c2 LIMIT 1    '),('DELETE FROM t1 WHERE c1 = "jcole" ORDER BY c2 LIMIT 1;');
select statement_digest(c1) digest,statement_digest_text(c1) digest_text from digest_table1;
+----------------------------------+----------------------------------------------------+
| digest                           | digest_text                                        |
+----------------------------------+----------------------------------------------------+
| NULL                             | NULL                                               |
| 6B45C7E521D4182703BE53509A6731BC | DELETE FROM T1 WHERE C1 = ? ORDER BY C2 LIMIT ?    |
| 6B45C7E521D4182703BE53509A6731BC | DELETE FROM T1 WHERE C1 = ? ORDER BY C2 LIMIT ?    |
| 5112D9012311D16FA08A6D4A41157B59 | DELETE FROM T1 WHERE C1 = ? ORDER BY C2 LIMIT ? ;  |
+----------------------------------+----------------------------------------------------+
drop table digest_table1;
create table digest_table1(
  c1 VARCHAR(200)
)default character set = 'binary';
insert into digest_table1 values(null),('SELECT * FROM tl WHERE id < 20 ORDER BY c1,c2 LIMIT 5'),('SELECT * FROM tl WHERE id < 20 ORDER BY c1,c2 LIMIT 5    '),('SELECT * FROM tl WHERE id < 30 ORDER BY c1,c2 LIMIT 15;');
select statement_digest(c1) digest,statement_digest_text(c1) digest_text from digest_table1;
+----------------------------------+-----------------------------------------------------------+
| digest                           | digest_text                                               |
+----------------------------------+-----------------------------------------------------------+
| NULL                             | NULL                                                      |
| 8FC7EC57999B3E7A3BFE5B36B9D51EC4 | SELECT * FROM tl WHERE id < ? ORDER BY c1 , c2 LIMIT ?    |
| 8FC7EC57999B3E7A3BFE5B36B9D51EC4 | SELECT * FROM tl WHERE id < ? ORDER BY c1 , c2 LIMIT ?    |
| C46E19097E4E239804628D93A28147A3 | SELECT * FROM tl WHERE id < ? ORDER BY c1 , c2 LIMIT ? ;  |
+----------------------------------+-----------------------------------------------------------+
drop table digest_table1;
create table digest_table1(
  c1 VARCHAR(200)
)default character set = 'gb18030';
insert into digest_table1 values(null),('SELECT * FROM tl WHERE id < 20'),('SELECT * FROM tl WHERE id < 30'),('SELECT * FROM tl WHERE id < 40');
select statement_digest(c1) digest,statement_digest_text(c1) digest_text from digest_table1;
+----------------------------------+--------------------------------+
| digest                           | digest_text                    |
+----------------------------------+--------------------------------+
| NULL                             | NULL                           |
| F7A3D808C12C7E7E2392FCE142467F9D | SELECT * FROM TL WHERE ID < ?  |
| F7A3D808C12C7E7E2392FCE142467F9D | SELECT * FROM TL WHERE ID < ?  |
| F7A3D808C12C7E7E2392FCE142467F9D | SELECT * FROM TL WHERE ID < ?  |
+----------------------------------+--------------------------------+
-----------------------------------------------------------------------------------------------------------------
------------------------- 语句摘要函数-statement_digest(statement)/statement_digest_text(statement)--------------
###### 标签：digest-4 statement_digest(statement)/statement_digest_text(statement) - 函数间嵌套        
-----------------------------------------------------------------------------------------------------------------
######################### 标签：digest-4-1,digest-4-2 函数间嵌套 - 函数嵌套/被函数嵌套 #########################
##数字函数
SELECT ABS(statement_digest('SELECT ABS(-10)')) digest,ABS(statement_digest_text('SELECT ABS(-10)')) digest_text FROM dual;
+--------+-------------+
| digest | digest_text |
+--------+-------------+
|      0 |           0 |
+--------+-------------+
SELECT statement_digest(ABS(-10)) digest,statement_digest_text(ABS(-10)) digest_text FROM dual;
ERROR 42000: You have an error in your SQL syntax; check the manual that corresponds to your OceanBase version for the right syntax to use near '10' at line 1
SELECT AVG(statement_digest('SELECT 2+3*3')) digest,AVG(statement_digest_text('SELECT 2+3*3')) digest_text FROM dual;
+--------+-------------+
| digest | digest_text |
+--------+-------------+
|     20 |           0 |
+--------+-------------+
SELECT statement_digest(AVG(10)) digest,statement_digest_text(AVG(10)) digest_text FROM dual;
ERROR 42000: You have an error in your SQL syntax; check the manual that corresponds to your OceanBase version for the right syntax to use near '10.0000' at line 1
SELECT CEIL(statement_digest('SELECT 2+3*3')) digest,CEIL(statement_digest_text('SELECT 2+3*3')) digest_text FROM dual;
+--------+-------------+
| digest | digest_text |
+--------+-------------+
|     20 |           0 |
+--------+-------------+
SELECT statement_digest(CEIL(10.7)) digest,statement_digest_text(CEIL(10.7)) digest_text FROM dual;
ERROR 42000: You have an error in your SQL syntax; check the manual that corresponds to your OceanBase version for the right syntax to use near '11' at line 1
SELECT FLOOR(statement_digest('SELECT 2+3')) digest,FLOOR(statement_digest_text('SELECT 2+3')) digest_text FROM dual;
+--------+-------------+
| digest | digest_text |
+--------+-------------+
|      0 |           0 |
+--------+-------------+
SELECT statement_digest(FLOOR(10.7)) digest,statement_digest_text(FLOOR(10.7)) digest_text FROM dual;
ERROR 42000: You have an error in your SQL syntax; check the manual that corresponds to your OceanBase version for the right syntax to use near '10' at line 1
SELECT MAX(statement_digest('SELECT 2+3')) digest,MAX(statement_digest_text('SELECT 2+3')) digest_text FROM dual;
+----------------------------------+---------------+
| digest                           | digest_text   |
+----------------------------------+---------------+
| D3050F83ED93FB97B5ED5CDF1940DD09 | SELECT ? + ?  |
+----------------------------------+---------------+
SELECT statement_digest(MAX(20)) digest,statement_digest_text(MAX(20)) digest_text FROM dual;
ERROR 42000: You have an error in your SQL syntax; check the manual that corresponds to your OceanBase version for the right syntax to use near '20' at line 1
SELECT MIN(statement_digest('SELECT concat("whh",18)')) digest,MIN(statement_digest_text('SELECT concat("whh",18)')) digest_text FROM dual;
+----------------------------------+--------------------------+
| digest                           | digest_text              |
+----------------------------------+--------------------------+
| E60BC1BBC5300CC80D9E287B901EB63B | SELECT CONCAT ( ? , ? )  |
+----------------------------------+--------------------------+
SELECT statement_digest(MIN(10)) digest,statement_digest_text(MIN(10)) digest_text FROM dual;
ERROR 42000: You have an error in your SQL syntax; check the manual that corresponds to your OceanBase version for the right syntax to use near '10' at line 1
SELECT ROUND(statement_digest('SELECT concat("whh",18)')) digest,ROUND(statement_digest_text('SELECT concat("whh",18)')) digest_text FROM dual;
+--------+-------------+
| digest | digest_text |
+--------+-------------+
|      0 |           0 |
+--------+-------------+
SELECT statement_digest(ROUND(10)) digest,statement_digest_text(ROUND(10)) digest_text FROM dual;
ERROR 42000: You have an error in your SQL syntax; check the manual that corresponds to your OceanBase version for the right syntax to use near '10' at line 1
SELECT TRUNCATE(statement_digest('SELECT concat("whh",18)'),1) digest,TRUNCATE(statement_digest_text('SELECT concat("whh",18)'),1) digest_text FROM dual;
+--------+-------------+
| digest | digest_text |
+--------+-------------+
|      0 |           0 |
+--------+-------------+
SELECT statement_digest(TRUNCATE(10.12345,2)) digest,statement_digest_text(TRUNCATE(10.12345,2)) digest_text FROM dual;
ERROR 42000: You have an error in your SQL syntax; check the manual that corresponds to your OceanBase version for the right syntax to use near '10.12' at line 1
##字符函数
SELECT UPPER(statement_digest('SELECT truncate(20.123456,2) FROM dual')) digest,UPPER(statement_digest_text('SELECT truncate(20.123456,2) FROM dual')) digest_text FROM dual;
+----------------------------------+--------------------------------------+
| digest                           | digest_text                          |
+----------------------------------+--------------------------------------+
| 469E08E10AC960D063E290525DE6617A | SELECT TRUNCATE ( ? , 2 ) FROM DUAL  |
+----------------------------------+--------------------------------------+
SELECT statement_digest(UPPER('SELECT truncate(20.123456,2) FROM dual')) digest,statement_digest_text(UPPER('SELECT truncate(20.123456,2) FROM dual')) digest_text FROM dual;
+----------------------------------+--------------------------------------+
| digest                           | digest_text                          |
+----------------------------------+--------------------------------------+
| 469E08E10AC960D063E290525DE6617A | SELECT TRUNCATE ( ? , 2 ) FROM DUAL  |
+----------------------------------+--------------------------------------+
SELECT LOWER(statement_digest('INSERT INTO t1 (col1,col2) VALUES(15,col1*2)')) digest,LOWER(statement_digest_text('INSERT INTO t1 (col1,col2) VALUES(15,col1*2)')) digest_text FROM dual;
+----------------------------------+---------------------------------------------------------+
| digest                           | digest_text                                             |
+----------------------------------+---------------------------------------------------------+
| 07e12363e5475e5aec1da3efee6f2b8b | insert into t1 ( col1 , col2 ) values ( ? , col1 * ? )  |
+----------------------------------+---------------------------------------------------------+
SELECT statement_digest(LOWER('INSERT INTO t1 (col1,col2) VALUES(15,col1*2)')) digest,statement_digest_text(LOWER('INSERT INTO t1 (col1,col2) VALUES(15,col1*2)')) digest_text FROM dual;
+----------------------------------+---------------------------------------------------------+
| digest                           | digest_text                                             |
+----------------------------------+---------------------------------------------------------+
| 07E12363E5475E5AEC1DA3EFEE6F2B8B | INSERT INTO T1 ( COL1 , COL2 ) VALUES ( ? , COL1 * ? )  |
+----------------------------------+---------------------------------------------------------+
SELECT INSTR(statement_digest('INSERT INTO t1 (col1,col2) VALUES(15,col1*2)'),'ab') digest,INSTR(statement_digest_text('INSERT INTO t1 (col1,col2) VALUES(15,col1*2)'),'t1') digest_text FROM dual;
+--------+-------------+
| digest | digest_text |
+--------+-------------+
|      0 |          13 |
+--------+-------------+
SELECT statement_digest(INSTR('INSERT INTO t1 (col1,col2) VALUES(15,col1*2)','t1')) digest,statement_digest_text(INSTR('INSERT INTO t1 (col1,col2) VALUES(15,col1*2)','col1')) digest_text FROM dual;
ERROR 42000: You have an error in your SQL syntax; check the manual that corresponds to your OceanBase version for the right syntax to use near '13' at line 1
SELECT LENGTH(statement_digest('UPDATE t1 SET id = id + 1 ORDER BY id DESC LIMIT 10')) digest,LENGTH(statement_digest_text('UPDATE t1 SET id = id + 1 ORDER BY id DESC LIMIT 10')) digest_text FROM dual;
+--------+-------------+
| digest | digest_text |
+--------+-------------+
|     32 |          51 |
+--------+-------------+
SELECT statement_digest(LENGTH('UPDATE t1 SET id = id + 1 ORDER BY id DESC LIMIT 10')) digest,statement_digest_text(LENGTH('UPDATE t1 SET id = id + 1 ORDER BY id DESC LIMIT 10')) digest_text FROM dual;
ERROR 42000: You have an error in your SQL syntax; check the manual that corresponds to your OceanBase version for the right syntax to use near '51' at line 1
SELECT REPLACE(statement_digest('INSERT INTO t1 (col1,col2) VALUES(15,col1*2)'),0,'$') digest,REPLACE(statement_digest_text('INSERT INTO t1 (col1,col2) VALUES(15,col1*2)'),'?','@') digest_text FROM dual;
+----------------------------------+---------------------------------------------------------+
| digest                           | digest_text                                             |
+----------------------------------+---------------------------------------------------------+
| $7E12363E5475E5AEC1DA3EFEE6F2B8B | INSERT INTO T1 ( COL1 , COL2 ) VALUES ( @ , COL1 * @ )  |
+----------------------------------+---------------------------------------------------------+
SELECT statement_digest(REPLACE('INSERT INTO t1 (col1,col2) VALUES(15,col1*2)','t1','t2')) digest,statement_digest_text(REPLACE('INSERT INTO t1 (col1,col2) VALUES(15,col1*2)','t1','t2')) digest_text FROM dual;
+----------------------------------+---------------------------------------------------------+
| digest                           | digest_text                                             |
+----------------------------------+---------------------------------------------------------+
| 52619C484479AF467C2F4217F277F7C8 | INSERT INTO T2 ( COL1 , COL2 ) VALUES ( ? , COL1 * ? )  |
+----------------------------------+---------------------------------------------------------+
SELECT SUBSTR(statement_digest('SELECT * FROM tl WHERE id < 20 ORDER BY c1,c2'),1,15) digest,SUBSTR(statement_digest_text('SELECT * FROM tl WHERE id < 20 ORDER BY c1,c2'),1,29) digest_text FROM dual;
+-----------------+-------------------------------+
| digest          | digest_text                   |
+-----------------+-------------------------------+
| 2470A648D58683E | SELECT * FROM TL WHERE ID < ? |
+-----------------+-------------------------------+
SELECT statement_digest(SUBSTR('SELECT * FROM tl WHERE id < 20 ORDER BY c1,c2',1,42)) digest,statement_digest_text(SUBSTR('SELECT * FROM tl WHERE id < 20 ORDER BY c1,c2',1,42)) digest_text FROM dual;
+----------------------------------+--------------------------------------------+
| digest                           | digest_text                                |
+----------------------------------+--------------------------------------------+
| 49AC070A94B6CC99F0FD5390E67AB07E | SELECT * FROM TL WHERE ID < ? ORDER BY C1  |
+----------------------------------+--------------------------------------------+
SELECT CONCAT('{',statement_digest('SELECT * FROM tl WHERE id < 20 ORDER BY c1,c2'),'}') digest,CONCAT('{',statement_digest_text('SELECT * FROM tl WHERE id < 20 ORDER BY c1,c2'),'}') digest_text FROM dual;
+------------------------------------+---------------------------------------------------+
| digest                             | digest_text                                       |
+------------------------------------+---------------------------------------------------+
| {2470A648D58683E298F1B847A91B3748} | {SELECT * FROM TL WHERE ID < ? ORDER BY C1 , C2 } |
+------------------------------------+---------------------------------------------------+
SELECT statement_digest(CONCAT('  ','SELECT * FROM tl WHERE id < 20 ORDER BY c1,c2',';')) digest,statement_digest_text(CONCAT('   ','SELECT * FROM tl WHERE id < 20 ORDER BY c1,c2',';')) digest_text FROM dual;
+----------------------------------+---------------------------------------------------+
| digest                           | digest_text                                       |
+----------------------------------+---------------------------------------------------+
| D66B853482402339FD70F5DE0C558B21 | SELECT * FROM TL WHERE ID < ? ORDER BY C1 , C2 ;  |
+----------------------------------+---------------------------------------------------+
SELECT LPAD(statement_digest('SELECT * FROM tl WHERE id < 20 ORDER BY c1,c2'),40,'$') digest,LPAD(statement_digest_text('SELECT * FROM tl WHERE id < 20 ORDER BY c1,c2'),50,'$') digest_text FROM dual;
+------------------------------------------+----------------------------------------------------+
| digest                                   | digest_text                                        |
+------------------------------------------+----------------------------------------------------+
| $$$$$$$$2470A648D58683E298F1B847A91B3748 | $$$SELECT * FROM TL WHERE ID < ? ORDER BY C1 , C2  |
+------------------------------------------+----------------------------------------------------+
SELECT statement_digest(LPAD('SELECT * FROM tl WHERE id < 20 ORDER BY c1,c2',60,' ')) digest,statement_digest_text(LPAD('SELECT * FROM tl WHERE id < 20 ORDER BY c1,c2',50,' ')) digest_text FROM dual;
+----------------------------------+-------------------------------------------------+
| digest                           | digest_text                                     |
+----------------------------------+-------------------------------------------------+
| 2470A648D58683E298F1B847A91B3748 | SELECT * FROM TL WHERE ID < ? ORDER BY C1 , C2  |
+----------------------------------+-------------------------------------------------+
SELECT TRIM(statement_digest('   SELECT * FROM tl WHERE id < 20 LIMIT 3   ')) digest,TRIM(statement_digest_text('  SELECT * FROM tl WHERE id < 20 LIMIT 3  ')) digest_text FROM dual;
+----------------------------------+---------------------------------------+
| digest                           | digest_text                           |
+----------------------------------+---------------------------------------+
| AB470CCC50169686CFFD6643CA96FB49 | SELECT * FROM TL WHERE ID < ? LIMIT ? |
+----------------------------------+---------------------------------------+
SELECT statement_digest(TRIM('   SELECT * FROM tl WHERE id < 20 LIMIT 3   ')) digest,statement_digest_text(TRIM('  SELECT * FROM tl WHERE id < 20 LIMIT 3  ')) digest_text FROM dual;
+----------------------------------+----------------------------------------+
| digest                           | digest_text                            |
+----------------------------------+----------------------------------------+
| AB470CCC50169686CFFD6643CA96FB49 | SELECT * FROM TL WHERE ID < ? LIMIT ?  |
+----------------------------------+----------------------------------------+
SELECT REVERSE(statement_digest('SELECT * FROM tl WHERE id < 20 LIMIT 3')) digest,REVERSE(statement_digest_text('SELECT * FROM tl WHERE id < 20 LIMIT 3')) digest_text FROM dual;
+----------------------------------+----------------------------------------+
| digest                           | digest_text                            |
+----------------------------------+----------------------------------------+
| 94BF69AC3466DFFC68696105CCC074BA |  ? TIMIL ? < DI EREHW LT MORF * TCELES |
+----------------------------------+----------------------------------------+
SELECT statement_digest(REVERSE(REVERSE('SELECT * FROM tl WHERE id < 20 LIMIT 3'))) digest,statement_digest_text(REVERSE(REVERSE('SELECT * FROM tl WHERE id < 20 LIMIT 3'))) digest_text FROM dual;
+----------------------------------+----------------------------------------+
| digest                           | digest_text                            |
+----------------------------------+----------------------------------------+
| AB470CCC50169686CFFD6643CA96FB49 | SELECT * FROM TL WHERE ID < ? LIMIT ?  |
+----------------------------------+----------------------------------------+
##日期函数
SELECT FROM_DAYS(statement_digest('UPDATE t1 SET id = id + 1')) digest,FROM_DAYS(statement_digest_text('UPDATE t1 SET id = id + 1')) FROM dual;
+------------+---------------------------------------------------------------+
| digest     | FROM_DAYS(statement_digest_text('UPDATE t1 SET id = id + 1')) |
+------------+---------------------------------------------------------------+
| 0227-07-01 | 0000-00-00                                                    |
+------------+---------------------------------------------------------------+
SELECT statement_digest(FROM_DAYS(729575)) digest,statement_digest_text(FROM_DAYS(729575)) FROM dual;
ERROR 42000: You have an error in your SQL syntax; check the manual that corresponds to your OceanBase version for the right syntax to use near '1997-07-05' at line 1
## 系统时间会变，所以预期执行结果也会不一样，知道sql语句支持就好，暂时注释掉
## --error 1064
## SELECT statement_digest(SYSDATE()),statement_digest_text(SYSDATE()) FROM dual;
##通用函数
SELECT IFNULL(NULL,statement_digest('UPDATE t1 SET id = id + 1')) digest,IFNULL(statement_digest_text('UPDATE t1 SET id = id + 1'),NULL) digest_text FROM dual;
+----------------------------------+----------------------------+
| digest                           | digest_text                |
+----------------------------------+----------------------------+
| 83091A9F378BA243C82A390F5F7BBB77 | UPDATE T1 SET ID = ID + ?  |
+----------------------------------+----------------------------+
SELECT statement_digest(IFNULL(NULL,'UPDATE t1 SET id = id + 3')) digest,statement_digest_text(IFNULL(NULL,'UPDATE t1 SET id = id + 3')) digest_text FROM dual;
+----------------------------------+----------------------------+
| digest                           | digest_text                |
+----------------------------------+----------------------------+
| 83091A9F378BA243C82A390F5F7BBB77 | UPDATE T1 SET ID = ID + ?  |
+----------------------------------+----------------------------+
SELECT COALESCE(NULL,statement_digest('DELETE FROM t1 WHERE c1 = "jcole" ')) digest,COALESCE(statement_digest_text('DELETE FROM t1 WHERE c1 = "jcole" '),NULL) digest_text FROM dual;
+----------------------------------+------------------------------+
| digest                           | digest_text                  |
+----------------------------------+------------------------------+
| A66D5C4325D82467E443039AAED826F1 | DELETE FROM T1 WHERE C1 = ?  |
+----------------------------------+------------------------------+
SELECT statement_digest(COALESCE(NULL,'DELETE FROM t1 WHERE c1 = "whh" ')) digest,statement_digest_text(COALESCE(NULL,'DELETE FROM t1 WHERE c1 = "whh" ')) digest_text FROM dual;
+----------------------------------+------------------------------+
| digest                           | digest_text                  |
+----------------------------------+------------------------------+
| A66D5C4325D82467E443039AAED826F1 | DELETE FROM T1 WHERE C1 = ?  |
+----------------------------------+------------------------------+
######################### 标签：digest-4-2 函数间嵌套 - 多级函数嵌套 #########################
## statement_digest 自己嵌套自己
select statement_digest('SELECT * FROM tl WHERE id < 20') digest from dual;
+----------------------------------+
| digest                           |
+----------------------------------+
| F7A3D808C12C7E7E2392FCE142467F9D |
+----------------------------------+
select statement_digest(statement_digest('SELECT * FROM tl WHERE id < 20')) digest from dual;
ERROR 42000: You have an error in your SQL syntax; check the manual that corresponds to your OceanBase version for the right syntax to use near 'F7A3D808C12C7E7E2392FCE142467F9D' at line 1
select statement_digest(statement_digest(statement_digest('SELECT * FROM tl WHERE id < 20'))) digest from dual;
ERROR 42000: You have an error in your SQL syntax; check the manual that corresponds to your OceanBase version for the right syntax to use near 'F7A3D808C12C7E7E2392FCE142467F9D' at line 1
select statement_digest(statement_digest(statement_digest(statement_digest('SELECT * FROM tl WHERE id < 20')))) digest from dual;
ERROR 42000: You have an error in your SQL syntax; check the manual that corresponds to your OceanBase version for the right syntax to use near 'F7A3D808C12C7E7E2392FCE142467F9D' at line 1
## statement_digest_text 自己嵌套自己
select statement_digest_text('SELECT * FROM tl WHERE id < 20') digest_text from dual;
+--------------------------------+
| digest_text                    |
+--------------------------------+
| SELECT * FROM TL WHERE ID < ?  |
+--------------------------------+
##issue:41146768 bug7: 语句摘要函数 statement_digest()/statement_digest_text(),参数的SQL语句含有?，mysql失败，ob成功。
select statement_digest_text(statement_digest_text('SELECT * FROM tl WHERE id < 20')) digest_text from dual;
ERROR HY000: Incorrect arguments to digest function
select statement_digest_text(statement_digest_text(statement_digest_text('SELECT * FROM tl WHERE id < 20'))) digest_text from dual;
ERROR HY000: Incorrect arguments to digest function
select statement_digest_text(statement_digest_text(statement_digest_text(statement_digest_text('SELECT * FROM tl WHERE id < 20')))) digest_text from dual;
ERROR HY000: Incorrect arguments to digest function
## statement_digest/statement_digest_text 相互嵌套
select statement_digest(statement_digest_text('UPDATE t1 SET id = id * 5')) digest from dual;
ERROR HY000: Incorrect arguments to digest function
select statement_digest_text(concat('select sql_id, statement from oceanbase.v$plan_cache_plan_stat where sql_id = ',statement_digest('UPDATE t1 SET id = id * 5'))) digest_text from dual;
+------------------------------------------------------------------------------------------------------------------+
| digest_text                                                                                                      |
+------------------------------------------------------------------------------------------------------------------+
| SELECT SQL_ID , STATEMENT FROM OCEANBASE.V$PLAN_CACHE_PLAN_STAT WHERE SQL_ID = D831D6237F80DD0F0E46164B8FA07F95  |
+------------------------------------------------------------------------------------------------------------------+
select statement_digest(statement_digest_text(concat('select sql_id, statement from oceanbase.v$plan_cache_plan_stat where sql_id = ',statement_digest('UPDATE t1 SET id = id * 5')))) digest from dual;
+----------------------------------+
| digest                           |
+----------------------------------+
| 26DC6D0905B737C6E3D48FA2BB80CFE9 |
+----------------------------------+
-----------------------------------------------------------------------------------------------------------------
------------------------- 语句摘要函数-statement_digest(statement)/statement_digest_text(statement)--------------
###### 标签：digest-5 statement_digest(statement)/statement_digest_text(statement) - 运算符        
-----------------------------------------------------------------------------------------------------------------
######################### 标签：digest-5-1 运算符 - 算术运算符 #########################
select statement_digest('UPDATE t1 SET id = id + (1+2*4/3%3)') digest from dual;
+----------------------------------+
| digest                           |
+----------------------------------+
| 9C0E607EE950A10ECBE3D1C1B4B0BFEA |
+----------------------------------+
select statement_digest_text('UPDATE t1 SET id = id + (1+2*4/3%3)') digest_text from dual;
+------------------------------------------------+
| digest_text                                    |
+------------------------------------------------+
| UPDATE T1 SET ID = ID + ( ? + ? * ? / ? % ? )  |
+------------------------------------------------+
select statement_digest('SELECT 3*5') + 3 -1 *9 / 4 % 3 digest from dual;
+--------+
| digest |
+--------+
|   9.75 |
+--------+
select statement_digest_text('SELECT 3*5')+ 3 -1 *9 / 4 % 3  digest_text from dual;
+-------------+
| digest_text |
+-------------+
|        0.75 |
+-------------+
select statement_digest('SELECT 3*5') DIV 2 digest from dual;
+--------+
| digest |
+--------+
|      4 |
+--------+
select statement_digest_text('SELECT 3*5') MOD 3  digest_text from dual;
+-------------+
| digest_text |
+-------------+
|           0 |
+-------------+
######################### 标签：digest-5-2 运算符 - 比较运算符 #########################
select statement_digest('UPDATE t1 SET id = id + 1') = statement_digest('UPDATE t1 SET id = id + 1')  '=' from dual;
+------+
| =    |
+------+
|    1 |
+------+
select statement_digest('UPDATE t1 SET id = id + 1') > statement_digest('UPDATE t1 SET id = id + 2') '>' from dual;
+------+
| >    |
+------+
|    0 |
+------+
select statement_digest('UPDATE t1 SET id = id + 1') < statement_digest('UPDATE t2 SET id = id + 1') '<' from dual;
+------+
| <    |
+------+
|    1 |
+------+
select statement_digest('UPDATE t1 SET id = 1') >= statement_digest('UPDATE t1 SET id = 2') '>=' from dual;
+------+
| >=   |
+------+
|    1 |
+------+
select statement_digest('UPDATE t1 SET id = id + 1') <= statement_digest('DELETE FROM t1 WHERE c1 = "jcole"') '<=' from dual;
+------+
| <=   |
+------+
|    1 |
+------+
select statement_digest('UPDATE t1 SET id = id + 1') != statement_digest('INSERT INTO t1 (col1,col2) VALUES(15,2*2)') '!=' from dual;
+------+
| !=   |
+------+
|    1 |
+------+
select statement_digest('UPDATE t1 SET id = id + 1') <> statement_digest('UPDATE t1 SET id = id + 2') '<>' from dual;
+------+
| <>   |
+------+
|    0 |
+------+
select statement_digest_text('UPDATE t1 SET id = id + 1') = statement_digest_text('UPDATE t1 SET id = id + 1')  '=' from dual;
+------+
| =    |
+------+
|    1 |
+------+
select statement_digest_text('UPDATE t1 SET id = id + 1') > statement_digest_text('UPDATE t1 SET id = id + 2') '>' from dual;
+------+
| >    |
+------+
|    0 |
+------+
select statement_digest_text('UPDATE t1 SET id = id + 1') < statement_digest_text('UPDATE t2 SET id = id + 1') '<' from dual;
+------+
| <    |
+------+
|    1 |
+------+
select statement_digest_text('UPDATE t1 SET id = 1') >= statement_digest_text('UPDATE t1 SET id = 2') '>=' from dual;
+------+
| >=   |
+------+
|    1 |
+------+
select statement_digest_text('UPDATE t1 SET id = id + 1') <= statement_digest_text('DELETE FROM t1 WHERE c1 = "jcole"') '<=' from dual;
+------+
| <=   |
+------+
|    0 |
+------+
select statement_digest_text('UPDATE t1 SET id = id + 1') != statement_digest_text('INSERT INTO t1 (col1,col2) VALUES(15,2*2)') '!=' from dual;
+------+
| !=   |
+------+
|    1 |
+------+
select statement_digest_text('UPDATE t1 SET id = id + 1') <> statement_digest_text('UPDATE t1 SET id = id + 2') '<>' from dual;
+------+
| <>   |
+------+
|    0 |
+------+
select statement_digest('UPDATE t1 SET id = id + 1') in (statement_digest('UPDATE t1 SET id = id + 1'),'',1)  'in' from dual;
+------+
| in   |
+------+
|    1 |
+------+
select statement_digest('UPDATE t1 SET id = id + 1') not in (statement_digest('UPDATE t1 SET id = id + 1'),'',1) 'not in' from dual;
+--------+
| not in |
+--------+
|      0 |
+--------+
select statement_digest(null) is null  'is null' from dual;
+---------+
| is null |
+---------+
|       1 |
+---------+
select statement_digest('UPDATE t1 SET id = 1')  is not null 'is not null' from dual;
+-------------+
| is not null |
+-------------+
|           1 |
+-------------+
select statement_digest('UPDATE t1 SET id = id + 1') between 0 and 100 'between' from dual;
+---------+
| between |
+---------+
|       0 |
+---------+
Warnings:
Warning	1292	Truncated incorrect DECIMAL value: '83091A9F378BA243C82A390F5F7BBB77'
Warning	1292	Truncated incorrect DECIMAL value: '83091A9F378BA243C82A390F5F7BBB77'
select statement_digest('UPDATE t1 SET id = id + 1') not between 0 and 100 'not between' from dual;
+-------------+
| not between |
+-------------+
|           1 |
+-------------+
Warnings:
Warning	1292	Truncated incorrect DECIMAL value: '83091A9F378BA243C82A390F5F7BBB77'
Warning	1292	Truncated incorrect DECIMAL value: '83091A9F378BA243C82A390F5F7BBB77'
select statement_digest('UPDATE t1 SET id = id + 1') <=> null '<=>' from dual;
+-----+
| <=> |
+-----+
|   0 |
+-----+
select statement_digest('UPDATE t1 SET id = id + 1') LIKE '%bdb%' as 'like'  from dual;
+------+
| like |
+------+
|    0 |
+------+
select statement_digest('UPDATE t1 SET id = id + 1') REGEXP '^d89' as 'regexp' from dual;
+--------+
| regexp |
+--------+
|      0 |
+--------+
select statement_digest('UPDATE t1 SET id = id + 1') RLIKE '^d89' as 'rlike' from dual;
+-------+
| rlike |
+-------+
|     0 |
+-------+
select statement_digest_text('UPDATE t1 SET id = id + 1') in (statement_digest_text('UPDATE t1 SET id = id + 1'),'',1)  'in' from dual;
+------+
| in   |
+------+
|    1 |
+------+
select statement_digest_text('UPDATE t1 SET id = id + 1') not in (statement_digest_text('UPDATE t1 SET id = id + 1'),'',1) 'not in' from dual;
+--------+
| not in |
+--------+
|      0 |
+--------+
select statement_digest_text(null) is null  'is null' from dual;
+---------+
| is null |
+---------+
|       1 |
+---------+
select statement_digest_text('UPDATE t1 SET id = 1')  is not null 'is not null' from dual;
+-------------+
| is not null |
+-------------+
|           1 |
+-------------+
select statement_digest_text('UPDATE t1 SET id = id + 1') between 0 and 100 'between' from dual;
+---------+
| between |
+---------+
|       1 |
+---------+
Warnings:
Warning	1292	Truncated incorrect DECIMAL value: 'UPDATE T1 SET ID = ID + ? '
Warning	1292	Truncated incorrect DECIMAL value: 'UPDATE T1 SET ID = ID + ? '
select statement_digest_text('UPDATE t1 SET id = id + 1') not between 0 and 100 'not between' from dual;
+-------------+
| not between |
+-------------+
|           0 |
+-------------+
Warnings:
Warning	1292	Truncated incorrect DECIMAL value: 'UPDATE T1 SET ID = ID + ? '
Warning	1292	Truncated incorrect DECIMAL value: 'UPDATE T1 SET ID = ID + ? '
select statement_digest_text(null) <=> null '<=>' from dual;
+-----+
| <=> |
+-----+
|   1 |
+-----+
select statement_digest_text('UPDATE t1 SET id = id + 1') LIKE '%?%' as 'like'from dual;
+------+
| like |
+------+
|    1 |
+------+
select statement_digest_text('UPDATE t1 SET id = id + 1') REGEXP '^UPDATE' as 'regexp' from dual;
+--------+
| regexp |
+--------+
|      1 |
+--------+
select statement_digest_text('UPDATE t1 SET id = id + 1') RLIKE '^UPDATE' as 'rlike' from dual;
+-------+
| rlike |
+-------+
|     1 |
+-------+
######################### 标签：digest-5-3 运算符 - 逻辑运算符 #########################
select not statement_digest('DELETE FROM t1 WHERE c1 = "q"') 'not' from dual;
+------+
| not  |
+------+
|    1 |
+------+
select statement_digest('DELETE FROM t1 WHERE c1 = "w"') and 1 'and' from dual;
+------+
| and  |
+------+
|    0 |
+------+
select statement_digest('DELETE FROM t1 WHERE c1 = "e"') or 0 'or' from dual;
+------+
| or   |
+------+
|    0 |
+------+
select statement_digest('DELETE FROM t1 WHERE c1 = "r"') xor statement_digest('DELETE FROM t1 WHERE c1 = "t"') 'xor' from dual;
+------+
| xor  |
+------+
|    0 |
+------+
select not statement_digest_text('DELETE FROM t1 WHERE c1 = "jcole"') 'not' from dual;
+------+
| not  |
+------+
|    1 |
+------+
select statement_digest_text('DELETE FROM t1 WHERE c1 = "jcole"') and 1 'and' from dual;
+------+
| and  |
+------+
|    0 |
+------+
select statement_digest_text('DELETE FROM t1 WHERE c1 = "jcole"') or 0 'or' from dual;
+------+
| or   |
+------+
|    0 |
+------+
select statement_digest_text('DELETE FROM t1 WHERE c1 = "jcole"') xor statement_digest_text('DELETE FROM t1 WHERE c1 = "t"') 'xor' from dual;
+------+
| xor  |
+------+
|    0 |
+------+
######################### 标签：digest-5-4 运算符 - 位运算符 #########################
select statement_digest('DELETE FROM t1 WHERE c1 = "q"') & 1'&' from dual;
+------+
| &    |
+------+
|    0 |
+------+
select statement_digest('DELETE FROM t1 WHERE c1 = "w"') | 1 '|' from dual;
+------+
| |    |
+------+
|    1 |
+------+
select statement_digest('DELETE FROM t1 WHERE c1 = "e"') ^ 0 '^' from dual;
+------+
| ^    |
+------+
|    0 |
+------+
select !statement_digest('DELETE FROM t1 WHERE c1 = "r"') '!' from dual;
+------+
| !    |
+------+
|    1 |
+------+
select statement_digest('DELETE FROM t1 WHERE c1 = "r"') >> 3 '>>' from dual;
+------+
| >>   |
+------+
|    0 |
+------+
select statement_digest('DELETE FROM t1 WHERE c1 = "r"') << 3 '<<' from dual;
+------+
| <<   |
+------+
|    0 |
+------+
select statement_digest_text('DELETE FROM t1 WHERE c1 = "jcole"') & 1 '&' from dual;
+------+
| &    |
+------+
|    0 |
+------+
select statement_digest_text('DELETE FROM t1 WHERE c1 = "jcole"') | 1 '|' from dual;
+------+
| |    |
+------+
|    1 |
+------+
select statement_digest_text('DELETE FROM t1 WHERE c1 = "jcole"') ^ 3 '^' from dual;
+------+
| ^    |
+------+
|    3 |
+------+
select !statement_digest_text('DELETE FROM t1 WHERE c1 = "jcole"') '!' from dual;
+------+
| !    |
+------+
|    1 |
+------+
select statement_digest_text('DELETE FROM t1 WHERE c1 = "jcole"') >> 3 '>>' from dual;
+------+
| >>   |
+------+
|    0 |
+------+
select statement_digest_text('DELETE FROM t1 WHERE c1 = "jcole"') << 3 '<<' from dual;
+------+
| <<   |
+------+
|    0 |
+------+
-----------------------------------------------------------------------------------------------------------------
------------------------- 语句摘要函数-statement_digest(statement)/statement_digest_text(statement)--------------
###### 标签：digest-6 statement_digest(statement)/statement_digest_text(statement) - 视图，索引，约束
-----------------------------------------------------------------------------------------------------------------
#################################################################################
### 表，视图创建
DROP TABLE digest_table1;
CREATE TABLE digest_table1( 
  id INT,
  c1 VARCHAR(200), 
  c2 VARCHAR(200)
);
insert into digest_table1 values(1,'INSERT INTO t1(col1,col2) VALUES(15,25)','INSERT INTO t1(col1,col2) VALUES(16,col1*3)');
insert into digest_table1 values(2,'DELETE FROM t1 WHERE c1 = "whh"','DELETE FROM t1 WHERE c1 = "whh" ORDER BY c2,c3 LIMIT 2');
insert into digest_table1 values(3,'UPDATE t1 SET id = id + 1','UPDATE t1 SET id = id + 1 ORDER BY id DESC LIMIT 4');
insert into digest_table1 values(4,'SELECT * FROM tl WHERE id < 20','SELECT * FROM tl WHERE id < 20 ORDER BY c1,c2 LIMIT 6,10');
DROP TABLE digest_table2;
CREATE TABLE `digest_table2` (
  `id` int unsigned NOT NULL AUTO_INCREMENT,
  `sqls` varchar(255) NOT NULL COMMENT 'sql语句',
  `digest` varchar(255) NOT NULL DEFAULT '' COMMENT 'statement_digest',
  `digest_text` varchar(255) NOT NULL DEFAULT '' COMMENT 'statement_digest_text',
  PRIMARY KEY (`id`)
);
INSERT INTO digest_table2 VALUES(1,'INSERT INTO t1 VALUES(15,25)',statement_digest('INSERT INTO t1 VALUES(15,25)'),statement_digest_text('INSERT INTO t1 VALUES(15,25)'));
INSERT INTO digest_table2 VALUES(2,'DELETE FROM t1 WHERE c1 = "whh"',statement_digest('DELETE FROM t1 WHERE c1 = "whh"'),statement_digest_text('DELETE FROM t1 WHERE c1 = "whh"'));
INSERT INTO digest_table2 VALUES(3,'UPDATE t1 SET id = id + 1',statement_digest('UPDATE t1 SET id = id + 1'),statement_digest_text('UPDATE t1 SET id = id + 1'));
INSERT INTO digest_table2 VALUES(5,'SELECT * FROM tl WHERE id < 20',statement_digest('SELECT * FROM tl WHERE id < 20'),statement_digest_text('SELECT * FROM tl WHERE id < 20'));
DROP VIEW t1_view;
CREATE VIEW t1_view AS SELECT * FROM digest_table1 WHERE id <= 3;
DROP VIEW t2_view;
CREATE VIEW t2_view AS SELECT * FROM digest_table1 WHERE id >= 2;
DROP VIEW t3_view;
######################### 标签：digest-6-1 视图 #########################
### SELECT
##多列/单列
select id,statement_digest(c1) digest,statement_digest_text(c2) digest_text from t1_view ORDER BY id;
+------+----------------------------------+---------------------------------------------------------+
| id   | digest                           | digest_text                                             |
+------+----------------------------------+---------------------------------------------------------+
|    1 | 77B68119B2484298E19F6CFB653B54A2 | INSERT INTO T1 ( COL1 , COL2 ) VALUES ( ? , COL1 * ? )  |
|    2 | A66D5C4325D82467E443039AAED826F1 | DELETE FROM T1 WHERE C1 = ? ORDER BY C2 , C3 LIMIT ?    |
|    3 | 83091A9F378BA243C82A390F5F7BBB77 | UPDATE T1 SET ID = ID + ? ORDER BY ID DESC LIMIT ?      |
+------+----------------------------------+---------------------------------------------------------+
##issue:41063613 bug5: 
select id,statement_digest(CONCAT(c1,';',c2)) digest,statement_digest_text(CONCAT(c1,';',c2)) digest_text from t1_view ORDER BY id;
ERROR HY000: Incorrect arguments to digest function
##WHERE 子句
SELECT id,c1,statement_digest(c1) digest FROM t1_view WHERE statement_digest(c1) = '2A79EA558908297E4C12584F07C76222';
+------+------+--------+
| id   | c1   | digest |
+------+------+--------+
+------+------+--------+
SELECT id,c2,statement_digest_text(c2) digest_text FROM t1_view WHERE statement_digest_text(c2) like '%col1*?%';
+------+------+-------------+
| id   | c2   | digest_text |
+------+------+-------------+
+------+------+-------------+
SELECT id,c1,statement_digest(c1) digest,c2,statement_digest_text(c2) digest_text FROM t1_view WHERE statement_digest(c1) = statement_digest('DELETE FROM t1 WHERE c1 = "qwer"');
+------+---------------------------------+----------------------------------+--------------------------------------------------------+-------------------------------------------------------+
| id   | c1                              | digest                           | c2                                                     | digest_text                                           |
+------+---------------------------------+----------------------------------+--------------------------------------------------------+-------------------------------------------------------+
|    2 | DELETE FROM t1 WHERE c1 = "whh" | A66D5C4325D82467E443039AAED826F1 | DELETE FROM t1 WHERE c1 = "whh" ORDER BY c2,c3 LIMIT 2 | DELETE FROM T1 WHERE C1 = ? ORDER BY C2 , C3 LIMIT ?  |
+------+---------------------------------+----------------------------------+--------------------------------------------------------+-------------------------------------------------------+
##order by 子句
SELECT id,statement_digest(c1) digest,statement_digest_text(c2) digest_text FROM t1_view ORDER BY statement_digest(c1);
+------+----------------------------------+---------------------------------------------------------+
| id   | digest                           | digest_text                                             |
+------+----------------------------------+---------------------------------------------------------+
|    1 | 77B68119B2484298E19F6CFB653B54A2 | INSERT INTO T1 ( COL1 , COL2 ) VALUES ( ? , COL1 * ? )  |
|    3 | 83091A9F378BA243C82A390F5F7BBB77 | UPDATE T1 SET ID = ID + ? ORDER BY ID DESC LIMIT ?      |
|    2 | A66D5C4325D82467E443039AAED826F1 | DELETE FROM T1 WHERE C1 = ? ORDER BY C2 , C3 LIMIT ?    |
+------+----------------------------------+---------------------------------------------------------+
SELECT id,statement_digest(c1) digest,statement_digest_text(c2) digest_text FROM t1_view ORDER BY statement_digest(c1) DESC;
+------+----------------------------------+---------------------------------------------------------+
| id   | digest                           | digest_text                                             |
+------+----------------------------------+---------------------------------------------------------+
|    2 | A66D5C4325D82467E443039AAED826F1 | DELETE FROM T1 WHERE C1 = ? ORDER BY C2 , C3 LIMIT ?    |
|    3 | 83091A9F378BA243C82A390F5F7BBB77 | UPDATE T1 SET ID = ID + ? ORDER BY ID DESC LIMIT ?      |
|    1 | 77B68119B2484298E19F6CFB653B54A2 | INSERT INTO T1 ( COL1 , COL2 ) VALUES ( ? , COL1 * ? )  |
+------+----------------------------------+---------------------------------------------------------+
SELECT id,statement_digest(c1) digest,statement_digest_text(c2) digest_text FROM t1_view ORDER BY statement_digest_text(c2);
+------+----------------------------------+---------------------------------------------------------+
| id   | digest                           | digest_text                                             |
+------+----------------------------------+---------------------------------------------------------+
|    2 | A66D5C4325D82467E443039AAED826F1 | DELETE FROM T1 WHERE C1 = ? ORDER BY C2 , C3 LIMIT ?    |
|    1 | 77B68119B2484298E19F6CFB653B54A2 | INSERT INTO T1 ( COL1 , COL2 ) VALUES ( ? , COL1 * ? )  |
|    3 | 83091A9F378BA243C82A390F5F7BBB77 | UPDATE T1 SET ID = ID + ? ORDER BY ID DESC LIMIT ?      |
+------+----------------------------------+---------------------------------------------------------+
SELECT id,statement_digest(c1) digest,statement_digest_text(c2) digest_text FROM t1_view ORDER BY statement_digest_text(c2) ASC;
+------+----------------------------------+---------------------------------------------------------+
| id   | digest                           | digest_text                                             |
+------+----------------------------------+---------------------------------------------------------+
|    2 | A66D5C4325D82467E443039AAED826F1 | DELETE FROM T1 WHERE C1 = ? ORDER BY C2 , C3 LIMIT ?    |
|    1 | 77B68119B2484298E19F6CFB653B54A2 | INSERT INTO T1 ( COL1 , COL2 ) VALUES ( ? , COL1 * ? )  |
|    3 | 83091A9F378BA243C82A390F5F7BBB77 | UPDATE T1 SET ID = ID + ? ORDER BY ID DESC LIMIT ?      |
+------+----------------------------------+---------------------------------------------------------+
##group by having 子句
SELECT id,statement_digest(c1) digest,statement_digest_text(c2) digest_text FROM t1_view GROUP BY statement_digest(c1) ORDER BY id;
+------+----------------------------------+---------------------------------------------------------+
| id   | digest                           | digest_text                                             |
+------+----------------------------------+---------------------------------------------------------+
|    1 | 77B68119B2484298E19F6CFB653B54A2 | INSERT INTO T1 ( COL1 , COL2 ) VALUES ( ? , COL1 * ? )  |
|    2 | A66D5C4325D82467E443039AAED826F1 | DELETE FROM T1 WHERE C1 = ? ORDER BY C2 , C3 LIMIT ?    |
|    3 | 83091A9F378BA243C82A390F5F7BBB77 | UPDATE T1 SET ID = ID + ? ORDER BY ID DESC LIMIT ?      |
+------+----------------------------------+---------------------------------------------------------+
SELECT id,statement_digest(c1) digest,statement_digest_text(c2) digest_text FROM t1_view GROUP BY statement_digest_text(c2),id ORDER BY id ;
+------+----------------------------------+---------------------------------------------------------+
| id   | digest                           | digest_text                                             |
+------+----------------------------------+---------------------------------------------------------+
|    1 | 77B68119B2484298E19F6CFB653B54A2 | INSERT INTO T1 ( COL1 , COL2 ) VALUES ( ? , COL1 * ? )  |
|    2 | A66D5C4325D82467E443039AAED826F1 | DELETE FROM T1 WHERE C1 = ? ORDER BY C2 , C3 LIMIT ?    |
|    3 | 83091A9F378BA243C82A390F5F7BBB77 | UPDATE T1 SET ID = ID + ? ORDER BY ID DESC LIMIT ?      |
+------+----------------------------------+---------------------------------------------------------+
SELECT id,statement_digest(c1) digest,statement_digest_text(c2) digest_text FROM t1_view GROUP BY statement_digest(c1) HAVING digest > statement_digest('DELETE FROM t1 WHERE c1 = "qwer"') ORDER BY id;
+------+--------+-------------+
| id   | digest | digest_text |
+------+--------+-------------+
+------+--------+-------------+
#DISTINCT
SELECT distinct statement_digest(c1) digest,id,c1 FROM t1_view e ORDER BY id;
+----------------------------------+------+-----------------------------------------+
| digest                           | id   | c1                                      |
+----------------------------------+------+-----------------------------------------+
| 77B68119B2484298E19F6CFB653B54A2 |    1 | INSERT INTO t1(col1,col2) VALUES(15,25) |
| A66D5C4325D82467E443039AAED826F1 |    2 | DELETE FROM t1 WHERE c1 = "whh"         |
| 83091A9F378BA243C82A390F5F7BBB77 |    3 | UPDATE t1 SET id = id + 1               |
+----------------------------------+------+-----------------------------------------+
SELECT distinct statement_digest_text(c2),id,c2 FROM t1_view e ORDER BY id;
+---------------------------------------------------------+------+--------------------------------------------------------+
| statement_digest_text(c2)                               | id   | c2                                                     |
+---------------------------------------------------------+------+--------------------------------------------------------+
| INSERT INTO T1 ( COL1 , COL2 ) VALUES ( ? , COL1 * ? )  |    1 | INSERT INTO t1(col1,col2) VALUES(16,col1*3)            |
| DELETE FROM T1 WHERE C1 = ? ORDER BY C2 , C3 LIMIT ?    |    2 | DELETE FROM t1 WHERE c1 = "whh" ORDER BY c2,c3 LIMIT 2 |
| UPDATE T1 SET ID = ID + ? ORDER BY ID DESC LIMIT ?      |    3 | UPDATE t1 SET id = id + 1 ORDER BY id DESC LIMIT 4     |
+---------------------------------------------------------+------+--------------------------------------------------------+
#CASE WHEN
SELECT id,statement_digest(CASE WHEN c1 IS NULL THEN c2 ELSE c1 END) digest,statement_digest_text(CASE WHEN c1 IS NULL THEN c2 ELSE c1 END) digest_text FROM t1_view  ORDER BY id;
+------+----------------------------------+--------------------------------------------------+
| id   | digest                           | digest_text                                      |
+------+----------------------------------+--------------------------------------------------+
|    1 | 77B68119B2484298E19F6CFB653B54A2 | INSERT INTO T1 ( COL1 , COL2 ) VALUES ( ? , ? )  |
|    2 | A66D5C4325D82467E443039AAED826F1 | DELETE FROM T1 WHERE C1 = ?                      |
|    3 | 83091A9F378BA243C82A390F5F7BBB77 | UPDATE T1 SET ID = ID + ?                        |
+------+----------------------------------+--------------------------------------------------+
SELECT id,CASE WHEN statement_digest(c1)= statement_digest('DELETE FROM t1 WHERE c1 = "whh"') THEN 'id=2的statement_digest（c1列）'  ELSE '其他列' END digest FROM t1_view ORDER BY id;
+------+------------------------------------+
| id   | digest                             |
+------+------------------------------------+
|    1 | 其他列                             |
|    2 | id=2的statement_digest（c1列）     |
|    3 | 其他列                             |
+------+------------------------------------+
SELECT id,CASE WHEN statement_digest_text(c2) LIKE '%INSERT%' THEN 'id=1的 statement_digest_text（c2列）' ELSE '其他列' END digest FROM t1_view ORDER BY id;
+------+------------------------------------------+
| id   | digest                                   |
+------+------------------------------------------+
|    1 | id=1的 statement_digest_text（c2列）     |
|    2 | 其他列                                   |
|    3 | 其他列                                   |
+------+------------------------------------------+
##连接查询
SELECT e.id,statement_digest(e.c1) digest,statement_digest_text(e.c2) digest_text FROM t1_view e, t2_view p WHERE e.id = p.id ORDER BY e.id;
+------+----------------------------------+-------------------------------------------------------+
| id   | digest                           | digest_text                                           |
+------+----------------------------------+-------------------------------------------------------+
|    2 | A66D5C4325D82467E443039AAED826F1 | DELETE FROM T1 WHERE C1 = ? ORDER BY C2 , C3 LIMIT ?  |
|    3 | 83091A9F378BA243C82A390F5F7BBB77 | UPDATE T1 SET ID = ID + ? ORDER BY ID DESC LIMIT ?    |
+------+----------------------------------+-------------------------------------------------------+
SELECT e.id,statement_digest(e.c1) digest,statement_digest_text(e.c2) digest_text FROM t1_view e LEFT JOIN t2_view p ON e.id = p.id ORDER BY e.id;
+------+----------------------------------+---------------------------------------------------------+
| id   | digest                           | digest_text                                             |
+------+----------------------------------+---------------------------------------------------------+
|    1 | 77B68119B2484298E19F6CFB653B54A2 | INSERT INTO T1 ( COL1 , COL2 ) VALUES ( ? , COL1 * ? )  |
|    2 | A66D5C4325D82467E443039AAED826F1 | DELETE FROM T1 WHERE C1 = ? ORDER BY C2 , C3 LIMIT ?    |
|    3 | 83091A9F378BA243C82A390F5F7BBB77 | UPDATE T1 SET ID = ID + ? ORDER BY ID DESC LIMIT ?      |
+------+----------------------------------+---------------------------------------------------------+
SELECT e.id,statement_digest(e.c1) digest,statement_digest_text(e.c2) digest_text FROM t1_view e RIGHT JOIN t2_view p ON e.id = p.id ORDER BY e.id;
+------+----------------------------------+-------------------------------------------------------+
| id   | digest                           | digest_text                                           |
+------+----------------------------------+-------------------------------------------------------+
| NULL | NULL                             | NULL                                                  |
|    2 | A66D5C4325D82467E443039AAED826F1 | DELETE FROM T1 WHERE C1 = ? ORDER BY C2 , C3 LIMIT ?  |
|    3 | 83091A9F378BA243C82A390F5F7BBB77 | UPDATE T1 SET ID = ID + ? ORDER BY ID DESC LIMIT ?    |
+------+----------------------------------+-------------------------------------------------------+
SELECT e.id,statement_digest(e.c1) digest,statement_digest_text(e.c2) digest_text FROM t1_view e INNER JOIN t2_view p ON e.id = p.id WHERE statement_digest_text(e.c2) LIKE '%+%'  ORDER BY e.id;
+------+----------------------------------+-----------------------------------------------------+
| id   | digest                           | digest_text                                         |
+------+----------------------------------+-----------------------------------------------------+
|    3 | 83091A9F378BA243C82A390F5F7BBB77 | UPDATE T1 SET ID = ID + ? ORDER BY ID DESC LIMIT ?  |
+------+----------------------------------+-----------------------------------------------------+
##SELECT嵌套
#SELECT
SELECT e.id,statement_digest(e.c1) digest,statement_digest_text(e.c2) digest_text FROM (SELECT id,c1,c2 FROM t1_view WHERE statement_digest_text(c2) LIKE '%+%') e ORDER BY e.id;
+------+----------------------------------+-----------------------------------------------------+
| id   | digest                           | digest_text                                         |
+------+----------------------------------+-----------------------------------------------------+
|    3 | 83091A9F378BA243C82A390F5F7BBB77 | UPDATE T1 SET ID = ID + ? ORDER BY ID DESC LIMIT ?  |
+------+----------------------------------+-----------------------------------------------------+
#EXISTS / NOT EXISTS
SELECT e.id,statement_digest(e.c1) digest,statement_digest_text(e.c2) digest_text FROM t1_view e WHERE EXISTS (SELECT statement_digest(p.c1) FROM t2_view p WHERE statement_digest(p.c1) like '%5F%' ) ORDER BY e.id;
+------+----------------------------------+---------------------------------------------------------+
| id   | digest                           | digest_text                                             |
+------+----------------------------------+---------------------------------------------------------+
|    1 | 77B68119B2484298E19F6CFB653B54A2 | INSERT INTO T1 ( COL1 , COL2 ) VALUES ( ? , COL1 * ? )  |
|    2 | A66D5C4325D82467E443039AAED826F1 | DELETE FROM T1 WHERE C1 = ? ORDER BY C2 , C3 LIMIT ?    |
|    3 | 83091A9F378BA243C82A390F5F7BBB77 | UPDATE T1 SET ID = ID + ? ORDER BY ID DESC LIMIT ?      |
+------+----------------------------------+---------------------------------------------------------+
SELECT e.id,statement_digest(e.c1) digest,statement_digest_text(e.c2) digest_text FROM t2_view e WHERE NOT EXISTS (SELECT statement_digest(p.id) FROM t2_view p WHERE statement_digest_text(p.c2)  like '%drop%' ) ORDER BY e.id;
+------+----------------------------------+-------------------------------------------------------------+
| id   | digest                           | digest_text                                                 |
+------+----------------------------------+-------------------------------------------------------------+
|    2 | A66D5C4325D82467E443039AAED826F1 | DELETE FROM T1 WHERE C1 = ? ORDER BY C2 , C3 LIMIT ?        |
|    3 | 83091A9F378BA243C82A390F5F7BBB77 | UPDATE T1 SET ID = ID + ? ORDER BY ID DESC LIMIT ?          |
|    4 | F7A3D808C12C7E7E2392FCE142467F9D | SELECT * FROM TL WHERE ID < ? ORDER BY C1 , C2 LIMIT ? , ?  |
+------+----------------------------------+-------------------------------------------------------------+
#ANY
SELECT e.id,statement_digest(e.c1) digest,statement_digest_text(e.c2) digest_text FROM t1_view e WHERE statement_digest(e.c1) = ANY (SELECT statement_digest(p.c1) FROM t2_view p) ORDER BY e.id;
+------+----------------------------------+-------------------------------------------------------+
| id   | digest                           | digest_text                                           |
+------+----------------------------------+-------------------------------------------------------+
|    2 | A66D5C4325D82467E443039AAED826F1 | DELETE FROM T1 WHERE C1 = ? ORDER BY C2 , C3 LIMIT ?  |
|    3 | 83091A9F378BA243C82A390F5F7BBB77 | UPDATE T1 SET ID = ID + ? ORDER BY ID DESC LIMIT ?    |
+------+----------------------------------+-------------------------------------------------------+
SELECT e.id,statement_digest(e.c1) digest,statement_digest_text(e.c2) digest_text FROM t1_view e WHERE statement_digest_text(e.c2) < ANY (SELECT statement_digest_text(p.c2) FROM t2_view p) ORDER BY e.id;
+------+----------------------------------+---------------------------------------------------------+
| id   | digest                           | digest_text                                             |
+------+----------------------------------+---------------------------------------------------------+
|    1 | 77B68119B2484298E19F6CFB653B54A2 | INSERT INTO T1 ( COL1 , COL2 ) VALUES ( ? , COL1 * ? )  |
|    2 | A66D5C4325D82467E443039AAED826F1 | DELETE FROM T1 WHERE C1 = ? ORDER BY C2 , C3 LIMIT ?    |
+------+----------------------------------+---------------------------------------------------------+
#ALL 
SELECT e.id,statement_digest(e.c1) digest,statement_digest_text(e.c2) digest_text FROM t1_view e WHERE statement_digest(e.c1) = ALL (SELECT statement_digest(p.c1) FROM t2_view p WHERE p.id = 1) ORDER BY e.id;
+------+----------------------------------+---------------------------------------------------------+
| id   | digest                           | digest_text                                             |
+------+----------------------------------+---------------------------------------------------------+
|    1 | 77B68119B2484298E19F6CFB653B54A2 | INSERT INTO T1 ( COL1 , COL2 ) VALUES ( ? , COL1 * ? )  |
|    2 | A66D5C4325D82467E443039AAED826F1 | DELETE FROM T1 WHERE C1 = ? ORDER BY C2 , C3 LIMIT ?    |
|    3 | 83091A9F378BA243C82A390F5F7BBB77 | UPDATE T1 SET ID = ID + ? ORDER BY ID DESC LIMIT ?      |
+------+----------------------------------+---------------------------------------------------------+
SELECT e.id,statement_digest(e.c1) digest,statement_digest_text(e.c2) digest_text FROM t1_view e WHERE statement_digest_text(e.c2) <= ALL (SELECT statement_digest_text(p.c2) FROM t2_view p WHERE p.id <= 3) ORDER BY e.id;
+------+----------------------------------+-------------------------------------------------------+
| id   | digest                           | digest_text                                           |
+------+----------------------------------+-------------------------------------------------------+
|    2 | A66D5C4325D82467E443039AAED826F1 | DELETE FROM T1 WHERE C1 = ? ORDER BY C2 , C3 LIMIT ?  |
+------+----------------------------------+-------------------------------------------------------+
#CREATE AS 
CREATE VIEW t3_view AS SELECT e.id,statement_digest(e.c1) digest,statement_digest_text(e.c2) digest_text FROM t1_view e;
SELECT * FROM t3_view ORDER BY id;
+------+----------------------------------+---------------------------------------------------------+
| id   | digest                           | digest_text                                             |
+------+----------------------------------+---------------------------------------------------------+
|    1 | 77B68119B2484298E19F6CFB653B54A2 | INSERT INTO T1 ( COL1 , COL2 ) VALUES ( ? , COL1 * ? )  |
|    2 | A66D5C4325D82467E443039AAED826F1 | DELETE FROM T1 WHERE C1 = ? ORDER BY C2 , C3 LIMIT ?    |
|    3 | 83091A9F378BA243C82A390F5F7BBB77 | UPDATE T1 SET ID = ID + ? ORDER BY ID DESC LIMIT ?      |
+------+----------------------------------+---------------------------------------------------------+
#WITH AS的SELECT
WITH a AS (SELECT id,c1,statement_digest(c1) digest FROM t1_view WHERE id<3) SELECT a.id,a.c1,a.digest FROM a ORDER BY a.id;
+------+-----------------------------------------+----------------------------------+
| id   | c1                                      | digest                           |
+------+-----------------------------------------+----------------------------------+
|    1 | INSERT INTO t1(col1,col2) VALUES(15,25) | 77B68119B2484298E19F6CFB653B54A2 |
|    2 | DELETE FROM t1 WHERE c1 = "whh"         | A66D5C4325D82467E443039AAED826F1 |
+------+-----------------------------------------+----------------------------------+
WITH a AS (SELECT id,c1,statement_digest_text(c2) digest_text FROM t1_view WHERE id<4) SELECT a.id,a.c1,a.digest_text FROM a ORDER BY a.id;
+------+-----------------------------------------+---------------------------------------------------------+
| id   | c1                                      | digest_text                                             |
+------+-----------------------------------------+---------------------------------------------------------+
|    1 | INSERT INTO t1(col1,col2) VALUES(15,25) | INSERT INTO T1 ( COL1 , COL2 ) VALUES ( ? , COL1 * ? )  |
|    2 | DELETE FROM t1 WHERE c1 = "whh"         | DELETE FROM T1 WHERE C1 = ? ORDER BY C2 , C3 LIMIT ?    |
|    3 | UPDATE t1 SET id = id + 1               | UPDATE T1 SET ID = ID + ? ORDER BY ID DESC LIMIT ?      |
+------+-----------------------------------------+---------------------------------------------------------+
#模糊查询like 
SELECT e.id,statement_digest(e.c1) digest,statement_digest_text(e.c2) digest_text FROM t1_view e WHERE statement_digest(e.c1) LIKE '%B%' ORDER BY e.id;
+------+----------------------------------+---------------------------------------------------------+
| id   | digest                           | digest_text                                             |
+------+----------------------------------+---------------------------------------------------------+
|    1 | 77B68119B2484298E19F6CFB653B54A2 | INSERT INTO T1 ( COL1 , COL2 ) VALUES ( ? , COL1 * ? )  |
|    3 | 83091A9F378BA243C82A390F5F7BBB77 | UPDATE T1 SET ID = ID + ? ORDER BY ID DESC LIMIT ?      |
+------+----------------------------------+---------------------------------------------------------+
SELECT e.id,statement_digest(e.c1) digest,statement_digest_text(e.c2) digest_text FROM t1_view e WHERE statement_digest_text(e.c2) NOT LIKE '%alter%' ORDER BY e.id;
+------+----------------------------------+---------------------------------------------------------+
| id   | digest                           | digest_text                                             |
+------+----------------------------------+---------------------------------------------------------+
|    1 | 77B68119B2484298E19F6CFB653B54A2 | INSERT INTO T1 ( COL1 , COL2 ) VALUES ( ? , COL1 * ? )  |
|    2 | A66D5C4325D82467E443039AAED826F1 | DELETE FROM T1 WHERE C1 = ? ORDER BY C2 , C3 LIMIT ?    |
|    3 | 83091A9F378BA243C82A390F5F7BBB77 | UPDATE T1 SET ID = ID + ? ORDER BY ID DESC LIMIT ?      |
+------+----------------------------------+---------------------------------------------------------+
### update
UPDATE t1_view SET c1 = 'INSERT INTO t1 VALUES(15,25,35)' WHERE statement_digest(c1) = statement_digest('INSERT INTO t1(col1,col2) VALUES(15,25)');
UPDATE t1_view SET c2 = 'INSERT INTO t1(col1,col2) VALUES(16,col1*3/4)' WHERE statement_digest_text(c2) like '%*%' ORDER BY statement_digest_text(c2) DESC;
UPDATE t1_view SET c1 = 'UPDATE t1 SET id = id * 2' WHERE id = (SELECT id FROM t2_view WHERE statement_digest_text(c1) like '%+%');
SELECT id,c1,c2 FROM t1_view ORDER BY id;
+------+---------------------------------+--------------------------------------------------------+
| id   | c1                              | c2                                                     |
+------+---------------------------------+--------------------------------------------------------+
|    1 | INSERT INTO t1 VALUES(15,25,35) | INSERT INTO t1(col1,col2) VALUES(16,col1*3/4)          |
|    2 | DELETE FROM t1 WHERE c1 = "whh" | DELETE FROM t1 WHERE c1 = "whh" ORDER BY c2,c3 LIMIT 2 |
|    3 | UPDATE t1 SET id = id * 2       | UPDATE t1 SET id = id + 1 ORDER BY id DESC LIMIT 4     |
+------+---------------------------------+--------------------------------------------------------+
###delete
SELECT * FROM  t2_view ORDER BY id;
+------+---------------------------------+----------------------------------------------------------+
| id   | c1                              | c2                                                       |
+------+---------------------------------+----------------------------------------------------------+
|    2 | DELETE FROM t1 WHERE c1 = "whh" | DELETE FROM t1 WHERE c1 = "whh" ORDER BY c2,c3 LIMIT 2   |
|    3 | UPDATE t1 SET id = id * 2       | UPDATE t1 SET id = id + 1 ORDER BY id DESC LIMIT 4       |
|    4 | SELECT * FROM tl WHERE id < 20  | SELECT * FROM tl WHERE id < 20 ORDER BY c1,c2 LIMIT 6,10 |
+------+---------------------------------+----------------------------------------------------------+
DELETE FROM t2_view WHERE statement_digest(c1) = statement_digest('DELETE FROM t1 WHERE c1 = "whh"') ORDER BY statement_digest(c1);
DELETE FROM t2_view WHERE statement_digest_text(c2) LIKE '%<%' ORDER BY statement_digest(c1);
SELECT * FROM  t2_view ORDER BY id;
+------+---------------------------+----------------------------------------------------+
| id   | c1                        | c2                                                 |
+------+---------------------------+----------------------------------------------------+
|    3 | UPDATE t1 SET id = id * 2 | UPDATE t1 SET id = id + 1 ORDER BY id DESC LIMIT 4 |
+------+---------------------------+----------------------------------------------------+
######################### 标签：digest-6-2 索引 #########################
DROP INDEX `digest_index1` ON digest_table1;
DROP INDEX `digest_index2` ON digest_table1;
CREATE INDEX digest_index1 ON digest_table1(id);
ALTER TABLE digest_table1 ADD INDEX digest_index2(id);
#insert 
insert into digest_table2 SELECT id+5,c1,statement_digest(c1),statement_digest_text(c1) FROM digest_table1 e WHERE id < 2;
SELECT * FROM digest_table2 ORDER BY id;
+----+---------------------------------+----------------------------------+--------------------------------------+
| id | sqls                            | digest                           | digest_text                          |
+----+---------------------------------+----------------------------------+--------------------------------------+
|  1 | INSERT INTO t1 VALUES(15,25)    | 0896093076902A887B06E3329D9AF69E | INSERT INTO T1 VALUES ( ? , ? )      |
|  2 | DELETE FROM t1 WHERE c1 = "whh" | A66D5C4325D82467E443039AAED826F1 | DELETE FROM T1 WHERE C1 = ?          |
|  3 | UPDATE t1 SET id = id + 1       | 83091A9F378BA243C82A390F5F7BBB77 | UPDATE T1 SET ID = ID + ?            |
|  5 | SELECT * FROM tl WHERE id < 20  | F7A3D808C12C7E7E2392FCE142467F9D | SELECT * FROM TL WHERE ID < ?        |
|  6 | INSERT INTO t1 VALUES(15,25,35) | 03CC01C679F263866804F4015AD43EF9 | INSERT INTO T1 VALUES ( ? , ? , ? )  |
+----+---------------------------------+----------------------------------+--------------------------------------+
#update 
UPDATE digest_table2 set sqls = 'INSERT INTO t1 VALUES(15,25*3)' WHERE digest = statement_digest('INSERT INTO t1 VALUES(15,25)');
SELECT * FROM digest_table2 ORDER BY id;
+----+---------------------------------+----------------------------------+--------------------------------------+
| id | sqls                            | digest                           | digest_text                          |
+----+---------------------------------+----------------------------------+--------------------------------------+
|  1 | INSERT INTO t1 VALUES(15,25*3)  | 0896093076902A887B06E3329D9AF69E | INSERT INTO T1 VALUES ( ? , ? )      |
|  2 | DELETE FROM t1 WHERE c1 = "whh" | A66D5C4325D82467E443039AAED826F1 | DELETE FROM T1 WHERE C1 = ?          |
|  3 | UPDATE t1 SET id = id + 1       | 83091A9F378BA243C82A390F5F7BBB77 | UPDATE T1 SET ID = ID + ?            |
|  5 | SELECT * FROM tl WHERE id < 20  | F7A3D808C12C7E7E2392FCE142467F9D | SELECT * FROM TL WHERE ID < ?        |
|  6 | INSERT INTO t1 VALUES(15,25,35) | 03CC01C679F263866804F4015AD43EF9 | INSERT INTO T1 VALUES ( ? , ? , ? )  |
+----+---------------------------------+----------------------------------+--------------------------------------+
UPDATE digest_table2 set digest_text = statement_digest_text('UPDATE t1 SET id = id * 1') WHERE id = 3;
SELECT *  FROM digest_table2 ORDER BY id;
+----+---------------------------------+----------------------------------+--------------------------------------+
| id | sqls                            | digest                           | digest_text                          |
+----+---------------------------------+----------------------------------+--------------------------------------+
|  1 | INSERT INTO t1 VALUES(15,25*3)  | 0896093076902A887B06E3329D9AF69E | INSERT INTO T1 VALUES ( ? , ? )      |
|  2 | DELETE FROM t1 WHERE c1 = "whh" | A66D5C4325D82467E443039AAED826F1 | DELETE FROM T1 WHERE C1 = ?          |
|  3 | UPDATE t1 SET id = id + 1       | 83091A9F378BA243C82A390F5F7BBB77 | UPDATE T1 SET ID = ID * ?            |
|  5 | SELECT * FROM tl WHERE id < 20  | F7A3D808C12C7E7E2392FCE142467F9D | SELECT * FROM TL WHERE ID < ?        |
|  6 | INSERT INTO t1 VALUES(15,25,35) | 03CC01C679F263866804F4015AD43EF9 | INSERT INTO T1 VALUES ( ? , ? , ? )  |
+----+---------------------------------+----------------------------------+--------------------------------------+
#SELECT 
SELECT id,statement_digest(c1) digest,statement_digest_text(c2) digest_text FROM digest_table1 e WHERE statement_digest_text(c2) LIKE '%INSERT%' ORDER BY e.id;
+------+----------------------------------+-------------------------------------------------------------+
| id   | digest                           | digest_text                                                 |
+------+----------------------------------+-------------------------------------------------------------+
|    1 | 03CC01C679F263866804F4015AD43EF9 | INSERT INTO T1 ( COL1 , COL2 ) VALUES ( ? , COL1 * ? / ? )  |
+------+----------------------------------+-------------------------------------------------------------+
SELECT id,statement_digest(c1) digest,statement_digest_text(c2) digest_text FROM digest_table1 e WHERE statement_digest_text(c2) LIKE '%UPDATE%' order by statement_digest(e.c2) desc;
+------+----------------------------------+-----------------------------------------------------+
| id   | digest                           | digest_text                                         |
+------+----------------------------------+-----------------------------------------------------+
|    3 | D831D6237F80DD0F0E46164B8FA07F95 | UPDATE T1 SET ID = ID + ? ORDER BY ID DESC LIMIT ?  |
+------+----------------------------------+-----------------------------------------------------+
#delete 
SELECT count(*) FROM digest_table2;
+----------+
| count(*) |
+----------+
|        5 |
+----------+
DELETE FROM digest_table2 WHERE digest = statement_digest('SELECT * FROM tl WHERE id < 20');
SELECT * FROM digest_table2 ORDER BY id;
+----+---------------------------------+----------------------------------+--------------------------------------+
| id | sqls                            | digest                           | digest_text                          |
+----+---------------------------------+----------------------------------+--------------------------------------+
|  1 | INSERT INTO t1 VALUES(15,25*3)  | 0896093076902A887B06E3329D9AF69E | INSERT INTO T1 VALUES ( ? , ? )      |
|  2 | DELETE FROM t1 WHERE c1 = "whh" | A66D5C4325D82467E443039AAED826F1 | DELETE FROM T1 WHERE C1 = ?          |
|  3 | UPDATE t1 SET id = id + 1       | 83091A9F378BA243C82A390F5F7BBB77 | UPDATE T1 SET ID = ID * ?            |
|  6 | INSERT INTO t1 VALUES(15,25,35) | 03CC01C679F263866804F4015AD43EF9 | INSERT INTO T1 VALUES ( ? , ? , ? )  |
+----+---------------------------------+----------------------------------+--------------------------------------+
######################### 标签：digest-6-3 约束 #########################
DROP TABLE digest_table1;
CREATE TABLE `digest_table1` (
  `id` int PRIMARY KEY,
  `sqls` varchar(255)  NOT NULL,
  `digest` varchar(255) UNIQUE,
  `digest_text` varchar(255) NOT NULL
);
#insert 
INSERT INTO digest_table1 VALUES(1,'INSERT INTO t1 VALUES(15,25)',statement_digest('INSERT INTO t1 VALUES(15,25)'),statement_digest_text('INSERT INTO t1 VALUES(15,25)'));
INSERT INTO digest_table1 VALUES(2,'DELETE FROM t1 WHERE c1 = "whh"',statement_digest('DELETE FROM t1 WHERE c1 = "whh"'),statement_digest_text('DELETE FROM t1 WHERE c1 = "whh"'));
INSERT INTO digest_table1 VALUES(3,'UPDATE t1 SET id = id + 1',statement_digest('UPDATE t1 SET id = id + 1'),statement_digest_text('UPDATE t1 SET id = id + 1'));
INSERT INTO digest_table1 VALUES(4,'SELECT * FROM tl WHERE id < 20',statement_digest('SELECT * FROM tl WHERE id < 20'),statement_digest_text('SELECT * FROM tl WHERE id < 20'));
SELECT * FROM digest_table1 ORDER BY id;
+----+---------------------------------+----------------------------------+----------------------------------+
| id | sqls                            | digest                           | digest_text                      |
+----+---------------------------------+----------------------------------+----------------------------------+
|  1 | INSERT INTO t1 VALUES(15,25)    | 0896093076902A887B06E3329D9AF69E | INSERT INTO T1 VALUES ( ? , ? )  |
|  2 | DELETE FROM t1 WHERE c1 = "whh" | A66D5C4325D82467E443039AAED826F1 | DELETE FROM T1 WHERE C1 = ?      |
|  3 | UPDATE t1 SET id = id + 1       | 83091A9F378BA243C82A390F5F7BBB77 | UPDATE T1 SET ID = ID + ?        |
|  4 | SELECT * FROM tl WHERE id < 20  | F7A3D808C12C7E7E2392FCE142467F9D | SELECT * FROM TL WHERE ID < ?    |
+----+---------------------------------+----------------------------------+----------------------------------+
#update 
UPDATE digest_table1 set sqls = 'INSERT INTO t1 VALUES(15,25*3)',digest_text=statement_digest_text('INSERT INTO t1 VALUES(15,25*3)') WHERE digest = statement_digest('INSERT INTO t1 VALUES(15,25)');
SELECT * FROM digest_table1 ORDER BY id;
+----+---------------------------------+----------------------------------+--------------------------------------+
| id | sqls                            | digest                           | digest_text                          |
+----+---------------------------------+----------------------------------+--------------------------------------+
|  1 | INSERT INTO t1 VALUES(15,25*3)  | 0896093076902A887B06E3329D9AF69E | INSERT INTO T1 VALUES ( ? , ? * ? )  |
|  2 | DELETE FROM t1 WHERE c1 = "whh" | A66D5C4325D82467E443039AAED826F1 | DELETE FROM T1 WHERE C1 = ?          |
|  3 | UPDATE t1 SET id = id + 1       | 83091A9F378BA243C82A390F5F7BBB77 | UPDATE T1 SET ID = ID + ?            |
|  4 | SELECT * FROM tl WHERE id < 20  | F7A3D808C12C7E7E2392FCE142467F9D | SELECT * FROM TL WHERE ID < ?        |
+----+---------------------------------+----------------------------------+--------------------------------------+
#SELECT 
SELECT * FROM digest_table1 WHERE digest = statement_digest('UPDATE t1 SET id = id + 1') ORDER BY id;
+----+---------------------------+----------------------------------+----------------------------+
| id | sqls                      | digest                           | digest_text                |
+----+---------------------------+----------------------------------+----------------------------+
|  3 | UPDATE t1 SET id = id + 1 | 83091A9F378BA243C82A390F5F7BBB77 | UPDATE T1 SET ID = ID + ?  |
+----+---------------------------+----------------------------------+----------------------------+
SELECT * FROM digest_table1 WHERE digest_text LIKE '%?%' ORDER BY id;
+----+---------------------------------+----------------------------------+--------------------------------------+
| id | sqls                            | digest                           | digest_text                          |
+----+---------------------------------+----------------------------------+--------------------------------------+
|  1 | INSERT INTO t1 VALUES(15,25*3)  | 0896093076902A887B06E3329D9AF69E | INSERT INTO T1 VALUES ( ? , ? * ? )  |
|  2 | DELETE FROM t1 WHERE c1 = "whh" | A66D5C4325D82467E443039AAED826F1 | DELETE FROM T1 WHERE C1 = ?          |
|  3 | UPDATE t1 SET id = id + 1       | 83091A9F378BA243C82A390F5F7BBB77 | UPDATE T1 SET ID = ID + ?            |
|  4 | SELECT * FROM tl WHERE id < 20  | F7A3D808C12C7E7E2392FCE142467F9D | SELECT * FROM TL WHERE ID < ?        |
+----+---------------------------------+----------------------------------+--------------------------------------+
#delete 
SELECT count(*) FROM digest_table1;
+----------+
| count(*) |
+----------+
|        4 |
+----------+
DELETE FROM digest_table1 WHERE digest = statement_digest('DELETE FROM t1 WHERE c1 = "whh"');
SELECT * FROM digest_table1 ORDER BY id;
+----+--------------------------------+----------------------------------+--------------------------------------+
| id | sqls                           | digest                           | digest_text                          |
+----+--------------------------------+----------------------------------+--------------------------------------+
|  1 | INSERT INTO t1 VALUES(15,25*3) | 0896093076902A887B06E3329D9AF69E | INSERT INTO T1 VALUES ( ? , ? * ? )  |
|  3 | UPDATE t1 SET id = id + 1      | 83091A9F378BA243C82A390F5F7BBB77 | UPDATE T1 SET ID = ID + ?            |
|  4 | SELECT * FROM tl WHERE id < 20 | F7A3D808C12C7E7E2392FCE142467F9D | SELECT * FROM TL WHERE ID < ?        |
+----+--------------------------------+----------------------------------+--------------------------------------+
# Clean up users
drop user whh@'%';
