drop table if exists t;
create table t(
id              int primary key auto_increment,
col_int8        tinyint,
col_int16       smallint,
col_int24       mediumint,
col_int32       int,
col_int64       bigint,
col_uint8       tinyint unsigned,
col_uint16      smallint unsigned,
col_uint24      mediumint unsigned,
col_uint32      int unsigned,
col_uint64      bigint unsigned,
col_float       float,
col_double      double,
col_ufloat      float unsigned,
col_udouble     double unsigned,
col_decimal     decimal(20, 2),
col_udecimal    decimal(20, 4) unsigned,
col_datetime    datetime(2),
col_timestamp   timestamp(3) null default null,
col_date        date,
col_time        time(4),
col_year        year(4),
col_varchar     varchar(6),
col_char        char(5),
col_varbinary   varbinary(5),
col_binary      binary(4),
col_varchar0    varchar(0),
col_varbinary0  varbinary(0)
);
set sql_mode='strict_all_tables';
delete from t;
insert into t(col_int8) values (-129);
insert into t(col_int8) values (-128);
insert into t(col_int8) values (127);
insert into t(col_int8) values (128);
insert into t(col_int16) values (-32769);
insert into t(col_int16) values (-32768);
insert into t(col_int16) values (32767);
insert into t(col_int16) values (32768);
insert into t(col_int24) values (-8388609);
insert into t(col_int24) values (-8388608);
insert into t(col_int24) values (8388607);
insert into t(col_int24) values (8388608);
insert into t(col_int32) values (-2147483649);
insert into t(col_int32) values (-2147483648);
insert into t(col_int32) values (2147483647);
insert into t(col_int32) values (2147483648);
insert into t(col_int64) values ('11a');
insert into t(col_int64) values ('22.4 ');
insert into t(col_int64) values (' 33.5');
insert into t(col_int64) values (' 44 ');
insert into t(col_int64) values ('55 5');
insert into t(col_int64) values ('66 a');
insert into t(col_int64) values ('77. 9');
insert into t(col_int64) values ('88.a');
insert into t(col_int64) values ('99.9a');
insert into t(col_int64) values (-9223372036854775809);
insert into t(col_int64) values (-9223372036854775808);
insert into t(col_int64) values (9223372036854775807);
insert into t(col_int64) values (9223372036854775808);
insert into t(col_uint8) values (-1);
insert into t(col_uint8) values (0);
insert into t(col_uint8) values (255);
insert into t(col_uint8) values (256);
insert into t(col_uint16) values (-1);
insert into t(col_uint16) values (0);
insert into t(col_uint16) values (65535);
insert into t(col_uint16) values (65536);
insert into t(col_uint24) values (-1);
insert into t(col_uint24) values (0);
insert into t(col_uint24) values (16777215);
insert into t(col_uint24) values (16777216);
insert into t(col_uint32) values (-1);
insert into t(col_uint32) values (0);
insert into t(col_uint32) values (4294967295);
insert into t(col_uint32) values (4294967296);
insert into t(col_uint64) values ('11a');
insert into t(col_uint64) values ('22.4 ');
insert into t(col_uint64) values (' 33.5');
insert into t(col_uint64) values (' 44 ');
insert into t(col_uint64) values ('55 5');
insert into t(col_uint64) values ('66 a');
insert into t(col_uint64) values ('77. 9');
insert into t(col_uint64) values ('88.a');
insert into t(col_uint64) values ('99.9a');
insert into t(col_uint64) values (-1);
insert into t(col_uint64) values (0);
insert into t(col_uint64) values (18446744073709551615);
insert into t(col_uint64) values (18446744073709551616);
insert into t(col_year) values ('2001a');
insert into t(col_year) values ('201a');
insert into t(col_year) values ('21a');
insert into t(col_year) values ('2a');
insert into t(col_year) values (1900);
insert into t(col_year) values (1901);
insert into t(col_year) values (2155);
insert into t(col_year) values (2156);
insert into t(col_varchar) values ('bb        ');
insert into t(col_varchar) values ('cc       !');
insert into t(col_varchar) values (0x6565202020202020202020);
insert into t(col_varchar) values (0x6666202020202020202021);
insert into t(col_varchar) values (0x6767000000000000000000);
insert into t(col_varchar) values (0x6868000000000000000021);
insert into t(col_varchar) values ('支付宝          ');
insert into t(col_varchar) values ('淘宝           !');
insert into t(col_char) values ('bb        ');
insert into t(col_char) values ('cc       !');
insert into t(col_char) values (0x6565202020202020202020);
insert into t(col_char) values (0x6666202020202020202021);
insert into t(col_char) values (0x6767000000000000000000);
insert into t(col_char) values (0x6868000000000000000021);
insert into t(col_char) values ('支付宝          ');
insert into t(col_char) values ('淘宝           !');
insert into t(col_varbinary) values ('bb        ');
insert into t(col_varbinary) values ('cc       !');
insert into t(col_varbinary) values (0x6565202020202020202020);
insert into t(col_varbinary) values (0x6666202020202020202021);
insert into t(col_varbinary) values (0x6767000000000000000000);
insert into t(col_varbinary) values (0x6868000000000000000021);
insert into t(col_varbinary) values ('支付宝          ');
insert into t(col_varbinary) values ('淘宝           !');
insert into t(col_binary) values ('bb        ');
insert into t(col_binary) values ('cc       !');
insert into t(col_binary) values (0x6565202020202020202020);
insert into t(col_binary) values (0x6666202020202020202021);
insert into t(col_binary) values (0x6767000000000000000000);
insert into t(col_binary) values (0x6868000000000000000021);
insert into t(col_binary) values ('支付宝          ');
insert into t(col_binary) values ('淘宝           !');
insert into t(col_varchar0) values ('');
insert into t(col_varchar0) values ('aa');
insert into t(col_varbinary0) values ('');
insert into t(col_varbinary0) values ('aa');
select col_int64 from t where col_int64 is not null order by id;
col_int64
22
34
44
-9223372036854775808
9223372036854775807
select col_uint64 from t where col_uint64 is not null order by id;
col_uint64
22
34
44
0
18446744073709551615
select col_year from t where col_year is not null order by id;
col_year
1901
2155
select hex(col_varchar) from t where col_varchar is not null order by id;
hex(col_varchar)
626220202020
656520202020
E694AFE4BB98E5AE9D202020
select hex(col_char) from t where col_char is not null order by id;
hex(col_char)
6262
6565
E694AFE4BB98E5AE9D
select hex(col_varbinary) from t where col_varbinary is not null order by id;
hex(col_varbinary)
select hex(col_binary) from t where col_binary is not null order by id;
hex(col_binary)
select hex(col_varchar0) from t where col_varchar0 is not null order by id;
hex(col_varchar0)

select hex(col_varbinary0) from t where col_varbinary0 is not null order by id;
hex(col_varbinary0)

set sql_mode='';
delete from t;
insert into t(col_int8) values (-129);
insert into t(col_int8) values (-128);
insert into t(col_int8) values (127);
insert into t(col_int8) values (128);
insert into t(col_int16) values (-32769);
insert into t(col_int16) values (-32768);
insert into t(col_int16) values (32767);
insert into t(col_int16) values (32768);
insert into t(col_int24) values (-8388609);
insert into t(col_int24) values (-8388608);
insert into t(col_int24) values (8388607);
insert into t(col_int24) values (8388608);
insert into t(col_int32) values (-2147483649);
insert into t(col_int32) values (-2147483648);
insert into t(col_int32) values (2147483647);
insert into t(col_int32) values (2147483648);
insert into t(col_int64) values ('11a');
insert into t(col_int64) values ('22.4 ');
insert into t(col_int64) values (' 33.5');
insert into t(col_int64) values (' 44 ');
insert into t(col_int64) values ('55 5');
insert into t(col_int64) values ('66 a');
insert into t(col_int64) values ('77. 9');
insert into t(col_int64) values ('88.a');
insert into t(col_int64) values ('99.9a');
insert into t(col_int64) values (-9223372036854775809);
insert into t(col_int64) values (-9223372036854775808);
insert into t(col_int64) values (9223372036854775807);
insert into t(col_int64) values (9223372036854775808);
insert into t(col_uint8) values (-1);
insert into t(col_uint8) values (0);
insert into t(col_uint8) values (255);
insert into t(col_uint8) values (256);
insert into t(col_uint16) values (-1);
insert into t(col_uint16) values (0);
insert into t(col_uint16) values (65535);
insert into t(col_uint16) values (65536);
insert into t(col_uint24) values (-1);
insert into t(col_uint24) values (0);
insert into t(col_uint24) values (16777215);
insert into t(col_uint24) values (16777216);
insert into t(col_uint32) values (-1);
insert into t(col_uint32) values (0);
insert into t(col_uint32) values (4294967295);
insert into t(col_uint32) values (4294967296);
insert into t(col_uint64) values ('11a');
insert into t(col_uint64) values ('22.4 ');
insert into t(col_uint64) values (' 33.5');
insert into t(col_uint64) values (' 44 ');
insert into t(col_uint64) values ('55 5');
insert into t(col_uint64) values ('66 a');
insert into t(col_uint64) values ('77. 9');
insert into t(col_uint64) values ('88.a');
insert into t(col_uint64) values ('99.9a');
insert into t(col_uint64) values (-1);
insert into t(col_uint64) values (0);
insert into t(col_uint64) values (18446744073709551615);
insert into t(col_uint64) values (18446744073709551616);
insert into t(col_year) values ('2001a');
insert into t(col_year) values ('201a');
insert into t(col_year) values ('21a');
insert into t(col_year) values ('2a');
insert into t(col_year) values (1900);
insert into t(col_year) values (1901);
insert into t(col_year) values (2155);
insert into t(col_year) values (2156);
insert into t(col_varchar) values ('bb        ');
insert into t(col_varchar) values ('cc       !');
insert into t(col_varchar) values (0x6565202020202020202020);
insert into t(col_varchar) values (0x6666202020202020202021);
insert into t(col_varchar) values (0x6767000000000000000000);
insert into t(col_varchar) values (0x6868000000000000000021);
insert into t(col_varchar) values ('支付宝          ');
insert into t(col_varchar) values ('淘宝           !');
insert into t(col_char) values ('bb        ');
insert into t(col_char) values ('cc       !');
insert into t(col_char) values (0x6565202020202020202020);
insert into t(col_char) values (0x6666202020202020202021);
insert into t(col_char) values (0x6767000000000000000000);
insert into t(col_char) values (0x6868000000000000000021);
insert into t(col_char) values ('支付宝          ');
insert into t(col_char) values ('淘宝           !');
insert into t(col_varbinary) values ('bb        ');
insert into t(col_varbinary) values ('cc       !');
insert into t(col_varbinary) values (0x6565202020202020202020);
insert into t(col_varbinary) values (0x6666202020202020202021);
insert into t(col_varbinary) values (0x6767000000000000000000);
insert into t(col_varbinary) values (0x6868000000000000000021);
insert into t(col_varbinary) values ('支付宝          ');
insert into t(col_varbinary) values ('淘宝           !');
insert into t(col_binary) values ('bb        ');
insert into t(col_binary) values ('cc       !');
insert into t(col_binary) values (0x6565202020202020202020);
insert into t(col_binary) values (0x6666202020202020202021);
insert into t(col_binary) values (0x6767000000000000000000);
insert into t(col_binary) values (0x6868000000000000000021);
insert into t(col_binary) values ('支付宝          ');
insert into t(col_binary) values ('淘宝           !');
insert into t(col_varchar0) values ('');
insert into t(col_varchar0) values ('aa');
insert into t(col_varbinary0) values ('');
insert into t(col_varbinary0) values ('aa');
select col_int64 from t where col_int64 is not null order by id;
col_int64
11
22
34
44
55
66
77
88
100
-9223372036854775808
-9223372036854775808
9223372036854775807
9223372036854775807
select col_uint64 from t where col_uint64 is not null order by id;
col_uint64
11
22
34
44
55
66
77
88
100
0
0
18446744073709551615
18446744073709551615
select col_year from t where col_year is not null order by id;
col_year
2001
0000
2021
2002
0000
1901
2155
0000
select hex(col_varchar) from t where col_varchar is not null order by id;
hex(col_varchar)
626220202020
636320202020
656520202020
666620202020
676700000000
686800000000
E694AFE4BB98E5AE9D202020
E6B798E5AE9D20202020
select hex(col_char) from t where col_char is not null order by id;
hex(col_char)
6262
6363
6565
6666
6767000000
6868000000
E694AFE4BB98E5AE9D
E6B798E5AE9D
select hex(col_varbinary) from t where col_varbinary is not null order by id;
hex(col_varbinary)
6262202020
6363202020
6565202020
6666202020
6767000000
6868000000
E694AFE4BB
E6B798E5AE
select hex(col_binary) from t where col_binary is not null order by id;
hex(col_binary)
62622020
63632020
65652020
66662020
67670000
68680000
E694AFE4
E6B798E5
select hex(col_varchar0) from t where col_varchar0 is not null order by id;
hex(col_varchar0)


select hex(col_varbinary0) from t where col_varbinary0 is not null order by id;
hex(col_varbinary0)


drop table if exists t;
