set @@ob_enable_plan_cache = 0;
drop table t1;
drop table t2;
drop table t1_null;
drop table t2_null;
drop table t1_constraint;
drop table t2_constraint;
create table t1 (c1 int, c2 int, b3 int);
create table t2 (c1 int, c2 int, c3 int);
insert into t1 values (1, 1, 1);
insert into t1 values (2, 1, 2);
insert into t1 values (3, 4, 3);
insert into t1 values (4, 6, 4);
insert into t1 values (5, 7, 5);
insert into t2 values (1, 1, 1);
insert into t2 values (3, 4, 4);
insert into t2 values (4, 2, 2);
insert into t2 values (6, 2, 2);
commit;
select * from t1;
C1	C2	B3
1	1	1
2	1	2
3	4	3
4	6	4
5	7	5
create table t1_null (c1 int, c2 int not null, b3 int);
create table t2_null (c1 int, c2 int, c3 int);
insert into t1_null values (1, 1, 1);
insert into t1_null values (2, 1, 2);
insert into t1_null values (3, 4, 3);
insert into t1_null values (4, 6, 4);
insert into t1_null values (5, 7, 5);
insert into t2_null values (1, 1, 1);
insert into t2_null values (3, 4, 4);
insert into t2_null values (4, 2, 2);
commit;
create table t1_constraint (c1 int , c2 int not null, b3 int,constraint uk31 unique(c2,b3));
create table t2_constraint (c1 int, c2 int, c3 int);
insert into t1_constraint values (1, 1, 1);
insert into t1_constraint values (2, 1, 2);
insert into t1_constraint values (3, 4, 3);
insert into t1_constraint values (4, 6, 4);
insert into t1_constraint values (5, 7, 5);
insert into t2_constraint values (1, 1, 1);
insert into t2_constraint values (3, 4, 4);
insert into t2_constraint values (4, 2, 2);
commit;
result_format: 4
explain_protocol: 1
set "autocommit"=0;
##old cg fail
##merge into t1 using t2 on (t1.c1 = t2.c1) when matched then update set t1.c2 = t1.c2 * 2 where t1.c2 < 5 delete where t1.c2 > 5 when not matched then insert values (t2.c1, t2.c2, t2.c3);
##normal
explain merge into t1 using t2 on (t1.c1 = t2.c1) when matched then update set t1.c2 = t1.c2 * 2 where t1.c1 < 5 delete where t1.b3 > 3 when not matched then insert values (t2.c1, t2.c2, t2.c3);
Query Plan
===================================================
|ID|OPERATOR           |NAME|EST.ROWS|EST.TIME(us)|
---------------------------------------------------
|0 |MERGE              |    |4       |7           |
|1 |└─HASH OUTER JOIN  |    |4       |7           |
|2 |  ├─TABLE FULL SCAN|T2  |4       |3           |
|3 |  └─TABLE FULL SCAN|T1  |5       |3           |
===================================================
Outputs & filters:
-------------------------------------
  0 - output(nil), filter(nil)
      columns([{T1: ({T1: (T1.__pk_increment, T1.C1, T1.C2, T1.B3)})}]), partitions(p0), 
      column_values([T_HIDDEN_PK], [column_conv(NUMBER,PS:(-1,0),NULL,T2.C1)], [column_conv(NUMBER,PS:(-1,0),NULL,T2.C2)], [column_conv(NUMBER,PS:(-1,0),
      NULL,T2.C3)]),
      update([T1.C2=column_conv(NUMBER,PS:(-1,0),NULL,T1.C2 * 2)]), 
      insert_conds(nil), update_conds([T1.C1 < 5]), delete_conds([T1.B3 > 3])
  1 - output([T1.__pk_increment], [T1.C1], [T1.C2], [T1.B3], [T2.C1], [T2.C2], [T2.C3]), filter(nil), rowset=16
      equal_conds([T1.C1 = T2.C1]), other_conds(nil)
  2 - output([T2.C1], [T2.C2], [T2.C3]), filter(nil), rowset=16
      access([T2.C1], [T2.C2], [T2.C3]), partitions(p0)
      is_index_back=false, is_global_index=false, 
      range_key([T2.__pk_increment]), range(MIN ; MAX)always true
  3 - output([T1.__pk_increment], [T1.C1], [T1.C2], [T1.B3]), filter(nil), rowset=16
      access([T1.__pk_increment], [T1.C1], [T1.C2], [T1.B3]), partitions(p0)
      is_index_back=false, is_global_index=false, 
      range_key([T1.__pk_increment]), range(MIN ; MAX)always true
merge into t1 using t2 on (t1.c1 = t2.c1) when matched then update set t1.c2 = t1.c2 * 2 where t1.c1 < 5 delete where t1.b3 > 3 when not matched then insert values (t2.c1, t2.c2, t2.c3);
EXPLAIN BASIC select * from t1;
Query Plan
=========================
|ID|OPERATOR       |NAME|
-------------------------
|0 |TABLE FULL SCAN|T1  |
=========================
Outputs & filters:
-------------------------------------
  0 - output([T1.C1], [T1.C2], [T1.B3]), filter(nil), rowset=16
      access([T1.C1], [T1.C2], [T1.B3]), partitions(p0)
      is_index_back=false, is_global_index=false, 
      range_key([T1.__pk_increment]), range(MIN ; MAX)always true
select * from t1;
+------+------+------+
| C1   | C2   | B3   |
+------+------+------+
|    1 |    2 |    1 |
|    2 |    1 |    2 |
|    3 |    8 |    3 |
|    5 |    7 |    5 |
|    6 |    2 |    2 |
+------+------+------+
rollback;

##only update
explain merge into t1 using t2 on (t1.c1 = t2.c1) when matched then update set t1.c2 = t1.c2 * 2 where t1.c1 < 5;
Query Plan
===================================================
|ID|OPERATOR           |NAME|EST.ROWS|EST.TIME(us)|
---------------------------------------------------
|0 |MERGE              |    |1       |6           |
|1 |└─HASH JOIN        |    |1       |6           |
|2 |  ├─TABLE FULL SCAN|T1  |1       |3           |
|3 |  └─TABLE FULL SCAN|T2  |4       |3           |
===================================================
Outputs & filters:
-------------------------------------
  0 - output(nil), filter(nil)
      columns([{T1: ({T1: (T1.__pk_increment, T1.C1, T1.C2, T1.B3)})}]),
      update([T1.C2=column_conv(NUMBER,PS:(-1,0),NULL,T1.C2 * 2)]), 
      insert_conds(nil), update_conds(nil), delete_conds(nil)
  1 - output([T1.__pk_increment], [T1.C1], [T1.C2], [T1.B3]), filter(nil), rowset=16
      equal_conds([T1.C1 = T2.C1]), other_conds(nil)
  2 - output([T1.__pk_increment], [T1.C1], [T1.C2], [T1.B3]), filter([T1.C1 < 5]), rowset=16
      access([T1.__pk_increment], [T1.C1], [T1.C2], [T1.B3]), partitions(p0)
      is_index_back=false, is_global_index=false, filter_before_indexback[false], 
      range_key([T1.__pk_increment]), range(MIN ; MAX)always true
  3 - output([T2.C1]), filter(nil), rowset=16
      access([T2.C1]), partitions(p0)
      is_index_back=false, is_global_index=false, 
      range_key([T2.__pk_increment]), range(MIN ; MAX)always true
merge into t1 using t2 on (t1.c1 = t2.c1) when matched then update set t1.c2 = t1.c2 * 2 where t1.c1 < 5;
EXPLAIN BASIC select * from t1;
Query Plan
=========================
|ID|OPERATOR       |NAME|
-------------------------
|0 |TABLE FULL SCAN|T1  |
=========================
Outputs & filters:
-------------------------------------
  0 - output([T1.C1], [T1.C2], [T1.B3]), filter(nil), rowset=16
      access([T1.C1], [T1.C2], [T1.B3]), partitions(p0)
      is_index_back=false, is_global_index=false, 
      range_key([T1.__pk_increment]), range(MIN ; MAX)always true
select * from t1;
+------+------+------+
| C1   | C2   | B3   |
+------+------+------+
|    1 |    2 |    1 |
|    2 |    1 |    2 |
|    3 |    8 |    3 |
|    4 |   12 |    4 |
|    5 |    7 |    5 |
+------+------+------+
rollback;

##only insert
explain merge into t1 using t2 on (t1.c1 = t2.c1) when not matched then insert values (t2.c1, t2.c2, t2.c3);
Query Plan
==========================================================
|ID|OPERATOR                 |NAME |EST.ROWS|EST.TIME(us)|
----------------------------------------------------------
|0 |INSERT                   |     |1       |13          |
|1 |└─SUBPLAN SCAN           |VIEW1|1       |6           |
|2 |  └─HASH RIGHT ANTI JOIN |     |1       |6           |
|3 |    ├─TABLE FULL SCAN    |T1   |5       |3           |
|4 |    └─TABLE FULL SCAN    |T2   |4       |3           |
==========================================================
Outputs & filters:
-------------------------------------
  0 - output(nil), filter(nil)
      columns([{T1: ({T1: (T1.__pk_increment, T1.C1, T1.C2, T1.B3)})}]), partitions(p0), 
      column_values([T_HIDDEN_PK], [column_conv(NUMBER,PS:(-1,0),NULL,VIEW1.T2.C1)], [column_conv(NUMBER,PS:(-1,0),NULL,VIEW1.T2.C2)], [column_conv(NUMBER,
      PS:(-1,0),NULL,VIEW1.T2.C3)])
  1 - output([VIEW1.T2.C1], [VIEW1.T2.C2], [VIEW1.T2.C3]), filter(nil), rowset=16
      access([VIEW1.T2.C1], [VIEW1.T2.C2], [VIEW1.T2.C3])
  2 - output([T2.C1], [T2.C2], [T2.C3]), filter(nil), rowset=16
      equal_conds([T1.C1 = T2.C1]), other_conds(nil)
  3 - output([T1.C1]), filter(nil), rowset=16
      access([T1.C1]), partitions(p0)
      is_index_back=false, is_global_index=false, 
      range_key([T1.__pk_increment]), range(MIN ; MAX)always true
  4 - output([T2.C1], [T2.C2], [T2.C3]), filter(nil), rowset=16
      access([T2.C1], [T2.C2], [T2.C3]), partitions(p0)
      is_index_back=false, is_global_index=false, 
      range_key([T2.__pk_increment]), range(MIN ; MAX)always true
merge into t1 using t2 on (t1.c1 = t2.c1) when not matched then insert values (t2.c1, t2.c2, t2.c3);
EXPLAIN BASIC select * from t1;
Query Plan
=========================
|ID|OPERATOR       |NAME|
-------------------------
|0 |TABLE FULL SCAN|T1  |
=========================
Outputs & filters:
-------------------------------------
  0 - output([T1.C1], [T1.C2], [T1.B3]), filter(nil), rowset=16
      access([T1.C1], [T1.C2], [T1.B3]), partitions(p0)
      is_index_back=false, is_global_index=false, 
      range_key([T1.__pk_increment]), range(MIN ; MAX)always true
select * from t1;
+------+------+------+
| C1   | C2   | B3   |
+------+------+------+
|    1 |    1 |    1 |
|    2 |    1 |    2 |
|    3 |    4 |    3 |
|    4 |    6 |    4 |
|    5 |    7 |    5 |
|    6 |    2 |    2 |
+------+------+------+
rollback;

##check null
select* from t1_null;
+------+----+------+
| C1   | C2 | B3   |
+------+----+------+
|    1 |  1 |    1 |
|    2 |  1 |    2 |
|    3 |  4 |    3 |
|    4 |  6 |    4 |
|    5 |  7 |    5 |
+------+----+------+
set "autocommit"=0;
explain merge into t1_null t1 using t2_null t2 on (t1.c1 = t2.c1) when matched then update set t1.c2 = case when t2.c2 = 4 then null else t2.c2 * 2 end where t2.c2 < 5 delete where t1.b3  > 3 when not matched then insert values (t2.c1, t2.c2, t2.c3);
Query Plan
===================================================
|ID|OPERATOR           |NAME|EST.ROWS|EST.TIME(us)|
---------------------------------------------------
|0 |MERGE              |    |3       |7           |
|1 |└─HASH OUTER JOIN  |    |3       |7           |
|2 |  ├─TABLE FULL SCAN|T2  |3       |3           |
|3 |  └─TABLE FULL SCAN|T1  |5       |3           |
===================================================
Outputs & filters:
-------------------------------------
  0 - output(nil), filter(nil)
      columns([{T1: ({T1_NULL: (T1.__pk_increment, T1.C1, T1.C2, T1.B3)})}]), partitions(p0), 
      column_values([T_HIDDEN_PK], [column_conv(NUMBER,PS:(-1,0),NULL,T2.C1)], [column_conv(NUMBER,PS:(-1,0),NOT NULL,T2.C2)], [column_conv(NUMBER,PS:(-1,
      0),NULL,T2.C3)]),
      update([T1.C2=column_conv(NUMBER,PS:(-1,0),NOT NULL,CASE WHEN T2.C2 = 4 THEN NULL ELSE T2.C2 * 2 END)]), 
      insert_conds(nil), update_conds([T2.C2 < 5]), delete_conds([T1.B3 > 3])
  1 - output([T1.__pk_increment], [T1.C1], [T1.C2], [T1.B3], [T2.C2], [T2.C1], [T2.C3]), filter(nil), rowset=16
      equal_conds([T1.C1 = T2.C1]), other_conds(nil)
  2 - output([T2.C1], [T2.C2], [T2.C3]), filter(nil), rowset=16
      access([T2.C1], [T2.C2], [T2.C3]), partitions(p0)
      is_index_back=false, is_global_index=false, 
      range_key([T2.__pk_increment]), range(MIN ; MAX)always true
  3 - output([T1.__pk_increment], [T1.C1], [T1.C2], [T1.B3]), filter(nil), rowset=16
      access([T1.__pk_increment], [T1.C1], [T1.C2], [T1.B3]), partitions(p0)
      is_index_back=false, is_global_index=false, 
      range_key([T1.__pk_increment]), range(MIN ; MAX)always true
merge into t1_null t1 using t2_null t2 on (t1.c1 = t2.c1) when matched then update set t1.c2 = case when t2.c2 = 4 then null else t2.c2 * 2 end where t2.c2 < 5 delete where t1.b3  > 3 when not matched then insert values (t2.c1, t2.c2, t2.c3);
ERROR 23000: cannot insert NULL into '(C2)'
select* from t1_null;
+------+----+------+
| C1   | C2 | B3   |
+------+----+------+
|    1 |  1 |    1 |
|    2 |  1 |    2 |
|    3 |  4 |    3 |
|    4 |  6 |    4 |
|    5 |  7 |    5 |
+------+----+------+
rollback;

##constraint
EXPLAIN BASIC select * from t1_constraint;
Query Plan
==================================
|ID|OPERATOR       |NAME         |
----------------------------------
|0 |TABLE FULL SCAN|T1_CONSTRAINT|
==================================
Outputs & filters:
-------------------------------------
  0 - output([T1_CONSTRAINT.C1], [T1_CONSTRAINT.C2], [T1_CONSTRAINT.B3]), filter(nil), rowset=16
      access([T1_CONSTRAINT.C1], [T1_CONSTRAINT.C2], [T1_CONSTRAINT.B3]), partitions(p0)
      is_index_back=false, is_global_index=false, 
      range_key([T1_CONSTRAINT.__pk_increment]), range(MIN ; MAX)always true
select * from t1_constraint;
+------+----+------+
| C1   | C2 | B3   |
+------+----+------+
|    1 |  1 |    1 |
|    2 |  1 |    2 |
|    3 |  4 |    3 |
|    4 |  6 |    4 |
|    5 |  7 |    5 |
+------+----+------+
set "autocommit"=0;
explain merge into t1_constraint t1 using t2_constraint t2 on (t1.c1 = t2.c1) when matched then update set t1.c2 = 1,t1.b3=2 where t2.c2 < 5 delete where t1.c1  > 3 when not matched then insert values (t2.c1, t2.c2, t2.c3);
Query Plan
===================================================
|ID|OPERATOR           |NAME|EST.ROWS|EST.TIME(us)|
---------------------------------------------------
|0 |MERGE              |    |3       |7           |
|1 |└─HASH OUTER JOIN  |    |3       |7           |
|2 |  ├─TABLE FULL SCAN|T2  |3       |3           |
|3 |  └─TABLE FULL SCAN|T1  |5       |3           |
===================================================
Outputs & filters:
-------------------------------------
  0 - output(nil), filter(nil)
      columns([{T1: ({T1_CONSTRAINT: (T1.__pk_increment, T1.C1, T1.C2, T1.B3)})}]), partitions(p0), 
      column_values([T_HIDDEN_PK], [column_conv(NUMBER,PS:(-1,0),NULL,T2.C1)], [column_conv(NUMBER,PS:(-1,0),NOT NULL,T2.C2)], [column_conv(NUMBER,PS:(-1,
      0),NULL,T2.C3)]),
      update([T1.C2=column_conv(NUMBER,PS:(-1,0),NOT NULL,1)], [T1.B3=column_conv(NUMBER,PS:(-1,0),NULL,2)]), 
      insert_conds(nil), update_conds([T2.C2 < 5]), delete_conds([T1.C1 > 3])
  1 - output([T1.__pk_increment], [T1.C1], [T1.C2], [T1.B3], [T2.C2], [T2.C1], [T2.C3]), filter(nil), rowset=16
      equal_conds([T1.C1 = T2.C1]), other_conds(nil)
  2 - output([T2.C1], [T2.C2], [T2.C3]), filter(nil), rowset=16
      access([T2.C1], [T2.C2], [T2.C3]), partitions(p0)
      is_index_back=false, is_global_index=false, 
      range_key([T2.__pk_increment]), range(MIN ; MAX)always true
  3 - output([T1.__pk_increment], [T1.C1], [T1.C2], [T1.B3]), filter(nil), rowset=16
      access([T1.__pk_increment], [T1.C1], [T1.C2], [T1.B3]), partitions(p0)
      is_index_back=false, is_global_index=false, 
      range_key([T1.__pk_increment]), range(MIN ; MAX)always true
merge into t1_constraint t1 using t2_constraint t2 on (t1.c1 = t2.c1) when matched then update set t1.c2 = 1,t1.b3=2 where t2.c2 < 5 delete where t1.c1  > 3 when not matched then insert values (t2.c1, t2.c2, t2.c3);
ERROR 23000: unique constraint '1-2' for key 'UK31' violated
select* from t1_constraint;
+------+----+------+
| C1   | C2 | B3   |
+------+----+------+
|    1 |  1 |    1 |
|    2 |  1 |    2 |
|    3 |  4 |    3 |
|    4 |  6 |    4 |
|    5 |  7 |    5 |
+------+----+------+
rollback;

drop table t1;
drop table t2;
drop table t1_null;
drop table t2_null;
drop table t1_constraint;
drop table t2_constraint;



