#Environmental cleaning
drop user hjw@'%';
create user hjw identified by 'hjw';
grant all on *.* to hjw WITH GRANT OPTION;
#user-1  基础操作
#user-2  数据库常规操作
#user-3  表的常规操作
#user-4  视图的增删改查
#user-5  索引
#user-6  约束
#user-7  多表相连
#user-1  基础操作
DROP user "xiaobai"@"%";
#user-1-1  创建用户
create user "xiaobai"@"%" IDENTIFIED by "123456";
create user "xiaobai"@"%" IDENTIFIED by "123456";
#user-1-3  授权
grant all on *.* to 'xiaobai'@'%';
#user-1-2  查询拥有的权限
#user-1-4  识别当前用户
#user-1-6  修改密码
set password for 'xiaobai'@'%'=password('234567');
#user-1-7  查询已有用户
#user-1-5  取消所有权限
#user-2-4-1  删除用户
DROP user "xiaobai"@"%";
#user-2  数据库常规操作
#user-2-3-1  查询有哪些数据库
#user-2-1-1  创建数据库
drop database 数据库1;
create database ceshi;
create database 123;
create database 123?;
create database ceshi123;
drop database ceshi123;
create database ceshi?;
create database 表1;
drop database 表1;
create database 表&;
create database null;
create database 数据库1,数据库2;
use ceshi;
#user-2-3-2  查询有哪些表
#user-2-2-1  创建表
drop table hz;
create table hz(id int(10),user_name varchar(20),fenshu int(20),banji int(6));
insert into hz(id,user_name,fenshu,banji)value(1,"laowang",99,1);
insert into hz(id,user_name,fenshu,banji)value(2,"laowang",99,2);
insert into hz(id,user_name,fenshu,banji)value(3,"laowang",99,2);
insert into hz(id,user_name,fenshu,banji)value(4,"laowang",99,1);
#user-2-4-3  删除表
DROP TABLE hz;
#user-2-4-2  删除数据库
DROP DATABASE ceshi;
#user-3  表的常规操作
#user-3-1  insert into
create database ceshi;
use ceshi;
create table 123(id int(10));
create table /(id int(10));
create table 123abc(id int(10));
drop table 123abc;
create table abc?(id int(10));
create table 表1(id int(10));
drop table 表1;
create table %&(id int(10));
create table null(id int(10));
create table 表1(id int(10),shuzi bigint(20),xingbie varchar(20),riqi date,shijian time,juti datetime);
desc 表1;
Field	Type	Null	Key	Default	Extra
id	int(10)	YES		NULL	
shuzi	bigint(20)	YES		NULL	
xingbie	varchar(20)	YES		NULL	
riqi	date	YES		NULL	
shijian	time	YES		NULL	
juti	datetime	YES		NULL	
insert into 表1(id,shuzi,xingbie,riqi,shijian,juti)VALUES(1,6.5989891,"女",'2020-07-05','21:30:01','2022-07-01 12:00:00');
drop table 表1;
DROP table hz;
create table hz(id int(10),user_name varchar(20),fenshu int(20),banji int(6),riqi date);
insert into hz value(1,"xiaobai",99,6221,'2022-01-06');
insert into hz value(2,"xiaowang",98,6223,'2052-08-06');
insert into hz value(3,"dabai",100,6221,'2021-08-06');
insert into hz value(4,"xiaoliu",100,6223,'2032-11-16');
alter table hz add leibie int(20);
ALTER TABLE hz CHANGE user_name user_names varchar(20);
rename table hz to t;
drop table t;
#user-3-2  update
use ceshi;
DROP table hz;
create table hz(id int(10),user_name varchar(20),fenshu int(20),banji int(6));
insert into hz value(1,"xiaobai",99,6221);
insert into hz value(2,"xiaowang",98,6223);
insert into hz value(3,"dabai",100,6221);
insert into hz value(4,"xiaoliu",100,6223);
rename table hz to t;
UPDATE t SET user_name="xiaocao" WHERE user_name="xiaoliu";
UPDATE t SET USER_name = 40/10 WHERE fenshu=98;
drop table t;
#user-3-2  select 
use ceshi;
DROP table hz;
create table hz(id int(10),user_name varchar(20),fenshu int(20),banji int(6));
insert into hz value(1,"xiaobai",99,6221);
insert into hz value(2,"xiaowang",98,6223);
insert into hz value(3,"dabai",100,6221);
insert into hz value(4,"xiaoliu",100,6223);
insert into hz value(5,"xiaoai",79,6221);
insert into hz value(6,"xiaobai",78,6223);
insert into hz value(7,"dabai",20,6221);
insert into hz value(8,"xiaogou",60,6223);
rename table hz to t;
DELETE FROM t WHERE user_name="xiaoliu";
DELETE FROM t WHERE user_name="xiaoliu";
SELECT * from t where user_name="xiaoliu";
id	user_name	fenshu	banji
SELECT user_name from t;
user_name
xiaobai
xiaowang
dabai
xiaoai
xiaobai
dabai
xiaogou
SELECT * from t limit 4,6;
id	user_name	fenshu	banji
6	xiaobai	78	6223
7	dabai	20	6221
8	xiaogou	60	6223
#3-3-2   GROUP by
SELECT * FROM t GROUP by banji;
id	user_name	fenshu	banji
1	xiaobai	99	6221
2	xiaowang	98	6223
#3-3-2-5  count
#3-3-2-1  min
#3-3-2-2  max
#3-3-2-3  avg
#3-3-2-4  sum
#3-3-3   ORDER by
SELECT * FROM t ORDER by fenshu desc;
id	user_name	fenshu	banji
3	dabai	100	6221
1	xiaobai	99	6221
2	xiaowang	98	6223
5	xiaoai	79	6221
6	xiaobai	78	6223
8	xiaogou	60	6223
7	dabai	20	6221
SELECT fenshu,user_name,banji FROM t where banji=6223 ORDER by banji desc;
fenshu	user_name	banji
98	xiaowang	6223
78	xiaobai	6223
60	xiaogou	6223
drop table t;
#user-4  视图的增删改查
#user-4-4  视图的创建
use ceshi;
DROP TABLE t;
drop view shitu;
create table t(id int(10),name varchar(20),fenshu int(20),banji int(6));
insert into t value(1,"xiaobai",99,6221);
insert into t value(2,"xiaowang",98,6223);
insert into t value(3,"dabai",100,6221);
insert into t value(4,"xiaoliu",100,6223);
CREATE VIEW shitu as SELECT * FROM t GROUP by banji;
SELECT * FROM shitu;
id	name	fenshu	banji
1	xiaobai	99	6221
2	xiaowang	98	6223
drop view shitu;
#user-4-1  视图的查询
use ceshi;
DROP TABLE t;
drop view shitu;
create table t(id int(10),user_name varchar(20),fenshu int(20),banji int(6));
insert into t value(1,"xiaobai",99,6221);
insert into t value(2,"xiaowang",98,6223);
insert into t value(3,"dabai",100,6221);
insert into t value(4,"xiaoliu",100,6223);
CREATE VIEW shitu as SELECT * FROM t;
#group by
SELECT * FROM shitu GROUP by banji;
id	user_name	fenshu	banji
1	xiaobai	99	6221
2	xiaowang	98	6223
#count
#avg
#sum
#max
#min
#ORDER by
SELECT * FROM shitu ORDER by fenshu desc;
id	user_name	fenshu	banji
3	dabai	100	6221
4	xiaoliu	100	6223
1	xiaobai	99	6221
2	xiaowang	98	6223
SELECT * FROM shitu LIMIT 1;
id	user_name	fenshu	banji
1	xiaobai	99	6221
SELECT * FROM shitu LIMIT 0,3;
id	user_name	fenshu	banji
1	xiaobai	99	6221
2	xiaowang	98	6223
3	dabai	100	6221
SELECT * FROM shitu order by fenshu desc;
id	user_name	fenshu	banji
3	dabai	100	6221
4	xiaoliu	100	6223
1	xiaobai	99	6221
2	xiaowang	98	6223
SELECT * from shitu where user_name="xiaoliu";
id	user_name	fenshu	banji
4	xiaoliu	100	6223
drop view shitu;
DROP TABLE t;
#user-4-2  视图的修改
use ceshi;
DROP TABLE hz;
drop view shitu;
create table hz(id int(10),user_name varchar(20),fenshu int(20),banji int(6));
insert into hz value(1,"xiaobai",99,6221);
insert into hz value(2,"xiaowang",98,6223);
insert into hz value(3,"dabai",100,6221);
insert into hz value(4,"xiaoliu",100,6223);
SELECT * from hz order by fenshu desc;
id	user_name	fenshu	banji
3	dabai	100	6221
4	xiaoliu	100	6223
1	xiaobai	99	6221
2	xiaowang	98	6223
CREATE VIEW shitu as SELECT * FROM hz;
SELECT * from shitu order by fenshu desc;
id	user_name	fenshu	banji
3	dabai	100	6221
4	xiaoliu	100	6223
1	xiaobai	99	6221
2	xiaowang	98	6223
UPDATE shitu SET user_name="xiaoliu" WHERE user_name="dabai";
SELECT * from shitu order by fenshu desc;
id	user_name	fenshu	banji
3	xiaoliu	100	6221
4	xiaoliu	100	6223
1	xiaobai	99	6221
2	xiaowang	98	6223
SELECT * from shitu where user_name="xiaoliu";
id	user_name	fenshu	banji
3	xiaoliu	100	6221
4	xiaoliu	100	6223
DELETE FROM shitu WHERE 1=1;
drop view shitu;
DROP TABLE hz;
#user-5   索引
use ceshi;
drop table b;
CREATE TABLE b(f1 int(10),f2 int(10));
SELECT * from b;
f1	f2
CREATE INDEX b ON b(f1);
SELECT * from b;
f1	f2
INSERT INTO b VALUES(69,698);
SELECT * FROM b;
f1	f2
69	698
UPDATE b SET f1=77 where f1=69;
SELECT * FROM b;
f1	f2
77	698
SELECT f1,f2 FROM b;
f1	f2
77	698
DELETE FROM b WHERE f1=77;
SELECT * FROM b;
f1	f2
drop table b;
#user-6 约束
use ceshi;
drop table hz;
create table hz(id int(10),name varchar(10),fenshu int(10),banji int(10),xuexiao varchar(10));
insert into hz(id,name,fenshu,banji,xuexiao)value(1,"zhansan",5899,6224,"ligong"),(2,"xiaoli",1000,6223,"henankeji"),(3,"xiaoai",99,6223,"nongye"),(4,"xiaocao",100,6224,"zheda");
#非空
alter table hz modify id int not null;
alter table hz modify id int null;
#主键
alter table hz add primary key (id);
#唯一、自增长
alter table hz add unique yueshu(id);
alter table hz modify id int auto_increment;
alter table hz modify id int;
alter table hz drop key yueshu;
drop table hz;
#外键
use ceshi;
drop table beijing;
drop table shanghai;
create table beijing(
dept_name varchar(20),
budget int,
descript varchar(20),
primary key(dept_name)
);
create table shanghai(
shanghai_id varchar(20),
deptnames varchar(20),
credits int,
foreign key(deptnames) references beijing(dept_name));
drop table shanghai;
drop table beijing;
#user-7 多表相连
use ceshi;
drop table f1;
drop table f2;
create table f1(id int(10),name varchar(10),fenshu int(10),banji int(10),xuexiao varchar(10));
insert into f1(id,name,fenshu,banji,xuexiao)value(1,"zhansan",99,6224,"ligong"),(2,"xiaoli",100,6223,"henankeji"),(3,"xiaoai",99,6223,"nongye"),(4,"xiaocao",100,6224,"zheda");
SELECT * from f1;
id	name	fenshu	banji	xuexiao
1	zhansan	99	6224	ligong
2	xiaoli	100	6223	henankeji
3	xiaoai	99	6223	nongye
4	xiaocao	100	6224	zheda
create table f2(id int(10),name varchar(10),fenshu int(10),banji int(10),xuexiao varchar(30));
insert into f2(id,name,fenshu,banji,xuexiao)value(1,"xiaobei",99,6224,"qinghua"),(2,"xiaoqing",100,6223,"beida"),(3,"xiaozhu",99,6223,"zhongkeyuan"),(4,"xiaowang",100,6224,"shekeyuan");
SELECT * from f2;
id	name	fenshu	banji	xuexiao
1	xiaobei	99	6224	qinghua
2	xiaoqing	100	6223	beida
3	xiaozhu	99	6223	zhongkeyuan
4	xiaowang	100	6224	shekeyuan
#user7-1  基本连接
#user7-2  LEFT join
#user7-3  RIGHT join
#user7-4  inner join
#user7-5   union
#user7-6   排序
#user7-8   嵌套
SELECT name from f1 where fenshu>(SELECT fenshu from f2 where name="xiaobei");
name
xiaoli
xiaocao
SELECT name from f1 where banji>(SELECT xuexiao from f2 where name="xiaozhu");
name
zhansan
xiaoli
xiaoai
xiaocao
Warnings:
Warning	1292	Truncated incorrect DECIMAL value: 'zhongkeyuan'
drop table f1;
drop table f2;
#比较运算
create database ceshi;
use ceshi;
DROP table hz;
create table hz(id int(10),user_name varchar(20),fenshu int(20),banji int(6));
insert into hz value(1,"xiaobai",99,6221),(2,"xiaowang",98,6223),(3,"dabai",100,6221),(4,"xiaoliu",100,6223);
insert into hz value(5,"xiaoai",79,6221),(6,"xiaobai",78,6223),(7,"dabai",20,6221),(8,"xiaogou",60,6223);
select * from hz;
id	user_name	fenshu	banji
1	xiaobai	99	6221
2	xiaowang	98	6223
3	dabai	100	6221
4	xiaoliu	100	6223
5	xiaoai	79	6221
6	xiaobai	78	6223
7	dabai	20	6221
8	xiaogou	60	6223
SELECT sum(fenshu) from hz;
sum(fenshu)
634
SELECT * FROM hz WHERE fenshu=98>(SELECT fenshu FROM hz WHERE id=5);
id	user_name	fenshu	banji
SELECT fenshu FROM hz WHERE fenshu=79>=(SELECT fenshu FROM hz WHERE id=5);
fenshu
SELECT fenshu FROM hz where user_name="xiaogou"<(SELECT fenshu FROM hz where user_name="xiaowang");
fenshu
99
98
100
100
79
78
20
60
SELECT fenshu FROM hz WHERE fenshu=79<=(SELECT fenshu FROM hz WHERE id=5);
fenshu
99
98
100
100
79
78
20
60
SELECT fenshu FROM hz WHERE user_name="xiaoliu"<=(SELECT fenshu FROM hz WHERE id=3);
fenshu
99
98
100
100
79
78
20
60
SELECT fenshu FROM hz WHERE id=5 !=(SELECT fenshu FROM hz WHERE id=6);
fenshu
99
98
100
100
79
78
20
60
DROP table hz;
# Clean up users
drop user hjw@'%' ;
