# 清理环境
drop user u_replx cascade;
drop user u_common cascade;
# 创建测试用户
create user u_replx IDENTIFIED BY ali1234;
grant all on *.* to u_replx WITH GRANT OPTION;
grant dba to u_replx;
grant all privileges to u_replx;
create user u_common IDENTIFIED BY ali1234;
grant all on *.* to u_common WITH GRANT OPTION;
grant dba to u_common;
grant all privileges to u_common;
# 切换u_common用户创建依赖表
CREATE TABLE "SA_DB_RESTYPE_SALEPRICE" 
("RES_TYPE_ID" VARCHAR2(32), 
"ORGID" VARCHAR2(32), 
"CHARGEITEMID" VARCHAR2(32), 
"PRICE" NUMBER(12,0), 
"STARTTIME" DATE, 
"ENDTIME" DATE, 
"STATUS" VARCHAR2(32), 
"OPERATOR" VARCHAR2(32), 
"LOWEST_PRICE" NUMBER(12,0), 
"DEALMETHOD" VARCHAR2(16), 
"PRICETYPE" VARCHAR2(32) DEFAULT 'retail', 
"ADDEDTAXRATE" NUMBER(3,0) DEFAULT 0, 
"ADDEDTAXMETHOD" NUMBER(1,0) DEFAULT 0, 
"SCORETYPE" VARCHAR2(32), 
"DEDUCTSCORE" NUMBER(16,0)
);
CREATE TABLE "IM_IF_BB_ACTIVITYCHECK" 
("INTF_DATE" VARCHAR2(8), 
"REC_SEQ" NUMBER(14,0), 
"CHECKMONTH" VARCHAR2(6), 
"PACKAGECODE" VARCHAR2(16), 
"MOBILENO" VARCHAR2(16), 
"IMEI" VARCHAR2(32), 
"STATUS" VARCHAR2(32), 
"STATUS_DATE" DATE, 
"MEMO" VARCHAR2(50)
);
CREATE TABLE "IM_IF_BB_CUSTACTIVATE" 
("INTF_DATE" VARCHAR2(8), 
"REC_SEQ" NUMBER(14,0), 
"REGION" NUMBER(5,0), 
"MOBILENO" VARCHAR2(32), 
"IMEI" VARCHAR2(20), 
"PACKAGECODE" VARCHAR2(32), 
"ACTIVEDATE" DATE, 
"STATUS" VARCHAR2(32), 
"STATUS_DATE" DATE, 
"MEMO" VARCHAR2(50), 
"DELIVERPROVINCE" NUMBER(5,0), 
"CHANNELTYPE" NUMBER(1,0), 
"CHANNELMODEL" NUMBER(1,0), 
"MATERIELCODE" VARCHAR2(32)
);
CREATE TABLE "IM_IF_BB_PRODUCTINFO" 
("INTF_DATE" VARCHAR2(8), 
"REC_SEQ" NUMBER(14,0), 
"PRODUCT_ID" VARCHAR2(32), 
"IDU_TYPE" NUMBER(1,0), 
"MATERIEL_CODE" VARCHAR2(16), 
"VENDOR_ID" VARCHAR2(32), 
"PRD_NAME" VARCHAR2(256), 
"COLOR" VARCHAR2(100), 
"CONF_INFO" VARCHAR2(64), 
"NET_VER" VARCHAR2(64), 
"RECOM_PRICE" NUMBER(12,2), 
"HIGH_PRIC" NUMBER(12,2), 
"BRAND_ID" VARCHAR2(32), 
"PIC_FILE_NAME" VARCHAR2(256), 
"REGISTED_DATE" DATE, 
"PRD_STATUS" VARCHAR2(64), 
"ACESY" VARCHAR2(600), 
"CUSTOMNORM" VARCHAR2(64), 
"VERSION" VARCHAR2(64), 
"STATUS" VARCHAR2(32), 
"STATUS_DATE" DATE, 
"MEMO" VARCHAR2(50), 
"SELLTYPE" NUMBER(1,0), 
"PRODUCTIONSTATUS" VARCHAR2(50), 
"INDATE" DATE, 
"PICTURETYPE" VARCHAR2(50), 
"CUSTOMERTYPE" VARCHAR2(50), 
"PRODUCTPACKAGE" VARCHAR2(1000), 
"LOWEND" VARCHAR2(10), 
"PILOTPRODUCT" VARCHAR2(10), 
"STEERFLAG" VARCHAR2(10), 
"PRD_MODE" VARCHAR2(15), 
"JOIN_TYPE" VARCHAR2(10)
);
CREATE TABLE "IM_IF_BB_PROPACKAGES" 
("INTF_DATE" VARCHAR2(8), 
"REC_SEQ" NUMBER(14,0), 
"PACKAGE_CODE" VARCHAR2(16), 
"PACKAGE_CONTENT" VARCHAR2(1023), 
"STATUS" VARCHAR2(32), 
"STATUS_DATE" DATE, 
"MEMO" VARCHAR2(50)
);
CREATE TABLE "IM_IF_BB_REEXACTIVITY" 
("INTF_DATE" VARCHAR2(8), 
"REC_SEQ" NUMBER(14,0), 
"BUSITYPE" VARCHAR2(4), 
"OPTYPE" NUMBER(1,0), 
"IMEI" VARCHAR2(32), 
"OUT_IMEI" VARCHAR2(32), 
"BUSIDATE" DATE, 
"CHANNELTYPE" NUMBER(1,0), 
"REGION" NUMBER(5,0), 
"MOBILENO" VARCHAR2(16), 
"PACKAGECODE" VARCHAR2(16), 
"STATUS" VARCHAR2(32), 
"STATUS_DATE" DATE, 
"MEMO" VARCHAR2(50), 
"CHANNELMODEL" NUMBER(1,0)
);
CREATE TABLE "IM_IF_BB_RESOURCE" 
("PARAM_TYPE_ID" VARCHAR2(32), 
"PARAM_TYPE_NAME" VARCHAR2(128), 
"PARAM_ID" VARCHAR2(32), 
"PARAM_NAME" VARCHAR2(64), 
"STATE" NUMBER(1,0)
);
CREATE TABLE "IM_IF_BB_TASK" 
("TASK_NO" VARCHAR2(20), 
"TASK_NAME" VARCHAR2(50), 
"TRANS_DIRECT" VARCHAR2(10), 
"TASK_OPERATOR" VARCHAR2(20), 
"TASK_STATUS" VARCHAR2(10), 
"STATUS_TIME" DATE
);
CREATE TABLE "IM_BUSI_SET" 
("RES_TYPE_ID" VARCHAR2(32), 
"BUSI_TYPE" VARCHAR2(32), 
"BUSI_NAME" VARCHAR2(64), 
"BUSI_MEMO" VARCHAR2(200), 
"STATUS" VARCHAR2(32), 
"EFF_DATE" DATE, 
"EXP_DATE" DATE
);
CREATE TABLE "IM_BUSI_SET_PARAMCHG" 
("BUSI_TYPE" VARCHAR2(32), 
"BUSI_NAME" VARCHAR2(64), 
"BUSI_MEMO" VARCHAR2(200), 
"STATUS" VARCHAR2(32), 
"EFF_DATE" DATE, 
"EXP_DATE" DATE, 
"EVENT_TYPE" VARCHAR2(32), 
"IF_LOG" NUMBER(1,0), 
"HANDLE_DO" VARCHAR2(32), 
"ORDER_SEQ" NUMBER(3,0)
);
CREATE TABLE "IM_DICT_ITEM" 
("ITEMID" VARCHAR2(32), 
"ITEMNAME" VARCHAR2(64), 
"GROUPID" VARCHAR2(32), 
"SORTORDER" NUMBER(3,0) DEFAULT 0, 
"DESCRIPTION" VARCHAR2(256), 
"CREATEDATE" DATE, 
"STATUS" NUMBER(1,0) DEFAULT 0, 
"STATUSDATE" DATE
);
CREATE TABLE "IM_IF_SEGMENT_SCPINFO" 
("REGION" NUMBER(6,0), 
"SCP_ID" VARCHAR2(32), 
"SCP_NAME" VARCHAR2(32), 
"STATUS" VARCHAR2(32)
);
CREATE TABLE "IM_QRY_COND_MATCHER" 
("QUERY_ID" VARCHAR2(32), 
"COND_NAME" VARCHAR2(32), 
"MATCHER" VARCHAR2(32), 
"SQL" VARCHAR2(2000), 
"PARAM_1" VARCHAR2(32), 
"PARAM_2" VARCHAR2(32), 
"PARAM_3" VARCHAR2(32), 
"PARAM_4" VARCHAR2(32)
);
CREATE TABLE "IM_QUERY" 
("QUERY_ID" VARCHAR2(32), 
"QUERY_NAME" VARCHAR2(64), 
"SQL" VARCHAR2(2000), 
"MEMO" VARCHAR2(500), 
"IS_HEAD" CHAR(1) DEFAULT 'Y', 
"IF_ORDER" VARCHAR2(8) DEFAULT 'NO'
);
CREATE TABLE "IM_RES_TYPE" 
("RES_TYPE_ID" VARCHAR2(32), 
"RES_TYPE_NAME" VARCHAR2(64), 
"RES_TABLE_NAME" VARCHAR2(50), 
"IF_STOCKS" VARCHAR2(32), 
"PARENT_RES_ID" VARCHAR2(32), 
"IF_BASE" VARCHAR2(32), 
"SUPPLIER_ID" VARCHAR2(32) DEFAULT 'UNKNOWN', 
"IF_SEQUENCE" VARCHAR2(32), 
"RES_TYPE_MEMO" VARCHAR2(500), 
"STATUS" VARCHAR2(32), 
"EFF_DATE" DATE, 
"EXP_DATE" DATE, 
"CREATE_ORG_ID" VARCHAR2(32), 
"RES_KIND_ID" VARCHAR2(32), 
"IF_PHYSICAL" VARCHAR2(32), 
"VERSION_NUMBER" VARCHAR2(50), 
"RES_LIMIT" VARCHAR2(32), 
"INV_NAME" VARCHAR2(32), 
"INV_ID_LENGTH" NUMBER(3,0) DEFAULT 0, 
"INV_SEG_LEN" NUMBER(3,0) DEFAULT 0, 
"NET_TYPE" VARCHAR2(32) DEFAULT 'ALL', 
"REGION" NUMBER(6,0), 
"LAST_BUSI_ID" VARCHAR2(32), 
"STATUS_DATE" DATE DEFAULT sysdate, 
"OPER_ID" VARCHAR2(32), 
"BRAND_ID" VARCHAR2(32), 
"SPECTPLT_ID" VARCHAR2(32), 
"MEASURE_UNIT" VARCHAR2(32), 
"IS_BATCH_MGR" NUMBER(1,0), 
"RES_MODULE_TYPE" NUMBER(1,0), 
"IF_SYN" VARCHAR2(32), 
"GOODS_KIND_ID" VARCHAR2(32), 
"PARENT_GOODS_ID" VARCHAR2(32), 
"CREATE_DATE" DATE DEFAULT sysdate, 
"PARTICULAR_ATTR" VARCHAR2(128), 
"RES_SPECIAL_MODEL" VARCHAR2(32)
);
CREATE TABLE "IM_RES_TYPE_ATTR_SET" 
("RES_TYPE_ID" VARCHAR2(32), 
"ATTR_ID" VARCHAR2(32), 
"ATTR_VALUE" VARCHAR2(500), 
"STATUS" VARCHAR2(32), 
"STATUS_DATE" DATE, 
"STATUS_OPER_ID" VARCHAR2(32), 
"CREATE_DATE" DATE, 
"CREATE_OPER_ID" VARCHAR2(32), 
"IF_SYSTEM" VARCHAR2(32), 
"IS_PRIMARY_KEY" NUMBER(1,0), 
"TPLT_ID" VARCHAR2(32), 
"ATTR_NAME" VARCHAR2(64), 
"ATTR_VALUE_DESC" VARCHAR2(1024), 
"EXTVALUE1" VARCHAR2(256), 
"EXTVALUE2" VARCHAR2(256), 
"EXTVALUE3" VARCHAR2(256)
);
CREATE TABLE "IM_RES_TYPE_COLOR" 
("RES_TYPE_ID" VARCHAR2(32), 
"COLOR" VARCHAR2(32)
);
CREATE TABLE "IM_VENDOR_INFO" 
("VENDOR_ID" VARCHAR2(32), 
"MIS_VENDOR_ID" VARCHAR2(32), 
"RES_KIND_ID" VARCHAR2(32), 
"VENDOR_NAME" VARCHAR2(64), 
"ADDRESS" VARCHAR2(128), 
"POST_CODE" NUMBER(6,0), 
"LINK_MAN" VARCHAR2(32), 
"LINK_PHONE" VARCHAR2(32), 
"FAX_PHONE" VARCHAR2(32), 
"STATUS" NUMBER(1,0), 
"CREATE_DATE" DATE, 
"CREATE_OPERATOR" VARCHAR2(32), 
"MAPPING_ID" VARCHAR2(32), 
"REGION" NUMBER(6,0) DEFAULT 999
);
CREATE TABLE "PSI_CFG_RESBRAND" 
("RES_KIND_ID" VARCHAR2(32), 
"BRAND_ID" VARCHAR2(32), 
"BRAND_NAME" VARCHAR2(64), 
"BRAND_DESC" VARCHAR2(256), 
"VENDOR_ID" VARCHAR2(32), 
"CREATE_DATE" DATE, 
"STATUS" VARCHAR2(32), 
"STATUS_DATE" DATE, 
"CREATE_OPER" VARCHAR2(32), 
"BRAND_IMAGE_NAME" VARCHAR2(256), 
"BRAND_IMAGE_UNIFIEDNAME" VARCHAR2(256), 
"BRAND_LEVEL" VARCHAR2(32), 
"GOODS_KIND_ID" VARCHAR2(32), 
"SORT_ORDER" NUMBER(3,0)
);
CREATE TABLE "IM_IF_SEGMENT_HLRINFO" 
("REGION" number(6), 
"MAIN_HLR_ID" VARCHAR2(32), 
"MAIN_HLR_NAME" VARCHAR2(256), 
"BK_HLR_ID" VARCHAR2(32),
"STATUS" VARCHAR2(32)
);
# 切换u_replx账户执行测试用例
CREATE TABLE "REPLX_LOG" 
("REGION" NUMBER(4,0), 
"INSTANCE_ID" NUMBER(2,0), 
"SEQNUM" NUMBER(14,0), 
"TABLE_OWNER" VARCHAR2(32), 
"TABLE_NAME" VARCHAR2(64), 
"OPERATION" CHAR(1), 
"HASH_VAL" NUMBER(4,0), 
"ROW_ID" VARCHAR2(128), 
"PKEY" VARCHAR2(1024), 
"PRIORITY" NUMBER(2,0), 
"SCN" NUMBER(14,0), 
"SRC_DB" VARCHAR2(32), 
"DST_DB" VARCHAR2(32), 
"INTIME" DATE DEFAULT sysdate
) 
PARTITION BY LIST ("INSTANCE_ID") 
(PARTITION "REPLX_LOG_1"  VALUES (1) , 
PARTITION "REPLX_LOG_2"  VALUES (2) , 
PARTITION "REPLX_LOG_10"  VALUES (10) , 
PARTITION "REPLX_LOG_20"  VALUES (20) ) ;
CREATE TABLE "REPLICATE_SWITCH" 
("INSTANCE_ID" NUMBER(2,0), 
"SWITCH_FLAG" NUMBER(1,0), 
"POLL_INTERVAL" NUMBER(4,0), 
"SWITCH_TIME" DATE, 
"MEMO" VARCHAR2(256)
);
CREATE SEQUENCE "REPLX_SEQ"  MINVALUE 1 MAXVALUE 9999999999999 INCREMENT BY 1 START WITH 9539211 CACHE 20000 NOORDER  CYCLE ;
result_format: 4
#########  依赖的package  #########
CREATE OR REPLACE PACKAGE "PKG_REPLX_EVT" is
    -- Author  : L39860
    -- Created : 2005-10-20 10:17:58
    -- Purpose :
    procedure InsertLog(
        row_id in varchar2, --rowid
        towner in varchar2, --Table owner
        tname  in varchar2, --The table name
        operation in char,  --'IDU'
        key    in varchar2,
        hash_val in number, --Table hash value
        region in varchar2 := '300', --Region
        priority in number := 0
    );

    procedure SetTriggerFlag(flag in number);
    procedure SetSrcDBName(src_db in varchar2);
end pkg_replx_evt;
//
CREATE OR REPLACE PACKAGE BODY "PKG_REPLX_EVT" is
    --日志切换参数
    DateNow  date;  --当前时间
    NextTime date;  --下此刷新时间
    CurSID   number(2); --
    PollGAP  number(4);
    SwitchFlag number(1);
    instance_number number(2);
    db_name varchar2(32);
    if_trigger binary_integer;


    procedure InitParam;
    procedure InsertLog(
        row_id in varchar2, --rowid
        towner in varchar2, --table_owner
        tname  in varchar2, --The table name
        operation in char,  --'IDU'
        key    in varchar2,
        hash_val in number, --Table hash value
        region in varchar2, --Region
        priority in number
    )is
    begin
        if 0 = if_trigger then
            return;
        end if;

        DateNow := sysdate;
        if DateNow > NextTime then
            InitParam;
        end if;


        insert into replx_log
            (region, table_owner, table_name, operation, hash_val,
             row_id, pkey, instance_id,
             seqnum, priority, scn, src_db, intime)
        values
            (region, towner, tname, operation, hash_val,
             row_id, key, CurSID,
             replx_seq.nextval, priority, 0, db_name, DateNow);
    end;


    procedure SetTriggerFlag(flag in number)
    as
    begin
        if_trigger := flag;
    end;


    procedure SetSrcDBName(src_db in varchar2)
    as
    begin
        db_name := src_db;
    end;

    procedure InitParam
    is
    begin
        begin
            select switch_flag, poll_interval
              into SwitchFlag, PollGAP
              from replicate_switch
             where instance_id=instance_number and rownum<2;

            exception
                when others then
                    NextTime := DateNow+(1/24);
                    return;
        end;

        if SwitchFlag = 0 then
            CurSID := instance_number;
        else
            CurSID := instance_number*10;
        end if;
        NextTime := DateNow+(PollGAP/1440);
    end;

begin
    instance_number := sys_context('userenv', 'instance');
    db_name := sys_context('userenv', 'db_name');
    SwitchFlag := 0;
    PollGAP := 60;
    CurSID := instance_number;
    if_trigger := 1;


    DateNow := sysdate;
    NextTime := DateNow+(1/24);

    begin
        select switch_flag, poll_interval
          into SwitchFlag, PollGAP
          from replicate_switch
         where instance_id=instance_number and rownum<2;

        exception
            when others then
                return;
    end;

    if SwitchFlag <> 0 then
        CurSID := instance_number*10;
    end if;
    NextTime := DateNow+(PollGAP/1440);

end pkg_replx_evt;
//
#########  创建触发器  #########
# TRIG_REPLX30_1660303 触发器创建
CREATE OR REPLACE TRIGGER "TRIG_REPLX30_1660303"
    after insert or delete or update on U_COMMON.SA_DB_RESTYPE_SALEPRICE
    for each row
declare
    key_str   varchar(1024);
begin
    if INSERTING then
        key_str :='RES_TYPE_ID='||:new.RES_TYPE_ID||','||chr(3)||
                  'ORGID='||:new.ORGID||','||chr(3)||
                  'CHARGEITEMID='||:new.CHARGEITEMID||','||chr(3)||
                  'STARTTIME='||to_char(:new.STARTTIME, 'yyyymmddhh24miss')||','||chr(3)||
                  'PRICETYPE='||:new.PRICETYPE;
        pkg_replx_evt.InsertLog(
            row_id=>:new.rowid,
            towner=>'U_COMMON',
            tname=>'SA_DB_RESTYPE_SALEPRICE',
            key=>key_str,
            priority=>0,
            hash_val=>45,
            operation=>'I'
        );
        return;
    end if;



    key_str :='RES_TYPE_ID='||:old.RES_TYPE_ID||','||chr(3)||
              'ORGID='||:old.ORGID||','||chr(3)||
              'CHARGEITEMID='||:old.CHARGEITEMID||','||chr(3)||
              'STARTTIME='||to_char(:old.STARTTIME, 'yyyymmddhh24miss')||','||chr(3)||
              'PRICETYPE='||:old.PRICETYPE;
    if UPDATING then
        pkg_replx_evt.InsertLog(
            row_id=>:new.rowid,
            towner=>'U_COMMON',
            tname=>'SA_DB_RESTYPE_SALEPRICE',
            key=>key_str,
            priority=>0,
            hash_val=>45,
            operation=>'U'
        );
        return;
    end if;



    if DELETING then
        pkg_replx_evt.InsertLog(
            row_id=>:new.rowid,
            towner=>'U_COMMON',
            tname=>'SA_DB_RESTYPE_SALEPRICE',
            key=>key_str,
            priority=>0,
            hash_val=>45,
            operation=>'D'
        );
        return;
    end if;
end;
//
ALTER TRIGGER "TRIG_REPLX30_1660303" DISABLE;
//
# TRIG_REPLX30_1661310 触发器创建
CREATE OR REPLACE TRIGGER "TRIG_REPLX30_1661310"
    after insert or delete or update on U_COMMON.IM_IF_BB_ACTIVITYCHECK
    for each row
declare
    key_str   varchar(1024);
begin
    if INSERTING then
        key_str :='INTF_DATE='||:new.INTF_DATE||','||chr(3)||
                  'REC_SEQ='||:new.REC_SEQ;
        pkg_replx_evt.InsertLog(
            row_id=>:new.rowid,
            towner=>'IM',
            tname=>'IM_IF_BB_ACTIVITYCHECK',
            key=>key_str,
            priority=>0,
            hash_val=>60,
            operation=>'I'
        );
        return;
    end if;



    key_str :='INTF_DATE='||:old.INTF_DATE||','||chr(3)||
              'REC_SEQ='||:old.REC_SEQ;
    if UPDATING then
        pkg_replx_evt.InsertLog(
            row_id=>:new.rowid,
            towner=>'IM',
            tname=>'IM_IF_BB_ACTIVITYCHECK',
            key=>key_str,
            priority=>0,
            hash_val=>60,
            operation=>'U'
        );
        return;
    end if;



    if DELETING then
        pkg_replx_evt.InsertLog(
            row_id=>:new.rowid,
            towner=>'IM',
            tname=>'IM_IF_BB_ACTIVITYCHECK',
            key=>key_str,
            priority=>0,
            hash_val=>60,
            operation=>'D'
        );
        return;
    end if;
end;
//
ALTER TRIGGER "TRIG_REPLX30_1661310" DISABLE;
//
# TRIG_REPLX30_1661353 触发器创建
CREATE OR REPLACE TRIGGER "TRIG_REPLX30_1661353"
    after insert or delete or update on U_COMMON.IM_IF_BB_CUSTACTIVATE
    for each row
declare
    key_str   varchar(1024);
begin
    if INSERTING then
        key_str :='INTF_DATE='||:new.INTF_DATE||','||chr(3)||
                  'REC_SEQ='||:new.REC_SEQ;
        pkg_replx_evt.InsertLog(
            row_id=>:new.rowid,
            towner=>'IM',
            tname=>'IM_IF_BB_CUSTACTIVATE',
            key=>key_str,
            priority=>0,
            hash_val=>21,
            operation=>'I'
        );
        return;
    end if;



    key_str :='INTF_DATE='||:old.INTF_DATE||','||chr(3)||
              'REC_SEQ='||:old.REC_SEQ;
    if UPDATING then
        pkg_replx_evt.InsertLog(
            row_id=>:new.rowid,
            towner=>'IM',
            tname=>'IM_IF_BB_CUSTACTIVATE',
            key=>key_str,
            priority=>0,
            hash_val=>21,
            operation=>'U'
        );
        return;
    end if;



    if DELETING then
        pkg_replx_evt.InsertLog(
            row_id=>:new.rowid,
            towner=>'IM',
            tname=>'IM_IF_BB_CUSTACTIVATE',
            key=>key_str,
            priority=>0,
            hash_val=>21,
            operation=>'D'
        );
        return;
    end if;
end;
//
ALTER TRIGGER "TRIG_REPLX30_1661353" DISABLE;
//
# TRIG_REPLX30_1661438 触发器创建
CREATE OR REPLACE TRIGGER "TRIG_REPLX30_1661438"
    after insert or delete or update on U_COMMON.IM_IF_BB_PRODUCTINFO
    for each row
declare
    key_str   varchar(1024);
begin
    if INSERTING then
        key_str :='INTF_DATE='||:new.INTF_DATE||','||chr(3)||
                  'REC_SEQ='||:new.REC_SEQ||','||chr(3)||
                  'PRD_MODE='||:new.PRD_MODE;
        pkg_replx_evt.InsertLog(
            row_id=>:new.rowid,
            towner=>'IM',
            tname=>'IM_IF_BB_PRODUCTINFO',
            key=>key_str,
            priority=>0,
            hash_val=>60,
            operation=>'I'
        );
        return;
    end if;



    key_str :='INTF_DATE='||:old.INTF_DATE||','||chr(3)||
              'REC_SEQ='||:old.REC_SEQ||','||chr(3)||
              'PRD_MODE='||:old.PRD_MODE;
    if UPDATING then
        pkg_replx_evt.InsertLog(
            row_id=>:new.rowid,
            towner=>'IM',
            tname=>'IM_IF_BB_PRODUCTINFO',
            key=>key_str,
            priority=>0,
            hash_val=>60,
            operation=>'U'
        );
        return;
    end if;



    if DELETING then
        pkg_replx_evt.InsertLog(
            row_id=>:new.rowid,
            towner=>'IM',
            tname=>'IM_IF_BB_PRODUCTINFO',
            key=>key_str,
            priority=>0,
            hash_val=>60,
            operation=>'D'
        );
        return;
    end if;
end;
//
ALTER TRIGGER "TRIG_REPLX30_1661438" DISABLE;
//
# TRIG_REPLX30_1661441 触发器创建
CREATE OR REPLACE TRIGGER "TRIG_REPLX30_1661441"
    after insert or delete or update on U_COMMON.IM_IF_BB_PROPACKAGES
    for each row
declare
    key_str   varchar(1024);
begin
    if INSERTING then
        key_str :='INTF_DATE='||:new.INTF_DATE||','||chr(3)||
                  'REC_SEQ='||:new.REC_SEQ;
        pkg_replx_evt.InsertLog(
            row_id=>:new.rowid,
            towner=>'IM',
            tname=>'IM_IF_BB_PROPACKAGES',
            key=>key_str,
            priority=>0,
            hash_val=>49,
            operation=>'I'
        );
        return;
    end if;



    key_str :='INTF_DATE='||:old.INTF_DATE||','||chr(3)||
              'REC_SEQ='||:old.REC_SEQ;
    if UPDATING then
        pkg_replx_evt.InsertLog(
            row_id=>:new.rowid,
            towner=>'IM',
            tname=>'IM_IF_BB_PROPACKAGES',
            key=>key_str,
            priority=>0,
            hash_val=>49,
            operation=>'U'
        );
        return;
    end if;



    if DELETING then
        pkg_replx_evt.InsertLog(
            row_id=>:new.rowid,
            towner=>'IM',
            tname=>'IM_IF_BB_PROPACKAGES',
            key=>key_str,
            priority=>0,
            hash_val=>49,
            operation=>'D'
        );
        return;
    end if;
end;
//
ALTER TRIGGER "TRIG_REPLX30_1661441" DISABLE;
//
# TRIG_REPLX30_1661467 触发器创建
CREATE OR REPLACE TRIGGER "TRIG_REPLX30_1661467"
    after insert or delete or update on U_COMMON.IM_IF_BB_REEXACTIVITY
    for each row
declare
    key_str   varchar(1024);
begin
    if INSERTING then
        key_str :='INTF_DATE='||:new.INTF_DATE||','||chr(3)||
                  'REC_SEQ='||:new.REC_SEQ;
        pkg_replx_evt.InsertLog(
            row_id=>:new.rowid,
            towner=>'IM',
            tname=>'IM_IF_BB_REEXACTIVITY',
            key=>key_str,
            priority=>0,
            hash_val=>19,
            operation=>'I'
        );
        return;
    end if;



    key_str :='INTF_DATE='||:old.INTF_DATE||','||chr(3)||
              'REC_SEQ='||:old.REC_SEQ;
    if UPDATING then
        pkg_replx_evt.InsertLog(
            row_id=>:new.rowid,
            towner=>'IM',
            tname=>'IM_IF_BB_REEXACTIVITY',
            key=>key_str,
            priority=>0,
            hash_val=>19,
            operation=>'U'
        );
        return;
    end if;



    if DELETING then
        pkg_replx_evt.InsertLog(
            row_id=>:new.rowid,
            towner=>'IM',
            tname=>'IM_IF_BB_REEXACTIVITY',
            key=>key_str,
            priority=>0,
            hash_val=>19,
            operation=>'D'
        );
        return;
    end if;
end;
//
ALTER TRIGGER "TRIG_REPLX30_1661467" DISABLE;
//
# TRIG_REPLX30_1661469 触发器创建
CREATE OR REPLACE TRIGGER "TRIG_REPLX30_1661469"
    after insert or delete or update on U_COMMON.IM_IF_BB_RESOURCE
    for each row
declare
    key_str   varchar(1024);
begin
    if INSERTING then
        key_str :='PARAM_TYPE_ID='||:new.PARAM_TYPE_ID||','||chr(3)||
                  'PARAM_ID='||:new.PARAM_ID;
        pkg_replx_evt.InsertLog(
            row_id=>:new.rowid,
            towner=>'IM',
            tname=>'IM_IF_BB_RESOURCE',
            key=>key_str,
            priority=>0,
            hash_val=>16,
            operation=>'I'
        );
        return;
    end if;



    key_str :='PARAM_TYPE_ID='||:old.PARAM_TYPE_ID||','||chr(3)||
              'PARAM_ID='||:old.PARAM_ID;
    if UPDATING then
        pkg_replx_evt.InsertLog(
            row_id=>:new.rowid,
            towner=>'IM',
            tname=>'IM_IF_BB_RESOURCE',
            key=>key_str,
            priority=>0,
            hash_val=>16,
            operation=>'U'
        );
        return;
    end if;



    if DELETING then
        pkg_replx_evt.InsertLog(
            row_id=>:new.rowid,
            towner=>'IM',
            tname=>'IM_IF_BB_RESOURCE',
            key=>key_str,
            priority=>0,
            hash_val=>16,
            operation=>'D'
        );
        return;
    end if;
end;
//
ALTER TRIGGER "TRIG_REPLX30_1661469" DISABLE;
//
# TRIG_REPLX30_1661514 触发器创建
CREATE OR REPLACE TRIGGER "TRIG_REPLX30_1661514"
    after insert or delete or update on U_COMMON.IM_IF_BB_TASK
    for each row
declare
    key_str   varchar(1024);
begin
    if INSERTING then
        key_str :='TASK_NO='||:new.TASK_NO;
        pkg_replx_evt.InsertLog(
            row_id=>:new.rowid,
            towner=>'IM',
            tname=>'IM_IF_BB_TASK',
            key=>key_str,
            priority=>0,
            hash_val=>35,
            operation=>'I'
        );
        return;
    end if;



    key_str :='TASK_NO='||:old.TASK_NO;
    if UPDATING then
        pkg_replx_evt.InsertLog(
            row_id=>:new.rowid,
            towner=>'IM',
            tname=>'IM_IF_BB_TASK',
            key=>key_str,
            priority=>0,
            hash_val=>35,
            operation=>'U'
        );
        return;
    end if;



    if DELETING then
        pkg_replx_evt.InsertLog(
            row_id=>:new.rowid,
            towner=>'IM',
            tname=>'IM_IF_BB_TASK',
            key=>key_str,
            priority=>0,
            hash_val=>35,
            operation=>'D'
        );
        return;
    end if;
end;
//
ALTER TRIGGER "TRIG_REPLX30_1661514" DISABLE;
//
# TRIG_REPLX30_1662225 触发器创建
CREATE OR REPLACE TRIGGER "TRIG_REPLX30_1662225"
    after insert or delete or update on U_COMMON.IM_BUSI_SET
    for each row
declare
    key_str   varchar(1024);
begin
    if INSERTING then
        key_str :='RES_TYPE_ID='||:new.RES_TYPE_ID||','||chr(3)||
                  'BUSI_TYPE='||:new.BUSI_TYPE;
        pkg_replx_evt.InsertLog(
            row_id=>:new.rowid,
            towner=>'IM_DICT',
            tname=>'IM_BUSI_SET',
            key=>key_str,
            priority=>0,
            hash_val=>42,
            operation=>'I'
        );
        return;
    end if;



    key_str :='RES_TYPE_ID='||:old.RES_TYPE_ID||','||chr(3)||
              'BUSI_TYPE='||:old.BUSI_TYPE;
    if UPDATING then
        pkg_replx_evt.InsertLog(
            row_id=>:new.rowid,
            towner=>'IM_DICT',
            tname=>'IM_BUSI_SET',
            key=>key_str,
            priority=>0,
            hash_val=>42,
            operation=>'U'
        );
        return;
    end if;



    if DELETING then
        pkg_replx_evt.InsertLog(
            row_id=>:new.rowid,
            towner=>'IM_DICT',
            tname=>'IM_BUSI_SET',
            key=>key_str,
            priority=>0,
            hash_val=>42,
            operation=>'D'
        );
        return;
    end if;
end;
//
ALTER TRIGGER "TRIG_REPLX30_1662225" DISABLE;
//
# TRIG_REPLX30_1662226 触发器创建
CREATE OR REPLACE TRIGGER "TRIG_REPLX30_1662226"
    after insert or delete or update on U_COMMON.IM_BUSI_SET_PARAMCHG
    for each row
declare
    key_str   varchar(1024);
begin
    if INSERTING then
        key_str :='BUSI_TYPE='||:new.BUSI_TYPE;
        pkg_replx_evt.InsertLog(
            row_id=>:new.rowid,
            towner=>'IM_DICT',
            tname=>'IM_BUSI_SET_PARAMCHG',
            key=>key_str,
            priority=>0,
            hash_val=>60,
            operation=>'I'
        );
        return;
    end if;



    key_str :='BUSI_TYPE='||:old.BUSI_TYPE;
    if UPDATING then
        pkg_replx_evt.InsertLog(
            row_id=>:new.rowid,
            towner=>'IM_DICT',
            tname=>'IM_BUSI_SET_PARAMCHG',
            key=>key_str,
            priority=>0,
            hash_val=>60,
            operation=>'U'
        );
        return;
    end if;



    if DELETING then
        pkg_replx_evt.InsertLog(
            row_id=>:new.rowid,
            towner=>'IM_DICT',
            tname=>'IM_BUSI_SET_PARAMCHG',
            key=>key_str,
            priority=>0,
            hash_val=>60,
            operation=>'D'
        );
        return;
    end if;
end;
//
ALTER TRIGGER "TRIG_REPLX30_1662226" DISABLE;
//
# TRIG_REPLX30_1665084 触发器创建
CREATE OR REPLACE TRIGGER "TRIG_REPLX30_1665084"
    after insert or delete or update on U_COMMON.IM_DICT_ITEM
    for each row
declare
    key_str   varchar(1024);
begin
    if INSERTING then
        key_str :='ITEMID='||:new.ITEMID||','||chr(3)||
                  'GROUPID='||:new.GROUPID;
        pkg_replx_evt.InsertLog(
            row_id=>:new.rowid,
            towner=>'IM_DICT',
            tname=>'IM_DICT_ITEM',
            key=>key_str,
            priority=>0,
            hash_val=>25,
            operation=>'I'
        );
        return;
    end if;



    key_str :='ITEMID='||:old.ITEMID||','||chr(3)||
              'GROUPID='||:old.GROUPID;
    if UPDATING then
        pkg_replx_evt.InsertLog(
            row_id=>:new.rowid,
            towner=>'IM_DICT',
            tname=>'IM_DICT_ITEM',
            key=>key_str,
            priority=>0,
            hash_val=>25,
            operation=>'U'
        );
        return;
    end if;



    if DELETING then
        pkg_replx_evt.InsertLog(
            row_id=>:new.rowid,
            towner=>'IM_DICT',
            tname=>'IM_DICT_ITEM',
            key=>key_str,
            priority=>0,
            hash_val=>25,
            operation=>'D'
        );
        return;
    end if;
end;
//
ALTER TRIGGER "TRIG_REPLX30_1665084" DISABLE;
//
# TRIG_REPLX30_1665832 触发器创建
CREATE OR REPLACE TRIGGER "TRIG_REPLX30_1665832"
    after insert or delete or update on U_COMMON.IM_IF_SEGMENT_HLRINFO
    for each row
declare
    key_str   varchar(1024);
begin
    if INSERTING then
        key_str :='REGION='||:new.REGION||','||chr(3)||
                  'MAIN_HLR_ID='||:new.MAIN_HLR_ID;
        pkg_replx_evt.InsertLog(
            row_id=>:new.rowid,
            towner=>'IM_DICT',
            tname=>'IM_IF_SEGMENT_HLRINFO',
            key=>key_str,
            priority=>0,
            hash_val=>37,
            operation=>'I'
        );
        return;
    end if;



    key_str :='REGION='||:old.REGION||','||chr(3)||
              'MAIN_HLR_ID='||:old.MAIN_HLR_ID;
    if UPDATING then
        pkg_replx_evt.InsertLog(
            row_id=>:new.rowid,
            towner=>'IM_DICT',
            tname=>'IM_IF_SEGMENT_HLRINFO',
            key=>key_str,
            priority=>0,
            hash_val=>37,
            operation=>'U'
        );
        return;
    end if;



    if DELETING then
        pkg_replx_evt.InsertLog(
            row_id=>:new.rowid,
            towner=>'IM_DICT',
            tname=>'IM_IF_SEGMENT_HLRINFO',
            key=>key_str,
            priority=>0,
            hash_val=>37,
            operation=>'D'
        );
        return;
    end if;
end;
//
ALTER TRIGGER "TRIG_REPLX30_1665832" DISABLE;
//
# TRIG_REPLX30_1665835 触发器创建
CREATE OR REPLACE TRIGGER "TRIG_REPLX30_1665835"
    after insert or delete or update on U_COMMON.IM_IF_SEGMENT_SCPINFO
    for each row
declare
    key_str   varchar(1024);
begin
    if INSERTING then
        key_str :='REGION='||:new.REGION||','||chr(3)||
                  'SCP_ID='||:new.SCP_ID;
        pkg_replx_evt.InsertLog(
            row_id=>:new.rowid,
            towner=>'IM_DICT',
            tname=>'IM_IF_SEGMENT_SCPINFO',
            key=>key_str,
            priority=>0,
            hash_val=>11,
            operation=>'I'
        );
        return;
    end if;



    key_str :='REGION='||:old.REGION||','||chr(3)||
              'SCP_ID='||:old.SCP_ID;
    if UPDATING then
        pkg_replx_evt.InsertLog(
            row_id=>:new.rowid,
            towner=>'IM_DICT',
            tname=>'IM_IF_SEGMENT_SCPINFO',
            key=>key_str,
            priority=>0,
            hash_val=>11,
            operation=>'U'
        );
        return;
    end if;



    if DELETING then
        pkg_replx_evt.InsertLog(
            row_id=>:new.rowid,
            towner=>'IM_DICT',
            tname=>'IM_IF_SEGMENT_SCPINFO',
            key=>key_str,
            priority=>0,
            hash_val=>11,
            operation=>'D'
        );
        return;
    end if;
end;
//
ALTER TRIGGER "TRIG_REPLX30_1665835" DISABLE;
//
# TRIG_REPLX30_1666449 触发器创建
CREATE OR REPLACE TRIGGER "TRIG_REPLX30_1666449"
    after insert or delete or update on U_COMMON.IM_QRY_COND_MATCHER
    for each row
declare
    key_str   varchar(1024);
begin
    if INSERTING then
        key_str :='QUERY_ID='||:new.QUERY_ID||','||chr(3)||
                  'COND_NAME='||:new.COND_NAME||','||chr(3)||
                  'MATCHER='||:new.MATCHER;
        pkg_replx_evt.InsertLog(
            row_id=>:new.rowid,
            towner=>'IM_DICT',
            tname=>'IM_QRY_COND_MATCHER',
            key=>key_str,
            priority=>0,
            hash_val=>43,
            operation=>'I'
        );
        return;
    end if;



    key_str :='QUERY_ID='||:old.QUERY_ID||','||chr(3)||
              'COND_NAME='||:old.COND_NAME||','||chr(3)||
              'MATCHER='||:old.MATCHER;
    if UPDATING then
        pkg_replx_evt.InsertLog(
            row_id=>:new.rowid,
            towner=>'IM_DICT',
            tname=>'IM_QRY_COND_MATCHER',
            key=>key_str,
            priority=>0,
            hash_val=>43,
            operation=>'U'
        );
        return;
    end if;



    if DELETING then
        pkg_replx_evt.InsertLog(
            row_id=>:new.rowid,
            towner=>'IM_DICT',
            tname=>'IM_QRY_COND_MATCHER',
            key=>key_str,
            priority=>0,
            hash_val=>43,
            operation=>'D'
        );
        return;
    end if;
end;
//
ALTER TRIGGER "TRIG_REPLX30_1666449" DISABLE;
//
# TRIG_REPLX30_1666564 触发器创建
CREATE OR REPLACE TRIGGER "TRIG_REPLX30_1666564"
    after insert or delete or update on U_COMMON.IM_QUERY
    for each row
declare
    key_str   varchar(1024);
begin
    if INSERTING then
        key_str :='QUERY_ID='||:new.QUERY_ID||','||chr(3)||
                  'IS_HEAD='||:new.IS_HEAD;
        pkg_replx_evt.InsertLog(
            row_id=>:new.rowid,
            towner=>'IM_DICT',
            tname=>'IM_QUERY',
            key=>key_str,
            priority=>0,
            hash_val=>4,
            operation=>'I'
        );
        return;
    end if;



    key_str :='QUERY_ID='||:old.QUERY_ID||','||chr(3)||
              'IS_HEAD='||:old.IS_HEAD;
    if UPDATING then
        pkg_replx_evt.InsertLog(
            row_id=>:new.rowid,
            towner=>'IM_DICT',
            tname=>'IM_QUERY',
            key=>key_str,
            priority=>0,
            hash_val=>4,
            operation=>'U'
        );
        return;
    end if;



    if DELETING then
        pkg_replx_evt.InsertLog(
            row_id=>:new.rowid,
            towner=>'IM_DICT',
            tname=>'IM_QUERY',
            key=>key_str,
            priority=>0,
            hash_val=>4,
            operation=>'D'
        );
        return;
    end if;
end;
//
ALTER TRIGGER "TRIG_REPLX30_1666564" DISABLE;
//
# TRIG_REPLX30_1666932 触发器创建
CREATE OR REPLACE TRIGGER "TRIG_REPLX30_1666932"
    after insert or delete or update on U_COMMON.IM_RES_TYPE
    for each row
declare
    key_str   varchar(1024);
begin
    if INSERTING then
        key_str :='RES_TYPE_ID='||:new.RES_TYPE_ID;
        pkg_replx_evt.InsertLog(
            row_id=>:new.rowid,
            towner=>'IM_DICT',
            tname=>'IM_RES_TYPE',
            key=>key_str,
            priority=>0,
            hash_val=>19,
            operation=>'I'
        );
        return;
    end if;



    key_str :='RES_TYPE_ID='||:old.RES_TYPE_ID;
    if UPDATING then
        pkg_replx_evt.InsertLog(
            row_id=>:new.rowid,
            towner=>'IM_DICT',
            tname=>'IM_RES_TYPE',
            key=>key_str,
            priority=>0,
            hash_val=>19,
            operation=>'U'
        );
        return;
    end if;



    if DELETING then
        pkg_replx_evt.InsertLog(
            row_id=>:new.rowid,
            towner=>'IM_DICT',
            tname=>'IM_RES_TYPE',
            key=>key_str,
            priority=>0,
            hash_val=>19,
            operation=>'D'
        );
        return;
    end if;
end;
//
ALTER TRIGGER "TRIG_REPLX30_1666932" DISABLE;
//
# TRIG_REPLX30_1667067 触发器创建
CREATE OR REPLACE TRIGGER "TRIG_REPLX30_1667067"
    after insert or delete or update on U_COMMON.IM_RES_TYPE_ATTR_SET
    for each row
declare
    key_str   varchar(1024);
begin
    if INSERTING then
        key_str :='RES_TYPE_ID='||:new.RES_TYPE_ID||','||chr(3)||
                  'ATTR_ID='||:new.ATTR_ID;
        pkg_replx_evt.InsertLog(
            row_id=>:new.rowid,
            towner=>'IM_DICT',
            tname=>'IM_RES_TYPE_ATTR_SET',
            key=>key_str,
            priority=>0,
            hash_val=>52,
            operation=>'I'
        );
        return;
    end if;



    key_str :='RES_TYPE_ID='||:old.RES_TYPE_ID||','||chr(3)||
              'ATTR_ID='||:old.ATTR_ID;
    if UPDATING then
        pkg_replx_evt.InsertLog(
            row_id=>:new.rowid,
            towner=>'IM_DICT',
            tname=>'IM_RES_TYPE_ATTR_SET',
            key=>key_str,
            priority=>0,
            hash_val=>52,
            operation=>'U'
        );
        return;
    end if;



    if DELETING then
        pkg_replx_evt.InsertLog(
            row_id=>:new.rowid,
            towner=>'IM_DICT',
            tname=>'IM_RES_TYPE_ATTR_SET',
            key=>key_str,
            priority=>0,
            hash_val=>52,
            operation=>'D'
        );
        return;
    end if;
end;
//
ALTER TRIGGER "TRIG_REPLX30_1667067" DISABLE;
//
# TRIG_REPLX30_1667393 触发器创建
CREATE OR REPLACE TRIGGER "TRIG_REPLX30_1667393"
    after insert or delete or update on U_COMMON.IM_RES_TYPE_COLOR
    for each row
declare
    key_str   varchar(1024);
begin
    if INSERTING then
        key_str :='RES_TYPE_ID='||:new.RES_TYPE_ID||','||chr(3)||
                  'COLOR='||:new.COLOR;
        pkg_replx_evt.InsertLog(
            row_id=>:new.rowid,
            towner=>'IM_DICT',
            tname=>'IM_RES_TYPE_COLOR',
            key=>key_str,
            priority=>0,
            hash_val=>30,
            operation=>'I'
        );
        return;
    end if;



    key_str :='RES_TYPE_ID='||:old.RES_TYPE_ID||','||chr(3)||
              'COLOR='||:old.COLOR;
    if UPDATING then
        pkg_replx_evt.InsertLog(
            row_id=>:new.rowid,
            towner=>'IM_DICT',
            tname=>'IM_RES_TYPE_COLOR',
            key=>key_str,
            priority=>0,
            hash_val=>30,
            operation=>'U'
        );
        return;
    end if;



    if DELETING then
        pkg_replx_evt.InsertLog(
            row_id=>:new.rowid,
            towner=>'IM_DICT',
            tname=>'IM_RES_TYPE_COLOR',
            key=>key_str,
            priority=>0,
            hash_val=>30,
            operation=>'D'
        );
        return;
    end if;
end;
//
ALTER TRIGGER "TRIG_REPLX30_1667393" DISABLE;
//
# TRIG_REPLX30_1668255 触发器创建
CREATE OR REPLACE TRIGGER "TRIG_REPLX30_1668255"
    after insert or delete or update on U_COMMON.IM_VENDOR_INFO
    for each row
declare
    key_str   varchar(1024);
begin
    if INSERTING then
        key_str :='VENDOR_ID='||:new.VENDOR_ID||','||chr(3)||
                  'REGION='||:new.REGION;
        pkg_replx_evt.InsertLog(
            row_id=>:new.rowid,
            towner=>'IM_DICT',
            tname=>'IM_VENDOR_INFO',
            key=>key_str,
            priority=>0,
            hash_val=>17,
            operation=>'I'
        );
        return;
    end if;



    key_str :='VENDOR_ID='||:old.VENDOR_ID||','||chr(3)||
              'REGION='||:old.REGION;
    if UPDATING then
        pkg_replx_evt.InsertLog(
            row_id=>:new.rowid,
            towner=>'IM_DICT',
            tname=>'IM_VENDOR_INFO',
            key=>key_str,
            priority=>0,
            hash_val=>17,
            operation=>'U'
        );
        return;
    end if;



    if DELETING then
        pkg_replx_evt.InsertLog(
            row_id=>:new.rowid,
            towner=>'IM_DICT',
            tname=>'IM_VENDOR_INFO',
            key=>key_str,
            priority=>0,
            hash_val=>17,
            operation=>'D'
        );
        return;
    end if;
end;
//
ALTER TRIGGER "TRIG_REPLX30_1668255" DISABLE;
//
# TRIG_REPLX30_1954503 触发器创建
CREATE OR REPLACE TRIGGER "TRIG_REPLX30_1954503"
    after insert or delete or update on U_COMMON.PSI_CFG_RESBRAND
    for each row
declare
    key_str   varchar(1024);
begin
    if INSERTING then
        key_str :='BRAND_ID='||:new.BRAND_ID;
        pkg_replx_evt.InsertLog(
            row_id=>:new.rowid,
            towner=>'IM_DICT',
            tname=>'PSI_CFG_RESBRAND',
            key=>key_str,
            priority=>0,
            hash_val=>28,
            operation=>'I'
        );
        return;
    end if;



    key_str :='BRAND_ID='||:old.BRAND_ID;
    if UPDATING then
        pkg_replx_evt.InsertLog(
            row_id=>:new.rowid,
            towner=>'IM_DICT',
            tname=>'PSI_CFG_RESBRAND',
            key=>key_str,
            priority=>0,
            hash_val=>28,
            operation=>'U'
        );
        return;
    end if;



    if DELETING then
        pkg_replx_evt.InsertLog(
            row_id=>:new.rowid,
            towner=>'IM_DICT',
            tname=>'PSI_CFG_RESBRAND',
            key=>key_str,
            priority=>0,
            hash_val=>28,
            operation=>'D'
        );
        return;
    end if;
end;
//
ALTER TRIGGER "TRIG_REPLX30_1954503" DISABLE;
//
######### TRIG_REPLX30_1954503 调用部分  #########
delete from replx_log;
delete from replicate_switch;
delete from U_COMMON.PSI_CFG_RESBRAND;
ALTER TRIGGER "TRIG_REPLX30_1954503" ENABLE;
# 这个文件内所有触发器的调用都受rowid的影响, 修复后请到test文件中放开下面的所有调用
insert into U_COMMON.PSI_CFG_RESBRAND(BRAND_ID) values(200);
ALTER TRIGGER "TRIG_REPLX30_1954503" DISABLE;
######### TRIG_REPLX30_1954503 调用部分  #########
delete from replx_log;
delete from replicate_switch;
delete from U_COMMON.PSI_CFG_RESBRAND;
ALTER TRIGGER "TRIG_REPLX30_1954503" ENABLE;
insert into U_COMMON.PSI_CFG_RESBRAND(BRAND_ID) values(200);
# 预期结果: 300, IM_DICT, PSI_CFG_RESBRAND, I, 28
select region, table_owner, table_name, operation, hash_val from replx_log;
+--------+-------------+------------------+-----------+----------+
| REGION | TABLE_OWNER | TABLE_NAME       | OPERATION | HASH_VAL |
+--------+-------------+------------------+-----------+----------+
|    300 | IM_DICT     | PSI_CFG_RESBRAND | I         |       28 |
+--------+-------------+------------------+-----------+----------+
# 预期结果: BRAND_ID=200, 1, 0
select pkey, instance_id, scn from replx_log;
+--------------+-------------+------+
| PKEY         | INSTANCE_ID | SCN  |
+--------------+-------------+------+
| BRAND_ID=200 |           2 |    0 |
+--------------+-------------+------+
update U_COMMON.PSI_CFG_RESBRAND set BRAND_ID = 90;
# 预期结果如下:
# 300, IM_DICT, PSI_CFG_RESBRAND, I, 28
# 300, IM_DICT, PSI_CFG_RESBRAND, U, 28
select region, table_owner, table_name, operation, hash_val from replx_log order by operation;
+--------+-------------+------------------+-----------+----------+
| REGION | TABLE_OWNER | TABLE_NAME       | OPERATION | HASH_VAL |
+--------+-------------+------------------+-----------+----------+
|    300 | IM_DICT     | PSI_CFG_RESBRAND | I         |       28 |
|    300 | IM_DICT     | PSI_CFG_RESBRAND | U         |       28 |
+--------+-------------+------------------+-----------+----------+
delete from U_COMMON.PSI_CFG_RESBRAND;
# 预期结果如下:
# 300, IM_DICT, PSI_CFG_RESBRAND, D, 28
# 300, IM_DICT, PSI_CFG_RESBRAND, I, 28
# 300, IM_DICT, PSI_CFG_RESBRAND, U, 28
select region, table_owner, table_name, operation, hash_val from replx_log order by operation;
+--------+-------------+------------------+-----------+----------+
| REGION | TABLE_OWNER | TABLE_NAME       | OPERATION | HASH_VAL |
+--------+-------------+------------------+-----------+----------+
|    300 | IM_DICT     | PSI_CFG_RESBRAND | D         |       28 |
|    300 | IM_DICT     | PSI_CFG_RESBRAND | I         |       28 |
|    300 | IM_DICT     | PSI_CFG_RESBRAND | U         |       28 |
+--------+-------------+------------------+-----------+----------+
ALTER TRIGGER "TRIG_REPLX30_1954503" DISABLE;
######### TRIG_REPLX30_1668255 调用部分  #########
delete from replx_log;
delete from replicate_switch;
delete from U_COMMON.IM_VENDOR_INFO;
ALTER TRIGGER "TRIG_REPLX30_1668255" ENABLE;
insert into U_COMMON.IM_VENDOR_INFO(VENDOR_ID,REGION) values(1,2);
# 预期结果: 300, IM_DICT, IM_VENDOR_INFO, I, 17
select region, table_owner, table_name, operation, hash_val from replx_log;
+--------+-------------+----------------+-----------+----------+
| REGION | TABLE_OWNER | TABLE_NAME     | OPERATION | HASH_VAL |
+--------+-------------+----------------+-----------+----------+
|    300 | IM_DICT     | IM_VENDOR_INFO | I         |       17 |
+--------+-------------+----------------+-----------+----------+
# 预期结果: VENDOR_ID=1,REGION=2, 1, 0
select pkey, instance_id, scn from replx_log;
+-----------------------+-------------+------+
| PKEY                  | INSTANCE_ID | SCN  |
+-----------------------+-------------+------+
| VENDOR_ID=1,REGION=2 |           2 |    0 |
+-----------------------+-------------+------+
update U_COMMON.IM_VENDOR_INFO set VENDOR_ID = 9;
# 预期结果如下:
# 300, IM_DICT, IM_VENDOR_INFO, I, 17
# 300, IM_DICT, IM_VENDOR_INFO, U, 17
select region, table_owner, table_name, operation, hash_val from replx_log order by operation;
+--------+-------------+----------------+-----------+----------+
| REGION | TABLE_OWNER | TABLE_NAME     | OPERATION | HASH_VAL |
+--------+-------------+----------------+-----------+----------+
|    300 | IM_DICT     | IM_VENDOR_INFO | I         |       17 |
|    300 | IM_DICT     | IM_VENDOR_INFO | U         |       17 |
+--------+-------------+----------------+-----------+----------+
delete from U_COMMON.IM_VENDOR_INFO;
# 预期结果如下:
# 300, IM_DICT, IM_VENDOR_INFO, D, 17
# 300, IM_DICT, IM_VENDOR_INFO, I, 17
# 300, IM_DICT, IM_VENDOR_INFO, U, 17
select region, table_owner, table_name, operation, hash_val from replx_log order by operation;
+--------+-------------+----------------+-----------+----------+
| REGION | TABLE_OWNER | TABLE_NAME     | OPERATION | HASH_VAL |
+--------+-------------+----------------+-----------+----------+
|    300 | IM_DICT     | IM_VENDOR_INFO | D         |       17 |
|    300 | IM_DICT     | IM_VENDOR_INFO | I         |       17 |
|    300 | IM_DICT     | IM_VENDOR_INFO | U         |       17 |
+--------+-------------+----------------+-----------+----------+
ALTER TRIGGER "TRIG_REPLX30_1668255" DISABLE;
######### TRIG_REPLX30_1667393 调用部分  #########
delete from replx_log;
delete from replicate_switch;
delete from U_COMMON.IM_RES_TYPE_COLOR;
ALTER TRIGGER "TRIG_REPLX30_1667393" ENABLE;
insert into U_COMMON.IM_RES_TYPE_COLOR(RES_TYPE_ID,COLOR) values(1,2);
# 预期结果: 300, IM_DICT, IM_RES_TYPE_COLOR, I, 30
select region, table_owner, table_name, operation, hash_val from replx_log;
+--------+-------------+-------------------+-----------+----------+
| REGION | TABLE_OWNER | TABLE_NAME        | OPERATION | HASH_VAL |
+--------+-------------+-------------------+-----------+----------+
|    300 | IM_DICT     | IM_RES_TYPE_COLOR | I         |       30 |
+--------+-------------+-------------------+-----------+----------+
# 预期结果: RES_TYPE_ID=1,COLOR=2, 1, 0
select pkey, instance_id, scn from replx_log;
+------------------------+-------------+------+
| PKEY                   | INSTANCE_ID | SCN  |
+------------------------+-------------+------+
| RES_TYPE_ID=1,COLOR=2 |           2 |    0 |
+------------------------+-------------+------+
update U_COMMON.IM_RES_TYPE_COLOR set RES_TYPE_ID = 9;
# 预期结果如下:
# 300, IM_DICT, IM_RES_TYPE_COLOR, I, 30
# 300, IM_DICT, IM_RES_TYPE_COLOR, U, 30
select region, table_owner, table_name, operation, hash_val from replx_log order by operation;
+--------+-------------+-------------------+-----------+----------+
| REGION | TABLE_OWNER | TABLE_NAME        | OPERATION | HASH_VAL |
+--------+-------------+-------------------+-----------+----------+
|    300 | IM_DICT     | IM_RES_TYPE_COLOR | I         |       30 |
|    300 | IM_DICT     | IM_RES_TYPE_COLOR | U         |       30 |
+--------+-------------+-------------------+-----------+----------+
delete from U_COMMON.IM_RES_TYPE_COLOR;
# 预期结果如下:
# 300, IM_DICT, IM_RES_TYPE_COLOR, D, 30
# 300, IM_DICT, IM_RES_TYPE_COLOR, I, 30
# 300, IM_DICT, IM_RES_TYPE_COLOR, U, 30
select region, table_owner, table_name, operation, hash_val from replx_log order by operation;
+--------+-------------+-------------------+-----------+----------+
| REGION | TABLE_OWNER | TABLE_NAME        | OPERATION | HASH_VAL |
+--------+-------------+-------------------+-----------+----------+
|    300 | IM_DICT     | IM_RES_TYPE_COLOR | D         |       30 |
|    300 | IM_DICT     | IM_RES_TYPE_COLOR | I         |       30 |
|    300 | IM_DICT     | IM_RES_TYPE_COLOR | U         |       30 |
+--------+-------------+-------------------+-----------+----------+
ALTER TRIGGER "TRIG_REPLX30_1667393" DISABLE;
######### TRIG_REPLX30_1667067 调用部分  #########
delete from replx_log;
delete from replicate_switch;
delete from U_COMMON.IM_RES_TYPE_ATTR_SET;
ALTER TRIGGER "TRIG_REPLX30_1667067" ENABLE;
insert into U_COMMON.IM_RES_TYPE_ATTR_SET(RES_TYPE_ID,ATTR_ID) values(1,2);
# 预期结果: 300, IM_DICT, IM_RES_TYPE_ATTR_SET, I, 52
select region, table_owner, table_name, operation, hash_val from replx_log;
+--------+-------------+----------------------+-----------+----------+
| REGION | TABLE_OWNER | TABLE_NAME           | OPERATION | HASH_VAL |
+--------+-------------+----------------------+-----------+----------+
|    300 | IM_DICT     | IM_RES_TYPE_ATTR_SET | I         |       52 |
+--------+-------------+----------------------+-----------+----------+
# 预期结果: RES_TYPE_ID=1,ATTR_ID=2, 1, 0
select pkey, instance_id, scn from replx_log;
+--------------------------+-------------+------+
| PKEY                     | INSTANCE_ID | SCN  |
+--------------------------+-------------+------+
| RES_TYPE_ID=1,ATTR_ID=2 |           2 |    0 |
+--------------------------+-------------+------+
update U_COMMON.IM_RES_TYPE_ATTR_SET set RES_TYPE_ID = 9;
# 预期结果如下:
# 300, IM_DICT, IM_RES_TYPE_ATTR_SET, I, 52
# 300, IM_DICT, IM_RES_TYPE_ATTR_SET, U, 52
select region, table_owner, table_name, operation, hash_val from replx_log order by operation;
+--------+-------------+----------------------+-----------+----------+
| REGION | TABLE_OWNER | TABLE_NAME           | OPERATION | HASH_VAL |
+--------+-------------+----------------------+-----------+----------+
|    300 | IM_DICT     | IM_RES_TYPE_ATTR_SET | I         |       52 |
|    300 | IM_DICT     | IM_RES_TYPE_ATTR_SET | U         |       52 |
+--------+-------------+----------------------+-----------+----------+
delete from U_COMMON.IM_RES_TYPE_ATTR_SET;
# 预期结果如下:
# 300, IM_DICT, IM_RES_TYPE_ATTR_SET, D, 52
# 300, IM_DICT, IM_RES_TYPE_ATTR_SET, I, 52
# 300, IM_DICT, IM_RES_TYPE_ATTR_SET, U, 52
select region, table_owner, table_name, operation, hash_val from replx_log order by operation;
+--------+-------------+----------------------+-----------+----------+
| REGION | TABLE_OWNER | TABLE_NAME           | OPERATION | HASH_VAL |
+--------+-------------+----------------------+-----------+----------+
|    300 | IM_DICT     | IM_RES_TYPE_ATTR_SET | D         |       52 |
|    300 | IM_DICT     | IM_RES_TYPE_ATTR_SET | I         |       52 |
|    300 | IM_DICT     | IM_RES_TYPE_ATTR_SET | U         |       52 |
+--------+-------------+----------------------+-----------+----------+
ALTER TRIGGER "TRIG_REPLX30_1667067" DISABLE;
######### TRIG_REPLX30_1666932 调用部分  #########
delete from replx_log;
delete from replicate_switch;
delete from U_COMMON.IM_RES_TYPE;
ALTER TRIGGER "TRIG_REPLX30_1666932" ENABLE;
insert into U_COMMON.IM_RES_TYPE(RES_TYPE_ID) values(1);
# 预期结果: 300, IM_DICT, IM_RES_TYPE, I, 19
select region, table_owner, table_name, operation, hash_val from replx_log;
+--------+-------------+-------------+-----------+----------+
| REGION | TABLE_OWNER | TABLE_NAME  | OPERATION | HASH_VAL |
+--------+-------------+-------------+-----------+----------+
|    300 | IM_DICT     | IM_RES_TYPE | I         |       19 |
+--------+-------------+-------------+-----------+----------+
# 预期结果: RES_TYPE_ID=1, 1, 0
select pkey, instance_id, scn from replx_log;
+---------------+-------------+------+
| PKEY          | INSTANCE_ID | SCN  |
+---------------+-------------+------+
| RES_TYPE_ID=1 |           2 |    0 |
+---------------+-------------+------+
update U_COMMON.IM_RES_TYPE set RES_TYPE_ID = 9;
# 预期结果如下:
# 300, IM_DICT, IM_RES_TYPE, I, 19
# 300, IM_DICT, IM_RES_TYPE, U, 19
select region, table_owner, table_name, operation, hash_val from replx_log order by operation;
+--------+-------------+-------------+-----------+----------+
| REGION | TABLE_OWNER | TABLE_NAME  | OPERATION | HASH_VAL |
+--------+-------------+-------------+-----------+----------+
|    300 | IM_DICT     | IM_RES_TYPE | I         |       19 |
|    300 | IM_DICT     | IM_RES_TYPE | U         |       19 |
+--------+-------------+-------------+-----------+----------+
delete from U_COMMON.IM_RES_TYPE;
# 预期结果如下:
# 300, IM_DICT, IM_RES_TYPE, D, 19
# 300, IM_DICT, IM_RES_TYPE, I, 19
# 300, IM_DICT, IM_RES_TYPE, U, 19
select region, table_owner, table_name, operation, hash_val from replx_log order by operation;
+--------+-------------+-------------+-----------+----------+
| REGION | TABLE_OWNER | TABLE_NAME  | OPERATION | HASH_VAL |
+--------+-------------+-------------+-----------+----------+
|    300 | IM_DICT     | IM_RES_TYPE | D         |       19 |
|    300 | IM_DICT     | IM_RES_TYPE | I         |       19 |
|    300 | IM_DICT     | IM_RES_TYPE | U         |       19 |
+--------+-------------+-------------+-----------+----------+
ALTER TRIGGER "TRIG_REPLX30_1666932" DISABLE;
######### TRIG_REPLX30_1666564 调用部分  #########
delete from replx_log;
delete from replicate_switch;
delete from U_COMMON.IM_QUERY;
ALTER TRIGGER "TRIG_REPLX30_1666564" ENABLE;
insert into U_COMMON.IM_QUERY(QUERY_ID,IS_HEAD) values(1,2);
# 预期结果: 300, IM_DICT, IM_QUERY, I, 4
select region, table_owner, table_name, operation, hash_val from replx_log;
+--------+-------------+------------+-----------+----------+
| REGION | TABLE_OWNER | TABLE_NAME | OPERATION | HASH_VAL |
+--------+-------------+------------+-----------+----------+
|    300 | IM_DICT     | IM_QUERY   | I         |        4 |
+--------+-------------+------------+-----------+----------+
# 预期结果: QUERY_ID=1,IS_HEAD=2, 1, 0
select pkey, instance_id, scn from replx_log;
+-----------------------+-------------+------+
| PKEY                  | INSTANCE_ID | SCN  |
+-----------------------+-------------+------+
| QUERY_ID=1,IS_HEAD=2 |           2 |    0 |
+-----------------------+-------------+------+
update U_COMMON.IM_QUERY set QUERY_ID = 9;
# 预期结果如下:
# 300, IM_DICT, IM_QUERY, I, 4
# 300, IM_DICT, IM_QUERY, U, 4
select region, table_owner, table_name, operation, hash_val from replx_log order by operation;
+--------+-------------+------------+-----------+----------+
| REGION | TABLE_OWNER | TABLE_NAME | OPERATION | HASH_VAL |
+--------+-------------+------------+-----------+----------+
|    300 | IM_DICT     | IM_QUERY   | I         |        4 |
|    300 | IM_DICT     | IM_QUERY   | U         |        4 |
+--------+-------------+------------+-----------+----------+
delete from U_COMMON.IM_QUERY;
# 预期结果如下:
# 300, IM_DICT, IM_QUERY, D, 4
# 300, IM_DICT, IM_QUERY, I, 4
# 300, IM_DICT, IM_QUERY, U, 4
select region, table_owner, table_name, operation, hash_val from replx_log order by operation;
+--------+-------------+------------+-----------+----------+
| REGION | TABLE_OWNER | TABLE_NAME | OPERATION | HASH_VAL |
+--------+-------------+------------+-----------+----------+
|    300 | IM_DICT     | IM_QUERY   | D         |        4 |
|    300 | IM_DICT     | IM_QUERY   | I         |        4 |
|    300 | IM_DICT     | IM_QUERY   | U         |        4 |
+--------+-------------+------------+-----------+----------+
ALTER TRIGGER "TRIG_REPLX30_1666564" DISABLE;
######### TRIG_REPLX30_1666449 调用部分  #########
delete from replx_log;
delete from replicate_switch;
delete from U_COMMON.IM_QRY_COND_MATCHER;
ALTER TRIGGER "TRIG_REPLX30_1666449" ENABLE;
insert into U_COMMON.IM_QRY_COND_MATCHER(QUERY_ID,COND_NAME,MATCHER) values(1,2,3);
# 预期结果: 300, IM_DICT, IM_QRY_COND_MATCHER, I, 43
select region, table_owner, table_name, operation, hash_val from replx_log;
+--------+-------------+---------------------+-----------+----------+
| REGION | TABLE_OWNER | TABLE_NAME          | OPERATION | HASH_VAL |
+--------+-------------+---------------------+-----------+----------+
|    300 | IM_DICT     | IM_QRY_COND_MATCHER | I         |       43 |
+--------+-------------+---------------------+-----------+----------+
# 预期结果: QUERY_ID=1,COND_NAME=2,MATCHER=3, 1, 0
select pkey, instance_id, scn from replx_log;
+------------------------------------+-------------+------+
| PKEY                               | INSTANCE_ID | SCN  |
+------------------------------------+-------------+------+
| QUERY_ID=1,COND_NAME=2,MATCHER=3 |           2 |    0 |
+------------------------------------+-------------+------+
update U_COMMON.IM_QRY_COND_MATCHER set QUERY_ID = 9;
# 预期结果如下:
# 300, IM_DICT, IM_QRY_COND_MATCHER, I, 43
# 300, IM_DICT, IM_QRY_COND_MATCHER, U, 43
select region, table_owner, table_name, operation, hash_val from replx_log order by operation;
+--------+-------------+---------------------+-----------+----------+
| REGION | TABLE_OWNER | TABLE_NAME          | OPERATION | HASH_VAL |
+--------+-------------+---------------------+-----------+----------+
|    300 | IM_DICT     | IM_QRY_COND_MATCHER | I         |       43 |
|    300 | IM_DICT     | IM_QRY_COND_MATCHER | U         |       43 |
+--------+-------------+---------------------+-----------+----------+
delete from U_COMMON.IM_QRY_COND_MATCHER;
# 预期结果如下:
# 300, IM_DICT, IM_QRY_COND_MATCHER, D, 43
# 300, IM_DICT, IM_QRY_COND_MATCHER, I, 43
# 300, IM_DICT, IM_QRY_COND_MATCHER, U, 43
select region, table_owner, table_name, operation, hash_val from replx_log order by operation;
+--------+-------------+---------------------+-----------+----------+
| REGION | TABLE_OWNER | TABLE_NAME          | OPERATION | HASH_VAL |
+--------+-------------+---------------------+-----------+----------+
|    300 | IM_DICT     | IM_QRY_COND_MATCHER | D         |       43 |
|    300 | IM_DICT     | IM_QRY_COND_MATCHER | I         |       43 |
|    300 | IM_DICT     | IM_QRY_COND_MATCHER | U         |       43 |
+--------+-------------+---------------------+-----------+----------+
ALTER TRIGGER "TRIG_REPLX30_1666449" DISABLE;
######### TRIG_REPLX30_1665835 调用部分  #########
delete from replx_log;
delete from replicate_switch;
delete from U_COMMON.IM_IF_SEGMENT_SCPINFO;
ALTER TRIGGER "TRIG_REPLX30_1665835" ENABLE;
insert into U_COMMON.IM_IF_SEGMENT_SCPINFO(REGION,SCP_ID) values(1,2);
# 预期结果: 300, IM_DICT, IM_IF_SEGMENT_SCPINFO, I, 11
select region, table_owner, table_name, operation, hash_val from replx_log;
+--------+-------------+-----------------------+-----------+----------+
| REGION | TABLE_OWNER | TABLE_NAME            | OPERATION | HASH_VAL |
+--------+-------------+-----------------------+-----------+----------+
|    300 | IM_DICT     | IM_IF_SEGMENT_SCPINFO | I         |       11 |
+--------+-------------+-----------------------+-----------+----------+
# 预期结果: REGION=1,SCP_ID=2, 1, 0
select pkey, instance_id, scn from replx_log;
+--------------------+-------------+------+
| PKEY               | INSTANCE_ID | SCN  |
+--------------------+-------------+------+
| REGION=1,SCP_ID=2 |           2 |    0 |
+--------------------+-------------+------+
update U_COMMON.IM_IF_SEGMENT_SCPINFO set REGION = 9;
# 预期结果如下:
# 300, IM_DICT, IM_IF_SEGMENT_SCPINFO, I, 11
# 300, IM_DICT, IM_IF_SEGMENT_SCPINFO, U, 11
select region, table_owner, table_name, operation, hash_val from replx_log order by operation;
+--------+-------------+-----------------------+-----------+----------+
| REGION | TABLE_OWNER | TABLE_NAME            | OPERATION | HASH_VAL |
+--------+-------------+-----------------------+-----------+----------+
|    300 | IM_DICT     | IM_IF_SEGMENT_SCPINFO | I         |       11 |
|    300 | IM_DICT     | IM_IF_SEGMENT_SCPINFO | U         |       11 |
+--------+-------------+-----------------------+-----------+----------+
delete from U_COMMON.IM_IF_SEGMENT_SCPINFO;
# 预期结果如下:
# 300, IM_DICT, IM_IF_SEGMENT_SCPINFO, D, 11
# 300, IM_DICT, IM_IF_SEGMENT_SCPINFO, I, 11
# 300, IM_DICT, IM_IF_SEGMENT_SCPINFO, U, 11
select region, table_owner, table_name, operation, hash_val from replx_log order by operation;
+--------+-------------+-----------------------+-----------+----------+
| REGION | TABLE_OWNER | TABLE_NAME            | OPERATION | HASH_VAL |
+--------+-------------+-----------------------+-----------+----------+
|    300 | IM_DICT     | IM_IF_SEGMENT_SCPINFO | D         |       11 |
|    300 | IM_DICT     | IM_IF_SEGMENT_SCPINFO | I         |       11 |
|    300 | IM_DICT     | IM_IF_SEGMENT_SCPINFO | U         |       11 |
+--------+-------------+-----------------------+-----------+----------+
ALTER TRIGGER "TRIG_REPLX30_1665835" DISABLE;
######### TRIG_REPLX30_1665832 调用部分  #########
delete from replx_log;
delete from replicate_switch;
delete from U_COMMON.IM_IF_SEGMENT_HLRINFO;
ALTER TRIGGER "TRIG_REPLX30_1665832" ENABLE;
insert into U_COMMON.IM_IF_SEGMENT_HLRINFO(REGION,MAIN_HLR_ID) values(1,2);
# 预期结果: 300, IM_DICT, IM_IF_SEGMENT_HLRINFO, I, 37
select region, table_owner, table_name, operation, hash_val from replx_log;
+--------+-------------+-----------------------+-----------+----------+
| REGION | TABLE_OWNER | TABLE_NAME            | OPERATION | HASH_VAL |
+--------+-------------+-----------------------+-----------+----------+
|    300 | IM_DICT     | IM_IF_SEGMENT_HLRINFO | I         |       37 |
+--------+-------------+-----------------------+-----------+----------+
# 预期结果: REGION=1,MAIN_HLR_ID=2, 1, 0
select pkey, instance_id, scn from replx_log;
+-------------------------+-------------+------+
| PKEY                    | INSTANCE_ID | SCN  |
+-------------------------+-------------+------+
| REGION=1,MAIN_HLR_ID=2 |           2 |    0 |
+-------------------------+-------------+------+
update U_COMMON.IM_IF_SEGMENT_HLRINFO set REGION = 9;
# 预期结果如下:
# 300, IM_DICT, IM_IF_SEGMENT_HLRINFO, I, 37
# 300, IM_DICT, IM_IF_SEGMENT_HLRINFO, U, 37
select region, table_owner, table_name, operation, hash_val from replx_log order by operation;
+--------+-------------+-----------------------+-----------+----------+
| REGION | TABLE_OWNER | TABLE_NAME            | OPERATION | HASH_VAL |
+--------+-------------+-----------------------+-----------+----------+
|    300 | IM_DICT     | IM_IF_SEGMENT_HLRINFO | I         |       37 |
|    300 | IM_DICT     | IM_IF_SEGMENT_HLRINFO | U         |       37 |
+--------+-------------+-----------------------+-----------+----------+
delete from U_COMMON.IM_IF_SEGMENT_HLRINFO;
# 预期结果如下:
# 300, IM_DICT, IM_IF_SEGMENT_HLRINFO, D, 37
# 300, IM_DICT, IM_IF_SEGMENT_HLRINFO, I, 37
# 300, IM_DICT, IM_IF_SEGMENT_HLRINFO, U, 37
select region, table_owner, table_name, operation, hash_val from replx_log order by operation;
+--------+-------------+-----------------------+-----------+----------+
| REGION | TABLE_OWNER | TABLE_NAME            | OPERATION | HASH_VAL |
+--------+-------------+-----------------------+-----------+----------+
|    300 | IM_DICT     | IM_IF_SEGMENT_HLRINFO | D         |       37 |
|    300 | IM_DICT     | IM_IF_SEGMENT_HLRINFO | I         |       37 |
|    300 | IM_DICT     | IM_IF_SEGMENT_HLRINFO | U         |       37 |
+--------+-------------+-----------------------+-----------+----------+
ALTER TRIGGER "TRIG_REPLX30_1665832" DISABLE;
######### TRIG_REPLX30_1665084 调用部分  #########
delete from replx_log;
delete from replicate_switch;
delete from U_COMMON.IM_DICT_ITEM;
ALTER TRIGGER "TRIG_REPLX30_1665084" ENABLE;
insert into U_COMMON.IM_DICT_ITEM(ITEMID,GROUPID) values(1,2);
# 预期结果: 300, IM_DICT, IM_DICT_ITEM, I, 25
select region, table_owner, table_name, operation, hash_val from replx_log;
+--------+-------------+--------------+-----------+----------+
| REGION | TABLE_OWNER | TABLE_NAME   | OPERATION | HASH_VAL |
+--------+-------------+--------------+-----------+----------+
|    300 | IM_DICT     | IM_DICT_ITEM | I         |       25 |
+--------+-------------+--------------+-----------+----------+
# 预期结果: ITEMID=1,GROUPID=2, 1, 0
select pkey, instance_id, scn from replx_log;
+---------------------+-------------+------+
| PKEY                | INSTANCE_ID | SCN  |
+---------------------+-------------+------+
| ITEMID=1,GROUPID=2 |           2 |    0 |
+---------------------+-------------+------+
update U_COMMON.IM_DICT_ITEM set ITEMID = 9;
# 预期结果如下:
# 300, IM_DICT, IM_DICT_ITEM, I, 25
# 300, IM_DICT, IM_DICT_ITEM, U, 25
select region, table_owner, table_name, operation, hash_val from replx_log order by operation;
+--------+-------------+--------------+-----------+----------+
| REGION | TABLE_OWNER | TABLE_NAME   | OPERATION | HASH_VAL |
+--------+-------------+--------------+-----------+----------+
|    300 | IM_DICT     | IM_DICT_ITEM | I         |       25 |
|    300 | IM_DICT     | IM_DICT_ITEM | U         |       25 |
+--------+-------------+--------------+-----------+----------+
delete from U_COMMON.IM_DICT_ITEM;
# 预期结果如下:
# 300, IM_DICT, IM_DICT_ITEM, D, 25
# 300, IM_DICT, IM_DICT_ITEM, I, 25
# 300, IM_DICT, IM_DICT_ITEM, U, 25
select region, table_owner, table_name, operation, hash_val from replx_log order by operation;
+--------+-------------+--------------+-----------+----------+
| REGION | TABLE_OWNER | TABLE_NAME   | OPERATION | HASH_VAL |
+--------+-------------+--------------+-----------+----------+
|    300 | IM_DICT     | IM_DICT_ITEM | D         |       25 |
|    300 | IM_DICT     | IM_DICT_ITEM | I         |       25 |
|    300 | IM_DICT     | IM_DICT_ITEM | U         |       25 |
+--------+-------------+--------------+-----------+----------+
ALTER TRIGGER "TRIG_REPLX30_1665084" DISABLE;
######### TRIG_REPLX30_1662226 调用部分  #########
delete from replx_log;
delete from replicate_switch;
delete from U_COMMON.IM_BUSI_SET_PARAMCHG;
ALTER TRIGGER "TRIG_REPLX30_1662226" ENABLE;
insert into U_COMMON.IM_BUSI_SET_PARAMCHG(BUSI_TYPE) values(100);
# 预期结果: 300, IM_DICT, IM_BUSI_SET_PARAMCHG, I, 60
select region, table_owner, table_name, operation, hash_val from replx_log;
+--------+-------------+----------------------+-----------+----------+
| REGION | TABLE_OWNER | TABLE_NAME           | OPERATION | HASH_VAL |
+--------+-------------+----------------------+-----------+----------+
|    300 | IM_DICT     | IM_BUSI_SET_PARAMCHG | I         |       60 |
+--------+-------------+----------------------+-----------+----------+
# 预期结果: BUSI_TYPE=100, 1, 0
select pkey, instance_id, scn from replx_log;
+---------------+-------------+------+
| PKEY          | INSTANCE_ID | SCN  |
+---------------+-------------+------+
| BUSI_TYPE=100 |           2 |    0 |
+---------------+-------------+------+
update U_COMMON.IM_BUSI_SET_PARAMCHG set BUSI_TYPE = 90;
# 预期结果如下:
# 300, IM_DICT, IM_BUSI_SET_PARAMCHG, I, 60
# 300, IM_DICT, IM_BUSI_SET_PARAMCHG, U, 60
select region, table_owner, table_name, operation, hash_val from replx_log order by operation;
+--------+-------------+----------------------+-----------+----------+
| REGION | TABLE_OWNER | TABLE_NAME           | OPERATION | HASH_VAL |
+--------+-------------+----------------------+-----------+----------+
|    300 | IM_DICT     | IM_BUSI_SET_PARAMCHG | I         |       60 |
|    300 | IM_DICT     | IM_BUSI_SET_PARAMCHG | U         |       60 |
+--------+-------------+----------------------+-----------+----------+
delete from U_COMMON.IM_BUSI_SET_PARAMCHG;
# 预期结果如下:
# 300, IM_DICT, IM_BUSI_SET_PARAMCHG, D, 60
# 300, IM_DICT, IM_BUSI_SET_PARAMCHG, I, 60
# 300, IM_DICT, IM_BUSI_SET_PARAMCHG, U, 60
select region, table_owner, table_name, operation, hash_val from replx_log order by operation;
+--------+-------------+----------------------+-----------+----------+
| REGION | TABLE_OWNER | TABLE_NAME           | OPERATION | HASH_VAL |
+--------+-------------+----------------------+-----------+----------+
|    300 | IM_DICT     | IM_BUSI_SET_PARAMCHG | D         |       60 |
|    300 | IM_DICT     | IM_BUSI_SET_PARAMCHG | I         |       60 |
|    300 | IM_DICT     | IM_BUSI_SET_PARAMCHG | U         |       60 |
+--------+-------------+----------------------+-----------+----------+
ALTER TRIGGER "TRIG_REPLX30_1662226" DISABLE;
######### TRIG_REPLX30_1662225 调用部分  #########
delete from replx_log;
delete from replicate_switch;
delete from U_COMMON.IM_BUSI_SET;
ALTER TRIGGER "TRIG_REPLX30_1662225" ENABLE;
insert into U_COMMON.IM_BUSI_SET(RES_TYPE_ID,BUSI_TYPE) values(1,2);
# 预期结果: 300, IM_DICT, IM_BUSI_SET, I, 42
select region, table_owner, table_name, operation, hash_val from replx_log;
+--------+-------------+-------------+-----------+----------+
| REGION | TABLE_OWNER | TABLE_NAME  | OPERATION | HASH_VAL |
+--------+-------------+-------------+-----------+----------+
|    300 | IM_DICT     | IM_BUSI_SET | I         |       42 |
+--------+-------------+-------------+-----------+----------+
# 预期结果: RES_TYPE_ID=1,BUSI_TYPE=2, 1, 0
select pkey, instance_id, scn from replx_log;
+----------------------------+-------------+------+
| PKEY                       | INSTANCE_ID | SCN  |
+----------------------------+-------------+------+
| RES_TYPE_ID=1,BUSI_TYPE=2 |           2 |    0 |
+----------------------------+-------------+------+
update U_COMMON.IM_BUSI_SET set BUSI_TYPE = 9;
# 预期结果如下:
# 300, IM_DICT, IM_BUSI_SET, I, 42
# 300, IM_DICT, IM_BUSI_SET, U, 42
select region, table_owner, table_name, operation, hash_val from replx_log order by operation;
+--------+-------------+-------------+-----------+----------+
| REGION | TABLE_OWNER | TABLE_NAME  | OPERATION | HASH_VAL |
+--------+-------------+-------------+-----------+----------+
|    300 | IM_DICT     | IM_BUSI_SET | I         |       42 |
|    300 | IM_DICT     | IM_BUSI_SET | U         |       42 |
+--------+-------------+-------------+-----------+----------+
delete from U_COMMON.IM_BUSI_SET;
# 预期结果如下:
# 300, IM_DICT, IM_BUSI_SET, D, 42
# 300, IM_DICT, IM_BUSI_SET, I, 42
# 300, IM_DICT, IM_BUSI_SET, U, 42
select region, table_owner, table_name, operation, hash_val from replx_log order by operation;
+--------+-------------+-------------+-----------+----------+
| REGION | TABLE_OWNER | TABLE_NAME  | OPERATION | HASH_VAL |
+--------+-------------+-------------+-----------+----------+
|    300 | IM_DICT     | IM_BUSI_SET | D         |       42 |
|    300 | IM_DICT     | IM_BUSI_SET | I         |       42 |
|    300 | IM_DICT     | IM_BUSI_SET | U         |       42 |
+--------+-------------+-------------+-----------+----------+
ALTER TRIGGER "TRIG_REPLX30_1662225" DISABLE;
######### TRIG_REPLX30_1661514 调用部分  #########
delete from replx_log;
delete from replicate_switch;
delete from U_COMMON.IM_IF_BB_TASK;
ALTER TRIGGER "TRIG_REPLX30_1661514" ENABLE;
insert into U_COMMON.IM_IF_BB_TASK(TASK_NO) values(110);
# 预期结果: 300, IM, IM_IF_BB_TASK, I, 35
select region, table_owner, table_name, operation, hash_val from replx_log;
+--------+-------------+---------------+-----------+----------+
| REGION | TABLE_OWNER | TABLE_NAME    | OPERATION | HASH_VAL |
+--------+-------------+---------------+-----------+----------+
|    300 | IM          | IM_IF_BB_TASK | I         |       35 |
+--------+-------------+---------------+-----------+----------+
# 预期结果: TASK_NO=110, 1, 0
select pkey, instance_id, scn from replx_log;
+-------------+-------------+------+
| PKEY        | INSTANCE_ID | SCN  |
+-------------+-------------+------+
| TASK_NO=110 |           2 |    0 |
+-------------+-------------+------+
update U_COMMON.IM_IF_BB_TASK set TASK_NO = 9;
# 预期结果如下:
# 300, IM, IM_IF_BB_TASK, I, 35
# 300, IM, IM_IF_BB_TASK, U, 35
select region, table_owner, table_name, operation, hash_val from replx_log order by operation;
+--------+-------------+---------------+-----------+----------+
| REGION | TABLE_OWNER | TABLE_NAME    | OPERATION | HASH_VAL |
+--------+-------------+---------------+-----------+----------+
|    300 | IM          | IM_IF_BB_TASK | I         |       35 |
|    300 | IM          | IM_IF_BB_TASK | U         |       35 |
+--------+-------------+---------------+-----------+----------+
delete from U_COMMON.IM_IF_BB_TASK;
# 预期结果如下:
# 300, IM, IM_IF_BB_TASK, D, 35
# 300, IM, IM_IF_BB_TASK, I, 35
# 300, IM, IM_IF_BB_TASK, U, 35
select region, table_owner, table_name, operation, hash_val from replx_log order by operation;
+--------+-------------+---------------+-----------+----------+
| REGION | TABLE_OWNER | TABLE_NAME    | OPERATION | HASH_VAL |
+--------+-------------+---------------+-----------+----------+
|    300 | IM          | IM_IF_BB_TASK | D         |       35 |
|    300 | IM          | IM_IF_BB_TASK | I         |       35 |
|    300 | IM          | IM_IF_BB_TASK | U         |       35 |
+--------+-------------+---------------+-----------+----------+
ALTER TRIGGER "TRIG_REPLX30_1661514" DISABLE;
######### TRIG_REPLX30_1661469 调用部分  #########
delete from replx_log;
delete from replicate_switch;
delete from U_COMMON.IM_IF_BB_RESOURCE;
ALTER TRIGGER "TRIG_REPLX30_1661469" ENABLE;
insert into U_COMMON.IM_IF_BB_RESOURCE(PARAM_TYPE_ID,PARAM_ID) values(1,2);
# 预期结果: 300, IM, IM_IF_BB_RESOURCE, I, 16
select region, table_owner, table_name, operation, hash_val from replx_log;
+--------+-------------+-------------------+-----------+----------+
| REGION | TABLE_OWNER | TABLE_NAME        | OPERATION | HASH_VAL |
+--------+-------------+-------------------+-----------+----------+
|    300 | IM          | IM_IF_BB_RESOURCE | I         |       16 |
+--------+-------------+-------------------+-----------+----------+
# 预期结果: PARAM_TYPE_ID=1,PARAM_ID=2, 1, 0
select pkey, instance_id, scn from replx_log;
+-----------------------------+-------------+------+
| PKEY                        | INSTANCE_ID | SCN  |
+-----------------------------+-------------+------+
| PARAM_TYPE_ID=1,PARAM_ID=2 |           2 |    0 |
+-----------------------------+-------------+------+
update U_COMMON.IM_IF_BB_RESOURCE set PARAM_TYPE_ID = 9;
# 预期结果如下:
# 300, IM, IM_IF_BB_RESOURCE, I, 16
# 300, IM, IM_IF_BB_RESOURCE, U, 16
select region, table_owner, table_name, operation, hash_val from replx_log order by operation;
+--------+-------------+-------------------+-----------+----------+
| REGION | TABLE_OWNER | TABLE_NAME        | OPERATION | HASH_VAL |
+--------+-------------+-------------------+-----------+----------+
|    300 | IM          | IM_IF_BB_RESOURCE | I         |       16 |
|    300 | IM          | IM_IF_BB_RESOURCE | U         |       16 |
+--------+-------------+-------------------+-----------+----------+
delete from U_COMMON.IM_IF_BB_RESOURCE;
# 预期结果如下:
# 300, IM, IM_IF_BB_RESOURCE, D, 16
# 300, IM, IM_IF_BB_RESOURCE, I, 16
# 300, IM, IM_IF_BB_RESOURCE, U, 16
select region, table_owner, table_name, operation, hash_val from replx_log order by operation;
+--------+-------------+-------------------+-----------+----------+
| REGION | TABLE_OWNER | TABLE_NAME        | OPERATION | HASH_VAL |
+--------+-------------+-------------------+-----------+----------+
|    300 | IM          | IM_IF_BB_RESOURCE | D         |       16 |
|    300 | IM          | IM_IF_BB_RESOURCE | I         |       16 |
|    300 | IM          | IM_IF_BB_RESOURCE | U         |       16 |
+--------+-------------+-------------------+-----------+----------+
ALTER TRIGGER "TRIG_REPLX30_1661469" DISABLE;
######### TRIG_REPLX30_1661467 调用部分  #########
delete from replx_log;
delete from replicate_switch;
delete from U_COMMON.IM_IF_BB_REEXACTIVITY;
ALTER TRIGGER "TRIG_REPLX30_1661467" ENABLE;
insert into U_COMMON.IM_IF_BB_REEXACTIVITY(INTF_DATE,REC_SEQ) values('20191001',1);
# 预期结果: 300, IM, IM_IF_BB_REEXACTIVITY, I, 19
select region, table_owner, table_name, operation, hash_val from replx_log;
+--------+-------------+-----------------------+-----------+----------+
| REGION | TABLE_OWNER | TABLE_NAME            | OPERATION | HASH_VAL |
+--------+-------------+-----------------------+-----------+----------+
|    300 | IM          | IM_IF_BB_REEXACTIVITY | I         |       19 |
+--------+-------------+-----------------------+-----------+----------+
# 预期结果: INTF_DATE=20191001,REC_SEQ=1, 1, 0
select pkey, instance_id, scn from replx_log;
+-------------------------------+-------------+------+
| PKEY                          | INSTANCE_ID | SCN  |
+-------------------------------+-------------+------+
| INTF_DATE=20191001,REC_SEQ=1 |           2 |    0 |
+-------------------------------+-------------+------+
update U_COMMON.IM_IF_BB_REEXACTIVITY set REC_SEQ = 9;
# 预期结果如下:
# 300, IM, IM_IF_BB_REEXACTIVITY, I, 19
# 300, IM, IM_IF_BB_REEXACTIVITY, U, 19
select region, table_owner, table_name, operation, hash_val from replx_log order by operation;
+--------+-------------+-----------------------+-----------+----------+
| REGION | TABLE_OWNER | TABLE_NAME            | OPERATION | HASH_VAL |
+--------+-------------+-----------------------+-----------+----------+
|    300 | IM          | IM_IF_BB_REEXACTIVITY | I         |       19 |
|    300 | IM          | IM_IF_BB_REEXACTIVITY | U         |       19 |
+--------+-------------+-----------------------+-----------+----------+
delete from U_COMMON.IM_IF_BB_REEXACTIVITY;
# 预期结果如下:
# 300, IM, IM_IF_BB_REEXACTIVITY, D, 19
# 300, IM, IM_IF_BB_REEXACTIVITY, I, 19
# 300, IM, IM_IF_BB_REEXACTIVITY, U, 19
select region, table_owner, table_name, operation, hash_val from replx_log order by operation;
+--------+-------------+-----------------------+-----------+----------+
| REGION | TABLE_OWNER | TABLE_NAME            | OPERATION | HASH_VAL |
+--------+-------------+-----------------------+-----------+----------+
|    300 | IM          | IM_IF_BB_REEXACTIVITY | D         |       19 |
|    300 | IM          | IM_IF_BB_REEXACTIVITY | I         |       19 |
|    300 | IM          | IM_IF_BB_REEXACTIVITY | U         |       19 |
+--------+-------------+-----------------------+-----------+----------+
ALTER TRIGGER "TRIG_REPLX30_1661467" DISABLE;
######### TRIG_REPLX30_1661441 调用部分  #########
delete from replx_log;
delete from replicate_switch;
delete from U_COMMON.IM_IF_BB_PROPACKAGES;
ALTER TRIGGER "TRIG_REPLX30_1661441" ENABLE;
insert into U_COMMON.IM_IF_BB_PROPACKAGES(INTF_DATE,REC_SEQ) values('20191001',1);
# 预期结果: 300, IM, IM_IF_BB_PROPACKAGES, I, 49
select region, table_owner, table_name, operation, hash_val from replx_log;
+--------+-------------+----------------------+-----------+----------+
| REGION | TABLE_OWNER | TABLE_NAME           | OPERATION | HASH_VAL |
+--------+-------------+----------------------+-----------+----------+
|    300 | IM          | IM_IF_BB_PROPACKAGES | I         |       49 |
+--------+-------------+----------------------+-----------+----------+
# 预期结果: INTF_DATE=20191001,REC_SEQ=1, 1, 0
select pkey, instance_id, scn from replx_log;
+-------------------------------+-------------+------+
| PKEY                          | INSTANCE_ID | SCN  |
+-------------------------------+-------------+------+
| INTF_DATE=20191001,REC_SEQ=1 |           2 |    0 |
+-------------------------------+-------------+------+
update U_COMMON.IM_IF_BB_PROPACKAGES set REC_SEQ = 9;
# 预期结果如下:
# 300, IM, IM_IF_BB_PROPACKAGES, I, 49
# 300, IM, IM_IF_BB_PROPACKAGES, U, 49
select region, table_owner, table_name, operation, hash_val from replx_log order by operation;
+--------+-------------+----------------------+-----------+----------+
| REGION | TABLE_OWNER | TABLE_NAME           | OPERATION | HASH_VAL |
+--------+-------------+----------------------+-----------+----------+
|    300 | IM          | IM_IF_BB_PROPACKAGES | I         |       49 |
|    300 | IM          | IM_IF_BB_PROPACKAGES | U         |       49 |
+--------+-------------+----------------------+-----------+----------+
delete from U_COMMON.IM_IF_BB_PROPACKAGES;
# 预期结果如下:
# 300, IM, IM_IF_BB_PROPACKAGES, D, 49
# 300, IM, IM_IF_BB_PROPACKAGES, I, 49
# 300, IM, IM_IF_BB_PROPACKAGES, U, 49
select region, table_owner, table_name, operation, hash_val from replx_log order by operation;
+--------+-------------+----------------------+-----------+----------+
| REGION | TABLE_OWNER | TABLE_NAME           | OPERATION | HASH_VAL |
+--------+-------------+----------------------+-----------+----------+
|    300 | IM          | IM_IF_BB_PROPACKAGES | D         |       49 |
|    300 | IM          | IM_IF_BB_PROPACKAGES | I         |       49 |
|    300 | IM          | IM_IF_BB_PROPACKAGES | U         |       49 |
+--------+-------------+----------------------+-----------+----------+
ALTER TRIGGER "TRIG_REPLX30_1661441" DISABLE;
######### TRIG_REPLX30_1661438 调用部分  #########
delete from replx_log;
delete from replicate_switch;
delete from U_COMMON.IM_IF_BB_PRODUCTINFO;
ALTER TRIGGER "TRIG_REPLX30_1661438" ENABLE;
insert into U_COMMON.IM_IF_BB_PRODUCTINFO(INTF_DATE,REC_SEQ,PRD_MODE) values('20191001',1,2);
# 预期结果: 300, IM, IM_IF_BB_PRODUCTINFO, I, 60
select region, table_owner, table_name, operation, hash_val from replx_log;
+--------+-------------+----------------------+-----------+----------+
| REGION | TABLE_OWNER | TABLE_NAME           | OPERATION | HASH_VAL |
+--------+-------------+----------------------+-----------+----------+
|    300 | IM          | IM_IF_BB_PRODUCTINFO | I         |       60 |
+--------+-------------+----------------------+-----------+----------+
# 预期结果: INTF_DATE=20191001,REC_SEQ=1,PRD_MODE=2, 1, 0
select pkey, instance_id, scn from replx_log;
+-------------------------------------------+-------------+------+
| PKEY                                      | INSTANCE_ID | SCN  |
+-------------------------------------------+-------------+------+
| INTF_DATE=20191001,REC_SEQ=1,PRD_MODE=2 |           2 |    0 |
+-------------------------------------------+-------------+------+
update U_COMMON.IM_IF_BB_PRODUCTINFO set REC_SEQ = 9;
# 预期结果如下:
# 300, IM, IM_IF_BB_PRODUCTINFO, I, 60
# 300, IM, IM_IF_BB_PRODUCTINFO, U, 60
select region, table_owner, table_name, operation, hash_val from replx_log order by operation;
+--------+-------------+----------------------+-----------+----------+
| REGION | TABLE_OWNER | TABLE_NAME           | OPERATION | HASH_VAL |
+--------+-------------+----------------------+-----------+----------+
|    300 | IM          | IM_IF_BB_PRODUCTINFO | I         |       60 |
|    300 | IM          | IM_IF_BB_PRODUCTINFO | U         |       60 |
+--------+-------------+----------------------+-----------+----------+
delete from U_COMMON.IM_IF_BB_PRODUCTINFO;
# 预期结果如下:
# 300, IM, IM_IF_BB_PRODUCTINFO, D, 60
# 300, IM, IM_IF_BB_PRODUCTINFO, I, 60
# 300, IM, IM_IF_BB_PRODUCTINFO, U, 60
select region, table_owner, table_name, operation, hash_val from replx_log order by operation;
+--------+-------------+----------------------+-----------+----------+
| REGION | TABLE_OWNER | TABLE_NAME           | OPERATION | HASH_VAL |
+--------+-------------+----------------------+-----------+----------+
|    300 | IM          | IM_IF_BB_PRODUCTINFO | D         |       60 |
|    300 | IM          | IM_IF_BB_PRODUCTINFO | I         |       60 |
|    300 | IM          | IM_IF_BB_PRODUCTINFO | U         |       60 |
+--------+-------------+----------------------+-----------+----------+
ALTER TRIGGER "TRIG_REPLX30_1661438" DISABLE;
######### TRIG_REPLX30_1661353 调用部分  #########
delete from replx_log;
delete from replicate_switch;
delete from U_COMMON.IM_IF_BB_CUSTACTIVATE;
ALTER TRIGGER "TRIG_REPLX30_1661353" ENABLE;
insert into U_COMMON.IM_IF_BB_CUSTACTIVATE(INTF_DATE,REC_SEQ) values('20191001',1);
# 预期结果: 300, IM, IM_IF_BB_CUSTACTIVATE, I, 21
select region, table_owner, table_name, operation, hash_val from replx_log;
+--------+-------------+-----------------------+-----------+----------+
| REGION | TABLE_OWNER | TABLE_NAME            | OPERATION | HASH_VAL |
+--------+-------------+-----------------------+-----------+----------+
|    300 | IM          | IM_IF_BB_CUSTACTIVATE | I         |       21 |
+--------+-------------+-----------------------+-----------+----------+
# 预期结果: INTF_DATE=20191001,REC_SEQ=1, 1, 0
select pkey, instance_id, scn from replx_log;
+-------------------------------+-------------+------+
| PKEY                          | INSTANCE_ID | SCN  |
+-------------------------------+-------------+------+
| INTF_DATE=20191001,REC_SEQ=1 |           2 |    0 |
+-------------------------------+-------------+------+
update U_COMMON.IM_IF_BB_CUSTACTIVATE set REC_SEQ = 9;
# 预期结果如下:
# 300, IM, IM_IF_BB_CUSTACTIVATE, I, 21
# 300, IM, IM_IF_BB_CUSTACTIVATE, U, 21
select region, table_owner, table_name, operation, hash_val from replx_log order by operation;
+--------+-------------+-----------------------+-----------+----------+
| REGION | TABLE_OWNER | TABLE_NAME            | OPERATION | HASH_VAL |
+--------+-------------+-----------------------+-----------+----------+
|    300 | IM          | IM_IF_BB_CUSTACTIVATE | I         |       21 |
|    300 | IM          | IM_IF_BB_CUSTACTIVATE | U         |       21 |
+--------+-------------+-----------------------+-----------+----------+
delete from U_COMMON.IM_IF_BB_CUSTACTIVATE;
# 预期结果如下:
# 300, IM, IM_IF_BB_CUSTACTIVATE, D, 21
# 300, IM, IM_IF_BB_CUSTACTIVATE, I, 21
# 300, IM, IM_IF_BB_CUSTACTIVATE, U, 21
select region, table_owner, table_name, operation, hash_val from replx_log order by operation;
+--------+-------------+-----------------------+-----------+----------+
| REGION | TABLE_OWNER | TABLE_NAME            | OPERATION | HASH_VAL |
+--------+-------------+-----------------------+-----------+----------+
|    300 | IM          | IM_IF_BB_CUSTACTIVATE | D         |       21 |
|    300 | IM          | IM_IF_BB_CUSTACTIVATE | I         |       21 |
|    300 | IM          | IM_IF_BB_CUSTACTIVATE | U         |       21 |
+--------+-------------+-----------------------+-----------+----------+
ALTER TRIGGER "TRIG_REPLX30_1661353" DISABLE;
######### TRIG_REPLX30_1661310 调用部分  #########
delete from replx_log;
delete from replicate_switch;
delete from U_COMMON.IM_IF_BB_ACTIVITYCHECK;
ALTER TRIGGER "TRIG_REPLX30_1661310" ENABLE;
insert into U_COMMON.IM_IF_BB_ACTIVITYCHECK(INTF_DATE,REC_SEQ) values('20191001',1);
# 预期结果: 300, IM, IM_IF_BB_ACTIVITYCHECK, I, 60
select region, table_owner, table_name, operation, hash_val from replx_log;
+--------+-------------+------------------------+-----------+----------+
| REGION | TABLE_OWNER | TABLE_NAME             | OPERATION | HASH_VAL |
+--------+-------------+------------------------+-----------+----------+
|    300 | IM          | IM_IF_BB_ACTIVITYCHECK | I         |       60 |
+--------+-------------+------------------------+-----------+----------+
# 预期结果: INTF_DATE=20191001,REC_SEQ=1, 1, 0
select pkey, instance_id, scn from replx_log;
+-------------------------------+-------------+------+
| PKEY                          | INSTANCE_ID | SCN  |
+-------------------------------+-------------+------+
| INTF_DATE=20191001,REC_SEQ=1 |           2 |    0 |
+-------------------------------+-------------+------+
update U_COMMON.IM_IF_BB_ACTIVITYCHECK set REC_SEQ = 9;
# 预期结果如下:
# 300, IM, IM_IF_BB_ACTIVITYCHECK, I, 60
# 300, IM, IM_IF_BB_ACTIVITYCHECK, U, 60
select region, table_owner, table_name, operation, hash_val from replx_log order by operation;
+--------+-------------+------------------------+-----------+----------+
| REGION | TABLE_OWNER | TABLE_NAME             | OPERATION | HASH_VAL |
+--------+-------------+------------------------+-----------+----------+
|    300 | IM          | IM_IF_BB_ACTIVITYCHECK | I         |       60 |
|    300 | IM          | IM_IF_BB_ACTIVITYCHECK | U         |       60 |
+--------+-------------+------------------------+-----------+----------+
delete from U_COMMON.IM_IF_BB_ACTIVITYCHECK;
# 预期结果如下:
# 300, IM, IM_IF_BB_ACTIVITYCHECK, D, 60
# 300, IM, IM_IF_BB_ACTIVITYCHECK, I, 60
# 300, IM, IM_IF_BB_ACTIVITYCHECK, U, 60
select region, table_owner, table_name, operation, hash_val from replx_log order by operation;
+--------+-------------+------------------------+-----------+----------+
| REGION | TABLE_OWNER | TABLE_NAME             | OPERATION | HASH_VAL |
+--------+-------------+------------------------+-----------+----------+
|    300 | IM          | IM_IF_BB_ACTIVITYCHECK | D         |       60 |
|    300 | IM          | IM_IF_BB_ACTIVITYCHECK | I         |       60 |
|    300 | IM          | IM_IF_BB_ACTIVITYCHECK | U         |       60 |
+--------+-------------+------------------------+-----------+----------+
ALTER TRIGGER "TRIG_REPLX30_1661310" DISABLE;
######### TRIG_REPLX30_1660303 调用部分  #########
delete from replx_log;
delete from replicate_switch;
delete from U_COMMON.SA_DB_RESTYPE_SALEPRICE;
ALTER TRIGGER "TRIG_REPLX30_1660303" ENABLE;
insert into U_COMMON.SA_DB_RESTYPE_SALEPRICE(RES_TYPE_ID,ORGID,CHARGEITEMID,STARTTIME,PRICETYPE) values(1,2,3,to_date('20190730'),5);
# 预期结果: 300, U_COMMON, SA_DB_RESTYPE_SALEPRICE, I, 45
select region, table_owner, table_name, operation, hash_val from replx_log;
+--------+-------------+-------------------------+-----------+----------+
| REGION | TABLE_OWNER | TABLE_NAME              | OPERATION | HASH_VAL |
+--------+-------------+-------------------------+-----------+----------+
|    300 | U_COMMON    | SA_DB_RESTYPE_SALEPRICE | I         |       45 |
+--------+-------------+-------------------------+-----------+----------+
# 预期结果: RES_TYPE_ID=1,ORGID=2,CHARGEITEMID=3,STARTTIME=20190730000000,PRICETYPE=5, 1, 0
select pkey, instance_id, scn from replx_log;
+-------------------------------------------------------------------------------+-------------+------+
| PKEY                                                                          | INSTANCE_ID | SCN  |
+-------------------------------------------------------------------------------+-------------+------+
| RES_TYPE_ID=1,ORGID=2,CHARGEITEMID=3,STARTTIME=20190730000000,PRICETYPE=5 |           2 |    0 |
+-------------------------------------------------------------------------------+-------------+------+
update U_COMMON.SA_DB_RESTYPE_SALEPRICE set ORGID = 9;
# 预期结果如下:
# 300, U_COMMON, SA_DB_RESTYPE_SALEPRICE, I, 45
# 300, U_COMMON, SA_DB_RESTYPE_SALEPRICE, U, 45
select region, table_owner, table_name, operation, hash_val from replx_log order by operation;
+--------+-------------+-------------------------+-----------+----------+
| REGION | TABLE_OWNER | TABLE_NAME              | OPERATION | HASH_VAL |
+--------+-------------+-------------------------+-----------+----------+
|    300 | U_COMMON    | SA_DB_RESTYPE_SALEPRICE | I         |       45 |
|    300 | U_COMMON    | SA_DB_RESTYPE_SALEPRICE | U         |       45 |
+--------+-------------+-------------------------+-----------+----------+
delete from U_COMMON.SA_DB_RESTYPE_SALEPRICE where ORGID = 9;
# 预期结果如下:
# 300, U_COMMON, SA_DB_RESTYPE_SALEPRICE, D, 45
# 300, U_COMMON, SA_DB_RESTYPE_SALEPRICE, I, 45
# 300, U_COMMON, SA_DB_RESTYPE_SALEPRICE, U, 45
select region, table_owner, table_name, operation, hash_val from replx_log order by operation;
+--------+-------------+-------------------------+-----------+----------+
| REGION | TABLE_OWNER | TABLE_NAME              | OPERATION | HASH_VAL |
+--------+-------------+-------------------------+-----------+----------+
|    300 | U_COMMON    | SA_DB_RESTYPE_SALEPRICE | D         |       45 |
|    300 | U_COMMON    | SA_DB_RESTYPE_SALEPRICE | I         |       45 |
|    300 | U_COMMON    | SA_DB_RESTYPE_SALEPRICE | U         |       45 |
+--------+-------------+-------------------------+-----------+----------+
ALTER TRIGGER "TRIG_REPLX30_1660303" DISABLE;
# 清理测试用户
result_format: 4
drop user u_replx cascade;
drop user u_common cascade;
