drop database  IF EXISTS  ob100x;
create database ob100x  character set utf16;
use ob100x;
select database();
database()
ob100x
没有参数          minus-1-1      
select  100  minus  select  300;
100
100
select  300   from   dual  UNION  select  300    from   dual;
300
300
select  300  from   dual     UNION  all   select   300   from   dual;
300
300
300
select  300  INTERSECT  select  300;
300
300
参数为空           minus-1-2      
select  ''     minus  select   ''    from dual;

select  ''     UNION  select   ''    from dual;


select  ''      UNION ALL   select   ''    from dual;



select  ''      INTERSECT   select   ''    from dual;


参数为空格       minus-1-3        
select  '     '      minus  select   '     '    from dual;

select  '     '      UNION  select   '     '    from dual;

     
select  '     '       UNION ALL   select   '     '    from dual;

     
     
select  '     '       INTERSECT   select   '     '    from dual;

     
参数为null       minus-1-4        
select  null      minus  select   null    from dual;
NULL
select  null      UNION  select   null    from dual;
NULL
NULL
select  null       UNION ALL   select   null    from dual;
NULL
NULL
NULL
select  null       INTERSECT   select   null    from dual;
NULL
NULL
参数为普通字符    minus-1-5     
select  'helloworld'     minus  select    'hello';
helloworld
helloworld
select   *    from    (select  'helloworld'     eee    UNION  select    'hello')   order   by   eee;
eee
hello
helloworld
select   *    from    (select  'hello'   eee   UNION   ALL   select    'hello')  order   by   eee;
eee
hello
hello
select   *    from    (select  'hello'   eee     UNION    ALL    select    'helloworld')  order   by   eee;
eee
hello
helloworld
select  'hello'             FROM    dual   union   select    'hello';
hello
hello
select  'hello'             FROM    dual   INTERSECT   select    'hello';
hello
hello
select  'helloworld'    FROM     dual    INTERSECT   select    'hello';
helloworld
select  'hello'            FROM     dual    INTERSECT   select    'helloworld';
hello
参数为普通数字      minus-1-6     
select       1     minus  select   1    from dual;
1
select       1     UNION  select   1    from dual;
1
1
select       1     UNION   ALL    select   1    from dual;
1
1
1
select       1     INTERSECT   select   1    from dual;
1
1
参数为普通日期      minus-1-7     
SELECT   str_to_date('2006-05-07 13:23:44','yyyy-mm-dd hh24:mi:ss')    FROM   dual      MINUS       SELECT   str_to_date('2004-05-07 13:23:44','yyyy-mm-dd hh24:mi:ss')    FROM   dual;
str_to_date('2006-05-07 13:23:44','yyyy-mm-dd hh24:mi:ss')
SELECT   str_to_date('2004-05-07 13:23:44','yyyy-mm-dd hh24:mi:ss')    FROM   dual      UNION       SELECT   str_to_date('2004-05-07 13:23:44','yyyy-mm-dd hh24:mi:ss')    FROM   dual;
str_to_date('2004-05-07 13:23:44','yyyy-mm-dd hh24:mi:ss')
NULL
SELECT   str_to_date('2004-05-07 13:23:44','yyyy-mm-dd hh24:mi:ss')    FROM   dual      UNION   all     SELECT   str_to_date('2004-05-07 13:23:44','yyyy-mm-dd hh24:mi:ss')    FROM   dual;
str_to_date('2004-05-07 13:23:44','yyyy-mm-dd hh24:mi:ss')
NULL
NULL
SELECT   str_to_date('2004-05-07 13:23:44','yyyy-mm-dd hh24:mi:ss')    FROM   dual      INTERSECT     SELECT   str_to_date('2004-05-07 13:23:44','yyyy-mm-dd hh24:mi:ss')    FROM   dual;
str_to_date('2004-05-07 13:23:44','yyyy-mm-dd hh24:mi:ss')
NULL
多个参数           minus-1-8     
select   *  from    (select       100    aaa,'hello'  bbb           minus  select    100,'hello'      from dual)    order   by   aaa,bbb;
aaa	bbb
select   *  from    (select       1000  aaa,'hello'   bbb       minus  select   100,'hello'      from dual)        order   by   aaa,bbb;
aaa	bbb
1000	hello
select   *  from    (select       100  aaa,'hello1'   bbb       minus  select   100,'hello'      from dual)        order   by   aaa,bbb;
aaa	bbb
100	hello1
select   *  from    (select       100    aaa,'hello'  bbb           UNION  select    100,'hello'      from dual)    order   by   aaa,bbb;
aaa	bbb
100	hello
select   *  from    (select       1000  aaa,'hello'   bbb       UNION  select   100,'hello'      from dual)        order   by   aaa,bbb;
aaa	bbb
100	hello
1000	hello
select   *  from    (select       100  aaa,'hello1'   bbb       UNION  select   100,'hello'      from dual)        order   by   aaa,bbb;
aaa	bbb
100	hello
100	hello1
select   *  from    (select       100    aaa,'hello'  bbb           union  all  select    100,'hello'      from dual)    order   by   aaa,bbb;
aaa	bbb
100	hello
100	hello
select   *  from    (select       1000  aaa,'hello'   bbb        union  all  select   100,'hello'      from dual)        order   by   aaa,bbb;
aaa	bbb
100	hello
1000	hello
select   *  from    (select       100  aaa,'hello1'   bbb        union  all  select   100,'hello'      from dual)        order   by   aaa,bbb;
aaa	bbb
100	hello
100	hello1
select   *  from    (select       100    aaa,'hello'  bbb        INTERSECT  select    100,'hello'      from dual)    order   by   aaa,bbb;
aaa	bbb
100	hello
select   *  from    (select       1000  aaa,'hello'   bbb       INTERSECT  select   100,'hello'      from dual)        order   by   aaa,bbb;
aaa	bbb
select   *  from    (select       100  aaa,'hello1'   bbb       INTERSECT  select   100,'hello'      from dual)        order   by   aaa,bbb;
aaa	bbb
SELECT /*+no_rewrite*/
'100','hello','100','hello', '100','hello',  '100','hello',  '100','hello',  '100','hello',  '100','hello',  '100','hello',  '100','hello',  '100','hello',  '100','hello',  '100','hello',  '100','hello',  '100','hello',  '100','hello',
'100','hello','100','hello', '100','hello',  '100','hello',  '100','hello',  '100','hello',  '100','hello',  '100','hello',  '100','hello',  '100','hello',  '100','hello',  '100','hello',  '100','hello',  '100','hello',  '100','hello',
'100','hello','100','hello', '100','hello',  '100','hello',  '100','hello',  '100','hello',  '100','hello',  '100','hello',  '100','hello',  '100','hello',  '100','hello',  '100','hello',  '100','hello',  '100','hello',  '100','hello',
'100','hello','100','hello', '100','hello',  '100','hello',  '100','hello',  '100','hello',  '100','hello',  '100','hello',  '100','hello',  '100','hello',  '100','hello',  '100','hello',  '100','hello',  '100','hello',  '100','hello',
'100','hello','100','hello', '100','hello',  '100','hello',  '100','hello',  '100','hello',  '100','hello',  '100','hello',  '100','hello',  '100','hello',  '100','hello',  '100','hello',  '100','hello',  '100','hello',  '100','hello',
'100','hello','100','hello', '100','hello',  '100','hello',  '100','hello',  '100','hello',  '100','hello',  '100','hello',  '100','hello',  '100','hello',  '100','hello',  '100','hello',  '100','hello',  '100','hello',  '100','hello',
'100','hello','100','hello', '100','hello',  '100','hello',  '100','hello',  '100','hello',  '100','hello',  '100','hello',  '100','hello',  '100','hello',  '100','hello',  '100','hello',  '100','hello',  '100','hello',  '100','hello',
'100','hello','100','hello', '100','hello',  '100','hello',  '100','hello',  '100','hello',  '100','hello',  '100','hello',  '100','hello',  '100','hello',  '100','hello',  '100','hello',  '100','hello',  '100','hello',  '100','hello'
FROM    dual    minus 
select /*+no_rewrite*/
'100','hello','100','hello', '100','hello',  '100','hello',  '100','hello',  '100','hello',  '100','hello',  '100','hello',  '100','hello',  '100','hello',  '100','hello',  '100','hello',  '100','hello',  '100','hello',  '100','hello',
'100','hello','100','hello', '100','hello',  '100','hello',  '100','hello',  '100','hello',  '100','hello',  '100','hello',  '100','hello',  '100','hello',  '100','hello',  '100','hello',  '100','hello',  '100','hello',  '100','hello',
'100','hello','100','hello', '100','hello',  '100','hello',  '100','hello',  '100','hello',  '100','hello',  '100','hello',  '100','hello',  '100','hello',  '100','hello',  '100','hello',  '100','hello',  '100','hello',  '100','hello',
'100','hello','100','hello', '100','hello',  '100','hello',  '100','hello',  '100','hello',  '100','hello',  '100','hello',  '100','hello',  '100','hello',  '100','hello',  '100','hello',  '100','hello',  '100','hello',  '100','hello',
'100','hello','100','hello', '100','hello',  '100','hello',  '100','hello',  '100','hello',  '100','hello',  '100','hello',  '100','hello',  '100','hello',  '100','hello',  '100','hello',  '100','hello',  '100','hello',  '100','hello',
'100','hello','100','hello', '100','hello',  '100','hello',  '100','hello',  '100','hello',  '100','hello',  '100','hello',  '100','hello',  '100','hello',  '100','hello',  '100','hello',  '100','hello',  '100','hello',  '100','hello',
'100','hello','100','hello', '100','hello',  '100','hello',  '100','hello',  '100','hello',  '100','hello',  '100','hello',  '100','hello',  '100','hello',  '100','hello',  '100','hello',  '100','hello',  '100','hello',  '100','hello',
'100','hello','100','hello', '100','hello',  '100','hello',  '100','hello',  '100','hello',  '100','hello',  '100','hello',  '100','hello',  '100','hello',  '100','hello',  '100','hello',  '100','hello',  '100','hello',  '100','hello'
from dual;
100	hello	100	hello	100	hello	100	hello	100	hello	100	hello	100	hello	100	hello	100	hello	100	hello	100	hello	100	hello	100	hello	100	hello	100	hello	100	hello	100	hello	100	hello	100	hello	100	hello	100	hello	100	hello	100	hello	100	hello	100	hello	100	hello	100	hello	100	hello	100	hello	100	hello	100	hello	100	hello	100	hello	100	hello	100	hello	100	hello	100	hello	100	hello	100	hello	100	hello	100	hello	100	hello	100	hello	100	hello	100	hello	100	hello	100	hello	100	hello	100	hello	100	hello	100	hello	100	hello	100	hello	100	hello	100	hello	100	hello	100	hello	100	hello	100	hello	100	hello	100	hello	100	hello	100	hello	100	hello	100	hello	100	hello	100	hello	100	hello	100	hello	100	hello	100	hello	100	hello	100	hello	100	hello	100	hello	100	hello	100	hello	100	hello	100	hello	100	hello	100	hello	100	hello	100	hello	100	hello	100	hello	100	hello	100	hello	100	hello	100	hello	100	hello	100	hello	100	hello	100	hello	100	hello	100	hello	100	hello	100	hello	100	hello	100	hello	100	hello	100	hello	100	hello	100	hello	100	hello	100	hello	100	hello	100	hello	100	hello	100	hello	100	hello	100	hello	100	hello	100	hello	100	hello	100	hello	100	hello	100	hello	100	hello	100	hello	100	hello
SELECT /*+no_rewrite*/
'100','hello','100','hello', '100','hello',  '100','hello',  '100','hello',  '100','hello',  '100','hello',  '100','hello',  '100','hello',  '100','hello',  '100','hello',  '100','hello',  '100','hello',  '100','hello',  '100','hello',
'100','hello','100','hello', '100','hello',  '100','hello',  '100','hello',  '100','hello',  '100','hello',  '100','hello',  '100','hello',  '100','hello',  '100','hello',  '100','hello',  '100','hello',  '100','hello',  '100','hello',
'100','hello','100','hello', '100','hello',  '100','hello',  '100','hello',  '100','hello',  '100','hello',  '100','hello',  '100','hello',  '100','hello',  '100','hello',  '100','hello',  '100','hello',  '100','hello',  '100','hello',
'100','hello','100','hello', '100','hello',  '100','hello',  '100','hello',  '100','hello',  '100','hello',  '100','hello',  '100','hello',  '100','hello',  '100','hello',  '100','hello',  '100','hello',  '100','hello',  '100','hello',
'100','hello','100','hello', '100','hello',  '100','hello',  '100','hello',  '100','hello',  '100','hello',  '100','hello',  '100','hello',  '100','hello',  '100','hello',  '100','hello',  '100','hello',  '100','hello',  '100','hello',
'100','hello','100','hello', '100','hello',  '100','hello',  '100','hello',  '100','hello',  '100','hello',  '100','hello',  '100','hello',  '100','hello',  '100','hello',  '100','hello',  '100','hello',  '100','hello',  '100','hello',
'100','hello','100','hello', '100','hello',  '100','hello',  '100','hello',  '100','hello',  '100','hello',  '100','hello',  '100','hello',  '100','hello',  '100','hello',  '100','hello',  '100','hello',  '100','hello',  '100','hello',
'100','hello','100','hello', '100','hello',  '100','hello',  '100','hello',  '100','hello',  '100','hello',  '100','hello',  '100','hello',  '100','hello',  '100','hello',  '100','hello',  '100','hello',  '100','hello',  '100','hello'
FROM    dual    UNION 
select /*+no_rewrite*/
'100','hello','100','hello', '100','hello',  '100','hello',  '100','hello',  '100','hello',  '100','hello',  '100','hello',  '100','hello',  '100','hello',  '100','hello',  '100','hello',  '100','hello',  '100','hello',  '100','hello',
'100','hello','100','hello', '100','hello',  '100','hello',  '100','hello',  '100','hello',  '100','hello',  '100','hello',  '100','hello',  '100','hello',  '100','hello',  '100','hello',  '100','hello',  '100','hello',  '100','hello',
'100','hello','100','hello', '100','hello',  '100','hello',  '100','hello',  '100','hello',  '100','hello',  '100','hello',  '100','hello',  '100','hello',  '100','hello',  '100','hello',  '100','hello',  '100','hello',  '100','hello',
'100','hello','100','hello', '100','hello',  '100','hello',  '100','hello',  '100','hello',  '100','hello',  '100','hello',  '100','hello',  '100','hello',  '100','hello',  '100','hello',  '100','hello',  '100','hello',  '100','hello',
'100','hello','100','hello', '100','hello',  '100','hello',  '100','hello',  '100','hello',  '100','hello',  '100','hello',  '100','hello',  '100','hello',  '100','hello',  '100','hello',  '100','hello',  '100','hello',  '100','hello',
'100','hello','100','hello', '100','hello',  '100','hello',  '100','hello',  '100','hello',  '100','hello',  '100','hello',  '100','hello',  '100','hello',  '100','hello',  '100','hello',  '100','hello',  '100','hello',  '100','hello',
'100','hello','100','hello', '100','hello',  '100','hello',  '100','hello',  '100','hello',  '100','hello',  '100','hello',  '100','hello',  '100','hello',  '100','hello',  '100','hello',  '100','hello',  '100','hello',  '100','hello',
'100','hello','100','hello', '100','hello',  '100','hello',  '100','hello',  '100','hello',  '100','hello',  '100','hello',  '100','hello',  '100','hello',  '100','hello',  '100','hello',  '100','hello',  '100','hello',  '100','hello'
from dual;
100	hello	100	hello	100	hello	100	hello	100	hello	100	hello	100	hello	100	hello	100	hello	100	hello	100	hello	100	hello	100	hello	100	hello	100	hello	100	hello	100	hello	100	hello	100	hello	100	hello	100	hello	100	hello	100	hello	100	hello	100	hello	100	hello	100	hello	100	hello	100	hello	100	hello	100	hello	100	hello	100	hello	100	hello	100	hello	100	hello	100	hello	100	hello	100	hello	100	hello	100	hello	100	hello	100	hello	100	hello	100	hello	100	hello	100	hello	100	hello	100	hello	100	hello	100	hello	100	hello	100	hello	100	hello	100	hello	100	hello	100	hello	100	hello	100	hello	100	hello	100	hello	100	hello	100	hello	100	hello	100	hello	100	hello	100	hello	100	hello	100	hello	100	hello	100	hello	100	hello	100	hello	100	hello	100	hello	100	hello	100	hello	100	hello	100	hello	100	hello	100	hello	100	hello	100	hello	100	hello	100	hello	100	hello	100	hello	100	hello	100	hello	100	hello	100	hello	100	hello	100	hello	100	hello	100	hello	100	hello	100	hello	100	hello	100	hello	100	hello	100	hello	100	hello	100	hello	100	hello	100	hello	100	hello	100	hello	100	hello	100	hello	100	hello	100	hello	100	hello	100	hello	100	hello	100	hello	100	hello	100	hello	100	hello	100	hello	100	hello
100	hello	100	hello	100	hello	100	hello	100	hello	100	hello	100	hello	100	hello	100	hello	100	hello	100	hello	100	hello	100	hello	100	hello	100	hello	100	hello	100	hello	100	hello	100	hello	100	hello	100	hello	100	hello	100	hello	100	hello	100	hello	100	hello	100	hello	100	hello	100	hello	100	hello	100	hello	100	hello	100	hello	100	hello	100	hello	100	hello	100	hello	100	hello	100	hello	100	hello	100	hello	100	hello	100	hello	100	hello	100	hello	100	hello	100	hello	100	hello	100	hello	100	hello	100	hello	100	hello	100	hello	100	hello	100	hello	100	hello	100	hello	100	hello	100	hello	100	hello	100	hello	100	hello	100	hello	100	hello	100	hello	100	hello	100	hello	100	hello	100	hello	100	hello	100	hello	100	hello	100	hello	100	hello	100	hello	100	hello	100	hello	100	hello	100	hello	100	hello	100	hello	100	hello	100	hello	100	hello	100	hello	100	hello	100	hello	100	hello	100	hello	100	hello	100	hello	100	hello	100	hello	100	hello	100	hello	100	hello	100	hello	100	hello	100	hello	100	hello	100	hello	100	hello	100	hello	100	hello	100	hello	100	hello	100	hello	100	hello	100	hello	100	hello	100	hello	100	hello	100	hello	100	hello	100	hello	100	hello	100	hello	100	hello	100	hello	100	hello
SELECT /*+no_rewrite*/
'100','hello','100','hello', '100','hello',  '100','hello',  '100','hello',  '100','hello',  '100','hello',  '100','hello',  '100','hello',  '100','hello',  '100','hello',  '100','hello',  '100','hello',  '100','hello',  '100','hello',
'100','hello','100','hello', '100','hello',  '100','hello',  '100','hello',  '100','hello',  '100','hello',  '100','hello',  '100','hello',  '100','hello',  '100','hello',  '100','hello',  '100','hello',  '100','hello',  '100','hello',
'100','hello','100','hello', '100','hello',  '100','hello',  '100','hello',  '100','hello',  '100','hello',  '100','hello',  '100','hello',  '100','hello',  '100','hello',  '100','hello',  '100','hello',  '100','hello',  '100','hello',
'100','hello','100','hello', '100','hello',  '100','hello',  '100','hello',  '100','hello',  '100','hello',  '100','hello',  '100','hello',  '100','hello',  '100','hello',  '100','hello',  '100','hello',  '100','hello',  '100','hello',
'100','hello','100','hello', '100','hello',  '100','hello',  '100','hello',  '100','hello',  '100','hello',  '100','hello',  '100','hello',  '100','hello',  '100','hello',  '100','hello',  '100','hello',  '100','hello',  '100','hello',
'100','hello','100','hello', '100','hello',  '100','hello',  '100','hello',  '100','hello',  '100','hello',  '100','hello',  '100','hello',  '100','hello',  '100','hello',  '100','hello',  '100','hello',  '100','hello',  '100','hello',
'100','hello','100','hello', '100','hello',  '100','hello',  '100','hello',  '100','hello',  '100','hello',  '100','hello',  '100','hello',  '100','hello',  '100','hello',  '100','hello',  '100','hello',  '100','hello',  '100','hello',
'100','hello','100','hello', '100','hello',  '100','hello',  '100','hello',  '100','hello',  '100','hello',  '100','hello',  '100','hello',  '100','hello',  '100','hello',  '100','hello',  '100','hello',  '100','hello',  '100','hello'
FROM    dual    UNION  all 
select /*+no_rewrite*/
'100','hello','100','hello', '100','hello',  '100','hello',  '100','hello',  '100','hello',  '100','hello',  '100','hello',  '100','hello',  '100','hello',  '100','hello',  '100','hello',  '100','hello',  '100','hello',  '100','hello',
'100','hello','100','hello', '100','hello',  '100','hello',  '100','hello',  '100','hello',  '100','hello',  '100','hello',  '100','hello',  '100','hello',  '100','hello',  '100','hello',  '100','hello',  '100','hello',  '100','hello',
'100','hello','100','hello', '100','hello',  '100','hello',  '100','hello',  '100','hello',  '100','hello',  '100','hello',  '100','hello',  '100','hello',  '100','hello',  '100','hello',  '100','hello',  '100','hello',  '100','hello',
'100','hello','100','hello', '100','hello',  '100','hello',  '100','hello',  '100','hello',  '100','hello',  '100','hello',  '100','hello',  '100','hello',  '100','hello',  '100','hello',  '100','hello',  '100','hello',  '100','hello',
'100','hello','100','hello', '100','hello',  '100','hello',  '100','hello',  '100','hello',  '100','hello',  '100','hello',  '100','hello',  '100','hello',  '100','hello',  '100','hello',  '100','hello',  '100','hello',  '100','hello',
'100','hello','100','hello', '100','hello',  '100','hello',  '100','hello',  '100','hello',  '100','hello',  '100','hello',  '100','hello',  '100','hello',  '100','hello',  '100','hello',  '100','hello',  '100','hello',  '100','hello',
'100','hello','100','hello', '100','hello',  '100','hello',  '100','hello',  '100','hello',  '100','hello',  '100','hello',  '100','hello',  '100','hello',  '100','hello',  '100','hello',  '100','hello',  '100','hello',  '100','hello',
'100','hello','100','hello', '100','hello',  '100','hello',  '100','hello',  '100','hello',  '100','hello',  '100','hello',  '100','hello',  '100','hello',  '100','hello',  '100','hello',  '100','hello',  '100','hello',  '100','hello'
from dual;
100	hello	100	hello	100	hello	100	hello	100	hello	100	hello	100	hello	100	hello	100	hello	100	hello	100	hello	100	hello	100	hello	100	hello	100	hello	100	hello	100	hello	100	hello	100	hello	100	hello	100	hello	100	hello	100	hello	100	hello	100	hello	100	hello	100	hello	100	hello	100	hello	100	hello	100	hello	100	hello	100	hello	100	hello	100	hello	100	hello	100	hello	100	hello	100	hello	100	hello	100	hello	100	hello	100	hello	100	hello	100	hello	100	hello	100	hello	100	hello	100	hello	100	hello	100	hello	100	hello	100	hello	100	hello	100	hello	100	hello	100	hello	100	hello	100	hello	100	hello	100	hello	100	hello	100	hello	100	hello	100	hello	100	hello	100	hello	100	hello	100	hello	100	hello	100	hello	100	hello	100	hello	100	hello	100	hello	100	hello	100	hello	100	hello	100	hello	100	hello	100	hello	100	hello	100	hello	100	hello	100	hello	100	hello	100	hello	100	hello	100	hello	100	hello	100	hello	100	hello	100	hello	100	hello	100	hello	100	hello	100	hello	100	hello	100	hello	100	hello	100	hello	100	hello	100	hello	100	hello	100	hello	100	hello	100	hello	100	hello	100	hello	100	hello	100	hello	100	hello	100	hello	100	hello	100	hello	100	hello	100	hello	100	hello	100	hello	100	hello
100	hello	100	hello	100	hello	100	hello	100	hello	100	hello	100	hello	100	hello	100	hello	100	hello	100	hello	100	hello	100	hello	100	hello	100	hello	100	hello	100	hello	100	hello	100	hello	100	hello	100	hello	100	hello	100	hello	100	hello	100	hello	100	hello	100	hello	100	hello	100	hello	100	hello	100	hello	100	hello	100	hello	100	hello	100	hello	100	hello	100	hello	100	hello	100	hello	100	hello	100	hello	100	hello	100	hello	100	hello	100	hello	100	hello	100	hello	100	hello	100	hello	100	hello	100	hello	100	hello	100	hello	100	hello	100	hello	100	hello	100	hello	100	hello	100	hello	100	hello	100	hello	100	hello	100	hello	100	hello	100	hello	100	hello	100	hello	100	hello	100	hello	100	hello	100	hello	100	hello	100	hello	100	hello	100	hello	100	hello	100	hello	100	hello	100	hello	100	hello	100	hello	100	hello	100	hello	100	hello	100	hello	100	hello	100	hello	100	hello	100	hello	100	hello	100	hello	100	hello	100	hello	100	hello	100	hello	100	hello	100	hello	100	hello	100	hello	100	hello	100	hello	100	hello	100	hello	100	hello	100	hello	100	hello	100	hello	100	hello	100	hello	100	hello	100	hello	100	hello	100	hello	100	hello	100	hello	100	hello	100	hello	100	hello	100	hello	100	hello
100	hello	100	hello	100	hello	100	hello	100	hello	100	hello	100	hello	100	hello	100	hello	100	hello	100	hello	100	hello	100	hello	100	hello	100	hello	100	hello	100	hello	100	hello	100	hello	100	hello	100	hello	100	hello	100	hello	100	hello	100	hello	100	hello	100	hello	100	hello	100	hello	100	hello	100	hello	100	hello	100	hello	100	hello	100	hello	100	hello	100	hello	100	hello	100	hello	100	hello	100	hello	100	hello	100	hello	100	hello	100	hello	100	hello	100	hello	100	hello	100	hello	100	hello	100	hello	100	hello	100	hello	100	hello	100	hello	100	hello	100	hello	100	hello	100	hello	100	hello	100	hello	100	hello	100	hello	100	hello	100	hello	100	hello	100	hello	100	hello	100	hello	100	hello	100	hello	100	hello	100	hello	100	hello	100	hello	100	hello	100	hello	100	hello	100	hello	100	hello	100	hello	100	hello	100	hello	100	hello	100	hello	100	hello	100	hello	100	hello	100	hello	100	hello	100	hello	100	hello	100	hello	100	hello	100	hello	100	hello	100	hello	100	hello	100	hello	100	hello	100	hello	100	hello	100	hello	100	hello	100	hello	100	hello	100	hello	100	hello	100	hello	100	hello	100	hello	100	hello	100	hello	100	hello	100	hello	100	hello	100	hello	100	hello	100	hello	100	hello
SELECT /*+no_rewrite*/
'100','hello','100','hello', '100','hello',  '100','hello',  '100','hello',  '100','hello',  '100','hello',  '100','hello',  '100','hello',  '100','hello',  '100','hello',  '100','hello',  '100','hello',  '100','hello',  '100','hello',
'100','hello','100','hello', '100','hello',  '100','hello',  '100','hello',  '100','hello',  '100','hello',  '100','hello',  '100','hello',  '100','hello',  '100','hello',  '100','hello',  '100','hello',  '100','hello',  '100','hello',
'100','hello','100','hello', '100','hello',  '100','hello',  '100','hello',  '100','hello',  '100','hello',  '100','hello',  '100','hello',  '100','hello',  '100','hello',  '100','hello',  '100','hello',  '100','hello',  '100','hello',
'100','hello','100','hello', '100','hello',  '100','hello',  '100','hello',  '100','hello',  '100','hello',  '100','hello',  '100','hello',  '100','hello',  '100','hello',  '100','hello',  '100','hello',  '100','hello',  '100','hello',
'100','hello','100','hello', '100','hello',  '100','hello',  '100','hello',  '100','hello',  '100','hello',  '100','hello',  '100','hello',  '100','hello',  '100','hello',  '100','hello',  '100','hello',  '100','hello',  '100','hello',
'100','hello','100','hello', '100','hello',  '100','hello',  '100','hello',  '100','hello',  '100','hello',  '100','hello',  '100','hello',  '100','hello',  '100','hello',  '100','hello',  '100','hello',  '100','hello',  '100','hello',
'100','hello','100','hello', '100','hello',  '100','hello',  '100','hello',  '100','hello',  '100','hello',  '100','hello',  '100','hello',  '100','hello',  '100','hello',  '100','hello',  '100','hello',  '100','hello',  '100','hello',
'100','hello','100','hello', '100','hello',  '100','hello',  '100','hello',  '100','hello',  '100','hello',  '100','hello',  '100','hello',  '100','hello',  '100','hello',  '100','hello',  '100','hello',  '100','hello',  '100','hello'
FROM    dual   INTERSECT
select /*+no_rewrite*/
'100','hello','100','hello', '100','hello',  '100','hello',  '100','hello',  '100','hello',  '100','hello',  '100','hello',  '100','hello',  '100','hello',  '100','hello',  '100','hello',  '100','hello',  '100','hello',  '100','hello',
'100','hello','100','hello', '100','hello',  '100','hello',  '100','hello',  '100','hello',  '100','hello',  '100','hello',  '100','hello',  '100','hello',  '100','hello',  '100','hello',  '100','hello',  '100','hello',  '100','hello',
'100','hello','100','hello', '100','hello',  '100','hello',  '100','hello',  '100','hello',  '100','hello',  '100','hello',  '100','hello',  '100','hello',  '100','hello',  '100','hello',  '100','hello',  '100','hello',  '100','hello',
'100','hello','100','hello', '100','hello',  '100','hello',  '100','hello',  '100','hello',  '100','hello',  '100','hello',  '100','hello',  '100','hello',  '100','hello',  '100','hello',  '100','hello',  '100','hello',  '100','hello',
'100','hello','100','hello', '100','hello',  '100','hello',  '100','hello',  '100','hello',  '100','hello',  '100','hello',  '100','hello',  '100','hello',  '100','hello',  '100','hello',  '100','hello',  '100','hello',  '100','hello',
'100','hello','100','hello', '100','hello',  '100','hello',  '100','hello',  '100','hello',  '100','hello',  '100','hello',  '100','hello',  '100','hello',  '100','hello',  '100','hello',  '100','hello',  '100','hello',  '100','hello',
'100','hello','100','hello', '100','hello',  '100','hello',  '100','hello',  '100','hello',  '100','hello',  '100','hello',  '100','hello',  '100','hello',  '100','hello',  '100','hello',  '100','hello',  '100','hello',  '100','hello',
'100','hello','100','hello', '100','hello',  '100','hello',  '100','hello',  '100','hello',  '100','hello',  '100','hello',  '100','hello',  '100','hello',  '100','hello',  '100','hello',  '100','hello',  '100','hello',  '100','hello'
from dual;
100	hello	100	hello	100	hello	100	hello	100	hello	100	hello	100	hello	100	hello	100	hello	100	hello	100	hello	100	hello	100	hello	100	hello	100	hello	100	hello	100	hello	100	hello	100	hello	100	hello	100	hello	100	hello	100	hello	100	hello	100	hello	100	hello	100	hello	100	hello	100	hello	100	hello	100	hello	100	hello	100	hello	100	hello	100	hello	100	hello	100	hello	100	hello	100	hello	100	hello	100	hello	100	hello	100	hello	100	hello	100	hello	100	hello	100	hello	100	hello	100	hello	100	hello	100	hello	100	hello	100	hello	100	hello	100	hello	100	hello	100	hello	100	hello	100	hello	100	hello	100	hello	100	hello	100	hello	100	hello	100	hello	100	hello	100	hello	100	hello	100	hello	100	hello	100	hello	100	hello	100	hello	100	hello	100	hello	100	hello	100	hello	100	hello	100	hello	100	hello	100	hello	100	hello	100	hello	100	hello	100	hello	100	hello	100	hello	100	hello	100	hello	100	hello	100	hello	100	hello	100	hello	100	hello	100	hello	100	hello	100	hello	100	hello	100	hello	100	hello	100	hello	100	hello	100	hello	100	hello	100	hello	100	hello	100	hello	100	hello	100	hello	100	hello	100	hello	100	hello	100	hello	100	hello	100	hello	100	hello	100	hello	100	hello	100	hello	100	hello
100	hello	100	hello	100	hello	100	hello	100	hello	100	hello	100	hello	100	hello	100	hello	100	hello	100	hello	100	hello	100	hello	100	hello	100	hello	100	hello	100	hello	100	hello	100	hello	100	hello	100	hello	100	hello	100	hello	100	hello	100	hello	100	hello	100	hello	100	hello	100	hello	100	hello	100	hello	100	hello	100	hello	100	hello	100	hello	100	hello	100	hello	100	hello	100	hello	100	hello	100	hello	100	hello	100	hello	100	hello	100	hello	100	hello	100	hello	100	hello	100	hello	100	hello	100	hello	100	hello	100	hello	100	hello	100	hello	100	hello	100	hello	100	hello	100	hello	100	hello	100	hello	100	hello	100	hello	100	hello	100	hello	100	hello	100	hello	100	hello	100	hello	100	hello	100	hello	100	hello	100	hello	100	hello	100	hello	100	hello	100	hello	100	hello	100	hello	100	hello	100	hello	100	hello	100	hello	100	hello	100	hello	100	hello	100	hello	100	hello	100	hello	100	hello	100	hello	100	hello	100	hello	100	hello	100	hello	100	hello	100	hello	100	hello	100	hello	100	hello	100	hello	100	hello	100	hello	100	hello	100	hello	100	hello	100	hello	100	hello	100	hello	100	hello	100	hello	100	hello	100	hello	100	hello	100	hello	100	hello	100	hello	100	hello	100	hello	100	hello
minus-2-1-1    char               
drop   table  if  exists   EMP001;
create table EMP001(a char(20),b TEXT(100));
insert into EMP001 values('helloworld','ab');
insert into EMP001 values('hello','ab');
insert into EMP001 values('','ab');
insert into EMP001 values(null,'ab');
drop   table  if  exists   EMP002;
create table EMP002(a char(20),b TEXT(100));
insert into EMP002 values('helloworld','ab');
insert into EMP002 values('hello','ab');
insert into EMP002 values('','ab');
insert into EMP002 values(null,'ab');
select    count(*)    FROM     (select     a,b   FROM    EMP001    minus  select      a,a       FROM    EMP002) e;
count(*)
4
select    count(*)    FROM     (select     a,b  FROM    EMP001    UNION  select    a,a       FROM    EMP002) e;
count(*)
8
select    count(*)    FROM     (select     b,b  FROM    EMP001    UNION  select    a,a       FROM    EMP002) e;
ERROR 42S21: Duplicate column name 'b'
select    count(*)    FROM     (select      *   FROM    EMP001    UNION  all  select      *        FROM    EMP002) e;
count(*)
8
select    count(*)    FROM     (select      *   FROM    EMP001    INTERSECT  select      *        FROM    EMP002) e;
count(*)
4
select    count(*)    FROM     (select      *   FROM    EMP001    JOIN   (select      *   FROM    EMP001    minus  select      *        FROM    EMP002) ON    1=1) e;
ERROR 42S21: Duplicate column name 'a'
select    count(*)    FROM     (select      *   FROM    EMP001    JOIN   (select      *   FROM    EMP001    UNION  select      *        FROM    EMP002) r   ON    1=1) e;
ERROR 42S21: Duplicate column name 'a'
select    count(*)    FROM     (select      y.a  FROM    EMP001 y    JOIN   (select     a  FROM    EMP001    UNION  all  select      a      FROM    EMP002)  r ON    1=1)e;
count(*)
32
select    count(*)    FROM     (select     b   FROM    EMP001    JOIN   (select     a  FROM    EMP001    INTERSECT  select      a       FROM    EMP002) r    ON    1=1)e;
count(*)
16
select    count(*)    FROM     (select     b   FROM    EMP001    JOIN   (select      a   FROM    EMP001    minus  select     a       FROM    EMP002) ON    (select     b  FROM    EMP001    minus  select     b       FROM    EMP002)= (select      b  FROM    EMP001    minus  select      b     FROM    EMP001));
count(*)
0
select    count(*)    FROM     (select      *   FROM    EMP001    JOIN   (select      *   FROM    EMP001    minus  select      *        FROM    EMP002) ON    (select      a   FROM    EMP001    minus  select      a        FROM    EMP002)= (select     a   FROM    EMP001    minus  select      *        FROM    EMP001));
ERROR 21000: The used SELECT statements have a different number of columns
minus-2-1-2   varchar
drop   table  if  exists   EMP001;
create table EMP001(a char(20),b VARCHAR(20));
insert into EMP001 values('helloworld','ab');
insert into EMP001 values('hello','ab');
insert into EMP001 values('','ab');
insert into EMP001 values(null,'ab');
drop   table  if  exists   EMP002;
create table EMP002(a char(20),b VARCHAR(20));
insert into EMP002 values('helloworld','ab');
insert into EMP002 values('hello','ab');
insert into EMP002 values('','ab');
insert into EMP002 values(null,'ab');
select    count(*)    FROM     (select      *   FROM    EMP001    minus  select     *      FROM    EMP002) e;
count(*)
0
select    count(*)    FROM     (select      *  FROM    EMP001    UNION  select      *        FROM    EMP002) e;
count(*)
4
select    count(*)    FROM     (select      *   FROM    EMP001    UNION  all  select      *        FROM    EMP002) e;
count(*)
8
select    count(*)    FROM     (select      *   FROM    EMP001    INTERSECT  select     *      FROM    EMP002) e;
count(*)
4
select    count(*)    FROM     (select    e.a   FROM    EMP001  e   JOIN   (select     t.a   FROM    EMP001  t   union    select    r.a     FROM    EMP002  r)e    ON    1=1) y;
ERROR 23000: Column 'e.a' in field list is ambiguous
minus-2-1-3   TINYTEXT               
drop   table  if  exists   EMP001;
create table EMP001(a tinytext,b char(20),c VARCHAR(20));
insert into EMP001 values('','hello','world');
insert into EMP001 values(' ','hello001','world002');
insert into EMP001 values(null,'hello01','world09');
insert into EMP001 values('helloworld','hello100','world200');
insert into EMP001 values('100','200','300');
insert into EMP001 values('400','500','600');
drop   table  if  exists   EMP002;
create table EMP002(a TINYTEXT,b char(20),c VARCHAR(20));
insert into EMP002 values('','hello','world');
insert into EMP002 values(' ','hello001','world002');
insert into EMP002 values(null,'hello01','world09');
insert into EMP002 values('helloworld','hello100','world200');
insert into EMP002 values('100','200','300');
insert into EMP002 values('400','500','600');
select      *   FROM    EMP001     minus   select      *        FROM    EMP002   r  ORDER BY  a,b,c;
a	b	c
select      *   FROM    EMP001     UNION   select      *        FROM    EMP002   r  ORDER BY  a,b,c;
a	b	c
NULL	hello01	world09
	hello	world
 	hello001	world002
100	200	300
400	500	600
helloworld	hello100	world200
select      *   FROM    EMP001     UNION  all   select      *        FROM    EMP002   r  ORDER BY   a,b,c;
a	b	c
NULL	hello01	world09
NULL	hello01	world09
	hello	world
	hello	world
 	hello001	world002
 	hello001	world002
100	200	300
100	200	300
400	500	600
400	500	600
helloworld	hello100	world200
helloworld	hello100	world200
select      *   FROM    EMP001    INTERSECT   select      *        FROM    EMP002   r  ORDER BY   a,b,c;
a	b	c
NULL	hello01	world09
	hello	world
 	hello001	world002
100	200	300
400	500	600
helloworld	hello100	world200
select    count(*)    FROM     (select      a,c   FROM    EMP001    minus  select      c,a      FROM    EMP002);
count(*)
6
select    count(*)    FROM     (select      *   FROM    EMP001    UNION  select      *        FROM    EMP002) e;
count(*)
6
select    count(*)    FROM     (select      *   FROM    EMP001    UNION  all  select      *        FROM    EMP002)  r;
count(*)
12
select    count(*)    FROM     (select      *   FROM    EMP001    INTERSECT  select      *        FROM    EMP002) r;
count(*)
6
select    count(*)    FROM     (select      *   FROM    EMP001    JOIN   (select      *   FROM    EMP001    minus  select      *        FROM    EMP002) ON    1=1);
ERROR 42S21: Duplicate column name 'a'
select    count(*)    FROM     (select      *   FROM    EMP001    JOIN   (select      *   FROM    EMP001    UNION  select      *        FROM    EMP002) ON    1=1);
ERROR 42S21: Duplicate column name 'a'
select    count(*)    FROM     (select      *   FROM    EMP001    JOIN   (select      *   FROM    EMP001    UNION  all  select      *        FROM    EMP002) ON    1=1);
ERROR 42S21: Duplicate column name 'a'
select    count(*)    FROM     (select      *   FROM    EMP001    JOIN   (select      *   FROM    EMP001    INTERSECT  select      *        FROM    EMP002) ON    1=1);
ERROR 42S21: Duplicate column name 'a'
minus-2-1-4   BLOB
drop   table  if  exists   EMP001;
create table EMP001(a BLOB(20));
insert into EMP001 values(' ');
insert into EMP001 values('');
insert into EMP001 values(null);
insert into EMP001 values('helloworld');
drop   table  if  exists   EMP002;
create table EMP002(a BLOB(20),b BLOB(20));
insert into EMP002 values(' ','    ');
insert into EMP002 values('','ttt');
insert into EMP002 values(null,'');
insert into EMP002 values('helloworld','100');
select    count(*)    FROM     (select      *   FROM    EMP001    minus  select      t.b       FROM    EMP002 t)  h;
count(*)
3
select    count(*)    FROM     (select      *   FROM    EMP001    UNION  select    r.a        FROM    EMP002  r) e;
count(*)
4
select    count(*)    FROM     (select      *   FROM    EMP001    union  all  select      t.b       FROM    EMP002 t)  h;
count(*)
8
select    count(*)    FROM     (select      *   FROM    EMP001    INTERSECT  select      *        FROM    EMP002)e;
ERROR 21000: The used SELECT statements have a different number of columns
select    count(*)    FROM     (select      e.a   FROM    EMP001   e  JOIN   (select     m.a  FROM    EMP001  m    UNION  select     c.b      FROM    EMP002  c)  h   ON    e.a=h.a) k;
count(*)
3
minus-2-2-1    TINYINT    
drop   table  if  exists   EMP001;
create table EMP001(a TINYINT);
insert into EMP001 values('1');
insert into EMP001 values(null);
insert into EMP001 values('100');
drop   table  if  exists   EMP002;
create table EMP002(a TINYINT);
insert into EMP002 values('99');
insert into EMP002 values(null);
insert into EMP002 values('100');
insert into EMP002 values('111');
select    count(*)    FROM     (select      *   FROM    EMP001    minus  select      *        FROM    EMP002);
count(*)
1
select    count(*)    FROM     (select      *   FROM    EMP001    UNION  select      *        FROM    EMP002)e;
count(*)
5
select    count(*)    FROM     (select      *   FROM    EMP001    UNION  all  select      *        FROM    EMP002)e;
count(*)
7
select    count(*)    FROM     (select      *   FROM    EMP001    INTERSECT  select      *        FROM    EMP002)e;
count(*)
2
minus-2-2-2    float        
drop   table  if  exists   EMP001;
create table EMP001(a FLOAT,b  DOUBLE);
insert into EMP001 values('1.366','1.3602233398');
insert into EMP001 values(null,'1.325896');
insert into EMP001 values('100000.366',11.22625);
insert into EMP001 values('','');
ERROR 01000: Data truncated for column 'a' at row 1
drop   table  if  exists   EMP002;
create table EMP002(a FLOAT,b  DOUBLE);
insert into EMP001 values('1.366','1.3233398');
insert into EMP001 values(null,'1.3896');
insert into EMP001 values('1000000.366',11.2222625);
select    count(*)    FROM     (select      *   FROM    EMP001    minus  select      *        FROM    EMP002);
count(*)
6
select    count(*)    FROM     (select      *   FROM    EMP001    UNION  select      *        FROM    EMP002)e;
count(*)
6
select    count(*)    FROM     (select      *   FROM    EMP001    UNION  all  select      *        FROM    EMP002)e;
count(*)
6
select    count(*)    FROM     (select      *   FROM    EMP001    INTERSECT  select      *        FROM    EMP002)e;
count(*)
0
select    count(*)    FROM     (select      e.a   FROM    EMP001  e   JOIN   (select      r.b   FROM    EMP001 r    union  select     h.a        FROM    EMP002 h)  m   ON    m.b    ='  ') t;
count(*)
0
select    count(*)    FROM     (select      e.a   FROM    EMP001  e   JOIN   (select      r.b   FROM    EMP001 r    union  select     h.a        FROM    EMP002 h)  m   on   (select    count(*)    FROM     (select      *   FROM    EMP001   UNION    select      *        FROM    EMP002) y)=   (select    count(*)    FROM     ((select      *   FROM    EMP001   UNION  all   select      *        FROM    EMP002)) u)) t;
count(*)
36
minus-2-2-3    longblob
drop   table  if  exists   EMP001;
create table EMP001(a  longblob,b LONGTEXT);
insert into EMP001 values(1.263,'hello');
insert into EMP001 values('','   ');
insert into EMP001 values(null,'world');
insert into EMP001 values('100000','yun');
drop   table  if  exists   EMP002;
create table EMP002(a  longblob,b LONGTEXT);
insert into EMP002 values(3.263,'hello');
insert into EMP002 values('   ','   ');
insert into EMP002 values(null,'     ');
insert into EMP002 values('100000',null);
select    count(*)    FROM     (select      *   FROM    EMP001    minus  select      *        FROM    EMP002) e;
count(*)
4
select    count(*)    FROM     (select      *   FROM    EMP001    UNION  select      *        FROM    EMP002) e;
count(*)
8
select    count(*)    FROM     (select      *   FROM    EMP001    UNION  all  select      *        FROM    EMP002) e;
count(*)
8
select    count(*)    FROM     (select      *   FROM    EMP001    INTERSECT  select      *        FROM    EMP002) e;
count(*)
0
select    count(*)    FROM     (select      y.b   FROM    EMP001   y  JOIN   (select    e.a   FROM    EMP001  e    minus  select      t.b        FROM    EMP002  t)h  ON    1=1) v;
count(*)
12
select    count(*)    FROM     (select      y.b   FROM    EMP001   y  JOIN   (select    e.a   FROM    EMP001  e    UNION  select      t.b        FROM    EMP002  t)  h  ON    1=1)  v;
count(*)
28
select    count(*)    FROM     (select      y.b   FROM    EMP001   y  JOIN   (select    e.a   FROM    EMP001  e    union  all    select      t.b        FROM    EMP002  t) h  ON    1=1) v;
count(*)
32
select    count(*)    FROM     (select      y.b   FROM    EMP001   y  JOIN   (select    e.a   FROM    EMP001  e    INTERSECT  select      t.b        FROM    EMP002  t)h   ON    1=1) v;
count(*)
4
minus-2-2-4    BIGINT
drop   table  if  exists   EMP001;
create table EMP001(a BIGINT);
insert into EMP001 values('4000');
insert into EMP001 values(null);
insert into EMP001 values('100000');
drop   table  if  exists   EMP002;
create table EMP002(a BIGINT);
insert into EMP002 values('01240');
insert into EMP002 values(null);
insert into EMP002 values('100000');
select    count(*)    FROM     (select      *   FROM    EMP001    minus  select      *        FROM    EMP002) e;
count(*)
1
select    count(*)    FROM     (select      *   FROM    EMP001    UNION  select      *        FROM    EMP002) e;
count(*)
4
select    count(*)    FROM     (select      *   FROM    EMP001    UNION  all  select      *        FROM    EMP002) e;
count(*)
6
select    count(*)    FROM     (select      *   FROM    EMP001    INTERSECT  select      *        FROM    EMP002) e;
count(*)
2
minus-2-2-5    DECIMAL
drop   table  if  exists   EMP001;
create table EMP001(a DECIMAL);
insert into EMP001 values('050');
insert into EMP001 values(null);
insert into EMP001 values('100000');
drop   table  if  exists   EMP002;
create table EMP002(a DECIMAL);
insert into EMP002 values('090');
insert into EMP002 values(null);
insert into EMP002 values('100000');
select    count(*)    FROM     (select      *   FROM    EMP001    minus  select      *        FROM    EMP002)e;
count(*)
1
select    count(*)    FROM     (select      *   FROM    EMP001    UNION  select      *        FROM    EMP002)e;
count(*)
4
select    count(*)    FROM     (select      *   FROM    EMP001    UNION  all  select      *        FROM    EMP002)e;
count(*)
6
select    count(*)    FROM     (select      *   FROM    EMP001    INTERSECT  select      *        FROM    EMP002)r;
count(*)
2
minus-2-3-1   DATE             
drop   table  if  exists   EMP001;
create table EMP001(a DATE);
insert into EMP001 values('1989-10-01');
insert into EMP001 values(null);
drop   table  if  exists   EMP002;
create table EMP002(a DATE);
insert into EMP002 values('1989-09-18');
insert into EMP002 values('1989-09-18');
insert into EMP002 values(null);
select    *   FROM    EMP001    minus  select      *         FROM    EMP002;
a
1989-10-01
select    count(*)    FROM     (select      *   FROM    EMP001    minus  select      *        FROM    EMP002) e;
count(*)
1
select    count(*)    FROM     (select      *   FROM    EMP001    UNION  select      *        FROM    EMP002) e;
count(*)
3
select    count(*)    FROM     (select      *   FROM    EMP001    UNION  all  select      *        FROM    EMP002) e;
count(*)
5
select    count(*)    FROM     (select      *   FROM    EMP001    INTERSECT  select      *        FROM    EMP002) e;
count(*)
1
minus-2-3-2  TIMESTAMP               
drop   table  if  exists   EMP001;
create table EMP001(a TIMESTAMP);
insert into EMP001 values('1989-10-01');
insert into EMP001 values(null);
drop   table  if  exists   EMP002;
create table EMP002(a DATE);
insert into EMP002 values('1989-09-18');
insert into EMP002 values('1989-09-18');
insert into EMP002 values(null);
select      *   FROM    EMP001    UNION  select      *        FROM    EMP002;
a
1989-10-01 00:00:00
NULL
1989-09-18 00:00:00
select    count(*)    FROM     (select      *   FROM    EMP001    UNION  select      *        FROM    EMP002) e;
count(*)
3
select    count(*)    FROM     (select      *   FROM    EMP001    UNION   all   select      *        FROM    EMP002) e;
count(*)
5
select    count(*)    FROM     (select      *   FROM    EMP001    minus  select      *        FROM    EMP002) e;
count(*)
1
select    count(*)    FROM     (select      *   FROM    EMP001    UNION  select      *        FROM    EMP002) e;
count(*)
3
select    count(*)    FROM     (select      *   FROM    EMP001    UNION  all  select      *        FROM    EMP002) e;
count(*)
5
select    count(*)    FROM     (select      *   FROM    EMP001    INTERSECT  select      *        FROM    EMP002) e;
count(*)
1
minus-2-3-3   YEAR        
drop   table  if  exists   EMP001;
create table EMP001(a YEAR);
insert into EMP001 values(null);
insert into EMP001 values('0');
drop   table  if  exists   EMP002;
create table EMP002(a YEAR);
insert into EMP002 values(null);
insert into EMP002 values('99');
select     e.a   FROM    EMP001   e    UNION  select      r.a     FROM    EMP002  r  order   by   e.a;
ERROR 42000: Table 'e' from one of the SELECTs cannot be used in global ORDER clause
drop   table  if  exists   emp001;
drop   table  if  exists   emp002;
drop   table  if  exists   emp;
create TABLE   EMP(empno   int,ename   VARCHAR(100) ,job  VARCHAR(100),mgr   int ,hiredate DATE,sal   float(8,0) ,comm   int ,deptno  int,comid   int);
INSERT INTO EMP VALUES(1,'SMITH','CLERK',7902,'1980-12-12',800,NULL,20,9999);
INSERT INTO EMP VALUES(2,'ALLEN','SALESMAN',7698,'1981-12-12',1600,300,30,9999);
INSERT INTO EMP VALUES(3,'WARD','SALESMAN',7698,'1982-12-12',1250,500,30,9999);
INSERT INTO EMP VALUES(4,'JONES','MANAGER',7839,'1983-12-12',2975,NULL,20,9999);
INSERT INTO EMP VALUES(5,'MARTIN','SALESMAN',7698,'1984-12-12',1250,1400,30,9999);
INSERT INTO EMP VALUES(100,'BLAKE','MANAGER',7839,'1985-12-12',2850,NULL,30,9999);
INSERT INTO EMP VALUES(200,'CLARK','MANAGER',7839,'1986-12-12',2450,NULL,10,9999);
INSERT INTO EMP VALUES(100,'BLAKE','MANAGER',7839,'1985-12-12',2850,NULL,30,9999);
INSERT INTO EMP VALUES(200,'CLARK','MANAGER',7839,'1986-12-12',2450,NULL,10,9999);
INSERT INTO EMP VALUES(300,'SCOTT','ANALYST',7566,'1987-12-12',3000,NULL,20,9999);
INSERT INTO EMP VALUES(400,'KING','PRESIDENT',NULL,'1988-12-12',5000,NULL,10,9999);
INSERT INTO EMP VALUES(1000,'TURNER','SALESMAN',7698,'1989-12-12',1500,0,30,9999);
INSERT INTO EMP VALUES(2000,'ADAMS','CLERK',7788,'1990-12-12',1100,NULL,20,9999);
INSERT INTO EMP VALUES(3000,'JAMES','CLERK',7698,'1991-12-12',950,NULL,30,9999);
INSERT INTO EMP VALUES(1000,'FORD','ANALYST',7566,'1992-12-12',3000,NULL,20,9999);
INSERT INTO EMP VALUES(5000,'MILLER','CLERK',7782,'1993-12-12',1300,NULL,10,9999);
create table  emp001   as select * from   emp;
create table  emp002   as select * from   emp;
select 普通查询      minus-3-1-1-1          
SELECT   *  FROM   (SELECT     *      FROM    EMP001      minus    select    *     FROM    EMP002)  e   ORDER  BY    e.empno,e.ename,e.job,e.mgr,e.hiredate,e.sal,e.comm,e.deptno,e.comid;
empno	ename	job	mgr	hiredate	sal	comm	deptno	comid
SELECT   *  FROM   (SELECT     *      FROM    EMP001      UNION    select    *     FROM    EMP002)  e   ORDER  BY    e.empno,e.ename,e.job,e.mgr,e.hiredate,e.sal,e.comm,e.deptno,e.comid;
empno	ename	job	mgr	hiredate	sal	comm	deptno	comid
1	SMITH	CLERK	7902	1980-12-12	800	NULL	20	9999
2	ALLEN	SALESMAN	7698	1981-12-12	1600	300	30	9999
3	WARD	SALESMAN	7698	1982-12-12	1250	500	30	9999
4	JONES	MANAGER	7839	1983-12-12	2975	NULL	20	9999
5	MARTIN	SALESMAN	7698	1984-12-12	1250	1400	30	9999
100	BLAKE	MANAGER	7839	1985-12-12	2850	NULL	30	9999
200	CLARK	MANAGER	7839	1986-12-12	2450	NULL	10	9999
300	SCOTT	ANALYST	7566	1987-12-12	3000	NULL	20	9999
400	KING	PRESIDENT	NULL	1988-12-12	5000	NULL	10	9999
1000	FORD	ANALYST	7566	1992-12-12	3000	NULL	20	9999
1000	TURNER	SALESMAN	7698	1989-12-12	1500	0	30	9999
2000	ADAMS	CLERK	7788	1990-12-12	1100	NULL	20	9999
3000	JAMES	CLERK	7698	1991-12-12	950	NULL	30	9999
5000	MILLER	CLERK	7782	1993-12-12	1300	NULL	10	9999
SELECT   *  FROM   (SELECT     *      FROM    EMP001      union  all    select    *     FROM    EMP002)  e   ORDER  BY    e.empno,e.ename,e.job,e.mgr,e.hiredate,e.sal,e.comm,e.deptno,e.comid;
empno	ename	job	mgr	hiredate	sal	comm	deptno	comid
1	SMITH	CLERK	7902	1980-12-12	800	NULL	20	9999
1	SMITH	CLERK	7902	1980-12-12	800	NULL	20	9999
2	ALLEN	SALESMAN	7698	1981-12-12	1600	300	30	9999
2	ALLEN	SALESMAN	7698	1981-12-12	1600	300	30	9999
3	WARD	SALESMAN	7698	1982-12-12	1250	500	30	9999
3	WARD	SALESMAN	7698	1982-12-12	1250	500	30	9999
4	JONES	MANAGER	7839	1983-12-12	2975	NULL	20	9999
4	JONES	MANAGER	7839	1983-12-12	2975	NULL	20	9999
5	MARTIN	SALESMAN	7698	1984-12-12	1250	1400	30	9999
5	MARTIN	SALESMAN	7698	1984-12-12	1250	1400	30	9999
100	BLAKE	MANAGER	7839	1985-12-12	2850	NULL	30	9999
100	BLAKE	MANAGER	7839	1985-12-12	2850	NULL	30	9999
100	BLAKE	MANAGER	7839	1985-12-12	2850	NULL	30	9999
100	BLAKE	MANAGER	7839	1985-12-12	2850	NULL	30	9999
200	CLARK	MANAGER	7839	1986-12-12	2450	NULL	10	9999
200	CLARK	MANAGER	7839	1986-12-12	2450	NULL	10	9999
200	CLARK	MANAGER	7839	1986-12-12	2450	NULL	10	9999
200	CLARK	MANAGER	7839	1986-12-12	2450	NULL	10	9999
300	SCOTT	ANALYST	7566	1987-12-12	3000	NULL	20	9999
300	SCOTT	ANALYST	7566	1987-12-12	3000	NULL	20	9999
400	KING	PRESIDENT	NULL	1988-12-12	5000	NULL	10	9999
400	KING	PRESIDENT	NULL	1988-12-12	5000	NULL	10	9999
1000	FORD	ANALYST	7566	1992-12-12	3000	NULL	20	9999
1000	FORD	ANALYST	7566	1992-12-12	3000	NULL	20	9999
1000	TURNER	SALESMAN	7698	1989-12-12	1500	0	30	9999
1000	TURNER	SALESMAN	7698	1989-12-12	1500	0	30	9999
2000	ADAMS	CLERK	7788	1990-12-12	1100	NULL	20	9999
2000	ADAMS	CLERK	7788	1990-12-12	1100	NULL	20	9999
3000	JAMES	CLERK	7698	1991-12-12	950	NULL	30	9999
3000	JAMES	CLERK	7698	1991-12-12	950	NULL	30	9999
5000	MILLER	CLERK	7782	1993-12-12	1300	NULL	10	9999
5000	MILLER	CLERK	7782	1993-12-12	1300	NULL	10	9999
SELECT   *  FROM   (SELECT     *      FROM    EMP001      INTERSECT    select    *     FROM    EMP002)  e   ORDER  BY    e.empno,e.ename,e.job,e.mgr,e.hiredate,e.sal,e.comm,e.deptno,e.comid;
empno	ename	job	mgr	hiredate	sal	comm	deptno	comid
1	SMITH	CLERK	7902	1980-12-12	800	NULL	20	9999
2	ALLEN	SALESMAN	7698	1981-12-12	1600	300	30	9999
3	WARD	SALESMAN	7698	1982-12-12	1250	500	30	9999
4	JONES	MANAGER	7839	1983-12-12	2975	NULL	20	9999
5	MARTIN	SALESMAN	7698	1984-12-12	1250	1400	30	9999
100	BLAKE	MANAGER	7839	1985-12-12	2850	NULL	30	9999
200	CLARK	MANAGER	7839	1986-12-12	2450	NULL	10	9999
300	SCOTT	ANALYST	7566	1987-12-12	3000	NULL	20	9999
400	KING	PRESIDENT	NULL	1988-12-12	5000	NULL	10	9999
1000	FORD	ANALYST	7566	1992-12-12	3000	NULL	20	9999
1000	TURNER	SALESMAN	7698	1989-12-12	1500	0	30	9999
2000	ADAMS	CLERK	7788	1990-12-12	1100	NULL	20	9999
3000	JAMES	CLERK	7698	1991-12-12	950	NULL	30	9999
5000	MILLER	CLERK	7782	1993-12-12	1300	NULL	10	9999
minus-3-1-1-1  select嵌套 
SELECT   *  FROM   (SELECT   *  FROM   (SELECT     *      FROM    EMP001      minus    select    *     FROM    EMP002)      MINUS  SELECT   *  FROM   (SELECT     *      FROM    EMP002      minus    select    *     FROM    EMP001))  e   ORDER  BY    e.empno,e.ename,e.job,e.mgr,e.hiredate,e.sal,e.comm,e.deptno,e.comid;
empno	ename	job	mgr	hiredate	sal	comm	deptno	comid
SELECT   *  FROM   (SELECT   *  FROM   (SELECT     *      FROM    EMP001      UNION    select    *     FROM    EMP002) h      UNION  SELECT   *  FROM   (SELECT     *      FROM    EMP002      union all    select    *     FROM    EMP001) j)  e  ORDER  BY    e.empno,e.ename,e.job,e.mgr,e.hiredate,e.sal,e.comm,e.deptno,e.comid;
empno	ename	job	mgr	hiredate	sal	comm	deptno	comid
1	SMITH	CLERK	7902	1980-12-12	800	NULL	20	9999
2	ALLEN	SALESMAN	7698	1981-12-12	1600	300	30	9999
3	WARD	SALESMAN	7698	1982-12-12	1250	500	30	9999
4	JONES	MANAGER	7839	1983-12-12	2975	NULL	20	9999
5	MARTIN	SALESMAN	7698	1984-12-12	1250	1400	30	9999
100	BLAKE	MANAGER	7839	1985-12-12	2850	NULL	30	9999
200	CLARK	MANAGER	7839	1986-12-12	2450	NULL	10	9999
300	SCOTT	ANALYST	7566	1987-12-12	3000	NULL	20	9999
400	KING	PRESIDENT	NULL	1988-12-12	5000	NULL	10	9999
1000	FORD	ANALYST	7566	1992-12-12	3000	NULL	20	9999
1000	TURNER	SALESMAN	7698	1989-12-12	1500	0	30	9999
2000	ADAMS	CLERK	7788	1990-12-12	1100	NULL	20	9999
3000	JAMES	CLERK	7698	1991-12-12	950	NULL	30	9999
5000	MILLER	CLERK	7782	1993-12-12	1300	NULL	10	9999
SELECT   *  FROM   (SELECT   *  FROM   (SELECT     *      FROM    EMP001      UNION   all   select    *     FROM    EMP002) h      UNION  SELECT   *  FROM   (SELECT     *      FROM    EMP002      union all    select    *     FROM    EMP001) j)  e  ORDER  BY    e.empno,e.ename,e.job,e.mgr,e.hiredate,e.sal,e.comm,e.deptno,e.comid;
empno	ename	job	mgr	hiredate	sal	comm	deptno	comid
1	SMITH	CLERK	7902	1980-12-12	800	NULL	20	9999
2	ALLEN	SALESMAN	7698	1981-12-12	1600	300	30	9999
3	WARD	SALESMAN	7698	1982-12-12	1250	500	30	9999
4	JONES	MANAGER	7839	1983-12-12	2975	NULL	20	9999
5	MARTIN	SALESMAN	7698	1984-12-12	1250	1400	30	9999
100	BLAKE	MANAGER	7839	1985-12-12	2850	NULL	30	9999
200	CLARK	MANAGER	7839	1986-12-12	2450	NULL	10	9999
300	SCOTT	ANALYST	7566	1987-12-12	3000	NULL	20	9999
400	KING	PRESIDENT	NULL	1988-12-12	5000	NULL	10	9999
1000	FORD	ANALYST	7566	1992-12-12	3000	NULL	20	9999
1000	TURNER	SALESMAN	7698	1989-12-12	1500	0	30	9999
2000	ADAMS	CLERK	7788	1990-12-12	1100	NULL	20	9999
3000	JAMES	CLERK	7698	1991-12-12	950	NULL	30	9999
5000	MILLER	CLERK	7782	1993-12-12	1300	NULL	10	9999
SELECT   *  FROM   (SELECT   *  FROM   (SELECT     *      FROM    EMP001      INTERSECT    select    *     FROM    EMP002) h      INTERSECT  SELECT   *  FROM   (SELECT     *      FROM    EMP002      union all    select    *     FROM    EMP001) j)  e  ORDER  BY    e.empno,e.ename,e.job,e.mgr,e.hiredate,e.sal,e.comm,e.deptno,e.comid;
empno	ename	job	mgr	hiredate	sal	comm	deptno	comid
1	SMITH	CLERK	7902	1980-12-12	800	NULL	20	9999
2	ALLEN	SALESMAN	7698	1981-12-12	1600	300	30	9999
3	WARD	SALESMAN	7698	1982-12-12	1250	500	30	9999
4	JONES	MANAGER	7839	1983-12-12	2975	NULL	20	9999
5	MARTIN	SALESMAN	7698	1984-12-12	1250	1400	30	9999
100	BLAKE	MANAGER	7839	1985-12-12	2850	NULL	30	9999
200	CLARK	MANAGER	7839	1986-12-12	2450	NULL	10	9999
300	SCOTT	ANALYST	7566	1987-12-12	3000	NULL	20	9999
400	KING	PRESIDENT	NULL	1988-12-12	5000	NULL	10	9999
1000	FORD	ANALYST	7566	1992-12-12	3000	NULL	20	9999
1000	TURNER	SALESMAN	7698	1989-12-12	1500	0	30	9999
2000	ADAMS	CLERK	7788	1990-12-12	1100	NULL	20	9999
3000	JAMES	CLERK	7698	1991-12-12	950	NULL	30	9999
5000	MILLER	CLERK	7782	1993-12-12	1300	NULL	10	9999
SELECT   *  FROM   (SELECT   *  FROM   (SELECT     *      FROM    EMP001      UNION    select    *     FROM    EMP002)  q      union  all    SELECT   *  FROM   (SELECT     k.*      FROM    EMP002  k      JOIN     (select    *     FROM    EMP001)   y    ON    1=1       )  v   )  e  ORDER  BY    e.empno,e.ename,e.job,e.mgr,e.hiredate,e.sal,e.comm,e.deptno,e.comid;
empno	ename	job	mgr	hiredate	sal	comm	deptno	comid
1	SMITH	CLERK	7902	1980-12-12	800	NULL	20	9999
1	SMITH	CLERK	7902	1980-12-12	800	NULL	20	9999
1	SMITH	CLERK	7902	1980-12-12	800	NULL	20	9999
1	SMITH	CLERK	7902	1980-12-12	800	NULL	20	9999
1	SMITH	CLERK	7902	1980-12-12	800	NULL	20	9999
1	SMITH	CLERK	7902	1980-12-12	800	NULL	20	9999
1	SMITH	CLERK	7902	1980-12-12	800	NULL	20	9999
1	SMITH	CLERK	7902	1980-12-12	800	NULL	20	9999
1	SMITH	CLERK	7902	1980-12-12	800	NULL	20	9999
1	SMITH	CLERK	7902	1980-12-12	800	NULL	20	9999
1	SMITH	CLERK	7902	1980-12-12	800	NULL	20	9999
1	SMITH	CLERK	7902	1980-12-12	800	NULL	20	9999
1	SMITH	CLERK	7902	1980-12-12	800	NULL	20	9999
1	SMITH	CLERK	7902	1980-12-12	800	NULL	20	9999
1	SMITH	CLERK	7902	1980-12-12	800	NULL	20	9999
1	SMITH	CLERK	7902	1980-12-12	800	NULL	20	9999
1	SMITH	CLERK	7902	1980-12-12	800	NULL	20	9999
2	ALLEN	SALESMAN	7698	1981-12-12	1600	300	30	9999
2	ALLEN	SALESMAN	7698	1981-12-12	1600	300	30	9999
2	ALLEN	SALESMAN	7698	1981-12-12	1600	300	30	9999
2	ALLEN	SALESMAN	7698	1981-12-12	1600	300	30	9999
2	ALLEN	SALESMAN	7698	1981-12-12	1600	300	30	9999
2	ALLEN	SALESMAN	7698	1981-12-12	1600	300	30	9999
2	ALLEN	SALESMAN	7698	1981-12-12	1600	300	30	9999
2	ALLEN	SALESMAN	7698	1981-12-12	1600	300	30	9999
2	ALLEN	SALESMAN	7698	1981-12-12	1600	300	30	9999
2	ALLEN	SALESMAN	7698	1981-12-12	1600	300	30	9999
2	ALLEN	SALESMAN	7698	1981-12-12	1600	300	30	9999
2	ALLEN	SALESMAN	7698	1981-12-12	1600	300	30	9999
2	ALLEN	SALESMAN	7698	1981-12-12	1600	300	30	9999
2	ALLEN	SALESMAN	7698	1981-12-12	1600	300	30	9999
2	ALLEN	SALESMAN	7698	1981-12-12	1600	300	30	9999
2	ALLEN	SALESMAN	7698	1981-12-12	1600	300	30	9999
2	ALLEN	SALESMAN	7698	1981-12-12	1600	300	30	9999
3	WARD	SALESMAN	7698	1982-12-12	1250	500	30	9999
3	WARD	SALESMAN	7698	1982-12-12	1250	500	30	9999
3	WARD	SALESMAN	7698	1982-12-12	1250	500	30	9999
3	WARD	SALESMAN	7698	1982-12-12	1250	500	30	9999
3	WARD	SALESMAN	7698	1982-12-12	1250	500	30	9999
3	WARD	SALESMAN	7698	1982-12-12	1250	500	30	9999
3	WARD	SALESMAN	7698	1982-12-12	1250	500	30	9999
3	WARD	SALESMAN	7698	1982-12-12	1250	500	30	9999
3	WARD	SALESMAN	7698	1982-12-12	1250	500	30	9999
3	WARD	SALESMAN	7698	1982-12-12	1250	500	30	9999
3	WARD	SALESMAN	7698	1982-12-12	1250	500	30	9999
3	WARD	SALESMAN	7698	1982-12-12	1250	500	30	9999
3	WARD	SALESMAN	7698	1982-12-12	1250	500	30	9999
3	WARD	SALESMAN	7698	1982-12-12	1250	500	30	9999
3	WARD	SALESMAN	7698	1982-12-12	1250	500	30	9999
3	WARD	SALESMAN	7698	1982-12-12	1250	500	30	9999
3	WARD	SALESMAN	7698	1982-12-12	1250	500	30	9999
4	JONES	MANAGER	7839	1983-12-12	2975	NULL	20	9999
4	JONES	MANAGER	7839	1983-12-12	2975	NULL	20	9999
4	JONES	MANAGER	7839	1983-12-12	2975	NULL	20	9999
4	JONES	MANAGER	7839	1983-12-12	2975	NULL	20	9999
4	JONES	MANAGER	7839	1983-12-12	2975	NULL	20	9999
4	JONES	MANAGER	7839	1983-12-12	2975	NULL	20	9999
4	JONES	MANAGER	7839	1983-12-12	2975	NULL	20	9999
4	JONES	MANAGER	7839	1983-12-12	2975	NULL	20	9999
4	JONES	MANAGER	7839	1983-12-12	2975	NULL	20	9999
4	JONES	MANAGER	7839	1983-12-12	2975	NULL	20	9999
4	JONES	MANAGER	7839	1983-12-12	2975	NULL	20	9999
4	JONES	MANAGER	7839	1983-12-12	2975	NULL	20	9999
4	JONES	MANAGER	7839	1983-12-12	2975	NULL	20	9999
4	JONES	MANAGER	7839	1983-12-12	2975	NULL	20	9999
4	JONES	MANAGER	7839	1983-12-12	2975	NULL	20	9999
4	JONES	MANAGER	7839	1983-12-12	2975	NULL	20	9999
4	JONES	MANAGER	7839	1983-12-12	2975	NULL	20	9999
5	MARTIN	SALESMAN	7698	1984-12-12	1250	1400	30	9999
5	MARTIN	SALESMAN	7698	1984-12-12	1250	1400	30	9999
5	MARTIN	SALESMAN	7698	1984-12-12	1250	1400	30	9999
5	MARTIN	SALESMAN	7698	1984-12-12	1250	1400	30	9999
5	MARTIN	SALESMAN	7698	1984-12-12	1250	1400	30	9999
5	MARTIN	SALESMAN	7698	1984-12-12	1250	1400	30	9999
5	MARTIN	SALESMAN	7698	1984-12-12	1250	1400	30	9999
5	MARTIN	SALESMAN	7698	1984-12-12	1250	1400	30	9999
5	MARTIN	SALESMAN	7698	1984-12-12	1250	1400	30	9999
5	MARTIN	SALESMAN	7698	1984-12-12	1250	1400	30	9999
5	MARTIN	SALESMAN	7698	1984-12-12	1250	1400	30	9999
5	MARTIN	SALESMAN	7698	1984-12-12	1250	1400	30	9999
5	MARTIN	SALESMAN	7698	1984-12-12	1250	1400	30	9999
5	MARTIN	SALESMAN	7698	1984-12-12	1250	1400	30	9999
5	MARTIN	SALESMAN	7698	1984-12-12	1250	1400	30	9999
5	MARTIN	SALESMAN	7698	1984-12-12	1250	1400	30	9999
5	MARTIN	SALESMAN	7698	1984-12-12	1250	1400	30	9999
100	BLAKE	MANAGER	7839	1985-12-12	2850	NULL	30	9999
100	BLAKE	MANAGER	7839	1985-12-12	2850	NULL	30	9999
100	BLAKE	MANAGER	7839	1985-12-12	2850	NULL	30	9999
100	BLAKE	MANAGER	7839	1985-12-12	2850	NULL	30	9999
100	BLAKE	MANAGER	7839	1985-12-12	2850	NULL	30	9999
100	BLAKE	MANAGER	7839	1985-12-12	2850	NULL	30	9999
100	BLAKE	MANAGER	7839	1985-12-12	2850	NULL	30	9999
100	BLAKE	MANAGER	7839	1985-12-12	2850	NULL	30	9999
100	BLAKE	MANAGER	7839	1985-12-12	2850	NULL	30	9999
100	BLAKE	MANAGER	7839	1985-12-12	2850	NULL	30	9999
100	BLAKE	MANAGER	7839	1985-12-12	2850	NULL	30	9999
100	BLAKE	MANAGER	7839	1985-12-12	2850	NULL	30	9999
100	BLAKE	MANAGER	7839	1985-12-12	2850	NULL	30	9999
100	BLAKE	MANAGER	7839	1985-12-12	2850	NULL	30	9999
100	BLAKE	MANAGER	7839	1985-12-12	2850	NULL	30	9999
100	BLAKE	MANAGER	7839	1985-12-12	2850	NULL	30	9999
100	BLAKE	MANAGER	7839	1985-12-12	2850	NULL	30	9999
100	BLAKE	MANAGER	7839	1985-12-12	2850	NULL	30	9999
100	BLAKE	MANAGER	7839	1985-12-12	2850	NULL	30	9999
100	BLAKE	MANAGER	7839	1985-12-12	2850	NULL	30	9999
100	BLAKE	MANAGER	7839	1985-12-12	2850	NULL	30	9999
100	BLAKE	MANAGER	7839	1985-12-12	2850	NULL	30	9999
100	BLAKE	MANAGER	7839	1985-12-12	2850	NULL	30	9999
100	BLAKE	MANAGER	7839	1985-12-12	2850	NULL	30	9999
100	BLAKE	MANAGER	7839	1985-12-12	2850	NULL	30	9999
100	BLAKE	MANAGER	7839	1985-12-12	2850	NULL	30	9999
100	BLAKE	MANAGER	7839	1985-12-12	2850	NULL	30	9999
100	BLAKE	MANAGER	7839	1985-12-12	2850	NULL	30	9999
100	BLAKE	MANAGER	7839	1985-12-12	2850	NULL	30	9999
100	BLAKE	MANAGER	7839	1985-12-12	2850	NULL	30	9999
100	BLAKE	MANAGER	7839	1985-12-12	2850	NULL	30	9999
100	BLAKE	MANAGER	7839	1985-12-12	2850	NULL	30	9999
100	BLAKE	MANAGER	7839	1985-12-12	2850	NULL	30	9999
200	CLARK	MANAGER	7839	1986-12-12	2450	NULL	10	9999
200	CLARK	MANAGER	7839	1986-12-12	2450	NULL	10	9999
200	CLARK	MANAGER	7839	1986-12-12	2450	NULL	10	9999
200	CLARK	MANAGER	7839	1986-12-12	2450	NULL	10	9999
200	CLARK	MANAGER	7839	1986-12-12	2450	NULL	10	9999
200	CLARK	MANAGER	7839	1986-12-12	2450	NULL	10	9999
200	CLARK	MANAGER	7839	1986-12-12	2450	NULL	10	9999
200	CLARK	MANAGER	7839	1986-12-12	2450	NULL	10	9999
200	CLARK	MANAGER	7839	1986-12-12	2450	NULL	10	9999
200	CLARK	MANAGER	7839	1986-12-12	2450	NULL	10	9999
200	CLARK	MANAGER	7839	1986-12-12	2450	NULL	10	9999
200	CLARK	MANAGER	7839	1986-12-12	2450	NULL	10	9999
200	CLARK	MANAGER	7839	1986-12-12	2450	NULL	10	9999
200	CLARK	MANAGER	7839	1986-12-12	2450	NULL	10	9999
200	CLARK	MANAGER	7839	1986-12-12	2450	NULL	10	9999
200	CLARK	MANAGER	7839	1986-12-12	2450	NULL	10	9999
200	CLARK	MANAGER	7839	1986-12-12	2450	NULL	10	9999
200	CLARK	MANAGER	7839	1986-12-12	2450	NULL	10	9999
200	CLARK	MANAGER	7839	1986-12-12	2450	NULL	10	9999
200	CLARK	MANAGER	7839	1986-12-12	2450	NULL	10	9999
200	CLARK	MANAGER	7839	1986-12-12	2450	NULL	10	9999
200	CLARK	MANAGER	7839	1986-12-12	2450	NULL	10	9999
200	CLARK	MANAGER	7839	1986-12-12	2450	NULL	10	9999
200	CLARK	MANAGER	7839	1986-12-12	2450	NULL	10	9999
200	CLARK	MANAGER	7839	1986-12-12	2450	NULL	10	9999
200	CLARK	MANAGER	7839	1986-12-12	2450	NULL	10	9999
200	CLARK	MANAGER	7839	1986-12-12	2450	NULL	10	9999
200	CLARK	MANAGER	7839	1986-12-12	2450	NULL	10	9999
200	CLARK	MANAGER	7839	1986-12-12	2450	NULL	10	9999
200	CLARK	MANAGER	7839	1986-12-12	2450	NULL	10	9999
200	CLARK	MANAGER	7839	1986-12-12	2450	NULL	10	9999
200	CLARK	MANAGER	7839	1986-12-12	2450	NULL	10	9999
200	CLARK	MANAGER	7839	1986-12-12	2450	NULL	10	9999
300	SCOTT	ANALYST	7566	1987-12-12	3000	NULL	20	9999
300	SCOTT	ANALYST	7566	1987-12-12	3000	NULL	20	9999
300	SCOTT	ANALYST	7566	1987-12-12	3000	NULL	20	9999
300	SCOTT	ANALYST	7566	1987-12-12	3000	NULL	20	9999
300	SCOTT	ANALYST	7566	1987-12-12	3000	NULL	20	9999
300	SCOTT	ANALYST	7566	1987-12-12	3000	NULL	20	9999
300	SCOTT	ANALYST	7566	1987-12-12	3000	NULL	20	9999
300	SCOTT	ANALYST	7566	1987-12-12	3000	NULL	20	9999
300	SCOTT	ANALYST	7566	1987-12-12	3000	NULL	20	9999
300	SCOTT	ANALYST	7566	1987-12-12	3000	NULL	20	9999
300	SCOTT	ANALYST	7566	1987-12-12	3000	NULL	20	9999
300	SCOTT	ANALYST	7566	1987-12-12	3000	NULL	20	9999
300	SCOTT	ANALYST	7566	1987-12-12	3000	NULL	20	9999
300	SCOTT	ANALYST	7566	1987-12-12	3000	NULL	20	9999
300	SCOTT	ANALYST	7566	1987-12-12	3000	NULL	20	9999
300	SCOTT	ANALYST	7566	1987-12-12	3000	NULL	20	9999
300	SCOTT	ANALYST	7566	1987-12-12	3000	NULL	20	9999
400	KING	PRESIDENT	NULL	1988-12-12	5000	NULL	10	9999
400	KING	PRESIDENT	NULL	1988-12-12	5000	NULL	10	9999
400	KING	PRESIDENT	NULL	1988-12-12	5000	NULL	10	9999
400	KING	PRESIDENT	NULL	1988-12-12	5000	NULL	10	9999
400	KING	PRESIDENT	NULL	1988-12-12	5000	NULL	10	9999
400	KING	PRESIDENT	NULL	1988-12-12	5000	NULL	10	9999
400	KING	PRESIDENT	NULL	1988-12-12	5000	NULL	10	9999
400	KING	PRESIDENT	NULL	1988-12-12	5000	NULL	10	9999
400	KING	PRESIDENT	NULL	1988-12-12	5000	NULL	10	9999
400	KING	PRESIDENT	NULL	1988-12-12	5000	NULL	10	9999
400	KING	PRESIDENT	NULL	1988-12-12	5000	NULL	10	9999
400	KING	PRESIDENT	NULL	1988-12-12	5000	NULL	10	9999
400	KING	PRESIDENT	NULL	1988-12-12	5000	NULL	10	9999
400	KING	PRESIDENT	NULL	1988-12-12	5000	NULL	10	9999
400	KING	PRESIDENT	NULL	1988-12-12	5000	NULL	10	9999
400	KING	PRESIDENT	NULL	1988-12-12	5000	NULL	10	9999
400	KING	PRESIDENT	NULL	1988-12-12	5000	NULL	10	9999
1000	FORD	ANALYST	7566	1992-12-12	3000	NULL	20	9999
1000	FORD	ANALYST	7566	1992-12-12	3000	NULL	20	9999
1000	FORD	ANALYST	7566	1992-12-12	3000	NULL	20	9999
1000	FORD	ANALYST	7566	1992-12-12	3000	NULL	20	9999
1000	FORD	ANALYST	7566	1992-12-12	3000	NULL	20	9999
1000	FORD	ANALYST	7566	1992-12-12	3000	NULL	20	9999
1000	FORD	ANALYST	7566	1992-12-12	3000	NULL	20	9999
1000	FORD	ANALYST	7566	1992-12-12	3000	NULL	20	9999
1000	FORD	ANALYST	7566	1992-12-12	3000	NULL	20	9999
1000	FORD	ANALYST	7566	1992-12-12	3000	NULL	20	9999
1000	FORD	ANALYST	7566	1992-12-12	3000	NULL	20	9999
1000	FORD	ANALYST	7566	1992-12-12	3000	NULL	20	9999
1000	FORD	ANALYST	7566	1992-12-12	3000	NULL	20	9999
1000	FORD	ANALYST	7566	1992-12-12	3000	NULL	20	9999
1000	FORD	ANALYST	7566	1992-12-12	3000	NULL	20	9999
1000	FORD	ANALYST	7566	1992-12-12	3000	NULL	20	9999
1000	FORD	ANALYST	7566	1992-12-12	3000	NULL	20	9999
1000	TURNER	SALESMAN	7698	1989-12-12	1500	0	30	9999
1000	TURNER	SALESMAN	7698	1989-12-12	1500	0	30	9999
1000	TURNER	SALESMAN	7698	1989-12-12	1500	0	30	9999
1000	TURNER	SALESMAN	7698	1989-12-12	1500	0	30	9999
1000	TURNER	SALESMAN	7698	1989-12-12	1500	0	30	9999
1000	TURNER	SALESMAN	7698	1989-12-12	1500	0	30	9999
1000	TURNER	SALESMAN	7698	1989-12-12	1500	0	30	9999
1000	TURNER	SALESMAN	7698	1989-12-12	1500	0	30	9999
1000	TURNER	SALESMAN	7698	1989-12-12	1500	0	30	9999
1000	TURNER	SALESMAN	7698	1989-12-12	1500	0	30	9999
1000	TURNER	SALESMAN	7698	1989-12-12	1500	0	30	9999
1000	TURNER	SALESMAN	7698	1989-12-12	1500	0	30	9999
1000	TURNER	SALESMAN	7698	1989-12-12	1500	0	30	9999
1000	TURNER	SALESMAN	7698	1989-12-12	1500	0	30	9999
1000	TURNER	SALESMAN	7698	1989-12-12	1500	0	30	9999
1000	TURNER	SALESMAN	7698	1989-12-12	1500	0	30	9999
1000	TURNER	SALESMAN	7698	1989-12-12	1500	0	30	9999
2000	ADAMS	CLERK	7788	1990-12-12	1100	NULL	20	9999
2000	ADAMS	CLERK	7788	1990-12-12	1100	NULL	20	9999
2000	ADAMS	CLERK	7788	1990-12-12	1100	NULL	20	9999
2000	ADAMS	CLERK	7788	1990-12-12	1100	NULL	20	9999
2000	ADAMS	CLERK	7788	1990-12-12	1100	NULL	20	9999
2000	ADAMS	CLERK	7788	1990-12-12	1100	NULL	20	9999
2000	ADAMS	CLERK	7788	1990-12-12	1100	NULL	20	9999
2000	ADAMS	CLERK	7788	1990-12-12	1100	NULL	20	9999
2000	ADAMS	CLERK	7788	1990-12-12	1100	NULL	20	9999
2000	ADAMS	CLERK	7788	1990-12-12	1100	NULL	20	9999
2000	ADAMS	CLERK	7788	1990-12-12	1100	NULL	20	9999
2000	ADAMS	CLERK	7788	1990-12-12	1100	NULL	20	9999
2000	ADAMS	CLERK	7788	1990-12-12	1100	NULL	20	9999
2000	ADAMS	CLERK	7788	1990-12-12	1100	NULL	20	9999
2000	ADAMS	CLERK	7788	1990-12-12	1100	NULL	20	9999
2000	ADAMS	CLERK	7788	1990-12-12	1100	NULL	20	9999
2000	ADAMS	CLERK	7788	1990-12-12	1100	NULL	20	9999
3000	JAMES	CLERK	7698	1991-12-12	950	NULL	30	9999
3000	JAMES	CLERK	7698	1991-12-12	950	NULL	30	9999
3000	JAMES	CLERK	7698	1991-12-12	950	NULL	30	9999
3000	JAMES	CLERK	7698	1991-12-12	950	NULL	30	9999
3000	JAMES	CLERK	7698	1991-12-12	950	NULL	30	9999
3000	JAMES	CLERK	7698	1991-12-12	950	NULL	30	9999
3000	JAMES	CLERK	7698	1991-12-12	950	NULL	30	9999
3000	JAMES	CLERK	7698	1991-12-12	950	NULL	30	9999
3000	JAMES	CLERK	7698	1991-12-12	950	NULL	30	9999
3000	JAMES	CLERK	7698	1991-12-12	950	NULL	30	9999
3000	JAMES	CLERK	7698	1991-12-12	950	NULL	30	9999
3000	JAMES	CLERK	7698	1991-12-12	950	NULL	30	9999
3000	JAMES	CLERK	7698	1991-12-12	950	NULL	30	9999
3000	JAMES	CLERK	7698	1991-12-12	950	NULL	30	9999
3000	JAMES	CLERK	7698	1991-12-12	950	NULL	30	9999
3000	JAMES	CLERK	7698	1991-12-12	950	NULL	30	9999
3000	JAMES	CLERK	7698	1991-12-12	950	NULL	30	9999
5000	MILLER	CLERK	7782	1993-12-12	1300	NULL	10	9999
5000	MILLER	CLERK	7782	1993-12-12	1300	NULL	10	9999
5000	MILLER	CLERK	7782	1993-12-12	1300	NULL	10	9999
5000	MILLER	CLERK	7782	1993-12-12	1300	NULL	10	9999
5000	MILLER	CLERK	7782	1993-12-12	1300	NULL	10	9999
5000	MILLER	CLERK	7782	1993-12-12	1300	NULL	10	9999
5000	MILLER	CLERK	7782	1993-12-12	1300	NULL	10	9999
5000	MILLER	CLERK	7782	1993-12-12	1300	NULL	10	9999
5000	MILLER	CLERK	7782	1993-12-12	1300	NULL	10	9999
5000	MILLER	CLERK	7782	1993-12-12	1300	NULL	10	9999
5000	MILLER	CLERK	7782	1993-12-12	1300	NULL	10	9999
5000	MILLER	CLERK	7782	1993-12-12	1300	NULL	10	9999
5000	MILLER	CLERK	7782	1993-12-12	1300	NULL	10	9999
5000	MILLER	CLERK	7782	1993-12-12	1300	NULL	10	9999
5000	MILLER	CLERK	7782	1993-12-12	1300	NULL	10	9999
5000	MILLER	CLERK	7782	1993-12-12	1300	NULL	10	9999
5000	MILLER	CLERK	7782	1993-12-12	1300	NULL	10	9999
minus-3-1-1-3    聚合函数
SELECT    sum(empno)     FROM    EMP001     minus    select    sum(empno)        FROM    EMP002;
sum(empno)
SELECT    avg(empno)     FROM    EMP001     minus    select    avg(empno)        FROM    EMP002;
avg(empno)
SELECT    max(empno)     FROM    EMP001     minus    select    max(empno)        FROM    EMP002;
max(empno)
SELECT    min(empno)     FROM    EMP001     minus    select    sum(empno)        FROM    EMP002;
min(empno)
1
SELECT     sum(empno)   rrr       FROM    EMP001     UNION      select    sum(empno)        FROM    EMP002   ORDER BY   rrr;
rrr
13315
SELECT    avg(empno)  rrr    FROM    EMP001      UNION  all    select    avg(empno)        FROM    EMP002   ORDER BY   rrr;
rrr
832.1875
832.1875
SELECT    max(empno)  rrr    FROM    EMP001     INTERSECT    select    max(empno)        FROM    EMP002     ORDER BY   rrr;
rrr
5000
SELECT    min(e.empno)    rrr     FROM    EMP001    e   JOIN   EMP002   r    ON   1=2;
rrr
NULL
minus-3-1-1-4    create as        
DROP VIEW    IF exists    EMP001_create;
DROP TABLE   IF exists    EMP001_create;
create TABLE    EMP001_create   as  SELECT    sum(empno)   eee   FROM    EMP001     minus    select    sum(empno)        FROM    EMP002;
SELECT  *  FROM     EMP001_create   ORDER BY   eee;
eee
DROP TABLE   IF exists    EMP001_create;
create TABLE    EMP001_create   as  SELECT    sum(empno)   eee   FROM    EMP001     union    select    sum(empno)        FROM    EMP002;
SELECT  *  FROM     EMP001_create   ORDER BY   eee;
eee
13315
DROP TABLE   IF exists    EMP001_create;
create TABLE    EMP001_create   as  SELECT    sum(empno)   eee   FROM    EMP001     union  all    select    sum(empno)        FROM    EMP002;
SELECT  *  FROM     EMP001_create   ORDER BY   eee;
eee
13315
13315
DROP TABLE   IF exists    EMP001_create;
create TABLE    EMP001_create   as  SELECT    sum(empno)   eee   FROM    EMP001     INTERSECT    select    sum(empno)        FROM    EMP002;
SELECT  *  FROM     EMP001_create   ORDER BY   eee;
eee
13315
minus-3-1-2   where  语句    
SELECT   *  FROM   (SELECT     *      FROM    EMP001   WHERE   empno  < 2         minus    select    *     FROM    EMP002  e   WHERE   e.EMPNO<3)  ORDER   BY   EMPNO;
empno	ename	job	mgr	hiredate	sal	comm	deptno	comid
SELECT   *  FROM   (SELECT     *      FROM    EMP001   WHERE   empno  < 2         union    select    *     FROM    EMP002  e   WHERE   e.EMPNO<3)  ORDER   BY   EMPNO;
empno	ename	job	mgr	hiredate	sal	comm	deptno	comid
1	SMITH	CLERK	7902	1980-12-12	800	NULL	20	9999
2	ALLEN	SALESMAN	7698	1981-12-12	1600	300	30	9999
SELECT   *  FROM   (SELECT     *      FROM    EMP001   WHERE   empno  < 2         UNION  all    select    *     FROM    EMP002  e   WHERE   e.EMPNO<3)  ORDER   BY   EMPNO;
empno	ename	job	mgr	hiredate	sal	comm	deptno	comid
1	SMITH	CLERK	7902	1980-12-12	800	NULL	20	9999
1	SMITH	CLERK	7902	1980-12-12	800	NULL	20	9999
2	ALLEN	SALESMAN	7698	1981-12-12	1600	300	30	9999
SELECT   *  FROM   (SELECT     *      FROM    EMP001   WHERE   empno  < 2         INTERSECT    select    *     FROM    EMP002  e   WHERE   e.EMPNO<3)  ORDER   BY   EMPNO;
empno	ename	job	mgr	hiredate	sal	comm	deptno	comid
1	SMITH	CLERK	7902	1980-12-12	800	NULL	20	9999
minus-3-1-3     order by 子句
SELECT   *  FROM   (SELECT     *      FROM    EMP001   WHERE   empno  < 2         minus    select    *     FROM    EMP002  e   WHERE   e.EMPNO<3)    ORDER   BY   EMPNO;
empno	ename	job	mgr	hiredate	sal	comm	deptno	comid
SELECT   *  FROM   (SELECT     *      FROM    EMP001   WHERE   empno  < 2         UNION    select    *     FROM    EMP002  e   WHERE   EMPNO>3)  e     ORDER  BY    empno,ename,job,mgr,hiredate,sal,comm,deptno,comid;
empno	ename	job	mgr	hiredate	sal	comm	deptno	comid
1	SMITH	CLERK	7902	1980-12-12	800	NULL	20	9999
4	JONES	MANAGER	7839	1983-12-12	2975	NULL	20	9999
5	MARTIN	SALESMAN	7698	1984-12-12	1250	1400	30	9999
100	BLAKE	MANAGER	7839	1985-12-12	2850	NULL	30	9999
200	CLARK	MANAGER	7839	1986-12-12	2450	NULL	10	9999
300	SCOTT	ANALYST	7566	1987-12-12	3000	NULL	20	9999
400	KING	PRESIDENT	NULL	1988-12-12	5000	NULL	10	9999
1000	FORD	ANALYST	7566	1992-12-12	3000	NULL	20	9999
1000	TURNER	SALESMAN	7698	1989-12-12	1500	0	30	9999
2000	ADAMS	CLERK	7788	1990-12-12	1100	NULL	20	9999
3000	JAMES	CLERK	7698	1991-12-12	950	NULL	30	9999
5000	MILLER	CLERK	7782	1993-12-12	1300	NULL	10	9999
SELECT   *  FROM   (SELECT     *      FROM    EMP001   WHERE   empno  < 2         UNION all    select    *     FROM    EMP002  e   WHERE   e.EMPNO>3)  e     ORDER  BY    empno,ename,job,mgr,hiredate,sal,comm,deptno,comid;
empno	ename	job	mgr	hiredate	sal	comm	deptno	comid
1	SMITH	CLERK	7902	1980-12-12	800	NULL	20	9999
4	JONES	MANAGER	7839	1983-12-12	2975	NULL	20	9999
5	MARTIN	SALESMAN	7698	1984-12-12	1250	1400	30	9999
100	BLAKE	MANAGER	7839	1985-12-12	2850	NULL	30	9999
100	BLAKE	MANAGER	7839	1985-12-12	2850	NULL	30	9999
200	CLARK	MANAGER	7839	1986-12-12	2450	NULL	10	9999
200	CLARK	MANAGER	7839	1986-12-12	2450	NULL	10	9999
300	SCOTT	ANALYST	7566	1987-12-12	3000	NULL	20	9999
400	KING	PRESIDENT	NULL	1988-12-12	5000	NULL	10	9999
1000	FORD	ANALYST	7566	1992-12-12	3000	NULL	20	9999
1000	TURNER	SALESMAN	7698	1989-12-12	1500	0	30	9999
2000	ADAMS	CLERK	7788	1990-12-12	1100	NULL	20	9999
3000	JAMES	CLERK	7698	1991-12-12	950	NULL	30	9999
5000	MILLER	CLERK	7782	1993-12-12	1300	NULL	10	9999
SELECT   *  FROM   (SELECT     *      FROM    EMP001   WHERE   empno  < 2         INTERSECT    select    *     FROM    EMP002  e   WHERE   e.EMPNO<3) e       ORDER  BY    empno,ename,job,mgr,hiredate,sal,comm,deptno,comid;
empno	ename	job	mgr	hiredate	sal	comm	deptno	comid
1	SMITH	CLERK	7902	1980-12-12	800	NULL	20	9999
minus-3-1-4     group by   子句
SELECT        *      FROM   (SELECT    empno      FROM    EMP001     GROUP  BY    empno            minus    SELECT    empno      FROM    EMP002     GROUP  BY    empno)  e  ORDER  BY    empno;
empno
SELECT        *      FROM   (SELECT    empno      FROM    EMP001     GROUP  BY    empno            UNION    SELECT    empno      FROM    EMP002     GROUP  BY    empno) e  ORDER  BY    empno;
empno
1
2
3
4
5
100
200
300
400
1000
2000
3000
5000
SELECT        *      FROM   (SELECT    empno      FROM    EMP001     GROUP  BY    empno            UNION all    SELECT    empno      FROM    EMP002     GROUP  BY    empno) e  ORDER  BY    empno;
empno
1
1
2
2
3
3
4
4
5
5
100
100
200
200
300
300
400
400
1000
1000
2000
2000
3000
3000
5000
5000
SELECT        *      FROM   (SELECT    empno      FROM    EMP001     GROUP  BY    empno            INTERSECT    SELECT    empno      FROM    EMP002     GROUP  BY    empno) e  ORDER  BY    empno;
empno
1
2
3
4
5
100
200
300
400
1000
2000
3000
5000
minus-3-1-5     group by  having   子句
SELECT        *      FROM         (SELECT    empno      FROM    EMP001     GROUP  BY    empno,sal   having    sal>100       minus    SELECT    empno      FROM    EMP002     GROUP  BY    empno  having    empno>1000) e   ORDER   BY   EMPNO;
empno
1
2
3
4
5
100
200
300
400
1000
SELECT        *      FROM         (SELECT    empno      FROM    EMP001     GROUP  BY    empno,sal   having    sal>100       UNION    SELECT    empno      FROM    EMP002     GROUP  BY    empno  having    empno>1000)e    ORDER   BY   EMPNO;
empno
1
2
3
4
5
100
200
300
400
1000
2000
3000
5000
SELECT        *      FROM         (SELECT    empno      FROM    EMP001     GROUP  BY    empno,sal   having    sal>100       UNION all   SELECT    empno      FROM    EMP002     GROUP  BY    empno  having    empno>1000)e    ORDER   BY   EMPNO;
empno
1
2
3
4
5
100
200
300
400
1000
1000
2000
2000
3000
3000
5000
5000
SELECT        *      FROM         (SELECT    empno      FROM    EMP001     GROUP  BY    empno,sal   having    sal>100       INTERSECT    SELECT    empno      FROM    EMP002     GROUP  BY    empno  having    empno>1000) e   ORDER   BY   EMPNO;
empno
2000
3000
5000
minus-3-2-1   根据字段插入
INSERT INTO  EMP001(empno,sal)   SELECT   empno,sal   FROM    EMP001      minus    select    empno,sal    FROM    EMP002;
INSERT INTO  EMP001(empno,sal)   SELECT   empno,sal   FROM    EMP001      UNION    select    empno,sal    FROM    EMP002;
INSERT INTO  EMP001(empno,sal)   SELECT   empno,sal   FROM    EMP001      UNION  all    select    empno,sal    FROM    EMP002;
INSERT INTO  EMP001(empno,sal)   SELECT   empno,sal   FROM    EMP001      INTERSECT    select    empno,sal    FROM    EMP002;
SELECT   *  FROM   (SELECT     *      FROM    EMP001      minus    select    *     FROM    EMP002)  e   ORDER  BY e.empno,e.ename,e.job,e.mgr,e.hiredate,e.sal,e.comm,e.deptno;
empno	ename	job	mgr	hiredate	sal	comm	deptno	comid
1	NULL	NULL	NULL	NULL	800	NULL	NULL	NULL
2	NULL	NULL	NULL	NULL	1600	NULL	NULL	NULL
3	NULL	NULL	NULL	NULL	1250	NULL	NULL	NULL
4	NULL	NULL	NULL	NULL	2975	NULL	NULL	NULL
5	NULL	NULL	NULL	NULL	1250	NULL	NULL	NULL
100	NULL	NULL	NULL	NULL	2850	NULL	NULL	NULL
200	NULL	NULL	NULL	NULL	2450	NULL	NULL	NULL
300	NULL	NULL	NULL	NULL	3000	NULL	NULL	NULL
400	NULL	NULL	NULL	NULL	5000	NULL	NULL	NULL
1000	NULL	NULL	NULL	NULL	1500	NULL	NULL	NULL
1000	NULL	NULL	NULL	NULL	3000	NULL	NULL	NULL
2000	NULL	NULL	NULL	NULL	1100	NULL	NULL	NULL
3000	NULL	NULL	NULL	NULL	950	NULL	NULL	NULL
5000	NULL	NULL	NULL	NULL	1300	NULL	NULL	NULL
SELECT   *  FROM   (SELECT     *      FROM    EMP001      UNION    select    *     FROM    EMP002)  e      ORDER  BY e.empno,e.ename,e.job,e.mgr,e.hiredate,e.sal,e.comm,e.deptno;
empno	ename	job	mgr	hiredate	sal	comm	deptno	comid
1	NULL	NULL	NULL	NULL	800	NULL	NULL	NULL
1	SMITH	CLERK	7902	1980-12-12	800	NULL	20	9999
2	NULL	NULL	NULL	NULL	1600	NULL	NULL	NULL
2	ALLEN	SALESMAN	7698	1981-12-12	1600	300	30	9999
3	NULL	NULL	NULL	NULL	1250	NULL	NULL	NULL
3	WARD	SALESMAN	7698	1982-12-12	1250	500	30	9999
4	NULL	NULL	NULL	NULL	2975	NULL	NULL	NULL
4	JONES	MANAGER	7839	1983-12-12	2975	NULL	20	9999
5	NULL	NULL	NULL	NULL	1250	NULL	NULL	NULL
5	MARTIN	SALESMAN	7698	1984-12-12	1250	1400	30	9999
100	NULL	NULL	NULL	NULL	2850	NULL	NULL	NULL
100	BLAKE	MANAGER	7839	1985-12-12	2850	NULL	30	9999
200	NULL	NULL	NULL	NULL	2450	NULL	NULL	NULL
200	CLARK	MANAGER	7839	1986-12-12	2450	NULL	10	9999
300	NULL	NULL	NULL	NULL	3000	NULL	NULL	NULL
300	SCOTT	ANALYST	7566	1987-12-12	3000	NULL	20	9999
400	NULL	NULL	NULL	NULL	5000	NULL	NULL	NULL
400	KING	PRESIDENT	NULL	1988-12-12	5000	NULL	10	9999
1000	NULL	NULL	NULL	NULL	1500	NULL	NULL	NULL
1000	NULL	NULL	NULL	NULL	3000	NULL	NULL	NULL
1000	FORD	ANALYST	7566	1992-12-12	3000	NULL	20	9999
1000	TURNER	SALESMAN	7698	1989-12-12	1500	0	30	9999
2000	NULL	NULL	NULL	NULL	1100	NULL	NULL	NULL
2000	ADAMS	CLERK	7788	1990-12-12	1100	NULL	20	9999
3000	NULL	NULL	NULL	NULL	950	NULL	NULL	NULL
3000	JAMES	CLERK	7698	1991-12-12	950	NULL	30	9999
5000	NULL	NULL	NULL	NULL	1300	NULL	NULL	NULL
5000	MILLER	CLERK	7782	1993-12-12	1300	NULL	10	9999
SELECT   *  FROM   (SELECT     *      FROM    EMP001      UNION  all    select    *     FROM    EMP002)  e    ORDER  BY e.empno,e.ename,e.job,e.mgr,e.hiredate,e.sal,e.comm,e.deptno;
empno	ename	job	mgr	hiredate	sal	comm	deptno	comid
1	NULL	NULL	NULL	NULL	800	NULL	NULL	NULL
1	NULL	NULL	NULL	NULL	800	NULL	NULL	NULL
1	NULL	NULL	NULL	NULL	800	NULL	NULL	NULL
1	NULL	NULL	NULL	NULL	800	NULL	NULL	NULL
1	NULL	NULL	NULL	NULL	800	NULL	NULL	NULL
1	SMITH	CLERK	7902	1980-12-12	800	NULL	20	9999
1	SMITH	CLERK	7902	1980-12-12	800	NULL	20	9999
2	NULL	NULL	NULL	NULL	1600	NULL	NULL	NULL
2	NULL	NULL	NULL	NULL	1600	NULL	NULL	NULL
2	NULL	NULL	NULL	NULL	1600	NULL	NULL	NULL
2	NULL	NULL	NULL	NULL	1600	NULL	NULL	NULL
2	NULL	NULL	NULL	NULL	1600	NULL	NULL	NULL
2	ALLEN	SALESMAN	7698	1981-12-12	1600	300	30	9999
2	ALLEN	SALESMAN	7698	1981-12-12	1600	300	30	9999
3	NULL	NULL	NULL	NULL	1250	NULL	NULL	NULL
3	NULL	NULL	NULL	NULL	1250	NULL	NULL	NULL
3	NULL	NULL	NULL	NULL	1250	NULL	NULL	NULL
3	NULL	NULL	NULL	NULL	1250	NULL	NULL	NULL
3	NULL	NULL	NULL	NULL	1250	NULL	NULL	NULL
3	WARD	SALESMAN	7698	1982-12-12	1250	500	30	9999
3	WARD	SALESMAN	7698	1982-12-12	1250	500	30	9999
4	NULL	NULL	NULL	NULL	2975	NULL	NULL	NULL
4	NULL	NULL	NULL	NULL	2975	NULL	NULL	NULL
4	NULL	NULL	NULL	NULL	2975	NULL	NULL	NULL
4	NULL	NULL	NULL	NULL	2975	NULL	NULL	NULL
4	NULL	NULL	NULL	NULL	2975	NULL	NULL	NULL
4	JONES	MANAGER	7839	1983-12-12	2975	NULL	20	9999
4	JONES	MANAGER	7839	1983-12-12	2975	NULL	20	9999
5	NULL	NULL	NULL	NULL	1250	NULL	NULL	NULL
5	NULL	NULL	NULL	NULL	1250	NULL	NULL	NULL
5	NULL	NULL	NULL	NULL	1250	NULL	NULL	NULL
5	NULL	NULL	NULL	NULL	1250	NULL	NULL	NULL
5	NULL	NULL	NULL	NULL	1250	NULL	NULL	NULL
5	MARTIN	SALESMAN	7698	1984-12-12	1250	1400	30	9999
5	MARTIN	SALESMAN	7698	1984-12-12	1250	1400	30	9999
100	NULL	NULL	NULL	NULL	2850	NULL	NULL	NULL
100	NULL	NULL	NULL	NULL	2850	NULL	NULL	NULL
100	NULL	NULL	NULL	NULL	2850	NULL	NULL	NULL
100	NULL	NULL	NULL	NULL	2850	NULL	NULL	NULL
100	NULL	NULL	NULL	NULL	2850	NULL	NULL	NULL
100	NULL	NULL	NULL	NULL	2850	NULL	NULL	NULL
100	NULL	NULL	NULL	NULL	2850	NULL	NULL	NULL
100	BLAKE	MANAGER	7839	1985-12-12	2850	NULL	30	9999
100	BLAKE	MANAGER	7839	1985-12-12	2850	NULL	30	9999
100	BLAKE	MANAGER	7839	1985-12-12	2850	NULL	30	9999
100	BLAKE	MANAGER	7839	1985-12-12	2850	NULL	30	9999
200	NULL	NULL	NULL	NULL	2450	NULL	NULL	NULL
200	NULL	NULL	NULL	NULL	2450	NULL	NULL	NULL
200	NULL	NULL	NULL	NULL	2450	NULL	NULL	NULL
200	NULL	NULL	NULL	NULL	2450	NULL	NULL	NULL
200	NULL	NULL	NULL	NULL	2450	NULL	NULL	NULL
200	NULL	NULL	NULL	NULL	2450	NULL	NULL	NULL
200	NULL	NULL	NULL	NULL	2450	NULL	NULL	NULL
200	CLARK	MANAGER	7839	1986-12-12	2450	NULL	10	9999
200	CLARK	MANAGER	7839	1986-12-12	2450	NULL	10	9999
200	CLARK	MANAGER	7839	1986-12-12	2450	NULL	10	9999
200	CLARK	MANAGER	7839	1986-12-12	2450	NULL	10	9999
300	NULL	NULL	NULL	NULL	3000	NULL	NULL	NULL
300	NULL	NULL	NULL	NULL	3000	NULL	NULL	NULL
300	NULL	NULL	NULL	NULL	3000	NULL	NULL	NULL
300	NULL	NULL	NULL	NULL	3000	NULL	NULL	NULL
300	NULL	NULL	NULL	NULL	3000	NULL	NULL	NULL
300	SCOTT	ANALYST	7566	1987-12-12	3000	NULL	20	9999
300	SCOTT	ANALYST	7566	1987-12-12	3000	NULL	20	9999
400	NULL	NULL	NULL	NULL	5000	NULL	NULL	NULL
400	NULL	NULL	NULL	NULL	5000	NULL	NULL	NULL
400	NULL	NULL	NULL	NULL	5000	NULL	NULL	NULL
400	NULL	NULL	NULL	NULL	5000	NULL	NULL	NULL
400	NULL	NULL	NULL	NULL	5000	NULL	NULL	NULL
400	KING	PRESIDENT	NULL	1988-12-12	5000	NULL	10	9999
400	KING	PRESIDENT	NULL	1988-12-12	5000	NULL	10	9999
1000	NULL	NULL	NULL	NULL	1500	NULL	NULL	NULL
1000	NULL	NULL	NULL	NULL	1500	NULL	NULL	NULL
1000	NULL	NULL	NULL	NULL	1500	NULL	NULL	NULL
1000	NULL	NULL	NULL	NULL	1500	NULL	NULL	NULL
1000	NULL	NULL	NULL	NULL	1500	NULL	NULL	NULL
1000	NULL	NULL	NULL	NULL	3000	NULL	NULL	NULL
1000	NULL	NULL	NULL	NULL	3000	NULL	NULL	NULL
1000	NULL	NULL	NULL	NULL	3000	NULL	NULL	NULL
1000	NULL	NULL	NULL	NULL	3000	NULL	NULL	NULL
1000	NULL	NULL	NULL	NULL	3000	NULL	NULL	NULL
1000	FORD	ANALYST	7566	1992-12-12	3000	NULL	20	9999
1000	FORD	ANALYST	7566	1992-12-12	3000	NULL	20	9999
1000	TURNER	SALESMAN	7698	1989-12-12	1500	0	30	9999
1000	TURNER	SALESMAN	7698	1989-12-12	1500	0	30	9999
2000	NULL	NULL	NULL	NULL	1100	NULL	NULL	NULL
2000	NULL	NULL	NULL	NULL	1100	NULL	NULL	NULL
2000	NULL	NULL	NULL	NULL	1100	NULL	NULL	NULL
2000	NULL	NULL	NULL	NULL	1100	NULL	NULL	NULL
2000	NULL	NULL	NULL	NULL	1100	NULL	NULL	NULL
2000	ADAMS	CLERK	7788	1990-12-12	1100	NULL	20	9999
2000	ADAMS	CLERK	7788	1990-12-12	1100	NULL	20	9999
3000	NULL	NULL	NULL	NULL	950	NULL	NULL	NULL
3000	NULL	NULL	NULL	NULL	950	NULL	NULL	NULL
3000	NULL	NULL	NULL	NULL	950	NULL	NULL	NULL
3000	NULL	NULL	NULL	NULL	950	NULL	NULL	NULL
3000	NULL	NULL	NULL	NULL	950	NULL	NULL	NULL
3000	JAMES	CLERK	7698	1991-12-12	950	NULL	30	9999
3000	JAMES	CLERK	7698	1991-12-12	950	NULL	30	9999
5000	NULL	NULL	NULL	NULL	1300	NULL	NULL	NULL
5000	NULL	NULL	NULL	NULL	1300	NULL	NULL	NULL
5000	NULL	NULL	NULL	NULL	1300	NULL	NULL	NULL
5000	NULL	NULL	NULL	NULL	1300	NULL	NULL	NULL
5000	NULL	NULL	NULL	NULL	1300	NULL	NULL	NULL
5000	MILLER	CLERK	7782	1993-12-12	1300	NULL	10	9999
5000	MILLER	CLERK	7782	1993-12-12	1300	NULL	10	9999
SELECT   *  FROM   (SELECT     *      FROM    EMP001      INTERSECT    select    *     FROM    EMP002)  e      ORDER  BY e.empno,e.ename,e.job,e.mgr,e.hiredate,e.sal,e.comm,e.deptno;
empno	ename	job	mgr	hiredate	sal	comm	deptno	comid
1	SMITH	CLERK	7902	1980-12-12	800	NULL	20	9999
2	ALLEN	SALESMAN	7698	1981-12-12	1600	300	30	9999
3	WARD	SALESMAN	7698	1982-12-12	1250	500	30	9999
4	JONES	MANAGER	7839	1983-12-12	2975	NULL	20	9999
5	MARTIN	SALESMAN	7698	1984-12-12	1250	1400	30	9999
100	BLAKE	MANAGER	7839	1985-12-12	2850	NULL	30	9999
200	CLARK	MANAGER	7839	1986-12-12	2450	NULL	10	9999
300	SCOTT	ANALYST	7566	1987-12-12	3000	NULL	20	9999
400	KING	PRESIDENT	NULL	1988-12-12	5000	NULL	10	9999
1000	FORD	ANALYST	7566	1992-12-12	3000	NULL	20	9999
1000	TURNER	SALESMAN	7698	1989-12-12	1500	0	30	9999
2000	ADAMS	CLERK	7788	1990-12-12	1100	NULL	20	9999
3000	JAMES	CLERK	7698	1991-12-12	950	NULL	30	9999
5000	MILLER	CLERK	7782	1993-12-12	1300	NULL	10	9999
minus-3-2-4    根据表插入
INSERT INTO  EMP001   SELECT   *   FROM    EMP001      minus    select    *    FROM    EMP002;
INSERT INTO  EMP001   SELECT   *   FROM    EMP001      INTERSECT    select    *    FROM    EMP002;
INSERT INTO  EMP001   SELECT   *   FROM    EMP001      UNION    select    *    FROM    EMP002;
INSERT INTO  EMP001   SELECT   *   FROM    EMP001      UNION  all    select    *    FROM    EMP002;
SELECT   *  FROM   (SELECT     *      FROM    EMP001      minus    select    *     FROM    EMP002)  e   ORDER  BY e.empno,e.ename,e.job,e.mgr,e.hiredate,e.sal,e.comm,e.deptno;
empno	ename	job	mgr	hiredate	sal	comm	deptno	comid
1	NULL	NULL	NULL	NULL	800	NULL	NULL	NULL
2	NULL	NULL	NULL	NULL	1600	NULL	NULL	NULL
3	NULL	NULL	NULL	NULL	1250	NULL	NULL	NULL
4	NULL	NULL	NULL	NULL	2975	NULL	NULL	NULL
5	NULL	NULL	NULL	NULL	1250	NULL	NULL	NULL
100	NULL	NULL	NULL	NULL	2850	NULL	NULL	NULL
200	NULL	NULL	NULL	NULL	2450	NULL	NULL	NULL
300	NULL	NULL	NULL	NULL	3000	NULL	NULL	NULL
400	NULL	NULL	NULL	NULL	5000	NULL	NULL	NULL
1000	NULL	NULL	NULL	NULL	1500	NULL	NULL	NULL
1000	NULL	NULL	NULL	NULL	3000	NULL	NULL	NULL
2000	NULL	NULL	NULL	NULL	1100	NULL	NULL	NULL
3000	NULL	NULL	NULL	NULL	950	NULL	NULL	NULL
5000	NULL	NULL	NULL	NULL	1300	NULL	NULL	NULL
SELECT   *  FROM   (SELECT     *      FROM    EMP001      UNION    select    *     FROM    EMP002)  e     ORDER  BY e.empno,e.ename,e.job,e.mgr,e.hiredate,e.sal,e.comm,e.deptno;
empno	ename	job	mgr	hiredate	sal	comm	deptno	comid
1	NULL	NULL	NULL	NULL	800	NULL	NULL	NULL
1	SMITH	CLERK	7902	1980-12-12	800	NULL	20	9999
2	NULL	NULL	NULL	NULL	1600	NULL	NULL	NULL
2	ALLEN	SALESMAN	7698	1981-12-12	1600	300	30	9999
3	NULL	NULL	NULL	NULL	1250	NULL	NULL	NULL
3	WARD	SALESMAN	7698	1982-12-12	1250	500	30	9999
4	NULL	NULL	NULL	NULL	2975	NULL	NULL	NULL
4	JONES	MANAGER	7839	1983-12-12	2975	NULL	20	9999
5	NULL	NULL	NULL	NULL	1250	NULL	NULL	NULL
5	MARTIN	SALESMAN	7698	1984-12-12	1250	1400	30	9999
100	NULL	NULL	NULL	NULL	2850	NULL	NULL	NULL
100	BLAKE	MANAGER	7839	1985-12-12	2850	NULL	30	9999
200	NULL	NULL	NULL	NULL	2450	NULL	NULL	NULL
200	CLARK	MANAGER	7839	1986-12-12	2450	NULL	10	9999
300	NULL	NULL	NULL	NULL	3000	NULL	NULL	NULL
300	SCOTT	ANALYST	7566	1987-12-12	3000	NULL	20	9999
400	NULL	NULL	NULL	NULL	5000	NULL	NULL	NULL
400	KING	PRESIDENT	NULL	1988-12-12	5000	NULL	10	9999
1000	NULL	NULL	NULL	NULL	1500	NULL	NULL	NULL
1000	NULL	NULL	NULL	NULL	3000	NULL	NULL	NULL
1000	FORD	ANALYST	7566	1992-12-12	3000	NULL	20	9999
1000	TURNER	SALESMAN	7698	1989-12-12	1500	0	30	9999
2000	NULL	NULL	NULL	NULL	1100	NULL	NULL	NULL
2000	ADAMS	CLERK	7788	1990-12-12	1100	NULL	20	9999
3000	NULL	NULL	NULL	NULL	950	NULL	NULL	NULL
3000	JAMES	CLERK	7698	1991-12-12	950	NULL	30	9999
5000	NULL	NULL	NULL	NULL	1300	NULL	NULL	NULL
5000	MILLER	CLERK	7782	1993-12-12	1300	NULL	10	9999
SELECT   *  FROM   (SELECT     *      FROM    EMP001      UNION  all    select    *     FROM    EMP002)  e      ORDER  BY e.empno,e.ename,e.job,e.mgr,e.hiredate,e.sal,e.comm,e.deptno;
empno	ename	job	mgr	hiredate	sal	comm	deptno	comid
1	NULL	NULL	NULL	NULL	800	NULL	NULL	NULL
1	NULL	NULL	NULL	NULL	800	NULL	NULL	NULL
1	NULL	NULL	NULL	NULL	800	NULL	NULL	NULL
1	NULL	NULL	NULL	NULL	800	NULL	NULL	NULL
1	NULL	NULL	NULL	NULL	800	NULL	NULL	NULL
1	NULL	NULL	NULL	NULL	800	NULL	NULL	NULL
1	NULL	NULL	NULL	NULL	800	NULL	NULL	NULL
1	NULL	NULL	NULL	NULL	800	NULL	NULL	NULL
1	NULL	NULL	NULL	NULL	800	NULL	NULL	NULL
1	NULL	NULL	NULL	NULL	800	NULL	NULL	NULL
1	NULL	NULL	NULL	NULL	800	NULL	NULL	NULL
1	NULL	NULL	NULL	NULL	800	NULL	NULL	NULL
1	NULL	NULL	NULL	NULL	800	NULL	NULL	NULL
1	NULL	NULL	NULL	NULL	800	NULL	NULL	NULL
1	SMITH	CLERK	7902	1980-12-12	800	NULL	20	9999
1	SMITH	CLERK	7902	1980-12-12	800	NULL	20	9999
1	SMITH	CLERK	7902	1980-12-12	800	NULL	20	9999
1	SMITH	CLERK	7902	1980-12-12	800	NULL	20	9999
1	SMITH	CLERK	7902	1980-12-12	800	NULL	20	9999
1	SMITH	CLERK	7902	1980-12-12	800	NULL	20	9999
1	SMITH	CLERK	7902	1980-12-12	800	NULL	20	9999
1	SMITH	CLERK	7902	1980-12-12	800	NULL	20	9999
2	NULL	NULL	NULL	NULL	1600	NULL	NULL	NULL
2	NULL	NULL	NULL	NULL	1600	NULL	NULL	NULL
2	NULL	NULL	NULL	NULL	1600	NULL	NULL	NULL
2	NULL	NULL	NULL	NULL	1600	NULL	NULL	NULL
2	NULL	NULL	NULL	NULL	1600	NULL	NULL	NULL
2	NULL	NULL	NULL	NULL	1600	NULL	NULL	NULL
2	NULL	NULL	NULL	NULL	1600	NULL	NULL	NULL
2	NULL	NULL	NULL	NULL	1600	NULL	NULL	NULL
2	NULL	NULL	NULL	NULL	1600	NULL	NULL	NULL
2	NULL	NULL	NULL	NULL	1600	NULL	NULL	NULL
2	NULL	NULL	NULL	NULL	1600	NULL	NULL	NULL
2	NULL	NULL	NULL	NULL	1600	NULL	NULL	NULL
2	NULL	NULL	NULL	NULL	1600	NULL	NULL	NULL
2	NULL	NULL	NULL	NULL	1600	NULL	NULL	NULL
2	ALLEN	SALESMAN	7698	1981-12-12	1600	300	30	9999
2	ALLEN	SALESMAN	7698	1981-12-12	1600	300	30	9999
2	ALLEN	SALESMAN	7698	1981-12-12	1600	300	30	9999
2	ALLEN	SALESMAN	7698	1981-12-12	1600	300	30	9999
2	ALLEN	SALESMAN	7698	1981-12-12	1600	300	30	9999
2	ALLEN	SALESMAN	7698	1981-12-12	1600	300	30	9999
2	ALLEN	SALESMAN	7698	1981-12-12	1600	300	30	9999
2	ALLEN	SALESMAN	7698	1981-12-12	1600	300	30	9999
3	NULL	NULL	NULL	NULL	1250	NULL	NULL	NULL
3	NULL	NULL	NULL	NULL	1250	NULL	NULL	NULL
3	NULL	NULL	NULL	NULL	1250	NULL	NULL	NULL
3	NULL	NULL	NULL	NULL	1250	NULL	NULL	NULL
3	NULL	NULL	NULL	NULL	1250	NULL	NULL	NULL
3	NULL	NULL	NULL	NULL	1250	NULL	NULL	NULL
3	NULL	NULL	NULL	NULL	1250	NULL	NULL	NULL
3	NULL	NULL	NULL	NULL	1250	NULL	NULL	NULL
3	NULL	NULL	NULL	NULL	1250	NULL	NULL	NULL
3	NULL	NULL	NULL	NULL	1250	NULL	NULL	NULL
3	NULL	NULL	NULL	NULL	1250	NULL	NULL	NULL
3	NULL	NULL	NULL	NULL	1250	NULL	NULL	NULL
3	NULL	NULL	NULL	NULL	1250	NULL	NULL	NULL
3	NULL	NULL	NULL	NULL	1250	NULL	NULL	NULL
3	WARD	SALESMAN	7698	1982-12-12	1250	500	30	9999
3	WARD	SALESMAN	7698	1982-12-12	1250	500	30	9999
3	WARD	SALESMAN	7698	1982-12-12	1250	500	30	9999
3	WARD	SALESMAN	7698	1982-12-12	1250	500	30	9999
3	WARD	SALESMAN	7698	1982-12-12	1250	500	30	9999
3	WARD	SALESMAN	7698	1982-12-12	1250	500	30	9999
3	WARD	SALESMAN	7698	1982-12-12	1250	500	30	9999
3	WARD	SALESMAN	7698	1982-12-12	1250	500	30	9999
4	NULL	NULL	NULL	NULL	2975	NULL	NULL	NULL
4	NULL	NULL	NULL	NULL	2975	NULL	NULL	NULL
4	NULL	NULL	NULL	NULL	2975	NULL	NULL	NULL
4	NULL	NULL	NULL	NULL	2975	NULL	NULL	NULL
4	NULL	NULL	NULL	NULL	2975	NULL	NULL	NULL
4	NULL	NULL	NULL	NULL	2975	NULL	NULL	NULL
4	NULL	NULL	NULL	NULL	2975	NULL	NULL	NULL
4	NULL	NULL	NULL	NULL	2975	NULL	NULL	NULL
4	NULL	NULL	NULL	NULL	2975	NULL	NULL	NULL
4	NULL	NULL	NULL	NULL	2975	NULL	NULL	NULL
4	NULL	NULL	NULL	NULL	2975	NULL	NULL	NULL
4	NULL	NULL	NULL	NULL	2975	NULL	NULL	NULL
4	NULL	NULL	NULL	NULL	2975	NULL	NULL	NULL
4	NULL	NULL	NULL	NULL	2975	NULL	NULL	NULL
4	JONES	MANAGER	7839	1983-12-12	2975	NULL	20	9999
4	JONES	MANAGER	7839	1983-12-12	2975	NULL	20	9999
4	JONES	MANAGER	7839	1983-12-12	2975	NULL	20	9999
4	JONES	MANAGER	7839	1983-12-12	2975	NULL	20	9999
4	JONES	MANAGER	7839	1983-12-12	2975	NULL	20	9999
4	JONES	MANAGER	7839	1983-12-12	2975	NULL	20	9999
4	JONES	MANAGER	7839	1983-12-12	2975	NULL	20	9999
4	JONES	MANAGER	7839	1983-12-12	2975	NULL	20	9999
5	NULL	NULL	NULL	NULL	1250	NULL	NULL	NULL
5	NULL	NULL	NULL	NULL	1250	NULL	NULL	NULL
5	NULL	NULL	NULL	NULL	1250	NULL	NULL	NULL
5	NULL	NULL	NULL	NULL	1250	NULL	NULL	NULL
5	NULL	NULL	NULL	NULL	1250	NULL	NULL	NULL
5	NULL	NULL	NULL	NULL	1250	NULL	NULL	NULL
5	NULL	NULL	NULL	NULL	1250	NULL	NULL	NULL
5	NULL	NULL	NULL	NULL	1250	NULL	NULL	NULL
5	NULL	NULL	NULL	NULL	1250	NULL	NULL	NULL
5	NULL	NULL	NULL	NULL	1250	NULL	NULL	NULL
5	NULL	NULL	NULL	NULL	1250	NULL	NULL	NULL
5	NULL	NULL	NULL	NULL	1250	NULL	NULL	NULL
5	NULL	NULL	NULL	NULL	1250	NULL	NULL	NULL
5	NULL	NULL	NULL	NULL	1250	NULL	NULL	NULL
5	MARTIN	SALESMAN	7698	1984-12-12	1250	1400	30	9999
5	MARTIN	SALESMAN	7698	1984-12-12	1250	1400	30	9999
5	MARTIN	SALESMAN	7698	1984-12-12	1250	1400	30	9999
5	MARTIN	SALESMAN	7698	1984-12-12	1250	1400	30	9999
5	MARTIN	SALESMAN	7698	1984-12-12	1250	1400	30	9999
5	MARTIN	SALESMAN	7698	1984-12-12	1250	1400	30	9999
5	MARTIN	SALESMAN	7698	1984-12-12	1250	1400	30	9999
5	MARTIN	SALESMAN	7698	1984-12-12	1250	1400	30	9999
100	NULL	NULL	NULL	NULL	2850	NULL	NULL	NULL
100	NULL	NULL	NULL	NULL	2850	NULL	NULL	NULL
100	NULL	NULL	NULL	NULL	2850	NULL	NULL	NULL
100	NULL	NULL	NULL	NULL	2850	NULL	NULL	NULL
100	NULL	NULL	NULL	NULL	2850	NULL	NULL	NULL
100	NULL	NULL	NULL	NULL	2850	NULL	NULL	NULL
100	NULL	NULL	NULL	NULL	2850	NULL	NULL	NULL
100	NULL	NULL	NULL	NULL	2850	NULL	NULL	NULL
100	NULL	NULL	NULL	NULL	2850	NULL	NULL	NULL
100	NULL	NULL	NULL	NULL	2850	NULL	NULL	NULL
100	NULL	NULL	NULL	NULL	2850	NULL	NULL	NULL
100	NULL	NULL	NULL	NULL	2850	NULL	NULL	NULL
100	NULL	NULL	NULL	NULL	2850	NULL	NULL	NULL
100	NULL	NULL	NULL	NULL	2850	NULL	NULL	NULL
100	NULL	NULL	NULL	NULL	2850	NULL	NULL	NULL
100	NULL	NULL	NULL	NULL	2850	NULL	NULL	NULL
100	NULL	NULL	NULL	NULL	2850	NULL	NULL	NULL
100	NULL	NULL	NULL	NULL	2850	NULL	NULL	NULL
100	BLAKE	MANAGER	7839	1985-12-12	2850	NULL	30	9999
100	BLAKE	MANAGER	7839	1985-12-12	2850	NULL	30	9999
100	BLAKE	MANAGER	7839	1985-12-12	2850	NULL	30	9999
100	BLAKE	MANAGER	7839	1985-12-12	2850	NULL	30	9999
100	BLAKE	MANAGER	7839	1985-12-12	2850	NULL	30	9999
100	BLAKE	MANAGER	7839	1985-12-12	2850	NULL	30	9999
100	BLAKE	MANAGER	7839	1985-12-12	2850	NULL	30	9999
100	BLAKE	MANAGER	7839	1985-12-12	2850	NULL	30	9999
100	BLAKE	MANAGER	7839	1985-12-12	2850	NULL	30	9999
100	BLAKE	MANAGER	7839	1985-12-12	2850	NULL	30	9999
100	BLAKE	MANAGER	7839	1985-12-12	2850	NULL	30	9999
100	BLAKE	MANAGER	7839	1985-12-12	2850	NULL	30	9999
200	NULL	NULL	NULL	NULL	2450	NULL	NULL	NULL
200	NULL	NULL	NULL	NULL	2450	NULL	NULL	NULL
200	NULL	NULL	NULL	NULL	2450	NULL	NULL	NULL
200	NULL	NULL	NULL	NULL	2450	NULL	NULL	NULL
200	NULL	NULL	NULL	NULL	2450	NULL	NULL	NULL
200	NULL	NULL	NULL	NULL	2450	NULL	NULL	NULL
200	NULL	NULL	NULL	NULL	2450	NULL	NULL	NULL
200	NULL	NULL	NULL	NULL	2450	NULL	NULL	NULL
200	NULL	NULL	NULL	NULL	2450	NULL	NULL	NULL
200	NULL	NULL	NULL	NULL	2450	NULL	NULL	NULL
200	NULL	NULL	NULL	NULL	2450	NULL	NULL	NULL
200	NULL	NULL	NULL	NULL	2450	NULL	NULL	NULL
200	NULL	NULL	NULL	NULL	2450	NULL	NULL	NULL
200	NULL	NULL	NULL	NULL	2450	NULL	NULL	NULL
200	NULL	NULL	NULL	NULL	2450	NULL	NULL	NULL
200	NULL	NULL	NULL	NULL	2450	NULL	NULL	NULL
200	NULL	NULL	NULL	NULL	2450	NULL	NULL	NULL
200	NULL	NULL	NULL	NULL	2450	NULL	NULL	NULL
200	CLARK	MANAGER	7839	1986-12-12	2450	NULL	10	9999
200	CLARK	MANAGER	7839	1986-12-12	2450	NULL	10	9999
200	CLARK	MANAGER	7839	1986-12-12	2450	NULL	10	9999
200	CLARK	MANAGER	7839	1986-12-12	2450	NULL	10	9999
200	CLARK	MANAGER	7839	1986-12-12	2450	NULL	10	9999
200	CLARK	MANAGER	7839	1986-12-12	2450	NULL	10	9999
200	CLARK	MANAGER	7839	1986-12-12	2450	NULL	10	9999
200	CLARK	MANAGER	7839	1986-12-12	2450	NULL	10	9999
200	CLARK	MANAGER	7839	1986-12-12	2450	NULL	10	9999
200	CLARK	MANAGER	7839	1986-12-12	2450	NULL	10	9999
200	CLARK	MANAGER	7839	1986-12-12	2450	NULL	10	9999
200	CLARK	MANAGER	7839	1986-12-12	2450	NULL	10	9999
300	NULL	NULL	NULL	NULL	3000	NULL	NULL	NULL
300	NULL	NULL	NULL	NULL	3000	NULL	NULL	NULL
300	NULL	NULL	NULL	NULL	3000	NULL	NULL	NULL
300	NULL	NULL	NULL	NULL	3000	NULL	NULL	NULL
300	NULL	NULL	NULL	NULL	3000	NULL	NULL	NULL
300	NULL	NULL	NULL	NULL	3000	NULL	NULL	NULL
300	NULL	NULL	NULL	NULL	3000	NULL	NULL	NULL
300	NULL	NULL	NULL	NULL	3000	NULL	NULL	NULL
300	NULL	NULL	NULL	NULL	3000	NULL	NULL	NULL
300	NULL	NULL	NULL	NULL	3000	NULL	NULL	NULL
300	NULL	NULL	NULL	NULL	3000	NULL	NULL	NULL
300	NULL	NULL	NULL	NULL	3000	NULL	NULL	NULL
300	NULL	NULL	NULL	NULL	3000	NULL	NULL	NULL
300	NULL	NULL	NULL	NULL	3000	NULL	NULL	NULL
300	SCOTT	ANALYST	7566	1987-12-12	3000	NULL	20	9999
300	SCOTT	ANALYST	7566	1987-12-12	3000	NULL	20	9999
300	SCOTT	ANALYST	7566	1987-12-12	3000	NULL	20	9999
300	SCOTT	ANALYST	7566	1987-12-12	3000	NULL	20	9999
300	SCOTT	ANALYST	7566	1987-12-12	3000	NULL	20	9999
300	SCOTT	ANALYST	7566	1987-12-12	3000	NULL	20	9999
300	SCOTT	ANALYST	7566	1987-12-12	3000	NULL	20	9999
300	SCOTT	ANALYST	7566	1987-12-12	3000	NULL	20	9999
400	NULL	NULL	NULL	NULL	5000	NULL	NULL	NULL
400	NULL	NULL	NULL	NULL	5000	NULL	NULL	NULL
400	NULL	NULL	NULL	NULL	5000	NULL	NULL	NULL
400	NULL	NULL	NULL	NULL	5000	NULL	NULL	NULL
400	NULL	NULL	NULL	NULL	5000	NULL	NULL	NULL
400	NULL	NULL	NULL	NULL	5000	NULL	NULL	NULL
400	NULL	NULL	NULL	NULL	5000	NULL	NULL	NULL
400	NULL	NULL	NULL	NULL	5000	NULL	NULL	NULL
400	NULL	NULL	NULL	NULL	5000	NULL	NULL	NULL
400	NULL	NULL	NULL	NULL	5000	NULL	NULL	NULL
400	NULL	NULL	NULL	NULL	5000	NULL	NULL	NULL
400	NULL	NULL	NULL	NULL	5000	NULL	NULL	NULL
400	NULL	NULL	NULL	NULL	5000	NULL	NULL	NULL
400	NULL	NULL	NULL	NULL	5000	NULL	NULL	NULL
400	KING	PRESIDENT	NULL	1988-12-12	5000	NULL	10	9999
400	KING	PRESIDENT	NULL	1988-12-12	5000	NULL	10	9999
400	KING	PRESIDENT	NULL	1988-12-12	5000	NULL	10	9999
400	KING	PRESIDENT	NULL	1988-12-12	5000	NULL	10	9999
400	KING	PRESIDENT	NULL	1988-12-12	5000	NULL	10	9999
400	KING	PRESIDENT	NULL	1988-12-12	5000	NULL	10	9999
400	KING	PRESIDENT	NULL	1988-12-12	5000	NULL	10	9999
400	KING	PRESIDENT	NULL	1988-12-12	5000	NULL	10	9999
1000	NULL	NULL	NULL	NULL	1500	NULL	NULL	NULL
1000	NULL	NULL	NULL	NULL	1500	NULL	NULL	NULL
1000	NULL	NULL	NULL	NULL	1500	NULL	NULL	NULL
1000	NULL	NULL	NULL	NULL	1500	NULL	NULL	NULL
1000	NULL	NULL	NULL	NULL	1500	NULL	NULL	NULL
1000	NULL	NULL	NULL	NULL	1500	NULL	NULL	NULL
1000	NULL	NULL	NULL	NULL	1500	NULL	NULL	NULL
1000	NULL	NULL	NULL	NULL	1500	NULL	NULL	NULL
1000	NULL	NULL	NULL	NULL	1500	NULL	NULL	NULL
1000	NULL	NULL	NULL	NULL	1500	NULL	NULL	NULL
1000	NULL	NULL	NULL	NULL	1500	NULL	NULL	NULL
1000	NULL	NULL	NULL	NULL	1500	NULL	NULL	NULL
1000	NULL	NULL	NULL	NULL	1500	NULL	NULL	NULL
1000	NULL	NULL	NULL	NULL	1500	NULL	NULL	NULL
1000	NULL	NULL	NULL	NULL	3000	NULL	NULL	NULL
1000	NULL	NULL	NULL	NULL	3000	NULL	NULL	NULL
1000	NULL	NULL	NULL	NULL	3000	NULL	NULL	NULL
1000	NULL	NULL	NULL	NULL	3000	NULL	NULL	NULL
1000	NULL	NULL	NULL	NULL	3000	NULL	NULL	NULL
1000	NULL	NULL	NULL	NULL	3000	NULL	NULL	NULL
1000	NULL	NULL	NULL	NULL	3000	NULL	NULL	NULL
1000	NULL	NULL	NULL	NULL	3000	NULL	NULL	NULL
1000	NULL	NULL	NULL	NULL	3000	NULL	NULL	NULL
1000	NULL	NULL	NULL	NULL	3000	NULL	NULL	NULL
1000	NULL	NULL	NULL	NULL	3000	NULL	NULL	NULL
1000	NULL	NULL	NULL	NULL	3000	NULL	NULL	NULL
1000	NULL	NULL	NULL	NULL	3000	NULL	NULL	NULL
1000	NULL	NULL	NULL	NULL	3000	NULL	NULL	NULL
1000	FORD	ANALYST	7566	1992-12-12	3000	NULL	20	9999
1000	FORD	ANALYST	7566	1992-12-12	3000	NULL	20	9999
1000	FORD	ANALYST	7566	1992-12-12	3000	NULL	20	9999
1000	FORD	ANALYST	7566	1992-12-12	3000	NULL	20	9999
1000	FORD	ANALYST	7566	1992-12-12	3000	NULL	20	9999
1000	FORD	ANALYST	7566	1992-12-12	3000	NULL	20	9999
1000	FORD	ANALYST	7566	1992-12-12	3000	NULL	20	9999
1000	FORD	ANALYST	7566	1992-12-12	3000	NULL	20	9999
1000	TURNER	SALESMAN	7698	1989-12-12	1500	0	30	9999
1000	TURNER	SALESMAN	7698	1989-12-12	1500	0	30	9999
1000	TURNER	SALESMAN	7698	1989-12-12	1500	0	30	9999
1000	TURNER	SALESMAN	7698	1989-12-12	1500	0	30	9999
1000	TURNER	SALESMAN	7698	1989-12-12	1500	0	30	9999
1000	TURNER	SALESMAN	7698	1989-12-12	1500	0	30	9999
1000	TURNER	SALESMAN	7698	1989-12-12	1500	0	30	9999
1000	TURNER	SALESMAN	7698	1989-12-12	1500	0	30	9999
2000	NULL	NULL	NULL	NULL	1100	NULL	NULL	NULL
2000	NULL	NULL	NULL	NULL	1100	NULL	NULL	NULL
2000	NULL	NULL	NULL	NULL	1100	NULL	NULL	NULL
2000	NULL	NULL	NULL	NULL	1100	NULL	NULL	NULL
2000	NULL	NULL	NULL	NULL	1100	NULL	NULL	NULL
2000	NULL	NULL	NULL	NULL	1100	NULL	NULL	NULL
2000	NULL	NULL	NULL	NULL	1100	NULL	NULL	NULL
2000	NULL	NULL	NULL	NULL	1100	NULL	NULL	NULL
2000	NULL	NULL	NULL	NULL	1100	NULL	NULL	NULL
2000	NULL	NULL	NULL	NULL	1100	NULL	NULL	NULL
2000	NULL	NULL	NULL	NULL	1100	NULL	NULL	NULL
2000	NULL	NULL	NULL	NULL	1100	NULL	NULL	NULL
2000	NULL	NULL	NULL	NULL	1100	NULL	NULL	NULL
2000	NULL	NULL	NULL	NULL	1100	NULL	NULL	NULL
2000	ADAMS	CLERK	7788	1990-12-12	1100	NULL	20	9999
2000	ADAMS	CLERK	7788	1990-12-12	1100	NULL	20	9999
2000	ADAMS	CLERK	7788	1990-12-12	1100	NULL	20	9999
2000	ADAMS	CLERK	7788	1990-12-12	1100	NULL	20	9999
2000	ADAMS	CLERK	7788	1990-12-12	1100	NULL	20	9999
2000	ADAMS	CLERK	7788	1990-12-12	1100	NULL	20	9999
2000	ADAMS	CLERK	7788	1990-12-12	1100	NULL	20	9999
2000	ADAMS	CLERK	7788	1990-12-12	1100	NULL	20	9999
3000	NULL	NULL	NULL	NULL	950	NULL	NULL	NULL
3000	NULL	NULL	NULL	NULL	950	NULL	NULL	NULL
3000	NULL	NULL	NULL	NULL	950	NULL	NULL	NULL
3000	NULL	NULL	NULL	NULL	950	NULL	NULL	NULL
3000	NULL	NULL	NULL	NULL	950	NULL	NULL	NULL
3000	NULL	NULL	NULL	NULL	950	NULL	NULL	NULL
3000	NULL	NULL	NULL	NULL	950	NULL	NULL	NULL
3000	NULL	NULL	NULL	NULL	950	NULL	NULL	NULL
3000	NULL	NULL	NULL	NULL	950	NULL	NULL	NULL
3000	NULL	NULL	NULL	NULL	950	NULL	NULL	NULL
3000	NULL	NULL	NULL	NULL	950	NULL	NULL	NULL
3000	NULL	NULL	NULL	NULL	950	NULL	NULL	NULL
3000	NULL	NULL	NULL	NULL	950	NULL	NULL	NULL
3000	NULL	NULL	NULL	NULL	950	NULL	NULL	NULL
3000	JAMES	CLERK	7698	1991-12-12	950	NULL	30	9999
3000	JAMES	CLERK	7698	1991-12-12	950	NULL	30	9999
3000	JAMES	CLERK	7698	1991-12-12	950	NULL	30	9999
3000	JAMES	CLERK	7698	1991-12-12	950	NULL	30	9999
3000	JAMES	CLERK	7698	1991-12-12	950	NULL	30	9999
3000	JAMES	CLERK	7698	1991-12-12	950	NULL	30	9999
3000	JAMES	CLERK	7698	1991-12-12	950	NULL	30	9999
3000	JAMES	CLERK	7698	1991-12-12	950	NULL	30	9999
5000	NULL	NULL	NULL	NULL	1300	NULL	NULL	NULL
5000	NULL	NULL	NULL	NULL	1300	NULL	NULL	NULL
5000	NULL	NULL	NULL	NULL	1300	NULL	NULL	NULL
5000	NULL	NULL	NULL	NULL	1300	NULL	NULL	NULL
5000	NULL	NULL	NULL	NULL	1300	NULL	NULL	NULL
5000	NULL	NULL	NULL	NULL	1300	NULL	NULL	NULL
5000	NULL	NULL	NULL	NULL	1300	NULL	NULL	NULL
5000	NULL	NULL	NULL	NULL	1300	NULL	NULL	NULL
5000	NULL	NULL	NULL	NULL	1300	NULL	NULL	NULL
5000	NULL	NULL	NULL	NULL	1300	NULL	NULL	NULL
5000	NULL	NULL	NULL	NULL	1300	NULL	NULL	NULL
5000	NULL	NULL	NULL	NULL	1300	NULL	NULL	NULL
5000	NULL	NULL	NULL	NULL	1300	NULL	NULL	NULL
5000	NULL	NULL	NULL	NULL	1300	NULL	NULL	NULL
5000	MILLER	CLERK	7782	1993-12-12	1300	NULL	10	9999
5000	MILLER	CLERK	7782	1993-12-12	1300	NULL	10	9999
5000	MILLER	CLERK	7782	1993-12-12	1300	NULL	10	9999
5000	MILLER	CLERK	7782	1993-12-12	1300	NULL	10	9999
5000	MILLER	CLERK	7782	1993-12-12	1300	NULL	10	9999
5000	MILLER	CLERK	7782	1993-12-12	1300	NULL	10	9999
5000	MILLER	CLERK	7782	1993-12-12	1300	NULL	10	9999
5000	MILLER	CLERK	7782	1993-12-12	1300	NULL	10	9999
SELECT   *  FROM   (SELECT     *      FROM    EMP001      INTERSECT    select    *     FROM    EMP002)  e      ORDER  BY e.empno,e.ename,e.job,e.mgr,e.hiredate,e.sal,e.comm,e.deptno;
empno	ename	job	mgr	hiredate	sal	comm	deptno	comid
1	SMITH	CLERK	7902	1980-12-12	800	NULL	20	9999
2	ALLEN	SALESMAN	7698	1981-12-12	1600	300	30	9999
3	WARD	SALESMAN	7698	1982-12-12	1250	500	30	9999
4	JONES	MANAGER	7839	1983-12-12	2975	NULL	20	9999
5	MARTIN	SALESMAN	7698	1984-12-12	1250	1400	30	9999
100	BLAKE	MANAGER	7839	1985-12-12	2850	NULL	30	9999
200	CLARK	MANAGER	7839	1986-12-12	2450	NULL	10	9999
300	SCOTT	ANALYST	7566	1987-12-12	3000	NULL	20	9999
400	KING	PRESIDENT	NULL	1988-12-12	5000	NULL	10	9999
1000	FORD	ANALYST	7566	1992-12-12	3000	NULL	20	9999
1000	TURNER	SALESMAN	7698	1989-12-12	1500	0	30	9999
2000	ADAMS	CLERK	7788	1990-12-12	1100	NULL	20	9999
3000	JAMES	CLERK	7698	1991-12-12	950	NULL	30	9999
5000	MILLER	CLERK	7782	1993-12-12	1300	NULL	10	9999
minus-3-2-3    插入 使用子查询        
INSERT INTO  EMP002 VALUES((SELECT  sum(empno)  FROM   (SELECT     *      FROM    EMP001      minus    select    *     FROM    EMP002)  e  ),'SMITH002','CLERK',4,'1981-12-12',9000,NULL,30,20);
INSERT INTO  EMP002 VALUES((SELECT  sum(empno)  FROM   (SELECT     *      FROM    EMP001      UNION    select    *     FROM    EMP002)  e  ),'SMITH002','CLERK',4,'1981-12-12',9000,NULL,30,20);
INSERT INTO  EMP002 VALUES((SELECT  sum(empno)  FROM   (SELECT     *      FROM    EMP001      union  all    select    *     FROM    EMP002)  e  ),'SMITH002','CLERK',4,'1981-12-12',9000,NULL,30,20);
INSERT INTO  EMP002 VALUES((SELECT  sum(empno)  FROM   (SELECT     *      FROM    EMP001      INTERSECT    select    *     FROM    EMP002)  e  ),'SMITH002','CLERK',4,'1981-12-12',9000,NULL,30,20);
INSERT INTO  EMP002 VALUES((SELECT  sum(empno)  FROM   (SELECT     *      FROM    EMP001      UNION    select    *     FROM    EMP002)  e  ),'SMITH002','CLERK',4,'1989-12-12',9000,NULL,30,20);
INSERT INTO  EMP002 VALUES((SELECT  sum(empno)  FROM   (SELECT     *      FROM    EMP001      UNION  all    select    *     FROM    EMP002)  e  ),'SMITH002','CLERK',4,'1988-11-12',9000,NULL,30,20);
INSERT INTO  EMP002 VALUES((SELECT  sum(empno)  FROM   (SELECT     *      FROM    EMP001      INTERSECT    select    *     FROM    EMP002)  e  ),'SMITH002','CLERK',4,'1908-12-12',9000,NULL,30,20);
SELECT  sum(empno)   ttt,sum(sal)  rrr FROM   (SELECT     *      FROM    EMP001      minus    select    *     FROM    EMP002)  e     GROUP  BY    empno,sal       ORDER  BY ttt,rrr;
ttt	rrr
1	800
2	1600
3	1250
4	2975
5	1250
100	2850
200	2450
300	3000
400	5000
1000	1500
1000	3000
2000	1100
3000	950
5000	1300
SELECT  sum(empno)   ttt,sum(sal)  rrr FROM   (SELECT     *      FROM    EMP001      UNION    select    *     FROM    EMP002)  e     GROUP  BY    empno,sal       ORDER  BY ttt,rrr;
ttt	rrr
2	1600
4	3200
6	2500
8	5950
10	2500
200	5700
400	4900
600	6000
800	10000
2000	3000
2000	6000
4000	2200
6000	1900
10000	2600
26030	18000
39045	9000
340790	9000
418880	9000
1113475	9000
SELECT  sum(empno)   ttt,sum(sal)  rrr FROM   (SELECT     *      FROM    EMP001      UNION all    select    *     FROM    EMP002)  e     GROUP  BY    empno,sal       ORDER  BY ttt,rrr;
ttt	rrr
22	17600
44	35200
66	27500
88	65450
110	27500
3000	85500
6000	73500
6600	66000
8800	110000
22000	33000
22000	66000
39045	9000
39045	27000
44000	24200
66000	20900
110000	28600
340790	9000
418880	9000
1113475	9000
SELECT  sum(empno)   ttt,sum(sal)  rrr FROM   (SELECT     *      FROM    EMP001      INTERSECT    select    *     FROM    EMP002)  e     GROUP  BY    empno,sal       ORDER  BY ttt,rrr;
ttt	rrr
1	800
2	1600
3	1250
4	2975
5	1250
100	2850
200	2450
300	3000
400	5000
1000	1500
1000	3000
2000	1100
3000	950
5000	1300
minus-3-2-4    插入语句中使用嵌套
INSERT INTO  EMP001  VALUES( (SELECT    9000  FROM    dual    minus     (SELECT  sum(empno)  FROM   (SELECT     *      FROM    EMP001      minus    select    *     FROM    EMP002))    ),'SMITH002','CLERK',4,'1989-12-12',9000,NULL,30,20);
INSERT INTO  EMP001  VALUES( (SELECT    9000  FROM    dual    UNION     (SELECT  sum(empno)  FROM   (SELECT     *      FROM    EMP001      minus    select    *     FROM    EMP002))    ),'SMITH002','CLERK',4,'1989-12-12',9000,NULL,30,20);
ERROR 21000: Subquery returns more than 1 row
INSERT INTO  EMP001  VALUES( (SELECT    9000  FROM    dual    UNION  all     (SELECT  sum(empno)  FROM   (SELECT     *      FROM    EMP001       UNION  all      select    *     FROM    EMP002))    ),'SMITH002','CLERK',4,'1989-12-12',9000,NULL,30,20);
ERROR 21000: Subquery returns more than 1 row
INSERT INTO  EMP001  VALUES( (SELECT    9000  FROM    dual    INTERSECT     (SELECT  sum(empno)  FROM   (SELECT     *      FROM    EMP001      minus    select    *     FROM    EMP002))    ),'SMITH002','CLERK',4,'1989-12-12',9000,NULL,30,20);
minus-3-3      update语句              
UPDATE    EMP001  e  SET    e.empno =(SELECT  sum(empno)     FROM   (SELECT     *      FROM    EMP001      minus    select    *     FROM    EMP002) r);
SELECT  sum(empno)     FROM       EMP001    e ;
sum(empno)
6824650
UPDATE    EMP001  e  SET    e.empno =(SELECT  sum(empno)     FROM   (SELECT     *      FROM    EMP001      UNION    select    *     FROM    EMP002) r);
SELECT  sum(empno)     FROM       EMP001    e ;
sum(empno)
789148400
UPDATE    EMP001  e  SET    e.empno =(SELECT  sum(empno)     FROM   (SELECT     *      FROM    EMP001      UNION  all    select    *     FROM    EMP002)r);
SELECT  sum(empno)     FROM       EMP001    e ;
sum(empno)
245245014500
UPDATE    EMP001  e  SET    e.empno =(SELECT  sum(empno)     FROM   (SELECT     *      FROM    EMP001      INTERSECT    select    *     FROM    EMP002)r);
SELECT  sum(empno)     FROM       EMP001    e ;
sum(empno)
NULL
minus-3-4        delete 语句                 
DELETE  FROM     EMP001    e    WHERE   e.empno <(SELECT  sum(empno)     FROM   (SELECT     *      FROM    EMP001      minus    select    *     FROM    EMP002)r);
SELECT  sum(empno)     FROM       EMP001    e ;
sum(empno)
NULL
DELETE  FROM     EMP001    e    WHERE   e.empno <(SELECT  sum(empno)     FROM   (SELECT     *      FROM    EMP001      UNION    select    *     FROM    EMP002)r);
SELECT  sum(empno)     FROM       EMP001    e ;
sum(empno)
NULL
DELETE  FROM     EMP001    e    WHERE   e.empno <(SELECT  sum(empno)     FROM   (SELECT     *      FROM    EMP001      UNION  all    select    *     FROM    EMP002)r);
SELECT  sum(empno)     FROM       EMP001    e ;
sum(empno)
NULL
DELETE  FROM     EMP001    e    WHERE   e.empno <(SELECT  sum(empno)     FROM   (SELECT     *      FROM    EMP001    INTERSECT      select    *     FROM    EMP002)r);
SELECT  sum(empno)     FROM       EMP001    e ;
sum(empno)
NULL
minus-3-5      CASE WHEN语句
SELECT   sum(empno)  eee,  COUNT (CASE WHEN  (SELECT    10    FROM    dual      minus    select   50   FROM    dual)>50  THEN 1 
ELSE       NULL      END) rrr     FROM    EMP001 e    GROUP  BY e.empno,e.sal   ORDER BY  eee,rrr;
eee	rrr
NULL	0
NULL	0
NULL	0
NULL	0
NULL	0
NULL	0
NULL	0
NULL	0
NULL	0
NULL	0
NULL	0
NULL	0
NULL	0
SELECT   sum(empno)  eee,  COUNT (CASE WHEN  (SELECT    10    FROM    dual      INTERSECT    select   50   FROM    dual)>50  THEN 1 
ELSE       NULL      END) rrr     FROM    EMP001 e    GROUP  BY e.empno,e.sal   ORDER BY  eee,rrr;
eee	rrr
NULL	0
NULL	0
NULL	0
NULL	0
NULL	0
NULL	0
NULL	0
NULL	0
NULL	0
NULL	0
NULL	0
NULL	0
NULL	0
drop   table  if  exists   emp001;
drop   table  if  exists   emp002;
create table  emp001   as select * from   emp;
create table  emp002   as select * from   emp;
DROP TABLE  IF exists    EMP001_VIEW;
CREATE OR  REPLACE  VIEW EMP001_VIEW AS   SELECT  *    FROM   EMP001;
DROP TABLE  IF exists    EMP002_VIEW;
CREATE OR  REPLACE  VIEW EMP002_VIEW AS   SELECT  *    FROM   EMP002;
minus-4-1-1-1-1    select     select 普通查询           
SELECT   *  FROM   (SELECT     *      FROM    EMP001_VIEW      minus    select    *     FROM    EMP002_VIEW)  e   ORDER  BY  e.EMPNO,e.HIREDATE,e.sal;
empno	ename	job	mgr	hiredate	sal	comm	deptno	comid
SELECT   *  FROM   (SELECT     *      FROM    EMP001_VIEW      UNION    select    *     FROM    EMP002_VIEW)  e   ORDER  BY  e.EMPNO,e.HIREDATE,e.sal;
empno	ename	job	mgr	hiredate	sal	comm	deptno	comid
1	SMITH	CLERK	7902	1980-12-12	800	NULL	20	9999
2	ALLEN	SALESMAN	7698	1981-12-12	1600	300	30	9999
3	WARD	SALESMAN	7698	1982-12-12	1250	500	30	9999
4	JONES	MANAGER	7839	1983-12-12	2975	NULL	20	9999
5	MARTIN	SALESMAN	7698	1984-12-12	1250	1400	30	9999
100	BLAKE	MANAGER	7839	1985-12-12	2850	NULL	30	9999
200	CLARK	MANAGER	7839	1986-12-12	2450	NULL	10	9999
300	SCOTT	ANALYST	7566	1987-12-12	3000	NULL	20	9999
400	KING	PRESIDENT	NULL	1988-12-12	5000	NULL	10	9999
1000	TURNER	SALESMAN	7698	1989-12-12	1500	0	30	9999
1000	FORD	ANALYST	7566	1992-12-12	3000	NULL	20	9999
2000	ADAMS	CLERK	7788	1990-12-12	1100	NULL	20	9999
3000	JAMES	CLERK	7698	1991-12-12	950	NULL	30	9999
5000	MILLER	CLERK	7782	1993-12-12	1300	NULL	10	9999
SELECT   *  FROM   (SELECT     *      FROM    EMP001_VIEW      UNION   all    select    *     FROM    EMP002_VIEW)  e   ORDER  BY  e.EMPNO,e.HIREDATE,e.sal;
empno	ename	job	mgr	hiredate	sal	comm	deptno	comid
1	SMITH	CLERK	7902	1980-12-12	800	NULL	20	9999
1	SMITH	CLERK	7902	1980-12-12	800	NULL	20	9999
2	ALLEN	SALESMAN	7698	1981-12-12	1600	300	30	9999
2	ALLEN	SALESMAN	7698	1981-12-12	1600	300	30	9999
3	WARD	SALESMAN	7698	1982-12-12	1250	500	30	9999
3	WARD	SALESMAN	7698	1982-12-12	1250	500	30	9999
4	JONES	MANAGER	7839	1983-12-12	2975	NULL	20	9999
4	JONES	MANAGER	7839	1983-12-12	2975	NULL	20	9999
5	MARTIN	SALESMAN	7698	1984-12-12	1250	1400	30	9999
5	MARTIN	SALESMAN	7698	1984-12-12	1250	1400	30	9999
100	BLAKE	MANAGER	7839	1985-12-12	2850	NULL	30	9999
100	BLAKE	MANAGER	7839	1985-12-12	2850	NULL	30	9999
100	BLAKE	MANAGER	7839	1985-12-12	2850	NULL	30	9999
100	BLAKE	MANAGER	7839	1985-12-12	2850	NULL	30	9999
200	CLARK	MANAGER	7839	1986-12-12	2450	NULL	10	9999
200	CLARK	MANAGER	7839	1986-12-12	2450	NULL	10	9999
200	CLARK	MANAGER	7839	1986-12-12	2450	NULL	10	9999
200	CLARK	MANAGER	7839	1986-12-12	2450	NULL	10	9999
300	SCOTT	ANALYST	7566	1987-12-12	3000	NULL	20	9999
300	SCOTT	ANALYST	7566	1987-12-12	3000	NULL	20	9999
400	KING	PRESIDENT	NULL	1988-12-12	5000	NULL	10	9999
400	KING	PRESIDENT	NULL	1988-12-12	5000	NULL	10	9999
1000	TURNER	SALESMAN	7698	1989-12-12	1500	0	30	9999
1000	TURNER	SALESMAN	7698	1989-12-12	1500	0	30	9999
1000	FORD	ANALYST	7566	1992-12-12	3000	NULL	20	9999
1000	FORD	ANALYST	7566	1992-12-12	3000	NULL	20	9999
2000	ADAMS	CLERK	7788	1990-12-12	1100	NULL	20	9999
2000	ADAMS	CLERK	7788	1990-12-12	1100	NULL	20	9999
3000	JAMES	CLERK	7698	1991-12-12	950	NULL	30	9999
3000	JAMES	CLERK	7698	1991-12-12	950	NULL	30	9999
5000	MILLER	CLERK	7782	1993-12-12	1300	NULL	10	9999
5000	MILLER	CLERK	7782	1993-12-12	1300	NULL	10	9999
SELECT   *  FROM   (SELECT     *      FROM    EMP001_VIEW      INTERSECT    select    *     FROM    EMP002_VIEW)  e   ORDER  BY  e.EMPNO,e.HIREDATE,e.sal;
empno	ename	job	mgr	hiredate	sal	comm	deptno	comid
1	SMITH	CLERK	7902	1980-12-12	800	NULL	20	9999
2	ALLEN	SALESMAN	7698	1981-12-12	1600	300	30	9999
3	WARD	SALESMAN	7698	1982-12-12	1250	500	30	9999
4	JONES	MANAGER	7839	1983-12-12	2975	NULL	20	9999
5	MARTIN	SALESMAN	7698	1984-12-12	1250	1400	30	9999
100	BLAKE	MANAGER	7839	1985-12-12	2850	NULL	30	9999
200	CLARK	MANAGER	7839	1986-12-12	2450	NULL	10	9999
300	SCOTT	ANALYST	7566	1987-12-12	3000	NULL	20	9999
400	KING	PRESIDENT	NULL	1988-12-12	5000	NULL	10	9999
1000	TURNER	SALESMAN	7698	1989-12-12	1500	0	30	9999
1000	FORD	ANALYST	7566	1992-12-12	3000	NULL	20	9999
2000	ADAMS	CLERK	7788	1990-12-12	1100	NULL	20	9999
3000	JAMES	CLERK	7698	1991-12-12	950	NULL	30	9999
5000	MILLER	CLERK	7782	1993-12-12	1300	NULL	10	9999
minus-4-1-1-1-2    select嵌套 
SELECT   *  FROM   (SELECT   *  FROM   (SELECT     *      FROM    EMP001_VIEW      minus    select    *     FROM    EMP002_VIEW)      MINUS  SELECT   *  FROM   (SELECT     *      FROM    EMP002_VIEW      minus    select    *     FROM    EMP001_VIEW))  e  ORDER  BY  e.EMPNO,e.HIREDATE,e.sal;
empno	ename	job	mgr	hiredate	sal	comm	deptno	comid
SELECT   *  FROM   (SELECT   *  FROM   (SELECT     *      FROM    EMP001_VIEW      minus    select    *     FROM    EMP002_VIEW)      MINUS  SELECT   *  FROM   (SELECT     *      FROM    EMP002_VIEW      UNION    select    *     FROM    EMP001_VIEW))  e  ORDER  BY  e.EMPNO,e.HIREDATE,e.sal;
empno	ename	job	mgr	hiredate	sal	comm	deptno	comid
SELECT   *  FROM   (SELECT   *  FROM   (SELECT     *      FROM    EMP001_VIEW      minus    select    *     FROM    EMP002_VIEW)      MINUS  SELECT   *  FROM   (SELECT     *      FROM    EMP002_VIEW      UNION  all    select    *     FROM    EMP001_VIEW))  e  ORDER  BY  e.EMPNO,e.HIREDATE,e.sal;
empno	ename	job	mgr	hiredate	sal	comm	deptno	comid
SELECT   *  FROM   (SELECT   *  FROM   (SELECT     *      FROM    EMP001_VIEW      minus    select    *     FROM    EMP002_VIEW)      MINUS  SELECT   *  FROM   (SELECT     *      FROM    EMP002_VIEW      INTERSECT    select    *     FROM    EMP001_VIEW))  e  ORDER  BY  e.EMPNO,e.HIREDATE,e.sal;
empno	ename	job	mgr	hiredate	sal	comm	deptno	comid
minus-4-1-1-1-3  聚合函数
SELECT    sum(empno)     FROM    EMP001     minus    select    sum(sal)        FROM    EMP001_VIEW;
sum(empno)
13315
SELECT   *  FROM   (SELECT    avg(empno)  eee    FROM    EMP001     UNION    select    avg(comm)        FROM    EMP002_VIEW)  t   ORDER BY   eee;
eee
550.0000
832.1875
SELECT   *  FROM   (SELECT    max(empno) eee    FROM    EMP001     UNION  all    select    max(empno)        FROM    EMP002_VIEW)  t   ORDER BY   eee;
eee
5000
5000
SELECT    min(empno)     FROM    EMP001     INTERSECT    select    sum(sal)        FROM    EMP002_VIEW;
min(empno)
minus-4-1-1-1-4    create as       
drop   table  if  exists   EMP001_create;
create TABLE    EMP001_create   as  SELECT    sum(empno)  eee     FROM    EMP001_VIEW     minus    select    sum(empno)        FROM    EMP002_VIEW;
SELECT  *  FROM     EMP001_create e ORDER  BY eee;
eee
drop   table  if  exists   EMP001_create;
create TABLE    EMP001_create   as  SELECT    sum(empno)  eee     FROM    EMP001_VIEW     UNION    select    sum(empno)        FROM    EMP002_VIEW;
SELECT  *  FROM     EMP001_create e ORDER  BY eee;
eee
13315
drop   table  if  exists   EMP001_create;
create TABLE    EMP001_create   as  SELECT    sum(empno)  eee     FROM    EMP001_VIEW     union  all     select    sum(empno)        FROM    EMP002_VIEW;
SELECT  *  FROM     EMP001_create e ORDER  BY eee;
eee
13315
13315
drop   table  if  exists   EMP001_create;
create TABLE    EMP001_create   as  SELECT    sum(empno)  eee     FROM    EMP001_VIEW     INTERSECT    select    sum(empno)        FROM    EMP002_VIEW;
SELECT  *  FROM     EMP001_create e ORDER  BY eee;
eee
13315
minus-4-1-1-2   where  语句    
SELECT   *  FROM   (SELECT     *      FROM    EMP001_VIEW   WHERE   empno  < 2         minus    select    *     FROM    EMP002_VIEW  e   WHERE   e.EMPNO<3)e  ORDER  BY  e.EMPNO,e.HIREDATE,e.sal;
empno	ename	job	mgr	hiredate	sal	comm	deptno	comid
SELECT   *  FROM   (SELECT     *      FROM    EMP001_VIEW   WHERE   empno  < 2         UNION    select    *     FROM    EMP002_VIEW  e   WHERE   e.EMPNO<3)e  ORDER  BY  e.EMPNO,e.HIREDATE,e.sal;
empno	ename	job	mgr	hiredate	sal	comm	deptno	comid
1	SMITH	CLERK	7902	1980-12-12	800	NULL	20	9999
2	ALLEN	SALESMAN	7698	1981-12-12	1600	300	30	9999
SELECT   *  FROM   (SELECT     *      FROM    EMP001_VIEW   WHERE   empno  < 2         UNION  all    select    *     FROM    EMP002_VIEW  e   WHERE   e.EMPNO<3)e  ORDER  BY  e.EMPNO,e.HIREDATE,e.sal;
empno	ename	job	mgr	hiredate	sal	comm	deptno	comid
1	SMITH	CLERK	7902	1980-12-12	800	NULL	20	9999
1	SMITH	CLERK	7902	1980-12-12	800	NULL	20	9999
2	ALLEN	SALESMAN	7698	1981-12-12	1600	300	30	9999
SELECT   *  FROM   (SELECT     *      FROM    EMP001_VIEW   WHERE   empno  < 2         INTERSECT    select    *     FROM    EMP002_VIEW  e   WHERE   e.EMPNO<3)e  ORDER  BY  e.EMPNO,e.HIREDATE,e.sal;
empno	ename	job	mgr	hiredate	sal	comm	deptno	comid
1	SMITH	CLERK	7902	1980-12-12	800	NULL	20	9999
minus-4-1-1-3     order by 子句
SELECT   *  FROM   (SELECT     *      FROM    EMP001_VIEW   WHERE   empno  < 2         minus    select    *     FROM    EMP001_VIEW  e   WHERE   e.EMPNO<3)   e  ORDER  BY  e.EMPNO,e.HIREDATE,e.sal;
empno	ename	job	mgr	hiredate	sal	comm	deptno	comid
SELECT   *  FROM   (SELECT     *      FROM    EMP001_VIEW   WHERE   empno  < 2         UNION    select    *     FROM    EMP001_VIEW  e   WHERE   e.EMPNO<3) e  ORDER  BY  e.EMPNO,e.HIREDATE,e.sal;
empno	ename	job	mgr	hiredate	sal	comm	deptno	comid
1	SMITH	CLERK	7902	1980-12-12	800	NULL	20	9999
2	ALLEN	SALESMAN	7698	1981-12-12	1600	300	30	9999
SELECT   *  FROM   (SELECT     *      FROM    EMP001_VIEW   WHERE   empno  < 2         UNION  all    select    *     FROM    EMP001_VIEW  e   WHERE   e.EMPNO<3)   e  ORDER  BY  e.EMPNO,e.HIREDATE,e.sal;
empno	ename	job	mgr	hiredate	sal	comm	deptno	comid
1	SMITH	CLERK	7902	1980-12-12	800	NULL	20	9999
1	SMITH	CLERK	7902	1980-12-12	800	NULL	20	9999
2	ALLEN	SALESMAN	7698	1981-12-12	1600	300	30	9999
SELECT   *  FROM   (SELECT     *      FROM    EMP001_VIEW   WHERE   empno  < 2         INTERSECT    select    *     FROM    EMP001_VIEW  e   WHERE   e.EMPNO<3) e  ORDER  BY  e.EMPNO,e.HIREDATE,e.sal;
empno	ename	job	mgr	hiredate	sal	comm	deptno	comid
1	SMITH	CLERK	7902	1980-12-12	800	NULL	20	9999
minus-4-1-1-4     group by   子句
SELECT        *      FROM   (SELECT    empno      FROM    EMP001_VIEW     GROUP  BY    empno            minus    SELECT    comm      FROM    EMP002     GROUP  BY    comm,empno)   e  ORDER  BY  e.EMPNO;
empno
1
2
3
4
5
100
200
400
1000
2000
3000
5000
SELECT        *      FROM   (SELECT    empno      FROM    EMP001_VIEW     GROUP  BY    empno            UNION    SELECT    comm      FROM    EMP002     GROUP  BY    comm,empno)     e  ORDER  BY  e.EMPNO;
empno
NULL
0
1
2
3
4
5
100
200
300
400
500
1000
1400
2000
3000
5000
SELECT        *      FROM   (SELECT    empno      FROM    EMP001_VIEW     GROUP  BY    empno            UNION  all    SELECT    comm      FROM    EMP002     GROUP  BY    comm,empno)   e  ORDER  BY  e.EMPNO;
empno
NULL
NULL
NULL
NULL
NULL
NULL
NULL
NULL
NULL
NULL
0
1
2
3
4
5
100
200
300
300
400
500
1000
1400
2000
3000
5000
SELECT        *      FROM   (SELECT    empno      FROM    EMP001_VIEW     GROUP  BY    empno            INTERSECT    SELECT    comm      FROM    EMP002     GROUP  BY    comm,empno)    e  ORDER  BY  e.EMPNO;
empno
300
minus-4-1-1-5     group by  having   子句
SELECT        *      FROM         (SELECT    empno      FROM    EMP001_VIEW     GROUP  BY    empno,sal,comm  having    comm>100       minus    SELECT    empno      FROM    EMP001_VIEW     GROUP  BY    empno  having    empno>1000)  r   ORDER   BY   EMPNO;
empno
2
3
5
SELECT        *      FROM         (SELECT    empno      FROM    EMP001_VIEW     GROUP  BY    empno,sal,comm  having    comm<100       UNION    SELECT    empno      FROM    EMP001_VIEW     GROUP  BY    empno  having    empno>1000) r   ORDER   BY   EMPNO;
empno
1000
2000
3000
5000
SELECT        *      FROM         (SELECT    empno      FROM    EMP001_VIEW     GROUP  BY    empno,sal,comm  having    comm>100       UNION  all    SELECT    empno      FROM    EMP001_VIEW     GROUP  BY    empno  having    empno>1000) r   ORDER   BY   EMPNO;
empno
2
3
5
2000
3000
5000
SELECT        *      FROM         (SELECT    empno      FROM    EMP001_VIEW     GROUP  BY    empno,sal,comm  having    comm !=100       INTERSECT    SELECT    empno      FROM    EMP001_VIEW     GROUP  BY    empno  having    empno>1000) r   ORDER   BY   EMPNO;
empno
minus-4-1-2-1   根据字段插入
INSERT INTO  EMP001_VIEW(empno,sal)   SELECT   empno,sal   FROM    EMP001      minus    select    empno,sal    FROM    EMP002;
INSERT INTO  EMP001_VIEW(empno,sal)   SELECT   empno,sal   FROM    EMP001      UNION    select    empno,sal    FROM    EMP002;
INSERT INTO  EMP001_VIEW(empno,sal)   SELECT   empno,sal   FROM    EMP001      UNION  all    select    empno,sal    FROM    EMP002;
INSERT INTO  EMP001_VIEW(empno,sal)   SELECT   empno,sal   FROM    EMP001      INTERSECT    select    empno,sal    FROM    EMP002;
SELECT   *  FROM   (SELECT     *      FROM    EMP001_VIEW      minus    select    *     FROM    EMP002)  e       ORDER  BY e.empno,e.ename,e.job,e.mgr,e.hiredate,e.sal,e.comm,e.deptno;
empno	ename	job	mgr	hiredate	sal	comm	deptno	comid
1	NULL	NULL	NULL	NULL	800	NULL	NULL	NULL
2	NULL	NULL	NULL	NULL	1600	NULL	NULL	NULL
3	NULL	NULL	NULL	NULL	1250	NULL	NULL	NULL
4	NULL	NULL	NULL	NULL	2975	NULL	NULL	NULL
5	NULL	NULL	NULL	NULL	1250	NULL	NULL	NULL
100	NULL	NULL	NULL	NULL	2850	NULL	NULL	NULL
200	NULL	NULL	NULL	NULL	2450	NULL	NULL	NULL
300	NULL	NULL	NULL	NULL	3000	NULL	NULL	NULL
400	NULL	NULL	NULL	NULL	5000	NULL	NULL	NULL
1000	NULL	NULL	NULL	NULL	1500	NULL	NULL	NULL
1000	NULL	NULL	NULL	NULL	3000	NULL	NULL	NULL
2000	NULL	NULL	NULL	NULL	1100	NULL	NULL	NULL
3000	NULL	NULL	NULL	NULL	950	NULL	NULL	NULL
5000	NULL	NULL	NULL	NULL	1300	NULL	NULL	NULL
SELECT   *  FROM   (SELECT     *      FROM    EMP001_VIEW      UNION    select    *     FROM    EMP002)  e       ORDER  BY e.empno,e.ename,e.job,e.mgr,e.hiredate,e.sal,e.comm,e.deptno;
empno	ename	job	mgr	hiredate	sal	comm	deptno	comid
1	NULL	NULL	NULL	NULL	800	NULL	NULL	NULL
1	SMITH	CLERK	7902	1980-12-12	800	NULL	20	9999
2	NULL	NULL	NULL	NULL	1600	NULL	NULL	NULL
2	ALLEN	SALESMAN	7698	1981-12-12	1600	300	30	9999
3	NULL	NULL	NULL	NULL	1250	NULL	NULL	NULL
3	WARD	SALESMAN	7698	1982-12-12	1250	500	30	9999
4	NULL	NULL	NULL	NULL	2975	NULL	NULL	NULL
4	JONES	MANAGER	7839	1983-12-12	2975	NULL	20	9999
5	NULL	NULL	NULL	NULL	1250	NULL	NULL	NULL
5	MARTIN	SALESMAN	7698	1984-12-12	1250	1400	30	9999
100	NULL	NULL	NULL	NULL	2850	NULL	NULL	NULL
100	BLAKE	MANAGER	7839	1985-12-12	2850	NULL	30	9999
200	NULL	NULL	NULL	NULL	2450	NULL	NULL	NULL
200	CLARK	MANAGER	7839	1986-12-12	2450	NULL	10	9999
300	NULL	NULL	NULL	NULL	3000	NULL	NULL	NULL
300	SCOTT	ANALYST	7566	1987-12-12	3000	NULL	20	9999
400	NULL	NULL	NULL	NULL	5000	NULL	NULL	NULL
400	KING	PRESIDENT	NULL	1988-12-12	5000	NULL	10	9999
1000	NULL	NULL	NULL	NULL	1500	NULL	NULL	NULL
1000	NULL	NULL	NULL	NULL	3000	NULL	NULL	NULL
1000	FORD	ANALYST	7566	1992-12-12	3000	NULL	20	9999
1000	TURNER	SALESMAN	7698	1989-12-12	1500	0	30	9999
2000	NULL	NULL	NULL	NULL	1100	NULL	NULL	NULL
2000	ADAMS	CLERK	7788	1990-12-12	1100	NULL	20	9999
3000	NULL	NULL	NULL	NULL	950	NULL	NULL	NULL
3000	JAMES	CLERK	7698	1991-12-12	950	NULL	30	9999
5000	NULL	NULL	NULL	NULL	1300	NULL	NULL	NULL
5000	MILLER	CLERK	7782	1993-12-12	1300	NULL	10	9999
SELECT   *  FROM   (SELECT     *      FROM    EMP001_VIEW      UNION  all    select    *     FROM    EMP002)     e   ORDER  BY e.empno,e.ename,e.job,e.mgr,e.hiredate,e.sal,e.comm,e.deptno;
empno	ename	job	mgr	hiredate	sal	comm	deptno	comid
1	NULL	NULL	NULL	NULL	800	NULL	NULL	NULL
1	NULL	NULL	NULL	NULL	800	NULL	NULL	NULL
1	NULL	NULL	NULL	NULL	800	NULL	NULL	NULL
1	NULL	NULL	NULL	NULL	800	NULL	NULL	NULL
1	NULL	NULL	NULL	NULL	800	NULL	NULL	NULL
1	SMITH	CLERK	7902	1980-12-12	800	NULL	20	9999
1	SMITH	CLERK	7902	1980-12-12	800	NULL	20	9999
2	NULL	NULL	NULL	NULL	1600	NULL	NULL	NULL
2	NULL	NULL	NULL	NULL	1600	NULL	NULL	NULL
2	NULL	NULL	NULL	NULL	1600	NULL	NULL	NULL
2	NULL	NULL	NULL	NULL	1600	NULL	NULL	NULL
2	NULL	NULL	NULL	NULL	1600	NULL	NULL	NULL
2	ALLEN	SALESMAN	7698	1981-12-12	1600	300	30	9999
2	ALLEN	SALESMAN	7698	1981-12-12	1600	300	30	9999
3	NULL	NULL	NULL	NULL	1250	NULL	NULL	NULL
3	NULL	NULL	NULL	NULL	1250	NULL	NULL	NULL
3	NULL	NULL	NULL	NULL	1250	NULL	NULL	NULL
3	NULL	NULL	NULL	NULL	1250	NULL	NULL	NULL
3	NULL	NULL	NULL	NULL	1250	NULL	NULL	NULL
3	WARD	SALESMAN	7698	1982-12-12	1250	500	30	9999
3	WARD	SALESMAN	7698	1982-12-12	1250	500	30	9999
4	NULL	NULL	NULL	NULL	2975	NULL	NULL	NULL
4	NULL	NULL	NULL	NULL	2975	NULL	NULL	NULL
4	NULL	NULL	NULL	NULL	2975	NULL	NULL	NULL
4	NULL	NULL	NULL	NULL	2975	NULL	NULL	NULL
4	NULL	NULL	NULL	NULL	2975	NULL	NULL	NULL
4	JONES	MANAGER	7839	1983-12-12	2975	NULL	20	9999
4	JONES	MANAGER	7839	1983-12-12	2975	NULL	20	9999
5	NULL	NULL	NULL	NULL	1250	NULL	NULL	NULL
5	NULL	NULL	NULL	NULL	1250	NULL	NULL	NULL
5	NULL	NULL	NULL	NULL	1250	NULL	NULL	NULL
5	NULL	NULL	NULL	NULL	1250	NULL	NULL	NULL
5	NULL	NULL	NULL	NULL	1250	NULL	NULL	NULL
5	MARTIN	SALESMAN	7698	1984-12-12	1250	1400	30	9999
5	MARTIN	SALESMAN	7698	1984-12-12	1250	1400	30	9999
100	NULL	NULL	NULL	NULL	2850	NULL	NULL	NULL
100	NULL	NULL	NULL	NULL	2850	NULL	NULL	NULL
100	NULL	NULL	NULL	NULL	2850	NULL	NULL	NULL
100	NULL	NULL	NULL	NULL	2850	NULL	NULL	NULL
100	NULL	NULL	NULL	NULL	2850	NULL	NULL	NULL
100	NULL	NULL	NULL	NULL	2850	NULL	NULL	NULL
100	NULL	NULL	NULL	NULL	2850	NULL	NULL	NULL
100	BLAKE	MANAGER	7839	1985-12-12	2850	NULL	30	9999
100	BLAKE	MANAGER	7839	1985-12-12	2850	NULL	30	9999
100	BLAKE	MANAGER	7839	1985-12-12	2850	NULL	30	9999
100	BLAKE	MANAGER	7839	1985-12-12	2850	NULL	30	9999
200	NULL	NULL	NULL	NULL	2450	NULL	NULL	NULL
200	NULL	NULL	NULL	NULL	2450	NULL	NULL	NULL
200	NULL	NULL	NULL	NULL	2450	NULL	NULL	NULL
200	NULL	NULL	NULL	NULL	2450	NULL	NULL	NULL
200	NULL	NULL	NULL	NULL	2450	NULL	NULL	NULL
200	NULL	NULL	NULL	NULL	2450	NULL	NULL	NULL
200	NULL	NULL	NULL	NULL	2450	NULL	NULL	NULL
200	CLARK	MANAGER	7839	1986-12-12	2450	NULL	10	9999
200	CLARK	MANAGER	7839	1986-12-12	2450	NULL	10	9999
200	CLARK	MANAGER	7839	1986-12-12	2450	NULL	10	9999
200	CLARK	MANAGER	7839	1986-12-12	2450	NULL	10	9999
300	NULL	NULL	NULL	NULL	3000	NULL	NULL	NULL
300	NULL	NULL	NULL	NULL	3000	NULL	NULL	NULL
300	NULL	NULL	NULL	NULL	3000	NULL	NULL	NULL
300	NULL	NULL	NULL	NULL	3000	NULL	NULL	NULL
300	NULL	NULL	NULL	NULL	3000	NULL	NULL	NULL
300	SCOTT	ANALYST	7566	1987-12-12	3000	NULL	20	9999
300	SCOTT	ANALYST	7566	1987-12-12	3000	NULL	20	9999
400	NULL	NULL	NULL	NULL	5000	NULL	NULL	NULL
400	NULL	NULL	NULL	NULL	5000	NULL	NULL	NULL
400	NULL	NULL	NULL	NULL	5000	NULL	NULL	NULL
400	NULL	NULL	NULL	NULL	5000	NULL	NULL	NULL
400	NULL	NULL	NULL	NULL	5000	NULL	NULL	NULL
400	KING	PRESIDENT	NULL	1988-12-12	5000	NULL	10	9999
400	KING	PRESIDENT	NULL	1988-12-12	5000	NULL	10	9999
1000	NULL	NULL	NULL	NULL	1500	NULL	NULL	NULL
1000	NULL	NULL	NULL	NULL	1500	NULL	NULL	NULL
1000	NULL	NULL	NULL	NULL	1500	NULL	NULL	NULL
1000	NULL	NULL	NULL	NULL	1500	NULL	NULL	NULL
1000	NULL	NULL	NULL	NULL	1500	NULL	NULL	NULL
1000	NULL	NULL	NULL	NULL	3000	NULL	NULL	NULL
1000	NULL	NULL	NULL	NULL	3000	NULL	NULL	NULL
1000	NULL	NULL	NULL	NULL	3000	NULL	NULL	NULL
1000	NULL	NULL	NULL	NULL	3000	NULL	NULL	NULL
1000	NULL	NULL	NULL	NULL	3000	NULL	NULL	NULL
1000	FORD	ANALYST	7566	1992-12-12	3000	NULL	20	9999
1000	FORD	ANALYST	7566	1992-12-12	3000	NULL	20	9999
1000	TURNER	SALESMAN	7698	1989-12-12	1500	0	30	9999
1000	TURNER	SALESMAN	7698	1989-12-12	1500	0	30	9999
2000	NULL	NULL	NULL	NULL	1100	NULL	NULL	NULL
2000	NULL	NULL	NULL	NULL	1100	NULL	NULL	NULL
2000	NULL	NULL	NULL	NULL	1100	NULL	NULL	NULL
2000	NULL	NULL	NULL	NULL	1100	NULL	NULL	NULL
2000	NULL	NULL	NULL	NULL	1100	NULL	NULL	NULL
2000	ADAMS	CLERK	7788	1990-12-12	1100	NULL	20	9999
2000	ADAMS	CLERK	7788	1990-12-12	1100	NULL	20	9999
3000	NULL	NULL	NULL	NULL	950	NULL	NULL	NULL
3000	NULL	NULL	NULL	NULL	950	NULL	NULL	NULL
3000	NULL	NULL	NULL	NULL	950	NULL	NULL	NULL
3000	NULL	NULL	NULL	NULL	950	NULL	NULL	NULL
3000	NULL	NULL	NULL	NULL	950	NULL	NULL	NULL
3000	JAMES	CLERK	7698	1991-12-12	950	NULL	30	9999
3000	JAMES	CLERK	7698	1991-12-12	950	NULL	30	9999
5000	NULL	NULL	NULL	NULL	1300	NULL	NULL	NULL
5000	NULL	NULL	NULL	NULL	1300	NULL	NULL	NULL
5000	NULL	NULL	NULL	NULL	1300	NULL	NULL	NULL
5000	NULL	NULL	NULL	NULL	1300	NULL	NULL	NULL
5000	NULL	NULL	NULL	NULL	1300	NULL	NULL	NULL
5000	MILLER	CLERK	7782	1993-12-12	1300	NULL	10	9999
5000	MILLER	CLERK	7782	1993-12-12	1300	NULL	10	9999
SELECT   *  FROM   (SELECT     *      FROM    EMP001_VIEW      INTERSECT    select    *     FROM    EMP002)     e   ORDER  BY e.empno,e.ename,e.job,e.mgr,e.hiredate,e.sal,e.comm,e.deptno;
empno	ename	job	mgr	hiredate	sal	comm	deptno	comid
1	SMITH	CLERK	7902	1980-12-12	800	NULL	20	9999
2	ALLEN	SALESMAN	7698	1981-12-12	1600	300	30	9999
3	WARD	SALESMAN	7698	1982-12-12	1250	500	30	9999
4	JONES	MANAGER	7839	1983-12-12	2975	NULL	20	9999
5	MARTIN	SALESMAN	7698	1984-12-12	1250	1400	30	9999
100	BLAKE	MANAGER	7839	1985-12-12	2850	NULL	30	9999
200	CLARK	MANAGER	7839	1986-12-12	2450	NULL	10	9999
300	SCOTT	ANALYST	7566	1987-12-12	3000	NULL	20	9999
400	KING	PRESIDENT	NULL	1988-12-12	5000	NULL	10	9999
1000	FORD	ANALYST	7566	1992-12-12	3000	NULL	20	9999
1000	TURNER	SALESMAN	7698	1989-12-12	1500	0	30	9999
2000	ADAMS	CLERK	7788	1990-12-12	1100	NULL	20	9999
3000	JAMES	CLERK	7698	1991-12-12	950	NULL	30	9999
5000	MILLER	CLERK	7782	1993-12-12	1300	NULL	10	9999
minus-4-1-2-2   根据表插入
INSERT INTO  EMP001_VIEW   SELECT     *      FROM    EMP001      minus    select    *     FROM    EMP002;
INSERT INTO  EMP001_VIEW   SELECT     *      FROM    EMP001      UNION    select    *     FROM    EMP002;
INSERT INTO  EMP001_VIEW   SELECT     *      FROM    EMP001      UNION  all    select    *     FROM    EMP002;
INSERT INTO  EMP001_VIEW   SELECT     *      FROM    EMP001      INTERSECT    select    *     FROM    EMP002;
SELECT  sum(empno)  FROM   (SELECT     *      FROM    EMP001_VIEW      minus    select    *     FROM    EMP002)  e   ORDER  BY  e.EMPNO;
sum(empno)
13015
SELECT  sum(empno)  FROM   (SELECT     *      FROM    EMP001_VIEW      UNION    select    *     FROM    EMP002)  e   ORDER  BY  e.EMPNO;
sum(empno)
26030
SELECT  sum(empno)  FROM   (SELECT     *      FROM    EMP001_VIEW      UNION  all    select    *     FROM    EMP002)  e   ORDER  BY  e.EMPNO;
sum(empno)
275715
SELECT  sum(empno)  FROM   (SELECT     *      FROM    EMP001_VIEW      INTERSECT    select    *     FROM    EMP002)  e   ORDER  BY  e.EMPNO;
sum(empno)
13015
minus-4-1-2-3    插入 使用子查询                  
INSERT INTO  EMP002_VIEW VALUES((SELECT  sum(empno)  FROM   (SELECT     *      FROM    EMP001      minus    select    *     FROM    EMP002)  e  ),'SMITH002','CLERK',4,'1988-12-12',9000,NULL,30,9999);
INSERT INTO  EMP002_VIEW VALUES((SELECT  sum(empno)  FROM   (SELECT     *      FROM    EMP001      UNION    select    *     FROM    EMP002)  e  ),'SMITH002','CLERK',4,'1988-12-12',9000,NULL,30,9999);
INSERT INTO  EMP002_VIEW VALUES((SELECT  sum(empno)  FROM   (SELECT     *      FROM    EMP001      UNION  all    select    *     FROM    EMP002)  e  ),'SMITH002','CLERK',4,'1988-12-12',9000,NULL,30,9999);
INSERT INTO  EMP002_VIEW VALUES((SELECT  sum(empno)  FROM   (SELECT     *      FROM    EMP001      INTERSECT    select    *     FROM    EMP002)  e  ),'SMITH002','CLERK',4,'1988-12-12',9000,NULL,30,9999);
SELECT  sum(empno)   eee,sum(sal)   rrr   FROM   (SELECT     *      FROM    EMP001_VIEW      minus    select    *     FROM    EMP002)  e     GROUP  BY    empno,sal       ORDER  BY  eee,rrr;
eee	rrr
1	800
2	1600
3	1250
4	2975
5	1250
100	2850
200	2450
300	3000
400	5000
1000	1500
1000	3000
2000	1100
3000	950
5000	1300
SELECT  sum(empno)   eee,sum(sal)   rrr    FROM   (SELECT     *      FROM    EMP001_VIEW      UNION    select    *     FROM    EMP002)  e     GROUP  BY    empno,sal        ORDER  BY  eee,rrr;
eee	rrr
2	1600
4	3200
6	2500
8	5950
10	2500
200	5700
400	4900
600	6000
800	10000
2000	3000
2000	6000
4000	2200
6000	1900
10000	2600
13015	9000
39045	9000
327775	9000
SELECT  sum(empno)   eee,sum(sal)   rrr    FROM   (SELECT     *      FROM    EMP001_VIEW      UNION   all    select    *     FROM    EMP002)  e     GROUP  BY    empno,sal      ORDER  BY  eee,rrr;
eee	rrr
21	16800
42	33600
63	26250
84	62475
105	26250
2900	82650
5800	71050
6300	63000
8400	105000
21000	31500
21000	63000
26030	18000
39045	9000
42000	23100
63000	19950
105000	27300
327775	9000
SELECT  sum(empno)   eee,sum(sal)   rrr    FROM   (SELECT     *      FROM    EMP001_VIEW      INTERSECT    select    *     FROM    EMP002)  e     GROUP  BY    empno,sal       ORDER  BY  eee,rrr;
eee	rrr
1	800
2	1600
3	1250
4	2975
5	1250
100	2850
200	2450
300	3000
400	5000
1000	1500
1000	3000
2000	1100
3000	950
5000	1300
minus-4-1-2-4    插入语句中使用嵌套
INSERT INTO  EMP001  VALUES( (SELECT    9000  FROM    dual    minus     (SELECT  sum(empno)  FROM   (SELECT     *      FROM    EMP001_VIEW      minus    select    *     FROM    EMP002) t)    ),'SMITH002','CLERK',4,'1988-12-12',9000,NULL,30,20);
INSERT INTO  EMP001  VALUES( (SELECT    9000  FROM    dual    UNION     (SELECT  sum(empno)  FROM   (SELECT     *      FROM    EMP001_VIEW      UNION    select    *     FROM    EMP002) t)    ),'SMITH002','CLERK',4,'1989-12-12',9000,NULL,30,20);
ERROR 21000: Subquery returns more than 1 row
INSERT INTO  EMP001  VALUES( (SELECT    9000  FROM    dual    UNION  all     (SELECT  sum(empno)  FROM   (SELECT     *      FROM    EMP001_VIEW      union  all    select    *     FROM    EMP002) t)    ),'SMITH002','CLERK',4,'1988-03-12',9000,NULL,30,20);
ERROR 21000: Subquery returns more than 1 row
INSERT INTO  EMP001  VALUES( (SELECT    9000  FROM    dual    INTERSECT     (SELECT  sum(empno)  FROM   (SELECT     *      FROM    EMP001_VIEW      minus    select    *     FROM    EMP002) t)    ),'SMITH002','CLERK',4,'1918-12-12',9000,NULL,30,30);
SELECT  sum(empno)   eee,sum(sal)   rrr    FROM   (SELECT     *      FROM    EMP001_VIEW      minus    select    *     FROM    EMP002)  e     GROUP  BY    empno,sal         ORDER  BY  eee,rrr;
eee	rrr
NULL	9000
1	800
2	1600
3	1250
4	2975
5	1250
100	2850
200	2450
300	3000
400	5000
1000	1500
1000	3000
2000	1100
3000	950
5000	1300
9000	9000
SELECT  sum(empno)   eee,sum(sal)   rrr    FROM   (SELECT     *      FROM    EMP001_VIEW      UNION    select    *     FROM    EMP002)  e     GROUP  BY    empno,sal         ORDER  BY  eee,rrr;
eee	rrr
NULL	9000
2	1600
4	3200
6	2500
8	5950
10	2500
200	5700
400	4900
600	6000
800	10000
2000	3000
2000	6000
4000	2200
6000	1900
9000	9000
10000	2600
13015	9000
39045	9000
327775	9000
SELECT  sum(empno)   eee,sum(sal)   rrr    FROM   (SELECT     *      FROM    EMP001_VIEW      UNION   ALL     select    *     FROM    EMP002)  e     GROUP  BY    empno,sal         ORDER  BY  eee,rrr;
eee	rrr
NULL	9000
21	16800
42	33600
63	26250
84	62475
105	26250
2900	82650
5800	71050
6300	63000
8400	105000
9000	9000
21000	31500
21000	63000
26030	18000
39045	9000
42000	23100
63000	19950
105000	27300
327775	9000
SELECT  sum(empno)   eee,sum(sal)   rrr    FROM   (SELECT     *      FROM    EMP001_VIEW      INTERSECT    select    *     FROM    EMP002)  e     GROUP  BY    empno,sal         ORDER  BY  eee,rrr;
eee	rrr
1	800
2	1600
3	1250
4	2975
5	1250
100	2850
200	2450
300	3000
400	5000
1000	1500
1000	3000
2000	1100
3000	950
5000	1300
minus-4-1-3            update语句              
UPDATE    EMP001_VIEW   e  SET    e.empno =(SELECT  sum(empno)     FROM   (SELECT     *      FROM    EMP001      minus    select    *     FROM    EMP002)e);
SELECT  sum(empno)   eee   FROM       EMP001_VIEW    ORDER   BY   eee;
eee
6516440
UPDATE    EMP001_VIEW   e  SET    e.empno =(SELECT  sum(empno)     FROM   (SELECT     *      FROM    EMP001      UNION    select    *     FROM    EMP002)e);
SELECT  sum(empno)   eee   FROM       EMP001_VIEW    ORDER   BY   eee;
eee
298743920
UPDATE    EMP001_VIEW   e  SET    e.empno =(SELECT  sum(empno)     FROM   (SELECT     *      FROM    EMP001      UNION  all    select    *     FROM    EMP002)e);
SELECT  sum(empno)   eee   FROM       EMP001_VIEW    ORDER   BY   eee;
eee
88548425160
UPDATE    EMP001_VIEW   e  SET    e.empno =(SELECT  sum(empno)     FROM   (SELECT     *      FROM    EMP001      INTERSECT    select    *     FROM    EMP002)e);
SELECT  sum(empno)   eee   FROM       EMP001_VIEW    ORDER   BY   eee;
eee
NULL
minus-4-1-4         delete 语句                 
DELETE  FROM     EMP001_VIEW    e    WHERE   e.empno <(SELECT  sum(empno)     FROM   (SELECT     *      FROM    EMP001      minus    select    *     FROM    EMP002));
DELETE  FROM     EMP001_VIEW    e    WHERE   e.empno <(SELECT  sum(empno)     FROM   (SELECT     *      FROM    EMP001      UNION    select    *     FROM    EMP002));
DELETE  FROM     EMP001_VIEW    e    WHERE   e.empno <(SELECT  sum(empno)     FROM   (SELECT     *      FROM    EMP001      UNION  all    select    *     FROM    EMP002));
DELETE  FROM     EMP001_VIEW    e    WHERE   e.empno <(SELECT  sum(empno)     FROM   (SELECT     *      FROM    EMP001      INTERSECT    select    *     FROM    EMP002));
minus-4-5    CASE WHEN语句
SELECT   sum(empno)  eee,  COUNT (CASE WHEN  (SELECT    10    FROM    dual      minus    select   50   FROM    dual)>50  THEN 1 
ELSE       NULL      END) rrr 
FROM    EMP001_VIEW   e    GROUP  BY e.empno,e.sal   ORDER BY  eee,rrr;
eee	rrr
NULL	0
NULL	0
NULL	0
NULL	0
NULL	0
NULL	0
NULL	0
NULL	0
NULL	0
NULL	0
NULL	0
NULL	0
NULL	0
SELECT   sum(empno)  eee,  COUNT (CASE WHEN  (SELECT    10    FROM    dual      union    select   50   FROM    dual)>50  THEN 1 
ELSE       NULL      END) rrr 
FROM    EMP001_VIEW   e    GROUP  BY e.empno,e.sal   ORDER BY  eee,rrr;
ERROR 21000: Subquery returns more than 1 row
SELECT   sum(empno)  eee,  COUNT (CASE WHEN  (SELECT    10    FROM    dual      UNION  all    select   50   FROM    dual)>50  THEN 1 
ELSE       NULL      END) rrr 
FROM    EMP001_VIEW   e    GROUP  BY e.empno,e.sal   ORDER BY  eee,rrr;
ERROR 21000: Subquery returns more than 1 row
SELECT   sum(empno)  eee,  COUNT (CASE WHEN  (SELECT    10    FROM    dual      INTERSECT    select   50   FROM    dual)>50  THEN 1 
ELSE       NULL      END) rrr 
FROM    EMP001_VIEW   e    GROUP  BY e.empno,e.sal   ORDER BY  eee,rrr;
eee	rrr
NULL	0
NULL	0
NULL	0
NULL	0
NULL	0
NULL	0
NULL	0
NULL	0
NULL	0
NULL	0
NULL	0
NULL	0
NULL	0
minus-4-2-1    内连接
drop   table  if  exists   emp001;
drop   table  if  exists   emp002;
drop   table  if  exists   emp;
create TABLE   EMP(empno   int,ename   VARCHAR(100) ,job  VARCHAR(100),mgr   int ,hiredate DATE,sal   float(8,0) ,comm   int ,deptno  int,comid   int);
INSERT INTO EMP VALUES(1,'SMITH','CLERK',7902,'1980-12-12',800,NULL,20,9999);
INSERT INTO EMP VALUES(2,'ALLEN','SALESMAN',7698,'1981-12-12',1600,300,30,9999);
INSERT INTO EMP VALUES(3,'WARD','SALESMAN',7698,'1982-12-12',1250,500,30,9999);
INSERT INTO EMP VALUES(4,'JONES','MANAGER',7839,'1983-12-12',2975,NULL,20,9999);
INSERT INTO EMP VALUES(5,'MARTIN','SALESMAN',7698,'1984-12-12',1250,1400,30,9999);
INSERT INTO EMP VALUES(100,'BLAKE','MANAGER',7839,'1985-12-12',2850,NULL,30,9999);
INSERT INTO EMP VALUES(200,'CLARK','MANAGER',7839,'1986-12-12',2450,NULL,10,9999);
INSERT INTO EMP VALUES(100,'BLAKE','MANAGER',7839,'1985-12-12',2850,NULL,30,9999);
INSERT INTO EMP VALUES(200,'CLARK','MANAGER',7839,'1986-12-12',2450,NULL,10,9999);
INSERT INTO EMP VALUES(300,'SCOTT','ANALYST',7566,'1987-12-12',3000,NULL,20,9999);
INSERT INTO EMP VALUES(400,'KING','PRESIDENT',NULL,'1988-12-12',5000,NULL,10,9999);
INSERT INTO EMP VALUES(1000,'TURNER','SALESMAN',7698,'1989-12-12',1500,0,30,9999);
INSERT INTO EMP VALUES(2000,'ADAMS','CLERK',7788,'1990-12-12',1100,NULL,20,9999);
INSERT INTO EMP VALUES(3000,'JAMES','CLERK',7698,'1991-12-12',950,NULL,30,9999);
INSERT INTO EMP VALUES(1000,'FORD','ANALYST',7566,'1992-12-12',3000,NULL,20,9999);
INSERT INTO EMP VALUES(5000,'MILLER','CLERK',7782,'1993-12-12',1300,NULL,10,9999);
create table  emp001   as select * from   emp;
create table  emp002   as select * from   emp;
SELECT    sum(e.empno)  z, sum(e.sal) x,sum(r.empno) c , sum(r.sal) v  FROM      (SELECT     *      FROM    EMP001      minus    select    *     FROM    EMP002)   e                     join EMP001 r  on e.empno = r.empno   ORDER BY  z,x,c,v;
z	x	c	v
NULL	NULL	NULL	NULL
SELECT    sum(e.empno)  z, sum(e.sal) x,sum(r.empno) c , sum(r.sal) v  FROM      (SELECT     *      FROM    EMP001      UNION    select    *     FROM    EMP002)   e                     join EMP001 r  on e.empno = r.empno    ORDER BY  z,x,c,v;
z	x	c	v
15315	38825	15315	38825
SELECT    sum(e.empno)  z, sum(e.sal) x,sum(r.empno) c , sum(r.sal) v  FROM      (SELECT     *      FROM    EMP001      UNION  all    select    *     FROM    EMP002)   e                     join EMP001 r  on e.empno = r.empno    ORDER BY  z,x,c,v;
z	x	c	v
31830	98850	31830	98850
SELECT    sum(e.empno)  z, sum(e.sal) x,sum(r.empno) c , sum(r.sal) v  FROM      (SELECT     *      FROM    EMP001      INTERSECT    select    *     FROM    EMP002)   e                     join EMP001 r  on e.empno = r.empno    ORDER BY  z,x,c,v;
z	x	c	v
15315	38825	15315	38825
minus-4-2-2 
SELECT    sum(e.empno) , sum(e.sal),sum(r.empno) , sum(r.sal)   FROM      (SELECT     *      FROM    EMP001      minus    select    *     FROM    EMP002)   e       left     join EMP001 r  on e.empno = r.empno   ORDER BY  e.empno;
sum(e.empno)	sum(e.sal)	sum(r.empno)	sum(r.sal)
NULL	NULL	NULL	NULL
SELECT    sum(e.empno) , sum(e.sal),sum(r.empno) , sum(r.sal)   FROM      (SELECT     *      FROM    EMP001      minus    select    *     FROM    EMP002)   e    left outer      join EMP001 r  on e.empno = r.empno   ORDER BY  e.empno;
sum(e.empno)	sum(e.sal)	sum(r.empno)	sum(r.sal)
NULL	NULL	NULL	NULL
SELECT    sum(e.empno) , sum(e.sal),sum(r.empno) , sum(r.sal)   FROM      (SELECT     *      FROM    EMP001      UNION    select    *     FROM    EMP002)   e       left     join EMP001 r  on e.empno = r.empno   ORDER BY  e.empno;
sum(e.empno)	sum(e.sal)	sum(r.empno)	sum(r.sal)
15315	38825	15315	38825
SELECT    sum(e.empno) , sum(e.sal),sum(r.empno) , sum(r.sal)   FROM      (SELECT     *      FROM    EMP001      UNION    select    *     FROM    EMP002)   e    left outer      join EMP001 r  on e.empno = r.empno   ORDER BY  e.empno;
sum(e.empno)	sum(e.sal)	sum(r.empno)	sum(r.sal)
15315	38825	15315	38825
SELECT    sum(e.empno) , sum(e.sal),sum(r.empno) , sum(r.sal)   FROM      (SELECT     *      FROM    EMP001      UNION  all    select    *     FROM    EMP002)   e       left     join EMP001 r  on e.empno = r.empno   ORDER BY  e.empno;
sum(e.empno)	sum(e.sal)	sum(r.empno)	sum(r.sal)
31830	98850	31830	98850
SELECT    sum(e.empno) , sum(e.sal),sum(r.empno) , sum(r.sal)   FROM      (SELECT     *      FROM    EMP001      UNION  all    select    *     FROM    EMP002)   e    left outer      join EMP001 r  on e.empno = r.empno   ORDER BY  e.empno;
sum(e.empno)	sum(e.sal)	sum(r.empno)	sum(r.sal)
31830	98850	31830	98850
SELECT    sum(e.empno) , sum(e.sal),sum(r.empno) , sum(r.sal)   FROM      (SELECT     *      FROM    EMP001      INTERSECT    select    *     FROM    EMP002)   e       left     join EMP001 r  on e.empno = r.empno   ORDER BY  e.empno;
sum(e.empno)	sum(e.sal)	sum(r.empno)	sum(r.sal)
15315	38825	15315	38825
SELECT    sum(e.empno) , sum(e.sal),sum(r.empno) , sum(r.sal)   FROM      (SELECT     *      FROM    EMP001      INTERSECT    select    *     FROM    EMP002)   e    left outer      join EMP001 r  on e.empno = r.empno   ORDER BY  e.empno;
sum(e.empno)	sum(e.sal)	sum(r.empno)	sum(r.sal)
15315	38825	15315	38825
minus-4-2-3
SELECT    sum(e.empno) , sum(e.sal),sum(r.empno) , sum(r.sal)   FROM      (SELECT     *      FROM    EMP001      minus    select    *     FROM    EMP002)   e       right     join EMP001 r  on e.empno = r.empno   ORDER BY  e.empno;
sum(e.empno)	sum(e.sal)	sum(r.empno)	sum(r.sal)
NULL	NULL	13315	34325
SELECT    sum(e.empno) , sum(e.sal),sum(r.empno) , sum(r.sal)   FROM      (SELECT     *      FROM    EMP001      minus    select    *     FROM    EMP002)   e    right outer      join EMP001 r  on e.empno = r.empno   ORDER BY  e.empno;
sum(e.empno)	sum(e.sal)	sum(r.empno)	sum(r.sal)
NULL	NULL	13315	34325
SELECT    sum(e.empno) , sum(e.sal),sum(r.empno) , sum(r.sal)   FROM      (SELECT     *      FROM    EMP001      UNION    select    *     FROM    EMP002)   e       right     join EMP001 r  on e.empno = r.empno   ORDER BY  e.empno;
sum(e.empno)	sum(e.sal)	sum(r.empno)	sum(r.sal)
15315	38825	15315	38825
SELECT    sum(e.empno) , sum(e.sal),sum(r.empno) , sum(r.sal)   FROM      (SELECT     *      FROM    EMP001      UNION    select    *     FROM    EMP002)   e    right outer      join EMP001 r  on e.empno = r.empno   ORDER BY  e.empno;
sum(e.empno)	sum(e.sal)	sum(r.empno)	sum(r.sal)
15315	38825	15315	38825
SELECT    sum(e.empno) , sum(e.sal),sum(r.empno) , sum(r.sal)   FROM      (SELECT     *      FROM    EMP001      UNION  all    select    *     FROM    EMP002)   e       right     join EMP001 r  on e.empno = r.empno   ORDER BY  e.empno;
sum(e.empno)	sum(e.sal)	sum(r.empno)	sum(r.sal)
31830	98850	31830	98850
SELECT    sum(e.empno) , sum(e.sal),sum(r.empno) , sum(r.sal)   FROM      (SELECT     *      FROM    EMP001      UNION  all     select    *     FROM    EMP002)   e    right outer      join EMP001 r  on e.empno = r.empno   ORDER BY  e.empno;
sum(e.empno)	sum(e.sal)	sum(r.empno)	sum(r.sal)
31830	98850	31830	98850
SELECT    sum(e.empno) , sum(e.sal),sum(r.empno) , sum(r.sal)   FROM      (SELECT     *      FROM    EMP001      INTERSECT    select    *     FROM    EMP002)   e       right     join EMP001 r  on e.empno = r.empno   ORDER BY  e.empno;
sum(e.empno)	sum(e.sal)	sum(r.empno)	sum(r.sal)
15315	38825	15315	38825
SELECT    sum(e.empno) , sum(e.sal),sum(r.empno) , sum(r.sal)   FROM      (SELECT     *      FROM    EMP001      INTERSECT    select    *     FROM    EMP002)   e    right outer      join EMP001 r  on e.empno = r.empno   ORDER BY  e.empno;
sum(e.empno)	sum(e.sal)	sum(r.empno)	sum(r.sal)
15315	38825	15315	38825
minus-4-2-4   全连接full join
SELECT    sum(e.empno) , sum(e.sal),sum(r.empno) , sum(r.sal)   FROM      (SELECT     *      FROM    EMP001      minus    select    *     FROM    EMP002)   e       full     join EMP001 r  on e.empno = r.empno   ORDER BY  e.empno;
sum(e.empno)	sum(e.sal)	sum(r.empno)	sum(r.sal)
NULL	NULL	13315	34325
SELECT    sum(e.empno) , sum(e.sal),sum(r.empno) , sum(r.sal)   FROM      (SELECT     *      FROM    EMP001      UNION    select    *     FROM    EMP002)   e       full     join EMP001 r  on e.empno = r.empno   ORDER BY  e.empno;
sum(e.empno)	sum(e.sal)	sum(r.empno)	sum(r.sal)
15315	38825	15315	38825
SELECT    sum(e.empno) , sum(e.sal),sum(r.empno) , sum(r.sal)   FROM      (SELECT     *      FROM    EMP001      UNION  all    select    *     FROM    EMP002)   e       full     join EMP001 r  on e.empno = r.empno   ORDER BY  e.empno;
sum(e.empno)	sum(e.sal)	sum(r.empno)	sum(r.sal)
31830	98850	31830	98850
SELECT    sum(e.empno) , sum(e.sal),sum(r.empno) , sum(r.sal)   FROM      (SELECT     *      FROM    EMP001      INTERSECT    select    *     FROM    EMP002)   e       full     join EMP001 r  on e.empno = r.empno   ORDER BY  e.empno;
sum(e.empno)	sum(e.sal)	sum(r.empno)	sum(r.sal)
15315	38825	15315	38825
子查询  in    minus-4-3-1 
SELECT     empno    FROM emp001  t    WHERE deptno IN     (SELECT     deptno      FROM (SELECT     *      FROM     EMP001  e      minus    select    *     FROM    EMP002  r)t)   ORDER  BY   t.empno;
empno
SELECT     empno    FROM emp001  t    WHERE deptno IN     (SELECT     deptno      FROM (SELECT     *      FROM     EMP001  e      UNION    select    *     FROM    EMP002  r)t)   ORDER  BY   t.empno;
empno
1
2
3
4
5
100
100
200
200
300
400
1000
1000
2000
3000
5000
SELECT     empno    FROM emp001  t    WHERE deptno IN     (SELECT     deptno      FROM (SELECT     *      FROM     EMP001  e      UNION  all    select    *     FROM    EMP002  r)t)   ORDER  BY   t.empno;
empno
1
2
3
4
5
100
100
200
200
300
400
1000
1000
2000
3000
5000
SELECT     empno    FROM emp001  t    WHERE deptno IN     (SELECT     deptno      FROM (SELECT     *      FROM     EMP001  e      INTERSECT    select    *     FROM    EMP002  r)t)   ORDER  BY   t.empno;
empno
1
2
3
4
5
100
100
200
200
300
400
1000
1000
2000
3000
5000
子查询   not    in    minus-4-3-2
SELECT     empno    FROM emp001  t    WHERE deptno   not  IN     (SELECT     deptno      FROM (SELECT     *      FROM     EMP001  e      minus    select    *     FROM    EMP002  r)t)   ORDER  BY   t.empno;
empno
1
2
3
4
5
100
100
200
200
300
400
1000
1000
2000
3000
5000
SELECT     empno    FROM emp001  t    WHERE deptno  not IN     (SELECT     deptno      FROM (SELECT     *      FROM     EMP001  e      UNION    select    *     FROM    EMP002  r)t)   ORDER  BY   t.empno;
empno
SELECT     empno    FROM emp001  t    WHERE deptno  not IN     (SELECT     deptno      FROM (SELECT     *      FROM     EMP001  e      UNION  all    select    *     FROM    EMP002  r)t)   ORDER  BY   t.empno;
empno
SELECT     empno    FROM emp001  t    WHERE deptno  not IN     (SELECT     deptno      FROM (SELECT     *      FROM     EMP001  e      INTERSECT    select    *     FROM    EMP002  r)t)   ORDER  BY   t.empno;
empno
minus-5-1-1    两表都是空表
DELETE  from   emp001;
delete    from   emp002;
SELECT     *      FROM    EMP001      minus    select    *     FROM    EMP002;
empno	ename	job	mgr	hiredate	sal	comm	deptno	comid
SELECT     *      FROM    EMP001      UNION    select    *     FROM    EMP002;
empno	ename	job	mgr	hiredate	sal	comm	deptno	comid
SELECT     *      FROM    EMP001      UNION  all    select    *     FROM    EMP002;
empno	ename	job	mgr	hiredate	sal	comm	deptno	comid
SELECT     *      FROM    EMP001      INTERSECT    select    *     FROM    EMP002;
empno	ename	job	mgr	hiredate	sal	comm	deptno	comid
minus-5-1-2    一个表为空一个表有数据
INSERT INTO  EMP001 VALUES(null,'SMITH100','CLERK',7901,'1988-12-12',600,NULL,20,10);
SELECT     *      FROM    EMP001      minus    select    *     FROM    EMP002;
empno	ename	job	mgr	hiredate	sal	comm	deptno	comid
NULL	SMITH100	CLERK	7901	1988-12-12	600	NULL	20	10
SELECT     *      FROM    EMP001      UNION    select    *     FROM    EMP002;
empno	ename	job	mgr	hiredate	sal	comm	deptno	comid
NULL	SMITH100	CLERK	7901	1988-12-12	600	NULL	20	10
SELECT     *      FROM    EMP001      UNION  all    select    *     FROM    EMP002;
empno	ename	job	mgr	hiredate	sal	comm	deptno	comid
NULL	SMITH100	CLERK	7901	1988-12-12	600	NULL	20	10
SELECT     *      FROM    EMP001      INTERSECT    select    *     FROM    EMP002;
empno	ename	job	mgr	hiredate	sal	comm	deptno	comid
DELETE  from   emp001;
delete    from   emp002;
INSERT INTO  EMP002 VALUES(null,'SMITH100','CLERK',7901,'1998-12-12',600,NULL,20,10);
SELECT     *      FROM    EMP001      minus    select    *     FROM    EMP002;
empno	ename	job	mgr	hiredate	sal	comm	deptno	comid
SELECT     *      FROM    EMP001      UNION    select    *     FROM    EMP002;
empno	ename	job	mgr	hiredate	sal	comm	deptno	comid
NULL	SMITH100	CLERK	7901	1998-12-12	600	NULL	20	10
SELECT     *      FROM    EMP001      UNION  all    select    *     FROM    EMP002;
empno	ename	job	mgr	hiredate	sal	comm	deptno	comid
NULL	SMITH100	CLERK	7901	1998-12-12	600	NULL	20	10
SELECT     *      FROM    EMP001      INTERSECT    select    *     FROM    EMP002;
empno	ename	job	mgr	hiredate	sal	comm	deptno	comid
minus-5-1-3   两表数据条数一样        
DELETE  from   emp001;
delete    from   emp002;
INSERT INTO  EMP001 VALUES(null,'SMITH100','CLERK',7901,'1998-12-12',600,NULL,20,9999);
INSERT INTO  EMP002 VALUES(null,'SMITH100','CLERK',7901,'1998-12-12',600,NULL,20,9999);
INSERT INTO  EMP001 VALUES(null,'SMITH100','CLERK',7901,'1998-12-12',600,NULL,20,9999);
INSERT INTO  EMP002 VALUES(null,'SMITH100','CLERK',7901,'1998-12-12',600,NULL,20,9999);
INSERT INTO  EMP001 VALUES(null,'SMITH100','CLERK',7901,'1998-12-12',600,NULL,20,9999);
INSERT INTO  EMP002 VALUES(null,'SMITH100','CLERK',7901,'1998-12-12',600,NULL,20,9999);
INSERT INTO  EMP001 VALUES(null,'SMITH100','CLERK',7901,'1998-12-12',600,NULL,20,9999);
INSERT INTO  EMP002 VALUES(null,'SMITH100','CLERK',7901,'1998-12-12',600,NULL,20,9999);
INSERT INTO  EMP001 VALUES(null,'SMITH100','CLERK',7901,'1998-12-12',600,NULL,20,9999);
INSERT INTO  EMP002 VALUES(null,'SMITH100','CLERK',7901,'1998-12-12',600,NULL,20,9999);
SELECT    *       FROM    EMP001      minus    select    *     FROM    EMP002;
empno	ename	job	mgr	hiredate	sal	comm	deptno	comid
SELECT    *       FROM    EMP001      UNION    select    *     FROM    EMP002;
empno	ename	job	mgr	hiredate	sal	comm	deptno	comid
NULL	SMITH100	CLERK	7901	1998-12-12	600	NULL	20	9999
SELECT    *       FROM    EMP001      UNION  all    select    *     FROM    EMP002;
empno	ename	job	mgr	hiredate	sal	comm	deptno	comid
NULL	SMITH100	CLERK	7901	1998-12-12	600	NULL	20	9999
NULL	SMITH100	CLERK	7901	1998-12-12	600	NULL	20	9999
NULL	SMITH100	CLERK	7901	1998-12-12	600	NULL	20	9999
NULL	SMITH100	CLERK	7901	1998-12-12	600	NULL	20	9999
NULL	SMITH100	CLERK	7901	1998-12-12	600	NULL	20	9999
NULL	SMITH100	CLERK	7901	1998-12-12	600	NULL	20	9999
NULL	SMITH100	CLERK	7901	1998-12-12	600	NULL	20	9999
NULL	SMITH100	CLERK	7901	1998-12-12	600	NULL	20	9999
NULL	SMITH100	CLERK	7901	1998-12-12	600	NULL	20	9999
NULL	SMITH100	CLERK	7901	1998-12-12	600	NULL	20	9999
SELECT    *       FROM    EMP001      INTERSECT    select    *     FROM    EMP002;
empno	ename	job	mgr	hiredate	sal	comm	deptno	comid
NULL	SMITH100	CLERK	7901	1998-12-12	600	NULL	20	9999
minus-5-1-4  两表数据条数不一样        
DELETE  from   emp001;
delete    from   emp002;
INSERT INTO  EMP001 VALUES(1,'SMITH100','CLERK',7901,'1991-12-12',600,NULL,20,9999);
INSERT INTO  EMP002 VALUES(2,'SMITH100','CLERK',7901,'1992-12-12',610,NULL,20,9999);
INSERT INTO  EMP001 VALUES(1,'SMITH100','CLERK',7901,'1993-12-12',620,NULL,20,9999);
INSERT INTO  EMP002 VALUES(4,'SMITH100','CLERK',7901,'1994-12-12',630,NULL,20,9999);
INSERT INTO  EMP001 VALUES(5,'SMITH100','CLERK',7901,'1995-12-12',640,NULL,20,9999);
INSERT INTO  EMP002 VALUES(1,'SMITH100','CLERK',7901,'1996-12-12',650,NULL,20,9999);
INSERT INTO  EMP001 VALUES(7,'SMITH100','CLERK',7901,'1997-12-12',660,NULL,20,9999);
INSERT INTO  EMP002 VALUES(9,'SMITH100','CLERK',7901,'1998-12-12',670,NULL,20,9999);
INSERT INTO  EMP001 VALUES(9,'SMITH100','CLERK',7901,'1999-12-12',680,NULL,20,9999);
SELECT   count(*)   FROM   (SELECT     *      FROM    EMP001      minus    select    *     FROM    EMP002)e;
count(*)
5
SELECT   count(*)   FROM   (SELECT     *      FROM    EMP001      UNION    select    *     FROM    EMP002)e;
count(*)
9
SELECT   count(*)   FROM   (SELECT     *      FROM    EMP001      UNION  all    select    *     FROM    EMP002)e;
count(*)
9
SELECT   count(*)   FROM   (SELECT     *      FROM    EMP001      INTERSECT    select    *     FROM    EMP002)e;
count(*)
0
minus-5-1-5   两表参与字段一样            
DELETE  from   emp001;
delete    from   emp002;
INSERT INTO  EMP001 VALUES(1,'SMITH100','CLERK',7901,'1999-12-12',600,NULL,20,9999);
INSERT INTO  EMP001 VALUES(2,'SMITH100','CLERK',7902,'1999-12-12',600,NULL,20,9999);
INSERT INTO  EMP001 VALUES(3,'SMITH100','CLERK',7903,'1999-12-12',600,NULL,20,9999);
INSERT INTO  EMP001 VALUES(4,'SMITH100','CLERK',7904,'1999-12-12',600,NULL,20,9999);
INSERT INTO  EMP001 VALUES(5,'SMITH100','CLERK',7905,'1999-12-12',600,NULL,20,9999);
INSERT INTO  EMP002 VALUES(1,'SMITH100','CLERK',7901,'1999-12-12',600,NULL,20,9999);
INSERT INTO  EMP002 VALUES(2,'SMITH100','CLERK',7902,'1999-12-12',600,NULL,20,9999);
INSERT INTO  EMP002 VALUES(3,'SMITH100','CLERK',7903,'1999-12-12',600,NULL,20,9999);
INSERT INTO  EMP002 VALUES(4,'SMITH100','CLERK',1000,'1999-12-12',600,NULL,20,9999);
INSERT INTO  EMP002 VALUES(5,'SMITH100','CLERK',2000,'1999-12-12',600,NULL,20,9999);
SELECT   count(*)   FROM   (SELECT     EMPNO,sal,DEPTNO     FROM    EMP001      minus    select    EMPNO,sal,DEPTNO         FROM    EMP002)e;
count(*)
0
SELECT   count(*)   FROM   (SELECT     EMPNO,sal,DEPTNO     FROM    EMP001      UNION    select    EMPNO,sal,DEPTNO         FROM    EMP002)e;
count(*)
5
SELECT   count(*)   FROM   (SELECT     EMPNO,sal,DEPTNO     FROM    EMP001      UNION  all    select    EMPNO,sal,DEPTNO         FROM    EMP002)e;
count(*)
10
SELECT   count(*)   FROM   (SELECT     EMPNO,sal,DEPTNO     FROM    EMP001      INTERSECT    select    EMPNO,sal,DEPTNO         FROM    EMP002)e;
count(*)
5
minus-5-1-6-1   两表参与字段不一样    字段的数据类型不同   
DELETE  from   emp001;
delete    from   emp002;
INSERT INTO  EMP001 VALUES(1,'SMITH100','CLERK',7901,'1999-12-12',600,NULL,20,9999);
INSERT INTO  EMP001 VALUES(2,'SMITH100','CLERK',7902,'1999-12-12',600,NULL,20,9999);
INSERT INTO  EMP001 VALUES(3,'SMITH100','CLERK',7903,'1999-12-12',600,NULL,20,9999);
INSERT INTO  EMP001 VALUES(4,'SMITH100','CLERK',7904,'1999-12-12',600,NULL,20,9999);
INSERT INTO  EMP001 VALUES(5,'SMITH100','CLERK',7905,'1999-12-12',600,NULL,20,9999);
INSERT INTO  EMP002 VALUES(1,'SMITH100','CLERK',7901,'1999-12-12',600,NULL,20,9999);
INSERT INTO  EMP002 VALUES(2,'SMITH100','CLERK',7902,'1999-12-12',600,NULL,20,9999);
INSERT INTO  EMP002 VALUES(3,'SMITH100','CLERK',7903,'1999-12-12',600,NULL,20,9999);
INSERT INTO  EMP002 VALUES(4,'SMITH100','CLERK',1000,'1999-12-12',600,NULL,20,9999);
INSERT INTO  EMP002 VALUES(5,'SMITH100','CLERK',2000,'1999-12-12',600,NULL,20,9999);
SELECT   count(*)   FROM   (SELECT     EMPNO,sal,DEPTNO     FROM    EMP001      minus    select    EMPNO,sal,HIREDATE         FROM    EMP002   ORDER BY    EMPNO)e;
count(*)
5
SELECT   count(*)   FROM   (SELECT     EMPNO,sal,DEPTNO     FROM    EMP001      UNION    select    EMPNO,sal,HIREDATE         FROM    EMP002   ORDER BY    EMPNO)e;
count(*)
10
SELECT   count(*)   FROM   (SELECT     EMPNO,sal,DEPTNO     FROM    EMP001      UNION  ALL     select    EMPNO,sal,HIREDATE         FROM    EMP002   ORDER BY    EMPNO)e;
count(*)
10
SELECT   count(*)   FROM   (SELECT     EMPNO,sal,DEPTNO     FROM    EMP001      INTERSECT    select    EMPNO,sal,HIREDATE         FROM    EMP002   ORDER BY    EMPNO)e;
count(*)
0
minus-5-1-6-2   两表参与字段不一样    字段的数据类型相同   
DELETE  from   emp001;
delete    from   emp002;
INSERT INTO  EMP001 VALUES(1,'SMITH100','CLERK',7901,'1999-12-12',600,NULL,20,9999);
INSERT INTO  EMP001 VALUES(2,'SMITH100','CLERK',7902,'1999-12-12',600,NULL,20,9999);
INSERT INTO  EMP001 VALUES(3,'SMITH100','CLERK',7903,'1999-12-12',600,NULL,20,9999);
INSERT INTO  EMP001 VALUES(4,'SMITH100','CLERK',7904,'1999-12-12',600,NULL,20,9999);
INSERT INTO  EMP001 VALUES(5,'SMITH100','CLERK',7905,'1999-12-12',600,NULL,20,9999);
INSERT INTO  EMP002 VALUES(1,'SMITH100','CLERK',7901,'1999-12-12',600,NULL,20,9999);
INSERT INTO  EMP002 VALUES(2,'SMITH100','CLERK',7902,'1999-12-12',600,NULL,20,9999);
INSERT INTO  EMP002 VALUES(3,'SMITH100','CLERK',7903,'1999-12-12',600,NULL,20,9999);
INSERT INTO  EMP002 VALUES(4,'SMITH100','CLERK',1000,'1999-12-12',600,NULL,20,9999);
INSERT INTO  EMP002 VALUES(5,'SMITH100','CLERK',2000,'1999-12-12',600,NULL,20,9999);
SELECT     EMPNO,sal,DEPTNO     FROM    EMP001      minus    select    EMPNO,sal,sal         FROM    EMP002   ORDER BY      EMPNO,sal,DEPTNO   ;
EMPNO	sal	DEPTNO
1	600	20
2	600	20
3	600	20
4	600	20
5	600	20
SELECT     EMPNO,sal,DEPTNO     FROM    EMP001      UNION    select    EMPNO,sal,sal         FROM    EMP002   ORDER BY      EMPNO,sal,DEPTNO   ;
EMPNO	sal	DEPTNO
1	600	20
1	600	600
2	600	20
2	600	600
3	600	20
3	600	600
4	600	20
4	600	600
5	600	20
5	600	600
SELECT     EMPNO,sal,DEPTNO     FROM    EMP001      UNION  ALL      select    EMPNO,sal,sal         FROM    EMP002   ORDER BY      EMPNO,sal,DEPTNO   ;
EMPNO	sal	DEPTNO
1	600	20
1	600	600
2	600	20
2	600	600
3	600	20
3	600	600
4	600	20
4	600	600
5	600	20
5	600	600
SELECT     EMPNO,sal,DEPTNO     FROM    EMP001      INTERSECT    select    EMPNO,sal,sal         FROM    EMP002   ORDER BY      EMPNO,sal,DEPTNO   ;
EMPNO	sal	DEPTNO
drop   table  if  exists   t_user;
create TABLE t_user(id   INTEGER,no   INTEGER,ename   VARCHAR(100),age   INTEGER,level_no   INTEGER);
INSERT INTO t_user VALUES(1,00001,'a',25,1);
INSERT INTO t_user VALUES(2,00002,'b',30,2);
INSERT INTO t_user VALUES(3,00003,'c',35,3);
INSERT INTO t_user VALUES(4,00004,'d',45,1);
INSERT INTO t_user VALUES(5,00005,'e',30,2);
INSERT INTO t_user VALUES(5,00005,'e',30,2);
INSERT INTO t_user VALUES(5,00005,'e',30,2);
INSERT INTO t_user VALUES(5,00005,'e',30,2);
INSERT INTO t_user VALUES(5,00005,'e',30,2);
INSERT INTO t_user VALUES(5,00005,'e',30,2);
INSERT INTO t_user VALUES(6,00006,'f',35,3);
INSERT INTO t_user VALUES(7,00007,'g',25,1);
INSERT INTO t_user VALUES(8,00008,'h',35,2);
INSERT INTO t_user VALUES(9,00009,'i',20,3);
INSERT INTO t_user VALUES(10,00010,'j',25,1);
minus-5-2-1  参与字段没有重复数据
select SUM(id)   FROM   (select id   from t_user where id<10 minus select id from t_user where id between 3 and 7)e;
SUM(id)
20
select SUM(id)   FROM   (select id   from t_user where id<10 UNION select id from t_user where id between 3 and 7)e;
SUM(id)
45
select SUM(id)   FROM   (select id   from t_user where id<10 UNION  ALL select id from t_user where id between 3 and 7)e;
SUM(id)
120
select SUM(id)   FROM   (select id   from t_user where id<10 INTERSECT select id from t_user where id between 3 and 7)e;
SUM(id)
25
minus-5-2-2  参与字段有重复数据
select age,level_no   EEE   from t_user where id<8 minus select age,level_no from t_user where level_no=3  ORDER BY  age,EEE;
age	EEE
25	1
30	2
45	1
select age,level_no+100   EEE  from t_user where id<8 minus select age,level_no from t_user where level_no=3  ORDER BY  age,EEE;
age	EEE
25	101
30	102
35	103
45	101
select age,level_no   EEE   from t_user where id<8 UNION select age,level_no from t_user where level_no=3  ORDER BY  age,EEE;
age	EEE
20	3
25	1
30	2
35	3
45	1
select age,level_no+100   EEE  from t_user where id<8 UNION select age,level_no from t_user where level_no=3  ORDER BY  age,EEE;
age	EEE
20	3
25	101
30	102
35	3
35	103
45	101
select age,level_no   EEE   from t_user where id<8 UNION  ALL   select age,level_no from t_user where level_no=3  ORDER BY  age,EEE;
age	EEE
20	3
25	1
25	1
30	2
30	2
30	2
30	2
30	2
30	2
30	2
35	3
35	3
35	3
35	3
45	1
select age,level_no+100   EEE  from t_user where id<8 UNION  ALL   select age,level_no from t_user where level_no=3  ORDER BY  age,EEE;
age	EEE
20	3
25	101
25	101
30	102
30	102
30	102
30	102
30	102
30	102
30	102
35	3
35	3
35	103
35	103
45	101
select age,level_no   EEE   from t_user where id<8 INTERSECT select age,level_no from t_user where level_no=3  ORDER BY  age,EEE;
age	EEE
35	3
select age,level_no+100   EEE  from t_user where id<8 INTERSECT select age,level_no from t_user where level_no=3  ORDER BY  age,EEE;
age	EEE
minus-5-3-1   字段类型不一样
SELECT    count(*)   FROM    (SELECT   CAST(sal as  char)     FROM EMP001   minus    SELECT  ename    FROM EMP002)e;
count(*)
1
SELECT    count(*)   FROM    (SELECT   CAST(sal as  char)     FROM EMP001   UNION    SELECT  ename    FROM EMP002)e;
count(*)
2
SELECT    count(*)   FROM    (SELECT   CAST(sal as  char)     FROM EMP001   UNION   all    SELECT  ename    FROM EMP002)e;
count(*)
10
SELECT    count(*)   FROM    (SELECT   CAST(sal as  char)     FROM EMP001   INTERSECT    SELECT  ename    FROM EMP002)e;
count(*)
0
minus-5-3-2     其他
select deptno,job,sum(sal) from EMP002 group by deptno,job
INTERSECT
select deptno,cast(null as  char),sum(sal) from EMP001 group by deptno
UNION    all
SELECT 900,cast(null as   char),sum(sal) from EMP001
UNION   
select deptno,cast(null as  char),sum(sal) from EMP001 group by deptno
UNION   
select deptno,cast(deptno   as  char),sum(deptno) from EMP001 group by deptno,NULL,comm,'','   '
UNION    all
select deptno,cast(null as  char),sum(sal) from EMP001 group by deptno
UNION   
select 100,'hello',sum(sal) from EMP001
UNION   
select 100,'hello',200 from dual
MINUS
select deptno,job,sum(sal) from EMP001 group by deptno,job
INTERSECT
select deptno,cast(null as  char),sum(sal) from EMP001 group by deptno
UNION   
select 100,'hello',sum(sal) from EMP002
MINUS
select deptno,job,sum(sal) from EMP001 group by deptno,job
INTERSECT
select deptno,cast(null  as  char),sum(sal) from EMP001 group by deptno
UNION   
select 100,'hello',sum(sal) from EMP001
MINUS
select deptno,job,sum(sal) from EMP001 group by deptno,job
INTERSECT
select deptno,cast(null  as   char),sum(sal) from EMP001 group by deptno
UNION   
select 100,'hello',sum(sal) from EMP002
MINUS
select deptno,job,sum(sal) from EMP001 group by deptno,job
INTERSECT
select deptno,cast(null  as  char),sum(sal) from EMP001 group by deptno
UNION       
select 100,'hello',sum(sal) from EMP001
MINUS
select deptno,job,sum(sal) from EMP002 group by deptno,job
INTERSECT
select deptno,cast(null  as  char),sum(sal) from EMP001 group by deptno
MINUS
SELECT  20,NULL,1400  FROM   dual
MINUS
SELECT  30,NULL,1890  FROM   dual
MINUS
SELECT  1550,NULL,40  FROM   dual;
deptno	job	sum(sal)
20	NULL	3000
drop procedure if exists onehundredthousand;
create  procedure onehundredthousand()
begin  
declare i INTEGER;
while i < 100000 do  
INSERT INTO EMP001 VALUES(1,CONCAT('SMITH003',i,'CLERK',7903,'1998-12-21','dd-mm-yyyy'),1000,NULL,40,i);
INSERT INTO EMP002 VALUES(1,CONCAT('SMITH003',i,'CLERK',7903,'1997-12-12','dd-mm-yyyy'),1000,NULL,40,i);
end while;  
end;
/
CALL   onehundredthousand();
SELECT   count(*)   FROM   (SELECT     *      FROM    EMP001      MINUS    select    *     FROM    EMP002)e;
count(*)
2
SELECT   count(*)   FROM   (SELECT     *      FROM    EMP001      UNION    select    *     FROM    EMP002)e;
count(*)
7
SELECT   count(*)   FROM   (SELECT     *      FROM    EMP001      UNION  all    select    *     FROM    EMP002)e;
count(*)
10
SELECT   count(*)   FROM   (SELECT     *      FROM    EMP001      INTERSECT    select    *     FROM    EMP002)e;
count(*)
3
drop   table  if  exists   EMP;
create TABLE EMP(empno   INTEGER,ename   VARCHAR(100),job  VARCHAR(100),mgr   INTEGER,hiredate TIMESTAMP(1),sal   INTEGER,comm   INTEGER,deptno INTEGER,deptnoname   char(100));
INSERT INTO EMP VALUES(1,'1SMITH','CLERK',7902,'1994-12-15',800,100,20,'分部1');
INSERT INTO EMP VALUES(4,'2JONES','MANAGER',7839,'1994-12-15',801,200,20,'分部2');
INSERT INTO EMP VALUES(5,'3SCOTT','ANALYST',7566,'1994-12-15',802,NULL,20,'分部3');
INSERT INTO EMP VALUES(1,'4ADAMS','CLERK',7788,'1994-12-15',1100,300,20,'分部4');
INSERT INTO EMP VALUES(2,'5FORD','ANALYST',7566,'1994-12-15',1101,400,20,'分部5');
INSERT INTO EMP VALUES(2,'6LUALLEN','SALESMAN',7698,'1994-12-15',1103,500,30,'分部6');
INSERT INTO EMP VALUES(3,'7KAWARD','SALESMAN',7698,'1994-12-15',1104,600,30,'分部7');
INSERT INTO EMP VALUES(5,'8YRMARTIN','SALESMAN',7698,'1994-12-15',1105,700,30,'分部8');
INSERT INTO EMP VALUES(6,'9DDBLAKE','MANAGER',7839,'1994-12-15',2000,NULL,30,'分部9');
INSERT INTO EMP VALUES(7,'10NGTURNER','SALESMAN',7698,'1994-12-15',2001,900,30,'分部10');
INSERT INTO EMP VALUES(9,'11WQJAMES','CLERK',7698,'1994-12-15',2002,NULL,30,'分部11');
INSERT INTO EMP VALUES(8,'12CLARK','MANAGER',7839,'1994-12-15',2003,NULL,10,'分部12');
INSERT INTO EMP VALUES(4,'13TOM','PRESIDENT',NULL,'1994-12-15',3000,NULL,10,'分部13');
INSERT INTO EMP VALUES(5,'14LOCY','CLERK',7782,'1994-12-15',1000,1000,10,'分部14');
INSERT INTO EMP VALUES(3,'15JACK','CLERK',7782,'1994-12-15',801,NULL,10,'分部15');
INSERT INTO EMP VALUES(7,'16MARKDAN','CLERK',7782,'1994-12-15',1701,1100,10,'分部16');
INSERT INTO EMP VALUES(6,'17CHEGNLONG','CLERK',7782,'1994-12-15',1702,1200,10,'分部17');
INSERT INTO EMP VALUES(6,'18JINBAO','CLERK',7782,'1994-12-15',1703,1300,10,'分部18');
INSERT INTO EMP VALUES(5,'19LILIANJIE','CLERK',7782,'1994-12-15',1704,1400,10,'分部19');
INSERT INTO EMP VALUES(4,'20TELANGPU','CLERK',7782,'1994-12-15',1705,NULL,10,'分部20');
INSERT INTO EMP VALUES(9,'11WQJAMES','CLERK',7698,'1994-12-15',2002,NULL,30,'分部11');
INSERT INTO EMP VALUES(2,'5FORD','ANALYST',7566,'1994-12-15',1101,400,20,'分部5');
INSERT INTO EMP VALUES(9500,'99FORD','ANALYST',7566,'1994-12-15',1101,400,20,'分部5');
minus-6-1-1 无参数的存储过程
drop procedure if exists pl_test;/
create  procedure pl_test()  
begin  
declare  i TINYINT;  
SELECT   COUNT(*)   FROM    (SELECT     1   FROM     dual  minus   SELECT     1     FROM     dual)e;
SELECT   COUNT(*)   FROM    (SELECT     1   FROM     dual  UNION   SELECT     1     FROM     dual)e;
SELECT   COUNT(*)   FROM    (SELECT     1   FROM     dual  union  all   SELECT     1     FROM     dual)e;
SELECT   COUNT(*)   FROM    (SELECT     1   FROM     dual  INTERSECT   SELECT     1     FROM     dual)e;
end;
/
call  pl_test();/
COUNT(*)
COUNT(*)
COUNT(*)
COUNT(*)
0
1
2
1
minus-6-1-2    只有一个 in 参数的存储过程
drop procedure if exists pl_test;/
create  procedure pl_test (in numb int)
BEGIN
INSERT INTO EMP VALUES((SELECT   numb   FROM   dual   MINUS   SELECT   numb     FROM   dual),'99FORD','ANALYST',7566,'1997-12-14',1101,400,20,'分部5');
INSERT INTO EMP VALUES((SELECT   numb   FROM   dual   UNION   SELECT   numb     FROM   dual),'99FORD','ANALYST',7566,'1997-12-14',1101,400,20,'分部5');
INSERT INTO EMP VALUES((SELECT   numb   FROM   dual   union  all   SELECT   numb     FROM   dual),'99FORD','ANALYST',7566,'1997-12-14',1101,400,20,'分部5');
INSERT INTO EMP VALUES((SELECT   numb   FROM   dual   INTERSECT   SELECT   numb     FROM   dual),'99FORD','ANALYST',7566,'1997-12-14',1101,400,20,'分部5');
end;
/
call   pl_test(1000);/
ERROR 21000: Subquery returns more than 1 row
minus-6-1-3  
drop procedure if exists pl_test;/
CREATE  PROCEDURE pl_test(out num int)
BEGIN	
SELECT     COUNT(*)  INTO num   FROM (SELECT     empno   FROM   EMP  MINUS  SELECT     empno    FROM   EMP);
SELECT     COUNT(*)  INTO num   FROM (SELECT     empno   FROM   EMP  UNION  SELECT     empno    FROM   EMP);
SELECT     COUNT(*)  INTO num   FROM (SELECT     empno   FROM   EMP  union  all  SELECT     empno    FROM   EMP);
SELECT     COUNT(*)  INTO num   FROM (SELECT     empno   FROM   EMP  INTERSECT  SELECT     empno    FROM   EMP);
END;
/
call   pl_test(@num);/
minus-6-1-4     包含 inout 参数的存储过程,in需要穿参数   out的传变量，in  out 的作in使用就按照in处理 作out使用就按照out处理     ###in out作out使用
drop procedure if exists pl_test;/
CREATE  PROCEDURE pl_test(OUT p1  int,inout p2 int,OUT p3  int)
BEGIN	
SELECT     COUNT(*)  INTO p1    FROM (SELECT     empno   FROM   EMP  MINUS  SELECT     empno    FROM   EMP);
SELECT     COUNT(*)  INTO p2    FROM (SELECT     empno   FROM   EMP  UNION  SELECT     empno    FROM   EMP);
SELECT     COUNT(*)  INTO p3    FROM (SELECT     empno   FROM   EMP  UNION  all  SELECT     empno    FROM   EMP);
SELECT     COUNT(*)  INTO p3    FROM (SELECT     empno   FROM   EMP  INTERSECT  SELECT     empno    FROM   EMP);
INSERT INTO emp   VALUES(1,(SELECT   1  FROM   dual  MINUS   SELECT  2  FROM   dual),'ANALYST',7566,'1998-12-12',p1+p2+p3,400,20,'分部5');
END;
/
call   pl_test(@p1,@p2,@p3);/
minus-6-1-5
drop procedure if exists pl_test;/
CREATE  PROCEDURE pl_test(OUT p1  int,inout p2 int,OUT p3  int)
BEGIN	
SELECT     COUNT(*)  INTO p1    FROM (SELECT     empno   FROM   EMP  MINUS  SELECT     empno    FROM   EMP);
SELECT     COUNT(*)  INTO p2    FROM (SELECT     empno   FROM   EMP  UNION  SELECT     empno    FROM   EMP);
SELECT     COUNT(*)  INTO p3    FROM (SELECT     empno   FROM   EMP  UNION  all  SELECT     empno    FROM   EMP);
SELECT     COUNT(*)  INTO p3    FROM (SELECT     empno   FROM   EMP  INTERSECT  SELECT     empno    FROM   EMP);
INSERT INTO emp   VALUES(1,(SELECT   1  FROM   dual  MINUS   SELECT  2  FROM   dual),'ANALYST',7566,'1998-12-12',p1+p2+p3,400,20,'分部5');
END;
/
set @num01 =350;/
call   pl_test(@p1,@num01,@p3);/
--echo  minus-6-1-6    函数的结果作为存储过程的参数传递
drop function if exists fun_test;/
create  function fun_test()
RETURNS int    
begin   
declare 	result01   int  DEFAULT 0; 
declare 	result02   int  DEFAULT 0; 
declare 	result03  int  DEFAULT 0; 
declare 	result04   int  DEFAULT 0; 
SELECT   count(*)    INTO   result01  FROM    (select   comm      from       EMP     MINUS    select   sal      from       EMP);   
SELECT   count(*)    INTO   result02  FROM    (select   comm      from       EMP     UNION    select   sal      from       EMP);   
SELECT   count(*)    INTO   result03  FROM    (select   comm      from       EMP     union  all    select   sal      from       EMP);   
SELECT   count(*)    INTO   result04  FROM    (select   comm      from       EMP     INTERSECT    select   sal      from       EMP);   
return  result01+result02+result03+result04;  
end;
/
select  fun_test()  from  dual;/
fun_test()
100
drop procedure if exists pl_test;/
CREATE  PROCEDURE pl_test(in p1  int)
BEGIN	
declare  i INT DEFAULT 1;
while
i < 100 DO
INSERT INTO EMP   VALUES(i,(SELECT   1  FROM   dual  MINUS   SELECT  2  FROM   dual),'ANALYST',7566,'1998-12-14',p1,400,20,'分部5');
SET i = i + 1;
END WHILE;
END;
/
set @num02 =fun_test();/
CALL  pl_test(@num02);/
select  count(*)  from emp  e  ORDER BY e.EMPNO,e.sal;/
count(*)
126
minus-6-2-1  无参数的自定义函数
drop function if exists fun_test;/
create  function fun_test()
RETURNS int    
begin   
declare 	result01   int  DEFAULT 0; 
declare 	result02   int  DEFAULT 0; 
declare 	result03   int  DEFAULT 0; 
declare 	result04   int  DEFAULT 0; 
SELECT   count(*)    INTO   result01  FROM    (select   comm      from       EMP     MINUS    select   sal      from       EMP);   
SELECT   count(*)    INTO   result01  FROM    (select   comm      from       EMP     UNION    select   sal      from       EMP);   
SELECT   count(*)    INTO   result01  FROM    (select   comm      from       EMP     union  all    select   sal      from       EMP);   
SELECT   count(*)    INTO   result01  FROM    (select   comm      from       EMP     INTERSECT    select   sal      from       EMP);   
return  result01+result02+result03+result04;  
end;
/
select  fun_test()  from  dual;/
fun_test()
3
minus-6-2-2   自定义函数  有参数
drop function if exists fun_test;/
create  function fun_test(saller002 int)
RETURNS int    
begin   
declare 	result01   int  DEFAULT 0; 
declare 	result02   int  DEFAULT 0; 
declare 	result03   int  DEFAULT 0; 
declare 	result04   int  DEFAULT 0; 
SELECT   count(*)    INTO   result01  FROM    (select   comm      from       EMP     MINUS    select   sal      from       EMP) e   where   e.comm>saller002;   
SELECT   count(*)    INTO   result02  FROM    (select   comm      from       EMP     UNION    select   sal      from       EMP) e   where   e.comm>saller002;   
SELECT   count(*)    INTO   result03  FROM    (select   comm      from       EMP     union  all    select   sal      from       EMP) e   where   e.comm>saller002;   
SELECT   count(*)    INTO   result04  FROM    (select   comm      from       EMP     INTERSECT    select   sal      from       EMP) e   where   e.comm>saller002;   
return  result01+result02+result03+result04;  
end;
/
select  fun_test(100)  from  dual;/
fun_test(100)
183
minus-6-3-1     游标   cursor............. is      
drop procedure if exists pl_test;/
CREATE PROCEDURE pl_test()  
BEGIN  
declare c int;  
declare n varchar(20);  
declare total int default 0;  
declare done int default false;  
declare cur cursor for select  ename, comm      from       EMP     minus    select  ename, sal      from       EMP;
declare continue HANDLER for not found set done = true;  
set total = 0;  
open cur;  
read_loop:loop  
fetch cur into n,c;  
if done then  
leave read_loop;    
end if;  
set total = total + c;  
end loop;  
close cur;  
select total;  
END;
/
call pl_test();/
total
NULL
drop procedure if exists pl_test;/
CREATE PROCEDURE pl_test()  
BEGIN  
declare c int;  
declare n varchar(20);  
declare total int default 0;  
declare done int default false;  
declare cur cursor for select  ename, comm      from       EMP     UNION    select  ename, sal      from       EMP;
declare continue HANDLER for not found set done = true;  
set total = 0;  
open cur;  
read_loop:loop  
fetch cur into n,c;  
if done then  
leave read_loop;    
end if;  
set total = total + c;  
end loop;  
close cur;  
select total;  
END;
/
call pl_test();/
total
NULL
drop procedure if exists pl_test;/
CREATE PROCEDURE pl_test()  
BEGIN  
declare c int;  
declare n varchar(20);  
declare total int default 0;  
declare done int default false;  
declare cur cursor for select  ename, comm      from       EMP     union  all    select  ename, sal      from       EMP;
declare continue HANDLER for not found set done = true;  
set total = 0;  
open cur;  
read_loop:loop  
fetch cur into n,c;  
if done then  
leave read_loop;    
end if;  
set total = total + c;  
end loop;  
close cur;  
select total;  
END;
/
call pl_test();/
total
NULL
drop procedure if exists pl_test;/
CREATE PROCEDURE pl_test()  
BEGIN  
declare c int;  
declare n varchar(20);  
declare total int default 0;  
declare done int default false;  
declare cur cursor for select  ename, comm      from       EMP     INTERSECT    select  ename, sal      from       EMP;
declare continue HANDLER for not found set done = true;  
set total = 0;  
open cur;  
read_loop:loop  
fetch cur into n,c;  
if done then  
leave read_loop;    
end if;  
set total = total + c;  
end loop;  
close cur;  
select total;  
END;
/
call pl_test();/
total
1000
alter system set _rowsets_max_rows = 2;
alter system flush plan cache;
drop table if exists t1, t2, t3;
create table t1 (c1 int, c2 int, c3 int);
create table t2 (c1 int);
create table t3 (c1 int, c2 int, primary key(c1, c2));
insert into t1 values(1,1,1);
insert into t1 values(2,1,1);
insert into t1 values(2,1,2);
insert into t1 values(2,1,3);
insert into t1 values(2,2,1);
insert into t2 values(2);
insert into t3 values(2,1);
explain select /*+no_rewrite*/c1, c2 from (select c1, c2, c3 from t1 order by 1,2,3) t where not exists(select * from t2 where t.c3 = t2.c1) except select c1, c2 from t3;
Query Plan
=======================================================
|ID|OPERATOR               |NAME|EST.ROWS|EST.TIME(us)|
-------------------------------------------------------
|0 |MERGE EXCEPT DISTINCT  |    |3       |96          |
|1 |├─SUBPLAN FILTER       |    |3       |93          |
|2 |│ ├─SUBPLAN SCAN       |t   |5       |4           |
|3 |│ │ └─SORT             |    |5       |4           |
|4 |│ │   └─TABLE FULL SCAN|t1  |5       |3           |
|5 |│ └─TABLE FULL SCAN    |t2  |1       |18          |
|6 |└─TABLE FULL SCAN      |t3  |1       |3           |
=======================================================
Outputs & filters:
-------------------------------------
  0 - output([EXCEPT([1])], [EXCEPT([2])]), filter(nil), rowset=2
  1 - output([t.c1], [t.c2]), filter([(T_OP_NOT_EXISTS, subquery(1))]), rowset=2
      exec_params_([t.c3(:0)]), onetime_exprs_(nil), init_plan_idxs_(nil), use_batch=false
  2 - output([t.c3], [t.c1], [t.c2]), filter(nil), rowset=2
      access([t.c3], [t.c1], [t.c2])
  3 - output([t1.c1], [t1.c2], [t1.c3]), filter(nil), rowset=2
      sort_keys([t1.c1, ASC], [t1.c2, ASC], [t1.c3, ASC])
  4 - output([t1.c1], [t1.c2], [t1.c3]), filter(nil), rowset=2
      access([t1.c1], [t1.c2], [t1.c3]), partitions(p0)
      is_index_back=false, is_global_index=false, 
      range_key([t1.__pk_increment]), range(MIN ; MAX)always true
  5 - output([t2.c1]), filter([:0 = t2.c1]), rowset=2
      access([t2.c1]), partitions(p0)
      is_index_back=false, is_global_index=false, filter_before_indexback[false], 
      range_key([t2.__pk_increment]), range(MIN ; MAX)always true
  6 - output([t3.c1], [t3.c2]), filter(nil), rowset=2
      access([t3.c1], [t3.c2]), partitions(p0)
      is_index_back=false, is_global_index=false, 
      range_key([t3.c1], [t3.c2]), range(MIN,MIN ; MAX,MAX)always true
select /*+no_rewrite*/c1, c2 from (select c1, c2, c3 from t1 order by 1,2,3) t where not exists(select * from t2 where t.c3 = t2.c1) except select c1, c2 from t3;
c1	c2
1	1
2	2
drop table t1;
drop table t2;
drop table t3;
alter system set _rowsets_max_rows = 256;
drop database  IF EXISTS  ob100x;
