set ob_enable_index_direct_select=1;
alter system set merger_check_interval = '10s' tenant sys;
alter system set merger_check_interval = '10s' tenant all_user;
alter system set merger_check_interval = '10s' tenant all_meta;
drop table if exists t1,t2,t3,t4;
create table t1(pk int primary key, v1 varchar(10), v2 varchar(10));
insert into t1 values(1,'abbbbbb',6),(2,'aabbbbbbbb',10);
alter system major freeze tenant = sys;
alter system major freeze tenant = all_user;
alter system major freeze tenant = all_meta;
desc t1;
Field	Type	Null	Key	Default	Extra
pk	int(11)	NO	PRI	NULL	
v1	varchar(10)	YES		NULL	
v2	varchar(10)	YES		NULL	
alter table t1 modify column v1 varchar(20);
desc t1;
Field	Type	Null	Key	Default	Extra
pk	int(11)	NO	PRI	NULL	
v1	varchar(20)	YES		NULL	
v2	varchar(10)	YES		NULL	
insert into t1 values(3,'aaabbbbbbbbb',12),(4,'aaaabbbbbbbbbbb',15);
insert into t1 values(5,'aaaaabbbbbbbbbbbbbbbb',21);
ERROR 22001: Data too long for column 'v1' at row 1
insert into t1 values(6,'aaaaaab',7);
select * from t1;
pk	v1	v2
1	abbbbbb	6
2	aabbbbbbbb	10
3	aaabbbbbbbbb	12
4	aaaabbbbbbbbbbb	15
6	aaaaaab	7
replace into t1 values(1,'abbbbbbbbbbbbbbbbbbb',20),(7,'aaaaaaabbbbbbbbbbb',18);
replace into t1 values(2,'aabbbbbbbbbbbbbbbbbbbb',22);
ERROR 22001: Data too long for column 'v1' at row 1
replace into t1 values(3,'aaabbbbb',8);
select * from t1;
pk	v1	v2
1	abbbbbbbbbbbbbbbbbbb	20
2	aabbbbbbbb	10
3	aaabbbbb	8
4	aaaabbbbbbbbbbb	15
6	aaaaaab	7
7	aaaaaaabbbbbbbbbbb	18
update t1 set v1='aabbbbbbbbbbbbbb',v2=16 where pk=2;
update t1 set v1='aaaaaaaabbbbbbb',v2=15 where pk=8;
update t1 set v1='aaaaaaabbbbbbbbbbbbbb',v2=21 where pk=7;
ERROR 22001: Data too long for column
update t1 set v1='aaaab',v2=5 where pk=4;
select * from t1;
pk	v1	v2
1	abbbbbbbbbbbbbbbbbbb	20
2	aabbbbbbbbbbbbbb	16
3	aaabbbbb	8
4	aaaab	5
6	aaaaaab	7
7	aaaaaaabbbbbbbbbbb	18
delete from t1 where pk=1;
alter table t1 modify column v1 varchar(22);
alter system major freeze tenant = sys;
alter system major freeze tenant = all_user;
alter system major freeze tenant = all_meta;
insert into t1 values(1,'abbbbbbbbbbbbbbbbbbbbb',21);
select * from t1;
pk	v1	v2
1	abbbbbbbbbbbbbbbbbbbbb	21
2	aabbbbbbbbbbbbbb	16
3	aaabbbbb	8
4	aaaab	5
6	aaaaaab	7
7	aaaaaaabbbbbbbbbbb	18
delete from t1 where pk=3;
alter table t1 modify column v1 varchar(23);
alter system major freeze tenant = sys;
alter system major freeze tenant = all_user;
alter system major freeze tenant = all_meta;
insert into t1 values(3,'aaabbbbbbbbbbbbbbbbbbbb',23);
select * from t1;
pk	v1	v2
1	abbbbbbbbbbbbbbbbbbbbb	21
2	aabbbbbbbbbbbbbb	16
3	aaabbbbbbbbbbbbbbbbbbbb	23
4	aaaab	5
6	aaaaaab	7
7	aaaaaaabbbbbbbbbbb	18
delete from t1 where pk=6;
alter system major freeze tenant = sys;
alter system major freeze tenant = all_user;
alter system major freeze tenant = all_meta;
alter table t1 modify column v1 varchar(24);
insert into t1 values(6,'aaaaaabbbbbbbbbbbbbbbbbb',24);
select * from t1;
pk	v1	v2
1	abbbbbbbbbbbbbbbbbbbbb	21
2	aabbbbbbbbbbbbbb	16
3	aaabbbbbbbbbbbbbbbbbbbb	23
4	aaaab	5
6	aaaaaabbbbbbbbbbbbbbbbbb	24
7	aaaaaaabbbbbbbbbbb	18
desc t1;
Field	Type	Null	Key	Default	Extra
pk	int(11)	NO	PRI	NULL	
v1	varchar(24)	YES		NULL	
v2	varchar(10)	YES		NULL	
alter table t1 modify column v1 varchar(35);
desc t1;
Field	Type	Null	Key	Default	Extra
pk	int(11)	NO	PRI	NULL	
v1	varchar(35)	YES		NULL	
v2	varchar(10)	YES		NULL	
insert into t1 values(8,'aaaaaaaabbbbbbbbbbbbbbbbb',25),(9,'aaaaaaaaabbbbbbbbbbbbbbbbb',26);
insert into t1 values(10,'aaaaaaaaaabbbbbbbbbbbbbbbbbbbbbbbbbb',36);
ERROR 22001: Data too long for column 'v1' at row 1
insert into t1 values(11,'aaaaaaaaaaabbbbbbbbbbb',22);
select * from t1;
pk	v1	v2
1	abbbbbbbbbbbbbbbbbbbbb	21
2	aabbbbbbbbbbbbbb	16
3	aaabbbbbbbbbbbbbbbbbbbb	23
4	aaaab	5
6	aaaaaabbbbbbbbbbbbbbbbbb	24
7	aaaaaaabbbbbbbbbbb	18
8	aaaaaaaabbbbbbbbbbbbbbbbb	25
9	aaaaaaaaabbbbbbbbbbbbbbbbb	26
11	aaaaaaaaaaabbbbbbbbbbb	22
replace into t1 values(1,'abbbbbbbbbbbbbbbbbbbbbbbbbbbbbbbbb',33);
replace into t1 values(2,'aabbbbbbbbbbbbbbbbbbbbbbbbbbbbbbbbbb',36);
ERROR 22001: Data too long for column 'v1' at row 1
replace into t1 values(3,'aaabbbbbbbbbbbbbbbbb',20);
select * from t1;
pk	v1	v2
1	abbbbbbbbbbbbbbbbbbbbbbbbbbbbbbbbb	33
2	aabbbbbbbbbbbbbb	16
3	aaabbbbbbbbbbbbbbbbb	20
4	aaaab	5
6	aaaaaabbbbbbbbbbbbbbbbbb	24
7	aaaaaaabbbbbbbbbbb	18
8	aaaaaaaabbbbbbbbbbbbbbbbb	25
9	aaaaaaaaabbbbbbbbbbbbbbbbb	26
11	aaaaaaaaaaabbbbbbbbbbb	22
update t1 set v1='aaaabbbbbbbbbbbbbbbbbbbbb',v2=25 where pk=4;
update t1 set v1='aaabbbbbbbbbbbbbbbbbbbbbbbbbbbbbbbbb',v2=36 where pk=3;
ERROR 22001: Data too long for column
update t1 set v1='aaaaaab',v2=7 where pk=6;
select * from t1;
pk	v1	v2
1	abbbbbbbbbbbbbbbbbbbbbbbbbbbbbbbbb	33
2	aabbbbbbbbbbbbbb	16
3	aaabbbbbbbbbbbbbbbbb	20
4	aaaabbbbbbbbbbbbbbbbbbbbb	25
6	aaaaaab	7
7	aaaaaaabbbbbbbbbbb	18
8	aaaaaaaabbbbbbbbbbbbbbbbb	25
9	aaaaaaaaabbbbbbbbbbbbbbbbb	26
11	aaaaaaaaaaabbbbbbbbbbb	22
drop table if exists t1;
create table t1(pk int primary key, v1 varchar(10), v2 varchar(10));
insert into t1 values(1,'abbbbbb',6),(2,'aabbbbbbbb',10);
alter system major freeze tenant = sys;
alter system major freeze tenant = all_user;
alter system major freeze tenant = all_meta;
delete from t1 where pk=1;
alter system major freeze tenant = sys;
alter system major freeze tenant = all_user;
alter system major freeze tenant = all_meta;
alter table t1 modify column v1 varchar(15);
insert into t1 values(1,'abbbbbbbbbbbbb',14);
select * from t1;
pk	v1	v2
1	abbbbbbbbbbbbb	14
2	aabbbbbbbb	10
drop table if exists t1;
create table t1(pk varchar(1) primary key, v1 varchar(10), v2 varchar(10));
set ob_enable_index_direct_select=1;
alter system set merger_check_interval = '10s' tenant sys;
alter system set merger_check_interval = '10s' tenant all_user;
alter system set merger_check_interval = '10s' tenant all_meta;
alter system major freeze tenant = sys;
alter system major freeze tenant = all_user;
alter system major freeze tenant = all_meta;
alter table t1 modify column v1 varchar(5);
ERROR 0A000: Not supported feature or function
desc t1;
Field	Type	Null	Key	Default	Extra
pk	varchar(1)	NO	PRI	NULL	
v1	varchar(10)	YES		NULL	
v2	varchar(10)	YES		NULL	
alter table t1 modify column v1 varchar(0);
ERROR 0A000: Not supported feature or function
desc t1;
Field	Type	Null	Key	Default	Extra
pk	varchar(1)	NO	PRI	NULL	
v1	varchar(10)	YES		NULL	
v2	varchar(10)	YES		NULL	
alter table t1 modify column v1 varchar(-1);
ERROR 42000: You have an error in your SQL syntax; check the manual that corresponds to your OceanBase version for the right syntax to use near '-1)' at line 1
desc t1;
Field	Type	Null	Key	Default	Extra
pk	varchar(1)	NO	PRI	NULL	
v1	varchar(10)	YES		NULL	
v2	varchar(10)	YES		NULL	
alter table t1 modify column v1 varchar(65535);
desc t1;
Field	Type	Null	Key	Default	Extra
pk	varchar(1)	NO	PRI	NULL	
v1	varchar(65535)	YES		NULL	
v2	varchar(10)	YES		NULL	
alter table t1 modify column v1 varchar(65535);
drop table t1;
create table t1(pk varchar(20) primary key, i1 int, i2 int);
alter table t1 modify column pk varchar(65537);
ERROR 42000: Specified key was too long; max key length is 16384 bytes
create table t2(pk1 varchar(20),pk2 varchar(1024), v1 varchar(20), i2 int , primary key(pk1,pk2));
alter table t2 modify column pk1 varchar(65537);
ERROR 42000: Specified key was too long; max key length is 16384 bytes
create table t3(pk varchar(4096) primary key, v1 varchar(65535), v2 varchar(1), v3 varchar(1),v4 varchar(1), v5 varchar(1),v6 varchar(1));
alter table t3 modify column v5 varchar(65535);
create table t4(pk varchar(20) primary key, v1 varchar(20), i2 int);
alter table t4 modify column v1 varchar(65535);
drop table t3;
drop table t1,t2,t4;
create table t2(pk int primary key, v1 varchar(5), v2 varchar(10)) EXPIRE_INFO (v1='aaaaa');
insert into t2 values(1,'aaaaa',5),(2,'aaaa',4);
alter table t2 modify column v1 varchar(6);
alter system major freeze tenant = sys;
alter system major freeze tenant = all_user;
alter system major freeze tenant = all_meta;
set ob_enable_index_direct_select=1;
alter system set merger_check_interval = '10s' tenant sys;
alter system set merger_check_interval = '10s' tenant all_user;
alter system set merger_check_interval = '10s' tenant all_meta;
select * from t2;
pk	v1	v2
1	aaaaa	5
2	aaaa	4
insert into t2 values(3,'aaaaaa',6);
insert into t2 values(4,'aaaaaaa',7);
ERROR 22001: Data too long for column 'v1' at row 1
alter system major freeze tenant = sys;
alter system major freeze tenant = all_user;
alter system major freeze tenant = all_meta;
select * from t2;
pk	v1	v2
1	aaaaa	5
2	aaaa	4
3	aaaaaa	6
alter table t2 set EXPIRE_INFO (v1='aaaaaa');
alter system major freeze tenant = sys;
alter system major freeze tenant = all_user;
alter system major freeze tenant = all_meta;
select * from t2;
pk	v1	v2
1	aaaaa	5
2	aaaa	4
3	aaaaaa	6
drop table t2;
create table t3(pk int primary key, v1 varchar(5), v2 varchar(10)) EXPIRE_INFO (v1 = 'aaaaaa');
insert into t3 values(1,'aaaaa',5);
alter table t3 modify column v1 varchar(6);
insert into t3 values(2,'aaaaaa',6);
select * from t3;
pk	v1	v2
1	aaaaa	5
2	aaaaaa	6
alter system major freeze tenant = sys;
alter system major freeze tenant = all_user;
alter system major freeze tenant = all_meta;
select * from t3;
pk	v1	v2
1	aaaaa	5
2	aaaaaa	6
alter table t3 set EXPIRE_INFO (v1 > 'aaaaaa');
alter table t3 modify column v1 varchar(8);
insert into t3 values(3,'aaaaaaa',7),(4,'aaaaaaaa',8);
select * from t3;
pk	v1	v2
1	aaaaa	5
2	aaaaaa	6
3	aaaaaaa	7
4	aaaaaaaa	8
alter system major freeze tenant = sys;
alter system major freeze tenant = all_user;
alter system major freeze tenant = all_meta;
select * from t3;
pk	v1	v2
1	aaaaa	5
2	aaaaaa	6
3	aaaaaaa	7
4	aaaaaaaa	8
drop table t3;
create table t4(pk int primary key, v1 varchar(5) default 'aa' not null, v2 varchar(10));
insert into t4 values(1,'aa',2),(2,'aaa',3);
insert into t4(pk,v2) values(3,2);
alter table t4 modify column v1 varchar(6) default 'aa' not null;
select * from t4;
pk	v1	v2
1	aa	2
2	aaa	3
3	aa	2
alter table t4 alter v1 set default 'aaaaa';
insert into t4(pk,v2) values(4,2);
select * from t4;
pk	v1	v2
1	aa	2
2	aaa	3
3	aa	2
4	aaaaa	2
alter table t4 alter v1 set default 'aaaaaa';
select * from t4;
pk	v1	v2
1	aa	2
2	aaa	3
3	aa	2
4	aaaaa	2
insert into t4(pk,v2) values(5,6);
select * from t4;
pk	v1	v2
1	aa	2
2	aaa	3
3	aa	2
4	aaaaa	2
5	aaaaaa	6
alter table t4 alter v1 set default 'aaaaaaa';
ERROR 42000: Invalid default value for 'v1'
alter system major freeze tenant = sys;
alter system major freeze tenant = all_user;
alter system major freeze tenant = all_meta;
select * from t4;
pk	v1	v2
1	aa	2
2	aaa	3
3	aa	2
4	aaaaa	2
5	aaaaaa	6
alter table t4 modify column v1 varchar(7) default 'aaaaaa' not null;
insert into t4(pk,v2) values(6,6);
alter table t4 alter v1 set default 'aaaaaaa';
insert into t4(pk,v2) values(7,7);
alter table t4 alter v1 set default 'aaaaaaaa';
ERROR 42000: Invalid default value for 'v1'
select * from t4;
pk	v1	v2
1	aa	2
2	aaa	3
3	aa	2
4	aaaaa	2
5	aaaaaa	6
6	aaaaaa	6
7	aaaaaaa	7
drop table t4;
