use test;
================= basic auto-increment test ===================
================= variable/columns/sql_mode ===================
drop table if exists t1;
create table t1(c1 int primary key auto_increment, c2 int);
set auto_increment_increment=1;
set auto_increment_offset=1;
insert into t1(c1, c2) values(0,1),(0,2);
select * from t1;
c1	c2
1	1
2	2
insert into t1(c1,c2) values(NULL,1),(NULL,2);
select * from t1;
c1	c2
1	1
2	2
3	1
4	2
insert into t1 values(0,1),(0,2);
select * from t1;
c1	c2
1	1
2	2
3	1
4	2
5	1
6	2
insert into t1 values(NULL,1),(NULL,2);
select * from t1;
c1	c2
1	1
2	2
3	1
4	2
5	1
6	2
7	1
8	2
insert into t1(c2) values(1),(2);
select * from t1;
c1	c2
1	1
2	2
3	1
4	2
5	1
6	2
7	1
8	2
9	1
10	2
set session sql_mode = 'NO_AUTO_VALUE_ON_ZERO';
select @@sql_mode;
@@sql_mode
NO_AUTO_VALUE_ON_ZERO
insert into t1 values(0,1);
select * from t1;
c1	c2
0	1
1	1
2	2
3	1
4	2
5	1
6	2
7	1
8	2
9	1
10	2
set session sql_mode = '';
set auto_increment_increment=2;
show variables like '%increment%';
Variable_name	Value
auto_increment_cache_size	1000000
auto_increment_increment	2
auto_increment_offset	1
div_precision_increment	4
insert into t1(c2) values(1),(2);
select * from t1;
c1	c2
0	1
1	1
2	2
3	1
4	2
5	1
6	2
7	1
8	2
9	1
10	2
11	1
13	2
set auto_increment_offset=2;
show variables like '%increment%';
Variable_name	Value
auto_increment_cache_size	1000000
auto_increment_increment	2
auto_increment_offset	2
div_precision_increment	4
insert into t1(c2) values(1),(2);
select * from t1;
c1	c2
0	1
1	1
2	2
3	1
4	2
5	1
6	2
7	1
8	2
9	1
10	2
11	1
13	2
16	1
18	2
delete from t1 where c1>10;
select * from t1;
c1	c2
0	1
1	1
2	2
3	1
4	2
5	1
6	2
7	1
8	2
9	1
10	2
insert into t1(c2) values(1),(2);
select * from t1;
c1	c2
0	1
1	1
2	2
3	1
4	2
5	1
6	2
7	1
8	2
9	1
10	2
20	1
22	2
update t1 set c1=25 where c1=20;
insert into t1(c2) values(1),(2);
select * from t1;
c1	c2
0	1
1	1
2	2
3	1
4	2
5	1
6	2
7	1
8	2
9	1
10	2
22	2
24	1
25	1
26	2
================= mixed-insert auto-increment test ===================
insert into t1 values(11,1),(14,2);
select * from t1;
c1	c2
0	1
1	1
2	2
3	1
4	2
5	1
6	2
7	1
8	2
9	1
10	2
11	1
14	2
22	2
24	1
25	1
26	2
insert into t1 values(50, 1), (100, 2);
select * from t1;
c1	c2
0	1
1	1
2	2
3	1
4	2
5	1
6	2
7	1
8	2
9	1
10	2
11	1
14	2
22	2
24	1
25	1
26	2
50	1
100	2
insert into t1 values(0, 1), (0, 2);
select * from t1;
c1	c2
0	1
1	1
2	2
3	1
4	2
5	1
6	2
7	1
8	2
9	1
10	2
11	1
14	2
22	2
24	1
25	1
26	2
50	1
100	2
1000016	1
1000018	2
set auto_increment_increment=1;
set auto_increment_offset=1;
truncate table t1;
insert into t1 values(11, 1),(-1, 1),(NULL, 1);
select * from t1;
c1	c2
-1	1
11	1
1000012	1
select last_insert_id();
last_insert_id()
1000012
insert into t1 values(null, 1);
select last_insert_id();
last_insert_id()
1000015
select * from t1;
c1	c2
-1	1
11	1
1000012	1
1000015	1
drop table if exists t1;
================= alter table auto-increment test ===================
set auto_increment_increment=1;
set auto_increment_offset=1;
drop table if exists t1;
create table t1(c1 int primary key);
alter table t1 add c2 int auto_increment;
Warnings:
Warning	-1	Alter table add auto_increment column is dangerous, table_name='t1', column_name='c2'
insert into t1 values(1, 0);
insert into t1 values(2, 0);
select * from t1;
c1	c2
1	1
2	2
alter table t1 modify c2 int;
insert into t1 values(3, 0);
select * from t1;
c1	c2
1	1
2	2
3	0
alter table t1 add c3 int auto_increment;
Warnings:
Warning	-1	Alter table add auto_increment column is dangerous, table_name='t1', column_name='c3'
insert into t1 values(4, 1, 0);
insert into t1 values(5, 1, 0);
select * from t1;
c1	c2	c3
1	1	0
2	2	0
3	0	0
4	1	1
5	1	2
alter table t1 drop c2;
select * from t1;
c1	c3
1	0
2	0
3	0
4	1
5	2
alter table t1 change c3 c2 int auto_increment;
insert into t1 values(6, 0);
insert into t1 values(7, 0);
select * from t1;
c1	c2
1	0
2	0
3	0
4	1
5	2
6	3
7	4
alter table t1 modify c2 int;
insert into t1 values(8, 0);
insert into t1 values(9, 0);
select * from t1;
c1	c2
1	0
2	0
3	0
4	1
5	2
6	3
7	4
8	0
9	0
drop table if exists t1;
================= auto-increment boundary test ===================
create table t1(c1 int primary key, c2 tinyint auto_increment);
insert into t1 values (1, 126);
insert into t1 values (2, 0), (3, 0);
select * from t1;
c1	c2
1	126
2	127
3	127
insert into t1 values (4, 0);
select * from t1;
c1	c2
1	126
2	127
3	127
4	127
drop table if exists t2;
create table t2(c1 bigint unsigned primary key auto_increment);
insert into t2 values (18446744073709551614);
insert into t2 values (0);
ERROR HY000: Failed to read auto-increment value from storage engine
drop table if exists t3;
create table t3(c1 bigint primary key auto_increment);
set auto_increment_increment = 1000;
insert into t3 values (9223372036854775807);
select * from t3;
c1
9223372036854775807
set auto_increment_increment = 1;
drop table t1, t2, t3;
================= auto-increment prefetch test ===================
create table t1(c1 int primary key auto_increment);
insert into t1 values (0);
insert into t1 values (999998);
insert into t1 values (0);
select * from t1;
c1
1
999998
1999999
insert into t1 values (0), (0), (0);
select * from t1;
c1
1
999998
1999999
2000000
2000001
2000002
insert into t1 values (2999999);
insert into t1 values (0), (0), (0), (0), (0);
select * from t1;
c1
1
999998
1999999
2000000
2000001
2000002
2999999
4000000
4000001
4000002
4000003
4000004
drop table t1;
================= auto-increment truncate test ===================
create table t1(c1 int primary key auto_increment);
insert into t1 values (0), (NULL), (0);
select * from t1;
c1
1
2
3
truncate table t1;
select * from t1;
c1
drop table t1;
================= auto-increment last_insert_id test ===================
create table t1(c1 int primary key auto_increment);
insert into t1 values (0), (NULL), (0);
select last_insert_id();
last_insert_id()
1
insert into t1 values (100);
select last_insert_id();
last_insert_id()
1
insert into t1 values (0), (1000), (0);
select last_insert_id();
last_insert_id()
1000101
insert into t1 values (null);
select last_insert_id();
last_insert_id()
1000104
create table t2(c1 int primary key auto_increment);
select last_insert_id();
last_insert_id()
1000104
drop table t1, t2;
select last_insert_id();
last_insert_id()
1000104
================= auto-increment and insert...on duplicate key update  ===================
create table t1(c1 int primary key, c2 int auto_increment, c3 int default 1);
insert into t1(c1, c2) values (1, null);
select * from t1;
c1	c2	c3
1	1	1
select last_insert_id();
last_insert_id()
1
insert into t1(c1, c2)  values (1, null), (2, null) on duplicate key update c3 = c3 + 1;
select * from t1;
c1	c2	c3
1	1	2
2	1000002	1
select last_insert_id();
last_insert_id()
1000002
insert into t1(c1, c2)  values (3, null);
select * from t1;
c1	c2	c3
1	1	2
2	1000002	1
3	1000003	1
select last_insert_id();
last_insert_id()
1000003
insert into t1(c1, c2)  values (1, null), (2, null), (4, null) on duplicate key update c3 = c3 + 1;
select * from t1;
c1	c2	c3
1	1	3
2	1000002	2
3	1000003	1
4	2000003	1
select last_insert_id();
last_insert_id()
2000003
insert into t1(c1, c2)  values (5, null);
select * from t1;
c1	c2	c3
1	1	3
2	1000002	2
3	1000003	1
4	2000003	1
5	2000004	1
select last_insert_id();
last_insert_id()
2000004
truncate table t1;
insert into t1(c1, c2)  values (1, null), (2, null);
insert into t1(c1, c2)  values (3, null), (2, null), (4, null);
ERROR 23000: Duplicate entry '2' for key 'PRIMARY'
select * from t1;
c1	c2	c3
1	1	1
2	2	1
select last_insert_id();
last_insert_id()
1
drop table t1;
create table t1(c1 int primary key, c2 int auto_increment, unique index(c2), c3 int, c4 int);
insert into t1(c1,c4) values(0,0);
select * from t1;
c1	c2	c3	c4
0	1	NULL	0
select last_insert_id();
last_insert_id()
1
insert into t1(c1) values(0) on duplicate key update c3=last_insert_id(), c4=c4+1;
select * from t1;
c1	c2	c3	c4
0	1	1	1
select last_insert_id();
last_insert_id()
1
drop table t1;
CREATE TABLE t1 (c2 char(100),c1 bigint auto_increment primary key);
INSERT INTO t1 ( c1 , c2 ) VALUES ( 99 , 'aa' ) ;
INSERT INTO t1 ( c1 , c2 ) VALUES ( 99 , 'bb' ) , ( 0 , 'cc' ) ON DUPLICATE KEY UPDATE c2 = 'dd' ;
INSERT INTO t1 ( c1 , c2 ) VALUES ( NULL , 'ee' ) ON DUPLICATE KEY UPDATE c2 = 'ff' ;
SELECT * FROM t1 order by c1;
c2	c1
dd	99
cc	1000100
ee	1000102
drop table t1;
create table t1(c1 bigint key auto_increment);
insert into t1 values (99);
insert into t1 values (0);
insert into t1 values (0);
update t1 set c1 = 999999999 where c1 = 1000100;
select * from t1;
c1
99
1000101
999999999
insert into t1 values (99) on duplicate key update c1 = 999999999;
ERROR 23000: Duplicate entry '999999999' for key 'PRIMARY'
insert into t1 values (0);
select * from t1;
c1
99
1000101
1000102
999999999
drop table t1;
create table t1(c1 int key, c2 int auto_increment);
insert into t1 values (1, 0), (2, 0), (3, 0);
insert into t1 values (4, 0), (5, 0), (6, 0);
select * from t1;
c1	c2
1	1
2	2
3	3
4	4
5	5
6	6
insert into t1 values (6, 0), (8, 0), (9, 0) on duplicate key update c2 = 7;
select * from t1;
c1	c2
1	1
2	2
3	3
4	4
5	5
6	7
8	8
9	9
insert into t1 values (10, 0);
select * from t1;
c1	c2
1	1
2	2
3	3
4	4
5	5
6	7
8	8
9	9
10	10
truncate table t1;
insert into t1 values (1, 0), (2, 0), (3, 0);
insert into t1 values (4, 0), (5, 0), (6, 0);
select * from t1;
c1	c2
1	1
2	2
3	3
4	4
5	5
6	6
insert into t1 values (7, 0), (6, 0), (9, 0) on duplicate key update c2 = 7;
ERROR HY000: Auto-increment value in UPDATE conflicts with internally generated values
select * from t1;
c1	c2
1	1
2	2
3	3
4	4
5	5
6	6
insert into t1 values (10, 0);
select * from t1;
c1	c2
1	1
2	2
3	3
4	4
5	5
6	6
10	10
drop table t1;
create table t1(c1 int auto_increment primary key, c2 int);
insert into t1(c1) values(0);
update t1 set c1 = 99999 where c1=1;
insert into t1(c1) values(99999) on duplicate key update c2=c2;
insert into t1(c1) values(0);
select * from t1;
c1	c2
2	NULL
99999	NULL
insert into t1(c1) values(99999) on duplicate key update c2=1;
insert into t1(c1) values(0);
select * from t1;
c1	c2
2	NULL
99999	1
1100000	NULL
drop table t1;
================= auto-increment first row is duplicate  ===================
create table t1(c1 int primary key auto_increment, c2 int);
insert into t1 values (null, 1), (null, 1), (null, 1);
select * from t1;
c1	c2
1	1
2	1
3	1
insert into t1 values (3, 1), (null, 1), (null, 1);
ERROR 23000: Duplicate entry '3' for key 'PRIMARY'
insert into t1 values (null, 1);
select * from t1;
c1	c2
1	1
2	1
3	1
1000007	1
drop table t1;
================= auto-increment conflict with row existed ===================
create table t1(c1 int primary key auto_increment, c2 int);
insert into t1 values (null, 1), (null, 1), (null, 1);
select * from t1;
c1	c2
1	1
2	1
3	1
update t1 set c1 = 5 where c1 = 3;
select * from t1;
c1	c2
1	1
2	1
5	1
insert into t1 values (null, 1), (null, 1), (null, 1) on duplicate key update c2 = c2 + 1;
select * from t1;
c1	c2
1	1
2	1
4	1
5	2
1000006	1
select last_insert_id();
last_insert_id()
4
drop table t1;
create table t1(c1 int auto_increment primary key);
insert into t1 values(null);
update t1 set c1=1000010 where c1=1;
insert into t1 values(9);
select last_insert_id();
last_insert_id()
1
insert into t1 values(null);
ERROR 23000: Duplicate entry '1000010' for key 'PRIMARY'
select last_insert_id();
last_insert_id()
1
drop table t1;
================= auto-increment in select / update===================
SELECT LAST_INSERT_ID(20);
LAST_INSERT_ID(20)
20
SELECT 1 FROM dual WHERE LAST_INSERT_ID( 10 ) = 10 ;
1
1
SELECT LAST_INSERT_ID();
LAST_INSERT_ID()
10
create table t1(c1 bigint primary key auto_increment, c2 char(20));
insert into t1 values (1, "test");
select last_insert_id(11);
last_insert_id(11)
11
update  t1 set c1 = 9, c2 = last_insert_id(length(cast(last_insert_id() as char(100))));
select last_insert_id();
last_insert_id()
2
select * from t1;
c1	c2
9	2
drop table t1;
================= auto-increment range re-allocation ===================
create table t1(c1 int key auto_increment);
insert into t1 values (null), (10), (20), (null);
insert into t1 values (null);
select * from t1;
c1
1
10
20
1000021
1000022
truncate table t1;
insert into t1 values (10), (20), (null), (30), (40), (null), (null);
insert into t1 values (null);
select * from t1;
c1
10
20
30
40
1000021
1000022
1000023
1000028
truncate table t1;
insert into t1 values (10), (20), (null), (26), (null), (null), (null);
insert into t1 values (null);
select * from t1;
c1
10
20
26
1000021
1000022
1000023
1000024
1000028
drop table t1;
