drop table if exists test;
'strict mode'
create table test(c1 int auto_increment primary key, c2 int);
insert into test values();
insert into test values(default, 1);
insert into test values(default(c1), 2);
insert into test set c1 = default, c2 = 3;
insert into test set c1 = default(c1), c2 = 4;
insert into test set c1 = c1, c2 = 5;
insert into test values(c1, 6);
insert into test values(c1, 7);
insert into test values(c1 + c2, 7);
insert into test values(c1 + c2, 7);
insert into test values(1 + c2, 7);
insert into test values(1 + c2, 7);
insert into test values(c1 + 1, 7);
ERROR 23000: Duplicate entry '1' for key 'PRIMARY'
select * from test;
c1	c2
1	NULL
1000002	1
1000003	2
1000004	3
2000005	4
3000006	5
4000007	6
4000008	7
4000009	7
4000010	7
4000011	7
4000012	7
delete from test;
insert into test values(9,10);
update test set c1 =default, c2 = 7;
select * from test;
c1	c2
0	7
update test set c1 = default(c1), c2 = 8;
select * from test;
c1	c2
0	8
delete from test;
update test set c1 =default, c2 = 7;
update test set c1 = default(c1), c2 = 8;
drop table test;
set @@sql_mode='';
'not strict mode'
create table test(c1 int auto_increment primary key, c2 int);
insert into test values();
insert into test values(default, 1);
insert into test values(default(c1), 2);
insert into test set c1 = default, c2 = 3;
insert into test set c1 = default(c1), c2 = 4;
insert into test set c1 = c1, c2 = 5;
insert into test values(c1, 6);
insert into test values(c1, 7);
insert into test values(c1 + c2, 7);
insert into test values(c1 + c2, 7);
insert into test values(1 + c2, 7);
insert into test values(1 + c2, 7);
insert into test values(c1 + 1, 7);
ERROR 23000: Duplicate entry '1' for key 'PRIMARY'
select * from test;
c1	c2
1	NULL
1000002	1
1000003	2
1000004	3
2000005	4
3000006	5
4000007	6
4000008	7
4000009	7
4000010	7
4000011	7
4000012	7
delete from test;
insert into test values(9,10);
update test set c1 =default, c2 = 7;
select * from test;
c1	c2
0	7
update test set c1 = default(c1), c2 = 8;
select * from test;
c1	c2
0	8
delete from test;
update test set c1 =default, c2 = 7;
update test set c1 = default(c1), c2 = 8;
drop table test;
set @@sql_mode='strict_all_tables';
'auto_incrememnt is unique key'
'strict mode'
create table test(c1 int primary key, c2 int, c3 int auto_increment unique key);
insert into test(c1) values(10);
insert into test values(1, 1, default);
insert into test values(11, 2, default(c3));
insert into test set c1 = 12, c2 = 3,  c3 = default;
insert into test set c1 = 13, c2 = 4, c3 = default(c3);
insert into test set c1 = 14, c2 = 5, c3 = c3;
insert into test set c1 = 135, c3 = c2 + 1;
insert into test set c1 = 136, c3 = c2 + 1;
insert into test set c1 = 137, c3 = c2 + c3;
insert into test set c1 = 138, c2 = 5, c3 = c3 + 1;
ERROR 23000: Duplicate entry '1' for key 'c3'
insert into test values(15, 6, c3);
insert into test values(16, 3, c3);
insert into test values(17,3,c3);
insert into test(c1,c3) values(18, c2+c3);
insert into test(c1,c3) values(19, c2+1);
insert into test values(19,3, c3+1);
ERROR 23000: Duplicate entry '19' for key 'PRIMARY'
select * from test;
c1	c2	c3
1	1	2
10	NULL	1
11	2	3
12	3	4
13	4	1000005
14	5	2000006
15	6	6000010
16	3	6000011
17	3	6000012
18	NULL	6000013
19	NULL	6000014
135	NULL	3000007
136	NULL	4000008
137	NULL	5000009
delete from test;
insert into test values(15, 6, 3);
update test set c1 =16, c2 = 7, c3=default limit 1;
select * from test;
c1	c2	c3
16	7	0
update test set c1 = 17, c2 = 8, c3 = default(c3) limit 1;
select * from test;
c1	c2	c3
17	8	0
delete from test;
update test set c1 =18, c2 = 7, c3 = default;
update test set c1 = 19, c2 = 8, c3 = default(c3);
drop table test;
set @@sql_mode='';
'not strict mode'
create table test(c1 int primary key, c2 int, c3 int auto_increment unique key);
insert into test values();
insert into test values(2, 1, default);
insert into test values(3, 2, default(c3));
insert into test set c1 = 4, c2 = 3,  c3 = default;
insert into test set c1 = 5, c2 = 4, c3 = default(c3);
insert into test set c1 = 6, c2 = 5, c3 = c3;
insert into test set c1 = 135, c3 = c2 + 1;
insert into test set c1 = 136, c3 = c2 + 1;
insert into test set c1 = 137, c3 = c2 + c3;
insert into test set c1 = 138, c2 = 5, c3 = c3 + 1;
ERROR 23000: Duplicate entry '1' for key 'c3'
insert into test values(15, 6, c3);
insert into test values(16, 3, c3);
insert into test values(17,3,c3);
insert into test(c1,c3) values(18, c2+c3);
insert into test(c1,c3) values(19, c2+1);
insert into test values(19,3, c3+1);
ERROR 23000: Duplicate entry '19' for key 'PRIMARY'
select * from test;
c1	c2	c3
0	NULL	1
2	1	1000002
3	2	1000003
4	3	1000004
5	4	2000005
6	5	3000006
15	6	7000010
16	3	7000011
17	3	7000012
18	NULL	7000013
19	NULL	7000014
135	NULL	4000007
136	NULL	5000008
137	NULL	6000009
update test set c1 =default, c2 = 7, c3=default limit 1;
select * from test;
c1	c2	c3
0	7	0
2	1	1000002
3	2	1000003
4	3	1000004
5	4	2000005
6	5	3000006
15	6	7000010
16	3	7000011
17	3	7000012
18	NULL	7000013
19	NULL	7000014
135	NULL	4000007
136	NULL	5000008
137	NULL	6000009
update test set c1 = 10, c2 = 8, c3 = default(c3) limit 1;
select * from test;
c1	c2	c3
2	1	1000002
3	2	1000003
4	3	1000004
5	4	2000005
6	5	3000006
10	8	0
15	6	7000010
16	3	7000011
17	3	7000012
18	NULL	7000013
19	NULL	7000014
135	NULL	4000007
136	NULL	5000008
137	NULL	6000009
delete from test;
update test set c1 =default, c2 = 7, c3 = default;
update test set c1 = 2, c2 = 8, c3 = default(c3);
drop table test;
create table test(c1 int auto_increment primary key, c2 int);
insert into test values(1,2);
insert into test values(1,2) on duplicate key update c1 = default;
select * from test;
c1	c2
0	2
insert into test values(0,2) on duplicate key update c1 = default(c1), c2 = 10;
insert into test values(1000002,2) on duplicate key update c1 = default(c1), c2 = 10;
ERROR 23000: Duplicate entry '0' for key 'PRIMARY'
select * from test;
c1	c2
0	2
1000002	2
drop table test;
create table test(c1 int primary key, c2 int, c3 int auto_increment unique key);
insert into test values(1, 2 , 1);
insert into test values(1,3,4) on duplicate key update c3=default;
select * from test;
c1	c2	c3
1	2	0
insert into test values(1,3,4) on duplicate key update c3=default(c3);
select * from test;
c1	c2	c3
1	2	0
drop table test;
create table test(c1 int auto_increment primary key);
insert into test set c1 = NULL;
insert into test set c1 = NULL;
insert into test set c1 = 0;
insert into test set c1 = 0;
insert into test values(NULL);
insert into test values(NULL);
insert into test values(0);
insert into test values(0);
select * from test;
c1
1
1000002
2000003
3000004
4000005
4000006
4000007
4000008
