drop table if exists t1;
create table t1(c1 int primary key default 1 not null,
c2 varchar(20) default 'aaa',
c3 float default 1.01 not null,
c4 double default 2.111345 not null,
c5 timestamp default '2013-12-02 11:56:00.0',
c6 datetime default '2013-12-02');
desc t1;
Field	Type	Null	Key	Default	Extra
c1	int(11)	NO	PRI	1	
c2	varchar(20)	YES		aaa	
c3	float	NO		1.01	
c4	double	NO		2.111345	
c5	timestamp	NO		2013-12-02 11:56:00	
c6	datetime	YES		2013-12-02 00:00:00	
insert into t1 values(1, 'a', 2.02, 2.456, usec_to_time(6), usec_to_time(9)), (2, 'b', 9.1111, 3.45678, '2013-09-08 11:45:56.09', '2013-09-08');
select * from t1;
c1	c2	c3	c4	c5	c6
1	a	2.02	2.456	1970-01-01 08:00:00	1970-01-01 08:00:00
2	b	9.1111	3.45678	2013-09-08 11:45:56	2013-09-08 00:00:00
drop table if exists t1,t2,t3,t4;
create table t2(c1 int primary key default 'a' not null,
c2 varchar(20) default 1234,
c3 float default 1.01 not null,
c4 double default 2.111345 not null,
c5 timestamp default '2013-12-02 11:56:00.0',
c6 datetime default '2013-12-02');
ERROR 42000: Invalid default value for 'c1'
create table t3 (c3 float default 'abcd' not null);
ERROR 42000: Invalid default value for 'c3'
create table t4(a int primary key,b timestamp default usec_to_time(1243354325435));
ERROR 42000: You have an error in your SQL syntax; check the manual that corresponds to your OceanBase version for the right syntax to use near 'usec_to_time(1243354325435))' at line 1
create table t4(a int primary key,b timestamp default 1243354325435);
ERROR 42000: Invalid default value for 'b'
create table t1(c1 int primary key default 1 not null,
c2 varchar(20) default 'aaa',
c3 float default 1.01 not null,
c4 double default 2.111345 not null,
c5 timestamp default '2013-12-02 11:56:00.0',
c6 datetime default '2013-12-02');
desc t1;
Field	Type	Null	Key	Default	Extra
c1	int(11)	NO	PRI	1	
c2	varchar(20)	YES		aaa	
c3	float	NO		1.01	
c4	double	NO		2.111345	
c5	timestamp	NO		2013-12-02 11:56:00	
c6	datetime	YES		2013-12-02 00:00:00	
insert into t1(c1) values(1), (2), (3), (4);
select * from t1;
c1	c2	c3	c4	c5	c6
1	aaa	1.01	2.111345	2013-12-02 11:56:00	2013-12-02 00:00:00
2	aaa	1.01	2.111345	2013-12-02 11:56:00	2013-12-02 00:00:00
3	aaa	1.01	2.111345	2013-12-02 11:56:00	2013-12-02 00:00:00
4	aaa	1.01	2.111345	2013-12-02 11:56:00	2013-12-02 00:00:00
drop table if exists t1;
create table t1(c1 int primary key default 1 not null,
c2 varchar(20) default 'aaa',
c3 float default 1.01 not null,
c4 double default 2.111345 not null,
c5 timestamp default '2013-12-02 11:56:00.0');
desc t1;
Field	Type	Null	Key	Default	Extra
c1	int(11)	NO	PRI	1	
c2	varchar(20)	YES		aaa	
c3	float	NO		1.01	
c4	double	NO		2.111345	
c5	timestamp	NO		2013-12-02 11:56:00	
alter table t1 add c6 datetime default '2013-12-02' not null;
desc t1;
Field	Type	Null	Key	Default	Extra
c1	int(11)	NO	PRI	1	
c2	varchar(20)	YES		aaa	
c3	float	NO		1.01	
c4	double	NO		2.111345	
c5	timestamp	NO		2013-12-02 11:56:00	
c6	datetime	NO		2013-12-02 00:00:00	
insert into t1(c1) values(1), (2), (3);
select * from t1;
c1	c2	c3	c4	c5	c6
1	aaa	1.01	2.111345	2013-12-02 11:56:00	2013-12-02 00:00:00
2	aaa	1.01	2.111345	2013-12-02 11:56:00	2013-12-02 00:00:00
3	aaa	1.01	2.111345	2013-12-02 11:56:00	2013-12-02 00:00:00
drop table if exists t1;
create table t1(c1 int primary key default 1 not null,
c2 varchar(20) default 'aaa',
c3 float default 1.01 not null,
c4 double default 2.111345 not null,
c5 timestamp default '2013-12-02 11:56:00.0');
desc t1;
Field	Type	Null	Key	Default	Extra
c1	int(11)	NO	PRI	1	
c2	varchar(20)	YES		aaa	
c3	float	NO		1.01	
c4	double	NO		2.111345	
c5	timestamp	NO		2013-12-02 11:56:00	
alter table t1 add c6 datetime default '2013-12-02' not null;
desc t1;
Field	Type	Null	Key	Default	Extra
c1	int(11)	NO	PRI	1	
c2	varchar(20)	YES		aaa	
c3	float	NO		1.01	
c4	double	NO		2.111345	
c5	timestamp	NO		2013-12-02 11:56:00	
c6	datetime	NO		2013-12-02 00:00:00	
alter table t1 alter c1 set default 3;
desc t1;
Field	Type	Null	Key	Default	Extra
c1	int(11)	NO	PRI	3	
c2	varchar(20)	YES		aaa	
c3	float	NO		1.01	
c4	double	NO		2.111345	
c5	timestamp	NO		2013-12-02 11:56:00	
c6	datetime	NO		2013-12-02 00:00:00	
alter table t1 alter c1 drop default;
desc t1;
Field	Type	Null	Key	Default	Extra
c1	int(11)	NO	PRI	NULL	
c2	varchar(20)	YES		aaa	
c3	float	NO		1.01	
c4	double	NO		2.111345	
c5	timestamp	NO		2013-12-02 11:56:00	
c6	datetime	NO		2013-12-02 00:00:00	
alter table t1 alter c1 drop not null;
ERROR 42000: You have an error in your SQL syntax; check the manual that corresponds to your OceanBase version for the right syntax to use near 'not null' at line 1
desc t1;
Field	Type	Null	Key	Default	Extra
c1	int(11)	NO	PRI	NULL	
c2	varchar(20)	YES		aaa	
c3	float	NO		1.01	
c4	double	NO		2.111345	
c5	timestamp	NO		2013-12-02 11:56:00	
c6	datetime	NO		2013-12-02 00:00:00	
alter table t1 alter c2 set not null;
ERROR 42000: You have an error in your SQL syntax; check the manual that corresponds to your OceanBase version for the right syntax to use near 'not null' at line 1
desc t1;
Field	Type	Null	Key	Default	Extra
c1	int(11)	NO	PRI	NULL	
c2	varchar(20)	YES		aaa	
c3	float	NO		1.01	
c4	double	NO		2.111345	
c5	timestamp	NO		2013-12-02 11:56:00	
c6	datetime	NO		2013-12-02 00:00:00	
alter table t1 alter c3 drop not null;
ERROR 42000: You have an error in your SQL syntax; check the manual that corresponds to your OceanBase version for the right syntax to use near 'not null' at line 1
desc t1;
Field	Type	Null	Key	Default	Extra
c1	int(11)	NO	PRI	NULL	
c2	varchar(20)	YES		aaa	
c3	float	NO		1.01	
c4	double	NO		2.111345	
c5	timestamp	NO		2013-12-02 11:56:00	
c6	datetime	NO		2013-12-02 00:00:00	
alter table t1 alter c2 set default 'aa';
desc t1;
Field	Type	Null	Key	Default	Extra
c1	int(11)	NO	PRI	NULL	
c2	varchar(20)	YES		aa	
c3	float	NO		1.01	
c4	double	NO		2.111345	
c5	timestamp	NO		2013-12-02 11:56:00	
c6	datetime	NO		2013-12-02 00:00:00	
alter table t1 alter c2 drop default;
desc t1;
Field	Type	Null	Key	Default	Extra
c1	int(11)	NO	PRI	NULL	
c2	varchar(20)	YES		NULL	
c3	float	NO		1.01	
c4	double	NO		2.111345	
c5	timestamp	NO		2013-12-02 11:56:00	
c6	datetime	NO		2013-12-02 00:00:00	
alter table t1 drop c2;
desc t1;
Field	Type	Null	Key	Default	Extra
c1	int(11)	NO	PRI	NULL	
c3	float	NO		1.01	
c4	double	NO		2.111345	
c5	timestamp	NO		2013-12-02 11:56:00	
c6	datetime	NO		2013-12-02 00:00:00	
alter table t1 add c2 varchar(10) default '';
desc t1;
Field	Type	Null	Key	Default	Extra
c1	int(11)	NO	PRI	NULL	
c3	float	NO		1.01	
c4	double	NO		2.111345	
c5	timestamp	NO		2013-12-02 11:56:00	
c6	datetime	NO		2013-12-02 00:00:00	
c2	varchar(10)	YES			
drop table if exists t1;
create table t1(c1 int primary key, c2 int default now());
ERROR 42000: Invalid default value for 'c2'
create table t1(c1 int primary key, c2 timestamp default now(), c3 timestamp default current_timestamp());
desc t1;
Field	Type	Null	Key	Default	Extra
c1	int(11)	NO	PRI	NULL	
c2	timestamp	NO		CURRENT_TIMESTAMP	
c3	timestamp	NO		CURRENT_TIMESTAMP	
insert into t1(c1) values(1), (2), (3);
select c1, time_to_usec(c2) - time_to_usec(c3) from t1;
c1	time_to_usec(c2) - time_to_usec(c3)
1	0
2	0
3	0
replace into t1(c1) values(4);
select c1, time_to_usec(c2) - time_to_usec(c3) from t1;
c1	time_to_usec(c2) - time_to_usec(c3)
1	0
2	0
3	0
4	0
replace into t1(c1, c2) values(5, now()), (6, current_timestamp());
select c1, time_to_usec(c2) - time_to_usec(c3) from t1;
c1	time_to_usec(c2) - time_to_usec(c3)
1	0
2	0
3	0
4	0
5	0
6	0
delete from t1;
replace into t1(c1) values(3), (4);
replace into t1(c1) values(1), (2);
select alias1.c2=alias2.c2 from (select c2 from t1 where c1=1 or c1 = 2) as alias1, (select c2 from t1 where c1=3 or c1=4) as alias2 where alias1.c2=alias2.c2;
alias1.c2=alias2.c2
1
1
1
1
drop table if exists t1;
create table t1(c1 int primary key default 1 not null,
c2 varchar(1024),
c3 char);
desc t1;
Field	Type	Null	Key	Default	Extra
c1	int(11)	NO	PRI	1	
c2	varchar(1024)	YES		NULL	
c3	char(1)	YES		NULL	
drop table if exists t1;
create table t1(c1 int primary key default 1 not null,
c2 varchar(20) default 'aaa',
c3 float default 1.01 not null,
c4 double default 2.111345 not null,
c5 timestamp default '2013-12-02 11:56:00.0',
c6 datetime default '2013-12-02');
desc t1;
Field	Type	Null	Key	Default	Extra
c1	int(11)	NO	PRI	1	
c2	varchar(20)	YES		aaa	
c3	float	NO		1.01	
c4	double	NO		2.111345	
c5	timestamp	NO		2013-12-02 11:56:00	
c6	datetime	YES		2013-12-02 00:00:00	
replace into t1(c1) values(1);
replace into t1(c1) values(2);
select * from t1;
c1	c2	c3	c4	c5	c6
1	aaa	1.01	2.111345	2013-12-02 11:56:00	2013-12-02 00:00:00
2	aaa	1.01	2.111345	2013-12-02 11:56:00	2013-12-02 00:00:00
alter table t1 alter c2 set default 'bbb';
select * from t1;
c1	c2	c3	c4	c5	c6
1	aaa	1.01	2.111345	2013-12-02 11:56:00	2013-12-02 00:00:00
2	aaa	1.01	2.111345	2013-12-02 11:56:00	2013-12-02 00:00:00
merge
alter system major freeze tenant = sys;
alter system major freeze tenant = all_user;
alter system major freeze tenant = all_meta;
select * from t1;
c1	c2	c3	c4	c5	c6
1	aaa	1.01	2.111345	2013-12-02 11:56:00	2013-12-02 00:00:00
2	aaa	1.01	2.111345	2013-12-02 11:56:00	2013-12-02 00:00:00
alter table t1 alter c2 set default 'ccc';
select * from t1;
c1	c2	c3	c4	c5	c6
1	aaa	1.01	2.111345	2013-12-02 11:56:00	2013-12-02 00:00:00
2	aaa	1.01	2.111345	2013-12-02 11:56:00	2013-12-02 00:00:00
replace into t1(c1) values(1);
replace into t1(c1) values(3);
select * from t1;
c1	c2	c3	c4	c5	c6
1	ccc	1.01	2.111345	2013-12-02 11:56:00	2013-12-02 00:00:00
2	aaa	1.01	2.111345	2013-12-02 11:56:00	2013-12-02 00:00:00
3	ccc	1.01	2.111345	2013-12-02 11:56:00	2013-12-02 00:00:00
drop table if exists t1;
