drop database if exists tt;
create database tt;
create database tt;
ERROR HY000: Can't create database 'tt'; database exists
drop database tt1;
ERROR HY000: Can't drop database 'tt1'; database doesn't exist
use tt;
create table person( number int(11) primary key, name varchar(255), birthday DATE );
create table person( number int(11) primary key, name varchar(255), birthday DATE );
ERROR 42S01: Table 'person' already exists
drop table if exists dc;
create table dc(id int auto_increment,primary key(id));
insert into dc values(2147483647);
insert into dc values(2147483647);
ERROR 23000: Duplicate entry '2147483647' for key 'PRIMARY'
insert into dc values 2147483647);
ERROR 42000: You have an error in your SQL syntax; check the manual that corresponds to your OceanBase version for the right syntax to use near '2147483647)' at line 1
SET PASSWORD FOR sqljxy01 = PASSWORD('abc123');
ERROR 42000: Can not find any matching row in the user table
SET CHARACTER SET 'utf9';
ERROR 42000: Unknown character set: 'utf9'
create table articles (test int,content varchar(30),primary key(test));
SELECT test  FROM `articles`  WHERE content REGEXP '.*<img.*?src=\"http://www' ;
test
set version_comment="";
ERROR HY000: Variable 'version_comment' is a read only variable
drop database tt;
use test;
drop table if exists t1;
select * from t1;
ERROR 42S02: Table 'test.t1' doesn't exist
drop table if exists html_content9;
CREATE TABLE `html_content9` (  `category_id ` INT NULL , `h_status` TINYINT NULL ,primary key( `category_id`));
ERROR 42000: Incorrect column name 'category_id '
set ft_min_word_le=3;
ERROR HY000: Unknown system variable 'ft_min_word_le'
drop table if exists Employees_HC;
drop table if exists Employees_China;
create table Employees_HC( E_ID  int primary key);
create table Employees_China( E_ID  int primary key,E_name varchar(20));
SELECT  E_id, E_name FROM Employees_China UNION  SELECT * FROM Employees_HC ;
ERROR 21000: The used SELECT statements have a different number of columns
drop table if exists yy;
create table yy (id int,primary key(id));
insert into yy values(12);
insert into yy values(13);
select id from yy where id = (select t.id from yy t );
ERROR 21000: Subquery returns more than 1 row
set max_allowed_packet=1024;
ERROR HY000: SESSION variable 'max_allowed_packet' is read-only. Use SET GLOBAL to assign the value
drop table if exists t1;
create table t1 (c1 VARCHAR(10) NOT NULL COMMENT 'c1 comment', c2 INTEGER,c3 INTEGER COMMENT '012345678901234567890123456789012345678901234567890123456789012345678901234567890123456789012345678901234567890123456789012345678901234567890123456789012345678901234567890123456789012345678901234567890123456789012345678901234567890123456789012345678901234567890123456789012345678901234567890123456789', c4 INTEGER, c5 INTEGER, c6 INTEGER, c7 INTEGER, INDEX i1 (c1) COMMENT 'i1 comment',INDEX i2(c2)
) COMMENT='abcdefghijabcdefghijabcdefghijabcdefghijabcdefghijabcdefghijabcdefghijabcdefghijabcdefghijabcdefghijabcdefghijabcdefghijabcdefghijabcdefghijabcdefghijabcdefghijabcdefghijabcdefghijabcdefghijabcdefghijabcdefghijabcdefghijabcdefghijabcdefghijabcdefghijabcdefghijabcdefghijabcdefghijabcdefghijabcdefghijabcdefghijabcdefghijabcdefghijabcdefghijabcdefghijabcdefghijabcdefghijabcdefghijabcdefghijabcdefghijabcdefghijabcdefghijabcdefghijabcdefghijabcdefghijabcdefghijabcdefghijabcdefghijabcdefghijabcdefghijabcdefghijabcdefghijabcdefghijabcdefghijabcdefghijabcdefghijabcdefghijabcdefghijabcdefghijabcdefghijabcdefghijabcdefghijabcdefghijabcdefghijabcdefghijabcdefghijabcdefghijabcdefghijabcdefghijabcdefghijabcdefghijabcdefghijabcdefghijabcdefghijabcdefghijabcdefghijabcdefghijabcdefghijabcdefghijabcdefghijabcdefghijabcdefghijabcdefghijabcdefghijabcdefghijabcdefghijabcdefghijabcdefghijabcdefghijabcdefghijabcdefghijabcdefghijabcdefghijabcdefghijabcdefghijabcdefghijabcdefghijabcdefghijabcdefghijabcdefghijabcdefghijabcdefghijabcdabcdefghijabcdefghijabcdefghijabcdefghijabcdefghijabcdefghijabcdefghijabcdefghijabcdefghijabcdefghijabcdefghijabcdefghijabcdefghijabcdefghijabcdefghijabcdefghijabcdefghijabcdefghijabcdefghijabcdefghijabcdefghijabcdefghijabcdefghijabcdefghijabcdefghijabcdefghijabcdefghijabcdefghijabcdefghijabcdefghijabcdefghijabcdefghijabcdefghijabcdefghijabcdefghijabcdefghijabcdefghijabcdefghijabcdefghijabcdefghijabcdefghijabcdefghijabcdefghijabcdefghijabcdefghijabcdefghijabcdefghijabcdefghijabcdefghijabcdefghijabcdefghijabcdefghijabcdefghijabcdefghijabcdefghijabcdefghijabcdefghijabcdefghijabcdefghijabcdefghijabcdefghijabcdefghijabcdefghijabcdefghijabcdefghijabcdefghijabcdefghijabcdefghijabcdefghijabcdefghijabcdefghijabcdefghijabcdefghijabcdefghijabcdefghijabcdefghijabcdefghijabcdefghijabcdefghijabcdefghijabcdefghijabcdefghijabcdefghijabcdefghijabcdefghijabcdefghijabcdefghijabcdefghijabcdefghijabcdefghijabcdefghijabcdefghijabcdefghijabcdefghijabcdefghijabcdefghijabcdefghijabcdefghijabcdefghijabcdefghijabcdefghijabcdefghijabcdeabcdefghijabcdefghijabcdefghijabcdefghijabcdefghijabcdefghijabcdefghijabcdefghijabcdefghijabcdefghijabcdefghijabcdefghijabcdefghijabcdefghijabcdefghijabcdefghijabcdefghijabcdefghijabcdefghijabcdefghijabcdefghijabcdefghijabcdefghijabcdefghijabcdefghijabcdefghijabcdefghijabcdefghijabcdefghijabcdefghijabcdefghijabcdefghijabcdefghijabcdefghijabcdefghijabcdefghijabcdefghijabcdefghijabcdefghijabcdefghijabcdefghijabcdefghijabcdefghijabcdefghijabcdefghijabcdefghijabcdefghijabcdefghijabcdefghijabcdefghijabcdefghijabcdefghijabcdefghijabcdefghijabcdefghijabcdefghijabcdefghijabcdefghijabcdefghijabcdefghijabcdefghijabcdefghijabcdefghijabcdefghijabcdefghijabcdefghijabcdefghijabcdefghijabcdefghijabcdefghijabcdefghijabcdefghijabcdefghijabcdefghijabcdefghijabcdefghijabcdefghijabcdefghijabcdefghijabcdefghijabcdefghijabcdefghijabcdefghijabcdefghijabcdefghijabcdefghijabcdefghijabcdefghijabcdefghijabcdefghijabcdefghijabcdefghijabcdefghijabcdefghijabcdefghijabcdefghijabcdefghijabcdefghijabcdefghijabcdefghijabcdefghijabcdefghijabcdabcdefghijabcdefghijabcdefghijabcdefghijabcdefghijabcdefghijabcdefghijabcdefghijabcdefghijabcdefghijabcdefghijabcdefghijabcdefghijabcdefghijabcdefghijabcdefghijabcdefghijabcdefghijabcdefghijabcdefghijabcdefghijabcdefghijabcdefghijabcdefghijabcdefghijabcdefghijabcdefghijabcdefghijabcdefghijabcdefghijabcdefghijabcdefghijabcdefghijabcdefghijabcdefghijabcdefghijabcdefghijabcdefghijabcdefghijabcdefghijabcdefghijabcdefghijabcdefghijabcdefghijabcdefghijabcdefghijabcdefghijabcdefghijabcdefghijabcdefghijabcdefghijabcdefghijabcdefghijabcdefghijabcdefghijabcdefghijabcdefghijabcdefghijabcdefghijabcdefghijabcdefghijabcdefghijabcdefghijabcdefghijabcdefghijabcdefghijabcdefghijabcdefghijabcdefghijabcdefghijabcdefghijabcdefghijabcdefghijabcdefghijabcdefghijabcdefghijabcdefghijabcdefghijabcdefghijabcdefghijabcdefghijabcdefghijabcdefghijabcdefghijabcdefghijabcdefghijabcdefghijabcdefghijabcdefghijabcdefghijabcdefghijabcdefghijabcdefghijabcdefghijabcdefghijabcdefghijabcdefghijabcdefghijabcdefghijabcdefghijabcdefghijabcdefghijabcde';
ERROR HY000: Comment for table is too long (max = 4096)
drop table if exists t1;
create table t1 ( i int primary key comment '123456789*123456789*123456789*123456789*
123456789*123456789*123456789*123456789*
123456789*123456789*123456789*123456789*
123456789*123456789*123456789*123456789*
123456789*123456789*123456789*123456789*
123456789*123456789*123456789*123456789*
123456789*123456789*123456789*123456789*
123456789*123456789*123456789*123456789*
123456789*123456789*123456789*123456789*
123456789*123456789*123456789*123456789*
123456789*123456789*123456789*123456789*
123456789*123456789*123456789*123456789*
123456789*123456789*123456789*123456789*
123456789*123456789*123456789*123456789*
123456789*123456789*123456789*123456789*
123456789*123456789*123456789*123456789*
123456789*123456789*123456789*123456789*
123456789*123456789*123456789*123456789*
123456789*123456789*123456789*123456789*
123456789*123456789*123456789*123456789*
123456789*123456789*123456789*123456789*
123456789*123456789*123456789*123456789*
123456789*123456789*123456789*123456789*
123456789*123456789*123456789*123456789***********************************************************************************************123456789*123456789*123456789*123456789*
123456789*123456789*123456789*123456789*
123456789*123456789*123456789*123456789*
123456789*123456789*123456789*123456789*
123456789*123456789*123456789*123456789*
123456789*123456789*123456789*123456789*
123456789*123456789*123456789*123456789*
123456789*123456789*123456789*123456789*
123456789*123456789*123456789*123456789*
123456789*123456789*123456789*123456789*
123456789*123456789*123456789*123456789*
123456789*123456789*123456789*123456789*
123456789*123456789*123456789*123456789*
123456789*123456789*123456789*123456789*
123456789*123456789*123456789*123456789*
123456789*123456789*123456789*123456789*
123456789*123456789*123456789*123456789*
123456789*123456789*123456789*123456789*
123456789*123456789*123456789*123456789*
123456789*123456789*123456789*123456789*
123456789*123456789*123456789*123456789*
123456789*123456789*123456789*123456789*
123456789*123456789*123456789*123456789*
123456789*123456789*123456789*123456789*********************************************************************************************');
ERROR HY000: Comment for field is too long (max = 2048)
drop table if exists t1;
drop table if exists t21;
CREATE TABLE t21 (c TIMESTAMP) PARTITION BY HASH (c) PARTITIONS 4;
ERROR HY000: Field 'c' is of a not allowed type for this type of partitioning
drop table if exists t1;
create table t1(c12 int primary key);
drop table if exists pre3;
create table pre3 (dd int UNSIGNED,cc int UNSIGNED,primary key(dd));
insert into pre3 values(2,99999);
select dd-cc from pre3 ;
ERROR 22003: BIGINT UNSIGNED value is out of range in ''(2 - 99999)''
drop table if exists t78;
CREATE TABLE t78(   pk INT,   a INT,   b INT,   PRIMARY KEY (pk) );
drop table if exists t1;
create table t1(c1 int primary key);
start transaction read only;
insert into t1 values(0);
ERROR 25006: Cannot execute statement in a READ ONLY transaction.
drop table if exists t1;
create table t1(a int not null, b int, c char(10) not null, d varchar(20),primary key(a)) ;
create table `aaaaaaaaaaaaaaaaaaaaaaaaaaaaaaaaaaaaaaaaaaaaaaaaaaaaaaaaaaaaaaaaaaa` (aaaaaaaaaaaaaaaaaaaaaaaaaaaaaaaaaaaaaaaaaaaaaaaaaaaaaaaaaaaaaaaaaa int);
ERROR 42000: Identifier name 'aaaaaaaaaaaaaaaaaaaaaaaaaaaaaaaaaaaaaaaaaaaaaaaaaaaaaaaaaaaaaaaaaaa' is too long
CREATE DATABASE aaaaaaaaaaaaaaaaaaaaaaaaaaaaaaaaaaaaaaaaaaaaaaaaaaaaaaaaaaaaaaaaaaaaaaaaaaaaaaaaaaaaaaaaaaaaaaaaaaaaaaaaaaaaaaaaaaaaaaaaaaaaaaaa;
ERROR 42000: Identifier name 'aaaaaaaaaaaaaaaaaaaaaaaaaaaaaaaaaaaaaaaaaaaaaaaaaaaaaaaaaaaaaaaaaaaaaaaaaaaaaaaaaaaaaaaaaaaaaaaaaaaaaaaaaaaaaaaaaaaaaaaaaaaaaaaa' is too long
alter table t1 add primary key (c);
ERROR 42000: Multiple primary key defined
drop table if exists main3;
create table main3(id int not null default null,name varchar(20),primary key(id));
ERROR 42000: Invalid default value for 'id'
set wait_timeout=null;
ERROR 42000: Incorrect argument type to variable 'wait_timeout'
set session max_allowed_packet=1048577;
ERROR HY000: SESSION variable 'max_allowed_packet' is read-only. Use SET GLOBAL to assign the value
drop table if exists t1;
create table t1(a int not null, b int, c char(10) not null, d varchar(20),primary key(a));
insert into t1 values (5,5,'oo','oo'),(4,4,'tr','tr'),(3,4,'ad','ad'),(2,3,'ak','ak');
alter table t1 add index (b,b);
ERROR 42S21: Duplicate column name 'b'
alter table t1 add index b (b), add index b (b);
ERROR 42000: Duplicate key name 'b'
drop table if exists t1;
create table t1(a int not null,primary key(a,a));
ERROR 42S21: Duplicate column name 'a'
drop table if exists t3;
create table t3 (c3 int primary key);
ALTER TABLE t3 CHANGE c3 `01234567890123456789012345678901234567890123456789012345678901234567890123456789012345678901234567890123456789012345678901234567` INT;
ERROR 42000: Identifier name '01234567890123456789012345678901234567890123456789012345678901234567890123456789012345678901234567890123456789012345678901234567' is too long
drop table if exists t3;
CREATE TABLE t1 (a INT PRIMARY KEY, b INT);
INSERT INTO t1 VALUES (1,1),(2,1),(3,2),(4,2),(5,3),(6,3);
SET SQL_MODE = 'ONLY_FULL_GROUP_BY';
SELECT MAX(a)-MIN(a) FROM t1 GROUP BY b;
MAX(a)-MIN(a)
1
1
1
SELECT CASE WHEN AVG(a)>=0 THEN 'Positive' ELSE 'Negative' END FROM t1  GROUP BY b;
CASE WHEN AVG(a)>=0 THEN 'Positive' ELSE 'Negative' END
Positive
Positive
Positive
SELECT a + 1 FROM t1 GROUP BY a;
a + 1
2
3
4
5
6
7
SELECT a + b FROM t1 GROUP BY b;
ERROR 42000: 'test.t1.a' is not in GROUP BY
SELECT concurrent_insert = @@session.concurrent_insert;
ERROR 42S22: Unknown column 'concurrent_insert' in 'field list'
DROP TABLE WL6445.t1;
ERROR 42S02: Unknown table 'wl6445.t1'
drop table if exists t2;
create table t2 (a int primary key) partition by hash(b) partitions 4;
ERROR 42S22: Unknown column 'b' in 'partition function'
drop table if exists k3;
create table k3(id int primary key, name varchar(20))  partition by key() partitions 2;
drop table if exists test;
create table test(test varchar(768) primary key);
drop table if exists t1;
create table t1(a int primary key);
alter table t1 add index (n);
ERROR 42000: Key column 'n' doesn't exist in table
drop table if exists b15776;
CREATE TABLE b15776 (a char(2147483647));
ERROR 42000: Column length too big for column 'a' (max = 256)
drop table if exists t1;
create table t1 ( id int primary key,a timestamp );
alter table t1 add unique ( a(1) );
ERROR HY000: Incorrect prefix key; the used key part isn't a string, the used length is longer than the key part, or the storage engine doesn't support unique prefix keys
drop table if exists t1;
create table t1(a int primary key);
ALTER TABLE t1 DROP INDEX c4;
ERROR 42000: Can't DROP 'c4'; check that column/key exists
drop table if exists v2;
create table v2(a int primary key);
update v2 set a = (select max(a) from v2);
CREATE VIEW v02 AS SELECT * FROM DUAL;
ERROR HY000: No tables used
USE `#mysql50#.`;
ERROR 42000: Incorrect database name '#mysql50#.'
drop table if exists t1;
create table t1 (a int primary key);
alter table t1 rename to ``;
ERROR 42000: Incorrect table name ''
rename table t1 to ``;
ERROR 42000: Incorrect table name ''
SELECT global.concurrent_insert;
ERROR 42S02: Unknown table 'global' in field list
drop table if exists t1;
create table t1(a int primary key);
INSERT INTO t1 (a, a) VALUES (1, 1);
ERROR 42000: Column 'a' specified twice
drop table if exists t1;
CREATE TABLE t1 (a tinyint(3), b varchar(255), PRIMARY KEY  (a));
SELECT 1 FROM t1 GROUP BY SUM(b);
ERROR HY000: Invalid use of group function
drop table if exists t1;
create table t1(a int primary key);
alter table t1 drop column a;
ERROR 42000: You can't delete all columns with ALTER TABLE; use DROP TABLE instead
drop table if exists t1;
create table t1(a int primary key);
INSERT INTO t1 VALUES (1, 1);
ERROR 21S01: Column count doesn't match value count at row 1
drop table if exists t1;
CREATE TABLE t1 (a INT primary key);
INSERT INTO t1 VALUES (1),(2);
drop view if exists v1;
CREATE VIEW v1 AS SELECT * FROM t1;
SELECT * FROM v1 USE KEY(non_existant);
a
1
2
SELECT * FROM v1 FORCE KEY(non_existant);
a
1
2
SELECT * FROM v1 IGNORE KEY(non_existant);
a
1
2
DROP VIEW v1;
DROP TABLE t1;
create table t1(a int primary key);
drop table if exists t1;
create table t1(a int primary key);
drop table if exists t1;
create table t1(a int primary key);
insert into t1 values(1);
drop table if exists t1;
create table t1(a int primary key);
drop table if exists t1;
CREATE TABLE t1 (a TIMESTAMP(6) ON UPDATE CURRENT_TIMESTAMP);
ERROR HY000: Invalid ON UPDATE clause for 'a' column
CREATE TABLE t1 (a TIMESTAMP(6) ON UPDATE CURRENT_TIMESTAMP(0));
ERROR HY000: Invalid ON UPDATE clause for 'a' column
SET @@time_zone = "+13:01";
ERROR HY000: Unknown or incorrect time zone: '+13:01'
SET @@global.time_zone = "+24:00";
ERROR HY000: Unknown or incorrect time zone: '+24:00'
SET @@time_zone = OFF;
ERROR HY000: Unknown or incorrect time zone: 'OFF'
SET @@time_zone = ON;
ERROR HY000: Unknown or incorrect time zone: 'ON'
SET @@global.time_zone = OFF;
ERROR HY000: Unknown or incorrect time zone: 'OFF'
create view v1 as select 1 from (select 1) as d1;
drop table if exists t1;
create table t1(a int primary key);
insert into t1 values(0x412020, NULL);
ERROR 21S01: Column count doesn't match value count at row 1
SELECT CAST(1 AS decimal(65,31));
ERROR 42000: Too big scale 31 specified for column '1'. Maximum is 30.
SELECT CAST(1 AS decimal(38,10));
CAST(1 AS decimal(38,10))
1.0000000000
SELECT CAST(1 AS decimal(66,10));
ERROR 42000: Too big precision 66 specified for column '1'. Maximum is 65.
CREATE TABLE t7(c1 DECIMAL(5,10));
ERROR 42000: For float(M,D), double(M,D) or decimal(M,D), M must be >= D (column 'c1').
CREATE TABLE t7(c1 FLOAT(5,10));
ERROR 42000: For float(M,D), double(M,D) or decimal(M,D), M must be >= D (column 'c1').
CREATE TABLE t7(c1 DOUBLE(5,10));
ERROR 42000: For float(M,D), double(M,D) or decimal(M,D), M must be >= D (column 'c1').
drop table if exists t1;
CREATE TABLE t1 (    id INT NOT NULL,    ic INT,    ia INT AUTO_INCREMENT,    ie INT AUTO_INCREMENT,    PRIMARY KEY(id)  );
ERROR 42000: Incorrect table definition; there can be only one auto column
create user mysqltest1_thisisreallytoolong_no_thisisevenlongerthanthat_hello;
ERROR HY000: String 'mysqltest1_thisisreallytoolong_no_thisisevenlongerthanthat_hello' is too long for user name (should be no longer than 64)
START TRANSACTION;
SET TRANSACTION READ ONLY;
ERROR 25001: Transaction characteristics can't be changed while a transaction is in progress
