create table test_table(id int primary key, name varchar(64), age int, description varchar(64), index index_1(age) local, index index_2(name) local);
insert into test_table(id, name, age, description) values (0, 'name33', 33, 'rd1');
insert into test_table(id, name, age, description) values (1, 'name33', 33, 'rd1');
insert into test_table(id, name, age, description) values (2, 'name33', 33, 'rd1');
insert into test_table(id, name, age, description) values (3, 'name33', 33, 'rd1');
insert into test_table(id, name, age, description) values (4, 'name33', 33, 'rd1');
insert into test_table(id, name, age, description) values (5, 'name33', 33, 'rd1');
insert into test_table(id, name, age, description) values (6, 'name33', 33, 'rd1');
insert into test_table(id, name, age, description) values (7, 'name33', 33, 'rd1');
insert into test_table(id, name, age, description) values (8, 'name33', 33, 'rd1');
insert into test_table(id, name, age, description) values (9, 'name33', 33, 'rd1');
insert into test_table(id, name, age, description) values (10, 'name33', 33, 'rd1');
insert into test_table(id, name, age, description) values (11, 'name33', 33, 'rd1');
insert into test_table(id, name, age, description) values (12, 'name33', 33, 'rd1');
insert into test_table(id, name, age, description) values (13, 'name33', 33, 'rd1');
insert into test_table(id, name, age, description) values (14, 'name33', 33, 'rd1');
insert into test_table(id, name, age, description) values (15, 'name33', 33, 'rd1');
insert into test_table(id, name, age, description) values (16, 'name33', 33, 'rd1');
insert into test_table(id, name, age, description) values (17, 'name33', 33, 'rd1');
insert into test_table(id, name, age, description) values (18, 'name33', 33, 'rd1');
insert into test_table(id, name, age, description) values (19, 'name33', 33, 'rd1');
insert into test_table(id, name, age, description) values (20, 'name33', 33, 'rd1');
insert into test_table(id, name, age, description) values (21, 'name33', 33, 'rd1');
insert into test_table(id, name, age, description) values (22, 'name33', 33, 'rd1');
insert into test_table(id, name, age, description) values (23, 'name33', 33, 'rd1');
insert into test_table(id, name, age, description) values (24, 'name33', 33, 'rd1');
insert into test_table(id, name, age, description) values (25, 'name33', 33, 'rd1');
insert into test_table(id, name, age, description) values (26, 'name33', 33, 'rd1');
insert into test_table(id, name, age, description) values (27, 'name33', 33, 'rd1');
insert into test_table(id, name, age, description) values (28, 'name33', 33, 'rd1');
insert into test_table(id, name, age, description) values (29, 'name33', 33, 'rd1');
insert into test_table(id, name, age, description) values (30, 'name33', 33, 'rd1');
insert into test_table(id, name, age, description) values (31, 'name33', 33, 'rd1');
insert into test_table(id, name, age, description) values (32, 'name33', 33, 'rd1');
insert into test_table(id, name, age, description) values (33, 'name33', 33, 'rd1');
insert into test_table(id, name, age, description) values (34, 'name33', 33, 'rd1');
insert into test_table(id, name, age, description) values (35, 'name33', 33, 'rd1');
insert into test_table(id, name, age, description) values (36, 'name33', 33, 'rd1');
insert into test_table(id, name, age, description) values (37, 'name33', 33, 'rd1');
insert into test_table(id, name, age, description) values (38, 'name33', 33, 'rd1');
insert into test_table(id, name, age, description) values (39, 'name33', 33, 'rd1');
insert into test_table(id, name, age, description) values (40, 'name33', 33, 'rd1');
insert into test_table(id, name, age, description) values (41, 'name33', 33, 'rd1');
insert into test_table(id, name, age, description) values (42, 'name33', 33, 'rd1');
insert into test_table(id, name, age, description) values (43, 'name33', 33, 'rd1');
insert into test_table(id, name, age, description) values (44, 'name33', 33, 'rd1');
insert into test_table(id, name, age, description) values (45, 'name33', 33, 'rd1');
insert into test_table(id, name, age, description) values (46, 'name33', 33, 'rd1');
insert into test_table(id, name, age, description) values (47, 'name33', 33, 'rd1');
insert into test_table(id, name, age, description) values (48, 'name33', 33, 'rd1');
insert into test_table(id, name, age, description) values (49, 'name33', 33, 'rd1');
insert into test_table(id, name, age, description) values (50, 'name33', 33, 'rd1');
insert into test_table(id, name, age, description) values (51, 'name33', 33, 'rd1');
insert into test_table(id, name, age, description) values (52, 'name33', 33, 'rd1');
insert into test_table(id, name, age, description) values (53, 'name33', 33, 'rd1');
insert into test_table(id, name, age, description) values (54, 'name33', 33, 'rd1');
insert into test_table(id, name, age, description) values (55, 'name33', 33, 'rd1');
insert into test_table(id, name, age, description) values (56, 'name33', 33, 'rd1');
insert into test_table(id, name, age, description) values (57, 'name33', 33, 'rd1');
insert into test_table(id, name, age, description) values (58, 'name33', 33, 'rd1');
insert into test_table(id, name, age, description) values (59, 'name33', 33, 'rd1');
insert into test_table(id, name, age, description) values (60, 'name33', 33, 'rd1');
insert into test_table(id, name, age, description) values (61, 'name33', 33, 'rd1');
insert into test_table(id, name, age, description) values (62, 'name33', 33, 'rd1');
insert into test_table(id, name, age, description) values (63, 'name33', 33, 'rd1');
insert into test_table(id, name, age, description) values (64, 'name33', 33, 'rd1');
insert into test_table(id, name, age, description) values (65, 'name33', 33, 'rd1');
insert into test_table(id, name, age, description) values (66, 'name33', 33, 'rd1');
insert into test_table(id, name, age, description) values (67, 'name33', 33, 'rd1');
insert into test_table(id, name, age, description) values (68, 'name33', 33, 'rd1');
insert into test_table(id, name, age, description) values (69, 'name33', 33, 'rd1');
insert into test_table(id, name, age, description) values (70, 'name33', 33, 'rd1');
insert into test_table(id, name, age, description) values (71, 'name33', 33, 'rd1');
insert into test_table(id, name, age, description) values (72, 'name33', 33, 'rd1');
insert into test_table(id, name, age, description) values (73, 'name33', 33, 'rd1');
insert into test_table(id, name, age, description) values (74, 'name33', 33, 'rd1');
insert into test_table(id, name, age, description) values (75, 'name33', 33, 'rd1');
insert into test_table(id, name, age, description) values (76, 'name33', 33, 'rd1');
insert into test_table(id, name, age, description) values (77, 'name33', 33, 'rd1');
insert into test_table(id, name, age, description) values (78, 'name33', 33, 'rd1');
insert into test_table(id, name, age, description) values (79, 'name33', 33, 'rd1');
insert into test_table(id, name, age, description) values (80, 'name33', 33, 'rd1');
insert into test_table(id, name, age, description) values (81, 'name33', 33, 'rd1');
insert into test_table(id, name, age, description) values (82, 'name33', 33, 'rd1');
insert into test_table(id, name, age, description) values (83, 'name33', 33, 'rd1');
insert into test_table(id, name, age, description) values (84, 'name33', 33, 'rd1');
insert into test_table(id, name, age, description) values (85, 'name33', 33, 'rd1');
insert into test_table(id, name, age, description) values (86, 'name33', 33, 'rd1');
insert into test_table(id, name, age, description) values (87, 'name33', 33, 'rd1');
insert into test_table(id, name, age, description) values (88, 'name33', 33, 'rd1');
insert into test_table(id, name, age, description) values (89, 'name33', 33, 'rd1');
insert into test_table(id, name, age, description) values (90, 'name33', 33, 'rd1');
insert into test_table(id, name, age, description) values (91, 'name33', 33, 'rd1');
insert into test_table(id, name, age, description) values (92, 'name33', 33, 'rd1');
insert into test_table(id, name, age, description) values (93, 'name33', 33, 'rd1');
insert into test_table(id, name, age, description) values (94, 'name33', 33, 'rd1');
insert into test_table(id, name, age, description) values (95, 'name33', 33, 'rd1');
insert into test_table(id, name, age, description) values (96, 'name33', 33, 'rd1');
insert into test_table(id, name, age, description) values (97, 'name33', 33, 'rd1');
insert into test_table(id, name, age, description) values (98, 'name33', 33, 'rd1');
insert into test_table(id, name, age, description) values (99, 'name33', 33, 'rd1');
insert into test_table(id, name, age, description) values (100, 'name44', 44, 'rd2');
insert into test_table(id, name, age, description) values (101, 'name44', 44, 'rd2');
insert into test_table(id, name, age, description) values (102, 'name44', 44, 'rd2');
insert into test_table(id, name, age, description) values (103, 'name44', 44, 'rd2');
insert into test_table(id, name, age, description) values (104, 'name44', 44, 'rd2');
insert into test_table(id, name, age, description) values (105, 'name44', 44, 'rd2');
insert into test_table(id, name, age, description) values (106, 'name44', 44, 'rd2');
insert into test_table(id, name, age, description) values (107, 'name44', 44, 'rd2');
insert into test_table(id, name, age, description) values (108, 'name44', 44, 'rd2');
insert into test_table(id, name, age, description) values (109, 'name44', 44, 'rd2');
insert into test_table(id, name, age, description) values (110, 'name44', 44, 'rd2');
insert into test_table(id, name, age, description) values (111, 'name44', 44, 'rd2');
insert into test_table(id, name, age, description) values (112, 'name44', 44, 'rd2');
insert into test_table(id, name, age, description) values (113, 'name44', 44, 'rd2');
insert into test_table(id, name, age, description) values (114, 'name44', 44, 'rd2');
insert into test_table(id, name, age, description) values (115, 'name44', 44, 'rd2');
insert into test_table(id, name, age, description) values (116, 'name44', 44, 'rd2');
insert into test_table(id, name, age, description) values (117, 'name44', 44, 'rd2');
insert into test_table(id, name, age, description) values (118, 'name44', 44, 'rd2');
insert into test_table(id, name, age, description) values (119, 'name44', 44, 'rd2');
insert into test_table(id, name, age, description) values (120, 'name44', 44, 'rd2');
insert into test_table(id, name, age, description) values (121, 'name44', 44, 'rd2');
insert into test_table(id, name, age, description) values (122, 'name44', 44, 'rd2');
insert into test_table(id, name, age, description) values (123, 'name44', 44, 'rd2');
insert into test_table(id, name, age, description) values (124, 'name44', 44, 'rd2');
insert into test_table(id, name, age, description) values (125, 'name44', 44, 'rd2');
insert into test_table(id, name, age, description) values (126, 'name44', 44, 'rd2');
insert into test_table(id, name, age, description) values (127, 'name44', 44, 'rd2');
insert into test_table(id, name, age, description) values (128, 'name44', 44, 'rd2');
insert into test_table(id, name, age, description) values (129, 'name44', 44, 'rd2');
insert into test_table(id, name, age, description) values (130, 'name44', 44, 'rd2');
insert into test_table(id, name, age, description) values (131, 'name44', 44, 'rd2');
insert into test_table(id, name, age, description) values (132, 'name44', 44, 'rd2');
insert into test_table(id, name, age, description) values (133, 'name44', 44, 'rd2');
insert into test_table(id, name, age, description) values (134, 'name44', 44, 'rd2');
insert into test_table(id, name, age, description) values (135, 'name44', 44, 'rd2');
insert into test_table(id, name, age, description) values (136, 'name44', 44, 'rd2');
insert into test_table(id, name, age, description) values (137, 'name44', 44, 'rd2');
insert into test_table(id, name, age, description) values (138, 'name44', 44, 'rd2');
insert into test_table(id, name, age, description) values (139, 'name44', 44, 'rd2');
insert into test_table(id, name, age, description) values (140, 'name44', 44, 'rd2');
insert into test_table(id, name, age, description) values (141, 'name44', 44, 'rd2');
insert into test_table(id, name, age, description) values (142, 'name44', 44, 'rd2');
insert into test_table(id, name, age, description) values (143, 'name44', 44, 'rd2');
insert into test_table(id, name, age, description) values (144, 'name44', 44, 'rd2');
insert into test_table(id, name, age, description) values (145, 'name44', 44, 'rd2');
insert into test_table(id, name, age, description) values (146, 'name44', 44, 'rd2');
insert into test_table(id, name, age, description) values (147, 'name44', 44, 'rd2');
insert into test_table(id, name, age, description) values (148, 'name44', 44, 'rd2');
insert into test_table(id, name, age, description) values (149, 'name44', 44, 'rd2');
insert into test_table(id, name, age, description) values (150, 'name44', 44, 'rd2');
insert into test_table(id, name, age, description) values (151, 'name44', 44, 'rd2');
insert into test_table(id, name, age, description) values (152, 'name44', 44, 'rd2');
insert into test_table(id, name, age, description) values (153, 'name44', 44, 'rd2');
insert into test_table(id, name, age, description) values (154, 'name44', 44, 'rd2');
insert into test_table(id, name, age, description) values (155, 'name44', 44, 'rd2');
insert into test_table(id, name, age, description) values (156, 'name44', 44, 'rd2');
insert into test_table(id, name, age, description) values (157, 'name44', 44, 'rd2');
insert into test_table(id, name, age, description) values (158, 'name44', 44, 'rd2');
insert into test_table(id, name, age, description) values (159, 'name44', 44, 'rd2');
insert into test_table(id, name, age, description) values (160, 'name44', 44, 'rd2');
insert into test_table(id, name, age, description) values (161, 'name44', 44, 'rd2');
insert into test_table(id, name, age, description) values (162, 'name44', 44, 'rd2');
insert into test_table(id, name, age, description) values (163, 'name44', 44, 'rd2');
insert into test_table(id, name, age, description) values (164, 'name44', 44, 'rd2');
insert into test_table(id, name, age, description) values (165, 'name44', 44, 'rd2');
insert into test_table(id, name, age, description) values (166, 'name44', 44, 'rd2');
insert into test_table(id, name, age, description) values (167, 'name44', 44, 'rd2');
insert into test_table(id, name, age, description) values (168, 'name44', 44, 'rd2');
insert into test_table(id, name, age, description) values (169, 'name44', 44, 'rd2');
insert into test_table(id, name, age, description) values (170, 'name44', 44, 'rd2');
insert into test_table(id, name, age, description) values (171, 'name44', 44, 'rd2');
insert into test_table(id, name, age, description) values (172, 'name44', 44, 'rd2');
insert into test_table(id, name, age, description) values (173, 'name44', 44, 'rd2');
insert into test_table(id, name, age, description) values (174, 'name44', 44, 'rd2');
insert into test_table(id, name, age, description) values (175, 'name44', 44, 'rd2');
insert into test_table(id, name, age, description) values (176, 'name44', 44, 'rd2');
insert into test_table(id, name, age, description) values (177, 'name44', 44, 'rd2');
insert into test_table(id, name, age, description) values (178, 'name44', 44, 'rd2');
insert into test_table(id, name, age, description) values (179, 'name44', 44, 'rd2');
insert into test_table(id, name, age, description) values (180, 'name44', 44, 'rd2');
insert into test_table(id, name, age, description) values (181, 'name44', 44, 'rd2');
insert into test_table(id, name, age, description) values (182, 'name44', 44, 'rd2');
insert into test_table(id, name, age, description) values (183, 'name44', 44, 'rd2');
insert into test_table(id, name, age, description) values (184, 'name44', 44, 'rd2');
insert into test_table(id, name, age, description) values (185, 'name44', 44, 'rd2');
insert into test_table(id, name, age, description) values (186, 'name44', 44, 'rd2');
insert into test_table(id, name, age, description) values (187, 'name44', 44, 'rd2');
insert into test_table(id, name, age, description) values (188, 'name44', 44, 'rd2');
insert into test_table(id, name, age, description) values (189, 'name44', 44, 'rd2');
insert into test_table(id, name, age, description) values (190, 'name44', 44, 'rd2');
insert into test_table(id, name, age, description) values (191, 'name44', 44, 'rd2');
insert into test_table(id, name, age, description) values (192, 'name44', 44, 'rd2');
insert into test_table(id, name, age, description) values (193, 'name44', 44, 'rd2');
insert into test_table(id, name, age, description) values (194, 'name44', 44, 'rd2');
insert into test_table(id, name, age, description) values (195, 'name44', 44, 'rd2');
insert into test_table(id, name, age, description) values (196, 'name44', 44, 'rd2');
insert into test_table(id, name, age, description) values (197, 'name44', 44, 'rd2');
insert into test_table(id, name, age, description) values (198, 'name44', 44, 'rd2');
insert into test_table(id, name, age, description) values (199, 'name44', 44, 'rd2');
insert into test_table(id, name, age, description) values (200, 'name22', 22, 'rd3');
insert into test_table(id, name, age, description) values (201, 'name22', 22, 'rd3');
insert into test_table(id, name, age, description) values (202, 'name22', 22, 'rd3');
insert into test_table(id, name, age, description) values (203, 'name22', 22, 'rd3');
insert into test_table(id, name, age, description) values (204, 'name22', 22, 'rd3');
insert into test_table(id, name, age, description) values (205, 'name22', 22, 'rd3');
insert into test_table(id, name, age, description) values (206, 'name22', 22, 'rd3');
insert into test_table(id, name, age, description) values (207, 'name22', 22, 'rd3');
insert into test_table(id, name, age, description) values (208, 'name22', 22, 'rd3');
insert into test_table(id, name, age, description) values (209, 'name22', 22, 'rd3');
insert into test_table(id, name, age, description) values (210, 'name22', 22, 'rd3');
insert into test_table(id, name, age, description) values (211, 'name22', 22, 'rd3');
insert into test_table(id, name, age, description) values (212, 'name22', 22, 'rd3');
insert into test_table(id, name, age, description) values (213, 'name22', 22, 'rd3');
insert into test_table(id, name, age, description) values (214, 'name22', 22, 'rd3');
insert into test_table(id, name, age, description) values (215, 'name22', 22, 'rd3');
insert into test_table(id, name, age, description) values (216, 'name22', 22, 'rd3');
insert into test_table(id, name, age, description) values (217, 'name22', 22, 'rd3');
insert into test_table(id, name, age, description) values (218, 'name22', 22, 'rd3');
insert into test_table(id, name, age, description) values (219, 'name22', 22, 'rd3');
insert into test_table(id, name, age, description) values (220, 'name22', 22, 'rd3');
insert into test_table(id, name, age, description) values (221, 'name22', 22, 'rd3');
insert into test_table(id, name, age, description) values (222, 'name22', 22, 'rd3');
insert into test_table(id, name, age, description) values (223, 'name22', 22, 'rd3');
insert into test_table(id, name, age, description) values (224, 'name22', 22, 'rd3');
insert into test_table(id, name, age, description) values (225, 'name22', 22, 'rd3');
insert into test_table(id, name, age, description) values (226, 'name22', 22, 'rd3');
insert into test_table(id, name, age, description) values (227, 'name22', 22, 'rd3');
insert into test_table(id, name, age, description) values (228, 'name22', 22, 'rd3');
insert into test_table(id, name, age, description) values (229, 'name22', 22, 'rd3');
insert into test_table(id, name, age, description) values (230, 'name22', 22, 'rd3');
insert into test_table(id, name, age, description) values (231, 'name22', 22, 'rd3');
insert into test_table(id, name, age, description) values (232, 'name22', 22, 'rd3');
insert into test_table(id, name, age, description) values (233, 'name22', 22, 'rd3');
insert into test_table(id, name, age, description) values (234, 'name22', 22, 'rd3');
insert into test_table(id, name, age, description) values (235, 'name22', 22, 'rd3');
insert into test_table(id, name, age, description) values (236, 'name22', 22, 'rd3');
insert into test_table(id, name, age, description) values (237, 'name22', 22, 'rd3');
insert into test_table(id, name, age, description) values (238, 'name22', 22, 'rd3');
insert into test_table(id, name, age, description) values (239, 'name22', 22, 'rd3');
insert into test_table(id, name, age, description) values (240, 'name22', 22, 'rd3');
insert into test_table(id, name, age, description) values (241, 'name22', 22, 'rd3');
insert into test_table(id, name, age, description) values (242, 'name22', 22, 'rd3');
insert into test_table(id, name, age, description) values (243, 'name22', 22, 'rd3');
insert into test_table(id, name, age, description) values (244, 'name22', 22, 'rd3');
insert into test_table(id, name, age, description) values (245, 'name22', 22, 'rd3');
insert into test_table(id, name, age, description) values (246, 'name22', 22, 'rd3');
insert into test_table(id, name, age, description) values (247, 'name22', 22, 'rd3');
insert into test_table(id, name, age, description) values (248, 'name22', 22, 'rd3');
insert into test_table(id, name, age, description) values (249, 'name22', 22, 'rd3');
insert into test_table(id, name, age, description) values (250, 'name22', 22, 'rd3');
insert into test_table(id, name, age, description) values (251, 'name22', 22, 'rd3');
insert into test_table(id, name, age, description) values (252, 'name22', 22, 'rd3');
insert into test_table(id, name, age, description) values (253, 'name22', 22, 'rd3');
insert into test_table(id, name, age, description) values (254, 'name22', 22, 'rd3');
insert into test_table(id, name, age, description) values (255, 'name22', 22, 'rd3');
insert into test_table(id, name, age, description) values (256, 'name22', 22, 'rd3');
insert into test_table(id, name, age, description) values (257, 'name22', 22, 'rd3');
insert into test_table(id, name, age, description) values (258, 'name22', 22, 'rd3');
insert into test_table(id, name, age, description) values (259, 'name22', 22, 'rd3');
insert into test_table(id, name, age, description) values (260, 'name22', 22, 'rd3');
insert into test_table(id, name, age, description) values (261, 'name22', 22, 'rd3');
insert into test_table(id, name, age, description) values (262, 'name22', 22, 'rd3');
insert into test_table(id, name, age, description) values (263, 'name22', 22, 'rd3');
insert into test_table(id, name, age, description) values (264, 'name22', 22, 'rd3');
insert into test_table(id, name, age, description) values (265, 'name22', 22, 'rd3');
insert into test_table(id, name, age, description) values (266, 'name22', 22, 'rd3');
insert into test_table(id, name, age, description) values (267, 'name22', 22, 'rd3');
insert into test_table(id, name, age, description) values (268, 'name22', 22, 'rd3');
insert into test_table(id, name, age, description) values (269, 'name22', 22, 'rd3');
insert into test_table(id, name, age, description) values (270, 'name22', 22, 'rd3');
insert into test_table(id, name, age, description) values (271, 'name22', 22, 'rd3');
insert into test_table(id, name, age, description) values (272, 'name22', 22, 'rd3');
insert into test_table(id, name, age, description) values (273, 'name22', 22, 'rd3');
insert into test_table(id, name, age, description) values (274, 'name22', 22, 'rd3');
insert into test_table(id, name, age, description) values (275, 'name22', 22, 'rd3');
insert into test_table(id, name, age, description) values (276, 'name22', 22, 'rd3');
insert into test_table(id, name, age, description) values (277, 'name22', 22, 'rd3');
insert into test_table(id, name, age, description) values (278, 'name22', 22, 'rd3');
insert into test_table(id, name, age, description) values (279, 'name22', 22, 'rd3');
insert into test_table(id, name, age, description) values (280, 'name22', 22, 'rd3');
insert into test_table(id, name, age, description) values (281, 'name22', 22, 'rd3');
insert into test_table(id, name, age, description) values (282, 'name22', 22, 'rd3');
insert into test_table(id, name, age, description) values (283, 'name22', 22, 'rd3');
insert into test_table(id, name, age, description) values (284, 'name22', 22, 'rd3');
insert into test_table(id, name, age, description) values (285, 'name22', 22, 'rd3');
insert into test_table(id, name, age, description) values (286, 'name22', 22, 'rd3');
insert into test_table(id, name, age, description) values (287, 'name22', 22, 'rd3');
insert into test_table(id, name, age, description) values (288, 'name22', 22, 'rd3');
insert into test_table(id, name, age, description) values (289, 'name22', 22, 'rd3');
insert into test_table(id, name, age, description) values (290, 'name22', 22, 'rd3');
insert into test_table(id, name, age, description) values (291, 'name22', 22, 'rd3');
insert into test_table(id, name, age, description) values (292, 'name22', 22, 'rd3');
insert into test_table(id, name, age, description) values (293, 'name22', 22, 'rd3');
insert into test_table(id, name, age, description) values (294, 'name22', 22, 'rd3');
insert into test_table(id, name, age, description) values (295, 'name22', 22, 'rd3');
insert into test_table(id, name, age, description) values (296, 'name22', 22, 'rd3');
insert into test_table(id, name, age, description) values (297, 'name22', 22, 'rd3');
insert into test_table(id, name, age, description) values (298, 'name22', 22, 'rd3');
insert into test_table(id, name, age, description) values (299, 'name22', 22, 'rd3');
case 1: all data in memtable, no sstable
select count(*) from test_table;
count(*)
300
explain select * from test_table;
Query Plan
=========================================
|ID|OPERATOR  |NAME      |EST. ROWS|COST|
-----------------------------------------
|0 |TABLE SCAN|test_table|300      |140 |
=========================================

Outputs & filters: 
-------------------------------------
  0 - output([test_table.id], [test_table.name], [test_table.age], [test_table.description]), filter(nil), 
      access([test_table.id], [test_table.name], [test_table.age], [test_table.description]), partitions(p0)

select count(*) from test_table where age = 22;
count(*)
100
explain select /*+index(test_table index_1)*/ * from test_table where age = 22;
Query Plan
==================================================
|ID|OPERATOR  |NAME               |EST. ROWS|COST|
--------------------------------------------------
|0 |TABLE SCAN|test_table(index_1)|100      |621 |
==================================================

Outputs & filters: 
-------------------------------------
  0 - output([test_table.id], [test_table.name], [test_table.age], [test_table.description]), filter(nil), 
      access([test_table.age], [test_table.id], [test_table.name], [test_table.description]), partitions(p0)

select count(*) from test_table where name = 'name22';
count(*)
100
explain select /*+index(test_table index_2)*/ * from test_table where name = 'name22';
Query Plan
==================================================
|ID|OPERATOR  |NAME               |EST. ROWS|COST|
--------------------------------------------------
|0 |TABLE SCAN|test_table(index_2)|100      |621 |
==================================================

Outputs & filters: 
-------------------------------------
  0 - output([test_table.id], [test_table.name], [test_table.age], [test_table.description]), filter(nil), 
      access([test_table.name], [test_table.id], [test_table.age], [test_table.description]), partitions(p0)

alter system major freeze tenant = sys;
alter system major freeze tenant = all_user;
alter system major freeze tenant = all_meta;
case 2: all data in sstable, not memtable data
select count(*) from test_table;
count(*)
300
explain select * from test_table;
Query Plan
=========================================
|ID|OPERATOR  |NAME      |EST. ROWS|COST|
-----------------------------------------
|0 |TABLE SCAN|test_table|300      |140 |
=========================================

Outputs & filters: 
-------------------------------------
  0 - output([test_table.id], [test_table.name], [test_table.age], [test_table.description]), filter(nil), 
      access([test_table.id], [test_table.name], [test_table.age], [test_table.description]), partitions(p0)

select count(*) from test_table where age = 22;
count(*)
100
explain select /*+index(test_table index_1)*/ * from test_table where age = 22;
Query Plan
==================================================
|ID|OPERATOR  |NAME               |EST. ROWS|COST|
--------------------------------------------------
|0 |TABLE SCAN|test_table(index_1)|100      |621 |
==================================================

Outputs & filters: 
-------------------------------------
  0 - output([test_table.id], [test_table.name], [test_table.age], [test_table.description]), filter(nil), 
      access([test_table.age], [test_table.id], [test_table.name], [test_table.description]), partitions(p0)

select count(*) from test_table where name = 'name22';
count(*)
100
explain select /*+index(test_table index_2)*/ * from test_table where name = 'name22';
Query Plan
==================================================
|ID|OPERATOR  |NAME               |EST. ROWS|COST|
--------------------------------------------------
|0 |TABLE SCAN|test_table(index_2)|100      |621 |
==================================================

Outputs & filters: 
-------------------------------------
  0 - output([test_table.id], [test_table.name], [test_table.age], [test_table.description]), filter(nil), 
      access([test_table.name], [test_table.id], [test_table.age], [test_table.description]), partitions(p0)

case 3: main table delete estimate cost
delete from test_table where id < 50;
select count(*) from test_table where id < 100;
count(*)
50
explain select * from test_table where id < 100;
Query Plan
=========================================
|ID|OPERATOR  |NAME      |EST. ROWS|COST|
-----------------------------------------
|0 |TABLE SCAN|test_table|50       |48  |
=========================================

Outputs & filters: 
-------------------------------------
  0 - output([test_table.id], [test_table.name], [test_table.age], [test_table.description]), filter(nil), 
      access([test_table.id], [test_table.name], [test_table.age], [test_table.description]), partitions(p0)

select count(*) from test_table where age = 33;
count(*)
50
explain select /*+index(test_table index_1)*/ * from test_table where age = 33;
Query Plan
==================================================
|ID|OPERATOR  |NAME               |EST. ROWS|COST|
--------------------------------------------------
|0 |TABLE SCAN|test_table(index_1)|50       |352 |
==================================================

Outputs & filters: 
-------------------------------------
  0 - output([test_table.id], [test_table.name], [test_table.age], [test_table.description]), filter(nil), 
      access([test_table.age], [test_table.id], [test_table.name], [test_table.description]), partitions(p0)

select count(*) from test_table where name = 'name33';
count(*)
50
explain select /*+index(test_table index_2)*/ * from test_table where name = 'name33';
Query Plan
==================================================
|ID|OPERATOR  |NAME               |EST. ROWS|COST|
--------------------------------------------------
|0 |TABLE SCAN|test_table(index_2)|50       |352 |
==================================================

Outputs & filters: 
-------------------------------------
  0 - output([test_table.id], [test_table.name], [test_table.age], [test_table.description]), filter(nil), 
      access([test_table.name], [test_table.id], [test_table.age], [test_table.description]), partitions(p0)

case 4: main table delete -> insert estimate cost
insert into test_table(id, name, age, description) values (0, 'name33', 33, 'rd1');
insert into test_table(id, name, age, description) values (1, 'name33', 33, 'rd1');
insert into test_table(id, name, age, description) values (2, 'name33', 33, 'rd1');
insert into test_table(id, name, age, description) values (3, 'name33', 33, 'rd1');
insert into test_table(id, name, age, description) values (4, 'name33', 33, 'rd1');
insert into test_table(id, name, age, description) values (5, 'name33', 33, 'rd1');
insert into test_table(id, name, age, description) values (6, 'name33', 33, 'rd1');
insert into test_table(id, name, age, description) values (7, 'name33', 33, 'rd1');
insert into test_table(id, name, age, description) values (8, 'name33', 33, 'rd1');
insert into test_table(id, name, age, description) values (9, 'name33', 33, 'rd1');
insert into test_table(id, name, age, description) values (10, 'name33', 33, 'rd1');
insert into test_table(id, name, age, description) values (11, 'name33', 33, 'rd1');
insert into test_table(id, name, age, description) values (12, 'name33', 33, 'rd1');
insert into test_table(id, name, age, description) values (13, 'name33', 33, 'rd1');
insert into test_table(id, name, age, description) values (14, 'name33', 33, 'rd1');
insert into test_table(id, name, age, description) values (15, 'name33', 33, 'rd1');
insert into test_table(id, name, age, description) values (16, 'name33', 33, 'rd1');
insert into test_table(id, name, age, description) values (17, 'name33', 33, 'rd1');
insert into test_table(id, name, age, description) values (18, 'name33', 33, 'rd1');
insert into test_table(id, name, age, description) values (19, 'name33', 33, 'rd1');
insert into test_table(id, name, age, description) values (20, 'name33', 33, 'rd1');
insert into test_table(id, name, age, description) values (21, 'name33', 33, 'rd1');
insert into test_table(id, name, age, description) values (22, 'name33', 33, 'rd1');
insert into test_table(id, name, age, description) values (23, 'name33', 33, 'rd1');
insert into test_table(id, name, age, description) values (24, 'name33', 33, 'rd1');
insert into test_table(id, name, age, description) values (25, 'name33', 33, 'rd1');
insert into test_table(id, name, age, description) values (26, 'name33', 33, 'rd1');
insert into test_table(id, name, age, description) values (27, 'name33', 33, 'rd1');
insert into test_table(id, name, age, description) values (28, 'name33', 33, 'rd1');
insert into test_table(id, name, age, description) values (29, 'name33', 33, 'rd1');
insert into test_table(id, name, age, description) values (30, 'name33', 33, 'rd1');
insert into test_table(id, name, age, description) values (31, 'name33', 33, 'rd1');
insert into test_table(id, name, age, description) values (32, 'name33', 33, 'rd1');
insert into test_table(id, name, age, description) values (33, 'name33', 33, 'rd1');
insert into test_table(id, name, age, description) values (34, 'name33', 33, 'rd1');
insert into test_table(id, name, age, description) values (35, 'name33', 33, 'rd1');
insert into test_table(id, name, age, description) values (36, 'name33', 33, 'rd1');
insert into test_table(id, name, age, description) values (37, 'name33', 33, 'rd1');
insert into test_table(id, name, age, description) values (38, 'name33', 33, 'rd1');
insert into test_table(id, name, age, description) values (39, 'name33', 33, 'rd1');
insert into test_table(id, name, age, description) values (40, 'name33', 33, 'rd1');
insert into test_table(id, name, age, description) values (41, 'name33', 33, 'rd1');
insert into test_table(id, name, age, description) values (42, 'name33', 33, 'rd1');
insert into test_table(id, name, age, description) values (43, 'name33', 33, 'rd1');
insert into test_table(id, name, age, description) values (44, 'name33', 33, 'rd1');
insert into test_table(id, name, age, description) values (45, 'name33', 33, 'rd1');
insert into test_table(id, name, age, description) values (46, 'name33', 33, 'rd1');
insert into test_table(id, name, age, description) values (47, 'name33', 33, 'rd1');
insert into test_table(id, name, age, description) values (48, 'name33', 33, 'rd1');
insert into test_table(id, name, age, description) values (49, 'name33', 33, 'rd1');
select count(*) from test_table where id < 100;
count(*)
100
explain select * from test_table where id < 100;
Query Plan
=========================================
|ID|OPERATOR  |NAME      |EST. ROWS|COST|
-----------------------------------------
|0 |TABLE SCAN|test_table|100      |59  |
=========================================

Outputs & filters: 
-------------------------------------
  0 - output([test_table.id], [test_table.name], [test_table.age], [test_table.description]), filter(nil), 
      access([test_table.id], [test_table.name], [test_table.age], [test_table.description]), partitions(p0)

select count(*) from test_table where age = 33;
count(*)
100
explain select /*+index(test_table index_1)*/ * from test_table where age = 33;
Query Plan
==================================================
|ID|OPERATOR  |NAME               |EST. ROWS|COST|
--------------------------------------------------
|0 |TABLE SCAN|test_table(index_1)|100      |621 |
==================================================

Outputs & filters: 
-------------------------------------
  0 - output([test_table.id], [test_table.name], [test_table.age], [test_table.description]), filter(nil), 
      access([test_table.age], [test_table.id], [test_table.name], [test_table.description]), partitions(p0)

select count(*) from test_table where name = 'name33';
count(*)
100
explain select /*+index(test_table index_2)*/ * from test_table where name = 'name33';
Query Plan
==================================================
|ID|OPERATOR  |NAME               |EST. ROWS|COST|
--------------------------------------------------
|0 |TABLE SCAN|test_table(index_2)|100      |621 |
==================================================

Outputs & filters: 
-------------------------------------
  0 - output([test_table.id], [test_table.name], [test_table.age], [test_table.description]), filter(nil), 
      access([test_table.name], [test_table.id], [test_table.age], [test_table.description]), partitions(p0)

case 5: main table update estimate cost
update test_table set description = 'rd22' where id = 100;
update test_table set description = 'rd22' where id = 101;
update test_table set description = 'rd22' where id = 102;
update test_table set description = 'rd22' where id = 103;
update test_table set description = 'rd22' where id = 104;
update test_table set description = 'rd22' where id = 105;
update test_table set description = 'rd22' where id = 106;
update test_table set description = 'rd22' where id = 107;
update test_table set description = 'rd22' where id = 108;
update test_table set description = 'rd22' where id = 109;
update test_table set description = 'rd22' where id = 110;
update test_table set description = 'rd22' where id = 111;
update test_table set description = 'rd22' where id = 112;
update test_table set description = 'rd22' where id = 113;
update test_table set description = 'rd22' where id = 114;
update test_table set description = 'rd22' where id = 115;
update test_table set description = 'rd22' where id = 116;
update test_table set description = 'rd22' where id = 117;
update test_table set description = 'rd22' where id = 118;
update test_table set description = 'rd22' where id = 119;
update test_table set description = 'rd22' where id = 120;
update test_table set description = 'rd22' where id = 121;
update test_table set description = 'rd22' where id = 122;
update test_table set description = 'rd22' where id = 123;
update test_table set description = 'rd22' where id = 124;
update test_table set description = 'rd22' where id = 125;
update test_table set description = 'rd22' where id = 126;
update test_table set description = 'rd22' where id = 127;
update test_table set description = 'rd22' where id = 128;
update test_table set description = 'rd22' where id = 129;
update test_table set description = 'rd22' where id = 130;
update test_table set description = 'rd22' where id = 131;
update test_table set description = 'rd22' where id = 132;
update test_table set description = 'rd22' where id = 133;
update test_table set description = 'rd22' where id = 134;
update test_table set description = 'rd22' where id = 135;
update test_table set description = 'rd22' where id = 136;
update test_table set description = 'rd22' where id = 137;
update test_table set description = 'rd22' where id = 138;
update test_table set description = 'rd22' where id = 139;
update test_table set description = 'rd22' where id = 140;
update test_table set description = 'rd22' where id = 141;
update test_table set description = 'rd22' where id = 142;
update test_table set description = 'rd22' where id = 143;
update test_table set description = 'rd22' where id = 144;
update test_table set description = 'rd22' where id = 145;
update test_table set description = 'rd22' where id = 146;
update test_table set description = 'rd22' where id = 147;
update test_table set description = 'rd22' where id = 148;
update test_table set description = 'rd22' where id = 149;
select count(*) from test_table where id >= 100 and id < 200;
count(*)
100
explain select * from test_table where id >= 100 and id < 200;
Query Plan
=========================================
|ID|OPERATOR  |NAME      |EST. ROWS|COST|
-----------------------------------------
|0 |TABLE SCAN|test_table|100      |59  |
=========================================

Outputs & filters: 
-------------------------------------
  0 - output([test_table.id], [test_table.name], [test_table.age], [test_table.description]), filter(nil), 
      access([test_table.id], [test_table.name], [test_table.age], [test_table.description]), partitions(p0)

select count(*) from test_table where age = 44;
count(*)
100
explain select /*+index(test_table index_1)*/ * from test_table where age = 44;
Query Plan
==================================================
|ID|OPERATOR  |NAME               |EST. ROWS|COST|
--------------------------------------------------
|0 |TABLE SCAN|test_table(index_1)|100      |621 |
==================================================

Outputs & filters: 
-------------------------------------
  0 - output([test_table.id], [test_table.name], [test_table.age], [test_table.description]), filter(nil), 
      access([test_table.age], [test_table.id], [test_table.name], [test_table.description]), partitions(p0)

select count(*) from test_table where name = 'name44';
count(*)
100
explain select /*+index(test_table index_2)*/ * from test_table where name = 'name44';
Query Plan
==================================================
|ID|OPERATOR  |NAME               |EST. ROWS|COST|
--------------------------------------------------
|0 |TABLE SCAN|test_table(index_2)|100      |621 |
==================================================

Outputs & filters: 
-------------------------------------
  0 - output([test_table.id], [test_table.name], [test_table.age], [test_table.description]), filter(nil), 
      access([test_table.name], [test_table.id], [test_table.age], [test_table.description]), partitions(p0)

case 6: main table update -> delete estimate cost
delete from test_table where id >= 100 and id < 150;
select count(*) from test_table where id >= 100 and id < 200;
count(*)
50
explain select * from test_table where id >= 100 and id < 200;
Query Plan
=========================================
|ID|OPERATOR  |NAME      |EST. ROWS|COST|
-----------------------------------------
|0 |TABLE SCAN|test_table|50       |48  |
=========================================

Outputs & filters: 
-------------------------------------
  0 - output([test_table.id], [test_table.name], [test_table.age], [test_table.description]), filter(nil), 
      access([test_table.id], [test_table.name], [test_table.age], [test_table.description]), partitions(p0)

select count(*) from test_table where age = 44;
count(*)
50
explain select /*+index(test_table index_1)*/ * from test_table where age = 44;
Query Plan
==================================================
|ID|OPERATOR  |NAME               |EST. ROWS|COST|
--------------------------------------------------
|0 |TABLE SCAN|test_table(index_1)|50       |352 |
==================================================

Outputs & filters: 
-------------------------------------
  0 - output([test_table.id], [test_table.name], [test_table.age], [test_table.description]), filter(nil), 
      access([test_table.age], [test_table.id], [test_table.name], [test_table.description]), partitions(p0)

select count(*) from test_table where name = 'name44';
count(*)
50
explain select /*+index(test_table index_2)*/ * from test_table where name = 'name44';
Query Plan
==================================================
|ID|OPERATOR  |NAME               |EST. ROWS|COST|
--------------------------------------------------
|0 |TABLE SCAN|test_table(index_2)|50       |352 |
==================================================

Outputs & filters: 
-------------------------------------
  0 - output([test_table.id], [test_table.name], [test_table.age], [test_table.description]), filter(nil), 
      access([test_table.name], [test_table.id], [test_table.age], [test_table.description]), partitions(p0)

case 7: main table update -> delete -> insert estimate cost
insert into test_table(id, name, age, description) values (100, 'name44', 44, 'rd2');
insert into test_table(id, name, age, description) values (101, 'name44', 44, 'rd2');
insert into test_table(id, name, age, description) values (102, 'name44', 44, 'rd2');
insert into test_table(id, name, age, description) values (103, 'name44', 44, 'rd2');
insert into test_table(id, name, age, description) values (104, 'name44', 44, 'rd2');
insert into test_table(id, name, age, description) values (105, 'name44', 44, 'rd2');
insert into test_table(id, name, age, description) values (106, 'name44', 44, 'rd2');
insert into test_table(id, name, age, description) values (107, 'name44', 44, 'rd2');
insert into test_table(id, name, age, description) values (108, 'name44', 44, 'rd2');
insert into test_table(id, name, age, description) values (109, 'name44', 44, 'rd2');
insert into test_table(id, name, age, description) values (110, 'name44', 44, 'rd2');
insert into test_table(id, name, age, description) values (111, 'name44', 44, 'rd2');
insert into test_table(id, name, age, description) values (112, 'name44', 44, 'rd2');
insert into test_table(id, name, age, description) values (113, 'name44', 44, 'rd2');
insert into test_table(id, name, age, description) values (114, 'name44', 44, 'rd2');
insert into test_table(id, name, age, description) values (115, 'name44', 44, 'rd2');
insert into test_table(id, name, age, description) values (116, 'name44', 44, 'rd2');
insert into test_table(id, name, age, description) values (117, 'name44', 44, 'rd2');
insert into test_table(id, name, age, description) values (118, 'name44', 44, 'rd2');
insert into test_table(id, name, age, description) values (119, 'name44', 44, 'rd2');
insert into test_table(id, name, age, description) values (120, 'name44', 44, 'rd2');
insert into test_table(id, name, age, description) values (121, 'name44', 44, 'rd2');
insert into test_table(id, name, age, description) values (122, 'name44', 44, 'rd2');
insert into test_table(id, name, age, description) values (123, 'name44', 44, 'rd2');
insert into test_table(id, name, age, description) values (124, 'name44', 44, 'rd2');
insert into test_table(id, name, age, description) values (125, 'name44', 44, 'rd2');
insert into test_table(id, name, age, description) values (126, 'name44', 44, 'rd2');
insert into test_table(id, name, age, description) values (127, 'name44', 44, 'rd2');
insert into test_table(id, name, age, description) values (128, 'name44', 44, 'rd2');
insert into test_table(id, name, age, description) values (129, 'name44', 44, 'rd2');
insert into test_table(id, name, age, description) values (130, 'name44', 44, 'rd2');
insert into test_table(id, name, age, description) values (131, 'name44', 44, 'rd2');
insert into test_table(id, name, age, description) values (132, 'name44', 44, 'rd2');
insert into test_table(id, name, age, description) values (133, 'name44', 44, 'rd2');
insert into test_table(id, name, age, description) values (134, 'name44', 44, 'rd2');
insert into test_table(id, name, age, description) values (135, 'name44', 44, 'rd2');
insert into test_table(id, name, age, description) values (136, 'name44', 44, 'rd2');
insert into test_table(id, name, age, description) values (137, 'name44', 44, 'rd2');
insert into test_table(id, name, age, description) values (138, 'name44', 44, 'rd2');
insert into test_table(id, name, age, description) values (139, 'name44', 44, 'rd2');
insert into test_table(id, name, age, description) values (140, 'name44', 44, 'rd2');
insert into test_table(id, name, age, description) values (141, 'name44', 44, 'rd2');
insert into test_table(id, name, age, description) values (142, 'name44', 44, 'rd2');
insert into test_table(id, name, age, description) values (143, 'name44', 44, 'rd2');
insert into test_table(id, name, age, description) values (144, 'name44', 44, 'rd2');
insert into test_table(id, name, age, description) values (145, 'name44', 44, 'rd2');
insert into test_table(id, name, age, description) values (146, 'name44', 44, 'rd2');
insert into test_table(id, name, age, description) values (147, 'name44', 44, 'rd2');
insert into test_table(id, name, age, description) values (148, 'name44', 44, 'rd2');
insert into test_table(id, name, age, description) values (149, 'name44', 44, 'rd2');
select count(*) from test_table where id >= 100 and id < 200;
count(*)
100
explain select * from test_table where id >= 100 and id < 200;
Query Plan
=========================================
|ID|OPERATOR  |NAME      |EST. ROWS|COST|
-----------------------------------------
|0 |TABLE SCAN|test_table|100      |59  |
=========================================

Outputs & filters: 
-------------------------------------
  0 - output([test_table.id], [test_table.name], [test_table.age], [test_table.description]), filter(nil), 
      access([test_table.id], [test_table.name], [test_table.age], [test_table.description]), partitions(p0)

select count(*) from test_table where age = 44;
count(*)
100
explain select /*+index(test_table index_1)*/ * from test_table where age = 44;
Query Plan
==================================================
|ID|OPERATOR  |NAME               |EST. ROWS|COST|
--------------------------------------------------
|0 |TABLE SCAN|test_table(index_1)|100      |621 |
==================================================

Outputs & filters: 
-------------------------------------
  0 - output([test_table.id], [test_table.name], [test_table.age], [test_table.description]), filter(nil), 
      access([test_table.age], [test_table.id], [test_table.name], [test_table.description]), partitions(p0)

select count(*) from test_table where name = 'name44';
count(*)
100
explain select /*+index(test_table index_2)*/ * from test_table where name = 'name44';
Query Plan
==================================================
|ID|OPERATOR  |NAME               |EST. ROWS|COST|
--------------------------------------------------
|0 |TABLE SCAN|test_table(index_2)|100      |621 |
==================================================

Outputs & filters: 
-------------------------------------
  0 - output([test_table.id], [test_table.name], [test_table.age], [test_table.description]), filter(nil), 
      access([test_table.name], [test_table.id], [test_table.age], [test_table.description]), partitions(p0)

case 8: index update estimate cost
update test_table set name = 'name55', age = 55 where id = 200;
update test_table set name = 'name55', age = 55 where id = 201;
update test_table set name = 'name55', age = 55 where id = 202;
update test_table set name = 'name55', age = 55 where id = 203;
update test_table set name = 'name55', age = 55 where id = 204;
update test_table set name = 'name55', age = 55 where id = 205;
update test_table set name = 'name55', age = 55 where id = 206;
update test_table set name = 'name55', age = 55 where id = 207;
update test_table set name = 'name55', age = 55 where id = 208;
update test_table set name = 'name55', age = 55 where id = 209;
update test_table set name = 'name55', age = 55 where id = 210;
update test_table set name = 'name55', age = 55 where id = 211;
update test_table set name = 'name55', age = 55 where id = 212;
update test_table set name = 'name55', age = 55 where id = 213;
update test_table set name = 'name55', age = 55 where id = 214;
update test_table set name = 'name55', age = 55 where id = 215;
update test_table set name = 'name55', age = 55 where id = 216;
update test_table set name = 'name55', age = 55 where id = 217;
update test_table set name = 'name55', age = 55 where id = 218;
update test_table set name = 'name55', age = 55 where id = 219;
update test_table set name = 'name55', age = 55 where id = 220;
update test_table set name = 'name55', age = 55 where id = 221;
update test_table set name = 'name55', age = 55 where id = 222;
update test_table set name = 'name55', age = 55 where id = 223;
update test_table set name = 'name55', age = 55 where id = 224;
update test_table set name = 'name55', age = 55 where id = 225;
update test_table set name = 'name55', age = 55 where id = 226;
update test_table set name = 'name55', age = 55 where id = 227;
update test_table set name = 'name55', age = 55 where id = 228;
update test_table set name = 'name55', age = 55 where id = 229;
update test_table set name = 'name55', age = 55 where id = 230;
update test_table set name = 'name55', age = 55 where id = 231;
update test_table set name = 'name55', age = 55 where id = 232;
update test_table set name = 'name55', age = 55 where id = 233;
update test_table set name = 'name55', age = 55 where id = 234;
update test_table set name = 'name55', age = 55 where id = 235;
update test_table set name = 'name55', age = 55 where id = 236;
update test_table set name = 'name55', age = 55 where id = 237;
update test_table set name = 'name55', age = 55 where id = 238;
update test_table set name = 'name55', age = 55 where id = 239;
update test_table set name = 'name55', age = 55 where id = 240;
update test_table set name = 'name55', age = 55 where id = 241;
update test_table set name = 'name55', age = 55 where id = 242;
update test_table set name = 'name55', age = 55 where id = 243;
update test_table set name = 'name55', age = 55 where id = 244;
update test_table set name = 'name55', age = 55 where id = 245;
update test_table set name = 'name55', age = 55 where id = 246;
update test_table set name = 'name55', age = 55 where id = 247;
update test_table set name = 'name55', age = 55 where id = 248;
update test_table set name = 'name55', age = 55 where id = 249;
select count(*) from test_table where id >= 200;
count(*)
100
explain select * from test_table where id >= 200;
Query Plan
=========================================
|ID|OPERATOR  |NAME      |EST. ROWS|COST|
-----------------------------------------
|0 |TABLE SCAN|test_table|100      |59  |
=========================================

Outputs & filters: 
-------------------------------------
  0 - output([test_table.id], [test_table.name], [test_table.age], [test_table.description]), filter(nil), 
      access([test_table.id], [test_table.name], [test_table.age], [test_table.description]), partitions(p0)

select count(*) from test_table where age = 22;
count(*)
50
explain select /*+index(test_table index_1)*/ * from test_table where age = 22;
Query Plan
==================================================
|ID|OPERATOR  |NAME               |EST. ROWS|COST|
--------------------------------------------------
|0 |TABLE SCAN|test_table(index_1)|50       |352 |
==================================================

Outputs & filters: 
-------------------------------------
  0 - output([test_table.id], [test_table.name], [test_table.age], [test_table.description]), filter(nil), 
      access([test_table.age], [test_table.id], [test_table.name], [test_table.description]), partitions(p0)

select count(*) from test_table where name = 'name22';
count(*)
50
explain select /*+index(test_table index_2)*/ * from test_table where name = 'name22';
Query Plan
==================================================
|ID|OPERATOR  |NAME               |EST. ROWS|COST|
--------------------------------------------------
|0 |TABLE SCAN|test_table(index_2)|50       |352 |
==================================================

Outputs & filters: 
-------------------------------------
  0 - output([test_table.id], [test_table.name], [test_table.age], [test_table.description]), filter(nil), 
      access([test_table.name], [test_table.id], [test_table.age], [test_table.description]), partitions(p0)

case 9: index update ->update back estimate cost
update test_table set name = 'name22', age = 22 where id = 200;
update test_table set name = 'name22', age = 22 where id = 201;
update test_table set name = 'name22', age = 22 where id = 202;
update test_table set name = 'name22', age = 22 where id = 203;
update test_table set name = 'name22', age = 22 where id = 204;
update test_table set name = 'name22', age = 22 where id = 205;
update test_table set name = 'name22', age = 22 where id = 206;
update test_table set name = 'name22', age = 22 where id = 207;
update test_table set name = 'name22', age = 22 where id = 208;
update test_table set name = 'name22', age = 22 where id = 209;
update test_table set name = 'name22', age = 22 where id = 210;
update test_table set name = 'name22', age = 22 where id = 211;
update test_table set name = 'name22', age = 22 where id = 212;
update test_table set name = 'name22', age = 22 where id = 213;
update test_table set name = 'name22', age = 22 where id = 214;
update test_table set name = 'name22', age = 22 where id = 215;
update test_table set name = 'name22', age = 22 where id = 216;
update test_table set name = 'name22', age = 22 where id = 217;
update test_table set name = 'name22', age = 22 where id = 218;
update test_table set name = 'name22', age = 22 where id = 219;
update test_table set name = 'name22', age = 22 where id = 220;
update test_table set name = 'name22', age = 22 where id = 221;
update test_table set name = 'name22', age = 22 where id = 222;
update test_table set name = 'name22', age = 22 where id = 223;
update test_table set name = 'name22', age = 22 where id = 224;
update test_table set name = 'name22', age = 22 where id = 225;
update test_table set name = 'name22', age = 22 where id = 226;
update test_table set name = 'name22', age = 22 where id = 227;
update test_table set name = 'name22', age = 22 where id = 228;
update test_table set name = 'name22', age = 22 where id = 229;
update test_table set name = 'name22', age = 22 where id = 230;
update test_table set name = 'name22', age = 22 where id = 231;
update test_table set name = 'name22', age = 22 where id = 232;
update test_table set name = 'name22', age = 22 where id = 233;
update test_table set name = 'name22', age = 22 where id = 234;
update test_table set name = 'name22', age = 22 where id = 235;
update test_table set name = 'name22', age = 22 where id = 236;
update test_table set name = 'name22', age = 22 where id = 237;
update test_table set name = 'name22', age = 22 where id = 238;
update test_table set name = 'name22', age = 22 where id = 239;
update test_table set name = 'name22', age = 22 where id = 240;
update test_table set name = 'name22', age = 22 where id = 241;
update test_table set name = 'name22', age = 22 where id = 242;
update test_table set name = 'name22', age = 22 where id = 243;
update test_table set name = 'name22', age = 22 where id = 244;
update test_table set name = 'name22', age = 22 where id = 245;
update test_table set name = 'name22', age = 22 where id = 246;
update test_table set name = 'name22', age = 22 where id = 247;
update test_table set name = 'name22', age = 22 where id = 248;
update test_table set name = 'name22', age = 22 where id = 249;
select count(*) from test_table where id >= 200;
count(*)
100
explain select * from test_table where id >= 200;
Query Plan
=========================================
|ID|OPERATOR  |NAME      |EST. ROWS|COST|
-----------------------------------------
|0 |TABLE SCAN|test_table|100      |59  |
=========================================

Outputs & filters: 
-------------------------------------
  0 - output([test_table.id], [test_table.name], [test_table.age], [test_table.description]), filter(nil), 
      access([test_table.id], [test_table.name], [test_table.age], [test_table.description]), partitions(p0)

select count(*) from test_table where age = 22;
count(*)
100
explain select /*+index(test_table index_1)*/ * from test_table where age = 22;
Query Plan
==================================================
|ID|OPERATOR  |NAME               |EST. ROWS|COST|
--------------------------------------------------
|0 |TABLE SCAN|test_table(index_1)|100      |621 |
==================================================

Outputs & filters: 
-------------------------------------
  0 - output([test_table.id], [test_table.name], [test_table.age], [test_table.description]), filter(nil), 
      access([test_table.age], [test_table.id], [test_table.name], [test_table.description]), partitions(p0)

select count(*) from test_table where name = 'name22';
count(*)
100
explain select /*+index(test_table index_2)*/ * from test_table where name = 'name22';
Query Plan
==================================================
|ID|OPERATOR  |NAME               |EST. ROWS|COST|
--------------------------------------------------
|0 |TABLE SCAN|test_table(index_2)|100      |621 |
==================================================

Outputs & filters: 
-------------------------------------
  0 - output([test_table.id], [test_table.name], [test_table.age], [test_table.description]), filter(nil), 
      access([test_table.name], [test_table.id], [test_table.age], [test_table.description]), partitions(p0)

case 10: main table insert estimate cost
insert into test_table(id, name, age, description) values (300, 'name22', 22, 'rd3');
insert into test_table(id, name, age, description) values (301, 'name22', 22, 'rd3');
insert into test_table(id, name, age, description) values (302, 'name22', 22, 'rd3');
insert into test_table(id, name, age, description) values (303, 'name22', 22, 'rd3');
insert into test_table(id, name, age, description) values (304, 'name22', 22, 'rd3');
insert into test_table(id, name, age, description) values (305, 'name22', 22, 'rd3');
insert into test_table(id, name, age, description) values (306, 'name22', 22, 'rd3');
insert into test_table(id, name, age, description) values (307, 'name22', 22, 'rd3');
insert into test_table(id, name, age, description) values (308, 'name22', 22, 'rd3');
insert into test_table(id, name, age, description) values (309, 'name22', 22, 'rd3');
insert into test_table(id, name, age, description) values (310, 'name22', 22, 'rd3');
insert into test_table(id, name, age, description) values (311, 'name22', 22, 'rd3');
insert into test_table(id, name, age, description) values (312, 'name22', 22, 'rd3');
insert into test_table(id, name, age, description) values (313, 'name22', 22, 'rd3');
insert into test_table(id, name, age, description) values (314, 'name22', 22, 'rd3');
insert into test_table(id, name, age, description) values (315, 'name22', 22, 'rd3');
insert into test_table(id, name, age, description) values (316, 'name22', 22, 'rd3');
insert into test_table(id, name, age, description) values (317, 'name22', 22, 'rd3');
insert into test_table(id, name, age, description) values (318, 'name22', 22, 'rd3');
insert into test_table(id, name, age, description) values (319, 'name22', 22, 'rd3');
insert into test_table(id, name, age, description) values (320, 'name22', 22, 'rd3');
insert into test_table(id, name, age, description) values (321, 'name22', 22, 'rd3');
insert into test_table(id, name, age, description) values (322, 'name22', 22, 'rd3');
insert into test_table(id, name, age, description) values (323, 'name22', 22, 'rd3');
insert into test_table(id, name, age, description) values (324, 'name22', 22, 'rd3');
insert into test_table(id, name, age, description) values (325, 'name22', 22, 'rd3');
insert into test_table(id, name, age, description) values (326, 'name22', 22, 'rd3');
insert into test_table(id, name, age, description) values (327, 'name22', 22, 'rd3');
insert into test_table(id, name, age, description) values (328, 'name22', 22, 'rd3');
insert into test_table(id, name, age, description) values (329, 'name22', 22, 'rd3');
insert into test_table(id, name, age, description) values (330, 'name22', 22, 'rd3');
insert into test_table(id, name, age, description) values (331, 'name22', 22, 'rd3');
insert into test_table(id, name, age, description) values (332, 'name22', 22, 'rd3');
insert into test_table(id, name, age, description) values (333, 'name22', 22, 'rd3');
insert into test_table(id, name, age, description) values (334, 'name22', 22, 'rd3');
insert into test_table(id, name, age, description) values (335, 'name22', 22, 'rd3');
insert into test_table(id, name, age, description) values (336, 'name22', 22, 'rd3');
insert into test_table(id, name, age, description) values (337, 'name22', 22, 'rd3');
insert into test_table(id, name, age, description) values (338, 'name22', 22, 'rd3');
insert into test_table(id, name, age, description) values (339, 'name22', 22, 'rd3');
insert into test_table(id, name, age, description) values (340, 'name22', 22, 'rd3');
insert into test_table(id, name, age, description) values (341, 'name22', 22, 'rd3');
insert into test_table(id, name, age, description) values (342, 'name22', 22, 'rd3');
insert into test_table(id, name, age, description) values (343, 'name22', 22, 'rd3');
insert into test_table(id, name, age, description) values (344, 'name22', 22, 'rd3');
insert into test_table(id, name, age, description) values (345, 'name22', 22, 'rd3');
insert into test_table(id, name, age, description) values (346, 'name22', 22, 'rd3');
insert into test_table(id, name, age, description) values (347, 'name22', 22, 'rd3');
insert into test_table(id, name, age, description) values (348, 'name22', 22, 'rd3');
insert into test_table(id, name, age, description) values (349, 'name22', 22, 'rd3');
insert into test_table(id, name, age, description) values (350, 'name22', 22, 'rd3');
insert into test_table(id, name, age, description) values (351, 'name22', 22, 'rd3');
insert into test_table(id, name, age, description) values (352, 'name22', 22, 'rd3');
insert into test_table(id, name, age, description) values (353, 'name22', 22, 'rd3');
insert into test_table(id, name, age, description) values (354, 'name22', 22, 'rd3');
insert into test_table(id, name, age, description) values (355, 'name22', 22, 'rd3');
insert into test_table(id, name, age, description) values (356, 'name22', 22, 'rd3');
insert into test_table(id, name, age, description) values (357, 'name22', 22, 'rd3');
insert into test_table(id, name, age, description) values (358, 'name22', 22, 'rd3');
insert into test_table(id, name, age, description) values (359, 'name22', 22, 'rd3');
insert into test_table(id, name, age, description) values (360, 'name22', 22, 'rd3');
insert into test_table(id, name, age, description) values (361, 'name22', 22, 'rd3');
insert into test_table(id, name, age, description) values (362, 'name22', 22, 'rd3');
insert into test_table(id, name, age, description) values (363, 'name22', 22, 'rd3');
insert into test_table(id, name, age, description) values (364, 'name22', 22, 'rd3');
insert into test_table(id, name, age, description) values (365, 'name22', 22, 'rd3');
insert into test_table(id, name, age, description) values (366, 'name22', 22, 'rd3');
insert into test_table(id, name, age, description) values (367, 'name22', 22, 'rd3');
insert into test_table(id, name, age, description) values (368, 'name22', 22, 'rd3');
insert into test_table(id, name, age, description) values (369, 'name22', 22, 'rd3');
insert into test_table(id, name, age, description) values (370, 'name22', 22, 'rd3');
insert into test_table(id, name, age, description) values (371, 'name22', 22, 'rd3');
insert into test_table(id, name, age, description) values (372, 'name22', 22, 'rd3');
insert into test_table(id, name, age, description) values (373, 'name22', 22, 'rd3');
insert into test_table(id, name, age, description) values (374, 'name22', 22, 'rd3');
insert into test_table(id, name, age, description) values (375, 'name22', 22, 'rd3');
insert into test_table(id, name, age, description) values (376, 'name22', 22, 'rd3');
insert into test_table(id, name, age, description) values (377, 'name22', 22, 'rd3');
insert into test_table(id, name, age, description) values (378, 'name22', 22, 'rd3');
insert into test_table(id, name, age, description) values (379, 'name22', 22, 'rd3');
insert into test_table(id, name, age, description) values (380, 'name22', 22, 'rd3');
insert into test_table(id, name, age, description) values (381, 'name22', 22, 'rd3');
insert into test_table(id, name, age, description) values (382, 'name22', 22, 'rd3');
insert into test_table(id, name, age, description) values (383, 'name22', 22, 'rd3');
insert into test_table(id, name, age, description) values (384, 'name22', 22, 'rd3');
insert into test_table(id, name, age, description) values (385, 'name22', 22, 'rd3');
insert into test_table(id, name, age, description) values (386, 'name22', 22, 'rd3');
insert into test_table(id, name, age, description) values (387, 'name22', 22, 'rd3');
insert into test_table(id, name, age, description) values (388, 'name22', 22, 'rd3');
insert into test_table(id, name, age, description) values (389, 'name22', 22, 'rd3');
insert into test_table(id, name, age, description) values (390, 'name22', 22, 'rd3');
insert into test_table(id, name, age, description) values (391, 'name22', 22, 'rd3');
insert into test_table(id, name, age, description) values (392, 'name22', 22, 'rd3');
insert into test_table(id, name, age, description) values (393, 'name22', 22, 'rd3');
insert into test_table(id, name, age, description) values (394, 'name22', 22, 'rd3');
insert into test_table(id, name, age, description) values (395, 'name22', 22, 'rd3');
insert into test_table(id, name, age, description) values (396, 'name22', 22, 'rd3');
insert into test_table(id, name, age, description) values (397, 'name22', 22, 'rd3');
insert into test_table(id, name, age, description) values (398, 'name22', 22, 'rd3');
insert into test_table(id, name, age, description) values (399, 'name22', 22, 'rd3');
select count(*) from test_table where id >= 200;
count(*)
200
explain select * from test_table where id >= 200;
Query Plan
=========================================
|ID|OPERATOR  |NAME      |EST. ROWS|COST|
-----------------------------------------
|0 |TABLE SCAN|test_table|200      |81  |
=========================================

Outputs & filters: 
-------------------------------------
  0 - output([test_table.id], [test_table.name], [test_table.age], [test_table.description]), filter(nil), 
      access([test_table.id], [test_table.name], [test_table.age], [test_table.description]), partitions(p0)

select count(*) from test_table where age = 22;
count(*)
200
explain select /*+index(test_table index_1)*/ * from test_table where age = 22;
Query Plan
==================================================
|ID|OPERATOR  |NAME               |EST. ROWS|COST|
--------------------------------------------------
|0 |TABLE SCAN|test_table(index_1)|200      |1159|
==================================================

Outputs & filters: 
-------------------------------------
  0 - output([test_table.id], [test_table.name], [test_table.age], [test_table.description]), filter(nil), 
      access([test_table.age], [test_table.id], [test_table.name], [test_table.description]), partitions(p0)

select count(*) from test_table where name = 'name22';
count(*)
200
explain select /*+index(test_table index_2)*/ * from test_table where name = 'name22';
Query Plan
==================================================
|ID|OPERATOR  |NAME               |EST. ROWS|COST|
--------------------------------------------------
|0 |TABLE SCAN|test_table(index_2)|200      |1159|
==================================================

Outputs & filters: 
-------------------------------------
  0 - output([test_table.id], [test_table.name], [test_table.age], [test_table.description]), filter(nil), 
      access([test_table.name], [test_table.id], [test_table.age], [test_table.description]), partitions(p0)

case 11: main table insert ->update estimate cost
update test_table set description = 'rd33' where id = 300;
update test_table set description = 'rd33' where id = 301;
update test_table set description = 'rd33' where id = 302;
update test_table set description = 'rd33' where id = 303;
update test_table set description = 'rd33' where id = 304;
update test_table set description = 'rd33' where id = 305;
update test_table set description = 'rd33' where id = 306;
update test_table set description = 'rd33' where id = 307;
update test_table set description = 'rd33' where id = 308;
update test_table set description = 'rd33' where id = 309;
update test_table set description = 'rd33' where id = 310;
update test_table set description = 'rd33' where id = 311;
update test_table set description = 'rd33' where id = 312;
update test_table set description = 'rd33' where id = 313;
update test_table set description = 'rd33' where id = 314;
update test_table set description = 'rd33' where id = 315;
update test_table set description = 'rd33' where id = 316;
update test_table set description = 'rd33' where id = 317;
update test_table set description = 'rd33' where id = 318;
update test_table set description = 'rd33' where id = 319;
update test_table set description = 'rd33' where id = 320;
update test_table set description = 'rd33' where id = 321;
update test_table set description = 'rd33' where id = 322;
update test_table set description = 'rd33' where id = 323;
update test_table set description = 'rd33' where id = 324;
update test_table set description = 'rd33' where id = 325;
update test_table set description = 'rd33' where id = 326;
update test_table set description = 'rd33' where id = 327;
update test_table set description = 'rd33' where id = 328;
update test_table set description = 'rd33' where id = 329;
update test_table set description = 'rd33' where id = 330;
update test_table set description = 'rd33' where id = 331;
update test_table set description = 'rd33' where id = 332;
update test_table set description = 'rd33' where id = 333;
update test_table set description = 'rd33' where id = 334;
update test_table set description = 'rd33' where id = 335;
update test_table set description = 'rd33' where id = 336;
update test_table set description = 'rd33' where id = 337;
update test_table set description = 'rd33' where id = 338;
update test_table set description = 'rd33' where id = 339;
update test_table set description = 'rd33' where id = 340;
update test_table set description = 'rd33' where id = 341;
update test_table set description = 'rd33' where id = 342;
update test_table set description = 'rd33' where id = 343;
update test_table set description = 'rd33' where id = 344;
update test_table set description = 'rd33' where id = 345;
update test_table set description = 'rd33' where id = 346;
update test_table set description = 'rd33' where id = 347;
update test_table set description = 'rd33' where id = 348;
update test_table set description = 'rd33' where id = 349;
update test_table set description = 'rd33' where id = 350;
update test_table set description = 'rd33' where id = 351;
update test_table set description = 'rd33' where id = 352;
update test_table set description = 'rd33' where id = 353;
update test_table set description = 'rd33' where id = 354;
update test_table set description = 'rd33' where id = 355;
update test_table set description = 'rd33' where id = 356;
update test_table set description = 'rd33' where id = 357;
update test_table set description = 'rd33' where id = 358;
update test_table set description = 'rd33' where id = 359;
update test_table set description = 'rd33' where id = 360;
update test_table set description = 'rd33' where id = 361;
update test_table set description = 'rd33' where id = 362;
update test_table set description = 'rd33' where id = 363;
update test_table set description = 'rd33' where id = 364;
update test_table set description = 'rd33' where id = 365;
update test_table set description = 'rd33' where id = 366;
update test_table set description = 'rd33' where id = 367;
update test_table set description = 'rd33' where id = 368;
update test_table set description = 'rd33' where id = 369;
update test_table set description = 'rd33' where id = 370;
update test_table set description = 'rd33' where id = 371;
update test_table set description = 'rd33' where id = 372;
update test_table set description = 'rd33' where id = 373;
update test_table set description = 'rd33' where id = 374;
update test_table set description = 'rd33' where id = 375;
update test_table set description = 'rd33' where id = 376;
update test_table set description = 'rd33' where id = 377;
update test_table set description = 'rd33' where id = 378;
update test_table set description = 'rd33' where id = 379;
update test_table set description = 'rd33' where id = 380;
update test_table set description = 'rd33' where id = 381;
update test_table set description = 'rd33' where id = 382;
update test_table set description = 'rd33' where id = 383;
update test_table set description = 'rd33' where id = 384;
update test_table set description = 'rd33' where id = 385;
update test_table set description = 'rd33' where id = 386;
update test_table set description = 'rd33' where id = 387;
update test_table set description = 'rd33' where id = 388;
update test_table set description = 'rd33' where id = 389;
update test_table set description = 'rd33' where id = 390;
update test_table set description = 'rd33' where id = 391;
update test_table set description = 'rd33' where id = 392;
update test_table set description = 'rd33' where id = 393;
update test_table set description = 'rd33' where id = 394;
update test_table set description = 'rd33' where id = 395;
update test_table set description = 'rd33' where id = 396;
update test_table set description = 'rd33' where id = 397;
update test_table set description = 'rd33' where id = 398;
update test_table set description = 'rd33' where id = 399;
select count(*) from test_table where id >= 200;
count(*)
200
explain select * from test_table where id >= 200;
Query Plan
=========================================
|ID|OPERATOR  |NAME      |EST. ROWS|COST|
-----------------------------------------
|0 |TABLE SCAN|test_table|200      |81  |
=========================================

Outputs & filters: 
-------------------------------------
  0 - output([test_table.id], [test_table.name], [test_table.age], [test_table.description]), filter(nil), 
      access([test_table.id], [test_table.name], [test_table.age], [test_table.description]), partitions(p0)

select count(*) from test_table where age = 22;
count(*)
200
explain select /*+index(test_table index_1)*/ * from test_table where age = 22;
Query Plan
==================================================
|ID|OPERATOR  |NAME               |EST. ROWS|COST|
--------------------------------------------------
|0 |TABLE SCAN|test_table(index_1)|200      |1159|
==================================================

Outputs & filters: 
-------------------------------------
  0 - output([test_table.id], [test_table.name], [test_table.age], [test_table.description]), filter(nil), 
      access([test_table.age], [test_table.id], [test_table.name], [test_table.description]), partitions(p0)

select count(*) from test_table where name = 'name22';
count(*)
200
explain select /*+index(test_table index_2)*/ * from test_table where name = 'name22';
Query Plan
==================================================
|ID|OPERATOR  |NAME               |EST. ROWS|COST|
--------------------------------------------------
|0 |TABLE SCAN|test_table(index_2)|200      |1159|
==================================================

Outputs & filters: 
-------------------------------------
  0 - output([test_table.id], [test_table.name], [test_table.age], [test_table.description]), filter(nil), 
      access([test_table.name], [test_table.id], [test_table.age], [test_table.description]), partitions(p0)

case 12: main table insert ->update -> delete estimate cost
delete from test_table where id >= 300 and id < 400;
select count(*) from test_table where id >= 200;
count(*)
100
explain select * from test_table where id >= 200;
Query Plan
=========================================
|ID|OPERATOR  |NAME      |EST. ROWS|COST|
-----------------------------------------
|0 |TABLE SCAN|test_table|100      |59  |
=========================================

Outputs & filters: 
-------------------------------------
  0 - output([test_table.id], [test_table.name], [test_table.age], [test_table.description]), filter(nil), 
      access([test_table.id], [test_table.name], [test_table.age], [test_table.description]), partitions(p0)

select count(*) from test_table where age = 22;
count(*)
100
explain select /*+index(test_table index_1)*/ * from test_table where age = 22;
Query Plan
==================================================
|ID|OPERATOR  |NAME               |EST. ROWS|COST|
--------------------------------------------------
|0 |TABLE SCAN|test_table(index_1)|100      |621 |
==================================================

Outputs & filters: 
-------------------------------------
  0 - output([test_table.id], [test_table.name], [test_table.age], [test_table.description]), filter(nil), 
      access([test_table.age], [test_table.id], [test_table.name], [test_table.description]), partitions(p0)

select count(*) from test_table where name = 'name22';
count(*)
100
explain select /*+index(test_table index_2)*/ * from test_table where name = 'name22';
Query Plan
==================================================
|ID|OPERATOR  |NAME               |EST. ROWS|COST|
--------------------------------------------------
|0 |TABLE SCAN|test_table(index_2)|100      |621 |
==================================================

Outputs & filters: 
-------------------------------------
  0 - output([test_table.id], [test_table.name], [test_table.age], [test_table.description]), filter(nil), 
      access([test_table.name], [test_table.id], [test_table.age], [test_table.description]), partitions(p0)

case 13: main table insert extra 10000 row estimate cost
select count(*) from test_table where id >= 400;
count(*)
10000
explain select * from test_table where id >= 400;
Query Plan
=========================================
|ID|OPERATOR  |NAME      |EST. ROWS|COST|
-----------------------------------------
|0 |TABLE SCAN|test_table|12512    |2939|
=========================================

Outputs & filters: 
-------------------------------------
  0 - output([test_table.id], [test_table.name], [test_table.age], [test_table.description]), filter(nil), 
      access([test_table.id], [test_table.name], [test_table.age], [test_table.description]), partitions(p0)

select count(*) from test_table where age = 66;
count(*)
10000
explain select /*+index(test_table index_1)*/ * from test_table where age = 66;
Query Plan
===================================================
|ID|OPERATOR  |NAME               |EST. ROWS|COST |
---------------------------------------------------
|0 |TABLE SCAN|test_table(index_1)|12511    |67494|
===================================================

Outputs & filters: 
-------------------------------------
  0 - output([test_table.id], [test_table.name], [test_table.age], [test_table.description]), filter(nil), 
      access([test_table.age], [test_table.id], [test_table.name], [test_table.description]), partitions(p0)

select count(*) from test_table where name = 'name66';
count(*)
10000
explain select /*+index(test_table index_2)*/ * from test_table where name = 'name66';
Query Plan
===================================================
|ID|OPERATOR  |NAME               |EST. ROWS|COST |
---------------------------------------------------
|0 |TABLE SCAN|test_table(index_2)|10000    |53899|
===================================================

Outputs & filters: 
-------------------------------------
  0 - output([test_table.id], [test_table.name], [test_table.age], [test_table.description]), filter(nil), 
      access([test_table.name], [test_table.id], [test_table.age], [test_table.description]), partitions(p0)

drop table test_table;
