drop table if exists t1, t2;
create table t1(pk int primary key, c1 int, c2 int default 0) EXPIRE_INFO ( pk < 10,enable_transaction_expire=true);
create table t2(pk int primary key, c1 int, c2 timestamp default now()) EXPIRE_INFO ( pk < 10,enable_transaction_expire=true);
replace into t1(pk,c1) values(0,0);
replace into t2(pk,c1) values(0,0);
alter system major freeze tenant = sys;
alter system major freeze tenant = all_user;
alter system major freeze tenant = all_meta;
update t1 set c1=10 where pk = 0;
update t2 set c1=10 where pk = 0;
select pk, c1, c2 from t1 where pk=0;
pk	c1	c2
0	10	0
select pk, c1, c2 from t2 where pk=0;
pk	c1	c2
0	10	createtime
select pk, c1, c2 from t1 where pk=0;
pk	c1	c2
select pk, c1, c2 from t2 where pk=0;
pk	c1	c2
create index idx1 on t1(c1);
replace into t1(pk,c1) values(1,1);
replace into t2(pk,c1) values(1,1);
alter system major freeze tenant = sys;
alter system major freeze tenant = all_user;
alter system major freeze tenant = all_meta;
update t1 set c1=11 where pk = 1;
update t2 set c1=11 where pk = 1;
select pk, c1, c2 from t1 where pk=1;
pk	c1	c2
1	11	0
select pk, c1, c2 from t2 where pk=1;
pk	c1	c2
1	11	createtime
select pk, c1, c2 from t1 where pk=1;
pk	c1	c2
drop index idx1 on t1;
create unique index idx1 on t1(c1);
replace into t1(pk,c1) values(3,3);
replace into t2(pk,c1) values(3,3);
alter system major freeze tenant = sys;
alter system major freeze tenant = all_user;
alter system major freeze tenant = all_meta;
update t1 set c1=11 where pk = 3;
update t2 set c1=11 where pk = 3;
select pk, c1, c2 from t1 where pk=3;
pk	c1	c2
3	11	0
select pk, c1, c2 from t2 where pk=3;
pk	c1	c2
3	11	createtime
alter system major freeze tenant = sys;
alter system major freeze tenant = all_user;
alter system major freeze tenant = all_meta;
update t1 set c1=13 where pk = 3;
update t2 set c1=13 where pk = 3;
select pk, c1, c2 from t1 where pk=3;
pk	c1	c2
select pk, c1, c2 from t2 where pk=3;
pk	c1	c2
alter system major freeze tenant = sys;
alter system major freeze tenant = all_user;
alter system major freeze tenant = all_meta;
update t1 set c1=14 where pk = 3;
update t2 set c1=14 where pk = 3;
select pk, c1, c2 from t1 where pk=3;
pk	c1	c2
select pk, c1, c2 from t2 where pk=3;
pk	c1	c2
