case 8:some expr with merging_frozen_time
drop table if exists t16;
create table t16(c0 int primary key,c1 timestamp) EXPIRE_INFO (c1 < date_add(merging_frozen_time(),interval 30 second),enable_transaction_expire=true);
select merging_frozen_time();
ERROR 42000: MERGING_FROZEN_TIME() system function only be used in daily merging.
insert into t16 values(1, now());
insert into t16 values(2, now());
insert into t16 values(3, now());
insert into t16 values(4, date_add(now(), INTERVAL 5 second ));
insert into t16 values(5, date_add(now(), INTERVAL 6 second ));
alter system major freeze tenant = sys;
alter system major freeze tenant = all_user;
alter system major freeze tenant = all_meta;
select * from t16;
c0	c1
insert into t16 values(7, date_add(now(), INTERVAL 35 second ));
insert into t16 values(8, date_add(now(), INTERVAL 30 second ));
insert into t16 values(9, date_add(now(), INTERVAL 32 second ));
insert into t16 values(10, date_add(now(), INTERVAL 32 DAY ));
insert into t16 values(11, date_add(now(), INTERVAL -32 DAY ));
alter system major freeze tenant = sys;
alter system major freeze tenant = all_user;
alter system major freeze tenant = all_meta;
select * from t16;
c0	c1
7	time
9	time
10	time
alter table t16 set EXPIRE_INFO (c0>1);
insert into t16 values(17, date_add(now(), INTERVAL 35 second ));
insert into t16 values(8, date_add(now(), INTERVAL 30 second ));
insert into t16 values(11, date_add(now(), INTERVAL 32 second ));
insert into t16 values(-9, date_add(now(), INTERVAL 32 second ));
alter system major freeze tenant = sys;
alter system major freeze tenant = all_user;
alter system major freeze tenant = all_meta;
select * from t16;
c0	c1
-9	time
alter table t16 set EXPIRE_INFO (c0<1 or c1 < date_add(merging_frozen_time(),interval -1 HOUR));
show create table t16;
table_name	table_definition
t16	CREATE TABLE t16 (
  c0 INT,
  c1 TIMESTAMP,
  PRIMARY KEY(c0)
) TABLET_MAX_SIZE = 268435456, TABLET_BLOCK_SIZE = 16384, EXPIRE_INFO =( c0<1 or c1 < date_add(merging_frozen_time(),interval -1 HOUR), REPLICA_NUM = 1, DEFAULT CHARSET = 'utf8'
alter table t16 set EXPIRE_INFO (0<1);
ERROR 42000: Expire info must specify column in expression
alter table t16 set EXPIRE_INFO (0<1 or c1 < date_add(merging_frozen_time(),interval -1 HOUR));
alter table t16 set EXPIRE_INFO (c0<1 or  c1 < date_add(merging_frozen_time(),interval -1 HOUR));
show create table t16;
table_name	table_definition
t16	CREATE TABLE t16 (
  c0 INT,
  c1 TIMESTAMP,
  PRIMARY KEY(c0)
) TABLET_MAX_SIZE = 268435456, TABLET_BLOCK_SIZE = 16384, EXPIRE_INFO =( c0<1 or  c1 < date_add(merging_frozen_time(),interval -1 HOUR), REPLICA_NUM = 1, DEFAULT CHARSET = 'utf8'
insert into t16 values(19, date_add(now(), INTERVAL -1 hour ));
insert into t16 values(18, date_add(now(), INTERVAL 1 hour ));
insert into t16 values(-18, date_add(now(), INTERVAL 1 hour ));
alter system major freeze tenant = sys;
alter system major freeze tenant = all_user;
alter system major freeze tenant = all_meta;
select * from t16;
c0	c1
18	time
alter table t16 set EXPIRE_INFO (NULL);
show create table t16;
table_name	table_definition
t16	CREATE TABLE t16 (
  c0 INT,
  c1 TIMESTAMP,
  PRIMARY KEY(c0)
) TABLET_MAX_SIZE = 268435456, TABLET_BLOCK_SIZE = 16384, REPLICA_NUM = 1, DEFAULT CHARSET = 'utf8'
insert into t16 values(28, date_add(now(), INTERVAL 1 hour ));
insert into t16 values(29, date_add(now(), INTERVAL 1 hour ));
alter system major freeze tenant = sys;
alter system major freeze tenant = all_user;
alter system major freeze tenant = all_meta;
select * from t16;
c0	c1
18	time
28	time
29	time
alter table t16 set EXPIRE_INFO ( c1 < date_add(merging_frozen_time(),interval -1 minute));
insert into t16 values(39, date_add(now(), INTERVAL 1 minute ));
insert into t16 values(38, date_add(now(), INTERVAL 1 minute ));
alter system major freeze tenant = sys;
alter system major freeze tenant = all_user;
alter system major freeze tenant = all_meta;
select c0 from t16;
c0
18
28
29
38
39
update t16 set c0 =100 where c0=29;
select c0 from t16;
c0
18
28
38
39
100
alter table t16 set EXPIRE_INFO ( date_add(c1,interval -1 minute)<merging_frozen_time());
insert into t16 values(40, date_add(now(), INTERVAL -2 minute ));
insert into t16 values(41, date_add(now(), INTERVAL -2 minute ));
alter system major freeze tenant = sys;
alter system major freeze tenant = all_user;
alter system major freeze tenant = all_meta;
select c0 from t16;
c0
18
28
100
drop table if exists t17;
create table t17( a int primary key,c16 datetime default now(),c17 datetime default now())EXPIRE_INFO (c17<merging_frozen_time(),enable_transaction_expire=true);
insert into t17(a) values(1),(2),(3),(4),(5),(6);
alter system major freeze tenant = sys;
alter system major freeze tenant = all_user;
alter system major freeze tenant = all_meta;
select * from t17;
a	c16	c17
alter table t17 set EXPIRE_INFO (c17>merging_frozen_time());
insert into t17(a) values(1),(2),(3),(4),(5),(6);
alter system major freeze tenant = sys;
alter system major freeze tenant = all_user;
alter system major freeze tenant = all_meta;
select * from t17;
a	c16	c17
1	time	time
2	time	time
3	time	time
4	time	time
5	time	time
6	time	time
select a from t17;
a
1
2
3
4
5
6
update t17 set a=11 where a=1;
select a from t17;
a
2
3
4
5
6
11
drop table if exists t1;
create table t1(c1 int primary key, c2 int);
alter table t1 set EXPIRE_INFO (c2>0);
alter table t1 set tablet_max_size=100000;
show create table t1;
table_name	table_definition
t1	CREATE TABLE t1 (
  c1 INT,
  c2 INT,
  PRIMARY KEY(c1)
) TABLET_MAX_SIZE = 100000, TABLET_BLOCK_SIZE = 16384, EXPIRE_INFO =( c2>0, REPLICA_NUM = 1, DEFAULT CHARSET = 'utf8'
drop table t1;
drop table if exists test;
create table test(a int,b int,c datetime primary key) EXPIRE_INFO (a>time_to_usec(merging_frozen_time()),enable_transaction_expire=true);
insert into test values(1,1,'2014-08-21 15:00:00');
insert into test values(2,2,'2014-08-20 13:00:00');
alter system major freeze tenant = sys;
alter system major freeze tenant = all_user;
alter system major freeze tenant = all_meta;
select a,b from test;
a	b
2	2
1	1
drop table if exists test11;
create table test11 (i2 varchar(1024) primary key) EXPIRE_INFO (                                                                                                        i2='1defghijk123456789abcdefghijk123456789abcdefghijk123456789abcdefghijk123456789abcdefghijk123456789abcdefghijk123456789abcdefghijk123456789abcdefghijk123456789abcdefghijk123456789abcdefghijk123456789abcdefghijk123456789abcdefghijk123456789abcdefghijk123456789abcdefghijk123456789abcdefghijk123456789abcdefghijk123456789abcdefghijk123456789abcdefghijk123456789abcdefghijk123456789abcdefghijk123456789abcdefghijk123456789abcdefghijk123456789abcdefghijk123456789abcdefghijk123456789abcdefghijk123^456789abcdefghijk123456789abcdefghijk123456789abcdefghijk123456789abcdefghijk123456789abcdefghijk123456789abcdefghijk123456789abcdefghijk123456789abcdefghijk123456789abcdefghijk123456789abcdefghijk123456789abcdefghijk123456789abcdefghijk123456789abcdefghijk123456789abcdefghijk123456789abcdefghijk123456789abcdefghijk123456789abcdefghijk123456789abcdefghijk123456789abcdefghijk123456789abcdefghijk123456789abcdefghijk123456789abcdefghijk123456789abcdefghijk123456789abcdefghijk123456789abcdefghijk123456789ab');
ERROR 42000: length(1006) of EXPIRE_INFO (is larger than the max allowed(512)
create table test11 (i2 varchar(1024) primary key);
alter table test11 set EXPIRE_INFO (                                                                                                                                   i2='1defghijk123456789abcdefghijk123456789abcdefghijk123456789abcdefghijk123456789abcdefghijk123456789abcdefghijk123456789abcdefghijk123456789abcdefghijk123456789abcdefghijk123456789abcdefghijk123456789abcdefghijk123456789abcdefghijk123456789abcdefghijk123456789abcdefghijk123456789abcdefghijk123456789abcdefghijk123456789abcdefghijk123456789abcdefghijk123456789abcdefghijk123456789abcdefghijk123456789abcdefghijk123456789abcdefghijk123456789abcdefghijk123456789abcdefghijk123456789abcdefghijk123456789abcdefghijk123456789abcdefghijk123456789abcdefghijk123456789abcdefghijk123456789abcdefghijk123456789abcdefghijk123456789abcdefghijk123456789abcdefghijk123456789abcdefghijk123456789abcdefghijk123456789abcdefghijk123456789abcdefghijk123456789abcdefghijk123456789abcdefghijk123456789abcdefghijk123456789abcdefghijk123456789abcdefghijk123456789abcdefghijk123456789abcdefghijk123456789abcdefghijk123456789abcdefghijk123456789abcdefghijk123456789abcdefghijk123456789abcdefghijk123456789abcdefghijk123456789ab');
ERROR 42000: length(1005) of EXPIRE_INFO (is larger than the max allowed(512)
