drop table if exists t1,t2,t3,t4,t5,t6;
CREATE TABLE t1 (a int not null, b char (10) not null) partition by hash(a) partitions 3;
insert into t1 values(1,'a');
insert into t1 values(2,'b');
insert into t1 values(3,'c');
insert into t1 values(4,'d');
CREATE TABLE t2 (a int not null, b char (10) not null) partition by hash(a) partitions 3;
insert into t2 values (3,'c');
insert into t2 values (4,'d');
insert into t2 values (5,'f');
insert into t2 values (6,'e');
select a,b from t1 union distinct select a,b from t2;
a	b
3	c
6	e
1	a
4	d
2	b
5	f
select found_rows();
found_rows()
6
select a,b from t1 union all select a,b from t2;
a	b
3	c
3	c
6	e
1	a
4	d
4	d
2	b
5	f
select found_rows();
found_rows()
8
select a,b from t1 union all select a,b from t2 order by b;
a	b
1	a
2	b
3	c
3	c
4	d
4	d
6	e
5	f
select found_rows();
found_rows()
8
select a,b from t1 union all select a,b from t2 union select 7,'g';
a	b
1	a
2	b
3	c
4	d
5	f
6	e
7	g
select found_rows();
found_rows()
7
select 0,'#' union select a,b from t1 union all select a,b from t2 union select 7,'gg';
0	#
0	#
1	a
2	b
3	c
4	d
5	f
6	e
7	gg
select found_rows();
found_rows()
8
select a,b from t1 union select a,b from t1;
a	b
3	c
1	a
4	d
2	b
select found_rows();
found_rows()
4
select 't1',b,count(*) from t1 group by b UNION select 't2',b,count(*) from t2 group by b;
t1	b	count(*)
t1	a	1
t1	b	1
t1	c	1
t1	d	1
t2	c	1
t2	d	1
t2	e	1
t2	f	1
select found_rows();
found_rows()
8
(select a,b from t1 limit 2)  union all (select a,b from t2 order by a) limit 4;
a	b
3	c
1	a
3	c
6	e
select found_rows();
found_rows()
6
(select a,b from t1 limit 2)  union all (select a,b from t2 order by a limit 1);
a	b
3	c
1	a
3	c
select found_rows();
found_rows()
3
(select a,b from t1 limit 2)  union all (select a,b from t2 order by a limit 1) order by b desc;
a	b
3	c
3	c
1	a
select found_rows();
found_rows()
3
(select sql_calc_found_rows  a,b from t1 limit 2)  union all (select a,b from t2 order by a) limit 2;
a	b
3	c
1	a
select found_rows();
found_rows()
6
select sql_calc_found_rows  a,b from t1  union all select a,b from t2 limit 2;
a	b
3	c
3	c
select found_rows();
found_rows()
8
select * from t1 where a = 1 union select 1;
ERROR 21000: The used SELECT statements have a different number of columns
(select * from t1 limit 2) union (select * from t2 limit 3) limit 4;
a	b
1	a
3	c
4	d
6	e
select found_Rows();
found_Rows()
4
(select * from t1 limit 2) union (select * from t2 limit 3);
a	b
1	a
3	c
4	d
6	e
select found_Rows();
found_Rows()
4
(select * from t1 limit 2) union (select * from t2 limit 20,3);
a	b
1	a
3	c
select found_Rows();
found_Rows()
2
(select * from t1 limit 2, 1) union (select * from t2 limit 20,3);
a	b
4	d
select found_Rows();
found_Rows()
1
(select * from t1 limit 2, 1) union (select * from t2 limit 20,3) limit 4;
a	b
4	d
select found_Rows();
found_Rows()
1
(select * from t1 limit 2, 1) union all(select * from t2 limit 20,3) limit 4;
a	b
4	d
select found_Rows();
found_Rows()
1
(select * from t1 limit 2, 1) union all(select * from t2 limit 20,3);
a	b
4	d
select found_Rows();
found_Rows()
1
(SELECT SQL_CALC_FOUND_ROWS * FROM t1) UNION all (SELECT * FROM t2) LIMIT 1;
a	b
3	c
select found_rows();
found_rows()
8
(SELECT SQL_CALC_FOUND_ROWS * FROM t1 LIMIT 1) UNION all (SELECT * FROM t2) LIMIT 2;
a	b
3	c
3	c
select found_rows();
found_rows()
5
(SELECT SQL_CALC_FOUND_ROWS * FROM t1 LIMIT 1) UNION all (SELECT * FROM t2);
a	b
3	c
3	c
6	e
4	d
5	f
select found_rows();
found_rows()
5
(SELECT SQL_CALC_FOUND_ROWS * FROM t1) UNION all (SELECT * FROM t2 LIMIT 1);
a	b
3	c
1	a
4	d
2	b
3	c
select found_rows();
found_rows()
5
(SELECT SQL_CALC_FOUND_ROWS * FROM t1 LIMIT 1) UNION all (SELECT * FROM t2) LIMIT 2;
a	b
3	c
3	c
select found_rows();
found_rows()
5
(SELECT SQL_CALC_FOUND_ROWS * FROM t1 LIMIT 1) UNION all (SELECT * FROM t2 LIMIT 2);
a	b
3	c
3	c
6	e
select found_rows();
found_rows()
3
SELECT SQL_CALC_FOUND_ROWS * FROM t1 UNION all SELECT * FROM t2 LIMIT 2;
a	b
3	c
3	c
select found_rows();
found_rows()
8
SELECT SQL_CALC_FOUND_ROWS * FROM t1 UNION SELECT * FROM t2 LIMIT 2;
a	b
3	c
6	e
select found_rows();
found_rows()
6
SELECT SQL_CALC_FOUND_ROWS * FROM t1 UNION SELECT * FROM t2 LIMIT 100;
a	b
3	c
6	e
1	a
4	d
2	b
5	f
select found_rows();
found_rows()
6
(SELECT SQL_CALC_FOUND_ROWS * FROM t1 LIMIT 100) UNION (SELECT * FROM t2);
a	b
1	a
2	b
3	c
4	d
5	f
6	e
select found_rows();
found_rows()
6
(SELECT SQL_CALC_FOUND_ROWS * FROM t1 LIMIT 1) UNION (SELECT * FROM t2);
a	b
3	c
4	d
5	f
6	e
select found_rows();
found_rows()
4
(SELECT SQL_CALC_FOUND_ROWS * FROM t1 LIMIT 1) UNION (SELECT * FROM t2 LIMIT 2);
a	b
3	c
6	e
select found_rows();
found_rows()
2
(SELECT SQL_CALC_FOUND_ROWS * FROM t1 LIMIT 1) UNION (SELECT * FROM t2) LIMIT 2;
a	b
3	c
6	e
select found_rows();
found_rows()
4
SELECT SQL_CALC_FOUND_ROWS * FROM t1 UNION (SELECT * FROM t2) LIMIT 2,2;
a	b
1	a
4	d
select found_rows();
found_rows()
6
(SELECT SQL_CALC_FOUND_ROWS * FROM t1 limit 2,2) UNION (SELECT * FROM t2);
a	b
2	b
3	c
4	d
5	f
6	e
select found_rows();
found_rows()
5
SELECT SQL_CALC_FOUND_ROWS * FROM t1 UNION (SELECT * FROM t2 LIMIT 2,2);
a	b
1	a
2	b
3	c
4	d
5	f
select found_rows();
found_rows()
5
(SELECT SQL_CALC_FOUND_ROWS * FROM t1 limit 2,2) UNION (SELECT * FROM t2) limit 2,1;
a	b
3	c
select found_rows();
found_rows()
5
SELECT SQL_CALC_FOUND_ROWS * FROM t1 UNION (SELECT * FROM t2) LIMIT 32,2;
a	b
select found_rows();
found_rows()
6
(SELECT SQL_CALC_FOUND_ROWS * FROM t1 limit 23,2) UNION (SELECT * FROM t2);
a	b
3	c
4	d
5	f
6	e
select found_rows();
found_rows()
4
SELECT SQL_CALC_FOUND_ROWS * FROM t1 UNION (SELECT * FROM t2 LIMIT 22,2);
a	b
1	a
2	b
3	c
4	d
select found_rows();
found_rows()
4
(SELECT SQL_CALC_FOUND_ROWS * FROM t1 limit 22,2) UNION (SELECT * FROM t2) limit 22,1;
a	b
select found_rows();
found_rows()
4
select * from ((select * from t1 limit 1) union (select * from t1 limit 1) union (select * from t1 limit 1)) a;
a	b
3	c
select found_rows();
found_rows()
1
select * from ((((select * from t1))) union (select * from t1) union (select * from t1)) a;
a	b
3	c
1	a
4	d
2	b
select found_rows();
found_rows()
4
select * from ((select * from t1) union (((select * from t1))) union (select * from t1)) a;
a	b
3	c
1	a
4	d
2	b
select found_rows();
found_rows()
4
select SQL_CALC_FOUND_ROWS * from ((select * from t1 limit 1) union (select * from t1 limit 1) union (select * from t1 limit 1)) a;
a	b
3	c
select found_rows();
found_rows()
1
select * from ((((select SQL_CALC_FOUND_ROWS * from t1))) union (select * from t1) union (select * from t1)) a;
ERROR 42000: Incorrect usage/placement of 'SQL_CALC_FOUND_ROWS'
select found_rows();
found_rows()
1
select * from ((select * from t1) union (((select * from t1))) union (select SQL_CALC_FOUND_ROWS * from t1)) a;
ERROR 42000: Incorrect usage/placement of 'SQL_CALC_FOUND_ROWS'
select found_rows();
found_rows()
1
drop table if exists t1,t2;
create table t1 (a int not null auto_increment, b int not null, primary key(a, b)) partition by hash(b) partitions 3;
insert into t1 (b) values (2);
insert into t1 (b) values (3);
insert into t1 (b) values (5);
insert into t1 (b) values (5);
insert into t1 (b) values (5);
insert into t1 (b) values (6);
insert into t1 (b) values (7);
insert into t1 (b) values (9);
select SQL_CALC_FOUND_ROWS * from t1;
a	b
2	3
6	6
8	9
7	7
1	2
3	5
4	5
5	5
select found_rows();
found_rows()
8
select SQL_CALC_FOUND_ROWS * from t1 limit 1;
a	b
2	3
select found_rows();
found_rows()
8
select SQL_CALC_FOUND_ROWS * from t1 limit 1;
a	b
2	3
select found_rows();
found_rows()
8
select SQL_CALC_FOUND_ROWS * from t1 order by b desc limit 1;
a	b
8	9
select found_rows();
found_rows()
8
select SQL_CALC_FOUND_ROWS distinct b from t1 limit 1;
b
3
select found_rows();
found_rows()
6
select SQL_CALC_FOUND_ROWS b,count(*) as c from t1 group by b order by c desc limit 1;
b	c
5	3
select found_rows();
found_rows()
6
select SQL_CALC_FOUND_ROWS * from t1 left join t1 as t2 on (t1.b=t2.a) limit 2,1;
a	b	a	b
3	5	5	5
select found_rows();
found_rows()
8
drop table t1;
create table t1 (a int not null primary key) partition by hash(a) partitions  3;
insert into t1 values (1);
insert into t1 values (2);
insert into t1 values (3);
insert into t1 values (4);
insert into t1 values (5);
select sql_calc_found_rows a from t1 where a in (1,2,3) order by a desc limit 0,2;
a
3
2
select FOUND_ROWS();
FOUND_ROWS()
3
select sql_calc_found_rows a from t1 where a in (1,2,3) order by a+2 desc limit 0,2;
a
3
2
select FOUND_ROWS();
FOUND_ROWS()
3
drop table t1;
CREATE TABLE t1 (
`id` smallint(5) unsigned NOT NULL,
`kid` smallint(5) unsigned NOT NULL default '0',
PRIMARY KEY (`id`)
) partition by hash(`id`) partitions 3;
CREATE TABLE t2 (
id smallint(5) unsigned NOT NULL,
name varchar(50) NOT NULL default '',
email varchar(50) NOT NULL default '',
PRIMARY KEY  (id)) partition by key(id) partitions 3;
SELECT SQL_CALC_FOUND_ROWS DISTINCT email FROM t2 LEFT JOIN t1  ON kid = t2.id WHERE t1.id IS NULL LIMIT 10;
show variables like 'sql_mode';
Variable_name	Value
sql_mode	STRICT_ALL_TABLES
SELECT SQL_CALC_FOUND_ROWS DISTINCT email FROM t2 LEFT JOIN t1  ON kid = t2.id WHERE t1.id IS NULL LIMIT 10;
email
email151
email100
email37
email127
email181
email67
email62
email111
email162
email172
SELECT FOUND_ROWS();
FOUND_ROWS()
200
SELECT SQL_CALC_FOUND_ROWS DISTINCT email FROM t2 LEFT JOIN t1  ON kid = t2.id WHERE t1.id IS NULL order by email LIMIT 10;
email
email1
email10
email100
email101
email102
email103
email104
email105
email106
email107
SELECT FOUND_ROWS();
FOUND_ROWS()
200
SELECT DISTINCT email FROM t2 LEFT JOIN t1  ON kid = t2.id WHERE t1.id IS NULL LIMIT 10;
email
email151
email100
email37
email127
email181
email67
email62
email111
email162
email172
SELECT DISTINCT email FROM t2 LEFT JOIN t1  ON kid = t2.id WHERE t1.id IS NULL ORDER BY email LIMIT 10;
email
email1
email10
email100
email101
email102
email103
email104
email105
email106
email107
INSERT INTO `t1` (`id`, `kid`) VALUES ('0', '150');
SELECT SQL_CALC_FOUND_ROWS DISTINCT email FROM t2 LEFT JOIN t1  ON kid = t2.id WHERE t1.id IS NULL LIMIT 10;
email
email151
email100
email37
email127
email181
email67
email62
email111
email162
email172
SELECT FOUND_ROWS();
FOUND_ROWS()
199
drop table t1,t2;
CREATE TABLE `t1` (
`titre` char(80) NOT NULL default '',
`numeropost` mediumint(8) unsigned NOT NULL,
`maxnumrep` int(10) unsigned NOT NULL default '0',
PRIMARY KEY  (`numeropost`)
) partition by hash(`numeropost`) partitions 3;
INSERT INTO t1 (numeropost, titre,maxnumrep) VALUES (1, 'test1','1');
INSERT INTO t1 (numeropost, titre,maxnumrep) VALUES (2, 'test2','2');
INSERT INTO t1 (numeropost, titre,maxnumrep) VALUES (3, 'test3','3');
SELECT SQL_CALC_FOUND_ROWS titre,numeropost,maxnumrep FROM t1 WHERE numeropost IN (1,2) ORDER BY maxnumrep DESC LIMIT 0, 1;
titre	numeropost	maxnumrep
test2	2	2
SELECT FOUND_ROWS();
FOUND_ROWS()
2
SELECT SQL_CALC_FOUND_ROWS 1 FROM (SELECT 1) as a LIMIT 0;
1
SELECT FOUND_ROWS();
FOUND_ROWS()
1
SELECT SQL_CALC_FOUND_ROWS * FROM t1 WHERE numeropost > 1  LIMIT 0;
titre	numeropost	maxnumrep
SELECT FOUND_ROWS();
FOUND_ROWS()
2
SELECT SQL_CALC_FOUND_ROWS * FROM t1 LIMIT 0;
titre	numeropost	maxnumrep
SELECT FOUND_ROWS();
FOUND_ROWS()
3
SELECT SQL_CALC_FOUND_ROWS * FROM t1 ORDER BY numeropost  LIMIT 0;
titre	numeropost	maxnumrep
SELECT FOUND_ROWS();
FOUND_ROWS()
3
drop table t1;
create table t1 (id int, primary key (id)) partition by hash(id) partitions 3;
insert into t1 values (1);
insert into t1 values (2);
insert into t1 values (3);
insert into t1 values (4);
insert into t1 values (5);
select SQL_CALC_FOUND_ROWS * from t1 where id > 3 limit 0, 1;
id
4
select FOUND_ROWS();
FOUND_ROWS()
2
select SQL_CALC_FOUND_ROWS * from t1 where id > 3 AND 1=2 limit 0, 1;
id
select FOUND_ROWS();
FOUND_ROWS()
0
select SQL_CALC_FOUND_ROWS * from t1 where id > 6 limit 0, 1;
id
select FOUND_ROWS();
FOUND_ROWS()
0
drop table t1;
CREATE TABLE t1 ( a int not null, b int not null) partition by hash (a) partitions 3;
INSERT INTO t1 VALUES ( 47,    1  );
INSERT INTO t1 VALUES ( 70,    1  );
SELECT * FROM t1
WHERE
(
( b =1 AND a BETWEEN 14 AND 21 ) OR
( b =2 AND a BETWEEN 16 AND 18 ) OR
( b =3 AND a BETWEEN 15 AND 19 )
);
a	b
DROP TABLE t1;
CREATE TABLE t1 ( a integer, u varchar(15), r integer, key uao_idx( r, a, u));
DELETE  FROM t1
WHERE (  r = 1 AND a IN ( 1, 2    ) AND ( u = 'w'   OR u LIKE 'w/%'   ) )
OR (  r = 1 AND a IN (       3 ) AND ( u = 'w/U' OR u LIKE 'w/U/%' ) )
OR (  r = 1 AND a IN ( 1, 2, 3 ) AND ( u = 'w'                     ) );
drop table t1;
CREATE TABLE t1 (a VARCHAR(16)) partition by key(a) partitions 3;
INSERT INTO t1 VALUES ('1');
INSERT INTO t1 VALUES ('2');
INSERT INTO t1 VALUES ('3');
SELECT SQL_CALC_FOUND_ROWS * FROM t1 WHERE a = '2' LIMIT 0, 1;
a
2
SELECT FOUND_ROWS();
FOUND_ROWS()
1
DROP TABLE t1;
CREATE TABLE t1 (a INT) partition by key(a) partitions 3;
INSERT INTO t1 VALUES (0), (0);
INSERT INTO t1 VALUES (2), (2);
INSERT INTO t1 VALUES (1), (1);
SELECT SQL_CALC_FOUND_ROWS * FROM t1 WHERE a = 0 GROUP BY a HAVING a > 10;
a
SELECT FOUND_ROWS();
FOUND_ROWS()
0
DROP TABLE t1;
SELECT 'foo';
foo
foo
SELECT FOUND_ROWS();
FOUND_ROWS()
1
SELECT SQL_CALC_FOUND_ROWS 'foo';
foo
foo
SELECT FOUND_ROWS();
FOUND_ROWS()
1
SELECT SQL_CALC_FOUND_ROWS 'foo' limit 0;
foo
SELECT FOUND_ROWS();
FOUND_ROWS()
1
SELECT FOUND_ROWS();
FOUND_ROWS()
1
SELECT SQL_CALC_FOUND_ROWS 'foo' UNION SELECT 'bar' LIMIT 0;
foo
SELECT FOUND_ROWS();
FOUND_ROWS()
2
CREATE TABLE t1 (a int, b int) partition by key(b) partitions 3;
INSERT INTO t1 VALUES (1,2);
INSERT INTO t1 VALUES (1,3);
INSERT INTO t1 VALUES (1,4);
INSERT INTO t1 VALUES (1,5);
SELECT SQL_CALC_FOUND_ROWS DISTINCT 'a' FROM t1 GROUP BY b LIMIT 2;
a
a
SELECT FOUND_ROWS();
FOUND_ROWS()
1
DROP TABLE t1;
