drop table if exists t1,t2;
alter system set merge_delay_interval='1s' server_type=chunkserver;
alter system set merge_delay_for_lsync='1s' server_type=chunkserver;
alter system set min_major_freeze_interval='1s' server_type=updateserver;
alter system set check_async_task_interval='5s' server_type=rootserver;
alter system set check_tablet_available_interval='2s' server_type=chunkserver;
alter system set write_delay_after_drop_index = '1s' server_type=rootserver;
alter system set read_delay_after_drop_index = '1s' server_type=rootserver;
alter system set build_global_index_time='60s' server_type=rootserver;
alter system set build_sample_time='60s' server_type=rootserver;
alter system set write_delay_after_create_index = '1s' server_type=rootserver;
create table t1(
a1 char(3) primary key,
a2 int,
a3 char(3),
a4 float,
a5 datetime
);
insert into t1 values('AME',0,'SEA',0.100,date'1942-02-19');
insert into t1 values('HBR',1,'SEA',0.085,date'1948-03-05');
insert into t1 values('BOT',-2,'SEA',-0.085,date'1951-11-29');
insert into t1 values('BMC',3,'SEA',-0.085,date'1958-09-08');
insert into t1 values('TWU',+0,'LAX',-0.080,date'1969-10-05');
insert into t1 values('BDL',-0,'DEN',-0.080,date'1960-11-27');
insert into t1 values('DTX',1,'NYC',0.080,date'1961-05-04');
insert into t1 values('PLS',-1,'WDC',-0.075,date'1949-01-02');
insert into t1 values('ZAJ',2,'CHI',-0.075,date'1960-06-15');
insert into t1 values('VVV',-2,'MON',0.075,date'1959-06-28');
insert into t1 values('GTM',3,'DAL',-0.070,date'1977-09-23');
insert into t1 values('SSJ',null,'CHI',null,date'1974-03-19');
insert into t1 values('KKK',-3,'ATL',null,null);
insert into t1 values('XXX',null,'MIN',null,null);
insert into t1 values('WWW',1,'LED',null,null);
insert into t1 values('GG3',-3,'DD3',-0.051,now());
insert into t1 values('GG2',-3,'DD2',0.052,now());
insert into t1 values('GG1',3,'DD1',0.053,now());
select * from t1;
a1	a2	a3	a4	a5
AME	0	SEA	0.1	timestamp
BDL	0	DEN	-0.08	timestamp
BMC	3	SEA	-0.085	timestamp
BOT	-2	SEA	-0.085	timestamp
DTX	1	NYC	0.08	timestamp
GG1	3	DD1	0.053	timestamp
GG2	-3	DD2	0.052	timestamp
GG3	-3	DD3	-0.051	timestamp
GTM	3	DAL	-0.07	timestamp
HBR	1	SEA	0.085	timestamp
KKK	-3	ATL	NULL	timestamp
PLS	-1	WDC	-0.075	timestamp
SSJ	NULL	CHI	NULL	timestamp
TWU	0	LAX	-0.08	timestamp
VVV	-2	MON	0.075	timestamp
WWW	1	LED	NULL	timestamp
XXX	NULL	MIN	NULL	timestamp
ZAJ	2	CHI	-0.075	timestamp
select sign(100) , sign(-100) , sign(-0.17) , sign(0.0000000001) , sign(0) , sign(0.00) , sign(+0) , sign(-0);
sign(100)	sign(-100)	sign(-0.17)	sign(0.0000000001)	sign(0)	sign(0.00)	sign(+0)	sign(-0)
BIGINT	BIGINT	BIGINT	BIGINT	BIGINT	BIGINT	BIGINT	BIGINT
1	-1	-1	1	0	0	0	0
select sign('100') , sign('-100') , sign('+0') , sign('-0.000001') , sign('-0.0000000');
sign('100')	sign('-100')	sign('+0')	sign('-0.000001')	sign('-0.0000000')
BIGINT	BIGINT	BIGINT	BIGINT	BIGINT
1	-1	0	-1	0
select sign('2014.11.11');
ERROR 22000:  OB-5085: Not a number Can not cast varchar value to number type
select sign('abc');
ERROR 22000:  Invalid numeric char 'a'
select sign(true);
sign(true)
BIGINT
1
select sign(1>0);
sign(1>0)
BIGINT
1
select sign(null);
sign(null)
BIGINT
NULL
select sign( row(1,2) );
ERROR 22000:  OB-5083: Invalid data type for the operation
select sign( '2.1' > 1 AND 1 < 2 AND 1 <> 2 AND 1 != 2 AND 3 between 1 and 4 AND 5 not between 1 and 3 AND 1 in (1,2,3) AND 4 not in (1,2,3) );
sign( '2.1' > 1 AND 1 < 2 AND 1 <> 2 AND 1 != 2 AND 3 between 1 and 4 AND 5 not between 1 and 3 AND 1 in (1,2,3) AND 4 not in (1,2,3) )
BIGINT
1
select sign( NOT ( 1 < 2 ) );
sign( NOT ( 1 < 2 ) )
BIGINT
0
select sign( 1 < 2 OR false );
sign( 1 < 2 OR false )
BIGINT
1
select sign( row(1,2) <= row(2,3) );
sign( row(1,2) <= row(2,3) )
BIGINT
1
select sign( 1.1 + 1.1 - 1.1 * 1.1 / 1.1 - 4%3 );
sign( 1.1 + 1.1 - 1.1 * 1.1 / 1.1 - 4%3 )
BIGINT
1
select sign( length('abc') );
sign( length('abc') )
BIGINT
1
select sign( 'abc' like 'a%c' AND 'abc' not like 'cde' );
sign( 'abc' like 'a%c' AND 'abc' not like 'cde' )
BIGINT
1
select sign( concat( 'a', 'bc' ) );
ERROR 22000:  Invalid numeric char 'a'
select sign( trim('   aaa  ') );
ERROR 22000:  Invalid numeric char 'a'
select sign( substr('abc',1,2) );
ERROR 22000:  Invalid numeric char 'a'
select sign( sign( sign(0.0000000000000000000000000000000) ) );
sign( sign( sign(0.0000000000000000000000000000000) ) )
BIGINT
0
select sign( sign( sign(0.0000000000000000000000000000001) ) );
sign( sign( sign(0.0000000000000000000000000000001) ) )
BIGINT
1
select sign( sign( sign(-0.0000000000000000000000000000001) ) );
sign( sign( sign(-0.0000000000000000000000000000001) ) )
BIGINT
-1
select sign( sign( neg( sign( sign(0.0000000000000000000000000000000) ) ) ) );
sign( sign( neg( sign( sign(0.0000000000000000000000000000000) ) ) ) )
BIGINT
0
select sign( sign( neg( sign( sign(0.0000000000000000000000000000001) ) ) ) );
sign( sign( neg( sign( sign(0.0000000000000000000000000000001) ) ) ) )
BIGINT
-1
select sign( sign( neg( sign( sign(-0.0000000000000000000000000000001) ) ) ) );
sign( sign( neg( sign( sign(-0.0000000000000000000000000000001) ) ) ) )
BIGINT
1
select sign( sign('1.1') + sign(0.1) );
sign( sign('1.1') + sign(0.1) )
BIGINT
1
select sign( nvl( 1, 'r' ) );
sign( nvl( 1, 'r' ) )
BIGINT
1
select sign( nvl(null, 'r') );
ERROR 22000:  Invalid numeric char 'r'
select sign( nvl(null, 100) );
sign( nvl(null, 100) )
BIGINT
1
select sign(a1) from t1;
ERROR 22000:  Invalid numeric char 'A'
select sign(a3) from t1;
ERROR 22000:  Invalid numeric char 'S'
select sign(a1),a2 from t1;
ERROR 22000:  Invalid numeric char 'A'
select sign(a2) from t1 where sign(a4) >= 0;
sign(a2)
BIGINT
0
1
1
-1
1
-1
select sign(a4) from t1 where sign(a2) <=0 AND a2 < 2;
sign(a4)
BIGINT
1
-1
-1
1
-1
NULL
-1
-1
1
select * from t1 group by sign(a2);
a1	a2	a3	a4	a5
VARCHAR	BIGINT	VARCHAR	DECIMAL	timestamp
SSJ	NULL	CHI	NULL	timestamp
BOT	-2	SEA	-0.085	timestamp
AME	0	SEA	0.1	timestamp
BMC	3	SEA	-0.085	timestamp
select * from t1 order by sign(a4) ;
a1	a2	a3	a4	a5
VARCHAR	BIGINT	VARCHAR	DECIMAL	timestamp
XXX	NULL	MIN	NULL	timestamp
WWW	1	LED	NULL	timestamp
KKK	-3	ATL	NULL	timestamp
SSJ	NULL	CHI	NULL	timestamp
ZAJ	2	CHI	-0.075	timestamp
BDL	0	DEN	-0.08	timestamp
BMC	3	SEA	-0.085	timestamp
BOT	-2	SEA	-0.085	timestamp
GG3	-3	DD3	-0.051	timestamp
GTM	3	DAL	-0.07	timestamp
TWU	0	LAX	-0.08	timestamp
PLS	-1	WDC	-0.075	timestamp
VVV	-2	MON	0.075	timestamp
HBR	1	SEA	0.085	timestamp
GG2	-3	DD2	0.052	timestamp
GG1	3	DD1	0.053	timestamp
DTX	1	NYC	0.08	timestamp
AME	0	SEA	0.1	timestamp
select * from t1 order by sign(a4) , a4 ;
a1	a2	a3	a4	a5
VARCHAR	BIGINT	VARCHAR	DECIMAL	timestamp
XXX	NULL	MIN	NULL	timestamp
KKK	-3	ATL	NULL	timestamp
SSJ	NULL	CHI	NULL	timestamp
WWW	1	LED	NULL	timestamp
BMC	3	SEA	-0.085	timestamp
BOT	-2	SEA	-0.085	timestamp
BDL	0	DEN	-0.08	timestamp
TWU	0	LAX	-0.08	timestamp
ZAJ	2	CHI	-0.075	timestamp
PLS	-1	WDC	-0.075	timestamp
GTM	3	DAL	-0.07	timestamp
GG3	-3	DD3	-0.051	timestamp
GG2	-3	DD2	0.052	timestamp
GG1	3	DD1	0.053	timestamp
VVV	-2	MON	0.075	timestamp
DTX	1	NYC	0.08	timestamp
HBR	1	SEA	0.085	timestamp
AME	0	SEA	0.1	timestamp
select * from t1 order by sign(a4) , a1 ;
a1	a2	a3	a4	a5
VARCHAR	BIGINT	VARCHAR	DECIMAL	timestamp
KKK	-3	ATL	NULL	timestamp
SSJ	NULL	CHI	NULL	timestamp
WWW	1	LED	NULL	timestamp
XXX	NULL	MIN	NULL	timestamp
BDL	0	DEN	-0.08	timestamp
BMC	3	SEA	-0.085	timestamp
BOT	-2	SEA	-0.085	timestamp
GG3	-3	DD3	-0.051	timestamp
GTM	3	DAL	-0.07	timestamp
PLS	-1	WDC	-0.075	timestamp
TWU	0	LAX	-0.08	timestamp
ZAJ	2	CHI	-0.075	timestamp
AME	0	SEA	0.1	timestamp
DTX	1	NYC	0.08	timestamp
GG1	3	DD1	0.053	timestamp
GG2	-3	DD2	0.052	timestamp
HBR	1	SEA	0.085	timestamp
VVV	-2	MON	0.075	timestamp
select abs(a2) , sum(a4) from t1 group by abs(a2) having sum(sign(a4)) > 0;
abs(a2)	sum(a4)
BIGINT	DECIMAL
1	0.09
select * from t1 where a2 = sign ( floor(1.5) - ceil(1.5) + round(1.5) - abs(-1.5) + neg(-1) );
a1	a2	a3	a4	a5
VARCHAR	BIGINT	VARCHAR	DECIMAL	timestamp
DTX	1	NYC	0.08	timestamp
HBR	1	SEA	0.085	timestamp
WWW	1	LED	NULL	timestamp
select sign( sum(a2) ) , sign( sum(a4) ) from t1;
sign( sum(a2) )	sign( sum(a4) )
BIGINT	BIGINT
0	-1
select sign( avg(a2) ) , sign( avg(a4) ) from t1;
sign( avg(a2) )	sign( avg(a4) )
BIGINT	BIGINT
0	-1
select sign( max(a2) ) , sign( min(a4) ) from t1;
sign( max(a2) )	sign( min(a4) )
BIGINT	BIGINT
1	-1
select sign(count(*)) from t1;
sign(count(*))
BIGINT
1
select * from t1 where sign( length(a1) ) = 1;
a1	a2	a3	a4	a5
VARCHAR	BIGINT	VARCHAR	DECIMAL	timestamp
AME	0	SEA	0.1	timestamp
BDL	0	DEN	-0.08	timestamp
BMC	3	SEA	-0.085	timestamp
BOT	-2	SEA	-0.085	timestamp
DTX	1	NYC	0.08	timestamp
GG1	3	DD1	0.053	timestamp
GG2	-3	DD2	0.052	timestamp
GG3	-3	DD3	-0.051	timestamp
GTM	3	DAL	-0.07	timestamp
HBR	1	SEA	0.085	timestamp
KKK	-3	ATL	NULL	timestamp
PLS	-1	WDC	-0.075	timestamp
SSJ	NULL	CHI	NULL	timestamp
TWU	0	LAX	-0.08	timestamp
VVV	-2	MON	0.075	timestamp
WWW	1	LED	NULL	timestamp
XXX	NULL	MIN	NULL	timestamp
ZAJ	2	CHI	-0.075	timestamp
select sign( cast(a1 as varchar(1024)) ) , sign( cast(a3 as varchar(1024)) ) from t1;
ERROR 22000:  Invalid numeric char 'A'
select sign( cast(a2 as varchar(1024)) ) , sign( cast(a4 as varchar(1024)) ) from t1;
sign( cast(a2 as varchar(1024)) )	sign( cast(a4 as varchar(1024)) )
BIGINT	BIGINT
0	1
0	-1
1	-1
-1	-1
1	1
1	1
-1	1
-1	-1
1	-1
1	1
-1	NULL
-1	-1
NULL	NULL
0	-1
-1	1
1	NULL
NULL	NULL
1	-1
select * from t1 as t11 join t1 as t12 on sign(t11.a2) = sign(t12.a4);
ERROR 0A000: OB-7: Not supported feature or function
select tmp.a1 , sign(tmp.a2) , tmp.a3 , sign(tmp.a4) from t1 as tmp;
a1	sign(tmp.a2)	a3	sign(tmp.a4)
VARCHAR	BIGINT	VARCHAR	BIGINT
AME	0	SEA	1
BDL	0	DEN	-1
BMC	1	SEA	-1
BOT	-1	SEA	-1
DTX	1	NYC	1
GG1	1	DD1	1
GG2	-1	DD2	1
GG3	-1	DD3	-1
GTM	1	DAL	-1
HBR	1	SEA	1
KKK	-1	ATL	NULL
PLS	-1	WDC	-1
SSJ	NULL	CHI	NULL
TWU	0	LAX	-1
VVV	-1	MON	1
WWW	1	LED	NULL
XXX	NULL	MIN	NULL
ZAJ	1	CHI	-1
select sign(a2) from t1 where sign(a4) >= 0 for update;
sign(a2)
BIGINT
0
1
1
-1
1
-1
select sign(a4) from t1 where sign(a2) <=0 AND a2 < 2 for update;
sign(a4)
BIGINT
1
-1
-1
1
-1
NULL
-1
-1
1
select * from t1 group by sign(a2) for update;
ERROR 0A000: This select statement is not allowed by implementation
select * from t1 order by sign(a4) for update;
ERROR 0A000: This select statement is not allowed by implementation
select abs(a2) , sum(a4) from t1 group by abs(a2) having sum(sign(a4)) > 0 for update;
ERROR 0A000: This select statement is not allowed by implementation
select * from t1 where a2 = sign ( floor(1.5) - ceil(1.5) + round(1.5) - abs(-1.5) + neg(-1) ) for update;
a1	a2	a3	a4	a5
VARCHAR	BIGINT	VARCHAR	DECIMAL	timestamp
DTX	1	NYC	0.08	timestamp
HBR	1	SEA	0.085	timestamp
WWW	1	LED	NULL	timestamp
select sign( sum(a2) ) , sign( sum(a4) ) from t1 for update;
ERROR 0A000: This select statement is not allowed by implementation
select sign( avg(a2) ) , sign( avg(a4) ) from t1 for update;
ERROR 0A000: This select statement is not allowed by implementation
select sign( max(a2) ) , sign( min(a4) ) from t1 for update;
ERROR 0A000: This select statement is not allowed by implementation
select sign(count(*)) from t1 for update;
ERROR 0A000: This select statement is not allowed by implementation
select * from t1 where sign( length(a1) ) = 1 for update;
a1	a2	a3	a4	a5
VARCHAR	BIGINT	VARCHAR	DECIMAL	timestamp
AME	0	SEA	0.1	timestamp
BDL	0	DEN	-0.08	timestamp
BMC	3	SEA	-0.085	timestamp
BOT	-2	SEA	-0.085	timestamp
DTX	1	NYC	0.08	timestamp
GG1	3	DD1	0.053	timestamp
GG2	-3	DD2	0.052	timestamp
GG3	-3	DD3	-0.051	timestamp
GTM	3	DAL	-0.07	timestamp
HBR	1	SEA	0.085	timestamp
KKK	-3	ATL	NULL	timestamp
PLS	-1	WDC	-0.075	timestamp
SSJ	NULL	CHI	NULL	timestamp
TWU	0	LAX	-0.08	timestamp
VVV	-2	MON	0.075	timestamp
WWW	1	LED	NULL	timestamp
XXX	NULL	MIN	NULL	timestamp
ZAJ	2	CHI	-0.075	timestamp
select sign( cast(a1 as varchar(1024)) ) , sign( cast(a3 as varchar(1024)) ) from t1 for update;
ERROR 22000:  Invalid numeric char 'A'
select sign( cast(a2 as varchar(1024)) ) , sign( cast(a4 as varchar(1024)) ) from t1 for update;
sign( cast(a2 as varchar(1024)) )	sign( cast(a4 as varchar(1024)) )
BIGINT	BIGINT
0	1
0	-1
1	-1
-1	-1
1	1
1	1
-1	1
-1	-1
1	-1
1	1
-1	NULL
-1	-1
NULL	NULL
0	-1
-1	1
1	NULL
NULL	NULL
1	-1
insert into t1(a1, a2) values('III' , sign(0.1) );
replace into t1(a1, a2) values('RRR' , sign(0.1) );
select * from t1;
a1	a2	a3	a4	a5
VARCHAR	BIGINT	VARCHAR	DECIMAL	timestamp
AME	0	SEA	0.1	timestamp
BDL	0	DEN	-0.08	timestamp
BMC	3	SEA	-0.085	timestamp
BOT	-2	SEA	-0.085	timestamp
DTX	1	NYC	0.08	timestamp
GG1	3	DD1	0.053	timestamp
GG2	-3	DD2	0.052	timestamp
GG3	-3	DD3	-0.051	timestamp
GTM	3	DAL	-0.07	timestamp
HBR	1	SEA	0.085	timestamp
III	1	NULL	NULL	timestamp
KKK	-3	ATL	NULL	timestamp
PLS	-1	WDC	-0.075	timestamp
RRR	1	NULL	NULL	timestamp
SSJ	NULL	CHI	NULL	timestamp
TWU	0	LAX	-0.08	timestamp
VVV	-2	MON	0.075	timestamp
WWW	1	LED	NULL	timestamp
XXX	NULL	MIN	NULL	timestamp
ZAJ	2	CHI	-0.075	timestamp
update t1 set a4 = a4 + sign(a4) where a1 > 'SSS';
select * from t1;
a1	a2	a3	a4	a5
VARCHAR	BIGINT	VARCHAR	DECIMAL	timestamp
AME	0	SEA	0.1	timestamp
BDL	0	DEN	-0.08	timestamp
BMC	3	SEA	-0.085	timestamp
BOT	-2	SEA	-0.085	timestamp
DTX	1	NYC	0.08	timestamp
GG1	3	DD1	0.053	timestamp
GG2	-3	DD2	0.052	timestamp
GG3	-3	DD3	-0.051	timestamp
GTM	3	DAL	-0.07	timestamp
HBR	1	SEA	0.085	timestamp
III	1	NULL	NULL	timestamp
KKK	-3	ATL	NULL	timestamp
PLS	-1	WDC	-0.075	timestamp
RRR	1	NULL	NULL	timestamp
SSJ	NULL	CHI	NULL	timestamp
TWU	0	LAX	-1.08	timestamp
VVV	-2	MON	1.075	timestamp
WWW	1	LED	NULL	timestamp
XXX	NULL	MIN	NULL	timestamp
ZAJ	2	CHI	-1.075	timestamp
update t1 set a2 = 10 + sign(a2) where sign(a4) > 0;
select * from t1;
a1	a2	a3	a4	a5
VARCHAR	BIGINT	VARCHAR	DECIMAL	timestamp
AME	10	SEA	0.1	timestamp
BDL	0	DEN	-0.08	timestamp
BMC	3	SEA	-0.085	timestamp
BOT	-2	SEA	-0.085	timestamp
DTX	11	NYC	0.08	timestamp
GG1	11	DD1	0.053	timestamp
GG2	9	DD2	0.052	timestamp
GG3	-3	DD3	-0.051	timestamp
GTM	3	DAL	-0.07	timestamp
HBR	11	SEA	0.085	timestamp
III	1	NULL	NULL	timestamp
KKK	-3	ATL	NULL	timestamp
PLS	-1	WDC	-0.075	timestamp
RRR	1	NULL	NULL	timestamp
SSJ	NULL	CHI	NULL	timestamp
TWU	0	LAX	-1.08	timestamp
VVV	9	MON	1.075	timestamp
WWW	1	LED	NULL	timestamp
XXX	NULL	MIN	NULL	timestamp
ZAJ	2	CHI	-1.075	timestamp
delete from t1 where sign(a2) = 0;
select * from t1;
a1	a2	a3	a4	a5
VARCHAR	BIGINT	VARCHAR	DECIMAL	timestamp
AME	10	SEA	0.1	timestamp
BMC	3	SEA	-0.085	timestamp
BOT	-2	SEA	-0.085	timestamp
DTX	11	NYC	0.08	timestamp
GG1	11	DD1	0.053	timestamp
GG2	9	DD2	0.052	timestamp
GG3	-3	DD3	-0.051	timestamp
GTM	3	DAL	-0.07	timestamp
HBR	11	SEA	0.085	timestamp
III	1	NULL	NULL	timestamp
KKK	-3	ATL	NULL	timestamp
PLS	-1	WDC	-0.075	timestamp
RRR	1	NULL	NULL	timestamp
SSJ	NULL	CHI	NULL	timestamp
VVV	9	MON	1.075	timestamp
WWW	1	LED	NULL	timestamp
XXX	NULL	MIN	NULL	timestamp
ZAJ	2	CHI	-1.075	timestamp
delete from t1 where sign(a2) is null;
select * from t1;
a1	a2	a3	a4	a5
VARCHAR	BIGINT	VARCHAR	DECIMAL	timestamp
AME	10	SEA	0.1	timestamp
BMC	3	SEA	-0.085	timestamp
BOT	-2	SEA	-0.085	timestamp
DTX	11	NYC	0.08	timestamp
GG1	11	DD1	0.053	timestamp
GG2	9	DD2	0.052	timestamp
GG3	-3	DD3	-0.051	timestamp
GTM	3	DAL	-0.07	timestamp
HBR	11	SEA	0.085	timestamp
III	1	NULL	NULL	timestamp
KKK	-3	ATL	NULL	timestamp
PLS	-1	WDC	-0.075	timestamp
RRR	1	NULL	NULL	timestamp
VVV	9	MON	1.075	timestamp
WWW	1	LED	NULL	timestamp
ZAJ	2	CHI	-1.075	timestamp
insert into t1(a1 , a2) values('CC2' , sign(-0.1) ) when row_count( insert into t1(a1, a2) values('CCC' , sign(0.1) ) ) = 1;
insert into t1(a1 , a2) values('CC4', sign(null) ) when row_count( replace into t1(a1, a2) values('CC3' , sign(-0.1) ) ) = 1;
replace into t1(a1 , a2) values('CC5', sign('-1.1') ) when row_count( update t1 set a2 = 20 + sign(a2) where a1 = 'CCC' ) = 1;
update t1 set a2 = 30 * sign(a2) where a1 = 'CC2' when row_count( replace into t1(a1, a2) values('CC6' , sign(-0.1) ) ) = 1;
update t1 set a2 = 50 / sign(a2) where a1 = 'CC2' when row_count( update t1 set a2 = sign(a2) % 98 where a1 = 'CC3' ) = 1;
select * from t1;
a1	a2	a3	a4	a5
VARCHAR	BIGINT	VARCHAR	DECIMAL	timestamp
AME	10	SEA	0.1	timestamp
BMC	3	SEA	-0.085	timestamp
BOT	-2	SEA	-0.085	timestamp
CC2	-50	NULL	NULL	timestamp
CC3	-1	NULL	NULL	timestamp
CC4	NULL	NULL	NULL	timestamp
CC5	-1	NULL	NULL	timestamp
CC6	-1	NULL	NULL	timestamp
CCC	21	NULL	NULL	timestamp
DTX	11	NYC	0.08	timestamp
GG1	11	DD1	0.053	timestamp
GG2	9	DD2	0.052	timestamp
GG3	-3	DD3	-0.051	timestamp
GTM	3	DAL	-0.07	timestamp
HBR	11	SEA	0.085	timestamp
III	1	NULL	NULL	timestamp
KKK	-3	ATL	NULL	timestamp
PLS	-1	WDC	-0.075	timestamp
RRR	1	NULL	NULL	timestamp
VVV	9	MON	1.075	timestamp
WWW	1	LED	NULL	timestamp
ZAJ	2	CHI	-1.075	timestamp
alter table t1 set expire_info sign(a4) is null or sign(a2) < 0;
insert into t1(a1,a2,a3,a4) values('EX1',-1,'AAA',0),('EX2',-1,'AAA',0),('EX3',0,'AAA',NULL),('EX4',0,'AAA',null);
select * from t1;
a1	a2	a3	a4	a5
VARCHAR	BIGINT	VARCHAR	DECIMAL	timestamp
AME	10	SEA	0.1	timestamp
BMC	3	SEA	-0.085	timestamp
BOT	-2	SEA	-0.085	timestamp
CC2	-50	NULL	NULL	timestamp
CC3	-1	NULL	NULL	timestamp
CC4	NULL	NULL	NULL	timestamp
CC5	-1	NULL	NULL	timestamp
CC6	-1	NULL	NULL	timestamp
CCC	21	NULL	NULL	timestamp
DTX	11	NYC	0.08	timestamp
EX1	-1	AAA	0	timestamp
EX2	-1	AAA	0	timestamp
EX3	0	AAA	NULL	timestamp
EX4	0	AAA	NULL	timestamp
GG1	11	DD1	0.053	timestamp
GG2	9	DD2	0.052	timestamp
GG3	-3	DD3	-0.051	timestamp
GTM	3	DAL	-0.07	timestamp
HBR	11	SEA	0.085	timestamp
III	1	NULL	NULL	timestamp
KKK	-3	ATL	NULL	timestamp
PLS	-1	WDC	-0.075	timestamp
RRR	1	NULL	NULL	timestamp
VVV	9	MON	1.075	timestamp
WWW	1	LED	NULL	timestamp
ZAJ	2	CHI	-1.075	timestamp
select a1, decode( sign(a2) , 1 , 'possitive a2', 0 , 'zero a2' , -1 , 'negative a2' , '--imposible a2'), a3 , decode( sign(a4) , 1 , 'possitive a4', 0 , 'zero a4' , -1 , 'negative a4' , '--impossible a4') from t1;
a1	decode( sign(a2) , 1 , 'possitive a2', 0 , 'zero a2' , -1 , 'negative a2' , '--imposible a2')	a3	decode( sign(a4) , 1 , 'possitive a4', 0 , 'zero a4' , -1 , 'negative a4' , '--impossible a4')
VARCHAR	VARCHAR	VARCHAR	VARCHAR
AME	possitive a2	SEA	possitive a4
BMC	possitive a2	SEA	negative a4
BOT	negative a2	SEA	negative a4
CC2	negative a2	NULL	--impossible a4
CC3	negative a2	NULL	--impossible a4
CC4	--imposible a2	NULL	--impossible a4
CC5	negative a2	NULL	--impossible a4
CC6	negative a2	NULL	--impossible a4
CCC	possitive a2	NULL	--impossible a4
DTX	possitive a2	NYC	possitive a4
EX1	negative a2	AAA	zero a4
EX2	negative a2	AAA	zero a4
EX3	zero a2	AAA	--impossible a4
EX4	zero a2	AAA	--impossible a4
GG1	possitive a2	DD1	possitive a4
GG2	possitive a2	DD2	possitive a4
GG3	negative a2	DD3	negative a4
GTM	possitive a2	DAL	negative a4
HBR	possitive a2	SEA	possitive a4
III	possitive a2	NULL	--impossible a4
KKK	negative a2	ATL	--impossible a4
PLS	negative a2	WDC	negative a4
RRR	possitive a2	NULL	--impossible a4
VVV	possitive a2	MON	possitive a4
WWW	possitive a2	LED	--impossible a4
ZAJ	possitive a2	CHI	negative a4
alter system major freeze tenant = sys;
alter system major freeze tenant = all_user;
alter system major freeze tenant = all_meta;
select * from t1;
a1	a2	a3	a4	a5
VARCHAR	BIGINT	VARCHAR	DECIMAL	timestamp
AME	10	SEA	0.1	timestamp
BMC	3	SEA	-0.085	timestamp
DTX	11	NYC	0.08	timestamp
GG1	11	DD1	0.053	timestamp
GG2	9	DD2	0.052	timestamp
GTM	3	DAL	-0.07	timestamp
HBR	11	SEA	0.085	timestamp
VVV	9	MON	1.075	timestamp
ZAJ	2	CHI	-1.075	timestamp
