drop table if exists t1,t2,t3,v1;
drop view if exists t1,t2,t3,v1;
set time_zone='+03:00';
select now()-curdate()*1000000-curtime();
now()-curdate()*1000000-curtime()
0
select date_format('1997-01-02 03:04:05', '%M %W %D %Y %y %m %d %h %i %s %w');
date_format('1997-01-02 03:04:05', '%M %W %D %Y %y %m %d %h %i %s %w')
January Thursday 2nd 1997 97 01 02 03 04 05 4
select date_format('1997-01-02', concat('%M %W %D ','%Y %y %m %d %h %i %s %w'));
date_format('1997-01-02', concat('%M %W %D ','%Y %y %m %d %h %i %s %w'))
January Thursday 2nd 1997 97 01 02 12 00 00 4
select '1997-12-31 23:59:59' + INTERVAL 1 SECOND;
'1997-12-31 23:59:59' + INTERVAL 1 SECOND
1998-01-01 00:00:00
select '1998-01-01 00:00:00' - INTERVAL 1 SECOND;
'1998-01-01 00:00:00' - INTERVAL 1 SECOND
1997-12-31 23:59:59
select date_sub('1998-01-02',INTERVAL 31 DAY);
date_sub('1998-01-02',INTERVAL 31 DAY)
1997-12-02
select date_add('1997-12-31',INTERVAL 1 SECOND);
date_add('1997-12-31',INTERVAL 1 SECOND)
1997-12-31 00:00:01
select date_add('1997-12-31',INTERVAL 1 DAY);
date_add('1997-12-31',INTERVAL 1 DAY)
1998-01-01
select date_add(NULL,INTERVAL 100000 SECOND);
date_add(NULL,INTERVAL 100000 SECOND)
NULL
select date_add('1997-12-31 23:59:59',INTERVAL NULL SECOND);
date_add('1997-12-31 23:59:59',INTERVAL NULL SECOND)
NULL
select date_add('1997-12-31 23:59:59',INTERVAL NULL MINUTE_SECOND);
date_add('1997-12-31 23:59:59',INTERVAL NULL MINUTE_SECOND)
NULL
select date_add('9999-12-31 23:59:59',INTERVAL 1 SECOND);
date_add('9999-12-31 23:59:59',INTERVAL 1 SECOND)
NULL
select date_sub('0000-00-00 00:00:00',INTERVAL 1 SECOND);
date_sub('0000-00-00 00:00:00',INTERVAL 1 SECOND)
NULL
select date_add('1998-01-30',Interval 1 month);
date_add('1998-01-30',Interval 1 month)
1998-02-28
select date_add('1998-01-30',Interval '2:1' year_month);
date_add('1998-01-30',Interval '2:1' year_month)
2000-02-29
select date_add('1996-02-29',Interval '1' year);
date_add('1996-02-29',Interval '1' year)
1997-02-28
select extract(YEAR FROM '1999-01-02 10:11:12');
extract(YEAR FROM '1999-01-02 10:11:12')
1999
select extract(YEAR_MONTH FROM '1999-01-02');
extract(YEAR_MONTH FROM '1999-01-02')
199901
select extract(DAY FROM '1999-01-02');
extract(DAY FROM '1999-01-02')
2
select extract(DAY_HOUR FROM '1999-01-02 10:11:12');
extract(DAY_HOUR FROM '1999-01-02 10:11:12')
210
select extract(DAY_MINUTE FROM '02 10:11:12');
extract(DAY_MINUTE FROM '02 10:11:12')
NULL
select extract(DAY_SECOND FROM '225 10:11:12');
extract(DAY_SECOND FROM '225 10:11:12')
NULL
select extract(HOUR FROM '1999-01-02 10:11:12');
extract(HOUR FROM '1999-01-02 10:11:12')
10
select extract(HOUR_MINUTE FROM '10:11:12');
extract(HOUR_MINUTE FROM '10:11:12')
1011
select extract(HOUR_SECOND FROM '10:11:12');
extract(HOUR_SECOND FROM '10:11:12')
101112
select extract(MINUTE FROM '10:11:12');
extract(MINUTE FROM '10:11:12')
11
select extract(MINUTE_SECOND FROM '10:11:12');
extract(MINUTE_SECOND FROM '10:11:12')
1112
select extract(SECOND FROM '1999-01-02 10:11:12');
extract(SECOND FROM '1999-01-02 10:11:12')
12
select extract(MONTH FROM '2001-02-00');
extract(MONTH FROM '2001-02-00')
NULL
SELECT EXTRACT(QUARTER FROM '2004-01-15') AS quarter;
quarter
1
SELECT EXTRACT(QUARTER FROM '2004-02-15') AS quarter;
quarter
1
SELECT EXTRACT(QUARTER FROM '2004-03-15') AS quarter;
quarter
1
SELECT EXTRACT(QUARTER FROM '2004-04-15') AS quarter;
quarter
2
SELECT EXTRACT(QUARTER FROM '2004-05-15') AS quarter;
quarter
2
SELECT EXTRACT(QUARTER FROM '2004-06-15') AS quarter;
quarter
2
SELECT EXTRACT(QUARTER FROM '2004-07-15') AS quarter;
quarter
3
SELECT EXTRACT(QUARTER FROM '2004-08-15') AS quarter;
quarter
3
SELECT EXTRACT(QUARTER FROM '2004-09-15') AS quarter;
quarter
3
SELECT EXTRACT(QUARTER FROM '2004-10-15') AS quarter;
quarter
4
SELECT EXTRACT(QUARTER FROM '2004-11-15') AS quarter;
quarter
4
SELECT EXTRACT(QUARTER FROM '2004-12-15') AS quarter;
quarter
4
SELECT DATE_SUB(str_to_date('9999-12-31 00:01:00','%Y-%m-%d %H:%i:%s'), INTERVAL 1 MINUTE);
DATE_SUB(str_to_date('9999-12-31 00:01:00','%Y-%m-%d %H:%i:%s'), INTERVAL 1 MINUTE)
9999-12-31 00:00:00
SELECT DATE_ADD(str_to_date('9999-12-30 23:59:00','%Y-%m-%d %H:%i:%s'), INTERVAL 1 MINUTE);
DATE_ADD(str_to_date('9999-12-30 23:59:00','%Y-%m-%d %H:%i:%s'), INTERVAL 1 MINUTE)
9999-12-31 00:00:00
create table t1 (ctime varchar(20));
insert into t1 values ('2001-01-12 12:23:40');
select ctime from t1 where extract(MONTH FROM ctime) = 1 AND extract(YEAR FROM ctime) = 2001;
ctime
2001-01-12 12:23:40
drop table t1;
create table t1 (id int);
create table t2 (id int, date date);
insert into t1 values (1);
insert into t2 values (1, '0000-00-00');
insert into t1 values (2);
insert into t2 values (2, '2000-01-01');
drop table t1,t2;
create table t1 (d date, dt datetime, t timestamp, c char(10));
insert into t1 values ('0000-00-00', '0000-00-00', '0000-00-00', '0000-00-00');
select extract(MONTH FROM '0000-00-00'),extract(MONTH FROM d),extract(MONTH FROM dt),extract(MONTH FROM t),extract(MONTH FROM c) from t1;
extract(MONTH FROM '0000-00-00')	extract(MONTH FROM d)	extract(MONTH FROM dt)	extract(MONTH FROM t)	extract(MONTH FROM c)
0	0	0	0	0
drop table t1;
CREATE TABLE t1 ( `start` datetime default NULL);
INSERT INTO t1 VALUES ('2002-10-21 00:00:00'),('2002-10-28 00:00:00'),('2002-11-04 00:00:00');
CREATE TABLE t2 ( ctime1 timestamp NOT NULL, ctime2 timestamp NOT NULL);
INSERT INTO t2 VALUES (20021029165106,20021105164731);
CREATE TABLE t3 (ctime1 char(19) NOT NULL, ctime2 char(19) NOT NULL);
INSERT INTO t3 VALUES ('2002-10-29 16:51:06','2002-11-05 16:47:31');
select * from t1, t2 where t1.`start` between t2.ctime1 and t2.ctime2;
start	ctime1	ctime2
2002-11-04 00:00:00	2002-10-29 16:51:06	2002-11-05 16:47:31
select * from t1, t2 where t1.`start` >= t2.ctime1 and t1.`start` <= t2.ctime2;
start	ctime1	ctime2
2002-11-04 00:00:00	2002-10-29 16:51:06	2002-11-05 16:47:31
select * from t1, t3 where t1.`start` between t3.ctime1 and t3.ctime2;
start	ctime1	ctime2
2002-11-04 00:00:00	2002-10-29 16:51:06	2002-11-05 16:47:31
drop table t1,t2,t3;
select unix_timestamp(@a);
unix_timestamp(@a)
NULL
select unix_timestamp('1969-12-01 19:00:01');
unix_timestamp('1969-12-01 19:00:01')
0
select unix_timestamp('2039-01-20 01:00:00');
unix_timestamp('2039-01-20 01:00:00')
2179087200
select unix_timestamp('1968-01-20 01:00:00');
unix_timestamp('1968-01-20 01:00:00')
0
select unix_timestamp('2038-02-10 01:00:00');
unix_timestamp('2038-02-10 01:00:00')
2149365600
select unix_timestamp('1969-11-20 01:00:00');
unix_timestamp('1969-11-20 01:00:00')
0
select unix_timestamp('2038-01-20 01:00:00');
unix_timestamp('2038-01-20 01:00:00')
2147551200
select unix_timestamp('1969-12-30 01:00:00');
unix_timestamp('1969-12-30 01:00:00')
0
select unix_timestamp('2038-01-17 12:00:00');
unix_timestamp('2038-01-17 12:00:00')
2147331600
select unix_timestamp('1970-01-01 03:00:01');
unix_timestamp('1970-01-01 03:00:01')
1
select unix_timestamp('2038-01-19 07:14:07');
unix_timestamp('2038-01-19 07:14:07')
2147487247
CREATE TABLE t1 (datetime datetime, timestamp timestamp, date date, time time);
INSERT INTO t1 values ('2001-01-02 03:04:05', '2002-01-02 03:04:05', '2003-01-02', '06:07:08');
SELECT * from t1;
datetime	timestamp	date	time
2001-01-02 03:04:05	2002-01-02 03:04:05	2003-01-02	06:07:08
drop table t1;
SET @TMP='2007-08-01 12:22:49';
CREATE TABLE t1 (d DATETIME);
INSERT INTO t1 VALUES ('2007-08-01 12:22:59');
INSERT INTO t1 VALUES ('2007-08-01 12:23:01');
INSERT INTO t1 VALUES ('2007-08-01 12:23:20');
DROP TABLE t1;
set time_zone='-6:00';
create table t1(a timestamp);
insert into t1 values (19691231190001);
select * from t1;
a
1969-12-31 19:00:01
drop table t1;
create table t1(f1 date, f2 time, f3 datetime);
insert into t1 values ('2006-01-01', '12:01:01', '2006-01-01 12:01:01');
insert into t1 values ('2006-01-02', '12:01:02', '2006-01-02 12:01:02');
select f1 from t1 where f1 between CAST('2006-1-1' as date) and CAST(20060101 as date);
f1
2006-01-01
select f1 from t1 where f1 between cast('2006-1-1' as date) and cast('2006.1.1' as date);
f1
2006-01-01
select f1 from t1 where date(f1) between cast('2006-1-1' as date) and cast('2006.1.1' as date);
f1
2006-01-01
select f2 from t1 where f2 between cast('12:1:2' as time) and cast('12:2:2' as time);
f2
12:01:02
select f3 from t1 where f3 between cast('2006-1-1 12:1:1' as datetime) and cast('2006-1-1 12:1:2' as datetime);
f3
2006-01-01 12:01:01
select f1 from t1 where cast('2006-1-1' as date) between f1 and f3;
f1
2006-01-01
select f1 from t1 where cast('2006-1-1' as date) between date(f1) and date(f3);
f1
2006-01-01
select f1 from t1 where cast('2006-1-1' as date) between f1 and cast('zzz' as date);
f1
drop table t1;
SELECT EXTRACT(HOUR FROM '100000:02:03');
EXTRACT(HOUR FROM '100000:02:03')
NULL
SET character_set_results = NULL;
SHOW VARIABLES LIKE 'character_set_results';
Variable_name	Value
character_set_results	
CREATE TABLE testBug8868 (field1 DATE, field2 VARCHAR(32) CHARACTER SET BINARY);
INSERT INTO testBug8868 VALUES ('2006-09-04', 'abcd');
DROP TABLE testBug8868;
CREATE TABLE t1 (
a TIMESTAMP
);
INSERT INTO t1 VALUES (now()), (now());
DROP TABLE t1;
End of 4.1 tests
create table t1 (a timestamp default '2005-05-05 01:01:01',
b timestamp default '2005-05-05 01:01:01');
select a != b from t1;
a != b
drop table t1;
create table t1 (a datetime, i int, b datetime);
select a != b from t1;
a != b
drop table t1;
select timestampdiff(month,'2004-09-11','2004-09-11');
timestampdiff(month,'2004-09-11','2004-09-11')
0
select timestampdiff(month,'2004-09-11','2005-09-11');
timestampdiff(month,'2004-09-11','2005-09-11')
12
select timestampdiff(month,'2004-09-11','2006-09-11');
timestampdiff(month,'2004-09-11','2006-09-11')
24
select timestampdiff(month,'2004-09-11','2007-09-11');
timestampdiff(month,'2004-09-11','2007-09-11')
36
select timestampdiff(month,'2005-09-11','2004-09-11');
timestampdiff(month,'2005-09-11','2004-09-11')
-12
select timestampdiff(month,'2005-09-11','2003-09-11');
timestampdiff(month,'2005-09-11','2003-09-11')
-24
select timestampdiff(month,'2004-02-28','2005-02-28');
timestampdiff(month,'2004-02-28','2005-02-28')
12
select timestampdiff(month,'2004-02-29','2005-02-28');
timestampdiff(month,'2004-02-29','2005-02-28')
11
select timestampdiff(month,'2004-02-28','2005-02-28');
timestampdiff(month,'2004-02-28','2005-02-28')
12
select timestampdiff(month,'2004-03-29','2005-03-28');
timestampdiff(month,'2004-03-29','2005-03-28')
11
select timestampdiff(month,'2003-02-28','2004-02-29');
timestampdiff(month,'2003-02-28','2004-02-29')
12
select timestampdiff(month,'2003-02-28','2005-02-28');
timestampdiff(month,'2003-02-28','2005-02-28')
24
select timestampdiff(month,'1999-09-11','2001-10-10');
timestampdiff(month,'1999-09-11','2001-10-10')
24
select timestampdiff(month,'1999-09-11','2001-9-11');
timestampdiff(month,'1999-09-11','2001-9-11')
24
select timestampdiff(year,'1999-09-11','2001-9-11');
timestampdiff(year,'1999-09-11','2001-9-11')
2
select timestampdiff(year,'2004-02-28','2005-02-28');
timestampdiff(year,'2004-02-28','2005-02-28')
1
select timestampdiff(year,'2004-02-29','2005-02-28');
timestampdiff(year,'2004-02-29','2005-02-28')
0
CREATE TABLE t1 (id int NOT NULL PRIMARY KEY, day date);
CREATE TABLE t2 (id int NOT NULL PRIMARY KEY, day date);
INSERT INTO t1 VALUES
(1, '2005-06-01'), (2, '2005-02-01'), (3, '2005-07-01');
INSERT INTO t2 VALUES
(1, '2005-08-01'), (2, '2005-06-15'), (3, '2005-07-15');
SELECT * FROM t1, t2
WHERE t1.day BETWEEN
'2005.09.01' - INTERVAL 6 MONTH AND t2.day;
id	day	id	day
1	2005-06-01	1	2005-08-01
1	2005-06-01	2	2005-06-15
1	2005-06-01	3	2005-07-15
3	2005-07-01	1	2005-08-01
3	2005-07-01	3	2005-07-15
SELECT * FROM t1, t2
WHERE CAST(t1.day AS DATE) BETWEEN
'2005.09.01' - INTERVAL 6 MONTH AND t2.day;
id	day	id	day
1	2005-06-01	1	2005-08-01
1	2005-06-01	2	2005-06-15
1	2005-06-01	3	2005-07-15
3	2005-07-01	1	2005-08-01
3	2005-07-01	3	2005-07-15
DROP TABLE t1,t2;
set time_zone= @@global.time_zone;
select str_to_date('10:00 PM', '%h:%i %p') + INTERVAL 10 MINUTE;
str_to_date('10:00 PM', '%h:%i %p') + INTERVAL 10 MINUTE
22:10:00
create table t1 (field DATE);
insert into t1 values ('2006-11-06');
select * from t1 where field < '2006-11-06 04:08:36.0';
field
2006-11-06
select * from t1 where field = '2006-11-06 04:08:36.0';
field
select * from t1 where field = '2006-11-06';
field
2006-11-06
select * from t1 where CAST(field as DATETIME) < '2006-11-06 04:08:36.0';
field
2006-11-06
select * from t1 where CAST(field as DATE) < '2006-11-06 04:08:36.0';
field
2006-11-06
drop table t1;
CREATE TABLE t1 (a int, t1 time, t2 time, d date, PRIMARY KEY  (a));
INSERT INTO t1 VALUES (1, '10:00:00', NULL, NULL),
(2, '11:00:00', '11:15:00', '1972-02-06');
DROP TABLE t1;
#
# Bug #52315 part 2 : utc_date() crashes when system time > year 2037
#
SET TIMESTAMP=-147490000;
SELECT UTC_TIMESTAMP();
SET TIMESTAMP=2147483646;
SELECT UTC_TIMESTAMP();
SET TIMESTAMP=2147483647;
SELECT UTC_TIMESTAMP();
SET TIMESTAMP=0;
SELECT UTC_TIMESTAMP();
SET TIMESTAMP=-1;
SELECT UTC_TIMESTAMP();
SET TIMESTAMP=1;
SELECT UTC_TIMESTAMP();
SET TIMESTAMP=0;
End of 5.0 tests
select date_sub('0050-01-01 00:00:01',INTERVAL 2 SECOND);
date_sub('0050-01-01 00:00:01',INTERVAL 2 SECOND)
0049-12-31 23:59:59
select date_sub('0199-01-01 00:00:01',INTERVAL 2 SECOND);
date_sub('0199-01-01 00:00:01',INTERVAL 2 SECOND)
0198-12-31 23:59:59
select date_add('0199-12-31 23:59:59',INTERVAL 2 SECOND);
date_add('0199-12-31 23:59:59',INTERVAL 2 SECOND)
0200-01-01 00:00:01
select date_sub('0200-01-01 00:00:01',INTERVAL 2 SECOND);
date_sub('0200-01-01 00:00:01',INTERVAL 2 SECOND)
0199-12-31 23:59:59
select date_sub('0200-01-01 00:00:01',INTERVAL 1 SECOND);
date_sub('0200-01-01 00:00:01',INTERVAL 1 SECOND)
0200-01-01 00:00:00
select date_sub('0200-01-01 00:00:01',INTERVAL 2 SECOND);
date_sub('0200-01-01 00:00:01',INTERVAL 2 SECOND)
0199-12-31 23:59:59
select date_add('2001-01-01 23:59:59',INTERVAL -2000 YEAR);
date_add('2001-01-01 23:59:59',INTERVAL -2000 YEAR)
0001-01-01 23:59:59
select date_sub('50-01-01 00:00:01',INTERVAL 2 SECOND);
date_sub('50-01-01 00:00:01',INTERVAL 2 SECOND)
2049-12-31 23:59:59
select date_sub('90-01-01 00:00:01',INTERVAL 2 SECOND);
date_sub('90-01-01 00:00:01',INTERVAL 2 SECOND)
1989-12-31 23:59:59
select date_sub('0069-01-01 00:00:01',INTERVAL 2 SECOND);
date_sub('0069-01-01 00:00:01',INTERVAL 2 SECOND)
0068-12-31 23:59:59
select date_sub('0169-01-01 00:00:01',INTERVAL 2 SECOND);
date_sub('0169-01-01 00:00:01',INTERVAL 2 SECOND)
0168-12-31 23:59:59
CREATE TABLE t1(a DOUBLE NOT NULL);
INSERT INTO t1 VALUES (0),(9.216e-096);
# should not crash
DROP TABLE t1;
#
# Bug #52160: crash and inconsistent results when grouping
#             by a function and column
#
CREATE TABLE t1(a CHAR(10) NOT NULL);
INSERT INTO t1 VALUES (''),('');
DROP TABLE t1;
#
# Bug#11766112  59151:UNINITIALIZED VALUES IN EXTRACT_DATE_TIME WITH STR_TO_DATE(SPACE(..) ...
#
#
# Bug#11765216  58154: UNINITIALIZED VARIABLE FORMAT IN STR_TO_DATE FUNCTION
#
SET GLOBAL SQL_MODE='';
SET GLOBAL SQL_MODE=DEFAULT;
#
# Bug#11766087  59125: VALGRIND UNINITIALISED VALUE WARNING IN ULL2DEC, LONGLONG2DECIMAL
#
#
# Bug#11766126  59166: ANOTHER DATETIME VALGRIND UNINITIALIZED WARNING
#
SET @@global.sql_mode='';
SET @@global.sql_mode=DEFAULT;
#
# Bug#11766124  59164: VALGRIND: UNINITIALIZED VALUE IN NUMBER_TO_DATETIME
#
#
# Bug#11889186  60503: CRASH IN MAKE_DATE_TIME WITH DATE_FORMAT / STR_TO_DATE COMBINATION
#
SELECT DATE_FORMAT('0000-00-11', '%W');
DATE_FORMAT('0000-00-11', '%W')
NULL
SELECT DATE_FORMAT('0000-00-11', '%a');
DATE_FORMAT('0000-00-11', '%a')
NULL
SELECT DATE_FORMAT('0000-00-11', '%w');
DATE_FORMAT('0000-00-11', '%w')
NULL
#
# Bug#12403504  AFTER FIX FOR #11889186 : ASSERTION FAILED: DELSUM+(INT) Y/4-TEMP > 0
#
#
# Bug#12584302 AFTER FIX FOR #12403504: ASSERTION FAILED: DELSUM+(INT) Y/4-TEMP > 0,
#
#
# Bug #13098726 MY_TIME.C:786: CALC_DAYNR: ASSERTION `DELSUM+(INT)
# Y/4-TEMP > 0' FAILED
#
# BUG#13458237 INCONSISTENT HANDLING OF INVALIDE DATES WITH ZERO DAY
# SIMILAR TO '2009-10-00'
#
End of 5.1 tests
#
# BUG#43578 'MyISAM&Maria gives wrong rows with range access
# ORDER BY DESC on date index'
#
CREATE TABLE t1(c1 DATE NOT NULL PRIMARY KEY, c2 DATE NULL, c3 INT,
INDEX idx2(c2));
SET TIMESTAMP=1235553613;
SELECT * FROM t1;
c1	c2	c3
drop table t1;
End of 5.5 tests
#
# Bug#57039: constant subtime expression returns incorrect result.
#
CREATE TABLE t1 (`date_date` datetime NOT NULL);
INSERT INTO t1 VALUES ('2008-01-03 00:00:00'), ('2008-01-03 00:00:00');
DROP TABLE t1;
#
# Bug#57512 str_to_date crash...
#
#
# BUG#59895 - setting storage engine to null segfaults mysqld
#
#
# BUG#13354387 - CRASH IN IN MY_DECIMAL::OPERATOR FOR VIEW AND FUNCTION UNIX_TIMESTAMP
# Part1 (5.5)
SET time_zone='+03:00';
CREATE TABLE t1 (a DATETIME NOT NULL);
INSERT INTO t1 VALUES ('2009-09-20 07:32:39.06');
INSERT INTO t1 VALUES ('0000-00-00 00:00:00.00');
CREATE VIEW v1 AS SELECT * FROM t1;
SELECT CAST(UNIX_TIMESTAMP(a) AS DECIMAL(25,3)) AS c1 FROM v1 ORDER BY 1;
c1
0.000
1253421159.000
DROP VIEW v1;
DROP TABLE t1;
SET time_zone=DEFAULT;
#
# Bug #59686 crash in String::copy() with time data type
#
create table t1(a time);
insert into t1 values ('00:00:00'),('00:01:00');
select 1 from t1 where 1 < some (select cast(a as datetime) from t1);
1
1
1
drop table t1;
#
# End of 5.5 tests
#
#
# Start of 5.6 tests
#
#
# BUG#13545236 - ASSERT IN SEC_SINCE_EPOCH
#
CREATE TABLE t1 (a TIME NOT NULL);
INSERT INTO t1 VALUES ('04:39:24');
INSERT INTO t1 VALUES ('00:20:09');
DROP TABLE t1;
CREATE TABLE t1 (a TIME);
INSERT INTO t1 VALUES ('00:00:00');
DROP TABLE t1;
#
# BUG#13354387 - CRASH IN IN MY_DECIMAL::OPERATOR FOR VIEW AND FUNCTION UNIX_TIMESTAMP
# Part2 (5.6)
CREATE TABLE t1 (a VARCHAR(32) NOT NULL);
INSERT INTO t1 VALUES ('a');
SELECT 1 FROM t1 GROUP BY @a:=UNIX_TIMESTAMP(a);
1
1
SELECT a, UNIX_TIMESTAMP(a), UNIX_TIMESTAMP('a') FROM t1;
a	UNIX_TIMESTAMP(a)	UNIX_TIMESTAMP('a')
a	0.000000	0.000000
DELETE FROM t1;
INSERT INTO t1 VALUES ('5000-01-01 00:00:00');
SELECT a, UNIX_TIMESTAMP(a), UNIX_TIMESTAMP('5000-01-01 00:00:00') FROM t1;
a	UNIX_TIMESTAMP(a)	UNIX_TIMESTAMP('5000-01-01 00:00:00')
5000-01-01 00:00:00	95617555200.000000	95617555200
DROP TABLE t1;
#
# Bug#13988413 CRASH/ASSERTION AFTER INVALID MEMORY READ
#              IN MY_USECONDS_TO_STR
#
#
# Bug#13982125 BUFFER OVERFLOW OF VARIABLE BUF IN
#              ITEM_FUNC_MAKETIME::GET_TIME
#
#
# Bug#14042545 ASSERTION FAILED: DEC <= 6 IN MY_USECONDS_TO_STR()
#
# bug 
drop table if exists t1;
Warnings:
Note	1051	Unknown table 'test.t1'
create table t1(c1 int );
insert into t1 values(1);
UPDATE  t1 SET c1 = DATE ( 1 );
ERROR 22007: Incorrect value
drop table t1;
sysdate test
create table datetime_t(c1 datetime(6), c12 int, c2 datetime(6), source varchar(32));
insert into datetime_t values(now(), sleep(1), now(), 'now1');
insert into datetime_t values(now(1), sleep(2), now(1), 'now2');
insert into datetime_t values(current_timestamp(), sleep(1), current_timestamp(0), 'current_timestamp1');
insert into datetime_t values(current_timestamp(1), sleep(2), current_timestamp(1), 'current_timestamp2');
insert into datetime_t values(sysdate(), sleep(1), sysdate(), 'sysdate1');
insert into datetime_t values(sysdate(1), sleep(2), sysdate(1), 'sysdate2');
select distinct source from datetime_t where c1 != c2;
source
sysdate1
sysdate2
drop table datetime_t;
create table sysdate(c1 int);
ERROR 42000: You have an error in your SQL syntax; check the manual that corresponds to your OceanBase version for the right syntax to use near 'sysdate(c1 int)' at line 1
