#
# Test of function defaults for any server, including embedded.
# We run the same tests with different settings for better coverage.
#
#
# Function defaults run 1. No microsecond precision. MyISAM.
#
SET TIME_ZONE = '+00:00';
#
# Test of errors for column data types that dont support function
# defaults.
#
drop table if exists t1;
CREATE TABLE t1( a TINYINT DEFAULT CURRENT_TIMESTAMP );
ERROR 42000: Invalid default value for 'a'
CREATE TABLE t1( a SMALLINT DEFAULT CURRENT_TIMESTAMP );
ERROR 42000: Invalid default value for 'a'
CREATE TABLE t1( a MEDIUMINT DEFAULT CURRENT_TIMESTAMP );
ERROR 42000: Invalid default value for 'a'
CREATE TABLE t1( a INT DEFAULT CURRENT_TIMESTAMP );
ERROR 42000: Invalid default value for 'a'
CREATE TABLE t1( a BIGINT DEFAULT CURRENT_TIMESTAMP );
ERROR 42000: Invalid default value for 'a'
CREATE TABLE t1( a FLOAT DEFAULT CURRENT_TIMESTAMP );
ERROR 42000: Invalid default value for 'a'
CREATE TABLE t1( a DECIMAL DEFAULT CURRENT_TIMESTAMP );
ERROR 42000: Invalid default value for 'a'
CREATE TABLE t1( a DATE DEFAULT CURRENT_TIMESTAMP );
ERROR 42000: Invalid default value for 'a'
CREATE TABLE t1( a TIME DEFAULT CURRENT_TIMESTAMP );
ERROR 42000: Invalid default value for 'a'
CREATE TABLE t1( a YEAR DEFAULT CURRENT_TIMESTAMP );
ERROR 42000: Invalid default value for 'a'
CREATE TABLE t1( a TINYINT ON UPDATE CURRENT_TIMESTAMP );
ERROR HY000: Invalid ON UPDATE clause for 'a' column
CREATE TABLE t1( a SMALLINT ON UPDATE CURRENT_TIMESTAMP );
ERROR HY000: Invalid ON UPDATE clause for 'a' column
CREATE TABLE t1( a MEDIUMINT ON UPDATE CURRENT_TIMESTAMP );
ERROR HY000: Invalid ON UPDATE clause for 'a' column
CREATE TABLE t1( a INT ON UPDATE CURRENT_TIMESTAMP );
ERROR HY000: Invalid ON UPDATE clause for 'a' column
CREATE TABLE t1( a BIGINT ON UPDATE CURRENT_TIMESTAMP );
ERROR HY000: Invalid ON UPDATE clause for 'a' column
CREATE TABLE t1( a FLOAT ON UPDATE CURRENT_TIMESTAMP );
ERROR HY000: Invalid ON UPDATE clause for 'a' column
CREATE TABLE t1( a DECIMAL ON UPDATE CURRENT_TIMESTAMP );
ERROR HY000: Invalid ON UPDATE clause for 'a' column
CREATE TABLE t1( a DATE ON UPDATE CURRENT_TIMESTAMP );
ERROR HY000: Invalid ON UPDATE clause for 'a' column
CREATE TABLE t1( a TIME ON UPDATE CURRENT_TIMESTAMP );
ERROR HY000: Invalid ON UPDATE clause for 'a' column
CREATE TABLE t1( a YEAR ON UPDATE CURRENT_TIMESTAMP );
ERROR HY000: Invalid ON UPDATE clause for 'a' column
#
# Test that the default clause behaves like NOW() regarding time zones.
#
CREATE TABLE t1 (
a TIMESTAMP NOT NULL DEFAULT CURRENT_TIMESTAMP ON UPDATE CURRENT_TIMESTAMP,
b TIMESTAMP NOT NULL DEFAULT CURRENT_TIMESTAMP,
c TIMESTAMP NOT NULL DEFAULT '0000-00-00 00:00:00' ON UPDATE CURRENT_TIMESTAMP,
d TIMESTAMP NULL,
e DATETIME DEFAULT CURRENT_TIMESTAMP ON UPDATE CURRENT_TIMESTAMP,
f DATETIME DEFAULT CURRENT_TIMESTAMP,
g DATETIME ON UPDATE CURRENT_TIMESTAMP,
h DATETIME
);
# 2011-09-27 14:11:08 UTC
SET TIMESTAMP = 1317132668.654321;
SET @old_time_zone = @@TIME_ZONE;
SET TIME_ZONE = '+05:00';
INSERT INTO t1( d, h ) VALUES ( NOW(), NOW() );
# 1989-05-13 01:02:03
SET TIMESTAMP = 611017323.543212;
UPDATE t1 SET d = NOW(), h = NOW();
SET TIME_ZONE = @old_time_zone;
DROP TABLE t1;
#
# Test of several TIMESTAMP columns with different function defaults.
#
CREATE TABLE t1 (
a TIMESTAMP NOT NULL DEFAULT CURRENT_TIMESTAMP ON UPDATE CURRENT_TIMESTAMP,
b TIMESTAMP NOT NULL DEFAULT CURRENT_TIMESTAMP ON UPDATE CURRENT_TIMESTAMP,
c TIMESTAMP NOT NULL DEFAULT CURRENT_TIMESTAMP,
d TIMESTAMP NOT NULL DEFAULT '0000-00-00 00:00:00' ON UPDATE CURRENT_TIMESTAMP,
e TIMESTAMP NOT NULL DEFAULT '0000-00-00 00:00:00' ON UPDATE CURRENT_TIMESTAMP,
f INT
);
# 2011-04-19 07:22:02 UTC
SET TIMESTAMP = 1303197722.534231;
INSERT INTO t1 ( f ) VALUES (1);
SELECT * FROM t1;
# 2011-04-19 07:23:18 UTC
SET TIMESTAMP = 1303197798.132435;
UPDATE t1 SET f = 2;
SELECT * FROM t1;
DROP TABLE t1;
#
# Test of inserted values out of order.
#
CREATE TABLE t1 (
a INT,
b TIMESTAMP NOT NULL DEFAULT CURRENT_TIMESTAMP ON UPDATE CURRENT_TIMESTAMP,
c TIMESTAMP NOT NULL DEFAULT CURRENT_TIMESTAMP,
d TIMESTAMP NOT NULL DEFAULT '0000-00-00 00:00:00' ON UPDATE CURRENT_TIMESTAMP,
e TIMESTAMP NULL,
f DATETIME,
g DATETIME DEFAULT CURRENT_TIMESTAMP,
h DATETIME ON UPDATE CURRENT_TIMESTAMP,
i DATETIME DEFAULT CURRENT_TIMESTAMP ON UPDATE CURRENT_TIMESTAMP,
j INT
);
# 2011-04-19 07:22:02 UTC
SET TIMESTAMP = 1303197722.534231;
INSERT INTO t1 ( j, a ) VALUES ( 1, 1 );
SELECT * FROM t1;
DROP TABLE t1;
#
# Test of ON DUPLICATE KEY UPDATE
#
CREATE TABLE t1 (
a INT PRIMARY KEY,
b INT,
c TIMESTAMP NOT NULL DEFAULT CURRENT_TIMESTAMP ON UPDATE CURRENT_TIMESTAMP,
d TIMESTAMP NOT NULL DEFAULT CURRENT_TIMESTAMP,
e TIMESTAMP NOT NULL DEFAULT '0000-00-00 00:00:00' ON UPDATE CURRENT_TIMESTAMP,
f TIMESTAMP NOT NULL DEFAULT '1986-09-27 03:00:00.098765',
g TIMESTAMP NULL,
h DATETIME DEFAULT CURRENT_TIMESTAMP ON UPDATE CURRENT_TIMESTAMP,
i DATETIME DEFAULT CURRENT_TIMESTAMP,
j DATETIME ON UPDATE CURRENT_TIMESTAMP,
k DATETIME NULL,
l DATETIME DEFAULT '1986-09-27 03:00:00.098765'
);
# 1977-12-21 23:00:00 UTC
SET TIMESTAMP = 251593200.192837;
INSERT INTO t1(a) VALUES (1) ON DUPLICATE KEY UPDATE b = 2;
SELECT * FROM t1;
# 1975-05-21 23:00:00 UTC
SET TIMESTAMP = 169945200.918273;
INSERT INTO t1(a) VALUES (1) ON DUPLICATE KEY UPDATE b = 2;
SELECT * FROM t1;
# 1973-08-14 09:11:22 UTC
SET TIMESTAMP = 114167482.534231;
INSERT INTO t1(a) VALUES (2) ON DUPLICATE KEY UPDATE b = 2;
SELECT * FROM t1;
DROP TABLE t1;
CREATE TABLE t1 ( a INT PRIMARY KEY, b INT, c TIMESTAMP NOT NULL DEFAULT CURRENT_TIMESTAMP ON UPDATE CURRENT_TIMESTAMP );
# 2011-04-19 07:23:18 UTC
SET TIMESTAMP = 1303197798.945156;
INSERT INTO t1 VALUES
(1, 0, '2001-01-01 01:01:01.111111'),
(2, 0, '2002-02-02 02:02:02.222222'),
(3, 0, '2003-03-03 03:03:03.333333');
SELECT * FROM t1;
a	b	c
1	0	2001-01-01 01:01:01
2	0	2002-02-02 02:02:02
3	0	2003-03-03 03:03:03
UPDATE t1 SET b = 2, c = c WHERE a = 2;
SELECT * FROM t1;
INSERT INTO t1 (a) VALUES (4);
SELECT * FROM t1;
UPDATE t1 SET c = '2004-04-04 04:04:04.444444' WHERE a = 4;
SELECT * FROM t1;
INSERT INTO t1 ( a ) VALUES ( 3 ), ( 5 ) ON DUPLICATE KEY UPDATE b = 3, c = c;
SELECT * FROM t1;
INSERT INTO t1 (a, c) VALUES
(4, '2004-04-04 00:00:00.444444'),
(6, '2006-06-06 06:06:06.666666')
ON DUPLICATE KEY UPDATE b = 4;
SELECT * FROM t1;
DROP TABLE t1;
#
# Test of REPLACE INTO executed as UPDATE.
#
CREATE TABLE t1 (
a INT PRIMARY KEY,
b TIMESTAMP NOT NULL DEFAULT CURRENT_TIMESTAMP ON UPDATE CURRENT_TIMESTAMP,
c DATETIME  DEFAULT CURRENT_TIMESTAMP ON UPDATE CURRENT_TIMESTAMP,
d TIMESTAMP NOT NULL DEFAULT CURRENT_TIMESTAMP,
e DATETIME  DEFAULT CURRENT_TIMESTAMP,
f TIMESTAMP NOT NULL DEFAULT '0000-00-00 00:00:00' ON UPDATE CURRENT_TIMESTAMP,
g DATETIME  ON UPDATE CURRENT_TIMESTAMP,
h TIMESTAMP NULL,
i DATETIME
);
# 1970-09-21 09:11:12 UTC
SET TIMESTAMP = 22756272.163584;
REPLACE INTO t1 ( a ) VALUES ( 1 );
SELECT * FROM t1;
# 1970-11-10 14:16:17 UTC
SET TIMESTAMP = 27094577.852954;
REPLACE INTO t1 ( a ) VALUES ( 1 );
SELECT * FROM t1;
DROP TABLE t1;
#
# Test of insertion of NULL, DEFAULT and an empty row for DEFAULT
# CURRENT_TIMESTAMP.
#
CREATE TABLE t1 (
a TIMESTAMP NOT NULL DEFAULT CURRENT_TIMESTAMP ON UPDATE CURRENT_TIMESTAMP,
b DATETIME DEFAULT CURRENT_TIMESTAMP,
c INT
);
# 2011-04-20 09:53:41 UTC
SET TIMESTAMP = 1303293221.163578;
INSERT INTO t1 VALUES (NULL, NULL, 1), (DEFAULT, DEFAULT, 2);
INSERT INTO t1 ( a, b, c ) VALUES (NULL, NULL, 3), (DEFAULT, DEFAULT, 4);
SELECT * FROM t1;
SET TIME_ZONE = '+03:00';
SELECT * FROM t1;
SET TIME_ZONE = '+00:00';
DROP TABLE t1;
# 2011-04-20 07:05:39 UTC
SET TIMESTAMP = 1303283139.195624;
CREATE TABLE t1 (
a TIMESTAMP NOT NULL DEFAULT '2010-10-11 12:34:56' ON UPDATE CURRENT_TIMESTAMP,
b DATETIME DEFAULT '2010-10-11 12:34:56'
);
INSERT INTO t1          VALUES (NULL, NULL), (DEFAULT, DEFAULT);
INSERT INTO t1 ( a, b ) VALUES (NULL, NULL), (DEFAULT, DEFAULT);
SELECT * FROM t1;
DROP TABLE t1;
# 2011-04-20 09:53:41 UTC
SET TIMESTAMP = 1303293221.136952;
CREATE TABLE t1 (
a TIMESTAMP NOT NULL DEFAULT CURRENT_TIMESTAMP ON UPDATE CURRENT_TIMESTAMP,
b TIMESTAMP NOT NULL DEFAULT CURRENT_TIMESTAMP,
c TIMESTAMP NOT NULL DEFAULT '0000-00-00 00:00:00' ON UPDATE CURRENT_TIMESTAMP,
d TIMESTAMP NOT NULL DEFAULT '1986-09-27 03:00:00.098765',
e TIMESTAMP NULL,
f DATETIME DEFAULT CURRENT_TIMESTAMP ON UPDATE CURRENT_TIMESTAMP,
g DATETIME DEFAULT CURRENT_TIMESTAMP,
h DATETIME ON UPDATE CURRENT_TIMESTAMP,
i DATETIME NULL,
j DATETIME DEFAULT '1986-09-27 03:00:00.098765'
);
INSERT INTO t1 VALUES ();
SELECT * FROM t1;
DROP TABLE t1;
#
# Test of multiple-table UPDATE for DEFAULT CURRENT_TIMESTAMP
#
CREATE TABLE t1 (
a TIMESTAMP NOT NULL DEFAULT CURRENT_TIMESTAMP ON UPDATE CURRENT_TIMESTAMP,
b DATETIME DEFAULT CURRENT_TIMESTAMP,
c INT
);
INSERT INTO t1 ( c ) VALUES (1);
SELECT * FROM t1;
# 2011-04-20 17:06:13 UTC
SET TIMESTAMP = 1303311973.163587;
SELECT * FROM t1;
DROP TABLE t1;
CREATE TABLE t1 (
a TIMESTAMP NOT NULL DEFAULT CURRENT_TIMESTAMP,
b TIMESTAMP NOT NULL DEFAULT '0000-00-00 00:00:00' ON UPDATE CURRENT_TIMESTAMP,
c DATETIME  DEFAULT   CURRENT_TIMESTAMP,
d DATETIME  ON UPDATE CURRENT_TIMESTAMP,
e INT
);
drop table if exists t2;
CREATE TABLE t2 (
f INT,
g DATETIME  ON UPDATE CURRENT_TIMESTAMP,
h DATETIME  DEFAULT   CURRENT_TIMESTAMP,
i TIMESTAMP NOT NULL DEFAULT '0000-00-00 00:00:00' ON UPDATE CURRENT_TIMESTAMP,
j TIMESTAMP NOT NULL DEFAULT CURRENT_TIMESTAMP
);
# 1995-03-11 00:02:03 UTC
SET TIMESTAMP = 794880123.195676;
INSERT INTO t1 ( e ) VALUES ( 1 ), ( 2 );
INSERT INTO t2 ( f ) VALUES ( 1 ), ( 2 );
SELECT * FROM t1;
SELECT * FROM t2;
# 1980-12-13 02:02:01 UTC
SET TIMESTAMP = 345520921.196755;
SELECT * FROM t1;
SELECT * FROM t2;
DROP TABLE t1, t2;
#
# Test of multiple table update with temporary table and on the fly.
#
CREATE TABLE t1 (
a TIMESTAMP NOT NULL DEFAULT '0000-00-00 00:00:00' ON UPDATE CURRENT_TIMESTAMP,
b DATETIME ON UPDATE CURRENT_TIMESTAMP,
c INT,
d INT
);
CREATE TABLE t2 (
a TIMESTAMP NOT NULL DEFAULT '0000-00-00 00:00:00' ON UPDATE CURRENT_TIMESTAMP,
b DATETIME ON UPDATE CURRENT_TIMESTAMP,
c INT KEY,
d INT
);
INSERT INTO t1 ( c ) VALUES (1), (2);
INSERT INTO t2 ( c ) VALUES (1), (2);
# Test of multiple table update done on the fly
# 2011-04-20 15:06:13 UTC
SET TIMESTAMP = 1303311973.194685;
SELECT * FROM t1;
SELECT * FROM t2;
# Test of multiple table update done with temporary table.
# 1979-01-15 03:02:01
SET TIMESTAMP = 285213721.134679;
SELECT * FROM t1;
SELECT * FROM t2;
DROP TABLE t1, t2;
#
# Test of ON UPDATE CURRENT_TIMESTAMP.
#
CREATE TABLE t1 (
a TIMESTAMP NOT NULL DEFAULT '0000-00-00 00:00:00' ON UPDATE CURRENT_TIMESTAMP,
b DATETIME ON UPDATE CURRENT_TIMESTAMP,
c INT
);
# 2011-04-20 09:53:41 UTC
SET TIMESTAMP = 1303293221.794613;
INSERT INTO t1 ( c ) VALUES ( 1 );
SELECT * FROM t1;
UPDATE t1 SET c = 1;
SELECT * FROM t1;
a	b	c
0000-00-00 00:00:00	NULL	1
UPDATE t1 SET c = 2;
SELECT * FROM t1;
#
# Test of multiple-table UPDATE for ON UPDATE CURRENT_TIMESTAMP
#
# 2011-04-20 15:06:13 UTC
SET TIMESTAMP = 1303311973.534231;
SELECT * FROM t1;
SELECT * FROM t1;
DROP TABLE t1;
#
# Test of a multiple-table update where only one table is updated and
# the updated table has a primary key.
#
drop table if exists t1,t2;
CREATE TABLE t1 ( a INT, b INT, PRIMARY KEY (a) );
INSERT INTO t1 VALUES (1, 1),(2, 2),(3, 3),(4, 4);
drop table if exists t2;
CREATE TABLE t2 ( a INT, b INT );
INSERT INTO t2 VALUES (1, 1),(2, 2),(3, 3),(4, 4),(5, 5);
SELECT * FROM t1;
a	b
1	1
2	2
3	3
4	4
SELECT * FROM t2;
a	b
1	1
2	2
3	3
4	4
5	5
DROP TABLE t1, t2;
#
# Test of ALTER TABLE, reordering columns.
#
CREATE TABLE t1 ( a TIMESTAMP NOT NULL DEFAULT CURRENT_TIMESTAMP ON UPDATE CURRENT_TIMESTAMP, b INT );
SHOW CREATE TABLE t1;
Table	Create Table
t1	CREATE TABLE `t1` (
  `a` timestamp NOT NULL DEFAULT CURRENT_TIMESTAMP ON UPDATE CURRENT_TIMESTAMP,
  `b` int(11) DEFAULT NULL
) DEFAULT CHARSET = utf8mb4 COMPRESSION = 'lz4_1.0' REPLICA_NUM = 1 BLOCK_SIZE = 16384 USE_BLOOM_FILTER = FALSE TABLET_SIZE = 134217728 PCTFREE = 10
DROP TABLE t1;
CREATE TABLE t1 ( a INT, b TIMESTAMP NOT NULL DEFAULT CURRENT_TIMESTAMP ON UPDATE CURRENT_TIMESTAMP, c TIMESTAMP NULL );
SHOW CREATE TABLE t1;
Table	Create Table
t1	CREATE TABLE `t1` (
  `a` int(11) DEFAULT NULL,
  `b` timestamp NOT NULL DEFAULT CURRENT_TIMESTAMP ON UPDATE CURRENT_TIMESTAMP,
  `c` timestamp NULL DEFAULT NULL
) DEFAULT CHARSET = utf8mb4 COMPRESSION = 'lz4_1.0' REPLICA_NUM = 1 BLOCK_SIZE = 16384 USE_BLOOM_FILTER = FALSE TABLET_SIZE = 134217728 PCTFREE = 10
DROP TABLE t1;
CREATE TABLE t1 ( a INT, b TIMESTAMP NULL );
SHOW CREATE TABLE t1;
Table	Create Table
t1	CREATE TABLE `t1` (
  `a` int(11) DEFAULT NULL,
  `b` timestamp NULL DEFAULT NULL
) DEFAULT CHARSET = utf8mb4 COMPRESSION = 'lz4_1.0' REPLICA_NUM = 1 BLOCK_SIZE = 16384 USE_BLOOM_FILTER = FALSE TABLET_SIZE = 134217728 PCTFREE = 10
DROP TABLE t1;
CREATE TABLE t1 ( a TIMESTAMP NOT NULL DEFAULT CURRENT_TIMESTAMP ON UPDATE CURRENT_TIMESTAMP, b TIMESTAMP NULL );
SHOW CREATE TABLE t1;
Table	Create Table
t1	CREATE TABLE `t1` (
  `a` timestamp NOT NULL DEFAULT CURRENT_TIMESTAMP ON UPDATE CURRENT_TIMESTAMP,
  `b` timestamp NULL DEFAULT NULL
) DEFAULT CHARSET = utf8mb4 COMPRESSION = 'lz4_1.0' REPLICA_NUM = 1 BLOCK_SIZE = 16384 USE_BLOOM_FILTER = FALSE TABLET_SIZE = 134217728 PCTFREE = 10
DROP TABLE t1;
CREATE TABLE t1 ( a TIMESTAMP NOT NULL DEFAULT CURRENT_TIMESTAMP ON UPDATE CURRENT_TIMESTAMP, b TIMESTAMP NULL );
SHOW CREATE TABLE t1;
Table	Create Table
t1	CREATE TABLE `t1` (
  `a` timestamp NOT NULL DEFAULT CURRENT_TIMESTAMP ON UPDATE CURRENT_TIMESTAMP,
  `b` timestamp NULL DEFAULT NULL
) DEFAULT CHARSET = utf8mb4 COMPRESSION = 'lz4_1.0' REPLICA_NUM = 1 BLOCK_SIZE = 16384 USE_BLOOM_FILTER = FALSE TABLET_SIZE = 134217728 PCTFREE = 10
DROP TABLE t1;
CREATE TABLE t1 ( a TIMESTAMP NOT NULL DEFAULT '0000-00-00 00:00:00' ON UPDATE NOW(), b INT, c TIMESTAMP NULL );
SHOW CREATE TABLE t1;
Table	Create Table
t1	CREATE TABLE `t1` (
  `a` timestamp NOT NULL DEFAULT '0000-00-00 00:00:00' ON UPDATE CURRENT_TIMESTAMP,
  `b` int(11) DEFAULT NULL,
  `c` timestamp NULL DEFAULT NULL
) DEFAULT CHARSET = utf8mb4 COMPRESSION = 'lz4_1.0' REPLICA_NUM = 1 BLOCK_SIZE = 16384 USE_BLOOM_FILTER = FALSE TABLET_SIZE = 134217728 PCTFREE = 10
DROP TABLE t1;
CREATE TABLE t1 ( a TIMESTAMP NOT NULL DEFAULT '0000-00-00 00:00:00' ON UPDATE NOW(), b INT, c TIMESTAMP NULL );
SHOW CREATE TABLE t1;
Table	Create Table
t1	CREATE TABLE `t1` (
  `a` timestamp NOT NULL DEFAULT '0000-00-00 00:00:00' ON UPDATE CURRENT_TIMESTAMP,
  `b` int(11) DEFAULT NULL,
  `c` timestamp NULL DEFAULT NULL
) DEFAULT CHARSET = utf8mb4 COMPRESSION = 'lz4_1.0' REPLICA_NUM = 1 BLOCK_SIZE = 16384 USE_BLOOM_FILTER = FALSE TABLET_SIZE = 134217728 PCTFREE = 10
DROP TABLE t1;
CREATE TABLE t1 ( a TIMESTAMP NOT NULL DEFAULT NOW() ON UPDATE CURRENT_TIMESTAMP, b INT, c TIMESTAMP NULL );
SHOW CREATE TABLE t1;
Table	Create Table
t1	CREATE TABLE `t1` (
  `a` timestamp NOT NULL DEFAULT CURRENT_TIMESTAMP ON UPDATE CURRENT_TIMESTAMP,
  `b` int(11) DEFAULT NULL,
  `c` timestamp NULL DEFAULT NULL
) DEFAULT CHARSET = utf8mb4 COMPRESSION = 'lz4_1.0' REPLICA_NUM = 1 BLOCK_SIZE = 16384 USE_BLOOM_FILTER = FALSE TABLET_SIZE = 134217728 PCTFREE = 10
DROP TABLE t1;
CREATE TABLE t1 ( a TIMESTAMP NOT NULL DEFAULT NOW() ON UPDATE CURRENT_TIMESTAMP, b INT, c TIMESTAMP NULL );
SHOW CREATE TABLE t1;
Table	Create Table
t1	CREATE TABLE `t1` (
  `a` timestamp NOT NULL DEFAULT CURRENT_TIMESTAMP ON UPDATE CURRENT_TIMESTAMP,
  `b` int(11) DEFAULT NULL,
  `c` timestamp NULL DEFAULT NULL
) DEFAULT CHARSET = utf8mb4 COMPRESSION = 'lz4_1.0' REPLICA_NUM = 1 BLOCK_SIZE = 16384 USE_BLOOM_FILTER = FALSE TABLET_SIZE = 134217728 PCTFREE = 10
DROP TABLE t1;
#
# Test of ALTER TABLE, adding columns.
#
CREATE TABLE t1 ( a INT );
ALTER TABLE t1 ADD COLUMN b TIMESTAMP NOT NULL DEFAULT CURRENT_TIMESTAMP ON UPDATE CURRENT_TIMESTAMP;
SHOW CREATE TABLE t1;
Table	Create Table
t1	CREATE TABLE `t1` (
  `a` int(11) DEFAULT NULL,
  `b` timestamp NOT NULL DEFAULT CURRENT_TIMESTAMP ON UPDATE CURRENT_TIMESTAMP
) DEFAULT CHARSET = utf8mb4 COMPRESSION = 'lz4_1.0' REPLICA_NUM = 1 BLOCK_SIZE = 16384 USE_BLOOM_FILTER = FALSE TABLET_SIZE = 134217728 PCTFREE = 10
DROP TABLE t1;
#
# Test of INSERT SELECT.
#
CREATE TABLE t1 (
a TIMESTAMP NOT NULL DEFAULT CURRENT_TIMESTAMP ON UPDATE CURRENT_TIMESTAMP,
b TIMESTAMP NOT NULL DEFAULT CURRENT_TIMESTAMP ON UPDATE CURRENT_TIMESTAMP,
c DATETIME DEFAULT CURRENT_TIMESTAMP ON UPDATE CURRENT_TIMESTAMP,
d DATETIME DEFAULT CURRENT_TIMESTAMP ON UPDATE CURRENT_TIMESTAMP
);
CREATE TABLE t2 (
placeholder1 INT,
placeholder2 INT,
placeholder3 INT,
placeholder4 INT,
a TIMESTAMP NOT NULL DEFAULT CURRENT_TIMESTAMP ON UPDATE CURRENT_TIMESTAMP,
b TIMESTAMP NOT NULL DEFAULT '0000-00-00 00:00:00',
c DATETIME,
d DATETIME
);
# 1977-08-16 15:30:01 UTC
SET TIMESTAMP = 240589801.654312;
INSERT INTO t2 (a, b, c, d) VALUES (
'1977-08-16 15:30:01.123456',
'1977-08-16 15:30:01.234567',
'1977-08-16 15:30:01.345678',
'1977-08-16 15:30:01.456789'
);
# 1986-09-27 01:00:00 UTC
SET TIMESTAMP = 528166800.132435;
SELECT * FROM t1;
DROP TABLE t1, t2;
#
# Test of CREATE TABLE SELECT.
#
# We test that the columns of the source table are used to determine
# function defaults for the receiving table.
#
# 1970-04-11 20:13:57 UTC
SET TIMESTAMP = 8712837.657898;
CREATE TABLE t1 (
a TIMESTAMP NOT NULL DEFAULT CURRENT_TIMESTAMP ON UPDATE CURRENT_TIMESTAMP,
b TIMESTAMP NOT NULL DEFAULT CURRENT_TIMESTAMP,
c TIMESTAMP NOT NULL DEFAULT '0000-00-00 00:00:00' ON UPDATE CURRENT_TIMESTAMP,
d TIMESTAMP NOT NULL DEFAULT '1986-09-27 03:00:00.098765',
e TIMESTAMP NULL,
f DATETIME DEFAULT CURRENT_TIMESTAMP ON UPDATE CURRENT_TIMESTAMP,
g DATETIME DEFAULT CURRENT_TIMESTAMP,
h DATETIME ON UPDATE CURRENT_TIMESTAMP,
i DATETIME NULL,
j DATETIME DEFAULT '1986-09-27 03:00:00.098765'
);
INSERT INTO t1 VALUES ();
# 1971-01-31 21:13:57 UTC
SET TIMESTAMP = 34200837.164937;
# No function default for non-column expressions:
DROP TABLE if exists t1, t2, t3, t4, t5, t6, t7, t8, t9, t10, t11, t12, t13;
# 1970-04-11 20:13:57 UTC
SET TIMESTAMP = 8712837.164953;
CREATE TABLE t1 (
a DATETIME DEFAULT CURRENT_TIMESTAMP ON UPDATE CURRENT_TIMESTAMP,
b DATETIME DEFAULT CURRENT_TIMESTAMP,
c DATETIME ON UPDATE CURRENT_TIMESTAMP,
d DATETIME NULL,
e DATETIME DEFAULT '1986-09-27 03:00:00.098765'
);
INSERT INTO t1 VALUES ();
# 1971-01-31 20:13:57 UTC
SET TIMESTAMP = 34200837.915736;
# Test CREATE TABLE LIKE
CREATE TABLE t7 LIKE t1;
SHOW CREATE TABLE t7;
Table	Create Table
t7	CREATE TABLE `t7` (
  `a` datetime DEFAULT CURRENT_TIMESTAMP ON UPDATE CURRENT_TIMESTAMP,
  `b` datetime DEFAULT CURRENT_TIMESTAMP,
  `c` datetime DEFAULT NULL ON UPDATE CURRENT_TIMESTAMP,
  `d` datetime DEFAULT NULL,
  `e` datetime DEFAULT '1986-09-27 03:00:00'
) DEFAULT CHARSET = utf8mb4 COMPRESSION = 'lz4_1.0' REPLICA_NUM = 1 BLOCK_SIZE = 16384 USE_BLOOM_FILTER = FALSE TABLET_SIZE = 134217728 PCTFREE = 10
DROP TABLE if exists t1, t2, t3, t4, t5, t6, t7;
#
# Test of a CREATE TABLE SELECT that also declared columns. In this case
# the function default for them should be activated during the execution of the
# CREATE TABLE statement.
#
# 1970-01-01 03:16:40
SET TIMESTAMP = 1000.987654;
CREATE TABLE t1 ( a INT );
INSERT INTO t1 VALUES ( 1 ), ( 2 );
SET TIMESTAMP = 2000.876543;
DROP TABLE if exists t1, t2;
#
# Test of updating a view.
#
CREATE TABLE t1 ( a INT, b DATETIME DEFAULT CURRENT_TIMESTAMP );
CREATE TABLE t2 ( a INT, b DATETIME ON UPDATE CURRENT_TIMESTAMP );
DROP TABLE if exists v1, v2;
CREATE VIEW v1 AS SELECT * FROM t1;
SHOW CREATE VIEW v1;
View	Create View	character_set_client	collation_connection
v1	CREATE VIEW `v1` AS select `test`.`t1`.`a` AS `a`,`test`.`t1`.`b` AS `b` from `test`.`t1`	utf8mb4	utf8mb4_general_ci
CREATE VIEW v2 AS SELECT * FROM t2;
SHOW CREATE VIEW v2;
View	Create View	character_set_client	collation_connection
v2	CREATE VIEW `v2` AS select `test`.`t2`.`a` AS `a`,`test`.`t2`.`b` AS `b` from `test`.`t2`	utf8mb4	utf8mb4_general_ci
# 1971-01-31 21:13:57 UTC
SET TIMESTAMP = 34200837.348564;
SELECT * FROM t1;
SELECT * FROM v1;
SELECT * FROM t2;
SELECT * FROM v2;
# 1970-04-11 20:13:57 UTC
SET TIMESTAMP = 8712837.567332;
SELECT * FROM t1;
SELECT * FROM v1;
SELECT * FROM t2;
SELECT * FROM v2;
DROP VIEW v1, v2;
DROP TABLE t1, t2;
#
# Test with stored procedures.
#
CREATE TABLE t1 (
a INT,
b TIMESTAMP NOT NULL DEFAULT CURRENT_TIMESTAMP ON UPDATE CURRENT_TIMESTAMP,
c TIMESTAMP NOT NULL DEFAULT CURRENT_TIMESTAMP,
d TIMESTAMP NOT NULL DEFAULT '0000-00-00 00:00:00' ON UPDATE CURRENT_TIMESTAMP,
e TIMESTAMP NULL,
f DATETIME DEFAULT CURRENT_TIMESTAMP,
g DATETIME ON UPDATE CURRENT_TIMESTAMP
);
# 1971-01-31 20:13:57 UTC
SET TIMESTAMP = 34200837.876544;
SELECT * FROM t1;
a	b	c	d	e	f	g
# 1970-04-11 21:13:57 UTC
SET TIMESTAMP = 8712837.143546;
SELECT * FROM t1;
DROP TABLE t1;
#
# Test with triggers.
#
CREATE TABLE t1 (
a INT,
b TIMESTAMP NOT NULL DEFAULT CURRENT_TIMESTAMP ON UPDATE CURRENT_TIMESTAMP,
c TIMESTAMP NOT NULL DEFAULT CURRENT_TIMESTAMP,
d TIMESTAMP NOT NULL DEFAULT '0000-00-00 00:00:00' ON UPDATE CURRENT_TIMESTAMP,
e TIMESTAMP NULL,
f DATETIME,
g DATETIME DEFAULT CURRENT_TIMESTAMP,
h DATETIME ON UPDATE CURRENT_TIMESTAMP,
i DATETIME DEFAULT CURRENT_TIMESTAMP ON UPDATE CURRENT_TIMESTAMP
);
CREATE TABLE t2 ( a INT );
# 1971-01-31 21:13:57 UTC
SET TIMESTAMP = 34200837.978675;
INSERT INTO t2 ( a ) VALUES ( 1 );
SELECT * FROM t1;
# 1970-04-11 21:13:57 UTC
SET TIMESTAMP = 8712837.456789;
INSERT INTO t2 ( a ) VALUES ( 1 );
SELECT * FROM t1;
DROP TABLE t1, t2;
#
# Test where the assignment target is not a column.
#
CREATE TABLE t1 ( a TIMESTAMP NOT NULL DEFAULT CURRENT_TIMESTAMP ON UPDATE CURRENT_TIMESTAMP );
CREATE TABLE t2 ( a TIMESTAMP NOT NULL DEFAULT CURRENT_TIMESTAMP ON UPDATE CURRENT_TIMESTAMP );
CREATE TABLE t3 ( a TIMESTAMP NOT NULL DEFAULT '0000-00-00 00:00:00' ON UPDATE CURRENT_TIMESTAMP );
CREATE TABLE t4 ( a TIMESTAMP NOT NULL DEFAULT '0000-00-00 00:00:00' ON UPDATE CURRENT_TIMESTAMP );
SELECT a FROM t1;
a
SELECT a FROM t2;
a
INSERT INTO t3 VALUES ();
SELECT a FROM t3;
a
0000-00-00 00:00:00
INSERT INTO t4 VALUES ();
SELECT a FROM t4;
a
0000-00-00 00:00:00
DROP TABLE t1, t2, t3, t4;
#
# Test of LOAD DATA/XML INFILE
# This tests behavior of function defaults for TIMESTAMP and DATETIME
# columns. during LOAD ... INFILE.
# As can be seen here, a TIMESTAMP column with only ON UPDATE
# CURRENT_TIMESTAMP will still have CURRENT_TIMESTAMP inserted on LOAD
# ... INFILE if the value is missing. For DATETIME columns a NULL value
# is inserted instead.
#
CREATE TABLE t1 (
a INT,
b TIMESTAMP NOT NULL DEFAULT CURRENT_TIMESTAMP ON UPDATE CURRENT_TIMESTAMP,
c TIMESTAMP NOT NULL DEFAULT CURRENT_TIMESTAMP,
d TIMESTAMP NOT NULL DEFAULT '0000-00-00 00:00:00' ON UPDATE CURRENT_TIMESTAMP,
e TIMESTAMP NOT NULL DEFAULT CURRENT_TIMESTAMP ON UPDATE CURRENT_TIMESTAMP,
f DATETIME,
g DATETIME DEFAULT CURRENT_TIMESTAMP,
h DATETIME ON UPDATE CURRENT_TIMESTAMP,
i DATETIME DEFAULT CURRENT_TIMESTAMP ON UPDATE CURRENT_TIMESTAMP
);
CREATE TABLE t2 (
a TIMESTAMP NOT NULL DEFAULT CURRENT_TIMESTAMP ON UPDATE CURRENT_TIMESTAMP,
b TIMESTAMP NOT NULL DEFAULT CURRENT_TIMESTAMP,
c TIMESTAMP NOT NULL DEFAULT '0000-00-00 00:00:00' ON UPDATE CURRENT_TIMESTAMP,
d TIMESTAMP NOT NULL DEFAULT CURRENT_TIMESTAMP ON UPDATE CURRENT_TIMESTAMP,
e DATETIME NOT NULL,
f DATETIME NOT NULL DEFAULT '1977-01-02 12:13:14',
g DATETIME DEFAULT CURRENT_TIMESTAMP NOT NULL,
h DATETIME ON UPDATE CURRENT_TIMESTAMP NOT NULL,
i DATETIME DEFAULT CURRENT_TIMESTAMP ON UPDATE CURRENT_TIMESTAMP NOT NULL
);
# Mon Aug 1 15:11:19 2011 UTC
SET TIMESTAMP = 1312211479.918273;
SELECT * FROM t1;
a	b	c	d	e	f	g	h	i
SELECT a FROM t2;
a
SELECT b FROM t2;
b
SELECT c FROM t2;
c
SELECT d FROM t2;
d
# As shown here, supplying a NULL value to a non-nullable
# column with no default value results in the zero date.
SELECT e FROM t2;
e
# As shown here, supplying a NULL value to a non-nullable column with a
# default value results in the zero date.
SELECT f FROM t2;
f
# As shown here, supplying a NULL value to a non-nullable column with a
# default function results in the zero date.
SELECT g FROM t2;
g
# As shown here, supplying a NULL value to a non-nullable DATETIME ON
# UPDATE CURRENT_TIMESTAMP column with no default value results in the
# zero date.
SELECT h FROM t2;
h
SELECT i FROM t2;
i
DELETE FROM t1;
DELETE FROM t2;
# Read t3 file into t1
# The syntax will cause a different code path to be taken
# (read_fixed_length()) than under the LOAD ... INTO TABLE t1 command
# above. The code in this path is copy-pasted code from the path taken
# under the syntax used in the previous LOAD command.
SELECT b FROM t1;
b
SELECT c FROM t1;
c
SELECT d FROM t1;
d
SELECT e FROM t1;
e
# Yes, a missing field cannot be NULL using this syntax, so it will
# zero date instead. Says a comment in read_fixed_length() : 'No fields
# specified in fields_vars list can be NULL in this format.'
# It appears to be by design. This is inconsistent with LOAD DATA INFILE
# syntax in previous test.
SELECT f FROM t1;
f
SELECT g FROM t1;
g
# See comment above 'SELECT f FROM f1'.
SELECT h FROM t1;
h
SELECT i FROM t1;
i
DELETE FROM t1;
SELECT * FROM t1;
a	b	c	d	e	f	g	h	i
SELECT @dummy;
@dummy
NULL
DELETE FROM t1;
SELECT * FROM t1;
a	b	c	d	e	f	g	h	i
DELETE FROM t1;
SELECT * FROM t1;
a	b	c	d	e	f	g	h	i
DELETE FROM t1;
# Load a static XML file
Missing tags are treated as NULL
SELECT * FROM t1;
a	b	c	d	e	f	g	h	i
DROP TABLE t1, t2;
#
# Similar LOAD DATA tests in another form
#
# All of this test portion has been run on a pre-WL5874 trunk
# (except that like_b and like_c didn't exist) and all result
# differences are a bug.
# Regarding like_b its definition is the same as b's except
# that the constant default is replaced with a function
# default. Our expectation is that like_b would behave
# like b: if b is set to NULL, or set to 0000-00-00, or set to
# its default, then the same should apply to like_b. Same for
# like_c vs c.
# Mon Aug 1 15:11:19 2011 UTC
SET TIMESTAMP = 1312211479.089786;
# Too short row
CREATE TABLE t1 (
dummy INT,
a DATETIME NULL DEFAULT NULL,
b DATETIME NULL DEFAULT '2011-11-18',
like_b DATETIME NULL DEFAULT CURRENT_TIMESTAMP,
c DATETIME NOT NULL DEFAULT '2011-11-18',
like_c DATETIME NOT NULL DEFAULT CURRENT_TIMESTAMP,
d TIMESTAMP NULL DEFAULT '2011-05-03' ON UPDATE CURRENT_TIMESTAMP,
e TIMESTAMP NOT NULL DEFAULT '2011-05-03',
f TIMESTAMP NOT NULL DEFAULT CURRENT_TIMESTAMP,
g TIMESTAMP NULL DEFAULT NULL,
h INT NULL,
i INT NOT NULL DEFAULT 42
);
# There is no promotion
SHOW CREATE TABLE t1;
Table	Create Table
t1	CREATE TABLE `t1` (
  `dummy` int(11) DEFAULT NULL,
  `a` datetime DEFAULT NULL,
  `b` datetime DEFAULT '2011-11-18 00:00:00',
  `like_b` datetime DEFAULT CURRENT_TIMESTAMP,
  `c` datetime NOT NULL DEFAULT '2011-11-18 00:00:00',
  `like_c` datetime NOT NULL DEFAULT CURRENT_TIMESTAMP,
  `d` timestamp NULL DEFAULT '2011-05-03 00:00:00' ON UPDATE CURRENT_TIMESTAMP,
  `e` timestamp NOT NULL DEFAULT '2011-05-03 00:00:00',
  `f` timestamp NOT NULL DEFAULT CURRENT_TIMESTAMP,
  `g` timestamp NULL DEFAULT NULL,
  `h` int(11) DEFAULT NULL,
  `i` int(11) NOT NULL DEFAULT '42'
) DEFAULT CHARSET = utf8mb4 COMPRESSION = 'lz4_1.0' REPLICA_NUM = 1 BLOCK_SIZE = 16384 USE_BLOOM_FILTER = FALSE TABLET_SIZE = 134217728 PCTFREE = 10
# It is strange that 'like_b' gets NULL when 'b' gets 0. But
# this is consistent with how 'a' gets NULL when 'b' gets 0,
# with how 'g' gets NULL when 'd' gets 0, and with how 'h' gets
# NULL when 'i' gets 0. Looks like 'DEFAULT
# <non-NULL-constant>' is changed to 0, whereas DEFAULT NULL
# and DEFAULT NOW are changed to NULL.
SELECT * FROM t1;
dummy	a	b	like_b	c	like_c	d	e	f	g	h	i
delete from t1;
alter table t1
modify f TIMESTAMP NULL default CURRENT_TIMESTAMP;
# There is no promotion
SHOW CREATE TABLE t1;
Table	Create Table
t1	CREATE TABLE `t1` (
  `dummy` int(11) DEFAULT NULL,
  `a` datetime DEFAULT NULL,
  `b` datetime DEFAULT '2011-11-18 00:00:00',
  `like_b` datetime DEFAULT CURRENT_TIMESTAMP,
  `c` datetime NOT NULL DEFAULT '2011-11-18 00:00:00',
  `like_c` datetime NOT NULL DEFAULT CURRENT_TIMESTAMP,
  `d` timestamp NULL DEFAULT '2011-05-03 00:00:00' ON UPDATE CURRENT_TIMESTAMP,
  `e` timestamp NOT NULL DEFAULT '2011-05-03 00:00:00',
  `f` timestamp NULL DEFAULT CURRENT_TIMESTAMP,
  `g` timestamp NULL DEFAULT NULL,
  `h` int(11) DEFAULT NULL,
  `i` int(11) NOT NULL DEFAULT '42'
) DEFAULT CHARSET = utf8mb4 COMPRESSION = 'lz4_1.0' REPLICA_NUM = 1 BLOCK_SIZE = 16384 USE_BLOOM_FILTER = FALSE TABLET_SIZE = 134217728 PCTFREE = 10
SELECT * FROM t1;
dummy	a	b	like_b	c	like_c	d	e	f	g	h	i
delete from t1;
drop table t1;
# Conclusion derived from trunk's results:
# DATETIME DEFAULT <non-NULL-constant> (b,c) gets 0000-00-00,
# DATETIME DEFAULT NULL (a) gets NULL,
# TIMESTAMP NULL DEFAULT <non-NULL-constant> (d) gets 0000-00-00,
# TIMESTAMP NULL DEFAULT NULL (g) gets NULL,
# TIMESTAMP NULL DEFAULT NOW (f after ALTER) gets NULL,
# TIMESTAMP NOT NULL (f before ALTER, e) gets NOW.
### Loading NULL ###
CREATE TABLE t1 (
dummy INT,
a DATETIME NULL DEFAULT NULL,
b DATETIME NULL DEFAULT '2011-11-18',
like_b DATETIME NULL DEFAULT CURRENT_TIMESTAMP,
c DATETIME NOT NULL DEFAULT '2011-11-18',
like_c DATETIME NOT NULL DEFAULT CURRENT_TIMESTAMP,
d TIMESTAMP NULL DEFAULT '2011-05-03' ON UPDATE CURRENT_TIMESTAMP,
e TIMESTAMP NOT NULL DEFAULT '2011-05-03',
f TIMESTAMP NOT NULL DEFAULT CURRENT_TIMESTAMP,
g TIMESTAMP NULL DEFAULT NULL,
h INT NULL,
i INT NOT NULL DEFAULT 42
);
# There is no promotion
SHOW CREATE TABLE t1;
Table	Create Table
t1	CREATE TABLE `t1` (
  `dummy` int(11) DEFAULT NULL,
  `a` datetime DEFAULT NULL,
  `b` datetime DEFAULT '2011-11-18 00:00:00',
  `like_b` datetime DEFAULT CURRENT_TIMESTAMP,
  `c` datetime NOT NULL DEFAULT '2011-11-18 00:00:00',
  `like_c` datetime NOT NULL DEFAULT CURRENT_TIMESTAMP,
  `d` timestamp NULL DEFAULT '2011-05-03 00:00:00' ON UPDATE CURRENT_TIMESTAMP,
  `e` timestamp NOT NULL DEFAULT '2011-05-03 00:00:00',
  `f` timestamp NOT NULL DEFAULT CURRENT_TIMESTAMP,
  `g` timestamp NULL DEFAULT NULL,
  `h` int(11) DEFAULT NULL,
  `i` int(11) NOT NULL DEFAULT '42'
) DEFAULT CHARSET = utf8mb4 COMPRESSION = 'lz4_1.0' REPLICA_NUM = 1 BLOCK_SIZE = 16384 USE_BLOOM_FILTER = FALSE TABLET_SIZE = 134217728 PCTFREE = 10
SELECT * FROM t1;
dummy	a	b	like_b	c	like_c	d	e	f	g	h	i
delete from t1;
alter table t1
modify f TIMESTAMP NULL default CURRENT_TIMESTAMP;
# There is no promotion
SHOW CREATE TABLE t1;
Table	Create Table
t1	CREATE TABLE `t1` (
  `dummy` int(11) DEFAULT NULL,
  `a` datetime DEFAULT NULL,
  `b` datetime DEFAULT '2011-11-18 00:00:00',
  `like_b` datetime DEFAULT CURRENT_TIMESTAMP,
  `c` datetime NOT NULL DEFAULT '2011-11-18 00:00:00',
  `like_c` datetime NOT NULL DEFAULT CURRENT_TIMESTAMP,
  `d` timestamp NULL DEFAULT '2011-05-03 00:00:00' ON UPDATE CURRENT_TIMESTAMP,
  `e` timestamp NOT NULL DEFAULT '2011-05-03 00:00:00',
  `f` timestamp NULL DEFAULT CURRENT_TIMESTAMP,
  `g` timestamp NULL DEFAULT NULL,
  `h` int(11) DEFAULT NULL,
  `i` int(11) NOT NULL DEFAULT '42'
) DEFAULT CHARSET = utf8mb4 COMPRESSION = 'lz4_1.0' REPLICA_NUM = 1 BLOCK_SIZE = 16384 USE_BLOOM_FILTER = FALSE TABLET_SIZE = 134217728 PCTFREE = 10
SELECT * FROM t1;
dummy	a	b	like_b	c	like_c	d	e	f	g	h	i
delete from t1;
# Conclusion derived from trunk's results:
# DATETIME NULL (a,b) gets NULL,
# DATETIME NOT NULL (c) gets 0000-00-00,
# TIMESTAMP NULL (d,f,g) gets NULL,
# TIMESTAMP NOT NULL (e) gets NOW.
drop table t1;
#
# Test of updatable views with check options. The option can be violated
# using ON UPDATE updates which is very strange as this offers a loophole
# in this integrity check.
#
SET TIME_ZONE = '+03:00';
# 1970-01-01 03:16:40
SET TIMESTAMP = 1000.123456;
CREATE TABLE t1 ( a INT, b TIMESTAMP NOT NULL DEFAULT CURRENT_TIMESTAMP ON UPDATE CURRENT_TIMESTAMP);
SHOW CREATE TABLE t1;
Table	Create Table
t1	CREATE TABLE `t1` (
  `a` int(11) DEFAULT NULL,
  `b` timestamp NOT NULL DEFAULT CURRENT_TIMESTAMP ON UPDATE CURRENT_TIMESTAMP
) DEFAULT CHARSET = utf8mb4 COMPRESSION = 'lz4_1.0' REPLICA_NUM = 1 BLOCK_SIZE = 16384 USE_BLOOM_FILTER = FALSE TABLET_SIZE = 134217728 PCTFREE = 10
INSERT INTO t1 ( a ) VALUES ( 1 );
SELECT * FROM t1;
CREATE VIEW v1 AS SELECT * FROM t1 WHERE b <= '1970-01-01 03:16:40.123456';
SELECT * FROM v1;
a	b
1	1970-01-01 03:16:40
# 1970-01-01 03:33:20
SET TIMESTAMP = 2000.000234;
Logically, there should be an ER_VIEW_CHECK_FAILED here.
SELECT * FROM t1;
DROP VIEW v1;
DROP TABLE t1;
CREATE TABLE t1 (
a TIMESTAMP NOT NULL DEFAULT '1973-08-14 09:11:22.089786' ON UPDATE CURRENT_TIMESTAMP,
c INT KEY
);
# 1973-08-14 09:11:22 UTC
SET TIMESTAMP = 114167482.534231;
INSERT INTO t1 ( c ) VALUES ( 1 );
CREATE VIEW v1 AS
SELECT *
FROM t1
WHERE a >= '1973-08-14 09:11:22';
SELECT * FROM v1;
a	c
1973-08-14 09:11:22	1
SET TIMESTAMP = 1.126789;
Logically, there should be an ER_VIEW_CHECK_FAILED here.
SELECT * FROM v1;
a	c
1973-08-14 09:11:22	1
DROP VIEW v1;
DROP TABLE t1;
#
# Bug 13095459 - MULTI-TABLE UPDATE MODIFIES A ROW TWICE
#
CREATE TABLE t1 (
a INT,
b INT,
ts TIMESTAMP NOT NULL DEFAULT CURRENT_TIMESTAMP ON UPDATE CURRENT_TIMESTAMP,
PRIMARY KEY ( a, ts )
);
INSERT INTO t1( a, b, ts ) VALUES ( 1, 0, '2000-09-28 17:44:34' );
CREATE TABLE t2 ( a INT );
INSERT INTO t2 VALUES ( 1 );
SELECT b FROM t1;
b
0
DROP TABLE t1, t2;
#
# Bug#11745578: 17392: ALTER TABLE ADD COLUMN TIMESTAMP DEFAULT
# CURRENT_TIMESTAMP INSERTS ZERO
#
SET timestamp = 1000;
CREATE TABLE t1 ( b INT );
INSERT INTO t1 VALUES (1),(2);
SELECT * FROM t1;
b
1
2
DROP TABLE t1;
CREATE TABLE t1 ( a TIMESTAMP  NOT NULL DEFAULT NOW() ON UPDATE CURRENT_TIMESTAMP, b DATETIME DEFAULT NOW() );
INSERT INTO t1 VALUES ();
SET timestamp = 1000000000;
ALTER TABLE t1 MODIFY COLUMN a TIMESTAMP(3) DEFAULT CURRENT_TIMESTAMP(3);
ALTER TABLE t1 MODIFY COLUMN b DATETIME(3) DEFAULT CURRENT_TIMESTAMP(3);
SELECT * FROM t1;
DROP TABLE t1;
CREATE TABLE t1 (
a TIMESTAMP NOT NULL DEFAULT '1999-12-01 11:22:33' ON UPDATE CURRENT_TIMESTAMP,
b DATETIME DEFAULT '1999-12-01 11:22:33'
);
INSERT INTO t1 VALUES ();
ALTER TABLE t1 MODIFY COLUMN a TIMESTAMP DEFAULT NOW();
ALTER TABLE t1 MODIFY COLUMN b DATETIME DEFAULT NOW();
INSERT INTO t1 VALUES ();
SELECT * FROM t1;
DROP TABLE t1;
#
# Function defaults run 2. Six digits scale on seconds
# precision. InnoDB.
#
