merge happens
drop table if exists tbl1,tbl2;
create table tbl1 (i1 int, v2 varchar(80), i3 char(20),i4 float, d4 datetime(6),i5 decimal(5,3), primary key(i3));
create  unique index idx1 on tbl1(i1);
alter system major freeze tenant = sys;
alter system major freeze tenant = all_user;
alter system major freeze tenant = all_meta;
alter system major freeze tenant = sys;
alter system major freeze tenant = all_user;
alter system major freeze tenant = all_meta;
insert into tbl1 values(1,'now','haha1',1.6256,'2014-05-04 12:00:00',-10.235);
select * from tbl1;
i1	v2	i3	i4	d4	i5
1	now	haha1	1.6256	2014-05-04 12:00:00.000000	-10.235
update tbl1 set i1=1 ;
select * from tbl1;
i1	v2	i3	i4	d4	i5
1	now	haha1	1.6256	2014-05-04 12:00:00.000000	-10.235
update tbl1 set i1=1 where i3='haha1';
update tbl1 set i1=3 where i3='haha1';
update tbl1 set i1=1 where i3='haha1';
select * from tbl1;
i1	v2	i3	i4	d4	i5
1	now	haha1	1.6256	2014-05-04 12:00:00.000000	-10.235
insert into tbl1 values(2,'now','haha2',1.6256,'2014-05-04 12:00:00',-10.235);
insert into tbl1 values(3,'now','haha3',1.6256,'2014-05-04 12:00:00',-10.235);
insert into tbl1 values(4,'now','haha4',1.6256,'2014-05-04 12:00:00',-10.235);
insert into tbl1 values(5,'now','haha5',1.6256,'2014-05-04 12:00:00',-10.235);
insert into tbl1 values(6,'now','haha6',1.6256,'2014-05-04 12:00:00',-10.235);
insert into tbl1 values(7,'now','haha7',1.6256,'2014-05-04 12:00:00',-10.235);
insert into tbl1 values(8,'now','haha8',1.6256,'2014-05-04 12:00:00',-10.235);
insert into tbl1 values(9,'now','haha9',1.6256,'2014-05-04 12:00:00',-10.235);
insert into tbl1 values(10,'now','haha10',1.6256,'2014-05-04 12:00:00',-10.235);
insert into tbl1 values(11,'now','haha11',1.6256,'2014-05-04 12:00:00',-10.235);
insert into tbl1 values(12,'now','haha12',1.6256,'2014-05-04 12:00:00',-10.235);
update tbl1 set i1=1 where i3='haha10';
ERROR 23000: Duplicate entry '1' for key 'idx1'
update tbl1 set i1=20 where i3='haha10';
update tbl1 set i1=10 where i3='haha1';
update tbl1 set i1=null where i3='haha1';
select * from tbl1 where i3='haha2' or i3='haha3';
i1	v2	i3	i4	d4	i5
2	now	haha2	1.6256	2014-05-04 12:00:00.000000	-10.235
3	now	haha3	1.6256	2014-05-04 12:00:00.000000	-10.235
update tbl1 set i1=22 where i3='haha2' or i3='haha3';
ERROR 23000: Duplicate entry '22' for key 'idx1'
update tbl1 set i1=0 where i3='haha2';
update tbl1 set i1=-1 where i3='haha3' ;
select * from tbl1 where i3='haha2' or i3='haha3';
i1	v2	i3	i4	d4	i5
0	now	haha2	1.6256	2014-05-04 12:00:00.000000	-10.235
-1	now	haha3	1.6256	2014-05-04 12:00:00.000000	-10.235
insert into tbl1 values(21,'now','haha21',1.6256,'2014-05-04 12:00:00',-10.235);
replace into tbl1 values(21,'now','haha21',1.6256,'2014-05-04 12:00:00',-10.235);
replace into tbl1 values(21,'now','haha21',1.6256,'2014-05-04 12:00:00',-10.235);
replace into tbl1 values(21,'now','haha21',1.6256,'2014-05-04 12:00:00',-10.235);
update tbl1 set i1=i1+30;
update tbl1 set i1=i1-50;
select * from tbl1;
i1	v2	i3	i4	d4	i5
NULL	now	haha1	1.6256	2014-05-04 12:00:00.000000	-10.235
0	now	haha10	1.6256	2014-05-04 12:00:00.000000	-10.235
-9	now	haha11	1.6256	2014-05-04 12:00:00.000000	-10.235
-8	now	haha12	1.6256	2014-05-04 12:00:00.000000	-10.235
-20	now	haha2	1.6256	2014-05-04 12:00:00.000000	-10.235
1	now	haha21	1.6256	2014-05-04 12:00:00.000000	-10.235
-21	now	haha3	1.6256	2014-05-04 12:00:00.000000	-10.235
-16	now	haha4	1.6256	2014-05-04 12:00:00.000000	-10.235
-15	now	haha5	1.6256	2014-05-04 12:00:00.000000	-10.235
-14	now	haha6	1.6256	2014-05-04 12:00:00.000000	-10.235
-13	now	haha7	1.6256	2014-05-04 12:00:00.000000	-10.235
-12	now	haha8	1.6256	2014-05-04 12:00:00.000000	-10.235
-11	now	haha9	1.6256	2014-05-04 12:00:00.000000	-10.235
update tbl1 set i1='24' where i3='haha2';
delete from tbl1 where i1=1000;
delete from tbl1 where i1='1000';
select * from tbl1 where i1=21;
i1	v2	i3	i4	d4	i5
21	now	haha21	1.6256	2014-05-04 12:00:00.000000	-10.235
alter system major freeze tenant = sys;
alter system major freeze tenant = all_user;
alter system major freeze tenant = all_meta;
select * from tbl1 ;
i1	v2	i3	i4	d4	i5
NULL	now	haha1	1.6256	2014-05-04 12:00:00.000000	-10.235
0	now	haha10	1.6256	2014-05-04 12:00:00.000000	-10.235
-9	now	haha11	1.6256	2014-05-04 12:00:00.000000	-10.235
-8	now	haha12	1.6256	2014-05-04 12:00:00.000000	-10.235
24	now	haha2	1.6256	2014-05-04 12:00:00.000000	-10.235
21	now	haha21	1.6256	2014-05-04 12:00:00.000000	-10.235
-21	now	haha3	1.6256	2014-05-04 12:00:00.000000	-10.235
-16	now	haha4	1.6256	2014-05-04 12:00:00.000000	-10.235
-15	now	haha5	1.6256	2014-05-04 12:00:00.000000	-10.235
-14	now	haha6	1.6256	2014-05-04 12:00:00.000000	-10.235
-13	now	haha7	1.6256	2014-05-04 12:00:00.000000	-10.235
-12	now	haha8	1.6256	2014-05-04 12:00:00.000000	-10.235
-11	now	haha9	1.6256	2014-05-04 12:00:00.000000	-10.235
