merge happens
drop table if exists tbl1,t1;
create table tbl1 (i1 int, v2 varchar(80), i3 char(20),i4 float, d4 datetime(6),i5 decimal(5,3), primary key(i3));
create  unique index idx1 on tbl1(i1);
create table t1(pk int primary key, c1 int, c2 int);
create unique index i1 on t1(c2);
alter system major freeze tenant = sys;
alter system major freeze tenant = all_user;
alter system major freeze tenant = all_meta;
alter system major freeze tenant = sys;
alter system major freeze tenant = all_user;
alter system major freeze tenant = all_meta;
insert into tbl1 values(1,'now','haha1',1.6256,'2014-05-04 12:00:00',-10.235);
replace into tbl1(v2,i3,i4) values('dgafdg','efg',-1.25);
select * from tbl1;
i1	v2	i3	i4	d4	i5
NULL	dgafdg	efg	-1.25	NULL	NULL
1	now	haha1	1.6256	2014-05-04 12:00:00.000000	-10.235
update tbl1 set i1=1 where i1=100 ;
update tbl1 set i1=1 where i1='100' ;
insert into t1(pk, c1, c2) values(0,0,0);
select * from t1;
pk	c1	c2
0	0	0
replace into t1(pk, c1) values(0,1);
select * from t1;
pk	c1	c2
0	1	NULL
select idx of t1;
pk	c2
0	NULL
