drop table if exists t1;
create table t1(pk int primary key, i1 int, v1 varchar(20));
create unique index idx1 on t1(pk,v1);
alter system major freeze tenant = sys;
alter system major freeze tenant = all_user;
alter system major freeze tenant = all_meta;
alter system major freeze tenant = sys;
alter system major freeze tenant = all_user;
alter system major freeze tenant = all_meta;
replace into t1 values(1,1,'a'),(2,2,'b'),(3,3,'c');
insert into t1 values(1,1,'a') when row_count(update t1 set pk=4 where pk=1) = 1;
insert into t1 values(2,2,'b') when row_count(update t1 set pk=3 where pk=2) = 1;
ERROR 23000: Duplicate entry '3' for key 'PRIMARY'
select * from t1;
pk	i1	v1
1	1	a
2	2	b
3	3	c
4	1	a
insert into t1 values(5,5,'e') when row_count(update t1 set pk=5 where pk=3) = 1;
ERROR 23000: Duplicate entry '5' for key 'PRIMARY'
select * from t1;
pk	i1	v1
1	1	a
2	2	b
3	3	c
4	1	a
delete from t1 where pk<10;
replace into t1 values(1,1,'a'),(2,2,'b'),(3,3,'c');
insert into t1 values(2,2,'b') when row_count(update t1 set pk=4 where pk>1 and pk<3)=1;
insert into t1 values(3,3,'c') when row_count(update t1 set pk=5 where pk>3 and pk<6)=1;
ERROR 23000: Duplicate entry '3' for key 'PRIMARY'
insert into t1 values(7,7,'a') when row_count(update t1 set pk=7 where pk>1 and pk<3)=1;
ERROR 23000: Duplicate entry '7' for key 'PRIMARY'
select * from t1;
pk	i1	v1
1	1	a
2	2	b
3	3	c
4	2	b
delete from t1 where pk<10;
replace into t1 values(1,1,'a'),(2,2,'b'),(3,3,'c');
insert into t1 values(4,4,'d');
update t1 set pk=5 where pk=4 ;
insert into t1 values(5,5,'e');
ERROR 23000: Duplicate entry '5' for key 'PRIMARY'
update t1 set pk=2 where pk=5;
ERROR 23000: Duplicate entry '2' for key 'PRIMARY'
update t1 set pk=6 where pk=1 when row_count(insert into t1 values(6,6,'f'))=1;
ERROR 23000: Duplicate entry '6' for key 'PRIMARY'
select * from t1;
pk	i1	v1
1	1	a
2	2	b
3	3	c
5	4	d
delete from t1 where pk<10;
replace into t1 values(1,1,'a'),(2,2,'b'),(3,3,'c');
update t1 set pk=4 where pk>=3 and pk<5 when row_count(insert into t1 values(4,4,'d'));
ERROR 23000: Duplicate entry '4' for key 'PRIMARY'
update t1 set pk=4 where pk>=3 and pk<5 when row_count(insert into t1 values(5,5,'e'));
update t1 set pk=6 where pk>=1 and pk<3 when row_count(insert into t1 values(7,7,'f'));
ERROR 23000: Duplicate entry '6' for key 'PRIMARY'
update t1 set pk=8 where pk>=3 and pk<5 when row_count(insert into t1 values(4,4,'d'));
ERROR 23000: Duplicate entry '4' for key 'PRIMARY'
select * from t1;
pk	i1	v1
1	1	a
2	2	b
4	3	c
5	5	e
delete from t1 where pk<10;
replace into t1 values(1,1,'a'),(2,2,'b'),(3,3,'c');
select * from t1 where pk=1 when row_count(insert into t1 values(1,1,'b') when row_count(update t1 set pk=4 where pk=1) = 1)=1;
pk	i1	v1
1	1	b
select * from t1 where pk=3 when row_count(insert into t1 values(2,2,'c') when row_count(update t1 set pk=3 where pk=2) = 1)=1;
ERROR 23000: Duplicate entry '3' for key 'PRIMARY'
select * from t1 where pk=6 when row_count(insert into t1 values(6,6,'c') when row_count(update t1 set pk=6 where pk=2) = 1)=3;
ERROR 23000: Duplicate entry '6' for key 'PRIMARY'
delete from t1 where pk<10;
replace into t1 values(1,1,'a'),(2,2,'b'),(3,3,'c');
select * from t1 where pk=2 when row_count(insert into t1 values(2,2,'c') when row_count(update t1 set pk=4 where pk>1 and pk<3) = 1)=1;
pk	i1	v1
2	2	c
select * from t1 where pk=2 when row_count(insert into t1 values(2,2,'c') when row_count(update t1 set pk=3 where pk>1 and pk<3) = 1)=1;
ERROR 23000: Duplicate entry '3' for key 'PRIMARY'
select * from t1 where pk=2 when row_count(insert into t1 values(2,2,'c') when row_count(update t1 set pk=6 where pk>2 and pk<6) = 2)=1;
ERROR 23000: Duplicate entry '6' for key 'PRIMARY'
delete from t1 where pk<10;
replace into t1 values(1,1,'a'),(2,2,'b'),(3,3,'c');
insert into t1 values(4,4,'d');
select * from t1 where pk=2 when row_count(update t1 set pk=5 where pk=4) =1;
pk	i1	v1
2	2	b
insert into t1 values(4,4,'d');
select * from t1 where pk=2 when row_count(update t1 set pk=3 where pk=4) =1;
ERROR 23000: Duplicate entry '3' for key 'PRIMARY'
insert into t1 values(4,4,'d');
ERROR 23000: Duplicate entry '4' for key 'PRIMARY'
select * from t1 where pk=2 when row_count(update t1 set pk=5 where pk=4) =1;
ERROR 23000: Duplicate entry '5' for key 'PRIMARY'
select * from t1 where pk=2 when row_count(update t1 set pk=6 where pk=3 when row_count(insert into t1 values(6,6,'d')) =1) =1;
ERROR 23000: Duplicate entry '6' for key 'PRIMARY'
delete from t1 where pk<10;
replace into t1 values(1,1,'a'),(2,2,'b'),(3,3,'c');
select * from t1 where pk=2 when row_count(update t1 set pk=5 where pk>3 and pk<5 when row_count(insert into t1 values(4,4,'d')) =1) =1;
ERROR 23000: Number 2 When filter failed, ret=-5064, func 1: ROW_COUNT()=0
select * from t1;
pk	i1	v1
1	1	a
2	2	b
3	3	c
select * from t1 where pk=2 when row_count(update t1 set pk=6 where pk>=3 and pk<5 when row_count(insert into t1 values(7,7,'d')) =1) =2;
ERROR 23000: Number 2 When filter failed, ret=-5064, func 1: ROW_COUNT()=1
select * from t1 where pk=2 when row_count(update t1 set pk=6 where pk>=3 and pk<5 when row_count(insert into t1 values(4,4,'d')) =1) =1;
pk	i1	v1
2	2	b
delete from t1 where pk<10;
replace into t1 values(1,1,'a'),(2,2,'b'),(3,3,'c'),(4,4,'d'),(5,5,'e');
select * from t1;
pk	i1	v1
1	1	a
2	2	b
3	3	c
4	4	d
5	5	e
delete from t1 where pk<20;
replace into t1 values(1,1,'a'),(2,2,'b'),(3,3,'c'),(4,4,'d'),(5,5,'e');
select * from t1;
pk	i1	v1
1	1	a
2	2	b
3	3	c
4	4	d
5	5	e
