alter system set check_async_task_interval='5s' server_type=rootserver;
alter system set check_tablet_available_interval='2s' server_type=chunkserver;
alter system set write_delay_after_drop_index = '1s' server_type=rootserver;
alter system set read_delay_after_drop_index = '1s' server_type=rootserver;
alter system set build_global_index_time='60s' server_type=rootserver;
alter system set build_sample_time='60s' server_type=rootserver;
drop table if exists tbl1;
create table tbl1 (pk int,i1 int, v2 varchar(80), i3 char(20),i4 float, d4 datetime(6),i5 decimal(5,3),i6 bool, primary key(pk));
insert into tbl1 values(1,1,'abc12','1agc',1.25,'2014-01-01 12:00:00',23.23,1),
(2,10,'23abc12','4agc1',-0.25,'2015-11-01 12:00:00',-23.230,0),
(3,201,'xx23abc12','cagc1',-2.25,'2015-11-21 11:20:10',3.231,1),
(4,80,'zx23abc12','zcagc1',2.25,'2013-01-21 11:20:10',-3.231,1),
(5,53,'cx23abc12','rcagc1',109.25,'2016-01-22 11:20:10',-13.131,0),
(6,78,'tx23abc12','icagc1',-109.25,'2014-09-16 16:24:00',-13.531,1),
(7,400,'yx23abc12','ocagc1',85.85,'2014-09-17 16:20:21',-93.131,0),
(8,50,'vx23abc12','wcagc1',-85.85,'2014-09-10 16:20:21',93.131,1),
(9,610,'ukx23abc12','pecagc1',-1.85,'2014-09-19 16:20:21',99.131,0),
(10,42,'kx23abc12','ecagc1',-85.86,'2014-09-18 16:20:21',-99.131,1),
(11,null,null,null,null,null,null,null);
create unique index idx_1 on tbl1(i1);
create unique index idx_2 on tbl1(v2);
create unique index idx_3 on tbl1(i3);
create unique index idx_4 on tbl1(i4);
create unique index idx_5 on tbl1(d4);
create unique index idx_6 on tbl1(i5);
create unique index idx_7 on tbl1(i1,v2,i3,i4,d4,i5,i6);
alter system major freeze tenant = sys;
alter system major freeze tenant = all_user;
alter system major freeze tenant = all_meta;
alter system major freeze tenant = sys;
alter system major freeze tenant = all_user;
alter system major freeze tenant = all_meta;
select date_sub(null, INTERVAL -6 DAY);
date_sub(null, INTERVAL -6 DAY)
NULL
select * from tbl1;
pk	i1	v2	i3	i4	d4	i5	i6
1	1	abc12	1agc	1.25	2014-01-01 12:00:00	23.23	1
2	10	23abc12	4agc1	-0.25	2015-11-01 12:00:00	-23.23	0
3	201	xx23abc12	cagc1	-2.25	2015-11-21 11:20:10	3.231	1
4	80	zx23abc12	zcagc1	2.25	2013-01-21 11:20:10	-3.231	1
5	53	cx23abc12	rcagc1	109.25	2016-01-22 11:20:10	-13.131	0
6	78	tx23abc12	icagc1	-109.25	2014-09-16 16:24:00	-13.531	1
7	400	yx23abc12	ocagc1	85.85	2014-09-17 16:20:21	-93.131	0
8	50	vx23abc12	wcagc1	-85.85	2014-09-10 16:20:21	93.131	1
9	610	ukx23abc12	pecagc1	-1.85	2014-09-19 16:20:21	99.131	0
10	42	kx23abc12	ecagc1	-85.86	2014-09-18 16:20:21	-99.131	1
11	NULL	NULL	NULL	NULL	NULL	NULL	NULL
update  tbl1 set i1=i1-20;
update  tbl1 set i1=i1+20;
update  tbl1 set v2=concat(v2,'abc');
update  tbl1 set v2=substr(v2,1,10);
update  tbl1 set i3=concat(v2,'abc');
update  tbl1 set i3=substr(v2,1,10);
update  tbl1 set i4=i4*2;
update  tbl1 set i4=i4/2;
update  tbl1 set d4=date_sub(d4, INTERVAL -6 DAY) where d4 is not null;
update  tbl1 set d4=date_add(d4, INTERVAL -6 DAY) where d4 is not null;
update  tbl1 set i5=i5+0.05;
update  tbl1 set i5=i5-0.05;
update  tbl1 set i6=i6 and 1;
select * from tbl1;
pk	i1	v2	i3	i4	d4	i5	i6
1	1	abc12abc	abc12abc	1.25	2014-01-01 12:00:00	23.23	1
2	10	23abc12abc	23abc12abc	-0.25	2015-11-01 12:00:00	-23.23	0
3	201	xx23abc12a	xx23abc12a	-2.25	2015-11-21 11:20:10	3.231	1
4	80	zx23abc12a	zx23abc12a	2.25	2013-01-21 11:20:10	-3.231	1
5	53	cx23abc12a	cx23abc12a	109.25	2016-01-22 11:20:10	-13.131	0
6	78	tx23abc12a	tx23abc12a	-109.25	2014-09-16 16:24:00	-13.531	1
7	400	yx23abc12a	yx23abc12a	85.85	2014-09-17 16:20:21	-93.131	0
8	50	vx23abc12a	vx23abc12a	-85.85	2014-09-10 16:20:21	93.131	1
9	610	ukx23abc12	ukx23abc12	-1.85	2014-09-19 16:20:21	99.131	0
10	42	kx23abc12a	kx23abc12a	-85.86	2014-09-18 16:20:21	-99.131	1
11	NULL	NULL	NULL	NULL	NULL	NULL	NULL
select * from tbl1 where i1>10 and i1<=1000;
pk	i1	v2	i3	i4	d4	i5	i6
10	42	kx23abc12a	kx23abc12a	-85.86	2014-09-18 16:20:21	-99.131	1
8	50	vx23abc12a	vx23abc12a	-85.85	2014-09-10 16:20:21	93.131	1
5	53	cx23abc12a	cx23abc12a	109.25	2016-01-22 11:20:10	-13.131	0
6	78	tx23abc12a	tx23abc12a	-109.25	2014-09-16 16:24:00	-13.531	1
4	80	zx23abc12a	zx23abc12a	2.25	2013-01-21 11:20:10	-3.231	1
3	201	xx23abc12a	xx23abc12a	-2.25	2015-11-21 11:20:10	3.231	1
7	400	yx23abc12a	yx23abc12a	85.85	2014-09-17 16:20:21	-93.131	0
9	610	ukx23abc12	ukx23abc12	-1.85	2014-09-19 16:20:21	99.131	0
select * from tbl1 where i1>10+1 and i1<1000;
pk	i1	v2	i3	i4	d4	i5	i6
10	42	kx23abc12a	kx23abc12a	-85.86	2014-09-18 16:20:21	-99.131	1
8	50	vx23abc12a	vx23abc12a	-85.85	2014-09-10 16:20:21	93.131	1
5	53	cx23abc12a	cx23abc12a	109.25	2016-01-22 11:20:10	-13.131	0
6	78	tx23abc12a	tx23abc12a	-109.25	2014-09-16 16:24:00	-13.531	1
4	80	zx23abc12a	zx23abc12a	2.25	2013-01-21 11:20:10	-3.231	1
3	201	xx23abc12a	xx23abc12a	-2.25	2015-11-21 11:20:10	3.231	1
7	400	yx23abc12a	yx23abc12a	85.85	2014-09-17 16:20:21	-93.131	0
9	610	ukx23abc12	ukx23abc12	-1.85	2014-09-19 16:20:21	99.131	0
select * from tbl1 where i1 between 10+1 and 1000;
pk	i1	v2	i3	i4	d4	i5	i6
10	42	kx23abc12a	kx23abc12a	-85.86	2014-09-18 16:20:21	-99.131	1
8	50	vx23abc12a	vx23abc12a	-85.85	2014-09-10 16:20:21	93.131	1
5	53	cx23abc12a	cx23abc12a	109.25	2016-01-22 11:20:10	-13.131	0
6	78	tx23abc12a	tx23abc12a	-109.25	2014-09-16 16:24:00	-13.531	1
4	80	zx23abc12a	zx23abc12a	2.25	2013-01-21 11:20:10	-3.231	1
3	201	xx23abc12a	xx23abc12a	-2.25	2015-11-21 11:20:10	3.231	1
7	400	yx23abc12a	yx23abc12a	85.85	2014-09-17 16:20:21	-93.131	0
9	610	ukx23abc12	ukx23abc12	-1.85	2014-09-19 16:20:21	99.131	0
prepare stmt1 from select * from tbl1 where i1>?+1 and i1<?-10;
set @a=10;
set @b=1000;
execute stmt1 using @a, @b;
pk	i1	v2	i3	i4	d4	i5	i6
10	42	kx23abc12a	kx23abc12a	-85.86	2014-09-18 16:20:21	-99.131	1
8	50	vx23abc12a	vx23abc12a	-85.85	2014-09-10 16:20:21	93.131	1
5	53	cx23abc12a	cx23abc12a	109.25	2016-01-22 11:20:10	-13.131	0
6	78	tx23abc12a	tx23abc12a	-109.25	2014-09-16 16:24:00	-13.531	1
4	80	zx23abc12a	zx23abc12a	2.25	2013-01-21 11:20:10	-3.231	1
3	201	xx23abc12a	xx23abc12a	-2.25	2015-11-21 11:20:10	3.231	1
7	400	yx23abc12a	yx23abc12a	85.85	2014-09-17 16:20:21	-93.131	0
9	610	ukx23abc12	ukx23abc12	-1.85	2014-09-19 16:20:21	99.131	0
set @a=10+1-1;
set @b=1000-1+1;
execute stmt1 using @a, @b;
pk	i1	v2	i3	i4	d4	i5	i6
10	42	kx23abc12a	kx23abc12a	-85.86	2014-09-18 16:20:21	-99.131	1
8	50	vx23abc12a	vx23abc12a	-85.85	2014-09-10 16:20:21	93.131	1
5	53	cx23abc12a	cx23abc12a	109.25	2016-01-22 11:20:10	-13.131	0
6	78	tx23abc12a	tx23abc12a	-109.25	2014-09-16 16:24:00	-13.531	1
4	80	zx23abc12a	zx23abc12a	2.25	2013-01-21 11:20:10	-3.231	1
3	201	xx23abc12a	xx23abc12a	-2.25	2015-11-21 11:20:10	3.231	1
7	400	yx23abc12a	yx23abc12a	85.85	2014-09-17 16:20:21	-93.131	0
9	610	ukx23abc12	ukx23abc12	-1.85	2014-09-19 16:20:21	99.131	0
select * from tbl1 where i1>10 and i1<1000-10;
pk	i1	v2	i3	i4	d4	i5	i6
10	42	kx23abc12a	kx23abc12a	-85.86	2014-09-18 16:20:21	-99.131	1
8	50	vx23abc12a	vx23abc12a	-85.85	2014-09-10 16:20:21	93.131	1
5	53	cx23abc12a	cx23abc12a	109.25	2016-01-22 11:20:10	-13.131	0
6	78	tx23abc12a	tx23abc12a	-109.25	2014-09-16 16:24:00	-13.531	1
4	80	zx23abc12a	zx23abc12a	2.25	2013-01-21 11:20:10	-3.231	1
3	201	xx23abc12a	xx23abc12a	-2.25	2015-11-21 11:20:10	3.231	1
7	400	yx23abc12a	yx23abc12a	85.85	2014-09-17 16:20:21	-93.131	0
9	610	ukx23abc12	ukx23abc12	-1.85	2014-09-19 16:20:21	99.131	0
select * from tbl1 where i1>10+1 and i1<1000-10;
pk	i1	v2	i3	i4	d4	i5	i6
10	42	kx23abc12a	kx23abc12a	-85.86	2014-09-18 16:20:21	-99.131	1
8	50	vx23abc12a	vx23abc12a	-85.85	2014-09-10 16:20:21	93.131	1
5	53	cx23abc12a	cx23abc12a	109.25	2016-01-22 11:20:10	-13.131	0
6	78	tx23abc12a	tx23abc12a	-109.25	2014-09-16 16:24:00	-13.531	1
4	80	zx23abc12a	zx23abc12a	2.25	2013-01-21 11:20:10	-3.231	1
3	201	xx23abc12a	xx23abc12a	-2.25	2015-11-21 11:20:10	3.231	1
7	400	yx23abc12a	yx23abc12a	85.85	2014-09-17 16:20:21	-93.131	0
9	610	ukx23abc12	ukx23abc12	-1.85	2014-09-19 16:20:21	99.131	0
select * from tbl1 where i1>1*10+1 and i1<1000;
pk	i1	v2	i3	i4	d4	i5	i6
10	42	kx23abc12a	kx23abc12a	-85.86	2014-09-18 16:20:21	-99.131	1
8	50	vx23abc12a	vx23abc12a	-85.85	2014-09-10 16:20:21	93.131	1
5	53	cx23abc12a	cx23abc12a	109.25	2016-01-22 11:20:10	-13.131	0
6	78	tx23abc12a	tx23abc12a	-109.25	2014-09-16 16:24:00	-13.531	1
4	80	zx23abc12a	zx23abc12a	2.25	2013-01-21 11:20:10	-3.231	1
3	201	xx23abc12a	xx23abc12a	-2.25	2015-11-21 11:20:10	3.231	1
7	400	yx23abc12a	yx23abc12a	85.85	2014-09-17 16:20:21	-93.131	0
9	610	ukx23abc12	ukx23abc12	-1.85	2014-09-19 16:20:21	99.131	0
select * from tbl1 where i1>10 and i1<=1000*2;
pk	i1	v2	i3	i4	d4	i5	i6
10	42	kx23abc12a	kx23abc12a	-85.86	2014-09-18 16:20:21	-99.131	1
8	50	vx23abc12a	vx23abc12a	-85.85	2014-09-10 16:20:21	93.131	1
5	53	cx23abc12a	cx23abc12a	109.25	2016-01-22 11:20:10	-13.131	0
6	78	tx23abc12a	tx23abc12a	-109.25	2014-09-16 16:24:00	-13.531	1
4	80	zx23abc12a	zx23abc12a	2.25	2013-01-21 11:20:10	-3.231	1
3	201	xx23abc12a	xx23abc12a	-2.25	2015-11-21 11:20:10	3.231	1
7	400	yx23abc12a	yx23abc12a	85.85	2014-09-17 16:20:21	-93.131	0
9	610	ukx23abc12	ukx23abc12	-1.85	2014-09-19 16:20:21	99.131	0
select * from tbl1 where i1>10*2+3 and i1<=1000*2;
pk	i1	v2	i3	i4	d4	i5	i6
10	42	kx23abc12a	kx23abc12a	-85.86	2014-09-18 16:20:21	-99.131	1
8	50	vx23abc12a	vx23abc12a	-85.85	2014-09-10 16:20:21	93.131	1
5	53	cx23abc12a	cx23abc12a	109.25	2016-01-22 11:20:10	-13.131	0
6	78	tx23abc12a	tx23abc12a	-109.25	2014-09-16 16:24:00	-13.531	1
4	80	zx23abc12a	zx23abc12a	2.25	2013-01-21 11:20:10	-3.231	1
3	201	xx23abc12a	xx23abc12a	-2.25	2015-11-21 11:20:10	3.231	1
7	400	yx23abc12a	yx23abc12a	85.85	2014-09-17 16:20:21	-93.131	0
9	610	ukx23abc12	ukx23abc12	-1.85	2014-09-19 16:20:21	99.131	0
select * from tbl1 where i1>1*50/5+1 and i1<=1000*2/2+1;
pk	i1	v2	i3	i4	d4	i5	i6
3	201	xx23abc12a	xx23abc12a	-2.25	2015-11-21 11:20:10	3.231	1
4	80	zx23abc12a	zx23abc12a	2.25	2013-01-21 11:20:10	-3.231	1
5	53	cx23abc12a	cx23abc12a	109.25	2016-01-22 11:20:10	-13.131	0
6	78	tx23abc12a	tx23abc12a	-109.25	2014-09-16 16:24:00	-13.531	1
7	400	yx23abc12a	yx23abc12a	85.85	2014-09-17 16:20:21	-93.131	0
8	50	vx23abc12a	vx23abc12a	-85.85	2014-09-10 16:20:21	93.131	1
9	610	ukx23abc12	ukx23abc12	-1.85	2014-09-19 16:20:21	99.131	0
10	42	kx23abc12a	kx23abc12a	-85.86	2014-09-18 16:20:21	-99.131	1
select * from tbl1 where i1>50 and i1<=1000*2/2+1;
pk	i1	v2	i3	i4	d4	i5	i6
5	53	cx23abc12a	cx23abc12a	109.25	2016-01-22 11:20:10	-13.131	0
6	78	tx23abc12a	tx23abc12a	-109.25	2014-09-16 16:24:00	-13.531	1
4	80	zx23abc12a	zx23abc12a	2.25	2013-01-21 11:20:10	-3.231	1
3	201	xx23abc12a	xx23abc12a	-2.25	2015-11-21 11:20:10	3.231	1
7	400	yx23abc12a	yx23abc12a	85.85	2014-09-17 16:20:21	-93.131	0
9	610	ukx23abc12	ukx23abc12	-1.85	2014-09-19 16:20:21	99.131	0
select * from tbl1 where i1>50*1+3 and i1<=1000;
pk	i1	v2	i3	i4	d4	i5	i6
6	78	tx23abc12a	tx23abc12a	-109.25	2014-09-16 16:24:00	-13.531	1
4	80	zx23abc12a	zx23abc12a	2.25	2013-01-21 11:20:10	-3.231	1
3	201	xx23abc12a	xx23abc12a	-2.25	2015-11-21 11:20:10	3.231	1
7	400	yx23abc12a	yx23abc12a	85.85	2014-09-17 16:20:21	-93.131	0
9	610	ukx23abc12	ukx23abc12	-1.85	2014-09-19 16:20:21	99.131	0
select * from tbl1 where i1>(19 mod 10)+1 and i1<=1000;
pk	i1	v2	i3	i4	d4	i5	i6
10	42	kx23abc12a	kx23abc12a	-85.86	2014-09-18 16:20:21	-99.131	1
8	50	vx23abc12a	vx23abc12a	-85.85	2014-09-10 16:20:21	93.131	1
5	53	cx23abc12a	cx23abc12a	109.25	2016-01-22 11:20:10	-13.131	0
6	78	tx23abc12a	tx23abc12a	-109.25	2014-09-16 16:24:00	-13.531	1
4	80	zx23abc12a	zx23abc12a	2.25	2013-01-21 11:20:10	-3.231	1
3	201	xx23abc12a	xx23abc12a	-2.25	2015-11-21 11:20:10	3.231	1
7	400	yx23abc12a	yx23abc12a	85.85	2014-09-17 16:20:21	-93.131	0
9	610	ukx23abc12	ukx23abc12	-1.85	2014-09-19 16:20:21	99.131	0
select * from tbl1 where i1>(19 mod 10)+1 and i1<=(1000 mod 1001) +10;
pk	i1	v2	i3	i4	d4	i5	i6
10	42	kx23abc12a	kx23abc12a	-85.86	2014-09-18 16:20:21	-99.131	1
8	50	vx23abc12a	vx23abc12a	-85.85	2014-09-10 16:20:21	93.131	1
5	53	cx23abc12a	cx23abc12a	109.25	2016-01-22 11:20:10	-13.131	0
6	78	tx23abc12a	tx23abc12a	-109.25	2014-09-16 16:24:00	-13.531	1
4	80	zx23abc12a	zx23abc12a	2.25	2013-01-21 11:20:10	-3.231	1
3	201	xx23abc12a	xx23abc12a	-2.25	2015-11-21 11:20:10	3.231	1
7	400	yx23abc12a	yx23abc12a	85.85	2014-09-17 16:20:21	-93.131	0
9	610	ukx23abc12	ukx23abc12	-1.85	2014-09-19 16:20:21	99.131	0
prepare stmt1 from select * from tbl1 where i1>(? mod 10) and i1<(? mod 1005)-10;
set @a=10;
set @b=1001;
execute stmt1 using @a, @b;
pk	i1	v2	i3	i4	d4	i5	i6
1	1	abc12abc	abc12abc	1.25	2014-01-01 12:00:00	23.23	1
2	10	23abc12abc	23abc12abc	-0.25	2015-11-01 12:00:00	-23.23	0
10	42	kx23abc12a	kx23abc12a	-85.86	2014-09-18 16:20:21	-99.131	1
8	50	vx23abc12a	vx23abc12a	-85.85	2014-09-10 16:20:21	93.131	1
5	53	cx23abc12a	cx23abc12a	109.25	2016-01-22 11:20:10	-13.131	0
6	78	tx23abc12a	tx23abc12a	-109.25	2014-09-16 16:24:00	-13.531	1
4	80	zx23abc12a	zx23abc12a	2.25	2013-01-21 11:20:10	-3.231	1
3	201	xx23abc12a	xx23abc12a	-2.25	2015-11-21 11:20:10	3.231	1
7	400	yx23abc12a	yx23abc12a	85.85	2014-09-17 16:20:21	-93.131	0
9	610	ukx23abc12	ukx23abc12	-1.85	2014-09-19 16:20:21	99.131	0
set @a=10+1-1;
set @b=1001-1+1;
execute stmt1 using @a, @b;
pk	i1	v2	i3	i4	d4	i5	i6
1	1	abc12abc	abc12abc	1.25	2014-01-01 12:00:00	23.23	1
2	10	23abc12abc	23abc12abc	-0.25	2015-11-01 12:00:00	-23.23	0
10	42	kx23abc12a	kx23abc12a	-85.86	2014-09-18 16:20:21	-99.131	1
8	50	vx23abc12a	vx23abc12a	-85.85	2014-09-10 16:20:21	93.131	1
5	53	cx23abc12a	cx23abc12a	109.25	2016-01-22 11:20:10	-13.131	0
6	78	tx23abc12a	tx23abc12a	-109.25	2014-09-16 16:24:00	-13.531	1
4	80	zx23abc12a	zx23abc12a	2.25	2013-01-21 11:20:10	-3.231	1
3	201	xx23abc12a	xx23abc12a	-2.25	2015-11-21 11:20:10	3.231	1
7	400	yx23abc12a	yx23abc12a	85.85	2014-09-17 16:20:21	-93.131	0
9	610	ukx23abc12	ukx23abc12	-1.85	2014-09-19 16:20:21	99.131	0
select * from tbl1 where i1>10 and i1<1000-10;
pk	i1	v2	i3	i4	d4	i5	i6
10	42	kx23abc12a	kx23abc12a	-85.86	2014-09-18 16:20:21	-99.131	1
8	50	vx23abc12a	vx23abc12a	-85.85	2014-09-10 16:20:21	93.131	1
5	53	cx23abc12a	cx23abc12a	109.25	2016-01-22 11:20:10	-13.131	0
6	78	tx23abc12a	tx23abc12a	-109.25	2014-09-16 16:24:00	-13.531	1
4	80	zx23abc12a	zx23abc12a	2.25	2013-01-21 11:20:10	-3.231	1
3	201	xx23abc12a	xx23abc12a	-2.25	2015-11-21 11:20:10	3.231	1
7	400	yx23abc12a	yx23abc12a	85.85	2014-09-17 16:20:21	-93.131	0
9	610	ukx23abc12	ukx23abc12	-1.85	2014-09-19 16:20:21	99.131	0
select * from tbl1 where i1>10+1 and i1<1000-10;
pk	i1	v2	i3	i4	d4	i5	i6
10	42	kx23abc12a	kx23abc12a	-85.86	2014-09-18 16:20:21	-99.131	1
8	50	vx23abc12a	vx23abc12a	-85.85	2014-09-10 16:20:21	93.131	1
5	53	cx23abc12a	cx23abc12a	109.25	2016-01-22 11:20:10	-13.131	0
6	78	tx23abc12a	tx23abc12a	-109.25	2014-09-16 16:24:00	-13.531	1
4	80	zx23abc12a	zx23abc12a	2.25	2013-01-21 11:20:10	-3.231	1
3	201	xx23abc12a	xx23abc12a	-2.25	2015-11-21 11:20:10	3.231	1
7	400	yx23abc12a	yx23abc12a	85.85	2014-09-17 16:20:21	-93.131	0
9	610	ukx23abc12	ukx23abc12	-1.85	2014-09-19 16:20:21	99.131	0
select * from tbl1 where i1>1*10+1 and i1<1000;
pk	i1	v2	i3	i4	d4	i5	i6
10	42	kx23abc12a	kx23abc12a	-85.86	2014-09-18 16:20:21	-99.131	1
8	50	vx23abc12a	vx23abc12a	-85.85	2014-09-10 16:20:21	93.131	1
5	53	cx23abc12a	cx23abc12a	109.25	2016-01-22 11:20:10	-13.131	0
6	78	tx23abc12a	tx23abc12a	-109.25	2014-09-16 16:24:00	-13.531	1
4	80	zx23abc12a	zx23abc12a	2.25	2013-01-21 11:20:10	-3.231	1
3	201	xx23abc12a	xx23abc12a	-2.25	2015-11-21 11:20:10	3.231	1
7	400	yx23abc12a	yx23abc12a	85.85	2014-09-17 16:20:21	-93.131	0
9	610	ukx23abc12	ukx23abc12	-1.85	2014-09-19 16:20:21	99.131	0
select * from tbl1 where i1>10 and i1<=1000*2;
pk	i1	v2	i3	i4	d4	i5	i6
10	42	kx23abc12a	kx23abc12a	-85.86	2014-09-18 16:20:21	-99.131	1
8	50	vx23abc12a	vx23abc12a	-85.85	2014-09-10 16:20:21	93.131	1
5	53	cx23abc12a	cx23abc12a	109.25	2016-01-22 11:20:10	-13.131	0
6	78	tx23abc12a	tx23abc12a	-109.25	2014-09-16 16:24:00	-13.531	1
4	80	zx23abc12a	zx23abc12a	2.25	2013-01-21 11:20:10	-3.231	1
3	201	xx23abc12a	xx23abc12a	-2.25	2015-11-21 11:20:10	3.231	1
7	400	yx23abc12a	yx23abc12a	85.85	2014-09-17 16:20:21	-93.131	0
9	610	ukx23abc12	ukx23abc12	-1.85	2014-09-19 16:20:21	99.131	0
select * from tbl1 where i1>10*2+3 and i1<=1000*2;
pk	i1	v2	i3	i4	d4	i5	i6
10	42	kx23abc12a	kx23abc12a	-85.86	2014-09-18 16:20:21	-99.131	1
8	50	vx23abc12a	vx23abc12a	-85.85	2014-09-10 16:20:21	93.131	1
5	53	cx23abc12a	cx23abc12a	109.25	2016-01-22 11:20:10	-13.131	0
6	78	tx23abc12a	tx23abc12a	-109.25	2014-09-16 16:24:00	-13.531	1
4	80	zx23abc12a	zx23abc12a	2.25	2013-01-21 11:20:10	-3.231	1
3	201	xx23abc12a	xx23abc12a	-2.25	2015-11-21 11:20:10	3.231	1
7	400	yx23abc12a	yx23abc12a	85.85	2014-09-17 16:20:21	-93.131	0
9	610	ukx23abc12	ukx23abc12	-1.85	2014-09-19 16:20:21	99.131	0
update tbl1 set i1=i1+1-1  where i1>10*2+3 and i1<=1000*2;
select * from tbl1 where i1>1*50/5+1 and i1<=1000*2/2+1;
pk	i1	v2	i3	i4	d4	i5	i6
3	201	xx23abc12a	xx23abc12a	-2.25	2015-11-21 11:20:10	3.231	1
4	80	zx23abc12a	zx23abc12a	2.25	2013-01-21 11:20:10	-3.231	1
5	53	cx23abc12a	cx23abc12a	109.25	2016-01-22 11:20:10	-13.131	0
6	78	tx23abc12a	tx23abc12a	-109.25	2014-09-16 16:24:00	-13.531	1
7	400	yx23abc12a	yx23abc12a	85.85	2014-09-17 16:20:21	-93.131	0
8	50	vx23abc12a	vx23abc12a	-85.85	2014-09-10 16:20:21	93.131	1
9	610	ukx23abc12	ukx23abc12	-1.85	2014-09-19 16:20:21	99.131	0
10	42	kx23abc12a	kx23abc12a	-85.86	2014-09-18 16:20:21	-99.131	1
select * from tbl1 where i1>50 and i1<=1000*2/2+1;
pk	i1	v2	i3	i4	d4	i5	i6
5	53	cx23abc12a	cx23abc12a	109.25	2016-01-22 11:20:10	-13.131	0
6	78	tx23abc12a	tx23abc12a	-109.25	2014-09-16 16:24:00	-13.531	1
4	80	zx23abc12a	zx23abc12a	2.25	2013-01-21 11:20:10	-3.231	1
3	201	xx23abc12a	xx23abc12a	-2.25	2015-11-21 11:20:10	3.231	1
7	400	yx23abc12a	yx23abc12a	85.85	2014-09-17 16:20:21	-93.131	0
9	610	ukx23abc12	ukx23abc12	-1.85	2014-09-19 16:20:21	99.131	0
select * from tbl1 where i1>50*1+3 and i1<=1000;
pk	i1	v2	i3	i4	d4	i5	i6
6	78	tx23abc12a	tx23abc12a	-109.25	2014-09-16 16:24:00	-13.531	1
4	80	zx23abc12a	zx23abc12a	2.25	2013-01-21 11:20:10	-3.231	1
3	201	xx23abc12a	xx23abc12a	-2.25	2015-11-21 11:20:10	3.231	1
7	400	yx23abc12a	yx23abc12a	85.85	2014-09-17 16:20:21	-93.131	0
9	610	ukx23abc12	ukx23abc12	-1.85	2014-09-19 16:20:21	99.131	0
select * from tbl1 where i1>(19 mod 10)+1 and i1<=1000;
pk	i1	v2	i3	i4	d4	i5	i6
10	42	kx23abc12a	kx23abc12a	-85.86	2014-09-18 16:20:21	-99.131	1
8	50	vx23abc12a	vx23abc12a	-85.85	2014-09-10 16:20:21	93.131	1
5	53	cx23abc12a	cx23abc12a	109.25	2016-01-22 11:20:10	-13.131	0
6	78	tx23abc12a	tx23abc12a	-109.25	2014-09-16 16:24:00	-13.531	1
4	80	zx23abc12a	zx23abc12a	2.25	2013-01-21 11:20:10	-3.231	1
3	201	xx23abc12a	xx23abc12a	-2.25	2015-11-21 11:20:10	3.231	1
7	400	yx23abc12a	yx23abc12a	85.85	2014-09-17 16:20:21	-93.131	0
9	610	ukx23abc12	ukx23abc12	-1.85	2014-09-19 16:20:21	99.131	0
select * from tbl1 where i1>(19 mod 10)+1 and i1<=(1000 mod 1001) +10;
pk	i1	v2	i3	i4	d4	i5	i6
10	42	kx23abc12a	kx23abc12a	-85.86	2014-09-18 16:20:21	-99.131	1
8	50	vx23abc12a	vx23abc12a	-85.85	2014-09-10 16:20:21	93.131	1
5	53	cx23abc12a	cx23abc12a	109.25	2016-01-22 11:20:10	-13.131	0
6	78	tx23abc12a	tx23abc12a	-109.25	2014-09-16 16:24:00	-13.531	1
4	80	zx23abc12a	zx23abc12a	2.25	2013-01-21 11:20:10	-3.231	1
3	201	xx23abc12a	xx23abc12a	-2.25	2015-11-21 11:20:10	3.231	1
7	400	yx23abc12a	yx23abc12a	85.85	2014-09-17 16:20:21	-93.131	0
9	610	ukx23abc12	ukx23abc12	-1.85	2014-09-19 16:20:21	99.131	0
select * from tbl1 where i1>10 and i1<=(1000 mod 1001) +10;
pk	i1	v2	i3	i4	d4	i5	i6
10	42	kx23abc12a	kx23abc12a	-85.86	2014-09-18 16:20:21	-99.131	1
8	50	vx23abc12a	vx23abc12a	-85.85	2014-09-10 16:20:21	93.131	1
5	53	cx23abc12a	cx23abc12a	109.25	2016-01-22 11:20:10	-13.131	0
6	78	tx23abc12a	tx23abc12a	-109.25	2014-09-16 16:24:00	-13.531	1
4	80	zx23abc12a	zx23abc12a	2.25	2013-01-21 11:20:10	-3.231	1
3	201	xx23abc12a	xx23abc12a	-2.25	2015-11-21 11:20:10	3.231	1
7	400	yx23abc12a	yx23abc12a	85.85	2014-09-17 16:20:21	-93.131	0
9	610	ukx23abc12	ukx23abc12	-1.85	2014-09-19 16:20:21	99.131	0
select * from tbl1 where i1>10+0 and i1<=(1000*1001) +10;
pk	i1	v2	i3	i4	d4	i5	i6
10	42	kx23abc12a	kx23abc12a	-85.86	2014-09-18 16:20:21	-99.131	1
8	50	vx23abc12a	vx23abc12a	-85.85	2014-09-10 16:20:21	93.131	1
5	53	cx23abc12a	cx23abc12a	109.25	2016-01-22 11:20:10	-13.131	0
6	78	tx23abc12a	tx23abc12a	-109.25	2014-09-16 16:24:00	-13.531	1
4	80	zx23abc12a	zx23abc12a	2.25	2013-01-21 11:20:10	-3.231	1
3	201	xx23abc12a	xx23abc12a	-2.25	2015-11-21 11:20:10	3.231	1
7	400	yx23abc12a	yx23abc12a	85.85	2014-09-17 16:20:21	-93.131	0
9	610	ukx23abc12	ukx23abc12	-1.85	2014-09-19 16:20:21	99.131	0
select * from tbl1 where i1>=10+null and i1<=(1000*1001) +10;
pk	i1	v2	i3	i4	d4	i5	i6
select * from tbl1 where i1>=10+1 and i1<=(1000*2) +null;
pk	i1	v2	i3	i4	d4	i5	i6
select * from tbl1 where i1>=10+1 and i1<=(1000*2) or i1 is null;
pk	i1	v2	i3	i4	d4	i5	i6
10	42	kx23abc12a	kx23abc12a	-85.86	2014-09-18 16:20:21	-99.131	1
8	50	vx23abc12a	vx23abc12a	-85.85	2014-09-10 16:20:21	93.131	1
5	53	cx23abc12a	cx23abc12a	109.25	2016-01-22 11:20:10	-13.131	0
6	78	tx23abc12a	tx23abc12a	-109.25	2014-09-16 16:24:00	-13.531	1
4	80	zx23abc12a	zx23abc12a	2.25	2013-01-21 11:20:10	-3.231	1
3	201	xx23abc12a	xx23abc12a	-2.25	2015-11-21 11:20:10	3.231	1
7	400	yx23abc12a	yx23abc12a	85.85	2014-09-17 16:20:21	-93.131	0
9	610	ukx23abc12	ukx23abc12	-1.85	2014-09-19 16:20:21	99.131	0
11	NULL	NULL	NULL	NULL	NULL	NULL	NULL
update tbl1 set i1=i1+1-1 where i1>=10+1 and i1<=(1000*2) or i1 is null;
select * from tbl1 where i1>=10+1 and i1<=(1000*2) or i1 is (null+1);
ERROR 42000: You have an error in your SQL syntax; check the manual that corresponds to your OceanBase version for the right syntax to use near '(null+1)' at line 1
select * from tbl1 where i1>=10+1 and i1<=(1000*2) or i1 is null+1;
ERROR 22000: OB-5083: Invalid data type for the operation
select * from tbl1 where i1>=10+1 and i1<=(1000*2) and i1 is null;
pk	i1	v2	i3	i4	d4	i5	i6
select * from tbl1 where i1>=10+1 and i1<=(1000*2) and i1 is not  null;
pk	i1	v2	i3	i4	d4	i5	i6
10	42	kx23abc12a	kx23abc12a	-85.86	2014-09-18 16:20:21	-99.131	1
8	50	vx23abc12a	vx23abc12a	-85.85	2014-09-10 16:20:21	93.131	1
5	53	cx23abc12a	cx23abc12a	109.25	2016-01-22 11:20:10	-13.131	0
6	78	tx23abc12a	tx23abc12a	-109.25	2014-09-16 16:24:00	-13.531	1
4	80	zx23abc12a	zx23abc12a	2.25	2013-01-21 11:20:10	-3.231	1
3	201	xx23abc12a	xx23abc12a	-2.25	2015-11-21 11:20:10	3.231	1
7	400	yx23abc12a	yx23abc12a	85.85	2014-09-17 16:20:21	-93.131	0
9	610	ukx23abc12	ukx23abc12	-1.85	2014-09-19 16:20:21	99.131	0
update tbl1 set i1=i1+100-100  where i1>=10+1 and i1<=(1000*2) and i1 is not  null;
select * from tbl1 where i1>=10+1 and i1<=(100*2) or i1 = 610;
pk	i1	v2	i3	i4	d4	i5	i6
10	42	kx23abc12a	kx23abc12a	-85.86	2014-09-18 16:20:21	-99.131	1
8	50	vx23abc12a	vx23abc12a	-85.85	2014-09-10 16:20:21	93.131	1
5	53	cx23abc12a	cx23abc12a	109.25	2016-01-22 11:20:10	-13.131	0
6	78	tx23abc12a	tx23abc12a	-109.25	2014-09-16 16:24:00	-13.531	1
4	80	zx23abc12a	zx23abc12a	2.25	2013-01-21 11:20:10	-3.231	1
9	610	ukx23abc12	ukx23abc12	-1.85	2014-09-19 16:20:21	99.131	0
select * from tbl1 where i1>=10+1 and i1<=(100*2) or i3 = 'cx23abc12';
pk	i1	v2	i3	i4	d4	i5	i6
4	80	zx23abc12a	zx23abc12a	2.25	2013-01-21 11:20:10	-3.231	1
5	53	cx23abc12a	cx23abc12a	109.25	2016-01-22 11:20:10	-13.131	0
6	78	tx23abc12a	tx23abc12a	-109.25	2014-09-16 16:24:00	-13.531	1
8	50	vx23abc12a	vx23abc12a	-85.85	2014-09-10 16:20:21	93.131	1
10	42	kx23abc12a	kx23abc12a	-85.86	2014-09-18 16:20:21	-99.131	1
select * from tbl1 where i1>=10+1 and i1<=(100*2) and i5  between 0 and 1000;
pk	i1	v2	i3	i4	d4	i5	i6
8	50	vx23abc12a	vx23abc12a	-85.85	2014-09-10 16:20:21	93.131	1
prepare stmt1 from select * from tbl1 where i1>=?+1 and i1<=(?*2) and i5  between ? and ?;
set @a=10;
set @b=100;
set @c=0;
set @d=1000;
execute stmt1 using @a, @b,@c,@d;
pk	i1	v2	i3	i4	d4	i5	i6
8	50	vx23abc12a	vx23abc12a	-85.85	2014-09-10 16:20:21	93.131	1
set @a=10+1-1;
set @b=1000-1+1;
set @c=0+1000-1+1-1000;
set @d=1000-1+1;
execute stmt1 using @a, @b,@c,@d;
pk	i1	v2	i3	i4	d4	i5	i6
8	50	vx23abc12a	vx23abc12a	-85.85	2014-09-10 16:20:21	93.131	1
3	201	xx23abc12a	xx23abc12a	-2.25	2015-11-21 11:20:10	3.231	1
9	610	ukx23abc12	ukx23abc12	-1.85	2014-09-19 16:20:21	99.131	0
prepare stmt1 from update tbl1 set i1=i1+15-15 where i1>=?+1 and i1<=(?*2) and i5  between ? and ?;
set @a=10;
set @b=100;
set @c=0;
set @d=1000;
execute stmt1 using @a, @b,@c,@d;
set @a=10+1-1;
set @b=1000-1+1;
set @c=0+1000-1+1-1000;
set @d=1000-1+1;
execute stmt1 using @a, @b,@c,@d;
select * from tbl1 where i1>=10+1 and i1<=(100*10) and i5  between -100 and 1000;
pk	i1	v2	i3	i4	d4	i5	i6
10	42	kx23abc12a	kx23abc12a	-85.86	2014-09-18 16:20:21	-99.131	1
8	50	vx23abc12a	vx23abc12a	-85.85	2014-09-10 16:20:21	93.131	1
5	53	cx23abc12a	cx23abc12a	109.25	2016-01-22 11:20:10	-13.131	0
6	78	tx23abc12a	tx23abc12a	-109.25	2014-09-16 16:24:00	-13.531	1
4	80	zx23abc12a	zx23abc12a	2.25	2013-01-21 11:20:10	-3.231	1
3	201	xx23abc12a	xx23abc12a	-2.25	2015-11-21 11:20:10	3.231	1
7	400	yx23abc12a	yx23abc12a	85.85	2014-09-17 16:20:21	-93.131	0
9	610	ukx23abc12	ukx23abc12	-1.85	2014-09-19 16:20:21	99.131	0
select * from tbl1 where i1 between 10+1 and (100*10) and i5  between -100 and 1000;
pk	i1	v2	i3	i4	d4	i5	i6
10	42	kx23abc12a	kx23abc12a	-85.86	2014-09-18 16:20:21	-99.131	1
8	50	vx23abc12a	vx23abc12a	-85.85	2014-09-10 16:20:21	93.131	1
5	53	cx23abc12a	cx23abc12a	109.25	2016-01-22 11:20:10	-13.131	0
6	78	tx23abc12a	tx23abc12a	-109.25	2014-09-16 16:24:00	-13.531	1
4	80	zx23abc12a	zx23abc12a	2.25	2013-01-21 11:20:10	-3.231	1
3	201	xx23abc12a	xx23abc12a	-2.25	2015-11-21 11:20:10	3.231	1
7	400	yx23abc12a	yx23abc12a	85.85	2014-09-17 16:20:21	-93.131	0
9	610	ukx23abc12	ukx23abc12	-1.85	2014-09-19 16:20:21	99.131	0
select * from tbl1 where i1<=round(1000.5) and i1>=round(0.5);
pk	i1	v2	i3	i4	d4	i5	i6
1	1	abc12abc	abc12abc	1.25	2014-01-01 12:00:00	23.23	1
2	10	23abc12abc	23abc12abc	-0.25	2015-11-01 12:00:00	-23.23	0
3	201	xx23abc12a	xx23abc12a	-2.25	2015-11-21 11:20:10	3.231	1
4	80	zx23abc12a	zx23abc12a	2.25	2013-01-21 11:20:10	-3.231	1
5	53	cx23abc12a	cx23abc12a	109.25	2016-01-22 11:20:10	-13.131	0
6	78	tx23abc12a	tx23abc12a	-109.25	2014-09-16 16:24:00	-13.531	1
7	400	yx23abc12a	yx23abc12a	85.85	2014-09-17 16:20:21	-93.131	0
8	50	vx23abc12a	vx23abc12a	-85.85	2014-09-10 16:20:21	93.131	1
9	610	ukx23abc12	ukx23abc12	-1.85	2014-09-19 16:20:21	99.131	0
10	42	kx23abc12a	kx23abc12a	-85.86	2014-09-18 16:20:21	-99.131	1
update  tbl1  set i1=i1*2/2 where i1<=round(1000.5) and i1>=round(0.5);
select * from tbl1 where  i1>=0 and i1<=EXTRACT(DAY FROM '2014-09-30 12:00:00' )+600;
pk	i1	v2	i3	i4	d4	i5	i6
1	1	abc12abc	abc12abc	1.25	2014-01-01 12:00:00	23.23	1
2	10	23abc12abc	23abc12abc	-0.25	2015-11-01 12:00:00	-23.23	0
10	42	kx23abc12a	kx23abc12a	-85.86	2014-09-18 16:20:21	-99.131	1
8	50	vx23abc12a	vx23abc12a	-85.85	2014-09-10 16:20:21	93.131	1
5	53	cx23abc12a	cx23abc12a	109.25	2016-01-22 11:20:10	-13.131	0
6	78	tx23abc12a	tx23abc12a	-109.25	2014-09-16 16:24:00	-13.531	1
4	80	zx23abc12a	zx23abc12a	2.25	2013-01-21 11:20:10	-3.231	1
3	201	xx23abc12a	xx23abc12a	-2.25	2015-11-21 11:20:10	3.231	1
7	400	yx23abc12a	yx23abc12a	85.85	2014-09-17 16:20:21	-93.131	0
9	610	ukx23abc12	ukx23abc12	-1.85	2014-09-19 16:20:21	99.131	0
select * from tbl1 where  i1>=EXTRACT(DAY FROM '2014-09-30 12:00:00' )-29 and i1<=EXTRACT(DAY FROM '2014-09-30 12:00:00' )+600;
pk	i1	v2	i3	i4	d4	i5	i6
1	1	abc12abc	abc12abc	1.25	2014-01-01 12:00:00	23.23	1
2	10	23abc12abc	23abc12abc	-0.25	2015-11-01 12:00:00	-23.23	0
10	42	kx23abc12a	kx23abc12a	-85.86	2014-09-18 16:20:21	-99.131	1
8	50	vx23abc12a	vx23abc12a	-85.85	2014-09-10 16:20:21	93.131	1
5	53	cx23abc12a	cx23abc12a	109.25	2016-01-22 11:20:10	-13.131	0
6	78	tx23abc12a	tx23abc12a	-109.25	2014-09-16 16:24:00	-13.531	1
4	80	zx23abc12a	zx23abc12a	2.25	2013-01-21 11:20:10	-3.231	1
3	201	xx23abc12a	xx23abc12a	-2.25	2015-11-21 11:20:10	3.231	1
7	400	yx23abc12a	yx23abc12a	85.85	2014-09-17 16:20:21	-93.131	0
9	610	ukx23abc12	ukx23abc12	-1.85	2014-09-19 16:20:21	99.131	0
update tbl1 set i1=i1+1-1 where  i1>=EXTRACT(DAY FROM '2014-09-30 12:00:00' )-29 and i1<=EXTRACT(DAY FROM '2014-09-30 12:00:00' )+600;
update tbl1 set i5=i5+1-1 where  i1>=EXTRACT(DAY FROM '2014-09-30 12:00:00' )-29 and i1<=EXTRACT(DAY FROM '2014-09-30 12:00:00' )+600;
drop index idx_1 on tbl1;
create index idx_12 on tbl1(i1,i5);
alter system major freeze tenant = sys;
alter system major freeze tenant = all_user;
alter system major freeze tenant = all_meta;
select * from tbl1 where i1>10 and i1<=1000;
pk	i1	v2	i3	i4	d4	i5	i6
10	42	kx23abc12a	kx23abc12a	-85.86	2014-09-18 16:20:21	-99.131	1
8	50	vx23abc12a	vx23abc12a	-85.85	2014-09-10 16:20:21	93.131	1
5	53	cx23abc12a	cx23abc12a	109.25	2016-01-22 11:20:10	-13.131	0
6	78	tx23abc12a	tx23abc12a	-109.25	2014-09-16 16:24:00	-13.531	1
4	80	zx23abc12a	zx23abc12a	2.25	2013-01-21 11:20:10	-3.231	1
3	201	xx23abc12a	xx23abc12a	-2.25	2015-11-21 11:20:10	3.231	1
7	400	yx23abc12a	yx23abc12a	85.85	2014-09-17 16:20:21	-93.131	0
9	610	ukx23abc12	ukx23abc12	-1.85	2014-09-19 16:20:21	99.131	0
select * from tbl1 where i1>10+1 and i1<1000;
pk	i1	v2	i3	i4	d4	i5	i6
10	42	kx23abc12a	kx23abc12a	-85.86	2014-09-18 16:20:21	-99.131	1
8	50	vx23abc12a	vx23abc12a	-85.85	2014-09-10 16:20:21	93.131	1
5	53	cx23abc12a	cx23abc12a	109.25	2016-01-22 11:20:10	-13.131	0
6	78	tx23abc12a	tx23abc12a	-109.25	2014-09-16 16:24:00	-13.531	1
4	80	zx23abc12a	zx23abc12a	2.25	2013-01-21 11:20:10	-3.231	1
3	201	xx23abc12a	xx23abc12a	-2.25	2015-11-21 11:20:10	3.231	1
7	400	yx23abc12a	yx23abc12a	85.85	2014-09-17 16:20:21	-93.131	0
9	610	ukx23abc12	ukx23abc12	-1.85	2014-09-19 16:20:21	99.131	0
select * from tbl1 where i1>10 and i1<1000-10;
pk	i1	v2	i3	i4	d4	i5	i6
10	42	kx23abc12a	kx23abc12a	-85.86	2014-09-18 16:20:21	-99.131	1
8	50	vx23abc12a	vx23abc12a	-85.85	2014-09-10 16:20:21	93.131	1
5	53	cx23abc12a	cx23abc12a	109.25	2016-01-22 11:20:10	-13.131	0
6	78	tx23abc12a	tx23abc12a	-109.25	2014-09-16 16:24:00	-13.531	1
4	80	zx23abc12a	zx23abc12a	2.25	2013-01-21 11:20:10	-3.231	1
3	201	xx23abc12a	xx23abc12a	-2.25	2015-11-21 11:20:10	3.231	1
7	400	yx23abc12a	yx23abc12a	85.85	2014-09-17 16:20:21	-93.131	0
9	610	ukx23abc12	ukx23abc12	-1.85	2014-09-19 16:20:21	99.131	0
select * from tbl1 where i1>10+1 and i1<1000-10;
pk	i1	v2	i3	i4	d4	i5	i6
10	42	kx23abc12a	kx23abc12a	-85.86	2014-09-18 16:20:21	-99.131	1
8	50	vx23abc12a	vx23abc12a	-85.85	2014-09-10 16:20:21	93.131	1
5	53	cx23abc12a	cx23abc12a	109.25	2016-01-22 11:20:10	-13.131	0
6	78	tx23abc12a	tx23abc12a	-109.25	2014-09-16 16:24:00	-13.531	1
4	80	zx23abc12a	zx23abc12a	2.25	2013-01-21 11:20:10	-3.231	1
3	201	xx23abc12a	xx23abc12a	-2.25	2015-11-21 11:20:10	3.231	1
7	400	yx23abc12a	yx23abc12a	85.85	2014-09-17 16:20:21	-93.131	0
9	610	ukx23abc12	ukx23abc12	-1.85	2014-09-19 16:20:21	99.131	0
select * from tbl1 where i1>1*10+1 and i1<1000;
pk	i1	v2	i3	i4	d4	i5	i6
10	42	kx23abc12a	kx23abc12a	-85.86	2014-09-18 16:20:21	-99.131	1
8	50	vx23abc12a	vx23abc12a	-85.85	2014-09-10 16:20:21	93.131	1
5	53	cx23abc12a	cx23abc12a	109.25	2016-01-22 11:20:10	-13.131	0
6	78	tx23abc12a	tx23abc12a	-109.25	2014-09-16 16:24:00	-13.531	1
4	80	zx23abc12a	zx23abc12a	2.25	2013-01-21 11:20:10	-3.231	1
3	201	xx23abc12a	xx23abc12a	-2.25	2015-11-21 11:20:10	3.231	1
7	400	yx23abc12a	yx23abc12a	85.85	2014-09-17 16:20:21	-93.131	0
9	610	ukx23abc12	ukx23abc12	-1.85	2014-09-19 16:20:21	99.131	0
select * from tbl1 where i1>10 and i1<=1000*2;
pk	i1	v2	i3	i4	d4	i5	i6
10	42	kx23abc12a	kx23abc12a	-85.86	2014-09-18 16:20:21	-99.131	1
8	50	vx23abc12a	vx23abc12a	-85.85	2014-09-10 16:20:21	93.131	1
5	53	cx23abc12a	cx23abc12a	109.25	2016-01-22 11:20:10	-13.131	0
6	78	tx23abc12a	tx23abc12a	-109.25	2014-09-16 16:24:00	-13.531	1
4	80	zx23abc12a	zx23abc12a	2.25	2013-01-21 11:20:10	-3.231	1
3	201	xx23abc12a	xx23abc12a	-2.25	2015-11-21 11:20:10	3.231	1
7	400	yx23abc12a	yx23abc12a	85.85	2014-09-17 16:20:21	-93.131	0
9	610	ukx23abc12	ukx23abc12	-1.85	2014-09-19 16:20:21	99.131	0
select * from tbl1 where i1>10*2+3 and i1<=1000*2;
pk	i1	v2	i3	i4	d4	i5	i6
10	42	kx23abc12a	kx23abc12a	-85.86	2014-09-18 16:20:21	-99.131	1
8	50	vx23abc12a	vx23abc12a	-85.85	2014-09-10 16:20:21	93.131	1
5	53	cx23abc12a	cx23abc12a	109.25	2016-01-22 11:20:10	-13.131	0
6	78	tx23abc12a	tx23abc12a	-109.25	2014-09-16 16:24:00	-13.531	1
4	80	zx23abc12a	zx23abc12a	2.25	2013-01-21 11:20:10	-3.231	1
3	201	xx23abc12a	xx23abc12a	-2.25	2015-11-21 11:20:10	3.231	1
7	400	yx23abc12a	yx23abc12a	85.85	2014-09-17 16:20:21	-93.131	0
9	610	ukx23abc12	ukx23abc12	-1.85	2014-09-19 16:20:21	99.131	0
select * from tbl1 where i1>10 and i1<=(1000 mod 1001) +10;
pk	i1	v2	i3	i4	d4	i5	i6
10	42	kx23abc12a	kx23abc12a	-85.86	2014-09-18 16:20:21	-99.131	1
8	50	vx23abc12a	vx23abc12a	-85.85	2014-09-10 16:20:21	93.131	1
5	53	cx23abc12a	cx23abc12a	109.25	2016-01-22 11:20:10	-13.131	0
6	78	tx23abc12a	tx23abc12a	-109.25	2014-09-16 16:24:00	-13.531	1
4	80	zx23abc12a	zx23abc12a	2.25	2013-01-21 11:20:10	-3.231	1
3	201	xx23abc12a	xx23abc12a	-2.25	2015-11-21 11:20:10	3.231	1
7	400	yx23abc12a	yx23abc12a	85.85	2014-09-17 16:20:21	-93.131	0
9	610	ukx23abc12	ukx23abc12	-1.85	2014-09-19 16:20:21	99.131	0
select * from tbl1 where i1>10+0 and i1<=(1000*1001) +10;
pk	i1	v2	i3	i4	d4	i5	i6
10	42	kx23abc12a	kx23abc12a	-85.86	2014-09-18 16:20:21	-99.131	1
8	50	vx23abc12a	vx23abc12a	-85.85	2014-09-10 16:20:21	93.131	1
5	53	cx23abc12a	cx23abc12a	109.25	2016-01-22 11:20:10	-13.131	0
6	78	tx23abc12a	tx23abc12a	-109.25	2014-09-16 16:24:00	-13.531	1
4	80	zx23abc12a	zx23abc12a	2.25	2013-01-21 11:20:10	-3.231	1
3	201	xx23abc12a	xx23abc12a	-2.25	2015-11-21 11:20:10	3.231	1
7	400	yx23abc12a	yx23abc12a	85.85	2014-09-17 16:20:21	-93.131	0
9	610	ukx23abc12	ukx23abc12	-1.85	2014-09-19 16:20:21	99.131	0
select * from tbl1 where i1>=10+null and i1<=(1000*1001) +10;
pk	i1	v2	i3	i4	d4	i5	i6
select * from tbl1 where i1>=10+1 and i1<=(1000*2) +null;
pk	i1	v2	i3	i4	d4	i5	i6
select * from tbl1 where i1>=10+1 and i1<=(1000*2) or i1 is null;
pk	i1	v2	i3	i4	d4	i5	i6
10	42	kx23abc12a	kx23abc12a	-85.86	2014-09-18 16:20:21	-99.131	1
8	50	vx23abc12a	vx23abc12a	-85.85	2014-09-10 16:20:21	93.131	1
5	53	cx23abc12a	cx23abc12a	109.25	2016-01-22 11:20:10	-13.131	0
6	78	tx23abc12a	tx23abc12a	-109.25	2014-09-16 16:24:00	-13.531	1
4	80	zx23abc12a	zx23abc12a	2.25	2013-01-21 11:20:10	-3.231	1
3	201	xx23abc12a	xx23abc12a	-2.25	2015-11-21 11:20:10	3.231	1
7	400	yx23abc12a	yx23abc12a	85.85	2014-09-17 16:20:21	-93.131	0
9	610	ukx23abc12	ukx23abc12	-1.85	2014-09-19 16:20:21	99.131	0
11	NULL	NULL	NULL	NULL	NULL	NULL	NULL
select * from tbl1 where i1>=10+1 and i1<=(1000*2) and i1 is null;
pk	i1	v2	i3	i4	d4	i5	i6
select * from tbl1 where i1>=10+1 and i1<=(1000*2) and i1 is not  null;
pk	i1	v2	i3	i4	d4	i5	i6
10	42	kx23abc12a	kx23abc12a	-85.86	2014-09-18 16:20:21	-99.131	1
8	50	vx23abc12a	vx23abc12a	-85.85	2014-09-10 16:20:21	93.131	1
5	53	cx23abc12a	cx23abc12a	109.25	2016-01-22 11:20:10	-13.131	0
6	78	tx23abc12a	tx23abc12a	-109.25	2014-09-16 16:24:00	-13.531	1
4	80	zx23abc12a	zx23abc12a	2.25	2013-01-21 11:20:10	-3.231	1
3	201	xx23abc12a	xx23abc12a	-2.25	2015-11-21 11:20:10	3.231	1
7	400	yx23abc12a	yx23abc12a	85.85	2014-09-17 16:20:21	-93.131	0
9	610	ukx23abc12	ukx23abc12	-1.85	2014-09-19 16:20:21	99.131	0
select * from tbl1 where i1>=10+1 and i1<=(100*2) or i1 = 610;
pk	i1	v2	i3	i4	d4	i5	i6
10	42	kx23abc12a	kx23abc12a	-85.86	2014-09-18 16:20:21	-99.131	1
8	50	vx23abc12a	vx23abc12a	-85.85	2014-09-10 16:20:21	93.131	1
5	53	cx23abc12a	cx23abc12a	109.25	2016-01-22 11:20:10	-13.131	0
6	78	tx23abc12a	tx23abc12a	-109.25	2014-09-16 16:24:00	-13.531	1
4	80	zx23abc12a	zx23abc12a	2.25	2013-01-21 11:20:10	-3.231	1
9	610	ukx23abc12	ukx23abc12	-1.85	2014-09-19 16:20:21	99.131	0
select * from tbl1 where i1>=10+1 and i1<=(100*2) or i3 = 'cx23abc12';
pk	i1	v2	i3	i4	d4	i5	i6
4	80	zx23abc12a	zx23abc12a	2.25	2013-01-21 11:20:10	-3.231	1
5	53	cx23abc12a	cx23abc12a	109.25	2016-01-22 11:20:10	-13.131	0
6	78	tx23abc12a	tx23abc12a	-109.25	2014-09-16 16:24:00	-13.531	1
8	50	vx23abc12a	vx23abc12a	-85.85	2014-09-10 16:20:21	93.131	1
10	42	kx23abc12a	kx23abc12a	-85.86	2014-09-18 16:20:21	-99.131	1
select * from tbl1 where i1>=10+1 and i1<=(100*2) and i5  between 0 and 1000;
pk	i1	v2	i3	i4	d4	i5	i6
8	50	vx23abc12a	vx23abc12a	-85.85	2014-09-10 16:20:21	93.131	1
select * from tbl1 where i1>=10+1 and i1<=(100*10) and i5  between -100 and 1000;
pk	i1	v2	i3	i4	d4	i5	i6
10	42	kx23abc12a	kx23abc12a	-85.86	2014-09-18 16:20:21	-99.131	1
8	50	vx23abc12a	vx23abc12a	-85.85	2014-09-10 16:20:21	93.131	1
5	53	cx23abc12a	cx23abc12a	109.25	2016-01-22 11:20:10	-13.131	0
6	78	tx23abc12a	tx23abc12a	-109.25	2014-09-16 16:24:00	-13.531	1
4	80	zx23abc12a	zx23abc12a	2.25	2013-01-21 11:20:10	-3.231	1
3	201	xx23abc12a	xx23abc12a	-2.25	2015-11-21 11:20:10	3.231	1
7	400	yx23abc12a	yx23abc12a	85.85	2014-09-17 16:20:21	-93.131	0
9	610	ukx23abc12	ukx23abc12	-1.85	2014-09-19 16:20:21	99.131	0
select * from tbl1 where i1<=round(1000.5) and i1>=round(0.5);
pk	i1	v2	i3	i4	d4	i5	i6
1	1	abc12abc	abc12abc	1.25	2014-01-01 12:00:00	23.23	1
2	10	23abc12abc	23abc12abc	-0.25	2015-11-01 12:00:00	-23.23	0
3	201	xx23abc12a	xx23abc12a	-2.25	2015-11-21 11:20:10	3.231	1
4	80	zx23abc12a	zx23abc12a	2.25	2013-01-21 11:20:10	-3.231	1
5	53	cx23abc12a	cx23abc12a	109.25	2016-01-22 11:20:10	-13.131	0
6	78	tx23abc12a	tx23abc12a	-109.25	2014-09-16 16:24:00	-13.531	1
7	400	yx23abc12a	yx23abc12a	85.85	2014-09-17 16:20:21	-93.131	0
8	50	vx23abc12a	vx23abc12a	-85.85	2014-09-10 16:20:21	93.131	1
9	610	ukx23abc12	ukx23abc12	-1.85	2014-09-19 16:20:21	99.131	0
10	42	kx23abc12a	kx23abc12a	-85.86	2014-09-18 16:20:21	-99.131	1
select * from tbl1 where  i1>=0 and i1<=EXTRACT(DAY FROM '2014-09-30 12:00:00' )+600;
pk	i1	v2	i3	i4	d4	i5	i6
1	1	abc12abc	abc12abc	1.25	2014-01-01 12:00:00	23.23	1
2	10	23abc12abc	23abc12abc	-0.25	2015-11-01 12:00:00	-23.23	0
10	42	kx23abc12a	kx23abc12a	-85.86	2014-09-18 16:20:21	-99.131	1
8	50	vx23abc12a	vx23abc12a	-85.85	2014-09-10 16:20:21	93.131	1
5	53	cx23abc12a	cx23abc12a	109.25	2016-01-22 11:20:10	-13.131	0
6	78	tx23abc12a	tx23abc12a	-109.25	2014-09-16 16:24:00	-13.531	1
4	80	zx23abc12a	zx23abc12a	2.25	2013-01-21 11:20:10	-3.231	1
3	201	xx23abc12a	xx23abc12a	-2.25	2015-11-21 11:20:10	3.231	1
7	400	yx23abc12a	yx23abc12a	85.85	2014-09-17 16:20:21	-93.131	0
9	610	ukx23abc12	ukx23abc12	-1.85	2014-09-19 16:20:21	99.131	0
select * from tbl1 where  i1>=EXTRACT(DAY FROM '2014-09-30 12:00:00' )-29 and i1<=EXTRACT(DAY FROM '2014-09-30 12:00:00' )+600;
pk	i1	v2	i3	i4	d4	i5	i6
1	1	abc12abc	abc12abc	1.25	2014-01-01 12:00:00	23.23	1
2	10	23abc12abc	23abc12abc	-0.25	2015-11-01 12:00:00	-23.23	0
10	42	kx23abc12a	kx23abc12a	-85.86	2014-09-18 16:20:21	-99.131	1
8	50	vx23abc12a	vx23abc12a	-85.85	2014-09-10 16:20:21	93.131	1
5	53	cx23abc12a	cx23abc12a	109.25	2016-01-22 11:20:10	-13.131	0
6	78	tx23abc12a	tx23abc12a	-109.25	2014-09-16 16:24:00	-13.531	1
4	80	zx23abc12a	zx23abc12a	2.25	2013-01-21 11:20:10	-3.231	1
3	201	xx23abc12a	xx23abc12a	-2.25	2015-11-21 11:20:10	3.231	1
7	400	yx23abc12a	yx23abc12a	85.85	2014-09-17 16:20:21	-93.131	0
9	610	ukx23abc12	ukx23abc12	-1.85	2014-09-19 16:20:21	99.131	0
select * from tbl1 where i1 in(1,10,42,50,null,610,400);
pk	i1	v2	i3	i4	d4	i5	i6
1	1	abc12abc	abc12abc	1.25	2014-01-01 12:00:00	23.23	1
2	10	23abc12abc	23abc12abc	-0.25	2015-11-01 12:00:00	-23.23	0
10	42	kx23abc12a	kx23abc12a	-85.86	2014-09-18 16:20:21	-99.131	1
8	50	vx23abc12a	vx23abc12a	-85.85	2014-09-10 16:20:21	93.131	1
9	610	ukx23abc12	ukx23abc12	-1.85	2014-09-19 16:20:21	99.131	0
7	400	yx23abc12a	yx23abc12a	85.85	2014-09-17 16:20:21	-93.131	0
select * from tbl1 where (i1,i4) in((1,1.25),(10,-0.25),(80,2.25),(42,-85.85));
pk	i1	v2	i3	i4	d4	i5	i6
1	1	abc12abc	abc12abc	1.25	2014-01-01 12:00:00	23.23	1
2	10	23abc12abc	23abc12abc	-0.25	2015-11-01 12:00:00	-23.23	0
4	80	zx23abc12a	zx23abc12a	2.25	2013-01-21 11:20:10	-3.231	1
select * from tbl1 where (i4,i1) in ((1.25,1),(-0.25,10),(-85.85,42),(2.25,80));
pk	i1	v2	i3	i4	d4	i5	i6
1	1	abc12abc	abc12abc	1.25	2014-01-01 12:00:00	23.23	1
2	10	23abc12abc	23abc12abc	-0.25	2015-11-01 12:00:00	-23.23	0
4	80	zx23abc12a	zx23abc12a	2.25	2013-01-21 11:20:10	-3.231	1
create index idx_15 on tbl1(i1,i5);
alter system major freeze tenant = sys;
alter system major freeze tenant = all_user;
alter system major freeze tenant = all_meta;
select * from tbl1 where i1>10 and i1<=1000;
pk	i1	v2	i3	i4	d4	i5	i6
10	42	kx23abc12a	kx23abc12a	-85.86	2014-09-18 16:20:21	-99.131	1
8	50	vx23abc12a	vx23abc12a	-85.85	2014-09-10 16:20:21	93.131	1
5	53	cx23abc12a	cx23abc12a	109.25	2016-01-22 11:20:10	-13.131	0
6	78	tx23abc12a	tx23abc12a	-109.25	2014-09-16 16:24:00	-13.531	1
4	80	zx23abc12a	zx23abc12a	2.25	2013-01-21 11:20:10	-3.231	1
3	201	xx23abc12a	xx23abc12a	-2.25	2015-11-21 11:20:10	3.231	1
7	400	yx23abc12a	yx23abc12a	85.85	2014-09-17 16:20:21	-93.131	0
9	610	ukx23abc12	ukx23abc12	-1.85	2014-09-19 16:20:21	99.131	0
select * from tbl1 where i1>10+1 and i1<1000;
pk	i1	v2	i3	i4	d4	i5	i6
10	42	kx23abc12a	kx23abc12a	-85.86	2014-09-18 16:20:21	-99.131	1
8	50	vx23abc12a	vx23abc12a	-85.85	2014-09-10 16:20:21	93.131	1
5	53	cx23abc12a	cx23abc12a	109.25	2016-01-22 11:20:10	-13.131	0
6	78	tx23abc12a	tx23abc12a	-109.25	2014-09-16 16:24:00	-13.531	1
4	80	zx23abc12a	zx23abc12a	2.25	2013-01-21 11:20:10	-3.231	1
3	201	xx23abc12a	xx23abc12a	-2.25	2015-11-21 11:20:10	3.231	1
7	400	yx23abc12a	yx23abc12a	85.85	2014-09-17 16:20:21	-93.131	0
9	610	ukx23abc12	ukx23abc12	-1.85	2014-09-19 16:20:21	99.131	0
select * from tbl1 where i1>10 and i1<1000-10;
pk	i1	v2	i3	i4	d4	i5	i6
10	42	kx23abc12a	kx23abc12a	-85.86	2014-09-18 16:20:21	-99.131	1
8	50	vx23abc12a	vx23abc12a	-85.85	2014-09-10 16:20:21	93.131	1
5	53	cx23abc12a	cx23abc12a	109.25	2016-01-22 11:20:10	-13.131	0
6	78	tx23abc12a	tx23abc12a	-109.25	2014-09-16 16:24:00	-13.531	1
4	80	zx23abc12a	zx23abc12a	2.25	2013-01-21 11:20:10	-3.231	1
3	201	xx23abc12a	xx23abc12a	-2.25	2015-11-21 11:20:10	3.231	1
7	400	yx23abc12a	yx23abc12a	85.85	2014-09-17 16:20:21	-93.131	0
9	610	ukx23abc12	ukx23abc12	-1.85	2014-09-19 16:20:21	99.131	0
select * from tbl1 where i1>10+1 and i1<1000-10;
pk	i1	v2	i3	i4	d4	i5	i6
10	42	kx23abc12a	kx23abc12a	-85.86	2014-09-18 16:20:21	-99.131	1
8	50	vx23abc12a	vx23abc12a	-85.85	2014-09-10 16:20:21	93.131	1
5	53	cx23abc12a	cx23abc12a	109.25	2016-01-22 11:20:10	-13.131	0
6	78	tx23abc12a	tx23abc12a	-109.25	2014-09-16 16:24:00	-13.531	1
4	80	zx23abc12a	zx23abc12a	2.25	2013-01-21 11:20:10	-3.231	1
3	201	xx23abc12a	xx23abc12a	-2.25	2015-11-21 11:20:10	3.231	1
7	400	yx23abc12a	yx23abc12a	85.85	2014-09-17 16:20:21	-93.131	0
9	610	ukx23abc12	ukx23abc12	-1.85	2014-09-19 16:20:21	99.131	0
select * from tbl1 where i1>1*10+1 and i1<1000;
pk	i1	v2	i3	i4	d4	i5	i6
10	42	kx23abc12a	kx23abc12a	-85.86	2014-09-18 16:20:21	-99.131	1
8	50	vx23abc12a	vx23abc12a	-85.85	2014-09-10 16:20:21	93.131	1
5	53	cx23abc12a	cx23abc12a	109.25	2016-01-22 11:20:10	-13.131	0
6	78	tx23abc12a	tx23abc12a	-109.25	2014-09-16 16:24:00	-13.531	1
4	80	zx23abc12a	zx23abc12a	2.25	2013-01-21 11:20:10	-3.231	1
3	201	xx23abc12a	xx23abc12a	-2.25	2015-11-21 11:20:10	3.231	1
7	400	yx23abc12a	yx23abc12a	85.85	2014-09-17 16:20:21	-93.131	0
9	610	ukx23abc12	ukx23abc12	-1.85	2014-09-19 16:20:21	99.131	0
select * from tbl1 where i1>10 and i1<=1000*2;
pk	i1	v2	i3	i4	d4	i5	i6
10	42	kx23abc12a	kx23abc12a	-85.86	2014-09-18 16:20:21	-99.131	1
8	50	vx23abc12a	vx23abc12a	-85.85	2014-09-10 16:20:21	93.131	1
5	53	cx23abc12a	cx23abc12a	109.25	2016-01-22 11:20:10	-13.131	0
6	78	tx23abc12a	tx23abc12a	-109.25	2014-09-16 16:24:00	-13.531	1
4	80	zx23abc12a	zx23abc12a	2.25	2013-01-21 11:20:10	-3.231	1
3	201	xx23abc12a	xx23abc12a	-2.25	2015-11-21 11:20:10	3.231	1
7	400	yx23abc12a	yx23abc12a	85.85	2014-09-17 16:20:21	-93.131	0
9	610	ukx23abc12	ukx23abc12	-1.85	2014-09-19 16:20:21	99.131	0
select * from tbl1 where i1>10*2+3 and i1<=1000*2;
pk	i1	v2	i3	i4	d4	i5	i6
10	42	kx23abc12a	kx23abc12a	-85.86	2014-09-18 16:20:21	-99.131	1
8	50	vx23abc12a	vx23abc12a	-85.85	2014-09-10 16:20:21	93.131	1
5	53	cx23abc12a	cx23abc12a	109.25	2016-01-22 11:20:10	-13.131	0
6	78	tx23abc12a	tx23abc12a	-109.25	2014-09-16 16:24:00	-13.531	1
4	80	zx23abc12a	zx23abc12a	2.25	2013-01-21 11:20:10	-3.231	1
3	201	xx23abc12a	xx23abc12a	-2.25	2015-11-21 11:20:10	3.231	1
7	400	yx23abc12a	yx23abc12a	85.85	2014-09-17 16:20:21	-93.131	0
9	610	ukx23abc12	ukx23abc12	-1.85	2014-09-19 16:20:21	99.131	0
select * from tbl1 where i1>1*50/5+1 and i1<=1000*2/2+1;
pk	i1	v2	i3	i4	d4	i5	i6
3	201	xx23abc12a	xx23abc12a	-2.25	2015-11-21 11:20:10	3.231	1
4	80	zx23abc12a	zx23abc12a	2.25	2013-01-21 11:20:10	-3.231	1
5	53	cx23abc12a	cx23abc12a	109.25	2016-01-22 11:20:10	-13.131	0
6	78	tx23abc12a	tx23abc12a	-109.25	2014-09-16 16:24:00	-13.531	1
7	400	yx23abc12a	yx23abc12a	85.85	2014-09-17 16:20:21	-93.131	0
8	50	vx23abc12a	vx23abc12a	-85.85	2014-09-10 16:20:21	93.131	1
9	610	ukx23abc12	ukx23abc12	-1.85	2014-09-19 16:20:21	99.131	0
10	42	kx23abc12a	kx23abc12a	-85.86	2014-09-18 16:20:21	-99.131	1
select * from tbl1 where i1>50 and i1<=1000*2/2+1;
pk	i1	v2	i3	i4	d4	i5	i6
5	53	cx23abc12a	cx23abc12a	109.25	2016-01-22 11:20:10	-13.131	0
6	78	tx23abc12a	tx23abc12a	-109.25	2014-09-16 16:24:00	-13.531	1
4	80	zx23abc12a	zx23abc12a	2.25	2013-01-21 11:20:10	-3.231	1
3	201	xx23abc12a	xx23abc12a	-2.25	2015-11-21 11:20:10	3.231	1
7	400	yx23abc12a	yx23abc12a	85.85	2014-09-17 16:20:21	-93.131	0
9	610	ukx23abc12	ukx23abc12	-1.85	2014-09-19 16:20:21	99.131	0
select * from tbl1 where i1>50*1+3 and i1<=1000;
pk	i1	v2	i3	i4	d4	i5	i6
6	78	tx23abc12a	tx23abc12a	-109.25	2014-09-16 16:24:00	-13.531	1
4	80	zx23abc12a	zx23abc12a	2.25	2013-01-21 11:20:10	-3.231	1
3	201	xx23abc12a	xx23abc12a	-2.25	2015-11-21 11:20:10	3.231	1
7	400	yx23abc12a	yx23abc12a	85.85	2014-09-17 16:20:21	-93.131	0
9	610	ukx23abc12	ukx23abc12	-1.85	2014-09-19 16:20:21	99.131	0
select * from tbl1 where i1>(19 mod 10)+1 and i1<=1000;
pk	i1	v2	i3	i4	d4	i5	i6
10	42	kx23abc12a	kx23abc12a	-85.86	2014-09-18 16:20:21	-99.131	1
8	50	vx23abc12a	vx23abc12a	-85.85	2014-09-10 16:20:21	93.131	1
5	53	cx23abc12a	cx23abc12a	109.25	2016-01-22 11:20:10	-13.131	0
6	78	tx23abc12a	tx23abc12a	-109.25	2014-09-16 16:24:00	-13.531	1
4	80	zx23abc12a	zx23abc12a	2.25	2013-01-21 11:20:10	-3.231	1
3	201	xx23abc12a	xx23abc12a	-2.25	2015-11-21 11:20:10	3.231	1
7	400	yx23abc12a	yx23abc12a	85.85	2014-09-17 16:20:21	-93.131	0
9	610	ukx23abc12	ukx23abc12	-1.85	2014-09-19 16:20:21	99.131	0
select * from tbl1 where i1>(19 mod 10)+1 and i1<=(1000 mod 1001) +10;
pk	i1	v2	i3	i4	d4	i5	i6
10	42	kx23abc12a	kx23abc12a	-85.86	2014-09-18 16:20:21	-99.131	1
8	50	vx23abc12a	vx23abc12a	-85.85	2014-09-10 16:20:21	93.131	1
5	53	cx23abc12a	cx23abc12a	109.25	2016-01-22 11:20:10	-13.131	0
6	78	tx23abc12a	tx23abc12a	-109.25	2014-09-16 16:24:00	-13.531	1
4	80	zx23abc12a	zx23abc12a	2.25	2013-01-21 11:20:10	-3.231	1
3	201	xx23abc12a	xx23abc12a	-2.25	2015-11-21 11:20:10	3.231	1
7	400	yx23abc12a	yx23abc12a	85.85	2014-09-17 16:20:21	-93.131	0
9	610	ukx23abc12	ukx23abc12	-1.85	2014-09-19 16:20:21	99.131	0
select * from tbl1 where i1>10 and i1<=(1000 mod 1001) +10;
pk	i1	v2	i3	i4	d4	i5	i6
10	42	kx23abc12a	kx23abc12a	-85.86	2014-09-18 16:20:21	-99.131	1
8	50	vx23abc12a	vx23abc12a	-85.85	2014-09-10 16:20:21	93.131	1
5	53	cx23abc12a	cx23abc12a	109.25	2016-01-22 11:20:10	-13.131	0
6	78	tx23abc12a	tx23abc12a	-109.25	2014-09-16 16:24:00	-13.531	1
4	80	zx23abc12a	zx23abc12a	2.25	2013-01-21 11:20:10	-3.231	1
3	201	xx23abc12a	xx23abc12a	-2.25	2015-11-21 11:20:10	3.231	1
7	400	yx23abc12a	yx23abc12a	85.85	2014-09-17 16:20:21	-93.131	0
9	610	ukx23abc12	ukx23abc12	-1.85	2014-09-19 16:20:21	99.131	0
select * from tbl1 where i1>10+0 and i1<=(1000*1001) +10;
pk	i1	v2	i3	i4	d4	i5	i6
10	42	kx23abc12a	kx23abc12a	-85.86	2014-09-18 16:20:21	-99.131	1
8	50	vx23abc12a	vx23abc12a	-85.85	2014-09-10 16:20:21	93.131	1
5	53	cx23abc12a	cx23abc12a	109.25	2016-01-22 11:20:10	-13.131	0
6	78	tx23abc12a	tx23abc12a	-109.25	2014-09-16 16:24:00	-13.531	1
4	80	zx23abc12a	zx23abc12a	2.25	2013-01-21 11:20:10	-3.231	1
3	201	xx23abc12a	xx23abc12a	-2.25	2015-11-21 11:20:10	3.231	1
7	400	yx23abc12a	yx23abc12a	85.85	2014-09-17 16:20:21	-93.131	0
9	610	ukx23abc12	ukx23abc12	-1.85	2014-09-19 16:20:21	99.131	0
select * from tbl1 where i1>=10+null and i1<=(1000*1001) +10;
pk	i1	v2	i3	i4	d4	i5	i6
select * from tbl1 where i1>=10+1 and i1<=(1000*2) +null;
pk	i1	v2	i3	i4	d4	i5	i6
select * from tbl1 where i1>=10+1 and i1<=(1000*2) or i1 is null;
pk	i1	v2	i3	i4	d4	i5	i6
10	42	kx23abc12a	kx23abc12a	-85.86	2014-09-18 16:20:21	-99.131	1
8	50	vx23abc12a	vx23abc12a	-85.85	2014-09-10 16:20:21	93.131	1
5	53	cx23abc12a	cx23abc12a	109.25	2016-01-22 11:20:10	-13.131	0
6	78	tx23abc12a	tx23abc12a	-109.25	2014-09-16 16:24:00	-13.531	1
4	80	zx23abc12a	zx23abc12a	2.25	2013-01-21 11:20:10	-3.231	1
3	201	xx23abc12a	xx23abc12a	-2.25	2015-11-21 11:20:10	3.231	1
7	400	yx23abc12a	yx23abc12a	85.85	2014-09-17 16:20:21	-93.131	0
9	610	ukx23abc12	ukx23abc12	-1.85	2014-09-19 16:20:21	99.131	0
11	NULL	NULL	NULL	NULL	NULL	NULL	NULL
select * from tbl1 where i1>=10+1 and i1<=(1000*2) and i1 is null;
pk	i1	v2	i3	i4	d4	i5	i6
select * from tbl1 where i1>=10+1 and i1<=(1000*2) and i1 is not  null;
pk	i1	v2	i3	i4	d4	i5	i6
10	42	kx23abc12a	kx23abc12a	-85.86	2014-09-18 16:20:21	-99.131	1
8	50	vx23abc12a	vx23abc12a	-85.85	2014-09-10 16:20:21	93.131	1
5	53	cx23abc12a	cx23abc12a	109.25	2016-01-22 11:20:10	-13.131	0
6	78	tx23abc12a	tx23abc12a	-109.25	2014-09-16 16:24:00	-13.531	1
4	80	zx23abc12a	zx23abc12a	2.25	2013-01-21 11:20:10	-3.231	1
3	201	xx23abc12a	xx23abc12a	-2.25	2015-11-21 11:20:10	3.231	1
7	400	yx23abc12a	yx23abc12a	85.85	2014-09-17 16:20:21	-93.131	0
9	610	ukx23abc12	ukx23abc12	-1.85	2014-09-19 16:20:21	99.131	0
select * from tbl1 where i1>=10+1 and i1<=(100*2) or i1 = 610;
pk	i1	v2	i3	i4	d4	i5	i6
10	42	kx23abc12a	kx23abc12a	-85.86	2014-09-18 16:20:21	-99.131	1
8	50	vx23abc12a	vx23abc12a	-85.85	2014-09-10 16:20:21	93.131	1
5	53	cx23abc12a	cx23abc12a	109.25	2016-01-22 11:20:10	-13.131	0
6	78	tx23abc12a	tx23abc12a	-109.25	2014-09-16 16:24:00	-13.531	1
4	80	zx23abc12a	zx23abc12a	2.25	2013-01-21 11:20:10	-3.231	1
9	610	ukx23abc12	ukx23abc12	-1.85	2014-09-19 16:20:21	99.131	0
select * from tbl1 where i1>=10+1 and i1<=(100*2) or i3 = 'cx23abc12';
pk	i1	v2	i3	i4	d4	i5	i6
4	80	zx23abc12a	zx23abc12a	2.25	2013-01-21 11:20:10	-3.231	1
5	53	cx23abc12a	cx23abc12a	109.25	2016-01-22 11:20:10	-13.131	0
6	78	tx23abc12a	tx23abc12a	-109.25	2014-09-16 16:24:00	-13.531	1
8	50	vx23abc12a	vx23abc12a	-85.85	2014-09-10 16:20:21	93.131	1
10	42	kx23abc12a	kx23abc12a	-85.86	2014-09-18 16:20:21	-99.131	1
select * from tbl1 where i1>=10+1 and i1<=(100*2) and i5  between 0 and 1000;
pk	i1	v2	i3	i4	d4	i5	i6
8	50	vx23abc12a	vx23abc12a	-85.85	2014-09-10 16:20:21	93.131	1
select * from tbl1 where i1>=10+1 and i1<=(100*10) and i5  between -100 and 1000;
pk	i1	v2	i3	i4	d4	i5	i6
10	42	kx23abc12a	kx23abc12a	-85.86	2014-09-18 16:20:21	-99.131	1
8	50	vx23abc12a	vx23abc12a	-85.85	2014-09-10 16:20:21	93.131	1
5	53	cx23abc12a	cx23abc12a	109.25	2016-01-22 11:20:10	-13.131	0
6	78	tx23abc12a	tx23abc12a	-109.25	2014-09-16 16:24:00	-13.531	1
4	80	zx23abc12a	zx23abc12a	2.25	2013-01-21 11:20:10	-3.231	1
3	201	xx23abc12a	xx23abc12a	-2.25	2015-11-21 11:20:10	3.231	1
7	400	yx23abc12a	yx23abc12a	85.85	2014-09-17 16:20:21	-93.131	0
9	610	ukx23abc12	ukx23abc12	-1.85	2014-09-19 16:20:21	99.131	0
select * from tbl1 where i1>10+1 and i1<1000 and pk<=10;
pk	i1	v2	i3	i4	d4	i5	i6
3	201	xx23abc12a	xx23abc12a	-2.25	2015-11-21 11:20:10	3.231	1
4	80	zx23abc12a	zx23abc12a	2.25	2013-01-21 11:20:10	-3.231	1
5	53	cx23abc12a	cx23abc12a	109.25	2016-01-22 11:20:10	-13.131	0
6	78	tx23abc12a	tx23abc12a	-109.25	2014-09-16 16:24:00	-13.531	1
7	400	yx23abc12a	yx23abc12a	85.85	2014-09-17 16:20:21	-93.131	0
8	50	vx23abc12a	vx23abc12a	-85.85	2014-09-10 16:20:21	93.131	1
9	610	ukx23abc12	ukx23abc12	-1.85	2014-09-19 16:20:21	99.131	0
10	42	kx23abc12a	kx23abc12a	-85.86	2014-09-18 16:20:21	-99.131	1
select * from tbl1 where i1>-9999999999+1+0 and i1<10000000000-2+1-1+2-2+3-3+4-4+5-5+6-6+7-7+8-8+9-9+0-0+10-10 and pk<=10;
pk	i1	v2	i3	i4	d4	i5	i6
1	1	abc12abc	abc12abc	1.25	2014-01-01 12:00:00	23.23	1
2	10	23abc12abc	23abc12abc	-0.25	2015-11-01 12:00:00	-23.23	0
3	201	xx23abc12a	xx23abc12a	-2.25	2015-11-21 11:20:10	3.231	1
4	80	zx23abc12a	zx23abc12a	2.25	2013-01-21 11:20:10	-3.231	1
5	53	cx23abc12a	cx23abc12a	109.25	2016-01-22 11:20:10	-13.131	0
6	78	tx23abc12a	tx23abc12a	-109.25	2014-09-16 16:24:00	-13.531	1
7	400	yx23abc12a	yx23abc12a	85.85	2014-09-17 16:20:21	-93.131	0
8	50	vx23abc12a	vx23abc12a	-85.85	2014-09-10 16:20:21	93.131	1
9	610	ukx23abc12	ukx23abc12	-1.85	2014-09-19 16:20:21	99.131	0
10	42	kx23abc12a	kx23abc12a	-85.86	2014-09-18 16:20:21	-99.131	1
select * from tbl1 where i1>-9999999999+1+0 and i1<10000000000-2+1-1+2-2+3-3+4-4+5-5+6-6+7-7+8-8+9-9+0-0+10-10 ;
pk	i1	v2	i3	i4	d4	i5	i6
1	1	abc12abc	abc12abc	1.25	2014-01-01 12:00:00	23.23	1
2	10	23abc12abc	23abc12abc	-0.25	2015-11-01 12:00:00	-23.23	0
10	42	kx23abc12a	kx23abc12a	-85.86	2014-09-18 16:20:21	-99.131	1
8	50	vx23abc12a	vx23abc12a	-85.85	2014-09-10 16:20:21	93.131	1
5	53	cx23abc12a	cx23abc12a	109.25	2016-01-22 11:20:10	-13.131	0
6	78	tx23abc12a	tx23abc12a	-109.25	2014-09-16 16:24:00	-13.531	1
4	80	zx23abc12a	zx23abc12a	2.25	2013-01-21 11:20:10	-3.231	1
3	201	xx23abc12a	xx23abc12a	-2.25	2015-11-21 11:20:10	3.231	1
7	400	yx23abc12a	yx23abc12a	85.85	2014-09-17 16:20:21	-93.131	0
9	610	ukx23abc12	ukx23abc12	-1.85	2014-09-19 16:20:21	99.131	0
select * from tbl1 where i1>=10+1 and i1<=(100*10) and i5  between -100 and 1000;
pk	i1	v2	i3	i4	d4	i5	i6
10	42	kx23abc12a	kx23abc12a	-85.86	2014-09-18 16:20:21	-99.131	1
8	50	vx23abc12a	vx23abc12a	-85.85	2014-09-10 16:20:21	93.131	1
5	53	cx23abc12a	cx23abc12a	109.25	2016-01-22 11:20:10	-13.131	0
6	78	tx23abc12a	tx23abc12a	-109.25	2014-09-16 16:24:00	-13.531	1
4	80	zx23abc12a	zx23abc12a	2.25	2013-01-21 11:20:10	-3.231	1
3	201	xx23abc12a	xx23abc12a	-2.25	2015-11-21 11:20:10	3.231	1
7	400	yx23abc12a	yx23abc12a	85.85	2014-09-17 16:20:21	-93.131	0
9	610	ukx23abc12	ukx23abc12	-1.85	2014-09-19 16:20:21	99.131	0
prepare stmt1 from  select * from tbl1 where i1>=?+1 and i1<=(?*10) and i5  between ? and ?;
set @a=10;
set @b=100;
set @c=-100;
set @d=1000;
execute stmt1 using @a, @b,@c,@d;
pk	i1	v2	i3	i4	d4	i5	i6
10	42	kx23abc12a	kx23abc12a	-85.86	2014-09-18 16:20:21	-99.131	1
8	50	vx23abc12a	vx23abc12a	-85.85	2014-09-10 16:20:21	93.131	1
5	53	cx23abc12a	cx23abc12a	109.25	2016-01-22 11:20:10	-13.131	0
6	78	tx23abc12a	tx23abc12a	-109.25	2014-09-16 16:24:00	-13.531	1
4	80	zx23abc12a	zx23abc12a	2.25	2013-01-21 11:20:10	-3.231	1
3	201	xx23abc12a	xx23abc12a	-2.25	2015-11-21 11:20:10	3.231	1
7	400	yx23abc12a	yx23abc12a	85.85	2014-09-17 16:20:21	-93.131	0
9	610	ukx23abc12	ukx23abc12	-1.85	2014-09-19 16:20:21	99.131	0
set @a=10+1-1+10-10+1-1+1-1+1-1+1-1;
set @b=100-1+1+10-10+10-10+1-1+10-10;
set @c=-100+1-1+1-1+1-1+1-1+2-2+3-3+4-4+5-5+6-6+7-7+8-8+9-9+10-10;
set @d=1000+1-1+1-1+1-1+1-1+2-2+3-3+4-4+5-5+6-6+7-7+8-8+9-9+10-10;
execute stmt1 using @a, @b,@c,@d;
pk	i1	v2	i3	i4	d4	i5	i6
10	42	kx23abc12a	kx23abc12a	-85.86	2014-09-18 16:20:21	-99.131	1
8	50	vx23abc12a	vx23abc12a	-85.85	2014-09-10 16:20:21	93.131	1
5	53	cx23abc12a	cx23abc12a	109.25	2016-01-22 11:20:10	-13.131	0
6	78	tx23abc12a	tx23abc12a	-109.25	2014-09-16 16:24:00	-13.531	1
4	80	zx23abc12a	zx23abc12a	2.25	2013-01-21 11:20:10	-3.231	1
3	201	xx23abc12a	xx23abc12a	-2.25	2015-11-21 11:20:10	3.231	1
7	400	yx23abc12a	yx23abc12a	85.85	2014-09-17 16:20:21	-93.131	0
9	610	ukx23abc12	ukx23abc12	-1.85	2014-09-19 16:20:21	99.131	0
select * from tbl1 where i1>=length('abc')-10 and i1<length('dagafdgafdgfg')+1000;
pk	i1	v2	i3	i4	d4	i5	i6
1	1	abc12abc	abc12abc	1.25	2014-01-01 12:00:00	23.23	1
2	10	23abc12abc	23abc12abc	-0.25	2015-11-01 12:00:00	-23.23	0
10	42	kx23abc12a	kx23abc12a	-85.86	2014-09-18 16:20:21	-99.131	1
8	50	vx23abc12a	vx23abc12a	-85.85	2014-09-10 16:20:21	93.131	1
5	53	cx23abc12a	cx23abc12a	109.25	2016-01-22 11:20:10	-13.131	0
6	78	tx23abc12a	tx23abc12a	-109.25	2014-09-16 16:24:00	-13.531	1
4	80	zx23abc12a	zx23abc12a	2.25	2013-01-21 11:20:10	-3.231	1
3	201	xx23abc12a	xx23abc12a	-2.25	2015-11-21 11:20:10	3.231	1
7	400	yx23abc12a	yx23abc12a	85.85	2014-09-17 16:20:21	-93.131	0
9	610	ukx23abc12	ukx23abc12	-1.85	2014-09-19 16:20:21	99.131	0
set @a='agafgfdgfdghfdhadfh';
set @b='adgfdagdfgggfgfdgfgfgfgfdgdfgadfghdfgfdg';
prepare stmt1 from  select * from tbl1 where i1>=length(?)-10 and i1<length(?)+1000;
execute stmt1 using @a, @b;
pk	i1	v2	i3	i4	d4	i5	i6
2	10	23abc12abc	23abc12abc	-0.25	2015-11-01 12:00:00	-23.23	0
10	42	kx23abc12a	kx23abc12a	-85.86	2014-09-18 16:20:21	-99.131	1
8	50	vx23abc12a	vx23abc12a	-85.85	2014-09-10 16:20:21	93.131	1
5	53	cx23abc12a	cx23abc12a	109.25	2016-01-22 11:20:10	-13.131	0
6	78	tx23abc12a	tx23abc12a	-109.25	2014-09-16 16:24:00	-13.531	1
4	80	zx23abc12a	zx23abc12a	2.25	2013-01-21 11:20:10	-3.231	1
3	201	xx23abc12a	xx23abc12a	-2.25	2015-11-21 11:20:10	3.231	1
7	400	yx23abc12a	yx23abc12a	85.85	2014-09-17 16:20:21	-93.131	0
9	610	ukx23abc12	ukx23abc12	-1.85	2014-09-19 16:20:21	99.131	0
select * from tbl1 where (i1,i5) in ((1,23.23),(42,-99.131),(50,93.131),(610,99.131));
pk	i1	v2	i3	i4	d4	i5	i6
1	1	abc12abc	abc12abc	1.25	2014-01-01 12:00:00	23.23	1
10	42	kx23abc12a	kx23abc12a	-85.86	2014-09-18 16:20:21	-99.131	1
8	50	vx23abc12a	vx23abc12a	-85.85	2014-09-10 16:20:21	93.131	1
9	610	ukx23abc12	ukx23abc12	-1.85	2014-09-19 16:20:21	99.131	0
select * from tbl1 where (i5,i1) in ((23.23,1),(-99.131,42),(93.131,50),(99.131,610));
pk	i1	v2	i3	i4	d4	i5	i6
1	1	abc12abc	abc12abc	1.25	2014-01-01 12:00:00	23.23	1
10	42	kx23abc12a	kx23abc12a	-85.86	2014-09-18 16:20:21	-99.131	1
8	50	vx23abc12a	vx23abc12a	-85.85	2014-09-10 16:20:21	93.131	1
9	610	ukx23abc12	ukx23abc12	-1.85	2014-09-19 16:20:21	99.131	0
select * from tbl1 where (i1,i5,i4) in ((1,23.23,1.25),(610,99.131,-1.85),(42,-99.131,-85.85));
pk	i1	v2	i3	i4	d4	i5	i6
1	1	abc12abc	abc12abc	1.25	2014-01-01 12:00:00	23.23	1
9	610	ukx23abc12	ukx23abc12	-1.85	2014-09-19 16:20:21	99.131	0
select * from tbl1 where (i4,i1,i5) in ((1.25,1,23.23),(-1.85,610,99.131),(-85.85,42,-99.131));
pk	i1	v2	i3	i4	d4	i5	i6
1	1	abc12abc	abc12abc	1.25	2014-01-01 12:00:00	23.23	1
9	610	ukx23abc12	ukx23abc12	-1.85	2014-09-19 16:20:21	99.131	0
prepare stmt1 from  select * from tbl1 where (i4,i1,i5) in ((1.25,?,23.23),(-1.85,?,99.131),(?,42,?));
set @a=-99.131;
set @b=610;
set @c=1;
set @d=-85.85;
execute stmt1 using @c,@b,@d,@a;
pk	i1	v2	i3	i4	d4	i5	i6
1	1	abc12abc	abc12abc	1.25	2014-01-01 12:00:00	23.23	1
9	610	ukx23abc12	ukx23abc12	-1.85	2014-09-19 16:20:21	99.131	0
prepare stmt1 from  select * from tbl1 where i1>=?*?+?+? and i1<=?*?+?-?;
set @a=-10;
set @b=2;
set @c=1;
set @d=-1;
set @e=100;
set @f=10;
set @g=2;
set @h=3;
execute stmt1 using @a,@b,@c,@d,@e,@f,@g,@h;
pk	i1	v2	i3	i4	d4	i5	i6
1	1	abc12abc	abc12abc	1.25	2014-01-01 12:00:00	23.23	1
2	10	23abc12abc	23abc12abc	-0.25	2015-11-01 12:00:00	-23.23	0
10	42	kx23abc12a	kx23abc12a	-85.86	2014-09-18 16:20:21	-99.131	1
8	50	vx23abc12a	vx23abc12a	-85.85	2014-09-10 16:20:21	93.131	1
5	53	cx23abc12a	cx23abc12a	109.25	2016-01-22 11:20:10	-13.131	0
6	78	tx23abc12a	tx23abc12a	-109.25	2014-09-16 16:24:00	-13.531	1
4	80	zx23abc12a	zx23abc12a	2.25	2013-01-21 11:20:10	-3.231	1
3	201	xx23abc12a	xx23abc12a	-2.25	2015-11-21 11:20:10	3.231	1
7	400	yx23abc12a	yx23abc12a	85.85	2014-09-17 16:20:21	-93.131	0
9	610	ukx23abc12	ukx23abc12	-1.85	2014-09-19 16:20:21	99.131	0
update tbl1 set i1=i1+1-1 where  i1>=EXTRACT(DAY FROM '2014-09-30 12:00:00' )-29 and i1<=EXTRACT(DAY FROM '2014-09-30 12:00:00' )+600;
update tbl1 set i5=i5+1-1 where  i1>=EXTRACT(DAY FROM '2014-09-30 12:00:00' )-29 and i1<=EXTRACT(DAY FROM '2014-09-30 12:00:00' )+600;
update tbl1 set i5=round(i5) where  i1>=EXTRACT(DAY FROM '2014-09-30 12:00:00' )-29 and i1<=EXTRACT(DAY FROM '2014-09-30 12:00:00' )+600;
update tbl1 set d4=date_add(d4, INTERVAL -6 hour) where  i1>=EXTRACT(DAY FROM '2014-09-30 12:00:00' )-29 and i1<=EXTRACT(DAY FROM '2014-09-30 12:00:00' )+600;
select * from tbl1;
pk	i1	v2	i3	i4	d4	i5	i6
1	1	abc12abc	abc12abc	1.25	2014-01-01 06:00:00	23	1
2	10	23abc12abc	23abc12abc	-0.25	2015-11-01 06:00:00	-23	0
3	201	xx23abc12a	xx23abc12a	-2.25	2015-11-21 05:20:10	3	1
4	80	zx23abc12a	zx23abc12a	2.25	2013-01-21 05:20:10	-3	1
5	53	cx23abc12a	cx23abc12a	109.25	2016-01-22 05:20:10	-13	0
6	78	tx23abc12a	tx23abc12a	-109.25	2014-09-16 10:24:00	-14	1
7	400	yx23abc12a	yx23abc12a	85.85	2014-09-17 10:20:21	-93	0
8	50	vx23abc12a	vx23abc12a	-85.85	2014-09-10 10:20:21	93	1
9	610	ukx23abc12	ukx23abc12	-1.85	2014-09-19 10:20:21	99	0
10	42	kx23abc12a	kx23abc12a	-85.86	2014-09-18 10:20:21	-99	1
11	NULL	NULL	NULL	NULL	NULL	NULL	NULL
delete from  tbl1  where  i1>=EXTRACT(DAY FROM '2014-09-30 12:00:00' )-29 and i1<=EXTRACT(DAY FROM '2014-09-30 12:00:00' )+600;
select *  from  tbl1  where  i1>=EXTRACT(DAY FROM '2014-09-30 12:00:00' )-29 and i1<=EXTRACT(DAY FROM '2014-09-30 12:00:00' )+600;
pk	i1	v2	i3	i4	d4	i5	i6
select * from tbl1;
pk	i1	v2	i3	i4	d4	i5	i6
11	NULL	NULL	NULL	NULL	NULL	NULL	NULL
