create table t1(pk1 int, c1 int, c2 int, c3 int, primary key(pk1));
insert into t1(pk1,c1,c2,c3) values(1,1,1,1);
insert into t1(pk1,c1,c2,c3) values(2,2,2,1);
insert into t1(pk1,c1,c2,c3) values(3,3,3,1);
insert into t1(pk1,c1,c2,c3) values(4,4,4,1);
insert into t1(pk1,c1,c2,c3) values(5,5,5,1);
insert into t1(pk1,c1,c2,c3) values(6,6,6,1);
insert into t1(pk1,c1,c2,c3) values(7,7,7,1);
insert into t1(pk1,c1,c2,c3) values(8,8,8,1);
create index i1 on t1(c1,c2) storing(c3);
alter system major freeze tenant = sys;
alter system major freeze tenant = all_user;
alter system major freeze tenant = all_meta;
select * from t1;
pk1	c1	c2	c3
1	1	1	1
2	2	2	1
3	3	3	1
4	4	4	1
5	5	5	1
6	6	6	1
7	7	7	1
8	8	8	1
pk1	c1	c2	c3
1	1	1	1
2	2	2	1
3	3	3	1
4	4	4	1
5	5	5	1
6	6	6	1
7	7	7	1
8	8	8	1
set autocommit=0;
set autocommit=0;
update t1 set c3=c3+1 where (c1,c2)=(1,1) or (c1,c2)=(2,2);
delete from t1 where (c1,c2)=(3,3) or (c1,c2)=(4,4) or (c1,c2)=(5,6) or (c1,c2)=(7,8);
select * from t1;
pk1	c1	c2	c3
1	1	1	2
2	2	2	2
5	5	5	1
6	6	6	1
7	7	7	1
8	8	8	1
pk1	c1	c2	c3
1	1	1	2
2	2	2	2
5	5	5	1
6	6	6	1
7	7	7	1
8	8	8	1
select * from t1;
pk1	c1	c2	c3
1	1	1	1
2	2	2	1
3	3	3	1
4	4	4	1
5	5	5	1
6	6	6	1
7	7	7	1
8	8	8	1
pk1	c1	c2	c3
1	1	1	1
2	2	2	1
3	3	3	1
4	4	4	1
5	5	5	1
6	6	6	1
7	7	7	1
8	8	8	1
commit;
update t1 set c3=c3+1 where (c1,c2)=(5,5) or (c1,c2)=(6,6);
delete from t1 where (c1,c2)=(7,7) or (c1,c2)=(8,8) or (c1,c2)=(5,6) or (c1,c2)=(7,8);
select * from t1;
pk1	c1	c2	c3
1	1	1	2
2	2	2	2
5	5	5	1
6	6	6	1
7	7	7	1
8	8	8	1
pk1	c1	c2	c3
1	1	1	2
2	2	2	2
5	5	5	1
6	6	6	1
7	7	7	1
8	8	8	1
commit;
update t1 set c3=c3+1 where 
(c1,c2)=(7,7) or (c1,c2)=(8,8) or (c1,c2)=(5,5) or (c1,c2)=(6,6) or
(c1,c2)=(1,1) or (c1,c2)=(2,2) or (c1,c2)=(3,3) or (c1,c2)=(4,4);
select * from t1;
pk1	c1	c2	c3
1	1	1	2
2	2	2	2
5	5	5	2
6	6	6	2
pk1	c1	c2	c3
1	1	1	2
2	2	2	2
5	5	5	2
6	6	6	2
commit;
select * from t1;
pk1	c1	c2	c3
1	1	1	3
2	2	2	3
5	5	5	3
6	6	6	3
pk1	c1	c2	c3
1	1	1	3
2	2	2	3
5	5	5	3
6	6	6	3
commit;
delete from t1;
replace into t1(pk1,c1,c2,c3) values (1,1,1,1),(2,2,2,1),(3,3,3,1),(4,4,4,1),(5,5,5,1),(6,6,6,1),(7,7,7,1),(8,8,8,1);
select * from t1;
pk1	c1	c2	c3
1	1	1	1
2	2	2	1
3	3	3	1
4	4	4	1
5	5	5	1
6	6	6	1
7	7	7	1
8	8	8	1
pk1	c1	c2	c3
1	1	1	1
2	2	2	1
3	3	3	1
4	4	4	1
5	5	5	1
6	6	6	1
7	7	7	1
8	8	8	1
update t1 set c3=c3+1 where (c1,c2)=(1,1) or (c1,c2)=(2,2) or (c1,c2)=(3,3) or (c1,c2)=(4,4);
select * from t1;
pk1	c1	c2	c3
1	1	1	2
2	2	2	2
3	3	3	2
4	4	4	2
5	5	5	1
6	6	6	1
7	7	7	1
8	8	8	1
pk1	c1	c2	c3
1	1	1	2
2	2	2	2
3	3	3	2
4	4	4	2
5	5	5	1
6	6	6	1
7	7	7	1
8	8	8	1
update t1 set c3=c3+1 where (c1,c2)=(7,7) or (c1,c2)=(8,8) or (c1,c2)=(5,5) or (c1,c2)=(6,6);
select * from t1;
pk1	c1	c2	c3
1	1	1	1
2	2	2	1
3	3	3	1
4	4	4	1
5	5	5	2
6	6	6	2
7	7	7	2
8	8	8	2
pk1	c1	c2	c3
1	1	1	1
2	2	2	1
3	3	3	1
4	4	4	1
5	5	5	2
6	6	6	2
7	7	7	2
8	8	8	2
commit;
select * from t1;
pk1	c1	c2	c3
1	1	1	2
2	2	2	2
3	3	3	2
4	4	4	2
5	5	5	2
6	6	6	2
7	7	7	2
8	8	8	2
pk1	c1	c2	c3
1	1	1	2
2	2	2	2
3	3	3	2
4	4	4	2
5	5	5	2
6	6	6	2
7	7	7	2
8	8	8	2
commit;
delete from t1;
replace into t1(pk1,c1,c2,c3) values (1,1,1,1),(2,2,2,1),(3,3,3,1),(4,4,4,1),(5,5,5,1),(6,6,6,1),(7,7,7,1),(8,8,8,1);
select * from t1;
pk1	c1	c2	c3
1	1	1	1
2	2	2	1
3	3	3	1
4	4	4	1
5	5	5	1
6	6	6	1
7	7	7	1
8	8	8	1
pk1	c1	c2	c3
1	1	1	1
2	2	2	1
3	3	3	1
4	4	4	1
5	5	5	1
6	6	6	1
7	7	7	1
8	8	8	1
update t1 set c3=c3+1 where 
(c1,c2)=(7,7) or (c1,c2)=(8,8) or (c1,c2)=(5,5) or (c1,c2)=(6,6) or
(c1,c2)=(1,1) or (c1,c2)=(2,2) or (c1,c2)=(3,3) or (c1,c2)=(4,4);
select * from t1;
pk1	c1	c2	c3
1	1	1	2
2	2	2	2
3	3	3	2
4	4	4	2
5	5	5	2
6	6	6	2
7	7	7	2
8	8	8	2
pk1	c1	c2	c3
1	1	1	2
2	2	2	2
3	3	3	2
4	4	4	2
5	5	5	2
6	6	6	2
7	7	7	2
8	8	8	2
commit;
update t1 set c3=c3+1 where 
(c1,c2)=(7,7) or (c1,c2)=(8,8) or (c1,c2)=(5,5) or (c1,c2)=(6,6) or
(c1,c2)=(1,1) or (c1,c2)=(2,2) or (c1,c2)=(3,3) or (c1,c2)=(4,4);
select * from t1;
pk1	c1	c2	c3
1	1	1	3
2	2	2	3
3	3	3	3
4	4	4	3
5	5	5	3
6	6	6	3
7	7	7	3
8	8	8	3
pk1	c1	c2	c3
1	1	1	3
2	2	2	3
3	3	3	3
4	4	4	3
5	5	5	3
6	6	6	3
7	7	7	3
8	8	8	3
commit;
delete from t1 where 
(c1,c2)=(7,7) or (c1,c2)=(8,8) or (c1,c2)=(5,5) or (c1,c2)=(6,6) or
(c1,c2)=(1,1) or (c1,c2)=(2,2) or (c1,c2)=(3,3) or (c1,c2)=(4,4);
select * from t1;
pk1	c1	c2	c3
pk1	c1	c2	c3
commit;
select * from t1;
pk1	c1	c2	c3
pk1	c1	c2	c3
delete from t1 where 
(c1,c2)=(7,7) or (c1,c2)=(8,8) or (c1,c2)=(5,5) or (c1,c2)=(6,6) or
(c1,c2)=(1,1) or (c1,c2)=(2,2) or (c1,c2)=(3,3) or (c1,c2)=(4,4);
select * from t1;
pk1	c1	c2	c3
pk1	c1	c2	c3
commit;
delete from t1;
replace into t1(pk1,c1,c2,c3) values (1,1,1,1),(2,2,2,1),(3,3,3,1),(4,4,4,1),(5,5,5,1),(6,6,6,1),(7,7,7,1),(8,8,8,1);
select * from t1;
pk1	c1	c2	c3
1	1	1	1
2	2	2	1
3	3	3	1
4	4	4	1
5	5	5	1
6	6	6	1
7	7	7	1
8	8	8	1
pk1	c1	c2	c3
1	1	1	1
2	2	2	1
3	3	3	1
4	4	4	1
5	5	5	1
6	6	6	1
7	7	7	1
8	8	8	1
update t1 set c3=c3+1 where 
(c1,c2)=(7,7) or (c1,c2)=(8,8) or (c1,c2)=(5,5) or (c1,c2)=(6,6) or
(c1,c2)=(1,1) or (c1,c2)=(2,2) or (c1,c2)=(3,3) or (c1,c2)=(4,4);
select * from t1;
pk1	c1	c2	c3
1	1	1	2
2	2	2	2
3	3	3	2
4	4	4	2
5	5	5	2
6	6	6	2
7	7	7	2
8	8	8	2
pk1	c1	c2	c3
1	1	1	2
2	2	2	2
3	3	3	2
4	4	4	2
5	5	5	2
6	6	6	2
7	7	7	2
8	8	8	2
update t1 set c3=c3+1 where c1 in (1,2);
Got one of the listed errors
delete from t1 where c1 in (3,4);
Got one of the listed errors
update t1 set c3=c3+1 where (c1,c2)=(1,1) or (c1,c2)=(2,2) or (c1,c2)=(3,3) or (c1,c2)=(4,4);
Got one of the listed errors
delete from t1 where (c1,c2)=(1,1) or (c1,c2)=(2,2) or (c1,c2)=(3,3) or (c1,c2)=(4,4);
Got one of the listed errors
delete from t1;
Got one of the listed errors
update t1 set c3=c3+1;
Got one of the listed errors
select * from t1;
pk1	c1	c2	c3
1	1	1	1
2	2	2	1
3	3	3	1
4	4	4	1
5	5	5	1
6	6	6	1
7	7	7	1
8	8	8	1
pk1	c1	c2	c3
1	1	1	1
2	2	2	1
3	3	3	1
4	4	4	1
5	5	5	1
6	6	6	1
7	7	7	1
8	8	8	1
select * from t1;
pk1	c1	c2	c3
1	1	1	2
2	2	2	2
3	3	3	2
4	4	4	2
5	5	5	2
6	6	6	2
7	7	7	2
8	8	8	2
pk1	c1	c2	c3
1	1	1	2
2	2	2	2
3	3	3	2
4	4	4	2
5	5	5	2
6	6	6	2
7	7	7	2
8	8	8	2
commit;
select * from t1;
pk1	c1	c2	c3
1	1	1	2
2	2	2	2
3	3	3	2
4	4	4	2
5	5	5	2
6	6	6	2
7	7	7	2
8	8	8	2
pk1	c1	c2	c3
1	1	1	2
2	2	2	2
3	3	3	2
4	4	4	2
5	5	5	2
6	6	6	2
7	7	7	2
8	8	8	2
commit;
set autocommit=1;
set autocommit=1;
drop table t1;
set global ob_enable_index_direct_select =0;
