create table t1(pk int primary key, a int, b int, c int, d int);
create index i1 on t1(b, c) storing(d);
alter system major freeze tenant = sys;
alter system major freeze tenant = all_user;
alter system major freeze tenant = all_meta;
set autocommit=0;
insert into t1(pk, a, b, c, d) values(1,1,1,1,1),(2,1,1,1,1),(3,1,1,1,1);
commit;
set autocommit=0;
select pk, b, c, d from t1 where b>0 and b<10;
pk	b	c	d
1	1	1	1
2	1	1	1
3	1	1	1
select * from t1 where pk>0 and pk<10;
pk	a	b	c	d
1	1	1	1	1
2	1	1	1	1
3	1	1	1	1
select * from t1 where b>0 and b<10;
pk	a	b	c	d
1	1	1	1	1
2	1	1	1	1
3	1	1	1	1
insert into t1(pk,a ,b, c, d) values(4,1,1,1,1);
commit;
select pk, b, c, d from t1 where b>0 and b<10;
pk	b	c	d
1	1	1	1
2	1	1	1
3	1	1	1
4	1	1	1
select * from t1 where pk>0 and pk<10;
pk	a	b	c	d
1	1	1	1	1
2	1	1	1	1
3	1	1	1	1
4	1	1	1	1
select * from t1 where b>0 and b<10;
pk	a	b	c	d
1	1	1	1	1
2	1	1	1	1
3	1	1	1	1
4	1	1	1	1
delete from t1 where pk=1;
replace into t1(pk,a ,b, c, d) values(1, 2, 2, 2, 2);
commit;
select pk, b, c, d from t1 where b>0 and b<10;
pk	b	c	d
2	1	1	1
3	1	1	1
4	1	1	1
1	2	2	2
select * from t1 where pk>0 and pk<10;
pk	a	b	c	d
1	2	2	2	2
2	1	1	1	1
3	1	1	1	1
4	1	1	1	1
select * from t1 where b>0 and b<10;
pk	a	b	c	d
1	2	2	2	2
2	1	1	1	1
3	1	1	1	1
4	1	1	1	1
update t1 set a=2, b=2, c=2, d=2 where pk=2;
commit;
select pk, b, c, d from t1 where b>0 and b<10;
pk	b	c	d
3	1	1	1
4	1	1	1
1	2	2	2
2	2	2	2
select * from t1 where pk>0 and pk<10;
pk	a	b	c	d
1	2	2	2	2
2	2	2	2	2
3	1	1	1	1
4	1	1	1	1
select * from t1 where b>0 and b<10;
pk	a	b	c	d
1	2	2	2	2
2	2	2	2	2
3	1	1	1	1
4	1	1	1	1
delete from t1 where pk=3;
commit;
select pk, b, c, d from t1 where b>0 and b<10;
pk	b	c	d
4	1	1	1
1	2	2	2
2	2	2	2
select * from t1 where pk>0 and pk<10;
pk	a	b	c	d
1	2	2	2	2
2	2	2	2	2
4	1	1	1	1
select * from t1 where b>0 and b<10;
pk	a	b	c	d
1	2	2	2	2
2	2	2	2	2
4	1	1	1	1
commit;
select pk, b, c, d from t1 where b>0 and b<10;
pk	b	c	d
4	1	1	1
1	2	2	2
2	2	2	2
select * from t1 where pk>0 and pk<10;
pk	a	b	c	d
1	2	2	2	2
2	2	2	2	2
4	1	1	1	1
select * from t1 where b>0 and b<10;
pk	a	b	c	d
1	2	2	2	2
2	2	2	2	2
4	1	1	1	1
