create table t1(pk1 int, pk2 int, c1 int, c2 int, primary key(pk1,pk2));
insert into t1(pk1,pk2,c1,c2) values(1,1,1,1);
insert into t1(pk1,pk2,c1,c2) values(1,2,1,1);
insert into t1(pk1,pk2,c1,c2) values(1,3,1,1);
insert into t1(pk1,pk2,c1,c2) values(1,4,1,1);
insert into t1(pk1,pk2,c1,c2) values(1,5,2,1);
insert into t1(pk1,pk2,c1,c2) values(1,6,2,1);
insert into t1(pk1,pk2,c1,c2) values(1,7,2,1);
insert into t1(pk1,pk2,c1,c2) values(1,8,2,1);
create index i1 on t1(c1,c2);
alter system major freeze tenant = sys;
alter system major freeze tenant = all_user;
alter system major freeze tenant = all_meta;
select * from t1;
pk1	pk2	c1	c2
1	1	1	1
1	2	1	1
1	3	1	1
1	4	1	1
1	5	2	1
1	6	2	1
1	7	2	1
1	8	2	1
pk1	pk2	c1	c2
1	1	1	1
1	2	1	1
1	3	1	1
1	4	1	1
1	5	2	1
1	6	2	1
1	7	2	1
1	8	2	1
set autocommit=0;
update t1 set c2=c2+1 where pk1=1;
select * from t1;
pk1	pk2	c1	c2
1	1	1	2
1	2	1	2
1	3	1	2
1	4	1	2
1	5	2	2
1	6	2	2
1	7	2	2
1	8	2	2
pk1	pk2	c1	c2
1	1	1	2
1	2	1	2
1	3	1	2
1	4	1	2
1	5	2	2
1	6	2	2
1	7	2	2
1	8	2	2
set autocommit=0;
update t1 set c2=c2+1 where c1=1;
Got one of the listed errors
select * from t1;
pk1	pk2	c1	c2
1	1	1	1
1	2	1	1
1	3	1	1
1	4	1	1
1	5	2	1
1	6	2	1
1	7	2	1
1	8	2	1
pk1	pk2	c1	c2
1	1	1	1
1	2	1	1
1	3	1	1
1	4	1	1
1	5	2	1
1	6	2	1
1	7	2	1
1	8	2	1
select * from t1;
pk1	pk2	c1	c2
1	1	1	2
1	2	1	2
1	3	1	2
1	4	1	2
1	5	2	2
1	6	2	2
1	7	2	2
1	8	2	2
pk1	pk2	c1	c2
1	1	1	2
1	2	1	2
1	3	1	2
1	4	1	2
1	5	2	2
1	6	2	2
1	7	2	2
1	8	2	2
update t1 set c2=c2+1 where c1=1;
select * from t1;
pk1	pk2	c1	c2
1	1	1	3
1	2	1	3
1	3	1	3
1	4	1	3
1	5	2	2
1	6	2	2
1	7	2	2
1	8	2	2
pk1	pk2	c1	c2
1	1	1	3
1	2	1	3
1	3	1	3
1	4	1	3
1	5	2	2
1	6	2	2
1	7	2	2
1	8	2	2
commit;
select * from t1;
pk1	pk2	c1	c2
1	1	1	3
1	2	1	3
1	3	1	3
1	4	1	3
1	5	2	2
1	6	2	2
1	7	2	2
1	8	2	2
pk1	pk2	c1	c2
1	1	1	3
1	2	1	3
1	3	1	3
1	4	1	3
1	5	2	2
1	6	2	2
1	7	2	2
1	8	2	2
update t1 set c2=c2+1 where c1=1;
update t1 set c2=c2+1 where c1=2;
select * from t1;
pk1	pk2	c1	c2
1	1	1	4
1	2	1	4
1	3	1	4
1	4	1	4
1	5	2	3
1	6	2	3
1	7	2	3
1	8	2	3
pk1	pk2	c1	c2
1	1	1	4
1	2	1	4
1	3	1	4
1	4	1	4
1	5	2	3
1	6	2	3
1	7	2	3
1	8	2	3
commit;
delete from t1;
insert into t1(pk1,pk2,c1,c2) values (1,1,1,1),(2,2,2,1),(3,3,3,1),(4,4,4,1),(5,5,5,1),(6,6,6,1),(7,7,7,1),(8,8,8,1);
select * from t1;
pk1	pk2	c1	c2
1	1	1	1
2	2	2	1
3	3	3	1
4	4	4	1
5	5	5	1
6	6	6	1
7	7	7	1
8	8	8	1
pk1	pk2	c1	c2
1	1	1	1
2	2	2	1
3	3	3	1
4	4	4	1
5	5	5	1
6	6	6	1
7	7	7	1
8	8	8	1
update t1 set c2=c2+1 where pk1<5;
select * from t1;
pk1	pk2	c1	c2
1	1	1	2
2	2	2	2
3	3	3	2
4	4	4	2
5	5	5	1
6	6	6	1
7	7	7	1
8	8	8	1
pk1	pk2	c1	c2
1	1	1	2
2	2	2	2
3	3	3	2
4	4	4	2
5	5	5	1
6	6	6	1
7	7	7	1
8	8	8	1
update t1 set c2=c2+1 where c1>4;
select * from t1;
pk1	pk2	c1	c2
1	1	1	1
2	2	2	1
3	3	3	1
4	4	4	1
5	5	5	2
6	6	6	2
7	7	7	2
8	8	8	2
pk1	pk2	c1	c2
1	1	1	1
2	2	2	1
3	3	3	1
4	4	4	1
5	5	5	2
6	6	6	2
7	7	7	2
8	8	8	2
update t1 set c2=c2+1 where pk1<5;
Got one of the listed errors
select * from t1;
pk1	pk2	c1	c2
1	1	1	2
2	2	2	2
3	3	3	2
4	4	4	2
5	5	5	1
6	6	6	1
7	7	7	1
8	8	8	1
pk1	pk2	c1	c2
1	1	1	2
2	2	2	2
3	3	3	2
4	4	4	2
5	5	5	1
6	6	6	1
7	7	7	1
8	8	8	1
update t1 set c2=c2+1 where pk1>4;
Got one of the listed errors
commit;
select * from t1;
pk1	pk2	c1	c2
1	1	1	2
2	2	2	2
3	3	3	2
4	4	4	2
5	5	5	1
6	6	6	1
7	7	7	1
8	8	8	1
pk1	pk2	c1	c2
1	1	1	2
2	2	2	2
3	3	3	2
4	4	4	2
5	5	5	1
6	6	6	1
7	7	7	1
8	8	8	1
commit;
select * from t1;
pk1	pk2	c1	c2
1	1	1	2
2	2	2	2
3	3	3	2
4	4	4	2
5	5	5	2
6	6	6	2
7	7	7	2
8	8	8	2
pk1	pk2	c1	c2
1	1	1	2
2	2	2	2
3	3	3	2
4	4	4	2
5	5	5	2
6	6	6	2
7	7	7	2
8	8	8	2
update t1 set c2=c2+1 where pk1<5;
select * from t1;
pk1	pk2	c1	c2
1	1	1	3
2	2	2	3
3	3	3	3
4	4	4	3
5	5	5	2
6	6	6	2
7	7	7	2
8	8	8	2
pk1	pk2	c1	c2
1	1	1	3
2	2	2	3
3	3	3	3
4	4	4	3
5	5	5	2
6	6	6	2
7	7	7	2
8	8	8	2
commit;
select * from t1;
pk1	pk2	c1	c2
1	1	1	3
2	2	2	3
3	3	3	3
4	4	4	3
5	5	5	2
6	6	6	2
7	7	7	2
8	8	8	2
pk1	pk2	c1	c2
1	1	1	3
2	2	2	3
3	3	3	3
4	4	4	3
5	5	5	2
6	6	6	2
7	7	7	2
8	8	8	2
commit;
delete from t1;
insert into t1(pk1,pk2,c1,c2) values (1,1,1,1),(1,2,2,1),(1,3,3,1),(1,4,4,1),(2,5,5,1),(2,6,6,1),(2,7,7,1),(2,8,8,1);
select * from t1;
pk1	pk2	c1	c2
1	1	1	1
1	2	2	1
1	3	3	1
1	4	4	1
2	5	5	1
2	6	6	1
2	7	7	1
2	8	8	1
pk1	pk2	c1	c2
1	1	1	1
1	2	2	1
1	3	3	1
1	4	4	1
2	5	5	1
2	6	6	1
2	7	7	1
2	8	8	1
update t1 set c2=c2+1 where pk1=1 and c1<=4;
select * from t1;
pk1	pk2	c1	c2
1	1	1	2
1	2	2	2
1	3	3	2
1	4	4	2
2	5	5	1
2	6	6	1
2	7	7	1
2	8	8	1
pk1	pk2	c1	c2
1	1	1	2
1	2	2	2
1	3	3	2
1	4	4	2
2	5	5	1
2	6	6	1
2	7	7	1
2	8	8	1
update t1 set c2=c2+1 where pk1=1 and c1<=4;
Got one of the listed errors
update t1 set c2=c2+1 where pk1=1 and c1>=1;
Got one of the listed errors
delete from t1 where pk1=1 and c1<=4;
Got one of the listed errors
delete from t1 where pk1=1 and c1>=1;
Got one of the listed errors
update t1 set c2=c2+1 where c1=1;
Got one of the listed errors
delete from t1 where c1=1;
Got one of the listed errors
update t1 set c2=c2+1 where c1>=4 and pk1=2;
select * from t1;
pk1	pk2	c1	c2
1	1	1	1
1	2	2	1
1	3	3	1
1	4	4	1
2	5	5	2
2	6	6	2
2	7	7	2
2	8	8	2
pk1	pk2	c1	c2
1	1	1	1
1	2	2	1
1	3	3	1
1	4	4	1
2	5	5	2
2	6	6	2
2	7	7	2
2	8	8	2
update t1 set c2=c2+1 where c1>=4;
Got one of the listed errors
update t1 set c2=c2+1 where c1<=8;
Got one of the listed errors
update t1 set c2=c2+1 where pk1=2;
Got one of the listed errors
select * from t1;
pk1	pk2	c1	c2
1	1	1	2
1	2	2	2
1	3	3	2
1	4	4	2
2	5	5	1
2	6	6	1
2	7	7	1
2	8	8	1
pk1	pk2	c1	c2
1	1	1	2
1	2	2	2
1	3	3	2
1	4	4	2
2	5	5	1
2	6	6	1
2	7	7	1
2	8	8	1
commit;
select * from t1;
pk1	pk2	c1	c2
1	1	1	2
1	2	2	2
1	3	3	2
1	4	4	2
2	5	5	2
2	6	6	2
2	7	7	2
2	8	8	2
pk1	pk2	c1	c2
1	1	1	2
1	2	2	2
1	3	3	2
1	4	4	2
2	5	5	2
2	6	6	2
2	7	7	2
2	8	8	2
update t1 set c2=c2+1 where pk1=1 and c1<=4;
select * from t1;
pk1	pk2	c1	c2
1	1	1	3
1	2	2	3
1	3	3	3
1	4	4	3
2	5	5	2
2	6	6	2
2	7	7	2
2	8	8	2
pk1	pk2	c1	c2
1	1	1	3
1	2	2	3
1	3	3	3
1	4	4	3
2	5	5	2
2	6	6	2
2	7	7	2
2	8	8	2
update t1 set c2=c2+1 where pk1=1 and c1>=1;
select * from t1;
pk1	pk2	c1	c2
1	1	1	4
1	2	2	4
1	3	3	4
1	4	4	4
2	5	5	2
2	6	6	2
2	7	7	2
2	8	8	2
pk1	pk2	c1	c2
1	1	1	4
1	2	2	4
1	3	3	4
1	4	4	4
2	5	5	2
2	6	6	2
2	7	7	2
2	8	8	2
delete from t1 where pk1=1 and c1<=4;
select * from t1;
pk1	pk2	c1	c2
2	5	5	2
2	6	6	2
2	7	7	2
2	8	8	2
pk1	pk2	c1	c2
2	5	5	2
2	6	6	2
2	7	7	2
2	8	8	2
commit;
select * from t1;
pk1	pk2	c1	c2
2	5	5	2
2	6	6	2
2	7	7	2
2	8	8	2
pk1	pk2	c1	c2
2	5	5	2
2	6	6	2
2	7	7	2
2	8	8	2
commit;
set autocommit=1;
set autocommit=1;
drop table t1;
set global ob_enable_index_direct_select =0;
