create table t1(pk1 int, c1 int, c2 int, c3 int, primary key(pk1));
create table t2(pk1 int, c1 varchar(20), c2 varchar(20), primary key(pk1));
create unique index i1 on t1(c2);
create unique index i2 on t1(c1, c2);
create unique index i3 on t2(c1);
insert into t1(pk1, c1, c2, c3) values
(0,0,0,0),
(1,0,1,0);
insert into t2 values
(1,'xxxc','a'),
(2,'xxxb','a'),
(3,'xxxa','a'),
(4,'yyyy','a');
alter system major freeze tenant = sys;
alter system major freeze tenant = all_user;
alter system major freeze tenant = all_meta;
alter system major freeze tenant = sys;
alter system major freeze tenant = all_user;
alter system major freeze tenant = all_meta;
insert into t1(pk1, c1, c2, c3) values
(2,1,2,1),
(3,1,3,1);
case 1-1, optimized
select * from t1 where c2=0 order by c2;
pk1	c1	c2	c3
0	0	0	0
select * from t1 where c1=0 order by c1;
pk1	c1	c2	c3
0	0	0	0
1	0	1	0
select * from t1 where c1=0 order by c2;
pk1	c1	c2	c3
0	0	0	0
1	0	1	0
select * from t1 where c1=0 order by c1, c2;
pk1	c1	c2	c3
0	0	0	0
1	0	1	0
select * from t1 where c1=0 and c2>0 order by c2;
pk1	c1	c2	c3
1	0	1	0
select * from t1 where c1=0 and c2>0 order by c1, c2;
pk1	c1	c2	c3
1	0	1	0
select * from t1 where c2=0 order by c2 limit 2;
pk1	c1	c2	c3
0	0	0	0
select * from t1 where c1=0 order by c1 limit 3;
pk1	c1	c2	c3
0	0	0	0
1	0	1	0
select * from t1 where c1=0 order by c2 limit 4;
pk1	c1	c2	c3
0	0	0	0
1	0	1	0
select * from t1 where c1=0 order by c1, c2 limit 5;
pk1	c1	c2	c3
0	0	0	0
1	0	1	0
select * from t1 where c1=0 and c2>0 order by c2 limit 6;
pk1	c1	c2	c3
1	0	1	0
select * from t1 where c1=0 and c2>0 order by c1, c2 limit 7;
pk1	c1	c2	c3
1	0	1	0
explain select * from t1 where c2=0 order by c2;
explain select * from t1 where c1=0 order by c1;
explain select * from t1 where c1=0 order by c2;
explain select * from t1 where c1=0 order by c1, c2;
explain select * from t1 where c1=0 and c2>0 order by c2;
explain select * from t1 where c1=0 and c2>0 order by c1, c2;
explain select * from t1 where c2=0 order by c2 limit 2;
explain select * from t1 where c1=0 order by c1 limit 3;
explain select * from t1 where c1=0 order by c2 limit 4;
explain select * from t1 where c1=0 order by c1, c2 limit 5;
explain select * from t1 where c1=0 and c2>0 order by c2 limit 6;
explain select * from t1 where c1=0 and c2>0 order by c1, c2 limit 7;
case 1-2, non-optimized
select * from t1 where c2=0 order by c2, pk1;
pk1	c1	c2	c3
0	0	0	0
select * from t1 where c1=0 and c2>0 order by c2, pk1;
pk1	c1	c2	c3
1	0	1	0
select * from t1 where c1=0 and c2>0 order by c1, c2, pk1;
pk1	c1	c2	c3
1	0	1	0
select * from t1 where c2=0 order by c2, pk1 limit 4;
pk1	c1	c2	c3
0	0	0	0
select * from t1 where c1=0 and c2>0 order by c2, pk1 limit 4;
pk1	c1	c2	c3
1	0	1	0
select * from t1 where c1=0 and c2>0 order by c1, c2, pk1 limit 4;
pk1	c1	c2	c3
1	0	1	0
explain select * from t1 where c2=0 order by c2, pk1;
explain select * from t1 where c1=0 and c2>0 order by c2, pk1;
explain select * from t1 where c1=0 and c2>0 order by c1, c2, pk1;
explain select * from t1 where c2=0 order by c2, pk1 limit 4;
explain select * from t1 where c1=0 and c2>0 order by c2, pk1 limit 4;
explain select * from t1 where c1=0 and c2>0 order by c1, c2, pk1 limit 4;
case 2-1, optimized
explain update t1 set c1=c1, c2=c2*10, c3=c3*10 where c1=0 and c2<1 order by c2;
explain update t1 set c1=c1, c2=c2*10, c3=c3*10 where c1>=0 and c1<1 and c2>0 order by c1, c2;
explain update t1 set c1=c1, c2=c2*10, c3=c3*10 where c1=0 and c2<0 order by c2 limit 3;
explain update t1 set c1=c1, c2=c2*10, c3=c3*10 where c1>=0 and c1<=1 order by c1, c2 limit 3;
update t1 set c1=c1, c2=c2*10, c3=c3*10 where c1=0 and c2<1 order by c2;
update t1 set c1=c1, c2=c2*10, c3=c3*10 where c1>=0 and c1<1 and c2>0 order by c1, c2;
update t1 set c1=c1, c2=c2*10, c3=c3*10 where c1=0 and c2<0 order by c2 limit 3;
update t1 set c1=c1, c2=c2*10, c3=c3*10 where c1>=0 and c1<=1 order by c1, c2 limit 3;
select * from t1;
pk1	c1	c2	c3
0	0	0	0
1	0	100	0
2	1	20	10
3	1	3	1
case 2-2, non-optimized
explain update t1 set c1=c1, c2=c2*10, c3=c3*10 where c1=0 and c2<1 order by c2, pk1;
explain update t1 set c1=c1, c2=c2*10, c3=c3*10 where c1=0 and c2<1 order by c2, pk1 limit 3;
update t1 set c1=c1, c2=c2*10, c3=c3*10 where c1=0 and c2<1 order by c2, pk1;
update t1 set c1=c1, c2=c2*10, c3=c3*10 where c1=0 and c2<1 order by c2, pk1 limit 3;
select * from t1;
pk1	c1	c2	c3
0	0	0	0
1	0	100	0
2	1	20	10
3	1	3	1
case 3-1, optimized
explain delete from t1 where c1=0 and c2<1 order by c2;
explain delete from t1 where c1=0 and c2>0 order by c2 limit 2;
delete from t1 where c1=0 and c2<1 order by c2;
delete from t1 where c1=0 and c2>0 order by c2 limit 2;
select * from t1;
pk1	c1	c2	c3
2	1	20	10
3	1	3	1
case 3-2, non-optimized
explain delete from t1 where c1=1 and c2>0 order by c2, pk1;
explain delete from t1 where c1=1 and c2>0 order by c2, pk1 limit 2;
delete from t1 where c1=1 and c2>0 order by c2, pk1;
delete from t1 where c1=1 and c2>0 order by c2, pk1 limit 2;
select * from t1;
pk1	c1	c2	c3
case 4-1, select + col like 'xxx%'
explain select * from t2 where c1 like 'xxx%' order by c1;
explain select * from t2 where c1 like 'xxx%' escape 'x' order by c1;
explain select * from t2 where c1 not like 'xxx%' order by c1;
explain select * from t2 where c1 not like 'xxx%' escape 'x' order by c1;
select * from t2 where c1 like 'xxx%' order by c1;
pk1	c1	c2
3	xxxa	a
2	xxxb	a
1	xxxc	a
select * from t2 where c1 like 'xxx%' escape 'x' order by c1;
pk1	c1	c2
select * from t2 where c1 not like 'xxx%' order by c1;
pk1	c1	c2
4	yyyy	a
select * from t2 where c1 not like 'xxx%' escape 'x' order by c1;
pk1	c1	c2
3	xxxa	a
2	xxxb	a
1	xxxc	a
4	yyyy	a
case 4-2, select + col like '%xxx%'
explain select * from t2 where c1 like '%xxx%' order by c1;
explain select * from t2 where c1 like '%xxx%' escape 'x' order by c1;
explain select * from t2 where c1 not like '%xxx%' order by c1;
explain select * from t2 where c1 not like '%xxx%' escape 'x' order by c1;
select * from t2 where c1 like '%xxx%' order by c1;
pk1	c1	c2
3	xxxa	a
2	xxxb	a
1	xxxc	a
select * from t2 where c1 like '%xxx%' escape 'x' order by c1;
pk1	c1	c2
select * from t2 where c1 not like '%xxx%' order by c1;
pk1	c1	c2
4	yyyy	a
select * from t2 where c1 not like '%xxx%' escape 'x' order by c1;
pk1	c1	c2
3	xxxa	a
2	xxxb	a
1	xxxc	a
4	yyyy	a
case 4-3, select + col like '%xxx'
explain select * from t2 where c1 like '%xxx' order by c1;
explain select * from t2 where c1 like '%xxx' escape 'x' order by c1;
explain select * from t2 where c1 not like '%xxx' order by c1;
explain select * from t2 where c1 not like '%xxx' escape 'x' order by c1;
select * from t2 where c1 like '%xxx' order by c1;
pk1	c1	c2
select * from t2 where c1 like '%xxx' escape 'x' order by c1;
pk1	c1	c2
select * from t2 where c1 not like '%xxx' order by c1;
pk1	c1	c2
3	xxxa	a
2	xxxb	a
1	xxxc	a
4	yyyy	a
select * from t2 where c1 not like '%xxx' escape 'x' order by c1;
pk1	c1	c2
3	xxxa	a
2	xxxb	a
1	xxxc	a
4	yyyy	a
case 4-4, update + col like 'xxx%'
explain update t2 set c2=concat(c2,'b') where c1 like 'xxx%' order by c1;
explain update t2 set c2=concat(c2,'b') where c1 like 'xxx%' escape 'x' order by c1;
explain update t2 set c2=concat(c2,'b') where c1 not like 'xxx%' order by c1;
explain update t2 set c2=concat(c2,'b') where c1 not like 'xxx%' escape 'x' order by c1;
update t2 set c2=concat(c2,'b') where c1 like 'xxx%' order by c1;
update t2 set c2=concat(c2,'b') where c1 like 'xxx%' escape 'x' order by c1;
update t2 set c2=concat(c2,'b') where c1 not like 'xxx%' order by c1;
update t2 set c2=concat(c2,'b') where c1 not like 'xxx%' escape 'x' order by c1;
select * from t2;
pk1	c1	c2
1	xxxc	abb
2	xxxb	abb
3	xxxa	abb
4	yyyy	abb
case 4-5, update + col like '%xxx%'
explain update t2 set c2=concat(c2,'b') where c1 like '%xxx%' order by c1;
explain update t2 set c2=concat(c2,'b') where c1 like '%xxx%' escape 'x' order by c1;
explain update t2 set c2=concat(c2,'b') where c1 not like '%xxx%' order by c1;
explain update t2 set c2=concat(c2,'b') where c1 not like '%xxx%' escape 'x' order by c1;
update t2 set c2=concat(c2,'b') where c1 like '%xxx%' order by c1;
update t2 set c2=concat(c2,'b') where c1 like '%xxx%' escape 'x' order by c1;
update t2 set c2=concat(c2,'b') where c1 not like '%xxx%' order by c1;
update t2 set c2=concat(c2,'b') where c1 not like '%xxx%' escape 'x' order by c1;
select * from t2;
pk1	c1	c2
1	xxxc	abbbb
2	xxxb	abbbb
3	xxxa	abbbb
4	yyyy	abbbb
case 4-6, update + col like '%xxx'
explain update t2 set c2=concat(c2,'b') where c1 like '%xxx' order by c1;
explain update t2 set c2=concat(c2,'b') where c1 like '%xxx' escape 'x' order by c1;
explain update t2 set c2=concat(c2,'b') where c1 not like '%xxx' order by c1;
explain update t2 set c2=concat(c2,'b') where c1 not like '%xxx' escape 'x' order by c1;
update t2 set c2=concat(c2,'b') where c1 like '%xxx' order by c1;
update t2 set c2=concat(c2,'b') where c1 like '%xxx' escape 'x' order by c1;
update t2 set c2=concat(c2,'b') where c1 not like '%xxx' order by c1;
update t2 set c2=concat(c2,'b') where c1 not like '%xxx' escape 'x' order by c1;
select * from t2;
pk1	c1	c2
1	xxxc	abbbbbb
2	xxxb	abbbbbb
3	xxxa	abbbbbb
4	yyyy	abbbbbb
case 4-7, delete + col like 'xxx%'
explain delete from t2 where c1 like 'xxx%' order by c1;
explain delete from t2 where c1 like 'xxx%' escape 'x' order by c1;
explain delete from t2 where c1 not like 'xxx%' order by c1;
explain delete from t2 where c1 not like 'xxx%' escape 'x' order by c1;
case 4-8, delete + col like '%xxx%'
explain delete from t2 where c1 like '%xxx%' order by c1;
explain delete from t2 where c1 like '%xxx%' escape 'x' order by c1;
explain delete from t2 where c1 not like '%xxx%' order by c1;
explain delete from t2 where c1 not like '%xxx%' escape 'x' order by c1;
select * from t2;
pk1	c1	c2
1	xxxc	abbbbbb
2	xxxb	abbbbbb
3	xxxa	abbbbbb
4	yyyy	abbbbbb
case 4-9, delete + col like '%xxx'
explain delete from t2 where c1 like '%xxx' order by c1;
explain delete from t2 where c1 like '%xxx' escape 'x' order by c1;
explain delete from t2 where c1 not like '%xxx' order by c1;
explain delete from t2 where c1 not like '%xxx' escape 'x' order by c1;
case 5-1, select + col like X'78787825'
explain select * from t2 where c1 like X'78787825' order by c1;
explain select * from t2 where c1 like X'78787825' escape 'x' order by c1;
explain select * from t2 where c1 not like X'78787825' order by c1;
explain select * from t2 where c1 not like X'78787825' escape 'x' order by c1;
select * from t2 where c1 like X'78787825' order by c1;
pk1	c1	c2
3	xxxa	abbbbbb
2	xxxb	abbbbbb
1	xxxc	abbbbbb
select * from t2 where c1 like X'78787825' escape 'x' order by c1;
pk1	c1	c2
select * from t2 where c1 not like X'78787825' order by c1;
pk1	c1	c2
4	yyyy	abbbbbb
select * from t2 where c1 not like X'78787825' escape 'x' order by c1;
pk1	c1	c2
3	xxxa	abbbbbb
2	xxxb	abbbbbb
1	xxxc	abbbbbb
4	yyyy	abbbbbb
case 5-2, select + col like X'2578787825'
explain select * from t2 where c1 like X'2578787825' order by c1;
explain select * from t2 where c1 like X'2578787825' escape 'x' order by c1;
explain select * from t2 where c1 not like X'2578787825' order by c1;
explain select * from t2 where c1 not like X'2578787825' escape 'x' order by c1;
select * from t2 where c1 like X'2578787825' order by c1;
pk1	c1	c2
3	xxxa	abbbbbb
2	xxxb	abbbbbb
1	xxxc	abbbbbb
select * from t2 where c1 like X'2578787825' escape 'x' order by c1;
pk1	c1	c2
select * from t2 where c1 not like X'2578787825' order by c1;
pk1	c1	c2
4	yyyy	abbbbbb
select * from t2 where c1 not like X'2578787825' escape 'x' order by c1;
pk1	c1	c2
3	xxxa	abbbbbb
2	xxxb	abbbbbb
1	xxxc	abbbbbb
4	yyyy	abbbbbb
case 5-3, select + col like X'25787878'
explain select * from t2 where c1 like X'25787878' order by c1;
explain select * from t2 where c1 like X'25787878' escape 'x' order by c1;
explain select * from t2 where c1 not like X'25787878' order by c1;
explain select * from t2 where c1 not like X'25787878' escape 'x' order by c1;
select * from t2 where c1 like X'25787878' order by c1;
pk1	c1	c2
select * from t2 where c1 like X'25787878' escape 'x' order by c1;
pk1	c1	c2
select * from t2 where c1 not like X'25787878' order by c1;
pk1	c1	c2
3	xxxa	abbbbbb
2	xxxb	abbbbbb
1	xxxc	abbbbbb
4	yyyy	abbbbbb
select * from t2 where c1 not like X'25787878' escape 'x' order by c1;
pk1	c1	c2
3	xxxa	abbbbbb
2	xxxb	abbbbbb
1	xxxc	abbbbbb
4	yyyy	abbbbbb
case 5-4, update + col like X'78787825'
explain update t2 set c2=concat(c2,'b') where c1 like X'78787825' order by c1;
explain update t2 set c2=concat(c2,'b') where c1 like X'78787825' escape 'x' order by c1;
explain update t2 set c2=concat(c2,'b') where c1 not like X'78787825' order by c1;
explain update t2 set c2=concat(c2,'b') where c1 not like X'78787825' escape 'x' order by c1;
update t2 set c2=concat(c2,'b') where c1 like X'78787825' order by c1;
update t2 set c2=concat(c2,'b') where c1 like X'78787825' escape 'x' order by c1;
update t2 set c2=concat(c2,'b') where c1 not like X'78787825' order by c1;
update t2 set c2=concat(c2,'b') where c1 not like X'78787825' escape 'x' order by c1;
select * from t2;
pk1	c1	c2
1	xxxc	abbbbbbbb
2	xxxb	abbbbbbbb
3	xxxa	abbbbbbbb
4	yyyy	abbbbbbbb
case 5-5, update + col like X'2578787825'
explain update t2 set c2=concat(c2,'b') where c1 like X'2578787825' order by c1;
explain update t2 set c2=concat(c2,'b') where c1 like X'2578787825' escape 'x' order by c1;
explain update t2 set c2=concat(c2,'b') where c1 not like X'2578787825' order by c1;
explain update t2 set c2=concat(c2,'b') where c1 not like X'2578787825' escape 'x' order by c1;
update t2 set c2=concat(c2,'b') where c1 like X'2578787825' order by c1;
update t2 set c2=concat(c2,'b') where c1 like X'2578787825' escape 'x' order by c1;
update t2 set c2=concat(c2,'b') where c1 not like X'2578787825' order by c1;
update t2 set c2=concat(c2,'b') where c1 not like X'2578787825' escape 'x' order by c1;
select * from t2;
pk1	c1	c2
1	xxxc	abbbbbbbbbb
2	xxxb	abbbbbbbbbb
3	xxxa	abbbbbbbbbb
4	yyyy	abbbbbbbbbb
case 5-6, update + col like X'25787878'
explain update t2 set c2=concat(c2,'b') where c1 like X'25787878' order by c1;
explain update t2 set c2=concat(c2,'b') where c1 like X'25787878' escape 'x' order by c1;
explain update t2 set c2=concat(c2,'b') where c1 not like X'25787878' order by c1;
explain update t2 set c2=concat(c2,'b') where c1 not like X'25787878' escape 'x' order by c1;
update t2 set c2=concat(c2,'b') where c1 like X'25787878' order by c1;
update t2 set c2=concat(c2,'b') where c1 like X'25787878' escape 'x' order by c1;
update t2 set c2=concat(c2,'b') where c1 not like X'25787878' order by c1;
update t2 set c2=concat(c2,'b') where c1 not like X'25787878' escape 'x' order by c1;
select * from t2;
pk1	c1	c2
1	xxxc	abbbbbbbbbbbb
2	xxxb	abbbbbbbbbbbb
3	xxxa	abbbbbbbbbbbb
4	yyyy	abbbbbbbbbbbb
case 5-7, delete + col like X'78787825'
explain delete from t2 where c1 like X'78787825' order by c1;
explain delete from t2 where c1 like X'78787825' escape 'x' order by c1;
explain delete from t2 where c1 not like X'78787825' order by c1;
explain delete from t2 where c1 not like X'78787825' escape 'x' order by c1;
case 5-8, delete + col like X'2578787825'
explain delete from t2 where c1 like X'2578787825' order by c1;
explain delete from t2 where c1 like X'2578787825' escape 'x' order by c1;
explain delete from t2 where c1 not like X'2578787825' order by c1;
explain delete from t2 where c1 not like X'2578787825' escape 'x' order by c1;
select * from t2;
pk1	c1	c2
1	xxxc	abbbbbbbbbbbb
2	xxxb	abbbbbbbbbbbb
3	xxxa	abbbbbbbbbbbb
4	yyyy	abbbbbbbbbbbb
case 5-9, delete + col like X'25787878'
explain delete from t2 where c1 like X'25787878' order by c1;
explain delete from t2 where c1 like X'25787878' escape 'x' order by c1;
explain delete from t2 where c1 not like X'25787878' order by c1;
explain delete from t2 where c1 not like X'25787878' escape 'x' order by c1;
