create table t1(pk1 int, c1 int, c2 int, c3 int, primary key(pk1));
create index i1 on t1(c1,c2) storing(c3);
insert into t1(pk1,c1,c2,c3) values(1,1,1,1);
insert into t1(pk1,c1,c2,c3) values(2,1,1,1);
insert into t1(pk1,c1,c2,c3) values(3,1,2,1);
insert into t1(pk1,c1,c2,c3) values(4,1,2,1);
insert into t1(pk1,c1,c2,c3) values(5,2,3,1);
insert into t1(pk1,c1,c2,c3) values(6,2,3,1);
insert into t1(pk1,c1,c2,c3) values(7,2,4,1);
insert into t1(pk1,c1,c2,c3) values(8,2,4,1);
alter system major freeze tenant = sys;
alter system major freeze tenant = all_user;
alter system major freeze tenant = all_meta;
select * from t1;
pk1	c1	c2	c3
1	1	1	1
2	1	1	1
3	1	2	1
4	1	2	1
5	2	3	1
6	2	3	1
7	2	4	1
8	2	4	1
pk1	c1	c2	c3
1	1	1	1
2	1	1	1
3	1	2	1
4	1	2	1
5	2	3	1
6	2	3	1
7	2	4	1
8	2	4	1
set autocommit=0;
set autocommit=0;
update t1 set c3=c3+1 where c1=1 and c2=1;
update t1 set c3=c3+1 where c1=1 and c2>1 and c2<=2;
update t1 set c3=c3+1 where c1>1 and c1<3 and c2=3;
update t1 set c3=c3+1 where c1>=2 and c1<=3 and c2>3 and c2<=4;
select * from t1;
pk1	c1	c2	c3
1	1	1	2
2	1	1	2
3	1	2	2
4	1	2	2
5	2	3	2
6	2	3	2
7	2	4	2
8	2	4	2
pk1	c1	c2	c3
1	1	1	2
2	1	1	2
3	1	2	2
4	1	2	2
5	2	3	2
6	2	3	2
7	2	4	2
8	2	4	2
select * from t1;
pk1	c1	c2	c3
1	1	1	1
2	1	1	1
3	1	2	1
4	1	2	1
5	2	3	1
6	2	3	1
7	2	4	1
8	2	4	1
pk1	c1	c2	c3
1	1	1	1
2	1	1	1
3	1	2	1
4	1	2	1
5	2	3	1
6	2	3	1
7	2	4	1
8	2	4	1
commit;
delete from t1 where c1=1 and c2=1;
delete from t1 where c1=1 and c2>1 and c2<=2;
delete from t1 where c1>1 and c1<3 and c2=3;
delete from t1 where c1>=2 and c1<=3 and c2>3 and c2<=4;
select * from t1;
pk1	c1	c2	c3
pk1	c1	c2	c3
select * from t1;
pk1	c1	c2	c3
1	1	1	2
2	1	1	2
3	1	2	2
4	1	2	2
5	2	3	2
6	2	3	2
7	2	4	2
8	2	4	2
pk1	c1	c2	c3
1	1	1	2
2	1	1	2
3	1	2	2
4	1	2	2
5	2	3	2
6	2	3	2
7	2	4	2
8	2	4	2
update t1 set c3=c3+1 where c1=1 and c2=1;
Got one of the listed errors
delete from t1 where c1=1 and c2=1;
Got one of the listed errors
commit;
insert into t1(pk1,c1,c2,c3) values(1,1,1,1);
replace into t1(pk1,c1,c2,c3) values(2,1,1,1);
select * from t1;
pk1	c1	c2	c3
1	1	1	1
2	1	1	1
pk1	c1	c2	c3
1	1	1	1
2	1	1	1
select * from t1;
pk1	c1	c2	c3
pk1	c1	c2	c3
insert into t1(pk1,c1,c2,c3) values(1,1,1,1);
Got one of the listed errors
replace into t1(pk1,c1,c2,c3) values(2,1,1,1);
Got one of the listed errors
update t1 set c3=c3+1 where pk1=1;
delete from t1 where pk1=2;
update t1 set c3=c3+1 where c1=1 and c2=1;
delete from t1 where c1=1 and c2=1;
select * from t1;
pk1	c1	c2	c3
pk1	c1	c2	c3
select * from t1;
pk1	c1	c2	c3
1	1	1	1
2	1	1	1
pk1	c1	c2	c3
1	1	1	1
2	1	1	1
commit;
select * from t1;
pk1	c1	c2	c3
1	1	1	1
2	1	1	1
pk1	c1	c2	c3
1	1	1	1
2	1	1	1
update t1 set c3=c3+1 where c1=1 and c2=1;
select * from t1;
pk1	c1	c2	c3
1	1	1	2
2	1	1	2
pk1	c1	c2	c3
1	1	1	2
2	1	1	2
commit;
select * from t1;
pk1	c1	c2	c3
1	1	1	2
2	1	1	2
pk1	c1	c2	c3
1	1	1	2
2	1	1	2
commit;
delete from t1;
insert into t1(pk1,c1,c2,c3) values (1,1,1,1),(2,1,1,1),(3,1,2,1),(4,1,2,1),(5,2,3,1),(6,2,3,1),(7,2,4,1),(8,2,4,1);
select * from t1;
pk1	c1	c2	c3
1	1	1	1
2	1	1	1
3	1	2	1
4	1	2	1
5	2	3	1
6	2	3	1
7	2	4	1
8	2	4	1
pk1	c1	c2	c3
1	1	1	1
2	1	1	1
3	1	2	1
4	1	2	1
5	2	3	1
6	2	3	1
7	2	4	1
8	2	4	1
update t1 set c3=c3+1 where c1=1 and c2=1;
select * from t1;
pk1	c1	c2	c3
1	1	1	2
2	1	1	2
3	1	2	1
4	1	2	1
5	2	3	1
6	2	3	1
7	2	4	1
8	2	4	1
pk1	c1	c2	c3
1	1	1	2
2	1	1	2
3	1	2	1
4	1	2	1
5	2	3	1
6	2	3	1
7	2	4	1
8	2	4	1
delete from t1 where c1=1 and c2=2;
select * from t1;
pk1	c1	c2	c3
1	1	1	2
2	1	1	2
5	2	3	1
6	2	3	1
7	2	4	1
8	2	4	1
pk1	c1	c2	c3
1	1	1	2
2	1	1	2
5	2	3	1
6	2	3	1
7	2	4	1
8	2	4	1
insert into t1(pk1,c1,c2,c3) values (9,3,5,1);
replace into t1(pk1,c1,c2,c3) values (10,3,5,1);
select * from t1;
pk1	c1	c2	c3
1	1	1	1
2	1	1	1
3	1	2	1
4	1	2	1
5	2	3	1
6	2	3	1
7	2	4	1
8	2	4	1
pk1	c1	c2	c3
1	1	1	1
2	1	1	1
3	1	2	1
4	1	2	1
5	2	3	1
6	2	3	1
7	2	4	1
8	2	4	1
update t1 set c3=c3+1 where c1=1 and c2=1;
Got one of the listed errors
update t1 set c3=c3+1 where c1=1 and c2=2;
Got one of the listed errors
update t1 set c3=c3+1 where pk1=1;
Got one of the listed errors
delete from t1 where c1=1 and c2=1;
Got one of the listed errors
delete from t1 where c1=1 and c2=2;
Got one of the listed errors
delete from t1 where pk1=1;
Got one of the listed errors
update t1 set c3=c3+1 where c1=3 and c2=5;
delete from t1 where c1=3 and c2=5;
select * from t1;
pk1	c1	c2	c3
1	1	1	1
2	1	1	1
3	1	2	1
4	1	2	1
5	2	3	1
6	2	3	1
7	2	4	1
8	2	4	1
pk1	c1	c2	c3
1	1	1	1
2	1	1	1
3	1	2	1
4	1	2	1
5	2	3	1
6	2	3	1
7	2	4	1
8	2	4	1
commit;
select * from t1;
pk1	c1	c2	c3
1	1	1	2
2	1	1	2
5	2	3	1
6	2	3	1
7	2	4	1
8	2	4	1
9	3	5	1
10	3	5	1
pk1	c1	c2	c3
1	1	1	2
2	1	1	2
5	2	3	1
6	2	3	1
7	2	4	1
8	2	4	1
9	3	5	1
10	3	5	1
update t1 set c3=c3+1 where c1=3 and c2=5;
select * from t1;
pk1	c1	c2	c3
1	1	1	2
2	1	1	2
5	2	3	1
6	2	3	1
7	2	4	1
8	2	4	1
9	3	5	2
10	3	5	2
pk1	c1	c2	c3
1	1	1	2
2	1	1	2
5	2	3	1
6	2	3	1
7	2	4	1
8	2	4	1
9	3	5	2
10	3	5	2
delete from t1 where c1=3 and c2=5;
select * from t1;
pk1	c1	c2	c3
1	1	1	2
2	1	1	2
5	2	3	1
6	2	3	1
7	2	4	1
8	2	4	1
pk1	c1	c2	c3
1	1	1	2
2	1	1	2
5	2	3	1
6	2	3	1
7	2	4	1
8	2	4	1
update t1 set c3=c3+1 where c1=3 and c2=5;
select * from t1 where c1=3 and c2=5;
pk1	c1	c2	c3
pk1	c1	c2	c3
insert into t1(pk1,c1,c2,c3) values (9,3,5,1);
ERROR 23000: Duplicate entry '9' for key 'PRIMARY'
replace into t1(pk1,c1,c2,c3) values (10,3,5,1);
Got one of the listed errors
select * from t1;
pk1	c1	c2	c3
1	1	1	2
2	1	1	2
5	2	3	1
6	2	3	1
7	2	4	1
8	2	4	1
9	3	5	1
10	3	5	1
pk1	c1	c2	c3
1	1	1	2
2	1	1	2
5	2	3	1
6	2	3	1
7	2	4	1
8	2	4	1
9	3	5	1
10	3	5	1
commit;
select * from t1;
pk1	c1	c2	c3
1	1	1	2
2	1	1	2
5	2	3	1
6	2	3	1
7	2	4	1
8	2	4	1
pk1	c1	c2	c3
1	1	1	2
2	1	1	2
5	2	3	1
6	2	3	1
7	2	4	1
8	2	4	1
commit;
select * from t1;
pk1	c1	c2	c3
1	1	1	2
2	1	1	2
5	2	3	1
6	2	3	1
7	2	4	1
8	2	4	1
pk1	c1	c2	c3
1	1	1	2
2	1	1	2
5	2	3	1
6	2	3	1
7	2	4	1
8	2	4	1
commit;
delete from t1;
insert into t1(pk1,c1,c2,c3) values (1,1,NULL,1),(2,1,NULL,1),(3,1,1,1),(4,1,1,1),(5,2,NULL,1),(6,2,NULL,1),(7,2,1,1),(8,2,1,1);
select * from t1;
pk1	c1	c2	c3
1	1	NULL	1
2	1	NULL	1
3	1	1	1
4	1	1	1
5	2	NULL	1
6	2	NULL	1
7	2	1	1
8	2	1	1
pk1	c1	c2	c3
1	1	NULL	1
2	1	NULL	1
3	1	1	1
4	1	1	1
5	2	NULL	1
6	2	NULL	1
7	2	1	1
8	2	1	1
update t1 set c3=c3+1 where c1=1 and c2 is NULL;
select * from t1;
pk1	c1	c2	c3
1	1	NULL	2
2	1	NULL	2
3	1	1	1
4	1	1	1
5	2	NULL	1
6	2	NULL	1
7	2	1	1
8	2	1	1
pk1	c1	c2	c3
1	1	NULL	2
2	1	NULL	2
3	1	1	1
4	1	1	1
5	2	NULL	1
6	2	NULL	1
7	2	1	1
8	2	1	1
delete from t1 where c1=1 and c2 is not NULL;
select * from t1;
pk1	c1	c2	c3
1	1	NULL	2
2	1	NULL	2
5	2	NULL	1
6	2	NULL	1
7	2	1	1
8	2	1	1
pk1	c1	c2	c3
1	1	NULL	2
2	1	NULL	2
5	2	NULL	1
6	2	NULL	1
7	2	1	1
8	2	1	1
update t1 set c3=c3+1 where c1=1 and c2 is NULL;
Got one of the listed errors
delete from t1 where c1=1 and c2 is not NULL;
Got one of the listed errors
insert into t1(pk1) values(1);
ERROR 23000: Duplicate entry '1' for key 'PRIMARY'
replace into t1(pk1) values(1);
Got one of the listed errors
select * from t1;
pk1	c1	c2	c3
1	1	NULL	1
2	1	NULL	1
3	1	1	1
4	1	1	1
5	2	NULL	1
6	2	NULL	1
7	2	1	1
8	2	1	1
pk1	c1	c2	c3
1	1	NULL	1
2	1	NULL	1
3	1	1	1
4	1	1	1
5	2	NULL	1
6	2	NULL	1
7	2	1	1
8	2	1	1
insert into t1(pk1,c1,c2,c3) values (100,NULL,NULL,1);
select * from t1;
pk1	c1	c2	c3
1	1	NULL	2
2	1	NULL	2
5	2	NULL	1
6	2	NULL	1
7	2	1	1
8	2	1	1
100	NULL	NULL	1
pk1	c1	c2	c3
100	NULL	NULL	1
1	1	NULL	2
2	1	NULL	2
5	2	NULL	1
6	2	NULL	1
7	2	1	1
8	2	1	1
commit;
update t1 set c3=c3+1 where c1 is null and c2 is null;
update t1 set c3=c3+1 where c1 is null and c2 is null;
Got one of the listed errors
delete from t1 where c1 is null and c2 is null;
Got one of the listed errors
select * from t1;
pk1	c1	c2	c3
1	1	NULL	2
2	1	NULL	2
5	2	NULL	1
6	2	NULL	1
7	2	1	1
8	2	1	1
100	NULL	NULL	1
pk1	c1	c2	c3
100	NULL	NULL	1
1	1	NULL	2
2	1	NULL	2
5	2	NULL	1
6	2	NULL	1
7	2	1	1
8	2	1	1
commit;
select * from t1;
pk1	c1	c2	c3
1	1	NULL	2
2	1	NULL	2
5	2	NULL	1
6	2	NULL	1
7	2	1	1
8	2	1	1
100	NULL	NULL	2
pk1	c1	c2	c3
100	NULL	NULL	2
1	1	NULL	2
2	1	NULL	2
5	2	NULL	1
6	2	NULL	1
7	2	1	1
8	2	1	1
commit;
set autocommit=1;
set autocommit=1;
drop table t1;
set global ob_enable_index_direct_select =0;
