create table t1(pk int primary key, a int, b int, c varchar(1024));
create index i1 on t1(b) storing(c);
alter system major freeze tenant = sys;
alter system major freeze tenant = all_user;
alter system major freeze tenant = all_meta;
insert into t1 values(1,1,1,'a'),(2,1,1,'a');
replace into t1 values(3,1,1,'a'),(4,1,1,'a');
CASE1
set autocommit=0;
update t1 set a=a+1,b=b+1,c='b' where pk=1;
update t1 set a=a+1,b=b+1,c='b' where pk=3;
set autocommit=0;
update t1 set a=a+1,b=b+1,c='b' where pk=2;
update t1 set a=a+1,b=b+1,c='b' where pk=4;
select pk, b, c from t1 where b>0 and b<10 order by pk;
pk	b	c
1	1	a
2	2	b
3	1	a
4	2	b
select pk, a, b from t1 where pk>0 and pk<10 order by pk;
pk	a	b
1	1	1
2	2	2
3	1	1
4	2	2
select * from t1 where b>0 and b<10 order by pk;
pk	a	b	c
1	1	1	a
2	2	2	b
3	1	1	a
4	2	2	b
select pk, b, c from t1 where b>0 and b<10 order by pk;
pk	b	c
1	2	b
2	1	a
3	2	b
4	1	a
select pk, a, b from t1 where pk>0 and pk<10 order by pk;
pk	a	b
1	2	2
2	1	1
3	2	2
4	1	1
select * from t1 where b>0 and b<10 order by pk;
pk	a	b	c
1	2	2	b
2	1	1	a
3	2	2	b
4	1	1	a
commit;
select pk, b, c from t1 where b>0 and b<10 order by pk;
pk	b	c
1	2	b
2	1	a
3	2	b
4	1	a
select pk, a, b from t1 where pk>0 and pk<10 order by pk;
pk	a	b
1	2	2
2	1	1
3	2	2
4	1	1
select * from t1 where b>0 and b<10 order by pk;
pk	a	b	c
1	2	2	b
2	1	1	a
3	2	2	b
4	1	1	a
commit;
select pk, b, c from t1 where b>0 and b<10 order by pk;
pk	b	c
1	2	b
2	2	b
3	2	b
4	2	b
select pk, a, b from t1 where pk>0 and pk<10 order by pk;
pk	a	b
1	2	2
2	2	2
3	2	2
4	2	2
select * from t1 where b>0 and b<10 order by pk;
pk	a	b	c
1	2	2	b
2	2	2	b
3	2	2	b
4	2	2	b
commit;
select pk, b, c from t1 where b>0 and b<10 order by pk;
pk	b	c
1	2	b
2	2	b
3	2	b
4	2	b
select pk, a, b from t1 where pk>0 and pk<10 order by pk;
pk	a	b
1	2	2
2	2	2
3	2	2
4	2	2
select * from t1 where b>0 and b<10 order by pk;
pk	a	b	c
1	2	2	b
2	2	2	b
3	2	2	b
4	2	2	b
commit;
CASE2
set autocommit=0;
replace into t1 values(5,1,1,'a'),(6,1,1,'a');
commit;
update t1 set a=a+1,b=b+1,c='b' where pk=5;
set autocommit=0;
update t1 set a=a+1,b=b+1,c='b' where pk=6;
delete from t1 where pk=5;
Got one of the listed errors
update t1 set b=4 where pk=5;
Got one of the listed errors
insert into t1 values(5,3,3,'b');
ERROR 23000: Duplicate entry '5' for key 'PRIMARY'
replace into t1 values(5,3,3,'c');
Got one of the listed errors
select pk, b, c from t1 where b>0 and b<10 order by pk;
pk	b	c
1	2	b
2	2	b
3	2	b
4	2	b
5	1	a
6	2	b
select pk, a, b from t1 where pk>0 and pk<10 order by pk;
pk	a	b
1	2	2
2	2	2
3	2	2
4	2	2
5	1	1
6	2	2
select * from t1 where b>0 and b<10 order by pk;
pk	a	b	c
1	2	2	b
2	2	2	b
3	2	2	b
4	2	2	b
5	1	1	a
6	2	2	b
select pk, b, c from t1 where b>0 and b<10 order by pk;
pk	b	c
1	2	b
2	2	b
3	2	b
4	2	b
5	2	b
6	1	a
select pk, a, b from t1 where pk>0 and pk<10 order by pk;
pk	a	b
1	2	2
2	2	2
3	2	2
4	2	2
5	2	2
6	1	1
select * from t1 where b>0 and b<10 order by pk;
pk	a	b	c
1	2	2	b
2	2	2	b
3	2	2	b
4	2	2	b
5	2	2	b
6	1	1	a
commit;
select pk, b, c from t1 where b>0 and b<10 order by pk;
pk	b	c
1	2	b
2	2	b
3	2	b
4	2	b
5	2	b
6	1	a
select pk, a, b from t1 where pk>0 and pk<10 order by pk;
pk	a	b
1	2	2
2	2	2
3	2	2
4	2	2
5	2	2
6	1	1
select * from t1 where b>0 and b<10 order by pk;
pk	a	b	c
1	2	2	b
2	2	2	b
3	2	2	b
4	2	2	b
5	2	2	b
6	1	1	a
commit;
select pk, b, c from t1 where b>0 and b<10 order by pk;
pk	b	c
1	2	b
2	2	b
3	2	b
4	2	b
5	2	b
6	2	b
select pk, a, b from t1 where pk>0 and pk<10 order by pk;
pk	a	b
1	2	2
2	2	2
3	2	2
4	2	2
5	2	2
6	2	2
select * from t1 where b>0 and b<10 order by pk;
pk	a	b	c
1	2	2	b
2	2	2	b
3	2	2	b
4	2	2	b
5	2	2	b
6	2	2	b
commit;
select pk, b, c from t1 where b>0 and b<10 order by pk;
pk	b	c
1	2	b
2	2	b
3	2	b
4	2	b
5	2	b
6	2	b
select pk, a, b from t1 where pk>0 and pk<10 order by pk;
pk	a	b
1	2	2
2	2	2
3	2	2
4	2	2
5	2	2
6	2	2
select * from t1 where b>0 and b<10 order by pk;
pk	a	b	c
1	2	2	b
2	2	2	b
3	2	2	b
4	2	2	b
5	2	2	b
6	2	2	b
commit;
CASE3
set autocommit=0;
replace into t1 values(5,1,1,'a'),(6,1,1,'a'),(7,1,1,'a');
commit;
update t1 set a=a+1,b=b+1,c='b' where pk=5;
set autocommit=0;
delete from t1 where pk=6;
update t1 set a=a+1, b=b+1, c='b' where pk=6;
replace into t1 values(7,2,2,'b');
select pk, b, c from t1 where b>0 and b<10 order by pk;
pk	b	c
1	2	b
2	2	b
3	2	b
4	2	b
5	1	a
7	2	b
select pk, a, b from t1 where pk>0 and pk<10 order by pk;
pk	a	b
1	2	2
2	2	2
3	2	2
4	2	2
5	1	1
7	2	2
select * from t1 where b>0 and b<10 order by pk;
pk	a	b	c
1	2	2	b
2	2	2	b
3	2	2	b
4	2	2	b
5	1	1	a
7	2	2	b
select pk, b, c from t1 where b>0 and b<10 order by pk;
pk	b	c
1	2	b
2	2	b
3	2	b
4	2	b
5	2	b
6	1	a
7	1	a
select pk, a, b from t1 where pk>0 and pk<10 order by pk;
pk	a	b
1	2	2
2	2	2
3	2	2
4	2	2
5	2	2
6	1	1
7	1	1
select * from t1 where b>0 and b<10 order by pk;
pk	a	b	c
1	2	2	b
2	2	2	b
3	2	2	b
4	2	2	b
5	2	2	b
6	1	1	a
7	1	1	a
commit;
select pk, b, c from t1 where b>0 and b<10 order by pk;
pk	b	c
1	2	b
2	2	b
3	2	b
4	2	b
5	2	b
6	1	a
7	1	a
select pk, a, b from t1 where pk>0 and pk<10 order by pk;
pk	a	b
1	2	2
2	2	2
3	2	2
4	2	2
5	2	2
6	1	1
7	1	1
select * from t1 where b>0 and b<10 order by pk;
pk	a	b	c
1	2	2	b
2	2	2	b
3	2	2	b
4	2	2	b
5	2	2	b
6	1	1	a
7	1	1	a
commit;
select pk, b, c from t1 where b>0 and b<10 order by pk;
pk	b	c
1	2	b
2	2	b
3	2	b
4	2	b
5	2	b
7	2	b
select pk, a, b from t1 where pk>0 and pk<10 order by pk;
pk	a	b
1	2	2
2	2	2
3	2	2
4	2	2
5	2	2
7	2	2
select * from t1 where b>0 and b<10 order by pk;
pk	a	b	c
1	2	2	b
2	2	2	b
3	2	2	b
4	2	2	b
5	2	2	b
7	2	2	b
commit;
select pk, b, c from t1 where b>0 and b<10 order by pk;
pk	b	c
1	2	b
2	2	b
3	2	b
4	2	b
5	2	b
7	2	b
select pk, a, b from t1 where pk>0 and pk<10 order by pk;
pk	a	b
1	2	2
2	2	2
3	2	2
4	2	2
5	2	2
7	2	2
select * from t1 where b>0 and b<10 order by pk;
pk	a	b	c
1	2	2	b
2	2	2	b
3	2	2	b
4	2	2	b
5	2	2	b
7	2	2	b
commit;
CASE4
set autocommit=0;
replace into t1 values(8,1,1,'a'),(9,1,1,'a');
commit;
update t1 set a=a+1, b=b+1, c='b' where pk=8;
set autocommit=0;
update t1 set a=a+1, b=b+1, c='b' where pk=9;
select pk, b, c from t1 where b>0 and b<10 order by pk;
pk	b	c
1	2	b
2	2	b
3	2	b
4	2	b
5	2	b
7	2	b
8	1	a
9	2	b
select pk, a, b from t1 where pk>0 and pk<10 order by pk;
pk	a	b
1	2	2
2	2	2
3	2	2
4	2	2
5	2	2
7	2	2
8	1	1
9	2	2
select * from t1 where b>0 and b<10 order by pk;
pk	a	b	c
1	2	2	b
2	2	2	b
3	2	2	b
4	2	2	b
5	2	2	b
7	2	2	b
8	1	1	a
9	2	2	b
select pk, b, c from t1 where b>0 and b<10 order by pk;
pk	b	c
1	2	b
2	2	b
3	2	b
4	2	b
5	2	b
7	2	b
8	2	b
9	1	a
select pk, a, b from t1 where pk>0 and pk<10 order by pk;
pk	a	b
1	2	2
2	2	2
3	2	2
4	2	2
5	2	2
7	2	2
8	2	2
9	1	1
select * from t1 where b>0 and b<10 order by pk;
pk	a	b	c
1	2	2	b
2	2	2	b
3	2	2	b
4	2	2	b
5	2	2	b
7	2	2	b
8	2	2	b
9	1	1	a
commit;
select pk, b, c from t1 where b>0 and b<10 order by pk;
pk	b	c
1	2	b
2	2	b
3	2	b
4	2	b
5	2	b
7	2	b
8	2	b
9	1	a
select pk, a, b from t1 where pk>0 and pk<10 order by pk;
pk	a	b
1	2	2
2	2	2
3	2	2
4	2	2
5	2	2
7	2	2
8	2	2
9	1	1
select * from t1 where b>0 and b<10 order by pk;
pk	a	b	c
1	2	2	b
2	2	2	b
3	2	2	b
4	2	2	b
5	2	2	b
7	2	2	b
8	2	2	b
9	1	1	a
select pk, b, c from t1 where b>0 and b<10 order by pk;
pk	b	c
1	2	b
2	2	b
3	2	b
4	2	b
5	2	b
7	2	b
8	2	b
9	2	b
select pk, a, b from t1 where pk>0 and pk<10 order by pk;
pk	a	b
1	2	2
2	2	2
3	2	2
4	2	2
5	2	2
7	2	2
8	2	2
9	2	2
select * from t1 where b>0 and b<10 order by pk;
pk	a	b	c
1	2	2	b
2	2	2	b
3	2	2	b
4	2	2	b
5	2	2	b
7	2	2	b
8	2	2	b
9	2	2	b
rollback;
select pk, b, c from t1 where b>0 and b<10 order by pk;
pk	b	c
1	2	b
2	2	b
3	2	b
4	2	b
5	2	b
7	2	b
8	2	b
9	1	a
select pk, a, b from t1 where pk>0 and pk<10 order by pk;
pk	a	b
1	2	2
2	2	2
3	2	2
4	2	2
5	2	2
7	2	2
8	2	2
9	1	1
select * from t1 where b>0 and b<10 order by pk;
pk	a	b	c
1	2	2	b
2	2	2	b
3	2	2	b
4	2	2	b
5	2	2	b
7	2	2	b
8	2	2	b
9	1	1	a
drop table t1;
