create table t1(c1 int primary key, c2 varchar(1024), c3 int, c4 int);
create unique index i11 on t1(c2);
create unique index i12 on t1(c3) storing(c2, c4);
insert into t1 values(1,'a',1, 1);
alter system major freeze tenant = sys;
alter system major freeze tenant = all_user;
alter system major freeze tenant = all_meta;
alter system major freeze tenant = sys;
alter system major freeze tenant = all_user;
alter system major freeze tenant = all_meta;
select table_name, index_status from oceanbase.__all_virtual_table where table_name like '%idx_i1%';
table_name	index_status
insert into t1 values(2,'b',2, 2);
insert into t1 values(3,'a',3, 3);
ERROR 23000: Duplicate entry 'a' for key 'i11'
insert into t1 values(3,'c',3, 3);
insert into t1 values(4,'d','2',4);
ERROR 23000: Duplicate entry '2' for key 'i12'
insert into t1 values(4,'d','4',4);
select * from t1;
c1	c2	c3	c4
1	a	1	1
2	b	2	2
3	c	3	3
4	d	4	4
c1	c2
1	a
2	b
3	c
4	d
c1	c2	c3	c4
1	a	1	1
2	b	2	2
3	c	3	3
4	d	4	4
replace into t1 values(5,'a',5, 5);
replace into t1 values(5,'f',5, 5);
insert into t1 values(6,'g','2',6);
ERROR 23000: Duplicate entry '2' for key 'i12'
insert into t1 values(6,'g','6',6);
select * from t1;
c1	c2	c3	c4
2	b	2	2
3	c	3	3
4	d	4	4
5	f	5	5
6	g	6	6
c1	c2
2	b
3	c
4	d
5	f
6	g
c1	c2	c3	c4
2	b	2	2
3	c	3	3
4	d	4	4
5	f	5	5
6	g	6	6
insert into t1 values(7,'h',30, 7);
replace into t1 values(8,'i',8, 8);
update t1 set c2='a' where c1=7;
select * from t1;
c1	c2	c3	c4
2	b	2	2
3	c	3	3
4	d	4	4
5	f	5	5
6	g	6	6
7	a	30	7
8	i	8	8
update t1 set c3='2' where c1=8;
ERROR 23000: Duplicate entry '2' for key 'i12'
update t1 set c2='aa' where c1=7;
update t1 set c3=22 where c1=8;
select * from t1;
c1	c2	c3	c4
2	b	2	2
3	c	3	3
4	d	4	4
5	f	5	5
6	g	6	6
7	aa	30	7
8	i	22	8
c1	c2
7	aa
2	b
3	c
4	d
5	f
6	g
8	i
c1	c2	c3	c4
2	b	2	2
3	c	3	3
4	d	4	4
5	f	5	5
6	g	6	6
8	i	22	8
7	aa	30	7
