create table t1(c1 int , c2 varchar(1024), c3 int, c4 varchar(1024), c5  timestamp(6) default "2012-01-01 12:00:00", c6 bool, primary key(c1, c2));
insert into t1 values(1,'a',1,'a','2013-12-03 00:00:00',0);
insert into t1 values(2,'b',2,'b','2013-12-03 00:00:00',1);
insert into t1 values(3,'b',2,'b','2013-12-03 00:00:00',1);
insert into t1 values(4,'b',2,'b','2013-12-03 00:00:00',1);
insert into t1 values(5,'e', 5,'e','2013-12-03 00:00:00',1);
insert into t1 values(5,'e1',5,'e1','2013-12-03 00:00:00',1);
insert into t1 values(5,'e2',5,'e1','2013-12-03 00:00:00',1);
insert into t1 values(6,'f',6,'f','2013-12-03 00:00:00',1);
insert into t1 values(7,'f',7,'f','2013-12-03 00:00:00',1);
insert into t1 values(8,'f',8,'f','2013-12-03 00:00:00',1);
insert into t1 values(9,'g',9,'g','2013-12-03 00:00:00',null);
insert into t1 values(10,'g',10,'g',null,null);
insert into t1 values(11,'g',11,'g',null,null);
insert into t1 values(12,'g',11,null,null,null);
insert into t1 values(13,'g',null,null,null,null);
insert into t1 values(14,null,null,null,null,null);
insert into t1 values(null,'h',null,null,null,null);
insert into t1 values(null,null,null,null,null,null);
create index i1 on t1(c3,c4) storing(c6);
select * from t1;
c1	c2	c3	c4	c5	c6
NULL	NULL	NULL	NULL	NULL	NULL
NULL	h	NULL	NULL	NULL	NULL
1	a	1	a	2013-12-03 00:00:00	0
2	b	2	b	2013-12-03 00:00:00	1
3	b	2	b	2013-12-03 00:00:00	1
4	b	2	b	2013-12-03 00:00:00	1
5	e	5	e	2013-12-03 00:00:00	1
5	e1	5	e1	2013-12-03 00:00:00	1
5	e2	5	e1	2013-12-03 00:00:00	1
6	f	6	f	2013-12-03 00:00:00	1
7	f	7	f	2013-12-03 00:00:00	1
8	f	8	f	2013-12-03 00:00:00	1
9	g	9	g	2013-12-03 00:00:00	NULL
10	g	10	g	NULL	NULL
11	g	11	g	NULL	NULL
12	g	11	NULL	NULL	NULL
13	g	NULL	NULL	NULL	NULL
14	NULL	NULL	NULL	NULL	NULL
alter system major freeze tenant = sys;
alter system major freeze tenant = all_user;
alter system major freeze tenant = all_meta;
c1	c2	c3	c4	c6
NULL	NULL	NULL	NULL	NULL
NULL	h	NULL	NULL	NULL
13	g	NULL	NULL	NULL
14	NULL	NULL	NULL	NULL
1	a	1	a	0
2	b	2	b	1
3	b	2	b	1
4	b	2	b	1
5	e	5	e	1
5	e1	5	e1	1
5	e2	5	e1	1
6	f	6	f	1
7	f	7	f	1
8	f	8	f	1
9	g	9	g	NULL
10	g	10	g	NULL
12	g	11	NULL	NULL
11	g	11	g	NULL
insert into t1(c1,c2) values(201,'j');
insert into t1(c1,c2,c3) values(202,'j',202);
insert into t1(c1,c2,c3,c4) values(203,'j',203,'j');
select * from t1;
c1	c2	c3	c4	c5	c6
NULL	NULL	NULL	NULL	NULL	NULL
NULL	h	NULL	NULL	NULL	NULL
1	a	1	a	2013-12-03 00:00:00	0
2	b	2	b	2013-12-03 00:00:00	1
3	b	2	b	2013-12-03 00:00:00	1
4	b	2	b	2013-12-03 00:00:00	1
5	e	5	e	2013-12-03 00:00:00	1
5	e1	5	e1	2013-12-03 00:00:00	1
5	e2	5	e1	2013-12-03 00:00:00	1
6	f	6	f	2013-12-03 00:00:00	1
7	f	7	f	2013-12-03 00:00:00	1
8	f	8	f	2013-12-03 00:00:00	1
9	g	9	g	2013-12-03 00:00:00	NULL
10	g	10	g	NULL	NULL
11	g	11	g	NULL	NULL
12	g	11	NULL	NULL	NULL
13	g	NULL	NULL	NULL	NULL
14	NULL	NULL	NULL	NULL	NULL
201	j	NULL	NULL	NULL	NULL
202	j	202	NULL	NULL	NULL
203	j	203	j	NULL	NULL
c1	c2	c3	c4	c6
NULL	NULL	NULL	NULL	NULL
NULL	h	NULL	NULL	NULL
13	g	NULL	NULL	NULL
14	NULL	NULL	NULL	NULL
201	j	NULL	NULL	NULL
1	a	1	a	0
2	b	2	b	1
3	b	2	b	1
4	b	2	b	1
5	e	5	e	1
5	e1	5	e1	1
5	e2	5	e1	1
6	f	6	f	1
7	f	7	f	1
8	f	8	f	1
9	g	9	g	NULL
10	g	10	g	NULL
12	g	11	NULL	NULL
11	g	11	g	NULL
202	j	202	NULL	NULL
203	j	203	j	NULL
replace into t1(c1,c2) values(301,'k');
replace into t1(c1,c2,c3) values(302,'k',302);
replace into t1(c1,c2,c3,c4) values(303,'k',303,'k');
replace into t1 values(14,null,14,null,null,1);
replace into t1 values(304,null,304,null,null,1);
select * from t1;
c1	c2	c3	c4	c5	c6
NULL	NULL	NULL	NULL	NULL	NULL
NULL	h	NULL	NULL	NULL	NULL
1	a	1	a	2013-12-03 00:00:00	0
2	b	2	b	2013-12-03 00:00:00	1
3	b	2	b	2013-12-03 00:00:00	1
4	b	2	b	2013-12-03 00:00:00	1
5	e	5	e	2013-12-03 00:00:00	1
5	e1	5	e1	2013-12-03 00:00:00	1
5	e2	5	e1	2013-12-03 00:00:00	1
6	f	6	f	2013-12-03 00:00:00	1
7	f	7	f	2013-12-03 00:00:00	1
8	f	8	f	2013-12-03 00:00:00	1
9	g	9	g	2013-12-03 00:00:00	NULL
10	g	10	g	NULL	NULL
11	g	11	g	NULL	NULL
12	g	11	NULL	NULL	NULL
13	g	NULL	NULL	NULL	NULL
14	NULL	14	NULL	NULL	1
201	j	NULL	NULL	NULL	NULL
202	j	202	NULL	NULL	NULL
203	j	203	j	NULL	NULL
301	k	NULL	NULL	NULL	NULL
302	k	302	NULL	NULL	NULL
303	k	303	k	NULL	NULL
304	NULL	304	NULL	NULL	1
c1	c2	c3	c4	c6
NULL	NULL	NULL	NULL	NULL
NULL	h	NULL	NULL	NULL
13	g	NULL	NULL	NULL
201	j	NULL	NULL	NULL
301	k	NULL	NULL	NULL
1	a	1	a	0
2	b	2	b	1
3	b	2	b	1
4	b	2	b	1
5	e	5	e	1
5	e1	5	e1	1
5	e2	5	e1	1
6	f	6	f	1
7	f	7	f	1
8	f	8	f	1
9	g	9	g	NULL
10	g	10	g	NULL
12	g	11	NULL	NULL
11	g	11	g	NULL
14	NULL	14	NULL	1
202	j	202	NULL	NULL
203	j	203	j	NULL
302	k	302	NULL	NULL
303	k	303	k	NULL
304	NULL	304	NULL	1
update t1 set c3=1000, c4='aa', c5=null where c1=1 and c2='a';
update t1 set c3=null, c4=null ,c5=null, c6=null where c1=2 and c2='b';
select * from t1;
c1	c2	c3	c4	c5	c6
NULL	NULL	NULL	NULL	NULL	NULL
NULL	h	NULL	NULL	NULL	NULL
1	a	1000	aa	NULL	0
2	b	NULL	NULL	NULL	NULL
3	b	2	b	2013-12-03 00:00:00	1
4	b	2	b	2013-12-03 00:00:00	1
5	e	5	e	2013-12-03 00:00:00	1
5	e1	5	e1	2013-12-03 00:00:00	1
5	e2	5	e1	2013-12-03 00:00:00	1
6	f	6	f	2013-12-03 00:00:00	1
7	f	7	f	2013-12-03 00:00:00	1
8	f	8	f	2013-12-03 00:00:00	1
9	g	9	g	2013-12-03 00:00:00	NULL
10	g	10	g	NULL	NULL
11	g	11	g	NULL	NULL
12	g	11	NULL	NULL	NULL
13	g	NULL	NULL	NULL	NULL
14	NULL	14	NULL	NULL	1
201	j	NULL	NULL	NULL	NULL
202	j	202	NULL	NULL	NULL
203	j	203	j	NULL	NULL
301	k	NULL	NULL	NULL	NULL
302	k	302	NULL	NULL	NULL
303	k	303	k	NULL	NULL
304	NULL	304	NULL	NULL	1
c1	c2	c3	c4	c6
NULL	NULL	NULL	NULL	NULL
NULL	h	NULL	NULL	NULL
2	b	NULL	NULL	NULL
13	g	NULL	NULL	NULL
201	j	NULL	NULL	NULL
301	k	NULL	NULL	NULL
3	b	2	b	1
4	b	2	b	1
5	e	5	e	1
5	e1	5	e1	1
5	e2	5	e1	1
6	f	6	f	1
7	f	7	f	1
8	f	8	f	1
9	g	9	g	NULL
10	g	10	g	NULL
12	g	11	NULL	NULL
11	g	11	g	NULL
14	NULL	14	NULL	1
202	j	202	NULL	NULL
203	j	203	j	NULL
302	k	302	NULL	NULL
303	k	303	k	NULL
304	NULL	304	NULL	1
1	a	1000	aa	0
delete from t1 where c1 is null and c2 is null;
delete from t1 where c1=304 and c2  is null and c3=304;
delete from t1 where c1=14 and c2 is null and c3=14 and c4 is null;
delete from t1 where c1=1 and c2='a';
select * from t1;
c1	c2	c3	c4	c5	c6
NULL	h	NULL	NULL	NULL	NULL
2	b	NULL	NULL	NULL	NULL
3	b	2	b	2013-12-03 00:00:00	1
4	b	2	b	2013-12-03 00:00:00	1
5	e	5	e	2013-12-03 00:00:00	1
5	e1	5	e1	2013-12-03 00:00:00	1
5	e2	5	e1	2013-12-03 00:00:00	1
6	f	6	f	2013-12-03 00:00:00	1
7	f	7	f	2013-12-03 00:00:00	1
8	f	8	f	2013-12-03 00:00:00	1
9	g	9	g	2013-12-03 00:00:00	NULL
10	g	10	g	NULL	NULL
11	g	11	g	NULL	NULL
12	g	11	NULL	NULL	NULL
13	g	NULL	NULL	NULL	NULL
201	j	NULL	NULL	NULL	NULL
202	j	202	NULL	NULL	NULL
203	j	203	j	NULL	NULL
301	k	NULL	NULL	NULL	NULL
302	k	302	NULL	NULL	NULL
303	k	303	k	NULL	NULL
c1	c2	c3	c4	c6
NULL	h	NULL	NULL	NULL
2	b	NULL	NULL	NULL
13	g	NULL	NULL	NULL
201	j	NULL	NULL	NULL
301	k	NULL	NULL	NULL
3	b	2	b	1
4	b	2	b	1
5	e	5	e	1
5	e1	5	e1	1
5	e2	5	e1	1
6	f	6	f	1
7	f	7	f	1
8	f	8	f	1
9	g	9	g	NULL
10	g	10	g	NULL
12	g	11	NULL	NULL
11	g	11	g	NULL
202	j	202	NULL	NULL
203	j	203	j	NULL
302	k	302	NULL	NULL
303	k	303	k	NULL
drop table t1;
