drop table if exists ttl;
create table ttl(i1 int, v2 varchar(80), i3 char(20),i4 float, d4 datetime(6),i5 decimal(5,3), primary key(i1));
create index ttlidx_125 on ttl(i1);
create index ttlidx_225 on ttl(v2);
create index ttlidx_325 on ttl(i3);
create index ttlidx_425 on ttl(i3);
create index ttlidx_525 on ttl(d4);
create index ttlidx_124 on ttl(i1);
create index ttlidx_224 on ttl(v2);
create index ttlidx_324 on ttl(i3);
create index ttlidx_424 on ttl(i3);
create index ttlidx_524 on ttl(d4);
create index ttlidx_123 on ttl(i1);
create index ttlidx_223 on ttl(v2);
create index ttlidx_323 on ttl(i3);
create index ttlidx_423 on ttl(i3);
create index ttlidx_523 on ttl(d4);
create index ttlidx_122 on ttl(i1);
create index ttlidx_222 on ttl(v2);
create index ttlidx_322 on ttl(i3);
create index ttlidx_422 on ttl(i3);
create index ttlidx_522 on ttl(d4);
create index ttlidx_121 on ttl(i1);
create index ttlidx_221 on ttl(v2);
create index ttlidx_321 on ttl(i3);
create index ttlidx_421 on ttl(i3);
create index ttlidx_521 on ttl(d4);
create index ttlidx_120 on ttl(i1);
create index ttlidx_220 on ttl(v2);
create index ttlidx_320 on ttl(i3);
create index ttlidx_420 on ttl(i3);
create index ttlidx_520 on ttl(d4);
create index ttlidx_119 on ttl(i1);
create index ttlidx_219 on ttl(v2);
create index ttlidx_319 on ttl(i3);
create index ttlidx_419 on ttl(i3);
create index ttlidx_519 on ttl(d4);
create index ttlidx_118 on ttl(i1);
create index ttlidx_218 on ttl(v2);
create index ttlidx_318 on ttl(i3);
create index ttlidx_418 on ttl(i3);
create index ttlidx_518 on ttl(d4);
create index ttlidx_117 on ttl(i1);
create index ttlidx_217 on ttl(v2);
create index ttlidx_317 on ttl(i3);
create index ttlidx_417 on ttl(i3);
create index ttlidx_517 on ttl(d4);
create index ttlidx_116 on ttl(i1);
create index ttlidx_216 on ttl(v2);
create index ttlidx_316 on ttl(i3);
create index ttlidx_416 on ttl(i3);
create index ttlidx_516 on ttl(d4);
create index ttlidx_115 on ttl(i1);
create index ttlidx_215 on ttl(v2);
create index ttlidx_315 on ttl(i3);
create index ttlidx_415 on ttl(i3);
create index ttlidx_515 on ttl(d4);
create index ttlidx_114 on ttl(i1);
create index ttlidx_214 on ttl(v2);
create index ttlidx_314 on ttl(i3);
create index ttlidx_414 on ttl(i3);
create index ttlidx_514 on ttl(d4);
create index ttlidx_113 on ttl(i1);
create index ttlidx_213 on ttl(v2);
create index ttlidx_313 on ttl(i3);
create index ttlidx_413 on ttl(i3);
create index ttlidx_513 on ttl(d4);
create index ttlidx_112 on ttl(i1);
create index ttlidx_212 on ttl(v2);
create index ttlidx_312 on ttl(i3);
create index ttlidx_412 on ttl(i3);
create index ttlidx_512 on ttl(d4);
create index ttlidx_111 on ttl(i1);
create index ttlidx_211 on ttl(v2);
create index ttlidx_311 on ttl(i3);
create index ttlidx_411 on ttl(i3);
create index ttlidx_511 on ttl(d4);
create index ttlidx_110 on ttl(i1);
create index ttlidx_210 on ttl(v2);
create index ttlidx_310 on ttl(i3);
create index ttlidx_410 on ttl(i3);
create index ttlidx_510 on ttl(d4);
create index ttlidx_19 on ttl(i1);
create index ttlidx_29 on ttl(v2);
create index ttlidx_39 on ttl(i3);
create index ttlidx_49 on ttl(i3);
create index ttlidx_59 on ttl(d4);
create index ttlidx_18 on ttl(i1);
create index ttlidx_28 on ttl(v2);
create index ttlidx_38 on ttl(i3);
create index ttlidx_48 on ttl(i3);
create index ttlidx_58 on ttl(d4);
create index ttlidx_17 on ttl(i1);
create index ttlidx_27 on ttl(v2);
create index ttlidx_37 on ttl(i3);
create index ttlidx_47 on ttl(i3);
create index ttlidx_57 on ttl(d4);
create index ttlidx_16 on ttl(i1);
create index ttlidx_26 on ttl(v2);
create index ttlidx_36 on ttl(i3);
create index ttlidx_46 on ttl(i3);
create index ttlidx_56 on ttl(d4);
create index ttlidx_15 on ttl(i1);
create index ttlidx_25 on ttl(v2);
create index ttlidx_35 on ttl(i3);
create index ttlidx_45 on ttl(i3);
create index ttlidx_55 on ttl(d4);
create index ttlidx_14 on ttl(i1);
create index ttlidx_24 on ttl(v2);
create index ttlidx_34 on ttl(i3);
create index ttlidx_44 on ttl(i3);
create index ttlidx_54 on ttl(d4);
create index ttlidx_13 on ttl(i1);
create index ttlidx_23 on ttl(v2);
create index ttlidx_33 on ttl(i3);
create index ttlidx_43 on ttl(i3);
create index ttlidx_53 on ttl(d4);
create index ttlidx_12 on ttl(i1);
create index ttlidx_22 on ttl(v2);
create index ttlidx_32 on ttl(i3);
create index ttlidx_42 on ttl(i3);
create index ttlidx_52 on ttl(d4);
create index ttlidx_11 on ttl(i1);
create index ttlidx_21 on ttl(v2);
create index ttlidx_31 on ttl(i3);
create index ttlidx_41 on ttl(i3);
create index ttlidx_51 on ttl(d4);
create index ttlidx_126 on ttl(i1);
create index ttlidx_127cnt2 on ttl(v2);
create index ttlidx_128cnt2 on ttl(i3);
create index ttlidx_129cnt2 on ttl(i3);
ERROR 42000: Too many keys specified; max 128 keys allowed
merge happens
alter system major freeze tenant = sys;
alter system major freeze tenant = all_user;
alter system major freeze tenant = all_meta;
select count(*)  from oceanbase.__all_virtual_table where table_name like '__idx_%' and index_status!=2;
count(*)
0
select * from ttl limit 1;
i1	v2	i3	i4	d4	i5
1	now	haha	1.6256	2014-05-04 12:00:00.000000	-10.235
select * from ttl where i1=1;
i1	v2	i3	i4	d4	i5
1	now	haha	1.6256	2014-05-04 12:00:00.000000	-10.235
update ttl set i1=400 where i1=10;
delete from ttl where i1=11;
delete from ttl where i1>=11 and i1<=20;
select * from ttl where i1>=11 and i1<=20;
i1	v2	i3	i4	d4	i5
select * from ttl where i1>=21 and i1<=30;
i1	v2	i3	i4	d4	i5
21	now	haha	1.6256	2014-05-04 12:00:00.000000	-10.235
22	now	haha	1.6256	2014-05-04 12:00:00.000000	-10.235
23	now	haha	1.6256	2014-05-04 12:00:00.000000	-10.235
24	now	haha	1.6256	2014-05-04 12:00:00.000000	-10.235
25	now	haha	1.6256	2014-05-04 12:00:00.000000	-10.235
26	now	haha	1.6256	2014-05-04 12:00:00.000000	-10.235
27	now	haha	1.6256	2014-05-04 12:00:00.000000	-10.235
28	now	haha	1.6256	2014-05-04 12:00:00.000000	-10.235
29	now	haha	1.6256	2014-05-04 12:00:00.000000	-10.235
30	now	haha	1.6256	2014-05-04 12:00:00.000000	-10.235
