create table t1(pk1 int, pk2 int, c1 int, c2 int, primary key(pk1,pk2));
insert into t1(pk1,pk2,c1,c2) values(1,1,1,1);
insert into t1(pk1,pk2,c1,c2) values(2,2,1,1);
insert into t1(pk1,pk2,c1,c2) values(3,3,2,1);
insert into t1(pk1,pk2,c1,c2) values(4,4,2,1);
insert into t1(pk1,pk2,c1,c2) values(5,5,3,1);
insert into t1(pk1,pk2,c1,c2) values(6,6,3,1);
insert into t1(pk1,pk2,c1,c2) values(7,7,4,1);
insert into t1(pk1,pk2,c1,c2) values(8,8,4,1);
create index i1 on t1(c1) storing(c2);
alter system major freeze tenant = sys;
alter system major freeze tenant = all_user;
alter system major freeze tenant = all_meta;
select * from t1;
pk1	pk2	c1	c2
1	1	1	1
2	2	1	1
3	3	2	1
4	4	2	1
5	5	3	1
6	6	3	1
7	7	4	1
8	8	4	1
pk1	pk2	c1	c2
1	1	1	1
2	2	1	1
3	3	2	1
4	4	2	1
5	5	3	1
6	6	3	1
7	7	4	1
8	8	4	1
set autocommit=0;
set autocommit=0;
update t1 set c2=c2+1 where c1 in (1,2,3,4);
select * from t1;
pk1	pk2	c1	c2
1	1	1	2
2	2	1	2
3	3	2	2
4	4	2	2
5	5	3	2
6	6	3	2
7	7	4	2
8	8	4	2
pk1	pk2	c1	c2
1	1	1	2
2	2	1	2
3	3	2	2
4	4	2	2
5	5	3	2
6	6	3	2
7	7	4	2
8	8	4	2
delete from t1 where c1 in (1,2);
select * from t1;
pk1	pk2	c1	c2
5	5	3	2
6	6	3	2
7	7	4	2
8	8	4	2
pk1	pk2	c1	c2
5	5	3	2
6	6	3	2
7	7	4	2
8	8	4	2
select * from t1;
pk1	pk2	c1	c2
1	1	1	1
2	2	1	1
3	3	2	1
4	4	2	1
5	5	3	1
6	6	3	1
7	7	4	1
8	8	4	1
pk1	pk2	c1	c2
1	1	1	1
2	2	1	1
3	3	2	1
4	4	2	1
5	5	3	1
6	6	3	1
7	7	4	1
8	8	4	1
commit;
select * from t1;
pk1	pk2	c1	c2
5	5	3	2
6	6	3	2
7	7	4	2
8	8	4	2
pk1	pk2	c1	c2
5	5	3	2
6	6	3	2
7	7	4	2
8	8	4	2
commit;
select * from t1;
pk1	pk2	c1	c2
5	5	3	2
6	6	3	2
7	7	4	2
8	8	4	2
pk1	pk2	c1	c2
5	5	3	2
6	6	3	2
7	7	4	2
8	8	4	2
commit;
delete from t1;
replace into t1(pk1,pk2,c1,c2) values (1,1,1,1),(2,2,1,1),(3,3,2,1),(4,4,2,1),(5,5,3,1),(6,6,3,1),(7,7,4,1),(8,8,4,1);
select * from t1;
pk1	pk2	c1	c2
1	1	1	1
2	2	1	1
3	3	2	1
4	4	2	1
5	5	3	1
6	6	3	1
7	7	4	1
8	8	4	1
pk1	pk2	c1	c2
1	1	1	1
2	2	1	1
3	3	2	1
4	4	2	1
5	5	3	1
6	6	3	1
7	7	4	1
8	8	4	1
update t1 set c2=c2+1 where c1 in (1,2);
select * from t1;
pk1	pk2	c1	c2
1	1	1	2
2	2	1	2
3	3	2	2
4	4	2	2
5	5	3	1
6	6	3	1
7	7	4	1
8	8	4	1
pk1	pk2	c1	c2
1	1	1	2
2	2	1	2
3	3	2	2
4	4	2	2
5	5	3	1
6	6	3	1
7	7	4	1
8	8	4	1
select * from t1;
pk1	pk2	c1	c2
1	1	1	1
2	2	1	1
3	3	2	1
4	4	2	1
5	5	3	1
6	6	3	1
7	7	4	1
8	8	4	1
pk1	pk2	c1	c2
1	1	1	1
2	2	1	1
3	3	2	1
4	4	2	1
5	5	3	1
6	6	3	1
7	7	4	1
8	8	4	1
delete from t1 where c1 in (3,4);
select * from t1;
pk1	pk2	c1	c2
1	1	1	2
2	2	1	2
3	3	2	2
4	4	2	2
5	5	3	1
6	6	3	1
7	7	4	1
8	8	4	1
pk1	pk2	c1	c2
1	1	1	2
2	2	1	2
3	3	2	2
4	4	2	2
5	5	3	1
6	6	3	1
7	7	4	1
8	8	4	1
commit;
select * from t1;
pk1	pk2	c1	c2
1	1	1	2
2	2	1	2
3	3	2	2
4	4	2	2
pk1	pk2	c1	c2
1	1	1	2
2	2	1	2
3	3	2	2
4	4	2	2
commit;
select * from t1;
pk1	pk2	c1	c2
1	1	1	2
2	2	1	2
3	3	2	2
4	4	2	2
pk1	pk2	c1	c2
1	1	1	2
2	2	1	2
3	3	2	2
4	4	2	2
commit;
delete from t1;
replace into t1(pk1,pk2,c1,c2) values (1,1,1,1),(2,2,1,1),(3,3,2,1),(4,4,2,1),(5,5,3,1),(6,6,3,1),(7,7,4,1),(8,8,4,1);
select * from t1;
pk1	pk2	c1	c2
1	1	1	1
2	2	1	1
3	3	2	1
4	4	2	1
5	5	3	1
6	6	3	1
7	7	4	1
8	8	4	1
pk1	pk2	c1	c2
1	1	1	1
2	2	1	1
3	3	2	1
4	4	2	1
5	5	3	1
6	6	3	1
7	7	4	1
8	8	4	1
update t1 set c2=c2+1 where c1 in (1,2,3,4);
select * from t1;
pk1	pk2	c1	c2
1	1	1	2
2	2	1	2
3	3	2	2
4	4	2	2
5	5	3	2
6	6	3	2
7	7	4	2
8	8	4	2
pk1	pk2	c1	c2
1	1	1	2
2	2	1	2
3	3	2	2
4	4	2	2
5	5	3	2
6	6	3	2
7	7	4	2
8	8	4	2
delete from t1 where c1 in (1,2);
select * from t1;
pk1	pk2	c1	c2
5	5	3	2
6	6	3	2
7	7	4	2
8	8	4	2
pk1	pk2	c1	c2
5	5	3	2
6	6	3	2
7	7	4	2
8	8	4	2
commit;
update t1 set c2=c2+1 where c1 in (1,2,3,4);
select * from t1;
pk1	pk2	c1	c2
5	5	3	3
6	6	3	3
7	7	4	3
8	8	4	3
pk1	pk2	c1	c2
5	5	3	3
6	6	3	3
7	7	4	3
8	8	4	3
delete from t1 where c1 in (3,4);
select * from t1;
pk1	pk2	c1	c2
pk1	pk2	c1	c2
commit;
select * from t1;
pk1	pk2	c1	c2
pk1	pk2	c1	c2
commit;
delete from t1;
replace into t1(pk1,pk2,c1,c2) values (1,1,1,1),(2,2,1,1),(3,3,2,1),(4,4,2,1),(5,5,3,1),(6,6,3,1),(7,7,4,1),(8,8,4,1);
select * from t1;
pk1	pk2	c1	c2
1	1	1	1
2	2	1	1
3	3	2	1
4	4	2	1
5	5	3	1
6	6	3	1
7	7	4	1
8	8	4	1
pk1	pk2	c1	c2
1	1	1	1
2	2	1	1
3	3	2	1
4	4	2	1
5	5	3	1
6	6	3	1
7	7	4	1
8	8	4	1
delete from t1 where c1 in (1,2);
replace into t1(pk1,pk2,c1,c2) values (1,1,1,1),(2,2,1,1);
insert  into t1(pk1,pk2,c1,c2) values (3,3,2,1),(4,4,2,1);
update t1 set c2=c2+1 where c1 in (1,2,3,4);
replace into t1(pk1,pk2,c1,c2) values (9,9,5,1);
insert  into t1(pk1,pk2,c1,c2) values (10,10,5,1);
select * from t1;
pk1	pk2	c1	c2
1	1	1	2
2	2	1	2
3	3	2	2
4	4	2	2
5	5	3	2
6	6	3	2
7	7	4	2
8	8	4	2
9	9	5	1
10	10	5	1
pk1	pk2	c1	c2
1	1	1	2
2	2	1	2
3	3	2	2
4	4	2	2
5	5	3	2
6	6	3	2
7	7	4	2
8	8	4	2
9	9	5	1
10	10	5	1
set ob_query_timeout=1000000;
update t1 set c2=c2+1 where c1 in (1,2,3,4);
Got one of the listed errors
delete from t1 where c1 in (1,2,3,4);
Got one of the listed errors
replace into t1(pk1,pk2,c1,c2) values (1,1,1,1);
Got one of the listed errors
insert into t1(pk1,pk2,c1,c2) values (1,1,1,1);
ERROR 23000: Duplicate entry '1-1' for key 'PRIMARY'
update t1 set c2=c2+1 where c1 in (1,2);
Got one of the listed errors
delete from t1 where c1 in (1,2);
Got one of the listed errors
update t1 set c2=c2+1 where (pk1,pk2) in ((9,9),(10,10));
delete from t1 where (pk1,pk2) in ((9,9),(10,10));
update t1 set c2=c2+1 where c1 in (5);
select * from t1;
pk1	pk2	c1	c2
1	1	1	1
2	2	1	1
3	3	2	1
4	4	2	1
5	5	3	1
6	6	3	1
7	7	4	1
8	8	4	1
pk1	pk2	c1	c2
1	1	1	1
2	2	1	1
3	3	2	1
4	4	2	1
5	5	3	1
6	6	3	1
7	7	4	1
8	8	4	1
delete from t1 where c1 in(5);
select * from t1;
pk1	pk2	c1	c2
1	1	1	1
2	2	1	1
3	3	2	1
4	4	2	1
5	5	3	1
6	6	3	1
7	7	4	1
8	8	4	1
pk1	pk2	c1	c2
1	1	1	1
2	2	1	1
3	3	2	1
4	4	2	1
5	5	3	1
6	6	3	1
7	7	4	1
8	8	4	1
select * from t1;
pk1	pk2	c1	c2
1	1	1	2
2	2	1	2
3	3	2	2
4	4	2	2
5	5	3	2
6	6	3	2
7	7	4	2
8	8	4	2
9	9	5	1
10	10	5	1
pk1	pk2	c1	c2
1	1	1	2
2	2	1	2
3	3	2	2
4	4	2	2
5	5	3	2
6	6	3	2
7	7	4	2
8	8	4	2
9	9	5	1
10	10	5	1
commit;
select * from t1;
pk1	pk2	c1	c2
1	1	1	2
2	2	1	2
3	3	2	2
4	4	2	2
5	5	3	2
6	6	3	2
7	7	4	2
8	8	4	2
9	9	5	1
10	10	5	1
pk1	pk2	c1	c2
1	1	1	2
2	2	1	2
3	3	2	2
4	4	2	2
5	5	3	2
6	6	3	2
7	7	4	2
8	8	4	2
9	9	5	1
10	10	5	1
update t1 set c2=c2+1 where c1 in (5);
select * from t1;
pk1	pk2	c1	c2
1	1	1	2
2	2	1	2
3	3	2	2
4	4	2	2
5	5	3	2
6	6	3	2
7	7	4	2
8	8	4	2
9	9	5	2
10	10	5	2
pk1	pk2	c1	c2
1	1	1	2
2	2	1	2
3	3	2	2
4	4	2	2
5	5	3	2
6	6	3	2
7	7	4	2
8	8	4	2
9	9	5	2
10	10	5	2
commit;
select * from t1;
pk1	pk2	c1	c2
1	1	1	2
2	2	1	2
3	3	2	2
4	4	2	2
5	5	3	2
6	6	3	2
7	7	4	2
8	8	4	2
9	9	5	2
10	10	5	2
pk1	pk2	c1	c2
1	1	1	2
2	2	1	2
3	3	2	2
4	4	2	2
5	5	3	2
6	6	3	2
7	7	4	2
8	8	4	2
9	9	5	2
10	10	5	2
commit;
set autocommit=1;
set autocommit=1;
drop table t1;
set global ob_enable_index_direct_select =0;
