create table t1(pk1 int, pk2 int, c1 int, c2 int, primary key(pk1,pk2));
insert into t1(pk1,pk2,c1,c2) values(1,1,1,1);
insert into t1(pk1,pk2,c1,c2) values(2,2,1,1);
insert into t1(pk1,pk2,c1,c2) values(3,3,1,1);
insert into t1(pk1,pk2,c1,c2) values(4,4,1,1);
insert into t1(pk1,pk2,c1,c2) values(5,5,1,1);
insert into t1(pk1,pk2,c1,c2) values(6,6,1,1);
insert into t1(pk1,pk2,c1,c2) values(7,7,1,1);
insert into t1(pk1,pk2,c1,c2) values(8,8,1,1);
create index i1 on t1(c1,c2);
alter system major freeze tenant = sys;
alter system major freeze tenant = all_user;
alter system major freeze tenant = all_meta;
select * from t1;
pk1	pk2	c1	c2
1	1	1	1
2	2	1	1
3	3	1	1
4	4	1	1
5	5	1	1
6	6	1	1
7	7	1	1
8	8	1	1
pk1	pk2	c1	c2
1	1	1	1
2	2	1	1
3	3	1	1
4	4	1	1
5	5	1	1
6	6	1	1
7	7	1	1
8	8	1	1
set autocommit=0;
set autocommit=0;
update t1 set c1=c1+1, c2=c2+1 where (pk1,pk2)=(1,1) or (pk1,pk2)=(2,2) or (pk1,pk2)=(3,3) or (pk1,pk2)=(4,4);
select * from t1;
pk1	pk2	c1	c2
1	1	2	2
2	2	2	2
3	3	2	2
4	4	2	2
5	5	1	1
6	6	1	1
7	7	1	1
8	8	1	1
pk1	pk2	c1	c2
5	5	1	1
6	6	1	1
7	7	1	1
8	8	1	1
1	1	2	2
2	2	2	2
3	3	2	2
4	4	2	2
delete from t1 where (pk1,pk2)=(1,1) or (pk1,pk2)=(2,2);
select * from t1;
pk1	pk2	c1	c2
3	3	2	2
4	4	2	2
5	5	1	1
6	6	1	1
7	7	1	1
8	8	1	1
pk1	pk2	c1	c2
5	5	1	1
6	6	1	1
7	7	1	1
8	8	1	1
3	3	2	2
4	4	2	2
select * from t1;
pk1	pk2	c1	c2
1	1	1	1
2	2	1	1
3	3	1	1
4	4	1	1
5	5	1	1
6	6	1	1
7	7	1	1
8	8	1	1
pk1	pk2	c1	c2
1	1	1	1
2	2	1	1
3	3	1	1
4	4	1	1
5	5	1	1
6	6	1	1
7	7	1	1
8	8	1	1
delete from t1 where (pk1,pk2)=(1,1) or (pk1,pk2)=(2,2) or (pk1,pk2)=(3,3) or (pk1,pk2)=(4,4);
select * from t1;
pk1	pk2	c1	c2
5	5	1	1
6	6	1	1
7	7	1	1
8	8	1	1
pk1	pk2	c1	c2
5	5	1	1
6	6	1	1
7	7	1	1
8	8	1	1
update t1 set c1=c1+1, c2=c2+1 where 
(pk1,pk2)=(1,1) or (pk1,pk2)=(2,2) or (pk1,pk2)=(3,3) or (pk1,pk2)=(4,4) or
(pk1,pk2)=(5,5) or (pk1,pk2)=(6,6) or (pk1,pk2)=(7,7) or (pk1,pk2)=(8,8);
select * from t1;
pk1	pk2	c1	c2
5	5	2	2
6	6	2	2
7	7	2	2
8	8	2	2
pk1	pk2	c1	c2
5	5	2	2
6	6	2	2
7	7	2	2
8	8	2	2
commit;
select * from t1;
pk1	pk2	c1	c2
5	5	2	2
6	6	2	2
7	7	2	2
8	8	2	2
pk1	pk2	c1	c2
5	5	2	2
6	6	2	2
7	7	2	2
8	8	2	2
commit;
select * from t1;
pk1	pk2	c1	c2
5	5	2	2
6	6	2	2
7	7	2	2
8	8	2	2
pk1	pk2	c1	c2
5	5	2	2
6	6	2	2
7	7	2	2
8	8	2	2
commit;
select * from t1;
pk1	pk2	c1	c2
5	5	2	2
6	6	2	2
7	7	2	2
8	8	2	2
pk1	pk2	c1	c2
5	5	2	2
6	6	2	2
7	7	2	2
8	8	2	2
commit;
replace into t1(pk1,pk2,c1,c2) values (1,1,1,1),(2,2,1,1),(3,3,1,1),(4,4,1,1),(5,5,1,1),(6,6,1,1),(7,7,1,1),(8,8,1,1);
select * from t1;
pk1	pk2	c1	c2
1	1	1	1
2	2	1	1
3	3	1	1
4	4	1	1
5	5	1	1
6	6	1	1
7	7	1	1
8	8	1	1
pk1	pk2	c1	c2
1	1	1	1
2	2	1	1
3	3	1	1
4	4	1	1
5	5	1	1
6	6	1	1
7	7	1	1
8	8	1	1
update t1 set c1=c1+1, c2=c2+1 where (pk1,pk2)=(1,1) or (pk1,pk2)=(2,2) or (pk1,pk2)=(3,3) or (pk1,pk2)=(4,4);
select * from t1;
pk1	pk2	c1	c2
1	1	2	2
2	2	2	2
3	3	2	2
4	4	2	2
5	5	1	1
6	6	1	1
7	7	1	1
8	8	1	1
pk1	pk2	c1	c2
5	5	1	1
6	6	1	1
7	7	1	1
8	8	1	1
1	1	2	2
2	2	2	2
3	3	2	2
4	4	2	2
delete from t1 where (pk1,pk2)=(1,1) or (pk1,pk2)=(2,2);
select * from t1;
pk1	pk2	c1	c2
3	3	2	2
4	4	2	2
5	5	1	1
6	6	1	1
7	7	1	1
8	8	1	1
pk1	pk2	c1	c2
5	5	1	1
6	6	1	1
7	7	1	1
8	8	1	1
3	3	2	2
4	4	2	2
commit;
update t1 set c1=c1+1, c2=c2+1 where (pk1,pk2)=(1,1) or (pk1,pk2)=(2,2) or (pk1,pk2)=(3,3) or (pk1,pk2)=(4,4);
update t1 set c1=c1+1, c2=c2+1 where 
(pk1,pk2)=(1,1) or (pk1,pk2)=(2,2) or (pk1,pk2)=(3,3) or (pk1,pk2)=(4,4) or
(pk1,pk2)=(5,5) or (pk1,pk2)=(6,6) or (pk1,pk2)=(7,7) or (pk1,pk2)=(8,8);
select * from t1;
pk1	pk2	c1	c2
3	3	4	4
4	4	4	4
5	5	2	2
6	6	2	2
7	7	2	2
8	8	2	2
pk1	pk2	c1	c2
5	5	2	2
6	6	2	2
7	7	2	2
8	8	2	2
3	3	4	4
4	4	4	4
delete from t1 where (pk1,pk2)=(1,1) or (pk1,pk2)=(2,2);
commit;
select * from t1;
pk1	pk2	c1	c2
3	3	4	4
4	4	4	4
5	5	2	2
6	6	2	2
7	7	2	2
8	8	2	2
pk1	pk2	c1	c2
5	5	2	2
6	6	2	2
7	7	2	2
8	8	2	2
3	3	4	4
4	4	4	4
commit;
replace into t1(pk1,pk2,c1,c2) values (1,1,1,1),(2,2,1,1),(3,3,1,1),(4,4,1,1),(5,5,1,1),(6,6,1,1),(7,7,1,1),(8,8,1,1);
select * from t1;
pk1	pk2	c1	c2
1	1	1	1
2	2	1	1
3	3	1	1
4	4	1	1
5	5	1	1
6	6	1	1
7	7	1	1
8	8	1	1
pk1	pk2	c1	c2
1	1	1	1
2	2	1	1
3	3	1	1
4	4	1	1
5	5	1	1
6	6	1	1
7	7	1	1
8	8	1	1
update t1 set c1=c1+1, c2=c2+1 where (pk1,pk2)=(1,1) or (pk1,pk2)=(2,2) or (pk1,pk2)=(3,3) or (pk1,pk2)=(4,4);
delete from t1 where (pk1,pk2)=(5,5) or (pk1,pk2)=(6,6) or (pk1,pk2)=(7,7) or (pk1,pk2)=(8,8);
update t1 set c1=c1+1, c2=c2+1 where (pk1,pk2)=(9,9) or (pk1,pk2)=(10,10);
delete from t1 where (pk1,pk2)=(11,11) or (pk1,pk2)=(12,12);
select * from t1;
pk1	pk2	c1	c2
1	1	2	2
2	2	2	2
3	3	2	2
4	4	2	2
pk1	pk2	c1	c2
1	1	2	2
2	2	2	2
3	3	2	2
4	4	2	2
set ob_query_timeout=1000000;
update t1 set c1=c1+1, c2=c2+1 where (pk1,pk2)=(1,1) or (pk1,pk2)=(2,2) or (pk1,pk2)=(3,3) or (pk1,pk2)=(4,4);
Got one of the listed errors
update t1 set c1=c1+1, c2=c2+1 where (pk1,pk2)=(1,1);
Got one of the listed errors
update t1 set c1=c1+1, c2=c2+1 where (pk1,pk2)=(4,4);
Got one of the listed errors
update t1 set c1=c1+1, c2=c2+1 where (pk1,pk2)=(5,5) or (pk1,pk2)=(6,6);
Got one of the listed errors
delete from t1 where (pk1,pk2)=(1,1) or (pk1,pk2)=(2,2) or (pk1,pk2)=(3,3) or (pk1,pk2)=(4,4);
Got one of the listed errors
delete from t1 where (pk1,pk2)=(1,1);
Got one of the listed errors
delete from t1 where (pk1,pk2)=(4,4);
Got one of the listed errors
delete from t1 where (pk1,pk2)=(5,5) or (pk1,pk2)=(6,6);
Got one of the listed errors
replace into t1(pk1,pk2,c1,c2) values (1,1,1,1);
Got one of the listed errors
insert  into t1(pk1,pk2,c1,c2) values (1,1,1,1);
ERROR 23000: Duplicate entry '1-1' for key 'PRIMARY'
update t1 set c1=c1+1, c2=c2+1 where (pk1,pk2)=(9,9) or (pk1,pk2)=(10,10);
delete from t1 where (pk1,pk2)=(11,11) or (pk1,pk2)=(12,12);
replace into t1(pk1,pk2,c1,c2) values (9,9,1,1);
insert into t1(pk1,pk2,c1,c2) values (10,10,1,1);
replace into t1(pk1,pk2,c1,c2) values (11,11,1,1);
insert into t1(pk1,pk2,c1,c2) values (12,12,1,1);
select * from t1;
pk1	pk2	c1	c2
1	1	1	1
2	2	1	1
3	3	1	1
4	4	1	1
5	5	1	1
6	6	1	1
7	7	1	1
8	8	1	1
9	9	1	1
10	10	1	1
11	11	1	1
12	12	1	1
pk1	pk2	c1	c2
1	1	1	1
2	2	1	1
3	3	1	1
4	4	1	1
5	5	1	1
6	6	1	1
7	7	1	1
8	8	1	1
9	9	1	1
10	10	1	1
11	11	1	1
12	12	1	1
select * from t1;
pk1	pk2	c1	c2
1	1	2	2
2	2	2	2
3	3	2	2
4	4	2	2
pk1	pk2	c1	c2
1	1	2	2
2	2	2	2
3	3	2	2
4	4	2	2
update t1 set c1=c1+1, c2=c2+1 where (pk1,pk2)=(9,9) or (pk1,pk2)=(10,10);
delete from t1 where (pk1,pk2)=(11,11) or (pk1,pk2)=(12,12);
select * from t1;
pk1	pk2	c1	c2
1	1	2	2
2	2	2	2
3	3	2	2
4	4	2	2
pk1	pk2	c1	c2
1	1	2	2
2	2	2	2
3	3	2	2
4	4	2	2
commit;
select * from t1;
pk1	pk2	c1	c2
1	1	2	2
2	2	2	2
3	3	2	2
4	4	2	2
9	9	1	1
10	10	1	1
11	11	1	1
12	12	1	1
pk1	pk2	c1	c2
9	9	1	1
10	10	1	1
11	11	1	1
12	12	1	1
1	1	2	2
2	2	2	2
3	3	2	2
4	4	2	2
update t1 set c1=c1+1, c2=c2+1 where (pk1,pk2)=(9,9) or (pk1,pk2)=(10,10) or (pk1,pk2)=(11,11) or (pk1,pk2)=(12,12);
select * from t1;
pk1	pk2	c1	c2
1	1	2	2
2	2	2	2
3	3	2	2
4	4	2	2
9	9	2	2
10	10	2	2
11	11	2	2
12	12	2	2
pk1	pk2	c1	c2
1	1	2	2
2	2	2	2
3	3	2	2
4	4	2	2
9	9	2	2
10	10	2	2
11	11	2	2
12	12	2	2
commit;
select * from t1;
pk1	pk2	c1	c2
1	1	2	2
2	2	2	2
3	3	2	2
4	4	2	2
9	9	2	2
10	10	2	2
11	11	2	2
12	12	2	2
pk1	pk2	c1	c2
1	1	2	2
2	2	2	2
3	3	2	2
4	4	2	2
9	9	2	2
10	10	2	2
11	11	2	2
12	12	2	2
commit;
set autocommit=1;
set autocommit=1;
drop table t1;
set global ob_enable_index_direct_select =0;
