create table t1(pk1 int, pk2 int, a int, b int, c int, primary key(pk1, pk2));
insert into t1 values(1,1,1,1,1),(1,2,1,1,1);
insert into t1 values(1,3,2,1,1),(1,4,2,1,1);
insert into t1 values(2,5,3,1,1),(2,6,3,1,1);
insert into t1 values(2,7,4,1,1),(2,8,4,1,1);
create index i1 on t1(a) storing(c);
create index i2 on t1(b);
create index i3 on t1(c);
create index i4 on t1(a,b);
CASE:
update t1 set a=a+1,b=b+1,c=c+1 where pk1 = 1;
select * from t1;
pk1	pk2	a	b	c
1	1	2	2	2
1	2	2	2	2
1	3	3	2	2
1	4	3	2	2
2	5	3	1	1
2	6	3	1	1
2	7	4	1	1
2	8	4	1	1
pk1	pk2	a	c
1	1	2	2
1	2	2	2
1	3	3	2
1	4	3	2
2	5	3	1
2	6	3	1
2	7	4	1
2	8	4	1
pk1	pk2	b
2	5	1
2	6	1
2	7	1
2	8	1
1	1	2
1	2	2
1	3	2
1	4	2
pk1	pk2	c
2	5	1
2	6	1
2	7	1
2	8	1
1	1	2
1	2	2
1	3	2
1	4	2
pk1	pk2	a	b
1	1	2	2
1	2	2	2
2	5	3	1
2	6	3	1
1	3	3	2
1	4	3	2
2	7	4	1
2	8	4	1
update t1 set a=a+1,b=b+1,c=c+1 where pk1 > 1;
update t1 set a=a+1,b=b+1,c=c+1 where pk1 >= 1;
update t1 set a=a+1,b=b+1,c=c+1 where pk1 < 1;
update t1 set a=a+1,b=b+1,c=c+1 where pk1 <= 1;
select * from t1;
pk1	pk2	a	b	c
1	1	4	4	4
1	2	4	4	4
1	3	5	4	4
1	4	5	4	4
2	5	5	3	3
2	6	5	3	3
2	7	6	3	3
2	8	6	3	3
pk1	pk2	a	c
1	1	4	4
1	2	4	4
1	3	5	4
1	4	5	4
2	5	5	3
2	6	5	3
2	7	6	3
2	8	6	3
pk1	pk2	b
2	5	3
2	6	3
2	7	3
2	8	3
1	1	4
1	2	4
1	3	4
1	4	4
pk1	pk2	c
2	5	3
2	6	3
2	7	3
2	8	3
1	1	4
1	2	4
1	3	4
1	4	4
pk1	pk2	a	b
1	1	4	4
1	2	4	4
2	5	5	3
2	6	5	3
1	3	5	4
1	4	5	4
2	7	6	3
2	8	6	3
replace into t1 values(1,1,1,1,1),(1,2,1,1,1),(1,3,2,1,1),(1,4,2,1,1),(2,5,3,1,1),(2,6,3,1,1),(2,7,4,1,1),(2,8,4,1,1);
delete from t1 where pk1 = 1;
select * from t1;
pk1	pk2	a	b	c
2	5	3	1	1
2	6	3	1	1
2	7	4	1	1
2	8	4	1	1
pk1	pk2	a	c
2	5	3	1
2	6	3	1
2	7	4	1
2	8	4	1
pk1	pk2	b
2	5	1
2	6	1
2	7	1
2	8	1
pk1	pk2	c
2	5	1
2	6	1
2	7	1
2	8	1
pk1	pk2	a	b
2	5	3	1
2	6	3	1
2	7	4	1
2	8	4	1
replace into t1 values(1,1,1,1,1),(1,2,1,1,1),(1,3,2,1,1),(1,4,2,1,1),(2,5,3,1,1),(2,6,3,1,1),(2,7,4,1,1),(2,8,4,1,1);
delete from t1 where pk1 > 1;
select * from t1;
pk1	pk2	a	b	c
1	1	1	1	1
1	2	1	1	1
1	3	2	1	1
1	4	2	1	1
pk1	pk2	a	c
1	1	1	1
1	2	1	1
1	3	2	1
1	4	2	1
pk1	pk2	b
1	1	1
1	2	1
1	3	1
1	4	1
pk1	pk2	c
1	1	1
1	2	1
1	3	1
1	4	1
pk1	pk2	a	b
1	1	1	1
1	2	1	1
1	3	2	1
1	4	2	1
replace into t1 values(1,1,1,1,1),(1,2,1,1,1),(1,3,2,1,1),(1,4,2,1,1),(2,5,3,1,1),(2,6,3,1,1),(2,7,4,1,1),(2,8,4,1,1);
delete from t1 where pk1 >= 1;
select * from t1;
pk1	pk2	a	b	c
pk1	pk2	a	c
pk1	pk2	b
pk1	pk2	c
pk1	pk2	a	b
replace into t1 values(1,1,1,1,1),(1,2,1,1,1),(1,3,2,1,1),(1,4,2,1,1),(2,5,3,1,1),(2,6,3,1,1),(2,7,4,1,1),(2,8,4,1,1);
delete from t1 where pk1 < 1;
select * from t1;
pk1	pk2	a	b	c
1	1	1	1	1
1	2	1	1	1
1	3	2	1	1
1	4	2	1	1
2	5	3	1	1
2	6	3	1	1
2	7	4	1	1
2	8	4	1	1
pk1	pk2	a	c
1	1	1	1
1	2	1	1
1	3	2	1
1	4	2	1
2	5	3	1
2	6	3	1
2	7	4	1
2	8	4	1
pk1	pk2	b
1	1	1
1	2	1
1	3	1
1	4	1
2	5	1
2	6	1
2	7	1
2	8	1
pk1	pk2	c
1	1	1
1	2	1
1	3	1
1	4	1
2	5	1
2	6	1
2	7	1
2	8	1
pk1	pk2	a	b
1	1	1	1
1	2	1	1
1	3	2	1
1	4	2	1
2	5	3	1
2	6	3	1
2	7	4	1
2	8	4	1
replace into t1 values(1,1,1,1,1),(1,2,1,1,1),(1,3,2,1,1),(1,4,2,1,1),(2,5,3,1,1),(2,6,3,1,1),(2,7,4,1,1),(2,8,4,1,1);
delete from t1 where pk1 <= 1;
select * from t1;
pk1	pk2	a	b	c
2	5	3	1	1
2	6	3	1	1
2	7	4	1	1
2	8	4	1	1
pk1	pk2	a	c
2	5	3	1
2	6	3	1
2	7	4	1
2	8	4	1
pk1	pk2	b
2	5	1
2	6	1
2	7	1
2	8	1
pk1	pk2	c
2	5	1
2	6	1
2	7	1
2	8	1
pk1	pk2	a	b
2	5	3	1
2	6	3	1
2	7	4	1
2	8	4	1
CASE:
delete from t1;
replace into t1 values(1,1,1,1,1),(1,2,1,1,1),(1,3,2,1,1),(1,4,2,1,1),(2,5,3,1,1),(2,6,3,1,1),(2,7,4,1,1),(2,8,4,1,1);
update t1 set c=c+1 where a=1;
select * from t1;
pk1	pk2	a	b	c
1	1	1	1	2
1	2	1	1	2
1	3	2	1	1
1	4	2	1	1
2	5	3	1	1
2	6	3	1	1
2	7	4	1	1
2	8	4	1	1
pk1	pk2	a	c
1	1	1	2
1	2	1	2
1	3	2	1
1	4	2	1
2	5	3	1
2	6	3	1
2	7	4	1
2	8	4	1
pk1	pk2	b
1	1	1
1	2	1
1	3	1
1	4	1
2	5	1
2	6	1
2	7	1
2	8	1
pk1	pk2	c
1	3	1
1	4	1
2	5	1
2	6	1
2	7	1
2	8	1
1	1	2
1	2	2
pk1	pk2	a	b
1	1	1	1
1	2	1	1
1	3	2	1
1	4	2	1
2	5	3	1
2	6	3	1
2	7	4	1
2	8	4	1
update t1 set c=c+1 where a>1 and a<4;
update t1 set c=c+1 where a>=1 and a<=4;
select * from t1;
pk1	pk2	a	b	c
1	1	1	1	3
1	2	1	1	3
1	3	2	1	3
1	4	2	1	3
2	5	3	1	3
2	6	3	1	3
2	7	4	1	2
2	8	4	1	2
pk1	pk2	a	c
1	1	1	3
1	2	1	3
1	3	2	3
1	4	2	3
2	5	3	3
2	6	3	3
2	7	4	2
2	8	4	2
pk1	pk2	b
1	1	1
1	2	1
1	3	1
1	4	1
2	5	1
2	6	1
2	7	1
2	8	1
pk1	pk2	c
2	7	2
2	8	2
1	1	3
1	2	3
1	3	3
1	4	3
2	5	3
2	6	3
pk1	pk2	a	b
1	1	1	1
1	2	1	1
1	3	2	1
1	4	2	1
2	5	3	1
2	6	3	1
2	7	4	1
2	8	4	1
update t1 set c=c+1 where b=1;
select * from t1;
pk1	pk2	a	b	c
1	1	1	1	4
1	2	1	1	4
1	3	2	1	4
1	4	2	1	4
2	5	3	1	4
2	6	3	1	4
2	7	4	1	3
2	8	4	1	3
pk1	pk2	a	c
1	1	1	4
1	2	1	4
1	3	2	4
1	4	2	4
2	5	3	4
2	6	3	4
2	7	4	3
2	8	4	3
pk1	pk2	b
1	1	1
1	2	1
1	3	1
1	4	1
2	5	1
2	6	1
2	7	1
2	8	1
pk1	pk2	c
2	7	3
2	8	3
1	1	4
1	2	4
1	3	4
1	4	4
2	5	4
2	6	4
pk1	pk2	a	b
1	1	1	1
1	2	1	1
1	3	2	1
1	4	2	1
2	5	3	1
2	6	3	1
2	7	4	1
2	8	4	1
replace into t1 values(1,1,1,1,1),(1,2,1,1,1),(1,3,2,1,1),(1,4,2,1,1),(2,5,3,1,1),(2,6,3,1,1),(2,7,4,1,1),(2,8,4,1,1);
delete from t1 where a=1;
select * from t1;
pk1	pk2	a	b	c
1	3	2	1	1
1	4	2	1	1
2	5	3	1	1
2	6	3	1	1
2	7	4	1	1
2	8	4	1	1
pk1	pk2	a	c
1	3	2	1
1	4	2	1
2	5	3	1
2	6	3	1
2	7	4	1
2	8	4	1
pk1	pk2	b
1	3	1
1	4	1
2	5	1
2	6	1
2	7	1
2	8	1
pk1	pk2	c
1	3	1
1	4	1
2	5	1
2	6	1
2	7	1
2	8	1
pk1	pk2	a	b
1	3	2	1
1	4	2	1
2	5	3	1
2	6	3	1
2	7	4	1
2	8	4	1
replace into t1 values(1,1,1,1,1),(1,2,1,1,1),(1,3,2,1,1),(1,4,2,1,1),(2,5,3,1,1),(2,6,3,1,1),(2,7,4,1,1),(2,8,4,1,1);
delete from t1 where a>1 and a<4;
select * from t1;
pk1	pk2	a	b	c
1	1	1	1	1
1	2	1	1	1
2	7	4	1	1
2	8	4	1	1
pk1	pk2	a	c
1	1	1	1
1	2	1	1
2	7	4	1
2	8	4	1
pk1	pk2	b
1	1	1
1	2	1
2	7	1
2	8	1
pk1	pk2	c
1	1	1
1	2	1
2	7	1
2	8	1
pk1	pk2	a	b
1	1	1	1
1	2	1	1
2	7	4	1
2	8	4	1
replace into t1 values(1,1,1,1,1),(1,2,1,1,1),(1,3,2,1,1),(1,4,2,1,1),(2,5,3,1,1),(2,6,3,1,1),(2,7,4,1,1),(2,8,4,1,1);
delete from t1 where a>=1 and a<=4;
select * from t1;
pk1	pk2	a	b	c
pk1	pk2	a	c
pk1	pk2	b
pk1	pk2	c
pk1	pk2	a	b
replace into t1 values(1,1,1,1,1),(1,2,1,1,1),(1,3,2,1,1),(1,4,2,1,1),(2,5,3,1,1),(2,6,3,1,1),(2,7,4,1,1),(2,8,4,1,1);
delete from t1 where b=1;
select * from t1;
pk1	pk2	a	b	c
pk1	pk2	a	c
pk1	pk2	b
pk1	pk2	c
pk1	pk2	a	b
drop table t1;
