create table t1(c1 int primary key default 1 not null,
c2 varchar(20) default 'aaa',
c3 int default 1 not null,
c4 timestamp default '2013-12-02 11:56:00.0');
create index i1 on t1(c2) storing(c3,c4);
insert into t1(c1) values(1);
replace into t1(c1) values(2);
set @@session.ob_enable_index_direct_select = 1;
alter system major freeze tenant = sys;
alter system major freeze tenant = all_user;
alter system major freeze tenant = all_meta;
select * from t1;
c1	c2	c3	c4
1	aaa	1	2013-12-02 11:56:00
2	aaa	1	2013-12-02 11:56:00
alter table t1 alter c2 set default 'aa';
insert into t1(c1) values(3);
replace into t1(c1) values(4);
select * from t1;
c1	c2	c3	c4
1	aaa	1	2013-12-02 11:56:00
2	aaa	1	2013-12-02 11:56:00
3	aa	1	2013-12-02 11:56:00
4	aa	1	2013-12-02 11:56:00
c1	c2	c3	c4
3	aa	1	2013-12-02 11:56:00
4	aa	1	2013-12-02 11:56:00
1	aaa	1	2013-12-02 11:56:00
2	aaa	1	2013-12-02 11:56:00
alter table t1 add c5 timestamp default '2013-12-02' not null;
insert into t1(c1) values(5);
replace into t1(c1) values(6);
select * from t1;
c1	c2	c3	c4	c5
1	aaa	1	2013-12-02 11:56:00	2013-12-02 00:00:00
2	aaa	1	2013-12-02 11:56:00	2013-12-02 00:00:00
3	aa	1	2013-12-02 11:56:00	2013-12-02 00:00:00
4	aa	1	2013-12-02 11:56:00	2013-12-02 00:00:00
5	aa	1	2013-12-02 11:56:00	2013-12-02 00:00:00
6	aa	1	2013-12-02 11:56:00	2013-12-02 00:00:00
c1	c2	c3	c4
3	aa	1	2013-12-02 11:56:00
4	aa	1	2013-12-02 11:56:00
5	aa	1	2013-12-02 11:56:00
6	aa	1	2013-12-02 11:56:00
1	aaa	1	2013-12-02 11:56:00
2	aaa	1	2013-12-02 11:56:00
alter system major freeze tenant = sys;
alter system major freeze tenant = all_user;
alter system major freeze tenant = all_meta;
insert into t1(c1) values(7);
replace into t1(c1) values(8);
select * from t1;
c1	c2	c3	c4	c5
1	aaa	1	2013-12-02 11:56:00	2013-12-02 00:00:00
2	aaa	1	2013-12-02 11:56:00	2013-12-02 00:00:00
3	aa	1	2013-12-02 11:56:00	2013-12-02 00:00:00
4	aa	1	2013-12-02 11:56:00	2013-12-02 00:00:00
5	aa	1	2013-12-02 11:56:00	2013-12-02 00:00:00
6	aa	1	2013-12-02 11:56:00	2013-12-02 00:00:00
7	aa	1	2013-12-02 11:56:00	2013-12-02 00:00:00
8	aa	1	2013-12-02 11:56:00	2013-12-02 00:00:00
c1	c2	c3	c4
3	aa	1	2013-12-02 11:56:00
4	aa	1	2013-12-02 11:56:00
5	aa	1	2013-12-02 11:56:00
6	aa	1	2013-12-02 11:56:00
7	aa	1	2013-12-02 11:56:00
8	aa	1	2013-12-02 11:56:00
1	aaa	1	2013-12-02 11:56:00
2	aaa	1	2013-12-02 11:56:00
alter table t1 alter c3 set default 2;
insert into t1(c1) values(9);
replace into t1(c1) values(10);
select * from t1;
c1	c2	c3	c4	c5
1	aaa	1	2013-12-02 11:56:00	2013-12-02 00:00:00
2	aaa	1	2013-12-02 11:56:00	2013-12-02 00:00:00
3	aa	1	2013-12-02 11:56:00	2013-12-02 00:00:00
4	aa	1	2013-12-02 11:56:00	2013-12-02 00:00:00
5	aa	1	2013-12-02 11:56:00	2013-12-02 00:00:00
6	aa	1	2013-12-02 11:56:00	2013-12-02 00:00:00
7	aa	1	2013-12-02 11:56:00	2013-12-02 00:00:00
8	aa	1	2013-12-02 11:56:00	2013-12-02 00:00:00
9	aa	2	2013-12-02 11:56:00	2013-12-02 00:00:00
10	aa	2	2013-12-02 11:56:00	2013-12-02 00:00:00
c1	c2	c3	c4
3	aa	1	2013-12-02 11:56:00
4	aa	1	2013-12-02 11:56:00
5	aa	1	2013-12-02 11:56:00
6	aa	1	2013-12-02 11:56:00
7	aa	1	2013-12-02 11:56:00
8	aa	1	2013-12-02 11:56:00
9	aa	2	2013-12-02 11:56:00
10	aa	2	2013-12-02 11:56:00
1	aaa	1	2013-12-02 11:56:00
2	aaa	1	2013-12-02 11:56:00
alter system major freeze tenant = sys;
alter system major freeze tenant = all_user;
alter system major freeze tenant = all_meta;
insert into t1(c1) values(11);
replace into t1(c1) values(12);
select * from t1;
c1	c2	c3	c4	c5
1	aaa	1	2013-12-02 11:56:00	2013-12-02 00:00:00
2	aaa	1	2013-12-02 11:56:00	2013-12-02 00:00:00
3	aa	1	2013-12-02 11:56:00	2013-12-02 00:00:00
4	aa	1	2013-12-02 11:56:00	2013-12-02 00:00:00
5	aa	1	2013-12-02 11:56:00	2013-12-02 00:00:00
6	aa	1	2013-12-02 11:56:00	2013-12-02 00:00:00
7	aa	1	2013-12-02 11:56:00	2013-12-02 00:00:00
8	aa	1	2013-12-02 11:56:00	2013-12-02 00:00:00
9	aa	2	2013-12-02 11:56:00	2013-12-02 00:00:00
10	aa	2	2013-12-02 11:56:00	2013-12-02 00:00:00
11	aa	2	2013-12-02 11:56:00	2013-12-02 00:00:00
12	aa	2	2013-12-02 11:56:00	2013-12-02 00:00:00
c1	c2	c3	c4
3	aa	1	2013-12-02 11:56:00
4	aa	1	2013-12-02 11:56:00
5	aa	1	2013-12-02 11:56:00
6	aa	1	2013-12-02 11:56:00
7	aa	1	2013-12-02 11:56:00
8	aa	1	2013-12-02 11:56:00
9	aa	2	2013-12-02 11:56:00
10	aa	2	2013-12-02 11:56:00
11	aa	2	2013-12-02 11:56:00
12	aa	2	2013-12-02 11:56:00
1	aaa	1	2013-12-02 11:56:00
2	aaa	1	2013-12-02 11:56:00
update t1 set c3=NULL where c1=11;
ERROR 23000: Column cannot be null
update t1 set c3=null where c1=12;
ERROR 23000: Column cannot be null
update t1 set c3=null where c1=13;
ERROR 23000: Column cannot be null
alter table t1 alter c3 drop default;
replace into t1(c1,c2,c3) values(11,'a',1);
replace into t1(c1,c2,c3) values(12,'a',1);
insert into t1(c1,c2) values(13,'a');
ERROR HY000: Field 'c3' doesn't have a default value
replace into t1(c1,c2) values(14,'a');
ERROR HY000: Field 'c3' doesn't have a default value
update t1 set c3=NULL where c1=11;
ERROR 23000: Column cannot be null
update t1 set c3=null where c1=12;
ERROR 23000: Column cannot be null
select * from t1;
c1	c2	c3	c4	c5
1	aaa	1	2013-12-02 11:56:00	2013-12-02 00:00:00
2	aaa	1	2013-12-02 11:56:00	2013-12-02 00:00:00
3	aa	1	2013-12-02 11:56:00	2013-12-02 00:00:00
4	aa	1	2013-12-02 11:56:00	2013-12-02 00:00:00
5	aa	1	2013-12-02 11:56:00	2013-12-02 00:00:00
6	aa	1	2013-12-02 11:56:00	2013-12-02 00:00:00
7	aa	1	2013-12-02 11:56:00	2013-12-02 00:00:00
8	aa	1	2013-12-02 11:56:00	2013-12-02 00:00:00
9	aa	2	2013-12-02 11:56:00	2013-12-02 00:00:00
10	aa	2	2013-12-02 11:56:00	2013-12-02 00:00:00
11	a	1	2013-12-02 11:56:00	2013-12-02 00:00:00
12	a	1	2013-12-02 11:56:00	2013-12-02 00:00:00
c1	c2	c3	c4
11	a	1	2013-12-02 11:56:00
12	a	1	2013-12-02 11:56:00
3	aa	1	2013-12-02 11:56:00
4	aa	1	2013-12-02 11:56:00
5	aa	1	2013-12-02 11:56:00
6	aa	1	2013-12-02 11:56:00
7	aa	1	2013-12-02 11:56:00
8	aa	1	2013-12-02 11:56:00
9	aa	2	2013-12-02 11:56:00
10	aa	2	2013-12-02 11:56:00
1	aaa	1	2013-12-02 11:56:00
2	aaa	1	2013-12-02 11:56:00
alter system major freeze tenant = sys;
alter system major freeze tenant = all_user;
alter system major freeze tenant = all_meta;
insert into t1(c1,c3) values(13,1);
replace into t1(c1,c3) values(14,1);
select * from t1;
c1	c2	c3	c4	c5
1	aaa	1	2013-12-02 11:56:00	2013-12-02 00:00:00
2	aaa	1	2013-12-02 11:56:00	2013-12-02 00:00:00
3	aa	1	2013-12-02 11:56:00	2013-12-02 00:00:00
4	aa	1	2013-12-02 11:56:00	2013-12-02 00:00:00
5	aa	1	2013-12-02 11:56:00	2013-12-02 00:00:00
6	aa	1	2013-12-02 11:56:00	2013-12-02 00:00:00
7	aa	1	2013-12-02 11:56:00	2013-12-02 00:00:00
8	aa	1	2013-12-02 11:56:00	2013-12-02 00:00:00
9	aa	2	2013-12-02 11:56:00	2013-12-02 00:00:00
10	aa	2	2013-12-02 11:56:00	2013-12-02 00:00:00
11	a	1	2013-12-02 11:56:00	2013-12-02 00:00:00
12	a	1	2013-12-02 11:56:00	2013-12-02 00:00:00
13	aa	1	2013-12-02 11:56:00	2013-12-02 00:00:00
14	aa	1	2013-12-02 11:56:00	2013-12-02 00:00:00
c1	c2	c3	c4
11	a	1	2013-12-02 11:56:00
12	a	1	2013-12-02 11:56:00
3	aa	1	2013-12-02 11:56:00
4	aa	1	2013-12-02 11:56:00
5	aa	1	2013-12-02 11:56:00
6	aa	1	2013-12-02 11:56:00
7	aa	1	2013-12-02 11:56:00
8	aa	1	2013-12-02 11:56:00
9	aa	2	2013-12-02 11:56:00
10	aa	2	2013-12-02 11:56:00
13	aa	1	2013-12-02 11:56:00
14	aa	1	2013-12-02 11:56:00
1	aaa	1	2013-12-02 11:56:00
2	aaa	1	2013-12-02 11:56:00
alter table t1 modify column c3 int;
insert into t1(c1) values(15);
replace into t1(c1) values(16);
select * from t1;
c1	c2	c3	c4	c5
1	aaa	1	2013-12-02 11:56:00	2013-12-02 00:00:00
2	aaa	1	2013-12-02 11:56:00	2013-12-02 00:00:00
3	aa	1	2013-12-02 11:56:00	2013-12-02 00:00:00
4	aa	1	2013-12-02 11:56:00	2013-12-02 00:00:00
5	aa	1	2013-12-02 11:56:00	2013-12-02 00:00:00
6	aa	1	2013-12-02 11:56:00	2013-12-02 00:00:00
7	aa	1	2013-12-02 11:56:00	2013-12-02 00:00:00
8	aa	1	2013-12-02 11:56:00	2013-12-02 00:00:00
9	aa	2	2013-12-02 11:56:00	2013-12-02 00:00:00
10	aa	2	2013-12-02 11:56:00	2013-12-02 00:00:00
11	a	1	2013-12-02 11:56:00	2013-12-02 00:00:00
12	a	1	2013-12-02 11:56:00	2013-12-02 00:00:00
13	aa	1	2013-12-02 11:56:00	2013-12-02 00:00:00
14	aa	1	2013-12-02 11:56:00	2013-12-02 00:00:00
15	aa	NULL	2013-12-02 11:56:00	2013-12-02 00:00:00
16	aa	NULL	2013-12-02 11:56:00	2013-12-02 00:00:00
c1	c2	c3	c4
11	a	1	2013-12-02 11:56:00
12	a	1	2013-12-02 11:56:00
3	aa	1	2013-12-02 11:56:00
4	aa	1	2013-12-02 11:56:00
5	aa	1	2013-12-02 11:56:00
6	aa	1	2013-12-02 11:56:00
7	aa	1	2013-12-02 11:56:00
8	aa	1	2013-12-02 11:56:00
9	aa	2	2013-12-02 11:56:00
10	aa	2	2013-12-02 11:56:00
13	aa	1	2013-12-02 11:56:00
14	aa	1	2013-12-02 11:56:00
15	aa	NULL	2013-12-02 11:56:00
16	aa	NULL	2013-12-02 11:56:00
1	aaa	1	2013-12-02 11:56:00
2	aaa	1	2013-12-02 11:56:00
drop table if exists t1;
