create table t1(pk int primary key, a int, b int, c int, d int, e int);
create index i1 on t1(b,c) storing(d,e);
insert into t1 values(1,1,1,1,1,1),(2,1,1,1,1,1),(3,1,1,1,1,1),(4,1,1,1,1,1);
set autocommit=0;
select pk, b from t1 where b between 0 and 1000;
pk	b
1	1
2	1
3	1
4	1
select pk, a, b from t1 where pk>0 and pk<10;
pk	a	b
1	1	1
2	1	1
3	1	1
4	1	1
select * from t1 where b>0 and b<1000;
pk	a	b	c	d	e
1	1	1	1	1	1
2	1	1	1	1	1
3	1	1	1	1	1
4	1	1	1	1	1
set autocommit=0;
update t1 set a=pk+10, b=pk+10, c=pk+10, d=pk+10, e=pk+10 where pk=2;
update t1 set a=pk+10, b=pk+10, c=pk+10, d=pk+10, e=pk+10 where pk=3;
delete from t1 where pk=4;
insert into t1 values(5,1,1,1,1,1);
replace into t1 values(6,1,1,1,1,1);
replace into t1 values(7,1,1,1,1,1);
commit;
select pk, b from t1 where b between 0 and 1000;
pk	b
1	1
5	1
6	1
7	1
2	12
3	13
select pk, a, b from t1 where pk>0 and pk<10;
pk	a	b
1	1	1
2	12	12
3	13	13
5	1	1
6	1	1
7	1	1
select * from t1 where b>0 and b<1000;
pk	a	b	c	d	e
1	1	1	1	1	1
2	12	12	12	12	12
3	13	13	13	13	13
5	1	1	1	1	1
6	1	1	1	1	1
7	1	1	1	1	1
update t1 set a=pk+100, b=pk+100, c=pk+100, d=pk+100, e=pk+100 where pk=3;
update t1 set a=pk+100, b=pk+100, c=pk+100, d=pk+100, e=pk+100 where pk=4;
update t1 set a=pk+100, b=pk+100, c=pk+100, d=pk+100, e=pk+100 where pk=5;
update t1 set a=pk+100, b=pk+100, c=pk+100, d=pk+100, e=pk+100 where pk=6;
select pk, b from t1 where b between 0 and 1000;
pk	b
1	1
7	1
2	12
3	103
5	105
6	106
select pk, a, b from t1 where pk>0 and pk<10;
pk	a	b
1	1	1
2	12	12
3	103	103
5	105	105
6	106	106
7	1	1
select * from t1 where b>0 and b<1000;
pk	a	b	c	d	e
1	1	1	1	1	1
2	12	12	12	12	12
3	103	103	103	103	103
5	105	105	105	105	105
6	106	106	106	106	106
7	1	1	1	1	1
commit;
select pk, b from t1 where b between 0 and 1000;
pk	b
1	1
7	1
2	12
3	103
5	105
6	106
select pk, a, b from t1 where pk>0 and pk<10;
pk	a	b
1	1	1
2	12	12
3	103	103
5	105	105
6	106	106
7	1	1
select * from t1 where b>0 and b<1000;
pk	a	b	c	d	e
1	1	1	1	1	1
2	12	12	12	12	12
3	103	103	103	103	103
5	105	105	105	105	105
6	106	106	106	106	106
7	1	1	1	1	1
commit;
select pk, b from t1 where b between 0 and 1000;
pk	b
1	1
7	1
2	12
3	103
5	105
6	106
select pk, a, b from t1 where pk>0 and pk<10;
pk	a	b
1	1	1
2	12	12
3	103	103
5	105	105
6	106	106
7	1	1
select * from t1 where b>0 and b<1000;
pk	a	b	c	d	e
1	1	1	1	1	1
2	12	12	12	12	12
3	103	103	103	103	103
5	105	105	105	105	105
6	106	106	106	106	106
7	1	1	1	1	1
commit;
select pk, b from t1 where b between 0 and 1000;
pk	b
1	1
7	1
2	12
3	103
5	105
6	106
select pk, a, b from t1 where pk>0 and pk<10;
pk	a	b
1	1	1
2	12	12
3	103	103
5	105	105
6	106	106
7	1	1
select * from t1 where b>0 and b<1000;
pk	a	b	c	d	e
1	1	1	1	1	1
2	12	12	12	12	12
3	103	103	103	103	103
5	105	105	105	105	105
6	106	106	106	106	106
7	1	1	1	1	1
commit;
drop table t1;
