drop table if exists t1,t2,t3;
CREATE TABLE t1 (
ID CHAR(32) NOT NULL,
name CHAR(32) NOT NULL,
value CHAR(255),
INDEX indexIDname (ID,name)
) ;
INSERT INTO t1 VALUES
('keyword','indexdir','/export/home/local/www/database/indexes/keyword');
INSERT INTO t1 VALUES ('keyword','urlprefix','text/ /text');
INSERT INTO t1 VALUES ('keyword','urlmap','/text/ /');
INSERT INTO t1 VALUES ('keyword','attr','personal employee company');
INSERT INTO t1 VALUES
('emailgids','indexdir','/export/home/local/www/database/indexes/emailgids');
INSERT INTO t1 VALUES ('emailgids','urlprefix','text/ /text');
INSERT INTO t1 VALUES ('emailgids','urlmap','/text/ /');
INSERT INTO t1 VALUES ('emailgids','attr','personal employee company');
SELECT value FROM t1 WHERE ID='emailgids' AND name='attr';
value
personal employee company
drop table t1;
CREATE TABLE t1 (
price int(5) DEFAULT '0' NOT NULL,
area varchar(40) DEFAULT '' NOT NULL,
type varchar(40) DEFAULT '' NOT NULL,
transityes char(1) DEFAULT 'Y' NOT NULL,
shopsyes char(1) DEFAULT 'Y' NOT NULL,
schoolsyes char(1) DEFAULT 'Y' NOT NULL,
petsyes char(1) DEFAULT 'Y' NOT NULL,
KEY price (price,area,type,transityes,shopsyes,schoolsyes,petsyes)
);
INSERT INTO t1 VALUES (900,'Vancouver','Shared/Roomate','N','N','N','N');
INSERT INTO t1 VALUES (900,'Vancouver','Shared/Roomate','N','N','N','N');
INSERT INTO t1 VALUES (900,'Vancouver','Shared/Roomate','','','','');
INSERT INTO t1 VALUES (900,'Vancouver','Shared/Roomate','Y','Y','Y','Y');
INSERT INTO t1 VALUES (900,'Vancouver','Shared/Roomate','Y','Y','Y','Y');
INSERT INTO t1 VALUES (900,'Vancouver','Shared/Roomate','Y','Y','Y','Y');
INSERT INTO t1 VALUES (900,'Vancouver','Shared/Roomate','Y','Y','Y','Y');
INSERT INTO t1 VALUES (900,'Vancouver','Shared/Roomate','Y','Y','Y','Y');
SELECT * FROM t1 WHERE area='Vancouver' and transityes='y' and schoolsyes='y' and ( ((type='1 Bedroom' or type='Studio/Bach') and (price<=500)) or ((type='2 Bedroom') and (price<=550)) or ((type='Shared/Roomate') and (price<=300)) or ((type='Room and Board') and (price<=500)) ) and price <= 400;
price	area	type	transityes	shopsyes	schoolsyes	petsyes
drop table t1;
CREATE TABLE t1 (program varchar(30) not null,  type varchar(30),  sites varchar(30),  PRIMARY KEY (program));
ALTER TABLE t1 modify program varchar(30);
drop table t1;
CREATE TABLE t1 (
name varchar(50) DEFAULT '' NOT NULL,
author varchar(50) DEFAULT '' NOT NULL,
category decimal(10,0) DEFAULT '0' NOT NULL,
email varchar(50),
password varchar(50),
proxy varchar(50),
bitmap varchar(20),
msg varchar(255),
urlscol varchar(127),
urlhttp varchar(127),
timeout decimal(10,0),
nbcnx decimal(10,0),
creation decimal(10,0),
livinguntil decimal(10,0),
lang decimal(10,0),
type decimal(10,0),
subcat decimal(10,0),
subtype decimal(10,0),
reg char(1),
scs varchar(255),
capacity decimal(10,0),
userISP varchar(50),
CCident varchar(50) DEFAULT '' NOT NULL,
PRIMARY KEY (name,author,category)
);
INSERT INTO t1 VALUES
('patnom','patauteur',0,'p.favre@cryo-networks.fr',NULL,NULL,'#p2sndnq6ae5g1u6t','essai salut','scol://195.242.78.119:patauteur.patnom',NULL,NULL,NULL,950036174,-882087474,NULL,3,0,3,'1','Pub/patnom/futur_divers.scs',NULL,'pat','CC1');
INSERT INTO t1 VALUES
('LeNomDeMonSite','Marc',0,'m.barilley@cryo-networks.fr',NULL,NULL,NULL,NULL,'scol://195.242.78.119:Marc.LeNomDeMonSite',NULL,NULL,NULL,950560434,-881563214,NULL,3,0,3,'1','Pub/LeNomDeMonSite/domus_hibere.scs',NULL,'Marq','CC1');
select * from t1 where name='patnom' and author='patauteur' and category=0;
name	author	category	email	password	proxy	bitmap	msg	urlscol	urlhttp	timeout	nbcnx	creation	livinguntil	lang	type	subcat	subtype	reg	scs	capacity	userISP	CCident
patnom	patauteur	0	p.favre@cryo-networks.fr	NULL	NULL	#p2sndnq6ae5g1u6t	essai salut	scol://195.242.78.119:patauteur.patnom	NULL	NULL	NULL	950036174	-882087474	NULL	3	0	3	1	Pub/patnom/futur_divers.scs	NULL	pat	CC1
drop table t1;
create table t1
(
name_id int not null auto_increment,
name varchar(50),
INDEX name_idx (name),
primary key (name_id)
);
INSERT t1 VALUES(NULL,'/');
INSERT t1 VALUES(NULL,'[T,U]_axpby');
SELECT * FROM t1 WHERE name='[T,U]_axpy';
name_id	name
SELECT * FROM t1 WHERE name='[T,U]_axpby';
name_id	name
2	[T,U]_axpby
create table t2
(
name_id int not null auto_increment,
name char(255) binary,
INDEX name_idx (name),
primary key (name_id)
);
INSERT t2 VALUES(NULL,'/');
INSERT t2 VALUES(NULL,'[T,U]_axpby');
SELECT * FROM t2 WHERE name='[T,U]_axpy';
name_id	name
SELECT * FROM t2 WHERE name='[T,U]_axpby';
name_id	name
2	[T,U]_axpby
drop table t1,t2;
create table t1
(
SEQNO                         numeric(12 ) not null,
MOTYPEID                 numeric(12 ) not null,
MOINSTANCEID     numeric(12 ) not null,
ATTRID                       numeric(12 ) not null,
VALUE                         varchar(120) not null,
primary key (SEQNO, MOTYPEID, MOINSTANCEID, ATTRID, VALUE )
);
INSERT INTO t1 VALUES (1, 1, 1, 1, 'a');
INSERT INTO t1 VALUES (1, 1, 1, 1, 'b');
INSERT INTO t1 VALUES (1, 1, 1, 1, 'a');
ERROR 23000: Duplicate entry '1-1-1-1-a' for key 'PRIMARY'
drop table t1;
CREATE TABLE t1 (
a varchar(50) NOT NULL,
b tinyint(3) unsigned NOT NULL default '0',
PRIMARY KEY (a, b)
) ;
INSERT INTO t1 VALUES ('a',1),('a',2);
SELECT * FROM t1 WHERE a='a' AND b=2;
a	b
a	2
SELECT * FROM t1 WHERE a='a' AND b in (2);
a	b
a	2
SELECT * FROM t1 WHERE a='a' AND b in (1,2);
a	b
a	1
a	2
drop table t1;
create table t1 (a int not null unique, b int unique, c int, d int not null primary key, key(c), e int not null unique);
drop table t1;
create table t1 (i int, a char(200), b varchar(100), unique (a), unique (b)) charset utf8;
select i, length(a), length(b), char_length(a), char_length(b) from t1;
i	length(a)	length(b)	char_length(a)	char_length(b)
select i from t1 where a=repeat(_utf8 'a',200);
i
select i from t1 where a=repeat(_utf8 0xD0B1,200);
i
select i from t1 where b=repeat(_utf8 'b',310);
i
drop table t1;
CREATE TABLE t1 (id int unsigned auto_increment, name char(50), primary key (id));
insert into t1 (name) values ('a'), ('b'),('c'),('d'),('e'),('f'),('g');
explain select 1 from t1 where id =2;
explain select 1 from t1 where id =2 or id=3;
explain select name from t1 where id =2;
explain select 1 from t1 where id =2;
drop table t1;
CREATE TABLE t1 (numeropost mediumint(8) unsigned NOT NULL default '0', numreponse int(10) unsigned NOT NULL auto_increment, PRIMARY KEY (numeropost,numreponse), UNIQUE KEY numreponse (numreponse));
INSERT INTO t1 (numeropost,numreponse) VALUES ('1','1'),('1','2'),('2','3'),('2','4');
SELECT numeropost FROM t1 WHERE numreponse='1';
numeropost
1
EXPLAIN SELECT numeropost FROM t1 WHERE numreponse='1';
SELECT numeropost FROM t1 WHERE numreponse='1';
numeropost
1
drop table t1;
DROP TABLE IF EXISTS t1;
CREATE TABLE t1 (
c1 int,
c2 varbinary(240),
UNIQUE KEY (c1),
KEY (c2)
);
INSERT INTO t1 VALUES (1,'\Z\Z\Z\Z');
INSERT INTO t1 VALUES (2,'\Z\Z\Z\Z\Z\Z');
INSERT INTO t1 VALUES (3,'\Z\Z\Z\Z');
select c1 from t1 where c2='\Z\Z\Z\Z';
c1
1
3
DELETE FROM t1 WHERE (c1 = 1);
select c1 from t1 where c2='\Z\Z\Z\Z';
c1
3
DELETE FROM t1 WHERE (c1 = 3);
select c1 from t1 where c2='\Z\Z\Z\Z';
c1
truncate table t1;
insert into t1 values(1,"aaaa"),(2,"aaab"),(3,"aaac"),(4,"aaccc");
delete from t1 where c1=3;
delete from t1 where c1=1;
delete from t1 where c1=4;
drop table t1;
create table t1 (c char(10), index (c(0)));
ERROR HY000: Key part 'c' length cannot be 0
create table t1 (c char(10), index (c,c));
ERROR 42S21: Duplicate column name 'c'
create table t1 (c1 char(10), c2 char(10), index (c1,c2,c1));
ERROR 42S21: Duplicate column name 'c1'
create table t1 (c1 char(10), c2 char(10), index (c1,c1,c2));
ERROR 42S21: Duplicate column name 'c1'
create table t1 (c1 char(10), c2 char(10), index (c2,c1,c1));
ERROR 42S21: Duplicate column name 'c1'
create table t1 (c1 char(10), c2 char(10));
alter table t1 add key (c1,c1);
ERROR 42S21: Duplicate column name 'c1'
alter table t1 add key (c2,c1,c1);
ERROR 42S21: Duplicate column name 'c1'
alter table t1 add key (c1,c2,c1);
ERROR 42S21: Duplicate column name 'c1'
alter table t1 add key (c1,c1,c2);
ERROR 42S21: Duplicate column name 'c1'
drop table t1;
create table t1 (
i1 INT NOT NULL,
i2 INT NOT NULL,
UNIQUE i1idx (i1),
UNIQUE i2idx (i2));
drop table t1;
create table t1 (
c1 int,
c2 varchar(20) not null,
primary key (c1),
key (c2/*(10)*/)
) ;
insert into t1 values (1,'');
insert into t1 values (2,' \t\tTest String');
insert into t1 values (3,' \n\tTest String');
update t1 set c2 = 'New Test String' where c1 = 1;
select * from t1 order by c1;
c1	c2
1	New Test String
2	 		Test String
3	 
	Test String
drop table t1;
create table t1 (a varchar(10), b varchar(10), key(a/*(10)*/,b/*(10)*/));
alter table t1 modify b varchar(20);
alter table t1 modify a varchar(20);
drop table t1;
create table t1 (
c1 int,
c2 char(12),
c3 varchar(123),
c4 timestamp NOT NULL DEFAULT CURRENT_TIMESTAMP ON UPDATE CURRENT_TIMESTAMP,
index (c1),
index i1 (c1),
index i2 (c2),
index i3 (c3),
unique i4 (c4),
index i5 (c1, c2, c3, c4),
primary key (c2, c3),
index (c2, c4));
alter table t1 drop index c1;
alter table t1 add index (c1);
alter table t1 add index (c1);
alter table t1 drop index i3;
alter table t1 add index i3 (c3);
alter table t1 drop index i2, drop index i4;
alter table t1 add index i2 (c2), add index i4 (c4);
alter table t1 drop index i2, drop index i4, add index i6 (c2, c4);
alter table t1 add index i2 (c2), add index i4 (c4), drop index i6;
alter table t1 drop index i2, drop index i4, add unique i4 (c4);
alter table t1 add index i2 (c2), drop index i4, add index i4 (c4);
alter table t1 drop index c2, add index (c2/*(4)*/,c3/*(7)*/);
alter table t1 drop index c2, add index (c2/*(4)*/,c3/*(7)*/);
insert into t1 values(1, 'a', 'a', NULL);
insert into t1 values(1, 'b', 'b', NULL);
alter table t1 drop index i3, drop index i2, drop index i1;
drop table t1;
CREATE TABLE t1( a TINYINT, KEY(a) )/* ENGINE=MyISAM*/;
INSERT INTO t1 VALUES( 1 );
EXPLAIN SELECT MAX(a) FROM t1 FORCE INDEX(a);
drop table t1;
CREATE TABLE t1 (
a INTEGER auto_increment PRIMARY KEY,
b INTEGER NOT NULL,
c INTEGER NOT NULL,
d CHAR(64)
);
CREATE TABLE t2 (
a INTEGER auto_increment PRIMARY KEY,
b INTEGER NOT NULL,
c SMALLINT NOT NULL,
d DATETIME NOT NULL,
e SMALLINT NOT NULL,
f INTEGER NOT NULL,
g INTEGER NOT NULL,
h SMALLINT NOT NULL,
i INTEGER NOT NULL,
j INTEGER NOT NULL,
UNIQUE INDEX (b),
INDEX (b, d, e, f, g, h, i, j, c),
INDEX (c)
);
INSERT INTO t2 VALUES
(NULL, 1, 254, '1000-01-01 00:00:00', 257, 0, 0, 0, 0, 0),
(NULL, 2, 1, '2004-11-30 12:00:00', 1, 0, 0, 0, 0, 0),
(NULL, 3, 1, '2004-11-30 12:00:00', 1, 0, 0, 2, -21600, 0),
(NULL, 4, 1, '2004-11-30 12:00:00', 1, 0, 0, 2, -10800, 0),
(NULL, 5, 1, '2004-11-30 12:00:00', 1, 0, 0, 5, -10800, 0),
(NULL, 6, 1, '2004-11-30 12:00:00', 102, 0, 0, 0, 0, 0),
(NULL, 7, 1, '2004-11-30 12:00:00', 105, 2, 0, 0, 0, 0),
(NULL, 8, 1, '2004-11-30 12:00:00', 105, 10, 0, 0, 0, 0);
INSERT INTO t1 (b, c, d) VALUES
(3388000, -553000, NULL),
(3388000, -553000, NULL);
DROP TABLE t1, t2;
End of 5.0 tests
DROP TABLE IF EXISTS t1;
CREATE TABLE t1 (a INT PRIMARY KEY AUTO_INCREMENT);
INSERT INTO t1 VALUES (), (), ();
SELECT 1 AS c1
FROM t1
ORDER BY (
SELECT 1 AS c2
FROM t1
GROUP BY GREATEST(LAST_INSERT_ID(), t1.a)/* ASC*/
LIMIT 1);
c1
1
1
1
DROP TABLE t1;
CREATE TABLE t1 (a INT, b INT, INDEX (a,b));
INSERT INTO t1 (a, b)
VALUES
(1,1), (1,2), (1,3), (1,4), (1,5),
(2,2), (2,3), (2,1), (3,1), (4,1), (4,2), (4,3), (4,4), (4,5), (4,6);
EXPLAIN SELECT 1 FROM t1 AS t1_outer WHERE
(SELECT max(b) FROM t1 GROUP BY a HAVING a < 2) > 12;
SELECT 1 as RES FROM t1 AS t1_outer WHERE
(SELECT max(b) FROM t1 GROUP BY a HAVING a < 2) > 12;
DROP TABLE t1;
#
# Bug#18144: Cost with FORCE/USE index seems incorrect in some cases.
#
# We are interested in showing that the cost for the last plan is higher
# than for the preceding two plans.
#
CREATE TABLE t1( a INT, b INT, KEY( a ) );
INSERT INTO t1 values (1, 2), (1, 3), (2, 3), (2, 4), (3, 4), (3, 5);
EXPLAIN SELECT a, SUM( b ) FROM t1 GROUP BY a;
EXPLAIN SELECT a, SUM( b ) FROM t1 USE INDEX( a ) GROUP BY a;
EXPLAIN SELECT a, SUM( b ) FROM t1 FORCE INDEX( a ) GROUP BY a;
DROP TABLE t1;
CREATE TABLE t1(a INT, b INT, KEY(a));
INSERT INTO t1 VALUES (1,2);
SELECT * FROM t1 FORCE INDEX ();
ERROR 42000: You have an error in your SQL syntax; check the manual that corresponds to your OceanBase version for the right syntax to use near ')' at line 1
SELECT * FROM t1 IGNORE INDEX ();
ERROR 42000: You have an error in your SQL syntax; check the manual that corresponds to your OceanBase version for the right syntax to use near ')' at line 1
SELECT * FROM t1 USE INDEX (a);
a	b
1	2
DROP TABLE t1;
