create table t1(pk int primary key, a int);
create index iloveidx on t1(a);
insert into t1 values(1,0),(2,0),(4,0),(3,0);
insert into t1 values(0,0);
insert into t1 values(5,0),(6,0),(8,0),(7,0);
update t1 set a=1 where pk = 0;
update t1 set a=1 where pk = 1;
delete from t1 where pk=0;
replace into t1(pk, a) values(0,2);
delete from t1 where pk=2;
replace into t1(pk, a) values(2,2);
delete from t1 where pk = 2;
delete from t1 where pk = 1;
delete from t1 where pk = 5;
select * from t1;
pk	a
0	2
3	0
4	0
6	0
7	0
8	0
select  /*+ index(t1 iloveidx) */ * from t1;
pk	a
0	2
3	0
4	0
6	0
7	0
8	0
alter system major freeze tenant = sys;
alter system major freeze tenant = all_user;
alter system major freeze tenant = all_meta;
select * from t1;
pk	a
0	2
3	0
4	0
6	0
7	0
8	0
select  /*+ index(t1 iloveidx) */ * from t1;
pk	a
3	0
4	0
6	0
7	0
8	0
0	2
insert into t1 values(100,0),(200,0),(101,0);
insert into t1 values(102,0);
insert into t1 values(104,0),(103,0);
insert into t1 values(2,0);
update  t1 set a=1 where pk = 7;
update  t1 set a=1 where pk = 3;
delete from t1 where pk=0;
delete from t1 where pk=7;
delete from t1 where pk=103;
select * from t1;
pk	a
2	0
3	1
4	0
6	0
8	0
100	0
101	0
102	0
104	0
200	0
select  /*+ index(t1 iloveidx) */ * from t1;
pk	a
2	0
4	0
6	0
8	0
100	0
101	0
102	0
104	0
200	0
3	1
alter system major freeze tenant = sys;
alter system major freeze tenant = all_user;
alter system major freeze tenant = all_meta;
select * from t1;
pk	a
2	0
3	1
4	0
6	0
8	0
100	0
101	0
102	0
104	0
200	0
select  /*+ index(t1 iloveidx) */ * from t1;
pk	a
2	0
4	0
6	0
8	0
100	0
101	0
102	0
104	0
200	0
3	1
insert into t1 values(0,0),(7,0);
insert into t1 values(307,0),(103,0);
insert into t1 values(300,0),(305,0),(301,0);
insert into t1 values(302,0);
insert into t1 values(304,0),(303,0);
update  t1 set a=1 where pk = 7;
update  t1 set a=1 where pk = 3;
update  t1 set a=1 where pk = 102;
update  t1 set a=1 where pk = 101;
delete from t1 where pk=4;
delete from t1 where pk=200;
delete from t1 where pk=300;
select * from t1;
pk	a
0	0
2	0
3	1
6	0
7	1
8	0
100	0
101	1
102	1
103	0
104	0
301	0
302	0
303	0
304	0
305	0
307	0
drop table t1;
create table t1 (id int primary key, k int);
insert into t1 values(1,1);
alter table t1 add column f int default 0, add key(f);
create index f_t1 on t1(f);
alter system major freeze tenant = sys;
alter system major freeze tenant = all_user;
alter system major freeze tenant = all_meta;
select * from t1;
id	k	f
1	1	0
drop table t1;
select count(*) > 0 from oceanbase.__all_virtual_column_statistic;
count(*) > 0
1
create table t1 (id int primary key, k int);
insert into t1 values(2,2);
create index k_t1 on t1(k);
alter table t1 modify k BIGINT;
alter system major freeze tenant = sys;
alter system major freeze tenant = all_user;
alter system major freeze tenant = all_meta;
drop table t1;
create table t1 (c1 int primary key, c2 int);
insert into t1 values(1,1);
alter system major freeze tenant = sys;
alter system major freeze tenant = all_user;
alter system major freeze tenant = all_meta;
alter table t1 add column c3 int default 0;
update t1 set c2 = 2 where c1 = 1;
create index c3_t on t1 (c3);
alter system major freeze tenant = sys;
alter system major freeze tenant = all_user;
alter system major freeze tenant = all_meta;
drop table t1;
