drop table if exists t1;
create table t1(pk int primary key);
insert into t1 values(1),(2),(4),(3);
insert into t1 values(0);
insert into t1 values(5),(6),(8),(7);
delete from t1 where pk = 2;
delete from t1 where pk = 1;
delete from t1 where pk = 5;
select * from t1;
pk
0
3
4
6
7
8
alter system major freeze tenant = sys;
alter system major freeze tenant = all_user;
alter system major freeze tenant = all_meta;
insert into t1 values(100),(200),(101);
insert into t1 values(102);
insert into t1 values(104),(103);
insert into t1 values(2);
delete from t1 where pk=0;
delete from t1 where pk=7;
delete from t1 where pk=103;
select * from t1;
pk
2
3
4
6
8
100
101
102
104
200
alter system major freeze tenant = sys;
alter system major freeze tenant = all_user;
alter system major freeze tenant = all_meta;
insert into t1 values(0),(7);
insert into t1 values(307),(103);
insert into t1 values(300),(305),(301);
insert into t1 values(302);
insert into t1 values(304),(303);
delete from t1 where pk=4;
delete from t1 where pk=200;
delete from t1 where pk=300;
select * from t1;
pk
0
2
3
6
7
8
100
101
102
103
104
301
302
303
304
305
307
drop table t1;
