drop table if exists t1;
create table t1 (a int, key (a));
insert into t1 values (NULL), (0), (1), (2), (3), (4), (5), (6), (7), (8), (9),
(10), (11), (12), (13), (14), (15), (16), (17), (18), (19);
explain basic select * from t1 where not(not(a));
Query Plan
====================
|ID|OPERATOR  |NAME|
--------------------
|0 |TABLE SCAN|t1  |
====================

Outputs & filters: 
-------------------------------------
  0 - output([t1.a]), filter([t1.a]), 
      access([t1.a]), partitions(p0)

select * from t1 where not(not(a));
a
1
2
3
4
5
6
7
8
9
10
11
12
13
14
15
16
17
18
19
explain basic select * from t1 where not(not(not(a > 10)));
Query Plan
=====================
|ID|OPERATOR  |NAME |
---------------------
|0 |TABLE SCAN|t1(a)|
=====================

Outputs & filters: 
-------------------------------------
  0 - output([t1.a]), filter(nil), 
      access([t1.a]), partitions(p0)

select * from t1 where not(not(not(a > 10)));
a
0
1
2
3
4
5
6
7
8
9
10
explain basic select * from t1 where not(not(not(a < 5) and not(a > 10)));
Query Plan
=====================
|ID|OPERATOR  |NAME |
---------------------
|0 |TABLE SCAN|t1(a)|
=====================

Outputs & filters: 
-------------------------------------
  0 - output([t1.a]), filter(nil), 
      access([t1.a]), partitions(p0)

select * from t1 where not(not(not(a < 5) and not(a > 10)));
a
5
6
7
8
9
10
explain basic select * from t1 where not(a = 10);
Query Plan
=====================
|ID|OPERATOR  |NAME |
---------------------
|0 |TABLE SCAN|t1(a)|
=====================

Outputs & filters: 
-------------------------------------
  0 - output([t1.a]), filter(nil), 
      access([t1.a]), partitions(p0)

select * from t1 where not(a = 10);
a
0
1
2
3
4
5
6
7
8
9
11
12
13
14
15
16
17
18
19
explain basic select * from t1 where not(a != 10);
Query Plan
=====================
|ID|OPERATOR  |NAME |
---------------------
|0 |TABLE SCAN|t1(a)|
=====================

Outputs & filters: 
-------------------------------------
  0 - output([t1.a]), filter(nil), 
      access([t1.a]), partitions(p0)

select * from t1 where not(a != 1);
a
1
explain basic select * from t1 where not(a < 10);
Query Plan
=====================
|ID|OPERATOR  |NAME |
---------------------
|0 |TABLE SCAN|t1(a)|
=====================

Outputs & filters: 
-------------------------------------
  0 - output([t1.a]), filter(nil), 
      access([t1.a]), partitions(p0)

select * from t1 where not(a < 10);
a
10
11
12
13
14
15
16
17
18
19
explain basic select * from t1 where not(a >= 10);
Query Plan
=====================
|ID|OPERATOR  |NAME |
---------------------
|0 |TABLE SCAN|t1(a)|
=====================

Outputs & filters: 
-------------------------------------
  0 - output([t1.a]), filter(nil), 
      access([t1.a]), partitions(p0)

select * from t1 where not(a >= 10);
a
0
1
2
3
4
5
6
7
8
9
explain basic select * from t1 where not(a > 10);
Query Plan
=====================
|ID|OPERATOR  |NAME |
---------------------
|0 |TABLE SCAN|t1(a)|
=====================

Outputs & filters: 
-------------------------------------
  0 - output([t1.a]), filter(nil), 
      access([t1.a]), partitions(p0)

select * from t1 where not(a > 10);
a
0
1
2
3
4
5
6
7
8
9
10
explain basic select * from t1 where not(a <= 10);
Query Plan
=====================
|ID|OPERATOR  |NAME |
---------------------
|0 |TABLE SCAN|t1(a)|
=====================

Outputs & filters: 
-------------------------------------
  0 - output([t1.a]), filter(nil), 
      access([t1.a]), partitions(p0)

select * from t1 where not(a <= 10);
a
11
12
13
14
15
16
17
18
19
explain basic select * from t1 where not(a is null);
Query Plan
====================
|ID|OPERATOR  |NAME|
--------------------
|0 |TABLE SCAN|t1  |
====================

Outputs & filters: 
-------------------------------------
  0 - output([t1.a]), filter([(T_OP_IS_NOT, t1.a, NULL, 0)]), 
      access([t1.a]), partitions(p0)

select * from t1 where not(a is null);
a
0
1
2
3
4
5
6
7
8
9
10
11
12
13
14
15
16
17
18
19
explain basic select * from t1 where not(a is not null);
Query Plan
=====================
|ID|OPERATOR  |NAME |
---------------------
|0 |TABLE SCAN|t1(a)|
=====================

Outputs & filters: 
-------------------------------------
  0 - output([t1.a]), filter(nil), 
      access([t1.a]), partitions(p0)

select * from t1 where not(a is not null);
a
NULL
explain basic select * from t1 where not(a < 5 or a > 15);
Query Plan
=====================
|ID|OPERATOR  |NAME |
---------------------
|0 |TABLE SCAN|t1(a)|
=====================

Outputs & filters: 
-------------------------------------
  0 - output([t1.a]), filter(nil), 
      access([t1.a]), partitions(p0)

select * from t1 where not(a < 5 or a > 15);
a
5
6
7
8
9
10
11
12
13
14
15
explain basic select * from t1 where not(a < 15 and a > 5);
Query Plan
=====================
|ID|OPERATOR  |NAME |
---------------------
|0 |TABLE SCAN|t1(a)|
=====================

Outputs & filters: 
-------------------------------------
  0 - output([t1.a]), filter(nil), 
      access([t1.a]), partitions(p0)

select * from t1 where not(a < 15 and a > 5);
a
0
1
2
3
4
5
15
16
17
18
19
explain basic select * from t1 where a = 2 or not(a < 10);
Query Plan
=====================
|ID|OPERATOR  |NAME |
---------------------
|0 |TABLE SCAN|t1(a)|
=====================

Outputs & filters: 
-------------------------------------
  0 - output([t1.a]), filter(nil), 
      access([t1.a]), partitions(p0)

select * from t1 where a = 2 or not(a < 10);
a
2
10
11
12
13
14
15
16
17
18
19
explain basic select * from t1 where a > 5 and not(a > 10);
Query Plan
=====================
|ID|OPERATOR  |NAME |
---------------------
|0 |TABLE SCAN|t1(a)|
=====================

Outputs & filters: 
-------------------------------------
  0 - output([t1.a]), filter(nil), 
      access([t1.a]), partitions(p0)

select * from t1 where a > 5 and not(a > 10);
a
6
7
8
9
10
explain basic select * from t1 where a = 2 or not(a < 5 or a > 15);
Query Plan
=====================
|ID|OPERATOR  |NAME |
---------------------
|0 |TABLE SCAN|t1(a)|
=====================

Outputs & filters: 
-------------------------------------
  0 - output([t1.a]), filter(nil), 
      access([t1.a]), partitions(p0)

select * from t1 where a = 2 or not(a < 5 or a > 15);
a
2
5
6
7
8
9
10
11
12
13
14
15
explain basic select * from t1 where a = 7 or not(a < 15 and a > 5);
Query Plan
=====================
|ID|OPERATOR  |NAME |
---------------------
|0 |TABLE SCAN|t1(a)|
=====================

Outputs & filters: 
-------------------------------------
  0 - output([t1.a]), filter(nil), 
      access([t1.a]), partitions(p0)

select * from t1 where a = 7 or not(a < 15 and a > 5);
a
0
1
2
3
4
5
7
15
16
17
18
19
explain basic select * from t1 where NULL or not(a < 15 and a > 5);
Query Plan
=====================
|ID|OPERATOR  |NAME |
---------------------
|0 |TABLE SCAN|t1(a)|
=====================

Outputs & filters: 
-------------------------------------
  0 - output([t1.a]), filter(nil), 
      access([t1.a]), partitions(p0)

select * from t1 where NULL or not(a < 15 and a > 5);
a
0
1
2
3
4
5
15
16
17
18
19
explain basic select * from t1 where not(NULL and a > 5);
Query Plan
====================
|ID|OPERATOR  |NAME|
--------------------
|0 |TABLE SCAN|t1  |
====================

Outputs & filters: 
-------------------------------------
  0 - output([t1.a]), filter([(T_OP_NOT, NULL) OR t1.a <= 5]), 
      access([t1.a]), partitions(p0)

select * from t1 where not(NULL and a > 5);
a
0
1
2
3
4
5
explain basic select * from t1 where not(NULL or a);
Query Plan
====================
|ID|OPERATOR  |NAME|
--------------------
|0 |TABLE SCAN|t1  |
====================

Outputs & filters: 
-------------------------------------
  0 - output([t1.a]), filter([(T_OP_NOT, t1.a)]), startup_filter([(T_OP_NOT, NULL)]), 
      access([t1.a]), partitions(p0)

select * from t1 where not(NULL or a);
a
explain basic select * from t1 where not(NULL and a);
Query Plan
====================
|ID|OPERATOR  |NAME|
--------------------
|0 |TABLE SCAN|t1  |
====================

Outputs & filters: 
-------------------------------------
  0 - output([t1.a]), filter([(T_OP_NOT, NULL) OR (T_OP_NOT, t1.a)]), 
      access([t1.a]), partitions(p0)

select * from t1 where not(NULL and a);
a
0
explain basic select * from t1 where not((a < 5 or a < 10) and (not(a > 16) or a > 17));
Query Plan
=====================
|ID|OPERATOR  |NAME |
---------------------
|0 |TABLE SCAN|t1(a)|
=====================

Outputs & filters: 
-------------------------------------
  0 - output([t1.a]), filter(nil), 
      access([t1.a]), partitions(p0)

select * from t1 where not((a < 5 or a < 10) and (not(a > 16) or a > 17));
a
10
11
12
13
14
15
16
17
18
19
explain basic select * from t1 where not((a < 5 and a < 10) and (not(a > 16) or a > 17));
Query Plan
=====================
|ID|OPERATOR  |NAME |
---------------------
|0 |TABLE SCAN|t1(a)|
=====================

Outputs & filters: 
-------------------------------------
  0 - output([t1.a]), filter(nil), 
      access([t1.a]), partitions(p0)

select * from t1 where not((a < 5 and a < 10) and (not(a > 16) or a > 17));
a
5
6
7
8
9
10
11
12
13
14
15
16
17
18
19
explain basic select * from t1 where ((a between 5 and 15) and (not(a like 10)));
Query Plan
=====================
|ID|OPERATOR  |NAME |
---------------------
|0 |TABLE SCAN|t1(a)|
=====================

Outputs & filters: 
-------------------------------------
  0 - output([t1.a]), filter([(T_OP_NOT, (T_OP_LIKE, t1.a, ?, '\\'))]), 
      access([t1.a]), partitions(p0)

select * from t1 where ((a between 5 and 15) and (not(a like 10)));
a
5
6
7
8
9
11
12
13
14
15
delete from t1 where a > 3;
select a, not(not(a)) from t1;
a	not(not(a))
NULL	NULL
0	0
1	1
2	1
3	1
explain basic select a, not(not(a)), not(a <= 2 and not(a)), not(a not like "1"), not (a not in (1,2)), not(a != 2) from t1 where not(not(a)) having not(not(a));
Query Plan
====================
|ID|OPERATOR  |NAME|
--------------------
|0 |TABLE SCAN|t1  |
====================

Outputs & filters: 
-------------------------------------
  0 - output([t1.a], [(T_OP_NOT, (T_OP_NOT, t1.a))], [(T_OP_NOT, t1.a <= 2 AND (T_OP_NOT, t1.a))], [(T_OP_NOT, (T_OP_NOT, (T_OP_LIKE, t1.a, '1', '\\')))], [(T_OP_NOT, (T_OP_NOT_IN, t1.a, (1, 2)))], [(T_OP_NOT, t1.a != 2)]), filter([t1.a]), 
      access([t1.a]), partitions(p0)

drop table t1;
