drop table if exists t1, t2, t3;
create table t1(a int primary key, b int, c int, d int, index idx_b(b), index idx_c(c), index idx_d(d));
create table t2(a int primary key, b int, c int, d int, index idx_b(b), index idx_c(c), index idx_d(d));
create table t3(a int primary key, b int, c int, d int, index idx_b(b), index idx_c(c), index idx_d(d));
insert into t1(a, b, c, d) values (0, 1, 1, 1);
insert into t1(a, b, c, d) values (1, 1, 1, 1);
insert into t1(a, b, c, d) values (2, 1, 1, 1);
insert into t1(a, b, c, d) values (3, 1, 1, 1);
insert into t1(a, b, c, d) values (4, 1, 1, 1);
insert into t1(a, b, c, d) values (5, 1, 1, 1);
insert into t1(a, b, c, d) values (6, 1, 1, 1);
insert into t1(a, b, c, d) values (7, 1, 1, 1);
insert into t1(a, b, c, d) values (8, 1, 1, 1);
insert into t1(a, b, c, d) values (9, 1, 1, 1);
insert into t1(a, b, c, d) values (10, 1, 1, 1);
insert into t1(a, b, c, d) values (11, 1, 1, 1);
insert into t1(a, b, c, d) values (12, 1, 1, 1);
insert into t1(a, b, c, d) values (13, 1, 1, 1);
insert into t1(a, b, c, d) values (14, 1, 1, 1);
insert into t1(a, b, c, d) values (15, 1, 1, 1);
insert into t1(a, b, c, d) values (16, 1, 1, 1);
insert into t1(a, b, c, d) values (17, 1, 1, 1);
insert into t1(a, b, c, d) values (18, 1, 1, 1);
insert into t1(a, b, c, d) values (19, 1, 1, 1);
insert into t1(a, b, c, d) values (20, 1, 1, 1);
insert into t1(a, b, c, d) values (21, 1, 1, 1);
insert into t1(a, b, c, d) values (22, 1, 1, 1);
insert into t1(a, b, c, d) values (23, 1, 1, 1);
insert into t1(a, b, c, d) values (24, 1, 1, 1);
insert into t1(a, b, c, d) values (25, 1, 1, 1);
insert into t1(a, b, c, d) values (26, 1, 1, 1);
insert into t1(a, b, c, d) values (27, 1, 1, 1);
insert into t1(a, b, c, d) values (28, 1, 1, 1);
insert into t1(a, b, c, d) values (29, 1, 1, 1);
insert into t1(a, b, c, d) values (30, 1, 1, 1);
insert into t1(a, b, c, d) values (31, 1, 1, 1);
insert into t1(a, b, c, d) values (32, 1, 1, 1);
insert into t1(a, b, c, d) values (33, 1, 1, 1);
insert into t1(a, b, c, d) values (34, 1, 1, 1);
insert into t1(a, b, c, d) values (35, 1, 1, 1);
insert into t1(a, b, c, d) values (36, 1, 1, 1);
insert into t1(a, b, c, d) values (37, 1, 1, 1);
insert into t1(a, b, c, d) values (38, 1, 1, 1);
insert into t1(a, b, c, d) values (39, 1, 1, 1);
insert into t1(a, b, c, d) values (40, 1, 1, 1);
insert into t1(a, b, c, d) values (41, 1, 1, 1);
insert into t1(a, b, c, d) values (42, 1, 1, 1);
insert into t1(a, b, c, d) values (43, 1, 1, 1);
insert into t1(a, b, c, d) values (44, 1, 1, 1);
insert into t1(a, b, c, d) values (45, 1, 1, 1);
insert into t1(a, b, c, d) values (46, 1, 1, 1);
insert into t1(a, b, c, d) values (47, 1, 1, 1);
insert into t1(a, b, c, d) values (48, 1, 1, 1);
insert into t1(a, b, c, d) values (49, 1, 1, 1);
insert into t1(a, b, c, d) values (50, 1, 1, 1);
insert into t1(a, b, c, d) values (51, 1, 1, 1);
insert into t1(a, b, c, d) values (52, 1, 1, 1);
insert into t1(a, b, c, d) values (53, 1, 1, 1);
insert into t1(a, b, c, d) values (54, 1, 1, 1);
insert into t1(a, b, c, d) values (55, 1, 1, 1);
insert into t1(a, b, c, d) values (56, 1, 1, 1);
insert into t1(a, b, c, d) values (57, 1, 1, 1);
insert into t1(a, b, c, d) values (58, 1, 1, 1);
insert into t1(a, b, c, d) values (59, 1, 1, 1);
insert into t1(a, b, c, d) values (60, 1, 1, 1);
insert into t1(a, b, c, d) values (61, 1, 1, 1);
insert into t1(a, b, c, d) values (62, 1, 1, 1);
insert into t1(a, b, c, d) values (63, 1, 1, 1);
insert into t1(a, b, c, d) values (64, 1, 1, 1);
insert into t1(a, b, c, d) values (65, 1, 1, 1);
insert into t1(a, b, c, d) values (66, 1, 1, 1);
insert into t1(a, b, c, d) values (67, 1, 1, 1);
insert into t1(a, b, c, d) values (68, 1, 1, 1);
insert into t1(a, b, c, d) values (69, 1, 1, 1);
insert into t1(a, b, c, d) values (70, 1, 1, 1);
insert into t1(a, b, c, d) values (71, 1, 1, 1);
insert into t1(a, b, c, d) values (72, 1, 1, 1);
insert into t1(a, b, c, d) values (73, 1, 1, 1);
insert into t1(a, b, c, d) values (74, 1, 1, 1);
insert into t1(a, b, c, d) values (75, 1, 1, 1);
insert into t1(a, b, c, d) values (76, 1, 1, 1);
insert into t1(a, b, c, d) values (77, 1, 1, 1);
insert into t1(a, b, c, d) values (78, 1, 1, 1);
insert into t1(a, b, c, d) values (79, 1, 1, 1);
insert into t1(a, b, c, d) values (80, 1, 1, 1);
insert into t1(a, b, c, d) values (81, 1, 1, 1);
insert into t1(a, b, c, d) values (82, 1, 1, 1);
insert into t1(a, b, c, d) values (83, 1, 1, 1);
insert into t1(a, b, c, d) values (84, 1, 1, 1);
insert into t1(a, b, c, d) values (85, 1, 1, 1);
insert into t1(a, b, c, d) values (86, 1, 1, 1);
insert into t1(a, b, c, d) values (87, 1, 1, 1);
insert into t1(a, b, c, d) values (88, 1, 1, 1);
insert into t1(a, b, c, d) values (89, 1, 1, 1);
insert into t1(a, b, c, d) values (90, 1, 1, 1);
insert into t1(a, b, c, d) values (91, 1, 1, 1);
insert into t1(a, b, c, d) values (92, 1, 1, 1);
insert into t1(a, b, c, d) values (93, 1, 1, 1);
insert into t1(a, b, c, d) values (94, 1, 1, 1);
insert into t1(a, b, c, d) values (95, 1, 1, 1);
insert into t1(a, b, c, d) values (96, 1, 1, 1);
insert into t1(a, b, c, d) values (97, 1, 1, 1);
insert into t1(a, b, c, d) values (98, 1, 1, 1);
insert into t1(a, b, c, d) values (99, 1, 1, 1);
insert into t1(a, b, c, d) values (100, 2, 2, 2);
insert into t1(a, b, c, d) values (101, 2, 2, 2);
insert into t1(a, b, c, d) values (102, 2, 2, 2);
insert into t1(a, b, c, d) values (103, 2, 2, 2);
insert into t1(a, b, c, d) values (104, 2, 2, 2);
insert into t1(a, b, c, d) values (105, 2, 2, 2);
insert into t1(a, b, c, d) values (106, 2, 2, 2);
insert into t1(a, b, c, d) values (107, 2, 2, 2);
insert into t1(a, b, c, d) values (108, 2, 2, 2);
insert into t1(a, b, c, d) values (109, 2, 2, 2);
insert into t1(a, b, c, d) values (110, 2, 2, 2);
insert into t1(a, b, c, d) values (111, 2, 2, 2);
insert into t1(a, b, c, d) values (112, 2, 2, 2);
insert into t1(a, b, c, d) values (113, 2, 2, 2);
insert into t1(a, b, c, d) values (114, 2, 2, 2);
insert into t1(a, b, c, d) values (115, 2, 2, 2);
insert into t1(a, b, c, d) values (116, 2, 2, 2);
insert into t1(a, b, c, d) values (117, 2, 2, 2);
insert into t1(a, b, c, d) values (118, 2, 2, 2);
insert into t1(a, b, c, d) values (119, 2, 2, 2);
insert into t1(a, b, c, d) values (120, 2, 2, 2);
insert into t1(a, b, c, d) values (121, 2, 2, 2);
insert into t1(a, b, c, d) values (122, 2, 2, 2);
insert into t1(a, b, c, d) values (123, 2, 2, 2);
insert into t1(a, b, c, d) values (124, 2, 2, 2);
insert into t1(a, b, c, d) values (125, 2, 2, 2);
insert into t1(a, b, c, d) values (126, 2, 2, 2);
insert into t1(a, b, c, d) values (127, 2, 2, 2);
insert into t1(a, b, c, d) values (128, 2, 2, 2);
insert into t1(a, b, c, d) values (129, 2, 2, 2);
insert into t1(a, b, c, d) values (130, 2, 2, 2);
insert into t1(a, b, c, d) values (131, 2, 2, 2);
insert into t1(a, b, c, d) values (132, 2, 2, 2);
insert into t1(a, b, c, d) values (133, 2, 2, 2);
insert into t1(a, b, c, d) values (134, 2, 2, 2);
insert into t1(a, b, c, d) values (135, 2, 2, 2);
insert into t1(a, b, c, d) values (136, 2, 2, 2);
insert into t1(a, b, c, d) values (137, 2, 2, 2);
insert into t1(a, b, c, d) values (138, 2, 2, 2);
insert into t1(a, b, c, d) values (139, 2, 2, 2);
insert into t1(a, b, c, d) values (140, 2, 2, 2);
insert into t1(a, b, c, d) values (141, 2, 2, 2);
insert into t1(a, b, c, d) values (142, 2, 2, 2);
insert into t1(a, b, c, d) values (143, 2, 2, 2);
insert into t1(a, b, c, d) values (144, 2, 2, 2);
insert into t1(a, b, c, d) values (145, 2, 2, 2);
insert into t1(a, b, c, d) values (146, 2, 2, 2);
insert into t1(a, b, c, d) values (147, 2, 2, 2);
insert into t1(a, b, c, d) values (148, 2, 2, 2);
insert into t1(a, b, c, d) values (149, 2, 2, 2);
insert into t1(a, b, c, d) values (150, 2, 2, 2);
insert into t1(a, b, c, d) values (151, 2, 2, 2);
insert into t1(a, b, c, d) values (152, 2, 2, 2);
insert into t1(a, b, c, d) values (153, 2, 2, 2);
insert into t1(a, b, c, d) values (154, 2, 2, 2);
insert into t1(a, b, c, d) values (155, 2, 2, 2);
insert into t1(a, b, c, d) values (156, 2, 2, 2);
insert into t1(a, b, c, d) values (157, 2, 2, 2);
insert into t1(a, b, c, d) values (158, 2, 2, 2);
insert into t1(a, b, c, d) values (159, 2, 2, 2);
insert into t1(a, b, c, d) values (160, 2, 2, 2);
insert into t1(a, b, c, d) values (161, 2, 2, 2);
insert into t1(a, b, c, d) values (162, 2, 2, 2);
insert into t1(a, b, c, d) values (163, 2, 2, 2);
insert into t1(a, b, c, d) values (164, 2, 2, 2);
insert into t1(a, b, c, d) values (165, 2, 2, 2);
insert into t1(a, b, c, d) values (166, 2, 2, 2);
insert into t1(a, b, c, d) values (167, 2, 2, 2);
insert into t1(a, b, c, d) values (168, 2, 2, 2);
insert into t1(a, b, c, d) values (169, 2, 2, 2);
insert into t1(a, b, c, d) values (170, 2, 2, 2);
insert into t1(a, b, c, d) values (171, 2, 2, 2);
insert into t1(a, b, c, d) values (172, 2, 2, 2);
insert into t1(a, b, c, d) values (173, 2, 2, 2);
insert into t1(a, b, c, d) values (174, 2, 2, 2);
insert into t1(a, b, c, d) values (175, 2, 2, 2);
insert into t1(a, b, c, d) values (176, 2, 2, 2);
insert into t1(a, b, c, d) values (177, 2, 2, 2);
insert into t1(a, b, c, d) values (178, 2, 2, 2);
insert into t1(a, b, c, d) values (179, 2, 2, 2);
insert into t1(a, b, c, d) values (180, 2, 2, 2);
insert into t1(a, b, c, d) values (181, 2, 2, 2);
insert into t1(a, b, c, d) values (182, 2, 2, 2);
insert into t1(a, b, c, d) values (183, 2, 2, 2);
insert into t1(a, b, c, d) values (184, 2, 2, 2);
insert into t1(a, b, c, d) values (185, 2, 2, 2);
insert into t1(a, b, c, d) values (186, 2, 2, 2);
insert into t1(a, b, c, d) values (187, 2, 2, 2);
insert into t1(a, b, c, d) values (188, 2, 2, 2);
insert into t1(a, b, c, d) values (189, 2, 2, 2);
insert into t1(a, b, c, d) values (190, 2, 2, 2);
insert into t1(a, b, c, d) values (191, 2, 2, 2);
insert into t1(a, b, c, d) values (192, 2, 2, 2);
insert into t1(a, b, c, d) values (193, 2, 2, 2);
insert into t1(a, b, c, d) values (194, 2, 2, 2);
insert into t1(a, b, c, d) values (195, 2, 2, 2);
insert into t1(a, b, c, d) values (196, 2, 2, 2);
insert into t1(a, b, c, d) values (197, 2, 2, 2);
insert into t1(a, b, c, d) values (198, 2, 2, 2);
insert into t1(a, b, c, d) values (199, 2, 2, 2);
insert into t1(a, b, c, d) values (200, 3, 3, 3);
insert into t1(a, b, c, d) values (201, 3, 3, 3);
insert into t1(a, b, c, d) values (202, 3, 3, 3);
insert into t1(a, b, c, d) values (203, 3, 3, 3);
insert into t1(a, b, c, d) values (204, 3, 3, 3);
insert into t1(a, b, c, d) values (205, 3, 3, 3);
insert into t1(a, b, c, d) values (206, 3, 3, 3);
insert into t1(a, b, c, d) values (207, 3, 3, 3);
insert into t1(a, b, c, d) values (208, 3, 3, 3);
insert into t1(a, b, c, d) values (209, 3, 3, 3);
insert into t1(a, b, c, d) values (210, 3, 3, 3);
insert into t1(a, b, c, d) values (211, 3, 3, 3);
insert into t1(a, b, c, d) values (212, 3, 3, 3);
insert into t1(a, b, c, d) values (213, 3, 3, 3);
insert into t1(a, b, c, d) values (214, 3, 3, 3);
insert into t1(a, b, c, d) values (215, 3, 3, 3);
insert into t1(a, b, c, d) values (216, 3, 3, 3);
insert into t1(a, b, c, d) values (217, 3, 3, 3);
insert into t1(a, b, c, d) values (218, 3, 3, 3);
insert into t1(a, b, c, d) values (219, 3, 3, 3);
insert into t1(a, b, c, d) values (220, 3, 3, 3);
insert into t1(a, b, c, d) values (221, 3, 3, 3);
insert into t1(a, b, c, d) values (222, 3, 3, 3);
insert into t1(a, b, c, d) values (223, 3, 3, 3);
insert into t1(a, b, c, d) values (224, 3, 3, 3);
insert into t1(a, b, c, d) values (225, 3, 3, 3);
insert into t1(a, b, c, d) values (226, 3, 3, 3);
insert into t1(a, b, c, d) values (227, 3, 3, 3);
insert into t1(a, b, c, d) values (228, 3, 3, 3);
insert into t1(a, b, c, d) values (229, 3, 3, 3);
insert into t1(a, b, c, d) values (230, 3, 3, 3);
insert into t1(a, b, c, d) values (231, 3, 3, 3);
insert into t1(a, b, c, d) values (232, 3, 3, 3);
insert into t1(a, b, c, d) values (233, 3, 3, 3);
insert into t1(a, b, c, d) values (234, 3, 3, 3);
insert into t1(a, b, c, d) values (235, 3, 3, 3);
insert into t1(a, b, c, d) values (236, 3, 3, 3);
insert into t1(a, b, c, d) values (237, 3, 3, 3);
insert into t1(a, b, c, d) values (238, 3, 3, 3);
insert into t1(a, b, c, d) values (239, 3, 3, 3);
insert into t1(a, b, c, d) values (240, 3, 3, 3);
insert into t1(a, b, c, d) values (241, 3, 3, 3);
insert into t1(a, b, c, d) values (242, 3, 3, 3);
insert into t1(a, b, c, d) values (243, 3, 3, 3);
insert into t1(a, b, c, d) values (244, 3, 3, 3);
insert into t1(a, b, c, d) values (245, 3, 3, 3);
insert into t1(a, b, c, d) values (246, 3, 3, 3);
insert into t1(a, b, c, d) values (247, 3, 3, 3);
insert into t1(a, b, c, d) values (248, 3, 3, 3);
insert into t1(a, b, c, d) values (249, 3, 3, 3);
insert into t1(a, b, c, d) values (250, 3, 3, 3);
insert into t1(a, b, c, d) values (251, 3, 3, 3);
insert into t1(a, b, c, d) values (252, 3, 3, 3);
insert into t1(a, b, c, d) values (253, 3, 3, 3);
insert into t1(a, b, c, d) values (254, 3, 3, 3);
insert into t1(a, b, c, d) values (255, 3, 3, 3);
insert into t1(a, b, c, d) values (256, 3, 3, 3);
insert into t1(a, b, c, d) values (257, 3, 3, 3);
insert into t1(a, b, c, d) values (258, 3, 3, 3);
insert into t1(a, b, c, d) values (259, 3, 3, 3);
insert into t1(a, b, c, d) values (260, 3, 3, 3);
insert into t1(a, b, c, d) values (261, 3, 3, 3);
insert into t1(a, b, c, d) values (262, 3, 3, 3);
insert into t1(a, b, c, d) values (263, 3, 3, 3);
insert into t1(a, b, c, d) values (264, 3, 3, 3);
insert into t1(a, b, c, d) values (265, 3, 3, 3);
insert into t1(a, b, c, d) values (266, 3, 3, 3);
insert into t1(a, b, c, d) values (267, 3, 3, 3);
insert into t1(a, b, c, d) values (268, 3, 3, 3);
insert into t1(a, b, c, d) values (269, 3, 3, 3);
insert into t1(a, b, c, d) values (270, 3, 3, 3);
insert into t1(a, b, c, d) values (271, 3, 3, 3);
insert into t1(a, b, c, d) values (272, 3, 3, 3);
insert into t1(a, b, c, d) values (273, 3, 3, 3);
insert into t1(a, b, c, d) values (274, 3, 3, 3);
insert into t1(a, b, c, d) values (275, 3, 3, 3);
insert into t1(a, b, c, d) values (276, 3, 3, 3);
insert into t1(a, b, c, d) values (277, 3, 3, 3);
insert into t1(a, b, c, d) values (278, 3, 3, 3);
insert into t1(a, b, c, d) values (279, 3, 3, 3);
insert into t1(a, b, c, d) values (280, 3, 3, 3);
insert into t1(a, b, c, d) values (281, 3, 3, 3);
insert into t1(a, b, c, d) values (282, 3, 3, 3);
insert into t1(a, b, c, d) values (283, 3, 3, 3);
insert into t1(a, b, c, d) values (284, 3, 3, 3);
insert into t1(a, b, c, d) values (285, 3, 3, 3);
insert into t1(a, b, c, d) values (286, 3, 3, 3);
insert into t1(a, b, c, d) values (287, 3, 3, 3);
insert into t1(a, b, c, d) values (288, 3, 3, 3);
insert into t1(a, b, c, d) values (289, 3, 3, 3);
insert into t1(a, b, c, d) values (290, 3, 3, 3);
insert into t1(a, b, c, d) values (291, 3, 3, 3);
insert into t1(a, b, c, d) values (292, 3, 3, 3);
insert into t1(a, b, c, d) values (293, 3, 3, 3);
insert into t1(a, b, c, d) values (294, 3, 3, 3);
insert into t1(a, b, c, d) values (295, 3, 3, 3);
insert into t1(a, b, c, d) values (296, 3, 3, 3);
insert into t1(a, b, c, d) values (297, 3, 3, 3);
insert into t1(a, b, c, d) values (298, 3, 3, 3);
insert into t1(a, b, c, d) values (299, 3, 3, 3);
select count(*) from t1;
count(*)
300
explain select * from t1;
Query Plan
===================================
|ID|OPERATOR  |NAME|EST. ROWS|COST|
-----------------------------------
|0 |TABLE SCAN|t1  |300      |140 |
===================================

Outputs & filters: 
-------------------------------------
  0 - output([t1.a], [t1.b], [t1.c], [t1.d]), filter(nil), 
      access([t1.a], [t1.b], [t1.c], [t1.d]), partitions(p0)

select count(*) from t1 where b = 1;
count(*)
100
explain select/*+index(t1 idx_b)*/ * from t1 where b = 1;
Query Plan
========================================
|ID|OPERATOR  |NAME     |EST. ROWS|COST|
----------------------------------------
|0 |TABLE SCAN|t1(idx_b)|100      |621 |
========================================

Outputs & filters: 
-------------------------------------
  0 - output([t1.a], [t1.b], [t1.c], [t1.d]), filter(nil), 
      access([t1.b], [t1.a], [t1.c], [t1.d]), partitions(p0)

select count(*) from t1 where c >= 2;
count(*)
200
explain select/*+index(t1 idx_c)*/ * from t1 where c >= 2;
Query Plan
========================================
|ID|OPERATOR  |NAME     |EST. ROWS|COST|
----------------------------------------
|0 |TABLE SCAN|t1(idx_c)|200      |1159|
========================================

Outputs & filters: 
-------------------------------------
  0 - output([t1.a], [t1.b], [t1.c], [t1.d]), filter(nil), 
      access([t1.c], [t1.a], [t1.b], [t1.d]), partitions(p0)

select count(*) from t1 where d < 3;
count(*)
200
explain select/*+index(t1 idx_d)*/ * from t1 where d < 3;
Query Plan
========================================
|ID|OPERATOR  |NAME     |EST. ROWS|COST|
----------------------------------------
|0 |TABLE SCAN|t1(idx_d)|200      |1159|
========================================

Outputs & filters: 
-------------------------------------
  0 - output([t1.a], [t1.b], [t1.c], [t1.d]), filter(nil), 
      access([t1.d], [t1.a], [t1.b], [t1.c]), partitions(p0)

insert into t1(a, b, c, d) values (300, 1, 1, 1);
insert into t1(a, b, c, d) values (301, 1, 1, 1);
insert into t1(a, b, c, d) values (302, 1, 1, 1);
insert into t1(a, b, c, d) values (303, 1, 1, 1);
insert into t1(a, b, c, d) values (304, 1, 1, 1);
insert into t1(a, b, c, d) values (305, 1, 1, 1);
insert into t1(a, b, c, d) values (306, 1, 1, 1);
insert into t1(a, b, c, d) values (307, 1, 1, 1);
insert into t1(a, b, c, d) values (308, 1, 1, 1);
insert into t1(a, b, c, d) values (309, 1, 1, 1);
insert into t1(a, b, c, d) values (310, 1, 1, 1);
insert into t1(a, b, c, d) values (311, 1, 1, 1);
insert into t1(a, b, c, d) values (312, 1, 1, 1);
insert into t1(a, b, c, d) values (313, 1, 1, 1);
insert into t1(a, b, c, d) values (314, 1, 1, 1);
insert into t1(a, b, c, d) values (315, 1, 1, 1);
insert into t1(a, b, c, d) values (316, 1, 1, 1);
insert into t1(a, b, c, d) values (317, 1, 1, 1);
insert into t1(a, b, c, d) values (318, 1, 1, 1);
insert into t1(a, b, c, d) values (319, 1, 1, 1);
insert into t1(a, b, c, d) values (320, 1, 1, 1);
insert into t1(a, b, c, d) values (321, 1, 1, 1);
insert into t1(a, b, c, d) values (322, 1, 1, 1);
insert into t1(a, b, c, d) values (323, 1, 1, 1);
insert into t1(a, b, c, d) values (324, 1, 1, 1);
insert into t1(a, b, c, d) values (325, 1, 1, 1);
insert into t1(a, b, c, d) values (326, 1, 1, 1);
insert into t1(a, b, c, d) values (327, 1, 1, 1);
insert into t1(a, b, c, d) values (328, 1, 1, 1);
insert into t1(a, b, c, d) values (329, 1, 1, 1);
insert into t1(a, b, c, d) values (330, 1, 1, 1);
insert into t1(a, b, c, d) values (331, 1, 1, 1);
insert into t1(a, b, c, d) values (332, 1, 1, 1);
insert into t1(a, b, c, d) values (333, 1, 1, 1);
insert into t1(a, b, c, d) values (334, 1, 1, 1);
insert into t1(a, b, c, d) values (335, 1, 1, 1);
insert into t1(a, b, c, d) values (336, 1, 1, 1);
insert into t1(a, b, c, d) values (337, 1, 1, 1);
insert into t1(a, b, c, d) values (338, 1, 1, 1);
insert into t1(a, b, c, d) values (339, 1, 1, 1);
insert into t1(a, b, c, d) values (340, 1, 1, 1);
insert into t1(a, b, c, d) values (341, 1, 1, 1);
insert into t1(a, b, c, d) values (342, 1, 1, 1);
insert into t1(a, b, c, d) values (343, 1, 1, 1);
insert into t1(a, b, c, d) values (344, 1, 1, 1);
insert into t1(a, b, c, d) values (345, 1, 1, 1);
insert into t1(a, b, c, d) values (346, 1, 1, 1);
insert into t1(a, b, c, d) values (347, 1, 1, 1);
insert into t1(a, b, c, d) values (348, 1, 1, 1);
insert into t1(a, b, c, d) values (349, 1, 1, 1);
insert into t1(a, b, c, d) values (350, 1, 1, 1);
insert into t1(a, b, c, d) values (351, 1, 1, 1);
insert into t1(a, b, c, d) values (352, 1, 1, 1);
insert into t1(a, b, c, d) values (353, 1, 1, 1);
insert into t1(a, b, c, d) values (354, 1, 1, 1);
insert into t1(a, b, c, d) values (355, 1, 1, 1);
insert into t1(a, b, c, d) values (356, 1, 1, 1);
insert into t1(a, b, c, d) values (357, 1, 1, 1);
insert into t1(a, b, c, d) values (358, 1, 1, 1);
insert into t1(a, b, c, d) values (359, 1, 1, 1);
insert into t1(a, b, c, d) values (360, 1, 1, 1);
insert into t1(a, b, c, d) values (361, 1, 1, 1);
insert into t1(a, b, c, d) values (362, 1, 1, 1);
insert into t1(a, b, c, d) values (363, 1, 1, 1);
insert into t1(a, b, c, d) values (364, 1, 1, 1);
insert into t1(a, b, c, d) values (365, 1, 1, 1);
insert into t1(a, b, c, d) values (366, 1, 1, 1);
insert into t1(a, b, c, d) values (367, 1, 1, 1);
insert into t1(a, b, c, d) values (368, 1, 1, 1);
insert into t1(a, b, c, d) values (369, 1, 1, 1);
insert into t1(a, b, c, d) values (370, 1, 1, 1);
insert into t1(a, b, c, d) values (371, 1, 1, 1);
insert into t1(a, b, c, d) values (372, 1, 1, 1);
insert into t1(a, b, c, d) values (373, 1, 1, 1);
insert into t1(a, b, c, d) values (374, 1, 1, 1);
insert into t1(a, b, c, d) values (375, 1, 1, 1);
insert into t1(a, b, c, d) values (376, 1, 1, 1);
insert into t1(a, b, c, d) values (377, 1, 1, 1);
insert into t1(a, b, c, d) values (378, 1, 1, 1);
insert into t1(a, b, c, d) values (379, 1, 1, 1);
insert into t1(a, b, c, d) values (380, 1, 1, 1);
insert into t1(a, b, c, d) values (381, 1, 1, 1);
insert into t1(a, b, c, d) values (382, 1, 1, 1);
insert into t1(a, b, c, d) values (383, 1, 1, 1);
insert into t1(a, b, c, d) values (384, 1, 1, 1);
insert into t1(a, b, c, d) values (385, 1, 1, 1);
insert into t1(a, b, c, d) values (386, 1, 1, 1);
insert into t1(a, b, c, d) values (387, 1, 1, 1);
insert into t1(a, b, c, d) values (388, 1, 1, 1);
insert into t1(a, b, c, d) values (389, 1, 1, 1);
insert into t1(a, b, c, d) values (390, 1, 1, 1);
insert into t1(a, b, c, d) values (391, 1, 1, 1);
insert into t1(a, b, c, d) values (392, 1, 1, 1);
insert into t1(a, b, c, d) values (393, 1, 1, 1);
insert into t1(a, b, c, d) values (394, 1, 1, 1);
insert into t1(a, b, c, d) values (395, 1, 1, 1);
insert into t1(a, b, c, d) values (396, 1, 1, 1);
insert into t1(a, b, c, d) values (397, 1, 1, 1);
insert into t1(a, b, c, d) values (398, 1, 1, 1);
insert into t1(a, b, c, d) values (399, 1, 1, 1);
select count(*) from t1;
count(*)
400
explain select * from t1;
Query Plan
===================================
|ID|OPERATOR  |NAME|EST. ROWS|COST|
-----------------------------------
|0 |TABLE SCAN|t1  |400      |198 |
===================================

Outputs & filters: 
-------------------------------------
  0 - output([t1.a], [t1.b], [t1.c], [t1.d]), filter(nil), 
      access([t1.a], [t1.b], [t1.c], [t1.d]), partitions(p0)

select count(*) from t1 where b = 1;
count(*)
200
explain select/*+index(t1 idx_b)*/ * from t1 where b = 1;
Query Plan
========================================
|ID|OPERATOR  |NAME     |EST. ROWS|COST|
----------------------------------------
|0 |TABLE SCAN|t1(idx_b)|200      |1159|
========================================

Outputs & filters: 
-------------------------------------
  0 - output([t1.a], [t1.b], [t1.c], [t1.d]), filter(nil), 
      access([t1.b], [t1.a], [t1.c], [t1.d]), partitions(p0)

select count(*) from t1 where c >= 2;
count(*)
200
explain select/*+index(t1 idx_c)*/ * from t1 where c >= 2;
Query Plan
========================================
|ID|OPERATOR  |NAME     |EST. ROWS|COST|
----------------------------------------
|0 |TABLE SCAN|t1(idx_c)|200      |1159|
========================================

Outputs & filters: 
-------------------------------------
  0 - output([t1.a], [t1.b], [t1.c], [t1.d]), filter(nil), 
      access([t1.c], [t1.a], [t1.b], [t1.d]), partitions(p0)

select count(*) from t1 where d < 3;
count(*)
300
explain select/*+index(t1 idx_d)*/ * from t1 where d < 3;
Query Plan
========================================
|ID|OPERATOR  |NAME     |EST. ROWS|COST|
----------------------------------------
|0 |TABLE SCAN|t1(idx_d)|300      |1698|
========================================

Outputs & filters: 
-------------------------------------
  0 - output([t1.a], [t1.b], [t1.c], [t1.d]), filter(nil), 
      access([t1.d], [t1.a], [t1.b], [t1.c]), partitions(p0)

update t1 set b = 3, c = 3, d = 3 where b = 1 and c = 1 and d = 1;
select count(*) from t1;
count(*)
400
explain select * from t1;
Query Plan
===================================
|ID|OPERATOR  |NAME|EST. ROWS|COST|
-----------------------------------
|0 |TABLE SCAN|t1  |400      |198 |
===================================

Outputs & filters: 
-------------------------------------
  0 - output([t1.a], [t1.b], [t1.c], [t1.d]), filter(nil), 
      access([t1.a], [t1.b], [t1.c], [t1.d]), partitions(p0)

select count(*) from t1 where b = 1;
count(*)
0
explain select/*+index(t1 idx_b)*/ * from t1 where b = 1;
Query Plan
========================================
|ID|OPERATOR  |NAME     |EST. ROWS|COST|
----------------------------------------
|0 |TABLE SCAN|t1(idx_b)|0        |10  |
========================================

Outputs & filters: 
-------------------------------------
  0 - output([t1.a], [t1.b], [t1.c], [t1.d]), filter(nil), 
      access([t1.b], [t1.a], [t1.c], [t1.d]), partitions(p0)

select count(*) from t1 where c >= 2;
count(*)
400
explain select/*+index(t1 idx_c)*/ * from t1 where c >= 2;
Query Plan
========================================
|ID|OPERATOR  |NAME     |EST. ROWS|COST|
----------------------------------------
|0 |TABLE SCAN|t1(idx_c)|400      |2318|
========================================

Outputs & filters: 
-------------------------------------
  0 - output([t1.a], [t1.b], [t1.c], [t1.d]), filter(nil), 
      access([t1.c], [t1.a], [t1.b], [t1.d]), partitions(p0)

select count(*) from t1 where d < 3;
count(*)
100
explain select/*+index(t1 idx_d)*/ * from t1 where d < 3;
Query Plan
========================================
|ID|OPERATOR  |NAME     |EST. ROWS|COST|
----------------------------------------
|0 |TABLE SCAN|t1(idx_d)|100      |621 |
========================================

Outputs & filters: 
-------------------------------------
  0 - output([t1.a], [t1.b], [t1.c], [t1.d]), filter(nil), 
      access([t1.d], [t1.a], [t1.b], [t1.c]), partitions(p0)

delete from t1 where b = 2 and c = 2 and d = 2;
select count(*) from t1;
count(*)
300
explain select * from t1;
Query Plan
===================================
|ID|OPERATOR  |NAME|EST. ROWS|COST|
-----------------------------------
|0 |TABLE SCAN|t1  |300      |140 |
===================================

Outputs & filters: 
-------------------------------------
  0 - output([t1.a], [t1.b], [t1.c], [t1.d]), filter(nil), 
      access([t1.a], [t1.b], [t1.c], [t1.d]), partitions(p0)

select count(*) from t1 where b = 1;
count(*)
0
explain select/*+index(t1 idx_b)*/ * from t1 where b = 1;
Query Plan
========================================
|ID|OPERATOR  |NAME     |EST. ROWS|COST|
----------------------------------------
|0 |TABLE SCAN|t1(idx_b)|0        |10  |
========================================

Outputs & filters: 
-------------------------------------
  0 - output([t1.a], [t1.b], [t1.c], [t1.d]), filter(nil), 
      access([t1.b], [t1.a], [t1.c], [t1.d]), partitions(p0)

select count(*) from t1 where c >= 2;
count(*)
300
explain select/*+index(t1 idx_c)*/ * from t1 where c >= 2;
Query Plan
========================================
|ID|OPERATOR  |NAME     |EST. ROWS|COST|
----------------------------------------
|0 |TABLE SCAN|t1(idx_c)|300      |1698|
========================================

Outputs & filters: 
-------------------------------------
  0 - output([t1.a], [t1.b], [t1.c], [t1.d]), filter(nil), 
      access([t1.c], [t1.a], [t1.b], [t1.d]), partitions(p0)

select count(*) from t1 where d < 3;
count(*)
0
explain select/*+index(t1 idx_d)*/ * from t1 where d < 3;
Query Plan
========================================
|ID|OPERATOR  |NAME     |EST. ROWS|COST|
----------------------------------------
|0 |TABLE SCAN|t1(idx_d)|0        |10  |
========================================

Outputs & filters: 
-------------------------------------
  0 - output([t1.a], [t1.b], [t1.c], [t1.d]), filter(nil), 
      access([t1.d], [t1.a], [t1.b], [t1.c]), partitions(p0)

drop table t1;
insert into t2(a, b, c, d) values (0, 1, 1, 1);
insert into t2(a, b, c, d) values (1, 1, 1, 1);
insert into t2(a, b, c, d) values (2, 1, 1, 1);
insert into t2(a, b, c, d) values (3, 1, 1, 1);
insert into t2(a, b, c, d) values (4, 1, 1, 1);
insert into t2(a, b, c, d) values (5, 1, 1, 1);
insert into t2(a, b, c, d) values (6, 1, 1, 1);
insert into t2(a, b, c, d) values (7, 1, 1, 1);
insert into t2(a, b, c, d) values (8, 1, 1, 1);
insert into t2(a, b, c, d) values (9, 1, 1, 1);
insert into t2(a, b, c, d) values (10, 1, 1, 1);
insert into t2(a, b, c, d) values (11, 1, 1, 1);
insert into t2(a, b, c, d) values (12, 1, 1, 1);
insert into t2(a, b, c, d) values (13, 1, 1, 1);
insert into t2(a, b, c, d) values (14, 1, 1, 1);
insert into t2(a, b, c, d) values (15, 1, 1, 1);
insert into t2(a, b, c, d) values (16, 1, 1, 1);
insert into t2(a, b, c, d) values (17, 1, 1, 1);
insert into t2(a, b, c, d) values (18, 1, 1, 1);
insert into t2(a, b, c, d) values (19, 1, 1, 1);
insert into t2(a, b, c, d) values (20, 1, 1, 1);
insert into t2(a, b, c, d) values (21, 1, 1, 1);
insert into t2(a, b, c, d) values (22, 1, 1, 1);
insert into t2(a, b, c, d) values (23, 1, 1, 1);
insert into t2(a, b, c, d) values (24, 1, 1, 1);
insert into t2(a, b, c, d) values (25, 1, 1, 1);
insert into t2(a, b, c, d) values (26, 1, 1, 1);
insert into t2(a, b, c, d) values (27, 1, 1, 1);
insert into t2(a, b, c, d) values (28, 1, 1, 1);
insert into t2(a, b, c, d) values (29, 1, 1, 1);
insert into t2(a, b, c, d) values (30, 1, 1, 1);
insert into t2(a, b, c, d) values (31, 1, 1, 1);
insert into t2(a, b, c, d) values (32, 1, 1, 1);
insert into t2(a, b, c, d) values (33, 1, 1, 1);
insert into t2(a, b, c, d) values (34, 1, 1, 1);
insert into t2(a, b, c, d) values (35, 1, 1, 1);
insert into t2(a, b, c, d) values (36, 1, 1, 1);
insert into t2(a, b, c, d) values (37, 1, 1, 1);
insert into t2(a, b, c, d) values (38, 1, 1, 1);
insert into t2(a, b, c, d) values (39, 1, 1, 1);
insert into t2(a, b, c, d) values (40, 1, 1, 1);
insert into t2(a, b, c, d) values (41, 1, 1, 1);
insert into t2(a, b, c, d) values (42, 1, 1, 1);
insert into t2(a, b, c, d) values (43, 1, 1, 1);
insert into t2(a, b, c, d) values (44, 1, 1, 1);
insert into t2(a, b, c, d) values (45, 1, 1, 1);
insert into t2(a, b, c, d) values (46, 1, 1, 1);
insert into t2(a, b, c, d) values (47, 1, 1, 1);
insert into t2(a, b, c, d) values (48, 1, 1, 1);
insert into t2(a, b, c, d) values (49, 1, 1, 1);
insert into t2(a, b, c, d) values (50, 1, 1, 1);
insert into t2(a, b, c, d) values (51, 1, 1, 1);
insert into t2(a, b, c, d) values (52, 1, 1, 1);
insert into t2(a, b, c, d) values (53, 1, 1, 1);
insert into t2(a, b, c, d) values (54, 1, 1, 1);
insert into t2(a, b, c, d) values (55, 1, 1, 1);
insert into t2(a, b, c, d) values (56, 1, 1, 1);
insert into t2(a, b, c, d) values (57, 1, 1, 1);
insert into t2(a, b, c, d) values (58, 1, 1, 1);
insert into t2(a, b, c, d) values (59, 1, 1, 1);
insert into t2(a, b, c, d) values (60, 1, 1, 1);
insert into t2(a, b, c, d) values (61, 1, 1, 1);
insert into t2(a, b, c, d) values (62, 1, 1, 1);
insert into t2(a, b, c, d) values (63, 1, 1, 1);
insert into t2(a, b, c, d) values (64, 1, 1, 1);
insert into t2(a, b, c, d) values (65, 1, 1, 1);
insert into t2(a, b, c, d) values (66, 1, 1, 1);
insert into t2(a, b, c, d) values (67, 1, 1, 1);
insert into t2(a, b, c, d) values (68, 1, 1, 1);
insert into t2(a, b, c, d) values (69, 1, 1, 1);
insert into t2(a, b, c, d) values (70, 1, 1, 1);
insert into t2(a, b, c, d) values (71, 1, 1, 1);
insert into t2(a, b, c, d) values (72, 1, 1, 1);
insert into t2(a, b, c, d) values (73, 1, 1, 1);
insert into t2(a, b, c, d) values (74, 1, 1, 1);
insert into t2(a, b, c, d) values (75, 1, 1, 1);
insert into t2(a, b, c, d) values (76, 1, 1, 1);
insert into t2(a, b, c, d) values (77, 1, 1, 1);
insert into t2(a, b, c, d) values (78, 1, 1, 1);
insert into t2(a, b, c, d) values (79, 1, 1, 1);
insert into t2(a, b, c, d) values (80, 1, 1, 1);
insert into t2(a, b, c, d) values (81, 1, 1, 1);
insert into t2(a, b, c, d) values (82, 1, 1, 1);
insert into t2(a, b, c, d) values (83, 1, 1, 1);
insert into t2(a, b, c, d) values (84, 1, 1, 1);
insert into t2(a, b, c, d) values (85, 1, 1, 1);
insert into t2(a, b, c, d) values (86, 1, 1, 1);
insert into t2(a, b, c, d) values (87, 1, 1, 1);
insert into t2(a, b, c, d) values (88, 1, 1, 1);
insert into t2(a, b, c, d) values (89, 1, 1, 1);
insert into t2(a, b, c, d) values (90, 1, 1, 1);
insert into t2(a, b, c, d) values (91, 1, 1, 1);
insert into t2(a, b, c, d) values (92, 1, 1, 1);
insert into t2(a, b, c, d) values (93, 1, 1, 1);
insert into t2(a, b, c, d) values (94, 1, 1, 1);
insert into t2(a, b, c, d) values (95, 1, 1, 1);
insert into t2(a, b, c, d) values (96, 1, 1, 1);
insert into t2(a, b, c, d) values (97, 1, 1, 1);
insert into t2(a, b, c, d) values (98, 1, 1, 1);
insert into t2(a, b, c, d) values (99, 1, 1, 1);
insert into t2(a, b, c, d) values (100, 2, 2, 2);
insert into t2(a, b, c, d) values (101, 2, 2, 2);
insert into t2(a, b, c, d) values (102, 2, 2, 2);
insert into t2(a, b, c, d) values (103, 2, 2, 2);
insert into t2(a, b, c, d) values (104, 2, 2, 2);
insert into t2(a, b, c, d) values (105, 2, 2, 2);
insert into t2(a, b, c, d) values (106, 2, 2, 2);
insert into t2(a, b, c, d) values (107, 2, 2, 2);
insert into t2(a, b, c, d) values (108, 2, 2, 2);
insert into t2(a, b, c, d) values (109, 2, 2, 2);
insert into t2(a, b, c, d) values (110, 2, 2, 2);
insert into t2(a, b, c, d) values (111, 2, 2, 2);
insert into t2(a, b, c, d) values (112, 2, 2, 2);
insert into t2(a, b, c, d) values (113, 2, 2, 2);
insert into t2(a, b, c, d) values (114, 2, 2, 2);
insert into t2(a, b, c, d) values (115, 2, 2, 2);
insert into t2(a, b, c, d) values (116, 2, 2, 2);
insert into t2(a, b, c, d) values (117, 2, 2, 2);
insert into t2(a, b, c, d) values (118, 2, 2, 2);
insert into t2(a, b, c, d) values (119, 2, 2, 2);
insert into t2(a, b, c, d) values (120, 2, 2, 2);
insert into t2(a, b, c, d) values (121, 2, 2, 2);
insert into t2(a, b, c, d) values (122, 2, 2, 2);
insert into t2(a, b, c, d) values (123, 2, 2, 2);
insert into t2(a, b, c, d) values (124, 2, 2, 2);
insert into t2(a, b, c, d) values (125, 2, 2, 2);
insert into t2(a, b, c, d) values (126, 2, 2, 2);
insert into t2(a, b, c, d) values (127, 2, 2, 2);
insert into t2(a, b, c, d) values (128, 2, 2, 2);
insert into t2(a, b, c, d) values (129, 2, 2, 2);
insert into t2(a, b, c, d) values (130, 2, 2, 2);
insert into t2(a, b, c, d) values (131, 2, 2, 2);
insert into t2(a, b, c, d) values (132, 2, 2, 2);
insert into t2(a, b, c, d) values (133, 2, 2, 2);
insert into t2(a, b, c, d) values (134, 2, 2, 2);
insert into t2(a, b, c, d) values (135, 2, 2, 2);
insert into t2(a, b, c, d) values (136, 2, 2, 2);
insert into t2(a, b, c, d) values (137, 2, 2, 2);
insert into t2(a, b, c, d) values (138, 2, 2, 2);
insert into t2(a, b, c, d) values (139, 2, 2, 2);
insert into t2(a, b, c, d) values (140, 2, 2, 2);
insert into t2(a, b, c, d) values (141, 2, 2, 2);
insert into t2(a, b, c, d) values (142, 2, 2, 2);
insert into t2(a, b, c, d) values (143, 2, 2, 2);
insert into t2(a, b, c, d) values (144, 2, 2, 2);
insert into t2(a, b, c, d) values (145, 2, 2, 2);
insert into t2(a, b, c, d) values (146, 2, 2, 2);
insert into t2(a, b, c, d) values (147, 2, 2, 2);
insert into t2(a, b, c, d) values (148, 2, 2, 2);
insert into t2(a, b, c, d) values (149, 2, 2, 2);
insert into t2(a, b, c, d) values (150, 2, 2, 2);
insert into t2(a, b, c, d) values (151, 2, 2, 2);
insert into t2(a, b, c, d) values (152, 2, 2, 2);
insert into t2(a, b, c, d) values (153, 2, 2, 2);
insert into t2(a, b, c, d) values (154, 2, 2, 2);
insert into t2(a, b, c, d) values (155, 2, 2, 2);
insert into t2(a, b, c, d) values (156, 2, 2, 2);
insert into t2(a, b, c, d) values (157, 2, 2, 2);
insert into t2(a, b, c, d) values (158, 2, 2, 2);
insert into t2(a, b, c, d) values (159, 2, 2, 2);
insert into t2(a, b, c, d) values (160, 2, 2, 2);
insert into t2(a, b, c, d) values (161, 2, 2, 2);
insert into t2(a, b, c, d) values (162, 2, 2, 2);
insert into t2(a, b, c, d) values (163, 2, 2, 2);
insert into t2(a, b, c, d) values (164, 2, 2, 2);
insert into t2(a, b, c, d) values (165, 2, 2, 2);
insert into t2(a, b, c, d) values (166, 2, 2, 2);
insert into t2(a, b, c, d) values (167, 2, 2, 2);
insert into t2(a, b, c, d) values (168, 2, 2, 2);
insert into t2(a, b, c, d) values (169, 2, 2, 2);
insert into t2(a, b, c, d) values (170, 2, 2, 2);
insert into t2(a, b, c, d) values (171, 2, 2, 2);
insert into t2(a, b, c, d) values (172, 2, 2, 2);
insert into t2(a, b, c, d) values (173, 2, 2, 2);
insert into t2(a, b, c, d) values (174, 2, 2, 2);
insert into t2(a, b, c, d) values (175, 2, 2, 2);
insert into t2(a, b, c, d) values (176, 2, 2, 2);
insert into t2(a, b, c, d) values (177, 2, 2, 2);
insert into t2(a, b, c, d) values (178, 2, 2, 2);
insert into t2(a, b, c, d) values (179, 2, 2, 2);
insert into t2(a, b, c, d) values (180, 2, 2, 2);
insert into t2(a, b, c, d) values (181, 2, 2, 2);
insert into t2(a, b, c, d) values (182, 2, 2, 2);
insert into t2(a, b, c, d) values (183, 2, 2, 2);
insert into t2(a, b, c, d) values (184, 2, 2, 2);
insert into t2(a, b, c, d) values (185, 2, 2, 2);
insert into t2(a, b, c, d) values (186, 2, 2, 2);
insert into t2(a, b, c, d) values (187, 2, 2, 2);
insert into t2(a, b, c, d) values (188, 2, 2, 2);
insert into t2(a, b, c, d) values (189, 2, 2, 2);
insert into t2(a, b, c, d) values (190, 2, 2, 2);
insert into t2(a, b, c, d) values (191, 2, 2, 2);
insert into t2(a, b, c, d) values (192, 2, 2, 2);
insert into t2(a, b, c, d) values (193, 2, 2, 2);
insert into t2(a, b, c, d) values (194, 2, 2, 2);
insert into t2(a, b, c, d) values (195, 2, 2, 2);
insert into t2(a, b, c, d) values (196, 2, 2, 2);
insert into t2(a, b, c, d) values (197, 2, 2, 2);
insert into t2(a, b, c, d) values (198, 2, 2, 2);
insert into t2(a, b, c, d) values (199, 2, 2, 2);
insert into t2(a, b, c, d) values (200, 3, 3, 3);
insert into t2(a, b, c, d) values (201, 3, 3, 3);
insert into t2(a, b, c, d) values (202, 3, 3, 3);
insert into t2(a, b, c, d) values (203, 3, 3, 3);
insert into t2(a, b, c, d) values (204, 3, 3, 3);
insert into t2(a, b, c, d) values (205, 3, 3, 3);
insert into t2(a, b, c, d) values (206, 3, 3, 3);
insert into t2(a, b, c, d) values (207, 3, 3, 3);
insert into t2(a, b, c, d) values (208, 3, 3, 3);
insert into t2(a, b, c, d) values (209, 3, 3, 3);
insert into t2(a, b, c, d) values (210, 3, 3, 3);
insert into t2(a, b, c, d) values (211, 3, 3, 3);
insert into t2(a, b, c, d) values (212, 3, 3, 3);
insert into t2(a, b, c, d) values (213, 3, 3, 3);
insert into t2(a, b, c, d) values (214, 3, 3, 3);
insert into t2(a, b, c, d) values (215, 3, 3, 3);
insert into t2(a, b, c, d) values (216, 3, 3, 3);
insert into t2(a, b, c, d) values (217, 3, 3, 3);
insert into t2(a, b, c, d) values (218, 3, 3, 3);
insert into t2(a, b, c, d) values (219, 3, 3, 3);
insert into t2(a, b, c, d) values (220, 3, 3, 3);
insert into t2(a, b, c, d) values (221, 3, 3, 3);
insert into t2(a, b, c, d) values (222, 3, 3, 3);
insert into t2(a, b, c, d) values (223, 3, 3, 3);
insert into t2(a, b, c, d) values (224, 3, 3, 3);
insert into t2(a, b, c, d) values (225, 3, 3, 3);
insert into t2(a, b, c, d) values (226, 3, 3, 3);
insert into t2(a, b, c, d) values (227, 3, 3, 3);
insert into t2(a, b, c, d) values (228, 3, 3, 3);
insert into t2(a, b, c, d) values (229, 3, 3, 3);
insert into t2(a, b, c, d) values (230, 3, 3, 3);
insert into t2(a, b, c, d) values (231, 3, 3, 3);
insert into t2(a, b, c, d) values (232, 3, 3, 3);
insert into t2(a, b, c, d) values (233, 3, 3, 3);
insert into t2(a, b, c, d) values (234, 3, 3, 3);
insert into t2(a, b, c, d) values (235, 3, 3, 3);
insert into t2(a, b, c, d) values (236, 3, 3, 3);
insert into t2(a, b, c, d) values (237, 3, 3, 3);
insert into t2(a, b, c, d) values (238, 3, 3, 3);
insert into t2(a, b, c, d) values (239, 3, 3, 3);
insert into t2(a, b, c, d) values (240, 3, 3, 3);
insert into t2(a, b, c, d) values (241, 3, 3, 3);
insert into t2(a, b, c, d) values (242, 3, 3, 3);
insert into t2(a, b, c, d) values (243, 3, 3, 3);
insert into t2(a, b, c, d) values (244, 3, 3, 3);
insert into t2(a, b, c, d) values (245, 3, 3, 3);
insert into t2(a, b, c, d) values (246, 3, 3, 3);
insert into t2(a, b, c, d) values (247, 3, 3, 3);
insert into t2(a, b, c, d) values (248, 3, 3, 3);
insert into t2(a, b, c, d) values (249, 3, 3, 3);
insert into t2(a, b, c, d) values (250, 3, 3, 3);
insert into t2(a, b, c, d) values (251, 3, 3, 3);
insert into t2(a, b, c, d) values (252, 3, 3, 3);
insert into t2(a, b, c, d) values (253, 3, 3, 3);
insert into t2(a, b, c, d) values (254, 3, 3, 3);
insert into t2(a, b, c, d) values (255, 3, 3, 3);
insert into t2(a, b, c, d) values (256, 3, 3, 3);
insert into t2(a, b, c, d) values (257, 3, 3, 3);
insert into t2(a, b, c, d) values (258, 3, 3, 3);
insert into t2(a, b, c, d) values (259, 3, 3, 3);
insert into t2(a, b, c, d) values (260, 3, 3, 3);
insert into t2(a, b, c, d) values (261, 3, 3, 3);
insert into t2(a, b, c, d) values (262, 3, 3, 3);
insert into t2(a, b, c, d) values (263, 3, 3, 3);
insert into t2(a, b, c, d) values (264, 3, 3, 3);
insert into t2(a, b, c, d) values (265, 3, 3, 3);
insert into t2(a, b, c, d) values (266, 3, 3, 3);
insert into t2(a, b, c, d) values (267, 3, 3, 3);
insert into t2(a, b, c, d) values (268, 3, 3, 3);
insert into t2(a, b, c, d) values (269, 3, 3, 3);
insert into t2(a, b, c, d) values (270, 3, 3, 3);
insert into t2(a, b, c, d) values (271, 3, 3, 3);
insert into t2(a, b, c, d) values (272, 3, 3, 3);
insert into t2(a, b, c, d) values (273, 3, 3, 3);
insert into t2(a, b, c, d) values (274, 3, 3, 3);
insert into t2(a, b, c, d) values (275, 3, 3, 3);
insert into t2(a, b, c, d) values (276, 3, 3, 3);
insert into t2(a, b, c, d) values (277, 3, 3, 3);
insert into t2(a, b, c, d) values (278, 3, 3, 3);
insert into t2(a, b, c, d) values (279, 3, 3, 3);
insert into t2(a, b, c, d) values (280, 3, 3, 3);
insert into t2(a, b, c, d) values (281, 3, 3, 3);
insert into t2(a, b, c, d) values (282, 3, 3, 3);
insert into t2(a, b, c, d) values (283, 3, 3, 3);
insert into t2(a, b, c, d) values (284, 3, 3, 3);
insert into t2(a, b, c, d) values (285, 3, 3, 3);
insert into t2(a, b, c, d) values (286, 3, 3, 3);
insert into t2(a, b, c, d) values (287, 3, 3, 3);
insert into t2(a, b, c, d) values (288, 3, 3, 3);
insert into t2(a, b, c, d) values (289, 3, 3, 3);
insert into t2(a, b, c, d) values (290, 3, 3, 3);
insert into t2(a, b, c, d) values (291, 3, 3, 3);
insert into t2(a, b, c, d) values (292, 3, 3, 3);
insert into t2(a, b, c, d) values (293, 3, 3, 3);
insert into t2(a, b, c, d) values (294, 3, 3, 3);
insert into t2(a, b, c, d) values (295, 3, 3, 3);
insert into t2(a, b, c, d) values (296, 3, 3, 3);
insert into t2(a, b, c, d) values (297, 3, 3, 3);
insert into t2(a, b, c, d) values (298, 3, 3, 3);
insert into t2(a, b, c, d) values (299, 3, 3, 3);
alter system major freeze tenant = sys;
alter system major freeze tenant = all_user;
alter system major freeze tenant = all_meta;
select count(*) from t2;
count(*)
300
explain select * from t2;
Query Plan
===================================
|ID|OPERATOR  |NAME|EST. ROWS|COST|
-----------------------------------
|0 |TABLE SCAN|t2  |300      |104 |
===================================

Outputs & filters: 
-------------------------------------
  0 - output([t2.a], [t2.b], [t2.c], [t2.d]), filter(nil), 
      access([t2.a], [t2.b], [t2.c], [t2.d]), partitions(p0)

select count(*) from t2 where b = 1;
count(*)
100
explain select/*+index(t2 idx_b)*/ * from t2 where b = 1;
Query Plan
========================================
|ID|OPERATOR  |NAME     |EST. ROWS|COST|
----------------------------------------
|0 |TABLE SCAN|t2(idx_b)|100      |621 |
========================================

Outputs & filters: 
-------------------------------------
  0 - output([t2.a], [t2.b], [t2.c], [t2.d]), filter(nil), 
      access([t2.b], [t2.a], [t2.c], [t2.d]), partitions(p0)

select count(*) from t2 where c >= 2;
count(*)
200
explain select/*+index(t2 idx_c)*/ * from t2 where c >= 2;
Query Plan
========================================
|ID|OPERATOR  |NAME     |EST. ROWS|COST|
----------------------------------------
|0 |TABLE SCAN|t2(idx_c)|200      |1159|
========================================

Outputs & filters: 
-------------------------------------
  0 - output([t2.a], [t2.b], [t2.c], [t2.d]), filter(nil), 
      access([t2.c], [t2.a], [t2.b], [t2.d]), partitions(p0)

select count(*) from t2 where d < 3;
count(*)
200
explain select/*+index(t2 idx_d)*/ * from t2 where d < 3;
Query Plan
========================================
|ID|OPERATOR  |NAME     |EST. ROWS|COST|
----------------------------------------
|0 |TABLE SCAN|t2(idx_d)|200      |1159|
========================================

Outputs & filters: 
-------------------------------------
  0 - output([t2.a], [t2.b], [t2.c], [t2.d]), filter(nil), 
      access([t2.d], [t2.a], [t2.b], [t2.c]), partitions(p0)

insert into t2(a, b, c, d) values (300, 1, 1, 1);
insert into t2(a, b, c, d) values (301, 1, 1, 1);
insert into t2(a, b, c, d) values (302, 1, 1, 1);
insert into t2(a, b, c, d) values (303, 1, 1, 1);
insert into t2(a, b, c, d) values (304, 1, 1, 1);
insert into t2(a, b, c, d) values (305, 1, 1, 1);
insert into t2(a, b, c, d) values (306, 1, 1, 1);
insert into t2(a, b, c, d) values (307, 1, 1, 1);
insert into t2(a, b, c, d) values (308, 1, 1, 1);
insert into t2(a, b, c, d) values (309, 1, 1, 1);
insert into t2(a, b, c, d) values (310, 1, 1, 1);
insert into t2(a, b, c, d) values (311, 1, 1, 1);
insert into t2(a, b, c, d) values (312, 1, 1, 1);
insert into t2(a, b, c, d) values (313, 1, 1, 1);
insert into t2(a, b, c, d) values (314, 1, 1, 1);
insert into t2(a, b, c, d) values (315, 1, 1, 1);
insert into t2(a, b, c, d) values (316, 1, 1, 1);
insert into t2(a, b, c, d) values (317, 1, 1, 1);
insert into t2(a, b, c, d) values (318, 1, 1, 1);
insert into t2(a, b, c, d) values (319, 1, 1, 1);
insert into t2(a, b, c, d) values (320, 1, 1, 1);
insert into t2(a, b, c, d) values (321, 1, 1, 1);
insert into t2(a, b, c, d) values (322, 1, 1, 1);
insert into t2(a, b, c, d) values (323, 1, 1, 1);
insert into t2(a, b, c, d) values (324, 1, 1, 1);
insert into t2(a, b, c, d) values (325, 1, 1, 1);
insert into t2(a, b, c, d) values (326, 1, 1, 1);
insert into t2(a, b, c, d) values (327, 1, 1, 1);
insert into t2(a, b, c, d) values (328, 1, 1, 1);
insert into t2(a, b, c, d) values (329, 1, 1, 1);
insert into t2(a, b, c, d) values (330, 1, 1, 1);
insert into t2(a, b, c, d) values (331, 1, 1, 1);
insert into t2(a, b, c, d) values (332, 1, 1, 1);
insert into t2(a, b, c, d) values (333, 1, 1, 1);
insert into t2(a, b, c, d) values (334, 1, 1, 1);
insert into t2(a, b, c, d) values (335, 1, 1, 1);
insert into t2(a, b, c, d) values (336, 1, 1, 1);
insert into t2(a, b, c, d) values (337, 1, 1, 1);
insert into t2(a, b, c, d) values (338, 1, 1, 1);
insert into t2(a, b, c, d) values (339, 1, 1, 1);
insert into t2(a, b, c, d) values (340, 1, 1, 1);
insert into t2(a, b, c, d) values (341, 1, 1, 1);
insert into t2(a, b, c, d) values (342, 1, 1, 1);
insert into t2(a, b, c, d) values (343, 1, 1, 1);
insert into t2(a, b, c, d) values (344, 1, 1, 1);
insert into t2(a, b, c, d) values (345, 1, 1, 1);
insert into t2(a, b, c, d) values (346, 1, 1, 1);
insert into t2(a, b, c, d) values (347, 1, 1, 1);
insert into t2(a, b, c, d) values (348, 1, 1, 1);
insert into t2(a, b, c, d) values (349, 1, 1, 1);
insert into t2(a, b, c, d) values (350, 1, 1, 1);
insert into t2(a, b, c, d) values (351, 1, 1, 1);
insert into t2(a, b, c, d) values (352, 1, 1, 1);
insert into t2(a, b, c, d) values (353, 1, 1, 1);
insert into t2(a, b, c, d) values (354, 1, 1, 1);
insert into t2(a, b, c, d) values (355, 1, 1, 1);
insert into t2(a, b, c, d) values (356, 1, 1, 1);
insert into t2(a, b, c, d) values (357, 1, 1, 1);
insert into t2(a, b, c, d) values (358, 1, 1, 1);
insert into t2(a, b, c, d) values (359, 1, 1, 1);
insert into t2(a, b, c, d) values (360, 1, 1, 1);
insert into t2(a, b, c, d) values (361, 1, 1, 1);
insert into t2(a, b, c, d) values (362, 1, 1, 1);
insert into t2(a, b, c, d) values (363, 1, 1, 1);
insert into t2(a, b, c, d) values (364, 1, 1, 1);
insert into t2(a, b, c, d) values (365, 1, 1, 1);
insert into t2(a, b, c, d) values (366, 1, 1, 1);
insert into t2(a, b, c, d) values (367, 1, 1, 1);
insert into t2(a, b, c, d) values (368, 1, 1, 1);
insert into t2(a, b, c, d) values (369, 1, 1, 1);
insert into t2(a, b, c, d) values (370, 1, 1, 1);
insert into t2(a, b, c, d) values (371, 1, 1, 1);
insert into t2(a, b, c, d) values (372, 1, 1, 1);
insert into t2(a, b, c, d) values (373, 1, 1, 1);
insert into t2(a, b, c, d) values (374, 1, 1, 1);
insert into t2(a, b, c, d) values (375, 1, 1, 1);
insert into t2(a, b, c, d) values (376, 1, 1, 1);
insert into t2(a, b, c, d) values (377, 1, 1, 1);
insert into t2(a, b, c, d) values (378, 1, 1, 1);
insert into t2(a, b, c, d) values (379, 1, 1, 1);
insert into t2(a, b, c, d) values (380, 1, 1, 1);
insert into t2(a, b, c, d) values (381, 1, 1, 1);
insert into t2(a, b, c, d) values (382, 1, 1, 1);
insert into t2(a, b, c, d) values (383, 1, 1, 1);
insert into t2(a, b, c, d) values (384, 1, 1, 1);
insert into t2(a, b, c, d) values (385, 1, 1, 1);
insert into t2(a, b, c, d) values (386, 1, 1, 1);
insert into t2(a, b, c, d) values (387, 1, 1, 1);
insert into t2(a, b, c, d) values (388, 1, 1, 1);
insert into t2(a, b, c, d) values (389, 1, 1, 1);
insert into t2(a, b, c, d) values (390, 1, 1, 1);
insert into t2(a, b, c, d) values (391, 1, 1, 1);
insert into t2(a, b, c, d) values (392, 1, 1, 1);
insert into t2(a, b, c, d) values (393, 1, 1, 1);
insert into t2(a, b, c, d) values (394, 1, 1, 1);
insert into t2(a, b, c, d) values (395, 1, 1, 1);
insert into t2(a, b, c, d) values (396, 1, 1, 1);
insert into t2(a, b, c, d) values (397, 1, 1, 1);
insert into t2(a, b, c, d) values (398, 1, 1, 1);
insert into t2(a, b, c, d) values (399, 1, 1, 1);
alter system major freeze tenant = sys;
alter system major freeze tenant = all_user;
alter system major freeze tenant = all_meta;
select count(*) from t2;
count(*)
400
explain select * from t2;
Query Plan
===================================
|ID|OPERATOR  |NAME|EST. ROWS|COST|
-----------------------------------
|0 |TABLE SCAN|t2  |400      |127 |
===================================

Outputs & filters: 
-------------------------------------
  0 - output([t2.a], [t2.b], [t2.c], [t2.d]), filter(nil), 
      access([t2.a], [t2.b], [t2.c], [t2.d]), partitions(p0)

select count(*) from t2 where b = 1;
count(*)
200
explain select/*+index(t2 idx_b)*/ * from t2 where b = 1;
Query Plan
========================================
|ID|OPERATOR  |NAME     |EST. ROWS|COST|
----------------------------------------
|0 |TABLE SCAN|t2(idx_b)|200      |1159|
========================================

Outputs & filters: 
-------------------------------------
  0 - output([t2.a], [t2.b], [t2.c], [t2.d]), filter(nil), 
      access([t2.b], [t2.a], [t2.c], [t2.d]), partitions(p0)

select count(*) from t2 where c >= 2;
count(*)
200
explain select/*+index(t2 idx_c)*/ * from t2 where c >= 2;
Query Plan
========================================
|ID|OPERATOR  |NAME     |EST. ROWS|COST|
----------------------------------------
|0 |TABLE SCAN|t2(idx_c)|200      |1159|
========================================

Outputs & filters: 
-------------------------------------
  0 - output([t2.a], [t2.b], [t2.c], [t2.d]), filter(nil), 
      access([t2.c], [t2.a], [t2.b], [t2.d]), partitions(p0)

select count(*) from t2 where d < 3;
count(*)
300
explain select/*+index(t2 idx_d)*/ * from t2 where d < 3;
Query Plan
========================================
|ID|OPERATOR  |NAME     |EST. ROWS|COST|
----------------------------------------
|0 |TABLE SCAN|t2(idx_d)|300      |1698|
========================================

Outputs & filters: 
-------------------------------------
  0 - output([t2.a], [t2.b], [t2.c], [t2.d]), filter(nil), 
      access([t2.d], [t2.a], [t2.b], [t2.c]), partitions(p0)

update t2 set b = 3, c = 3, d = 3 where b = 1 and c = 1 and d = 1;
alter system major freeze tenant = sys;
alter system major freeze tenant = all_user;
alter system major freeze tenant = all_meta;
select count(*) from t2;
count(*)
400
explain select * from t2;
Query Plan
===================================
|ID|OPERATOR  |NAME|EST. ROWS|COST|
-----------------------------------
|0 |TABLE SCAN|t2  |400      |127 |
===================================

Outputs & filters: 
-------------------------------------
  0 - output([t2.a], [t2.b], [t2.c], [t2.d]), filter(nil), 
      access([t2.a], [t2.b], [t2.c], [t2.d]), partitions(p0)

select count(*) from t2 where b = 1;
count(*)
0
explain select/*+index(t2 idx_b)*/ * from t2 where b = 1;
Query Plan
========================================
|ID|OPERATOR  |NAME     |EST. ROWS|COST|
----------------------------------------
|0 |TABLE SCAN|t2(idx_b)|0        |10  |
========================================

Outputs & filters: 
-------------------------------------
  0 - output([t2.a], [t2.b], [t2.c], [t2.d]), filter(nil), 
      access([t2.b], [t2.a], [t2.c], [t2.d]), partitions(p0)

select count(*) from t2 where c >= 2;
count(*)
400
explain select/*+index(t2 idx_c)*/ * from t2 where c >= 2;
Query Plan
========================================
|ID|OPERATOR  |NAME     |EST. ROWS|COST|
----------------------------------------
|0 |TABLE SCAN|t2(idx_c)|400      |2236|
========================================

Outputs & filters: 
-------------------------------------
  0 - output([t2.a], [t2.b], [t2.c], [t2.d]), filter(nil), 
      access([t2.c], [t2.a], [t2.b], [t2.d]), partitions(p0)

select count(*) from t2 where d < 3;
count(*)
100
explain select/*+index(t2 idx_d)*/ * from t2 where d < 3;
Query Plan
========================================
|ID|OPERATOR  |NAME     |EST. ROWS|COST|
----------------------------------------
|0 |TABLE SCAN|t2(idx_d)|100      |621 |
========================================

Outputs & filters: 
-------------------------------------
  0 - output([t2.a], [t2.b], [t2.c], [t2.d]), filter(nil), 
      access([t2.d], [t2.a], [t2.b], [t2.c]), partitions(p0)

delete from t2 where b = 2 and c = 2 and d = 2;
alter system major freeze tenant = sys;
alter system major freeze tenant = all_user;
alter system major freeze tenant = all_meta;
select count(*) from t2;
count(*)
300
explain select * from t2;
Query Plan
===================================
|ID|OPERATOR  |NAME|EST. ROWS|COST|
-----------------------------------
|0 |TABLE SCAN|t2  |300      |104 |
===================================

Outputs & filters: 
-------------------------------------
  0 - output([t2.a], [t2.b], [t2.c], [t2.d]), filter(nil), 
      access([t2.a], [t2.b], [t2.c], [t2.d]), partitions(p0)

select count(*) from t2 where b = 1;
count(*)
0
explain select/*+index(t2 idx_b)*/ * from t2 where b = 1;
Query Plan
========================================
|ID|OPERATOR  |NAME     |EST. ROWS|COST|
----------------------------------------
|0 |TABLE SCAN|t2(idx_b)|0        |10  |
========================================

Outputs & filters: 
-------------------------------------
  0 - output([t2.a], [t2.b], [t2.c], [t2.d]), filter(nil), 
      access([t2.b], [t2.a], [t2.c], [t2.d]), partitions(p0)

select count(*) from t2 where c >= 2;
count(*)
300
explain select/*+index(t2 idx_c)*/ * from t2 where c >= 2;
Query Plan
========================================
|ID|OPERATOR  |NAME     |EST. ROWS|COST|
----------------------------------------
|0 |TABLE SCAN|t2(idx_c)|300      |1698|
========================================

Outputs & filters: 
-------------------------------------
  0 - output([t2.a], [t2.b], [t2.c], [t2.d]), filter(nil), 
      access([t2.c], [t2.a], [t2.b], [t2.d]), partitions(p0)

select count(*) from t2 where d < 3;
count(*)
0
explain select/*+index(t2 idx_d)*/ * from t2 where d < 3;
Query Plan
========================================
|ID|OPERATOR  |NAME     |EST. ROWS|COST|
----------------------------------------
|0 |TABLE SCAN|t2(idx_d)|0        |10  |
========================================

Outputs & filters: 
-------------------------------------
  0 - output([t2.a], [t2.b], [t2.c], [t2.d]), filter(nil), 
      access([t2.d], [t2.a], [t2.b], [t2.c]), partitions(p0)

drop table t2;
insert into t3(a, b, c, d) values (0, 1, 1, 1);
insert into t3(a, b, c, d) values (1, 1, 1, 1);
insert into t3(a, b, c, d) values (2, 1, 1, 1);
insert into t3(a, b, c, d) values (3, 1, 1, 1);
insert into t3(a, b, c, d) values (4, 1, 1, 1);
insert into t3(a, b, c, d) values (5, 1, 1, 1);
insert into t3(a, b, c, d) values (6, 1, 1, 1);
insert into t3(a, b, c, d) values (7, 1, 1, 1);
insert into t3(a, b, c, d) values (8, 1, 1, 1);
insert into t3(a, b, c, d) values (9, 1, 1, 1);
insert into t3(a, b, c, d) values (10, 1, 1, 1);
insert into t3(a, b, c, d) values (11, 1, 1, 1);
insert into t3(a, b, c, d) values (12, 1, 1, 1);
insert into t3(a, b, c, d) values (13, 1, 1, 1);
insert into t3(a, b, c, d) values (14, 1, 1, 1);
insert into t3(a, b, c, d) values (15, 1, 1, 1);
insert into t3(a, b, c, d) values (16, 1, 1, 1);
insert into t3(a, b, c, d) values (17, 1, 1, 1);
insert into t3(a, b, c, d) values (18, 1, 1, 1);
insert into t3(a, b, c, d) values (19, 1, 1, 1);
insert into t3(a, b, c, d) values (20, 1, 1, 1);
insert into t3(a, b, c, d) values (21, 1, 1, 1);
insert into t3(a, b, c, d) values (22, 1, 1, 1);
insert into t3(a, b, c, d) values (23, 1, 1, 1);
insert into t3(a, b, c, d) values (24, 1, 1, 1);
insert into t3(a, b, c, d) values (25, 1, 1, 1);
insert into t3(a, b, c, d) values (26, 1, 1, 1);
insert into t3(a, b, c, d) values (27, 1, 1, 1);
insert into t3(a, b, c, d) values (28, 1, 1, 1);
insert into t3(a, b, c, d) values (29, 1, 1, 1);
insert into t3(a, b, c, d) values (30, 1, 1, 1);
insert into t3(a, b, c, d) values (31, 1, 1, 1);
insert into t3(a, b, c, d) values (32, 1, 1, 1);
insert into t3(a, b, c, d) values (33, 1, 1, 1);
insert into t3(a, b, c, d) values (34, 1, 1, 1);
insert into t3(a, b, c, d) values (35, 1, 1, 1);
insert into t3(a, b, c, d) values (36, 1, 1, 1);
insert into t3(a, b, c, d) values (37, 1, 1, 1);
insert into t3(a, b, c, d) values (38, 1, 1, 1);
insert into t3(a, b, c, d) values (39, 1, 1, 1);
insert into t3(a, b, c, d) values (40, 1, 1, 1);
insert into t3(a, b, c, d) values (41, 1, 1, 1);
insert into t3(a, b, c, d) values (42, 1, 1, 1);
insert into t3(a, b, c, d) values (43, 1, 1, 1);
insert into t3(a, b, c, d) values (44, 1, 1, 1);
insert into t3(a, b, c, d) values (45, 1, 1, 1);
insert into t3(a, b, c, d) values (46, 1, 1, 1);
insert into t3(a, b, c, d) values (47, 1, 1, 1);
insert into t3(a, b, c, d) values (48, 1, 1, 1);
insert into t3(a, b, c, d) values (49, 1, 1, 1);
insert into t3(a, b, c, d) values (50, 1, 1, 1);
insert into t3(a, b, c, d) values (51, 1, 1, 1);
insert into t3(a, b, c, d) values (52, 1, 1, 1);
insert into t3(a, b, c, d) values (53, 1, 1, 1);
insert into t3(a, b, c, d) values (54, 1, 1, 1);
insert into t3(a, b, c, d) values (55, 1, 1, 1);
insert into t3(a, b, c, d) values (56, 1, 1, 1);
insert into t3(a, b, c, d) values (57, 1, 1, 1);
insert into t3(a, b, c, d) values (58, 1, 1, 1);
insert into t3(a, b, c, d) values (59, 1, 1, 1);
insert into t3(a, b, c, d) values (60, 1, 1, 1);
insert into t3(a, b, c, d) values (61, 1, 1, 1);
insert into t3(a, b, c, d) values (62, 1, 1, 1);
insert into t3(a, b, c, d) values (63, 1, 1, 1);
insert into t3(a, b, c, d) values (64, 1, 1, 1);
insert into t3(a, b, c, d) values (65, 1, 1, 1);
insert into t3(a, b, c, d) values (66, 1, 1, 1);
insert into t3(a, b, c, d) values (67, 1, 1, 1);
insert into t3(a, b, c, d) values (68, 1, 1, 1);
insert into t3(a, b, c, d) values (69, 1, 1, 1);
insert into t3(a, b, c, d) values (70, 1, 1, 1);
insert into t3(a, b, c, d) values (71, 1, 1, 1);
insert into t3(a, b, c, d) values (72, 1, 1, 1);
insert into t3(a, b, c, d) values (73, 1, 1, 1);
insert into t3(a, b, c, d) values (74, 1, 1, 1);
insert into t3(a, b, c, d) values (75, 1, 1, 1);
insert into t3(a, b, c, d) values (76, 1, 1, 1);
insert into t3(a, b, c, d) values (77, 1, 1, 1);
insert into t3(a, b, c, d) values (78, 1, 1, 1);
insert into t3(a, b, c, d) values (79, 1, 1, 1);
insert into t3(a, b, c, d) values (80, 1, 1, 1);
insert into t3(a, b, c, d) values (81, 1, 1, 1);
insert into t3(a, b, c, d) values (82, 1, 1, 1);
insert into t3(a, b, c, d) values (83, 1, 1, 1);
insert into t3(a, b, c, d) values (84, 1, 1, 1);
insert into t3(a, b, c, d) values (85, 1, 1, 1);
insert into t3(a, b, c, d) values (86, 1, 1, 1);
insert into t3(a, b, c, d) values (87, 1, 1, 1);
insert into t3(a, b, c, d) values (88, 1, 1, 1);
insert into t3(a, b, c, d) values (89, 1, 1, 1);
insert into t3(a, b, c, d) values (90, 1, 1, 1);
insert into t3(a, b, c, d) values (91, 1, 1, 1);
insert into t3(a, b, c, d) values (92, 1, 1, 1);
insert into t3(a, b, c, d) values (93, 1, 1, 1);
insert into t3(a, b, c, d) values (94, 1, 1, 1);
insert into t3(a, b, c, d) values (95, 1, 1, 1);
insert into t3(a, b, c, d) values (96, 1, 1, 1);
insert into t3(a, b, c, d) values (97, 1, 1, 1);
insert into t3(a, b, c, d) values (98, 1, 1, 1);
insert into t3(a, b, c, d) values (99, 1, 1, 1);
insert into t3(a, b, c, d) values (100, 2, 2, 2);
insert into t3(a, b, c, d) values (101, 2, 2, 2);
insert into t3(a, b, c, d) values (102, 2, 2, 2);
insert into t3(a, b, c, d) values (103, 2, 2, 2);
insert into t3(a, b, c, d) values (104, 2, 2, 2);
insert into t3(a, b, c, d) values (105, 2, 2, 2);
insert into t3(a, b, c, d) values (106, 2, 2, 2);
insert into t3(a, b, c, d) values (107, 2, 2, 2);
insert into t3(a, b, c, d) values (108, 2, 2, 2);
insert into t3(a, b, c, d) values (109, 2, 2, 2);
insert into t3(a, b, c, d) values (110, 2, 2, 2);
insert into t3(a, b, c, d) values (111, 2, 2, 2);
insert into t3(a, b, c, d) values (112, 2, 2, 2);
insert into t3(a, b, c, d) values (113, 2, 2, 2);
insert into t3(a, b, c, d) values (114, 2, 2, 2);
insert into t3(a, b, c, d) values (115, 2, 2, 2);
insert into t3(a, b, c, d) values (116, 2, 2, 2);
insert into t3(a, b, c, d) values (117, 2, 2, 2);
insert into t3(a, b, c, d) values (118, 2, 2, 2);
insert into t3(a, b, c, d) values (119, 2, 2, 2);
insert into t3(a, b, c, d) values (120, 2, 2, 2);
insert into t3(a, b, c, d) values (121, 2, 2, 2);
insert into t3(a, b, c, d) values (122, 2, 2, 2);
insert into t3(a, b, c, d) values (123, 2, 2, 2);
insert into t3(a, b, c, d) values (124, 2, 2, 2);
insert into t3(a, b, c, d) values (125, 2, 2, 2);
insert into t3(a, b, c, d) values (126, 2, 2, 2);
insert into t3(a, b, c, d) values (127, 2, 2, 2);
insert into t3(a, b, c, d) values (128, 2, 2, 2);
insert into t3(a, b, c, d) values (129, 2, 2, 2);
insert into t3(a, b, c, d) values (130, 2, 2, 2);
insert into t3(a, b, c, d) values (131, 2, 2, 2);
insert into t3(a, b, c, d) values (132, 2, 2, 2);
insert into t3(a, b, c, d) values (133, 2, 2, 2);
insert into t3(a, b, c, d) values (134, 2, 2, 2);
insert into t3(a, b, c, d) values (135, 2, 2, 2);
insert into t3(a, b, c, d) values (136, 2, 2, 2);
insert into t3(a, b, c, d) values (137, 2, 2, 2);
insert into t3(a, b, c, d) values (138, 2, 2, 2);
insert into t3(a, b, c, d) values (139, 2, 2, 2);
insert into t3(a, b, c, d) values (140, 2, 2, 2);
insert into t3(a, b, c, d) values (141, 2, 2, 2);
insert into t3(a, b, c, d) values (142, 2, 2, 2);
insert into t3(a, b, c, d) values (143, 2, 2, 2);
insert into t3(a, b, c, d) values (144, 2, 2, 2);
insert into t3(a, b, c, d) values (145, 2, 2, 2);
insert into t3(a, b, c, d) values (146, 2, 2, 2);
insert into t3(a, b, c, d) values (147, 2, 2, 2);
insert into t3(a, b, c, d) values (148, 2, 2, 2);
insert into t3(a, b, c, d) values (149, 2, 2, 2);
insert into t3(a, b, c, d) values (150, 2, 2, 2);
insert into t3(a, b, c, d) values (151, 2, 2, 2);
insert into t3(a, b, c, d) values (152, 2, 2, 2);
insert into t3(a, b, c, d) values (153, 2, 2, 2);
insert into t3(a, b, c, d) values (154, 2, 2, 2);
insert into t3(a, b, c, d) values (155, 2, 2, 2);
insert into t3(a, b, c, d) values (156, 2, 2, 2);
insert into t3(a, b, c, d) values (157, 2, 2, 2);
insert into t3(a, b, c, d) values (158, 2, 2, 2);
insert into t3(a, b, c, d) values (159, 2, 2, 2);
insert into t3(a, b, c, d) values (160, 2, 2, 2);
insert into t3(a, b, c, d) values (161, 2, 2, 2);
insert into t3(a, b, c, d) values (162, 2, 2, 2);
insert into t3(a, b, c, d) values (163, 2, 2, 2);
insert into t3(a, b, c, d) values (164, 2, 2, 2);
insert into t3(a, b, c, d) values (165, 2, 2, 2);
insert into t3(a, b, c, d) values (166, 2, 2, 2);
insert into t3(a, b, c, d) values (167, 2, 2, 2);
insert into t3(a, b, c, d) values (168, 2, 2, 2);
insert into t3(a, b, c, d) values (169, 2, 2, 2);
insert into t3(a, b, c, d) values (170, 2, 2, 2);
insert into t3(a, b, c, d) values (171, 2, 2, 2);
insert into t3(a, b, c, d) values (172, 2, 2, 2);
insert into t3(a, b, c, d) values (173, 2, 2, 2);
insert into t3(a, b, c, d) values (174, 2, 2, 2);
insert into t3(a, b, c, d) values (175, 2, 2, 2);
insert into t3(a, b, c, d) values (176, 2, 2, 2);
insert into t3(a, b, c, d) values (177, 2, 2, 2);
insert into t3(a, b, c, d) values (178, 2, 2, 2);
insert into t3(a, b, c, d) values (179, 2, 2, 2);
insert into t3(a, b, c, d) values (180, 2, 2, 2);
insert into t3(a, b, c, d) values (181, 2, 2, 2);
insert into t3(a, b, c, d) values (182, 2, 2, 2);
insert into t3(a, b, c, d) values (183, 2, 2, 2);
insert into t3(a, b, c, d) values (184, 2, 2, 2);
insert into t3(a, b, c, d) values (185, 2, 2, 2);
insert into t3(a, b, c, d) values (186, 2, 2, 2);
insert into t3(a, b, c, d) values (187, 2, 2, 2);
insert into t3(a, b, c, d) values (188, 2, 2, 2);
insert into t3(a, b, c, d) values (189, 2, 2, 2);
insert into t3(a, b, c, d) values (190, 2, 2, 2);
insert into t3(a, b, c, d) values (191, 2, 2, 2);
insert into t3(a, b, c, d) values (192, 2, 2, 2);
insert into t3(a, b, c, d) values (193, 2, 2, 2);
insert into t3(a, b, c, d) values (194, 2, 2, 2);
insert into t3(a, b, c, d) values (195, 2, 2, 2);
insert into t3(a, b, c, d) values (196, 2, 2, 2);
insert into t3(a, b, c, d) values (197, 2, 2, 2);
insert into t3(a, b, c, d) values (198, 2, 2, 2);
insert into t3(a, b, c, d) values (199, 2, 2, 2);
insert into t3(a, b, c, d) values (200, 3, 3, 3);
insert into t3(a, b, c, d) values (201, 3, 3, 3);
insert into t3(a, b, c, d) values (202, 3, 3, 3);
insert into t3(a, b, c, d) values (203, 3, 3, 3);
insert into t3(a, b, c, d) values (204, 3, 3, 3);
insert into t3(a, b, c, d) values (205, 3, 3, 3);
insert into t3(a, b, c, d) values (206, 3, 3, 3);
insert into t3(a, b, c, d) values (207, 3, 3, 3);
insert into t3(a, b, c, d) values (208, 3, 3, 3);
insert into t3(a, b, c, d) values (209, 3, 3, 3);
insert into t3(a, b, c, d) values (210, 3, 3, 3);
insert into t3(a, b, c, d) values (211, 3, 3, 3);
insert into t3(a, b, c, d) values (212, 3, 3, 3);
insert into t3(a, b, c, d) values (213, 3, 3, 3);
insert into t3(a, b, c, d) values (214, 3, 3, 3);
insert into t3(a, b, c, d) values (215, 3, 3, 3);
insert into t3(a, b, c, d) values (216, 3, 3, 3);
insert into t3(a, b, c, d) values (217, 3, 3, 3);
insert into t3(a, b, c, d) values (218, 3, 3, 3);
insert into t3(a, b, c, d) values (219, 3, 3, 3);
insert into t3(a, b, c, d) values (220, 3, 3, 3);
insert into t3(a, b, c, d) values (221, 3, 3, 3);
insert into t3(a, b, c, d) values (222, 3, 3, 3);
insert into t3(a, b, c, d) values (223, 3, 3, 3);
insert into t3(a, b, c, d) values (224, 3, 3, 3);
insert into t3(a, b, c, d) values (225, 3, 3, 3);
insert into t3(a, b, c, d) values (226, 3, 3, 3);
insert into t3(a, b, c, d) values (227, 3, 3, 3);
insert into t3(a, b, c, d) values (228, 3, 3, 3);
insert into t3(a, b, c, d) values (229, 3, 3, 3);
insert into t3(a, b, c, d) values (230, 3, 3, 3);
insert into t3(a, b, c, d) values (231, 3, 3, 3);
insert into t3(a, b, c, d) values (232, 3, 3, 3);
insert into t3(a, b, c, d) values (233, 3, 3, 3);
insert into t3(a, b, c, d) values (234, 3, 3, 3);
insert into t3(a, b, c, d) values (235, 3, 3, 3);
insert into t3(a, b, c, d) values (236, 3, 3, 3);
insert into t3(a, b, c, d) values (237, 3, 3, 3);
insert into t3(a, b, c, d) values (238, 3, 3, 3);
insert into t3(a, b, c, d) values (239, 3, 3, 3);
insert into t3(a, b, c, d) values (240, 3, 3, 3);
insert into t3(a, b, c, d) values (241, 3, 3, 3);
insert into t3(a, b, c, d) values (242, 3, 3, 3);
insert into t3(a, b, c, d) values (243, 3, 3, 3);
insert into t3(a, b, c, d) values (244, 3, 3, 3);
insert into t3(a, b, c, d) values (245, 3, 3, 3);
insert into t3(a, b, c, d) values (246, 3, 3, 3);
insert into t3(a, b, c, d) values (247, 3, 3, 3);
insert into t3(a, b, c, d) values (248, 3, 3, 3);
insert into t3(a, b, c, d) values (249, 3, 3, 3);
insert into t3(a, b, c, d) values (250, 3, 3, 3);
insert into t3(a, b, c, d) values (251, 3, 3, 3);
insert into t3(a, b, c, d) values (252, 3, 3, 3);
insert into t3(a, b, c, d) values (253, 3, 3, 3);
insert into t3(a, b, c, d) values (254, 3, 3, 3);
insert into t3(a, b, c, d) values (255, 3, 3, 3);
insert into t3(a, b, c, d) values (256, 3, 3, 3);
insert into t3(a, b, c, d) values (257, 3, 3, 3);
insert into t3(a, b, c, d) values (258, 3, 3, 3);
insert into t3(a, b, c, d) values (259, 3, 3, 3);
insert into t3(a, b, c, d) values (260, 3, 3, 3);
insert into t3(a, b, c, d) values (261, 3, 3, 3);
insert into t3(a, b, c, d) values (262, 3, 3, 3);
insert into t3(a, b, c, d) values (263, 3, 3, 3);
insert into t3(a, b, c, d) values (264, 3, 3, 3);
insert into t3(a, b, c, d) values (265, 3, 3, 3);
insert into t3(a, b, c, d) values (266, 3, 3, 3);
insert into t3(a, b, c, d) values (267, 3, 3, 3);
insert into t3(a, b, c, d) values (268, 3, 3, 3);
insert into t3(a, b, c, d) values (269, 3, 3, 3);
insert into t3(a, b, c, d) values (270, 3, 3, 3);
insert into t3(a, b, c, d) values (271, 3, 3, 3);
insert into t3(a, b, c, d) values (272, 3, 3, 3);
insert into t3(a, b, c, d) values (273, 3, 3, 3);
insert into t3(a, b, c, d) values (274, 3, 3, 3);
insert into t3(a, b, c, d) values (275, 3, 3, 3);
insert into t3(a, b, c, d) values (276, 3, 3, 3);
insert into t3(a, b, c, d) values (277, 3, 3, 3);
insert into t3(a, b, c, d) values (278, 3, 3, 3);
insert into t3(a, b, c, d) values (279, 3, 3, 3);
insert into t3(a, b, c, d) values (280, 3, 3, 3);
insert into t3(a, b, c, d) values (281, 3, 3, 3);
insert into t3(a, b, c, d) values (282, 3, 3, 3);
insert into t3(a, b, c, d) values (283, 3, 3, 3);
insert into t3(a, b, c, d) values (284, 3, 3, 3);
insert into t3(a, b, c, d) values (285, 3, 3, 3);
insert into t3(a, b, c, d) values (286, 3, 3, 3);
insert into t3(a, b, c, d) values (287, 3, 3, 3);
insert into t3(a, b, c, d) values (288, 3, 3, 3);
insert into t3(a, b, c, d) values (289, 3, 3, 3);
insert into t3(a, b, c, d) values (290, 3, 3, 3);
insert into t3(a, b, c, d) values (291, 3, 3, 3);
insert into t3(a, b, c, d) values (292, 3, 3, 3);
insert into t3(a, b, c, d) values (293, 3, 3, 3);
insert into t3(a, b, c, d) values (294, 3, 3, 3);
insert into t3(a, b, c, d) values (295, 3, 3, 3);
insert into t3(a, b, c, d) values (296, 3, 3, 3);
insert into t3(a, b, c, d) values (297, 3, 3, 3);
insert into t3(a, b, c, d) values (298, 3, 3, 3);
insert into t3(a, b, c, d) values (299, 3, 3, 3);
alter system major freeze tenant = sys;
alter system major freeze tenant = all_user;
alter system major freeze tenant = all_meta;
select count(*) from t3;
count(*)
300
explain select * from t3;
Query Plan
===================================
|ID|OPERATOR  |NAME|EST. ROWS|COST|
-----------------------------------
|0 |TABLE SCAN|t3  |300      |104 |
===================================

Outputs & filters: 
-------------------------------------
  0 - output([t3.a], [t3.b], [t3.c], [t3.d]), filter(nil), 
      access([t3.a], [t3.b], [t3.c], [t3.d]), partitions(p0)

select count(*) from t3 where b = 1;
count(*)
100
explain select/*+index(t3 idx_b)*/ * from t3 where b = 1;
Query Plan
========================================
|ID|OPERATOR  |NAME     |EST. ROWS|COST|
----------------------------------------
|0 |TABLE SCAN|t3(idx_b)|100      |621 |
========================================

Outputs & filters: 
-------------------------------------
  0 - output([t3.a], [t3.b], [t3.c], [t3.d]), filter(nil), 
      access([t3.b], [t3.a], [t3.c], [t3.d]), partitions(p0)

select count(*) from t3 where c >= 2;
count(*)
200
explain select/*+index(t3 idx_c)*/ * from t3 where c >= 2;
Query Plan
========================================
|ID|OPERATOR  |NAME     |EST. ROWS|COST|
----------------------------------------
|0 |TABLE SCAN|t3(idx_c)|200      |1159|
========================================

Outputs & filters: 
-------------------------------------
  0 - output([t3.a], [t3.b], [t3.c], [t3.d]), filter(nil), 
      access([t3.c], [t3.a], [t3.b], [t3.d]), partitions(p0)

select count(*) from t3 where d < 3;
count(*)
200
explain select/*+index(t3 idx_d)*/ * from t3 where d < 3;
Query Plan
========================================
|ID|OPERATOR  |NAME     |EST. ROWS|COST|
----------------------------------------
|0 |TABLE SCAN|t3(idx_d)|200      |1159|
========================================

Outputs & filters: 
-------------------------------------
  0 - output([t3.a], [t3.b], [t3.c], [t3.d]), filter(nil), 
      access([t3.d], [t3.a], [t3.b], [t3.c]), partitions(p0)

insert into t3(a, b, c, d) values (300, 1, 1, 1);
insert into t3(a, b, c, d) values (301, 1, 1, 1);
insert into t3(a, b, c, d) values (302, 1, 1, 1);
insert into t3(a, b, c, d) values (303, 1, 1, 1);
insert into t3(a, b, c, d) values (304, 1, 1, 1);
insert into t3(a, b, c, d) values (305, 1, 1, 1);
insert into t3(a, b, c, d) values (306, 1, 1, 1);
insert into t3(a, b, c, d) values (307, 1, 1, 1);
insert into t3(a, b, c, d) values (308, 1, 1, 1);
insert into t3(a, b, c, d) values (309, 1, 1, 1);
insert into t3(a, b, c, d) values (310, 1, 1, 1);
insert into t3(a, b, c, d) values (311, 1, 1, 1);
insert into t3(a, b, c, d) values (312, 1, 1, 1);
insert into t3(a, b, c, d) values (313, 1, 1, 1);
insert into t3(a, b, c, d) values (314, 1, 1, 1);
insert into t3(a, b, c, d) values (315, 1, 1, 1);
insert into t3(a, b, c, d) values (316, 1, 1, 1);
insert into t3(a, b, c, d) values (317, 1, 1, 1);
insert into t3(a, b, c, d) values (318, 1, 1, 1);
insert into t3(a, b, c, d) values (319, 1, 1, 1);
insert into t3(a, b, c, d) values (320, 1, 1, 1);
insert into t3(a, b, c, d) values (321, 1, 1, 1);
insert into t3(a, b, c, d) values (322, 1, 1, 1);
insert into t3(a, b, c, d) values (323, 1, 1, 1);
insert into t3(a, b, c, d) values (324, 1, 1, 1);
insert into t3(a, b, c, d) values (325, 1, 1, 1);
insert into t3(a, b, c, d) values (326, 1, 1, 1);
insert into t3(a, b, c, d) values (327, 1, 1, 1);
insert into t3(a, b, c, d) values (328, 1, 1, 1);
insert into t3(a, b, c, d) values (329, 1, 1, 1);
insert into t3(a, b, c, d) values (330, 1, 1, 1);
insert into t3(a, b, c, d) values (331, 1, 1, 1);
insert into t3(a, b, c, d) values (332, 1, 1, 1);
insert into t3(a, b, c, d) values (333, 1, 1, 1);
insert into t3(a, b, c, d) values (334, 1, 1, 1);
insert into t3(a, b, c, d) values (335, 1, 1, 1);
insert into t3(a, b, c, d) values (336, 1, 1, 1);
insert into t3(a, b, c, d) values (337, 1, 1, 1);
insert into t3(a, b, c, d) values (338, 1, 1, 1);
insert into t3(a, b, c, d) values (339, 1, 1, 1);
insert into t3(a, b, c, d) values (340, 1, 1, 1);
insert into t3(a, b, c, d) values (341, 1, 1, 1);
insert into t3(a, b, c, d) values (342, 1, 1, 1);
insert into t3(a, b, c, d) values (343, 1, 1, 1);
insert into t3(a, b, c, d) values (344, 1, 1, 1);
insert into t3(a, b, c, d) values (345, 1, 1, 1);
insert into t3(a, b, c, d) values (346, 1, 1, 1);
insert into t3(a, b, c, d) values (347, 1, 1, 1);
insert into t3(a, b, c, d) values (348, 1, 1, 1);
insert into t3(a, b, c, d) values (349, 1, 1, 1);
insert into t3(a, b, c, d) values (350, 1, 1, 1);
insert into t3(a, b, c, d) values (351, 1, 1, 1);
insert into t3(a, b, c, d) values (352, 1, 1, 1);
insert into t3(a, b, c, d) values (353, 1, 1, 1);
insert into t3(a, b, c, d) values (354, 1, 1, 1);
insert into t3(a, b, c, d) values (355, 1, 1, 1);
insert into t3(a, b, c, d) values (356, 1, 1, 1);
insert into t3(a, b, c, d) values (357, 1, 1, 1);
insert into t3(a, b, c, d) values (358, 1, 1, 1);
insert into t3(a, b, c, d) values (359, 1, 1, 1);
insert into t3(a, b, c, d) values (360, 1, 1, 1);
insert into t3(a, b, c, d) values (361, 1, 1, 1);
insert into t3(a, b, c, d) values (362, 1, 1, 1);
insert into t3(a, b, c, d) values (363, 1, 1, 1);
insert into t3(a, b, c, d) values (364, 1, 1, 1);
insert into t3(a, b, c, d) values (365, 1, 1, 1);
insert into t3(a, b, c, d) values (366, 1, 1, 1);
insert into t3(a, b, c, d) values (367, 1, 1, 1);
insert into t3(a, b, c, d) values (368, 1, 1, 1);
insert into t3(a, b, c, d) values (369, 1, 1, 1);
insert into t3(a, b, c, d) values (370, 1, 1, 1);
insert into t3(a, b, c, d) values (371, 1, 1, 1);
insert into t3(a, b, c, d) values (372, 1, 1, 1);
insert into t3(a, b, c, d) values (373, 1, 1, 1);
insert into t3(a, b, c, d) values (374, 1, 1, 1);
insert into t3(a, b, c, d) values (375, 1, 1, 1);
insert into t3(a, b, c, d) values (376, 1, 1, 1);
insert into t3(a, b, c, d) values (377, 1, 1, 1);
insert into t3(a, b, c, d) values (378, 1, 1, 1);
insert into t3(a, b, c, d) values (379, 1, 1, 1);
insert into t3(a, b, c, d) values (380, 1, 1, 1);
insert into t3(a, b, c, d) values (381, 1, 1, 1);
insert into t3(a, b, c, d) values (382, 1, 1, 1);
insert into t3(a, b, c, d) values (383, 1, 1, 1);
insert into t3(a, b, c, d) values (384, 1, 1, 1);
insert into t3(a, b, c, d) values (385, 1, 1, 1);
insert into t3(a, b, c, d) values (386, 1, 1, 1);
insert into t3(a, b, c, d) values (387, 1, 1, 1);
insert into t3(a, b, c, d) values (388, 1, 1, 1);
insert into t3(a, b, c, d) values (389, 1, 1, 1);
insert into t3(a, b, c, d) values (390, 1, 1, 1);
insert into t3(a, b, c, d) values (391, 1, 1, 1);
insert into t3(a, b, c, d) values (392, 1, 1, 1);
insert into t3(a, b, c, d) values (393, 1, 1, 1);
insert into t3(a, b, c, d) values (394, 1, 1, 1);
insert into t3(a, b, c, d) values (395, 1, 1, 1);
insert into t3(a, b, c, d) values (396, 1, 1, 1);
insert into t3(a, b, c, d) values (397, 1, 1, 1);
insert into t3(a, b, c, d) values (398, 1, 1, 1);
insert into t3(a, b, c, d) values (399, 1, 1, 1);
select count(*) from t3;
count(*)
400
explain select * from t3;
Query Plan
===================================
|ID|OPERATOR  |NAME|EST. ROWS|COST|
-----------------------------------
|0 |TABLE SCAN|t3  |400      |127 |
===================================

Outputs & filters: 
-------------------------------------
  0 - output([t3.a], [t3.b], [t3.c], [t3.d]), filter(nil), 
      access([t3.a], [t3.b], [t3.c], [t3.d]), partitions(p0)

select count(*) from t3 where b = 1;
count(*)
200
explain select/*+index(t3 idx_b)*/ * from t3 where b = 1;
Query Plan
========================================
|ID|OPERATOR  |NAME     |EST. ROWS|COST|
----------------------------------------
|0 |TABLE SCAN|t3(idx_b)|200      |1159|
========================================

Outputs & filters: 
-------------------------------------
  0 - output([t3.a], [t3.b], [t3.c], [t3.d]), filter(nil), 
      access([t3.b], [t3.a], [t3.c], [t3.d]), partitions(p0)

select count(*) from t3 where c >= 2;
count(*)
200
explain select/*+index(t3 idx_c)*/ * from t3 where c >= 2;
Query Plan
========================================
|ID|OPERATOR  |NAME     |EST. ROWS|COST|
----------------------------------------
|0 |TABLE SCAN|t3(idx_c)|200      |1159|
========================================

Outputs & filters: 
-------------------------------------
  0 - output([t3.a], [t3.b], [t3.c], [t3.d]), filter(nil), 
      access([t3.c], [t3.a], [t3.b], [t3.d]), partitions(p0)

select count(*) from t3 where d < 3;
count(*)
300
explain select/*+index(t3 idx_d)*/ * from t3 where d < 3;
Query Plan
========================================
|ID|OPERATOR  |NAME     |EST. ROWS|COST|
----------------------------------------
|0 |TABLE SCAN|t3(idx_d)|300      |1698|
========================================

Outputs & filters: 
-------------------------------------
  0 - output([t3.a], [t3.b], [t3.c], [t3.d]), filter(nil), 
      access([t3.d], [t3.a], [t3.b], [t3.c]), partitions(p0)

update t3 set b = 3, c = 3, d = 3 where b = 1 and c = 1 and d = 1;
select count(*) from t3;
count(*)
400
explain select * from t3;
Query Plan
===================================
|ID|OPERATOR  |NAME|EST. ROWS|COST|
-----------------------------------
|0 |TABLE SCAN|t3  |400      |127 |
===================================

Outputs & filters: 
-------------------------------------
  0 - output([t3.a], [t3.b], [t3.c], [t3.d]), filter(nil), 
      access([t3.a], [t3.b], [t3.c], [t3.d]), partitions(p0)

select count(*) from t3 where b = 1;
count(*)
0
explain select/*+index(t3 idx_b)*/ * from t3 where b = 1;
Query Plan
========================================
|ID|OPERATOR  |NAME     |EST. ROWS|COST|
----------------------------------------
|0 |TABLE SCAN|t3(idx_b)|0        |10  |
========================================

Outputs & filters: 
-------------------------------------
  0 - output([t3.a], [t3.b], [t3.c], [t3.d]), filter(nil), 
      access([t3.b], [t3.a], [t3.c], [t3.d]), partitions(p0)

select count(*) from t3 where c >= 2;
count(*)
400
explain select/*+index(t3 idx_c)*/ * from t3 where c >= 2;
Query Plan
========================================
|ID|OPERATOR  |NAME     |EST. ROWS|COST|
----------------------------------------
|0 |TABLE SCAN|t3(idx_c)|400      |2236|
========================================

Outputs & filters: 
-------------------------------------
  0 - output([t3.a], [t3.b], [t3.c], [t3.d]), filter(nil), 
      access([t3.c], [t3.a], [t3.b], [t3.d]), partitions(p0)

select count(*) from t3 where d < 3;
count(*)
100
explain select/*+index(t3 idx_d)*/ * from t3 where d < 3;
Query Plan
========================================
|ID|OPERATOR  |NAME     |EST. ROWS|COST|
----------------------------------------
|0 |TABLE SCAN|t3(idx_d)|100      |621 |
========================================

Outputs & filters: 
-------------------------------------
  0 - output([t3.a], [t3.b], [t3.c], [t3.d]), filter(nil), 
      access([t3.d], [t3.a], [t3.b], [t3.c]), partitions(p0)

delete from t3 where b = 2 and c = 2 and d = 2;
select count(*) from t3;
count(*)
300
explain select * from t3;
Query Plan
===================================
|ID|OPERATOR  |NAME|EST. ROWS|COST|
-----------------------------------
|0 |TABLE SCAN|t3  |300      |104 |
===================================

Outputs & filters: 
-------------------------------------
  0 - output([t3.a], [t3.b], [t3.c], [t3.d]), filter(nil), 
      access([t3.a], [t3.b], [t3.c], [t3.d]), partitions(p0)

select count(*) from t3 where b = 1;
count(*)
0
explain select/*+index(t3 idx_b)*/ * from t3 where b = 1;
Query Plan
========================================
|ID|OPERATOR  |NAME     |EST. ROWS|COST|
----------------------------------------
|0 |TABLE SCAN|t3(idx_b)|0        |10  |
========================================

Outputs & filters: 
-------------------------------------
  0 - output([t3.a], [t3.b], [t3.c], [t3.d]), filter(nil), 
      access([t3.b], [t3.a], [t3.c], [t3.d]), partitions(p0)

select count(*) from t3 where c >= 2;
count(*)
300
explain select/*+index(t3 idx_c)*/ * from t3 where c >= 2;
Query Plan
========================================
|ID|OPERATOR  |NAME     |EST. ROWS|COST|
----------------------------------------
|0 |TABLE SCAN|t3(idx_c)|300      |1698|
========================================

Outputs & filters: 
-------------------------------------
  0 - output([t3.a], [t3.b], [t3.c], [t3.d]), filter(nil), 
      access([t3.c], [t3.a], [t3.b], [t3.d]), partitions(p0)

select count(*) from t3 where d < 3;
count(*)
0
explain select/*+index(t3 idx_d)*/ * from t3 where d < 3;
Query Plan
========================================
|ID|OPERATOR  |NAME     |EST. ROWS|COST|
----------------------------------------
|0 |TABLE SCAN|t3(idx_d)|0        |10  |
========================================

Outputs & filters: 
-------------------------------------
  0 - output([t3.a], [t3.b], [t3.c], [t3.d]), filter(nil), 
      access([t3.d], [t3.a], [t3.b], [t3.c]), partitions(p0)

drop table t3;
