result_format: 4
drop tenant if exists tt1 force;
drop resource pool if exists test_resource_pool1;
drop resource unit if exists test_resource_unit1;
create resource unit test_resource_unit1 max_cpu 1, max_memory '1G', max_iops 100000, max_disk_size 536870912, max_session_num 1024;

## 功能: 获取指定租户的ip&port
## 用法:
## 模板:


create database test2;


set @@ob_query_timeout=1000000000;

###misc###
create package obpackagetest as
declare type ob_type_record is record(id int, msg varchar(30));
declare type ob_type_nested_table is table of varchar(30);
declare ob_item_var varchar(30);
declare ob_item_rec ob_type_record;
declare ob_item_nested_table ob_type_nested_table;
function get_var() return varchar(30);
procedure set_var();
end;//
drop package obpackagetest;

create package body obpackagetest as
declare type ob_type_record is record(id int, msg varchar(30));
declare type ob_type_nested_table is table of varchar(30);
declare ob_item_var varchar(30);
declare ob_item_rec ob_type_record;
declare ob_item_nested_table ob_type_nested_table;
function get_var() return varchar(30);
procedure set_var() is
begin
end;
end;//
drop package body obpackagetest;

###spec and body test###
create package obpackagetest is
end obpackagetest;
drop package obpackagetest;

create package obpackagetest as
end obpackagetest;
drop package obpackagetest;

create package obpackagetest as
end;
drop package obpackagetest;

create package obpackagetest as
end;
create table obpackagetest (package_name varchar(30));
drop package obpackagetest;
drop table obpackagetest;

create or replace package obpackagetest as
end;
create or replace package obpackagetest as
end;
drop package obpackagetest;

create or replace package obpackagetest is
end;
create or replace package body obpackagetest as
end obpackagetest;
create or replace package body obpackagetest is
end obpackagetest;
create or replace package body obpackagetest as
end;
drop package obpackagetest;

create table obtabletest (a varchar(30));
create or replace package obpackagetest as
declare ob_item_var varchar(30) default 'var in head';
end;//
create or replace package body obpackagetest as
begin
set ob_item_var = 'var in body init';
end;//
do
begin
insert into obtabletest values (obpackagetest.ob_item_var);
end;//
select * from obtabletest;
+------------------+
| a                |
+------------------+
| var in body init |
+------------------+
drop table obtabletest;
drop package obpackagetest;

####call procedure test###
create table obtabletest (a varchar(10));
create package obpackagetest as
procedure a();
end;//
create package body obpackagetest as
procedure a() is
begin
insert into obtabletest values('test');
end;
end;//
call obpackagetest.a();
select * from obtabletest;
+------+
| a    |
+------+
| test |
+------+
drop table obtabletest;
drop package obpackagetest;

create table obtabletest (a varchar(10));
create package obpackagetest as
procedure a(x varchar(10));
end;//
create package body obpackagetest as
procedure a(x varchar(10)) is
begin
insert into obtabletest values(x);
end;
end;//
call obpackagetest.a('test');
select * from obtabletest;
+------+
| a    |
+------+
| test |
+------+
drop table obtabletest;
drop package obpackagetest;

create table obtabletest (a varchar(10), b int);
create package obpackagetest as
procedure a(x varchar(10), y int);
end;//
create package body obpackagetest as
procedure a(x varchar(10), y int) is
begin
insert into obtabletest values(x, y);
end;
end;//
call obpackagetest.a('test', 1);
select * from obtabletest;
+------+------+
| a    | b    |
+------+------+
| test |    1 |
+------+------+
drop table obtabletest;
drop package obpackagetest;

create table obtabletest (a varchar(10));
create package obpackagetest as
procedure a(x varchar(10));
procedure b(x varchar(10));
end;//
create package body obpackagetest as
procedure a(x varchar(10)) is
begin
insert into obtabletest values(x);
end;
procedure b(x varchar(10)) is
begin
insert into obtabletest values(x);
end;
end;//
call obpackagetest.a('test1');
call obpackagetest.b('test2');
select * from obtabletest;
+-------+
| a     |
+-------+
| test1 |
| test2 |
+-------+
drop table obtabletest;
drop package obpackagetest;

create table obtabletest (a varchar(10));
create package obpackagetest as
procedure a(x varchar(10));
procedure a(x int);
end;//
create package body obpackagetest as
procedure a(x varchar(10)) is
begin
insert into obtabletest values('varchar');
end;
procedure a(x int) is
begin
insert into obtabletest values('int');
end;
end;//
call obpackagetest.a('test1');
call obpackagetest.a(1);
select * from obtabletest;
+---------+
| a       |
+---------+
| varchar |
| int     |
+---------+
drop table obtabletest;
drop package obpackagetest;

create table obtabletest (a varchar(10));
create package obpackagetest as
procedure b(x int);
end;//
create package body obpackagetest as
procedure a(x varchar(10)) is
begin
insert into obtabletest values('varchar');
end;
procedure a(x int) is
begin
insert into obtabletest values('int');
end;
procedure b(x int) is
begin
if x=0 then
call a("test");
else
call a(1);
end if;
end;
end;//
call obpackagetest.b(0);
call obpackagetest.b(1);
select * from obtabletest;
+---------+
| a       |
+---------+
| varchar |
| int     |
+---------+
drop table obtabletest;
drop package obpackagetest;

create table obtabletest (a varchar(10));
create package obpackagetest as
procedure b(x int);
end;//
create package body obpackagetest as
procedure b(x int) is
begin
call a("test");
end;
procedure a(x varchar(10)) is
begin
insert into obtabletest values('varchar');
end;
end;//
call obpackagetest.b(0);
ERROR 42000: procedure obpackagetest.a does not exist
select * from obtabletest;
+------+
| a    |
+------+
+------+
drop table obtabletest;
drop package obpackagetest;

create table obtabletest (a varchar(10));
create package obpackagetest as
procedure b(x int);
end;//
create package body obpackagetest as
procedure a(x varchar(10));
procedure b(x int) is
begin
call a("test");
end;
procedure a(x varchar(10)) is
begin
insert into obtabletest values('varchar');
end;
end;//
call obpackagetest.b(0);
select * from obtabletest;
+---------+
| a       |
+---------+
| varchar |
+---------+
drop table obtabletest;
drop package obpackagetest;

create table obtabletest (a varchar(10));
create package obpackagetest as
procedure b(x varchar(10));
procedure b(x int);
end;//
create package body obpackagetest as
procedure a(x varchar(10)) is
begin
call b(x);
end;
procedure b(x int) is
begin
call a('test');
end;
procedure b(x varchar(10)) is
begin
insert into obtabletest values('varchar');
end;
end;//
call obpackagetest.b(0);
select * from obtabletest;
+---------+
| a       |
+---------+
| varchar |
+---------+
drop table obtabletest;
drop package obpackagetest;

create table obtabletest (a varchar(10));
create package obpackagetest as
procedure a();
end;//
call obpackagetest.a();
ERROR 42000: PACKAGE BODY 'test.obpackagetest' does not exist
drop table obtabletest;
drop package obpackagetest;

create table obtabletest (a varchar(10));
create package obpackagetest as
procedure a();
end;//
create package body obpackagetest as
end;//
call obpackagetest.a();
ERROR 0A000: package routine not supported
drop table obtabletest;
drop package obpackagetest;

create table obtabletest (a varchar(10));
create package obpackagetest as
procedure b(x int);
end;//
create package body obpackagetest as
procedure a(x varchar(10)) is
begin
insert into obtabletest values('varchar');
end;
procedure a() is
begin
insert into obtabletest values('void');
end;
procedure b(x int) is
begin
if x=0 then
call a("test");
else
call a();
end if;
end;
end;//
call obpackagetest.b(0);
call obpackagetest.b(1);
select * from obtabletest;
+---------+
| a       |
+---------+
| varchar |
| void    |
+---------+
drop table obtabletest;
drop package obpackagetest;

create table obtabletest (a varchar(10), b int);
create package obpackagetest as
procedure a(x varchar(10), y int);
end;//
create package body obpackagetest as
procedure a(x varchar(10), 
            y int) 
is
begin
insert into obtabletest values(x, y);
end;
end;//
call obpackagetest.a('test', 1);
select * from obtabletest;
+------+------+
| a    | b    |
+------+------+
| test |    1 |
+------+------+
drop table obtabletest;
drop package obpackagetest;

create table obtabletest (a varchar(20));
create package obpackagetest as
declare type tab_type is table of varchar(20);
declare x varchar(20) default 'test_default';
procedure a();
end;//
create package body obpackagetest as
procedure a() is
begin
insert into obtabletest values('test_insert');
end;
end;//

create table obtabletest (a varchar(20));

call obpackagetest.a();//
ERROR 42000: Unknown database 'obpackagetest'
do begin call obpackagetest.a(); end;//
ERROR 42000: Unknown database 'obpackagetest'
do begin declare x varchar(20) default obpackagetest.x;insert into obtabletest values(x);end;//
ERROR 42000: Undeclared variable: obpackagetest
do begin declare x obpackagetest.tab_type;do x.extend;set x(1)='test_tab';insert into obtabletest values(x(1));end;//
ERROR 42000: package does not exist

call test.obpackagetest.a();//
do begin call test.obpackagetest.a(); end;//
do begin declare x varchar(20) default test.obpackagetest.x;insert into test.obtabletest values(x);end;//
do begin declare x test.obpackagetest.tab_type;do x.extend;set x(1)='test_tab';insert into test.obtabletest values(x(1));end;//
select * from test.obtabletest;//
+--------------+
| a            |
+--------------+
| test_default |
| test_tab     |
+--------------+

delete from test2.obtabletest;//
call test2.obpackagetest.a();//
ERROR 42000: package does not exist
do begin call test2.obpackagetest.a(); end;//
ERROR 42000: package does not exist
do begin declare x varchar(20) default test2.obpackagetest.x;insert into test.obtabletest values(x);end;//
ERROR 42000: Undeclared variable: obpackagetest
do begin declare x test2.obpackagetest.tab_type;do x.extend;set x(1)='test_tab';insert into test2.obtabletest values(x(1));end;//
ERROR 42000: package does not exist

drop table obtabletest;
drop table obtabletest;
drop package obpackagetest;

###package var###
create table obtabletest (a varchar(10));
create package obpackagetest as
declare x varchar(10) default 'test';
procedure p();
end;//
create package body obpackagetest as
procedure p() is
begin
declare y varchar(10);
set y = x;
insert into obtabletest values(y);
end;
end;//
call obpackagetest.p();
select * from obtabletest;
+------+
| a    |
+------+
| test |
+------+
drop table obtabletest;
drop package obpackagetest;

create table obtabletest (a varchar(10));
create package obpackagetest as
procedure p();
end;//
create package body obpackagetest as
declare x varchar(10) default 'test';
procedure p() is
begin
declare y varchar(10);
set y = x;
insert into obtabletest values(y);
end;
end;//
call obpackagetest.p();
select * from obtabletest;
+------+
| a    |
+------+
| test |
+------+
drop table obtabletest;
drop package obpackagetest;

create table obtabletest (a varchar(10));
create package obpackagetest as
declare x varchar(10) default 'test';
procedure p();
end;//
create package body obpackagetest as
declare x varchar(10) default 'test';
procedure p() is
begin
end;
end;//
call obpackagetest.p();
ERROR 42000: Duplicate variable: x
select * from obtabletest;
+------+
| a    |
+------+
+------+
drop table obtabletest;
drop package obpackagetest;

create package obpackagetest as
declare type typ_rec is record (x varchar(10), y int);
procedure p();
end;//
create package body obpackagetest as
declare type typ_rec is record (x varchar(10), y int);
procedure p() is
begin
end;
end;//
call obpackagetest.p();
ERROR 42000: Duplicate type: typ_rec
drop package obpackagetest;

create table obtabletest (a varchar(10));
insert into obtabletest values('test1');
insert into obtabletest values('test2');
create package obpackagetest as
declare x varchar(10) default 'test1';
procedure p();
end;//
create package body obpackagetest as
procedure p() is
begin
declare y varchar(10);
select * from obtabletest where a = x into y;
insert into obtabletest values(y);
end;
end;//
call obpackagetest.p();
select * from obtabletest;
+-------+
| a     |
+-------+
| test1 |
| test2 |
| test1 |
+-------+
drop table obtabletest;
drop package obpackagetest;

create table obtabletest (a varchar(10));
create package obpackagetest as
declare x varchar(10);
procedure p();
end;//
create package body obpackagetest as
procedure p() is
begin
set x = 'test';
insert into obtabletest values(x);
end;
end;//
call obpackagetest.p();
select * from obtabletest;
+------+
| a    |
+------+
| test |
+------+
drop table obtabletest;
drop package obpackagetest;

create table obtabletest (a varchar(10));
create package obpackagetest as
procedure p();
end;//
create package body obpackagetest as
declare x varchar(10);
procedure p() is
begin
set x = 'test';
insert into obtabletest values(x);
end;
end;//
call obpackagetest.p();
select * from obtabletest;
+------+
| a    |
+------+
| test |
+------+
drop table obtabletest;
drop package obpackagetest;

create table obtabletest (a varchar(10), b int);
create package obpackagetest as
declare type typ_rec is record (x varchar(10), y int);
declare res typ_rec;
procedure p();
end;//
create package body obpackagetest as
procedure p() is
begin
set res.x = 'test1';
set res.y = 1;
insert into obtabletest values(res.x, res.y);
end;
end;//
call obpackagetest.p();
select * from obtabletest;
+-------+------+
| a     | b    |
+-------+------+
| test1 |    1 |
+-------+------+
drop table obtabletest;
drop package obpackagetest;

create table obtabletest (a varchar(10), b varchar(10));
create package obpackagetest as
declare type tab_type is table of varchar(10);
declare v_tab tab_type;
procedure p();
end;//
create package body obpackagetest as
procedure p() is
begin
do v_tab.extend;
set v_tab(1) = 'test1';
do v_tab.extend;
set v_tab(2) = 'test2';
insert into obtabletest values(v_tab(1), v_tab(2));
end;
end;//
call obpackagetest.p();
select * from obtabletest;
+-------+-------+
| a     | b     |
+-------+-------+
| test1 | test2 |
+-------+-------+
drop table obtabletest;
drop package obpackagetest;

create table obtabletest (a varchar(10), b varchar(10));
create package obpackagetest as
declare tab_idx integer;
declare type tab_type is table of varchar(10);
declare v_tab tab_type;
procedure p();
end;//
create package body obpackagetest as
procedure p() is
begin
do v_tab.extend;
set tab_idx = 1;
set v_tab(tab_idx) = 'test1';
set tab_idx = 2;
do v_tab.extend;
set v_tab(tab_idx) = 'test2';
insert into obtabletest values(v_tab(tab_idx), v_tab(tab_idx));
end;
end;//
call obpackagetest.p();
select * from obtabletest;
+-------+-------+
| a     | b     |
+-------+-------+
| test2 | test2 |
+-------+-------+
drop table obtabletest;
drop package obpackagetest;

create table obtabletest (a bool);
create package obpackagetest as
declare x bool;
end;//
do
begin
set obpackagetest.x = true;
insert into obtabletest values(obpackagetest.x);
end;//
select * from obtabletest;
+------+
| a    |
+------+
|    1 |
+------+
drop table obtabletest;
drop package obpackagetest;

create table obtabletest (a int);
create package obpackagetest as
declare x int;
end;//
do
begin
set obpackagetest.x = 1;
insert into obtabletest values(obpackagetest.x);
end;//
select * from obtabletest;
+------+
| a    |
+------+
|    1 |
+------+
drop table obtabletest;
drop package obpackagetest;

create table obtabletest (a varchar(10));
create package obpackagetest as
declare x varchar(10);
end;//
do
begin
set obpackagetest.x = 'test';
insert into obtabletest values(obpackagetest.x);
end;//
select * from obtabletest;
+------+
| a    |
+------+
| test |
+------+
drop table obtabletest;
drop package obpackagetest;

create table obtabletest (a decimal(6,2));
create package obpackagetest as
declare x decimal(6,2);
end;//
do
begin
set obpackagetest.x = 1000.23;
insert into obtabletest values(obpackagetest.x);
end;//
select * from obtabletest;
+---------+
| a       |
+---------+
| 1000.23 |
+---------+
drop table obtabletest;
drop package obpackagetest;

create table obtabletest (a varchar(10), b int);
create package obpackagetest as
declare type typ_rec is record (x varchar(10), y int);
declare res typ_rec;
end;//
do
begin
set obpackagetest.res.x = 'test1';
set obpackagetest.res.y = 1;
insert into obtabletest values(obpackagetest.res.x, obpackagetest.res.y);
end;//
select * from obtabletest;
+-------+------+
| a     | b    |
+-------+------+
| test1 |    1 |
+-------+------+
drop table obtabletest;
drop package obpackagetest;

create table obtabletest (a decimal(6,2), b int);
create package obpackagetest as
declare type typ_rec is record (x decimal(6,2), y int);
declare res typ_rec;
end;//
do
begin
set obpackagetest.res.x = 1000.23;
set obpackagetest.res.y = 1;
insert into obtabletest values(obpackagetest.res.x, obpackagetest.res.y);
end;//
select * from obtabletest;
+---------+------+
| a       | b    |
+---------+------+
| 1000.23 |    1 |
+---------+------+
drop table obtabletest;
drop package obpackagetest;

create table a(a1 int, a2 int);
insert into a values(1,1);
create table b(b1 int, b2 int);
create package obpackagetest as
declare type typ_rec is record (x int, y int);
declare res typ_rec;
end;//
do
begin
declare c cursor for  select a1,a2 from a;
open c;
fetch c into obpackagetest.res;
insert into b values(obpackagetest.res.x, obpackagetest.res.y);
close c;
end//
select * from b;
+------+------+
| b1   | b2   |
+------+------+
|    1 |    1 |
+------+------+
drop table a;
drop table b;
drop package obpackagetest;

create table a(a1 decimal(6,2), a2 decimal(6,2));
insert into a values(1000.23,1001.23);
create table b(b1 decimal(6,2), b2 decimal(6,2));
create package obpackagetest as
declare type typ_rec is record (x decimal(6,2), y decimal(6,2));
declare res typ_rec;
end;//
do
begin
declare c cursor for  select a1,a2 from a;
open c;
fetch c into obpackagetest.res;
insert into b values(obpackagetest.res.x, obpackagetest.res.y);
close c;
end//
select * from b;
+---------+---------+
| b1      | b2      |
+---------+---------+
| 1000.23 | 1001.23 |
+---------+---------+
drop table a;
drop table b;
drop package obpackagetest;

create table obtabletest (a int, b int);
create package obpackagetest as
declare type tab_type is table of int;
declare v_tab tab_type;
end;//
do
begin
do obpackagetest.v_tab.extend;
set obpackagetest.v_tab(1) = 1;
do obpackagetest.v_tab.extend;
set obpackagetest.v_tab(2) = 2;
insert into obtabletest values(obpackagetest.v_tab(1), obpackagetest.v_tab(2));
end;//
select * from obtabletest;
+------+------+
| a    | b    |
+------+------+
|    1 |    2 |
+------+------+
drop table obtabletest;
drop package obpackagetest;

create table obtabletest (a varchar(10), b varchar(10));
create package obpackagetest as
declare type tab_type is table of varchar(10);
declare v_tab tab_type;
end;//
do
begin
do obpackagetest.v_tab.extend;
set obpackagetest.v_tab(1) = 'test1';
do obpackagetest.v_tab.extend;
set obpackagetest.v_tab(2) = 'test2';
insert into obtabletest values(obpackagetest.v_tab(1), obpackagetest.v_tab(2));
end;//
select * from obtabletest;
+-------+-------+
| a     | b     |
+-------+-------+
| test1 | test2 |
+-------+-------+
drop table obtabletest;
drop package obpackagetest;

create table obtabletest (a decimal(6,2), b decimal(6,2));
create package obpackagetest as
declare type tab_type is table of decimal(6,2);
declare v_tab tab_type;
end;//
do
begin
do obpackagetest.v_tab.extend;
set obpackagetest.v_tab(1) = 1000.23;
do obpackagetest.v_tab.extend;
set obpackagetest.v_tab(2) = 1001.23;
insert into obtabletest values(obpackagetest.v_tab(1), obpackagetest.v_tab(2));
end;//
select * from obtabletest;
+---------+---------+
| a       | b       |
+---------+---------+
| 1000.23 | 1001.23 |
+---------+---------+
drop table obtabletest;
drop package obpackagetest;

create table obtabletest (a decimal(6,2), b varchar(10));
create package obpackagetest as
declare type typ_rec is record (x decimal(6,2), y varchar(10));
declare type tab_type is table of typ_rec;
declare v_tab tab_type;
end;//
do
begin
do obpackagetest.v_tab.extend;
set obpackagetest.v_tab(1).x = 1000.23;
set obpackagetest.v_tab(1).y = 'test1';
do obpackagetest.v_tab.extend;
set obpackagetest.v_tab(2).x = 1001.23;
set obpackagetest.v_tab(2).y = 'test2';
insert into obtabletest values(obpackagetest.v_tab(1).x, obpackagetest.v_tab(1).y);
insert into obtabletest values(obpackagetest.v_tab(2).x, obpackagetest.v_tab(2).y);
end;//
select * from obtabletest;
+---------+-------+
| a       | b     |
+---------+-------+
| 1000.23 | test1 |
| 1001.23 | test2 |
+---------+-------+
drop table obtabletest;
drop package obpackagetest;

create table a(a1 bigint);
insert into a values(1);
insert into a values(2);
create table b(b1 bigint);
create package obpackagetest as
declare type tab_type is table of bigint;
declare v_tab tab_type;
end;//
do
begin
declare c cursor for select a1 from a;
open c;
fetch c bulk collect into obpackagetest.v_tab limit 1000;
insert into b values(obpackagetest.v_tab(1));
insert into b values(obpackagetest.v_tab(2));
close c;
end//
select * from b;
+------+
| b1   |
+------+
|    1 |
|    2 |
+------+
drop table a;
drop table b;
drop package obpackagetest;

create table a(a1 decimal(6,2));
insert into a values(1000.23);
insert into a values(1001.23);
create table b(b1 decimal(6,2));
create package obpackagetest as
declare type tab_type is table of decimal(6,2);
declare v_tab tab_type;
end;//
do
begin
declare c cursor for select a1 from a;
open c;
fetch c bulk collect into obpackagetest.v_tab limit 1000;
insert into b values(obpackagetest.v_tab(1));
insert into b values(obpackagetest.v_tab(2));
close c;
end//
select * from b;
+---------+
| b1      |
+---------+
| 1000.23 |
| 1001.23 |
+---------+
drop table a;
drop table b;
drop package obpackagetest;

create table obtabletest (a decimal(6,2), b varchar(10));
insert into obtabletest values(1000.23, 'test1'), (1001.23, 'test2');
create package obpackagetest as
declare type typ_rec is record (x decimal(6,2), y varchar(10));
declare type tab_type is table of typ_rec;
declare v_tab tab_type;
end;//
do
begin
declare c cursor for select a, b from obtabletest;
open c;
fetch c bulk collect into obpackagetest.v_tab limit 1000;
insert into obtabletest values(obpackagetest.v_tab(1).x, obpackagetest.v_tab(1).y);
insert into obtabletest values(obpackagetest.v_tab(2).x, obpackagetest.v_tab(2).y);
close c;
end;//
select * from obtabletest;
+---------+-------+
| a       | b     |
+---------+-------+
| 1000.23 | test1 |
| 1001.23 | test2 |
| 1000.23 | test1 |
| 1001.23 | test2 |
+---------+-------+
drop table obtabletest;
drop package obpackagetest;

create table obtabletest (a varchar(10), b int);
create package obpackagetest as
declare type typ_rec is record (x varchar(10), y int);
end;//
do
begin
declare res obpackagetest.typ_rec;
set res.x = 'test1';
set res.y = 1;
insert into obtabletest values(res.x, res.y);
end;//
select * from obtabletest;
+-------+------+
| a     | b    |
+-------+------+
| test1 |    1 |
+-------+------+
drop table obtabletest;
drop package obpackagetest;

create table obtabletest (a varchar(10), b varchar(10));
create package obpackagetest as
declare type tab_type is table of varchar(10);
end;//
do
begin
declare v_tab obpackagetest.tab_type;
do v_tab.extend;
set v_tab(1) = 'test1';
do v_tab.extend;
set v_tab(2) = 'test2';
insert into obtabletest values(v_tab(1), v_tab(2));
end;//
select * from obtabletest;
+-------+-------+
| a     | b     |
+-------+-------+
| test1 | test2 |
+-------+-------+
drop table obtabletest;
drop package obpackagetest;

create table obtabletest (a varchar(10));
create package obpackagetest as
declare x varchar(10);
end;//
create package body obpackagetest as
begin
set x = 'test';
end;//
do
begin
insert into obtabletest values(obpackagetest.x);
end;//
select * from obtabletest;
+------+
| a    |
+------+
| test |
+------+
drop table obtabletest;
drop package obpackagetest;

drop tenant if exists tt1 force;
drop resource pool if exists test_resource_pool1;
drop resource unit if exists test_resource_unit1;

