drop table if exists query_timeout_t;
create table query_timeout_t (c1 int, c2 int, primary key(c1, c2), c3 int);
insert into query_timeout_t values (1, 2, 3);
set query timeout to 50us
set ob_query_timeout=50;
select * from query_timeout_t;
Got one of the listed errors
set query timeout to 5s
set ob_query_timeout=5000000;
drop table if exists query_timeout_t;
create table query_timeout_t(c1 int primary key, c2 int);
replace into query_timeout_t values(1,1);
set query timeout to 500ms
set ob_query_timeout=500000;
select * from query_timeout_t where c1=1;
c1	c2
1	1
select count(*) from query_timeout_t;
count(*)
1
select * from query_timeout_t union select * from query_timeout_t;
c1	c2
1	1
update query_timeout_t set c2=2 where c1=1;
set query timeout to 200ms
set ob_query_timeout=200000;
select * from query_timeout_t where c1=1;
c1	c2
1	2
select count(*) from query_timeout_t;
count(*)
1
select * from query_timeout_t union select * from query_timeout_t;
c1	c2
1	2
update query_timeout_t set c2=2 where c1=1;
set query timeout to 10us
set ob_query_timeout=10;
select count(*) from query_timeout_t;
Got one of the listed errors
select * from query_timeout_t union select * from query_timeout_t;
Got one of the listed errors
set ob_query_timeout=1500000;
drop table query_timeout_t;
set ob_query_timeout=1;
set ob_query_timeout=10000000;
