set @@session.binlog_row_image = "full";
create database if not exists db1;
use db1;
drop table if exists test;
create table test(c1 int primary key, c2 int default 2, c3 int ,c4 int, c5 int,  unique key(c4,c5));
insert into test values(1,1,1,1,1);
insert into test values(2,2,2,2,2);
select * from test;
c1	c2	c3	c4	c5
1	1	1	1	1
2	2	2	2	2
replace into test (c1, c4,c5) values (3,1,2);
select * from test;
c1	c2	c3	c4	c5
1	1	1	1	1
2	2	2	2	2
3	2	NULL	1	2
replace into test (c1, c4,c5) values (1,4,4);
select * from test;
c1	c2	c3	c4	c5
1	2	NULL	4	4
2	2	2	2	2
3	2	NULL	1	2
replace into test (c1,c4,c5) values (2,1,2),(1,1,2);
select * from test;
c1	c2	c3	c4	c5
1	2	NULL	1	2
replace into test (c1, c4,c5) values (4,4,4);
select * from test;
c1	c2	c3	c4	c5
1	2	NULL	1	2
4	2	NULL	4	4
replace into test(c1,c4,c5) values(2,4,4);
select * from test;
c1	c2	c3	c4	c5
1	2	NULL	1	2
2	2	NULL	4	4
drop table test;
create table test(c1 int primary key, c2 int, c3 int, c4 int, c5 int, unique key(c2,c3));
insert into test values(2,1,1,1,1),(3,3,3,3,3) on duplicate key update c2=9;
select * from test;
c1	c2	c3	c4	c5
2	1	1	1	1
3	3	3	3	3
insert into test values(2,1,1,1,1),(3,3,3,3,3),(4,4,4,4,4) on duplicate key update c2=10;
select * from test;
c1	c2	c3	c4	c5
2	10	1	1	1
3	10	3	3	3
4	4	4	4	4
insert into test values(5,4,4,4,4) on duplicate key update c2=10;
select * from test;
c1	c2	c3	c4	c5
2	10	1	1	1
3	10	3	3	3
4	10	4	4	4
insert into test values(2,1,1,1,1) on duplicate key update c2=10;
insert into test values(4,10,4,3,2) on duplicate key update c3=10;
select * from test;
c1	c2	c3	c4	c5
2	10	1	1	1
3	10	3	3	3
4	10	10	4	4
insert into test values(2,10,10,10,10) on duplicate key update c3 = c3+1,c4=c4+1;
select * from test;
c1	c2	c3	c4	c5
2	10	2	2	1
3	10	3	3	3
4	10	10	4	4
drop table test;
create table test(c1 int primary key, c2 int, c3 int, c4 char, c5 int not null, unique key(c2,c3));
replace into test (c1,c2,c3) values(2,3,3);
ERROR HY000: Field 'c5' doesn't have a default value
replace into test values(2,3,3,3,3);
insert into test (c1,c2,c3,c5) values(1,2,2,2) on duplicate key update c5=c5+1;
select * from test;
c1	c2	c3	c4	c5
1	2	2	NULL	2
2	3	3	3	3
insert into test (c1,c2,c3,c5) values(1,2,2,2) on duplicate key update c5=c4+1;
ERROR 23000: Column cannot be null
select * from test;
c1	c2	c3	c4	c5
1	2	2	NULL	2
2	3	3	3	3
insert into test (c1,c2,c3) values(4,4,4) on duplicate key update c5=c4+1;
ERROR HY000: Field 'c5' doesn't have a default value
select * from test;
c1	c2	c3	c4	c5
1	2	2	NULL	2
2	3	3	3	3
insert into test  values(4,4,4,4,4) on duplicate key update c5=c4+1;
select * from test;
c1	c2	c3	c4	c5
1	2	2	NULL	2
2	3	3	3	3
4	4	4	4	4
drop table test;
create table test (c1 int primary key, c2 int ,c3 int, c4 int,c5 int, unique key(c4,c5));
insert into test values(1,1,1,1,1);
insert into test values(2,2,2,2,2);
insert into test values(1,2,2,3,3) on duplicate key update c3=c4+c5;
select * from test;
c1	c2	c3	c4	c5
1	1	2	1	1
2	2	2	2	2
insert into test values(1,2,2,3,3) on duplicate key update c3=c4+c5,c4=c4+1;
select * from test;
c1	c2	c3	c4	c5
1	1	2	2	1
2	2	2	2	2
insert into test values(1,2,2,3,3) on duplicate key update c1 = c2+1;
ERROR 23000: Duplicate entry '2' for key 'PRIMARY'
insert into test values(1,2,2,3,3) on duplicate key update c1 = c2+2;
select * from test;
c1	c2	c3	c4	c5
2	2	2	2	2
3	1	2	2	1
insert into test values(4,4,4,4,4) on duplicate key update c1 = c2;
select * from test;
c1	c2	c3	c4	c5
2	2	2	2	2
3	1	2	2	1
4	4	4	4	4
insert into test values(4,4,4,4,4) on duplicate key update c4=c4+c5;
select * from test;
c1	c2	c3	c4	c5
2	2	2	2	2
3	1	2	2	1
4	4	4	8	4
insert into test values(4,4,4,4,4) on duplicate key update c1 = c4;
select * from test;
c1	c2	c3	c4	c5
2	2	2	2	2
3	1	2	2	1
8	4	4	8	4
insert into test values(4,4,4,4,4) on duplicate key update c1 = c4, c3 = c5;
select * from test;
c1	c2	c3	c4	c5
2	2	2	2	2
3	1	2	2	1
4	4	4	4	4
8	4	4	8	4
insert into test values(1,1,1,1,1),(2,2,2,2,2),(3,3,3,3,3),(4,4,4,4,4) on duplicate key update c2=values(c3)+values(c2), c1=values(c1);
select * from test;
c1	c2	c3	c4	c5
1	1	1	1	1
2	4	2	2	2
3	6	2	2	1
4	8	4	4	4
8	4	4	8	4
select values(c1) from test;
values(c1)
NULL
NULL
NULL
NULL
NULL
select values(c1+c2) from test;
ERROR 42000: You have an error in your SQL syntax; check the manual that corresponds to your OceanBase version for the right syntax to use near '+c2) from test' at line 1
insert into test values(3,3,3,3,3),(4,4,4,4,4) on duplicate key update c2=values(c3+c2);
ERROR 42000: You have an error in your SQL syntax; check the manual that corresponds to your OceanBase version for the right syntax to use near '+c2)' at line 1
insert into test values(3,3,3,3,3),(4,4,4,4,4) on duplicate key update c2=values(a);
ERROR 42S22: Unknown column 'a' in 'field list'
insert into test values(3,3,3,3,3),(4,4,4,4,4) on duplicate key update c2=values(3);
ERROR 42000: You have an error in your SQL syntax; check the manual that corresponds to your OceanBase version for the right syntax to use near '3)' at line 1
drop table test;
create table test(c1 int primary key, c2 int, c3 varchar(32), c4 int, c5 int, unique key(c1,c4) LOCAL) partition by hash(c1) partitions 3;
insert into test values(1,1,'a', 1, 1);
insert into test values(2,2,'b',2,2);
insert into test values(3,3,'c',3,3);
select * from test;
c1	c2	c3	c4	c5
1	1	a	1	1
2	2	b	2	2
3	3	c	3	3
replace into test (c1,c2,c4,c5) values(1,4,2,3);
select * from test;
c1	c2	c3	c4	c5
1	4	NULL	2	3
2	2	b	2	2
3	3	c	3	3
replace into test (c1,c2,c4,c5) values(1,2,3,2);
select * from test;
c1	c2	c3	c4	c5
1	2	NULL	3	2
2	2	b	2	2
3	3	c	3	3
drop table test;
CREATE TABLE IF NOT EXISTS t1(      custid int,      campid int,      thedate int,
PRIMARY KEY (thedate,campid)  );
replace into t1(custid, campid, thedate) values(11, 0, '1992');
select * from t1;
custid	campid	thedate
11	0	1992
drop table t1;
create table test(c1 timestamp primary key, c2 int not null, c3 char(4));
insert into test () values ();
ERROR HY000: Field 'c2' doesn't have a default value
insert into test (c2) values (3);
insert into test (c2) values (3);
insert into test (c2) values (3);
select c2 from test;
c2
3
3
3
drop table test;
create table test(c1 timestamp primary key, c2 int);
insert into test values (1);
ERROR 21S01: Column count doesn't match value count at row 1
insert into test() values();
insert into test values();
insert into test values (),(1,2);
ERROR 21S01: Column count doesn't match value count at row 2
insert into test values (2,3),(),(1,2);
ERROR 21S01: Column count doesn't match value count at row 2
insert into test (c1) values();
ERROR 21S01: Column count doesn't match value count at row 1
insert into test (c1,c2) values();
ERROR 21S01: Column count doesn't match value count at row 1
insert into test (c1,c2) values(now(), 1, 3);
ERROR 21S01: Column count doesn't match value count at row 1
select c2 from test;
c2
NULL
NULL
drop table test;
create table tt(c1 int primary key, c2 int, c3 int);
insert into tt values(2,4,6);
insert into tt values(3,4,7);
insert into tt values(6,9,10);
insert into tt values(2,6,3),(3,5,9),(6,12,4) on duplicate key update c2 = values(c2)+values(c3), c3 = values(c1)+values(c3);
succeed
succeed
succeed
succeed
succeed
succeed
drop database db1;
set @@session.binlog_row_image = "minimal";
create database if not exists db1;
use db1;
drop table if exists test;
create table test(c1 int primary key, c2 int default 2, c3 int ,c4 int, c5 int,  unique key(c4,c5));
insert into test values(1,1,1,1,1);
insert into test values(2,2,2,2,2);
select * from test;
c1	c2	c3	c4	c5
1	1	1	1	1
2	2	2	2	2
replace into test (c1, c4,c5) values (3,1,2);
select * from test;
c1	c2	c3	c4	c5
1	1	1	1	1
2	2	2	2	2
3	2	NULL	1	2
replace into test (c1, c4,c5) values (1,4,4);
select * from test;
c1	c2	c3	c4	c5
1	2	NULL	4	4
2	2	2	2	2
3	2	NULL	1	2
replace into test (c1,c4,c5) values (2,1,2),(1,1,2);
select * from test;
c1	c2	c3	c4	c5
1	2	NULL	1	2
replace into test (c1, c4,c5) values (4,4,4);
select * from test;
c1	c2	c3	c4	c5
1	2	NULL	1	2
4	2	NULL	4	4
replace into test(c1,c4,c5) values(2,4,4);
select * from test;
c1	c2	c3	c4	c5
1	2	NULL	1	2
2	2	NULL	4	4
drop table test;
create table test(c1 int primary key, c2 int, c3 int, c4 int, c5 int, unique key(c2,c3));
insert into test values(2,1,1,1,1),(3,3,3,3,3) on duplicate key update c2=9;
select * from test;
c1	c2	c3	c4	c5
2	1	1	1	1
3	3	3	3	3
insert into test values(2,1,1,1,1),(3,3,3,3,3),(4,4,4,4,4) on duplicate key update c2=10;
select * from test;
c1	c2	c3	c4	c5
2	10	1	1	1
3	10	3	3	3
4	4	4	4	4
insert into test values(5,4,4,4,4) on duplicate key update c2=10;
select * from test;
c1	c2	c3	c4	c5
2	10	1	1	1
3	10	3	3	3
4	10	4	4	4
insert into test values(2,1,1,1,1) on duplicate key update c2=10;
insert into test values(4,10,4,3,2) on duplicate key update c3=10;
select * from test;
c1	c2	c3	c4	c5
2	10	1	1	1
3	10	3	3	3
4	10	10	4	4
insert into test values(2,10,10,10,10) on duplicate key update c3 = c3+1,c4=c4+1;
select * from test;
c1	c2	c3	c4	c5
2	10	2	2	1
3	10	3	3	3
4	10	10	4	4
drop table test;
create table test(c1 int primary key, c2 int, c3 int, c4 char, c5 int not null, unique key(c2,c3));
replace into test (c1,c2,c3) values(2,3,3);
ERROR HY000: Field 'c5' doesn't have a default value
replace into test values(2,3,3,3,3);
insert into test (c1,c2,c3,c5) values(1,2,2,2) on duplicate key update c5=c5+1;
select * from test;
c1	c2	c3	c4	c5
1	2	2	NULL	2
2	3	3	3	3
insert into test (c1,c2,c3,c5) values(1,2,2,2) on duplicate key update c5=c4+1;
ERROR 23000: Column cannot be null
select * from test;
c1	c2	c3	c4	c5
1	2	2	NULL	2
2	3	3	3	3
insert into test (c1,c2,c3) values(4,4,4) on duplicate key update c5=c4+1;
ERROR HY000: Field 'c5' doesn't have a default value
select * from test;
c1	c2	c3	c4	c5
1	2	2	NULL	2
2	3	3	3	3
insert into test  values(4,4,4,4,4) on duplicate key update c5=c4+1;
select * from test;
c1	c2	c3	c4	c5
1	2	2	NULL	2
2	3	3	3	3
4	4	4	4	4
drop table test;
create table test (c1 int primary key, c2 int ,c3 int, c4 int,c5 int, unique key(c4,c5));
insert into test values(1,1,1,1,1);
insert into test values(2,2,2,2,2);
insert into test values(1,2,2,3,3) on duplicate key update c3=c4+c5;
select * from test;
c1	c2	c3	c4	c5
1	1	2	1	1
2	2	2	2	2
insert into test values(1,2,2,3,3) on duplicate key update c3=c4+c5,c4=c4+1;
select * from test;
c1	c2	c3	c4	c5
1	1	2	2	1
2	2	2	2	2
insert into test values(1,2,2,3,3) on duplicate key update c1 = c2+1;
ERROR 23000: Duplicate entry '2' for key 'PRIMARY'
insert into test values(1,2,2,3,3) on duplicate key update c1 = c2+2;
select * from test;
c1	c2	c3	c4	c5
2	2	2	2	2
3	1	2	2	1
insert into test values(4,4,4,4,4) on duplicate key update c1 = c2;
select * from test;
c1	c2	c3	c4	c5
2	2	2	2	2
3	1	2	2	1
4	4	4	4	4
insert into test values(4,4,4,4,4) on duplicate key update c4=c4+c5;
select * from test;
c1	c2	c3	c4	c5
2	2	2	2	2
3	1	2	2	1
4	4	4	8	4
insert into test values(4,4,4,4,4) on duplicate key update c1 = c4;
select * from test;
c1	c2	c3	c4	c5
2	2	2	2	2
3	1	2	2	1
8	4	4	8	4
insert into test values(4,4,4,4,4) on duplicate key update c1 = c4, c3 = c5;
select * from test;
c1	c2	c3	c4	c5
2	2	2	2	2
3	1	2	2	1
4	4	4	4	4
8	4	4	8	4
insert into test values(1,1,1,1,1),(2,2,2,2,2),(3,3,3,3,3),(4,4,4,4,4) on duplicate key update
c2=values(c3)+values(c2), c1=values(c1);
select * from test;
c1	c2	c3	c4	c5
1	1	1	1	1
2	4	2	2	2
3	6	2	2	1
4	8	4	4	4
8	4	4	8	4
select values(c1) from test;
values(c1)
NULL
NULL
NULL
NULL
NULL
select values(c1+c2) from test;
ERROR 42000: You have an error in your SQL syntax; check the manual that corresponds to your OceanBase version for the right syntax to use near '+c2) from test' at line 1
insert into test values(3,3,3,3,3),(4,4,4,4,4) on duplicate key update c2=values(c3+c2);
ERROR 42000: You have an error in your SQL syntax; check the manual that corresponds to your OceanBase version for the right syntax to use near '+c2)' at line 1
insert into test values(3,3,3,3,3),(4,4,4,4,4) on duplicate key update c2=values(a);
ERROR 42S22: Unknown column 'a' in 'field list'
insert into test values(3,3,3,3,3),(4,4,4,4,4) on duplicate key update c2=values(3);
ERROR 42000: You have an error in your SQL syntax; check the manual that corresponds to your OceanBase version for the right syntax to use near '3)' at line 1
drop table test;
create table test(c1 int primary key, c2 int, c3 varchar(32), c4 int, c5 int, unique key(c1, c4) LOCAL) partition by hash(c1) partitions 3;
insert into test values(1,1,'a', 1, 1);
insert into test values(2,2,'b',2,2);
insert into test values(3,3,'c',3,3);
select * from test;
c1	c2	c3	c4	c5
1	1	a	1	1
2	2	b	2	2
3	3	c	3	3
replace into test (c1,c2,c4,c5) values(1,4,2,3);
select * from test;
c1	c2	c3	c4	c5
1	4	NULL	2	3
2	2	b	2	2
3	3	c	3	3
replace into test (c1,c2,c4,c5) values(1,2,3,2);
select * from test;
c1	c2	c3	c4	c5
1	2	NULL	3	2
2	2	b	2	2
3	3	c	3	3
drop table test;
CREATE TABLE IF NOT EXISTS t1(      custid int,      campid int,      thedate int,
PRIMARY KEY (thedate,campid)  );
replace into t1(custid, campid, thedate) values(11, 0, '1992');
select * from t1;
custid	campid	thedate
11	0	1992
drop table t1;
create table test(c1 timestamp primary key, c2 int not null, c3 char(4));
insert into test () values ();
ERROR HY000: Field 'c2' doesn't have a default value
insert into test (c2) values (3);
insert into test (c2) values (3);
insert into test (c2) values (3);
select c2 from test;
c2
3
3
3
drop table test;
create table test(c1 timestamp primary key, c2 int);
insert into test values (1);
ERROR 21S01: Column count doesn't match value count at row 1
insert into test() values();
insert into test values();
insert into test values (),(1,2);
ERROR 21S01: Column count doesn't match value count at row 2
insert into test values (2,3),(),(1,2);
ERROR 21S01: Column count doesn't match value count at row 2
insert into test (c1) values();
ERROR 21S01: Column count doesn't match value count at row 1
insert into test (c1,c2) values();
ERROR 21S01: Column count doesn't match value count at row 1
insert into test (c1,c2) values(now(), 1, 3);
ERROR 21S01: Column count doesn't match value count at row 1
select c2 from test;
c2
NULL
NULL
drop table test;
create table tt(c1 int primary key, c2 int, c3 int);
insert into tt values(2,4,6);
insert into tt values(3,4,7);
insert into tt values(6,9,10);
insert into tt values(2,6,3),(3,5,9),(6,12,4) on duplicate key update c2 = values(c2)+values(c3), c3 = values(c1)+values(c3);
succeed
succeed
succeed
succeed
succeed
succeed
drop database db1;
set @@session.binlog_row_image = "full";
drop database if exists tt;
create database tt;
use tt;
create table t1(pk1 int, c1 int, c2 int, c3 int, primary key(pk1));
insert into t1(pk1, c1, c2, c3) values (1,0,10,0), (2,1,2,1),(3,1,3,1);
select * from t1 where c1>=0 and c2=2 order by c1, c2 limit 3;
pk1	c1	c2	c3
2	1	2	1
update t1 set c1=c1, c2=c2*10, c3=c3*10 where c1>=0 and c2=2 order by c1, c2 limit 3;
select * from t1 where pk1=2;
pk1	c1	c2	c3
2	1	20	10
drop table t1;
create table test(c1 int primary key, c2 char(2));
replace into test values(1, 3);
insert into test values(3,5) on duplicate key update c2 = 5;
insert into test values(3,5) on duplicate key update c2 = 5;
select * from test;
c1	c2
1	3
3	5
drop table test;
create table tt(c1 int primary key, c2 int);
insert into tt values(1,2),(2,2);
update tt set c2 = 2;
update tt set c2 = 3;
update tt set c2  = 4 limit 1;
replace into tt values(4,2),(5,3);
replace into tt values(4,3), (5,3);
insert into tt values(3,2),(4,2) on duplicate key update c2 = 2;
insert into tt values(3,2),(4,2) on duplicate key update c2 = 2;
drop table tt;
create table t1(c1 int primary key, c2 int, c3 int, unique key(c2));
replace into t1 values(1,2, 3),(3,4, 2);
replace into t1 values(1,2,3),(3,4,2);
replace into t1 values(1,4, 3),(3,5, 2);
drop table t1;
create table t2 (c1 int primary key, c2 int auto_increment, c3 timestamp, c4 int not null, c5 int, c6 int default 5);
insert into t2 values(1, default, default, default, default, 3);
ERROR HY000: Field doesn't have a default value
insert into t2 values(1, default, default, 4, default,4);
update t2 set c2 = default;
select c2 from t2;
c2
0
update t2 set c3 = default;
select default(c2),default(c3) from t2;
default(c2)	default(c3)
0	0000-00-00 00:00:00
select default(c4) from t2;
ERROR HY000: Field 'c4' doesn't have a default value
select default(c5) from t2;
default(c5)
NULL
insert into t2 values(2, 3, NULL, 4, 3, 4);
update t2 set c2 = default(c6) where c1 = 2;
select c2 from t2;
c2
0
5
drop table t2;
create table tt(c1 int primary key , c2 char(4), c5 char(6));
insert into tt values(1,2,3);
set @@session.sql_mode = '';
insert into tt values(1,2,3) on duplicate key update c2 = 'abcde', c5 = concat(c2, '33');
select * from tt;
c1	c2	c5
1	abcd	abcd33
drop table tt;
create table test(c1 char(4), c5 char(6), c2 binary(3), c3  binary(5));
insert into test values(1,2,3,4);
update test set c1 ="abcdd", c5 = concat(c1, '12');
select * from test;
c1	c5	c2	c3
abcd	abcd12	3  	4    
drop table test;
create table t_0(c1 bigint primary key, c2 varchar(20) unique, c3 decimal(5,3) default 0.33, c4 timestamp default '2015-11-12 11:00:00', c5 smallint auto_increment, unique index (c3), c6 int, unique index(c4,c5), index (c6) );
insert into t_0 (c1,c2,c3,c4,c5,c6) values(1,'a',1.33,'2015-11-12 11:00:01',1, 1),(2,'aa',2.33,'2015-11-12 11:00:02',1, 1),(3,'b',3.33,'2015-11-12 11:00:02',2, 3);
insert into t_0 (c1, c2, c3, c4, c5, c6) values(31,'31',31.1,'2016-11-12 11:00:00',31, 31),(32,'32',32.1,'2017-11-12 11:00:00',32, 32),(33,'33',33.1,'2017-11-12 11:00:00',33, 33),(34,'34',34.1,'2018-11-12 11:00:00',34, 34);
insert into t_0 values(6,'aa',7.33,'2015-11-12 11:00:10',7, 7) on duplicate key update c5=values(c6);
drop table t_0;
create table index_table(c1 int, c2 char(128), c3 int, c4 char(128), c5 int, c6 char(128), primary key(c1, c2), unique key(c3,c4));
create index t1_index_table on index_table (c5);
insert into index_table values (1, '10.232.35.40', 1, 'a', 1, 'a');
insert into index_table values (2, '10.232.35.41', 2, 'b', 2, 'b');
insert into index_table values (3, '10.232.35.42', 3, 'c', 3, 'c');
insert into index_table values (4, '10.232.35.43', 4, 'd', 4, 'd');
alter system major freeze tenant = sys;
alter system major freeze tenant = all_user;
alter system major freeze tenant = all_meta;
replace into index_table values(1, '10.232.35.41', 2, 'c', 3, 'a');
select * from index_table;
c1	c2	c3	c4	c5	c6
1	10.232.35.40	1	a	1	a
1	10.232.35.41	2	c	3	a
2	10.232.35.41	2	b	2	b
3	10.232.35.42	3	c	3	c
4	10.232.35.43	4	d	4	d
replace into index_table values(1, '10.232.35.40', '2', 'b', 4, 'c');
select * from index_table;
c1	c2	c3	c4	c5	c6
1	10.232.35.40	2	b	4	c
1	10.232.35.41	2	c	3	a
3	10.232.35.42	3	c	3	c
4	10.232.35.43	4	d	4	d
insert into index_table values (1, '10.232.35.40', 1, 'a', 1, 'a') on duplicate key update c6 = concat(c6, 'a');
insert into index_table values (2, '10.232.35.41', 2, 'b', 2, 'b') on duplicate key update c6 = concat(c6, 'a');
insert into index_table values (3, '10.232.35.42', 3, 'c', 3, 'c') on duplicate key update c6 = concat(c6, 'a');
insert into index_table values (4, '10.232.35.43', 4, 'd', 4, 'd') on duplicate key update c6 = concat(c6, 'a');
insert into index_table values (1, '10.232.35.41', 2, 'c', 3, 'a') on duplicate key update c6 = concat(c6, 'a');
insert into index_table values (1, '10.232.35.40', '2', 'b', 4, 'c') on duplicate key update c6 = concat(c6, 'a');
select * from index_table;
c1	c2	c3	c4	c5	c6
1	10.232.35.40	2	b	4	caaa
1	10.232.35.41	2	c	3	aa
3	10.232.35.42	3	c	3	ca
4	10.232.35.43	4	d	4	da
alter system major freeze tenant = sys;
alter system major freeze tenant = all_user;
alter system major freeze tenant = all_meta;
select * from index_table;
c1	c2	c3	c4	c5	c6
1	10.232.35.40	2	b	4	caaa
1	10.232.35.41	2	c	3	aa
3	10.232.35.42	3	c	3	ca
4	10.232.35.43	4	d	4	da
insert into index_table values (1, '10.232.35.40', 1, 'a', 1, 'a') on duplicate key update c6 = concat(c6, 'a');
insert into index_table values (2, '10.232.35.41', 2, 'b', 2, 'b') on duplicate key update c6 = concat(c6, 'a');
insert into index_table values (3, '10.232.35.42', 3, 'c', 3, 'c') on duplicate key update c6 = concat(c6, 'a');
insert into index_table values (4, '10.232.35.43', 4, 'd', 4, 'd') on duplicate key update c6 = concat(c6, 'a');
insert into index_table values (1, '10.232.35.41', 2, 'c', 3, 'a') on duplicate key update c6 = concat(c6, 'a');
insert into index_table values (1, '10.232.35.40', '2', 'b', 4, 'c') on duplicate key update c6 = concat(c6, 'a');
select * from index_table;
c1	c2	c3	c4	c5	c6
1	10.232.35.40	2	b	4	caaaaaa
1	10.232.35.41	2	c	3	aaa
3	10.232.35.42	3	c	3	caa
4	10.232.35.43	4	d	4	daa
alter system major freeze tenant = sys;
alter system major freeze tenant = all_user;
alter system major freeze tenant = all_meta;
select * from index_table;
c1	c2	c3	c4	c5	c6
1	10.232.35.40	2	b	4	caaaaaa
1	10.232.35.41	2	c	3	aaa
3	10.232.35.42	3	c	3	caa
4	10.232.35.43	4	d	4	daa
drop table if exists t_0;
create table t_0(c1 bigint primary key, c2 varchar(20) unique, c3 decimal(5,3) default 0.33, c4 timestamp default '2015-11-12 11:00:00', c5 smallint auto_increment, unique index (c3), c6 int, unique index(c4,c5), index (c6) );
insert into t_0 (c1,c2,c3,c4,c5,c6) values(1,'a',1.33,'2015-11-12 11:00:01',1,1),(2,'aa',2.33,'2015-11-12 11:00:02',1, 1),(3,'b',3.33,'2015-11-12 11:00:02',2, 3);
insert into t_0  values(1, 'a',8.33,'2015-11-12 11:00:11',8, 9) on duplicate key update c3 = values(c3) + 20;
select * from t_0;
c1	c2	c3	c4	c5	c6
1	a	28.330	2015-11-12 11:00:01	1	1
2	aa	2.330	2015-11-12 11:00:02	1	1
3	b	3.330	2015-11-12 11:00:02	2	3
create table test(c1 int primary key, c2 int);
insert into test values(1,2) on duplicate key update c1 = c1 + 3, c2 = c1+ 3;
select * from test;
c1	c2
1	2
insert into test values(1,2) on duplicate key update c1 = c1 + 3, c2 = c1+ 3;
select * from test;
c1	c2
4	7
drop table test;
drop table if exists test;
create table test(pk1 int, pk2 int, first_name varchar(100), last_name varchar(100), primary key(pk1, pk2));
insert into test values(1,1, 'first                     1', 'last                    1');
create index test_index ON test(first_name(10));
replace into test(pk1,pk2,first_name,last_name) values (1, 1, 'first                     1', 'last                    2');
select * from test;
pk1	pk2	first_name	last_name
1	1	first                     1	last                    2
insert into test(pk1,pk2,first_name,last_name) values (1, 1, 'first                     1', 'last                    2') on duplicate key update last_name = 'dtew';
select * from test;
pk1	pk2	first_name	last_name
1	1	first                     1	dtew
drop table test;
drop database tt;
