ERROR 42000: You have an error in your SQL syntax; check the manual that corresponds to your OceanBase version for the right syntax to use near 'server_type=rootserver' at line 1
create table t1(pk int primary key, a int);
insert into t1 values(1,0),(2,0),(4,0),(3,0);
insert into t1 values(0,0);
insert into t1 values(5,0),(6,0),(7,0);
select * from t1;
pk	a
0	0
1	0
2	0
3	0
4	0
5	0
6	0
7	0
select * from t1 where pk = 9;
pk	a
alter system major freeze tenant = sys;
alter system major freeze tenant = all_user;
alter system major freeze tenant = all_meta;
select * from t1;
pk	a
0	0
1	0
2	0
3	0
4	0
5	0
6	0
7	0
delete from t1 where pk = 1;
select * from t1 where pk = 1;
pk	a
delete from t1 where pk = 2;
insert into t1 values(2, 5);
select * from t1 where pk = 2;
pk	a
2	5
update t1 set a = 10 where pk = 3;
select * from t1 where pk = 3;
pk	a
3	10
alter system major freeze tenant = sys;
alter system major freeze tenant = all_user;
alter system major freeze tenant = all_meta;
select * from t1;
pk	a
0	0
2	5
3	10
4	0
5	0
6	0
7	0
drop table t1;
