DROP TABLE IF EXISTS table0_bigint;
CREATE TABLE table0_bigint (
col_char_12_key char(12),
col_char_12 char(12),
col_bigint_key bigint,
pk bigint,
col_bigint bigint,
/*Indices*/
key idx3(col_char_12_key ),
key idx1(col_bigint_key ),
primary key (pk)) ;
SELECT 1 FROM table0_bigint WHERE col_bigint_key BETWEEN CAST( 4 AS CHAR(100) ) AND CAST( 5 AS CHAR(100) ) FOR UPDATE;
1
SELECT 1 FROM table0_bigint WHERE pk IN ( SUBSTR( CAST( ( 0 ) AS CHAR(100) ) , 1 , 12 ) , SUBSTR( CAST( ( LENGTH('KVVBZ') ) AS CHAR(100) ) , 1 , 12 ) , SUBSTR( CAST( ( ROUND( -100 + -1 ) ) AS CHAR(100) ) , 1 , 12 ) , SUBSTR( CAST( ( 7 ) AS CHAR(100) ) , 1 , 12 ) , SUBSTR( CAST( ( ROUND( ROUND( 9 - 9 ) + 1 ) ) AS CHAR(100) ) , 1 , 12 ) ) FOR UPDATE;
1
SELECT 1 FROM table0_bigint WHERE pk NOT IN ( 9 , 10 , 10 , -1 , 1 ) FOR UPDATE;
1
SELECT pk FROM table0_bigint WHERE col_bigint_key NOT IN ( CAST(1 AS CHAR(100)) , CAST(-100 AS CHAR(100)) , CAST(-1 AS CHAR(100)) ) ORDER BY pk,pk  , pk  LIMIT 160 , 1 /* RESULTSET_HAS_ZERO_OR_ONE_ROWS */;
pk
SELECT DISTINCT 1 FROM table0_bigint ORDER BY pk;
1
UPDATE table0_bigint SET col_char_12_key = SUBSTR( CAST( ( ROUND ( 186 ) ) AS CHAR(100) ) , 1 , 12 ) WHERE col_char_12_key < CAST(-9 AS CHAR(100)) ORDER BY col_char_12_key DESC , pk ASC LIMIT 1 ;
SELECT * FROM table0_bigint ORDER BY pk;
col_char_12_key	col_char_12	col_bigint_key	pk	col_bigint
SELECT DISTINCT NULL , UPPER( col_bigint_key ) , TRUE , FALSE , 1 FROM table0_bigint ORDER BY col_char_12 ASC , pk DESC;
NULL	UPPER( col_bigint_key )	TRUE	FALSE	1
INSERT INTO table0_bigint ( pk , col_bigint_key ) VALUES ( 4, CAST( 1 AS CHAR(100)) ) , ( 10, CAST( -10 AS CHAR(100)) ) ;
SELECT * FROM table0_bigint ORDER BY pk;
col_char_12_key	col_char_12	col_bigint_key	pk	col_bigint
NULL	NULL	1	4	NULL
NULL	NULL	-10	10	NULL
SELECT 1 FROM table0_bigint WHERE col_bigint_key BETWEEN SUBSTR( CAST( ( ROUND( LENGTH('CJIIR') * 10 ) ) AS CHAR(100) ) , 1 , 12 ) AND SUBSTR( CAST( ( SIGN ( ROUND( 2 + 10 ) ) ) AS CHAR(100) ) , 1 , 12 ) FOR UPDATE;
1
INSERT INTO table0_bigint ( pk , col_char_12_key ) VALUES ( 1 , SUBSTR( CAST( ( CEIL ( 2 ) ) AS CHAR(100) ) , 1 , 12 ) ) ;
SELECT * FROM table0_bigint ORDER BY pk;
col_char_12_key	col_char_12	col_bigint_key	pk	col_bigint
2	NULL	NULL	1	NULL
NULL	NULL	1	4	NULL
NULL	NULL	-10	10	NULL
SELECT * FROM table0_bigint WHERE col_bigint_key IN ( SUBSTR( CAST( ( ROUND( -100 * -9 ) ) AS CHAR(100) ) , 1 , 12 ) , SUBSTR( CAST( ( LENGTH('JEHST') ) AS CHAR(100) ) , 1 , 12 ) , SUBSTR( CAST( ( ROUND( 9 * ROUND( -10 + -100 ) ) ) AS CHAR(100) ) , 1 , 12 ) , SUBSTR( CAST( ( LENGTH('NBDVY') ) AS CHAR(100) ) , 1 , 12 ) , SUBSTR( CAST( ( ROUND( 1 + 99 ) ) AS CHAR(100) ) , 1 , 12 ) ) ORDER BY col_char_12_key , pk DESC LIMIT 2;
col_char_12_key	col_char_12	col_bigint_key	pk	col_bigint
SELECT 1 FROM table0_bigint WHERE pk BETWEEN SUBSTR( CAST( ( LENGTH('NKBGL') ) AS CHAR(100) ) , 1 , 12 ) AND SUBSTR( CAST( ( 74 ) AS CHAR(100) ) , 1 , 12 ) FOR UPDATE;
1
1
SELECT 1 FROM table0_bigint WHERE pk IN ( SUBSTR( CAST( ( ROUND( -100 - -1 ) ) AS CHAR(100) ) , 1 , 12 ) , SUBSTR( CAST( ( ROUND( FLOOR ( 0 ) * 9 ) ) AS CHAR(100) ) , 1 , 12 ) , SUBSTR( CAST( ( LENGTH( SUBSTR( CAST( ( ROUND( -100 * ROUND ( ROUND( 1 + ROUND( 0 - LENGTH( SUBSTR( CAST( ( CEIL ( ROUND( LENGTH( SUBSTR( CAST( ( ABS ( LENGTH('NHODW') ) ) AS CHAR(100) ) , 1 , 12 ) ) * 1 ) ) ) AS CHAR(100) ) , 1 , 12 ) ) ) ) ) ) ) AS CHAR(100) ) , 1 , 12 ) ) ) AS CHAR(100) ) , 1 , 12 ) , SUBSTR( CAST( ( LENGTH('BFHMS') ) AS CHAR(100) ) , 1 , 12 ) , SUBSTR( CAST( ( ROUND( -100 * -10 ) ) AS CHAR(100) ) , 1 , 12 ) ) FOR UPDATE;
1
1
SELECT  NULL , UPPER( pk ) , TRUE , FALSE , 1 FROM table0_bigint ORDER BY col_bigint_key , col_char_12_key , pk ASC;
NULL	UPPER( pk )	TRUE	FALSE	1
NULL	1	1	0	1
NULL	10	1	0	1
NULL	4	1	0	1
SELECT UPPER( pk ) FROM table0_bigint WHERE col_char_12_key < CAST(-1 AS CHAR(100)) GROUP BY pk ORDER BY pk LIMIT 3;
UPPER( pk )
SELECT 1 FROM table0_bigint WHERE col_bigint BETWEEN SUBSTR( CAST( ( 9 ) AS CHAR(100) ) , 1 , 12 ) AND SUBSTR( CAST( ( FLOOR ( 223 ) ) AS CHAR(100) ) , 1 , 12 ) FOR UPDATE;
1
SELECT * FROM table0_bigint WHERE 4 > LENGTH('FVRNR') ORDER BY col_char_12_key,pk DESC , pk  LIMIT 7;
col_char_12_key	col_char_12	col_bigint_key	pk	col_bigint
UPDATE table0_bigint SET pk = SUBSTR( CAST( ( ROUND( -1 + 3 ) ) AS CHAR(100) ) , 1 , 12 ) , col_bigint = SUBSTR( CAST( ( ROUND( ROUND( -9 + ROUND( 248 + ROUND( 9 - 7 ) ) ) + -100 ) ) AS CHAR(100) ) , 1 , 12 ) , col_char_12_key = SUBSTR( CAST( ( ABS ( 1 ) ) AS CHAR(100) ) , 1 , 12 ) WHERE 71 < ROUND( LENGTH('JNDDV') - 1 ) ORDER BY col_char_12  , pk  LIMIT 6 ;
SELECT * FROM table0_bigint ORDER BY pk;
col_char_12_key	col_char_12	col_bigint_key	pk	col_bigint
2	NULL	NULL	1	NULL
NULL	NULL	1	4	NULL
NULL	NULL	-10	10	NULL
UPDATE table0_bigint SET col_bigint = col_bigint_key WHERE col_bigint_key < CAST(1 AS CHAR(100)) ORDER BY pk LIMIT 5 ;
SELECT * FROM table0_bigint ORDER BY pk;
col_char_12_key	col_char_12	col_bigint_key	pk	col_bigint
2	NULL	NULL	1	NULL
NULL	NULL	1	4	NULL
NULL	NULL	-10	10	-10
SELECT UPPER( col_char_12_key ),pk FROM table0_bigint WHERE ( 247791616 , -1050411008 , -857145344 , 10485760 , -1488650240 ) NOT IN ( ( SUBSTR( CAST( ( LENGTH('OPLLO') ) AS CHAR(100) ) , 1 , 12 ) , SUBSTR( CAST( ( ABS ( 0 ) ) AS CHAR(100) ) , 1 , 12 ) , SUBSTR( CAST( ( LENGTH('KXMCG') ) AS CHAR(100) ) , 1 , 12 ) , SUBSTR( CAST( ( 0 ) AS CHAR(100) ) , 1 , 12 ) , SUBSTR( CAST( ( ROUND( 9 + ROUND( LENGTH('TEYSW') * 0 ) ) ) AS CHAR(100) ) , 1 , 12 ) ) ) GROUP BY col_char_12_key,pk ORDER BY col_char_12_key,pk LIMIT 7 , 8;
UPPER( col_char_12_key )	pk
UPDATE table0_bigint SET pk = SUBSTR( CAST( ( ROUND( -100 * -100 ) ) AS CHAR(100) ) , 1 , 12 ) , col_char_12_key = SUBSTR(concat( CAST(col_bigint_key AS CHAR(100)) , SUBSTR( CAST( ( ROUND( -100 + 1 ) ) AS CHAR(100) ) , 1 , 12 ) ) , 1 , 12 ) WHERE col_bigint_key IN ( 9 , 10 , 0 , 9 , 10 ) ORDER BY col_bigint  , col_char_12 ASC , pk DESC LIMIT 5 ;
SELECT * FROM table0_bigint ORDER BY pk;
col_char_12_key	col_char_12	col_bigint_key	pk	col_bigint
2	NULL	NULL	1	NULL
NULL	NULL	1	4	NULL
NULL	NULL	-10	10	-10
INSERT INTO table0_bigint ( pk , col_bigint_key, col_char_12 ) VALUES ( 9 , SUBSTR( CAST( ( ROUND( -10 - SIGN ( 5 ) ) ) AS CHAR(100) ) , 1 , 12 ) , SUBSTR( CAST( ( LENGTH('ZKJSP') ) AS CHAR(100) ) , 1 , 12 ) ) ;
SELECT * FROM table0_bigint ORDER BY pk;
col_char_12_key	col_char_12	col_bigint_key	pk	col_bigint
2	NULL	NULL	1	NULL
NULL	NULL	1	4	NULL
NULL	5	-11	9	NULL
NULL	NULL	-10	10	-10
SELECT * FROM table0_bigint WHERE 0 != -10 ORDER BY col_bigint,col_bigint_key,col_char_12,col_char_12_key,pk,pk ASC , pk ASC LIMIT 7 , 3;
col_char_12_key	col_char_12	col_bigint_key	pk	col_bigint
UPDATE table0_bigint SET col_bigint_key = SUBSTR( CAST( ( ROUND( ABS ( 218 ) + 99 ) ) AS CHAR(100) ) , 1 , 12 ) WHERE col_bigint = ( SUBSTR( CAST( ( ABS ( SIGN ( 5 ) ) ) AS CHAR(100) ) , 1 , 12 ) ) ORDER BY col_bigint DESC , col_char_12 DESC , pk DESC LIMIT 1 ;
SELECT * FROM table0_bigint ORDER BY pk;
col_char_12_key	col_char_12	col_bigint_key	pk	col_bigint
2	NULL	NULL	1	NULL
NULL	NULL	1	4	NULL
NULL	5	-11	9	NULL
NULL	NULL	-10	10	-10
SELECT 1 FROM table0_bigint WHERE col_bigint_key > ( SUBSTR( CAST( ( ROUND( -9 + 0 ) ) AS CHAR(100) ) , 1 , 12 ) ) AND pk >= ( SUBSTR( CAST( ( 99 ) AS CHAR(100) ) , 1 , 12 ) ) FOR UPDATE;
1
SELECT * FROM table0_bigint WHERE col_bigint < LENGTH( SUBSTR( CAST( ( ROUND( 196 - -1 ) ) AS CHAR(100) ) , 1 , 12 ) ) ORDER BY col_bigint  , col_char_12_key DESC , pk ASC LIMIT 4 , 1;
col_char_12_key	col_char_12	col_bigint_key	pk	col_bigint
SELECT * FROM table0_bigint WHERE ( -1000865792 , -629014528 , 1698299904 , -1707606016 , -1834876928 ) IN ( ( SUBSTR( CAST( ( CEIL ( ROUND( 10 * ROUND( ROUND( 123 * FLOOR ( -1 ) ) + -10 ) ) ) ) AS CHAR(100) ) , 1 , 12 ) , SUBSTR( CAST( ( ROUND ( LENGTH( SUBSTR( CAST( ( ROUND( LENGTH( SUBSTR( CAST( ( LENGTH('MUGRJ') ) AS CHAR(100) ) , 1 , 12 ) ) * -1 ) ) AS CHAR(100) ) , 1 , 12 ) ) ) ) AS CHAR(100) ) , 1 , 12 ) , SUBSTR( CAST( ( CEIL ( ROUND ( ROUND( -1 + 10 ) ) ) ) AS CHAR(100) ) , 1 , 12 ) , SUBSTR( CAST( ( 99 ) AS CHAR(100) ) , 1 , 12 ) , SUBSTR( CAST( ( CEIL ( LENGTH( SUBSTR( CAST( ( ABS ( CEIL ( CEIL ( 5 ) ) ) ) AS CHAR(100) ) , 1 , 12 ) ) ) ) AS CHAR(100) ) , 1 , 12 ) ) ) ORDER BY col_bigint_key , col_char_12_key,pk  , pk ASC LIMIT 2;
col_char_12_key	col_char_12	col_bigint_key	pk	col_bigint
SELECT col_bigint_key FROM table0_bigint WHERE pk <= ( SUBSTR( CAST( ( FLOOR ( LENGTH('AUYKC') ) ) AS CHAR(100) ) , 1 , 12 ) ) ORDER BY col_bigint_key , pk DESC LIMIT 7 , 1 /* RESULTSET_HAS_ZERO_OR_ONE_ROWS */;
col_bigint_key
SELECT col_bigint,col_bigint_key,col_char_12,col_char_12_key,pk FROM table0_bigint WHERE col_char_12_key IN ( CAST(9 AS CHAR(100)) , CAST(0 AS CHAR(100)) , CAST(9 AS CHAR(100)) ) GROUP BY col_bigint,col_bigint_key,col_char_12,col_char_12_key,pk ORDER BY col_bigint,col_bigint_key,col_char_12,col_char_12_key,pk LIMIT 1;
col_bigint	col_bigint_key	col_char_12	col_char_12_key	pk
INSERT INTO table0_bigint ( pk , col_bigint_key, col_char_12 ) VALUES ( 83 , SUBSTR( CAST( ( ROUND( 99 - 99 ) ) AS CHAR(100) ) , 1 , 12 ) , SUBSTR( CAST( ( ROUND( 1 + 9 ) ) AS CHAR(100) ) , 1 , 12 ) ) ;
SELECT * FROM table0_bigint ORDER BY pk;
col_char_12_key	col_char_12	col_bigint_key	pk	col_bigint
2	NULL	NULL	1	NULL
NULL	NULL	1	4	NULL
NULL	5	-11	9	NULL
NULL	NULL	-10	10	-10
NULL	10	0	83	NULL
UPDATE table0_bigint SET col_char_12_key = col_char_12_key WHERE LENGTH( SUBSTR( CAST( ( LENGTH('PDMTE') ) AS CHAR(100) ) , 1 , 12 ) ) != LENGTH( SUBSTR( CAST( ( ROUND( 10 + SIGN ( 138 ) ) ) AS CHAR(100) ) , 1 , 12 ) ) ORDER BY col_char_12_key , pk  LIMIT 5 ;
SELECT * FROM table0_bigint ORDER BY pk;
col_char_12_key	col_char_12	col_bigint_key	pk	col_bigint
2	NULL	NULL	1	NULL
NULL	NULL	1	4	NULL
NULL	5	-11	9	NULL
NULL	NULL	-10	10	-10
NULL	10	0	83	NULL
SELECT pk FROM table0_bigint WHERE col_bigint_key IN ( SUBSTR( CAST( ( LENGTH( SUBSTR( CAST( ( 0 ) AS CHAR(100) ) , 1 , 12 ) ) ) AS CHAR(100) ) , 1 , 12 ) , SUBSTR( CAST( ( CEIL ( 124 ) ) AS CHAR(100) ) , 1 , 12 ) , SUBSTR( CAST( ( ROUND( 9 * LENGTH( SUBSTR( CAST( ( LENGTH('WBLUY') ) AS CHAR(100) ) , 1 , 12 ) ) ) ) AS CHAR(100) ) , 1 , 12 ) , SUBSTR( CAST( ( LENGTH( SUBSTR( CAST( ( ROUND ( LENGTH( SUBSTR( CAST( ( FLOOR ( ROUND( 1 * FLOOR ( LENGTH('NKGKI') ) ) ) ) AS CHAR(100) ) , 1 , 12 ) ) ) ) AS CHAR(100) ) , 1 , 12 ) ) ) AS CHAR(100) ) , 1 , 12 ) , SUBSTR( CAST( ( FLOOR ( CEIL ( 9 ) ) ) AS CHAR(100) ) , 1 , 12 ) ) ORDER BY pk,pk DESC , pk  LIMIT 1 /* RESULTSET_HAS_ZERO_OR_ONE_ROWS */;
pk
4
SELECT * FROM table0_bigint WHERE ROUND( ROUND( 10 + 48 ) + 10 ) <= ROUND( 6 * 5 ) ORDER BY col_bigint_key , col_char_12_key , pk DESC LIMIT 2 , 3;
col_char_12_key	col_char_12	col_bigint_key	pk	col_bigint
SELECT  9999 FROM table0_bigint ORDER BY col_char_12_key , col_char_12_key , pk DESC;
9999
9999
9999
9999
9999
9999
SELECT col_bigint , col_char_12 FROM table0_bigint  ORDER BY col_char_12_key , col_bigint_key , pk  LIMIT 1 /* RESULTSET_HAS_ZERO_OR_ONE_ROWS */;
col_bigint	col_char_12
NULL	5
SELECT 1 FROM table0_bigint WHERE  ( col_bigint > SUBSTR( CAST( ( SIGN ( ROUND( -9 + -10 ) ) ) AS CHAR(100) ) , 1 , 12 ) ) AND NOT ( col_char_12 > SUBSTR( CAST( ( ROUND ( ROUND( 0 * 52 ) ) ) AS CHAR(100) ) , 1 , 12 ) ) FOR UPDATE;
1
UPDATE table0_bigint SET col_char_12_key = col_char_12_key WHERE pk NOT IN ( -9 , -1 , 1 , -9 , 9 ) ORDER BY col_bigint_key ASC , pk ASC LIMIT 6 ;
SELECT * FROM table0_bigint ORDER BY pk;
col_char_12_key	col_char_12	col_bigint_key	pk	col_bigint
2	NULL	NULL	1	NULL
NULL	NULL	1	4	NULL
NULL	5	-11	9	NULL
NULL	NULL	-10	10	-10
NULL	10	0	83	NULL
UPDATE table0_bigint SET col_bigint_key = col_bigint_key WHERE col_char_12_key NOT IN ( CAST(62 AS CHAR(100)) , CAST(-9 AS CHAR(100)) , CAST(1 AS CHAR(100)) ) ORDER BY col_bigint ASC , pk  LIMIT 4 ;
SELECT * FROM table0_bigint ORDER BY pk;
col_char_12_key	col_char_12	col_bigint_key	pk	col_bigint
2	NULL	NULL	1	NULL
NULL	NULL	1	4	NULL
NULL	5	-11	9	NULL
NULL	NULL	-10	10	-10
NULL	10	0	83	NULL
INSERT INTO table0_bigint ( pk , col_bigint_key ) VALUES ( 110, CAST( 99 AS CHAR(100)) ) , ( 1, CAST( -10 AS CHAR(100)) ) ;
ERROR 23000: Duplicate entry '1' for key 'PRIMARY'
SELECT * FROM table0_bigint ORDER BY pk;
col_char_12_key	col_char_12	col_bigint_key	pk	col_bigint
2	NULL	NULL	1	NULL
NULL	NULL	1	4	NULL
NULL	5	-11	9	NULL
NULL	NULL	-10	10	-10
NULL	10	0	83	NULL
SELECT col_char_12_key FROM table0_bigint WHERE NOT ( pk <> SUBSTR( CAST( ( LENGTH( SUBSTR( CAST( ( LENGTH('OQLGN') ) AS CHAR(100) ) , 1 , 12 ) ) ) AS CHAR(100) ) , 1 , 12 ) ) OR NOT ( col_bigint != SUBSTR( CAST( ( SIGN ( FLOOR ( SIGN ( ROUND( -1 * 104 ) ) ) ) ) AS CHAR(100) ) , 1 , 12 ) ) AND  ( col_bigint_key <> SUBSTR( CAST( ( ROUND( -9 * 9 ) ) AS CHAR(100) ) , 1 , 12 ) ) ORDER BY pk LIMIT 3;
col_char_12_key
2
SELECT  NULL , pk , TRUE , col_bigint_key , FALSE , 1 FROM table0_bigint ORDER BY col_bigint_key , col_char_12_key , pk ;
NULL	pk	TRUE	col_bigint_key	FALSE	1
NULL	1	1	NULL	0	1
NULL	9	1	-11	0	1
NULL	10	1	-10	0	1
NULL	83	1	0	0	1
NULL	4	1	1	0	1
SELECT col_bigint_key FROM table0_bigint WHERE col_char_12 IN ( SUBSTR( CAST( ( CEIL ( -10 ) ) AS CHAR(100) ) , 1 , 12 ) , SUBSTR( CAST( ( CEIL ( ROUND( 35 - ROUND( 0 - 10 ) ) ) ) AS CHAR(100) ) , 1 , 12 ) , SUBSTR( CAST( ( LENGTH('ZPVYC') ) AS CHAR(100) ) , 1 , 12 ) , SUBSTR( CAST( ( ROUND( 99 * 99 ) ) AS CHAR(100) ) , 1 , 12 ) , SUBSTR( CAST( ( ROUND( -100 + 1 ) ) AS CHAR(100) ) , 1 , 12 ) ) ORDER BY pk LIMIT 1 /* RESULTSET_HAS_ZERO_OR_ONE_ROWS */;
col_bigint_key
-11
UPDATE table0_bigint SET pk = -100 , col_char_12_key = SUBSTR(concat( CAST(col_bigint AS CHAR(100)) , SUBSTR( CAST( ( SIGN ( 65 ) ) AS CHAR(100) ) , 1 , 12 )) , 1 , 12 ) WHERE ( -1061814272 , -1248264192 ) IN ( ( SUBSTR( CAST( ( ROUND( 99 + -1 ) ) AS CHAR(100) ) , 1 , 12 ) , SUBSTR( CAST( ( ROUND( 0 - -9 ) ) AS CHAR(100) ) , 1 , 12 ) ) , ( SUBSTR( CAST( ( ROUND( 50 + LENGTH( SUBSTR( CAST( ( CEIL ( 5 ) ) AS CHAR(100) ) , 1 , 12 ) ) ) ) AS CHAR(100) ) , 1 , 12 ) , SUBSTR( CAST( ( ROUND( LENGTH( SUBSTR( CAST( ( ROUND( 224 * ROUND( -10 + ROUND( 174 + 0 ) ) ) ) AS CHAR(100) ) , 1 , 12 ) ) + 0 ) ) AS CHAR(100) ) , 1 , 12 ) ) ) ORDER BY col_bigint_key , col_char_12_key , pk ASC LIMIT 39 ;
SELECT * FROM table0_bigint ORDER BY pk;
col_char_12_key	col_char_12	col_bigint_key	pk	col_bigint
2	NULL	NULL	1	NULL
NULL	NULL	1	4	NULL
NULL	5	-11	9	NULL
NULL	NULL	-10	10	-10
NULL	10	0	83	NULL
SELECT col_bigint FROM table0_bigint WHERE col_bigint_key >= ( SUBSTR( CAST( ( LENGTH( SUBSTR( CAST( ( ROUND( ROUND( -9 - -100 ) - 10 ) ) AS CHAR(100) ) , 1 , 12 ) ) ) AS CHAR(100) ) , 1 , 12 ) ) ORDER BY col_bigint_key , pk ASC LIMIT 227 , 1 /* RESULTSET_HAS_ZERO_OR_ONE_ROWS */;
col_bigint
INSERT INTO table0_bigint ( pk , col_char_12_key ) VALUES ( -10 , SUBSTR( CAST( ( ROUND ( 99 ) ) AS CHAR(100) ) , 1 , 12 ) ) ;
SELECT * FROM table0_bigint ORDER BY pk;
col_char_12_key	col_char_12	col_bigint_key	pk	col_bigint
99	NULL	NULL	-10	NULL
2	NULL	NULL	1	NULL
NULL	NULL	1	4	NULL
NULL	5	-11	9	NULL
NULL	NULL	-10	10	-10
NULL	10	0	83	NULL
SELECT pk FROM table0_bigint WHERE ROUND ( 0 ) < SUBSTR( CAST( ( ROUND( 99 * ROUND( 221 + 9 ) ) ) AS CHAR(100) ) , 1 , 12 ) ORDER BY col_bigint_key ASC , col_char_12 ASC , pk ASC LIMIT 2 , 1 /* RESULTSET_HAS_ZERO_OR_ONE_ROWS */;
pk
9
SELECT COUNT( col_bigint ) FROM table0_bigint WHERE LENGTH('OTQIA') != LENGTH( SUBSTR( CAST( ( ROUND( 53 + ROUND( -100 - 99 ) ) ) AS CHAR(100) ) , 1 , 12 ) ) ORDER BY pk LIMIT 106 , 3 /* RESULTSET_HAS_ZERO_OR_ONE_ROWS */;
COUNT( col_bigint )
INSERT INTO table0_bigint (pk) VALUES ( 9 ) ;
ERROR 23000: Duplicate entry '9' for key 'PRIMARY'
SELECT * FROM table0_bigint ORDER BY pk;
col_char_12_key	col_char_12	col_bigint_key	pk	col_bigint
99	NULL	NULL	-10	NULL
2	NULL	NULL	1	NULL
NULL	NULL	1	4	NULL
NULL	5	-11	9	NULL
NULL	NULL	-10	10	-10
NULL	10	0	83	NULL
SELECT 1 FROM table0_bigint WHERE NOT ( col_char_12_key < SUBSTR( CAST( ( 6 ) AS CHAR(100) ) , 1 , 12 ) ) AND NOT ( col_bigint >= SUBSTR( CAST( ( ROUND( LENGTH( SUBSTR( CAST( ( LENGTH( SUBSTR( CAST( ( 239 ) AS CHAR(100) ) , 1 , 12 ) ) ) AS CHAR(100) ) , 1 , 12 ) ) * 180 ) ) AS CHAR(100) ) , 1 , 12 ) ) FOR UPDATE;
1
SELECT col_bigint_key,pk FROM table0_bigint WHERE pk NOT IN ( 1 , 163 , -9 , 9 , -9 ) GROUP BY col_bigint_key,pk ORDER BY col_bigint_key,pk LIMIT 1;
col_bigint_key	pk
NULL	-10
SELECT col_char_12_key,pk FROM table0_bigint WHERE LENGTH( SUBSTR( CAST( ( ROUND( 0 - LENGTH('MRHGO') ) ) AS CHAR(100) ) , 1 , 12 ) ) > ROUND ( LENGTH( SUBSTR( CAST( ( ROUND( 99 - 4 ) ) AS CHAR(100) ) , 1 , 12 ) ) ) GROUP BY col_char_12_key,pk ORDER BY col_char_12_key,pk LIMIT 1 , 2;
col_char_12_key	pk
SELECT * FROM table0_bigint WHERE col_bigint_key NOT IN ( CAST(-1 AS CHAR(100)) , CAST(99 AS CHAR(100)) , CAST(10 AS CHAR(100)) ) ORDER BY col_bigint_key , pk  LIMIT 1 , 2;
col_char_12_key	col_char_12	col_bigint_key	pk	col_bigint
NULL	NULL	-10	10	-10
NULL	10	0	83	NULL
INSERT INTO table0_bigint ( pk , col_bigint, col_char_12 ) VALUES ( 99 , SUBSTR( CAST( ( LENGTH('NOZET') ) AS CHAR(100) ) , 1 , 12 ) , SUBSTR( CAST( ( 9 ) AS CHAR(100) ) , 1 , 12 ) ) ;
SELECT * FROM table0_bigint ORDER BY pk;
col_char_12_key	col_char_12	col_bigint_key	pk	col_bigint
99	NULL	NULL	-10	NULL
2	NULL	NULL	1	NULL
NULL	NULL	1	4	NULL
NULL	5	-11	9	NULL
NULL	NULL	-10	10	-10
NULL	10	0	83	NULL
NULL	9	NULL	99	5
SELECT 1 FROM table0_bigint WHERE col_char_12 NOT IN ( SUBSTR( CAST( ( LENGTH('WXYFT') ) AS CHAR(100) ) , 1 , 12 ) , SUBSTR( CAST( ( LENGTH( SUBSTR( CAST( ( ROUND( 0 + -10 ) ) AS CHAR(100) ) , 1 , 12 ) ) ) AS CHAR(100) ) , 1 , 12 ) , SUBSTR( CAST( ( ROUND( 251 * -100 ) ) AS CHAR(100) ) , 1 , 12 ) , SUBSTR( CAST( ( ROUND( ROUND( ABS ( 5 ) - 9 ) + -1 ) ) AS CHAR(100) ) , 1 , 12 ) , SUBSTR( CAST( ( ROUND( LENGTH( SUBSTR( CAST( ( CEIL ( LENGTH( SUBSTR( CAST( ( LENGTH('QTYRB') ) AS CHAR(100) ) , 1 , 12 ) ) ) ) AS CHAR(100) ) , 1 , 12 ) ) * -1 ) ) AS CHAR(100) ) , 1 , 12 ) ) FOR UPDATE;
1
1
1
SELECT pk FROM table0_bigint WHERE pk > -1384644608 and pk < -1384644608 ORDER BY pk , col_char_12_key,pk  , pk ASC LIMIT 5 , 8 /* RESULTSET_HAS_ZERO_OR_ONE_ROWS */;
pk
SELECT pk FROM table0_bigint WHERE pk NOT IN ( 237 , -100 , 9 , 99 , 99 ) ORDER BY pk  , pk  LIMIT 5 , 8;
pk
SELECT ALL NULL FROM table0_bigint ORDER BY pk;
NULL
NULL
NULL
NULL
NULL
NULL
NULL
NULL
SELECT  col_bigint,col_bigint_key,col_char_12,col_char_12_key,pk FROM table0_bigint ORDER BY col_bigint DESC , pk ASC;
col_bigint	col_bigint_key	col_char_12	col_char_12_key	pk
5	NULL	9	NULL	99
-10	-10	NULL	NULL	10
NULL	NULL	NULL	99	-10
NULL	NULL	NULL	2	1
NULL	1	NULL	NULL	4
NULL	-11	5	NULL	9
NULL	0	10	NULL	83
SELECT col_bigint_key FROM table0_bigint WHERE -100 >= CEIL ( ROUND( 142 * 7 ) ) ORDER BY col_bigint_key , col_char_12_key , col_bigint_key , pk DESC LIMIT 8 , 1 /* RESULTSET_HAS_ZERO_OR_ONE_ROWS */;
col_bigint_key
SELECT 1 FROM table0_bigint WHERE col_bigint NOT IN ( SUBSTR( CAST( ( ROUND( 10 - LENGTH( SUBSTR( CAST( ( SIGN ( -100 ) ) AS CHAR(100) ) , 1 , 12 ) ) ) ) AS CHAR(100) ) , 1 , 12 ) , SUBSTR( CAST( ( ROUND( 50 - LENGTH( SUBSTR( CAST( ( CEIL ( ROUND( -1 + 12 ) ) ) AS CHAR(100) ) , 1 , 12 ) ) ) ) AS CHAR(100) ) , 1 , 12 ) , SUBSTR( CAST( ( SIGN ( 10 ) ) AS CHAR(100) ) , 1 , 12 ) , SUBSTR( CAST( ( ROUND( -1 * 1 ) ) AS CHAR(100) ) , 1 , 12 ) , SUBSTR( CAST( ( ROUND( 99 + 99 ) ) AS CHAR(100) ) , 1 , 12 ) ) FOR UPDATE;
1
1
1
INSERT INTO table0_bigint ( pk , col_char_12_key ) VALUES ( 154, CAST( -10 AS CHAR(100)) ) , ( -9, CAST( 139 AS CHAR(100)) ) ;
SELECT * FROM table0_bigint ORDER BY pk;
col_char_12_key	col_char_12	col_bigint_key	pk	col_bigint
99	NULL	NULL	-10	NULL
139	NULL	NULL	-9	NULL
2	NULL	NULL	1	NULL
NULL	NULL	1	4	NULL
NULL	5	-11	9	NULL
NULL	NULL	-10	10	-10
NULL	10	0	83	NULL
NULL	9	NULL	99	5
-10	NULL	NULL	154	NULL
SELECT pk , col_bigint , col_char_12_key FROM table0_bigint WHERE pk > ( SUBSTR( CAST( ( ROUND( LENGTH('ZUSND') - 254 ) ) AS CHAR(100) ) , 1 , 12 ) ) ORDER BY col_bigint_key ASC , col_char_12 ASC , pk ASC LIMIT 6 , 6;
pk	col_bigint	col_char_12_key
10	-10	NULL
83	NULL	NULL
4	NULL	NULL
INSERT INTO table0_bigint ( pk , col_char_12_key ) VALUES ( -9 , SUBSTR( CAST( ( ROUND( LENGTH( SUBSTR( CAST( ( CEIL ( LENGTH('LHVXV') ) ) AS CHAR(100) ) , 1 , 12 ) ) + -100 ) ) AS CHAR(100) ) , 1 , 12 ) ) ;
ERROR 23000: Duplicate entry '-9' for key 'PRIMARY'
SELECT * FROM table0_bigint ORDER BY pk;
col_char_12_key	col_char_12	col_bigint_key	pk	col_bigint
99	NULL	NULL	-10	NULL
139	NULL	NULL	-9	NULL
2	NULL	NULL	1	NULL
NULL	NULL	1	4	NULL
NULL	5	-11	9	NULL
NULL	NULL	-10	10	-10
NULL	10	0	83	NULL
NULL	9	NULL	99	5
-10	NULL	NULL	154	NULL
SELECT 1 FROM table0_bigint WHERE pk BETWEEN SUBSTR( CAST( ( ROUND( 1 - ROUND( 159 - -9 ) ) ) AS CHAR(100) ) , 1 , 12 ) AND SUBSTR( CAST( ( ROUND( 1 - 9 ) ) AS CHAR(100) ) , 1 , 12 ) FOR UPDATE;
1
1
1
SELECT UPPER( col_bigint_key ) FROM table0_bigint WHERE col_bigint IN ( 99 , -1 , -1 , 1 , 0 ) GROUP BY col_bigint_key ORDER BY col_bigint_key LIMIT 55 , 1 /* RESULTSET_HAS_ZERO_OR_ONE_ROWS */;
UPPER( col_bigint_key )
SELECT  col_bigint,col_bigint_key,col_char_12,col_char_12_key,pk FROM table0_bigint ORDER BY col_char_12_key , col_bigint_key , col_char_12_key , pk DESC;
col_bigint	col_bigint_key	col_char_12	col_char_12_key	pk
5	NULL	9	NULL	99
NULL	-11	5	NULL	9
-10	-10	NULL	NULL	10
NULL	0	10	NULL	83
NULL	1	NULL	NULL	4
NULL	NULL	NULL	-10	154
NULL	NULL	NULL	139	-9
NULL	NULL	NULL	2	1
NULL	NULL	NULL	99	-10
INSERT INTO table0_bigint ( pk , col_bigint_key ) VALUES ( 99 , SUBSTR( CAST( ( FLOOR ( ROUND( LENGTH( SUBSTR( CAST( ( ROUND( 0 * 9 ) ) AS CHAR(100) ) , 1 , 12 ) ) + -1 ) ) ) AS CHAR(100) ) , 1 , 12 ) ) ;
ERROR 23000: Duplicate entry '99' for key 'PRIMARY'
SELECT * FROM table0_bigint ORDER BY pk;
col_char_12_key	col_char_12	col_bigint_key	pk	col_bigint
99	NULL	NULL	-10	NULL
139	NULL	NULL	-9	NULL
2	NULL	NULL	1	NULL
NULL	NULL	1	4	NULL
NULL	5	-11	9	NULL
NULL	NULL	-10	10	-10
NULL	10	0	83	NULL
NULL	9	NULL	99	5
-10	NULL	NULL	154	NULL
INSERT INTO table0_bigint ( pk , col_bigint_key, col_char_12_key ) VALUES ( 99 , SUBSTR( CAST( ( LENGTH( SUBSTR( CAST( ( ABS ( FLOOR ( -9 ) ) ) AS CHAR(100) ) , 1 , 12 ) ) ) AS CHAR(100) ) , 1 , 12 ) , SUBSTR( CAST( ( ROUND( ROUND( 9 + ROUND( FLOOR ( 9 ) - 11 ) ) - 99 ) ) AS CHAR(100) ) , 1 , 12 ) ) ;
ERROR 23000: Duplicate entry '99' for key 'PRIMARY'
SELECT * FROM table0_bigint ORDER BY pk;
col_char_12_key	col_char_12	col_bigint_key	pk	col_bigint
99	NULL	NULL	-10	NULL
139	NULL	NULL	-9	NULL
2	NULL	NULL	1	NULL
NULL	NULL	1	4	NULL
NULL	5	-11	9	NULL
NULL	NULL	-10	10	-10
NULL	10	0	83	NULL
NULL	9	NULL	99	5
-10	NULL	NULL	154	NULL
SELECT col_char_12_key FROM table0_bigint WHERE ( 1447165952 ) NOT IN ( SUBSTR( CAST( ( ROUND( CEIL ( 10 ) * 243 ) ) AS CHAR(100) ) , 1 , 12 ) , SUBSTR( CAST( ( SIGN ( LENGTH( SUBSTR( CAST( ( ROUND( 99 * ROUND( 85 - 173 ) ) ) AS CHAR(100) ) , 1 , 12 ) ) ) ) AS CHAR(100) ) , 1 , 12 ) , SUBSTR( CAST( ( FLOOR ( -10 ) ) AS CHAR(100) ) , 1 , 12 ) , SUBSTR( CAST( ( 0 ) AS CHAR(100) ) , 1 , 12 ) , SUBSTR( CAST( ( ABS ( ABS ( 211 ) ) ) AS CHAR(100) ) , 1 , 12 ) ) ORDER BY col_bigint ASC , col_char_12_key  , pk DESC LIMIT 1 /* RESULTSET_HAS_ZERO_OR_ONE_ROWS */;
col_char_12_key
NULL
SELECT UPPER( col_char_12_key ),pk FROM table0_bigint WHERE pk BETWEEN SUBSTR( CAST( ( ROUND ( ABS ( -9 ) ) ) AS CHAR(100) ) , 1 , 12 ) AND SUBSTR( CAST( ( 11 ) AS CHAR(100) ) , 1 , 12 ) GROUP BY col_char_12_key,pk ORDER BY col_char_12_key,pk LIMIT 7 , 6;
UPPER( col_char_12_key )	pk
SELECT * FROM table0_bigint WHERE pk IN ( SUBSTR( CAST( ( LENGTH('SPPKB') ) AS CHAR(100) ) , 1 , 12 ) , SUBSTR( CAST( ( CEIL ( ROUND( -10 + -10 ) ) ) AS CHAR(100) ) , 1 , 12 ) , SUBSTR( CAST( ( CEIL ( -10 ) ) AS CHAR(100) ) , 1 , 12 ) , SUBSTR( CAST( ( LENGTH('CJPUM') ) AS CHAR(100) ) , 1 , 12 ) , SUBSTR( CAST( ( ROUND ( ROUND( 31 + CEIL ( -9 ) ) ) ) AS CHAR(100) ) , 1 , 12 ) ) ORDER BY col_bigint ASC , col_char_12 ASC , pk ASC LIMIT 4;
col_char_12_key	col_char_12	col_bigint_key	pk	col_bigint
99	NULL	NULL	-10	NULL
SELECT UPPER( col_char_12 ) FROM table0_bigint WHERE ( -1430192128 , -34471936 ) IN ( ( SUBSTR( CAST( ( SIGN ( ROUND( 36 - ABS ( 9 ) ) ) ) AS CHAR(100) ) , 1 , 12 ) , SUBSTR( CAST( ( ROUND( FLOOR ( 9 ) - 5 ) ) AS CHAR(100) ) , 1 , 12 ) ) , ( SUBSTR( CAST( ( LENGTH('GGZCN') ) AS CHAR(100) ) , 1 , 12 ) , SUBSTR( CAST( ( 51 ) AS CHAR(100) ) , 1 , 12 ) ) ) GROUP BY col_char_12 ORDER BY col_char_12 LIMIT 3 , 1 /* RESULTSET_HAS_ZERO_OR_ONE_ROWS */;
UPPER( col_char_12 )
UPDATE table0_bigint AS X SET X . col_bigint_key = SUBSTR( CAST( ( LENGTH( SUBSTR( CAST( ( ROUND( -10 * 99 ) ) AS CHAR(100) ) , 1 , 12 ) ) ) AS CHAR(100) ) , 1 , 12 ) WHERE pk >= ( SUBSTR( CAST( ( ROUND( -1 * LENGTH( SUBSTR( CAST( ( LENGTH( SUBSTR( CAST( ( ROUND( 241 + -1 ) ) AS CHAR(100) ) , 1 , 12 ) ) ) AS CHAR(100) ) , 1 , 12 ) ) ) ) AS CHAR(100) ) , 1 , 12 ) ) AND col_bigint != ( SUBSTR( CAST( ( ROUND( CEIL ( FLOOR ( -9 ) ) - 0 ) ) AS CHAR(100) ) , 1 , 12 ) ) ORDER BY col_char_12_key , pk ASC LIMIT 0 ;
SELECT * FROM table0_bigint ORDER BY pk;
col_char_12_key	col_char_12	col_bigint_key	pk	col_bigint
99	NULL	NULL	-10	NULL
139	NULL	NULL	-9	NULL
2	NULL	NULL	1	NULL
NULL	NULL	1	4	NULL
NULL	5	-11	9	NULL
NULL	NULL	-10	10	-10
NULL	10	0	83	NULL
NULL	9	NULL	99	5
-10	NULL	NULL	154	NULL
SELECT pk , col_bigint_key , col_char_12_key FROM table0_bigint WHERE pk = ( SUBSTR( CAST( ( ROUND( ROUND( -100 - 88 ) * -9 ) ) AS CHAR(100) ) , 1 , 12 ) ) ORDER BY pk LIMIT 7 /* RESULTSET_HAS_ZERO_OR_ONE_ROWS */;
pk	col_bigint_key	col_char_12_key
INSERT INTO table0_bigint ( pk , col_bigint_key ) VALUES ( -9 , SUBSTR( CAST( ( ROUND( 0 * -9 ) ) AS CHAR(100) ) , 1 , 12 ) ) ;
ERROR 23000: Duplicate entry '-9' for key 'PRIMARY'
SELECT * FROM table0_bigint ORDER BY pk;
col_char_12_key	col_char_12	col_bigint_key	pk	col_bigint
99	NULL	NULL	-10	NULL
139	NULL	NULL	-9	NULL
2	NULL	NULL	1	NULL
NULL	NULL	1	4	NULL
NULL	5	-11	9	NULL
NULL	NULL	-10	10	-10
NULL	10	0	83	NULL
NULL	9	NULL	99	5
-10	NULL	NULL	154	NULL
SELECT * FROM table0_bigint  ORDER BY pk LIMIT 3;
col_char_12_key	col_char_12	col_bigint_key	pk	col_bigint
99	NULL	NULL	-10	NULL
139	NULL	NULL	-9	NULL
2	NULL	NULL	1	NULL
SELECT col_char_12_key FROM table0_bigint WHERE ( 1232863232 ) IN ( SUBSTR( CAST( ( ABS ( 10 ) ) AS CHAR(100) ) , 1 , 12 ) , SUBSTR( CAST( ( ROUND( 1 * 99 ) ) AS CHAR(100) ) , 1 , 12 ) , SUBSTR( CAST( ( 12 ) AS CHAR(100) ) , 1 , 12 ) , SUBSTR( CAST( ( ROUND( 0 + ROUND( -10 + ROUND ( 9 ) ) ) ) AS CHAR(100) ) , 1 , 12 ) , SUBSTR( CAST( ( SIGN ( 3 ) ) AS CHAR(100) ) , 1 , 12 ) ) ORDER BY col_char_12_key , col_char_12_key , col_char_12_key , pk DESC LIMIT 1 /* RESULTSET_HAS_ZERO_OR_ONE_ROWS */;
col_char_12_key
INSERT INTO table0_bigint ( pk , col_bigint, col_char_12_key ) VALUES ( -100 , SUBSTR( CAST( ( LENGTH( SUBSTR( CAST( ( CEIL ( LENGTH('HTHNN') ) ) AS CHAR(100) ) , 1 , 12 ) ) ) AS CHAR(100) ) , 1 , 12 ) , SUBSTR( CAST( ( -10 ) AS CHAR(100) ) , 1 , 12 ) ) ;
SELECT * FROM table0_bigint ORDER BY pk;
col_char_12_key	col_char_12	col_bigint_key	pk	col_bigint
-10	NULL	NULL	-100	1
99	NULL	NULL	-10	NULL
139	NULL	NULL	-9	NULL
2	NULL	NULL	1	NULL
NULL	NULL	1	4	NULL
NULL	5	-11	9	NULL
NULL	NULL	-10	10	-10
NULL	10	0	83	NULL
NULL	9	NULL	99	5
-10	NULL	NULL	154	NULL
SELECT * FROM table0_bigint WHERE SUBSTR( CAST( ( LENGTH('LIQRQ') ) AS CHAR(100) ) , 1 , 12 ) != LENGTH( SUBSTR( CAST( ( LENGTH('JOYVR') ) AS CHAR(100) ) , 1 , 12 ) ) ORDER BY pk LIMIT 3;
col_char_12_key	col_char_12	col_bigint_key	pk	col_bigint
-10	NULL	NULL	-100	1
99	NULL	NULL	-10	NULL
139	NULL	NULL	-9	NULL
SELECT col_bigint_key FROM table0_bigint WHERE col_bigint_key BETWEEN SUBSTR( CAST( ( -10 ) AS CHAR(100) ) , 1 , 12 ) AND SUBSTR( CAST( ( LENGTH( SUBSTR( CAST( ( ABS ( ROUND( 159 + 3 ) ) ) AS CHAR(100) ) , 1 , 12 ) ) ) AS CHAR(100) ) , 1 , 12 ) ORDER BY pk LIMIT 2 , 1 /* RESULTSET_HAS_ZERO_OR_ONE_ROWS */;
col_bigint_key
0
INSERT INTO table0_bigint ( pk , col_char_12_key ) VALUES ( 158, CAST( 151 AS CHAR(100)) ) , ( 10, CAST( -9 AS CHAR(100)) ) ;
ERROR 23000: Duplicate entry '10' for key 'PRIMARY'
SELECT * FROM table0_bigint ORDER BY pk;
col_char_12_key	col_char_12	col_bigint_key	pk	col_bigint
-10	NULL	NULL	-100	1
99	NULL	NULL	-10	NULL
139	NULL	NULL	-9	NULL
2	NULL	NULL	1	NULL
NULL	NULL	1	4	NULL
NULL	5	-11	9	NULL
NULL	NULL	-10	10	-10
NULL	10	0	83	NULL
NULL	9	NULL	99	5
-10	NULL	NULL	154	NULL
SELECT * FROM table0_bigint WHERE pk BETWEEN SUBSTR( CAST( ( ROUND ( 0 ) ) AS CHAR(100) ) , 1 , 12 ) AND SUBSTR( CAST( ( LENGTH( SUBSTR( CAST( ( LENGTH( SUBSTR( CAST( ( SIGN ( -1 ) ) AS CHAR(100) ) , 1 , 12 ) ) ) AS CHAR(100) ) , 1 , 12 ) ) ) AS CHAR(100) ) , 1 , 12 ) ORDER BY col_char_12_key,pk  , pk DESC LIMIT 1 , 3;
col_char_12_key	col_char_12	col_bigint_key	pk	col_bigint
UPDATE table0_bigint SET col_char_12 = col_char_12 WHERE ( -2061959168 , -2062942208 , 1517289472 ) NOT IN ( ( SUBSTR( CAST( ( ROUND( -1 * ROUND( -9 + SIGN ( 0 ) ) ) ) AS CHAR(100) ) , 1 , 12 ) , SUBSTR( CAST( ( SIGN ( ABS ( 9 ) ) ) AS CHAR(100) ) , 1 , 12 ) , SUBSTR( CAST( ( LENGTH('EGYEF') ) AS CHAR(100) ) , 1 , 12 ) ) , ( SUBSTR( CAST( ( ROUND( LENGTH( SUBSTR( CAST( ( ROUND( -9 - -9 ) ) AS CHAR(100) ) , 1 , 12 ) ) + -9 ) ) AS CHAR(100) ) , 1 , 12 ) , SUBSTR( CAST( ( 99 ) AS CHAR(100) ) , 1 , 12 ) , SUBSTR( CAST( ( ROUND( -10 * 0 ) ) AS CHAR(100) ) , 1 , 12 ) ) ) ORDER BY col_char_12_key , pk  LIMIT 1 ;
SELECT * FROM table0_bigint ORDER BY pk;
col_char_12_key	col_char_12	col_bigint_key	pk	col_bigint
-10	NULL	NULL	-100	1
99	NULL	NULL	-10	NULL
139	NULL	NULL	-9	NULL
2	NULL	NULL	1	NULL
NULL	NULL	1	4	NULL
NULL	5	-11	9	NULL
NULL	NULL	-10	10	-10
NULL	10	0	83	NULL
NULL	9	NULL	99	5
-10	NULL	NULL	154	NULL
INSERT INTO table0_bigint ( pk , col_char_12_key ) VALUES ( 87, CAST( 9 AS CHAR(100)) ) , ( -10, CAST( 0 AS CHAR(100)) ) ;
ERROR 23000: Duplicate entry '-10' for key 'PRIMARY'
SELECT * FROM table0_bigint ORDER BY pk;
col_char_12_key	col_char_12	col_bigint_key	pk	col_bigint
-10	NULL	NULL	-100	1
99	NULL	NULL	-10	NULL
139	NULL	NULL	-9	NULL
2	NULL	NULL	1	NULL
NULL	NULL	1	4	NULL
NULL	5	-11	9	NULL
NULL	NULL	-10	10	-10
NULL	10	0	83	NULL
NULL	9	NULL	99	5
-10	NULL	NULL	154	NULL
SELECT COUNT( col_bigint_key ) FROM table0_bigint WHERE pk > -10 ORDER BY col_bigint DESC , col_char_12_key ASC , pk DESC LIMIT 222 , 2 /* RESULTSET_HAS_ZERO_OR_ONE_ROWS */;
COUNT( col_bigint_key )
SELECT * FROM table0_bigint WHERE col_char_12_key BETWEEN CAST( 2 AS CHAR(100) ) AND CAST( 7 AS CHAR(100) ) ORDER BY col_char_12_key , pk DESC LIMIT 1;
col_char_12_key	col_char_12	col_bigint_key	pk	col_bigint
2	NULL	NULL	1	NULL
SELECT * FROM table0_bigint WHERE ROUND ( 115 ) <> ROUND( 58 * LENGTH( SUBSTR( CAST( ( 41 ) AS CHAR(100) ) , 1 , 12 ) ) ) ORDER BY pk LIMIT 5;
col_char_12_key	col_char_12	col_bigint_key	pk	col_bigint
-10	NULL	NULL	-100	1
99	NULL	NULL	-10	NULL
139	NULL	NULL	-9	NULL
2	NULL	NULL	1	NULL
NULL	NULL	1	4	NULL
SELECT * FROM table0_bigint WHERE ( 161284096 , 2020278272 , 561053696 ) NOT IN ( ( SUBSTR( CAST( ( LENGTH( SUBSTR( CAST( ( CEIL ( ABS ( LENGTH('DSHHL') ) ) ) AS CHAR(100) ) , 1 , 12 ) ) ) AS CHAR(100) ) , 1 , 12 ) , SUBSTR( CAST( ( ROUND ( 6 ) ) AS CHAR(100) ) , 1 , 12 ) , SUBSTR( CAST( ( LENGTH( SUBSTR( CAST( ( ROUND ( 242 ) ) AS CHAR(100) ) , 1 , 12 ) ) ) AS CHAR(100) ) , 1 , 12 ) ) , ( SUBSTR( CAST( ( ROUND( 86 + ABS ( FLOOR ( 9 ) ) ) ) AS CHAR(100) ) , 1 , 12 ) , SUBSTR( CAST( ( 0 ) AS CHAR(100) ) , 1 , 12 ) , SUBSTR( CAST( ( FLOOR ( 99 ) ) AS CHAR(100) ) , 1 , 12 ) ) ) ORDER BY col_char_12_key , col_char_12_key , pk  LIMIT 3 , 1;
col_char_12_key	col_char_12	col_bigint_key	pk	col_bigint
NULL	10	0	83	NULL
SELECT pk , col_bigint , col_char_12 FROM table0_bigint WHERE pk > 1176109056 and pk < 1176109056 ORDER BY col_bigint_key , col_bigint_key , col_char_12_key , pk ASC LIMIT 8 /* RESULTSET_HAS_ZERO_OR_ONE_ROWS */;
pk	col_bigint	col_char_12
SELECT col_bigint,col_bigint_key,col_char_12,col_char_12_key,pk FROM table0_bigint WHERE col_char_12_key IN ( CAST(10 AS CHAR(100)) , CAST(10 AS CHAR(100)) , CAST(99 AS CHAR(100)) ) ORDER BY col_bigint  , col_char_12 DESC , pk DESC LIMIT 6 , 1 /* RESULTSET_HAS_ZERO_OR_ONE_ROWS */;
col_bigint	col_bigint_key	col_char_12	col_char_12_key	pk
INSERT INTO table0_bigint ( pk , col_char_12_key ) VALUES ( 10, CAST( -100 AS CHAR(100)) ) , ( 99, CAST( 9 AS CHAR(100)) ) ;
ERROR 23000: Duplicate entry '10' for key 'PRIMARY'
SELECT * FROM table0_bigint ORDER BY pk;
col_char_12_key	col_char_12	col_bigint_key	pk	col_bigint
-10	NULL	NULL	-100	1
99	NULL	NULL	-10	NULL
139	NULL	NULL	-9	NULL
2	NULL	NULL	1	NULL
NULL	NULL	1	4	NULL
NULL	5	-11	9	NULL
NULL	NULL	-10	10	-10
NULL	10	0	83	NULL
NULL	9	NULL	99	5
-10	NULL	NULL	154	NULL
SELECT 1 FROM table0_bigint WHERE LENGTH('ONGIC') = ABS ( 87 ) FOR UPDATE;
1
INSERT INTO table0_bigint (pk) VALUES ( 0 ) ;
SELECT * FROM table0_bigint ORDER BY pk;
col_char_12_key	col_char_12	col_bigint_key	pk	col_bigint
-10	NULL	NULL	-100	1
99	NULL	NULL	-10	NULL
139	NULL	NULL	-9	NULL
NULL	NULL	NULL	0	NULL
2	NULL	NULL	1	NULL
NULL	NULL	1	4	NULL
NULL	5	-11	9	NULL
NULL	NULL	-10	10	-10
NULL	10	0	83	NULL
NULL	9	NULL	99	5
-10	NULL	NULL	154	NULL
SELECT 1 FROM table0_bigint WHERE CEIL ( ROUND( 0 * 10 ) ) > SIGN ( 0 ) FOR UPDATE;
1
SELECT col_char_12_key FROM table0_bigint WHERE 10 > ROUND( 203 * -9 ) ORDER BY pk LIMIT 5;
col_char_12_key
-10
99
139
NULL
2
SELECT col_bigint_key FROM table0_bigint WHERE ( 559284224 ) IN ( SUBSTR( CAST( ( ROUND( -100 + 1 ) ) AS CHAR(100) ) , 1 , 12 ) , SUBSTR( CAST( ( ROUND( LENGTH('JDCJN') - 186 ) ) AS CHAR(100) ) , 1 , 12 ) , SUBSTR( CAST( ( ROUND( -9 + 1 ) ) AS CHAR(100) ) , 1 , 12 ) , SUBSTR( CAST( ( ROUND( -10 - SIGN ( 9 ) ) ) AS CHAR(100) ) , 1 , 12 ) , SUBSTR( CAST( ( ROUND ( LENGTH('GJGNY') ) ) AS CHAR(100) ) , 1 , 12 ) ) ORDER BY col_bigint_key , col_bigint_key , col_char_12_key , pk ASC LIMIT 1;
col_bigint_key
SELECT 1 FROM table0_bigint  FOR UPDATE;
1
1
1
1
1
1
1
1
1
1
1
1
SELECT col_bigint_key FROM table0_bigint WHERE 223 > ROUND ( 0 ) ORDER BY col_bigint_key ASC , col_char_12_key  , pk  LIMIT 7 , 1 /* RESULTSET_HAS_ZERO_OR_ONE_ROWS */;
col_bigint_key
-11
INSERT INTO table0_bigint ( pk , col_bigint_key ) VALUES ( 107, CAST( -9 AS CHAR(100)) ) , ( -10, CAST( 88 AS CHAR(100)) ) ;
ERROR 23000: Duplicate entry '-10' for key 'PRIMARY'
SELECT * FROM table0_bigint ORDER BY pk;
col_char_12_key	col_char_12	col_bigint_key	pk	col_bigint
-10	NULL	NULL	-100	1
99	NULL	NULL	-10	NULL
139	NULL	NULL	-9	NULL
NULL	NULL	NULL	0	NULL
2	NULL	NULL	1	NULL
NULL	NULL	1	4	NULL
NULL	5	-11	9	NULL
NULL	NULL	-10	10	-10
NULL	10	0	83	NULL
NULL	9	NULL	99	5
-10	NULL	NULL	154	NULL
SELECT * FROM table0_bigint WHERE FLOOR ( LENGTH( SUBSTR( CAST( ( ROUND( -9 - LENGTH( SUBSTR( CAST( ( LENGTH( SUBSTR( CAST( ( LENGTH( SUBSTR( CAST( ( ROUND( ROUND( 10 + LENGTH('XYUVK') ) * 10 ) ) AS CHAR(100) ) , 1 , 12 ) ) ) AS CHAR(100) ) , 1 , 12 ) ) ) AS CHAR(100) ) , 1 , 12 ) ) ) ) AS CHAR(100) ) , 1 , 12 ) ) ) != 10 ORDER BY col_char_12_key , pk ASC LIMIT 0 , 2;
col_char_12_key	col_char_12	col_bigint_key	pk	col_bigint
NULL	NULL	NULL	0	NULL
NULL	NULL	1	4	NULL
SELECT * FROM table0_bigint  ORDER BY col_bigint_key , pk  LIMIT 2;
col_char_12_key	col_char_12	col_bigint_key	pk	col_bigint
-10	NULL	NULL	-100	1
99	NULL	NULL	-10	NULL
SELECT  NULL , pk , TRUE , col_bigint_key , FALSE , 1 FROM table0_bigint ORDER BY col_bigint_key , pk ;
NULL	pk	TRUE	col_bigint_key	FALSE	1
NULL	-100	1	NULL	0	1
NULL	-10	1	NULL	0	1
NULL	-9	1	NULL	0	1
NULL	0	1	NULL	0	1
NULL	1	1	NULL	0	1
NULL	99	1	NULL	0	1
NULL	154	1	NULL	0	1
NULL	9	1	-11	0	1
NULL	10	1	-10	0	1
NULL	83	1	0	0	1
NULL	4	1	1	0	1
SELECT DISTINCT UPPER( pk ) FROM table0_bigint WHERE col_bigint_key IN ( 1 , 1 , 9 , 255 , -100 ) ORDER BY col_bigint_key , col_char_12_key , col_bigint_key , pk DESC;
UPPER( pk )
4
SELECT  1 FROM table0_bigint ORDER BY pk,pk DESC , pk ;
1
1
1
1
1
1
1
1
1
1
1
1
SELECT UPPER( pk ) FROM table0_bigint WHERE LENGTH( SUBSTR( CAST( ( LENGTH('HDIUT') ) AS CHAR(100) ) , 1 , 12 ) ) != col_bigint GROUP BY pk ORDER BY pk LIMIT 1 /* RESULTSET_HAS_ZERO_OR_ONE_ROWS */;
UPPER( pk )
10
SELECT UPPER( pk ) FROM table0_bigint WHERE ( 1126563840 ) IN ( SUBSTR( CAST( ( LENGTH( SUBSTR( CAST( ( 9 ) AS CHAR(100) ) , 1 , 12 ) ) ) AS CHAR(100) ) , 1 , 12 ) , SUBSTR( CAST( ( ROUND( CEIL ( LENGTH( SUBSTR( CAST( ( LENGTH( SUBSTR( CAST( ( LENGTH( SUBSTR( CAST( ( ROUND( -100 * ROUND( CEIL ( 99 ) - 86 ) ) ) AS CHAR(100) ) , 1 , 12 ) ) ) AS CHAR(100) ) , 1 , 12 ) ) ) AS CHAR(100) ) , 1 , 12 ) ) ) + -100 ) ) AS CHAR(100) ) , 1 , 12 ) , SUBSTR( CAST( ( ROUND( 1 * -1 ) ) AS CHAR(100) ) , 1 , 12 ) , SUBSTR( CAST( ( ROUND( LENGTH( SUBSTR( CAST( ( -100 ) AS CHAR(100) ) , 1 , 12 ) ) - 10 ) ) AS CHAR(100) ) , 1 , 12 ) , SUBSTR( CAST( ( ROUND( ROUND( 10 * ROUND( ROUND( ROUND ( 10 ) * 9 ) * -9 ) ) + 4 ) ) AS CHAR(100) ) , 1 , 12 ) ) GROUP BY pk ORDER BY pk LIMIT 5 , 1 /* RESULTSET_HAS_ZERO_OR_ONE_ROWS */;
UPPER( pk )
SELECT col_bigint_key FROM table0_bigint WHERE col_bigint_key NOT IN ( CAST(99 AS CHAR(100)) , CAST(1 AS CHAR(100)) , CAST(-10 AS CHAR(100)) ) ORDER BY col_bigint  , col_char_12_key ASC , pk ASC LIMIT 5 , 1 /* RESULTSET_HAS_ZERO_OR_ONE_ROWS */;
col_bigint_key
SELECT col_bigint_key FROM table0_bigint WHERE pk BETWEEN SUBSTR( CAST( ( ROUND ( -100 ) ) AS CHAR(100) ) , 1 , 12 ) AND SUBSTR( CAST( ( SIGN ( -1 ) ) AS CHAR(100) ) , 1 , 12 ) ORDER BY pk LIMIT 7 , 1 /* RESULTSET_HAS_ZERO_OR_ONE_ROWS */;
col_bigint_key
INSERT INTO table0_bigint ( pk , col_char_12_key ) VALUES ( -100 , SUBSTR( CAST( ( ROUND( -1 + 9 ) ) AS CHAR(100) ) , 1 , 12 ) ) ;
ERROR 23000: Duplicate entry '-100' for key 'PRIMARY'
SELECT * FROM table0_bigint ORDER BY pk;
col_char_12_key	col_char_12	col_bigint_key	pk	col_bigint
-10	NULL	NULL	-100	1
99	NULL	NULL	-10	NULL
139	NULL	NULL	-9	NULL
NULL	NULL	NULL	0	NULL
2	NULL	NULL	1	NULL
NULL	NULL	1	4	NULL
NULL	5	-11	9	NULL
NULL	NULL	-10	10	-10
NULL	10	0	83	NULL
NULL	9	NULL	99	5
-10	NULL	NULL	154	NULL
SELECT UPPER( col_bigint_key ) FROM table0_bigint WHERE ( -1317076992 , 593166336 , -744030208 ) IN ( ( SUBSTR( CAST( ( ROUND( -10 - 1 ) ) AS CHAR(100) ) , 1 , 12 ) , SUBSTR( CAST( ( FLOOR ( ROUND( ROUND( -10 - CEIL ( LENGTH( SUBSTR( CAST( ( ROUND( LENGTH( SUBSTR( CAST( ( ROUND( 9 - -100 ) ) AS CHAR(100) ) , 1 , 12 ) ) - 0 ) ) AS CHAR(100) ) , 1 , 12 ) ) ) ) * 101 ) ) ) AS CHAR(100) ) , 1 , 12 ) , SUBSTR( CAST( ( ROUND( -100 - ROUND( 99 + 1 ) ) ) AS CHAR(100) ) , 1 , 12 ) ) , ( SUBSTR( CAST( ( ABS ( 1 ) ) AS CHAR(100) ) , 1 , 12 ) , SUBSTR( CAST( ( LENGTH( SUBSTR( CAST( ( ROUND( ABS ( 128 ) + 56 ) ) AS CHAR(100) ) , 1 , 12 ) ) ) AS CHAR(100) ) , 1 , 12 ) , SUBSTR( CAST( ( ROUND( LENGTH( SUBSTR( CAST( ( ROUND( 9 - -1 ) ) AS CHAR(100) ) , 1 , 12 ) ) - 33 ) ) AS CHAR(100) ) , 1 , 12 ) ) ) GROUP BY col_bigint_key ORDER BY col_bigint_key LIMIT 5 , 5;
UPPER( col_bigint_key )
SELECT 1 FROM table0_bigint WHERE col_char_12 != ( SUBSTR( CAST( ( LENGTH( SUBSTR( CAST( ( LENGTH('VPLLG') ) AS CHAR(100) ) , 1 , 12 ) ) ) AS CHAR(100) ) , 1 , 12 ) ) AND col_bigint_key < ( SUBSTR( CAST( ( ROUND( 1 * -10 ) ) AS CHAR(100) ) , 1 , 12 ) ) FOR UPDATE;
1
1
SELECT pk , col_bigint_key , col_char_12_key FROM table0_bigint WHERE col_bigint >= ( SUBSTR( CAST( ( ROUND( 0 - LENGTH( SUBSTR( CAST( ( 123 ) AS CHAR(100) ) , 1 , 12 ) ) ) ) AS CHAR(100) ) , 1 , 12 ) ) ORDER BY pk LIMIT 6 , 1 /* RESULTSET_HAS_ZERO_OR_ONE_ROWS */;
pk	col_bigint_key	col_char_12_key
SELECT UPPER( col_char_12 ) FROM table0_bigint WHERE ABS ( 2 ) < LENGTH( SUBSTR( CAST( ( LENGTH( SUBSTR( CAST( ( CEIL ( 14 ) ) AS CHAR(100) ) , 1 , 12 ) ) ) AS CHAR(100) ) , 1 , 12 ) ) GROUP BY col_char_12 ORDER BY col_char_12 LIMIT 1 /* RESULTSET_HAS_ZERO_OR_ONE_ROWS */;
UPPER( col_char_12 )
INSERT INTO table0_bigint (pk) VALUES ( -9 ) ;
ERROR 23000: Duplicate entry '-9' for key 'PRIMARY'
SELECT * FROM table0_bigint ORDER BY pk;
col_char_12_key	col_char_12	col_bigint_key	pk	col_bigint
-10	NULL	NULL	-100	1
99	NULL	NULL	-10	NULL
139	NULL	NULL	-9	NULL
NULL	NULL	NULL	0	NULL
2	NULL	NULL	1	NULL
NULL	NULL	1	4	NULL
NULL	5	-11	9	NULL
NULL	NULL	-10	10	-10
NULL	10	0	83	NULL
NULL	9	NULL	99	5
-10	NULL	NULL	154	NULL
INSERT INTO table0_bigint ( pk , col_bigint_key ) VALUES ( 242, CAST( 9 AS CHAR(100)) ) , ( 0, CAST( -1 AS CHAR(100)) ) ;
ERROR 23000: Duplicate entry '0' for key 'PRIMARY'
SELECT * FROM table0_bigint ORDER BY pk;
col_char_12_key	col_char_12	col_bigint_key	pk	col_bigint
-10	NULL	NULL	-100	1
99	NULL	NULL	-10	NULL
139	NULL	NULL	-9	NULL
NULL	NULL	NULL	0	NULL
2	NULL	NULL	1	NULL
NULL	NULL	1	4	NULL
NULL	5	-11	9	NULL
NULL	NULL	-10	10	-10
NULL	10	0	83	NULL
NULL	9	NULL	99	5
-10	NULL	NULL	154	NULL
INSERT INTO table0_bigint (pk) VALUES ( 0 ) ;
ERROR 23000: Duplicate entry '0' for key 'PRIMARY'
SELECT * FROM table0_bigint ORDER BY pk;
col_char_12_key	col_char_12	col_bigint_key	pk	col_bigint
-10	NULL	NULL	-100	1
99	NULL	NULL	-10	NULL
139	NULL	NULL	-9	NULL
NULL	NULL	NULL	0	NULL
2	NULL	NULL	1	NULL
NULL	NULL	1	4	NULL
NULL	5	-11	9	NULL
NULL	NULL	-10	10	-10
NULL	10	0	83	NULL
NULL	9	NULL	99	5
-10	NULL	NULL	154	NULL
SELECT UPPER( col_bigint_key ),pk FROM table0_bigint WHERE ( 1035927552 , 970391552 ) IN ( ( SUBSTR( CAST( ( SIGN ( 1 ) ) AS CHAR(100) ) , 1 , 12 ) , SUBSTR( CAST( ( ROUND( 0 + 165 ) ) AS CHAR(100) ) , 1 , 12 ) ) , ( SUBSTR( CAST( ( LENGTH( SUBSTR( CAST( ( 93 ) AS CHAR(100) ) , 1 , 12 ) ) ) AS CHAR(100) ) , 1 , 12 ) , SUBSTR( CAST( ( SIGN ( ROUND( LENGTH( SUBSTR( CAST( ( ROUND( CEIL ( LENGTH('VCJYO') ) + 1 ) ) AS CHAR(100) ) , 1 , 12 ) ) * 9 ) ) ) AS CHAR(100) ) , 1 , 12 ) ) ) GROUP BY col_bigint_key,pk ORDER BY col_bigint_key,pk LIMIT 7 , 8;
UPPER( col_bigint_key )	pk
SELECT * FROM table0_bigint WHERE ( -459276288 , -1569390592 , 1102577664 , -883884032 , 1603600384 ) IN ( ( SUBSTR( CAST( ( 0 ) AS CHAR(100) ) , 1 , 12 ) , SUBSTR( CAST( ( ROUND( ROUND( 190 * 99 ) - 228 ) ) AS CHAR(100) ) , 1 , 12 ) , SUBSTR( CAST( ( ROUND( 1 + 111 ) ) AS CHAR(100) ) , 1 , 12 ) , SUBSTR( CAST( ( ROUND( 71 - LENGTH( SUBSTR( CAST( ( LENGTH('QMCWH') ) AS CHAR(100) ) , 1 , 12 ) ) ) ) AS CHAR(100) ) , 1 , 12 ) , SUBSTR( CAST( ( ROUND ( CEIL ( ROUND ( 99 ) ) ) ) AS CHAR(100) ) , 1 , 12 ) ) ) ORDER BY col_bigint_key , pk  LIMIT 4;
col_char_12_key	col_char_12	col_bigint_key	pk	col_bigint
SELECT ALL 1 , NULL , TRUE , FALSE , UPPER( col_char_12 ) FROM table0_bigint ORDER BY col_char_12 DESC , pk ASC;
1	NULL	TRUE	FALSE	UPPER( col_char_12 )
1	NULL	1	0	9
1	NULL	1	0	5
1	NULL	1	0	10
1	NULL	1	0	NULL
1	NULL	1	0	NULL
1	NULL	1	0	NULL
1	NULL	1	0	NULL
1	NULL	1	0	NULL
1	NULL	1	0	NULL
1	NULL	1	0	NULL
1	NULL	1	0	NULL
SELECT col_bigint_key FROM table0_bigint WHERE ( -322568192 , -690683904 , 1158676480 , -767688704 ) IN ( ( SUBSTR( CAST( ( ROUND( 1 - 1 ) ) AS CHAR(100) ) , 1 , 12 ) , SUBSTR( CAST( ( ROUND( 243 * -1 ) ) AS CHAR(100) ) , 1 , 12 ) , SUBSTR( CAST( ( ROUND( 1 + -100 ) ) AS CHAR(100) ) , 1 , 12 ) , SUBSTR( CAST( ( ROUND( LENGTH( SUBSTR( CAST( ( ROUND( -10 * ROUND( 9 * LENGTH( SUBSTR( CAST( ( SIGN ( ABS ( SIGN ( -10 ) ) ) ) AS CHAR(100) ) , 1 , 12 ) ) ) ) ) AS CHAR(100) ) , 1 , 12 ) ) * 199 ) ) AS CHAR(100) ) , 1 , 12 ) ) ) ORDER BY pk , col_bigint_key,pk ASC , pk ASC LIMIT 6 , 1 /* RESULTSET_HAS_ZERO_OR_ONE_ROWS */;
col_bigint_key
SELECT COUNT( pk ) FROM table0_bigint WHERE  ( col_char_12 < SUBSTR( CAST( ( LENGTH( SUBSTR( CAST( ( FLOOR ( ROUND( LENGTH('TPOKJ') * -1 ) ) ) AS CHAR(100) ) , 1 , 12 ) ) ) AS CHAR(100) ) , 1 , 12 ) ) AND  ( col_char_12 <> SUBSTR( CAST( ( ROUND( ROUND( LENGTH('QVKNZ') + -1 ) * -100 ) ) AS CHAR(100) ) , 1 , 12 ) ) OR NOT ( col_char_12 != SUBSTR( CAST( ( -100 ) AS CHAR(100) ) , 1 , 12 ) ) ORDER BY pk LIMIT 4 , 1 /* RESULTSET_HAS_ZERO_OR_ONE_ROWS */;
COUNT( pk )
SELECT col_bigint_key , col_char_12_key FROM table0_bigint WHERE ( -818937856 ) IN ( SUBSTR( CAST( ( LENGTH('LIVJL') ) AS CHAR(100) ) , 1 , 12 ) , SUBSTR( CAST( ( ROUND( -1 * LENGTH( SUBSTR( CAST( ( LENGTH( SUBSTR( CAST( ( ROUND( 10 - 99 ) ) AS CHAR(100) ) , 1 , 12 ) ) ) AS CHAR(100) ) , 1 , 12 ) ) ) ) AS CHAR(100) ) , 1 , 12 ) , SUBSTR( CAST( ( 10 ) AS CHAR(100) ) , 1 , 12 ) , SUBSTR( CAST( ( LENGTH('OQURV') ) AS CHAR(100) ) , 1 , 12 ) , SUBSTR( CAST( ( LENGTH( SUBSTR( CAST( ( ROUND( ROUND ( 1 ) - 100 ) ) AS CHAR(100) ) , 1 , 12 ) ) ) AS CHAR(100) ) , 1 , 12 ) ) ORDER BY col_bigint ASC , col_char_12_key  , pk ASC LIMIT 3 , 1 /* RESULTSET_HAS_ZERO_OR_ONE_ROWS */;
col_bigint_key	col_char_12_key
SELECT pk , col_bigint_key FROM table0_bigint WHERE col_bigint IN ( 219 , 1 , 10 , -10 , 9 ) ORDER BY col_bigint_key,pk DESC , pk DESC LIMIT 1 /* RESULTSET_HAS_ZERO_OR_ONE_ROWS */;
pk	col_bigint_key
-100	NULL
SELECT col_bigint_key FROM table0_bigint WHERE col_char_12_key BETWEEN CAST( 4 AS CHAR(100) ) AND CAST( 7 AS CHAR(100) ) ORDER BY col_bigint_key  , col_char_12 DESC , pk  LIMIT 2 , 1 /* RESULTSET_HAS_ZERO_OR_ONE_ROWS */;
col_bigint_key
SELECT pk , col_bigint_key , col_char_12_key FROM table0_bigint WHERE pk > -1642463232 and pk < -1642463232 ORDER BY col_bigint ASC , pk ASC LIMIT 5 , 8 /* RESULTSET_HAS_ZERO_OR_ONE_ROWS */;
pk	col_bigint_key	col_char_12_key
SELECT UPPER( pk ) FROM table0_bigint WHERE LENGTH('ZDIAP') > ROUND( -100 * ROUND( FLOOR ( -9 ) + 99 ) ) GROUP BY pk ORDER BY pk LIMIT 1 /* RESULTSET_HAS_ZERO_OR_ONE_ROWS */;
UPPER( pk )
-100
INSERT INTO table0_bigint ( pk , col_bigint_key, col_char_12_key ) VALUES ( 8 , SUBSTR( CAST( ( LENGTH( SUBSTR( CAST( ( SIGN ( -9 ) ) AS CHAR(100) ) , 1 , 12 ) ) ) AS CHAR(100) ) , 1 , 12 ) , SUBSTR( CAST( ( ROUND( -100 * 1 ) ) AS CHAR(100) ) , 1 , 12 ) ) ;
SELECT * FROM table0_bigint ORDER BY pk;
col_char_12_key	col_char_12	col_bigint_key	pk	col_bigint
-10	NULL	NULL	-100	1
99	NULL	NULL	-10	NULL
139	NULL	NULL	-9	NULL
NULL	NULL	NULL	0	NULL
2	NULL	NULL	1	NULL
NULL	NULL	1	4	NULL
-100	NULL	2	8	NULL
NULL	5	-11	9	NULL
NULL	NULL	-10	10	-10
NULL	10	0	83	NULL
NULL	9	NULL	99	5
-10	NULL	NULL	154	NULL
SELECT col_char_12_key FROM table0_bigint WHERE pk >= -1732444160 and pk <= -1732444160 ORDER BY col_char_12  , pk  LIMIT 3 , 4 /* RESULTSET_HAS_ZERO_OR_ONE_ROWS */;
col_char_12_key
INSERT INTO table0_bigint (pk) VALUES ( -1 ) ;
SELECT * FROM table0_bigint ORDER BY pk;
col_char_12_key	col_char_12	col_bigint_key	pk	col_bigint
-10	NULL	NULL	-100	1
99	NULL	NULL	-10	NULL
139	NULL	NULL	-9	NULL
NULL	NULL	NULL	-1	NULL
NULL	NULL	NULL	0	NULL
2	NULL	NULL	1	NULL
NULL	NULL	1	4	NULL
-100	NULL	2	8	NULL
NULL	5	-11	9	NULL
NULL	NULL	-10	10	-10
NULL	10	0	83	NULL
NULL	9	NULL	99	5
-10	NULL	NULL	154	NULL
SELECT 1 FROM table0_bigint WHERE col_char_12_key BETWEEN CAST( 2 AS CHAR(100) ) AND CAST( 5 AS CHAR(100) ) FOR UPDATE;
1
1
UPDATE table0_bigint SET pk = SUBSTR( CAST( ( ROUND( 138 - 1 ) ) AS CHAR(100) ) , 1 , 12 ) WHERE LENGTH( SUBSTR( CAST( ( LENGTH('ESNBL') ) AS CHAR(100) ) , 1 , 12 ) ) = 74 ORDER BY col_bigint_key , pk DESC LIMIT 237 ;
SELECT * FROM table0_bigint ORDER BY pk;
col_char_12_key	col_char_12	col_bigint_key	pk	col_bigint
-10	NULL	NULL	-100	1
99	NULL	NULL	-10	NULL
139	NULL	NULL	-9	NULL
NULL	NULL	NULL	-1	NULL
NULL	NULL	NULL	0	NULL
2	NULL	NULL	1	NULL
NULL	NULL	1	4	NULL
-100	NULL	2	8	NULL
NULL	5	-11	9	NULL
NULL	NULL	-10	10	-10
NULL	10	0	83	NULL
NULL	9	NULL	99	5
-10	NULL	NULL	154	NULL
SELECT pk , col_bigint , col_char_12 FROM table0_bigint WHERE col_bigint_key <> ROUND ( ROUND( -100 + ROUND( 10 + -10 ) ) ) ORDER BY col_char_12_key DESC , pk DESC LIMIT 5 , 1 /* RESULTSET_HAS_ZERO_OR_ONE_ROWS */;
pk	col_bigint	col_char_12
SELECT UPPER( col_char_12_key ) FROM table0_bigint WHERE ( 739180544 ) IN ( SUBSTR( CAST( ( CEIL ( ROUND( -100 * ROUND( LENGTH('IANFC') * 0 ) ) ) ) AS CHAR(100) ) , 1 , 12 ) , SUBSTR( CAST( ( CEIL ( SIGN ( ABS ( 1 ) ) ) ) AS CHAR(100) ) , 1 , 12 ) , SUBSTR( CAST( ( ROUND( 5 - ROUND( 251 - ROUND( ROUND( ROUND( 1 - ROUND( 99 * 9 ) ) * -100 ) + 50 ) ) ) ) AS CHAR(100) ) , 1 , 12 ) , SUBSTR( CAST( ( FLOOR ( 1 ) ) AS CHAR(100) ) , 1 , 12 ) , SUBSTR( CAST( ( 1 ) AS CHAR(100) ) , 1 , 12 ) ) GROUP BY col_char_12_key ORDER BY col_char_12_key LIMIT 1 /* RESULTSET_HAS_ZERO_OR_ONE_ROWS */;
UPPER( col_char_12_key )
INSERT INTO table0_bigint ( pk , col_bigint_key ) VALUES ( 1, CAST( -100 AS CHAR(100)) ) , ( 7, CAST( 10 AS CHAR(100)) ) ;
ERROR 23000: Duplicate entry '1' for key 'PRIMARY'
SELECT * FROM table0_bigint ORDER BY pk;
col_char_12_key	col_char_12	col_bigint_key	pk	col_bigint
-10	NULL	NULL	-100	1
99	NULL	NULL	-10	NULL
139	NULL	NULL	-9	NULL
NULL	NULL	NULL	-1	NULL
NULL	NULL	NULL	0	NULL
2	NULL	NULL	1	NULL
NULL	NULL	1	4	NULL
-100	NULL	2	8	NULL
NULL	5	-11	9	NULL
NULL	NULL	-10	10	-10
NULL	10	0	83	NULL
NULL	9	NULL	99	5
-10	NULL	NULL	154	NULL
SELECT ALL NULL , UPPER( col_char_12_key ) , TRUE , FALSE , 1 FROM table0_bigint ORDER BY pk;
NULL	UPPER( col_char_12_key )	TRUE	FALSE	1
NULL	-10	1	0	1
NULL	99	1	0	1
NULL	139	1	0	1
NULL	NULL	1	0	1
NULL	NULL	1	0	1
NULL	2	1	0	1
NULL	NULL	1	0	1
NULL	-100	1	0	1
NULL	NULL	1	0	1
NULL	NULL	1	0	1
NULL	NULL	1	0	1
NULL	NULL	1	0	1
NULL	-10	1	0	1
INSERT INTO table0_bigint ( pk , col_char_12_key ) VALUES ( 10 , SUBSTR( CAST( ( LENGTH( SUBSTR( CAST( ( LENGTH( SUBSTR( CAST( ( ROUND( ROUND( 238 * ROUND( 0 + -100 ) ) * 9 ) ) AS CHAR(100) ) , 1 , 12 ) ) ) AS CHAR(100) ) , 1 , 12 ) ) ) AS CHAR(100) ) , 1 , 12 ) ) ;
ERROR 23000: Duplicate entry '10' for key 'PRIMARY'
SELECT * FROM table0_bigint ORDER BY pk;
col_char_12_key	col_char_12	col_bigint_key	pk	col_bigint
-10	NULL	NULL	-100	1
99	NULL	NULL	-10	NULL
139	NULL	NULL	-9	NULL
NULL	NULL	NULL	-1	NULL
NULL	NULL	NULL	0	NULL
2	NULL	NULL	1	NULL
NULL	NULL	1	4	NULL
-100	NULL	2	8	NULL
NULL	5	-11	9	NULL
NULL	NULL	-10	10	-10
NULL	10	0	83	NULL
NULL	9	NULL	99	5
-10	NULL	NULL	154	NULL
SELECT 1 FROM table0_bigint WHERE SUBSTR( CAST( ( LENGTH('FYJAS') ) AS CHAR(100) ) , 1 , 12 ) != LENGTH('GYZFR') FOR UPDATE;
1
SELECT * FROM table0_bigint WHERE ROUND( ROUND ( CEIL ( 143 ) ) - -100 ) <> 9 ORDER BY col_char_12_key , col_bigint_key , col_char_12_key , pk DESC LIMIT 8 , 8;
col_char_12_key	col_char_12	col_bigint_key	pk	col_bigint
-10	NULL	NULL	-100	1
-100	NULL	2	8	NULL
139	NULL	NULL	-9	NULL
2	NULL	NULL	1	NULL
99	NULL	NULL	-10	NULL
INSERT INTO table0_bigint ( pk , col_char_12_key ) VALUES ( -1, CAST( 243 AS CHAR(100)) ) , ( 0, CAST( 28 AS CHAR(100)) ) ;
ERROR 23000: Duplicate entry '-1' for key 'PRIMARY'
SELECT * FROM table0_bigint ORDER BY pk;
col_char_12_key	col_char_12	col_bigint_key	pk	col_bigint
-10	NULL	NULL	-100	1
99	NULL	NULL	-10	NULL
139	NULL	NULL	-9	NULL
NULL	NULL	NULL	-1	NULL
NULL	NULL	NULL	0	NULL
2	NULL	NULL	1	NULL
NULL	NULL	1	4	NULL
-100	NULL	2	8	NULL
NULL	5	-11	9	NULL
NULL	NULL	-10	10	-10
NULL	10	0	83	NULL
NULL	9	NULL	99	5
-10	NULL	NULL	154	NULL
SELECT UPPER( col_char_12 ) FROM table0_bigint WHERE col_bigint_key > ( SUBSTR( CAST( ( ROUND ( 1 ) ) AS CHAR(100) ) , 1 , 12 ) ) GROUP BY col_char_12 ORDER BY col_char_12 LIMIT 154 , 1 /* RESULTSET_HAS_ZERO_OR_ONE_ROWS */;
UPPER( col_char_12 )
INSERT INTO table0_bigint ( pk , col_bigint_key ) VALUES ( -10 , SUBSTR( CAST( ( ROUND( ROUND( -100 + ROUND( -9 * 194 ) ) * 9 ) ) AS CHAR(100) ) , 1 , 12 ) ) ;
ERROR 23000: Duplicate entry '-10' for key 'PRIMARY'
SELECT * FROM table0_bigint ORDER BY pk;
col_char_12_key	col_char_12	col_bigint_key	pk	col_bigint
-10	NULL	NULL	-100	1
99	NULL	NULL	-10	NULL
139	NULL	NULL	-9	NULL
NULL	NULL	NULL	-1	NULL
NULL	NULL	NULL	0	NULL
2	NULL	NULL	1	NULL
NULL	NULL	1	4	NULL
-100	NULL	2	8	NULL
NULL	5	-11	9	NULL
NULL	NULL	-10	10	-10
NULL	10	0	83	NULL
NULL	9	NULL	99	5
-10	NULL	NULL	154	NULL
SELECT * FROM table0_bigint WHERE pk = ( SUBSTR( CAST( ( SIGN ( 1 ) ) AS CHAR(100) ) , 1 , 12 ) ) ORDER BY pk LIMIT 2 , 2;
col_char_12_key	col_char_12	col_bigint_key	pk	col_bigint
SELECT col_char_12 FROM table0_bigint WHERE ( 144310272 , -321847296 ) IN ( ( SUBSTR( CAST( ( 0 ) AS CHAR(100) ) , 1 , 12 ) , SUBSTR( CAST( ( ROUND( ROUND( 9 + 122 ) - 0 ) ) AS CHAR(100) ) , 1 , 12 ) ) , ( SUBSTR( CAST( ( LENGTH('JVNIO') ) AS CHAR(100) ) , 1 , 12 ) , SUBSTR( CAST( ( SIGN ( 9 ) ) AS CHAR(100) ) , 1 , 12 ) ) ) ORDER BY col_bigint DESC , col_char_12_key DESC , pk DESC LIMIT 148 , 1 /* RESULTSET_HAS_ZERO_OR_ONE_ROWS */;
col_char_12
SELECT DISTINCT col_bigint,col_bigint_key,col_char_12,col_char_12_key,pk FROM table0_bigint ORDER BY col_bigint_key , col_char_12_key , col_bigint_key , pk ;
col_bigint	col_bigint_key	col_char_12	col_char_12_key	pk
NULL	NULL	NULL	NULL	-1
NULL	NULL	NULL	NULL	0
5	NULL	9	NULL	99
1	NULL	NULL	-10	-100
NULL	NULL	NULL	-10	154
NULL	NULL	NULL	139	-9
NULL	NULL	NULL	2	1
NULL	NULL	NULL	99	-10
NULL	-11	5	NULL	9
-10	-10	NULL	NULL	10
NULL	0	10	NULL	83
NULL	1	NULL	NULL	4
NULL	2	NULL	-100	8
SELECT ALL UPPER( pk ) FROM table0_bigint WHERE NOT ( col_bigint_key != SUBSTR( CAST( ( CEIL ( -9 ) ) AS CHAR(100) ) , 1 , 12 ) ) AND  ( col_bigint_key > SUBSTR( CAST( ( ROUND( 1 + 61 ) ) AS CHAR(100) ) , 1 , 12 ) ) OR NOT ( pk < SUBSTR( CAST( ( ABS ( -100 ) ) AS CHAR(100) ) , 1 , 12 ) ) ORDER BY col_bigint_key , pk ;
UPPER( pk )
154
SELECT * FROM table0_bigint WHERE SUBSTR( CAST( ( 9 ) AS CHAR(100) ) , 1 , 12 ) != LENGTH('ISMPM') ORDER BY pk LIMIT 200 , 3;
col_char_12_key	col_char_12	col_bigint_key	pk	col_bigint
INSERT INTO table0_bigint ( pk , col_char_12_key ) VALUES ( 10, CAST( 99 AS CHAR(100)) ) , ( 10, CAST( 1 AS CHAR(100)) ) ;
ERROR 23000: Duplicate entry '10' for key 'PRIMARY'
SELECT * FROM table0_bigint ORDER BY pk;
col_char_12_key	col_char_12	col_bigint_key	pk	col_bigint
-10	NULL	NULL	-100	1
99	NULL	NULL	-10	NULL
139	NULL	NULL	-9	NULL
NULL	NULL	NULL	-1	NULL
NULL	NULL	NULL	0	NULL
2	NULL	NULL	1	NULL
NULL	NULL	1	4	NULL
-100	NULL	2	8	NULL
NULL	5	-11	9	NULL
NULL	NULL	-10	10	-10
NULL	10	0	83	NULL
NULL	9	NULL	99	5
-10	NULL	NULL	154	NULL
SELECT 1 FROM table0_bigint WHERE ( -208404480 ) IN ( SUBSTR( CAST( ( ROUND( 10 - ROUND( 174 * 99 ) ) ) AS CHAR(100) ) , 1 , 12 ) , SUBSTR( CAST( ( ROUND( -10 - 9 ) ) AS CHAR(100) ) , 1 , 12 ) , SUBSTR( CAST( ( ROUND( 10 * -1 ) ) AS CHAR(100) ) , 1 , 12 ) , SUBSTR( CAST( ( LENGTH('WMJLG') ) AS CHAR(100) ) , 1 , 12 ) , SUBSTR( CAST( ( ROUND( -10 - SIGN ( 76 ) ) ) AS CHAR(100) ) , 1 , 12 ) ) FOR UPDATE;
1
SELECT pk , col_bigint_key FROM table0_bigint WHERE col_bigint_key IN ( SUBSTR( CAST( ( ROUND( -9 * ROUND( -10 + 148 ) ) ) AS CHAR(100) ) , 1 , 12 ) , SUBSTR( CAST( ( ROUND( 99 - -10 ) ) AS CHAR(100) ) , 1 , 12 ) , SUBSTR( CAST( ( SIGN ( ROUND( 0 - -100 ) ) ) AS CHAR(100) ) , 1 , 12 ) , SUBSTR( CAST( ( ROUND( 9 + 9 ) ) AS CHAR(100) ) , 1 , 12 ) , SUBSTR( CAST( ( CEIL ( 106 ) ) AS CHAR(100) ) , 1 , 12 ) ) ORDER BY col_bigint_key , col_bigint_key , pk ASC LIMIT 1 /* RESULTSET_HAS_ZERO_OR_ONE_ROWS */;
pk	col_bigint_key
4	1
SELECT pk , col_char_12_key FROM table0_bigint WHERE LENGTH('SQOEP') < -1 ORDER BY col_bigint_key , col_bigint_key , col_char_12_key , pk ASC LIMIT 1 /* RESULTSET_HAS_ZERO_OR_ONE_ROWS */;
pk	col_char_12_key
SELECT 1 FROM table0_bigint WHERE FLOOR ( -9 ) <= 4 FOR UPDATE;
1
1
1
1
1
1
1
1
1
1
1
1
1
1
SELECT col_bigint , col_char_12_key FROM table0_bigint WHERE pk = ( SUBSTR( CAST( ( ROUND ( SIGN ( 24 ) ) ) AS CHAR(100) ) , 1 , 12 ) ) ORDER BY col_bigint_key , col_char_12,pk DESC , pk  LIMIT 7 /* RESULTSET_HAS_ZERO_OR_ONE_ROWS */;
col_bigint	col_char_12_key
NULL	2
INSERT INTO table0_bigint ( pk , col_bigint, col_char_12_key ) VALUES ( -1 , SUBSTR( CAST( ( LENGTH( SUBSTR( CAST( ( ROUND ( -9 ) ) AS CHAR(100) ) , 1 , 12 ) ) ) AS CHAR(100) ) , 1 , 12 ) , SUBSTR( CAST( ( ROUND( 8 - 92 ) ) AS CHAR(100) ) , 1 , 12 ) ) ;
ERROR 23000: Duplicate entry '-1' for key 'PRIMARY'
SELECT * FROM table0_bigint ORDER BY pk;
col_char_12_key	col_char_12	col_bigint_key	pk	col_bigint
-10	NULL	NULL	-100	1
99	NULL	NULL	-10	NULL
139	NULL	NULL	-9	NULL
NULL	NULL	NULL	-1	NULL
NULL	NULL	NULL	0	NULL
2	NULL	NULL	1	NULL
NULL	NULL	1	4	NULL
-100	NULL	2	8	NULL
NULL	5	-11	9	NULL
NULL	NULL	-10	10	-10
NULL	10	0	83	NULL
NULL	9	NULL	99	5
-10	NULL	NULL	154	NULL
SELECT * FROM table0_bigint WHERE col_bigint_key <= ( SUBSTR( CAST( ( -100 ) AS CHAR(100) ) , 1 , 12 ) ) ORDER BY col_bigint_key , col_bigint_key , col_bigint_key , pk ASC LIMIT 105 , 3;
col_char_12_key	col_char_12	col_bigint_key	pk	col_bigint
SELECT UPPER( col_bigint_key ) FROM table0_bigint WHERE SIGN ( -9 ) != SUBSTR( CAST( ( 185 ) AS CHAR(100) ) , 1 , 12 ) GROUP BY col_bigint_key ORDER BY col_bigint_key LIMIT 1;
UPPER( col_bigint_key )
NULL
UPDATE table0_bigint SET col_bigint = pk WHERE col_bigint != ( SUBSTR( CAST( ( ROUND( ROUND( 99 * -10 ) + 10 ) ) AS CHAR(100) ) , 1 , 12 ) ) ORDER BY col_bigint_key , col_bigint_key , pk DESC LIMIT 4 ;
SELECT * FROM table0_bigint ORDER BY pk;
col_char_12_key	col_char_12	col_bigint_key	pk	col_bigint
-10	NULL	NULL	-100	-100
99	NULL	NULL	-10	NULL
139	NULL	NULL	-9	NULL
NULL	NULL	NULL	-1	NULL
NULL	NULL	NULL	0	NULL
2	NULL	NULL	1	NULL
NULL	NULL	1	4	NULL
-100	NULL	2	8	NULL
NULL	5	-11	9	NULL
NULL	NULL	-10	10	10
NULL	10	0	83	NULL
NULL	9	NULL	99	99
-10	NULL	NULL	154	NULL
INSERT INTO table0_bigint ( pk , col_bigint_key ) VALUES ( 1, CAST( 5 AS CHAR(100)) ) , ( -1, CAST( -10 AS CHAR(100)) ) ;
ERROR 23000: Duplicate entry '1' for key 'PRIMARY'
SELECT * FROM table0_bigint ORDER BY pk;
col_char_12_key	col_char_12	col_bigint_key	pk	col_bigint
-10	NULL	NULL	-100	-100
99	NULL	NULL	-10	NULL
139	NULL	NULL	-9	NULL
NULL	NULL	NULL	-1	NULL
NULL	NULL	NULL	0	NULL
2	NULL	NULL	1	NULL
NULL	NULL	1	4	NULL
-100	NULL	2	8	NULL
NULL	5	-11	9	NULL
NULL	NULL	-10	10	10
NULL	10	0	83	NULL
NULL	9	NULL	99	99
-10	NULL	NULL	154	NULL
SELECT UPPER( col_bigint_key ),pk FROM table0_bigint WHERE SIGN ( CEIL ( ROUND( 99 - 1 ) ) ) >= LENGTH( SUBSTR( CAST( ( LENGTH('EFTZP') ) AS CHAR(100) ) , 1 , 12 ) ) GROUP BY col_bigint_key,pk ORDER BY col_bigint_key,pk LIMIT 4 , 4;
UPPER( col_bigint_key )	pk
NULL	0
NULL	1
NULL	99
NULL	154
SELECT UPPER( col_bigint_key ),pk FROM table0_bigint  GROUP BY col_bigint_key,pk ORDER BY col_bigint_key,pk LIMIT 1 , 3;
UPPER( col_bigint_key )	pk
NULL	-10
NULL	-9
NULL	-1
SELECT COUNT( col_char_12 ) FROM table0_bigint WHERE pk IN ( SUBSTR( CAST( ( ROUND( 99 - 1 ) ) AS CHAR(100) ) , 1 , 12 ) , SUBSTR( CAST( ( ROUND( 20 + -100 ) ) AS CHAR(100) ) , 1 , 12 ) , SUBSTR( CAST( ( LENGTH( SUBSTR( CAST( ( ROUND( LENGTH('YTZWX') * -10 ) ) AS CHAR(100) ) , 1 , 12 ) ) ) AS CHAR(100) ) , 1 , 12 ) , SUBSTR( CAST( ( LENGTH( SUBSTR( CAST( ( LENGTH( SUBSTR( CAST( ( LENGTH( SUBSTR( CAST( ( LENGTH( SUBSTR( CAST( ( CEIL ( 99 ) ) AS CHAR(100) ) , 1 , 12 ) ) ) AS CHAR(100) ) , 1 , 12 ) ) ) AS CHAR(100) ) , 1 , 12 ) ) ) AS CHAR(100) ) , 1 , 12 ) ) ) AS CHAR(100) ) , 1 , 12 ) , SUBSTR( CAST( ( FLOOR ( -9 ) ) AS CHAR(100) ) , 1 , 12 ) ) ORDER BY col_bigint_key ASC , pk  LIMIT 4 , 1 /* RESULTSET_HAS_ZERO_OR_ONE_ROWS */;
COUNT( col_char_12 )
SELECT ALL NULL , UPPER( col_bigint_key ) , TRUE , FALSE , 1 FROM table0_bigint ORDER BY col_bigint  , col_char_12_key ASC , pk ASC;
NULL	UPPER( col_bigint_key )	TRUE	FALSE	1
NULL	NULL	1	0	1
NULL	NULL	1	0	1
NULL	1	1	0	1
NULL	-11	1	0	1
NULL	0	1	0	1
NULL	NULL	1	0	1
NULL	2	1	0	1
NULL	NULL	1	0	1
NULL	NULL	1	0	1
NULL	NULL	1	0	1
NULL	NULL	1	0	1
NULL	-10	1	0	1
NULL	NULL	1	0	1
SELECT * FROM table0_bigint WHERE col_char_12_key BETWEEN CAST( 2 AS CHAR(100) ) AND CAST( 7 AS CHAR(100) ) ORDER BY col_bigint_key  , col_char_12_key ASC , pk DESC LIMIT 4;
col_char_12_key	col_char_12	col_bigint_key	pk	col_bigint
2	NULL	NULL	1	NULL
SELECT col_char_12_key FROM table0_bigint WHERE ( -320929792 , -397344768 , 1392181248 ) NOT IN ( ( SUBSTR( CAST( ( CEIL ( ROUND ( -1 ) ) ) AS CHAR(100) ) , 1 , 12 ) , SUBSTR( CAST( ( LENGTH( SUBSTR( CAST( ( ROUND( 0 + ROUND( ROUND( -10 * ROUND( ROUND( 1 * 9 ) * 0 ) ) * -9 ) ) ) AS CHAR(100) ) , 1 , 12 ) ) ) AS CHAR(100) ) , 1 , 12 ) , SUBSTR( CAST( ( -10 ) AS CHAR(100) ) , 1 , 12 ) ) , ( SUBSTR( CAST( ( ROUND( -10 - ROUND( 1 + ROUND ( 13 ) ) ) ) AS CHAR(100) ) , 1 , 12 ) , SUBSTR( CAST( ( FLOOR ( 1 ) ) AS CHAR(100) ) , 1 , 12 ) , SUBSTR( CAST( ( -10 ) AS CHAR(100) ) , 1 , 12 ) ) ) ORDER BY pk LIMIT 1 , 1 /* RESULTSET_HAS_ZERO_OR_ONE_ROWS */;
col_char_12_key
99
SELECT * FROM table0_bigint WHERE ( -192086016 ) IN ( SUBSTR( CAST( ( LENGTH( SUBSTR( CAST( ( ROUND( 1 - 10 ) ) AS CHAR(100) ) , 1 , 12 ) ) ) AS CHAR(100) ) , 1 , 12 ) , SUBSTR( CAST( ( LENGTH( SUBSTR( CAST( ( CEIL ( CEIL ( -100 ) ) ) AS CHAR(100) ) , 1 , 12 ) ) ) AS CHAR(100) ) , 1 , 12 ) , SUBSTR( CAST( ( ROUND( ROUND( -9 + ROUND( 201 * 1 ) ) + 9 ) ) AS CHAR(100) ) , 1 , 12 ) , SUBSTR( CAST( ( -100 ) AS CHAR(100) ) , 1 , 12 ) , SUBSTR( CAST( ( ROUND( 247 - -9 ) ) AS CHAR(100) ) , 1 , 12 ) ) ORDER BY col_bigint ASC , pk  LIMIT 1;
col_char_12_key	col_char_12	col_bigint_key	pk	col_bigint
INSERT INTO table0_bigint ( pk , col_char_12_key ) VALUES ( 8 , SUBSTR( CAST( ( ROUND( 53 - ROUND( LENGTH('BSTIJ') * 164 ) ) ) AS CHAR(100) ) , 1 , 12 ) ) ;
ERROR 23000: Duplicate entry '8' for key 'PRIMARY'
SELECT * FROM table0_bigint ORDER BY pk;
col_char_12_key	col_char_12	col_bigint_key	pk	col_bigint
-10	NULL	NULL	-100	-100
99	NULL	NULL	-10	NULL
139	NULL	NULL	-9	NULL
NULL	NULL	NULL	-1	NULL
NULL	NULL	NULL	0	NULL
2	NULL	NULL	1	NULL
NULL	NULL	1	4	NULL
-100	NULL	2	8	NULL
NULL	5	-11	9	NULL
NULL	NULL	-10	10	10
NULL	10	0	83	NULL
NULL	9	NULL	99	99
-10	NULL	NULL	154	NULL
SELECT col_bigint,col_bigint_key,col_char_12,col_char_12_key,pk FROM table0_bigint WHERE pk >= -1677262848 and pk <= -1677262848 ORDER BY pk LIMIT 4 , 4 /* RESULTSET_HAS_ZERO_OR_ONE_ROWS */;
col_bigint	col_bigint_key	col_char_12	col_char_12_key	pk
INSERT INTO table0_bigint ( pk , col_bigint, col_char_12_key ) VALUES ( -1 , SUBSTR( CAST( ( LENGTH( SUBSTR( CAST( ( LENGTH('JBWLE') ) AS CHAR(100) ) , 1 , 12 ) ) ) AS CHAR(100) ) , 1 , 12 ) , SUBSTR( CAST( ( LENGTH( SUBSTR( CAST( ( LENGTH( SUBSTR( CAST( ( ROUND( 9 + 1 ) ) AS CHAR(100) ) , 1 , 12 ) ) ) AS CHAR(100) ) , 1 , 12 ) ) ) AS CHAR(100) ) , 1 , 12 ) ) ;
ERROR 23000: Duplicate entry '-1' for key 'PRIMARY'
SELECT * FROM table0_bigint ORDER BY pk;
col_char_12_key	col_char_12	col_bigint_key	pk	col_bigint
-10	NULL	NULL	-100	-100
99	NULL	NULL	-10	NULL
139	NULL	NULL	-9	NULL
NULL	NULL	NULL	-1	NULL
NULL	NULL	NULL	0	NULL
2	NULL	NULL	1	NULL
NULL	NULL	1	4	NULL
-100	NULL	2	8	NULL
NULL	5	-11	9	NULL
NULL	NULL	-10	10	10
NULL	10	0	83	NULL
NULL	9	NULL	99	99
-10	NULL	NULL	154	NULL
SELECT COUNT( col_char_12 ) FROM table0_bigint  ORDER BY pk LIMIT 4 /* RESULTSET_HAS_ZERO_OR_ONE_ROWS */;
COUNT( col_char_12 )
3
INSERT INTO table0_bigint ( pk , col_bigint_key ) VALUES ( 0 , SUBSTR( CAST( ( -9 ) AS CHAR(100) ) , 1 , 12 ) ) ;
ERROR 23000: Duplicate entry '0' for key 'PRIMARY'
SELECT * FROM table0_bigint ORDER BY pk;
col_char_12_key	col_char_12	col_bigint_key	pk	col_bigint
-10	NULL	NULL	-100	-100
99	NULL	NULL	-10	NULL
139	NULL	NULL	-9	NULL
NULL	NULL	NULL	-1	NULL
NULL	NULL	NULL	0	NULL
2	NULL	NULL	1	NULL
NULL	NULL	1	4	NULL
-100	NULL	2	8	NULL
NULL	5	-11	9	NULL
NULL	NULL	-10	10	10
NULL	10	0	83	NULL
NULL	9	NULL	99	99
-10	NULL	NULL	154	NULL
SELECT col_char_12_key,pk FROM table0_bigint WHERE ( -738656256 , -1797783552 , 570687488 ) NOT IN ( ( SUBSTR( CAST( ( LENGTH('SITHD') ) AS CHAR(100) ) , 1 , 12 ) , SUBSTR( CAST( ( ROUND( FLOOR ( LENGTH('ZOCUG') ) + -9 ) ) AS CHAR(100) ) , 1 , 12 ) , SUBSTR( CAST( ( -1 ) AS CHAR(100) ) , 1 , 12 ) ) , ( SUBSTR( CAST( ( LENGTH('RKGJG') ) AS CHAR(100) ) , 1 , 12 ) , SUBSTR( CAST( ( LENGTH('ILLNZ') ) AS CHAR(100) ) , 1 , 12 ) , SUBSTR( CAST( ( LENGTH('BCRZC') ) AS CHAR(100) ) , 1 , 12 ) ) ) GROUP BY col_char_12_key,pk ORDER BY col_char_12_key,pk LIMIT 5 , 7;
col_char_12_key	pk
NULL	83
NULL	99
-10	-100
-10	154
-100	8
139	-9
2	1
SELECT col_bigint_key FROM table0_bigint WHERE col_bigint NOT IN ( SUBSTR( CAST( ( LENGTH( SUBSTR( CAST( ( LENGTH( SUBSTR( CAST( ( ROUND( -9 + LENGTH('FDXCP') ) ) AS CHAR(100) ) , 1 , 12 ) ) ) AS CHAR(100) ) , 1 , 12 ) ) ) AS CHAR(100) ) , 1 , 12 ) , SUBSTR( CAST( ( ROUND( 10 - ROUND( ABS ( ROUND( 5 * LENGTH('MXYVP') ) ) + 0 ) ) ) AS CHAR(100) ) , 1 , 12 ) , SUBSTR( CAST( ( LENGTH( SUBSTR( CAST( ( ROUND( ROUND( 10 * -9 ) + -1 ) ) AS CHAR(100) ) , 1 , 12 ) ) ) AS CHAR(100) ) , 1 , 12 ) , SUBSTR( CAST( ( LENGTH('BZRSE') ) AS CHAR(100) ) , 1 , 12 ) , SUBSTR( CAST( ( 99 ) AS CHAR(100) ) , 1 , 12 ) ) ORDER BY pk , col_bigint , col_char_12,pk DESC , pk ASC LIMIT 1 /* RESULTSET_HAS_ZERO_OR_ONE_ROWS */;
col_bigint_key
NULL
UPDATE table0_bigint SET pk = SUBSTR( CAST( ( ROUND( -1 * -1 ) ) AS CHAR(100) ) , 1 , 12 ) , col_char_12 = SUBSTR(concat( CAST(col_bigint_key AS CHAR(100)) , SUBSTR( CAST( ( ROUND( ABS ( -1 ) + 0 ) ) AS CHAR(100) ) , 1 , 12 ) ) , 1 , 12 ) WHERE ( 1287585792 , -2092367872 , -1320812544 ) NOT IN ( ( SUBSTR( CAST( ( ROUND ( 9 ) ) AS CHAR(100) ) , 1 , 12 ) , SUBSTR( CAST( ( LENGTH('OYCRY') ) AS CHAR(100) ) , 1 , 12 ) , SUBSTR( CAST( ( CEIL ( LENGTH( SUBSTR( CAST( ( ROUND( FLOOR ( 10 ) - 10 ) ) AS CHAR(100) ) , 1 , 12 ) ) ) ) AS CHAR(100) ) , 1 , 12 ) ) , ( SUBSTR( CAST( ( FLOOR ( LENGTH( SUBSTR( CAST( ( ROUND( LENGTH('KOSBD') + 99 ) ) AS CHAR(100) ) , 1 , 12 ) ) ) ) AS CHAR(100) ) , 1 , 12 ) , SUBSTR( CAST( ( LENGTH('HTBPQ') ) AS CHAR(100) ) , 1 , 12 ) , SUBSTR( CAST( ( LENGTH('HMXSO') ) AS CHAR(100) ) , 1 , 12 ) ) ) ORDER BY col_bigint,col_bigint_key,col_char_12,col_char_12_key,pk,pk  , pk  LIMIT 4 ;
ERROR 23000: Duplicate entry '1' for key 'PRIMARY'
SELECT * FROM table0_bigint ORDER BY pk;
col_char_12_key	col_char_12	col_bigint_key	pk	col_bigint
-10	NULL	NULL	-100	-100
99	NULL	NULL	-10	NULL
139	NULL	NULL	-9	NULL
NULL	NULL	NULL	-1	NULL
NULL	NULL	NULL	0	NULL
2	NULL	NULL	1	NULL
NULL	NULL	1	4	NULL
-100	NULL	2	8	NULL
NULL	5	-11	9	NULL
NULL	NULL	-10	10	10
NULL	10	0	83	NULL
NULL	9	NULL	99	99
-10	NULL	NULL	154	NULL
SELECT UPPER( col_char_12_key ),pk FROM table0_bigint WHERE pk <> 0 GROUP BY col_char_12_key,pk ORDER BY col_char_12_key,pk LIMIT 1;
UPPER( col_char_12_key )	pk
NULL	-1
SELECT col_char_12_key FROM table0_bigint WHERE col_char_12_key < ( SUBSTR( CAST( ( ROUND( -100 - 1 ) ) AS CHAR(100) ) , 1 , 12 ) ) AND pk = ( SUBSTR( CAST( ( LENGTH( SUBSTR( CAST( ( ROUND( 9 + FLOOR ( 10 ) ) ) AS CHAR(100) ) , 1 , 12 ) ) ) AS CHAR(100) ) , 1 , 12 ) ) ORDER BY col_bigint_key , pk DESC LIMIT 233 , 1 /* RESULTSET_HAS_ZERO_OR_ONE_ROWS */;
col_char_12_key
INSERT INTO table0_bigint ( pk , col_bigint, col_char_12_key ) VALUES ( 1 , SUBSTR( CAST( ( ROUND( 3 + 0 ) ) AS CHAR(100) ) , 1 , 12 ) , SUBSTR( CAST( ( FLOOR ( 0 ) ) AS CHAR(100) ) , 1 , 12 ) ) ;
ERROR 23000: Duplicate entry '1' for key 'PRIMARY'
SELECT * FROM table0_bigint ORDER BY pk;
col_char_12_key	col_char_12	col_bigint_key	pk	col_bigint
-10	NULL	NULL	-100	-100
99	NULL	NULL	-10	NULL
139	NULL	NULL	-9	NULL
NULL	NULL	NULL	-1	NULL
NULL	NULL	NULL	0	NULL
2	NULL	NULL	1	NULL
NULL	NULL	1	4	NULL
-100	NULL	2	8	NULL
NULL	5	-11	9	NULL
NULL	NULL	-10	10	10
NULL	10	0	83	NULL
NULL	9	NULL	99	99
-10	NULL	NULL	154	NULL
SELECT * FROM table0_bigint WHERE LENGTH( SUBSTR( CAST( ( ROUND( 99 - 189 ) ) AS CHAR(100) ) , 1 , 12 ) ) > 99 ORDER BY pk,pk  , pk ASC LIMIT 6 , 2;
col_char_12_key	col_char_12	col_bigint_key	pk	col_bigint
SELECT COUNT( col_bigint ) FROM table0_bigint WHERE pk IN ( SUBSTR( CAST( ( ROUND( 0 - LENGTH('CMAYC') ) ) AS CHAR(100) ) , 1 , 12 ) , SUBSTR( CAST( ( LENGTH( SUBSTR( CAST( ( ABS ( 9 ) ) AS CHAR(100) ) , 1 , 12 ) ) ) AS CHAR(100) ) , 1 , 12 ) , SUBSTR( CAST( ( LENGTH( SUBSTR( CAST( ( LENGTH('ASOLB') ) AS CHAR(100) ) , 1 , 12 ) ) ) AS CHAR(100) ) , 1 , 12 ) , SUBSTR( CAST( ( LENGTH( SUBSTR( CAST( ( ROUND( ROUND ( -9 ) * 0 ) ) AS CHAR(100) ) , 1 , 12 ) ) ) AS CHAR(100) ) , 1 , 12 ) , SUBSTR( CAST( ( -1 ) AS CHAR(100) ) , 1 , 12 ) ) ORDER BY col_char_12_key , col_bigint_key , col_bigint_key , pk  LIMIT 4 /* RESULTSET_HAS_ZERO_OR_ONE_ROWS */;
COUNT( col_bigint )
0
SELECT col_bigint_key FROM table0_bigint WHERE pk = ( SUBSTR( CAST( ( ABS ( -1 ) ) AS CHAR(100) ) , 1 , 12 ) ) ORDER BY col_char_12_key , pk ASC LIMIT 2 /* RESULTSET_HAS_ZERO_OR_ONE_ROWS */;
col_bigint_key
NULL
SELECT col_bigint_key FROM table0_bigint WHERE pk = ( SUBSTR( CAST( ( FLOOR ( SIGN ( LENGTH( SUBSTR( CAST( ( ROUND( ABS ( FLOOR ( ROUND( LENGTH( SUBSTR( CAST( ( ROUND( 7 * -10 ) ) AS CHAR(100) ) , 1 , 12 ) ) + 99 ) ) ) + -9 ) ) AS CHAR(100) ) , 1 , 12 ) ) ) ) ) AS CHAR(100) ) , 1 , 12 ) ) ORDER BY col_bigint,pk  , pk ASC LIMIT 2 , 3 /* RESULTSET_HAS_ZERO_OR_ONE_ROWS */;
col_bigint_key
SELECT pk , col_bigint , col_char_12_key FROM table0_bigint WHERE col_bigint < ( SUBSTR( CAST( ( ROUND( 1 * 2 ) ) AS CHAR(100) ) , 1 , 12 ) ) ORDER BY col_bigint_key , col_char_12_key , col_char_12_key , pk ASC LIMIT 6 , 1 /* RESULTSET_HAS_ZERO_OR_ONE_ROWS */;
pk	col_bigint	col_char_12_key
SELECT col_bigint_key FROM table0_bigint WHERE pk > 465436672 and pk < 465436672 ORDER BY col_bigint_key DESC , col_char_12_key ASC , pk DESC LIMIT 169 , 1 /* RESULTSET_HAS_ZERO_OR_ONE_ROWS */;
col_bigint_key
SELECT * FROM table0_bigint WHERE SUBSTR( CAST( ( LENGTH('BBRFS') ) AS CHAR(100) ) , 1 , 12 ) >= SIGN ( ABS ( 9 ) ) ORDER BY col_bigint_key , pk ASC LIMIT 3;
col_char_12_key	col_char_12	col_bigint_key	pk	col_bigint
-10	NULL	NULL	-100	-100
99	NULL	NULL	-10	NULL
139	NULL	NULL	-9	NULL
SELECT 1 FROM table0_bigint WHERE SUBSTR( CAST( ( ROUND( ROUND( -9 - FLOOR ( -1 ) ) - 0 ) ) AS CHAR(100) ) , 1 , 12 ) > ABS ( -9 ) FOR UPDATE;
1
UPDATE table0_bigint SET col_char_12 = col_char_12_key WHERE ( 1015218176 , 1071906816 , -2019426304 ) IN ( ( SUBSTR( CAST( ( ROUND( 99 + ROUND( ROUND( -9 * CEIL ( ROUND( -9 * 10 ) ) ) - 1 ) ) ) AS CHAR(100) ) , 1 , 12 ) , SUBSTR( CAST( ( ROUND( -9 - -100 ) ) AS CHAR(100) ) , 1 , 12 ) , SUBSTR( CAST( ( LENGTH('PMXWE') ) AS CHAR(100) ) , 1 , 12 ) ) , ( SUBSTR( CAST( ( ROUND( ROUND( 1 - 1 ) * 234 ) ) AS CHAR(100) ) , 1 , 12 ) , SUBSTR( CAST( ( ROUND( ROUND( -9 + -10 ) + -10 ) ) AS CHAR(100) ) , 1 , 12 ) , SUBSTR( CAST( ( LENGTH('YLGGU') ) AS CHAR(100) ) , 1 , 12 ) ) ) ORDER BY pk LIMIT 5 ;
SELECT * FROM table0_bigint ORDER BY pk;
col_char_12_key	col_char_12	col_bigint_key	pk	col_bigint
-10	NULL	NULL	-100	-100
99	NULL	NULL	-10	NULL
139	NULL	NULL	-9	NULL
NULL	NULL	NULL	-1	NULL
NULL	NULL	NULL	0	NULL
2	NULL	NULL	1	NULL
NULL	NULL	1	4	NULL
-100	NULL	2	8	NULL
NULL	5	-11	9	NULL
NULL	NULL	-10	10	10
NULL	10	0	83	NULL
NULL	9	NULL	99	99
-10	NULL	NULL	154	NULL
INSERT INTO table0_bigint ( pk , col_char_12_key ) VALUES ( 10, CAST( 6 AS CHAR(100)) ) , ( 10, CAST( 8 AS CHAR(100)) ) ;
ERROR 23000: Duplicate entry '10' for key 'PRIMARY'
SELECT * FROM table0_bigint ORDER BY pk;
col_char_12_key	col_char_12	col_bigint_key	pk	col_bigint
-10	NULL	NULL	-100	-100
99	NULL	NULL	-10	NULL
139	NULL	NULL	-9	NULL
NULL	NULL	NULL	-1	NULL
NULL	NULL	NULL	0	NULL
2	NULL	NULL	1	NULL
NULL	NULL	1	4	NULL
-100	NULL	2	8	NULL
NULL	5	-11	9	NULL
NULL	NULL	-10	10	10
NULL	10	0	83	NULL
NULL	9	NULL	99	99
-10	NULL	NULL	154	NULL
SELECT  UPPER( col_char_12_key ) FROM table0_bigint WHERE  ( col_bigint_key = SUBSTR( CAST( ( ROUND( 1 - -9 ) ) AS CHAR(100) ) , 1 , 12 ) ) AND  ( col_bigint_key > SUBSTR( CAST( ( -1 ) AS CHAR(100) ) , 1 , 12 ) ) ORDER BY col_bigint_key  , col_char_12_key DESC , pk ASC;
UPPER( col_char_12_key )
SELECT * FROM table0_bigint  ORDER BY col_char_12_key , col_bigint_key , pk DESC LIMIT 7 , 5;
col_char_12_key	col_char_12	col_bigint_key	pk	col_bigint
-10	NULL	NULL	154	NULL
-10	NULL	NULL	-100	-100
-100	NULL	2	8	NULL
139	NULL	NULL	-9	NULL
2	NULL	NULL	1	NULL
SELECT * FROM table0_bigint WHERE col_bigint != ( SUBSTR( CAST( ( 0 ) AS CHAR(100) ) , 1 , 12 ) ) AND col_bigint = ( SUBSTR( CAST( ( CEIL ( -10 ) ) AS CHAR(100) ) , 1 , 12 ) ) ORDER BY col_char_12_key  , pk ASC LIMIT 6 , 1 /* RESULTSET_HAS_ZERO_OR_ONE_ROWS */;
col_char_12_key	col_char_12	col_bigint_key	pk	col_bigint
SELECT pk , col_bigint_key , col_char_12_key FROM table0_bigint WHERE col_bigint BETWEEN SUBSTR( CAST( ( LENGTH( SUBSTR( CAST( ( ROUND( 0 * SIGN ( FLOOR ( 0 ) ) ) ) AS CHAR(100) ) , 1 , 12 ) ) ) AS CHAR(100) ) , 1 , 12 ) AND SUBSTR( CAST( ( ROUND( -1 - ROUND( -10 + ROUND ( 1 ) ) ) ) AS CHAR(100) ) , 1 , 12 ) ORDER BY pk LIMIT 4 , 3;
pk	col_bigint_key	col_char_12_key
SELECT pk , col_bigint , col_char_12_key FROM table0_bigint WHERE LENGTH('CMBMS') != ABS ( 10 ) ORDER BY pk LIMIT 2 , 4;
pk	col_bigint	col_char_12_key
-9	NULL	139
-1	NULL	NULL
0	NULL	NULL
1	NULL	2
INSERT INTO table0_bigint (pk) VALUES ( 8 ) ;
ERROR 23000: Duplicate entry '8' for key 'PRIMARY'
SELECT * FROM table0_bigint ORDER BY pk;
col_char_12_key	col_char_12	col_bigint_key	pk	col_bigint
-10	NULL	NULL	-100	-100
99	NULL	NULL	-10	NULL
139	NULL	NULL	-9	NULL
NULL	NULL	NULL	-1	NULL
NULL	NULL	NULL	0	NULL
2	NULL	NULL	1	NULL
NULL	NULL	1	4	NULL
-100	NULL	2	8	NULL
NULL	5	-11	9	NULL
NULL	NULL	-10	10	10
NULL	10	0	83	NULL
NULL	9	NULL	99	99
-10	NULL	NULL	154	NULL
SELECT 1 FROM table0_bigint  FOR UPDATE;
1
1
1
1
1
1
1
1
1
1
1
1
1
1
SELECT * FROM table0_bigint WHERE -100 <> FLOOR ( 1 ) ORDER BY col_bigint_key , pk ASC LIMIT 1 /* RESULTSET_HAS_ZERO_OR_ONE_ROWS */;
col_char_12_key	col_char_12	col_bigint_key	pk	col_bigint
-10	NULL	NULL	-100	-100
INSERT INTO table0_bigint (pk) VALUES ( 10 ) ;
ERROR 23000: Duplicate entry '10' for key 'PRIMARY'
SELECT * FROM table0_bigint ORDER BY pk;
col_char_12_key	col_char_12	col_bigint_key	pk	col_bigint
-10	NULL	NULL	-100	-100
99	NULL	NULL	-10	NULL
139	NULL	NULL	-9	NULL
NULL	NULL	NULL	-1	NULL
NULL	NULL	NULL	0	NULL
2	NULL	NULL	1	NULL
NULL	NULL	1	4	NULL
-100	NULL	2	8	NULL
NULL	5	-11	9	NULL
NULL	NULL	-10	10	10
NULL	10	0	83	NULL
NULL	9	NULL	99	99
-10	NULL	NULL	154	NULL
INSERT INTO table0_bigint ( pk , col_bigint, col_char_12 ) VALUES ( 99 , SUBSTR( CAST( ( CEIL ( -9 ) ) AS CHAR(100) ) , 1 , 12 ) , SUBSTR( CAST( ( LENGTH('FCPXL') ) AS CHAR(100) ) , 1 , 12 ) ) ;
ERROR 23000: Duplicate entry '99' for key 'PRIMARY'
SELECT * FROM table0_bigint ORDER BY pk;
col_char_12_key	col_char_12	col_bigint_key	pk	col_bigint
-10	NULL	NULL	-100	-100
99	NULL	NULL	-10	NULL
139	NULL	NULL	-9	NULL
NULL	NULL	NULL	-1	NULL
NULL	NULL	NULL	0	NULL
2	NULL	NULL	1	NULL
NULL	NULL	1	4	NULL
-100	NULL	2	8	NULL
NULL	5	-11	9	NULL
NULL	NULL	-10	10	10
NULL	10	0	83	NULL
NULL	9	NULL	99	99
-10	NULL	NULL	154	NULL
SELECT UPPER( col_bigint_key ) FROM table0_bigint WHERE 0 >= ROUND( -100 * -10 ) GROUP BY col_bigint_key ORDER BY col_bigint_key LIMIT 1 , 2;
UPPER( col_bigint_key )
SELECT * FROM table0_bigint WHERE col_bigint_key > ( SUBSTR( CAST( ( ROUND( 159 - 1 ) ) AS CHAR(100) ) , 1 , 12 ) ) ORDER BY col_char_12_key , pk ASC LIMIT 5;
col_char_12_key	col_char_12	col_bigint_key	pk	col_bigint
SELECT DISTINCT 9999 FROM table0_bigint ORDER BY col_bigint ASC , col_char_12_key  , pk ;
9999
9999
SELECT COUNT( col_char_12_key ) FROM table0_bigint WHERE LENGTH('OBPPF') <= LENGTH('UOVGR') ORDER BY pk LIMIT 8 , 6 /* RESULTSET_HAS_ZERO_OR_ONE_ROWS */;
COUNT( col_char_12_key )
SELECT 1 FROM table0_bigint WHERE col_bigint_key NOT IN ( CAST(99 AS CHAR(100)) , CAST(99 AS CHAR(100)) , CAST(7 AS CHAR(100)) ) FOR UPDATE;
1
1
1
1
1
1
INSERT INTO table0_bigint ( pk , col_bigint_key ) VALUES ( 99, CAST( 99 AS CHAR(100)) ) , ( 1, CAST( -1 AS CHAR(100)) ) ;
ERROR 23000: Duplicate entry '99' for key 'PRIMARY'
SELECT * FROM table0_bigint ORDER BY pk;
col_char_12_key	col_char_12	col_bigint_key	pk	col_bigint
-10	NULL	NULL	-100	-100
99	NULL	NULL	-10	NULL
139	NULL	NULL	-9	NULL
NULL	NULL	NULL	-1	NULL
NULL	NULL	NULL	0	NULL
2	NULL	NULL	1	NULL
NULL	NULL	1	4	NULL
-100	NULL	2	8	NULL
NULL	5	-11	9	NULL
NULL	NULL	-10	10	10
NULL	10	0	83	NULL
NULL	9	NULL	99	99
-10	NULL	NULL	154	NULL
INSERT INTO table0_bigint ( pk , col_char_12_key ) VALUES ( 67, CAST( 9 AS CHAR(100)) ) , ( 0, CAST( 185 AS CHAR(100)) ) ;
ERROR 23000: Duplicate entry '0' for key 'PRIMARY'
SELECT * FROM table0_bigint ORDER BY pk;
col_char_12_key	col_char_12	col_bigint_key	pk	col_bigint
-10	NULL	NULL	-100	-100
99	NULL	NULL	-10	NULL
139	NULL	NULL	-9	NULL
NULL	NULL	NULL	-1	NULL
NULL	NULL	NULL	0	NULL
2	NULL	NULL	1	NULL
NULL	NULL	1	4	NULL
-100	NULL	2	8	NULL
NULL	5	-11	9	NULL
NULL	NULL	-10	10	10
NULL	10	0	83	NULL
NULL	9	NULL	99	99
-10	NULL	NULL	154	NULL
INSERT INTO table0_bigint ( pk , col_char_12_key ) VALUES ( 0 , SUBSTR( CAST( ( ROUND ( ROUND( 99 - ROUND( 6 - 1 ) ) ) ) AS CHAR(100) ) , 1 , 12 ) ) ;
ERROR 23000: Duplicate entry '0' for key 'PRIMARY'
SELECT * FROM table0_bigint ORDER BY pk;
col_char_12_key	col_char_12	col_bigint_key	pk	col_bigint
-10	NULL	NULL	-100	-100
99	NULL	NULL	-10	NULL
139	NULL	NULL	-9	NULL
NULL	NULL	NULL	-1	NULL
NULL	NULL	NULL	0	NULL
2	NULL	NULL	1	NULL
NULL	NULL	1	4	NULL
-100	NULL	2	8	NULL
NULL	5	-11	9	NULL
NULL	NULL	-10	10	10
NULL	10	0	83	NULL
NULL	9	NULL	99	99
-10	NULL	NULL	154	NULL
SELECT col_bigint_key,pk FROM table0_bigint WHERE col_bigint_key BETWEEN SUBSTR( CAST( ( 4 ) AS CHAR(100) ) , 1 , 12 ) AND SUBSTR( CAST( ( LENGTH('GQXIH') ) AS CHAR(100) ) , 1 , 12 ) GROUP BY col_bigint_key,pk ORDER BY col_bigint_key,pk LIMIT 1 , 1;
col_bigint_key	pk
SELECT UPPER( col_bigint_key ) FROM table0_bigint WHERE NOT ( col_char_12 != SUBSTR( CAST( ( ROUND( 9 + -10 ) ) AS CHAR(100) ) , 1 , 12 ) ) AND NOT ( pk > SUBSTR( CAST( ( ROUND( 9 - ABS ( 0 ) ) ) AS CHAR(100) ) , 1 , 12 ) ) AND NOT ( col_char_12 >= SUBSTR( CAST( ( ROUND( ROUND( -100 + 1 ) + -100 ) ) AS CHAR(100) ) , 1 , 12 ) ) AND  ( col_char_12 <= SUBSTR( CAST( ( LENGTH('PGNZA') ) AS CHAR(100) ) , 1 , 12 ) ) GROUP BY col_bigint_key ORDER BY col_bigint_key LIMIT 7 , 3;
UPPER( col_bigint_key )
UPDATE table0_bigint SET col_bigint_key = CAST(158 AS CHAR(100)) WHERE pk != 226 ORDER BY col_char_12_key , col_bigint_key , pk ASC LIMIT 7 ;
SELECT * FROM table0_bigint ORDER BY pk;
col_char_12_key	col_char_12	col_bigint_key	pk	col_bigint
-10	NULL	NULL	-100	-100
99	NULL	NULL	-10	NULL
139	NULL	NULL	-9	NULL
NULL	NULL	158	-1	NULL
NULL	NULL	158	0	NULL
2	NULL	NULL	1	NULL
NULL	NULL	158	4	NULL
-100	NULL	2	8	NULL
NULL	5	158	9	NULL
NULL	NULL	158	10	10
NULL	10	158	83	NULL
NULL	9	158	99	99
-10	NULL	NULL	154	NULL
SELECT * FROM table0_bigint WHERE ( 1157103616 , 2118713344 ) IN ( ( SUBSTR( CAST( ( ROUND( SIGN ( ROUND( ROUND( -1 + 2 ) * -1 ) ) + 99 ) ) AS CHAR(100) ) , 1 , 12 ) , SUBSTR( CAST( ( ROUND( -1 * ROUND( 99 * ROUND( ROUND( LENGTH('HGCQZ') * 160 ) * 0 ) ) ) ) AS CHAR(100) ) , 1 , 12 ) ) , ( SUBSTR( CAST( ( ROUND( 10 * ROUND( 135 * FLOOR ( -100 ) ) ) ) AS CHAR(100) ) , 1 , 12 ) , SUBSTR( CAST( ( ROUND ( 9 ) ) AS CHAR(100) ) , 1 , 12 ) ) ) ORDER BY col_char_12_key , col_char_12_key , pk ASC LIMIT 8;
col_char_12_key	col_char_12	col_bigint_key	pk	col_bigint
SELECT col_char_12 FROM table0_bigint WHERE CEIL ( -9 ) <> col_bigint ORDER BY col_bigint_key DESC , col_char_12 DESC , pk DESC LIMIT 7 , 3;
col_char_12
SELECT col_bigint,col_bigint_key,col_char_12,col_char_12_key,pk FROM table0_bigint WHERE ( -932380672 ) IN ( SUBSTR( CAST( ( SIGN ( SIGN ( ROUND( -9 - -9 ) ) ) ) AS CHAR(100) ) , 1 , 12 ) , SUBSTR( CAST( ( ROUND( 99 - 26 ) ) AS CHAR(100) ) , 1 , 12 ) , SUBSTR( CAST( ( ROUND( -9 + 1 ) ) AS CHAR(100) ) , 1 , 12 ) , SUBSTR( CAST( ( ROUND( 10 + 1 ) ) AS CHAR(100) ) , 1 , 12 ) , SUBSTR( CAST( ( ROUND( ROUND ( LENGTH('MHOYR') ) * -1 ) ) AS CHAR(100) ) , 1 , 12 ) ) ORDER BY col_char_12_key , col_char_12_key , pk  LIMIT 2;
col_bigint	col_bigint_key	col_char_12	col_char_12_key	pk
SELECT * FROM table0_bigint WHERE pk = ( SUBSTR( CAST( ( SIGN ( LENGTH('GRXDY') ) ) AS CHAR(100) ) , 1 , 12 ) ) AND col_bigint_key < ( SUBSTR( CAST( ( LENGTH( SUBSTR( CAST( ( ROUND ( 99 ) ) AS CHAR(100) ) , 1 , 12 ) ) ) AS CHAR(100) ) , 1 , 12 ) ) ORDER BY col_char_12 DESC , pk  LIMIT 1 /* RESULTSET_HAS_ZERO_OR_ONE_ROWS */;
col_char_12_key	col_char_12	col_bigint_key	pk	col_bigint
SELECT 1 FROM table0_bigint WHERE pk <> ( SUBSTR( CAST( ( ROUND ( LENGTH( SUBSTR( CAST( ( LENGTH( SUBSTR( CAST( ( LENGTH('HIFTU') ) AS CHAR(100) ) , 1 , 12 ) ) ) AS CHAR(100) ) , 1 , 12 ) ) ) ) AS CHAR(100) ) , 1 , 12 ) ) FOR UPDATE;
1
1
1
1
1
1
1
1
1
1
1
1
1
SELECT 1 FROM table0_bigint WHERE ROUND( -100 + ROUND( 17 + ROUND( ROUND( ROUND( -9 * CEIL ( 99 ) ) * -9 ) - 9 ) ) ) <> SUBSTR( CAST( ( 1 ) AS CHAR(100) ) , 1 , 12 ) FOR UPDATE;
1
1
1
1
1
1
1
1
1
1
1
1
1
1
INSERT INTO table0_bigint (pk) VALUES ( -9 ) ;
ERROR 23000: Duplicate entry '-9' for key 'PRIMARY'
SELECT * FROM table0_bigint ORDER BY pk;
col_char_12_key	col_char_12	col_bigint_key	pk	col_bigint
-10	NULL	NULL	-100	-100
99	NULL	NULL	-10	NULL
139	NULL	NULL	-9	NULL
NULL	NULL	158	-1	NULL
NULL	NULL	158	0	NULL
2	NULL	NULL	1	NULL
NULL	NULL	158	4	NULL
-100	NULL	2	8	NULL
NULL	5	158	9	NULL
NULL	NULL	158	10	10
NULL	10	158	83	NULL
NULL	9	158	99	99
-10	NULL	NULL	154	NULL
SELECT 1 FROM table0_bigint WHERE ( 2110980096 , -995164160 , -1201340416 , 1212678144 ) NOT IN ( ( SUBSTR( CAST( ( LENGTH('VBBAC') ) AS CHAR(100) ) , 1 , 12 ) , SUBSTR( CAST( ( ROUND( ROUND( -100 - 9 ) - 214 ) ) AS CHAR(100) ) , 1 , 12 ) , SUBSTR( CAST( ( -9 ) AS CHAR(100) ) , 1 , 12 ) , SUBSTR( CAST( ( LENGTH( SUBSTR( CAST( ( -1 ) AS CHAR(100) ) , 1 , 12 ) ) ) AS CHAR(100) ) , 1 , 12 ) ) ) FOR UPDATE;
1
1
1
1
1
1
1
1
1
1
1
1
1
1
INSERT INTO table0_bigint (pk) VALUES ( -10 ) ;
ERROR 23000: Duplicate entry '-10' for key 'PRIMARY'
SELECT * FROM table0_bigint ORDER BY pk;
col_char_12_key	col_char_12	col_bigint_key	pk	col_bigint
-10	NULL	NULL	-100	-100
99	NULL	NULL	-10	NULL
139	NULL	NULL	-9	NULL
NULL	NULL	158	-1	NULL
NULL	NULL	158	0	NULL
2	NULL	NULL	1	NULL
NULL	NULL	158	4	NULL
-100	NULL	2	8	NULL
NULL	5	158	9	NULL
NULL	NULL	158	10	10
NULL	10	158	83	NULL
NULL	9	158	99	99
-10	NULL	NULL	154	NULL
SELECT * FROM table0_bigint WHERE pk > ( SUBSTR( CAST( ( ROUND( 4 + 3 ) ) AS CHAR(100) ) , 1 , 12 ) ) ORDER BY col_bigint_key DESC , pk  LIMIT 1 /* RESULTSET_HAS_ZERO_OR_ONE_ROWS */;
col_char_12_key	col_char_12	col_bigint_key	pk	col_bigint
NULL	5	158	9	NULL
SELECT col_char_12 FROM table0_bigint WHERE col_bigint_key IN ( SUBSTR( CAST( ( ROUND( 9 - 4 ) ) AS CHAR(100) ) , 1 , 12 ) , SUBSTR( CAST( ( ROUND( 10 - -100 ) ) AS CHAR(100) ) , 1 , 12 ) , SUBSTR( CAST( ( LENGTH( SUBSTR( CAST( ( ROUND( -1 * LENGTH('YMSAK') ) ) AS CHAR(100) ) , 1 , 12 ) ) ) AS CHAR(100) ) , 1 , 12 ) , SUBSTR( CAST( ( CEIL ( CEIL ( -100 ) ) ) AS CHAR(100) ) , 1 , 12 ) , SUBSTR( CAST( ( LENGTH( SUBSTR( CAST( ( ROUND( LENGTH( SUBSTR( CAST( ( ROUND( 0 * 82 ) ) AS CHAR(100) ) , 1 , 12 ) ) - -10 ) ) AS CHAR(100) ) , 1 , 12 ) ) ) AS CHAR(100) ) , 1 , 12 ) ) ORDER BY pk LIMIT 2 , 1 /* RESULTSET_HAS_ZERO_OR_ONE_ROWS */;
col_char_12
SELECT 1 FROM table0_bigint WHERE col_bigint != ( SUBSTR( CAST( ( ROUND( 0 * 10 ) ) AS CHAR(100) ) , 1 , 12 ) ) AND col_bigint_key <= ( SUBSTR( CAST( ( ROUND( 99 - ROUND( -9 * 1 ) ) ) AS CHAR(100) ) , 1 , 12 ) ) FOR UPDATE;
1
SELECT UPPER( pk ) FROM table0_bigint WHERE col_bigint NOT IN ( -10 , 32 , -1 , 1 , -1 ) GROUP BY pk ORDER BY pk LIMIT 1;
UPPER( pk )
-100
UPDATE table0_bigint SET pk = SUBSTR( CAST( ( SIGN ( 10 ) ) AS CHAR(100) ) , 1 , 12 ) , col_bigint = 1 , col_char_12_key = 'SMYIR' WHERE col_bigint_key NOT IN ( 10 , 1 , 213 , 144 , 1 ) ORDER BY col_char_12_key , col_bigint_key , pk  LIMIT 180 ;
ERROR 23000: Duplicate entry '1' for key 'PRIMARY'
SELECT * FROM table0_bigint ORDER BY pk;
col_char_12_key	col_char_12	col_bigint_key	pk	col_bigint
-10	NULL	NULL	-100	-100
99	NULL	NULL	-10	NULL
139	NULL	NULL	-9	NULL
NULL	NULL	158	-1	NULL
NULL	NULL	158	0	NULL
2	NULL	NULL	1	NULL
NULL	NULL	158	4	NULL
-100	NULL	2	8	NULL
NULL	5	158	9	NULL
NULL	NULL	158	10	10
NULL	10	158	83	NULL
NULL	9	158	99	99
-10	NULL	NULL	154	NULL
SELECT col_bigint,col_bigint_key,col_char_12,col_char_12_key,pk FROM table0_bigint WHERE ( -315228160 ) IN ( SUBSTR( CAST( ( 10 ) AS CHAR(100) ) , 1 , 12 ) , SUBSTR( CAST( ( -9 ) AS CHAR(100) ) , 1 , 12 ) , SUBSTR( CAST( ( ROUND( -1 - -9 ) ) AS CHAR(100) ) , 1 , 12 ) , SUBSTR( CAST( ( 1 ) AS CHAR(100) ) , 1 , 12 ) , SUBSTR( CAST( ( CEIL ( LENGTH('MOVAO') ) ) AS CHAR(100) ) , 1 , 12 ) ) GROUP BY col_bigint,col_bigint_key,col_char_12,col_char_12_key,pk ORDER BY col_bigint,col_bigint_key,col_char_12,col_char_12_key,pk LIMIT 6 , 3;
col_bigint	col_bigint_key	col_char_12	col_char_12_key	pk
SELECT COUNT( col_bigint_key ) FROM table0_bigint WHERE col_char_12_key BETWEEN CAST( 1 AS CHAR(100) ) AND CAST( 7 AS CHAR(100) ) ORDER BY col_bigint_key  , pk ASC LIMIT 3 /* RESULTSET_HAS_ZERO_OR_ONE_ROWS */;
COUNT( col_bigint_key )
0
SELECT  1 , NULL , TRUE , FALSE , UPPER( col_bigint_key ) FROM table0_bigint ORDER BY col_char_12_key , col_char_12_key , pk ;
1	NULL	TRUE	FALSE	UPPER( col_bigint_key )
1	NULL	1	0	158
1	NULL	1	0	158
1	NULL	1	0	158
1	NULL	1	0	158
1	NULL	1	0	158
1	NULL	1	0	158
1	NULL	1	0	158
1	NULL	1	0	NULL
1	NULL	1	0	NULL
1	NULL	1	0	2
1	NULL	1	0	NULL
1	NULL	1	0	NULL
1	NULL	1	0	NULL
INSERT INTO table0_bigint ( pk , col_char_12_key ) VALUES ( 9 , SUBSTR( CAST( ( ROUND( LENGTH( SUBSTR( CAST( ( -10 ) AS CHAR(100) ) , 1 , 12 ) ) - 62 ) ) AS CHAR(100) ) , 1 , 12 ) ) ;
ERROR 23000: Duplicate entry '9' for key 'PRIMARY'
SELECT * FROM table0_bigint ORDER BY pk;
col_char_12_key	col_char_12	col_bigint_key	pk	col_bigint
-10	NULL	NULL	-100	-100
99	NULL	NULL	-10	NULL
139	NULL	NULL	-9	NULL
NULL	NULL	158	-1	NULL
NULL	NULL	158	0	NULL
2	NULL	NULL	1	NULL
NULL	NULL	158	4	NULL
-100	NULL	2	8	NULL
NULL	5	158	9	NULL
NULL	NULL	158	10	10
NULL	10	158	83	NULL
NULL	9	158	99	99
-10	NULL	NULL	154	NULL
SELECT COUNT( pk ) FROM table0_bigint WHERE col_bigint_key BETWEEN SUBSTR( CAST( ( SIGN ( -1 ) ) AS CHAR(100) ) , 1 , 12 ) AND SUBSTR( CAST( ( SIGN ( ROUND( 0 - 1 ) ) ) AS CHAR(100) ) , 1 , 12 ) ORDER BY col_bigint_key , pk ASC LIMIT 6 /* RESULTSET_HAS_ZERO_OR_ONE_ROWS */;
COUNT( pk )
0
UPDATE table0_bigint SET pk = LENGTH('MWVXL') , col_char_12 = SUBSTR(concat( CAST(col_bigint AS CHAR(100)) , SUBSTR( CAST( ( 4 ) AS CHAR(100) ) , 1 , 12 )) , 1 , 12 ) WHERE col_bigint BETWEEN SUBSTR( CAST( ( LENGTH('XNQHD') ) AS CHAR(100) ) , 1 , 12 ) AND SUBSTR( CAST( ( ROUND( 98 * 5 ) ) AS CHAR(100) ) , 1 , 12 ) ORDER BY col_bigint_key  , col_char_12 DESC , pk DESC LIMIT 2 ;
ERROR 23000: Duplicate entry '5' for key 'PRIMARY'
SELECT * FROM table0_bigint ORDER BY pk;
col_char_12_key	col_char_12	col_bigint_key	pk	col_bigint
-10	NULL	NULL	-100	-100
99	NULL	NULL	-10	NULL
139	NULL	NULL	-9	NULL
NULL	NULL	158	-1	NULL
NULL	NULL	158	0	NULL
2	NULL	NULL	1	NULL
NULL	NULL	158	4	NULL
-100	NULL	2	8	NULL
NULL	5	158	9	NULL
NULL	NULL	158	10	10
NULL	10	158	83	NULL
NULL	9	158	99	99
-10	NULL	NULL	154	NULL
SELECT  NULL , UPPER( col_bigint_key ) , TRUE , FALSE , 1 FROM table0_bigint ORDER BY col_bigint_key , col_char_12_key , col_bigint_key , pk ;
NULL	UPPER( col_bigint_key )	TRUE	FALSE	1
NULL	NULL	1	0	1
NULL	NULL	1	0	1
NULL	NULL	1	0	1
NULL	NULL	1	0	1
NULL	NULL	1	0	1
NULL	2	1	0	1
NULL	158	1	0	1
NULL	158	1	0	1
NULL	158	1	0	1
NULL	158	1	0	1
NULL	158	1	0	1
NULL	158	1	0	1
NULL	158	1	0	1
INSERT INTO table0_bigint ( pk , col_bigint_key, col_char_12_key ) VALUES ( -1 , SUBSTR( CAST( ( 242 ) AS CHAR(100) ) , 1 , 12 ) , SUBSTR( CAST( ( ROUND( 9 * 8 ) ) AS CHAR(100) ) , 1 , 12 ) ) ;
ERROR 23000: Duplicate entry '-1' for key 'PRIMARY'
SELECT * FROM table0_bigint ORDER BY pk;
col_char_12_key	col_char_12	col_bigint_key	pk	col_bigint
-10	NULL	NULL	-100	-100
99	NULL	NULL	-10	NULL
139	NULL	NULL	-9	NULL
NULL	NULL	158	-1	NULL
NULL	NULL	158	0	NULL
2	NULL	NULL	1	NULL
NULL	NULL	158	4	NULL
-100	NULL	2	8	NULL
NULL	5	158	9	NULL
NULL	NULL	158	10	10
NULL	10	158	83	NULL
NULL	9	158	99	99
-10	NULL	NULL	154	NULL
UPDATE table0_bigint SET col_char_12_key = col_char_12_key WHERE LENGTH('JAGQI') >= SUBSTR( CAST( ( 0 ) AS CHAR(100) ) , 1 , 12 ) ORDER BY col_bigint_key , pk ASC LIMIT 2 ;
SELECT * FROM table0_bigint ORDER BY pk;
col_char_12_key	col_char_12	col_bigint_key	pk	col_bigint
-10	NULL	NULL	-100	-100
99	NULL	NULL	-10	NULL
139	NULL	NULL	-9	NULL
NULL	NULL	158	-1	NULL
NULL	NULL	158	0	NULL
2	NULL	NULL	1	NULL
NULL	NULL	158	4	NULL
-100	NULL	2	8	NULL
NULL	5	158	9	NULL
NULL	NULL	158	10	10
NULL	10	158	83	NULL
NULL	9	158	99	99
-10	NULL	NULL	154	NULL
SELECT col_char_12_key FROM table0_bigint WHERE ( 1263992832 , 1630404608 , 1173356544 , -738787328 , -1503789056 ) NOT IN ( ( SUBSTR( CAST( ( ROUND( 2 + SIGN ( ROUND( 9 * SIGN ( -100 ) ) ) ) ) AS CHAR(100) ) , 1 , 12 ) , SUBSTR( CAST( ( LENGTH( SUBSTR( CAST( ( ROUND ( ABS ( LENGTH( SUBSTR( CAST( ( ROUND ( LENGTH('MHYPE') ) ) AS CHAR(100) ) , 1 , 12 ) ) ) ) ) AS CHAR(100) ) , 1 , 12 ) ) ) AS CHAR(100) ) , 1 , 12 ) , SUBSTR( CAST( ( ROUND( -100 * -100 ) ) AS CHAR(100) ) , 1 , 12 ) , SUBSTR( CAST( ( 0 ) AS CHAR(100) ) , 1 , 12 ) , SUBSTR( CAST( ( CEIL ( SIGN ( ROUND( 143 * 0 ) ) ) ) AS CHAR(100) ) , 1 , 12 ) ) ) ORDER BY pk LIMIT 5 , 1 /* RESULTSET_HAS_ZERO_OR_ONE_ROWS */;
col_char_12_key
2
SELECT UPPER( col_bigint_key ) FROM table0_bigint WHERE pk = ( SUBSTR( CAST( ( ROUND( -10 - -1 ) ) AS CHAR(100) ) , 1 , 12 ) ) GROUP BY col_bigint_key ORDER BY col_bigint_key LIMIT 4;
UPPER( col_bigint_key )
NULL
SELECT pk , col_bigint_key , col_char_12 FROM table0_bigint WHERE SUBSTR( CAST( ( ROUND( 144 * 198 ) ) AS CHAR(100) ) , 1 , 12 ) < 9 ORDER BY col_bigint_key , col_char_12_key , pk  LIMIT 8 , 1 /* RESULTSET_HAS_ZERO_OR_ONE_ROWS */;
pk	col_bigint_key	col_char_12
INSERT INTO table0_bigint ( pk , col_bigint_key ) VALUES ( 10 , SUBSTR( CAST( ( ROUND( -100 + ROUND( -9 * LENGTH( SUBSTR( CAST( ( ROUND( ROUND( 1 - 9 ) * 10 ) ) AS CHAR(100) ) , 1 , 12 ) ) ) ) ) AS CHAR(100) ) , 1 , 12 ) ) ;
ERROR 23000: Duplicate entry '10' for key 'PRIMARY'
SELECT * FROM table0_bigint ORDER BY pk;
col_char_12_key	col_char_12	col_bigint_key	pk	col_bigint
-10	NULL	NULL	-100	-100
99	NULL	NULL	-10	NULL
139	NULL	NULL	-9	NULL
NULL	NULL	158	-1	NULL
NULL	NULL	158	0	NULL
2	NULL	NULL	1	NULL
NULL	NULL	158	4	NULL
-100	NULL	2	8	NULL
NULL	5	158	9	NULL
NULL	NULL	158	10	10
NULL	10	158	83	NULL
NULL	9	158	99	99
-10	NULL	NULL	154	NULL
SELECT col_bigint FROM table0_bigint WHERE ROUND( ROUND( -1 * ROUND( LENGTH( SUBSTR( CAST( ( CEIL ( 0 ) ) AS CHAR(100) ) , 1 , 12 ) ) * 99 ) ) * 99 ) != LENGTH( SUBSTR( CAST( ( FLOOR ( 9 ) ) AS CHAR(100) ) , 1 , 12 ) ) ORDER BY col_bigint_key , col_bigint_key , pk  LIMIT 6 , 5;
col_bigint
NULL
NULL
NULL
NULL
10
INSERT INTO table0_bigint ( pk , col_char_12_key ) VALUES ( 4 , SUBSTR( CAST( ( ROUND( 1 * 157 ) ) AS CHAR(100) ) , 1 , 12 ) ) ;
ERROR 23000: Duplicate entry '4' for key 'PRIMARY'
SELECT * FROM table0_bigint ORDER BY pk;
col_char_12_key	col_char_12	col_bigint_key	pk	col_bigint
-10	NULL	NULL	-100	-100
99	NULL	NULL	-10	NULL
139	NULL	NULL	-9	NULL
NULL	NULL	158	-1	NULL
NULL	NULL	158	0	NULL
2	NULL	NULL	1	NULL
NULL	NULL	158	4	NULL
-100	NULL	2	8	NULL
NULL	5	158	9	NULL
NULL	NULL	158	10	10
NULL	10	158	83	NULL
NULL	9	158	99	99
-10	NULL	NULL	154	NULL
SELECT pk , col_char_12_key FROM table0_bigint WHERE NOT ( pk < SUBSTR( CAST( ( CEIL ( -100 ) ) AS CHAR(100) ) , 1 , 12 ) ) AND  ( col_bigint_key <= SUBSTR( CAST( ( SIGN ( 99 ) ) AS CHAR(100) ) , 1 , 12 ) ) AND NOT ( col_bigint > SUBSTR( CAST( ( LENGTH( SUBSTR( CAST( ( SIGN ( 0 ) ) AS CHAR(100) ) , 1 , 12 ) ) ) AS CHAR(100) ) , 1 , 12 ) ) AND NOT ( col_bigint_key <= SUBSTR( CAST( ( LENGTH('EUMZV') ) AS CHAR(100) ) , 1 , 12 ) ) ORDER BY col_char_12_key , col_char_12_key , pk  LIMIT 5;
pk	col_char_12_key
SELECT  FALSE FROM table0_bigint ORDER BY col_char_12_key , col_bigint_key , col_bigint_key , pk DESC;
FALSE
0
0
0
0
0
0
0
0
0
0
0
0
0
SELECT 1 FROM table0_bigint WHERE col_bigint_key BETWEEN CAST( 4 AS CHAR(100) ) AND CAST( 7 AS CHAR(100) ) FOR UPDATE;
1
SELECT col_bigint_key,pk FROM table0_bigint WHERE col_bigint_key BETWEEN SUBSTR( CAST( ( ROUND( 1 + 192 ) ) AS CHAR(100) ) , 1 , 12 ) AND SUBSTR( CAST( ( ROUND ( LENGTH( SUBSTR( CAST( ( ROUND( LENGTH('KTFLS') + 0 ) ) AS CHAR(100) ) , 1 , 12 ) ) ) ) AS CHAR(100) ) , 1 , 12 ) GROUP BY col_bigint_key,pk ORDER BY col_bigint_key,pk LIMIT 4 , 1;
col_bigint_key	pk
UPDATE table0_bigint SET pk = SUBSTR( CAST( ( LENGTH( SUBSTR( CAST( ( LENGTH('IAAHX') ) AS CHAR(100) ) , 1 , 12 ) ) ) AS CHAR(100) ) , 1 , 12 ) , col_bigint_key = SUBSTR( CAST( ( LENGTH( SUBSTR( CAST( ( LENGTH('KCWVY') ) AS CHAR(100) ) , 1 , 12 ) ) ) AS CHAR(100) ) , 1 , 12 ) , col_char_12 = SUBSTR( CAST( ( -100 ) AS CHAR(100) ) , 1 , 12 ) WHERE pk < ( SUBSTR( CAST( ( LENGTH( SUBSTR( CAST( ( ROUND( ROUND( -100 * ROUND( 99 + ROUND( LENGTH('TJPCM') * -100 ) ) ) - 12 ) ) AS CHAR(100) ) , 1 , 12 ) ) ) AS CHAR(100) ) , 1 , 12 ) ) ORDER BY col_char_12_key,pk  , pk  LIMIT 1 ;
ERROR 23000: Duplicate entry '1' for key 'PRIMARY'
SELECT * FROM table0_bigint ORDER BY pk;
col_char_12_key	col_char_12	col_bigint_key	pk	col_bigint
-10	NULL	NULL	-100	-100
99	NULL	NULL	-10	NULL
139	NULL	NULL	-9	NULL
NULL	NULL	158	-1	NULL
NULL	NULL	158	0	NULL
2	NULL	NULL	1	NULL
NULL	NULL	158	4	NULL
-100	NULL	2	8	NULL
NULL	5	158	9	NULL
NULL	NULL	158	10	10
NULL	10	158	83	NULL
NULL	9	158	99	99
-10	NULL	NULL	154	NULL
INSERT INTO table0_bigint ( pk , col_bigint_key ) VALUES ( 99, CAST( -10 AS CHAR(100)) ) , ( 0, CAST( -10 AS CHAR(100)) ) ;
ERROR 23000: Duplicate entry '99' for key 'PRIMARY'
SELECT * FROM table0_bigint ORDER BY pk;
col_char_12_key	col_char_12	col_bigint_key	pk	col_bigint
-10	NULL	NULL	-100	-100
99	NULL	NULL	-10	NULL
139	NULL	NULL	-9	NULL
NULL	NULL	158	-1	NULL
NULL	NULL	158	0	NULL
2	NULL	NULL	1	NULL
NULL	NULL	158	4	NULL
-100	NULL	2	8	NULL
NULL	5	158	9	NULL
NULL	NULL	158	10	10
NULL	10	158	83	NULL
NULL	9	158	99	99
-10	NULL	NULL	154	NULL
SELECT 1 FROM table0_bigint WHERE pk BETWEEN SUBSTR( CAST( ( ROUND( -100 - 0 ) ) AS CHAR(100) ) , 1 , 12 ) AND SUBSTR( CAST( ( LENGTH( SUBSTR( CAST( ( ROUND( 1 - 99 ) ) AS CHAR(100) ) , 1 , 12 ) ) ) AS CHAR(100) ) , 1 , 12 ) FOR UPDATE;
1
1
1
1
1
1
1
SELECT 1 FROM table0_bigint WHERE ( 741736448 , -1130496000 ) IN ( ( SUBSTR( CAST( ( ROUND( LENGTH( SUBSTR( CAST( ( CEIL ( ROUND( -100 * LENGTH('HKDDT') ) ) ) AS CHAR(100) ) , 1 , 12 ) ) + 74 ) ) AS CHAR(100) ) , 1 , 12 ) , SUBSTR( CAST( ( FLOOR ( 99 ) ) AS CHAR(100) ) , 1 , 12 ) ) , ( SUBSTR( CAST( ( ROUND( LENGTH( SUBSTR( CAST( ( 1 ) AS CHAR(100) ) , 1 , 12 ) ) + 0 ) ) AS CHAR(100) ) , 1 , 12 ) , SUBSTR( CAST( ( ROUND( ROUND( -100 - FLOOR ( 2 ) ) * 62 ) ) AS CHAR(100) ) , 1 , 12 ) ) ) FOR UPDATE;
1
SELECT COUNT( col_char_12 ) FROM table0_bigint WHERE ( 1233387520 , 1653407744 , -151519232 , 385155072 , 1837367296 ) IN ( ( SUBSTR( CAST( ( LENGTH( SUBSTR( CAST( ( ROUND( 8 - LENGTH( SUBSTR( CAST( ( ROUND( LENGTH('BESNW') + 10 ) ) AS CHAR(100) ) , 1 , 12 ) ) ) ) AS CHAR(100) ) , 1 , 12 ) ) ) AS CHAR(100) ) , 1 , 12 ) , SUBSTR( CAST( ( FLOOR ( 185 ) ) AS CHAR(100) ) , 1 , 12 ) , SUBSTR( CAST( ( ABS ( -10 ) ) AS CHAR(100) ) , 1 , 12 ) , SUBSTR( CAST( ( ROUND( ROUND( 228 + ROUND( 7 - ROUND( 10 - 234 ) ) ) * 2 ) ) AS CHAR(100) ) , 1 , 12 ) , SUBSTR( CAST( ( LENGTH( SUBSTR( CAST( ( 5 ) AS CHAR(100) ) , 1 , 12 ) ) ) AS CHAR(100) ) , 1 , 12 ) ) ) ORDER BY col_bigint DESC , col_char_12_key ASC , pk DESC LIMIT 2 , 4 /* RESULTSET_HAS_ZERO_OR_ONE_ROWS */;
COUNT( col_char_12 )
SELECT UPPER( col_bigint ) FROM table0_bigint WHERE col_bigint <= ABS ( CEIL ( 99 ) ) GROUP BY col_bigint ORDER BY col_bigint LIMIT 4;
UPPER( col_bigint )
-100
10
99
INSERT INTO table0_bigint ( pk , col_bigint_key, col_char_12_key ) VALUES ( -1 , SUBSTR( CAST( ( ROUND( 9 - 9 ) ) AS CHAR(100) ) , 1 , 12 ) , SUBSTR( CAST( ( ROUND ( 0 ) ) AS CHAR(100) ) , 1 , 12 ) ) ;
ERROR 23000: Duplicate entry '-1' for key 'PRIMARY'
SELECT * FROM table0_bigint ORDER BY pk;
col_char_12_key	col_char_12	col_bigint_key	pk	col_bigint
-10	NULL	NULL	-100	-100
99	NULL	NULL	-10	NULL
139	NULL	NULL	-9	NULL
NULL	NULL	158	-1	NULL
NULL	NULL	158	0	NULL
2	NULL	NULL	1	NULL
NULL	NULL	158	4	NULL
-100	NULL	2	8	NULL
NULL	5	158	9	NULL
NULL	NULL	158	10	10
NULL	10	158	83	NULL
NULL	9	158	99	99
-10	NULL	NULL	154	NULL
SELECT COUNT( pk ) FROM table0_bigint WHERE col_char_12 = ( SUBSTR( CAST( ( ROUND ( 9 ) ) AS CHAR(100) ) , 1 , 12 ) ) AND col_char_12_key = ( SUBSTR( CAST( ( ROUND( LENGTH('IWHIE') + 205 ) ) AS CHAR(100) ) , 1 , 12 ) ) ORDER BY pk LIMIT 8 /* RESULTSET_HAS_ZERO_OR_ONE_ROWS */;
COUNT( pk )
0
SELECT  UPPER( pk ) FROM table0_bigint WHERE col_bigint <> ( SUBSTR( CAST( ( CEIL ( 99 ) ) AS CHAR(100) ) , 1 , 12 ) ) AND col_bigint_key <= ( SUBSTR( CAST( ( CEIL ( LENGTH('KWPSS') ) ) AS CHAR(100) ) , 1 , 12 ) ) ORDER BY col_char_12_key , col_char_12_key , pk DESC;
UPPER( pk )
SELECT col_bigint,col_bigint_key,col_char_12,col_char_12_key,pk FROM table0_bigint WHERE col_bigint_key BETWEEN CAST( 3 AS CHAR(100) ) AND CAST( 7 AS CHAR(100) ) ORDER BY col_char_12_key , pk  LIMIT 1 /* RESULTSET_HAS_ZERO_OR_ONE_ROWS */;
col_bigint	col_bigint_key	col_char_12	col_char_12_key	pk
UPDATE table0_bigint SET pk = SUBSTR( CAST( ( LENGTH('URYZT') ) AS CHAR(100) ) , 1 , 12 ) , col_char_12 = SUBSTR(concat( CAST(col_bigint AS CHAR(100)) , SUBSTR( CAST( ( ROUND ( ROUND( 10 * 1 ) ) ) AS CHAR(100) ) , 1 , 12 ) ) , 1 , 12 ) WHERE pk <> ( SUBSTR( CAST( ( CEIL ( 99 ) ) AS CHAR(100) ) , 1 , 12 ) ) AND col_bigint >= ( SUBSTR( CAST( ( ROUND( -100 * 168 ) ) AS CHAR(100) ) , 1 , 12 ) ) ORDER BY col_char_12_key , pk  LIMIT 2 ;
ERROR 23000: Duplicate entry '5' for key 'PRIMARY'
SELECT * FROM table0_bigint ORDER BY pk;
col_char_12_key	col_char_12	col_bigint_key	pk	col_bigint
-10	NULL	NULL	-100	-100
99	NULL	NULL	-10	NULL
139	NULL	NULL	-9	NULL
NULL	NULL	158	-1	NULL
NULL	NULL	158	0	NULL
2	NULL	NULL	1	NULL
NULL	NULL	158	4	NULL
-100	NULL	2	8	NULL
NULL	5	158	9	NULL
NULL	NULL	158	10	10
NULL	10	158	83	NULL
NULL	9	158	99	99
-10	NULL	NULL	154	NULL
SELECT DISTINCT 9999 FROM table0_bigint ORDER BY col_bigint_key , col_bigint_key , col_bigint_key , pk DESC;
9999
9999
UPDATE table0_bigint SET pk = SUBSTR( CAST( ( ROUND( 1 + 9 ) ) AS CHAR(100) ) , 1 , 12 ) , col_bigint_key = SUBSTR( CAST( ( LENGTH( SUBSTR( CAST( ( -9 ) AS CHAR(100) ) , 1 , 12 ) ) ) AS CHAR(100) ) , 1 , 12 ) , col_char_12_key = SUBSTR( CAST( ( ROUND( LENGTH( SUBSTR( CAST( ( ROUND( LENGTH('DQWEY') - -1 ) ) AS CHAR(100) ) , 1 , 12 ) ) * -10 ) ) AS CHAR(100) ) , 1 , 12 ) WHERE ( -833224704 ) NOT IN ( SUBSTR( CAST( ( ROUND( 99 + CEIL ( 98 ) ) ) AS CHAR(100) ) , 1 , 12 ) , SUBSTR( CAST( ( ROUND( 9 * LENGTH('VKLUU') ) ) AS CHAR(100) ) , 1 , 12 ) , SUBSTR( CAST( ( SIGN ( LENGTH( SUBSTR( CAST( ( LENGTH('ARQER') ) AS CHAR(100) ) , 1 , 12 ) ) ) ) AS CHAR(100) ) , 1 , 12 ) , SUBSTR( CAST( ( ROUND( 4 + 0 ) ) AS CHAR(100) ) , 1 , 12 ) , SUBSTR( CAST( ( LENGTH('JNGDJ') ) AS CHAR(100) ) , 1 , 12 ) ) ORDER BY col_char_12_key , col_bigint_key , col_bigint_key , pk ASC LIMIT 1 ;
ERROR 23000: Duplicate entry '10' for key 'PRIMARY'
SELECT * FROM table0_bigint ORDER BY pk;
col_char_12_key	col_char_12	col_bigint_key	pk	col_bigint
-10	NULL	NULL	-100	-100
99	NULL	NULL	-10	NULL
139	NULL	NULL	-9	NULL
NULL	NULL	158	-1	NULL
NULL	NULL	158	0	NULL
2	NULL	NULL	1	NULL
NULL	NULL	158	4	NULL
-100	NULL	2	8	NULL
NULL	5	158	9	NULL
NULL	NULL	158	10	10
NULL	10	158	83	NULL
NULL	9	158	99	99
-10	NULL	NULL	154	NULL
UPDATE table0_bigint AS X SET X . col_bigint_key = CAST(-9 AS CHAR(100)) WHERE X . pk < SUBSTR( CAST( ( ROUND( 99 + ROUND( 99 * -9 ) ) ) AS CHAR(100) ) , 1 , 12 ) AND X . col_char_12 >= SUBSTR( CAST( ( LENGTH( SUBSTR( CAST( ( FLOOR ( 99 ) ) AS CHAR(100) ) , 1 , 12 ) ) ) AS CHAR(100) ) , 1 , 12 ) ORDER BY X . pk DESC ;
SELECT * FROM table0_bigint ORDER BY pk;
col_char_12_key	col_char_12	col_bigint_key	pk	col_bigint
-10	NULL	NULL	-100	-100
99	NULL	NULL	-10	NULL
139	NULL	NULL	-9	NULL
NULL	NULL	158	-1	NULL
NULL	NULL	158	0	NULL
2	NULL	NULL	1	NULL
NULL	NULL	158	4	NULL
-100	NULL	2	8	NULL
NULL	5	158	9	NULL
NULL	NULL	158	10	10
NULL	10	158	83	NULL
NULL	9	158	99	99
-10	NULL	NULL	154	NULL
INSERT INTO table0_bigint ( pk , col_char_12_key ) VALUES ( 10 , SUBSTR( CAST( ( LENGTH('CWBLN') ) AS CHAR(100) ) , 1 , 12 ) ) ;
ERROR 23000: Duplicate entry '10' for key 'PRIMARY'
SELECT * FROM table0_bigint ORDER BY pk;
col_char_12_key	col_char_12	col_bigint_key	pk	col_bigint
-10	NULL	NULL	-100	-100
99	NULL	NULL	-10	NULL
139	NULL	NULL	-9	NULL
NULL	NULL	158	-1	NULL
NULL	NULL	158	0	NULL
2	NULL	NULL	1	NULL
NULL	NULL	158	4	NULL
-100	NULL	2	8	NULL
NULL	5	158	9	NULL
NULL	NULL	158	10	10
NULL	10	158	83	NULL
NULL	9	158	99	99
-10	NULL	NULL	154	NULL
SELECT 1 FROM table0_bigint  FOR UPDATE;
1
1
1
1
1
1
1
1
1
1
1
1
1
1
UPDATE table0_bigint SET col_bigint = col_bigint_key WHERE col_char_12_key < CAST(-100 AS CHAR(100)) ORDER BY col_char_12_key , col_char_12_key , pk DESC LIMIT 7 ;
SELECT * FROM table0_bigint ORDER BY pk;
col_char_12_key	col_char_12	col_bigint_key	pk	col_bigint
-10	NULL	NULL	-100	NULL
99	NULL	NULL	-10	NULL
139	NULL	NULL	-9	NULL
NULL	NULL	158	-1	NULL
NULL	NULL	158	0	NULL
2	NULL	NULL	1	NULL
NULL	NULL	158	4	NULL
-100	NULL	2	8	NULL
NULL	5	158	9	NULL
NULL	NULL	158	10	10
NULL	10	158	83	NULL
NULL	9	158	99	99
-10	NULL	NULL	154	NULL
UPDATE table0_bigint SET pk = SUBSTR( CAST( ( 77 ) AS CHAR(100) ) , 1 , 12 ) WHERE col_bigint NOT IN ( SUBSTR( CAST( ( ROUND( -10 * FLOOR ( -9 ) ) ) AS CHAR(100) ) , 1 , 12 ) , SUBSTR( CAST( ( CEIL ( 100 ) ) AS CHAR(100) ) , 1 , 12 ) , SUBSTR( CAST( ( FLOOR ( 1 ) ) AS CHAR(100) ) , 1 , 12 ) , SUBSTR( CAST( ( 9 ) AS CHAR(100) ) , 1 , 12 ) , SUBSTR( CAST( ( FLOOR ( 0 ) ) AS CHAR(100) ) , 1 , 12 ) ) ORDER BY col_bigint_key DESC , col_char_12 DESC , pk ASC LIMIT 7 ;
ERROR 23000: Duplicate entry '77' for key 'PRIMARY'
SELECT * FROM table0_bigint ORDER BY pk;
col_char_12_key	col_char_12	col_bigint_key	pk	col_bigint
-10	NULL	NULL	-100	NULL
99	NULL	NULL	-10	NULL
139	NULL	NULL	-9	NULL
NULL	NULL	158	-1	NULL
NULL	NULL	158	0	NULL
2	NULL	NULL	1	NULL
NULL	NULL	158	4	NULL
-100	NULL	2	8	NULL
NULL	5	158	9	NULL
NULL	NULL	158	10	10
NULL	10	158	83	NULL
NULL	9	158	99	99
-10	NULL	NULL	154	NULL
SELECT DISTINCT 1 , NULL , TRUE , FALSE , UPPER( col_char_12 ) FROM table0_bigint ORDER BY col_bigint_key , col_char_12_key , pk ;
1	NULL	TRUE	FALSE	UPPER( col_char_12 )
1	NULL	1	0	NULL
1	NULL	1	0	5
1	NULL	1	0	10
1	NULL	1	0	9
UPDATE table0_bigint SET col_bigint_key = col_bigint_key WHERE ( -110034944 , -1583415296 , -1968832512 ) NOT IN ( ( SUBSTR( CAST( ( -100 ) AS CHAR(100) ) , 1 , 12 ) , SUBSTR( CAST( ( LENGTH( SUBSTR( CAST( ( ROUND( -100 - 0 ) ) AS CHAR(100) ) , 1 , 12 ) ) ) AS CHAR(100) ) , 1 , 12 ) , SUBSTR( CAST( ( ROUND( 10 + ROUND( ROUND( ROUND( ROUND( ROUND( LENGTH( SUBSTR( CAST( ( LENGTH('LDTDX') ) AS CHAR(100) ) , 1 , 12 ) ) + -9 ) + -100 ) - 10 ) + -100 ) - 31 ) ) ) AS CHAR(100) ) , 1 , 12 ) ) , ( SUBSTR( CAST( ( LENGTH('EFRSI') ) AS CHAR(100) ) , 1 , 12 ) , SUBSTR( CAST( ( -100 ) AS CHAR(100) ) , 1 , 12 ) , SUBSTR( CAST( ( ROUND( LENGTH( SUBSTR( CAST( ( ABS ( 1 ) ) AS CHAR(100) ) , 1 , 12 ) ) - 10 ) ) AS CHAR(100) ) , 1 , 12 ) ) ) ORDER BY col_bigint_key , col_bigint_key , col_bigint_key , pk DESC LIMIT 8 ;
SELECT * FROM table0_bigint ORDER BY pk;
col_char_12_key	col_char_12	col_bigint_key	pk	col_bigint
-10	NULL	NULL	-100	NULL
99	NULL	NULL	-10	NULL
139	NULL	NULL	-9	NULL
NULL	NULL	158	-1	NULL
NULL	NULL	158	0	NULL
2	NULL	NULL	1	NULL
NULL	NULL	158	4	NULL
-100	NULL	2	8	NULL
NULL	5	158	9	NULL
NULL	NULL	158	10	10
NULL	10	158	83	NULL
NULL	9	158	99	99
-10	NULL	NULL	154	NULL
SELECT * FROM table0_bigint WHERE ( -1762656256 , 1789526016 , -1195245568 ) IN ( ( SUBSTR( CAST( ( CEIL ( -10 ) ) AS CHAR(100) ) , 1 , 12 ) , SUBSTR( CAST( ( FLOOR ( -10 ) ) AS CHAR(100) ) , 1 , 12 ) , SUBSTR( CAST( ( ROUND( 9 * ROUND( 10 + 246 ) ) ) AS CHAR(100) ) , 1 , 12 ) ) , ( SUBSTR( CAST( ( LENGTH('GCSWI') ) AS CHAR(100) ) , 1 , 12 ) , SUBSTR( CAST( ( ROUND( LENGTH( SUBSTR( CAST( ( ROUND ( -100 ) ) AS CHAR(100) ) , 1 , 12 ) ) - 10 ) ) AS CHAR(100) ) , 1 , 12 ) , SUBSTR( CAST( ( ROUND( -1 - ROUND( -1 - ROUND( ABS ( 0 ) - 99 ) ) ) ) AS CHAR(100) ) , 1 , 12 ) ) ) ORDER BY pk LIMIT 8 , 8;
col_char_12_key	col_char_12	col_bigint_key	pk	col_bigint
UPDATE table0_bigint SET col_char_12_key = col_char_12_key WHERE FLOOR ( ROUND( -10 * ROUND ( 0 ) ) ) >= ROUND( 2 - SIGN ( -100 ) ) ORDER BY pk LIMIT 2 ;
SELECT * FROM table0_bigint ORDER BY pk;
col_char_12_key	col_char_12	col_bigint_key	pk	col_bigint
-10	NULL	NULL	-100	NULL
99	NULL	NULL	-10	NULL
139	NULL	NULL	-9	NULL
NULL	NULL	158	-1	NULL
NULL	NULL	158	0	NULL
2	NULL	NULL	1	NULL
NULL	NULL	158	4	NULL
-100	NULL	2	8	NULL
NULL	5	158	9	NULL
NULL	NULL	158	10	10
NULL	10	158	83	NULL
NULL	9	158	99	99
-10	NULL	NULL	154	NULL
SELECT 1 FROM table0_bigint WHERE pk IN ( SUBSTR( CAST( ( LENGTH('AIVUT') ) AS CHAR(100) ) , 1 , 12 ) , SUBSTR( CAST( ( ROUND( 99 + 9 ) ) AS CHAR(100) ) , 1 , 12 ) , SUBSTR( CAST( ( LENGTH('SYOCB') ) AS CHAR(100) ) , 1 , 12 ) , SUBSTR( CAST( ( LENGTH( SUBSTR( CAST( ( ROUND( LENGTH('SYNER') + -9 ) ) AS CHAR(100) ) , 1 , 12 ) ) ) AS CHAR(100) ) , 1 , 12 ) , SUBSTR( CAST( ( ROUND( 99 * 99 ) ) AS CHAR(100) ) , 1 , 12 ) ) FOR UPDATE;
1
SELECT col_char_12_key FROM table0_bigint WHERE pk < ( SUBSTR( CAST( ( LENGTH('RZEBY') ) AS CHAR(100) ) , 1 , 12 ) ) ORDER BY col_bigint_key , pk  LIMIT 5 , 1 /* RESULTSET_HAS_ZERO_OR_ONE_ROWS */;
col_char_12_key
NULL
SELECT COUNT( pk ) FROM table0_bigint WHERE col_char_12_key IN ( SUBSTR( CAST( ( ABS ( -1 ) ) AS CHAR(100) ) , 1 , 12 ) , SUBSTR( CAST( ( LENGTH('UDLVX') ) AS CHAR(100) ) , 1 , 12 ) , SUBSTR( CAST( ( LENGTH( SUBSTR( CAST( ( SIGN ( -9 ) ) AS CHAR(100) ) , 1 , 12 ) ) ) AS CHAR(100) ) , 1 , 12 ) , SUBSTR( CAST( ( CEIL ( 0 ) ) AS CHAR(100) ) , 1 , 12 ) , SUBSTR( CAST( ( ROUND ( FLOOR ( FLOOR ( 1 ) ) ) ) AS CHAR(100) ) , 1 , 12 ) ) ORDER BY pk LIMIT 8 , 1 /* RESULTSET_HAS_ZERO_OR_ONE_ROWS */;
COUNT( pk )
SELECT col_bigint,col_bigint_key,col_char_12,col_char_12_key,pk FROM table0_bigint WHERE ROUND ( FLOOR ( 8 ) ) < LENGTH( SUBSTR( CAST( ( FLOOR ( LENGTH( SUBSTR( CAST( ( -10 ) AS CHAR(100) ) , 1 , 12 ) ) ) ) AS CHAR(100) ) , 1 , 12 ) ) GROUP BY col_bigint,col_bigint_key,col_char_12,col_char_12_key,pk ORDER BY col_bigint,col_bigint_key,col_char_12,col_char_12_key,pk LIMIT 7;
col_bigint	col_bigint_key	col_char_12	col_char_12_key	pk
SELECT ALL NULL , pk , TRUE , col_bigint_key , FALSE , 1 FROM table0_bigint ORDER BY pk;
NULL	pk	TRUE	col_bigint_key	FALSE	1
NULL	-100	1	NULL	0	1
NULL	-10	1	NULL	0	1
NULL	-9	1	NULL	0	1
NULL	-1	1	158	0	1
NULL	0	1	158	0	1
NULL	1	1	NULL	0	1
NULL	4	1	158	0	1
NULL	8	1	2	0	1
NULL	9	1	158	0	1
NULL	10	1	158	0	1
NULL	83	1	158	0	1
NULL	99	1	158	0	1
NULL	154	1	NULL	0	1
INSERT INTO table0_bigint (pk) VALUES ( 9 ) ;
ERROR 23000: Duplicate entry '9' for key 'PRIMARY'
SELECT * FROM table0_bigint ORDER BY pk;
col_char_12_key	col_char_12	col_bigint_key	pk	col_bigint
-10	NULL	NULL	-100	NULL
99	NULL	NULL	-10	NULL
139	NULL	NULL	-9	NULL
NULL	NULL	158	-1	NULL
NULL	NULL	158	0	NULL
2	NULL	NULL	1	NULL
NULL	NULL	158	4	NULL
-100	NULL	2	8	NULL
NULL	5	158	9	NULL
NULL	NULL	158	10	10
NULL	10	158	83	NULL
NULL	9	158	99	99
-10	NULL	NULL	154	NULL
SELECT pk , col_bigint_key , col_char_12 FROM table0_bigint WHERE col_char_12 BETWEEN SUBSTR( CAST( ( ROUND( FLOOR ( ROUND( 1 - ROUND( -100 + -1 ) ) ) - 215 ) ) AS CHAR(100) ) , 1 , 12 ) AND SUBSTR( CAST( ( ROUND( -1 * 116 ) ) AS CHAR(100) ) , 1 , 12 ) ORDER BY col_bigint_key , pk ASC LIMIT 1 /* RESULTSET_HAS_ZERO_OR_ONE_ROWS */;
pk	col_bigint_key	col_char_12
SELECT UPPER( col_bigint_key ),pk FROM table0_bigint WHERE ( -513605632 , 533463040 , -905838592 ) NOT IN ( ( SUBSTR( CAST( ( ROUND( 0 - 174 ) ) AS CHAR(100) ) , 1 , 12 ) , SUBSTR( CAST( ( ROUND ( ROUND( 9 - 99 ) ) ) AS CHAR(100) ) , 1 , 12 ) , SUBSTR( CAST( ( ROUND( 99 * ROUND( 133 + 252 ) ) ) AS CHAR(100) ) , 1 , 12 ) ) , ( SUBSTR( CAST( ( LENGTH( SUBSTR( CAST( ( ROUND( 242 * LENGTH( SUBSTR( CAST( ( CEIL ( 99 ) ) AS CHAR(100) ) , 1 , 12 ) ) ) ) AS CHAR(100) ) , 1 , 12 ) ) ) AS CHAR(100) ) , 1 , 12 ) , SUBSTR( CAST( ( ROUND( -10 + ABS ( -9 ) ) ) AS CHAR(100) ) , 1 , 12 ) , SUBSTR( CAST( ( LENGTH( SUBSTR( CAST( ( ROUND( -1 - ABS ( ABS ( ROUND( LENGTH( SUBSTR( CAST( ( CEIL ( 99 ) ) AS CHAR(100) ) , 1 , 12 ) ) - 6 ) ) ) ) ) AS CHAR(100) ) , 1 , 12 ) ) ) AS CHAR(100) ) , 1 , 12 ) ) ) GROUP BY col_bigint_key,pk ORDER BY col_bigint_key,pk LIMIT 9 , 4;
UPPER( col_bigint_key )	pk
158	9
158	10
158	83
158	99
SELECT 1 FROM table0_bigint WHERE SUBSTR( CAST( ( LENGTH( SUBSTR( CAST( ( ROUND( -100 + ROUND( -10 + 100 ) ) ) AS CHAR(100) ) , 1 , 12 ) ) ) AS CHAR(100) ) , 1 , 12 ) != LENGTH('PQZVR') FOR UPDATE;
1
1
1
1
1
1
1
1
1
1
1
1
1
1
UPDATE table0_bigint SET col_char_12_key = col_char_12_key WHERE ROUND( -100 * 1 ) <> LENGTH( SUBSTR( CAST( ( FLOOR ( -9 ) ) AS CHAR(100) ) , 1 , 12 ) ) ORDER BY pk LIMIT 2 ;
SELECT * FROM table0_bigint ORDER BY pk;
col_char_12_key	col_char_12	col_bigint_key	pk	col_bigint
-10	NULL	NULL	-100	NULL
99	NULL	NULL	-10	NULL
139	NULL	NULL	-9	NULL
NULL	NULL	158	-1	NULL
NULL	NULL	158	0	NULL
2	NULL	NULL	1	NULL
NULL	NULL	158	4	NULL
-100	NULL	2	8	NULL
NULL	5	158	9	NULL
NULL	NULL	158	10	10
NULL	10	158	83	NULL
NULL	9	158	99	99
-10	NULL	NULL	154	NULL
SELECT * FROM table0_bigint WHERE col_bigint_key NOT IN ( 10 , 237 , 0 , 110 , 1 ) ORDER BY col_char_12_key , col_char_12_key , col_bigint_key , pk  LIMIT 8;
col_char_12_key	col_char_12	col_bigint_key	pk	col_bigint
NULL	NULL	158	-1	NULL
NULL	NULL	158	0	NULL
NULL	NULL	158	4	NULL
NULL	5	158	9	NULL
NULL	NULL	158	10	10
NULL	10	158	83	NULL
NULL	9	158	99	99
-100	NULL	2	8	NULL
SELECT 1 FROM table0_bigint WHERE col_char_12_key IN ( CAST(9 AS CHAR(100)) , CAST(-1 AS CHAR(100)) , CAST(1 AS CHAR(100)) ) FOR UPDATE;
1
SELECT 1 FROM table0_bigint  FOR UPDATE;
1
1
1
1
1
1
1
1
1
1
1
1
1
1
SELECT  1 FROM table0_bigint ORDER BY col_char_12_key , col_bigint_key , pk ;
1
1
1
1
1
1
1
1
1
1
1
1
1
1
SELECT * FROM table0_bigint WHERE LENGTH('SCKQO') < col_bigint_key ORDER BY col_bigint_key , pk  LIMIT 5;
col_char_12_key	col_char_12	col_bigint_key	pk	col_bigint
NULL	NULL	158	-1	NULL
NULL	NULL	158	0	NULL
NULL	NULL	158	4	NULL
NULL	5	158	9	NULL
NULL	NULL	158	10	10
INSERT INTO table0_bigint (pk) VALUES ( 9 ) ;
ERROR 23000: Duplicate entry '9' for key 'PRIMARY'
SELECT * FROM table0_bigint ORDER BY pk;
col_char_12_key	col_char_12	col_bigint_key	pk	col_bigint
-10	NULL	NULL	-100	NULL
99	NULL	NULL	-10	NULL
139	NULL	NULL	-9	NULL
NULL	NULL	158	-1	NULL
NULL	NULL	158	0	NULL
2	NULL	NULL	1	NULL
NULL	NULL	158	4	NULL
-100	NULL	2	8	NULL
NULL	5	158	9	NULL
NULL	NULL	158	10	10
NULL	10	158	83	NULL
NULL	9	158	99	99
-10	NULL	NULL	154	NULL
INSERT INTO table0_bigint ( pk , col_char_12_key ) VALUES ( -100 , SUBSTR( CAST( ( LENGTH('ZOIBV') ) AS CHAR(100) ) , 1 , 12 ) ) ;
ERROR 23000: Duplicate entry '-100' for key 'PRIMARY'
SELECT * FROM table0_bigint ORDER BY pk;
col_char_12_key	col_char_12	col_bigint_key	pk	col_bigint
-10	NULL	NULL	-100	NULL
99	NULL	NULL	-10	NULL
139	NULL	NULL	-9	NULL
NULL	NULL	158	-1	NULL
NULL	NULL	158	0	NULL
2	NULL	NULL	1	NULL
NULL	NULL	158	4	NULL
-100	NULL	2	8	NULL
NULL	5	158	9	NULL
NULL	NULL	158	10	10
NULL	10	158	83	NULL
NULL	9	158	99	99
-10	NULL	NULL	154	NULL
INSERT INTO table0_bigint ( pk , col_bigint, col_char_12 ) VALUES ( 99 , SUBSTR( CAST( ( LENGTH( SUBSTR( CAST( ( ROUND( 121 * ROUND ( 5 ) ) ) AS CHAR(100) ) , 1 , 12 ) ) ) AS CHAR(100) ) , 1 , 12 ) , SUBSTR( CAST( ( LENGTH( SUBSTR( CAST( ( ROUND ( -1 ) ) AS CHAR(100) ) , 1 , 12 ) ) ) AS CHAR(100) ) , 1 , 12 ) ) ;
ERROR 23000: Duplicate entry '99' for key 'PRIMARY'
SELECT * FROM table0_bigint ORDER BY pk;
col_char_12_key	col_char_12	col_bigint_key	pk	col_bigint
-10	NULL	NULL	-100	NULL
99	NULL	NULL	-10	NULL
139	NULL	NULL	-9	NULL
NULL	NULL	158	-1	NULL
NULL	NULL	158	0	NULL
2	NULL	NULL	1	NULL
NULL	NULL	158	4	NULL
-100	NULL	2	8	NULL
NULL	5	158	9	NULL
NULL	NULL	158	10	10
NULL	10	158	83	NULL
NULL	9	158	99	99
-10	NULL	NULL	154	NULL
SELECT * FROM table0_bigint WHERE ROUND ( ROUND( 10 * 99 ) ) >= 9 ORDER BY col_char_12_key , pk DESC LIMIT 3 , 2;
col_char_12_key	col_char_12	col_bigint_key	pk	col_bigint
NULL	5	158	9	NULL
NULL	NULL	158	4	NULL
SELECT ALL col_bigint,col_bigint_key,col_char_12,col_char_12_key,pk FROM table0_bigint ORDER BY col_bigint,col_bigint_key,col_char_12,col_char_12_key,pk,pk  , pk DESC;
col_bigint	col_bigint_key	col_char_12	col_char_12_key	pk
NULL	NULL	NULL	-10	-100
NULL	NULL	NULL	-10	154
NULL	NULL	NULL	139	-9
NULL	NULL	NULL	2	1
NULL	NULL	NULL	99	-10
NULL	2	NULL	-100	8
NULL	158	NULL	NULL	-1
NULL	158	NULL	NULL	0
NULL	158	NULL	NULL	4
NULL	158	10	NULL	83
NULL	158	5	NULL	9
10	158	NULL	NULL	10
99	158	9	NULL	99
SELECT pk FROM table0_bigint WHERE pk = ( SUBSTR( CAST( ( ROUND( 88 + LENGTH('BWRDK') ) ) AS CHAR(100) ) , 1 , 12 ) ) ORDER BY pk ASC , pk DESC LIMIT 1 , 1 /* RESULTSET_HAS_ZERO_OR_ONE_ROWS */;
pk
SELECT * FROM table0_bigint WHERE ( -1422983168 , 1369178112 ) NOT IN ( ( SUBSTR( CAST( ( ROUND( 1 - 9 ) ) AS CHAR(100) ) , 1 , 12 ) , SUBSTR( CAST( ( LENGTH( SUBSTR( CAST( ( FLOOR ( LENGTH( SUBSTR( CAST( ( 1 ) AS CHAR(100) ) , 1 , 12 ) ) ) ) AS CHAR(100) ) , 1 , 12 ) ) ) AS CHAR(100) ) , 1 , 12 ) ) , ( SUBSTR( CAST( ( ABS ( 0 ) ) AS CHAR(100) ) , 1 , 12 ) , SUBSTR( CAST( ( ROUND( 107 - 9 ) ) AS CHAR(100) ) , 1 , 12 ) ) ) ORDER BY pk LIMIT 1 /* RESULTSET_HAS_ZERO_OR_ONE_ROWS */;
col_char_12_key	col_char_12	col_bigint_key	pk	col_bigint
-10	NULL	NULL	-100	NULL
SELECT * FROM table0_bigint WHERE CEIL ( 0 ) = ROUND( -100 + ROUND( 99 + LENGTH( SUBSTR( CAST( ( SIGN ( ROUND( 1 + -9 ) ) ) AS CHAR(100) ) , 1 , 12 ) ) ) ) ORDER BY col_char_12 DESC , pk ASC LIMIT 4 , 3;
col_char_12_key	col_char_12	col_bigint_key	pk	col_bigint
SELECT UPPER( col_bigint ) FROM table0_bigint WHERE pk BETWEEN SUBSTR( CAST( ( LENGTH('XIVUF') ) AS CHAR(100) ) , 1 , 12 ) AND SUBSTR( CAST( ( LENGTH('JJUTH') ) AS CHAR(100) ) , 1 , 12 ) GROUP BY col_bigint ORDER BY col_bigint LIMIT 44 , 1 /* RESULTSET_HAS_ZERO_OR_ONE_ROWS */;
UPPER( col_bigint )
SELECT 1 FROM table0_bigint WHERE col_bigint NOT IN ( 0 , 99 , 1 , 0 , -1 ) FOR UPDATE;
1
1
SELECT ALL NULL , pk , TRUE , col_char_12_key , FALSE , 1 FROM table0_bigint ORDER BY col_char_12 DESC , pk ASC;
NULL	pk	TRUE	col_char_12_key	FALSE	1
NULL	99	1	NULL	0	1
NULL	9	1	NULL	0	1
NULL	83	1	NULL	0	1
NULL	-100	1	-10	0	1
NULL	-10	1	99	0	1
NULL	-9	1	139	0	1
NULL	-1	1	NULL	0	1
NULL	0	1	NULL	0	1
NULL	1	1	2	0	1
NULL	4	1	NULL	0	1
NULL	8	1	-100	0	1
NULL	10	1	NULL	0	1
NULL	154	1	-10	0	1
SELECT UPPER( col_char_12_key ),pk FROM table0_bigint WHERE pk >= ( SUBSTR( CAST( ( ROUND ( 9 ) ) AS CHAR(100) ) , 1 , 12 ) ) GROUP BY col_char_12_key,pk ORDER BY col_char_12_key,pk LIMIT 5;
UPPER( col_char_12_key )	pk
NULL	9
NULL	10
NULL	83
NULL	99
-10	154
SELECT 1 FROM table0_bigint WHERE -100 <> ROUND ( ROUND( 7 + CEIL ( ROUND( 1 + -100 ) ) ) ) FOR UPDATE;
1
1
1
1
1
1
1
1
1
1
1
1
1
1
SELECT col_bigint_key,pk FROM table0_bigint WHERE ( 1643773952 , -1831075840 , -1364393984 ) IN ( ( SUBSTR( CAST( ( LENGTH('HKHVX') ) AS CHAR(100) ) , 1 , 12 ) , SUBSTR( CAST( ( ROUND( -9 * 9 ) ) AS CHAR(100) ) , 1 , 12 ) , SUBSTR( CAST( ( ROUND( ROUND ( ABS ( 3 ) ) * -100 ) ) AS CHAR(100) ) , 1 , 12 ) ) , ( SUBSTR( CAST( ( 10 ) AS CHAR(100) ) , 1 , 12 ) , SUBSTR( CAST( ( LENGTH( SUBSTR( CAST( ( ABS ( ROUND ( 9 ) ) ) AS CHAR(100) ) , 1 , 12 ) ) ) AS CHAR(100) ) , 1 , 12 ) , SUBSTR( CAST( ( ROUND( 99 * ROUND( -9 + 0 ) ) ) AS CHAR(100) ) , 1 , 12 ) ) ) GROUP BY col_bigint_key,pk ORDER BY col_bigint_key,pk LIMIT 1;
col_bigint_key	pk
SELECT * FROM table0_bigint WHERE pk != ( SUBSTR( CAST( ( ROUND( -9 * 96 ) ) AS CHAR(100) ) , 1 , 12 ) ) ORDER BY pk LIMIT 8;
col_char_12_key	col_char_12	col_bigint_key	pk	col_bigint
-10	NULL	NULL	-100	NULL
99	NULL	NULL	-10	NULL
139	NULL	NULL	-9	NULL
NULL	NULL	158	-1	NULL
NULL	NULL	158	0	NULL
2	NULL	NULL	1	NULL
NULL	NULL	158	4	NULL
-100	NULL	2	8	NULL
SELECT COUNT( col_bigint_key ) FROM table0_bigint WHERE ( -611385344 , 1241645056 , -1209335808 , 1128005632 , -1157627904 ) IN ( ( SUBSTR( CAST( ( CEIL ( LENGTH( SUBSTR( CAST( ( 0 ) AS CHAR(100) ) , 1 , 12 ) ) ) ) AS CHAR(100) ) , 1 , 12 ) , SUBSTR( CAST( ( LENGTH( SUBSTR( CAST( ( ROUND( -1 + LENGTH('ONJLU') ) ) AS CHAR(100) ) , 1 , 12 ) ) ) AS CHAR(100) ) , 1 , 12 ) , SUBSTR( CAST( ( ROUND( 0 - 99 ) ) AS CHAR(100) ) , 1 , 12 ) , SUBSTR( CAST( ( 99 ) AS CHAR(100) ) , 1 , 12 ) , SUBSTR( CAST( ( LENGTH( SUBSTR( CAST( ( 9 ) AS CHAR(100) ) , 1 , 12 ) ) ) AS CHAR(100) ) , 1 , 12 ) ) ) ORDER BY col_bigint_key , col_bigint_key , pk  LIMIT 2 , 2 /* RESULTSET_HAS_ZERO_OR_ONE_ROWS */;
COUNT( col_bigint_key )
SELECT  9999 FROM table0_bigint ORDER BY pk;
9999
9999
9999
9999
9999
9999
9999
9999
9999
9999
9999
9999
9999
9999
UPDATE table0_bigint SET col_bigint = pk WHERE pk BETWEEN SUBSTR( CAST( ( LENGTH('UFBDU') ) AS CHAR(100) ) , 1 , 12 ) AND SUBSTR( CAST( ( ROUND( 10 + LENGTH( SUBSTR( CAST( ( ROUND( -1 + -10 ) ) AS CHAR(100) ) , 1 , 12 ) ) ) ) AS CHAR(100) ) , 1 , 12 ) ORDER BY col_bigint_key , pk ASC LIMIT 143 ;
SELECT * FROM table0_bigint ORDER BY pk;
col_char_12_key	col_char_12	col_bigint_key	pk	col_bigint
-10	NULL	NULL	-100	NULL
99	NULL	NULL	-10	NULL
139	NULL	NULL	-9	NULL
NULL	NULL	158	-1	NULL
NULL	NULL	158	0	NULL
2	NULL	NULL	1	NULL
NULL	NULL	158	4	NULL
-100	NULL	2	8	8
NULL	5	158	9	9
NULL	NULL	158	10	10
NULL	10	158	83	NULL
NULL	9	158	99	99
-10	NULL	NULL	154	NULL
SELECT UPPER( col_bigint_key ),pk FROM table0_bigint WHERE col_char_12_key BETWEEN CAST( 3 AS CHAR(100) ) AND CAST( 6 AS CHAR(100) ) GROUP BY col_bigint_key,pk ORDER BY col_bigint_key,pk LIMIT 4 , 3;
UPPER( col_bigint_key )	pk
UPDATE table0_bigint SET pk = SUBSTR( CAST( ( 5 ) AS CHAR(100) ) , 1 , 12 ) , col_bigint = SUBSTR( CAST( ( LENGTH( SUBSTR( CAST( ( ROUND( 7 - 7 ) ) AS CHAR(100) ) , 1 , 12 ) ) ) AS CHAR(100) ) , 1 , 12 ) , col_char_12_key = SUBSTR( CAST( ( CEIL ( 172 ) ) AS CHAR(100) ) , 1 , 12 ) WHERE ( -485621760 , 1310326784 ) NOT IN ( ( SUBSTR( CAST( ( LENGTH( SUBSTR( CAST( ( ROUND( LENGTH('POPTP') + 10 ) ) AS CHAR(100) ) , 1 , 12 ) ) ) AS CHAR(100) ) , 1 , 12 ) , SUBSTR( CAST( ( ABS ( 8 ) ) AS CHAR(100) ) , 1 , 12 ) ) , ( SUBSTR( CAST( ( LENGTH( SUBSTR( CAST( ( ROUND( -9 + ROUND( 9 + -1 ) ) ) AS CHAR(100) ) , 1 , 12 ) ) ) AS CHAR(100) ) , 1 , 12 ) , SUBSTR( CAST( ( ROUND( 0 * -1 ) ) AS CHAR(100) ) , 1 , 12 ) ) ) ORDER BY pk LIMIT 4 ;
ERROR 23000: Duplicate entry '5' for key 'PRIMARY'
SELECT * FROM table0_bigint ORDER BY pk;
col_char_12_key	col_char_12	col_bigint_key	pk	col_bigint
-10	NULL	NULL	-100	NULL
99	NULL	NULL	-10	NULL
139	NULL	NULL	-9	NULL
NULL	NULL	158	-1	NULL
NULL	NULL	158	0	NULL
2	NULL	NULL	1	NULL
NULL	NULL	158	4	NULL
-100	NULL	2	8	8
NULL	5	158	9	9
NULL	NULL	158	10	10
NULL	10	158	83	NULL
NULL	9	158	99	99
-10	NULL	NULL	154	NULL
SELECT  NULL , UPPER( col_char_12_key ) , TRUE , FALSE , 1 FROM table0_bigint ORDER BY col_bigint  , col_char_12_key  , pk ASC;
NULL	UPPER( col_char_12_key )	TRUE	FALSE	1
NULL	NULL	1	0	1
NULL	NULL	1	0	1
NULL	NULL	1	0	1
NULL	NULL	1	0	1
NULL	-10	1	0	1
NULL	-10	1	0	1
NULL	139	1	0	1
NULL	2	1	0	1
NULL	99	1	0	1
NULL	-100	1	0	1
NULL	NULL	1	0	1
NULL	NULL	1	0	1
NULL	NULL	1	0	1
INSERT INTO table0_bigint (pk) VALUES ( -100 ) ;
ERROR 23000: Duplicate entry '-100' for key 'PRIMARY'
SELECT * FROM table0_bigint ORDER BY pk;
col_char_12_key	col_char_12	col_bigint_key	pk	col_bigint
-10	NULL	NULL	-100	NULL
99	NULL	NULL	-10	NULL
139	NULL	NULL	-9	NULL
NULL	NULL	158	-1	NULL
NULL	NULL	158	0	NULL
2	NULL	NULL	1	NULL
NULL	NULL	158	4	NULL
-100	NULL	2	8	8
NULL	5	158	9	9
NULL	NULL	158	10	10
NULL	10	158	83	NULL
NULL	9	158	99	99
-10	NULL	NULL	154	NULL
SELECT ALL 1 FROM table0_bigint ORDER BY col_bigint_key , pk DESC;
1
1
1
1
1
1
1
1
1
1
1
1
1
1
INSERT INTO table0_bigint ( pk , col_bigint_key ) VALUES ( -1 , SUBSTR( CAST( ( SIGN ( 10 ) ) AS CHAR(100) ) , 1 , 12 ) ) ;
ERROR 23000: Duplicate entry '-1' for key 'PRIMARY'
SELECT * FROM table0_bigint ORDER BY pk;
col_char_12_key	col_char_12	col_bigint_key	pk	col_bigint
-10	NULL	NULL	-100	NULL
99	NULL	NULL	-10	NULL
139	NULL	NULL	-9	NULL
NULL	NULL	158	-1	NULL
NULL	NULL	158	0	NULL
2	NULL	NULL	1	NULL
NULL	NULL	158	4	NULL
-100	NULL	2	8	8
NULL	5	158	9	9
NULL	NULL	158	10	10
NULL	10	158	83	NULL
NULL	9	158	99	99
-10	NULL	NULL	154	NULL
SELECT 1 FROM table0_bigint WHERE FLOOR ( 7 ) >= FLOOR ( LENGTH( SUBSTR( CAST( ( ROUND( 0 * ROUND( LENGTH('PUMBM') * 1 ) ) ) AS CHAR(100) ) , 1 , 12 ) ) ) FOR UPDATE;
1
1
1
1
1
1
1
1
1
1
1
1
1
1
SELECT UPPER( pk ) FROM table0_bigint WHERE col_bigint_key NOT IN ( -9 , 9 , 0 , -100 , 9 ) GROUP BY pk ORDER BY pk LIMIT 7;
UPPER( pk )
-1
0
4
8
9
10
83
SELECT 1 FROM table0_bigint WHERE pk > ( SUBSTR( CAST( ( ROUND( ROUND( -100 - ROUND( CEIL ( 9 ) * 2 ) ) * 10 ) ) AS CHAR(100) ) , 1 , 12 ) ) FOR UPDATE;
1
1
1
1
1
1
1
1
1
1
1
1
1
1
SELECT  NULL , col_bigint_key , TRUE , UPPER( col_char_12_key ) , FALSE , 1 FROM table0_bigint ORDER BY pk,pk ASC , pk ASC;
NULL	col_bigint_key	TRUE	UPPER( col_char_12_key )	FALSE	1
NULL	NULL	1	-10	0	1
NULL	NULL	1	99	0	1
NULL	NULL	1	139	0	1
NULL	158	1	NULL	0	1
NULL	158	1	NULL	0	1
NULL	NULL	1	2	0	1
NULL	158	1	NULL	0	1
NULL	2	1	-100	0	1
NULL	158	1	NULL	0	1
NULL	158	1	NULL	0	1
NULL	158	1	NULL	0	1
NULL	158	1	NULL	0	1
NULL	NULL	1	-10	0	1
SELECT col_bigint_key FROM table0_bigint WHERE LENGTH('FZGTB') = col_bigint ORDER BY col_char_12_key , pk ASC LIMIT 161 , 2;
col_bigint_key
SELECT UPPER( col_bigint_key ) FROM table0_bigint WHERE col_char_12_key > ( SUBSTR( CAST( ( ROUND( 9 + ABS ( ROUND( 99 + 1 ) ) ) ) AS CHAR(100) ) , 1 , 12 ) ) AND pk <= ( SUBSTR( CAST( ( ROUND( 21 * 9 ) ) AS CHAR(100) ) , 1 , 12 ) ) GROUP BY col_bigint_key ORDER BY col_bigint_key LIMIT 229 , 1 /* RESULTSET_HAS_ZERO_OR_ONE_ROWS */;
UPPER( col_bigint_key )
SELECT UPPER( col_char_12 ) FROM table0_bigint WHERE col_char_12 = ( SUBSTR( CAST( ( ROUND( ROUND( -9 * LENGTH( SUBSTR( CAST( ( ROUND( 99 * LENGTH( SUBSTR( CAST( ( CEIL ( ROUND( ROUND( SIGN ( ROUND( 19 * 0 ) ) + -100 ) * 99 ) ) ) AS CHAR(100) ) , 1 , 12 ) ) ) ) AS CHAR(100) ) , 1 , 12 ) ) ) * 7 ) ) AS CHAR(100) ) , 1 , 12 ) ) AND col_char_12 != ( SUBSTR( CAST( ( LENGTH('BODUV') ) AS CHAR(100) ) , 1 , 12 ) ) GROUP BY col_char_12 ORDER BY col_char_12 LIMIT 3 , 1 /* RESULTSET_HAS_ZERO_OR_ONE_ROWS */;
UPPER( col_char_12 )
SELECT UPPER( col_bigint_key ) FROM table0_bigint WHERE ( 2106392576 , 488701952 ) NOT IN ( ( SUBSTR( CAST( ( ROUND( 1 - LENGTH( SUBSTR( CAST( ( LENGTH('PCWKF') ) AS CHAR(100) ) , 1 , 12 ) ) ) ) AS CHAR(100) ) , 1 , 12 ) , SUBSTR( CAST( ( CEIL ( -9 ) ) AS CHAR(100) ) , 1 , 12 ) ) , ( SUBSTR( CAST( ( LENGTH( SUBSTR( CAST( ( -10 ) AS CHAR(100) ) , 1 , 12 ) ) ) AS CHAR(100) ) , 1 , 12 ) , SUBSTR( CAST( ( CEIL ( ABS ( -10 ) ) ) AS CHAR(100) ) , 1 , 12 ) ) ) GROUP BY col_bigint_key ORDER BY col_bigint_key LIMIT 8 , 5;
UPPER( col_bigint_key )
INSERT INTO table0_bigint ( pk , col_bigint, col_char_12 ) VALUES ( -1 , SUBSTR( CAST( ( LENGTH('GSAJS') ) AS CHAR(100) ) , 1 , 12 ) , SUBSTR( CAST( ( ROUND ( FLOOR ( CEIL ( 9 ) ) ) ) AS CHAR(100) ) , 1 , 12 ) ) ;
ERROR 23000: Duplicate entry '-1' for key 'PRIMARY'
SELECT * FROM table0_bigint ORDER BY pk;
col_char_12_key	col_char_12	col_bigint_key	pk	col_bigint
-10	NULL	NULL	-100	NULL
99	NULL	NULL	-10	NULL
139	NULL	NULL	-9	NULL
NULL	NULL	158	-1	NULL
NULL	NULL	158	0	NULL
2	NULL	NULL	1	NULL
NULL	NULL	158	4	NULL
-100	NULL	2	8	8
NULL	5	158	9	9
NULL	NULL	158	10	10
NULL	10	158	83	NULL
NULL	9	158	99	99
-10	NULL	NULL	154	NULL
SELECT * FROM table0_bigint WHERE ROUND( LENGTH( SUBSTR( CAST( ( LENGTH( SUBSTR( CAST( ( ROUND ( ROUND( 1 - ROUND( 99 - 9 ) ) ) ) AS CHAR(100) ) , 1 , 12 ) ) ) AS CHAR(100) ) , 1 , 12 ) ) + 1 ) >= LENGTH('DSVQA') ORDER BY col_char_12_key , pk  LIMIT 4 , 3;
col_char_12_key	col_char_12	col_bigint_key	pk	col_bigint
INSERT INTO table0_bigint ( pk , col_bigint_key ) VALUES ( 123 , SUBSTR( CAST( ( ROUND( 99 - ROUND( 99 + 1 ) ) ) AS CHAR(100) ) , 1 , 12 ) ) ;
SELECT * FROM table0_bigint ORDER BY pk;
col_char_12_key	col_char_12	col_bigint_key	pk	col_bigint
-10	NULL	NULL	-100	NULL
99	NULL	NULL	-10	NULL
139	NULL	NULL	-9	NULL
NULL	NULL	158	-1	NULL
NULL	NULL	158	0	NULL
2	NULL	NULL	1	NULL
NULL	NULL	158	4	NULL
-100	NULL	2	8	8
NULL	5	158	9	9
NULL	NULL	158	10	10
NULL	10	158	83	NULL
NULL	9	158	99	99
NULL	NULL	-1	123	NULL
-10	NULL	NULL	154	NULL
SELECT col_char_12_key FROM table0_bigint WHERE col_char_12_key < CAST(99 AS CHAR(100)) ORDER BY col_char_12_key , col_bigint_key , pk ASC LIMIT 1 /* RESULTSET_HAS_ZERO_OR_ONE_ROWS */;
col_char_12_key
-10
SELECT ALL 1 , NULL , TRUE , FALSE , UPPER( pk ) FROM table0_bigint ORDER BY col_bigint_key , pk ;
1	NULL	TRUE	FALSE	UPPER( pk )
1	NULL	1	0	-100
1	NULL	1	0	-10
1	NULL	1	0	-9
1	NULL	1	0	1
1	NULL	1	0	154
1	NULL	1	0	123
1	NULL	1	0	8
1	NULL	1	0	-1
1	NULL	1	0	0
1	NULL	1	0	4
1	NULL	1	0	9
1	NULL	1	0	10
1	NULL	1	0	83
1	NULL	1	0	99
INSERT INTO table0_bigint ( pk , col_bigint_key, col_char_12_key ) VALUES ( -100 , SUBSTR( CAST( ( ROUND( 10 - LENGTH('TTFHO') ) ) AS CHAR(100) ) , 1 , 12 ) , SUBSTR( CAST( ( SIGN ( -1 ) ) AS CHAR(100) ) , 1 , 12 ) ) ;
ERROR 23000: Duplicate entry '-100' for key 'PRIMARY'
SELECT * FROM table0_bigint ORDER BY pk;
col_char_12_key	col_char_12	col_bigint_key	pk	col_bigint
-10	NULL	NULL	-100	NULL
99	NULL	NULL	-10	NULL
139	NULL	NULL	-9	NULL
NULL	NULL	158	-1	NULL
NULL	NULL	158	0	NULL
2	NULL	NULL	1	NULL
NULL	NULL	158	4	NULL
-100	NULL	2	8	8
NULL	5	158	9	9
NULL	NULL	158	10	10
NULL	10	158	83	NULL
NULL	9	158	99	99
NULL	NULL	-1	123	NULL
-10	NULL	NULL	154	NULL
INSERT INTO table0_bigint ( pk , col_char_12_key ) VALUES ( 10 , SUBSTR( CAST( ( -9 ) AS CHAR(100) ) , 1 , 12 ) ) ;
ERROR 23000: Duplicate entry '10' for key 'PRIMARY'
SELECT * FROM table0_bigint ORDER BY pk;
col_char_12_key	col_char_12	col_bigint_key	pk	col_bigint
-10	NULL	NULL	-100	NULL
99	NULL	NULL	-10	NULL
139	NULL	NULL	-9	NULL
NULL	NULL	158	-1	NULL
NULL	NULL	158	0	NULL
2	NULL	NULL	1	NULL
NULL	NULL	158	4	NULL
-100	NULL	2	8	8
NULL	5	158	9	9
NULL	NULL	158	10	10
NULL	10	158	83	NULL
NULL	9	158	99	99
NULL	NULL	-1	123	NULL
-10	NULL	NULL	154	NULL
SELECT 1 FROM table0_bigint WHERE col_bigint_key IN ( SUBSTR( CAST( ( LENGTH('LQJAL') ) AS CHAR(100) ) , 1 , 12 ) , SUBSTR( CAST( ( SIGN ( 1 ) ) AS CHAR(100) ) , 1 , 12 ) , SUBSTR( CAST( ( LENGTH('UKSJL') ) AS CHAR(100) ) , 1 , 12 ) , SUBSTR( CAST( ( ROUND( 6 * 0 ) ) AS CHAR(100) ) , 1 , 12 ) , SUBSTR( CAST( ( ROUND( 1 - LENGTH( SUBSTR( CAST( ( ROUND( 9 - ROUND( 1 * -1 ) ) ) AS CHAR(100) ) , 1 , 12 ) ) ) ) AS CHAR(100) ) , 1 , 12 ) ) FOR UPDATE;
1
1
UPDATE table0_bigint SET col_bigint_key = col_bigint_key WHERE col_char_12_key BETWEEN CAST( 3 AS CHAR(100) ) AND CAST( 6 AS CHAR(100) ) ORDER BY col_bigint_key , col_bigint_key , col_char_12_key , pk  LIMIT 4 ;
SELECT * FROM table0_bigint ORDER BY pk;
col_char_12_key	col_char_12	col_bigint_key	pk	col_bigint
-10	NULL	NULL	-100	NULL
99	NULL	NULL	-10	NULL
139	NULL	NULL	-9	NULL
NULL	NULL	158	-1	NULL
NULL	NULL	158	0	NULL
2	NULL	NULL	1	NULL
NULL	NULL	158	4	NULL
-100	NULL	2	8	8
NULL	5	158	9	9
NULL	NULL	158	10	10
NULL	10	158	83	NULL
NULL	9	158	99	99
NULL	NULL	-1	123	NULL
-10	NULL	NULL	154	NULL
SELECT col_bigint_key , col_char_12_key FROM table0_bigint WHERE pk = -100 ORDER BY col_char_12_key , col_char_12_key , pk DESC LIMIT 4 /* RESULTSET_HAS_ZERO_OR_ONE_ROWS */;
col_bigint_key	col_char_12_key
NULL	-10
SELECT UPPER( col_bigint_key ) FROM table0_bigint WHERE ( -933953536 , 262012928 ) NOT IN ( ( SUBSTR( CAST( ( 1 ) AS CHAR(100) ) , 1 , 12 ) , SUBSTR( CAST( ( LENGTH( SUBSTR( CAST( ( LENGTH( SUBSTR( CAST( ( ABS ( 94 ) ) AS CHAR(100) ) , 1 , 12 ) ) ) AS CHAR(100) ) , 1 , 12 ) ) ) AS CHAR(100) ) , 1 , 12 ) ) , ( SUBSTR( CAST( ( LENGTH( SUBSTR( CAST( ( 197 ) AS CHAR(100) ) , 1 , 12 ) ) ) AS CHAR(100) ) , 1 , 12 ) , SUBSTR( CAST( ( LENGTH('SEVCF') ) AS CHAR(100) ) , 1 , 12 ) ) ) GROUP BY col_bigint_key ORDER BY col_bigint_key LIMIT 4 , 3;
UPPER( col_bigint_key )
SELECT 1 FROM table0_bigint WHERE pk > -10 FOR UPDATE;
1
1
1
1
1
1
1
1
1
1
1
1
1
INSERT INTO table0_bigint ( pk , col_char_12_key ) VALUES ( -100, CAST( 212 AS CHAR(100)) ) , ( 0, CAST( -10 AS CHAR(100)) ) ;
ERROR 23000: Duplicate entry '-100' for key 'PRIMARY'
SELECT * FROM table0_bigint ORDER BY pk;
col_char_12_key	col_char_12	col_bigint_key	pk	col_bigint
-10	NULL	NULL	-100	NULL
99	NULL	NULL	-10	NULL
139	NULL	NULL	-9	NULL
NULL	NULL	158	-1	NULL
NULL	NULL	158	0	NULL
2	NULL	NULL	1	NULL
NULL	NULL	158	4	NULL
-100	NULL	2	8	8
NULL	5	158	9	9
NULL	NULL	158	10	10
NULL	10	158	83	NULL
NULL	9	158	99	99
NULL	NULL	-1	123	NULL
-10	NULL	NULL	154	NULL
SELECT UPPER( col_char_12_key ) FROM table0_bigint WHERE col_char_12_key < CAST(9 AS CHAR(100)) GROUP BY col_char_12_key ORDER BY col_char_12_key LIMIT 8 , 1 /* RESULTSET_HAS_ZERO_OR_ONE_ROWS */;
UPPER( col_char_12_key )
UPDATE table0_bigint SET col_char_12_key = SUBSTR( CAST( ( 0 ) AS CHAR(100) ) , 1 , 12 )  ORDER BY col_char_12_key , pk ASC LIMIT 2 ;
SELECT * FROM table0_bigint ORDER BY pk;
col_char_12_key	col_char_12	col_bigint_key	pk	col_bigint
-10	NULL	NULL	-100	NULL
99	NULL	NULL	-10	NULL
139	NULL	NULL	-9	NULL
0	NULL	158	-1	NULL
0	NULL	158	0	NULL
2	NULL	NULL	1	NULL
NULL	NULL	158	4	NULL
-100	NULL	2	8	8
NULL	5	158	9	9
NULL	NULL	158	10	10
NULL	10	158	83	NULL
NULL	9	158	99	99
NULL	NULL	-1	123	NULL
-10	NULL	NULL	154	NULL
SELECT COUNT( col_char_12 ) FROM table0_bigint WHERE LENGTH( SUBSTR( CAST( ( ROUND( 10 - FLOOR ( 1 ) ) ) AS CHAR(100) ) , 1 , 12 ) ) != LENGTH('KGHBY') ORDER BY col_char_12_key , col_bigint_key , pk ASC LIMIT 139 , 4 /* RESULTSET_HAS_ZERO_OR_ONE_ROWS */;
COUNT( col_char_12 )
SELECT col_bigint , col_char_12 FROM table0_bigint WHERE pk = 19 ORDER BY col_bigint_key , col_bigint_key , pk ASC LIMIT 4 , 4 /* RESULTSET_HAS_ZERO_OR_ONE_ROWS */;
col_bigint	col_char_12
INSERT INTO table0_bigint ( pk , col_char_12_key ) VALUES ( -10, CAST( 0 AS CHAR(100)) ) , ( 10, CAST( -10 AS CHAR(100)) ) ;
ERROR 23000: Duplicate entry '-10' for key 'PRIMARY'
SELECT * FROM table0_bigint ORDER BY pk;
col_char_12_key	col_char_12	col_bigint_key	pk	col_bigint
-10	NULL	NULL	-100	NULL
99	NULL	NULL	-10	NULL
139	NULL	NULL	-9	NULL
0	NULL	158	-1	NULL
0	NULL	158	0	NULL
2	NULL	NULL	1	NULL
NULL	NULL	158	4	NULL
-100	NULL	2	8	8
NULL	5	158	9	9
NULL	NULL	158	10	10
NULL	10	158	83	NULL
NULL	9	158	99	99
NULL	NULL	-1	123	NULL
-10	NULL	NULL	154	NULL
SELECT ALL TRUE FROM table0_bigint ORDER BY col_char_12_key , col_bigint_key , pk DESC;
TRUE
1
1
1
1
1
1
1
1
1
1
1
1
1
1
SELECT 1 FROM table0_bigint WHERE LENGTH( SUBSTR( CAST( ( LENGTH('CSPOH') ) AS CHAR(100) ) , 1 , 12 ) ) > LENGTH( SUBSTR( CAST( ( ROUND( -100 - -9 ) ) AS CHAR(100) ) , 1 , 12 ) ) FOR UPDATE;
1
SELECT * FROM table0_bigint WHERE pk = 99 ORDER BY pk,pk  , pk ASC LIMIT 23 , 3 /* RESULTSET_HAS_ZERO_OR_ONE_ROWS */;
col_char_12_key	col_char_12	col_bigint_key	pk	col_bigint
INSERT INTO table0_bigint (pk) VALUES ( 86 ) ;
SELECT * FROM table0_bigint ORDER BY pk;
col_char_12_key	col_char_12	col_bigint_key	pk	col_bigint
-10	NULL	NULL	-100	NULL
99	NULL	NULL	-10	NULL
139	NULL	NULL	-9	NULL
0	NULL	158	-1	NULL
0	NULL	158	0	NULL
2	NULL	NULL	1	NULL
NULL	NULL	158	4	NULL
-100	NULL	2	8	8
NULL	5	158	9	9
NULL	NULL	158	10	10
NULL	10	158	83	NULL
NULL	NULL	NULL	86	NULL
NULL	9	158	99	99
NULL	NULL	-1	123	NULL
-10	NULL	NULL	154	NULL
SELECT 1 FROM table0_bigint WHERE LENGTH( SUBSTR( CAST( ( ABS ( 1 ) ) AS CHAR(100) ) , 1 , 12 ) ) <= 99 FOR UPDATE;
1
1
1
1
1
1
1
1
1
1
1
1
1
1
1
1
SELECT pk , col_bigint_key FROM table0_bigint WHERE col_char_12_key BETWEEN CAST( 1 AS CHAR(100) ) AND CAST( 7 AS CHAR(100) ) ORDER BY pk DESC , pk ASC LIMIT 23 , 1 /* RESULTSET_HAS_ZERO_OR_ONE_ROWS */;
pk	col_bigint_key
SELECT 1 FROM table0_bigint WHERE pk != -100 FOR UPDATE;
1
1
1
1
1
1
1
1
1
1
1
1
1
1
1
SELECT col_char_12_key FROM table0_bigint WHERE ( -1417281536 ) NOT IN ( SUBSTR( CAST( ( ROUND( 99 + -9 ) ) AS CHAR(100) ) , 1 , 12 ) , SUBSTR( CAST( ( ABS ( 1 ) ) AS CHAR(100) ) , 1 , 12 ) , SUBSTR( CAST( ( LENGTH( SUBSTR( CAST( ( LENGTH( SUBSTR( CAST( ( FLOOR ( 29 ) ) AS CHAR(100) ) , 1 , 12 ) ) ) AS CHAR(100) ) , 1 , 12 ) ) ) AS CHAR(100) ) , 1 , 12 ) , SUBSTR( CAST( ( FLOOR ( 221 ) ) AS CHAR(100) ) , 1 , 12 ) , SUBSTR( CAST( ( LENGTH( SUBSTR( CAST( ( LENGTH( SUBSTR( CAST( ( FLOOR ( LENGTH( SUBSTR( CAST( ( -9 ) AS CHAR(100) ) , 1 , 12 ) ) ) ) AS CHAR(100) ) , 1 , 12 ) ) ) AS CHAR(100) ) , 1 , 12 ) ) ) AS CHAR(100) ) , 1 , 12 ) ) ORDER BY col_bigint_key,pk DESC , pk DESC LIMIT 1 /* RESULTSET_HAS_ZERO_OR_ONE_ROWS */;
col_char_12_key
-10
INSERT INTO table0_bigint ( pk , col_bigint_key ) VALUES ( 10 , SUBSTR( CAST( ( SIGN ( -100 ) ) AS CHAR(100) ) , 1 , 12 ) ) ;
ERROR 23000: Duplicate entry '10' for key 'PRIMARY'
SELECT * FROM table0_bigint ORDER BY pk;
col_char_12_key	col_char_12	col_bigint_key	pk	col_bigint
-10	NULL	NULL	-100	NULL
99	NULL	NULL	-10	NULL
139	NULL	NULL	-9	NULL
0	NULL	158	-1	NULL
0	NULL	158	0	NULL
2	NULL	NULL	1	NULL
NULL	NULL	158	4	NULL
-100	NULL	2	8	8
NULL	5	158	9	9
NULL	NULL	158	10	10
NULL	10	158	83	NULL
NULL	NULL	NULL	86	NULL
NULL	9	158	99	99
NULL	NULL	-1	123	NULL
-10	NULL	NULL	154	NULL
SELECT 1 FROM table0_bigint WHERE col_char_12_key >= ( SUBSTR( CAST( ( LENGTH( SUBSTR( CAST( ( 225 ) AS CHAR(100) ) , 1 , 12 ) ) ) AS CHAR(100) ) , 1 , 12 ) ) AND col_char_12_key < ( SUBSTR( CAST( ( 0 ) AS CHAR(100) ) , 1 , 12 ) ) FOR UPDATE;
1
INSERT INTO table0_bigint ( pk , col_char_12_key ) VALUES ( 22, CAST( 10 AS CHAR(100)) ) , ( 1, CAST( 99 AS CHAR(100)) ) ;
ERROR 23000: Duplicate entry '1' for key 'PRIMARY'
SELECT * FROM table0_bigint ORDER BY pk;
col_char_12_key	col_char_12	col_bigint_key	pk	col_bigint
-10	NULL	NULL	-100	NULL
99	NULL	NULL	-10	NULL
139	NULL	NULL	-9	NULL
0	NULL	158	-1	NULL
0	NULL	158	0	NULL
2	NULL	NULL	1	NULL
NULL	NULL	158	4	NULL
-100	NULL	2	8	8
NULL	5	158	9	9
NULL	NULL	158	10	10
NULL	10	158	83	NULL
NULL	NULL	NULL	86	NULL
NULL	9	158	99	99
NULL	NULL	-1	123	NULL
-10	NULL	NULL	154	NULL
SELECT col_bigint_key , col_char_12_key FROM table0_bigint WHERE pk NOT IN ( SUBSTR( CAST( ( 0 ) AS CHAR(100) ) , 1 , 12 ) , SUBSTR( CAST( ( SIGN ( ROUND( -1 + -9 ) ) ) AS CHAR(100) ) , 1 , 12 ) , SUBSTR( CAST( ( LENGTH('OJBQV') ) AS CHAR(100) ) , 1 , 12 ) , SUBSTR( CAST( ( LENGTH( SUBSTR( CAST( ( 207 ) AS CHAR(100) ) , 1 , 12 ) ) ) AS CHAR(100) ) , 1 , 12 ) , SUBSTR( CAST( ( CEIL ( ROUND( 9 - 4 ) ) ) AS CHAR(100) ) , 1 , 12 ) ) ORDER BY col_char_12_key , col_bigint_key , pk ASC LIMIT 1 /* RESULTSET_HAS_ZERO_OR_ONE_ROWS */;
col_bigint_key	col_char_12_key
NULL	NULL
SELECT UPPER( col_char_12_key ),pk FROM table0_bigint WHERE pk NOT IN ( -100 , -10 , 1 , 99 , -9 ) GROUP BY col_char_12_key,pk ORDER BY col_char_12_key,pk LIMIT 7;
UPPER( col_char_12_key )	pk
NULL	4
NULL	9
NULL	10
NULL	83
NULL	86
NULL	123
-10	154
SELECT 1 FROM table0_bigint WHERE col_bigint = 9 FOR UPDATE;
1
1
SELECT col_bigint_key , col_char_12_key FROM table0_bigint WHERE col_bigint_key = SIGN ( 99 ) ORDER BY col_bigint DESC , col_char_12_key DESC , pk ASC LIMIT 1 , 1 /* RESULTSET_HAS_ZERO_OR_ONE_ROWS */;
col_bigint_key	col_char_12_key
UPDATE table0_bigint SET pk = ROUND( 0 - 99 ) , col_char_12 = SUBSTR(concat( CAST(col_bigint AS CHAR(100)) , SUBSTR( CAST( ( -9 ) AS CHAR(100) ) , 1 , 12 )) , 1 , 12 ) WHERE col_bigint NOT IN ( SUBSTR( CAST( ( ROUND ( ROUND( 1 * 10 ) ) ) AS CHAR(100) ) , 1 , 12 ) , SUBSTR( CAST( ( ROUND( 0 - ABS ( ROUND( ROUND( -9 - LENGTH('RRTNZ') ) + 99 ) ) ) ) AS CHAR(100) ) , 1 , 12 ) , SUBSTR( CAST( ( ROUND( -10 * ROUND ( ROUND( 134 * ROUND( -1 * 10 ) ) ) ) ) AS CHAR(100) ) , 1 , 12 ) , SUBSTR( CAST( ( LENGTH('NDYZM') ) AS CHAR(100) ) , 1 , 12 ) , SUBSTR( CAST( ( LENGTH( SUBSTR( CAST( ( FLOOR ( -100 ) ) AS CHAR(100) ) , 1 , 12 ) ) ) AS CHAR(100) ) , 1 , 12 ) ) ORDER BY col_char_12_key DESC , pk ASC LIMIT 6 ;
ERROR 23000: Duplicate entry '-99' for key 'PRIMARY'
SELECT * FROM table0_bigint ORDER BY pk;
col_char_12_key	col_char_12	col_bigint_key	pk	col_bigint
-10	NULL	NULL	-100	NULL
99	NULL	NULL	-10	NULL
139	NULL	NULL	-9	NULL
0	NULL	158	-1	NULL
0	NULL	158	0	NULL
2	NULL	NULL	1	NULL
NULL	NULL	158	4	NULL
-100	NULL	2	8	8
NULL	5	158	9	9
NULL	NULL	158	10	10
NULL	10	158	83	NULL
NULL	NULL	NULL	86	NULL
NULL	9	158	99	99
NULL	NULL	-1	123	NULL
-10	NULL	NULL	154	NULL
SELECT col_bigint,col_bigint_key,col_char_12,col_char_12_key,pk FROM table0_bigint WHERE col_bigint <> 99 GROUP BY col_bigint,col_bigint_key,col_char_12,col_char_12_key,pk ORDER BY col_bigint,col_bigint_key,col_char_12,col_char_12_key,pk LIMIT 4 , 2;
col_bigint	col_bigint_key	col_char_12	col_char_12_key	pk
SELECT col_bigint FROM table0_bigint WHERE ( -1707474944 , -961937408 , 23068672 ) IN ( ( SUBSTR( CAST( ( 6 ) AS CHAR(100) ) , 1 , 12 ) , SUBSTR( CAST( ( LENGTH( SUBSTR( CAST( ( 2 ) AS CHAR(100) ) , 1 , 12 ) ) ) AS CHAR(100) ) , 1 , 12 ) , SUBSTR( CAST( ( SIGN ( LENGTH( SUBSTR( CAST( ( ROUND( 0 * 238 ) ) AS CHAR(100) ) , 1 , 12 ) ) ) ) AS CHAR(100) ) , 1 , 12 ) ) , ( SUBSTR( CAST( ( LENGTH( SUBSTR( CAST( ( LENGTH('UAWDK') ) AS CHAR(100) ) , 1 , 12 ) ) ) AS CHAR(100) ) , 1 , 12 ) , SUBSTR( CAST( ( ROUND ( LENGTH( SUBSTR( CAST( ( LENGTH( SUBSTR( CAST( ( ROUND( FLOOR ( ROUND( -9 + LENGTH('IGZAI') ) ) - 40 ) ) AS CHAR(100) ) , 1 , 12 ) ) ) AS CHAR(100) ) , 1 , 12 ) ) ) ) AS CHAR(100) ) , 1 , 12 ) , SUBSTR( CAST( ( ROUND( ROUND( -100 - 10 ) + 1 ) ) AS CHAR(100) ) , 1 , 12 ) ) ) ORDER BY pk LIMIT 7;
col_bigint
SELECT 1 FROM table0_bigint WHERE col_bigint NOT IN ( SUBSTR( CAST( ( -10 ) AS CHAR(100) ) , 1 , 12 ) , SUBSTR( CAST( ( SIGN ( -10 ) ) AS CHAR(100) ) , 1 , 12 ) , SUBSTR( CAST( ( ROUND( -10 * 9 ) ) AS CHAR(100) ) , 1 , 12 ) , SUBSTR( CAST( ( LENGTH( SUBSTR( CAST( ( ROUND( -9 * LENGTH('YYVNZ') ) ) AS CHAR(100) ) , 1 , 12 ) ) ) AS CHAR(100) ) , 1 , 12 ) , SUBSTR( CAST( ( LENGTH( SUBSTR( CAST( ( ROUND( FLOOR ( 10 ) + 1 ) ) AS CHAR(100) ) , 1 , 12 ) ) ) AS CHAR(100) ) , 1 , 12 ) ) FOR UPDATE;
1
1
1
1
1
SELECT 1 FROM table0_bigint WHERE 10 >= LENGTH('SGPUF') FOR UPDATE;
1
1
1
1
1
1
1
1
1
1
1
1
1
1
1
1
SELECT COUNT( col_bigint_key ) FROM table0_bigint WHERE pk = ( SUBSTR( CAST( ( ABS ( ROUND( 216 + ROUND( ROUND ( 164 ) + 0 ) ) ) ) AS CHAR(100) ) , 1 , 12 ) ) ORDER BY pk,pk  , pk  LIMIT 6 , 3 /* RESULTSET_HAS_ZERO_OR_ONE_ROWS */;
COUNT( col_bigint_key )
INSERT INTO table0_bigint ( pk , col_bigint_key ) VALUES ( -1, CAST( -1 AS CHAR(100)) ) , ( 9, CAST( -10 AS CHAR(100)) ) ;
ERROR 23000: Duplicate entry '-1' for key 'PRIMARY'
SELECT * FROM table0_bigint ORDER BY pk;
col_char_12_key	col_char_12	col_bigint_key	pk	col_bigint
-10	NULL	NULL	-100	NULL
99	NULL	NULL	-10	NULL
139	NULL	NULL	-9	NULL
0	NULL	158	-1	NULL
0	NULL	158	0	NULL
2	NULL	NULL	1	NULL
NULL	NULL	158	4	NULL
-100	NULL	2	8	8
NULL	5	158	9	9
NULL	NULL	158	10	10
NULL	10	158	83	NULL
NULL	NULL	NULL	86	NULL
NULL	9	158	99	99
NULL	NULL	-1	123	NULL
-10	NULL	NULL	154	NULL
SELECT * FROM table0_bigint WHERE col_bigint BETWEEN SUBSTR( CAST( ( ROUND( ROUND ( 0 ) * -9 ) ) AS CHAR(100) ) , 1 , 12 ) AND SUBSTR( CAST( ( ABS ( 99 ) ) AS CHAR(100) ) , 1 , 12 ) ORDER BY col_bigint_key DESC , pk DESC LIMIT 3 , 3;
col_char_12_key	col_char_12	col_bigint_key	pk	col_bigint
-100	NULL	2	8	8
SELECT col_bigint , col_char_12 FROM table0_bigint WHERE col_bigint_key IN ( SUBSTR( CAST( ( ROUND( -9 * ROUND( -100 * 62 ) ) ) AS CHAR(100) ) , 1 , 12 ) , SUBSTR( CAST( ( ROUND( LENGTH('FOYEQ') - -100 ) ) AS CHAR(100) ) , 1 , 12 ) , SUBSTR( CAST( ( -10 ) AS CHAR(100) ) , 1 , 12 ) , SUBSTR( CAST( ( 5 ) AS CHAR(100) ) , 1 , 12 ) , SUBSTR( CAST( ( SIGN ( SIGN ( LENGTH( SUBSTR( CAST( ( ROUND( SIGN ( 0 ) - -100 ) ) AS CHAR(100) ) , 1 , 12 ) ) ) ) ) AS CHAR(100) ) , 1 , 12 ) ) ORDER BY col_bigint_key , col_char_12_key , pk ASC LIMIT 6 , 1 /* RESULTSET_HAS_ZERO_OR_ONE_ROWS */;
col_bigint	col_char_12
INSERT INTO table0_bigint ( pk , col_bigint_key, col_char_12 ) VALUES ( -100 , SUBSTR( CAST( ( LENGTH( SUBSTR( CAST( ( CEIL ( 10 ) ) AS CHAR(100) ) , 1 , 12 ) ) ) AS CHAR(100) ) , 1 , 12 ) , SUBSTR( CAST( ( -9 ) AS CHAR(100) ) , 1 , 12 ) ) ;
ERROR 23000: Duplicate entry '-100' for key 'PRIMARY'
SELECT * FROM table0_bigint ORDER BY pk;
col_char_12_key	col_char_12	col_bigint_key	pk	col_bigint
-10	NULL	NULL	-100	NULL
99	NULL	NULL	-10	NULL
139	NULL	NULL	-9	NULL
0	NULL	158	-1	NULL
0	NULL	158	0	NULL
2	NULL	NULL	1	NULL
NULL	NULL	158	4	NULL
-100	NULL	2	8	8
NULL	5	158	9	9
NULL	NULL	158	10	10
NULL	10	158	83	NULL
NULL	NULL	NULL	86	NULL
NULL	9	158	99	99
NULL	NULL	-1	123	NULL
-10	NULL	NULL	154	NULL
SELECT pk FROM table0_bigint WHERE col_bigint <= LENGTH( SUBSTR( CAST( ( ROUND( ABS ( 51 ) * 1 ) ) AS CHAR(100) ) , 1 , 12 ) ) ORDER BY col_char_12_key , col_char_12_key , col_bigint_key , pk ASC LIMIT 1 /* RESULTSET_HAS_ZERO_OR_ONE_ROWS */;
pk
SELECT col_bigint,col_bigint_key,col_char_12,col_char_12_key,pk FROM table0_bigint WHERE 9 < col_bigint ORDER BY col_char_12_key,pk DESC , pk ASC LIMIT 1 /* RESULTSET_HAS_ZERO_OR_ONE_ROWS */;
col_bigint	col_bigint_key	col_char_12	col_char_12_key	pk
99	158	9	NULL	99
SELECT col_bigint_key FROM table0_bigint WHERE pk = ( SUBSTR( CAST( ( FLOOR ( 99 ) ) AS CHAR(100) ) , 1 , 12 ) ) ORDER BY pk LIMIT 1 , 4;
col_bigint_key
SELECT 1 FROM table0_bigint WHERE ABS ( ROUND( 99 + ROUND( 119 + -100 ) ) ) <= LENGTH('RVTSU') FOR UPDATE;
1
SELECT * FROM table0_bigint WHERE col_bigint_key != LENGTH('EZCBP') ORDER BY col_bigint_key,pk  , pk DESC LIMIT 4;
col_char_12_key	col_char_12	col_bigint_key	pk	col_bigint
NULL	NULL	-1	123	NULL
-100	NULL	2	8	8
0	NULL	158	-1	NULL
0	NULL	158	0	NULL
SELECT UPPER( col_char_12_key ),pk FROM table0_bigint WHERE col_bigint BETWEEN SUBSTR( CAST( ( 10 ) AS CHAR(100) ) , 1 , 12 ) AND SUBSTR( CAST( ( CEIL ( -9 ) ) AS CHAR(100) ) , 1 , 12 ) GROUP BY col_char_12_key,pk ORDER BY col_char_12_key,pk LIMIT 1;
UPPER( col_char_12_key )	pk
SELECT col_char_12_key FROM table0_bigint WHERE pk = -100 ORDER BY col_char_12_key,pk ASC , pk DESC LIMIT 5 , 1 /* RESULTSET_HAS_ZERO_OR_ONE_ROWS */;
col_char_12_key
SELECT pk , col_char_12_key FROM table0_bigint WHERE ( -214564864 , -1768751104 , 1494679552 , 1412235264 ) IN ( ( SUBSTR( CAST( ( 0 ) AS CHAR(100) ) , 1 , 12 ) , SUBSTR( CAST( ( ROUND( 0 - ROUND( LENGTH( SUBSTR( CAST( ( ROUND( SIGN ( FLOOR ( ROUND( 10 * -1 ) ) ) * 7 ) ) AS CHAR(100) ) , 1 , 12 ) ) - 199 ) ) ) AS CHAR(100) ) , 1 , 12 ) , SUBSTR( CAST( ( FLOOR ( 99 ) ) AS CHAR(100) ) , 1 , 12 ) , SUBSTR( CAST( ( FLOOR ( ROUND( ABS ( ROUND ( 9 ) ) * 0 ) ) ) AS CHAR(100) ) , 1 , 12 ) ) ) ORDER BY col_bigint DESC , pk ASC LIMIT 13 , 3;
pk	col_char_12_key
SELECT * FROM table0_bigint WHERE pk IN ( SUBSTR( CAST( ( FLOOR ( -1 ) ) AS CHAR(100) ) , 1 , 12 ) , SUBSTR( CAST( ( LENGTH('ZAGHI') ) AS CHAR(100) ) , 1 , 12 ) , SUBSTR( CAST( ( LENGTH( SUBSTR( CAST( ( ROUND( ROUND( 1 - -10 ) * 10 ) ) AS CHAR(100) ) , 1 , 12 ) ) ) AS CHAR(100) ) , 1 , 12 ) , SUBSTR( CAST( ( 1 ) AS CHAR(100) ) , 1 , 12 ) , SUBSTR( CAST( ( LENGTH('SCTGQ') ) AS CHAR(100) ) , 1 , 12 ) ) ORDER BY col_bigint  , col_char_12_key ASC , pk  LIMIT 207 , 2;
col_char_12_key	col_char_12	col_bigint_key	pk	col_bigint
UPDATE table0_bigint SET pk = SUBSTR( CAST( ( ROUND( ROUND( 0 * -9 ) - 217 ) ) AS CHAR(100) ) , 1 , 12 ) , col_char_12_key = SUBSTR(concat( CAST(col_bigint AS CHAR(100)) , SUBSTR( CAST( ( ROUND( -10 + 10 ) ) AS CHAR(100) ) , 1 , 12 ) ) , 1 , 12 ) WHERE col_bigint_key < CAST(57 AS CHAR(100)) ORDER BY col_bigint_key  , col_char_12_key DESC , pk DESC LIMIT 2 ;
ERROR 23000: Duplicate entry '-217' for key 'PRIMARY'
SELECT * FROM table0_bigint ORDER BY pk;
col_char_12_key	col_char_12	col_bigint_key	pk	col_bigint
-10	NULL	NULL	-100	NULL
99	NULL	NULL	-10	NULL
139	NULL	NULL	-9	NULL
0	NULL	158	-1	NULL
0	NULL	158	0	NULL
2	NULL	NULL	1	NULL
NULL	NULL	158	4	NULL
-100	NULL	2	8	8
NULL	5	158	9	9
NULL	NULL	158	10	10
NULL	10	158	83	NULL
NULL	NULL	NULL	86	NULL
NULL	9	158	99	99
NULL	NULL	-1	123	NULL
-10	NULL	NULL	154	NULL
SELECT * FROM table0_bigint WHERE ( 446889984 , 1166934016 , -496631808 ) IN ( ( SUBSTR( CAST( ( LENGTH('HROTB') ) AS CHAR(100) ) , 1 , 12 ) , SUBSTR( CAST( ( ROUND( 99 + 110 ) ) AS CHAR(100) ) , 1 , 12 ) , SUBSTR( CAST( ( LENGTH( SUBSTR( CAST( ( 239 ) AS CHAR(100) ) , 1 , 12 ) ) ) AS CHAR(100) ) , 1 , 12 ) ) , ( SUBSTR( CAST( ( ABS ( 0 ) ) AS CHAR(100) ) , 1 , 12 ) , SUBSTR( CAST( ( 1 ) AS CHAR(100) ) , 1 , 12 ) , SUBSTR( CAST( ( SIGN ( 40 ) ) AS CHAR(100) ) , 1 , 12 ) ) ) ORDER BY col_char_12_key , pk ASC LIMIT 8;
col_char_12_key	col_char_12	col_bigint_key	pk	col_bigint
SELECT 1 FROM table0_bigint WHERE col_bigint NOT IN ( SUBSTR( CAST( ( LENGTH( SUBSTR( CAST( ( 10 ) AS CHAR(100) ) , 1 , 12 ) ) ) AS CHAR(100) ) , 1 , 12 ) , SUBSTR( CAST( ( ROUND( -9 + 169 ) ) AS CHAR(100) ) , 1 , 12 ) , SUBSTR( CAST( ( LENGTH('SQWMK') ) AS CHAR(100) ) , 1 , 12 ) , SUBSTR( CAST( ( ROUND( 0 * 41 ) ) AS CHAR(100) ) , 1 , 12 ) , SUBSTR( CAST( ( ABS ( LENGTH( SUBSTR( CAST( ( CEIL ( 1 ) ) AS CHAR(100) ) , 1 , 12 ) ) ) ) AS CHAR(100) ) , 1 , 12 ) ) FOR UPDATE;
1
1
1
1
1
SELECT 1 FROM table0_bigint WHERE pk < 1 FOR UPDATE;
1
1
1
1
1
1
SELECT col_bigint_key,pk FROM table0_bigint WHERE ROUND( 9 + -10 ) <> ROUND( ROUND( ROUND( ABS ( ROUND( -1 - LENGTH( SUBSTR( CAST( ( SIGN ( 255 ) ) AS CHAR(100) ) , 1 , 12 ) ) ) ) + -10 ) - 4 ) * 9 ) GROUP BY col_bigint_key,pk ORDER BY col_bigint_key,pk LIMIT 6 , 5;
col_bigint_key	pk
-1	123
2	8
158	-1
158	0
158	4
SELECT col_bigint_key,pk FROM table0_bigint WHERE pk != ( SUBSTR( CAST( ( SIGN ( 232 ) ) AS CHAR(100) ) , 1 , 12 ) ) GROUP BY col_bigint_key,pk ORDER BY col_bigint_key,pk LIMIT 6 , 8;
col_bigint_key	pk
2	8
158	-1
158	0
158	4
158	9
158	10
158	83
158	99
SELECT pk FROM table0_bigint WHERE col_bigint <> ( SUBSTR( CAST( ( ROUND( 166 * 150 ) ) AS CHAR(100) ) , 1 , 12 ) ) ORDER BY pk LIMIT 4 , 1 /* RESULTSET_HAS_ZERO_OR_ONE_ROWS */;
pk
INSERT INTO table0_bigint ( pk , col_bigint_key ) VALUES ( -100, CAST( -10 AS CHAR(100)) ) , ( 194, CAST( 99 AS CHAR(100)) ) ;
ERROR 23000: Duplicate entry '-100' for key 'PRIMARY'
SELECT * FROM table0_bigint ORDER BY pk;
col_char_12_key	col_char_12	col_bigint_key	pk	col_bigint
-10	NULL	NULL	-100	NULL
99	NULL	NULL	-10	NULL
139	NULL	NULL	-9	NULL
0	NULL	158	-1	NULL
0	NULL	158	0	NULL
2	NULL	NULL	1	NULL
NULL	NULL	158	4	NULL
-100	NULL	2	8	8
NULL	5	158	9	9
NULL	NULL	158	10	10
NULL	10	158	83	NULL
NULL	NULL	NULL	86	NULL
NULL	9	158	99	99
NULL	NULL	-1	123	NULL
-10	NULL	NULL	154	NULL
INSERT INTO table0_bigint (pk) VALUES ( -9 ) ;
ERROR 23000: Duplicate entry '-9' for key 'PRIMARY'
SELECT * FROM table0_bigint ORDER BY pk;
col_char_12_key	col_char_12	col_bigint_key	pk	col_bigint
-10	NULL	NULL	-100	NULL
99	NULL	NULL	-10	NULL
139	NULL	NULL	-9	NULL
0	NULL	158	-1	NULL
0	NULL	158	0	NULL
2	NULL	NULL	1	NULL
NULL	NULL	158	4	NULL
-100	NULL	2	8	8
NULL	5	158	9	9
NULL	NULL	158	10	10
NULL	10	158	83	NULL
NULL	NULL	NULL	86	NULL
NULL	9	158	99	99
NULL	NULL	-1	123	NULL
-10	NULL	NULL	154	NULL
SELECT  1 FROM table0_bigint ORDER BY pk;
1
1
1
1
1
1
1
1
1
1
1
1
1
1
1
1
SELECT ALL NULL , UPPER( col_bigint_key ) , TRUE , FALSE , 1 FROM table0_bigint ORDER BY col_bigint_key , col_char_12_key , col_bigint_key , pk ASC;
NULL	UPPER( col_bigint_key )	TRUE	FALSE	1
NULL	NULL	1	0	1
NULL	NULL	1	0	1
NULL	NULL	1	0	1
NULL	NULL	1	0	1
NULL	NULL	1	0	1
NULL	NULL	1	0	1
NULL	-1	1	0	1
NULL	2	1	0	1
NULL	158	1	0	1
NULL	158	1	0	1
NULL	158	1	0	1
NULL	158	1	0	1
NULL	158	1	0	1
NULL	158	1	0	1
NULL	158	1	0	1
SELECT * FROM table0_bigint WHERE col_bigint_key BETWEEN SUBSTR( CAST( ( ROUND( ROUND( -1 - 247 ) + 144 ) ) AS CHAR(100) ) , 1 , 12 ) AND SUBSTR( CAST( ( LENGTH( SUBSTR( CAST( ( SIGN ( -100 ) ) AS CHAR(100) ) , 1 , 12 ) ) ) AS CHAR(100) ) , 1 , 12 ) ORDER BY pk LIMIT 6 , 3;
col_char_12_key	col_char_12	col_bigint_key	pk	col_bigint
INSERT INTO table0_bigint ( pk , col_char_12_key ) VALUES ( -100, CAST( 0 AS CHAR(100)) ) , ( -10, CAST( 234 AS CHAR(100)) ) ;
ERROR 23000: Duplicate entry '-100' for key 'PRIMARY'
SELECT * FROM table0_bigint ORDER BY pk;
col_char_12_key	col_char_12	col_bigint_key	pk	col_bigint
-10	NULL	NULL	-100	NULL
99	NULL	NULL	-10	NULL
139	NULL	NULL	-9	NULL
0	NULL	158	-1	NULL
0	NULL	158	0	NULL
2	NULL	NULL	1	NULL
NULL	NULL	158	4	NULL
-100	NULL	2	8	8
NULL	5	158	9	9
NULL	NULL	158	10	10
NULL	10	158	83	NULL
NULL	NULL	NULL	86	NULL
NULL	9	158	99	99
NULL	NULL	-1	123	NULL
-10	NULL	NULL	154	NULL
UPDATE table0_bigint SET pk = ROUND( 18 - ROUND( ROUND( 157 * ABS ( 6 ) ) + 94 ) ) , col_char_12_key = SUBSTR(concat( CAST(col_bigint AS CHAR(100)) , SUBSTR( CAST( ( ROUND( 0 - 9 ) ) AS CHAR(100) ) , 1 , 12 )) , 1 , 12 ) WHERE col_char_12_key <= ( SUBSTR( CAST( ( ROUND( LENGTH( SUBSTR( CAST( ( ROUND( LENGTH('VSJMM') - -1 ) ) AS CHAR(100) ) , 1 , 12 ) ) + -10 ) ) AS CHAR(100) ) , 1 , 12 ) ) AND col_bigint != ( SUBSTR( CAST( ( 9 ) AS CHAR(100) ) , 1 , 12 ) ) ORDER BY pk  , pk ASC LIMIT 130 ;
SELECT * FROM table0_bigint ORDER BY pk;
col_char_12_key	col_char_12	col_bigint_key	pk	col_bigint
8-9	NULL	2	-1018	8
-10	NULL	NULL	-100	NULL
99	NULL	NULL	-10	NULL
139	NULL	NULL	-9	NULL
0	NULL	158	-1	NULL
0	NULL	158	0	NULL
2	NULL	NULL	1	NULL
NULL	NULL	158	4	NULL
NULL	5	158	9	9
NULL	NULL	158	10	10
NULL	10	158	83	NULL
NULL	NULL	NULL	86	NULL
NULL	9	158	99	99
NULL	NULL	-1	123	NULL
-10	NULL	NULL	154	NULL
INSERT INTO table0_bigint (pk) VALUES ( -10 ) ;
ERROR 23000: Duplicate entry '-10' for key 'PRIMARY'
SELECT * FROM table0_bigint ORDER BY pk;
col_char_12_key	col_char_12	col_bigint_key	pk	col_bigint
8-9	NULL	2	-1018	8
-10	NULL	NULL	-100	NULL
99	NULL	NULL	-10	NULL
139	NULL	NULL	-9	NULL
0	NULL	158	-1	NULL
0	NULL	158	0	NULL
2	NULL	NULL	1	NULL
NULL	NULL	158	4	NULL
NULL	5	158	9	9
NULL	NULL	158	10	10
NULL	10	158	83	NULL
NULL	NULL	NULL	86	NULL
NULL	9	158	99	99
NULL	NULL	-1	123	NULL
-10	NULL	NULL	154	NULL
SELECT col_bigint_key FROM table0_bigint WHERE LENGTH( SUBSTR( CAST( ( 141 ) AS CHAR(100) ) , 1 , 12 ) ) < LENGTH('WSRKQ') ORDER BY col_char_12_key , col_bigint_key , pk DESC LIMIT 239 , 1 /* RESULTSET_HAS_ZERO_OR_ONE_ROWS */;
col_bigint_key
SELECT col_char_12_key FROM table0_bigint WHERE pk >= -1846542336 and pk <= -1846542336 ORDER BY col_bigint DESC , col_char_12  , pk ASC LIMIT 3 /* RESULTSET_HAS_ZERO_OR_ONE_ROWS */;
col_char_12_key
SELECT DISTINCT NULL , UPPER( col_char_12_key ) , TRUE , FALSE , 1 FROM table0_bigint ORDER BY col_char_12_key , pk DESC;
NULL	UPPER( col_char_12_key )	TRUE	FALSE	1
NULL	NULL	1	0	1
NULL	-10	1	0	1
NULL	0	1	0	1
NULL	139	1	0	1
NULL	2	1	0	1
NULL	8-9	1	0	1
NULL	99	1	0	1
SELECT  NULL , col_bigint , TRUE , UPPER( col_char_12 ) , FALSE , 1 FROM table0_bigint ORDER BY col_char_12_key , pk ;
NULL	col_bigint	TRUE	UPPER( col_char_12 )	FALSE	1
NULL	NULL	1	NULL	0	1
NULL	9	1	5	0	1
NULL	10	1	NULL	0	1
NULL	NULL	1	10	0	1
NULL	NULL	1	NULL	0	1
NULL	99	1	9	0	1
NULL	NULL	1	NULL	0	1
NULL	NULL	1	NULL	0	1
NULL	NULL	1	NULL	0	1
NULL	NULL	1	NULL	0	1
NULL	NULL	1	NULL	0	1
NULL	NULL	1	NULL	0	1
NULL	NULL	1	NULL	0	1
NULL	8	1	NULL	0	1
NULL	NULL	1	NULL	0	1
SELECT * FROM table0_bigint WHERE pk = -1 ORDER BY col_char_12_key,pk  , pk  LIMIT 8 , 8;
col_char_12_key	col_char_12	col_bigint_key	pk	col_bigint
SELECT 1 FROM table0_bigint  FOR UPDATE;
1
1
1
1
1
1
1
1
1
1
1
1
1
1
1
1
SELECT 1 FROM table0_bigint WHERE LENGTH( SUBSTR( CAST( ( ROUND ( 9 ) ) AS CHAR(100) ) , 1 , 12 ) ) <= col_bigint FOR UPDATE;
1
1
1
1
1
SELECT col_char_12 FROM table0_bigint WHERE col_bigint BETWEEN SUBSTR( CAST( ( ROUND( ROUND( 1 + -100 ) + -9 ) ) AS CHAR(100) ) , 1 , 12 ) AND SUBSTR( CAST( ( SIGN ( 1 ) ) AS CHAR(100) ) , 1 , 12 ) ORDER BY col_bigint , col_char_12_key,pk ASC , pk  LIMIT 192 , 1 /* RESULTSET_HAS_ZERO_OR_ONE_ROWS */;
col_char_12
SELECT col_bigint,col_bigint_key,col_char_12,col_char_12_key,pk FROM table0_bigint WHERE col_bigint BETWEEN SUBSTR( CAST( ( ROUND( 4 - -100 ) ) AS CHAR(100) ) , 1 , 12 ) AND SUBSTR( CAST( ( ROUND( ROUND( 10 * ROUND( 99 + 10 ) ) + 0 ) ) AS CHAR(100) ) , 1 , 12 ) GROUP BY col_bigint,col_bigint_key,col_char_12,col_char_12_key,pk ORDER BY col_bigint,col_bigint_key,col_char_12,col_char_12_key,pk LIMIT 5 , 7;
col_bigint	col_bigint_key	col_char_12	col_char_12_key	pk
UPDATE table0_bigint SET col_char_12_key = SUBSTR( CAST( ( LENGTH( SUBSTR( CAST( ( ROUND( 4 + 7 ) ) AS CHAR(100) ) , 1 , 12 ) ) ) AS CHAR(100) ) , 1 , 12 ) WHERE col_char_12_key BETWEEN SUBSTR( CAST( ( FLOOR ( ROUND( ROUND( LENGTH( SUBSTR( CAST( ( ROUND( -9 * ROUND( LENGTH('PGBBX') - 1 ) ) ) AS CHAR(100) ) , 1 , 12 ) ) * 9 ) * 150 ) ) ) AS CHAR(100) ) , 1 , 12 ) AND SUBSTR( CAST( ( CEIL ( 192 ) ) AS CHAR(100) ) , 1 , 12 ) ORDER BY col_char_12_key DESC , pk DESC LIMIT 2 ;
SELECT * FROM table0_bigint ORDER BY pk;
col_char_12_key	col_char_12	col_bigint_key	pk	col_bigint
8-9	NULL	2	-1018	8
-10	NULL	NULL	-100	NULL
99	NULL	NULL	-10	NULL
139	NULL	NULL	-9	NULL
0	NULL	158	-1	NULL
0	NULL	158	0	NULL
2	NULL	NULL	1	NULL
NULL	NULL	158	4	NULL
NULL	5	158	9	9
NULL	NULL	158	10	10
NULL	10	158	83	NULL
NULL	NULL	NULL	86	NULL
NULL	9	158	99	99
NULL	NULL	-1	123	NULL
-10	NULL	NULL	154	NULL
INSERT INTO table0_bigint (pk) VALUES ( 9 ) ;
ERROR 23000: Duplicate entry '9' for key 'PRIMARY'
SELECT * FROM table0_bigint ORDER BY pk;
col_char_12_key	col_char_12	col_bigint_key	pk	col_bigint
8-9	NULL	2	-1018	8
-10	NULL	NULL	-100	NULL
99	NULL	NULL	-10	NULL
139	NULL	NULL	-9	NULL
0	NULL	158	-1	NULL
0	NULL	158	0	NULL
2	NULL	NULL	1	NULL
NULL	NULL	158	4	NULL
NULL	5	158	9	9
NULL	NULL	158	10	10
NULL	10	158	83	NULL
NULL	NULL	NULL	86	NULL
NULL	9	158	99	99
NULL	NULL	-1	123	NULL
-10	NULL	NULL	154	NULL
SELECT 1 FROM table0_bigint WHERE ROUND( -9 + 101 ) <> ABS ( CEIL ( 0 ) ) FOR UPDATE;
1
1
1
1
1
1
1
1
1
1
1
1
1
1
1
1
INSERT INTO table0_bigint ( pk , col_bigint_key ) VALUES ( 13, CAST( 2 AS CHAR(100)) ) , ( 32, CAST( 2 AS CHAR(100)) ) ;
SELECT * FROM table0_bigint ORDER BY pk;
col_char_12_key	col_char_12	col_bigint_key	pk	col_bigint
8-9	NULL	2	-1018	8
-10	NULL	NULL	-100	NULL
99	NULL	NULL	-10	NULL
139	NULL	NULL	-9	NULL
0	NULL	158	-1	NULL
0	NULL	158	0	NULL
2	NULL	NULL	1	NULL
NULL	NULL	158	4	NULL
NULL	5	158	9	9
NULL	NULL	158	10	10
NULL	NULL	2	13	NULL
NULL	NULL	2	32	NULL
NULL	10	158	83	NULL
NULL	NULL	NULL	86	NULL
NULL	9	158	99	99
NULL	NULL	-1	123	NULL
-10	NULL	NULL	154	NULL
SELECT DISTINCT NULL , UPPER( col_char_12 ) , TRUE , FALSE , 1 FROM table0_bigint ORDER BY col_bigint_key DESC , col_char_12_key ASC , pk DESC;
NULL	UPPER( col_char_12 )	TRUE	FALSE	1
NULL	9	1	0	1
NULL	10	1	0	1
NULL	5	1	0	1
NULL	NULL	1	0	1
SELECT * FROM table0_bigint WHERE pk < ( SUBSTR( CAST( ( 173 ) AS CHAR(100) ) , 1 , 12 ) ) ORDER BY pk , col_bigint , col_char_12,pk DESC , pk DESC LIMIT 8 , 5;
col_char_12_key	col_char_12	col_bigint_key	pk	col_bigint
NULL	5	158	9	9
NULL	NULL	158	10	10
NULL	NULL	2	13	NULL
NULL	NULL	2	32	NULL
NULL	10	158	83	NULL
SELECT col_bigint,col_bigint_key,col_char_12,col_char_12_key,pk FROM table0_bigint WHERE col_bigint_key < ROUND ( ROUND( SIGN ( LENGTH('GKRHO') ) - 1 ) ) ORDER BY col_char_12_key , col_bigint_key , col_char_12_key , pk DESC LIMIT 3 , 1 /* RESULTSET_HAS_ZERO_OR_ONE_ROWS */;
col_bigint	col_bigint_key	col_char_12	col_char_12_key	pk
SELECT col_char_12_key FROM table0_bigint WHERE col_bigint_key > ( SUBSTR( CAST( ( ROUND( -9 * -1 ) ) AS CHAR(100) ) , 1 , 12 ) ) ORDER BY col_bigint DESC , pk DESC LIMIT 4 , 1 /* RESULTSET_HAS_ZERO_OR_ONE_ROWS */;
col_char_12_key
NULL
UPDATE table0_bigint SET col_bigint_key = SUBSTR( CAST( ( LENGTH('LMIGM') ) AS CHAR(100) ) , 1 , 12 ) WHERE pk <> ( SUBSTR( CAST( ( LENGTH( SUBSTR( CAST( ( ABS ( LENGTH('HZZVP') ) ) AS CHAR(100) ) , 1 , 12 ) ) ) AS CHAR(100) ) , 1 , 12 ) ) ORDER BY col_bigint , col_char_12_key,pk ASC , pk  LIMIT 6 ;
SELECT * FROM table0_bigint ORDER BY pk;
col_char_12_key	col_char_12	col_bigint_key	pk	col_bigint
8-9	NULL	2	-1018	8
-10	NULL	NULL	-100	NULL
99	NULL	NULL	-10	NULL
139	NULL	NULL	-9	NULL
0	NULL	158	-1	NULL
0	NULL	158	0	NULL
2	NULL	NULL	1	NULL
NULL	NULL	5	4	NULL
NULL	5	158	9	9
NULL	NULL	158	10	10
NULL	NULL	5	13	NULL
NULL	NULL	5	32	NULL
NULL	10	5	83	NULL
NULL	NULL	5	86	NULL
NULL	9	158	99	99
NULL	NULL	5	123	NULL
-10	NULL	NULL	154	NULL
SELECT UPPER( col_char_12 ) FROM table0_bigint WHERE col_bigint_key BETWEEN SUBSTR( CAST( ( ROUND( ROUND( 99 + -1 ) + 99 ) ) AS CHAR(100) ) , 1 , 12 ) AND SUBSTR( CAST( ( LENGTH( SUBSTR( CAST( ( SIGN ( -100 ) ) AS CHAR(100) ) , 1 , 12 ) ) ) AS CHAR(100) ) , 1 , 12 ) GROUP BY col_char_12 ORDER BY col_char_12 LIMIT 9 , 4;
UPPER( col_char_12 )
SELECT UPPER( col_char_12_key ) FROM table0_bigint WHERE col_char_12_key BETWEEN CAST( 3 AS CHAR(100) ) AND CAST( 6 AS CHAR(100) ) GROUP BY col_char_12_key ORDER BY col_char_12_key LIMIT 7 , 1 /* RESULTSET_HAS_ZERO_OR_ONE_ROWS */;
UPPER( col_char_12_key )
SELECT pk , col_bigint , col_char_12 FROM table0_bigint WHERE SUBSTR( CAST( ( LENGTH('ISWAC') ) AS CHAR(100) ) , 1 , 12 ) < CEIL ( LENGTH('BEFDQ') ) ORDER BY col_bigint_key , col_char_12,pk DESC , pk  LIMIT 144 , 2;
pk	col_bigint	col_char_12
INSERT INTO table0_bigint ( pk , col_bigint_key, col_char_12 ) VALUES ( -10 , SUBSTR( CAST( ( ROUND( -9 - -10 ) ) AS CHAR(100) ) , 1 , 12 ) , SUBSTR( CAST( ( LENGTH( SUBSTR( CAST( ( ROUND( SIGN ( ROUND( 206 - LENGTH( SUBSTR( CAST( ( ROUND( -100 + 9 ) ) AS CHAR(100) ) , 1 , 12 ) ) ) ) * 1 ) ) AS CHAR(100) ) , 1 , 12 ) ) ) AS CHAR(100) ) , 1 , 12 ) ) ;
ERROR 23000: Duplicate entry '-10' for key 'PRIMARY'
SELECT * FROM table0_bigint ORDER BY pk;
col_char_12_key	col_char_12	col_bigint_key	pk	col_bigint
8-9	NULL	2	-1018	8
-10	NULL	NULL	-100	NULL
99	NULL	NULL	-10	NULL
139	NULL	NULL	-9	NULL
0	NULL	158	-1	NULL
0	NULL	158	0	NULL
2	NULL	NULL	1	NULL
NULL	NULL	5	4	NULL
NULL	5	158	9	9
NULL	NULL	158	10	10
NULL	NULL	5	13	NULL
NULL	NULL	5	32	NULL
NULL	10	5	83	NULL
NULL	NULL	5	86	NULL
NULL	9	158	99	99
NULL	NULL	5	123	NULL
-10	NULL	NULL	154	NULL
SELECT col_bigint_key , col_char_12_key FROM table0_bigint WHERE pk = ( SUBSTR( CAST( ( FLOOR ( 10 ) ) AS CHAR(100) ) , 1 , 12 ) ) ORDER BY col_bigint_key  , pk  LIMIT 6 /* RESULTSET_HAS_ZERO_OR_ONE_ROWS */;
col_bigint_key	col_char_12_key
158	NULL
INSERT INTO table0_bigint (pk) VALUES ( 1 ) ;
ERROR 23000: Duplicate entry '1' for key 'PRIMARY'
SELECT * FROM table0_bigint ORDER BY pk;
col_char_12_key	col_char_12	col_bigint_key	pk	col_bigint
8-9	NULL	2	-1018	8
-10	NULL	NULL	-100	NULL
99	NULL	NULL	-10	NULL
139	NULL	NULL	-9	NULL
0	NULL	158	-1	NULL
0	NULL	158	0	NULL
2	NULL	NULL	1	NULL
NULL	NULL	5	4	NULL
NULL	5	158	9	9
NULL	NULL	158	10	10
NULL	NULL	5	13	NULL
NULL	NULL	5	32	NULL
NULL	10	5	83	NULL
NULL	NULL	5	86	NULL
NULL	9	158	99	99
NULL	NULL	5	123	NULL
-10	NULL	NULL	154	NULL
SELECT col_bigint,col_bigint_key,col_char_12,col_char_12_key,pk FROM table0_bigint WHERE col_bigint_key BETWEEN SUBSTR( CAST( ( ROUND( 9 * FLOOR ( 3 ) ) ) AS CHAR(100) ) , 1 , 12 ) AND SUBSTR( CAST( ( SIGN ( FLOOR ( 2 ) ) ) AS CHAR(100) ) , 1 , 12 ) ORDER BY col_bigint_key  , col_char_12 DESC , pk  LIMIT 1 /* RESULTSET_HAS_ZERO_OR_ONE_ROWS */;
col_bigint	col_bigint_key	col_char_12	col_char_12_key	pk
SELECT * FROM table0_bigint WHERE NOT ( col_bigint_key = SUBSTR( CAST( ( ROUND( 248 + -100 ) ) AS CHAR(100) ) , 1 , 12 ) ) AND  ( pk < SUBSTR( CAST( ( LENGTH( SUBSTR( CAST( ( SIGN ( -100 ) ) AS CHAR(100) ) , 1 , 12 ) ) ) AS CHAR(100) ) , 1 , 12 ) ) AND NOT ( col_bigint_key = SUBSTR( CAST( ( LENGTH('TRWQQ') ) AS CHAR(100) ) , 1 , 12 ) ) OR NOT ( col_char_12_key = SUBSTR( CAST( ( FLOOR ( 0 ) ) AS CHAR(100) ) , 1 , 12 ) ) OR NOT ( col_char_12 <> SUBSTR( CAST( ( ROUND( SIGN ( CEIL ( 200 ) ) - 10 ) ) AS CHAR(100) ) , 1 , 12 ) ) ORDER BY col_bigint_key , pk  LIMIT 4 , 1;
col_char_12_key	col_char_12	col_bigint_key	pk	col_bigint
-10	NULL	NULL	154	NULL
INSERT INTO table0_bigint (pk) VALUES ( 1 ) ;
ERROR 23000: Duplicate entry '1' for key 'PRIMARY'
SELECT * FROM table0_bigint ORDER BY pk;
col_char_12_key	col_char_12	col_bigint_key	pk	col_bigint
8-9	NULL	2	-1018	8
-10	NULL	NULL	-100	NULL
99	NULL	NULL	-10	NULL
139	NULL	NULL	-9	NULL
0	NULL	158	-1	NULL
0	NULL	158	0	NULL
2	NULL	NULL	1	NULL
NULL	NULL	5	4	NULL
NULL	5	158	9	9
NULL	NULL	158	10	10
NULL	NULL	5	13	NULL
NULL	NULL	5	32	NULL
NULL	10	5	83	NULL
NULL	NULL	5	86	NULL
NULL	9	158	99	99
NULL	NULL	5	123	NULL
-10	NULL	NULL	154	NULL
SELECT * FROM table0_bigint WHERE SIGN ( 1 ) > col_bigint_key ORDER BY col_bigint_key , pk DESC LIMIT 7 , 1 /* RESULTSET_HAS_ZERO_OR_ONE_ROWS */;
col_char_12_key	col_char_12	col_bigint_key	pk	col_bigint
SELECT pk , col_char_12_key FROM table0_bigint WHERE col_bigint > ( SUBSTR( CAST( ( ROUND( LENGTH('XQDYK') + -1 ) ) AS CHAR(100) ) , 1 , 12 ) ) AND col_char_12_key != ( SUBSTR( CAST( ( LENGTH('XKEOO') ) AS CHAR(100) ) , 1 , 12 ) ) ORDER BY col_char_12_key , pk  LIMIT 1 , 2;
pk	col_char_12_key
SELECT 1 FROM table0_bigint WHERE SUBSTR( CAST( ( SIGN ( ROUND( ROUND( FLOOR ( CEIL ( ROUND ( 0 ) ) ) + 3 ) * 10 ) ) ) AS CHAR(100) ) , 1 , 12 ) < ROUND( -100 + 1 ) FOR UPDATE;
1
SELECT * FROM table0_bigint WHERE col_bigint_key IN ( CAST(1 AS CHAR(100)) , CAST(149 AS CHAR(100)) , CAST(10 AS CHAR(100)) ) ORDER BY pk  , pk  LIMIT 2;
col_char_12_key	col_char_12	col_bigint_key	pk	col_bigint
UPDATE table0_bigint SET col_char_12_key = col_char_12_key WHERE pk BETWEEN SUBSTR( CAST( ( CEIL ( 1 ) ) AS CHAR(100) ) , 1 , 12 ) AND SUBSTR( CAST( ( ABS ( ROUND( 10 - 0 ) ) ) AS CHAR(100) ) , 1 , 12 ) ORDER BY col_bigint_key , col_char_12_key , col_bigint_key , pk DESC LIMIT 24 ;
SELECT * FROM table0_bigint ORDER BY pk;
col_char_12_key	col_char_12	col_bigint_key	pk	col_bigint
8-9	NULL	2	-1018	8
-10	NULL	NULL	-100	NULL
99	NULL	NULL	-10	NULL
139	NULL	NULL	-9	NULL
0	NULL	158	-1	NULL
0	NULL	158	0	NULL
2	NULL	NULL	1	NULL
NULL	NULL	5	4	NULL
NULL	5	158	9	9
NULL	NULL	158	10	10
NULL	NULL	5	13	NULL
NULL	NULL	5	32	NULL
NULL	10	5	83	NULL
NULL	NULL	5	86	NULL
NULL	9	158	99	99
NULL	NULL	5	123	NULL
-10	NULL	NULL	154	NULL
SELECT pk FROM table0_bigint WHERE 99 <= LENGTH( SUBSTR( CAST( ( 1 ) AS CHAR(100) ) , 1 , 12 ) ) ORDER BY col_char_12 DESC , pk  LIMIT 8 , 1 /* RESULTSET_HAS_ZERO_OR_ONE_ROWS */;
pk
SELECT 1 FROM table0_bigint WHERE ( -399769600 , 751697920 ) IN ( ( SUBSTR( CAST( ( LENGTH( SUBSTR( CAST( ( LENGTH( SUBSTR( CAST( ( ROUND( LENGTH('YERFO') + -10 ) ) AS CHAR(100) ) , 1 , 12 ) ) ) AS CHAR(100) ) , 1 , 12 ) ) ) AS CHAR(100) ) , 1 , 12 ) , SUBSTR( CAST( ( LENGTH( SUBSTR( CAST( ( ROUND( LENGTH( SUBSTR( CAST( ( SIGN ( LENGTH( SUBSTR( CAST( ( ROUND( 10 + 9 ) ) AS CHAR(100) ) , 1 , 12 ) ) ) ) AS CHAR(100) ) , 1 , 12 ) ) + -100 ) ) AS CHAR(100) ) , 1 , 12 ) ) ) AS CHAR(100) ) , 1 , 12 ) ) , ( SUBSTR( CAST( ( FLOOR ( LENGTH( SUBSTR( CAST( ( LENGTH( SUBSTR( CAST( ( ROUND( LENGTH('HZSOY') * -10 ) ) AS CHAR(100) ) , 1 , 12 ) ) ) AS CHAR(100) ) , 1 , 12 ) ) ) ) AS CHAR(100) ) , 1 , 12 ) , SUBSTR( CAST( ( LENGTH('ZHCDJ') ) AS CHAR(100) ) , 1 , 12 ) ) ) FOR UPDATE;
1
INSERT INTO table0_bigint ( pk , col_char_12_key ) VALUES ( 5, CAST( 1 AS CHAR(100)) ) , ( -9, CAST( 9 AS CHAR(100)) ) ;
ERROR 23000: Duplicate entry '-9' for key 'PRIMARY'
SELECT * FROM table0_bigint ORDER BY pk;
col_char_12_key	col_char_12	col_bigint_key	pk	col_bigint
8-9	NULL	2	-1018	8
-10	NULL	NULL	-100	NULL
99	NULL	NULL	-10	NULL
139	NULL	NULL	-9	NULL
0	NULL	158	-1	NULL
0	NULL	158	0	NULL
2	NULL	NULL	1	NULL
NULL	NULL	5	4	NULL
NULL	5	158	9	9
NULL	NULL	158	10	10
NULL	NULL	5	13	NULL
NULL	NULL	5	32	NULL
NULL	10	5	83	NULL
NULL	NULL	5	86	NULL
NULL	9	158	99	99
NULL	NULL	5	123	NULL
-10	NULL	NULL	154	NULL
INSERT INTO table0_bigint ( pk , col_char_12_key ) VALUES ( 1 , SUBSTR( CAST( ( 8 ) AS CHAR(100) ) , 1 , 12 ) ) ;
ERROR 23000: Duplicate entry '1' for key 'PRIMARY'
SELECT * FROM table0_bigint ORDER BY pk;
col_char_12_key	col_char_12	col_bigint_key	pk	col_bigint
8-9	NULL	2	-1018	8
-10	NULL	NULL	-100	NULL
99	NULL	NULL	-10	NULL
139	NULL	NULL	-9	NULL
0	NULL	158	-1	NULL
0	NULL	158	0	NULL
2	NULL	NULL	1	NULL
NULL	NULL	5	4	NULL
NULL	5	158	9	9
NULL	NULL	158	10	10
NULL	NULL	5	13	NULL
NULL	NULL	5	32	NULL
NULL	10	5	83	NULL
NULL	NULL	5	86	NULL
NULL	9	158	99	99
NULL	NULL	5	123	NULL
-10	NULL	NULL	154	NULL
SELECT col_bigint_key , col_char_12_key FROM table0_bigint WHERE col_bigint BETWEEN SUBSTR( CAST( ( ROUND( LENGTH('JSARD') * 16 ) ) AS CHAR(100) ) , 1 , 12 ) AND SUBSTR( CAST( ( -100 ) AS CHAR(100) ) , 1 , 12 ) ORDER BY col_char_12_key , col_bigint_key , col_char_12_key , pk ASC LIMIT 5 , 1 /* RESULTSET_HAS_ZERO_OR_ONE_ROWS */;
col_bigint_key	col_char_12_key
SELECT COUNT( col_char_12 ) FROM table0_bigint WHERE 60 <= 0 ORDER BY col_char_12_key , pk DESC LIMIT 4 /* RESULTSET_HAS_ZERO_OR_ONE_ROWS */;
COUNT( col_char_12 )
0
SELECT pk , col_bigint , col_char_12 FROM table0_bigint WHERE pk >= -376963072 and pk <= -376963072 ORDER BY col_bigint_key , col_char_12_key , col_char_12_key , pk ASC LIMIT 3 , 2 /* RESULTSET_HAS_ZERO_OR_ONE_ROWS */;
pk	col_bigint	col_char_12
SELECT * FROM table0_bigint WHERE SUBSTR( CAST( ( ABS ( -10 ) ) AS CHAR(100) ) , 1 , 12 ) <= 1 ORDER BY col_char_12_key , col_char_12_key , col_bigint_key , pk DESC LIMIT 4;
col_char_12_key	col_char_12	col_bigint_key	pk	col_bigint
SELECT UPPER( col_bigint_key ),pk FROM table0_bigint WHERE pk = 221 GROUP BY col_bigint_key,pk ORDER BY col_bigint_key,pk LIMIT 1;
UPPER( col_bigint_key )	pk
SELECT 1 FROM table0_bigint WHERE 183 <= LENGTH('UQETY') FOR UPDATE;
1
SELECT 1 FROM table0_bigint WHERE SUBSTR( CAST( ( ROUND( ROUND( -10 + -100 ) * 0 ) ) AS CHAR(100) ) , 1 , 12 ) = LENGTH( SUBSTR( CAST( ( FLOOR ( 1 ) ) AS CHAR(100) ) , 1 , 12 ) ) FOR UPDATE;
1
SELECT col_bigint,col_bigint_key,col_char_12,col_char_12_key,pk FROM table0_bigint WHERE pk = -1 ORDER BY col_bigint DESC , col_char_12_key DESC , pk  LIMIT 2 /* RESULTSET_HAS_ZERO_OR_ONE_ROWS */;
col_bigint	col_bigint_key	col_char_12	col_char_12_key	pk
NULL	158	NULL	0	-1
INSERT INTO table0_bigint ( pk , col_char_12_key ) VALUES ( -9 , SUBSTR( CAST( ( LENGTH( SUBSTR( CAST( ( ROUND( 99 + LENGTH( SUBSTR( CAST( ( ROUND( -100 * -100 ) ) AS CHAR(100) ) , 1 , 12 ) ) ) ) AS CHAR(100) ) , 1 , 12 ) ) ) AS CHAR(100) ) , 1 , 12 ) ) ;
ERROR 23000: Duplicate entry '-9' for key 'PRIMARY'
SELECT * FROM table0_bigint ORDER BY pk;
col_char_12_key	col_char_12	col_bigint_key	pk	col_bigint
8-9	NULL	2	-1018	8
-10	NULL	NULL	-100	NULL
99	NULL	NULL	-10	NULL
139	NULL	NULL	-9	NULL
0	NULL	158	-1	NULL
0	NULL	158	0	NULL
2	NULL	NULL	1	NULL
NULL	NULL	5	4	NULL
NULL	5	158	9	9
NULL	NULL	158	10	10
NULL	NULL	5	13	NULL
NULL	NULL	5	32	NULL
NULL	10	5	83	NULL
NULL	NULL	5	86	NULL
NULL	9	158	99	99
NULL	NULL	5	123	NULL
-10	NULL	NULL	154	NULL
INSERT INTO table0_bigint ( pk , col_bigint_key ) VALUES ( 9 , SUBSTR( CAST( ( CEIL ( LENGTH( SUBSTR( CAST( ( ROUND( 235 + 9 ) ) AS CHAR(100) ) , 1 , 12 ) ) ) ) AS CHAR(100) ) , 1 , 12 ) ) ;
ERROR 23000: Duplicate entry '9' for key 'PRIMARY'
SELECT * FROM table0_bigint ORDER BY pk;
col_char_12_key	col_char_12	col_bigint_key	pk	col_bigint
8-9	NULL	2	-1018	8
-10	NULL	NULL	-100	NULL
99	NULL	NULL	-10	NULL
139	NULL	NULL	-9	NULL
0	NULL	158	-1	NULL
0	NULL	158	0	NULL
2	NULL	NULL	1	NULL
NULL	NULL	5	4	NULL
NULL	5	158	9	9
NULL	NULL	158	10	10
NULL	NULL	5	13	NULL
NULL	NULL	5	32	NULL
NULL	10	5	83	NULL
NULL	NULL	5	86	NULL
NULL	9	158	99	99
NULL	NULL	5	123	NULL
-10	NULL	NULL	154	NULL
SELECT pk , col_bigint , col_char_12 FROM table0_bigint WHERE col_bigint_key <> ( SUBSTR( CAST( ( ROUND ( 99 ) ) AS CHAR(100) ) , 1 , 12 ) ) ORDER BY col_char_12_key ASC , pk DESC LIMIT 5 , 1 /* RESULTSET_HAS_ZERO_OR_ONE_ROWS */;
pk	col_bigint	col_char_12
13	NULL	NULL
SELECT col_bigint FROM table0_bigint WHERE ( 395771904 ) NOT IN ( SUBSTR( CAST( ( 179 ) AS CHAR(100) ) , 1 , 12 ) , SUBSTR( CAST( ( FLOOR ( ROUND( 0 + LENGTH( SUBSTR( CAST( ( SIGN ( -1 ) ) AS CHAR(100) ) , 1 , 12 ) ) ) ) ) AS CHAR(100) ) , 1 , 12 ) , SUBSTR( CAST( ( 99 ) AS CHAR(100) ) , 1 , 12 ) , SUBSTR( CAST( ( FLOOR ( 0 ) ) AS CHAR(100) ) , 1 , 12 ) , SUBSTR( CAST( ( ROUND( -100 + -100 ) ) AS CHAR(100) ) , 1 , 12 ) ) ORDER BY col_char_12 ASC , pk DESC LIMIT 145 , 1 /* RESULTSET_HAS_ZERO_OR_ONE_ROWS */;
col_bigint
SELECT UPPER( col_char_12_key ),pk FROM table0_bigint WHERE pk NOT IN ( -100 , 8 , -9 , 76 , 10 ) GROUP BY col_char_12_key,pk ORDER BY col_char_12_key,pk LIMIT 4 , 4;
UPPER( col_char_12_key )	pk
NULL	83
NULL	86
NULL	99
NULL	123
SELECT * FROM table0_bigint WHERE LENGTH( SUBSTR( CAST( ( ROUND( LENGTH('NCRWY') + 1 ) ) AS CHAR(100) ) , 1 , 12 ) ) != LENGTH('ZUUZB') ORDER BY col_char_12_key , pk  LIMIT 1;
col_char_12_key	col_char_12	col_bigint_key	pk	col_bigint
NULL	NULL	5	4	NULL
SELECT col_bigint,col_bigint_key,col_char_12,col_char_12_key,pk FROM table0_bigint WHERE pk > 9 ORDER BY col_bigint_key , pk DESC LIMIT 2;
col_bigint	col_bigint_key	col_char_12	col_char_12_key	pk
NULL	NULL	NULL	-10	154
NULL	5	NULL	NULL	123
SELECT col_char_12_key FROM table0_bigint WHERE col_char_12 <> ( SUBSTR( CAST( ( ROUND( -9 - -9 ) ) AS CHAR(100) ) , 1 , 12 ) ) AND col_char_12_key <> ( SUBSTR( CAST( ( ROUND( -100 + CEIL ( -100 ) ) ) AS CHAR(100) ) , 1 , 12 ) ) ORDER BY pk LIMIT 2 , 1 /* RESULTSET_HAS_ZERO_OR_ONE_ROWS */;
col_char_12_key
INSERT INTO table0_bigint (pk) VALUES ( 9 ) ;
ERROR 23000: Duplicate entry '9' for key 'PRIMARY'
SELECT * FROM table0_bigint ORDER BY pk;
col_char_12_key	col_char_12	col_bigint_key	pk	col_bigint
8-9	NULL	2	-1018	8
-10	NULL	NULL	-100	NULL
99	NULL	NULL	-10	NULL
139	NULL	NULL	-9	NULL
0	NULL	158	-1	NULL
0	NULL	158	0	NULL
2	NULL	NULL	1	NULL
NULL	NULL	5	4	NULL
NULL	5	158	9	9
NULL	NULL	158	10	10
NULL	NULL	5	13	NULL
NULL	NULL	5	32	NULL
NULL	10	5	83	NULL
NULL	NULL	5	86	NULL
NULL	9	158	99	99
NULL	NULL	5	123	NULL
-10	NULL	NULL	154	NULL
SELECT * FROM table0_bigint WHERE pk IN ( SUBSTR( CAST( ( ROUND( 9 - -1 ) ) AS CHAR(100) ) , 1 , 12 ) , SUBSTR( CAST( ( ROUND( 0 * 99 ) ) AS CHAR(100) ) , 1 , 12 ) , SUBSTR( CAST( ( ROUND( 9 - -10 ) ) AS CHAR(100) ) , 1 , 12 ) , SUBSTR( CAST( ( ROUND( -100 * 62 ) ) AS CHAR(100) ) , 1 , 12 ) , SUBSTR( CAST( ( LENGTH('SYGXO') ) AS CHAR(100) ) , 1 , 12 ) ) ORDER BY col_bigint_key  , col_char_12 ASC , pk  LIMIT 5 , 5;
col_char_12_key	col_char_12	col_bigint_key	pk	col_bigint
SELECT ALL UPPER( col_bigint_key ) FROM table0_bigint WHERE CEIL ( ROUND( 10 * 99 ) ) = FLOOR ( -100 ) ORDER BY col_bigint ASC , col_char_12_key  , pk ;
UPPER( col_bigint_key )
INSERT INTO table0_bigint ( pk , col_bigint_key, col_char_12 ) VALUES ( 1 , SUBSTR( CAST( ( ROUND( 1 - ROUND( 99 - 0 ) ) ) AS CHAR(100) ) , 1 , 12 ) , SUBSTR( CAST( ( ROUND ( ROUND( 9 * 10 ) ) ) AS CHAR(100) ) , 1 , 12 ) ) ;
ERROR 23000: Duplicate entry '1' for key 'PRIMARY'
SELECT * FROM table0_bigint ORDER BY pk;
col_char_12_key	col_char_12	col_bigint_key	pk	col_bigint
8-9	NULL	2	-1018	8
-10	NULL	NULL	-100	NULL
99	NULL	NULL	-10	NULL
139	NULL	NULL	-9	NULL
0	NULL	158	-1	NULL
0	NULL	158	0	NULL
2	NULL	NULL	1	NULL
NULL	NULL	5	4	NULL
NULL	5	158	9	9
NULL	NULL	158	10	10
NULL	NULL	5	13	NULL
NULL	NULL	5	32	NULL
NULL	10	5	83	NULL
NULL	NULL	5	86	NULL
NULL	9	158	99	99
NULL	NULL	5	123	NULL
-10	NULL	NULL	154	NULL
INSERT INTO table0_bigint (pk) VALUES ( 0 ) ;
ERROR 23000: Duplicate entry '0' for key 'PRIMARY'
SELECT * FROM table0_bigint ORDER BY pk;
col_char_12_key	col_char_12	col_bigint_key	pk	col_bigint
8-9	NULL	2	-1018	8
-10	NULL	NULL	-100	NULL
99	NULL	NULL	-10	NULL
139	NULL	NULL	-9	NULL
0	NULL	158	-1	NULL
0	NULL	158	0	NULL
2	NULL	NULL	1	NULL
NULL	NULL	5	4	NULL
NULL	5	158	9	9
NULL	NULL	158	10	10
NULL	NULL	5	13	NULL
NULL	NULL	5	32	NULL
NULL	10	5	83	NULL
NULL	NULL	5	86	NULL
NULL	9	158	99	99
NULL	NULL	5	123	NULL
-10	NULL	NULL	154	NULL
SELECT 1 FROM table0_bigint WHERE pk > 0 FOR UPDATE;
1
1
1
1
1
1
1
1
1
1
1
1
SELECT  9999 FROM table0_bigint ORDER BY col_char_12_key , pk DESC;
9999
9999
9999
9999
9999
9999
9999
9999
9999
9999
9999
9999
9999
9999
9999
9999
9999
9999
SELECT pk , col_bigint , col_char_12_key FROM table0_bigint WHERE CEIL ( ROUND( ROUND( 9 + ROUND( -1 - LENGTH('YDBAM') ) ) - 0 ) ) < -9 ORDER BY col_bigint  , col_char_12  , pk  LIMIT 2 , 1 /* RESULTSET_HAS_ZERO_OR_ONE_ROWS */;
pk	col_bigint	col_char_12_key
INSERT INTO table0_bigint ( pk , col_bigint, col_char_12_key ) VALUES ( 232 , SUBSTR( CAST( ( ROUND( CEIL ( LENGTH('VTSJZ') ) - 1 ) ) AS CHAR(100) ) , 1 , 12 ) , SUBSTR( CAST( ( CEIL ( ROUND( ABS ( 10 ) + -100 ) ) ) AS CHAR(100) ) , 1 , 12 ) ) ;
SELECT * FROM table0_bigint ORDER BY pk;
col_char_12_key	col_char_12	col_bigint_key	pk	col_bigint
8-9	NULL	2	-1018	8
-10	NULL	NULL	-100	NULL
99	NULL	NULL	-10	NULL
139	NULL	NULL	-9	NULL
0	NULL	158	-1	NULL
0	NULL	158	0	NULL
2	NULL	NULL	1	NULL
NULL	NULL	5	4	NULL
NULL	5	158	9	9
NULL	NULL	158	10	10
NULL	NULL	5	13	NULL
NULL	NULL	5	32	NULL
NULL	10	5	83	NULL
NULL	NULL	5	86	NULL
NULL	9	158	99	99
NULL	NULL	5	123	NULL
-10	NULL	NULL	154	NULL
-90	NULL	NULL	232	4
SELECT 1 FROM table0_bigint WHERE col_bigint >= ( SUBSTR( CAST( ( ABS ( 1 ) ) AS CHAR(100) ) , 1 , 12 ) ) FOR UPDATE;
1
1
1
1
1
1
SELECT * FROM table0_bigint WHERE col_bigint BETWEEN SUBSTR( CAST( ( LENGTH('LHLAL') ) AS CHAR(100) ) , 1 , 12 ) AND SUBSTR( CAST( ( ROUND( 10 * CEIL ( LENGTH( SUBSTR( CAST( ( ROUND( -1 * SIGN ( SIGN ( 39 ) ) ) ) AS CHAR(100) ) , 1 , 12 ) ) ) ) ) AS CHAR(100) ) , 1 , 12 ) ORDER BY col_bigint_key  , pk ASC LIMIT 8 , 8;
col_char_12_key	col_char_12	col_bigint_key	pk	col_bigint
SELECT col_bigint_key FROM table0_bigint WHERE col_bigint_key NOT IN ( CAST(0 AS CHAR(100)) , CAST(185 AS CHAR(100)) , CAST(-100 AS CHAR(100)) ) ORDER BY col_bigint_key , col_char_12_key , pk  LIMIT 5 , 1 /* RESULTSET_HAS_ZERO_OR_ONE_ROWS */;
col_bigint_key
5
SELECT DISTINCT NULL , UPPER( col_bigint ) , TRUE , FALSE , 1 FROM table0_bigint ORDER BY col_char_12_key , col_char_12_key , pk ;
NULL	UPPER( col_bigint )	TRUE	FALSE	1
NULL	9	1	0	1
NULL	10	1	0	1
NULL	99	1	0	1
NULL	NULL	1	0	1
NULL	4	1	0	1
NULL	8	1	0	1
INSERT INTO table0_bigint ( pk , col_bigint_key ) VALUES ( 99 , SUBSTR( CAST( ( LENGTH( SUBSTR( CAST( ( FLOOR ( ROUND( -1 + SIGN ( -100 ) ) ) ) AS CHAR(100) ) , 1 , 12 ) ) ) AS CHAR(100) ) , 1 , 12 ) ) ;
ERROR 23000: Duplicate entry '99' for key 'PRIMARY'
SELECT * FROM table0_bigint ORDER BY pk;
col_char_12_key	col_char_12	col_bigint_key	pk	col_bigint
8-9	NULL	2	-1018	8
-10	NULL	NULL	-100	NULL
99	NULL	NULL	-10	NULL
139	NULL	NULL	-9	NULL
0	NULL	158	-1	NULL
0	NULL	158	0	NULL
2	NULL	NULL	1	NULL
NULL	NULL	5	4	NULL
NULL	5	158	9	9
NULL	NULL	158	10	10
NULL	NULL	5	13	NULL
NULL	NULL	5	32	NULL
NULL	10	5	83	NULL
NULL	NULL	5	86	NULL
NULL	9	158	99	99
NULL	NULL	5	123	NULL
-10	NULL	NULL	154	NULL
-90	NULL	NULL	232	4
SELECT UPPER( col_bigint ) FROM table0_bigint WHERE col_char_12_key IN ( CAST(10 AS CHAR(100)) , CAST(9 AS CHAR(100)) , CAST(105 AS CHAR(100)) ) GROUP BY col_bigint ORDER BY col_bigint LIMIT 162 , 1 /* RESULTSET_HAS_ZERO_OR_ONE_ROWS */;
UPPER( col_bigint )
SELECT col_char_12_key,pk FROM table0_bigint WHERE ( 1454243840 , -1945763840 , -610861056 ) NOT IN ( ( SUBSTR( CAST( ( SIGN ( ROUND ( 1 ) ) ) AS CHAR(100) ) , 1 , 12 ) , SUBSTR( CAST( ( LENGTH( SUBSTR( CAST( ( ROUND( 9 + ROUND( -10 - CEIL ( ROUND( 9 + ROUND( -1 * -100 ) ) ) ) ) ) AS CHAR(100) ) , 1 , 12 ) ) ) AS CHAR(100) ) , 1 , 12 ) , SUBSTR( CAST( ( ROUND( 5 + 1 ) ) AS CHAR(100) ) , 1 , 12 ) ) , ( SUBSTR( CAST( ( CEIL ( 7 ) ) AS CHAR(100) ) , 1 , 12 ) , SUBSTR( CAST( ( LENGTH('XSECK') ) AS CHAR(100) ) , 1 , 12 ) , SUBSTR( CAST( ( CEIL ( 99 ) ) AS CHAR(100) ) , 1 , 12 ) ) ) GROUP BY col_char_12_key,pk ORDER BY col_char_12_key,pk LIMIT 123 , 2;
col_char_12_key	pk
SELECT COUNT( col_bigint_key ) FROM table0_bigint WHERE col_bigint_key IN ( SUBSTR( CAST( ( LENGTH( SUBSTR( CAST( ( ROUND ( LENGTH( SUBSTR( CAST( ( ROUND( -100 - FLOOR ( FLOOR ( ABS ( ROUND( -100 * CEIL ( -1 ) ) ) ) ) ) ) AS CHAR(100) ) , 1 , 12 ) ) ) ) AS CHAR(100) ) , 1 , 12 ) ) ) AS CHAR(100) ) , 1 , 12 ) , SUBSTR( CAST( ( LENGTH( SUBSTR( CAST( ( LENGTH( SUBSTR( CAST( ( ROUND( ROUND( ROUND( ROUND( LENGTH( SUBSTR( CAST( ( LENGTH('AKDLP') ) AS CHAR(100) ) , 1 , 12 ) ) - 203 ) - 1 ) * 99 ) * -9 ) ) AS CHAR(100) ) , 1 , 12 ) ) ) AS CHAR(100) ) , 1 , 12 ) ) ) AS CHAR(100) ) , 1 , 12 ) , SUBSTR( CAST( ( 99 ) AS CHAR(100) ) , 1 , 12 ) , SUBSTR( CAST( ( ROUND( LENGTH('JAHFF') - 9 ) ) AS CHAR(100) ) , 1 , 12 ) , SUBSTR( CAST( ( LENGTH('ARQGM') ) AS CHAR(100) ) , 1 , 12 ) ) ORDER BY col_char_12_key , col_bigint_key , col_char_12_key , pk ASC LIMIT 77 , 1 /* RESULTSET_HAS_ZERO_OR_ONE_ROWS */;
COUNT( col_bigint_key )
INSERT INTO table0_bigint ( pk , col_char_12_key ) VALUES ( 9 , SUBSTR( CAST( ( ROUND ( CEIL ( -10 ) ) ) AS CHAR(100) ) , 1 , 12 ) ) ;
ERROR 23000: Duplicate entry '9' for key 'PRIMARY'
SELECT * FROM table0_bigint ORDER BY pk;
col_char_12_key	col_char_12	col_bigint_key	pk	col_bigint
8-9	NULL	2	-1018	8
-10	NULL	NULL	-100	NULL
99	NULL	NULL	-10	NULL
139	NULL	NULL	-9	NULL
0	NULL	158	-1	NULL
0	NULL	158	0	NULL
2	NULL	NULL	1	NULL
NULL	NULL	5	4	NULL
NULL	5	158	9	9
NULL	NULL	158	10	10
NULL	NULL	5	13	NULL
NULL	NULL	5	32	NULL
NULL	10	5	83	NULL
NULL	NULL	5	86	NULL
NULL	9	158	99	99
NULL	NULL	5	123	NULL
-10	NULL	NULL	154	NULL
-90	NULL	NULL	232	4
SELECT COUNT( col_char_12_key ) FROM table0_bigint WHERE col_bigint BETWEEN SUBSTR( CAST( ( 10 ) AS CHAR(100) ) , 1 , 12 ) AND SUBSTR( CAST( ( ROUND( -9 + FLOOR ( 6 ) ) ) AS CHAR(100) ) , 1 , 12 ) ORDER BY pk , col_char_12_key,pk DESC , pk ASC LIMIT 1 /* RESULTSET_HAS_ZERO_OR_ONE_ROWS */;
COUNT( col_char_12_key )
0
SELECT pk FROM table0_bigint WHERE col_char_12_key > ( SUBSTR( CAST( ( SIGN ( 0 ) ) AS CHAR(100) ) , 1 , 12 ) ) AND col_bigint_key = ( SUBSTR( CAST( ( ROUND( -9 * ROUND( 194 * -1 ) ) ) AS CHAR(100) ) , 1 , 12 ) ) ORDER BY col_bigint_key , col_char_12_key , pk DESC LIMIT 115 , 4;
pk
INSERT INTO table0_bigint ( pk , col_bigint, col_char_12 ) VALUES ( 10 , SUBSTR( CAST( ( 101 ) AS CHAR(100) ) , 1 , 12 ) , SUBSTR( CAST( ( ABS ( LENGTH( SUBSTR( CAST( ( ROUND( -10 * 10 ) ) AS CHAR(100) ) , 1 , 12 ) ) ) ) AS CHAR(100) ) , 1 , 12 ) ) ;
ERROR 23000: Duplicate entry '10' for key 'PRIMARY'
SELECT * FROM table0_bigint ORDER BY pk;
col_char_12_key	col_char_12	col_bigint_key	pk	col_bigint
8-9	NULL	2	-1018	8
-10	NULL	NULL	-100	NULL
99	NULL	NULL	-10	NULL
139	NULL	NULL	-9	NULL
0	NULL	158	-1	NULL
0	NULL	158	0	NULL
2	NULL	NULL	1	NULL
NULL	NULL	5	4	NULL
NULL	5	158	9	9
NULL	NULL	158	10	10
NULL	NULL	5	13	NULL
NULL	NULL	5	32	NULL
NULL	10	5	83	NULL
NULL	NULL	5	86	NULL
NULL	9	158	99	99
NULL	NULL	5	123	NULL
-10	NULL	NULL	154	NULL
-90	NULL	NULL	232	4
INSERT INTO table0_bigint (pk) VALUES ( -10 ) ;
ERROR 23000: Duplicate entry '-10' for key 'PRIMARY'
SELECT * FROM table0_bigint ORDER BY pk;
col_char_12_key	col_char_12	col_bigint_key	pk	col_bigint
8-9	NULL	2	-1018	8
-10	NULL	NULL	-100	NULL
99	NULL	NULL	-10	NULL
139	NULL	NULL	-9	NULL
0	NULL	158	-1	NULL
0	NULL	158	0	NULL
2	NULL	NULL	1	NULL
NULL	NULL	5	4	NULL
NULL	5	158	9	9
NULL	NULL	158	10	10
NULL	NULL	5	13	NULL
NULL	NULL	5	32	NULL
NULL	10	5	83	NULL
NULL	NULL	5	86	NULL
NULL	9	158	99	99
NULL	NULL	5	123	NULL
-10	NULL	NULL	154	NULL
-90	NULL	NULL	232	4
SELECT * FROM table0_bigint  ORDER BY col_bigint_key , col_char_12_key , col_char_12_key , pk DESC LIMIT 2 , 2;
col_char_12_key	col_char_12	col_bigint_key	pk	col_bigint
-90	NULL	NULL	232	4
139	NULL	NULL	-9	NULL
SELECT pk FROM table0_bigint WHERE 0 < 10 ORDER BY col_char_12_key , pk ASC LIMIT 1 , 1 /* RESULTSET_HAS_ZERO_OR_ONE_ROWS */;
pk
9
SELECT col_bigint,col_bigint_key,col_char_12,col_char_12_key,pk FROM table0_bigint WHERE col_bigint_key < CAST(0 AS CHAR(100)) GROUP BY col_bigint,col_bigint_key,col_char_12,col_char_12_key,pk ORDER BY col_bigint,col_bigint_key,col_char_12,col_char_12_key,pk LIMIT 8;
col_bigint	col_bigint_key	col_char_12	col_char_12_key	pk
INSERT INTO table0_bigint ( pk , col_char_12_key ) VALUES ( 0, CAST( -10 AS CHAR(100)) ) , ( -10, CAST( 10 AS CHAR(100)) ) ;
ERROR 23000: Duplicate entry '0' for key 'PRIMARY'
SELECT * FROM table0_bigint ORDER BY pk;
col_char_12_key	col_char_12	col_bigint_key	pk	col_bigint
8-9	NULL	2	-1018	8
-10	NULL	NULL	-100	NULL
99	NULL	NULL	-10	NULL
139	NULL	NULL	-9	NULL
0	NULL	158	-1	NULL
0	NULL	158	0	NULL
2	NULL	NULL	1	NULL
NULL	NULL	5	4	NULL
NULL	5	158	9	9
NULL	NULL	158	10	10
NULL	NULL	5	13	NULL
NULL	NULL	5	32	NULL
NULL	10	5	83	NULL
NULL	NULL	5	86	NULL
NULL	9	158	99	99
NULL	NULL	5	123	NULL
-10	NULL	NULL	154	NULL
-90	NULL	NULL	232	4
SELECT col_bigint,col_bigint_key,col_char_12,col_char_12_key,pk FROM table0_bigint WHERE FLOOR ( 10 ) > SUBSTR( CAST( ( ROUND( -10 + ROUND( FLOOR ( 186 ) + -9 ) ) ) AS CHAR(100) ) , 1 , 12 ) ORDER BY pk LIMIT 1;
col_bigint	col_bigint_key	col_char_12	col_char_12_key	pk
SELECT * FROM table0_bigint WHERE col_bigint <= ABS ( 8 ) ORDER BY col_bigint_key , col_bigint_key , pk ASC LIMIT 4 , 1 /* RESULTSET_HAS_ZERO_OR_ONE_ROWS */;
col_char_12_key	col_char_12	col_bigint_key	pk	col_bigint
SELECT 1 FROM table0_bigint WHERE 65 != FLOOR ( SIGN ( -10 ) ) FOR UPDATE;
1
1
1
1
1
1
1
1
1
1
1
1
1
1
1
1
1
1
1
INSERT INTO table0_bigint ( pk , col_bigint_key ) VALUES ( 10, CAST( -100 AS CHAR(100)) ) , ( 99, CAST( 3 AS CHAR(100)) ) ;
ERROR 23000: Duplicate entry '10' for key 'PRIMARY'
SELECT * FROM table0_bigint ORDER BY pk;
col_char_12_key	col_char_12	col_bigint_key	pk	col_bigint
8-9	NULL	2	-1018	8
-10	NULL	NULL	-100	NULL
99	NULL	NULL	-10	NULL
139	NULL	NULL	-9	NULL
0	NULL	158	-1	NULL
0	NULL	158	0	NULL
2	NULL	NULL	1	NULL
NULL	NULL	5	4	NULL
NULL	5	158	9	9
NULL	NULL	158	10	10
NULL	NULL	5	13	NULL
NULL	NULL	5	32	NULL
NULL	10	5	83	NULL
NULL	NULL	5	86	NULL
NULL	9	158	99	99
NULL	NULL	5	123	NULL
-10	NULL	NULL	154	NULL
-90	NULL	NULL	232	4
SELECT col_bigint , col_char_12 FROM table0_bigint WHERE LENGTH('NNSZC') <> SUBSTR( CAST( ( 44 ) AS CHAR(100) ) , 1 , 12 ) ORDER BY col_bigint_key , col_bigint_key , col_bigint_key , pk ASC LIMIT 3;
col_bigint	col_char_12
NULL	NULL
NULL	NULL
NULL	NULL
UPDATE table0_bigint SET col_char_12_key = col_char_12_key WHERE ( 1347682304 ) NOT IN ( SUBSTR( CAST( ( LENGTH( SUBSTR( CAST( ( ROUND ( 0 ) ) AS CHAR(100) ) , 1 , 12 ) ) ) AS CHAR(100) ) , 1 , 12 ) , SUBSTR( CAST( ( ROUND( -9 * 9 ) ) AS CHAR(100) ) , 1 , 12 ) , SUBSTR( CAST( ( ROUND( 10 - 99 ) ) AS CHAR(100) ) , 1 , 12 ) , SUBSTR( CAST( ( CEIL ( 99 ) ) AS CHAR(100) ) , 1 , 12 ) , SUBSTR( CAST( ( ROUND( ROUND( ROUND( 99 - 2 ) + -9 ) - 0 ) ) AS CHAR(100) ) , 1 , 12 ) ) ORDER BY col_bigint_key,pk DESC , pk DESC LIMIT 6 ;
SELECT * FROM table0_bigint ORDER BY pk;
col_char_12_key	col_char_12	col_bigint_key	pk	col_bigint
8-9	NULL	2	-1018	8
-10	NULL	NULL	-100	NULL
99	NULL	NULL	-10	NULL
139	NULL	NULL	-9	NULL
0	NULL	158	-1	NULL
0	NULL	158	0	NULL
2	NULL	NULL	1	NULL
NULL	NULL	5	4	NULL
NULL	5	158	9	9
NULL	NULL	158	10	10
NULL	NULL	5	13	NULL
NULL	NULL	5	32	NULL
NULL	10	5	83	NULL
NULL	NULL	5	86	NULL
NULL	9	158	99	99
NULL	NULL	5	123	NULL
-10	NULL	NULL	154	NULL
-90	NULL	NULL	232	4
SELECT * FROM table0_bigint WHERE LENGTH('HCCYY') = 10 ORDER BY col_char_12_key , col_bigint_key , pk ASC LIMIT 5 , 3;
col_char_12_key	col_char_12	col_bigint_key	pk	col_bigint
INSERT INTO table0_bigint ( pk , col_bigint_key, col_char_12_key ) VALUES ( 8 , SUBSTR( CAST( ( FLOOR ( 1 ) ) AS CHAR(100) ) , 1 , 12 ) , SUBSTR( CAST( ( LENGTH('DLOLV') ) AS CHAR(100) ) , 1 , 12 ) ) ;
SELECT * FROM table0_bigint ORDER BY pk;
col_char_12_key	col_char_12	col_bigint_key	pk	col_bigint
8-9	NULL	2	-1018	8
-10	NULL	NULL	-100	NULL
99	NULL	NULL	-10	NULL
139	NULL	NULL	-9	NULL
0	NULL	158	-1	NULL
0	NULL	158	0	NULL
2	NULL	NULL	1	NULL
NULL	NULL	5	4	NULL
5	NULL	1	8	NULL
NULL	5	158	9	9
NULL	NULL	158	10	10
NULL	NULL	5	13	NULL
NULL	NULL	5	32	NULL
NULL	10	5	83	NULL
NULL	NULL	5	86	NULL
NULL	9	158	99	99
NULL	NULL	5	123	NULL
-10	NULL	NULL	154	NULL
-90	NULL	NULL	232	4
INSERT INTO table0_bigint ( pk , col_bigint_key ) VALUES ( 161, CAST( 99 AS CHAR(100)) ) , ( 9, CAST( 10 AS CHAR(100)) ) ;
ERROR 23000: Duplicate entry '9' for key 'PRIMARY'
SELECT * FROM table0_bigint ORDER BY pk;
col_char_12_key	col_char_12	col_bigint_key	pk	col_bigint
8-9	NULL	2	-1018	8
-10	NULL	NULL	-100	NULL
99	NULL	NULL	-10	NULL
139	NULL	NULL	-9	NULL
0	NULL	158	-1	NULL
0	NULL	158	0	NULL
2	NULL	NULL	1	NULL
NULL	NULL	5	4	NULL
5	NULL	1	8	NULL
NULL	5	158	9	9
NULL	NULL	158	10	10
NULL	NULL	5	13	NULL
NULL	NULL	5	32	NULL
NULL	10	5	83	NULL
NULL	NULL	5	86	NULL
NULL	9	158	99	99
NULL	NULL	5	123	NULL
-10	NULL	NULL	154	NULL
-90	NULL	NULL	232	4
UPDATE table0_bigint SET col_char_12_key = col_char_12_key WHERE ROUND( 5 + LENGTH('BVPJL') ) = CEIL ( -100 ) ORDER BY col_bigint ASC , col_char_12 DESC , pk  LIMIT 6 ;
SELECT * FROM table0_bigint ORDER BY pk;
col_char_12_key	col_char_12	col_bigint_key	pk	col_bigint
8-9	NULL	2	-1018	8
-10	NULL	NULL	-100	NULL
99	NULL	NULL	-10	NULL
139	NULL	NULL	-9	NULL
0	NULL	158	-1	NULL
0	NULL	158	0	NULL
2	NULL	NULL	1	NULL
NULL	NULL	5	4	NULL
5	NULL	1	8	NULL
NULL	5	158	9	9
NULL	NULL	158	10	10
NULL	NULL	5	13	NULL
NULL	NULL	5	32	NULL
NULL	10	5	83	NULL
NULL	NULL	5	86	NULL
NULL	9	158	99	99
NULL	NULL	5	123	NULL
-10	NULL	NULL	154	NULL
-90	NULL	NULL	232	4
SELECT 1 FROM table0_bigint WHERE pk <> ( SUBSTR( CAST( ( ROUND( 191 + SIGN ( LENGTH( SUBSTR( CAST( ( ROUND( 252 * -9 ) ) AS CHAR(100) ) , 1 , 12 ) ) ) ) ) AS CHAR(100) ) , 1 , 12 ) ) FOR UPDATE;
1
1
1
1
1
1
1
1
1
1
1
1
1
1
1
1
1
1
1
1
UPDATE table0_bigint SET col_bigint_key = SUBSTR( CAST( ( ROUND( 9 * ROUND( LENGTH('MXWJP') + -9 ) ) ) AS CHAR(100) ) , 1 , 12 ) WHERE col_char_12_key NOT IN ( CAST(-100 AS CHAR(100)) , CAST(10 AS CHAR(100)) , CAST(-1 AS CHAR(100)) ) ORDER BY col_char_12_key , col_char_12_key , col_char_12_key , pk DESC LIMIT 3 ;
SELECT * FROM table0_bigint ORDER BY pk;
col_char_12_key	col_char_12	col_bigint_key	pk	col_bigint
8-9	NULL	2	-1018	8
-10	NULL	-36	-100	NULL
99	NULL	NULL	-10	NULL
139	NULL	NULL	-9	NULL
0	NULL	158	-1	NULL
0	NULL	158	0	NULL
2	NULL	NULL	1	NULL
NULL	NULL	5	4	NULL
5	NULL	1	8	NULL
NULL	5	158	9	9
NULL	NULL	158	10	10
NULL	NULL	5	13	NULL
NULL	NULL	5	32	NULL
NULL	10	5	83	NULL
NULL	NULL	5	86	NULL
NULL	9	158	99	99
NULL	NULL	5	123	NULL
-10	NULL	-36	154	NULL
-90	NULL	-36	232	4
INSERT INTO table0_bigint ( pk , col_bigint_key, col_char_12 ) VALUES ( 99 , SUBSTR( CAST( ( LENGTH('HBVQO') ) AS CHAR(100) ) , 1 , 12 ) , SUBSTR( CAST( ( ABS ( ROUND ( 55 ) ) ) AS CHAR(100) ) , 1 , 12 ) ) ;
ERROR 23000: Duplicate entry '99' for key 'PRIMARY'
SELECT * FROM table0_bigint ORDER BY pk;
col_char_12_key	col_char_12	col_bigint_key	pk	col_bigint
8-9	NULL	2	-1018	8
-10	NULL	-36	-100	NULL
99	NULL	NULL	-10	NULL
139	NULL	NULL	-9	NULL
0	NULL	158	-1	NULL
0	NULL	158	0	NULL
2	NULL	NULL	1	NULL
NULL	NULL	5	4	NULL
5	NULL	1	8	NULL
NULL	5	158	9	9
NULL	NULL	158	10	10
NULL	NULL	5	13	NULL
NULL	NULL	5	32	NULL
NULL	10	5	83	NULL
NULL	NULL	5	86	NULL
NULL	9	158	99	99
NULL	NULL	5	123	NULL
-10	NULL	-36	154	NULL
-90	NULL	-36	232	4
SELECT ALL UPPER( col_bigint ) FROM table0_bigint WHERE pk IN ( -9 , -1 , 9 , 4 , 99 ) ORDER BY col_bigint DESC , pk DESC;
UPPER( col_bigint )
99
9
NULL
NULL
NULL
INSERT INTO table0_bigint ( pk , col_char_12_key ) VALUES ( -1, CAST( 1 AS CHAR(100)) ) , ( -10, CAST( 9 AS CHAR(100)) ) ;
ERROR 23000: Duplicate entry '-1' for key 'PRIMARY'
SELECT * FROM table0_bigint ORDER BY pk;
col_char_12_key	col_char_12	col_bigint_key	pk	col_bigint
8-9	NULL	2	-1018	8
-10	NULL	-36	-100	NULL
99	NULL	NULL	-10	NULL
139	NULL	NULL	-9	NULL
0	NULL	158	-1	NULL
0	NULL	158	0	NULL
2	NULL	NULL	1	NULL
NULL	NULL	5	4	NULL
5	NULL	1	8	NULL
NULL	5	158	9	9
NULL	NULL	158	10	10
NULL	NULL	5	13	NULL
NULL	NULL	5	32	NULL
NULL	10	5	83	NULL
NULL	NULL	5	86	NULL
NULL	9	158	99	99
NULL	NULL	5	123	NULL
-10	NULL	-36	154	NULL
-90	NULL	-36	232	4
SELECT col_bigint_key , col_char_12 FROM table0_bigint WHERE 0 <= LENGTH( SUBSTR( CAST( ( ROUND ( 9 ) ) AS CHAR(100) ) , 1 , 12 ) ) ORDER BY col_bigint_key ASC , col_char_12 ASC , pk  LIMIT 1 /* RESULTSET_HAS_ZERO_OR_ONE_ROWS */;
col_bigint_key	col_char_12
NULL	NULL
SELECT * FROM table0_bigint WHERE col_bigint_key BETWEEN CAST( 2 AS CHAR(100) ) AND CAST( 5 AS CHAR(100) ) ORDER BY col_bigint_key DESC , col_char_12_key  , pk  LIMIT 5 , 8;
col_char_12_key	col_char_12	col_bigint_key	pk	col_bigint
NULL	NULL	5	123	NULL
8-9	NULL	2	-1018	8
SELECT col_char_12_key,pk FROM table0_bigint WHERE pk = ( SUBSTR( CAST( ( CEIL ( 8 ) ) AS CHAR(100) ) , 1 , 12 ) ) GROUP BY col_char_12_key,pk ORDER BY col_char_12_key,pk LIMIT 3 , 2;
col_char_12_key	pk
SELECT 1 FROM table0_bigint WHERE col_bigint BETWEEN SUBSTR( CAST( ( LENGTH( SUBSTR( CAST( ( 15 ) AS CHAR(100) ) , 1 , 12 ) ) ) AS CHAR(100) ) , 1 , 12 ) AND SUBSTR( CAST( ( ROUND( 1 - -10 ) ) AS CHAR(100) ) , 1 , 12 ) FOR UPDATE;
1
1
1
1
1
SELECT col_bigint,col_bigint_key,col_char_12,col_char_12_key,pk FROM table0_bigint WHERE FLOOR ( ROUND( 0 * -100 ) ) = SUBSTR( CAST( ( LENGTH( SUBSTR( CAST( ( ROUND( -1 - 1 ) ) AS CHAR(100) ) , 1 , 12 ) ) ) AS CHAR(100) ) , 1 , 12 ) GROUP BY col_bigint,col_bigint_key,col_char_12,col_char_12_key,pk ORDER BY col_bigint,col_bigint_key,col_char_12,col_char_12_key,pk LIMIT 3 , 4;
col_bigint	col_bigint_key	col_char_12	col_char_12_key	pk
UPDATE table0_bigint SET col_bigint_key = col_bigint_key WHERE ( -879427584 , -2018246656 ) IN ( ( SUBSTR( CAST( ( ROUND( 9 - 0 ) ) AS CHAR(100) ) , 1 , 12 ) , SUBSTR( CAST( ( SIGN ( LENGTH('BIXES') ) ) AS CHAR(100) ) , 1 , 12 ) ) , ( SUBSTR( CAST( ( LENGTH( SUBSTR( CAST( ( LENGTH( SUBSTR( CAST( ( -9 ) AS CHAR(100) ) , 1 , 12 ) ) ) AS CHAR(100) ) , 1 , 12 ) ) ) AS CHAR(100) ) , 1 , 12 ) , SUBSTR( CAST( ( ROUND( 99 * 99 ) ) AS CHAR(100) ) , 1 , 12 ) ) ) ORDER BY col_bigint_key , col_char_12_key , col_bigint_key , pk  LIMIT 8 ;
SELECT * FROM table0_bigint ORDER BY pk;
col_char_12_key	col_char_12	col_bigint_key	pk	col_bigint
8-9	NULL	2	-1018	8
-10	NULL	-36	-100	NULL
99	NULL	NULL	-10	NULL
139	NULL	NULL	-9	NULL
0	NULL	158	-1	NULL
0	NULL	158	0	NULL
2	NULL	NULL	1	NULL
NULL	NULL	5	4	NULL
5	NULL	1	8	NULL
NULL	5	158	9	9
NULL	NULL	158	10	10
NULL	NULL	5	13	NULL
NULL	NULL	5	32	NULL
NULL	10	5	83	NULL
NULL	NULL	5	86	NULL
NULL	9	158	99	99
NULL	NULL	5	123	NULL
-10	NULL	-36	154	NULL
-90	NULL	-36	232	4
SELECT col_bigint,col_bigint_key,col_char_12,col_char_12_key,pk FROM table0_bigint WHERE 10 = col_bigint ORDER BY pk,pk  , pk ASC LIMIT 5 , 1 /* RESULTSET_HAS_ZERO_OR_ONE_ROWS */;
col_bigint	col_bigint_key	col_char_12	col_char_12_key	pk
SELECT col_bigint_key,pk FROM table0_bigint WHERE pk IN ( SUBSTR( CAST( ( SIGN ( FLOOR ( 91 ) ) ) AS CHAR(100) ) , 1 , 12 ) , SUBSTR( CAST( ( LENGTH( SUBSTR( CAST( ( LENGTH('OEGET') ) AS CHAR(100) ) , 1 , 12 ) ) ) AS CHAR(100) ) , 1 , 12 ) , SUBSTR( CAST( ( ROUND( -10 * ROUND( 9 * -9 ) ) ) AS CHAR(100) ) , 1 , 12 ) , SUBSTR( CAST( ( ROUND ( ROUND( ROUND( ROUND ( 114 ) + -10 ) * 6 ) ) ) AS CHAR(100) ) , 1 , 12 ) , SUBSTR( CAST( ( LENGTH( SUBSTR( CAST( ( LENGTH( SUBSTR( CAST( ( LENGTH('VRYBD') ) AS CHAR(100) ) , 1 , 12 ) ) ) AS CHAR(100) ) , 1 , 12 ) ) ) AS CHAR(100) ) , 1 , 12 ) ) GROUP BY col_bigint_key,pk ORDER BY col_bigint_key,pk LIMIT 3;
col_bigint_key	pk
NULL	1
SELECT 1 FROM table0_bigint WHERE col_char_12_key BETWEEN CAST( 3 AS CHAR(100) ) AND CAST( 5 AS CHAR(100) ) FOR UPDATE;
1
1
SELECT 1 FROM table0_bigint WHERE col_bigint_key BETWEEN SUBSTR( CAST( ( -1 ) AS CHAR(100) ) , 1 , 12 ) AND SUBSTR( CAST( ( LENGTH( SUBSTR( CAST( ( ABS ( 0 ) ) AS CHAR(100) ) , 1 , 12 ) ) ) AS CHAR(100) ) , 1 , 12 ) FOR UPDATE;
1
1
SELECT 1 FROM table0_bigint WHERE ROUND( LENGTH( SUBSTR( CAST( ( LENGTH( SUBSTR( CAST( ( CEIL ( LENGTH('DRHOB') ) ) AS CHAR(100) ) , 1 , 12 ) ) ) AS CHAR(100) ) , 1 , 12 ) ) * 10 ) != LENGTH('PFJKW') FOR UPDATE;
1
1
1
1
1
1
1
1
1
1
1
1
1
1
1
1
1
1
1
1
SELECT COUNT( col_bigint_key ) FROM table0_bigint WHERE ( -2017525760 , 614924288 ) NOT IN ( ( SUBSTR( CAST( ( ROUND( 201 - ROUND( 9 + CEIL ( 99 ) ) ) ) AS CHAR(100) ) , 1 , 12 ) , SUBSTR( CAST( ( ROUND( 9 + 0 ) ) AS CHAR(100) ) , 1 , 12 ) ) , ( SUBSTR( CAST( ( ROUND( 10 * 99 ) ) AS CHAR(100) ) , 1 , 12 ) , SUBSTR( CAST( ( ROUND( LENGTH( SUBSTR( CAST( ( CEIL ( FLOOR ( 121 ) ) ) AS CHAR(100) ) , 1 , 12 ) ) - -100 ) ) AS CHAR(100) ) , 1 , 12 ) ) ) ORDER BY pk ASC , pk  LIMIT 3 /* RESULTSET_HAS_ZERO_OR_ONE_ROWS */;
COUNT( col_bigint_key )
16
SELECT pk , col_bigint , col_char_12_key FROM table0_bigint WHERE SUBSTR( CAST( ( -100 ) AS CHAR(100) ) , 1 , 12 ) != FLOOR ( -10 ) ORDER BY pk LIMIT 1 /* RESULTSET_HAS_ZERO_OR_ONE_ROWS */;
pk	col_bigint	col_char_12_key
-1018	8	8-9
SELECT col_char_12_key,pk FROM table0_bigint WHERE pk NOT IN ( -100 , 7 , 3 , 9 , 0 ) GROUP BY col_char_12_key,pk ORDER BY col_char_12_key,pk LIMIT 8 , 7;
col_char_12_key	pk
-10	154
-90	232
0	-1
139	-9
2	1
5	8
8-9	-1018
SELECT col_bigint_key FROM table0_bigint WHERE pk >= -9 ORDER BY col_bigint_key , col_bigint_key , col_bigint_key , pk ASC LIMIT 8 , 1 /* RESULTSET_HAS_ZERO_OR_ONE_ROWS */;
col_bigint_key
5
SELECT * FROM table0_bigint WHERE pk >= 236 ORDER BY col_bigint_key , col_bigint_key , col_bigint_key , pk  LIMIT 7 , 8;
col_char_12_key	col_char_12	col_bigint_key	pk	col_bigint
SELECT 1 FROM table0_bigint WHERE col_bigint <> 2 FOR UPDATE;
1
1
1
1
1
1
SELECT col_bigint,col_bigint_key,col_char_12,col_char_12_key,pk FROM table0_bigint WHERE ( 1076035584 , -1011154944 ) IN ( ( SUBSTR( CAST( ( CEIL ( ROUND( 0 - ROUND( 159 * 17 ) ) ) ) AS CHAR(100) ) , 1 , 12 ) , SUBSTR( CAST( ( ROUND( -9 + ROUND( 141 + 99 ) ) ) AS CHAR(100) ) , 1 , 12 ) ) , ( SUBSTR( CAST( ( LENGTH( SUBSTR( CAST( ( ROUND( 99 * 10 ) ) AS CHAR(100) ) , 1 , 12 ) ) ) AS CHAR(100) ) , 1 , 12 ) , SUBSTR( CAST( ( -100 ) AS CHAR(100) ) , 1 , 12 ) ) ) GROUP BY col_bigint,col_bigint_key,col_char_12,col_char_12_key,pk ORDER BY col_bigint,col_bigint_key,col_char_12,col_char_12_key,pk LIMIT 5;
col_bigint	col_bigint_key	col_char_12	col_char_12_key	pk
SELECT * FROM table0_bigint WHERE col_bigint_key < CAST(9 AS CHAR(100)) ORDER BY col_bigint DESC , pk  LIMIT 7;
col_char_12_key	col_char_12	col_bigint_key	pk	col_bigint
8-9	NULL	2	-1018	8
-90	NULL	-36	232	4
-10	NULL	-36	-100	NULL
NULL	NULL	5	4	NULL
5	NULL	1	8	NULL
NULL	NULL	5	13	NULL
NULL	NULL	5	32	NULL
SELECT UPPER( col_char_12 ) FROM table0_bigint WHERE col_char_12 <> ( SUBSTR( CAST( ( ROUND( LENGTH( SUBSTR( CAST( ( ROUND( 7 + 1 ) ) AS CHAR(100) ) , 1 , 12 ) ) - 0 ) ) AS CHAR(100) ) , 1 , 12 ) ) AND col_char_12 >= ( SUBSTR( CAST( ( ROUND( -9 - -100 ) ) AS CHAR(100) ) , 1 , 12 ) ) GROUP BY col_char_12 ORDER BY col_char_12 LIMIT 3 , 1 /* RESULTSET_HAS_ZERO_OR_ONE_ROWS */;
UPPER( col_char_12 )
SELECT  NULL FROM table0_bigint ORDER BY col_bigint  , col_char_12 DESC , pk DESC;
NULL
NULL
NULL
NULL
NULL
NULL
NULL
NULL
NULL
NULL
NULL
NULL
NULL
NULL
NULL
NULL
NULL
NULL
NULL
NULL
SELECT UPPER( col_bigint_key ),pk FROM table0_bigint WHERE  ( col_bigint_key <> SUBSTR( CAST( ( LENGTH( SUBSTR( CAST( ( 1 ) AS CHAR(100) ) , 1 , 12 ) ) ) AS CHAR(100) ) , 1 , 12 ) ) OR  ( col_bigint_key != SUBSTR( CAST( ( LENGTH('HWNBV') ) AS CHAR(100) ) , 1 , 12 ) ) GROUP BY col_bigint_key,pk ORDER BY col_bigint_key,pk LIMIT 2 , 3;
UPPER( col_bigint_key )	pk
-36	232
1	8
2	-1018
SELECT ALL TRUE FROM table0_bigint ORDER BY col_char_12_key ASC , pk ASC;
TRUE
1
1
1
1
1
1
1
1
1
1
1
1
1
1
1
1
1
1
1
SELECT col_char_12_key FROM table0_bigint WHERE col_char_12 IN ( SUBSTR( CAST( ( -9 ) AS CHAR(100) ) , 1 , 12 ) , SUBSTR( CAST( ( FLOOR ( ROUND( 15 + 0 ) ) ) AS CHAR(100) ) , 1 , 12 ) , SUBSTR( CAST( ( SIGN ( LENGTH('WSMJS') ) ) AS CHAR(100) ) , 1 , 12 ) , SUBSTR( CAST( ( ROUND( -100 * 99 ) ) AS CHAR(100) ) , 1 , 12 ) , SUBSTR( CAST( ( ROUND( ROUND ( ROUND( -100 + -100 ) ) * 40 ) ) AS CHAR(100) ) , 1 , 12 ) ) ORDER BY col_bigint  , col_char_12 DESC , pk  LIMIT 1 /* RESULTSET_HAS_ZERO_OR_ONE_ROWS */;
col_char_12_key
INSERT INTO table0_bigint ( pk , col_bigint_key ) VALUES ( 1, CAST( -100 AS CHAR(100)) ) , ( 0, CAST( 0 AS CHAR(100)) ) ;
ERROR 23000: Duplicate entry '1' for key 'PRIMARY'
SELECT * FROM table0_bigint ORDER BY pk;
col_char_12_key	col_char_12	col_bigint_key	pk	col_bigint
8-9	NULL	2	-1018	8
-10	NULL	-36	-100	NULL
99	NULL	NULL	-10	NULL
139	NULL	NULL	-9	NULL
0	NULL	158	-1	NULL
0	NULL	158	0	NULL
2	NULL	NULL	1	NULL
NULL	NULL	5	4	NULL
5	NULL	1	8	NULL
NULL	5	158	9	9
NULL	NULL	158	10	10
NULL	NULL	5	13	NULL
NULL	NULL	5	32	NULL
NULL	10	5	83	NULL
NULL	NULL	5	86	NULL
NULL	9	158	99	99
NULL	NULL	5	123	NULL
-10	NULL	-36	154	NULL
-90	NULL	-36	232	4
SELECT * FROM table0_bigint WHERE pk > -1 ORDER BY col_bigint  , col_char_12_key ASC , pk ASC LIMIT 1 /* RESULTSET_HAS_ZERO_OR_ONE_ROWS */;
col_char_12_key	col_char_12	col_bigint_key	pk	col_bigint
NULL	NULL	5	4	NULL
SELECT col_bigint,col_bigint_key,col_char_12,col_char_12_key,pk FROM table0_bigint WHERE ( -1313931264 , -893059072 , 1827864576 , -665059328 ) NOT IN ( ( SUBSTR( CAST( ( LENGTH('ASWOD') ) AS CHAR(100) ) , 1 , 12 ) , SUBSTR( CAST( ( ROUND( 9 + ROUND( 1 + ROUND( 10 + 0 ) ) ) ) AS CHAR(100) ) , 1 , 12 ) , SUBSTR( CAST( ( FLOOR ( -100 ) ) AS CHAR(100) ) , 1 , 12 ) , SUBSTR( CAST( ( ABS ( -9 ) ) AS CHAR(100) ) , 1 , 12 ) ) ) GROUP BY col_bigint,col_bigint_key,col_char_12,col_char_12_key,pk ORDER BY col_bigint,col_bigint_key,col_char_12,col_char_12_key,pk LIMIT 4;
col_bigint	col_bigint_key	col_char_12	col_char_12_key	pk
NULL	NULL	NULL	139	-9
NULL	NULL	NULL	2	1
NULL	NULL	NULL	99	-10
NULL	-36	NULL	-10	-100
SELECT 1 FROM table0_bigint WHERE pk = ( SUBSTR( CAST( ( -9 ) AS CHAR(100) ) , 1 , 12 ) ) AND col_bigint <> ( SUBSTR( CAST( ( ROUND( -10 - LENGTH('FYEBF') ) ) AS CHAR(100) ) , 1 , 12 ) ) FOR UPDATE;
1
INSERT INTO table0_bigint ( pk , col_bigint_key ) VALUES ( 197, CAST( 9 AS CHAR(100)) ) , ( -1, CAST( 10 AS CHAR(100)) ) ;
ERROR 23000: Duplicate entry '-1' for key 'PRIMARY'
SELECT * FROM table0_bigint ORDER BY pk;
col_char_12_key	col_char_12	col_bigint_key	pk	col_bigint
8-9	NULL	2	-1018	8
-10	NULL	-36	-100	NULL
99	NULL	NULL	-10	NULL
139	NULL	NULL	-9	NULL
0	NULL	158	-1	NULL
0	NULL	158	0	NULL
2	NULL	NULL	1	NULL
NULL	NULL	5	4	NULL
5	NULL	1	8	NULL
NULL	5	158	9	9
NULL	NULL	158	10	10
NULL	NULL	5	13	NULL
NULL	NULL	5	32	NULL
NULL	10	5	83	NULL
NULL	NULL	5	86	NULL
NULL	9	158	99	99
NULL	NULL	5	123	NULL
-10	NULL	-36	154	NULL
-90	NULL	-36	232	4
INSERT INTO table0_bigint ( pk , col_bigint_key ) VALUES ( 99 , SUBSTR( CAST( ( LENGTH('QPASN') ) AS CHAR(100) ) , 1 , 12 ) ) ;
ERROR 23000: Duplicate entry '99' for key 'PRIMARY'
SELECT * FROM table0_bigint ORDER BY pk;
col_char_12_key	col_char_12	col_bigint_key	pk	col_bigint
8-9	NULL	2	-1018	8
-10	NULL	-36	-100	NULL
99	NULL	NULL	-10	NULL
139	NULL	NULL	-9	NULL
0	NULL	158	-1	NULL
0	NULL	158	0	NULL
2	NULL	NULL	1	NULL
NULL	NULL	5	4	NULL
5	NULL	1	8	NULL
NULL	5	158	9	9
NULL	NULL	158	10	10
NULL	NULL	5	13	NULL
NULL	NULL	5	32	NULL
NULL	10	5	83	NULL
NULL	NULL	5	86	NULL
NULL	9	158	99	99
NULL	NULL	5	123	NULL
-10	NULL	-36	154	NULL
-90	NULL	-36	232	4
SELECT UPPER( pk ) FROM table0_bigint WHERE col_bigint < ( SUBSTR( CAST( ( FLOOR ( LENGTH('VZUOB') ) ) AS CHAR(100) ) , 1 , 12 ) ) GROUP BY pk ORDER BY pk LIMIT 95 , 4;
UPPER( pk )
INSERT INTO table0_bigint ( pk , col_char_12_key ) VALUES ( 10, CAST( -1 AS CHAR(100)) ) , ( -100, CAST( -9 AS CHAR(100)) ) ;
ERROR 23000: Duplicate entry '10' for key 'PRIMARY'
SELECT * FROM table0_bigint ORDER BY pk;
col_char_12_key	col_char_12	col_bigint_key	pk	col_bigint
8-9	NULL	2	-1018	8
-10	NULL	-36	-100	NULL
99	NULL	NULL	-10	NULL
139	NULL	NULL	-9	NULL
0	NULL	158	-1	NULL
0	NULL	158	0	NULL
2	NULL	NULL	1	NULL
NULL	NULL	5	4	NULL
5	NULL	1	8	NULL
NULL	5	158	9	9
NULL	NULL	158	10	10
NULL	NULL	5	13	NULL
NULL	NULL	5	32	NULL
NULL	10	5	83	NULL
NULL	NULL	5	86	NULL
NULL	9	158	99	99
NULL	NULL	5	123	NULL
-10	NULL	-36	154	NULL
-90	NULL	-36	232	4
SELECT * FROM table0_bigint WHERE pk = 122 ORDER BY col_bigint  , col_char_12_key DESC , pk  LIMIT 2 , 4;
col_char_12_key	col_char_12	col_bigint_key	pk	col_bigint
SELECT  UPPER( col_bigint ) FROM table0_bigint WHERE col_bigint_key = ( SUBSTR( CAST( ( ABS ( 99 ) ) AS CHAR(100) ) , 1 , 12 ) ) ORDER BY pk;
UPPER( col_bigint )
UPDATE table0_bigint SET col_bigint_key = col_bigint_key WHERE ( 182386688 , 1873346560 ) NOT IN ( ( SUBSTR( CAST( ( ROUND( -9 - LENGTH('RUPKU') ) ) AS CHAR(100) ) , 1 , 12 ) , SUBSTR( CAST( ( SIGN ( ROUND( LENGTH('UFHFI') + 41 ) ) ) AS CHAR(100) ) , 1 , 12 ) ) , ( SUBSTR( CAST( ( FLOOR ( ROUND( 99 * 10 ) ) ) AS CHAR(100) ) , 1 , 12 ) , SUBSTR( CAST( ( ROUND( 10 - 10 ) ) AS CHAR(100) ) , 1 , 12 ) ) ) ORDER BY pk LIMIT 2 ;
SELECT * FROM table0_bigint ORDER BY pk;
col_char_12_key	col_char_12	col_bigint_key	pk	col_bigint
8-9	NULL	2	-1018	8
-10	NULL	-36	-100	NULL
99	NULL	NULL	-10	NULL
139	NULL	NULL	-9	NULL
0	NULL	158	-1	NULL
0	NULL	158	0	NULL
2	NULL	NULL	1	NULL
NULL	NULL	5	4	NULL
5	NULL	1	8	NULL
NULL	5	158	9	9
NULL	NULL	158	10	10
NULL	NULL	5	13	NULL
NULL	NULL	5	32	NULL
NULL	10	5	83	NULL
NULL	NULL	5	86	NULL
NULL	9	158	99	99
NULL	NULL	5	123	NULL
-10	NULL	-36	154	NULL
-90	NULL	-36	232	4
SELECT  TRUE FROM table0_bigint ORDER BY col_bigint_key , col_char_12_key,pk ASC , pk ;
TRUE
1
1
1
1
1
1
1
1
1
1
1
1
1
1
1
1
1
1
1
SELECT  NULL , pk , TRUE , col_bigint_key , FALSE , 1 FROM table0_bigint ORDER BY col_bigint_key DESC , col_char_12_key DESC , pk ASC;
NULL	pk	TRUE	col_bigint_key	FALSE	1
NULL	-1	1	158	0	1
NULL	0	1	158	0	1
NULL	9	1	158	0	1
NULL	10	1	158	0	1
NULL	99	1	158	0	1
NULL	4	1	5	0	1
NULL	13	1	5	0	1
NULL	32	1	5	0	1
NULL	83	1	5	0	1
NULL	86	1	5	0	1
NULL	123	1	5	0	1
NULL	-1018	1	2	0	1
NULL	8	1	1	0	1
NULL	232	1	-36	0	1
NULL	-100	1	-36	0	1
NULL	154	1	-36	0	1
NULL	-10	1	NULL	0	1
NULL	1	1	NULL	0	1
NULL	-9	1	NULL	0	1
SELECT 1 FROM table0_bigint WHERE ( -1007026176 , -1353711616 , -1598357504 ) IN ( ( SUBSTR( CAST( ( FLOOR ( CEIL ( SIGN ( ABS ( 10 ) ) ) ) ) AS CHAR(100) ) , 1 , 12 ) , SUBSTR( CAST( ( ROUND( 73 - 107 ) ) AS CHAR(100) ) , 1 , 12 ) , SUBSTR( CAST( ( LENGTH('PROWW') ) AS CHAR(100) ) , 1 , 12 ) ) , ( SUBSTR( CAST( ( ROUND( -100 + -1 ) ) AS CHAR(100) ) , 1 , 12 ) , SUBSTR( CAST( ( ROUND ( 0 ) ) AS CHAR(100) ) , 1 , 12 ) , SUBSTR( CAST( ( LENGTH('XJGFJ') ) AS CHAR(100) ) , 1 , 12 ) ) ) FOR UPDATE;
1
INSERT INTO table0_bigint ( pk , col_bigint_key ) VALUES ( 10, CAST( 10 AS CHAR(100)) ) , ( -9, CAST( 9 AS CHAR(100)) ) ;
ERROR 23000: Duplicate entry '10' for key 'PRIMARY'
SELECT * FROM table0_bigint ORDER BY pk;
col_char_12_key	col_char_12	col_bigint_key	pk	col_bigint
8-9	NULL	2	-1018	8
-10	NULL	-36	-100	NULL
99	NULL	NULL	-10	NULL
139	NULL	NULL	-9	NULL
0	NULL	158	-1	NULL
0	NULL	158	0	NULL
2	NULL	NULL	1	NULL
NULL	NULL	5	4	NULL
5	NULL	1	8	NULL
NULL	5	158	9	9
NULL	NULL	158	10	10
NULL	NULL	5	13	NULL
NULL	NULL	5	32	NULL
NULL	10	5	83	NULL
NULL	NULL	5	86	NULL
NULL	9	158	99	99
NULL	NULL	5	123	NULL
-10	NULL	-36	154	NULL
-90	NULL	-36	232	4
SELECT pk FROM table0_bigint  ORDER BY pk LIMIT 2;
pk
-1018
-100
UPDATE table0_bigint SET col_char_12 = col_char_12_key WHERE pk <= ( SUBSTR( CAST( ( -10 ) AS CHAR(100) ) , 1 , 12 ) ) AND col_char_12_key > ( SUBSTR( CAST( ( FLOOR ( 1 ) ) AS CHAR(100) ) , 1 , 12 ) ) ORDER BY col_char_12_key , col_bigint_key , pk  LIMIT 7 ;
SELECT * FROM table0_bigint ORDER BY pk;
col_char_12_key	col_char_12	col_bigint_key	pk	col_bigint
8-9	8-9	2	-1018	8
-10	NULL	-36	-100	NULL
99	99	NULL	-10	NULL
139	NULL	NULL	-9	NULL
0	NULL	158	-1	NULL
0	NULL	158	0	NULL
2	NULL	NULL	1	NULL
NULL	NULL	5	4	NULL
5	NULL	1	8	NULL
NULL	5	158	9	9
NULL	NULL	158	10	10
NULL	NULL	5	13	NULL
NULL	NULL	5	32	NULL
NULL	10	5	83	NULL
NULL	NULL	5	86	NULL
NULL	9	158	99	99
NULL	NULL	5	123	NULL
-10	NULL	-36	154	NULL
-90	NULL	-36	232	4
SELECT * FROM table0_bigint WHERE ( -2112487424 , 1390215168 ) NOT IN ( ( SUBSTR( CAST( ( ROUND ( 10 ) ) AS CHAR(100) ) , 1 , 12 ) , SUBSTR( CAST( ( LENGTH( SUBSTR( CAST( ( LENGTH( SUBSTR( CAST( ( ROUND( LENGTH( SUBSTR( CAST( ( LENGTH( SUBSTR( CAST( ( LENGTH('WUNRM') ) AS CHAR(100) ) , 1 , 12 ) ) ) AS CHAR(100) ) , 1 , 12 ) ) * 99 ) ) AS CHAR(100) ) , 1 , 12 ) ) ) AS CHAR(100) ) , 1 , 12 ) ) ) AS CHAR(100) ) , 1 , 12 ) ) , ( SUBSTR( CAST( ( ROUND( 99 * ROUND( ROUND ( 99 ) - -10 ) ) ) AS CHAR(100) ) , 1 , 12 ) , SUBSTR( CAST( ( LENGTH('ACQXN') ) AS CHAR(100) ) , 1 , 12 ) ) ) ORDER BY col_char_12_key , col_bigint_key , col_char_12_key , pk ASC LIMIT 9 , 2;
col_char_12_key	col_char_12	col_bigint_key	pk	col_bigint
-10	NULL	-36	-100	NULL
-10	NULL	-36	154	NULL
INSERT INTO table0_bigint (pk) VALUES ( 10 ) ;
ERROR 23000: Duplicate entry '10' for key 'PRIMARY'
SELECT * FROM table0_bigint ORDER BY pk;
col_char_12_key	col_char_12	col_bigint_key	pk	col_bigint
8-9	8-9	2	-1018	8
-10	NULL	-36	-100	NULL
99	99	NULL	-10	NULL
139	NULL	NULL	-9	NULL
0	NULL	158	-1	NULL
0	NULL	158	0	NULL
2	NULL	NULL	1	NULL
NULL	NULL	5	4	NULL
5	NULL	1	8	NULL
NULL	5	158	9	9
NULL	NULL	158	10	10
NULL	NULL	5	13	NULL
NULL	NULL	5	32	NULL
NULL	10	5	83	NULL
NULL	NULL	5	86	NULL
NULL	9	158	99	99
NULL	NULL	5	123	NULL
-10	NULL	-36	154	NULL
-90	NULL	-36	232	4
INSERT INTO table0_bigint ( pk , col_char_12_key ) VALUES ( 10 , SUBSTR( CAST( ( CEIL ( 10 ) ) AS CHAR(100) ) , 1 , 12 ) ) ;
ERROR 23000: Duplicate entry '10' for key 'PRIMARY'
SELECT * FROM table0_bigint ORDER BY pk;
col_char_12_key	col_char_12	col_bigint_key	pk	col_bigint
8-9	8-9	2	-1018	8
-10	NULL	-36	-100	NULL
99	99	NULL	-10	NULL
139	NULL	NULL	-9	NULL
0	NULL	158	-1	NULL
0	NULL	158	0	NULL
2	NULL	NULL	1	NULL
NULL	NULL	5	4	NULL
5	NULL	1	8	NULL
NULL	5	158	9	9
NULL	NULL	158	10	10
NULL	NULL	5	13	NULL
NULL	NULL	5	32	NULL
NULL	10	5	83	NULL
NULL	NULL	5	86	NULL
NULL	9	158	99	99
NULL	NULL	5	123	NULL
-10	NULL	-36	154	NULL
-90	NULL	-36	232	4
INSERT INTO table0_bigint ( pk , col_bigint_key ) VALUES ( -1 , SUBSTR( CAST( ( FLOOR ( -100 ) ) AS CHAR(100) ) , 1 , 12 ) ) ;
ERROR 23000: Duplicate entry '-1' for key 'PRIMARY'
SELECT * FROM table0_bigint ORDER BY pk;
col_char_12_key	col_char_12	col_bigint_key	pk	col_bigint
8-9	8-9	2	-1018	8
-10	NULL	-36	-100	NULL
99	99	NULL	-10	NULL
139	NULL	NULL	-9	NULL
0	NULL	158	-1	NULL
0	NULL	158	0	NULL
2	NULL	NULL	1	NULL
NULL	NULL	5	4	NULL
5	NULL	1	8	NULL
NULL	5	158	9	9
NULL	NULL	158	10	10
NULL	NULL	5	13	NULL
NULL	NULL	5	32	NULL
NULL	10	5	83	NULL
NULL	NULL	5	86	NULL
NULL	9	158	99	99
NULL	NULL	5	123	NULL
-10	NULL	-36	154	NULL
-90	NULL	-36	232	4
SELECT 1 FROM table0_bigint WHERE LENGTH('DNXOF') <> SUBSTR( CAST( ( LENGTH('NBUXJ') ) AS CHAR(100) ) , 1 , 12 ) FOR UPDATE;
1
SELECT 1 FROM table0_bigint WHERE col_bigint <> -1 FOR UPDATE;
1
1
1
1
1
1
UPDATE table0_bigint SET col_char_12_key = col_char_12_key WHERE col_bigint_key NOT IN ( 99 , 1 , -1 , 1 , 0 ) ORDER BY col_char_12_key , col_bigint_key , col_bigint_key , pk ASC LIMIT 1 ;
SELECT * FROM table0_bigint ORDER BY pk;
col_char_12_key	col_char_12	col_bigint_key	pk	col_bigint
8-9	8-9	2	-1018	8
-10	NULL	-36	-100	NULL
99	99	NULL	-10	NULL
139	NULL	NULL	-9	NULL
0	NULL	158	-1	NULL
0	NULL	158	0	NULL
2	NULL	NULL	1	NULL
NULL	NULL	5	4	NULL
5	NULL	1	8	NULL
NULL	5	158	9	9
NULL	NULL	158	10	10
NULL	NULL	5	13	NULL
NULL	NULL	5	32	NULL
NULL	10	5	83	NULL
NULL	NULL	5	86	NULL
NULL	9	158	99	99
NULL	NULL	5	123	NULL
-10	NULL	-36	154	NULL
-90	NULL	-36	232	4
SELECT * FROM table0_bigint WHERE pk < ( SUBSTR( CAST( ( LENGTH('VZNAX') ) AS CHAR(100) ) , 1 , 12 ) ) ORDER BY col_bigint_key , col_char_12,pk ASC , pk DESC LIMIT 99 , 3;
col_char_12_key	col_char_12	col_bigint_key	pk	col_bigint
SELECT pk , col_bigint , col_char_12_key FROM table0_bigint WHERE ( 1424293888 , -533921792 ) NOT IN ( ( SUBSTR( CAST( ( ROUND( 3 - FLOOR ( -1 ) ) ) AS CHAR(100) ) , 1 , 12 ) , SUBSTR( CAST( ( SIGN ( ROUND( ROUND( ROUND( 10 * 1 ) * -100 ) + 99 ) ) ) AS CHAR(100) ) , 1 , 12 ) ) , ( SUBSTR( CAST( ( ROUND( LENGTH('ATBFH') * 10 ) ) AS CHAR(100) ) , 1 , 12 ) , SUBSTR( CAST( ( ROUND( LENGTH( SUBSTR( CAST( ( 10 ) AS CHAR(100) ) , 1 , 12 ) ) + 180 ) ) AS CHAR(100) ) , 1 , 12 ) ) ) ORDER BY col_char_12_key , col_bigint_key , pk ASC LIMIT 4 , 4;
pk	col_bigint	col_char_12_key
86	NULL	NULL
123	NULL	NULL
9	9	NULL
10	10	NULL
INSERT INTO table0_bigint ( pk , col_bigint_key ) VALUES ( 0, CAST( -100 AS CHAR(100)) ) , ( 67, CAST( 9 AS CHAR(100)) ) ;
ERROR 23000: Duplicate entry '0' for key 'PRIMARY'
SELECT * FROM table0_bigint ORDER BY pk;
col_char_12_key	col_char_12	col_bigint_key	pk	col_bigint
8-9	8-9	2	-1018	8
-10	NULL	-36	-100	NULL
99	99	NULL	-10	NULL
139	NULL	NULL	-9	NULL
0	NULL	158	-1	NULL
0	NULL	158	0	NULL
2	NULL	NULL	1	NULL
NULL	NULL	5	4	NULL
5	NULL	1	8	NULL
NULL	5	158	9	9
NULL	NULL	158	10	10
NULL	NULL	5	13	NULL
NULL	NULL	5	32	NULL
NULL	10	5	83	NULL
NULL	NULL	5	86	NULL
NULL	9	158	99	99
NULL	NULL	5	123	NULL
-10	NULL	-36	154	NULL
-90	NULL	-36	232	4
SELECT DISTINCT NULL , col_bigint , TRUE , UPPER( col_char_12_key ) , FALSE , 1 FROM table0_bigint ORDER BY col_bigint_key , pk ;
NULL	col_bigint	TRUE	UPPER( col_char_12_key )	FALSE	1
NULL	NULL	1	99	0	1
NULL	NULL	1	139	0	1
NULL	NULL	1	2	0	1
NULL	NULL	1	-10	0	1
NULL	4	1	-90	0	1
NULL	NULL	1	5	0	1
NULL	8	1	8-9	0	1
NULL	NULL	1	NULL	0	1
NULL	NULL	1	0	0	1
NULL	9	1	NULL	0	1
NULL	10	1	NULL	0	1
NULL	99	1	NULL	0	1
SELECT COUNT( col_char_12_key ) FROM table0_bigint WHERE  ( pk <= SUBSTR( CAST( ( 9 ) AS CHAR(100) ) , 1 , 12 ) ) OR  ( pk > SUBSTR( CAST( ( LENGTH('GVNEW') ) AS CHAR(100) ) , 1 , 12 ) ) ORDER BY col_bigint_key , col_char_12_key , col_bigint_key , pk  LIMIT 2 , 3 /* RESULTSET_HAS_ZERO_OR_ONE_ROWS */;
COUNT( col_char_12_key )
UPDATE table0_bigint SET pk = SUBSTR( CAST( ( LENGTH( SUBSTR( CAST( ( -100 ) AS CHAR(100) ) , 1 , 12 ) ) ) AS CHAR(100) ) , 1 , 12 ) , col_char_12_key = SUBSTR( CAST( ( ROUND( 99 - LENGTH( SUBSTR( CAST( ( ABS ( -9 ) ) AS CHAR(100) ) , 1 , 12 ) ) ) ) AS CHAR(100) ) , 1 , 12 ) WHERE col_bigint_key IN ( 184 , 99 , 3 , 25 , 139 ) ORDER BY pk LIMIT 2 ;
SELECT * FROM table0_bigint ORDER BY pk;
col_char_12_key	col_char_12	col_bigint_key	pk	col_bigint
8-9	8-9	2	-1018	8
-10	NULL	-36	-100	NULL
99	99	NULL	-10	NULL
139	NULL	NULL	-9	NULL
0	NULL	158	-1	NULL
0	NULL	158	0	NULL
2	NULL	NULL	1	NULL
NULL	NULL	5	4	NULL
5	NULL	1	8	NULL
NULL	5	158	9	9
NULL	NULL	158	10	10
NULL	NULL	5	13	NULL
NULL	NULL	5	32	NULL
NULL	10	5	83	NULL
NULL	NULL	5	86	NULL
NULL	9	158	99	99
NULL	NULL	5	123	NULL
-10	NULL	-36	154	NULL
-90	NULL	-36	232	4
INSERT INTO table0_bigint ( pk , col_bigint, col_char_12 ) VALUES ( 10 , SUBSTR( CAST( ( 9 ) AS CHAR(100) ) , 1 , 12 ) , SUBSTR( CAST( ( ABS ( ROUND( 0 - 3 ) ) ) AS CHAR(100) ) , 1 , 12 ) ) ;
ERROR 23000: Duplicate entry '10' for key 'PRIMARY'
SELECT * FROM table0_bigint ORDER BY pk;
col_char_12_key	col_char_12	col_bigint_key	pk	col_bigint
8-9	8-9	2	-1018	8
-10	NULL	-36	-100	NULL
99	99	NULL	-10	NULL
139	NULL	NULL	-9	NULL
0	NULL	158	-1	NULL
0	NULL	158	0	NULL
2	NULL	NULL	1	NULL
NULL	NULL	5	4	NULL
5	NULL	1	8	NULL
NULL	5	158	9	9
NULL	NULL	158	10	10
NULL	NULL	5	13	NULL
NULL	NULL	5	32	NULL
NULL	10	5	83	NULL
NULL	NULL	5	86	NULL
NULL	9	158	99	99
NULL	NULL	5	123	NULL
-10	NULL	-36	154	NULL
-90	NULL	-36	232	4
SELECT col_bigint_key FROM table0_bigint WHERE col_bigint_key != ( SUBSTR( CAST( ( ROUND( 99 * -9 ) ) AS CHAR(100) ) , 1 , 12 ) ) AND col_char_12_key > ( SUBSTR( CAST( ( ROUND ( ROUND( ROUND( LENGTH( SUBSTR( CAST( ( ROUND( 0 * 0 ) ) AS CHAR(100) ) , 1 , 12 ) ) * 52 ) * -9 ) ) ) AS CHAR(100) ) , 1 , 12 ) ) ORDER BY pk LIMIT 1 /* RESULTSET_HAS_ZERO_OR_ONE_ROWS */;
col_bigint_key
2
SELECT col_char_12_key FROM table0_bigint WHERE pk IN ( SUBSTR( CAST( ( LENGTH( SUBSTR( CAST( ( LENGTH('IBUSI') ) AS CHAR(100) ) , 1 , 12 ) ) ) AS CHAR(100) ) , 1 , 12 ) , SUBSTR( CAST( ( ROUND ( 9 ) ) AS CHAR(100) ) , 1 , 12 ) , SUBSTR( CAST( ( LENGTH('KMEBY') ) AS CHAR(100) ) , 1 , 12 ) , SUBSTR( CAST( ( FLOOR ( FLOOR ( 9 ) ) ) AS CHAR(100) ) , 1 , 12 ) , SUBSTR( CAST( ( SIGN ( 86 ) ) AS CHAR(100) ) , 1 , 12 ) ) ORDER BY col_char_12_key , col_char_12_key , col_bigint_key , pk ASC LIMIT 8 , 1 /* RESULTSET_HAS_ZERO_OR_ONE_ROWS */;
col_char_12_key
SELECT COUNT( col_bigint ) FROM table0_bigint WHERE 9 = 0 ORDER BY col_char_12_key , col_char_12_key , col_bigint_key , pk ASC LIMIT 8 /* RESULTSET_HAS_ZERO_OR_ONE_ROWS */;
COUNT( col_bigint )
0
INSERT INTO table0_bigint ( pk , col_bigint, col_char_12 ) VALUES ( 144 , SUBSTR( CAST( ( LENGTH( SUBSTR( CAST( ( LENGTH('SOIWR') ) AS CHAR(100) ) , 1 , 12 ) ) ) AS CHAR(100) ) , 1 , 12 ) , SUBSTR( CAST( ( ROUND( ROUND ( ROUND( ROUND( 124 + 101 ) * 0 ) ) * 10 ) ) AS CHAR(100) ) , 1 , 12 ) ) ;
SELECT * FROM table0_bigint ORDER BY pk;
col_char_12_key	col_char_12	col_bigint_key	pk	col_bigint
8-9	8-9	2	-1018	8
-10	NULL	-36	-100	NULL
99	99	NULL	-10	NULL
139	NULL	NULL	-9	NULL
0	NULL	158	-1	NULL
0	NULL	158	0	NULL
2	NULL	NULL	1	NULL
NULL	NULL	5	4	NULL
5	NULL	1	8	NULL
NULL	5	158	9	9
NULL	NULL	158	10	10
NULL	NULL	5	13	NULL
NULL	NULL	5	32	NULL
NULL	10	5	83	NULL
NULL	NULL	5	86	NULL
NULL	9	158	99	99
NULL	NULL	5	123	NULL
NULL	0	NULL	144	1
-10	NULL	-36	154	NULL
-90	NULL	-36	232	4
SELECT * FROM table0_bigint WHERE -100 <= SUBSTR( CAST( ( CEIL ( 232 ) ) AS CHAR(100) ) , 1 , 12 ) ORDER BY col_bigint_key DESC , col_char_12_key ASC , pk  LIMIT 7 , 1 /* RESULTSET_HAS_ZERO_OR_ONE_ROWS */;
col_char_12_key	col_char_12	col_bigint_key	pk	col_bigint
NULL	NULL	5	32	NULL
SELECT col_bigint,col_bigint_key,col_char_12,col_char_12_key,pk FROM table0_bigint WHERE col_bigint != SIGN ( 10 ) ORDER BY col_char_12_key , pk  LIMIT 1 , 1 /* RESULTSET_HAS_ZERO_OR_ONE_ROWS */;
col_bigint	col_bigint_key	col_char_12	col_char_12_key	pk
10	158	NULL	NULL	10
INSERT INTO table0_bigint ( pk , col_char_12_key ) VALUES ( 99, CAST( 0 AS CHAR(100)) ) , ( -1, CAST( 2 AS CHAR(100)) ) ;
ERROR 23000: Duplicate entry '99' for key 'PRIMARY'
SELECT * FROM table0_bigint ORDER BY pk;
col_char_12_key	col_char_12	col_bigint_key	pk	col_bigint
8-9	8-9	2	-1018	8
-10	NULL	-36	-100	NULL
99	99	NULL	-10	NULL
139	NULL	NULL	-9	NULL
0	NULL	158	-1	NULL
0	NULL	158	0	NULL
2	NULL	NULL	1	NULL
NULL	NULL	5	4	NULL
5	NULL	1	8	NULL
NULL	5	158	9	9
NULL	NULL	158	10	10
NULL	NULL	5	13	NULL
NULL	NULL	5	32	NULL
NULL	10	5	83	NULL
NULL	NULL	5	86	NULL
NULL	9	158	99	99
NULL	NULL	5	123	NULL
NULL	0	NULL	144	1
-10	NULL	-36	154	NULL
-90	NULL	-36	232	4
SELECT 1 FROM table0_bigint WHERE col_char_12_key BETWEEN CAST( 1 AS CHAR(100) ) AND CAST( 6 AS CHAR(100) ) FOR UPDATE;
1
1
1
1
UPDATE table0_bigint SET pk = SUBSTR( CAST( ( ROUND( 0 + ROUND( 10 * ROUND( 215 * 72 ) ) ) ) AS CHAR(100) ) , 1 , 12 ) WHERE col_bigint_key BETWEEN SUBSTR( CAST( ( ROUND( 1 * 5 ) ) AS CHAR(100) ) , 1 , 12 ) AND SUBSTR( CAST( ( ROUND( ABS ( ROUND ( ROUND( ROUND ( -10 ) * 10 ) ) ) * 1 ) ) AS CHAR(100) ) , 1 , 12 ) ORDER BY col_bigint_key , pk ASC LIMIT 3 ;
ERROR 23000: Duplicate entry '154800' for key 'PRIMARY'
SELECT * FROM table0_bigint ORDER BY pk;
col_char_12_key	col_char_12	col_bigint_key	pk	col_bigint
8-9	8-9	2	-1018	8
-10	NULL	-36	-100	NULL
99	99	NULL	-10	NULL
139	NULL	NULL	-9	NULL
0	NULL	158	-1	NULL
0	NULL	158	0	NULL
2	NULL	NULL	1	NULL
NULL	NULL	5	4	NULL
5	NULL	1	8	NULL
NULL	5	158	9	9
NULL	NULL	158	10	10
NULL	NULL	5	13	NULL
NULL	NULL	5	32	NULL
NULL	10	5	83	NULL
NULL	NULL	5	86	NULL
NULL	9	158	99	99
NULL	NULL	5	123	NULL
NULL	0	NULL	144	1
-10	NULL	-36	154	NULL
-90	NULL	-36	232	4
SELECT 1 FROM table0_bigint WHERE ( -291373056 , 85721088 , -50593792 , 2019557376 ) NOT IN ( ( SUBSTR( CAST( ( ROUND( 150 + 204 ) ) AS CHAR(100) ) , 1 , 12 ) , SUBSTR( CAST( ( LENGTH( SUBSTR( CAST( ( ROUND( 99 + 9 ) ) AS CHAR(100) ) , 1 , 12 ) ) ) AS CHAR(100) ) , 1 , 12 ) , SUBSTR( CAST( ( LENGTH('CZTQU') ) AS CHAR(100) ) , 1 , 12 ) , SUBSTR( CAST( ( ROUND ( 10 ) ) AS CHAR(100) ) , 1 , 12 ) ) ) FOR UPDATE;
1
1
1
1
1
1
1
1
1
1
1
1
1
1
1
1
1
1
1
1
1
SELECT UPPER( col_bigint_key ) FROM table0_bigint WHERE ( -1805254656 ) IN ( SUBSTR( CAST( ( 1 ) AS CHAR(100) ) , 1 , 12 ) , SUBSTR( CAST( ( ABS ( LENGTH( SUBSTR( CAST( ( ROUND( -9 + 120 ) ) AS CHAR(100) ) , 1 , 12 ) ) ) ) AS CHAR(100) ) , 1 , 12 ) , SUBSTR( CAST( ( 119 ) AS CHAR(100) ) , 1 , 12 ) , SUBSTR( CAST( ( ROUND( 3 * LENGTH('LSUYP') ) ) AS CHAR(100) ) , 1 , 12 ) , SUBSTR( CAST( ( ROUND( 10 + ROUND( 1 + ABS ( CEIL ( 99 ) ) ) ) ) AS CHAR(100) ) , 1 , 12 ) ) GROUP BY col_bigint_key ORDER BY col_bigint_key LIMIT 2;
UPPER( col_bigint_key )
SELECT 1 FROM table0_bigint WHERE ( 559742976 , -1506541568 , 681377792 ) NOT IN ( ( SUBSTR( CAST( ( ROUND( LENGTH('MJVVC') * -10 ) ) AS CHAR(100) ) , 1 , 12 ) , SUBSTR( CAST( ( LENGTH( SUBSTR( CAST( ( -1 ) AS CHAR(100) ) , 1 , 12 ) ) ) AS CHAR(100) ) , 1 , 12 ) , SUBSTR( CAST( ( LENGTH( SUBSTR( CAST( ( -1 ) AS CHAR(100) ) , 1 , 12 ) ) ) AS CHAR(100) ) , 1 , 12 ) ) , ( SUBSTR( CAST( ( LENGTH('GJMSV') ) AS CHAR(100) ) , 1 , 12 ) , SUBSTR( CAST( ( ABS ( 99 ) ) AS CHAR(100) ) , 1 , 12 ) , SUBSTR( CAST( ( LENGTH( SUBSTR( CAST( ( ROUND ( ROUND( CEIL ( -10 ) + -9 ) ) ) AS CHAR(100) ) , 1 , 12 ) ) ) AS CHAR(100) ) , 1 , 12 ) ) ) FOR UPDATE;
1
1
1
1
1
1
1
1
1
1
1
1
1
1
1
1
1
1
1
1
1
INSERT INTO table0_bigint ( pk , col_bigint, col_char_12 ) VALUES ( 10 , SUBSTR( CAST( ( ROUND( 9 * 4 ) ) AS CHAR(100) ) , 1 , 12 ) , SUBSTR( CAST( ( ROUND( -10 * 194 ) ) AS CHAR(100) ) , 1 , 12 ) ) ;
ERROR 23000: Duplicate entry '10' for key 'PRIMARY'
SELECT * FROM table0_bigint ORDER BY pk;
col_char_12_key	col_char_12	col_bigint_key	pk	col_bigint
8-9	8-9	2	-1018	8
-10	NULL	-36	-100	NULL
99	99	NULL	-10	NULL
139	NULL	NULL	-9	NULL
0	NULL	158	-1	NULL
0	NULL	158	0	NULL
2	NULL	NULL	1	NULL
NULL	NULL	5	4	NULL
5	NULL	1	8	NULL
NULL	5	158	9	9
NULL	NULL	158	10	10
NULL	NULL	5	13	NULL
NULL	NULL	5	32	NULL
NULL	10	5	83	NULL
NULL	NULL	5	86	NULL
NULL	9	158	99	99
NULL	NULL	5	123	NULL
NULL	0	NULL	144	1
-10	NULL	-36	154	NULL
-90	NULL	-36	232	4
SELECT * FROM table0_bigint WHERE col_bigint_key < CAST(-100 AS CHAR(100)) ORDER BY col_char_12_key , pk DESC LIMIT 7 , 8;
col_char_12_key	col_char_12	col_bigint_key	pk	col_bigint
INSERT INTO table0_bigint (pk) VALUES ( -1 ) ;
ERROR 23000: Duplicate entry '-1' for key 'PRIMARY'
SELECT * FROM table0_bigint ORDER BY pk;
col_char_12_key	col_char_12	col_bigint_key	pk	col_bigint
8-9	8-9	2	-1018	8
-10	NULL	-36	-100	NULL
99	99	NULL	-10	NULL
139	NULL	NULL	-9	NULL
0	NULL	158	-1	NULL
0	NULL	158	0	NULL
2	NULL	NULL	1	NULL
NULL	NULL	5	4	NULL
5	NULL	1	8	NULL
NULL	5	158	9	9
NULL	NULL	158	10	10
NULL	NULL	5	13	NULL
NULL	NULL	5	32	NULL
NULL	10	5	83	NULL
NULL	NULL	5	86	NULL
NULL	9	158	99	99
NULL	NULL	5	123	NULL
NULL	0	NULL	144	1
-10	NULL	-36	154	NULL
-90	NULL	-36	232	4
SELECT 1 FROM table0_bigint WHERE ROUND( 35 * 99 ) > col_bigint_key FOR UPDATE;
1
1
1
1
1
1
1
1
1
1
1
1
1
1
1
1
1
INSERT INTO table0_bigint ( pk , col_bigint, col_char_12 ) VALUES ( 9 , SUBSTR( CAST( ( ROUND( 191 * 3 ) ) AS CHAR(100) ) , 1 , 12 ) , SUBSTR( CAST( ( LENGTH('VBETU') ) AS CHAR(100) ) , 1 , 12 ) ) ;
ERROR 23000: Duplicate entry '9' for key 'PRIMARY'
SELECT * FROM table0_bigint ORDER BY pk;
col_char_12_key	col_char_12	col_bigint_key	pk	col_bigint
8-9	8-9	2	-1018	8
-10	NULL	-36	-100	NULL
99	99	NULL	-10	NULL
139	NULL	NULL	-9	NULL
0	NULL	158	-1	NULL
0	NULL	158	0	NULL
2	NULL	NULL	1	NULL
NULL	NULL	5	4	NULL
5	NULL	1	8	NULL
NULL	5	158	9	9
NULL	NULL	158	10	10
NULL	NULL	5	13	NULL
NULL	NULL	5	32	NULL
NULL	10	5	83	NULL
NULL	NULL	5	86	NULL
NULL	9	158	99	99
NULL	NULL	5	123	NULL
NULL	0	NULL	144	1
-10	NULL	-36	154	NULL
-90	NULL	-36	232	4
UPDATE table0_bigint SET pk = SUBSTR( CAST( ( ROUND( -100 - FLOOR ( -1 ) ) ) AS CHAR(100) ) , 1 , 12 ) , col_bigint_key = 9 , col_char_12_key = 'VJLWN' WHERE col_bigint > FLOOR ( -1 ) ORDER BY col_char_12_key , col_char_12_key , col_bigint_key , pk DESC LIMIT 3 ;
ERROR 23000: Duplicate entry '-99' for key 'PRIMARY'
SELECT * FROM table0_bigint ORDER BY pk;
col_char_12_key	col_char_12	col_bigint_key	pk	col_bigint
8-9	8-9	2	-1018	8
-10	NULL	-36	-100	NULL
99	99	NULL	-10	NULL
139	NULL	NULL	-9	NULL
0	NULL	158	-1	NULL
0	NULL	158	0	NULL
2	NULL	NULL	1	NULL
NULL	NULL	5	4	NULL
5	NULL	1	8	NULL
NULL	5	158	9	9
NULL	NULL	158	10	10
NULL	NULL	5	13	NULL
NULL	NULL	5	32	NULL
NULL	10	5	83	NULL
NULL	NULL	5	86	NULL
NULL	9	158	99	99
NULL	NULL	5	123	NULL
NULL	0	NULL	144	1
-10	NULL	-36	154	NULL
-90	NULL	-36	232	4
INSERT INTO table0_bigint ( pk , col_bigint_key ) VALUES ( 5 , SUBSTR( CAST( ( LENGTH( SUBSTR( CAST( ( ROUND ( LENGTH( SUBSTR( CAST( ( ROUND ( -1 ) ) AS CHAR(100) ) , 1 , 12 ) ) ) ) AS CHAR(100) ) , 1 , 12 ) ) ) AS CHAR(100) ) , 1 , 12 ) ) ;
SELECT * FROM table0_bigint ORDER BY pk;
col_char_12_key	col_char_12	col_bigint_key	pk	col_bigint
8-9	8-9	2	-1018	8
-10	NULL	-36	-100	NULL
99	99	NULL	-10	NULL
139	NULL	NULL	-9	NULL
0	NULL	158	-1	NULL
0	NULL	158	0	NULL
2	NULL	NULL	1	NULL
NULL	NULL	5	4	NULL
NULL	NULL	1	5	NULL
5	NULL	1	8	NULL
NULL	5	158	9	9
NULL	NULL	158	10	10
NULL	NULL	5	13	NULL
NULL	NULL	5	32	NULL
NULL	10	5	83	NULL
NULL	NULL	5	86	NULL
NULL	9	158	99	99
NULL	NULL	5	123	NULL
NULL	0	NULL	144	1
-10	NULL	-36	154	NULL
-90	NULL	-36	232	4
SELECT col_bigint FROM table0_bigint WHERE ( 1185415168 , -849805312 ) IN ( ( SUBSTR( CAST( ( LENGTH('BXPZX') ) AS CHAR(100) ) , 1 , 12 ) , SUBSTR( CAST( ( ROUND( 126 * CEIL ( -1 ) ) ) AS CHAR(100) ) , 1 , 12 ) ) , ( SUBSTR( CAST( ( ROUND( 0 - ROUND( LENGTH('NESRM') + -100 ) ) ) AS CHAR(100) ) , 1 , 12 ) , SUBSTR( CAST( ( FLOOR ( 0 ) ) AS CHAR(100) ) , 1 , 12 ) ) ) ORDER BY pk LIMIT 8 , 1 /* RESULTSET_HAS_ZERO_OR_ONE_ROWS */;
col_bigint
UPDATE table0_bigint SET pk = SUBSTR( CAST( ( LENGTH( SUBSTR( CAST( ( ROUND( 99 - -9 ) ) AS CHAR(100) ) , 1 , 12 ) ) ) AS CHAR(100) ) , 1 , 12 )  ORDER BY pk LIMIT 44 ;
ERROR 23000: Duplicate entry '3' for key 'PRIMARY'
SELECT * FROM table0_bigint ORDER BY pk;
col_char_12_key	col_char_12	col_bigint_key	pk	col_bigint
8-9	8-9	2	-1018	8
-10	NULL	-36	-100	NULL
99	99	NULL	-10	NULL
139	NULL	NULL	-9	NULL
0	NULL	158	-1	NULL
0	NULL	158	0	NULL
2	NULL	NULL	1	NULL
NULL	NULL	5	4	NULL
NULL	NULL	1	5	NULL
5	NULL	1	8	NULL
NULL	5	158	9	9
NULL	NULL	158	10	10
NULL	NULL	5	13	NULL
NULL	NULL	5	32	NULL
NULL	10	5	83	NULL
NULL	NULL	5	86	NULL
NULL	9	158	99	99
NULL	NULL	5	123	NULL
NULL	0	NULL	144	1
-10	NULL	-36	154	NULL
-90	NULL	-36	232	4
SELECT pk FROM table0_bigint  ORDER BY col_bigint  , col_char_12 ASC , pk  LIMIT 2 , 1 /* RESULTSET_HAS_ZERO_OR_ONE_ROWS */;
pk
-1
SELECT DISTINCT NULL , UPPER( col_char_12 ) , TRUE , FALSE , 1 FROM table0_bigint ORDER BY col_bigint_key , pk ASC;
NULL	UPPER( col_char_12 )	TRUE	FALSE	1
NULL	99	1	0	1
NULL	0	1	0	1
NULL	NULL	1	0	1
NULL	8-9	1	0	1
NULL	10	1	0	1
NULL	5	1	0	1
NULL	9	1	0	1
INSERT INTO table0_bigint (pk) VALUES ( -100 ) ;
ERROR 23000: Duplicate entry '-100' for key 'PRIMARY'
SELECT * FROM table0_bigint ORDER BY pk;
col_char_12_key	col_char_12	col_bigint_key	pk	col_bigint
8-9	8-9	2	-1018	8
-10	NULL	-36	-100	NULL
99	99	NULL	-10	NULL
139	NULL	NULL	-9	NULL
0	NULL	158	-1	NULL
0	NULL	158	0	NULL
2	NULL	NULL	1	NULL
NULL	NULL	5	4	NULL
NULL	NULL	1	5	NULL
5	NULL	1	8	NULL
NULL	5	158	9	9
NULL	NULL	158	10	10
NULL	NULL	5	13	NULL
NULL	NULL	5	32	NULL
NULL	10	5	83	NULL
NULL	NULL	5	86	NULL
NULL	9	158	99	99
NULL	NULL	5	123	NULL
NULL	0	NULL	144	1
-10	NULL	-36	154	NULL
-90	NULL	-36	232	4
SELECT pk , col_bigint_key , col_char_12 FROM table0_bigint WHERE col_bigint_key NOT IN ( SUBSTR( CAST( ( 1 ) AS CHAR(100) ) , 1 , 12 ) , SUBSTR( CAST( ( ROUND( FLOOR ( ROUND( ROUND( 9 + LENGTH('SLSCG') ) + 9 ) ) * 0 ) ) AS CHAR(100) ) , 1 , 12 ) , SUBSTR( CAST( ( ROUND( 9 - 1 ) ) AS CHAR(100) ) , 1 , 12 ) , SUBSTR( CAST( ( SIGN ( -9 ) ) AS CHAR(100) ) , 1 , 12 ) , SUBSTR( CAST( ( LENGTH('RSPYL') ) AS CHAR(100) ) , 1 , 12 ) ) ORDER BY col_bigint_key ASC , col_char_12_key  , pk  LIMIT 1 /* RESULTSET_HAS_ZERO_OR_ONE_ROWS */;
pk	col_bigint_key	col_char_12
-100	-36	NULL
SELECT pk , col_bigint , col_char_12 FROM table0_bigint WHERE pk > -1710751744 and pk < -1710751744 ORDER BY pk LIMIT 3 , 4 /* RESULTSET_HAS_ZERO_OR_ONE_ROWS */;
pk	col_bigint	col_char_12
UPDATE table0_bigint SET col_bigint_key = col_bigint_key WHERE col_bigint BETWEEN SUBSTR( CAST( ( CEIL ( 110 ) ) AS CHAR(100) ) , 1 , 12 ) AND SUBSTR( CAST( ( ROUND( 99 + ROUND( 99 * -9 ) ) ) AS CHAR(100) ) , 1 , 12 ) ORDER BY col_bigint_key , col_char_12_key , col_bigint_key , pk  LIMIT 7 ;
SELECT * FROM table0_bigint ORDER BY pk;
col_char_12_key	col_char_12	col_bigint_key	pk	col_bigint
8-9	8-9	2	-1018	8
-10	NULL	-36	-100	NULL
99	99	NULL	-10	NULL
139	NULL	NULL	-9	NULL
0	NULL	158	-1	NULL
0	NULL	158	0	NULL
2	NULL	NULL	1	NULL
NULL	NULL	5	4	NULL
NULL	NULL	1	5	NULL
5	NULL	1	8	NULL
NULL	5	158	9	9
NULL	NULL	158	10	10
NULL	NULL	5	13	NULL
NULL	NULL	5	32	NULL
NULL	10	5	83	NULL
NULL	NULL	5	86	NULL
NULL	9	158	99	99
NULL	NULL	5	123	NULL
NULL	0	NULL	144	1
-10	NULL	-36	154	NULL
-90	NULL	-36	232	4
SELECT 1 FROM table0_bigint WHERE LENGTH( SUBSTR( CAST( ( SIGN ( 10 ) ) AS CHAR(100) ) , 1 , 12 ) ) < ABS ( 10 ) FOR UPDATE;
1
1
1
1
1
1
1
1
1
1
1
1
1
1
1
1
1
1
1
1
1
1
SELECT col_bigint_key , col_char_12_key FROM table0_bigint WHERE col_char_12 NOT IN ( SUBSTR( CAST( ( LENGTH( SUBSTR( CAST( ( LENGTH('NVWWV') ) AS CHAR(100) ) , 1 , 12 ) ) ) AS CHAR(100) ) , 1 , 12 ) , SUBSTR( CAST( ( ABS ( LENGTH('ZKBFA') ) ) AS CHAR(100) ) , 1 , 12 ) , SUBSTR( CAST( ( LENGTH( SUBSTR( CAST( ( ROUND( -1 - LENGTH( SUBSTR( CAST( ( ROUND( LENGTH('JLQHH') + 160 ) ) AS CHAR(100) ) , 1 , 12 ) ) ) ) AS CHAR(100) ) , 1 , 12 ) ) ) AS CHAR(100) ) , 1 , 12 ) , SUBSTR( CAST( ( SIGN ( LENGTH('IVWYA') ) ) AS CHAR(100) ) , 1 , 12 ) , SUBSTR( CAST( ( ABS ( 0 ) ) AS CHAR(100) ) , 1 , 12 ) ) ORDER BY col_bigint ASC , col_char_12_key  , pk ASC LIMIT 1 /* RESULTSET_HAS_ZERO_OR_ONE_ROWS */;
col_bigint_key	col_char_12_key
5	NULL
SELECT * FROM table0_bigint WHERE col_bigint_key BETWEEN SUBSTR( CAST( ( ROUND( 5 + 38 ) ) AS CHAR(100) ) , 1 , 12 ) AND SUBSTR( CAST( ( ROUND ( ROUND( LENGTH('RVBDE') - 0 ) ) ) AS CHAR(100) ) , 1 , 12 ) ORDER BY col_char_12_key , col_char_12_key , pk ASC LIMIT 6 , 5;
col_char_12_key	col_char_12	col_bigint_key	pk	col_bigint
UPDATE table0_bigint SET pk = SUBSTR( CAST( ( LENGTH( SUBSTR( CAST( ( ROUND( 10 * 9 ) ) AS CHAR(100) ) , 1 , 12 ) ) ) AS CHAR(100) ) , 1 , 12 ) WHERE col_bigint_key = ( SUBSTR( CAST( ( SIGN ( LENGTH( SUBSTR( CAST( ( ROUND( 9 * -10 ) ) AS CHAR(100) ) , 1 , 12 ) ) ) ) AS CHAR(100) ) , 1 , 12 ) ) ORDER BY pk LIMIT 4 ;
ERROR 23000: Duplicate entry '2' for key 'PRIMARY'
SELECT * FROM table0_bigint ORDER BY pk;
col_char_12_key	col_char_12	col_bigint_key	pk	col_bigint
8-9	8-9	2	-1018	8
-10	NULL	-36	-100	NULL
99	99	NULL	-10	NULL
139	NULL	NULL	-9	NULL
0	NULL	158	-1	NULL
0	NULL	158	0	NULL
2	NULL	NULL	1	NULL
NULL	NULL	5	4	NULL
NULL	NULL	1	5	NULL
5	NULL	1	8	NULL
NULL	5	158	9	9
NULL	NULL	158	10	10
NULL	NULL	5	13	NULL
NULL	NULL	5	32	NULL
NULL	10	5	83	NULL
NULL	NULL	5	86	NULL
NULL	9	158	99	99
NULL	NULL	5	123	NULL
NULL	0	NULL	144	1
-10	NULL	-36	154	NULL
-90	NULL	-36	232	4
SELECT col_bigint,col_bigint_key,col_char_12,col_char_12_key,pk FROM table0_bigint WHERE ( 1924792320 , 1681719296 , 1575288832 , -1209073664 , 1176567808 ) NOT IN ( ( SUBSTR( CAST( ( ROUND( 31 - LENGTH('XCMRL') ) ) AS CHAR(100) ) , 1 , 12 ) , SUBSTR( CAST( ( ROUND( -9 * 130 ) ) AS CHAR(100) ) , 1 , 12 ) , SUBSTR( CAST( ( ROUND( 1 + LENGTH('NXWNE') ) ) AS CHAR(100) ) , 1 , 12 ) , SUBSTR( CAST( ( LENGTH( SUBSTR( CAST( ( 9 ) AS CHAR(100) ) , 1 , 12 ) ) ) AS CHAR(100) ) , 1 , 12 ) , SUBSTR( CAST( ( ROUND( LENGTH('VGKHM') - 78 ) ) AS CHAR(100) ) , 1 , 12 ) ) ) GROUP BY col_bigint,col_bigint_key,col_char_12,col_char_12_key,pk ORDER BY col_bigint,col_bigint_key,col_char_12,col_char_12_key,pk LIMIT 6;
col_bigint	col_bigint_key	col_char_12	col_char_12_key	pk
NULL	NULL	NULL	139	-9
NULL	NULL	NULL	2	1
NULL	NULL	99	99	-10
NULL	-36	NULL	-10	-100
NULL	-36	NULL	-10	154
NULL	1	NULL	NULL	5
UPDATE table0_bigint SET pk = SUBSTR( CAST( ( CEIL ( LENGTH( SUBSTR( CAST( ( ROUND( 9 - -100 ) ) AS CHAR(100) ) , 1 , 12 ) ) ) ) AS CHAR(100) ) , 1 , 12 )  ORDER BY pk , col_bigint_key,pk ASC , pk  LIMIT 184 ;
ERROR 23000: Duplicate entry '3' for key 'PRIMARY'
SELECT * FROM table0_bigint ORDER BY pk;
col_char_12_key	col_char_12	col_bigint_key	pk	col_bigint
8-9	8-9	2	-1018	8
-10	NULL	-36	-100	NULL
99	99	NULL	-10	NULL
139	NULL	NULL	-9	NULL
0	NULL	158	-1	NULL
0	NULL	158	0	NULL
2	NULL	NULL	1	NULL
NULL	NULL	5	4	NULL
NULL	NULL	1	5	NULL
5	NULL	1	8	NULL
NULL	5	158	9	9
NULL	NULL	158	10	10
NULL	NULL	5	13	NULL
NULL	NULL	5	32	NULL
NULL	10	5	83	NULL
NULL	NULL	5	86	NULL
NULL	9	158	99	99
NULL	NULL	5	123	NULL
NULL	0	NULL	144	1
-10	NULL	-36	154	NULL
-90	NULL	-36	232	4
SELECT col_bigint_key FROM table0_bigint WHERE col_bigint IN ( SUBSTR( CAST( ( LENGTH( SUBSTR( CAST( ( LENGTH('WDHEK') ) AS CHAR(100) ) , 1 , 12 ) ) ) AS CHAR(100) ) , 1 , 12 ) , SUBSTR( CAST( ( ROUND( 4 + -100 ) ) AS CHAR(100) ) , 1 , 12 ) , SUBSTR( CAST( ( ROUND( LENGTH('XNEDU') * 124 ) ) AS CHAR(100) ) , 1 , 12 ) , SUBSTR( CAST( ( LENGTH('BXFFX') ) AS CHAR(100) ) , 1 , 12 ) , SUBSTR( CAST( ( ROUND( -100 * 9 ) ) AS CHAR(100) ) , 1 , 12 ) ) ORDER BY pk LIMIT 2 , 1 /* RESULTSET_HAS_ZERO_OR_ONE_ROWS */;
col_bigint_key
SELECT col_char_12 FROM table0_bigint WHERE col_bigint BETWEEN SUBSTR( CAST( ( ROUND( 0 * LENGTH('JDQXV') ) ) AS CHAR(100) ) , 1 , 12 ) AND SUBSTR( CAST( ( 10 ) AS CHAR(100) ) , 1 , 12 ) ORDER BY col_bigint_key,pk  , pk DESC LIMIT 70 , 1 /* RESULTSET_HAS_ZERO_OR_ONE_ROWS */;
col_char_12
UPDATE table0_bigint SET pk = SUBSTR( CAST( ( 9 ) AS CHAR(100) ) , 1 , 12 ) WHERE pk = ( SUBSTR( CAST( ( ROUND( ABS ( LENGTH( SUBSTR( CAST( ( LENGTH( SUBSTR( CAST( ( LENGTH('CEJDE') ) AS CHAR(100) ) , 1 , 12 ) ) ) AS CHAR(100) ) , 1 , 12 ) ) ) * 0 ) ) AS CHAR(100) ) , 1 , 12 ) ) ORDER BY col_bigint DESC , pk ASC LIMIT 3 ;
ERROR 23000: Duplicate entry '9' for key 'PRIMARY'
SELECT * FROM table0_bigint ORDER BY pk;
col_char_12_key	col_char_12	col_bigint_key	pk	col_bigint
8-9	8-9	2	-1018	8
-10	NULL	-36	-100	NULL
99	99	NULL	-10	NULL
139	NULL	NULL	-9	NULL
0	NULL	158	-1	NULL
0	NULL	158	0	NULL
2	NULL	NULL	1	NULL
NULL	NULL	5	4	NULL
NULL	NULL	1	5	NULL
5	NULL	1	8	NULL
NULL	5	158	9	9
NULL	NULL	158	10	10
NULL	NULL	5	13	NULL
NULL	NULL	5	32	NULL
NULL	10	5	83	NULL
NULL	NULL	5	86	NULL
NULL	9	158	99	99
NULL	NULL	5	123	NULL
NULL	0	NULL	144	1
-10	NULL	-36	154	NULL
-90	NULL	-36	232	4
SELECT ALL NULL , pk , TRUE , col_bigint_key , FALSE , 1 FROM table0_bigint ORDER BY col_bigint,col_bigint_key,col_char_12,col_char_12_key,pk,pk ASC , pk DESC;
NULL	pk	TRUE	col_bigint_key	FALSE	1
NULL	-9	1	NULL	0	1
NULL	1	1	NULL	0	1
NULL	-10	1	NULL	0	1
NULL	-100	1	-36	0	1
NULL	154	1	-36	0	1
NULL	5	1	1	0	1
NULL	8	1	1	0	1
NULL	4	1	5	0	1
NULL	13	1	5	0	1
NULL	32	1	5	0	1
NULL	86	1	5	0	1
NULL	123	1	5	0	1
NULL	83	1	5	0	1
NULL	-1	1	158	0	1
NULL	0	1	158	0	1
NULL	144	1	NULL	0	1
NULL	232	1	-36	0	1
NULL	-1018	1	2	0	1
NULL	9	1	158	0	1
NULL	10	1	158	0	1
NULL	99	1	158	0	1
SELECT UPPER( col_char_12_key ),pk FROM table0_bigint WHERE ( -1984757760 , -510132224 , 1967783936 , -1164640256 ) NOT IN ( ( SUBSTR( CAST( ( ROUND( ROUND( 99 * ROUND( -9 + ROUND( 9 * CEIL ( 7 ) ) ) ) - 63 ) ) AS CHAR(100) ) , 1 , 12 ) , SUBSTR( CAST( ( ROUND( 99 * ROUND( 99 * 1 ) ) ) AS CHAR(100) ) , 1 , 12 ) , SUBSTR( CAST( ( FLOOR ( ROUND( 10 * ABS ( 0 ) ) ) ) AS CHAR(100) ) , 1 , 12 ) , SUBSTR( CAST( ( ROUND( -10 - ABS ( ROUND( ROUND( 9 * ROUND( 180 + -9 ) ) + 171 ) ) ) ) AS CHAR(100) ) , 1 , 12 ) ) ) GROUP BY col_char_12_key,pk ORDER BY col_char_12_key,pk LIMIT 5 , 8;
UPPER( col_char_12_key )	pk
NULL	32
NULL	83
NULL	86
NULL	99
NULL	123
NULL	144
-10	-100
-10	154
INSERT INTO table0_bigint ( pk , col_bigint, col_char_12_key ) VALUES ( 1 , SUBSTR( CAST( ( LENGTH( SUBSTR( CAST( ( ROUND( -10 + ROUND( CEIL ( ROUND( 9 + 1 ) ) + 154 ) ) ) AS CHAR(100) ) , 1 , 12 ) ) ) AS CHAR(100) ) , 1 , 12 ) , SUBSTR( CAST( ( LENGTH( SUBSTR( CAST( ( FLOOR ( -10 ) ) AS CHAR(100) ) , 1 , 12 ) ) ) AS CHAR(100) ) , 1 , 12 ) ) ;
ERROR 23000: Duplicate entry '1' for key 'PRIMARY'
SELECT * FROM table0_bigint ORDER BY pk;
col_char_12_key	col_char_12	col_bigint_key	pk	col_bigint
8-9	8-9	2	-1018	8
-10	NULL	-36	-100	NULL
99	99	NULL	-10	NULL
139	NULL	NULL	-9	NULL
0	NULL	158	-1	NULL
0	NULL	158	0	NULL
2	NULL	NULL	1	NULL
NULL	NULL	5	4	NULL
NULL	NULL	1	5	NULL
5	NULL	1	8	NULL
NULL	5	158	9	9
NULL	NULL	158	10	10
NULL	NULL	5	13	NULL
NULL	NULL	5	32	NULL
NULL	10	5	83	NULL
NULL	NULL	5	86	NULL
NULL	9	158	99	99
NULL	NULL	5	123	NULL
NULL	0	NULL	144	1
-10	NULL	-36	154	NULL
-90	NULL	-36	232	4
SELECT * FROM table0_bigint WHERE SUBSTR( CAST( ( CEIL ( LENGTH('DVGQM') ) ) AS CHAR(100) ) , 1 , 12 ) < LENGTH('BEPHP') ORDER BY pk,pk DESC , pk ASC LIMIT 2;
col_char_12_key	col_char_12	col_bigint_key	pk	col_bigint
SELECT col_bigint,col_bigint_key,col_char_12,col_char_12_key,pk FROM table0_bigint WHERE ROUND( -100 * -1 ) < 44 ORDER BY col_bigint_key , pk DESC LIMIT 6 , 5;
col_bigint	col_bigint_key	col_char_12	col_char_12_key	pk
INSERT INTO table0_bigint ( pk , col_bigint, col_char_12 ) VALUES ( -10 , SUBSTR( CAST( ( ROUND( LENGTH('EEMNV') * 99 ) ) AS CHAR(100) ) , 1 , 12 ) , SUBSTR( CAST( ( ROUND( 1 - 0 ) ) AS CHAR(100) ) , 1 , 12 ) ) ;
ERROR 23000: Duplicate entry '-10' for key 'PRIMARY'
SELECT * FROM table0_bigint ORDER BY pk;
col_char_12_key	col_char_12	col_bigint_key	pk	col_bigint
8-9	8-9	2	-1018	8
-10	NULL	-36	-100	NULL
99	99	NULL	-10	NULL
139	NULL	NULL	-9	NULL
0	NULL	158	-1	NULL
0	NULL	158	0	NULL
2	NULL	NULL	1	NULL
NULL	NULL	5	4	NULL
NULL	NULL	1	5	NULL
5	NULL	1	8	NULL
NULL	5	158	9	9
NULL	NULL	158	10	10
NULL	NULL	5	13	NULL
NULL	NULL	5	32	NULL
NULL	10	5	83	NULL
NULL	NULL	5	86	NULL
NULL	9	158	99	99
NULL	NULL	5	123	NULL
NULL	0	NULL	144	1
-10	NULL	-36	154	NULL
-90	NULL	-36	232	4
SELECT ALL FALSE FROM table0_bigint ORDER BY col_char_12_key , pk DESC;
FALSE
0
0
0
0
0
0
0
0
0
0
0
0
0
0
0
0
0
0
0
0
0
SELECT col_bigint_key , col_char_12_key FROM table0_bigint WHERE col_bigint BETWEEN SUBSTR( CAST( ( 9 ) AS CHAR(100) ) , 1 , 12 ) AND SUBSTR( CAST( ( LENGTH( SUBSTR( CAST( ( ROUND ( ROUND( 10 * 99 ) ) ) AS CHAR(100) ) , 1 , 12 ) ) ) AS CHAR(100) ) , 1 , 12 ) ORDER BY col_char_12_key , col_char_12_key , pk ASC LIMIT 8 , 1 /* RESULTSET_HAS_ZERO_OR_ONE_ROWS */;
col_bigint_key	col_char_12_key
INSERT INTO table0_bigint ( pk , col_char_12_key ) VALUES ( 10 , SUBSTR( CAST( ( LENGTH('QGBWI') ) AS CHAR(100) ) , 1 , 12 ) ) ;
ERROR 23000: Duplicate entry '10' for key 'PRIMARY'
SELECT * FROM table0_bigint ORDER BY pk;
col_char_12_key	col_char_12	col_bigint_key	pk	col_bigint
8-9	8-9	2	-1018	8
-10	NULL	-36	-100	NULL
99	99	NULL	-10	NULL
139	NULL	NULL	-9	NULL
0	NULL	158	-1	NULL
0	NULL	158	0	NULL
2	NULL	NULL	1	NULL
NULL	NULL	5	4	NULL
NULL	NULL	1	5	NULL
5	NULL	1	8	NULL
NULL	5	158	9	9
NULL	NULL	158	10	10
NULL	NULL	5	13	NULL
NULL	NULL	5	32	NULL
NULL	10	5	83	NULL
NULL	NULL	5	86	NULL
NULL	9	158	99	99
NULL	NULL	5	123	NULL
NULL	0	NULL	144	1
-10	NULL	-36	154	NULL
-90	NULL	-36	232	4
SELECT col_bigint,col_bigint_key,col_char_12,col_char_12_key,pk FROM table0_bigint WHERE LENGTH( SUBSTR( CAST( ( ROUND( 99 - 1 ) ) AS CHAR(100) ) , 1 , 12 ) ) <= SUBSTR( CAST( ( ROUND( 0 * -9 ) ) AS CHAR(100) ) , 1 , 12 ) ORDER BY col_bigint_key  , col_char_12_key ASC , pk ASC LIMIT 4 , 1 /* RESULTSET_HAS_ZERO_OR_ONE_ROWS */;
col_bigint	col_bigint_key	col_char_12	col_char_12_key	pk
SELECT col_bigint,col_bigint_key,col_char_12,col_char_12_key,pk FROM table0_bigint WHERE pk != ( SUBSTR( CAST( ( LENGTH( SUBSTR( CAST( ( ROUND( 99 - LENGTH('DOTCF') ) ) AS CHAR(100) ) , 1 , 12 ) ) ) AS CHAR(100) ) , 1 , 12 ) ) GROUP BY col_bigint,col_bigint_key,col_char_12,col_char_12_key,pk ORDER BY col_bigint,col_bigint_key,col_char_12,col_char_12_key,pk LIMIT 5;
col_bigint	col_bigint_key	col_char_12	col_char_12_key	pk
NULL	NULL	NULL	139	-9
NULL	NULL	NULL	2	1
NULL	NULL	99	99	-10
NULL	-36	NULL	-10	-100
NULL	-36	NULL	-10	154
SELECT col_bigint , col_char_12 FROM table0_bigint WHERE pk BETWEEN SUBSTR( CAST( ( FLOOR ( ROUND( -1 * ROUND( 99 - ROUND( 10 - 199 ) ) ) ) ) AS CHAR(100) ) , 1 , 12 ) AND SUBSTR( CAST( ( ROUND( -100 - 0 ) ) AS CHAR(100) ) , 1 , 12 ) ORDER BY pk , col_bigint , col_char_12,pk  , pk DESC LIMIT 8 , 1 /* RESULTSET_HAS_ZERO_OR_ONE_ROWS */;
col_bigint	col_char_12
SELECT  NULL FROM table0_bigint ORDER BY col_bigint_key , pk DESC;
NULL
NULL
NULL
NULL
NULL
NULL
NULL
NULL
NULL
NULL
NULL
NULL
NULL
NULL
NULL
NULL
NULL
NULL
NULL
NULL
NULL
NULL
SELECT col_bigint,col_bigint_key,col_char_12,col_char_12_key,pk FROM table0_bigint WHERE pk NOT IN ( 9 , 9 , 99 , -100 , -1 ) GROUP BY col_bigint,col_bigint_key,col_char_12,col_char_12_key,pk ORDER BY col_bigint,col_bigint_key,col_char_12,col_char_12_key,pk LIMIT 2 , 4;
col_bigint	col_bigint_key	col_char_12	col_char_12_key	pk
NULL	NULL	99	99	-10
NULL	-36	NULL	-10	154
NULL	1	NULL	NULL	5
NULL	1	NULL	5	8
UPDATE table0_bigint AS X SET X . col_char_12_key = SUBSTR( CAST( ( -1 ) AS CHAR(100) ) , 1 , 12 ) WHERE 2 <= LENGTH( SUBSTR( CAST( ( SIGN ( 0 ) ) AS CHAR(100) ) , 1 , 12 ) ) ORDER BY col_bigint_key , col_bigint_key , col_bigint_key , pk  LIMIT 9 ;
SELECT * FROM table0_bigint ORDER BY pk;
col_char_12_key	col_char_12	col_bigint_key	pk	col_bigint
8-9	8-9	2	-1018	8
-10	NULL	-36	-100	NULL
99	99	NULL	-10	NULL
139	NULL	NULL	-9	NULL
0	NULL	158	-1	NULL
0	NULL	158	0	NULL
2	NULL	NULL	1	NULL
NULL	NULL	5	4	NULL
NULL	NULL	1	5	NULL
5	NULL	1	8	NULL
NULL	5	158	9	9
NULL	NULL	158	10	10
NULL	NULL	5	13	NULL
NULL	NULL	5	32	NULL
NULL	10	5	83	NULL
NULL	NULL	5	86	NULL
NULL	9	158	99	99
NULL	NULL	5	123	NULL
NULL	0	NULL	144	1
-10	NULL	-36	154	NULL
-90	NULL	-36	232	4
SELECT col_bigint_key FROM table0_bigint WHERE col_bigint_key <= ( SUBSTR( CAST( ( ROUND( 172 + ROUND( -9 * SIGN ( ROUND( FLOOR ( 1 ) - 99 ) ) ) ) ) AS CHAR(100) ) , 1 , 12 ) ) ORDER BY col_bigint_key DESC , pk  LIMIT 113 , 3;
col_bigint_key
SELECT col_bigint_key FROM table0_bigint WHERE col_char_12_key BETWEEN CAST( 4 AS CHAR(100) ) AND CAST( 7 AS CHAR(100) ) ORDER BY pk LIMIT 7 , 1 /* RESULTSET_HAS_ZERO_OR_ONE_ROWS */;
col_bigint_key
SELECT UPPER( col_char_12 ) FROM table0_bigint WHERE pk != ( SUBSTR( CAST( ( CEIL ( ROUND( ROUND( ROUND( -10 * SIGN ( 99 ) ) * 99 ) - 0 ) ) ) AS CHAR(100) ) , 1 , 12 ) ) GROUP BY col_char_12 ORDER BY col_char_12 LIMIT 121 , 1;
UPPER( col_char_12 )
SELECT DISTINCT 9999 FROM table0_bigint ORDER BY col_bigint_key ASC , pk DESC;
9999
9999
SELECT ALL NULL FROM table0_bigint ORDER BY col_bigint , col_char_12,pk DESC , pk ASC;
NULL
NULL
NULL
NULL
NULL
NULL
NULL
NULL
NULL
NULL
NULL
NULL
NULL
NULL
NULL
NULL
NULL
NULL
NULL
NULL
NULL
NULL
SELECT pk , col_bigint , col_char_12_key FROM table0_bigint WHERE ( 2115829760 ) NOT IN ( SUBSTR( CAST( ( ROUND( ROUND( ROUND( ROUND( -1 + -1 ) * -1 ) - -100 ) * 147 ) ) AS CHAR(100) ) , 1 , 12 ) , SUBSTR( CAST( ( ABS ( 8 ) ) AS CHAR(100) ) , 1 , 12 ) , SUBSTR( CAST( ( ROUND( CEIL ( -100 ) - 9 ) ) AS CHAR(100) ) , 1 , 12 ) , SUBSTR( CAST( ( LENGTH('JJVRY') ) AS CHAR(100) ) , 1 , 12 ) , SUBSTR( CAST( ( LENGTH('ILFCR') ) AS CHAR(100) ) , 1 , 12 ) ) ORDER BY col_bigint , col_char_12_key,pk ASC , pk DESC LIMIT 1;
pk	col_bigint	col_char_12_key
4	NULL	NULL
UPDATE table0_bigint SET col_char_12_key = SUBSTR( CAST( ( LENGTH('ULIRZ') ) AS CHAR(100) ) , 1 , 12 ) WHERE col_bigint IN ( -9 , -100 , 1 , 35 , -100 ) ORDER BY pk LIMIT 4 ;
SELECT * FROM table0_bigint ORDER BY pk;
col_char_12_key	col_char_12	col_bigint_key	pk	col_bigint
8-9	8-9	2	-1018	8
-10	NULL	-36	-100	NULL
99	99	NULL	-10	NULL
139	NULL	NULL	-9	NULL
0	NULL	158	-1	NULL
0	NULL	158	0	NULL
2	NULL	NULL	1	NULL
NULL	NULL	5	4	NULL
NULL	NULL	1	5	NULL
5	NULL	1	8	NULL
NULL	5	158	9	9
NULL	NULL	158	10	10
NULL	NULL	5	13	NULL
NULL	NULL	5	32	NULL
NULL	10	5	83	NULL
NULL	NULL	5	86	NULL
NULL	9	158	99	99
NULL	NULL	5	123	NULL
5	0	NULL	144	1
-10	NULL	-36	154	NULL
-90	NULL	-36	232	4
SELECT 1 FROM table0_bigint WHERE NOT ( pk < SUBSTR( CAST( ( CEIL ( 9 ) ) AS CHAR(100) ) , 1 , 12 ) ) AND NOT ( col_bigint_key >= SUBSTR( CAST( ( ROUND ( -1 ) ) AS CHAR(100) ) , 1 , 12 ) ) OR  ( pk <> SUBSTR( CAST( ( LENGTH( SUBSTR( CAST( ( ROUND( LENGTH('KFRBI') * 9 ) ) AS CHAR(100) ) , 1 , 12 ) ) ) AS CHAR(100) ) , 1 , 12 ) ) FOR UPDATE;
1
1
1
1
1
1
1
1
1
1
1
1
1
1
1
1
1
1
1
1
1
1
SELECT 1 FROM table0_bigint WHERE FLOOR ( 1 ) != ROUND ( 0 ) FOR UPDATE;
1
1
1
1
1
1
1
1
1
1
1
1
1
1
1
1
1
1
1
1
1
1
SELECT col_bigint_key , col_char_12_key FROM table0_bigint WHERE pk = 10 ORDER BY col_bigint_key  , col_char_12_key  , pk  LIMIT 2 , 1 /* RESULTSET_HAS_ZERO_OR_ONE_ROWS */;
col_bigint_key	col_char_12_key
SELECT pk , col_bigint , col_char_12_key FROM table0_bigint WHERE ( -13369344 , -1029636096 , -1161560064 , -938737664 ) IN ( ( SUBSTR( CAST( ( SIGN ( 0 ) ) AS CHAR(100) ) , 1 , 12 ) , SUBSTR( CAST( ( FLOOR ( -10 ) ) AS CHAR(100) ) , 1 , 12 ) , SUBSTR( CAST( ( LENGTH('MMOVD') ) AS CHAR(100) ) , 1 , 12 ) , SUBSTR( CAST( ( LENGTH('DKPGA') ) AS CHAR(100) ) , 1 , 12 ) ) ) ORDER BY pk DESC , pk ASC LIMIT 4 , 1 /* RESULTSET_HAS_ZERO_OR_ONE_ROWS */;
pk	col_bigint	col_char_12_key
SELECT UPPER( col_bigint_key ),pk FROM table0_bigint WHERE col_bigint IN ( 99 , 74 , 0 , 1 , 9 ) GROUP BY col_bigint_key,pk ORDER BY col_bigint_key,pk LIMIT 1 , 3;
UPPER( col_bigint_key )	pk
158	9
158	99
SELECT 1 FROM table0_bigint WHERE pk != ( SUBSTR( CAST( ( ROUND( 99 - ABS ( 99 ) ) ) AS CHAR(100) ) , 1 , 12 ) ) AND col_bigint >= ( SUBSTR( CAST( ( ROUND( LENGTH('OSUBQ') + 1 ) ) AS CHAR(100) ) , 1 , 12 ) ) FOR UPDATE;
1
1
1
1
1
SELECT * FROM table0_bigint WHERE col_char_12_key < CAST(-100 AS CHAR(100)) ORDER BY col_char_12_key , pk ASC LIMIT 205 , 1;
col_char_12_key	col_char_12	col_bigint_key	pk	col_bigint
SELECT UPPER( col_bigint_key ),pk FROM table0_bigint WHERE  ( col_bigint_key != SUBSTR( CAST( ( ROUND ( ROUND( -9 * 9 ) ) ) AS CHAR(100) ) , 1 , 12 ) ) OR  ( col_bigint_key > SUBSTR( CAST( ( ROUND( 10 - LENGTH( SUBSTR( CAST( ( ROUND( ROUND( 9 + 99 ) + -10 ) ) AS CHAR(100) ) , 1 , 12 ) ) ) ) AS CHAR(100) ) , 1 , 12 ) ) GROUP BY col_bigint_key,pk ORDER BY col_bigint_key,pk LIMIT 5 , 7;
UPPER( col_bigint_key )	pk
2	-1018
5	4
5	13
5	32
5	83
5	86
5	123
SELECT col_char_12 FROM table0_bigint WHERE col_char_12_key = ( SUBSTR( CAST( ( SIGN ( LENGTH('VXQGA') ) ) AS CHAR(100) ) , 1 , 12 ) ) AND col_bigint_key != ( SUBSTR( CAST( ( ROUND( 99 * ROUND ( FLOOR ( -1 ) ) ) ) AS CHAR(100) ) , 1 , 12 ) ) ORDER BY col_bigint_key , col_char_12_key , pk  LIMIT 1 /* RESULTSET_HAS_ZERO_OR_ONE_ROWS */;
col_char_12
SELECT 1 FROM table0_bigint WHERE -9 >= SIGN ( -10 ) FOR UPDATE;
1
SELECT pk , col_bigint_key , col_char_12 FROM table0_bigint WHERE pk IN ( SUBSTR( CAST( ( FLOOR ( 10 ) ) AS CHAR(100) ) , 1 , 12 ) , SUBSTR( CAST( ( ROUND ( LENGTH('KPINT') ) ) AS CHAR(100) ) , 1 , 12 ) , SUBSTR( CAST( ( CEIL ( 134 ) ) AS CHAR(100) ) , 1 , 12 ) , SUBSTR( CAST( ( FLOOR ( -9 ) ) AS CHAR(100) ) , 1 , 12 ) , SUBSTR( CAST( ( ROUND( LENGTH( SUBSTR( CAST( ( CEIL ( -10 ) ) AS CHAR(100) ) , 1 , 12 ) ) * 1 ) ) AS CHAR(100) ) , 1 , 12 ) ) ORDER BY col_bigint_key , col_bigint_key , pk DESC LIMIT 1 /* RESULTSET_HAS_ZERO_OR_ONE_ROWS */;
pk	col_bigint_key	col_char_12
-9	NULL	NULL
SELECT  NULL , UPPER( col_bigint ) , TRUE , FALSE , 1 FROM table0_bigint ORDER BY col_bigint DESC , col_char_12_key DESC , pk DESC;
NULL	UPPER( col_bigint )	TRUE	FALSE	1
NULL	99	1	0	1
NULL	10	1	0	1
NULL	9	1	0	1
NULL	8	1	0	1
NULL	4	1	0	1
NULL	1	1	0	1
NULL	NULL	1	0	1
NULL	NULL	1	0	1
NULL	NULL	1	0	1
NULL	NULL	1	0	1
NULL	NULL	1	0	1
NULL	NULL	1	0	1
NULL	NULL	1	0	1
NULL	NULL	1	0	1
NULL	NULL	1	0	1
NULL	NULL	1	0	1
NULL	NULL	1	0	1
NULL	NULL	1	0	1
NULL	NULL	1	0	1
NULL	NULL	1	0	1
NULL	NULL	1	0	1
INSERT INTO table0_bigint ( pk , col_bigint_key ) VALUES ( -10, CAST( -1 AS CHAR(100)) ) , ( -1, CAST( 10 AS CHAR(100)) ) ;
ERROR 23000: Duplicate entry '-10' for key 'PRIMARY'
SELECT * FROM table0_bigint ORDER BY pk;
col_char_12_key	col_char_12	col_bigint_key	pk	col_bigint
8-9	8-9	2	-1018	8
-10	NULL	-36	-100	NULL
99	99	NULL	-10	NULL
139	NULL	NULL	-9	NULL
0	NULL	158	-1	NULL
0	NULL	158	0	NULL
2	NULL	NULL	1	NULL
NULL	NULL	5	4	NULL
NULL	NULL	1	5	NULL
5	NULL	1	8	NULL
NULL	5	158	9	9
NULL	NULL	158	10	10
NULL	NULL	5	13	NULL
NULL	NULL	5	32	NULL
NULL	10	5	83	NULL
NULL	NULL	5	86	NULL
NULL	9	158	99	99
NULL	NULL	5	123	NULL
5	0	NULL	144	1
-10	NULL	-36	154	NULL
-90	NULL	-36	232	4
INSERT INTO table0_bigint ( pk , col_bigint, col_char_12 ) VALUES ( 9 , SUBSTR( CAST( ( CEIL ( ROUND ( -100 ) ) ) AS CHAR(100) ) , 1 , 12 ) , SUBSTR( CAST( ( ROUND( ROUND( LENGTH( SUBSTR( CAST( ( ROUND( 220 + ROUND( LENGTH( SUBSTR( CAST( ( 169 ) AS CHAR(100) ) , 1 , 12 ) ) * -10 ) ) ) AS CHAR(100) ) , 1 , 12 ) ) + 213 ) + 229 ) ) AS CHAR(100) ) , 1 , 12 ) ) ;
ERROR 23000: Duplicate entry '9' for key 'PRIMARY'
SELECT * FROM table0_bigint ORDER BY pk;
col_char_12_key	col_char_12	col_bigint_key	pk	col_bigint
8-9	8-9	2	-1018	8
-10	NULL	-36	-100	NULL
99	99	NULL	-10	NULL
139	NULL	NULL	-9	NULL
0	NULL	158	-1	NULL
0	NULL	158	0	NULL
2	NULL	NULL	1	NULL
NULL	NULL	5	4	NULL
NULL	NULL	1	5	NULL
5	NULL	1	8	NULL
NULL	5	158	9	9
NULL	NULL	158	10	10
NULL	NULL	5	13	NULL
NULL	NULL	5	32	NULL
NULL	10	5	83	NULL
NULL	NULL	5	86	NULL
NULL	9	158	99	99
NULL	NULL	5	123	NULL
5	0	NULL	144	1
-10	NULL	-36	154	NULL
-90	NULL	-36	232	4
INSERT INTO table0_bigint ( pk , col_bigint_key, col_char_12_key ) VALUES ( 0 , SUBSTR( CAST( ( LENGTH('RSTJO') ) AS CHAR(100) ) , 1 , 12 ) , SUBSTR( CAST( ( LENGTH('GNIBS') ) AS CHAR(100) ) , 1 , 12 ) ) ;
ERROR 23000: Duplicate entry '0' for key 'PRIMARY'
SELECT * FROM table0_bigint ORDER BY pk;
col_char_12_key	col_char_12	col_bigint_key	pk	col_bigint
8-9	8-9	2	-1018	8
-10	NULL	-36	-100	NULL
99	99	NULL	-10	NULL
139	NULL	NULL	-9	NULL
0	NULL	158	-1	NULL
0	NULL	158	0	NULL
2	NULL	NULL	1	NULL
NULL	NULL	5	4	NULL
NULL	NULL	1	5	NULL
5	NULL	1	8	NULL
NULL	5	158	9	9
NULL	NULL	158	10	10
NULL	NULL	5	13	NULL
NULL	NULL	5	32	NULL
NULL	10	5	83	NULL
NULL	NULL	5	86	NULL
NULL	9	158	99	99
NULL	NULL	5	123	NULL
5	0	NULL	144	1
-10	NULL	-36	154	NULL
-90	NULL	-36	232	4
INSERT INTO table0_bigint ( pk , col_char_12_key ) VALUES ( 208, CAST( 55 AS CHAR(100)) ) , ( 10, CAST( -100 AS CHAR(100)) ) ;
ERROR 23000: Duplicate entry '10' for key 'PRIMARY'
SELECT * FROM table0_bigint ORDER BY pk;
col_char_12_key	col_char_12	col_bigint_key	pk	col_bigint
8-9	8-9	2	-1018	8
-10	NULL	-36	-100	NULL
99	99	NULL	-10	NULL
139	NULL	NULL	-9	NULL
0	NULL	158	-1	NULL
0	NULL	158	0	NULL
2	NULL	NULL	1	NULL
NULL	NULL	5	4	NULL
NULL	NULL	1	5	NULL
5	NULL	1	8	NULL
NULL	5	158	9	9
NULL	NULL	158	10	10
NULL	NULL	5	13	NULL
NULL	NULL	5	32	NULL
NULL	10	5	83	NULL
NULL	NULL	5	86	NULL
NULL	9	158	99	99
NULL	NULL	5	123	NULL
5	0	NULL	144	1
-10	NULL	-36	154	NULL
-90	NULL	-36	232	4
SELECT pk , col_bigint , col_char_12 FROM table0_bigint WHERE col_bigint_key < ( SUBSTR( CAST( ( ROUND( 5 * -9 ) ) AS CHAR(100) ) , 1 , 12 ) ) ORDER BY pk LIMIT 7;
pk	col_bigint	col_char_12
SELECT COUNT( pk ) FROM table0_bigint WHERE SIGN ( 9 ) <= LENGTH( SUBSTR( CAST( ( FLOOR ( LENGTH( SUBSTR( CAST( ( LENGTH( SUBSTR( CAST( ( -9 ) AS CHAR(100) ) , 1 , 12 ) ) ) AS CHAR(100) ) , 1 , 12 ) ) ) ) AS CHAR(100) ) , 1 , 12 ) ) ORDER BY pk LIMIT 3 /* RESULTSET_HAS_ZERO_OR_ONE_ROWS */;
COUNT( pk )
21
UPDATE table0_bigint SET pk = ROUND( -1 - 0 ) , col_char_12_key = SUBSTR(concat( CAST(col_bigint AS CHAR(100)) , SUBSTR( CAST( ( CEIL ( ROUND( 99 - ROUND( 99 - CEIL ( ROUND( 10 * -10 ) ) ) ) ) ) AS CHAR(100) ) , 1 , 12 )) , 1 , 12 ) WHERE col_bigint IN ( -10 , -10 , 172 , 10 , 1 ) ORDER BY col_bigint_key , pk  LIMIT 3 ;
ERROR 23000: Duplicate entry '-1' for key 'PRIMARY'
SELECT * FROM table0_bigint ORDER BY pk;
col_char_12_key	col_char_12	col_bigint_key	pk	col_bigint
8-9	8-9	2	-1018	8
-10	NULL	-36	-100	NULL
99	99	NULL	-10	NULL
139	NULL	NULL	-9	NULL
0	NULL	158	-1	NULL
0	NULL	158	0	NULL
2	NULL	NULL	1	NULL
NULL	NULL	5	4	NULL
NULL	NULL	1	5	NULL
5	NULL	1	8	NULL
NULL	5	158	9	9
NULL	NULL	158	10	10
NULL	NULL	5	13	NULL
NULL	NULL	5	32	NULL
NULL	10	5	83	NULL
NULL	NULL	5	86	NULL
NULL	9	158	99	99
NULL	NULL	5	123	NULL
5	0	NULL	144	1
-10	NULL	-36	154	NULL
-90	NULL	-36	232	4
INSERT INTO table0_bigint (pk) VALUES ( 0 ) ;
ERROR 23000: Duplicate entry '0' for key 'PRIMARY'
SELECT * FROM table0_bigint ORDER BY pk;
col_char_12_key	col_char_12	col_bigint_key	pk	col_bigint
8-9	8-9	2	-1018	8
-10	NULL	-36	-100	NULL
99	99	NULL	-10	NULL
139	NULL	NULL	-9	NULL
0	NULL	158	-1	NULL
0	NULL	158	0	NULL
2	NULL	NULL	1	NULL
NULL	NULL	5	4	NULL
NULL	NULL	1	5	NULL
5	NULL	1	8	NULL
NULL	5	158	9	9
NULL	NULL	158	10	10
NULL	NULL	5	13	NULL
NULL	NULL	5	32	NULL
NULL	10	5	83	NULL
NULL	NULL	5	86	NULL
NULL	9	158	99	99
NULL	NULL	5	123	NULL
5	0	NULL	144	1
-10	NULL	-36	154	NULL
-90	NULL	-36	232	4
SELECT 1 FROM table0_bigint WHERE pk IN ( SUBSTR( CAST( ( ROUND( ROUND ( ROUND( 10 - 62 ) ) - 99 ) ) AS CHAR(100) ) , 1 , 12 ) , SUBSTR( CAST( ( ROUND( -1 + FLOOR ( 0 ) ) ) AS CHAR(100) ) , 1 , 12 ) , SUBSTR( CAST( ( FLOOR ( ROUND( -10 * 108 ) ) ) AS CHAR(100) ) , 1 , 12 ) , SUBSTR( CAST( ( -100 ) AS CHAR(100) ) , 1 , 12 ) , SUBSTR( CAST( ( ABS ( ROUND( -1 * -1 ) ) ) AS CHAR(100) ) , 1 , 12 ) ) FOR UPDATE;
1
1
1
1
INSERT INTO table0_bigint ( pk , col_bigint_key ) VALUES ( 9, CAST( 157 AS CHAR(100)) ) , ( 9, CAST( 2 AS CHAR(100)) ) ;
ERROR 23000: Duplicate entry '9' for key 'PRIMARY'
SELECT * FROM table0_bigint ORDER BY pk;
col_char_12_key	col_char_12	col_bigint_key	pk	col_bigint
8-9	8-9	2	-1018	8
-10	NULL	-36	-100	NULL
99	99	NULL	-10	NULL
139	NULL	NULL	-9	NULL
0	NULL	158	-1	NULL
0	NULL	158	0	NULL
2	NULL	NULL	1	NULL
NULL	NULL	5	4	NULL
NULL	NULL	1	5	NULL
5	NULL	1	8	NULL
NULL	5	158	9	9
NULL	NULL	158	10	10
NULL	NULL	5	13	NULL
NULL	NULL	5	32	NULL
NULL	10	5	83	NULL
NULL	NULL	5	86	NULL
NULL	9	158	99	99
NULL	NULL	5	123	NULL
5	0	NULL	144	1
-10	NULL	-36	154	NULL
-90	NULL	-36	232	4
SELECT col_bigint_key,pk FROM table0_bigint WHERE pk <> 5 GROUP BY col_bigint_key,pk ORDER BY col_bigint_key,pk LIMIT 4;
col_bigint_key	pk
NULL	-10
NULL	-9
NULL	1
NULL	144
INSERT INTO table0_bigint (pk) VALUES ( 227 ) ;
SELECT * FROM table0_bigint ORDER BY pk;
col_char_12_key	col_char_12	col_bigint_key	pk	col_bigint
8-9	8-9	2	-1018	8
-10	NULL	-36	-100	NULL
99	99	NULL	-10	NULL
139	NULL	NULL	-9	NULL
0	NULL	158	-1	NULL
0	NULL	158	0	NULL
2	NULL	NULL	1	NULL
NULL	NULL	5	4	NULL
NULL	NULL	1	5	NULL
5	NULL	1	8	NULL
NULL	5	158	9	9
NULL	NULL	158	10	10
NULL	NULL	5	13	NULL
NULL	NULL	5	32	NULL
NULL	10	5	83	NULL
NULL	NULL	5	86	NULL
NULL	9	158	99	99
NULL	NULL	5	123	NULL
5	0	NULL	144	1
-10	NULL	-36	154	NULL
NULL	NULL	NULL	227	NULL
-90	NULL	-36	232	4
SELECT * FROM table0_bigint WHERE ( 316866560 , 1754529792 , 1441398784 , -2102853632 , -869400576 ) NOT IN ( ( SUBSTR( CAST( ( SIGN ( 1 ) ) AS CHAR(100) ) , 1 , 12 ) , SUBSTR( CAST( ( LENGTH( SUBSTR( CAST( ( ROUND( ROUND( 1 - FLOOR ( 1 ) ) + 1 ) ) AS CHAR(100) ) , 1 , 12 ) ) ) AS CHAR(100) ) , 1 , 12 ) , SUBSTR( CAST( ( LENGTH( SUBSTR( CAST( ( ABS ( -100 ) ) AS CHAR(100) ) , 1 , 12 ) ) ) AS CHAR(100) ) , 1 , 12 ) , SUBSTR( CAST( ( ROUND( 228 + FLOOR ( -10 ) ) ) AS CHAR(100) ) , 1 , 12 ) , SUBSTR( CAST( ( -9 ) AS CHAR(100) ) , 1 , 12 ) ) ) ORDER BY col_bigint_key DESC , pk DESC LIMIT 191 , 1 /* RESULTSET_HAS_ZERO_OR_ONE_ROWS */;
col_char_12_key	col_char_12	col_bigint_key	pk	col_bigint
UPDATE table0_bigint SET col_bigint_key = col_bigint_key WHERE ABS ( LENGTH('ZNHBI') ) != 124 ORDER BY col_char_12_key , pk ASC LIMIT 3 ;
SELECT * FROM table0_bigint ORDER BY pk;
col_char_12_key	col_char_12	col_bigint_key	pk	col_bigint
8-9	8-9	2	-1018	8
-10	NULL	-36	-100	NULL
99	99	NULL	-10	NULL
139	NULL	NULL	-9	NULL
0	NULL	158	-1	NULL
0	NULL	158	0	NULL
2	NULL	NULL	1	NULL
NULL	NULL	5	4	NULL
NULL	NULL	1	5	NULL
5	NULL	1	8	NULL
NULL	5	158	9	9
NULL	NULL	158	10	10
NULL	NULL	5	13	NULL
NULL	NULL	5	32	NULL
NULL	10	5	83	NULL
NULL	NULL	5	86	NULL
NULL	9	158	99	99
NULL	NULL	5	123	NULL
5	0	NULL	144	1
-10	NULL	-36	154	NULL
NULL	NULL	NULL	227	NULL
-90	NULL	-36	232	4
SELECT * FROM table0_bigint WHERE pk < ( SUBSTR( CAST( ( ROUND( 99 + CEIL ( -100 ) ) ) AS CHAR(100) ) , 1 , 12 ) ) ORDER BY col_char_12_key , pk ASC LIMIT 1 /* RESULTSET_HAS_ZERO_OR_ONE_ROWS */;
col_char_12_key	col_char_12	col_bigint_key	pk	col_bigint
-10	NULL	-36	-100	NULL
INSERT INTO table0_bigint ( pk , col_char_12_key ) VALUES ( -1 , SUBSTR( CAST( ( LENGTH('GKWNZ') ) AS CHAR(100) ) , 1 , 12 ) ) ;
ERROR 23000: Duplicate entry '-1' for key 'PRIMARY'
SELECT * FROM table0_bigint ORDER BY pk;
col_char_12_key	col_char_12	col_bigint_key	pk	col_bigint
8-9	8-9	2	-1018	8
-10	NULL	-36	-100	NULL
99	99	NULL	-10	NULL
139	NULL	NULL	-9	NULL
0	NULL	158	-1	NULL
0	NULL	158	0	NULL
2	NULL	NULL	1	NULL
NULL	NULL	5	4	NULL
NULL	NULL	1	5	NULL
5	NULL	1	8	NULL
NULL	5	158	9	9
NULL	NULL	158	10	10
NULL	NULL	5	13	NULL
NULL	NULL	5	32	NULL
NULL	10	5	83	NULL
NULL	NULL	5	86	NULL
NULL	9	158	99	99
NULL	NULL	5	123	NULL
5	0	NULL	144	1
-10	NULL	-36	154	NULL
NULL	NULL	NULL	227	NULL
-90	NULL	-36	232	4
SELECT ALL 9999 FROM table0_bigint ORDER BY pk;
9999
9999
9999
9999
9999
9999
9999
9999
9999
9999
9999
9999
9999
9999
9999
9999
9999
9999
9999
9999
9999
9999
9999
SELECT * FROM table0_bigint WHERE pk BETWEEN SUBSTR( CAST( ( 5 ) AS CHAR(100) ) , 1 , 12 ) AND SUBSTR( CAST( ( 10 ) AS CHAR(100) ) , 1 , 12 ) ORDER BY col_char_12  , pk DESC LIMIT 1 , 1;
col_char_12_key	col_char_12	col_bigint_key	pk	col_bigint
5	NULL	1	8	NULL
SELECT * FROM table0_bigint WHERE col_bigint IN ( SUBSTR( CAST( ( ROUND( FLOOR ( ROUND( 9 * 9 ) ) * 2 ) ) AS CHAR(100) ) , 1 , 12 ) , SUBSTR( CAST( ( SIGN ( ROUND ( ROUND( LENGTH( SUBSTR( CAST( ( ROUND( LENGTH('OAIRX') * -10 ) ) AS CHAR(100) ) , 1 , 12 ) ) * 10 ) ) ) ) AS CHAR(100) ) , 1 , 12 ) , SUBSTR( CAST( ( LENGTH('JLMTH') ) AS CHAR(100) ) , 1 , 12 ) , SUBSTR( CAST( ( LENGTH('GRXLX') ) AS CHAR(100) ) , 1 , 12 ) , SUBSTR( CAST( ( LENGTH('NUJTR') ) AS CHAR(100) ) , 1 , 12 ) ) ORDER BY col_char_12_key , col_char_12_key , col_bigint_key , pk DESC LIMIT 251 , 4;
col_char_12_key	col_char_12	col_bigint_key	pk	col_bigint
SELECT * FROM table0_bigint WHERE pk IN ( 9 , -9 , 0 , 1 , 1 ) ORDER BY col_char_12_key , pk DESC LIMIT 9 , 4;
col_char_12_key	col_char_12	col_bigint_key	pk	col_bigint
INSERT INTO table0_bigint ( pk , col_char_12_key ) VALUES ( 99 , SUBSTR( CAST( ( ROUND ( -100 ) ) AS CHAR(100) ) , 1 , 12 ) ) ;
ERROR 23000: Duplicate entry '99' for key 'PRIMARY'
SELECT * FROM table0_bigint ORDER BY pk;
col_char_12_key	col_char_12	col_bigint_key	pk	col_bigint
8-9	8-9	2	-1018	8
-10	NULL	-36	-100	NULL
99	99	NULL	-10	NULL
139	NULL	NULL	-9	NULL
0	NULL	158	-1	NULL
0	NULL	158	0	NULL
2	NULL	NULL	1	NULL
NULL	NULL	5	4	NULL
NULL	NULL	1	5	NULL
5	NULL	1	8	NULL
NULL	5	158	9	9
NULL	NULL	158	10	10
NULL	NULL	5	13	NULL
NULL	NULL	5	32	NULL
NULL	10	5	83	NULL
NULL	NULL	5	86	NULL
NULL	9	158	99	99
NULL	NULL	5	123	NULL
5	0	NULL	144	1
-10	NULL	-36	154	NULL
NULL	NULL	NULL	227	NULL
-90	NULL	-36	232	4
INSERT INTO table0_bigint ( pk , col_bigint_key ) VALUES ( -100 , SUBSTR( CAST( ( 9 ) AS CHAR(100) ) , 1 , 12 ) ) ;
ERROR 23000: Duplicate entry '-100' for key 'PRIMARY'
SELECT * FROM table0_bigint ORDER BY pk;
col_char_12_key	col_char_12	col_bigint_key	pk	col_bigint
8-9	8-9	2	-1018	8
-10	NULL	-36	-100	NULL
99	99	NULL	-10	NULL
139	NULL	NULL	-9	NULL
0	NULL	158	-1	NULL
0	NULL	158	0	NULL
2	NULL	NULL	1	NULL
NULL	NULL	5	4	NULL
NULL	NULL	1	5	NULL
5	NULL	1	8	NULL
NULL	5	158	9	9
NULL	NULL	158	10	10
NULL	NULL	5	13	NULL
NULL	NULL	5	32	NULL
NULL	10	5	83	NULL
NULL	NULL	5	86	NULL
NULL	9	158	99	99
NULL	NULL	5	123	NULL
5	0	NULL	144	1
-10	NULL	-36	154	NULL
NULL	NULL	NULL	227	NULL
-90	NULL	-36	232	4
SELECT col_bigint,col_bigint_key,col_char_12,col_char_12_key,pk FROM table0_bigint WHERE col_bigint != LENGTH('OEMWC') ORDER BY col_char_12_key , col_bigint_key , col_char_12_key , pk  LIMIT 1 /* RESULTSET_HAS_ZERO_OR_ONE_ROWS */;
col_bigint	col_bigint_key	col_char_12	col_char_12_key	pk
9	158	5	NULL	9
SELECT * FROM table0_bigint WHERE col_bigint_key IN ( SUBSTR( CAST( ( ROUND( -9 * LENGTH( SUBSTR( CAST( ( ROUND( 1 - 223 ) ) AS CHAR(100) ) , 1 , 12 ) ) ) ) AS CHAR(100) ) , 1 , 12 ) , SUBSTR( CAST( ( ROUND( ROUND( ROUND( 9 - -9 ) - -1 ) + 9 ) ) AS CHAR(100) ) , 1 , 12 ) , SUBSTR( CAST( ( ROUND( ROUND( ROUND( 1 - -1 ) * -100 ) * -1 ) ) AS CHAR(100) ) , 1 , 12 ) , SUBSTR( CAST( ( CEIL ( SIGN ( 1 ) ) ) AS CHAR(100) ) , 1 , 12 ) , SUBSTR( CAST( ( LENGTH( SUBSTR( CAST( ( ROUND( 99 - ROUND( ROUND( 9 * 9 ) + 10 ) ) ) AS CHAR(100) ) , 1 , 12 ) ) ) AS CHAR(100) ) , 1 , 12 ) ) ORDER BY col_bigint  , col_char_12_key DESC , pk ASC LIMIT 3 , 1;
col_char_12_key	col_char_12	col_bigint_key	pk	col_bigint
NULL	NULL	1	5	NULL
INSERT INTO table0_bigint ( pk , col_bigint_key ) VALUES ( 9 , SUBSTR( CAST( ( ROUND( FLOOR ( 10 ) - 1 ) ) AS CHAR(100) ) , 1 , 12 ) ) ;
ERROR 23000: Duplicate entry '9' for key 'PRIMARY'
SELECT * FROM table0_bigint ORDER BY pk;
col_char_12_key	col_char_12	col_bigint_key	pk	col_bigint
8-9	8-9	2	-1018	8
-10	NULL	-36	-100	NULL
99	99	NULL	-10	NULL
139	NULL	NULL	-9	NULL
0	NULL	158	-1	NULL
0	NULL	158	0	NULL
2	NULL	NULL	1	NULL
NULL	NULL	5	4	NULL
NULL	NULL	1	5	NULL
5	NULL	1	8	NULL
NULL	5	158	9	9
NULL	NULL	158	10	10
NULL	NULL	5	13	NULL
NULL	NULL	5	32	NULL
NULL	10	5	83	NULL
NULL	NULL	5	86	NULL
NULL	9	158	99	99
NULL	NULL	5	123	NULL
5	0	NULL	144	1
-10	NULL	-36	154	NULL
NULL	NULL	NULL	227	NULL
-90	NULL	-36	232	4
SELECT UPPER( col_char_12_key ),pk FROM table0_bigint WHERE col_bigint_key = ( SUBSTR( CAST( ( ROUND( ROUND( ABS ( 0 ) * 189 ) - 99 ) ) AS CHAR(100) ) , 1 , 12 ) ) AND col_char_12 <= ( SUBSTR( CAST( ( 10 ) AS CHAR(100) ) , 1 , 12 ) ) GROUP BY col_char_12_key,pk ORDER BY col_char_12_key,pk LIMIT 65 , 4;
UPPER( col_char_12_key )	pk
INSERT INTO table0_bigint (pk) VALUES ( -10 ) ;
ERROR 23000: Duplicate entry '-10' for key 'PRIMARY'
SELECT * FROM table0_bigint ORDER BY pk;
col_char_12_key	col_char_12	col_bigint_key	pk	col_bigint
8-9	8-9	2	-1018	8
-10	NULL	-36	-100	NULL
99	99	NULL	-10	NULL
139	NULL	NULL	-9	NULL
0	NULL	158	-1	NULL
0	NULL	158	0	NULL
2	NULL	NULL	1	NULL
NULL	NULL	5	4	NULL
NULL	NULL	1	5	NULL
5	NULL	1	8	NULL
NULL	5	158	9	9
NULL	NULL	158	10	10
NULL	NULL	5	13	NULL
NULL	NULL	5	32	NULL
NULL	10	5	83	NULL
NULL	NULL	5	86	NULL
NULL	9	158	99	99
NULL	NULL	5	123	NULL
5	0	NULL	144	1
-10	NULL	-36	154	NULL
NULL	NULL	NULL	227	NULL
-90	NULL	-36	232	4
UPDATE table0_bigint SET col_bigint = col_bigint WHERE col_char_12_key BETWEEN SUBSTR( CAST( ( 10 ) AS CHAR(100) ) , 1 , 12 ) AND SUBSTR( CAST( ( CEIL ( 0 ) ) AS CHAR(100) ) , 1 , 12 ) ORDER BY col_char_12_key , pk DESC LIMIT 1 ;
SELECT * FROM table0_bigint ORDER BY pk;
col_char_12_key	col_char_12	col_bigint_key	pk	col_bigint
8-9	8-9	2	-1018	8
-10	NULL	-36	-100	NULL
99	99	NULL	-10	NULL
139	NULL	NULL	-9	NULL
0	NULL	158	-1	NULL
0	NULL	158	0	NULL
2	NULL	NULL	1	NULL
NULL	NULL	5	4	NULL
NULL	NULL	1	5	NULL
5	NULL	1	8	NULL
NULL	5	158	9	9
NULL	NULL	158	10	10
NULL	NULL	5	13	NULL
NULL	NULL	5	32	NULL
NULL	10	5	83	NULL
NULL	NULL	5	86	NULL
NULL	9	158	99	99
NULL	NULL	5	123	NULL
5	0	NULL	144	1
-10	NULL	-36	154	NULL
NULL	NULL	NULL	227	NULL
-90	NULL	-36	232	4
SELECT * FROM table0_bigint WHERE ( -2110062592 , -1921843200 , -718667776 , -1413021696 ) NOT IN ( ( SUBSTR( CAST( ( SIGN ( 9 ) ) AS CHAR(100) ) , 1 , 12 ) , SUBSTR( CAST( ( FLOOR ( ROUND( 130 * ROUND( 99 + 10 ) ) ) ) AS CHAR(100) ) , 1 , 12 ) , SUBSTR( CAST( ( 1 ) AS CHAR(100) ) , 1 , 12 ) , SUBSTR( CAST( ( ROUND ( -9 ) ) AS CHAR(100) ) , 1 , 12 ) ) ) ORDER BY pk LIMIT 6 , 4;
col_char_12_key	col_char_12	col_bigint_key	pk	col_bigint
2	NULL	NULL	1	NULL
NULL	NULL	5	4	NULL
NULL	NULL	1	5	NULL
5	NULL	1	8	NULL
SELECT col_bigint_key,pk FROM table0_bigint WHERE col_bigint = -10 GROUP BY col_bigint_key,pk ORDER BY col_bigint_key,pk LIMIT 4;
col_bigint_key	pk
SELECT UPPER( col_char_12 ) FROM table0_bigint WHERE LENGTH('LFWUL') <= ABS ( 2 ) GROUP BY col_char_12 ORDER BY col_char_12 LIMIT 4;
UPPER( col_char_12 )
SELECT 1 FROM table0_bigint WHERE ROUND( -100 * 99 ) <= ABS ( LENGTH('WVTAT') ) FOR UPDATE;
1
1
1
1
1
1
1
1
1
1
1
1
1
1
1
1
1
1
1
1
1
1
1
SELECT  1 , NULL , TRUE , FALSE , UPPER( col_char_12_key ) FROM table0_bigint ORDER BY pk;
1	NULL	TRUE	FALSE	UPPER( col_char_12_key )
1	NULL	1	0	8-9
1	NULL	1	0	-10
1	NULL	1	0	99
1	NULL	1	0	139
1	NULL	1	0	0
1	NULL	1	0	0
1	NULL	1	0	2
1	NULL	1	0	NULL
1	NULL	1	0	NULL
1	NULL	1	0	5
1	NULL	1	0	NULL
1	NULL	1	0	NULL
1	NULL	1	0	NULL
1	NULL	1	0	NULL
1	NULL	1	0	NULL
1	NULL	1	0	NULL
1	NULL	1	0	NULL
1	NULL	1	0	NULL
1	NULL	1	0	5
1	NULL	1	0	-10
1	NULL	1	0	NULL
1	NULL	1	0	-90
SELECT * FROM table0_bigint WHERE -9 > LENGTH( SUBSTR( CAST( ( LENGTH( SUBSTR( CAST( ( ABS ( 1 ) ) AS CHAR(100) ) , 1 , 12 ) ) ) AS CHAR(100) ) , 1 , 12 ) ) ORDER BY col_bigint,col_bigint_key,col_char_12,col_char_12_key,pk,pk  , pk ASC LIMIT 4 , 2;
col_char_12_key	col_char_12	col_bigint_key	pk	col_bigint
UPDATE table0_bigint SET col_char_12_key = col_char_12_key WHERE pk <> ( SUBSTR( CAST( ( ABS ( 10 ) ) AS CHAR(100) ) , 1 , 12 ) ) ORDER BY pk , col_char_12_key,pk  , pk  LIMIT 3 ;
SELECT * FROM table0_bigint ORDER BY pk;
col_char_12_key	col_char_12	col_bigint_key	pk	col_bigint
8-9	8-9	2	-1018	8
-10	NULL	-36	-100	NULL
99	99	NULL	-10	NULL
139	NULL	NULL	-9	NULL
0	NULL	158	-1	NULL
0	NULL	158	0	NULL
2	NULL	NULL	1	NULL
NULL	NULL	5	4	NULL
NULL	NULL	1	5	NULL
5	NULL	1	8	NULL
NULL	5	158	9	9
NULL	NULL	158	10	10
NULL	NULL	5	13	NULL
NULL	NULL	5	32	NULL
NULL	10	5	83	NULL
NULL	NULL	5	86	NULL
NULL	9	158	99	99
NULL	NULL	5	123	NULL
5	0	NULL	144	1
-10	NULL	-36	154	NULL
NULL	NULL	NULL	227	NULL
-90	NULL	-36	232	4
SELECT DISTINCT NULL , pk , TRUE , col_char_12_key , FALSE , 1 FROM table0_bigint ORDER BY pk;
NULL	pk	TRUE	col_char_12_key	FALSE	1
NULL	-1018	1	8-9	0	1
NULL	-100	1	-10	0	1
NULL	-10	1	99	0	1
NULL	-9	1	139	0	1
NULL	-1	1	0	0	1
NULL	0	1	0	0	1
NULL	1	1	2	0	1
NULL	4	1	NULL	0	1
NULL	5	1	NULL	0	1
NULL	8	1	5	0	1
NULL	9	1	NULL	0	1
NULL	10	1	NULL	0	1
NULL	13	1	NULL	0	1
NULL	32	1	NULL	0	1
NULL	83	1	NULL	0	1
NULL	86	1	NULL	0	1
NULL	99	1	NULL	0	1
NULL	123	1	NULL	0	1
NULL	144	1	5	0	1
NULL	154	1	-10	0	1
NULL	227	1	NULL	0	1
NULL	232	1	-90	0	1
UPDATE table0_bigint SET col_bigint = pk WHERE pk NOT IN ( SUBSTR( CAST( ( ROUND( -9 * 9 ) ) AS CHAR(100) ) , 1 , 12 ) , SUBSTR( CAST( ( ROUND ( ABS ( 1 ) ) ) AS CHAR(100) ) , 1 , 12 ) , SUBSTR( CAST( ( 10 ) AS CHAR(100) ) , 1 , 12 ) , SUBSTR( CAST( ( ROUND( LENGTH('BGDPO') - 113 ) ) AS CHAR(100) ) , 1 , 12 ) , SUBSTR( CAST( ( ROUND( 206 - -9 ) ) AS CHAR(100) ) , 1 , 12 ) ) ORDER BY col_char_12_key,pk DESC , pk ASC LIMIT 5 ;
SELECT * FROM table0_bigint ORDER BY pk;
col_char_12_key	col_char_12	col_bigint_key	pk	col_bigint
8-9	8-9	2	-1018	8
-10	NULL	-36	-100	NULL
99	99	NULL	-10	NULL
139	NULL	NULL	-9	NULL
0	NULL	158	-1	NULL
0	NULL	158	0	NULL
2	NULL	NULL	1	NULL
NULL	NULL	5	4	NULL
NULL	NULL	1	5	NULL
5	NULL	1	8	NULL
NULL	5	158	9	9
NULL	NULL	158	10	10
NULL	NULL	5	13	NULL
NULL	NULL	5	32	NULL
NULL	10	5	83	83
NULL	NULL	5	86	86
NULL	9	158	99	99
NULL	NULL	5	123	123
5	0	NULL	144	1
-10	NULL	-36	154	NULL
NULL	NULL	NULL	227	227
-90	NULL	-36	232	4
SELECT * FROM table0_bigint WHERE pk IN ( SUBSTR( CAST( ( -100 ) AS CHAR(100) ) , 1 , 12 ) , SUBSTR( CAST( ( ROUND( 99 * -100 ) ) AS CHAR(100) ) , 1 , 12 ) , SUBSTR( CAST( ( ROUND( 9 - ROUND( 1 * 48 ) ) ) AS CHAR(100) ) , 1 , 12 ) , SUBSTR( CAST( ( LENGTH('BIXPR') ) AS CHAR(100) ) , 1 , 12 ) , SUBSTR( CAST( ( ROUND( ROUND ( 45 ) - 1 ) ) AS CHAR(100) ) , 1 , 12 ) ) ORDER BY col_bigint,col_bigint_key,col_char_12,col_char_12_key,pk,pk DESC , pk DESC LIMIT 4;
col_char_12_key	col_char_12	col_bigint_key	pk	col_bigint
-10	NULL	-36	-100	NULL
NULL	NULL	1	5	NULL
SELECT pk , col_bigint , col_char_12 FROM table0_bigint WHERE pk > -2103443456 and pk < -2103443456 ORDER BY col_char_12_key , col_char_12_key , col_char_12_key , pk  LIMIT 3 /* RESULTSET_HAS_ZERO_OR_ONE_ROWS */;
pk	col_bigint	col_char_12
SELECT 1 FROM table0_bigint WHERE LENGTH( SUBSTR( CAST( ( LENGTH('CKVDL') ) AS CHAR(100) ) , 1 , 12 ) ) != col_bigint FOR UPDATE;
1
1
1
1
1
1
1
1
1
1
SELECT 1 FROM table0_bigint WHERE col_char_12_key BETWEEN CAST( 4 AS CHAR(100) ) AND CAST( 8 AS CHAR(100) ) FOR UPDATE;
1
1
1
SELECT col_bigint,col_bigint_key,col_char_12,col_char_12_key,pk FROM table0_bigint WHERE pk BETWEEN SUBSTR( CAST( ( LENGTH( SUBSTR( CAST( ( ROUND( 9 + 7 ) ) AS CHAR(100) ) , 1 , 12 ) ) ) AS CHAR(100) ) , 1 , 12 ) AND SUBSTR( CAST( ( ABS ( 10 ) ) AS CHAR(100) ) , 1 , 12 ) GROUP BY col_bigint,col_bigint_key,col_char_12,col_char_12_key,pk ORDER BY col_bigint,col_bigint_key,col_char_12,col_char_12_key,pk LIMIT 5 , 6;
col_bigint	col_bigint_key	col_char_12	col_char_12_key	pk
UPDATE table0_bigint SET col_bigint = col_bigint WHERE NOT ( pk = SUBSTR( CAST( ( ROUND ( ROUND( ROUND( -9 * 10 ) + 10 ) ) ) AS CHAR(100) ) , 1 , 12 ) ) OR NOT ( pk <> SUBSTR( CAST( ( ROUND( 7 - -10 ) ) AS CHAR(100) ) , 1 , 12 ) ) ORDER BY pk LIMIT 1 ;
SELECT * FROM table0_bigint ORDER BY pk;
col_char_12_key	col_char_12	col_bigint_key	pk	col_bigint
8-9	8-9	2	-1018	8
-10	NULL	-36	-100	NULL
99	99	NULL	-10	NULL
139	NULL	NULL	-9	NULL
0	NULL	158	-1	NULL
0	NULL	158	0	NULL
2	NULL	NULL	1	NULL
NULL	NULL	5	4	NULL
NULL	NULL	1	5	NULL
5	NULL	1	8	NULL
NULL	5	158	9	9
NULL	NULL	158	10	10
NULL	NULL	5	13	NULL
NULL	NULL	5	32	NULL
NULL	10	5	83	83
NULL	NULL	5	86	86
NULL	9	158	99	99
NULL	NULL	5	123	123
5	0	NULL	144	1
-10	NULL	-36	154	NULL
NULL	NULL	NULL	227	227
-90	NULL	-36	232	4
SELECT col_bigint,col_bigint_key,col_char_12,col_char_12_key,pk FROM table0_bigint WHERE col_bigint_key NOT IN ( CAST(99 AS CHAR(100)) , CAST(4 AS CHAR(100)) , CAST(-100 AS CHAR(100)) ) GROUP BY col_bigint,col_bigint_key,col_char_12,col_char_12_key,pk ORDER BY col_bigint,col_bigint_key,col_char_12,col_char_12_key,pk LIMIT 4;
col_bigint	col_bigint_key	col_char_12	col_char_12_key	pk
NULL	-36	NULL	-10	-100
NULL	-36	NULL	-10	154
NULL	1	NULL	NULL	5
NULL	1	NULL	5	8
INSERT INTO table0_bigint ( pk , col_bigint, col_char_12 ) VALUES ( 67 , SUBSTR( CAST( ( ROUND( -9 + -1 ) ) AS CHAR(100) ) , 1 , 12 ) , SUBSTR( CAST( ( ROUND ( 1 ) ) AS CHAR(100) ) , 1 , 12 ) ) ;
SELECT * FROM table0_bigint ORDER BY pk;
col_char_12_key	col_char_12	col_bigint_key	pk	col_bigint
8-9	8-9	2	-1018	8
-10	NULL	-36	-100	NULL
99	99	NULL	-10	NULL
139	NULL	NULL	-9	NULL
0	NULL	158	-1	NULL
0	NULL	158	0	NULL
2	NULL	NULL	1	NULL
NULL	NULL	5	4	NULL
NULL	NULL	1	5	NULL
5	NULL	1	8	NULL
NULL	5	158	9	9
NULL	NULL	158	10	10
NULL	NULL	5	13	NULL
NULL	NULL	5	32	NULL
NULL	1	NULL	67	-10
NULL	10	5	83	83
NULL	NULL	5	86	86
NULL	9	158	99	99
NULL	NULL	5	123	123
5	0	NULL	144	1
-10	NULL	-36	154	NULL
NULL	NULL	NULL	227	227
-90	NULL	-36	232	4
INSERT INTO table0_bigint ( pk , col_char_12_key ) VALUES ( 1, CAST( 94 AS CHAR(100)) ) , ( 0, CAST( 54 AS CHAR(100)) ) ;
ERROR 23000: Duplicate entry '1' for key 'PRIMARY'
SELECT * FROM table0_bigint ORDER BY pk;
col_char_12_key	col_char_12	col_bigint_key	pk	col_bigint
8-9	8-9	2	-1018	8
-10	NULL	-36	-100	NULL
99	99	NULL	-10	NULL
139	NULL	NULL	-9	NULL
0	NULL	158	-1	NULL
0	NULL	158	0	NULL
2	NULL	NULL	1	NULL
NULL	NULL	5	4	NULL
NULL	NULL	1	5	NULL
5	NULL	1	8	NULL
NULL	5	158	9	9
NULL	NULL	158	10	10
NULL	NULL	5	13	NULL
NULL	NULL	5	32	NULL
NULL	1	NULL	67	-10
NULL	10	5	83	83
NULL	NULL	5	86	86
NULL	9	158	99	99
NULL	NULL	5	123	123
5	0	NULL	144	1
-10	NULL	-36	154	NULL
NULL	NULL	NULL	227	227
-90	NULL	-36	232	4
SELECT pk FROM table0_bigint WHERE LENGTH( SUBSTR( CAST( ( ROUND( -1 * 225 ) ) AS CHAR(100) ) , 1 , 12 ) ) <= CEIL ( 100 ) ORDER BY pk , col_char_12_key,pk ASC , pk ASC LIMIT 42 , 1 /* RESULTSET_HAS_ZERO_OR_ONE_ROWS */;
pk
INSERT INTO table0_bigint (pk) VALUES ( 7 ) ;
SELECT * FROM table0_bigint ORDER BY pk;
col_char_12_key	col_char_12	col_bigint_key	pk	col_bigint
8-9	8-9	2	-1018	8
-10	NULL	-36	-100	NULL
99	99	NULL	-10	NULL
139	NULL	NULL	-9	NULL
0	NULL	158	-1	NULL
0	NULL	158	0	NULL
2	NULL	NULL	1	NULL
NULL	NULL	5	4	NULL
NULL	NULL	1	5	NULL
NULL	NULL	NULL	7	NULL
5	NULL	1	8	NULL
NULL	5	158	9	9
NULL	NULL	158	10	10
NULL	NULL	5	13	NULL
NULL	NULL	5	32	NULL
NULL	1	NULL	67	-10
NULL	10	5	83	83
NULL	NULL	5	86	86
NULL	9	158	99	99
NULL	NULL	5	123	123
5	0	NULL	144	1
-10	NULL	-36	154	NULL
NULL	NULL	NULL	227	227
-90	NULL	-36	232	4
SELECT pk , col_bigint_key , col_char_12 FROM table0_bigint WHERE 10 <= ROUND( ROUND( LENGTH( SUBSTR( CAST( ( ROUND( 1 - LENGTH( SUBSTR( CAST( ( LENGTH('BRWED') ) AS CHAR(100) ) , 1 , 12 ) ) ) ) AS CHAR(100) ) , 1 , 12 ) ) + -10 ) + -1 ) ORDER BY col_bigint,col_bigint_key,col_char_12,col_char_12_key,pk,pk  , pk ASC LIMIT 7 , 1 /* RESULTSET_HAS_ZERO_OR_ONE_ROWS */;
pk	col_bigint_key	col_char_12
SELECT col_bigint,col_bigint_key,col_char_12,col_char_12_key,pk FROM table0_bigint WHERE -100 = ABS ( ROUND( -9 - -9 ) ) GROUP BY col_bigint,col_bigint_key,col_char_12,col_char_12_key,pk ORDER BY col_bigint,col_bigint_key,col_char_12,col_char_12_key,pk LIMIT 3 , 2;
col_bigint	col_bigint_key	col_char_12	col_char_12_key	pk
UPDATE table0_bigint SET pk = ROUND( 254 - -1 ) WHERE col_char_12_key < CAST(1 AS CHAR(100)) ORDER BY pk,pk ASC , pk DESC LIMIT 72 ;
ERROR 23000: Duplicate entry '255' for key 'PRIMARY'
SELECT * FROM table0_bigint ORDER BY pk;
col_char_12_key	col_char_12	col_bigint_key	pk	col_bigint
8-9	8-9	2	-1018	8
-10	NULL	-36	-100	NULL
99	99	NULL	-10	NULL
139	NULL	NULL	-9	NULL
0	NULL	158	-1	NULL
0	NULL	158	0	NULL
2	NULL	NULL	1	NULL
NULL	NULL	5	4	NULL
NULL	NULL	1	5	NULL
NULL	NULL	NULL	7	NULL
5	NULL	1	8	NULL
NULL	5	158	9	9
NULL	NULL	158	10	10
NULL	NULL	5	13	NULL
NULL	NULL	5	32	NULL
NULL	1	NULL	67	-10
NULL	10	5	83	83
NULL	NULL	5	86	86
NULL	9	158	99	99
NULL	NULL	5	123	123
5	0	NULL	144	1
-10	NULL	-36	154	NULL
NULL	NULL	NULL	227	227
-90	NULL	-36	232	4
SELECT UPPER( col_char_12 ) FROM table0_bigint WHERE col_bigint IN ( SUBSTR( CAST( ( ROUND( 1 - 9 ) ) AS CHAR(100) ) , 1 , 12 ) , SUBSTR( CAST( ( ROUND ( 3 ) ) AS CHAR(100) ) , 1 , 12 ) , SUBSTR( CAST( ( ROUND( -1 * LENGTH( SUBSTR( CAST( ( 0 ) AS CHAR(100) ) , 1 , 12 ) ) ) ) AS CHAR(100) ) , 1 , 12 ) , SUBSTR( CAST( ( ABS ( LENGTH( SUBSTR( CAST( ( ROUND( 1 - SIGN ( ROUND( 157 - ROUND( 1 * -100 ) ) ) ) ) AS CHAR(100) ) , 1 , 12 ) ) ) ) AS CHAR(100) ) , 1 , 12 ) , SUBSTR( CAST( ( SIGN ( 1 ) ) AS CHAR(100) ) , 1 , 12 ) ) GROUP BY col_char_12 ORDER BY col_char_12 LIMIT 36 , 1 /* RESULTSET_HAS_ZERO_OR_ONE_ROWS */;
UPPER( col_char_12 )
SELECT UPPER( col_bigint_key ) FROM table0_bigint WHERE col_bigint <= ( SUBSTR( CAST( ( 9 ) AS CHAR(100) ) , 1 , 12 ) ) GROUP BY col_bigint_key ORDER BY col_bigint_key LIMIT 1 /* RESULTSET_HAS_ZERO_OR_ONE_ROWS */;
UPPER( col_bigint_key )
NULL
INSERT INTO table0_bigint ( pk , col_bigint, col_char_12 ) VALUES ( 0 , SUBSTR( CAST( ( ROUND( 9 - ROUND( 9 * 207 ) ) ) AS CHAR(100) ) , 1 , 12 ) , SUBSTR( CAST( ( -9 ) AS CHAR(100) ) , 1 , 12 ) ) ;
ERROR 23000: Duplicate entry '0' for key 'PRIMARY'
SELECT * FROM table0_bigint ORDER BY pk;
col_char_12_key	col_char_12	col_bigint_key	pk	col_bigint
8-9	8-9	2	-1018	8
-10	NULL	-36	-100	NULL
99	99	NULL	-10	NULL
139	NULL	NULL	-9	NULL
0	NULL	158	-1	NULL
0	NULL	158	0	NULL
2	NULL	NULL	1	NULL
NULL	NULL	5	4	NULL
NULL	NULL	1	5	NULL
NULL	NULL	NULL	7	NULL
5	NULL	1	8	NULL
NULL	5	158	9	9
NULL	NULL	158	10	10
NULL	NULL	5	13	NULL
NULL	NULL	5	32	NULL
NULL	1	NULL	67	-10
NULL	10	5	83	83
NULL	NULL	5	86	86
NULL	9	158	99	99
NULL	NULL	5	123	123
5	0	NULL	144	1
-10	NULL	-36	154	NULL
NULL	NULL	NULL	227	227
-90	NULL	-36	232	4
SELECT UPPER( col_char_12 ) FROM table0_bigint WHERE pk BETWEEN SUBSTR( CAST( ( ROUND( 7 - ROUND( ROUND ( -100 ) * -10 ) ) ) AS CHAR(100) ) , 1 , 12 ) AND SUBSTR( CAST( ( ROUND ( 9 ) ) AS CHAR(100) ) , 1 , 12 ) GROUP BY col_char_12 ORDER BY col_char_12 LIMIT 8;
UPPER( col_char_12 )
NULL
5
99
INSERT INTO table0_bigint (pk) VALUES ( -9 ) ;
ERROR 23000: Duplicate entry '-9' for key 'PRIMARY'
SELECT * FROM table0_bigint ORDER BY pk;
col_char_12_key	col_char_12	col_bigint_key	pk	col_bigint
8-9	8-9	2	-1018	8
-10	NULL	-36	-100	NULL
99	99	NULL	-10	NULL
139	NULL	NULL	-9	NULL
0	NULL	158	-1	NULL
0	NULL	158	0	NULL
2	NULL	NULL	1	NULL
NULL	NULL	5	4	NULL
NULL	NULL	1	5	NULL
NULL	NULL	NULL	7	NULL
5	NULL	1	8	NULL
NULL	5	158	9	9
NULL	NULL	158	10	10
NULL	NULL	5	13	NULL
NULL	NULL	5	32	NULL
NULL	1	NULL	67	-10
NULL	10	5	83	83
NULL	NULL	5	86	86
NULL	9	158	99	99
NULL	NULL	5	123	123
5	0	NULL	144	1
-10	NULL	-36	154	NULL
NULL	NULL	NULL	227	227
-90	NULL	-36	232	4
INSERT INTO table0_bigint ( pk , col_char_12_key ) VALUES ( 159, CAST( 9 AS CHAR(100)) ) , ( 60, CAST( 8 AS CHAR(100)) ) ;
SELECT * FROM table0_bigint ORDER BY pk;
col_char_12_key	col_char_12	col_bigint_key	pk	col_bigint
8-9	8-9	2	-1018	8
-10	NULL	-36	-100	NULL
99	99	NULL	-10	NULL
139	NULL	NULL	-9	NULL
0	NULL	158	-1	NULL
0	NULL	158	0	NULL
2	NULL	NULL	1	NULL
NULL	NULL	5	4	NULL
NULL	NULL	1	5	NULL
NULL	NULL	NULL	7	NULL
5	NULL	1	8	NULL
NULL	5	158	9	9
NULL	NULL	158	10	10
NULL	NULL	5	13	NULL
NULL	NULL	5	32	NULL
8	NULL	NULL	60	NULL
NULL	1	NULL	67	-10
NULL	10	5	83	83
NULL	NULL	5	86	86
NULL	9	158	99	99
NULL	NULL	5	123	123
5	0	NULL	144	1
-10	NULL	-36	154	NULL
9	NULL	NULL	159	NULL
NULL	NULL	NULL	227	227
-90	NULL	-36	232	4
INSERT INTO table0_bigint (pk) VALUES ( 111 ) ;
SELECT * FROM table0_bigint ORDER BY pk;
col_char_12_key	col_char_12	col_bigint_key	pk	col_bigint
8-9	8-9	2	-1018	8
-10	NULL	-36	-100	NULL
99	99	NULL	-10	NULL
139	NULL	NULL	-9	NULL
0	NULL	158	-1	NULL
0	NULL	158	0	NULL
2	NULL	NULL	1	NULL
NULL	NULL	5	4	NULL
NULL	NULL	1	5	NULL
NULL	NULL	NULL	7	NULL
5	NULL	1	8	NULL
NULL	5	158	9	9
NULL	NULL	158	10	10
NULL	NULL	5	13	NULL
NULL	NULL	5	32	NULL
8	NULL	NULL	60	NULL
NULL	1	NULL	67	-10
NULL	10	5	83	83
NULL	NULL	5	86	86
NULL	9	158	99	99
NULL	NULL	NULL	111	NULL
NULL	NULL	5	123	123
5	0	NULL	144	1
-10	NULL	-36	154	NULL
9	NULL	NULL	159	NULL
NULL	NULL	NULL	227	227
-90	NULL	-36	232	4
SELECT UPPER( col_char_12_key ) FROM table0_bigint WHERE pk BETWEEN SUBSTR( CAST( ( ROUND( 120 * CEIL ( 154 ) ) ) AS CHAR(100) ) , 1 , 12 ) AND SUBSTR( CAST( ( LENGTH( SUBSTR( CAST( ( LENGTH( SUBSTR( CAST( ( ROUND( LENGTH('ZOMIM') * 9 ) ) AS CHAR(100) ) , 1 , 12 ) ) ) AS CHAR(100) ) , 1 , 12 ) ) ) AS CHAR(100) ) , 1 , 12 ) GROUP BY col_char_12_key ORDER BY col_char_12_key LIMIT 8 , 1 /* RESULTSET_HAS_ZERO_OR_ONE_ROWS */;
UPPER( col_char_12_key )
UPDATE table0_bigint SET col_bigint_key = col_bigint_key WHERE LENGTH('RAJHK') <= 9 ORDER BY col_bigint_key , pk  LIMIT 6 ;
SELECT * FROM table0_bigint ORDER BY pk;
col_char_12_key	col_char_12	col_bigint_key	pk	col_bigint
8-9	8-9	2	-1018	8
-10	NULL	-36	-100	NULL
99	99	NULL	-10	NULL
139	NULL	NULL	-9	NULL
0	NULL	158	-1	NULL
0	NULL	158	0	NULL
2	NULL	NULL	1	NULL
NULL	NULL	5	4	NULL
NULL	NULL	1	5	NULL
NULL	NULL	NULL	7	NULL
5	NULL	1	8	NULL
NULL	5	158	9	9
NULL	NULL	158	10	10
NULL	NULL	5	13	NULL
NULL	NULL	5	32	NULL
8	NULL	NULL	60	NULL
NULL	1	NULL	67	-10
NULL	10	5	83	83
NULL	NULL	5	86	86
NULL	9	158	99	99
NULL	NULL	NULL	111	NULL
NULL	NULL	5	123	123
5	0	NULL	144	1
-10	NULL	-36	154	NULL
9	NULL	NULL	159	NULL
NULL	NULL	NULL	227	227
-90	NULL	-36	232	4
SELECT col_bigint,col_bigint_key,col_char_12,col_char_12_key,pk FROM table0_bigint WHERE pk BETWEEN SUBSTR( CAST( ( ROUND( ROUND( 96 * -9 ) * -100 ) ) AS CHAR(100) ) , 1 , 12 ) AND SUBSTR( CAST( ( SIGN ( -100 ) ) AS CHAR(100) ) , 1 , 12 ) GROUP BY col_bigint,col_bigint_key,col_char_12,col_char_12_key,pk ORDER BY col_bigint,col_bigint_key,col_char_12,col_char_12_key,pk LIMIT 1;
col_bigint	col_bigint_key	col_char_12	col_char_12_key	pk
SELECT UPPER( col_char_12 ) FROM table0_bigint WHERE pk = 9 GROUP BY col_char_12 ORDER BY col_char_12 LIMIT 6 , 1 /* RESULTSET_HAS_ZERO_OR_ONE_ROWS */;
UPPER( col_char_12 )
SELECT ALL NULL , col_bigint , TRUE , UPPER( col_char_12_key ) , FALSE , 1 FROM table0_bigint ORDER BY col_bigint ASC , col_char_12  , pk ASC;
NULL	col_bigint	TRUE	UPPER( col_char_12_key )	FALSE	1
NULL	NULL	1	-10	0	1
NULL	NULL	1	139	0	1
NULL	NULL	1	0	0	1
NULL	NULL	1	0	0	1
NULL	NULL	1	2	0	1
NULL	NULL	1	NULL	0	1
NULL	NULL	1	NULL	0	1
NULL	NULL	1	NULL	0	1
NULL	NULL	1	5	0	1
NULL	NULL	1	NULL	0	1
NULL	NULL	1	NULL	0	1
NULL	NULL	1	8	0	1
NULL	NULL	1	NULL	0	1
NULL	NULL	1	-10	0	1
NULL	NULL	1	9	0	1
NULL	NULL	1	99	0	1
NULL	-10	1	NULL	0	1
NULL	1	1	5	0	1
NULL	4	1	-90	0	1
NULL	8	1	8-9	0	1
NULL	9	1	NULL	0	1
NULL	10	1	NULL	0	1
NULL	83	1	NULL	0	1
NULL	86	1	NULL	0	1
NULL	99	1	NULL	0	1
NULL	123	1	NULL	0	1
NULL	227	1	NULL	0	1
SELECT UPPER( col_char_12_key ) FROM table0_bigint WHERE LENGTH( SUBSTR( CAST( ( LENGTH( SUBSTR( CAST( ( ROUND( -9 - LENGTH( SUBSTR( CAST( ( LENGTH('AXJEK') ) AS CHAR(100) ) , 1 , 12 ) ) ) ) AS CHAR(100) ) , 1 , 12 ) ) ) AS CHAR(100) ) , 1 , 12 ) ) >= SUBSTR( CAST( ( LENGTH( SUBSTR( CAST( ( ROUND ( -9 ) ) AS CHAR(100) ) , 1 , 12 ) ) ) AS CHAR(100) ) , 1 , 12 ) GROUP BY col_char_12_key ORDER BY col_char_12_key LIMIT 4 , 1 /* RESULTSET_HAS_ZERO_OR_ONE_ROWS */;
UPPER( col_char_12_key )
SELECT col_bigint,col_bigint_key,col_char_12,col_char_12_key,pk FROM table0_bigint WHERE ( 2003435520 , 1223491584 , 2037907456 ) IN ( ( SUBSTR( CAST( ( LENGTH('JTXYT') ) AS CHAR(100) ) , 1 , 12 ) , SUBSTR( CAST( ( ROUND( 10 * 6 ) ) AS CHAR(100) ) , 1 , 12 ) , SUBSTR( CAST( ( LENGTH('GFBPZ') ) AS CHAR(100) ) , 1 , 12 ) ) , ( SUBSTR( CAST( ( ROUND( -100 + LENGTH( SUBSTR( CAST( ( LENGTH('EOJGW') ) AS CHAR(100) ) , 1 , 12 ) ) ) ) AS CHAR(100) ) , 1 , 12 ) , SUBSTR( CAST( ( ROUND( 10 + 1 ) ) AS CHAR(100) ) , 1 , 12 ) , SUBSTR( CAST( ( ROUND( -1 * ROUND ( -1 ) ) ) AS CHAR(100) ) , 1 , 12 ) ) ) GROUP BY col_bigint,col_bigint_key,col_char_12,col_char_12_key,pk ORDER BY col_bigint,col_bigint_key,col_char_12,col_char_12_key,pk LIMIT 52 , 2;
col_bigint	col_bigint_key	col_char_12	col_char_12_key	pk
SELECT * FROM table0_bigint WHERE col_bigint_key BETWEEN SUBSTR( CAST( ( 216 ) AS CHAR(100) ) , 1 , 12 ) AND SUBSTR( CAST( ( ROUND( 10 - 99 ) ) AS CHAR(100) ) , 1 , 12 ) ORDER BY pk LIMIT 2 , 2;
col_char_12_key	col_char_12	col_bigint_key	pk	col_bigint
SELECT * FROM table0_bigint WHERE ( -1674772480 , 505675776 , 627507200 ) IN ( ( SUBSTR( CAST( ( ABS ( -9 ) ) AS CHAR(100) ) , 1 , 12 ) , SUBSTR( CAST( ( LENGTH('RWODA') ) AS CHAR(100) ) , 1 , 12 ) , SUBSTR( CAST( ( SIGN ( -10 ) ) AS CHAR(100) ) , 1 , 12 ) ) , ( SUBSTR( CAST( ( LENGTH('UZSQC') ) AS CHAR(100) ) , 1 , 12 ) , SUBSTR( CAST( ( ROUND( LENGTH('EBDMY') * 0 ) ) AS CHAR(100) ) , 1 , 12 ) , SUBSTR( CAST( ( ROUND( ROUND( -10 * LENGTH('ALIYC') ) * 53 ) ) AS CHAR(100) ) , 1 , 12 ) ) ) ORDER BY pk,pk  , pk DESC LIMIT 121 , 2;
col_char_12_key	col_char_12	col_bigint_key	pk	col_bigint
INSERT INTO table0_bigint (pk) VALUES ( 99 ) ;
ERROR 23000: Duplicate entry '99' for key 'PRIMARY'
SELECT * FROM table0_bigint ORDER BY pk;
col_char_12_key	col_char_12	col_bigint_key	pk	col_bigint
8-9	8-9	2	-1018	8
-10	NULL	-36	-100	NULL
99	99	NULL	-10	NULL
139	NULL	NULL	-9	NULL
0	NULL	158	-1	NULL
0	NULL	158	0	NULL
2	NULL	NULL	1	NULL
NULL	NULL	5	4	NULL
NULL	NULL	1	5	NULL
NULL	NULL	NULL	7	NULL
5	NULL	1	8	NULL
NULL	5	158	9	9
NULL	NULL	158	10	10
NULL	NULL	5	13	NULL
NULL	NULL	5	32	NULL
8	NULL	NULL	60	NULL
NULL	1	NULL	67	-10
NULL	10	5	83	83
NULL	NULL	5	86	86
NULL	9	158	99	99
NULL	NULL	NULL	111	NULL
NULL	NULL	5	123	123
5	0	NULL	144	1
-10	NULL	-36	154	NULL
9	NULL	NULL	159	NULL
NULL	NULL	NULL	227	227
-90	NULL	-36	232	4
SELECT pk FROM table0_bigint WHERE col_bigint NOT IN ( 99 , 9 , 1 , 1 , 140 ) ORDER BY col_char_12_key , col_bigint_key , col_bigint_key , pk ASC LIMIT 2;
pk
67
227
INSERT INTO table0_bigint ( pk , col_bigint_key ) VALUES ( 6 , SUBSTR( CAST( ( ROUND( -10 - 6 ) ) AS CHAR(100) ) , 1 , 12 ) ) ;
SELECT * FROM table0_bigint ORDER BY pk;
col_char_12_key	col_char_12	col_bigint_key	pk	col_bigint
8-9	8-9	2	-1018	8
-10	NULL	-36	-100	NULL
99	99	NULL	-10	NULL
139	NULL	NULL	-9	NULL
0	NULL	158	-1	NULL
0	NULL	158	0	NULL
2	NULL	NULL	1	NULL
NULL	NULL	5	4	NULL
NULL	NULL	1	5	NULL
NULL	NULL	-16	6	NULL
NULL	NULL	NULL	7	NULL
5	NULL	1	8	NULL
NULL	5	158	9	9
NULL	NULL	158	10	10
NULL	NULL	5	13	NULL
NULL	NULL	5	32	NULL
8	NULL	NULL	60	NULL
NULL	1	NULL	67	-10
NULL	10	5	83	83
NULL	NULL	5	86	86
NULL	9	158	99	99
NULL	NULL	NULL	111	NULL
NULL	NULL	5	123	123
5	0	NULL	144	1
-10	NULL	-36	154	NULL
9	NULL	NULL	159	NULL
NULL	NULL	NULL	227	227
-90	NULL	-36	232	4
SELECT * FROM table0_bigint WHERE col_bigint_key IN ( -10 , 1 , -10 , 1 , -9 ) ORDER BY col_bigint_key , col_bigint_key , pk ASC LIMIT 3 , 1;
col_char_12_key	col_char_12	col_bigint_key	pk	col_bigint
UPDATE table0_bigint SET col_bigint_key = CAST(-9 AS CHAR(100)) WHERE col_bigint_key IN ( -1 , -10 , 1 , 1 , 10 ) ORDER BY pk,pk ASC , pk ASC LIMIT 8 ;
SELECT * FROM table0_bigint ORDER BY pk;
col_char_12_key	col_char_12	col_bigint_key	pk	col_bigint
8-9	8-9	2	-1018	8
-10	NULL	-36	-100	NULL
99	99	NULL	-10	NULL
139	NULL	NULL	-9	NULL
0	NULL	158	-1	NULL
0	NULL	158	0	NULL
2	NULL	NULL	1	NULL
NULL	NULL	5	4	NULL
NULL	NULL	-9	5	NULL
NULL	NULL	-16	6	NULL
NULL	NULL	NULL	7	NULL
5	NULL	-9	8	NULL
NULL	5	158	9	9
NULL	NULL	158	10	10
NULL	NULL	5	13	NULL
NULL	NULL	5	32	NULL
8	NULL	NULL	60	NULL
NULL	1	NULL	67	-10
NULL	10	5	83	83
NULL	NULL	5	86	86
NULL	9	158	99	99
NULL	NULL	NULL	111	NULL
NULL	NULL	5	123	123
5	0	NULL	144	1
-10	NULL	-36	154	NULL
9	NULL	NULL	159	NULL
NULL	NULL	NULL	227	227
-90	NULL	-36	232	4
SELECT col_bigint_key,pk FROM table0_bigint WHERE col_bigint_key IN ( SUBSTR( CAST( ( ROUND ( 99 ) ) AS CHAR(100) ) , 1 , 12 ) , SUBSTR( CAST( ( LENGTH('ZWBQF') ) AS CHAR(100) ) , 1 , 12 ) , SUBSTR( CAST( ( LENGTH( SUBSTR( CAST( ( ROUND ( LENGTH( SUBSTR( CAST( ( CEIL ( 203 ) ) AS CHAR(100) ) , 1 , 12 ) ) ) ) AS CHAR(100) ) , 1 , 12 ) ) ) AS CHAR(100) ) , 1 , 12 ) , SUBSTR( CAST( ( ROUND( CEIL ( CEIL ( 9 ) ) - 172 ) ) AS CHAR(100) ) , 1 , 12 ) , SUBSTR( CAST( ( ABS ( 9 ) ) AS CHAR(100) ) , 1 , 12 ) ) GROUP BY col_bigint_key,pk ORDER BY col_bigint_key,pk LIMIT 254 , 2;
col_bigint_key	pk
SELECT col_bigint,col_bigint_key,col_char_12,col_char_12_key,pk FROM table0_bigint WHERE pk != ( SUBSTR( CAST( ( CEIL ( FLOOR ( -1 ) ) ) AS CHAR(100) ) , 1 , 12 ) ) GROUP BY col_bigint,col_bigint_key,col_char_12,col_char_12_key,pk ORDER BY col_bigint,col_bigint_key,col_char_12,col_char_12_key,pk LIMIT 101 , 4;
col_bigint	col_bigint_key	col_char_12	col_char_12_key	pk
UPDATE table0_bigint SET col_bigint_key = pk  ORDER BY col_bigint DESC , col_char_12 DESC , pk DESC LIMIT 2 ;
SELECT * FROM table0_bigint ORDER BY pk;
col_char_12_key	col_char_12	col_bigint_key	pk	col_bigint
8-9	8-9	2	-1018	8
-10	NULL	-36	-100	NULL
99	99	NULL	-10	NULL
139	NULL	NULL	-9	NULL
0	NULL	158	-1	NULL
0	NULL	158	0	NULL
2	NULL	NULL	1	NULL
NULL	NULL	5	4	NULL
NULL	NULL	-9	5	NULL
NULL	NULL	-16	6	NULL
NULL	NULL	NULL	7	NULL
5	NULL	-9	8	NULL
NULL	5	158	9	9
NULL	NULL	158	10	10
NULL	NULL	5	13	NULL
NULL	NULL	5	32	NULL
8	NULL	NULL	60	NULL
NULL	1	NULL	67	-10
NULL	10	5	83	83
NULL	NULL	5	86	86
NULL	9	158	99	99
NULL	NULL	NULL	111	NULL
NULL	NULL	123	123	123
5	0	NULL	144	1
-10	NULL	-36	154	NULL
9	NULL	NULL	159	NULL
NULL	NULL	227	227	227
-90	NULL	-36	232	4
INSERT INTO table0_bigint ( pk , col_bigint_key ) VALUES ( 10, CAST( 1 AS CHAR(100)) ) , ( 10, CAST( -100 AS CHAR(100)) ) ;
ERROR 23000: Duplicate entry '10' for key 'PRIMARY'
SELECT * FROM table0_bigint ORDER BY pk;
col_char_12_key	col_char_12	col_bigint_key	pk	col_bigint
8-9	8-9	2	-1018	8
-10	NULL	-36	-100	NULL
99	99	NULL	-10	NULL
139	NULL	NULL	-9	NULL
0	NULL	158	-1	NULL
0	NULL	158	0	NULL
2	NULL	NULL	1	NULL
NULL	NULL	5	4	NULL
NULL	NULL	-9	5	NULL
NULL	NULL	-16	6	NULL
NULL	NULL	NULL	7	NULL
5	NULL	-9	8	NULL
NULL	5	158	9	9
NULL	NULL	158	10	10
NULL	NULL	5	13	NULL
NULL	NULL	5	32	NULL
8	NULL	NULL	60	NULL
NULL	1	NULL	67	-10
NULL	10	5	83	83
NULL	NULL	5	86	86
NULL	9	158	99	99
NULL	NULL	NULL	111	NULL
NULL	NULL	123	123	123
5	0	NULL	144	1
-10	NULL	-36	154	NULL
9	NULL	NULL	159	NULL
NULL	NULL	227	227	227
-90	NULL	-36	232	4
SELECT col_char_12_key FROM table0_bigint WHERE col_char_12_key < CAST(58 AS CHAR(100)) ORDER BY col_bigint DESC , pk ASC LIMIT 122 , 1 /* RESULTSET_HAS_ZERO_OR_ONE_ROWS */;
col_char_12_key
INSERT INTO table0_bigint ( pk , col_bigint_key, col_char_12 ) VALUES ( -100 , SUBSTR( CAST( ( ROUND( 10 + LENGTH( SUBSTR( CAST( ( FLOOR ( 44 ) ) AS CHAR(100) ) , 1 , 12 ) ) ) ) AS CHAR(100) ) , 1 , 12 ) , SUBSTR( CAST( ( ROUND( FLOOR ( 99 ) - 19 ) ) AS CHAR(100) ) , 1 , 12 ) ) ;
ERROR 23000: Duplicate entry '-100' for key 'PRIMARY'
SELECT * FROM table0_bigint ORDER BY pk;
col_char_12_key	col_char_12	col_bigint_key	pk	col_bigint
8-9	8-9	2	-1018	8
-10	NULL	-36	-100	NULL
99	99	NULL	-10	NULL
139	NULL	NULL	-9	NULL
0	NULL	158	-1	NULL
0	NULL	158	0	NULL
2	NULL	NULL	1	NULL
NULL	NULL	5	4	NULL
NULL	NULL	-9	5	NULL
NULL	NULL	-16	6	NULL
NULL	NULL	NULL	7	NULL
5	NULL	-9	8	NULL
NULL	5	158	9	9
NULL	NULL	158	10	10
NULL	NULL	5	13	NULL
NULL	NULL	5	32	NULL
8	NULL	NULL	60	NULL
NULL	1	NULL	67	-10
NULL	10	5	83	83
NULL	NULL	5	86	86
NULL	9	158	99	99
NULL	NULL	NULL	111	NULL
NULL	NULL	123	123	123
5	0	NULL	144	1
-10	NULL	-36	154	NULL
9	NULL	NULL	159	NULL
NULL	NULL	227	227	227
-90	NULL	-36	232	4
SELECT UPPER( col_char_12 ) FROM table0_bigint WHERE LENGTH('SNWXQ') > 9 GROUP BY col_char_12 ORDER BY col_char_12 LIMIT 2 , 1;
UPPER( col_char_12 )
SELECT col_bigint_key , col_char_12_key FROM table0_bigint WHERE col_char_12_key BETWEEN CAST( 1 AS CHAR(100) ) AND CAST( 7 AS CHAR(100) ) ORDER BY col_bigint_key , pk ASC LIMIT 7 , 1 /* RESULTSET_HAS_ZERO_OR_ONE_ROWS */;
col_bigint_key	col_char_12_key
SELECT col_bigint_key FROM table0_bigint WHERE col_bigint_key != LENGTH( SUBSTR( CAST( ( LENGTH('DAYMK') ) AS CHAR(100) ) , 1 , 12 ) ) ORDER BY pk LIMIT 6 , 2;
col_bigint_key
-16
-9
SELECT DISTINCT NULL FROM table0_bigint ORDER BY pk,pk  , pk DESC;
NULL
NULL
INSERT INTO table0_bigint (pk) VALUES ( 9 ) ;
ERROR 23000: Duplicate entry '9' for key 'PRIMARY'
SELECT * FROM table0_bigint ORDER BY pk;
col_char_12_key	col_char_12	col_bigint_key	pk	col_bigint
8-9	8-9	2	-1018	8
-10	NULL	-36	-100	NULL
99	99	NULL	-10	NULL
139	NULL	NULL	-9	NULL
0	NULL	158	-1	NULL
0	NULL	158	0	NULL
2	NULL	NULL	1	NULL
NULL	NULL	5	4	NULL
NULL	NULL	-9	5	NULL
NULL	NULL	-16	6	NULL
NULL	NULL	NULL	7	NULL
5	NULL	-9	8	NULL
NULL	5	158	9	9
NULL	NULL	158	10	10
NULL	NULL	5	13	NULL
NULL	NULL	5	32	NULL
8	NULL	NULL	60	NULL
NULL	1	NULL	67	-10
NULL	10	5	83	83
NULL	NULL	5	86	86
NULL	9	158	99	99
NULL	NULL	NULL	111	NULL
NULL	NULL	123	123	123
5	0	NULL	144	1
-10	NULL	-36	154	NULL
9	NULL	NULL	159	NULL
NULL	NULL	227	227	227
-90	NULL	-36	232	4
SELECT 1 FROM table0_bigint WHERE -10 <> 99 FOR UPDATE;
1
1
1
1
1
1
1
1
1
1
1
1
1
1
1
1
1
1
1
1
1
1
1
1
1
1
1
1
1
INSERT INTO table0_bigint ( pk , col_bigint, col_char_12 ) VALUES ( -1 , SUBSTR( CAST( ( SIGN ( -10 ) ) AS CHAR(100) ) , 1 , 12 ) , SUBSTR( CAST( ( LENGTH( SUBSTR( CAST( ( SIGN ( ROUND ( 5 ) ) ) AS CHAR(100) ) , 1 , 12 ) ) ) AS CHAR(100) ) , 1 , 12 ) ) ;
ERROR 23000: Duplicate entry '-1' for key 'PRIMARY'
SELECT * FROM table0_bigint ORDER BY pk;
col_char_12_key	col_char_12	col_bigint_key	pk	col_bigint
8-9	8-9	2	-1018	8
-10	NULL	-36	-100	NULL
99	99	NULL	-10	NULL
139	NULL	NULL	-9	NULL
0	NULL	158	-1	NULL
0	NULL	158	0	NULL
2	NULL	NULL	1	NULL
NULL	NULL	5	4	NULL
NULL	NULL	-9	5	NULL
NULL	NULL	-16	6	NULL
NULL	NULL	NULL	7	NULL
5	NULL	-9	8	NULL
NULL	5	158	9	9
NULL	NULL	158	10	10
NULL	NULL	5	13	NULL
NULL	NULL	5	32	NULL
8	NULL	NULL	60	NULL
NULL	1	NULL	67	-10
NULL	10	5	83	83
NULL	NULL	5	86	86
NULL	9	158	99	99
NULL	NULL	NULL	111	NULL
NULL	NULL	123	123	123
5	0	NULL	144	1
-10	NULL	-36	154	NULL
9	NULL	NULL	159	NULL
NULL	NULL	227	227	227
-90	NULL	-36	232	4
SELECT 1 FROM table0_bigint WHERE ( -1134231552 , 1018232832 , 552665088 ) IN ( ( SUBSTR( CAST( ( ABS ( LENGTH('ELMMQ') ) ) AS CHAR(100) ) , 1 , 12 ) , SUBSTR( CAST( ( 0 ) AS CHAR(100) ) , 1 , 12 ) , SUBSTR( CAST( ( ROUND( -9 + FLOOR ( 9 ) ) ) AS CHAR(100) ) , 1 , 12 ) ) , ( SUBSTR( CAST( ( ROUND( ROUND( -1 - LENGTH( SUBSTR( CAST( ( -9 ) AS CHAR(100) ) , 1 , 12 ) ) ) - 0 ) ) AS CHAR(100) ) , 1 , 12 ) , SUBSTR( CAST( ( ROUND( 9 - LENGTH('LVMET') ) ) AS CHAR(100) ) , 1 , 12 ) , SUBSTR( CAST( ( ROUND( ROUND( 5 + 7 ) + 0 ) ) AS CHAR(100) ) , 1 , 12 ) ) ) FOR UPDATE;
1
SELECT  NULL , UPPER( col_bigint ) , TRUE , FALSE , 1 FROM table0_bigint ORDER BY col_char_12_key , col_bigint_key , pk ASC;
NULL	UPPER( col_bigint )	TRUE	FALSE	1
NULL	NULL	1	0	1
NULL	-10	1	0	1
NULL	NULL	1	0	1
NULL	NULL	1	0	1
NULL	NULL	1	0	1
NULL	NULL	1	0	1
NULL	NULL	1	0	1
NULL	NULL	1	0	1
NULL	83	1	0	1
NULL	86	1	0	1
NULL	123	1	0	1
NULL	9	1	0	1
NULL	10	1	0	1
NULL	99	1	0	1
NULL	227	1	0	1
NULL	NULL	1	0	1
NULL	NULL	1	0	1
NULL	4	1	0	1
NULL	NULL	1	0	1
NULL	NULL	1	0	1
NULL	NULL	1	0	1
NULL	NULL	1	0	1
NULL	1	1	0	1
NULL	NULL	1	0	1
NULL	NULL	1	0	1
NULL	8	1	0	1
NULL	NULL	1	0	1
NULL	NULL	1	0	1
SELECT pk FROM table0_bigint WHERE LENGTH('JBAYJ') != ROUND ( ROUND( -100 * 0 ) ) ORDER BY col_bigint_key , col_bigint_key , pk DESC LIMIT 1 /* RESULTSET_HAS_ZERO_OR_ONE_ROWS */;
pk
159
SELECT COUNT( col_bigint ) FROM table0_bigint WHERE pk != ( SUBSTR( CAST( ( LENGTH('MJUHA') ) AS CHAR(100) ) , 1 , 12 ) ) ORDER BY col_char_12_key , col_bigint_key , pk  LIMIT 1 , 2 /* RESULTSET_HAS_ZERO_OR_ONE_ROWS */;
COUNT( col_bigint )
SELECT col_bigint , col_char_12 FROM table0_bigint WHERE ( 1180041216 , -1979777024 , -795934720 ) IN ( ( SUBSTR( CAST( ( ROUND( 1 * -1 ) ) AS CHAR(100) ) , 1 , 12 ) , SUBSTR( CAST( ( LENGTH('ZMEXE') ) AS CHAR(100) ) , 1 , 12 ) , SUBSTR( CAST( ( ROUND ( LENGTH( SUBSTR( CAST( ( ROUND( 10 + 141 ) ) AS CHAR(100) ) , 1 , 12 ) ) ) ) AS CHAR(100) ) , 1 , 12 ) ) , ( SUBSTR( CAST( ( ROUND( -10 + 2 ) ) AS CHAR(100) ) , 1 , 12 ) , SUBSTR( CAST( ( ROUND( 71 * 10 ) ) AS CHAR(100) ) , 1 , 12 ) , SUBSTR( CAST( ( LENGTH('CGIIT') ) AS CHAR(100) ) , 1 , 12 ) ) ) ORDER BY pk LIMIT 5 , 1 /* RESULTSET_HAS_ZERO_OR_ONE_ROWS */;
col_bigint	col_char_12
SELECT ALL FALSE FROM table0_bigint ORDER BY col_char_12  , pk ;
FALSE
0
0
0
0
0
0
0
0
0
0
0
0
0
0
0
0
0
0
0
0
0
0
0
0
0
0
0
0
SELECT * FROM table0_bigint WHERE FLOOR ( ABS ( ROUND( -9 * ROUND( 0 * 99 ) ) ) ) = col_bigint_key ORDER BY pk , col_bigint_key,pk ASC , pk ASC LIMIT 232 , 2;
col_char_12_key	col_char_12	col_bigint_key	pk	col_bigint
SELECT 1 FROM table0_bigint WHERE col_bigint_key >= ( SUBSTR( CAST( ( FLOOR ( -10 ) ) AS CHAR(100) ) , 1 , 12 ) ) FOR UPDATE;
1
1
1
1
1
1
1
1
1
1
1
1
1
1
1
1
SELECT * FROM table0_bigint WHERE LENGTH('EDLPV') <> LENGTH('JFLXC') ORDER BY col_bigint DESC , col_char_12_key ASC , pk ASC LIMIT 3;
col_char_12_key	col_char_12	col_bigint_key	pk	col_bigint
SELECT ALL NULL FROM table0_bigint ORDER BY col_bigint_key  , col_char_12  , pk ASC;
NULL
NULL
NULL
NULL
NULL
NULL
NULL
NULL
NULL
NULL
NULL
NULL
NULL
NULL
NULL
NULL
NULL
NULL
NULL
NULL
NULL
NULL
NULL
NULL
NULL
NULL
NULL
NULL
NULL
INSERT INTO table0_bigint ( pk , col_bigint, col_char_12_key ) VALUES ( 91 , SUBSTR( CAST( ( ROUND ( 1 ) ) AS CHAR(100) ) , 1 , 12 ) , SUBSTR( CAST( ( ROUND( -100 * 3 ) ) AS CHAR(100) ) , 1 , 12 ) ) ;
SELECT * FROM table0_bigint ORDER BY pk;
col_char_12_key	col_char_12	col_bigint_key	pk	col_bigint
8-9	8-9	2	-1018	8
-10	NULL	-36	-100	NULL
99	99	NULL	-10	NULL
139	NULL	NULL	-9	NULL
0	NULL	158	-1	NULL
0	NULL	158	0	NULL
2	NULL	NULL	1	NULL
NULL	NULL	5	4	NULL
NULL	NULL	-9	5	NULL
NULL	NULL	-16	6	NULL
NULL	NULL	NULL	7	NULL
5	NULL	-9	8	NULL
NULL	5	158	9	9
NULL	NULL	158	10	10
NULL	NULL	5	13	NULL
NULL	NULL	5	32	NULL
8	NULL	NULL	60	NULL
NULL	1	NULL	67	-10
NULL	10	5	83	83
NULL	NULL	5	86	86
-300	NULL	NULL	91	1
NULL	9	158	99	99
NULL	NULL	NULL	111	NULL
NULL	NULL	123	123	123
5	0	NULL	144	1
-10	NULL	-36	154	NULL
9	NULL	NULL	159	NULL
NULL	NULL	227	227	227
-90	NULL	-36	232	4
INSERT INTO table0_bigint (pk) VALUES ( 1 ) ;
ERROR 23000: Duplicate entry '1' for key 'PRIMARY'
SELECT * FROM table0_bigint ORDER BY pk;
col_char_12_key	col_char_12	col_bigint_key	pk	col_bigint
8-9	8-9	2	-1018	8
-10	NULL	-36	-100	NULL
99	99	NULL	-10	NULL
139	NULL	NULL	-9	NULL
0	NULL	158	-1	NULL
0	NULL	158	0	NULL
2	NULL	NULL	1	NULL
NULL	NULL	5	4	NULL
NULL	NULL	-9	5	NULL
NULL	NULL	-16	6	NULL
NULL	NULL	NULL	7	NULL
5	NULL	-9	8	NULL
NULL	5	158	9	9
NULL	NULL	158	10	10
NULL	NULL	5	13	NULL
NULL	NULL	5	32	NULL
8	NULL	NULL	60	NULL
NULL	1	NULL	67	-10
NULL	10	5	83	83
NULL	NULL	5	86	86
-300	NULL	NULL	91	1
NULL	9	158	99	99
NULL	NULL	NULL	111	NULL
NULL	NULL	123	123	123
5	0	NULL	144	1
-10	NULL	-36	154	NULL
9	NULL	NULL	159	NULL
NULL	NULL	227	227	227
-90	NULL	-36	232	4
SELECT COUNT( col_bigint_key ) FROM table0_bigint WHERE col_bigint_key IN ( -9 , 10 , -10 , 8 , 10 ) ORDER BY pk LIMIT 6 , 5 /* RESULTSET_HAS_ZERO_OR_ONE_ROWS */;
COUNT( col_bigint_key )
SELECT pk FROM table0_bigint WHERE 10 = 10 ORDER BY col_char_12_key , pk  LIMIT 3 , 1;
pk
7
SELECT ALL TRUE FROM table0_bigint ORDER BY pk,pk ASC , pk ;
TRUE
1
1
1
1
1
1
1
1
1
1
1
1
1
1
1
1
1
1
1
1
1
1
1
1
1
1
1
1
1
SELECT COUNT( col_char_12 ) FROM table0_bigint WHERE ABS ( LENGTH( SUBSTR( CAST( ( ROUND( 1 + -10 ) ) AS CHAR(100) ) , 1 , 12 ) ) ) >= LENGTH('GBDPK') ORDER BY col_bigint_key , col_char_12_key , pk ASC LIMIT 7 /* RESULTSET_HAS_ZERO_OR_ONE_ROWS */;
COUNT( col_char_12 )
0
SELECT * FROM table0_bigint WHERE col_char_12_key BETWEEN CAST( 1 AS CHAR(100) ) AND CAST( 8 AS CHAR(100) ) ORDER BY col_char_12_key , col_bigint_key , pk DESC LIMIT 0 , 2;
col_char_12_key	col_char_12	col_bigint_key	pk	col_bigint
139	NULL	NULL	-9	NULL
2	NULL	NULL	1	NULL
UPDATE table0_bigint SET col_char_12_key = col_char_12_key WHERE col_bigint_key >= ( SUBSTR( CAST( ( LENGTH( SUBSTR( CAST( ( FLOOR ( 99 ) ) AS CHAR(100) ) , 1 , 12 ) ) ) AS CHAR(100) ) , 1 , 12 ) ) AND pk <= ( SUBSTR( CAST( ( SIGN ( LENGTH('PZFAZ') ) ) AS CHAR(100) ) , 1 , 12 ) ) ORDER BY col_char_12_key , pk ASC LIMIT 7 ;
SELECT * FROM table0_bigint ORDER BY pk;
col_char_12_key	col_char_12	col_bigint_key	pk	col_bigint
8-9	8-9	2	-1018	8
-10	NULL	-36	-100	NULL
99	99	NULL	-10	NULL
139	NULL	NULL	-9	NULL
0	NULL	158	-1	NULL
0	NULL	158	0	NULL
2	NULL	NULL	1	NULL
NULL	NULL	5	4	NULL
NULL	NULL	-9	5	NULL
NULL	NULL	-16	6	NULL
NULL	NULL	NULL	7	NULL
5	NULL	-9	8	NULL
NULL	5	158	9	9
NULL	NULL	158	10	10
NULL	NULL	5	13	NULL
NULL	NULL	5	32	NULL
8	NULL	NULL	60	NULL
NULL	1	NULL	67	-10
NULL	10	5	83	83
NULL	NULL	5	86	86
-300	NULL	NULL	91	1
NULL	9	158	99	99
NULL	NULL	NULL	111	NULL
NULL	NULL	123	123	123
5	0	NULL	144	1
-10	NULL	-36	154	NULL
9	NULL	NULL	159	NULL
NULL	NULL	227	227	227
-90	NULL	-36	232	4
SELECT 1 FROM table0_bigint WHERE pk > 240 FOR UPDATE;
1
SELECT col_char_12 FROM table0_bigint WHERE col_bigint < ( SUBSTR( CAST( ( 10 ) AS CHAR(100) ) , 1 , 12 ) ) ORDER BY col_char_12 DESC , pk ASC LIMIT 1 /* RESULTSET_HAS_ZERO_OR_ONE_ROWS */;
col_char_12
8-9
SELECT pk , col_bigint_key , col_char_12 FROM table0_bigint WHERE pk > 1802371072 and pk < 1802371072 ORDER BY col_char_12_key , col_bigint_key , pk  LIMIT 3 /* RESULTSET_HAS_ZERO_OR_ONE_ROWS */;
pk	col_bigint_key	col_char_12
SELECT  NULL , pk , TRUE , col_char_12_key , FALSE , 1 FROM table0_bigint ORDER BY col_bigint_key , pk ASC;
NULL	pk	TRUE	col_char_12_key	FALSE	1
NULL	-10	1	99	0	1
NULL	-9	1	139	0	1
NULL	1	1	2	0	1
NULL	7	1	NULL	0	1
NULL	60	1	8	0	1
NULL	67	1	NULL	0	1
NULL	91	1	-300	0	1
NULL	111	1	NULL	0	1
NULL	144	1	5	0	1
NULL	159	1	9	0	1
NULL	-100	1	-10	0	1
NULL	154	1	-10	0	1
NULL	232	1	-90	0	1
NULL	6	1	NULL	0	1
NULL	5	1	NULL	0	1
NULL	8	1	5	0	1
NULL	-1018	1	8-9	0	1
NULL	4	1	NULL	0	1
NULL	13	1	NULL	0	1
NULL	32	1	NULL	0	1
NULL	83	1	NULL	0	1
NULL	86	1	NULL	0	1
NULL	123	1	NULL	0	1
NULL	-1	1	0	0	1
NULL	0	1	0	0	1
NULL	9	1	NULL	0	1
NULL	10	1	NULL	0	1
NULL	99	1	NULL	0	1
NULL	227	1	NULL	0	1
INSERT INTO table0_bigint (pk) VALUES ( 1 ) ;
ERROR 23000: Duplicate entry '1' for key 'PRIMARY'
SELECT * FROM table0_bigint ORDER BY pk;
col_char_12_key	col_char_12	col_bigint_key	pk	col_bigint
8-9	8-9	2	-1018	8
-10	NULL	-36	-100	NULL
99	99	NULL	-10	NULL
139	NULL	NULL	-9	NULL
0	NULL	158	-1	NULL
0	NULL	158	0	NULL
2	NULL	NULL	1	NULL
NULL	NULL	5	4	NULL
NULL	NULL	-9	5	NULL
NULL	NULL	-16	6	NULL
NULL	NULL	NULL	7	NULL
5	NULL	-9	8	NULL
NULL	5	158	9	9
NULL	NULL	158	10	10
NULL	NULL	5	13	NULL
NULL	NULL	5	32	NULL
8	NULL	NULL	60	NULL
NULL	1	NULL	67	-10
NULL	10	5	83	83
NULL	NULL	5	86	86
-300	NULL	NULL	91	1
NULL	9	158	99	99
NULL	NULL	NULL	111	NULL
NULL	NULL	123	123	123
5	0	NULL	144	1
-10	NULL	-36	154	NULL
9	NULL	NULL	159	NULL
NULL	NULL	227	227	227
-90	NULL	-36	232	4
SELECT col_char_12 FROM table0_bigint WHERE pk NOT IN ( 9 , 205 , 134 , -100 , 10 ) ORDER BY col_char_12_key , pk DESC LIMIT 1 , 1 /* RESULTSET_HAS_ZERO_OR_ONE_ROWS */;
col_char_12
NULL
SELECT * FROM table0_bigint WHERE SUBSTR( CAST( ( FLOOR ( ROUND( -1 * FLOOR ( ROUND( ROUND( ROUND( 99 + ROUND( -10 - 99 ) ) - 151 ) + 9 ) ) ) ) ) AS CHAR(100) ) , 1 , 12 ) > LENGTH('WLESF') ORDER BY col_bigint_key , pk ASC LIMIT 183 , 2;
col_char_12_key	col_char_12	col_bigint_key	pk	col_bigint
SELECT 1 FROM table0_bigint WHERE pk IN ( SUBSTR( CAST( ( FLOOR ( ROUND( 208 + 9 ) ) ) AS CHAR(100) ) , 1 , 12 ) , SUBSTR( CAST( ( LENGTH( SUBSTR( CAST( ( LENGTH('EBWNH') ) AS CHAR(100) ) , 1 , 12 ) ) ) AS CHAR(100) ) , 1 , 12 ) , SUBSTR( CAST( ( ROUND ( -100 ) ) AS CHAR(100) ) , 1 , 12 ) , SUBSTR( CAST( ( ROUND( ROUND( -1 + ROUND( ROUND( 0 * -1 ) - 85 ) ) * 0 ) ) AS CHAR(100) ) , 1 , 12 ) , SUBSTR( CAST( ( LENGTH( SUBSTR( CAST( ( CEIL ( ROUND( -1 + -9 ) ) ) AS CHAR(100) ) , 1 , 12 ) ) ) AS CHAR(100) ) , 1 , 12 ) ) FOR UPDATE;
1
1
1
1
SELECT * FROM table0_bigint WHERE col_char_12 BETWEEN SUBSTR( CAST( ( FLOOR ( -10 ) ) AS CHAR(100) ) , 1 , 12 ) AND SUBSTR( CAST( ( ABS ( ROUND( 0 - 9 ) ) ) AS CHAR(100) ) , 1 , 12 ) ORDER BY col_char_12_key , col_char_12_key , pk ASC LIMIT 6;
col_char_12_key	col_char_12	col_bigint_key	pk	col_bigint
NULL	5	158	9	9
NULL	1	NULL	67	-10
NULL	10	5	83	83
NULL	9	158	99	99
5	0	NULL	144	1
8-9	8-9	2	-1018	8
SELECT col_bigint_key FROM table0_bigint WHERE ROUND( 127 * -1 ) = ABS ( 9 ) ORDER BY col_bigint_key DESC , col_char_12_key  , pk  LIMIT 1 /* RESULTSET_HAS_ZERO_OR_ONE_ROWS */;
col_bigint_key
INSERT INTO table0_bigint ( pk , col_bigint_key ) VALUES ( 10, CAST( 10 AS CHAR(100)) ) , ( 1, CAST( 10 AS CHAR(100)) ) ;
ERROR 23000: Duplicate entry '10' for key 'PRIMARY'
SELECT * FROM table0_bigint ORDER BY pk;
col_char_12_key	col_char_12	col_bigint_key	pk	col_bigint
8-9	8-9	2	-1018	8
-10	NULL	-36	-100	NULL
99	99	NULL	-10	NULL
139	NULL	NULL	-9	NULL
0	NULL	158	-1	NULL
0	NULL	158	0	NULL
2	NULL	NULL	1	NULL
NULL	NULL	5	4	NULL
NULL	NULL	-9	5	NULL
NULL	NULL	-16	6	NULL
NULL	NULL	NULL	7	NULL
5	NULL	-9	8	NULL
NULL	5	158	9	9
NULL	NULL	158	10	10
NULL	NULL	5	13	NULL
NULL	NULL	5	32	NULL
8	NULL	NULL	60	NULL
NULL	1	NULL	67	-10
NULL	10	5	83	83
NULL	NULL	5	86	86
-300	NULL	NULL	91	1
NULL	9	158	99	99
NULL	NULL	NULL	111	NULL
NULL	NULL	123	123	123
5	0	NULL	144	1
-10	NULL	-36	154	NULL
9	NULL	NULL	159	NULL
NULL	NULL	227	227	227
-90	NULL	-36	232	4
UPDATE table0_bigint AS X SET X . col_bigint_key = CAST(0 AS CHAR(100)) WHERE X . col_char_12_key < CAST(10 AS CHAR(100)) ORDER BY X . col_bigint_key  , X . col_char_12_key DESC , X . pk ASC ;
SELECT * FROM table0_bigint ORDER BY pk;
col_char_12_key	col_char_12	col_bigint_key	pk	col_bigint
8-9	8-9	2	-1018	8
-10	NULL	0	-100	NULL
99	99	NULL	-10	NULL
139	NULL	NULL	-9	NULL
0	NULL	0	-1	NULL
0	NULL	0	0	NULL
2	NULL	NULL	1	NULL
NULL	NULL	5	4	NULL
NULL	NULL	-9	5	NULL
NULL	NULL	-16	6	NULL
NULL	NULL	NULL	7	NULL
5	NULL	-9	8	NULL
NULL	5	158	9	9
NULL	NULL	158	10	10
NULL	NULL	5	13	NULL
NULL	NULL	5	32	NULL
8	NULL	NULL	60	NULL
NULL	1	NULL	67	-10
NULL	10	5	83	83
NULL	NULL	5	86	86
-300	NULL	0	91	1
NULL	9	158	99	99
NULL	NULL	NULL	111	NULL
NULL	NULL	123	123	123
5	0	NULL	144	1
-10	NULL	0	154	NULL
9	NULL	NULL	159	NULL
NULL	NULL	227	227	227
-90	NULL	0	232	4
INSERT INTO table0_bigint ( pk , col_bigint_key, col_char_12 ) VALUES ( -10 , SUBSTR( CAST( ( ROUND( -9 * ROUND( ROUND( CEIL ( 70 ) - 2 ) + -1 ) ) ) AS CHAR(100) ) , 1 , 12 ) , SUBSTR( CAST( ( ROUND( -9 * 80 ) ) AS CHAR(100) ) , 1 , 12 ) ) ;
ERROR 23000: Duplicate entry '-10' for key 'PRIMARY'
SELECT * FROM table0_bigint ORDER BY pk;
col_char_12_key	col_char_12	col_bigint_key	pk	col_bigint
8-9	8-9	2	-1018	8
-10	NULL	0	-100	NULL
99	99	NULL	-10	NULL
139	NULL	NULL	-9	NULL
0	NULL	0	-1	NULL
0	NULL	0	0	NULL
2	NULL	NULL	1	NULL
NULL	NULL	5	4	NULL
NULL	NULL	-9	5	NULL
NULL	NULL	-16	6	NULL
NULL	NULL	NULL	7	NULL
5	NULL	-9	8	NULL
NULL	5	158	9	9
NULL	NULL	158	10	10
NULL	NULL	5	13	NULL
NULL	NULL	5	32	NULL
8	NULL	NULL	60	NULL
NULL	1	NULL	67	-10
NULL	10	5	83	83
NULL	NULL	5	86	86
-300	NULL	0	91	1
NULL	9	158	99	99
NULL	NULL	NULL	111	NULL
NULL	NULL	123	123	123
5	0	NULL	144	1
-10	NULL	0	154	NULL
9	NULL	NULL	159	NULL
NULL	NULL	227	227	227
-90	NULL	0	232	4
SELECT pk FROM table0_bigint WHERE col_bigint_key != SIGN ( FLOOR ( -10 ) ) ORDER BY col_char_12_key  , pk ASC LIMIT 1 , 1 /* RESULTSET_HAS_ZERO_OR_ONE_ROWS */;
pk
5
SELECT UPPER( col_char_12 ) FROM table0_bigint WHERE pk <= ( SUBSTR( CAST( ( LENGTH( SUBSTR( CAST( ( 69 ) AS CHAR(100) ) , 1 , 12 ) ) ) AS CHAR(100) ) , 1 , 12 ) ) GROUP BY col_char_12 ORDER BY col_char_12 LIMIT 2 , 1 /* RESULTSET_HAS_ZERO_OR_ONE_ROWS */;
UPPER( col_char_12 )
99
SELECT 1 FROM table0_bigint WHERE pk = ( SUBSTR( CAST( ( ROUND( ROUND( 1 - ROUND ( 3 ) ) * 10 ) ) AS CHAR(100) ) , 1 , 12 ) ) FOR UPDATE;
1
SELECT 1 FROM table0_bigint WHERE LENGTH( SUBSTR( CAST( ( ABS ( -10 ) ) AS CHAR(100) ) , 1 , 12 ) ) != SUBSTR( CAST( ( ROUND( -1 - -10 ) ) AS CHAR(100) ) , 1 , 12 ) FOR UPDATE;
1
1
1
1
1
1
1
1
1
1
1
1
1
1
1
1
1
1
1
1
1
1
1
1
1
1
1
1
1
1
SELECT col_bigint , col_char_12_key FROM table0_bigint WHERE SIGN ( 1 ) >= LENGTH('NJDNH') ORDER BY col_bigint ASC , col_char_12_key ASC , pk  LIMIT 1 /* RESULTSET_HAS_ZERO_OR_ONE_ROWS */;
col_bigint	col_char_12_key
SELECT 1 FROM table0_bigint WHERE col_bigint = ( SUBSTR( CAST( ( -100 ) AS CHAR(100) ) , 1 , 12 ) ) FOR UPDATE;
1
UPDATE table0_bigint SET pk = SUBSTR( CAST( ( LENGTH('OESSJ') ) AS CHAR(100) ) , 1 , 12 ) WHERE -100 <= -1 ORDER BY col_char_12_key , pk  LIMIT 1 ;
ERROR 23000: Duplicate entry '5' for key 'PRIMARY'
SELECT * FROM table0_bigint ORDER BY pk;
col_char_12_key	col_char_12	col_bigint_key	pk	col_bigint
8-9	8-9	2	-1018	8
-10	NULL	0	-100	NULL
99	99	NULL	-10	NULL
139	NULL	NULL	-9	NULL
0	NULL	0	-1	NULL
0	NULL	0	0	NULL
2	NULL	NULL	1	NULL
NULL	NULL	5	4	NULL
NULL	NULL	-9	5	NULL
NULL	NULL	-16	6	NULL
NULL	NULL	NULL	7	NULL
5	NULL	-9	8	NULL
NULL	5	158	9	9
NULL	NULL	158	10	10
NULL	NULL	5	13	NULL
NULL	NULL	5	32	NULL
8	NULL	NULL	60	NULL
NULL	1	NULL	67	-10
NULL	10	5	83	83
NULL	NULL	5	86	86
-300	NULL	0	91	1
NULL	9	158	99	99
NULL	NULL	NULL	111	NULL
NULL	NULL	123	123	123
5	0	NULL	144	1
-10	NULL	0	154	NULL
9	NULL	NULL	159	NULL
NULL	NULL	227	227	227
-90	NULL	0	232	4
SELECT 1 FROM table0_bigint WHERE 10 < LENGTH( SUBSTR( CAST( ( ROUND( LENGTH('IXOEG') - 5 ) ) AS CHAR(100) ) , 1 , 12 ) ) FOR UPDATE;
1
SELECT DISTINCT UPPER( col_bigint ) FROM table0_bigint WHERE SUBSTR( CAST( ( ROUND( 99 + 10 ) ) AS CHAR(100) ) , 1 , 12 ) > FLOOR ( 27 ) ORDER BY col_bigint_key DESC , col_char_12_key DESC , pk ;
UPPER( col_bigint )
227
9
10
99
123
83
86
8
4
1
NULL
-10
SELECT COUNT( col_char_12_key ) FROM table0_bigint WHERE ( -622198784 , 576716800 , 1158545408 , -627441664 , 472252416 ) NOT IN ( ( SUBSTR( CAST( ( -1 ) AS CHAR(100) ) , 1 , 12 ) , SUBSTR( CAST( ( ROUND( 10 * -1 ) ) AS CHAR(100) ) , 1 , 12 ) , SUBSTR( CAST( ( ROUND( 99 - 4 ) ) AS CHAR(100) ) , 1 , 12 ) , SUBSTR( CAST( ( ROUND( -1 - LENGTH( SUBSTR( CAST( ( ROUND( 19 * 236 ) ) AS CHAR(100) ) , 1 , 12 ) ) ) ) AS CHAR(100) ) , 1 , 12 ) , SUBSTR( CAST( ( 104 ) AS CHAR(100) ) , 1 , 12 ) ) ) ORDER BY col_bigint_key , pk ASC LIMIT 7 /* RESULTSET_HAS_ZERO_OR_ONE_ROWS */;
COUNT( col_char_12_key )
14
INSERT INTO table0_bigint (pk) VALUES ( 216 ) ;
SELECT * FROM table0_bigint ORDER BY pk;
col_char_12_key	col_char_12	col_bigint_key	pk	col_bigint
8-9	8-9	2	-1018	8
-10	NULL	0	-100	NULL
99	99	NULL	-10	NULL
139	NULL	NULL	-9	NULL
0	NULL	0	-1	NULL
0	NULL	0	0	NULL
2	NULL	NULL	1	NULL
NULL	NULL	5	4	NULL
NULL	NULL	-9	5	NULL
NULL	NULL	-16	6	NULL
NULL	NULL	NULL	7	NULL
5	NULL	-9	8	NULL
NULL	5	158	9	9
NULL	NULL	158	10	10
NULL	NULL	5	13	NULL
NULL	NULL	5	32	NULL
8	NULL	NULL	60	NULL
NULL	1	NULL	67	-10
NULL	10	5	83	83
NULL	NULL	5	86	86
-300	NULL	0	91	1
NULL	9	158	99	99
NULL	NULL	NULL	111	NULL
NULL	NULL	123	123	123
5	0	NULL	144	1
-10	NULL	0	154	NULL
9	NULL	NULL	159	NULL
NULL	NULL	NULL	216	NULL
NULL	NULL	227	227	227
-90	NULL	0	232	4
SELECT pk , col_bigint_key , col_char_12 FROM table0_bigint WHERE pk BETWEEN SUBSTR( CAST( ( LENGTH('QQWKY') ) AS CHAR(100) ) , 1 , 12 ) AND SUBSTR( CAST( ( ROUND ( SIGN ( 144 ) ) ) AS CHAR(100) ) , 1 , 12 ) ORDER BY col_bigint DESC , col_char_12_key DESC , pk DESC LIMIT 4 , 1 /* RESULTSET_HAS_ZERO_OR_ONE_ROWS */;
pk	col_bigint_key	col_char_12
SELECT * FROM table0_bigint WHERE pk < ( SUBSTR( CAST( ( LENGTH('BWPOY') ) AS CHAR(100) ) , 1 , 12 ) ) ORDER BY pk LIMIT 5 , 2;
col_char_12_key	col_char_12	col_bigint_key	pk	col_bigint
0	NULL	0	0	NULL
2	NULL	NULL	1	NULL
SELECT  NULL , pk , TRUE , col_bigint_key , FALSE , 1 FROM table0_bigint ORDER BY col_bigint_key , col_bigint_key , pk ;
NULL	pk	TRUE	col_bigint_key	FALSE	1
NULL	-10	1	NULL	0	1
NULL	-9	1	NULL	0	1
NULL	1	1	NULL	0	1
NULL	7	1	NULL	0	1
NULL	60	1	NULL	0	1
NULL	67	1	NULL	0	1
NULL	111	1	NULL	0	1
NULL	144	1	NULL	0	1
NULL	159	1	NULL	0	1
NULL	216	1	NULL	0	1
NULL	6	1	-16	0	1
NULL	5	1	-9	0	1
NULL	8	1	-9	0	1
NULL	-100	1	0	0	1
NULL	-1	1	0	0	1
NULL	0	1	0	0	1
NULL	91	1	0	0	1
NULL	154	1	0	0	1
NULL	232	1	0	0	1
NULL	-1018	1	2	0	1
NULL	4	1	5	0	1
NULL	13	1	5	0	1
NULL	32	1	5	0	1
NULL	83	1	5	0	1
NULL	86	1	5	0	1
NULL	123	1	123	0	1
NULL	9	1	158	0	1
NULL	10	1	158	0	1
NULL	99	1	158	0	1
NULL	227	1	227	0	1
SELECT col_bigint_key , col_char_12_key FROM table0_bigint WHERE pk < ( SUBSTR( CAST( ( CEIL ( FLOOR ( 99 ) ) ) AS CHAR(100) ) , 1 , 12 ) ) ORDER BY pk LIMIT 2 , 1 /* RESULTSET_HAS_ZERO_OR_ONE_ROWS */;
col_bigint_key	col_char_12_key
NULL	99
SELECT UPPER( col_char_12 ) FROM table0_bigint WHERE SIGN ( 128 ) = LENGTH( SUBSTR( CAST( ( ROUND( FLOOR ( 1 ) + 1 ) ) AS CHAR(100) ) , 1 , 12 ) ) GROUP BY col_char_12 ORDER BY col_char_12 LIMIT 0 , 1;
UPPER( col_char_12 )
NULL
SELECT col_char_12_key FROM table0_bigint WHERE col_bigint IN ( SUBSTR( CAST( ( ROUND( LENGTH( SUBSTR( CAST( ( LENGTH( SUBSTR( CAST( ( 1 ) AS CHAR(100) ) , 1 , 12 ) ) ) AS CHAR(100) ) , 1 , 12 ) ) * -10 ) ) AS CHAR(100) ) , 1 , 12 ) , SUBSTR( CAST( ( ROUND( 1 + FLOOR ( -100 ) ) ) AS CHAR(100) ) , 1 , 12 ) , SUBSTR( CAST( ( ROUND( -9 - LENGTH('UVOOY') ) ) AS CHAR(100) ) , 1 , 12 ) , SUBSTR( CAST( ( ROUND( 1 * 99 ) ) AS CHAR(100) ) , 1 , 12 ) , SUBSTR( CAST( ( LENGTH('CTWWH') ) AS CHAR(100) ) , 1 , 12 ) ) ORDER BY col_char_12_key , col_char_12_key , col_bigint_key , pk  LIMIT 1 /* RESULTSET_HAS_ZERO_OR_ONE_ROWS */;
col_char_12_key
NULL
INSERT INTO table0_bigint ( pk , col_bigint_key, col_char_12 ) VALUES ( 0 , SUBSTR( CAST( ( LENGTH( SUBSTR( CAST( ( ROUND( 99 + 177 ) ) AS CHAR(100) ) , 1 , 12 ) ) ) AS CHAR(100) ) , 1 , 12 ) , SUBSTR( CAST( ( ROUND( -9 * 0 ) ) AS CHAR(100) ) , 1 , 12 ) ) ;
ERROR 23000: Duplicate entry '0' for key 'PRIMARY'
SELECT * FROM table0_bigint ORDER BY pk;
col_char_12_key	col_char_12	col_bigint_key	pk	col_bigint
8-9	8-9	2	-1018	8
-10	NULL	0	-100	NULL
99	99	NULL	-10	NULL
139	NULL	NULL	-9	NULL
0	NULL	0	-1	NULL
0	NULL	0	0	NULL
2	NULL	NULL	1	NULL
NULL	NULL	5	4	NULL
NULL	NULL	-9	5	NULL
NULL	NULL	-16	6	NULL
NULL	NULL	NULL	7	NULL
5	NULL	-9	8	NULL
NULL	5	158	9	9
NULL	NULL	158	10	10
NULL	NULL	5	13	NULL
NULL	NULL	5	32	NULL
8	NULL	NULL	60	NULL
NULL	1	NULL	67	-10
NULL	10	5	83	83
NULL	NULL	5	86	86
-300	NULL	0	91	1
NULL	9	158	99	99
NULL	NULL	NULL	111	NULL
NULL	NULL	123	123	123
5	0	NULL	144	1
-10	NULL	0	154	NULL
9	NULL	NULL	159	NULL
NULL	NULL	NULL	216	NULL
NULL	NULL	227	227	227
-90	NULL	0	232	4
SELECT DISTINCT 1 , NULL , TRUE , FALSE , UPPER( col_char_12_key ) FROM table0_bigint ORDER BY pk;
1	NULL	TRUE	FALSE	UPPER( col_char_12_key )
1	NULL	1	0	8-9
1	NULL	1	0	-10
1	NULL	1	0	99
1	NULL	1	0	139
1	NULL	1	0	0
1	NULL	1	0	2
1	NULL	1	0	NULL
1	NULL	1	0	5
1	NULL	1	0	8
1	NULL	1	0	-300
1	NULL	1	0	9
1	NULL	1	0	-90
SELECT col_char_12_key FROM table0_bigint WHERE SUBSTR( CAST( ( 99 ) AS CHAR(100) ) , 1 , 12 ) <= CEIL ( 0 ) ORDER BY col_bigint_key  , col_char_12_key ASC , pk ASC LIMIT 1 /* RESULTSET_HAS_ZERO_OR_ONE_ROWS */;
col_char_12_key
SELECT col_char_12 FROM table0_bigint WHERE ( 1097793536 , 1889927168 , -515440640 ) NOT IN ( ( SUBSTR( CAST( ( LENGTH( SUBSTR( CAST( ( LENGTH('EQPGT') ) AS CHAR(100) ) , 1 , 12 ) ) ) AS CHAR(100) ) , 1 , 12 ) , SUBSTR( CAST( ( ROUND( -10 + LENGTH( SUBSTR( CAST( ( ROUND( -1 * 0 ) ) AS CHAR(100) ) , 1 , 12 ) ) ) ) AS CHAR(100) ) , 1 , 12 ) , SUBSTR( CAST( ( ABS ( 9 ) ) AS CHAR(100) ) , 1 , 12 ) ) , ( SUBSTR( CAST( ( ROUND( 0 * -100 ) ) AS CHAR(100) ) , 1 , 12 ) , SUBSTR( CAST( ( 10 ) AS CHAR(100) ) , 1 , 12 ) , SUBSTR( CAST( ( FLOOR ( 6 ) ) AS CHAR(100) ) , 1 , 12 ) ) ) ORDER BY col_bigint DESC , col_char_12_key  , pk  LIMIT 21 , 1 /* RESULTSET_HAS_ZERO_OR_ONE_ROWS */;
col_char_12
NULL
SELECT * FROM table0_bigint WHERE pk BETWEEN SUBSTR( CAST( ( ABS ( LENGTH('IAWTI') ) ) AS CHAR(100) ) , 1 , 12 ) AND SUBSTR( CAST( ( SIGN ( ROUND( ABS ( 1 ) * -100 ) ) ) AS CHAR(100) ) , 1 , 12 ) ORDER BY col_char_12_key , col_char_12_key , col_bigint_key , pk  LIMIT 7 , 7;
col_char_12_key	col_char_12	col_bigint_key	pk	col_bigint
SELECT col_bigint,col_bigint_key,col_char_12,col_char_12_key,pk FROM table0_bigint WHERE ABS ( SIGN ( LENGTH('YYNKE') ) ) != SUBSTR( CAST( ( SIGN ( 9 ) ) AS CHAR(100) ) , 1 , 12 ) ORDER BY col_char_12_key , col_char_12_key , pk ASC LIMIT 2 , 1 /* RESULTSET_HAS_ZERO_OR_ONE_ROWS */;
col_bigint	col_bigint_key	col_char_12	col_char_12_key	pk
SELECT col_char_12_key FROM table0_bigint WHERE pk = ( SUBSTR( CAST( ( ROUND( ROUND( 10 + 160 ) * 7 ) ) AS CHAR(100) ) , 1 , 12 ) ) ORDER BY col_bigint_key,pk  , pk ASC LIMIT 3 /* RESULTSET_HAS_ZERO_OR_ONE_ROWS */;
col_char_12_key
INSERT INTO table0_bigint ( pk , col_char_12_key ) VALUES ( 99 , SUBSTR( CAST( ( LENGTH('PDPYC') ) AS CHAR(100) ) , 1 , 12 ) ) ;
ERROR 23000: Duplicate entry '99' for key 'PRIMARY'
SELECT * FROM table0_bigint ORDER BY pk;
col_char_12_key	col_char_12	col_bigint_key	pk	col_bigint
8-9	8-9	2	-1018	8
-10	NULL	0	-100	NULL
99	99	NULL	-10	NULL
139	NULL	NULL	-9	NULL
0	NULL	0	-1	NULL
0	NULL	0	0	NULL
2	NULL	NULL	1	NULL
NULL	NULL	5	4	NULL
NULL	NULL	-9	5	NULL
NULL	NULL	-16	6	NULL
NULL	NULL	NULL	7	NULL
5	NULL	-9	8	NULL
NULL	5	158	9	9
NULL	NULL	158	10	10
NULL	NULL	5	13	NULL
NULL	NULL	5	32	NULL
8	NULL	NULL	60	NULL
NULL	1	NULL	67	-10
NULL	10	5	83	83
NULL	NULL	5	86	86
-300	NULL	0	91	1
NULL	9	158	99	99
NULL	NULL	NULL	111	NULL
NULL	NULL	123	123	123
5	0	NULL	144	1
-10	NULL	0	154	NULL
9	NULL	NULL	159	NULL
NULL	NULL	NULL	216	NULL
NULL	NULL	227	227	227
-90	NULL	0	232	4
INSERT INTO table0_bigint ( pk , col_bigint_key ) VALUES ( 9 , SUBSTR( CAST( ( SIGN ( ROUND ( LENGTH('LFFAW') ) ) ) AS CHAR(100) ) , 1 , 12 ) ) ;
ERROR 23000: Duplicate entry '9' for key 'PRIMARY'
SELECT * FROM table0_bigint ORDER BY pk;
col_char_12_key	col_char_12	col_bigint_key	pk	col_bigint
8-9	8-9	2	-1018	8
-10	NULL	0	-100	NULL
99	99	NULL	-10	NULL
139	NULL	NULL	-9	NULL
0	NULL	0	-1	NULL
0	NULL	0	0	NULL
2	NULL	NULL	1	NULL
NULL	NULL	5	4	NULL
NULL	NULL	-9	5	NULL
NULL	NULL	-16	6	NULL
NULL	NULL	NULL	7	NULL
5	NULL	-9	8	NULL
NULL	5	158	9	9
NULL	NULL	158	10	10
NULL	NULL	5	13	NULL
NULL	NULL	5	32	NULL
8	NULL	NULL	60	NULL
NULL	1	NULL	67	-10
NULL	10	5	83	83
NULL	NULL	5	86	86
-300	NULL	0	91	1
NULL	9	158	99	99
NULL	NULL	NULL	111	NULL
NULL	NULL	123	123	123
5	0	NULL	144	1
-10	NULL	0	154	NULL
9	NULL	NULL	159	NULL
NULL	NULL	NULL	216	NULL
NULL	NULL	227	227	227
-90	NULL	0	232	4
INSERT INTO table0_bigint ( pk , col_char_12_key ) VALUES ( 0 , SUBSTR( CAST( ( LENGTH('CEOIC') ) AS CHAR(100) ) , 1 , 12 ) ) ;
ERROR 23000: Duplicate entry '0' for key 'PRIMARY'
SELECT * FROM table0_bigint ORDER BY pk;
col_char_12_key	col_char_12	col_bigint_key	pk	col_bigint
8-9	8-9	2	-1018	8
-10	NULL	0	-100	NULL
99	99	NULL	-10	NULL
139	NULL	NULL	-9	NULL
0	NULL	0	-1	NULL
0	NULL	0	0	NULL
2	NULL	NULL	1	NULL
NULL	NULL	5	4	NULL
NULL	NULL	-9	5	NULL
NULL	NULL	-16	6	NULL
NULL	NULL	NULL	7	NULL
5	NULL	-9	8	NULL
NULL	5	158	9	9
NULL	NULL	158	10	10
NULL	NULL	5	13	NULL
NULL	NULL	5	32	NULL
8	NULL	NULL	60	NULL
NULL	1	NULL	67	-10
NULL	10	5	83	83
NULL	NULL	5	86	86
-300	NULL	0	91	1
NULL	9	158	99	99
NULL	NULL	NULL	111	NULL
NULL	NULL	123	123	123
5	0	NULL	144	1
-10	NULL	0	154	NULL
9	NULL	NULL	159	NULL
NULL	NULL	NULL	216	NULL
NULL	NULL	227	227	227
-90	NULL	0	232	4
SELECT DISTINCT UPPER( col_char_12 ) FROM table0_bigint WHERE pk >= ( SUBSTR( CAST( ( CEIL ( ROUND( 8 - ROUND( ABS ( ROUND( -100 - SIGN ( 1 ) ) ) + -100 ) ) ) ) AS CHAR(100) ) , 1 , 12 ) ) ORDER BY col_char_12_key , pk ;
UPPER( col_char_12 )
NULL
5
1
10
9
0
UPDATE table0_bigint SET pk = SIGN ( 0 ) WHERE pk IN ( 1 , 0 , 1 , -10 , -10 ) ORDER BY col_bigint_key , col_bigint_key , pk  LIMIT 7 ;
ERROR 23000: Duplicate entry '0' for key 'PRIMARY'
SELECT * FROM table0_bigint ORDER BY pk;
col_char_12_key	col_char_12	col_bigint_key	pk	col_bigint
8-9	8-9	2	-1018	8
-10	NULL	0	-100	NULL
99	99	NULL	-10	NULL
139	NULL	NULL	-9	NULL
0	NULL	0	-1	NULL
0	NULL	0	0	NULL
2	NULL	NULL	1	NULL
NULL	NULL	5	4	NULL
NULL	NULL	-9	5	NULL
NULL	NULL	-16	6	NULL
NULL	NULL	NULL	7	NULL
5	NULL	-9	8	NULL
NULL	5	158	9	9
NULL	NULL	158	10	10
NULL	NULL	5	13	NULL
NULL	NULL	5	32	NULL
8	NULL	NULL	60	NULL
NULL	1	NULL	67	-10
NULL	10	5	83	83
NULL	NULL	5	86	86
-300	NULL	0	91	1
NULL	9	158	99	99
NULL	NULL	NULL	111	NULL
NULL	NULL	123	123	123
5	0	NULL	144	1
-10	NULL	0	154	NULL
9	NULL	NULL	159	NULL
NULL	NULL	NULL	216	NULL
NULL	NULL	227	227	227
-90	NULL	0	232	4
INSERT INTO table0_bigint ( pk , col_bigint_key ) VALUES ( -9, CAST( 9 AS CHAR(100)) ) , ( 224, CAST( 247 AS CHAR(100)) ) ;
ERROR 23000: Duplicate entry '-9' for key 'PRIMARY'
SELECT * FROM table0_bigint ORDER BY pk;
col_char_12_key	col_char_12	col_bigint_key	pk	col_bigint
8-9	8-9	2	-1018	8
-10	NULL	0	-100	NULL
99	99	NULL	-10	NULL
139	NULL	NULL	-9	NULL
0	NULL	0	-1	NULL
0	NULL	0	0	NULL
2	NULL	NULL	1	NULL
NULL	NULL	5	4	NULL
NULL	NULL	-9	5	NULL
NULL	NULL	-16	6	NULL
NULL	NULL	NULL	7	NULL
5	NULL	-9	8	NULL
NULL	5	158	9	9
NULL	NULL	158	10	10
NULL	NULL	5	13	NULL
NULL	NULL	5	32	NULL
8	NULL	NULL	60	NULL
NULL	1	NULL	67	-10
NULL	10	5	83	83
NULL	NULL	5	86	86
-300	NULL	0	91	1
NULL	9	158	99	99
NULL	NULL	NULL	111	NULL
NULL	NULL	123	123	123
5	0	NULL	144	1
-10	NULL	0	154	NULL
9	NULL	NULL	159	NULL
NULL	NULL	NULL	216	NULL
NULL	NULL	227	227	227
-90	NULL	0	232	4
SELECT UPPER( pk ) FROM table0_bigint WHERE ( -1480261632 ) NOT IN ( SUBSTR( CAST( ( LENGTH('HEWDT') ) AS CHAR(100) ) , 1 , 12 ) , SUBSTR( CAST( ( CEIL ( SIGN ( ROUND( 115 + ROUND( 3 - ROUND( FLOOR ( ABS ( LENGTH('PULRI') ) ) - 21 ) ) ) ) ) ) AS CHAR(100) ) , 1 , 12 ) , SUBSTR( CAST( ( LENGTH( SUBSTR( CAST( ( ROUND( 99 + LENGTH( SUBSTR( CAST( ( FLOOR ( 1 ) ) AS CHAR(100) ) , 1 , 12 ) ) ) ) AS CHAR(100) ) , 1 , 12 ) ) ) AS CHAR(100) ) , 1 , 12 ) , SUBSTR( CAST( ( LENGTH( SUBSTR( CAST( ( FLOOR ( SIGN ( -10 ) ) ) AS CHAR(100) ) , 1 , 12 ) ) ) AS CHAR(100) ) , 1 , 12 ) , SUBSTR( CAST( ( LENGTH( SUBSTR( CAST( ( ROUND( -9 * ROUND( SIGN ( -100 ) - 99 ) ) ) AS CHAR(100) ) , 1 , 12 ) ) ) AS CHAR(100) ) , 1 , 12 ) ) GROUP BY pk ORDER BY pk LIMIT 7 , 1 /* RESULTSET_HAS_ZERO_OR_ONE_ROWS */;
UPPER( pk )
4
SELECT 1 FROM table0_bigint WHERE pk IN ( SUBSTR( CAST( ( ROUND( SIGN ( 3 ) + 141 ) ) AS CHAR(100) ) , 1 , 12 ) , SUBSTR( CAST( ( LENGTH('TFBDK') ) AS CHAR(100) ) , 1 , 12 ) , SUBSTR( CAST( ( ROUND( 9 + LENGTH( SUBSTR( CAST( ( ROUND( -9 * 10 ) ) AS CHAR(100) ) , 1 , 12 ) ) ) ) AS CHAR(100) ) , 1 , 12 ) , SUBSTR( CAST( ( ROUND ( -100 ) ) AS CHAR(100) ) , 1 , 12 ) , SUBSTR( CAST( ( ROUND ( 50 ) ) AS CHAR(100) ) , 1 , 12 ) ) FOR UPDATE;
1
1
1
SELECT DISTINCT 1 , NULL , TRUE , FALSE , UPPER( col_char_12 ) FROM table0_bigint ORDER BY col_char_12_key,pk  , pk ASC;
1	NULL	TRUE	FALSE	UPPER( col_char_12 )
1	NULL	1	0	5
1	NULL	1	0	1
1	NULL	1	0	10
1	NULL	1	0	9
1	NULL	1	0	NULL
1	NULL	1	0	0
1	NULL	1	0	8-9
1	NULL	1	0	99
SELECT col_bigint,col_bigint_key,col_char_12,col_char_12_key,pk FROM table0_bigint WHERE SUBSTR( CAST( ( 1 ) AS CHAR(100) ) , 1 , 12 ) != ROUND ( -10 ) ORDER BY col_bigint DESC , col_char_12 DESC , pk  LIMIT 23 , 1 /* RESULTSET_HAS_ZERO_OR_ONE_ROWS */;
col_bigint	col_bigint_key	col_char_12	col_char_12_key	pk
NULL	5	NULL	NULL	13
UPDATE table0_bigint SET pk = SUBSTR( CAST( ( ROUND( 243 * LENGTH( SUBSTR( CAST( ( ROUND ( 0 ) ) AS CHAR(100) ) , 1 , 12 ) ) ) ) AS CHAR(100) ) , 1 , 12 ) , col_bigint = 10 , col_char_12_key = 'WONZM' WHERE col_char_12 IN ( SUBSTR( CAST( ( ROUND( SIGN ( 0 ) + -1 ) ) AS CHAR(100) ) , 1 , 12 ) , SUBSTR( CAST( ( LENGTH( SUBSTR( CAST( ( ROUND( 10 + 53 ) ) AS CHAR(100) ) , 1 , 12 ) ) ) AS CHAR(100) ) , 1 , 12 ) , SUBSTR( CAST( ( 10 ) AS CHAR(100) ) , 1 , 12 ) , SUBSTR( CAST( ( LENGTH('YRJSG') ) AS CHAR(100) ) , 1 , 12 ) , SUBSTR( CAST( ( FLOOR ( LENGTH( SUBSTR( CAST( ( ROUND ( -10 ) ) AS CHAR(100) ) , 1 , 12 ) ) ) ) AS CHAR(100) ) , 1 , 12 ) ) ORDER BY col_bigint,col_bigint_key,col_char_12,col_char_12_key,pk,pk DESC , pk DESC LIMIT 3 ;
ERROR 23000: Duplicate entry '243' for key 'PRIMARY'
SELECT * FROM table0_bigint ORDER BY pk;
col_char_12_key	col_char_12	col_bigint_key	pk	col_bigint
8-9	8-9	2	-1018	8
-10	NULL	0	-100	NULL
99	99	NULL	-10	NULL
139	NULL	NULL	-9	NULL
0	NULL	0	-1	NULL
0	NULL	0	0	NULL
2	NULL	NULL	1	NULL
NULL	NULL	5	4	NULL
NULL	NULL	-9	5	NULL
NULL	NULL	-16	6	NULL
NULL	NULL	NULL	7	NULL
5	NULL	-9	8	NULL
NULL	5	158	9	9
NULL	NULL	158	10	10
NULL	NULL	5	13	NULL
NULL	NULL	5	32	NULL
8	NULL	NULL	60	NULL
NULL	1	NULL	67	-10
NULL	10	5	83	83
NULL	NULL	5	86	86
-300	NULL	0	91	1
NULL	9	158	99	99
NULL	NULL	NULL	111	NULL
NULL	NULL	123	123	123
5	0	NULL	144	1
-10	NULL	0	154	NULL
9	NULL	NULL	159	NULL
NULL	NULL	NULL	216	NULL
NULL	NULL	227	227	227
-90	NULL	0	232	4
INSERT INTO table0_bigint ( pk , col_char_12_key ) VALUES ( -9, CAST( -10 AS CHAR(100)) ) , ( 220, CAST( 10 AS CHAR(100)) ) ;
ERROR 23000: Duplicate entry '-9' for key 'PRIMARY'
SELECT * FROM table0_bigint ORDER BY pk;
col_char_12_key	col_char_12	col_bigint_key	pk	col_bigint
8-9	8-9	2	-1018	8
-10	NULL	0	-100	NULL
99	99	NULL	-10	NULL
139	NULL	NULL	-9	NULL
0	NULL	0	-1	NULL
0	NULL	0	0	NULL
2	NULL	NULL	1	NULL
NULL	NULL	5	4	NULL
NULL	NULL	-9	5	NULL
NULL	NULL	-16	6	NULL
NULL	NULL	NULL	7	NULL
5	NULL	-9	8	NULL
NULL	5	158	9	9
NULL	NULL	158	10	10
NULL	NULL	5	13	NULL
NULL	NULL	5	32	NULL
8	NULL	NULL	60	NULL
NULL	1	NULL	67	-10
NULL	10	5	83	83
NULL	NULL	5	86	86
-300	NULL	0	91	1
NULL	9	158	99	99
NULL	NULL	NULL	111	NULL
NULL	NULL	123	123	123
5	0	NULL	144	1
-10	NULL	0	154	NULL
9	NULL	NULL	159	NULL
NULL	NULL	NULL	216	NULL
NULL	NULL	227	227	227
-90	NULL	0	232	4
UPDATE table0_bigint SET col_bigint_key = SUBSTR( CAST( ( CEIL ( ROUND( LENGTH('SVNDW') - -9 ) ) ) AS CHAR(100) ) , 1 , 12 )  ORDER BY col_char_12_key , col_char_12_key , col_bigint_key , pk  LIMIT 6 ;
SELECT * FROM table0_bigint ORDER BY pk;
col_char_12_key	col_char_12	col_bigint_key	pk	col_bigint
8-9	8-9	2	-1018	8
-10	NULL	0	-100	NULL
99	99	NULL	-10	NULL
139	NULL	NULL	-9	NULL
0	NULL	0	-1	NULL
0	NULL	0	0	NULL
2	NULL	NULL	1	NULL
NULL	NULL	5	4	NULL
NULL	NULL	14	5	NULL
NULL	NULL	14	6	NULL
NULL	NULL	14	7	NULL
5	NULL	-9	8	NULL
NULL	5	158	9	9
NULL	NULL	158	10	10
NULL	NULL	5	13	NULL
NULL	NULL	5	32	NULL
8	NULL	NULL	60	NULL
NULL	1	14	67	-10
NULL	10	5	83	83
NULL	NULL	5	86	86
-300	NULL	0	91	1
NULL	9	158	99	99
NULL	NULL	14	111	NULL
NULL	NULL	123	123	123
5	0	NULL	144	1
-10	NULL	0	154	NULL
9	NULL	NULL	159	NULL
NULL	NULL	14	216	NULL
NULL	NULL	227	227	227
-90	NULL	0	232	4
SELECT COUNT( col_char_12 ) FROM table0_bigint WHERE LENGTH('JEKOZ') <> SUBSTR( CAST( ( -100 ) AS CHAR(100) ) , 1 , 12 ) ORDER BY col_bigint_key,pk DESC , pk DESC LIMIT 2 /* RESULTSET_HAS_ZERO_OR_ONE_ROWS */;
COUNT( col_char_12 )
7
SELECT * FROM table0_bigint WHERE col_bigint_key BETWEEN CAST( 3 AS CHAR(100) ) AND CAST( 7 AS CHAR(100) ) ORDER BY col_bigint_key , col_char_12_key , col_bigint_key , pk DESC LIMIT 1 , 1;
col_char_12_key	col_char_12	col_bigint_key	pk	col_bigint
NULL	10	5	83	83
SELECT col_bigint,col_bigint_key,col_char_12,col_char_12_key,pk FROM table0_bigint WHERE col_bigint NOT IN ( SUBSTR( CAST( ( 156 ) AS CHAR(100) ) , 1 , 12 ) , SUBSTR( CAST( ( ROUND( LENGTH( SUBSTR( CAST( ( ROUND( -10 + -100 ) ) AS CHAR(100) ) , 1 , 12 ) ) * -1 ) ) AS CHAR(100) ) , 1 , 12 ) , SUBSTR( CAST( ( ROUND( -10 * 1 ) ) AS CHAR(100) ) , 1 , 12 ) , SUBSTR( CAST( ( LENGTH('DCBON') ) AS CHAR(100) ) , 1 , 12 ) , SUBSTR( CAST( ( ROUND( 22 * LENGTH( SUBSTR( CAST( ( ROUND( -10 - 0 ) ) AS CHAR(100) ) , 1 , 12 ) ) ) ) AS CHAR(100) ) , 1 , 12 ) ) ORDER BY pk , col_bigint , col_char_12_key,pk ASC , pk ASC LIMIT 5;
col_bigint	col_bigint_key	col_char_12	col_char_12_key	pk
8	2	8-9	8-9	-1018
9	158	5	NULL	9
10	158	NULL	NULL	10
83	5	10	NULL	83
86	5	NULL	NULL	86
SELECT 1 FROM table0_bigint WHERE col_char_12_key < CAST(-10 AS CHAR(100)) FOR UPDATE;
1
INSERT INTO table0_bigint ( pk , col_bigint, col_char_12_key ) VALUES ( -1 , SUBSTR( CAST( ( ROUND( 4 * 99 ) ) AS CHAR(100) ) , 1 , 12 ) , SUBSTR( CAST( ( ROUND( CEIL ( 1 ) - 99 ) ) AS CHAR(100) ) , 1 , 12 ) ) ;
ERROR 23000: Duplicate entry '-1' for key 'PRIMARY'
SELECT * FROM table0_bigint ORDER BY pk;
col_char_12_key	col_char_12	col_bigint_key	pk	col_bigint
8-9	8-9	2	-1018	8
-10	NULL	0	-100	NULL
99	99	NULL	-10	NULL
139	NULL	NULL	-9	NULL
0	NULL	0	-1	NULL
0	NULL	0	0	NULL
2	NULL	NULL	1	NULL
NULL	NULL	5	4	NULL
NULL	NULL	14	5	NULL
NULL	NULL	14	6	NULL
NULL	NULL	14	7	NULL
5	NULL	-9	8	NULL
NULL	5	158	9	9
NULL	NULL	158	10	10
NULL	NULL	5	13	NULL
NULL	NULL	5	32	NULL
8	NULL	NULL	60	NULL
NULL	1	14	67	-10
NULL	10	5	83	83
NULL	NULL	5	86	86
-300	NULL	0	91	1
NULL	9	158	99	99
NULL	NULL	14	111	NULL
NULL	NULL	123	123	123
5	0	NULL	144	1
-10	NULL	0	154	NULL
9	NULL	NULL	159	NULL
NULL	NULL	14	216	NULL
NULL	NULL	227	227	227
-90	NULL	0	232	4
SELECT UPPER( col_char_12 ) FROM table0_bigint WHERE ( -751960064 ) NOT IN ( SUBSTR( CAST( ( ROUND( 0 + 0 ) ) AS CHAR(100) ) , 1 , 12 ) , SUBSTR( CAST( ( CEIL ( 10 ) ) AS CHAR(100) ) , 1 , 12 ) , SUBSTR( CAST( ( ABS ( 10 ) ) AS CHAR(100) ) , 1 , 12 ) , SUBSTR( CAST( ( -10 ) AS CHAR(100) ) , 1 , 12 ) , SUBSTR( CAST( ( LENGTH( SUBSTR( CAST( ( 241 ) AS CHAR(100) ) , 1 , 12 ) ) ) AS CHAR(100) ) , 1 , 12 ) ) GROUP BY col_char_12 ORDER BY col_char_12 LIMIT 4 , 2;
UPPER( col_char_12 )
5
8-9
SELECT col_char_12_key FROM table0_bigint WHERE col_char_12_key BETWEEN CAST( 3 AS CHAR(100) ) AND CAST( 7 AS CHAR(100) ) ORDER BY col_char_12_key , col_char_12_key , pk DESC LIMIT 4 , 4;
col_char_12_key
SELECT col_bigint_key FROM table0_bigint WHERE ROUND( 124 + 4 ) != SUBSTR( CAST( ( ROUND( 18 - ROUND( ROUND( -100 - LENGTH( SUBSTR( CAST( ( ROUND( 8 * -9 ) ) AS CHAR(100) ) , 1 , 12 ) ) ) * 10 ) ) ) AS CHAR(100) ) , 1 , 12 ) ORDER BY col_bigint DESC , pk DESC LIMIT 4;
col_bigint_key
227
123
158
5
SELECT pk , col_bigint , col_char_12_key FROM table0_bigint WHERE pk < 99 ORDER BY col_bigint ASC , col_char_12_key  , pk  LIMIT 3 , 1 /* RESULTSET_HAS_ZERO_OR_ONE_ROWS */;
pk	col_bigint	col_char_12_key
7	NULL	NULL
INSERT INTO table0_bigint ( pk , col_char_12_key ) VALUES ( 9, CAST( 93 AS CHAR(100)) ) , ( -10, CAST( 9 AS CHAR(100)) ) ;
ERROR 23000: Duplicate entry '9' for key 'PRIMARY'
SELECT * FROM table0_bigint ORDER BY pk;
col_char_12_key	col_char_12	col_bigint_key	pk	col_bigint
8-9	8-9	2	-1018	8
-10	NULL	0	-100	NULL
99	99	NULL	-10	NULL
139	NULL	NULL	-9	NULL
0	NULL	0	-1	NULL
0	NULL	0	0	NULL
2	NULL	NULL	1	NULL
NULL	NULL	5	4	NULL
NULL	NULL	14	5	NULL
NULL	NULL	14	6	NULL
NULL	NULL	14	7	NULL
5	NULL	-9	8	NULL
NULL	5	158	9	9
NULL	NULL	158	10	10
NULL	NULL	5	13	NULL
NULL	NULL	5	32	NULL
8	NULL	NULL	60	NULL
NULL	1	14	67	-10
NULL	10	5	83	83
NULL	NULL	5	86	86
-300	NULL	0	91	1
NULL	9	158	99	99
NULL	NULL	14	111	NULL
NULL	NULL	123	123	123
5	0	NULL	144	1
-10	NULL	0	154	NULL
9	NULL	NULL	159	NULL
NULL	NULL	14	216	NULL
NULL	NULL	227	227	227
-90	NULL	0	232	4
SELECT col_bigint,col_bigint_key,col_char_12,col_char_12_key,pk FROM table0_bigint WHERE SIGN ( 8 ) > ROUND( 10 * ROUND ( ABS ( 1 ) ) ) GROUP BY col_bigint,col_bigint_key,col_char_12,col_char_12_key,pk ORDER BY col_bigint,col_bigint_key,col_char_12,col_char_12_key,pk LIMIT 85 , 2;
col_bigint	col_bigint_key	col_char_12	col_char_12_key	pk
SELECT COUNT( col_char_12_key ) FROM table0_bigint WHERE pk BETWEEN SUBSTR( CAST( ( ROUND( 89 + 10 ) ) AS CHAR(100) ) , 1 , 12 ) AND SUBSTR( CAST( ( -9 ) AS CHAR(100) ) , 1 , 12 ) ORDER BY col_bigint ASC , col_char_12 ASC , pk  LIMIT 235 , 1 /* RESULTSET_HAS_ZERO_OR_ONE_ROWS */;
COUNT( col_char_12_key )
SELECT col_char_12 FROM table0_bigint WHERE ( -315031552 , -924712960 , 1745158144 ) IN ( ( SUBSTR( CAST( ( ROUND( -9 * ROUND( -10 * 18 ) ) ) AS CHAR(100) ) , 1 , 12 ) , SUBSTR( CAST( ( ROUND ( -9 ) ) AS CHAR(100) ) , 1 , 12 ) , SUBSTR( CAST( ( ROUND( ROUND( -100 + LENGTH( SUBSTR( CAST( ( ROUND( 173 * ROUND( 128 * 0 ) ) ) AS CHAR(100) ) , 1 , 12 ) ) ) - 30 ) ) AS CHAR(100) ) , 1 , 12 ) ) , ( SUBSTR( CAST( ( LENGTH('UAQLE') ) AS CHAR(100) ) , 1 , 12 ) , SUBSTR( CAST( ( LENGTH( SUBSTR( CAST( ( LENGTH('MEOHY') ) AS CHAR(100) ) , 1 , 12 ) ) ) AS CHAR(100) ) , 1 , 12 ) , SUBSTR( CAST( ( ROUND( 1 - ROUND( CEIL ( LENGTH('GNNZO') ) - 4 ) ) ) AS CHAR(100) ) , 1 , 12 ) ) ) ORDER BY col_char_12_key ASC , pk DESC LIMIT 7;
col_char_12
SELECT * FROM table0_bigint WHERE pk NOT IN ( -1 , 0 , -100 , -1 , 96 ) ORDER BY col_bigint_key , col_char_12,pk  , pk  LIMIT 2;
col_char_12_key	col_char_12	col_bigint_key	pk	col_bigint
139	NULL	NULL	-9	NULL
2	NULL	NULL	1	NULL
SELECT DISTINCT NULL FROM table0_bigint ORDER BY col_bigint_key DESC , col_char_12 DESC , pk ASC;
NULL
NULL
UPDATE table0_bigint SET col_bigint_key = pk WHERE col_bigint IN ( 9 , 157 , -9 , 9 , 5 ) ORDER BY col_char_12_key , pk DESC LIMIT 4 ;
SELECT * FROM table0_bigint ORDER BY pk;
col_char_12_key	col_char_12	col_bigint_key	pk	col_bigint
8-9	8-9	2	-1018	8
-10	NULL	0	-100	NULL
99	99	NULL	-10	NULL
139	NULL	NULL	-9	NULL
0	NULL	0	-1	NULL
0	NULL	0	0	NULL
2	NULL	NULL	1	NULL
NULL	NULL	5	4	NULL
NULL	NULL	14	5	NULL
NULL	NULL	14	6	NULL
NULL	NULL	14	7	NULL
5	NULL	-9	8	NULL
NULL	5	9	9	9
NULL	NULL	158	10	10
NULL	NULL	5	13	NULL
NULL	NULL	5	32	NULL
8	NULL	NULL	60	NULL
NULL	1	14	67	-10
NULL	10	5	83	83
NULL	NULL	5	86	86
-300	NULL	0	91	1
NULL	9	158	99	99
NULL	NULL	14	111	NULL
NULL	NULL	123	123	123
5	0	NULL	144	1
-10	NULL	0	154	NULL
9	NULL	NULL	159	NULL
NULL	NULL	14	216	NULL
NULL	NULL	227	227	227
-90	NULL	0	232	4
SELECT col_bigint FROM table0_bigint WHERE FLOOR ( 0 ) < CEIL ( ROUND( -1 + 10 ) ) ORDER BY col_char_12_key,pk ASC , pk  LIMIT 4 , 1 /* RESULTSET_HAS_ZERO_OR_ONE_ROWS */;
col_bigint
9
SELECT UPPER( col_bigint ) FROM table0_bigint WHERE col_bigint NOT IN ( SUBSTR( CAST( ( CEIL ( FLOOR ( 115 ) ) ) AS CHAR(100) ) , 1 , 12 ) , SUBSTR( CAST( ( ROUND( ROUND( 9 + -1 ) * 5 ) ) AS CHAR(100) ) , 1 , 12 ) , SUBSTR( CAST( ( CEIL ( 241 ) ) AS CHAR(100) ) , 1 , 12 ) , SUBSTR( CAST( ( LENGTH( SUBSTR( CAST( ( ABS ( ROUND( 10 - LENGTH( SUBSTR( CAST( ( LENGTH( SUBSTR( CAST( ( ROUND( -9 - 4 ) ) AS CHAR(100) ) , 1 , 12 ) ) ) AS CHAR(100) ) , 1 , 12 ) ) ) ) ) AS CHAR(100) ) , 1 , 12 ) ) ) AS CHAR(100) ) , 1 , 12 ) , SUBSTR( CAST( ( 46 ) AS CHAR(100) ) , 1 , 12 ) ) GROUP BY col_bigint ORDER BY col_bigint LIMIT 4 , 4;
UPPER( col_bigint )
10
83
86
99
SELECT * FROM table0_bigint WHERE pk = ( SUBSTR( CAST( ( FLOOR ( 99 ) ) AS CHAR(100) ) , 1 , 12 ) ) ORDER BY col_bigint_key  , pk DESC LIMIT 2 , 2 /* RESULTSET_HAS_ZERO_OR_ONE_ROWS */;
col_char_12_key	col_char_12	col_bigint_key	pk	col_bigint
SELECT COUNT( col_bigint ) FROM table0_bigint WHERE col_bigint NOT IN ( 124 , 1 , 9 , -10 , 0 ) ORDER BY col_char_12_key,pk  , pk DESC LIMIT 5 /* RESULTSET_HAS_ZERO_OR_ONE_ROWS */;
COUNT( col_bigint )
8
INSERT INTO table0_bigint ( pk , col_bigint_key, col_char_12 ) VALUES ( 10 , SUBSTR( CAST( ( ROUND( 10 - ROUND( ROUND( 99 - -100 ) * 0 ) ) ) AS CHAR(100) ) , 1 , 12 ) , SUBSTR( CAST( ( CEIL ( LENGTH('WHRWM') ) ) AS CHAR(100) ) , 1 , 12 ) ) ;
ERROR 23000: Duplicate entry '10' for key 'PRIMARY'
SELECT * FROM table0_bigint ORDER BY pk;
col_char_12_key	col_char_12	col_bigint_key	pk	col_bigint
8-9	8-9	2	-1018	8
-10	NULL	0	-100	NULL
99	99	NULL	-10	NULL
139	NULL	NULL	-9	NULL
0	NULL	0	-1	NULL
0	NULL	0	0	NULL
2	NULL	NULL	1	NULL
NULL	NULL	5	4	NULL
NULL	NULL	14	5	NULL
NULL	NULL	14	6	NULL
NULL	NULL	14	7	NULL
5	NULL	-9	8	NULL
NULL	5	9	9	9
NULL	NULL	158	10	10
NULL	NULL	5	13	NULL
NULL	NULL	5	32	NULL
8	NULL	NULL	60	NULL
NULL	1	14	67	-10
NULL	10	5	83	83
NULL	NULL	5	86	86
-300	NULL	0	91	1
NULL	9	158	99	99
NULL	NULL	14	111	NULL
NULL	NULL	123	123	123
5	0	NULL	144	1
-10	NULL	0	154	NULL
9	NULL	NULL	159	NULL
NULL	NULL	14	216	NULL
NULL	NULL	227	227	227
-90	NULL	0	232	4
SELECT col_char_12_key FROM table0_bigint WHERE pk >= -1782251520 and pk <= -1782251520 ORDER BY col_bigint_key , pk DESC LIMIT 8 , 7 /* RESULTSET_HAS_ZERO_OR_ONE_ROWS */;
col_char_12_key
INSERT INTO table0_bigint ( pk , col_bigint_key ) VALUES ( 9 , SUBSTR( CAST( ( ROUND( 0 * ROUND( ROUND( 1 * -9 ) * 1 ) ) ) AS CHAR(100) ) , 1 , 12 ) ) ;
ERROR 23000: Duplicate entry '9' for key 'PRIMARY'
SELECT * FROM table0_bigint ORDER BY pk;
col_char_12_key	col_char_12	col_bigint_key	pk	col_bigint
8-9	8-9	2	-1018	8
-10	NULL	0	-100	NULL
99	99	NULL	-10	NULL
139	NULL	NULL	-9	NULL
0	NULL	0	-1	NULL
0	NULL	0	0	NULL
2	NULL	NULL	1	NULL
NULL	NULL	5	4	NULL
NULL	NULL	14	5	NULL
NULL	NULL	14	6	NULL
NULL	NULL	14	7	NULL
5	NULL	-9	8	NULL
NULL	5	9	9	9
NULL	NULL	158	10	10
NULL	NULL	5	13	NULL
NULL	NULL	5	32	NULL
8	NULL	NULL	60	NULL
NULL	1	14	67	-10
NULL	10	5	83	83
NULL	NULL	5	86	86
-300	NULL	0	91	1
NULL	9	158	99	99
NULL	NULL	14	111	NULL
NULL	NULL	123	123	123
5	0	NULL	144	1
-10	NULL	0	154	NULL
9	NULL	NULL	159	NULL
NULL	NULL	14	216	NULL
NULL	NULL	227	227	227
-90	NULL	0	232	4
SELECT * FROM table0_bigint WHERE col_bigint BETWEEN SUBSTR( CAST( ( ROUND( -9 - LENGTH('VHDNU') ) ) AS CHAR(100) ) , 1 , 12 ) AND SUBSTR( CAST( ( ROUND( LENGTH( SUBSTR( CAST( ( ROUND( ROUND( 99 + ABS ( LENGTH('GGHFY') ) ) - 0 ) ) AS CHAR(100) ) , 1 , 12 ) ) * 126 ) ) AS CHAR(100) ) , 1 , 12 ) ORDER BY pk LIMIT 181 , 2;
col_char_12_key	col_char_12	col_bigint_key	pk	col_bigint
INSERT INTO table0_bigint ( pk , col_char_12_key ) VALUES ( 9, CAST( 10 AS CHAR(100)) ) , ( 175, CAST( -100 AS CHAR(100)) ) ;
ERROR 23000: Duplicate entry '9' for key 'PRIMARY'
SELECT * FROM table0_bigint ORDER BY pk;
col_char_12_key	col_char_12	col_bigint_key	pk	col_bigint
8-9	8-9	2	-1018	8
-10	NULL	0	-100	NULL
99	99	NULL	-10	NULL
139	NULL	NULL	-9	NULL
0	NULL	0	-1	NULL
0	NULL	0	0	NULL
2	NULL	NULL	1	NULL
NULL	NULL	5	4	NULL
NULL	NULL	14	5	NULL
NULL	NULL	14	6	NULL
NULL	NULL	14	7	NULL
5	NULL	-9	8	NULL
NULL	5	9	9	9
NULL	NULL	158	10	10
NULL	NULL	5	13	NULL
NULL	NULL	5	32	NULL
8	NULL	NULL	60	NULL
NULL	1	14	67	-10
NULL	10	5	83	83
NULL	NULL	5	86	86
-300	NULL	0	91	1
NULL	9	158	99	99
NULL	NULL	14	111	NULL
NULL	NULL	123	123	123
5	0	NULL	144	1
-10	NULL	0	154	NULL
9	NULL	NULL	159	NULL
NULL	NULL	14	216	NULL
NULL	NULL	227	227	227
-90	NULL	0	232	4
SELECT col_bigint_key FROM table0_bigint WHERE col_bigint_key BETWEEN SUBSTR( CAST( ( ROUND( FLOOR ( 6 ) * 99 ) ) AS CHAR(100) ) , 1 , 12 ) AND SUBSTR( CAST( ( ROUND( -9 * ROUND( 9 - 99 ) ) ) AS CHAR(100) ) , 1 , 12 ) ORDER BY col_char_12_key , pk DESC LIMIT 29 , 1;
col_bigint_key
SELECT col_bigint FROM table0_bigint WHERE NOT ( pk != SUBSTR( CAST( ( ROUND( -1 + FLOOR ( 10 ) ) ) AS CHAR(100) ) , 1 , 12 ) ) AND  ( col_bigint_key != SUBSTR( CAST( ( FLOOR ( -10 ) ) AS CHAR(100) ) , 1 , 12 ) ) ORDER BY col_bigint_key , col_char_12_key , pk  LIMIT 1 /* RESULTSET_HAS_ZERO_OR_ONE_ROWS */;
col_bigint
9
INSERT INTO table0_bigint (pk) VALUES ( 9 ) ;
ERROR 23000: Duplicate entry '9' for key 'PRIMARY'
SELECT * FROM table0_bigint ORDER BY pk;
col_char_12_key	col_char_12	col_bigint_key	pk	col_bigint
8-9	8-9	2	-1018	8
-10	NULL	0	-100	NULL
99	99	NULL	-10	NULL
139	NULL	NULL	-9	NULL
0	NULL	0	-1	NULL
0	NULL	0	0	NULL
2	NULL	NULL	1	NULL
NULL	NULL	5	4	NULL
NULL	NULL	14	5	NULL
NULL	NULL	14	6	NULL
NULL	NULL	14	7	NULL
5	NULL	-9	8	NULL
NULL	5	9	9	9
NULL	NULL	158	10	10
NULL	NULL	5	13	NULL
NULL	NULL	5	32	NULL
8	NULL	NULL	60	NULL
NULL	1	14	67	-10
NULL	10	5	83	83
NULL	NULL	5	86	86
-300	NULL	0	91	1
NULL	9	158	99	99
NULL	NULL	14	111	NULL
NULL	NULL	123	123	123
5	0	NULL	144	1
-10	NULL	0	154	NULL
9	NULL	NULL	159	NULL
NULL	NULL	14	216	NULL
NULL	NULL	227	227	227
-90	NULL	0	232	4
SELECT col_bigint_key FROM table0_bigint WHERE pk != 1 ORDER BY col_bigint  , col_char_12_key ASC , pk DESC LIMIT 4 , 1 /* RESULTSET_HAS_ZERO_OR_ONE_ROWS */;
col_bigint_key
14
SELECT * FROM table0_bigint WHERE col_bigint_key BETWEEN CAST( 2 AS CHAR(100) ) AND CAST( 7 AS CHAR(100) ) ORDER BY col_char_12_key , col_bigint_key , col_char_12_key , pk  LIMIT 2 , 1;
col_char_12_key	col_char_12	col_bigint_key	pk	col_bigint
NULL	NULL	5	32	NULL
SELECT UPPER( pk ) FROM table0_bigint WHERE NOT ( col_char_12 <> SUBSTR( CAST( ( SIGN ( LENGTH('OARSS') ) ) AS CHAR(100) ) , 1 , 12 ) ) OR  ( col_bigint_key <= SUBSTR( CAST( ( LENGTH( SUBSTR( CAST( ( ROUND( 6 - 59 ) ) AS CHAR(100) ) , 1 , 12 ) ) ) AS CHAR(100) ) , 1 , 12 ) ) OR NOT ( col_bigint < SUBSTR( CAST( ( ROUND( ROUND( -1 + 1 ) + -9 ) ) AS CHAR(100) ) , 1 , 12 ) ) AND  ( col_char_12 = SUBSTR( CAST( ( 9 ) AS CHAR(100) ) , 1 , 12 ) ) GROUP BY pk ORDER BY pk LIMIT 1 , 1 /* RESULTSET_HAS_ZERO_OR_ONE_ROWS */;
UPPER( pk )
-100
SELECT col_bigint , col_char_12 FROM table0_bigint WHERE pk >= 1981874176 and pk <= 1981874176 ORDER BY col_bigint_key , col_char_12_key , col_char_12_key , pk DESC LIMIT 2 , 3 /* RESULTSET_HAS_ZERO_OR_ONE_ROWS */;
col_bigint	col_char_12
SELECT UPPER( col_char_12 ) FROM table0_bigint WHERE 98 <> 97 GROUP BY col_char_12 ORDER BY col_char_12 LIMIT 3 , 2;
UPPER( col_char_12 )
10
5
SELECT COUNT( col_char_12 ) FROM table0_bigint WHERE 99 != ABS ( 10 ) ORDER BY pk LIMIT 7 /* RESULTSET_HAS_ZERO_OR_ONE_ROWS */;
COUNT( col_char_12 )
7
UPDATE table0_bigint SET pk = SUBSTR( CAST( ( ABS ( 10 ) ) AS CHAR(100) ) , 1 , 12 ) WHERE ( -1483669504 , 483196928 , 295436288 ) NOT IN ( ( SUBSTR( CAST( ( ROUND( FLOOR ( 10 ) * 99 ) ) AS CHAR(100) ) , 1 , 12 ) , SUBSTR( CAST( ( ROUND( -10 - 2 ) ) AS CHAR(100) ) , 1 , 12 ) , SUBSTR( CAST( ( ROUND( ABS ( 89 ) + -9 ) ) AS CHAR(100) ) , 1 , 12 ) ) , ( SUBSTR( CAST( ( ABS ( FLOOR ( FLOOR ( 0 ) ) ) ) AS CHAR(100) ) , 1 , 12 ) , SUBSTR( CAST( ( ROUND( 10 - ROUND ( LENGTH( SUBSTR( CAST( ( SIGN ( -100 ) ) AS CHAR(100) ) , 1 , 12 ) ) ) ) ) AS CHAR(100) ) , 1 , 12 ) , SUBSTR( CAST( ( -9 ) AS CHAR(100) ) , 1 , 12 ) ) ) ORDER BY pk DESC , pk DESC LIMIT 4 ;
ERROR 23000: Duplicate entry '10' for key 'PRIMARY'
SELECT * FROM table0_bigint ORDER BY pk;
col_char_12_key	col_char_12	col_bigint_key	pk	col_bigint
8-9	8-9	2	-1018	8
-10	NULL	0	-100	NULL
99	99	NULL	-10	NULL
139	NULL	NULL	-9	NULL
0	NULL	0	-1	NULL
0	NULL	0	0	NULL
2	NULL	NULL	1	NULL
NULL	NULL	5	4	NULL
NULL	NULL	14	5	NULL
NULL	NULL	14	6	NULL
NULL	NULL	14	7	NULL
5	NULL	-9	8	NULL
NULL	5	9	9	9
NULL	NULL	158	10	10
NULL	NULL	5	13	NULL
NULL	NULL	5	32	NULL
8	NULL	NULL	60	NULL
NULL	1	14	67	-10
NULL	10	5	83	83
NULL	NULL	5	86	86
-300	NULL	0	91	1
NULL	9	158	99	99
NULL	NULL	14	111	NULL
NULL	NULL	123	123	123
5	0	NULL	144	1
-10	NULL	0	154	NULL
9	NULL	NULL	159	NULL
NULL	NULL	14	216	NULL
NULL	NULL	227	227	227
-90	NULL	0	232	4
INSERT INTO table0_bigint ( pk , col_bigint_key ) VALUES ( 9, CAST( 0 AS CHAR(100)) ) , ( 0, CAST( 9 AS CHAR(100)) ) ;
ERROR 23000: Duplicate entry '9' for key 'PRIMARY'
SELECT * FROM table0_bigint ORDER BY pk;
col_char_12_key	col_char_12	col_bigint_key	pk	col_bigint
8-9	8-9	2	-1018	8
-10	NULL	0	-100	NULL
99	99	NULL	-10	NULL
139	NULL	NULL	-9	NULL
0	NULL	0	-1	NULL
0	NULL	0	0	NULL
2	NULL	NULL	1	NULL
NULL	NULL	5	4	NULL
NULL	NULL	14	5	NULL
NULL	NULL	14	6	NULL
NULL	NULL	14	7	NULL
5	NULL	-9	8	NULL
NULL	5	9	9	9
NULL	NULL	158	10	10
NULL	NULL	5	13	NULL
NULL	NULL	5	32	NULL
8	NULL	NULL	60	NULL
NULL	1	14	67	-10
NULL	10	5	83	83
NULL	NULL	5	86	86
-300	NULL	0	91	1
NULL	9	158	99	99
NULL	NULL	14	111	NULL
NULL	NULL	123	123	123
5	0	NULL	144	1
-10	NULL	0	154	NULL
9	NULL	NULL	159	NULL
NULL	NULL	14	216	NULL
NULL	NULL	227	227	227
-90	NULL	0	232	4
INSERT INTO table0_bigint (pk) VALUES ( -100 ) ;
ERROR 23000: Duplicate entry '-100' for key 'PRIMARY'
SELECT * FROM table0_bigint ORDER BY pk;
col_char_12_key	col_char_12	col_bigint_key	pk	col_bigint
8-9	8-9	2	-1018	8
-10	NULL	0	-100	NULL
99	99	NULL	-10	NULL
139	NULL	NULL	-9	NULL
0	NULL	0	-1	NULL
0	NULL	0	0	NULL
2	NULL	NULL	1	NULL
NULL	NULL	5	4	NULL
NULL	NULL	14	5	NULL
NULL	NULL	14	6	NULL
NULL	NULL	14	7	NULL
5	NULL	-9	8	NULL
NULL	5	9	9	9
NULL	NULL	158	10	10
NULL	NULL	5	13	NULL
NULL	NULL	5	32	NULL
8	NULL	NULL	60	NULL
NULL	1	14	67	-10
NULL	10	5	83	83
NULL	NULL	5	86	86
-300	NULL	0	91	1
NULL	9	158	99	99
NULL	NULL	14	111	NULL
NULL	NULL	123	123	123
5	0	NULL	144	1
-10	NULL	0	154	NULL
9	NULL	NULL	159	NULL
NULL	NULL	14	216	NULL
NULL	NULL	227	227	227
-90	NULL	0	232	4
SELECT * FROM table0_bigint  ORDER BY col_char_12_key , col_bigint_key , pk  LIMIT 2;
col_char_12_key	col_char_12	col_bigint_key	pk	col_bigint
NULL	NULL	5	4	NULL
NULL	NULL	5	13	NULL
SELECT  UPPER( col_char_12 ) FROM table0_bigint WHERE col_bigint_key IN ( SUBSTR( CAST( ( LENGTH('NWIEW') ) AS CHAR(100) ) , 1 , 12 ) , SUBSTR( CAST( ( ROUND( 99 - -9 ) ) AS CHAR(100) ) , 1 , 12 ) , SUBSTR( CAST( ( ROUND( 159 - ROUND( -100 * ROUND( 9 + ROUND( 1 + LENGTH('VRVIX') ) ) ) ) ) AS CHAR(100) ) , 1 , 12 ) , SUBSTR( CAST( ( ROUND( ROUND( 218 * 152 ) + 99 ) ) AS CHAR(100) ) , 1 , 12 ) , SUBSTR( CAST( ( LENGTH('RITRC') ) AS CHAR(100) ) , 1 , 12 ) ) ORDER BY col_char_12_key , pk ;
UPPER( col_char_12 )
NULL
NULL
NULL
10
NULL
SELECT 1 FROM table0_bigint WHERE pk BETWEEN SUBSTR( CAST( ( ABS ( 9 ) ) AS CHAR(100) ) , 1 , 12 ) AND SUBSTR( CAST( ( 230 ) AS CHAR(100) ) , 1 , 12 ) FOR UPDATE;
1
1
1
1
1
1
1
1
1
1
1
1
1
1
1
1
1
1
SELECT * FROM table0_bigint WHERE pk IN ( SUBSTR( CAST( ( ROUND( 99 * -100 ) ) AS CHAR(100) ) , 1 , 12 ) , SUBSTR( CAST( ( LENGTH( SUBSTR( CAST( ( ROUND( ROUND ( CEIL ( ROUND( 2 - 10 ) ) ) - 2 ) ) AS CHAR(100) ) , 1 , 12 ) ) ) AS CHAR(100) ) , 1 , 12 ) , SUBSTR( CAST( ( LENGTH('SVZBK') ) AS CHAR(100) ) , 1 , 12 ) , SUBSTR( CAST( ( ROUND( LENGTH('KQDQJ') * 198 ) ) AS CHAR(100) ) , 1 , 12 ) , SUBSTR( CAST( ( ROUND( 9 - 10 ) ) AS CHAR(100) ) , 1 , 12 ) ) ORDER BY pk LIMIT 5 , 6;
col_char_12_key	col_char_12	col_bigint_key	pk	col_bigint
SELECT col_char_12_key FROM table0_bigint WHERE col_char_12_key BETWEEN CAST( 4 AS CHAR(100) ) AND CAST( 6 AS CHAR(100) ) ORDER BY col_char_12_key , col_bigint_key , pk ASC LIMIT 3;
col_char_12_key
5
5
INSERT INTO table0_bigint (pk) VALUES ( 43 ) ;
SELECT * FROM table0_bigint ORDER BY pk;
col_char_12_key	col_char_12	col_bigint_key	pk	col_bigint
8-9	8-9	2	-1018	8
-10	NULL	0	-100	NULL
99	99	NULL	-10	NULL
139	NULL	NULL	-9	NULL
0	NULL	0	-1	NULL
0	NULL	0	0	NULL
2	NULL	NULL	1	NULL
NULL	NULL	5	4	NULL
NULL	NULL	14	5	NULL
NULL	NULL	14	6	NULL
NULL	NULL	14	7	NULL
5	NULL	-9	8	NULL
NULL	5	9	9	9
NULL	NULL	158	10	10
NULL	NULL	5	13	NULL
NULL	NULL	5	32	NULL
NULL	NULL	NULL	43	NULL
8	NULL	NULL	60	NULL
NULL	1	14	67	-10
NULL	10	5	83	83
NULL	NULL	5	86	86
-300	NULL	0	91	1
NULL	9	158	99	99
NULL	NULL	14	111	NULL
NULL	NULL	123	123	123
5	0	NULL	144	1
-10	NULL	0	154	NULL
9	NULL	NULL	159	NULL
NULL	NULL	14	216	NULL
NULL	NULL	227	227	227
-90	NULL	0	232	4
INSERT INTO table0_bigint ( pk , col_char_12_key ) VALUES ( -1 , SUBSTR( CAST( ( ROUND( ROUND( 9 - -100 ) * 1 ) ) AS CHAR(100) ) , 1 , 12 ) ) ;
ERROR 23000: Duplicate entry '-1' for key 'PRIMARY'
SELECT * FROM table0_bigint ORDER BY pk;
col_char_12_key	col_char_12	col_bigint_key	pk	col_bigint
8-9	8-9	2	-1018	8
-10	NULL	0	-100	NULL
99	99	NULL	-10	NULL
139	NULL	NULL	-9	NULL
0	NULL	0	-1	NULL
0	NULL	0	0	NULL
2	NULL	NULL	1	NULL
NULL	NULL	5	4	NULL
NULL	NULL	14	5	NULL
NULL	NULL	14	6	NULL
NULL	NULL	14	7	NULL
5	NULL	-9	8	NULL
NULL	5	9	9	9
NULL	NULL	158	10	10
NULL	NULL	5	13	NULL
NULL	NULL	5	32	NULL
NULL	NULL	NULL	43	NULL
8	NULL	NULL	60	NULL
NULL	1	14	67	-10
NULL	10	5	83	83
NULL	NULL	5	86	86
-300	NULL	0	91	1
NULL	9	158	99	99
NULL	NULL	14	111	NULL
NULL	NULL	123	123	123
5	0	NULL	144	1
-10	NULL	0	154	NULL
9	NULL	NULL	159	NULL
NULL	NULL	14	216	NULL
NULL	NULL	227	227	227
-90	NULL	0	232	4
SELECT * FROM table0_bigint WHERE ( 196804608 , 1711603712 , 1276772352 , -84541440 ) NOT IN ( ( SUBSTR( CAST( ( 22 ) AS CHAR(100) ) , 1 , 12 ) , SUBSTR( CAST( ( ROUND( -9 * LENGTH('NJYST') ) ) AS CHAR(100) ) , 1 , 12 ) , SUBSTR( CAST( ( ROUND( ROUND( -9 + -9 ) - 99 ) ) AS CHAR(100) ) , 1 , 12 ) , SUBSTR( CAST( ( -1 ) AS CHAR(100) ) , 1 , 12 ) ) ) ORDER BY pk LIMIT 7 , 1 /* RESULTSET_HAS_ZERO_OR_ONE_ROWS */;
col_char_12_key	col_char_12	col_bigint_key	pk	col_bigint
NULL	NULL	5	4	NULL
SELECT DISTINCT 1 , NULL , TRUE , FALSE , UPPER( pk ) FROM table0_bigint ORDER BY col_bigint_key , pk ;
1	NULL	TRUE	FALSE	UPPER( pk )
1	NULL	1	0	-10
1	NULL	1	0	-9
1	NULL	1	0	1
1	NULL	1	0	43
1	NULL	1	0	60
1	NULL	1	0	144
1	NULL	1	0	159
1	NULL	1	0	8
1	NULL	1	0	-100
1	NULL	1	0	-1
1	NULL	1	0	0
1	NULL	1	0	91
1	NULL	1	0	154
1	NULL	1	0	232
1	NULL	1	0	-1018
1	NULL	1	0	4
1	NULL	1	0	13
1	NULL	1	0	32
1	NULL	1	0	83
1	NULL	1	0	86
1	NULL	1	0	9
1	NULL	1	0	5
1	NULL	1	0	6
1	NULL	1	0	7
1	NULL	1	0	67
1	NULL	1	0	111
1	NULL	1	0	216
1	NULL	1	0	123
1	NULL	1	0	10
1	NULL	1	0	99
1	NULL	1	0	227
SELECT COUNT( col_bigint_key ) FROM table0_bigint WHERE col_bigint_key <= ( SUBSTR( CAST( ( LENGTH('ZSULN') ) AS CHAR(100) ) , 1 , 12 ) ) ORDER BY col_char_12 ASC , pk  LIMIT 2 , 4 /* RESULTSET_HAS_ZERO_OR_ONE_ROWS */;
COUNT( col_bigint_key )
SELECT * FROM table0_bigint WHERE ROUND ( ROUND( -10 + SIGN ( SIGN ( ROUND( 0 + ROUND( ROUND( CEIL ( LENGTH('KNELK') ) + -9 ) + 0 ) ) ) ) ) ) <= col_bigint_key ORDER BY col_bigint_key , col_bigint_key , col_bigint_key , pk  LIMIT 3 , 2;
col_char_12_key	col_char_12	col_bigint_key	pk	col_bigint
0	NULL	0	0	NULL
-300	NULL	0	91	1
INSERT INTO table0_bigint ( pk , col_char_12_key ) VALUES ( 99, CAST( -1 AS CHAR(100)) ) , ( 9, CAST( -1 AS CHAR(100)) ) ;
ERROR 23000: Duplicate entry '99' for key 'PRIMARY'
SELECT * FROM table0_bigint ORDER BY pk;
col_char_12_key	col_char_12	col_bigint_key	pk	col_bigint
8-9	8-9	2	-1018	8
-10	NULL	0	-100	NULL
99	99	NULL	-10	NULL
139	NULL	NULL	-9	NULL
0	NULL	0	-1	NULL
0	NULL	0	0	NULL
2	NULL	NULL	1	NULL
NULL	NULL	5	4	NULL
NULL	NULL	14	5	NULL
NULL	NULL	14	6	NULL
NULL	NULL	14	7	NULL
5	NULL	-9	8	NULL
NULL	5	9	9	9
NULL	NULL	158	10	10
NULL	NULL	5	13	NULL
NULL	NULL	5	32	NULL
NULL	NULL	NULL	43	NULL
8	NULL	NULL	60	NULL
NULL	1	14	67	-10
NULL	10	5	83	83
NULL	NULL	5	86	86
-300	NULL	0	91	1
NULL	9	158	99	99
NULL	NULL	14	111	NULL
NULL	NULL	123	123	123
5	0	NULL	144	1
-10	NULL	0	154	NULL
9	NULL	NULL	159	NULL
NULL	NULL	14	216	NULL
NULL	NULL	227	227	227
-90	NULL	0	232	4
UPDATE table0_bigint SET pk = SUBSTR( CAST( ( ROUND( 98 * ROUND( 99 - 99 ) ) ) AS CHAR(100) ) , 1 , 12 ) WHERE pk IN ( -9 , 0 , 99 , 0 , -9 ) ORDER BY col_bigint_key,pk DESC , pk ASC LIMIT 7 ;
ERROR 23000: Duplicate entry '0' for key 'PRIMARY'
SELECT * FROM table0_bigint ORDER BY pk;
col_char_12_key	col_char_12	col_bigint_key	pk	col_bigint
8-9	8-9	2	-1018	8
-10	NULL	0	-100	NULL
99	99	NULL	-10	NULL
139	NULL	NULL	-9	NULL
0	NULL	0	-1	NULL
0	NULL	0	0	NULL
2	NULL	NULL	1	NULL
NULL	NULL	5	4	NULL
NULL	NULL	14	5	NULL
NULL	NULL	14	6	NULL
NULL	NULL	14	7	NULL
5	NULL	-9	8	NULL
NULL	5	9	9	9
NULL	NULL	158	10	10
NULL	NULL	5	13	NULL
NULL	NULL	5	32	NULL
NULL	NULL	NULL	43	NULL
8	NULL	NULL	60	NULL
NULL	1	14	67	-10
NULL	10	5	83	83
NULL	NULL	5	86	86
-300	NULL	0	91	1
NULL	9	158	99	99
NULL	NULL	14	111	NULL
NULL	NULL	123	123	123
5	0	NULL	144	1
-10	NULL	0	154	NULL
9	NULL	NULL	159	NULL
NULL	NULL	14	216	NULL
NULL	NULL	227	227	227
-90	NULL	0	232	4
SELECT 1 FROM table0_bigint WHERE ( 385024000 , 1879506944 , 740229120 ) IN ( ( SUBSTR( CAST( ( LENGTH( SUBSTR( CAST( ( ROUND( 9 * ROUND ( 207 ) ) ) AS CHAR(100) ) , 1 , 12 ) ) ) AS CHAR(100) ) , 1 , 12 ) , SUBSTR( CAST( ( ROUND( CEIL ( ROUND( 10 - -9 ) ) - 179 ) ) AS CHAR(100) ) , 1 , 12 ) , SUBSTR( CAST( ( ROUND( -10 + LENGTH('OQUMR') ) ) AS CHAR(100) ) , 1 , 12 ) ) , ( SUBSTR( CAST( ( ROUND ( ROUND( 136 + 6 ) ) ) AS CHAR(100) ) , 1 , 12 ) , SUBSTR( CAST( ( ROUND( 50 + 9 ) ) AS CHAR(100) ) , 1 , 12 ) , SUBSTR( CAST( ( ROUND( 0 + LENGTH( SUBSTR( CAST( ( ROUND( 1 * 99 ) ) AS CHAR(100) ) , 1 , 12 ) ) ) ) AS CHAR(100) ) , 1 , 12 ) ) ) FOR UPDATE;
1
SELECT  UPPER( col_bigint_key ) FROM table0_bigint WHERE pk <= 10 ORDER BY col_char_12_key,pk DESC , pk DESC;
UPPER( col_bigint_key )
158
9
14
14
14
5
0
0
0
NULL
NULL
-9
2
NULL
SELECT pk FROM table0_bigint WHERE ( 1998127104 , -1831927808 , -1280376832 , 341966848 ) NOT IN ( ( SUBSTR( CAST( ( FLOOR ( 178 ) ) AS CHAR(100) ) , 1 , 12 ) , SUBSTR( CAST( ( CEIL ( -100 ) ) AS CHAR(100) ) , 1 , 12 ) , SUBSTR( CAST( ( LENGTH('UHPKK') ) AS CHAR(100) ) , 1 , 12 ) , SUBSTR( CAST( ( LENGTH( SUBSTR( CAST( ( ROUND( 99 * 99 ) ) AS CHAR(100) ) , 1 , 12 ) ) ) AS CHAR(100) ) , 1 , 12 ) ) ) ORDER BY pk LIMIT 8 , 5;
pk
5
6
7
8
9
UPDATE table0_bigint SET col_bigint_key = col_bigint_key WHERE col_char_12 IN ( SUBSTR( CAST( ( -1 ) AS CHAR(100) ) , 1 , 12 ) , SUBSTR( CAST( ( LENGTH('GFAUH') ) AS CHAR(100) ) , 1 , 12 ) , SUBSTR( CAST( ( ROUND( 0 - -10 ) ) AS CHAR(100) ) , 1 , 12 ) , SUBSTR( CAST( ( -9 ) AS CHAR(100) ) , 1 , 12 ) , SUBSTR( CAST( ( ROUND( -10 * 0 ) ) AS CHAR(100) ) , 1 , 12 ) ) ORDER BY col_bigint_key , pk DESC LIMIT 8 ;
SELECT * FROM table0_bigint ORDER BY pk;
col_char_12_key	col_char_12	col_bigint_key	pk	col_bigint
8-9	8-9	2	-1018	8
-10	NULL	0	-100	NULL
99	99	NULL	-10	NULL
139	NULL	NULL	-9	NULL
0	NULL	0	-1	NULL
0	NULL	0	0	NULL
2	NULL	NULL	1	NULL
NULL	NULL	5	4	NULL
NULL	NULL	14	5	NULL
NULL	NULL	14	6	NULL
NULL	NULL	14	7	NULL
5	NULL	-9	8	NULL
NULL	5	9	9	9
NULL	NULL	158	10	10
NULL	NULL	5	13	NULL
NULL	NULL	5	32	NULL
NULL	NULL	NULL	43	NULL
8	NULL	NULL	60	NULL
NULL	1	14	67	-10
NULL	10	5	83	83
NULL	NULL	5	86	86
-300	NULL	0	91	1
NULL	9	158	99	99
NULL	NULL	14	111	NULL
NULL	NULL	123	123	123
5	0	NULL	144	1
-10	NULL	0	154	NULL
9	NULL	NULL	159	NULL
NULL	NULL	14	216	NULL
NULL	NULL	227	227	227
-90	NULL	0	232	4
INSERT INTO table0_bigint (pk) VALUES ( 10 ) ;
ERROR 23000: Duplicate entry '10' for key 'PRIMARY'
SELECT * FROM table0_bigint ORDER BY pk;
col_char_12_key	col_char_12	col_bigint_key	pk	col_bigint
8-9	8-9	2	-1018	8
-10	NULL	0	-100	NULL
99	99	NULL	-10	NULL
139	NULL	NULL	-9	NULL
0	NULL	0	-1	NULL
0	NULL	0	0	NULL
2	NULL	NULL	1	NULL
NULL	NULL	5	4	NULL
NULL	NULL	14	5	NULL
NULL	NULL	14	6	NULL
NULL	NULL	14	7	NULL
5	NULL	-9	8	NULL
NULL	5	9	9	9
NULL	NULL	158	10	10
NULL	NULL	5	13	NULL
NULL	NULL	5	32	NULL
NULL	NULL	NULL	43	NULL
8	NULL	NULL	60	NULL
NULL	1	14	67	-10
NULL	10	5	83	83
NULL	NULL	5	86	86
-300	NULL	0	91	1
NULL	9	158	99	99
NULL	NULL	14	111	NULL
NULL	NULL	123	123	123
5	0	NULL	144	1
-10	NULL	0	154	NULL
9	NULL	NULL	159	NULL
NULL	NULL	14	216	NULL
NULL	NULL	227	227	227
-90	NULL	0	232	4
SELECT 1 FROM table0_bigint WHERE col_char_12_key <> ( SUBSTR( CAST( ( ROUND( 0 - ROUND( -1 * LENGTH( SUBSTR( CAST( ( ROUND( -9 + 99 ) ) AS CHAR(100) ) , 1 , 12 ) ) ) ) ) AS CHAR(100) ) , 1 , 12 ) ) AND col_bigint_key = ( SUBSTR( CAST( ( ROUND( 38 - -1 ) ) AS CHAR(100) ) , 1 , 12 ) ) FOR UPDATE;
1
INSERT INTO table0_bigint ( pk , col_bigint_key, col_char_12 ) VALUES ( -10 , SUBSTR( CAST( ( 0 ) AS CHAR(100) ) , 1 , 12 ) , SUBSTR( CAST( ( ROUND( 1 + 9 ) ) AS CHAR(100) ) , 1 , 12 ) ) ;
ERROR 23000: Duplicate entry '-10' for key 'PRIMARY'
SELECT * FROM table0_bigint ORDER BY pk;
col_char_12_key	col_char_12	col_bigint_key	pk	col_bigint
8-9	8-9	2	-1018	8
-10	NULL	0	-100	NULL
99	99	NULL	-10	NULL
139	NULL	NULL	-9	NULL
0	NULL	0	-1	NULL
0	NULL	0	0	NULL
2	NULL	NULL	1	NULL
NULL	NULL	5	4	NULL
NULL	NULL	14	5	NULL
NULL	NULL	14	6	NULL
NULL	NULL	14	7	NULL
5	NULL	-9	8	NULL
NULL	5	9	9	9
NULL	NULL	158	10	10
NULL	NULL	5	13	NULL
NULL	NULL	5	32	NULL
NULL	NULL	NULL	43	NULL
8	NULL	NULL	60	NULL
NULL	1	14	67	-10
NULL	10	5	83	83
NULL	NULL	5	86	86
-300	NULL	0	91	1
NULL	9	158	99	99
NULL	NULL	14	111	NULL
NULL	NULL	123	123	123
5	0	NULL	144	1
-10	NULL	0	154	NULL
9	NULL	NULL	159	NULL
NULL	NULL	14	216	NULL
NULL	NULL	227	227	227
-90	NULL	0	232	4
SELECT * FROM table0_bigint WHERE ROUND ( -1 ) = SIGN ( LENGTH( SUBSTR( CAST( ( ROUND( ROUND( -1 - SIGN ( ROUND( 10 - 4 ) ) ) * 153 ) ) AS CHAR(100) ) , 1 , 12 ) ) ) ORDER BY col_bigint_key , col_bigint_key , pk DESC LIMIT 37 , 4;
col_char_12_key	col_char_12	col_bigint_key	pk	col_bigint
SELECT pk , col_char_12_key FROM table0_bigint WHERE col_bigint_key IN ( CAST(0 AS CHAR(100)) , CAST(-10 AS CHAR(100)) , CAST(0 AS CHAR(100)) ) ORDER BY pk LIMIT 1 /* RESULTSET_HAS_ZERO_OR_ONE_ROWS */;
pk	col_char_12_key
-100	-10
SELECT col_bigint_key,pk FROM table0_bigint WHERE col_bigint_key > ( SUBSTR( CAST( ( LENGTH( SUBSTR( CAST( ( LENGTH( SUBSTR( CAST( ( ROUND( 1 - 99 ) ) AS CHAR(100) ) , 1 , 12 ) ) ) AS CHAR(100) ) , 1 , 12 ) ) ) AS CHAR(100) ) , 1 , 12 ) ) GROUP BY col_bigint_key,pk ORDER BY col_bigint_key,pk LIMIT 3 , 3;
col_bigint_key	pk
5	32
5	83
5	86
SELECT 1 FROM table0_bigint WHERE pk = ( SUBSTR( CAST( ( CEIL ( SIGN ( SIGN ( LENGTH( SUBSTR( CAST( ( ROUND( 66 + LENGTH( SUBSTR( CAST( ( SIGN ( -9 ) ) AS CHAR(100) ) , 1 , 12 ) ) ) ) AS CHAR(100) ) , 1 , 12 ) ) ) ) ) ) AS CHAR(100) ) , 1 , 12 ) ) FOR UPDATE;
1
1
SELECT * FROM table0_bigint WHERE ( -2037907456 ) NOT IN ( SUBSTR( CAST( ( LENGTH('UWETV') ) AS CHAR(100) ) , 1 , 12 ) , SUBSTR( CAST( ( 229 ) AS CHAR(100) ) , 1 , 12 ) , SUBSTR( CAST( ( LENGTH( SUBSTR( CAST( ( 10 ) AS CHAR(100) ) , 1 , 12 ) ) ) AS CHAR(100) ) , 1 , 12 ) , SUBSTR( CAST( ( FLOOR ( -100 ) ) AS CHAR(100) ) , 1 , 12 ) , SUBSTR( CAST( ( FLOOR ( ABS ( SIGN ( 4 ) ) ) ) AS CHAR(100) ) , 1 , 12 ) ) ORDER BY col_bigint_key DESC , pk DESC LIMIT 143 , 4;
col_char_12_key	col_char_12	col_bigint_key	pk	col_bigint
SELECT UPPER( col_bigint_key ) FROM table0_bigint WHERE col_bigint_key BETWEEN SUBSTR( CAST( ( ROUND( -10 * LENGTH( SUBSTR( CAST( ( ABS ( LENGTH( SUBSTR( CAST( ( ROUND( ABS ( 94 ) - 1 ) ) AS CHAR(100) ) , 1 , 12 ) ) ) ) AS CHAR(100) ) , 1 , 12 ) ) ) ) AS CHAR(100) ) , 1 , 12 ) AND SUBSTR( CAST( ( ABS ( 1 ) ) AS CHAR(100) ) , 1 , 12 ) GROUP BY col_bigint_key ORDER BY col_bigint_key LIMIT 5 , 1 /* RESULTSET_HAS_ZERO_OR_ONE_ROWS */;
UPPER( col_bigint_key )
SELECT 1 FROM table0_bigint WHERE pk IN ( SUBSTR( CAST( ( LENGTH( SUBSTR( CAST( ( ROUND( 74 * 9 ) ) AS CHAR(100) ) , 1 , 12 ) ) ) AS CHAR(100) ) , 1 , 12 ) , SUBSTR( CAST( ( ABS ( SIGN ( 22 ) ) ) AS CHAR(100) ) , 1 , 12 ) , SUBSTR( CAST( ( ROUND ( ROUND( 9 - ROUND( 0 - SIGN ( -100 ) ) ) ) ) AS CHAR(100) ) , 1 , 12 ) , SUBSTR( CAST( ( ROUND( 0 + LENGTH('RVXBY') ) ) AS CHAR(100) ) , 1 , 12 ) , SUBSTR( CAST( ( LENGTH( SUBSTR( CAST( ( ROUND( -1 + SIGN ( ABS ( 1 ) ) ) ) AS CHAR(100) ) , 1 , 12 ) ) ) AS CHAR(100) ) , 1 , 12 ) ) FOR UPDATE;
1
1
1
1
SELECT 1 FROM table0_bigint WHERE pk < ( SUBSTR( CAST( ( ROUND( 0 - 7 ) ) AS CHAR(100) ) , 1 , 12 ) ) FOR UPDATE;
1
1
1
1
1
SELECT 1 FROM table0_bigint WHERE pk >= ( SUBSTR( CAST( ( LENGTH( SUBSTR( CAST( ( ROUND( -100 - ROUND( ROUND( -100 * -9 ) + 0 ) ) ) AS CHAR(100) ) , 1 , 12 ) ) ) AS CHAR(100) ) , 1 , 12 ) ) FOR UPDATE;
1
1
1
1
1
1
1
1
1
1
1
1
1
1
1
1
1
1
1
1
1
1
1
1
SELECT col_bigint FROM table0_bigint WHERE pk >= ( SUBSTR( CAST( ( ROUND ( 1 ) ) AS CHAR(100) ) , 1 , 12 ) ) ORDER BY col_bigint_key , col_bigint_key , col_bigint_key , pk  LIMIT 7 , 1 /* RESULTSET_HAS_ZERO_OR_ONE_ROWS */;
col_bigint
NULL
INSERT INTO table0_bigint ( pk , col_bigint_key ) VALUES ( 10, CAST( 239 AS CHAR(100)) ) , ( -100, CAST( 245 AS CHAR(100)) ) ;
ERROR 23000: Duplicate entry '10' for key 'PRIMARY'
SELECT * FROM table0_bigint ORDER BY pk;
col_char_12_key	col_char_12	col_bigint_key	pk	col_bigint
8-9	8-9	2	-1018	8
-10	NULL	0	-100	NULL
99	99	NULL	-10	NULL
139	NULL	NULL	-9	NULL
0	NULL	0	-1	NULL
0	NULL	0	0	NULL
2	NULL	NULL	1	NULL
NULL	NULL	5	4	NULL
NULL	NULL	14	5	NULL
NULL	NULL	14	6	NULL
NULL	NULL	14	7	NULL
5	NULL	-9	8	NULL
NULL	5	9	9	9
NULL	NULL	158	10	10
NULL	NULL	5	13	NULL
NULL	NULL	5	32	NULL
NULL	NULL	NULL	43	NULL
8	NULL	NULL	60	NULL
NULL	1	14	67	-10
NULL	10	5	83	83
NULL	NULL	5	86	86
-300	NULL	0	91	1
NULL	9	158	99	99
NULL	NULL	14	111	NULL
NULL	NULL	123	123	123
5	0	NULL	144	1
-10	NULL	0	154	NULL
9	NULL	NULL	159	NULL
NULL	NULL	14	216	NULL
NULL	NULL	227	227	227
-90	NULL	0	232	4
SELECT * FROM table0_bigint WHERE ( -812122112 , -195100672 , 390266880 , -1552809984 ) NOT IN ( ( SUBSTR( CAST( ( ROUND( 99 * 10 ) ) AS CHAR(100) ) , 1 , 12 ) , SUBSTR( CAST( ( ROUND( 155 * ROUND( 10 - 10 ) ) ) AS CHAR(100) ) , 1 , 12 ) , SUBSTR( CAST( ( LENGTH('NAEDX') ) AS CHAR(100) ) , 1 , 12 ) , SUBSTR( CAST( ( ROUND( -100 + ROUND( 8 * LENGTH('SNJYW') ) ) ) AS CHAR(100) ) , 1 , 12 ) ) ) ORDER BY col_char_12_key,pk ASC , pk  LIMIT 7 , 7;
col_char_12_key	col_char_12	col_bigint_key	pk	col_bigint
NULL	NULL	5	32	NULL
NULL	NULL	NULL	43	NULL
NULL	1	14	67	-10
NULL	10	5	83	83
NULL	NULL	5	86	86
NULL	9	158	99	99
NULL	NULL	14	111	NULL
SELECT pk FROM table0_bigint WHERE ( -58327040 , 1424818176 , 2127691776 , -1271267328 , -1453326336 ) NOT IN ( ( SUBSTR( CAST( ( FLOOR ( -9 ) ) AS CHAR(100) ) , 1 , 12 ) , SUBSTR( CAST( ( ROUND( 1 * 1 ) ) AS CHAR(100) ) , 1 , 12 ) , SUBSTR( CAST( ( ROUND( -100 - 1 ) ) AS CHAR(100) ) , 1 , 12 ) , SUBSTR( CAST( ( LENGTH( SUBSTR( CAST( ( ROUND( ROUND( 99 - -1 ) + -100 ) ) AS CHAR(100) ) , 1 , 12 ) ) ) AS CHAR(100) ) , 1 , 12 ) , SUBSTR( CAST( ( ABS ( LENGTH( SUBSTR( CAST( ( CEIL ( -100 ) ) AS CHAR(100) ) , 1 , 12 ) ) ) ) AS CHAR(100) ) , 1 , 12 ) ) ) ORDER BY col_char_12_key , col_char_12_key , col_char_12_key , pk ASC LIMIT 147 , 1 /* RESULTSET_HAS_ZERO_OR_ONE_ROWS */;
pk
SELECT pk FROM table0_bigint WHERE col_bigint_key BETWEEN CAST( 2 AS CHAR(100) ) AND CAST( 7 AS CHAR(100) ) ORDER BY pk DESC , pk ASC LIMIT 1 , 1 /* RESULTSET_HAS_ZERO_OR_ONE_ROWS */;
pk
83
SELECT * FROM table0_bigint WHERE pk < 63 ORDER BY col_char_12_key , col_bigint_key , col_bigint_key , pk  LIMIT 5 , 7;
col_char_12_key	col_char_12	col_bigint_key	pk	col_bigint
NULL	NULL	14	5	NULL
NULL	NULL	14	6	NULL
NULL	NULL	14	7	NULL
NULL	NULL	158	10	10
-10	NULL	0	-100	NULL
0	NULL	0	-1	NULL
0	NULL	0	0	NULL
SELECT col_bigint , col_char_12_key FROM table0_bigint WHERE col_char_12_key IN ( CAST(3 AS CHAR(100)) , CAST(-100 AS CHAR(100)) , CAST(5 AS CHAR(100)) ) ORDER BY col_char_12_key ASC , pk DESC LIMIT 5 , 1 /* RESULTSET_HAS_ZERO_OR_ONE_ROWS */;
col_bigint	col_char_12_key
SELECT 1 FROM table0_bigint WHERE col_bigint_key NOT IN ( 9 , -9 , -100 , -10 , 99 ) FOR UPDATE;
1
1
1
1
1
1
1
1
1
1
1
1
1
1
1
1
1
1
1
1
1
1
1
SELECT col_bigint,col_bigint_key,col_char_12,col_char_12_key,pk FROM table0_bigint WHERE col_bigint_key = ( SUBSTR( CAST( ( ROUND( LENGTH('JRRJF') - 0 ) ) AS CHAR(100) ) , 1 , 12 ) ) GROUP BY col_bigint,col_bigint_key,col_char_12,col_char_12_key,pk ORDER BY col_bigint,col_bigint_key,col_char_12,col_char_12_key,pk LIMIT 135 , 2;
col_bigint	col_bigint_key	col_char_12	col_char_12_key	pk
SELECT COUNT( col_bigint_key ) FROM table0_bigint WHERE NOT ( col_bigint_key != SUBSTR( CAST( ( FLOOR ( CEIL ( 1 ) ) ) AS CHAR(100) ) , 1 , 12 ) ) OR NOT ( pk <= SUBSTR( CAST( ( ROUND( 185 * LENGTH('MWPKC') ) ) AS CHAR(100) ) , 1 , 12 ) ) ORDER BY col_bigint_key  , col_char_12 ASC , pk DESC LIMIT 7 /* RESULTSET_HAS_ZERO_OR_ONE_ROWS */;
COUNT( col_bigint_key )
0
SELECT 1 FROM table0_bigint WHERE 1 = CEIL ( LENGTH('LEYSN') ) FOR UPDATE;
1
SELECT 1 FROM table0_bigint WHERE col_bigint_key NOT IN ( SUBSTR( CAST( ( LENGTH( SUBSTR( CAST( ( ROUND( -1 - 92 ) ) AS CHAR(100) ) , 1 , 12 ) ) ) AS CHAR(100) ) , 1 , 12 ) , SUBSTR( CAST( ( SIGN ( 5 ) ) AS CHAR(100) ) , 1 , 12 ) , SUBSTR( CAST( ( -10 ) AS CHAR(100) ) , 1 , 12 ) , SUBSTR( CAST( ( LENGTH('YWAZC') ) AS CHAR(100) ) , 1 , 12 ) , SUBSTR( CAST( ( FLOOR ( ROUND( LENGTH( SUBSTR( CAST( ( LENGTH('RCIEE') ) AS CHAR(100) ) , 1 , 12 ) ) + 99 ) ) ) AS CHAR(100) ) , 1 , 12 ) ) FOR UPDATE;
1
1
1
1
1
1
1
1
1
1
1
1
1
1
1
1
1
1
1
1
SELECT col_char_12 FROM table0_bigint WHERE ( 176029696 , 1690238976 , 1002504192 , -37093376 , -911540224 ) IN ( ( SUBSTR( CAST( ( CEIL ( 0 ) ) AS CHAR(100) ) , 1 , 12 ) , SUBSTR( CAST( ( LENGTH('DAVNB') ) AS CHAR(100) ) , 1 , 12 ) , SUBSTR( CAST( ( 1 ) AS CHAR(100) ) , 1 , 12 ) , SUBSTR( CAST( ( -100 ) AS CHAR(100) ) , 1 , 12 ) , SUBSTR( CAST( ( ABS ( -100 ) ) AS CHAR(100) ) , 1 , 12 ) ) ) ORDER BY col_bigint_key , pk DESC LIMIT 1 /* RESULTSET_HAS_ZERO_OR_ONE_ROWS */;
col_char_12
UPDATE table0_bigint SET pk = SUBSTR( CAST( ( LENGTH( SUBSTR( CAST( ( ROUND ( -1 ) ) AS CHAR(100) ) , 1 , 12 ) ) ) AS CHAR(100) ) , 1 , 12 ) , col_char_12_key = SUBSTR(concat( CAST(col_bigint_key AS CHAR(100)) , SUBSTR( CAST( ( SIGN ( 11 ) ) AS CHAR(100) ) , 1 , 12 ) ) , 1 , 12 ) WHERE col_bigint_key > ROUND ( ABS ( CEIL ( 250 ) ) ) ORDER BY pk , col_bigint_key,pk DESC , pk DESC LIMIT 1 ;
SELECT * FROM table0_bigint ORDER BY pk;
col_char_12_key	col_char_12	col_bigint_key	pk	col_bigint
8-9	8-9	2	-1018	8
-10	NULL	0	-100	NULL
99	99	NULL	-10	NULL
139	NULL	NULL	-9	NULL
0	NULL	0	-1	NULL
0	NULL	0	0	NULL
2	NULL	NULL	1	NULL
NULL	NULL	5	4	NULL
NULL	NULL	14	5	NULL
NULL	NULL	14	6	NULL
NULL	NULL	14	7	NULL
5	NULL	-9	8	NULL
NULL	5	9	9	9
NULL	NULL	158	10	10
NULL	NULL	5	13	NULL
NULL	NULL	5	32	NULL
NULL	NULL	NULL	43	NULL
8	NULL	NULL	60	NULL
NULL	1	14	67	-10
NULL	10	5	83	83
NULL	NULL	5	86	86
-300	NULL	0	91	1
NULL	9	158	99	99
NULL	NULL	14	111	NULL
NULL	NULL	123	123	123
5	0	NULL	144	1
-10	NULL	0	154	NULL
9	NULL	NULL	159	NULL
NULL	NULL	14	216	NULL
NULL	NULL	227	227	227
-90	NULL	0	232	4
SELECT col_bigint,col_bigint_key,col_char_12,col_char_12_key,pk FROM table0_bigint WHERE col_bigint BETWEEN SUBSTR( CAST( ( SIGN ( -9 ) ) AS CHAR(100) ) , 1 , 12 ) AND SUBSTR( CAST( ( ROUND( 1 + LENGTH('TFZBE') ) ) AS CHAR(100) ) , 1 , 12 ) GROUP BY col_bigint,col_bigint_key,col_char_12,col_char_12_key,pk ORDER BY col_bigint,col_bigint_key,col_char_12,col_char_12_key,pk LIMIT 8;
col_bigint	col_bigint_key	col_char_12	col_char_12_key	pk
1	NULL	0	5	144
1	0	NULL	-300	91
4	0	NULL	-90	232
INSERT INTO table0_bigint (pk) VALUES ( -9 ) ;
ERROR 23000: Duplicate entry '-9' for key 'PRIMARY'
SELECT * FROM table0_bigint ORDER BY pk;
col_char_12_key	col_char_12	col_bigint_key	pk	col_bigint
8-9	8-9	2	-1018	8
-10	NULL	0	-100	NULL
99	99	NULL	-10	NULL
139	NULL	NULL	-9	NULL
0	NULL	0	-1	NULL
0	NULL	0	0	NULL
2	NULL	NULL	1	NULL
NULL	NULL	5	4	NULL
NULL	NULL	14	5	NULL
NULL	NULL	14	6	NULL
NULL	NULL	14	7	NULL
5	NULL	-9	8	NULL
NULL	5	9	9	9
NULL	NULL	158	10	10
NULL	NULL	5	13	NULL
NULL	NULL	5	32	NULL
NULL	NULL	NULL	43	NULL
8	NULL	NULL	60	NULL
NULL	1	14	67	-10
NULL	10	5	83	83
NULL	NULL	5	86	86
-300	NULL	0	91	1
NULL	9	158	99	99
NULL	NULL	14	111	NULL
NULL	NULL	123	123	123
5	0	NULL	144	1
-10	NULL	0	154	NULL
9	NULL	NULL	159	NULL
NULL	NULL	14	216	NULL
NULL	NULL	227	227	227
-90	NULL	0	232	4
SELECT UPPER( col_char_12_key ) FROM table0_bigint WHERE col_char_12_key BETWEEN CAST( 1 AS CHAR(100) ) AND CAST( 6 AS CHAR(100) ) GROUP BY col_char_12_key ORDER BY col_char_12_key LIMIT 5 , 1 /* RESULTSET_HAS_ZERO_OR_ONE_ROWS */;
UPPER( col_char_12_key )
UPDATE table0_bigint SET col_bigint_key = col_bigint_key WHERE LENGTH('CKLDQ') <> CEIL ( CEIL ( 10 ) ) ORDER BY col_bigint ASC , col_char_12 DESC , pk  LIMIT 4 ;
SELECT * FROM table0_bigint ORDER BY pk;
col_char_12_key	col_char_12	col_bigint_key	pk	col_bigint
8-9	8-9	2	-1018	8
-10	NULL	0	-100	NULL
99	99	NULL	-10	NULL
139	NULL	NULL	-9	NULL
0	NULL	0	-1	NULL
0	NULL	0	0	NULL
2	NULL	NULL	1	NULL
NULL	NULL	5	4	NULL
NULL	NULL	14	5	NULL
NULL	NULL	14	6	NULL
NULL	NULL	14	7	NULL
5	NULL	-9	8	NULL
NULL	5	9	9	9
NULL	NULL	158	10	10
NULL	NULL	5	13	NULL
NULL	NULL	5	32	NULL
NULL	NULL	NULL	43	NULL
8	NULL	NULL	60	NULL
NULL	1	14	67	-10
NULL	10	5	83	83
NULL	NULL	5	86	86
-300	NULL	0	91	1
NULL	9	158	99	99
NULL	NULL	14	111	NULL
NULL	NULL	123	123	123
5	0	NULL	144	1
-10	NULL	0	154	NULL
9	NULL	NULL	159	NULL
NULL	NULL	14	216	NULL
NULL	NULL	227	227	227
-90	NULL	0	232	4
UPDATE table0_bigint SET col_bigint_key = col_bigint_key WHERE ( -1873674240 , -2059075584 , -112459776 , 467795968 ) NOT IN ( ( SUBSTR( CAST( ( 10 ) AS CHAR(100) ) , 1 , 12 ) , SUBSTR( CAST( ( FLOOR ( -10 ) ) AS CHAR(100) ) , 1 , 12 ) , SUBSTR( CAST( ( 99 ) AS CHAR(100) ) , 1 , 12 ) , SUBSTR( CAST( ( LENGTH( SUBSTR( CAST( ( LENGTH( SUBSTR( CAST( ( ROUND( 99 + LENGTH( SUBSTR( CAST( ( ROUND( ROUND( SIGN ( ROUND ( ROUND( -100 + -9 ) ) ) * 2 ) * 99 ) ) AS CHAR(100) ) , 1 , 12 ) ) ) ) AS CHAR(100) ) , 1 , 12 ) ) ) AS CHAR(100) ) , 1 , 12 ) ) ) AS CHAR(100) ) , 1 , 12 ) ) ) ORDER BY pk DESC , pk DESC LIMIT 1 ;
SELECT * FROM table0_bigint ORDER BY pk;
col_char_12_key	col_char_12	col_bigint_key	pk	col_bigint
8-9	8-9	2	-1018	8
-10	NULL	0	-100	NULL
99	99	NULL	-10	NULL
139	NULL	NULL	-9	NULL
0	NULL	0	-1	NULL
0	NULL	0	0	NULL
2	NULL	NULL	1	NULL
NULL	NULL	5	4	NULL
NULL	NULL	14	5	NULL
NULL	NULL	14	6	NULL
NULL	NULL	14	7	NULL
5	NULL	-9	8	NULL
NULL	5	9	9	9
NULL	NULL	158	10	10
NULL	NULL	5	13	NULL
NULL	NULL	5	32	NULL
NULL	NULL	NULL	43	NULL
8	NULL	NULL	60	NULL
NULL	1	14	67	-10
NULL	10	5	83	83
NULL	NULL	5	86	86
-300	NULL	0	91	1
NULL	9	158	99	99
NULL	NULL	14	111	NULL
NULL	NULL	123	123	123
5	0	NULL	144	1
-10	NULL	0	154	NULL
9	NULL	NULL	159	NULL
NULL	NULL	14	216	NULL
NULL	NULL	227	227	227
-90	NULL	0	232	4
SELECT pk , col_bigint_key , col_char_12 FROM table0_bigint WHERE SIGN ( 1 ) <> LENGTH( SUBSTR( CAST( ( ROUND( 0 * 0 ) ) AS CHAR(100) ) , 1 , 12 ) ) ORDER BY col_bigint  , col_char_12_key  , pk ASC LIMIT 7;
pk	col_bigint_key	col_char_12
SELECT COUNT( col_char_12 ) FROM table0_bigint WHERE col_bigint IN ( 1 , 99 , 1 , 1 , -1 ) ORDER BY col_bigint_key , col_char_12_key , pk ASC LIMIT 3 , 2 /* RESULTSET_HAS_ZERO_OR_ONE_ROWS */;
COUNT( col_char_12 )
SELECT 1 FROM table0_bigint WHERE -9 = CEIL ( 0 ) FOR UPDATE;
1
SELECT col_bigint_key FROM table0_bigint WHERE pk <= ( SUBSTR( CAST( ( FLOOR ( LENGTH('QMDPO') ) ) AS CHAR(100) ) , 1 , 12 ) ) AND col_char_12 <> ( SUBSTR( CAST( ( FLOOR ( LENGTH('SBABT') ) ) AS CHAR(100) ) , 1 , 12 ) ) ORDER BY col_bigint_key , col_char_12_key , col_char_12_key , pk ASC LIMIT 4 , 4;
col_bigint_key
UPDATE table0_bigint SET pk = LENGTH( SUBSTR( CAST( ( LENGTH( SUBSTR( CAST( ( LENGTH('WELJN') ) AS CHAR(100) ) , 1 , 12 ) ) ) AS CHAR(100) ) , 1 , 12 ) ) , col_char_12_key = SUBSTR(concat( CAST(col_bigint_key AS CHAR(100)) , SUBSTR( CAST( ( ROUND( 99 * FLOOR ( LENGTH('VFOCC') ) ) ) AS CHAR(100) ) , 1 , 12 )) , 1 , 12 ) WHERE pk BETWEEN SUBSTR( CAST( ( ROUND ( LENGTH( SUBSTR( CAST( ( LENGTH('MLVRZ') ) AS CHAR(100) ) , 1 , 12 ) ) ) ) AS CHAR(100) ) , 1 , 12 ) AND SUBSTR( CAST( ( ROUND( -10 - 174 ) ) AS CHAR(100) ) , 1 , 12 ) ORDER BY col_bigint_key , pk ASC LIMIT 8 ;
SELECT * FROM table0_bigint ORDER BY pk;
col_char_12_key	col_char_12	col_bigint_key	pk	col_bigint
8-9	8-9	2	-1018	8
-10	NULL	0	-100	NULL
99	99	NULL	-10	NULL
139	NULL	NULL	-9	NULL
0	NULL	0	-1	NULL
0	NULL	0	0	NULL
2	NULL	NULL	1	NULL
NULL	NULL	5	4	NULL
NULL	NULL	14	5	NULL
NULL	NULL	14	6	NULL
NULL	NULL	14	7	NULL
5	NULL	-9	8	NULL
NULL	5	9	9	9
NULL	NULL	158	10	10
NULL	NULL	5	13	NULL
NULL	NULL	5	32	NULL
NULL	NULL	NULL	43	NULL
8	NULL	NULL	60	NULL
NULL	1	14	67	-10
NULL	10	5	83	83
NULL	NULL	5	86	86
-300	NULL	0	91	1
NULL	9	158	99	99
NULL	NULL	14	111	NULL
NULL	NULL	123	123	123
5	0	NULL	144	1
-10	NULL	0	154	NULL
9	NULL	NULL	159	NULL
NULL	NULL	14	216	NULL
NULL	NULL	227	227	227
-90	NULL	0	232	4
UPDATE table0_bigint SET pk = SUBSTR( CAST( ( ROUND( LENGTH( SUBSTR( CAST( ( 123 ) AS CHAR(100) ) , 1 , 12 ) ) * 10 ) ) AS CHAR(100) ) , 1 , 12 ) , col_bigint_key = -9 , col_char_12 = 'KYSWG' WHERE col_char_12 <= ( SUBSTR( CAST( ( ROUND( -1 + ROUND( LENGTH( SUBSTR( CAST( ( CEIL ( ROUND( 99 - 5 ) ) ) AS CHAR(100) ) , 1 , 12 ) ) - -9 ) ) ) AS CHAR(100) ) , 1 , 12 ) ) AND col_bigint <= ( SUBSTR( CAST( ( ABS ( 52 ) ) AS CHAR(100) ) , 1 , 12 ) ) ORDER BY col_bigint_key , col_bigint_key , pk  LIMIT 135 ;
ERROR 23000: Duplicate entry '30' for key 'PRIMARY'
SELECT * FROM table0_bigint ORDER BY pk;
col_char_12_key	col_char_12	col_bigint_key	pk	col_bigint
8-9	8-9	2	-1018	8
-10	NULL	0	-100	NULL
99	99	NULL	-10	NULL
139	NULL	NULL	-9	NULL
0	NULL	0	-1	NULL
0	NULL	0	0	NULL
2	NULL	NULL	1	NULL
NULL	NULL	5	4	NULL
NULL	NULL	14	5	NULL
NULL	NULL	14	6	NULL
NULL	NULL	14	7	NULL
5	NULL	-9	8	NULL
NULL	5	9	9	9
NULL	NULL	158	10	10
NULL	NULL	5	13	NULL
NULL	NULL	5	32	NULL
NULL	NULL	NULL	43	NULL
8	NULL	NULL	60	NULL
NULL	1	14	67	-10
NULL	10	5	83	83
NULL	NULL	5	86	86
-300	NULL	0	91	1
NULL	9	158	99	99
NULL	NULL	14	111	NULL
NULL	NULL	123	123	123
5	0	NULL	144	1
-10	NULL	0	154	NULL
9	NULL	NULL	159	NULL
NULL	NULL	14	216	NULL
NULL	NULL	227	227	227
-90	NULL	0	232	4
SELECT * FROM table0_bigint WHERE pk IN ( 0 , -100 , 0 , -10 , -10 ) ORDER BY col_bigint_key , col_char_12_key , pk DESC LIMIT 2;
col_char_12_key	col_char_12	col_bigint_key	pk	col_bigint
99	99	NULL	-10	NULL
-10	NULL	0	-100	NULL
INSERT INTO table0_bigint ( pk , col_char_12_key ) VALUES ( -100, CAST( 9 AS CHAR(100)) ) , ( 1, CAST( 171 AS CHAR(100)) ) ;
ERROR 23000: Duplicate entry '-100' for key 'PRIMARY'
SELECT * FROM table0_bigint ORDER BY pk;
col_char_12_key	col_char_12	col_bigint_key	pk	col_bigint
8-9	8-9	2	-1018	8
-10	NULL	0	-100	NULL
99	99	NULL	-10	NULL
139	NULL	NULL	-9	NULL
0	NULL	0	-1	NULL
0	NULL	0	0	NULL
2	NULL	NULL	1	NULL
NULL	NULL	5	4	NULL
NULL	NULL	14	5	NULL
NULL	NULL	14	6	NULL
NULL	NULL	14	7	NULL
5	NULL	-9	8	NULL
NULL	5	9	9	9
NULL	NULL	158	10	10
NULL	NULL	5	13	NULL
NULL	NULL	5	32	NULL
NULL	NULL	NULL	43	NULL
8	NULL	NULL	60	NULL
NULL	1	14	67	-10
NULL	10	5	83	83
NULL	NULL	5	86	86
-300	NULL	0	91	1
NULL	9	158	99	99
NULL	NULL	14	111	NULL
NULL	NULL	123	123	123
5	0	NULL	144	1
-10	NULL	0	154	NULL
9	NULL	NULL	159	NULL
NULL	NULL	14	216	NULL
NULL	NULL	227	227	227
-90	NULL	0	232	4
SELECT col_bigint_key,pk FROM table0_bigint WHERE col_bigint_key NOT IN ( CAST(3 AS CHAR(100)) , CAST(7 AS CHAR(100)) , CAST(10 AS CHAR(100)) ) GROUP BY col_bigint_key,pk ORDER BY col_bigint_key,pk LIMIT 4 , 3;
col_bigint_key	pk
0	91
0	154
0	232
SELECT UPPER( col_bigint_key ),pk FROM table0_bigint WHERE 1 != LENGTH('GXJFT') GROUP BY col_bigint_key,pk ORDER BY col_bigint_key,pk LIMIT 65 , 2;
UPPER( col_bigint_key )	pk
INSERT INTO table0_bigint ( pk , col_bigint_key, col_char_12 ) VALUES ( 1 , SUBSTR( CAST( ( ROUND( 6 - -9 ) ) AS CHAR(100) ) , 1 , 12 ) , SUBSTR( CAST( ( ROUND( -9 - ROUND( 3 * -100 ) ) ) AS CHAR(100) ) , 1 , 12 ) ) ;
ERROR 23000: Duplicate entry '1' for key 'PRIMARY'
SELECT * FROM table0_bigint ORDER BY pk;
col_char_12_key	col_char_12	col_bigint_key	pk	col_bigint
8-9	8-9	2	-1018	8
-10	NULL	0	-100	NULL
99	99	NULL	-10	NULL
139	NULL	NULL	-9	NULL
0	NULL	0	-1	NULL
0	NULL	0	0	NULL
2	NULL	NULL	1	NULL
NULL	NULL	5	4	NULL
NULL	NULL	14	5	NULL
NULL	NULL	14	6	NULL
NULL	NULL	14	7	NULL
5	NULL	-9	8	NULL
NULL	5	9	9	9
NULL	NULL	158	10	10
NULL	NULL	5	13	NULL
NULL	NULL	5	32	NULL
NULL	NULL	NULL	43	NULL
8	NULL	NULL	60	NULL
NULL	1	14	67	-10
NULL	10	5	83	83
NULL	NULL	5	86	86
-300	NULL	0	91	1
NULL	9	158	99	99
NULL	NULL	14	111	NULL
NULL	NULL	123	123	123
5	0	NULL	144	1
-10	NULL	0	154	NULL
9	NULL	NULL	159	NULL
NULL	NULL	14	216	NULL
NULL	NULL	227	227	227
-90	NULL	0	232	4
SELECT * FROM table0_bigint WHERE ( -1263468544 , 1640366080 , -2099773440 , -156893184 ) NOT IN ( ( SUBSTR( CAST( ( ROUND( 99 - ROUND( ROUND ( 9 ) - 99 ) ) ) AS CHAR(100) ) , 1 , 12 ) , SUBSTR( CAST( ( LENGTH( SUBSTR( CAST( ( FLOOR ( 199 ) ) AS CHAR(100) ) , 1 , 12 ) ) ) AS CHAR(100) ) , 1 , 12 ) , SUBSTR( CAST( ( LENGTH('AVDWA') ) AS CHAR(100) ) , 1 , 12 ) , SUBSTR( CAST( ( LENGTH( SUBSTR( CAST( ( -1 ) AS CHAR(100) ) , 1 , 12 ) ) ) AS CHAR(100) ) , 1 , 12 ) ) ) ORDER BY pk LIMIT 1 , 3;
col_char_12_key	col_char_12	col_bigint_key	pk	col_bigint
-10	NULL	0	-100	NULL
99	99	NULL	-10	NULL
139	NULL	NULL	-9	NULL
SELECT col_bigint,col_bigint_key,col_char_12,col_char_12_key,pk FROM table0_bigint WHERE ( -2147352576 , -929562624 , -1315962880 , -1535377408 ) NOT IN ( ( SUBSTR( CAST( ( LENGTH( SUBSTR( CAST( ( ROUND( -1 + FLOOR ( 1 ) ) ) AS CHAR(100) ) , 1 , 12 ) ) ) AS CHAR(100) ) , 1 , 12 ) , SUBSTR( CAST( ( ABS ( LENGTH( SUBSTR( CAST( ( ROUND ( SIGN ( ROUND( -10 - CEIL ( 1 ) ) ) ) ) AS CHAR(100) ) , 1 , 12 ) ) ) ) AS CHAR(100) ) , 1 , 12 ) , SUBSTR( CAST( ( CEIL ( -9 ) ) AS CHAR(100) ) , 1 , 12 ) , SUBSTR( CAST( ( ROUND ( ROUND( 8 - 235 ) ) ) AS CHAR(100) ) , 1 , 12 ) ) ) GROUP BY col_bigint,col_bigint_key,col_char_12,col_char_12_key,pk ORDER BY col_bigint,col_bigint_key,col_char_12,col_char_12_key,pk LIMIT 2;
col_bigint	col_bigint_key	col_char_12	col_char_12_key	pk
NULL	NULL	NULL	NULL	43
NULL	NULL	NULL	139	-9
SELECT col_bigint,col_bigint_key,col_char_12,col_char_12_key,pk FROM table0_bigint WHERE ( 1348599808 , 1411383296 ) NOT IN ( ( SUBSTR( CAST( ( 0 ) AS CHAR(100) ) , 1 , 12 ) , SUBSTR( CAST( ( ROUND( ROUND ( -10 ) * 9 ) ) AS CHAR(100) ) , 1 , 12 ) ) , ( SUBSTR( CAST( ( ROUND( 6 - LENGTH('QBVML') ) ) AS CHAR(100) ) , 1 , 12 ) , SUBSTR( CAST( ( ROUND ( FLOOR ( ROUND( ROUND( LENGTH( SUBSTR( CAST( ( 1 ) AS CHAR(100) ) , 1 , 12 ) ) - -1 ) - -100 ) ) ) ) AS CHAR(100) ) , 1 , 12 ) ) ) GROUP BY col_bigint,col_bigint_key,col_char_12,col_char_12_key,pk ORDER BY col_bigint,col_bigint_key,col_char_12,col_char_12_key,pk LIMIT 176 , 3;
col_bigint	col_bigint_key	col_char_12	col_char_12_key	pk
UPDATE table0_bigint SET col_char_12_key = SUBSTR( CAST( ( LENGTH( SUBSTR( CAST( ( FLOOR ( ROUND( -10 * LENGTH('FNGKI') ) ) ) AS CHAR(100) ) , 1 , 12 ) ) ) AS CHAR(100) ) , 1 , 12 ) WHERE ( -132644864 ) IN ( SUBSTR( CAST( ( ROUND ( ABS ( LENGTH( SUBSTR( CAST( ( ROUND( 116 * 0 ) ) AS CHAR(100) ) , 1 , 12 ) ) ) ) ) AS CHAR(100) ) , 1 , 12 ) , SUBSTR( CAST( ( ROUND( LENGTH('EMIHV') * -100 ) ) AS CHAR(100) ) , 1 , 12 ) , SUBSTR( CAST( ( ROUND( SIGN ( ROUND( ROUND( ROUND( 1 - 3 ) + 9 ) * 9 ) ) + 49 ) ) AS CHAR(100) ) , 1 , 12 ) , SUBSTR( CAST( ( -10 ) AS CHAR(100) ) , 1 , 12 ) , SUBSTR( CAST( ( LENGTH( SUBSTR( CAST( ( ABS ( 99 ) ) AS CHAR(100) ) , 1 , 12 ) ) ) AS CHAR(100) ) , 1 , 12 ) ) ORDER BY pk LIMIT 8 ;
SELECT * FROM table0_bigint ORDER BY pk;
col_char_12_key	col_char_12	col_bigint_key	pk	col_bigint
8-9	8-9	2	-1018	8
-10	NULL	0	-100	NULL
99	99	NULL	-10	NULL
139	NULL	NULL	-9	NULL
0	NULL	0	-1	NULL
0	NULL	0	0	NULL
2	NULL	NULL	1	NULL
NULL	NULL	5	4	NULL
NULL	NULL	14	5	NULL
NULL	NULL	14	6	NULL
NULL	NULL	14	7	NULL
5	NULL	-9	8	NULL
NULL	5	9	9	9
NULL	NULL	158	10	10
NULL	NULL	5	13	NULL
NULL	NULL	5	32	NULL
NULL	NULL	NULL	43	NULL
8	NULL	NULL	60	NULL
NULL	1	14	67	-10
NULL	10	5	83	83
NULL	NULL	5	86	86
-300	NULL	0	91	1
NULL	9	158	99	99
NULL	NULL	14	111	NULL
NULL	NULL	123	123	123
5	0	NULL	144	1
-10	NULL	0	154	NULL
9	NULL	NULL	159	NULL
NULL	NULL	14	216	NULL
NULL	NULL	227	227	227
-90	NULL	0	232	4
SELECT 1 FROM table0_bigint WHERE col_bigint IN ( SUBSTR( CAST( ( LENGTH( SUBSTR( CAST( ( ROUND( -9 * 4 ) ) AS CHAR(100) ) , 1 , 12 ) ) ) AS CHAR(100) ) , 1 , 12 ) , SUBSTR( CAST( ( LENGTH( SUBSTR( CAST( ( LENGTH( SUBSTR( CAST( ( LENGTH('EQIRO') ) AS CHAR(100) ) , 1 , 12 ) ) ) AS CHAR(100) ) , 1 , 12 ) ) ) AS CHAR(100) ) , 1 , 12 ) , SUBSTR( CAST( ( ROUND( 9 - -1 ) ) AS CHAR(100) ) , 1 , 12 ) , SUBSTR( CAST( ( 1 ) AS CHAR(100) ) , 1 , 12 ) , SUBSTR( CAST( ( LENGTH( SUBSTR( CAST( ( -9 ) AS CHAR(100) ) , 1 , 12 ) ) ) AS CHAR(100) ) , 1 , 12 ) ) FOR UPDATE;
1
1
1
1
INSERT INTO table0_bigint ( pk , col_bigint_key, col_char_12_key ) VALUES ( -10 , SUBSTR( CAST( ( ROUND( -1 * ROUND( ROUND( 70 + ROUND( ROUND( -100 * -100 ) * 35 ) ) + 10 ) ) ) AS CHAR(100) ) , 1 , 12 ) , SUBSTR( CAST( ( FLOOR ( 1 ) ) AS CHAR(100) ) , 1 , 12 ) ) ;
ERROR 23000: Duplicate entry '-10' for key 'PRIMARY'
SELECT * FROM table0_bigint ORDER BY pk;
col_char_12_key	col_char_12	col_bigint_key	pk	col_bigint
8-9	8-9	2	-1018	8
-10	NULL	0	-100	NULL
99	99	NULL	-10	NULL
139	NULL	NULL	-9	NULL
0	NULL	0	-1	NULL
0	NULL	0	0	NULL
2	NULL	NULL	1	NULL
NULL	NULL	5	4	NULL
NULL	NULL	14	5	NULL
NULL	NULL	14	6	NULL
NULL	NULL	14	7	NULL
5	NULL	-9	8	NULL
NULL	5	9	9	9
NULL	NULL	158	10	10
NULL	NULL	5	13	NULL
NULL	NULL	5	32	NULL
NULL	NULL	NULL	43	NULL
8	NULL	NULL	60	NULL
NULL	1	14	67	-10
NULL	10	5	83	83
NULL	NULL	5	86	86
-300	NULL	0	91	1
NULL	9	158	99	99
NULL	NULL	14	111	NULL
NULL	NULL	123	123	123
5	0	NULL	144	1
-10	NULL	0	154	NULL
9	NULL	NULL	159	NULL
NULL	NULL	14	216	NULL
NULL	NULL	227	227	227
-90	NULL	0	232	4
SELECT 1 FROM table0_bigint WHERE ( 2124873728 , -595001344 , -1521287168 , 502923264 , -759103488 ) NOT IN ( ( SUBSTR( CAST( ( ROUND( 99 + 9 ) ) AS CHAR(100) ) , 1 , 12 ) , SUBSTR( CAST( ( ROUND( ROUND( -1 + 203 ) - 8 ) ) AS CHAR(100) ) , 1 , 12 ) , SUBSTR( CAST( ( ROUND( -10 + 10 ) ) AS CHAR(100) ) , 1 , 12 ) , SUBSTR( CAST( ( 9 ) AS CHAR(100) ) , 1 , 12 ) , SUBSTR( CAST( ( LENGTH( SUBSTR( CAST( ( ROUND( 1 + ROUND( 59 - ROUND( 0 - -100 ) ) ) ) AS CHAR(100) ) , 1 , 12 ) ) ) AS CHAR(100) ) , 1 , 12 ) ) ) FOR UPDATE;
1
1
1
1
1
1
1
1
1
1
1
1
1
1
1
1
1
1
1
1
1
1
1
1
1
1
1
1
1
1
1
1
SELECT col_char_12_key,pk FROM table0_bigint WHERE pk BETWEEN SUBSTR( CAST( ( ROUND( ROUND( 10 + FLOOR ( ROUND( LENGTH('YULUB') - 5 ) ) ) + 10 ) ) AS CHAR(100) ) , 1 , 12 ) AND SUBSTR( CAST( ( LENGTH('WFJRX') ) AS CHAR(100) ) , 1 , 12 ) GROUP BY col_char_12_key,pk ORDER BY col_char_12_key,pk LIMIT 2;
col_char_12_key	pk
INSERT INTO table0_bigint ( pk , col_bigint_key ) VALUES ( -1, CAST( 1 AS CHAR(100)) ) , ( 0, CAST( 9 AS CHAR(100)) ) ;
ERROR 23000: Duplicate entry '-1' for key 'PRIMARY'
SELECT * FROM table0_bigint ORDER BY pk;
col_char_12_key	col_char_12	col_bigint_key	pk	col_bigint
8-9	8-9	2	-1018	8
-10	NULL	0	-100	NULL
99	99	NULL	-10	NULL
139	NULL	NULL	-9	NULL
0	NULL	0	-1	NULL
0	NULL	0	0	NULL
2	NULL	NULL	1	NULL
NULL	NULL	5	4	NULL
NULL	NULL	14	5	NULL
NULL	NULL	14	6	NULL
NULL	NULL	14	7	NULL
5	NULL	-9	8	NULL
NULL	5	9	9	9
NULL	NULL	158	10	10
NULL	NULL	5	13	NULL
NULL	NULL	5	32	NULL
NULL	NULL	NULL	43	NULL
8	NULL	NULL	60	NULL
NULL	1	14	67	-10
NULL	10	5	83	83
NULL	NULL	5	86	86
-300	NULL	0	91	1
NULL	9	158	99	99
NULL	NULL	14	111	NULL
NULL	NULL	123	123	123
5	0	NULL	144	1
-10	NULL	0	154	NULL
9	NULL	NULL	159	NULL
NULL	NULL	14	216	NULL
NULL	NULL	227	227	227
-90	NULL	0	232	4
SELECT pk , col_char_12_key FROM table0_bigint WHERE pk = -10 ORDER BY col_char_12_key , col_bigint_key , pk DESC LIMIT 0 , 1 /* RESULTSET_HAS_ZERO_OR_ONE_ROWS */;
pk	col_char_12_key
-10	99
SELECT col_bigint,col_bigint_key,col_char_12,col_char_12_key,pk FROM table0_bigint WHERE LENGTH('UUYTC') = SUBSTR( CAST( ( LENGTH( SUBSTR( CAST( ( FLOOR ( 156 ) ) AS CHAR(100) ) , 1 , 12 ) ) ) AS CHAR(100) ) , 1 , 12 ) ORDER BY col_bigint_key ASC , col_char_12 ASC , pk DESC LIMIT 8 , 1 /* RESULTSET_HAS_ZERO_OR_ONE_ROWS */;
col_bigint	col_bigint_key	col_char_12	col_char_12_key	pk
INSERT INTO table0_bigint ( pk , col_bigint_key, col_char_12 ) VALUES ( 7 , SUBSTR( CAST( ( ABS ( ROUND( ABS ( LENGTH('KYSBD') ) * -9 ) ) ) AS CHAR(100) ) , 1 , 12 ) , SUBSTR( CAST( ( LENGTH( SUBSTR( CAST( ( CEIL ( LENGTH( SUBSTR( CAST( ( ROUND( 44 - -100 ) ) AS CHAR(100) ) , 1 , 12 ) ) ) ) AS CHAR(100) ) , 1 , 12 ) ) ) AS CHAR(100) ) , 1 , 12 ) ) ;
ERROR 23000: Duplicate entry '7' for key 'PRIMARY'
SELECT * FROM table0_bigint ORDER BY pk;
col_char_12_key	col_char_12	col_bigint_key	pk	col_bigint
8-9	8-9	2	-1018	8
-10	NULL	0	-100	NULL
99	99	NULL	-10	NULL
139	NULL	NULL	-9	NULL
0	NULL	0	-1	NULL
0	NULL	0	0	NULL
2	NULL	NULL	1	NULL
NULL	NULL	5	4	NULL
NULL	NULL	14	5	NULL
NULL	NULL	14	6	NULL
NULL	NULL	14	7	NULL
5	NULL	-9	8	NULL
NULL	5	9	9	9
NULL	NULL	158	10	10
NULL	NULL	5	13	NULL
NULL	NULL	5	32	NULL
NULL	NULL	NULL	43	NULL
8	NULL	NULL	60	NULL
NULL	1	14	67	-10
NULL	10	5	83	83
NULL	NULL	5	86	86
-300	NULL	0	91	1
NULL	9	158	99	99
NULL	NULL	14	111	NULL
NULL	NULL	123	123	123
5	0	NULL	144	1
-10	NULL	0	154	NULL
9	NULL	NULL	159	NULL
NULL	NULL	14	216	NULL
NULL	NULL	227	227	227
-90	NULL	0	232	4
INSERT INTO table0_bigint ( pk , col_char_12_key ) VALUES ( 0, CAST( -9 AS CHAR(100)) ) , ( -100, CAST( -1 AS CHAR(100)) ) ;
ERROR 23000: Duplicate entry '0' for key 'PRIMARY'
SELECT * FROM table0_bigint ORDER BY pk;
col_char_12_key	col_char_12	col_bigint_key	pk	col_bigint
8-9	8-9	2	-1018	8
-10	NULL	0	-100	NULL
99	99	NULL	-10	NULL
139	NULL	NULL	-9	NULL
0	NULL	0	-1	NULL
0	NULL	0	0	NULL
2	NULL	NULL	1	NULL
NULL	NULL	5	4	NULL
NULL	NULL	14	5	NULL
NULL	NULL	14	6	NULL
NULL	NULL	14	7	NULL
5	NULL	-9	8	NULL
NULL	5	9	9	9
NULL	NULL	158	10	10
NULL	NULL	5	13	NULL
NULL	NULL	5	32	NULL
NULL	NULL	NULL	43	NULL
8	NULL	NULL	60	NULL
NULL	1	14	67	-10
NULL	10	5	83	83
NULL	NULL	5	86	86
-300	NULL	0	91	1
NULL	9	158	99	99
NULL	NULL	14	111	NULL
NULL	NULL	123	123	123
5	0	NULL	144	1
-10	NULL	0	154	NULL
9	NULL	NULL	159	NULL
NULL	NULL	14	216	NULL
NULL	NULL	227	227	227
-90	NULL	0	232	4
SELECT col_bigint,col_bigint_key,col_char_12,col_char_12_key,pk FROM table0_bigint WHERE ( -344784896 , -770048000 , 2044198912 ) IN ( ( SUBSTR( CAST( ( CEIL ( ROUND ( ROUND( -9 * FLOOR ( ROUND( LENGTH( SUBSTR( CAST( ( ABS ( LENGTH( SUBSTR( CAST( ( CEIL ( ROUND( -9 - -1 ) ) ) AS CHAR(100) ) , 1 , 12 ) ) ) ) AS CHAR(100) ) , 1 , 12 ) ) - -9 ) ) ) ) ) ) AS CHAR(100) ) , 1 , 12 ) , SUBSTR( CAST( ( ROUND( 99 * LENGTH('MVXAB') ) ) AS CHAR(100) ) , 1 , 12 ) , SUBSTR( CAST( ( ROUND ( 99 ) ) AS CHAR(100) ) , 1 , 12 ) ) , ( SUBSTR( CAST( ( 169 ) AS CHAR(100) ) , 1 , 12 ) , SUBSTR( CAST( ( ROUND( ABS ( 5 ) + 1 ) ) AS CHAR(100) ) , 1 , 12 ) , SUBSTR( CAST( ( CEIL ( 1 ) ) AS CHAR(100) ) , 1 , 12 ) ) ) GROUP BY col_bigint,col_bigint_key,col_char_12,col_char_12_key,pk ORDER BY col_bigint,col_bigint_key,col_char_12,col_char_12_key,pk LIMIT 3;
col_bigint	col_bigint_key	col_char_12	col_char_12_key	pk
SELECT ALL 1 , NULL , TRUE , FALSE , UPPER( pk ) FROM table0_bigint ORDER BY col_bigint DESC , col_char_12 ASC , pk ASC;
1	NULL	TRUE	FALSE	UPPER( pk )
1	NULL	1	0	227
1	NULL	1	0	123
1	NULL	1	0	99
1	NULL	1	0	86
1	NULL	1	0	83
1	NULL	1	0	10
1	NULL	1	0	9
1	NULL	1	0	-1018
1	NULL	1	0	232
1	NULL	1	0	91
1	NULL	1	0	144
1	NULL	1	0	67
1	NULL	1	0	-100
1	NULL	1	0	-9
1	NULL	1	0	-1
1	NULL	1	0	0
1	NULL	1	0	1
1	NULL	1	0	4
1	NULL	1	0	5
1	NULL	1	0	6
1	NULL	1	0	7
1	NULL	1	0	8
1	NULL	1	0	13
1	NULL	1	0	32
1	NULL	1	0	43
1	NULL	1	0	60
1	NULL	1	0	111
1	NULL	1	0	154
1	NULL	1	0	159
1	NULL	1	0	216
1	NULL	1	0	-10
INSERT INTO table0_bigint ( pk , col_char_12_key ) VALUES ( 10 , SUBSTR( CAST( ( LENGTH( SUBSTR( CAST( ( ROUND( CEIL ( LENGTH('ICWSE') ) * 246 ) ) AS CHAR(100) ) , 1 , 12 ) ) ) AS CHAR(100) ) , 1 , 12 ) ) ;
ERROR 23000: Duplicate entry '10' for key 'PRIMARY'
SELECT * FROM table0_bigint ORDER BY pk;
col_char_12_key	col_char_12	col_bigint_key	pk	col_bigint
8-9	8-9	2	-1018	8
-10	NULL	0	-100	NULL
99	99	NULL	-10	NULL
139	NULL	NULL	-9	NULL
0	NULL	0	-1	NULL
0	NULL	0	0	NULL
2	NULL	NULL	1	NULL
NULL	NULL	5	4	NULL
NULL	NULL	14	5	NULL
NULL	NULL	14	6	NULL
NULL	NULL	14	7	NULL
5	NULL	-9	8	NULL
NULL	5	9	9	9
NULL	NULL	158	10	10
NULL	NULL	5	13	NULL
NULL	NULL	5	32	NULL
NULL	NULL	NULL	43	NULL
8	NULL	NULL	60	NULL
NULL	1	14	67	-10
NULL	10	5	83	83
NULL	NULL	5	86	86
-300	NULL	0	91	1
NULL	9	158	99	99
NULL	NULL	14	111	NULL
NULL	NULL	123	123	123
5	0	NULL	144	1
-10	NULL	0	154	NULL
9	NULL	NULL	159	NULL
NULL	NULL	14	216	NULL
NULL	NULL	227	227	227
-90	NULL	0	232	4
SELECT pk , col_char_12_key FROM table0_bigint WHERE col_bigint_key BETWEEN SUBSTR( CAST( ( ROUND( 105 * -10 ) ) AS CHAR(100) ) , 1 , 12 ) AND SUBSTR( CAST( ( LENGTH('WZEUJ') ) AS CHAR(100) ) , 1 , 12 ) ORDER BY col_char_12_key , pk DESC LIMIT 1 /* RESULTSET_HAS_ZERO_OR_ONE_ROWS */;
pk	col_char_12_key
86	NULL
SELECT * FROM table0_bigint  ORDER BY pk LIMIT 4 , 4;
col_char_12_key	col_char_12	col_bigint_key	pk	col_bigint
0	NULL	0	-1	NULL
0	NULL	0	0	NULL
2	NULL	NULL	1	NULL
NULL	NULL	5	4	NULL
SELECT 1 FROM table0_bigint WHERE ( -1993277440 , 1286406144 , -1722941440 , -1085407232 ) IN ( ( SUBSTR( CAST( ( ABS ( SIGN ( 10 ) ) ) AS CHAR(100) ) , 1 , 12 ) , SUBSTR( CAST( ( -10 ) AS CHAR(100) ) , 1 , 12 ) , SUBSTR( CAST( ( LENGTH( SUBSTR( CAST( ( LENGTH( SUBSTR( CAST( ( ROUND( -10 * 133 ) ) AS CHAR(100) ) , 1 , 12 ) ) ) AS CHAR(100) ) , 1 , 12 ) ) ) AS CHAR(100) ) , 1 , 12 ) , SUBSTR( CAST( ( LENGTH( SUBSTR( CAST( ( -100 ) AS CHAR(100) ) , 1 , 12 ) ) ) AS CHAR(100) ) , 1 , 12 ) ) ) FOR UPDATE;
1
SELECT 1 FROM table0_bigint WHERE ( 996016128 , -1842937856 , -700645376 ) NOT IN ( ( SUBSTR( CAST( ( LENGTH( SUBSTR( CAST( ( SIGN ( ROUND( 99 + 10 ) ) ) AS CHAR(100) ) , 1 , 12 ) ) ) AS CHAR(100) ) , 1 , 12 ) , SUBSTR( CAST( ( ROUND( 1 - 4 ) ) AS CHAR(100) ) , 1 , 12 ) , SUBSTR( CAST( ( ABS ( LENGTH('YYGDO') ) ) AS CHAR(100) ) , 1 , 12 ) ) , ( SUBSTR( CAST( ( SIGN ( -10 ) ) AS CHAR(100) ) , 1 , 12 ) , SUBSTR( CAST( ( ROUND( LENGTH( SUBSTR( CAST( ( LENGTH('PVDCL') ) AS CHAR(100) ) , 1 , 12 ) ) + -1 ) ) AS CHAR(100) ) , 1 , 12 ) , SUBSTR( CAST( ( ROUND ( 9 ) ) AS CHAR(100) ) , 1 , 12 ) ) ) FOR UPDATE;
1
1
1
1
1
1
1
1
1
1
1
1
1
1
1
1
1
1
1
1
1
1
1
1
1
1
1
1
1
1
1
1
SELECT * FROM table0_bigint WHERE 9 >= -1 ORDER BY pk , col_bigint , col_char_12,pk ASC , pk  LIMIT 8 , 8;
col_char_12_key	col_char_12	col_bigint_key	pk	col_bigint
NULL	NULL	14	5	NULL
NULL	NULL	14	6	NULL
NULL	NULL	14	7	NULL
5	NULL	-9	8	NULL
NULL	5	9	9	9
NULL	NULL	158	10	10
NULL	NULL	5	13	NULL
NULL	NULL	5	32	NULL
SELECT DISTINCT 1 , NULL , TRUE , FALSE , UPPER( col_bigint ) FROM table0_bigint ORDER BY col_bigint_key DESC , col_char_12_key ASC , pk ASC;
1	NULL	TRUE	FALSE	UPPER( col_bigint )
1	NULL	1	0	227
1	NULL	1	0	10
1	NULL	1	0	99
1	NULL	1	0	123
1	NULL	1	0	-10
1	NULL	1	0	9
1	NULL	1	0	83
1	NULL	1	0	86
1	NULL	1	0	8
1	NULL	1	0	NULL
1	NULL	1	0	1
1	NULL	1	0	4
SELECT  NULL , UPPER( col_char_12_key ) , TRUE , FALSE , 1 FROM table0_bigint ORDER BY pk;
NULL	UPPER( col_char_12_key )	TRUE	FALSE	1
NULL	8-9	1	0	1
NULL	-10	1	0	1
NULL	99	1	0	1
NULL	139	1	0	1
NULL	0	1	0	1
NULL	0	1	0	1
NULL	2	1	0	1
NULL	NULL	1	0	1
NULL	NULL	1	0	1
NULL	NULL	1	0	1
NULL	NULL	1	0	1
NULL	5	1	0	1
NULL	NULL	1	0	1
NULL	NULL	1	0	1
NULL	NULL	1	0	1
NULL	NULL	1	0	1
NULL	NULL	1	0	1
NULL	8	1	0	1
NULL	NULL	1	0	1
NULL	NULL	1	0	1
NULL	NULL	1	0	1
NULL	-300	1	0	1
NULL	NULL	1	0	1
NULL	NULL	1	0	1
NULL	NULL	1	0	1
NULL	5	1	0	1
NULL	-10	1	0	1
NULL	9	1	0	1
NULL	NULL	1	0	1
NULL	NULL	1	0	1
NULL	-90	1	0	1
SELECT col_char_12_key FROM table0_bigint WHERE ( -693829632 , -794886144 , -1764032512 ) NOT IN ( ( SUBSTR( CAST( ( -1 ) AS CHAR(100) ) , 1 , 12 ) , SUBSTR( CAST( ( ROUND ( -10 ) ) AS CHAR(100) ) , 1 , 12 ) , SUBSTR( CAST( ( 46 ) AS CHAR(100) ) , 1 , 12 ) ) , ( SUBSTR( CAST( ( ROUND( ROUND ( -10 ) - 99 ) ) AS CHAR(100) ) , 1 , 12 ) , SUBSTR( CAST( ( ROUND( 8 * ROUND( 99 - FLOOR ( ROUND( 10 * FLOOR ( ROUND( -9 * 1 ) ) ) ) ) ) ) AS CHAR(100) ) , 1 , 12 ) , SUBSTR( CAST( ( SIGN ( -10 ) ) AS CHAR(100) ) , 1 , 12 ) ) ) ORDER BY col_char_12,pk  , pk ASC LIMIT 4 , 1 /* RESULTSET_HAS_ZERO_OR_ONE_ROWS */;
col_char_12_key
2
SELECT 1 FROM table0_bigint WHERE col_bigint_key >= FLOOR ( 61 ) FOR UPDATE;
1
1
1
1
1
SELECT col_bigint FROM table0_bigint WHERE pk BETWEEN SUBSTR( CAST( ( LENGTH('XPRSC') ) AS CHAR(100) ) , 1 , 12 ) AND SUBSTR( CAST( ( SIGN ( ROUND( -1 + LENGTH( SUBSTR( CAST( ( ROUND( 0 * LENGTH( SUBSTR( CAST( ( 99 ) AS CHAR(100) ) , 1 , 12 ) ) ) ) AS CHAR(100) ) , 1 , 12 ) ) ) ) ) AS CHAR(100) ) , 1 , 12 ) ORDER BY col_bigint_key  , col_char_12 ASC , pk DESC LIMIT 1 /* RESULTSET_HAS_ZERO_OR_ONE_ROWS */;
col_bigint
INSERT INTO table0_bigint ( pk , col_bigint_key ) VALUES ( 99, CAST( -10 AS CHAR(100)) ) , ( 0, CAST( 10 AS CHAR(100)) ) ;
ERROR 23000: Duplicate entry '99' for key 'PRIMARY'
SELECT * FROM table0_bigint ORDER BY pk;
col_char_12_key	col_char_12	col_bigint_key	pk	col_bigint
8-9	8-9	2	-1018	8
-10	NULL	0	-100	NULL
99	99	NULL	-10	NULL
139	NULL	NULL	-9	NULL
0	NULL	0	-1	NULL
0	NULL	0	0	NULL
2	NULL	NULL	1	NULL
NULL	NULL	5	4	NULL
NULL	NULL	14	5	NULL
NULL	NULL	14	6	NULL
NULL	NULL	14	7	NULL
5	NULL	-9	8	NULL
NULL	5	9	9	9
NULL	NULL	158	10	10
NULL	NULL	5	13	NULL
NULL	NULL	5	32	NULL
NULL	NULL	NULL	43	NULL
8	NULL	NULL	60	NULL
NULL	1	14	67	-10
NULL	10	5	83	83
NULL	NULL	5	86	86
-300	NULL	0	91	1
NULL	9	158	99	99
NULL	NULL	14	111	NULL
NULL	NULL	123	123	123
5	0	NULL	144	1
-10	NULL	0	154	NULL
9	NULL	NULL	159	NULL
NULL	NULL	14	216	NULL
NULL	NULL	227	227	227
-90	NULL	0	232	4
INSERT INTO table0_bigint ( pk , col_bigint_key ) VALUES ( 10, CAST( 219 AS CHAR(100)) ) , ( 10, CAST( 9 AS CHAR(100)) ) ;
ERROR 23000: Duplicate entry '10' for key 'PRIMARY'
SELECT * FROM table0_bigint ORDER BY pk;
col_char_12_key	col_char_12	col_bigint_key	pk	col_bigint
8-9	8-9	2	-1018	8
-10	NULL	0	-100	NULL
99	99	NULL	-10	NULL
139	NULL	NULL	-9	NULL
0	NULL	0	-1	NULL
0	NULL	0	0	NULL
2	NULL	NULL	1	NULL
NULL	NULL	5	4	NULL
NULL	NULL	14	5	NULL
NULL	NULL	14	6	NULL
NULL	NULL	14	7	NULL
5	NULL	-9	8	NULL
NULL	5	9	9	9
NULL	NULL	158	10	10
NULL	NULL	5	13	NULL
NULL	NULL	5	32	NULL
NULL	NULL	NULL	43	NULL
8	NULL	NULL	60	NULL
NULL	1	14	67	-10
NULL	10	5	83	83
NULL	NULL	5	86	86
-300	NULL	0	91	1
NULL	9	158	99	99
NULL	NULL	14	111	NULL
NULL	NULL	123	123	123
5	0	NULL	144	1
-10	NULL	0	154	NULL
9	NULL	NULL	159	NULL
NULL	NULL	14	216	NULL
NULL	NULL	227	227	227
-90	NULL	0	232	4
SELECT DISTINCT NULL , col_bigint , TRUE , UPPER( col_char_12_key ) , FALSE , 1 FROM table0_bigint ORDER BY col_bigint_key , col_char_12_key , col_bigint_key , pk ASC;
NULL	col_bigint	TRUE	UPPER( col_char_12_key )	FALSE	1
NULL	NULL	1	139	0	1
NULL	NULL	1	2	0	1
NULL	1	1	5	0	1
NULL	NULL	1	8	0	1
NULL	NULL	1	9	0	1
NULL	NULL	1	99	0	1
NULL	NULL	1	5	0	1
NULL	NULL	1	-10	0	1
NULL	1	1	-300	0	1
NULL	4	1	-90	0	1
NULL	NULL	1	0	0	1
NULL	8	1	8-9	0	1
NULL	NULL	1	NULL	0	1
NULL	83	1	NULL	0	1
NULL	86	1	NULL	0	1
NULL	9	1	NULL	0	1
NULL	-10	1	NULL	0	1
NULL	123	1	NULL	0	1
NULL	10	1	NULL	0	1
NULL	99	1	NULL	0	1
NULL	227	1	NULL	0	1
SELECT * FROM table0_bigint WHERE ( 1906311168 , -168361984 , -1338900480 , 1338769408 ) NOT IN ( ( SUBSTR( CAST( ( LENGTH( SUBSTR( CAST( ( 9 ) AS CHAR(100) ) , 1 , 12 ) ) ) AS CHAR(100) ) , 1 , 12 ) , SUBSTR( CAST( ( LENGTH('NAJAK') ) AS CHAR(100) ) , 1 , 12 ) , SUBSTR( CAST( ( ROUND ( FLOOR ( -100 ) ) ) AS CHAR(100) ) , 1 , 12 ) , SUBSTR( CAST( ( ROUND( 63 * ROUND( 1 * 1 ) ) ) AS CHAR(100) ) , 1 , 12 ) ) ) ORDER BY pk LIMIT 6;
col_char_12_key	col_char_12	col_bigint_key	pk	col_bigint
8-9	8-9	2	-1018	8
-10	NULL	0	-100	NULL
99	99	NULL	-10	NULL
139	NULL	NULL	-9	NULL
0	NULL	0	-1	NULL
0	NULL	0	0	NULL
SELECT * FROM table0_bigint WHERE ( -234422272 ) IN ( SUBSTR( CAST( ( -10 ) AS CHAR(100) ) , 1 , 12 ) , SUBSTR( CAST( ( 2 ) AS CHAR(100) ) , 1 , 12 ) , SUBSTR( CAST( ( ROUND( 10 * ROUND ( ROUND( ROUND( -1 - -1 ) + 10 ) ) ) ) AS CHAR(100) ) , 1 , 12 ) , SUBSTR( CAST( ( SIGN ( ROUND( -10 * 10 ) ) ) AS CHAR(100) ) , 1 , 12 ) , SUBSTR( CAST( ( ABS ( 99 ) ) AS CHAR(100) ) , 1 , 12 ) ) ORDER BY pk ASC , pk  LIMIT 6 , 5;
col_char_12_key	col_char_12	col_bigint_key	pk	col_bigint
SELECT * FROM table0_bigint WHERE pk < 0 ORDER BY pk LIMIT 8 , 3;
col_char_12_key	col_char_12	col_bigint_key	pk	col_bigint
SELECT  col_bigint,col_bigint_key,col_char_12,col_char_12_key,pk FROM table0_bigint ORDER BY col_bigint_key , col_char_12_key , pk ASC;
col_bigint	col_bigint_key	col_char_12	col_char_12_key	pk
NULL	NULL	NULL	NULL	43
NULL	NULL	NULL	139	-9
NULL	NULL	NULL	2	1
1	NULL	0	5	144
NULL	NULL	NULL	8	60
NULL	NULL	NULL	9	159
NULL	NULL	99	99	-10
NULL	-9	NULL	5	8
NULL	0	NULL	-10	-100
NULL	0	NULL	-10	154
1	0	NULL	-300	91
4	0	NULL	-90	232
NULL	0	NULL	0	-1
NULL	0	NULL	0	0
8	2	8-9	8-9	-1018
NULL	5	NULL	NULL	4
NULL	5	NULL	NULL	13
NULL	5	NULL	NULL	32
83	5	10	NULL	83
86	5	NULL	NULL	86
9	9	5	NULL	9
NULL	14	NULL	NULL	5
NULL	14	NULL	NULL	6
NULL	14	NULL	NULL	7
-10	14	1	NULL	67
NULL	14	NULL	NULL	111
NULL	14	NULL	NULL	216
123	123	NULL	NULL	123
10	158	NULL	NULL	10
99	158	9	NULL	99
227	227	NULL	NULL	227
INSERT INTO table0_bigint ( pk , col_char_12_key ) VALUES ( 0, CAST( 0 AS CHAR(100)) ) , ( 10, CAST( -1 AS CHAR(100)) ) ;
ERROR 23000: Duplicate entry '0' for key 'PRIMARY'
SELECT * FROM table0_bigint ORDER BY pk;
col_char_12_key	col_char_12	col_bigint_key	pk	col_bigint
8-9	8-9	2	-1018	8
-10	NULL	0	-100	NULL
99	99	NULL	-10	NULL
139	NULL	NULL	-9	NULL
0	NULL	0	-1	NULL
0	NULL	0	0	NULL
2	NULL	NULL	1	NULL
NULL	NULL	5	4	NULL
NULL	NULL	14	5	NULL
NULL	NULL	14	6	NULL
NULL	NULL	14	7	NULL
5	NULL	-9	8	NULL
NULL	5	9	9	9
NULL	NULL	158	10	10
NULL	NULL	5	13	NULL
NULL	NULL	5	32	NULL
NULL	NULL	NULL	43	NULL
8	NULL	NULL	60	NULL
NULL	1	14	67	-10
NULL	10	5	83	83
NULL	NULL	5	86	86
-300	NULL	0	91	1
NULL	9	158	99	99
NULL	NULL	14	111	NULL
NULL	NULL	123	123	123
5	0	NULL	144	1
-10	NULL	0	154	NULL
9	NULL	NULL	159	NULL
NULL	NULL	14	216	NULL
NULL	NULL	227	227	227
-90	NULL	0	232	4
SELECT * FROM table0_bigint WHERE pk BETWEEN SUBSTR( CAST( ( ROUND( ROUND ( 1 ) * 99 ) ) AS CHAR(100) ) , 1 , 12 ) AND SUBSTR( CAST( ( 5 ) AS CHAR(100) ) , 1 , 12 ) ORDER BY col_bigint  , col_char_12_key DESC , pk ASC LIMIT 7 , 6;
col_char_12_key	col_char_12	col_bigint_key	pk	col_bigint
SELECT * FROM table0_bigint WHERE col_char_12_key IN ( SUBSTR( CAST( ( ROUND( LENGTH('PKYBV') * 8 ) ) AS CHAR(100) ) , 1 , 12 ) , SUBSTR( CAST( ( LENGTH( SUBSTR( CAST( ( LENGTH( SUBSTR( CAST( ( ROUND( -10 - 10 ) ) AS CHAR(100) ) , 1 , 12 ) ) ) AS CHAR(100) ) , 1 , 12 ) ) ) AS CHAR(100) ) , 1 , 12 ) , SUBSTR( CAST( ( LENGTH( SUBSTR( CAST( ( ROUND( -10 - 41 ) ) AS CHAR(100) ) , 1 , 12 ) ) ) AS CHAR(100) ) , 1 , 12 ) , SUBSTR( CAST( ( LENGTH('TALDL') ) AS CHAR(100) ) , 1 , 12 ) , SUBSTR( CAST( ( ROUND( ROUND( -100 * 3 ) - 10 ) ) AS CHAR(100) ) , 1 , 12 ) ) ORDER BY col_bigint_key , pk DESC LIMIT 1;
col_char_12_key	col_char_12	col_bigint_key	pk	col_bigint
5	0	NULL	144	1
INSERT INTO table0_bigint (pk) VALUES ( 99 ) ;
ERROR 23000: Duplicate entry '99' for key 'PRIMARY'
SELECT * FROM table0_bigint ORDER BY pk;
col_char_12_key	col_char_12	col_bigint_key	pk	col_bigint
8-9	8-9	2	-1018	8
-10	NULL	0	-100	NULL
99	99	NULL	-10	NULL
139	NULL	NULL	-9	NULL
0	NULL	0	-1	NULL
0	NULL	0	0	NULL
2	NULL	NULL	1	NULL
NULL	NULL	5	4	NULL
NULL	NULL	14	5	NULL
NULL	NULL	14	6	NULL
NULL	NULL	14	7	NULL
5	NULL	-9	8	NULL
NULL	5	9	9	9
NULL	NULL	158	10	10
NULL	NULL	5	13	NULL
NULL	NULL	5	32	NULL
NULL	NULL	NULL	43	NULL
8	NULL	NULL	60	NULL
NULL	1	14	67	-10
NULL	10	5	83	83
NULL	NULL	5	86	86
-300	NULL	0	91	1
NULL	9	158	99	99
NULL	NULL	14	111	NULL
NULL	NULL	123	123	123
5	0	NULL	144	1
-10	NULL	0	154	NULL
9	NULL	NULL	159	NULL
NULL	NULL	14	216	NULL
NULL	NULL	227	227	227
-90	NULL	0	232	4
SELECT * FROM table0_bigint WHERE  ( pk <= SUBSTR( CAST( ( ROUND( ABS ( 9 ) + 99 ) ) AS CHAR(100) ) , 1 , 12 ) ) AND NOT ( col_char_12_key > SUBSTR( CAST( ( 9 ) AS CHAR(100) ) , 1 , 12 ) ) OR NOT ( col_char_12_key != SUBSTR( CAST( ( 99 ) AS CHAR(100) ) , 1 , 12 ) ) OR NOT ( pk <= SUBSTR( CAST( ( LENGTH( SUBSTR( CAST( ( LENGTH('QLAYI') ) AS CHAR(100) ) , 1 , 12 ) ) ) AS CHAR(100) ) , 1 , 12 ) ) OR NOT ( col_char_12 < SUBSTR( CAST( ( SIGN ( 99 ) ) AS CHAR(100) ) , 1 , 12 ) ) OR NOT ( pk != SUBSTR( CAST( ( ROUND( 1 - 199 ) ) AS CHAR(100) ) , 1 , 12 ) ) ORDER BY col_bigint_key , col_char_12_key , col_char_12_key , pk  LIMIT 4 , 2;
col_char_12_key	col_char_12	col_bigint_key	pk	col_bigint
8	NULL	NULL	60	NULL
9	NULL	NULL	159	NULL
SELECT UPPER( col_bigint_key ),pk FROM table0_bigint WHERE pk BETWEEN SUBSTR( CAST( ( LENGTH( SUBSTR( CAST( ( ROUND( 0 * ROUND( ROUND( 133 * SIGN ( ROUND( SIGN ( LENGTH('ALYMT') ) - -10 ) ) ) - -1 ) ) ) AS CHAR(100) ) , 1 , 12 ) ) ) AS CHAR(100) ) , 1 , 12 ) AND SUBSTR( CAST( ( ROUND ( 1 ) ) AS CHAR(100) ) , 1 , 12 ) GROUP BY col_bigint_key,pk ORDER BY col_bigint_key,pk LIMIT 8 , 6;
UPPER( col_bigint_key )	pk
SELECT UPPER( pk ) FROM table0_bigint WHERE pk BETWEEN SUBSTR( CAST( ( FLOOR ( ROUND( 10 * -9 ) ) ) AS CHAR(100) ) , 1 , 12 ) AND SUBSTR( CAST( ( LENGTH('WTUOC') ) AS CHAR(100) ) , 1 , 12 ) GROUP BY pk ORDER BY pk LIMIT 89 , 4;
UPPER( pk )
SELECT UPPER( col_char_12_key ),pk FROM table0_bigint WHERE col_bigint NOT IN ( SUBSTR( CAST( ( LENGTH( SUBSTR( CAST( ( LENGTH( SUBSTR( CAST( ( ROUND( 122 + LENGTH('EXLLG') ) ) AS CHAR(100) ) , 1 , 12 ) ) ) AS CHAR(100) ) , 1 , 12 ) ) ) AS CHAR(100) ) , 1 , 12 ) , SUBSTR( CAST( ( LENGTH( SUBSTR( CAST( ( -1 ) AS CHAR(100) ) , 1 , 12 ) ) ) AS CHAR(100) ) , 1 , 12 ) , SUBSTR( CAST( ( ROUND( ROUND( -10 - 9 ) + 1 ) ) AS CHAR(100) ) , 1 , 12 ) , SUBSTR( CAST( ( ROUND( ROUND( SIGN ( 9 ) - -1 ) * -1 ) ) AS CHAR(100) ) , 1 , 12 ) , SUBSTR( CAST( ( CEIL ( 48 ) ) AS CHAR(100) ) , 1 , 12 ) ) GROUP BY col_char_12_key,pk ORDER BY col_char_12_key,pk LIMIT 6;
UPPER( col_char_12_key )	pk
NULL	9
NULL	10
NULL	67
NULL	83
NULL	86
NULL	99
INSERT INTO table0_bigint ( pk , col_char_12_key ) VALUES ( -100, CAST( 9 AS CHAR(100)) ) , ( -10, CAST( 132 AS CHAR(100)) ) ;
ERROR 23000: Duplicate entry '-100' for key 'PRIMARY'
SELECT * FROM table0_bigint ORDER BY pk;
col_char_12_key	col_char_12	col_bigint_key	pk	col_bigint
8-9	8-9	2	-1018	8
-10	NULL	0	-100	NULL
99	99	NULL	-10	NULL
139	NULL	NULL	-9	NULL
0	NULL	0	-1	NULL
0	NULL	0	0	NULL
2	NULL	NULL	1	NULL
NULL	NULL	5	4	NULL
NULL	NULL	14	5	NULL
NULL	NULL	14	6	NULL
NULL	NULL	14	7	NULL
5	NULL	-9	8	NULL
NULL	5	9	9	9
NULL	NULL	158	10	10
NULL	NULL	5	13	NULL
NULL	NULL	5	32	NULL
NULL	NULL	NULL	43	NULL
8	NULL	NULL	60	NULL
NULL	1	14	67	-10
NULL	10	5	83	83
NULL	NULL	5	86	86
-300	NULL	0	91	1
NULL	9	158	99	99
NULL	NULL	14	111	NULL
NULL	NULL	123	123	123
5	0	NULL	144	1
-10	NULL	0	154	NULL
9	NULL	NULL	159	NULL
NULL	NULL	14	216	NULL
NULL	NULL	227	227	227
-90	NULL	0	232	4
SELECT 1 FROM table0_bigint WHERE SUBSTR( CAST( ( ROUND ( ROUND( 1 + 93 ) ) ) AS CHAR(100) ) , 1 , 12 ) != LENGTH('RTEJY') FOR UPDATE;
1
1
1
1
1
1
1
1
1
1
1
1
1
1
1
1
1
1
1
1
1
1
1
1
1
1
1
1
1
1
1
1
SELECT * FROM table0_bigint WHERE pk < ( SUBSTR( CAST( ( LENGTH('GMBWV') ) AS CHAR(100) ) , 1 , 12 ) ) ORDER BY col_bigint_key  , pk ASC LIMIT 8 , 8;
col_char_12_key	col_char_12	col_bigint_key	pk	col_bigint
INSERT INTO table0_bigint ( pk , col_char_12_key ) VALUES ( -100, CAST( 109 AS CHAR(100)) ) , ( -10, CAST( 1 AS CHAR(100)) ) ;
ERROR 23000: Duplicate entry '-100' for key 'PRIMARY'
SELECT * FROM table0_bigint ORDER BY pk;
col_char_12_key	col_char_12	col_bigint_key	pk	col_bigint
8-9	8-9	2	-1018	8
-10	NULL	0	-100	NULL
99	99	NULL	-10	NULL
139	NULL	NULL	-9	NULL
0	NULL	0	-1	NULL
0	NULL	0	0	NULL
2	NULL	NULL	1	NULL
NULL	NULL	5	4	NULL
NULL	NULL	14	5	NULL
NULL	NULL	14	6	NULL
NULL	NULL	14	7	NULL
5	NULL	-9	8	NULL
NULL	5	9	9	9
NULL	NULL	158	10	10
NULL	NULL	5	13	NULL
NULL	NULL	5	32	NULL
NULL	NULL	NULL	43	NULL
8	NULL	NULL	60	NULL
NULL	1	14	67	-10
NULL	10	5	83	83
NULL	NULL	5	86	86
-300	NULL	0	91	1
NULL	9	158	99	99
NULL	NULL	14	111	NULL
NULL	NULL	123	123	123
5	0	NULL	144	1
-10	NULL	0	154	NULL
9	NULL	NULL	159	NULL
NULL	NULL	14	216	NULL
NULL	NULL	227	227	227
-90	NULL	0	232	4
SELECT UPPER( col_char_12_key ),pk FROM table0_bigint WHERE 1 != SIGN ( -9 ) GROUP BY col_char_12_key,pk ORDER BY col_char_12_key,pk LIMIT 1;
UPPER( col_char_12_key )	pk
NULL	4
SELECT col_bigint_key,pk FROM table0_bigint WHERE LENGTH('DOBWX') <= col_bigint_key GROUP BY col_bigint_key,pk ORDER BY col_bigint_key,pk LIMIT 1;
col_bigint_key	pk
5	4
INSERT INTO table0_bigint ( pk , col_bigint_key, col_char_12_key ) VALUES ( 99 , SUBSTR( CAST( ( ROUND( 9 + LENGTH('BSSFX') ) ) AS CHAR(100) ) , 1 , 12 ) , SUBSTR( CAST( ( -9 ) AS CHAR(100) ) , 1 , 12 ) ) ;
ERROR 23000: Duplicate entry '99' for key 'PRIMARY'
SELECT * FROM table0_bigint ORDER BY pk;
col_char_12_key	col_char_12	col_bigint_key	pk	col_bigint
8-9	8-9	2	-1018	8
-10	NULL	0	-100	NULL
99	99	NULL	-10	NULL
139	NULL	NULL	-9	NULL
0	NULL	0	-1	NULL
0	NULL	0	0	NULL
2	NULL	NULL	1	NULL
NULL	NULL	5	4	NULL
NULL	NULL	14	5	NULL
NULL	NULL	14	6	NULL
NULL	NULL	14	7	NULL
5	NULL	-9	8	NULL
NULL	5	9	9	9
NULL	NULL	158	10	10
NULL	NULL	5	13	NULL
NULL	NULL	5	32	NULL
NULL	NULL	NULL	43	NULL
8	NULL	NULL	60	NULL
NULL	1	14	67	-10
NULL	10	5	83	83
NULL	NULL	5	86	86
-300	NULL	0	91	1
NULL	9	158	99	99
NULL	NULL	14	111	NULL
NULL	NULL	123	123	123
5	0	NULL	144	1
-10	NULL	0	154	NULL
9	NULL	NULL	159	NULL
NULL	NULL	14	216	NULL
NULL	NULL	227	227	227
-90	NULL	0	232	4
UPDATE table0_bigint SET pk = CEIL ( ROUND( -9 * LENGTH('DMBYM') ) ) WHERE col_bigint_key BETWEEN CAST( 1 AS CHAR(100) ) AND CAST( 5 AS CHAR(100) ) ORDER BY col_bigint_key , pk  LIMIT 3 ;
ERROR 23000: Duplicate entry '-45' for key 'PRIMARY'
SELECT * FROM table0_bigint ORDER BY pk;
col_char_12_key	col_char_12	col_bigint_key	pk	col_bigint
8-9	8-9	2	-1018	8
-10	NULL	0	-100	NULL
99	99	NULL	-10	NULL
139	NULL	NULL	-9	NULL
0	NULL	0	-1	NULL
0	NULL	0	0	NULL
2	NULL	NULL	1	NULL
NULL	NULL	5	4	NULL
NULL	NULL	14	5	NULL
NULL	NULL	14	6	NULL
NULL	NULL	14	7	NULL
5	NULL	-9	8	NULL
NULL	5	9	9	9
NULL	NULL	158	10	10
NULL	NULL	5	13	NULL
NULL	NULL	5	32	NULL
NULL	NULL	NULL	43	NULL
8	NULL	NULL	60	NULL
NULL	1	14	67	-10
NULL	10	5	83	83
NULL	NULL	5	86	86
-300	NULL	0	91	1
NULL	9	158	99	99
NULL	NULL	14	111	NULL
NULL	NULL	123	123	123
5	0	NULL	144	1
-10	NULL	0	154	NULL
9	NULL	NULL	159	NULL
NULL	NULL	14	216	NULL
NULL	NULL	227	227	227
-90	NULL	0	232	4
SELECT pk , col_bigint , col_char_12_key FROM table0_bigint WHERE pk > -1 ORDER BY col_char_12_key , col_bigint_key , col_bigint_key , pk DESC LIMIT 1;
pk	col_bigint	col_char_12_key
43	NULL	NULL
SELECT 1 FROM table0_bigint WHERE ( -532348928 , -1975713792 ) IN ( ( SUBSTR( CAST( ( LENGTH( SUBSTR( CAST( ( ROUND( LENGTH( SUBSTR( CAST( ( LENGTH('XTBUR') ) AS CHAR(100) ) , 1 , 12 ) ) - 99 ) ) AS CHAR(100) ) , 1 , 12 ) ) ) AS CHAR(100) ) , 1 , 12 ) , SUBSTR( CAST( ( ROUND( 1 - LENGTH('YIQBS') ) ) AS CHAR(100) ) , 1 , 12 ) ) , ( SUBSTR( CAST( ( ROUND ( 9 ) ) AS CHAR(100) ) , 1 , 12 ) , SUBSTR( CAST( ( ROUND( 1 + 1 ) ) AS CHAR(100) ) , 1 , 12 ) ) ) FOR UPDATE;
1
UPDATE table0_bigint AS X SET X . col_bigint_key = SUBSTR( CAST( ( ROUND( 1 * 32 ) ) AS CHAR(100) ) , 1 , 12 ) WHERE col_bigint != CEIL ( LENGTH('SASTN') ) ORDER BY pk , col_bigint_key,pk ASC , pk ASC LIMIT 7 ;
SELECT * FROM table0_bigint ORDER BY pk;
col_char_12_key	col_char_12	col_bigint_key	pk	col_bigint
8-9	8-9	32	-1018	8
-10	NULL	0	-100	NULL
99	99	NULL	-10	NULL
139	NULL	NULL	-9	NULL
0	NULL	0	-1	NULL
0	NULL	0	0	NULL
2	NULL	NULL	1	NULL
NULL	NULL	5	4	NULL
NULL	NULL	14	5	NULL
NULL	NULL	14	6	NULL
NULL	NULL	14	7	NULL
5	NULL	-9	8	NULL
NULL	5	32	9	9
NULL	NULL	32	10	10
NULL	NULL	5	13	NULL
NULL	NULL	5	32	NULL
NULL	NULL	NULL	43	NULL
8	NULL	NULL	60	NULL
NULL	1	32	67	-10
NULL	10	32	83	83
NULL	NULL	32	86	86
-300	NULL	32	91	1
NULL	9	158	99	99
NULL	NULL	14	111	NULL
NULL	NULL	123	123	123
5	0	NULL	144	1
-10	NULL	0	154	NULL
9	NULL	NULL	159	NULL
NULL	NULL	14	216	NULL
NULL	NULL	227	227	227
-90	NULL	0	232	4
SELECT UPPER( col_char_12_key ),pk FROM table0_bigint WHERE pk <= ( SUBSTR( CAST( ( LENGTH('FATEH') ) AS CHAR(100) ) , 1 , 12 ) ) GROUP BY col_char_12_key,pk ORDER BY col_char_12_key,pk LIMIT 2 , 4;
UPPER( col_char_12_key )	pk
-10	-100
0	-1
0	0
139	-9
SELECT COUNT( pk ) FROM table0_bigint WHERE col_char_12_key BETWEEN SUBSTR( CAST( ( 0 ) AS CHAR(100) ) , 1 , 12 ) AND SUBSTR( CAST( ( ROUND( 156 * ROUND( -10 + 110 ) ) ) AS CHAR(100) ) , 1 , 12 ) ORDER BY col_bigint ASC , col_char_12_key DESC , pk DESC LIMIT 2 /* RESULTSET_HAS_ZERO_OR_ONE_ROWS */;
COUNT( pk )
3
SELECT * FROM table0_bigint WHERE col_bigint NOT IN ( SUBSTR( CAST( ( ROUND( ROUND ( 0 ) + 1 ) ) AS CHAR(100) ) , 1 , 12 ) , SUBSTR( CAST( ( ABS ( ROUND( 0 + -100 ) ) ) AS CHAR(100) ) , 1 , 12 ) , SUBSTR( CAST( ( LENGTH('PBHFF') ) AS CHAR(100) ) , 1 , 12 ) , SUBSTR( CAST( ( ROUND( ROUND ( 99 ) - -1 ) ) AS CHAR(100) ) , 1 , 12 ) , SUBSTR( CAST( ( LENGTH('QQZWF') ) AS CHAR(100) ) , 1 , 12 ) ) ORDER BY pk LIMIT 6 , 5;
col_char_12_key	col_char_12	col_bigint_key	pk	col_bigint
NULL	9	158	99	99
NULL	NULL	123	123	123
NULL	NULL	227	227	227
-90	NULL	0	232	4
SELECT 1 FROM table0_bigint WHERE ( -1615986688 , -925630464 , 739311616 , -1377632256 ) NOT IN ( ( SUBSTR( CAST( ( ROUND( 69 * LENGTH( SUBSTR( CAST( ( ROUND( -10 + 0 ) ) AS CHAR(100) ) , 1 , 12 ) ) ) ) AS CHAR(100) ) , 1 , 12 ) , SUBSTR( CAST( ( LENGTH('UXQPN') ) AS CHAR(100) ) , 1 , 12 ) , SUBSTR( CAST( ( ROUND( -1 + 131 ) ) AS CHAR(100) ) , 1 , 12 ) , SUBSTR( CAST( ( ROUND( CEIL ( SIGN ( LENGTH( SUBSTR( CAST( ( ROUND( -9 + -100 ) ) AS CHAR(100) ) , 1 , 12 ) ) ) ) + 2 ) ) AS CHAR(100) ) , 1 , 12 ) ) ) FOR UPDATE;
1
1
1
1
1
1
1
1
1
1
1
1
1
1
1
1
1
1
1
1
1
1
1
1
1
1
1
1
1
1
1
1
SELECT col_bigint , col_char_12 FROM table0_bigint WHERE pk > 1366228992 and pk < 1366228992 ORDER BY pk LIMIT 8 , 6 /* RESULTSET_HAS_ZERO_OR_ONE_ROWS */;
col_bigint	col_char_12
SELECT 1 FROM table0_bigint WHERE col_bigint_key NOT IN ( CAST(-1 AS CHAR(100)) , CAST(6 AS CHAR(100)) , CAST(1 AS CHAR(100)) ) FOR UPDATE;
1
1
1
1
1
1
1
1
1
1
1
1
1
1
1
1
1
1
1
1
1
1
1
1
1
SELECT col_char_12_key FROM table0_bigint WHERE LENGTH( SUBSTR( CAST( ( ROUND( -9 + ROUND( 2 * FLOOR ( CEIL ( LENGTH('NJCKH') ) ) ) ) ) AS CHAR(100) ) , 1 , 12 ) ) < -9 ORDER BY pk LIMIT 2 , 1 /* RESULTSET_HAS_ZERO_OR_ONE_ROWS */;
col_char_12_key
SELECT DISTINCT col_bigint,col_bigint_key,col_char_12,col_char_12_key,pk FROM table0_bigint ORDER BY col_bigint_key , col_char_12_key , col_bigint_key , pk DESC;
col_bigint	col_bigint_key	col_char_12	col_char_12_key	pk
NULL	NULL	NULL	NULL	43
NULL	NULL	NULL	139	-9
NULL	NULL	NULL	2	1
1	NULL	0	5	144
NULL	NULL	NULL	8	60
NULL	NULL	NULL	9	159
NULL	NULL	99	99	-10
NULL	-9	NULL	5	8
NULL	0	NULL	-10	154
NULL	0	NULL	-10	-100
4	0	NULL	-90	232
NULL	0	NULL	0	0
NULL	0	NULL	0	-1
NULL	5	NULL	NULL	32
NULL	5	NULL	NULL	13
NULL	5	NULL	NULL	4
NULL	14	NULL	NULL	216
NULL	14	NULL	NULL	111
NULL	14	NULL	NULL	7
NULL	14	NULL	NULL	6
NULL	14	NULL	NULL	5
86	32	NULL	NULL	86
83	32	10	NULL	83
-10	32	1	NULL	67
10	32	NULL	NULL	10
9	32	5	NULL	9
1	32	NULL	-300	91
8	32	8-9	8-9	-1018
123	123	NULL	NULL	123
99	158	9	NULL	99
227	227	NULL	NULL	227
SELECT pk FROM table0_bigint WHERE col_bigint <> ( SUBSTR( CAST( ( LENGTH( SUBSTR( CAST( ( LENGTH('XSLUX') ) AS CHAR(100) ) , 1 , 12 ) ) ) AS CHAR(100) ) , 1 , 12 ) ) ORDER BY col_char_12_key,pk ASC , pk  LIMIT 195 , 3;
pk
INSERT INTO table0_bigint ( pk , col_bigint_key ) VALUES ( 125 , SUBSTR( CAST( ( CEIL ( 152 ) ) AS CHAR(100) ) , 1 , 12 ) ) ;
SELECT * FROM table0_bigint ORDER BY pk;
col_char_12_key	col_char_12	col_bigint_key	pk	col_bigint
8-9	8-9	32	-1018	8
-10	NULL	0	-100	NULL
99	99	NULL	-10	NULL
139	NULL	NULL	-9	NULL
0	NULL	0	-1	NULL
0	NULL	0	0	NULL
2	NULL	NULL	1	NULL
NULL	NULL	5	4	NULL
NULL	NULL	14	5	NULL
NULL	NULL	14	6	NULL
NULL	NULL	14	7	NULL
5	NULL	-9	8	NULL
NULL	5	32	9	9
NULL	NULL	32	10	10
NULL	NULL	5	13	NULL
NULL	NULL	5	32	NULL
NULL	NULL	NULL	43	NULL
8	NULL	NULL	60	NULL
NULL	1	32	67	-10
NULL	10	32	83	83
NULL	NULL	32	86	86
-300	NULL	32	91	1
NULL	9	158	99	99
NULL	NULL	14	111	NULL
NULL	NULL	123	123	123
NULL	NULL	152	125	NULL
5	0	NULL	144	1
-10	NULL	0	154	NULL
9	NULL	NULL	159	NULL
NULL	NULL	14	216	NULL
NULL	NULL	227	227	227
-90	NULL	0	232	4
SELECT * FROM table0_bigint WHERE pk NOT IN ( SUBSTR( CAST( ( LENGTH('WQFTN') ) AS CHAR(100) ) , 1 , 12 ) , SUBSTR( CAST( ( ABS ( LENGTH( SUBSTR( CAST( ( ROUND( ROUND( 0 + LENGTH('PVRBB') ) * 0 ) ) AS CHAR(100) ) , 1 , 12 ) ) ) ) AS CHAR(100) ) , 1 , 12 ) , SUBSTR( CAST( ( LENGTH('EJMSA') ) AS CHAR(100) ) , 1 , 12 ) , SUBSTR( CAST( ( CEIL ( -9 ) ) AS CHAR(100) ) , 1 , 12 ) , SUBSTR( CAST( ( ROUND( -1 - -1 ) ) AS CHAR(100) ) , 1 , 12 ) ) ORDER BY pk LIMIT 1 , 3;
col_char_12_key	col_char_12	col_bigint_key	pk	col_bigint
-10	NULL	0	-100	NULL
99	99	NULL	-10	NULL
0	NULL	0	-1	NULL
SELECT pk FROM table0_bigint WHERE col_bigint_key < ( SUBSTR( CAST( ( LENGTH('NJODO') ) AS CHAR(100) ) , 1 , 12 ) ) ORDER BY col_bigint,col_bigint_key,col_char_12,col_char_12_key,pk,pk ASC , pk DESC LIMIT 1 /* RESULTSET_HAS_ZERO_OR_ONE_ROWS */;
pk
8
INSERT INTO table0_bigint ( pk , col_bigint, col_char_12_key ) VALUES ( -9 , SUBSTR( CAST( ( LENGTH( SUBSTR( CAST( ( ROUND( ROUND ( 0 ) * 167 ) ) AS CHAR(100) ) , 1 , 12 ) ) ) AS CHAR(100) ) , 1 , 12 ) , SUBSTR( CAST( ( ABS ( 10 ) ) AS CHAR(100) ) , 1 , 12 ) ) ;
ERROR 23000: Duplicate entry '-9' for key 'PRIMARY'
SELECT * FROM table0_bigint ORDER BY pk;
col_char_12_key	col_char_12	col_bigint_key	pk	col_bigint
8-9	8-9	32	-1018	8
-10	NULL	0	-100	NULL
99	99	NULL	-10	NULL
139	NULL	NULL	-9	NULL
0	NULL	0	-1	NULL
0	NULL	0	0	NULL
2	NULL	NULL	1	NULL
NULL	NULL	5	4	NULL
NULL	NULL	14	5	NULL
NULL	NULL	14	6	NULL
NULL	NULL	14	7	NULL
5	NULL	-9	8	NULL
NULL	5	32	9	9
NULL	NULL	32	10	10
NULL	NULL	5	13	NULL
NULL	NULL	5	32	NULL
NULL	NULL	NULL	43	NULL
8	NULL	NULL	60	NULL
NULL	1	32	67	-10
NULL	10	32	83	83
NULL	NULL	32	86	86
-300	NULL	32	91	1
NULL	9	158	99	99
NULL	NULL	14	111	NULL
NULL	NULL	123	123	123
NULL	NULL	152	125	NULL
5	0	NULL	144	1
-10	NULL	0	154	NULL
9	NULL	NULL	159	NULL
NULL	NULL	14	216	NULL
NULL	NULL	227	227	227
-90	NULL	0	232	4
SELECT COUNT( pk ) FROM table0_bigint WHERE ( -812384256 , 820510720 , 1550843904 , 505806848 ) NOT IN ( ( SUBSTR( CAST( ( ROUND( ROUND( 79 + 46 ) + 246 ) ) AS CHAR(100) ) , 1 , 12 ) , SUBSTR( CAST( ( LENGTH('WMNPW') ) AS CHAR(100) ) , 1 , 12 ) , SUBSTR( CAST( ( FLOOR ( 99 ) ) AS CHAR(100) ) , 1 , 12 ) , SUBSTR( CAST( ( LENGTH('VJKCC') ) AS CHAR(100) ) , 1 , 12 ) ) ) ORDER BY col_char_12_key , col_bigint_key , pk  LIMIT 3 , 4 /* RESULTSET_HAS_ZERO_OR_ONE_ROWS */;
COUNT( pk )
SELECT 1 FROM table0_bigint WHERE LENGTH( SUBSTR( CAST( ( LENGTH('KLUNP') ) AS CHAR(100) ) , 1 , 12 ) ) != ROUND( 99 * 1 ) FOR UPDATE;
1
1
1
1
1
1
1
1
1
1
1
1
1
1
1
1
1
1
1
1
1
1
1
1
1
1
1
1
1
1
1
1
1
SELECT pk FROM table0_bigint WHERE pk > ( SUBSTR( CAST( ( 239 ) AS CHAR(100) ) , 1 , 12 ) ) ORDER BY col_bigint_key  , pk  LIMIT 8 , 1 /* RESULTSET_HAS_ZERO_OR_ONE_ROWS */;
pk
SELECT * FROM table0_bigint WHERE ( 1044316160 , 1567883264 , 255393792 , 1653276672 , 405143552 ) NOT IN ( ( SUBSTR( CAST( ( LENGTH('JAWNJ') ) AS CHAR(100) ) , 1 , 12 ) , SUBSTR( CAST( ( SIGN ( ROUND( 10 - 9 ) ) ) AS CHAR(100) ) , 1 , 12 ) , SUBSTR( CAST( ( ROUND( 10 - ROUND( LENGTH('FYQKR') - -1 ) ) ) AS CHAR(100) ) , 1 , 12 ) , SUBSTR( CAST( ( LENGTH( SUBSTR( CAST( ( CEIL ( LENGTH('FGDWS') ) ) AS CHAR(100) ) , 1 , 12 ) ) ) AS CHAR(100) ) , 1 , 12 ) , SUBSTR( CAST( ( ROUND( SIGN ( 9 ) + 9 ) ) AS CHAR(100) ) , 1 , 12 ) ) ) ORDER BY col_char_12_key , pk ASC LIMIT 4 , 4;
col_char_12_key	col_char_12	col_bigint_key	pk	col_bigint
NULL	5	32	9	9
NULL	NULL	32	10	10
NULL	NULL	5	13	NULL
NULL	NULL	5	32	NULL
SELECT 1 FROM table0_bigint WHERE ( 1553661952 , 591593472 , 1008467968 , -2074935296 ) IN ( ( SUBSTR( CAST( ( ROUND( 2 + 9 ) ) AS CHAR(100) ) , 1 , 12 ) , SUBSTR( CAST( ( LENGTH( SUBSTR( CAST( ( ROUND( 120 + 17 ) ) AS CHAR(100) ) , 1 , 12 ) ) ) AS CHAR(100) ) , 1 , 12 ) , SUBSTR( CAST( ( ABS ( 88 ) ) AS CHAR(100) ) , 1 , 12 ) , SUBSTR( CAST( ( LENGTH('RJNXF') ) AS CHAR(100) ) , 1 , 12 ) ) ) FOR UPDATE;
1
SELECT COUNT( pk ) FROM table0_bigint WHERE NOT ( col_bigint_key < SUBSTR( CAST( ( LENGTH( SUBSTR( CAST( ( ABS ( ROUND( LENGTH('RPAMY') * 77 ) ) ) AS CHAR(100) ) , 1 , 12 ) ) ) AS CHAR(100) ) , 1 , 12 ) ) AND  ( col_char_12 >= SUBSTR( CAST( ( ROUND( ROUND( 9 - 1 ) - 181 ) ) AS CHAR(100) ) , 1 , 12 ) ) OR NOT ( pk >= SUBSTR( CAST( ( ROUND ( -1 ) ) AS CHAR(100) ) , 1 , 12 ) ) AND  ( col_char_12 >= SUBSTR( CAST( ( ROUND( LENGTH( SUBSTR( CAST( ( LENGTH( SUBSTR( CAST( ( LENGTH( SUBSTR( CAST( ( 130 ) AS CHAR(100) ) , 1 , 12 ) ) ) AS CHAR(100) ) , 1 , 12 ) ) ) AS CHAR(100) ) , 1 , 12 ) ) + 99 ) ) AS CHAR(100) ) , 1 , 12 ) ) ORDER BY col_char_12  , pk  LIMIT 6 /* RESULTSET_HAS_ZERO_OR_ONE_ROWS */;
COUNT( pk )
6
SELECT 1 FROM table0_bigint WHERE ( 1898250240 , -1087766528 , 1020067840 , -1204682752 , -1353252864 ) IN ( ( SUBSTR( CAST( ( SIGN ( CEIL ( LENGTH('JJLZV') ) ) ) AS CHAR(100) ) , 1 , 12 ) , SUBSTR( CAST( ( ROUND( 1 - 228 ) ) AS CHAR(100) ) , 1 , 12 ) , SUBSTR( CAST( ( -10 ) AS CHAR(100) ) , 1 , 12 ) , SUBSTR( CAST( ( LENGTH('KXNDB') ) AS CHAR(100) ) , 1 , 12 ) , SUBSTR( CAST( ( ROUND( 120 + ROUND ( LENGTH( SUBSTR( CAST( ( -100 ) AS CHAR(100) ) , 1 , 12 ) ) ) ) ) AS CHAR(100) ) , 1 , 12 ) ) ) FOR UPDATE;
1
SELECT pk FROM table0_bigint  ORDER BY col_bigint_key , col_bigint_key , col_char_12_key , pk DESC LIMIT 5 , 1 /* RESULTSET_HAS_ZERO_OR_ONE_ROWS */;
pk
159
SELECT * FROM table0_bigint WHERE pk < ( SUBSTR( CAST( ( ROUND( -100 - 230 ) ) AS CHAR(100) ) , 1 , 12 ) ) ORDER BY col_char_12_key , col_char_12_key , col_char_12_key , pk DESC LIMIT 2;
col_char_12_key	col_char_12	col_bigint_key	pk	col_bigint
8-9	8-9	32	-1018	8
SELECT DISTINCT TRUE FROM table0_bigint ORDER BY pk DESC , pk DESC;
TRUE
1
INSERT INTO table0_bigint (pk) VALUES ( 0 ) ;
ERROR 23000: Duplicate entry '0' for key 'PRIMARY'
SELECT * FROM table0_bigint ORDER BY pk;
col_char_12_key	col_char_12	col_bigint_key	pk	col_bigint
8-9	8-9	32	-1018	8
-10	NULL	0	-100	NULL
99	99	NULL	-10	NULL
139	NULL	NULL	-9	NULL
0	NULL	0	-1	NULL
0	NULL	0	0	NULL
2	NULL	NULL	1	NULL
NULL	NULL	5	4	NULL
NULL	NULL	14	5	NULL
NULL	NULL	14	6	NULL
NULL	NULL	14	7	NULL
5	NULL	-9	8	NULL
NULL	5	32	9	9
NULL	NULL	32	10	10
NULL	NULL	5	13	NULL
NULL	NULL	5	32	NULL
NULL	NULL	NULL	43	NULL
8	NULL	NULL	60	NULL
NULL	1	32	67	-10
NULL	10	32	83	83
NULL	NULL	32	86	86
-300	NULL	32	91	1
NULL	9	158	99	99
NULL	NULL	14	111	NULL
NULL	NULL	123	123	123
NULL	NULL	152	125	NULL
5	0	NULL	144	1
-10	NULL	0	154	NULL
9	NULL	NULL	159	NULL
NULL	NULL	14	216	NULL
NULL	NULL	227	227	227
-90	NULL	0	232	4
SELECT 1 FROM table0_bigint WHERE col_bigint_key < 0 FOR UPDATE;
1
1
INSERT INTO table0_bigint ( pk , col_bigint_key ) VALUES ( 10 , SUBSTR( CAST( ( LENGTH('JNDVT') ) AS CHAR(100) ) , 1 , 12 ) ) ;
ERROR 23000: Duplicate entry '10' for key 'PRIMARY'
SELECT * FROM table0_bigint ORDER BY pk;
col_char_12_key	col_char_12	col_bigint_key	pk	col_bigint
8-9	8-9	32	-1018	8
-10	NULL	0	-100	NULL
99	99	NULL	-10	NULL
139	NULL	NULL	-9	NULL
0	NULL	0	-1	NULL
0	NULL	0	0	NULL
2	NULL	NULL	1	NULL
NULL	NULL	5	4	NULL
NULL	NULL	14	5	NULL
NULL	NULL	14	6	NULL
NULL	NULL	14	7	NULL
5	NULL	-9	8	NULL
NULL	5	32	9	9
NULL	NULL	32	10	10
NULL	NULL	5	13	NULL
NULL	NULL	5	32	NULL
NULL	NULL	NULL	43	NULL
8	NULL	NULL	60	NULL
NULL	1	32	67	-10
NULL	10	32	83	83
NULL	NULL	32	86	86
-300	NULL	32	91	1
NULL	9	158	99	99
NULL	NULL	14	111	NULL
NULL	NULL	123	123	123
NULL	NULL	152	125	NULL
5	0	NULL	144	1
-10	NULL	0	154	NULL
9	NULL	NULL	159	NULL
NULL	NULL	14	216	NULL
NULL	NULL	227	227	227
-90	NULL	0	232	4
SELECT 1 FROM table0_bigint WHERE pk IN ( 0 , -9 , 183 , 0 , 9 ) FOR UPDATE;
1
1
1
1
SELECT * FROM table0_bigint WHERE pk < ( SUBSTR( CAST( ( -10 ) AS CHAR(100) ) , 1 , 12 ) ) ORDER BY col_bigint_key , col_char_12_key , pk DESC LIMIT 3;
col_char_12_key	col_char_12	col_bigint_key	pk	col_bigint
-10	NULL	0	-100	NULL
8-9	8-9	32	-1018	8
UPDATE table0_bigint SET pk = SUBSTR( CAST( ( FLOOR ( 49 ) ) AS CHAR(100) ) , 1 , 12 ) WHERE pk BETWEEN SUBSTR( CAST( ( ROUND( -1 - 5 ) ) AS CHAR(100) ) , 1 , 12 ) AND SUBSTR( CAST( ( FLOOR ( -100 ) ) AS CHAR(100) ) , 1 , 12 ) ORDER BY col_bigint ASC , col_char_12_key ASC , pk  LIMIT 6 ;
SELECT * FROM table0_bigint ORDER BY pk;
col_char_12_key	col_char_12	col_bigint_key	pk	col_bigint
8-9	8-9	32	-1018	8
-10	NULL	0	-100	NULL
99	99	NULL	-10	NULL
139	NULL	NULL	-9	NULL
0	NULL	0	-1	NULL
0	NULL	0	0	NULL
2	NULL	NULL	1	NULL
NULL	NULL	5	4	NULL
NULL	NULL	14	5	NULL
NULL	NULL	14	6	NULL
NULL	NULL	14	7	NULL
5	NULL	-9	8	NULL
NULL	5	32	9	9
NULL	NULL	32	10	10
NULL	NULL	5	13	NULL
NULL	NULL	5	32	NULL
NULL	NULL	NULL	43	NULL
8	NULL	NULL	60	NULL
NULL	1	32	67	-10
NULL	10	32	83	83
NULL	NULL	32	86	86
-300	NULL	32	91	1
NULL	9	158	99	99
NULL	NULL	14	111	NULL
NULL	NULL	123	123	123
NULL	NULL	152	125	NULL
5	0	NULL	144	1
-10	NULL	0	154	NULL
9	NULL	NULL	159	NULL
NULL	NULL	14	216	NULL
NULL	NULL	227	227	227
-90	NULL	0	232	4
SELECT col_bigint_key FROM table0_bigint WHERE ( -688783360 , 43909120 , -316211200 ) IN ( ( SUBSTR( CAST( ( CEIL ( ROUND( -9 - -10 ) ) ) AS CHAR(100) ) , 1 , 12 ) , SUBSTR( CAST( ( LENGTH('XMHLF') ) AS CHAR(100) ) , 1 , 12 ) , SUBSTR( CAST( ( LENGTH('ZIQMR') ) AS CHAR(100) ) , 1 , 12 ) ) , ( SUBSTR( CAST( ( LENGTH( SUBSTR( CAST( ( LENGTH('ADIQP') ) AS CHAR(100) ) , 1 , 12 ) ) ) AS CHAR(100) ) , 1 , 12 ) , SUBSTR( CAST( ( ROUND( 10 * 198 ) ) AS CHAR(100) ) , 1 , 12 ) , SUBSTR( CAST( ( ROUND ( 1 ) ) AS CHAR(100) ) , 1 , 12 ) ) ) ORDER BY col_bigint_key , pk  LIMIT 5 , 1 /* RESULTSET_HAS_ZERO_OR_ONE_ROWS */;
col_bigint_key
SELECT UPPER( col_bigint_key ),pk FROM table0_bigint WHERE col_bigint != ( SUBSTR( CAST( ( 10 ) AS CHAR(100) ) , 1 , 12 ) ) GROUP BY col_bigint_key,pk ORDER BY col_bigint_key,pk LIMIT 2;
UPPER( col_bigint_key )	pk
NULL	144
0	232
SELECT 1 FROM table0_bigint WHERE SUBSTR( CAST( ( 0 ) AS CHAR(100) ) , 1 , 12 ) <> 99 FOR UPDATE;
1
1
1
1
1
1
1
1
1
1
1
1
1
1
1
1
1
1
1
1
1
1
1
1
1
1
1
1
1
1
1
1
1
SELECT ALL col_bigint,col_bigint_key,col_char_12,col_char_12_key,pk FROM table0_bigint ORDER BY col_char_12_key , col_bigint_key , col_char_12_key , pk ASC;
col_bigint	col_bigint_key	col_char_12	col_char_12_key	pk
NULL	NULL	NULL	NULL	43
NULL	5	NULL	NULL	4
NULL	5	NULL	NULL	13
NULL	5	NULL	NULL	32
NULL	14	NULL	NULL	5
NULL	14	NULL	NULL	6
NULL	14	NULL	NULL	7
NULL	14	NULL	NULL	111
NULL	14	NULL	NULL	216
9	32	5	NULL	9
10	32	NULL	NULL	10
-10	32	1	NULL	67
83	32	10	NULL	83
86	32	NULL	NULL	86
123	123	NULL	NULL	123
NULL	152	NULL	NULL	125
99	158	9	NULL	99
227	227	NULL	NULL	227
NULL	0	NULL	-10	-100
NULL	0	NULL	-10	154
1	32	NULL	-300	91
4	0	NULL	-90	232
NULL	0	NULL	0	-1
NULL	0	NULL	0	0
NULL	NULL	NULL	139	-9
NULL	NULL	NULL	2	1
1	NULL	0	5	144
NULL	-9	NULL	5	8
NULL	NULL	NULL	8	60
8	32	8-9	8-9	-1018
NULL	NULL	NULL	9	159
NULL	NULL	99	99	-10
SELECT UPPER( col_char_12 ) FROM table0_bigint WHERE col_char_12_key IN ( CAST(135 AS CHAR(100)) , CAST(0 AS CHAR(100)) , CAST(18 AS CHAR(100)) ) GROUP BY col_char_12 ORDER BY col_char_12 LIMIT 5 , 1 /* RESULTSET_HAS_ZERO_OR_ONE_ROWS */;
UPPER( col_char_12 )
INSERT INTO table0_bigint ( pk , col_char_12_key ) VALUES ( 1 , SUBSTR( CAST( ( LENGTH( SUBSTR( CAST( ( ROUND( FLOOR ( -1 ) - 1 ) ) AS CHAR(100) ) , 1 , 12 ) ) ) AS CHAR(100) ) , 1 , 12 ) ) ;
ERROR 23000: Duplicate entry '1' for key 'PRIMARY'
SELECT * FROM table0_bigint ORDER BY pk;
col_char_12_key	col_char_12	col_bigint_key	pk	col_bigint
8-9	8-9	32	-1018	8
-10	NULL	0	-100	NULL
99	99	NULL	-10	NULL
139	NULL	NULL	-9	NULL
0	NULL	0	-1	NULL
0	NULL	0	0	NULL
2	NULL	NULL	1	NULL
NULL	NULL	5	4	NULL
NULL	NULL	14	5	NULL
NULL	NULL	14	6	NULL
NULL	NULL	14	7	NULL
5	NULL	-9	8	NULL
NULL	5	32	9	9
NULL	NULL	32	10	10
NULL	NULL	5	13	NULL
NULL	NULL	5	32	NULL
NULL	NULL	NULL	43	NULL
8	NULL	NULL	60	NULL
NULL	1	32	67	-10
NULL	10	32	83	83
NULL	NULL	32	86	86
-300	NULL	32	91	1
NULL	9	158	99	99
NULL	NULL	14	111	NULL
NULL	NULL	123	123	123
NULL	NULL	152	125	NULL
5	0	NULL	144	1
-10	NULL	0	154	NULL
9	NULL	NULL	159	NULL
NULL	NULL	14	216	NULL
NULL	NULL	227	227	227
-90	NULL	0	232	4
SELECT pk FROM table0_bigint WHERE pk > 1839595520 and pk < 1839595520 ORDER BY pk LIMIT 5 /* RESULTSET_HAS_ZERO_OR_ONE_ROWS */;
pk
INSERT INTO table0_bigint (pk) VALUES ( -9 ) ;
ERROR 23000: Duplicate entry '-9' for key 'PRIMARY'
SELECT * FROM table0_bigint ORDER BY pk;
col_char_12_key	col_char_12	col_bigint_key	pk	col_bigint
8-9	8-9	32	-1018	8
-10	NULL	0	-100	NULL
99	99	NULL	-10	NULL
139	NULL	NULL	-9	NULL
0	NULL	0	-1	NULL
0	NULL	0	0	NULL
2	NULL	NULL	1	NULL
NULL	NULL	5	4	NULL
NULL	NULL	14	5	NULL
NULL	NULL	14	6	NULL
NULL	NULL	14	7	NULL
5	NULL	-9	8	NULL
NULL	5	32	9	9
NULL	NULL	32	10	10
NULL	NULL	5	13	NULL
NULL	NULL	5	32	NULL
NULL	NULL	NULL	43	NULL
8	NULL	NULL	60	NULL
NULL	1	32	67	-10
NULL	10	32	83	83
NULL	NULL	32	86	86
-300	NULL	32	91	1
NULL	9	158	99	99
NULL	NULL	14	111	NULL
NULL	NULL	123	123	123
NULL	NULL	152	125	NULL
5	0	NULL	144	1
-10	NULL	0	154	NULL
9	NULL	NULL	159	NULL
NULL	NULL	14	216	NULL
NULL	NULL	227	227	227
-90	NULL	0	232	4
SELECT pk , col_bigint_key FROM table0_bigint WHERE FLOOR ( -100 ) >= 254 ORDER BY pk LIMIT 4 , 2;
pk	col_bigint_key
SELECT COUNT( pk ) FROM table0_bigint WHERE col_bigint_key < ( SUBSTR( CAST( ( ROUND( 10 - -100 ) ) AS CHAR(100) ) , 1 , 12 ) ) ORDER BY col_bigint_key , col_char_12_key , pk DESC LIMIT 0 , 2 /* RESULTSET_HAS_ZERO_OR_ONE_ROWS */;
COUNT( pk )
21
SELECT col_char_12_key FROM table0_bigint WHERE col_bigint_key > LENGTH( SUBSTR( CAST( ( ROUND( 10 - 1 ) ) AS CHAR(100) ) , 1 , 12 ) ) ORDER BY col_bigint  , col_char_12_key DESC , pk ASC LIMIT 2 , 1 /* RESULTSET_HAS_ZERO_OR_ONE_ROWS */;
col_char_12_key
NULL
SELECT * FROM table0_bigint WHERE col_bigint >= ( SUBSTR( CAST( ( ROUND( 6 * 0 ) ) AS CHAR(100) ) , 1 , 12 ) ) ORDER BY pk LIMIT 7 , 8;
col_char_12_key	col_char_12	col_bigint_key	pk	col_bigint
NULL	NULL	123	123	123
5	0	NULL	144	1
NULL	NULL	227	227	227
-90	NULL	0	232	4
INSERT INTO table0_bigint ( pk , col_bigint_key ) VALUES ( 99, CAST( 100 AS CHAR(100)) ) , ( 10, CAST( -1 AS CHAR(100)) ) ;
ERROR 23000: Duplicate entry '99' for key 'PRIMARY'
SELECT * FROM table0_bigint ORDER BY pk;
col_char_12_key	col_char_12	col_bigint_key	pk	col_bigint
8-9	8-9	32	-1018	8
-10	NULL	0	-100	NULL
99	99	NULL	-10	NULL
139	NULL	NULL	-9	NULL
0	NULL	0	-1	NULL
0	NULL	0	0	NULL
2	NULL	NULL	1	NULL
NULL	NULL	5	4	NULL
NULL	NULL	14	5	NULL
NULL	NULL	14	6	NULL
NULL	NULL	14	7	NULL
5	NULL	-9	8	NULL
NULL	5	32	9	9
NULL	NULL	32	10	10
NULL	NULL	5	13	NULL
NULL	NULL	5	32	NULL
NULL	NULL	NULL	43	NULL
8	NULL	NULL	60	NULL
NULL	1	32	67	-10
NULL	10	32	83	83
NULL	NULL	32	86	86
-300	NULL	32	91	1
NULL	9	158	99	99
NULL	NULL	14	111	NULL
NULL	NULL	123	123	123
NULL	NULL	152	125	NULL
5	0	NULL	144	1
-10	NULL	0	154	NULL
9	NULL	NULL	159	NULL
NULL	NULL	14	216	NULL
NULL	NULL	227	227	227
-90	NULL	0	232	4
SELECT col_bigint,col_bigint_key,col_char_12,col_char_12_key,pk FROM table0_bigint WHERE col_bigint_key IN ( CAST(44 AS CHAR(100)) , CAST(99 AS CHAR(100)) , CAST(-10 AS CHAR(100)) ) GROUP BY col_bigint,col_bigint_key,col_char_12,col_char_12_key,pk ORDER BY col_bigint,col_bigint_key,col_char_12,col_char_12_key,pk LIMIT 7 , 1;
col_bigint	col_bigint_key	col_char_12	col_char_12_key	pk
SELECT col_char_12_key FROM table0_bigint WHERE col_char_12_key <= ( SUBSTR( CAST( ( ROUND( 4 * 99 ) ) AS CHAR(100) ) , 1 , 12 ) ) AND col_bigint_key = ( SUBSTR( CAST( ( ROUND( ROUND( 1 * 99 ) + 0 ) ) AS CHAR(100) ) , 1 , 12 ) ) ORDER BY col_bigint ASC , pk DESC LIMIT 8 , 1 /* RESULTSET_HAS_ZERO_OR_ONE_ROWS */;
col_char_12_key
SELECT UPPER( col_char_12_key ) FROM table0_bigint WHERE LENGTH('QTOCU') > SUBSTR( CAST( ( LENGTH('USZFN') ) AS CHAR(100) ) , 1 , 12 ) GROUP BY col_char_12_key ORDER BY col_char_12_key LIMIT 7 , 3;
UPPER( col_char_12_key )
SELECT pk FROM table0_bigint WHERE col_bigint_key < CAST(2 AS CHAR(100)) ORDER BY pk LIMIT 1 , 1 /* RESULTSET_HAS_ZERO_OR_ONE_ROWS */;
pk
-1
SELECT 1 FROM table0_bigint WHERE LENGTH( SUBSTR( CAST( ( ROUND( LENGTH( SUBSTR( CAST( ( SIGN ( -1 ) ) AS CHAR(100) ) , 1 , 12 ) ) - 10 ) ) AS CHAR(100) ) , 1 , 12 ) ) <= ROUND( 0 * -1 ) FOR UPDATE;
1
SELECT * FROM table0_bigint WHERE ( -12189696 , 1658257408 , 1670381568 ) NOT IN ( ( SUBSTR( CAST( ( FLOOR ( -100 ) ) AS CHAR(100) ) , 1 , 12 ) , SUBSTR( CAST( ( -9 ) AS CHAR(100) ) , 1 , 12 ) , SUBSTR( CAST( ( ROUND( CEIL ( 5 ) - -9 ) ) AS CHAR(100) ) , 1 , 12 ) ) , ( SUBSTR( CAST( ( SIGN ( LENGTH( SUBSTR( CAST( ( ROUND( 1 + CEIL ( LENGTH( SUBSTR( CAST( ( LENGTH('JFBJK') ) AS CHAR(100) ) , 1 , 12 ) ) ) ) ) AS CHAR(100) ) , 1 , 12 ) ) ) ) AS CHAR(100) ) , 1 , 12 ) , SUBSTR( CAST( ( -1 ) AS CHAR(100) ) , 1 , 12 ) , SUBSTR( CAST( ( ROUND( CEIL ( FLOOR ( 1 ) ) + 1 ) ) AS CHAR(100) ) , 1 , 12 ) ) ) ORDER BY pk,pk  , pk  LIMIT 3 , 1;
col_char_12_key	col_char_12	col_bigint_key	pk	col_bigint
139	NULL	NULL	-9	NULL
SELECT DISTINCT 9999 FROM table0_bigint ORDER BY col_bigint_key  , pk DESC;
9999
9999
INSERT INTO table0_bigint ( pk , col_bigint_key ) VALUES ( 10, CAST( 0 AS CHAR(100)) ) , ( 8, CAST( -1 AS CHAR(100)) ) ;
ERROR 23000: Duplicate entry '10' for key 'PRIMARY'
SELECT * FROM table0_bigint ORDER BY pk;
col_char_12_key	col_char_12	col_bigint_key	pk	col_bigint
8-9	8-9	32	-1018	8
-10	NULL	0	-100	NULL
99	99	NULL	-10	NULL
139	NULL	NULL	-9	NULL
0	NULL	0	-1	NULL
0	NULL	0	0	NULL
2	NULL	NULL	1	NULL
NULL	NULL	5	4	NULL
NULL	NULL	14	5	NULL
NULL	NULL	14	6	NULL
NULL	NULL	14	7	NULL
5	NULL	-9	8	NULL
NULL	5	32	9	9
NULL	NULL	32	10	10
NULL	NULL	5	13	NULL
NULL	NULL	5	32	NULL
NULL	NULL	NULL	43	NULL
8	NULL	NULL	60	NULL
NULL	1	32	67	-10
NULL	10	32	83	83
NULL	NULL	32	86	86
-300	NULL	32	91	1
NULL	9	158	99	99
NULL	NULL	14	111	NULL
NULL	NULL	123	123	123
NULL	NULL	152	125	NULL
5	0	NULL	144	1
-10	NULL	0	154	NULL
9	NULL	NULL	159	NULL
NULL	NULL	14	216	NULL
NULL	NULL	227	227	227
-90	NULL	0	232	4
SELECT col_bigint_key FROM table0_bigint  ORDER BY col_bigint_key , pk DESC LIMIT 175 , 1 /* RESULTSET_HAS_ZERO_OR_ONE_ROWS */;
col_bigint_key
SELECT COUNT( col_char_12 ) FROM table0_bigint WHERE pk IN ( SUBSTR( CAST( ( CEIL ( ROUND ( FLOOR ( ROUND( 0 + LENGTH('CASNT') ) ) ) ) ) AS CHAR(100) ) , 1 , 12 ) , SUBSTR( CAST( ( FLOOR ( FLOOR ( 42 ) ) ) AS CHAR(100) ) , 1 , 12 ) , SUBSTR( CAST( ( ROUND( 10 * -9 ) ) AS CHAR(100) ) , 1 , 12 ) , SUBSTR( CAST( ( ROUND( ROUND( -9 * 99 ) + -1 ) ) AS CHAR(100) ) , 1 , 12 ) , SUBSTR( CAST( ( LENGTH( SUBSTR( CAST( ( CEIL ( FLOOR ( 1 ) ) ) AS CHAR(100) ) , 1 , 12 ) ) ) AS CHAR(100) ) , 1 , 12 ) ) ORDER BY col_bigint_key , col_bigint_key , col_bigint_key , pk ASC LIMIT 1 , 1 /* RESULTSET_HAS_ZERO_OR_ONE_ROWS */;
COUNT( col_char_12 )
SELECT col_char_12_key FROM table0_bigint WHERE pk NOT IN ( 10 , -100 , -9 , 17 , 10 ) ORDER BY col_bigint_key ASC , col_char_12 DESC , pk  LIMIT 3 , 4;
col_char_12_key
NULL
8
9
5
INSERT INTO table0_bigint ( pk , col_bigint, col_char_12 ) VALUES ( 99 , SUBSTR( CAST( ( LENGTH( SUBSTR( CAST( ( ROUND( 8 * 9 ) ) AS CHAR(100) ) , 1 , 12 ) ) ) AS CHAR(100) ) , 1 , 12 ) , SUBSTR( CAST( ( ROUND( 229 - FLOOR ( -1 ) ) ) AS CHAR(100) ) , 1 , 12 ) ) ;
ERROR 23000: Duplicate entry '99' for key 'PRIMARY'
SELECT * FROM table0_bigint ORDER BY pk;
col_char_12_key	col_char_12	col_bigint_key	pk	col_bigint
8-9	8-9	32	-1018	8
-10	NULL	0	-100	NULL
99	99	NULL	-10	NULL
139	NULL	NULL	-9	NULL
0	NULL	0	-1	NULL
0	NULL	0	0	NULL
2	NULL	NULL	1	NULL
NULL	NULL	5	4	NULL
NULL	NULL	14	5	NULL
NULL	NULL	14	6	NULL
NULL	NULL	14	7	NULL
5	NULL	-9	8	NULL
NULL	5	32	9	9
NULL	NULL	32	10	10
NULL	NULL	5	13	NULL
NULL	NULL	5	32	NULL
NULL	NULL	NULL	43	NULL
8	NULL	NULL	60	NULL
NULL	1	32	67	-10
NULL	10	32	83	83
NULL	NULL	32	86	86
-300	NULL	32	91	1
NULL	9	158	99	99
NULL	NULL	14	111	NULL
NULL	NULL	123	123	123
NULL	NULL	152	125	NULL
5	0	NULL	144	1
-10	NULL	0	154	NULL
9	NULL	NULL	159	NULL
NULL	NULL	14	216	NULL
NULL	NULL	227	227	227
-90	NULL	0	232	4
SELECT COUNT( col_bigint ) FROM table0_bigint WHERE NOT ( col_char_12 > SUBSTR( CAST( ( ROUND( CEIL ( 253 ) * 9 ) ) AS CHAR(100) ) , 1 , 12 ) ) OR NOT ( col_char_12 != SUBSTR( CAST( ( SIGN ( 99 ) ) AS CHAR(100) ) , 1 , 12 ) ) AND NOT ( col_bigint >= SUBSTR( CAST( ( 6 ) AS CHAR(100) ) , 1 , 12 ) ) ORDER BY pk LIMIT 2 /* RESULTSET_HAS_ZERO_OR_ONE_ROWS */;
COUNT( col_bigint )
3
SELECT col_bigint,col_bigint_key,col_char_12,col_char_12_key,pk FROM table0_bigint WHERE ( 1196163072 , 1124401152 , -1166213120 , -1144061952 , -2020409344 ) IN ( ( SUBSTR( CAST( ( SIGN ( LENGTH('ZTPVR') ) ) AS CHAR(100) ) , 1 , 12 ) , SUBSTR( CAST( ( ROUND( 1 + 10 ) ) AS CHAR(100) ) , 1 , 12 ) , SUBSTR( CAST( ( LENGTH( SUBSTR( CAST( ( ABS ( CEIL ( -1 ) ) ) AS CHAR(100) ) , 1 , 12 ) ) ) AS CHAR(100) ) , 1 , 12 ) , SUBSTR( CAST( ( CEIL ( ROUND( 0 * CEIL ( LENGTH( SUBSTR( CAST( ( ROUND( 3 * 10 ) ) AS CHAR(100) ) , 1 , 12 ) ) ) ) ) ) AS CHAR(100) ) , 1 , 12 ) , SUBSTR( CAST( ( ABS ( 9 ) ) AS CHAR(100) ) , 1 , 12 ) ) ) ORDER BY col_bigint_key , col_char_12,pk ASC , pk DESC LIMIT 7 , 1 /* RESULTSET_HAS_ZERO_OR_ONE_ROWS */;
col_bigint	col_bigint_key	col_char_12	col_char_12_key	pk
UPDATE table0_bigint SET col_bigint = pk WHERE ( 1648164864 , 412549120 , 1753612288 ) NOT IN ( ( SUBSTR( CAST( ( ROUND( 212 - ROUND( 10 + 203 ) ) ) AS CHAR(100) ) , 1 , 12 ) , SUBSTR( CAST( ( ROUND( 70 - LENGTH( SUBSTR( CAST( ( ROUND ( 3 ) ) AS CHAR(100) ) , 1 , 12 ) ) ) ) AS CHAR(100) ) , 1 , 12 ) , SUBSTR( CAST( ( 0 ) AS CHAR(100) ) , 1 , 12 ) ) , ( SUBSTR( CAST( ( LENGTH('RTFQH') ) AS CHAR(100) ) , 1 , 12 ) , SUBSTR( CAST( ( LENGTH('PWKXO') ) AS CHAR(100) ) , 1 , 12 ) , SUBSTR( CAST( ( LENGTH( SUBSTR( CAST( ( CEIL ( 0 ) ) AS CHAR(100) ) , 1 , 12 ) ) ) AS CHAR(100) ) , 1 , 12 ) ) ) ORDER BY pk LIMIT 4 ;
SELECT * FROM table0_bigint ORDER BY pk;
col_char_12_key	col_char_12	col_bigint_key	pk	col_bigint
8-9	8-9	32	-1018	-1018
-10	NULL	0	-100	-100
99	99	NULL	-10	-10
139	NULL	NULL	-9	-9
0	NULL	0	-1	NULL
0	NULL	0	0	NULL
2	NULL	NULL	1	NULL
NULL	NULL	5	4	NULL
NULL	NULL	14	5	NULL
NULL	NULL	14	6	NULL
NULL	NULL	14	7	NULL
5	NULL	-9	8	NULL
NULL	5	32	9	9
NULL	NULL	32	10	10
NULL	NULL	5	13	NULL
NULL	NULL	5	32	NULL
NULL	NULL	NULL	43	NULL
8	NULL	NULL	60	NULL
NULL	1	32	67	-10
NULL	10	32	83	83
NULL	NULL	32	86	86
-300	NULL	32	91	1
NULL	9	158	99	99
NULL	NULL	14	111	NULL
NULL	NULL	123	123	123
NULL	NULL	152	125	NULL
5	0	NULL	144	1
-10	NULL	0	154	NULL
9	NULL	NULL	159	NULL
NULL	NULL	14	216	NULL
NULL	NULL	227	227	227
-90	NULL	0	232	4
SELECT UPPER( col_char_12_key ),pk FROM table0_bigint WHERE col_bigint_key NOT IN ( SUBSTR( CAST( ( ROUND( 10 + -10 ) ) AS CHAR(100) ) , 1 , 12 ) , SUBSTR( CAST( ( LENGTH('ICFMK') ) AS CHAR(100) ) , 1 , 12 ) , SUBSTR( CAST( ( ROUND( 99 * ROUND( -10 + 99 ) ) ) AS CHAR(100) ) , 1 , 12 ) , SUBSTR( CAST( ( ROUND( ROUND( -9 - 10 ) * 9 ) ) AS CHAR(100) ) , 1 , 12 ) , SUBSTR( CAST( ( ROUND( -9 + LENGTH('KHJAQ') ) ) AS CHAR(100) ) , 1 , 12 ) ) GROUP BY col_char_12_key,pk ORDER BY col_char_12_key,pk LIMIT 6 , 8;
UPPER( col_char_12_key )	pk
NULL	83
NULL	86
NULL	99
NULL	111
NULL	123
NULL	125
NULL	216
NULL	227
SELECT COUNT( col_char_12_key ) FROM table0_bigint WHERE ABS ( 9 ) <= ABS ( ROUND( 99 - LENGTH( SUBSTR( CAST( ( FLOOR ( 118 ) ) AS CHAR(100) ) , 1 , 12 ) ) ) ) ORDER BY pk,pk DESC , pk DESC LIMIT 8 , 8 /* RESULTSET_HAS_ZERO_OR_ONE_ROWS */;
COUNT( col_char_12_key )
SELECT * FROM table0_bigint WHERE  ( col_bigint_key >= SUBSTR( CAST( ( LENGTH('PMKRW') ) AS CHAR(100) ) , 1 , 12 ) ) AND  ( col_bigint > SUBSTR( CAST( ( ROUND( -10 * 0 ) ) AS CHAR(100) ) , 1 , 12 ) ) OR NOT ( pk <> SUBSTR( CAST( ( ROUND( 110 * 0 ) ) AS CHAR(100) ) , 1 , 12 ) ) ORDER BY col_bigint_key , col_char_12_key , col_char_12_key , pk  LIMIT 0 , 4;
col_char_12_key	col_char_12	col_bigint_key	pk	col_bigint
0	NULL	0	0	NULL
NULL	5	32	9	9
NULL	NULL	32	10	10
NULL	10	32	83	83
SELECT col_bigint,col_bigint_key,col_char_12,col_char_12_key,pk FROM table0_bigint WHERE LENGTH('HVDCF') < LENGTH('CUOOP') GROUP BY col_bigint,col_bigint_key,col_char_12,col_char_12_key,pk ORDER BY col_bigint,col_bigint_key,col_char_12,col_char_12_key,pk LIMIT 2;
col_bigint	col_bigint_key	col_char_12	col_char_12_key	pk
INSERT INTO table0_bigint ( pk , col_bigint, col_char_12_key ) VALUES ( 4 , SUBSTR( CAST( ( 99 ) AS CHAR(100) ) , 1 , 12 ) , SUBSTR( CAST( ( FLOOR ( 119 ) ) AS CHAR(100) ) , 1 , 12 ) ) ;
ERROR 23000: Duplicate entry '4' for key 'PRIMARY'
SELECT * FROM table0_bigint ORDER BY pk;
col_char_12_key	col_char_12	col_bigint_key	pk	col_bigint
8-9	8-9	32	-1018	-1018
-10	NULL	0	-100	-100
99	99	NULL	-10	-10
139	NULL	NULL	-9	-9
0	NULL	0	-1	NULL
0	NULL	0	0	NULL
2	NULL	NULL	1	NULL
NULL	NULL	5	4	NULL
NULL	NULL	14	5	NULL
NULL	NULL	14	6	NULL
NULL	NULL	14	7	NULL
5	NULL	-9	8	NULL
NULL	5	32	9	9
NULL	NULL	32	10	10
NULL	NULL	5	13	NULL
NULL	NULL	5	32	NULL
NULL	NULL	NULL	43	NULL
8	NULL	NULL	60	NULL
NULL	1	32	67	-10
NULL	10	32	83	83
NULL	NULL	32	86	86
-300	NULL	32	91	1
NULL	9	158	99	99
NULL	NULL	14	111	NULL
NULL	NULL	123	123	123
NULL	NULL	152	125	NULL
5	0	NULL	144	1
-10	NULL	0	154	NULL
9	NULL	NULL	159	NULL
NULL	NULL	14	216	NULL
NULL	NULL	227	227	227
-90	NULL	0	232	4
SELECT * FROM table0_bigint WHERE col_bigint_key IN ( SUBSTR( CAST( ( SIGN ( 3 ) ) AS CHAR(100) ) , 1 , 12 ) , SUBSTR( CAST( ( FLOOR ( 10 ) ) AS CHAR(100) ) , 1 , 12 ) , SUBSTR( CAST( ( LENGTH('ASOTM') ) AS CHAR(100) ) , 1 , 12 ) , SUBSTR( CAST( ( ABS ( CEIL ( -1 ) ) ) AS CHAR(100) ) , 1 , 12 ) , SUBSTR( CAST( ( ROUND( 134 - 8 ) ) AS CHAR(100) ) , 1 , 12 ) ) ORDER BY col_char_12_key  , pk  LIMIT 3;
col_char_12_key	col_char_12	col_bigint_key	pk	col_bigint
NULL	NULL	5	4	NULL
NULL	NULL	5	13	NULL
NULL	NULL	5	32	NULL
INSERT INTO table0_bigint ( pk , col_char_12_key ) VALUES ( -10, CAST( -1 AS CHAR(100)) ) , ( 0, CAST( 1 AS CHAR(100)) ) ;
ERROR 23000: Duplicate entry '-10' for key 'PRIMARY'
SELECT * FROM table0_bigint ORDER BY pk;
col_char_12_key	col_char_12	col_bigint_key	pk	col_bigint
8-9	8-9	32	-1018	-1018
-10	NULL	0	-100	-100
99	99	NULL	-10	-10
139	NULL	NULL	-9	-9
0	NULL	0	-1	NULL
0	NULL	0	0	NULL
2	NULL	NULL	1	NULL
NULL	NULL	5	4	NULL
NULL	NULL	14	5	NULL
NULL	NULL	14	6	NULL
NULL	NULL	14	7	NULL
5	NULL	-9	8	NULL
NULL	5	32	9	9
NULL	NULL	32	10	10
NULL	NULL	5	13	NULL
NULL	NULL	5	32	NULL
NULL	NULL	NULL	43	NULL
8	NULL	NULL	60	NULL
NULL	1	32	67	-10
NULL	10	32	83	83
NULL	NULL	32	86	86
-300	NULL	32	91	1
NULL	9	158	99	99
NULL	NULL	14	111	NULL
NULL	NULL	123	123	123
NULL	NULL	152	125	NULL
5	0	NULL	144	1
-10	NULL	0	154	NULL
9	NULL	NULL	159	NULL
NULL	NULL	14	216	NULL
NULL	NULL	227	227	227
-90	NULL	0	232	4
SELECT col_bigint_key FROM table0_bigint WHERE  ( col_bigint_key < SUBSTR( CAST( ( LENGTH( SUBSTR( CAST( ( ROUND( ROUND( -100 * 9 ) - 6 ) ) AS CHAR(100) ) , 1 , 12 ) ) ) AS CHAR(100) ) , 1 , 12 ) ) OR NOT ( col_char_12 != SUBSTR( CAST( ( ABS ( ABS ( SIGN ( ROUND( 132 * -1 ) ) ) ) ) AS CHAR(100) ) , 1 , 12 ) ) ORDER BY col_bigint_key , pk  LIMIT 1 /* RESULTSET_HAS_ZERO_OR_ONE_ROWS */;
col_bigint_key
-9
SELECT 1 FROM table0_bigint WHERE 9 <> -100 FOR UPDATE;
1
1
1
1
1
1
1
1
1
1
1
1
1
1
1
1
1
1
1
1
1
1
1
1
1
1
1
1
1
1
1
1
1
SELECT UPPER( pk ) FROM table0_bigint WHERE ( 733413376 , 895811584 , 2115239936 , -1784348672 ) IN ( ( SUBSTR( CAST( ( ROUND( FLOOR ( SIGN ( 198 ) ) * 0 ) ) AS CHAR(100) ) , 1 , 12 ) , SUBSTR( CAST( ( ROUND ( 8 ) ) AS CHAR(100) ) , 1 , 12 ) , SUBSTR( CAST( ( 79 ) AS CHAR(100) ) , 1 , 12 ) , SUBSTR( CAST( ( -100 ) AS CHAR(100) ) , 1 , 12 ) ) ) GROUP BY pk ORDER BY pk LIMIT 2;
UPPER( pk )
SELECT col_bigint , col_char_12_key FROM table0_bigint  ORDER BY col_char_12_key , col_bigint_key , pk  LIMIT 53 , 1 /* RESULTSET_HAS_ZERO_OR_ONE_ROWS */;
col_bigint	col_char_12_key
INSERT INTO table0_bigint ( pk , col_bigint_key ) VALUES ( -100 , SUBSTR( CAST( ( ROUND( 0 - ROUND ( FLOOR ( ROUND( 10 - -10 ) ) ) ) ) AS CHAR(100) ) , 1 , 12 ) ) ;
ERROR 23000: Duplicate entry '-100' for key 'PRIMARY'
SELECT * FROM table0_bigint ORDER BY pk;
col_char_12_key	col_char_12	col_bigint_key	pk	col_bigint
8-9	8-9	32	-1018	-1018
-10	NULL	0	-100	-100
99	99	NULL	-10	-10
139	NULL	NULL	-9	-9
0	NULL	0	-1	NULL
0	NULL	0	0	NULL
2	NULL	NULL	1	NULL
NULL	NULL	5	4	NULL
NULL	NULL	14	5	NULL
NULL	NULL	14	6	NULL
NULL	NULL	14	7	NULL
5	NULL	-9	8	NULL
NULL	5	32	9	9
NULL	NULL	32	10	10
NULL	NULL	5	13	NULL
NULL	NULL	5	32	NULL
NULL	NULL	NULL	43	NULL
8	NULL	NULL	60	NULL
NULL	1	32	67	-10
NULL	10	32	83	83
NULL	NULL	32	86	86
-300	NULL	32	91	1
NULL	9	158	99	99
NULL	NULL	14	111	NULL
NULL	NULL	123	123	123
NULL	NULL	152	125	NULL
5	0	NULL	144	1
-10	NULL	0	154	NULL
9	NULL	NULL	159	NULL
NULL	NULL	14	216	NULL
NULL	NULL	227	227	227
-90	NULL	0	232	4
INSERT INTO table0_bigint ( pk , col_char_12_key ) VALUES ( 9, CAST( 1 AS CHAR(100)) ) , ( -1, CAST( 10 AS CHAR(100)) ) ;
ERROR 23000: Duplicate entry '9' for key 'PRIMARY'
SELECT * FROM table0_bigint ORDER BY pk;
col_char_12_key	col_char_12	col_bigint_key	pk	col_bigint
8-9	8-9	32	-1018	-1018
-10	NULL	0	-100	-100
99	99	NULL	-10	-10
139	NULL	NULL	-9	-9
0	NULL	0	-1	NULL
0	NULL	0	0	NULL
2	NULL	NULL	1	NULL
NULL	NULL	5	4	NULL
NULL	NULL	14	5	NULL
NULL	NULL	14	6	NULL
NULL	NULL	14	7	NULL
5	NULL	-9	8	NULL
NULL	5	32	9	9
NULL	NULL	32	10	10
NULL	NULL	5	13	NULL
NULL	NULL	5	32	NULL
NULL	NULL	NULL	43	NULL
8	NULL	NULL	60	NULL
NULL	1	32	67	-10
NULL	10	32	83	83
NULL	NULL	32	86	86
-300	NULL	32	91	1
NULL	9	158	99	99
NULL	NULL	14	111	NULL
NULL	NULL	123	123	123
NULL	NULL	152	125	NULL
5	0	NULL	144	1
-10	NULL	0	154	NULL
9	NULL	NULL	159	NULL
NULL	NULL	14	216	NULL
NULL	NULL	227	227	227
-90	NULL	0	232	4
SELECT col_bigint,col_bigint_key,col_char_12,col_char_12_key,pk FROM table0_bigint WHERE 10 = -100 GROUP BY col_bigint,col_bigint_key,col_char_12,col_char_12_key,pk ORDER BY col_bigint,col_bigint_key,col_char_12,col_char_12_key,pk LIMIT 8;
col_bigint	col_bigint_key	col_char_12	col_char_12_key	pk
SELECT col_char_12_key FROM table0_bigint WHERE ( 2080636928 , 992542720 , 1237385216 , 1414594560 ) NOT IN ( ( SUBSTR( CAST( ( LENGTH('FKGSQ') ) AS CHAR(100) ) , 1 , 12 ) , SUBSTR( CAST( ( ROUND( ROUND( -10 * ROUND( ROUND( ROUND( 0 - 1 ) * -1 ) + -1 ) ) * 99 ) ) AS CHAR(100) ) , 1 , 12 ) , SUBSTR( CAST( ( ROUND( 1 - -1 ) ) AS CHAR(100) ) , 1 , 12 ) , SUBSTR( CAST( ( LENGTH('YUMDV') ) AS CHAR(100) ) , 1 , 12 ) ) ) ORDER BY pk LIMIT 9 , 1 /* RESULTSET_HAS_ZERO_OR_ONE_ROWS */;
col_char_12_key
NULL
SELECT pk , col_char_12_key FROM table0_bigint WHERE ( -463470592 , 299630592 ) IN ( ( SUBSTR( CAST( ( LENGTH('BMTLZ') ) AS CHAR(100) ) , 1 , 12 ) , SUBSTR( CAST( ( ROUND( -1 * 1 ) ) AS CHAR(100) ) , 1 , 12 ) ) , ( SUBSTR( CAST( ( LENGTH( SUBSTR( CAST( ( ROUND( LENGTH( SUBSTR( CAST( ( ROUND( 6 * 99 ) ) AS CHAR(100) ) , 1 , 12 ) ) + 9 ) ) AS CHAR(100) ) , 1 , 12 ) ) ) AS CHAR(100) ) , 1 , 12 ) , SUBSTR( CAST( ( FLOOR ( 8 ) ) AS CHAR(100) ) , 1 , 12 ) ) ) ORDER BY col_char_12_key , col_char_12_key , pk  LIMIT 1 /* RESULTSET_HAS_ZERO_OR_ONE_ROWS */;
pk	col_char_12_key
SELECT ALL FALSE FROM table0_bigint ORDER BY col_bigint_key  , col_char_12  , pk DESC;
FALSE
0
0
0
0
0
0
0
0
0
0
0
0
0
0
0
0
0
0
0
0
0
0
0
0
0
0
0
0
0
0
0
0
SELECT COUNT( pk ) FROM table0_bigint WHERE LENGTH( SUBSTR( CAST( ( ROUND( 9 - 1 ) ) AS CHAR(100) ) , 1 , 12 ) ) != -100 ORDER BY col_char_12_key , col_char_12_key , col_bigint_key , pk DESC LIMIT 2 /* RESULTSET_HAS_ZERO_OR_ONE_ROWS */;
COUNT( pk )
32
UPDATE table0_bigint SET col_char_12_key = col_char_12_key WHERE col_bigint_key != -9 ORDER BY col_bigint_key , col_char_12_key , col_char_12_key , pk  LIMIT 2 ;
SELECT * FROM table0_bigint ORDER BY pk;
col_char_12_key	col_char_12	col_bigint_key	pk	col_bigint
8-9	8-9	32	-1018	-1018
-10	NULL	0	-100	-100
99	99	NULL	-10	-10
139	NULL	NULL	-9	-9
0	NULL	0	-1	NULL
0	NULL	0	0	NULL
2	NULL	NULL	1	NULL
NULL	NULL	5	4	NULL
NULL	NULL	14	5	NULL
NULL	NULL	14	6	NULL
NULL	NULL	14	7	NULL
5	NULL	-9	8	NULL
NULL	5	32	9	9
NULL	NULL	32	10	10
NULL	NULL	5	13	NULL
NULL	NULL	5	32	NULL
NULL	NULL	NULL	43	NULL
8	NULL	NULL	60	NULL
NULL	1	32	67	-10
NULL	10	32	83	83
NULL	NULL	32	86	86
-300	NULL	32	91	1
NULL	9	158	99	99
NULL	NULL	14	111	NULL
NULL	NULL	123	123	123
NULL	NULL	152	125	NULL
5	0	NULL	144	1
-10	NULL	0	154	NULL
9	NULL	NULL	159	NULL
NULL	NULL	14	216	NULL
NULL	NULL	227	227	227
-90	NULL	0	232	4
SELECT UPPER( col_char_12 ) FROM table0_bigint WHERE LENGTH( SUBSTR( CAST( ( ROUND ( 234 ) ) AS CHAR(100) ) , 1 , 12 ) ) != col_bigint GROUP BY col_char_12 ORDER BY col_char_12 LIMIT 8 , 1 /* RESULTSET_HAS_ZERO_OR_ONE_ROWS */;
UPPER( col_char_12 )
SELECT col_bigint , col_char_12_key FROM table0_bigint  ORDER BY col_bigint_key ASC , col_char_12  , pk ASC LIMIT 1 /* RESULTSET_HAS_ZERO_OR_ONE_ROWS */;
col_bigint	col_char_12_key
-9	139
INSERT INTO table0_bigint ( pk , col_char_12_key ) VALUES ( -100, CAST( -9 AS CHAR(100)) ) , ( 9, CAST( -100 AS CHAR(100)) ) ;
ERROR 23000: Duplicate entry '-100' for key 'PRIMARY'
SELECT * FROM table0_bigint ORDER BY pk;
col_char_12_key	col_char_12	col_bigint_key	pk	col_bigint
8-9	8-9	32	-1018	-1018
-10	NULL	0	-100	-100
99	99	NULL	-10	-10
139	NULL	NULL	-9	-9
0	NULL	0	-1	NULL
0	NULL	0	0	NULL
2	NULL	NULL	1	NULL
NULL	NULL	5	4	NULL
NULL	NULL	14	5	NULL
NULL	NULL	14	6	NULL
NULL	NULL	14	7	NULL
5	NULL	-9	8	NULL
NULL	5	32	9	9
NULL	NULL	32	10	10
NULL	NULL	5	13	NULL
NULL	NULL	5	32	NULL
NULL	NULL	NULL	43	NULL
8	NULL	NULL	60	NULL
NULL	1	32	67	-10
NULL	10	32	83	83
NULL	NULL	32	86	86
-300	NULL	32	91	1
NULL	9	158	99	99
NULL	NULL	14	111	NULL
NULL	NULL	123	123	123
NULL	NULL	152	125	NULL
5	0	NULL	144	1
-10	NULL	0	154	NULL
9	NULL	NULL	159	NULL
NULL	NULL	14	216	NULL
NULL	NULL	227	227	227
-90	NULL	0	232	4
SELECT * FROM table0_bigint WHERE 1 = SIGN ( -100 ) ORDER BY col_bigint_key ASC , col_char_12 ASC , pk DESC LIMIT 7 , 6;
col_char_12_key	col_char_12	col_bigint_key	pk	col_bigint
INSERT INTO table0_bigint (pk) VALUES ( 28 ) ;
SELECT * FROM table0_bigint ORDER BY pk;
col_char_12_key	col_char_12	col_bigint_key	pk	col_bigint
8-9	8-9	32	-1018	-1018
-10	NULL	0	-100	-100
99	99	NULL	-10	-10
139	NULL	NULL	-9	-9
0	NULL	0	-1	NULL
0	NULL	0	0	NULL
2	NULL	NULL	1	NULL
NULL	NULL	5	4	NULL
NULL	NULL	14	5	NULL
NULL	NULL	14	6	NULL
NULL	NULL	14	7	NULL
5	NULL	-9	8	NULL
NULL	5	32	9	9
NULL	NULL	32	10	10
NULL	NULL	5	13	NULL
NULL	NULL	NULL	28	NULL
NULL	NULL	5	32	NULL
NULL	NULL	NULL	43	NULL
8	NULL	NULL	60	NULL
NULL	1	32	67	-10
NULL	10	32	83	83
NULL	NULL	32	86	86
-300	NULL	32	91	1
NULL	9	158	99	99
NULL	NULL	14	111	NULL
NULL	NULL	123	123	123
NULL	NULL	152	125	NULL
5	0	NULL	144	1
-10	NULL	0	154	NULL
9	NULL	NULL	159	NULL
NULL	NULL	14	216	NULL
NULL	NULL	227	227	227
-90	NULL	0	232	4
SELECT col_bigint,col_bigint_key,col_char_12,col_char_12_key,pk FROM table0_bigint WHERE col_bigint_key BETWEEN CAST( 4 AS CHAR(100) ) AND CAST( 8 AS CHAR(100) ) GROUP BY col_bigint,col_bigint_key,col_char_12,col_char_12_key,pk ORDER BY col_bigint,col_bigint_key,col_char_12,col_char_12_key,pk LIMIT 2 , 1;
col_bigint	col_bigint_key	col_char_12	col_char_12_key	pk
NULL	5	NULL	NULL	32
SELECT 1 FROM table0_bigint WHERE col_bigint IN ( SUBSTR( CAST( ( ABS ( ROUND( 99 - ROUND ( 9 ) ) ) ) AS CHAR(100) ) , 1 , 12 ) , SUBSTR( CAST( ( ROUND( -10 + ROUND( 10 + FLOOR ( 0 ) ) ) ) AS CHAR(100) ) , 1 , 12 ) , SUBSTR( CAST( ( FLOOR ( SIGN ( 99 ) ) ) AS CHAR(100) ) , 1 , 12 ) , SUBSTR( CAST( ( CEIL ( LENGTH('AAFBH') ) ) AS CHAR(100) ) , 1 , 12 ) , SUBSTR( CAST( ( ROUND( -9 - 10 ) ) AS CHAR(100) ) , 1 , 12 ) ) FOR UPDATE;
1
1
1
SELECT * FROM table0_bigint WHERE col_char_12_key BETWEEN CAST( 1 AS CHAR(100) ) AND CAST( 5 AS CHAR(100) ) ORDER BY col_bigint,col_bigint_key,col_char_12,col_char_12_key,pk,pk  , pk  LIMIT 9 , 1;
col_char_12_key	col_char_12	col_bigint_key	pk	col_bigint
SELECT * FROM table0_bigint WHERE pk <> ( SUBSTR( CAST( ( LENGTH( SUBSTR( CAST( ( ROUND ( -1 ) ) AS CHAR(100) ) , 1 , 12 ) ) ) AS CHAR(100) ) , 1 , 12 ) ) ORDER BY col_char_12_key , col_char_12_key , pk  LIMIT 7 , 7;
col_char_12_key	col_char_12	col_bigint_key	pk	col_bigint
NULL	NULL	NULL	28	NULL
NULL	NULL	5	32	NULL
NULL	NULL	NULL	43	NULL
NULL	1	32	67	-10
NULL	10	32	83	83
NULL	NULL	32	86	86
NULL	9	158	99	99
SELECT col_char_12_key FROM table0_bigint WHERE ( 1427963904 , 600178688 , -909705216 , 1657733120 ) IN ( ( SUBSTR( CAST( ( ROUND( -10 * -100 ) ) AS CHAR(100) ) , 1 , 12 ) , SUBSTR( CAST( ( LENGTH('SDWMJ') ) AS CHAR(100) ) , 1 , 12 ) , SUBSTR( CAST( ( ROUND( 99 - 9 ) ) AS CHAR(100) ) , 1 , 12 ) , SUBSTR( CAST( ( LENGTH('ANKQH') ) AS CHAR(100) ) , 1 , 12 ) ) ) ORDER BY col_bigint DESC , pk DESC LIMIT 6 , 1 /* RESULTSET_HAS_ZERO_OR_ONE_ROWS */;
col_char_12_key
SELECT  FALSE FROM table0_bigint ORDER BY col_bigint_key , col_char_12_key , col_char_12_key , pk ASC;
FALSE
0
0
0
0
0
0
0
0
0
0
0
0
0
0
0
0
0
0
0
0
0
0
0
0
0
0
0
0
0
0
0
0
0
UPDATE table0_bigint AS X SET X . col_char_12_key = SUBSTR( CAST( ( 5 ) AS CHAR(100) ) , 1 , 12 ) WHERE ( -712179712 , 1281097728 , -1100349440 , 1627127808 ) IN ( ( SUBSTR( CAST( ( LENGTH('TRKPA') ) AS CHAR(100) ) , 1 , 12 ) , SUBSTR( CAST( ( SIGN ( -10 ) ) AS CHAR(100) ) , 1 , 12 ) , SUBSTR( CAST( ( ABS ( 9 ) ) AS CHAR(100) ) , 1 , 12 ) , SUBSTR( CAST( ( ROUND( -100 - ROUND( 9 + 11 ) ) ) AS CHAR(100) ) , 1 , 12 ) ) ) ORDER BY col_bigint_key , col_bigint_key , col_char_12_key , pk ASC LIMIT 191 ;
SELECT * FROM table0_bigint ORDER BY pk;
col_char_12_key	col_char_12	col_bigint_key	pk	col_bigint
8-9	8-9	32	-1018	-1018
-10	NULL	0	-100	-100
99	99	NULL	-10	-10
139	NULL	NULL	-9	-9
0	NULL	0	-1	NULL
0	NULL	0	0	NULL
2	NULL	NULL	1	NULL
NULL	NULL	5	4	NULL
NULL	NULL	14	5	NULL
NULL	NULL	14	6	NULL
NULL	NULL	14	7	NULL
5	NULL	-9	8	NULL
NULL	5	32	9	9
NULL	NULL	32	10	10
NULL	NULL	5	13	NULL
NULL	NULL	NULL	28	NULL
NULL	NULL	5	32	NULL
NULL	NULL	NULL	43	NULL
8	NULL	NULL	60	NULL
NULL	1	32	67	-10
NULL	10	32	83	83
NULL	NULL	32	86	86
-300	NULL	32	91	1
NULL	9	158	99	99
NULL	NULL	14	111	NULL
NULL	NULL	123	123	123
NULL	NULL	152	125	NULL
5	0	NULL	144	1
-10	NULL	0	154	NULL
9	NULL	NULL	159	NULL
NULL	NULL	14	216	NULL
NULL	NULL	227	227	227
-90	NULL	0	232	4
SELECT 1 FROM table0_bigint WHERE pk < ( SUBSTR( CAST( ( LENGTH( SUBSTR( CAST( ( ROUND( 0 - -9 ) ) AS CHAR(100) ) , 1 , 12 ) ) ) AS CHAR(100) ) , 1 , 12 ) ) FOR UPDATE;
1
1
1
1
1
1
1
INSERT INTO table0_bigint ( pk , col_char_12_key ) VALUES ( 10 , SUBSTR( CAST( ( ROUND( -100 * SIGN ( 1 ) ) ) AS CHAR(100) ) , 1 , 12 ) ) ;
ERROR 23000: Duplicate entry '10' for key 'PRIMARY'
SELECT * FROM table0_bigint ORDER BY pk;
col_char_12_key	col_char_12	col_bigint_key	pk	col_bigint
8-9	8-9	32	-1018	-1018
-10	NULL	0	-100	-100
99	99	NULL	-10	-10
139	NULL	NULL	-9	-9
0	NULL	0	-1	NULL
0	NULL	0	0	NULL
2	NULL	NULL	1	NULL
NULL	NULL	5	4	NULL
NULL	NULL	14	5	NULL
NULL	NULL	14	6	NULL
NULL	NULL	14	7	NULL
5	NULL	-9	8	NULL
NULL	5	32	9	9
NULL	NULL	32	10	10
NULL	NULL	5	13	NULL
NULL	NULL	NULL	28	NULL
NULL	NULL	5	32	NULL
NULL	NULL	NULL	43	NULL
8	NULL	NULL	60	NULL
NULL	1	32	67	-10
NULL	10	32	83	83
NULL	NULL	32	86	86
-300	NULL	32	91	1
NULL	9	158	99	99
NULL	NULL	14	111	NULL
NULL	NULL	123	123	123
NULL	NULL	152	125	NULL
5	0	NULL	144	1
-10	NULL	0	154	NULL
9	NULL	NULL	159	NULL
NULL	NULL	14	216	NULL
NULL	NULL	227	227	227
-90	NULL	0	232	4
INSERT INTO table0_bigint (pk) VALUES ( 0 ) ;
ERROR 23000: Duplicate entry '0' for key 'PRIMARY'
SELECT * FROM table0_bigint ORDER BY pk;
col_char_12_key	col_char_12	col_bigint_key	pk	col_bigint
8-9	8-9	32	-1018	-1018
-10	NULL	0	-100	-100
99	99	NULL	-10	-10
139	NULL	NULL	-9	-9
0	NULL	0	-1	NULL
0	NULL	0	0	NULL
2	NULL	NULL	1	NULL
NULL	NULL	5	4	NULL
NULL	NULL	14	5	NULL
NULL	NULL	14	6	NULL
NULL	NULL	14	7	NULL
5	NULL	-9	8	NULL
NULL	5	32	9	9
NULL	NULL	32	10	10
NULL	NULL	5	13	NULL
NULL	NULL	NULL	28	NULL
NULL	NULL	5	32	NULL
NULL	NULL	NULL	43	NULL
8	NULL	NULL	60	NULL
NULL	1	32	67	-10
NULL	10	32	83	83
NULL	NULL	32	86	86
-300	NULL	32	91	1
NULL	9	158	99	99
NULL	NULL	14	111	NULL
NULL	NULL	123	123	123
NULL	NULL	152	125	NULL
5	0	NULL	144	1
-10	NULL	0	154	NULL
9	NULL	NULL	159	NULL
NULL	NULL	14	216	NULL
NULL	NULL	227	227	227
-90	NULL	0	232	4
SELECT pk , col_bigint_key FROM table0_bigint WHERE pk > -2033975296 and pk < -2033975296 ORDER BY col_bigint , col_char_12_key,pk DESC , pk DESC LIMIT 4 /* RESULTSET_HAS_ZERO_OR_ONE_ROWS */;
pk	col_bigint_key
SELECT pk FROM table0_bigint WHERE -9 > ROUND( -9 - -100 ) ORDER BY col_char_12_key ASC , pk DESC LIMIT 1 /* RESULTSET_HAS_ZERO_OR_ONE_ROWS */;
pk
SELECT 1 FROM table0_bigint WHERE ( 1874526208 , -1168769024 ) IN ( ( SUBSTR( CAST( ( LENGTH('TYANV') ) AS CHAR(100) ) , 1 , 12 ) , SUBSTR( CAST( ( ABS ( LENGTH('OXNRT') ) ) AS CHAR(100) ) , 1 , 12 ) ) , ( SUBSTR( CAST( ( ROUND( -100 - ABS ( ROUND( 7 + ROUND ( 1 ) ) ) ) ) AS CHAR(100) ) , 1 , 12 ) , SUBSTR( CAST( ( LENGTH( SUBSTR( CAST( ( LENGTH( SUBSTR( CAST( ( LENGTH('CGCRZ') ) AS CHAR(100) ) , 1 , 12 ) ) ) AS CHAR(100) ) , 1 , 12 ) ) ) AS CHAR(100) ) , 1 , 12 ) ) ) FOR UPDATE;
1
SELECT * FROM table0_bigint WHERE col_bigint_key NOT IN ( 99 , 99 , 10 , 232 , -1 ) ORDER BY pk , col_bigint , col_char_12,pk  , pk  LIMIT 68 , 2;
col_char_12_key	col_char_12	col_bigint_key	pk	col_bigint
SELECT * FROM table0_bigint WHERE ( -145620992 , 471269376 , 2031681536 , -1137704960 , 1929052160 ) NOT IN ( ( SUBSTR( CAST( ( ABS ( LENGTH( SUBSTR( CAST( ( ROUND ( LENGTH( SUBSTR( CAST( ( ROUND( ROUND( -1 + 9 ) * 181 ) ) AS CHAR(100) ) , 1 , 12 ) ) ) ) AS CHAR(100) ) , 1 , 12 ) ) ) ) AS CHAR(100) ) , 1 , 12 ) , SUBSTR( CAST( ( LENGTH('PXSVR') ) AS CHAR(100) ) , 1 , 12 ) , SUBSTR( CAST( ( 77 ) AS CHAR(100) ) , 1 , 12 ) , SUBSTR( CAST( ( LENGTH( SUBSTR( CAST( ( LENGTH( SUBSTR( CAST( ( LENGTH('WCEEA') ) AS CHAR(100) ) , 1 , 12 ) ) ) AS CHAR(100) ) , 1 , 12 ) ) ) AS CHAR(100) ) , 1 , 12 ) , SUBSTR( CAST( ( ROUND ( 10 ) ) AS CHAR(100) ) , 1 , 12 ) ) ) ORDER BY pk LIMIT 7;
col_char_12_key	col_char_12	col_bigint_key	pk	col_bigint
8-9	8-9	32	-1018	-1018
-10	NULL	0	-100	-100
99	99	NULL	-10	-10
139	NULL	NULL	-9	-9
0	NULL	0	-1	NULL
0	NULL	0	0	NULL
2	NULL	NULL	1	NULL
SELECT pk FROM table0_bigint WHERE col_bigint_key NOT IN ( CAST(118 AS CHAR(100)) , CAST(10 AS CHAR(100)) , CAST(220 AS CHAR(100)) ) ORDER BY col_char_12_key , col_char_12_key , col_bigint_key , pk ASC LIMIT 8 , 1 /* RESULTSET_HAS_ZERO_OR_ONE_ROWS */;
pk
9
SELECT 1 FROM table0_bigint WHERE pk NOT IN ( SUBSTR( CAST( ( LENGTH( SUBSTR( CAST( ( FLOOR ( 119 ) ) AS CHAR(100) ) , 1 , 12 ) ) ) AS CHAR(100) ) , 1 , 12 ) , SUBSTR( CAST( ( LENGTH('CUIAG') ) AS CHAR(100) ) , 1 , 12 ) , SUBSTR( CAST( ( CEIL ( 6 ) ) AS CHAR(100) ) , 1 , 12 ) , SUBSTR( CAST( ( ROUND ( 99 ) ) AS CHAR(100) ) , 1 , 12 ) , SUBSTR( CAST( ( LENGTH( SUBSTR( CAST( ( FLOOR ( ABS ( 8 ) ) ) AS CHAR(100) ) , 1 , 12 ) ) ) AS CHAR(100) ) , 1 , 12 ) ) FOR UPDATE;
1
1
1
1
1
1
1
1
1
1
1
1
1
1
1
1
1
1
1
1
1
1
1
1
1
1
1
1
1
1
SELECT UPPER( col_bigint_key ),pk FROM table0_bigint WHERE NOT ( col_bigint <> SUBSTR( CAST( ( ROUND( -10 * ROUND( -100 - 10 ) ) ) AS CHAR(100) ) , 1 , 12 ) ) OR  ( col_char_12_key > SUBSTR( CAST( ( ROUND( -1 - 163 ) ) AS CHAR(100) ) , 1 , 12 ) ) GROUP BY col_bigint_key,pk ORDER BY col_bigint_key,pk LIMIT 233 , 1;
UPPER( col_bigint_key )	pk
SELECT col_bigint_key FROM table0_bigint WHERE pk BETWEEN SUBSTR( CAST( ( LENGTH( SUBSTR( CAST( ( ROUND( 9 - ROUND( -9 * 164 ) ) ) AS CHAR(100) ) , 1 , 12 ) ) ) AS CHAR(100) ) , 1 , 12 ) AND SUBSTR( CAST( ( ROUND( -100 - ROUND( 10 + 6 ) ) ) AS CHAR(100) ) , 1 , 12 ) ORDER BY col_bigint_key ASC , col_char_12 DESC , pk DESC LIMIT 1 /* RESULTSET_HAS_ZERO_OR_ONE_ROWS */;
col_bigint_key
SELECT UPPER( col_char_12_key ),pk FROM table0_bigint WHERE ( 1161101312 , -78446592 , -1044381696 , 2051473408 , -151388160 ) IN ( ( SUBSTR( CAST( ( -10 ) AS CHAR(100) ) , 1 , 12 ) , SUBSTR( CAST( ( LENGTH('KKELD') ) AS CHAR(100) ) , 1 , 12 ) , SUBSTR( CAST( ( -10 ) AS CHAR(100) ) , 1 , 12 ) , SUBSTR( CAST( ( SIGN ( ABS ( 135 ) ) ) AS CHAR(100) ) , 1 , 12 ) , SUBSTR( CAST( ( ROUND( 58 * LENGTH('EAHKU') ) ) AS CHAR(100) ) , 1 , 12 ) ) ) GROUP BY col_char_12_key,pk ORDER BY col_char_12_key,pk LIMIT 1;
UPPER( col_char_12_key )	pk
SELECT  NULL , UPPER( col_char_12 ) , TRUE , FALSE , 1 FROM table0_bigint ORDER BY col_bigint ASC , col_char_12 ASC , pk DESC;
NULL	UPPER( col_char_12 )	TRUE	FALSE	1
NULL	NULL	1	0	1
NULL	NULL	1	0	1
NULL	NULL	1	0	1
NULL	NULL	1	0	1
NULL	NULL	1	0	1
NULL	NULL	1	0	1
NULL	NULL	1	0	1
NULL	NULL	1	0	1
NULL	NULL	1	0	1
NULL	NULL	1	0	1
NULL	NULL	1	0	1
NULL	NULL	1	0	1
NULL	NULL	1	0	1
NULL	NULL	1	0	1
NULL	NULL	1	0	1
NULL	NULL	1	0	1
NULL	NULL	1	0	1
NULL	NULL	1	0	1
NULL	8-9	1	0	1
NULL	NULL	1	0	1
NULL	1	1	0	1
NULL	99	1	0	1
NULL	NULL	1	0	1
NULL	NULL	1	0	1
NULL	0	1	0	1
NULL	NULL	1	0	1
NULL	5	1	0	1
NULL	NULL	1	0	1
NULL	10	1	0	1
NULL	NULL	1	0	1
NULL	9	1	0	1
NULL	NULL	1	0	1
NULL	NULL	1	0	1
UPDATE table0_bigint SET col_bigint_key = SUBSTR( CAST( ( ROUND( 10 - -1 ) ) AS CHAR(100) ) , 1 , 12 ) WHERE pk BETWEEN SUBSTR( CAST( ( LENGTH( SUBSTR( CAST( ( ROUND( 8 * 0 ) ) AS CHAR(100) ) , 1 , 12 ) ) ) AS CHAR(100) ) , 1 , 12 ) AND SUBSTR( CAST( ( SIGN ( 99 ) ) AS CHAR(100) ) , 1 , 12 ) ORDER BY col_char_12_key , col_bigint_key , col_char_12_key , pk ASC LIMIT 255 ;
SELECT * FROM table0_bigint ORDER BY pk;
col_char_12_key	col_char_12	col_bigint_key	pk	col_bigint
8-9	8-9	32	-1018	-1018
-10	NULL	0	-100	-100
99	99	NULL	-10	-10
139	NULL	NULL	-9	-9
0	NULL	0	-1	NULL
0	NULL	0	0	NULL
2	NULL	11	1	NULL
NULL	NULL	5	4	NULL
NULL	NULL	14	5	NULL
NULL	NULL	14	6	NULL
NULL	NULL	14	7	NULL
5	NULL	-9	8	NULL
NULL	5	32	9	9
NULL	NULL	32	10	10
NULL	NULL	5	13	NULL
NULL	NULL	NULL	28	NULL
NULL	NULL	5	32	NULL
NULL	NULL	NULL	43	NULL
8	NULL	NULL	60	NULL
NULL	1	32	67	-10
NULL	10	32	83	83
NULL	NULL	32	86	86
-300	NULL	32	91	1
NULL	9	158	99	99
NULL	NULL	14	111	NULL
NULL	NULL	123	123	123
NULL	NULL	152	125	NULL
5	0	NULL	144	1
-10	NULL	0	154	NULL
9	NULL	NULL	159	NULL
NULL	NULL	14	216	NULL
NULL	NULL	227	227	227
-90	NULL	0	232	4
UPDATE table0_bigint SET col_char_12_key = col_char_12_key WHERE col_bigint BETWEEN SUBSTR( CAST( ( 181 ) AS CHAR(100) ) , 1 , 12 ) AND SUBSTR( CAST( ( ROUND( 99 - LENGTH('EHVGG') ) ) AS CHAR(100) ) , 1 , 12 ) ORDER BY col_char_12_key , col_bigint_key , pk  LIMIT 6 ;
SELECT * FROM table0_bigint ORDER BY pk;
col_char_12_key	col_char_12	col_bigint_key	pk	col_bigint
8-9	8-9	32	-1018	-1018
-10	NULL	0	-100	-100
99	99	NULL	-10	-10
139	NULL	NULL	-9	-9
0	NULL	0	-1	NULL
0	NULL	0	0	NULL
2	NULL	11	1	NULL
NULL	NULL	5	4	NULL
NULL	NULL	14	5	NULL
NULL	NULL	14	6	NULL
NULL	NULL	14	7	NULL
5	NULL	-9	8	NULL
NULL	5	32	9	9
NULL	NULL	32	10	10
NULL	NULL	5	13	NULL
NULL	NULL	NULL	28	NULL
NULL	NULL	5	32	NULL
NULL	NULL	NULL	43	NULL
8	NULL	NULL	60	NULL
NULL	1	32	67	-10
NULL	10	32	83	83
NULL	NULL	32	86	86
-300	NULL	32	91	1
NULL	9	158	99	99
NULL	NULL	14	111	NULL
NULL	NULL	123	123	123
NULL	NULL	152	125	NULL
5	0	NULL	144	1
-10	NULL	0	154	NULL
9	NULL	NULL	159	NULL
NULL	NULL	14	216	NULL
NULL	NULL	227	227	227
-90	NULL	0	232	4
SELECT col_char_12_key FROM table0_bigint WHERE SIGN ( ROUND( ROUND( 9 + ROUND( -100 + -1 ) ) - 102 ) ) <= SIGN ( ROUND( ROUND( ROUND( -9 - ROUND( -100 * 10 ) ) - -1 ) + 83 ) ) ORDER BY col_bigint_key , col_bigint_key , col_char_12_key , pk ASC LIMIT 3 , 1 /* RESULTSET_HAS_ZERO_OR_ONE_ROWS */;
col_char_12_key
5
SELECT 1 FROM table0_bigint WHERE col_bigint_key BETWEEN CAST( 2 AS CHAR(100) ) AND CAST( 7 AS CHAR(100) ) FOR UPDATE;
1
1
1
1
SELECT pk , col_char_12_key FROM table0_bigint WHERE col_char_12_key < CAST(8 AS CHAR(100)) ORDER BY col_char_12_key , pk  LIMIT 1 /* RESULTSET_HAS_ZERO_OR_ONE_ROWS */;
pk	col_char_12_key
-100	-10
SELECT col_char_12_key FROM table0_bigint WHERE pk NOT IN ( SUBSTR( CAST( ( LENGTH( SUBSTR( CAST( ( ROUND( 9 * 10 ) ) AS CHAR(100) ) , 1 , 12 ) ) ) AS CHAR(100) ) , 1 , 12 ) , SUBSTR( CAST( ( ROUND ( -1 ) ) AS CHAR(100) ) , 1 , 12 ) , SUBSTR( CAST( ( LENGTH( SUBSTR( CAST( ( LENGTH('YCNQW') ) AS CHAR(100) ) , 1 , 12 ) ) ) AS CHAR(100) ) , 1 , 12 ) , SUBSTR( CAST( ( LENGTH( SUBSTR( CAST( ( LENGTH('FDVCB') ) AS CHAR(100) ) , 1 , 12 ) ) ) AS CHAR(100) ) , 1 , 12 ) , SUBSTR( CAST( ( ROUND( 9 + 99 ) ) AS CHAR(100) ) , 1 , 12 ) ) ORDER BY col_char_12_key  , pk  LIMIT 6 , 1 /* RESULTSET_HAS_ZERO_OR_ONE_ROWS */;
col_char_12_key
NULL
SELECT * FROM table0_bigint WHERE pk = 136 ORDER BY col_char_12_key ASC , pk DESC LIMIT 1 , 4;
col_char_12_key	col_char_12	col_bigint_key	pk	col_bigint
INSERT INTO table0_bigint ( pk , col_bigint, col_char_12 ) VALUES ( -9 , SUBSTR( CAST( ( CEIL ( ROUND( -1 - ROUND( 0 + ROUND ( ABS ( ROUND( 1 + -10 ) ) ) ) ) ) ) AS CHAR(100) ) , 1 , 12 ) , SUBSTR( CAST( ( LENGTH( SUBSTR( CAST( ( LENGTH('IVCSM') ) AS CHAR(100) ) , 1 , 12 ) ) ) AS CHAR(100) ) , 1 , 12 ) ) ;
ERROR 23000: Duplicate entry '-9' for key 'PRIMARY'
SELECT * FROM table0_bigint ORDER BY pk;
col_char_12_key	col_char_12	col_bigint_key	pk	col_bigint
8-9	8-9	32	-1018	-1018
-10	NULL	0	-100	-100
99	99	NULL	-10	-10
139	NULL	NULL	-9	-9
0	NULL	0	-1	NULL
0	NULL	0	0	NULL
2	NULL	11	1	NULL
NULL	NULL	5	4	NULL
NULL	NULL	14	5	NULL
NULL	NULL	14	6	NULL
NULL	NULL	14	7	NULL
5	NULL	-9	8	NULL
NULL	5	32	9	9
NULL	NULL	32	10	10
NULL	NULL	5	13	NULL
NULL	NULL	NULL	28	NULL
NULL	NULL	5	32	NULL
NULL	NULL	NULL	43	NULL
8	NULL	NULL	60	NULL
NULL	1	32	67	-10
NULL	10	32	83	83
NULL	NULL	32	86	86
-300	NULL	32	91	1
NULL	9	158	99	99
NULL	NULL	14	111	NULL
NULL	NULL	123	123	123
NULL	NULL	152	125	NULL
5	0	NULL	144	1
-10	NULL	0	154	NULL
9	NULL	NULL	159	NULL
NULL	NULL	14	216	NULL
NULL	NULL	227	227	227
-90	NULL	0	232	4
SELECT 1 FROM table0_bigint WHERE pk > ( SUBSTR( CAST( ( ROUND( 3 * 237 ) ) AS CHAR(100) ) , 1 , 12 ) ) FOR UPDATE;
1
SELECT col_char_12_key FROM table0_bigint WHERE col_char_12_key NOT IN ( SUBSTR( CAST( ( SIGN ( 1 ) ) AS CHAR(100) ) , 1 , 12 ) , SUBSTR( CAST( ( ROUND ( 10 ) ) AS CHAR(100) ) , 1 , 12 ) , SUBSTR( CAST( ( ROUND( 0 + ROUND( 99 + 201 ) ) ) AS CHAR(100) ) , 1 , 12 ) , SUBSTR( CAST( ( ROUND ( ROUND ( 0 ) ) ) AS CHAR(100) ) , 1 , 12 ) , SUBSTR( CAST( ( ROUND( LENGTH('HZDHQ') + 99 ) ) AS CHAR(100) ) , 1 , 12 ) ) ORDER BY col_char_12_key , col_bigint_key , pk DESC LIMIT 1 /* RESULTSET_HAS_ZERO_OR_ONE_ROWS */;
col_char_12_key
-10
SELECT 1 FROM table0_bigint WHERE ROUND( 1 * 99 ) != LENGTH( SUBSTR( CAST( ( ABS ( ROUND( 1 * 1 ) ) ) AS CHAR(100) ) , 1 , 12 ) ) FOR UPDATE;
1
1
1
1
1
1
1
1
1
1
1
1
1
1
1
1
1
1
1
1
1
1
1
1
1
1
1
1
1
1
1
1
1
1
UPDATE table0_bigint SET col_char_12_key = col_char_12_key WHERE pk <= ( SUBSTR( CAST( ( CEIL ( ROUND( LENGTH('CXGMO') + -9 ) ) ) AS CHAR(100) ) , 1 , 12 ) ) ORDER BY pk LIMIT 4 ;
SELECT * FROM table0_bigint ORDER BY pk;
col_char_12_key	col_char_12	col_bigint_key	pk	col_bigint
8-9	8-9	32	-1018	-1018
-10	NULL	0	-100	-100
99	99	NULL	-10	-10
139	NULL	NULL	-9	-9
0	NULL	0	-1	NULL
0	NULL	0	0	NULL
2	NULL	11	1	NULL
NULL	NULL	5	4	NULL
NULL	NULL	14	5	NULL
NULL	NULL	14	6	NULL
NULL	NULL	14	7	NULL
5	NULL	-9	8	NULL
NULL	5	32	9	9
NULL	NULL	32	10	10
NULL	NULL	5	13	NULL
NULL	NULL	NULL	28	NULL
NULL	NULL	5	32	NULL
NULL	NULL	NULL	43	NULL
8	NULL	NULL	60	NULL
NULL	1	32	67	-10
NULL	10	32	83	83
NULL	NULL	32	86	86
-300	NULL	32	91	1
NULL	9	158	99	99
NULL	NULL	14	111	NULL
NULL	NULL	123	123	123
NULL	NULL	152	125	NULL
5	0	NULL	144	1
-10	NULL	0	154	NULL
9	NULL	NULL	159	NULL
NULL	NULL	14	216	NULL
NULL	NULL	227	227	227
-90	NULL	0	232	4
SELECT * FROM table0_bigint WHERE CEIL ( LENGTH( SUBSTR( CAST( ( ROUND( -100 + 9 ) ) AS CHAR(100) ) , 1 , 12 ) ) ) >= ROUND ( ROUND( 99 - 10 ) ) ORDER BY col_bigint_key , col_char_12_key,pk DESC , pk ASC LIMIT 7;
col_char_12_key	col_char_12	col_bigint_key	pk	col_bigint
SELECT col_bigint_key , col_char_12 FROM table0_bigint WHERE col_char_12_key NOT IN ( CAST(10 AS CHAR(100)) , CAST(10 AS CHAR(100)) , CAST(-10 AS CHAR(100)) ) ORDER BY col_bigint_key DESC , col_char_12_key DESC , pk  LIMIT 1 /* RESULTSET_HAS_ZERO_OR_ONE_ROWS */;
col_bigint_key	col_char_12
32	8-9
SELECT pk , col_bigint_key FROM table0_bigint WHERE col_bigint_key < CAST(15 AS CHAR(100)) ORDER BY col_bigint_key , col_bigint_key , pk ASC LIMIT 1 /* RESULTSET_HAS_ZERO_OR_ONE_ROWS */;
pk	col_bigint_key
8	-9
SELECT col_bigint_key , col_char_12 FROM table0_bigint WHERE ROUND ( ABS ( ABS ( 3 ) ) ) > SUBSTR( CAST( ( ROUND( FLOOR ( 0 ) + 99 ) ) AS CHAR(100) ) , 1 , 12 ) ORDER BY col_char_12_key , col_char_12_key , pk DESC LIMIT 5 , 1 /* RESULTSET_HAS_ZERO_OR_ONE_ROWS */;
col_bigint_key	col_char_12
SELECT 1 FROM table0_bigint WHERE ROUND( LENGTH( SUBSTR( CAST( ( LENGTH( SUBSTR( CAST( ( 10 ) AS CHAR(100) ) , 1 , 12 ) ) ) AS CHAR(100) ) , 1 , 12 ) ) * 55 ) < 0 FOR UPDATE;
1
SELECT * FROM table0_bigint WHERE col_bigint_key < ABS ( 99 ) ORDER BY pk , col_char_12_key,pk DESC , pk ASC LIMIT 1 , 2;
col_char_12_key	col_char_12	col_bigint_key	pk	col_bigint
-10	NULL	0	-100	-100
0	NULL	0	-1	NULL
SELECT 1 FROM table0_bigint WHERE 10 >= LENGTH('XDGGV') FOR UPDATE;
1
1
1
1
1
1
1
1
1
1
1
1
1
1
1
1
1
1
1
1
1
1
1
1
1
1
1
1
1
1
1
1
1
1
UPDATE table0_bigint SET pk = SUBSTR( CAST( ( ROUND( 119 * ROUND( 0 + 66 ) ) ) AS CHAR(100) ) , 1 , 12 ) WHERE col_char_12 BETWEEN SUBSTR( CAST( ( ROUND( -100 * 99 ) ) AS CHAR(100) ) , 1 , 12 ) AND SUBSTR( CAST( ( LENGTH( SUBSTR( CAST( ( LENGTH('VQAFO') ) AS CHAR(100) ) , 1 , 12 ) ) ) AS CHAR(100) ) , 1 , 12 ) ORDER BY col_bigint_key , pk ASC LIMIT 8 ;
ERROR 23000: Duplicate entry '7854' for key 'PRIMARY'
SELECT * FROM table0_bigint ORDER BY pk;
col_char_12_key	col_char_12	col_bigint_key	pk	col_bigint
8-9	8-9	32	-1018	-1018
-10	NULL	0	-100	-100
99	99	NULL	-10	-10
139	NULL	NULL	-9	-9
0	NULL	0	-1	NULL
0	NULL	0	0	NULL
2	NULL	11	1	NULL
NULL	NULL	5	4	NULL
NULL	NULL	14	5	NULL
NULL	NULL	14	6	NULL
NULL	NULL	14	7	NULL
5	NULL	-9	8	NULL
NULL	5	32	9	9
NULL	NULL	32	10	10
NULL	NULL	5	13	NULL
NULL	NULL	NULL	28	NULL
NULL	NULL	5	32	NULL
NULL	NULL	NULL	43	NULL
8	NULL	NULL	60	NULL
NULL	1	32	67	-10
NULL	10	32	83	83
NULL	NULL	32	86	86
-300	NULL	32	91	1
NULL	9	158	99	99
NULL	NULL	14	111	NULL
NULL	NULL	123	123	123
NULL	NULL	152	125	NULL
5	0	NULL	144	1
-10	NULL	0	154	NULL
9	NULL	NULL	159	NULL
NULL	NULL	14	216	NULL
NULL	NULL	227	227	227
-90	NULL	0	232	4
SELECT col_char_12_key FROM table0_bigint WHERE ( 1912078336 ) NOT IN ( SUBSTR( CAST( ( ROUND( LENGTH('BWXFT') * 10 ) ) AS CHAR(100) ) , 1 , 12 ) , SUBSTR( CAST( ( 211 ) AS CHAR(100) ) , 1 , 12 ) , SUBSTR( CAST( ( ROUND( 1 * LENGTH('QSJDV') ) ) AS CHAR(100) ) , 1 , 12 ) , SUBSTR( CAST( ( FLOOR ( -10 ) ) AS CHAR(100) ) , 1 , 12 ) , SUBSTR( CAST( ( LENGTH( SUBSTR( CAST( ( LENGTH( SUBSTR( CAST( ( ABS ( -9 ) ) AS CHAR(100) ) , 1 , 12 ) ) ) AS CHAR(100) ) , 1 , 12 ) ) ) AS CHAR(100) ) , 1 , 12 ) ) ORDER BY col_bigint DESC , pk ASC LIMIT 3 , 1 /* RESULTSET_HAS_ZERO_OR_ONE_ROWS */;
col_char_12_key
NULL
INSERT INTO table0_bigint (pk) VALUES ( -9 ) ;
ERROR 23000: Duplicate entry '-9' for key 'PRIMARY'
SELECT * FROM table0_bigint ORDER BY pk;
col_char_12_key	col_char_12	col_bigint_key	pk	col_bigint
8-9	8-9	32	-1018	-1018
-10	NULL	0	-100	-100
99	99	NULL	-10	-10
139	NULL	NULL	-9	-9
0	NULL	0	-1	NULL
0	NULL	0	0	NULL
2	NULL	11	1	NULL
NULL	NULL	5	4	NULL
NULL	NULL	14	5	NULL
NULL	NULL	14	6	NULL
NULL	NULL	14	7	NULL
5	NULL	-9	8	NULL
NULL	5	32	9	9
NULL	NULL	32	10	10
NULL	NULL	5	13	NULL
NULL	NULL	NULL	28	NULL
NULL	NULL	5	32	NULL
NULL	NULL	NULL	43	NULL
8	NULL	NULL	60	NULL
NULL	1	32	67	-10
NULL	10	32	83	83
NULL	NULL	32	86	86
-300	NULL	32	91	1
NULL	9	158	99	99
NULL	NULL	14	111	NULL
NULL	NULL	123	123	123
NULL	NULL	152	125	NULL
5	0	NULL	144	1
-10	NULL	0	154	NULL
9	NULL	NULL	159	NULL
NULL	NULL	14	216	NULL
NULL	NULL	227	227	227
-90	NULL	0	232	4
SELECT col_bigint,col_bigint_key,col_char_12,col_char_12_key,pk FROM table0_bigint WHERE ( -321454080 , 79495168 , -1367867392 ) NOT IN ( ( SUBSTR( CAST( ( ABS ( FLOOR ( -1 ) ) ) AS CHAR(100) ) , 1 , 12 ) , SUBSTR( CAST( ( ROUND ( -9 ) ) AS CHAR(100) ) , 1 , 12 ) , SUBSTR( CAST( ( ROUND( FLOOR ( 10 ) + -10 ) ) AS CHAR(100) ) , 1 , 12 ) ) , ( SUBSTR( CAST( ( ROUND( 1 - 99 ) ) AS CHAR(100) ) , 1 , 12 ) , SUBSTR( CAST( ( 1 ) AS CHAR(100) ) , 1 , 12 ) , SUBSTR( CAST( ( FLOOR ( 0 ) ) AS CHAR(100) ) , 1 , 12 ) ) ) GROUP BY col_bigint,col_bigint_key,col_char_12,col_char_12_key,pk ORDER BY col_bigint,col_bigint_key,col_char_12,col_char_12_key,pk LIMIT 7 , 7;
col_bigint	col_bigint_key	col_char_12	col_char_12_key	pk
NULL	0	NULL	0	0
NULL	5	NULL	NULL	4
NULL	5	NULL	NULL	13
NULL	5	NULL	NULL	32
NULL	11	NULL	2	1
NULL	14	NULL	NULL	5
NULL	14	NULL	NULL	6
SELECT 1 FROM table0_bigint WHERE ( 1535180800 ) NOT IN ( SUBSTR( CAST( ( ROUND( 10 * 9 ) ) AS CHAR(100) ) , 1 , 12 ) , SUBSTR( CAST( ( -100 ) AS CHAR(100) ) , 1 , 12 ) , SUBSTR( CAST( ( ABS ( ROUND( 205 + 88 ) ) ) AS CHAR(100) ) , 1 , 12 ) , SUBSTR( CAST( ( LENGTH('MEWKZ') ) AS CHAR(100) ) , 1 , 12 ) , SUBSTR( CAST( ( ROUND( -9 - ROUND( 0 * ROUND( 1 + LENGTH( SUBSTR( CAST( ( SIGN ( ROUND( LENGTH( SUBSTR( CAST( ( ROUND( 172 + -9 ) ) AS CHAR(100) ) , 1 , 12 ) ) - -100 ) ) ) AS CHAR(100) ) , 1 , 12 ) ) ) ) ) ) AS CHAR(100) ) , 1 , 12 ) ) FOR UPDATE;
1
1
1
1
1
1
1
1
1
1
1
1
1
1
1
1
1
1
1
1
1
1
1
1
1
1
1
1
1
1
1
1
1
1
SELECT 1 FROM table0_bigint WHERE col_bigint_key BETWEEN CAST( 4 AS CHAR(100) ) AND CAST( 7 AS CHAR(100) ) FOR UPDATE;
1
1
1
1
SELECT * FROM table0_bigint WHERE pk = 250 ORDER BY col_char_12_key , pk DESC LIMIT 3;
col_char_12_key	col_char_12	col_bigint_key	pk	col_bigint
SELECT 1 FROM table0_bigint WHERE -9 < ABS ( LENGTH('AVCAG') ) FOR UPDATE;
1
1
1
1
1
1
1
1
1
1
1
1
1
1
1
1
1
1
1
1
1
1
1
1
1
1
1
1
1
1
1
1
1
1
UPDATE table0_bigint AS X SET X . col_bigint_key = SUBSTR( CAST( ( ROUND( ROUND( -1 * 0 ) - 99 ) ) AS CHAR(100) ) , 1 , 12 ) WHERE pk <> ( SUBSTR( CAST( ( CEIL ( -10 ) ) AS CHAR(100) ) , 1 , 12 ) ) ORDER BY col_bigint_key , pk DESC LIMIT 4 ;
SELECT * FROM table0_bigint ORDER BY pk;
col_char_12_key	col_char_12	col_bigint_key	pk	col_bigint
8-9	8-9	32	-1018	-1018
-10	NULL	0	-100	-100
99	99	NULL	-10	-10
139	NULL	NULL	-9	-9
0	NULL	0	-1	NULL
0	NULL	0	0	NULL
2	NULL	11	1	NULL
NULL	NULL	5	4	NULL
NULL	NULL	14	5	NULL
NULL	NULL	14	6	NULL
NULL	NULL	14	7	NULL
5	NULL	-9	8	NULL
NULL	5	32	9	9
NULL	NULL	32	10	10
NULL	NULL	5	13	NULL
NULL	NULL	NULL	28	NULL
NULL	NULL	5	32	NULL
NULL	NULL	-99	43	NULL
8	NULL	-99	60	NULL
NULL	1	32	67	-10
NULL	10	32	83	83
NULL	NULL	32	86	86
-300	NULL	32	91	1
NULL	9	158	99	99
NULL	NULL	14	111	NULL
NULL	NULL	123	123	123
NULL	NULL	152	125	NULL
5	0	-99	144	1
-10	NULL	0	154	NULL
9	NULL	-99	159	NULL
NULL	NULL	14	216	NULL
NULL	NULL	227	227	227
-90	NULL	0	232	4
INSERT INTO table0_bigint ( pk , col_bigint_key, col_char_12_key ) VALUES ( -100 , SUBSTR( CAST( ( LENGTH( SUBSTR( CAST( ( LENGTH('RMRPS') ) AS CHAR(100) ) , 1 , 12 ) ) ) AS CHAR(100) ) , 1 , 12 ) , SUBSTR( CAST( ( ROUND( -9 * 9 ) ) AS CHAR(100) ) , 1 , 12 ) ) ;
ERROR 23000: Duplicate entry '-100' for key 'PRIMARY'
SELECT * FROM table0_bigint ORDER BY pk;
col_char_12_key	col_char_12	col_bigint_key	pk	col_bigint
8-9	8-9	32	-1018	-1018
-10	NULL	0	-100	-100
99	99	NULL	-10	-10
139	NULL	NULL	-9	-9
0	NULL	0	-1	NULL
0	NULL	0	0	NULL
2	NULL	11	1	NULL
NULL	NULL	5	4	NULL
NULL	NULL	14	5	NULL
NULL	NULL	14	6	NULL
NULL	NULL	14	7	NULL
5	NULL	-9	8	NULL
NULL	5	32	9	9
NULL	NULL	32	10	10
NULL	NULL	5	13	NULL
NULL	NULL	NULL	28	NULL
NULL	NULL	5	32	NULL
NULL	NULL	-99	43	NULL
8	NULL	-99	60	NULL
NULL	1	32	67	-10
NULL	10	32	83	83
NULL	NULL	32	86	86
-300	NULL	32	91	1
NULL	9	158	99	99
NULL	NULL	14	111	NULL
NULL	NULL	123	123	123
NULL	NULL	152	125	NULL
5	0	-99	144	1
-10	NULL	0	154	NULL
9	NULL	-99	159	NULL
NULL	NULL	14	216	NULL
NULL	NULL	227	227	227
-90	NULL	0	232	4
SELECT 1 FROM table0_bigint WHERE 9 != 196 FOR UPDATE;
1
1
1
1
1
1
1
1
1
1
1
1
1
1
1
1
1
1
1
1
1
1
1
1
1
1
1
1
1
1
1
1
1
1
SELECT COUNT( col_char_12 ) FROM table0_bigint WHERE ( 1732902912 , -1674379264 , 2117140480 ) IN ( ( SUBSTR( CAST( ( ROUND( 2 + -9 ) ) AS CHAR(100) ) , 1 , 12 ) , SUBSTR( CAST( ( LENGTH( SUBSTR( CAST( ( ROUND( ROUND ( 0 ) + 192 ) ) AS CHAR(100) ) , 1 , 12 ) ) ) AS CHAR(100) ) , 1 , 12 ) , SUBSTR( CAST( ( LENGTH( SUBSTR( CAST( ( ROUND( 50 + ROUND( 10 + 1 ) ) ) AS CHAR(100) ) , 1 , 12 ) ) ) AS CHAR(100) ) , 1 , 12 ) ) , ( SUBSTR( CAST( ( ROUND( -1 - 240 ) ) AS CHAR(100) ) , 1 , 12 ) , SUBSTR( CAST( ( -1 ) AS CHAR(100) ) , 1 , 12 ) , SUBSTR( CAST( ( ROUND( -9 + ROUND( ROUND( 242 + -9 ) * 59 ) ) ) AS CHAR(100) ) , 1 , 12 ) ) ) ORDER BY col_char_12_key , pk ASC LIMIT 2 , 3 /* RESULTSET_HAS_ZERO_OR_ONE_ROWS */;
COUNT( col_char_12 )
SELECT * FROM table0_bigint WHERE col_bigint = SIGN ( SIGN ( -9 ) ) ORDER BY col_char_12_key , pk  LIMIT 6;
col_char_12_key	col_char_12	col_bigint_key	pk	col_bigint
SELECT col_bigint,col_bigint_key,col_char_12,col_char_12_key,pk FROM table0_bigint WHERE pk = ( SUBSTR( CAST( ( CEIL ( ABS ( LENGTH('WPTMN') ) ) ) AS CHAR(100) ) , 1 , 12 ) ) GROUP BY col_bigint,col_bigint_key,col_char_12,col_char_12_key,pk ORDER BY col_bigint,col_bigint_key,col_char_12,col_char_12_key,pk LIMIT 4;
col_bigint	col_bigint_key	col_char_12	col_char_12_key	pk
NULL	14	NULL	NULL	5
SELECT * FROM table0_bigint  ORDER BY col_bigint_key , col_char_12_key , pk  LIMIT 7;
col_char_12_key	col_char_12	col_bigint_key	pk	col_bigint
NULL	NULL	NULL	28	NULL
139	NULL	NULL	-9	-9
99	99	NULL	-10	-10
NULL	NULL	-99	43	NULL
5	0	-99	144	1
8	NULL	-99	60	NULL
9	NULL	-99	159	NULL
SELECT col_char_12_key,pk FROM table0_bigint WHERE FLOOR ( 31 ) = SUBSTR( CAST( ( ROUND( LENGTH('CXMHW') + 9 ) ) AS CHAR(100) ) , 1 , 12 ) GROUP BY col_char_12_key,pk ORDER BY col_char_12_key,pk LIMIT 4 , 1;
col_char_12_key	pk
SELECT 1 FROM table0_bigint WHERE  ( pk = SUBSTR( CAST( ( ROUND( 1 * ROUND ( LENGTH( SUBSTR( CAST( ( CEIL ( ROUND( ROUND( -9 - FLOOR ( -9 ) ) + -100 ) ) ) AS CHAR(100) ) , 1 , 12 ) ) ) ) ) AS CHAR(100) ) , 1 , 12 ) ) OR  ( col_bigint_key != SUBSTR( CAST( ( FLOOR ( ROUND( -100 - 119 ) ) ) AS CHAR(100) ) , 1 , 12 ) ) FOR UPDATE;
1
1
1
1
1
1
1
1
1
1
1
1
1
1
1
1
1
1
1
1
1
1
1
1
1
1
1
1
1
1
1
SELECT col_bigint,col_bigint_key,col_char_12,col_char_12_key,pk FROM table0_bigint WHERE LENGTH('KHZPZ') != LENGTH('IQGVW') ORDER BY col_bigint_key DESC , pk ASC LIMIT 4 , 1 /* RESULTSET_HAS_ZERO_OR_ONE_ROWS */;
col_bigint	col_bigint_key	col_char_12	col_char_12_key	pk
SELECT pk , col_bigint_key , col_char_12 FROM table0_bigint WHERE col_char_12 = ( SUBSTR( CAST( ( ABS ( 252 ) ) AS CHAR(100) ) , 1 , 12 ) ) AND col_bigint_key <> ( SUBSTR( CAST( ( LENGTH('TAQMS') ) AS CHAR(100) ) , 1 , 12 ) ) ORDER BY col_bigint_key ASC , col_char_12 ASC , pk DESC LIMIT 5 , 1 /* RESULTSET_HAS_ZERO_OR_ONE_ROWS */;
pk	col_bigint_key	col_char_12
INSERT INTO table0_bigint ( pk , col_bigint_key ) VALUES ( 115, CAST( -10 AS CHAR(100)) ) , ( 10, CAST( 0 AS CHAR(100)) ) ;
ERROR 23000: Duplicate entry '10' for key 'PRIMARY'
SELECT * FROM table0_bigint ORDER BY pk;
col_char_12_key	col_char_12	col_bigint_key	pk	col_bigint
8-9	8-9	32	-1018	-1018
-10	NULL	0	-100	-100
99	99	NULL	-10	-10
139	NULL	NULL	-9	-9
0	NULL	0	-1	NULL
0	NULL	0	0	NULL
2	NULL	11	1	NULL
NULL	NULL	5	4	NULL
NULL	NULL	14	5	NULL
NULL	NULL	14	6	NULL
NULL	NULL	14	7	NULL
5	NULL	-9	8	NULL
NULL	5	32	9	9
NULL	NULL	32	10	10
NULL	NULL	5	13	NULL
NULL	NULL	NULL	28	NULL
NULL	NULL	5	32	NULL
NULL	NULL	-99	43	NULL
8	NULL	-99	60	NULL
NULL	1	32	67	-10
NULL	10	32	83	83
NULL	NULL	32	86	86
-300	NULL	32	91	1
NULL	9	158	99	99
NULL	NULL	14	111	NULL
NULL	NULL	123	123	123
NULL	NULL	152	125	NULL
5	0	-99	144	1
-10	NULL	0	154	NULL
9	NULL	-99	159	NULL
NULL	NULL	14	216	NULL
NULL	NULL	227	227	227
-90	NULL	0	232	4
UPDATE table0_bigint SET pk = SUBSTR( CAST( ( ROUND( -10 + ROUND( ROUND ( -100 ) - 12 ) ) ) AS CHAR(100) ) , 1 , 12 ) , col_char_12_key = SUBSTR(concat( CAST(col_bigint_key AS CHAR(100)) , SUBSTR( CAST( ( 186 ) AS CHAR(100) ) , 1 , 12 ) ) , 1 , 12 ) WHERE SUBSTR( CAST( ( 112 ) AS CHAR(100) ) , 1 , 12 ) <> SIGN ( -1 ) ORDER BY pk LIMIT 75 ;
ERROR 23000: Duplicate entry '-122' for key 'PRIMARY'
SELECT * FROM table0_bigint ORDER BY pk;
col_char_12_key	col_char_12	col_bigint_key	pk	col_bigint
8-9	8-9	32	-1018	-1018
-10	NULL	0	-100	-100
99	99	NULL	-10	-10
139	NULL	NULL	-9	-9
0	NULL	0	-1	NULL
0	NULL	0	0	NULL
2	NULL	11	1	NULL
NULL	NULL	5	4	NULL
NULL	NULL	14	5	NULL
NULL	NULL	14	6	NULL
NULL	NULL	14	7	NULL
5	NULL	-9	8	NULL
NULL	5	32	9	9
NULL	NULL	32	10	10
NULL	NULL	5	13	NULL
NULL	NULL	NULL	28	NULL
NULL	NULL	5	32	NULL
NULL	NULL	-99	43	NULL
8	NULL	-99	60	NULL
NULL	1	32	67	-10
NULL	10	32	83	83
NULL	NULL	32	86	86
-300	NULL	32	91	1
NULL	9	158	99	99
NULL	NULL	14	111	NULL
NULL	NULL	123	123	123
NULL	NULL	152	125	NULL
5	0	-99	144	1
-10	NULL	0	154	NULL
9	NULL	-99	159	NULL
NULL	NULL	14	216	NULL
NULL	NULL	227	227	227
-90	NULL	0	232	4
SELECT 1 FROM table0_bigint WHERE NOT ( col_char_12_key <> SUBSTR( CAST( ( ROUND( 99 * 3 ) ) AS CHAR(100) ) , 1 , 12 ) ) OR  ( col_bigint <> SUBSTR( CAST( ( ROUND( 36 * -1 ) ) AS CHAR(100) ) , 1 , 12 ) ) OR  ( pk < SUBSTR( CAST( ( ROUND( -100 - -100 ) ) AS CHAR(100) ) , 1 , 12 ) ) FOR UPDATE;
1
1
1
1
1
1
1
1
1
1
1
1
1
1
1
1
1
SELECT 1 FROM table0_bigint WHERE pk IN ( SUBSTR( CAST( ( CEIL ( 0 ) ) AS CHAR(100) ) , 1 , 12 ) , SUBSTR( CAST( ( 1 ) AS CHAR(100) ) , 1 , 12 ) , SUBSTR( CAST( ( ROUND( 99 + 1 ) ) AS CHAR(100) ) , 1 , 12 ) , SUBSTR( CAST( ( -1 ) AS CHAR(100) ) , 1 , 12 ) , SUBSTR( CAST( ( ROUND( -9 + LENGTH( SUBSTR( CAST( ( -10 ) AS CHAR(100) ) , 1 , 12 ) ) ) ) AS CHAR(100) ) , 1 , 12 ) ) FOR UPDATE;
1
1
1
1
SELECT * FROM table0_bigint WHERE col_bigint NOT IN ( SUBSTR( CAST( ( FLOOR ( 0 ) ) AS CHAR(100) ) , 1 , 12 ) , SUBSTR( CAST( ( ABS ( 10 ) ) AS CHAR(100) ) , 1 , 12 ) , SUBSTR( CAST( ( ROUND( 1 - ROUND( -100 + LENGTH( SUBSTR( CAST( ( 10 ) AS CHAR(100) ) , 1 , 12 ) ) ) ) ) AS CHAR(100) ) , 1 , 12 ) , SUBSTR( CAST( ( ROUND( ROUND( -10 * 9 ) + 6 ) ) AS CHAR(100) ) , 1 , 12 ) , SUBSTR( CAST( ( FLOOR ( -9 ) ) AS CHAR(100) ) , 1 , 12 ) ) ORDER BY col_bigint_key , col_char_12_key , pk DESC LIMIT 7;
col_char_12_key	col_char_12	col_bigint_key	pk	col_bigint
99	99	NULL	-10	-10
5	0	-99	144	1
-10	NULL	0	-100	-100
-90	NULL	0	232	4
NULL	NULL	32	86	86
NULL	10	32	83	83
NULL	1	32	67	-10
SELECT col_bigint FROM table0_bigint WHERE col_char_12_key IN ( SUBSTR( CAST( ( ROUND( ROUND( -1 + -9 ) + 209 ) ) AS CHAR(100) ) , 1 , 12 ) , SUBSTR( CAST( ( FLOOR ( 1 ) ) AS CHAR(100) ) , 1 , 12 ) , SUBSTR( CAST( ( LENGTH('NJCTG') ) AS CHAR(100) ) , 1 , 12 ) , SUBSTR( CAST( ( FLOOR ( FLOOR ( LENGTH( SUBSTR( CAST( ( ROUND( 76 - ROUND( ROUND( 0 - LENGTH( SUBSTR( CAST( ( ROUND( 8 * -100 ) ) AS CHAR(100) ) , 1 , 12 ) ) ) * 5 ) ) ) AS CHAR(100) ) , 1 , 12 ) ) ) ) ) AS CHAR(100) ) , 1 , 12 ) , SUBSTR( CAST( ( ROUND( 186 - 0 ) ) AS CHAR(100) ) , 1 , 12 ) ) ORDER BY col_bigint_key , col_bigint_key , pk DESC LIMIT 247 , 1 /* RESULTSET_HAS_ZERO_OR_ONE_ROWS */;
col_bigint
SELECT * FROM table0_bigint WHERE SUBSTR( CAST( ( ROUND( CEIL ( -9 ) * 99 ) ) AS CHAR(100) ) , 1 , 12 ) = CEIL ( ROUND( 99 * 1 ) ) ORDER BY col_bigint_key , pk ASC LIMIT 1 /* RESULTSET_HAS_ZERO_OR_ONE_ROWS */;
col_char_12_key	col_char_12	col_bigint_key	pk	col_bigint
SELECT col_bigint FROM table0_bigint  ORDER BY col_bigint_key ASC , col_char_12 DESC , pk  LIMIT 82 , 1 /* RESULTSET_HAS_ZERO_OR_ONE_ROWS */;
col_bigint
UPDATE table0_bigint SET col_bigint = pk WHERE 9 > SUBSTR( CAST( ( LENGTH( SUBSTR( CAST( ( ROUND( 9 * LENGTH('GRMOI') ) ) AS CHAR(100) ) , 1 , 12 ) ) ) AS CHAR(100) ) , 1 , 12 ) ORDER BY col_bigint_key,pk ASC , pk DESC LIMIT 2 ;
SELECT * FROM table0_bigint ORDER BY pk;
col_char_12_key	col_char_12	col_bigint_key	pk	col_bigint
8-9	8-9	32	-1018	-1018
-10	NULL	0	-100	-100
99	99	NULL	-10	-10
139	NULL	NULL	-9	-9
0	NULL	0	-1	NULL
0	NULL	0	0	NULL
2	NULL	11	1	NULL
NULL	NULL	5	4	NULL
NULL	NULL	14	5	NULL
NULL	NULL	14	6	NULL
NULL	NULL	14	7	NULL
5	NULL	-9	8	NULL
NULL	5	32	9	9
NULL	NULL	32	10	10
NULL	NULL	5	13	NULL
NULL	NULL	NULL	28	NULL
NULL	NULL	5	32	NULL
NULL	NULL	-99	43	NULL
8	NULL	-99	60	NULL
NULL	1	32	67	-10
NULL	10	32	83	83
NULL	NULL	32	86	86
-300	NULL	32	91	1
NULL	9	158	99	99
NULL	NULL	14	111	NULL
NULL	NULL	123	123	123
NULL	NULL	152	125	NULL
5	0	-99	144	1
-10	NULL	0	154	NULL
9	NULL	-99	159	NULL
NULL	NULL	14	216	NULL
NULL	NULL	227	227	227
-90	NULL	0	232	4
SELECT pk FROM table0_bigint WHERE col_char_12_key < CAST(99 AS CHAR(100)) ORDER BY pk , col_bigint , col_char_12_key,pk  , pk  LIMIT 5 , 1 /* RESULTSET_HAS_ZERO_OR_ONE_ROWS */;
pk
1
SELECT pk , col_char_12_key FROM table0_bigint WHERE col_bigint_key != ( SUBSTR( CAST( ( ROUND( SIGN ( CEIL ( 0 ) ) - 10 ) ) AS CHAR(100) ) , 1 , 12 ) ) ORDER BY col_bigint_key , pk  LIMIT 8;
pk	col_char_12_key
43	NULL
60	8
144	5
159	9
8	5
-100	-10
-1	0
0	0
SELECT COUNT( col_bigint_key ) FROM table0_bigint WHERE ( -818872320 , -488308736 , -1389232128 ) NOT IN ( ( SUBSTR( CAST( ( FLOOR ( LENGTH('DNTFV') ) ) AS CHAR(100) ) , 1 , 12 ) , SUBSTR( CAST( ( SIGN ( 4 ) ) AS CHAR(100) ) , 1 , 12 ) , SUBSTR( CAST( ( ROUND( 3 + LENGTH('BEYHU') ) ) AS CHAR(100) ) , 1 , 12 ) ) , ( SUBSTR( CAST( ( SIGN ( 213 ) ) AS CHAR(100) ) , 1 , 12 ) , SUBSTR( CAST( ( LENGTH('XYLWB') ) AS CHAR(100) ) , 1 , 12 ) , SUBSTR( CAST( ( LENGTH( SUBSTR( CAST( ( -10 ) AS CHAR(100) ) , 1 , 12 ) ) ) AS CHAR(100) ) , 1 , 12 ) ) ) ORDER BY col_bigint  , col_char_12 ASC , pk  LIMIT 253 , 2 /* RESULTSET_HAS_ZERO_OR_ONE_ROWS */;
COUNT( col_bigint_key )
INSERT INTO table0_bigint ( pk , col_bigint, col_char_12 ) VALUES ( 99 , SUBSTR( CAST( ( ROUND ( ROUND( -9 * -1 ) ) ) AS CHAR(100) ) , 1 , 12 ) , SUBSTR( CAST( ( ROUND( 99 - 10 ) ) AS CHAR(100) ) , 1 , 12 ) ) ;
ERROR 23000: Duplicate entry '99' for key 'PRIMARY'
SELECT * FROM table0_bigint ORDER BY pk;
col_char_12_key	col_char_12	col_bigint_key	pk	col_bigint
8-9	8-9	32	-1018	-1018
-10	NULL	0	-100	-100
99	99	NULL	-10	-10
139	NULL	NULL	-9	-9
0	NULL	0	-1	NULL
0	NULL	0	0	NULL
2	NULL	11	1	NULL
NULL	NULL	5	4	NULL
NULL	NULL	14	5	NULL
NULL	NULL	14	6	NULL
NULL	NULL	14	7	NULL
5	NULL	-9	8	NULL
NULL	5	32	9	9
NULL	NULL	32	10	10
NULL	NULL	5	13	NULL
NULL	NULL	NULL	28	NULL
NULL	NULL	5	32	NULL
NULL	NULL	-99	43	NULL
8	NULL	-99	60	NULL
NULL	1	32	67	-10
NULL	10	32	83	83
NULL	NULL	32	86	86
-300	NULL	32	91	1
NULL	9	158	99	99
NULL	NULL	14	111	NULL
NULL	NULL	123	123	123
NULL	NULL	152	125	NULL
5	0	-99	144	1
-10	NULL	0	154	NULL
9	NULL	-99	159	NULL
NULL	NULL	14	216	NULL
NULL	NULL	227	227	227
-90	NULL	0	232	4
SELECT 1 FROM table0_bigint WHERE LENGTH( SUBSTR( CAST( ( 9 ) AS CHAR(100) ) , 1 , 12 ) ) != LENGTH('SURAC') FOR UPDATE;
1
1
1
1
1
1
1
1
1
1
1
1
1
1
1
1
1
1
1
1
1
1
1
1
1
1
1
1
1
1
1
1
1
1
SELECT COUNT( pk ) FROM table0_bigint WHERE -10 <= CEIL ( ROUND ( SIGN ( -1 ) ) ) ORDER BY col_char_12_key , col_bigint_key , pk ASC LIMIT 0 , 4 /* RESULTSET_HAS_ZERO_OR_ONE_ROWS */;
COUNT( pk )
33
INSERT INTO table0_bigint (pk) VALUES ( 99 ) ;
ERROR 23000: Duplicate entry '99' for key 'PRIMARY'
SELECT * FROM table0_bigint ORDER BY pk;
col_char_12_key	col_char_12	col_bigint_key	pk	col_bigint
8-9	8-9	32	-1018	-1018
-10	NULL	0	-100	-100
99	99	NULL	-10	-10
139	NULL	NULL	-9	-9
0	NULL	0	-1	NULL
0	NULL	0	0	NULL
2	NULL	11	1	NULL
NULL	NULL	5	4	NULL
NULL	NULL	14	5	NULL
NULL	NULL	14	6	NULL
NULL	NULL	14	7	NULL
5	NULL	-9	8	NULL
NULL	5	32	9	9
NULL	NULL	32	10	10
NULL	NULL	5	13	NULL
NULL	NULL	NULL	28	NULL
NULL	NULL	5	32	NULL
NULL	NULL	-99	43	NULL
8	NULL	-99	60	NULL
NULL	1	32	67	-10
NULL	10	32	83	83
NULL	NULL	32	86	86
-300	NULL	32	91	1
NULL	9	158	99	99
NULL	NULL	14	111	NULL
NULL	NULL	123	123	123
NULL	NULL	152	125	NULL
5	0	-99	144	1
-10	NULL	0	154	NULL
9	NULL	-99	159	NULL
NULL	NULL	14	216	NULL
NULL	NULL	227	227	227
-90	NULL	0	232	4
SELECT UPPER( col_bigint_key ),pk FROM table0_bigint WHERE col_bigint_key > 251 GROUP BY col_bigint_key,pk ORDER BY col_bigint_key,pk LIMIT 4;
UPPER( col_bigint_key )	pk
UPDATE table0_bigint SET pk = SUBSTR( CAST( ( 1 ) AS CHAR(100) ) , 1 , 12 ) , col_bigint_key = SUBSTR( CAST( ( LENGTH( SUBSTR( CAST( ( LENGTH('EKUFM') ) AS CHAR(100) ) , 1 , 12 ) ) ) AS CHAR(100) ) , 1 , 12 ) , col_char_12 = SUBSTR( CAST( ( ABS ( ROUND( 9 + ROUND( 70 * ROUND( -1 * LENGTH( SUBSTR( CAST( ( LENGTH( SUBSTR( CAST( ( ROUND( 99 - 227 ) ) AS CHAR(100) ) , 1 , 12 ) ) ) AS CHAR(100) ) , 1 , 12 ) ) ) ) ) ) ) AS CHAR(100) ) , 1 , 12 ) WHERE col_bigint_key = ( SUBSTR( CAST( ( ROUND( 9 * FLOOR ( ROUND( -1 * 0 ) ) ) ) AS CHAR(100) ) , 1 , 12 ) ) ORDER BY pk LIMIT 1 ;
ERROR 23000: Duplicate entry '1' for key 'PRIMARY'
SELECT * FROM table0_bigint ORDER BY pk;
col_char_12_key	col_char_12	col_bigint_key	pk	col_bigint
8-9	8-9	32	-1018	-1018
-10	NULL	0	-100	-100
99	99	NULL	-10	-10
139	NULL	NULL	-9	-9
0	NULL	0	-1	NULL
0	NULL	0	0	NULL
2	NULL	11	1	NULL
NULL	NULL	5	4	NULL
NULL	NULL	14	5	NULL
NULL	NULL	14	6	NULL
NULL	NULL	14	7	NULL
5	NULL	-9	8	NULL
NULL	5	32	9	9
NULL	NULL	32	10	10
NULL	NULL	5	13	NULL
NULL	NULL	NULL	28	NULL
NULL	NULL	5	32	NULL
NULL	NULL	-99	43	NULL
8	NULL	-99	60	NULL
NULL	1	32	67	-10
NULL	10	32	83	83
NULL	NULL	32	86	86
-300	NULL	32	91	1
NULL	9	158	99	99
NULL	NULL	14	111	NULL
NULL	NULL	123	123	123
NULL	NULL	152	125	NULL
5	0	-99	144	1
-10	NULL	0	154	NULL
9	NULL	-99	159	NULL
NULL	NULL	14	216	NULL
NULL	NULL	227	227	227
-90	NULL	0	232	4
SELECT 1 FROM table0_bigint WHERE col_bigint BETWEEN SUBSTR( CAST( ( ROUND( 0 - 0 ) ) AS CHAR(100) ) , 1 , 12 ) AND SUBSTR( CAST( ( ABS ( ROUND( LENGTH('VCXTP') + 0 ) ) ) AS CHAR(100) ) , 1 , 12 ) FOR UPDATE;
1
1
1
1
SELECT * FROM table0_bigint WHERE col_bigint_key IN ( -1 , 61 , 6 , 10 , -10 ) ORDER BY pk ASC , pk ASC LIMIT 8 , 4;
col_char_12_key	col_char_12	col_bigint_key	pk	col_bigint
SELECT * FROM table0_bigint WHERE col_char_12_key BETWEEN SUBSTR( CAST( ( ROUND( ROUND( ABS ( ROUND( 10 + -100 ) ) + -9 ) - 29 ) ) AS CHAR(100) ) , 1 , 12 ) AND SUBSTR( CAST( ( ROUND( CEIL ( 99 ) + 46 ) ) AS CHAR(100) ) , 1 , 12 ) ORDER BY col_char_12_key , pk  LIMIT 6;
col_char_12_key	col_char_12	col_bigint_key	pk	col_bigint
SELECT 1 FROM table0_bigint  FOR UPDATE;
1
1
1
1
1
1
1
1
1
1
1
1
1
1
1
1
1
1
1
1
1
1
1
1
1
1
1
1
1
1
1
1
1
1
SELECT UPPER( col_bigint ) FROM table0_bigint WHERE ( 402063360 , 1390608384 , -538443776 ) IN ( ( SUBSTR( CAST( ( ROUND( ABS ( ROUND( LENGTH('ZOXNA') * 0 ) ) * 1 ) ) AS CHAR(100) ) , 1 , 12 ) , SUBSTR( CAST( ( SIGN ( 99 ) ) AS CHAR(100) ) , 1 , 12 ) , SUBSTR( CAST( ( SIGN ( 4 ) ) AS CHAR(100) ) , 1 , 12 ) ) , ( SUBSTR( CAST( ( LENGTH('RDLRX') ) AS CHAR(100) ) , 1 , 12 ) , SUBSTR( CAST( ( ROUND( LENGTH('BVQTG') * 0 ) ) AS CHAR(100) ) , 1 , 12 ) , SUBSTR( CAST( ( ROUND( 10 + ABS ( ROUND( 15 - 251 ) ) ) ) AS CHAR(100) ) , 1 , 12 ) ) ) GROUP BY col_bigint ORDER BY col_bigint LIMIT 3 , 2;
UPPER( col_bigint )
SELECT * FROM table0_bigint WHERE col_bigint_key <> ( SUBSTR( CAST( ( -9 ) AS CHAR(100) ) , 1 , 12 ) ) ORDER BY col_char_12_key , col_char_12_key , col_char_12_key , pk ASC LIMIT 8;
col_char_12_key	col_char_12	col_bigint_key	pk	col_bigint
NULL	NULL	5	4	NULL
NULL	NULL	14	5	NULL
NULL	NULL	14	6	NULL
NULL	NULL	14	7	NULL
NULL	5	32	9	9
NULL	NULL	32	10	10
NULL	NULL	5	13	NULL
NULL	NULL	5	32	NULL
SELECT pk FROM table0_bigint WHERE pk < ( SUBSTR( CAST( ( LENGTH( SUBSTR( CAST( ( ROUND ( LENGTH( SUBSTR( CAST( ( ROUND( 130 - 1 ) ) AS CHAR(100) ) , 1 , 12 ) ) ) ) AS CHAR(100) ) , 1 , 12 ) ) ) AS CHAR(100) ) , 1 , 12 ) ) ORDER BY pk LIMIT 1 /* RESULTSET_HAS_ZERO_OR_ONE_ROWS */;
pk
-1018
INSERT INTO table0_bigint ( pk , col_bigint, col_char_12_key ) VALUES ( -9 , SUBSTR( CAST( ( ROUND( ROUND( 75 * -10 ) + 3 ) ) AS CHAR(100) ) , 1 , 12 ) , SUBSTR( CAST( ( LENGTH('FRUFA') ) AS CHAR(100) ) , 1 , 12 ) ) ;
ERROR 23000: Duplicate entry '-9' for key 'PRIMARY'
SELECT * FROM table0_bigint ORDER BY pk;
col_char_12_key	col_char_12	col_bigint_key	pk	col_bigint
8-9	8-9	32	-1018	-1018
-10	NULL	0	-100	-100
99	99	NULL	-10	-10
139	NULL	NULL	-9	-9
0	NULL	0	-1	NULL
0	NULL	0	0	NULL
2	NULL	11	1	NULL
NULL	NULL	5	4	NULL
NULL	NULL	14	5	NULL
NULL	NULL	14	6	NULL
NULL	NULL	14	7	NULL
5	NULL	-9	8	NULL
NULL	5	32	9	9
NULL	NULL	32	10	10
NULL	NULL	5	13	NULL
NULL	NULL	NULL	28	NULL
NULL	NULL	5	32	NULL
NULL	NULL	-99	43	NULL
8	NULL	-99	60	NULL
NULL	1	32	67	-10
NULL	10	32	83	83
NULL	NULL	32	86	86
-300	NULL	32	91	1
NULL	9	158	99	99
NULL	NULL	14	111	NULL
NULL	NULL	123	123	123
NULL	NULL	152	125	NULL
5	0	-99	144	1
-10	NULL	0	154	NULL
9	NULL	-99	159	NULL
NULL	NULL	14	216	NULL
NULL	NULL	227	227	227
-90	NULL	0	232	4
SELECT * FROM table0_bigint WHERE ROUND( 99 * ROUND( ROUND ( -1 ) * 99 ) ) != 217 ORDER BY col_bigint_key ASC , col_char_12 DESC , pk  LIMIT 156 , 1;
col_char_12_key	col_char_12	col_bigint_key	pk	col_bigint
SELECT col_char_12_key FROM table0_bigint WHERE col_char_12_key < CAST(-9 AS CHAR(100)) ORDER BY pk DESC , pk ASC LIMIT 1 /* RESULTSET_HAS_ZERO_OR_ONE_ROWS */;
col_char_12_key
-10
INSERT INTO table0_bigint ( pk , col_bigint_key, col_char_12_key ) VALUES ( 10 , SUBSTR( CAST( ( ROUND( SIGN ( 1 ) - -10 ) ) AS CHAR(100) ) , 1 , 12 ) , SUBSTR( CAST( ( 0 ) AS CHAR(100) ) , 1 , 12 ) ) ;
ERROR 23000: Duplicate entry '10' for key 'PRIMARY'
SELECT * FROM table0_bigint ORDER BY pk;
col_char_12_key	col_char_12	col_bigint_key	pk	col_bigint
8-9	8-9	32	-1018	-1018
-10	NULL	0	-100	-100
99	99	NULL	-10	-10
139	NULL	NULL	-9	-9
0	NULL	0	-1	NULL
0	NULL	0	0	NULL
2	NULL	11	1	NULL
NULL	NULL	5	4	NULL
NULL	NULL	14	5	NULL
NULL	NULL	14	6	NULL
NULL	NULL	14	7	NULL
5	NULL	-9	8	NULL
NULL	5	32	9	9
NULL	NULL	32	10	10
NULL	NULL	5	13	NULL
NULL	NULL	NULL	28	NULL
NULL	NULL	5	32	NULL
NULL	NULL	-99	43	NULL
8	NULL	-99	60	NULL
NULL	1	32	67	-10
NULL	10	32	83	83
NULL	NULL	32	86	86
-300	NULL	32	91	1
NULL	9	158	99	99
NULL	NULL	14	111	NULL
NULL	NULL	123	123	123
NULL	NULL	152	125	NULL
5	0	-99	144	1
-10	NULL	0	154	NULL
9	NULL	-99	159	NULL
NULL	NULL	14	216	NULL
NULL	NULL	227	227	227
-90	NULL	0	232	4
SELECT col_bigint_key , col_char_12_key FROM table0_bigint WHERE 99 = 1 ORDER BY col_bigint_key ASC , pk  LIMIT 80 , 1 /* RESULTSET_HAS_ZERO_OR_ONE_ROWS */;
col_bigint_key	col_char_12_key
SELECT col_bigint_key FROM table0_bigint WHERE col_bigint_key BETWEEN SUBSTR( CAST( ( LENGTH('LNGOS') ) AS CHAR(100) ) , 1 , 12 ) AND SUBSTR( CAST( ( -100 ) AS CHAR(100) ) , 1 , 12 ) ORDER BY col_bigint_key , col_bigint_key , col_bigint_key , pk  LIMIT 7 , 1 /* RESULTSET_HAS_ZERO_OR_ONE_ROWS */;
col_bigint_key
SELECT UPPER( col_char_12_key ) FROM table0_bigint WHERE pk IN ( -1 , 4 , 1 , 0 , 9 ) GROUP BY col_char_12_key ORDER BY col_char_12_key LIMIT 6 , 1 /* RESULTSET_HAS_ZERO_OR_ONE_ROWS */;
UPPER( col_char_12_key )
SELECT COUNT( col_char_12_key ) FROM table0_bigint WHERE col_bigint > ( SUBSTR( CAST( ( ROUND( LENGTH( SUBSTR( CAST( ( ROUND( 236 - 137 ) ) AS CHAR(100) ) , 1 , 12 ) ) + 0 ) ) AS CHAR(100) ) , 1 , 12 ) ) AND col_bigint_key = ( SUBSTR( CAST( ( CEIL ( 0 ) ) AS CHAR(100) ) , 1 , 12 ) ) ORDER BY col_char_12_key , col_bigint_key , pk ASC LIMIT 60 , 1 /* RESULTSET_HAS_ZERO_OR_ONE_ROWS */;
COUNT( col_char_12_key )
SELECT col_bigint FROM table0_bigint WHERE LENGTH( SUBSTR( CAST( ( ROUND( -100 - 100 ) ) AS CHAR(100) ) , 1 , 12 ) ) <> 0 ORDER BY col_bigint_key , col_bigint_key , pk ASC LIMIT 7 , 1 /* RESULTSET_HAS_ZERO_OR_ONE_ROWS */;
col_bigint
NULL
SELECT col_bigint , col_char_12_key FROM table0_bigint WHERE col_bigint_key IN ( 136 , 1 , -1 , 1 , -9 ) ORDER BY col_bigint  , pk DESC LIMIT 1 /* RESULTSET_HAS_ZERO_OR_ONE_ROWS */;
col_bigint	col_char_12_key
NULL	5
SELECT ALL NULL , pk , TRUE , col_char_12_key , FALSE , 1 FROM table0_bigint ORDER BY col_bigint , col_char_12_key,pk ASC , pk DESC;
NULL	pk	TRUE	col_char_12_key	FALSE	1
NULL	4	1	NULL	0	1
NULL	5	1	NULL	0	1
NULL	6	1	NULL	0	1
NULL	7	1	NULL	0	1
NULL	13	1	NULL	0	1
NULL	28	1	NULL	0	1
NULL	32	1	NULL	0	1
NULL	43	1	NULL	0	1
NULL	111	1	NULL	0	1
NULL	125	1	NULL	0	1
NULL	216	1	NULL	0	1
NULL	154	1	-10	0	1
NULL	-1	1	0	0	1
NULL	0	1	0	0	1
NULL	1	1	2	0	1
NULL	8	1	5	0	1
NULL	60	1	8	0	1
NULL	159	1	9	0	1
NULL	-1018	1	8-9	0	1
NULL	-100	1	-10	0	1
NULL	67	1	NULL	0	1
NULL	-10	1	99	0	1
NULL	-9	1	139	0	1
NULL	91	1	-300	0	1
NULL	144	1	5	0	1
NULL	232	1	-90	0	1
NULL	9	1	NULL	0	1
NULL	10	1	NULL	0	1
NULL	83	1	NULL	0	1
NULL	86	1	NULL	0	1
NULL	99	1	NULL	0	1
NULL	123	1	NULL	0	1
NULL	227	1	NULL	0	1
SELECT pk , col_char_12_key FROM table0_bigint WHERE NOT ( col_char_12 <= SUBSTR( CAST( ( LENGTH('KFHHV') ) AS CHAR(100) ) , 1 , 12 ) ) OR NOT ( pk <> SUBSTR( CAST( ( ROUND( ROUND( 0 + 0 ) * 78 ) ) AS CHAR(100) ) , 1 , 12 ) ) ORDER BY col_char_12_key , col_bigint_key , col_bigint_key , pk DESC LIMIT 1 /* RESULTSET_HAS_ZERO_OR_ONE_ROWS */;
pk	col_char_12_key
99	NULL
UPDATE table0_bigint SET pk = -9 , col_char_12_key = SUBSTR(concat( CAST(col_bigint AS CHAR(100)) , SUBSTR( CAST( ( LENGTH( SUBSTR( CAST( ( ROUND( 219 * -100 ) ) AS CHAR(100) ) , 1 , 12 ) ) ) AS CHAR(100) ) , 1 , 12 )) , 1 , 12 ) WHERE pk IN ( -1 , 3 , 1 , 0 , 9 ) ORDER BY pk , col_bigint_key,pk DESC , pk  LIMIT 103 ;
ERROR 23000: Duplicate entry '-9' for key 'PRIMARY'
SELECT * FROM table0_bigint ORDER BY pk;
col_char_12_key	col_char_12	col_bigint_key	pk	col_bigint
8-9	8-9	32	-1018	-1018
-10	NULL	0	-100	-100
99	99	NULL	-10	-10
139	NULL	NULL	-9	-9
0	NULL	0	-1	NULL
0	NULL	0	0	NULL
2	NULL	11	1	NULL
NULL	NULL	5	4	NULL
NULL	NULL	14	5	NULL
NULL	NULL	14	6	NULL
NULL	NULL	14	7	NULL
5	NULL	-9	8	NULL
NULL	5	32	9	9
NULL	NULL	32	10	10
NULL	NULL	5	13	NULL
NULL	NULL	NULL	28	NULL
NULL	NULL	5	32	NULL
NULL	NULL	-99	43	NULL
8	NULL	-99	60	NULL
NULL	1	32	67	-10
NULL	10	32	83	83
NULL	NULL	32	86	86
-300	NULL	32	91	1
NULL	9	158	99	99
NULL	NULL	14	111	NULL
NULL	NULL	123	123	123
NULL	NULL	152	125	NULL
5	0	-99	144	1
-10	NULL	0	154	NULL
9	NULL	-99	159	NULL
NULL	NULL	14	216	NULL
NULL	NULL	227	227	227
-90	NULL	0	232	4
INSERT INTO table0_bigint (pk) VALUES ( 93 ) ;
SELECT * FROM table0_bigint ORDER BY pk;
col_char_12_key	col_char_12	col_bigint_key	pk	col_bigint
8-9	8-9	32	-1018	-1018
-10	NULL	0	-100	-100
99	99	NULL	-10	-10
139	NULL	NULL	-9	-9
0	NULL	0	-1	NULL
0	NULL	0	0	NULL
2	NULL	11	1	NULL
NULL	NULL	5	4	NULL
NULL	NULL	14	5	NULL
NULL	NULL	14	6	NULL
NULL	NULL	14	7	NULL
5	NULL	-9	8	NULL
NULL	5	32	9	9
NULL	NULL	32	10	10
NULL	NULL	5	13	NULL
NULL	NULL	NULL	28	NULL
NULL	NULL	5	32	NULL
NULL	NULL	-99	43	NULL
8	NULL	-99	60	NULL
NULL	1	32	67	-10
NULL	10	32	83	83
NULL	NULL	32	86	86
-300	NULL	32	91	1
NULL	NULL	NULL	93	NULL
NULL	9	158	99	99
NULL	NULL	14	111	NULL
NULL	NULL	123	123	123
NULL	NULL	152	125	NULL
5	0	-99	144	1
-10	NULL	0	154	NULL
9	NULL	-99	159	NULL
NULL	NULL	14	216	NULL
NULL	NULL	227	227	227
-90	NULL	0	232	4
SELECT * FROM table0_bigint WHERE ROUND ( -1 ) <= 129 ORDER BY col_bigint_key DESC , col_char_12_key ASC , pk ASC LIMIT 8 , 8;
col_char_12_key	col_char_12	col_bigint_key	pk	col_bigint
NULL	NULL	32	86	86
-300	NULL	32	91	1
8-9	8-9	32	-1018	-1018
NULL	NULL	14	5	NULL
NULL	NULL	14	6	NULL
NULL	NULL	14	7	NULL
NULL	NULL	14	111	NULL
NULL	NULL	14	216	NULL
SELECT col_bigint_key FROM table0_bigint WHERE pk = 99 ORDER BY col_bigint_key  , col_char_12 ASC , pk DESC LIMIT 3 /* RESULTSET_HAS_ZERO_OR_ONE_ROWS */;
col_bigint_key
158
UPDATE table0_bigint SET col_bigint = pk WHERE LENGTH( SUBSTR( CAST( ( ABS ( LENGTH('NFLDW') ) ) AS CHAR(100) ) , 1 , 12 ) ) <> col_bigint ORDER BY col_char_12_key ASC , pk  LIMIT 4 ;
SELECT * FROM table0_bigint ORDER BY pk;
col_char_12_key	col_char_12	col_bigint_key	pk	col_bigint
8-9	8-9	32	-1018	-1018
-10	NULL	0	-100	-100
99	99	NULL	-10	-10
139	NULL	NULL	-9	-9
0	NULL	0	-1	NULL
0	NULL	0	0	NULL
2	NULL	11	1	NULL
NULL	NULL	5	4	NULL
NULL	NULL	14	5	NULL
NULL	NULL	14	6	NULL
NULL	NULL	14	7	NULL
5	NULL	-9	8	NULL
NULL	5	32	9	9
NULL	NULL	32	10	10
NULL	NULL	5	13	NULL
NULL	NULL	NULL	28	NULL
NULL	NULL	5	32	NULL
NULL	NULL	-99	43	NULL
8	NULL	-99	60	NULL
NULL	1	32	67	67
NULL	10	32	83	83
NULL	NULL	32	86	86
-300	NULL	32	91	1
NULL	NULL	NULL	93	NULL
NULL	9	158	99	99
NULL	NULL	14	111	NULL
NULL	NULL	123	123	123
NULL	NULL	152	125	NULL
5	0	-99	144	1
-10	NULL	0	154	NULL
9	NULL	-99	159	NULL
NULL	NULL	14	216	NULL
NULL	NULL	227	227	227
-90	NULL	0	232	4
SELECT pk FROM table0_bigint WHERE pk = ( SUBSTR( CAST( ( LENGTH('WURNQ') ) AS CHAR(100) ) , 1 , 12 ) ) ORDER BY pk , col_char_12_key,pk DESC , pk  LIMIT 102 , 3 /* RESULTSET_HAS_ZERO_OR_ONE_ROWS */;
pk
INSERT INTO table0_bigint ( pk , col_bigint, col_char_12 ) VALUES ( 9 , SUBSTR( CAST( ( ROUND( 0 * 5 ) ) AS CHAR(100) ) , 1 , 12 ) , SUBSTR( CAST( ( ROUND( 99 * LENGTH( SUBSTR( CAST( ( ABS ( 26 ) ) AS CHAR(100) ) , 1 , 12 ) ) ) ) AS CHAR(100) ) , 1 , 12 ) ) ;
ERROR 23000: Duplicate entry '9' for key 'PRIMARY'
SELECT * FROM table0_bigint ORDER BY pk;
col_char_12_key	col_char_12	col_bigint_key	pk	col_bigint
8-9	8-9	32	-1018	-1018
-10	NULL	0	-100	-100
99	99	NULL	-10	-10
139	NULL	NULL	-9	-9
0	NULL	0	-1	NULL
0	NULL	0	0	NULL
2	NULL	11	1	NULL
NULL	NULL	5	4	NULL
NULL	NULL	14	5	NULL
NULL	NULL	14	6	NULL
NULL	NULL	14	7	NULL
5	NULL	-9	8	NULL
NULL	5	32	9	9
NULL	NULL	32	10	10
NULL	NULL	5	13	NULL
NULL	NULL	NULL	28	NULL
NULL	NULL	5	32	NULL
NULL	NULL	-99	43	NULL
8	NULL	-99	60	NULL
NULL	1	32	67	67
NULL	10	32	83	83
NULL	NULL	32	86	86
-300	NULL	32	91	1
NULL	NULL	NULL	93	NULL
NULL	9	158	99	99
NULL	NULL	14	111	NULL
NULL	NULL	123	123	123
NULL	NULL	152	125	NULL
5	0	-99	144	1
-10	NULL	0	154	NULL
9	NULL	-99	159	NULL
NULL	NULL	14	216	NULL
NULL	NULL	227	227	227
-90	NULL	0	232	4
SELECT 1 FROM table0_bigint  FOR UPDATE;
1
1
1
1
1
1
1
1
1
1
1
1
1
1
1
1
1
1
1
1
1
1
1
1
1
1
1
1
1
1
1
1
1
1
1
SELECT UPPER( col_char_12_key ),pk FROM table0_bigint WHERE col_char_12_key BETWEEN CAST( 2 AS CHAR(100) ) AND CAST( 7 AS CHAR(100) ) GROUP BY col_char_12_key,pk ORDER BY col_char_12_key,pk LIMIT 7 , 2;
UPPER( col_char_12_key )	pk
SELECT * FROM table0_bigint WHERE NOT ( col_bigint_key > SUBSTR( CAST( ( ROUND( ROUND( -9 * 10 ) - 1 ) ) AS CHAR(100) ) , 1 , 12 ) ) AND  ( col_char_12_key >= SUBSTR( CAST( ( FLOOR ( SIGN ( 0 ) ) ) AS CHAR(100) ) , 1 , 12 ) ) OR  ( col_bigint_key > SUBSTR( CAST( ( -9 ) AS CHAR(100) ) , 1 , 12 ) ) ORDER BY col_bigint_key , col_bigint_key , col_bigint_key , pk ASC LIMIT 7;
col_char_12_key	col_char_12	col_bigint_key	pk	col_bigint
8	NULL	-99	60	NULL
5	0	-99	144	1
9	NULL	-99	159	NULL
-10	NULL	0	-100	-100
0	NULL	0	-1	NULL
0	NULL	0	0	NULL
-10	NULL	0	154	NULL
