drop table if exists t1;
create table t1(pk int primary key,c1 int);
insert into t1 values(1,1),(2,2),(3,3);
select /*+frozen_version(2)*/ * from t1;
ERROR 42000: OB-6008: Table not frozen
select /*+frozen_version(1)*/ * from t1;
pk	c1
select /*+frozen_version(0)*/ * from t1;
pk	c1
select /*+frozen_version(-1)*/ * from t1;
pk	c1
select /*+frozen_version(1)*/ * from t1 where pk = 1;
pk	c1
select /*+frozen_version(1)*/ * from t1 where pk in (1,2,3);
pk	c1
select /*+frozen_version(0)*/ * from t1 where pk = 1;
pk	c1
select /*+frozen_version(0)*/ * from t1 where pk in (1,2,3);
pk	c1
select /*+frozen_version(-1)*/ * from t1 where pk = 1;
pk	c1
select /*+frozen_version(-1)*/ * from t1 where pk in (1,2,3);
pk	c1
select /*+frozen_version(abc)*/ * from t1 where pk in (1,2,3);
ERROR 42000: You have an error in your SQL syntax; check the manual that corresponds to your OceanBase version for the right syntax to use near 'abc)*/ * from t1 where pk in (1,2,3)' at line 1
select /*+frozen_version(2)*/ * from t1 where pk = 1  for update;
pk	c1
1	1
select /*+frozen_version(0)*/ * from t1 where pk = 1  for update;
pk	c1
1	1
select /*+frozen_version(1)*/ * from t1 where pk = 1  for update;
pk	c1
1	1
select /*+frozen_version(-1)*/ * from t1 where pk = 1  for update;
pk	c1
1	1
select /*+frozen_version(1)*/ * from t1 union select /*+frozen_version(1)*/ * from t1;
pk	c1
select /*+frozen_version(1)*/ * from t1 union select * from t1;
pk	c1
1	1
2	2
3	3
drop table t1;
case 1: all data in memory
create table t1(c1 int primary key, c2 int, c3 int);
insert into t1 values(1,1,1),(2,2,2),(3,3,3);
select * from t1;
c1	c2	c3
1	1	1
2	2	2
3	3	3
major_freeze happens
alter system major freeze tenant = sys;
alter system major freeze tenant = all_user;
alter system major freeze tenant = all_meta;
update t1 set c2 = 2, c3 = 2 where c1 = 1;
select /*+frozen_version(2)*/ * from t1 where c1 = 1;
c1	c2	c3
1	1	1
select * from t1 where c1 = 1;
c1	c2	c3
1	2	2
insert into t1 values(4,4,4),(5,5,5),(6,6,6);
select * from t1;
c1	c2	c3
1	2	2
2	2	2
3	3	3
4	4	4
5	5	5
6	6	6
select /*+frozen_version(2)*/ * from t1;
c1	c2	c3
1	1	1
2	2	2
3	3	3
drop table t1;
