drop database if exists select_bug;
create database select_bug;
use select_bug;
create table t1(c1 int, c2 int);
create table t2(c1 int, c2 int);
create table t3(c1 int);
insert into t1 values (10,1),(3,1),(3,2);
insert into t2 values (2,1);
insert into t3 values (5);
select * from (t1);
c1	c2
10	1
3	1
3	2
select * from (t1,(t2));
c1	c2	c1	c2
10	1	2	1
3	1	2	1
3	2	2	1
select * from (t3,((t1,t2)));
c1	c1	c2	c1	c2
5	10	1	2	1
5	3	1	2	1
5	3	2	2	1
select * from t1 join t2 join t3;
c1	c2	c1	c2	c1
10	1	2	1	5
3	1	2	1	5
3	2	2	1	5
select * from (t1 join t2) join t3;
c1	c2	c1	c2	c1
10	1	2	1	5
3	1	2	1	5
3	2	2	1	5
select * from (t1 join t2) join (select * from t3) a;
c1	c2	c1	c2	c1
10	1	2	1	5
3	1	2	1	5
3	2	2	1	5
select * from ((t1 join t2) join (select * from t3) a);
c1	c2	c1	c2	c1
10	1	2	1	5
3	1	2	1	5
3	2	2	1	5
drop table if exists t1,t2,t3;
create table t1(c1 int,c2 int);
insert into t1 values(1,1),(2,2),(3,3);
delete from t1 where c1 in (select max(c1) from t1 t2);
select * from t1;
c1	c2
1	1
2	2
delete from t1 where c1 in (select min(c2) from (select max(c1) as c2 from t1 ) t2);
select * from t1;
c1	c2
1	1
insert into t1 values (2,2),(3,3);
update t1 set c1 = 5 where c1 in (select max(c1) from t1);
select * from t1;
c1	c2
1	1
2	2
5	3
drop table t1;
create table t1(c1 int, c2 int);
create index idx on t1(c2);
insert into t1 values(1,1),(2,2),(3,3);
select * from t1 use key();
c1	c2
1	1
2	2
3	3
select * from t1 force index();
ERROR 42000: You have an error in your SQL syntax; check the manual that corresponds to your OceanBase version for the right syntax to use near ')' at line 1
select * from t1 ignore index();
ERROR 42000: You have an error in your SQL syntax; check the manual that corresponds to your OceanBase version for the right syntax to use near ')' at line 1
select * from t1 use key(idx);
c1	c2
1	1
2	2
3	3
select * from t1 force index(idx);
c1	c2
1	1
2	2
3	3
select * from t1 ignore key(idx);
c1	c2
1	1
2	2
3	3
select * from t1 use key(a);
c1	c2
1	1
2	2
3	3
select * from t1 force index(a);
c1	c2
1	1
2	2
3	3
select * from t1 ignore key(a);
c1	c2
1	1
2	2
3	3
drop table t1;
SELECT a.x FROM (SELECT 1 AS x) AS a HAVING a.x = 1;
x
1
create table t1(c1 int,c2 int);
insert into t1 values(1,1),(2,2);
select a.c1 from (select c1 from t1) as a having a.c1 = 1;
c1
1
drop table t1;
create table t1 (c1 int);
insert into t1 values (1);
select * from t1 where 'a' not like 'b' and ((c1 < 2 and false) or (c1 < 2 and c1 is not null)) ;
c1
1
select * from t1 where 'a' not like 'b' and ((false) or (c1 < 2 and c1 is not null));
c1
1
drop table t1;
create table t1 (c1 int, c2 int);
create table t2 (c1 int, c2 int);
insert into t1 values(1,2),(3,4);
select * from t1 group by 1>(select count(*) from t2);
c1	c2
1	2
select * from t1 order by 1>(select count(*) from t2);
c1	c2
1	2
3	4
select (1>(select count(*) from t2)) from t1;
(1>(select count(*) from t2))
1
1
select * from t1 where 1>(select count(*) from t2);
c1	c2
1	2
3	4
select (1>(select count(*) from t2)) from t1 union select c1 from t2;
(1>(select count(*) from t2))
1
select * from t1 group by 1>(select count(*) from t2) union select * from t2;
c1	c2
1	2
select * from t1 order by 1>(select count(*) from t2) intersect select * from t2;
c1	c2
select * from t1 where 1>(select count(*) from t2) union select * from t2;
c1	c2
1	2
3	4
insert into t2 values(1,2);
select * from t1 group by 1>(select count(*) from t2);
c1	c2
1	2
select * from t1 order by 1>(select count(*) from t2);
c1	c2
1	2
3	4
select (1>(select count(*) from t2)) from t1;
(1>(select count(*) from t2))
0
0
select * from t1 where 1>(select count(*) from t2);
c1	c2
select (1>(select count(*) from t2)) from t1 union select c1 from t2;
(1>(select count(*) from t2))
0
1
select * from t1 group by 1>(select count(*) from t2) union select * from t2;
c1	c2
1	2
select * from t1 order by 1>(select count(*) from t2) intersect select * from t2;
c1	c2
1	2
select * from t1 where 1>(select count(*) from t2) union select * from t2;
c1	c2
1	2
drop table t1,t2;
create table t1 (a int not null, b char (10) not null) partition by hash(a) partitions 3;
insert into t1 value(11,22);
(select count(*) from t1) UNION (select count(*) from t1);
count(*)
1
select min(2) from t1;
min(2)
2
select max(2) from t1;
max(2)
2
select sum(2) from t1;
sum(2)
2
select avg(2) from t1;
avg(2)
2.0000
drop table t1;
create table t1 (id int, value varchar(4096));
insert into t1 values
(1, '/usr/local/mysql/data/'),(2, ''),(3, '1');
select max(t3.value) from t1 as t3, t1 t4 where t3.value = t4.value;
max(t3.value)
1
drop table t1;
select /*+query_timeout;
ERROR 42000: You have an error in your SQL syntax; check the manual that corresponds to your OceanBase version for the right syntax to use near 'query_timeout' at line 1
select /*+ query_timeout;
ERROR 42000: You have an error in your SQL syntax; check the manual that corresponds to your OceanBase version for the right syntax to use near 'query_timeout' at line 1
select /*+ 32345;
ERROR 42000: You have an error in your SQL syntax; check the manual that corresponds to your OceanBase version for the right syntax to use near '32345' at line 1
create table t1(c1 int);
create table t2(c1 int);
select * from t1, t2 for update wait 1;
c1	c1
drop table t1, t2;
select * from oceanbase.__all_virtual_database partition(p20);
ERROR HY000: Unknown partition
drop table if exists jx_ts;
create table jx_ts (id int, purchased date, primary key(id, purchased))partition by range(year(purchased)) subpartition by hash(to_days(purchased)) subpartitions 2 (partition p0 values less than (1990), partition p1 values less than (2000), partition p2 values less than maxvalue);
select * from jx_ts partition(p1sp0);
id	purchased
drop table jx_ts;
drop table if exists jx_t1;
create table jx_t1(c1 int primary key) partition by range(c1) (partition p0 values less than (10));
select * from jx_t1 partition(p10);
ERROR HY000: Unknown partition
select * from jx_t1 partition(p0);
c1
drop table jx_t1;
use test;
drop table if exists test.a;
drop table if exists test.b;
drop table if exists test.c;
create table a(a1 char(5));
create table b(b1 char(6));
create table c(c1 bigint);
insert into a values('a');
insert into b values('bbb');
insert into c values(12);
set @xxx = 'asd';
select @xxx;
@xxx
asd
select a1 from a into @xxx;
select @xxx;
@xxx
a
select @xxx;
@xxx
a
select b1 from b into @xxx;
select @xxx;
@xxx
bbb
select @xxx;
@xxx
bbb
select c1 from c into @xxx;
select @xxx;
@xxx
12
select @xxx;
@xxx
12
set ob_read_consistency='weak';
set @xxx = 'asd';
select @xxx;
@xxx
asd
select a1 from a into @xxx;
select @xxx;
@xxx
a
select @xxx;
@xxx
a
select b1 from b into @xxx;
select @xxx;
@xxx
bbb
select @xxx;
@xxx
bbb
select c1 from c into @xxx;
select @xxx;
@xxx
12
select @xxx;
@xxx
12
set ob_read_consistency='weak';
set @xxx = 'asd';
select @xxx;
@xxx
asd
select a1 from a into @xxx;
select @xxx;
@xxx
a
select @xxx;
@xxx
a
select b1 from b into @xxx;
select @xxx;
@xxx
bbb
select @xxx;
@xxx
bbb
select c1 from c into @xxx;
select @xxx;
@xxx
12
select @xxx;
@xxx
12
set ob_read_consistency='weak';
set @xxx = 'asd';
select @xxx;
@xxx
asd
select a1 from a into @xxx;
select @xxx;
@xxx
a
select @xxx;
@xxx
a
select b1 from b into @xxx;
select @xxx;
@xxx
bbb
select @xxx;
@xxx
bbb
select c1 from c into @xxx;
select @xxx;
@xxx
12
select @xxx;
@xxx
12
set ob_read_consistency='weak';
set @xxx = 'asd';
select @xxx;
@xxx
asd
select a1 from a into @xxx;
select @xxx;
@xxx
a
select @xxx;
@xxx
a
select b1 from b into @xxx;
select @xxx;
@xxx
bbb
select @xxx;
@xxx
bbb
select c1 from c into @xxx;
select @xxx;
@xxx
12
select @xxx;
@xxx
12
set ob_read_consistency='weak';
set @xxx = 'asd';
select @xxx;
@xxx
asd
select a1 from a into @xxx;
select @xxx;
@xxx
a
select @xxx;
@xxx
a
select b1 from b into @xxx;
select @xxx;
@xxx
bbb
select @xxx;
@xxx
bbb
select c1 from c into @xxx;
select @xxx;
@xxx
12
select @xxx;
@xxx
12
drop table a;
drop table b;
drop table c;
drop database select_bug;
