set a=1;
ERROR HY000: Unknown system variable 'a'
set global a=1;
ERROR HY000: Unknown system variable 'a'
set b=str;
ERROR HY000: Unknown system variable 'b'
set c='str';
ERROR HY000: Unknown system variable 'c'
set a;
ERROR 42000: You have an error in your SQL syntax; check the manual that corresponds to your OceanBase version for the right syntax to use near 'a' at line 1
set a=;
ERROR 42000: You have an error in your SQL syntax; check the manual that corresponds to your OceanBase version for the right syntax to use near '=' at line 1
set =;
ERROR 42000: You have an error in your SQL syntax; check the manual that corresponds to your OceanBase version for the right syntax to use near '=' at line 1
set @a=1;
select @a;
@a
1
set @b=str;
ERROR 42S22: Unknown column 'str' in 'field_list'
set @c='str';
select @c;
@c
str
set @a;
ERROR 42000: You have an error in your SQL syntax; check the manual that corresponds to your OceanBase version for the right syntax to use near '@a' at line 1
set @b=1;
select @b;
@b
1
set @a=@b;
select @a;
@a
1
set @a=1;
select @a;
@a
1
set @b='str';
select @b;
@b
str
set @c=@a+@b;
Warnings:
Warning	1292	Truncated incorrect DOUBLE value: 'str'
select @c;
@c
1
set @b=2;
set @c=@a+@b;
select @c;
@c
3
set @c=@a/@b;
select @c;
@c
0.5
set @c=@a-@b;
select @c;
@c
-1
set @c=@a*@b;
select @c;
@c
2
set @c=@c/0;
select @c;
@c
NULL
set @a=100;
set @a=@a%100;
select @a;
@a
0
set @status=1;
conn1
set max_allowed_packet=2048000;
ERROR HY000: SESSION variable 'max_allowed_packet' is read-only. Use SET GLOBAL to assign the value
show variables like '%ob_read_consistency%';
Variable_name	Value
ob_read_consistency	STRONG
set ob_read_consistency=1;
show variables like '%max_allowed_packet%';
Variable_name	Value
max_allowed_packet	4194304
show variables like '%ob_read_consistency%';
Variable_name	Value
ob_read_consistency	FROZEN
conn2
show variables like '%max_allowed_packet%';
Variable_name	Value
max_allowed_packet	4194304
show variables like '%ob_read_consistency%';
Variable_name	Value
ob_read_consistency	STRONG
conn1
set global max_allowed_packet=2048000;
set global ob_read_consistency=1;
show variables like '%max_allowed_packet%';
Variable_name	Value
max_allowed_packet	4194304
show variables like '%ob_read_consistency%';
Variable_name	Value
ob_read_consistency	FROZEN
conn2
show variables like '%max_allowed_packet%';
Variable_name	Value
max_allowed_packet	4194304
show variables like '%ob_read_consistency%';
Variable_name	Value
ob_read_consistency	STRONG
create conn3
show variables like '%max_allowed_packet%';
Variable_name	Value
max_allowed_packet	2048000
show variables like '%ob_read_consistency%';
Variable_name	Value
ob_read_consistency	FROZEN
drop table if exists t1;
create table t1(c1 varchar(20) primary key, c2 int);
replace into t1 values('s1',1);
set @a='s1';
update t1 set c2=0 where c1=@a;
drop table t1;
for autocommit
set autocommit=on;
show variables like 'autocommit';
Variable_name	Value
autocommit	ON
set autocommit=off;
show variables like 'autocommit';
Variable_name	Value
autocommit	OFF
set @@autocommit=on;
show variables like 'autocommit';
Variable_name	Value
autocommit	ON
set @@autocommit=off;
show variables like 'autocommit';
Variable_name	Value
autocommit	OFF
set "autocommit"=on;
ERROR 42000: You have an error in your SQL syntax; check the manual that corresponds to your OceanBase version for the right syntax to use near '"autocommit"=on' at line 1
show variables like 'autocommit';
Variable_name	Value
autocommit	OFF
set "autocommit"=off;
ERROR 42000: You have an error in your SQL syntax; check the manual that corresponds to your OceanBase version for the right syntax to use near '"autocommit"=off' at line 1
show variables like 'autocommit';
Variable_name	Value
autocommit	OFF
set session autocommit=on;
show variables like 'autocommit';
Variable_name	Value
autocommit	ON
set session autocommit=off;
show variables like 'autocommit';
Variable_name	Value
autocommit	OFF
set @@session.autocommit=off;
show variables like 'autocommit';
Variable_name	Value
autocommit	OFF
set @@session.autocommit=on;
show variables like 'autocommit';
Variable_name	Value
autocommit	ON
set global autocommit=on;
show global variables like 'autocommit';
Variable_name	Value
autocommit	ON
set global autocommit=off;
show global variables like 'autocommit';
Variable_name	Value
autocommit	OFF
set @@global.autocommit=on;
show global variables like 'autocommit';
Variable_name	Value
autocommit	ON
set @@global.autocommit=off;
show global variables like 'autocommit';
Variable_name	Value
autocommit	OFF
set @f=false;
set @e=upper('hello');
select @e;
@e
HELLO
select @f;
@f
0
set @first_var= cast(NULL as CHAR);
select @first_var;
@first_var
NULL
set @xml= '<entry><id>pt10</id><pt>10</pt></entry><entry><id>pt50</id><pt>50</pt></entry>';
select @xml;
@xml
<entry><id>pt10</id><pt>10</pt></entry><entry><id>pt50</id><pt>50</pt></entry>
set @str1 = 'select ?';
select @str1;
@str1
select ?
set @param1='%%';
select @param1;
@param1
%%
set global max_allowed_packet=16777216;
set global ob_read_consistency='STRONG';
set global autocommit=on;
set version_com='fdsadg';
ERROR HY000: Unknown system variable 'version_com'
set session version_com='fdsadg';
ERROR HY000: Unknown system variable 'version_com'
set global version_com='fdsadg';
ERROR HY000: Unknown system variable 'version_com'
set version_comment='fdsadg';
ERROR HY000: Variable 'version_comment' is a read only variable
set session version_comment='fdsadg';
ERROR HY000: Variable 'version_comment' is a read only variable
set global version_comment='fdsadg';
ERROR HY000: Variable 'version_comment' is a read only variable
