drop table if exists t1,t2;
drop table if exists t1aa,t2aa;
drop table if exists ```ab``cd```;
drop database if exists mysqltest;
drop database if exists mysqltest1;
create table t1 (a int not null primary key, b int not null,c int not null, key(b,c));
insert into t1 values (1,2,2),(2,2,3),(3,2,4),(4,2,4);
-- Here we enable metadata just to check that the collation of the
-- resultset is non-binary for string type. This should be changed
-- after Bug#29394 is implemented.
insert into t1 values (5,5,5);
insert into t1 values (5,5,5);
ERROR 23000: Duplicate entry '5' for key 'PRIMARY'
-- Here we enable metadata just to check that the collation of the
-- resultset is non-binary for string type. This should be changed
-- after Bug#29394 is implemented.
drop table t1;
-- Here we enable metadata just to check that the collation of the
-- resultset is non-binary for string type. This should be changed
-- after Bug#29394 is implemented.
show variables like "wait_timeout%";
Catalog	Database	Table	Table_alias	Column	Column_alias	Type	Length	Max length	Is_null	Flags	Decimals	Charsetnr
def		subquery_alias	subquery_alias	Variable_name	Variable_name	253	512	12	N	1	31	45
def		subquery_alias	subquery_alias	Value	Value	253	262144	5	Y	0	31	45
Variable_name	Value
wait_timeout	28800
show variables like "WAIT_timeout%";
Catalog	Database	Table	Table_alias	Column	Column_alias	Type	Length	Max length	Is_null	Flags	Decimals	Charsetnr
def		subquery_alias	subquery_alias	Variable_name	Variable_name	253	512	12	N	1	31	45
def		subquery_alias	subquery_alias	Value	Value	253	262144	5	Y	0	31	45
Variable_name	Value
wait_timeout	28800
show variables like "this_doesn't_exists%";
Catalog	Database	Table	Table_alias	Column	Column_alias	Type	Length	Max length	Is_null	Flags	Decimals	Charsetnr
def		subquery_alias	subquery_alias	Variable_name	Variable_name	253	512	0	N	1	31	45
def		subquery_alias	subquery_alias	Value	Value	253	262144	0	Y	0	31	45
Variable_name	Value
show table status from test like "this_doesn't_exists%";
Catalog	Database	Table	Table_alias	Column	Column_alias	Type	Length	Max length	Is_null	Flags	Decimals	Charsetnr
def		subquery_alias	subquery_alias	name	name	253	512	0	N	16387	31	45
def		subquery_alias	subquery_alias	engine	engine	253	256	0	N	1	31	45
def		subquery_alias	subquery_alias	version	version	8	20	0	N	32897	0	63
def		subquery_alias	subquery_alias	row_format	row_format	253	40	0	N	1	31	45
def		subquery_alias	subquery_alias	rows	rows	8	20	0	N	32897	0	63
def		subquery_alias	subquery_alias	avg_row_length	avg_row_length	8	20	0	N	32897	0	63
def		subquery_alias	subquery_alias	data_length	data_length	8	20	0	N	32897	0	63
def		subquery_alias	subquery_alias	max_data_length	max_data_length	8	20	0	N	32897	0	63
def		subquery_alias	subquery_alias	index_length	index_length	8	20	0	N	32897	0	63
def		subquery_alias	subquery_alias	data_free	data_free	8	20	0	N	32897	0	63
def		subquery_alias	subquery_alias	auto_increment	auto_increment	8	20	0	N	32929	0	63
def		subquery_alias	subquery_alias	create_time	create_time	7	26	0	N	1153	6	63
def		subquery_alias	subquery_alias	update_time	update_time	7	26	0	N	1153	6	63
def		subquery_alias	subquery_alias	check_time	check_time	7	26	0	N	1153	6	63
def		subquery_alias	subquery_alias	collation	collation	253	512	0	N	1	31	45
def		subquery_alias	subquery_alias	checksum	checksum	8	20	0	N	32897	0	63
def		subquery_alias	subquery_alias	create_options	create_options	253	4096	0	N	1	31	45
def		subquery_alias	subquery_alias	comment	comment	253	16384	0	N	1	31	45
name	engine	version	row_format	rows	avg_row_length	data_length	max_data_length	index_length	data_free	auto_increment	create_time	update_time	check_time	collation	checksum	create_options	comment
show databases like "test%";
Catalog	Database	Table	Table_alias	Column	Column_alias	Type	Length	Max length	Is_null	Flags	Decimals	Charsetnr
def		subquery_alias	subquery_alias	Database	Database (test%)	253	512	4	N	1	31	45
Database (test%)
test
create table t1 (f1 int not null, f2 int not null, f3 int not null, f4 int not null, primary key(f1,f2,f3,f4));
insert into t1 values (1,1,1,0),(1,1,2,0),(1,1,3,0),(1,2,1,0),(1,2,2,0),(1,2,3,0),(1,3,1,0),(1,3,2,0),(1,3,3,0),(1,1,1,1),(1,1,2,1),(1,1,3,1),(1,2,1,1),(1,2,2,1),(1,2,3,1),(1,3,1,1),(1,3,2,1),(1,3,3,1);
-- Here we enable metadata just to check that the collation of the
-- resultset is non-binary for string type. This should be changed
-- after Bug#29394 is implemented.
show index from t1;
Table	Non_unique	Key_name	Seq_in_index	Column_name	Collation	Cardinality	Sub_part	Packed	Null	Index_type	Comment	Index_comment	Visible
t1	0	PRIMARY	1	f1	A	NULL	NULL	NULL		BTREE	available		YES
t1	0	PRIMARY	2	f2	A	NULL	NULL	NULL		BTREE	available		YES
t1	0	PRIMARY	3	f3	A	NULL	NULL	NULL		BTREE	available		YES
t1	0	PRIMARY	4	f4	A	NULL	NULL	NULL		BTREE	available		YES
-- Here we enable metadata just to check that the collation of the
-- resultset is non-binary for string type. This should be changed
-- after Bug#29394 is implemented.
show index from t1;
Table	Non_unique	Key_name	Seq_in_index	Column_name	Collation	Cardinality	Sub_part	Packed	Null	Index_type	Comment	Index_comment	Visible
t1	0	PRIMARY	1	f1	A	NULL	NULL	NULL		BTREE	available		YES
t1	0	PRIMARY	2	f2	A	NULL	NULL	NULL		BTREE	available		YES
t1	0	PRIMARY	3	f3	A	NULL	NULL	NULL		BTREE	available		YES
t1	0	PRIMARY	4	f4	A	NULL	NULL	NULL		BTREE	available		YES
drop table t1;
create table t1 (
name char(20) default 'O''Brien' comment 'O''Brien as default',
c int not null comment 'int column',
`c-b` int comment 'name with a minus',
`space 2` int comment 'name with a space'
  ) comment = 'it\'s a table' ;
show full columns from t1;
Field	Type	Collation	Null	Key	Default	Extra	Privileges	Comment
name	char(20)	utf8mb4_general_ci	YES		O'Brien			O'Brien as default
c	int(11)	NULL	NO		NULL			int column
c-b	int(11)	NULL	YES		NULL			name with a minus
space 2	int(11)	NULL	YES		NULL			name with a space
drop table t1;
create table t1 (a int not null, unique aa (a));
show create table t1;
Table	Create Table
t1	CREATE TABLE `t1` (
  `a` int(11) NOT NULL,
  UNIQUE KEY `aa` (`a`) BLOCK_SIZE 16384
) DEFAULT CHARSET = utf8mb4 COMPRESSION = 'lz4_1.0' REPLICA_NUM = 1 BLOCK_SIZE = 16384 USE_BLOOM_FILTER = FALSE TABLET_SIZE = 134217728 PCTFREE = 10
drop table t1;
create table t1 (a int not null, primary key (a));
show create table t1;
Table	Create Table
t1	CREATE TABLE `t1` (
  `a` int(11) NOT NULL,
  PRIMARY KEY (`a`)
) DEFAULT CHARSET = utf8mb4 COMPRESSION = 'lz4_1.0' REPLICA_NUM = 1 BLOCK_SIZE = 16384 USE_BLOOM_FILTER = FALSE TABLET_SIZE = 134217728 PCTFREE = 10
drop table t1;
create table t1(n int);
insert into t1 values (1);
drop table t1;
create table t1 (a decimal(9,2), b decimal (9,0), e double(9,2), f double(5,0), h float(3,2), i float(3,0));
show columns from t1;
Field	Type	Null	Key	Default	Extra
a	decimal(9,2)	YES		NULL	
b	decimal(9,0)	YES		NULL	
e	double(9,2)	YES		NULL	
f	double(5,0)	YES		NULL	
h	float(3,2)	YES		NULL	
i	float(3,0)	YES		NULL	
show full columns from t1;
Field	Type	Collation	Null	Key	Default	Extra	Privileges	Comment
a	decimal(9,2)	NULL	YES		NULL			
b	decimal(9,0)	NULL	YES		NULL			
e	double(9,2)	NULL	YES		NULL			
f	double(5,0)	NULL	YES		NULL			
h	float(3,2)	NULL	YES		NULL			
i	float(3,0)	NULL	YES		NULL			
drop table t1;
create table t1 (
type_bool bool not null default 0,
type_tiny tinyint not null auto_increment primary key,
type_short smallint(3),
type_mediumint mediumint,
type_bigint bigint,
type_decimal decimal(5,2),
type_numeric numeric(5,2),
empty_char char(0),
type_char char(2),
type_varchar varchar(10),
type_timestamp timestamp not null default current_timestamp on update current_timestamp,
type_date date not null default '0000-00-00',
type_time time not null default '00:00:00',
type_datetime datetime not null default '0000-00-00 00:00:00',
type_year year,
index(type_short)
) COMMENT="test" CHARSET= utf8;
show create table t1;
Table	Create Table
t1	CREATE TABLE `t1` (
  `type_bool` tinyint(1) NOT NULL DEFAULT '0',
  `type_tiny` tinyint(4) NOT NULL AUTO_INCREMENT,
  `type_short` smallint(3) DEFAULT NULL,
  `type_mediumint` mediumint(9) DEFAULT NULL,
  `type_bigint` bigint(20) DEFAULT NULL,
  `type_decimal` decimal(5,2) DEFAULT NULL,
  `type_numeric` decimal(5,2) DEFAULT NULL,
  `empty_char` char(0) DEFAULT NULL,
  `type_char` char(2) DEFAULT NULL,
  `type_varchar` varchar(10) DEFAULT NULL,
  `type_timestamp` timestamp NOT NULL DEFAULT CURRENT_TIMESTAMP ON UPDATE CURRENT_TIMESTAMP,
  `type_date` date NOT NULL DEFAULT '0000-00-00',
  `type_time` time NOT NULL DEFAULT '00:00:00',
  `type_datetime` datetime NOT NULL DEFAULT '0000-00-00 00:00:00',
  `type_year` year(4) DEFAULT NULL,
  PRIMARY KEY (`type_tiny`),
  KEY `type_short` (`type_short`) BLOCK_SIZE 16384
) AUTO_INCREMENT = 1 AUTO_INCREMENT_MODE = 'ORDER' DEFAULT CHARSET = utf8mb4 COMPRESSION = 'lz4_1.0' REPLICA_NUM = 1 BLOCK_SIZE = 16384 USE_BLOOM_FILTER = FALSE TABLET_SIZE = 134217728 PCTFREE = 10 COMMENT = 'test'
insert into t1 (type_timestamp) values ("2003-02-07 10:00:01");
select * from t1;
type_bool	type_tiny	type_short	type_mediumint	type_bigint	type_decimal	type_numeric	empty_char	type_char	type_varchar	type_timestamp	type_date	type_time	type_datetime	type_year
0	1	NULL	NULL	NULL	NULL	NULL	NULL	NULL	NULL	2003-02-07 10:00:01	0000-00-00	00:00:00	0000-00-00 00:00:00	NULL
drop table t1;
create table t1 (a int not null);
drop table t1;
create table t1 (c decimal, d double, f float, r real);
show columns from t1;
Field	Type	Null	Key	Default	Extra
c	decimal(10,0)	YES		NULL	
d	double	YES		NULL	
f	float	YES		NULL	
r	double	YES		NULL	
drop table t1;
create table t1 (c decimal(3,3), d double(3,3), f float(3,3));
show columns from t1;
Field	Type	Null	Key	Default	Extra
c	decimal(3,3)	YES		NULL	
d	double(3,3)	YES		NULL	
f	float(3,3)	YES		NULL	
drop table t1;
SET @old_sql_mode= @@sql_mode, sql_mode= '';
CREATE TABLE ```ab``cd``` (i INT);
DROP TABLE ```ab``cd```;
CREATE TABLE ```ab````cd``` (i INT);
SHOW CREATE TABLE ```ab````cd```;
Table	Create Table
`ab``cd`	CREATE TABLE ``ab``cd`` (
  `i` int(11) DEFAULT NULL
) DEFAULT CHARSET = utf8mb4 COMPRESSION = 'lz4_1.0' REPLICA_NUM = 1 BLOCK_SIZE = 16384 USE_BLOOM_FILTER = FALSE TABLET_SIZE = 134217728 PCTFREE = 10
DROP TABLE ```ab````cd```;
CREATE TABLE ```a` (i INT);
SHOW CREATE TABLE ```a`;
Table	Create Table
`a	CREATE TABLE ``a` (
  `i` int(11) DEFAULT NULL
) DEFAULT CHARSET = utf8mb4 COMPRESSION = 'lz4_1.0' REPLICA_NUM = 1 BLOCK_SIZE = 16384 USE_BLOOM_FILTER = FALSE TABLET_SIZE = 134217728 PCTFREE = 10
DROP TABLE ```a`;
CREATE TABLE `a.1` (i INT);
SHOW CREATE TABLE `a.1`;
Table	Create Table
a.1	CREATE TABLE `a.1` (
  `i` int(11) DEFAULT NULL
) DEFAULT CHARSET = utf8mb4 COMPRESSION = 'lz4_1.0' REPLICA_NUM = 1 BLOCK_SIZE = 16384 USE_BLOOM_FILTER = FALSE TABLET_SIZE = 134217728 PCTFREE = 10
DROP TABLE `a.1`;
SET sql_mode= '';
CREATE TABLE t1 (i INT);
SHOW CREATE TABLE t1;
Table	Create Table
t1	CREATE TABLE `t1` (
  `i` int(11) DEFAULT NULL
) DEFAULT CHARSET = utf8mb4 COMPRESSION = 'lz4_1.0' REPLICA_NUM = 1 BLOCK_SIZE = 16384 USE_BLOOM_FILTER = FALSE TABLET_SIZE = 134217728 PCTFREE = 10
DROP TABLE t1;
CREATE TABLE `table` (i INT);
SHOW CREATE TABLE `table`;
Table	Create Table
table	CREATE TABLE `table` (
  `i` int(11) DEFAULT NULL
) DEFAULT CHARSET = utf8mb4 COMPRESSION = 'lz4_1.0' REPLICA_NUM = 1 BLOCK_SIZE = 16384 USE_BLOOM_FILTER = FALSE TABLET_SIZE = 134217728 PCTFREE = 10
DROP TABLE `table`;
SET sql_mode= @old_sql_mode;
CREATE TABLE t1 (
a int(11) default NULL,
KEY a USING BTREE (a)
);
CREATE TABLE t2 (
b int(11) default NULL,
index(b)
);
drop table if exists t3;
CREATE TABLE t3 (
a int(11) default NULL,
b int(11) default NULL,
KEY a USING BTREE (a),
index(b)
);
insert into t1 values (1),(2);
insert into t2 values (1),(2);
insert into t3 values (1,1),(2,2);
insert into t1 values (3),(4);
insert into t2 values (3),(4);
insert into t3 values (3,3),(4,4);
insert into t1 values (5);
insert into t2 values (5);
insert into t3 values (5,5);
delete from t1 where a=3;
delete from t2 where b=3;
delete from t3 where a=3;
truncate table t1;
truncate table t2;
truncate table t3;
insert into t1 values (5);
insert into t2 values (5);
insert into t3 values (5,5);
delete from t1 where a=5;
delete from t2 where b=5;
delete from t3 where a=5;
drop table t1, t2, t3;
create database mysqltest;
create table mysqltest.t1(a int);
insert into mysqltest.t1 values(1);
grant select on `mysqltest`.* to mysqltest_1;
select * from t1;
a
1
show create database mysqltest;
Database	Create Database
mysqltest	CREATE DATABASE `mysqltest` DEFAULT CHARACTER SET = utf8mb4 REPLICA_NUM = NUM
drop table t1;
ERROR 42000: DROP command denied to user 'mysqltest_1'@'%' for table 't1'
drop database mysqltest;
ERROR 42000: Access denied for user 'mysqltest_1'@'%' to database 'mysqltest'
set names binary;
CREATE TABLE t1 (i int, KEY (i)) ;
SHOW CREATE TABLE t1;
Table	Create Table
t1	CREATE TABLE `t1` (
  `i` int(11) DEFAULT NULL,
  KEY `i` (`i`) BLOCK_SIZE 16384
) DEFAULT CHARSET = utf8mb4 COMPRESSION = 'lz4_1.0' REPLICA_NUM = 1 BLOCK_SIZE = 16384 USE_BLOOM_FILTER = FALSE TABLET_SIZE = 134217728 PCTFREE = 10
DROP TABLE t1;
CREATE TABLE t1 (i int, KEY USING HASH (i));
SHOW CREATE TABLE t1;
Table	Create Table
t1	CREATE TABLE `t1` (
  `i` int(11) DEFAULT NULL,
  KEY `i` (`i`) BLOCK_SIZE 16384
) DEFAULT CHARSET = utf8mb4 COMPRESSION = 'lz4_1.0' REPLICA_NUM = 1 BLOCK_SIZE = 16384 USE_BLOOM_FILTER = FALSE TABLET_SIZE = 134217728 PCTFREE = 10
DROP TABLE t1;
CREATE TABLE t1 (i int, KEY USING BTREE (i));
SHOW CREATE TABLE t1;
Table	Create Table
t1	CREATE TABLE `t1` (
  `i` int(11) DEFAULT NULL,
  KEY `i` (`i`) BLOCK_SIZE 16384
) DEFAULT CHARSET = utf8mb4 COMPRESSION = 'lz4_1.0' REPLICA_NUM = 1 BLOCK_SIZE = 16384 USE_BLOOM_FILTER = FALSE TABLET_SIZE = 134217728 PCTFREE = 10
DROP TABLE t1;
CREATE TABLE t1 (i int, KEY (i));
SHOW CREATE TABLE t1;
Table	Create Table
t1	CREATE TABLE `t1` (
  `i` int(11) DEFAULT NULL,
  KEY `i` (`i`) BLOCK_SIZE 16384
) DEFAULT CHARSET = utf8mb4 COMPRESSION = 'lz4_1.0' REPLICA_NUM = 1 BLOCK_SIZE = 16384 USE_BLOOM_FILTER = FALSE TABLET_SIZE = 134217728 PCTFREE = 10
DROP TABLE t1;
CREATE TABLE t1 (i int, KEY USING BTREE (i));
SHOW CREATE TABLE t1;
Table	Create Table
t1	CREATE TABLE `t1` (
  `i` int(11) DEFAULT NULL,
  KEY `i` (`i`) BLOCK_SIZE 16384
) DEFAULT CHARSET = utf8mb4 COMPRESSION = 'lz4_1.0' REPLICA_NUM = 1 BLOCK_SIZE = 16384 USE_BLOOM_FILTER = FALSE TABLET_SIZE = 134217728 PCTFREE = 10
DROP TABLE t1;
CREATE TABLE t1 (i int, KEY (i));
SHOW CREATE TABLE t1;
Table	Create Table
t1	CREATE TABLE `t1` (
  `i` int(11) DEFAULT NULL,
  KEY `i` (`i`) BLOCK_SIZE 16384
) DEFAULT CHARSET = utf8mb4 COMPRESSION = 'lz4_1.0' REPLICA_NUM = 1 BLOCK_SIZE = 16384 USE_BLOOM_FILTER = FALSE TABLET_SIZE = 134217728 PCTFREE = 10
SHOW CREATE TABLE t1;
Table	Create Table
t1	CREATE TABLE `t1` (
  `i` int(11) DEFAULT NULL,
  KEY `i` (`i`) BLOCK_SIZE 16384
) DEFAULT CHARSET = utf8mb4 COMPRESSION = 'lz4_1.0' REPLICA_NUM = 1 BLOCK_SIZE = 16384 USE_BLOOM_FILTER = FALSE TABLET_SIZE = 134217728 PCTFREE = 10
DROP TABLE t1;
CREATE TABLE t1 (i int, KEY USING BTREE (i)) ;
SHOW CREATE TABLE t1;
Table	Create Table
t1	CREATE TABLE `t1` (
  `i` int(11) DEFAULT NULL,
  KEY `i` (`i`) BLOCK_SIZE 16384
) DEFAULT CHARSET = utf8mb4 COMPRESSION = 'lz4_1.0' REPLICA_NUM = 1 BLOCK_SIZE = 16384 USE_BLOOM_FILTER = FALSE TABLET_SIZE = 134217728 PCTFREE = 10
SHOW CREATE TABLE t1;
Table	Create Table
t1	CREATE TABLE `t1` (
  `i` int(11) DEFAULT NULL,
  KEY `i` (`i`) BLOCK_SIZE 16384
) DEFAULT CHARSET = utf8mb4 COMPRESSION = 'lz4_1.0' REPLICA_NUM = 1 BLOCK_SIZE = 16384 USE_BLOOM_FILTER = FALSE TABLET_SIZE = 134217728 PCTFREE = 10
DROP TABLE t1;
CREATE TABLE t1(
field1 varchar(1000) NOT NULL,
PRIMARY KEY(field1)
);
show index from t1;
Catalog	Database	Table	Table_alias	Column	Column_alias	Type	Length	Max length	Is_null	Flags	Decimals	Charsetnr
def		subquery_alias	subquery_alias	Table	Table	253	512	2	N	1	31	45
def		subquery_alias	subquery_alias	Non_unique	Non_unique	8	20	1	N	32897	0	63
def		subquery_alias	subquery_alias	Key_name	Key_name	253	512	7	N	16387	31	45
def		subquery_alias	subquery_alias	Seq_in_index	Seq_in_index	8	20	1	N	49283	0	63
def		subquery_alias	subquery_alias	Column_name	Column_name	253	512	6	N	1	31	45
def		subquery_alias	subquery_alias	Collation	Collation	253	512	1	Y	0	31	45
def		subquery_alias	subquery_alias	Cardinality	Cardinality	8	20	0	Y	32896	0	63
def		subquery_alias	subquery_alias	Sub_part	Sub_part	253	1024	0	Y	0	31	45
def		subquery_alias	subquery_alias	Packed	Packed	253	1024	0	Y	0	31	45
def		subquery_alias	subquery_alias	Null	Null	253	512	0	N	1	31	45
def		subquery_alias	subquery_alias	Index_type	Index_type	253	512	5	N	1	31	45
def		subquery_alias	subquery_alias	Comment	Comment	253	16384	9	Y	0	31	45
def		subquery_alias	subquery_alias	Index_comment	Index_comment	253	16384	0	N	1	31	45
def		subquery_alias	subquery_alias	Visible	Visible	253	12	3	N	1	31	45
Table	Non_unique	Key_name	Seq_in_index	Column_name	Collation	Cardinality	Sub_part	Packed	Null	Index_type	Comment	Index_comment	Visible
t1	0	PRIMARY	1	field1	A	NULL	NULL	NULL		BTREE	available		YES
drop table t1;
create table t1 (
c1 int NOT NULL,
c2 int NOT NULL,
PRIMARY KEY (c1),
INDEX  (c2)
);
SHOW CREATE TABLE t1;
Table	Create Table
t1	CREATE TABLE `t1` (
  `c1` int(11) NOT NULL,
  `c2` int(11) NOT NULL,
  PRIMARY KEY (`c1`),
  KEY `c2` (`c2`) BLOCK_SIZE 16384
) DEFAULT CHARSET = utf8mb4 COMPRESSION = 'lz4_1.0' REPLICA_NUM = 1 BLOCK_SIZE = 16384 USE_BLOOM_FILTER = FALSE TABLET_SIZE = 134217728 PCTFREE = 10
DROP TABLE t1;

# Bug#12183 SHOW OPEN TABLES behavior doesn't match grammar.

DROP DATABASE IF EXISTS mysqltest1;
CREATE DATABASE mysqltest1;
use mysqltest1;

CREATE TABLE t1(a INT);
CREATE TABLE t2(a INT);


SELECT 1 FROM t1;
1
SELECT 1 FROM t2;
1






DROP DATABASE mysqltest1;
use test;

SHOW TABLES FROM non_existing_database;
ERROR 42000: Unknown database 'non_existing_database'
End of 4.1 tests
DROP VIEW IF EXISTS v1;
CREATE VIEW v1 AS SELECT 1;
SHOW CREATE VIEW v1;
View	Create View	character_set_client	collation_connection
v1	CREATE VIEW `v1` AS select 1 AS `1`	binary	binary
DROP VIEW v1;
CREATE VIEW v1 AS SELECT NOW();
SHOW CREATE VIEW v1;
View	Create View	character_set_client	collation_connection
v1	CREATE VIEW `v1` AS select now() AS `NOW()`	binary	binary
DROP VIEW v1;
SHOW TABLES FROM no_such_database;
ERROR 42000: Unknown database 'no_such_database'
SHOW COLUMNS FROM no_such_table;
ERROR 42S02: Table 'test.no_such_table' doesn't exist
show status like 'slow_queries';
Variable_name	Value
show status like 'slow_queries';
Variable_name	Value
select 1 from information_schema.tables limit 1;
1
1
show status like 'slow_queries';
Variable_name	Value
create table t1 (a int);
create view v1 as select a from t1;
show tables;
show columns in t1;
show count(*) warnings;
show count(*) errors;
show warnings;
show status;
show processlist;
show variables;
show charset;
show collation;
show grants;
show create database test;
show create table t1;
show create view v1;
show status like 'slow_queries';
Variable_name	Value
drop view v1;
drop table t1;
DROP DATABASE IF EXISTS mysqltest1;
DROP TABLE IF EXISTS t1;
DROP VIEW IF EXISTS v1;
CREATE DATABASE mysqltest1;
CREATE TABLE t1(c INT NOT NULL PRIMARY KEY);
CREATE VIEW v1 AS SELECT 1;
set names utf8;
-- Here we enable metadata just to check that the collation of the
-- resultset is non-binary for string type. This should be changed
-- after Bug#29394 is implemented.
----------------------------------------------------------------
SHOW CHARACTER SET LIKE 'utf8';
Catalog	Database	Table	Table_alias	Column	Column_alias	Type	Length	Max length	Is_null	Flags	Decimals	Charsetnr
def		subquery_alias	subquery_alias	Charset	Charset	253	512	0	N	16387	31	45
def		subquery_alias	subquery_alias	Description	Description	253	256	0	N	1	31	45
def		subquery_alias	subquery_alias	Default collation	Default collation	253	512	0	N	1	31	45
def		subquery_alias	subquery_alias	Maxlen	Maxlen	8	20	0	N	32897	0	63
Charset	Description	Default collation	Maxlen
----------------------------------------------------------------
SHOW COLLATION LIKE 'latin1_bin';
Catalog	Database	Table	Table_alias	Column	Column_alias	Type	Length	Max length	Is_null	Flags	Decimals	Charsetnr
def		subquery_alias	subquery_alias	Collation	Collation	253	512	0	N	16387	31	45
def		subquery_alias	subquery_alias	Charset	Charset	253	512	0	N	1	31	45
def		subquery_alias	subquery_alias	Id	Id	8	20	0	N	32897	0	63
def		subquery_alias	subquery_alias	Default	Default	253	16	0	N	1	31	45
def		subquery_alias	subquery_alias	Compiled	Compiled	253	16	0	N	1	31	45
def		subquery_alias	subquery_alias	Sortlen	Sortlen	8	20	0	N	32897	0	63
Collation	Charset	Id	Default	Compiled	Sortlen
----------------------------------------------------------------
----------------------------------------------------------------
SHOW DATABASES LIKE 'mysqltest1';
Catalog	Database	Table	Table_alias	Column	Column_alias	Type	Length	Max length	Is_null	Flags	Decimals	Charsetnr
def		subquery_alias	subquery_alias	Database	Database (mysqltest1)	253	512	10	N	1	31	45
Database (mysqltest1)
mysqltest1
----------------------------------------------------------------
SHOW CREATE TABLE t1;
Catalog	Database	Table	Table_alias	Column	Column_alias	Type	Length	Max length	Is_null	Flags	Decimals	Charsetnr
def		subquery_alias	subquery_alias	Table	Table	253	512	2	N	1	31	45
def		subquery_alias	subquery_alias	Create Table	Create Table	253	16384	212	N	1	31	45
Table	Create Table
t1	CREATE TABLE `t1` (
  `c` int(11) NOT NULL,
  PRIMARY KEY (`c`)
) DEFAULT CHARSET = utf8mb4 COMPRESSION = 'lz4_1.0' REPLICA_NUM = 1 BLOCK_SIZE = 16384 USE_BLOOM_FILTER = FALSE TABLET_SIZE = 134217728 PCTFREE = 10
----------------------------------------------------------------
SHOW INDEX FROM t1;
Catalog	Database	Table	Table_alias	Column	Column_alias	Type	Length	Max length	Is_null	Flags	Decimals	Charsetnr
def		subquery_alias	subquery_alias	Table	Table	253	512	2	N	1	31	45
def		subquery_alias	subquery_alias	Non_unique	Non_unique	8	20	1	N	32897	0	63
def		subquery_alias	subquery_alias	Key_name	Key_name	253	512	7	N	16387	31	45
def		subquery_alias	subquery_alias	Seq_in_index	Seq_in_index	8	20	1	N	49283	0	63
def		subquery_alias	subquery_alias	Column_name	Column_name	253	512	1	N	1	31	45
def		subquery_alias	subquery_alias	Collation	Collation	253	512	1	Y	0	31	45
def		subquery_alias	subquery_alias	Cardinality	Cardinality	8	20	0	Y	32896	0	63
def		subquery_alias	subquery_alias	Sub_part	Sub_part	253	1024	0	Y	0	31	45
def		subquery_alias	subquery_alias	Packed	Packed	253	1024	0	Y	0	31	45
def		subquery_alias	subquery_alias	Null	Null	253	512	0	N	1	31	45
def		subquery_alias	subquery_alias	Index_type	Index_type	253	512	5	N	1	31	45
def		subquery_alias	subquery_alias	Comment	Comment	253	16384	9	Y	0	31	45
def		subquery_alias	subquery_alias	Index_comment	Index_comment	253	16384	0	N	1	31	45
def		subquery_alias	subquery_alias	Visible	Visible	253	12	3	N	1	31	45
Table	Non_unique	Key_name	Seq_in_index	Column_name	Collation	Cardinality	Sub_part	Packed	Null	Index_type	Comment	Index_comment	Visible
t1	0	PRIMARY	1	c	A	NULL	NULL	NULL		BTREE	available		YES
----------------------------------------------------------------
----------------------------------------------------------------
----------------------------------------------------------------
SHOW TABLES LIKE 't1';
Catalog	Database	Table	Table_alias	Column	Column_alias	Type	Length	Max length	Is_null	Flags	Decimals	Charsetnr
def		subquery_alias	subquery_alias	table_name	Tables_in_test (t1)	253	512	2	N	16387	31	45
Tables_in_test (t1)
t1
----------------------------------------------------------------
SHOW COLUMNS FROM t1;
Catalog	Database	Table	Table_alias	Column	Column_alias	Type	Length	Max length	Is_null	Flags	Decimals	Charsetnr
def		subquery_alias	subquery_alias	Field	Field	253	512	1	N	16387	31	45
def		subquery_alias	subquery_alias	Type	Type	253	256	7	N	1	31	45
def		subquery_alias	subquery_alias	Null	Null	253	16	2	N	1	31	45
def		subquery_alias	subquery_alias	Key	Key	253	16	3	N	1	31	45
def		subquery_alias	subquery_alias	Default	Default	253	16384	4	N	1	31	45
def		subquery_alias	subquery_alias	Extra	Extra	253	16384	0	N	1	31	45
Field	Type	Null	Key	Default	Extra
c	int(11)	NO	PRI	NULL	
----------------------------------------------------------------
----------------------------------------------------------------
----------------------------------------------------------------
SHOW CREATE VIEW v1;
Catalog	Database	Table	Table_alias	Column	Column_alias	Type	Length	Max length	Is_null	Flags	Decimals	Charsetnr
def		subquery_alias	subquery_alias	View	View	253	512	2	N	1	31	45
def		subquery_alias	subquery_alias	Create View	Create View	253	16384	35	N	1	31	45
def		subquery_alias	subquery_alias	character_set_client	character_set_client	253	512	7	N	1	31	45
def		subquery_alias	subquery_alias	collation_connection	collation_connection	253	512	18	N	1	31	45
View	Create View	character_set_client	collation_connection
v1	CREATE VIEW `v1` AS select 1 AS `1`	utf8mb4	utf8mb4_general_ci
----------------------------------------------------------------
SELECT *
FROM INFORMATION_SCHEMA.VIEWS
WHERE table_name = 'v1';
Catalog	Database	Table	Table_alias	Column	Column_alias	Type	Length	Max length	Is_null	Flags	Decimals	Charsetnr
def	INFORMATION_SCHEMA	VIEWS	VIEWS	TABLE_CATALOG	TABLE_CATALOG	253	12	3	N	1	31	45
def	INFORMATION_SCHEMA	VIEWS	VIEWS	TABLE_SCHEMA	TABLE_SCHEMA	253	512	4	N	1	31	45
def	INFORMATION_SCHEMA	VIEWS	VIEWS	TABLE_NAME	TABLE_NAME	253	512	2	N	1	31	45
def	INFORMATION_SCHEMA	VIEWS	VIEWS	VIEW_DEFINITION	VIEW_DEFINITION	253	262144	15	N	1	31	45
def	INFORMATION_SCHEMA	VIEWS	VIEWS	CHECK_OPTION	CHECK_OPTION	253	16	4	N	1	31	45
def	INFORMATION_SCHEMA	VIEWS	VIEWS	IS_UPDATABLE	IS_UPDATABLE	253	12	2	N	1	31	45
def	INFORMATION_SCHEMA	VIEWS	VIEWS	DEFINER	DEFINER	253	16	4	N	1	31	45
def	INFORMATION_SCHEMA	VIEWS	VIEWS	SECURITY_TYPE	SECURITY_TYPE	253	16	4	N	1	31	45
def	INFORMATION_SCHEMA	VIEWS	VIEWS	CHARACTER_SET_CLIENT	CHARACTER_SET_CLIENT	253	28	7	N	1	31	45
def	INFORMATION_SCHEMA	VIEWS	VIEWS	COLLATION_CONNECTION	COLLATION_CONNECTION	253	72	18	N	1	31	45
TABLE_CATALOG	TABLE_SCHEMA	TABLE_NAME	VIEW_DEFINITION	CHECK_OPTION	IS_UPDATABLE	DEFINER	SECURITY_TYPE	CHARACTER_SET_CLIENT	COLLATION_CONNECTION
def	test	v1	select 1 AS `1`	NONE	NO	NONE	NONE	utf8mb4	utf8mb4_general_ci
----------------------------------------------------------------
----------------------------------------------------------------
----------------------------------------------------------------
DROP DATABASE mysqltest1;
DROP TABLE t1;
DROP VIEW v1;
show variables like 'myisam_recover_options';
Variable_name	Value
CREATE TABLE t1 (
Codigo int(10) unsigned NOT NULL auto_increment,
Nombre varchar(255) default NULL,
Telefono varchar(255) default NULL,
Observaciones varchar(1024),
Direccion varchar(255) default NULL,
Dni varchar(255) default NULL,
CP int(11) default NULL,
Provincia varchar(255) default NULL,
Poblacion varchar(255) default NULL,
PRIMARY KEY  (Codigo)
) DEFAULT CHARSET=utf8;
show create table t1;
Catalog	Database	Table	Table_alias	Column	Column_alias	Type	Length	Max length	Is_null	Flags	Decimals	Charsetnr
def		subquery_alias	subquery_alias	Table	Table	253	512	2	N	1	31	45
def		subquery_alias	subquery_alias	Create Table	Create Table	253	16384	576	N	1	31	45
Table	Create Table
t1	CREATE TABLE `t1` (
  `Codigo` int(10) unsigned NOT NULL AUTO_INCREMENT,
  `Nombre` varchar(255) DEFAULT NULL,
  `Telefono` varchar(255) DEFAULT NULL,
  `Observaciones` varchar(1024) DEFAULT NULL,
  `Direccion` varchar(255) DEFAULT NULL,
  `Dni` varchar(255) DEFAULT NULL,
  `CP` int(11) DEFAULT NULL,
  `Provincia` varchar(255) DEFAULT NULL,
  `Poblacion` varchar(255) DEFAULT NULL,
  PRIMARY KEY (`Codigo`)
) AUTO_INCREMENT = 1 AUTO_INCREMENT_MODE = 'ORDER' DEFAULT CHARSET = utf8mb4 COMPRESSION = 'lz4_1.0' REPLICA_NUM = 1 BLOCK_SIZE = 16384 USE_BLOOM_FILTER = FALSE TABLET_SIZE = 134217728 PCTFREE = 10
drop table t1;
End of 5.0 tests
drop database if exists mysqltest;
create database mysqltest;
show create database mysqltest;
Database	Create Database
mysqltest	CREATE DATABASE `mysqltest` DEFAULT CHARACTER SET = utf8mb4 REPLICA_NUM = NUM
create table mysqltest.t1(a int);
insert into mysqltest.t1 values(1);
grant select on `mysqltest`.`t1` to mysqltest_4;
show create database mysqltest;
Database	Create Database
mysqltest	CREATE DATABASE `mysqltest` DEFAULT CHARACTER SET = utf8mb4 REPLICA_NUM = NUM
drop database mysqltest;
set names utf8;
drop table if exists `Ã©tÃ©123`;
create table `Ã©tÃ©123` (field1 int);
show full tables like '%123';
Tables_in_test (%123)	Table_type
Ã©tÃ©123	BASE TABLE
drop table `Ã©tÃ©123`;
#
# Bug#4374 SHOW TABLE STATUS FROM ignores collation_connection
# Character set: Latin-1 (ISO-8859-1)
#
show columns from `#mysql50#????????`;
Got one of the listed errors
DROP TABLE IF EXISTS t1;
CREATE TABLE t1(c1 INT);
DROP TABLE t1;
set names utf8;
