drop table if exists t1,t2;
create table t1(c1 int primary key);
alter system add sql_filter key('t1');
ERROR 42000: You have an error in your SQL syntax; check the manual that corresponds to your OceanBase version for the right syntax to use near ')' at line 1
alter system add sql_filter key('t1') type=select;
ERROR 42000: You have an error in your SQL syntax; check the manual that corresponds to your OceanBase version for the right syntax to use near 'select' at line 1
alter system add sql_filter key('t1') type=select max_concurrent=0;
alter system add sql_filter key('t1') type=update max_concurrent=0;
ERROR 0A000: OB-7: Not supported feature or function
alter system add sql_filter key('t1') type=delete max_concurrent=0;
ERROR 0A000: OB-7: Not supported feature or function
alter system add sql_filter key('t1') type=insert max_concurrent=0;
ERROR 42000: You have an error in your SQL syntax; check the manual that corresponds to your OceanBase version for the right syntax to use near 'insert max_concurrent=0' at line 1
alter system add sql_filter key('t1') type=replace max_concurrent=0;
ERROR 42000: You have an error in your SQL syntax; check the manual that corresponds to your OceanBase version for the right syntax to use near 'replace max_concurrent=0' at line 1
alter system add sql_filter key('t1') type=select max_concurrent=-1;
ERROR 42000: You have an error in your SQL syntax; check the manual that corresponds to your OceanBase version for the right syntax to use near '-1' at line 1
alter system add sql_filter key('t1') type=select max_concurrent=9223372036854775808;
ERROR 42000: You have an error in your SQL syntax; check the manual that corresponds to your OceanBase version for the right syntax to use near '9223372036854775808' at line 1
alter system add sql_filter key('t1') type=select max_concurrent=9223372036854775807;
alter system add sql_filter key('t1'),('c1'),('c3') type=select max_concurrent=1 key_in_order;
alter system add sql_filter key('t1'),('c1'),('c3') type=select max_concurrent=1 slave;
alter system add sql_filter key('t1'),('c1'),('c3') type=select max_concurrent=1 slave key_in_order;
ERROR 42000: You have an error in your SQL syntax; check the manual that corresponds to your OceanBase version for the right syntax to use near 'key_in_order' at line 1
alter system add sql_filter key('t1'),('c1'),('c3') type=select max_concurrent=1 key_in_order slave;
select filter_id,type,keys_str,keys_num,max_cons,cur_cons,key_in_order,slave from __all_sql_filter_info;
filter_id	type	keys_str	keys_num	max_cons	cur_cons	key_in_order	slave
1	1	('t1')	1	0	0	0	0
2	1	('t1')	1	9223372036854775807	0	0	0
3	1	('t1'),('c1'),('c3')	3	1	0	1	0
4	1	('t1'),('c1'),('c3')	3	1	0	0	1
5	1	('t1'),('c1'),('c3')	3	1	0	1	1
alter system delete sql_filter all;
alter system add sql_filter key('alter') type=select max_concurrent=0;
alter system add sql_filter key('t2') type=select max_concurrent=0;
alter system add sql_filter key('update') type=select max_concurrent=0;
alter system add sql_filter key('insert') type=select max_concurrent=0;
create table t2(c1 int primary key, c2 int);
insert into t2 values (1,1),(2,2),(3,4);
select * from t2;
ERROR 70100: Query execution was interrupted, rule_id: 7
update t2 set c2=3 where c1=3;
alter system add sql_filter key('t2') type=select max_concurrent=1;
select * from t2;
c1	c2
1	1
2	2
3	3
select filter_id,type,keys_str,keys_num,max_cons,cur_cons,key_in_order,slave from __all_sql_filter_info;
filter_id	type	keys_str	keys_num	max_cons	cur_cons	key_in_order	slave
6	1	('alter')	1	0	0	0	0
7	1	('t2')	1	0	0	0	0
8	1	('update')	1	0	0	0	0
9	1	('insert')	1	0	0	0	0
10	1	('t2')	1	1	0	0	0
alter system delete sql_filter all;
alter system add sql_filter key('c1'),('c2') type=select max_concurrent=0 key_in_order;
select * from t2 where c2=1 and c1=1;
c1	c2
1	1
select * from t2 where c1=1 and c2=1;
ERROR 70100: Query execution was interrupted, rule_id: 11
alter system add sql_filter key('c1'),('c2') type=select max_concurrent=0 slave;
select * from t2 where c2=1 and c1=1;
ERROR 70100: Query execution was interrupted, rule_id: 12
select filter_id,type,keys_str,keys_num,max_cons,cur_cons,key_in_order,slave from __all_sql_filter_info;
filter_id	type	keys_str	keys_num	max_cons	cur_cons	key_in_order	slave
11	1	('c1'),('c2')	2	0	0	1	0
12	1	('c1'),('c2')	2	0	0	0	1
alter system delete sql_filter all;
alter system add sql_filter key('t2') type=select max_concurrent=0;
select * from t2;
ERROR 70100: Query execution was interrupted, rule_id: 13
alter system delete sql_filter all;
alter system add sql_filter key('c1') type=select max_concurrent=0;
select c1 from t2;
ERROR 70100: Query execution was interrupted, rule_id: 14
alter system delete sql_filter all;
alter system add sql_filter key('sum') type=select max_concurrent=0;
select sum(c1) from t2;
ERROR 70100: Query execution was interrupted, rule_id: 15
alter system delete sql_filter all;
alter system add sql_filter key('now') type=select max_concurrent=0;
select now();
ERROR 70100: Query execution was interrupted, rule_id: 16
alter system delete sql_filter all;
alter system add sql_filter key('+') type=select max_concurrent=0;
select c1+c2 from t2;
ERROR 70100: Query execution was interrupted, rule_id: 17
alter system delete sql_filter all;
alter system add sql_filter key('limit') type=select max_concurrent=0;
select * from t2 limit 1;
ERROR 70100: Query execution was interrupted, rule_id: 18
alter system delete sql_filter all;
alter system add sql_filter key('query_timeout') type=select max_concurrent=0;
select /*+ query_timeout (10000000)*/ * from t2;
ERROR 70100: Query execution was interrupted, rule_id: 19
alter system delete sql_filter all;
alter system add sql_filter key('set') type=select max_concurrent=0;
set autocommit=0;
update t2 set c2=3 where c1=3;
set autocommit=1;
alter system delete sql_filter all;
alter system add sql_filter key('t2') type=select max_concurrent=0;
set autocommit=0;
select * from t2;
ERROR 70100: Query execution was interrupted, rule_id: 21
set autocommit=1;
alter system delete sql_filter all;
alter system add sql_filter key('c1') type=select max_concurrent=0;
set autocommit=0;
select c1 from t2;
ERROR 70100: Query execution was interrupted, rule_id: 22
set autocommit=1;
alter system delete sql_filter all;
alter system add sql_filter key('sum') type=select max_concurrent=0;
set autocommit=0;
select sum(c1) from t2;
ERROR 70100: Query execution was interrupted, rule_id: 23
set autocommit=1;
alter system delete sql_filter all;
alter system add sql_filter key('now') type=select max_concurrent=0;
set autocommit=0;
select now();
ERROR 70100: Query execution was interrupted, rule_id: 24
set autocommit=1;
alter system delete sql_filter all;
alter system add sql_filter key('+') type=select max_concurrent=0;
set autocommit=0;
select c1+c2 from t2;
ERROR 70100: Query execution was interrupted, rule_id: 25
set autocommit=1;
alter system delete sql_filter all;
alter system add sql_filter key('limit') type=select max_concurrent=0;
set autocommit=0;
select * from t2 limit 1;
ERROR 70100: Query execution was interrupted, rule_id: 26
set autocommit=1;
alter system delete sql_filter all;
alter system add sql_filter key('query_timeout') type=select max_concurrent=0;
set autocommit=0;
select /*+ query_timeout (10000000)*/ * from t2;
ERROR 70100: Query execution was interrupted, rule_id: 27
set autocommit=1;
alter system add sql_filter key('?') type=select max_concurrent=0;
ERROR 42000: OB-2: Invalid argument
alter system add sql_filter key('??') type=select max_concurrent=0;
alter system add sql_filter key('?=?') type=select max_concurrent=0;
ERROR 42000: OB-2: Invalid argument
alter system add sql_filter key('?=?') type=select max_concurrent=0;
ERROR 42000: OB-2: Invalid argument
alter system add sql_filter key('??',1) type=select max_concurrent=0;
ERROR 42000: OB-2: Invalid argument
alter system add sql_filter key('c1=?',1,1) type=select max_concurrent=0;
ERROR 42000: OB-2: Invalid argument
alter system add sql_filter key('c1='?'',1) type=select max_concurrent=0;
ERROR 42000: You have an error in your SQL syntax; check the manual that corresponds to your OceanBase version for the right syntax to use near '?'',1) type=select max_concurrent=0' at line 1
alter system add sql_filter key("c1='?'",1) type=select max_concurrent=0;
ERROR 42000: Unknown value c1='?'
alter system add sql_filter key('c1='s'',1) type=select max_concurrent=0;
ERROR 42000: You have an error in your SQL syntax; check the manual that corresponds to your OceanBase version for the right syntax to use near 's'',1) type=select max_concurrent=0' at line 1
alter system add sql_filter key('??',1,1) type=select max_concurrent=0;
ERROR 42000: OB-2: Invalid argument
alter system add sql_filter key('?=?','c1',1) type=select max_concurrent=0;
alter system delete sql_filter all;
prepare stmt_c1 from select * from t2 where c1=?;
prepare stmt_c2 from select * from t2 where c2=?;
prepare stmt_c1_c2 from select * from t2 where c1=? and c2=?;
prepare stmt_c1_vc2 from select * from t2 where c1=? and c2=1;
prepare stmt_c2_c1 from select * from t2 where c2=? and c1=?;
prepare stmt_c1_limit from select * from t2 where c1=? limit 1;
prepare stmt_sum_c1 from select sum(c1) from t2 where c1=?;
set @c1_1=1;
set @c1_2=2;
set @c2_1=1;
set @c2_2=2;
execute stmt_c1 using @c1_1;
c1	c2
1	1
execute stmt_c1_c2 using @c1_1,@c2_1;
c1	c2
1	1
execute stmt_c2_c1 using @c2_1,@c1_1;
c1	c2
1	1
execute stmt_c1_limit using @c1_1;
c1	c2
1	1
execute stmt_sum_c1 using @c1_1;
sum(c1)
1
alter system add sql_filter key('c1=?',1) type=select max_concurrent=0;
execute stmt_c1 using @c1_1;
ERROR 70100: Query execution was interrupted, rule_id: 30
select * from t2 where c1=1;
c1	c2
1	1
execute stmt_c1 using @c1_2;
c1	c2
2	2
alter system delete sql_filter all;
alter system add sql_filter key('c1=?',1), ('c2=?',1) type=select max_concurrent=0 key_in_order;
execute stmt_c1_c2 using @c1_1,@c2_1;
ERROR 70100: Query execution was interrupted, rule_id: 31
select * from t2 where c1=1 and c2=1;
c1	c2
1	1
execute stmt_c2_c1 using @c2_1,@c1_1;
c1	c2
1	1
execute stmt_c1_vc2 using @c1_1;
c1	c2
1	1
execute stmt_c1_c2 using @c1_1,@c1_2;
c1	c2
execute stmt_c1 using @c1_1;
c1	c2
1	1
alter system delete sql_filter all;
alter system add sql_filter key('c1=?',1), ('c2=?',2) type=select max_concurrent=0;
execute stmt_c1_c2 using @c1_1,@c2_1;
c1	c2
1	1
select * from t2 where c1=1 and c2=2;
c1	c2
execute stmt_c1_c2 using @c1_1,@c2_2;
ERROR 70100: Query execution was interrupted, rule_id: 32
execute stmt_c2_c1 using @c2_2,@c1_1;
ERROR 70100: Query execution was interrupted, rule_id: 32
execute stmt_c1_vc2 using @c1_1;
c1	c2
1	1
execute stmt_c1 using @c1_1;
c1	c2
1	1
alter system delete sql_filter all;
alter system add sql_filter key('c1=?',1), ('c2') type=select max_concurrent=0;
execute stmt_c1_c2 using @c1_1,@c2_1;
ERROR 70100: Query execution was interrupted, rule_id: 33
select * from t2 where c1=1 and c2=1;
c1	c2
1	1
execute stmt_c2_c1 using @c2_1,@c1_1;
ERROR 70100: Query execution was interrupted, rule_id: 33
execute stmt_c1_vc2 using @c1_1;
ERROR 70100: Query execution was interrupted, rule_id: 33
execute stmt_c1_c2 using @c1_1,@c1_2;
ERROR 70100: Query execution was interrupted, rule_id: 33
execute stmt_c1 using @c1_1;
c1	c2
1	1
alter system delete sql_filter all;
alter system add sql_filter key('c1=?',1), ('c2') type=select max_concurrent=0 key_in_order;
execute stmt_c1_c2 using @c1_1,@c2_1;
ERROR 70100: Query execution was interrupted, rule_id: 34
select * from t2 where c1=1 and c2=1;
c1	c2
1	1
execute stmt_c2_c1 using @c2_1,@c1_1;
c1	c2
1	1
execute stmt_c1_vc2 using @c1_1;
ERROR 70100: Query execution was interrupted, rule_id: 34
execute stmt_c1_c2 using @c1_1,@c1_2;
ERROR 70100: Query execution was interrupted, rule_id: 34
execute stmt_c1 using @c1_1;
c1	c2
1	1
alter system delete sql_filter all;
alter system add sql_filter key ('c2'),('c1=?',1) type=select max_concurrent=0;
execute stmt_c1_c2 using @c1_1,@c2_1;
ERROR 70100: Query execution was interrupted, rule_id: 35
select * from t2 where c1=1 and c2=1;
c1	c2
1	1
execute stmt_c2_c1 using @c2_1,@c1_1;
ERROR 70100: Query execution was interrupted, rule_id: 35
execute stmt_c1_vc2 using @c1_1;
ERROR 70100: Query execution was interrupted, rule_id: 35
execute stmt_c1_c2 using @c1_1,@c1_2;
ERROR 70100: Query execution was interrupted, rule_id: 35
execute stmt_c1 using @c1_1;
c1	c2
1	1
alter system delete sql_filter all;
alter system add sql_filter key('c1=?',1), ('limit') type=select max_concurrent=0;
execute stmt_c1_limit using @c1_1;
ERROR 70100: Query execution was interrupted, rule_id: 36
select * from t2 where c1=1 limit 1;
c1	c2
1	1
alter system delete sql_filter all;
alter system add sql_filter key ('sum'),('c1=?',1) type=select max_concurrent=0;
execute stmt_sum_c1 using @c1_1;
ERROR 70100: Query execution was interrupted, rule_id: 37
select sum(c1) from t2 where c1=1;
sum(c1)
1
alter system delete sql_filter all;
alter system add sql_filter key('?',1) type=select max_concurrent=0;
execute stmt_c1 using @c1_1;
ERROR 70100: Query execution was interrupted, rule_id: 38
execute stmt_c1_c2 using @c1_1,@c2_1;
ERROR 70100: Query execution was interrupted, rule_id: 38
execute stmt_c2_c1 using @c2_1,@c1_1;
ERROR 70100: Query execution was interrupted, rule_id: 38
execute stmt_c1_limit using @c1_1;
ERROR 70100: Query execution was interrupted, rule_id: 38
execute stmt_sum_c1 using @c1_1;
ERROR 70100: Query execution was interrupted, rule_id: 38
alter system delete sql_filter all;
alter system add sql_filter key('c1=?',1) type=select max_concurrent=0;
begin;
execute stmt_c1 using @c1_1;
ERROR 70100: Query execution was interrupted, rule_id: 39
select * from t2 where c1=1;
c1	c2
1	1
execute stmt_c1 using @c1_2;
c1	c2
2	2
commit;
alter system delete sql_filter all;
alter system add sql_filter key('c1=?',1), ('c2=?',1) type=select max_concurrent=0 key_in_order;
begin;
execute stmt_c1_c2 using @c1_1,@c2_1;
ERROR 70100: Query execution was interrupted, rule_id: 40
select * from t2 where c1=1 and c2=1;
c1	c2
1	1
execute stmt_c2_c1 using @c2_1,@c1_1;
c1	c2
1	1
execute stmt_c1_vc2 using @c1_1;
c1	c2
1	1
execute stmt_c1_c2 using @c1_1,@c1_2;
c1	c2
execute stmt_c1 using @c1_1;
c1	c2
1	1
commit;
alter system delete sql_filter all;
alter system add sql_filter key('c1=?',1), ('c2=?',2) type=select max_concurrent=0;
begin;
execute stmt_c1_c2 using @c1_1,@c2_1;
c1	c2
1	1
select * from t2 where c1=1 and c2=2;
c1	c2
execute stmt_c1_c2 using @c1_1,@c2_2;
ERROR 70100: Query execution was interrupted, rule_id: 41
execute stmt_c2_c1 using @c2_2,@c1_1;
ERROR 70100: Query execution was interrupted, rule_id: 41
execute stmt_c1_vc2 using @c1_1;
c1	c2
1	1
execute stmt_c1 using @c1_1;
c1	c2
1	1
commit;
alter system delete sql_filter all;
alter system add sql_filter key('c1=?',1), ('c2') type=select max_concurrent=0;
begin;
execute stmt_c1_c2 using @c1_1,@c2_1;
ERROR 70100: Query execution was interrupted, rule_id: 42
select * from t2 where c1=1 and c2=1;
c1	c2
1	1
execute stmt_c2_c1 using @c2_1,@c1_1;
ERROR 70100: Query execution was interrupted, rule_id: 42
execute stmt_c1_vc2 using @c1_1;
ERROR 70100: Query execution was interrupted, rule_id: 42
execute stmt_c1_c2 using @c1_1,@c1_2;
ERROR 70100: Query execution was interrupted, rule_id: 42
execute stmt_c1 using @c1_1;
c1	c2
1	1
commit;
alter system delete sql_filter all;
alter system add sql_filter key('c1=?',1), ('c2') type=select max_concurrent=0 key_in_order;
begin;
execute stmt_c1_c2 using @c1_1,@c2_1;
ERROR 70100: Query execution was interrupted, rule_id: 43
select * from t2 where c1=1 and c2=1;
c1	c2
1	1
execute stmt_c2_c1 using @c2_1,@c1_1;
c1	c2
1	1
execute stmt_c1_vc2 using @c1_1;
ERROR 70100: Query execution was interrupted, rule_id: 43
execute stmt_c1_c2 using @c1_1,@c1_2;
ERROR 70100: Query execution was interrupted, rule_id: 43
execute stmt_c1 using @c1_1;
c1	c2
1	1
commit;
alter system delete sql_filter all;
alter system add sql_filter key ('c2'),('c1=?',1) type=select max_concurrent=0;
begin;
execute stmt_c1_c2 using @c1_1,@c2_1;
ERROR 70100: Query execution was interrupted, rule_id: 44
select * from t2 where c1=1 and c2=1;
c1	c2
1	1
execute stmt_c2_c1 using @c2_1,@c1_1;
ERROR 70100: Query execution was interrupted, rule_id: 44
execute stmt_c1_vc2 using @c1_1;
ERROR 70100: Query execution was interrupted, rule_id: 44
execute stmt_c1_c2 using @c1_1,@c1_2;
ERROR 70100: Query execution was interrupted, rule_id: 44
execute stmt_c1 using @c1_1;
c1	c2
1	1
commit;
alter system delete sql_filter all;
alter system add sql_filter key('c1=?',1), ('limit') type=select max_concurrent=0;
begin;
execute stmt_c1_limit using @c1_1;
ERROR 70100: Query execution was interrupted, rule_id: 45
select * from t2 where c1=1 limit 1;
c1	c2
1	1
commit;
alter system delete sql_filter all;
alter system add sql_filter key ('sum'),('c1=?',1) type=select max_concurrent=0;
begin;
execute stmt_sum_c1 using @c1_1;
ERROR 70100: Query execution was interrupted, rule_id: 46
select sum(c1) from t2 where c1=1;
sum(c1)
1
commit;
alter system delete sql_filter all;
alter system add sql_filter key('?',1) type=select max_concurrent=0;
begin;
execute stmt_c1 using @c1_1;
ERROR 70100: Query execution was interrupted, rule_id: 47
execute stmt_c1_c2 using @c1_1,@c2_1;
ERROR 70100: Query execution was interrupted, rule_id: 47
execute stmt_c2_c1 using @c2_1,@c1_1;
ERROR 70100: Query execution was interrupted, rule_id: 47
execute stmt_c1_limit using @c1_1;
ERROR 70100: Query execution was interrupted, rule_id: 47
execute stmt_sum_c1 using @c1_1;
ERROR 70100: Query execution was interrupted, rule_id: 47
commit;
set autocommit=1;
alter system add sql_filter key('c1=??') type=select max_concurrent=0;
execute stmt_c1 using @c1_1;
ERROR 70100: Query execution was interrupted, rule_id: 48
select * from t2 where c1=1;
c1	c2
1	1
execute stmt_c1 using @c1_2;
ERROR 70100: Query execution was interrupted, rule_id: 48
alter system delete sql_filter all;
alter system add sql_filter key('??') type=select max_concurrent=0;
execute stmt_c1 using @c1_1;
ERROR 70100: Query execution was interrupted, rule_id: 49
select * from t2 where c1=1;
c1	c2
1	1
execute stmt_c1 using @c1_2;
ERROR 70100: Query execution was interrupted, rule_id: 49
execute stmt_c2 using @c1_1;
ERROR 70100: Query execution was interrupted, rule_id: 49
alter system delete sql_filter all;
alter system add sql_filter key('???????????????????') type=select max_concurrent=0;
execute stmt_c1 using @c1_1;
ERROR 70100: Query execution was interrupted, rule_id: 50
select * from t2 where c1=1;
c1	c2
1	1
execute stmt_c1 using @c1_2;
ERROR 70100: Query execution was interrupted, rule_id: 50
execute stmt_c2 using @c1_1;
ERROR 70100: Query execution was interrupted, rule_id: 50
alter system delete sql_filter all;
alter system add sql_filter key('c1=??'),('c2=??') type=select max_concurrent=0;
execute stmt_c1 using @c1_1;
c1	c2
1	1
execute stmt_c2 using @c1_2;
c1	c2
2	2
execute stmt_c1_c2 using @c1_1,@c2_1;
ERROR 70100: Query execution was interrupted, rule_id: 51
execute stmt_c2_c1 using @c2_1,@c1_1;
ERROR 70100: Query execution was interrupted, rule_id: 51
select * from t2 where c1=1 and c2=1;
c1	c2
1	1
alter system delete sql_filter all;
alter system add sql_filter key('c1=??????? and c2=???') type=select max_concurrent=0;
execute stmt_c1 using @c1_1;
c1	c2
1	1
execute stmt_c2 using @c1_2;
c1	c2
2	2
execute stmt_c1_c2 using @c1_1,@c2_1;
ERROR 70100: Query execution was interrupted, rule_id: 52
execute stmt_c2_c1 using @c2_1,@c1_1;
c1	c2
1	1
select * from t2 where c1=1 and c2=1;
c1	c2
1	1
alter system delete sql_filter all;
alter system add sql_filter key('c1=??'),('c2=?',1) type=select max_concurrent=0;
execute stmt_c1 using @c1_1;
c1	c2
1	1
execute stmt_c2 using @c1_2;
c1	c2
2	2
execute stmt_c1_c2 using @c1_1,@c2_1;
ERROR 70100: Query execution was interrupted, rule_id: 53
execute stmt_c2_c1 using @c2_1,@c1_1;
ERROR 70100: Query execution was interrupted, rule_id: 53
select * from t2 where c1=1 and c2=1;
c1	c2
1	1
alter system delete sql_filter all;
alter system add sql_filter key('c1=??????? and c2=?',1) type=select max_concurrent=0;
execute stmt_c1 using @c1_1;
c1	c2
1	1
execute stmt_c2 using @c1_2;
c1	c2
2	2
execute stmt_c1_c2 using @c1_1,@c2_1;
ERROR 70100: Query execution was interrupted, rule_id: 54
execute stmt_c2_c1 using @c2_1,@c1_1;
c1	c2
1	1
select * from t2 where c1=1 and c2=1;
c1	c2
1	1
alter system delete sql_filter all;
alter system add sql_filter key('c1=?',1),('c2=?',1) type=select max_concurrent=0;
execute stmt_c1 using @c1_1;
c1	c2
1	1
execute stmt_c2 using @c1_2;
c1	c2
2	2
execute stmt_c1_c2 using @c1_1,@c2_1;
ERROR 70100: Query execution was interrupted, rule_id: 55
execute stmt_c2_c1 using @c2_1,@c1_1;
ERROR 70100: Query execution was interrupted, rule_id: 55
select * from t2 where c1=1 and c2=1;
c1	c2
1	1
alter system delete sql_filter all;
alter system add sql_filter key('c1=? and c2=?',1,1) type=select max_concurrent=0;
execute stmt_c1 using @c1_1;
c1	c2
1	1
execute stmt_c2 using @c1_2;
c1	c2
2	2
execute stmt_c1_c2 using @c1_1,@c2_1;
ERROR 70100: Query execution was interrupted, rule_id: 56
execute stmt_c2_c1 using @c2_1,@c1_1;
c1	c2
1	1
select * from t2 where c1=1 and c2=1;
c1	c2
1	1
alter system delete sql_filter all;
