drop table if exists test;
create table test(c1 int primary key, c2 timestamp, c3 timestamp default now());
insert into test values(1, NULL, now());
select c2 = c3 from test;
c2 = c3
1
update test set c1 = 2, c2 = NULL, c3 = now();
select c2 = c3 from test;
c2 = c3
1
insert into test values(2, now(), now()) on duplicate key update c2=NULL, c3= now();
select c2 = c3 from test;
c2 = c3
1
replace into test values(2, NULL, now());
select c2 = c3 from test;
c2 = c3
1
drop table if exists test;
create table test(c1 int primary key, c2 timestamp default 0, c3 timestamp);
insert into test values(1, NULL, now());
select c2 = c3 from test;
c2 = c3
1
update test set c1 = 2, c2 = NULL, c3 = now();
select c2 = c3 from test;
c2 = c3
1
insert into test values(2, now(), now()) on duplicate key update c2=NULL, c3= now();
select c2 = c3 from test;
c2 = c3
1
replace into test values(2, NULL, now());
select c2 = c3 from test;
c2 = c3
1
drop table if exists test;
create table test(c1 int primary key, c2 timestamp default '2010-03-24', c3 timestamp);
insert into test values(1, NULL, now());
select c2 = c3 from test;
c2 = c3
1
update test set c1 = 2, c2 = NULL, c3 = now();
select c2 = c3 from test;
c2 = c3
1
insert into test values(2, now(), now()) on duplicate key update c2=NULL, c3= now();
select c2 = c3 from test;
c2 = c3
1
replace into test values(2, NULL, now());
select c2 = c3 from test;
c2 = c3
1
drop table if exists test;
create table test(c1 int primary key, c2 timestamp NULL , c3 timestamp);
insert into test values(1, NULL, NULL);
select c2, c2 = c3 from test;
c2	c2 = c3
NULL	NULL
update test set c1 = 2, c2 = NULL, c3 = now();
select c2, c2 = c3 from test;
c2	c2 = c3
NULL	NULL
insert into test values(2, now(), now()) on duplicate key update c2=NULL, c3= now();
select c2 = c3 from test;
c2 = c3
NULL
replace into test values(2, NULL, now());
select c2 = c3 from test;
c2 = c3
NULL
drop table if exists test;
create table test(c1 int primary key, c2 timestamp NULL default '2013-03-12', c3 timestamp);
insert into test values(1, NULL, NULL);
select c2, c2 = c3 from test;
c2	c2 = c3
NULL	NULL
update test set c1 = 2, c2 = NULL, c3 = now();
select c2, c2 = c3 from test;
c2	c2 = c3
NULL	NULL
insert into test values(2, now(), now()) on duplicate key update c2=NULL, c3= now();
select c2 = c3 from test;
c2 = c3
NULL
replace into test values(2, NULL, now());
select c2 = c3 from test;
c2 = c3
NULL
drop table test;
