drop table if exists test;
create table test (c1 int primary key, c2 timestamp NULL, c3 timestamp default current_timestamp, c4 int, c5 timestamp default current_timestamp on update current_timestamp, c6 timestamp);
insert into test (c1, c4) values(1,1);
select c2 = c3, c2 = c5, c2 = c6, c3 = c5, c3 = c6, c5 = c6 from test;
c2 = c3	c2 = c5	c2 = c6	c3 = c5	c3 = c6	c5 = c6
NULL	NULL	NULL	1	0	0
update test set c4 = 5;
select c2 = c3, c2 = c5, c2 = c6, c3 = c5, c3 = c6, c5 = c6 from test;
c2 = c3	c2 = c5	c2 = c6	c3 = c5	c3 = c6	c5 = c6
NULL	NULL	NULL	0	0	0
update test set c4 = 5;
select c2 = c3, c2 = c5, c2 = c6, c3 = c5, c3 = c6, c5 = c6 from test;
c2 = c3	c2 = c5	c2 = c6	c3 = c5	c3 = c6	c5 = c6
NULL	NULL	NULL	0	0	0
update test set c2 = now();
select c2 = c3, c2 = c5, c2 = c6, c3 = c5, c3 = c6, c5 = c6 from test;
c2 = c3	c2 = c5	c2 = c6	c3 = c5	c3 = c6	c5 = c6
0	1	0	0	0	0
drop table if exists test;
create table test (c1 int primary key, c2 timestamp default '2011-01-01', c3 timestamp default current_timestamp, c4 int, c5 timestamp default current_timestamp on update current_timestamp,c6 timestamp);
insert into test (c1, c4) values(1,1);
select c2 = c3, c2 = c5, c2 = c6, c3 = c5, c3 = c6, c5 = c6 from test;
c2 = c3	c2 = c5	c2 = c6	c3 = c5	c3 = c6	c5 = c6
0	0	0	1	0	0
update test set c4 = 5;
select c2 = c3, c2 = c5, c2 = c6, c3 = c5, c3 = c6, c5 = c6 from test;
c2 = c3	c2 = c5	c2 = c6	c3 = c5	c3 = c6	c5 = c6
0	0	0	0	0	0
update test set c4 = 5;
select c2 = c3, c2 = c5, c2 = c6, c3 = c5, c3 = c6, c5 = c6 from test;
c2 = c3	c2 = c5	c2 = c6	c3 = c5	c3 = c6	c5 = c6
0	0	0	0	0	0
update test set c2 = now();
select c2 = c3, c2 = c5, c2 = c6, c3 = c5, c3 = c6, c5 = c6 from test;
c2 = c3	c2 = c5	c2 = c6	c3 = c5	c3 = c6	c5 = c6
0	1	0	0	0	0
drop table if exists test;
create table test (c1 int primary key, c2 timestamp default 0, c3 timestamp default current_timestamp, c4 int, c5 timestamp default current_timestamp on update current_timestamp, c6 timestamp);
insert into test (c1, c4) values(1,1);
select c2 = c3, c2 = c5, c2 = c6, c3 = c5, c3 = c6, c5 = c6 from test;
c2 = c3	c2 = c5	c2 = c6	c3 = c5	c3 = c6	c5 = c6
0	0	1	1	0	0
update test set c4 = 5;
select c2 = c3, c2 = c5, c2 = c6, c3 = c5, c3 = c6, c5 = c6 from test;
c2 = c3	c2 = c5	c2 = c6	c3 = c5	c3 = c6	c5 = c6
0	0	1	0	0	0
update test set c4 = 5;
select c2 = c3, c2 = c5, c2 = c6, c3 = c5, c3 = c6, c5 = c6 from test;
c2 = c3	c2 = c5	c2 = c6	c3 = c5	c3 = c6	c5 = c6
0	0	1	0	0	0
update test set c2 = now();
select c2 = c3, c2 = c5, c2 = c6, c3 = c5, c3 = c6, c5 = c6 from test;
c2 = c3	c2 = c5	c2 = c6	c3 = c5	c3 = c6	c5 = c6
0	1	0	0	0	0
create table test (c1 int primary key, c2 timestamp default now(), c3 timestamp default current_timestamp, c4 int, c5 timestamp default current_timestamp on update current_timestamp, c6 timestamp);
ERROR 42S01: Table 'test' already exists
insert into test (c1, c4) values(1,1);
ERROR 23000: Duplicate entry '1' for key 'PRIMARY'
select c2 = c3, c2 = c5, c2 = c6, c3 = c5, c3 = c6, c5 = c6 from test;
c2 = c3	c2 = c5	c2 = c6	c3 = c5	c3 = c6	c5 = c6
0	1	0	0	0	0
update test set c4 = 5;
select c2 = c3, c2 = c5, c2 = c6, c3 = c5, c3 = c6, c5 = c6 from test;
c2 = c3	c2 = c5	c2 = c6	c3 = c5	c3 = c6	c5 = c6
0	1	0	0	0	0
update test set c4 = 5;
select c2 = c3, c2 = c5, c2 = c6, c3 = c5, c3 = c6, c5 = c6 from test;
c2 = c3	c2 = c5	c2 = c6	c3 = c5	c3 = c6	c5 = c6
0	1	0	0	0	0
update test set c2 = now();
select c2 = c3, c2 = c5, c2 = c6, c3 = c5, c3 = c6, c5 = c6 from test;
c2 = c3	c2 = c5	c2 = c6	c3 = c5	c3 = c6	c5 = c6
0	1	0	0	0	0
drop table if exists test;
create table test (c1 int primary key, c2 timestamp on update current_timestamp, c3 timestamp default current_timestamp, c4 int, c5 timestamp default current_timestamp on update current_timestamp, c6 timestamp);
insert into test (c1, c4) values(1,1);
select c2 = c3, c2 = c5, c2 = c6, c3 = c5, c3 = c6, c5 = c6 from test;
c2 = c3	c2 = c5	c2 = c6	c3 = c5	c3 = c6	c5 = c6
0	0	1	1	0	0
update test set c4 = 5;
select c2 = c3, c2 = c5, c2 = c6, c3 = c5, c3 = c6, c5 = c6 from test;
c2 = c3	c2 = c5	c2 = c6	c3 = c5	c3 = c6	c5 = c6
0	1	0	0	0	0
update test set c4 = 5;
select c2 = c3, c2 = c5, c2 = c6, c3 = c5, c3 = c6, c5 = c6 from test;
c2 = c3	c2 = c5	c2 = c6	c3 = c5	c3 = c6	c5 = c6
0	1	0	0	0	0
update test set c2 = now();
select c2 = c3, c2 = c5, c2 = c6, c3 = c5, c3 = c6, c5 = c6 from test;
c2 = c3	c2 = c5	c2 = c6	c3 = c5	c3 = c6	c5 = c6
0	1	0	0	0	0
drop table test;
create table test(c1 int primary key, c2 timestamp, c3 timestamp default current_timestamp on update current_timestamp, c4 int, c5 timestamp, c6 timestamp);
insert into test (c1,c4) values(1,1);
select c2 = c3, c2 = c5, c2 = c6, c3 = c5, c3 = c6, c5 = c6 from test;
c2 = c3	c2 = c5	c2 = c6	c3 = c5	c3 = c6	c5 = c6
1	0	0	0	0	1
update test set c4= 2;
select c2 = c3 from test where c1 = 1;
c2 = c3
1
update test set c5 = c2, c1=1,c4=2;
select c2 = c3, c2 = c5, c2 = c6, c3 = c5, c3 = c6, c5 = c6 from test;
c2 = c3	c2 = c5	c2 = c6	c3 = c5	c3 = c6	c5 = c6
1	0	0	0	0	0
insert into test (c1) values(1) on duplicate key update c4 = 4, c5 = c2;
select c2 = c3, c2 = c5, c2 = c6, c3 = c5, c3 = c6, c5 = c6 from test;
c2 = c3	c2 = c5	c2 = c6	c3 = c5	c3 = c6	c5 = c6
1	0	0	0	0	0
insert into test (c1) values(1) on duplicate key update c4 = 4;
select c2 = c3, c2 = c5, c2 = c6, c3 = c5, c3 = c6, c5 = c6 from test;
c2 = c3	c2 = c5	c2 = c6	c3 = c5	c3 = c6	c5 = c6
1	0	0	0	0	0
replace into test (c1,c4) values(1,4);
select c2 = c3, c2 = c5, c2 = c6, c3 = c5, c3 = c6, c5 = c6 from test;
c2 = c3	c2 = c5	c2 = c6	c3 = c5	c3 = c6	c5 = c6
1	0	0	0	0	1
insert into test(c1,c2,c4) values(2, NULL, 3);
select c2 = c3, c2 = c5, c2 = c6, c3 = c5, c3 = c6, c5 = c6 from test;
c2 = c3	c2 = c5	c2 = c6	c3 = c5	c3 = c6	c5 = c6
1	0	0	0	0	1
1	0	0	0	0	1
insert into test (c1, c5) values(3, now());
select c2 = c3, c2 = c5, c2 = c6, c3 = c5, c3 = c6, c5 = c6 from test;
c2 = c3	c2 = c5	c2 = c6	c3 = c5	c3 = c6	c5 = c6
1	0	0	0	0	1
1	0	0	0	0	1
1	1	0	1	0	0
update test set c2 = c4+1 where c1 = 3;
select c2 = c3, c2 = c5, c2 = c6, c3 = c5, c3 = c6, c5 = c6 from test;
c2 = c3	c2 = c5	c2 = c6	c3 = c5	c3 = c6	c5 = c6
1	0	0	0	0	1
1	0	0	0	0	1
1	0	0	0	0	0
insert into test (c1) value (3) on duplicate key update c5 = c2, c2=c4+1;
select c2 = c3, c2 = c5, c2 = c6, c3 = c5, c3 = c6, c5 = c6 from test;
c2 = c3	c2 = c5	c2 = c6	c3 = c5	c3 = c6	c5 = c6
1	0	0	0	0	1
1	0	0	0	0	1
1	0	0	0	0	0
insert into test(c1,c2, c5) values(5,NULL, NULL);
select c2 = c3, c2 = c5, c2 = c6, c3 = c5, c3 = c6, c5 = c6 from test;
c2 = c3	c2 = c5	c2 = c6	c3 = c5	c3 = c6	c5 = c6
1	0	0	0	0	1
1	0	0	0	0	1
1	0	0	0	0	0
1	1	0	1	0	0
update test set c2 = c4+1 , c5 = c2 where c1= 5;
select c2 = c3, c2 = c5, c2 = c6, c3 = c5, c3 = c6, c5 = c6 from test;
c2 = c3	c2 = c5	c2 = c6	c3 = c5	c3 = c6	c5 = c6
1	0	0	0	0	1
1	0	0	0	0	1
1	0	0	0	0	0
1	1	0	1	0	0
replace into test(c1,c2, c5) values(4, NULL, now());
select c2 = c3, c2 = c5, c2 = c6, c3 = c5, c3 = c6, c5 = c6 from test;
c2 = c3	c2 = c5	c2 = c6	c3 = c5	c3 = c6	c5 = c6
1	0	0	0	0	1
1	0	0	0	0	1
1	0	0	0	0	0
1	1	0	1	0	0
1	1	0	1	0	0
drop table test;
