drop table if exists test;
create table test (c1 int primary key, c2 timestamp default 0);
insert into test (c1) values (1);
select * from test;
c1	c2
1	0000-00-00 00:00:00
drop table if exists test;
create table test (c1 int primary key, c2 timestamp default NULL);
ERROR 42000: Invalid default value for 'c2'
drop table if exists test;
create table test (c1 int primary key, c2 timestamp, c3 timestamp default NULL);
ERROR 42000: Invalid default value for 'c3'
drop table if exists test;
create table test (c1 int primary key, c2 timestamp default '2013-01-01');
insert into test (c1) values (1);
select * from test;
c1	c2
1	2013-01-01 00:00:00
drop table if exists test;
create table test (c1 int primary key, c2 timestamp, c3 timestamp);
insert into test (c1,c3) values (1, now());
select c2=c3 from test;
c2=c3
1
drop table if exists test;
create table test (c1 int primary key, c2 timestamp NULL, c3 timestamp);
insert into test (c1,c3) values (1, now());
select c2=c3 from test;
c2=c3
NULL
drop table if exists test;
create table test (c1 int primary key, c2 timestamp on update current_timestamp, c3 timestamp);
insert into test (c1) values (1);
select c2=c3 from test;
c2=c3
1
drop table if exists test;
create table test (c1 int primary key, c2 timestamp, c3 timestamp);
insert into test (c1) values (1);
select c3 from test;
c3
0000-00-00 00:00:00
drop table if exists test;
create table test (c1 int primary key, c2 timestamp, c3 timestamp, c4 int);
insert into test (c1, c2, c3) values (1, default, default);
select c3, c2 = c3 from test;
c3	c2 = c3
0000-00-00 00:00:00	0
update test set c4 = 1, c2 = default, c3 = default;
select c3, c2 = c3 from test;
c3	c2 = c3
0000-00-00 00:00:00	0
drop table if exists test;
create table test (c1 int primary key, c2 timestamp, c3 timestamp, c4 int);
insert into test (c1, c2, c3) values (1, default(c2), default(c3));
select c3, c2 = c3 from test;
c3	c2 = c3
0000-00-00 00:00:00	1
update test set c4 = 1, c2 = default(c2), c3 = default(c3);
select c3, c2 = c3 from test;
c3	c2 = c3
0000-00-00 00:00:00	1
drop table test;
create table test (c1 int primary key, c2 timestamp, c3 timestamp, c4 int);
insert into test set c1 = 1, c2 = c2, c3 = c3;
select * from test;
c1	c2	c3	c4
1	0000-00-00 00:00:00	0000-00-00 00:00:00	NULL
'timestamp column has default now(), c1 = c1 return 0'
drop table test;
create table test(c1 int primary key, c2 timestamp, c3 timestamp default now());
insert into test set c1=1,c2=c2,c3=c3;
select * from test;
c1	c2	c3
1	0000-00-00 00:00:00	0000-00-00 00:00:00
insert into test set c1 = 2, c2 = default(c2), c3 = default(c3);
select * from test;
c1	c2	c3
1	0000-00-00 00:00:00	0000-00-00 00:00:00
2	0000-00-00 00:00:00	0000-00-00 00:00:00
insert into test set c1 = 3, c2 = default, c3 =default;
select c2=c3,c2=0,c3=0,datediff(c2,now())<0,datediff(c3,now())<0 from test where c1 = 3;
c2=c3	c2=0	c3=0	datediff(c2,now())<0	datediff(c3,now())<0
1	0	0	0	0
delete from test;
insert into test values(4, c2,c3);
select * from test;
c1	c2	c3
4	0000-00-00 00:00:00	0000-00-00 00:00:00
insert into test values(5, default, default);
select c2=c3,c2=0,c3=0,datediff(c2,now())<0,datediff(c3,now())<0 from test where c1 = 5;
c2=c3	c2=0	c3=0	datediff(c2,now())<0	datediff(c3,now())<0
1	0	0	0	0
delete from test;
insert into test values(6, default(c2), default(c3));
select * from test;
c1	c2	c3
6	0000-00-00 00:00:00	0000-00-00 00:00:00
insert into test values(7, '2011-01-01 11:11:11', '2011-01-01 11:11:11');
update test set c2=default, c3=default where c1 = 7;
select c2=c3,c2=0,c3=0,datediff(c2,now())<0,datediff(c3,now())<0 from test where c1 = 7;
c2=c3	c2=0	c3=0	datediff(c2,now())<0	datediff(c3,now())<0
1	0	0	0	0
delete from test;
insert into test values(8, '2011-01-01 11:11:11', '2011-01-01 11:11:11');
update test set c2=default(c2), c3=default(c3) where c1 = 8;
select * from test;
c1	c2	c3
8	0000-00-00 00:00:00	0000-00-00 00:00:00
'timestamp column has default not now(), c1 = c1 return default_value'
drop table test;
create table test(c1 int primary key, c2 timestamp default '2011-01-21 12:12:12', c3 timestamp default '2011-01-21 12:12:12');
insert into test set c1=1,c2=c2,c3=c3;
select * from test;
c1	c2	c3
1	2011-01-21 12:12:12	2011-01-21 12:12:12
insert into test set c1 = 2, c2 = default(c2), c3 = default(c3);
select * from test;
c1	c2	c3
1	2011-01-21 12:12:12	2011-01-21 12:12:12
2	2011-01-21 12:12:12	2011-01-21 12:12:12
insert into test set c1 = 3, c2 = default, c3 =default;
select c2=c3,c2=0,c3=0,datediff(c2,now())<0,datediff(c3,now())<0 from test where c1 = 3;
c2=c3	c2=0	c3=0	datediff(c2,now())<0	datediff(c3,now())<0
1	0	0	1	1
delete from test;
insert into test values(4, c2,c3);
select * from test;
c1	c2	c3
4	2011-01-21 12:12:12	2011-01-21 12:12:12
insert into test values(5, default, default);
select c2=c3,c2=0,c3=0,datediff(c2,now())<0,datediff(c3,now())<0 from test where c1 = 5;
c2=c3	c2=0	c3=0	datediff(c2,now())<0	datediff(c3,now())<0
1	0	0	1	1
delete from test;
insert into test values(6, default(c2), default(c3));
select * from test;
c1	c2	c3
6	2011-01-21 12:12:12	2011-01-21 12:12:12
insert into test values(7, '2011-01-01 11:11:11', '2011-01-01 11:11:11');
update test set c2=default, c3=default where c1 = 7;
select c2=c3,c2=0,c3=0,datediff(c2,now())<0,datediff(c3,now())<0 from test where c1 = 7;
c2=c3	c2=0	c3=0	datediff(c2,now())<0	datediff(c3,now())<0
1	0	0	1	1
delete from test;
insert into test values(8, '2011-01-01 11:11:11', '2011-01-01 11:11:11');
update test set c2=default(c2), c3=default(c3) where c1 = 8;
select * from test;
c1	c2	c3
8	2011-01-21 12:12:12	2011-01-21 12:12:12
'timestamp column nullable has default now()'
drop table test;
create table test(c1 int primary key, c2 timestamp null default now(), c3 timestamp null default '2011-01-21 12:12:12');
insert into test set c1=1,c2=c2,c3=c3;
select * from test;
c1	c2	c3
1	NULL	2011-01-21 12:12:12
insert into test set c1 = 2, c2 = default(c2), c3 = default(c3);
select * from test;
c1	c2	c3
1	NULL	2011-01-21 12:12:12
2	NULL	2011-01-21 12:12:12
insert into test set c1 = 3, c2 = default, c3 =default;
select c2=c3,c2=0,c3=0,datediff(c2,now())<0,datediff(c3,now())<0 from test where c1 = 3;
c2=c3	c2=0	c3=0	datediff(c2,now())<0	datediff(c3,now())<0
0	0	0	0	1
delete from test;
insert into test values(4, c2,c3);
select * from test;
c1	c2	c3
4	NULL	2011-01-21 12:12:12
insert into test values(5, default, default);
select c2=c3,c2=0,c3=0,datediff(c2,now())<0,datediff(c3,now())<0 from test where c1 = 5;
c2=c3	c2=0	c3=0	datediff(c2,now())<0	datediff(c3,now())<0
0	0	0	0	1
delete from test;
insert into test values(6, default(c2), default(c3));
select * from test;
c1	c2	c3
6	NULL	2011-01-21 12:12:12
insert into test values(7, '2011-01-01 11:11:11', '2011-01-01 11:11:11');
update test set c2=default, c3=default where c1 = 7;
select c2=c3,c2=0,c3=0,datediff(c2,now())<0,datediff(c3,now())<0 from test where c1 = 7;
c2=c3	c2=0	c3=0	datediff(c2,now())<0	datediff(c3,now())<0
0	0	0	0	1
delete from test;
insert into test values(8, '2011-01-01 11:11:11', '2011-01-01 11:11:11');
update test set c2=default(c2), c3=default(c3) where c1 = 8;
select * from test;
c1	c2	c3
8	NULL	2011-01-21 12:12:12
'test insert into test values(1, c2,c3);'
drop table test;
create table test(c1 int primary key, c2 timestamp, c3 timestamp default now());
insert into test values(1, c2,c3);
select * from test;
c1	c2	c3
1	0000-00-00 00:00:00	0000-00-00 00:00:00
insert into test set c1 = 2, c2 = default(c2), c3 = default(c3);
select * from test;
c1	c2	c3
1	0000-00-00 00:00:00	0000-00-00 00:00:00
2	0000-00-00 00:00:00	0000-00-00 00:00:00
insert into test set c1 = 3, c2 = default, c3 =default;
select c2=c3,c2=0,c3=0,datediff(c2,now())<0,datediff(c3,now())<0 from test where c1 = 3;
c2=c3	c2=0	c3=0	datediff(c2,now())<0	datediff(c3,now())<0
1	0	0	0	0
delete from test;
insert into test values(4, c2,c3);
select * from test;
c1	c2	c3
4	0000-00-00 00:00:00	0000-00-00 00:00:00
insert into test values(5, default, default);
select c2=c3,c2=0,c3=0,datediff(c2,now())<0,datediff(c3,now())<0 from test where c1 = 5;
c2=c3	c2=0	c3=0	datediff(c2,now())<0	datediff(c3,now())<0
1	0	0	0	0
delete from test;
insert into test values(6, default(c2), default(c3));
select * from test;
c1	c2	c3
6	0000-00-00 00:00:00	0000-00-00 00:00:00
insert into test values(7, '2011-01-01 11:11:11', '2011-01-01 11:11:11');
update test set c2=default, c3=default where c1 = 7;
select c2=c3,c2=0,c3=0,datediff(c2,now())<0,datediff(c3,now())<0 from test where c1 = 7;
c2=c3	c2=0	c3=0	datediff(c2,now())<0	datediff(c3,now())<0
1	0	0	0	0
delete from test;
insert into test values(8, '2011-01-01 11:11:11', '2011-01-01 11:11:11');
update test set c2=default(c2), c3=default(c3) where c1 = 8;
select * from test;
c1	c2	c3
8	0000-00-00 00:00:00	0000-00-00 00:00:00
'timestamp column has default not now(), c1 = c1 return default_value'
drop table test;
create table test(c1 int primary key, c2 timestamp default '2011-01-21 12:12:12', c3 timestamp default '2011-01-21 12:12:12');
insert into test values(1,c2,c3);
select * from test;
c1	c2	c3
1	2011-01-21 12:12:12	2011-01-21 12:12:12
insert into test set c1 = 2, c2 = default(c2), c3 = default(c3);
select * from test;
c1	c2	c3
1	2011-01-21 12:12:12	2011-01-21 12:12:12
2	2011-01-21 12:12:12	2011-01-21 12:12:12
insert into test set c1 = 3, c2 = default, c3 =default;
select c2=c3,c2=0,c3=0,datediff(c2,now())<0,datediff(c3,now())<0 from test where c1 = 3;
c2=c3	c2=0	c3=0	datediff(c2,now())<0	datediff(c3,now())<0
1	0	0	1	1
delete from test;
insert into test values(4, c2,c3);
select * from test;
c1	c2	c3
4	2011-01-21 12:12:12	2011-01-21 12:12:12
insert into test values(5, default, default);
select c2=c3,c2=0,c3=0,datediff(c2,now())<0,datediff(c3,now())<0 from test where c1 = 5;
c2=c3	c2=0	c3=0	datediff(c2,now())<0	datediff(c3,now())<0
1	0	0	1	1
delete from test;
insert into test values(6, default(c2), default(c3));
select * from test;
c1	c2	c3
6	2011-01-21 12:12:12	2011-01-21 12:12:12
insert into test values(7, '2011-01-01 11:11:11', '2011-01-01 11:11:11');
update test set c2=default, c3=default where c1 = 7;
select c2=c3,c2=0,c3=0,datediff(c2,now())<0,datediff(c3,now())<0 from test where c1 = 7;
c2=c3	c2=0	c3=0	datediff(c2,now())<0	datediff(c3,now())<0
1	0	0	1	1
delete from test;
insert into test values(8, '2011-01-01 11:11:11', '2011-01-01 11:11:11');
update test set c2=default(c2), c3=default(c3) where c1 = 8;
select * from test;
c1	c2	c3
8	2011-01-21 12:12:12	2011-01-21 12:12:12
'timestamp column nullable has default now()'
drop table test;
create table test(c1 int primary key, c2 timestamp null default now(), c3 timestamp null default '2011-01-21 12:12:12');
insert into test values(1,c2,c3);
select * from test;
c1	c2	c3
1	NULL	2011-01-21 12:12:12
insert into test set c1 = 2, c2 = default(c2), c3 = default(c3);
select * from test;
c1	c2	c3
1	NULL	2011-01-21 12:12:12
2	NULL	2011-01-21 12:12:12
insert into test set c1 = 3, c2 = default, c3 =default;
select c2=c3,c2=0,c3=0,datediff(c2,now())<0,datediff(c3,now())<0 from test where c1 = 3;
c2=c3	c2=0	c3=0	datediff(c2,now())<0	datediff(c3,now())<0
0	0	0	0	1
delete from test;
insert into test values(4, c2,c3);
select * from test;
c1	c2	c3
4	NULL	2011-01-21 12:12:12
insert into test values(5, default, default);
select c2=c3,c2=0,c3=0,datediff(c2,now())<0,datediff(c3,now())<0 from test where c1 = 5;
c2=c3	c2=0	c3=0	datediff(c2,now())<0	datediff(c3,now())<0
0	0	0	0	1
delete from test;
insert into test values(6, default(c2), default(c3));
select * from test;
c1	c2	c3
6	NULL	2011-01-21 12:12:12
insert into test values(7, '2011-01-01 11:11:11', '2011-01-01 11:11:11');
update test set c2=default, c3=default where c1 = 7;
select c2=c3,c2=0,c3=0,datediff(c2,now())<0,datediff(c3,now())<0 from test where c1 = 7;
c2=c3	c2=0	c3=0	datediff(c2,now())<0	datediff(c3,now())<0
0	0	0	0	1
delete from test;
insert into test values(8, '2011-01-01 11:11:11', '2011-01-01 11:11:11');
update test set c2=default(c2), c3=default(c3) where c1 = 8;
select * from test;
c1	c2	c3
8	NULL	2011-01-21 12:12:12
drop table test;
create table test(c1 int primary key, c2 timestamp, c3 timestamp);
insert into test values(1,c2,c3);
insert into test set c1 = 20, c2 = c2, c3=c3;
select * from test;
c1	c2	c3
1	0000-00-00 00:00:00	0000-00-00 00:00:00
20	0000-00-00 00:00:00	0000-00-00 00:00:00
insert into test set c1 = 2, c2 = default(c2), c3 = default(c3);
select * from test;
c1	c2	c3
1	0000-00-00 00:00:00	0000-00-00 00:00:00
2	0000-00-00 00:00:00	0000-00-00 00:00:00
20	0000-00-00 00:00:00	0000-00-00 00:00:00
insert into test set c1 = 3, c2 = default, c3 =default;
select c2=c3,c2=0,c3=0,datediff(c2,now())<0,datediff(c3,now())<0 from test where c1 = 3;
c2=c3	c2=0	c3=0	datediff(c2,now())<0	datediff(c3,now())<0
0	0	1	0	NULL
delete from test;
insert into test values(4, c2,c3);
select * from test;
c1	c2	c3
4	0000-00-00 00:00:00	0000-00-00 00:00:00
insert into test values(5, default, default);
select c2=c3,c2=0,c3=0,datediff(c2,now())<0,datediff(c3,now())<0 from test where c1 = 5;
c2=c3	c2=0	c3=0	datediff(c2,now())<0	datediff(c3,now())<0
0	0	1	0	NULL
delete from test;
insert into test values(6, default(c2), default(c3));
select * from test;
c1	c2	c3
6	0000-00-00 00:00:00	0000-00-00 00:00:00
insert into test values(7, '2011-01-01 11:11:11', '2011-01-01 11:11:11');
update test set c2=default, c3=default where c1 = 7;
select c2=c3,c2=0,c3=0,datediff(c2,now())<0,datediff(c3,now())<0 from test where c1 = 7;
c2=c3	c2=0	c3=0	datediff(c2,now())<0	datediff(c3,now())<0
0	0	1	0	NULL
delete from test;
insert into test values(8, '2011-01-01 11:11:11', '2011-01-01 11:11:11');
update test set c2=default(c2), c3=default(c3) where c1 = 8;
select * from test;
c1	c2	c3
8	0000-00-00 00:00:00	0000-00-00 00:00:00
'change sql_mode to not strict'
set @@sql_mode='';
'timestamp column has default now(), c1 = c1 return 0'
drop table test;
create table test(c1 int primary key, c2 timestamp, c3 timestamp default now());
insert into test set c1=1,c2=c2,c3=c3;
select * from test;
c1	c2	c3
1	0000-00-00 00:00:00	0000-00-00 00:00:00
insert into test set c1 = 2, c2 = default(c2), c3 = default(c3);
select * from test;
c1	c2	c3
1	0000-00-00 00:00:00	0000-00-00 00:00:00
2	0000-00-00 00:00:00	0000-00-00 00:00:00
insert into test set c1 = 3, c2 = default, c3 =default;
select c2=c3,c2=0,c3=0,datediff(c2,now())<0,datediff(c3,now())<0 from test where c1 = 3;
c2=c3	c2=0	c3=0	datediff(c2,now())<0	datediff(c3,now())<0
1	0	0	0	0
delete from test;
insert into test values(4, c2,c3);
select * from test;
c1	c2	c3
4	0000-00-00 00:00:00	0000-00-00 00:00:00
insert into test values(5, default, default);
select c2=c3,c2=0,c3=0,datediff(c2,now())<0,datediff(c3,now())<0 from test where c1 = 5;
c2=c3	c2=0	c3=0	datediff(c2,now())<0	datediff(c3,now())<0
1	0	0	0	0
delete from test;
insert into test values(6, default(c2), default(c3));
select * from test;
c1	c2	c3
6	0000-00-00 00:00:00	0000-00-00 00:00:00
insert into test values(7, '2011-01-01 11:11:11', '2011-01-01 11:11:11');
update test set c2=default, c3=default where c1 = 7;
select c2=c3,c2=0,c3=0,datediff(c2,now())<0,datediff(c3,now())<0 from test where c1 = 7;
c2=c3	c2=0	c3=0	datediff(c2,now())<0	datediff(c3,now())<0
1	0	0	0	0
delete from test;
insert into test values(8, '2011-01-01 11:11:11', '2011-01-01 11:11:11');
update test set c2=default(c2), c3=default(c3) where c1 = 8;
select * from test;
c1	c2	c3
8	0000-00-00 00:00:00	0000-00-00 00:00:00
'timestamp column has default not now(), c1 = c1 return default_value'
drop table test;
create table test(c1 int primary key, c2 timestamp default '2011-01-21 12:12:12', c3 timestamp default '2011-01-21 12:12:12');
insert into test set c1=1,c2=c2,c3=c3;
select * from test;
c1	c2	c3
1	2011-01-21 12:12:12	2011-01-21 12:12:12
insert into test set c1 = 2, c2 = default(c2), c3 = default(c3);
select * from test;
c1	c2	c3
1	2011-01-21 12:12:12	2011-01-21 12:12:12
2	2011-01-21 12:12:12	2011-01-21 12:12:12
insert into test set c1 = 3, c2 = default, c3 =default;
select c2=c3,c2=0,c3=0,datediff(c2,now())<0,datediff(c3,now())<0 from test where c1 = 3;
c2=c3	c2=0	c3=0	datediff(c2,now())<0	datediff(c3,now())<0
1	0	0	1	1
delete from test;
insert into test values(4, c2,c3);
select * from test;
c1	c2	c3
4	2011-01-21 12:12:12	2011-01-21 12:12:12
insert into test values(5, default, default);
select c2=c3,c2=0,c3=0,datediff(c2,now())<0,datediff(c3,now())<0 from test where c1 = 5;
c2=c3	c2=0	c3=0	datediff(c2,now())<0	datediff(c3,now())<0
1	0	0	1	1
delete from test;
insert into test values(6, default(c2), default(c3));
select * from test;
c1	c2	c3
6	2011-01-21 12:12:12	2011-01-21 12:12:12
insert into test values(7, '2011-01-01 11:11:11', '2011-01-01 11:11:11');
update test set c2=default, c3=default where c1 = 7;
select c2=c3,c2=0,c3=0,datediff(c2,now())<0,datediff(c3,now())<0 from test where c1 = 7;
c2=c3	c2=0	c3=0	datediff(c2,now())<0	datediff(c3,now())<0
1	0	0	1	1
delete from test;
insert into test values(8, '2011-01-01 11:11:11', '2011-01-01 11:11:11');
update test set c2=default(c2), c3=default(c3) where c1 = 8;
select * from test;
c1	c2	c3
8	2011-01-21 12:12:12	2011-01-21 12:12:12
'timestamp column nullable has default now()'
drop table test;
create table test(c1 int primary key, c2 timestamp null default now(), c3 timestamp null default '2011-01-21 12:12:12');
insert into test set c1=1,c2=c2,c3=c3;
select * from test;
c1	c2	c3
1	NULL	2011-01-21 12:12:12
insert into test set c1 = 2, c2 = default(c2), c3 = default(c3);
select * from test;
c1	c2	c3
1	NULL	2011-01-21 12:12:12
2	NULL	2011-01-21 12:12:12
insert into test set c1 = 3, c2 = default, c3 =default;
select c2=c3,c2=0,c3=0,datediff(c2,now())<0,datediff(c3,now())<0 from test where c1 = 3;
c2=c3	c2=0	c3=0	datediff(c2,now())<0	datediff(c3,now())<0
0	0	0	0	1
delete from test;
insert into test values(4, c2,c3);
select * from test;
c1	c2	c3
4	NULL	2011-01-21 12:12:12
insert into test values(5, default, default);
select c2=c3,c2=0,c3=0,datediff(c2,now())<0,datediff(c3,now())<0 from test where c1 = 5;
c2=c3	c2=0	c3=0	datediff(c2,now())<0	datediff(c3,now())<0
0	0	0	0	1
delete from test;
insert into test values(6, default(c2), default(c3));
select * from test;
c1	c2	c3
6	NULL	2011-01-21 12:12:12
insert into test values(7, '2011-01-01 11:11:11', '2011-01-01 11:11:11');
update test set c2=default, c3=default where c1 = 7;
select c2=c3,c2=0,c3=0,datediff(c2,now())<0,datediff(c3,now())<0 from test where c1 = 7;
c2=c3	c2=0	c3=0	datediff(c2,now())<0	datediff(c3,now())<0
0	0	0	0	1
delete from test;
insert into test values(8, '2011-01-01 11:11:11', '2011-01-01 11:11:11');
update test set c2=default(c2), c3=default(c3) where c1 = 8;
select * from test;
c1	c2	c3
8	NULL	2011-01-21 12:12:12
'test insert into test values(1, c2,c3);'
drop table test;
create table test(c1 int primary key, c2 timestamp, c3 timestamp default now());
insert into test values(1, c2,c3);
select * from test;
c1	c2	c3
1	0000-00-00 00:00:00	0000-00-00 00:00:00
insert into test set c1 = 2, c2 = default(c2), c3 = default(c3);
select * from test;
c1	c2	c3
1	0000-00-00 00:00:00	0000-00-00 00:00:00
2	0000-00-00 00:00:00	0000-00-00 00:00:00
insert into test set c1 = 3, c2 = default, c3 =default;
select c2=c3,c2=0,c3=0,datediff(c2,now())<0,datediff(c3,now())<0 from test where c1 = 3;
c2=c3	c2=0	c3=0	datediff(c2,now())<0	datediff(c3,now())<0
1	0	0	0	0
delete from test;
insert into test values(4, c2,c3);
select * from test;
c1	c2	c3
4	0000-00-00 00:00:00	0000-00-00 00:00:00
insert into test values(5, default, default);
select c2=c3,c2=0,c3=0,datediff(c2,now())<0,datediff(c3,now())<0 from test where c1 = 5;
c2=c3	c2=0	c3=0	datediff(c2,now())<0	datediff(c3,now())<0
1	0	0	0	0
delete from test;
insert into test values(6, default(c2), default(c3));
select * from test;
c1	c2	c3
6	0000-00-00 00:00:00	0000-00-00 00:00:00
insert into test values(7, '2011-01-01 11:11:11', '2011-01-01 11:11:11');
update test set c2=default, c3=default where c1 = 7;
select c2=c3,c2=0,c3=0,datediff(c2,now())<0,datediff(c3,now())<0 from test where c1 = 7;
c2=c3	c2=0	c3=0	datediff(c2,now())<0	datediff(c3,now())<0
1	0	0	0	0
delete from test;
insert into test values(8, '2011-01-01 11:11:11', '2011-01-01 11:11:11');
update test set c2=default(c2), c3=default(c3) where c1 = 8;
select * from test;
c1	c2	c3
8	0000-00-00 00:00:00	0000-00-00 00:00:00
'timestamp column has default not now(), c1 = c1 return default_value'
drop table test;
create table test(c1 int primary key, c2 timestamp default '2011-01-21 12:12:12', c3 timestamp default '2011-01-21 12:12:12');
insert into test values(1,c2,c3);
select * from test;
c1	c2	c3
1	2011-01-21 12:12:12	2011-01-21 12:12:12
insert into test set c1 = 2, c2 = default(c2), c3 = default(c3);
select * from test;
c1	c2	c3
1	2011-01-21 12:12:12	2011-01-21 12:12:12
2	2011-01-21 12:12:12	2011-01-21 12:12:12
insert into test set c1 = 3, c2 = default, c3 =default;
select c2=c3,c2=0,c3=0,datediff(c2,now())<0,datediff(c3,now())<0 from test where c1 = 3;
c2=c3	c2=0	c3=0	datediff(c2,now())<0	datediff(c3,now())<0
1	0	0	1	1
delete from test;
insert into test values(4, c2,c3);
select * from test;
c1	c2	c3
4	2011-01-21 12:12:12	2011-01-21 12:12:12
insert into test values(5, default, default);
select c2=c3,c2=0,c3=0,datediff(c2,now())<0,datediff(c3,now())<0 from test where c1 = 5;
c2=c3	c2=0	c3=0	datediff(c2,now())<0	datediff(c3,now())<0
1	0	0	1	1
delete from test;
insert into test values(6, default(c2), default(c3));
select * from test;
c1	c2	c3
6	2011-01-21 12:12:12	2011-01-21 12:12:12
insert into test values(7, '2011-01-01 11:11:11', '2011-01-01 11:11:11');
update test set c2=default, c3=default where c1 = 7;
select c2=c3,c2=0,c3=0,datediff(c2,now())<0,datediff(c3,now())<0 from test where c1 = 7;
c2=c3	c2=0	c3=0	datediff(c2,now())<0	datediff(c3,now())<0
1	0	0	1	1
delete from test;
insert into test values(8, '2011-01-01 11:11:11', '2011-01-01 11:11:11');
update test set c2=default(c2), c3=default(c3) where c1 = 8;
select * from test;
c1	c2	c3
8	2011-01-21 12:12:12	2011-01-21 12:12:12
'timestamp column nullable has default now()'
drop table test;
create table test(c1 int primary key, c2 timestamp null default now(), c3 timestamp null default '2011-01-21 12:12:12');
insert into test values(1,c2,c3);
select * from test;
c1	c2	c3
1	NULL	2011-01-21 12:12:12
insert into test set c1 = 2, c2 = default(c2), c3 = default(c3);
select * from test;
c1	c2	c3
1	NULL	2011-01-21 12:12:12
2	NULL	2011-01-21 12:12:12
insert into test set c1 = 3, c2 = default, c3 =default;
select c2=c3,c2=0,c3=0,datediff(c2,now())<0,datediff(c3,now())<0 from test where c1 = 3;
c2=c3	c2=0	c3=0	datediff(c2,now())<0	datediff(c3,now())<0
0	0	0	0	1
delete from test;
insert into test values(4, c2,c3);
select * from test;
c1	c2	c3
4	NULL	2011-01-21 12:12:12
insert into test values(5, default, default);
select c2=c3,c2=0,c3=0,datediff(c2,now())<0,datediff(c3,now())<0 from test where c1 = 5;
c2=c3	c2=0	c3=0	datediff(c2,now())<0	datediff(c3,now())<0
0	0	0	0	1
delete from test;
insert into test values(6, default(c2), default(c3));
select * from test;
c1	c2	c3
6	NULL	2011-01-21 12:12:12
insert into test values(7, '2011-01-01 11:11:11', '2011-01-01 11:11:11');
update test set c2=default, c3=default where c1 = 7;
select c2=c3,c2=0,c3=0,datediff(c2,now())<0,datediff(c3,now())<0 from test where c1 = 7;
c2=c3	c2=0	c3=0	datediff(c2,now())<0	datediff(c3,now())<0
0	0	0	0	1
delete from test;
insert into test values(8, '2011-01-01 11:11:11', '2011-01-01 11:11:11');
update test set c2=default(c2), c3=default(c3) where c1 = 8;
select * from test;
c1	c2	c3
8	NULL	2011-01-21 12:12:12
drop table test;
create table test(c1 int primary key, c2 timestamp, c3 timestamp);
insert into test values(1,c2,c3);
insert into test set c1 = 20, c2 = c2, c3=c3;
select * from test;
c1	c2	c3
1	0000-00-00 00:00:00	0000-00-00 00:00:00
20	0000-00-00 00:00:00	0000-00-00 00:00:00
insert into test set c1 = 2, c2 = default(c2), c3 = default(c3);
select * from test;
c1	c2	c3
1	0000-00-00 00:00:00	0000-00-00 00:00:00
2	0000-00-00 00:00:00	0000-00-00 00:00:00
20	0000-00-00 00:00:00	0000-00-00 00:00:00
insert into test set c1 = 3, c2 = default, c3 =default;
select c2=c3,c2=0,c3=0,datediff(c2,now())<0,datediff(c3,now())<0 from test where c1 = 3;
c2=c3	c2=0	c3=0	datediff(c2,now())<0	datediff(c3,now())<0
0	0	1	0	NULL
delete from test;
insert into test values(4, c2,c3);
select * from test;
c1	c2	c3
4	0000-00-00 00:00:00	0000-00-00 00:00:00
insert into test values(5, default, default);
select c2=c3,c2=0,c3=0,datediff(c2,now())<0,datediff(c3,now())<0 from test where c1 = 5;
c2=c3	c2=0	c3=0	datediff(c2,now())<0	datediff(c3,now())<0
0	0	1	0	NULL
delete from test;
insert into test values(6, default(c2), default(c3));
select * from test;
c1	c2	c3
6	0000-00-00 00:00:00	0000-00-00 00:00:00
insert into test values(7, '2011-01-01 11:11:11', '2011-01-01 11:11:11');
update test set c2=default, c3=default where c1 = 7;
select c2=c3,c2=0,c3=0,datediff(c2,now())<0,datediff(c3,now())<0 from test where c1 = 7;
c2=c3	c2=0	c3=0	datediff(c2,now())<0	datediff(c3,now())<0
0	0	1	0	NULL
delete from test;
insert into test values(8, '2011-01-01 11:11:11', '2011-01-01 11:11:11');
update test set c2=default(c2), c3=default(c3) where c1 = 8;
select * from test;
c1	c2	c3
8	0000-00-00 00:00:00	0000-00-00 00:00:00
