drop database if exists jx_db;
create database jx_db;
use jx_db;
drop table if exists t1, t2;
purge recyclebin;
set @@recyclebin = on;
create table t1 (a integer, b integer,c1 CHAR(10));
insert into t1 (a) values (1),(2);
truncate table t1;
select count(*) from t1;
count(*)
0
insert into t1 values(1,2,"test");
select count(*) from t1;
count(*)
1
delete from t1;
select * from t1;
a	b	c1
drop table t1;
select count(*) from t1;
ERROR 42S02: Table 'jx_db.t1' doesn't exist
create table t1 (a integer auto_increment primary key);
insert into t1 (a) values (NULL),(NULL);
truncate table t1;
insert into t1 (a) values (NULL),(NULL);
SELECT * from t1;
a
1
2
delete from t1;
insert into t1 (a) values (NULL),(NULL);
SELECT * from t1;
a
3
4
drop table t1;
create table t1 (s1 int);
insert into t1 (s1) values (1), (2), (3), (4), (5);
drop view if exists v1;
create view v1 as select * from t1;
truncate table v1;
ERROR 42S02: Table 'jx_db.v1' doesn't exist
drop view v1;
drop table t1;
#
# Bug#20667 - Truncate table fails for a write locked table
#
CREATE TABLE t1 (c1 INT);
INSERT INTO t1 VALUES (1);
SELECT * FROM t1;
c1
1
CREATE TABLE t2 (c1 INT);
TRUNCATE TABLE t1;
CREATE VIEW v1 AS SELECT t1.c1 FROM t1,t2 WHERE t1.c1 = t2.c1;
INSERT INTO t1 VALUES (1), (2), (3);
INSERT INTO t2 VALUES (1), (3), (4);
SELECT * FROM v1;
c1
1
3
TRUNCATE table v1;
ERROR 42S02: Table 'jx_db.v1' doesn't exist
SELECT * FROM v1;
c1
1
3
DROP VIEW v1;
DROP TABLE t1, t2;
SELECT count(*) FROM oceanbase.USER_RECYCLEBIN;
count(*)
10
CREATE TABLE t1(id int primary key);
TRUNCATE TABLE t1;

SELECT count(*) FROM oceanbase.USER_RECYCLEBIN;
count(*)
11
set @@ob_enable_truncate_flashback = off;
TRUNCATE TABLE t1;

SELECT count(*) FROM oceanbase.USER_RECYCLEBIN;
count(*)
11
DROP TABLE t1;

use test;
set @@ob_enable_truncate_flashback = on;
CREATE TABLE test1(c1 int primary key, c2 int, c3 int);
CREATE INDEX test_index on test1(c2, c3);
SHOW INDEX FROM test1;
Table	Non_unique	Key_name	Seq_in_index	Column_name	Collation	Cardinality	Sub_part	Packed	Null	Index_type	Comment	Index_comment	Visible
test1	0	PRIMARY	1	c1	A	NULL	NULL	NULL		BTREE	available		YES
test1	1	test_index	1	c2	A	NULL	NULL	NULL	YES	BTREE	unavailable		YES
test1	1	test_index	2	c3	A	NULL	NULL	NULL	YES	BTREE	unavailable		YES
TRUNCATE TABLE test1;

SHOW INDEX FROM test1;
Table	Non_unique	Key_name	Seq_in_index	Column_name	Collation	Cardinality	Sub_part	Packed	Null	Index_type	Comment	Index_comment	Visible
test1	0	PRIMARY	1	c1	A	NULL	NULL	NULL		BTREE	available		YES
test1	1	test_index	1	c2	A	NULL	NULL	NULL	YES	BTREE	available		YES
test1	1	test_index	2	c3	A	NULL	NULL	NULL	YES	BTREE	available		YES

SHOW INDEX FROM test2;
Table	Non_unique	Key_name	Seq_in_index	Column_name	Collation	Cardinality	Sub_part	Packed	Null	Index_type	Comment	Index_comment	Visible

TRUNCATE INDEX test_index;
ERROR 42000: You have an error in your SQL syntax; check the manual that corresponds to your OceanBase version for the right syntax to use near 'INDEX test_index' at line 1
TRUNCATE TABLE test_index;
ERROR 42S02: Table 'test.test_index' doesn't exist
set @@ob_enable_truncate_flashback = off;
DROP TABLE test1;
DROP TABLE test2;
set @@recyclebin = off;
set @@ob_enable_truncate_flashback = on;
create table test1(c1 int);
truncate table test1;
SELECT count(*) FROM oceanbase.USER_RECYCLEBIN;
count(*)
16
set @@ob_enable_truncate_flashback = off;
drop table test1;
drop database jx_db;
purge recyclebin;
select count(*) from oceanbase.__all_recyclebin;
count(*)
0
