create table t1(pk int primary key, a int, b int, c varchar(1024));
create index i1 on t1(b) storing(c);
alter system major freeze tenant = sys;
alter system major freeze tenant = all_user;
alter system major freeze tenant = all_meta;
insert into t1 values(1,1,1,'a');
set autocommit=0;
update t1 set a=3 where pk=1;
set autocommit=0;
update t1 set a=5 where pk=1;
Got one of the listed errors
commit;
commit;
insert into t1 values(2,2,2,'b'),(3,3,3,'c'),(5,5,5,'e');
set autocommit=0;
select * from t1 where pk<6 for update;
pk	a	b	c
1	3	1	a
2	2	2	b
3	3	3	c
5	5	5	e
set autocommit=0;
insert into t1 values(4,4,4,'d');
update t1 set pk=10 where pk=3;
commit;
commit;
select * from t1;
pk	a	b	c
1	3	1	a
2	2	2	b
3	3	3	c
4	4	4	d
5	5	5	e
