drop table if exists t1;
create table t1(pk int primary key, c1 int);
create index idx on t1(c1);
insert into t1 values(6,6),(7,7),(8,8);
alter system major freeze tenant = sys;
alter system major freeze tenant = all_user;
alter system major freeze tenant = all_meta;
set autocommit=0;
set autocommit=0;
insert into t1 values(1,1);
insert into t1 values(2,2);
replace into t1 values(1,2);
Got one of the listed errors
select * from t1;
pk	c1
2	2
6	6
7	7
8	8
update t1 set c1=c1+1 where pk=1;
update t1 set c1=c1+1 where pk in (1,3,5);
update t1 set c1=c1+1 where pk>=1 and pk<=5 ;
select * from t1;
pk	c1
2	3
6	6
7	7
8	8
insert into t1 values(2,2);
ERROR 23000: Duplicate entry '2' for key 'PRIMARY'
update t1 set c1=c1+2 where pk=2;
select * from t1;
pk	c1
2	5
6	6
7	7
8	8
update t1 set c1=c1+2 where c1 in (1,3,5);
select * from t1;
pk	c1
2	7
6	6
7	7
8	8
update t1 set c1=c1+2;
select * from t1;
pk	c1
2	9
6	8
7	9
8	10
delete from t1 where c1=1;
delete from t1 where pk=1;
delete from t1 where pk=1;
insert into t1 values(2,2);
Got one of the listed errors
insert into t1 values(3,3);
update t1 set pk=4 where pk<=5;
select * from t1;
pk	c1
4	3
6	6
7	7
8	8
select * from t1 where pk in (1,2,3,4,5);
pk	c1
4	3
update t1 set c1=c1+1 where pk=1;
update t1 set c1=c1+1 where pk=3;
update t1 set c1=c1+1 where pk=4;
update t1 set c1=c1+1 where pk<5;
update t1 set c1=c1+1 where pk in (1,3,5);
select * from t1;
pk	c1
2	10
6	8
7	9
8	10
replace into t1 values(3,3),(1,1);
Got one of the listed errors
select * from t1 where pk in (1,2,3,4,5);
pk	c1
2	10
select * from t1;
pk	c1
4	3
6	6
7	7
8	8
select * from t1 where pk in (1,2,3,4,5);
pk	c1
4	3
commit;
select * from t1;
pk	c1
2	10
4	3
6	8
7	9
8	10
select * from t1 where pk in (1,2,3,4,5);
pk	c1
2	10
4	3
update t1 set c1=c1+1 where pk in (1,3,4,5);
select * from t1 where pk in (1,2,3,4,5);
pk	c1
2	10
4	4
commit;
update t1 set pk=5 where pk=4;
update t1 set pk=5 where pk=4;
Got one of the listed errors
update t1 set pk=5 where c1=4;
Got one of the listed errors
rollback;
select * from t1 where pk in (1,2,3,4,5);
pk	c1
2	10
4	4
select * from t1 ;
pk	c1
2	10
4	4
6	8
7	9
8	10
update t1 set pk=5 where pk=4;
select * from t1 where pk in (4,5) ;
pk	c1
5	4
commit;
select * from t1 ;
pk	c1
2	10
5	4
6	8
7	9
8	10
drop table t1;
