drop table if exists t1;
create table t1(pk1 int, pk2 int, c1 int, c2 int, primary key(pk1,pk2));
insert into t1(pk1,pk2,c1,c2) values(1,1,1,1);
insert into t1(pk1,pk2,c1,c2) values(1,2,2,1);
insert into t1(pk1,pk2,c1,c2) values(2,3,3,1);
insert into t1(pk1,pk2,c1,c2) values(2,4,4,1);
insert into t1(pk1,pk2,c1,c2) values(3,5,5,1);
insert into t1(pk1,pk2,c1,c2) values(3,6,6,1);
insert into t1(pk1,pk2,c1,c2) values(4,7,7,1);
insert into t1(pk1,pk2,c1,c2) values(4,8,8,1);
select * from t1;
pk1	pk2	c1	c2
1	1	1	1
1	2	2	1
2	3	3	1
2	4	4	1
3	5	5	1
3	6	6	1
4	7	7	1
4	8	8	1
set autocommit=0;
delete from t1 where pk1=1;
select * from t1;
pk1	pk2	c1	c2
2	3	3	1
2	4	4	1
3	5	5	1
3	6	6	1
4	7	7	1
4	8	8	1
update t1 set c2=c2+1 where pk1>=1 and pk1<=2;
select * from t1;
pk1	pk2	c1	c2
2	3	3	2
2	4	4	2
3	5	5	1
3	6	6	1
4	7	7	1
4	8	8	1
set autocommit=0;
select * from t1;
pk1	pk2	c1	c2
1	1	1	1
1	2	2	1
2	3	3	1
2	4	4	1
3	5	5	1
3	6	6	1
4	7	7	1
4	8	8	1
update t1 set c2=c2+1 where pk1>0 and pk1<5;
Got one of the listed errors
select * from t1;
pk1	pk2	c1	c2
1	1	1	1
1	2	2	1
2	3	3	1
2	4	4	1
3	5	5	1
3	6	6	1
4	7	7	1
4	8	8	1
delete from t1 where pk1>=1 and pk1<=4;
Got one of the listed errors
select * from t1;
pk1	pk2	c1	c2
1	1	1	1
1	2	2	1
2	3	3	1
2	4	4	1
3	5	5	1
3	6	6	1
4	7	7	1
4	8	8	1
update t1 set c2=c2+1 where pk1=3;
select * from t1;
pk1	pk2	c1	c2
1	1	1	1
1	2	2	1
2	3	3	1
2	4	4	1
3	5	5	2
3	6	6	2
4	7	7	1
4	8	8	1
update t1 set c2=c2+1 where pk1=4;
select * from t1;
pk1	pk2	c1	c2
1	1	1	1
1	2	2	1
2	3	3	1
2	4	4	1
3	5	5	2
3	6	6	2
4	7	7	2
4	8	8	2
select * from t1;
pk1	pk2	c1	c2
2	3	3	2
2	4	4	2
3	5	5	1
3	6	6	1
4	7	7	1
4	8	8	1
update t1 set c2=c2+1 where pk1>0 and pk1<5;
Got one of the listed errors
select * from t1;
pk1	pk2	c1	c2
2	3	3	2
2	4	4	2
3	5	5	1
3	6	6	1
4	7	7	1
4	8	8	1
delete from t1 where pk1=3;
Got one of the listed errors
select * from t1;
pk1	pk2	c1	c2
2	3	3	2
2	4	4	2
3	5	5	1
3	6	6	1
4	7	7	1
4	8	8	1
commit;
select * from t1;
pk1	pk2	c1	c2
2	3	3	2
2	4	4	2
3	5	5	1
3	6	6	1
4	7	7	1
4	8	8	1
commit;
select * from t1;
pk1	pk2	c1	c2
2	3	3	2
2	4	4	2
3	5	5	2
3	6	6	2
4	7	7	2
4	8	8	2
update t1 set c2=c2+1 where pk1>0 and pk1<5;
select * from t1;
pk1	pk2	c1	c2
2	3	3	3
2	4	4	3
3	5	5	3
3	6	6	3
4	7	7	3
4	8	8	3
delete from t1 where pk1=4;
select * from t1;
pk1	pk2	c1	c2
2	3	3	3
2	4	4	3
3	5	5	3
3	6	6	3
commit;
select * from t1;
pk1	pk2	c1	c2
2	3	3	3
2	4	4	3
3	5	5	3
3	6	6	3
commit;
delete from t1;
insert into t1(pk1,pk2,c1,c2) values (1,1,1,1),(1,2,1,1),(1,3,2,1),(1,4,2,1),(2,5,3,1),(2,6,3,1),(2,7,4,1),(2,8,4,1);
select * from t1;
pk1	pk2	c1	c2
1	1	1	1
1	2	1	1
1	3	2	1
1	4	2	1
2	5	3	1
2	6	3	1
2	7	4	1
2	8	4	1
delete from t1 where pk1=1 and c1=1;
select * from t1;
pk1	pk2	c1	c2
1	3	2	1
1	4	2	1
2	5	3	1
2	6	3	1
2	7	4	1
2	8	4	1
update t1 set c2=c2+1 where pk1=1 and c1<3;
select * from t1;
pk1	pk2	c1	c2
1	3	2	2
1	4	2	2
2	5	3	1
2	6	3	1
2	7	4	1
2	8	4	1
delete from t1 where pk1=1;
Got one of the listed errors
delete from t1 where (pk1,c1)>=(1,1) and pk2>=1;
Got one of the listed errors
update t1 set c2=c2+1 where pk1=1;
Got one of the listed errors
update t1 set c2=c2+1 where (pk1,c1)>=(1,1) and (pk1,c1)<=(2,2);
Got one of the listed errors
update t1 set c2=c2+1 where pk1=2 and c1=3;
select * from t1;
pk1	pk2	c1	c2
1	1	1	1
1	2	1	1
1	3	2	1
1	4	2	1
2	5	3	2
2	6	3	2
2	7	4	1
2	8	4	1
delete from t1 where pk1=2 and c1=4;
select * from t1;
pk1	pk2	c1	c2
1	1	1	1
1	2	1	1
1	3	2	1
1	4	2	1
2	5	3	2
2	6	3	2
select * from t1;
pk1	pk2	c1	c2
1	3	2	2
1	4	2	2
2	5	3	1
2	6	3	1
2	7	4	1
2	8	4	1
delete from t1 where pk1=2 and c1=3;
Got one of the listed errors
delete from t1 where pk1=2 and c1=4;
Got one of the listed errors
update t1 set c2=c2+1 where pk1=2 and c1=3;
Got one of the listed errors
update t1 set c2=c2+1 where pk1=2 and c1=4;
Got one of the listed errors
insert into t1(pk1,pk2,c1,c2) values (2,5,3,10);
ERROR 23000: Duplicate entry '2-5' for key 'PRIMARY'
replace into t1(pk1,pk2,c1,c2) values (2,5,3,10);
Got one of the listed errors
insert into t1(pk1,pk2,c1,c2) values (2,9,3,1);
replace into t1(pk1,pk2,c1,c2) values (2,10,3,1);
select * from t1;
pk1	pk2	c1	c2
1	3	2	2
1	4	2	2
2	5	3	1
2	6	3	1
2	7	4	1
2	8	4	1
2	9	3	1
2	10	3	1
commit;
select * from t1;
pk1	pk2	c1	c2
1	3	2	2
1	4	2	2
2	5	3	1
2	6	3	1
2	7	4	1
2	8	4	1
2	9	3	1
2	10	3	1
commit;
select * from t1;
pk1	pk2	c1	c2
1	3	2	2
1	4	2	2
2	5	3	2
2	6	3	2
2	9	3	1
2	10	3	1
commit;
select * from t1;
pk1	pk2	c1	c2
1	3	2	2
1	4	2	2
2	5	3	2
2	6	3	2
2	9	3	1
2	10	3	1
commit;
set autocommit=1;
set autocommit=1;
drop table t1;
