drop table if exists t1,t2,t3,t4;
create table t1(pk1 int , pk2 varchar(1024), pk3 datetime(6), a int, b varchar(1024), c datetime(6), primary key(pk1,pk2,pk3));
insert into t1 values(1,'s1','2012-12-12 12:00:00',100, 's100','2013-12-12 12:00:00' );
insert into t1 values(2,'s2','2012-12-12 12:00:00',200, 's200','2013-12-12 12:00:00' );
update t1 set b = 's2000' where pk1 = 1 and pk2 = 's1' and pk3= '2012-12-12 12:00:00' ;
select * from t1 where pk1 = 1 and pk2 = 's1' and pk3= '2012-12-12 12:00:00' for update;
pk1	pk2	pk3	a	b	c
1	s1	2012-12-12 12:00:00.000000	100	s2000	2013-12-12 12:00:00.000000
select * from t1 where pk1 = 1 and pk2 = 's1' and pk3= '2012-12-12 12:00:01' for update;
pk1	pk2	pk3	a	b	c
select * from t1 where pk1 =1 for update;
pk1	pk2	pk3	a	b	c
1	s1	2012-12-12 12:00:00.000000	100	s2000	2013-12-12 12:00:00.000000
select * from t1 where a=1 for update;
pk1	pk2	pk3	a	b	c
select * from t1 for update;
pk1	pk2	pk3	a	b	c
1	s1	2012-12-12 12:00:00.000000	100	s2000	2013-12-12 12:00:00.000000
2	s2	2012-12-12 12:00:00.000000	200	s200	2013-12-12 12:00:00.000000
select * from t1 where (pk1 = 1 and pk2 = 's1' and pk3= '2012-12-12 12:00:00' ) or (pk1 = 2 and pk2 = 's2' and pk3= '2012-12-12 12:00:00' ) for update;
pk1	pk2	pk3	a	b	c
1	s1	2012-12-12 12:00:00.000000	100	s2000	2013-12-12 12:00:00.000000
2	s2	2012-12-12 12:00:00.000000	200	s200	2013-12-12 12:00:00.000000
select * from t1 where pk1 = 1 and pk2 = 's1' and pk3= '2012-12-12 12:00:00' for update;
pk1	pk2	pk3	a	b	c
1	s1	2012-12-12 12:00:00.000000	100	s2000	2013-12-12 12:00:00.000000
select * from t1 where pk1 = 1 and pk2 = 's1' and pk3= '2012-12-12 12:00:00' for update;
pk1	pk2	pk3	a	b	c
1	s1	2012-12-12 12:00:00.000000	100	s2000	2013-12-12 12:00:00.000000
drop table t1;
create table t1(pk1 int , pk2 varchar(1024), pk3 datetime(6), a int, b varchar(1024), c datetime(6), primary key(pk1,pk2,pk3));
insert into t1 values(1,'s1','2012-12-12 12:00:00',100, 's100','2013-12-12 12:00:00' );
insert into t1 values(2,'s2','2012-12-12 12:00:00',200, 's200','2013-12-12 12:00:00' );
begin;
select * from t1 where pk1 = 1 and pk2 = 's1' and pk3 = '2012-12-12 12:00:00' for update;
pk1	pk2	pk3	a	b	c
1	s1	2012-12-12 12:00:00.000000	100	s100	2013-12-12 12:00:00.000000
update t1 set b='abc' where pk1 = 1 and pk2 = 's1' and pk3 = '2012-12-12 12:00:00';
select * from t1 where pk1 = 1 and pk2 = 's1' and pk3 = '2012-12-12 12:00:00' for update;
pk1	pk2	pk3	a	b	c
1	s1	2012-12-12 12:00:00.000000	100	abc	2013-12-12 12:00:00.000000
delete from t1 where pk1 = 1 and pk2 = 's1' and pk3 = '2012-12-12 12:00:00';
insert into t1 values(1,'s1','2012-12-12 12:00:00',100, 's100','2013-12-12 12:00:00' );
begin;
select * from t1 where pk1 = 2 and pk2 = 's2' and pk3 = '2012-12-12 12:00:00' for update;
pk1	pk2	pk3	a	b	c
2	s2	2012-12-12 12:00:00.000000	200	s200	2013-12-12 12:00:00.000000
update t1 set b='abcd' where pk1 = 2 and pk2 = 's2' and pk3 = '2012-12-12 12:00:00';
select * from t1 where pk1 = 2 and pk2 = 's2' and pk3 = '2012-12-12 12:00:00' for update;
pk1	pk2	pk3	a	b	c
2	s2	2012-12-12 12:00:00.000000	200	abcd	2013-12-12 12:00:00.000000
delete from t1 where pk1 = 2 and pk2 = 's2' and pk3 = '2012-12-12 12:00:00';
insert into t1 values(2,'s2','2012-12-12 12:00:00',200, 's200','2013-12-12 12:00:00' );
select * from t1 where pk1 = 1 and pk2 = 's1' and pk3 = '2012-12-12 12:00:00' for update;
Got one of the listed errors
commit;
rollback;
select * from t1;
pk1	pk2	pk3	a	b	c
1	s1	2012-12-12 12:00:00.000000	100	s100	2013-12-12 12:00:00.000000
2	s2	2012-12-12 12:00:00.000000	200	s200	2013-12-12 12:00:00.000000
begin;
select * from t1 where pk1 = 1 and pk2 = 's1' and pk3 = '2012-12-12 12:00:00' for update;
pk1	pk2	pk3	a	b	c
1	s1	2012-12-12 12:00:00.000000	100	s100	2013-12-12 12:00:00.000000
update t1 set b='abc' where pk1 = 1 and pk2 = 's1' and pk3 = '2012-12-12 12:00:00';
select * from t1 where pk1 = 1 and pk2 = 's1' and pk3 = '2012-12-12 12:00:00' for update;
pk1	pk2	pk3	a	b	c
1	s1	2012-12-12 12:00:00.000000	100	abc	2013-12-12 12:00:00.000000
delete from t1 where pk1 = 1 and pk2 = 's1' and pk3 = '2012-12-12 12:00:00';
insert into t1 values(1,'s1','2012-12-12 12:00:00',100, 's100','2013-12-12 12:00:00' );
begin;
select * from t1 where pk1 = 2 and pk2 = 's2' and pk3 = '2012-12-12 12:00:00' for update;
pk1	pk2	pk3	a	b	c
2	s2	2012-12-12 12:00:00.000000	200	s200	2013-12-12 12:00:00.000000
update t1 set b='abcd' where pk1 = 2 and pk2 = 's2' and pk3 = '2012-12-12 12:00:00';
select * from t1 where pk1 = 2 and pk2 = 's2' and pk3 = '2012-12-12 12:00:00' for update;
pk1	pk2	pk3	a	b	c
2	s2	2012-12-12 12:00:00.000000	200	abcd	2013-12-12 12:00:00.000000
delete from t1 where pk1 = 2 and pk2 = 's2' and pk3 = '2012-12-12 12:00:00';
insert into t1 values(2,'s2','2012-12-12 12:00:00',200, 's200','2013-12-12 12:00:00' );
commit;
commit;
select * from t1;
pk1	pk2	pk3	a	b	c
1	s1	2012-12-12 12:00:00.000000	100	s100	2013-12-12 12:00:00.000000
2	s2	2012-12-12 12:00:00.000000	200	s200	2013-12-12 12:00:00.000000
begin;
select * from t1 where pk1 = 1 and pk2 = 's1' and pk3 = '2012-12-12 12:00:00' for update;
pk1	pk2	pk3	a	b	c
1	s1	2012-12-12 12:00:00.000000	100	s100	2013-12-12 12:00:00.000000
begin;
update t1 set b = 's2000' where pk1 = 2 and pk2 = 's2' and pk3 = '2012-12-12 12:00:00';
delete from t1 where pk1 = 2 and pk2 = 's2' and pk3 = '2012-12-12 12:00:00';
insert into t1 values(2,'s2','2012-12-12 12:00:00',200, 's200','2013-12-12 12:00:00' );
update t1 set b = 's2000' where pk1 = 1 and pk2 = 's1' and pk3 = '2012-12-12 12:00:00';
Got one of the listed errors
commit;
rollback;
select * from t1;
pk1	pk2	pk3	a	b	c
1	s1	2012-12-12 12:00:00.000000	100	s100	2013-12-12 12:00:00.000000
2	s2	2012-12-12 12:00:00.000000	200	s200	2013-12-12 12:00:00.000000
begin;
select * from t1 where pk1 = 1 and pk2 = 's1' and pk3 = '2012-12-12 12:00:00' for update;
pk1	pk2	pk3	a	b	c
1	s1	2012-12-12 12:00:00.000000	100	s100	2013-12-12 12:00:00.000000
select * from t1 where pk1 = 2 and pk2 = 's2' and pk3 = '2012-12-12 12:00:00' for update;
pk1	pk2	pk3	a	b	c
2	s2	2012-12-12 12:00:00.000000	200	s200	2013-12-12 12:00:00.000000
begin;
update t1 set b = 's2000' where pk1 = 2 and pk2 = 's2' and pk3 = '2012-12-12 12:00:00';
Got one of the listed errors
update t1 set b = 's2000' where pk1 = 1 and pk2 = 's1' and pk3 = '2012-12-12 12:00:00';
Got one of the listed errors
commit;
rollback;
begin;
select * from t1 where pk1 = 1 and pk2 = 's1' and pk3 = '2012-12-12 12:00:00' for update;
pk1	pk2	pk3	a	b	c
1	s1	2012-12-12 12:00:00.000000	100	s100	2013-12-12 12:00:00.000000
commit;
begin;
select * from t1 where pk1 = 1 and pk2 = 's1' and pk3 = '2012-12-12 12:00:00' for update;
pk1	pk2	pk3	a	b	c
1	s1	2012-12-12 12:00:00.000000	100	s100	2013-12-12 12:00:00.000000
update t1 set b = 's2000' where pk1 = 1 and pk2 = 's1' and pk3 = '2012-12-12 12:00:00' ;
select * from t1 where pk1 = 1 and pk2 = 's1' and pk3 = '2012-12-12 12:00:00' for update;
pk1	pk2	pk3	a	b	c
1	s1	2012-12-12 12:00:00.000000	100	s2000	2013-12-12 12:00:00.000000
commit;
begin;
select * from t1 where pk1 = 1 and pk2 = 's1' and pk3 = '2012-12-12 12:00:00' for update;
pk1	pk2	pk3	a	b	c
1	s1	2012-12-12 12:00:00.000000	100	s2000	2013-12-12 12:00:00.000000
commit;
begin;
select * from t1 where pk1 = 1 and pk2 = 's1' and pk3 = '2012-12-12 12:00:00' for update;
pk1	pk2	pk3	a	b	c
1	s1	2012-12-12 12:00:00.000000	100	s2000	2013-12-12 12:00:00.000000
update t1 set b = 's2000' where pk1 = 1 and pk2 = 's1' and pk3 = '2012-12-12 12:00:00' ;
select * from t1 where pk1 = 1 and pk2 = 's1' and pk3 = '2012-12-12 12:00:00' for update;
pk1	pk2	pk3	a	b	c
1	s1	2012-12-12 12:00:00.000000	100	s2000	2013-12-12 12:00:00.000000
commit;
drop table t1;
