merge happens
drop table if exists tbl1,tbl2;
create table tbl1 (i1 int, v2 varchar(80), i3 char(20),i4 float, d4 datetime(6),i5 decimal(5,3), primary key(i3));
create   index idx1 on tbl1(i1);
alter system major freeze tenant = sys;
alter system major freeze tenant = all_user;
alter system major freeze tenant = all_meta;
insert into tbl1 values(1,'now','haha1',1.6256,'2014-05-04 12:00:00',-10.235);
select * from tbl1;
i1	v2	i3	i4	d4	i5
1	now	haha1	1.6256	2014-05-04 12:00:00.000000	-10.235
update tbl1 set i1=1 ;
select * from tbl1;
i1	v2	i3	i4	d4	i5
1	now	haha1	1.6256	2014-05-04 12:00:00.000000	-10.235
update tbl1 set i1=1 where i3='haha1';
update tbl1 set i1=3 where i3='haha1';
update tbl1 set i1=1 where i3='haha1';
select * from tbl1;
i1	v2	i3	i4	d4	i5
1	now	haha1	1.6256	2014-05-04 12:00:00.000000	-10.235
insert into tbl1 values(2,'now','haha2',1.6256,'2014-05-04 12:00:00',-10.235);
insert into tbl1 values(3,'now','haha3',1.6256,'2014-05-04 12:00:00',-10.235);
insert into tbl1 values(4,'now','haha4',1.6256,'2014-05-04 12:00:00',-10.235);
insert into tbl1 values(5,'now','haha5',1.6256,'2014-05-04 12:00:00',-10.235);
insert into tbl1 values(6,'now','haha6',1.6256,'2014-05-04 12:00:00',-10.235);
insert into tbl1 values(7,'now','haha7',1.6256,'2014-05-04 12:00:00',-10.235);
insert into tbl1 values(8,'now','haha8',1.6256,'2014-05-04 12:00:00',-10.235);
insert into tbl1 values(9,'now','haha9',1.6256,'2014-05-04 12:00:00',-10.235);
insert into tbl1 values(10,'now','haha10',1.6256,'2014-05-04 12:00:00',-10.235);
insert into tbl1 values(11,'now','haha11',1.6256,'2014-05-04 12:00:00',-10.235);
insert into tbl1 values(12,'now','haha12',1.6256,'2014-05-04 12:00:00',-10.235);
set autocommit=0;
set autocommit=0;
update tbl1 set  i3='abc' where i3='haha1';
select * from  tbl1  where i3='haha1';
i1	v2	i3	i4	d4	i5
1	now	haha1	1.6256	2014-05-04 12:00:00.000000	-10.235
commit;
select * from  tbl1  where i1='1';
i1	v2	i3	i4	d4	i5
1	now	abc	1.6256	2014-05-04 12:00:00.000000	-10.235
commit;
update tbl1 set  i1=100 where i3='haha2';
select * from  tbl1  where i3='haha2';
i1	v2	i3	i4	d4	i5
2	now	haha2	1.6256	2014-05-04 12:00:00.000000	-10.235
commit;
select * from  tbl1  where i3='haha2';
i1	v2	i3	i4	d4	i5
100	now	haha2	1.6256	2014-05-04 12:00:00.000000	-10.235
commit;
select * from tbl1 where i3 in ('haha4','haha5');
i1	v2	i3	i4	d4	i5
4	now	haha4	1.6256	2014-05-04 12:00:00.000000	-10.235
5	now	haha5	1.6256	2014-05-04 12:00:00.000000	-10.235
update tbl1 set  i1=400 where i3='haha4';
select * from tbl1 where i3='haha5';
i1	v2	i3	i4	d4	i5
5	now	haha5	1.6256	2014-05-04 12:00:00.000000	-10.235
select * from tbl1 where i3 in ('haha4','haha5');
i1	v2	i3	i4	d4	i5
400	now	haha4	1.6256	2014-05-04 12:00:00.000000	-10.235
5	now	haha5	1.6256	2014-05-04 12:00:00.000000	-10.235
select * from tbl1 where i3 in ('haha4','haha5');
i1	v2	i3	i4	d4	i5
4	now	haha4	1.6256	2014-05-04 12:00:00.000000	-10.235
5	now	haha5	1.6256	2014-05-04 12:00:00.000000	-10.235
select * from tbl1 where i3='haha4';
i1	v2	i3	i4	d4	i5
4	now	haha4	1.6256	2014-05-04 12:00:00.000000	-10.235
update tbl1 set  i1=500 where i3='haha5';
commit;
select * from tbl1 where i3 in ('haha4','haha5');
i1	v2	i3	i4	d4	i5
400	now	haha4	1.6256	2014-05-04 12:00:00.000000	-10.235
5	now	haha5	1.6256	2014-05-04 12:00:00.000000	-10.235
commit;
select * from tbl1 where i3 in ('haha4','haha5');
i1	v2	i3	i4	d4	i5
400	now	haha4	1.6256	2014-05-04 12:00:00.000000	-10.235
500	now	haha5	1.6256	2014-05-04 12:00:00.000000	-10.235
select * from tbl1 where i3 in ('haha4','haha5');
i1	v2	i3	i4	d4	i5
400	now	haha4	1.6256	2014-05-04 12:00:00.000000	-10.235
500	now	haha5	1.6256	2014-05-04 12:00:00.000000	-10.235
update tbl1 set  i1=1400 where i3='haha4';
select * from tbl1 where i3='haha5';
i1	v2	i3	i4	d4	i5
500	now	haha5	1.6256	2014-05-04 12:00:00.000000	-10.235
select * from tbl1 where i3 in ('haha4','haha5');
i1	v2	i3	i4	d4	i5
400	now	haha4	1.6256	2014-05-04 12:00:00.000000	-10.235
500	now	haha5	1.6256	2014-05-04 12:00:00.000000	-10.235
update tbl1 set  i1=500 where i3='haha5';
select * from tbl1 where i3='haha4';
i1	v2	i3	i4	d4	i5
400	now	haha4	1.6256	2014-05-04 12:00:00.000000	-10.235
commit;
select * from tbl1 where i3 in ('haha4','haha5');
i1	v2	i3	i4	d4	i5
1400	now	haha4	1.6256	2014-05-04 12:00:00.000000	-10.235
500	now	haha5	1.6256	2014-05-04 12:00:00.000000	-10.235
commit;
select * from tbl1 where i3 in ('haha4','haha5');
i1	v2	i3	i4	d4	i5
1400	now	haha4	1.6256	2014-05-04 12:00:00.000000	-10.235
500	now	haha5	1.6256	2014-05-04 12:00:00.000000	-10.235
select i1,i3 from tbl1 order by 1, 2;
i1	i3
1	abc
3	haha3
6	haha6
7	haha7
8	haha8
9	haha9
10	haha10
11	haha11
12	haha12
100	haha2
500	haha5
1400	haha4
