merge happens
drop table if exists tbl1,tbl2;
create table tbl1 (i1 int, v2 varchar(80), i3 char(20),i4 float, d4 datetime(6),i5 decimal(5,3), primary key(i3));
create   index idx1 on tbl1(i1);
alter system major freeze tenant = sys;
alter system major freeze tenant = all_user;
alter system major freeze tenant = all_meta;
alter system major freeze tenant = sys;
alter system major freeze tenant = all_user;
alter system major freeze tenant = all_meta;
insert into tbl1 values(1,'now','haha1',1.6256,'2014-05-04 12:00:00',-10.235);
select * from tbl1;
i1	v2	i3	i4	d4	i5
1	now	haha1	1.6256	2014-05-04 12:00:00	-10.235
update tbl1 set i1=1 ;
select * from tbl1;
i1	v2	i3	i4	d4	i5
1	now	haha1	1.6256	2014-05-04 12:00:00	-10.235
update tbl1 set i1=1 where i3='haha1';
update tbl1 set i1=3 where i3='haha1';
update tbl1 set i1=1 where i3='haha1';
select * from tbl1;
i1	v2	i3	i4	d4	i5
1	now	haha1	1.6256	2014-05-04 12:00:00	-10.235
insert into tbl1 values(2,'now','haha2',1.6256,'2014-05-04 12:00:00',-10.235);
insert into tbl1 values(3,'now','haha3',1.6256,'2014-05-04 12:00:00',-10.235);
insert into tbl1 values(4,'now','haha4',1.6256,'2014-05-04 12:00:00',-10.235);
insert into tbl1 values(5,'now','haha5',1.6256,'2014-05-04 12:00:00',-10.235);
insert into tbl1 values(6,'now','haha6',1.6256,'2014-05-04 12:00:00',-10.235);
insert into tbl1 values(7,'now','haha7',1.6256,'2014-05-04 12:00:00',-10.235);
insert into tbl1 values(8,'now','haha8',1.6256,'2014-05-04 12:00:00',-10.235);
insert into tbl1 values(9,'now','haha9',1.6256,'2014-05-04 12:00:00',-10.235);
insert into tbl1 values(10,'now','haha10',1.6256,'2014-05-04 12:00:00',-10.235);
insert into tbl1 values(11,'now','haha11',1.6256,'2014-05-04 12:00:00',-10.235);
insert into tbl1 values(12,'now','haha12',1.6256,'2014-05-04 12:00:00',-10.235);
set autocommit=0;
set autocommit=0;
select * from tbl1 where i1=1 and i3='haha1' for update;
i1	v2	i3	i4	d4	i5
1	now	haha1	1.6256	2014-05-04 12:00:00	-10.235
update  tbl1 set  v2='3' where i1=1 and i3='haha1';
ERROR 41000: Exclusive lock conflict 'haha1' for key 'PRIMARY'
update  tbl1 set  i3='new haha1' where i1=1 and i3='haha1';
ERROR 41000: Exclusive lock conflict 'haha1' for key 'PRIMARY'
update  tbl1 set  i1=100  where i1=1 and i3='haha1';
ERROR 41000: Exclusive lock conflict 'haha1' for key 'PRIMARY'
update  tbl1 set  v2='100'  where (i1,i3) in ((1,'haha1'),(10,'haha10'),(100,'haha100'));
ERROR 41000: Exclusive lock conflict 'haha1' for key 'PRIMARY'
update  tbl1 set  v2='100'  where i1<=10 and i1>=0;
ERROR 41000: Exclusive lock conflict 'haha1' for key 'PRIMARY'
select * from tbl1;
i1	v2	i3	i4	d4	i5
1	now	haha1	1.6256	2014-05-04 12:00:00	-10.235
10	now	haha10	1.6256	2014-05-04 12:00:00	-10.235
11	now	haha11	1.6256	2014-05-04 12:00:00	-10.235
12	now	haha12	1.6256	2014-05-04 12:00:00	-10.235
2	now	haha2	1.6256	2014-05-04 12:00:00	-10.235
3	now	haha3	1.6256	2014-05-04 12:00:00	-10.235
4	now	haha4	1.6256	2014-05-04 12:00:00	-10.235
5	now	haha5	1.6256	2014-05-04 12:00:00	-10.235
6	now	haha6	1.6256	2014-05-04 12:00:00	-10.235
7	now	haha7	1.6256	2014-05-04 12:00:00	-10.235
8	now	haha8	1.6256	2014-05-04 12:00:00	-10.235
9	now	haha9	1.6256	2014-05-04 12:00:00	-10.235
commit;
select * from tbl1;
i1	v2	i3	i4	d4	i5
1	now	haha1	1.6256	2014-05-04 12:00:00	-10.235
10	now	haha10	1.6256	2014-05-04 12:00:00	-10.235
11	now	haha11	1.6256	2014-05-04 12:00:00	-10.235
12	now	haha12	1.6256	2014-05-04 12:00:00	-10.235
2	now	haha2	1.6256	2014-05-04 12:00:00	-10.235
3	now	haha3	1.6256	2014-05-04 12:00:00	-10.235
4	now	haha4	1.6256	2014-05-04 12:00:00	-10.235
5	now	haha5	1.6256	2014-05-04 12:00:00	-10.235
6	now	haha6	1.6256	2014-05-04 12:00:00	-10.235
7	now	haha7	1.6256	2014-05-04 12:00:00	-10.235
8	now	haha8	1.6256	2014-05-04 12:00:00	-10.235
9	now	haha9	1.6256	2014-05-04 12:00:00	-10.235
commit;
delete  from tbl1 where i1=1 and i3='haha1';
select * from tbl1 where i1=1 and i3='haha1' for update;
i1	v2	i3	i4	d4	i5
update  tbl1 set  v2='3' where i1=1 and i3='haha1';
ERROR 41000: Exclusive lock conflict 'haha1' for key 'PRIMARY'
update  tbl1 set  i3='new haha1' where i1=1 and i3='haha1';
ERROR 41000: Exclusive lock conflict 'haha1' for key 'PRIMARY'
update  tbl1 set  i1=100  where i1=1 and i3='haha1';
ERROR 41000: Exclusive lock conflict 'haha1' for key 'PRIMARY'
update  tbl1 set  v2='100'  where (i1,i3) in ((1,'haha1'),(10,'haha10'),(100,'haha100'));
ERROR 41000: Exclusive lock conflict 'haha1' for key 'PRIMARY'
update  tbl1 set  v2='100'  where i1<=10 and i1>=0;
ERROR 41000: Exclusive lock conflict 'haha1' for key 'PRIMARY'
select * from tbl1;
i1	v2	i3	i4	d4	i5
1	now	haha1	1.6256	2014-05-04 12:00:00	-10.235
10	now	haha10	1.6256	2014-05-04 12:00:00	-10.235
11	now	haha11	1.6256	2014-05-04 12:00:00	-10.235
12	now	haha12	1.6256	2014-05-04 12:00:00	-10.235
2	now	haha2	1.6256	2014-05-04 12:00:00	-10.235
3	now	haha3	1.6256	2014-05-04 12:00:00	-10.235
4	now	haha4	1.6256	2014-05-04 12:00:00	-10.235
5	now	haha5	1.6256	2014-05-04 12:00:00	-10.235
6	now	haha6	1.6256	2014-05-04 12:00:00	-10.235
7	now	haha7	1.6256	2014-05-04 12:00:00	-10.235
8	now	haha8	1.6256	2014-05-04 12:00:00	-10.235
9	now	haha9	1.6256	2014-05-04 12:00:00	-10.235
commit;
select * from tbl1;
i1	v2	i3	i4	d4	i5
10	now	haha10	1.6256	2014-05-04 12:00:00	-10.235
11	now	haha11	1.6256	2014-05-04 12:00:00	-10.235
12	now	haha12	1.6256	2014-05-04 12:00:00	-10.235
2	now	haha2	1.6256	2014-05-04 12:00:00	-10.235
3	now	haha3	1.6256	2014-05-04 12:00:00	-10.235
4	now	haha4	1.6256	2014-05-04 12:00:00	-10.235
5	now	haha5	1.6256	2014-05-04 12:00:00	-10.235
6	now	haha6	1.6256	2014-05-04 12:00:00	-10.235
7	now	haha7	1.6256	2014-05-04 12:00:00	-10.235
8	now	haha8	1.6256	2014-05-04 12:00:00	-10.235
9	now	haha9	1.6256	2014-05-04 12:00:00	-10.235
commit;
