DROP TABLE IF EXISTS table0_bigint;
drop table if exists t1;
create table t1(c1 int primary key, c2 decimal(20,0));
create unique index i1 on t1(c2);
CREATE TABLE table0_bigint (
col_decimal_20_0_index decimal(20,0),
col_char_20_index char(20),
col_bigint_unique bigint,
col_decimal_20_0_unique decimal(20,0),
col_bigint bigint,
col_datetime_index datetime(6),
col_char_20_unique char(20),
pk bigint,
col_decimal_20_0 decimal(20,0),
col_bigint_index bigint,
col_datetime_unique datetime(6),
col_datetime datetime(6),
col_char_20 char(20),
primary key (pk));
CREATE INDEX index_table0_bigint_col_decimal_20_0_index ON table0_bigint(col_decimal_20_0_index);
CREATE INDEX index_table0_bigint_col_char_20_index ON table0_bigint(col_char_20_index);
CREATE UNIQUE INDEX unique_table0_bigint_col_decimal_20_0_unique ON table0_bigint(col_decimal_20_0_unique);
CREATE INDEX index_table0_bigint_col_datetime_index ON table0_bigint(col_datetime_index);
CREATE UNIQUE INDEX unique_table0_bigint_col_char_20_unique ON table0_bigint(col_char_20_unique);
CREATE INDEX index_table0_bigint_col_bigint_index ON table0_bigint(col_bigint_index);
CREATE UNIQUE INDEX unique_table0_bigint_col_datetime_unique ON table0_bigint(col_datetime_unique);
alter system major freeze tenant = sys;
alter system major freeze tenant = all_user;
alter system major freeze tenant = all_meta;
alter system major freeze tenant = sys;
alter system major freeze tenant = all_user;
alter system major freeze tenant = all_meta;
insert into t1 values(1,1.3);
insert into t1 values(2,1.3);
select table_name , index_status from __all_virtual_table where table_name like '%table0_bigint%unique%';
table_name	index_status
__idx_3039_unique_table0_bigint_col_decimal_20_0_unique	2
__idx_3039_unique_table0_bigint_col_char_20_unique	2
__idx_3039_unique_table0_bigint_col_datetime_unique	2
INSERT INTO table0_bigint ( pk , col_decimal_20_0_unique , col_char_20_unique , col_datetime_unique , col_bigint_unique ) VALUES ( LENGTH('AIWOE') , SIGN( 1.2345 ) , 'a' , '1970-01-01' , 7 );
UPDATE table0_bigint AS X SET X . col_decimal_20_0_index = SUBSTR( CAST( ( ROUND( -100 ) ) AS CHAR(100) ) , 1 , 20 ) WHERE CONCAT( col_char_20_index , 'IAYCZ' ) = 'XTFHI' ORDER BY pk ASC , pk DESC LIMIT 79;
INSERT INTO table0_bigint ( pk , col_decimal_20_0_unique , col_char_20_unique , col_datetime_unique , col_bigint_unique ) VALUES ( CEIL( 4875 ) , SUBSTR( CAST( ( 100.2345 ) AS CHAR(100) ) , 1 , 20 ) , 'z' , CONCAT( SUBSTR( CAST( 1000 + 12736742696157184000 AS CHAR(20) ) , 1 , 4 ) , '-12-28') , SUBSTR( CAST( ( SIGN( 99 ) ) AS CHAR(100) ) , 1 , 20 ) ) ;
INSERT INTO table0_bigint ( pk , col_decimal_20_0_unique , col_char_20_unique , col_datetime_unique , col_bigint_unique ) VALUES ( 8 , 1.2345 , 'w' , '9999-01-01' , SIGN( 0 ) );
select pk, col_decimal_20_0_unique  from table0_bigint order by pk;
pk	col_decimal_20_0_unique
5	1
8	1
4875	100
select  index_status from __all_virtual_table where table_name like '%table0_bigint%unique%';
index_status
2
2
2
select * from t1;
c1	c2
1	1
2	1
alter system major freeze tenant = sys;
alter system major freeze tenant = all_user;
alter system major freeze tenant = all_meta;
select  index_status from __all_virtual_table where table_name like '%table0_bigint%unique%';
index_status
6
2
2
