drop table if exists t1;
create table t1 (pk1 int,pk2 int, i1 int, v1 varchar(20),primary key(i1,pk2));
create unique index idx1 on t1(pk1,i1,pk2);
alter system major freeze tenant = sys;
alter system major freeze tenant = all_user;
alter system major freeze tenant = all_meta;
alter system major freeze tenant = sys;
alter system major freeze tenant = all_user;
alter system major freeze tenant = all_meta;
insert into t1 values(1,1,1,'a'),(2,2,2,'b'),(3,3,3,'c'),(4,4,4,'d'),(5,5,5,'e');
update t1 set pk1=4 where pk1=1;
update t1 set pk1=6,v1='d' where pk1=3;
select * from t1;
pk1	pk2	i1	v1
4	1	1	a
2	2	2	b
6	3	3	d
4	4	4	d
5	5	5	e
update t1 set pk1=4 where pk1<15 limit 2;
select * from t1;
pk1	pk2	i1	v1
4	1	1	a
4	2	2	b
6	3	3	d
4	4	4	d
5	5	5	e
update t1 set pk1=8 where pk1<15 order by pk2 asc  limit 2;
select * from t1;
pk1	pk2	i1	v1
8	1	1	a
8	2	2	b
6	3	3	d
4	4	4	d
5	5	5	e
update t1 set pk1=7 where pk1<15 order by pk2 limit 2,1;
select * from t1;
pk1	pk2	i1	v1
8	1	1	a
8	2	2	b
7	3	3	d
4	4	4	d
5	5	5	e
update t1 set pk1=6,v1='d' where pk1=3 limit 0;
select * from t1;
pk1	pk2	i1	v1
8	1	1	a
8	2	2	b
7	3	3	d
4	4	4	d
5	5	5	e
update t1 set v1=4 where pk1<15 limit 2;
select * from t1;
pk1	pk2	i1	v1
8	1	1	4
8	2	2	4
7	3	3	d
4	4	4	d
5	5	5	e
update t1 set v1=8 where pk1<15 order by pk2 asc  limit 2;
select * from t1;
pk1	pk2	i1	v1
8	1	1	8
8	2	2	8
7	3	3	d
4	4	4	d
5	5	5	e
update t1 set v1=7 where pk1<15 order by pk2 limit 2,1;
select * from t1;
pk1	pk2	i1	v1
8	1	1	8
8	2	2	8
7	3	3	7
4	4	4	d
5	5	5	e
update t1 set pk1=6,v1='d' where pk1=3 limit 0;
select * from t1;
pk1	pk2	i1	v1
8	1	1	8
8	2	2	8
7	3	3	7
4	4	4	d
5	5	5	e
explain delete from t1 where pk1<15;
Query Plan
====================================
|ID|OPERATOR   |NAME|EST. ROWS|COST|
------------------------------------
|0 |DELETE     |    |5        |43  |
|1 | TABLE SCAN|t1  |5        |38  |
====================================

Outputs & filters: 
-------------------------------------
  0 - output(nil), filter(nil), params([{t1: (t1.i1, t1.pk2, t1.pk1, t1.v1)}])
  1 - output([t1.i1], [t1.pk2], [t1.pk1], [t1.v1]), filter([t1.pk1 < 15]), 
      access([t1.i1], [t1.pk2], [t1.pk1], [t1.v1]), partitions(p0)

explain delete/*+index(t1 primary)*/ from t1 where pk1<15;
Query Plan
====================================
|ID|OPERATOR   |NAME|EST. ROWS|COST|
------------------------------------
|0 |DELETE     |    |1        |39  |
|1 | TABLE SCAN|t1  |1        |38  |
====================================

Outputs & filters: 
-------------------------------------
  0 - output(nil), filter(nil), params([{t1: (t1.i1, t1.pk2, t1.pk1, t1.v1)}])
  1 - output([t1.i1], [t1.pk2], [t1.pk1], [t1.v1]), filter([t1.pk1 < 15]), 
      access([t1.i1], [t1.pk2], [t1.pk1], [t1.v1]), partitions(p0)

explain delete/*+index(t1 idx1)*/ from t1 where pk1<15;
Query Plan
========================================
|ID|OPERATOR   |NAME    |EST. ROWS|COST|
----------------------------------------
|0 |DELETE     |        |5        |115 |
|1 | TABLE SCAN|t1(idx1)|5        |110 |
========================================

Outputs & filters: 
-------------------------------------
  0 - output(nil), filter(nil), params([{t1: (t1.i1, t1.pk2, t1.pk1, t1.v1)}])
  1 - output([t1.i1], [t1.pk2], [t1.pk1], [t1.v1]), filter(nil), 
      access([t1.i1], [t1.pk2], [t1.pk1], [t1.v1]), partitions(p0)

explain delete from t1 where pk1<15 limit 2;
Query Plan
=====================================
|ID|OPERATOR    |NAME|EST. ROWS|COST|
-------------------------------------
|0 |DELETE      |    |2        |39  |
|1 | LIMIT      |    |2        |37  |
|2 |  TABLE SCAN|t1  |2        |37  |
=====================================

Outputs & filters: 
-------------------------------------
  0 - output(nil), filter(nil), params([{t1: (t1.i1, t1.pk2, t1.pk1, t1.v1)}])
  1 - output([t1.i1], [t1.pk2], [t1.pk1], [t1.v1]), filter(nil), limit(2), offset(nil)
  2 - output([t1.i1], [t1.pk2], [t1.pk1], [t1.v1]), filter([t1.pk1 < 15]), 
      access([t1.i1], [t1.pk2], [t1.pk1], [t1.v1]), partitions(p0)

explain delete/*+index(t1 primary)*/ from t1 where pk1<15 limit 2;
Query Plan
=====================================
|ID|OPERATOR    |NAME|EST. ROWS|COST|
-------------------------------------
|0 |DELETE      |    |1        |39  |
|1 | LIMIT      |    |1        |38  |
|2 |  TABLE SCAN|t1  |1        |38  |
=====================================

Outputs & filters: 
-------------------------------------
  0 - output(nil), filter(nil), params([{t1: (t1.i1, t1.pk2, t1.pk1, t1.v1)}])
  1 - output([t1.i1], [t1.pk2], [t1.pk1], [t1.v1]), filter(nil), limit(2), offset(nil)
  2 - output([t1.i1], [t1.pk2], [t1.pk1], [t1.v1]), filter([t1.pk1 < 15]), 
      access([t1.i1], [t1.pk2], [t1.pk1], [t1.v1]), partitions(p0)

explain delete/*+index(t1 idx1)*/ from t1 where pk1<15 limit 2;
Query Plan
=========================================
|ID|OPERATOR    |NAME    |EST. ROWS|COST|
-----------------------------------------
|0 |DELETE      |        |2        |96  |
|1 | LIMIT      |        |2        |94  |
|2 |  TABLE SCAN|t1(idx1)|2        |94  |
=========================================

Outputs & filters: 
-------------------------------------
  0 - output(nil), filter(nil), params([{t1: (t1.i1, t1.pk2, t1.pk1, t1.v1)}])
  1 - output([t1.i1], [t1.pk2], [t1.pk1], [t1.v1]), filter(nil), limit(2), offset(nil)
  2 - output([t1.i1], [t1.pk2], [t1.pk1], [t1.v1]), filter(nil), 
      access([t1.i1], [t1.pk2], [t1.pk1], [t1.v1]), partitions(p0)

alter system major freeze tenant = sys;
alter system major freeze tenant = all_user;
alter system major freeze tenant = all_meta;
update t1 set pk1=1 where pk1<=4 limit 1;
select * from t1;
pk1	pk2	i1	v1
8	1	1	8
8	2	2	8
7	3	3	7
1	4	4	d
5	5	5	e
update t1 set pk1=3 where pk1>=6 order by pk2 limit 2;
select * from t1;
pk1	pk2	i1	v1
3	1	1	8
3	2	2	8
7	3	3	7
1	4	4	d
5	5	5	e
update t1 set pk1=-1 where (pk2,i1) in ((4,1),(5,2),(6,3),(2,3)) order by i1 limit 5;
select * from t1;
pk1	pk2	i1	v1
3	1	1	8
3	2	2	8
7	3	3	7
1	4	4	d
5	5	5	e
update t1 set pk1=-1 where (pk2,i1) in ((1,1),(1,2),(2,2),(3,3)) order by pk2  asc limit 5;
select * from t1;
pk1	pk2	i1	v1
-1	1	1	8
-1	2	2	8
-1	3	3	7
1	4	4	d
5	5	5	e
update t1 set pk1=-1 where (pk2,i1) in ((1,1),(1,2),(2,2),(3,3)) order by i1 asc limit 2;
select * from t1;
pk1	pk2	i1	v1
-1	1	1	8
-1	2	2	8
-1	3	3	7
1	4	4	d
5	5	5	e
update t1 set pk1=-2 where (pk2,i1) in ((4,4),(4,5),(5,5),(6,6)) order by i1 desc limit 2;
select * from t1;
pk1	pk2	i1	v1
-1	1	1	8
-1	2	2	8
-1	3	3	7
-2	4	4	d
-2	5	5	e
update t1 set pk1=4,v1='e' where pk2=1;
update t1 set pk1=5,v1='f' where pk2=2;
update t1 set pk1=6,v1='g' where pk2=3;
update t1 set pk1=-1 where (pk2,i1) in ((1,1),(1,2),(2,2),(3,3)) order by pk2  asc limit 5;
select * from t1;
pk1	pk2	i1	v1
-1	1	1	e
-1	2	2	f
-1	3	3	g
-2	4	4	d
-2	5	5	e
update t1 set pk1=-1 where (pk2,i1) in ((1,1),(1,2),(5,5),(3,3)) order by i1 asc limit 2;
select * from t1;
pk1	pk2	i1	v1
-1	1	1	e
-1	2	2	f
-1	3	3	g
-2	4	4	d
-2	5	5	e
update t1 set pk1=pk2+1,pk2=pk1+1 where (pk1,i1) in ((1,1),(1,2),(2,2),(2,3)) limit 2;
update t1 set pk1=pk1+1-1 where (pk2,i1) in ((1,1),(1,2),(2,2),(2,3)) limit 2;
select * from t1;
pk1	pk2	i1	v1
-1	1	1	e
-1	2	2	f
-1	3	3	g
-2	4	4	d
-2	5	5	e
alter system major freeze tenant = sys;
alter system major freeze tenant = all_user;
alter system major freeze tenant = all_meta;
select * from t1;
pk1	pk2	i1	v1
-1	1	1	e
-1	2	2	f
-1	3	3	g
-2	4	4	d
-2	5	5	e
replace into t1 values(1,1,1,'a'),(2,2,2,'b'),(3,3,3,'c'),(4,4,14,'d'),(5,5,5,'e');
select * from t1 where (pk1,pk2,i1) in ((2,2,2),(1,1,1),(2,2,3),(1,1,2),(3,3,3),(3,3,4),(4,4,5),(5,5,6))  order by pk1 desc limit 1,3;
pk1	pk2	i1	v1
2	2	2	b
1	1	1	a
update t1 set pk1=-2 where (pk1,pk2,i1) in ((2,2,2),(1,1,1),(2,2,3),(1,1,2),(3,3,3),(3,3,4),(4,4,5),(5,5,6))  order by pk1 desc limit 1,3;
select * from t1;
pk1	pk2	i1	v1
-2	1	1	a
-2	2	2	b
3	3	3	c
-2	4	4	d
5	5	5	e
4	4	14	d
drop table t1;
