drop table if exists t1;
create table t1 (a int, b int, c int, primary key (a, b));
insert into t1(a,b,c) values(1,1,1),(2,2,2),(3,3,3),(4,4,4);
select * from t1;
a	b	c
1	1	1
2	2	2
3	3	3
4	4	4
update t1 set b=2 where a>0 limit 1;
select * from t1;
a	b	c
1	2	1
2	2	2
3	3	3
4	4	4
update t1 set b=11 where a>0 limit 1,1;
select * from t1;
a	b	c
1	2	1
2	11	2
3	3	3
4	4	4
update t1 set b=2 where a>0 limit 2;
select * from t1;
a	b	c
1	2	1
2	2	2
3	3	3
4	4	4
update t1 set b=21 where a>0 limit 2,1;
select * from t1;
a	b	c
1	2	1
2	2	2
3	21	3
4	4	4
update t1 set b='30' where a>0 limit 0,3;
select * from t1;
a	b	c
1	30	1
2	30	2
3	30	3
4	4	4
update t1 set b=2 where a>0 limit 3;
select * from t1;
a	b	c
1	2	1
2	2	2
3	2	3
4	4	4
update t1 set b=2 where a>0 limit 4;
select * from t1;
a	b	c
1	2	1
2	2	2
3	2	3
4	2	4
update t1 set b=10 where a>0 limit 10;
select * from t1;
a	b	c
1	10	1
2	10	2
3	10	3
4	10	4
delete from t1 where a>0 limit 10;
select * from t1;
a	b	c
delete from t1 where a>0 limit 1000;
select * from t1;
a	b	c
delete from t1 where a>0 limit 0,1000;
insert into t1(a,b,c) values(1,1,1),(2,2,2),(3,3,3),(4,4,4);
select * from t1;
a	b	c
1	1	1
2	2	2
3	3	3
4	4	4
update t1 set b=2 where a>0 order by a desc limit 1;
select * from t1;
a	b	c
1	1	1
2	2	2
3	3	3
4	2	4
update t1 test set test.b=2 where test.a>0 order by test.a desc limit 2;
select * from t1;
a	b	c
1	1	1
2	2	2
3	2	3
4	2	4
update t1 set b=2 where a>0 order by a desc limit 0,3;
select * from t1;
a	b	c
1	1	1
2	2	2
3	2	3
4	2	4
update t1 set b=2 where a>0 order by a desc limit 4;
select * from t1;
a	b	c
1	2	1
2	2	2
3	2	3
4	2	4
delete from t1 where a>0 order by a limit 1;
select * from t1;
a	b	c
2	2	2
3	2	3
4	2	4
delete from t1 where a>0 order by a limit 1;
select * from t1;
a	b	c
3	2	3
4	2	4
delete from t1 where a>0 order by a limit 1;
select * from t1;
a	b	c
4	2	4
delete from t1 where a>0 order by a limit 1;
select * from t1;
a	b	c
delete from t1 where a>0 order by a limit 1;
select * from t1;
a	b	c
insert into t1(a,b,c) values(1,1,1),(2,2,2),(3,3,3),(4,4,4);
select * from t1;
a	b	c
1	1	1
2	2	2
3	3	3
4	4	4
delete from t1 where a>0 order by a desc limit -1;
ERROR 42000: You have an error in your SQL syntax; check the manual that corresponds to your OceanBase version for the right syntax to use near '-1' at line 1
delete from t1 where a>0 order by a desc limit 1;
select * from t1;
a	b	c
1	1	1
2	2	2
3	3	3
delete from t1 where a>0 order by a desc limit 1;
select * from t1;
a	b	c
1	1	1
2	2	2
delete from t1 where a>0 order by a desc limit 1;
select * from t1;
a	b	c
1	1	1
delete from t1 where a>0 order by a desc limit 1;
select * from t1;
a	b	c
delete from t1 where 1;
insert into t1(a,b,c) values(1,1,1),(2,2,2),(3,3,3),(4,4,4);
prepare stmt1 from  update t1 set b=? where a>? limit ?;
set @a=1001;
set @b=0;
set @c=3;
select * from t1;
a	b	c
1	1	1
2	2	2
3	3	3
4	4	4
execute stmt1 using @a,@b,@c;
execute stmt1 using @a,@c,@b;
select * from t1;
a	b	c
1	1001	1
2	1001	2
3	1001	3
4	4	4
delete from t1 where 1;
insert into t1(a,b,c) values(1,1,1),(2,2,2),(3,3,3),(4,4,4);
prepare stmt1 from  update t1 set b=? where a in (?,?)  order by a limit ?;
set @a=1001;
set @b=0;
set @d=1;
set @c=3;
select * from t1;
a	b	c
1	1	1
2	2	2
3	3	3
4	4	4
execute stmt1 using @a,@b,@d,@c;
select * from t1;
a	b	c
1	1001	1
2	2	2
3	3	3
4	4	4
execute stmt1 using @a,@c,@d,@b;
select * from t1;
a	b	c
1	1001	1
2	2	2
3	3	3
4	4	4
delete from t1 where 1;
insert into t1(a,b,c) values(1,1,1),(2,2,2),(3,3,3),(4,4,4);
prepare stmt1 from  update t1 set b=? where a in (?,?)  order by a desc  limit ?;
set @a=1001;
set @b=0;
set @d=1;
set @c=3;
select * from t1;
a	b	c
1	1	1
2	2	2
3	3	3
4	4	4
execute stmt1 using @a,@b,@d,@c;
execute stmt1 using @a,@c,@d,@b;
select * from t1;
a	b	c
1	1001	1
2	2	2
3	3	3
4	4	4
select * from t1;
a	b	c
1	1001	1
2	2	2
3	3	3
4	4	4
update t1 set b=5 where a>0 limit 2 when row_count(insert into t1 values(5,5,5))=1;
select * from t1;
a	b	c
1	5	1
2	5	2
3	3	3
4	4	4
5	5	5
update t1 set b=5 where a>0 order by a desc limit 2 when row_count(insert into t1 values(6,6,6))=1;
select * from t1;
a	b	c
1	5	1
2	5	2
3	3	3
4	5	4
5	5	5
6	6	6
update t1 set b=5 where a>0 order by a desc limit 2 when row_count(update t1 set b=5 where a>0 limit 2)=2;
select * from t1;
a	b	c
1	5	1
2	5	2
3	3	3
4	5	4
5	5	5
6	5	6
prepare stmt2 from update t1 set b=5 where a>0 order by a desc limit 2 when row_count(update t1 set b=5 where a>0 order by a desc limit ?)=?;
set @a=1;
set @b=1;
execute stmt2 using @a, @b;
select * from t1;
a	b	c
1	5	1
2	5	2
3	3	3
4	5	4
5	5	5
6	5	6
set @a=1;
set @b=1;
execute stmt2 using @a, @b;
select * from t1;
a	b	c
1	5	1
2	5	2
3	3	3
4	5	4
5	5	5
6	5	6
