drop table if exists t1;
create table t1(c1 int primary key, c2 int);
select * from t1 where c1=1 for update wait 0.001 when row_count(insert into t1 values(1,1)) = 0;
ERROR HY000: OB-12: Timeout
select * from t1 where c1=1 for update nowait when row_count(insert into t1 values(1,1),(2,2),(3,3)) = 2;
ERROR 23000: Number 1 When filter failed, ret=-5064, func 1: ROW_COUNT()=3
select * from t1 where c1=1 for update wait 0.0001 when row_count(update t1 set c2=0 where c1=1) = 1;
ERROR HY000: OB-12: Timeout
select * from t1 where c1=1 for update nowait when row_count(delete from t1 where c1=1) = 1;
ERROR 23000: Number 1 When filter failed, ret=-5064, func 1: ROW_COUNT()=0
select * from t1 where c1=1 for update wait 0.000001 when row_count(insert into t1 values(1,1)) = 1;
ERROR HY000: OB-12: Timeout
select * from t1 where c1=1 for update nowait when row_count(insert into t1 values(2,2),(3,3)) = 2;
c1	c2
select * from t1 where c1=1 for update nowait when row_count(update t1 set c2=0 where c1=1) = 1;
ERROR 23000: Number 1 When filter failed, ret=-5064, func 1: ROW_COUNT()=0
select * from t1 where c1=1 for update wait 1 when row_count(delete from t1 where c1=1) = 0;
c1	c2
select * from t1 where c1=1 for update wait 5 when row_count(delete from t1 where c1=2) = 1;
c1	c2
select * from t1 where c1=1 for update wait 10 when row_count(delete from t1 where c1=3) = 1;
c1	c2
select * from t1 where c1=1 for update nowait when true;
c1	c2
select * from t1 where c1=1 for update nowait when false;
ERROR 23000: Number 1 When filter failed, ret=-5064
select * from t1 where c1=1 for update wait 0.000001 when row_count(insert into t1 values(1,1)) = 1;
ERROR HY000: OB-12: Timeout
select * from t1 where c1=1 for update wait 0.000001 when row_count(insert into t1 values(1,1)) = 0;
ERROR HY000: OB-12: Timeout
delete  from t1 where c1=1;
begin;
select * from t1 where c1=1 for update nowait when row_count(insert into t1 values(1,1)) = 0;
ERROR 23000: Number 1 When filter failed, ret=-5064, func 1: ROW_COUNT()=1
commit;
select * from t1;
c1	c2
begin;
select * from t1 where c1=1 for update wait 0.03 when row_count(insert into t1 values(1,1),(2,2),(3,3)) = 2;
ERROR 23000: Number 1 When filter failed, ret=-5064, func 1: ROW_COUNT()=3
commit;
select * from t1;
c1	c2
begin;
select * from t1 where c1=1 for update wait 0.1 when row_count(update t1 set c2=0 where c1=1) = 1;
ERROR 23000: Number 1 When filter failed, ret=-5064, func 1: ROW_COUNT()=0
commit;
select * from t1;
c1	c2
begin;
select * from t1 where c1=1 for update wait 1 when row_count(delete from t1 where c1=1) = 1;
ERROR 23000: Number 1 When filter failed, ret=-5064, func 1: ROW_COUNT()=0
commit;
select * from t1;
c1	c2
begin;
select * from t1 where c1=1 for update wait 0.000001 when row_count(insert into t1 values(1,1)) = 1;
ERROR HY000: OB-12: Timeout
commit;
select * from t1;
c1	c2
begin;
select * from t1 where c1=1 for update nowait when row_count(insert into t1 values(2,2),(3,3)) = 2;
c1	c2
commit;
select * from t1;
c1	c2
2	2
3	3
begin;
select * from t1 where c1=1 for update wait 0.03 when row_count(update t1 set c2=0 where c1=1) = 0;
c1	c2
commit;
select * from t1;
c1	c2
2	2
3	3
begin;
select * from t1 where c1=1 for update wait 0.0001 when row_count(delete from t1 where c1=1) = 1;
ERROR HY000: OB-12: Timeout
commit;
select * from t1;
c1	c2
2	2
3	3
begin;
select * from t1 where c1=1 for update nowait when row_count(delete from t1 where c1=2) = 1;
c1	c2
commit;
select * from t1;
c1	c2
3	3
begin;
select * from t1 where c1=1 for update wait 0.001 when row_count(delete from t1 where c1=3) = 1;
ERROR HY000: OB-12: Timeout
commit;
select * from t1;
c1	c2
3	3
begin;
select * from t1 where c1=1 for update nowait when true;
c1	c2
commit;
select * from t1;
c1	c2
3	3
begin;
select * from t1 where c1=1 for update nowait when false;
ERROR 23000: Number 1 When filter failed, ret=-5064
commit;
select * from t1;
c1	c2
3	3
begin;
select * from t1 where c1=1 for update wait 0.000001 when row_count(insert into t1 values(1,1)) = 1;
ERROR HY000: OB-12: Timeout
commit;
select * from t1;
c1	c2
3	3
begin;
select * from t1 where c1=1 for update wait 0.000001 when row_count(insert into t1 values(1,1)) = 0;
ERROR HY000: OB-12: Timeout
commit;
select * from t1;
c1	c2
3	3
delete  from t1 where c1=1;
commit;
begin;
select * from t1 where c1=1 for update nowait when row_count(insert into t1 values(1,1)) = 0;
ERROR 23000: Number 1 When filter failed, ret=-5064, func 1: ROW_COUNT()=1
rollback;
select * from t1;
c1	c2
3	3
begin;
select * from t1 where c1=1 for update wait 0.000001 when row_count(insert into t1 values(1,1),(2,2),(3,3)) = 2;
ERROR HY000: OB-12: Timeout
rollback;
select * from t1;
c1	c2
3	3
begin;
select * from t1 where c1=1 for update nowait when row_count(update t1 set c2=0 where c1=1) = 1;
ERROR 23000: Number 1 When filter failed, ret=-5064, func 1: ROW_COUNT()=0
rollback;
select * from t1;
c1	c2
3	3
begin;
select * from t1 where c1=1 for update wait 0.000001 when row_count(delete from t1 where c1=1) = 1;
ERROR HY000: OB-12: Timeout
rollback;
select * from t1;
c1	c2
3	3
begin;
select * from t1 where c1=1 for update nowait when row_count(insert into t1 values(1,1)) = 1;
c1	c2
1	1
rollback;
select * from t1;
c1	c2
3	3
begin;
select * from t1 where c1=1 for update wait 0.000001 when row_count(insert into t1 values(1,1)) = 1;
ERROR HY000: OB-12: Timeout
commit;
select * from t1;
c1	c2
3	3
begin;
select * from t1 where c1=1 for update nowait when row_count(insert into t1 values(2,2),(3,3)) = 2;
ERROR 23000: Duplicate entry '3' for key 'PRIMARY'
rollback;
select * from t1;
c1	c2
3	3
begin;
select * from t1 where c1=1 for update wait 0.000001 when row_count(insert into t1 values(2,2),(3,3)) = 2;
ERROR HY000: OB-12: Timeout
commit;
select * from t1;
c1	c2
3	3
begin;
select * from t1 where c1=1 for update nowait when row_count(update t1 set c2=0 where c1=1) = 0;
c1	c2
rollback;
select * from t1;
c1	c2
3	3
begin;
select * from t1 where c1=1 for update wait 0.000001 when row_count(delete from t1 where c1=1) = 1;
ERROR HY000: OB-12: Timeout
rollback;
select * from t1;
c1	c2
3	3
begin;
select * from t1 where c1=1 for update nowait when row_count(delete from t1 where c1=2) = 0;
c1	c2
rollback;
select * from t1;
c1	c2
3	3
begin;
select * from t1 where c1=1 for update wait 0.000001 when row_count(delete from t1 where c1=3) = 1;
ERROR HY000: OB-12: Timeout
rollback;
select * from t1;
c1	c2
3	3
begin;
select * from t1 where c1=1 for update nowait when true;
c1	c2
rollback;
select * from t1;
c1	c2
3	3
begin;
select * from t1 where c1=1 for update nowait when false;
ERROR 23000: Number 1 When filter failed, ret=-5064
rollback;
select * from t1;
c1	c2
3	3
begin;
delete from t1 where c1=1;
commit;
select * from t1 where c1=1 for update wait 0.000001 when row_count(insert into t1 values(1,1)) = 1;
ERROR HY000: OB-12: Timeout
commit;
select * from t1;
c1	c2
3	3
begin;
select * from t1 where c1=1 for update nowait when row_count(insert into t1 values(1,1)) = 1;
c1	c2
1	1
rollback;
select * from t1;
c1	c2
3	3
set autocommit=1;
drop table if exists t1;
create table t1(c1 int primary key,c2 int);
set autocommit=0;
begin;
select * from t1 where c1=1 for update nowait when row_count(insert into t1 values(1,1))=1 and row_count(insert into t1 values(2,2)) = 1 and row_count(insert into t1 values(3,3),(4,4)) = 2;
c1	c2
1	1
commit;
select * from t1;
c1	c2
1	1
2	2
3	3
4	4
commit;
delete  from t1 where c1=1;
delete  from t1 where c1=2;
delete  from t1 where c1=3;
delete  from t1 where c1=4;
commit;
begin;
select * from t1 where c1=1 for update wait 0.000001 when row_count(insert into t1 values(1,1))=1 and row_count(insert into t1 values(2,2)) = 1 and row_count(insert into t1 values(3,3),(4,4)) = 2;
ERROR HY000: OB-12: Timeout
rollback;
select * from t1;
c1	c2
commit;
begin;
insert into t1 values(1,1);
update t1 set c2=0 where c1=1;
select * from t1 where c1=1 for update nowait when row_count( update t1 set c2=0 where c1=1)=0 ;
ERROR 23000: Number 1 When filter failed, ret=-5064, func 1: ROW_COUNT()=1
commit;
select * from t1;
c1	c2
1	0
commit;
begin;
update t1 set c2=0 where c1=1;
select * from t1 where c1=1 for update nowait when row_count( update t1 set c2=0 where c1=1)=0 ;
ERROR 23000: Number 1 When filter failed, ret=-5064, func 1: ROW_COUNT()=1
rollback;
select * from t1;
c1	c2
1	0
commit;
begin;
select * from t1 where c1=1 for update wait 0.000001 when row_count(insert into t1 values(1,1))=1 and row_count(insert into t1 values(2,2)) = 1 and row_count(insert into t1 values(1,1),(4,4)) = 2;
ERROR HY000: OB-12: Timeout
commit;
select * from t1;
c1	c2
1	0
commit;
begin;
delete from t1 where c1<=4;
select * from t1 where c1=1 for update nowait when row_count(insert into t1 values(1,1))=1 and row_count(insert into t1 values(2,2)) = 1 and row_count(insert into t1 values(3,3),(4,4)) = 1;
ERROR 23000: Number 1 When filter failed, ret=-5064, func 1: ROW_COUNT()=1, func 2: ROW_COUNT()=1, func 3: ROW_COUNT()=2
commit;
select * from t1;
c1	c2
commit;
begin;
select * from t1 where c1=1 for update wait 0.000001 when row_count(insert into t1 values(1,1))=0 and row_count(insert into t1 values(2,2)) = 1 and row_count(insert into t1 values(3,3),(4,4)) = 2;
ERROR HY000: OB-12: Timeout
commit;
select * from t1;
c1	c2
commit;
begin;
select * from t1 where c1=1 for update nowait when row_count(insert into t1 values(1,1))=1 and row_count(insert into t1 values(2,2)) = 1 and row_count(insert into t1 values(3,3),(4,4)) = 2 and false;
ERROR 23000: Number 1 When filter failed, ret=-5064, func 1: ROW_COUNT()=1, func 2: ROW_COUNT()=1, func 3: ROW_COUNT()=2
commit;
select * from t1;
c1	c2
commit;
begin;
select * from t1 where c1=1 for update wait 0.000001 when row_count(delete from t1 where c1=1)=0 and row_count(insert into t1 values(1,1)) = 1;
ERROR HY000: OB-12: Timeout
commit;
select * from t1;
c1	c2
delete from t1 where c1=1;
commit;
begin;
select * from t1 where c1=1 for update nowait when row_count(insert into t1 values(1,1)) = 1 and row_count(delete from t1 where c1=1)=1;
c1	c2
commit;
select * from t1;
c1	c2
commit;
begin;
select * from t1 where c1=1 for update wait 0.000001 when row_count(delete from t1 where c1=1 when row_count(insert into t1 values(1,1)) = 1 ) = 1;
ERROR HY000: OB-12: Timeout
commit;
select * from t1;
c1	c2
commit;
begin;
select * from t1 where c1=1 for update nowait when row_count(delete from t1 where c1=1 when row_count(insert into t1 values(1,1) when row_count(delete from t1 where c1=1) = 0 ) = 1 ) = 1;
c1	c2
commit;
select * from t1;
c1	c2
commit;
begin;
select * from t1 where c1=1 for update wait 0.000001 when row_count(delete from t1 where c1=1 when row_count(insert into t1 values(1,1)) = 1 ) = 1;
ERROR HY000: OB-12: Timeout
rollback;
select * from t1;
c1	c2
commit;
begin;
select * from t1 where c1=1 for update nowait when row_count(delete from t1 where c1=1 when row_count(insert into t1 values(1,1) when row_count(delete from t1 where c1=1) = 0 ) = 1 ) = 1;
c1	c2
rollback;
select * from t1;
c1	c2
commit;
begin;
select * from t1 where c1=1 for update wait 0.000001 when row_count(insert into t1 values(1,1) when row_count(update t1 set c2=0 where c1=1 when row_count(delete from t1 where c1=1) = 0)=0 ) = 1 ;
ERROR HY000: OB-12: Timeout
rollback;
select * from t1;
c1	c2
commit;
begin;
select * from t1 where c1=1 for update nowait when row_count(insert into t1 values(1,1) when row_count(update t1 set c2=0 where c1=1 when row_count(delete from t1 where c1=1) = 0)=0 ) = 1 ;
c1	c2
1	1
commit;
select * from t1;
c1	c2
1	1
delete from t1 where c1=1;
commit;
set autocommit=1;
