create table t1(pk1 int, pk2 int, c1 int, c2 int, primary key(pk1,pk2));
create table t2(pk1 int, pk2 int, c1 int, c2 int, primary key(pk1,pk2));
create index i1 on t1(c1);
create index i2 on t2(c1) storing(c2);
insert into t1(pk1,pk2,c1,c2) values(0,0,0,0),(0,1,0,0),(0,2,0,0),(0,3,0,0),(1,0,0,0),(1,1,0,0),(1,2,0,0),(1,3,0,0);
alter system major freeze tenant = sys;
alter system major freeze tenant = all_user;
alter system major freeze tenant = all_meta;
insert into t2(pk1,pk2,c1,c2) values(0,0,0,0),(0,1,0,0),(0,2,0,0),(0,3,0,0),(1,0,0,0),(1,1,0,0),(1,2,0,0),(1,3,0,0);
select c1,c2 from t1 where pk1=1 when row_count(update t1 set c1=c1+1, c2=c2+1 where pk1=1)=1;
ERROR 23000: Number 1 When filter failed, ret=-5064, func 1: ROW_COUNT()=4
select * from t1;
pk1	pk2	c1	c2
0	0	0	0
0	1	0	0
0	2	0	0
0	3	0	0
1	0	0	0
1	1	0	0
1	2	0	0
1	3	0	0
pk1	pk2	c1
0	0	0
0	1	0
0	2	0
0	3	0
1	0	0
1	1	0
1	2	0
1	3	0
select * from t1 when row_count(update t1 set c1=c1+1, c2=c2+1 where pk1=0)=4;
pk1	pk2	c1	c2
0	0	1	1
0	1	1	1
0	2	1	1
0	3	1	1
1	0	0	0
1	1	0	0
1	2	0	0
1	3	0	0
select c1,c2 from t1 where pk1=1 when row_count(update t1 set c1=c1+1, c2=c2+1 where pk1=1)=4;
c1	c2
1	1
1	1
1	1
1	1
select * from t1;
pk1	pk2	c1	c2
0	0	1	1
0	1	1	1
0	2	1	1
0	3	1	1
1	0	1	1
1	1	1	1
1	2	1	1
1	3	1	1
pk1	pk2	c1
0	0	1
0	1	1
0	2	1
0	3	1
1	0	1
1	1	1
1	2	1
1	3	1
replace into t1(pk1,pk2,c1,c2) values(0,0,0,0),(0,1,0,0),(0,2,0,0),(0,3,0,0),(1,0,0,0),(1,1,0,0),(1,2,0,0),(1,3,0,0);
select * from t1 where pk1=1 when row_count(update t1 set c1=c1+1, c2=c2+1 where pk1=1 when row_count(update t1 set c1=c1+1, c2=c2+1 where pk1=1)=4)=4;
pk1	pk2	c1	c2
1	0	2	2
1	1	2	2
1	2	2	2
1	3	2	2
select c1,c2 from t1 where pk1=0 when row_count(update t1 set c1=c1+1, c2=c2+1 where pk1=0 when row_count(update t1 set c1=c1+1, c2=c2+1 where pk1=0)=4)=4;
c1	c2
2	2
2	2
2	2
2	2
select * from t1;
pk1	pk2	c1	c2
0	0	2	2
0	1	2	2
0	2	2	2
0	3	2	2
1	0	2	2
1	1	2	2
1	2	2	2
1	3	2	2
pk1	pk2	c1
0	0	2
0	1	2
0	2	2
0	3	2
1	0	2
1	1	2
1	2	2
1	3	2
select * from t1 where pk1=1 when row_count(update t1 set c1=c1+1, c2=c2+1 where pk1=1 when row_count(update t1 set c1=c1+1, c2=c2+1 where pk1=1)=3)=4;
ERROR 23000: Number 1 When filter failed, ret=-5064, func 1: ROW_COUNT()=4
select * from t1 where pk1=1 when row_count(update t1 set c1=c1+1, c2=c2+1 where pk1=1 when row_count(update t1 set c1=c1+1, c2=c2+1 where pk1=1)=4)=3;
ERROR 23000: Number 2 When filter failed, ret=-5064, func 1: ROW_COUNT()=4
select * from t1;
pk1	pk2	c1	c2
0	0	2	2
0	1	2	2
0	2	2	2
0	3	2	2
1	0	2	2
1	1	2	2
1	2	2	2
1	3	2	2
pk1	pk2	c1
0	0	2
0	1	2
0	2	2
0	3	2
1	0	2
1	1	2
1	2	2
1	3	2
replace into t1(pk1,pk2,c1,c2) values(0,0,0,0),(0,1,0,0),(0,2,0,0),(0,3,0,0),(1,0,0,0),(1,1,0,0),(1,2,0,0),(1,3,0,0);
select * from t1 where pk1=0 when row_count(update t2 set c1=c1+1, c2=c2+1 where pk1=0 when row_count(update t1 set c1=c1+1, c2=c2+1 where pk1=0)=4)=4;
pk1	pk2	c1	c2
0	0	1	1
0	1	1	1
0	2	1	1
0	3	1	1
select * from t1;
pk1	pk2	c1	c2
0	0	1	1
0	1	1	1
0	2	1	1
0	3	1	1
1	0	0	0
1	1	0	0
1	2	0	0
1	3	0	0
pk1	pk2	c1
1	0	0
1	1	0
1	2	0
1	3	0
0	0	1
0	1	1
0	2	1
0	3	1
pk1	pk2	c1	c2
0	0	1	1
0	1	1	1
0	2	1	1
0	3	1	1
1	0	0	0
1	1	0	0
1	2	0	0
1	3	0	0
pk1	pk2	c1	c2
1	0	0	0
1	1	0	0
1	2	0	0
1	3	0	0
0	0	1	1
0	1	1	1
0	2	1	1
0	3	1	1
select c1,c2 from t2 where pk1=1 when row_count(update t2 set c1=c1+1, c2=c2+1 where pk1=1 when row_count(update t1 set c1=c1+1, c2=c2+1 where pk1=1)=4)=4;
c1	c2
1	1
1	1
1	1
1	1
select * from t1;
pk1	pk2	c1	c2
0	0	1	1
0	1	1	1
0	2	1	1
0	3	1	1
1	0	1	1
1	1	1	1
1	2	1	1
1	3	1	1
pk1	pk2	c1
0	0	1
0	1	1
0	2	1
0	3	1
1	0	1
1	1	1
1	2	1
1	3	1
pk1	pk2	c1	c2
0	0	1	1
0	1	1	1
0	2	1	1
0	3	1	1
1	0	1	1
1	1	1	1
1	2	1	1
1	3	1	1
pk1	pk2	c1	c2
0	0	1	1
0	1	1	1
0	2	1	1
0	3	1	1
1	0	1	1
1	1	1	1
1	2	1	1
1	3	1	1
select * from t1 where pk1=1 when row_count(update t2 set c1=c1+1, c2=c2+1 where pk1=1 when row_count(update t1 set c1=c1+1, c2=c2+1 where pk1=1)=4)=1;
ERROR 23000: Number 2 When filter failed, ret=-5064, func 1: ROW_COUNT()=4
select * from t1 where pk1=1 when row_count(update t2 set c1=c1+1, c2=c2+1 where pk1=1 when row_count(update t1 set c1=c1+1, c2=c2+1 where pk1=1)=1)=4;
ERROR 23000: Number 1 When filter failed, ret=-5064, func 1: ROW_COUNT()=4
select * from t1;
pk1	pk2	c1	c2
0	0	1	1
0	1	1	1
0	2	1	1
0	3	1	1
1	0	1	1
1	1	1	1
1	2	1	1
1	3	1	1
pk1	pk2	c1
0	0	1
0	1	1
0	2	1
0	3	1
1	0	1
1	1	1
1	2	1
1	3	1
pk1	pk2	c1	c2
0	0	1	1
0	1	1	1
0	2	1	1
0	3	1	1
1	0	1	1
1	1	1	1
1	2	1	1
1	3	1	1
pk1	pk2	c1	c2
0	0	1	1
0	1	1	1
0	2	1	1
0	3	1	1
1	0	1	1
1	1	1	1
1	2	1	1
1	3	1	1
replace into t1(pk1,pk2,c1,c2) values(0,0,0,0),(0,1,0,0),(0,2,0,0),(0,3,0,0),(1,0,0,0),(1,1,0,0),(1,2,0,0),(1,3,0,0);
replace into t2(pk1,pk2,c1,c2) values(0,0,0,0),(0,1,0,0),(0,2,0,0),(0,3,0,0),(1,0,0,0),(1,1,0,0),(1,2,0,0),(1,3,0,0);
select c1, c2 from t1 when row_count(update t1 set c1=c1+1, c2=c2+1 where pk1=1 when row_count(delete from t1 where pk1=0)=4)=1;
ERROR 23000: Number 2 When filter failed, ret=-5064, func 1: ROW_COUNT()=4
select c1, c2 from t1 when row_count(update t1 set c1=c1+1, c2=c2+1 where pk1=1 when row_count(delete from t1 where pk1=0)=1)=4;
ERROR 23000: Number 1 When filter failed, ret=-5064, func 1: ROW_COUNT()=4
select c1, c2 from t1 when row_count(update t1 set c1=c1+1, c2=c2+1 where pk1=1 when row_count(delete from t2 where pk1=0)=4)=1;
ERROR 23000: Number 2 When filter failed, ret=-5064, func 1: ROW_COUNT()=4
select c1, c2 from t1 when row_count(update t1 set c1=c1+1, c2=c2+1 where pk1=1 when row_count(delete from t2 where pk1=0)=1)=4;
ERROR 23000: Number 1 When filter failed, ret=-5064, func 1: ROW_COUNT()=4
select * from t1;
pk1	pk2	c1	c2
0	0	0	0
0	1	0	0
0	2	0	0
0	3	0	0
1	0	0	0
1	1	0	0
1	2	0	0
1	3	0	0
pk1	pk2	c1
0	0	0
0	1	0
0	2	0
0	3	0
1	0	0
1	1	0
1	2	0
1	3	0
select * from t2;
pk1	pk2	c1	c2
0	0	0	0
0	1	0	0
0	2	0	0
0	3	0	0
1	0	0	0
1	1	0	0
1	2	0	0
1	3	0	0
pk1	pk2	c1	c2
0	0	0	0
0	1	0	0
0	2	0	0
0	3	0	0
1	0	0	0
1	1	0	0
1	2	0	0
1	3	0	0
select c1, c2 from t1 where pk1=0 when row_count(update t1 set c1=c1+1, c2=c2+1 where pk1=0 when row_count(delete from t2 where pk1=0)=4)=4;
c1	c2
1	1
1	1
1	1
1	1
select * from t1;
pk1	pk2	c1	c2
0	0	1	1
0	1	1	1
0	2	1	1
0	3	1	1
1	0	0	0
1	1	0	0
1	2	0	0
1	3	0	0
pk1	pk2	c1
1	0	0
1	1	0
1	2	0
1	3	0
0	0	1
0	1	1
0	2	1
0	3	1
select * from t2;
pk1	pk2	c1	c2
1	0	0	0
1	1	0	0
1	2	0	0
1	3	0	0
pk1	pk2	c1	c2
1	0	0	0
1	1	0	0
1	2	0	0
1	3	0	0
select pk1, pk2, c1, c2 from t1 where pk1=0 when row_count(update t1 set c1=c1+1, c2=c2+1 where pk1=0 when row_count(delete from t2 where pk1=1)=4)=4;
pk1	pk2	c1	c2
0	0	2	2
0	1	2	2
0	2	2	2
0	3	2	2
select * from t1;
pk1	pk2	c1	c2
0	0	2	2
0	1	2	2
0	2	2	2
0	3	2	2
1	0	0	0
1	1	0	0
1	2	0	0
1	3	0	0
pk1	pk2	c1
1	0	0
1	1	0
1	2	0
1	3	0
0	0	2
0	1	2
0	2	2
0	3	2
select * from t2;
pk1	pk2	c1	c2
pk1	pk2	c1	c2
select * from t1 where pk1=1 when row_count(update t1 set c1=c1+1, c2=c2+1 where pk1=1 when row_count(delete from t1 where pk1=0)=4)=4;
pk1	pk2	c1	c2
1	0	1	1
1	1	1	1
1	2	1	1
1	3	1	1
select * from t1;
pk1	pk2	c1	c2
1	0	1	1
1	1	1	1
1	2	1	1
1	3	1	1
pk1	pk2	c1
1	0	1
1	1	1
1	2	1
1	3	1
select * from t2;
pk1	pk2	c1	c2
pk1	pk2	c1	c2
replace into t1(pk1,pk2,c1,c2) values(0,0,0,0),(0,1,0,0),(0,2,0,0),(0,3,0,0),(1,0,0,0),(1,1,0,0),(1,2,0,0),(1,3,0,0);
replace into t2(pk1,pk2,c1,c2) values(0,0,0,0),(0,1,0,0),(0,2,0,0),(0,3,0,0),(1,0,0,0),(1,1,0,0),(1,2,0,0),(1,3,0,0);
update t1 set c1=2, c2=2 where pk1=2 when row_count(insert into t1(pk1,pk2,c1,c2) values(2,0,0,0),(2,1,0,0))=1;
ERROR 23000: Number 1 When filter failed, ret=-5064, func 1: ROW_COUNT()=2
update t1 set c1=3, c2=3 where pk1=2 when row_count(replace into t1(pk1,pk2,c1,c2) values(2,2,0,0),(2,3,0,0))=1;
ERROR 23000: Number 1 When filter failed, ret=-5064, func 1: ROW_COUNT()=2
update t1 set c1=4, c2=4 where pk1=2 when row_count(insert into t1(pk1,pk2,c1,c2) values(1,0,0,0),(1,1,0,0))=2;
ERROR 23000: Duplicate entry '1-0' for key 'PRIMARY'
select * from t1;
pk1	pk2	c1	c2
0	0	0	0
0	1	0	0
0	2	0	0
0	3	0	0
1	0	0	0
1	1	0	0
1	2	0	0
1	3	0	0
pk1	pk2	c1
0	0	0
0	1	0
0	2	0
0	3	0
1	0	0
1	1	0
1	2	0
1	3	0
update t1 set c1=2, c2=2 where pk1=2 when row_count(insert into t1(pk1,pk2,c1,c2) values(2,0,0,0),(2,1,0,0))=2;
select * from t1;
pk1	pk2	c1	c2
0	0	0	0
0	1	0	0
0	2	0	0
0	3	0	0
1	0	0	0
1	1	0	0
1	2	0	0
1	3	0	0
2	0	0	0
2	1	0	0
pk1	pk2	c1
0	0	0
0	1	0
0	2	0
0	3	0
1	0	0
1	1	0
1	2	0
1	3	0
2	0	0
2	1	0
update t1 set c1=3, c2=3 where pk1=2 when row_count(replace into t1(pk1,pk2,c1,c2) values(2,2,0,0),(2,3,0,0))=2;
select * from t1;
pk1	pk2	c1	c2
0	0	0	0
0	1	0	0
0	2	0	0
0	3	0	0
1	0	0	0
1	1	0	0
1	2	0	0
1	3	0	0
2	0	3	3
2	1	3	3
2	2	0	0
2	3	0	0
pk1	pk2	c1
0	0	0
0	1	0
0	2	0
0	3	0
1	0	0
1	1	0
1	2	0
1	3	0
2	2	0
2	3	0
2	0	3
2	1	3
update t1 set c1=6, c2=6 where pk1=0 when row_count(insert into t1(pk1,pk2,c1,c2) values(3,0,0,0),(3,1,0,0))=1;
ERROR 23000: Number 1 When filter failed, ret=-5064, func 1: ROW_COUNT()=2
update t1 set c1=7, c2=7 where pk1=1 when row_count(replace into t1(pk1,pk2,c1,c2) values(3,2,0,0),(3,3,0,0))=1;
ERROR 23000: Number 1 When filter failed, ret=-5064, func 1: ROW_COUNT()=2
update t1 set c1=8, c2=8 where pk1=0 when row_count(insert into t2(pk1,pk2,c1,c2) values(3,0,0,0),(3,1,0,0))=1;
ERROR 23000: Number 1 When filter failed, ret=-5064, func 1: ROW_COUNT()=2
update t1 set c1=9, c2=9 where pk1=1 when row_count(replace into t2(pk1,pk2,c1,c2) values(3,2,0,0),(3,3,0,0))=1;
ERROR 23000: Number 1 When filter failed, ret=-5064, func 1: ROW_COUNT()=2
select * from t1;
pk1	pk2	c1	c2
0	0	0	0
0	1	0	0
0	2	0	0
0	3	0	0
1	0	0	0
1	1	0	0
1	2	0	0
1	3	0	0
2	0	3	3
2	1	3	3
2	2	0	0
2	3	0	0
pk1	pk2	c1
0	0	0
0	1	0
0	2	0
0	3	0
1	0	0
1	1	0
1	2	0
1	3	0
2	2	0
2	3	0
2	0	3
2	1	3
select * from t2;
pk1	pk2	c1	c2
0	0	0	0
0	1	0	0
0	2	0	0
0	3	0	0
1	0	0	0
1	1	0	0
1	2	0	0
1	3	0	0
pk1	pk2	c1	c2
0	0	0	0
0	1	0	0
0	2	0	0
0	3	0	0
1	0	0	0
1	1	0	0
1	2	0	0
1	3	0	0
update t1 set c1=6, c2=6 where pk1=0 when row_count(insert into t1(pk1,pk2,c1,c2) values(3,0,0,0),(3,1,0,0))=2;
update t1 set c1=7, c2=7 where pk1=1 when row_count(replace into t1(pk1,pk2,c1,c2) values(3,2,0,0),(3,3,0,0))=2;
select * from t1;
pk1	pk2	c1	c2
0	0	6	6
0	1	6	6
0	2	6	6
0	3	6	6
1	0	7	7
1	1	7	7
1	2	7	7
1	3	7	7
2	0	3	3
2	1	3	3
2	2	0	0
2	3	0	0
3	0	0	0
3	1	0	0
3	2	0	0
3	3	0	0
pk1	pk2	c1
2	2	0
2	3	0
3	0	0
3	1	0
3	2	0
3	3	0
2	0	3
2	1	3
0	0	6
0	1	6
0	2	6
0	3	6
1	0	7
1	1	7
1	2	7
1	3	7
update t1 set c1=8, c2=8 where pk1=0 when row_count(insert into t2(pk1,pk2,c1,c2) values(3,0,0,0),(3,1,0,0))=2;
update t1 set c1=9, c2=9 where pk1=1 when row_count(replace into t2(pk1,pk2,c1,c2) values(3,2,0,0),(3,3,0,0))=2;
select * from t1;
pk1	pk2	c1	c2
0	0	8	8
0	1	8	8
0	2	8	8
0	3	8	8
1	0	9	9
1	1	9	9
1	2	9	9
1	3	9	9
2	0	3	3
2	1	3	3
2	2	0	0
2	3	0	0
3	0	0	0
3	1	0	0
3	2	0	0
3	3	0	0
pk1	pk2	c1
2	2	0
2	3	0
3	0	0
3	1	0
3	2	0
3	3	0
2	0	3
2	1	3
0	0	8
0	1	8
0	2	8
0	3	8
1	0	9
1	1	9
1	2	9
1	3	9
select * from t2;
pk1	pk2	c1	c2
0	0	0	0
0	1	0	0
0	2	0	0
0	3	0	0
1	0	0	0
1	1	0	0
1	2	0	0
1	3	0	0
3	0	0	0
3	1	0	0
3	2	0	0
3	3	0	0
pk1	pk2	c1	c2
0	0	0	0
0	1	0	0
0	2	0	0
0	3	0	0
1	0	0	0
1	1	0	0
1	2	0	0
1	3	0	0
3	0	0	0
3	1	0	0
3	2	0	0
3	3	0	0
delete from t1;
delete from t2;
replace into t1(pk1,pk2,c1,c2) values(0,0,0,0),(0,1,0,0),(0,2,0,0),(0,3,0,0),(1,0,0,0),(1,1,0,0),(1,2,0,0),(1,3,0,0);
replace into t2(pk1,pk2,c1,c2) values(0,0,0,0),(0,1,0,0),(0,2,0,0),(0,3,0,0),(1,0,0,0),(1,1,0,0),(1,2,0,0),(1,3,0,0);
update t1 set c1=c1+1, c2=c2+1 where pk1=1 when row_count(update t1 set c1=c1+1, c2=c2+1 where pk1=0)=4;
select * from t1;
pk1	pk2	c1	c2
0	0	1	1
0	1	1	1
0	2	1	1
0	3	1	1
1	0	1	1
1	1	1	1
1	2	1	1
1	3	1	1
pk1	pk2	c1
0	0	1
0	1	1
0	2	1
0	3	1
1	0	1
1	1	1
1	2	1
1	3	1
update t1 set c1=c1+1, c2=c2+1 where pk1=0 when row_count(update t1 set c1=c1+1, c2=c2+1 where pk1=0)=4;
select * from t1;
pk1	pk2	c1	c2
0	0	3	3
0	1	3	3
0	2	3	3
0	3	3	3
1	0	1	1
1	1	1	1
1	2	1	1
1	3	1	1
pk1	pk2	c1
1	0	1
1	1	1
1	2	1
1	3	1
0	0	3
0	1	3
0	2	3
0	3	3
update t1 set c1=c1+1, c2=c2+1 where pk1=0 when row_count(update t1 set c1=c1+1, c2=c2+1 where pk1=0)=0;
ERROR 23000: Number 1 When filter failed, ret=-5064, func 1: ROW_COUNT()=4
update t1 set c1=c1+1, c2=c2+1 where pk1=1 when row_count(update t1 set c1=c1+1, c2=c2+1 where pk1=0)=0;
ERROR 23000: Number 1 When filter failed, ret=-5064, func 1: ROW_COUNT()=4
select * from t1;
pk1	pk2	c1	c2
0	0	3	3
0	1	3	3
0	2	3	3
0	3	3	3
1	0	1	1
1	1	1	1
1	2	1	1
1	3	1	1
pk1	pk2	c1
1	0	1
1	1	1
1	2	1
1	3	1
0	0	3
0	1	3
0	2	3
0	3	3
replace into t1(pk1,pk2,c1,c2) values(0,0,0,0),(0,1,0,0),(0,2,0,0),(0,3,0,0),(1,0,0,0),(1,1,0,0),(1,2,0,0),(1,3,0,0);
replace into t2(pk1,pk2,c1,c2) values(0,0,0,0),(0,1,0,0),(0,2,0,0),(0,3,0,0),(1,0,0,0),(1,1,0,0),(1,2,0,0),(1,3,0,0);
update t1 set c1=c1+1, c2=c2+1 where pk1=0 when row_count(delete from t1 where pk1=1)=1;
ERROR 23000: Number 1 When filter failed, ret=-5064, func 1: ROW_COUNT()=4
update t1 set c1=c1+1, c2=c2+1 where pk1=0 when row_count(delete from t2 where pk1=1)=1;
ERROR 23000: Number 1 When filter failed, ret=-5064, func 1: ROW_COUNT()=4
select * from t1;
pk1	pk2	c1	c2
0	0	0	0
0	1	0	0
0	2	0	0
0	3	0	0
1	0	0	0
1	1	0	0
1	2	0	0
1	3	0	0
pk1	pk2	c1
0	0	0
0	1	0
0	2	0
0	3	0
1	0	0
1	1	0
1	2	0
1	3	0
select * from t2;
pk1	pk2	c1	c2
0	0	0	0
0	1	0	0
0	2	0	0
0	3	0	0
1	0	0	0
1	1	0	0
1	2	0	0
1	3	0	0
pk1	pk2	c1	c2
0	0	0	0
0	1	0	0
0	2	0	0
0	3	0	0
1	0	0	0
1	1	0	0
1	2	0	0
1	3	0	0
update t1 set c1=c1+1, c2=c2+1 where pk1=0 when row_count(delete from t1 where pk1=1)=4;
select * from t1;
pk1	pk2	c1	c2
0	0	1	1
0	1	1	1
0	2	1	1
0	3	1	1
pk1	pk2	c1
0	0	1
0	1	1
0	2	1
0	3	1
update t1 set c1=c1+1, c2=c2+1 where pk1=0 when row_count(delete from t2 where pk1=1)=4;
select * from t1;
pk1	pk2	c1	c2
0	0	2	2
0	1	2	2
0	2	2	2
0	3	2	2
pk1	pk2	c1
0	0	2
0	1	2
0	2	2
0	3	2
select * from t2;
pk1	pk2	c1	c2
0	0	0	0
0	1	0	0
0	2	0	0
0	3	0	0
pk1	pk2	c1	c2
0	0	0	0
0	1	0	0
0	2	0	0
0	3	0	0
update t1 set c1=c1+1, c2=c2+1 where pk1=0 when row_count(delete from t1 where pk1=0)=4;
select * from t1;
pk1	pk2	c1	c2
pk1	pk2	c1
replace into t1(pk1,pk2,c1,c2) values(0,0,0,0),(0,1,0,0),(0,2,0,0),(0,3,0,0),(1,0,0,0),(1,1,0,0),(1,2,0,0),(1,3,0,0);
replace into t2(pk1,pk2,c1,c2) values(0,0,0,0),(0,1,0,0),(0,2,0,0),(0,3,0,0),(1,0,0,0),(1,1,0,0),(1,2,0,0),(1,3,0,0);
select * from t1 when row_count(delete from t1 where pk1=0)=0;
ERROR 23000: Number 1 When filter failed, ret=-5064, func 1: ROW_COUNT()=4
select * from t1;
pk1	pk2	c1	c2
0	0	0	0
0	1	0	0
0	2	0	0
0	3	0	0
1	0	0	0
1	1	0	0
1	2	0	0
1	3	0	0
pk1	pk2	c1
0	0	0
0	1	0
0	2	0
0	3	0
1	0	0
1	1	0
1	2	0
1	3	0
select * from t1 when row_count(delete from t1 where pk1=0)=4;
pk1	pk2	c1	c2
1	0	0	0
1	1	0	0
1	2	0	0
1	3	0	0
select * from t1;
pk1	pk2	c1	c2
1	0	0	0
1	1	0	0
1	2	0	0
1	3	0	0
pk1	pk2	c1
1	0	0
1	1	0
1	2	0
1	3	0
select c1,c2 from t1 where pk1=1 when row_count(delete from t1 where pk1=1)=4;
c1	c2
select * from t1;
pk1	pk2	c1	c2
pk1	pk2	c1
select pk1,pk2, c1, c2 from t2 when row_count(delete from t2 where pk1=0)=4;
pk1	pk2	c1	c2
1	0	0	0
1	1	0	0
1	2	0	0
1	3	0	0
select * from t2;
pk1	pk2	c1	c2
1	0	0	0
1	1	0	0
1	2	0	0
1	3	0	0
pk1	pk2	c1	c2
1	0	0	0
1	1	0	0
1	2	0	0
1	3	0	0
select * from t2 where pk1=1 when row_count(delete from t2 where pk1=1)=4;
pk1	pk2	c1	c2
select * from t2;
pk1	pk2	c1	c2
pk1	pk2	c1	c2
replace into t1(pk1,pk2,c1,c2) values(0,0,0,0),(0,1,0,0),(0,2,0,0),(0,3,0,0),(1,0,0,0),(1,1,0,0),(1,2,0,0),(1,3,0,0);
replace into t2(pk1,pk2,c1,c2) values(0,0,0,0),(0,1,0,0),(0,2,0,0),(0,3,0,0),(1,0,0,0),(1,1,0,0),(1,2,0,0),(1,3,0,0);
select * from t1 when row_count(delete from t1 where pk1=1 when row_count(delete from t1 where pk1=0)=1)=4;
ERROR 23000: Number 1 When filter failed, ret=-5064, func 1: ROW_COUNT()=4
select * from t2 when row_count(delete from t1 where pk1=1 when row_count(delete from t1 where pk1=0)=4)=1;
ERROR 23000: Number 2 When filter failed, ret=-5064, func 1: ROW_COUNT()=4
select * from t1;
pk1	pk2	c1	c2
0	0	0	0
0	1	0	0
0	2	0	0
0	3	0	0
1	0	0	0
1	1	0	0
1	2	0	0
1	3	0	0
pk1	pk2	c1
0	0	0
0	1	0
0	2	0
0	3	0
1	0	0
1	1	0
1	2	0
1	3	0
select pk1,pk2, c1, c2 from t2 when row_count(delete from t2 where pk1=0)=4;
pk1	pk2	c1	c2
1	0	0	0
1	1	0	0
1	2	0	0
1	3	0	0
select * from t2;
pk1	pk2	c1	c2
1	0	0	0
1	1	0	0
1	2	0	0
1	3	0	0
pk1	pk2	c1	c2
1	0	0	0
1	1	0	0
1	2	0	0
1	3	0	0
select * from t1 when row_count(delete from t1 where pk1=1 when row_count(delete from t1 where pk1=0)=4)=4;
pk1	pk2	c1	c2
select * from t1 when row_count(delete from t2 where pk1=1 when row_count(delete from t1 where pk1=1)=0)=4;
pk1	pk2	c1	c2
select * from t1;
pk1	pk2	c1	c2
pk1	pk2	c1
select pk1,pk2, c1, c2 from t2 when row_count(delete from t2 where pk1=1)=0;
pk1	pk2	c1	c2
select * from t2;
pk1	pk2	c1	c2
pk1	pk2	c1	c2
replace into t1(pk1,pk2,c1,c2) values(0,0,0,0),(0,1,0,0),(0,2,0,0),(0,3,0,0),(1,0,0,0),(1,1,0,0),(1,2,0,0),(1,3,0,0);
replace into t2(pk1,pk2,c1,c2) values(0,0,0,0),(0,1,0,0),(0,2,0,0),(0,3,0,0),(1,0,0,0),(1,1,0,0),(1,2,0,0),(1,3,0,0);
select c1, c2 from t1 where pk1=0 when row_count(delete from t1 where pk1=1 when row_count(delete from t2 where pk1=0)=4)=4;
c1	c2
0	0
0	0
0	0
0	0
select * from t1;
pk1	pk2	c1	c2
0	0	0	0
0	1	0	0
0	2	0	0
0	3	0	0
pk1	pk2	c1
0	0	0
0	1	0
0	2	0
0	3	0
select pk1,pk2, c1, c2 from t2 when row_count(delete from t2 where pk1=1)=4;
pk1	pk2	c1	c2
select c1, c2 from t1 where pk1=0 when row_count(delete from t2 where pk1=1 when row_count(delete from t2 where pk1=0)=4)=0;
ERROR 23000: Number 1 When filter failed, ret=-5064, func 1: ROW_COUNT()=0
select * from t2;
pk1	pk2	c1	c2
pk1	pk2	c1	c2
replace into t1(pk1,pk2,c1,c2) values(0,0,0,0),(0,1,0,0),(0,2,0,0),(0,3,0,0),(1,0,0,0),(1,1,0,0),(1,2,0,0),(1,3,0,0);
replace into t2(pk1,pk2,c1,c2) values(0,0,0,0),(0,1,0,0),(0,2,0,0),(0,3,0,0),(1,0,0,0),(1,1,0,0),(1,2,0,0),(1,3,0,0);
select c1,c2 from t1 when row_count(delete from t1 where pk1=0 when row_count(update t1 set c1=c1+1, c2=c2+1 where pk1=1)=4)=1;
ERROR 23000: Number 2 When filter failed, ret=-5064, func 1: ROW_COUNT()=4
select c1,c2 from t1 when row_count(delete from t1 where pk1=0 when row_count(update t1 set c1=c1+1, c2=c2+1 where pk1=1)=1)=4;
ERROR 23000: Number 1 When filter failed, ret=-5064, func 1: ROW_COUNT()=4
select c1,c2 from t1 when row_count(delete from t2 where pk1=0 when row_count(update t1 set c1=c1+1, c2=c2+1 where pk1=1)=4)=1;
ERROR 23000: Number 2 When filter failed, ret=-5064, func 1: ROW_COUNT()=4
select c1,c2 from t1 when row_count(delete from t2 where pk1=0 when row_count(update t1 set c1=c1+1, c2=c2+1 where pk1=1)=1)=4;
ERROR 23000: Number 1 When filter failed, ret=-5064, func 1: ROW_COUNT()=4
select * from t1;
pk1	pk2	c1	c2
0	0	0	0
0	1	0	0
0	2	0	0
0	3	0	0
1	0	0	0
1	1	0	0
1	2	0	0
1	3	0	0
pk1	pk2	c1
0	0	0
0	1	0
0	2	0
0	3	0
1	0	0
1	1	0
1	2	0
1	3	0
select * from t2;
pk1	pk2	c1	c2
0	0	0	0
0	1	0	0
0	2	0	0
0	3	0	0
1	0	0	0
1	1	0	0
1	2	0	0
1	3	0	0
pk1	pk2	c1	c2
0	0	0	0
0	1	0	0
0	2	0	0
0	3	0	0
1	0	0	0
1	1	0	0
1	2	0	0
1	3	0	0
select c1,c2 from t1 when row_count(delete from t1 where pk1=0 when row_count(update t1 set c1=c1+1, c2=c2+1 where pk1=1)=4)=4;
c1	c2
1	1
1	1
1	1
1	1
select * from t1;
pk1	pk2	c1	c2
1	0	1	1
1	1	1	1
1	2	1	1
1	3	1	1
pk1	pk2	c1
1	0	1
1	1	1
1	2	1
1	3	1
select pk1, pk2, c1,c2 from t1 when row_count(delete from t2 where pk1=0 when row_count(update t1 set c1=c1+1, c2=c2+1 where pk1=1)=4)=4;
pk1	pk2	c1	c2
1	0	2	2
1	1	2	2
1	2	2	2
1	3	2	2
select * from t1;
pk1	pk2	c1	c2
1	0	2	2
1	1	2	2
1	2	2	2
1	3	2	2
pk1	pk2	c1
1	0	2
1	1	2
1	2	2
1	3	2
select * from t2;
pk1	pk2	c1	c2
1	0	0	0
1	1	0	0
1	2	0	0
1	3	0	0
pk1	pk2	c1	c2
1	0	0	0
1	1	0	0
1	2	0	0
1	3	0	0
select pk1, pk2, c1,c2 from t2 when row_count(delete from t2 where pk1=1 when row_count(update t2 set c1=c1+1, c2=c2+1 where pk1=1)=4)=4;
pk1	pk2	c1	c2
select * from t1;
pk1	pk2	c1	c2
1	0	2	2
1	1	2	2
1	2	2	2
1	3	2	2
pk1	pk2	c1
1	0	2
1	1	2
1	2	2
1	3	2
select * from t2;
pk1	pk2	c1	c2
pk1	pk2	c1	c2
replace into t1(pk1,pk2,c1,c2) values(0,0,0,0),(0,1,0,0),(0,2,0,0),(0,3,0,0),(1,0,0,0),(1,1,0,0),(1,2,0,0),(1,3,0,0);
replace into t2(pk1,pk2,c1,c2) values(0,0,0,0),(0,1,0,0),(0,2,0,0),(0,3,0,0),(1,0,0,0),(1,1,0,0),(1,2,0,0),(1,3,0,0);
delete from t1 where pk1=2 when row_count(insert into t1(pk1,pk2,c1,c2) values(2,0,0,0),(2,1,0,0),(3,0,0,0))=0;
ERROR 23000: Number 1 When filter failed, ret=-5064, func 1: ROW_COUNT()=3
delete from t1 where pk1=2 when row_count(insert into t2(pk1,pk2,c1,c2) values(2,0,0,0),(2,1,0,0),(3,0,0,0))=0;
ERROR 23000: Number 1 When filter failed, ret=-5064, func 1: ROW_COUNT()=3
select * from t1;
pk1	pk2	c1	c2
0	0	0	0
0	1	0	0
0	2	0	0
0	3	0	0
1	0	0	0
1	1	0	0
1	2	0	0
1	3	0	0
pk1	pk2	c1
0	0	0
0	1	0
0	2	0
0	3	0
1	0	0
1	1	0
1	2	0
1	3	0
delete from t1 where pk1=2 when row_count(insert into t1(pk1,pk2,c1,c2) values(2,0,0,0),(2,1,0,0),(3,0,0,0))=3;
select * from t1;
pk1	pk2	c1	c2
0	0	0	0
0	1	0	0
0	2	0	0
0	3	0	0
1	0	0	0
1	1	0	0
1	2	0	0
1	3	0	0
2	0	0	0
2	1	0	0
3	0	0	0
pk1	pk2	c1
0	0	0
0	1	0
0	2	0
0	3	0
1	0	0
1	1	0
1	2	0
1	3	0
2	0	0
2	1	0
3	0	0
delete from t1 where pk1=2 when row_count(replace into t1(pk1,pk2,c1,c2) values(2,2,0,0),(2,3,0,0),(3,1,0,0))=3;
select * from t1;
pk1	pk2	c1	c2
0	0	0	0
0	1	0	0
0	2	0	0
0	3	0	0
1	0	0	0
1	1	0	0
1	2	0	0
1	3	0	0
2	2	0	0
2	3	0	0
3	0	0	0
3	1	0	0
pk1	pk2	c1
0	0	0
0	1	0
0	2	0
0	3	0
1	0	0
1	1	0
1	2	0
1	3	0
2	2	0
2	3	0
3	0	0
3	1	0
delete from t1 where pk1=0 when row_count(insert into t1(pk1,pk2,c1,c2) values(3,2,0,0))=0;
ERROR 23000: Number 1 When filter failed, ret=-5064, func 1: ROW_COUNT()=1
delete from t2 where pk1=0 when row_count(insert into t1(pk1,pk2,c1,c2) values(3,2,0,0))=0;
ERROR 23000: Number 1 When filter failed, ret=-5064, func 1: ROW_COUNT()=1
select * from t1;
pk1	pk2	c1	c2
0	0	0	0
0	1	0	0
0	2	0	0
0	3	0	0
1	0	0	0
1	1	0	0
1	2	0	0
1	3	0	0
2	2	0	0
2	3	0	0
3	0	0	0
3	1	0	0
pk1	pk2	c1
0	0	0
0	1	0
0	2	0
0	3	0
1	0	0
1	1	0
1	2	0
1	3	0
2	2	0
2	3	0
3	0	0
3	1	0
select * from t2;
pk1	pk2	c1	c2
0	0	0	0
0	1	0	0
0	2	0	0
0	3	0	0
1	0	0	0
1	1	0	0
1	2	0	0
1	3	0	0
pk1	pk2	c1	c2
0	0	0	0
0	1	0	0
0	2	0	0
0	3	0	0
1	0	0	0
1	1	0	0
1	2	0	0
1	3	0	0
delete from t1 where pk1=0 when row_count(insert into t1(pk1,pk2,c1,c2) values(3,2,0,0))=1;
select * from t1;
pk1	pk2	c1	c2
1	0	0	0
1	1	0	0
1	2	0	0
1	3	0	0
2	2	0	0
2	3	0	0
3	0	0	0
3	1	0	0
3	2	0	0
pk1	pk2	c1
1	0	0
1	1	0
1	2	0
1	3	0
2	2	0
2	3	0
3	0	0
3	1	0
3	2	0
delete from t1 where pk1=1 when row_count(replace into t1(pk1,pk2,c1,c2) values(3,3,0,0))=1;
select * from t1;
pk1	pk2	c1	c2
2	2	0	0
2	3	0	0
3	0	0	0
3	1	0	0
3	2	0	0
3	3	0	0
pk1	pk2	c1
2	2	0
2	3	0
3	0	0
3	1	0
3	2	0
3	3	0
delete from t2 where pk1=0 when row_count(insert into t1(pk1,pk2,c1,c2) values(4,0,0,0))=1;
select * from t1;
pk1	pk2	c1	c2
2	2	0	0
2	3	0	0
3	0	0	0
3	1	0	0
3	2	0	0
3	3	0	0
4	0	0	0
pk1	pk2	c1
2	2	0
2	3	0
3	0	0
3	1	0
3	2	0
3	3	0
4	0	0
select * from t2;
pk1	pk2	c1	c2
1	0	0	0
1	1	0	0
1	2	0	0
1	3	0	0
pk1	pk2	c1	c2
1	0	0	0
1	1	0	0
1	2	0	0
1	3	0	0
delete from t2 where pk1=1 when row_count(replace into t1(pk1,pk2,c1,c2) values(4,1,0,0))=1;
select * from t1;
pk1	pk2	c1	c2
2	2	0	0
2	3	0	0
3	0	0	0
3	1	0	0
3	2	0	0
3	3	0	0
4	0	0	0
4	1	0	0
pk1	pk2	c1
2	2	0
2	3	0
3	0	0
3	1	0
3	2	0
3	3	0
4	0	0
4	1	0
select * from t2;
pk1	pk2	c1	c2
pk1	pk2	c1	c2
delete from t1;
delete from t2;
replace into t1(pk1,pk2,c1,c2) values(0,0,0,0),(0,1,0,0),(0,2,0,0),(0,3,0,0),(1,0,0,0),(1,1,0,0),(1,2,0,0),(1,3,0,0);
replace into t2(pk1,pk2,c1,c2) values(0,0,0,0),(0,1,0,0),(0,2,0,0),(0,3,0,0),(1,0,0,0),(1,1,0,0),(1,2,0,0),(1,3,0,0);
delete from t1 where pk1=1 when row_count(delete from t1 where pk1=0)=1;
ERROR 23000: Number 1 When filter failed, ret=-5064, func 1: ROW_COUNT()=4
delete from t2 where pk1=1 when row_count(delete from t1 where pk1=0)=1;
ERROR 23000: Number 1 When filter failed, ret=-5064, func 1: ROW_COUNT()=4
select * from t1;
pk1	pk2	c1	c2
0	0	0	0
0	1	0	0
0	2	0	0
0	3	0	0
1	0	0	0
1	1	0	0
1	2	0	0
1	3	0	0
pk1	pk2	c1
0	0	0
0	1	0
0	2	0
0	3	0
1	0	0
1	1	0
1	2	0
1	3	0
select * from t2;
pk1	pk2	c1	c2
0	0	0	0
0	1	0	0
0	2	0	0
0	3	0	0
1	0	0	0
1	1	0	0
1	2	0	0
1	3	0	0
pk1	pk2	c1	c2
0	0	0	0
0	1	0	0
0	2	0	0
0	3	0	0
1	0	0	0
1	1	0	0
1	2	0	0
1	3	0	0
delete from t1 where pk1=0 when row_count(delete from t1 where pk1=0)=4;
select * from t1;
pk1	pk2	c1	c2
1	0	0	0
1	1	0	0
1	2	0	0
1	3	0	0
pk1	pk2	c1
1	0	0
1	1	0
1	2	0
1	3	0
delete from t1 where pk1=1 when row_count(delete from t1 where pk1=0)=0;
select * from t1;
pk1	pk2	c1	c2
pk1	pk2	c1
delete from t2 where pk1=1 when row_count(delete from t2 where pk1=0)=4;
select * from t1;
pk1	pk2	c1	c2
pk1	pk2	c1
select * from t2;
pk1	pk2	c1	c2
pk1	pk2	c1	c2
replace into t2(pk1,pk2,c1,c2) values(0,0,0,0),(0,1,0,0),(0,2,0,0),(0,3,0,0),(1,0,0,0),(1,1,0,0),(1,2,0,0),(1,3,0,0);
delete from t2 where pk1=1 when row_count(delete from t1 where pk1=0)=0;
select * from t1;
pk1	pk2	c1	c2
pk1	pk2	c1
select * from t2;
pk1	pk2	c1	c2
0	0	0	0
0	1	0	0
0	2	0	0
0	3	0	0
pk1	pk2	c1	c2
0	0	0	0
0	1	0	0
0	2	0	0
0	3	0	0
replace into t1(pk1,pk2,c1,c2) values(0,0,0,0),(0,1,0,0),(0,2,0,0),(0,3,0,0),(1,0,0,0),(1,1,0,0),(1,2,0,0),(1,3,0,0);
replace into t2(pk1,pk2,c1,c2) values(0,0,0,0),(0,1,0,0),(0,2,0,0),(0,3,0,0),(1,0,0,0),(1,1,0,0),(1,2,0,0),(1,3,0,0);
delete from t1 where pk1=1 when row_count(update t1 set c1=c1+1, c2=c2+1 where pk1=0)=3;
ERROR 23000: Number 1 When filter failed, ret=-5064, func 1: ROW_COUNT()=4
delete from t2 where pk1=1 when row_count(update t1 set c1=c1+1, c2=c2+1 where pk1=0)=3;
ERROR 23000: Number 1 When filter failed, ret=-5064, func 1: ROW_COUNT()=4
select * from t1;
pk1	pk2	c1	c2
0	0	0	0
0	1	0	0
0	2	0	0
0	3	0	0
1	0	0	0
1	1	0	0
1	2	0	0
1	3	0	0
pk1	pk2	c1
0	0	0
0	1	0
0	2	0
0	3	0
1	0	0
1	1	0
1	2	0
1	3	0
select * from t2;
pk1	pk2	c1	c2
0	0	0	0
0	1	0	0
0	2	0	0
0	3	0	0
1	0	0	0
1	1	0	0
1	2	0	0
1	3	0	0
pk1	pk2	c1	c2
0	0	0	0
0	1	0	0
0	2	0	0
0	3	0	0
1	0	0	0
1	1	0	0
1	2	0	0
1	3	0	0
delete from t1 where pk1=1 when row_count(update t1 set c1=c1+1, c2=c2+1 where pk1=0)=4;
select * from t1;
pk1	pk2	c1	c2
0	0	1	1
0	1	1	1
0	2	1	1
0	3	1	1
pk1	pk2	c1
0	0	1
0	1	1
0	2	1
0	3	1
delete from t2 where pk1=1 when row_count(update t1 set c1=c1+1, c2=c2+1 where pk1=0)=4;
select * from t1;
pk1	pk2	c1	c2
0	0	2	2
0	1	2	2
0	2	2	2
0	3	2	2
pk1	pk2	c1
0	0	2
0	1	2
0	2	2
0	3	2
select * from t2;
pk1	pk2	c1	c2
0	0	0	0
0	1	0	0
0	2	0	0
0	3	0	0
pk1	pk2	c1	c2
0	0	0	0
0	1	0	0
0	2	0	0
0	3	0	0
drop table t1,t2;
