SET sql_mode='STRICT_TRANS_TABLES,STRICT_ALL_TABLES';
SELECT @@sql_mode;
@@sql_mode
STRICT_TRANS_TABLES,STRICT_ALL_TABLES

DROP TABLE IF EXISTS Z0CASE;
DROP TABLE IF EXISTS Z1CASE;
CHAR FOREIGN KEY
CREATE TABLE Z1CASE(  Z1_TEST0 CHAR(100) PRIMARY KEY ) ;
CREATE TABLE Z0CASE(  Z0_TEST0 CHAR(100) PRIMARY KEY , FOREIGN KEY (Z0_TEST0) REFERENCES Z1CASE(Z1_TEST0)) ;
INSERT INTO  Z1CASE (Z1_TEST0)VALUES('1111.1111');
INSERT INTO  Z1CASE (Z1_TEST0)VALUES(2011);
INSERT INTO  Z1CASE (Z1_TEST0)VALUES(20111111);
INSERT INTO  Z1CASE (Z1_TEST0)VALUES('ABC');
INSERT INTO  Z0CASE (Z0_TEST0)VALUES('1111.1111');
INSERT INTO  Z0CASE (Z0_TEST0)VALUES(2011);
INSERT INTO  Z0CASE (Z0_TEST0)VALUES(20111111);
INSERT INTO  Z0CASE (Z0_TEST0)VALUES('ABC');
SELECT * FROM Z1CASE ORDER BY Z1_TEST0*1;
Z1_TEST0
ABC
1111.1111
2011
20111111
Warnings:
Warning	1292	Truncated incorrect DOUBLE value: 'ABC'
SELECT * FROM Z0CASE ORDER BY Z0_TEST0*1;
Z0_TEST0
ABC
1111.1111
2011
20111111
Warnings:
Warning	1292	Truncated incorrect DOUBLE value: 'ABC'
ALTER TABLE Z0CASE MODIFY COLUMN z0_test0  CHAR(100);
SELECT * FROM Z0CASE ORDER BY Z0_TEST0*1;
z0_test0
ABC
1111.1111
2011
20111111
Warnings:
Warning	1292	Truncated incorrect DOUBLE value: 'ABC'
DESC Z0CASE;
Field	Type	Null	Key	Default	Extra
z0_test0	char(100)	NO	PRI	NULL	
ALTER TABLE Z0CASE MODIFY COLUMN z0_test0  CHAR(99);
ERROR 0A000: Alter the precision of foreign key columns,column type CHAR not supported
ALTER TABLE Z0CASE MODIFY COLUMN z0_test0  CHAR(101);
ERROR 0A000: Alter the precision of foreign key columns,column type CHAR not supported
ALTER TABLE Z1CASE MODIFY COLUMN Z1_TEST0  CHAR(100);
SELECT * FROM Z0CASE ORDER BY Z0_TEST0*1;
z0_test0
ABC
1111.1111
2011
20111111
Warnings:
Warning	1292	Truncated incorrect DOUBLE value: 'ABC'
DESC Z0CASE;
Field	Type	Null	Key	Default	Extra
z0_test0	char(100)	NO	PRI	NULL	
ALTER TABLE Z1CASE MODIFY COLUMN Z1_TEST0  CHAR(99);
ERROR 0A000: Alter the precision of foreign key columns,column type CHAR not supported
ALTER TABLE Z1CASE MODIFY COLUMN Z1_TEST0  CHAR(101);
ERROR 0A000: Alter the precision of foreign key columns,column type CHAR not supported
ALTER TABLE Z0CASE MODIFY COLUMN z0_test0  VARCHAR(100);
ERROR HY000: 'z0_test0': used in a foreign key constraint
ALTER TABLE Z0CASE MODIFY COLUMN z0_test0  VARCHAR(99);
ERROR HY000: 'z0_test0': used in a foreign key constraint
ALTER TABLE Z0CASE MODIFY COLUMN z0_test0  VARCHAR(101);
ERROR HY000: 'z0_test0': used in a foreign key constraint
ALTER TABLE Z1CASE MODIFY COLUMN Z1_TEST0  VARCHAR(100);
ERROR HY000: 'Z1_TEST0': used in a foreign key constraint
ALTER TABLE Z1CASE MODIFY COLUMN Z1_TEST0  VARCHAR(101);
ERROR HY000: 'Z1_TEST0': used in a foreign key constraint
ALTER TABLE Z1CASE MODIFY COLUMN Z1_TEST0  BLOB;
ERROR HY000: 'Z1_TEST0': used in a foreign key constraint
ALTER TABLE Z0CASE MODIFY COLUMN Z0_TEST0  BLOB;
ERROR HY000: 'Z0_TEST0': used in a foreign key constraint
ALTER TABLE Z1CASE MODIFY COLUMN Z1_TEST0 TEXT;
ERROR HY000: 'Z1_TEST0': used in a foreign key constraint
ALTER TABLE Z1CASE MODIFY COLUMN Z1_TEST0 ENUM('1111.1111','2011','20111111','ABC');
ERROR HY000: 'Z1_TEST0': used in a foreign key constraint
ALTER TABLE Z1CASE MODIFY COLUMN Z1_TEST0  INT;
ERROR HY000: 'Z1_TEST0': used in a foreign key constraint
ALTER TABLE Z1CASE MODIFY COLUMN Z1_TEST0  DATE;
ERROR HY000: 'Z1_TEST0': used in a foreign key constraint
ALTER TABLE Z1CASE MODIFY COLUMN Z1_TEST0  TIMESTAMP;
ERROR HY000: 'Z1_TEST0': used in a foreign key constraint
ALTER TABLE Z0CASE MODIFY COLUMN Z0_TEST0 TEXT;
ERROR HY000: 'Z0_TEST0': used in a foreign key constraint
ALTER TABLE Z0CASE MODIFY COLUMN Z0_TEST0 ENUM('1111.1111','2011','20111111','ABC');
ERROR HY000: 'Z0_TEST0': used in a foreign key constraint
ALTER TABLE Z0CASE MODIFY COLUMN Z0_TEST0  INT;
ERROR HY000: 'Z0_TEST0': used in a foreign key constraint
ALTER TABLE Z0CASE MODIFY COLUMN Z0_TEST0  DATE;
ERROR HY000: 'Z0_TEST0': used in a foreign key constraint
ALTER TABLE Z0CASE MODIFY COLUMN Z0_TEST0  TIMESTAMP;
ERROR HY000: 'Z0_TEST0': used in a foreign key constraint
VARCHAR FOREIGN KEY
DROP TABLE Z0CASE;
DROP TABLE Z1CASE;
CREATE TABLE Z1CASE(  Z1_TEST0 VARCHAR(100) PRIMARY KEY ) ;
CREATE TABLE Z0CASE(  Z0_TEST0 VARCHAR(100) PRIMARY KEY , FOREIGN KEY (Z0_TEST0) REFERENCES Z1CASE(Z1_TEST0)) ;
INSERT INTO  Z1CASE (Z1_TEST0)VALUES('1111.1111');
INSERT INTO  Z1CASE (Z1_TEST0)VALUES(2011);
INSERT INTO  Z1CASE (Z1_TEST0)VALUES(20111111);
INSERT INTO  Z1CASE (Z1_TEST0)VALUES('ABC');
INSERT INTO  Z0CASE (Z0_TEST0)VALUES('1111.1111');
INSERT INTO  Z0CASE (Z0_TEST0)VALUES(2011);
INSERT INTO  Z0CASE (Z0_TEST0)VALUES(20111111);
INSERT INTO  Z0CASE (Z0_TEST0)VALUES('ABC');
SELECT * FROM Z1CASE ORDER BY Z1_TEST0*1;
Z1_TEST0
ABC
1111.1111
2011
20111111
Warnings:
Warning	1292	Truncated incorrect DOUBLE value: 'ABC'
SELECT * FROM Z0CASE ORDER BY Z0_TEST0*1;
Z0_TEST0
ABC
1111.1111
2011
20111111
Warnings:
Warning	1292	Truncated incorrect DOUBLE value: 'ABC'
ALTER TABLE Z0CASE MODIFY COLUMN z0_test0  CHAR(100);
ERROR HY000: 'z0_test0': used in a foreign key constraint
ALTER TABLE Z0CASE MODIFY COLUMN z0_test0  CHAR(99);
ERROR HY000: 'z0_test0': used in a foreign key constraint
ALTER TABLE Z0CASE MODIFY COLUMN z0_test0  CHAR(101);
ERROR HY000: 'z0_test0': used in a foreign key constraint
ALTER TABLE Z0CASE MODIFY COLUMN z0_test0  VARCHAR(100);
SELECT * FROM Z0CASE ORDER BY Z0_TEST0*1;
z0_test0
ABC
1111.1111
2011
20111111
Warnings:
Warning	1292	Truncated incorrect DOUBLE value: 'ABC'
DESC Z0CASE;
Field	Type	Null	Key	Default	Extra
z0_test0	varchar(100)	NO	PRI	NULL	
ALTER TABLE Z0CASE MODIFY COLUMN z0_test0 VARCHAR(99);
ERROR 0A000: Alter the precision of foreign key columns,column type VARCHAR not supported
ALTER TABLE Z0CASE MODIFY COLUMN z0_test0 VARCHAR(101);
SELECT * FROM Z0CASE ORDER BY Z0_TEST0*1;
z0_test0
ABC
1111.1111
2011
20111111
Warnings:
Warning	1292	Truncated incorrect DOUBLE value: 'ABC'
DESC Z0CASE;
Field	Type	Null	Key	Default	Extra
z0_test0	varchar(101)	NO	PRI	NULL	
ALTER TABLE Z0CASE MODIFY COLUMN z0_test0 BLOB;
ERROR HY000: 'z0_test0': used in a foreign key constraint
ALTER TABLE Z0CASE MODIFY COLUMN z0_test0 TEXT;
ERROR HY000: 'z0_test0': used in a foreign key constraint
ALTER TABLE Z0CASE MODIFY COLUMN z0_test0 ENUM('1111.1111','2011','20111111','ABC');
ERROR HY000: 'z0_test0': used in a foreign key constraint
ALTER TABLE Z0CASE MODIFY COLUMN z0_test0 INT;
ERROR HY000: 'z0_test0': used in a foreign key constraint
ALTER TABLE Z0CASE MODIFY COLUMN z0_test0 DATE;
ERROR HY000: 'z0_test0': used in a foreign key constraint
ALTER TABLE Z0CASE MODIFY COLUMN z0_test0 TIMESTAMP;
ERROR HY000: 'z0_test0': used in a foreign key constraint
ENUM FOREIGN KEY
DROP TABLE Z0CASE;
DROP TABLE Z1CASE;
CREATE TABLE Z1CASE(  Z1_TEST0  ENUM('1111.1111','2011','20111111','ABC') PRIMARY KEY ) ;
CREATE TABLE Z0CASE(  Z0_TEST0  ENUM('1111.1111','2011','20111111','ABC') PRIMARY KEY , FOREIGN KEY (Z0_TEST0) REFERENCES Z1CASE(Z1_TEST0)) ;
ALTER TABLE Z0CASE MODIFY COLUMN z0_test0 CHAR(100);
ERROR HY000: 'z0_test0': used in a foreign key constraint
ALTER TABLE Z1CASE MODIFY COLUMN Z1_TEST0 CHAR(100);
ERROR HY000: 'Z1_TEST0': used in a foreign key constraint
ALTER TABLE Z0CASE MODIFY COLUMN z0_test0 VARCHAR(100);
ERROR HY000: 'z0_test0': used in a foreign key constraint
ALTER TABLE Z1CASE MODIFY COLUMN Z1_TEST0 VARCHAR(100);
ERROR HY000: 'Z1_TEST0': used in a foreign key constraint
ALTER TABLE Z0CASE MODIFY COLUMN z0_test0 BLOB;
ERROR HY000: 'z0_test0': used in a foreign key constraint
ALTER TABLE Z0CASE MODIFY COLUMN z0_test0 TEXT;
ERROR HY000: 'z0_test0': used in a foreign key constraint
ALTER TABLE Z0CASE MODIFY COLUMN z0_test0 INT;
ERROR HY000: 'z0_test0': used in a foreign key constraint
ALTER TABLE Z0CASE MODIFY COLUMN z0_test0 DATE;
ERROR HY000: 'z0_test0': used in a foreign key constraint
ALTER TABLE Z0CASE MODIFY COLUMN z0_test0 TIMESTAMP;
ERROR HY000: 'z0_test0': used in a foreign key constraint
ENUM FOREIGN KEY
DROP TABLE Z0CASE;
DROP TABLE Z1CASE;
CREATE TABLE Z1CASE(  Z1_TEST0  INT PRIMARY KEY ) ;
CREATE TABLE Z0CASE(  Z0_TEST0  INT PRIMARY KEY , FOREIGN KEY (Z0_TEST0) REFERENCES Z1CASE(Z1_TEST0)) ;
ALTER TABLE Z0CASE MODIFY COLUMN z0_test0 INT;
DESC Z0CASE;
Field	Type	Null	Key	Default	Extra
z0_test0	int(11)	NO	PRI	NULL	
ALTER TABLE Z0CASE MODIFY COLUMN z0_test0 tinyINT;
ERROR HY000: 'z0_test0': used in a foreign key constraint
ALTER TABLE Z0CASE MODIFY COLUMN z0_test0 smallINT;
ERROR HY000: 'z0_test0': used in a foreign key constraint
ALTER TABLE Z0CASE MODIFY COLUMN z0_test0 bigINT;
ERROR HY000: 'z0_test0': used in a foreign key constraint
ALTER TABLE Z0CASE MODIFY COLUMN z0_test0 float(38);
ERROR HY000: 'z0_test0': used in a foreign key constraint
ALTER TABLE Z0CASE MODIFY COLUMN z0_test0 DECIMAL(38);
ERROR HY000: 'z0_test0': used in a foreign key constraint
ALTER TABLE Z0CASE MODIFY COLUMN z0_test0 CHAR(100);
ERROR HY000: 'z0_test0': used in a foreign key constraint
ALTER TABLE Z0CASE MODIFY COLUMN z0_test0 VARCHAR(100);
ERROR HY000: 'z0_test0': used in a foreign key constraint
ALTER TABLE Z0CASE MODIFY COLUMN z0_test0 BLOB;
ERROR HY000: 'z0_test0': used in a foreign key constraint
ALTER TABLE Z0CASE MODIFY COLUMN z0_test0 TEXT;
ERROR HY000: 'z0_test0': used in a foreign key constraint
ALTER TABLE Z0CASE MODIFY COLUMN z0_test0 ENUM('1111.1111','2011','20111111','ABC');
ERROR HY000: 'z0_test0': used in a foreign key constraint
ALTER TABLE Z0CASE MODIFY COLUMN z0_test0  DATE;
ERROR HY000: 'z0_test0': used in a foreign key constraint
ALTER TABLE Z0CASE MODIFY COLUMN z0_test0  TIMESTAMP;
ERROR HY000: 'z0_test0': used in a foreign key constraint
DATE FOREIGN KEY
DROP TABLE Z0CASE;
DROP TABLE Z1CASE;
CREATE TABLE Z1CASE(  Z1_TEST0  DATE PRIMARY KEY ) ;
CREATE TABLE Z0CASE(  Z0_TEST0  DATE PRIMARY KEY , FOREIGN KEY (Z0_TEST0) REFERENCES Z1CASE(Z1_TEST0)) ;
ALTER TABLE Z0CASE MODIFY COLUMN z0_test0 DATE;
DESC Z0CASE;
Field	Type	Null	Key	Default	Extra
z0_test0	date	NO	PRI	NULL	
ALTER TABLE Z0CASE MODIFY COLUMN z0_test0 TIMESTAMP;
ERROR HY000: 'z0_test0': used in a foreign key constraint
ALTER TABLE Z0CASE MODIFY COLUMN z0_test0 INT;
ERROR HY000: 'z0_test0': used in a foreign key constraint
ALTER TABLE Z0CASE MODIFY COLUMN z0_test0 float(38);
ERROR HY000: 'z0_test0': used in a foreign key constraint
ALTER TABLE Z0CASE MODIFY COLUMN z0_test0 DECIMAL(38);
ERROR HY000: 'z0_test0': used in a foreign key constraint
ALTER TABLE Z0CASE MODIFY COLUMN z0_test0 CHAR(100);
ERROR HY000: 'z0_test0': used in a foreign key constraint
ALTER TABLE Z0CASE MODIFY COLUMN z0_test0 VARCHAR(100);
ERROR HY000: 'z0_test0': used in a foreign key constraint
ALTER TABLE Z0CASE MODIFY COLUMN z0_test0 BLOB;
ERROR HY000: 'z0_test0': used in a foreign key constraint
ALTER TABLE Z0CASE MODIFY COLUMN z0_test0 TEXT;
ERROR HY000: 'z0_test0': used in a foreign key constraint
ALTER TABLE Z0CASE MODIFY COLUMN z0_test0 ENUM('1111.1111','2011','20111111','ABC');
ERROR HY000: 'z0_test0': used in a foreign key constraint
TIMESTAMP FOREIGN KEY
DROP TABLE Z0CASE;
DROP TABLE Z1CASE;
CREATE TABLE Z1CASE(  Z1_TEST0  TIMESTAMP PRIMARY KEY ) ;
CREATE TABLE Z0CASE(  Z0_TEST0  TIMESTAMP PRIMARY KEY , FOREIGN KEY (Z0_TEST0) REFERENCES Z1CASE(Z1_TEST0)) ;
ALTER TABLE Z0CASE MODIFY COLUMN z0_test0 TIMESTAMP;
DESC Z0CASE;
Field	Type	Null	Key	Default	Extra
z0_test0	timestamp	NO	PRI	NULL	
ALTER TABLE Z0CASE MODIFY COLUMN z0_test0 DATE;
ERROR HY000: 'z0_test0': used in a foreign key constraint
ALTER TABLE Z0CASE MODIFY COLUMN z0_test0 INT;
ERROR HY000: 'z0_test0': used in a foreign key constraint
ALTER TABLE Z0CASE MODIFY COLUMN z0_test0 float(38);
ERROR HY000: 'z0_test0': used in a foreign key constraint
ALTER TABLE Z0CASE MODIFY COLUMN z0_test0 DECIMAL(38);
ERROR HY000: 'z0_test0': used in a foreign key constraint
ALTER TABLE Z0CASE MODIFY COLUMN z0_test0 CHAR(100);
ERROR HY000: 'z0_test0': used in a foreign key constraint
ALTER TABLE Z0CASE MODIFY COLUMN z0_test0 VARCHAR(100);
ERROR HY000: 'z0_test0': used in a foreign key constraint
ALTER TABLE Z0CASE MODIFY COLUMN z0_test0 BLOB;
ERROR HY000: 'z0_test0': used in a foreign key constraint
ALTER TABLE Z0CASE MODIFY COLUMN z0_test0 TEXT;
ERROR HY000: 'z0_test0': used in a foreign key constraint
ALTER TABLE Z0CASE MODIFY COLUMN z0_test0 ENUM('1111.1111','2011','20111111','ABC');
ERROR HY000: 'z0_test0': used in a foreign key constraint
float FOREIGN KEY
DROP TABLE Z0CASE;
DROP TABLE Z1CASE;
CREATE TABLE Z1CASE(  Z1_TEST0  float PRIMARY KEY ) ;
CREATE TABLE Z0CASE(  Z0_TEST0  float PRIMARY KEY , FOREIGN KEY (Z0_TEST0) REFERENCES Z1CASE(Z1_TEST0)) ;
ALTER TABLE Z0CASE MODIFY COLUMN z0_test0 float(38);
ERROR HY000: 'z0_test0': used in a foreign key constraint
ALTER TABLE Z0CASE MODIFY COLUMN z0_test0 INT;
ERROR HY000: 'z0_test0': used in a foreign key constraint
ALTER TABLE Z0CASE MODIFY COLUMN z0_test0 DECIMAL(38,0);
ERROR HY000: 'z0_test0': used in a foreign key constraint
ALTER TABLE Z0CASE MODIFY COLUMN z0_test0 CHAR(100);
ERROR HY000: 'z0_test0': used in a foreign key constraint
ALTER TABLE Z0CASE MODIFY COLUMN z0_test0 VARCHAR(100);
ERROR HY000: 'z0_test0': used in a foreign key constraint
ALTER TABLE Z0CASE MODIFY COLUMN z0_test0 BLOB;
ERROR HY000: 'z0_test0': used in a foreign key constraint
ALTER TABLE Z0CASE MODIFY COLUMN z0_test0 TEXT;
ERROR HY000: 'z0_test0': used in a foreign key constraint
ALTER TABLE Z0CASE MODIFY COLUMN z0_test0 ENUM('1111.1111','2011','20111111','ABC');
ERROR HY000: 'z0_test0': used in a foreign key constraint
ALTER TABLE Z0CASE MODIFY COLUMN z0_test0 TIMESTAMP;
ERROR HY000: 'z0_test0': used in a foreign key constraint
ALTER TABLE Z0CASE MODIFY COLUMN z0_test0 DATE;
ERROR HY000: 'z0_test0': used in a foreign key constraint
DROP TABLE Z0CASE;
DROP TABLE Z1CASE;
CREATE TABLE Z1CASE(Z1_TEST0 double PRIMARY KEY ) ;
CREATE TABLE Z0CASE(Z0_TEST0 float(30) PRIMARY KEY , FOREIGN KEY (Z0_TEST0) REFERENCES Z1CASE(Z1_TEST0)) ;
INSERT INTO  Z1CASE (Z1_TEST0)VALUES('1111.1111');
INSERT INTO  Z1CASE (Z1_TEST0)VALUES(2011);
INSERT INTO  Z1CASE (Z1_TEST0)VALUES(20111111);
INSERT INTO  Z0CASE (Z0_TEST0)VALUES(2011);
SELECT * FROM Z1CASE ORDER BY Z1_TEST0;
Z1_TEST0
1111.1111
2011
20111111
SELECT * FROM Z0CASE;
Z0_TEST0
2011
ALTER TABLE Z0CASE MODIFY COLUMN z0_test0 float(30);
SELECT Z0_TEST0 FROM Z0CASE;
Z0_TEST0
2011
DESC Z0CASE;
Field	Type	Null	Key	Default	Extra
z0_test0	double	NO	PRI	NULL	
ALTER TABLE Z0CASE MODIFY COLUMN z0_test0 float(22);
ERROR HY000: 'z0_test0': used in a foreign key constraint
ALTER TABLE Z0CASE MODIFY COLUMN z0_test0 float(30);
SELECT Z0_TEST0 FROM Z0CASE;
Z0_TEST0
2011
DESC Z0CASE;
Field	Type	Null	Key	Default	Extra
z0_test0	double	NO	PRI	NULL	
ALTER TABLE Z0CASE MODIFY COLUMN z0_test0 float(28);
SELECT Z0_TEST0 FROM Z0CASE;
Z0_TEST0
2011
DESC Z0CASE;
Field	Type	Null	Key	Default	Extra
z0_test0	double	NO	PRI	NULL	
ALTER TABLE Z0CASE MODIFY COLUMN z0_test0 float(20);
ERROR HY000: 'z0_test0': used in a foreign key constraint
double FOREIGN KEY
DROP TABLE Z0CASE;
DROP TABLE Z1CASE;
CREATE TABLE Z1CASE(Z1_TEST0 double PRIMARY KEY) ;
CREATE TABLE Z0CASE(Z0_TEST0 double PRIMARY KEY, FOREIGN KEY (Z0_TEST0) REFERENCES Z1CASE(Z1_TEST0)) ;
ALTER TABLE Z0CASE MODIFY COLUMN z0_test0 double;
DESC Z0CASE;
Field	Type	Null	Key	Default	Extra
z0_test0	double	NO	PRI	NULL	
ALTER TABLE Z0CASE MODIFY COLUMN z0_test0 double;
ALTER TABLE Z0CASE MODIFY COLUMN z0_test0 float(25);
ERROR 0A000: Alter the type of foreign key columns not supported
ALTER TABLE Z0CASE MODIFY COLUMN z0_test0 float(24);
ERROR HY000: 'z0_test0': used in a foreign key constraint
ALTER TABLE Z0CASE MODIFY COLUMN z0_test0 DECIMAL(38,0);
ERROR HY000: 'z0_test0': used in a foreign key constraint
ALTER TABLE Z0CASE MODIFY COLUMN z0_test0 CHAR(100);
ERROR HY000: 'z0_test0': used in a foreign key constraint
ALTER TABLE Z0CASE MODIFY COLUMN z0_test0 VARCHAR(100);
ERROR HY000: 'z0_test0': used in a foreign key constraint
ALTER TABLE Z0CASE MODIFY COLUMN z0_test0 BLOB;
ERROR HY000: 'z0_test0': used in a foreign key constraint
ALTER TABLE Z0CASE MODIFY COLUMN z0_test0 TEXT;
ERROR HY000: 'z0_test0': used in a foreign key constraint
ALTER TABLE Z0CASE MODIFY COLUMN z0_test0 ENUM('1111.1111','2011','20111111','ABC');
ERROR HY000: 'z0_test0': used in a foreign key constraint
ALTER TABLE Z0CASE MODIFY COLUMN z0_test0 TIMESTAMP;
ERROR HY000: 'z0_test0': used in a foreign key constraint
ALTER TABLE Z0CASE MODIFY COLUMN z0_test0 DATE;
ERROR HY000: 'z0_test0': used in a foreign key constraint
唯一索引 + 外键
DROP TABLE Z0CASE;
DROP TABLE Z1CASE;
CREATE TABLE Z1CASE(  Z1_TEST0 CHAR(100) , Z1_TEST1 VARCHAR(100)) ;
CREATE UNIQUE  INDEX Z1CASE_index ON Z1CASE (Z1_TEST0) STORING(Z1_TEST1) with column group(all columns, each column);
CREATE TABLE Z0CASE(  Z0_TEST0 CHAR(100) , Z0_TEST1 VARCHAR(100), FOREIGN KEY (Z0_TEST0) REFERENCES Z1CASE(Z1_TEST0)) ;
INSERT INTO  Z1CASE (Z1_TEST0,Z1_TEST1)VALUES('1111.1111','1111.1111');
INSERT INTO  Z1CASE (Z1_TEST0,Z1_TEST1)VALUES(2011,2011);
INSERT INTO  Z1CASE (Z1_TEST0,Z1_TEST1)VALUES(20111111,20111111);
INSERT INTO  Z1CASE (Z1_TEST0,Z1_TEST1)VALUES('ABC','ABC');
INSERT INTO  Z1CASE (Z1_TEST0,Z1_TEST1)VALUES('ABC123','ABC123');
INSERT INTO  Z1CASE (Z1_TEST0,Z1_TEST1)VALUES(null,NULL);
INSERT INTO  Z0CASE (Z0_TEST0,Z0_TEST1)VALUES('1111.1111','1111.1111');
INSERT INTO  Z0CASE (Z0_TEST0,Z0_TEST1)VALUES(2011,2011);
INSERT INTO  Z0CASE (Z0_TEST0,Z0_TEST1)VALUES(20111111,20111111);
INSERT INTO  Z0CASE (Z0_TEST0,Z0_TEST1)VALUES('ABC','ABC');
INSERT INTO  Z0CASE (Z0_TEST0,Z0_TEST1)VALUES('ABC123','ABC123');
SELECT * FROM Z1CASE ORDER BY Z1_TEST0;
Z1_TEST0	Z1_TEST1
NULL	NULL
1111.1111	1111.1111
2011	2011
20111111	20111111
ABC	ABC
ABC123	ABC123
SELECT * FROM Z0CASE ORDER BY Z0_TEST0;
Z0_TEST0	Z0_TEST1
1111.1111	1111.1111
2011	2011
20111111	20111111
ABC	ABC
ABC123	ABC123
ALTER TABLE Z1CASE MODIFY COLUMN Z1_TEST0  CHAR(100);
SELECT * FROM Z1CASE ORDER BY Z1_TEST0;
Z1_TEST0	Z1_TEST1
NULL	NULL
1111.1111	1111.1111
2011	2011
20111111	20111111
ABC	ABC
ABC123	ABC123
DESC Z1CASE;
Field	Type	Null	Key	Default	Extra
Z1_TEST0	char(100)	YES	UNI	NULL	
Z1_TEST1	varchar(100)	YES		NULL	
ALTER TABLE Z0CASE MODIFY COLUMN Z0_TEST0  CHAR(100);
SELECT * FROM Z0CASE ORDER BY Z0_TEST0;
Z0_TEST0	Z0_TEST1
1111.1111	1111.1111
2011	2011
20111111	20111111
ABC	ABC
ABC123	ABC123
DESC Z1CASE;
Field	Type	Null	Key	Default	Extra
Z1_TEST0	char(100)	YES	UNI	NULL	
Z1_TEST1	varchar(100)	YES		NULL	
ALTER TABLE Z1CASE MODIFY COLUMN Z1_TEST0  CHAR(99);
ERROR 0A000: Alter the precision of foreign key columns,column type CHAR not supported
ALTER TABLE Z0CASE MODIFY COLUMN Z0_TEST0  CHAR(99);
ERROR 0A000: Alter the precision of foreign key columns,column type CHAR not supported
DROP TABLE Z0CASE;
DROP TABLE Z1CASE;
CREATE TABLE Z1CASE(  Z1_TEST0 DATE , Z1_TEST1 VARCHAR(100)) ;
CREATE UNIQUE  INDEX Z1CASE_index ON Z1CASE (Z1_TEST0) STORING(Z1_TEST1) with column group(all columns, each column);
CREATE TABLE Z0CASE(  Z0_TEST0 DATE , Z0_TEST1 VARCHAR(100), FOREIGN KEY (Z0_TEST0) REFERENCES Z1CASE(Z1_TEST0)) ;
INSERT INTO  Z1CASE (Z1_TEST0,Z1_TEST1)VALUES(null,NULL);
INSERT INTO  Z0CASE (Z0_TEST0,Z0_TEST1)VALUES(null,NULL);
SELECT * FROM Z1CASE;
Z1_TEST0	Z1_TEST1
NULL	NULL
SELECT * FROM Z0CASE;
Z0_TEST0	Z0_TEST1
NULL	NULL
ALTER TABLE Z1CASE MODIFY COLUMN Z1_TEST0 DATE ;
SELECT * FROM Z1CASE;
Z1_TEST0	Z1_TEST1
NULL	NULL
DESC Z1CASE;
Field	Type	Null	Key	Default	Extra
Z1_TEST0	date	YES	UNI	NULL	
Z1_TEST1	varchar(100)	YES		NULL	
ALTER TABLE Z1CASE MODIFY COLUMN Z1_TEST0 DATETIME;
ERROR HY000: 'Z1_TEST0': used in a foreign key constraint
ALTER TABLE Z0CASE MODIFY COLUMN Z0_TEST0 DATETIME;
ERROR HY000: 'Z0_TEST0': used in a foreign key constraint
ALTER TABLE Z0CASE MODIFY COLUMN Z0_TEST0 TIMEstamp;
ERROR HY000: 'Z0_TEST0': used in a foreign key constraint
ALTER TABLE Z1CASE MODIFY COLUMN Z1_TEST0 SET('','123','ABC');
ERROR HY000: 'Z1_TEST0': used in a foreign key constraint
ALTER TABLE Z0CASE MODIFY COLUMN Z0_TEST0 SET('');
ERROR HY000: 'Z0_TEST0': used in a foreign key constraint
ALTER TABLE Z1CASE MODIFY COLUMN Z1_TEST0 CHAR(99);
ERROR HY000: 'Z1_TEST0': used in a foreign key constraint
ALTER TABLE Z0CASE MODIFY COLUMN Z0_TEST0 CHAR(99);
ERROR HY000: 'Z0_TEST0': used in a foreign key constraint
CHAR NOT NULL 
DROP TABLE Z0CASE;
DROP TABLE Z1CASE;
CREATE TABLE Z0CASE(Z0_TEST0 CHAR(100) NOT NULL) ;
INSERT INTO  Z0CASE (Z0_TEST0)VALUES('1111');
INSERT INTO  Z0CASE (Z0_TEST0)VALUES(2011);
INSERT INTO  Z0CASE (Z0_TEST0)VALUES(20111111);
SELECT * FROM Z0CASE ORDER BY Z0_TEST0*1;
Z0_TEST0
1111
2011
20111111
ALTER TABLE Z0CASE MODIFY COLUMN z0_test0 CHAR(100)NOT NULL ;
SELECT * FROM Z0CASE ORDER BY Z0_TEST0*1;
z0_test0
1111
2011
20111111
DESC Z0CASE;
Field	Type	Null	Key	Default	Extra
z0_test0	char(100)	NO		NULL	
INSERT INTO Z0CASE VALUES();
ERROR HY000: Field 'z0_test0' doesn't have a default value
ALTER TABLE Z0CASE MODIFY COLUMN z0_test0 CHAR(99) NOT NULL;
SELECT * FROM Z0CASE ORDER BY Z0_TEST0*1;
z0_test0
1111
2011
20111111
DESC Z0CASE;
Field	Type	Null	Key	Default	Extra
z0_test0	char(99)	NO		NULL	
ALTER TABLE Z0CASE MODIFY COLUMN z0_test0 VARCHAR(100);
SELECT * FROM Z0CASE ORDER BY Z0_TEST0*1;
z0_test0
1111
2011
20111111
DESC Z0CASE;
Field	Type	Null	Key	Default	Extra
z0_test0	varchar(100)	YES		NULL	
DROP TABLE Z0CASE;
CREATE TABLE Z0CASE(Z0_TEST0 CHAR(100) NOT NULL) ;
INSERT INTO Z0CASE (Z0_TEST0)VALUES('1111');
INSERT INTO Z0CASE (Z0_TEST0)VALUES(2011);
INSERT INTO Z0CASE (Z0_TEST0)VALUES(20111111);
SELECT * FROM Z0CASE ORDER BY Z0_TEST0*1;
Z0_TEST0
1111
2011
20111111
ALTER TABLE Z0CASE MODIFY COLUMN z0_test0 double;
SELECT * FROM Z0CASE ORDER BY Z0_TEST0;
z0_test0
1111
2011
20111111
DESC Z0CASE;
Field	Type	Null	Key	Default	Extra
z0_test0	double	YES		NULL	
DROP TABLE Z0CASE;
CREATE TABLE Z0CASE(Z0_TEST0 CHAR(100) NOT NULL) ;
INSERT INTO  Z0CASE (Z0_TEST0)VALUES('1111');
INSERT INTO  Z0CASE (Z0_TEST0)VALUES(2011);
INSERT INTO  Z0CASE (Z0_TEST0)VALUES(20111111);
SELECT * FROM Z0CASE ORDER BY Z0_TEST0*1;
Z0_TEST0
1111
2011
20111111
ALTER TABLE Z0CASE MODIFY COLUMN z0_test0 float(24) NOT NULL;
SELECT * FROM Z0CASE ORDER BY Z0_TEST0;
z0_test0
1111
2011
20111100
DESC Z0CASE;
Field	Type	Null	Key	Default	Extra
z0_test0	float	NO		NULL	
DROP TABLE Z0CASE;
CREATE TABLE Z0CASE(Z0_TEST0 CHAR(100) NOT NULL) ;
INSERT INTO  Z0CASE (Z0_TEST0)VALUES('1111');
INSERT INTO  Z0CASE (Z0_TEST0)VALUES(2011);
INSERT INTO  Z0CASE (Z0_TEST0)VALUES(20111111);
SELECT * FROM Z0CASE ORDER BY Z0_TEST0*1;
Z0_TEST0
1111
2011
20111111
ALTER TABLE Z0CASE MODIFY COLUMN z0_test0 BLOB;
SELECT * FROM Z0CASE ORDER BY Z0_TEST0*1;
z0_test0
1111
2011
20111111
DESC Z0CASE;
Field	Type	Null	Key	Default	Extra
z0_test0	blob	YES		NULL	
DROP TABLE Z0CASE;
CREATE TABLE Z0CASE(Z0_TEST0 CHAR(100) NOT NULL) ;
INSERT INTO  Z0CASE (Z0_TEST0)VALUES('1111');
INSERT INTO  Z0CASE (Z0_TEST0)VALUES(2011);
INSERT INTO  Z0CASE (Z0_TEST0)VALUES(20111111);
SELECT * FROM Z0CASE ORDER BY Z0_TEST0*1;
Z0_TEST0
1111
2011
20111111
ALTER TABLE Z0CASE MODIFY COLUMN z0_test0 TEXT;
SELECT * FROM Z0CASE ORDER BY Z0_TEST0*1;
z0_test0
1111
2011
20111111
DESC Z0CASE;
Field	Type	Null	Key	Default	Extra
z0_test0	text	YES		NULL	
INSERT INTO Z0CASE (Z0_TEST0)VALUES('aaaa1!@#$%^&*   \[];,./{}|:"<>/111');
SELECT * FROM Z0CASE ORDER BY Z0_TEST0*1;
z0_test0
aaaa1!@#$%^&*   [];,./{}|:"<>/111
1111
2011
20111111
Warnings:
Warning	1292	Truncated incorrect DOUBLE value: 'aaaa1!@#$%^&*   [];,./{}|:"<>/111'
INSERT INTO Z0CASE (Z0_TEST0)VALUES(12344556);
SELECT * FROM Z0CASE ORDER BY Z0_TEST0*1;
z0_test0
aaaa1!@#$%^&*   [];,./{}|:"<>/111
1111
2011
12344556
20111111
Warnings:
Warning	1292	Truncated incorrect DOUBLE value: 'aaaa1!@#$%^&*   [];,./{}|:"<>/111'
INSERT INTO Z0CASE (Z0_TEST0)VALUES('            ');
SELECT * FROM Z0CASE ORDER BY Z0_TEST0*1;
z0_test0
aaaa1!@#$%^&*   [];,./{}|:"<>/111
            
1111
2011
12344556
20111111
Warnings:
Warning	1292	Truncated incorrect DOUBLE value: 'aaaa1!@#$%^&*   [];,./{}|:"<>/111'
UPDATE Z0CASE SET Z0_TEST0=111123112 WHERE Z0_TEST0='1111';
SELECT * FROM Z0CASE ORDER BY Z0_TEST0*1;
z0_test0
aaaa1!@#$%^&*   [];,./{}|:"<>/111
            
2011
12344556
20111111
111123112
Warnings:
Warning	1292	Truncated incorrect DOUBLE value: 'aaaa1!@#$%^&*   [];,./{}|:"<>/111'
UPDATE Z0CASE SET Z0_TEST0=' !@#$%^* ' WHERE Z0_TEST0=111123112;
ERROR 22007: Truncated incorrect DECIMAL value: 'aaaa1!@#$%^&*   [];,./{}|:"<>/111'
UPDATE Z0CASE SET Z0_TEST0=' !@#$%^* ' WHERE Z0_TEST0='111123112';
SELECT * FROM Z0CASE ORDER BY Z0_TEST0*1;
z0_test0
 !@#$%^* 
aaaa1!@#$%^&*   [];,./{}|:"<>/111
            
2011
12344556
20111111
Warnings:
Warning	1292	Truncated incorrect DOUBLE value: ' !@#$%^* '
Warning	1292	Truncated incorrect DOUBLE value: 'aaaa1!@#$%^&*   [];,./{}|:"<>/111'
DELETE FROM Z0CASE WHERE Z0_TEST0=2011;
ERROR 22007: Truncated incorrect DECIMAL value: ' !@#$%^* '
DELETE FROM Z0CASE WHERE Z0_TEST0='2011';
SELECT * FROM Z0CASE ORDER BY Z0_TEST0*1;
z0_test0
 !@#$%^* 
aaaa1!@#$%^&*   [];,./{}|:"<>/111
            
12344556
20111111
Warnings:
Warning	1292	Truncated incorrect DOUBLE value: ' !@#$%^* '
Warning	1292	Truncated incorrect DOUBLE value: 'aaaa1!@#$%^&*   [];,./{}|:"<>/111'
DELETE FROM Z0CASE WHERE Z0_TEST0='aaaa1!@#$%^&*   [];,./{}|:"<>/111';
SELECT * FROM Z0CASE ORDER BY Z0_TEST0*1;
z0_test0
 !@#$%^* 
            
12344556
20111111
Warnings:
Warning	1292	Truncated incorrect DOUBLE value: ' !@#$%^* '
DROP TABLE Z0CASE;
CREATE TABLE Z0CASE(Z0_TEST0 CHAR(100) NOT NULL) ;
INSERT INTO  Z0CASE (Z0_TEST0)VALUES('1111');
INSERT INTO  Z0CASE (Z0_TEST0)VALUES(2011);
INSERT INTO  Z0CASE (Z0_TEST0)VALUES(20111111);
SELECT * FROM Z0CASE ORDER BY Z0_TEST0*1;
Z0_TEST0
1111
2011
20111111
ALTER TABLE Z0CASE MODIFY COLUMN z0_test0 ENUM('1111','2011','20111111','ABC');
SELECT * FROM Z0CASE ORDER BY Z0_TEST0*1;
z0_test0
1111
2011
20111111
DESC Z0CASE;
Field	Type	Null	Key	Default	Extra
z0_test0	enum('1111','2011','20111111','ABC')	YES		NULL	
DROP TABLE Z0CASE;
CREATE TABLE Z0CASE(  Z0_TEST0  CHAR(100) NOT NULL ) ;
INSERT INTO  Z0CASE (Z0_TEST0)VALUES('1111');
INSERT INTO  Z0CASE (Z0_TEST0)VALUES(2011);
INSERT INTO  Z0CASE (Z0_TEST0)VALUES(20111111);
SELECT * FROM Z0CASE ORDER BY Z0_TEST0*1;
Z0_TEST0
1111
2011
20111111
ALTER TABLE Z0CASE MODIFY COLUMN z0_test0 TIMESTAMP;
ERROR 22007: Incorrect value
ALTER TABLE Z0CASE MODIFY COLUMN z0_test0 DATE;
ERROR 22007: Incorrect value
ALTER TABLE Z0CASE MODIFY COLUMN z0_test0  float(30);
SELECT * FROM Z0CASE ORDER BY Z0_TEST0*1;
z0_test0
1111
2011
20111111
DESC Z0CASE;
Field	Type	Null	Key	Default	Extra
z0_test0	double	YES		NULL	
ALTER TABLE Z0CASE MODIFY COLUMN z0_test0  float(38);
SELECT * FROM Z0CASE ORDER BY Z0_TEST0;
z0_test0
1111
2011
20111111
DESC Z0CASE;
Field	Type	Null	Key	Default	Extra
z0_test0	double	YES		NULL	
ALTER TABLE Z0CASE MODIFY COLUMN z0_test0  float(30);
SELECT * FROM Z0CASE ORDER BY Z0_TEST0;
z0_test0
1111
2011
20111111
DESC Z0CASE;
Field	Type	Null	Key	Default	Extra
z0_test0	double	YES		NULL	
ALTER TABLE Z0CASE MODIFY COLUMN z0_test0  float(28);
SELECT * FROM Z0CASE ORDER BY Z0_TEST0;
z0_test0
1111
2011
20111111
DESC Z0CASE;
Field	Type	Null	Key	Default	Extra
z0_test0	double	YES		NULL	
ALTER TABLE Z0CASE MODIFY COLUMN z0_test0  float(20);
BLOB NOT NULL 
DROP TABLE Z0CASE;
CREATE TABLE Z0CASE(  Z0_TEST0  tinyBLOB NOT NULL ) ;
INSERT INTO  Z0CASE (Z0_TEST0)VALUES('1111');
INSERT INTO  Z0CASE (Z0_TEST0)VALUES(2011);
INSERT INTO  Z0CASE (Z0_TEST0)VALUES(20111111);
SELECT * FROM Z0CASE ORDER BY Z0_TEST0*1;
Z0_TEST0
1111
2011
20111111
ALTER TABLE Z0CASE MODIFY COLUMN z0_test0 BLOB;
SELECT * FROM Z0CASE ORDER BY Z0_TEST0*1;
z0_test0
1111
2011
20111111
DESC Z0CASE;
Field	Type	Null	Key	Default	Extra
z0_test0	blob	YES		NULL	
INSERT INTO Z0CASE (Z0_TEST0)VALUES('aaaa1!@#$%^&*   \[];,./{}|:"<>/111');
SELECT * FROM Z0CASE ORDER BY Z0_TEST0*1;
z0_test0
aaaa1!@#$%^&*   [];,./{}|:"<>/111
1111
2011
20111111
Warnings:
Warning	1292	Truncated incorrect DOUBLE value: 'aaaa1!@#$%^&*   [];,./{}|:"<>/111'
INSERT INTO Z0CASE (Z0_TEST0)VALUES(12344556);
SELECT * FROM Z0CASE ORDER BY Z0_TEST0*1;
z0_test0
aaaa1!@#$%^&*   [];,./{}|:"<>/111
1111
2011
12344556
20111111
Warnings:
Warning	1292	Truncated incorrect DOUBLE value: 'aaaa1!@#$%^&*   [];,./{}|:"<>/111'
INSERT INTO Z0CASE (Z0_TEST0)VALUES('            ');
SELECT * FROM Z0CASE ORDER BY Z0_TEST0*1;
z0_test0
aaaa1!@#$%^&*   [];,./{}|:"<>/111
            
1111
2011
12344556
20111111
Warnings:
Warning	1292	Truncated incorrect DOUBLE value: 'aaaa1!@#$%^&*   [];,./{}|:"<>/111'
UPDATE Z0CASE SET Z0_TEST0=111123112 WHERE Z0_TEST0='1111';
SELECT * FROM Z0CASE ORDER BY Z0_TEST0*1;
z0_test0
aaaa1!@#$%^&*   [];,./{}|:"<>/111
            
2011
12344556
20111111
111123112
Warnings:
Warning	1292	Truncated incorrect DOUBLE value: 'aaaa1!@#$%^&*   [];,./{}|:"<>/111'
UPDATE Z0CASE SET Z0_TEST0=' !@#$%^* ' WHERE Z0_TEST0=111123112;
ERROR 22007: Truncated incorrect DECIMAL value: 'aaaa1!@#$%^&*   [];,./{}|:"<>/111'
UPDATE Z0CASE SET Z0_TEST0=' !@#$%^* ' WHERE Z0_TEST0='111123112';
SELECT * FROM Z0CASE ORDER BY Z0_TEST0*1;
z0_test0
 !@#$%^* 
aaaa1!@#$%^&*   [];,./{}|:"<>/111
            
2011
12344556
20111111
Warnings:
Warning	1292	Truncated incorrect DOUBLE value: ' !@#$%^* '
Warning	1292	Truncated incorrect DOUBLE value: 'aaaa1!@#$%^&*   [];,./{}|:"<>/111'
DELETE FROM Z0CASE WHERE Z0_TEST0=2011;
ERROR 22007: Truncated incorrect DECIMAL value: ' !@#$%^* '
DELETE FROM Z0CASE WHERE Z0_TEST0='2011';
SELECT * FROM Z0CASE ORDER BY Z0_TEST0*1;
z0_test0
 !@#$%^* 
aaaa1!@#$%^&*   [];,./{}|:"<>/111
            
12344556
20111111
Warnings:
Warning	1292	Truncated incorrect DOUBLE value: ' !@#$%^* '
Warning	1292	Truncated incorrect DOUBLE value: 'aaaa1!@#$%^&*   [];,./{}|:"<>/111'
DELETE FROM Z0CASE WHERE Z0_TEST0='aaaa1!@#$%^&*   [];,./{}|:"<>/111';
SELECT * FROM Z0CASE ORDER BY Z0_TEST0*1;
z0_test0
 !@#$%^* 
            
12344556
20111111
Warnings:
Warning	1292	Truncated incorrect DOUBLE value: ' !@#$%^* '
DROP TABLE Z0CASE;
CREATE TABLE Z0CASE(  Z0_TEST0  tinyBLOB NOT NULL ) ;
ALTER TABLE Z0CASE MODIFY COLUMN z0_test0  tinyBLOB;
DESC Z0CASE;
Field	Type	Null	Key	Default	Extra
z0_test0	tinyblob	YES		NULL	
DROP TABLE Z0CASE;
CREATE TABLE Z0CASE(  Z0_TEST0  tinyBLOB NOT NULL ) ;
ALTER TABLE Z0CASE MODIFY COLUMN z0_test0  longBLOB;
DESC Z0CASE;
Field	Type	Null	Key	Default	Extra
z0_test0	longblob	YES		NULL	
DROP TABLE Z0CASE;
CREATE TABLE Z0CASE(  Z0_TEST0  tinyBLOB NOT NULL ) ;
ALTER TABLE Z0CASE MODIFY COLUMN z0_test0  VARCHAR(100);
DESC Z0CASE;
Field	Type	Null	Key	Default	Extra
z0_test0	varchar(100)	YES		NULL	
DROP TABLE Z0CASE;
CREATE TABLE Z0CASE(  Z0_TEST0  BLOB NOT NULL ) ;
ALTER TABLE Z0CASE MODIFY COLUMN z0_test0  float(24);
DESC Z0CASE;
Field	Type	Null	Key	Default	Extra
z0_test0	float	YES		NULL	
DROP TABLE Z0CASE;
CREATE TABLE Z0CASE(  Z0_TEST0  BLOB NOT NULL ) ;
ALTER TABLE Z0CASE MODIFY COLUMN z0_test0 TEXT;
DESC Z0CASE;
Field	Type	Null	Key	Default	Extra
z0_test0	text	YES		NULL	
ALTER TABLE Z0CASE MODIFY COLUMN z0_test0 ENUM('1111','2011','20111111','ABC');
DESC Z0CASE;
Field	Type	Null	Key	Default	Extra
z0_test0	enum('1111','2011','20111111','ABC')	YES		NULL	
ALTER TABLE Z0CASE MODIFY COLUMN z0_test0 TIMESTAMP;
DESC Z0CASE;
Field	Type	Null	Key	Default	Extra
z0_test0	timestamp	YES		NULL	
ALTER TABLE Z0CASE MODIFY COLUMN z0_test0 DATE;
DESC Z0CASE;
Field	Type	Null	Key	Default	Extra
z0_test0	date	YES		NULL	
CHAR unique
DROP TABLE Z0CASE;
CREATE TABLE Z0CASE(  Z0_TEST0 CHAR(100) unique ) ;
INSERT INTO  Z0CASE (Z0_TEST0)VALUES('1111');
INSERT INTO  Z0CASE (Z0_TEST0)VALUES('2011');
INSERT INTO  Z0CASE (Z0_TEST0)VALUES('20111111');
SELECT * FROM Z0CASE ORDER BY Z0_TEST0*1;
Z0_TEST0
1111
2011
20111111
ALTER TABLE Z0CASE MODIFY COLUMN z0_test0  CHAR(100) ;
SELECT * FROM Z0CASE ORDER BY Z0_TEST0*1;
z0_test0
1111
2011
20111111
DESC Z0CASE;
Field	Type	Null	Key	Default	Extra
z0_test0	char(100)	YES	UNI	NULL	
ALTER TABLE Z0CASE MODIFY COLUMN z0_test0 CHAR(99);
SELECT * FROM Z0CASE ORDER BY Z0_TEST0*1;
z0_test0
1111
2011
20111111
DESC Z0CASE;
Field	Type	Null	Key	Default	Extra
z0_test0	char(99)	YES	UNI	NULL	
DROP TABLE Z0CASE;
CREATE TABLE Z0CASE(  Z0_TEST0 CHAR(100) unique ) ;
INSERT INTO  Z0CASE (Z0_TEST0)VALUES('1111');
INSERT INTO  Z0CASE (Z0_TEST0)VALUES('2011');
INSERT INTO  Z0CASE (Z0_TEST0)VALUES('20111111');
SELECT * FROM Z0CASE ORDER BY Z0_TEST0*1;
Z0_TEST0
1111
2011
20111111
ALTER TABLE Z0CASE MODIFY COLUMN z0_test0  VARCHAR(100);
SELECT * FROM Z0CASE ORDER BY Z0_TEST0*1;
z0_test0
1111
2011
20111111
DESC Z0CASE;
Field	Type	Null	Key	Default	Extra
z0_test0	varchar(100)	YES	UNI	NULL	
ALTER TABLE Z0CASE MODIFY COLUMN z0_test0 VARCHAR(99);
SELECT * FROM Z0CASE ORDER BY Z0_TEST0*1;
z0_test0
1111
2011
20111111
DESC Z0CASE;
Field	Type	Null	Key	Default	Extra
z0_test0	varchar(99)	YES	UNI	NULL	
修改主键
DROP TABLE Z0CASE;
CREATE TABLE Z0CASE(Z0_TEST0 CHAR(100)  PRIMARY KEY, Z0_TEST1 CHAR(100)) ;
INSERT INTO  Z0CASE (Z0_TEST0,Z0_TEST1)VALUES('1111.1111','1111.1111');
INSERT INTO  Z0CASE (Z0_TEST0,Z0_TEST1)VALUES(2011,2011);
INSERT INTO  Z0CASE (Z0_TEST0,Z0_TEST1)VALUES(20111111,20111111);
INSERT INTO  Z0CASE (Z0_TEST0,Z0_TEST1)VALUES('ABC','ABC');
SELECT * FROM Z0CASE ORDER BY Z0_TEST0*1;
Z0_TEST0	Z0_TEST1
ABC	ABC
1111.1111	1111.1111
2011	2011
20111111	20111111
Warnings:
Warning	1292	Truncated incorrect DOUBLE value: 'ABC'
ALTER TABLE Z0CASE drop PRIMARY KEY,add  PRIMARY KEY(Z0_TEST1);
SELECT * FROM Z0CASE ORDER BY Z0_TEST0*1;
Z0_TEST0	Z0_TEST1
ABC	ABC
1111.1111	1111.1111
2011	2011
20111111	20111111
Warnings:
Warning	1292	Truncated incorrect DOUBLE value: 'ABC'
DESC Z0CASE;
Field	Type	Null	Key	Default	Extra
Z0_TEST0	char(100)	NO		NULL	
Z0_TEST1	char(100)	NO	PRI	NULL	
ALTER TABLE Z0CASE drop PRIMARY KEY,add  PRIMARY KEY(Z0_TEST1);
SELECT * FROM Z0CASE ORDER BY Z0_TEST0*1;
Z0_TEST0	Z0_TEST1
ABC	ABC
1111.1111	1111.1111
2011	2011
20111111	20111111
Warnings:
Warning	1292	Truncated incorrect DOUBLE value: 'ABC'
DESC Z0CASE;
Field	Type	Null	Key	Default	Extra
Z0_TEST0	char(100)	NO		NULL	
Z0_TEST1	char(100)	NO	PRI	NULL	
DROP TABLE Z0CASE;
CREATE TABLE Z0CASE(  Z0_TEST0 CHAR(100)  PRIMARY KEY, Z0_TEST1 CHAR(100)) ;
INSERT INTO  Z0CASE (Z0_TEST0,Z0_TEST1)VALUES('1111.1111','1111.1111');
INSERT INTO  Z0CASE (Z0_TEST0,Z0_TEST1)VALUES(2011,2011);
INSERT INTO  Z0CASE (Z0_TEST0,Z0_TEST1)VALUES(20111111,20111111);
INSERT INTO  Z0CASE (Z0_TEST0,Z0_TEST1)VALUES('ABC','ABC');
INSERT INTO  Z0CASE (Z0_TEST0,Z0_TEST1)VALUES('ABC123',null);
SELECT * FROM Z0CASE ORDER BY Z0_TEST0*1;
Z0_TEST0	Z0_TEST1
ABC	ABC
ABC123	NULL
1111.1111	1111.1111
2011	2011
20111111	20111111
Warnings:
Warning	1292	Truncated incorrect DOUBLE value: 'ABC'
Warning	1292	Truncated incorrect DOUBLE value: 'ABC123'
ALTER TABLE Z0CASE drop PRIMARY KEY,add  PRIMARY KEY(Z0_TEST1);
ERROR 22004: Invalid use of NULL value
DROP TABLE Z0CASE;
CREATE TABLE Z0CASE(  Z0_TEST0 CHAR(100)  PRIMARY KEY, Z0_TEST1 CHAR(100)) ;
INSERT INTO  Z0CASE (Z0_TEST0,Z0_TEST1)VALUES('1111.1111','1111.1111');
INSERT INTO  Z0CASE (Z0_TEST0,Z0_TEST1)VALUES(2011,2011);
INSERT INTO  Z0CASE (Z0_TEST0,Z0_TEST1)VALUES(20111111,20111111);
INSERT INTO  Z0CASE (Z0_TEST0,Z0_TEST1)VALUES('ABC','ABC');
INSERT INTO  Z0CASE (Z0_TEST0,Z0_TEST1)VALUES('ABC123','ABC');
SELECT * FROM Z0CASE ORDER BY Z0_TEST0*1;
Z0_TEST0	Z0_TEST1
ABC	ABC
ABC123	ABC
1111.1111	1111.1111
2011	2011
20111111	20111111
Warnings:
Warning	1292	Truncated incorrect DOUBLE value: 'ABC'
Warning	1292	Truncated incorrect DOUBLE value: 'ABC123'
ALTER TABLE Z0CASE drop PRIMARY KEY,add  PRIMARY KEY(Z0_TEST1);
ERROR 23000: Duplicated primary key
BLOB/text
DROP TABLE Z0CASE;
CREATE TABLE Z0CASE(Z0_TEST0 VARCHAR(100) PRIMARY KEY, Z0_TEST1 text) ;
INSERT INTO  Z0CASE (Z0_TEST0,Z0_TEST1)VALUES('1111.1111','1111.1111');
INSERT INTO  Z0CASE (Z0_TEST0,Z0_TEST1)VALUES(2011,2011);
INSERT INTO  Z0CASE (Z0_TEST0,Z0_TEST1)VALUES(20111111,20111111);
INSERT INTO  Z0CASE (Z0_TEST0,Z0_TEST1)VALUES('ABC','ABC');
SELECT * FROM Z0CASE ORDER BY Z0_TEST0*1;
Z0_TEST0	Z0_TEST1
ABC	ABC
1111.1111	1111.1111
2011	2011
20111111	20111111
Warnings:
Warning	1292	Truncated incorrect DOUBLE value: 'ABC'
ALTER TABLE Z0CASE drop PRIMARY KEY,add  PRIMARY KEY(Z0_TEST1);
ERROR 42000: The used storage engine can't index column 'Z0_TEST1'
DROP TABLE Z0CASE;
CREATE TABLE Z0CASE(Z0_TEST0 VARCHAR(100) PRIMARY KEY, Z0_TEST1 BLOB) ;
ALTER TABLE Z0CASE drop PRIMARY KEY,add PRIMARY KEY(Z0_TEST1);
ERROR 42000: The used storage engine can't index column 'Z0_TEST1'
添加主键
DROP TABLE Z0CASE;
CREATE TABLE Z0CASE(Z0_TEST0 CHAR(100),Z0_TEST1 CHAR(100)) ;
INSERT INTO  Z0CASE (Z0_TEST0,Z0_TEST1)VALUES('1111.1111','1111.1111');
INSERT INTO  Z0CASE (Z0_TEST0,Z0_TEST1)VALUES(2011,2011);
INSERT INTO  Z0CASE (Z0_TEST0,Z0_TEST1)VALUES(20111111,20111111);
INSERT INTO  Z0CASE (Z0_TEST0,Z0_TEST1)VALUES('ABC','ABC');
INSERT INTO  Z0CASE (Z0_TEST0,Z0_TEST1)VALUES('ABC123',null);
SELECT * FROM Z0CASE ORDER BY Z0_TEST0*1;
Z0_TEST0	Z0_TEST1
ABC	ABC
ABC123	NULL
1111.1111	1111.1111
2011	2011
20111111	20111111
Warnings:
Warning	1292	Truncated incorrect DOUBLE value: 'ABC'
Warning	1292	Truncated incorrect DOUBLE value: 'ABC123'
ALTER TABLE Z0CASE ADD PRIMARY KEY(Z0_TEST0);
SELECT * FROM Z0CASE ORDER BY Z0_TEST0*1;
Z0_TEST0	Z0_TEST1
ABC	ABC
ABC123	NULL
1111.1111	1111.1111
2011	2011
20111111	20111111
Warnings:
Warning	1292	Truncated incorrect DOUBLE value: 'ABC'
Warning	1292	Truncated incorrect DOUBLE value: 'ABC123'
DESC Z0CASE;
Field	Type	Null	Key	Default	Extra
Z0_TEST0	char(100)	NO	PRI	NULL	
Z0_TEST1	char(100)	YES		NULL	
ALTER TABLE Z0CASE add PRIMARY KEY(Z0_TEST1);
ERROR 42000: Multiple primary key defined
DROP TABLE Z0CASE;
CREATE TABLE Z0CASE(  Z0_TEST0 CHAR(100) , Z0_TEST1 CHAR(100)) ;
INSERT INTO  Z0CASE (Z0_TEST0,Z0_TEST1)VALUES('1111.1111','1111.1111');
INSERT INTO  Z0CASE (Z0_TEST0,Z0_TEST1)VALUES(2011,2011);
INSERT INTO  Z0CASE (Z0_TEST0,Z0_TEST1)VALUES(20111111,20111111);
INSERT INTO  Z0CASE (Z0_TEST0,Z0_TEST1)VALUES(' ','ABC');
INSERT INTO  Z0CASE (Z0_TEST0,Z0_TEST1)VALUES('',null);
SELECT * FROM Z0CASE ORDER BY Z0_TEST0*1;
Z0_TEST0	Z0_TEST1
	ABC
	NULL
1111.1111	1111.1111
2011	2011
20111111	20111111
ALTER TABLE Z0CASE ADD PRIMARY KEY(Z0_TEST0);
ERROR 23000: Duplicated primary key
ALTER TABLE Z0CASE ADD PRIMARY KEY(Z0_TEST1);
ERROR 22004: Invalid use of NULL value
DROP TABLE Z0CASE;
CREATE TABLE Z0CASE(  Z0_TEST0 CHAR(100) , Z0_TEST1 VARCHAR(100)) ;
INSERT INTO  Z0CASE (Z0_TEST0,Z0_TEST1)VALUES('1111.1111','1111.1111');
INSERT INTO  Z0CASE (Z0_TEST0,Z0_TEST1)VALUES(2011,2011);
INSERT INTO  Z0CASE (Z0_TEST0,Z0_TEST1)VALUES(20111111,20111111);
INSERT INTO  Z0CASE (Z0_TEST0,Z0_TEST1)VALUES('ABC','ABC');
INSERT INTO  Z0CASE (Z0_TEST0,Z0_TEST1)VALUES('ABC123','ABC123');
SELECT * FROM Z0CASE ORDER BY Z0_TEST0*1;
Z0_TEST0	Z0_TEST1
ABC	ABC
ABC123	ABC123
1111.1111	1111.1111
2011	2011
20111111	20111111
Warnings:
Warning	1292	Truncated incorrect DOUBLE value: 'ABC'
Warning	1292	Truncated incorrect DOUBLE value: 'ABC123'
ALTER TABLE Z0CASE ADD  PRIMARY KEY(Z0_TEST0,Z0_TEST1);
SELECT * FROM Z0CASE ORDER BY Z0_TEST0*1;
Z0_TEST0	Z0_TEST1
ABC	ABC
ABC123	ABC123
1111.1111	1111.1111
2011	2011
20111111	20111111
Warnings:
Warning	1292	Truncated incorrect DOUBLE value: 'ABC'
Warning	1292	Truncated incorrect DOUBLE value: 'ABC123'
DESC Z0CASE;
Field	Type	Null	Key	Default	Extra
Z0_TEST0	char(100)	NO	PRI	NULL	
Z0_TEST1	varchar(100)	NO	PRI	NULL	
DROP TABLE Z0CASE;
CREATE TABLE Z0CASE(Z0_TEST0 CHAR(100),Z0_TEST1 CHAR(100)) ;
INSERT INTO  Z0CASE (Z0_TEST0,Z0_TEST1)VALUES('1111.1111','1111.1111');
INSERT INTO  Z0CASE (Z0_TEST0,Z0_TEST1)VALUES(2011,2011);
INSERT INTO  Z0CASE (Z0_TEST0,Z0_TEST1)VALUES(20111111,20111111);
INSERT INTO  Z0CASE (Z0_TEST0,Z0_TEST1)VALUES('123','321');
INSERT INTO  Z0CASE (Z0_TEST0,Z0_TEST1)VALUES('123','321');
SELECT * FROM Z0CASE ORDER BY Z0_TEST0*1;
Z0_TEST0	Z0_TEST1
123	321
123	321
1111.1111	1111.1111
2011	2011
20111111	20111111
ALTER TABLE Z0CASE ADD  PRIMARY KEY(Z0_TEST0,Z0_TEST1) ;
ERROR 23000: Duplicated primary key
DROP TABLE Z0CASE;
CREATE TABLE Z0CASE(  Z0_TEST0 CHAR(100) , Z0_TEST1 CHAR(100)) ;
INSERT INTO  Z0CASE (Z0_TEST0,Z0_TEST1)VALUES('1111.1111','1111.1111');
INSERT INTO  Z0CASE (Z0_TEST0,Z0_TEST1)VALUES(2011,2011);
INSERT INTO  Z0CASE (Z0_TEST0,Z0_TEST1)VALUES(20111111,20111111);
INSERT INTO  Z0CASE (Z0_TEST0,Z0_TEST1)VALUES('123','321');
INSERT INTO  Z0CASE (Z0_TEST0,Z0_TEST1)VALUES('123',null);
SELECT * FROM Z0CASE ORDER BY Z0_TEST0*1;
Z0_TEST0	Z0_TEST1
123	321
123	NULL
1111.1111	1111.1111
2011	2011
20111111	20111111
ALTER TABLE Z0CASE ADD  PRIMARY KEY(Z0_TEST0,Z0_TEST1);
ERROR 22004: Invalid use of NULL value
AUTO_INCREMENT
DROP TABLE Z0CASE;
CREATE TABLE Z0CASE(Z0_TEST0 INT AUTO_INCREMENT, Z0_TEST1 VARCHAR(100)) ;
INSERT INTO  Z0CASE (Z0_TEST0,Z0_TEST1)VALUES(2011,2011);
INSERT INTO  Z0CASE (Z0_TEST0,Z0_TEST1)VALUES(NULL,NULL);
SELECT * FROM Z0CASE ORDER BY Z0_TEST0;
Z0_TEST0	Z0_TEST1
2011	2011
2012	NULL
ALTER TABLE Z0CASE MODIFY COLUMN Z0_TEST0  FLOAT;
ALTER TABLE Z0CASE MODIFY COLUMN Z0_TEST0  CHAR(100);
DROP TABLE Z0CASE;
CREATE TABLE Z0CASE(  Z0_TEST0 INT PRIMARY KEY AUTO_INCREMENT, Z0_TEST1 VARCHAR(100)) ;
INSERT INTO  Z0CASE (Z0_TEST0,Z0_TEST1)VALUES(2011,2011);
INSERT INTO  Z0CASE (Z0_TEST0,Z0_TEST1)VALUES(NULL,NULL);
SELECT * FROM Z0CASE ORDER BY Z0_TEST0;
Z0_TEST0	Z0_TEST1
2011	2011
2012	NULL
ALTER TABLE Z0CASE MODIFY COLUMN Z0_TEST0  FLOAT;
ALTER TABLE Z0CASE MODIFY COLUMN Z0_TEST0 INT;
SELECT * FROM Z0CASE ORDER BY Z0_TEST0;
Z0_TEST0	Z0_TEST1
2011	2011
2012	NULL
DESC Z0CASE;
Field	Type	Null	Key	Default	Extra
Z0_TEST0	int(11)	NO	PRI	NULL	
Z0_TEST1	varchar(100)	YES		NULL	
ALTER TABLE Z0CASE MODIFY COLUMN Z0_TEST0  FLOAT;
SELECT * FROM Z0CASE ORDER BY Z0_TEST0;
Z0_TEST0	Z0_TEST1
2011	2011
2012	NULL
DESC Z0CASE;
Field	Type	Null	Key	Default	Extra
Z0_TEST0	float	NO	PRI	NULL	
Z0_TEST1	varchar(100)	YES		NULL	
ALTER TABLE Z0CASE drop PRIMARY KEY,ADD PRIMARY KEY(Z0_TEST0,Z0_TEST1) ;
ERROR 22004: Invalid use of NULL value
#check
#此处check有问题，开发在完善功能，后续check约束功能完成再执行。
DROP TABLE Z0CASE;
