SET sql_mode='STRICT_TRANS_TABLES,STRICT_ALL_TABLES';
SELECT @@sql_mode;
@@sql_mode
STRICT_TRANS_TABLES,STRICT_ALL_TABLES
DROP TABLE IF EXISTS Z0CASE;
CHAR
CREATE TABLE Z0CASE(Z0_TEST0 CHAR(100), Z0_TEST1 VARCHAR(50),Z0_TEST2 INT) with column group (all columns, each column);
INSERT INTO  Z0CASE (z0_test0,z0_test1,Z0_TEST2)VALUES('abc ABC','abc ABC',1);
INSERT INTO  Z0CASE (z0_test0,z0_test1,Z0_TEST2)VALUES('中文字符@!#$%^','中文字符@!#$%^',12);
INSERT INTO  Z0CASE (z0_test0,z0_test1,Z0_TEST2)VALUES(NULL,NULL,0);
INSERT INTO  Z0CASE (z0_test0,z0_test1,Z0_TEST2)VALUES(111,111,11);
INSERT INTO  Z0CASE (z0_test0,z0_test1,Z0_TEST2)VALUES('1111.1111','1111.1111',100);
INSERT INTO  Z0CASE (z0_test0,z0_test1,Z0_TEST2)VALUES('2011-11-11 11:11:11','2011-11-11 11:11:11',20);
INSERT INTO  Z0CASE (z0_test0,z0_test1,Z0_TEST2)VALUES(20111111,20111111,13);
INSERT INTO  Z0CASE (z0_test0,z0_test1,Z0_TEST2)VALUES(NULL,NULL,40);
INSERT INTO  Z0CASE (z0_test0,z0_test1,Z0_TEST2)VALUES('','',10);
INSERT INTO  Z0CASE (z0_test0,z0_test1,Z0_TEST2)VALUES('    ',' ',250);
SELECT * FROM Z0CASE ORDER BY Z0_TEST2;
Z0_TEST0	Z0_TEST1	Z0_TEST2
NULL	NULL	0
abc ABC	abc ABC	1
		10
111	111	11
中文字符@!#$%^	中文字符@!#$%^	12
20111111	20111111	13
2011-11-11 11:11:11	2011-11-11 11:11:11	20
NULL	NULL	40
1111.1111	1111.1111	100
	 	250
SELECT table_id,table_name FROM oceanbase.__all_virtual_table WHERE table_name='Z0CASE';
CHAR --> CHAR
ALTER TABLE Z0CASE MODIFY COLUMN  z0_test0 CHAR(100);
DESC Z0CASE;
Field	Type	Null	Key	Default	Extra
z0_test0	char(100)	YES		NULL	
Z0_TEST1	varchar(50)	YES		NULL	
Z0_TEST2	int(11)	YES		NULL	
SELECT * FROM Z0CASE ORDER BY Z0_TEST2;
z0_test0	Z0_TEST1	Z0_TEST2
NULL	NULL	0
abc ABC	abc ABC	1
		10
111	111	11
中文字符@!#$%^	中文字符@!#$%^	12
20111111	20111111	13
2011-11-11 11:11:11	2011-11-11 11:11:11	20
NULL	NULL	40
1111.1111	1111.1111	100
	 	250
SELECT table_id,table_name FROM oceanbase.__all_virtual_table WHERE table_name='Z0CASE';
ALTER TABLE Z0CASE MODIFY COLUMN  z0_test0 CHAR(101);
DESC Z0CASE;
Field	Type	Null	Key	Default	Extra
z0_test0	char(101)	YES		NULL	
Z0_TEST1	varchar(50)	YES		NULL	
Z0_TEST2	int(11)	YES		NULL	
SELECT * FROM Z0CASE ORDER BY Z0_TEST2;
z0_test0	Z0_TEST1	Z0_TEST2
NULL	NULL	0
abc ABC	abc ABC	1
		10
111	111	11
中文字符@!#$%^	中文字符@!#$%^	12
20111111	20111111	13
2011-11-11 11:11:11	2011-11-11 11:11:11	20
NULL	NULL	40
1111.1111	1111.1111	100
	 	250
SELECT table_id,table_name FROM oceanbase.__all_virtual_table WHERE table_name='Z0CASE';
ALTER TABLE Z0CASE MODIFY COLUMN  z0_test0 CHAR(99);
DESC Z0CASE;
Field	Type	Null	Key	Default	Extra
z0_test0	char(99)	YES		NULL	
Z0_TEST1	varchar(50)	YES		NULL	
Z0_TEST2	int(11)	YES		NULL	
SELECT * FROM Z0CASE ORDER BY Z0_TEST2;
z0_test0	Z0_TEST1	Z0_TEST2
NULL	NULL	0
abc ABC	abc ABC	1
		10
111	111	11
中文字符@!#$%^	中文字符@!#$%^	12
20111111	20111111	13
2011-11-11 11:11:11	2011-11-11 11:11:11	20
NULL	NULL	40
1111.1111	1111.1111	100
	 	250
SELECT table_id,table_name FROM oceanbase.__all_virtual_table WHERE table_name='Z0CASE';
ALTER TABLE Z0CASE MODIFY COLUMN  z0_test0 CHAR(0);
ERROR 22001: Data too long for column
DELETE FROM Z0CASE where 1=1;
ALTER TABLE Z0CASE MODIFY COLUMN  z0_test0 CHAR(3) DEFAULT '123';
DESC Z0CASE;
Field	Type	Null	Key	Default	Extra
z0_test0	char(3)	YES		123	
Z0_TEST1	varchar(50)	YES		NULL	
Z0_TEST2	int(11)	YES		NULL	
SELECT table_id,table_name FROM oceanbase.__all_virtual_table WHERE table_name='Z0CASE';
ALTER TABLE Z0CASE MODIFY COLUMN  z0_test0 CHAR(2) DEFAULT '123';
ERROR 42000: Invalid default value for 'z0_test0'
ALTER TABLE Z0CASE MODIFY COLUMN  z0_test0 CHAR(0) DEFAULT '  ';
DESC Z0CASE;
Field	Type	Null	Key	Default	Extra
z0_test0	char(0)	YES			
Z0_TEST1	varchar(50)	YES		NULL	
Z0_TEST2	int(11)	YES		NULL	
SELECT table_id,table_name FROM oceanbase.__all_virtual_table WHERE table_name='Z0CASE';
CHAR --> VARCHAR
ALTER TABLE Z0CASE MODIFY COLUMN  z0_test0 VARCHAR(99);
DESC Z0CASE;
Field	Type	Null	Key	Default	Extra
z0_test0	varchar(99)	YES		NULL	
Z0_TEST1	varchar(50)	YES		NULL	
Z0_TEST2	int(11)	YES		NULL	
SELECT table_id,table_name FROM oceanbase.__all_virtual_table WHERE table_name='Z0CASE';
ALTER TABLE Z0CASE MODIFY COLUMN z0_test0 VARCHAR(100) DEFAULT NULL;
DESC Z0CASE;
Field	Type	Null	Key	Default	Extra
z0_test0	varchar(100)	YES		NULL	
Z0_TEST1	varchar(50)	YES		NULL	
Z0_TEST2	int(11)	YES		NULL	
SELECT table_id,table_name FROM oceanbase.__all_virtual_table WHERE table_name='Z0CASE';
ALTER TABLE Z0CASE MODIFY COLUMN z0_test0 VARCHAR(101) DEFAULT NULL;
DESC Z0CASE;
Field	Type	Null	Key	Default	Extra
z0_test0	varchar(101)	YES		NULL	
Z0_TEST1	varchar(50)	YES		NULL	
Z0_TEST2	int(11)	YES		NULL	
SELECT table_id,table_name FROM oceanbase.__all_virtual_table WHERE table_name='Z0CASE';
ALTER TABLE Z0CASE MODIFY COLUMN z0_test0 VARCHAR(100) DEFAULT NULL;
DESC Z0CASE;
Field	Type	Null	Key	Default	Extra
z0_test0	varchar(100)	YES		NULL	
Z0_TEST1	varchar(50)	YES		NULL	
Z0_TEST2	int(11)	YES		NULL	
SELECT table_id,table_name FROM oceanbase.__all_virtual_table WHERE table_name='Z0CASE';
ALTER TABLE Z0CASE MODIFY COLUMN z0_test1 VARCHAR(100) DEFAULT NULL;
DESC Z0CASE;
Field	Type	Null	Key	Default	Extra
z0_test0	varchar(100)	YES		NULL	
z0_test1	varchar(100)	YES		NULL	
Z0_TEST2	int(11)	YES		NULL	
SELECT table_id,table_name FROM oceanbase.__all_virtual_table WHERE table_name='Z0CASE';
CHAR --> BLOB,此处BLOB和TEXT的长度为虚构的，其实不起任何作用，故BLOB和TEXT后面数字改变不会重写数据。
DROP TABLE Z0CASE;
CREATE TABLE Z0CASE(Z0_TEST0 CHAR(100), Z0_TEST1 VARCHAR(50),Z0_TEST2 INT) with column group (all columns, each column);
INSERT INTO  Z0CASE (z0_test0,z0_test1,Z0_TEST2)VALUES('abc ABC','abc ABC',1);
INSERT INTO  Z0CASE (z0_test0,z0_test1,Z0_TEST2)VALUES('中文字符@!#$%^','中文字符@!#$%^',12);
INSERT INTO  Z0CASE (z0_test0,z0_test1,Z0_TEST2)VALUES(NULL,NULL,0);
INSERT INTO  Z0CASE (z0_test0,z0_test1,Z0_TEST2)VALUES(111,111,11);
INSERT INTO  Z0CASE (z0_test0,z0_test1,Z0_TEST2)VALUES('1111.1111','1111.1111',100);
INSERT INTO  Z0CASE (z0_test0,z0_test1,Z0_TEST2)VALUES('2011-11-11 11:11:11','2011-11-11 11:11:11',20);
INSERT INTO  Z0CASE (z0_test0,z0_test1,Z0_TEST2)VALUES(20111111,20111111,15);
INSERT INTO  Z0CASE (z0_test0,z0_test1,Z0_TEST2)VALUES(NULL,NULL,30);
INSERT INTO  Z0CASE (z0_test0,z0_test1,Z0_TEST2)VALUES('','',10);
INSERT INTO  Z0CASE (z0_test0,z0_test1,Z0_TEST2)VALUES('    ',' ',240);
SELECT * FROM Z0CASE ORDER BY Z0_TEST2;
Z0_TEST0	Z0_TEST1	Z0_TEST2
NULL	NULL	0
abc ABC	abc ABC	1
		10
111	111	11
中文字符@!#$%^	中文字符@!#$%^	12
20111111	20111111	15
2011-11-11 11:11:11	2011-11-11 11:11:11	20
NULL	NULL	30
1111.1111	1111.1111	100
	 	240
SELECT table_id,table_name FROM oceanbase.__all_virtual_table WHERE table_name='Z0CASE';
ALTER TABLE Z0CASE MODIFY COLUMN z0_test0 BLOB(100);
SELECT * FROM Z0CASE ORDER BY Z0_TEST2;
z0_test0	Z0_TEST1	Z0_TEST2
NULL	NULL	0
abc ABC	abc ABC	1
		10
111	111	11
中文字符@!#$%^	中文字符@!#$%^	12
20111111	20111111	15
2011-11-11 11:11:11	2011-11-11 11:11:11	20
NULL	NULL	30
1111.1111	1111.1111	100
	 	240
DESC Z0CASE;
Field	Type	Null	Key	Default	Extra
z0_test0	tinyblob	YES		NULL	
Z0_TEST1	varchar(50)	YES		NULL	
Z0_TEST2	int(11)	YES		NULL	
SELECT table_id,table_name FROM oceanbase.__all_virtual_table WHERE table_name='Z0CASE';
ALTER TABLE Z0CASE MODIFY COLUMN z0_test0 BLOB(101);
DESC Z0CASE;
Field	Type	Null	Key	Default	Extra
z0_test0	tinyblob	YES		NULL	
Z0_TEST1	varchar(50)	YES		NULL	
Z0_TEST2	int(11)	YES		NULL	
SELECT table_id,table_name FROM oceanbase.__all_virtual_table WHERE table_name='Z0CASE';
ALTER TABLE Z0CASE MODIFY COLUMN z0_test0 BLOB(99);
DESC Z0CASE;
Field	Type	Null	Key	Default	Extra
z0_test0	tinyblob	YES		NULL	
Z0_TEST1	varchar(50)	YES		NULL	
Z0_TEST2	int(11)	YES		NULL	
SELECT table_id,table_name FROM oceanbase.__all_virtual_table WHERE table_name='Z0CASE';
CHAR --> TEXT
DROP TABLE Z0CASE;
CREATE TABLE Z0CASE(Z0_TEST0 CHAR(100), Z0_TEST1 VARCHAR(50),Z0_TEST2 INT) with column group (all columns, each column);
INSERT INTO  Z0CASE (z0_test0,z0_test1,Z0_TEST2)VALUES('abc ABC','abc ABC',1);
INSERT INTO  Z0CASE (z0_test0,z0_test1,Z0_TEST2)VALUES('中文字符@!#$%^','中文字符@!#$%^',12);
INSERT INTO  Z0CASE (z0_test0,z0_test1,Z0_TEST2)VALUES(NULL,NULL,30);
INSERT INTO  Z0CASE (z0_test0,z0_test1,Z0_TEST2)VALUES(111,111,11);
INSERT INTO  Z0CASE (z0_test0,z0_test1,Z0_TEST2)VALUES('1111.1111','1111.1111',100);
INSERT INTO  Z0CASE (z0_test0,z0_test1,Z0_TEST2)VALUES('2011-11-11 11:11:11','2011-11-11 11:11:11',20);
INSERT INTO  Z0CASE (z0_test0,z0_test1,Z0_TEST2)VALUES(20111111,20111111,41);
INSERT INTO  Z0CASE (z0_test0,z0_test1,Z0_TEST2)VALUES(NULL,NULL,0);
INSERT INTO  Z0CASE (z0_test0,z0_test1,Z0_TEST2)VALUES('','',10);
INSERT INTO  Z0CASE (z0_test0,z0_test1,Z0_TEST2)VALUES('    ',' ',250);
SELECT * FROM Z0CASE ORDER BY Z0_TEST2;
Z0_TEST0	Z0_TEST1	Z0_TEST2
NULL	NULL	0
abc ABC	abc ABC	1
		10
111	111	11
中文字符@!#$%^	中文字符@!#$%^	12
2011-11-11 11:11:11	2011-11-11 11:11:11	20
NULL	NULL	30
20111111	20111111	41
1111.1111	1111.1111	100
	 	250
SELECT table_id,table_name FROM oceanbase.__all_virtual_table WHERE table_name='Z0CASE';
ALTER TABLE Z0CASE MODIFY COLUMN z0_test0 TEXT(100);
SELECT * FROM Z0CASE ORDER BY Z0_TEST2;
z0_test0	Z0_TEST1	Z0_TEST2
NULL	NULL	0
abc ABC	abc ABC	1
		10
111	111	11
中文字符@!#$%^	中文字符@!#$%^	12
2011-11-11 11:11:11	2011-11-11 11:11:11	20
NULL	NULL	30
20111111	20111111	41
1111.1111	1111.1111	100
	 	250
DESC Z0CASE;
Field	Type	Null	Key	Default	Extra
z0_test0	text	YES		NULL	
Z0_TEST1	varchar(50)	YES		NULL	
Z0_TEST2	int(11)	YES		NULL	
SELECT table_id,table_name FROM oceanbase.__all_virtual_table WHERE table_name='Z0CASE';
ALTER TABLE Z0CASE MODIFY COLUMN z0_test0 TEXT(101);
DESC Z0CASE;
Field	Type	Null	Key	Default	Extra
z0_test0	text	YES		NULL	
Z0_TEST1	varchar(50)	YES		NULL	
Z0_TEST2	int(11)	YES		NULL	
SELECT table_id,table_name FROM oceanbase.__all_virtual_table WHERE table_name='Z0CASE';
ALTER TABLE Z0CASE MODIFY COLUMN z0_test0 TEXT(99);
DESC Z0CASE;
Field	Type	Null	Key	Default	Extra
z0_test0	text	YES		NULL	
Z0_TEST1	varchar(50)	YES		NULL	
Z0_TEST2	int(11)	YES		NULL	
SELECT table_id,table_name FROM oceanbase.__all_virtual_table WHERE table_name='Z0CASE';
CHAR --> SET
DROP TABLE Z0CASE;
CREATE TABLE Z0CASE(Z0_TEST0 CHAR(100), Z0_TEST1 VARCHAR(50),Z0_TEST2 INT) with column group (all columns, each column);
INSERT INTO  Z0CASE (z0_test0,z0_test1,Z0_TEST2)VALUES('abc ABC','abc ABC',1);
INSERT INTO  Z0CASE (z0_test0,z0_test1,Z0_TEST2)VALUES('中文字符@!#$%^','中文字符@!#$%^',11);
SELECT * FROM Z0CASE ORDER BY Z0_TEST2;
Z0_TEST0	Z0_TEST1	Z0_TEST2
abc ABC	abc ABC	1
中文字符@!#$%^	中文字符@!#$%^	11
SELECT table_id,table_name FROM oceanbase.__all_virtual_table WHERE table_name='Z0CASE';
ALTER TABLE Z0CASE MODIFY COLUMN z0_test0 SET('ABC','中文字符@!#$%^');
ERROR 01000: Data truncated for argument
ALTER TABLE Z0CASE MODIFY COLUMN z0_test0 SET('abc ABC','中文字符@!#$%^');
SELECT * FROM Z0CASE ORDER BY Z0_TEST2;
z0_test0	Z0_TEST1	Z0_TEST2
abc ABC	abc ABC	1
中文字符@!#$%^	中文字符@!#$%^	11
DESC Z0CASE;
Field	Type	Null	Key	Default	Extra
z0_test0	set('abc ABC','中文字符@!#$%^')	YES		NULL	
Z0_TEST1	varchar(50)	YES		NULL	
Z0_TEST2	int(11)	YES		NULL	
SELECT table_id,table_name FROM oceanbase.__all_virtual_table WHERE table_name='Z0CASE';
CHAR --> ENUM
DROP TABLE Z0CASE;
CREATE TABLE Z0CASE(Z0_TEST0 CHAR(100), Z0_TEST1 VARCHAR(50),Z0_TEST2 INT) with column group (all columns, each column);
INSERT INTO  Z0CASE (z0_test0,z0_test1,Z0_TEST2)VALUES('abc ABC','abc ABC',1);
INSERT INTO  Z0CASE (z0_test0,z0_test1,Z0_TEST2)VALUES('中文字符@!#$%^','中文字符@!#$%^',11);
SELECT * FROM Z0CASE ORDER BY Z0_TEST2;
Z0_TEST0	Z0_TEST1	Z0_TEST2
abc ABC	abc ABC	1
中文字符@!#$%^	中文字符@!#$%^	11
SELECT table_id,table_name FROM oceanbase.__all_virtual_table WHERE table_name='Z0CASE';
ALTER TABLE Z0CASE MODIFY COLUMN z0_test0 ENUM('ABC','中文字符@!#$%^') DEFAULT 'abc ABC';
ERROR 42000: Invalid default value for 'z0_test0'
ALTER TABLE Z0CASE MODIFY COLUMN z0_test0 ENUM('abc ABC','中文字符@!#$%^') DEFAULT 'abc ABC';
SELECT * FROM Z0CASE ORDER BY Z0_TEST2;
z0_test0	Z0_TEST1	Z0_TEST2
abc ABC	abc ABC	1
中文字符@!#$%^	中文字符@!#$%^	11
DESC Z0CASE;
Field	Type	Null	Key	Default	Extra
z0_test0	enum('abc ABC','中文字符@!#$%^')	YES		abc ABC	
Z0_TEST1	varchar(50)	YES		NULL	
Z0_TEST2	int(11)	YES		NULL	
SELECT table_id,table_name FROM oceanbase.__all_virtual_table WHERE table_name='Z0CASE';
DROP TABLE Z0CASE;
CREATE TABLE Z0CASE(Z0_TEST0 CHAR(100), Z0_TEST1 VARCHAR(50),Z0_TEST2 INT) with column group (all columns, each column);
INSERT INTO  Z0CASE (z0_test0,z0_test1,Z0_TEST2)VALUES(NULL,NULL,0);
INSERT INTO  Z0CASE (z0_test0,z0_test1,Z0_TEST2)VALUES(111,111,11);
INSERT INTO  Z0CASE (z0_test0,z0_test1,Z0_TEST2)VALUES('1111.1111','1111.1111',100);
INSERT INTO  Z0CASE (z0_test0,z0_test1,Z0_TEST2)VALUES('2011-11-11 11:11:11','2011-11-11 11:11:11',20);
INSERT INTO  Z0CASE (z0_test0,z0_test1,Z0_TEST2)VALUES(20111111,20111111,1);
INSERT INTO  Z0CASE (z0_test0,z0_test1,Z0_TEST2)VALUES(NULL,NULL,30);
INSERT INTO  Z0CASE (z0_test0,z0_test1,Z0_TEST2)VALUES(' ','',10);
SELECT * FROM Z0CASE ORDER BY Z0_TEST2;
Z0_TEST0	Z0_TEST1	Z0_TEST2
NULL	NULL	0
20111111	20111111	1
		10
111	111	11
2011-11-11 11:11:11	2011-11-11 11:11:11	20
NULL	NULL	30
1111.1111	1111.1111	100
SELECT table_id,table_name FROM oceanbase.__all_virtual_table WHERE table_name='Z0CASE';
ALTER TABLE Z0CASE MODIFY COLUMN z0_test0 ENUM('abc ABC','中文字符@!#$%^') DEFAULT 'abc ABC';
ERROR 01000: Data truncated for argument
CHAR --> INT,此处，INT类型后面的数字指的不是整数的长度，INT类型长度固定的。数字代表是的是：如果整数长度小于数字，则会把整数左边自动补上O，使之长度和数字一致，如果超长，则整数正常储存显示。
DROP TABLE Z0CASE;
CREATE TABLE Z0CASE(Z0_TEST0 CHAR(100), Z0_TEST1 VARCHAR(50),Z0_TEST2 INT) with column group (all columns, each column);
INSERT INTO  Z0CASE (z0_test0,z0_test1,Z0_TEST2)VALUES(NULL,NULL,0);
INSERT INTO  Z0CASE (z0_test0,z0_test1,Z0_TEST2)VALUES(111,111,11);
INSERT INTO  Z0CASE (z0_test0,z0_test1,Z0_TEST2)VALUES(111.1111,111,121);
INSERT INTO  Z0CASE (z0_test0,z0_test1,Z0_TEST2)VALUES(NULL,NULL,20);
SELECT * FROM Z0CASE ORDER BY Z0_TEST2;
Z0_TEST0	Z0_TEST1	Z0_TEST2
NULL	NULL	0
111	111	11
NULL	NULL	20
111.1111	111	121
SELECT table_id,table_name FROM oceanbase.__all_virtual_table WHERE table_name='Z0CASE';
ALTER TABLE Z0CASE MODIFY COLUMN z0_test0 INT(0);
SELECT * FROM Z0CASE ORDER BY Z0_TEST2;
z0_test0	Z0_TEST1	Z0_TEST2
NULL	NULL	0
111	111	11
NULL	NULL	20
111	111	121
DESC Z0CASE;
Field	Type	Null	Key	Default	Extra
z0_test0	int(11)	YES		NULL	
Z0_TEST1	varchar(50)	YES		NULL	
Z0_TEST2	int(11)	YES		NULL	
SELECT table_id,table_name FROM oceanbase.__all_virtual_table WHERE table_name='Z0CASE';
ALTER TABLE Z0CASE MODIFY COLUMN z0_test0 INT(1);
DESC Z0CASE;
Field	Type	Null	Key	Default	Extra
z0_test0	int(1)	YES		NULL	
Z0_TEST1	varchar(50)	YES		NULL	
Z0_TEST2	int(11)	YES		NULL	
SELECT table_id,table_name FROM oceanbase.__all_virtual_table WHERE table_name='Z0CASE';
DROP TABLE Z0CASE;
CREATE TABLE Z0CASE(Z0_TEST0 CHAR(100), Z0_TEST1 VARCHAR(50),Z0_TEST2 INT) with column group (all columns, each column);
INSERT INTO  Z0CASE (z0_test0,z0_test1,Z0_TEST2)VALUES('1111.1111','1111.1111',100);
INSERT INTO  Z0CASE (z0_test0,z0_test1,Z0_TEST2)VALUES('2011-11-11 11:11:11','2011-11-11 11:11:11',20);
INSERT INTO  Z0CASE (z0_test0,z0_test1,Z0_TEST2)VALUES(20111111,20111111,1);
INSERT INTO  Z0CASE (z0_test0,z0_test1,Z0_TEST2)VALUES(NULL,NULL,0);
INSERT INTO  Z0CASE (z0_test0,z0_test1,Z0_TEST2)VALUES('21132','',10);
ALTER TABLE Z0CASE MODIFY COLUMN z0_test0 INT(0);
ERROR 01000: Data truncated for argument
CHAR --> FLOAT
DROP TABLE Z0CASE;
CREATE TABLE Z0CASE(Z0_TEST0 CHAR(100), Z0_TEST1 VARCHAR(50),Z0_TEST2 INT) with column group (all columns, each column);
INSERT INTO  Z0CASE (z0_test0,z0_test1,Z0_TEST2)VALUES(NULL,NULL,0);
INSERT INTO  Z0CASE (z0_test0,z0_test1,Z0_TEST2)VALUES(111,111,1);
INSERT INTO  Z0CASE (z0_test0,z0_test1,Z0_TEST2)VALUES(111.1111,111,11);
INSERT INTO  Z0CASE (z0_test0,z0_test1,Z0_TEST2)VALUES(NULL,NULL,10);
SELECT * FROM Z0CASE ORDER BY Z0_TEST2;
Z0_TEST0	Z0_TEST1	Z0_TEST2
NULL	NULL	0
111	111	1
NULL	NULL	10
111.1111	111	11
SELECT table_id,table_name FROM oceanbase.__all_virtual_table WHERE table_name='Z0CASE';
ALTER TABLE Z0CASE MODIFY COLUMN z0_test0 FLOAT(7,0);
SELECT * FROM Z0CASE ORDER BY Z0_TEST2;
z0_test0	Z0_TEST1	Z0_TEST2
NULL	NULL	0
111	111	1
NULL	NULL	10
111	111	11
DESC Z0CASE;
Field	Type	Null	Key	Default	Extra
z0_test0	float(7,0)	YES		NULL	
Z0_TEST1	varchar(50)	YES		NULL	
Z0_TEST2	int(11)	YES		NULL	
SELECT table_id,table_name FROM oceanbase.__all_virtual_table WHERE table_name='Z0CASE';
ALTER TABLE Z0CASE MODIFY COLUMN z0_test0 FLOAT(1);
SELECT * FROM Z0CASE ORDER BY Z0_TEST2;
z0_test0	Z0_TEST1	Z0_TEST2
NULL	NULL	0
111	111	1
NULL	NULL	10
111	111	11
DESC Z0CASE;
Field	Type	Null	Key	Default	Extra
z0_test0	float	YES		NULL	
Z0_TEST1	varchar(50)	YES		NULL	
Z0_TEST2	int(11)	YES		NULL	
SELECT table_id,table_name FROM oceanbase.__all_virtual_table WHERE table_name='Z0CASE';
DROP TABLE Z0CASE;
CREATE TABLE Z0CASE(Z0_TEST0 CHAR(100), Z0_TEST1 VARCHAR(50),Z0_TEST2 INT) with column group (all columns, each column);
INSERT INTO  Z0CASE (z0_test0,z0_test1,Z0_TEST2)VALUES('1111.1111','1111.1111',100);
INSERT INTO  Z0CASE (z0_test0,z0_test1,Z0_TEST2)VALUES('2011-11-11 11:11:11','2011-11-11 11:11:11',20);
INSERT INTO  Z0CASE (z0_test0,z0_test1,Z0_TEST2)VALUES(20111111,20111111,1);
INSERT INTO  Z0CASE (z0_test0,z0_test1,Z0_TEST2)VALUES(NULL,NULL,0);
INSERT INTO  Z0CASE (z0_test0,z0_test1,Z0_TEST2)VALUES('21132','',10);
ALTER TABLE Z0CASE MODIFY COLUMN z0_test0 FLOAT(7,4);
ERROR 22003: Out of range value for column
CHAR --> DATE
DROP TABLE Z0CASE;
CREATE TABLE Z0CASE(Z0_TEST0 CHAR(100), Z0_TEST1 VARCHAR(50),Z0_TEST2 INT) with column group (all columns, each column);
INSERT INTO  Z0CASE (z0_test0,z0_test1,Z0_TEST2)VALUES('1111.1111','1111.1111',100);
INSERT INTO  Z0CASE (z0_test0,z0_test1,Z0_TEST2)VALUES('2011-11-11 11:11:11','2011-11-11 11:11:11',20);
INSERT INTO  Z0CASE (z0_test0,z0_test1,Z0_TEST2)VALUES(20111111,20111111,1);
INSERT INTO  Z0CASE (z0_test0,z0_test1,Z0_TEST2)VALUES(NULL,NULL,0);
SELECT * FROM Z0CASE ORDER BY Z0_TEST2;
Z0_TEST0	Z0_TEST1	Z0_TEST2
NULL	NULL	0
20111111	20111111	1
2011-11-11 11:11:11	2011-11-11 11:11:11	20
1111.1111	1111.1111	100
SELECT table_id,table_name FROM oceanbase.__all_virtual_table WHERE table_name='Z0CASE';
ALTER TABLE Z0CASE MODIFY COLUMN z0_test0 DATE;
SELECT * FROM Z0CASE ORDER BY Z0_TEST2;
z0_test0	Z0_TEST1	Z0_TEST2
NULL	NULL	0
2011-11-11	20111111	1
2011-11-11	2011-11-11 11:11:11	20
1111-11-11	1111.1111	100
DESC Z0CASE;
Field	Type	Null	Key	Default	Extra
z0_test0	date	YES		NULL	
Z0_TEST1	varchar(50)	YES		NULL	
Z0_TEST2	int(11)	YES		NULL	
SELECT table_id,table_name FROM oceanbase.__all_virtual_table WHERE table_name='Z0CASE';
DROP TABLE Z0CASE;
CREATE TABLE Z0CASE(Z0_TEST0 CHAR(100), Z0_TEST1 VARCHAR(50),Z0_TEST2 INT) with column group (all columns, each column);
INSERT INTO  Z0CASE (z0_test0,z0_test1,Z0_TEST2)VALUES('abc ABC','abc ABC',1);
INSERT INTO  Z0CASE (z0_test0,z0_test1,Z0_TEST2)VALUES('中文字符@!#$%^','中文字符@!#$%^',1);
INSERT INTO  Z0CASE (z0_test0,z0_test1,Z0_TEST2)VALUES(NULL,NULL,0);
INSERT INTO  Z0CASE (z0_test0,z0_test1,Z0_TEST2)VALUES(111,111,11);
INSERT INTO  Z0CASE (z0_test0,z0_test1,Z0_TEST2)VALUES('1111.1111','1111.1111',100);
INSERT INTO  Z0CASE (z0_test0,z0_test1,Z0_TEST2)VALUES('2011-11-11 11:11:11','2011-11-11 11:11:11',20);
INSERT INTO  Z0CASE (z0_test0,z0_test1,Z0_TEST2)VALUES(20111111,20111111,1);
INSERT INTO  Z0CASE (z0_test0,z0_test1,Z0_TEST2)VALUES(NULL,NULL,0);
INSERT INTO  Z0CASE (z0_test0,z0_test1,Z0_TEST2)VALUES(' ','',10);
ALTER TABLE Z0CASE MODIFY COLUMN z0_test0 DATE;
ERROR 22007: Incorrect value
ALTER TABLE Z0CASE modify( z0_test0 DATE);
ERROR 42000: You have an error in your SQL syntax; check the manual that corresponds to your OceanBase version for the right syntax to use near '( z0_test0 DATE)' at line 1
VARCHAR --> VARCHAR
DROP TABLE Z0CASE;
CREATE TABLE Z0CASE(Z0_TEST0 VARCHAR(100), Z0_TEST1 VARCHAR(50),Z0_TEST2 INT) with column group (all columns, each column);
INSERT INTO  Z0CASE (z0_test0,z0_test1,Z0_TEST2)VALUES('abc ABC','abc ABC',1);
INSERT INTO  Z0CASE (z0_test0,z0_test1,Z0_TEST2)VALUES('中文字符@!#$%^','中文字符@!#$%^',21);
INSERT INTO  Z0CASE (z0_test0,z0_test1,Z0_TEST2)VALUES(NULL,NULL,30);
INSERT INTO  Z0CASE (z0_test0,z0_test1,Z0_TEST2)VALUES(111,111,11);
INSERT INTO  Z0CASE (z0_test0,z0_test1,Z0_TEST2)VALUES('1111.1111','1111.1111',100);
INSERT INTO  Z0CASE (z0_test0,z0_test1,Z0_TEST2)VALUES('2011-11-11 11:11:11','2011-11-11 11:11:11',20);
INSERT INTO  Z0CASE (z0_test0,z0_test1,Z0_TEST2)VALUES(20111111,20111111,41);
INSERT INTO  Z0CASE (z0_test0,z0_test1,Z0_TEST2)VALUES(NULL,NULL,0);
INSERT INTO  Z0CASE (z0_test0,z0_test1,Z0_TEST2)VALUES(' ','',10);
SELECT * FROM Z0CASE ORDER BY Z0_TEST2;
Z0_TEST0	Z0_TEST1	Z0_TEST2
NULL	NULL	0
abc ABC	abc ABC	1
 		10
111	111	11
2011-11-11 11:11:11	2011-11-11 11:11:11	20
中文字符@!#$%^	中文字符@!#$%^	21
NULL	NULL	30
20111111	20111111	41
1111.1111	1111.1111	100
SELECT table_id,table_name FROM oceanbase.__all_virtual_table WHERE table_name='Z0CASE';
VARCHAR --> VARCHAR
ALTER TABLE Z0CASE MODIFY COLUMN z0_test0 VARCHAR(101) DEFAULT 123;
SELECT * FROM Z0CASE ORDER BY Z0_TEST2;
z0_test0	Z0_TEST1	Z0_TEST2
NULL	NULL	0
abc ABC	abc ABC	1
 		10
111	111	11
2011-11-11 11:11:11	2011-11-11 11:11:11	20
中文字符@!#$%^	中文字符@!#$%^	21
NULL	NULL	30
20111111	20111111	41
1111.1111	1111.1111	100
DESC Z0CASE;
Field	Type	Null	Key	Default	Extra
z0_test0	varchar(101)	YES		123	
Z0_TEST1	varchar(50)	YES		NULL	
Z0_TEST2	int(11)	YES		NULL	
SELECT table_id,table_name FROM oceanbase.__all_virtual_table WHERE table_name='Z0CASE';
ALTER TABLE Z0CASE MODIFY COLUMN z0_test0 VARCHAR(100);
SELECT * FROM Z0CASE ORDER BY Z0_TEST2;
z0_test0	Z0_TEST1	Z0_TEST2
NULL	NULL	0
abc ABC	abc ABC	1
 		10
111	111	11
2011-11-11 11:11:11	2011-11-11 11:11:11	20
中文字符@!#$%^	中文字符@!#$%^	21
NULL	NULL	30
20111111	20111111	41
1111.1111	1111.1111	100
DESC Z0CASE;
Field	Type	Null	Key	Default	Extra
z0_test0	varchar(100)	YES		NULL	
Z0_TEST1	varchar(50)	YES		NULL	
Z0_TEST2	int(11)	YES		NULL	
SELECT table_id,table_name FROM oceanbase.__all_virtual_table WHERE table_name='Z0CASE';
ALTER TABLE Z0CASE MODIFY COLUMN z0_test0 VARCHAR(101);
DESC Z0CASE;
Field	Type	Null	Key	Default	Extra
z0_test0	varchar(101)	YES		NULL	
Z0_TEST1	varchar(50)	YES		NULL	
Z0_TEST2	int(11)	YES		NULL	
SELECT table_id,table_name FROM oceanbase.__all_virtual_table WHERE table_name='Z0CASE';
VARCHAR --> CHAR
DROP TABLE Z0CASE;
CREATE TABLE Z0CASE(Z0_TEST0 VARCHAR(100), Z0_TEST1 VARCHAR(50),Z0_TEST2 INT) with column group (all columns, each column);
INSERT INTO  Z0CASE (z0_test0,z0_test1,Z0_TEST2)VALUES('abc ABC','abc ABC',1);
INSERT INTO  Z0CASE (z0_test0,z0_test1,Z0_TEST2)VALUES('中文字符@!#$%^','中文字符@!#$%^',12);
INSERT INTO  Z0CASE (z0_test0,z0_test1,Z0_TEST2)VALUES(NULL,NULL,30);
INSERT INTO  Z0CASE (z0_test0,z0_test1,Z0_TEST2)VALUES(111,111,11);
INSERT INTO  Z0CASE (z0_test0,z0_test1,Z0_TEST2)VALUES('1111.1111','1111.1111',100);
INSERT INTO  Z0CASE (z0_test0,z0_test1,Z0_TEST2)VALUES('2011-11-11 11:11:11','2011-11-11 11:11:11',20);
INSERT INTO  Z0CASE (z0_test0,z0_test1,Z0_TEST2)VALUES(20111111,20111111,14);
INSERT INTO  Z0CASE (z0_test0,z0_test1,Z0_TEST2)VALUES(NULL,NULL,0);
SELECT * FROM Z0CASE ORDER BY Z0_TEST2;
Z0_TEST0	Z0_TEST1	Z0_TEST2
NULL	NULL	0
abc ABC	abc ABC	1
111	111	11
中文字符@!#$%^	中文字符@!#$%^	12
20111111	20111111	14
2011-11-11 11:11:11	2011-11-11 11:11:11	20
NULL	NULL	30
1111.1111	1111.1111	100
SELECT table_id,table_name FROM oceanbase.__all_virtual_table WHERE table_name='Z0CASE';
ALTER TABLE Z0CASE MODIFY COLUMN z0_test0 CHAR(101) DEFAULT 123;
SELECT * FROM Z0CASE ORDER BY Z0_TEST2;
z0_test0	Z0_TEST1	Z0_TEST2
NULL	NULL	0
abc ABC	abc ABC	1
111	111	11
中文字符@!#$%^	中文字符@!#$%^	12
20111111	20111111	14
2011-11-11 11:11:11	2011-11-11 11:11:11	20
NULL	NULL	30
1111.1111	1111.1111	100
DESC Z0CASE;
Field	Type	Null	Key	Default	Extra
z0_test0	char(101)	YES		123	
Z0_TEST1	varchar(50)	YES		NULL	
Z0_TEST2	int(11)	YES		NULL	
SELECT table_id,table_name FROM oceanbase.__all_virtual_table WHERE table_name='Z0CASE';
ALTER TABLE Z0CASE MODIFY COLUMN z0_test0 CHAR(99);
SELECT * FROM Z0CASE ORDER BY Z0_TEST2;
z0_test0	Z0_TEST1	Z0_TEST2
NULL	NULL	0
abc ABC	abc ABC	1
111	111	11
中文字符@!#$%^	中文字符@!#$%^	12
20111111	20111111	14
2011-11-11 11:11:11	2011-11-11 11:11:11	20
NULL	NULL	30
1111.1111	1111.1111	100
DESC Z0CASE;
Field	Type	Null	Key	Default	Extra
z0_test0	char(99)	YES		NULL	
Z0_TEST1	varchar(50)	YES		NULL	
Z0_TEST2	int(11)	YES		NULL	
SELECT table_id,table_name FROM oceanbase.__all_virtual_table WHERE table_name='Z0CASE';
ALTER TABLE Z0CASE MODIFY COLUMN z0_test0 CHAR(100);
DESC Z0CASE;
Field	Type	Null	Key	Default	Extra
z0_test0	char(100)	YES		NULL	
Z0_TEST1	varchar(50)	YES		NULL	
Z0_TEST2	int(11)	YES		NULL	
SELECT table_id,table_name FROM oceanbase.__all_virtual_table WHERE table_name='Z0CASE';
VARCHAR --> BLOB
DROP TABLE Z0CASE;
CREATE TABLE Z0CASE(Z0_TEST0 VARCHAR(100), Z0_TEST1 VARCHAR(50),Z0_TEST2 INT) with column group (all columns, each column);
INSERT INTO  Z0CASE (z0_test0,z0_test1,Z0_TEST2)VALUES('abc ABC','abc ABC',1);
INSERT INTO  Z0CASE (z0_test0,z0_test1,Z0_TEST2)VALUES('中文字符@!#$%^','中文字符@!#$%^',21);
INSERT INTO  Z0CASE (z0_test0,z0_test1,Z0_TEST2)VALUES(NULL,NULL,0);
INSERT INTO  Z0CASE (z0_test0,z0_test1,Z0_TEST2)VALUES(111,111,11);
INSERT INTO  Z0CASE (z0_test0,z0_test1,Z0_TEST2)VALUES('1111.1111','1111.1111',100);
INSERT INTO  Z0CASE (z0_test0,z0_test1,Z0_TEST2)VALUES('2011-11-11 11:11:11','2011-11-11 11:11:11',20);
INSERT INTO  Z0CASE (z0_test0,z0_test1,Z0_TEST2)VALUES(20111111,20111111,31);
INSERT INTO  Z0CASE (z0_test0,z0_test1,Z0_TEST2)VALUES(NULL,NULL,40);
INSERT INTO  Z0CASE (z0_test0,z0_test1,Z0_TEST2)VALUES(' ','',10);
SELECT * FROM Z0CASE ORDER BY Z0_TEST2;
Z0_TEST0	Z0_TEST1	Z0_TEST2
NULL	NULL	0
abc ABC	abc ABC	1
 		10
111	111	11
2011-11-11 11:11:11	2011-11-11 11:11:11	20
中文字符@!#$%^	中文字符@!#$%^	21
20111111	20111111	31
NULL	NULL	40
1111.1111	1111.1111	100
SELECT table_id,table_name FROM oceanbase.__all_virtual_table WHERE table_name='Z0CASE';
ALTER TABLE Z0CASE MODIFY COLUMN z0_test0 BLOB(101) ;
SELECT * FROM Z0CASE ORDER BY Z0_TEST2;
z0_test0	Z0_TEST1	Z0_TEST2
NULL	NULL	0
abc ABC	abc ABC	1
 		10
111	111	11
2011-11-11 11:11:11	2011-11-11 11:11:11	20
中文字符@!#$%^	中文字符@!#$%^	21
20111111	20111111	31
NULL	NULL	40
1111.1111	1111.1111	100
DESC Z0CASE;
Field	Type	Null	Key	Default	Extra
z0_test0	tinyblob	YES		NULL	
Z0_TEST1	varchar(50)	YES		NULL	
Z0_TEST2	int(11)	YES		NULL	
SELECT table_id,table_name FROM oceanbase.__all_virtual_table WHERE table_name='Z0CASE';
DROP TABLE Z0CASE;
CREATE TABLE Z0CASE(Z0_TEST0 VARCHAR(100), Z0_TEST1 VARCHAR(50),Z0_TEST2 INT) with column group (all columns, each column);
INSERT INTO  Z0CASE (z0_test0,z0_test1,Z0_TEST2)VALUES('abc ABC','abc ABC',1);
INSERT INTO  Z0CASE (z0_test0,z0_test1,Z0_TEST2)VALUES('中文字符@!#$%^','中文字符@!#$%^',21);
INSERT INTO  Z0CASE (z0_test0,z0_test1,Z0_TEST2)VALUES(NULL,NULL,0);
INSERT INTO  Z0CASE (z0_test0,z0_test1,Z0_TEST2)VALUES(111,111,11);
INSERT INTO  Z0CASE (z0_test0,z0_test1,Z0_TEST2)VALUES('1111.1111','1111.1111',100);
INSERT INTO  Z0CASE (z0_test0,z0_test1,Z0_TEST2)VALUES('2011-11-11 11:11:11','2011-11-11 11:11:11',20);
INSERT INTO  Z0CASE (z0_test0,z0_test1,Z0_TEST2)VALUES(20111111,20111111,41);
INSERT INTO  Z0CASE (z0_test0,z0_test1,Z0_TEST2)VALUES(NULL,NULL,30);
INSERT INTO  Z0CASE (z0_test0,z0_test1,Z0_TEST2)VALUES(' ','',10);
SELECT * FROM Z0CASE ORDER BY Z0_TEST2;
Z0_TEST0	Z0_TEST1	Z0_TEST2
NULL	NULL	0
abc ABC	abc ABC	1
 		10
111	111	11
2011-11-11 11:11:11	2011-11-11 11:11:11	20
中文字符@!#$%^	中文字符@!#$%^	21
NULL	NULL	30
20111111	20111111	41
1111.1111	1111.1111	100
SELECT table_id,table_name FROM oceanbase.__all_virtual_table WHERE table_name='Z0CASE';
ALTER TABLE Z0CASE MODIFY COLUMN z0_test0 BLOB(100);
SELECT * FROM Z0CASE ORDER BY Z0_TEST2;
z0_test0	Z0_TEST1	Z0_TEST2
NULL	NULL	0
abc ABC	abc ABC	1
 		10
111	111	11
2011-11-11 11:11:11	2011-11-11 11:11:11	20
中文字符@!#$%^	中文字符@!#$%^	21
NULL	NULL	30
20111111	20111111	41
1111.1111	1111.1111	100
DESC Z0CASE;
Field	Type	Null	Key	Default	Extra
z0_test0	tinyblob	YES		NULL	
Z0_TEST1	varchar(50)	YES		NULL	
Z0_TEST2	int(11)	YES		NULL	
SELECT table_id,table_name FROM oceanbase.__all_virtual_table WHERE table_name='Z0CASE';
DROP TABLE Z0CASE;
CREATE TABLE Z0CASE(Z0_TEST0 VARCHAR(100), Z0_TEST1 VARCHAR(50),Z0_TEST2 INT) with column group (all columns, each column);
INSERT INTO  Z0CASE (z0_test0,z0_test1,Z0_TEST2)VALUES('abc ABC','abc ABC',1);
INSERT INTO  Z0CASE (z0_test0,z0_test1,Z0_TEST2)VALUES('中文字符@!#$%^','中文字符@!#$%^',21);
INSERT INTO  Z0CASE (z0_test0,z0_test1,Z0_TEST2)VALUES(NULL,NULL,30);
INSERT INTO  Z0CASE (z0_test0,z0_test1,Z0_TEST2)VALUES(111,111,11);
INSERT INTO  Z0CASE (z0_test0,z0_test1,Z0_TEST2)VALUES('1111.1111','1111.1111',100);
INSERT INTO  Z0CASE (z0_test0,z0_test1,Z0_TEST2)VALUES('2011-11-11 11:11:11','2011-11-11 11:11:11',20);
INSERT INTO  Z0CASE (z0_test0,z0_test1,Z0_TEST2)VALUES(20111111,20111111,41);
INSERT INTO  Z0CASE (z0_test0,z0_test1,Z0_TEST2)VALUES(NULL,NULL,0);
INSERT INTO  Z0CASE (z0_test0,z0_test1,Z0_TEST2)VALUES(' ','',10);
SELECT * FROM Z0CASE ORDER BY Z0_TEST2;
Z0_TEST0	Z0_TEST1	Z0_TEST2
NULL	NULL	0
abc ABC	abc ABC	1
 		10
111	111	11
2011-11-11 11:11:11	2011-11-11 11:11:11	20
中文字符@!#$%^	中文字符@!#$%^	21
NULL	NULL	30
20111111	20111111	41
1111.1111	1111.1111	100
SELECT table_id,table_name FROM oceanbase.__all_virtual_table WHERE table_name='Z0CASE';
ALTER TABLE Z0CASE MODIFY COLUMN z0_test0 BLOB(99);
SELECT * FROM Z0CASE ORDER BY Z0_TEST2;
z0_test0	Z0_TEST1	Z0_TEST2
NULL	NULL	0
abc ABC	abc ABC	1
 		10
111	111	11
2011-11-11 11:11:11	2011-11-11 11:11:11	20
中文字符@!#$%^	中文字符@!#$%^	21
NULL	NULL	30
20111111	20111111	41
1111.1111	1111.1111	100
DESC Z0CASE;
Field	Type	Null	Key	Default	Extra
z0_test0	tinyblob	YES		NULL	
Z0_TEST1	varchar(50)	YES		NULL	
Z0_TEST2	int(11)	YES		NULL	
SELECT table_id,table_name FROM oceanbase.__all_virtual_table WHERE table_name='Z0CASE';
VARCHAR --> TEXT
DROP TABLE Z0CASE;
CREATE TABLE Z0CASE(Z0_TEST0 VARCHAR(100), Z0_TEST1 VARCHAR(50),Z0_TEST2 INT) with column group (all columns, each column);
INSERT INTO  Z0CASE (z0_test0,z0_test1,Z0_TEST2)VALUES('abc ABC','abc ABC',1);
INSERT INTO  Z0CASE (z0_test0,z0_test1,Z0_TEST2)VALUES('中文字符@!#$%^','中文字符@!#$%^',21);
INSERT INTO  Z0CASE (z0_test0,z0_test1,Z0_TEST2)VALUES(NULL,NULL,30);
INSERT INTO  Z0CASE (z0_test0,z0_test1,Z0_TEST2)VALUES(111,111,11);
INSERT INTO  Z0CASE (z0_test0,z0_test1,Z0_TEST2)VALUES('1111.1111','1111.1111',100);
INSERT INTO  Z0CASE (z0_test0,z0_test1,Z0_TEST2)VALUES('2011-11-11 11:11:11','2011-11-11 11:11:11',20);
INSERT INTO  Z0CASE (z0_test0,z0_test1,Z0_TEST2)VALUES(20111111,20111111,41);
INSERT INTO  Z0CASE (z0_test0,z0_test1,Z0_TEST2)VALUES(NULL,NULL,0);
INSERT INTO  Z0CASE (z0_test0,z0_test1,Z0_TEST2)VALUES(' ','',10);
SELECT * FROM Z0CASE ORDER BY Z0_TEST2;
Z0_TEST0	Z0_TEST1	Z0_TEST2
NULL	NULL	0
abc ABC	abc ABC	1
 		10
111	111	11
2011-11-11 11:11:11	2011-11-11 11:11:11	20
中文字符@!#$%^	中文字符@!#$%^	21
NULL	NULL	30
20111111	20111111	41
1111.1111	1111.1111	100
SELECT table_id,table_name FROM oceanbase.__all_virtual_table WHERE table_name='Z0CASE';
ALTER TABLE Z0CASE MODIFY COLUMN z0_test0 TEXT(101) ;
SELECT * FROM Z0CASE ORDER BY Z0_TEST2;
z0_test0	Z0_TEST1	Z0_TEST2
NULL	NULL	0
abc ABC	abc ABC	1
 		10
111	111	11
2011-11-11 11:11:11	2011-11-11 11:11:11	20
中文字符@!#$%^	中文字符@!#$%^	21
NULL	NULL	30
20111111	20111111	41
1111.1111	1111.1111	100
DESC Z0CASE;
Field	Type	Null	Key	Default	Extra
z0_test0	text	YES		NULL	
Z0_TEST1	varchar(50)	YES		NULL	
Z0_TEST2	int(11)	YES		NULL	
SELECT table_id,table_name FROM oceanbase.__all_virtual_table WHERE table_name='Z0CASE';
DROP TABLE Z0CASE;
CREATE TABLE Z0CASE(Z0_TEST0 VARCHAR(100), Z0_TEST1 VARCHAR(50),Z0_TEST2 INT) with column group (all columns, each column);
INSERT INTO  Z0CASE (z0_test0,z0_test1,Z0_TEST2)VALUES('abc ABC','abc ABC',1);
INSERT INTO  Z0CASE (z0_test0,z0_test1,Z0_TEST2)VALUES('中文字符@!#$%^','中文字符@!#$%^',21);
INSERT INTO  Z0CASE (z0_test0,z0_test1,Z0_TEST2)VALUES(NULL,NULL,0);
INSERT INTO  Z0CASE (z0_test0,z0_test1,Z0_TEST2)VALUES(111,111,11);
INSERT INTO  Z0CASE (z0_test0,z0_test1,Z0_TEST2)VALUES('1111.1111','1111.1111',100);
INSERT INTO  Z0CASE (z0_test0,z0_test1,Z0_TEST2)VALUES('2011-11-11 11:11:11','2011-11-11 11:11:11',20);
INSERT INTO  Z0CASE (z0_test0,z0_test1,Z0_TEST2)VALUES(20111111,20111111,31);
INSERT INTO  Z0CASE (z0_test0,z0_test1,Z0_TEST2)VALUES(NULL,NULL,40);
INSERT INTO  Z0CASE (z0_test0,z0_test1,Z0_TEST2)VALUES(' ','',10);
SELECT * FROM Z0CASE ORDER BY Z0_TEST2;
Z0_TEST0	Z0_TEST1	Z0_TEST2
NULL	NULL	0
abc ABC	abc ABC	1
 		10
111	111	11
2011-11-11 11:11:11	2011-11-11 11:11:11	20
中文字符@!#$%^	中文字符@!#$%^	21
20111111	20111111	31
NULL	NULL	40
1111.1111	1111.1111	100
SELECT table_id,table_name FROM oceanbase.__all_virtual_table WHERE table_name='Z0CASE';
ALTER TABLE Z0CASE MODIFY COLUMN z0_test0 TEXT(100);
SELECT * FROM Z0CASE ORDER BY Z0_TEST2;
z0_test0	Z0_TEST1	Z0_TEST2
NULL	NULL	0
abc ABC	abc ABC	1
 		10
111	111	11
2011-11-11 11:11:11	2011-11-11 11:11:11	20
中文字符@!#$%^	中文字符@!#$%^	21
20111111	20111111	31
NULL	NULL	40
1111.1111	1111.1111	100
DESC Z0CASE;
Field	Type	Null	Key	Default	Extra
z0_test0	text	YES		NULL	
Z0_TEST1	varchar(50)	YES		NULL	
Z0_TEST2	int(11)	YES		NULL	
SELECT table_id,table_name FROM oceanbase.__all_virtual_table WHERE table_name='Z0CASE';
DROP TABLE Z0CASE;
CREATE TABLE Z0CASE(Z0_TEST0 VARCHAR(100), Z0_TEST1 VARCHAR(50),Z0_TEST2 INT) with column group (all columns, each column);
INSERT INTO  Z0CASE (z0_test0,z0_test1,Z0_TEST2)VALUES('abc ABC','abc ABC',1);
INSERT INTO  Z0CASE (z0_test0,z0_test1,Z0_TEST2)VALUES('中文字符@!#$%^','中文字符@!#$%^',21);
INSERT INTO  Z0CASE (z0_test0,z0_test1,Z0_TEST2)VALUES(NULL,NULL,30);
INSERT INTO  Z0CASE (z0_test0,z0_test1,Z0_TEST2)VALUES(111,111,11);
INSERT INTO  Z0CASE (z0_test0,z0_test1,Z0_TEST2)VALUES('1111.1111','1111.1111',100);
INSERT INTO  Z0CASE (z0_test0,z0_test1,Z0_TEST2)VALUES('2011-11-11 11:11:11','2011-11-11 11:11:11',20);
INSERT INTO  Z0CASE (z0_test0,z0_test1,Z0_TEST2)VALUES(20111111,20111111,41);
INSERT INTO  Z0CASE (z0_test0,z0_test1,Z0_TEST2)VALUES(NULL,NULL,0);
INSERT INTO  Z0CASE (z0_test0,z0_test1,Z0_TEST2)VALUES(' ','',10);
SELECT * FROM Z0CASE ORDER BY Z0_TEST2;
Z0_TEST0	Z0_TEST1	Z0_TEST2
NULL	NULL	0
abc ABC	abc ABC	1
 		10
111	111	11
2011-11-11 11:11:11	2011-11-11 11:11:11	20
中文字符@!#$%^	中文字符@!#$%^	21
NULL	NULL	30
20111111	20111111	41
1111.1111	1111.1111	100
SELECT table_id,table_name FROM oceanbase.__all_virtual_table WHERE table_name='Z0CASE';
ALTER TABLE Z0CASE MODIFY COLUMN z0_test0 TEXT(99);
SELECT * FROM Z0CASE ORDER BY Z0_TEST2;
z0_test0	Z0_TEST1	Z0_TEST2
NULL	NULL	0
abc ABC	abc ABC	1
 		10
111	111	11
2011-11-11 11:11:11	2011-11-11 11:11:11	20
中文字符@!#$%^	中文字符@!#$%^	21
NULL	NULL	30
20111111	20111111	41
1111.1111	1111.1111	100
DESC Z0CASE;
Field	Type	Null	Key	Default	Extra
z0_test0	text	YES		NULL	
Z0_TEST1	varchar(50)	YES		NULL	
Z0_TEST2	int(11)	YES		NULL	
SELECT table_id,table_name FROM oceanbase.__all_virtual_table WHERE table_name='Z0CASE';
VARCHAR --> BLOB 
DROP TABLE Z0CASE;
CREATE TABLE Z0CASE(Z0_TEST0 VARCHAR(100), Z0_TEST1 VARCHAR(50),Z0_TEST2 INT) with column group (all columns, each column);
INSERT INTO  Z0CASE (z0_test0,z0_test1,Z0_TEST2)VALUES('abc ABC','abc ABC',1);
INSERT INTO  Z0CASE (z0_test0,z0_test1,Z0_TEST2)VALUES('中文字符@!#$%^','中文字符@!#$%^',21);
INSERT INTO  Z0CASE (z0_test0,z0_test1,Z0_TEST2)VALUES(NULL,NULL,30);
INSERT INTO  Z0CASE (z0_test0,z0_test1,Z0_TEST2)VALUES(111,111,11);
INSERT INTO  Z0CASE (z0_test0,z0_test1,Z0_TEST2)VALUES('1111.1111','1111.1111',100);
INSERT INTO  Z0CASE (z0_test0,z0_test1,Z0_TEST2)VALUES('2011-11-11 11:11:11','2011-11-11 11:11:11',20);
INSERT INTO  Z0CASE (z0_test0,z0_test1,Z0_TEST2)VALUES(20111111,20111111,41);
INSERT INTO  Z0CASE (z0_test0,z0_test1,Z0_TEST2)VALUES(NULL,NULL,0);
INSERT INTO  Z0CASE (z0_test0,z0_test1,Z0_TEST2)VALUES(' ','',10);
SELECT * FROM Z0CASE ORDER BY Z0_TEST2;
Z0_TEST0	Z0_TEST1	Z0_TEST2
NULL	NULL	0
abc ABC	abc ABC	1
 		10
111	111	11
2011-11-11 11:11:11	2011-11-11 11:11:11	20
中文字符@!#$%^	中文字符@!#$%^	21
NULL	NULL	30
20111111	20111111	41
1111.1111	1111.1111	100
SELECT table_id,table_name FROM oceanbase.__all_virtual_table WHERE table_name='Z0CASE';
ALTER TABLE Z0CASE modify COLUMN z0_test0 BLOB;
SELECT * FROM Z0CASE ORDER BY Z0_TEST2;
z0_test0	Z0_TEST1	Z0_TEST2
NULL	NULL	0
abc ABC	abc ABC	1
 		10
111	111	11
2011-11-11 11:11:11	2011-11-11 11:11:11	20
中文字符@!#$%^	中文字符@!#$%^	21
NULL	NULL	30
20111111	20111111	41
1111.1111	1111.1111	100
DESC Z0CASE;
Field	Type	Null	Key	Default	Extra
z0_test0	blob	YES		NULL	
Z0_TEST1	varchar(50)	YES		NULL	
Z0_TEST2	int(11)	YES		NULL	
SELECT table_id,table_name FROM oceanbase.__all_virtual_table WHERE table_name='Z0CASE';
ALTER TABLE Z0CASE modify COLUMN z0_test1 BLOB;
SELECT * FROM Z0CASE ORDER BY Z0_TEST2;
z0_test0	z0_test1	Z0_TEST2
NULL	NULL	0
abc ABC	abc ABC	1
 		10
111	111	11
2011-11-11 11:11:11	2011-11-11 11:11:11	20
中文字符@!#$%^	中文字符@!#$%^	21
NULL	NULL	30
20111111	20111111	41
1111.1111	1111.1111	100
DESC Z0CASE;
Field	Type	Null	Key	Default	Extra
z0_test0	blob	YES		NULL	
z0_test1	blob	YES		NULL	
Z0_TEST2	int(11)	YES		NULL	
SELECT table_id,table_name FROM oceanbase.__all_virtual_table WHERE table_name='Z0CASE';
VARCHAR --> SET 
DROP TABLE Z0CASE;
CREATE TABLE Z0CASE(Z0_TEST0 VARCHAR(100), Z0_TEST1 VARCHAR(50),Z0_TEST2 INT) with column group (all columns, each column);
INSERT INTO  Z0CASE (z0_test0,z0_test1,Z0_TEST2)VALUES('abc ABC','abc ABC',1);
INSERT INTO  Z0CASE (z0_test0,z0_test1,Z0_TEST2)VALUES('中文字符@!#$%^','中文字符@!#$%^',11);
INSERT INTO  Z0CASE (z0_test0,z0_test1,Z0_TEST2)VALUES(NULL,NULL,0);
SELECT * FROM Z0CASE ORDER BY Z0_TEST2;
Z0_TEST0	Z0_TEST1	Z0_TEST2
NULL	NULL	0
abc ABC	abc ABC	1
中文字符@!#$%^	中文字符@!#$%^	11
SELECT table_id,table_name FROM oceanbase.__all_virtual_table WHERE table_name='Z0CASE';
ALTER TABLE Z0CASE MODIFY COLUMN z0_test0 SET('abc ABC','中文字符@!#$%^') ;
SELECT * FROM Z0CASE ORDER BY Z0_TEST2;
z0_test0	Z0_TEST1	Z0_TEST2
NULL	NULL	0
abc ABC	abc ABC	1
中文字符@!#$%^	中文字符@!#$%^	11
DESC Z0CASE;
Field	Type	Null	Key	Default	Extra
z0_test0	set('abc ABC','中文字符@!#$%^')	YES		NULL	
Z0_TEST1	varchar(50)	YES		NULL	
Z0_TEST2	int(11)	YES		NULL	
SELECT table_id,table_name FROM oceanbase.__all_virtual_table WHERE table_name='Z0CASE';
DROP TABLE Z0CASE;
CREATE TABLE Z0CASE(Z0_TEST0 VARCHAR(100), Z0_TEST1 VARCHAR(50),Z0_TEST2 INT) with column group (all columns, each column);
INSERT INTO  Z0CASE (z0_test0,z0_test1,Z0_TEST2)VALUES(111,111,11);
INSERT INTO  Z0CASE (z0_test0,z0_test1,Z0_TEST2)VALUES('1111.1111','1111.1111',100);
INSERT INTO  Z0CASE (z0_test0,z0_test1,Z0_TEST2)VALUES('2011-11-11 11:11:11','2011-11-11 11:11:11',20);
INSERT INTO  Z0CASE (z0_test0,z0_test1,Z0_TEST2)VALUES(20111111,20111111,1);
INSERT INTO  Z0CASE (z0_test0,z0_test1,Z0_TEST2)VALUES(NULL,NULL,0);
INSERT INTO  Z0CASE (z0_test0,z0_test1,Z0_TEST2)VALUES(' ','',10);
ALTER TABLE Z0CASE MODIFY COLUMN z0_test0 SET('abc ABC','中文字符@!#$%^',' ') ;
ERROR 01000: Data truncated for argument
VARCHAR --> ENUM 
DROP TABLE Z0CASE;
CREATE TABLE Z0CASE(Z0_TEST0 VARCHAR(100), Z0_TEST1 VARCHAR(50),Z0_TEST2 INT) with column group (all columns, each column);
INSERT INTO  Z0CASE (z0_test0,z0_test1,Z0_TEST2)VALUES('abc ABC','abc ABC',1);
INSERT INTO  Z0CASE (z0_test0,z0_test1,Z0_TEST2)VALUES('中文字符@!#$%^','中文字符@!#$%^',11);
INSERT INTO  Z0CASE (z0_test0,z0_test1,Z0_TEST2)VALUES(NULL,NULL,0);
SELECT * FROM Z0CASE ORDER BY Z0_TEST2;
Z0_TEST0	Z0_TEST1	Z0_TEST2
NULL	NULL	0
abc ABC	abc ABC	1
中文字符@!#$%^	中文字符@!#$%^	11
SELECT table_id,table_name FROM oceanbase.__all_virtual_table WHERE table_name='Z0CASE';
ALTER TABLE Z0CASE MODIFY COLUMN z0_test0 ENUM('abc ABC','中文字符@!#$%^') ;
SELECT * FROM Z0CASE ORDER BY Z0_TEST2;
z0_test0	Z0_TEST1	Z0_TEST2
NULL	NULL	0
abc ABC	abc ABC	1
中文字符@!#$%^	中文字符@!#$%^	11
DESC Z0CASE;
Field	Type	Null	Key	Default	Extra
z0_test0	enum('abc ABC','中文字符@!#$%^')	YES		NULL	
Z0_TEST1	varchar(50)	YES		NULL	
Z0_TEST2	int(11)	YES		NULL	
SELECT table_id,table_name FROM oceanbase.__all_virtual_table WHERE table_name='Z0CASE';
DROP TABLE Z0CASE;
CREATE TABLE Z0CASE(Z0_TEST0 VARCHAR(100), Z0_TEST1 VARCHAR(50),Z0_TEST2 INT) with column group (all columns, each column);
INSERT INTO  Z0CASE (z0_test0,z0_test1,Z0_TEST2)VALUES(111,111,11);
INSERT INTO  Z0CASE (z0_test0,z0_test1,Z0_TEST2)VALUES('1111.1111','1111.1111',100);
INSERT INTO  Z0CASE (z0_test0,z0_test1,Z0_TEST2)VALUES('2011-11-11 11:11:11','2011-11-11 11:11:11',20);
INSERT INTO  Z0CASE (z0_test0,z0_test1,Z0_TEST2)VALUES(20111111,20111111,1);
INSERT INTO  Z0CASE (z0_test0,z0_test1,Z0_TEST2)VALUES(NULL,NULL,0);
INSERT INTO  Z0CASE (z0_test0,z0_test1,Z0_TEST2)VALUES(' ','',10);
ALTER TABLE Z0CASE MODIFY COLUMN z0_test0 ENUM('abc ABC','中文字符@!#$%^',' ') ;
ERROR 01000: Data truncated for argument
VARCHAR --> DECIMAL
DROP TABLE Z0CASE;
CREATE TABLE Z0CASE(Z0_TEST0 VARCHAR(100), Z0_TEST1 VARCHAR(50),Z0_TEST2 INT) with column group (all columns, each column);
INSERT INTO  Z0CASE (z0_test0,z0_test1,Z0_TEST2)VALUES(111,111,11);
INSERT INTO  Z0CASE (z0_test0,z0_test1,Z0_TEST2)VALUES('1111.1111','1111.1111',100);
INSERT INTO  Z0CASE (z0_test0,z0_test1,Z0_TEST2)VALUES(NULL,NULL,0);
SELECT * FROM Z0CASE ORDER BY Z0_TEST2;
Z0_TEST0	Z0_TEST1	Z0_TEST2
NULL	NULL	0
111	111	11
1111.1111	1111.1111	100
SELECT table_id,table_name FROM oceanbase.__all_virtual_table WHERE table_name='Z0CASE';
ALTER TABLE Z0CASE MODIFY COLUMN z0_test0 DECIMAL(6,2) ;
SELECT * FROM Z0CASE ORDER BY Z0_TEST2;
z0_test0	Z0_TEST1	Z0_TEST2
NULL	NULL	0
111.00	111	11
1111.11	1111.1111	100
DESC Z0CASE;
Field	Type	Null	Key	Default	Extra
z0_test0	decimal(6,2)	YES		NULL	
Z0_TEST1	varchar(50)	YES		NULL	
Z0_TEST2	int(11)	YES		NULL	
SELECT table_id,table_name FROM oceanbase.__all_virtual_table WHERE table_name='Z0CASE';
DROP TABLE Z0CASE;
CREATE TABLE Z0CASE(Z0_TEST0 VARCHAR(100), Z0_TEST1 VARCHAR(50),Z0_TEST2 INT) with column group (all columns, each column);
INSERT INTO  Z0CASE (z0_test0,z0_test1,Z0_TEST2)VALUES(0.00,111,11);
INSERT INTO  Z0CASE (z0_test0,z0_test1,Z0_TEST2)VALUES('1111.1111','1111.1111',100);
INSERT INTO  Z0CASE (z0_test0,z0_test1,Z0_TEST2)VALUES('中文字符@!#$%^','中文字符@!#$%^',1);
INSERT INTO  Z0CASE (z0_test0,z0_test1,Z0_TEST2)VALUES('2011-11-11 11:11:11','2011-11-11 11:11:11',20);
ALTER TABLE Z0CASE MODIFY COLUMN z0_test0 DECIMAL(10,2) ;
ERROR 42000: Invalid numeric
VARCHAR --> DATE
DROP TABLE Z0CASE;
CREATE TABLE Z0CASE(Z0_TEST0 VARCHAR(100), Z0_TEST1 VARCHAR(50),Z0_TEST2 INT) with column group (all columns, each column);
INSERT INTO  Z0CASE (z0_test0,z0_test1,Z0_TEST2)VALUES('2011-11-11 11:11:11','2011-11-11 11:11:11',20);
INSERT INTO  Z0CASE (z0_test0,z0_test1,Z0_TEST2)VALUES('1111.1111','1111.1111',100);
INSERT INTO  Z0CASE (z0_test0,z0_test1,Z0_TEST2)VALUES(NULL,NULL,0);
SELECT * FROM Z0CASE ORDER BY Z0_TEST2;
Z0_TEST0	Z0_TEST1	Z0_TEST2
NULL	NULL	0
2011-11-11 11:11:11	2011-11-11 11:11:11	20
1111.1111	1111.1111	100
SELECT table_id,table_name FROM oceanbase.__all_virtual_table WHERE table_name='Z0CASE';
ALTER TABLE Z0CASE MODIFY COLUMN z0_test0 DATE ;
SELECT * FROM Z0CASE ORDER BY Z0_TEST2;
z0_test0	Z0_TEST1	Z0_TEST2
NULL	NULL	0
2011-11-11	2011-11-11 11:11:11	20
1111-11-11	1111.1111	100
DESC Z0CASE;
Field	Type	Null	Key	Default	Extra
z0_test0	date	YES		NULL	
Z0_TEST1	varchar(50)	YES		NULL	
Z0_TEST2	int(11)	YES		NULL	
SELECT table_id,table_name FROM oceanbase.__all_virtual_table WHERE table_name='Z0CASE';
DROP TABLE Z0CASE;
CREATE TABLE Z0CASE(Z0_TEST0 VARCHAR(100), Z0_TEST1 VARCHAR(50),Z0_TEST2 INT) with column group (all columns, each column);
INSERT INTO  Z0CASE (z0_test0,z0_test1,Z0_TEST2)VALUES(0.00,111,11);
INSERT INTO  Z0CASE (z0_test0,z0_test1,Z0_TEST2)VALUES('1111.1111','1111.1111',100);
INSERT INTO  Z0CASE (z0_test0,z0_test1,Z0_TEST2)VALUES('中文字符@!#$%^','中文字符@!#$%^',1);
INSERT INTO  Z0CASE (z0_test0,z0_test1,Z0_TEST2)VALUES('2011-11-11 11:11:11','2011-11-11 11:11:11',20);
ALTER TABLE Z0CASE MODIFY COLUMN z0_test0 DATE ;
ERROR 22007: Incorrect value
VARCHAR --> YEAR
DROP TABLE Z0CASE;
CREATE TABLE Z0CASE(Z0_TEST0 VARCHAR(100), Z0_TEST1 VARCHAR(50),Z0_TEST2 INT) with column group (all columns, each column);
INSERT INTO  Z0CASE (z0_test0,z0_test1,Z0_TEST2)VALUES('11.00','1111.1111',100);
INSERT INTO  Z0CASE (z0_test0,z0_test1,Z0_TEST2)VALUES('0.0','1111.1111',10);
INSERT INTO  Z0CASE (z0_test0,z0_test1,Z0_TEST2)VALUES(NULL,NULL,0);
SELECT * FROM Z0CASE ORDER BY Z0_TEST2;
Z0_TEST0	Z0_TEST1	Z0_TEST2
NULL	NULL	0
0.0	1111.1111	10
11.00	1111.1111	100
SELECT table_id,table_name FROM oceanbase.__all_virtual_table WHERE table_name='Z0CASE';
ALTER TABLE Z0CASE MODIFY COLUMN z0_test0 YEAR ;
SELECT * FROM Z0CASE ORDER BY Z0_TEST2;
z0_test0	Z0_TEST1	Z0_TEST2
NULL	NULL	0
2000	1111.1111	10
2011	1111.1111	100
DESC Z0CASE;
Field	Type	Null	Key	Default	Extra
z0_test0	year(4)	YES		NULL	
Z0_TEST1	varchar(50)	YES		NULL	
Z0_TEST2	int(11)	YES		NULL	
SELECT table_id,table_name FROM oceanbase.__all_virtual_table WHERE table_name='Z0CASE';
DROP TABLE Z0CASE;
CREATE TABLE Z0CASE(Z0_TEST0 VARCHAR(100), Z0_TEST1 VARCHAR(50),Z0_TEST2 INT) with column group (all columns, each column);
INSERT INTO  Z0CASE (z0_test0,z0_test1,Z0_TEST2)VALUES(0.00,111,11);
INSERT INTO  Z0CASE (z0_test0,z0_test1,Z0_TEST2)VALUES('1111.1111','1111.1111',100);
INSERT INTO  Z0CASE (z0_test0,z0_test1,Z0_TEST2)VALUES('2011-11-11 11:11:11','2011-11-11 11:11:11',20);
ALTER TABLE Z0CASE MODIFY COLUMN z0_test0 YEAR ;
ERROR 22003: Out of range value for column
BLOB
DROP TABLE Z0CASE;
CREATE TABLE Z0CASE(Z0_TEST0 TINYBLOB, Z0_TEST1 BLOB,Z0_TEST2 MEDIUMBLOB,Z0_TEST3 LONGBLOB) with column group (all columns, each column);
INSERT INTO  Z0CASE (z0_test0,z0_test1,Z0_TEST2,Z0_TEST3)VALUES('abc ABC','abc ABC','abc ABC','abc ABC');
INSERT INTO  Z0CASE (z0_test0,z0_test1,Z0_TEST2,Z0_TEST3)VALUES('中文字符@!#$%^','中文字符@!#$%^','中文字符@!#$%^','中文字符@!#$%^');
INSERT INTO  Z0CASE (z0_test0,z0_test1,Z0_TEST2,Z0_TEST3)VALUES('2011-11-11 11:11:11','2011-11-11 11:11:11',20,20);
INSERT INTO  Z0CASE (z0_test0,z0_test1,Z0_TEST2,Z0_TEST3)VALUES(NULL,NULL,0,0);
SELECT * FROM Z0CASE ORDER BY Z0_TEST2*1;
Z0_TEST0	Z0_TEST1	Z0_TEST2	Z0_TEST3
abc ABC	abc ABC	abc ABC	abc ABC
中文字符@!#$%^	中文字符@!#$%^	中文字符@!#$%^	中文字符@!#$%^
NULL	NULL	0	0
2011-11-11 11:11:11	2011-11-11 11:11:11	20	20
Warnings:
Warning	1292	Truncated incorrect DOUBLE value: 'abc ABC'
Warning	1292	Truncated incorrect DOUBLE value: '中文字符@!#$%^'
SELECT table_id,table_name FROM oceanbase.__all_virtual_table WHERE table_name='Z0CASE';
ALTER TABLE Z0CASE MODIFY COLUMN z0_test0 TINYBLOB ;
DESC Z0CASE;
Field	Type	Null	Key	Default	Extra
z0_test0	tinyblob	YES		NULL	
Z0_TEST1	blob	YES		NULL	
Z0_TEST2	mediumblob	YES		NULL	
Z0_TEST3	longblob	YES		NULL	
SELECT table_id,table_name FROM oceanbase.__all_virtual_table WHERE table_name='Z0CASE';
ALTER TABLE Z0CASE MODIFY COLUMN z0_test1 TINYBLOB ;
SELECT * FROM Z0CASE ORDER BY Z0_TEST2*1;
z0_test0	z0_test1	Z0_TEST2	Z0_TEST3
abc ABC	abc ABC	abc ABC	abc ABC
中文字符@!#$%^	中文字符@!#$%^	中文字符@!#$%^	中文字符@!#$%^
NULL	NULL	0	0
2011-11-11 11:11:11	2011-11-11 11:11:11	20	20
Warnings:
Warning	1292	Truncated incorrect DOUBLE value: 'abc ABC'
Warning	1292	Truncated incorrect DOUBLE value: '中文字符@!#$%^'
DESC Z0CASE;
Field	Type	Null	Key	Default	Extra
z0_test0	tinyblob	YES		NULL	
z0_test1	tinyblob	YES		NULL	
Z0_TEST2	mediumblob	YES		NULL	
Z0_TEST3	longblob	YES		NULL	
SELECT table_id,table_name FROM oceanbase.__all_virtual_table WHERE table_name='Z0CASE';
ALTER TABLE Z0CASE MODIFY COLUMN Z0_TEST2 TINYBLOB ;
SELECT * FROM Z0CASE ORDER BY Z0_TEST2*1;
z0_test0	z0_test1	Z0_TEST2	Z0_TEST3
abc ABC	abc ABC	abc ABC	abc ABC
中文字符@!#$%^	中文字符@!#$%^	中文字符@!#$%^	中文字符@!#$%^
NULL	NULL	0	0
2011-11-11 11:11:11	2011-11-11 11:11:11	20	20
Warnings:
Warning	1292	Truncated incorrect DOUBLE value: 'abc ABC'
Warning	1292	Truncated incorrect DOUBLE value: '中文字符@!#$%^'
DESC Z0CASE;
Field	Type	Null	Key	Default	Extra
z0_test0	tinyblob	YES		NULL	
z0_test1	tinyblob	YES		NULL	
Z0_TEST2	tinyblob	YES		NULL	
Z0_TEST3	longblob	YES		NULL	
SELECT table_id,table_name FROM oceanbase.__all_virtual_table WHERE table_name='Z0CASE';
DROP TABLE Z0CASE;
CREATE TABLE Z0CASE(Z0_TEST0 TINYBLOB, Z0_TEST1 BLOB,Z0_TEST2 MEDIUMBLOB,Z0_TEST3 LONGBLOB) with column group (all columns, each column);
INSERT INTO  Z0CASE (z0_test0,z0_test1,Z0_TEST2,Z0_TEST3)VALUES('abc ABC','abc ABC','abc ABC','abc ABC');
INSERT INTO  Z0CASE (z0_test0,z0_test1,Z0_TEST2,Z0_TEST3)VALUES('中文字符@!#$%^','中文字符@!#$%^','中文字符@!#$%^','中文字符@!#$%^');
INSERT INTO  Z0CASE (z0_test0,z0_test1,Z0_TEST2,Z0_TEST3)VALUES('2011-11-11 11:11:11','2011-11-11 11:11:11',20,20);
INSERT INTO  Z0CASE (z0_test0,z0_test1,Z0_TEST2,Z0_TEST3)VALUES(NULL,NULL,0,0);
SELECT * FROM Z0CASE ORDER BY Z0_TEST2*1;
Z0_TEST0	Z0_TEST1	Z0_TEST2	Z0_TEST3
abc ABC	abc ABC	abc ABC	abc ABC
中文字符@!#$%^	中文字符@!#$%^	中文字符@!#$%^	中文字符@!#$%^
NULL	NULL	0	0
2011-11-11 11:11:11	2011-11-11 11:11:11	20	20
Warnings:
Warning	1292	Truncated incorrect DOUBLE value: 'abc ABC'
Warning	1292	Truncated incorrect DOUBLE value: '中文字符@!#$%^'
SELECT table_id,table_name FROM oceanbase.__all_virtual_table WHERE table_name='Z0CASE';
ALTER TABLE Z0CASE MODIFY COLUMN z0_test0 BLOB ;
SELECT * FROM Z0CASE ORDER BY Z0_TEST2*1;
z0_test0	Z0_TEST1	Z0_TEST2	Z0_TEST3
abc ABC	abc ABC	abc ABC	abc ABC
中文字符@!#$%^	中文字符@!#$%^	中文字符@!#$%^	中文字符@!#$%^
NULL	NULL	0	0
2011-11-11 11:11:11	2011-11-11 11:11:11	20	20
Warnings:
Warning	1292	Truncated incorrect DOUBLE value: 'abc ABC'
Warning	1292	Truncated incorrect DOUBLE value: '中文字符@!#$%^'
DESC Z0CASE;
Field	Type	Null	Key	Default	Extra
z0_test0	blob	YES		NULL	
Z0_TEST1	blob	YES		NULL	
Z0_TEST2	mediumblob	YES		NULL	
Z0_TEST3	longblob	YES		NULL	
SELECT table_id,table_name FROM oceanbase.__all_virtual_table WHERE table_name='Z0CASE';
ALTER TABLE Z0CASE MODIFY COLUMN z0_test1 BLOB;
SELECT * FROM Z0CASE ORDER BY Z0_TEST2*1;
z0_test0	z0_test1	Z0_TEST2	Z0_TEST3
abc ABC	abc ABC	abc ABC	abc ABC
中文字符@!#$%^	中文字符@!#$%^	中文字符@!#$%^	中文字符@!#$%^
NULL	NULL	0	0
2011-11-11 11:11:11	2011-11-11 11:11:11	20	20
Warnings:
Warning	1292	Truncated incorrect DOUBLE value: 'abc ABC'
Warning	1292	Truncated incorrect DOUBLE value: '中文字符@!#$%^'
DESC Z0CASE;
Field	Type	Null	Key	Default	Extra
z0_test0	blob	YES		NULL	
z0_test1	blob	YES		NULL	
Z0_TEST2	mediumblob	YES		NULL	
Z0_TEST3	longblob	YES		NULL	
SELECT table_id,table_name FROM oceanbase.__all_virtual_table WHERE table_name='Z0CASE';
ALTER TABLE Z0CASE MODIFY COLUMN Z0_TEST2 BLOB ;
SELECT * FROM Z0CASE ORDER BY Z0_TEST2*1;
z0_test0	z0_test1	Z0_TEST2	Z0_TEST3
abc ABC	abc ABC	abc ABC	abc ABC
中文字符@!#$%^	中文字符@!#$%^	中文字符@!#$%^	中文字符@!#$%^
NULL	NULL	0	0
2011-11-11 11:11:11	2011-11-11 11:11:11	20	20
Warnings:
Warning	1292	Truncated incorrect DOUBLE value: 'abc ABC'
Warning	1292	Truncated incorrect DOUBLE value: '中文字符@!#$%^'
DESC Z0CASE;
Field	Type	Null	Key	Default	Extra
z0_test0	blob	YES		NULL	
z0_test1	blob	YES		NULL	
Z0_TEST2	blob	YES		NULL	
Z0_TEST3	longblob	YES		NULL	
SELECT table_id,table_name FROM oceanbase.__all_virtual_table WHERE table_name='Z0CASE';
ALTER TABLE Z0CASE MODIFY COLUMN Z0_TEST3 BLOB;
SELECT * FROM Z0CASE ORDER BY Z0_TEST2*1;
z0_test0	z0_test1	Z0_TEST2	Z0_TEST3
abc ABC	abc ABC	abc ABC	abc ABC
中文字符@!#$%^	中文字符@!#$%^	中文字符@!#$%^	中文字符@!#$%^
NULL	NULL	0	0
2011-11-11 11:11:11	2011-11-11 11:11:11	20	20
Warnings:
Warning	1292	Truncated incorrect DOUBLE value: 'abc ABC'
Warning	1292	Truncated incorrect DOUBLE value: '中文字符@!#$%^'
DESC Z0CASE;
Field	Type	Null	Key	Default	Extra
z0_test0	blob	YES		NULL	
z0_test1	blob	YES		NULL	
Z0_TEST2	blob	YES		NULL	
Z0_TEST3	blob	YES		NULL	
SELECT table_id,table_name FROM oceanbase.__all_virtual_table WHERE table_name='Z0CASE';
DROP TABLE Z0CASE;
CREATE TABLE Z0CASE(Z0_TEST0 TINYBLOB, Z0_TEST1 BLOB,Z0_TEST2 MEDIUMBLOB,Z0_TEST3 LONGBLOB) with column group (all columns, each column);
INSERT INTO  Z0CASE (z0_test0,z0_test1,Z0_TEST2,Z0_TEST3)VALUES('abc ABC','abc ABC','abc ABC','abc ABC');
INSERT INTO  Z0CASE (z0_test0,z0_test1,Z0_TEST2,Z0_TEST3)VALUES('中文字符@!#$%^','中文字符@!#$%^','中文字符@!#$%^','中文字符@!#$%^');
INSERT INTO  Z0CASE (z0_test0,z0_test1,Z0_TEST2,Z0_TEST3)VALUES('2011-11-11 11:11:11','2011-11-11 11:11:11',20,20);
INSERT INTO  Z0CASE (z0_test0,z0_test1,Z0_TEST2,Z0_TEST3)VALUES(NULL,NULL,0,0);
SELECT * FROM Z0CASE ORDER BY Z0_TEST2*1;
Z0_TEST0	Z0_TEST1	Z0_TEST2	Z0_TEST3
abc ABC	abc ABC	abc ABC	abc ABC
中文字符@!#$%^	中文字符@!#$%^	中文字符@!#$%^	中文字符@!#$%^
NULL	NULL	0	0
2011-11-11 11:11:11	2011-11-11 11:11:11	20	20
Warnings:
Warning	1292	Truncated incorrect DOUBLE value: 'abc ABC'
Warning	1292	Truncated incorrect DOUBLE value: '中文字符@!#$%^'
SELECT table_id,table_name FROM oceanbase.__all_virtual_table WHERE table_name='Z0CASE';
ALTER TABLE Z0CASE MODIFY COLUMN z0_test0 MEDIUMBLOB;
SELECT * FROM Z0CASE ORDER BY Z0_TEST2*1;
z0_test0	Z0_TEST1	Z0_TEST2	Z0_TEST3
abc ABC	abc ABC	abc ABC	abc ABC
中文字符@!#$%^	中文字符@!#$%^	中文字符@!#$%^	中文字符@!#$%^
NULL	NULL	0	0
2011-11-11 11:11:11	2011-11-11 11:11:11	20	20
Warnings:
Warning	1292	Truncated incorrect DOUBLE value: 'abc ABC'
Warning	1292	Truncated incorrect DOUBLE value: '中文字符@!#$%^'
DESC Z0CASE;
Field	Type	Null	Key	Default	Extra
z0_test0	mediumblob	YES		NULL	
Z0_TEST1	blob	YES		NULL	
Z0_TEST2	mediumblob	YES		NULL	
Z0_TEST3	longblob	YES		NULL	
SELECT table_id,table_name FROM oceanbase.__all_virtual_table WHERE table_name='Z0CASE';
INSERT INTO  Z0CASE (z0_test0,z0_test1,Z0_TEST2)VALUES('abcabc ABCabc ABCabc ABCabc ABC ABC','abc ABC','abc ABC');
INSERT INTO  Z0CASE (z0_test0,z0_test1,Z0_TEST2)VALUES(213456789078995113365842566663,NULL,0);
SELECT * FROM Z0CASE ORDER BY Z0_TEST2*1;
z0_test0	Z0_TEST1	Z0_TEST2	Z0_TEST3
abc ABC	abc ABC	abc ABC	abc ABC
中文字符@!#$%^	中文字符@!#$%^	中文字符@!#$%^	中文字符@!#$%^
NULL	NULL	0	0
abcabc ABCabc ABCabc ABCabc ABC ABC	abc ABC	abc ABC	NULL
213456789078995113365842566663	NULL	0	NULL
2011-11-11 11:11:11	2011-11-11 11:11:11	20	20
Warnings:
Warning	1292	Truncated incorrect DOUBLE value: 'abc ABC'
Warning	1292	Truncated incorrect DOUBLE value: '中文字符@!#$%^'
Warning	1292	Truncated incorrect DOUBLE value: 'abc ABC'
UPDATE Z0CASE SET z0_test0='QWERERTERYRTFDD!@#$%^&*%add发;;]   /.//?测试数据' WHERE z0_test1='abc ABC';
UPDATE Z0CASE SET z0_test0=1233665548899+3332248696232 WHERE z0_test2=0;
ERROR 42000: Invalid numeric
SELECT * FROM Z0CASE ORDER BY Z0_TEST2*1;
z0_test0	Z0_TEST1	Z0_TEST2	Z0_TEST3
QWERERTERYRTFDD!@#$%^&*%add发;;]   /.//?测试数据	abc ABC	abc ABC	abc ABC
中文字符@!#$%^	中文字符@!#$%^	中文字符@!#$%^	中文字符@!#$%^
NULL	NULL	0	0
QWERERTERYRTFDD!@#$%^&*%add发;;]   /.//?测试数据	abc ABC	abc ABC	NULL
213456789078995113365842566663	NULL	0	NULL
2011-11-11 11:11:11	2011-11-11 11:11:11	20	20
Warnings:
Warning	1292	Truncated incorrect DOUBLE value: 'abc ABC'
Warning	1292	Truncated incorrect DOUBLE value: '中文字符@!#$%^'
Warning	1292	Truncated incorrect DOUBLE value: 'abc ABC'
DELETE FROM Z0CASE WHERE z0_test0=213456789078995113365842566663;
ERROR 42000: Invalid numeric
DELETE FROM Z0CASE WHERE z0_test0='213456789078995113365842566663';
SELECT * FROM Z0CASE ORDER BY Z0_TEST2*1;
z0_test0	Z0_TEST1	Z0_TEST2	Z0_TEST3
QWERERTERYRTFDD!@#$%^&*%add发;;]   /.//?测试数据	abc ABC	abc ABC	abc ABC
中文字符@!#$%^	中文字符@!#$%^	中文字符@!#$%^	中文字符@!#$%^
NULL	NULL	0	0
QWERERTERYRTFDD!@#$%^&*%add发;;]   /.//?测试数据	abc ABC	abc ABC	NULL
2011-11-11 11:11:11	2011-11-11 11:11:11	20	20
Warnings:
Warning	1292	Truncated incorrect DOUBLE value: 'abc ABC'
Warning	1292	Truncated incorrect DOUBLE value: '中文字符@!#$%^'
Warning	1292	Truncated incorrect DOUBLE value: 'abc ABC'
ALTER TABLE Z0CASE MODIFY COLUMN z0_test1 MEDIUMBLOB;
ALTER TABLE Z0CASE MODIFY COLUMN Z0_TEST2 MEDIUMBLOB;
SELECT * FROM Z0CASE ORDER BY Z0_TEST2*1;
z0_test0	z0_test1	Z0_TEST2	Z0_TEST3
QWERERTERYRTFDD!@#$%^&*%add发;;]   /.//?测试数据	abc ABC	abc ABC	abc ABC
中文字符@!#$%^	中文字符@!#$%^	中文字符@!#$%^	中文字符@!#$%^
NULL	NULL	0	0
QWERERTERYRTFDD!@#$%^&*%add发;;]   /.//?测试数据	abc ABC	abc ABC	NULL
2011-11-11 11:11:11	2011-11-11 11:11:11	20	20
Warnings:
Warning	1292	Truncated incorrect DOUBLE value: 'abc ABC'
Warning	1292	Truncated incorrect DOUBLE value: '中文字符@!#$%^'
Warning	1292	Truncated incorrect DOUBLE value: 'abc ABC'
DESC Z0CASE;
Field	Type	Null	Key	Default	Extra
z0_test0	mediumblob	YES		NULL	
z0_test1	mediumblob	YES		NULL	
Z0_TEST2	mediumblob	YES		NULL	
Z0_TEST3	longblob	YES		NULL	
SELECT table_id,table_name FROM oceanbase.__all_virtual_table WHERE table_name='Z0CASE';
ALTER TABLE Z0CASE MODIFY COLUMN Z0_TEST3 MEDIUMBLOB;
SELECT z0_test0 FROM Z0CASE;
z0_test0
QWERERTERYRTFDD!@#$%^&*%add发;;]   /.//?测试数据
中文字符@!#$%^
2011-11-11 11:11:11
NULL
QWERERTERYRTFDD!@#$%^&*%add发;;]   /.//?测试数据
DESC Z0CASE;
Field	Type	Null	Key	Default	Extra
z0_test0	mediumblob	YES		NULL	
z0_test1	mediumblob	YES		NULL	
Z0_TEST2	mediumblob	YES		NULL	
Z0_TEST3	mediumblob	YES		NULL	
SELECT table_id,table_name FROM oceanbase.__all_virtual_table WHERE table_name='Z0CASE';
DROP TABLE Z0CASE;
CREATE TABLE Z0CASE(Z0_TEST0 TINYBLOB, Z0_TEST1 BLOB,Z0_TEST2 MEDIUMBLOB,Z0_TEST3 LONGBLOB) with column group (all columns, each column);
INSERT INTO  Z0CASE (z0_test0,z0_test1,Z0_TEST2,Z0_TEST3)VALUES('abc ABC','abc ABC','abc ABC','abc ABC');
INSERT INTO  Z0CASE (z0_test0,z0_test1,Z0_TEST2,Z0_TEST3)VALUES('中文字符@!#$%^','中文字符@!#$%^','中文字符@!#$%^','中文字符@!#$%^');
INSERT INTO  Z0CASE (z0_test0,z0_test1,Z0_TEST2,Z0_TEST3)VALUES('2011-11-11 11:11:11','2011-11-11 11:11:11',20,20);
INSERT INTO  Z0CASE (z0_test0,z0_test1,Z0_TEST2,Z0_TEST3)VALUES(NULL,NULL,0,0);
SELECT * FROM Z0CASE ORDER BY Z0_TEST2*1;
Z0_TEST0	Z0_TEST1	Z0_TEST2	Z0_TEST3
abc ABC	abc ABC	abc ABC	abc ABC
中文字符@!#$%^	中文字符@!#$%^	中文字符@!#$%^	中文字符@!#$%^
NULL	NULL	0	0
2011-11-11 11:11:11	2011-11-11 11:11:11	20	20
Warnings:
Warning	1292	Truncated incorrect DOUBLE value: 'abc ABC'
Warning	1292	Truncated incorrect DOUBLE value: '中文字符@!#$%^'
SELECT table_id,table_name FROM oceanbase.__all_virtual_table WHERE table_name='Z0CASE';
ALTER TABLE Z0CASE MODIFY COLUMN z0_test0 LONGBLOB;
SELECT * FROM Z0CASE ORDER BY Z0_TEST2*1;
z0_test0	Z0_TEST1	Z0_TEST2	Z0_TEST3
abc ABC	abc ABC	abc ABC	abc ABC
中文字符@!#$%^	中文字符@!#$%^	中文字符@!#$%^	中文字符@!#$%^
NULL	NULL	0	0
2011-11-11 11:11:11	2011-11-11 11:11:11	20	20
Warnings:
Warning	1292	Truncated incorrect DOUBLE value: 'abc ABC'
Warning	1292	Truncated incorrect DOUBLE value: '中文字符@!#$%^'
DESC Z0CASE;
Field	Type	Null	Key	Default	Extra
z0_test0	longblob	YES		NULL	
Z0_TEST1	blob	YES		NULL	
Z0_TEST2	mediumblob	YES		NULL	
Z0_TEST3	longblob	YES		NULL	
SELECT table_id,table_name FROM oceanbase.__all_virtual_table WHERE table_name='Z0CASE';
INSERT INTO  Z0CASE (z0_test0,z0_test1,Z0_TEST2)VALUES('abcabc ABCabc ABCabc ABCabc ABC ABC','abc ABC','abc ABC');
INSERT INTO  Z0CASE (z0_test0,z0_test1,Z0_TEST2)VALUES(213456789078995113365842566663,NULL,0);
SELECT * FROM Z0CASE ORDER BY Z0_TEST2*1;
z0_test0	Z0_TEST1	Z0_TEST2	Z0_TEST3
abc ABC	abc ABC	abc ABC	abc ABC
中文字符@!#$%^	中文字符@!#$%^	中文字符@!#$%^	中文字符@!#$%^
NULL	NULL	0	0
abcabc ABCabc ABCabc ABCabc ABC ABC	abc ABC	abc ABC	NULL
213456789078995113365842566663	NULL	0	NULL
2011-11-11 11:11:11	2011-11-11 11:11:11	20	20
Warnings:
Warning	1292	Truncated incorrect DOUBLE value: 'abc ABC'
Warning	1292	Truncated incorrect DOUBLE value: '中文字符@!#$%^'
Warning	1292	Truncated incorrect DOUBLE value: 'abc ABC'
UPDATE Z0CASE SET z0_test0='QWERERTERYRTFDD!@#$%^&*%add发;;]   /.//?测试数据' WHERE z0_test1='abc ABC';
UPDATE Z0CASE SET z0_test0=1233665548899+3332248696232 WHERE z0_test2=0;
ERROR 42000: Invalid numeric
SELECT * FROM Z0CASE ORDER BY Z0_TEST2*1;
z0_test0	Z0_TEST1	Z0_TEST2	Z0_TEST3
QWERERTERYRTFDD!@#$%^&*%add发;;]   /.//?测试数据	abc ABC	abc ABC	abc ABC
中文字符@!#$%^	中文字符@!#$%^	中文字符@!#$%^	中文字符@!#$%^
NULL	NULL	0	0
QWERERTERYRTFDD!@#$%^&*%add发;;]   /.//?测试数据	abc ABC	abc ABC	NULL
213456789078995113365842566663	NULL	0	NULL
2011-11-11 11:11:11	2011-11-11 11:11:11	20	20
Warnings:
Warning	1292	Truncated incorrect DOUBLE value: 'abc ABC'
Warning	1292	Truncated incorrect DOUBLE value: '中文字符@!#$%^'
Warning	1292	Truncated incorrect DOUBLE value: 'abc ABC'
DELETE FROM Z0CASE WHERE z0_test0=213456789078995113365842566663;
ERROR 42000: Invalid numeric
DELETE FROM Z0CASE WHERE z0_test0='213456789078995113365842566663';
SELECT * FROM Z0CASE ORDER BY Z0_TEST2*1;
z0_test0	Z0_TEST1	Z0_TEST2	Z0_TEST3
QWERERTERYRTFDD!@#$%^&*%add发;;]   /.//?测试数据	abc ABC	abc ABC	abc ABC
中文字符@!#$%^	中文字符@!#$%^	中文字符@!#$%^	中文字符@!#$%^
NULL	NULL	0	0
QWERERTERYRTFDD!@#$%^&*%add发;;]   /.//?测试数据	abc ABC	abc ABC	NULL
2011-11-11 11:11:11	2011-11-11 11:11:11	20	20
Warnings:
Warning	1292	Truncated incorrect DOUBLE value: 'abc ABC'
Warning	1292	Truncated incorrect DOUBLE value: '中文字符@!#$%^'
Warning	1292	Truncated incorrect DOUBLE value: 'abc ABC'
ALTER TABLE Z0CASE MODIFY COLUMN z0_test1 LONGBLOB;
ALTER TABLE Z0CASE MODIFY COLUMN Z0_TEST2 LONGBLOB;
ALTER TABLE Z0CASE MODIFY COLUMN Z0_TEST3 LONGBLOB;
DESC Z0CASE;
Field	Type	Null	Key	Default	Extra
z0_test0	longblob	YES		NULL	
z0_test1	longblob	YES		NULL	
Z0_TEST2	longblob	YES		NULL	
Z0_TEST3	longblob	YES		NULL	
SELECT table_id,table_name FROM oceanbase.__all_virtual_table WHERE table_name='Z0CASE';
其他字符类型
DROP TABLE Z0CASE;
CREATE TABLE Z0CASE(Z0_TEST0 TINYBLOB, Z0_TEST1 BLOB,Z0_TEST2 MEDIUMBLOB,Z0_TEST3 LONGBLOB) with column group (all columns, each column);
INSERT INTO  Z0CASE (z0_test0,z0_test1,Z0_TEST2,Z0_TEST3)VALUES('abc ABC','abc ABC','abc ABC','abc ABC');
INSERT INTO  Z0CASE (z0_test0,z0_test1,Z0_TEST2,Z0_TEST3)VALUES('中文字符@!#$%^','中文字符@!#$%^','中文字符@!#$%^','中文字符@!#$%^');
INSERT INTO  Z0CASE (z0_test0,z0_test1,Z0_TEST2,Z0_TEST3)VALUES('2011-11-11 11:11:11','2011-11-11 11:11:11',20,20);
INSERT INTO  Z0CASE (z0_test0,z0_test1,Z0_TEST2,Z0_TEST3)VALUES(NULL,NULL,0,0);
SELECT * FROM Z0CASE ORDER BY Z0_TEST2*1;
Z0_TEST0	Z0_TEST1	Z0_TEST2	Z0_TEST3
abc ABC	abc ABC	abc ABC	abc ABC
中文字符@!#$%^	中文字符@!#$%^	中文字符@!#$%^	中文字符@!#$%^
NULL	NULL	0	0
2011-11-11 11:11:11	2011-11-11 11:11:11	20	20
Warnings:
Warning	1292	Truncated incorrect DOUBLE value: 'abc ABC'
Warning	1292	Truncated incorrect DOUBLE value: '中文字符@!#$%^'
SELECT table_id,table_name FROM oceanbase.__all_virtual_table WHERE table_name='Z0CASE';
ALTER TABLE Z0CASE MODIFY COLUMN z0_test0 CHAR(100);
SELECT * FROM Z0CASE ORDER BY Z0_TEST2*1;
z0_test0	Z0_TEST1	Z0_TEST2	Z0_TEST3
abc ABC	abc ABC	abc ABC	abc ABC
中文字符@!#$%^	中文字符@!#$%^	中文字符@!#$%^	中文字符@!#$%^
NULL	NULL	0	0
2011-11-11 11:11:11	2011-11-11 11:11:11	20	20
Warnings:
Warning	1292	Truncated incorrect DOUBLE value: 'abc ABC'
Warning	1292	Truncated incorrect DOUBLE value: '中文字符@!#$%^'
DESC Z0CASE;
Field	Type	Null	Key	Default	Extra
z0_test0	char(100)	YES		NULL	
Z0_TEST1	blob	YES		NULL	
Z0_TEST2	mediumblob	YES		NULL	
Z0_TEST3	longblob	YES		NULL	
SELECT table_id,table_name FROM oceanbase.__all_virtual_table WHERE table_name='Z0CASE';
ALTER TABLE Z0CASE MODIFY COLUMN z0_test2 VARCHAR(100);
SELECT * FROM Z0CASE ORDER BY Z0_TEST2*1;
z0_test0	Z0_TEST1	z0_test2	Z0_TEST3
abc ABC	abc ABC	abc ABC	abc ABC
中文字符@!#$%^	中文字符@!#$%^	中文字符@!#$%^	中文字符@!#$%^
NULL	NULL	0	0
2011-11-11 11:11:11	2011-11-11 11:11:11	20	20
Warnings:
Warning	1292	Truncated incorrect DOUBLE value: 'abc ABC'
Warning	1292	Truncated incorrect DOUBLE value: '中文字符@!#$%^'
DESC Z0CASE;
Field	Type	Null	Key	Default	Extra
z0_test0	char(100)	YES		NULL	
Z0_TEST1	blob	YES		NULL	
z0_test2	varchar(100)	YES		NULL	
Z0_TEST3	longblob	YES		NULL	
SELECT table_id,table_name FROM oceanbase.__all_virtual_table WHERE table_name='Z0CASE';
ALTER TABLE Z0CASE MODIFY COLUMN z0_test3 SET('abc ABC','中文字符@!#$%^','20');
SELECT * FROM Z0CASE ORDER BY Z0_TEST2*1;
z0_test0	Z0_TEST1	z0_test2	z0_test3
abc ABC	abc ABC	abc ABC	abc ABC
中文字符@!#$%^	中文字符@!#$%^	中文字符@!#$%^	中文字符@!#$%^
NULL	NULL	0	
2011-11-11 11:11:11	2011-11-11 11:11:11	20	20
Warnings:
Warning	1292	Truncated incorrect DOUBLE value: 'abc ABC'
Warning	1292	Truncated incorrect DOUBLE value: '中文字符@!#$%^'
DESC Z0CASE;
Field	Type	Null	Key	Default	Extra
z0_test0	char(100)	YES		NULL	
Z0_TEST1	blob	YES		NULL	
z0_test2	varchar(100)	YES		NULL	
z0_test3	set('abc ABC','中文字符@!#$%^','20')	YES		NULL	
SELECT table_id,table_name FROM oceanbase.__all_virtual_table WHERE table_name='Z0CASE';
DROP TABLE Z0CASE;
CREATE TABLE Z0CASE(Z0_TEST0 TINYBLOB, Z0_TEST1 BLOB,Z0_TEST2 MEDIUMBLOB,Z0_TEST3 LONGBLOB) with column group (all columns, each column);
INSERT INTO  Z0CASE (z0_test0,z0_test1,Z0_TEST2)VALUES('111','111','111');
INSERT INTO  Z0CASE (z0_test0,z0_test1,Z0_TEST2)VALUES('1121','111.111','111.111');
INSERT INTO  Z0CASE (z0_test0,z0_test1,Z0_TEST2)VALUES('0','0.000','0.000');
INSERT INTO  Z0CASE (z0_test0,z0_test1,Z0_TEST2)VALUES(NULL,NULL,0);
SELECT * FROM Z0CASE ORDER BY Z0_TEST2*1;
Z0_TEST0	Z0_TEST1	Z0_TEST2	Z0_TEST3
0	0.000	0.000	NULL
NULL	NULL	0	NULL
111	111	111	NULL
1121	111.111	111.111	NULL
SELECT table_id,table_name FROM oceanbase.__all_virtual_table WHERE table_name='Z0CASE';
ALTER TABLE Z0CASE MODIFY COLUMN z0_test0 INT ;
SELECT * FROM Z0CASE ORDER BY Z0_TEST2*1;
z0_test0	Z0_TEST1	Z0_TEST2	Z0_TEST3
0	0.000	0.000	NULL
NULL	NULL	0	NULL
111	111	111	NULL
1121	111.111	111.111	NULL
DESC Z0CASE;
Field	Type	Null	Key	Default	Extra
z0_test0	int(11)	YES		NULL	
Z0_TEST1	blob	YES		NULL	
Z0_TEST2	mediumblob	YES		NULL	
Z0_TEST3	longblob	YES		NULL	
SELECT table_id,table_name FROM oceanbase.__all_virtual_table WHERE table_name='Z0CASE';
ALTER TABLE Z0CASE MODIFY COLUMN z0_test1 INT ;
SELECT * FROM Z0CASE ORDER BY Z0_TEST2*1;
z0_test0	z0_test1	Z0_TEST2	Z0_TEST3
0	0	0.000	NULL
NULL	NULL	0	NULL
111	111	111	NULL
1121	111	111.111	NULL
DESC Z0CASE;
Field	Type	Null	Key	Default	Extra
z0_test0	int(11)	YES		NULL	
z0_test1	int(11)	YES		NULL	
Z0_TEST2	mediumblob	YES		NULL	
Z0_TEST3	longblob	YES		NULL	
SELECT table_id,table_name FROM oceanbase.__all_virtual_table WHERE table_name='Z0CASE';
DROP TABLE Z0CASE;
CREATE TABLE Z0CASE(Z0_TEST0 TINYBLOB, Z0_TEST1 BLOB,Z0_TEST2 MEDIUMBLOB,Z0_TEST3 LONGBLOB) with column group (all columns, each column);
INSERT INTO  Z0CASE (z0_test0,z0_test1,Z0_TEST2,Z0_TEST3)VALUES('11:11:11 ','11:11:11 ','11:11:11 ','11:11:11 ');
INSERT INTO  Z0CASE (z0_test0,z0_test1,Z0_TEST2,Z0_TEST3)VALUES('2011-11-11 ','2011-11-11 ','2011-11-11 ','2011-11-11 11:11:11');
INSERT INTO  Z0CASE (z0_test0,z0_test1,Z0_TEST2,Z0_TEST3)VALUES('2011-11-11 11:11:11','2011-11-11 11:11:11','2011-11-11 11:11:11','2011-11-11 11:11:11');
INSERT INTO  Z0CASE (z0_test0,z0_test1,Z0_TEST2,Z0_TEST3)VALUES(NULL,NULL,NULL,NULL);
SELECT * FROM Z0CASE ORDER BY Z0_TEST2*1;
Z0_TEST0	Z0_TEST1	Z0_TEST2	Z0_TEST3
NULL	NULL	NULL	NULL
11:11:11 	11:11:11 	11:11:11 	11:11:11 
2011-11-11 	2011-11-11 	2011-11-11 	2011-11-11 11:11:11
2011-11-11 11:11:11	2011-11-11 11:11:11	2011-11-11 11:11:11	2011-11-11 11:11:11
Warnings:
Warning	1292	Truncated incorrect DOUBLE value: '11:11:11 '
Warning	1292	Truncated incorrect DOUBLE value: '2011-11-11 '
Warning	1292	Truncated incorrect DOUBLE value: '2011-11-11 11:11:11'
SELECT table_id,table_name FROM oceanbase.__all_virtual_table WHERE table_name='Z0CASE';
ALTER TABLE Z0CASE MODIFY COLUMN z0_test0 DATE;
SELECT * FROM Z0CASE ORDER BY Z0_TEST2*1;
z0_test0	Z0_TEST1	Z0_TEST2	Z0_TEST3
NULL	NULL	NULL	NULL
2011-11-11	11:11:11 	11:11:11 	11:11:11 
2011-11-11	2011-11-11 	2011-11-11 	2011-11-11 11:11:11
2011-11-11	2011-11-11 11:11:11	2011-11-11 11:11:11	2011-11-11 11:11:11
Warnings:
Warning	1292	Truncated incorrect DOUBLE value: '11:11:11 '
Warning	1292	Truncated incorrect DOUBLE value: '2011-11-11 '
Warning	1292	Truncated incorrect DOUBLE value: '2011-11-11 11:11:11'
DESC Z0CASE;
Field	Type	Null	Key	Default	Extra
z0_test0	date	YES		NULL	
Z0_TEST1	blob	YES		NULL	
Z0_TEST2	mediumblob	YES		NULL	
Z0_TEST3	longblob	YES		NULL	
SELECT table_id,table_name FROM oceanbase.__all_virtual_table WHERE table_name='Z0CASE';
ALTER TABLE Z0CASE MODIFY COLUMN z0_test1 DATETIME;
SELECT * FROM Z0CASE ORDER BY Z0_TEST2*1;
z0_test0	z0_test1	Z0_TEST2	Z0_TEST3
NULL	NULL	NULL	NULL
2011-11-11	2011-11-11 00:00:00	11:11:11 	11:11:11 
2011-11-11	2011-11-11 00:00:00	2011-11-11 	2011-11-11 11:11:11
2011-11-11	2011-11-11 11:11:11	2011-11-11 11:11:11	2011-11-11 11:11:11
Warnings:
Warning	1292	Truncated incorrect DOUBLE value: '11:11:11 '
Warning	1292	Truncated incorrect DOUBLE value: '2011-11-11 '
Warning	1292	Truncated incorrect DOUBLE value: '2011-11-11 11:11:11'
DESC Z0CASE;
Field	Type	Null	Key	Default	Extra
z0_test0	date	YES		NULL	
z0_test1	datetime	YES		NULL	
Z0_TEST2	mediumblob	YES		NULL	
Z0_TEST3	longblob	YES		NULL	
SELECT table_id,table_name FROM oceanbase.__all_virtual_table WHERE table_name='Z0CASE';
ALTER TABLE Z0CASE MODIFY COLUMN z0_test2 TIMESTAMP;
SELECT * FROM Z0CASE ORDER BY Z0_TEST1;
z0_test0	z0_test1	z0_test2	Z0_TEST3
NULL	NULL	NULL	NULL
2011-11-11	2011-11-11 00:00:00	2011-11-11 00:00:00	11:11:11 
2011-11-11	2011-11-11 00:00:00	2011-11-11 00:00:00	2011-11-11 11:11:11
2011-11-11	2011-11-11 11:11:11	2011-11-11 11:11:11	2011-11-11 11:11:11
DESC Z0CASE;
Field	Type	Null	Key	Default	Extra
z0_test0	date	YES		NULL	
z0_test1	datetime	YES		NULL	
z0_test2	timestamp	YES		NULL	
Z0_TEST3	longblob	YES		NULL	
SELECT table_id,table_name FROM oceanbase.__all_virtual_table WHERE table_name='Z0CASE';
ALTER TABLE Z0CASE MODIFY COLUMN Z0_TEST3 time;
SELECT * FROM Z0CASE ORDER BY Z0_TEST2*1;
z0_test0	z0_test1	z0_test2	Z0_TEST3
NULL	NULL	NULL	NULL
2011-11-11	2011-11-11 00:00:00	2011-11-11 00:00:00	11:11:11
2011-11-11	2011-11-11 00:00:00	2011-11-11 00:00:00	11:11:11
2011-11-11	2011-11-11 11:11:11	2011-11-11 11:11:11	11:11:11
DESC Z0CASE;
Field	Type	Null	Key	Default	Extra
z0_test0	date	YES		NULL	
z0_test1	datetime	YES		NULL	
z0_test2	timestamp	YES		NULL	
Z0_TEST3	time	YES		NULL	
SELECT table_id,table_name FROM oceanbase.__all_virtual_table WHERE table_name='Z0CASE';
TEXT
DROP TABLE Z0CASE;
CREATE TABLE Z0CASE(Z0_TEST0 TINYTEXT, Z0_TEST1 text,Z0_TEST2 MEDIUMTEXT,Z0_TEST3 LONGTEXT) with column group (all columns, each column);
INSERT INTO  Z0CASE (z0_test0,z0_test1,Z0_TEST2,Z0_TEST3)VALUES('11:11:11 ','11:11:11 ','11:11:11 ','11:11:11 ');
INSERT INTO  Z0CASE (z0_test0,z0_test1,Z0_TEST2,Z0_TEST3)VALUES('2011-11-11 ','2011-11-11 ','2011-11-11 ','2011-11-11 ');
INSERT INTO  Z0CASE (z0_test0,z0_test1,Z0_TEST2,Z0_TEST3)VALUES('2011-11-11 11:11:11','2011-11-11 11:11:11','2011-11-11 11:11:11','2011-11-11 11:11:11');
INSERT INTO  Z0CASE (z0_test0,z0_test1,Z0_TEST2,Z0_TEST3)VALUES(NULL,NULL,NULL,NULL);
SELECT * FROM Z0CASE ORDER BY Z0_TEST3*1;
Z0_TEST0	Z0_TEST1	Z0_TEST2	Z0_TEST3
NULL	NULL	NULL	NULL
11:11:11 	11:11:11 	11:11:11 	11:11:11 
2011-11-11 	2011-11-11 	2011-11-11 	2011-11-11 
2011-11-11 11:11:11	2011-11-11 11:11:11	2011-11-11 11:11:11	2011-11-11 11:11:11
Warnings:
Warning	1292	Truncated incorrect DOUBLE value: '11:11:11 '
Warning	1292	Truncated incorrect DOUBLE value: '2011-11-11 '
Warning	1292	Truncated incorrect DOUBLE value: '2011-11-11 11:11:11'
SELECT table_id,table_name FROM oceanbase.__all_virtual_table WHERE table_name='Z0CASE';
TINYTEXT -->TINYTEXT
ALTER TABLE Z0CASE MODIFY COLUMN z0_test0 TINYTEXT;
SELECT * FROM Z0CASE ORDER BY Z0_TEST3*1;
z0_test0	Z0_TEST1	Z0_TEST2	Z0_TEST3
NULL	NULL	NULL	NULL
11:11:11 	11:11:11 	11:11:11 	11:11:11 
2011-11-11 	2011-11-11 	2011-11-11 	2011-11-11 
2011-11-11 11:11:11	2011-11-11 11:11:11	2011-11-11 11:11:11	2011-11-11 11:11:11
Warnings:
Warning	1292	Truncated incorrect DOUBLE value: '11:11:11 '
Warning	1292	Truncated incorrect DOUBLE value: '2011-11-11 '
Warning	1292	Truncated incorrect DOUBLE value: '2011-11-11 11:11:11'
DESC Z0CASE;
Field	Type	Null	Key	Default	Extra
z0_test0	tinytext	YES		NULL	
Z0_TEST1	text	YES		NULL	
Z0_TEST2	mediumtext	YES		NULL	
Z0_TEST3	longtext	YES		NULL	
SELECT table_id,table_name FROM oceanbase.__all_virtual_table WHERE table_name='Z0CASE';
INSERT INTO  Z0CASE (z0_test0,z0_test1,Z0_TEST2,Z0_TEST3)VALUES('11:11:11 11:11:1111:11:1111:11:1111:11:11','11:11:11 ','11:11:11 ','12:11:11 ');
INSERT INTO  Z0CASE (z0_test0,z0_test1,Z0_TEST2,Z0_TEST3)VALUES(12345678963258741201236548789652,'11:11:11 ','11:11:11 ','11:14:11 ');
INSERT INTO  Z0CASE (z0_test0,z0_test1,Z0_TEST2,Z0_TEST3)VALUES('测试数据+——）（*&……%￥#@！123456789【】、；。/，《》？：Lasdasassffafsads','11:11:11 ','11:11:11 ','11:13:11 ');
SELECT * FROM Z0CASE ORDER BY Z0_TEST3*1;
z0_test0	Z0_TEST1	Z0_TEST2	Z0_TEST3
NULL	NULL	NULL	NULL
11:11:11 	11:11:11 	11:11:11 	11:11:11 
12345678963258741201236548789652	11:11:11 	11:11:11 	11:14:11 
测试数据+——）（*&……%￥#@！123456789【】、；。/，《》？：Lasdasassffafsads	11:11:11 	11:11:11 	11:13:11 
11:11:11 11:11:1111:11:1111:11:1111:11:11	11:11:11 	11:11:11 	12:11:11 
2011-11-11 	2011-11-11 	2011-11-11 	2011-11-11 
2011-11-11 11:11:11	2011-11-11 11:11:11	2011-11-11 11:11:11	2011-11-11 11:11:11
Warnings:
Warning	1292	Truncated incorrect DOUBLE value: '11:11:11 '
Warning	1292	Truncated incorrect DOUBLE value: '2011-11-11 '
Warning	1292	Truncated incorrect DOUBLE value: '2011-11-11 11:11:11'
Warning	1292	Truncated incorrect DOUBLE value: '12:11:11 '
Warning	1292	Truncated incorrect DOUBLE value: '11:14:11 '
Warning	1292	Truncated incorrect DOUBLE value: '11:13:11 '
UPDATE Z0CASE SET z0_test0=1234322312122 WHERE z0_test1='2011-11-11 ';
UPDATE Z0CASE SET z0_test0='@$%*&$#@12334556   4DFDDddfgdsfgjhrsdd[];/.,\\//' WHERE z0_test0=1234322312122;
ERROR 42000: Invalid numeric
UPDATE Z0CASE SET z0_test0='@$%*&$#@12334556   4DFDDddfgdsfgjhrsdd[];/.,\\//' WHERE z0_test0='1234322312122';
SELECT * FROM Z0CASE ORDER BY Z0_TEST3*1;
z0_test0	Z0_TEST1	Z0_TEST2	Z0_TEST3
NULL	NULL	NULL	NULL
11:11:11 	11:11:11 	11:11:11 	11:11:11 
12345678963258741201236548789652	11:11:11 	11:11:11 	11:14:11 
测试数据+——）（*&……%￥#@！123456789【】、；。/，《》？：Lasdasassffafsads	11:11:11 	11:11:11 	11:13:11 
11:11:11 11:11:1111:11:1111:11:1111:11:11	11:11:11 	11:11:11 	12:11:11 
@$%*&$#@12334556   4DFDDddfgdsfgjhrsdd[];/.,\//	2011-11-11 	2011-11-11 	2011-11-11 
2011-11-11 11:11:11	2011-11-11 11:11:11	2011-11-11 11:11:11	2011-11-11 11:11:11
Warnings:
Warning	1292	Truncated incorrect DOUBLE value: '11:11:11 '
Warning	1292	Truncated incorrect DOUBLE value: '2011-11-11 '
Warning	1292	Truncated incorrect DOUBLE value: '2011-11-11 11:11:11'
Warning	1292	Truncated incorrect DOUBLE value: '12:11:11 '
Warning	1292	Truncated incorrect DOUBLE value: '11:14:11 '
Warning	1292	Truncated incorrect DOUBLE value: '11:13:11 '
DELETE FROM Z0CASE WHERE z0_test0=12345678963258741201236548789652;
ERROR 42000: Invalid numeric
DELETE FROM Z0CASE WHERE z0_test0='12345678963258741201236548789652';
DELETE FROM Z0CASE WHERE z0_test0='@$%*&$#@12334556   4DFDDddfgdsfgjhrsdd[];/.,\\//';
SELECT * FROM Z0CASE;
z0_test0	Z0_TEST1	Z0_TEST2	Z0_TEST3
11:11:11 	11:11:11 	11:11:11 	11:11:11 
2011-11-11 11:11:11	2011-11-11 11:11:11	2011-11-11 11:11:11	2011-11-11 11:11:11
NULL	NULL	NULL	NULL
11:11:11 11:11:1111:11:1111:11:1111:11:11	11:11:11 	11:11:11 	12:11:11 
测试数据+——）（*&……%￥#@！123456789【】、；。/，《》？：Lasdasassffafsads	11:11:11 	11:11:11 	11:13:11 
ALTER TABLE Z0CASE MODIFY COLUMN z0_test1 TINYTEXT;
SELECT * FROM Z0CASE ORDER BY Z0_TEST3*1;
z0_test0	z0_test1	Z0_TEST2	Z0_TEST3
NULL	NULL	NULL	NULL
11:11:11 	11:11:11 	11:11:11 	11:11:11 
测试数据+——）（*&……%￥#@！123456789【】、；。/，《》？：Lasdasassffafsads	11:11:11 	11:11:11 	11:13:11 
11:11:11 11:11:1111:11:1111:11:1111:11:11	11:11:11 	11:11:11 	12:11:11 
2011-11-11 11:11:11	2011-11-11 11:11:11	2011-11-11 11:11:11	2011-11-11 11:11:11
Warnings:
Warning	1292	Truncated incorrect DOUBLE value: '11:11:11 '
Warning	1292	Truncated incorrect DOUBLE value: '2011-11-11 11:11:11'
Warning	1292	Truncated incorrect DOUBLE value: '12:11:11 '
Warning	1292	Truncated incorrect DOUBLE value: '11:13:11 '
DESC Z0CASE;
Field	Type	Null	Key	Default	Extra
z0_test0	tinytext	YES		NULL	
z0_test1	tinytext	YES		NULL	
Z0_TEST2	mediumtext	YES		NULL	
Z0_TEST3	longtext	YES		NULL	
SELECT table_id,table_name FROM oceanbase.__all_virtual_table WHERE table_name='Z0CASE';
ALTER TABLE Z0CASE MODIFY COLUMN Z0_TEST2 TINYTEXT;
SELECT * FROM Z0CASE ORDER BY Z0_TEST3*1;
z0_test0	z0_test1	Z0_TEST2	Z0_TEST3
NULL	NULL	NULL	NULL
11:11:11 	11:11:11 	11:11:11 	11:11:11 
测试数据+——）（*&……%￥#@！123456789【】、；。/，《》？：Lasdasassffafsads	11:11:11 	11:11:11 	11:13:11 
11:11:11 11:11:1111:11:1111:11:1111:11:11	11:11:11 	11:11:11 	12:11:11 
2011-11-11 11:11:11	2011-11-11 11:11:11	2011-11-11 11:11:11	2011-11-11 11:11:11
Warnings:
Warning	1292	Truncated incorrect DOUBLE value: '11:11:11 '
Warning	1292	Truncated incorrect DOUBLE value: '2011-11-11 11:11:11'
Warning	1292	Truncated incorrect DOUBLE value: '12:11:11 '
Warning	1292	Truncated incorrect DOUBLE value: '11:13:11 '
DESC Z0CASE;
Field	Type	Null	Key	Default	Extra
z0_test0	tinytext	YES		NULL	
z0_test1	tinytext	YES		NULL	
Z0_TEST2	tinytext	YES		NULL	
Z0_TEST3	longtext	YES		NULL	
SELECT table_id,table_name FROM oceanbase.__all_virtual_table WHERE table_name='Z0CASE';
ALTER TABLE Z0CASE MODIFY COLUMN Z0_TEST3 TINYTEXT;
SELECT * FROM Z0CASE ORDER BY Z0_TEST3*1;
z0_test0	z0_test1	Z0_TEST2	Z0_TEST3
NULL	NULL	NULL	NULL
11:11:11 	11:11:11 	11:11:11 	11:11:11 
测试数据+——）（*&……%￥#@！123456789【】、；。/，《》？：Lasdasassffafsads	11:11:11 	11:11:11 	11:13:11 
11:11:11 11:11:1111:11:1111:11:1111:11:11	11:11:11 	11:11:11 	12:11:11 
2011-11-11 11:11:11	2011-11-11 11:11:11	2011-11-11 11:11:11	2011-11-11 11:11:11
Warnings:
Warning	1292	Truncated incorrect DOUBLE value: '11:11:11 '
Warning	1292	Truncated incorrect DOUBLE value: '2011-11-11 11:11:11'
Warning	1292	Truncated incorrect DOUBLE value: '12:11:11 '
Warning	1292	Truncated incorrect DOUBLE value: '11:13:11 '
DESC Z0CASE;
Field	Type	Null	Key	Default	Extra
z0_test0	tinytext	YES		NULL	
z0_test1	tinytext	YES		NULL	
Z0_TEST2	tinytext	YES		NULL	
Z0_TEST3	tinytext	YES		NULL	
SELECT table_id,table_name FROM oceanbase.__all_virtual_table WHERE table_name='Z0CASE';
text -->text
DROP TABLE Z0CASE;
CREATE TABLE Z0CASE(Z0_TEST0 TINYTEXT, Z0_TEST1 text,Z0_TEST2 MEDIUMTEXT,Z0_TEST3 LONGTEXT) with column group (all columns, each column);
INSERT INTO  Z0CASE (z0_test0,z0_test1,Z0_TEST2,Z0_TEST3)VALUES('11:11:11 ','11:11:11 ','11:11:11 ','11:11:11 ');
INSERT INTO  Z0CASE (z0_test0,z0_test1,Z0_TEST2,Z0_TEST3)VALUES('2011-11-11 ','2011-11-11 ','2011-11-11 ','2011-11-11 ');
INSERT INTO  Z0CASE (z0_test0,z0_test1,Z0_TEST2,Z0_TEST3)VALUES('2011-11-11 11:11:11','2011-11-11 11:11:11','2011-11-11 11:11:11','2011-11-11 11:11:11');
INSERT INTO  Z0CASE (z0_test0,z0_test1,Z0_TEST2,Z0_TEST3)VALUES(NULL,NULL,NULL,NULL);
SELECT * FROM Z0CASE ORDER BY Z0_TEST3*1;
Z0_TEST0	Z0_TEST1	Z0_TEST2	Z0_TEST3
NULL	NULL	NULL	NULL
11:11:11 	11:11:11 	11:11:11 	11:11:11 
2011-11-11 	2011-11-11 	2011-11-11 	2011-11-11 
2011-11-11 11:11:11	2011-11-11 11:11:11	2011-11-11 11:11:11	2011-11-11 11:11:11
Warnings:
Warning	1292	Truncated incorrect DOUBLE value: '11:11:11 '
Warning	1292	Truncated incorrect DOUBLE value: '2011-11-11 '
Warning	1292	Truncated incorrect DOUBLE value: '2011-11-11 11:11:11'
SELECT table_id,table_name FROM oceanbase.__all_virtual_table WHERE table_name='Z0CASE';
ALTER TABLE Z0CASE MODIFY COLUMN z0_test0 text;
SELECT * FROM Z0CASE ORDER BY Z0_TEST3*1;
z0_test0	Z0_TEST1	Z0_TEST2	Z0_TEST3
NULL	NULL	NULL	NULL
11:11:11 	11:11:11 	11:11:11 	11:11:11 
2011-11-11 	2011-11-11 	2011-11-11 	2011-11-11 
2011-11-11 11:11:11	2011-11-11 11:11:11	2011-11-11 11:11:11	2011-11-11 11:11:11
Warnings:
Warning	1292	Truncated incorrect DOUBLE value: '11:11:11 '
Warning	1292	Truncated incorrect DOUBLE value: '2011-11-11 '
Warning	1292	Truncated incorrect DOUBLE value: '2011-11-11 11:11:11'
DESC Z0CASE;
Field	Type	Null	Key	Default	Extra
z0_test0	text	YES		NULL	
Z0_TEST1	text	YES		NULL	
Z0_TEST2	mediumtext	YES		NULL	
Z0_TEST3	longtext	YES		NULL	
SELECT table_id,table_name FROM oceanbase.__all_virtual_table WHERE table_name='Z0CASE';
ALTER TABLE Z0CASE MODIFY COLUMN z0_test1 text;
SELECT * FROM Z0CASE ORDER BY Z0_TEST3*1;
z0_test0	z0_test1	Z0_TEST2	Z0_TEST3
NULL	NULL	NULL	NULL
11:11:11 	11:11:11 	11:11:11 	11:11:11 
2011-11-11 	2011-11-11 	2011-11-11 	2011-11-11 
2011-11-11 11:11:11	2011-11-11 11:11:11	2011-11-11 11:11:11	2011-11-11 11:11:11
Warnings:
Warning	1292	Truncated incorrect DOUBLE value: '11:11:11 '
Warning	1292	Truncated incorrect DOUBLE value: '2011-11-11 '
Warning	1292	Truncated incorrect DOUBLE value: '2011-11-11 11:11:11'
DESC Z0CASE;
Field	Type	Null	Key	Default	Extra
z0_test0	text	YES		NULL	
z0_test1	text	YES		NULL	
Z0_TEST2	mediumtext	YES		NULL	
Z0_TEST3	longtext	YES		NULL	
SELECT table_id,table_name FROM oceanbase.__all_virtual_table WHERE table_name='Z0CASE';
ALTER TABLE Z0CASE MODIFY COLUMN Z0_TEST2 text;
SELECT * FROM Z0CASE ORDER BY Z0_TEST3*1;
z0_test0	z0_test1	Z0_TEST2	Z0_TEST3
NULL	NULL	NULL	NULL
11:11:11 	11:11:11 	11:11:11 	11:11:11 
2011-11-11 	2011-11-11 	2011-11-11 	2011-11-11 
2011-11-11 11:11:11	2011-11-11 11:11:11	2011-11-11 11:11:11	2011-11-11 11:11:11
Warnings:
Warning	1292	Truncated incorrect DOUBLE value: '11:11:11 '
Warning	1292	Truncated incorrect DOUBLE value: '2011-11-11 '
Warning	1292	Truncated incorrect DOUBLE value: '2011-11-11 11:11:11'
DESC Z0CASE;
Field	Type	Null	Key	Default	Extra
z0_test0	text	YES		NULL	
z0_test1	text	YES		NULL	
Z0_TEST2	text	YES		NULL	
Z0_TEST3	longtext	YES		NULL	
SELECT table_id,table_name FROM oceanbase.__all_virtual_table WHERE table_name='Z0CASE';
ALTER TABLE Z0CASE MODIFY COLUMN Z0_TEST3 text;
SELECT * FROM Z0CASE ORDER BY Z0_TEST3*1;
z0_test0	z0_test1	Z0_TEST2	Z0_TEST3
NULL	NULL	NULL	NULL
11:11:11 	11:11:11 	11:11:11 	11:11:11 
2011-11-11 	2011-11-11 	2011-11-11 	2011-11-11 
2011-11-11 11:11:11	2011-11-11 11:11:11	2011-11-11 11:11:11	2011-11-11 11:11:11
Warnings:
Warning	1292	Truncated incorrect DOUBLE value: '11:11:11 '
Warning	1292	Truncated incorrect DOUBLE value: '2011-11-11 '
Warning	1292	Truncated incorrect DOUBLE value: '2011-11-11 11:11:11'
DESC Z0CASE;
Field	Type	Null	Key	Default	Extra
z0_test0	text	YES		NULL	
z0_test1	text	YES		NULL	
Z0_TEST2	text	YES		NULL	
Z0_TEST3	text	YES		NULL	
SELECT table_id,table_name FROM oceanbase.__all_virtual_table WHERE table_name='Z0CASE';
MEDIUMTEXT -->MEDIUMTEXT
DROP TABLE Z0CASE;
CREATE TABLE Z0CASE(Z0_TEST0 TINYTEXT, Z0_TEST1 text,Z0_TEST2 MEDIUMTEXT,Z0_TEST3 LONGTEXT) with column group (all columns, each column);
INSERT INTO  Z0CASE (z0_test0,z0_test1,Z0_TEST2,Z0_TEST3)VALUES('11:11:11 ','11:11:11 ','11:11:11 ','11:11:11 ');
INSERT INTO  Z0CASE (z0_test0,z0_test1,Z0_TEST2,Z0_TEST3)VALUES('2011-11-11 ','2011-11-11 ','2011-11-11 ','2011-11-11 ');
INSERT INTO  Z0CASE (z0_test0,z0_test1,Z0_TEST2,Z0_TEST3)VALUES('2011-11-11 11:11:11','2011-11-11 11:11:11','2011-11-11 11:11:11','2011-11-11 11:11:11');
INSERT INTO  Z0CASE (z0_test0,z0_test1,Z0_TEST2,Z0_TEST3)VALUES(NULL,NULL,NULL,NULL);
SELECT * FROM Z0CASE ORDER BY Z0_TEST3*1;
Z0_TEST0	Z0_TEST1	Z0_TEST2	Z0_TEST3
NULL	NULL	NULL	NULL
11:11:11 	11:11:11 	11:11:11 	11:11:11 
2011-11-11 	2011-11-11 	2011-11-11 	2011-11-11 
2011-11-11 11:11:11	2011-11-11 11:11:11	2011-11-11 11:11:11	2011-11-11 11:11:11
Warnings:
Warning	1292	Truncated incorrect DOUBLE value: '11:11:11 '
Warning	1292	Truncated incorrect DOUBLE value: '2011-11-11 '
Warning	1292	Truncated incorrect DOUBLE value: '2011-11-11 11:11:11'
SELECT table_id,table_name FROM oceanbase.__all_virtual_table WHERE table_name='Z0CASE';
ALTER TABLE Z0CASE MODIFY COLUMN z0_test0 MEDIUMTEXT;
SELECT * FROM Z0CASE ORDER BY Z0_TEST3*1;
z0_test0	Z0_TEST1	Z0_TEST2	Z0_TEST3
NULL	NULL	NULL	NULL
11:11:11 	11:11:11 	11:11:11 	11:11:11 
2011-11-11 	2011-11-11 	2011-11-11 	2011-11-11 
2011-11-11 11:11:11	2011-11-11 11:11:11	2011-11-11 11:11:11	2011-11-11 11:11:11
Warnings:
Warning	1292	Truncated incorrect DOUBLE value: '11:11:11 '
Warning	1292	Truncated incorrect DOUBLE value: '2011-11-11 '
Warning	1292	Truncated incorrect DOUBLE value: '2011-11-11 11:11:11'
DESC Z0CASE;
Field	Type	Null	Key	Default	Extra
z0_test0	mediumtext	YES		NULL	
Z0_TEST1	text	YES		NULL	
Z0_TEST2	mediumtext	YES		NULL	
Z0_TEST3	longtext	YES		NULL	
SELECT table_id,table_name FROM oceanbase.__all_virtual_table WHERE table_name='Z0CASE';
INSERT INTO  Z0CASE (z0_test0,z0_test1,Z0_TEST2,Z0_TEST3)VALUES('11:11:11 11:11:1111:11:1111:11:1111:11:11','11:11:11 ','11:11:11 ','11:12:11 ');
INSERT INTO  Z0CASE (z0_test0,z0_test1,Z0_TEST2,Z0_TEST3)VALUES(12345678963258741201236548789652,'11:11:11 ','11:11:11 ','11:13:11 ');
INSERT INTO  Z0CASE (z0_test0,z0_test1,Z0_TEST2,Z0_TEST3)VALUES('测试数据+——）（*&……%￥#@！123456789【】、；。/，《》？：Lasdasassffafsads','11:11:11 ','11:11:11 ','11:14:11 ');
SELECT * FROM Z0CASE ORDER BY Z0_TEST3*1;
z0_test0	Z0_TEST1	Z0_TEST2	Z0_TEST3
NULL	NULL	NULL	NULL
11:11:11 	11:11:11 	11:11:11 	11:11:11 
11:11:11 11:11:1111:11:1111:11:1111:11:11	11:11:11 	11:11:11 	11:12:11 
12345678963258741201236548789652	11:11:11 	11:11:11 	11:13:11 
测试数据+——）（*&……%￥#@！123456789【】、；。/，《》？：Lasdasassffafsads	11:11:11 	11:11:11 	11:14:11 
2011-11-11 	2011-11-11 	2011-11-11 	2011-11-11 
2011-11-11 11:11:11	2011-11-11 11:11:11	2011-11-11 11:11:11	2011-11-11 11:11:11
Warnings:
Warning	1292	Truncated incorrect DOUBLE value: '11:11:11 '
Warning	1292	Truncated incorrect DOUBLE value: '2011-11-11 '
Warning	1292	Truncated incorrect DOUBLE value: '2011-11-11 11:11:11'
Warning	1292	Truncated incorrect DOUBLE value: '11:12:11 '
Warning	1292	Truncated incorrect DOUBLE value: '11:13:11 '
Warning	1292	Truncated incorrect DOUBLE value: '11:14:11 '
UPDATE Z0CASE SET z0_test0=1234322312122 WHERE z0_test1='2011-11-11 ';
UPDATE Z0CASE SET z0_test0='@$%*&$#@12334556   4DFDDddfgdsfgjhrsdd[];/.,\\//' WHERE z0_test0=1234322312122;
ERROR 42000: Invalid numeric
UPDATE Z0CASE SET z0_test0='@$%*&$#@12334556   4DFDDddfgdsfgjhrsdd[];/.,\\//' WHERE z0_test0='1234322312122';
SELECT * FROM Z0CASE ORDER BY Z0_TEST3*1;
z0_test0	Z0_TEST1	Z0_TEST2	Z0_TEST3
NULL	NULL	NULL	NULL
11:11:11 	11:11:11 	11:11:11 	11:11:11 
11:11:11 11:11:1111:11:1111:11:1111:11:11	11:11:11 	11:11:11 	11:12:11 
12345678963258741201236548789652	11:11:11 	11:11:11 	11:13:11 
测试数据+——）（*&……%￥#@！123456789【】、；。/，《》？：Lasdasassffafsads	11:11:11 	11:11:11 	11:14:11 
@$%*&$#@12334556   4DFDDddfgdsfgjhrsdd[];/.,\//	2011-11-11 	2011-11-11 	2011-11-11 
2011-11-11 11:11:11	2011-11-11 11:11:11	2011-11-11 11:11:11	2011-11-11 11:11:11
Warnings:
Warning	1292	Truncated incorrect DOUBLE value: '11:11:11 '
Warning	1292	Truncated incorrect DOUBLE value: '2011-11-11 '
Warning	1292	Truncated incorrect DOUBLE value: '2011-11-11 11:11:11'
Warning	1292	Truncated incorrect DOUBLE value: '11:12:11 '
Warning	1292	Truncated incorrect DOUBLE value: '11:13:11 '
Warning	1292	Truncated incorrect DOUBLE value: '11:14:11 '
DELETE FROM Z0CASE WHERE z0_test0=12345678963258741201236548789652;
ERROR 42000: Invalid numeric
DELETE FROM Z0CASE WHERE z0_test0='12345678963258741201236548789652';
DELETE FROM Z0CASE WHERE z0_test0='@$%*&$#@12334556   4DFDDddfgdsfgjhrsdd[];/.,\\//';
SELECT * FROM Z0CASE ORDER BY Z0_TEST3*1;
z0_test0	Z0_TEST1	Z0_TEST2	Z0_TEST3
NULL	NULL	NULL	NULL
11:11:11 	11:11:11 	11:11:11 	11:11:11 
11:11:11 11:11:1111:11:1111:11:1111:11:11	11:11:11 	11:11:11 	11:12:11 
测试数据+——）（*&……%￥#@！123456789【】、；。/，《》？：Lasdasassffafsads	11:11:11 	11:11:11 	11:14:11 
2011-11-11 11:11:11	2011-11-11 11:11:11	2011-11-11 11:11:11	2011-11-11 11:11:11
Warnings:
Warning	1292	Truncated incorrect DOUBLE value: '11:11:11 '
Warning	1292	Truncated incorrect DOUBLE value: '2011-11-11 11:11:11'
Warning	1292	Truncated incorrect DOUBLE value: '11:12:11 '
Warning	1292	Truncated incorrect DOUBLE value: '11:14:11 '
ALTER TABLE Z0CASE MODIFY COLUMN Z0_TEST2 MEDIUMTEXT;
SELECT * FROM Z0CASE ORDER BY Z0_TEST3*1;
z0_test0	Z0_TEST1	Z0_TEST2	Z0_TEST3
NULL	NULL	NULL	NULL
11:11:11 	11:11:11 	11:11:11 	11:11:11 
11:11:11 11:11:1111:11:1111:11:1111:11:11	11:11:11 	11:11:11 	11:12:11 
测试数据+——）（*&……%￥#@！123456789【】、；。/，《》？：Lasdasassffafsads	11:11:11 	11:11:11 	11:14:11 
2011-11-11 11:11:11	2011-11-11 11:11:11	2011-11-11 11:11:11	2011-11-11 11:11:11
Warnings:
Warning	1292	Truncated incorrect DOUBLE value: '11:11:11 '
Warning	1292	Truncated incorrect DOUBLE value: '2011-11-11 11:11:11'
Warning	1292	Truncated incorrect DOUBLE value: '11:12:11 '
Warning	1292	Truncated incorrect DOUBLE value: '11:14:11 '
DESC Z0CASE;
Field	Type	Null	Key	Default	Extra
z0_test0	mediumtext	YES		NULL	
Z0_TEST1	text	YES		NULL	
Z0_TEST2	mediumtext	YES		NULL	
Z0_TEST3	longtext	YES		NULL	
SELECT table_id,table_name FROM oceanbase.__all_virtual_table WHERE table_name='Z0CASE';
ALTER TABLE Z0CASE MODIFY COLUMN Z0_TEST3 MEDIUMTEXT;
SELECT * FROM Z0CASE ORDER BY Z0_TEST3*1;
z0_test0	Z0_TEST1	Z0_TEST2	Z0_TEST3
NULL	NULL	NULL	NULL
11:11:11 	11:11:11 	11:11:11 	11:11:11 
11:11:11 11:11:1111:11:1111:11:1111:11:11	11:11:11 	11:11:11 	11:12:11 
测试数据+——）（*&……%￥#@！123456789【】、；。/，《》？：Lasdasassffafsads	11:11:11 	11:11:11 	11:14:11 
2011-11-11 11:11:11	2011-11-11 11:11:11	2011-11-11 11:11:11	2011-11-11 11:11:11
Warnings:
Warning	1292	Truncated incorrect DOUBLE value: '11:11:11 '
Warning	1292	Truncated incorrect DOUBLE value: '2011-11-11 11:11:11'
Warning	1292	Truncated incorrect DOUBLE value: '11:12:11 '
Warning	1292	Truncated incorrect DOUBLE value: '11:14:11 '
DESC Z0CASE;
Field	Type	Null	Key	Default	Extra
z0_test0	mediumtext	YES		NULL	
Z0_TEST1	text	YES		NULL	
Z0_TEST2	mediumtext	YES		NULL	
Z0_TEST3	mediumtext	YES		NULL	
SELECT table_id,table_name FROM oceanbase.__all_virtual_table WHERE table_name='Z0CASE';
LONGTEXT -->LONGTEXT
DROP TABLE Z0CASE;
CREATE TABLE Z0CASE(Z0_TEST0 TINYTEXT, Z0_TEST1 text,Z0_TEST2 MEDIUMTEXT,Z0_TEST3 LONGTEXT) with column group (all columns, each column);
INSERT INTO  Z0CASE (z0_test0,z0_test1,Z0_TEST2,Z0_TEST3)VALUES('11:11:11 ','11:11:11 ','11:11:11 ','11:11:11 ');
INSERT INTO  Z0CASE (z0_test0,z0_test1,Z0_TEST2,Z0_TEST3)VALUES('2011-11-11 ','2011-11-11 ','2011-11-11 ','2011-11-11 ');
INSERT INTO  Z0CASE (z0_test0,z0_test1,Z0_TEST2,Z0_TEST3)VALUES('2011-11-11 11:11:11','2011-11-11 11:11:11','2011-11-11 11:11:11','2011-11-11 11:11:11');
INSERT INTO  Z0CASE (z0_test0,z0_test1,Z0_TEST2,Z0_TEST3)VALUES(NULL,NULL,NULL,NULL);
SELECT * FROM Z0CASE ORDER BY Z0_TEST3*1;
Z0_TEST0	Z0_TEST1	Z0_TEST2	Z0_TEST3
NULL	NULL	NULL	NULL
11:11:11 	11:11:11 	11:11:11 	11:11:11 
2011-11-11 	2011-11-11 	2011-11-11 	2011-11-11 
2011-11-11 11:11:11	2011-11-11 11:11:11	2011-11-11 11:11:11	2011-11-11 11:11:11
Warnings:
Warning	1292	Truncated incorrect DOUBLE value: '11:11:11 '
Warning	1292	Truncated incorrect DOUBLE value: '2011-11-11 '
Warning	1292	Truncated incorrect DOUBLE value: '2011-11-11 11:11:11'
SELECT table_id,table_name FROM oceanbase.__all_virtual_table WHERE table_name='Z0CASE';
ALTER TABLE Z0CASE MODIFY COLUMN z0_test0 LONGTEXT;
SELECT * FROM Z0CASE ORDER BY Z0_TEST3*1;
z0_test0	Z0_TEST1	Z0_TEST2	Z0_TEST3
NULL	NULL	NULL	NULL
11:11:11 	11:11:11 	11:11:11 	11:11:11 
2011-11-11 	2011-11-11 	2011-11-11 	2011-11-11 
2011-11-11 11:11:11	2011-11-11 11:11:11	2011-11-11 11:11:11	2011-11-11 11:11:11
Warnings:
Warning	1292	Truncated incorrect DOUBLE value: '11:11:11 '
Warning	1292	Truncated incorrect DOUBLE value: '2011-11-11 '
Warning	1292	Truncated incorrect DOUBLE value: '2011-11-11 11:11:11'
DESC Z0CASE;
Field	Type	Null	Key	Default	Extra
z0_test0	longtext	YES		NULL	
Z0_TEST1	text	YES		NULL	
Z0_TEST2	mediumtext	YES		NULL	
Z0_TEST3	longtext	YES		NULL	
SELECT table_id,table_name FROM oceanbase.__all_virtual_table WHERE table_name='Z0CASE';
INSERT INTO  Z0CASE (z0_test0,z0_test1,Z0_TEST2,Z0_TEST3)VALUES('11:11:11 11:11:1111:11:1111:11:1111:11:11','11:11:11 ','11:11:11 ','11:21:11 ');
INSERT INTO  Z0CASE (z0_test0,z0_test1,Z0_TEST2,Z0_TEST3)VALUES(12345678963258741201236548789652,'11:11:11 ','11:11:11 ','11:31:11 ');
INSERT INTO  Z0CASE (z0_test0,z0_test1,Z0_TEST2,Z0_TEST3)VALUES('测试数据+——）（*&……%￥#@！123456789【】、；。/，《》？：Lasdasassffafsads','11:11:11 ','11:11:11 ','11:14:11 ');
SELECT * FROM Z0CASE ORDER BY Z0_TEST3*1;
z0_test0	Z0_TEST1	Z0_TEST2	Z0_TEST3
NULL	NULL	NULL	NULL
11:11:11 	11:11:11 	11:11:11 	11:11:11 
11:11:11 11:11:1111:11:1111:11:1111:11:11	11:11:11 	11:11:11 	11:21:11 
12345678963258741201236548789652	11:11:11 	11:11:11 	11:31:11 
测试数据+——）（*&……%￥#@！123456789【】、；。/，《》？：Lasdasassffafsads	11:11:11 	11:11:11 	11:14:11 
2011-11-11 	2011-11-11 	2011-11-11 	2011-11-11 
2011-11-11 11:11:11	2011-11-11 11:11:11	2011-11-11 11:11:11	2011-11-11 11:11:11
Warnings:
Warning	1292	Truncated incorrect DOUBLE value: '11:11:11 '
Warning	1292	Truncated incorrect DOUBLE value: '2011-11-11 '
Warning	1292	Truncated incorrect DOUBLE value: '2011-11-11 11:11:11'
Warning	1292	Truncated incorrect DOUBLE value: '11:21:11 '
Warning	1292	Truncated incorrect DOUBLE value: '11:31:11 '
Warning	1292	Truncated incorrect DOUBLE value: '11:14:11 '
UPDATE Z0CASE SET z0_test0=1234322312122 WHERE z0_test1='2011-11-11 ';
UPDATE Z0CASE SET z0_test0='@$%*&$#@12334556   4DFDDddfgdsfgjhrsdd[];/.,\\//' WHERE z0_test0=1234322312122;
ERROR 42000: Invalid numeric
UPDATE Z0CASE SET z0_test0='@$%*&$#@12334556   4DFDDddfgdsfgjhrsdd[];/.,\\//' WHERE z0_test0='1234322312122';
SELECT * FROM Z0CASE ORDER BY Z0_TEST3*1;
z0_test0	Z0_TEST1	Z0_TEST2	Z0_TEST3
NULL	NULL	NULL	NULL
11:11:11 	11:11:11 	11:11:11 	11:11:11 
11:11:11 11:11:1111:11:1111:11:1111:11:11	11:11:11 	11:11:11 	11:21:11 
12345678963258741201236548789652	11:11:11 	11:11:11 	11:31:11 
测试数据+——）（*&……%￥#@！123456789【】、；。/，《》？：Lasdasassffafsads	11:11:11 	11:11:11 	11:14:11 
@$%*&$#@12334556   4DFDDddfgdsfgjhrsdd[];/.,\//	2011-11-11 	2011-11-11 	2011-11-11 
2011-11-11 11:11:11	2011-11-11 11:11:11	2011-11-11 11:11:11	2011-11-11 11:11:11
Warnings:
Warning	1292	Truncated incorrect DOUBLE value: '11:11:11 '
Warning	1292	Truncated incorrect DOUBLE value: '2011-11-11 '
Warning	1292	Truncated incorrect DOUBLE value: '2011-11-11 11:11:11'
Warning	1292	Truncated incorrect DOUBLE value: '11:21:11 '
Warning	1292	Truncated incorrect DOUBLE value: '11:31:11 '
Warning	1292	Truncated incorrect DOUBLE value: '11:14:11 '
DELETE FROM Z0CASE WHERE z0_test0=12345678963258741201236548789652;
ERROR 42000: Invalid numeric
DELETE FROM Z0CASE WHERE z0_test0='12345678963258741201236548789652';
DELETE FROM Z0CASE WHERE z0_test0='@$%*&$#@12334556   4DFDDddfgdsfgjhrsdd[];/.,\\//';
SELECT * FROM Z0CASE ORDER BY Z0_TEST3*1;
z0_test0	Z0_TEST1	Z0_TEST2	Z0_TEST3
NULL	NULL	NULL	NULL
11:11:11 	11:11:11 	11:11:11 	11:11:11 
11:11:11 11:11:1111:11:1111:11:1111:11:11	11:11:11 	11:11:11 	11:21:11 
测试数据+——）（*&……%￥#@！123456789【】、；。/，《》？：Lasdasassffafsads	11:11:11 	11:11:11 	11:14:11 
2011-11-11 11:11:11	2011-11-11 11:11:11	2011-11-11 11:11:11	2011-11-11 11:11:11
Warnings:
Warning	1292	Truncated incorrect DOUBLE value: '11:11:11 '
Warning	1292	Truncated incorrect DOUBLE value: '2011-11-11 11:11:11'
Warning	1292	Truncated incorrect DOUBLE value: '11:21:11 '
Warning	1292	Truncated incorrect DOUBLE value: '11:14:11 '
ALTER TABLE Z0CASE MODIFY COLUMN Z0_TEST3 LONGTEXT;
SELECT z0_test3 FROM Z0CASE;
z0_test3
11:11:11 
2011-11-11 11:11:11
NULL
11:21:11 
11:14:11 
DESC Z0CASE;
Field	Type	Null	Key	Default	Extra
z0_test0	longtext	YES		NULL	
Z0_TEST1	text	YES		NULL	
Z0_TEST2	mediumtext	YES		NULL	
Z0_TEST3	longtext	YES		NULL	
SELECT table_id,table_name FROM oceanbase.__all_virtual_table WHERE table_name='Z0CASE';
其他字符类型
DROP TABLE Z0CASE;
CREATE TABLE Z0CASE(Z0_TEST0 TINYTEXT, Z0_TEST1 text,Z0_TEST2 MEDIUMTEXT,Z0_TEST3 LONGTEXT) with column group (all columns, each column);
INSERT INTO  Z0CASE (z0_test0,z0_test1,Z0_TEST2,Z0_TEST3)VALUES('11111111111','111','111','111');
INSERT INTO  Z0CASE (z0_test0,z0_test1,Z0_TEST2,Z0_TEST3)VALUES('111.111','111.111','111.111','111.111');
INSERT INTO  Z0CASE (z0_test0,z0_test1,Z0_TEST2,Z0_TEST3)VALUES('0.000','0.000','0.000','0.000');
INSERT INTO  Z0CASE (z0_test0,z0_test1,Z0_TEST2,Z0_TEST3)VALUES(NULL,NULL,0,null);
SELECT * FROM Z0CASE ORDER BY Z0_TEST3*1;
Z0_TEST0	Z0_TEST1	Z0_TEST2	Z0_TEST3
NULL	NULL	0	NULL
0.000	0.000	0.000	0.000
11111111111	111	111	111
111.111	111.111	111.111	111.111
SELECT table_id,table_name FROM oceanbase.__all_virtual_table WHERE table_name='Z0CASE';
ALTER TABLE Z0CASE MODIFY COLUMN z0_test0 INT(255);
ERROR 22003: Out of range value for column
ALTER TABLE Z0CASE MODIFY COLUMN z0_test1 INT;
SELECT * FROM Z0CASE ORDER BY Z0_TEST3*1;
Z0_TEST0	z0_test1	Z0_TEST2	Z0_TEST3
NULL	NULL	0	NULL
0.000	0	0.000	0.000
11111111111	111	111	111
111.111	111	111.111	111.111
DESC Z0CASE;
Field	Type	Null	Key	Default	Extra
Z0_TEST0	tinytext	YES		NULL	
z0_test1	int(11)	YES		NULL	
Z0_TEST2	mediumtext	YES		NULL	
Z0_TEST3	longtext	YES		NULL	
SELECT table_id,table_name FROM oceanbase.__all_virtual_table WHERE table_name='Z0CASE';
ALTER TABLE Z0CASE MODIFY COLUMN Z0_TEST3 INT;
SELECT * FROM Z0CASE ORDER BY Z0_TEST3;
Z0_TEST0	z0_test1	Z0_TEST2	Z0_TEST3
NULL	NULL	0	NULL
0.000	0	0.000	0
11111111111	111	111	111
111.111	111	111.111	111
DESC Z0CASE;
Field	Type	Null	Key	Default	Extra
Z0_TEST0	tinytext	YES		NULL	
z0_test1	int(11)	YES		NULL	
Z0_TEST2	mediumtext	YES		NULL	
Z0_TEST3	int(11)	YES		NULL	
SELECT table_id,table_name FROM oceanbase.__all_virtual_table WHERE table_name='Z0CASE';
DROP TABLE Z0CASE;
CREATE TABLE Z0CASE(Z0_TEST0 TINYTEXT, Z0_TEST1 text,Z0_TEST2 MEDIUMTEXT,Z0_TEST3 LONGTEXT) with column group (all columns, each column);
INSERT INTO  Z0CASE (z0_test0,z0_test1,Z0_TEST2,Z0_TEST3)VALUES('11:11:11 ','11:11:11 ','11:11:11 ','11:11:11 ');
INSERT INTO  Z0CASE (z0_test0,z0_test1,Z0_TEST2,Z0_TEST3)VALUES('2011-11-11 ','2011-11-11 ','2011-11-11 ','2011-11-11 11:12:11');
INSERT INTO  Z0CASE (z0_test0,z0_test1,Z0_TEST2,Z0_TEST3)VALUES('2011-11-11 11:11:11','2011-11-11 11:11:11','2011-11-11 11:11:11','2011-11-11 11:22:11');
INSERT INTO  Z0CASE (z0_test0,z0_test1,Z0_TEST2,Z0_TEST3)VALUES(NULL,NULL,NULL,NULL);
SELECT * FROM Z0CASE ORDER BY Z0_TEST3*1;
Z0_TEST0	Z0_TEST1	Z0_TEST2	Z0_TEST3
NULL	NULL	NULL	NULL
11:11:11 	11:11:11 	11:11:11 	11:11:11 
2011-11-11 	2011-11-11 	2011-11-11 	2011-11-11 11:12:11
2011-11-11 11:11:11	2011-11-11 11:11:11	2011-11-11 11:11:11	2011-11-11 11:22:11
Warnings:
Warning	1292	Truncated incorrect DOUBLE value: '11:11:11 '
Warning	1292	Truncated incorrect DOUBLE value: '2011-11-11 11:12:11'
Warning	1292	Truncated incorrect DOUBLE value: '2011-11-11 11:22:11'
SELECT table_id,table_name FROM oceanbase.__all_virtual_table WHERE table_name='Z0CASE';
ALTER TABLE Z0CASE MODIFY COLUMN z0_test0 DATE;
SELECT * FROM Z0CASE ORDER BY Z0_TEST3*1;
z0_test0	Z0_TEST1	Z0_TEST2	Z0_TEST3
NULL	NULL	NULL	NULL
2011-11-11	11:11:11 	11:11:11 	11:11:11 
2011-11-11	2011-11-11 	2011-11-11 	2011-11-11 11:12:11
2011-11-11	2011-11-11 11:11:11	2011-11-11 11:11:11	2011-11-11 11:22:11
Warnings:
Warning	1292	Truncated incorrect DOUBLE value: '11:11:11 '
Warning	1292	Truncated incorrect DOUBLE value: '2011-11-11 11:12:11'
Warning	1292	Truncated incorrect DOUBLE value: '2011-11-11 11:22:11'
DESC Z0CASE;
Field	Type	Null	Key	Default	Extra
z0_test0	date	YES		NULL	
Z0_TEST1	text	YES		NULL	
Z0_TEST2	mediumtext	YES		NULL	
Z0_TEST3	longtext	YES		NULL	
SELECT table_id,table_name FROM oceanbase.__all_virtual_table WHERE table_name='Z0CASE';
ALTER TABLE Z0CASE MODIFY COLUMN z0_test1 DATETIME;
SELECT * FROM Z0CASE ORDER BY Z0_TEST3*1;
z0_test0	z0_test1	Z0_TEST2	Z0_TEST3
NULL	NULL	NULL	NULL
2011-11-11	2011-11-11 00:00:00	11:11:11 	11:11:11 
2011-11-11	2011-11-11 00:00:00	2011-11-11 	2011-11-11 11:12:11
2011-11-11	2011-11-11 11:11:11	2011-11-11 11:11:11	2011-11-11 11:22:11
Warnings:
Warning	1292	Truncated incorrect DOUBLE value: '11:11:11 '
Warning	1292	Truncated incorrect DOUBLE value: '2011-11-11 11:12:11'
Warning	1292	Truncated incorrect DOUBLE value: '2011-11-11 11:22:11'
DESC Z0CASE;
Field	Type	Null	Key	Default	Extra
z0_test0	date	YES		NULL	
z0_test1	datetime	YES		NULL	
Z0_TEST2	mediumtext	YES		NULL	
Z0_TEST3	longtext	YES		NULL	
SELECT table_id,table_name FROM oceanbase.__all_virtual_table WHERE table_name='Z0CASE';
ALTER TABLE Z0CASE MODIFY COLUMN z0_test2 TIMESTAMP;
SELECT * FROM Z0CASE ORDER BY Z0_TEST3*1;
z0_test0	z0_test1	z0_test2	Z0_TEST3
NULL	NULL	NULL	NULL
2011-11-11	2011-11-11 00:00:00	2011-11-11 00:00:00	11:11:11 
2011-11-11	2011-11-11 00:00:00	2011-11-11 00:00:00	2011-11-11 11:12:11
2011-11-11	2011-11-11 11:11:11	2011-11-11 11:11:11	2011-11-11 11:22:11
Warnings:
Warning	1292	Truncated incorrect DOUBLE value: '11:11:11 '
Warning	1292	Truncated incorrect DOUBLE value: '2011-11-11 11:12:11'
Warning	1292	Truncated incorrect DOUBLE value: '2011-11-11 11:22:11'
DESC Z0CASE;
Field	Type	Null	Key	Default	Extra
z0_test0	date	YES		NULL	
z0_test1	datetime	YES		NULL	
z0_test2	timestamp	YES		NULL	
Z0_TEST3	longtext	YES		NULL	
SELECT table_id,table_name FROM oceanbase.__all_virtual_table WHERE table_name='Z0CASE';
ALTER TABLE Z0CASE MODIFY COLUMN Z0_TEST3 time;
SELECT * FROM Z0CASE ORDER BY Z0_TEST3;
z0_test0	z0_test1	z0_test2	Z0_TEST3
NULL	NULL	NULL	NULL
2011-11-11	2011-11-11 00:00:00	2011-11-11 00:00:00	11:11:11
2011-11-11	2011-11-11 00:00:00	2011-11-11 00:00:00	11:12:11
2011-11-11	2011-11-11 11:11:11	2011-11-11 11:11:11	11:22:11
DESC Z0CASE;
Field	Type	Null	Key	Default	Extra
z0_test0	date	YES		NULL	
z0_test1	datetime	YES		NULL	
z0_test2	timestamp	YES		NULL	
Z0_TEST3	time	YES		NULL	
SELECT table_id,table_name FROM oceanbase.__all_virtual_table WHERE table_name='Z0CASE';
SET/ENUM
DROP TABLE Z0CASE;
CREATE TABLE Z0CASE(Z0_TEST0 SET('','ABC','12321','0'), Z0_TEST1 ENUM('','ABC','12321','0')) with column group (all columns, each column);
INSERT INTO  Z0CASE (z0_test0,z0_test1)VALUES('','');
INSERT INTO  Z0CASE (z0_test0,z0_test1)VALUES('ABC','ABC');
INSERT INTO  Z0CASE (z0_test0,z0_test1)VALUES('12321','12321');
INSERT INTO  Z0CASE (z0_test0,z0_test1)VALUES('0','0');
INSERT INTO  Z0CASE (z0_test0,z0_test1)VALUES(NULL,NULL);
SELECT * FROM Z0CASE ORDER BY Z0_TEST1*1;
Z0_TEST0	Z0_TEST1
NULL	NULL
	
ABC	ABC
12321	12321
0	0
SELECT table_id,table_name FROM oceanbase.__all_virtual_table WHERE table_name='Z0CASE';
ALTER TABLE Z0CASE MODIFY COLUMN Z0_TEST1 ENUM ('','ABC','12321','0','123','123213213') ;
SELECT * FROM Z0CASE ORDER BY Z0_TEST1*1;
Z0_TEST0	Z0_TEST1
NULL	NULL
	
ABC	ABC
12321	12321
0	0
DESC Z0CASE;
Field	Type	Null	Key	Default	Extra
Z0_TEST0	set('','ABC','12321','0')	YES		NULL	
Z0_TEST1	enum('','ABC','12321','0','123','123213213')	YES		NULL	
SELECT table_id,table_name FROM oceanbase.__all_virtual_table WHERE table_name='Z0CASE';
ALTER TABLE Z0CASE MODIFY COLUMN Z0_TEST0 SET ('','ABC','12321','0') ;
SELECT * FROM Z0CASE ORDER BY Z0_TEST1*1;
Z0_TEST0	Z0_TEST1
NULL	NULL
	
ABC	ABC
12321	12321
0	0
DESC Z0CASE;
Field	Type	Null	Key	Default	Extra
Z0_TEST0	set('','ABC','12321','0')	YES		NULL	
Z0_TEST1	enum('','ABC','12321','0','123','123213213')	YES		NULL	
SELECT table_id,table_name FROM oceanbase.__all_virtual_table WHERE table_name='Z0CASE';
ALTER TABLE Z0CASE MODIFY COLUMN Z0_TEST0 ENUM ('','ABC','12321','0') ;
SELECT * FROM Z0CASE ORDER BY Z0_TEST1*1;
Z0_TEST0	Z0_TEST1
NULL	NULL
	
ABC	ABC
12321	12321
0	0
DESC Z0CASE;
Field	Type	Null	Key	Default	Extra
Z0_TEST0	enum('','ABC','12321','0')	YES		NULL	
Z0_TEST1	enum('','ABC','12321','0','123','123213213')	YES		NULL	
SELECT table_id,table_name FROM oceanbase.__all_virtual_table WHERE table_name='Z0CASE';
ALTER TABLE Z0CASE MODIFY COLUMN Z0_TEST0 SET ('','ABC','12321','0','123') ;
SELECT * FROM Z0CASE ORDER BY Z0_TEST1*1;
Z0_TEST0	Z0_TEST1
NULL	NULL
	
ABC	ABC
12321	12321
0	0
DESC Z0CASE;
Field	Type	Null	Key	Default	Extra
Z0_TEST0	set('','ABC','12321','0','123')	YES		NULL	
Z0_TEST1	enum('','ABC','12321','0','123','123213213')	YES		NULL	
SELECT table_id,table_name FROM oceanbase.__all_virtual_table WHERE table_name='Z0CASE';
ALTER TABLE Z0CASE MODIFY COLUMN Z0_TEST0 SET ('12321','0','123');
ERROR 01000: Data truncated for argument
ALTER TABLE Z0CASE MODIFY COLUMN Z0_TEST1 ENUM ('','ABC','12321','0');
SELECT * FROM Z0CASE ORDER BY Z0_TEST1*1;
Z0_TEST0	Z0_TEST1
NULL	NULL
	
ABC	ABC
12321	12321
0	0
DESC Z0CASE;
Field	Type	Null	Key	Default	Extra
Z0_TEST0	set('','ABC','12321','0','123')	YES		NULL	
Z0_TEST1	enum('','ABC','12321','0')	YES		NULL	
SELECT table_id,table_name FROM oceanbase.__all_virtual_table WHERE table_name='Z0CASE';
ALTER TABLE Z0CASE MODIFY COLUMN Z0_TEST1 SET ('','ABC','12321','0');
SELECT * FROM Z0CASE ORDER BY Z0_TEST1*1;
Z0_TEST0	Z0_TEST1
NULL	NULL
	
ABC	ABC
12321	12321
0	0
DESC Z0CASE;
Field	Type	Null	Key	Default	Extra
Z0_TEST0	set('','ABC','12321','0','123')	YES		NULL	
Z0_TEST1	set('','ABC','12321','0')	YES		NULL	
SELECT table_id,table_name FROM oceanbase.__all_virtual_table WHERE table_name='Z0CASE';
ALTER TABLE Z0CASE MODIFY COLUMN Z0_TEST1 ENUM ('','ABC','12321','0','123');
SELECT * FROM Z0CASE ORDER BY Z0_TEST1*1;
Z0_TEST0	Z0_TEST1
NULL	NULL
	
ABC	ABC
12321	12321
0	0
DESC Z0CASE;
Field	Type	Null	Key	Default	Extra
Z0_TEST0	set('','ABC','12321','0','123')	YES		NULL	
Z0_TEST1	enum('','ABC','12321','0','123')	YES		NULL	
SELECT table_id,table_name FROM oceanbase.__all_virtual_table WHERE table_name='Z0CASE';
ALTER TABLE Z0CASE MODIFY COLUMN Z0_TEST1 ENUM ('12321','0') ;
ERROR 01000: Data truncated for argument
SET/ENUM --> CHAR/VARCHAR
DROP TABLE Z0CASE;
CREATE TABLE Z0CASE(Z0_TEST0 SET('','ABC','12321','0'), Z0_TEST1 ENUM('','ABC','12321','0')) with column group (all columns, each column);
INSERT INTO  Z0CASE (z0_test0,z0_test1)VALUES('','');
INSERT INTO  Z0CASE (z0_test0,z0_test1)VALUES('ABC','ABC');
INSERT INTO  Z0CASE (z0_test0,z0_test1)VALUES('12321','12321');
INSERT INTO  Z0CASE (z0_test0,z0_test1)VALUES('0','0');
INSERT INTO  Z0CASE (z0_test0,z0_test1)VALUES(NULL,NULL);
SELECT * FROM Z0CASE ORDER BY Z0_TEST1*1;
Z0_TEST0	Z0_TEST1
NULL	NULL
	
ABC	ABC
12321	12321
0	0
SELECT table_id,table_name FROM oceanbase.__all_virtual_table WHERE table_name='Z0CASE';
ALTER TABLE Z0CASE MODIFY COLUMN z0_test0 CHAR(100) ;
SELECT * FROM Z0CASE ORDER BY Z0_TEST1*1;
z0_test0	Z0_TEST1
NULL	NULL
	
ABC	ABC
12321	12321
0	0
DESC Z0CASE;
Field	Type	Null	Key	Default	Extra
z0_test0	char(100)	YES		NULL	
Z0_TEST1	enum('','ABC','12321','0')	YES		NULL	
SELECT table_id,table_name FROM oceanbase.__all_virtual_table WHERE table_name='Z0CASE';
ALTER TABLE Z0CASE MODIFY COLUMN Z0_TEST1 CHAR(100) ;
SELECT * FROM Z0CASE ORDER BY Z0_TEST1*1;
z0_test0	Z0_TEST1
NULL	NULL
	
ABC	ABC
0	0
12321	12321
Warnings:
Warning	1292	Truncated incorrect DOUBLE value: 'ABC'
DESC Z0CASE;
Field	Type	Null	Key	Default	Extra
z0_test0	char(100)	YES		NULL	
Z0_TEST1	char(100)	YES		NULL	
SELECT table_id,table_name FROM oceanbase.__all_virtual_table WHERE table_name='Z0CASE';
DROP TABLE Z0CASE;
CREATE TABLE Z0CASE(Z0_TEST0 SET('','ABC','12321','0'), Z0_TEST1 ENUM('','ABC','12321','0')) with column group (all columns, each column);
INSERT INTO  Z0CASE (z0_test0,z0_test1)VALUES('','');
INSERT INTO  Z0CASE (z0_test0,z0_test1)VALUES('ABC','ABC');
INSERT INTO  Z0CASE (z0_test0,z0_test1)VALUES('12321','12321');
INSERT INTO  Z0CASE (z0_test0,z0_test1)VALUES('0','0');
INSERT INTO  Z0CASE (z0_test0,z0_test1)VALUES(NULL,NULL);
SELECT * FROM Z0CASE ORDER BY Z0_TEST1*1;
Z0_TEST0	Z0_TEST1
NULL	NULL
	
ABC	ABC
12321	12321
0	0
SELECT table_id,table_name FROM oceanbase.__all_virtual_table WHERE table_name='Z0CASE';
ALTER TABLE Z0CASE MODIFY COLUMN z0_test0 VARCHAR(100) ;
SELECT * FROM Z0CASE ORDER BY Z0_TEST1*1;
z0_test0	Z0_TEST1
NULL	NULL
	
ABC	ABC
12321	12321
0	0
DESC Z0CASE;
Field	Type	Null	Key	Default	Extra
z0_test0	varchar(100)	YES		NULL	
Z0_TEST1	enum('','ABC','12321','0')	YES		NULL	
SELECT table_id,table_name FROM oceanbase.__all_virtual_table WHERE table_name='Z0CASE';
ALTER TABLE Z0CASE MODIFY COLUMN Z0_TEST1 VARCHAR(100) ;
SELECT * FROM Z0CASE ORDER BY Z0_TEST1*1;
z0_test0	Z0_TEST1
NULL	NULL
	
ABC	ABC
0	0
12321	12321
Warnings:
Warning	1292	Truncated incorrect DOUBLE value: 'ABC'
DESC Z0CASE;
Field	Type	Null	Key	Default	Extra
z0_test0	varchar(100)	YES		NULL	
Z0_TEST1	varchar(100)	YES		NULL	
SELECT table_id,table_name FROM oceanbase.__all_virtual_table WHERE table_name='Z0CASE';
DROP TABLE Z0CASE;
CREATE TABLE Z0CASE(Z0_TEST0 SET('','ABC','12321','0'), Z0_TEST1 ENUM('','ABC','12321','0')) with column group (all columns, each column);
INSERT INTO  Z0CASE (z0_test0,z0_test1)VALUES('','');
INSERT INTO  Z0CASE (z0_test0,z0_test1)VALUES('ABC','ABC');
INSERT INTO  Z0CASE (z0_test0,z0_test1)VALUES('12321','12321');
INSERT INTO  Z0CASE (z0_test0,z0_test1)VALUES('0','0');
INSERT INTO  Z0CASE (z0_test0,z0_test1)VALUES(NULL,NULL);
SELECT * FROM Z0CASE ORDER BY Z0_TEST1*1;
Z0_TEST0	Z0_TEST1
NULL	NULL
	
ABC	ABC
12321	12321
0	0
SELECT table_id,table_name FROM oceanbase.__all_virtual_table WHERE table_name='Z0CASE';
ALTER TABLE Z0CASE MODIFY COLUMN z0_test0 BLOB ;
SELECT * FROM Z0CASE ORDER BY Z0_TEST1*1;
z0_test0	Z0_TEST1
NULL	NULL
	
ABC	ABC
12321	12321
0	0
DESC Z0CASE;
Field	Type	Null	Key	Default	Extra
z0_test0	blob	YES		NULL	
Z0_TEST1	enum('','ABC','12321','0')	YES		NULL	
SELECT table_id,table_name FROM oceanbase.__all_virtual_table WHERE table_name='Z0CASE';
ALTER TABLE Z0CASE MODIFY COLUMN Z0_TEST1 BLOB ;
SELECT * FROM Z0CASE ORDER BY Z0_TEST1*1;
z0_test0	Z0_TEST1
NULL	NULL
	
ABC	ABC
0	0
12321	12321
Warnings:
Warning	1292	Truncated incorrect DOUBLE value: 'ABC'
DESC Z0CASE;
Field	Type	Null	Key	Default	Extra
z0_test0	blob	YES		NULL	
Z0_TEST1	blob	YES		NULL	
SELECT table_id,table_name FROM oceanbase.__all_virtual_table WHERE table_name='Z0CASE';
DROP TABLE Z0CASE;
CREATE TABLE Z0CASE(Z0_TEST0 SET('','ABC','12321','0'), Z0_TEST1 ENUM('','ABC','12321','0')) with column group (all columns, each column);
INSERT INTO  Z0CASE (z0_test0,z0_test1)VALUES('','');
INSERT INTO  Z0CASE (z0_test0,z0_test1)VALUES('ABC','ABC');
INSERT INTO  Z0CASE (z0_test0,z0_test1)VALUES('12321','12321');
INSERT INTO  Z0CASE (z0_test0,z0_test1)VALUES('0','0');
INSERT INTO  Z0CASE (z0_test0,z0_test1)VALUES(NULL,NULL);
SELECT * FROM Z0CASE ORDER BY Z0_TEST1*1;
Z0_TEST0	Z0_TEST1
NULL	NULL
	
ABC	ABC
12321	12321
0	0
SELECT table_id,table_name FROM oceanbase.__all_virtual_table WHERE table_name='Z0CASE';
ALTER TABLE Z0CASE MODIFY COLUMN z0_test0 text ;
SELECT * FROM Z0CASE ORDER BY Z0_TEST1*1;
z0_test0	Z0_TEST1
NULL	NULL
	
ABC	ABC
12321	12321
0	0
DESC Z0CASE;
Field	Type	Null	Key	Default	Extra
z0_test0	text	YES		NULL	
Z0_TEST1	enum('','ABC','12321','0')	YES		NULL	
SELECT table_id,table_name FROM oceanbase.__all_virtual_table WHERE table_name='Z0CASE';
ALTER TABLE Z0CASE MODIFY COLUMN Z0_TEST1 TINYTEXT ;
SELECT * FROM Z0CASE ORDER BY Z0_TEST1*1;
z0_test0	Z0_TEST1
NULL	NULL
	
ABC	ABC
0	0
12321	12321
Warnings:
Warning	1292	Truncated incorrect DOUBLE value: 'ABC'
DESC Z0CASE;
Field	Type	Null	Key	Default	Extra
z0_test0	text	YES		NULL	
Z0_TEST1	tinytext	YES		NULL	
SELECT table_id,table_name FROM oceanbase.__all_virtual_table WHERE table_name='Z0CASE';
SET/ENUM --> INT/FLOAT
DROP TABLE Z0CASE;
CREATE TABLE Z0CASE(Z0_TEST0 SET('','ABC','12321','0'), Z0_TEST1 ENUM('','ABC','12321','0')) with column group (all columns, each column);
INSERT INTO  Z0CASE (z0_test0,z0_test1)VALUES('','');
INSERT INTO  Z0CASE (z0_test0,z0_test1)VALUES('ABC','ABC');
INSERT INTO  Z0CASE (z0_test0,z0_test1)VALUES('12321','12321');
INSERT INTO  Z0CASE (z0_test0,z0_test1)VALUES('0','0');
INSERT INTO  Z0CASE (z0_test0,z0_test1)VALUES(NULL,NULL);
SELECT * FROM Z0CASE ORDER BY Z0_TEST1*1;
Z0_TEST0	Z0_TEST1
NULL	NULL
	
ABC	ABC
12321	12321
0	0
SELECT table_id,table_name FROM oceanbase.__all_virtual_table WHERE table_name='Z0CASE';
ALTER TABLE Z0CASE MODIFY COLUMN z0_test0 INT;
SELECT * FROM Z0CASE ORDER BY Z0_TEST1*1;
z0_test0	Z0_TEST1
NULL	NULL
0	
2	ABC
4	12321
8	0
DESC Z0CASE;
Field	Type	Null	Key	Default	Extra
z0_test0	int(11)	YES		NULL	
Z0_TEST1	enum('','ABC','12321','0')	YES		NULL	
SELECT table_id,table_name FROM oceanbase.__all_virtual_table WHERE table_name='Z0CASE';
ALTER TABLE Z0CASE MODIFY COLUMN Z0_TEST1 INT;
SELECT * FROM Z0CASE ORDER BY Z0_TEST1;
z0_test0	Z0_TEST1
NULL	NULL
0	1
2	2
4	3
8	4
DESC Z0CASE;
Field	Type	Null	Key	Default	Extra
z0_test0	int(11)	YES		NULL	
Z0_TEST1	int(11)	YES		NULL	
SELECT table_id,table_name FROM oceanbase.__all_virtual_table WHERE table_name='Z0CASE';
DROP TABLE Z0CASE;
CREATE TABLE Z0CASE(Z0_TEST0 SET('','ABC','12321','0'), Z0_TEST1 ENUM('','ABC','12321','0')) with column group (all columns, each column);
INSERT INTO  Z0CASE (z0_test0,z0_test1)VALUES('','');
INSERT INTO  Z0CASE (z0_test0,z0_test1)VALUES('ABC','ABC');
INSERT INTO  Z0CASE (z0_test0,z0_test1)VALUES('12321','12321');
INSERT INTO  Z0CASE (z0_test0,z0_test1)VALUES('0','0');
INSERT INTO  Z0CASE (z0_test0,z0_test1)VALUES(NULL,NULL);
SELECT * FROM Z0CASE ORDER BY Z0_TEST1*1;
Z0_TEST0	Z0_TEST1
NULL	NULL
	
ABC	ABC
12321	12321
0	0
SELECT table_id,table_name FROM oceanbase.__all_virtual_table WHERE table_name='Z0CASE';
ALTER TABLE Z0CASE MODIFY COLUMN z0_test0 FLOAT;
SELECT * FROM Z0CASE ORDER BY Z0_TEST1*1;
z0_test0	Z0_TEST1
NULL	NULL
0	
2	ABC
4	12321
8	0
DESC Z0CASE;
Field	Type	Null	Key	Default	Extra
z0_test0	float	YES		NULL	
Z0_TEST1	enum('','ABC','12321','0')	YES		NULL	
SELECT table_id,table_name FROM oceanbase.__all_virtual_table WHERE table_name='Z0CASE';
ALTER TABLE Z0CASE MODIFY COLUMN Z0_TEST1 FLOAT;
SELECT * FROM Z0CASE ORDER BY Z0_TEST1;
z0_test0	Z0_TEST1
NULL	NULL
0	1
2	2
4	3
8	4
DESC Z0CASE;
Field	Type	Null	Key	Default	Extra
z0_test0	float	YES		NULL	
Z0_TEST1	float	YES		NULL	
SELECT table_id,table_name FROM oceanbase.__all_virtual_table WHERE table_name='Z0CASE';
DROP TABLE Z0CASE;
CREATE TABLE Z0CASE(Z0_TEST0 SET('2011-11-11 11:11:11','11:11:11','12321','0','2011-11-21 11:11:11'), Z0_TEST1 ENUM('2011-11-11 11:11:11','11:11:11','12321','0','2011-11-21 11:11:11')) with column group (all columns, each column);
INSERT INTO  Z0CASE (z0_test0,z0_test1)VALUES('11:11:11 ','11:11:11 ');
INSERT INTO  Z0CASE (z0_test0,z0_test1)VALUES('2011-11-21 11:11:11','2011-11-21 11:11:11');
INSERT INTO  Z0CASE (z0_test0,z0_test1)VALUES('2011-11-11 11:11:11','2011-11-11 11:11:11');
INSERT INTO  Z0CASE (z0_test0,z0_test1)VALUES(NULL,NULL);
SELECT * FROM Z0CASE ORDER BY Z0_TEST1*1;
Z0_TEST0	Z0_TEST1
NULL	NULL
2011-11-11 11:11:11	2011-11-11 11:11:11
11:11:11	11:11:11
2011-11-21 11:11:11	2011-11-21 11:11:11
SELECT table_id,table_name FROM oceanbase.__all_virtual_table WHERE table_name='Z0CASE';
ALTER TABLE Z0CASE MODIFY COLUMN z0_test0 DATE ;
SELECT * FROM Z0CASE ORDER BY Z0_TEST1*1;
z0_test0	Z0_TEST1
NULL	NULL
2011-11-11	2011-11-11 11:11:11
2011-11-11	11:11:11
2011-11-21	2011-11-21 11:11:11
DESC Z0CASE;
Field	Type	Null	Key	Default	Extra
z0_test0	date	YES		NULL	
Z0_TEST1	enum('2011-11-11 11:11:11','11:11:11','12321','0','2011-11-21 11:11:11')	YES		NULL	
SELECT table_id,table_name FROM oceanbase.__all_virtual_table WHERE table_name='Z0CASE';
ALTER TABLE Z0CASE MODIFY COLUMN Z0_TEST1 DATE ;
SELECT * FROM Z0CASE ORDER BY Z0_TEST1;
z0_test0	Z0_TEST1
NULL	NULL
2011-11-11	2011-11-11
2011-11-11	2011-11-11
2011-11-21	2011-11-21
DESC Z0CASE;
Field	Type	Null	Key	Default	Extra
z0_test0	date	YES		NULL	
Z0_TEST1	date	YES		NULL	
SELECT table_id,table_name FROM oceanbase.__all_virtual_table WHERE table_name='Z0CASE';
DROP TABLE Z0CASE;
CREATE TABLE Z0CASE(Z0_TEST0 SET('2011-11-11 11:11:11','11:11:11','12321','0','2011-11-11'), Z0_TEST1 ENUM('2011-11-11 11:11:11','11:11:11','12321','0','2011-11-11')) with column group (all columns, each column);
INSERT INTO  Z0CASE (z0_test0,z0_test1)VALUES('11:11:11 ','11:11:11 ');
INSERT INTO  Z0CASE (z0_test0,z0_test1)VALUES('2011-11-11 ','2011-11-11 ');
INSERT INTO  Z0CASE (z0_test0,z0_test1)VALUES('2011-11-11 11:11:11','2011-11-11 11:11:11');
INSERT INTO  Z0CASE (z0_test0,z0_test1)VALUES(NULL,NULL);
SELECT * FROM Z0CASE ORDER BY Z0_TEST1*1;
Z0_TEST0	Z0_TEST1
NULL	NULL
2011-11-11 11:11:11	2011-11-11 11:11:11
11:11:11	11:11:11
2011-11-11	2011-11-11
SELECT table_id,table_name FROM oceanbase.__all_virtual_table WHERE table_name='Z0CASE';
ALTER TABLE Z0CASE MODIFY COLUMN z0_test1 DATETIME;
SELECT Z0_TEST1 FROM Z0CASE ORDER BY Z0_TEST1;
Z0_TEST1
NULL
2011-11-11 00:00:00
2011-11-11 00:00:00
2011-11-11 11:11:11
DESC Z0CASE;
Field	Type	Null	Key	Default	Extra
Z0_TEST0	set('2011-11-11 11:11:11','11:11:11','12321','0','2011-11-11')	YES		NULL	
z0_test1	datetime	YES		NULL	
SELECT table_id,table_name FROM oceanbase.__all_virtual_table WHERE table_name='Z0CASE';
ALTER TABLE Z0CASE MODIFY COLUMN Z0_TEST0 TIMESTAMP ;
SELECT Z0_TEST0 FROM Z0CASE ORDER BY Z0_TEST1;
Z0_TEST0
NULL
2011-11-11 00:00:00
2011-11-11 00:00:00
2011-11-11 11:11:11
DESC Z0CASE;
Field	Type	Null	Key	Default	Extra
Z0_TEST0	timestamp	YES		NULL	
z0_test1	datetime	YES		NULL	
SELECT table_id,table_name FROM oceanbase.__all_virtual_table WHERE table_name='Z0CASE';
DROP TABLE Z0CASE;
CREATE TABLE Z0CASE(Z0_TEST0 SET('2011-11-11 11:11:11','11:11:11','12321','0','2011-11-11'), Z0_TEST1 ENUM('2011-11-11 11:11:11','11:11:11','12321','0','2011-11-11')) with column group (all columns, each column);
INSERT INTO  Z0CASE (z0_test0,z0_test1)VALUES('11:11:11 ','11:11:11 ');
INSERT INTO  Z0CASE (z0_test0,z0_test1)VALUES('2011-11-11 ','2011-11-11 ');
INSERT INTO  Z0CASE (z0_test0,z0_test1)VALUES('2011-11-11 11:11:11','2011-11-11 11:11:11');
INSERT INTO  Z0CASE (z0_test0,z0_test1)VALUES(NULL,NULL);
SELECT * FROM Z0CASE ORDER BY Z0_TEST1*1;
Z0_TEST0	Z0_TEST1
NULL	NULL
2011-11-11 11:11:11	2011-11-11 11:11:11
11:11:11	11:11:11
2011-11-11	2011-11-11
SELECT table_id,table_name FROM oceanbase.__all_virtual_table WHERE table_name='Z0CASE';
ALTER TABLE Z0CASE MODIFY COLUMN z0_test0 TIME;
SELECT * FROM Z0CASE ORDER BY Z0_TEST1*1;
z0_test0	Z0_TEST1
NULL	NULL
11:11:11	2011-11-11 11:11:11
11:11:11	11:11:11
00:20:11	2011-11-11
DESC Z0CASE;
Field	Type	Null	Key	Default	Extra
z0_test0	time	YES		NULL	
Z0_TEST1	enum('2011-11-11 11:11:11','11:11:11','12321','0','2011-11-11')	YES		NULL	
SELECT table_id,table_name FROM oceanbase.__all_virtual_table WHERE table_name='Z0CASE';
DROP TABLE Z0CASE;
