SET sql_mode='STRICT_TRANS_TABLES,STRICT_ALL_TABLES';
SELECT @@sql_mode;
@@sql_mode
STRICT_TRANS_TABLES,STRICT_ALL_TABLES

DROP TABLE IF EXISTS Z0CASE;
CHAR   PRIMARY KEY
CREATE TABLE Z0CASE(Z0_TEST0 CHAR(100) PRIMARY KEY , Z0_TEST1 VARCHAR(50),Z0_TEST2 INT) with column group (all columns, each column);
INSERT INTO  Z0CASE (z0_test0,z0_test1,Z0_TEST2)VALUES('abc ABC','abc ABC',1);
INSERT INTO  Z0CASE (z0_test0,z0_test1,Z0_TEST2)VALUES('中文字符@!#$%^','中文字符@!#$%^',2);
INSERT INTO  Z0CASE (z0_test0,z0_test1,Z0_TEST2)VALUES(111,111,11);
INSERT INTO  Z0CASE (z0_test0,z0_test1,Z0_TEST2)VALUES('1111.1111','1111.1111',100);
INSERT INTO  Z0CASE (z0_test0,z0_test1,Z0_TEST2)VALUES('2011-11-11 11:11:11','2011-11-11 11:11:11',20);
INSERT INTO  Z0CASE (z0_test0,z0_test1,Z0_TEST2)VALUES(20111111,20111111,13);
INSERT INTO  Z0CASE (z0_test0,z0_test1,Z0_TEST2)VALUES('','',10);
SELECT * FROM Z0CASE ORDER BY Z0_TEST2;
Z0_TEST0	Z0_TEST1	Z0_TEST2
abc ABC	abc ABC	1
中文字符@!#$%^	中文字符@!#$%^	2
		10
111	111	11
20111111	20111111	13
2011-11-11 11:11:11	2011-11-11 11:11:11	20
1111.1111	1111.1111	100
SELECT table_id,table_name FROM oceanbase.__all_virtual_table WHERE table_name='Z0CASE';
ALTER TABLE Z0CASE MODIFY Z0_TEST0 CHAR(100);
SELECT * FROM Z0CASE ORDER BY Z0_TEST2;
Z0_TEST0	Z0_TEST1	Z0_TEST2
abc ABC	abc ABC	1
中文字符@!#$%^	中文字符@!#$%^	2
		10
111	111	11
20111111	20111111	13
2011-11-11 11:11:11	2011-11-11 11:11:11	20
1111.1111	1111.1111	100
DESC Z0CASE;
Field	Type	Null	Key	Default	Extra
Z0_TEST0	char(100)	NO	PRI	NULL	
Z0_TEST1	varchar(50)	YES		NULL	
Z0_TEST2	int(11)	YES		NULL	
SELECT table_id,table_name FROM oceanbase.__all_virtual_table WHERE table_name='Z0CASE';
ALTER TABLE Z0CASE MODIFY Z0_TEST0 CHAR(99);
SELECT * FROM Z0CASE ORDER BY Z0_TEST2;
Z0_TEST0	Z0_TEST1	Z0_TEST2
abc ABC	abc ABC	1
中文字符@!#$%^	中文字符@!#$%^	2
		10
111	111	11
20111111	20111111	13
2011-11-11 11:11:11	2011-11-11 11:11:11	20
1111.1111	1111.1111	100
DESC Z0CASE;
Field	Type	Null	Key	Default	Extra
Z0_TEST0	char(99)	NO	PRI	NULL	
Z0_TEST1	varchar(50)	YES		NULL	
Z0_TEST2	int(11)	YES		NULL	
SELECT table_id,table_name FROM oceanbase.__all_virtual_table WHERE table_name='Z0CASE';
ALTER TABLE Z0CASE MODIFY Z0_TEST0 CHAR(101);
SELECT * FROM Z0CASE ORDER BY Z0_TEST2;
Z0_TEST0	Z0_TEST1	Z0_TEST2
abc ABC	abc ABC	1
中文字符@!#$%^	中文字符@!#$%^	2
		10
111	111	11
20111111	20111111	13
2011-11-11 11:11:11	2011-11-11 11:11:11	20
1111.1111	1111.1111	100
DESC Z0CASE;
Field	Type	Null	Key	Default	Extra
Z0_TEST0	char(101)	NO	PRI	NULL	
Z0_TEST1	varchar(50)	YES		NULL	
Z0_TEST2	int(11)	YES		NULL	
SELECT table_id,table_name FROM oceanbase.__all_virtual_table WHERE table_name='Z0CASE';
INSERT INTO  Z0CASE (z0_test0)VALUES('102wertyuiopasdfghjklzqwertyuiopasdfghjklzqwertyuiopasdfghjklzqwertyuiopasdfghjklzqwertyuiopasdfghjklz');
ERROR 22001: Data too long for column 'Z0_TEST0' at row 1
INSERT INTO  Z0CASE (z0_test0)VALUES('101ertyuiopasdfghjklzqwertyuiopasdfghjklzqwertyuiopasdfghjklzqwertyuiopasdfghjklzqwertyuiopasdfghjklz');
SELECT * FROM Z0CASE ORDER BY Z0_TEST2;
Z0_TEST0	Z0_TEST1	Z0_TEST2
101ertyuiopasdfghjklzqwertyuiopasdfghjklzqwertyuiopasdfghjklzqwertyuiopasdfghjklzqwertyuiopasdfghjklz	NULL	NULL
abc ABC	abc ABC	1
中文字符@!#$%^	中文字符@!#$%^	2
		10
111	111	11
20111111	20111111	13
2011-11-11 11:11:11	2011-11-11 11:11:11	20
1111.1111	1111.1111	100
UPDATE Z0CASE SET z0_test0='102wertyuiopasdfghjklzqwertyuiopasdfghjklzqwertyuiopasdfghjklzqwertyuiopasdfghjklzqwertyuiopasdfghjklz' WHERE z0_test1='111';
ERROR 22001: Data too long for column 'Z0_TEST0' at row 1
UPDATE Z0CASE SET z0_test0='10wertyuiopasdfghjklzqwertyuiopasdfghjklzqwertyuiopasdfghjklzqwertyuiopasdfghjklzqwertyuiopasdfghjklz' WHERE z0_test1='111';
SELECT * FROM Z0CASE ORDER BY Z0_TEST2;
Z0_TEST0	Z0_TEST1	Z0_TEST2
101ertyuiopasdfghjklzqwertyuiopasdfghjklzqwertyuiopasdfghjklzqwertyuiopasdfghjklzqwertyuiopasdfghjklz	NULL	NULL
abc ABC	abc ABC	1
中文字符@!#$%^	中文字符@!#$%^	2
		10
10wertyuiopasdfghjklzqwertyuiopasdfghjklzqwertyuiopasdfghjklzqwertyuiopasdfghjklzqwertyuiopasdfghjklz	111	11
20111111	20111111	13
2011-11-11 11:11:11	2011-11-11 11:11:11	20
1111.1111	1111.1111	100
DELETE FROM Z0CASE WHERE z0_test0='10wertyuiopasdfghjklzqwertyuiopasdfghjklzqwertyuiopasdfghjklzqwertyuiopasdfghjklzqwertyuiopasdfghjklz';
SELECT * FROM Z0CASE ORDER BY Z0_TEST2;
Z0_TEST0	Z0_TEST1	Z0_TEST2
101ertyuiopasdfghjklzqwertyuiopasdfghjklzqwertyuiopasdfghjklzqwertyuiopasdfghjklzqwertyuiopasdfghjklz	NULL	NULL
abc ABC	abc ABC	1
中文字符@!#$%^	中文字符@!#$%^	2
		10
20111111	20111111	13
2011-11-11 11:11:11	2011-11-11 11:11:11	20
1111.1111	1111.1111	100
CHAR --> VARCHAR
DROP TABLE Z0CASE;
CREATE TABLE Z0CASE(Z0_TEST0 CHAR(100) PRIMARY KEY , Z0_TEST1 VARCHAR(50),Z0_TEST2 INT) with column group (all columns, each column);
INSERT INTO  Z0CASE (z0_test0,z0_test1,Z0_TEST2)VALUES('abc ABC','abc ABC',1);
INSERT INTO  Z0CASE (z0_test0,z0_test1,Z0_TEST2)VALUES('中文字符@!#$%^','中文字符@!#$%^',12);
INSERT INTO  Z0CASE (z0_test0,z0_test1,Z0_TEST2)VALUES(111,111,11);
INSERT INTO  Z0CASE (z0_test0,z0_test1,Z0_TEST2)VALUES('1111.1111','1111.1111',100);
INSERT INTO  Z0CASE (z0_test0,z0_test1,Z0_TEST2)VALUES('2011-11-11 11:11:11','2011-11-11 11:11:11',20);
INSERT INTO  Z0CASE (z0_test0,z0_test1,Z0_TEST2)VALUES(20111111,20111111,13);
INSERT INTO  Z0CASE (z0_test0,z0_test1,Z0_TEST2)VALUES('','',10);
SELECT * FROM Z0CASE ORDER BY Z0_TEST2;
Z0_TEST0	Z0_TEST1	Z0_TEST2
abc ABC	abc ABC	1
		10
111	111	11
中文字符@!#$%^	中文字符@!#$%^	12
20111111	20111111	13
2011-11-11 11:11:11	2011-11-11 11:11:11	20
1111.1111	1111.1111	100
SELECT table_id,table_name FROM oceanbase.__all_virtual_table WHERE table_name='Z0CASE';
长度变短
ALTER TABLE Z0CASE MODIFY COLUMN  z0_test0 VARCHAR(99);
SELECT * FROM Z0CASE ORDER BY Z0_TEST2;
z0_test0	Z0_TEST1	Z0_TEST2
abc ABC	abc ABC	1
		10
111	111	11
中文字符@!#$%^	中文字符@!#$%^	12
20111111	20111111	13
2011-11-11 11:11:11	2011-11-11 11:11:11	20
1111.1111	1111.1111	100
DESC Z0CASE;
Field	Type	Null	Key	Default	Extra
z0_test0	varchar(99)	NO	PRI	NULL	
Z0_TEST1	varchar(50)	YES		NULL	
Z0_TEST2	int(11)	YES		NULL	
SELECT table_id,table_name FROM oceanbase.__all_virtual_table WHERE table_name='Z0CASE';
INSERT INTO  Z0CASE (z0_test0)VALUES('1wertyuiopasdfghjklzqwertyuiopasdfghjklzqwertyuiopasdfghjklzqwertyuiopasdfghjklzqwertyuiopasdfghjklz');
ERROR 22001: Data too long for column 'z0_test0' at row 1
INSERT INTO  Z0CASE (z0_test0)VALUES('wertyuiopasdfghjklzqwertyuiopasdfghjklzqwertyuiopasdfghjklzqwertyuiopasdfghjklzqwertyuiopasdfghjklz');
SELECT * FROM Z0CASE ORDER BY Z0_TEST2;
z0_test0	Z0_TEST1	Z0_TEST2
wertyuiopasdfghjklzqwertyuiopasdfghjklzqwertyuiopasdfghjklzqwertyuiopasdfghjklzqwertyuiopasdfghjklz	NULL	NULL
abc ABC	abc ABC	1
		10
111	111	11
中文字符@!#$%^	中文字符@!#$%^	12
20111111	20111111	13
2011-11-11 11:11:11	2011-11-11 11:11:11	20
1111.1111	1111.1111	100
UPDATE Z0CASE SET z0_test0='1wertyuiopasdfghjklzqwertyuiopasdfghjklzqwertyuiopasdfghjklzqwertyuiopasdfghjklzqwertyuiopasdfghjklz' WHERE z0_test1='111';
ERROR 22001: Data too long for column 'z0_test0' at row 1
UPDATE Z0CASE SET z0_test0='1ertyuiopasdfghjklzqwertyuiopasdfghjklzqwertyuiopasdfghjklzqwertyuiopasdfghjklzqwertyuiopasdfghjklz' WHERE z0_test1='111';
SELECT * FROM Z0CASE ORDER BY Z0_TEST2;
z0_test0	Z0_TEST1	Z0_TEST2
wertyuiopasdfghjklzqwertyuiopasdfghjklzqwertyuiopasdfghjklzqwertyuiopasdfghjklzqwertyuiopasdfghjklz	NULL	NULL
abc ABC	abc ABC	1
		10
1ertyuiopasdfghjklzqwertyuiopasdfghjklzqwertyuiopasdfghjklzqwertyuiopasdfghjklzqwertyuiopasdfghjklz	111	11
中文字符@!#$%^	中文字符@!#$%^	12
20111111	20111111	13
2011-11-11 11:11:11	2011-11-11 11:11:11	20
1111.1111	1111.1111	100
DELETE FROM Z0CASE WHERE z0_test0='1ertyuiopasdfghjklzqwertyuiopasdfghjklzqwertyuiopasdfghjklzqwertyuiopasdfghjklzqwertyuiopasdfghjklz';
SELECT * FROM Z0CASE ORDER BY Z0_TEST2;
z0_test0	Z0_TEST1	Z0_TEST2
wertyuiopasdfghjklzqwertyuiopasdfghjklzqwertyuiopasdfghjklzqwertyuiopasdfghjklzqwertyuiopasdfghjklz	NULL	NULL
abc ABC	abc ABC	1
		10
中文字符@!#$%^	中文字符@!#$%^	12
20111111	20111111	13
2011-11-11 11:11:11	2011-11-11 11:11:11	20
1111.1111	1111.1111	100
长度不变
DROP TABLE Z0CASE;
CREATE TABLE Z0CASE(Z0_TEST0 CHAR(100) PRIMARY KEY , Z0_TEST1 VARCHAR(50),Z0_TEST2 INT) with column group (all columns, each column);
ALTER TABLE Z0CASE MODIFY column z0_test0 VARCHAR(100);
DESC Z0CASE;
Field	Type	Null	Key	Default	Extra
z0_test0	varchar(100)	NO	PRI	NULL	
Z0_TEST1	varchar(50)	YES		NULL	
Z0_TEST2	int(11)	YES		NULL	
SELECT table_id,table_name FROM oceanbase.__all_virtual_table WHERE table_name='Z0CASE';
长度变长
DROP TABLE Z0CASE;
CREATE TABLE Z0CASE(Z0_TEST0 CHAR(100) PRIMARY KEY , Z0_TEST1 VARCHAR(50),Z0_TEST2 INT) with column group (all columns, each column);
ALTER TABLE Z0CASE MODIFY  column z0_test0 VARCHAR(101);
DESC Z0CASE;
Field	Type	Null	Key	Default	Extra
z0_test0	varchar(101)	NO	PRI	NULL	
Z0_TEST1	varchar(50)	YES		NULL	
Z0_TEST2	int(11)	YES		NULL	
SELECT table_id,table_name FROM oceanbase.__all_virtual_table WHERE table_name='Z0CASE';
CHAR --> INT/float
DROP TABLE Z0CASE;
CREATE TABLE Z0CASE(Z0_TEST0 CHAR(100) PRIMARY KEY , Z0_TEST1 VARCHAR(50),Z0_TEST2 INT) with column group (all columns, each column);
INSERT INTO  Z0CASE (z0_test0,z0_test1,Z0_TEST2)VALUES(111,111,11);
INSERT INTO  Z0CASE (z0_test0,z0_test1,Z0_TEST2)VALUES('1111.1111','1111.1111',100);
INSERT INTO  Z0CASE (z0_test0,z0_test1,Z0_TEST2)VALUES(20111111,20111111,1);
SELECT * FROM Z0CASE ORDER BY Z0_TEST2;
Z0_TEST0	Z0_TEST1	Z0_TEST2
20111111	20111111	1
111	111	11
1111.1111	1111.1111	100
SELECT table_id,table_name FROM oceanbase.__all_virtual_table WHERE table_name='Z0CASE';
ALTER TABLE Z0CASE MODIFY COLUMN  z0_test0 INT;
SELECT * FROM Z0CASE ORDER BY Z0_TEST2;
z0_test0	Z0_TEST1	Z0_TEST2
20111111	20111111	1
111	111	11
1111	1111.1111	100
DESC Z0CASE;
Field	Type	Null	Key	Default	Extra
z0_test0	int(11)	NO	PRI	NULL	
Z0_TEST1	varchar(50)	YES		NULL	
Z0_TEST2	int(11)	YES		NULL	
SELECT table_id,table_name FROM oceanbase.__all_virtual_table WHERE table_name='Z0CASE';
INSERT INTO Z0CASE(z0_test0) VALUES('122A123');
ERROR 01000: Data truncated for column 'z0_test0' at row 1
INSERT INTO Z0CASE(z0_test0) VALUES('2147483648');
ERROR 22003: Out of range value for column 'z0_test0' at row 1
INSERT INTO Z0CASE(z0_test0) VALUES('2147483647');
INSERT INTO Z0CASE(z0_test0) VALUES('21474.83647');
SELECT * FROM Z0CASE ORDER BY Z0_TEST2;
z0_test0	Z0_TEST1	Z0_TEST2
21475	NULL	NULL
2147483647	NULL	NULL
20111111	20111111	1
111	111	11
1111	1111.1111	100
INSERT INTO Z0CASE(z0_test0) VALUES(-2147483649);
ERROR 22003: Out of range value for column 'z0_test0' at row 1
INSERT INTO Z0CASE(z0_test0) VALUES(-2147483648);
INSERT INTO Z0CASE(z0_test0) VALUES(-21474.83648);
SELECT * FROM Z0CASE ORDER BY Z0_TEST2;
z0_test0	Z0_TEST1	Z0_TEST2
-2147483648	NULL	NULL
-21475	NULL	NULL
21475	NULL	NULL
2147483647	NULL	NULL
20111111	20111111	1
111	111	11
1111	1111.1111	100
UPDATE Z0CASE SET z0_test0='21A3648' WHERE z0_test1='111';
ERROR 01000: Data truncated for column 'z0_test0' at row 1
UPDATE Z0CASE SET z0_test0='2147483648' WHERE z0_test1='111';
ERROR 22003: Out of range value for column 'z0_test0' at row 1
UPDATE Z0CASE SET z0_test0='21474836' WHERE z0_test1='111';
SELECT * FROM Z0CASE ORDER BY Z0_TEST2;
z0_test0	Z0_TEST1	Z0_TEST2
-2147483648	NULL	NULL
-21475	NULL	NULL
21475	NULL	NULL
2147483647	NULL	NULL
20111111	20111111	1
21474836	111	11
1111	1111.1111	100
UPDATE Z0CASE SET z0_test0=2147483647.6 WHERE z0_test1='1111.1111';
ERROR 22003: Out of range value for column 'z0_test0' at row 1
UPDATE Z0CASE SET z0_test0=214748364.7 WHERE z0_test1='1111.1111';
DELETE FROM Z0CASE WHERE z0_test0=2147483647;
SELECT * FROM Z0CASE ORDER BY Z0_TEST2;
z0_test0	Z0_TEST1	Z0_TEST2
-2147483648	NULL	NULL
-21475	NULL	NULL
21475	NULL	NULL
20111111	20111111	1
21474836	111	11
214748365	1111.1111	100
DROP TABLE Z0CASE;
CREATE TABLE Z0CASE(Z0_TEST0 CHAR(100) PRIMARY KEY , Z0_TEST1 VARCHAR(50),Z0_TEST2 INT) with column group (all columns, each column);
INSERT INTO  Z0CASE (z0_test0,z0_test1,Z0_TEST2)VALUES(111,111,11);
INSERT INTO  Z0CASE (z0_test0,z0_test1,Z0_TEST2)VALUES('1111.1111','1111.1111',100);
INSERT INTO  Z0CASE (z0_test0,z0_test1,Z0_TEST2)VALUES(20111111,20111111,1);
SELECT * FROM Z0CASE ORDER BY Z0_TEST2;
Z0_TEST0	Z0_TEST1	Z0_TEST2
20111111	20111111	1
111	111	11
1111.1111	1111.1111	100
SELECT table_id,table_name FROM oceanbase.__all_virtual_table WHERE table_name='Z0CASE';
ALTER TABLE Z0CASE MODIFY COLUMN  z0_test0 float;
SELECT * FROM Z0CASE ORDER BY Z0_TEST2;
z0_test0	Z0_TEST1	Z0_TEST2
20111100	20111111	1
111	111	11
1111.11	1111.1111	100
DESC Z0CASE;
Field	Type	Null	Key	Default	Extra
z0_test0	float	NO	PRI	NULL	
Z0_TEST1	varchar(50)	YES		NULL	
Z0_TEST2	int(11)	YES		NULL	
SELECT table_id,table_name FROM oceanbase.__all_virtual_table WHERE table_name='Z0CASE';
INSERT INTO Z0CASE(z0_test0) VALUES('123A.123');
ERROR 01000: Data truncated for column 'z0_test0' at row 1
INSERT INTO Z0CASE(z0_test0) VALUES('123123');
INSERT INTO Z0CASE(z0_test0) VALUES('123123.12345678912345678');
INSERT INTO Z0CASE(z0_test0) VALUES(2345678910123123122334323356789123456789);
ERROR 22003: Out of range value for column 'z0_test0' at row 1
INSERT INTO Z0CASE(z0_test0) VALUES(-2345678910123123122334323356789123456789);
ERROR 22003: Out of range value for column 'z0_test0' at row 1
INSERT INTO Z0CASE(z0_test0) VALUES(-234567891012312312233432335678912345678);
INSERT INTO Z0CASE(z0_test0) VALUES(224567891012312312233432335678912345678);
SELECT * FROM Z0CASE WHERE z0_test0 like '-234568000000000000000000000000000000000';
z0_test0	Z0_TEST1	Z0_TEST2
SELECT * FROM Z0CASE WHERE z0_test0 like '-2.34568E38';
z0_test0	Z0_TEST1	Z0_TEST2
-2.34568e38	NULL	NULL
UPDATE Z0CASE SET z0_test0='224568A0000000' WHERE z0_test0=224568000000000000000000000000000000000;
UPDATE Z0CASE SET z0_test0='224568.2345' WHERE z0_test0=-234568000000000000000000000000000000000;
SELECT * FROM Z0CASE ORDER BY Z0_TEST0;
z0_test0	Z0_TEST1	Z0_TEST2
-2.34568e38	NULL	NULL
111	111	11
1111.11	1111.1111	100
123123	NULL	NULL
123123	NULL	NULL
20111100	20111111	1
2.24568e38	NULL	NULL
UPDATE Z0CASE SET z0_test0='224568.2345' WHERE z0_test0 like'-2.34568E38';
SELECT * FROM Z0CASE ORDER BY Z0_TEST0;
z0_test0	Z0_TEST1	Z0_TEST2
111	111	11
1111.11	1111.1111	100
123123	NULL	NULL
123123	NULL	NULL
224568	NULL	NULL
20111100	20111111	1
2.24568e38	NULL	NULL
UPDATE Z0CASE SET z0_test0=345678910123123122334323356789123456789 WHERE z0_test0=111;
ERROR 22003: Out of range value for column 'z0_test0' at row 1
UPDATE Z0CASE SET z0_test0=45678910123123122334323356789123456789 WHERE z0_test0=111;
UPDATE Z0CASE SET z0_test0=-45678910123123122334323356789123456789 WHERE z0_test0 LIKE '2.24568E38';
SELECT * FROM Z0CASE ORDER BY Z0_TEST0;
z0_test0	Z0_TEST1	Z0_TEST2
-4.56789e37	NULL	NULL
1111.11	1111.1111	100
123123	NULL	NULL
123123	NULL	NULL
224568	NULL	NULL
20111100	20111111	1
4.56789e37	111	11
DELETE FROM Z0CASE WHERE z0_test0=45678900000000000000000000000000000000;
SELECT * FROM Z0CASE ORDER BY Z0_TEST0;
z0_test0	Z0_TEST1	Z0_TEST2
-4.56789e37	NULL	NULL
1111.11	1111.1111	100
123123	NULL	NULL
123123	NULL	NULL
224568	NULL	NULL
20111100	20111111	1
4.56789e37	111	11
DELETE FROM Z0CASE WHERE z0_test0 LIKE '4.56789E37';
SELECT * FROM Z0CASE ORDER BY Z0_TEST0;
z0_test0	Z0_TEST1	Z0_TEST2
-4.56789e37	NULL	NULL
1111.11	1111.1111	100
123123	NULL	NULL
123123	NULL	NULL
224568	NULL	NULL
20111100	20111111	1
CHAR --> ENUM
DROP TABLE Z0CASE;
CREATE TABLE Z0CASE(Z0_TEST0 CHAR(100) PRIMARY KEY, Z0_TEST1 VARCHAR(50),Z0_TEST2 INT) with column group (all columns, each column);
INSERT INTO  Z0CASE (z0_test0,z0_test1,Z0_TEST2)VALUES('abc ABC','abc ABC',1);
INSERT INTO  Z0CASE (z0_test0,z0_test1,Z0_TEST2)VALUES('中文字符@!#$%^','中文字符@!#$%^',2);
SELECT * FROM Z0CASE ORDER BY Z0_TEST2;
Z0_TEST0	Z0_TEST1	Z0_TEST2
abc ABC	abc ABC	1
中文字符@!#$%^	中文字符@!#$%^	2
SELECT table_id,table_name FROM oceanbase.__all_virtual_table WHERE table_name='Z0CASE';
ALTER TABLE Z0CASE MODIFY column z0_test0 ENUM('abc ABC','中文字符@!#$%^','') ;
SELECT * FROM Z0CASE ORDER BY Z0_TEST2;
z0_test0	Z0_TEST1	Z0_TEST2
abc ABC	abc ABC	1
中文字符@!#$%^	中文字符@!#$%^	2
DESC Z0CASE;
Field	Type	Null	Key	Default	Extra
z0_test0	enum('abc ABC','中文字符@!#$%^','')	NO	PRI	NULL	
Z0_TEST1	varchar(50)	YES		NULL	
Z0_TEST2	int(11)	YES		NULL	
SELECT table_id,table_name FROM oceanbase.__all_virtual_table WHERE table_name='Z0CASE';
INSERT INTO  Z0CASE (z0_test0)VALUES('');
SELECT * FROM Z0CASE ORDER BY Z0_TEST2;
z0_test0	Z0_TEST1	Z0_TEST2
	NULL	NULL
abc ABC	abc ABC	1
中文字符@!#$%^	中文字符@!#$%^	2
INSERT INTO  Z0CASE (z0_test0)VALUES(null);
ERROR 23000: Column 'z0_test0' cannot be null
INSERT INTO  Z0CASE (z0_test0)VALUES('abaa123!@#$%^');
ERROR 01000: Data truncated for column 'z0_test0' at row 1
INSERT INTO  Z0CASE (z0_test0)VALUES('abcABC');
ERROR 01000: Data truncated for column 'z0_test0' at row 1
UPDATE Z0CASE SET z0_test0='abc ' WHERE z0_test1='abc ABC';
ERROR 01000: Data truncated for column 'z0_test0' at row 1
UPDATE Z0CASE SET z0_test0='中文$%^' WHERE z0_test1='abc ABC';
ERROR 01000: Data truncated for column 'z0_test0' at row 1
DELETE FROM Z0CASE WHERE z0_test0='';
DELETE FROM Z0CASE WHERE z0_test0='abc ABC';
SELECT * FROM Z0CASE ORDER BY Z0_TEST2;
z0_test0	Z0_TEST1	Z0_TEST2
中文字符@!#$%^	中文字符@!#$%^	2
CHAR --> DATE
DROP TABLE Z0CASE;
CREATE TABLE Z0CASE(Z0_TEST0 CHAR(100) PRIMARY KEY , Z0_TEST1 VARCHAR(50),Z0_TEST2 INT) with column group (all columns, each column);
INSERT INTO  Z0CASE (z0_test0,z0_test1,Z0_TEST2)VALUES('1111.1111','1111.1111',100);
INSERT INTO  Z0CASE (z0_test0,z0_test1,Z0_TEST2)VALUES('2011-11-11 11:11:11','2011-11-11 11:11:11',20);
INSERT INTO  Z0CASE (z0_test0,z0_test1,Z0_TEST2)VALUES(20111111,20111111,1);
ALTER TABLE Z0CASE MODIFY column z0_test0 DATE;
ERROR 23000: Duplicated primary key
DROP TABLE Z0CASE;
CREATE TABLE Z0CASE(Z0_TEST0 CHAR(100) PRIMARY KEY , Z0_TEST1 VARCHAR(50),Z0_TEST2 INT) with column group (all columns, each column);
INSERT INTO  Z0CASE (z0_test0,z0_test1,Z0_TEST2)VALUES('1111.1111','1111.1111',100);
INSERT INTO  Z0CASE (z0_test0,z0_test1,Z0_TEST2)VALUES('2011-11-11 11:11:11','2011-11-11 11:11:11',20);
INSERT INTO  Z0CASE (z0_test0,z0_test1,Z0_TEST2)VALUES(20121212,20111111,1);
SELECT * FROM Z0CASE ORDER BY Z0_TEST2;
Z0_TEST0	Z0_TEST1	Z0_TEST2
20121212	20111111	1
2011-11-11 11:11:11	2011-11-11 11:11:11	20
1111.1111	1111.1111	100
SELECT table_id,table_name FROM oceanbase.__all_virtual_table WHERE table_name='Z0CASE';
ALTER TABLE Z0CASE MODIFY column z0_test0 DATE;
SELECT * FROM Z0CASE ORDER BY Z0_TEST2;
z0_test0	Z0_TEST1	Z0_TEST2
2012-12-12	20111111	1
2011-11-11	2011-11-11 11:11:11	20
1111-11-11	1111.1111	100
DESC Z0CASE;
Field	Type	Null	Key	Default	Extra
z0_test0	date	NO	PRI	NULL	
Z0_TEST1	varchar(50)	YES		NULL	
Z0_TEST2	int(11)	YES		NULL	
SELECT table_id,table_name FROM oceanbase.__all_virtual_table WHERE table_name='Z0CASE';
INSERT INTO Z0CASE(z0_test0) VALUES('2021年9月2日');
SELECT * FROM Z0CASE ORDER BY Z0_TEST2;
z0_test0	Z0_TEST1	Z0_TEST2
2021-09-02	NULL	NULL
2012-12-12	20111111	1
2011-11-11	2011-11-11 11:11:11	20
1111-11-11	1111.1111	100
INSERT INTO Z0CASE(z0_test0) VALUES('2002年开始本年度工作，至年末12月份的22日工作结束');
SELECT * FROM Z0CASE ORDER BY Z0_TEST0;
z0_test0	Z0_TEST1	Z0_TEST2
1111-11-11	1111.1111	100
2002-12-22	NULL	NULL
2011-11-11	2011-11-11 11:11:11	20
2012-12-12	20111111	1
2021-09-02	NULL	NULL
INSERT INTO Z0CASE(z0_test0) VALUES('2002-09-02');
SELECT * FROM Z0CASE ORDER BY Z0_TEST0;
z0_test0	Z0_TEST1	Z0_TEST2
1111-11-11	1111.1111	100
2002-09-02	NULL	NULL
2002-12-22	NULL	NULL
2011-11-11	2011-11-11 11:11:11	20
2012-12-12	20111111	1
2021-09-02	NULL	NULL
INSERT INTO Z0CASE(z0_test0) VALUES('2002-09-02 12:21:55');
ERROR 23000: Duplicate entry '2002-09-02' for key 'PRIMARY'
INSERT INTO Z0CASE(z0_test0) VALUES('2002-09-12 12:21:55');
INSERT INTO Z0CASE(z0_test0) VALUES('20021201');
SELECT * FROM Z0CASE ORDER BY Z0_TEST0;
z0_test0	Z0_TEST1	Z0_TEST2
1111-11-11	1111.1111	100
2002-09-02	NULL	NULL
2002-09-12	NULL	NULL
2002-12-01	NULL	NULL
2002-12-22	NULL	NULL
2011-11-11	2011-11-11 11:11:11	20
2012-12-12	20111111	1
2021-09-02	NULL	NULL
INSERT INTO Z0CASE(z0_test0) VALUES('10011990');
ERROR 22007: Incorrect datetime value for column 'z0_test0' at row 1
INSERT INTO Z0CASE(z0_test0) VALUES('2002');
ERROR 22007: Incorrect datetime value for column 'z0_test0' at row 1
INSERT INTO Z0CASE(z0_test0) VALUES('2002-10-42');
ERROR 22007: Incorrect datetime value for column 'z0_test0' at row 1
INSERT INTO Z0CASE(z0_test0) VALUES('2002-13-22');
ERROR 22007: Incorrect datetime value for column 'z0_test0' at row 1
UPDATE Z0CASE SET z0_test0='2002年开始本年度工作，至年末12月份的29日工作结束' WHERE z0_test0='2002-09-02 00:00:00';
UPDATE Z0CASE SET z0_test0='二零零三年一月一日' WHERE z0_test0='2002-09-12 00:00:00';
ERROR 22007: Incorrect datetime value for column 'z0_test0' at row 1
UPDATE Z0CASE SET z0_test0='2000' WHERE z0_test0='2002-09-12 00:00:00';
ERROR 22007: Incorrect datetime value for column 'z0_test0' at row 1
UPDATE Z0CASE SET z0_test0='11112000' WHERE z0_test0='2002-09-12 00:00:00';
ERROR 22007: Incorrect datetime value for column 'z0_test0' at row 1
UPDATE Z0CASE SET z0_test0='2000-02-30' WHERE z0_test0='2002-09-12 00:00:00';
ERROR 22007: Incorrect datetime value for column 'z0_test0' at row 1
UPDATE Z0CASE SET z0_test0='2000-02-29' WHERE z0_test0='2002-09-12 00:00:00';
SELECT * FROM Z0CASE ORDER BY Z0_TEST0;
z0_test0	Z0_TEST1	Z0_TEST2
1111-11-11	1111.1111	100
2000-02-29	NULL	NULL
2002-12-01	NULL	NULL
2002-12-22	NULL	NULL
2002-12-29	NULL	NULL
2011-11-11	2011-11-11 11:11:11	20
2012-12-12	20111111	1
2021-09-02	NULL	NULL
UPDATE Z0CASE SET z0_test0='2000-01-29 12:13:14' WHERE z0_test0='2000-02-29 00:00:00';
SELECT * FROM Z0CASE ORDER BY Z0_TEST0;
z0_test0	Z0_TEST1	Z0_TEST2
1111-11-11	1111.1111	100
2000-01-29	NULL	NULL
2002-12-01	NULL	NULL
2002-12-22	NULL	NULL
2002-12-29	NULL	NULL
2011-11-11	2011-11-11 11:11:11	20
2012-12-12	20111111	1
2021-09-02	NULL	NULL
DELETE FROM Z0CASE WHERE z0_test0='2000-01-29 00:00:00';
DELETE FROM Z0CASE WHERE z0_test0='2002-12-01';
SELECT * FROM Z0CASE ORDER BY Z0_TEST0;
z0_test0	Z0_TEST1	Z0_TEST2
1111-11-11	1111.1111	100
2002-12-22	NULL	NULL
2002-12-29	NULL	NULL
2011-11-11	2011-11-11 11:11:11	20
2012-12-12	20111111	1
2021-09-02	NULL	NULL
CHAR --> timestamp
DROP TABLE Z0CASE;
CREATE TABLE Z0CASE(Z0_TEST0 CHAR(100) PRIMARY KEY , Z0_TEST1 VARCHAR(50),Z0_TEST2 INT) with column group (all columns, each column);
INSERT INTO  Z0CASE (z0_test0,z0_test1,Z0_TEST2)VALUES('1111.1111','1111.1111',100);
INSERT INTO  Z0CASE (z0_test0,z0_test1,Z0_TEST2)VALUES('2011-11-11 11:11:11','2011-11-11 11:11:11',20);
INSERT INTO  Z0CASE (z0_test0,z0_test1,Z0_TEST2)VALUES(20111111,20111111,1);
SELECT * FROM Z0CASE ORDER BY Z0_TEST2;
Z0_TEST0	Z0_TEST1	Z0_TEST2
20111111	20111111	1
2011-11-11 11:11:11	2011-11-11 11:11:11	20
1111.1111	1111.1111	100
SELECT table_id,table_name FROM oceanbase.__all_virtual_table WHERE table_name='Z0CASE';
ALTER TABLE Z0CASE MODIFY column z0_test0 timestamp;
SELECT * FROM Z0CASE ORDER BY Z0_TEST0;
z0_test0	Z0_TEST1	Z0_TEST2
1111-11-11 00:00:00	1111.1111	100
2011-11-11 00:00:00	20111111	1
2011-11-11 11:11:11	2011-11-11 11:11:11	20
DESC Z0CASE;
Field	Type	Null	Key	Default	Extra
z0_test0	timestamp	NO	PRI	NULL	
Z0_TEST1	varchar(50)	YES		NULL	
Z0_TEST2	int(11)	YES		NULL	
SELECT table_id,table_name FROM oceanbase.__all_virtual_table WHERE table_name='Z0CASE';
INSERT INTO Z0CASE(z0_test0) VALUES('2021年9月2日');
SELECT * FROM Z0CASE ORDER BY Z0_TEST0;
z0_test0	Z0_TEST1	Z0_TEST2
1111-11-11 00:00:00	1111.1111	100
2011-11-11 00:00:00	20111111	1
2011-11-11 11:11:11	2011-11-11 11:11:11	20
2021-09-02 00:00:00	NULL	NULL
INSERT INTO Z0CASE(z0_test0) VALUES('2002年开始本年度工作，至年末12月份的22日工作结束');
INSERT INTO Z0CASE(z0_test0) VALUES('2002-09-02');
INSERT INTO Z0CASE(z0_test0) VALUES('2002-09-02 12:21:55');
INSERT INTO Z0CASE(z0_test0) VALUES('2002-09-03 12:21:55.567');
INSERT INTO Z0CASE(z0_test0) VALUES('20021201');
SELECT * FROM Z0CASE ORDER BY Z0_TEST0;
z0_test0	Z0_TEST1	Z0_TEST2
1111-11-11 00:00:00	1111.1111	100
2002-09-02 00:00:00	NULL	NULL
2002-09-02 12:21:55	NULL	NULL
2002-09-03 12:21:56	NULL	NULL
2002-12-01 00:00:00	NULL	NULL
2002-12-22 00:00:00	NULL	NULL
2011-11-11 00:00:00	20111111	1
2011-11-11 11:11:11	2011-11-11 11:11:11	20
2021-09-02 00:00:00	NULL	NULL
INSERT INTO Z0CASE(z0_test0) VALUES('10011990');
ERROR 22007: Incorrect datetime value for column 'z0_test0' at row 1
INSERT INTO Z0CASE(z0_test0) VALUES('2002');
ERROR 22007: Incorrect datetime value for column 'z0_test0' at row 1
INSERT INTO Z0CASE(z0_test0) VALUES('2002-10-42');
ERROR 22007: Incorrect datetime value for column 'z0_test0' at row 1
INSERT INTO Z0CASE(z0_test0) VALUES('2002-13-22');
ERROR 22007: Incorrect datetime value for column 'z0_test0' at row 1
INSERT INTO Z0CASE(z0_test0) VALUES('2002-09-02 24:21:55');
ERROR 22007: Incorrect datetime value for column 'z0_test0' at row 1
INSERT INTO Z0CASE(z0_test0) VALUES('2002-09-02 12:61:55');
ERROR 22007: Incorrect datetime value for column 'z0_test0' at row 1
INSERT INTO Z0CASE(z0_test0) VALUES('2002-09-02 12:11:61');
ERROR 22007: Incorrect datetime value for column 'z0_test0' at row 1
UPDATE Z0CASE SET z0_test0='2002年开始本年度工作，至年末12月份的29日工作结束' WHERE z0_test0='2002-09-03 12:21:56';
UPDATE Z0CASE SET z0_test0='二零零三年一月一日' WHERE z0_test0='2002-12-01 00:00:00';
ERROR 22007: Incorrect datetime value for column 'z0_test0' at row 1
UPDATE Z0CASE SET z0_test0='2000' WHERE z0_test0='2002-12-01 00:00:00';
ERROR 22007: Incorrect datetime value for column 'z0_test0' at row 1
UPDATE Z0CASE SET z0_test0='11112000' WHERE z0_test0='2002-12-01 00:00:00';
ERROR 22007: Incorrect datetime value for column 'z0_test0' at row 1
UPDATE Z0CASE SET z0_test0='2000-02-30' WHERE z0_test0='2002-12-01 00:00:00';
ERROR 22007: Incorrect datetime value for column 'z0_test0' at row 1
UPDATE Z0CASE SET z0_test0='2000-02-28 24:23:22' WHERE z0_test0='2002-12-01 00:00:00';
ERROR 22007: Incorrect datetime value for column 'z0_test0' at row 1
UPDATE Z0CASE SET z0_test0='2000-02-28 22:61:22' WHERE z0_test0='2002-12-01 00:00:00';
ERROR 22007: Incorrect datetime value for column 'z0_test0' at row 1
UPDATE Z0CASE SET z0_test0='2000-02-28 22:59:61' WHERE z0_test0='2002-12-01 00:00:00';
ERROR 22007: Incorrect datetime value for column 'z0_test0' at row 1
UPDATE Z0CASE SET z0_test0='2000-02-29' WHERE z0_test0='2002-12-01 00:00:00';
SELECT * FROM Z0CASE ORDER BY Z0_TEST0;
z0_test0	Z0_TEST1	Z0_TEST2
1111-11-11 00:00:00	1111.1111	100
2000-02-29 00:00:00	NULL	NULL
2002-09-02 00:00:00	NULL	NULL
2002-09-02 12:21:55	NULL	NULL
2002-12-22 00:00:00	NULL	NULL
2002-12-29 00:00:00	NULL	NULL
2011-11-11 00:00:00	20111111	1
2011-11-11 11:11:11	2011-11-11 11:11:11	20
2021-09-02 00:00:00	NULL	NULL
UPDATE Z0CASE SET z0_test0='2000-01-29 12:13:14' WHERE z0_test0='2000-02-29 00:00:00.0';
SELECT * FROM Z0CASE ORDER BY Z0_TEST0;
z0_test0	Z0_TEST1	Z0_TEST2
1111-11-11 00:00:00	1111.1111	100
2000-01-29 12:13:14	NULL	NULL
2002-09-02 00:00:00	NULL	NULL
2002-09-02 12:21:55	NULL	NULL
2002-12-22 00:00:00	NULL	NULL
2002-12-29 00:00:00	NULL	NULL
2011-11-11 00:00:00	20111111	1
2011-11-11 11:11:11	2011-11-11 11:11:11	20
2021-09-02 00:00:00	NULL	NULL
UPDATE Z0CASE SET z0_test0='2000-01-29 12:13:14.97754' WHERE z0_test0='2002-09-02 12:21:55';
DELETE FROM Z0CASE WHERE z0_test0='2000-01-29 12:13:14.0';
DELETE FROM Z0CASE WHERE z0_test0='2002-09-02';
SELECT * FROM Z0CASE ORDER BY Z0_TEST0;
z0_test0	Z0_TEST1	Z0_TEST2
1111-11-11 00:00:00	1111.1111	100
2000-01-29 12:13:15	NULL	NULL
2002-12-22 00:00:00	NULL	NULL
2002-12-29 00:00:00	NULL	NULL
2011-11-11 00:00:00	20111111	1
2011-11-11 11:11:11	2011-11-11 11:11:11	20
2021-09-02 00:00:00	NULL	NULL
DROP TABLE Z0CASE;
CREATE TABLE Z0CASE(Z0_TEST0 CHAR(100) PRIMARY KEY , Z0_TEST1 VARCHAR(50),Z0_TEST2 INT) with column group (all columns, each column);
INSERT INTO  Z0CASE (z0_test0,z0_test1,Z0_TEST2)VALUES('2011-11-11 11:11:11','2011-11-11 11:11:11',20);
INSERT INTO  Z0CASE (z0_test0,z0_test1,Z0_TEST2)VALUES(111111111111,20111111,1);
ALTER TABLE Z0CASE MODIFY column z0_test0 timestamp;
ERROR 23000: Duplicated primary key
VARCHAR
VARCHAR --> CHAR
DROP TABLE Z0CASE;
CREATE TABLE Z0CASE(Z0_TEST0 VARCHAR(100) PRIMARY KEY , Z0_TEST1 VARCHAR(50),Z0_TEST2 INT) with column group (all columns, each column);
INSERT INTO  Z0CASE (z0_test0,z0_test1,Z0_TEST2)VALUES('1111.1111','1111.1111',100);
INSERT INTO  Z0CASE (z0_test0,z0_test1,Z0_TEST2)VALUES('2011-11-11 11:11:11','2011-11-11 11:11:11',20);
INSERT INTO  Z0CASE (z0_test0,z0_test1,Z0_TEST2)VALUES(20111111,20111111,1);
SELECT * FROM Z0CASE ORDER BY Z0_TEST2;
Z0_TEST0	Z0_TEST1	Z0_TEST2
20111111	20111111	1
2011-11-11 11:11:11	2011-11-11 11:11:11	20
1111.1111	1111.1111	100
SELECT table_id,table_name FROM oceanbase.__all_virtual_table WHERE table_name='Z0CASE';
ALTER TABLE Z0CASE MODIFY column z0_test0 CHAR(100);
SELECT * FROM Z0CASE ORDER BY Z0_TEST2;
z0_test0	Z0_TEST1	Z0_TEST2
20111111	20111111	1
2011-11-11 11:11:11	2011-11-11 11:11:11	20
1111.1111	1111.1111	100
DESC Z0CASE;
Field	Type	Null	Key	Default	Extra
z0_test0	char(100)	NO	PRI	NULL	
Z0_TEST1	varchar(50)	YES		NULL	
Z0_TEST2	int(11)	YES		NULL	
SELECT table_id,table_name FROM oceanbase.__all_virtual_table WHERE table_name='Z0CASE';
DROP TABLE Z0CASE;
CREATE TABLE Z0CASE(Z0_TEST0 VARCHAR(100) PRIMARY KEY , Z0_TEST1 VARCHAR(50),Z0_TEST2 INT) with column group (all columns, each column);
INSERT INTO  Z0CASE (z0_test0,z0_test1,Z0_TEST2)VALUES('1111.1111','1111.1111',100);
INSERT INTO  Z0CASE (z0_test0,z0_test1,Z0_TEST2)VALUES('2011-11-11 11:11:11','2011-11-11 11:11:11',20);
INSERT INTO  Z0CASE (z0_test0,z0_test1,Z0_TEST2)VALUES(20111111,20111111,1);
SELECT * FROM Z0CASE ORDER BY Z0_TEST2;
Z0_TEST0	Z0_TEST1	Z0_TEST2
20111111	20111111	1
2011-11-11 11:11:11	2011-11-11 11:11:11	20
1111.1111	1111.1111	100
SELECT table_id,table_name FROM oceanbase.__all_virtual_table WHERE table_name='Z0CASE';
ALTER TABLE Z0CASE MODIFY column z0_test0 CHAR(99);
SELECT * FROM Z0CASE ORDER BY Z0_TEST2;
z0_test0	Z0_TEST1	Z0_TEST2
20111111	20111111	1
2011-11-11 11:11:11	2011-11-11 11:11:11	20
1111.1111	1111.1111	100
DESC Z0CASE;
Field	Type	Null	Key	Default	Extra
z0_test0	char(99)	NO	PRI	NULL	
Z0_TEST1	varchar(50)	YES		NULL	
Z0_TEST2	int(11)	YES		NULL	
SELECT table_id,table_name FROM oceanbase.__all_virtual_table WHERE table_name='Z0CASE';
VARCHAR --> TEXT
DROP TABLE Z0CASE;
CREATE TABLE Z0CASE(Z0_TEST0 VARCHAR(100) PRIMARY KEY , Z0_TEST1 VARCHAR(50),Z0_TEST2 INT) with column group (all columns, each column);
INSERT INTO  Z0CASE (z0_test0,z0_test1,Z0_TEST2)VALUES('1111.1111','1111.1111',100);
INSERT INTO  Z0CASE (z0_test0,z0_test1,Z0_TEST2)VALUES('2011-11-11 11:11:11','2011-11-11 11:11:11',20);
INSERT INTO  Z0CASE (z0_test0,z0_test1,Z0_TEST2)VALUES(20111111,20111111,1);
ALTER TABLE Z0CASE MODIFY column z0_test0 TINYTEXT;
ERROR 42000: The used storage engine can't index column 'z0_test0'
VARCHAR --> ENUM
DROP TABLE Z0CASE;
CREATE TABLE Z0CASE(Z0_TEST0 VARCHAR(100) PRIMARY KEY , Z0_TEST1 VARCHAR(50),Z0_TEST2 INT) with column group (all columns, each column);
INSERT INTO  Z0CASE (z0_test0,z0_test1,Z0_TEST2)VALUES('1111.1111','1111.1111',100);
INSERT INTO  Z0CASE (z0_test0,z0_test1,Z0_TEST2)VALUES('2011-11-11 11:11:11','2011-11-11 11:11:11',20);
INSERT INTO  Z0CASE (z0_test0,z0_test1,Z0_TEST2)VALUES(20111111,20111111,1);
SELECT * FROM Z0CASE ORDER BY Z0_TEST2;
Z0_TEST0	Z0_TEST1	Z0_TEST2
20111111	20111111	1
2011-11-11 11:11:11	2011-11-11 11:11:11	20
1111.1111	1111.1111	100
SELECT table_id,table_name FROM oceanbase.__all_virtual_table WHERE table_name='Z0CASE';
ALTER TABLE Z0CASE MODIFY column z0_test0 ENUM('11111111','2011-11-11 11:11:11','20111111');
ERROR 01000: Data truncated for argument
ALTER TABLE Z0CASE MODIFY column z0_test0 ENUM('1111.1111','2011-11-11 11:11:11','20111111');
SELECT * FROM Z0CASE ORDER BY Z0_TEST2;
z0_test0	Z0_TEST1	Z0_TEST2
20111111	20111111	1
2011-11-11 11:11:11	2011-11-11 11:11:11	20
1111.1111	1111.1111	100
DESC z0case;
Field	Type	Null	Key	Default	Extra
z0_test0	enum('1111.1111','2011-11-11 11:11:11','20111111')	NO	PRI	NULL	
Z0_TEST1	varchar(50)	YES		NULL	
Z0_TEST2	int(11)	YES		NULL	
SELECT table_id,table_name FROM oceanbase.__all_virtual_table WHERE table_name='Z0CASE';
VARCHAR --> INT/float
DROP TABLE Z0CASE;
CREATE TABLE Z0CASE(Z0_TEST0 VARCHAR(100) PRIMARY KEY , Z0_TEST1 VARCHAR(50),Z0_TEST2 INT) with column group (all columns, each column);
INSERT INTO  Z0CASE (z0_test0,z0_test1,Z0_TEST2)VALUES('1111.1111','1111.1111',100);
INSERT INTO  Z0CASE (z0_test0,z0_test1,Z0_TEST2)VALUES(20111111,20111111,1);
SELECT * FROM Z0CASE ORDER BY Z0_TEST2;
Z0_TEST0	Z0_TEST1	Z0_TEST2
20111111	20111111	1
1111.1111	1111.1111	100
SELECT table_id,table_name FROM oceanbase.__all_virtual_table WHERE table_name='Z0CASE';
ALTER TABLE Z0CASE MODIFY column z0_test0 INT;
SELECT * FROM Z0CASE ORDER BY Z0_TEST0;
z0_test0	Z0_TEST1	Z0_TEST2
1111	1111.1111	100
20111111	20111111	1
DESC z0case;
Field	Type	Null	Key	Default	Extra
z0_test0	int(11)	NO	PRI	NULL	
Z0_TEST1	varchar(50)	YES		NULL	
Z0_TEST2	int(11)	YES		NULL	
SELECT table_id,table_name FROM oceanbase.__all_virtual_table WHERE table_name='Z0CASE';
INSERT INTO  Z0CASE (z0_test0)VALUES('1111a1111');
ERROR 01000: Data truncated for column 'z0_test0' at row 1
INSERT INTO  Z0CASE (z0_test0)VALUES('2147483648');
ERROR 22003: Out of range value for column 'z0_test0' at row 1
INSERT INTO  Z0CASE (z0_test0)VALUES('2147483647');
SELECT * FROM Z0CASE ORDER BY Z0_TEST0;
z0_test0	Z0_TEST1	Z0_TEST2
1111	1111.1111	100
20111111	20111111	1
2147483647	NULL	NULL
DELETE FROM Z0CASE WHERE z0_test0=2147483647;
INSERT INTO  Z0CASE (z0_test0)VALUES(-2147483649);
ERROR 22003: Out of range value for column 'z0_test0' at row 1
INSERT INTO  Z0CASE (z0_test0)VALUES(-2147483648);
INSERT INTO  Z0CASE (z0_test0)VALUES(147483.648);
UPDATE Z0CASE SET z0_test0='2147483648' WHERE z0_test0=-2147483648;
ERROR 22003: Out of range value for column 'z0_test0' at row 1
UPDATE Z0CASE SET z0_test0='2147A3648' WHERE z0_test0=-2147483648;
ERROR 01000: Data truncated for column 'z0_test0' at row 1
UPDATE Z0CASE SET z0_test0='2147483647' WHERE z0_test0=-2147483648;
DELETE FROM Z0CASE WHERE z0_test0=2147483647;
UPDATE Z0CASE SET z0_test0=2147483648 WHERE z0_test0=1111;
ERROR 22003: Out of range value for column 'z0_test0' at row 1
UPDATE Z0CASE SET z0_test0=2147483647 WHERE z0_test0=1111;
UPDATE Z0CASE SET z0_test0=21474.83647 WHERE z0_test0=20111111;
SELECT * FROM Z0CASE ORDER BY Z0_TEST0;
z0_test0	Z0_TEST1	Z0_TEST2
21475	20111111	1
147484	NULL	NULL
2147483647	1111.1111	100
DELETE FROM Z0CASE WHERE z0_test0=2147483647;
SELECT * FROM Z0CASE ORDER BY Z0_TEST0;
z0_test0	Z0_TEST1	Z0_TEST2
21475	20111111	1
147484	NULL	NULL
DROP TABLE Z0CASE;
CREATE TABLE Z0CASE(Z0_TEST0 VARCHAR(100) PRIMARY KEY , Z0_TEST1 VARCHAR(50),Z0_TEST2 INT) with column group (all columns, each column);
INSERT INTO  Z0CASE (z0_test0,z0_test1,Z0_TEST2)VALUES('1111.1111','1111.1111',100);
INSERT INTO  Z0CASE (z0_test0,z0_test1,Z0_TEST2)VALUES(20111111,20111111,1);
SELECT * FROM Z0CASE ORDER BY Z0_TEST2;
Z0_TEST0	Z0_TEST1	Z0_TEST2
20111111	20111111	1
1111.1111	1111.1111	100
SELECT table_id,table_name FROM oceanbase.__all_virtual_table WHERE table_name='Z0CASE';
ALTER TABLE Z0CASE MODIFY column z0_test0 float(30,2);
DESC z0case;
Field	Type	Null	Key	Default	Extra
z0_test0	float(30,2)	NO	PRI	NULL	
Z0_TEST1	varchar(50)	YES		NULL	
Z0_TEST2	int(11)	YES		NULL	
SELECT * FROM Z0CASE ORDER BY Z0_TEST0;
z0_test0	Z0_TEST1	Z0_TEST2
1111.11	1111.1111	100
20111112.00	20111111	1
SELECT table_id,table_name FROM oceanbase.__all_virtual_table WHERE table_name='Z0CASE';
INSERT INTO  Z0CASE (z0_test0)VALUES('1111a111.11');
ERROR 01000: Data truncated for column 'z0_test0' at row 1
INSERT INTO  Z0CASE (z0_test0)VALUES('12345678901234567890123456789.83648');
ERROR 22003: Out of range value for column 'z0_test0' at row 1
INSERT INTO  Z0CASE (z0_test0)VALUES('1234567890123456789012345678.83648');
SELECT * FROM Z0CASE ORDER BY Z0_TEST0;
z0_test0	Z0_TEST1	Z0_TEST2
1111.11	1111.1111	100
20111112.00	20111111	1
1234567900681729900000000000.00	NULL	NULL
INSERT INTO  Z0CASE (z0_test0)VALUES(12345678901234567890123456789.83648);
ERROR 22003: Out of range value for column 'z0_test0' at row 1
INSERT INTO  Z0CASE (z0_test0)VALUES(12345678901234567890123456789);
ERROR 22003: Out of range value for column 'z0_test0' at row 1
INSERT INTO  Z0CASE (z0_test0)VALUES(1134567890123456789012345679.83648);
SELECT * FROM Z0CASE ORDER BY Z0_TEST0;
z0_test0	Z0_TEST1	Z0_TEST2
1111.11	1111.1111	100
20111112.00	20111111	1
1134567879697221500000000000.00	NULL	NULL
1234567900681729900000000000.00	NULL	NULL
UPDATE Z0CASE SET z0_test0='21a4.3648' WHERE z0_test0=1111.11;
ERROR 01000: Data truncated for column 'z0_test0' at row 1
UPDATE Z0CASE SET z0_test0='12345678901234567890123456789.83648' WHERE z0_test0=1111.11;
ERROR 22003: Out of range value for column 'z0_test0' at row 1
UPDATE Z0CASE SET z0_test0='1034567891234567890123456789.83648' WHERE z0_test0=1111.11;
UPDATE Z0CASE SET z0_test0=12345678901234567890123456789 WHERE z0_test0=1034567858712713100000000000;
ERROR 22003: Out of range value for column 'z0_test0' at row 1
UPDATE Z0CASE SET z0_test0=1234577890123456789012345678 WHERE z0_test0=1034567858712713100000000000;
SELECT * FROM Z0CASE ORDER BY Z0_TEST0;
z0_test0	Z0_TEST1	Z0_TEST2
20111112.00	20111111	1
1134567879697221500000000000.00	NULL	NULL
1234567900681729900000000000.00	NULL	NULL
1234577861923529700000000000.00	1111.1111	100
DELETE FROM Z0CASE WHERE z0_test0=1234577861923529700000000000;
DELETE FROM Z0CASE WHERE z0_test0=1.1345678796972215E27;
SELECT * FROM Z0CASE ORDER BY Z0_TEST0;
z0_test0	Z0_TEST1	Z0_TEST2
20111112.00	20111111	1
1234567900681729900000000000.00	NULL	NULL
VARCHAR -->date
DROP TABLE Z0CASE;
CREATE TABLE Z0CASE(Z0_TEST0 VARCHAR(100) PRIMARY KEY , Z0_TEST1 VARCHAR(50),Z0_TEST2 INT) with column group (all columns, each column);
INSERT INTO  Z0CASE (z0_test0,z0_test1,Z0_TEST2)VALUES('1111.1111','1111.1111',100);
INSERT INTO  Z0CASE (z0_test0,z0_test1,Z0_TEST2)VALUES('2011-11-11 11:11:11','2011-11-11 11:11:11',20);
SELECT * FROM Z0CASE ORDER BY Z0_TEST2;
Z0_TEST0	Z0_TEST1	Z0_TEST2
2011-11-11 11:11:11	2011-11-11 11:11:11	20
1111.1111	1111.1111	100
SELECT table_id,table_name FROM oceanbase.__all_virtual_table WHERE table_name='Z0CASE';
ALTER TABLE Z0CASE MODIFY column z0_test0 date;
SELECT * FROM Z0CASE ORDER BY Z0_TEST0;
z0_test0	Z0_TEST1	Z0_TEST2
1111-11-11	1111.1111	100
2011-11-11	2011-11-11 11:11:11	20
DESC z0case;
Field	Type	Null	Key	Default	Extra
z0_test0	date	NO	PRI	NULL	
Z0_TEST1	varchar(50)	YES		NULL	
Z0_TEST2	int(11)	YES		NULL	
SELECT table_id,table_name FROM oceanbase.__all_virtual_table WHERE table_name='Z0CASE';
VARCHAR -->timestamp
DROP TABLE Z0CASE;
CREATE TABLE Z0CASE(Z0_TEST0 VARCHAR(100) PRIMARY KEY , Z0_TEST1 VARCHAR(50),Z0_TEST2 INT) with column group (all columns, each column);
INSERT INTO  Z0CASE (z0_test0,z0_test1,Z0_TEST2)VALUES('1111.1111','1111.1111',100);
INSERT INTO  Z0CASE (z0_test0,z0_test1,Z0_TEST2)VALUES('2011-11-11 11:11:11','2011-11-11 11:11:11',20);
INSERT INTO  Z0CASE (z0_test0,z0_test1,Z0_TEST2)VALUES(20121212,20111111,1);
SELECT * FROM Z0CASE ORDER BY Z0_TEST2;
Z0_TEST0	Z0_TEST1	Z0_TEST2
20121212	20111111	1
2011-11-11 11:11:11	2011-11-11 11:11:11	20
1111.1111	1111.1111	100
SELECT table_id,table_name FROM oceanbase.__all_virtual_table WHERE table_name='Z0CASE';
ALTER TABLE Z0CASE MODIFY column z0_test0 timestamp;
SELECT * FROM Z0CASE ORDER BY Z0_TEST0;
z0_test0	Z0_TEST1	Z0_TEST2
1111-11-11 00:00:00	1111.1111	100
2011-11-11 11:11:11	2011-11-11 11:11:11	20
2012-12-12 00:00:00	20111111	1
DESC z0case;
Field	Type	Null	Key	Default	Extra
z0_test0	timestamp	NO	PRI	NULL	
Z0_TEST1	varchar(50)	YES		NULL	
Z0_TEST2	int(11)	YES		NULL	
SELECT table_id,table_name FROM oceanbase.__all_virtual_table WHERE table_name='Z0CASE';
SET/ENUM
SET --> ENUM
DROP TABLE Z0CASE;
CREATE TABLE Z0CASE(Z0_TEST0 SET('','ABC','12321','0') PRIMARY KEY, Z0_TEST1 ENUM('','ABC','12321','0')) with column group (all columns, each column);
INSERT INTO  Z0CASE (z0_test0,z0_test1)VALUES('','');
INSERT INTO  Z0CASE (z0_test0,z0_test1)VALUES('ABC','ABC');
INSERT INTO  Z0CASE (z0_test0,z0_test1)VALUES('12321','12321');
INSERT INTO  Z0CASE (z0_test0,z0_test1)VALUES('0','0');
SELECT * FROM Z0CASE ORDER BY Z0_TEST0*1;
Z0_TEST0	Z0_TEST1
	
ABC	ABC
12321	12321
0	0
SELECT table_id,table_name FROM oceanbase.__all_virtual_table WHERE table_name='Z0CASE';
ALTER TABLE Z0CASE MODIFY column Z0_TEST0 ENUM ('','ABC','12321','0','123','123213213');
SELECT * FROM Z0CASE ORDER BY Z0_TEST0*1;
Z0_TEST0	Z0_TEST1
	
ABC	ABC
12321	12321
0	0
DESC z0case;
Field	Type	Null	Key	Default	Extra
Z0_TEST0	enum('','ABC','12321','0','123','123213213')	NO	PRI	NULL	
Z0_TEST1	enum('','ABC','12321','0')	YES		NULL	
SELECT table_id,table_name FROM oceanbase.__all_virtual_table WHERE table_name='Z0CASE';
DROP TABLE Z0CASE;
CREATE TABLE Z0CASE(Z0_TEST0 SET('123','ABC','12321','0') PRIMARY KEY, Z0_TEST1 ENUM('','ABC','12321','0')) with column group (all columns, each column);
INSERT INTO  Z0CASE (z0_test0,z0_test1)VALUES('123','');
INSERT INTO  Z0CASE (z0_test0,z0_test1)VALUES('ABC','ABC');
INSERT INTO  Z0CASE (z0_test0,z0_test1)VALUES('12321','12321');
INSERT INTO  Z0CASE (z0_test0,z0_test1)VALUES('0','0');
SELECT * FROM Z0CASE ORDER BY Z0_TEST0*1;
Z0_TEST0	Z0_TEST1
123	
ABC	ABC
12321	12321
0	0
SELECT table_id,table_name FROM oceanbase.__all_virtual_table WHERE table_name='Z0CASE';
ALTER TABLE Z0CASE MODIFY column Z0_TEST0  ENUM('123','ABC','12321','0');
SELECT * FROM Z0CASE ORDER BY Z0_TEST0*1;
Z0_TEST0	Z0_TEST1
123	
ABC	ABC
12321	12321
0	0
DESC z0case;
Field	Type	Null	Key	Default	Extra
Z0_TEST0	enum('123','ABC','12321','0')	NO	PRI	NULL	
Z0_TEST1	enum('','ABC','12321','0')	YES		NULL	
SELECT table_id,table_name FROM oceanbase.__all_virtual_table WHERE table_name='Z0CASE';
DROP TABLE Z0CASE;
CREATE TABLE Z0CASE(Z0_TEST0 SET('123','ABC','12321','0') PRIMARY KEY, Z0_TEST1 ENUM('','ABC','12321','0')) with column group (all columns, each column);
INSERT INTO  Z0CASE (z0_test0,z0_test1)VALUES('123','');
INSERT INTO  Z0CASE (z0_test0,z0_test1)VALUES('ABC','ABC');
INSERT INTO  Z0CASE (z0_test0,z0_test1)VALUES('12321','12321');
INSERT INTO  Z0CASE (z0_test0,z0_test1)VALUES('0','0');
SELECT * FROM Z0CASE ORDER BY Z0_TEST0*1;
Z0_TEST0	Z0_TEST1
123	
ABC	ABC
12321	12321
0	0
SELECT table_id,table_name FROM oceanbase.__all_virtual_table WHERE table_name='Z0CASE';
ALTER TABLE Z0CASE MODIFY column Z0_TEST0  ENUM('123','abc','12321','0');
SELECT * FROM Z0CASE ORDER BY Z0_TEST0*1;
Z0_TEST0	Z0_TEST1
123	
abc	ABC
12321	12321
0	0
DESC z0case;
Field	Type	Null	Key	Default	Extra
Z0_TEST0	enum('123','abc','12321','0')	NO	PRI	NULL	
Z0_TEST1	enum('','ABC','12321','0')	YES		NULL	
SELECT table_id,table_name FROM oceanbase.__all_virtual_table WHERE table_name='Z0CASE';
DROP TABLE Z0CASE;
CREATE TABLE Z0CASE(Z0_TEST0 SET('123','ABC','12321','0') PRIMARY KEY, Z0_TEST1 ENUM('','ABC','12321','0')) with column group (all columns, each column);
INSERT INTO  Z0CASE (z0_test0,z0_test1)VALUES('123','');
INSERT INTO  Z0CASE (z0_test0,z0_test1)VALUES('ABC','ABC');
INSERT INTO  Z0CASE (z0_test0,z0_test1)VALUES('12321','12321');
INSERT INTO  Z0CASE (z0_test0,z0_test1)VALUES('0','0');
ALTER TABLE Z0CASE MODIFY column Z0_TEST0  ENUM('123','12321','0','bbc');
ERROR 01000: Data truncated for argument
SET --> CHAR
DROP TABLE Z0CASE;
CREATE TABLE Z0CASE(Z0_TEST0 SET('','ABC','12321','0') PRIMARY KEY, Z0_TEST1 ENUM('','ABC','12321','0')) with column group (all columns, each column);
INSERT INTO  Z0CASE (z0_test0,z0_test1)VALUES('','');
INSERT INTO  Z0CASE (z0_test0,z0_test1)VALUES('ABC','ABC');
INSERT INTO  Z0CASE (z0_test0,z0_test1)VALUES('12321','12321');
INSERT INTO  Z0CASE (z0_test0,z0_test1)VALUES('0','0');
SELECT * FROM Z0CASE ORDER BY Z0_TEST0*1;
Z0_TEST0	Z0_TEST1
	
ABC	ABC
12321	12321
0	0
SELECT table_id,table_name FROM oceanbase.__all_virtual_table WHERE table_name='Z0CASE';
ALTER TABLE Z0CASE MODIFY column Z0_TEST0 CHAR(100);
SELECT * FROM Z0CASE ORDER BY Z0_TEST0*1;
Z0_TEST0	Z0_TEST1
	
0	0
ABC	ABC
12321	12321
Warnings:
Warning	1292	Truncated incorrect DOUBLE value: 'ABC'
DESC z0case;
Field	Type	Null	Key	Default	Extra
Z0_TEST0	char(100)	NO	PRI	NULL	
Z0_TEST1	enum('','ABC','12321','0')	YES		NULL	
SELECT table_id,table_name FROM oceanbase.__all_virtual_table WHERE table_name='Z0CASE';
SET --> VARCHAR
DROP TABLE Z0CASE;
CREATE TABLE Z0CASE(Z0_TEST0 SET('','ABC','12321','0') PRIMARY KEY, Z0_TEST1 ENUM('','ABC','12321','0')) with column group (all columns, each column);
INSERT INTO  Z0CASE (z0_test0,z0_test1)VALUES('','');
INSERT INTO  Z0CASE (z0_test0,z0_test1)VALUES('ABC','ABC');
INSERT INTO  Z0CASE (z0_test0,z0_test1)VALUES('12321','12321');
INSERT INTO  Z0CASE (z0_test0,z0_test1)VALUES('0','0');
SELECT * FROM Z0CASE ORDER BY Z0_TEST0*1;
Z0_TEST0	Z0_TEST1
	
ABC	ABC
12321	12321
0	0
SELECT table_id,table_name FROM oceanbase.__all_virtual_table WHERE table_name='Z0CASE';
ALTER TABLE Z0CASE MODIFY column Z0_TEST0 VARCHAR(100);
SELECT * FROM Z0CASE ORDER BY Z0_TEST0*1;
Z0_TEST0	Z0_TEST1
	
0	0
ABC	ABC
12321	12321
Warnings:
Warning	1292	Truncated incorrect DOUBLE value: 'ABC'
DESC z0case;
Field	Type	Null	Key	Default	Extra
Z0_TEST0	varchar(100)	NO	PRI	NULL	
Z0_TEST1	enum('','ABC','12321','0')	YES		NULL	
SELECT table_id,table_name FROM oceanbase.__all_virtual_table WHERE table_name='Z0CASE';
ENUM --> VARCHAR
ALTER TABLE Z0CASE MODIFY column Z0_TEST1 VARCHAR(100);
SELECT * FROM Z0CASE ORDER BY Z0_TEST0*1;
Z0_TEST0	Z0_TEST1
	
0	0
ABC	ABC
12321	12321
Warnings:
Warning	1292	Truncated incorrect DOUBLE value: 'ABC'
DESC z0case;
Field	Type	Null	Key	Default	Extra
Z0_TEST0	varchar(100)	NO	PRI	NULL	
Z0_TEST1	varchar(100)	YES		NULL	
SELECT table_id,table_name FROM oceanbase.__all_virtual_table WHERE table_name='Z0CASE';
VARCHAR --> TEXT
ALTER TABLE Z0CASE MODIFY column Z0_TEST0 text(100);
ERROR 42000: The used storage engine can't index column 'Z0_TEST0'
SET --> INT/float
DROP TABLE Z0CASE;
CREATE TABLE Z0CASE(Z0_TEST0 SET('','ABC','12321','0') PRIMARY KEY, Z0_TEST1 ENUM('','ABC','12321','0')) with column group (all columns, each column);
INSERT INTO  Z0CASE (z0_test0,z0_test1)VALUES('','');
INSERT INTO  Z0CASE (z0_test0,z0_test1)VALUES('ABC','ABC');
INSERT INTO  Z0CASE (z0_test0,z0_test1)VALUES('12321','12321');
INSERT INTO  Z0CASE (z0_test0,z0_test1)VALUES('0','0');
SELECT * FROM Z0CASE ORDER BY Z0_TEST0*1;
Z0_TEST0	Z0_TEST1
	
ABC	ABC
12321	12321
0	0
SELECT table_id,table_name FROM oceanbase.__all_virtual_table WHERE table_name='Z0CASE';
ALTER TABLE Z0CASE MODIFY column Z0_TEST0 INT;
SELECT * FROM Z0CASE ORDER BY Z0_TEST0*1;
Z0_TEST0	Z0_TEST1
0	
2	ABC
4	12321
8	0
DESC z0case;
Field	Type	Null	Key	Default	Extra
Z0_TEST0	int(11)	NO	PRI	NULL	
Z0_TEST1	enum('','ABC','12321','0')	YES		NULL	
SELECT table_id,table_name FROM oceanbase.__all_virtual_table WHERE table_name='Z0CASE';
DROP TABLE Z0CASE;
CREATE TABLE Z0CASE(Z0_TEST0 SET('','ABC','12321','0') PRIMARY KEY, Z0_TEST1 ENUM('','ABC','12321','0')) with column group (all columns, each column);
INSERT INTO  Z0CASE (z0_test0,z0_test1)VALUES('','');
INSERT INTO  Z0CASE (z0_test0,z0_test1)VALUES('ABC','ABC');
INSERT INTO  Z0CASE (z0_test0,z0_test1)VALUES('12321','12321');
INSERT INTO  Z0CASE (z0_test0,z0_test1)VALUES('0','0');
SELECT * FROM Z0CASE ORDER BY Z0_TEST0*1;
Z0_TEST0	Z0_TEST1
	
ABC	ABC
12321	12321
0	0
SELECT table_id,table_name FROM oceanbase.__all_virtual_table WHERE table_name='Z0CASE';
ALTER TABLE Z0CASE MODIFY column Z0_TEST0 float(4,2);
SELECT * FROM Z0CASE ORDER BY Z0_TEST0*1;
Z0_TEST0	Z0_TEST1
0.00	
2.00	ABC
4.00	12321
8.00	0
DESC z0case;
Field	Type	Null	Key	Default	Extra
Z0_TEST0	float(4,2)	NO	PRI	NULL	
Z0_TEST1	enum('','ABC','12321','0')	YES		NULL	
SELECT table_id,table_name FROM oceanbase.__all_virtual_table WHERE table_name='Z0CASE';
SET/ENUM --> date/time/year/datetime/timestamp
DROP TABLE Z0CASE;
CREATE TABLE Z0CASE(Z0_TEST0 SET('2011-11-11 11:11:12','11:11:11','12321','0','2011-11-12') PRIMARY KEY) with column group (all columns, each column);
INSERT INTO  Z0CASE (z0_test0)VALUES('11:11:11 ');
INSERT INTO  Z0CASE (z0_test0)VALUES('2011-11-12 ');
INSERT INTO  Z0CASE (z0_test0)VALUES('2011-11-11 11:11:12');
ALTER TABLE Z0CASE MODIFY column Z0_TEST0 DATE;
ERROR 23000: Duplicated primary key
DROP TABLE Z0CASE;
CREATE TABLE Z0CASE(Z0_TEST0 SET('2011-11-11 11:11:12','11:11:11','12321','0','2011-11-12') PRIMARY KEY) with column group (all columns, each column);
INSERT INTO  Z0CASE (z0_test0)VALUES('11:11:11 ');
INSERT INTO  Z0CASE (z0_test0)VALUES('2011-11-12 ');
INSERT INTO  Z0CASE (z0_test0)VALUES('2011-11-11 11:11:12');
SELECT * FROM Z0CASE ORDER BY Z0_TEST0*1;
Z0_TEST0
2011-11-11 11:11:12
11:11:11
2011-11-12
SELECT table_id,table_name FROM oceanbase.__all_virtual_table WHERE table_name='Z0CASE';
ALTER TABLE Z0CASE MODIFY column Z0_TEST0 time;
SELECT * FROM Z0CASE ORDER BY Z0_TEST0*1;
Z0_TEST0
00:20:11
11:11:11
11:11:12
DESC z0case;
Field	Type	Null	Key	Default	Extra
Z0_TEST0	time	NO	PRI	NULL	
SELECT table_id,table_name FROM oceanbase.__all_virtual_table WHERE table_name='Z0CASE';
DROP TABLE Z0CASE;
CREATE TABLE Z0CASE(Z0_TEST0 SET('2011-11-11 11:11:12','11:11:11','12321','0','2011-11-12') PRIMARY KEY) with column group (all columns, each column);
INSERT INTO  Z0CASE (z0_test0)VALUES('11:11:11 ');
INSERT INTO  Z0CASE (z0_test0)VALUES('2011-11-12 ');
INSERT INTO  Z0CASE (z0_test0)VALUES('2011-11-11 11:11:12');
SELECT * FROM Z0CASE ORDER BY Z0_TEST0*1;
Z0_TEST0
2011-11-11 11:11:12
11:11:11
2011-11-12
SELECT table_id,table_name FROM oceanbase.__all_virtual_table WHERE table_name='Z0CASE';
ALTER TABLE Z0CASE MODIFY column Z0_TEST0 year;
SELECT * FROM Z0CASE ORDER BY Z0_TEST0;
Z0_TEST0
2001
2002
2016
DESC z0case;
Field	Type	Null	Key	Default	Extra
Z0_TEST0	year(4)	NO	PRI	NULL	
SELECT table_id,table_name FROM oceanbase.__all_virtual_table WHERE table_name='Z0CASE';
DROP TABLE Z0CASE;
CREATE TABLE Z0CASE(Z0_TEST0 SET('2011-11-11 11:11:12','11:11:11','12321','0','2011-11-12') PRIMARY KEY) with column group (all columns, each column);
INSERT INTO  Z0CASE (z0_test0)VALUES('11:11:11 ');
INSERT INTO  Z0CASE (z0_test0)VALUES('2011-11-12 ');
INSERT INTO  Z0CASE (z0_test0)VALUES('2011-11-11 11:11:12');
SELECT * FROM Z0CASE ORDER BY Z0_TEST0*1;
Z0_TEST0
2011-11-11 11:11:12
11:11:11
2011-11-12
SELECT table_id,table_name FROM oceanbase.__all_virtual_table WHERE table_name='Z0CASE';
ALTER TABLE Z0CASE MODIFY column Z0_TEST0 datetime;
SELECT * FROM Z0CASE ORDER BY Z0_TEST0;
Z0_TEST0
2011-11-11 00:00:00
2011-11-11 11:11:12
2011-11-12 00:00:00
DESC z0case;
Field	Type	Null	Key	Default	Extra
Z0_TEST0	datetime	NO	PRI	NULL	
SELECT table_id,table_name FROM oceanbase.__all_virtual_table WHERE table_name='Z0CASE';
DROP TABLE Z0CASE;
CREATE TABLE Z0CASE(Z0_TEST0 SET('2011-11-11 11:11:12','11:11:11','12321','0','2011-11-12') PRIMARY KEY) with column group (all columns, each column);
INSERT INTO  Z0CASE (z0_test0)VALUES('11:11:11 ');
INSERT INTO  Z0CASE (z0_test0)VALUES('2011-11-12 ');
INSERT INTO  Z0CASE (z0_test0)VALUES('2011-11-11 11:11:12');
SELECT * FROM Z0CASE ORDER BY Z0_TEST0*1;
Z0_TEST0
2011-11-11 11:11:12
11:11:11
2011-11-12
SELECT table_id,table_name FROM oceanbase.__all_virtual_table WHERE table_name='Z0CASE';
ALTER TABLE Z0CASE MODIFY column Z0_TEST0 timestamp;
SELECT * FROM Z0CASE ORDER BY Z0_TEST0;
Z0_TEST0
2011-11-11 00:00:00
2011-11-11 11:11:12
2011-11-12 00:00:00
DESC z0case;
Field	Type	Null	Key	Default	Extra
Z0_TEST0	timestamp	NO	PRI	NULL	
SELECT table_id,table_name FROM oceanbase.__all_virtual_table WHERE table_name='Z0CASE';
TINYINT/ SMALLINT/ MEDIUMINT	/ INT/ BIGINT
DROP TABLE Z0CASE;
CREATE TABLE Z0CASE(Z0_TEST0 TINYINT PRIMARY KEY) with column group (all columns, each column);
INSERT INTO  Z0CASE (z0_test0)VALUES(0);
INSERT INTO  Z0CASE (z0_test0)VALUES(111);
INSERT INTO  Z0CASE (z0_test0)VALUES(127);
INSERT INTO  Z0CASE (z0_test0)VALUES(-3.3333);
SELECT * FROM Z0CASE ORDER BY Z0_TEST0;
Z0_TEST0
-3
0
111
127
SELECT table_id,table_name FROM oceanbase.__all_virtual_table WHERE table_name='Z0CASE';
ALTER TABLE Z0CASE MODIFY column z0_test0 TINYINT  DEFAULT 0;
SELECT Z0_TEST0 FROM Z0CASE;
Z0_TEST0
-3
0
111
127
DESC z0case;
Field	Type	Null	Key	Default	Extra
z0_test0	tinyint(4)	NO	PRI	0	
SELECT table_id,table_name FROM oceanbase.__all_virtual_table WHERE table_name='Z0CASE';
INSERT INTO Z0CASE VALUES(NULL);
ERROR 23000: Column 'z0_test0' cannot be null
INSERT INTO Z0CASE VALUES('');
ERROR HY000: Incorrect integer value for column 'z0_test0' at row 1
INSERT INTO Z0CASE VALUES('128');
ERROR 22003: Out of range value for column 'z0_test0' at row 1
INSERT INTO Z0CASE VALUES(128);
ERROR 22003: Out of range value for column 'z0_test0' at row 1
INSERT INTO Z0CASE VALUES(-128);
SELECT * FROM Z0CASE ORDER BY Z0_TEST0;
z0_test0
-128
-3
0
111
127
DELETE FROM Z0CASE WHERE Z0_TEST0=-128;
UPDATE Z0CASE SET Z0_TEST0='' WHERE Z0_TEST0=127;
ERROR HY000: Incorrect integer value for column 'z0_test0' at row 1
UPDATE Z0CASE SET Z0_TEST0='128' WHERE Z0_TEST0=127;
ERROR 22003: Out of range value for column 'z0_test0' at row 1
UPDATE Z0CASE SET Z0_TEST0=128 WHERE Z0_TEST0=127;
ERROR 22003: Out of range value for column 'z0_test0' at row 1
UPDATE Z0CASE SET Z0_TEST0=-128 WHERE Z0_TEST0=127;
SELECT * FROM Z0CASE ORDER BY Z0_TEST0;
z0_test0
-128
-3
0
111
ALTER TABLE Z0CASE MODIFY column z0_test0 MEDIUMINT DEFAULT 0;
SELECT * FROM Z0CASE ORDER BY Z0_TEST0;
z0_test0
-128
-3
0
111
DESC z0case;
Field	Type	Null	Key	Default	Extra
z0_test0	mediumint(9)	NO	PRI	0	
SELECT table_id,table_name FROM oceanbase.__all_virtual_table WHERE table_name='Z0CASE';
INSERT INTO Z0CASE VALUES(-8388608);
SELECT * FROM Z0CASE ORDER BY Z0_TEST0;
z0_test0
-8388608
-128
-3
0
111
INSERT INTO Z0CASE VALUES('');
ERROR HY000: Incorrect integer value for column 'z0_test0' at row 1
INSERT INTO Z0CASE VALUES('8388608');
ERROR 22003: Out of range value for column 'z0_test0' at row 1
INSERT INTO Z0CASE VALUES(-8388609);
ERROR 22003: Out of range value for column 'z0_test0' at row 1
UPDATE Z0CASE SET Z0_TEST0=8388607 WHERE Z0_TEST0=-128;
SELECT * FROM Z0CASE ORDER BY Z0_TEST0;
z0_test0
-8388608
-3
0
111
8388607
UPDATE Z0CASE SET Z0_TEST0='' WHERE Z0_TEST0=-128;
UPDATE Z0CASE SET Z0_TEST0='8388608' WHERE Z0_TEST0=-128;
UPDATE Z0CASE SET Z0_TEST0=8388608 WHERE Z0_TEST0=-128;
DELETE FROM Z0CASE WHERE Z0_TEST0=8388607;
SELECT * FROM Z0CASE ORDER BY Z0_TEST0;
z0_test0
-8388608
-3
0
111
ALTER TABLE Z0CASE MODIFY column z0_test0 INT DEFAULT 0;
SELECT * FROM Z0CASE ORDER BY Z0_TEST0;
z0_test0
-8388608
-3
0
111
DESC z0case;
Field	Type	Null	Key	Default	Extra
z0_test0	int(11)	NO	PRI	0	
SELECT table_id,table_name FROM oceanbase.__all_virtual_table WHERE table_name='Z0CASE';
INSERT INTO Z0CASE VALUES(2147483647);
SELECT * FROM Z0CASE ORDER BY Z0_TEST0;
z0_test0
-8388608
-3
0
111
2147483647
INSERT INTO Z0CASE VALUES('');
ERROR HY000: Incorrect integer value for column 'z0_test0' at row 1
INSERT INTO Z0CASE VALUES('2147483648');
ERROR 22003: Out of range value for column 'z0_test0' at row 1
INSERT INTO Z0CASE VALUES(2147483648);
ERROR 22003: Out of range value for column 'z0_test0' at row 1
UPDATE Z0CASE SET Z0_TEST0=-2147483648 WHERE Z0_TEST0=0;
SELECT * FROM Z0CASE ORDER BY Z0_TEST0;
z0_test0
-2147483648
-8388608
-3
111
2147483647
UPDATE Z0CASE SET Z0_TEST0='' WHERE Z0_TEST0=-3;
ERROR HY000: Incorrect integer value for column 'z0_test0' at row 1
UPDATE Z0CASE SET Z0_TEST0='-2147483649' WHERE Z0_TEST0=-3;
ERROR 22003: Out of range value for column 'z0_test0' at row 1
UPDATE Z0CASE SET Z0_TEST0=-2147483649 WHERE Z0_TEST0=-3;
ERROR 22003: Out of range value for column 'z0_test0' at row 1
DELETE FROM Z0CASE WHERE Z0_TEST0=-2147483648;
SELECT * FROM Z0CASE ORDER BY Z0_TEST0;
z0_test0
-8388608
-3
111
2147483647
ALTER TABLE Z0CASE MODIFY column z0_test0 BIGINT DEFAULT 0;
SELECT * FROM Z0CASE ORDER BY Z0_TEST0;
z0_test0
-8388608
-3
111
2147483647
DESC z0case;
Field	Type	Null	Key	Default	Extra
z0_test0	bigint(20)	NO	PRI	0	
SELECT table_id,table_name FROM oceanbase.__all_virtual_table WHERE table_name='Z0CASE';
INSERT INTO Z0CASE VALUES(9223372036854775807);
SELECT * FROM Z0CASE ORDER BY Z0_TEST0;
z0_test0
-8388608
-3
111
2147483647
9223372036854775807
INSERT INTO Z0CASE VALUES('');
ERROR HY000: Incorrect integer value for column 'z0_test0' at row 1
INSERT INTO Z0CASE VALUES('9223372036854775808');
ERROR 22003: Out of range value for column 'z0_test0' at row 1
INSERT INTO Z0CASE VALUES(9223372036854775808);
ERROR 22003: Out of range value for column 'z0_test0' at row 1
UPDATE Z0CASE SET Z0_TEST0=-9223372036854775808 WHERE Z0_TEST0=-3;
SELECT * FROM Z0CASE ORDER BY Z0_TEST0;
z0_test0
-9223372036854775808
-8388608
111
2147483647
9223372036854775807
UPDATE Z0CASE SET Z0_TEST0='' WHERE Z0_TEST0=111;
ERROR HY000: Incorrect integer value for column 'z0_test0' at row 1
UPDATE Z0CASE SET Z0_TEST0='-9223372036854775809' WHERE Z0_TEST0=111;
ERROR 22003: Out of range value for column 'z0_test0' at row 1
UPDATE Z0CASE SET Z0_TEST0=-9223372036854775809 WHERE Z0_TEST0=111;
ERROR 22003: Out of range value for column 'z0_test0' at row 1
DELETE FROM Z0CASE WHERE Z0_TEST0=-9223372036854775808;
SELECT * FROM Z0CASE ORDER BY Z0_TEST0;
z0_test0
-8388608
111
2147483647
9223372036854775807
DROP TABLE Z0CASE;
CREATE TABLE Z0CASE(Z0_TEST0 SMALLINT PRIMARY KEY) with column group (all columns, each column);
INSERT INTO  Z0CASE (z0_test0)VALUES(0);
INSERT INTO  Z0CASE (z0_test0)VALUES(111);
INSERT INTO  Z0CASE (z0_test0)VALUES(127);
INSERT INTO  Z0CASE (z0_test0)VALUES(-3.3333);
SELECT * FROM Z0CASE ORDER BY Z0_TEST0;
Z0_TEST0
-3
0
111
127
SELECT table_id,table_name FROM oceanbase.__all_virtual_table WHERE table_name='Z0CASE';
ALTER TABLE Z0CASE MODIFY column z0_test0 TINYINT  DEFAULT 0;
SELECT * FROM Z0CASE ORDER BY Z0_TEST0;
z0_test0
-3
0
111
127
DESC z0case;
Field	Type	Null	Key	Default	Extra
z0_test0	tinyint(4)	NO	PRI	0	
SELECT table_id,table_name FROM oceanbase.__all_virtual_table WHERE table_name='Z0CASE';
ALTER TABLE Z0CASE MODIFY column z0_test0 SMALLINT DEFAULT 0;
SELECT * FROM Z0CASE ORDER BY Z0_TEST0;
z0_test0
-3
0
111
127
DESC z0case;
Field	Type	Null	Key	Default	Extra
z0_test0	smallint(6)	NO	PRI	0	
SELECT table_id,table_name FROM oceanbase.__all_virtual_table WHERE table_name='Z0CASE';
ALTER TABLE Z0CASE MODIFY column z0_test0 MEDIUMINT DEFAULT 0;
SELECT * FROM Z0CASE ORDER BY Z0_TEST0;
z0_test0
-3
0
111
127
DESC z0case;
Field	Type	Null	Key	Default	Extra
z0_test0	mediumint(9)	NO	PRI	0	
SELECT table_id,table_name FROM oceanbase.__all_virtual_table WHERE table_name='Z0CASE';
ALTER TABLE Z0CASE MODIFY column z0_test0 INT DEFAULT 0;
SELECT * FROM Z0CASE ORDER BY Z0_TEST0;
z0_test0
-3
0
111
127
DESC z0case;
Field	Type	Null	Key	Default	Extra
z0_test0	int(11)	NO	PRI	0	
SELECT table_id,table_name FROM oceanbase.__all_virtual_table WHERE table_name='Z0CASE';
ALTER TABLE Z0CASE MODIFY column z0_test0 BIGINT DEFAULT 0;
SELECT * FROM Z0CASE ORDER BY Z0_TEST0;
z0_test0
-3
0
111
127
DESC z0case;
Field	Type	Null	Key	Default	Extra
z0_test0	bigint(20)	NO	PRI	0	
SELECT table_id,table_name FROM oceanbase.__all_virtual_table WHERE table_name='Z0CASE';
DROP TABLE Z0CASE;
CREATE TABLE Z0CASE(Z0_TEST0 INT PRIMARY KEY) with column group (all columns, each column);
INSERT INTO  Z0CASE (z0_test0)VALUES(0);
INSERT INTO  Z0CASE (z0_test0)VALUES(111);
INSERT INTO  Z0CASE (z0_test0)VALUES(127);
INSERT INTO  Z0CASE (z0_test0)VALUES(-3.3333);
SELECT * FROM Z0CASE ORDER BY Z0_TEST0;
Z0_TEST0
-3
0
111
127
SELECT table_id,table_name FROM oceanbase.__all_virtual_table WHERE table_name='Z0CASE';
ALTER TABLE Z0CASE MODIFY column z0_test0 FLOAT  DEFAULT 0;
DESC z0case;
Field	Type	Null	Key	Default	Extra
z0_test0	float	NO	PRI	0	
SELECT * FROM Z0CASE ORDER BY Z0_TEST0;
z0_test0
-3
0
111
127
SELECT table_id,table_name FROM oceanbase.__all_virtual_table WHERE table_name='Z0CASE';
DROP TABLE Z0CASE;
CREATE TABLE Z0CASE(Z0_TEST0 INT PRIMARY KEY) with column group (all columns, each column);
INSERT INTO  Z0CASE (z0_test0)VALUES(0);
INSERT INTO  Z0CASE (z0_test0)VALUES(111);
INSERT INTO  Z0CASE (z0_test0)VALUES(127);
INSERT INTO  Z0CASE (z0_test0)VALUES(-3.3333);
SELECT * FROM Z0CASE ORDER BY Z0_TEST0;
Z0_TEST0
-3
0
111
127
SELECT table_id,table_name FROM oceanbase.__all_virtual_table WHERE table_name='Z0CASE';
ALTER TABLE Z0CASE MODIFY column z0_test0 DOUBLE DEFAULT 0;
DESC z0case;
Field	Type	Null	Key	Default	Extra
z0_test0	double	NO	PRI	0	
SELECT * FROM Z0CASE ORDER BY Z0_TEST0;
z0_test0
-3
0
111
127
SELECT table_id,table_name FROM oceanbase.__all_virtual_table WHERE table_name='Z0CASE';
INSERT INTO Z0CASE VALUES();
ERROR 23000: Duplicate entry '0' for key 'PRIMARY'
INSERT INTO Z0CASE VALUES('');
ERROR 01000: Data truncated for column 'z0_test0' at row 1
INSERT INTO Z0CASE VALUES('12');
INSERT INTO Z0CASE VALUES(112);
INSERT INTO Z0CASE VALUES('12345678910.109876543210123456789');
INSERT INTO Z0CASE VALUES(121222345678910.109876543210123456789);
SELECT * FROM Z0CASE ORDER BY Z0_TEST0;
z0_test0
-3
0
12
111
112
127
12345678910.109877
121222345678910.11
UPDATE Z0CASE SET Z0_TEST0='' WHERE Z0_TEST0=-3;
ERROR 01000: Data truncated for column 'z0_test0' at row 1
UPDATE Z0CASE SET Z0_TEST0=  WHERE Z0_TEST0=-3;
ERROR 42000: You have an error in your SQL syntax; check the manual that corresponds to your OceanBase version for the right syntax to use near 'Z0_TEST0=-3' at line 1
UPDATE Z0CASE SET Z0_TEST0='22'  WHERE Z0_TEST0=-3;
SELECT * FROM Z0CASE ORDER BY Z0_TEST0;
z0_test0
0
12
22
111
112
127
12345678910.109877
121222345678910.11
UPDATE Z0CASE SET Z0_TEST0='22.365456'  WHERE Z0_TEST0=22;
SELECT * FROM Z0CASE ORDER BY Z0_TEST0;
z0_test0
0
12
22.365456
111
112
127
12345678910.109877
121222345678910.11
UPDATE Z0CASE SET Z0_TEST0=33 WHERE Z0_TEST0=22.365456;
SELECT * FROM Z0CASE ORDER BY Z0_TEST0;
z0_test0
0
12
33
111
112
127
12345678910.109877
121222345678910.11
UPDATE Z0CASE SET Z0_TEST0=112233445566778899.98766554433221100 WHERE Z0_TEST0=33;
SELECT * FROM Z0CASE ORDER BY Z0_TEST0;
z0_test0
0
12
111
112
127
12345678910.109877
121222345678910.11
1.122334455667789e17
DELETE FROM Z0CASE WHERE Z0_TEST0=121222345678910.11;
SELECT * FROM Z0CASE ORDER BY Z0_TEST0;
z0_test0
0
12
111
112
127
12345678910.109877
1.122334455667789e17
DROP TABLE Z0CASE;
CREATE TABLE Z0CASE(Z0_TEST0 INT PRIMARY KEY) with column group (all columns, each column);
INSERT INTO  Z0CASE (z0_test0)VALUES(0);
INSERT INTO  Z0CASE (z0_test0)VALUES(111);
INSERT INTO  Z0CASE (z0_test0)VALUES(127);
INSERT INTO  Z0CASE (z0_test0)VALUES(-3.3333);
SELECT * FROM Z0CASE ORDER BY Z0_TEST0;
Z0_TEST0
-3
0
111
127
SELECT table_id,table_name FROM oceanbase.__all_virtual_table WHERE table_name='Z0CASE';
ALTER TABLE Z0CASE MODIFY column z0_test0 DECIMAL DEFAULT 0;
DESC z0case;
Field	Type	Null	Key	Default	Extra
z0_test0	decimal(10,0)	NO	PRI	0	
SELECT * FROM Z0CASE ORDER BY Z0_TEST0;
z0_test0
-3
0
111
127
SELECT table_id,table_name FROM oceanbase.__all_virtual_table WHERE table_name='Z0CASE';
INSERT INTO Z0CASE VALUES();
ERROR 23000: Duplicate entry '0' for key 'PRIMARY'
INSERT INTO Z0CASE VALUES('');
ERROR HY000: Incorrect decimal value for column 'z0_test0' at row 1
INSERT INTO Z0CASE VALUES('12');
INSERT INTO Z0CASE VALUES(112);
SELECT * FROM Z0CASE ORDER BY Z0_TEST0;
z0_test0
-3
0
12
111
112
127
INSERT INTO Z0CASE VALUES('12345678910.109876543210123456789');
ERROR 22003: Out of range value for column 'z0_test0' at row 1
INSERT INTO Z0CASE VALUES('1234567891.109876543210123456789');
Warnings:
Warning	1265	Data truncated for column 'z0_test0' at row 1
INSERT INTO Z0CASE VALUES(12345678910.109876543);
ERROR 22003: Out of range value for column 'z0_test0' at row 1
INSERT INTO Z0CASE VALUES(1234567890.109876543);
Warnings:
Warning	1265	Data truncated for column 'z0_test0' at row 1
SELECT * FROM Z0CASE ORDER BY Z0_TEST0;
z0_test0
-3
0
12
111
112
127
1234567890
1234567891
UPDATE Z0CASE SET Z0_TEST0='' WHERE Z0_TEST0=-3;
ERROR HY000: Incorrect decimal value for column 'z0_test0' at row 1
UPDATE Z0CASE SET Z0_TEST0=  WHERE Z0_TEST0=-3;
ERROR 42000: You have an error in your SQL syntax; check the manual that corresponds to your OceanBase version for the right syntax to use near 'Z0_TEST0=-3' at line 1
UPDATE Z0CASE SET Z0_TEST0='22'  WHERE Z0_TEST0=-3;
SELECT * FROM Z0CASE ORDER BY Z0_TEST0;
z0_test0
0
12
22
111
112
127
1234567890
1234567891
UPDATE Z0CASE SET Z0_TEST0='22222222222.365456'  WHERE Z0_TEST0=22;
ERROR 22003: Out of range value for column 'z0_test0' at row 1
UPDATE Z0CASE SET Z0_TEST0='2222222222.365456'  WHERE Z0_TEST0=22;
Warnings:
Warning	1265	Data truncated for column 'z0_test0' at row 1
SELECT * FROM Z0CASE ORDER BY Z0_TEST0;
z0_test0
0
12
111
112
127
1234567890
1234567891
2222222222
UPDATE Z0CASE SET Z0_TEST0=33 WHERE Z0_TEST0=2222222222;
SELECT * FROM Z0CASE ORDER BY Z0_TEST0;
z0_test0
0
12
33
111
112
127
1234567890
1234567891
UPDATE Z0CASE SET Z0_TEST0=11223344556.98766554433221100 WHERE Z0_TEST0=33;
ERROR 22003: Out of range value for column 'z0_test0' at row 1
UPDATE Z0CASE SET Z0_TEST0=1122334455.98766554433221100 WHERE Z0_TEST0=33;
Warnings:
Warning	1265	Data truncated for column 'z0_test0' at row 1
SELECT * FROM Z0CASE ORDER BY Z0_TEST0;
z0_test0
0
12
111
112
127
1122334456
1234567890
1234567891
DELETE FROM Z0CASE WHERE Z0_TEST0=1122334456;
SELECT * FROM Z0CASE ORDER BY Z0_TEST0;
z0_test0
0
12
111
112
127
1234567890
1234567891
DROP TABLE Z0CASE;
CREATE TABLE Z0CASE(Z0_TEST0 INT PRIMARY KEY) with column group (all columns, each column);
INSERT INTO  Z0CASE (z0_test0)VALUES(0);
INSERT INTO  Z0CASE (z0_test0)VALUES(111);
INSERT INTO  Z0CASE (z0_test0)VALUES(127);
INSERT INTO  Z0CASE (z0_test0)VALUES(-3.3333);
SELECT * FROM Z0CASE ORDER BY Z0_TEST0;
Z0_TEST0
-3
0
111
127
SELECT table_id,table_name FROM oceanbase.__all_virtual_table WHERE table_name='Z0CASE';
ALTER TABLE Z0CASE MODIFY column z0_test0 FLOAT(25) DEFAULT 0;
DESC z0case;
Field	Type	Null	Key	Default	Extra
z0_test0	double	NO	PRI	0	
SELECT * FROM Z0CASE ORDER BY Z0_TEST0;
z0_test0
-3
0
111
127
SELECT table_id,table_name FROM oceanbase.__all_virtual_table WHERE table_name='Z0CASE';
OTHER TYPE
DROP TABLE Z0CASE;
CREATE TABLE Z0CASE(Z0_TEST0 INT PRIMARY KEY) with column group (all columns, each column);
INSERT INTO  Z0CASE (z0_test0)VALUES(0);
INSERT INTO  Z0CASE (z0_test0)VALUES(20111111);
SELECT * FROM Z0CASE ORDER BY Z0_TEST0;
Z0_TEST0
0
20111111
SELECT table_id,table_name FROM oceanbase.__all_virtual_table WHERE table_name='Z0CASE';
ALTER TABLE Z0CASE MODIFY column z0_test0 DATE;
DESC z0case;
Field	Type	Null	Key	Default	Extra
z0_test0	date	NO	PRI	NULL	
SELECT * FROM Z0CASE ORDER BY Z0_TEST0;
z0_test0
0000-00-00
2011-11-11
SELECT table_id,table_name FROM oceanbase.__all_virtual_table WHERE table_name='Z0CASE';
DROP TABLE Z0CASE;
CREATE TABLE Z0CASE(Z0_TEST0 BIGINT PRIMARY KEY) with column group (all columns, each column);
INSERT INTO  Z0CASE (z0_test0)VALUES(0);
INSERT INTO  Z0CASE (z0_test0)VALUES(1111);
SELECT * FROM Z0CASE ORDER BY Z0_TEST0;
Z0_TEST0
0
1111
SELECT table_id,table_name FROM oceanbase.__all_virtual_table WHERE table_name='Z0CASE';
ALTER TABLE Z0CASE MODIFY column z0_test0 TIME  ;
DESC z0case;
Field	Type	Null	Key	Default	Extra
z0_test0	time	NO	PRI	NULL	
SELECT * FROM Z0CASE ORDER BY Z0_TEST0;
z0_test0
00:00:00
00:11:11
SELECT table_id,table_name FROM oceanbase.__all_virtual_table WHERE table_name='Z0CASE';
INSERT INTO Z0CASE VALUES(1234567);
ERROR 22007: Incorrect datetime value for column 'z0_test0' at row 1
INSERT INTO Z0CASE VALUES(1260);
ERROR 22007: Incorrect datetime value for column 'z0_test0' at row 1
INSERT INTO Z0CASE VALUES(60);
ERROR 22007: Incorrect datetime value for column 'z0_test0' at row 1
INSERT INTO Z0CASE VALUES(12);
INSERT INTO Z0CASE VALUES(1219);
INSERT INTO Z0CASE VALUES(123456);
INSERT INTO Z0CASE VALUES(20220102222426);
SELECT * FROM Z0CASE ORDER BY Z0_TEST0;
z0_test0
00:00:00
00:00:12
00:11:11
00:12:19
12:34:56
22:24:26
INSERT INTO Z0CASE VALUES(11:11:11);
ERROR 42000: You have an error in your SQL syntax; check the manual that corresponds to your OceanBase version for the right syntax to use near ':11:11)' at line 1
INSERT INTO Z0CASE VALUES('1960');
ERROR 22007: Incorrect datetime value for column 'z0_test0' at row 1
INSERT INTO Z0CASE VALUES('60');
ERROR 22007: Incorrect datetime value for column 'z0_test0' at row 1
INSERT INTO Z0CASE VALUES('20');
INSERT INTO Z0CASE VALUES('2021');
INSERT INTO Z0CASE VALUES('11:11:11');
INSERT INTO Z0CASE VALUES('12:12:12.5678');
INSERT INTO Z0CASE VALUES('2021-11-11 12:14:15.6789');
SELECT * FROM Z0CASE ORDER BY Z0_TEST0;
z0_test0
00:00:00
00:00:12
00:00:20
00:11:11
00:12:19
00:20:21
11:11:11
12:12:13
12:14:16
12:34:56
22:24:26
UPDATE Z0CASE SET Z0_TEST0='' WHERE Z0_TEST0=1970-01-01 00:00:00;
ERROR 42000: You have an error in your SQL syntax; check the manual that corresponds to your OceanBase version for the right syntax to use near '00:00:00' at line 1
UPDATE Z0CASE SET Z0_TEST0='' WHERE Z0_TEST0='1970-01-01 00:00:00';
ERROR 22007: Incorrect datetime value for column 'z0_test0' at row 1
UPDATE Z0CASE SET Z0_TEST0='60' WHERE Z0_TEST0='1970-01-01 00:00:00';
ERROR 22007: Incorrect datetime value for column 'z0_test0' at row 1
UPDATE Z0CASE SET Z0_TEST0=60 WHERE Z0_TEST0='1970-01-01 00:00:00';
ERROR 22007: Incorrect datetime value for column 'z0_test0' at row 1
UPDATE Z0CASE SET Z0_TEST0='1260' WHERE Z0_TEST0='1970-01-01 00:00:00';
ERROR 22007: Incorrect datetime value for column 'z0_test0' at row 1
UPDATE Z0CASE SET Z0_TEST0=1260 WHERE Z0_TEST0='1970-01-01 00:00:00';
ERROR 22007: Incorrect datetime value for column 'z0_test0' at row 1
UPDATE Z0CASE SET Z0_TEST0='125560' WHERE Z0_TEST0='1970-01-01 00:00:00';
ERROR 22007: Incorrect datetime value for column 'z0_test0' at row 1
UPDATE Z0CASE SET Z0_TEST0=125560 WHERE Z0_TEST0='1970-01-01 00:00:00';
ERROR 22007: Incorrect datetime value for column 'z0_test0' at row 1
UPDATE Z0CASE SET Z0_TEST0='1255589' WHERE Z0_TEST0='1970-01-01 00:00:00';
ERROR 22007: Incorrect datetime value for column 'z0_test0' at row 1
UPDATE Z0CASE SET Z0_TEST0=1255589 WHERE Z0_TEST0='1970-01-01 00:00:00';
ERROR 22007: Incorrect datetime value for column 'z0_test0' at row 1
UPDATE Z0CASE SET Z0_TEST0='44' WHERE Z0_TEST0='1970-01-01 00:00:00';
SELECT * FROM Z0CASE ORDER BY Z0_TEST0;
z0_test0
00:00:12
00:00:20
00:00:44
00:11:11
00:12:19
00:20:21
11:11:11
12:12:13
12:14:16
12:34:56
22:24:26
UPDATE Z0CASE SET Z0_TEST0='1224' WHERE Z0_TEST0='1970-01-01 00:00:44';
SELECT * FROM Z0CASE ORDER BY Z0_TEST0;
z0_test0
00:00:12
00:00:20
00:11:11
00:12:19
00:12:24
00:20:21
11:11:11
12:12:13
12:14:16
12:34:56
22:24:26
UPDATE Z0CASE SET Z0_TEST0='122425' WHERE Z0_TEST0='1970-01-01 00:12:24';
SELECT * FROM Z0CASE ORDER BY Z0_TEST0;
z0_test0
00:00:12
00:00:20
00:11:11
00:12:19
00:20:21
11:11:11
12:12:13
12:14:16
12:24:25
12:34:56
22:24:26
UPDATE Z0CASE SET Z0_TEST0=37 WHERE Z0_TEST0='1970-01-01 12:24:25';
SELECT * FROM Z0CASE ORDER BY Z0_TEST0;
z0_test0
00:00:12
00:00:20
00:00:37
00:11:11
00:12:19
00:20:21
11:11:11
12:12:13
12:14:16
12:34:56
22:24:26
UPDATE Z0CASE SET Z0_TEST0=3742 WHERE Z0_TEST0='1970-01-01 00:00:37';
SELECT * FROM Z0CASE ORDER BY Z0_TEST0;
z0_test0
00:00:12
00:00:20
00:11:11
00:12:19
00:20:21
00:37:42
11:11:11
12:12:13
12:14:16
12:34:56
22:24:26
UPDATE Z0CASE SET Z0_TEST0=123746 WHERE Z0_TEST0='1970-01-01 00:37:42';
SELECT * FROM Z0CASE ORDER BY Z0_TEST0;
z0_test0
00:00:12
00:00:20
00:11:11
00:12:19
00:20:21
11:11:11
12:12:13
12:14:16
12:34:56
12:37:46
22:24:26
DELETE FROM Z0CASE WHERE Z0_TEST0=123746;
SELECT * FROM Z0CASE ORDER BY Z0_TEST0;
z0_test0
00:00:12
00:00:20
00:11:11
00:12:19
00:20:21
11:11:11
12:12:13
12:14:16
12:34:56
22:24:26
DELETE FROM Z0CASE WHERE Z0_TEST0=1111;
SELECT * FROM Z0CASE ORDER BY Z0_TEST0;
z0_test0
00:00:12
00:00:20
00:12:19
00:20:21
11:11:11
12:12:13
12:14:16
12:34:56
22:24:26
DELETE FROM Z0CASE WHERE Z0_TEST0=12;
SELECT * FROM Z0CASE ORDER BY Z0_TEST0;
z0_test0
00:00:20
00:12:19
00:20:21
11:11:11
12:12:13
12:14:16
12:34:56
22:24:26
DELETE FROM Z0CASE WHERE Z0_TEST0='20';
SELECT * FROM Z0CASE ORDER BY Z0_TEST0;
z0_test0
00:12:19
00:20:21
11:11:11
12:12:13
12:14:16
12:34:56
22:24:26
DELETE FROM Z0CASE WHERE Z0_TEST0='1970-01-01 00:12:19';
SELECT * FROM Z0CASE ORDER BY Z0_TEST0;
z0_test0
00:20:21
11:11:11
12:12:13
12:14:16
12:34:56
22:24:26
DROP TABLE Z0CASE;
CREATE TABLE Z0CASE(Z0_TEST0 BIGINT PRIMARY KEY) with column group (all columns, each column);
INSERT INTO  Z0CASE (z0_test0)VALUES(0);
INSERT INTO  Z0CASE (z0_test0)VALUES(2011);
SELECT * FROM Z0CASE ORDER BY Z0_TEST0;
Z0_TEST0
0
2011
SELECT table_id,table_name FROM oceanbase.__all_virtual_table WHERE table_name='Z0CASE';
ALTER TABLE Z0CASE MODIFY column z0_test0 year;
DESC z0case;
Field	Type	Null	Key	Default	Extra
z0_test0	year(4)	NO	PRI	NULL	
SELECT * FROM Z0CASE ORDER BY Z0_TEST0;
z0_test0
0000
2011
SELECT table_id,table_name FROM oceanbase.__all_virtual_table WHERE table_name='Z0CASE';
INSERT INTO Z0CASE VALUES(3000);
ERROR 22003: Out of range value for column 'z0_test0' at row 1
INSERT INTO Z0CASE VALUES('3000');
ERROR 22003: Out of range value for column 'z0_test0' at row 1
INSERT INTO Z0CASE VALUES('1500');
ERROR 22003: Out of range value for column 'z0_test0' at row 1
INSERT INTO Z0CASE VALUES('151');
ERROR 22003: Out of range value for column 'z0_test0' at row 1
INSERT INTO Z0CASE VALUES(151);
ERROR 22003: Out of range value for column 'z0_test0' at row 1
INSERT INTO Z0CASE VALUES('2018-12-11');
ERROR 01000: Data truncated for column 'z0_test0' at row 1
INSERT INTO Z0CASE VALUES('2018-12-11 12:11:11');
ERROR 01000: Data truncated for column 'z0_test0' at row 1
INSERT INTO Z0CASE VALUES('二零零二');
ERROR HY000: Incorrect integer value for column 'z0_test0' at row 1
SELECT * FROM Z0CASE ORDER BY Z0_TEST0;
z0_test0
0000
2011
DELETE FROM Z0CASE WHERE Z0_TEST0='2000';
INSERT INTO Z0CASE VALUES('');
ERROR HY000: Incorrect integer value for column 'z0_test0' at row 1
SELECT * FROM Z0CASE ORDER BY Z0_TEST0;
z0_test0
0000
2011
INSERT INTO Z0CASE VALUES('15');
SELECT * FROM Z0CASE ORDER BY Z0_TEST0;
z0_test0
0000
2011
2015
INSERT INTO Z0CASE VALUES(16);
SELECT * FROM Z0CASE ORDER BY Z0_TEST0;
z0_test0
0000
2011
2015
2016
DELETE FROM Z0CASE WHERE Z0_TEST0='2000';
UPDATE Z0CASE SET Z0_TEST0='121' WHERE Z0_TEST0=2015;
ERROR 22003: Out of range value for column 'z0_test0' at row 1
UPDATE Z0CASE SET Z0_TEST0='20222' WHERE Z0_TEST0=2015;
ERROR 22003: Out of range value for column 'z0_test0' at row 1
UPDATE Z0CASE SET Z0_TEST0='二零零二' WHERE Z0_TEST0=2015;
SELECT * FROM Z0CASE ORDER BY Z0_TEST0;
z0_test0
0000
2000
2011
2016
DELETE FROM Z0CASE WHERE Z0_TEST0='2000';
UPDATE Z0CASE SET Z0_TEST0='' WHERE Z0_TEST0=2016;
SELECT * FROM Z0CASE ORDER BY Z0_TEST0;
z0_test0
0000
2000
2011
UPDATE Z0CASE SET Z0_TEST0='19' WHERE Z0_TEST0=2000;
SELECT * FROM Z0CASE ORDER BY Z0_TEST0;
z0_test0
0000
2011
2019
UPDATE Z0CASE SET Z0_TEST0=18 WHERE Z0_TEST0=19;
SELECT * FROM Z0CASE ORDER BY Z0_TEST0;
z0_test0
0000
2011
2018
DELETE FROM Z0CASE WHERE Z0_TEST0='2019';
SELECT * FROM Z0CASE ORDER BY Z0_TEST0;
z0_test0
0000
2011
2018
DELETE FROM Z0CASE WHERE Z0_TEST0='15';
SELECT * FROM Z0CASE ORDER BY Z0_TEST0;
z0_test0
0000
2011
2018
DELETE FROM Z0CASE WHERE Z0_TEST0=2016;
SELECT * FROM Z0CASE ORDER BY Z0_TEST0;
z0_test0
0000
2011
2018
DROP TABLE Z0CASE;
CREATE TABLE Z0CASE(Z0_TEST0 INT PRIMARY KEY) with column group (all columns, each column);
INSERT INTO  Z0CASE (z0_test0)VALUES(0);
INSERT INTO  Z0CASE (z0_test0)VALUES(20111111);
SELECT * FROM Z0CASE ORDER BY Z0_TEST0;
Z0_TEST0
0
20111111
SELECT table_id,table_name FROM oceanbase.__all_virtual_table WHERE table_name='Z0CASE';
ALTER TABLE Z0CASE MODIFY column z0_test0 DATEtime;
DESC z0case;
Field	Type	Null	Key	Default	Extra
z0_test0	datetime	NO	PRI	NULL	
SELECT * FROM Z0CASE ORDER BY Z0_TEST0;
z0_test0
0000-00-00 00:00:00
2011-11-11 00:00:00
SELECT table_id,table_name FROM oceanbase.__all_virtual_table WHERE table_name='Z0CASE';
DROP TABLE Z0CASE;
CREATE TABLE Z0CASE(Z0_TEST0 BIGINT PRIMARY KEY) with column group (all columns, each column);
INSERT INTO  Z0CASE (z0_test0)VALUES(0);
INSERT INTO  Z0CASE (z0_test0)VALUES(1111);
INSERT INTO  Z0CASE (z0_test0)VALUES(20111111);
SELECT * FROM Z0CASE ORDER BY Z0_TEST0;
Z0_TEST0
0
1111
20111111
SELECT table_id,table_name FROM oceanbase.__all_virtual_table WHERE table_name='Z0CASE';
ALTER TABLE Z0CASE MODIFY column z0_test0 TIMEstamp;
DESC z0case;
Field	Type	Null	Key	Default	Extra
z0_test0	timestamp	NO	PRI	NULL	
SELECT * FROM Z0CASE ORDER BY Z0_TEST0;
z0_test0
0000-00-00 00:00:00
2000-11-11 00:00:00
2011-11-11 00:00:00
SELECT table_id,table_name FROM oceanbase.__all_virtual_table WHERE table_name='Z0CASE';
DROP TABLE Z0CASE;
CREATE TABLE Z0CASE(Z0_TEST0 INT PRIMARY KEY) with column group (all columns, each column);
INSERT INTO  Z0CASE (z0_test0)VALUES(0);
INSERT INTO  Z0CASE (z0_test0)VALUES(20111111);
SELECT * FROM Z0CASE ORDER BY Z0_TEST0;
Z0_TEST0
0
20111111
SELECT table_id,table_name FROM oceanbase.__all_virtual_table WHERE table_name='Z0CASE';
ALTER TABLE Z0CASE MODIFY column z0_test0 CHAR(100);
DESC z0case;
Field	Type	Null	Key	Default	Extra
z0_test0	char(100)	NO	PRI	NULL	
SELECT * FROM Z0CASE ORDER BY Z0_TEST0;
z0_test0
0
20111111
SELECT table_id,table_name FROM oceanbase.__all_virtual_table WHERE table_name='Z0CASE';
DROP TABLE Z0CASE;
CREATE TABLE Z0CASE(Z0_TEST0 INT PRIMARY KEY) with column group (all columns, each column);
INSERT INTO  Z0CASE (z0_test0)VALUES(0);
INSERT INTO  Z0CASE (z0_test0)VALUES(20111111);
ALTER TABLE Z0CASE MODIFY column z0_test0 tinytext;
ERROR 42000: The used storage engine can't index column 'z0_test0'
DROP TABLE Z0CASE;
CREATE TABLE Z0CASE(Z0_TEST0 INT PRIMARY KEY) with column group (all columns, each column);
INSERT INTO  Z0CASE (z0_test0)VALUES(0);
INSERT INTO  Z0CASE (z0_test0)VALUES(11);
SELECT * FROM Z0CASE ORDER BY Z0_TEST0;
Z0_TEST0
0
11
SELECT table_id,table_name FROM oceanbase.__all_virtual_table WHERE table_name='Z0CASE';
ALTER TABLE Z0CASE MODIFY column z0_test0 ENUM('0','11');
ERROR 01000: Data truncated for argument
FLOAT/double/DECIMAL
DROP TABLE Z0CASE;
CREATE TABLE Z0CASE(Z0_TEST0 FLOAT(30,5) PRIMARY KEY) with column group (all columns, each column);
INSERT INTO  Z0CASE (z0_test0)VALUES(0);
INSERT INTO  Z0CASE (z0_test0)VALUES(20111111.111);
SELECT * FROM Z0CASE ORDER BY Z0_TEST0;
Z0_TEST0
0.00000
20111112.00000
SELECT table_id,table_name FROM oceanbase.__all_virtual_table WHERE table_name='Z0CASE';
ALTER TABLE Z0CASE MODIFY column Z0_TEST0 FLOAT (24);
DESC z0case;
Field	Type	Null	Key	Default	Extra
Z0_TEST0	float	NO	PRI	NULL	
SELECT * FROM Z0CASE ORDER BY Z0_TEST0;
Z0_TEST0
0
20111100
SELECT table_id,table_name FROM oceanbase.__all_virtual_table WHERE table_name='Z0CASE';
DROP TABLE Z0CASE;
CREATE TABLE Z0CASE(Z0_TEST0 FLOAT(30,5) PRIMARY KEY) with column group (all columns, each column);
INSERT INTO  Z0CASE (z0_test0)VALUES(0);
INSERT INTO  Z0CASE (z0_test0)VALUES(20111111.111);
SELECT * FROM Z0CASE ORDER BY Z0_TEST0;
Z0_TEST0
0.00000
20111112.00000
SELECT table_id,table_name FROM oceanbase.__all_virtual_table WHERE table_name='Z0CASE';
ALTER TABLE Z0CASE MODIFY column Z0_TEST0 FLOAT (25);
DESC z0case;
Field	Type	Null	Key	Default	Extra
Z0_TEST0	double	NO	PRI	NULL	
SELECT * FROM Z0CASE ORDER BY Z0_TEST0;
Z0_TEST0
0
20111112
SELECT table_id,table_name FROM oceanbase.__all_virtual_table WHERE table_name='Z0CASE';
DROP TABLE Z0CASE;
CREATE TABLE Z0CASE(Z0_TEST0 FLOAT(30,5) PRIMARY KEY) with column group (all columns, each column);
INSERT INTO  Z0CASE (z0_test0)VALUES(0);
INSERT INTO  Z0CASE (z0_test0)VALUES(20111111.111);
SELECT * FROM Z0CASE ORDER BY Z0_TEST0;
Z0_TEST0
0.00000
20111112.00000
SELECT table_id,table_name FROM oceanbase.__all_virtual_table WHERE table_name='Z0CASE';
ALTER TABLE Z0CASE MODIFY column Z0_TEST0 FLOAT (25,2);
DESC z0case;
Field	Type	Null	Key	Default	Extra
Z0_TEST0	float(25,2)	NO	PRI	NULL	
SELECT * FROM Z0CASE ORDER BY Z0_TEST0;
Z0_TEST0
0.00
20111112.00
SELECT table_id,table_name FROM oceanbase.__all_virtual_table WHERE table_name='Z0CASE';
DROP TABLE Z0CASE;
CREATE TABLE Z0CASE(Z0_TEST0 FLOAT(30,5) PRIMARY KEY) with column group (all columns, each column);
INSERT INTO  Z0CASE (z0_test0)VALUES(0);
INSERT INTO  Z0CASE (z0_test0)VALUES(20111111.111);
SELECT * FROM Z0CASE ORDER BY Z0_TEST0;
Z0_TEST0
0.00000
20111112.00000
SELECT table_id,table_name FROM oceanbase.__all_virtual_table WHERE table_name='Z0CASE';
ALTER TABLE Z0CASE MODIFY column Z0_TEST0 INT;
DESC z0case;
Field	Type	Null	Key	Default	Extra
Z0_TEST0	int(11)	NO	PRI	NULL	
SELECT * FROM Z0CASE ORDER BY Z0_TEST0;
Z0_TEST0
0
20111112
SELECT table_id,table_name FROM oceanbase.__all_virtual_table WHERE table_name='Z0CASE';
DROP TABLE Z0CASE;
CREATE TABLE Z0CASE(Z0_TEST0 FLOAT(30,5) PRIMARY KEY) with column group (all columns, each column);
INSERT INTO  Z0CASE (z0_test0)VALUES(0);
INSERT INTO  Z0CASE (z0_test0)VALUES(20111111.111);
ALTER TABLE Z0CASE MODIFY column Z0_TEST0 BLOB;
ERROR 42000: The used storage engine can't index column 'Z0_TEST0'
DOUBLE
DROP TABLE Z0CASE;
CREATE TABLE Z0CASE(Z0_TEST0 DOUBLE(30,5) PRIMARY KEY) with column group (all columns, each column);
INSERT INTO  Z0CASE (z0_test0)VALUES(0);
INSERT INTO  Z0CASE (z0_test0)VALUES(20111111.111);
SELECT * FROM Z0CASE ORDER BY Z0_TEST0;
Z0_TEST0
0.00000
20111111.11100
SELECT table_id,table_name FROM oceanbase.__all_virtual_table WHERE table_name='Z0CASE';
ALTER TABLE Z0CASE MODIFY column Z0_TEST0 DOUBLE(29,0);
DESC z0case;
Field	Type	Null	Key	Default	Extra
Z0_TEST0	double(29,0)	NO	PRI	NULL	
SELECT * FROM Z0CASE ORDER BY Z0_TEST0;
Z0_TEST0
0
20111111
SELECT table_id,table_name FROM oceanbase.__all_virtual_table WHERE table_name='Z0CASE';
DROP TABLE Z0CASE;
CREATE TABLE Z0CASE(Z0_TEST0 DOUBLE(30,5) PRIMARY KEY) with column group (all columns, each column);
INSERT INTO  Z0CASE (z0_test0)VALUES(0);
INSERT INTO  Z0CASE (z0_test0)VALUES(20111111.111);
SELECT * FROM Z0CASE ORDER BY Z0_TEST0;
Z0_TEST0
0.00000
20111111.11100
SELECT table_id,table_name FROM oceanbase.__all_virtual_table WHERE table_name='Z0CASE';
ALTER TABLE Z0CASE MODIFY column Z0_TEST0 DOUBLE(29,3);
DESC z0case;
Field	Type	Null	Key	Default	Extra
Z0_TEST0	double(29,3)	NO	PRI	NULL	
SELECT * FROM Z0CASE ORDER BY Z0_TEST0;
Z0_TEST0
0.000
20111111.111
SELECT table_id,table_name FROM oceanbase.__all_virtual_table WHERE table_name='Z0CASE';
DROP TABLE Z0CASE;
CREATE TABLE Z0CASE(Z0_TEST0 DOUBLE(30,5) PRIMARY KEY) with column group (all columns, each column);
INSERT INTO  Z0CASE (z0_test0)VALUES(0);
INSERT INTO  Z0CASE (z0_test0)VALUES(20111111.111);
SELECT * FROM Z0CASE ORDER BY Z0_TEST0;
Z0_TEST0
0.00000
20111111.11100
SELECT table_id,table_name FROM oceanbase.__all_virtual_table WHERE table_name='Z0CASE';
ALTER TABLE Z0CASE MODIFY column Z0_TEST0 INT;
DESC z0case;
Field	Type	Null	Key	Default	Extra
Z0_TEST0	int(11)	NO	PRI	NULL	
SELECT * FROM Z0CASE ORDER BY Z0_TEST0;
Z0_TEST0
0
20111111
SELECT table_id,table_name FROM oceanbase.__all_virtual_table WHERE table_name='Z0CASE';
DROP TABLE Z0CASE;
CREATE TABLE Z0CASE(Z0_TEST0 DOUBLE(30,5) PRIMARY KEY) with column group (all columns, each column);
INSERT INTO  Z0CASE (z0_test0)VALUES(0);
INSERT INTO  Z0CASE (z0_test0)VALUES(20111111.111);
SELECT * FROM Z0CASE ORDER BY Z0_TEST0;
Z0_TEST0
0.00000
20111111.11100
SELECT table_id,table_name FROM oceanbase.__all_virtual_table WHERE table_name='Z0CASE';
ALTER TABLE Z0CASE MODIFY column Z0_TEST0 FLOAT(30,5);
DESC z0case;
Field	Type	Null	Key	Default	Extra
Z0_TEST0	float(30,5)	NO	PRI	NULL	
SELECT * FROM Z0CASE ORDER BY Z0_TEST0;
Z0_TEST0
0.00000
20111112.00000
SELECT table_id,table_name FROM oceanbase.__all_virtual_table WHERE table_name='Z0CASE';
DROP TABLE Z0CASE;
CREATE TABLE Z0CASE(Z0_TEST0 DOUBLE(30,5) PRIMARY KEY) with column group (all columns, each column);
INSERT INTO  Z0CASE (z0_test0)VALUES(0);
INSERT INTO  Z0CASE (z0_test0)VALUES(20111111.111);
SELECT * FROM Z0CASE ORDER BY Z0_TEST0;
Z0_TEST0
0.00000
20111111.11100
SELECT table_id,table_name FROM oceanbase.__all_virtual_table WHERE table_name='Z0CASE';
ALTER TABLE Z0CASE MODIFY column Z0_TEST0 DECIMAL(30,5);
DESC z0case;
Field	Type	Null	Key	Default	Extra
Z0_TEST0	decimal(30,5)	NO	PRI	NULL	
SELECT * FROM Z0CASE ORDER BY Z0_TEST0;
Z0_TEST0
0.00000
20111111.11100
SELECT table_id,table_name FROM oceanbase.__all_virtual_table WHERE table_name='Z0CASE';
DECIMAL
DROP TABLE Z0CASE;
CREATE TABLE Z0CASE(Z0_TEST0 DECIMAL(30,5) PRIMARY KEY) with column group (all columns, each column);
INSERT INTO  Z0CASE (z0_test0)VALUES(0);
INSERT INTO  Z0CASE (z0_test0)VALUES(20111111.111);
SELECT * FROM Z0CASE ORDER BY Z0_TEST0;
Z0_TEST0
0.00000
20111111.11100
SELECT table_id,table_name FROM oceanbase.__all_virtual_table WHERE table_name='Z0CASE';
ALTER TABLE Z0CASE MODIFY column Z0_TEST0 DECIMAL(30,5);
DESC z0case;
Field	Type	Null	Key	Default	Extra
Z0_TEST0	decimal(30,5)	NO	PRI	NULL	
SELECT * FROM Z0CASE ORDER BY Z0_TEST0;
Z0_TEST0
0.00000
20111111.11100
SELECT table_id,table_name FROM oceanbase.__all_virtual_table WHERE table_name='Z0CASE';
ALTER TABLE Z0CASE MODIFY column Z0_TEST0 DECIMAL(31,5);
DESC z0case;
Field	Type	Null	Key	Default	Extra
Z0_TEST0	decimal(31,5)	NO	PRI	NULL	
SELECT * FROM Z0CASE ORDER BY Z0_TEST0;
Z0_TEST0
0.00000
20111111.11100
SELECT table_id,table_name FROM oceanbase.__all_virtual_table WHERE table_name='Z0CASE';
ALTER TABLE Z0CASE MODIFY column Z0_TEST0 DECIMAL(29,3);
DESC z0case;
Field	Type	Null	Key	Default	Extra
Z0_TEST0	decimal(29,3)	NO	PRI	NULL	
SELECT * FROM Z0CASE ORDER BY Z0_TEST0;
Z0_TEST0
0.000
20111111.111
SELECT table_id,table_name FROM oceanbase.__all_virtual_table WHERE table_name='Z0CASE';
ALTER TABLE Z0CASE MODIFY column Z0_TEST0 INT;
DESC z0case;
Field	Type	Null	Key	Default	Extra
Z0_TEST0	int(11)	NO	PRI	NULL	
SELECT * FROM Z0CASE ORDER BY Z0_TEST0;
Z0_TEST0
0
20111111
SELECT table_id,table_name FROM oceanbase.__all_virtual_table WHERE table_name='Z0CASE';
DROP TABLE Z0CASE;
CREATE TABLE Z0CASE(Z0_TEST0 DECIMAL(30,5) PRIMARY KEY) with column group (all columns, each column);
INSERT INTO  Z0CASE (z0_test0)VALUES(0);
INSERT INTO  Z0CASE (z0_test0)VALUES(20111111.111);
SELECT * FROM Z0CASE ORDER BY Z0_TEST0;
Z0_TEST0
0.00000
20111111.11100
SELECT table_id,table_name FROM oceanbase.__all_virtual_table WHERE table_name='Z0CASE';
ALTER TABLE Z0CASE MODIFY column Z0_TEST0 FLOAT(30,5);
DESC z0case;
Field	Type	Null	Key	Default	Extra
Z0_TEST0	float(30,5)	NO	PRI	NULL	
SELECT * FROM Z0CASE ORDER BY Z0_TEST0;
Z0_TEST0
0.00000
20111112.00000
SELECT table_id,table_name FROM oceanbase.__all_virtual_table WHERE table_name='Z0CASE';
DROP TABLE Z0CASE;
CREATE TABLE Z0CASE(Z0_TEST0 DECIMAL(30,5) PRIMARY KEY) with column group (all columns, each column);
INSERT INTO  Z0CASE (z0_test0)VALUES(0);
INSERT INTO  Z0CASE (z0_test0)VALUES(20111111.111);
SELECT * FROM Z0CASE ORDER BY Z0_TEST0;
Z0_TEST0
0.00000
20111111.11100
SELECT table_id,table_name FROM oceanbase.__all_virtual_table WHERE table_name='Z0CASE';
ALTER TABLE Z0CASE MODIFY column Z0_TEST0 DOUBLE(30,5);
DESC z0case;
Field	Type	Null	Key	Default	Extra
Z0_TEST0	double(30,5)	NO	PRI	NULL	
SELECT * FROM Z0CASE ORDER BY Z0_TEST0;
Z0_TEST0
0.00000
20111111.11100
SELECT table_id,table_name FROM oceanbase.__all_virtual_table WHERE table_name='Z0CASE';
date/time/year
DROP TABLE Z0CASE;
CREATE TABLE Z0CASE(Z0_TEST0 DATE PRIMARY KEY, Z0_TEST1 TIME ,Z0_TEST2 YEAR) with column group (all columns, each column);
INSERT INTO  Z0CASE (Z0_TEST0,Z0_TEST1,Z0_TEST2)VALUES('2011-11-11 11:11:11',' 11:11:11','2011');
INSERT INTO  Z0CASE (Z0_TEST0,Z0_TEST1,Z0_TEST2)VALUES(0,0,0);
SELECT * FROM Z0CASE ORDER BY Z0_TEST0;
Z0_TEST0	Z0_TEST1	Z0_TEST2
0000-00-00	00:00:00	0000
2011-11-11	11:11:11	2011
SELECT table_id,table_name FROM oceanbase.__all_virtual_table WHERE table_name='Z0CASE';
ALTER TABLE Z0CASE MODIFY column Z0_TEST0 DATE;
DESC z0case;
Field	Type	Null	Key	Default	Extra
Z0_TEST0	date	NO	PRI	NULL	
Z0_TEST1	time	YES		NULL	
Z0_TEST2	year(4)	YES		NULL	
SELECT * FROM Z0CASE ORDER BY Z0_TEST0;
Z0_TEST0	Z0_TEST1	Z0_TEST2
0000-00-00	00:00:00	0000
2011-11-11	11:11:11	2011
SELECT table_id,table_name FROM oceanbase.__all_virtual_table WHERE table_name='Z0CASE';
ALTER TABLE Z0CASE MODIFY column Z0_TEST0 TIME;
ERROR 23000: Duplicated primary key
ALTER TABLE Z0CASE MODIFY column Z0_TEST0 YEAR;
DESC z0case;
Field	Type	Null	Key	Default	Extra
Z0_TEST0	year(4)	NO	PRI	NULL	
Z0_TEST1	time	YES		NULL	
Z0_TEST2	year(4)	YES		NULL	
SELECT * FROM Z0CASE ORDER BY Z0_TEST0;
Z0_TEST0	Z0_TEST1	Z0_TEST2
0000	00:00:00	0000
2011	11:11:11	2011
SELECT table_id,table_name FROM oceanbase.__all_virtual_table WHERE table_name='Z0CASE';
DROP TABLE Z0CASE;
CREATE TABLE Z0CASE(Z0_TEST0 DATE , Z0_TEST1 TIME PRIMARY KEY,Z0_TEST2 YEAR) with column group (all columns, each column);
INSERT INTO  Z0CASE (Z0_TEST0,Z0_TEST1,Z0_TEST2)VALUES('2011-11-11 11:11:11',' 11:11:11','2011');
INSERT INTO  Z0CASE (Z0_TEST0,Z0_TEST1,Z0_TEST2)VALUES(0,0,0);
SELECT * FROM Z0CASE ORDER BY Z0_TEST0;
Z0_TEST0	Z0_TEST1	Z0_TEST2
0000-00-00	00:00:00	0000
2011-11-11	11:11:11	2011
SELECT table_id,table_name FROM oceanbase.__all_virtual_table WHERE table_name='Z0CASE';
ALTER TABLE Z0CASE MODIFY column Z0_TEST1 DATE;
ERROR 23000: Duplicated primary key
ALTER TABLE Z0CASE MODIFY column Z0_TEST1 TIME;
DESC z0case;
Field	Type	Null	Key	Default	Extra
Z0_TEST0	date	YES		NULL	
Z0_TEST1	time	NO	PRI	NULL	
Z0_TEST2	year(4)	YES		NULL	
SELECT * FROM Z0CASE ORDER BY Z0_TEST0;
Z0_TEST0	Z0_TEST1	Z0_TEST2
0000-00-00	00:00:00	0000
2011-11-11	11:11:11	2011
SELECT table_id,table_name FROM oceanbase.__all_virtual_table WHERE table_name='Z0CASE';
DROP TABLE Z0CASE;
CREATE TABLE Z0CASE(Z0_TEST0 DATE , Z0_TEST1 TIME PRIMARY KEY,Z0_TEST2 YEAR) with column group (all columns, each column);
INSERT INTO  Z0CASE (Z0_TEST0,Z0_TEST1,Z0_TEST2)VALUES('2011-11-11 11:11:11',' 11:11:11','2011');
INSERT INTO  Z0CASE (Z0_TEST0,Z0_TEST1,Z0_TEST2)VALUES(0,0,0);
ALTER TABLE Z0CASE MODIFY column Z0_TEST1 YEAR;
ERROR 22003: Out of range value for column
DROP TABLE Z0CASE;
CREATE TABLE Z0CASE(Z0_TEST0 DATE , Z0_TEST1 TIME ,Z0_TEST2 year PRIMARY KEY) with column group (all columns, each column);
INSERT INTO  Z0CASE (Z0_TEST0,Z0_TEST1,Z0_TEST2)VALUES('2011-11-11 11:11:11',' 11:11:11','2011');
INSERT INTO  Z0CASE (Z0_TEST0,Z0_TEST1,Z0_TEST2)VALUES(0,0,0);
ALTER TABLE Z0CASE MODIFY column Z0_TEST2 DATE;
ERROR 22007: Incorrect value
ALTER TABLE Z0CASE MODIFY column Z0_TEST2 TIME;
DROP TABLE Z0CASE;
CREATE TABLE Z0CASE(Z0_TEST0 DATE , Z0_TEST1 TIME,Z0_TEST2 YEAR PRIMARY KEY) with column group (all columns, each column);
INSERT INTO  Z0CASE (Z0_TEST0,Z0_TEST1,Z0_TEST2)VALUES('2011-11-11 11:11:11',' 11:11:11','2011');
INSERT INTO  Z0CASE (Z0_TEST0,Z0_TEST1,Z0_TEST2)VALUES(0,0,0);
SELECT * FROM Z0CASE ORDER BY Z0_TEST0;
Z0_TEST0	Z0_TEST1	Z0_TEST2
0000-00-00	00:00:00	0000
2011-11-11	11:11:11	2011
SELECT table_id,table_name FROM oceanbase.__all_virtual_table WHERE table_name='Z0CASE';
ALTER TABLE Z0CASE MODIFY column Z0_TEST2 YEAR;
DESC z0case;
Field	Type	Null	Key	Default	Extra
Z0_TEST0	date	YES		NULL	
Z0_TEST1	time	YES		NULL	
Z0_TEST2	year(4)	NO	PRI	NULL	
SELECT * FROM Z0CASE ORDER BY Z0_TEST0;
Z0_TEST0	Z0_TEST1	Z0_TEST2
0000-00-00	00:00:00	0000
2011-11-11	11:11:11	2011
SELECT table_id,table_name FROM oceanbase.__all_virtual_table WHERE table_name='Z0CASE';
DROP TABLE Z0CASE;
CREATE TABLE Z0CASE(Z0_TEST0 DATE PRIMARY KEY, Z0_TEST1 TIME ,Z0_TEST2 YEAR) with column group (all columns, each column);
INSERT INTO  Z0CASE (Z0_TEST0,Z0_TEST1,Z0_TEST2)VALUES('2011-11-11 11:11:11',' 11:11:11','2011');
INSERT INTO  Z0CASE (Z0_TEST0,Z0_TEST1,Z0_TEST2)VALUES(0,0,0);
SELECT * FROM Z0CASE ORDER BY Z0_TEST0;
Z0_TEST0	Z0_TEST1	Z0_TEST2
0000-00-00	00:00:00	0000
2011-11-11	11:11:11	2011
SELECT table_id,table_name FROM oceanbase.__all_virtual_table WHERE table_name='Z0CASE';
ALTER TABLE Z0CASE MODIFY column Z0_TEST0 DATETIME;
DESC z0case;
Field	Type	Null	Key	Default	Extra
Z0_TEST0	datetime	NO	PRI	NULL	
Z0_TEST1	time	YES		NULL	
Z0_TEST2	year(4)	YES		NULL	
SELECT * FROM Z0CASE ORDER BY Z0_TEST0;
Z0_TEST0	Z0_TEST1	Z0_TEST2
0000-00-00 00:00:00	00:00:00	0000
2011-11-11 00:00:00	11:11:11	2011
SELECT table_id,table_name FROM oceanbase.__all_virtual_table WHERE table_name='Z0CASE';
DROP TABLE Z0CASE;
CREATE TABLE Z0CASE(Z0_TEST0 DATE PRIMARY KEY, Z0_TEST1 TIME ,Z0_TEST2 YEAR) with column group (all columns, each column);
INSERT INTO  Z0CASE (Z0_TEST0,Z0_TEST1,Z0_TEST2)VALUES('2011-11-11 11:11:11',' 11:11:11','2011');
INSERT INTO  Z0CASE (Z0_TEST0,Z0_TEST1,Z0_TEST2)VALUES(0,0,0);
SELECT * FROM Z0CASE ORDER BY Z0_TEST0;
Z0_TEST0	Z0_TEST1	Z0_TEST2
0000-00-00	00:00:00	0000
2011-11-11	11:11:11	2011
SELECT table_id,table_name FROM oceanbase.__all_virtual_table WHERE table_name='Z0CASE';
ALTER TABLE Z0CASE MODIFY column Z0_TEST0 timestamp;
DESC z0case;
Field	Type	Null	Key	Default	Extra
Z0_TEST0	timestamp	NO	PRI	NULL	
Z0_TEST1	time	YES		NULL	
Z0_TEST2	year(4)	YES		NULL	
SELECT * FROM Z0CASE ORDER BY Z0_TEST0;
Z0_TEST0	Z0_TEST1	Z0_TEST2
0000-00-00 00:00:00	00:00:00	0000
2011-11-11 00:00:00	11:11:11	2011
SELECT table_id,table_name FROM oceanbase.__all_virtual_table WHERE table_name='Z0CASE';
其他字符类型
DROP TABLE Z0CASE;
CREATE TABLE Z0CASE(Z0_TEST0 DATE PRIMARY KEY, Z0_TEST1 TIME ,Z0_TEST2 YEAR) with column group (all columns, each column);
INSERT INTO  Z0CASE (Z0_TEST0,Z0_TEST1,Z0_TEST2)VALUES('2011-11-11 11:11:11',' 11:11:11','2011');
INSERT INTO  Z0CASE (Z0_TEST0,Z0_TEST1,Z0_TEST2)VALUES(0,0,0);
SELECT * FROM Z0CASE ORDER BY Z0_TEST0;
Z0_TEST0	Z0_TEST1	Z0_TEST2
0000-00-00	00:00:00	0000
2011-11-11	11:11:11	2011
SELECT table_id,table_name FROM oceanbase.__all_virtual_table WHERE table_name='Z0CASE';
ALTER TABLE Z0CASE MODIFY column Z0_TEST0 CHAR(100);
DESC z0case;
Field	Type	Null	Key	Default	Extra
Z0_TEST0	char(100)	NO	PRI	NULL	
Z0_TEST1	time	YES		NULL	
Z0_TEST2	year(4)	YES		NULL	
SELECT * FROM Z0CASE ORDER BY Z0_TEST0;
Z0_TEST0	Z0_TEST1	Z0_TEST2
0000-00-00	00:00:00	0000
2011-11-11	11:11:11	2011
SELECT table_id,table_name FROM oceanbase.__all_virtual_table WHERE table_name='Z0CASE';
DROP TABLE Z0CASE;
CREATE TABLE Z0CASE(Z0_TEST0 DATE PRIMARY KEY, Z0_TEST1 TIME ,Z0_TEST2 YEAR) with column group (all columns, each column);
INSERT INTO  Z0CASE (Z0_TEST0,Z0_TEST1,Z0_TEST2)VALUES('2011-11-11 11:11:11',' 11:11:11','2011');
INSERT INTO  Z0CASE (Z0_TEST0,Z0_TEST1,Z0_TEST2)VALUES(0,0,0);
SELECT * FROM Z0CASE ORDER BY Z0_TEST0;
Z0_TEST0	Z0_TEST1	Z0_TEST2
0000-00-00	00:00:00	0000
2011-11-11	11:11:11	2011
SELECT table_id,table_name FROM oceanbase.__all_virtual_table WHERE table_name='Z0CASE';
ALTER TABLE Z0CASE MODIFY column Z0_TEST0 SET('2011-11-11 11:11:11','0');
ERROR 01000: Data truncated for argument
ALTER TABLE Z0CASE MODIFY column Z0_TEST0 INT;
DESC z0case;
Field	Type	Null	Key	Default	Extra
Z0_TEST0	int(11)	NO	PRI	NULL	
Z0_TEST1	time	YES		NULL	
Z0_TEST2	year(4)	YES		NULL	
SELECT * FROM Z0CASE ORDER BY Z0_TEST0*1;
Z0_TEST0	Z0_TEST1	Z0_TEST2
0	00:00:00	0000
20111111	11:11:11	2011
SELECT table_id,table_name FROM oceanbase.__all_virtual_table WHERE table_name='Z0CASE';
DROP TABLE Z0CASE;
CREATE TABLE Z0CASE(Z0_TEST0 DATE PRIMARY KEY, Z0_TEST1 TIME ,Z0_TEST2 YEAR) with column group (all columns, each column);
INSERT INTO  Z0CASE (Z0_TEST0,Z0_TEST1,Z0_TEST2)VALUES('2011-11-11 11:11:11',' 11:11:11','2011');
INSERT INTO  Z0CASE (Z0_TEST0,Z0_TEST1,Z0_TEST2)VALUES(0,0,0);
SELECT * FROM Z0CASE ORDER BY Z0_TEST0;
Z0_TEST0	Z0_TEST1	Z0_TEST2
0000-00-00	00:00:00	0000
2011-11-11	11:11:11	2011
SELECT table_id,table_name FROM oceanbase.__all_virtual_table WHERE table_name='Z0CASE';
ALTER TABLE Z0CASE MODIFY column Z0_TEST0 float(25,2);
DESC z0case;
Field	Type	Null	Key	Default	Extra
Z0_TEST0	float(25,2)	NO	PRI	NULL	
Z0_TEST1	time	YES		NULL	
Z0_TEST2	year(4)	YES		NULL	
SELECT * FROM Z0CASE ORDER BY Z0_TEST0;
Z0_TEST0	Z0_TEST1	Z0_TEST2
0.00	00:00:00	0000
20111112.00	11:11:11	2011
SELECT table_id,table_name FROM oceanbase.__all_virtual_table WHERE table_name='Z0CASE';
date/DATETIME/TIMESTAMP
DROP TABLE Z0CASE;
CREATE TABLE Z0CASE(Z0_TEST0 DATETIME  PRIMARY KEY) with column group (all columns, each column);
INSERT INTO  Z0CASE (Z0_TEST0)VALUES('2011-11-11 11:11:11');
INSERT INTO  Z0CASE (Z0_TEST0)VALUES(0);
SELECT * FROM Z0CASE ORDER BY Z0_TEST0;
Z0_TEST0
0000-00-00 00:00:00
2011-11-11 11:11:11
SELECT table_id,table_name FROM oceanbase.__all_virtual_table WHERE table_name='Z0CASE';
ALTER TABLE Z0CASE MODIFY column Z0_TEST0 DATETIME;
DESC z0case;
Field	Type	Null	Key	Default	Extra
Z0_TEST0	datetime	NO	PRI	NULL	
SELECT * FROM Z0CASE ORDER BY Z0_TEST0;
Z0_TEST0
0000-00-00 00:00:00
2011-11-11 11:11:11
SELECT table_id,table_name FROM oceanbase.__all_virtual_table WHERE table_name='Z0CASE';
ALTER TABLE Z0CASE MODIFY column Z0_TEST0 DATE;
DESC z0case;
Field	Type	Null	Key	Default	Extra
Z0_TEST0	date	NO	PRI	NULL	
SELECT * FROM Z0CASE ORDER BY Z0_TEST0;
Z0_TEST0
0000-00-00
2011-11-11
SELECT table_id,table_name FROM oceanbase.__all_virtual_table WHERE table_name='Z0CASE';
DROP TABLE Z0CASE;
CREATE TABLE Z0CASE(Z0_TEST0 DATETIME  PRIMARY KEY) with column group (all columns, each column);
INSERT INTO  Z0CASE (Z0_TEST0)VALUES('2011-11-11 11:11:11');
INSERT INTO  Z0CASE (Z0_TEST0)VALUES(0);
SELECT * FROM Z0CASE ORDER BY Z0_TEST0;
Z0_TEST0
0000-00-00 00:00:00
2011-11-11 11:11:11
SELECT table_id,table_name FROM oceanbase.__all_virtual_table WHERE table_name='Z0CASE';
ALTER TABLE Z0CASE MODIFY column Z0_TEST0 time;
DESC z0case;
Field	Type	Null	Key	Default	Extra
Z0_TEST0	time	NO	PRI	NULL	
SELECT * FROM Z0CASE ORDER BY Z0_TEST0;
Z0_TEST0
00:00:00
11:11:11
SELECT table_id,table_name FROM oceanbase.__all_virtual_table WHERE table_name='Z0CASE';
DROP TABLE Z0CASE;
CREATE TABLE Z0CASE(Z0_TEST0 DATETIME  PRIMARY KEY) with column group (all columns, each column);
INSERT INTO  Z0CASE (Z0_TEST0)VALUES('2011-11-11 11:11:11');
INSERT INTO  Z0CASE (Z0_TEST0)VALUES(0);
SELECT * FROM Z0CASE ORDER BY Z0_TEST0;
Z0_TEST0
0000-00-00 00:00:00
2011-11-11 11:11:11
SELECT table_id,table_name FROM oceanbase.__all_virtual_table WHERE table_name='Z0CASE';
ALTER TABLE Z0CASE MODIFY column Z0_TEST0 timestamp;
DESC z0case;
Field	Type	Null	Key	Default	Extra
Z0_TEST0	timestamp	NO	PRI	NULL	
SELECT * FROM Z0CASE ORDER BY Z0_TEST0;
Z0_TEST0
0000-00-00 00:00:00
2011-11-11 11:11:11
SELECT table_id,table_name FROM oceanbase.__all_virtual_table WHERE table_name='Z0CASE';
DROP TABLE Z0CASE;
CREATE TABLE Z0CASE(Z0_TEST0 timestamp  PRIMARY KEY) with column group (all columns, each column);
INSERT INTO  Z0CASE (Z0_TEST0)VALUES('2011-11-11 11:11:11');
INSERT INTO  Z0CASE (Z0_TEST0)VALUES(0);
SELECT * FROM Z0CASE ORDER BY Z0_TEST0;
Z0_TEST0
0000-00-00 00:00:00
2011-11-11 11:11:11
SELECT table_id,table_name FROM oceanbase.__all_virtual_table WHERE table_name='Z0CASE';
ALTER TABLE Z0CASE MODIFY column Z0_TEST0 DATETIME;
DESC z0case;
Field	Type	Null	Key	Default	Extra
Z0_TEST0	datetime	NO	PRI	NULL	
SELECT * FROM Z0CASE ORDER BY Z0_TEST0;
Z0_TEST0
0000-00-00 00:00:00
2011-11-11 11:11:11
SELECT table_id,table_name FROM oceanbase.__all_virtual_table WHERE table_name='Z0CASE';
DROP TABLE Z0CASE;
CREATE TABLE Z0CASE(Z0_TEST0 DATETIME  PRIMARY KEY) with column group (all columns, each column);
INSERT INTO  Z0CASE (Z0_TEST0)VALUES('2011-11-11 11:11:11');
INSERT INTO  Z0CASE (Z0_TEST0)VALUES(0);
SELECT * FROM Z0CASE ORDER BY Z0_TEST0;
Z0_TEST0
0000-00-00 00:00:00
2011-11-11 11:11:11
SELECT table_id,table_name FROM oceanbase.__all_virtual_table WHERE table_name='Z0CASE';
ALTER TABLE Z0CASE MODIFY column Z0_TEST0 bigINT;
DESC z0case;
Field	Type	Null	Key	Default	Extra
Z0_TEST0	bigint(20)	NO	PRI	NULL	
SELECT * FROM Z0CASE ORDER BY Z0_TEST0;
Z0_TEST0
0
20111111111111
SELECT table_id,table_name FROM oceanbase.__all_virtual_table WHERE table_name='Z0CASE';
DROP TABLE Z0CASE;
CREATE TABLE Z0CASE(Z0_TEST0 timestamp  PRIMARY KEY) with column group (all columns, each column);
INSERT INTO  Z0CASE (Z0_TEST0)VALUES('2011-11-11 11:11:11');
INSERT INTO  Z0CASE (Z0_TEST0)VALUES(0);
SELECT * FROM Z0CASE ORDER BY Z0_TEST0;
Z0_TEST0
0000-00-00 00:00:00
2011-11-11 11:11:11
SELECT table_id,table_name FROM oceanbase.__all_virtual_table WHERE table_name='Z0CASE';
ALTER TABLE Z0CASE MODIFY column Z0_TEST0 bigINT;
DESC z0case;
Field	Type	Null	Key	Default	Extra
Z0_TEST0	bigint(20)	NO	PRI	NULL	
SELECT * FROM Z0CASE ORDER BY Z0_TEST0;
Z0_TEST0
0
20111111111111
SELECT table_id,table_name FROM oceanbase.__all_virtual_table WHERE table_name='Z0CASE';
DROP TABLE Z0CASE;
