SET sql_mode='STRICT_TRANS_TABLES,STRICT_ALL_TABLES';
SELECT @@sql_mode;
@@sql_mode
STRICT_TRANS_TABLES,STRICT_ALL_TABLES
DROP TABLE IF EXISTS Z0CASE;
TINYINT/ SMALLINT/ MEDIUMINT	/ INT/ BIGINT
CREATE TABLE Z0CASE(Z0_TEST0 TINYINT, Z0_TEST1 SMALLINT,Z0_TEST2 MEDIUMINT	,Z0_TEST3 INT,z0_test4 BIGINT) with column group (all columns, each column);
INSERT INTO  Z0CASE (z0_test0,z0_test1,Z0_TEST2,Z0_TEST3,z0_test4)VALUES(0,0,0,0,0);
INSERT INTO  Z0CASE (z0_test0,z0_test1,Z0_TEST2,Z0_TEST3,z0_test4)VALUES(111,111,111,111,111);
INSERT INTO  Z0CASE (z0_test0,z0_test1,Z0_TEST2,Z0_TEST3,z0_test4)VALUES(127,127.333,127.333,127.333,127.333);
INSERT INTO  Z0CASE (z0_test0,z0_test1,Z0_TEST2,Z0_TEST3,z0_test4)VALUES(-3.3333,-128.333,-128.333,-128.333,-128.333);
INSERT INTO  Z0CASE (z0_test0,z0_test1,Z0_TEST2,Z0_TEST3,z0_test4)VALUES(NULL,NULL,NULL,NULL,NULL);
SELECT * FROM Z0CASE ORDER BY Z0_TEST1;
Z0_TEST0	Z0_TEST1	Z0_TEST2	Z0_TEST3	z0_test4
NULL	NULL	NULL	NULL	NULL
-3	-128	-128	-128	-128
0	0	0	0	0
111	111	111	111	111
127	127	127	127	127
SELECT table_id,table_name FROM oceanbase.__all_virtual_table WHERE table_name='Z0CASE';
ALTER TABLE Z0CASE MODIFY COLUMN z0_test0 TINYINT  DEFAULT 0;
SELECT * FROM Z0CASE ORDER BY Z0_TEST1;
z0_test0	Z0_TEST1	Z0_TEST2	Z0_TEST3	z0_test4
NULL	NULL	NULL	NULL	NULL
-3	-128	-128	-128	-128
0	0	0	0	0
111	111	111	111	111
127	127	127	127	127
DESC Z0CASE;
Field	Type	Null	Key	Default	Extra
z0_test0	tinyint(4)	YES		0	
Z0_TEST1	smallint(6)	YES		NULL	
Z0_TEST2	mediumint(9)	YES		NULL	
Z0_TEST3	int(11)	YES		NULL	
z0_test4	bigint(20)	YES		NULL	
SELECT table_id,table_name FROM oceanbase.__all_virtual_table WHERE table_name='Z0CASE';
ALTER TABLE Z0CASE MODIFY COLUMN z0_test1 TINYINT DEFAULT 0;
SELECT * FROM Z0CASE ORDER BY Z0_TEST1;
z0_test0	z0_test1	Z0_TEST2	Z0_TEST3	z0_test4
NULL	NULL	NULL	NULL	NULL
-3	-128	-128	-128	-128
0	0	0	0	0
111	111	111	111	111
127	127	127	127	127
DESC Z0CASE;
Field	Type	Null	Key	Default	Extra
z0_test0	tinyint(4)	YES		0	
z0_test1	tinyint(4)	YES		0	
Z0_TEST2	mediumint(9)	YES		NULL	
Z0_TEST3	int(11)	YES		NULL	
z0_test4	bigint(20)	YES		NULL	
SELECT table_id,table_name FROM oceanbase.__all_virtual_table WHERE table_name='Z0CASE';
ALTER TABLE Z0CASE MODIFY COLUMN z0_test2 TINYINT DEFAULT 0;
SELECT * FROM Z0CASE ORDER BY Z0_TEST1;
z0_test0	z0_test1	z0_test2	Z0_TEST3	z0_test4
NULL	NULL	NULL	NULL	NULL
-3	-128	-128	-128	-128
0	0	0	0	0
111	111	111	111	111
127	127	127	127	127
DESC Z0CASE;
Field	Type	Null	Key	Default	Extra
z0_test0	tinyint(4)	YES		0	
z0_test1	tinyint(4)	YES		0	
z0_test2	tinyint(4)	YES		0	
Z0_TEST3	int(11)	YES		NULL	
z0_test4	bigint(20)	YES		NULL	
SELECT table_id,table_name FROM oceanbase.__all_virtual_table WHERE table_name='Z0CASE';
ALTER TABLE Z0CASE MODIFY COLUMN Z0_TEST3 TINYINT DEFAULT 0;
SELECT * FROM Z0CASE ORDER BY Z0_TEST1;
z0_test0	z0_test1	z0_test2	Z0_TEST3	z0_test4
NULL	NULL	NULL	NULL	NULL
-3	-128	-128	-128	-128
0	0	0	0	0
111	111	111	111	111
127	127	127	127	127
DESC Z0CASE;
Field	Type	Null	Key	Default	Extra
z0_test0	tinyint(4)	YES		0	
z0_test1	tinyint(4)	YES		0	
z0_test2	tinyint(4)	YES		0	
Z0_TEST3	tinyint(4)	YES		0	
z0_test4	bigint(20)	YES		NULL	
SELECT table_id,table_name FROM oceanbase.__all_virtual_table WHERE table_name='Z0CASE';
ALTER TABLE Z0CASE MODIFY COLUMN z0_test4 TINYINT DEFAULT 0;
SELECT * FROM Z0CASE ORDER BY Z0_TEST1;
z0_test0	z0_test1	z0_test2	Z0_TEST3	z0_test4
NULL	NULL	NULL	NULL	NULL
-3	-128	-128	-128	-128
0	0	0	0	0
111	111	111	111	111
127	127	127	127	127
DESC Z0CASE;
Field	Type	Null	Key	Default	Extra
z0_test0	tinyint(4)	YES		0	
z0_test1	tinyint(4)	YES		0	
z0_test2	tinyint(4)	YES		0	
Z0_TEST3	tinyint(4)	YES		0	
z0_test4	tinyint(4)	YES		0	
SELECT table_id,table_name FROM oceanbase.__all_virtual_table WHERE table_name='Z0CASE';
DROP TABLE Z0CASE;
CREATE TABLE Z0CASE(Z0_TEST0 TINYINT, Z0_TEST1 SMALLINT,Z0_TEST2 MEDIUMINT	,Z0_TEST3 INT,z0_test4 BIGINT) with column group (all columns, each column);
INSERT INTO  Z0CASE (z0_test0,z0_test1,Z0_TEST2,Z0_TEST3,z0_test4)VALUES(0,0,0,0,0);
INSERT INTO  Z0CASE (z0_test0,z0_test1,Z0_TEST2,Z0_TEST3,z0_test4)VALUES(111,111,111,111,111);
INSERT INTO  Z0CASE (z0_test0,z0_test1,Z0_TEST2,Z0_TEST3,z0_test4)VALUES(127,127.333,127.333,127.333,127.333);
INSERT INTO  Z0CASE (z0_test0,z0_test1,Z0_TEST2,Z0_TEST3,z0_test4)VALUES(-3.3333,-128.333,-128.333,-128.333,-128.333);
INSERT INTO  Z0CASE (z0_test0,z0_test1,Z0_TEST2,Z0_TEST3,z0_test4)VALUES(NULL,NULL,NULL,NULL,NULL);
SELECT * FROM Z0CASE ORDER BY Z0_TEST1;
Z0_TEST0	Z0_TEST1	Z0_TEST2	Z0_TEST3	z0_test4
NULL	NULL	NULL	NULL	NULL
-3	-128	-128	-128	-128
0	0	0	0	0
111	111	111	111	111
127	127	127	127	127
SELECT table_id,table_name FROM oceanbase.__all_virtual_table WHERE table_name='Z0CASE';
ALTER TABLE Z0CASE MODIFY COLUMN z0_test0 SMALLINT  DEFAULT 32767;
SELECT * FROM Z0CASE ORDER BY Z0_TEST1;
z0_test0	Z0_TEST1	Z0_TEST2	Z0_TEST3	z0_test4
NULL	NULL	NULL	NULL	NULL
-3	-128	-128	-128	-128
0	0	0	0	0
111	111	111	111	111
127	127	127	127	127
DESC Z0CASE;
Field	Type	Null	Key	Default	Extra
z0_test0	smallint(6)	YES		32767	
Z0_TEST1	smallint(6)	YES		NULL	
Z0_TEST2	mediumint(9)	YES		NULL	
Z0_TEST3	int(11)	YES		NULL	
z0_test4	bigint(20)	YES		NULL	
SELECT table_id,table_name FROM oceanbase.__all_virtual_table WHERE table_name='Z0CASE';
INSERT INTO  Z0CASE (z0_test0,z0_test1,Z0_TEST2,Z0_TEST3,z0_test4)VALUES(,0,0,0,0);
ERROR 21S01: Column count doesn't match value count at row 1
INSERT INTO  Z0CASE (z0_test0,z0_test1,Z0_TEST2,Z0_TEST3,z0_test4)VALUES('1234567',1,0,0,0);
ERROR 22003: Out of range value for column 'z0_test0' at row 1
INSERT INTO  Z0CASE (z0_test0,z0_test1,Z0_TEST2,Z0_TEST3,z0_test4)VALUES(NULL,2,0,0,0);
INSERT INTO  Z0CASE (z0_test0,z0_test1,Z0_TEST2,Z0_TEST3,z0_test4)VALUES(12342,3,0,0,0);
INSERT INTO  Z0CASE (z0_test0,z0_test1,Z0_TEST2,Z0_TEST3,z0_test4)VALUES('1567',4,0,0,0);
UPDATE Z0CASE SET z0_test0='' WHERE z0_test1=111;
ERROR HY000: Incorrect integer value for column 'z0_test0' at row 1
UPDATE Z0CASE SET z0_test0=12345678 WHERE z0_test1=111;
ERROR 22003: Out of range value for column 'z0_test0' at row 1
UPDATE Z0CASE SET z0_test0=null WHERE z0_test1=111;
UPDATE Z0CASE SET z0_test0=122 WHERE z0_test0=127;
UPDATE Z0CASE SET z0_test0='-122' WHERE z0_test0=-3;
SELECT * FROM Z0CASE ORDER BY Z0_TEST1;
z0_test0	Z0_TEST1	Z0_TEST2	Z0_TEST3	z0_test4
NULL	NULL	NULL	NULL	NULL
-122	-128	-128	-128	-128
0	0	0	0	0
NULL	2	0	0	0
12342	3	0	0	0
1567	4	0	0	0
NULL	111	111	111	111
122	127	127	127	127
DELETE FROM Z0CASE WHERE z0_test1=111;
DELETE FROM Z0CASE WHERE z0_test0 IS NULL;
DELETE FROM Z0CASE WHERE z0_test0=122;
SELECT * FROM Z0CASE ORDER BY Z0_TEST1;
z0_test0	Z0_TEST1	Z0_TEST2	Z0_TEST3	z0_test4
-122	-128	-128	-128	-128
0	0	0	0	0
12342	3	0	0	0
1567	4	0	0	0
ALTER TABLE Z0CASE MODIFY COLUMN z0_test1 SMALLINT DEFAULT 0;
SELECT * FROM Z0CASE ORDER BY Z0_TEST1;
z0_test0	z0_test1	Z0_TEST2	Z0_TEST3	z0_test4
-122	-128	-128	-128	-128
0	0	0	0	0
12342	3	0	0	0
1567	4	0	0	0
DESC Z0CASE;
Field	Type	Null	Key	Default	Extra
z0_test0	smallint(6)	YES		32767	
z0_test1	smallint(6)	YES		0	
Z0_TEST2	mediumint(9)	YES		NULL	
Z0_TEST3	int(11)	YES		NULL	
z0_test4	bigint(20)	YES		NULL	
SELECT table_id,table_name FROM oceanbase.__all_virtual_table WHERE table_name='Z0CASE';
ALTER TABLE Z0CASE MODIFY COLUMN z0_test2 SMALLINT DEFAULT 0;
SELECT * FROM Z0CASE ORDER BY Z0_TEST1;
z0_test0	z0_test1	z0_test2	Z0_TEST3	z0_test4
-122	-128	-128	-128	-128
0	0	0	0	0
12342	3	0	0	0
1567	4	0	0	0
DESC Z0CASE;
Field	Type	Null	Key	Default	Extra
z0_test0	smallint(6)	YES		32767	
z0_test1	smallint(6)	YES		0	
z0_test2	smallint(6)	YES		0	
Z0_TEST3	int(11)	YES		NULL	
z0_test4	bigint(20)	YES		NULL	
SELECT table_id,table_name FROM oceanbase.__all_virtual_table WHERE table_name='Z0CASE';
ALTER TABLE Z0CASE MODIFY COLUMN Z0_TEST3 SMALLINT DEFAULT 0;
SELECT * FROM Z0CASE ORDER BY Z0_TEST1;
z0_test0	z0_test1	z0_test2	Z0_TEST3	z0_test4
-122	-128	-128	-128	-128
0	0	0	0	0
12342	3	0	0	0
1567	4	0	0	0
DESC Z0CASE;
Field	Type	Null	Key	Default	Extra
z0_test0	smallint(6)	YES		32767	
z0_test1	smallint(6)	YES		0	
z0_test2	smallint(6)	YES		0	
Z0_TEST3	smallint(6)	YES		0	
z0_test4	bigint(20)	YES		NULL	
SELECT table_id,table_name FROM oceanbase.__all_virtual_table WHERE table_name='Z0CASE';
ALTER TABLE Z0CASE MODIFY COLUMN z0_test4 SMALLINT DEFAULT 0;
SELECT * FROM Z0CASE ORDER BY Z0_TEST1;
z0_test0	z0_test1	z0_test2	Z0_TEST3	z0_test4
-122	-128	-128	-128	-128
0	0	0	0	0
12342	3	0	0	0
1567	4	0	0	0
DESC Z0CASE;
Field	Type	Null	Key	Default	Extra
z0_test0	smallint(6)	YES		32767	
z0_test1	smallint(6)	YES		0	
z0_test2	smallint(6)	YES		0	
Z0_TEST3	smallint(6)	YES		0	
z0_test4	smallint(6)	YES		0	
SELECT table_id,table_name FROM oceanbase.__all_virtual_table WHERE table_name='Z0CASE';
DROP TABLE Z0CASE;
CREATE TABLE Z0CASE(Z0_TEST0 TINYINT, Z0_TEST1 SMALLINT,Z0_TEST2 MEDIUMINT	,Z0_TEST3 INT,z0_test4 BIGINT) with column group (all columns, each column);
INSERT INTO  Z0CASE (z0_test0,z0_test1,Z0_TEST2,Z0_TEST3,z0_test4)VALUES(0,0,0,0,0);
INSERT INTO  Z0CASE (z0_test0,z0_test1,Z0_TEST2,Z0_TEST3,z0_test4)VALUES(111,111,111,111,111);
INSERT INTO  Z0CASE (z0_test0,z0_test1,Z0_TEST2,Z0_TEST3,z0_test4)VALUES(127,127.333,127.333,127.333,127.333);
INSERT INTO  Z0CASE (z0_test0,z0_test1,Z0_TEST2,Z0_TEST3,z0_test4)VALUES(-3.3333,-128.333,-128.333,-128.333,-128.333);
INSERT INTO  Z0CASE (z0_test0,z0_test1,Z0_TEST2,Z0_TEST3,z0_test4)VALUES(NULL,NULL,NULL,NULL,NULL);
SELECT * FROM Z0CASE ORDER BY Z0_TEST1;
Z0_TEST0	Z0_TEST1	Z0_TEST2	Z0_TEST3	z0_test4
NULL	NULL	NULL	NULL	NULL
-3	-128	-128	-128	-128
0	0	0	0	0
111	111	111	111	111
127	127	127	127	127
SELECT table_id,table_name FROM oceanbase.__all_virtual_table WHERE table_name='Z0CASE';
ALTER TABLE Z0CASE MODIFY COLUMN z0_test0 MEDIUMINT DEFAULT 0;
SELECT * FROM Z0CASE ORDER BY Z0_TEST1;
z0_test0	Z0_TEST1	Z0_TEST2	Z0_TEST3	z0_test4
NULL	NULL	NULL	NULL	NULL
-3	-128	-128	-128	-128
0	0	0	0	0
111	111	111	111	111
127	127	127	127	127
DESC Z0CASE;
Field	Type	Null	Key	Default	Extra
z0_test0	mediumint(9)	YES		0	
Z0_TEST1	smallint(6)	YES		NULL	
Z0_TEST2	mediumint(9)	YES		NULL	
Z0_TEST3	int(11)	YES		NULL	
z0_test4	bigint(20)	YES		NULL	
SELECT table_id,table_name FROM oceanbase.__all_virtual_table WHERE table_name='Z0CASE';
ALTER TABLE Z0CASE MODIFY COLUMN z0_test1 MEDIUMINT DEFAULT 0;
SELECT * FROM Z0CASE ORDER BY Z0_TEST1;
z0_test0	z0_test1	Z0_TEST2	Z0_TEST3	z0_test4
NULL	NULL	NULL	NULL	NULL
-3	-128	-128	-128	-128
0	0	0	0	0
111	111	111	111	111
127	127	127	127	127
DESC Z0CASE;
Field	Type	Null	Key	Default	Extra
z0_test0	mediumint(9)	YES		0	
z0_test1	mediumint(9)	YES		0	
Z0_TEST2	mediumint(9)	YES		NULL	
Z0_TEST3	int(11)	YES		NULL	
z0_test4	bigint(20)	YES		NULL	
SELECT table_id,table_name FROM oceanbase.__all_virtual_table WHERE table_name='Z0CASE';
ALTER TABLE Z0CASE MODIFY COLUMN z0_test2 MEDIUMINT DEFAULT 0;
SELECT * FROM Z0CASE ORDER BY Z0_TEST1;
z0_test0	z0_test1	z0_test2	Z0_TEST3	z0_test4
NULL	NULL	NULL	NULL	NULL
-3	-128	-128	-128	-128
0	0	0	0	0
111	111	111	111	111
127	127	127	127	127
DESC Z0CASE;
Field	Type	Null	Key	Default	Extra
z0_test0	mediumint(9)	YES		0	
z0_test1	mediumint(9)	YES		0	
z0_test2	mediumint(9)	YES		0	
Z0_TEST3	int(11)	YES		NULL	
z0_test4	bigint(20)	YES		NULL	
SELECT table_id,table_name FROM oceanbase.__all_virtual_table WHERE table_name='Z0CASE';
ALTER TABLE Z0CASE MODIFY COLUMN Z0_TEST3 MEDIUMINT DEFAULT 0;
SELECT * FROM Z0CASE ORDER BY Z0_TEST1;
z0_test0	z0_test1	z0_test2	Z0_TEST3	z0_test4
NULL	NULL	NULL	NULL	NULL
-3	-128	-128	-128	-128
0	0	0	0	0
111	111	111	111	111
127	127	127	127	127
DESC Z0CASE;
Field	Type	Null	Key	Default	Extra
z0_test0	mediumint(9)	YES		0	
z0_test1	mediumint(9)	YES		0	
z0_test2	mediumint(9)	YES		0	
Z0_TEST3	mediumint(9)	YES		0	
z0_test4	bigint(20)	YES		NULL	
SELECT table_id,table_name FROM oceanbase.__all_virtual_table WHERE table_name='Z0CASE';
ALTER TABLE Z0CASE MODIFY COLUMN z0_test4 MEDIUMINT DEFAULT 0;
SELECT * FROM Z0CASE ORDER BY Z0_TEST1;
z0_test0	z0_test1	z0_test2	Z0_TEST3	z0_test4
NULL	NULL	NULL	NULL	NULL
-3	-128	-128	-128	-128
0	0	0	0	0
111	111	111	111	111
127	127	127	127	127
DESC Z0CASE;
Field	Type	Null	Key	Default	Extra
z0_test0	mediumint(9)	YES		0	
z0_test1	mediumint(9)	YES		0	
z0_test2	mediumint(9)	YES		0	
Z0_TEST3	mediumint(9)	YES		0	
z0_test4	mediumint(9)	YES		0	
SELECT table_id,table_name FROM oceanbase.__all_virtual_table WHERE table_name='Z0CASE';
DROP TABLE Z0CASE;
CREATE TABLE Z0CASE(Z0_TEST0 TINYINT, Z0_TEST1 SMALLINT,Z0_TEST2 MEDIUMINT	,Z0_TEST3 INT,z0_test4 BIGINT) with column group (all columns, each column);
INSERT INTO  Z0CASE (z0_test0,z0_test1,Z0_TEST2,Z0_TEST3,z0_test4)VALUES(0,0,0,0,0);
INSERT INTO  Z0CASE (z0_test0,z0_test1,Z0_TEST2,Z0_TEST3,z0_test4)VALUES(111,111,111,111,111);
INSERT INTO  Z0CASE (z0_test0,z0_test1,Z0_TEST2,Z0_TEST3,z0_test4)VALUES(127,127.333,127.333,127.333,127.333);
INSERT INTO  Z0CASE (z0_test0,z0_test1,Z0_TEST2,Z0_TEST3,z0_test4)VALUES(-3.3333,-128.333,-128.333,-128.333,-128.333);
INSERT INTO  Z0CASE (z0_test0,z0_test1,Z0_TEST2,Z0_TEST3,z0_test4)VALUES(NULL,NULL,NULL,NULL,NULL);
SELECT * FROM Z0CASE ORDER BY Z0_TEST1;
Z0_TEST0	Z0_TEST1	Z0_TEST2	Z0_TEST3	z0_test4
NULL	NULL	NULL	NULL	NULL
-3	-128	-128	-128	-128
0	0	0	0	0
111	111	111	111	111
127	127	127	127	127
SELECT table_id,table_name FROM oceanbase.__all_virtual_table WHERE table_name='Z0CASE';
ALTER TABLE Z0CASE MODIFY COLUMN z0_test0 INT DEFAULT 0;
SELECT * FROM Z0CASE ORDER BY Z0_TEST1;
z0_test0	Z0_TEST1	Z0_TEST2	Z0_TEST3	z0_test4
NULL	NULL	NULL	NULL	NULL
-3	-128	-128	-128	-128
0	0	0	0	0
111	111	111	111	111
127	127	127	127	127
DESC Z0CASE;
Field	Type	Null	Key	Default	Extra
z0_test0	int(11)	YES		0	
Z0_TEST1	smallint(6)	YES		NULL	
Z0_TEST2	mediumint(9)	YES		NULL	
Z0_TEST3	int(11)	YES		NULL	
z0_test4	bigint(20)	YES		NULL	
SELECT table_id,table_name FROM oceanbase.__all_virtual_table WHERE table_name='Z0CASE';
ALTER TABLE Z0CASE MODIFY COLUMN z0_test1 INT DEFAULT 0;
SELECT * FROM Z0CASE ORDER BY Z0_TEST1;
z0_test0	z0_test1	Z0_TEST2	Z0_TEST3	z0_test4
NULL	NULL	NULL	NULL	NULL
-3	-128	-128	-128	-128
0	0	0	0	0
111	111	111	111	111
127	127	127	127	127
DESC Z0CASE;
Field	Type	Null	Key	Default	Extra
z0_test0	int(11)	YES		0	
z0_test1	int(11)	YES		0	
Z0_TEST2	mediumint(9)	YES		NULL	
Z0_TEST3	int(11)	YES		NULL	
z0_test4	bigint(20)	YES		NULL	
SELECT table_id,table_name FROM oceanbase.__all_virtual_table WHERE table_name='Z0CASE';
ALTER TABLE Z0CASE MODIFY COLUMN z0_test2 INT DEFAULT 0;
SELECT * FROM Z0CASE ORDER BY Z0_TEST1;
z0_test0	z0_test1	z0_test2	Z0_TEST3	z0_test4
NULL	NULL	NULL	NULL	NULL
-3	-128	-128	-128	-128
0	0	0	0	0
111	111	111	111	111
127	127	127	127	127
DESC Z0CASE;
Field	Type	Null	Key	Default	Extra
z0_test0	int(11)	YES		0	
z0_test1	int(11)	YES		0	
z0_test2	int(11)	YES		0	
Z0_TEST3	int(11)	YES		NULL	
z0_test4	bigint(20)	YES		NULL	
SELECT table_id,table_name FROM oceanbase.__all_virtual_table WHERE table_name='Z0CASE';
ALTER TABLE Z0CASE MODIFY COLUMN Z0_TEST3 INT DEFAULT 0;
SELECT * FROM Z0CASE ORDER BY Z0_TEST1;
z0_test0	z0_test1	z0_test2	Z0_TEST3	z0_test4
NULL	NULL	NULL	NULL	NULL
-3	-128	-128	-128	-128
0	0	0	0	0
111	111	111	111	111
127	127	127	127	127
DESC Z0CASE;
Field	Type	Null	Key	Default	Extra
z0_test0	int(11)	YES		0	
z0_test1	int(11)	YES		0	
z0_test2	int(11)	YES		0	
Z0_TEST3	int(11)	YES		0	
z0_test4	bigint(20)	YES		NULL	
SELECT table_id,table_name FROM oceanbase.__all_virtual_table WHERE table_name='Z0CASE';
ALTER TABLE Z0CASE MODIFY COLUMN z0_test4 INT DEFAULT 0;
SELECT * FROM Z0CASE ORDER BY Z0_TEST1;
z0_test0	z0_test1	z0_test2	Z0_TEST3	z0_test4
NULL	NULL	NULL	NULL	NULL
-3	-128	-128	-128	-128
0	0	0	0	0
111	111	111	111	111
127	127	127	127	127
DESC Z0CASE;
Field	Type	Null	Key	Default	Extra
z0_test0	int(11)	YES		0	
z0_test1	int(11)	YES		0	
z0_test2	int(11)	YES		0	
Z0_TEST3	int(11)	YES		0	
z0_test4	int(11)	YES		0	
SELECT table_id,table_name FROM oceanbase.__all_virtual_table WHERE table_name='Z0CASE';
DROP TABLE Z0CASE;
CREATE TABLE Z0CASE(Z0_TEST0 TINYINT, Z0_TEST1 SMALLINT,Z0_TEST2 MEDIUMINT	,Z0_TEST3 INT,z0_test4 BIGINT) with column group (all columns, each column);
INSERT INTO  Z0CASE (z0_test0,z0_test1,Z0_TEST2,Z0_TEST3,z0_test4)VALUES(0,0,0,0,0);
INSERT INTO  Z0CASE (z0_test0,z0_test1,Z0_TEST2,Z0_TEST3,z0_test4)VALUES(111,111,111,111,111);
INSERT INTO  Z0CASE (z0_test0,z0_test1,Z0_TEST2,Z0_TEST3,z0_test4)VALUES(127,127.333,127.333,127.333,127.333);
INSERT INTO  Z0CASE (z0_test0,z0_test1,Z0_TEST2,Z0_TEST3,z0_test4)VALUES(-3.3333,-128.333,-128.333,-128.333,-128.333);
INSERT INTO  Z0CASE (z0_test0,z0_test1,Z0_TEST2,Z0_TEST3,z0_test4)VALUES(NULL,NULL,NULL,NULL,NULL);
SELECT * FROM Z0CASE ORDER BY Z0_TEST1;
Z0_TEST0	Z0_TEST1	Z0_TEST2	Z0_TEST3	z0_test4
NULL	NULL	NULL	NULL	NULL
-3	-128	-128	-128	-128
0	0	0	0	0
111	111	111	111	111
127	127	127	127	127
SELECT table_id,table_name FROM oceanbase.__all_virtual_table WHERE table_name='Z0CASE';
ALTER TABLE Z0CASE MODIFY COLUMN z0_test0 BIGINT DEFAULT 0;
SELECT * FROM Z0CASE ORDER BY Z0_TEST1;
z0_test0	Z0_TEST1	Z0_TEST2	Z0_TEST3	z0_test4
NULL	NULL	NULL	NULL	NULL
-3	-128	-128	-128	-128
0	0	0	0	0
111	111	111	111	111
127	127	127	127	127
DESC Z0CASE;
Field	Type	Null	Key	Default	Extra
z0_test0	bigint(20)	YES		0	
Z0_TEST1	smallint(6)	YES		NULL	
Z0_TEST2	mediumint(9)	YES		NULL	
Z0_TEST3	int(11)	YES		NULL	
z0_test4	bigint(20)	YES		NULL	
SELECT table_id,table_name FROM oceanbase.__all_virtual_table WHERE table_name='Z0CASE';
ALTER TABLE Z0CASE MODIFY COLUMN z0_test1 BIGINT DEFAULT 0;
SELECT * FROM Z0CASE ORDER BY Z0_TEST1;
z0_test0	z0_test1	Z0_TEST2	Z0_TEST3	z0_test4
NULL	NULL	NULL	NULL	NULL
-3	-128	-128	-128	-128
0	0	0	0	0
111	111	111	111	111
127	127	127	127	127
DESC Z0CASE;
Field	Type	Null	Key	Default	Extra
z0_test0	bigint(20)	YES		0	
z0_test1	bigint(20)	YES		0	
Z0_TEST2	mediumint(9)	YES		NULL	
Z0_TEST3	int(11)	YES		NULL	
z0_test4	bigint(20)	YES		NULL	
SELECT table_id,table_name FROM oceanbase.__all_virtual_table WHERE table_name='Z0CASE';
ALTER TABLE Z0CASE MODIFY COLUMN z0_test2 BIGINT DEFAULT 0;
SELECT * FROM Z0CASE ORDER BY Z0_TEST1;
z0_test0	z0_test1	z0_test2	Z0_TEST3	z0_test4
NULL	NULL	NULL	NULL	NULL
-3	-128	-128	-128	-128
0	0	0	0	0
111	111	111	111	111
127	127	127	127	127
DESC Z0CASE;
Field	Type	Null	Key	Default	Extra
z0_test0	bigint(20)	YES		0	
z0_test1	bigint(20)	YES		0	
z0_test2	bigint(20)	YES		0	
Z0_TEST3	int(11)	YES		NULL	
z0_test4	bigint(20)	YES		NULL	
SELECT table_id,table_name FROM oceanbase.__all_virtual_table WHERE table_name='Z0CASE';
ALTER TABLE Z0CASE MODIFY COLUMN Z0_TEST3 BIGINT DEFAULT 0;
SELECT * FROM Z0CASE ORDER BY Z0_TEST1;
z0_test0	z0_test1	z0_test2	Z0_TEST3	z0_test4
NULL	NULL	NULL	NULL	NULL
-3	-128	-128	-128	-128
0	0	0	0	0
111	111	111	111	111
127	127	127	127	127
DESC Z0CASE;
Field	Type	Null	Key	Default	Extra
z0_test0	bigint(20)	YES		0	
z0_test1	bigint(20)	YES		0	
z0_test2	bigint(20)	YES		0	
Z0_TEST3	bigint(20)	YES		0	
z0_test4	bigint(20)	YES		NULL	
SELECT table_id,table_name FROM oceanbase.__all_virtual_table WHERE table_name='Z0CASE';
ALTER TABLE Z0CASE MODIFY COLUMN z0_test4 BIGINT DEFAULT 0;
SELECT * FROM Z0CASE ORDER BY Z0_TEST1;
z0_test0	z0_test1	z0_test2	Z0_TEST3	z0_test4
NULL	NULL	NULL	NULL	NULL
-3	-128	-128	-128	-128
0	0	0	0	0
111	111	111	111	111
127	127	127	127	127
DESC Z0CASE;
Field	Type	Null	Key	Default	Extra
z0_test0	bigint(20)	YES		0	
z0_test1	bigint(20)	YES		0	
z0_test2	bigint(20)	YES		0	
Z0_TEST3	bigint(20)	YES		0	
z0_test4	bigint(20)	YES		0	
SELECT table_id,table_name FROM oceanbase.__all_virtual_table WHERE table_name='Z0CASE';
DROP TABLE Z0CASE;
CREATE TABLE Z0CASE(Z0_TEST0 TINYINT, Z0_TEST1 SMALLINT,Z0_TEST2 MEDIUMINT	,Z0_TEST3 INT,z0_test4 BIGINT) with column group (all columns, each column);
INSERT INTO  Z0CASE (z0_test0,z0_test1,Z0_TEST2,Z0_TEST3,z0_test4)VALUES(0,0,0,0,0);
INSERT INTO  Z0CASE (z0_test0,z0_test1,Z0_TEST2,Z0_TEST3,z0_test4)VALUES(111,111,111,111,111);
INSERT INTO  Z0CASE (z0_test0,z0_test1,Z0_TEST2,Z0_TEST3,z0_test4)VALUES(127,127.333,127.333,127.333,127.333);
INSERT INTO  Z0CASE (z0_test0,z0_test1,Z0_TEST2,Z0_TEST3,z0_test4)VALUES(-3.3333,-128.333,-128.333,-128.333,-128.333);
INSERT INTO  Z0CASE (z0_test0,z0_test1,Z0_TEST2,Z0_TEST3,z0_test4)VALUES(NULL,NULL,NULL,NULL,NULL);
SELECT * FROM Z0CASE ORDER BY Z0_TEST1;
Z0_TEST0	Z0_TEST1	Z0_TEST2	Z0_TEST3	z0_test4
NULL	NULL	NULL	NULL	NULL
-3	-128	-128	-128	-128
0	0	0	0	0
111	111	111	111	111
127	127	127	127	127
SELECT table_id,table_name FROM oceanbase.__all_virtual_table WHERE table_name='Z0CASE';
ALTER TABLE Z0CASE MODIFY COLUMN z0_test0 FLOAT DEFAULT 0;
SELECT * FROM Z0CASE ORDER BY Z0_TEST1;
z0_test0	Z0_TEST1	Z0_TEST2	Z0_TEST3	z0_test4
NULL	NULL	NULL	NULL	NULL
-3	-128	-128	-128	-128
0	0	0	0	0
111	111	111	111	111
127	127	127	127	127
DESC Z0CASE;
Field	Type	Null	Key	Default	Extra
z0_test0	float	YES		0	
Z0_TEST1	smallint(6)	YES		NULL	
Z0_TEST2	mediumint(9)	YES		NULL	
Z0_TEST3	int(11)	YES		NULL	
z0_test4	bigint(20)	YES		NULL	
SELECT table_id,table_name FROM oceanbase.__all_virtual_table WHERE table_name='Z0CASE';
ALTER TABLE Z0CASE MODIFY COLUMN z0_test1 FLOAT(5) DEFAULT 0;
SELECT * FROM Z0CASE ORDER BY Z0_TEST1;
z0_test0	z0_test1	Z0_TEST2	Z0_TEST3	z0_test4
NULL	NULL	NULL	NULL	NULL
-3	-128	-128	-128	-128
0	0	0	0	0
111	111	111	111	111
127	127	127	127	127
DESC Z0CASE;
Field	Type	Null	Key	Default	Extra
z0_test0	float	YES		0	
z0_test1	float	YES		0	
Z0_TEST2	mediumint(9)	YES		NULL	
Z0_TEST3	int(11)	YES		NULL	
z0_test4	bigint(20)	YES		NULL	
SELECT table_id,table_name FROM oceanbase.__all_virtual_table WHERE table_name='Z0CASE';
ALTER TABLE Z0CASE MODIFY COLUMN z0_test2 FLOAT(10,0) DEFAULT 0;
SELECT * FROM Z0CASE ORDER BY Z0_TEST1;
z0_test0	z0_test1	z0_test2	Z0_TEST3	z0_test4
NULL	NULL	NULL	NULL	NULL
-3	-128	-128	-128	-128
0	0	0	0	0
111	111	111	111	111
127	127	127	127	127
DESC Z0CASE;
Field	Type	Null	Key	Default	Extra
z0_test0	float	YES		0	
z0_test1	float	YES		0	
z0_test2	float(10,0)	YES		0	
Z0_TEST3	int(11)	YES		NULL	
z0_test4	bigint(20)	YES		NULL	
SELECT table_id,table_name FROM oceanbase.__all_virtual_table WHERE table_name='Z0CASE';
ALTER TABLE Z0CASE MODIFY COLUMN Z0_TEST3 FLOAT DEFAULT 0;
SELECT * FROM Z0CASE ORDER BY Z0_TEST1;
z0_test0	z0_test1	z0_test2	Z0_TEST3	z0_test4
NULL	NULL	NULL	NULL	NULL
-3	-128	-128	-128	-128
0	0	0	0	0
111	111	111	111	111
127	127	127	127	127
DESC Z0CASE;
Field	Type	Null	Key	Default	Extra
z0_test0	float	YES		0	
z0_test1	float	YES		0	
z0_test2	float(10,0)	YES		0	
Z0_TEST3	float	YES		0	
z0_test4	bigint(20)	YES		NULL	
SELECT table_id,table_name FROM oceanbase.__all_virtual_table WHERE table_name='Z0CASE';
ALTER TABLE Z0CASE MODIFY COLUMN z0_test4 FLOAT DEFAULT 0;
SELECT * FROM Z0CASE ORDER BY Z0_TEST1;
z0_test0	z0_test1	z0_test2	Z0_TEST3	z0_test4
NULL	NULL	NULL	NULL	NULL
-3	-128	-128	-128	-128
0	0	0	0	0
111	111	111	111	111
127	127	127	127	127
DESC Z0CASE;
Field	Type	Null	Key	Default	Extra
z0_test0	float	YES		0	
z0_test1	float	YES		0	
z0_test2	float(10,0)	YES		0	
Z0_TEST3	float	YES		0	
z0_test4	float	YES		0	
SELECT table_id,table_name FROM oceanbase.__all_virtual_table WHERE table_name='Z0CASE';
DROP TABLE Z0CASE;
CREATE TABLE Z0CASE(Z0_TEST0 TINYINT, Z0_TEST1 SMALLINT,Z0_TEST2 MEDIUMINT	,Z0_TEST3 INT,z0_test4 BIGINT) with column group (all columns, each column);
INSERT INTO  Z0CASE (z0_test0,z0_test1,Z0_TEST2,Z0_TEST3,z0_test4)VALUES(0,0,0,0,0);
INSERT INTO  Z0CASE (z0_test0,z0_test1,Z0_TEST2,Z0_TEST3,z0_test4)VALUES(111,111,111,111,111);
INSERT INTO  Z0CASE (z0_test0,z0_test1,Z0_TEST2,Z0_TEST3,z0_test4)VALUES(127,127.333,127.333,127.333,127.333);
INSERT INTO  Z0CASE (z0_test0,z0_test1,Z0_TEST2,Z0_TEST3,z0_test4)VALUES(-3.3333,-128.333,-128.333,-128.333,-128.333);
INSERT INTO  Z0CASE (z0_test0,z0_test1,Z0_TEST2,Z0_TEST3,z0_test4)VALUES(NULL,NULL,NULL,NULL,NULL);
SELECT * FROM Z0CASE ORDER BY Z0_TEST1;
Z0_TEST0	Z0_TEST1	Z0_TEST2	Z0_TEST3	z0_test4
NULL	NULL	NULL	NULL	NULL
-3	-128	-128	-128	-128
0	0	0	0	0
111	111	111	111	111
127	127	127	127	127
SELECT table_id,table_name FROM oceanbase.__all_virtual_table WHERE table_name='Z0CASE';
ALTER TABLE Z0CASE MODIFY COLUMN z0_test0 DOUBLE DEFAULT 0;
SELECT * FROM Z0CASE ORDER BY Z0_TEST1;
z0_test0	Z0_TEST1	Z0_TEST2	Z0_TEST3	z0_test4
NULL	NULL	NULL	NULL	NULL
-3	-128	-128	-128	-128
0	0	0	0	0
111	111	111	111	111
127	127	127	127	127
DESC Z0CASE;
Field	Type	Null	Key	Default	Extra
z0_test0	double	YES		0	
Z0_TEST1	smallint(6)	YES		NULL	
Z0_TEST2	mediumint(9)	YES		NULL	
Z0_TEST3	int(11)	YES		NULL	
z0_test4	bigint(20)	YES		NULL	
SELECT table_id,table_name FROM oceanbase.__all_virtual_table WHERE table_name='Z0CASE';
ALTER TABLE Z0CASE MODIFY COLUMN z0_test1 DOUBLE(5,0)  DEFAULT '123';
SELECT * FROM Z0CASE ORDER BY Z0_TEST1;
z0_test0	z0_test1	Z0_TEST2	Z0_TEST3	z0_test4
NULL	NULL	NULL	NULL	NULL
-3	-128	-128	-128	-128
0	0	0	0	0
111	111	111	111	111
127	127	127	127	127
DESC Z0CASE;
Field	Type	Null	Key	Default	Extra
z0_test0	double	YES		0	
z0_test1	double(5,0)	YES		123	
Z0_TEST2	mediumint(9)	YES		NULL	
Z0_TEST3	int(11)	YES		NULL	
z0_test4	bigint(20)	YES		NULL	
SELECT table_id,table_name FROM oceanbase.__all_virtual_table WHERE table_name='Z0CASE';
ALTER TABLE Z0CASE MODIFY COLUMN z0_test2 DOUBLE(10,0) DEFAULT 0;
SELECT * FROM Z0CASE ORDER BY Z0_TEST1;
z0_test0	z0_test1	z0_test2	Z0_TEST3	z0_test4
NULL	NULL	NULL	NULL	NULL
-3	-128	-128	-128	-128
0	0	0	0	0
111	111	111	111	111
127	127	127	127	127
DESC Z0CASE;
Field	Type	Null	Key	Default	Extra
z0_test0	double	YES		0	
z0_test1	double(5,0)	YES		123	
z0_test2	double(10,0)	YES		0	
Z0_TEST3	int(11)	YES		NULL	
z0_test4	bigint(20)	YES		NULL	
SELECT table_id,table_name FROM oceanbase.__all_virtual_table WHERE table_name='Z0CASE';
ALTER TABLE Z0CASE MODIFY COLUMN Z0_TEST3 DOUBLE  DEFAULT 0;
SELECT * FROM Z0CASE ORDER BY Z0_TEST1;
z0_test0	z0_test1	z0_test2	Z0_TEST3	z0_test4
NULL	NULL	NULL	NULL	NULL
-3	-128	-128	-128	-128
0	0	0	0	0
111	111	111	111	111
127	127	127	127	127
DESC Z0CASE;
Field	Type	Null	Key	Default	Extra
z0_test0	double	YES		0	
z0_test1	double(5,0)	YES		123	
z0_test2	double(10,0)	YES		0	
Z0_TEST3	double	YES		0	
z0_test4	bigint(20)	YES		NULL	
SELECT table_id,table_name FROM oceanbase.__all_virtual_table WHERE table_name='Z0CASE';
ALTER TABLE Z0CASE MODIFY COLUMN z0_test4 DOUBLE  DEFAULT 0;
SELECT * FROM Z0CASE ORDER BY Z0_TEST1;
z0_test0	z0_test1	z0_test2	Z0_TEST3	z0_test4
NULL	NULL	NULL	NULL	NULL
-3	-128	-128	-128	-128
0	0	0	0	0
111	111	111	111	111
127	127	127	127	127
DESC Z0CASE;
Field	Type	Null	Key	Default	Extra
z0_test0	double	YES		0	
z0_test1	double(5,0)	YES		123	
z0_test2	double(10,0)	YES		0	
Z0_TEST3	double	YES		0	
z0_test4	double	YES		0	
SELECT table_id,table_name FROM oceanbase.__all_virtual_table WHERE table_name='Z0CASE';
OTHER TYPE
DROP TABLE Z0CASE;
CREATE TABLE Z0CASE(Z0_TEST0 TINYINT, Z0_TEST1 SMALLINT,Z0_TEST2 MEDIUMINT	,Z0_TEST3 INT,z0_test4 BIGINT) with column group (all columns, each column);
INSERT INTO  Z0CASE (z0_test0,z0_test1,Z0_TEST2,Z0_TEST3,z0_test4)VALUES(0,0,0,0,0);
INSERT INTO  Z0CASE (z0_test0,z0_test1,Z0_TEST2,Z0_TEST3,z0_test4)VALUES(111,111,111,111,111);
INSERT INTO  Z0CASE (z0_test0,z0_test1,Z0_TEST2,Z0_TEST3,z0_test4)VALUES(127,127.333,127.333,127.333,127.333);
INSERT INTO  Z0CASE (z0_test0,z0_test1,Z0_TEST2,Z0_TEST3,z0_test4)VALUES(-3.3333,-128.333,-128.333,-128.333,-128.333);
INSERT INTO  Z0CASE (z0_test0,z0_test1,Z0_TEST2,Z0_TEST3,z0_test4)VALUES(NULL,NULL,NULL,NULL,NULL);
SELECT * FROM Z0CASE ORDER BY Z0_TEST1;
Z0_TEST0	Z0_TEST1	Z0_TEST2	Z0_TEST3	z0_test4
NULL	NULL	NULL	NULL	NULL
-3	-128	-128	-128	-128
0	0	0	0	0
111	111	111	111	111
127	127	127	127	127
SELECT table_id,table_name FROM oceanbase.__all_virtual_table WHERE table_name='Z0CASE';
ALTER TABLE Z0CASE MODIFY COLUMN z0_test0 CHAR(100) DEFAULT 0;
SELECT * FROM Z0CASE ORDER BY Z0_TEST1;
z0_test0	Z0_TEST1	Z0_TEST2	Z0_TEST3	z0_test4
NULL	NULL	NULL	NULL	NULL
-3	-128	-128	-128	-128
0	0	0	0	0
111	111	111	111	111
127	127	127	127	127
DESC Z0CASE;
Field	Type	Null	Key	Default	Extra
z0_test0	char(100)	YES		0	
Z0_TEST1	smallint(6)	YES		NULL	
Z0_TEST2	mediumint(9)	YES		NULL	
Z0_TEST3	int(11)	YES		NULL	
z0_test4	bigint(20)	YES		NULL	
SELECT table_id,table_name FROM oceanbase.__all_virtual_table WHERE table_name='Z0CASE';
ALTER TABLE Z0CASE MODIFY COLUMN z0_test1 CHAR(10)  DEFAULT 'ABC';
SELECT * FROM Z0CASE ORDER BY Z0_TEST1;
z0_test0	z0_test1	Z0_TEST2	Z0_TEST3	z0_test4
NULL	NULL	NULL	NULL	NULL
-3	-128	-128	-128	-128
0	0	0	0	0
111	111	111	111	111
127	127	127	127	127
DESC Z0CASE;
Field	Type	Null	Key	Default	Extra
z0_test0	char(100)	YES		0	
z0_test1	char(10)	YES		ABC	
Z0_TEST2	mediumint(9)	YES		NULL	
Z0_TEST3	int(11)	YES		NULL	
z0_test4	bigint(20)	YES		NULL	
SELECT table_id,table_name FROM oceanbase.__all_virtual_table WHERE table_name='Z0CASE';
ALTER TABLE Z0CASE MODIFY COLUMN z0_test2 CHAR(100) DEFAULT 0;
SELECT * FROM Z0CASE ORDER BY Z0_TEST1;
z0_test0	z0_test1	z0_test2	Z0_TEST3	z0_test4
NULL	NULL	NULL	NULL	NULL
-3	-128	-128	-128	-128
0	0	0	0	0
111	111	111	111	111
127	127	127	127	127
DESC Z0CASE;
Field	Type	Null	Key	Default	Extra
z0_test0	char(100)	YES		0	
z0_test1	char(10)	YES		ABC	
z0_test2	char(100)	YES		0	
Z0_TEST3	int(11)	YES		NULL	
z0_test4	bigint(20)	YES		NULL	
SELECT table_id,table_name FROM oceanbase.__all_virtual_table WHERE table_name='Z0CASE';
ALTER TABLE Z0CASE MODIFY COLUMN Z0_TEST3 CHAR(10)  DEFAULT null;
SELECT * FROM Z0CASE ORDER BY Z0_TEST1;
z0_test0	z0_test1	z0_test2	Z0_TEST3	z0_test4
NULL	NULL	NULL	NULL	NULL
-3	-128	-128	-128	-128
0	0	0	0	0
111	111	111	111	111
127	127	127	127	127
DESC Z0CASE;
Field	Type	Null	Key	Default	Extra
z0_test0	char(100)	YES		0	
z0_test1	char(10)	YES		ABC	
z0_test2	char(100)	YES		0	
Z0_TEST3	char(10)	YES		NULL	
z0_test4	bigint(20)	YES		NULL	
SELECT table_id,table_name FROM oceanbase.__all_virtual_table WHERE table_name='Z0CASE';
ALTER TABLE Z0CASE MODIFY COLUMN z0_test4 CHAR(100)  DEFAULT 0;
SELECT * FROM Z0CASE ORDER BY Z0_TEST1;
z0_test0	z0_test1	z0_test2	Z0_TEST3	z0_test4
NULL	NULL	NULL	NULL	NULL
-3	-128	-128	-128	-128
0	0	0	0	0
111	111	111	111	111
127	127	127	127	127
DESC Z0CASE;
Field	Type	Null	Key	Default	Extra
z0_test0	char(100)	YES		0	
z0_test1	char(10)	YES		ABC	
z0_test2	char(100)	YES		0	
Z0_TEST3	char(10)	YES		NULL	
z0_test4	char(100)	YES		0	
SELECT table_id,table_name FROM oceanbase.__all_virtual_table WHERE table_name='Z0CASE';
DROP TABLE Z0CASE;
CREATE TABLE Z0CASE(Z0_TEST0 TINYINT, Z0_TEST1 SMALLINT,Z0_TEST2 MEDIUMINT	,Z0_TEST3 INT,z0_test4 BIGINT) with column group (all columns, each column);
INSERT INTO  Z0CASE (z0_test0,z0_test1,Z0_TEST2,Z0_TEST3,z0_test4)VALUES(0,0,0,0,0);
INSERT INTO  Z0CASE (z0_test0,z0_test1,Z0_TEST2,Z0_TEST3,z0_test4)VALUES(111,111,111,111,111);
INSERT INTO  Z0CASE (z0_test0,z0_test1,Z0_TEST2,Z0_TEST3,z0_test4)VALUES(127,127.333,127.333,127.333,127.333);
INSERT INTO  Z0CASE (z0_test0,z0_test1,Z0_TEST2,Z0_TEST3,z0_test4)VALUES(-3.3333,-128.333,-128.333,-128.333,-128.333);
INSERT INTO  Z0CASE (z0_test0,z0_test1,Z0_TEST2,Z0_TEST3,z0_test4)VALUES(NULL,NULL,NULL,NULL,NULL);
SELECT * FROM Z0CASE ORDER BY Z0_TEST1;
Z0_TEST0	Z0_TEST1	Z0_TEST2	Z0_TEST3	z0_test4
NULL	NULL	NULL	NULL	NULL
-3	-128	-128	-128	-128
0	0	0	0	0
111	111	111	111	111
127	127	127	127	127
SELECT table_id,table_name FROM oceanbase.__all_virtual_table WHERE table_name='Z0CASE';
ALTER TABLE Z0CASE MODIFY COLUMN z0_test0 VARCHAR(100) DEFAULT 0;
SELECT * FROM Z0CASE ORDER BY Z0_TEST1;
z0_test0	Z0_TEST1	Z0_TEST2	Z0_TEST3	z0_test4
NULL	NULL	NULL	NULL	NULL
-3	-128	-128	-128	-128
0	0	0	0	0
111	111	111	111	111
127	127	127	127	127
DESC Z0CASE;
Field	Type	Null	Key	Default	Extra
z0_test0	varchar(100)	YES		0	
Z0_TEST1	smallint(6)	YES		NULL	
Z0_TEST2	mediumint(9)	YES		NULL	
Z0_TEST3	int(11)	YES		NULL	
z0_test4	bigint(20)	YES		NULL	
SELECT table_id,table_name FROM oceanbase.__all_virtual_table WHERE table_name='Z0CASE';
ALTER TABLE Z0CASE MODIFY COLUMN z0_test1 VARCHAR(10)  DEFAULT 'ABC';
SELECT * FROM Z0CASE ORDER BY Z0_TEST1;
z0_test0	z0_test1	Z0_TEST2	Z0_TEST3	z0_test4
NULL	NULL	NULL	NULL	NULL
-3	-128	-128	-128	-128
0	0	0	0	0
111	111	111	111	111
127	127	127	127	127
DESC Z0CASE;
Field	Type	Null	Key	Default	Extra
z0_test0	varchar(100)	YES		0	
z0_test1	varchar(10)	YES		ABC	
Z0_TEST2	mediumint(9)	YES		NULL	
Z0_TEST3	int(11)	YES		NULL	
z0_test4	bigint(20)	YES		NULL	
SELECT table_id,table_name FROM oceanbase.__all_virtual_table WHERE table_name='Z0CASE';
ALTER TABLE Z0CASE MODIFY COLUMN z0_test2 VARCHAR(100) DEFAULT 0;
SELECT * FROM Z0CASE ORDER BY Z0_TEST1;
z0_test0	z0_test1	z0_test2	Z0_TEST3	z0_test4
NULL	NULL	NULL	NULL	NULL
-3	-128	-128	-128	-128
0	0	0	0	0
111	111	111	111	111
127	127	127	127	127
DESC Z0CASE;
Field	Type	Null	Key	Default	Extra
z0_test0	varchar(100)	YES		0	
z0_test1	varchar(10)	YES		ABC	
z0_test2	varchar(100)	YES		0	
Z0_TEST3	int(11)	YES		NULL	
z0_test4	bigint(20)	YES		NULL	
SELECT table_id,table_name FROM oceanbase.__all_virtual_table WHERE table_name='Z0CASE';
ALTER TABLE Z0CASE MODIFY COLUMN Z0_TEST3 VARCHAR(10)  DEFAULT null;
SELECT * FROM Z0CASE ORDER BY Z0_TEST1;
z0_test0	z0_test1	z0_test2	Z0_TEST3	z0_test4
NULL	NULL	NULL	NULL	NULL
-3	-128	-128	-128	-128
0	0	0	0	0
111	111	111	111	111
127	127	127	127	127
DESC Z0CASE;
Field	Type	Null	Key	Default	Extra
z0_test0	varchar(100)	YES		0	
z0_test1	varchar(10)	YES		ABC	
z0_test2	varchar(100)	YES		0	
Z0_TEST3	varchar(10)	YES		NULL	
z0_test4	bigint(20)	YES		NULL	
SELECT table_id,table_name FROM oceanbase.__all_virtual_table WHERE table_name='Z0CASE';
ALTER TABLE Z0CASE MODIFY COLUMN z0_test4 VARCHAR(100)  DEFAULT 0;
SELECT * FROM Z0CASE ORDER BY Z0_TEST1;
z0_test0	z0_test1	z0_test2	Z0_TEST3	z0_test4
NULL	NULL	NULL	NULL	NULL
-3	-128	-128	-128	-128
0	0	0	0	0
111	111	111	111	111
127	127	127	127	127
DESC Z0CASE;
Field	Type	Null	Key	Default	Extra
z0_test0	varchar(100)	YES		0	
z0_test1	varchar(10)	YES		ABC	
z0_test2	varchar(100)	YES		0	
Z0_TEST3	varchar(10)	YES		NULL	
z0_test4	varchar(100)	YES		0	
SELECT table_id,table_name FROM oceanbase.__all_virtual_table WHERE table_name='Z0CASE';
DROP TABLE Z0CASE;
CREATE TABLE Z0CASE(Z0_TEST0 INT) with column group (all columns, each column);
INSERT INTO  Z0CASE (z0_test0)VALUES(0);
INSERT INTO  Z0CASE (z0_test0)VALUES(11);
此处OB报错，是BYDESIGN问题，不是bug。
ALTER TABLE Z0CASE MODIFY COLUMN z0_test0 ENUM('0','11') ;
ERROR 01000: Data truncated for argument
DROP TABLE Z0CASE;
CREATE TABLE Z0CASE(Z0_TEST0 TINYINT, Z0_TEST1 SMALLINT,Z0_TEST2 MEDIUMINT	,Z0_TEST3 INT,z0_test4 BIGINT) with column group (all columns, each column);
INSERT INTO  Z0CASE (z0_test0,z0_test1,Z0_TEST2,Z0_TEST3,z0_test4)VALUES(0,0,0,0,0);
INSERT INTO  Z0CASE (z0_test0,z0_test1,Z0_TEST2,Z0_TEST3,z0_test4)VALUES(111,111,111,111,111);
INSERT INTO  Z0CASE (z0_test0,z0_test1,Z0_TEST2,Z0_TEST3,z0_test4)VALUES(127,127.333,127.333,127.333,127.333);
INSERT INTO  Z0CASE (z0_test0,z0_test1,Z0_TEST2,Z0_TEST3,z0_test4)VALUES(-3.3333,-128.333,-128.333,-128.333,-128.333);
INSERT INTO  Z0CASE (z0_test0,z0_test1,Z0_TEST2,Z0_TEST3,z0_test4)VALUES(NULL,NULL,NULL,NULL,NULL);
SELECT * FROM Z0CASE ORDER BY Z0_TEST1;
Z0_TEST0	Z0_TEST1	Z0_TEST2	Z0_TEST3	z0_test4
NULL	NULL	NULL	NULL	NULL
-3	-128	-128	-128	-128
0	0	0	0	0
111	111	111	111	111
127	127	127	127	127
SELECT table_id,table_name FROM oceanbase.__all_virtual_table WHERE table_name='Z0CASE';
ALTER TABLE Z0CASE MODIFY COLUMN z0_test0 TINYBLOB(100);
ERROR 42000: You have an error in your SQL syntax; check the manual that corresponds to your OceanBase version for the right syntax to use near '(100)' at line 1
ALTER TABLE Z0CASE MODIFY COLUMN z0_test1 BLOB  DEFAULT null;
SELECT * FROM Z0CASE ORDER BY Z0_TEST1;
Z0_TEST0	z0_test1	Z0_TEST2	Z0_TEST3	z0_test4
NULL	NULL	NULL	NULL	NULL
-3	-128	-128	-128	-128
0	0	0	0	0
111	111	111	111	111
127	127	127	127	127
DESC Z0CASE;
Field	Type	Null	Key	Default	Extra
Z0_TEST0	tinyint(4)	YES		NULL	
z0_test1	blob	YES		NULL	
Z0_TEST2	mediumint(9)	YES		NULL	
Z0_TEST3	int(11)	YES		NULL	
z0_test4	bigint(20)	YES		NULL	
SELECT table_id,table_name FROM oceanbase.__all_virtual_table WHERE table_name='Z0CASE';
ALTER TABLE Z0CASE MODIFY COLUMN z0_test2 BLOB(100) DEFAULT null;
SELECT * FROM Z0CASE ORDER BY Z0_TEST1;
Z0_TEST0	z0_test1	z0_test2	Z0_TEST3	z0_test4
NULL	NULL	NULL	NULL	NULL
-3	-128	-128	-128	-128
0	0	0	0	0
111	111	111	111	111
127	127	127	127	127
DESC Z0CASE;
Field	Type	Null	Key	Default	Extra
Z0_TEST0	tinyint(4)	YES		NULL	
z0_test1	blob	YES		NULL	
z0_test2	tinyblob	YES		NULL	
Z0_TEST3	int(11)	YES		NULL	
z0_test4	bigint(20)	YES		NULL	
SELECT table_id,table_name FROM oceanbase.__all_virtual_table WHERE table_name='Z0CASE';
ALTER TABLE Z0CASE MODIFY COLUMN Z0_TEST3 BLOB(10)  DEFAULT null;
SELECT * FROM Z0CASE ORDER BY Z0_TEST1;
Z0_TEST0	z0_test1	z0_test2	Z0_TEST3	z0_test4
NULL	NULL	NULL	NULL	NULL
-3	-128	-128	-128	-128
0	0	0	0	0
111	111	111	111	111
127	127	127	127	127
DESC Z0CASE;
Field	Type	Null	Key	Default	Extra
Z0_TEST0	tinyint(4)	YES		NULL	
z0_test1	blob	YES		NULL	
z0_test2	tinyblob	YES		NULL	
Z0_TEST3	tinyblob	YES		NULL	
z0_test4	bigint(20)	YES		NULL	
SELECT table_id,table_name FROM oceanbase.__all_virtual_table WHERE table_name='Z0CASE';
ALTER TABLE Z0CASE MODIFY COLUMN z0_test4 LONGBLOB(100)  DEFAULT null;
ERROR 42000: You have an error in your SQL syntax; check the manual that corresponds to your OceanBase version for the right syntax to use near '(100)  DEFAULT null' at line 1
DROP TABLE Z0CASE;
CREATE TABLE Z0CASE(Z0_TEST0 TINYINT, Z0_TEST1 SMALLINT,Z0_TEST2 MEDIUMINT	,Z0_TEST3 INT,z0_test4 BIGINT) with column group (all columns, each column);
INSERT INTO  Z0CASE (z0_test0,z0_test1,Z0_TEST2,Z0_TEST3,z0_test4)VALUES(0,0,0,0,0);
INSERT INTO  Z0CASE (z0_test0,z0_test1,Z0_TEST2,Z0_TEST3,z0_test4)VALUES(111,111,111,111,111);
INSERT INTO  Z0CASE (z0_test0,z0_test1,Z0_TEST2,Z0_TEST3,z0_test4)VALUES(127,127.333,127.333,127.333,127.333);
INSERT INTO  Z0CASE (z0_test0,z0_test1,Z0_TEST2,Z0_TEST3,z0_test4)VALUES(-3.3333,-128.333,-128.333,-128.333,-128.333);
INSERT INTO  Z0CASE (z0_test0,z0_test1,Z0_TEST2,Z0_TEST3,z0_test4)VALUES(NULL,NULL,NULL,NULL,NULL);
SELECT * FROM Z0CASE ORDER BY Z0_TEST1;
Z0_TEST0	Z0_TEST1	Z0_TEST2	Z0_TEST3	z0_test4
NULL	NULL	NULL	NULL	NULL
-3	-128	-128	-128	-128
0	0	0	0	0
111	111	111	111	111
127	127	127	127	127
SELECT table_id,table_name FROM oceanbase.__all_virtual_table WHERE table_name='Z0CASE';
ALTER TABLE Z0CASE MODIFY COLUMN z0_test0 DATE ;
ERROR 22007: Incorrect value
ALTER TABLE Z0CASE MODIFY COLUMN z0_test1 TIME DEFAULT null;
SELECT * FROM Z0CASE ORDER BY Z0_TEST1;
Z0_TEST0	z0_test1	Z0_TEST2	Z0_TEST3	z0_test4
NULL	NULL	NULL	NULL	NULL
-3	-00:01:28	-128	-128	-128
0	00:00:00	0	0	0
111	00:01:11	111	111	111
127	00:01:27	127	127	127
DESC Z0CASE;
Field	Type	Null	Key	Default	Extra
Z0_TEST0	tinyint(4)	YES		NULL	
z0_test1	time	YES		NULL	
Z0_TEST2	mediumint(9)	YES		NULL	
Z0_TEST3	int(11)	YES		NULL	
z0_test4	bigint(20)	YES		NULL	
SELECT table_id,table_name FROM oceanbase.__all_virtual_table WHERE table_name='Z0CASE';
ALTER TABLE Z0CASE MODIFY COLUMN z0_test2 YEAR DEFAULT null;
ERROR 22003: Out of range value for column
ALTER TABLE Z0CASE MODIFY COLUMN Z0_TEST3 DATETIME DEFAULT null;
ERROR 22007: Incorrect value
ALTER TABLE Z0CASE MODIFY COLUMN z0_test4 TIMESTAMP DEFAULT null;
ERROR 22007: Incorrect value
FLOAT/DOUBLE/DECIMAL
FLOAT
DROP TABLE Z0CASE;
CREATE TABLE Z0CASE(Z0_TEST0 FLOAT, Z0_TEST1 FLOAT(30,0),Z0_TEST2 FLOAT) with column group (all columns, each column);
INSERT INTO  Z0CASE (z0_test0,z0_test1,Z0_TEST2)VALUES(0,0,0);
INSERT INTO  Z0CASE (z0_test0,z0_test1,Z0_TEST2)VALUES(111,111,111);
INSERT INTO  Z0CASE (z0_test0,z0_test1,Z0_TEST2)VALUES(127,127.333,127.333);
INSERT INTO  Z0CASE (z0_test0,z0_test1,Z0_TEST2)VALUES(-3.3333,-128.333,-128.333);
INSERT INTO  Z0CASE (z0_test0,z0_test1,Z0_TEST2)VALUES(NULL,NULL,NULL);
SELECT * FROM Z0CASE ORDER BY Z0_TEST1;
Z0_TEST0	Z0_TEST1	Z0_TEST2
NULL	NULL	NULL
-3.3333	-128	-128.333
0	0	0
111	111	111
127	127	127.333
SELECT table_id,table_name FROM oceanbase.__all_virtual_table WHERE table_name='Z0CASE';
ALTER TABLE Z0CASE MODIFY COLUMN z0_test0 FLOAT(32,0) ;
SELECT * FROM Z0CASE ORDER BY Z0_TEST1;
z0_test0	Z0_TEST1	Z0_TEST2
NULL	NULL	NULL
-3	-128	-128.333
0	0	0
111	111	111
127	127	127.333
DESC Z0CASE;
Field	Type	Null	Key	Default	Extra
z0_test0	float(32,0)	YES		NULL	
Z0_TEST1	float(30,0)	YES		NULL	
Z0_TEST2	float	YES		NULL	
SELECT table_id,table_name FROM oceanbase.__all_virtual_table WHERE table_name='Z0CASE';
ALTER TABLE Z0CASE MODIFY COLUMN z0_test0 FLOAT(32,0) ;
SELECT * FROM Z0CASE ORDER BY Z0_TEST1;
z0_test0	Z0_TEST1	Z0_TEST2
NULL	NULL	NULL
-3	-128	-128.333
0	0	0
111	111	111
127	127	127.333
DESC Z0CASE;
Field	Type	Null	Key	Default	Extra
z0_test0	float(32,0)	YES		NULL	
Z0_TEST1	float(30,0)	YES		NULL	
Z0_TEST2	float	YES		NULL	
SELECT table_id,table_name FROM oceanbase.__all_virtual_table WHERE table_name='Z0CASE';
ALTER TABLE Z0CASE MODIFY COLUMN z0_test0 FLOAT(25) ;
SELECT * FROM Z0CASE ORDER BY Z0_TEST1;
z0_test0	Z0_TEST1	Z0_TEST2
NULL	NULL	NULL
-3	-128	-128.333
0	0	0
111	111	111
127	127	127.333
DESC Z0CASE;
Field	Type	Null	Key	Default	Extra
z0_test0	double	YES		NULL	
Z0_TEST1	float(30,0)	YES		NULL	
Z0_TEST2	float	YES		NULL	
SELECT table_id,table_name FROM oceanbase.__all_virtual_table WHERE table_name='Z0CASE';
ALTER TABLE Z0CASE MODIFY COLUMN z0_test0 FLOAT(0) ;
SELECT * FROM Z0CASE ORDER BY Z0_TEST1;
z0_test0	Z0_TEST1	Z0_TEST2
NULL	NULL	NULL
-3	-128	-128.333
0	0	0
111	111	111
127	127	127.333
DESC Z0CASE;
Field	Type	Null	Key	Default	Extra
z0_test0	float	YES		NULL	
Z0_TEST1	float(30,0)	YES		NULL	
Z0_TEST2	float	YES		NULL	
SELECT table_id,table_name FROM oceanbase.__all_virtual_table WHERE table_name='Z0CASE';
ALTER TABLE Z0CASE MODIFY COLUMN z0_test0 FLOAT(32,0) ;
SELECT * FROM Z0CASE ORDER BY Z0_TEST1;
z0_test0	Z0_TEST1	Z0_TEST2
NULL	NULL	NULL
-3	-128	-128.333
0	0	0
111	111	111
127	127	127.333
DESC Z0CASE;
Field	Type	Null	Key	Default	Extra
z0_test0	float(32,0)	YES		NULL	
Z0_TEST1	float(30,0)	YES		NULL	
Z0_TEST2	float	YES		NULL	
SELECT table_id,table_name FROM oceanbase.__all_virtual_table WHERE table_name='Z0CASE';
ALTER TABLE Z0CASE MODIFY COLUMN z0_test0 FLOAT(32,0) ;
SELECT * FROM Z0CASE ORDER BY Z0_TEST1;
z0_test0	Z0_TEST1	Z0_TEST2
NULL	NULL	NULL
-3	-128	-128.333
0	0	0
111	111	111
127	127	127.333
DESC Z0CASE;
Field	Type	Null	Key	Default	Extra
z0_test0	float(32,0)	YES		NULL	
Z0_TEST1	float(30,0)	YES		NULL	
Z0_TEST2	float	YES		NULL	
SELECT table_id,table_name FROM oceanbase.__all_virtual_table WHERE table_name='Z0CASE';
DROP TABLE Z0CASE;
CREATE TABLE Z0CASE(Z0_TEST0 FLOAT, Z0_TEST1 FLOAT(30,0),Z0_TEST2 FLOAT) with column group (all columns, each column);
INSERT INTO  Z0CASE (z0_test0,z0_test1,Z0_TEST2)VALUES(0,0,0);
INSERT INTO  Z0CASE (z0_test0,z0_test1,Z0_TEST2)VALUES(111,111,111);
INSERT INTO  Z0CASE (z0_test0,z0_test1,Z0_TEST2)VALUES(127,127.333,127.333);
INSERT INTO  Z0CASE (z0_test0,z0_test1,Z0_TEST2)VALUES(-3.3333,-128.333,-128.333);
INSERT INTO  Z0CASE (z0_test0,z0_test1,Z0_TEST2)VALUES(NULL,NULL,NULL);
SELECT * FROM Z0CASE ORDER BY Z0_TEST1;
Z0_TEST0	Z0_TEST1	Z0_TEST2
NULL	NULL	NULL
-3.3333	-128	-128.333
0	0	0
111	111	111
127	127	127.333
SELECT table_id,table_name FROM oceanbase.__all_virtual_table WHERE table_name='Z0CASE';
ALTER TABLE Z0CASE MODIFY COLUMN z0_test0 DOUBLE(32,0) ;
SELECT * FROM Z0CASE ORDER BY Z0_TEST1;
z0_test0	Z0_TEST1	Z0_TEST2
NULL	NULL	NULL
-3	-128	-128.333
0	0	0
111	111	111
127	127	127.333
DESC Z0CASE;
Field	Type	Null	Key	Default	Extra
z0_test0	double(32,0)	YES		NULL	
Z0_TEST1	float(30,0)	YES		NULL	
Z0_TEST2	float	YES		NULL	
SELECT table_id,table_name FROM oceanbase.__all_virtual_table WHERE table_name='Z0CASE';
ALTER TABLE Z0CASE MODIFY COLUMN Z0_TEST1 DOUBLE(30,0) ;
SELECT * FROM Z0CASE ORDER BY Z0_TEST1;
z0_test0	Z0_TEST1	Z0_TEST2
NULL	NULL	NULL
-3	-128	-128.333
0	0	0
111	111	111
127	127	127.333
DESC Z0CASE;
Field	Type	Null	Key	Default	Extra
z0_test0	double(32,0)	YES		NULL	
Z0_TEST1	double(30,0)	YES		NULL	
Z0_TEST2	float	YES		NULL	
SELECT table_id,table_name FROM oceanbase.__all_virtual_table WHERE table_name='Z0CASE';
ALTER TABLE Z0CASE MODIFY COLUMN Z0_TEST1 DOUBLE(25,0) ;
SELECT * FROM Z0CASE ORDER BY Z0_TEST1;
z0_test0	Z0_TEST1	Z0_TEST2
NULL	NULL	NULL
-3	-128	-128.333
0	0	0
111	111	111
127	127	127.333
DESC Z0CASE;
Field	Type	Null	Key	Default	Extra
z0_test0	double(32,0)	YES		NULL	
Z0_TEST1	double(25,0)	YES		NULL	
Z0_TEST2	float	YES		NULL	
SELECT table_id,table_name FROM oceanbase.__all_virtual_table WHERE table_name='Z0CASE';
ALTER TABLE Z0CASE MODIFY COLUMN Z0_TEST2 DOUBLE(0,0) ;
ERROR 42000: Display width out of range for column 'Z0_TEST2' (max = 255)
SELECT * FROM Z0CASE ORDER BY Z0_TEST1;
z0_test0	Z0_TEST1	Z0_TEST2
NULL	NULL	NULL
-3	-128	-128.333
0	0	0
111	111	111
127	127	127.333
DESC Z0CASE;
Field	Type	Null	Key	Default	Extra
z0_test0	double(32,0)	YES		NULL	
Z0_TEST1	double(25,0)	YES		NULL	
Z0_TEST2	float	YES		NULL	
SELECT table_id,table_name FROM oceanbase.__all_virtual_table WHERE table_name='Z0CASE';
ALTER TABLE Z0CASE MODIFY COLUMN Z0_TEST2 DOUBLE(32,0) ;
SELECT * FROM Z0CASE ORDER BY Z0_TEST1;
z0_test0	Z0_TEST1	Z0_TEST2
NULL	NULL	NULL
-3	-128	-128
0	0	0
111	111	111
127	127	127
DESC Z0CASE;
Field	Type	Null	Key	Default	Extra
z0_test0	double(32,0)	YES		NULL	
Z0_TEST1	double(25,0)	YES		NULL	
Z0_TEST2	double(32,0)	YES		NULL	
SELECT table_id,table_name FROM oceanbase.__all_virtual_table WHERE table_name='Z0CASE';
ALTER TABLE Z0CASE MODIFY COLUMN Z0_TEST2 DOUBLE(32,0) ;
SELECT * FROM Z0CASE ORDER BY Z0_TEST1;
z0_test0	Z0_TEST1	Z0_TEST2
NULL	NULL	NULL
-3	-128	-128
0	0	0
111	111	111
127	127	127
DESC Z0CASE;
Field	Type	Null	Key	Default	Extra
z0_test0	double(32,0)	YES		NULL	
Z0_TEST1	double(25,0)	YES		NULL	
Z0_TEST2	double(32,0)	YES		NULL	
SELECT table_id,table_name FROM oceanbase.__all_virtual_table WHERE table_name='Z0CASE';
DROP TABLE Z0CASE;
CREATE TABLE Z0CASE(Z0_TEST0 FLOAT, Z0_TEST1 FLOAT(30,0),Z0_TEST2 FLOAT) with column group (all columns, each column);
INSERT INTO  Z0CASE (z0_test0,z0_test1,Z0_TEST2)VALUES(0,0,0);
INSERT INTO  Z0CASE (z0_test0,z0_test1,Z0_TEST2)VALUES(111,111,111);
INSERT INTO  Z0CASE (z0_test0,z0_test1,Z0_TEST2)VALUES(127,127.333,127.333);
INSERT INTO  Z0CASE (z0_test0,z0_test1,Z0_TEST2)VALUES(-3.3333,-128.333,-128.333);
INSERT INTO  Z0CASE (z0_test0,z0_test1,Z0_TEST2)VALUES(NULL,NULL,NULL);
SELECT * FROM Z0CASE ORDER BY Z0_TEST1;
Z0_TEST0	Z0_TEST1	Z0_TEST2
NULL	NULL	NULL
-3.3333	-128	-128.333
0	0	0
111	111	111
127	127	127.333
SELECT table_id,table_name FROM oceanbase.__all_virtual_table WHERE table_name='Z0CASE';
ALTER TABLE Z0CASE MODIFY COLUMN z0_test0 DECIMAL(32) ;
SELECT * FROM Z0CASE ORDER BY Z0_TEST1;
z0_test0	Z0_TEST1	Z0_TEST2
NULL	NULL	NULL
-3	-128	-128.333
0	0	0
111	111	111
127	127	127.333
DESC Z0CASE;
Field	Type	Null	Key	Default	Extra
z0_test0	decimal(32,0)	YES		NULL	
Z0_TEST1	float(30,0)	YES		NULL	
Z0_TEST2	float	YES		NULL	
SELECT table_id,table_name FROM oceanbase.__all_virtual_table WHERE table_name='Z0CASE';
ALTER TABLE Z0CASE MODIFY COLUMN Z0_TEST1 DECIMAL(10,0) ;
SELECT * FROM Z0CASE ORDER BY Z0_TEST1;
z0_test0	Z0_TEST1	Z0_TEST2
NULL	NULL	NULL
-3	-128	-128.333
0	0	0
111	111	111
127	127	127.333
DESC Z0CASE;
Field	Type	Null	Key	Default	Extra
z0_test0	decimal(32,0)	YES		NULL	
Z0_TEST1	decimal(10,0)	YES		NULL	
Z0_TEST2	float	YES		NULL	
SELECT table_id,table_name FROM oceanbase.__all_virtual_table WHERE table_name='Z0CASE';
ALTER TABLE Z0CASE MODIFY COLUMN Z0_TEST1 DECIMAL(10) ;
SELECT * FROM Z0CASE ORDER BY Z0_TEST1;
z0_test0	Z0_TEST1	Z0_TEST2
NULL	NULL	NULL
-3	-128	-128.333
0	0	0
111	111	111
127	127	127.333
DESC Z0CASE;
Field	Type	Null	Key	Default	Extra
z0_test0	decimal(32,0)	YES		NULL	
Z0_TEST1	decimal(10,0)	YES		NULL	
Z0_TEST2	float	YES		NULL	
SELECT table_id,table_name FROM oceanbase.__all_virtual_table WHERE table_name='Z0CASE';
ALTER TABLE Z0CASE MODIFY COLUMN Z0_TEST2 DECIMAL(32,2) ;
SELECT * FROM Z0CASE ORDER BY Z0_TEST1;
z0_test0	Z0_TEST1	Z0_TEST2
NULL	NULL	NULL
-3	-128	-128.33
0	0	0.00
111	111	111.00
127	127	127.33
DESC Z0CASE;
Field	Type	Null	Key	Default	Extra
z0_test0	decimal(32,0)	YES		NULL	
Z0_TEST1	decimal(10,0)	YES		NULL	
Z0_TEST2	decimal(32,2)	YES		NULL	
SELECT table_id,table_name FROM oceanbase.__all_virtual_table WHERE table_name='Z0CASE';
DOUBLE
DROP TABLE Z0CASE;
CREATE TABLE Z0CASE(Z0_TEST0 DOUBLE(10,0), Z0_TEST1 DOUBLE(30,0),Z0_TEST2 DOUBLE) with column group (all columns, each column);
INSERT INTO  Z0CASE (z0_test0,z0_test1,Z0_TEST2)VALUES(0,0,0);
INSERT INTO  Z0CASE (z0_test0,z0_test1,Z0_TEST2)VALUES(111,111,111);
INSERT INTO  Z0CASE (z0_test0,z0_test1,Z0_TEST2)VALUES(127,127.333,127.333);
INSERT INTO  Z0CASE (z0_test0,z0_test1,Z0_TEST2)VALUES(-3.3333,-128.333,-128.333);
INSERT INTO  Z0CASE (z0_test0,z0_test1,Z0_TEST2)VALUES(NULL,NULL,NULL);
SELECT * FROM Z0CASE ORDER BY Z0_TEST1;
Z0_TEST0	Z0_TEST1	Z0_TEST2
NULL	NULL	NULL
-3	-128	-128.333
0	0	0
111	111	111
127	127	127.333
SELECT table_id,table_name FROM oceanbase.__all_virtual_table WHERE table_name='Z0CASE';
ALTER TABLE Z0CASE MODIFY COLUMN z0_test0 DOUBLE(32,0) ;
SELECT * FROM Z0CASE ORDER BY Z0_TEST1;
z0_test0	Z0_TEST1	Z0_TEST2
NULL	NULL	NULL
-3	-128	-128.333
0	0	0
111	111	111
127	127	127.333
DESC Z0CASE;
Field	Type	Null	Key	Default	Extra
z0_test0	double(32,0)	YES		NULL	
Z0_TEST1	double(30,0)	YES		NULL	
Z0_TEST2	double	YES		NULL	
SELECT table_id,table_name FROM oceanbase.__all_virtual_table WHERE table_name='Z0CASE';
ALTER TABLE Z0CASE MODIFY COLUMN z0_test0 DOUBLE(30,0) ;
SELECT * FROM Z0CASE ORDER BY Z0_TEST1;
z0_test0	Z0_TEST1	Z0_TEST2
NULL	NULL	NULL
-3	-128	-128.333
0	0	0
111	111	111
127	127	127.333
DESC Z0CASE;
Field	Type	Null	Key	Default	Extra
z0_test0	double(30,0)	YES		NULL	
Z0_TEST1	double(30,0)	YES		NULL	
Z0_TEST2	double	YES		NULL	
SELECT table_id,table_name FROM oceanbase.__all_virtual_table WHERE table_name='Z0CASE';
ALTER TABLE Z0CASE MODIFY COLUMN Z0_TEST1 DOUBLE(25,0) ;
SELECT * FROM Z0CASE ORDER BY Z0_TEST1;
z0_test0	Z0_TEST1	Z0_TEST2
NULL	NULL	NULL
-3	-128	-128.333
0	0	0
111	111	111
127	127	127.333
DESC Z0CASE;
Field	Type	Null	Key	Default	Extra
z0_test0	double(30,0)	YES		NULL	
Z0_TEST1	double(25,0)	YES		NULL	
Z0_TEST2	double	YES		NULL	
SELECT table_id,table_name FROM oceanbase.__all_virtual_table WHERE table_name='Z0CASE';
ALTER TABLE Z0CASE MODIFY COLUMN z0_test0 DOUBLE(0,0) ;
ERROR 42000: Display width out of range for column 'z0_test0' (max = 255)
SELECT * FROM Z0CASE ORDER BY Z0_TEST1;
z0_test0	Z0_TEST1	Z0_TEST2
NULL	NULL	NULL
-3	-128	-128.333
0	0	0
111	111	111
127	127	127.333
DESC Z0CASE;
Field	Type	Null	Key	Default	Extra
z0_test0	double(30,0)	YES		NULL	
Z0_TEST1	double(25,0)	YES		NULL	
Z0_TEST2	double	YES		NULL	
SELECT table_id,table_name FROM oceanbase.__all_virtual_table WHERE table_name='Z0CASE';
DROP TABLE Z0CASE;
CREATE TABLE Z0CASE(Z0_TEST0 DOUBLE(10,0), Z0_TEST1 DOUBLE(30,0),Z0_TEST2 DOUBLE) with column group (all columns, each column);
INSERT INTO  Z0CASE (z0_test0,z0_test1,Z0_TEST2)VALUES(0,0,0);
INSERT INTO  Z0CASE (z0_test0,z0_test1,Z0_TEST2)VALUES(111,111,111);
INSERT INTO  Z0CASE (z0_test0,z0_test1,Z0_TEST2)VALUES(127,127.333,127.333);
INSERT INTO  Z0CASE (z0_test0,z0_test1,Z0_TEST2)VALUES(-3.3333,-128.333,-128.333);
INSERT INTO  Z0CASE (z0_test0,z0_test1,Z0_TEST2)VALUES(NULL,NULL,NULL);
SELECT * FROM Z0CASE;
Z0_TEST0	Z0_TEST1	Z0_TEST2
0	0	0
111	111	111
127	127	127.333
-3	-128	-128.333
NULL	NULL	NULL
SELECT table_id,table_name FROM oceanbase.__all_virtual_table WHERE table_name='Z0CASE';
ALTER TABLE Z0CASE MODIFY COLUMN z0_test0 FLOAT(10) ;
SELECT * FROM Z0CASE ORDER BY Z0_TEST1;
z0_test0	Z0_TEST1	Z0_TEST2
NULL	NULL	NULL
-3	-128	-128.333
0	0	0
111	111	111
127	127	127.333
DESC Z0CASE;
Field	Type	Null	Key	Default	Extra
z0_test0	float	YES		NULL	
Z0_TEST1	double(30,0)	YES		NULL	
Z0_TEST2	double	YES		NULL	
SELECT table_id,table_name FROM oceanbase.__all_virtual_table WHERE table_name='Z0CASE';
ALTER TABLE Z0CASE MODIFY COLUMN Z0_TEST1 FLOAT(30) ;
SELECT * FROM Z0CASE ORDER BY Z0_TEST1;
z0_test0	Z0_TEST1	Z0_TEST2
NULL	NULL	NULL
-3	-128	-128.333
0	0	0
111	111	111
127	127	127.333
DESC Z0CASE;
Field	Type	Null	Key	Default	Extra
z0_test0	float	YES		NULL	
Z0_TEST1	double	YES		NULL	
Z0_TEST2	double	YES		NULL	
SELECT table_id,table_name FROM oceanbase.__all_virtual_table WHERE table_name='Z0CASE';
ALTER TABLE Z0CASE MODIFY COLUMN Z0_TEST2 FLOAT(25) ;
SELECT * FROM Z0CASE ORDER BY Z0_TEST1;
z0_test0	Z0_TEST1	Z0_TEST2
NULL	NULL	NULL
-3	-128	-128.333
0	0	0
111	111	111
127	127	127.333
DESC Z0CASE;
Field	Type	Null	Key	Default	Extra
z0_test0	float	YES		NULL	
Z0_TEST1	double	YES		NULL	
Z0_TEST2	double	YES		NULL	
SELECT table_id,table_name FROM oceanbase.__all_virtual_table WHERE table_name='Z0CASE';
ALTER TABLE Z0CASE MODIFY COLUMN Z0_TEST2 FLOAT(24) ;
SELECT * FROM Z0CASE ORDER BY Z0_TEST1;
z0_test0	Z0_TEST1	Z0_TEST2
NULL	NULL	NULL
-3	-128	-128.333
0	0	0
111	111	111
127	127	127.333
DESC Z0CASE;
Field	Type	Null	Key	Default	Extra
z0_test0	float	YES		NULL	
Z0_TEST1	double	YES		NULL	
Z0_TEST2	float	YES		NULL	
SELECT table_id,table_name FROM oceanbase.__all_virtual_table WHERE table_name='Z0CASE';
DROP TABLE Z0CASE;
CREATE TABLE Z0CASE(Z0_TEST0 DOUBLE, Z0_TEST1 DOUBLE(30,0),Z0_TEST2 DOUBLE) with column group (all columns, each column);
INSERT INTO  Z0CASE (z0_test0,z0_test1,Z0_TEST2)VALUES(0,0,0);
INSERT INTO  Z0CASE (z0_test0,z0_test1,Z0_TEST2)VALUES(111,111,111);
INSERT INTO  Z0CASE (z0_test0,z0_test1,Z0_TEST2)VALUES(127,127.333,127.333);
INSERT INTO  Z0CASE (z0_test0,z0_test1,Z0_TEST2)VALUES(-3.3333,-128.333,-128.333);
INSERT INTO  Z0CASE (z0_test0,z0_test1,Z0_TEST2)VALUES(NULL,NULL,NULL);
SELECT * FROM Z0CASE ORDER BY Z0_TEST1;
Z0_TEST0	Z0_TEST1	Z0_TEST2
NULL	NULL	NULL
-3.3333	-128	-128.333
0	0	0
111	111	111
127	127	127.333
SELECT table_id,table_name FROM oceanbase.__all_virtual_table WHERE table_name='Z0CASE';
ALTER TABLE Z0CASE MODIFY COLUMN z0_test0 DECIMAL ;
SELECT * FROM Z0CASE ORDER BY Z0_TEST1;
z0_test0	Z0_TEST1	Z0_TEST2
NULL	NULL	NULL
-3	-128	-128.333
0	0	0
111	111	111
127	127	127.333
DESC Z0CASE;
Field	Type	Null	Key	Default	Extra
z0_test0	decimal(10,0)	YES		NULL	
Z0_TEST1	double(30,0)	YES		NULL	
Z0_TEST2	double	YES		NULL	
SELECT table_id,table_name FROM oceanbase.__all_virtual_table WHERE table_name='Z0CASE';
ALTER TABLE Z0CASE MODIFY COLUMN Z0_TEST1 DECIMAL(30,0) ;
SELECT * FROM Z0CASE ORDER BY Z0_TEST1;
z0_test0	Z0_TEST1	Z0_TEST2
NULL	NULL	NULL
-3	-128	-128.333
0	0	0
111	111	111
127	127	127.333
DESC Z0CASE;
Field	Type	Null	Key	Default	Extra
z0_test0	decimal(10,0)	YES		NULL	
Z0_TEST1	decimal(30,0)	YES		NULL	
Z0_TEST2	double	YES		NULL	
SELECT table_id,table_name FROM oceanbase.__all_virtual_table WHERE table_name='Z0CASE';
ALTER TABLE Z0CASE MODIFY COLUMN Z0_TEST1 DECIMAL(10) ;
SELECT * FROM Z0CASE ORDER BY Z0_TEST1;
z0_test0	Z0_TEST1	Z0_TEST2
NULL	NULL	NULL
-3	-128	-128.333
0	0	0
111	111	111
127	127	127.333
DESC Z0CASE;
Field	Type	Null	Key	Default	Extra
z0_test0	decimal(10,0)	YES		NULL	
Z0_TEST1	decimal(10,0)	YES		NULL	
Z0_TEST2	double	YES		NULL	
SELECT table_id,table_name FROM oceanbase.__all_virtual_table WHERE table_name='Z0CASE';
ALTER TABLE Z0CASE MODIFY COLUMN Z0_TEST2 DECIMAL(32,2) ;
SELECT * FROM Z0CASE ORDER BY Z0_TEST1;
z0_test0	Z0_TEST1	Z0_TEST2
NULL	NULL	NULL
-3	-128	-128.33
0	0	0.00
111	111	111.00
127	127	127.33
DESC Z0CASE;
Field	Type	Null	Key	Default	Extra
z0_test0	decimal(10,0)	YES		NULL	
Z0_TEST1	decimal(10,0)	YES		NULL	
Z0_TEST2	decimal(32,2)	YES		NULL	
SELECT table_id,table_name FROM oceanbase.__all_virtual_table WHERE table_name='Z0CASE';
DECIMAL
DROP TABLE Z0CASE;
CREATE TABLE Z0CASE(Z0_TEST0 DECIMAL(10), Z0_TEST1 DECIMAL(30,10),Z0_TEST2 DECIMAL) with column group (all columns, each column);
INSERT INTO  Z0CASE (z0_test0,z0_test1,Z0_TEST2)VALUES(0,0,0);
INSERT INTO  Z0CASE (z0_test0,z0_test1,Z0_TEST2)VALUES(111,111,111);
INSERT INTO  Z0CASE (z0_test0,z0_test1,Z0_TEST2)VALUES(127,127.333,127.333);
Warnings:
Warning	1265	Data truncated for column 'Z0_TEST2' at row 1
INSERT INTO  Z0CASE (z0_test0,z0_test1,Z0_TEST2)VALUES(-3.3333,-128.333,-128.333);
Warnings:
Warning	1265	Data truncated for column 'Z0_TEST0' at row 1
Warning	1265	Data truncated for column 'Z0_TEST2' at row 1
INSERT INTO  Z0CASE (z0_test0,z0_test1,Z0_TEST2)VALUES(NULL,NULL,NULL);
SELECT * FROM Z0CASE ORDER BY Z0_TEST1;
Z0_TEST0	Z0_TEST1	Z0_TEST2
NULL	NULL	NULL
-3	-128.3330000000	-128
0	0.0000000000	0
111	111.0000000000	111
127	127.3330000000	127
SELECT table_id,table_name FROM oceanbase.__all_virtual_table WHERE table_name='Z0CASE';
ALTER TABLE Z0CASE MODIFY COLUMN z0_test0 DECIMAL(32,0) ;
SELECT * FROM Z0CASE ORDER BY Z0_TEST1;
z0_test0	Z0_TEST1	Z0_TEST2
NULL	NULL	NULL
-3	-128.3330000000	-128
0	0.0000000000	0
111	111.0000000000	111
127	127.3330000000	127
DESC Z0CASE;
Field	Type	Null	Key	Default	Extra
z0_test0	decimal(32,0)	YES		NULL	
Z0_TEST1	decimal(30,10)	YES		NULL	
Z0_TEST2	decimal(10,0)	YES		NULL	
SELECT table_id,table_name FROM oceanbase.__all_virtual_table WHERE table_name='Z0CASE';
ALTER TABLE Z0CASE MODIFY COLUMN z0_test0 DECIMAL(30,0) ;
SELECT * FROM Z0CASE ORDER BY Z0_TEST1;
z0_test0	Z0_TEST1	Z0_TEST2
NULL	NULL	NULL
-3	-128.3330000000	-128
0	0.0000000000	0
111	111.0000000000	111
127	127.3330000000	127
DESC Z0CASE;
Field	Type	Null	Key	Default	Extra
z0_test0	decimal(30,0)	YES		NULL	
Z0_TEST1	decimal(30,10)	YES		NULL	
Z0_TEST2	decimal(10,0)	YES		NULL	
SELECT table_id,table_name FROM oceanbase.__all_virtual_table WHERE table_name='Z0CASE';
ALTER TABLE Z0CASE MODIFY COLUMN Z0_TEST1 DECIMAL(30,10) ;
SELECT * FROM Z0CASE ORDER BY Z0_TEST1;
z0_test0	Z0_TEST1	Z0_TEST2
NULL	NULL	NULL
-3	-128.3330000000	-128
0	0.0000000000	0
111	111.0000000000	111
127	127.3330000000	127
DESC Z0CASE;
Field	Type	Null	Key	Default	Extra
z0_test0	decimal(30,0)	YES		NULL	
Z0_TEST1	decimal(30,10)	YES		NULL	
Z0_TEST2	decimal(10,0)	YES		NULL	
SELECT table_id,table_name FROM oceanbase.__all_virtual_table WHERE table_name='Z0CASE';
ALTER TABLE Z0CASE MODIFY COLUMN Z0_TEST1 DECIMAL(25,0) ;
SELECT * FROM Z0CASE ORDER BY Z0_TEST1;
z0_test0	Z0_TEST1	Z0_TEST2
NULL	NULL	NULL
-3	-128	-128
0	0	0
111	111	111
127	127	127
DESC Z0CASE;
Field	Type	Null	Key	Default	Extra
z0_test0	decimal(30,0)	YES		NULL	
Z0_TEST1	decimal(25,0)	YES		NULL	
Z0_TEST2	decimal(10,0)	YES		NULL	
SELECT table_id,table_name FROM oceanbase.__all_virtual_table WHERE table_name='Z0CASE';
ALTER TABLE Z0CASE MODIFY COLUMN Z0_TEST2 DECIMAL(0) ;
SELECT * FROM Z0CASE ORDER BY Z0_TEST1;
z0_test0	Z0_TEST1	Z0_TEST2
NULL	NULL	NULL
-3	-128	-128
0	0	0
111	111	111
127	127	127
DESC Z0CASE;
Field	Type	Null	Key	Default	Extra
z0_test0	decimal(30,0)	YES		NULL	
Z0_TEST1	decimal(25,0)	YES		NULL	
Z0_TEST2	decimal(10,0)	YES		NULL	
SELECT table_id,table_name FROM oceanbase.__all_virtual_table WHERE table_name='Z0CASE';
DROP TABLE Z0CASE;
CREATE TABLE Z0CASE(Z0_TEST0 DECIMAL(10), Z0_TEST1 DECIMAL(30,10),Z0_TEST2 DECIMAL) with column group (all columns, each column);
INSERT INTO  Z0CASE (z0_test0,z0_test1,Z0_TEST2)VALUES(0,0,0);
INSERT INTO  Z0CASE (z0_test0,z0_test1,Z0_TEST2)VALUES(111,111,111);
INSERT INTO  Z0CASE (z0_test0,z0_test1,Z0_TEST2)VALUES(127,127.333,127.333);
Warnings:
Warning	1265	Data truncated for column 'Z0_TEST2' at row 1
INSERT INTO  Z0CASE (z0_test0,z0_test1,Z0_TEST2)VALUES(-3.3333,-128.333,-128.333);
Warnings:
Warning	1265	Data truncated for column 'Z0_TEST0' at row 1
Warning	1265	Data truncated for column 'Z0_TEST2' at row 1
INSERT INTO  Z0CASE (z0_test0,z0_test1,Z0_TEST2)VALUES(NULL,NULL,NULL);
SELECT * FROM Z0CASE ORDER BY Z0_TEST1;
Z0_TEST0	Z0_TEST1	Z0_TEST2
NULL	NULL	NULL
-3	-128.3330000000	-128
0	0.0000000000	0
111	111.0000000000	111
127	127.3330000000	127
SELECT table_id,table_name FROM oceanbase.__all_virtual_table WHERE table_name='Z0CASE';
ALTER TABLE Z0CASE MODIFY COLUMN z0_test0 FLOAT(10) ;
SELECT * FROM Z0CASE ORDER BY Z0_TEST1;
z0_test0	Z0_TEST1	Z0_TEST2
NULL	NULL	NULL
-3	-128.3330000000	-128
0	0.0000000000	0
111	111.0000000000	111
127	127.3330000000	127
DESC Z0CASE;
Field	Type	Null	Key	Default	Extra
z0_test0	float	YES		NULL	
Z0_TEST1	decimal(30,10)	YES		NULL	
Z0_TEST2	decimal(10,0)	YES		NULL	
SELECT table_id,table_name FROM oceanbase.__all_virtual_table WHERE table_name='Z0CASE';
ALTER TABLE Z0CASE MODIFY COLUMN Z0_TEST1 FLOAT(30) ;
SELECT * FROM Z0CASE ORDER BY Z0_TEST1;
z0_test0	Z0_TEST1	Z0_TEST2
NULL	NULL	NULL
-3	-128.333	-128
0	0	0
111	111	111
127	127.333	127
DESC Z0CASE;
Field	Type	Null	Key	Default	Extra
z0_test0	float	YES		NULL	
Z0_TEST1	double	YES		NULL	
Z0_TEST2	decimal(10,0)	YES		NULL	
SELECT table_id,table_name FROM oceanbase.__all_virtual_table WHERE table_name='Z0CASE';
ALTER TABLE Z0CASE MODIFY COLUMN Z0_TEST2 FLOAT(24)DEFAULT '';
ERROR 42000: Invalid default value for 'Z0_TEST2'
ALTER TABLE Z0CASE MODIFY COLUMN Z0_TEST2 FLOAT(25)DEFAULT '';
ERROR 42000: Invalid default value for 'Z0_TEST2'
DROP TABLE Z0CASE;
CREATE TABLE Z0CASE(Z0_TEST0 DECIMAL(10), Z0_TEST1 DECIMAL(30,10),Z0_TEST2 DECIMAL) with column group (all columns, each column);
INSERT INTO  Z0CASE (z0_test0,z0_test1,Z0_TEST2)VALUES(0,0,0);
INSERT INTO  Z0CASE (z0_test0,z0_test1,Z0_TEST2)VALUES(111,111,111);
INSERT INTO  Z0CASE (z0_test0,z0_test1,Z0_TEST2)VALUES(127,127.333,127.333);
Warnings:
Warning	1265	Data truncated for column 'Z0_TEST2' at row 1
INSERT INTO  Z0CASE (z0_test0,z0_test1,Z0_TEST2)VALUES(-3.3333,-128.333,-128.333);
Warnings:
Warning	1265	Data truncated for column 'Z0_TEST0' at row 1
Warning	1265	Data truncated for column 'Z0_TEST2' at row 1
INSERT INTO  Z0CASE (z0_test0,z0_test1,Z0_TEST2)VALUES(NULL,NULL,NULL);
SELECT * FROM Z0CASE ORDER BY Z0_TEST1;
Z0_TEST0	Z0_TEST1	Z0_TEST2
NULL	NULL	NULL
-3	-128.3330000000	-128
0	0.0000000000	0
111	111.0000000000	111
127	127.3330000000	127
SELECT table_id,table_name FROM oceanbase.__all_virtual_table WHERE table_name='Z0CASE';
ALTER TABLE Z0CASE MODIFY COLUMN z0_test0 DOUBLE(20,0) ;
SELECT * FROM Z0CASE ORDER BY Z0_TEST1;
z0_test0	Z0_TEST1	Z0_TEST2
NULL	NULL	NULL
-3	-128.3330000000	-128
0	0.0000000000	0
111	111.0000000000	111
127	127.3330000000	127
DESC Z0CASE;
Field	Type	Null	Key	Default	Extra
z0_test0	double(20,0)	YES		NULL	
Z0_TEST1	decimal(30,10)	YES		NULL	
Z0_TEST2	decimal(10,0)	YES		NULL	
SELECT table_id,table_name FROM oceanbase.__all_virtual_table WHERE table_name='Z0CASE';
ALTER TABLE Z0CASE MODIFY COLUMN Z0_TEST1 DOUBLE(30,0) ;
SELECT * FROM Z0CASE ORDER BY Z0_TEST1;
z0_test0	Z0_TEST1	Z0_TEST2
NULL	NULL	NULL
-3	-128	-128
0	0	0
111	111	111
127	127	127
DESC Z0CASE;
Field	Type	Null	Key	Default	Extra
z0_test0	double(20,0)	YES		NULL	
Z0_TEST1	double(30,0)	YES		NULL	
Z0_TEST2	decimal(10,0)	YES		NULL	
SELECT table_id,table_name FROM oceanbase.__all_virtual_table WHERE table_name='Z0CASE';
ALTER TABLE Z0CASE MODIFY COLUMN Z0_TEST1 DOUBLE(10,0) ;
SELECT * FROM Z0CASE ORDER BY Z0_TEST1;
z0_test0	Z0_TEST1	Z0_TEST2
NULL	NULL	NULL
-3	-128	-128
0	0	0
111	111	111
127	127	127
DESC Z0CASE;
Field	Type	Null	Key	Default	Extra
z0_test0	double(20,0)	YES		NULL	
Z0_TEST1	double(10,0)	YES		NULL	
Z0_TEST2	decimal(10,0)	YES		NULL	
SELECT table_id,table_name FROM oceanbase.__all_virtual_table WHERE table_name='Z0CASE';
ALTER TABLE Z0CASE MODIFY COLUMN Z0_TEST2 DOUBLE(32,0) ;
SELECT * FROM Z0CASE ORDER BY Z0_TEST1;
z0_test0	Z0_TEST1	Z0_TEST2
NULL	NULL	NULL
-3	-128	-128
0	0	0
111	111	111
127	127	127
DESC Z0CASE;
Field	Type	Null	Key	Default	Extra
z0_test0	double(20,0)	YES		NULL	
Z0_TEST1	double(10,0)	YES		NULL	
Z0_TEST2	double(32,0)	YES		NULL	
SELECT table_id,table_name FROM oceanbase.__all_virtual_table WHERE table_name='Z0CASE';
其他字符类型
DROP TABLE Z0CASE;
CREATE TABLE Z0CASE(Z0_TEST0 DECIMAL, Z0_TEST1 DOUBLE,Z0_TEST2 FLOAT) with column group (all columns, each column);
INSERT INTO  Z0CASE (z0_test0,z0_test1,Z0_TEST2)VALUES(0,0,0);
INSERT INTO  Z0CASE (z0_test0,z0_test1,Z0_TEST2)VALUES(111,111,111);
INSERT INTO  Z0CASE (z0_test0,z0_test1,Z0_TEST2)VALUES(127,127.333,127.333);
INSERT INTO  Z0CASE (z0_test0,z0_test1,Z0_TEST2)VALUES(-3.3333,-128.333,-128.333);
Warnings:
Warning	1265	Data truncated for column 'Z0_TEST0' at row 1
INSERT INTO  Z0CASE (z0_test0,z0_test1,Z0_TEST2)VALUES(NULL,NULL,NULL);
SELECT * FROM Z0CASE ORDER BY Z0_TEST1;
Z0_TEST0	Z0_TEST1	Z0_TEST2
NULL	NULL	NULL
-3	-128.333	-128.333
0	0	0
111	111	111
127	127.333	127.333
SELECT table_id,table_name FROM oceanbase.__all_virtual_table WHERE table_name='Z0CASE';
ALTER TABLE Z0CASE MODIFY COLUMN z0_test0 INT ;
SELECT * FROM Z0CASE ORDER BY Z0_TEST1;
z0_test0	Z0_TEST1	Z0_TEST2
NULL	NULL	NULL
-3	-128.333	-128.333
0	0	0
111	111	111
127	127.333	127.333
DESC Z0CASE;
Field	Type	Null	Key	Default	Extra
z0_test0	int(11)	YES		NULL	
Z0_TEST1	double	YES		NULL	
Z0_TEST2	float	YES		NULL	
SELECT table_id,table_name FROM oceanbase.__all_virtual_table WHERE table_name='Z0CASE';
ALTER TABLE Z0CASE MODIFY COLUMN Z0_TEST1 INT ;
SELECT * FROM Z0CASE ORDER BY Z0_TEST1;
z0_test0	Z0_TEST1	Z0_TEST2
NULL	NULL	NULL
-3	-128	-128.333
0	0	0
111	111	111
127	127	127.333
DESC Z0CASE;
Field	Type	Null	Key	Default	Extra
z0_test0	int(11)	YES		NULL	
Z0_TEST1	int(11)	YES		NULL	
Z0_TEST2	float	YES		NULL	
SELECT table_id,table_name FROM oceanbase.__all_virtual_table WHERE table_name='Z0CASE';
ALTER TABLE Z0CASE MODIFY COLUMN Z0_TEST2 INT ;
SELECT * FROM Z0CASE ORDER BY Z0_TEST1;
z0_test0	Z0_TEST1	Z0_TEST2
NULL	NULL	NULL
-3	-128	-128
0	0	0
111	111	111
127	127	127
DESC Z0CASE;
Field	Type	Null	Key	Default	Extra
z0_test0	int(11)	YES		NULL	
Z0_TEST1	int(11)	YES		NULL	
Z0_TEST2	int(11)	YES		NULL	
SELECT table_id,table_name FROM oceanbase.__all_virtual_table WHERE table_name='Z0CASE';
DROP TABLE Z0CASE;
CREATE TABLE Z0CASE(Z0_TEST0 DECIMAL(20,3), Z0_TEST1 DOUBLE(20,0),Z0_TEST2 FLOAT(20)) with column group (all columns, each column);
INSERT INTO  Z0CASE (z0_test0,z0_test1,Z0_TEST2)VALUES(0,0,0);
INSERT INTO  Z0CASE (z0_test0,z0_test1,Z0_TEST2)VALUES(111,111,111);
INSERT INTO  Z0CASE (z0_test0,z0_test1,Z0_TEST2)VALUES(127,127.333,127.333);
INSERT INTO  Z0CASE (z0_test0,z0_test1,Z0_TEST2)VALUES(-3.3333,-128.333,-128.333);
Warnings:
Warning	1265	Data truncated for column 'Z0_TEST0' at row 1
INSERT INTO  Z0CASE (z0_test0,z0_test1,Z0_TEST2)VALUES(NULL,NULL,NULL);
SELECT * FROM Z0CASE ORDER BY Z0_TEST1;
Z0_TEST0	Z0_TEST1	Z0_TEST2
NULL	NULL	NULL
-3.333	-128	-128.333
0.000	0	0
111.000	111	111
127.000	127	127.333
SELECT table_id,table_name FROM oceanbase.__all_virtual_table WHERE table_name='Z0CASE';
ALTER TABLE Z0CASE MODIFY COLUMN z0_test0 INT ;
SELECT * FROM Z0CASE ORDER BY Z0_TEST1;
z0_test0	Z0_TEST1	Z0_TEST2
NULL	NULL	NULL
-3	-128	-128.333
0	0	0
111	111	111
127	127	127.333
DESC Z0CASE;
Field	Type	Null	Key	Default	Extra
z0_test0	int(11)	YES		NULL	
Z0_TEST1	double(20,0)	YES		NULL	
Z0_TEST2	float	YES		NULL	
SELECT table_id,table_name FROM oceanbase.__all_virtual_table WHERE table_name='Z0CASE';
ALTER TABLE Z0CASE MODIFY COLUMN Z0_TEST1 INT ;
SELECT * FROM Z0CASE ORDER BY Z0_TEST1;
z0_test0	Z0_TEST1	Z0_TEST2
NULL	NULL	NULL
-3	-128	-128.333
0	0	0
111	111	111
127	127	127.333
DESC Z0CASE;
Field	Type	Null	Key	Default	Extra
z0_test0	int(11)	YES		NULL	
Z0_TEST1	int(11)	YES		NULL	
Z0_TEST2	float	YES		NULL	
SELECT table_id,table_name FROM oceanbase.__all_virtual_table WHERE table_name='Z0CASE';
ALTER TABLE Z0CASE MODIFY COLUMN Z0_TEST2 INT ;
SELECT * FROM Z0CASE ORDER BY Z0_TEST1;
z0_test0	Z0_TEST1	Z0_TEST2
NULL	NULL	NULL
-3	-128	-128
0	0	0
111	111	111
127	127	127
DESC Z0CASE;
Field	Type	Null	Key	Default	Extra
z0_test0	int(11)	YES		NULL	
Z0_TEST1	int(11)	YES		NULL	
Z0_TEST2	int(11)	YES		NULL	
SELECT table_id,table_name FROM oceanbase.__all_virtual_table WHERE table_name='Z0CASE';
DROP TABLE Z0CASE;
CREATE TABLE Z0CASE(Z0_TEST0 DECIMAL(20,3), Z0_TEST1 DOUBLE(20,0),Z0_TEST2 FLOAT(20)) with column group (all columns, each column);
INSERT INTO  Z0CASE (z0_test0,z0_test1,Z0_TEST2)VALUES(0,0,0);
INSERT INTO  Z0CASE (z0_test0,z0_test1,Z0_TEST2)VALUES(111,111,111);
INSERT INTO  Z0CASE (z0_test0,z0_test1,Z0_TEST2)VALUES(127,127.333,127.333);
INSERT INTO  Z0CASE (z0_test0,z0_test1,Z0_TEST2)VALUES(-3.3333,-128.333,-128.333);
Warnings:
Warning	1265	Data truncated for column 'Z0_TEST0' at row 1
INSERT INTO  Z0CASE (z0_test0,z0_test1,Z0_TEST2)VALUES(NULL,NULL,NULL);
SELECT * FROM Z0CASE ORDER BY Z0_TEST1;
Z0_TEST0	Z0_TEST1	Z0_TEST2
NULL	NULL	NULL
-3.333	-128	-128.333
0.000	0	0
111.000	111	111
127.000	127	127.333
SELECT table_id,table_name FROM oceanbase.__all_virtual_table WHERE table_name='Z0CASE';
ALTER TABLE Z0CASE MODIFY COLUMN z0_test0 CHAR(100);
SELECT * FROM Z0CASE ORDER BY Z0_TEST1;
z0_test0	Z0_TEST1	Z0_TEST2
NULL	NULL	NULL
-3.333	-128	-128.333
0.000	0	0
111.000	111	111
127.000	127	127.333
DESC Z0CASE;
Field	Type	Null	Key	Default	Extra
z0_test0	char(100)	YES		NULL	
Z0_TEST1	double(20,0)	YES		NULL	
Z0_TEST2	float	YES		NULL	
SELECT table_id,table_name FROM oceanbase.__all_virtual_table WHERE table_name='Z0CASE';
ALTER TABLE Z0CASE MODIFY COLUMN Z0_TEST1 CHAR(100);
SELECT * FROM Z0CASE ORDER BY Z0_TEST1;
z0_test0	Z0_TEST1	Z0_TEST2
NULL	NULL	NULL
-3.333	-128	-128.333
0.000	0	0
111.000	111	111
127.000	127	127.333
DESC Z0CASE;
Field	Type	Null	Key	Default	Extra
z0_test0	char(100)	YES		NULL	
Z0_TEST1	char(100)	YES		NULL	
Z0_TEST2	float	YES		NULL	
SELECT table_id,table_name FROM oceanbase.__all_virtual_table WHERE table_name='Z0CASE';
ALTER TABLE Z0CASE MODIFY COLUMN Z0_TEST2 CHAR(100);
SELECT * FROM Z0CASE ORDER BY Z0_TEST1;
z0_test0	Z0_TEST1	Z0_TEST2
NULL	NULL	NULL
-3.333	-128	-128.333
0.000	0	0
111.000	111	111
127.000	127	127.333
DESC Z0CASE;
Field	Type	Null	Key	Default	Extra
z0_test0	char(100)	YES		NULL	
Z0_TEST1	char(100)	YES		NULL	
Z0_TEST2	char(100)	YES		NULL	
SELECT table_id,table_name FROM oceanbase.__all_virtual_table WHERE table_name='Z0CASE';
DROP TABLE Z0CASE;
CREATE TABLE Z0CASE(Z0_TEST0 DECIMAL(20,3), Z0_TEST1 DOUBLE(20,0),Z0_TEST2 FLOAT(20)) with column group (all columns, each column);
INSERT INTO  Z0CASE (z0_test0,z0_test1,Z0_TEST2)VALUES(0,0,0);
INSERT INTO  Z0CASE (z0_test0,z0_test1,Z0_TEST2)VALUES(111,111,111);
INSERT INTO  Z0CASE (z0_test0,z0_test1,Z0_TEST2)VALUES(127,127.333,127.333);
INSERT INTO  Z0CASE (z0_test0,z0_test1,Z0_TEST2)VALUES(-3.3333,-128.333,-128.333);
Warnings:
Warning	1265	Data truncated for column 'Z0_TEST0' at row 1
INSERT INTO  Z0CASE (z0_test0,z0_test1,Z0_TEST2)VALUES(NULL,NULL,NULL);
SELECT * FROM Z0CASE ORDER BY Z0_TEST1;
Z0_TEST0	Z0_TEST1	Z0_TEST2
NULL	NULL	NULL
-3.333	-128	-128.333
0.000	0	0
111.000	111	111
127.000	127	127.333
SELECT table_id,table_name FROM oceanbase.__all_virtual_table WHERE table_name='Z0CASE';
ALTER TABLE Z0CASE MODIFY COLUMN z0_test0 BLOB ;
SELECT * FROM Z0CASE ORDER BY Z0_TEST1;
z0_test0	Z0_TEST1	Z0_TEST2
NULL	NULL	NULL
-3.333	-128	-128.333
0.000	0	0
111.000	111	111
127.000	127	127.333
DESC Z0CASE;
Field	Type	Null	Key	Default	Extra
z0_test0	blob	YES		NULL	
Z0_TEST1	double(20,0)	YES		NULL	
Z0_TEST2	float	YES		NULL	
SELECT table_id,table_name FROM oceanbase.__all_virtual_table WHERE table_name='Z0CASE';
ALTER TABLE Z0CASE MODIFY COLUMN Z0_TEST1 BLOB ;
SELECT * FROM Z0CASE ORDER BY Z0_TEST1;
z0_test0	Z0_TEST1	Z0_TEST2
NULL	NULL	NULL
-3.333	-128	-128.333
0.000	0	0
111.000	111	111
127.000	127	127.333
DESC Z0CASE;
Field	Type	Null	Key	Default	Extra
z0_test0	blob	YES		NULL	
Z0_TEST1	blob	YES		NULL	
Z0_TEST2	float	YES		NULL	
SELECT table_id,table_name FROM oceanbase.__all_virtual_table WHERE table_name='Z0CASE';
ALTER TABLE Z0CASE MODIFY COLUMN Z0_TEST2 BLOB ;
SELECT * FROM Z0CASE ORDER BY Z0_TEST1;
z0_test0	Z0_TEST1	Z0_TEST2
NULL	NULL	NULL
-3.333	-128	-128.333
0.000	0	0
111.000	111	111
127.000	127	127.333
DESC Z0CASE;
Field	Type	Null	Key	Default	Extra
z0_test0	blob	YES		NULL	
Z0_TEST1	blob	YES		NULL	
Z0_TEST2	blob	YES		NULL	
SELECT table_id,table_name FROM oceanbase.__all_virtual_table WHERE table_name='Z0CASE';
DROP TABLE Z0CASE;
CREATE TABLE Z0CASE(Z0_TEST0 DECIMAL, Z0_TEST1 DOUBLE,Z0_TEST2 FLOAT) with column group (all columns, each column);
INSERT INTO  Z0CASE (z0_test0,z0_test1,Z0_TEST2)VALUES(0,0,0);
INSERT INTO  Z0CASE (z0_test0,z0_test1,Z0_TEST2)VALUES(111,111,111);
SELECT * FROM Z0CASE ORDER BY Z0_TEST1;
Z0_TEST0	Z0_TEST1	Z0_TEST2
0	0	0
111	111	111
SELECT table_id,table_name FROM oceanbase.__all_virtual_table WHERE table_name='Z0CASE';
ALTER TABLE Z0CASE MODIFY COLUMN z0_test0 DATE ;
SELECT * FROM Z0CASE ORDER BY Z0_TEST1;
z0_test0	Z0_TEST1	Z0_TEST2
0000-00-00	0	0
2000-01-11	111	111
DESC Z0CASE;
Field	Type	Null	Key	Default	Extra
z0_test0	date	YES		NULL	
Z0_TEST1	double	YES		NULL	
Z0_TEST2	float	YES		NULL	
SELECT table_id,table_name FROM oceanbase.__all_virtual_table WHERE table_name='Z0CASE';
ALTER TABLE Z0CASE MODIFY COLUMN Z0_TEST1 DATE ;
SELECT * FROM Z0CASE ORDER BY Z0_TEST1;
z0_test0	Z0_TEST1	Z0_TEST2
0000-00-00	0000-00-00	0
2000-01-11	2000-01-11	111
DESC Z0CASE;
Field	Type	Null	Key	Default	Extra
z0_test0	date	YES		NULL	
Z0_TEST1	date	YES		NULL	
Z0_TEST2	float	YES		NULL	
SELECT table_id,table_name FROM oceanbase.__all_virtual_table WHERE table_name='Z0CASE';
ALTER TABLE Z0CASE MODIFY COLUMN Z0_TEST2 DATE ;
SELECT * FROM Z0CASE ORDER BY Z0_TEST1;
z0_test0	Z0_TEST1	Z0_TEST2
0000-00-00	0000-00-00	0000-00-00
2000-01-11	2000-01-11	2000-01-11
DESC Z0CASE;
Field	Type	Null	Key	Default	Extra
z0_test0	date	YES		NULL	
Z0_TEST1	date	YES		NULL	
Z0_TEST2	date	YES		NULL	
SELECT table_id,table_name FROM oceanbase.__all_virtual_table WHERE table_name='Z0CASE';
DROP TABLE Z0CASE;
CREATE TABLE Z0CASE(Z0_TEST0 DECIMAL, Z0_TEST1 DOUBLE,Z0_TEST2 FLOAT) with column group (all columns, each column);
INSERT INTO  Z0CASE (z0_test0,z0_test1,Z0_TEST2)VALUES(0,0,0);
INSERT INTO  Z0CASE (z0_test0,z0_test1,Z0_TEST2)VALUES(111,111,111);
SELECT * FROM Z0CASE ORDER BY Z0_TEST1;
Z0_TEST0	Z0_TEST1	Z0_TEST2
0	0	0
111	111	111
SELECT table_id,table_name FROM oceanbase.__all_virtual_table WHERE table_name='Z0CASE';
ALTER TABLE Z0CASE MODIFY COLUMN z0_test0 DATETIME;
SELECT * FROM Z0CASE ORDER BY Z0_TEST1;
z0_test0	Z0_TEST1	Z0_TEST2
0000-00-00 00:00:00	0	0
2000-01-11 00:00:00	111	111
DESC Z0CASE;
Field	Type	Null	Key	Default	Extra
z0_test0	datetime	YES		NULL	
Z0_TEST1	double	YES		NULL	
Z0_TEST2	float	YES		NULL	
SELECT table_id,table_name FROM oceanbase.__all_virtual_table WHERE table_name='Z0CASE';
ALTER TABLE Z0CASE MODIFY COLUMN Z0_TEST1 DATETIME;
SELECT * FROM Z0CASE ORDER BY Z0_TEST1;
z0_test0	Z0_TEST1	Z0_TEST2
0000-00-00 00:00:00	0000-00-00 00:00:00	0
2000-01-11 00:00:00	2000-01-11 00:00:00	111
DESC Z0CASE;
Field	Type	Null	Key	Default	Extra
z0_test0	datetime	YES		NULL	
Z0_TEST1	datetime	YES		NULL	
Z0_TEST2	float	YES		NULL	
SELECT table_id,table_name FROM oceanbase.__all_virtual_table WHERE table_name='Z0CASE';
ALTER TABLE Z0CASE MODIFY COLUMN Z0_TEST2 DATETIME;
SELECT * FROM Z0CASE ORDER BY Z0_TEST1;
z0_test0	Z0_TEST1	Z0_TEST2
0000-00-00 00:00:00	0000-00-00 00:00:00	0000-00-00 00:00:00
2000-01-11 00:00:00	2000-01-11 00:00:00	2000-01-11 00:00:00
DESC Z0CASE;
Field	Type	Null	Key	Default	Extra
z0_test0	datetime	YES		NULL	
Z0_TEST1	datetime	YES		NULL	
Z0_TEST2	datetime	YES		NULL	
SELECT table_id,table_name FROM oceanbase.__all_virtual_table WHERE table_name='Z0CASE';
DROP TABLE Z0CASE;
CREATE TABLE Z0CASE(Z0_TEST0 DECIMAL, Z0_TEST1 DOUBLE,Z0_TEST2 FLOAT) with column group (all columns, each column);
INSERT INTO  Z0CASE (z0_test0,z0_test1,Z0_TEST2)VALUES(0,0,0);
INSERT INTO  Z0CASE (z0_test0,z0_test1,Z0_TEST2)VALUES(111,111,111);
SELECT * FROM Z0CASE ORDER BY Z0_TEST1;
Z0_TEST0	Z0_TEST1	Z0_TEST2
0	0	0
111	111	111
SELECT table_id,table_name FROM oceanbase.__all_virtual_table WHERE table_name='Z0CASE';
ALTER TABLE Z0CASE MODIFY COLUMN z0_test0 TIMESTAMP ;
SELECT * FROM Z0CASE ORDER BY Z0_TEST1;
z0_test0	Z0_TEST1	Z0_TEST2
0000-00-00 00:00:00	0	0
2000-01-11 00:00:00	111	111
DESC Z0CASE;
Field	Type	Null	Key	Default	Extra
z0_test0	timestamp	YES		NULL	
Z0_TEST1	double	YES		NULL	
Z0_TEST2	float	YES		NULL	
SELECT table_id,table_name FROM oceanbase.__all_virtual_table WHERE table_name='Z0CASE';
ALTER TABLE Z0CASE MODIFY COLUMN Z0_TEST1 TIMESTAMP ;
SELECT * FROM Z0CASE ORDER BY Z0_TEST1;
z0_test0	Z0_TEST1	Z0_TEST2
0000-00-00 00:00:00	0000-00-00 00:00:00	0
2000-01-11 00:00:00	2000-01-11 00:00:00	111
DESC Z0CASE;
Field	Type	Null	Key	Default	Extra
z0_test0	timestamp	YES		NULL	
Z0_TEST1	timestamp	YES		NULL	
Z0_TEST2	float	YES		NULL	
SELECT table_id,table_name FROM oceanbase.__all_virtual_table WHERE table_name='Z0CASE';
ALTER TABLE Z0CASE MODIFY COLUMN Z0_TEST2 TIMESTAMP ;
SELECT * FROM Z0CASE ORDER BY Z0_TEST1;
z0_test0	Z0_TEST1	Z0_TEST2
0000-00-00 00:00:00	0000-00-00 00:00:00	0000-00-00 00:00:00
2000-01-11 00:00:00	2000-01-11 00:00:00	2000-01-11 00:00:00
DESC Z0CASE;
Field	Type	Null	Key	Default	Extra
z0_test0	timestamp	YES		NULL	
Z0_TEST1	timestamp	YES		NULL	
Z0_TEST2	timestamp	YES		NULL	
SELECT table_id,table_name FROM oceanbase.__all_virtual_table WHERE table_name='Z0CASE';
DATE/time/YEAR
DROP TABLE Z0CASE;
CREATE TABLE Z0CASE(Z0_TEST0 DATE, Z0_TEST1 TIME,Z0_TEST2 YEAR) with column group (all columns, each column);
INSERT INTO  Z0CASE (Z0_TEST0,Z0_TEST1,Z0_TEST2)VALUES('2011-11-11 11:11:11',' 11:11:11','2011');
INSERT INTO  Z0CASE (Z0_TEST0,Z0_TEST1,Z0_TEST2)VALUES(0,0,0);
INSERT INTO  Z0CASE (Z0_TEST0,Z0_TEST1,Z0_TEST2)VALUES(NULL,NULL,NULL);
SELECT * FROM Z0CASE ORDER BY Z0_TEST1;
Z0_TEST0	Z0_TEST1	Z0_TEST2
NULL	NULL	NULL
0000-00-00	00:00:00	0000
2011-11-11	11:11:11	2011
SELECT table_id,table_name FROM oceanbase.__all_virtual_table WHERE table_name='Z0CASE';
ALTER TABLE Z0CASE MODIFY COLUMN Z0_TEST0 DATE ;
SELECT * FROM Z0CASE ORDER BY Z0_TEST1;
Z0_TEST0	Z0_TEST1	Z0_TEST2
NULL	NULL	NULL
0000-00-00	00:00:00	0000
2011-11-11	11:11:11	2011
DESC Z0CASE;
Field	Type	Null	Key	Default	Extra
Z0_TEST0	date	YES		NULL	
Z0_TEST1	time	YES		NULL	
Z0_TEST2	year(4)	YES		NULL	
SELECT table_id,table_name FROM oceanbase.__all_virtual_table WHERE table_name='Z0CASE';
ALTER TABLE Z0CASE MODIFY COLUMN Z0_TEST1 DATE ;
DESC Z0CASE;
Field	Type	Null	Key	Default	Extra
Z0_TEST0	date	YES		NULL	
Z0_TEST1	date	YES		NULL	
Z0_TEST2	year(4)	YES		NULL	
SELECT table_id,table_name FROM oceanbase.__all_virtual_table WHERE table_name='Z0CASE';
ALTER TABLE Z0CASE MODIFY COLUMN Z0_TEST2 DATE ;
ERROR 22007: Incorrect value
DROP TABLE Z0CASE;
CREATE TABLE Z0CASE(Z0_TEST0 DATE, Z0_TEST1 TIME,Z0_TEST2 YEAR) with column group (all columns, each column);
INSERT INTO  Z0CASE (Z0_TEST0,Z0_TEST1,Z0_TEST2)VALUES('2011-11-11 11:11:11',' 11:11:11','2011');
INSERT INTO  Z0CASE (Z0_TEST0,Z0_TEST1,Z0_TEST2)VALUES(0,0,0);
INSERT INTO  Z0CASE (Z0_TEST0,Z0_TEST1,Z0_TEST2)VALUES(NULL,NULL,NULL);
SELECT * FROM Z0CASE ORDER BY Z0_TEST1;
Z0_TEST0	Z0_TEST1	Z0_TEST2
NULL	NULL	NULL
0000-00-00	00:00:00	0000
2011-11-11	11:11:11	2011
SELECT table_id,table_name FROM oceanbase.__all_virtual_table WHERE table_name='Z0CASE';
ALTER TABLE Z0CASE MODIFY COLUMN Z0_TEST0 TIME;
SELECT * FROM Z0CASE ORDER BY Z0_TEST1;
Z0_TEST0	Z0_TEST1	Z0_TEST2
NULL	NULL	NULL
00:00:00	00:00:00	0000
00:00:00	11:11:11	2011
DESC Z0CASE;
Field	Type	Null	Key	Default	Extra
Z0_TEST0	time	YES		NULL	
Z0_TEST1	time	YES		NULL	
Z0_TEST2	year(4)	YES		NULL	
SELECT table_id,table_name FROM oceanbase.__all_virtual_table WHERE table_name='Z0CASE';
ALTER TABLE Z0CASE MODIFY COLUMN Z0_TEST1 TIME;
SELECT * FROM Z0CASE ORDER BY Z0_TEST1;
Z0_TEST0	Z0_TEST1	Z0_TEST2
NULL	NULL	NULL
00:00:00	00:00:00	0000
00:00:00	11:11:11	2011
DESC Z0CASE;
Field	Type	Null	Key	Default	Extra
Z0_TEST0	time	YES		NULL	
Z0_TEST1	time	YES		NULL	
Z0_TEST2	year(4)	YES		NULL	
SELECT table_id,table_name FROM oceanbase.__all_virtual_table WHERE table_name='Z0CASE';
ALTER TABLE Z0CASE MODIFY COLUMN Z0_TEST2 TIME;
DROP TABLE Z0CASE;
CREATE TABLE Z0CASE(Z0_TEST0 DATE, Z0_TEST1 TIME,Z0_TEST2 YEAR) with column group (all columns, each column);
INSERT INTO  Z0CASE (Z0_TEST0,Z0_TEST1,Z0_TEST2)VALUES('2011-11-11 11:11:11',' 11:11:11','2011');
INSERT INTO  Z0CASE (Z0_TEST0,Z0_TEST1,Z0_TEST2)VALUES(0,0,0);
INSERT INTO  Z0CASE (Z0_TEST0,Z0_TEST1,Z0_TEST2)VALUES(NULL,NULL,NULL);
SELECT * FROM Z0CASE ORDER BY Z0_TEST1;
Z0_TEST0	Z0_TEST1	Z0_TEST2
NULL	NULL	NULL
0000-00-00	00:00:00	0000
2011-11-11	11:11:11	2011
SELECT table_id,table_name FROM oceanbase.__all_virtual_table WHERE table_name='Z0CASE';
ALTER TABLE Z0CASE MODIFY COLUMN Z0_TEST0 YEAR ;
SELECT * FROM Z0CASE ORDER BY Z0_TEST1;
Z0_TEST0	Z0_TEST1	Z0_TEST2
NULL	NULL	NULL
0000	00:00:00	0000
2011	11:11:11	2011
DESC Z0CASE;
Field	Type	Null	Key	Default	Extra
Z0_TEST0	year(4)	YES		NULL	
Z0_TEST1	time	YES		NULL	
Z0_TEST2	year(4)	YES		NULL	
SELECT table_id,table_name FROM oceanbase.__all_virtual_table WHERE table_name='Z0CASE';
ALTER TABLE Z0CASE MODIFY COLUMN Z0_TEST1 YEAR ;
ERROR 22003: Out of range value for column
ALTER TABLE Z0CASE MODIFY COLUMN Z0_TEST2 YEAR ;
SELECT * FROM Z0CASE ORDER BY Z0_TEST1;
Z0_TEST0	Z0_TEST1	Z0_TEST2
NULL	NULL	NULL
0000	00:00:00	0000
2011	11:11:11	2011
DESC Z0CASE;
Field	Type	Null	Key	Default	Extra
Z0_TEST0	year(4)	YES		NULL	
Z0_TEST1	time	YES		NULL	
Z0_TEST2	year(4)	YES		NULL	
SELECT table_id,table_name FROM oceanbase.__all_virtual_table WHERE table_name='Z0CASE';
DROP TABLE Z0CASE;
CREATE TABLE Z0CASE(Z0_TEST0 DATE, Z0_TEST1 TIME,Z0_TEST2 YEAR) with column group (all columns, each column);
INSERT INTO  Z0CASE (Z0_TEST0,Z0_TEST1,Z0_TEST2)VALUES('2011-11-11 11:11:11',' 11:11:11','2011');
INSERT INTO  Z0CASE (Z0_TEST0,Z0_TEST1,Z0_TEST2)VALUES(0,0,0);
INSERT INTO  Z0CASE (Z0_TEST0,Z0_TEST1,Z0_TEST2)VALUES(NULL,NULL,NULL);
SELECT * FROM Z0CASE ORDER BY Z0_TEST1;
Z0_TEST0	Z0_TEST1	Z0_TEST2
NULL	NULL	NULL
0000-00-00	00:00:00	0000
2011-11-11	11:11:11	2011
SELECT table_id,table_name FROM oceanbase.__all_virtual_table WHERE table_name='Z0CASE';
ALTER TABLE Z0CASE MODIFY COLUMN Z0_TEST0 DATETIME;
SELECT * FROM Z0CASE ORDER BY Z0_TEST1;
Z0_TEST0	Z0_TEST1	Z0_TEST2
NULL	NULL	NULL
0000-00-00 00:00:00	00:00:00	0000
2011-11-11 00:00:00	11:11:11	2011
DESC Z0CASE;
Field	Type	Null	Key	Default	Extra
Z0_TEST0	datetime	YES		NULL	
Z0_TEST1	time	YES		NULL	
Z0_TEST2	year(4)	YES		NULL	
SELECT table_id,table_name FROM oceanbase.__all_virtual_table WHERE table_name='Z0CASE';
ALTER TABLE Z0CASE MODIFY COLUMN Z0_TEST1 DATETIME;
DESC Z0CASE;
Field	Type	Null	Key	Default	Extra
Z0_TEST0	datetime	YES		NULL	
Z0_TEST1	datetime	YES		NULL	
Z0_TEST2	year(4)	YES		NULL	
SELECT table_id,table_name FROM oceanbase.__all_virtual_table WHERE table_name='Z0CASE';
此处和开发确认过，没有兼容MySQL，感觉MySQL的不太合理
ALTER TABLE Z0CASE MODIFY COLUMN Z0_TEST2 DATETIME;
ERROR 22007: Incorrect value
DROP TABLE Z0CASE;
CREATE TABLE Z0CASE(Z0_TEST0 DATE, Z0_TEST1 TIME,Z0_TEST2 YEAR) with column group (all columns, each column);
INSERT INTO  Z0CASE (Z0_TEST0,Z0_TEST1,Z0_TEST2)VALUES('2011-11-11 11:11:11',' 11:11:11','2011');
INSERT INTO  Z0CASE (Z0_TEST0,Z0_TEST1,Z0_TEST2)VALUES(0,0,0);
INSERT INTO  Z0CASE (Z0_TEST0,Z0_TEST1,Z0_TEST2)VALUES(NULL,NULL,NULL);
SELECT * FROM Z0CASE ORDER BY Z0_TEST1;
Z0_TEST0	Z0_TEST1	Z0_TEST2
NULL	NULL	NULL
0000-00-00	00:00:00	0000
2011-11-11	11:11:11	2011
SELECT table_id,table_name FROM oceanbase.__all_virtual_table WHERE table_name='Z0CASE';
ALTER TABLE Z0CASE MODIFY COLUMN Z0_TEST0 TIMESTAMP;
SELECT * FROM Z0CASE ORDER BY Z0_TEST1;
Z0_TEST0	Z0_TEST1	Z0_TEST2
NULL	NULL	NULL
0000-00-00 00:00:00	00:00:00	0000
2011-11-11 00:00:00	11:11:11	2011
DESC Z0CASE;
Field	Type	Null	Key	Default	Extra
Z0_TEST0	timestamp	YES		NULL	
Z0_TEST1	time	YES		NULL	
Z0_TEST2	year(4)	YES		NULL	
SELECT table_id,table_name FROM oceanbase.__all_virtual_table WHERE table_name='Z0CASE';
ALTER TABLE Z0CASE MODIFY COLUMN Z0_TEST1 TIMESTAMP ;
DESC Z0CASE;
Field	Type	Null	Key	Default	Extra
Z0_TEST0	timestamp	YES		NULL	
Z0_TEST1	timestamp	YES		NULL	
Z0_TEST2	year(4)	YES		NULL	
SELECT table_id,table_name FROM oceanbase.__all_virtual_table WHERE table_name='Z0CASE';
此处和开发确认过，没有兼容MySQL，感觉MySQL的不太合理
ALTER TABLE Z0CASE MODIFY COLUMN Z0_TEST2 TIMESTAMP ;
ERROR 22007: Incorrect value
其他字符类型
DROP TABLE Z0CASE;
CREATE TABLE Z0CASE(Z0_TEST0 DATE, Z0_TEST1 TIME,Z0_TEST2 YEAR) with column group (all columns, each column);
INSERT INTO  Z0CASE (Z0_TEST0,Z0_TEST1,Z0_TEST2)VALUES('2011-11-11 11:11:11',' 11:11:11','2011');
INSERT INTO  Z0CASE (Z0_TEST0,Z0_TEST1,Z0_TEST2)VALUES(0,0,0);
INSERT INTO  Z0CASE (Z0_TEST0,Z0_TEST1,Z0_TEST2)VALUES(NULL,NULL,NULL);
SELECT * FROM Z0CASE ORDER BY Z0_TEST1;
Z0_TEST0	Z0_TEST1	Z0_TEST2
NULL	NULL	NULL
0000-00-00	00:00:00	0000
2011-11-11	11:11:11	2011
SELECT table_id,table_name FROM oceanbase.__all_virtual_table WHERE table_name='Z0CASE';
ALTER TABLE Z0CASE MODIFY COLUMN Z0_TEST0 CHAR(100);
SELECT * FROM Z0CASE ORDER BY Z0_TEST1;
Z0_TEST0	Z0_TEST1	Z0_TEST2
NULL	NULL	NULL
0000-00-00	00:00:00	0000
2011-11-11	11:11:11	2011
DESC Z0CASE;
Field	Type	Null	Key	Default	Extra
Z0_TEST0	char(100)	YES		NULL	
Z0_TEST1	time	YES		NULL	
Z0_TEST2	year(4)	YES		NULL	
SELECT table_id,table_name FROM oceanbase.__all_virtual_table WHERE table_name='Z0CASE';
ALTER TABLE Z0CASE MODIFY COLUMN Z0_TEST1 CHAR(100) ;
SELECT * FROM Z0CASE ORDER BY Z0_TEST1*1;
Z0_TEST0	Z0_TEST1	Z0_TEST2
NULL	NULL	NULL
0000-00-00	00:00:00	0000
2011-11-11	11:11:11	2011
Warnings:
Warning	1292	Truncated incorrect DOUBLE value: '11:11:11'
Warning	1292	Truncated incorrect DOUBLE value: '00:00:00'
DESC Z0CASE;
Field	Type	Null	Key	Default	Extra
Z0_TEST0	char(100)	YES		NULL	
Z0_TEST1	char(100)	YES		NULL	
Z0_TEST2	year(4)	YES		NULL	
SELECT table_id,table_name FROM oceanbase.__all_virtual_table WHERE table_name='Z0CASE';
ALTER TABLE Z0CASE MODIFY COLUMN Z0_TEST2 CHAR(100) ;
SELECT * FROM Z0CASE ORDER BY Z0_TEST1*1;
Z0_TEST0	Z0_TEST1	Z0_TEST2
NULL	NULL	NULL
0000-00-00	00:00:00	0000
2011-11-11	11:11:11	2011
Warnings:
Warning	1292	Truncated incorrect DOUBLE value: '11:11:11'
Warning	1292	Truncated incorrect DOUBLE value: '00:00:00'
DESC Z0CASE;
Field	Type	Null	Key	Default	Extra
Z0_TEST0	char(100)	YES		NULL	
Z0_TEST1	char(100)	YES		NULL	
Z0_TEST2	char(100)	YES		NULL	
SELECT table_id,table_name FROM oceanbase.__all_virtual_table WHERE table_name='Z0CASE';
DROP TABLE Z0CASE;
CREATE TABLE Z0CASE(Z0_TEST0 DATE, Z0_TEST1 TIME,Z0_TEST2 YEAR) with column group (all columns, each column);
INSERT INTO  Z0CASE (Z0_TEST0,Z0_TEST1,Z0_TEST2)VALUES('2011-11-11 11:11:11',' 11:11:11','2011');
INSERT INTO  Z0CASE (Z0_TEST0,Z0_TEST1,Z0_TEST2)VALUES(0,0,0);
INSERT INTO  Z0CASE (Z0_TEST0,Z0_TEST1,Z0_TEST2)VALUES(NULL,NULL,NULL);
SELECT * FROM Z0CASE ORDER BY Z0_TEST1;
Z0_TEST0	Z0_TEST1	Z0_TEST2
NULL	NULL	NULL
0000-00-00	00:00:00	0000
2011-11-11	11:11:11	2011
SELECT table_id,table_name FROM oceanbase.__all_virtual_table WHERE table_name='Z0CASE';
ALTER TABLE Z0CASE MODIFY COLUMN Z0_TEST0 BLOB;
SELECT * FROM Z0CASE ORDER BY Z0_TEST1;
Z0_TEST0	Z0_TEST1	Z0_TEST2
NULL	NULL	NULL
0000-00-00	00:00:00	0000
2011-11-11	11:11:11	2011
DESC Z0CASE;
Field	Type	Null	Key	Default	Extra
Z0_TEST0	blob	YES		NULL	
Z0_TEST1	time	YES		NULL	
Z0_TEST2	year(4)	YES		NULL	
SELECT table_id,table_name FROM oceanbase.__all_virtual_table WHERE table_name='Z0CASE';
ALTER TABLE Z0CASE MODIFY COLUMN Z0_TEST1 BLOB ;
SELECT * FROM Z0CASE ORDER BY Z0_TEST1*1;
Z0_TEST0	Z0_TEST1	Z0_TEST2
NULL	NULL	NULL
0000-00-00	00:00:00	0000
2011-11-11	11:11:11	2011
Warnings:
Warning	1292	Truncated incorrect DOUBLE value: '11:11:11'
Warning	1292	Truncated incorrect DOUBLE value: '00:00:00'
DESC Z0CASE;
Field	Type	Null	Key	Default	Extra
Z0_TEST0	blob	YES		NULL	
Z0_TEST1	blob	YES		NULL	
Z0_TEST2	year(4)	YES		NULL	
SELECT table_id,table_name FROM oceanbase.__all_virtual_table WHERE table_name='Z0CASE';
ALTER TABLE Z0CASE MODIFY COLUMN Z0_TEST2 BLOB ;
SELECT * FROM Z0CASE ORDER BY Z0_TEST1*1;
Z0_TEST0	Z0_TEST1	Z0_TEST2
NULL	NULL	NULL
0000-00-00	00:00:00	0000
2011-11-11	11:11:11	2011
Warnings:
Warning	1292	Truncated incorrect DOUBLE value: '11:11:11'
Warning	1292	Truncated incorrect DOUBLE value: '00:00:00'
DESC Z0CASE;
Field	Type	Null	Key	Default	Extra
Z0_TEST0	blob	YES		NULL	
Z0_TEST1	blob	YES		NULL	
Z0_TEST2	blob	YES		NULL	
SELECT table_id,table_name FROM oceanbase.__all_virtual_table WHERE table_name='Z0CASE';
DROP TABLE Z0CASE;
CREATE TABLE Z0CASE(Z0_TEST0 DATE, Z0_TEST1 TIME,Z0_TEST2 YEAR) with column group (all columns, each column);
INSERT INTO  Z0CASE (Z0_TEST0,Z0_TEST1,Z0_TEST2)VALUES('2011-11-11 11:11:11',' 11:11:11','2011');
INSERT INTO  Z0CASE (Z0_TEST0,Z0_TEST1,Z0_TEST2)VALUES(0,0,0);
INSERT INTO  Z0CASE (Z0_TEST0,Z0_TEST1,Z0_TEST2)VALUES(NULL,NULL,NULL);
SELECT * FROM Z0CASE ORDER BY Z0_TEST1;
Z0_TEST0	Z0_TEST1	Z0_TEST2
NULL	NULL	NULL
0000-00-00	00:00:00	0000
2011-11-11	11:11:11	2011
SELECT table_id,table_name FROM oceanbase.__all_virtual_table WHERE table_name='Z0CASE';
ALTER TABLE Z0CASE MODIFY COLUMN Z0_TEST0 TEXT;
SELECT * FROM Z0CASE ORDER BY Z0_TEST1;
Z0_TEST0	Z0_TEST1	Z0_TEST2
NULL	NULL	NULL
0000-00-00	00:00:00	0000
2011-11-11	11:11:11	2011
DESC Z0CASE;
Field	Type	Null	Key	Default	Extra
Z0_TEST0	text	YES		NULL	
Z0_TEST1	time	YES		NULL	
Z0_TEST2	year(4)	YES		NULL	
SELECT table_id,table_name FROM oceanbase.__all_virtual_table WHERE table_name='Z0CASE';
ALTER TABLE Z0CASE MODIFY COLUMN Z0_TEST1 TEXT;
SELECT * FROM Z0CASE ORDER BY Z0_TEST1*1;
Z0_TEST0	Z0_TEST1	Z0_TEST2
NULL	NULL	NULL
0000-00-00	00:00:00	0000
2011-11-11	11:11:11	2011
Warnings:
Warning	1292	Truncated incorrect DOUBLE value: '11:11:11'
Warning	1292	Truncated incorrect DOUBLE value: '00:00:00'
DESC Z0CASE;
Field	Type	Null	Key	Default	Extra
Z0_TEST0	text	YES		NULL	
Z0_TEST1	text	YES		NULL	
Z0_TEST2	year(4)	YES		NULL	
SELECT table_id,table_name FROM oceanbase.__all_virtual_table WHERE table_name='Z0CASE';
ALTER TABLE Z0CASE MODIFY COLUMN Z0_TEST2 TEXT;
SELECT * FROM Z0CASE ORDER BY Z0_TEST1*1;
Z0_TEST0	Z0_TEST1	Z0_TEST2
NULL	NULL	NULL
0000-00-00	00:00:00	0000
2011-11-11	11:11:11	2011
Warnings:
Warning	1292	Truncated incorrect DOUBLE value: '11:11:11'
Warning	1292	Truncated incorrect DOUBLE value: '00:00:00'
DESC Z0CASE;
Field	Type	Null	Key	Default	Extra
Z0_TEST0	text	YES		NULL	
Z0_TEST1	text	YES		NULL	
Z0_TEST2	text	YES		NULL	
SELECT table_id,table_name FROM oceanbase.__all_virtual_table WHERE table_name='Z0CASE';
DROP TABLE Z0CASE;
CREATE TABLE Z0CASE(Z0_TEST0 DATE, Z0_TEST1 TIME,Z0_TEST2 YEAR) with column group (all columns, each column);
INSERT INTO  Z0CASE (Z0_TEST0,Z0_TEST1,Z0_TEST2)VALUES('2011-11-11 11:11:11',' 11:11:11','2011');
INSERT INTO  Z0CASE (Z0_TEST0,Z0_TEST1,Z0_TEST2)VALUES(0,0,0);
INSERT INTO  Z0CASE (Z0_TEST0,Z0_TEST1,Z0_TEST2)VALUES(NULL,NULL,NULL);
SELECT * FROM Z0CASE ORDER BY Z0_TEST1;
Z0_TEST0	Z0_TEST1	Z0_TEST2
NULL	NULL	NULL
0000-00-00	00:00:00	0000
2011-11-11	11:11:11	2011
SELECT table_id,table_name FROM oceanbase.__all_virtual_table WHERE table_name='Z0CASE';
ALTER TABLE Z0CASE MODIFY COLUMN Z0_TEST0 INT;
SELECT * FROM Z0CASE ORDER BY Z0_TEST1;
Z0_TEST0	Z0_TEST1	Z0_TEST2
NULL	NULL	NULL
0	00:00:00	0000
20111111	11:11:11	2011
DESC Z0CASE;
Field	Type	Null	Key	Default	Extra
Z0_TEST0	int(11)	YES		NULL	
Z0_TEST1	time	YES		NULL	
Z0_TEST2	year(4)	YES		NULL	
SELECT table_id,table_name FROM oceanbase.__all_virtual_table WHERE table_name='Z0CASE';
ALTER TABLE Z0CASE MODIFY COLUMN Z0_TEST1 INT ;
SELECT * FROM Z0CASE ORDER BY Z0_TEST1;
Z0_TEST0	Z0_TEST1	Z0_TEST2
NULL	NULL	NULL
0	0	0000
20111111	111111	2011
DESC Z0CASE;
Field	Type	Null	Key	Default	Extra
Z0_TEST0	int(11)	YES		NULL	
Z0_TEST1	int(11)	YES		NULL	
Z0_TEST2	year(4)	YES		NULL	
SELECT table_id,table_name FROM oceanbase.__all_virtual_table WHERE table_name='Z0CASE';
ALTER TABLE Z0CASE MODIFY COLUMN Z0_TEST2 INT ;
SELECT * FROM Z0CASE ORDER BY Z0_TEST1;
Z0_TEST0	Z0_TEST1	Z0_TEST2
NULL	NULL	NULL
0	0	0
20111111	111111	2011
DESC Z0CASE;
Field	Type	Null	Key	Default	Extra
Z0_TEST0	int(11)	YES		NULL	
Z0_TEST1	int(11)	YES		NULL	
Z0_TEST2	int(11)	YES		NULL	
SELECT table_id,table_name FROM oceanbase.__all_virtual_table WHERE table_name='Z0CASE';
DROP TABLE Z0CASE;
CREATE TABLE Z0CASE(Z0_TEST0 DATE, Z0_TEST1 TIME,Z0_TEST2 YEAR) with column group (all columns, each column);
INSERT INTO  Z0CASE (Z0_TEST0,Z0_TEST1,Z0_TEST2)VALUES('2011-11-11 11:11:11',' 11:11:11','2011');
INSERT INTO  Z0CASE (Z0_TEST0,Z0_TEST1,Z0_TEST2)VALUES(0,0,0);
INSERT INTO  Z0CASE (Z0_TEST0,Z0_TEST1,Z0_TEST2)VALUES(NULL,NULL,NULL);
SELECT * FROM Z0CASE ORDER BY Z0_TEST1;
Z0_TEST0	Z0_TEST1	Z0_TEST2
NULL	NULL	NULL
0000-00-00	00:00:00	0000
2011-11-11	11:11:11	2011
SELECT table_id,table_name FROM oceanbase.__all_virtual_table WHERE table_name='Z0CASE';
ALTER TABLE Z0CASE MODIFY COLUMN Z0_TEST0 FLOAT;
SELECT * FROM Z0CASE ORDER BY Z0_TEST1;
Z0_TEST0	Z0_TEST1	Z0_TEST2
NULL	NULL	NULL
0	00:00:00	0000
20111100	11:11:11	2011
DESC Z0CASE;
Field	Type	Null	Key	Default	Extra
Z0_TEST0	float	YES		NULL	
Z0_TEST1	time	YES		NULL	
Z0_TEST2	year(4)	YES		NULL	
SELECT table_id,table_name FROM oceanbase.__all_virtual_table WHERE table_name='Z0CASE';
ALTER TABLE Z0CASE MODIFY COLUMN Z0_TEST1 FLOAT ;
SELECT * FROM Z0CASE ORDER BY Z0_TEST1;
Z0_TEST0	Z0_TEST1	Z0_TEST2
NULL	NULL	NULL
0	0	0000
20111100	111111	2011
DESC Z0CASE;
Field	Type	Null	Key	Default	Extra
Z0_TEST0	float	YES		NULL	
Z0_TEST1	float	YES		NULL	
Z0_TEST2	year(4)	YES		NULL	
SELECT table_id,table_name FROM oceanbase.__all_virtual_table WHERE table_name='Z0CASE';
ALTER TABLE Z0CASE MODIFY COLUMN Z0_TEST2 FLOAT ;
SELECT * FROM Z0CASE ORDER BY Z0_TEST1;
Z0_TEST0	Z0_TEST1	Z0_TEST2
NULL	NULL	NULL
0	0	0
20111100	111111	2011
DESC Z0CASE;
Field	Type	Null	Key	Default	Extra
Z0_TEST0	float	YES		NULL	
Z0_TEST1	float	YES		NULL	
Z0_TEST2	float	YES		NULL	
SELECT table_id,table_name FROM oceanbase.__all_virtual_table WHERE table_name='Z0CASE';
DATE/DATETIME/TIMESTAMP
DROP TABLE Z0CASE;
CREATE TABLE Z0CASE(Z0_TEST0 DATE, Z0_TEST1 DATETIME,Z0_TEST2 TIMESTAMP) with column group (all columns, each column);
INSERT INTO  Z0CASE (Z0_TEST0,Z0_TEST1,Z0_TEST2)VALUES('2011-11-11 11:11:11','2011-11-11 11:11:11','2011-11-11 11:11:11');
INSERT INTO  Z0CASE (Z0_TEST0,Z0_TEST1,Z0_TEST2)VALUES(0,0,0);
INSERT INTO  Z0CASE (Z0_TEST0,Z0_TEST1,Z0_TEST2)VALUES(NULL,NULL,NULL);
SELECT * FROM Z0CASE ORDER BY Z0_TEST1;
Z0_TEST0	Z0_TEST1	Z0_TEST2
NULL	NULL	NULL
0000-00-00	0000-00-00 00:00:00	0000-00-00 00:00:00
2011-11-11	2011-11-11 11:11:11	2011-11-11 11:11:11
SELECT table_id,table_name FROM oceanbase.__all_virtual_table WHERE table_name='Z0CASE';
ALTER TABLE Z0CASE MODIFY COLUMN Z0_TEST0 DATE DEFAULT 0;
SELECT * FROM Z0CASE ORDER BY Z0_TEST1;
Z0_TEST0	Z0_TEST1	Z0_TEST2
NULL	NULL	NULL
0000-00-00	0000-00-00 00:00:00	0000-00-00 00:00:00
2011-11-11	2011-11-11 11:11:11	2011-11-11 11:11:11
DESC Z0CASE;
Field	Type	Null	Key	Default	Extra
Z0_TEST0	date	YES		0000-00-00	
Z0_TEST1	datetime	YES		NULL	
Z0_TEST2	timestamp	YES		NULL	
SELECT table_id,table_name FROM oceanbase.__all_virtual_table WHERE table_name='Z0CASE';
ALTER TABLE Z0CASE MODIFY COLUMN Z0_TEST1 DATE ;
SELECT * FROM Z0CASE ORDER BY Z0_TEST1;
Z0_TEST0	Z0_TEST1	Z0_TEST2
NULL	NULL	NULL
0000-00-00	0000-00-00	0000-00-00 00:00:00
2011-11-11	2011-11-11	2011-11-11 11:11:11
DESC Z0CASE;
Field	Type	Null	Key	Default	Extra
Z0_TEST0	date	YES		0000-00-00	
Z0_TEST1	date	YES		NULL	
Z0_TEST2	timestamp	YES		NULL	
SELECT table_id,table_name FROM oceanbase.__all_virtual_table WHERE table_name='Z0CASE';
ALTER TABLE Z0CASE MODIFY COLUMN Z0_TEST2 DATE ;
SELECT * FROM Z0CASE ORDER BY Z0_TEST1;
Z0_TEST0	Z0_TEST1	Z0_TEST2
NULL	NULL	NULL
0000-00-00	0000-00-00	0000-00-00
2011-11-11	2011-11-11	2011-11-11
DESC Z0CASE;
Field	Type	Null	Key	Default	Extra
Z0_TEST0	date	YES		0000-00-00	
Z0_TEST1	date	YES		NULL	
Z0_TEST2	date	YES		NULL	
SELECT table_id,table_name FROM oceanbase.__all_virtual_table WHERE table_name='Z0CASE';
DROP TABLE Z0CASE;
CREATE TABLE Z0CASE(Z0_TEST0 DATE, Z0_TEST1 DATETIME,Z0_TEST2 TIMESTAMP) with column group (all columns, each column);
INSERT INTO  Z0CASE (Z0_TEST0,Z0_TEST1,Z0_TEST2)VALUES('2011-11-11 11:11:11','2011-11-11 11:11:11','2011-11-11 11:11:11');
INSERT INTO  Z0CASE (Z0_TEST0,Z0_TEST1,Z0_TEST2)VALUES(0,0,0);
INSERT INTO  Z0CASE (Z0_TEST0,Z0_TEST1,Z0_TEST2)VALUES(NULL,NULL,NULL);
SELECT * FROM Z0CASE ORDER BY Z0_TEST1;
Z0_TEST0	Z0_TEST1	Z0_TEST2
NULL	NULL	NULL
0000-00-00	0000-00-00 00:00:00	0000-00-00 00:00:00
2011-11-11	2011-11-11 11:11:11	2011-11-11 11:11:11
SELECT table_id,table_name FROM oceanbase.__all_virtual_table WHERE table_name='Z0CASE';
ALTER TABLE Z0CASE MODIFY COLUMN Z0_TEST0 DATETIME DEFAULT 0;
SELECT * FROM Z0CASE ORDER BY Z0_TEST1;
Z0_TEST0	Z0_TEST1	Z0_TEST2
NULL	NULL	NULL
0000-00-00 00:00:00	0000-00-00 00:00:00	0000-00-00 00:00:00
2011-11-11 00:00:00	2011-11-11 11:11:11	2011-11-11 11:11:11
DESC Z0CASE;
Field	Type	Null	Key	Default	Extra
Z0_TEST0	datetime	YES		0000-00-00 00:00:00	
Z0_TEST1	datetime	YES		NULL	
Z0_TEST2	timestamp	YES		NULL	
SELECT table_id,table_name FROM oceanbase.__all_virtual_table WHERE table_name='Z0CASE';
ALTER TABLE Z0CASE MODIFY COLUMN Z0_TEST1 DATETIME;
SELECT * FROM Z0CASE ORDER BY Z0_TEST1;
Z0_TEST0	Z0_TEST1	Z0_TEST2
NULL	NULL	NULL
0000-00-00 00:00:00	0000-00-00 00:00:00	0000-00-00 00:00:00
2011-11-11 00:00:00	2011-11-11 11:11:11	2011-11-11 11:11:11
DESC Z0CASE;
Field	Type	Null	Key	Default	Extra
Z0_TEST0	datetime	YES		0000-00-00 00:00:00	
Z0_TEST1	datetime	YES		NULL	
Z0_TEST2	timestamp	YES		NULL	
SELECT table_id,table_name FROM oceanbase.__all_virtual_table WHERE table_name='Z0CASE';
ALTER TABLE Z0CASE MODIFY COLUMN Z0_TEST2 DATETIME;
SELECT * FROM Z0CASE ORDER BY Z0_TEST1;
Z0_TEST0	Z0_TEST1	Z0_TEST2
NULL	NULL	NULL
0000-00-00 00:00:00	0000-00-00 00:00:00	0000-00-00 00:00:00
2011-11-11 00:00:00	2011-11-11 11:11:11	2011-11-11 11:11:11
DESC Z0CASE;
Field	Type	Null	Key	Default	Extra
Z0_TEST0	datetime	YES		0000-00-00 00:00:00	
Z0_TEST1	datetime	YES		NULL	
Z0_TEST2	datetime	YES		NULL	
SELECT table_id,table_name FROM oceanbase.__all_virtual_table WHERE table_name='Z0CASE';
DROP TABLE Z0CASE;
CREATE TABLE Z0CASE(Z0_TEST0 DATE, Z0_TEST1 DATETIME,Z0_TEST2 TIMESTAMP) with column group (all columns, each column);
INSERT INTO  Z0CASE (Z0_TEST0,Z0_TEST1,Z0_TEST2)VALUES('2011-11-11 11:11:11','2011-11-11 11:11:11','2011-11-11 11:11:11');
INSERT INTO  Z0CASE (Z0_TEST0,Z0_TEST1,Z0_TEST2)VALUES(0,0,0);
INSERT INTO  Z0CASE (Z0_TEST0,Z0_TEST1,Z0_TEST2)VALUES(NULL,NULL,NULL);
SELECT * FROM Z0CASE ORDER BY Z0_TEST1;
Z0_TEST0	Z0_TEST1	Z0_TEST2
NULL	NULL	NULL
0000-00-00	0000-00-00 00:00:00	0000-00-00 00:00:00
2011-11-11	2011-11-11 11:11:11	2011-11-11 11:11:11
SELECT table_id,table_name FROM oceanbase.__all_virtual_table WHERE table_name='Z0CASE';
ALTER TABLE Z0CASE MODIFY COLUMN Z0_TEST0 TIMESTAMP DEFAULT 0;
SELECT * FROM Z0CASE ORDER BY Z0_TEST1;
Z0_TEST0	Z0_TEST1	Z0_TEST2
NULL	NULL	NULL
0000-00-00 00:00:00	0000-00-00 00:00:00	0000-00-00 00:00:00
2011-11-11 00:00:00	2011-11-11 11:11:11	2011-11-11 11:11:11
DESC Z0CASE;
Field	Type	Null	Key	Default	Extra
Z0_TEST0	timestamp	YES		0000-00-00 00:00:00	
Z0_TEST1	datetime	YES		NULL	
Z0_TEST2	timestamp	YES		NULL	
SELECT table_id,table_name FROM oceanbase.__all_virtual_table WHERE table_name='Z0CASE';
ALTER TABLE Z0CASE MODIFY COLUMN Z0_TEST1 TIMESTAMP ;
SELECT * FROM Z0CASE ORDER BY Z0_TEST1;
Z0_TEST0	Z0_TEST1	Z0_TEST2
NULL	NULL	NULL
0000-00-00 00:00:00	0000-00-00 00:00:00	0000-00-00 00:00:00
2011-11-11 00:00:00	2011-11-11 11:11:11	2011-11-11 11:11:11
DESC Z0CASE;
Field	Type	Null	Key	Default	Extra
Z0_TEST0	timestamp	YES		0000-00-00 00:00:00	
Z0_TEST1	timestamp	YES		NULL	
Z0_TEST2	timestamp	YES		NULL	
SELECT table_id,table_name FROM oceanbase.__all_virtual_table WHERE table_name='Z0CASE';
ALTER TABLE Z0CASE MODIFY COLUMN Z0_TEST2 TIMESTAMP ;
SELECT * FROM Z0CASE ORDER BY Z0_TEST1;
Z0_TEST0	Z0_TEST1	Z0_TEST2
NULL	NULL	NULL
0000-00-00 00:00:00	0000-00-00 00:00:00	0000-00-00 00:00:00
2011-11-11 00:00:00	2011-11-11 11:11:11	2011-11-11 11:11:11
DESC Z0CASE;
Field	Type	Null	Key	Default	Extra
Z0_TEST0	timestamp	YES		0000-00-00 00:00:00	
Z0_TEST1	timestamp	YES		NULL	
Z0_TEST2	timestamp	YES		NULL	
SELECT table_id,table_name FROM oceanbase.__all_virtual_table WHERE table_name='Z0CASE';
其他字符类型
DROP TABLE Z0CASE;
CREATE TABLE Z0CASE(Z0_TEST0 DATE, Z0_TEST1 DATETIME,Z0_TEST2 TIMESTAMP) with column group (all columns, each column);
INSERT INTO  Z0CASE (Z0_TEST0,Z0_TEST1,Z0_TEST2)VALUES('2011-11-11 11:11:11','2011-11-11 11:11:11','2011-11-11 11:11:11');
INSERT INTO  Z0CASE (Z0_TEST0,Z0_TEST1,Z0_TEST2)VALUES(0,0,0);
INSERT INTO  Z0CASE (Z0_TEST0,Z0_TEST1,Z0_TEST2)VALUES(NULL,NULL,NULL);
SELECT * FROM Z0CASE ORDER BY Z0_TEST1;
Z0_TEST0	Z0_TEST1	Z0_TEST2
NULL	NULL	NULL
0000-00-00	0000-00-00 00:00:00	0000-00-00 00:00:00
2011-11-11	2011-11-11 11:11:11	2011-11-11 11:11:11
SELECT table_id,table_name FROM oceanbase.__all_virtual_table WHERE table_name='Z0CASE';
ALTER TABLE Z0CASE MODIFY COLUMN Z0_TEST0 CHAR(100) DEFAULT 0;
SELECT * FROM Z0CASE ORDER BY Z0_TEST1;
Z0_TEST0	Z0_TEST1	Z0_TEST2
NULL	NULL	NULL
0000-00-00	0000-00-00 00:00:00	0000-00-00 00:00:00
2011-11-11	2011-11-11 11:11:11	2011-11-11 11:11:11
DESC Z0CASE;
Field	Type	Null	Key	Default	Extra
Z0_TEST0	char(100)	YES		0	
Z0_TEST1	datetime	YES		NULL	
Z0_TEST2	timestamp	YES		NULL	
SELECT table_id,table_name FROM oceanbase.__all_virtual_table WHERE table_name='Z0CASE';
ALTER TABLE Z0CASE MODIFY COLUMN Z0_TEST1 CHAR(100);
SELECT * FROM Z0CASE ORDER BY Z0_TEST1*1;
Z0_TEST0	Z0_TEST1	Z0_TEST2
NULL	NULL	NULL
0000-00-00	0000-00-00 00:00:00	0000-00-00 00:00:00
2011-11-11	2011-11-11 11:11:11	2011-11-11 11:11:11
Warnings:
Warning	1292	Truncated incorrect DOUBLE value: '2011-11-11 11:11:11'
Warning	1292	Truncated incorrect DOUBLE value: '0000-00-00 00:00:00'
DESC Z0CASE;
Field	Type	Null	Key	Default	Extra
Z0_TEST0	char(100)	YES		0	
Z0_TEST1	char(100)	YES		NULL	
Z0_TEST2	timestamp	YES		NULL	
SELECT table_id,table_name FROM oceanbase.__all_virtual_table WHERE table_name='Z0CASE';
ALTER TABLE Z0CASE MODIFY COLUMN Z0_TEST2 CHAR(100);
SELECT * FROM Z0CASE ORDER BY Z0_TEST1*1;
Z0_TEST0	Z0_TEST1	Z0_TEST2
NULL	NULL	NULL
0000-00-00	0000-00-00 00:00:00	0000-00-00 00:00:00
2011-11-11	2011-11-11 11:11:11	2011-11-11 11:11:11
Warnings:
Warning	1292	Truncated incorrect DOUBLE value: '2011-11-11 11:11:11'
Warning	1292	Truncated incorrect DOUBLE value: '0000-00-00 00:00:00'
DESC Z0CASE;
Field	Type	Null	Key	Default	Extra
Z0_TEST0	char(100)	YES		0	
Z0_TEST1	char(100)	YES		NULL	
Z0_TEST2	char(100)	YES		NULL	
SELECT table_id,table_name FROM oceanbase.__all_virtual_table WHERE table_name='Z0CASE';
DROP TABLE Z0CASE;
CREATE TABLE Z0CASE(Z0_TEST0 DATE, Z0_TEST1 DATETIME,Z0_TEST2 TIMESTAMP) with column group (all columns, each column);
INSERT INTO  Z0CASE (Z0_TEST0,Z0_TEST1,Z0_TEST2)VALUES('2011-11-11 11:11:11','2011-11-11 11:11:11','2011-11-11 11:11:11');
INSERT INTO  Z0CASE (Z0_TEST0,Z0_TEST1,Z0_TEST2)VALUES(0,0,0);
INSERT INTO  Z0CASE (Z0_TEST0,Z0_TEST1,Z0_TEST2)VALUES(NULL,NULL,NULL);
SELECT * FROM Z0CASE ORDER BY Z0_TEST1;
Z0_TEST0	Z0_TEST1	Z0_TEST2
NULL	NULL	NULL
0000-00-00	0000-00-00 00:00:00	0000-00-00 00:00:00
2011-11-11	2011-11-11 11:11:11	2011-11-11 11:11:11
SELECT table_id,table_name FROM oceanbase.__all_virtual_table WHERE table_name='Z0CASE';
ALTER TABLE Z0CASE MODIFY COLUMN Z0_TEST0 BLOB;
SELECT * FROM Z0CASE ORDER BY Z0_TEST1;
Z0_TEST0	Z0_TEST1	Z0_TEST2
NULL	NULL	NULL
0000-00-00	0000-00-00 00:00:00	0000-00-00 00:00:00
2011-11-11	2011-11-11 11:11:11	2011-11-11 11:11:11
DESC Z0CASE;
Field	Type	Null	Key	Default	Extra
Z0_TEST0	blob	YES		NULL	
Z0_TEST1	datetime	YES		NULL	
Z0_TEST2	timestamp	YES		NULL	
SELECT table_id,table_name FROM oceanbase.__all_virtual_table WHERE table_name='Z0CASE';
ALTER TABLE Z0CASE MODIFY COLUMN Z0_TEST1 BLOB;
SELECT * FROM Z0CASE ORDER BY Z0_TEST1*1;
Z0_TEST0	Z0_TEST1	Z0_TEST2
NULL	NULL	NULL
0000-00-00	0000-00-00 00:00:00	0000-00-00 00:00:00
2011-11-11	2011-11-11 11:11:11	2011-11-11 11:11:11
Warnings:
Warning	1292	Truncated incorrect DOUBLE value: '2011-11-11 11:11:11'
Warning	1292	Truncated incorrect DOUBLE value: '0000-00-00 00:00:00'
DESC Z0CASE;
Field	Type	Null	Key	Default	Extra
Z0_TEST0	blob	YES		NULL	
Z0_TEST1	blob	YES		NULL	
Z0_TEST2	timestamp	YES		NULL	
SELECT table_id,table_name FROM oceanbase.__all_virtual_table WHERE table_name='Z0CASE';
ALTER TABLE Z0CASE MODIFY COLUMN Z0_TEST2 BLOB;
SELECT * FROM Z0CASE ORDER BY Z0_TEST1*1;
Z0_TEST0	Z0_TEST1	Z0_TEST2
NULL	NULL	NULL
0000-00-00	0000-00-00 00:00:00	0000-00-00 00:00:00
2011-11-11	2011-11-11 11:11:11	2011-11-11 11:11:11
Warnings:
Warning	1292	Truncated incorrect DOUBLE value: '2011-11-11 11:11:11'
Warning	1292	Truncated incorrect DOUBLE value: '0000-00-00 00:00:00'
DESC Z0CASE;
Field	Type	Null	Key	Default	Extra
Z0_TEST0	blob	YES		NULL	
Z0_TEST1	blob	YES		NULL	
Z0_TEST2	blob	YES		NULL	
SELECT table_id,table_name FROM oceanbase.__all_virtual_table WHERE table_name='Z0CASE';
DROP TABLE Z0CASE;
CREATE TABLE Z0CASE(Z0_TEST0 DATE, Z0_TEST1 DATETIME,Z0_TEST2 TIMESTAMP) with column group (all columns, each column);
INSERT INTO  Z0CASE (Z0_TEST0,Z0_TEST1,Z0_TEST2)VALUES('2011-11-11 11:11:11','2011-11-11 11:11:11','2011-11-11 11:11:11');
INSERT INTO  Z0CASE (Z0_TEST0,Z0_TEST1,Z0_TEST2)VALUES(0,0,0);
INSERT INTO  Z0CASE (Z0_TEST0,Z0_TEST1,Z0_TEST2)VALUES(NULL,NULL,NULL);
SELECT * FROM Z0CASE ORDER BY Z0_TEST1;
Z0_TEST0	Z0_TEST1	Z0_TEST2
NULL	NULL	NULL
0000-00-00	0000-00-00 00:00:00	0000-00-00 00:00:00
2011-11-11	2011-11-11 11:11:11	2011-11-11 11:11:11
SELECT table_id,table_name FROM oceanbase.__all_virtual_table WHERE table_name='Z0CASE';
ALTER TABLE Z0CASE MODIFY COLUMN Z0_TEST0 INT;
SELECT * FROM Z0CASE ORDER BY Z0_TEST0;
Z0_TEST0	Z0_TEST1	Z0_TEST2
NULL	NULL	NULL
0	0000-00-00 00:00:00	0000-00-00 00:00:00
20111111	2011-11-11 11:11:11	2011-11-11 11:11:11
DESC Z0CASE;
Field	Type	Null	Key	Default	Extra
Z0_TEST0	int(11)	YES		NULL	
Z0_TEST1	datetime	YES		NULL	
Z0_TEST2	timestamp	YES		NULL	
SELECT table_id,table_name FROM oceanbase.__all_virtual_table WHERE table_name='Z0CASE';
ALTER TABLE Z0CASE MODIFY COLUMN Z0_TEST1 INT;
ERROR 22003: Out of range value for column
ALTER TABLE Z0CASE MODIFY COLUMN Z0_TEST1 BIGINT;
SELECT * FROM Z0CASE ORDER BY Z0_TEST0;
Z0_TEST0	Z0_TEST1	Z0_TEST2
NULL	NULL	NULL
0	0	0000-00-00 00:00:00
20111111	20111111111111	2011-11-11 11:11:11
DESC Z0CASE;
Field	Type	Null	Key	Default	Extra
Z0_TEST0	int(11)	YES		NULL	
Z0_TEST1	bigint(20)	YES		NULL	
Z0_TEST2	timestamp	YES		NULL	
SELECT table_id,table_name FROM oceanbase.__all_virtual_table WHERE table_name='Z0CASE';
ALTER TABLE Z0CASE MODIFY COLUMN Z0_TEST2 INT;
ERROR 22003: Out of range value for column
ALTER TABLE Z0CASE MODIFY COLUMN Z0_TEST2 BIGINT;
SELECT * FROM Z0CASE ORDER BY Z0_TEST0;
Z0_TEST0	Z0_TEST1	Z0_TEST2
NULL	NULL	NULL
0	0	0
20111111	20111111111111	20111111111111
DESC Z0CASE;
Field	Type	Null	Key	Default	Extra
Z0_TEST0	int(11)	YES		NULL	
Z0_TEST1	bigint(20)	YES		NULL	
Z0_TEST2	bigint(20)	YES		NULL	
SELECT table_id,table_name FROM oceanbase.__all_virtual_table WHERE table_name='Z0CASE';
binary/VARBINARY
binary-->binary
DROP TABLE Z0CASE;
CREATE TABLE Z0CASE (Z0_TEST0 binary(100),Z0_TEST1 INT)  with column group (all columns, each column);
INSERT INTO Z0CASE (Z0_TEST0,Z0_TEST1)VALUES(1,'111');
INSERT INTO Z0CASE (Z0_TEST0,Z0_TEST1)VALUES(2,'2');
INSERT INTO Z0CASE (Z0_TEST0,Z0_TEST1)VALUES(30,'30');
INSERT INTO Z0CASE (Z0_TEST0,Z0_TEST1)VALUES(64,'121');
SELECT * FROM Z0CASE ORDER BY Z0_TEST1;
Z0_TEST0	Z0_TEST1
2                                                                                                   	2
30                                                                                                  	30
1                                                                                                   	111
64                                                                                                  	121
SELECT table_id,table_name FROM oceanbase.__all_virtual_table WHERE table_name='Z0CASE';
ALTER TABLE Z0CASE modify  Z0_TEST0 binary(99);
ERROR 22001: Data too long for column
ALTER TABLE Z0CASE modify  Z0_TEST0 binary(101);
SELECT * FROM Z0CASE ORDER BY Z0_TEST1;
Z0_TEST0	Z0_TEST1
2                                                                                                    	2
30                                                                                                   	30
1                                                                                                    	111
64                                                                                                   	121
DESC Z0CASE;
Field	Type	Null	Key	Default	Extra
Z0_TEST0	binary(101)	YES		NULL	
Z0_TEST1	int(11)	YES		NULL	
SELECT table_id,table_name FROM oceanbase.__all_virtual_table WHERE table_name='Z0CASE';
binary-->VARBINARY
DROP TABLE Z0CASE;
CREATE TABLE Z0CASE (Z0_TEST0 binary(100),Z0_TEST1 INT)  with column group (all columns, each column);
INSERT INTO Z0CASE (Z0_TEST0,Z0_TEST1)VALUES(1,'111');
INSERT INTO Z0CASE (Z0_TEST0,Z0_TEST1)VALUES(2,'2');
INSERT INTO Z0CASE (Z0_TEST0,Z0_TEST1)VALUES(30,'30');
INSERT INTO Z0CASE (Z0_TEST0,Z0_TEST1)VALUES(64,'141');
SELECT * FROM Z0CASE ORDER BY Z0_TEST1;
Z0_TEST0	Z0_TEST1
2                                                                                                   	2
30                                                                                                  	30
1                                                                                                   	111
64                                                                                                  	141
SELECT table_id,table_name FROM oceanbase.__all_virtual_table WHERE table_name='Z0CASE';
ALTER TABLE Z0CASE modify  Z0_TEST0 VARBINARY(100);
SELECT * FROM Z0CASE ORDER BY Z0_TEST1;
Z0_TEST0	Z0_TEST1
2                                                                                                   	2
30                                                                                                  	30
1                                                                                                   	111
64                                                                                                  	141
DESC Z0CASE;
Field	Type	Null	Key	Default	Extra
Z0_TEST0	varbinary(100)	YES		NULL	
Z0_TEST1	int(11)	YES		NULL	
SELECT table_id,table_name FROM oceanbase.__all_virtual_table WHERE table_name='Z0CASE';
INSERT INTO Z0CASE (Z0_TEST0,Z0_TEST1)VALUES(11234567890123456789012345678901234567890123456789012345678901234567890123456789012345678901234567890,'11');
ERROR 22001: Data too long for column 'Z0_TEST0' at row 1
INSERT INTO Z0CASE (Z0_TEST0,Z0_TEST1)VALUES('qqwertasdfgzxcvbnmjklqwertasdfgzxcvbnmjklqwertasdfgzxcvbnmjklqwertasdfgzxcvbnmjklqwertasdfgzxcvbnmjkl','11');
ERROR 22001: Data too long for column 'Z0_TEST0' at row 1
INSERT INTO Z0CASE (Z0_TEST0,Z0_TEST1)VALUES(1234567890123456789012345678901234567890123456789012345678901234567890123456789012345678901234567890,'1');
INSERT INTO Z0CASE (Z0_TEST0,Z0_TEST1)VALUES('qwertasdfgzxcvbnmjklqwertasdfgzxcvbnmjklqwertasdfgzxcvbnmjklqwertasdfgzxcvbnmjklqwertasdfgzxcvbnmjkl','12');
SELECT * FROM Z0CASE ORDER BY Z0_TEST1;
Z0_TEST0	Z0_TEST1
1234567890123456789012345678901234567890123456789012345678901234567890120000000000000000000000000000	1
2                                                                                                   	2
qwertasdfgzxcvbnmjklqwertasdfgzxcvbnmjklqwertasdfgzxcvbnmjklqwertasdfgzxcvbnmjklqwertasdfgzxcvbnmjkl	12
30                                                                                                  	30
1                                                                                                   	111
64                                                                                                  	141
UPDATE Z0CASE SET Z0_TEST0='21234567890123456789012345678901234567890123456789012345678901234567890123456789012345678901234567890' WHERE Z0_TEST1='2';
ERROR 22001: Data too long for column 'Z0_TEST0' at row 1
UPDATE Z0CASE SET Z0_TEST0=2234567890123456789012345678901234567890123456789012345678901234567890123456789012345678901234567890 WHERE Z0_TEST1='2';
UPDATE Z0CASE SET Z0_TEST0='qwertasdfgzxcvbnmjklqwertasdfgzxcvbnmjklqwertasdfgzxcvbnmjklqwertasdfgzxcvbnmjklqwertasdfgzxcvbnmjkl' WHERE Z0_TEST1='30';
SELECT * FROM Z0CASE ORDER BY Z0_TEST1;
Z0_TEST0	Z0_TEST1
1234567890123456789012345678901234567890123456789012345678901234567890120000000000000000000000000000	1
2234567890123456789012345678901234567890123456789012345678901234567890120000000000000000000000000000	2
qwertasdfgzxcvbnmjklqwertasdfgzxcvbnmjklqwertasdfgzxcvbnmjklqwertasdfgzxcvbnmjklqwertasdfgzxcvbnmjkl	12
qwertasdfgzxcvbnmjklqwertasdfgzxcvbnmjklqwertasdfgzxcvbnmjklqwertasdfgzxcvbnmjklqwertasdfgzxcvbnmjkl	30
1                                                                                                   	111
64                                                                                                  	141
DELETE FROM Z0CASE WHERE Z0_TEST0='qwertasdfgzxcvbnmjklqwertasdfgzxcvbnmjklqwertasdfgzxcvbnmjklqwertasdfgzxcvbnmjklqwertasdfgzxcvbnmjkl';
DELETE FROM Z0CASE WHERE Z0_TEST0=2234567890123456789012345678901234567890123456789012345678901234567890120000000000000000000000000000;
ERROR 22007: Truncated incorrect DECIMAL value: '1'
DELETE FROM Z0CASE WHERE Z0_TEST0='2234567890123456789012345678901234567890123456789012345678901234567890120000000000000000000000000000';
SELECT * FROM Z0CASE ORDER BY Z0_TEST1;
Z0_TEST0	Z0_TEST1
1234567890123456789012345678901234567890123456789012345678901234567890120000000000000000000000000000	1
1                                                                                                   	111
64                                                                                                  	141
ALTER TABLE Z0CASE modify  Z0_TEST0 VARBINARY(99);
ERROR 22001: Data too long for column
ALTER TABLE Z0CASE modify  Z0_TEST0 VARBINARY(101);
SELECT * FROM Z0CASE ORDER BY Z0_TEST1;
Z0_TEST0	Z0_TEST1
1234567890123456789012345678901234567890123456789012345678901234567890120000000000000000000000000000	1
1                                                                                                   	111
64                                                                                                  	141
DESC Z0CASE;
Field	Type	Null	Key	Default	Extra
Z0_TEST0	varbinary(101)	YES		NULL	
Z0_TEST1	int(11)	YES		NULL	
SELECT table_id,table_name FROM oceanbase.__all_virtual_table WHERE table_name='Z0CASE';
ALTER TABLE Z0CASE modify  Z0_TEST0 VARBINARY(100);
SELECT * FROM Z0CASE ORDER BY Z0_TEST1;
Z0_TEST0	Z0_TEST1
1234567890123456789012345678901234567890123456789012345678901234567890120000000000000000000000000000	1
1                                                                                                   	111
64                                                                                                  	141
DESC Z0CASE;
Field	Type	Null	Key	Default	Extra
Z0_TEST0	varbinary(100)	YES		NULL	
Z0_TEST1	int(11)	YES		NULL	
SELECT table_id,table_name FROM oceanbase.__all_virtual_table WHERE table_name='Z0CASE';
VARBINARY-->VARBINARY
DROP TABLE Z0CASE;
CREATE TABLE Z0CASE (Z0_TEST0 VARBINARY(100),Z0_TEST1 INT)  with column group (all columns, each column);
INSERT INTO Z0CASE (Z0_TEST0,Z0_TEST1)VALUES(1,'111');
INSERT INTO Z0CASE (Z0_TEST0,Z0_TEST1)VALUES(2,'2');
INSERT INTO Z0CASE (Z0_TEST0,Z0_TEST1)VALUES(30,'30');
INSERT INTO Z0CASE (Z0_TEST0,Z0_TEST1)VALUES(64,'121');
SELECT * FROM Z0CASE ORDER BY Z0_TEST1;
Z0_TEST0	Z0_TEST1
2	2
30	30
1	111
64	121
SELECT table_id,table_name FROM oceanbase.__all_virtual_table WHERE table_name='Z0CASE';
ALTER TABLE Z0CASE modify  Z0_TEST0 VARBINARY(1048576);
SELECT * FROM Z0CASE ORDER BY Z0_TEST1;
Z0_TEST0	Z0_TEST1
2	2
30	30
1	111
64	121
DESC Z0CASE;
Field	Type	Null	Key	Default	Extra
Z0_TEST0	varbinary(1048576)	YES		NULL	
Z0_TEST1	int(11)	YES		NULL	
SELECT table_id,table_name FROM oceanbase.__all_virtual_table WHERE table_name='Z0CASE';
ALTER TABLE Z0CASE modify  Z0_TEST0 VARBINARY(0);
ERROR 22001: Data too long for column
VARBINARY-->binary
DROP TABLE Z0CASE;
CREATE TABLE Z0CASE (Z0_TEST0 VARBINARY(100),Z0_TEST1 INT)  with column group (all columns, each column);
INSERT INTO Z0CASE (Z0_TEST0,Z0_TEST1)VALUES(1,'111');
INSERT INTO Z0CASE (Z0_TEST0,Z0_TEST1)VALUES(2,'2');
INSERT INTO Z0CASE (Z0_TEST0,Z0_TEST1)VALUES(30,'30');
INSERT INTO Z0CASE (Z0_TEST0,Z0_TEST1)VALUES(64,'121');
SELECT * FROM Z0CASE ORDER BY Z0_TEST1;
Z0_TEST0	Z0_TEST1
2	2
30	30
1	111
64	121
SELECT table_id,table_name FROM oceanbase.__all_virtual_table WHERE table_name='Z0CASE';
ALTER TABLE Z0CASE modify  Z0_TEST0 binary(101);
SELECT * FROM Z0CASE ORDER BY Z0_TEST1;
Z0_TEST0	Z0_TEST1
2                                                                                                    	2
30                                                                                                   	30
1                                                                                                    	111
64                                                                                                   	121
DESC Z0CASE;
Field	Type	Null	Key	Default	Extra
Z0_TEST0	binary(101)	YES		NULL	
Z0_TEST1	int(11)	YES		NULL	
SELECT table_id,table_name FROM oceanbase.__all_virtual_table WHERE table_name='Z0CASE';
INSERT INTO Z0CASE (Z0_TEST0,Z0_TEST1)VALUES(110234567890123456789012345678901234567890123456789012345678901234567890123456789012345678901234567890,'111');
ERROR 22001: Data too long for column 'Z0_TEST0' at row 1
INSERT INTO Z0CASE (Z0_TEST0,Z0_TEST1)VALUES('qqqwertasdfgzxcvbnmjklqwertasdfgzxcvbnmjklqwertasdfgzxcvbnmjklqwertasdfgzxcvbnmjklqwertasdfgzxcvbnmjkl','111');
ERROR 22001: Data too long for column 'Z0_TEST0' at row 1
INSERT INTO Z0CASE (Z0_TEST0,Z0_TEST1)VALUES(11234567890123456789012345678901234567890123456789012345678901234567890123456789012345678901234567890,'111');
INSERT INTO Z0CASE (Z0_TEST0,Z0_TEST1)VALUES('qqwertasdfgzxcvbnmjklqwertasdfgzxcvbnmjklqwertasdfgzxcvbnmjklqwertasdfgzxcvbnmjklqwertasdfgzxcvbnmjkl','111');
SELECT * FROM Z0CASE ORDER BY Z0_TEST1;
Z0_TEST0	Z0_TEST1
2                                                                                                    	2
30                                                                                                   	30
1                                                                                                    	111
11234567890123456789012345678901234567890123456789012345678901234567890100000000000000000000000000000	111
qqwertasdfgzxcvbnmjklqwertasdfgzxcvbnmjklqwertasdfgzxcvbnmjklqwertasdfgzxcvbnmjklqwertasdfgzxcvbnmjkl	111
64                                                                                                   	121
UPDATE Z0CASE SET Z0_TEST0='210234567890123456789012345678901234567890123456789012345678901234567890123456789012345678901234567890' WHERE Z0_TEST1='2';
ERROR 22001: Data too long for column 'Z0_TEST0' at row 1
UPDATE Z0CASE SET Z0_TEST0=21234567890123456789012345678901234567890123456789012345678901234567890123456789012345678901234567890 WHERE Z0_TEST1='2';
UPDATE Z0CASE SET Z0_TEST0='qwertasdfgzxcvbnmjklqwertasdfgzxcvbnmjklqwertasdfgzxcvbnmjklqwertasdfgzxcvbnmjklqwertasdfgzxcvbnmjkl' WHERE Z0_TEST1='30';
SELECT * FROM Z0CASE ORDER BY Z0_TEST1;
Z0_TEST0	Z0_TEST1
21234567890123456789012345678901234567890123456789012345678901234567890100000000000000000000000000000	2
qwertasdfgzxcvbnmjklqwertasdfgzxcvbnmjklqwertasdfgzxcvbnmjklqwertasdfgzxcvbnmjklqwertasdfgzxcvbnmjkl 	30
1                                                                                                    	111
11234567890123456789012345678901234567890123456789012345678901234567890100000000000000000000000000000	111
qqwertasdfgzxcvbnmjklqwertasdfgzxcvbnmjklqwertasdfgzxcvbnmjklqwertasdfgzxcvbnmjklqwertasdfgzxcvbnmjkl	111
64                                                                                                   	121
DELETE FROM Z0CASE WHERE Z0_TEST0='qqwertasdfgzxcvbnmjklqwertasdfgzxcvbnmjklqwertasdfgzxcvbnmjklqwertasdfgzxcvbnmjklqwertasdfgzxcvbnmjkl';
DELETE FROM Z0CASE WHERE Z0_TEST0='11234567890123456789012345678901234567890123456789012345678901234567890100000000000000000000000000000';
SELECT * FROM Z0CASE ORDER BY Z0_TEST1;
Z0_TEST0	Z0_TEST1
21234567890123456789012345678901234567890123456789012345678901234567890100000000000000000000000000000	2
qwertasdfgzxcvbnmjklqwertasdfgzxcvbnmjklqwertasdfgzxcvbnmjklqwertasdfgzxcvbnmjklqwertasdfgzxcvbnmjkl 	30
1                                                                                                    	111
64                                                                                                   	121
ALTER TABLE Z0CASE modify  Z0_TEST0 binary(100);
ERROR 22001: Data too long for column
DROP TABLE Z0CASE;
CREATE TABLE Z0CASE (Z0_TEST0 VARBINARY(100),Z0_TEST1 INT)  with column group (all columns, each column);
INSERT INTO Z0CASE (Z0_TEST0,Z0_TEST1)VALUES(1,'111');
INSERT INTO Z0CASE (Z0_TEST0,Z0_TEST1)VALUES(2,'2');
INSERT INTO Z0CASE (Z0_TEST0,Z0_TEST1)VALUES(30,'30');
INSERT INTO Z0CASE (Z0_TEST0,Z0_TEST1)VALUES(64,'121');
SELECT * FROM Z0CASE ORDER BY Z0_TEST1;
Z0_TEST0	Z0_TEST1
2	2
30	30
1	111
64	121
SELECT table_id,table_name FROM oceanbase.__all_virtual_table WHERE table_name='Z0CASE';
ALTER TABLE Z0CASE modify  Z0_TEST0 binary(100);
SELECT * FROM Z0CASE ORDER BY Z0_TEST1;
Z0_TEST0	Z0_TEST1
2                                                                                                   	2
30                                                                                                  	30
1                                                                                                   	111
64                                                                                                  	121
DESC Z0CASE;
Field	Type	Null	Key	Default	Extra
Z0_TEST0	binary(100)	YES		NULL	
Z0_TEST1	int(11)	YES		NULL	
SELECT table_id,table_name FROM oceanbase.__all_virtual_table WHERE table_name='Z0CASE';
ALTER TABLE Z0CASE modify  Z0_TEST0 binary(101);
SELECT * FROM Z0CASE ORDER BY Z0_TEST1;
Z0_TEST0	Z0_TEST1
2                                                                                                    	2
30                                                                                                   	30
1                                                                                                    	111
64                                                                                                   	121
DESC Z0CASE;
Field	Type	Null	Key	Default	Extra
Z0_TEST0	binary(101)	YES		NULL	
Z0_TEST1	int(11)	YES		NULL	
SELECT table_id,table_name FROM oceanbase.__all_virtual_table WHERE table_name='Z0CASE';
DROP TABLE Z0CASE;
CREATE TABLE Z0CASE (Z0_TEST0 VARBINARY(100),Z0_TEST1 INT)  with column group (all columns, each column);
INSERT INTO Z0CASE (Z0_TEST0,Z0_TEST1)VALUES(1,'111');
INSERT INTO Z0CASE (Z0_TEST0,Z0_TEST1)VALUES(2,'2');
INSERT INTO Z0CASE (Z0_TEST0,Z0_TEST1)VALUES(30,'30');
INSERT INTO Z0CASE (Z0_TEST0,Z0_TEST1)VALUES(64,'12');
SELECT * FROM Z0CASE ORDER BY Z0_TEST1;
Z0_TEST0	Z0_TEST1
2	2
64	12
30	30
1	111
SELECT table_id,table_name FROM oceanbase.__all_virtual_table WHERE table_name='Z0CASE';
ALTER TABLE Z0CASE modify  Z0_TEST0 binary(99);
SELECT * FROM Z0CASE ORDER BY Z0_TEST1;
Z0_TEST0	Z0_TEST1
2                                                                                                  	2
64                                                                                                 	12
30                                                                                                 	30
1                                                                                                  	111
DESC Z0CASE;
Field	Type	Null	Key	Default	Extra
Z0_TEST0	binary(99)	YES		NULL	
Z0_TEST1	int(11)	YES		NULL	
SELECT table_id,table_name FROM oceanbase.__all_virtual_table WHERE table_name='Z0CASE';
ALTER TABLE Z0CASE modify  Z0_TEST0 binary(99);
DESC Z0CASE;
Field	Type	Null	Key	Default	Extra
Z0_TEST0	binary(99)	YES		NULL	
Z0_TEST1	int(11)	YES		NULL	
SELECT table_id,table_name FROM oceanbase.__all_virtual_table WHERE table_name='Z0CASE';
DROP TABLE Z0CASE;
