drop database if exists decimal_int;
create database decimal_int;
use decimal_int;
CREATE TABLE `t2` (
`y` decimal(20, 2) NOT NULL
);
INSERT IGNORE INTO t2 VALUES ();
Warnings:
Warning	1364	Field 'y' doesn't have a default value
select * from t2;
y
0.00
drop table t2;
BUG:
CREATE TABLE T4(C1 DECIMAL(65));
INSERT INTO T4(C1) VALUES(-1e+64);
SELECT TRUNCATE(C1,C1) FROM T4;
TRUNCATE(C1,C1)
0
DROP TABLE T4;
BUG:
CREATE TABLE T4(C1 DECIMAL,C2 DECIMAL(10,10),C3 DECIMAL(0),C4 DECIMAL(65),C5 DECIMAL(65,30),C6 DECIMAL(3,2),C7 DECIMAL(0,0));
INSERT INTO T4 VALUES (NULL,NULL,NULL,NULL,NULL,NULL,NULL);
INSERT INTO T4 VALUES (0,0,0,0,0,0,0);
INSERT INTO T4 VALUES (0.123,0.123,0.123,0.123,0.123,0.123,0.123);
Warnings:
Warning	1265	Data truncated for column 'C1' at row 1
Warning	1265	Data truncated for column 'C3' at row 1
Warning	1265	Data truncated for column 'C4' at row 1
Warning	1265	Data truncated for column 'C6' at row 1
Warning	1265	Data truncated for column 'C7' at row 1
INSERT INTO T4 VALUES (1e-30,1e-30,1e-30,1e-30,1e-30,1e-30,1e-30);
Warnings:
Warning	1265	Data truncated for column 'C1' at row 1
Warning	1265	Data truncated for column 'C2' at row 1
Warning	1265	Data truncated for column 'C3' at row 1
Warning	1265	Data truncated for column 'C4' at row 1
Warning	1265	Data truncated for column 'C6' at row 1
Warning	1265	Data truncated for column 'C7' at row 1
INSERT INTO T4(C1,C3,C4,C5,C6,C7) VALUES(01,01,01,01,01,01);
INSERT INTO T4(C1,C4,C5,C6) VALUES(-1,-1,-1,-1);
INSERT INTO T4(C1,C2,C4,C5,C6) VALUES(-0.1,-0.1,-0.1,-0.1,-0.1);
Warnings:
Warning	1265	Data truncated for column 'C1' at row 1
Warning	1265	Data truncated for column 'C4' at row 1
INSERT INTO T4(C4) VALUES(1e+64);
INSERT INTO T4(C4) VALUES(-1e+64);
INSERT INTO T4(C1,C3,C4,C5,C7) VALUES(01010,01010,01010,01010,01010);
SELECT CASE WHEN C1 IS NOT TRUE THEN 1 END C1 ,
CASE WHEN C2 IS NOT TRUE THEN 1 END C2 ,
CASE WHEN C3 IS NOT TRUE THEN 1 END C3 ,
CASE WHEN C4 IS NOT TRUE THEN 1 END C4 ,
CASE WHEN C5 IS NOT TRUE THEN 1 END C5 ,
CASE WHEN C6 IS NOT TRUE THEN 1 END C6 ,
CASE WHEN C7 IS NOT TRUE THEN 1 END C7 FROM T4;
C1	C2	C3	C4	C5	C6	C7
1	1	1	1	1	1	1
1	1	1	1	1	1	1
1	NULL	1	1	NULL	NULL	1
1	1	1	1	NULL	1	1
NULL	1	NULL	NULL	NULL	NULL	NULL
NULL	1	1	NULL	NULL	NULL	1
1	NULL	1	1	NULL	NULL	1
1	1	1	NULL	1	1	1
1	1	1	NULL	1	1	1
NULL	1	NULL	NULL	NULL	1	NULL
DROP TABLE T4;
CREATE TABLE T4(C1 DECIMAL,C2 DECIMAL,C3 DECIMAL);
INSERT INTO T4 VALUES (NULL,NULL,NULL);
INSERT INTO T4 VALUES (0,0,0);
INSERT INTO T4 VALUES (0.123,0.123,0.123);
Warnings:
Warning	1265	Data truncated for column 'C1' at row 1
Warning	1265	Data truncated for column 'C2' at row 1
Warning	1265	Data truncated for column 'C3' at row 1
SELECT C1 DIV C2 DIV C3 * C1  FROM T4;
C1 DIV C2 DIV C3 * C1
NULL
NULL
NULL
DROP TABLE T4;
DROP TABLE IF EXISTS T1;
CREATE TABLE T1(C1 DECIMAL,C2 DECIMAL(10,10),C3 DECIMAL(0),C4 DECIMAL(65),C5 DECIMAL(65,30),C6 DECIMAL(3,2),C7 DECIMAL(0,0));
DROP TABLE IF EXISTS T2;
Warnings:
Note	1051	Unknown table 'decimal_int.t2'
CREATE TABLE T2 AS SELECT C1 ^ -C3 % -1.25 as a FROM T1;
DESC T2;
Field	Type	Null	Key	Default	Extra
a	decimal(22,2)	YES		NULL	
DROP TABLE T1, T2;
BUG:
CREATE TABLE T1(C1 DECIMAL);
INSERT INTO T1(C1) VALUES (-1e-130);
Warnings:
Warning	1265	Data truncated for column 'C1' at row 1
INSERT INTO T1 SET C1 = -1e-130;
SELECT * FROM T1;
C1
0
0
DROP TABLE T1;
BUG:
CREATE TABLE T1(C1 DECIMAL,C2 DECIMAL(65,30));
INSERT INTO T1 VALUES(NULL,NULL);
INSERT INTO T1 SET C1 = -1.23 * C2;
EXPLAIN INSERT INTO T1 SET C1 = -1.23 * C2;
Query Plan
==================================================
|ID|OPERATOR          |NAME|EST.ROWS|EST.TIME(us)|
--------------------------------------------------
|0 |DISTRIBUTED INSERT|    |1       |13          |
|1 |└─EXPRESSION      |    |1       |1           |
==================================================
Outputs & filters:
-------------------------------------
  0 - output(nil), filter(nil)
      columns([{t1: ({t1: (t1.__pk_increment, t1.C1, t1.C2)})}]), 
      column_values([T_HIDDEN_PK], [column_conv(DECIMAL_INT,PS:(10,0),NULL,__values.C1)], [column_conv(DECIMAL_INT,PS:(65,30),NULL,cast(NULL, DECIMAL_INT(65,
       30)))])
  1 - output([__values.C1]), filter(nil)
      values({column_conv(DECIMAL_INT,PS:(10,0),NULL,cast(cast(-1.23, DECIMAL_INT(68, 2)) * cast(NULL, DECIMAL_INT(65, 30)), DECIMAL_INT(10, 0)))})
SELECT * FROM T1;
C1	C2
NULL	NULL
NULL	NULL
DROP TABLE T1;
BUG: 
create table t1 (a bit(64), b bit(2));
insert into t1 values (1, 0);
SELECT (SELECT SUM(t1_outer.a) FROM t1 AS t1_inner LIMIT 1) FROM t1 AS t1_outer GROUP BY t1_outer.b;
(SELECT SUM(t1_outer.a) FROM t1 AS t1_inner LIMIT 1)
1
drop table t1;
BUG: 
CREATE TABLE t1 (
`col_21` set('Alice','Bob','Charlie','David') CHARACTER SET gbk NOT NULL DEFAULT 'Charlie',
`col_22` decimal(32,16) NOT NULL DEFAULT '194.5280000000000000'
);
insert into t1 values (1, 2);
insert into t1 values (2, 2);
explain select field( t1.col_21 , t1.col_21 , t1.col_22 ) as r2 from t1;
Query Plan
===============================================
|ID|OPERATOR       |NAME|EST.ROWS|EST.TIME(us)|
-----------------------------------------------
|0 |TABLE FULL SCAN|t1  |2       |3           |
===============================================
Outputs & filters:
-------------------------------------
  0 - output([field(cast(t1.col_21, DECIMAL(-1, -1)), cast(t1.col_21, DECIMAL(-1, -1)), cast(t1.col_22, DECIMAL(32, 16)))]), filter(nil), rowset=16
      access([t1.col_21], [t1.col_22]), partitions(p0)
      is_index_back=false, is_global_index=false, 
      range_key([t1.__pk_increment]), range(MIN ; MAX)always true
select field( t1.col_21 , t1.col_21 , t1.col_22 ) as r2 from t1;
r2
1
1
drop table t1;
explain select field(1.23, 1.234, 1.2345) from dual;
Query Plan
==========================================
|ID|OPERATOR  |NAME|EST.ROWS|EST.TIME(us)|
------------------------------------------
|0 |EXPRESSION|    |1       |1           |
==========================================
Outputs & filters:
-------------------------------------
  0 - output([field(1.23, cast(1.234, DECIMAL_INT(3, 2)), cast(1.2345, DECIMAL_INT(3, 2)))]), filter(nil)
      values({field(1.23, cast(1.234, DECIMAL_INT(3, 2)), cast(1.2345, DECIMAL_INT(3, 2)))})
select field(1.23, 1.234, 1.2345) from dual;
field(1.23, 1.234, 1.2345)
0
explain select field(1.23, 1.2, 1) from dual;
Query Plan
==========================================
|ID|OPERATOR  |NAME|EST.ROWS|EST.TIME(us)|
------------------------------------------
|0 |EXPRESSION|    |1       |1           |
==========================================
Outputs & filters:
-------------------------------------
  0 - output([field(1.23, cast(1.2, DECIMAL_INT(3, 2)), cast(1, DECIMAL_INT(3, 2)))]), filter(nil)
      values({field(1.23, cast(1.2, DECIMAL_INT(3, 2)), cast(1, DECIMAL_INT(3, 2)))})
select field(1.23, 1.2, 1) from dual;
field(1.23, 1.2, 1)
0
explain select field(1.23, 121.234, 121.2345) from dual;
Query Plan
==========================================
|ID|OPERATOR  |NAME|EST.ROWS|EST.TIME(us)|
------------------------------------------
|0 |EXPRESSION|    |1       |1           |
==========================================
Outputs & filters:
-------------------------------------
  0 - output([field(1.23, cast(121.234, DECIMAL_INT(3, 2)), cast(121.2345, DECIMAL_INT(3, 2)))]), filter(nil)
      values({field(1.23, cast(121.234, DECIMAL_INT(3, 2)), cast(121.2345, DECIMAL_INT(3, 2)))})
select field(1.23, 121.234, 121.2345) from dual;
field(1.23, 121.234, 121.2345)
0
create table t1 (c1 decimal(3,2), c2 decimal(5,3), c3 decimal(10,5));
insert into t1 values (1.23, 1.23, 1.23);
insert into t1 values (1.23, 1.24, 1.23);
insert into t1 values (1.23, 1.234, 1.23);
insert into t1 values (1.23, 11.234, 111.23);
explain select field(c1, c2, c3) from t1;
Query Plan
===============================================
|ID|OPERATOR       |NAME|EST.ROWS|EST.TIME(us)|
-----------------------------------------------
|0 |TABLE FULL SCAN|t1  |4       |3           |
===============================================
Outputs & filters:
-------------------------------------
  0 - output([field(t1.c1, cast(t1.c2, DECIMAL_INT(3, 2)), cast(t1.c3, DECIMAL_INT(3, 2)))]), filter(nil), rowset=16
      access([t1.c1], [t1.c2], [t1.c3]), partitions(p0)
      is_index_back=false, is_global_index=false, 
      range_key([t1.__pk_increment]), range(MIN ; MAX)always true
select field(c1, c2, c3) from t1;
field(c1, c2, c3)
1
2
2
0
drop table t1;

CREATE TABLE `t1` (`c1` decimal(64,0) DEFAULT NULL);
insert into t1 values(1);
select dump(c1) from t1;
dump(c1)
"precision=64 scale=0 int_bytes=32 items=[1,0,0,0,]"
update t1 set c1 = date'2090-5-4';
select dump(c1) from t1;
dump(c1)
"precision=64 scale=0 int_bytes=32 items=[20900504,0,0,0,]"
update t1 set c1 = TIME '12:12:12';
select dump(c1) from t1;
dump(c1)
"precision=64 scale=0 int_bytes=32 items=[121212,0,0,0,]"
drop table t1;

CREATE TABLE `t1` (`c0` smallint(184) DEFAULT NULL COMMENT 'asdf',
`c1` decimal(10,0) DEFAULT NULL COMMENT 'asdf');
select Least(t1.c1, t1.c0) from t1;
Least(t1.c1, t1.c0)
drop table t1;
CREATE TABLE T2 (
DEPTNO NUMBER PRIMARY KEY
);
CREATE TABLE T1 (
DEPTNO NUMBER(2),
foreign key(DEPTNO) REFERENCES T2(DEPTNO)
);
insert into t2 values (12);
insert into t1 values (12);
insert into t1 values (34);
ERROR 23000: Cannot add or update a child row: a foreign key constraint fails
select * from t1;
DEPTNO
12
select * from t2;
DEPTNO
12
drop table t1;
drop table t2;
fk decimal_int -> decimal_int, different precision
CREATE TABLE T2 (
DEPTNO NUMBER(65,2) PRIMARY KEY
);
CREATE TABLE T1 (
DEPTNO NUMBER(6,2),
foreign key(DEPTNO) REFERENCES T2(DEPTNO)
);
insert into t2 values (12.34);
insert into t1 values (12.34);
insert into t1 values (1234);
ERROR 23000: Cannot add or update a child row: a foreign key constraint fails
select * from t1;
DEPTNO
12.34
select * from t2;
DEPTNO
12.34
drop table t1;
drop table t2;
fk decimal_int -> decimal_int, different scale
CREATE TABLE T2 (
DEPTNO NUMBER(65,2) PRIMARY KEY
);
CREATE TABLE T1 (
DEPTNO NUMBER(38,4),
foreign key(DEPTNO) REFERENCES T2(DEPTNO)
);
insert into t2 values (12.34);
insert into t1 values (12.34);
insert into t1 values (1234);
ERROR 23000: Cannot add or update a child row: a foreign key constraint fails
insert into t1 values (12.340);
insert into t1 values (12.341);
ERROR 23000: Cannot add or update a child row: a foreign key constraint fails
insert into t1 values (12.349);
ERROR 23000: Cannot add or update a child row: a foreign key constraint fails
select * from t1;
DEPTNO
12.3400
12.3400
select * from t2;
DEPTNO
12.34
drop table t1;
drop table t2;
drop table if exists t0;
CREATE TABLE `t0` (   `c0` decimal(10,0) DEFAULT NULL,   `c1` mediumtext DEFAULT NULL COMMENT 'asdf',   `c2` decimal(32,0) unsigned zerofill DEFAULT NULL,   `c3` tinyint(63) DEFAULT NULL COMMENT 'asdf',   KEY `i280` (`c0`, `c2`) BLOCK_SIZE 16384 LOCAL ) DEFAULT CHARSET = utf8mb4 ROW_FORMAT = DYNAMIC COMPRESSION = 'zstd_1.3.8' REPLICA_NUM = 1 BLOCK_SIZE = 16384 USE_BLOOM_FILTER = FALSE TABLET_SIZE = 134217728 PCTFREE = 0  partition by hash(c3) (partition p0, partition p1, partition p2, partition p3, partition p4, partition p5, partition p6, partition p7, partition p8, partition p9, partition p10, partition p11, partition p12, partition p13, partition p14, partition p15, partition p16, partition p17);
INSERT INTO `t0` VALUES (8852219957,NULL,NULL,NULL),(3511225368,NULL,NULL,NULL),(5911881247,NULL,NULL,NULL),(NULL,'-8.1143743438702817E18',00000000000002563962811463577600,NULL),(NULL,']8',00000000000002469619122111923700,NULL),(9344393385,NULL,00000000000004352687445809652000,NULL),(-4955769629,NULL,00000000000000904749577335152500,NULL),(-6511311962,NULL,NULL,NULL),(NULL,'1',NULL,NULL),(NULL,'0',NULL,NULL),(NULL,NULL,NULL,0),(NULL,NULL,NULL,NULL),(-6417549458,NULL,NULL,NULL),(-7808581952,NULL,NULL,NULL),(NULL,'Ev]5X&taeDO0OlY XAFe.Q0e3eOd',NULL,NULL),(NULL,'/',NULL,NULL),(8347492845,',1FjY3>CfZm6X!',NULL,NULL),(NULL,',1FjY3>CfZm6X!',NULL,NULL),(NULL,'5.8729553371720182E18',00000000000002255449323828478700,NULL),(NULL,'~',00000000000005061053892700372000,NULL),(7,'iG{M/mAC',00000000000003171809748722073000,0),(NULL,'||a{',00000000000000342131917252143600,NULL),(NULL,NULL,00000000000005955613007559641000,NULL),(NULL,NULL,00000000000000696939183858564400,NULL),(NULL,NULL,00000000000001172854497207669500,NULL),(-4955769629,NULL,NULL,NULL),(-1497344518,NULL,NULL,NULL),(-5487143858,'q3ca() n0',NULL,NULL),(-8107705494,NULL,NULL,NULL),(NULL,NULL,00000000000000030046434819337816,NULL),(NULL,NULL,00000000000007889143611067181000,NULL),(NULL,NULL,00000000000001952889603757564200,NULL),(NULL,NULL,00000000000003241450662237910500,NULL),(NULL,NULL,00000000000006634177428146575000,NULL),(NULL,NULL,00000000000000796615259933147500,NULL),(-6417549458,NULL,NULL,NULL),(3845917807,NULL,NULL,NULL),(-3038819936,NULL,NULL,NULL),(NULL,'4',NULL,NULL),(-7808581952,NULL,NULL,NULL),(-8037489711,NULL,NULL,NULL),(5916822884,'[s.ck*VY',00000000000005682309347251152000,NULL),(-7208481919,NULL,NULL,NULL),(3628136486,NULL,NULL,NULL),(NULL,NULL,NULL,NULL),(NULL,'~GQt,{\'ojrL1',00000000000000936000428073890800,0),(NULL,NULL,00000000000006052807762268753000,NULL),(-3038819936,NULL,NULL,-1),(NULL,NULL,NULL,-1),(4527044665,'',00000000000006011027917089443000,1),(NULL,NULL,NULL,1),(-1497344518,NULL,00000000000007601833755363311000,2),(NULL,NULL,NULL,2),(NULL,NULL,NULL,-2),(NULL,NULL,NULL,2),(3129721078,NULL,00000000000006502256991931677000,2),(NULL,'/9BRc&!1.MIJo~OV|?1w4aHln(L',00000000000003287785276943374000,2),(NULL,NULL,NULL,-2),(3845917807,NULL,00000000000005355203684204192000,3),(NULL,'O.sS?S~z4duru)l5hm)~',00000000000006237423403178675000,3),(NULL,NULL,NULL,-3),(-5490274987,'M\'D.cr\'JT>]~I>_\\i<[]SPW%Z2 P',00000000000007604571432702331000,3),(NULL,'IlGS(',00000000000002464569002564091000,-3),(-7219705514,'4',00000000000002977434631258011000,-3),(NULL,NULL,00000000000005021705487068708000,-3),(NULL,NULL,NULL,-4),(NULL,NULL,NULL,-4),(NULL,NULL,NULL,-4),(4640068733,'4',NULL,-4),(NULL,NULL,NULL,-4),(NULL,'',00000000000006761654071875255000,4),(-7808581952,'*EC11%6ge9({vtn',00000000000008523056953640193000,-5),(-5487143858,'q3ca() n0',00000000000003834259714991594500,5),(-6417549458,'3',00000000000006148784686228826000,-5),(-2614349466,'',00000000000002484111101206030000,5),(-7208481919,NULL,00000000000000944809654529953300,-5),(3628136486,'yD3%gu',NULL,5),(9210144884,'-7',00000000000007307922444136780000,5),(-7642244533,'5.0597946458164357E18',00000000000001511277865423638800,5),(-1597576083,'3b?.g?1w]l#',00000000000003620231966919927000,-5),(NULL,'',00000000000008141811459819050000,5),(6357067475,'3',00000000000001065893710866959000,-6),(NULL,NULL,NULL,-6),(8739899688,NULL,00000000000000082828787818088960,6),(NULL,'+',00000000000002649382989699941000,7),(1063729981,NULL,00000000000005058970582304713000,7),(NULL,NULL,00000000000000000000000000000000,7),(NULL,NULL,00000000000001119045635301902300,-7),(NULL,'SrJ)hZ*6u!',00000000000006588454253660193000,-7),(0,NULL,NULL,-8),(NULL,NULL,NULL,-8),(0,NULL,NULL,-8),(NULL,'5.2638153716353946E18',00000000000000591685558520312400,-8);
SELECT * FROM t0 WHERE ((((((+ (t0.c3))) IN (t0.c3)) || (((concat(t0.c2,'')) IS NOT UNKNOWN) IN (CAST(t0.c1 AS SIGNED)))) OR ((GREATEST(t0.c0, t0.c0, t0.c0)) IN (NULL))) OR (((t0.c3) != ('00000000000000')) NOT IN (((CAST(-443650398 AS SIGNED)) ^ (CAST(t0.c3 AS SIGNED)))))) && ((("2023-09-25 12:52:13") IS NOT FALSE) IN (COALESCE(t0.c1, t0.c0), (t0.c3) XOR (-2356533350)));
c0	c1	c2	c3
NULL	NULL	NULL	0
7	iG{M/mAC	00000000000003171809748722073000	0
NULL	~GQt,{'ojrL1	00000000000000936000428073890800	0
drop table t0;
BUG:
set ob_enable_plan_cache = 0;
SELECT MOD( 498597888, 1.2345 );
MOD( 498597888, 1.2345 )
0.0465
set ob_enable_plan_cache = 1;
SELECT MOD( 498597888, 1.2345 );
MOD( 498597888, 1.2345 )
0.0465
BUG:
create table t0 (a set ('x','y','z','ä','ö','ü'));
SELECT LEAST(a, 1323.123456) FROM t0;
LEAST(a, 1323.123456)
drop table t0;
create table t0(a number(4, 2) not null) partition by key(a);
insert into t0 values (4), (a + 5);
select * from t0;
a
4.00
5.00
drop table t0;
create table t0(a number(10, 2) not null) partition by key(a);
insert into t0 values (4), (a + 5);
select * from t0;
a
4.00
5.00
drop table t0;
create table t0(a number(20, 2) not null) partition by key(a);
insert into t0 values (4), (a + 5);
select * from t0;
a
4.00
5.00
drop table t0;
create table t0(a number(38, 2) not null) partition by key(a);
insert into t0 values (4), (a + 5);
select * from t0;
a
4.00
5.00
drop table t0;
BUG: 
create table t0 (d1 decimal(20,10));
insert into t0 values (1);
insert into t0 values (2);
set @a=(select d1 FROM t0 limit 1);
select @a := @a +1 as rn from t0;
rn
2.0000000000
3.0000000000
drop table t0;
BUG: 
create table t0(a decimal(18,10), b decimal(20,12));
select ora_decode(1, a, 1, '01', 2222, 1, 3333) from t0;
ora_decode(1, a, 1, '01', 2222, 1, 3333)
drop table t0;
BUG: 
CREATE TABLE t0 SELECT .123456789012345678901234567890123456789012345678901234567890123456 AS a;
select a, mod(a-@@auto_increment_offset,@@auto_increment_increment) FROM t0  order by a;
a	mod(a-@@auto_increment_offset,@@auto_increment_increment)
0.123456789012345678901234567890	-0.876543210987654321098765432110
drop table t0;
BUG: 
create table t0(c0 smallint(6), c1 mediumint(9), c2 int(255));
select nullif(cast(nullif(c0, c1) as DECIMAL), c2) from t0;
nullif(cast(nullif(c0, c1) as DECIMAL), c2)
drop table t0;
BUG: 
select NULLIF( ROUND( FLOOR( 100.2345 ) ), 10.2345 ) from dual;
NULLIF( ROUND( FLOOR( 100.2345 ) ), 10.2345 )
100
select nullif(NULLIF( ROUND( FLOOR( 100.2345 ) ), 10.2345 ),100.2345) from dual;
nullif(NULLIF( ROUND( FLOOR( 100.2345 ) ), 10.2345 ),100.2345)
100
SELECT  ROUND( SUM( NULLIF( 100.2345, 100.2345 ) ) ) from dual;
ROUND( SUM( NULLIF( 100.2345, 100.2345 ) ) )
NULL
BUG: 
drop table if exists t1;
CREATE TABLE t1(c0 NUMBER(10,4)  PRIMARY KEY, c1 NUMBER(10,4)   NULL) ;
INSERT INTO T1(C0) VALUES(-0.0);
explain SELECT /*+ */ ALL SUM(DISTINCT T1.C0), T1.C0, T1.C1 FROM T1 GROUP BY T1.C0, T1.C1 HAVING (NOT ((SUM(DISTINCT T1.C0)) BETWEEN (NULL) AND ('-1e15'))) ORDER BY SUM(DISTINCT T1.C0) DESC;
Query Plan
==================================================
|ID|OPERATOR          |NAME|EST.ROWS|EST.TIME(us)|
--------------------------------------------------
|0 |SORT              |    |1       |3           |
|1 |└─TABLE RANGE SCAN|t1  |1       |3           |
==================================================
Outputs & filters:
-------------------------------------
  0 - output([cast(t1.c0, DECIMAL_INT(32, 4))], [t1.c0], [t1.c1]), filter(nil), rowset=16
      sort_keys([cast(t1.c0, DECIMAL_INT(32, 4)), DESC])
  1 - output([t1.c0], [t1.c1], [cast(t1.c0, DECIMAL_INT(32, 4))]), filter(nil), rowset=16
      access([t1.c0], [t1.c1]), partitions(p0)
      is_index_back=false, is_global_index=false, 
      range_key([t1.c0]), range[-1000000.0000 ; MAX), 
      range_cond([(T_OP_NOT_BTW, cast(t1.c0, DECIMAL_INT(32, 4)), NULL, cast('-1e15', DECIMAL_INT(32, 4)))])
SELECT /*+ */ ALL SUM(DISTINCT T1.C0), T1.C0, T1.C1 FROM T1 GROUP BY T1.C0, T1.C1 HAVING (NOT ((SUM(DISTINCT T1.C0)) BETWEEN (NULL) AND ('-1e15'))) ORDER BY SUM(DISTINCT T1.C0) DESC;
SUM(DISTINCT T1.C0)	C0	C1
0.0000	0.0000	NULL
drop table t1;
drop table if exists t3;
BUG: bug/54918837
create table t3 (c1 INT(127) ,c2 TIME,c3 BIGINT(127) ,c4 DATE,c5 TIME,c6 VARBINARY(82) ,c7 INT(127) ,c8 DATE,c9 NUMERIC(64,0) ,c10 DATETIME,c11 BIGINT(127) ,c12 CHAR(152) ,c13 BINARY(152) ,c14 VARCHAR(86) ,c15 INT(127) ,c16 CHAR(152) ,c17 DATE,c18 BIGINT(127) ,c19 YEAR(4) , primary key(c14,c3,c6,c9,c13))  DEFAULT CHARSET = utf8mb4 COLLATE = utf8mb4_bin PARTITION BY KEY(c14,c3) PARTITIONS 10;
create index g_i_3_azmciNtTy on t3((c9-1.5)) global ;
INSERT INTO t3(c1,c2,c3,c4,c5,c6,c7,c8,c9,c10,c11,c12,c13,c14,c15,c16,c17,c18,c19) VALUES (1,'15:48:38',1,date'2026-4-11','22:22:37','vwFSHuFUmtadg001',1,date'2083-2-7',1,'1986-6-15 8:35:46',1,'FCmFVdRBgHKSSSPcHMPGxGYtqnDMJayMRVoFlknzhGPfAZMbBtEdtKciAwqfEDZWoFqfVgZkPSwMJtQozpwoKgPrZckNyMJVbmPeHgrZIdIcJWpfff001','bqbeKVLZxpaWeKTLJMJCyXajVDbRAlXOfhkcHAPhsaGXbCrWhHjZYdjOhvjMhvwloBPDKuxoDeeQlWqigvPwJNmeqMxJTnIdzqHYgVMqc001','FcMvacIjJ001',1,'PubbKARupunhkQNQkuunMTOGssZDnbvWWFcsGzEXmkuBfZHhgxHjKSvhrjddPnvkevTvjaXIaKirqjaMzcLMRavAxLAQLAadbjrqWXbgoBwkkTpPHOIJw001',date'2058-2-17',1,2017);
select * from t3;
c1	c2	c3	c4	c5	c6	c7	c8	c9	c10	c11	c12	c13	c14	c15	c16	c17	c18	c19
1	15:48:38	1	2026-04-11	22:22:37	vwFSHuFUmtadg001	1	2083-02-07	1	1986-06-15 08:35:46	1	FCmFVdRBgHKSSSPcHMPGxGYtqnDMJayMRVoFlknzhGPfAZMbBtEdtKciAwqfEDZWoFqfVgZkPSwMJtQozpwoKgPrZckNyMJVbmPeHgrZIdIcJWpfff001	bqbeKVLZxpaWeKTLJMJCyXajVDbRAlXOfhkcHAPhsaGXbCrWhHjZYdjOhvjMhvwloBPDKuxoDeeQlWqigvPwJNmeqMxJTnIdzqHYgVMqc001                                            	FcMvacIjJ001	1	PubbKARupunhkQNQkuunMTOGssZDnbvWWFcsGzEXmkuBfZHhgxHjKSvhrjddPnvkevTvjaXIaKirqjaMzcLMRavAxLAQLAadbjrqWXbgoBwkkTpPHOIJw001	2058-02-17	1	2017
explain select * from t3 where c9-1.5 = 1.0;
Query Plan
==========================================================================
|ID|OPERATOR                   |NAME               |EST.ROWS|EST.TIME(us)|
--------------------------------------------------------------------------
|0 |DISTRIBUTED TABLE FULL SCAN|t3(g_i_3_azmciNtTy)|1       |33          |
==========================================================================
Outputs & filters:
-------------------------------------
  0 - output([t3.c1], [t3.c2], [t3.c3], [t3.c4], [t3.c5], [t3.c6], [t3.c7], [t3.c8], [t3.c9], [t3.c10], [t3.c11], [t3.c12], [t3.c13], [t3.c14], [t3.c15],
       [t3.c16], [t3.c17], [t3.c18], [t3.c19]), filter([cast(t3.c9, DECIMAL_INT(66, 1)) + cast(-1.5, DECIMAL_INT(66, 1)) = cast(1.0, DECIMAL_INT(66, 1))]), rowset=16
      access([t3.c14], [t3.c3], [t3.c6], [t3.c9], [t3.c13], [t3.c1], [t3.c2], [t3.c4], [t3.c5], [t3.c7], [t3.c8], [t3.c10], [t3.c11], [t3.c12], [t3.c15],
       [t3.c16], [t3.c17], [t3.c18], [t3.c19]), partitions(p0)
      is_index_back=true, is_global_index=true, filter_before_indexback[true], 
      range_key([t3.SYS_NC35$], [t3.c14], [t3.c3], [t3.c6], [t3.c9], [t3.c13]), range(MIN,MIN,MIN,MIN,MIN,MIN ; MAX,MAX,MAX,MAX,MAX,MAX)always true
select * from t3 where c9-1.5 = -0.5;
c1	c2	c3	c4	c5	c6	c7	c8	c9	c10	c11	c12	c13	c14	c15	c16	c17	c18	c19
1	15:48:38	1	2026-04-11	22:22:37	vwFSHuFUmtadg001	1	2083-02-07	1	1986-06-15 08:35:46	1	FCmFVdRBgHKSSSPcHMPGxGYtqnDMJayMRVoFlknzhGPfAZMbBtEdtKciAwqfEDZWoFqfVgZkPSwMJtQozpwoKgPrZckNyMJVbmPeHgrZIdIcJWpfff001	bqbeKVLZxpaWeKTLJMJCyXajVDbRAlXOfhkcHAPhsaGXbCrWhHjZYdjOhvjMhvwloBPDKuxoDeeQlWqigvPwJNmeqMxJTnIdzqHYgVMqc001                                            	FcMvacIjJ001	1	PubbKARupunhkQNQkuunMTOGssZDnbvWWFcsGzEXmkuBfZHhgxHjKSvhrjddPnvkevTvjaXIaKirqjaMzcLMRavAxLAQLAadbjrqWXbgoBwkkTpPHOIJw001	2058-02-17	1	2017
drop table t3;
CREATE TABLE `t1` (   `c0` mediumint(9) DEFAULT NULL,   `c1` bigint(20) DEFAULT NULL COMMENT 'asdf',   `c2` decimal(1,0) DEFAULT NULL,   UNIQUE KEY `i200` (`c2`, `c1`) );
insert into t1 values (100, 100, 1);
explain SELECT  * FROM t1 WHERE (GREATEST(t1.c1, t1.c2, t1.c0)) IN (t1.c0);
Query Plan
===============================================
|ID|OPERATOR       |NAME|EST.ROWS|EST.TIME(us)|
-----------------------------------------------
|0 |TABLE FULL SCAN|t1  |1       |3           |
===============================================
Outputs & filters:
-------------------------------------
  0 - output([t1.c0], [t1.c1], [t1.c2]), filter([GREATEST(t1.c1, t1.c2, t1.c0) = cast(t1.c0, DECIMAL_INT(20, 0))]), rowset=16
      access([t1.c1], [t1.c2], [t1.c0]), partitions(p0)
      is_index_back=false, is_global_index=false, filter_before_indexback[false], 
      range_key([t1.__pk_increment]), range(MIN ; MAX)always true
SELECT  * FROM t1 WHERE (GREATEST(t1.c1, t1.c2, t1.c0)) IN (t1.c0);
c0	c1	c2
100	100	1
drop table t1;
create table t1 ( 
c_ydogyq1 int ,
c_reoxwl34 int);
insert into t1 (c_ydogyq1, c_reoxwl34) values 
(396667551, 217625229), 
(-368695015, -1288002677), 
(1741309262, -712324340), 
(970953275, -1454379871);
SELECT
ref_1.c_ydogyq1 as p0, 
round(cast(40 as decimal), ref_1.c_ydogyq1) as p2,
round(cast(40 as decimal), ref_1.c_ydogyq1) = 0 as p3
FROM
t1 as ref_1
WHERE
round(cast(40 as decimal), ref_1.c_ydogyq1) = 0
;
p0	p2	p3
-368695015	0	1
drop table t1;
create table t1 (c1 decimal(16, 16));
insert into t1 values (0);
select nullif(c1, c1) from t1;
nullif(c1, c1)
NULL
drop table t1;
BUG: 2025021400107214461
create table table10(num1 bigint, num2 bigint);
insert /*+ enable_parallel_dml parallel(2) append */ into table10 select -9999999999999999999999999999999999,9999999999999999999999999999999;
ERROR 22003: Out of range value for column 'num1' at row 0
insert /*+ enable_parallel_dml parallel(2) append */ into table10 select -9223372036854775807.52,9223372036854775807.52;
ERROR 22003: Out of range value for column 'num2' at row 0
insert /*+ enable_parallel_dml parallel(2) append */ into table10 select -9223372036854775808.52,9223372036854775807;
ERROR 22003: Out of range value for column 'num1' at row 0
insert /*+ enable_parallel_dml parallel(2) append */ into table10 select -9223372036854775808,9223372036854775807.43;
select * from table10;
num1	num2
-9223372036854775808	9223372036854775807
create table table11(num1 bigint unsigned);
insert /*+ enable_parallel_dml parallel(2) append */ into table11 select -9999999999999999999999999999999999;
ERROR 22003: Out of range value for column 'num1' at row 0
insert /*+ enable_parallel_dml parallel(2) append */ into table11 select -1;
ERROR 22003: Out of range value for column 'num1' at row 0
insert /*+ enable_parallel_dml parallel(2) append */ into table11 select 18446744073709551615;
insert /*+ enable_parallel_dml parallel(2) append */ into table11 select 18446744073709551615.52;
ERROR 22003: Out of range value for column 'num1' at row 0
insert /*+ enable_parallel_dml parallel(2) append */ into table11 select 18446744073709551615.43;
select * from table11;
num1
18446744073709551615
18446744073709551615
drop table table10;
drop table table11;
drop database decimal_int;
