# 环境清理
purge recyclebin;
result_format: 4
NAME_CONST-TC-1
基础参数测试
basic
select name_const(1,1);
+------+
| 1    |
+------+
|    1 |
+------+
select name_const(0,0);
+------+
| 0    |
+------+
|    0 |
+------+
select name_const(-1,-10);
ERROR HY000: Incorrect arguments to name_const
select name_const('-1',-10);
+------+
| -1   |
+------+
|  -10 |
+------+
select name_const(1.11,2.22);
+------+
| 1.11 |
+------+
| 2.22 |
+------+
select name_const(123,'0');
+-----+
| 123 |
+-----+
| 0   |
+-----+
select name_const('abc',1);
+------+
| abc  |
+------+
|    1 |
+------+
select name_const(11a,1);
ERROR HY000: Incorrect arguments to name_const
select name_const('黄龙时代','hlsd');
+--------------+
| 黄龙时代     |
+--------------+
| hlsd         |
+--------------+
select name_const('hlsd','黄龙时代');
+--------------+
| hlsd         |
+--------------+
| 黄龙时代     |
+--------------+
select name_const('黄龙时代','黄龙时代');
+--------------+
| 黄龙时代     |
+--------------+
| 黄龙时代     |
+--------------+
select name_const('!@#$%^&*',123456);
+----------+
| !@#$%^&* |
+----------+
|   123456 |
+----------+
select name_const(123456,'!@#$%^&*');
+----------+
| 123456   |
+----------+
| !@#$%^&* |
+----------+
select name_const('!@#$%^&*','!@#$%^&*');
+----------+
| !@#$%^&* |
+----------+
| !@#$%^&* |
+----------+
select name_const('abc123',111);
+--------+
| abc123 |
+--------+
|    111 |
+--------+
select name_const(111,'abc123');
+--------+
| 111    |
+--------+
| abc123 |
+--------+
select name_const('1980年小巷','oh');
+---------------+
| 1980年小巷    |
+---------------+
| oh            |
+---------------+
select name_const('oh','1980年小巷');
+---------------+
| oh            |
+---------------+
| 1980年小巷    |
+---------------+
select name_const('1980年小巷abcdefgh','oh');
+-----------------------+
| 1980年小巷abcdefgh    |
+-----------------------+
| oh                    |
+-----------------------+
select name_const('oh','1980年小巷abcdefgh');
+-----------------------+
| oh                    |
+-----------------------+
| 1980年小巷abcdefgh    |
+-----------------------+
MySQL官方列名是123400000与OB不一致
select name_const(1.234E+8,'科学计数');
+--------------+
| 123400000    |
+--------------+
| 科学计数     |
+--------------+
MySQL官方列名是123400000与OB不一致
select name_const(1.234E8,'科学计数');
+--------------+
| 123400000    |
+--------------+
| 科学计数     |
+--------------+
select name_const('科学计数',1.234E+8);
+--------------+
| 科学计数     |
+--------------+
|    123400000 |
+--------------+
select name_const('科学计数',1.234E8);
+--------------+
| 科学计数     |
+--------------+
|    123400000 |
+--------------+
select name_const(1.234*10^8,'科学计数');
ERROR HY000: Incorrect arguments to name_const
select name_const('1.234*10^8','科学计数');
+--------------+
| 1.234*10^8   |
+--------------+
| 科学计数     |
+--------------+
select name_const('科学计数',1.234*10^8);
ERROR HY000: Incorrect arguments to name_const
边界值
select name_const('边界值',999999999999999999999999999999999999999999999999999999999999999999999999999999999999999999999);
+------------------------------------------------------------------------------------------------+
| 边界值                                                                                         |
+------------------------------------------------------------------------------------------------+
| 1000000000000000000000000000000000000000000000000000000000000000000000000000000000000000000000 |
+------------------------------------------------------------------------------------------------+
select name_const(999999999999999999999999999999999999999999999999999999999999999999999999999999999999999999999,'边界值');
+------------------------------------------------------------------------------------------------+
| 1000000000000000000000000000000000000000000000000000000000000000000000000000000000000000000000 |
+------------------------------------------------------------------------------------------------+
| 边界值                                                                                         |
+------------------------------------------------------------------------------------------------+
ob执行结果列名true,值为1,MySQL8.0报错
select name_const(true,true);
+------+
| 1    |
+------+
|    1 |
+------+
ob执行结果列名false,值为0,MySQL8.0报错
select name_const(false,false);
+------+
| 0    |
+------+
|    0 |
+------+
select name_const(true,false);
+------+
| 1    |
+------+
|    0 |
+------+
select name_const(false,true);
+------+
| 0    |
+------+
|    1 |
+------+
select name_const('1980！@#￥',true);
+--------------+
| 1980！@#￥   |
+--------------+
|            1 |
+--------------+
select name_const('1980年OCT',false);
+------------+
| 1980年OCT  |
+------------+
|          0 |
+------------+
select name_const(true,123);
+------+
| 1    |
+------+
|  123 |
+------+
select name_const(false,456);
+------+
| 0    |
+------+
|  456 |
+------+
select name_const(SET('one', 'two'),'集合');
ERROR 42000: You have an error in your SQL syntax; check the manual that corresponds to your OceanBase version for the right syntax to use near '('one', 'two'),'集合')' at line 1
select name_const(('one'),'集合');
+--------+
| one    |
+--------+
| 集合   |
+--------+
select name_const(('one', 'two'),'集合');
ERROR 21000: Operand should contain 1 column(s)
select name_const('集合',('one', 'two'));
ERROR 21000: Operand should contain 1 column(s)
select name_const('集合',('one'));
+--------+
| 集合   |
+--------+
| one    |
+--------+
select name_const('{"key1": "value1", "key2": "value2"}','json');
+--------------------------------------+
| {"key1": "value1", "key2": "value2"} |
+--------------------------------------+
| json                                 |
+--------------------------------------+
时间日期
date
select name_const(date'1970-01-01','一九七零');
+--------------+
| 1970-01-01   |
+--------------+
| 一九七零     |
+--------------+
select name_const('日期',date'1970-01-01');
ERROR HY000: Incorrect arguments to name_const
select name_const('日期','1970-01-01');
+------------+
| 日期       |
+------------+
| 1970-01-01 |
+------------+
time
select name_const(time '11:11:11','NOW');
+----------+
| 11:11:11 |
+----------+
| NOW      |
+----------+
select name_const('NOW',time '11:11:11');
ERROR HY000: Incorrect arguments to name_const
select name_const('NOW','11:11:11');
+----------+
| NOW      |
+----------+
| 11:11:11 |
+----------+
datetime
select name_const('2022-09-15 00:00:00','新的一天');
+---------------------+
| 2022-09-15 00:00:00 |
+---------------------+
| 新的一天            |
+---------------------+
select name_const(datetime '2022-09-15 00:00:00','新的一天');
ERROR 42000: Incorrect parameters in the call to native function 'name_const'
select name_const('新的一天','2022-09-15 00:00:00');
+---------------------+
| 新的一天            |
+---------------------+
| 2022-09-15 00:00:00 |
+---------------------+
select name_const('新的一天',datetime'2022-09-15 00:00:00');
ERROR 42000: Incorrect parameters in the call to native function 'name_const'
timestamp
select name_const(timestamp '2022-09-15 00:00:00','新的一天');
+---------------------+
| 2022-09-15 00:00:00 |
+---------------------+
| 新的一天            |
+---------------------+
select name_const(timestamp '2022-09-15 00:00:00.000000','新的一天');
+----------------------------+
| 2022-09-15 00:00:00.000000 |
+----------------------------+
| 新的一天                   |
+----------------------------+
select name_const('timestamp 2022-09-15 00:00:00.000000','新的一天');
+--------------------------------------+
| timestamp 2022-09-15 00:00:00.000000 |
+--------------------------------------+
| 新的一天                             |
+--------------------------------------+
select name_const('新的一天新的一天新的一天新的一天新的一天新的一天新的一天新的一天新的一天
新的一天新的一天新的一天新的一天新的一天新的一天新的一天新的一天新的一天新的一天新的一天
新的一天新的一天新的一天新的一天新的一天新的一天新的一天新的一天新的一天新的一天新的一天
新的一天新的一天新的一天新的一天新的一天新的一天新的一天新的一天新的一天新的一天新的一天
新的一天新的一天新的一天新的一天新的一天新的一天新的一天新的一天新的一天新的一天新的一天
新的一天新的一天新的一天新的一天新的一天新的一天新的一天
新的一天timestamp 2022-09-15 00:00:00.000000','新的一天') as result;
+--------------+
| result       |
+--------------+
| 新的一天     |
+--------------+
select name_const('2022-09-15 00:00:00.000000','新的一天');
+----------------------------+
| 2022-09-15 00:00:00.000000 |
+----------------------------+
| 新的一天                   |
+----------------------------+
select name_const('新的一天','2022-09-15 00:00:00.000000');
+----------------------------+
| 新的一天                   |
+----------------------------+
| 2022-09-15 00:00:00.000000 |
+----------------------------+
select name_const('新的一天',timestamp '2022-09-15 00:00:00.000000');
ERROR HY000: Incorrect arguments to name_const
year
select name_const('2022','年份');
+--------+
| 2022   |
+--------+
| 年份   |
+--------+
select name_const(year'2022','年份');
ERROR 42000: Incorrect parameters in the call to native function 'name_const'
select name_const('年份','2022');
+--------+
| 年份   |
+--------+
| 2022   |
+--------+
select name_const('年份',year'2022');
ERROR 42000: Incorrect parameters in the call to native function 'name_const'
转义字符
OB第一次执行时报警告 1474 name has become ''
select name_const('\n','1');
+---+
|   |
+---+
| 1 |
+---+
select name_const('1','\n');
+---+
| 1 |
+---+
| 
 |
+---+
select name_const('\n\n\n\n','1');
+---+
|   |
+---+
| 1 |
+---+
select name_const('a\n','1');
+----+
| a
 |
+----+
| 1  |
+----+
select name_const('年\n月','日');
+---------+
| 年
月   |
+---------+
| 日      |
+---------+
OB第一次执行时报警告 Warning | 1474 | Name '       ' has become ''
select name_const('\t','1');
+---+
|   |
+---+
| 1 |
+---+
select name_const('1','\t');
+---+
| 1 |
+---+
| 	 |
+---+
OB第一次执行时报警告
select name_const('\r',1);
+------+
|      |
+------+
|    1 |
+------+
select name_const('\r\r\r\r',1);
+------+
|      |
+------+
|    1 |
+------+
OB第一次执行时报警告
select name_const('\r\n',1);
+------+
|      |
+------+
|    1 |
+------+
select name_const('1','\r\n');
+----+
| 1  |
+----+
| 
 |
+----+
OB第一次执行时报警告 Warning | 1474 | Name '' has become ''
select name_const('\0\0\0',1);
+------+
|      |
+------+
|    1 |
+------+
select name_const(111,'\0');
+-----+
| 111 |
+-----+
|     |
+-----+
select name_const('\\','\\');
+---+
| \ |
+---+
| \ |
+---+
select name_const('\\\\\\','\\\\\\');
+-----+
| \\\ |
+-----+
| \\\ |
+-----+
select name_const('\'',1);
+------+
| '    |
+------+
|    1 |
+------+
select name_const('\'\'','\'\'');
+----+
| '' |
+----+
| '' |
+----+
select name_const('\"','\"');
+---+
| " |
+---+
| " |
+---+
select name_const('\"\"','\"\"');
+----+
| "" |
+----+
| "" |
+----+
select name_const('\?','\?');
+---+
| ? |
+---+
| ? |
+---+
只能使用常量和普通字符串
SET @a = 1;
select name_const(@a,1);
ERROR HY000: Incorrect arguments to name_const
select name_const(1,@a);
ERROR HY000: Incorrect arguments to name_const
select name_const('age',18),name_const('age',18);
+------+------+
| age  | age  |
+------+------+
|   18 |   18 |
+------+------+
select * from (select name_const('age',18));
+------+
| age  |
+------+
|   18 |
+------+
select * from (select name_const('age',18),name_const('age',18)) a;
ERROR 42S21: Duplicate column name 'age'
drop table t1;
create table t1 select name_const('myvar',1) as myvar;
算术运算符
select name_const(1,1)+1;
+-------------------+
| name_const(1,1)+1 |
+-------------------+
|                 2 |
+-------------------+
select name_const(1+1,1);
ERROR HY000: Incorrect arguments to name_const
select name_const(1,1+1);
ERROR HY000: Incorrect arguments to name_const
select name_const(1,1)-1;
+-------------------+
| name_const(1,1)-1 |
+-------------------+
|                 0 |
+-------------------+
select name_const(1-1,1);
ERROR HY000: Incorrect arguments to name_const
select name_const(1,1-1);
ERROR HY000: Incorrect arguments to name_const
select name_const(1,1)*1;
+-------------------+
| name_const(1,1)*1 |
+-------------------+
|                 1 |
+-------------------+
select name_const(1*1,1);
ERROR HY000: Incorrect arguments to name_const
select name_const(1,1*1);
ERROR HY000: Incorrect arguments to name_const
select name_const(1,1)/1;
+-------------------+
| name_const(1,1)/1 |
+-------------------+
|            1.0000 |
+-------------------+
select name_const(1/1,1);
ERROR HY000: Incorrect arguments to name_const
select name_const(1,1/1);
ERROR HY000: Incorrect arguments to name_const
比较运算符
select name_const(1,1) > select name_const(1,2);
ERROR 42000: You have an error in your SQL syntax; check the manual that corresponds to your OceanBase version for the right syntax to use near 'select name_const(1,2)' at line 1
select name_const(1,1) < select name_const(1,2);
ERROR 42000: You have an error in your SQL syntax; check the manual that corresponds to your OceanBase version for the right syntax to use near 'select name_const(1,2)' at line 1
select name_const(1,1) = select name_const(1,2);
ERROR 42000: You have an error in your SQL syntax; check the manual that corresponds to your OceanBase version for the right syntax to use near 'select name_const(1,2)' at line 1
select name_const(1,1) =! select name_const(1,2);
ERROR 42000: You have an error in your SQL syntax; check the manual that corresponds to your OceanBase version for the right syntax to use near 'select name_const(1,2)' at line 1
验证没有、缺少参数或者参数多余时，预期结果报错
select name_const();
ERROR 42000: Incorrect parameter count in the call to native function 'name_const'
select name_const(1);
ERROR 42000: Incorrect parameter count in the call to native function 'name_const'
select name_const(1,2,3);
ERROR 42000: Incorrect parameter count in the call to native function 'name_const'
验证参数为''或者为null时，结果与mysql一致
select name_const(1,1);
+------+
| 1    |
+------+
|    1 |
+------+
select name_const(1,'');
+---+
| 1 |
+---+
|   |
+---+
select name_const('',1);
+------+
|      |
+------+
|    1 |
+------+
select name_const('','');
+--+
|  |
+--+
|  |
+--+
select name_const('         ','           ');
+-------------+
|             |
+-------------+
|             |
+-------------+
select name_const(1,null);
+------+
| 1    |
+------+
| NULL |
+------+
select name_const(null,null);
ERROR HY000: The 'name_const' syntax is reserved for purposes internal to the OceanBase Server
select name_const(null,1);
ERROR HY000: The 'name_const' syntax is reserved for purposes internal to the OceanBase Server
select name_const('null','null');
+------+
| null |
+------+
| null |
+------+
NAME_CONST-TC-2
函数嵌套
name_const的参数只能使用常量和普通字符串
select name_const('bool',IF(0, 'true', 'false'));
ERROR HY000: Incorrect arguments to name_const
select if((1+1)=2,name_const('result','true'),'false');
+-------------------------------------------------+
| if((1+1)=2,name_const('result','true'),'false') |
+-------------------------------------------------+
| true                                            |
+-------------------------------------------------+
select if(name_const(1,1)>0,'1','0');
+-------------------------------+
| if(name_const(1,1)>0,'1','0') |
+-------------------------------+
| 1                             |
+-------------------------------+
select name_const(IF(1, 'true', 'false'),'bool');
ERROR HY000: Incorrect arguments to name_const
select name_const('test',123456);
+--------+
| test   |
+--------+
| 123456 |
+--------+
select concat('测试',name_const('test',123456));
+--------------------------------------------+
| concat('测试',name_const('test',123456))   |
+--------------------------------------------+
| 测试123456                                 |
+--------------------------------------------+
select charset(name_const('test',123456));
+------------------------------------+
| charset(name_const('test',123456)) |
+------------------------------------+
| binary                             |
+------------------------------------+
select if(name_const('test',123456) = name_const('test',123456),true,false) as result;
+--------+
| result |
+--------+
|      1 |
+--------+
select if(name_const('T',123456) = name_const('test',123456),true,false) as result;
+--------+
| result |
+--------+
|      1 |
+--------+
select if(name_const('test',654321) = name_const('test',123456),true,false) as result;
+--------+
| result |
+--------+
|      0 |
+--------+
drop table t1;
create table t1(c1 int,c2 int);
insert into t1 values(1,111);
insert into t1 values(2,222);
insert into t1 values(3,333);
select case c1 when 1                  then name_const('c2',111)
               when name_const('c1',2) then 222
else '000'
end as CC
from t1;
+------+
| CC   |
+------+
| 111  |
| 222  |
| 000  |
+------+
select case when c1 = 1                  then name_const('c2',111)
            when c1 = name_const('c1',2) then 222
else '000'
end as CC
from t1;
+------+
| CC   |
+------+
| 111  |
| 222  |
| 000  |
+------+
select nullif(name_const('test',123456),name_const('test',123456)) as result;
+--------+
| result |
+--------+
|   NULL |
+--------+
select nullif(name_const('test',123456),name_const('test',123)) as result;
+--------+
| result |
+--------+
| 123456 |
+--------+
select ifnull(null,name_const('test',123456)) as result;
+--------+
| result |
+--------+
| 123456 |
+--------+
select coalesce(null,null,name_const('test',123456)) as result;
+--------+
| result |
+--------+
| 123456 |
+--------+
select cast(name_const('test',123456) as char(20));
+---------------------------------------------+
| cast(name_const('test',123456) as char(20)) |
+---------------------------------------------+
| 123456                                      |
+---------------------------------------------+
select convert(name_const('test',123456),char(20));
+---------------------------------------------+
| convert(name_const('test',123456),char(20)) |
+---------------------------------------------+
| 123456                                      |
+---------------------------------------------+
select abs(name_const('test',123456));
+--------------------------------+
| abs(name_const('test',123456)) |
+--------------------------------+
|                         123456 |
+--------------------------------+
select name_const('test',abs(123456));
ERROR HY000: Incorrect arguments to name_const
select name_const(abs(1),1);
ERROR HY000: Incorrect arguments to name_const
select ceiling(name_const(1,1));
+--------------------------+
| ceiling(name_const(1,1)) |
+--------------------------+
|                        1 |
+--------------------------+
select name_const(ceiling(1),1);
ERROR HY000: Incorrect arguments to name_const
select name_const(1,ceiling(1));
ERROR HY000: Incorrect arguments to name_const
select exp(name_const(1,2));
+----------------------+
| exp(name_const(1,2)) |
+----------------------+
|     7.38905609893065 |
+----------------------+
select floor(name_const(1,1));
+------------------------+
| floor(name_const(1,1)) |
+------------------------+
|                      1 |
+------------------------+
select power(name_const(2,2),name_const(2,2));
+----------------------------------------+
| power(name_const(2,2),name_const(2,2)) |
+----------------------------------------+
|                                      4 |
+----------------------------------------+
select sqrt(name_const(1,2));
+-----------------------+
| sqrt(name_const(1,2)) |
+-----------------------+
|    1.4142135623730951 |
+-----------------------+
select ascii(name_const(1,2));
+------------------------+
| ascii(name_const(1,2)) |
+------------------------+
|                     50 |
+------------------------+
select bin(name_const('bin',12));
+---------------------------+
| bin(name_const('bin',12)) |
+---------------------------+
| 1100                      |
+---------------------------+
select bit_length(name_const('test','text'));
+---------------------------------------+
| bit_length(name_const('test','text')) |
+---------------------------------------+
|                                    32 |
+---------------------------------------+
select char_length(name_const('test','abc'));
+---------------------------------------+
| char_length(name_const('test','abc')) |
+---------------------------------------+
|                                     3 |
+---------------------------------------+
聚合函数
drop table t1;
create table t1(c1 int,c2 int);
insert into t1 values(1,1);
insert into t1 values(2,2);
insert into t1 values(3,3);
insert into t1 values(4,4);
select name_const(max(c1),1) from t1;
ERROR HY000: Incorrect arguments to name_const
select name_const(1,max(c1)) from t1;
ERROR HY000: Incorrect arguments to name_const
select max(name_const(1,1));
+----------------------+
| max(name_const(1,1)) |
+----------------------+
|                    1 |
+----------------------+
select name_const(min(c1),1) from t1;
ERROR HY000: Incorrect arguments to name_const
select name_const(1,min(c1)) from t1;
ERROR HY000: Incorrect arguments to name_const
select min(name_const(1,1));
+----------------------+
| min(name_const(1,1)) |
+----------------------+
|                    1 |
+----------------------+
select name_const(sum(c1),1) from t1;
ERROR HY000: Incorrect arguments to name_const
select name_const(1,sum(c1)) from t1;
ERROR HY000: Incorrect arguments to name_const
select sum(name_const(1,1));
+----------------------+
| sum(name_const(1,1)) |
+----------------------+
|                    1 |
+----------------------+
select name_const(avg(c1),1) from t1;
ERROR HY000: Incorrect arguments to name_const
select name_const(1,avg(c1)) from t1;
ERROR HY000: Incorrect arguments to name_const
select avg(name_const(1,1));
+----------------------+
| avg(name_const(1,1)) |
+----------------------+
|               1.0000 |
+----------------------+
select name_const(count(c1),1) from t1;
ERROR HY000: Incorrect arguments to name_const
select name_const(1,count(c1)) from t1;
ERROR HY000: Incorrect arguments to name_const
select count(name_const(1,1));
+------------------------+
| count(name_const(1,1)) |
+------------------------+
|                      1 |
+------------------------+
NAME_CONST-TC-3
DQL
drop table t1;
create table t1(c1 int,c2 int,c3 int);
insert into t1 values(1,11,111);
insert into t1 values(1,0,111);
insert into t1 values(2,22,222);
insert into t1 values(2,0,222);
insert into t1 values(3,33,333);
insert into t1 values(3,0,333);
select *,name_const('追加列','√') from t1;
+------+------+------+-----------+
| c1   | c2   | c3   | 追加列    |
+------+------+------+-----------+
|    1 |   11 |  111 | √         |
|    1 |    0 |  111 | √         |
|    2 |   22 |  222 | √         |
|    2 |    0 |  222 | √         |
|    3 |   33 |  333 | √         |
|    3 |    0 |  333 | √         |
+------+------+------+-----------+
where
select c1 from t1 where c2 = name_const('c2',11);
+------+
| c1   |
+------+
|    1 |
+------+
select c1,name_const('cc1','+1') from t1 where c1 > 0;
+------+-----+
| c1   | cc1 |
+------+-----+
|    1 | +1  |
|    1 | +1  |
|    2 | +1  |
|    2 | +1  |
|    3 | +1  |
|    3 | +1  |
+------+-----+
order by  因为name_const('c1','c2')的值是常量，所以没有按c2排序也没有报错
select c1,c2 from t1 order by name_const('c1','c2');
+------+------+
| c1   | c2   |
+------+------+
|    1 |   11 |
|    1 |    0 |
|    2 |   22 |
|    2 |    0 |
|    3 |   33 |
|    3 |    0 |
+------+------+
select c1,c2,name_const('column','row') from t1 order by 2;
+------+------+--------+
| c1   | c2   | column |
+------+------+--------+
|    1 |    0 | row    |
|    2 |    0 | row    |
|    3 |    0 | row    |
|    1 |   11 | row    |
|    2 |   22 | row    |
|    3 |   33 | row    |
+------+------+--------+
select c1,c2,name_const('column','row') from t1 order by 3;
+------+------+--------+
| c1   | c2   | column |
+------+------+--------+
|    1 |   11 | row    |
|    1 |    0 | row    |
|    2 |   22 | row    |
|    2 |    0 | row    |
|    3 |   33 | row    |
|    3 |    0 | row    |
+------+------+--------+
group by 
select c1,c2 from t1 group by name_const('ccc','c1');
+------+------+
| c1   | c2   |
+------+------+
|    1 |   11 |
+------+------+
select c1,c2,name_const('column','row') from t1 group by c1;
+------+------+--------+
| c1   | c2   | column |
+------+------+--------+
|    1 |   11 | row    |
|    2 |   22 | row    |
|    3 |   33 | row    |
+------+------+--------+
select c1,c2,name_const('column','row') from t1 group by 3;
+------+------+--------+
| c1   | c2   | column |
+------+------+--------+
|    1 |   11 | row    |
+------+------+--------+
group by + having
select c1,c2 from t1 group by name_const('ccc','c1') having c1 > 0;
+------+------+
| c1   | c2   |
+------+------+
|    1 |   11 |
+------+------+
select c1,c2,name_const('column','row') from t1 group by c1 having c2 > 0;
+------+------+--------+
| c1   | c2   | column |
+------+------+--------+
|    1 |   11 | row    |
|    2 |   22 | row    |
|    3 |   33 | row    |
+------+------+--------+
子查询
exists,not exists
select c1,c2,c3 from t1 where  exists(select * from t1 where c1 > name_const('ccc',0));
+------+------+------+
| c1   | c2   | c3   |
+------+------+------+
|    1 |   11 |  111 |
|    1 |    0 |  111 |
|    2 |   22 |  222 |
|    2 |    0 |  222 |
|    3 |   33 |  333 |
|    3 |    0 |  333 |
+------+------+------+
select c1,name_const('ccc',0) from t1 where exists(select * from t1 where c1 > 0);
+------+------+
| c1   | ccc  |
+------+------+
|    1 |    0 |
|    1 |    0 |
|    2 |    0 |
|    2 |    0 |
|    3 |    0 |
|    3 |    0 |
+------+------+
select c1,c2,c3 from t1 where  not exists(select * from t1 where c1 = name_const('ccc',0));
+------+------+------+
| c1   | c2   | c3   |
+------+------+------+
|    1 |   11 |  111 |
|    1 |    0 |  111 |
|    2 |   22 |  222 |
|    2 |    0 |  222 |
|    3 |   33 |  333 |
|    3 |    0 |  333 |
+------+------+------+
select c1,name_const('ccc',0) from t1 where not exists(select * from t1 where c1 > 0);
+------+------+
| c1   | ccc  |
+------+------+
+------+------+
in,not in
select c1,c2,c3 from t1 where c1 in (name_const('ccc',1));
+------+------+------+
| c1   | c2   | c3   |
+------+------+------+
|    1 |   11 |  111 |
|    1 |    0 |  111 |
+------+------+------+
select c1,name_const('c',1) from t1 where c1 in (1,2);
+------+------+
| c1   | c    |
+------+------+
|    1 |    1 |
|    1 |    1 |
|    2 |    1 |
|    2 |    1 |
+------+------+
select c1,c2,c3 from t1 where c1 not in (name_const('ccc',1));
+------+------+------+
| c1   | c2   | c3   |
+------+------+------+
|    2 |   22 |  222 |
|    2 |    0 |  222 |
|    3 |   33 |  333 |
|    3 |    0 |  333 |
+------+------+------+
select c1,name_const('c',1) from t1 where c1 not in (3);
+------+------+
| c1   | c    |
+------+------+
|    1 |    1 |
|    1 |    1 |
|    2 |    1 |
|    2 |    1 |
+------+------+
any
select c1,name_const('ccc',1) from t1 where c1 > any(select c1 from t1);
+------+------+
| c1   | ccc  |
+------+------+
|    2 |    1 |
|    2 |    1 |
|    3 |    1 |
|    3 |    1 |
+------+------+
select c1,c2 from t1 where c1 > any(select name_const('c',1));
+------+------+
| c1   | c2   |
+------+------+
|    2 |   22 |
|    2 |    0 |
|    3 |   33 |
|    3 |    0 |
+------+------+
some
select c1,name_const('ccc',1) from t1 where c1 > some(select c1 from t1);
+------+------+
| c1   | ccc  |
+------+------+
|    2 |    1 |
|    2 |    1 |
|    3 |    1 |
|    3 |    1 |
+------+------+
select c1 from t1 where c1 > some(select name_const('c',1));
+------+
| c1   |
+------+
|    2 |
|    2 |
|    3 |
|    3 |
+------+
all
select c1,name_const('ccc',1) from t1 where c1 > all(select c1 from t1);
+------+------+
| c1   | ccc  |
+------+------+
+------+------+
select c1 from t1 where c1 > all(select name_const('c',1));
+------+
| c1   |
+------+
|    2 |
|    2 |
|    3 |
|    3 |
+------+
and or
select c1,name_const('c',1) from t1 where c1 = 1 and c2 = 11;
+------+------+
| c1   | c    |
+------+------+
|    1 |    1 |
+------+------+
select c1,name_const('c',1) from t1 where c1 = 1 or c2 = 22;
+------+------+
| c1   | c    |
+------+------+
|    1 |    1 |
|    1 |    1 |
|    2 |    1 |
+------+------+
insert 
insert into t1 values(4,44,name_const('c3',444));
insert into t1 values(4,44,name_const('c3',444)),(5,44,name_const('c3',444)),(name_const('c1',6),44,name_const('c3',444));
update
update t1 set c1 = name_const('c1',0) where c2 = 0;
update t1 set c1 = name_const('c1',-1) where c1 = name_const('c1',0);
delete
delete from t1 where c1 = name_const('c1',-1);
delete from t1 where c1 = name_const('c1',4) and c2 < name_const('c1',55);
NAME_CONST-TC-4
索引 约束
drop table t1;
create table t1(c1 int primary key,c2 varchar(10));
create index idx1 on t1(c1,c2 asc);
insert into t1 values(1,'第一排'),(2,'第二排');
select *,name_const('普通索引','#') from t1;
+----+-----------+--------------+
| c1 | c2        | 普通索引     |
+----+-----------+--------------+
|  1 | 第一排    | #            |
|  2 | 第二排    | #            |
+----+-----------+--------------+
drop table t1;
create table t1(c1 int,c2 varchar(10),index idx1(c2) global);
insert into t1 values(1,'第一排'),(2,'第二排');
select *,name_const('全局索引','#') from t1;
+------+-----------+--------------+
| c1   | c2        | 全局索引     |
+------+-----------+--------------+
|    1 | 第一排    | #            |
|    2 | 第二排    | #            |
+------+-----------+--------------+
drop table t1;
create table t1(c1 int,c2 varchar(10),unique index idx1(c2));
insert into t1 values(1,'第一排'),(2,'第二排');
select *,name_const('唯一索引','#') from t1;
+------+-----------+--------------+
| c1   | c2        | 唯一索引     |
+------+-----------+--------------+
|    1 | 第一排    | #            |
|    2 | 第二排    | #            |
+------+-----------+--------------+
drop table t1;
create table t1(c1 int,c2 varchar(10),index idx1(c1,c2));
insert into t1 values(1,'第一排'),(2,'第二排');
select *,name_const('复合索引','#') from t1;
+------+-----------+--------------+
| c1   | c2        | 复合索引     |
+------+-----------+--------------+
|    1 | 第一排    | #            |
|    2 | 第二排    | #            |
+------+-----------+--------------+
drop table t1;
create table t1(c1 varchar(10) default name_const('col1','unknow'));
ERROR 42000: You have an error in your SQL syntax; check the manual that corresponds to your OceanBase version for the right syntax to use near 'name_const('col1','unknow'))' at line 1
drop table t1;
create table t1(c1 int not null,c2 int default 0);
insert into t1 values(name_const(1,null),1);
ERROR 23000: Column 'c1' cannot be null
insert into t1 values(name_const(1,1),name_const(1,null));
insert into t1 values(name_const(1,1),name_const(1,''));
ERROR HY000: Incorrect integer value for column 'c2' at row 1
select * from t1;
+----+------+
| c1 | c2   |
+----+------+
|  1 | NULL |
+----+------+
drop table t1;
CREATE TABLE t1(c1 INT, c2 INT, CHECK(c1 = c2));
insert into t1 values(name_const(1,123),name_const(2,123));
select *,name_const('check','#') from t1;
+------+------+-------+
| c1   | c2   | check |
+------+------+-------+
|  123 |  123 | #     |
+------+------+-------+
drop table t1;
create table t1(c1 int primary key,c2 int);
drop table t2;
create table t2(d1 int, d2 int,constraint pk1 foreign key(d1) references t1(c1));
insert into t1 values(name_const(1,123),name_const(2,123));
insert into t2 values(name_const(1,123),name_const(2,123));
select *,name_const('foreign key','#') from t1 join t2;
+-----+------+------+------+-------------+
| c1  | c2   | d1   | d2   | foreign key |
+-----+------+------+------+-------------+
| 123 |  123 |  123 |  123 | #           |
+-----+------+------+------+-------------+
drop table t2;
drop table t1;
CREATE TABLE t1(c1 INT, c2 INT, unique(c1));
insert into t1 values(name_const(1,123),name_const(2,223));
select *,name_const('unique','#') from t1;
+------+------+--------+
| c1   | c2   | unique |
+------+------+--------+
|  123 |  223 | #      |
+------+------+--------+
NAME_CONST-TC-5
存储过程中的使用
预期name_const不能传形参aa,实际结果成功，BUG:45036290
drop procedure p1;
create procedure p1(in aa int)
 begin
  case 
  when aa < 60 then
    select name_const('score',60);
  when aa = 60 then
    select name_const('score','及格');
  else
  select name_const('score',aa);
  end case;
 end /
call p1(59);
+------------------------+
| name_const('score',60) |
+------------------------+
|                     60 |
+------------------------+
call p1(60);
+------------------------------+
| name_const('score','及格')   |
+------------------------------+
| 及格                         |
+------------------------------+
call p1(88);
+------------------------+
| name_const('score',aa) |
+------------------------+
|                     88 |
+------------------------+
call p1(name_const('score',66));
+------------------------+
| name_const('score',aa) |
+------------------------+
|                     66 |
+------------------------+
drop procedure p1;
create procedure p1(in a int,out b int)
 begin
  set b = name_const('age',18);
  if a > b then
    set b = name_const('年轻人',18);
  else 
	set b = name_const('老年人',18);
  end if;
 end /
call p1(20,@b);
ob警告但是过程创建成功，call报错，MySQL官方是直接报错
Warning | 5002 | Resolve error
drop procedure p1;
create procedure p1(inout name varchar(20))
begin
	set name = concat('id-',name_const('value',name));
end /
Warnings:
Warning	5002	Resolve error
call p1();
ERROR 42000: Incorrect number of arguments
预期name_const不能传形参aa,实际结果成功
drop procedure p1;
create procedure p1()
begin
	declare value varchar(20) default 'unknow';
	set value = 'abc';
	select name_const(value,value);
end /
call p1();
ERROR HY000: Incorrect arguments to name_const
触发器
drop table t1;
create table t1(c1 int,c2 int);
drop table t2;
create table t2(c1 int,c2 int);
drop trigger trg_name_const;
create trigger trg_name_const
after insert on t1
for each row
insert into t2
values(name_const(1,1),name_const(1,1));
insert into t1 values(name_const(2,2),name_const(2,2));
select * from t1;
+------+------+
| c1   | c2   |
+------+------+
|    2 |    2 |
+------+------+
select * from t2;
+------+------+
| c1   | c2   |
+------+------+
|    1 |    1 |
+------+------+
自定义函数
drop function f1;
create function f1(aa varchar(10),bb int) returns int
begin
	return name_const(aa,bb);
end;
/
Warnings:
Warning	5002	Resolve error
select f1('age',18);
ERROR HY000: Incorrect arguments to name_const
drop function f1;
create function f1() returns varchar(20)
begin
	declare value varchar(20) default 'unknow';
	set value = 'abc';
	return name_const(value,value);
end /
Warnings:
Warning	5002	Resolve error
select f1();
ERROR HY000: Incorrect arguments to name_const
复制表
drop table t1;
create table t1(c1 int,c2 int,c3 int,c4 int);
insert into t1 values(1,2,3,4);
drop table t2;
create table t2 as select * from t1;
select * from t2;
+------+------+------+------+
| c1   | c2   | c3   | c4   |
+------+------+------+------+
|    1 |    2 |    3 |    4 |
+------+------+------+------+
insert into t2 values(name_const(1,11),name_const(2,22),name_const(3,33),name_const(4,44));
delete from t2 where c1 = name_const(1,1);
update t2 set c1 = name_const(1,1111);
select name_const('t2','values'),* from t2;
+--------+------+------+------+------+
| t2     | c1   | c2   | c3   | c4   |
+--------+------+------+------+------+
| values | 1111 |   22 |   33 |   44 |
+--------+------+------+------+------+
视图
drop table t1;
create table t1(c1 int,c2 int,c3 int,c4 int);
insert into t1 values(1,2,3,4);
drop view v1;
create view v1 as select c1,c2,c3,c4 from t1;
select * from v1;
+------+------+------+------+
| c1   | c2   | c3   | c4   |
+------+------+------+------+
|    1 |    2 |    3 |    4 |
+------+------+------+------+
insert into v1 values(name_const(1,11),name_const(2,22),name_const(3,33),name_const(4,44));
delete from v1 where c1 = name_const(1,1);
update v1 set c1 = name_const(1,1111);
select name_const('v1','values'),* from v1;
+--------+------+------+------+------+
| v1     | c1   | c2   | c3   | c4   |
+--------+------+------+------+------+
| values | 1111 |   22 |   33 |   44 |
+--------+------+------+------+------+
分区表
hash
drop table t1;
create table t1(c1 int,c2 int)
partition by hash(c1)
(
partition p0,
partition p1
);
insert into t1 values(name_const('test',1),1);
insert into t1 values(name_const('test',2),2);
insert into t1 values(name_const('test',3),3);
insert into t1 values(name_const('test',4),4);
insert into t1 values(name_const('test',5),5);
insert into t1 values(name_const('test',6),6);
select * from t1;
+------+------+
| c1   | c2   |
+------+------+
|    2 |    2 |
|    4 |    4 |
|    6 |    6 |
|    1 |    1 |
|    3 |    3 |
|    5 |    5 |
+------+------+
select * from t1 partition(p0) where c1 = name_const(2,2);
+------+------+
| c1   | c2   |
+------+------+
|    2 |    2 |
+------+------+
update t1 set c1 = name_const(7,7) where c1 = name_const(6,6);
delete from t1 where c1 = name_const(5,5);
select * from t1 partition(p0);
+------+------+
| c1   | c2   |
+------+------+
|    2 |    2 |
|    4 |    4 |
+------+------+
range
drop table t1;
create table t1(c1 int,c2 int)
partition by range(c1)
(
partition p1 values less than(10),
partition p2 values less than(50),
partition pmax values less than (maxvalue)
);
insert into t1 values(name_const('test',1),1);
insert into t1 values(name_const('test',11),11);
insert into t1 values(name_const('test',22),22);
insert into t1 values(name_const('test',55),55);
select * from t1 partition(p2) where c1 = name_const('test',11) order by 1;
+------+------+
| c1   | c2   |
+------+------+
|   11 |   11 |
+------+------+
update t1 partition(p2) set c1 = name_const('test',12) where c1 = name_const('test',11);
delete from t1 partition(p2) where c1 = name_const('test',22);
select * from t1;
+------+------+
| c1   | c2   |
+------+------+
|    1 |    1 |
|   12 |   11 |
|   55 |   55 |
+------+------+
list
drop table t1;
create table t1(c1 int,c2 int)
partition by list(c1)
(
partition p1 values in(name_const('test',1),name_const('test',2),name_const('test',3)),
partition p2 values in(name_const('test',4),name_const('test',5),name_const('test',6)),
partition p3 values in(name_const('test',7),name_const('test',8),name_const('test',9))
);
ERROR HY000: This partition function is not allowed
list
drop table t1;
create table t1(c1 int,c2 int)
partition by key(c1)
partitions 2;
insert into t1 values(name_const('test',1),1);
insert into t1 values(name_const('test',2),2);
insert into t1 values(name_const('test',3),3);
insert into t1 values(name_const('test',4),4);
insert into t1 values(name_const('test',5),5);
insert into t1 values(name_const('test',6),6);
select * from t1 partition(p0);
+------+------+
| c1   | c2   |
+------+------+
|    1 |    1 |
|    2 |    2 |
|    3 |    3 |
|    4 |    4 |
|    5 |    5 |
|    6 |    6 |
+------+------+
delete from t1 partition(p0) where c1 > name_const('test',5);
update t1 partition(p0) set c1 = name_const('test',1) where c1 = 3;
select name_const('list分区','p0'),* from t1;
+------------+------+------+
| list分区   | c1   | c2   |
+------------+------+------+
| p0         |    1 |    1 |
| p0         |    2 |    2 |
| p0         |    1 |    3 |
| p0         |    4 |    4 |
| p0         |    5 |    5 |
+------------+------+------+
NAME_CONST-TC-6
待支持后再执行
#select * from (select * from(select name_const(version(),0))a join (select name_const(version(),0))b)c;
异常场景  database和user都是变量,预期报错无法查看
#select user();
select name_const(user(),1);
ERROR HY000: Incorrect arguments to name_const
select name_const(database(),1);
ERROR HY000: Incorrect arguments to name_const
补充字符集测试
utf8、utf8mb4、utf16、binary、gbk、gb18030
select name_const('s1',_utf8'test');
+------+
| s1   |
+------+
| test |
+------+
select name_const(1,_utf8'test' collate utf8_general_ci);
+------+
| 1    |
+------+
| test |
+------+
select name_const(1,_utf8'test' collate utf8_unicode_ci);
+------+
| 1    |
+------+
| test |
+------+
select name_const(1,_utf8'test' collate utf8_bin);
+------+
| 1    |
+------+
| test |
+------+
select name_const('中国',_utf8mb4'test');
+--------+
| 中国   |
+--------+
| test   |
+--------+
select name_const('！@#￥%……&*',_utf8mb4'test' collate utf8mb4_general_ci);
+-------------------+
| ！@#￥%……&*       |
+-------------------+
| test              |
+-------------------+
select name_const('123abc中国城',_utf8mb4'test' collate utf8mb4_unicode_ci);
+-----------------+
| 123abc中国城    |
+-----------------+
| test            |
+-----------------+
select name_const('utf8mb4',_utf8mb4'test' collate utf8mb4_bin);
+---------+
| utf8mb4 |
+---------+
| test    |
+---------+
select name_const('1.0000000001',_utf16'test');
+--------------+
| 1.0000000001 |
+--------------+
| 瑥獴         |
+--------------+
select name_const(true,_utf16'test' collate utf16_general_ci);
+--------+
| 1      |
+--------+
| 瑥獴   |
+--------+
select name_const(false,_utf16'test' collate utf16_bin);
+--------+
| 0      |
+--------+
| 瑥獴   |
+--------+
select name_const(0,_utf16'test' collate utf16_unicode_ci);
+--------+
| 0      |
+--------+
| 瑥獴   |
+--------+
select name_const(1.234E+8,_binary'test');
+-----------+
| 123400000 |
+-----------+
| test      |
+-----------+
select name_const('12:12:12',_gbk'test');
+----------+
| 12:12:12 |
+----------+
| test     |
+----------+
select name_const('null',_gbk'test' collate gbk_chinese_ci);
+------+
| null |
+------+
| test |
+------+
select name_const('2022-09-23 11:11:11',_gbk'test' collate gbk_bin);
+---------------------+
| 2022-09-23 11:11:11 |
+---------------------+
| test                |
+---------------------+
select name_const('0',_gb18030'test');
+------+
| 0    |
+------+
| test |
+------+
select name_const('',_gb18030'test' collate gb18030_chinese_ci);
+------+
|      |
+------+
| test |
+------+
select name_const('value',_gb18030'test' collate gb18030_bin);
+-------+
| value |
+-------+
| test  |
+-------+
select name_const(_utf8'test', 's1');
+------+
| test |
+------+
| s1   |
+------+
select name_const(_utf8mb4'test', 1);
+------+
| test |
+------+
|    1 |
+------+
select name_const(_utf16'test', null);
+------+
| test |
+------+
| NULL |
+------+
select name_const(_binary'test', true);
+------+
| test |
+------+
|    1 |
+------+
select name_const(_gbk'test', '');
+------+
| test |
+------+
|      |
+------+
select name_const(_gb18030'test', '111aaa√√√中中中');
+--------------------------+
| test                     |
+--------------------------+
| 111aaa√√√中中中          |
+--------------------------+
select name_const(_utf8'test' collate utf8_general_ci, 's1');
ERROR HY000: Incorrect arguments to name_const
select name_const(_utf8'test' collate utf8_unicode_ci, 's1');
ERROR HY000: Incorrect arguments to name_const
select name_const(_utf8'test' collate utf8_bin, 's1');
ERROR HY000: Incorrect arguments to name_const
select name_const(_utf8mb4'test' collate utf8mb4_general_ci, 1);
ERROR HY000: Incorrect arguments to name_const
select name_const(_utf8mb4'test' collate utf8mb4_unicode_ci, 1);
ERROR HY000: Incorrect arguments to name_const
select name_const(_utf8mb4'test' collate utf8mb4_bin, 1);
ERROR HY000: Incorrect arguments to name_const
select name_const(_utf16'test' collate utf16_general_ci, null);
ERROR HY000: Incorrect arguments to name_const
select name_const(_utf16'test' collate utf16_bin, null);
ERROR HY000: Incorrect arguments to name_const
select name_const(_utf16'test' collate utf16_unicode_ci, null);
ERROR HY000: Incorrect arguments to name_const
select name_const(_gbk'test' collate gbk_chinese_ci, '');
ERROR HY000: Incorrect arguments to name_const
select name_const(_gbk'test' collate gbk_bin, '');
ERROR HY000: Incorrect arguments to name_const
select name_const(_gb18030'test' collate gb18030_chinese_ci, '111aaa√√√中中中');
ERROR HY000: Incorrect arguments to name_const
select name_const(_gb18030'test' collate gb18030_bin, '111aaa√√√中中中');
ERROR HY000: Incorrect arguments to name_const
PURGE RECYCLEBIN;
