purge recyclebin;
result_format: 4
drop user whh@'%';
drop database if exists whh ;
create user whh identified by 'whh';
create database whh ;
grant all on *.* to whh with grant option;


##测试每种场合时，起始条件可能不同，可以删除再重新创建表
set sql_mode='strict_all_tables,no_zero_in_date';
alter system set default_auto_increment_mode = 'order';
##########################################################################################################################
###### 标签：auto_incre_1-1，auto_incre_1-5，auto_incre_2，auto_incre_3-1
###### 功能：数据类型（INT），复制表，自增模式，DML操作 
########################################################################################################################## 
##建表
drop table table0_date;
create table table0_date (
  a int,
  b int default 0,
  txt varchar(64) default 'table0_date'
);
insert into table0_date(a) values(110),(111),(112),(210),(211),(212);
drop table table1_default;
create table table1_default (
  a int not null auto_increment primary key,
  b int default 1,
  txt varchar(64) default 'table1_default 默认order模式',
  unique index(a)
);
drop table table2_order;
create table table2_order (
  a int not null auto_increment primary key,
  b int default 2,
  txt varchar(64) default 'table2_order order模式',
  unique index(a)
) auto_increment_mode = 'order';
drop table table3_noorder;
create table table3_noorder (
  a int not null auto_increment primary key,
  b int default 3,
  txt varchar(64) default 'table3_noorder noorder模式',
  unique index(a)
) auto_increment_mode = 'noorder';
############ 复制表 CREATE TABLE ... LIKE 语句
drop table like_t1_default;
create table like_t1_default like table1_default;
drop table like_t2_order;
create table like_t2_order like table2_order;
drop table like_t3_noorder;
create table like_t3_noorder like table3_noorder;
############ auto_incre_3-1 DML操作 ############
###### auto_incre_3-1-1 ①INSERT操作 
##简单插入
##INSERT 语句
##like_t1_default
insert into like_t1_default(a) values(null);
insert into like_t1_default(a) values(null),(null),(null);
select txt,a incre_col,b from like_t1_default order by a;
+----------------------------------+-----------+------+
| txt                              | incre_col | b    |
+----------------------------------+-----------+------+
| table1_default 默认order模式     |         1 |    1 |
| table1_default 默认order模式     |         2 |    1 |
| table1_default 默认order模式     |         3 |    1 |
| table1_default 默认order模式     |         4 |    1 |
+----------------------------------+-----------+------+
insert into like_t1_default(a) values(10);
insert into like_t1_default(a,txt) values(0,'最新自增值=>');
select txt,a incre_col,b from like_t1_default order by a;
+----------------------------------+-----------+------+
| txt                              | incre_col | b    |
+----------------------------------+-----------+------+
| table1_default 默认order模式     |         1 |    1 |
| table1_default 默认order模式     |         2 |    1 |
| table1_default 默认order模式     |         3 |    1 |
| table1_default 默认order模式     |         4 |    1 |
| table1_default 默认order模式     |        10 |    1 |
| 最新自增值=>                     |        11 |    1 |
+----------------------------------+-----------+------+
## like_t2_order
insert into like_t2_order(a) values(null);
insert into like_t2_order(a) values(null),(null),(null);
select txt,a incre_col,b from like_t2_order order by a;
+--------------------------+-----------+------+
| txt                      | incre_col | b    |
+--------------------------+-----------+------+
| table2_order order模式   |         1 |    2 |
| table2_order order模式   |         2 |    2 |
| table2_order order模式   |         3 |    2 |
| table2_order order模式   |         4 |    2 |
+--------------------------+-----------+------+
insert into like_t2_order(a) values(10);
insert into  like_t2_order(a,txt) values(0,'最新自增值=>');
select txt,a incre_col,b from like_t2_order order by a;
+--------------------------+-----------+------+
| txt                      | incre_col | b    |
+--------------------------+-----------+------+
| table2_order order模式   |         1 |    2 |
| table2_order order模式   |         2 |    2 |
| table2_order order模式   |         3 |    2 |
| table2_order order模式   |         4 |    2 |
| table2_order order模式   |        10 |    2 |
| 最新自增值=>             |        11 |    2 |
+--------------------------+-----------+------+
##like_t3_noorder
insert into like_t3_noorder(a) values(null);
insert into like_t3_noorder(a) values(null),(null),(null);
select txt,a incre_col,b from like_t3_noorder order by a;
+------------------------------+-----------+------+
| txt                          | incre_col | b    |
+------------------------------+-----------+------+
| table3_noorder noorder模式   |         1 |    3 |
| table3_noorder noorder模式   |         2 |    3 |
| table3_noorder noorder模式   |         3 |    3 |
| table3_noorder noorder模式   |         4 |    3 |
+------------------------------+-----------+------+
insert into like_t3_noorder(a) values(10);
insert into like_t3_noorder(a,txt) values(0,'最新自增值=>');
select txt,a incre_col,b from like_t3_noorder order by a;
+------------------------------+-----------+------+
| txt                          | incre_col | b    |
+------------------------------+-----------+------+
| table3_noorder noorder模式   |         1 |    3 |
| table3_noorder noorder模式   |         2 |    3 |
| table3_noorder noorder模式   |         3 |    3 |
| table3_noorder noorder模式   |         4 |    3 |
| table3_noorder noorder模式   |        10 |    3 |
| 最新自增值=>                 |   1000001 |    3 |
+------------------------------+-----------+------+
##REPLACE 语句
replace into like_t1_default(a) values(0),(0),(0);
select txt,a incre_col,b from like_t1_default order by a;
+----------------------------------+-----------+------+
| txt                              | incre_col | b    |
+----------------------------------+-----------+------+
| table1_default 默认order模式     |         1 |    1 |
| table1_default 默认order模式     |         2 |    1 |
| table1_default 默认order模式     |         3 |    1 |
| table1_default 默认order模式     |         4 |    1 |
| table1_default 默认order模式     |        10 |    1 |
| 最新自增值=>                     |        11 |    1 |
| table1_default 默认order模式     |        12 |    1 |
| table1_default 默认order模式     |        13 |    1 |
| table1_default 默认order模式     |        14 |    1 |
+----------------------------------+-----------+------+
replace into  like_t2_order(a) values(0),(0),(0);
select txt,a incre_col,b from like_t2_order order by a;
+--------------------------+-----------+------+
| txt                      | incre_col | b    |
+--------------------------+-----------+------+
| table2_order order模式   |         1 |    2 |
| table2_order order模式   |         2 |    2 |
| table2_order order模式   |         3 |    2 |
| table2_order order模式   |         4 |    2 |
| table2_order order模式   |        10 |    2 |
| 最新自增值=>             |        11 |    2 |
| table2_order order模式   |        12 |    2 |
| table2_order order模式   |        13 |    2 |
| table2_order order模式   |        14 |    2 |
+--------------------------+-----------+------+
replace into like_t3_noorder(a) values(null),(null),(null);
select txt,a incre_col,b from like_t3_noorder order by a;
+------------------------------+-----------+------+
| txt                          | incre_col | b    |
+------------------------------+-----------+------+
| table3_noorder noorder模式   |         1 |    3 |
| table3_noorder noorder模式   |         2 |    3 |
| table3_noorder noorder模式   |         3 |    3 |
| table3_noorder noorder模式   |         4 |    3 |
| table3_noorder noorder模式   |        10 |    3 |
| 最新自增值=>                 |   1000001 |    3 |
| table3_noorder noorder模式   |   1000002 |    3 |
| table3_noorder noorder模式   |   1000003 |    3 |
| table3_noorder noorder模式   |   1000004 |    3 |
+------------------------------+-----------+------+
##测试点 - 将任何其他值插入 AUTO_INCREMENT列
##INSERT 语句
insert into like_t1_default(a) values(15),(-25),(35),(45.5);
insert into like_t1_default(a,txt) values(0,'最新自增值=>');
select txt,a incre_col,b from like_t1_default order by a;
+----------------------------------+-----------+------+
| txt                              | incre_col | b    |
+----------------------------------+-----------+------+
| table1_default 默认order模式     |       -25 |    1 |
| table1_default 默认order模式     |         1 |    1 |
| table1_default 默认order模式     |         2 |    1 |
| table1_default 默认order模式     |         3 |    1 |
| table1_default 默认order模式     |         4 |    1 |
| table1_default 默认order模式     |        10 |    1 |
| 最新自增值=>                     |        11 |    1 |
| table1_default 默认order模式     |        12 |    1 |
| table1_default 默认order模式     |        13 |    1 |
| table1_default 默认order模式     |        14 |    1 |
| table1_default 默认order模式     |        15 |    1 |
| table1_default 默认order模式     |        35 |    1 |
| table1_default 默认order模式     |        46 |    1 |
| 最新自增值=>                     |        47 |    1 |
+----------------------------------+-----------+------+
insert into like_t2_order(a) values(15),(-25),(35),(45.5);
insert into  like_t2_order(a,txt) values(0,'最新自增值=>');
select txt,a incre_col,b from like_t2_order order by a;
+--------------------------+-----------+------+
| txt                      | incre_col | b    |
+--------------------------+-----------+------+
| table2_order order模式   |       -25 |    2 |
| table2_order order模式   |         1 |    2 |
| table2_order order模式   |         2 |    2 |
| table2_order order模式   |         3 |    2 |
| table2_order order模式   |         4 |    2 |
| table2_order order模式   |        10 |    2 |
| 最新自增值=>             |        11 |    2 |
| table2_order order模式   |        12 |    2 |
| table2_order order模式   |        13 |    2 |
| table2_order order模式   |        14 |    2 |
| table2_order order模式   |        15 |    2 |
| table2_order order模式   |        35 |    2 |
| table2_order order模式   |        46 |    2 |
| 最新自增值=>             |        47 |    2 |
+--------------------------+-----------+------+
insert into like_t3_noorder(a) values(15),(-25),(35),(45.5);
insert into like_t3_noorder(a,txt) values(0,'最新自增值=>');
select txt,a incre_col,b from like_t3_noorder order by a;
+------------------------------+-----------+------+
| txt                          | incre_col | b    |
+------------------------------+-----------+------+
| table3_noorder noorder模式   |       -25 |    3 |
| table3_noorder noorder模式   |         1 |    3 |
| table3_noorder noorder模式   |         2 |    3 |
| table3_noorder noorder模式   |         3 |    3 |
| table3_noorder noorder模式   |         4 |    3 |
| table3_noorder noorder模式   |        10 |    3 |
| table3_noorder noorder模式   |        15 |    3 |
| table3_noorder noorder模式   |        35 |    3 |
| table3_noorder noorder模式   |        46 |    3 |
| 最新自增值=>                 |   1000001 |    3 |
| table3_noorder noorder模式   |   1000002 |    3 |
| table3_noorder noorder模式   |   1000003 |    3 |
| table3_noorder noorder模式   |   1000004 |    3 |
| 最新自增值=>                 |   1000005 |    3 |
+------------------------------+-----------+------+
##批量插入
##INSERT ... SELECT语句
insert into like_t1_default select a,b,txt from table0_date where a <= 200;
select txt,a incre_col,b from like_t1_default order by a;
+----------------------------------+-----------+------+
| txt                              | incre_col | b    |
+----------------------------------+-----------+------+
| table1_default 默认order模式     |       -25 |    1 |
| table1_default 默认order模式     |         1 |    1 |
| table1_default 默认order模式     |         2 |    1 |
| table1_default 默认order模式     |         3 |    1 |
| table1_default 默认order模式     |         4 |    1 |
| table1_default 默认order模式     |        10 |    1 |
| 最新自增值=>                     |        11 |    1 |
| table1_default 默认order模式     |        12 |    1 |
| table1_default 默认order模式     |        13 |    1 |
| table1_default 默认order模式     |        14 |    1 |
| table1_default 默认order模式     |        15 |    1 |
| table1_default 默认order模式     |        35 |    1 |
| table1_default 默认order模式     |        46 |    1 |
| 最新自增值=>                     |        47 |    1 |
| table0_date                      |       110 |    0 |
| table0_date                      |       111 |    0 |
| table0_date                      |       112 |    0 |
+----------------------------------+-----------+------+
insert into like_t1_default(a,txt) values(0,'最新自增值=>');
select txt,a incre_col,b from like_t1_default order by a;
+----------------------------------+-----------+------+
| txt                              | incre_col | b    |
+----------------------------------+-----------+------+
| table1_default 默认order模式     |       -25 |    1 |
| table1_default 默认order模式     |         1 |    1 |
| table1_default 默认order模式     |         2 |    1 |
| table1_default 默认order模式     |         3 |    1 |
| table1_default 默认order模式     |         4 |    1 |
| table1_default 默认order模式     |        10 |    1 |
| 最新自增值=>                     |        11 |    1 |
| table1_default 默认order模式     |        12 |    1 |
| table1_default 默认order模式     |        13 |    1 |
| table1_default 默认order模式     |        14 |    1 |
| table1_default 默认order模式     |        15 |    1 |
| table1_default 默认order模式     |        35 |    1 |
| table1_default 默认order模式     |        46 |    1 |
| 最新自增值=>                     |        47 |    1 |
| table0_date                      |       110 |    0 |
| table0_date                      |       111 |    0 |
| table0_date                      |       112 |    0 |
| 最新自增值=>                     |       113 |    1 |
+----------------------------------+-----------+------+
insert into  like_t2_order select a,b,txt from table0_date where a <= 200;
select txt,a incre_col,b from like_t2_order order by a;
+--------------------------+-----------+------+
| txt                      | incre_col | b    |
+--------------------------+-----------+------+
| table2_order order模式   |       -25 |    2 |
| table2_order order模式   |         1 |    2 |
| table2_order order模式   |         2 |    2 |
| table2_order order模式   |         3 |    2 |
| table2_order order模式   |         4 |    2 |
| table2_order order模式   |        10 |    2 |
| 最新自增值=>             |        11 |    2 |
| table2_order order模式   |        12 |    2 |
| table2_order order模式   |        13 |    2 |
| table2_order order模式   |        14 |    2 |
| table2_order order模式   |        15 |    2 |
| table2_order order模式   |        35 |    2 |
| table2_order order模式   |        46 |    2 |
| 最新自增值=>             |        47 |    2 |
| table0_date              |       110 |    0 |
| table0_date              |       111 |    0 |
| table0_date              |       112 |    0 |
+--------------------------+-----------+------+
insert into  like_t2_order(a,txt) values(0,'最新自增值=>');
select txt,a incre_col,b from like_t2_order order by a;
+--------------------------+-----------+------+
| txt                      | incre_col | b    |
+--------------------------+-----------+------+
| table2_order order模式   |       -25 |    2 |
| table2_order order模式   |         1 |    2 |
| table2_order order模式   |         2 |    2 |
| table2_order order模式   |         3 |    2 |
| table2_order order模式   |         4 |    2 |
| table2_order order模式   |        10 |    2 |
| 最新自增值=>             |        11 |    2 |
| table2_order order模式   |        12 |    2 |
| table2_order order模式   |        13 |    2 |
| table2_order order模式   |        14 |    2 |
| table2_order order模式   |        15 |    2 |
| table2_order order模式   |        35 |    2 |
| table2_order order模式   |        46 |    2 |
| 最新自增值=>             |        47 |    2 |
| table0_date              |       110 |    0 |
| table0_date              |       111 |    0 |
| table0_date              |       112 |    0 |
| 最新自增值=>             |       113 |    2 |
+--------------------------+-----------+------+
insert into like_t3_noorder select a,b,txt from table0_date where a <= 200;
select txt,a incre_col,b from like_t3_noorder order by a;
+------------------------------+-----------+------+
| txt                          | incre_col | b    |
+------------------------------+-----------+------+
| table3_noorder noorder模式   |       -25 |    3 |
| table3_noorder noorder模式   |         1 |    3 |
| table3_noorder noorder模式   |         2 |    3 |
| table3_noorder noorder模式   |         3 |    3 |
| table3_noorder noorder模式   |         4 |    3 |
| table3_noorder noorder模式   |        10 |    3 |
| table3_noorder noorder模式   |        15 |    3 |
| table3_noorder noorder模式   |        35 |    3 |
| table3_noorder noorder模式   |        46 |    3 |
| table0_date                  |       110 |    0 |
| table0_date                  |       111 |    0 |
| table0_date                  |       112 |    0 |
| 最新自增值=>                 |   1000001 |    3 |
| table3_noorder noorder模式   |   1000002 |    3 |
| table3_noorder noorder模式   |   1000003 |    3 |
| table3_noorder noorder模式   |   1000004 |    3 |
| 最新自增值=>                 |   1000005 |    3 |
+------------------------------+-----------+------+
insert into like_t3_noorder(a,txt) values(0,'最新自增值=>');
select txt,a incre_col,b from like_t3_noorder order by a;
+------------------------------+-----------+------+
| txt                          | incre_col | b    |
+------------------------------+-----------+------+
| table3_noorder noorder模式   |       -25 |    3 |
| table3_noorder noorder模式   |         1 |    3 |
| table3_noorder noorder模式   |         2 |    3 |
| table3_noorder noorder模式   |         3 |    3 |
| table3_noorder noorder模式   |         4 |    3 |
| table3_noorder noorder模式   |        10 |    3 |
| table3_noorder noorder模式   |        15 |    3 |
| table3_noorder noorder模式   |        35 |    3 |
| table3_noorder noorder模式   |        46 |    3 |
| table0_date                  |       110 |    0 |
| table0_date                  |       111 |    0 |
| table0_date                  |       112 |    0 |
| 最新自增值=>                 |   1000001 |    3 |
| table3_noorder noorder模式   |   1000002 |    3 |
| table3_noorder noorder模式   |   1000003 |    3 |
| table3_noorder noorder模式   |   1000004 |    3 |
| 最新自增值=>                 |   1000005 |    3 |
| 最新自增值=>                 |   1000006 |    3 |
+------------------------------+-----------+------+
##混合插入
##INSERT ... ON DUPLICATE KEY UPDATE 语句
insert into like_t1_default (a,b,txt) values (1,1,'重复场合') on duplicate key update b=b+1,txt='insert...on duplicate key update 语句';
insert into like_t1_default(a,txt) values(0,'最新自增值1=>');
select txt,a incre_col,b from like_t1_default order by a;
+-----------------------------------------+-----------+------+
| txt                                     | incre_col | b    |
+-----------------------------------------+-----------+------+
| table1_default 默认order模式            |       -25 |    1 |
| insert...on duplicate key update 语句   |         1 |    2 |
| table1_default 默认order模式            |         2 |    1 |
| table1_default 默认order模式            |         3 |    1 |
| table1_default 默认order模式            |         4 |    1 |
| table1_default 默认order模式            |        10 |    1 |
| 最新自增值=>                            |        11 |    1 |
| table1_default 默认order模式            |        12 |    1 |
| table1_default 默认order模式            |        13 |    1 |
| table1_default 默认order模式            |        14 |    1 |
| table1_default 默认order模式            |        15 |    1 |
| table1_default 默认order模式            |        35 |    1 |
| table1_default 默认order模式            |        46 |    1 |
| 最新自增值=>                            |        47 |    1 |
| table0_date                             |       110 |    0 |
| table0_date                             |       111 |    0 |
| table0_date                             |       112 |    0 |
| 最新自增值=>                            |       113 |    1 |
| 最新自增值1=>                           |       114 |    1 |
+-----------------------------------------+-----------+------+
insert into like_t1_default (a,b,txt) values (150,1,'不重复场合') on duplicate key update b=b+1,txt='insert...on duplicate key update 语句';
insert into like_t1_default(a,txt) values(0,'最新自增值2=>');
select txt,a incre_col,b from like_t1_default order by a;
+-----------------------------------------+-----------+------+
| txt                                     | incre_col | b    |
+-----------------------------------------+-----------+------+
| table1_default 默认order模式            |       -25 |    1 |
| insert...on duplicate key update 语句   |         1 |    2 |
| table1_default 默认order模式            |         2 |    1 |
| table1_default 默认order模式            |         3 |    1 |
| table1_default 默认order模式            |         4 |    1 |
| table1_default 默认order模式            |        10 |    1 |
| 最新自增值=>                            |        11 |    1 |
| table1_default 默认order模式            |        12 |    1 |
| table1_default 默认order模式            |        13 |    1 |
| table1_default 默认order模式            |        14 |    1 |
| table1_default 默认order模式            |        15 |    1 |
| table1_default 默认order模式            |        35 |    1 |
| table1_default 默认order模式            |        46 |    1 |
| 最新自增值=>                            |        47 |    1 |
| table0_date                             |       110 |    0 |
| table0_date                             |       111 |    0 |
| table0_date                             |       112 |    0 |
| 最新自增值=>                            |       113 |    1 |
| 最新自增值1=>                           |       114 |    1 |
| 不重复场合                              |       150 |    1 |
| 最新自增值2=>                           |       151 |    1 |
+-----------------------------------------+-----------+------+
insert into  like_t2_order (a,b,txt) values (1,2,'重复场合') on duplicate key update b=b+1,txt='insert...on duplicate key update 语句';
insert into  like_t2_order(a,txt) values(0,'最新自增值1=>');
select txt,a incre_col,b from like_t2_order order by a;
+-----------------------------------------+-----------+------+
| txt                                     | incre_col | b    |
+-----------------------------------------+-----------+------+
| table2_order order模式                  |       -25 |    2 |
| insert...on duplicate key update 语句   |         1 |    3 |
| table2_order order模式                  |         2 |    2 |
| table2_order order模式                  |         3 |    2 |
| table2_order order模式                  |         4 |    2 |
| table2_order order模式                  |        10 |    2 |
| 最新自增值=>                            |        11 |    2 |
| table2_order order模式                  |        12 |    2 |
| table2_order order模式                  |        13 |    2 |
| table2_order order模式                  |        14 |    2 |
| table2_order order模式                  |        15 |    2 |
| table2_order order模式                  |        35 |    2 |
| table2_order order模式                  |        46 |    2 |
| 最新自增值=>                            |        47 |    2 |
| table0_date                             |       110 |    0 |
| table0_date                             |       111 |    0 |
| table0_date                             |       112 |    0 |
| 最新自增值=>                            |       113 |    2 |
| 最新自增值1=>                           |       114 |    2 |
+-----------------------------------------+-----------+------+
insert into  like_t2_order (a,b,txt) values (150,2,'不重复场合') on duplicate key update b=b+1,txt='insert...on duplicate key update 语句';
insert into  like_t2_order(a,txt) values(0,'最新自增值2=>');
select txt,a incre_col,b from like_t2_order order by a;
+-----------------------------------------+-----------+------+
| txt                                     | incre_col | b    |
+-----------------------------------------+-----------+------+
| table2_order order模式                  |       -25 |    2 |
| insert...on duplicate key update 语句   |         1 |    3 |
| table2_order order模式                  |         2 |    2 |
| table2_order order模式                  |         3 |    2 |
| table2_order order模式                  |         4 |    2 |
| table2_order order模式                  |        10 |    2 |
| 最新自增值=>                            |        11 |    2 |
| table2_order order模式                  |        12 |    2 |
| table2_order order模式                  |        13 |    2 |
| table2_order order模式                  |        14 |    2 |
| table2_order order模式                  |        15 |    2 |
| table2_order order模式                  |        35 |    2 |
| table2_order order模式                  |        46 |    2 |
| 最新自增值=>                            |        47 |    2 |
| table0_date                             |       110 |    0 |
| table0_date                             |       111 |    0 |
| table0_date                             |       112 |    0 |
| 最新自增值=>                            |       113 |    2 |
| 最新自增值1=>                           |       114 |    2 |
| 不重复场合                              |       150 |    2 |
| 最新自增值2=>                           |       151 |    2 |
+-----------------------------------------+-----------+------+
insert into like_t3_noorder (a,b,txt) values (1,3,'重复场合') on duplicate key update b=b+1,txt='insert...on duplicate key update 语句';
insert into like_t3_noorder(a,txt) values(0,'最新自增值1=>');
select txt,a incre_col,b from like_t3_noorder order by a;
+-----------------------------------------+-----------+------+
| txt                                     | incre_col | b    |
+-----------------------------------------+-----------+------+
| table3_noorder noorder模式              |       -25 |    3 |
| insert...on duplicate key update 语句   |         1 |    4 |
| table3_noorder noorder模式              |         2 |    3 |
| table3_noorder noorder模式              |         3 |    3 |
| table3_noorder noorder模式              |         4 |    3 |
| table3_noorder noorder模式              |        10 |    3 |
| table3_noorder noorder模式              |        15 |    3 |
| table3_noorder noorder模式              |        35 |    3 |
| table3_noorder noorder模式              |        46 |    3 |
| table0_date                             |       110 |    0 |
| table0_date                             |       111 |    0 |
| table0_date                             |       112 |    0 |
| 最新自增值=>                            |   1000001 |    3 |
| table3_noorder noorder模式              |   1000002 |    3 |
| table3_noorder noorder模式              |   1000003 |    3 |
| table3_noorder noorder模式              |   1000004 |    3 |
| 最新自增值=>                            |   1000005 |    3 |
| 最新自增值=>                            |   1000006 |    3 |
| 最新自增值1=>                           |   1000007 |    3 |
+-----------------------------------------+-----------+------+
insert into like_t3_noorder (a,b,txt) values (2000001,3,'不重复场合') on duplicate key update b=b+1,txt='insert...on duplicate key update 语句';
insert into like_t3_noorder(a,txt) values(0,'最新自增值2=>');
select txt,a incre_col,b from like_t3_noorder order by a;
+-----------------------------------------+-----------+------+
| txt                                     | incre_col | b    |
+-----------------------------------------+-----------+------+
| table3_noorder noorder模式              |       -25 |    3 |
| insert...on duplicate key update 语句   |         1 |    4 |
| table3_noorder noorder模式              |         2 |    3 |
| table3_noorder noorder模式              |         3 |    3 |
| table3_noorder noorder模式              |         4 |    3 |
| table3_noorder noorder模式              |        10 |    3 |
| table3_noorder noorder模式              |        15 |    3 |
| table3_noorder noorder模式              |        35 |    3 |
| table3_noorder noorder模式              |        46 |    3 |
| table0_date                             |       110 |    0 |
| table0_date                             |       111 |    0 |
| table0_date                             |       112 |    0 |
| 最新自增值=>                            |   1000001 |    3 |
| table3_noorder noorder模式              |   1000002 |    3 |
| table3_noorder noorder模式              |   1000003 |    3 |
| table3_noorder noorder模式              |   1000004 |    3 |
| 最新自增值=>                            |   1000005 |    3 |
| 最新自增值=>                            |   1000006 |    3 |
| 最新自增值1=>                           |   1000007 |    3 |
| 不重复场合                              |   2000001 |    3 |
| 最新自增值2=>                           |   3000001 |    3 |
+-----------------------------------------+-----------+------+
##将NULL和任何其他值混合插入 AUTO_INCREMENT列
##INSERT 语句
drop table like_t1_default;
create table like_t1_default like table1_default;
drop table like_t2_order;
create table like_t2_order like table2_order;
drop table like_t3_noorder;
create table like_t3_noorder like table3_noorder;
insert into like_t1_default(a) values(null),(15),(null),(null),(25);
insert into like_t1_default(a,txt) values(0,'最新自增值1=>');
select txt,a incre_col,b from like_t1_default order by a;
+----------------------------------+-----------+------+
| txt                              | incre_col | b    |
+----------------------------------+-----------+------+
| table1_default 默认order模式     |         1 |    1 |
| table1_default 默认order模式     |        15 |    1 |
| table1_default 默认order模式     |        16 |    1 |
| table1_default 默认order模式     |        17 |    1 |
| table1_default 默认order模式     |        25 |    1 |
| 最新自增值1=>                    |        26 |    1 |
+----------------------------------+-----------+------+
insert into like_t1_default(a) values(null),(null),(null),(35);
insert into like_t1_default(a,txt) values(0,'最新自增值2=>');
select txt,a incre_col,b from like_t1_default order by a;
+----------------------------------+-----------+------+
| txt                              | incre_col | b    |
+----------------------------------+-----------+------+
| table1_default 默认order模式     |         1 |    1 |
| table1_default 默认order模式     |        15 |    1 |
| table1_default 默认order模式     |        16 |    1 |
| table1_default 默认order模式     |        17 |    1 |
| table1_default 默认order模式     |        25 |    1 |
| 最新自增值1=>                    |        26 |    1 |
| table1_default 默认order模式     |        27 |    1 |
| table1_default 默认order模式     |        28 |    1 |
| table1_default 默认order模式     |        29 |    1 |
| table1_default 默认order模式     |        35 |    1 |
| 最新自增值2=>                    |        36 |    1 |
+----------------------------------+-----------+------+
insert into like_t2_order(a) values(null),(15),(null),(null),(25);
insert into  like_t2_order(a,txt) values(0,'最新自增值1=>');
select txt,a incre_col,b from like_t2_order order by a;
+--------------------------+-----------+------+
| txt                      | incre_col | b    |
+--------------------------+-----------+------+
| table2_order order模式   |         1 |    2 |
| table2_order order模式   |        15 |    2 |
| table2_order order模式   |        16 |    2 |
| table2_order order模式   |        17 |    2 |
| table2_order order模式   |        25 |    2 |
| 最新自增值1=>            |        26 |    2 |
+--------------------------+-----------+------+
insert into like_t2_order(a) values(null),(null),(null),(35);
insert into  like_t2_order(a,txt) values(0,'最新自增值2=>');
select txt,a incre_col,b from like_t2_order order by a;
+--------------------------+-----------+------+
| txt                      | incre_col | b    |
+--------------------------+-----------+------+
| table2_order order模式   |         1 |    2 |
| table2_order order模式   |        15 |    2 |
| table2_order order模式   |        16 |    2 |
| table2_order order模式   |        17 |    2 |
| table2_order order模式   |        25 |    2 |
| 最新自增值1=>            |        26 |    2 |
| table2_order order模式   |        27 |    2 |
| table2_order order模式   |        28 |    2 |
| table2_order order模式   |        29 |    2 |
| table2_order order模式   |        35 |    2 |
| 最新自增值2=>            |        36 |    2 |
+--------------------------+-----------+------+
insert into like_t3_noorder(a) values(null),(15),(null),(null),(25);
insert into like_t3_noorder(a,txt) values(0,'最新自增值1=>');
select txt,a incre_col,b from like_t3_noorder order by a;
+------------------------------+-----------+------+
| txt                          | incre_col | b    |
+------------------------------+-----------+------+
| table3_noorder noorder模式   |         1 |    3 |
| table3_noorder noorder模式   |        15 |    3 |
| table3_noorder noorder模式   |        25 |    3 |
| table3_noorder noorder模式   |   1000001 |    3 |
| table3_noorder noorder模式   |   1000002 |    3 |
| 最新自增值1=>                |   1000004 |    3 |
+------------------------------+-----------+------+
insert into like_t3_noorder(a) values(null),(null),(null),(35);
insert into like_t3_noorder(a,txt) values(0,'最新自增值2=>');
select txt,a incre_col,b from like_t3_noorder order by a;
+------------------------------+-----------+------+
| txt                          | incre_col | b    |
+------------------------------+-----------+------+
| table3_noorder noorder模式   |         1 |    3 |
| table3_noorder noorder模式   |        15 |    3 |
| table3_noorder noorder模式   |        25 |    3 |
| table3_noorder noorder模式   |        35 |    3 |
| table3_noorder noorder模式   |   1000001 |    3 |
| table3_noorder noorder模式   |   1000002 |    3 |
| 最新自增值1=>                |   1000004 |    3 |
| table3_noorder noorder模式   |   1000005 |    3 |
| table3_noorder noorder模式   |   1000006 |    3 |
| table3_noorder noorder模式   |   1000007 |    3 |
| 最新自增值2=>                |   1000009 |    3 |
+------------------------------+-----------+------+
###### auto_incre_3-1-2 ②DELETE操作
insert into like_t1_default(a,b) values(null,11);
insert into like_t1_default(a,b) values(null,11);
select txt,a incre_col,b from like_t1_default order by a;
+----------------------------------+-----------+------+
| txt                              | incre_col | b    |
+----------------------------------+-----------+------+
| table1_default 默认order模式     |         1 |    1 |
| table1_default 默认order模式     |        15 |    1 |
| table1_default 默认order模式     |        16 |    1 |
| table1_default 默认order模式     |        17 |    1 |
| table1_default 默认order模式     |        25 |    1 |
| 最新自增值1=>                    |        26 |    1 |
| table1_default 默认order模式     |        27 |    1 |
| table1_default 默认order模式     |        28 |    1 |
| table1_default 默认order模式     |        29 |    1 |
| table1_default 默认order模式     |        35 |    1 |
| 最新自增值2=>                    |        36 |    1 |
| table1_default 默认order模式     |        37 |   11 |
| table1_default 默认order模式     |        38 |   11 |
+----------------------------------+-----------+------+
delete from like_t1_default where b=11;
insert into like_t1_default(a,txt) values(0,'最新自增值=>');
select txt,a incre_col,b from like_t1_default order by a;
+----------------------------------+-----------+------+
| txt                              | incre_col | b    |
+----------------------------------+-----------+------+
| table1_default 默认order模式     |         1 |    1 |
| table1_default 默认order模式     |        15 |    1 |
| table1_default 默认order模式     |        16 |    1 |
| table1_default 默认order模式     |        17 |    1 |
| table1_default 默认order模式     |        25 |    1 |
| 最新自增值1=>                    |        26 |    1 |
| table1_default 默认order模式     |        27 |    1 |
| table1_default 默认order模式     |        28 |    1 |
| table1_default 默认order模式     |        29 |    1 |
| table1_default 默认order模式     |        35 |    1 |
| 最新自增值2=>                    |        36 |    1 |
| 最新自增值=>                     |        39 |    1 |
+----------------------------------+-----------+------+
insert into  like_t2_order(a,b) values(null,22);
insert into  like_t2_order(a,b) values(null,22);
select txt,a incre_col,b from like_t2_order order by a;
+--------------------------+-----------+------+
| txt                      | incre_col | b    |
+--------------------------+-----------+------+
| table2_order order模式   |         1 |    2 |
| table2_order order模式   |        15 |    2 |
| table2_order order模式   |        16 |    2 |
| table2_order order模式   |        17 |    2 |
| table2_order order模式   |        25 |    2 |
| 最新自增值1=>            |        26 |    2 |
| table2_order order模式   |        27 |    2 |
| table2_order order模式   |        28 |    2 |
| table2_order order模式   |        29 |    2 |
| table2_order order模式   |        35 |    2 |
| 最新自增值2=>            |        36 |    2 |
| table2_order order模式   |        37 |   22 |
| table2_order order模式   |        38 |   22 |
+--------------------------+-----------+------+
delete from  like_t2_order where b=22;
insert into  like_t2_order(a,txt) values(0,'最新自增值=>');
select txt,a incre_col,b from like_t2_order order by a;
+--------------------------+-----------+------+
| txt                      | incre_col | b    |
+--------------------------+-----------+------+
| table2_order order模式   |         1 |    2 |
| table2_order order模式   |        15 |    2 |
| table2_order order模式   |        16 |    2 |
| table2_order order模式   |        17 |    2 |
| table2_order order模式   |        25 |    2 |
| 最新自增值1=>            |        26 |    2 |
| table2_order order模式   |        27 |    2 |
| table2_order order模式   |        28 |    2 |
| table2_order order模式   |        29 |    2 |
| table2_order order模式   |        35 |    2 |
| 最新自增值2=>            |        36 |    2 |
| 最新自增值=>             |        39 |    2 |
+--------------------------+-----------+------+
insert into like_t3_noorder(a,b) values(null,33);
insert into like_t3_noorder(a,b) values(null,33);
select txt,a incre_col,b from like_t3_noorder order by a;
+------------------------------+-----------+------+
| txt                          | incre_col | b    |
+------------------------------+-----------+------+
| table3_noorder noorder模式   |         1 |    3 |
| table3_noorder noorder模式   |        15 |    3 |
| table3_noorder noorder模式   |        25 |    3 |
| table3_noorder noorder模式   |        35 |    3 |
| table3_noorder noorder模式   |   1000001 |    3 |
| table3_noorder noorder模式   |   1000002 |    3 |
| 最新自增值1=>                |   1000004 |    3 |
| table3_noorder noorder模式   |   1000005 |    3 |
| table3_noorder noorder模式   |   1000006 |    3 |
| table3_noorder noorder模式   |   1000007 |    3 |
| 最新自增值2=>                |   1000009 |    3 |
| table3_noorder noorder模式   |   1000010 |   33 |
| table3_noorder noorder模式   |   1000011 |   33 |
+------------------------------+-----------+------+
delete from like_t3_noorder where b=33;
insert into like_t3_noorder(a,txt) values(0,'最新自增值=>');
select txt,a incre_col,b from like_t3_noorder order by a;
+------------------------------+-----------+------+
| txt                          | incre_col | b    |
+------------------------------+-----------+------+
| table3_noorder noorder模式   |         1 |    3 |
| table3_noorder noorder模式   |        15 |    3 |
| table3_noorder noorder模式   |        25 |    3 |
| table3_noorder noorder模式   |        35 |    3 |
| table3_noorder noorder模式   |   1000001 |    3 |
| table3_noorder noorder模式   |   1000002 |    3 |
| 最新自增值1=>                |   1000004 |    3 |
| table3_noorder noorder模式   |   1000005 |    3 |
| table3_noorder noorder模式   |   1000006 |    3 |
| table3_noorder noorder模式   |   1000007 |    3 |
| 最新自增值2=>                |   1000009 |    3 |
| 最新自增值=>                 |   1000012 |    3 |
+------------------------------+-----------+------+
###### auto_incre_3-1-3 ③UPDATE操作
# mysql 5.x update没有推高这个自增值，和我们现在是兼容的；8.x update会推高
##更新现有AUTO_INCREMENT列值
insert into like_t1_default(a,b) values(null,111);
select txt,a incre_col,b from like_t1_default order by a;
+----------------------------------+-----------+------+
| txt                              | incre_col | b    |
+----------------------------------+-----------+------+
| table1_default 默认order模式     |         1 |    1 |
| table1_default 默认order模式     |        15 |    1 |
| table1_default 默认order模式     |        16 |    1 |
| table1_default 默认order模式     |        17 |    1 |
| table1_default 默认order模式     |        25 |    1 |
| 最新自增值1=>                    |        26 |    1 |
| table1_default 默认order模式     |        27 |    1 |
| table1_default 默认order模式     |        28 |    1 |
| table1_default 默认order模式     |        29 |    1 |
| table1_default 默认order模式     |        35 |    1 |
| 最新自增值2=>                    |        36 |    1 |
| 最新自增值=>                     |        39 |    1 |
| table1_default 默认order模式     |        40 |  111 |
+----------------------------------+-----------+------+
update like_t1_default set a = 0,txt = '将AUTO_INCREMENT列值设置为小于/等于当前最大自增值的值' where b = 111;
insert into like_t1_default values(null,11,'1当前自增值=>');
select txt,a incre_col,b from like_t1_default order by a;
+--------------------------------------------------------------------------+-----------+------+
| txt                                                                      | incre_col | b    |
+--------------------------------------------------------------------------+-----------+------+
| 将AUTO_INCREMENT列值设置为小于/等于当前最大自增值的值                    |         0 |  111 |
| table1_default 默认order模式                                             |         1 |    1 |
| table1_default 默认order模式                                             |        15 |    1 |
| table1_default 默认order模式                                             |        16 |    1 |
| table1_default 默认order模式                                             |        17 |    1 |
| table1_default 默认order模式                                             |        25 |    1 |
| 最新自增值1=>                                                            |        26 |    1 |
| table1_default 默认order模式                                             |        27 |    1 |
| table1_default 默认order模式                                             |        28 |    1 |
| table1_default 默认order模式                                             |        29 |    1 |
| table1_default 默认order模式                                             |        35 |    1 |
| 最新自增值2=>                                                            |        36 |    1 |
| 最新自增值=>                                                             |        39 |    1 |
| 1当前自增值=>                                                            |        41 |   11 |
+--------------------------------------------------------------------------+-----------+------+
update like_t1_default set a = 60 ,txt = '将AUTO_INCREMENT列值设置为大于当前最大自增值的值' where b = 111;
insert into like_t1_default values(null,11,'2当前自增值=>');
select txt,a incre_col,b from like_t1_default order by a;
+-------------------------------------------------------------------+-----------+------+
| txt                                                               | incre_col | b    |
+-------------------------------------------------------------------+-----------+------+
| table1_default 默认order模式                                      |         1 |    1 |
| table1_default 默认order模式                                      |        15 |    1 |
| table1_default 默认order模式                                      |        16 |    1 |
| table1_default 默认order模式                                      |        17 |    1 |
| table1_default 默认order模式                                      |        25 |    1 |
| 最新自增值1=>                                                     |        26 |    1 |
| table1_default 默认order模式                                      |        27 |    1 |
| table1_default 默认order模式                                      |        28 |    1 |
| table1_default 默认order模式                                      |        29 |    1 |
| table1_default 默认order模式                                      |        35 |    1 |
| 最新自增值2=>                                                     |        36 |    1 |
| 最新自增值=>                                                      |        39 |    1 |
| 1当前自增值=>                                                     |        41 |   11 |
| 2当前自增值=>                                                     |        42 |   11 |
| 将AUTO_INCREMENT列值设置为大于当前最大自增值的值                  |        60 |  111 |
+-------------------------------------------------------------------+-----------+------+
insert into  like_t2_order(a,b) values(null,222);
select txt,a incre_col,b from like_t2_order order by a;
+--------------------------+-----------+------+
| txt                      | incre_col | b    |
+--------------------------+-----------+------+
| table2_order order模式   |         1 |    2 |
| table2_order order模式   |        15 |    2 |
| table2_order order模式   |        16 |    2 |
| table2_order order模式   |        17 |    2 |
| table2_order order模式   |        25 |    2 |
| 最新自增值1=>            |        26 |    2 |
| table2_order order模式   |        27 |    2 |
| table2_order order模式   |        28 |    2 |
| table2_order order模式   |        29 |    2 |
| table2_order order模式   |        35 |    2 |
| 最新自增值2=>            |        36 |    2 |
| 最新自增值=>             |        39 |    2 |
| table2_order order模式   |        40 |  222 |
+--------------------------+-----------+------+
update  like_t2_order set a = 0,txt = '将AUTO_INCREMENT列值设置为小于/等于当前最大自增值的值' where b = 222;
insert into  like_t2_order values(null,22,'1当前自增值=>');
select txt,a incre_col,b from like_t2_order order by a;
+--------------------------------------------------------------------------+-----------+------+
| txt                                                                      | incre_col | b    |
+--------------------------------------------------------------------------+-----------+------+
| 将AUTO_INCREMENT列值设置为小于/等于当前最大自增值的值                    |         0 |  222 |
| table2_order order模式                                                   |         1 |    2 |
| table2_order order模式                                                   |        15 |    2 |
| table2_order order模式                                                   |        16 |    2 |
| table2_order order模式                                                   |        17 |    2 |
| table2_order order模式                                                   |        25 |    2 |
| 最新自增值1=>                                                            |        26 |    2 |
| table2_order order模式                                                   |        27 |    2 |
| table2_order order模式                                                   |        28 |    2 |
| table2_order order模式                                                   |        29 |    2 |
| table2_order order模式                                                   |        35 |    2 |
| 最新自增值2=>                                                            |        36 |    2 |
| 最新自增值=>                                                             |        39 |    2 |
| 1当前自增值=>                                                            |        41 |   22 |
+--------------------------------------------------------------------------+-----------+------+
update  like_t2_order set a = 60 ,txt = '将AUTO_INCREMENT列值设置为大于当前最大自增值的值' where b = 222;
insert into  like_t2_order values(null,22,'2当前自增值=>');
select txt,a incre_col,b from like_t2_order order by a;
+-------------------------------------------------------------------+-----------+------+
| txt                                                               | incre_col | b    |
+-------------------------------------------------------------------+-----------+------+
| table2_order order模式                                            |         1 |    2 |
| table2_order order模式                                            |        15 |    2 |
| table2_order order模式                                            |        16 |    2 |
| table2_order order模式                                            |        17 |    2 |
| table2_order order模式                                            |        25 |    2 |
| 最新自增值1=>                                                     |        26 |    2 |
| table2_order order模式                                            |        27 |    2 |
| table2_order order模式                                            |        28 |    2 |
| table2_order order模式                                            |        29 |    2 |
| table2_order order模式                                            |        35 |    2 |
| 最新自增值2=>                                                     |        36 |    2 |
| 最新自增值=>                                                      |        39 |    2 |
| 1当前自增值=>                                                     |        41 |   22 |
| 2当前自增值=>                                                     |        42 |   22 |
| 将AUTO_INCREMENT列值设置为大于当前最大自增值的值                  |        60 |  222 |
+-------------------------------------------------------------------+-----------+------+
insert into like_t3_noorder(a,b) values(null,333);
select txt,a incre_col,b from like_t3_noorder order by a;
+------------------------------+-----------+------+
| txt                          | incre_col | b    |
+------------------------------+-----------+------+
| table3_noorder noorder模式   |         1 |    3 |
| table3_noorder noorder模式   |        15 |    3 |
| table3_noorder noorder模式   |        25 |    3 |
| table3_noorder noorder模式   |        35 |    3 |
| table3_noorder noorder模式   |   1000001 |    3 |
| table3_noorder noorder模式   |   1000002 |    3 |
| 最新自增值1=>                |   1000004 |    3 |
| table3_noorder noorder模式   |   1000005 |    3 |
| table3_noorder noorder模式   |   1000006 |    3 |
| table3_noorder noorder模式   |   1000007 |    3 |
| 最新自增值2=>                |   1000009 |    3 |
| 最新自增值=>                 |   1000012 |    3 |
| table3_noorder noorder模式   |   1000013 |  333 |
+------------------------------+-----------+------+
update like_t3_noorder set a = 0,txt = '将AUTO_INCREMENT列值设置为小于/等于当前最大自增值的值' where b = 333;
insert into like_t3_noorder values(null,33,'1当前自增值=>');
select txt,a incre_col,b from like_t3_noorder order by a;
+--------------------------------------------------------------------------+-----------+------+
| txt                                                                      | incre_col | b    |
+--------------------------------------------------------------------------+-----------+------+
| 将AUTO_INCREMENT列值设置为小于/等于当前最大自增值的值                    |         0 |  333 |
| table3_noorder noorder模式                                               |         1 |    3 |
| table3_noorder noorder模式                                               |        15 |    3 |
| table3_noorder noorder模式                                               |        25 |    3 |
| table3_noorder noorder模式                                               |        35 |    3 |
| table3_noorder noorder模式                                               |   1000001 |    3 |
| table3_noorder noorder模式                                               |   1000002 |    3 |
| 最新自增值1=>                                                            |   1000004 |    3 |
| table3_noorder noorder模式                                               |   1000005 |    3 |
| table3_noorder noorder模式                                               |   1000006 |    3 |
| table3_noorder noorder模式                                               |   1000007 |    3 |
| 最新自增值2=>                                                            |   1000009 |    3 |
| 最新自增值=>                                                             |   1000012 |    3 |
| 1当前自增值=>                                                            |   1000014 |   33 |
+--------------------------------------------------------------------------+-----------+------+
update like_t3_noorder set a = 1000022 ,txt = '将AUTO_INCREMENT列值设置为大于当前最大自增值的值' where b = 333;
insert into like_t3_noorder values(null,33,'2当前自增值=>');
select txt,a incre_col,b from like_t3_noorder order by a;
+-------------------------------------------------------------------+-----------+------+
| txt                                                               | incre_col | b    |
+-------------------------------------------------------------------+-----------+------+
| table3_noorder noorder模式                                        |         1 |    3 |
| table3_noorder noorder模式                                        |        15 |    3 |
| table3_noorder noorder模式                                        |        25 |    3 |
| table3_noorder noorder模式                                        |        35 |    3 |
| table3_noorder noorder模式                                        |   1000001 |    3 |
| table3_noorder noorder模式                                        |   1000002 |    3 |
| 最新自增值1=>                                                     |   1000004 |    3 |
| table3_noorder noorder模式                                        |   1000005 |    3 |
| table3_noorder noorder模式                                        |   1000006 |    3 |
| table3_noorder noorder模式                                        |   1000007 |    3 |
| 最新自增值2=>                                                     |   1000009 |    3 |
| 最新自增值=>                                                      |   1000012 |    3 |
| 1当前自增值=>                                                     |   1000014 |   33 |
| 2当前自增值=>                                                     |   1000015 |   33 |
| 将AUTO_INCREMENT列值设置为大于当前最大自增值的值                  |   1000022 |  333 |
+-------------------------------------------------------------------+-----------+------+
##更新其他列值时引用AUTO_INCREMENT列
delete from like_t1_default;
insert into like_t1_default(a,b,txt) values(null,0,'update');
select txt,a incre_col,b from like_t1_default order by a;
+--------+-----------+------+
| txt    | incre_col | b    |
+--------+-----------+------+
| update |        43 |    0 |
+--------+-----------+------+
update like_t1_default set b = a+1 where txt = 'update';
insert into like_t1_default values(null,11,'当前自增值==>');
select txt,a incre_col,b from like_t1_default order by a;
+--------------------+-----------+------+
| txt                | incre_col | b    |
+--------------------+-----------+------+
| update             |        43 |   44 |
| 当前自增值==>      |        44 |   11 |
+--------------------+-----------+------+
delete from  like_t2_order;
insert into  like_t2_order(a,b,txt) values(null,0,'update');
select txt,a incre_col,b from like_t2_order order by a;
+--------+-----------+------+
| txt    | incre_col | b    |
+--------+-----------+------+
| update |        43 |    0 |
+--------+-----------+------+
update  like_t2_order set b = a+2 where txt = 'update';
insert into  like_t2_order values(null,22,'当前自增值==>');
select txt,a incre_col,b from like_t2_order order by a;
+--------------------+-----------+------+
| txt                | incre_col | b    |
+--------------------+-----------+------+
| update             |        43 |   45 |
| 当前自增值==>      |        44 |   22 |
+--------------------+-----------+------+
delete from like_t3_noorder;
insert into like_t3_noorder(a,b,txt) values(null,0,'update');
select txt,a incre_col,b from like_t3_noorder order by a;
+--------+-----------+------+
| txt    | incre_col | b    |
+--------+-----------+------+
| update |   1000016 |    0 |
+--------+-----------+------+
update like_t3_noorder set b = a+3 where txt = 'update';
insert into like_t3_noorder values(null,33,'当前自增值==>');
select txt,a incre_col,b from like_t3_noorder order by a;
+--------------------+-----------+---------+
| txt                | incre_col | b       |
+--------------------+-----------+---------+
| update             |   1000016 | 1000019 |
| 当前自增值==>      |   1000017 |      33 |
+--------------------+-----------+---------+
###### auto_incre_3-1-4 ④SELECT操作
select a incre_col from like_t1_default order by a;
+-----------+
| incre_col |
+-----------+
|        43 |
|        44 |
+-----------+
select abs(a) from like_t1_default order by a;
+--------+
| abs(a) |
+--------+
|     43 |
|     44 |
+--------+
select a+b from like_t1_default order by a;
+------+
| a+b  |
+------+
|   87 |
|   55 |
+------+
select a incre_col from like_t2_order order by a;
+-----------+
| incre_col |
+-----------+
|        43 |
|        44 |
+-----------+
select abs(a) from like_t2_order order by a;
+--------+
| abs(a) |
+--------+
|     43 |
|     44 |
+--------+
select a+b from like_t2_order order by a;
+------+
| a+b  |
+------+
|   88 |
|   66 |
+------+
select a incre_col from like_t3_noorder order by a;
+-----------+
| incre_col |
+-----------+
|   1000016 |
|   1000017 |
+-----------+
select abs(a) from like_t3_noorder order by a;
+---------+
| abs(a)  |
+---------+
| 1000016 |
| 1000017 |
+---------+
select a+b from like_t3_noorder order by a;
+---------+
| a+b     |
+---------+
| 2000035 |
| 1000050 |
+---------+
############ auto_incre_2-4 ④模式切换 ############
##建表
###### INT 类型，索引 - 唯一索引
set auto_increment_increment=1;
alter system set default_auto_increment_mode = 'order';
drop table like_t1_default;
create table like_t1_default like table1_default;
## ORDER==>ORDER
insert into like_t1_default(a) values(0),(0),(0),(0),(0);
select txt,a incre_col, b from like_t1_default order by a;
+----------------------------------+-----------+------+
| txt                              | incre_col | b    |
+----------------------------------+-----------+------+
| table1_default 默认order模式     |         1 |    1 |
| table1_default 默认order模式     |         2 |    1 |
| table1_default 默认order模式     |         3 |    1 |
| table1_default 默认order模式     |         4 |    1 |
| table1_default 默认order模式     |         5 |    1 |
+----------------------------------+-----------+------+
alter table like_t1_default auto_increment_mode = 'ORDER';
insert into like_t1_default values(0,2,'ORDER==>ORDER'),(0,2,'ORDER==>ORDER'),(0,2,'ORDER==>ORDER'),(0,2,'ORDER==>ORDER');
select txt,a incre_col, b from like_t1_default order by a;
+----------------------------------+-----------+------+
| txt                              | incre_col | b    |
+----------------------------------+-----------+------+
| table1_default 默认order模式     |         1 |    1 |
| table1_default 默认order模式     |         2 |    1 |
| table1_default 默认order模式     |         3 |    1 |
| table1_default 默认order模式     |         4 |    1 |
| table1_default 默认order模式     |         5 |    1 |
| ORDER==>ORDER                    |         6 |    2 |
| ORDER==>ORDER                    |         7 |    2 |
| ORDER==>ORDER                    |         8 |    2 |
| ORDER==>ORDER                    |         9 |    2 |
+----------------------------------+-----------+------+
## ORDER==>NOORDER
alter table like_t1_default auto_increment_mode = 'NOORDER';
insert into like_t1_default values(0,3,'ORDER==>NOORDER'),(0,3,'ORDER==>NOORDER'),(0,3,'ORDER==>NOORDER'),(0,3,'ORDER==>NOORDER');
select txt,a incre_col, b from like_t1_default order by a;
+----------------------------------+-----------+------+
| txt                              | incre_col | b    |
+----------------------------------+-----------+------+
| table1_default 默认order模式     |         1 |    1 |
| table1_default 默认order模式     |         2 |    1 |
| table1_default 默认order模式     |         3 |    1 |
| table1_default 默认order模式     |         4 |    1 |
| table1_default 默认order模式     |         5 |    1 |
| ORDER==>ORDER                    |         6 |    2 |
| ORDER==>ORDER                    |         7 |    2 |
| ORDER==>ORDER                    |         8 |    2 |
| ORDER==>ORDER                    |         9 |    2 |
| ORDER==>NOORDER                  |   1000001 |    3 |
| ORDER==>NOORDER                  |   1000002 |    3 |
| ORDER==>NOORDER                  |   1000003 |    3 |
| ORDER==>NOORDER                  |   1000004 |    3 |
+----------------------------------+-----------+------+
## NOORDER==>NOORDER
alter table like_t1_default auto_increment_mode = 'NOORDER';
insert into like_t1_default values(0,4,'NOORDER==>NOORDER'),(0,4,'NOORDER==>NOORDER'),(0,4,'NOORDER==>NOORDER'),(0,4,'NOORDER==>NOORDER');
select txt,a incre_col, b from like_t1_default order by a;
+----------------------------------+-----------+------+
| txt                              | incre_col | b    |
+----------------------------------+-----------+------+
| table1_default 默认order模式     |         1 |    1 |
| table1_default 默认order模式     |         2 |    1 |
| table1_default 默认order模式     |         3 |    1 |
| table1_default 默认order模式     |         4 |    1 |
| table1_default 默认order模式     |         5 |    1 |
| ORDER==>ORDER                    |         6 |    2 |
| ORDER==>ORDER                    |         7 |    2 |
| ORDER==>ORDER                    |         8 |    2 |
| ORDER==>ORDER                    |         9 |    2 |
| ORDER==>NOORDER                  |   1000001 |    3 |
| ORDER==>NOORDER                  |   1000002 |    3 |
| ORDER==>NOORDER                  |   1000003 |    3 |
| ORDER==>NOORDER                  |   1000004 |    3 |
| NOORDER==>NOORDER                |   1000005 |    4 |
| NOORDER==>NOORDER                |   1000006 |    4 |
| NOORDER==>NOORDER                |   1000007 |    4 |
| NOORDER==>NOORDER                |   1000008 |    4 |
+----------------------------------+-----------+------+
## NOORDER==>ORDER
alter table like_t1_default auto_increment_mode = 'ORDER';
insert into like_t1_default values(0,5,'NOORDER==>ORDER'),(0,5,'NOORDER==>ORDER'),(0,5,'NOORDER==>ORDER'),(0,5,'NOORDER==>ORDER');
select txt,a incre_col, b from like_t1_default order by a;
+----------------------------------+-----------+------+
| txt                              | incre_col | b    |
+----------------------------------+-----------+------+
| table1_default 默认order模式     |         1 |    1 |
| table1_default 默认order模式     |         2 |    1 |
| table1_default 默认order模式     |         3 |    1 |
| table1_default 默认order模式     |         4 |    1 |
| table1_default 默认order模式     |         5 |    1 |
| ORDER==>ORDER                    |         6 |    2 |
| ORDER==>ORDER                    |         7 |    2 |
| ORDER==>ORDER                    |         8 |    2 |
| ORDER==>ORDER                    |         9 |    2 |
| ORDER==>NOORDER                  |   1000001 |    3 |
| ORDER==>NOORDER                  |   1000002 |    3 |
| ORDER==>NOORDER                  |   1000003 |    3 |
| ORDER==>NOORDER                  |   1000004 |    3 |
| NOORDER==>NOORDER                |   1000005 |    4 |
| NOORDER==>NOORDER                |   1000006 |    4 |
| NOORDER==>NOORDER                |   1000007 |    4 |
| NOORDER==>NOORDER                |   1000008 |    4 |
| NOORDER==>ORDER                  |   2000001 |    5 |
| NOORDER==>ORDER                  |   2000002 |    5 |
| NOORDER==>ORDER                  |   2000003 |    5 |
| NOORDER==>ORDER                  |   2000004 |    5 |
+----------------------------------+-----------+------+
insert into like_t1_default values(0,6,'NOORDER==>ORDER test');
select txt,a incre_col, b from like_t1_default order by a;
+----------------------------------+-----------+------+
| txt                              | incre_col | b    |
+----------------------------------+-----------+------+
| table1_default 默认order模式     |         1 |    1 |
| table1_default 默认order模式     |         2 |    1 |
| table1_default 默认order模式     |         3 |    1 |
| table1_default 默认order模式     |         4 |    1 |
| table1_default 默认order模式     |         5 |    1 |
| ORDER==>ORDER                    |         6 |    2 |
| ORDER==>ORDER                    |         7 |    2 |
| ORDER==>ORDER                    |         8 |    2 |
| ORDER==>ORDER                    |         9 |    2 |
| ORDER==>NOORDER                  |   1000001 |    3 |
| ORDER==>NOORDER                  |   1000002 |    3 |
| ORDER==>NOORDER                  |   1000003 |    3 |
| ORDER==>NOORDER                  |   1000004 |    3 |
| NOORDER==>NOORDER                |   1000005 |    4 |
| NOORDER==>NOORDER                |   1000006 |    4 |
| NOORDER==>NOORDER                |   1000007 |    4 |
| NOORDER==>NOORDER                |   1000008 |    4 |
| NOORDER==>ORDER                  |   2000001 |    5 |
| NOORDER==>ORDER                  |   2000002 |    5 |
| NOORDER==>ORDER                  |   2000003 |    5 |
| NOORDER==>ORDER                  |   2000004 |    5 |
| NOORDER==>ORDER test             |   2000005 |    6 |
+----------------------------------+-----------+------+
update like_t1_default set a = 10 where b = 6;
insert into like_t1_default(a,txt) values(0,'最新自增值=>');
select txt,a incre_col, b from like_t1_default order by a;
+----------------------------------+-----------+------+
| txt                              | incre_col | b    |
+----------------------------------+-----------+------+
| table1_default 默认order模式     |         1 |    1 |
| table1_default 默认order模式     |         2 |    1 |
| table1_default 默认order模式     |         3 |    1 |
| table1_default 默认order模式     |         4 |    1 |
| table1_default 默认order模式     |         5 |    1 |
| ORDER==>ORDER                    |         6 |    2 |
| ORDER==>ORDER                    |         7 |    2 |
| ORDER==>ORDER                    |         8 |    2 |
| ORDER==>ORDER                    |         9 |    2 |
| NOORDER==>ORDER test             |        10 |    6 |
| ORDER==>NOORDER                  |   1000001 |    3 |
| ORDER==>NOORDER                  |   1000002 |    3 |
| ORDER==>NOORDER                  |   1000003 |    3 |
| ORDER==>NOORDER                  |   1000004 |    3 |
| NOORDER==>NOORDER                |   1000005 |    4 |
| NOORDER==>NOORDER                |   1000006 |    4 |
| NOORDER==>NOORDER                |   1000007 |    4 |
| NOORDER==>NOORDER                |   1000008 |    4 |
| NOORDER==>ORDER                  |   2000001 |    5 |
| NOORDER==>ORDER                  |   2000002 |    5 |
| NOORDER==>ORDER                  |   2000003 |    5 |
| NOORDER==>ORDER                  |   2000004 |    5 |
| 最新自增值=>                     |   2000006 |    1 |
+----------------------------------+-----------+------+
############ 复制表 CREATE TABLE ... AS 语句
drop table as_t1_default;
create table as_t1_default as select * from table1_default;
insert into as_t1_default(a) values(0),(0),(0);
select txt,a incre_col,b from as_t1_default order by a;
+----------------------------------+-----------+------+
| txt                              | incre_col | b    |
+----------------------------------+-----------+------+
| table1_default 默认order模式     |         0 |    1 |
| table1_default 默认order模式     |         0 |    1 |
| table1_default 默认order模式     |         0 |    1 |
+----------------------------------+-----------+------+
drop table as_t2_order;
create table as_t2_order as select * from table2_order;
insert into as_t2_order(a) values(0),(0),(0);
select txt,a incre_col,b from as_t2_order order by a;
+--------------------------+-----------+------+
| txt                      | incre_col | b    |
+--------------------------+-----------+------+
| table2_order order模式   |         0 |    2 |
| table2_order order模式   |         0 |    2 |
| table2_order order模式   |         0 |    2 |
+--------------------------+-----------+------+
drop table as_t3_noorder;
create table as_t3_noorder as select * from table3_noorder;
insert into as_t3_noorder(a) values(0),(0),(0);
select txt,a incre_col,b from as_t3_noorder order by a;
+------------------------------+-----------+------+
| txt                          | incre_col | b    |
+------------------------------+-----------+------+
| table3_noorder noorder模式   |         0 |    3 |
| table3_noorder noorder模式   |         0 |    3 |
| table3_noorder noorder模式   |         0 |    3 |
+------------------------------+-----------+------+
##########################################################################################################################
###### 标签：auto_incre_1-1，auto_incre_1-6，auto_incre_2，auto_incre_3-1
###### 功能：数据类型（INT），视图，自增模式，DML操作 
########################################################################################################################## 
##建表
drop table table0_date;
create table table0_date (
  a int,
  b int default 0,
  txt varchar(64) default 'table0_date'
);
insert into table0_date(a) values(110),(111),(112),(210),(211),(212);
drop table table1_default;
create table table1_default (
  a int not null auto_increment primary key,
  b int default 1,
  txt varchar(64) default 'table1_default 默认order模式',
  unique index(a)
);
drop table table2_order;
create table table2_order (
  a int not null auto_increment primary key,
  b int default 2,
  txt varchar(64) default 'table2_order order模式',
  unique index(a)
) auto_increment_mode = 'order';
drop table table3_noorder;
create table table3_noorder (
  a int not null auto_increment primary key,
  b int default 3,
  txt varchar(64) default 'table3_noorder noorder模式',
  unique index(a)
) auto_increment_mode = 'noorder';
#单基表视图
drop view v1_default;
create view v1_default as select * from table1_default;
drop view v2_order;
create view v2_order as select * from table2_order;
drop view v3_noorder;
create view v3_noorder as select * from table3_noorder;
##简单插入
##INSERT 语句
insert into v1_default(a) values(0),(0),(0);
select txt,a incre_col,b from v1_default order by a;
+----------------------------------+-----------+------+
| txt                              | incre_col | b    |
+----------------------------------+-----------+------+
| table1_default 默认order模式     |         1 |    1 |
| table1_default 默认order模式     |         2 |    1 |
| table1_default 默认order模式     |         3 |    1 |
+----------------------------------+-----------+------+
insert into v1_default(a) values(10);
insert into v1_default(a,txt) values(0,'最新自增值=>');
select txt,a incre_col,b from v1_default order by a;
+----------------------------------+-----------+------+
| txt                              | incre_col | b    |
+----------------------------------+-----------+------+
| table1_default 默认order模式     |         1 |    1 |
| table1_default 默认order模式     |         2 |    1 |
| table1_default 默认order模式     |         3 |    1 |
| table1_default 默认order模式     |        10 |    1 |
| 最新自增值=>                     |        11 |    1 |
+----------------------------------+-----------+------+
insert into v2_order(a) values(0),(0),(0);
select txt,a incre_col,b from v2_order order by a;
+--------------------------+-----------+------+
| txt                      | incre_col | b    |
+--------------------------+-----------+------+
| table2_order order模式   |         1 |    2 |
| table2_order order模式   |         2 |    2 |
| table2_order order模式   |         3 |    2 |
+--------------------------+-----------+------+
insert into v2_order(a) values(10);
insert into v2_order(a,txt) values(0,'最新自增值=>');
select txt,a incre_col,b from v2_order order by a;
+--------------------------+-----------+------+
| txt                      | incre_col | b    |
+--------------------------+-----------+------+
| table2_order order模式   |         1 |    2 |
| table2_order order模式   |         2 |    2 |
| table2_order order模式   |         3 |    2 |
| table2_order order模式   |        10 |    2 |
| 最新自增值=>             |        11 |    2 |
+--------------------------+-----------+------+
insert into v3_noorder(a) values(0),(0),(0);
select txt,a incre_col,b from v3_noorder order by a;
+------------------------------+-----------+------+
| txt                          | incre_col | b    |
+------------------------------+-----------+------+
| table3_noorder noorder模式   |         1 |    3 |
| table3_noorder noorder模式   |         2 |    3 |
| table3_noorder noorder模式   |         3 |    3 |
+------------------------------+-----------+------+
insert into v3_noorder(a) values(10);
insert into v3_noorder(a,txt) values(0,'最新自增值=>');
select txt,a incre_col,b from v3_noorder order by a;
+------------------------------+-----------+------+
| txt                          | incre_col | b    |
+------------------------------+-----------+------+
| table3_noorder noorder模式   |         1 |    3 |
| table3_noorder noorder模式   |         2 |    3 |
| table3_noorder noorder模式   |         3 |    3 |
| table3_noorder noorder模式   |        10 |    3 |
| 最新自增值=>                 |   1000001 |    3 |
+------------------------------+-----------+------+
##REPLACE 语句
replace into v1_default(a) values(0),(0),(0);
select txt,a incre_col,b from v1_default order by a;
+----------------------------------+-----------+------+
| txt                              | incre_col | b    |
+----------------------------------+-----------+------+
| table1_default 默认order模式     |         1 |    1 |
| table1_default 默认order模式     |         2 |    1 |
| table1_default 默认order模式     |         3 |    1 |
| table1_default 默认order模式     |        10 |    1 |
| 最新自增值=>                     |        11 |    1 |
| table1_default 默认order模式     |        12 |    1 |
| table1_default 默认order模式     |        13 |    1 |
| table1_default 默认order模式     |        14 |    1 |
+----------------------------------+-----------+------+
replace into  v2_order(a) values(0),(0),(0);
select txt,a incre_col,b from v2_order order by a;
+--------------------------+-----------+------+
| txt                      | incre_col | b    |
+--------------------------+-----------+------+
| table2_order order模式   |         1 |    2 |
| table2_order order模式   |         2 |    2 |
| table2_order order模式   |         3 |    2 |
| table2_order order模式   |        10 |    2 |
| 最新自增值=>             |        11 |    2 |
| table2_order order模式   |        12 |    2 |
| table2_order order模式   |        13 |    2 |
| table2_order order模式   |        14 |    2 |
+--------------------------+-----------+------+
replace into v3_noorder(a) values(null),(null),(null);
select txt,a incre_col,b from v3_noorder order by a;
+------------------------------+-----------+------+
| txt                          | incre_col | b    |
+------------------------------+-----------+------+
| table3_noorder noorder模式   |         1 |    3 |
| table3_noorder noorder模式   |         2 |    3 |
| table3_noorder noorder模式   |         3 |    3 |
| table3_noorder noorder模式   |        10 |    3 |
| 最新自增值=>                 |   1000001 |    3 |
| table3_noorder noorder模式   |   1000002 |    3 |
| table3_noorder noorder模式   |   1000003 |    3 |
| table3_noorder noorder模式   |   1000004 |    3 |
+------------------------------+-----------+------+
##测试点 - 将任何其他值插入 AUTO_INCREMENT列
##INSERT 语句
insert into v1_default(a) values(15),(-25),(35),(45.5);
insert into v1_default(a,txt) values(0,'最新自增值=>');
select txt,a incre_col,b from v1_default order by a;
+----------------------------------+-----------+------+
| txt                              | incre_col | b    |
+----------------------------------+-----------+------+
| table1_default 默认order模式     |       -25 |    1 |
| table1_default 默认order模式     |         1 |    1 |
| table1_default 默认order模式     |         2 |    1 |
| table1_default 默认order模式     |         3 |    1 |
| table1_default 默认order模式     |        10 |    1 |
| 最新自增值=>                     |        11 |    1 |
| table1_default 默认order模式     |        12 |    1 |
| table1_default 默认order模式     |        13 |    1 |
| table1_default 默认order模式     |        14 |    1 |
| table1_default 默认order模式     |        15 |    1 |
| table1_default 默认order模式     |        35 |    1 |
| table1_default 默认order模式     |        46 |    1 |
| 最新自增值=>                     |        47 |    1 |
+----------------------------------+-----------+------+
insert into v2_order(a) values(15),(-25),(35),(45.5);
insert into  v2_order(a,txt) values(0,'最新自增值=>');
select txt,a incre_col,b from v2_order order by a;
+--------------------------+-----------+------+
| txt                      | incre_col | b    |
+--------------------------+-----------+------+
| table2_order order模式   |       -25 |    2 |
| table2_order order模式   |         1 |    2 |
| table2_order order模式   |         2 |    2 |
| table2_order order模式   |         3 |    2 |
| table2_order order模式   |        10 |    2 |
| 最新自增值=>             |        11 |    2 |
| table2_order order模式   |        12 |    2 |
| table2_order order模式   |        13 |    2 |
| table2_order order模式   |        14 |    2 |
| table2_order order模式   |        15 |    2 |
| table2_order order模式   |        35 |    2 |
| table2_order order模式   |        46 |    2 |
| 最新自增值=>             |        47 |    2 |
+--------------------------+-----------+------+
insert into v3_noorder(a) values(15),(-25),(35),(45.5);
insert into v3_noorder(a,txt) values(0,'最新自增值=>');
select txt,a incre_col,b from v3_noorder order by a;
+------------------------------+-----------+------+
| txt                          | incre_col | b    |
+------------------------------+-----------+------+
| table3_noorder noorder模式   |       -25 |    3 |
| table3_noorder noorder模式   |         1 |    3 |
| table3_noorder noorder模式   |         2 |    3 |
| table3_noorder noorder模式   |         3 |    3 |
| table3_noorder noorder模式   |        10 |    3 |
| table3_noorder noorder模式   |        15 |    3 |
| table3_noorder noorder模式   |        35 |    3 |
| table3_noorder noorder模式   |        46 |    3 |
| 最新自增值=>                 |   1000001 |    3 |
| table3_noorder noorder模式   |   1000002 |    3 |
| table3_noorder noorder模式   |   1000003 |    3 |
| table3_noorder noorder模式   |   1000004 |    3 |
| 最新自增值=>                 |   1000005 |    3 |
+------------------------------+-----------+------+
##批量插入
##INSERT ... SELECT语句
insert into v1_default select a,b,txt from table0_date where a <= 200;
select txt,a incre_col,b from v1_default order by a;
+----------------------------------+-----------+------+
| txt                              | incre_col | b    |
+----------------------------------+-----------+------+
| table1_default 默认order模式     |       -25 |    1 |
| table1_default 默认order模式     |         1 |    1 |
| table1_default 默认order模式     |         2 |    1 |
| table1_default 默认order模式     |         3 |    1 |
| table1_default 默认order模式     |        10 |    1 |
| 最新自增值=>                     |        11 |    1 |
| table1_default 默认order模式     |        12 |    1 |
| table1_default 默认order模式     |        13 |    1 |
| table1_default 默认order模式     |        14 |    1 |
| table1_default 默认order模式     |        15 |    1 |
| table1_default 默认order模式     |        35 |    1 |
| table1_default 默认order模式     |        46 |    1 |
| 最新自增值=>                     |        47 |    1 |
| table0_date                      |       110 |    0 |
| table0_date                      |       111 |    0 |
| table0_date                      |       112 |    0 |
+----------------------------------+-----------+------+
insert into v1_default(a,txt) values(0,'最新自增值=>');
select txt,a incre_col,b from v1_default order by a;
+----------------------------------+-----------+------+
| txt                              | incre_col | b    |
+----------------------------------+-----------+------+
| table1_default 默认order模式     |       -25 |    1 |
| table1_default 默认order模式     |         1 |    1 |
| table1_default 默认order模式     |         2 |    1 |
| table1_default 默认order模式     |         3 |    1 |
| table1_default 默认order模式     |        10 |    1 |
| 最新自增值=>                     |        11 |    1 |
| table1_default 默认order模式     |        12 |    1 |
| table1_default 默认order模式     |        13 |    1 |
| table1_default 默认order模式     |        14 |    1 |
| table1_default 默认order模式     |        15 |    1 |
| table1_default 默认order模式     |        35 |    1 |
| table1_default 默认order模式     |        46 |    1 |
| 最新自增值=>                     |        47 |    1 |
| table0_date                      |       110 |    0 |
| table0_date                      |       111 |    0 |
| table0_date                      |       112 |    0 |
| 最新自增值=>                     |       113 |    1 |
+----------------------------------+-----------+------+
insert into  v2_order select a,b,txt from table0_date where a <= 200;
select txt,a incre_col,b from v2_order order by a;
+--------------------------+-----------+------+
| txt                      | incre_col | b    |
+--------------------------+-----------+------+
| table2_order order模式   |       -25 |    2 |
| table2_order order模式   |         1 |    2 |
| table2_order order模式   |         2 |    2 |
| table2_order order模式   |         3 |    2 |
| table2_order order模式   |        10 |    2 |
| 最新自增值=>             |        11 |    2 |
| table2_order order模式   |        12 |    2 |
| table2_order order模式   |        13 |    2 |
| table2_order order模式   |        14 |    2 |
| table2_order order模式   |        15 |    2 |
| table2_order order模式   |        35 |    2 |
| table2_order order模式   |        46 |    2 |
| 最新自增值=>             |        47 |    2 |
| table0_date              |       110 |    0 |
| table0_date              |       111 |    0 |
| table0_date              |       112 |    0 |
+--------------------------+-----------+------+
insert into  v2_order(a,txt) values(0,'最新自增值=>');
select txt,a incre_col,b from v2_order order by a;
+--------------------------+-----------+------+
| txt                      | incre_col | b    |
+--------------------------+-----------+------+
| table2_order order模式   |       -25 |    2 |
| table2_order order模式   |         1 |    2 |
| table2_order order模式   |         2 |    2 |
| table2_order order模式   |         3 |    2 |
| table2_order order模式   |        10 |    2 |
| 最新自增值=>             |        11 |    2 |
| table2_order order模式   |        12 |    2 |
| table2_order order模式   |        13 |    2 |
| table2_order order模式   |        14 |    2 |
| table2_order order模式   |        15 |    2 |
| table2_order order模式   |        35 |    2 |
| table2_order order模式   |        46 |    2 |
| 最新自增值=>             |        47 |    2 |
| table0_date              |       110 |    0 |
| table0_date              |       111 |    0 |
| table0_date              |       112 |    0 |
| 最新自增值=>             |       113 |    2 |
+--------------------------+-----------+------+
insert into v3_noorder select a,b,txt from table0_date where a <= 200;
select txt,a incre_col,b from v3_noorder order by a;
+------------------------------+-----------+------+
| txt                          | incre_col | b    |
+------------------------------+-----------+------+
| table3_noorder noorder模式   |       -25 |    3 |
| table3_noorder noorder模式   |         1 |    3 |
| table3_noorder noorder模式   |         2 |    3 |
| table3_noorder noorder模式   |         3 |    3 |
| table3_noorder noorder模式   |        10 |    3 |
| table3_noorder noorder模式   |        15 |    3 |
| table3_noorder noorder模式   |        35 |    3 |
| table3_noorder noorder模式   |        46 |    3 |
| table0_date                  |       110 |    0 |
| table0_date                  |       111 |    0 |
| table0_date                  |       112 |    0 |
| 最新自增值=>                 |   1000001 |    3 |
| table3_noorder noorder模式   |   1000002 |    3 |
| table3_noorder noorder模式   |   1000003 |    3 |
| table3_noorder noorder模式   |   1000004 |    3 |
| 最新自增值=>                 |   1000005 |    3 |
+------------------------------+-----------+------+
insert into v3_noorder(a,txt) values(0,'最新自增值=>');
select txt,a incre_col,b from v3_noorder order by a;
+------------------------------+-----------+------+
| txt                          | incre_col | b    |
+------------------------------+-----------+------+
| table3_noorder noorder模式   |       -25 |    3 |
| table3_noorder noorder模式   |         1 |    3 |
| table3_noorder noorder模式   |         2 |    3 |
| table3_noorder noorder模式   |         3 |    3 |
| table3_noorder noorder模式   |        10 |    3 |
| table3_noorder noorder模式   |        15 |    3 |
| table3_noorder noorder模式   |        35 |    3 |
| table3_noorder noorder模式   |        46 |    3 |
| table0_date                  |       110 |    0 |
| table0_date                  |       111 |    0 |
| table0_date                  |       112 |    0 |
| 最新自增值=>                 |   1000001 |    3 |
| table3_noorder noorder模式   |   1000002 |    3 |
| table3_noorder noorder模式   |   1000003 |    3 |
| table3_noorder noorder模式   |   1000004 |    3 |
| 最新自增值=>                 |   1000005 |    3 |
| 最新自增值=>                 |   1000006 |    3 |
+------------------------------+-----------+------+
##混合插入
##INSERT ... ON DUPLICATE KEY UPDATE 语句
insert into v1_default (a,b,txt) values (1,1,'重复场合') on duplicate key update b=b+1,txt='insert...on duplicate key update 语句';
insert into v1_default(a,txt) values(0,'最新自增值1=>');
select txt,a incre_col,b from v1_default order by a;
+-----------------------------------------+-----------+------+
| txt                                     | incre_col | b    |
+-----------------------------------------+-----------+------+
| table1_default 默认order模式            |       -25 |    1 |
| insert...on duplicate key update 语句   |         1 |    2 |
| table1_default 默认order模式            |         2 |    1 |
| table1_default 默认order模式            |         3 |    1 |
| table1_default 默认order模式            |        10 |    1 |
| 最新自增值=>                            |        11 |    1 |
| table1_default 默认order模式            |        12 |    1 |
| table1_default 默认order模式            |        13 |    1 |
| table1_default 默认order模式            |        14 |    1 |
| table1_default 默认order模式            |        15 |    1 |
| table1_default 默认order模式            |        35 |    1 |
| table1_default 默认order模式            |        46 |    1 |
| 最新自增值=>                            |        47 |    1 |
| table0_date                             |       110 |    0 |
| table0_date                             |       111 |    0 |
| table0_date                             |       112 |    0 |
| 最新自增值=>                            |       113 |    1 |
| 最新自增值1=>                           |       114 |    1 |
+-----------------------------------------+-----------+------+
insert into v1_default (a,b,txt) values (150,1,'不重复场合') on duplicate key update b=b+1,txt='insert...on duplicate key update 语句';
insert into v1_default(a,txt) values(0,'最新自增值2=>');
select txt,a incre_col,b from v1_default order by a;
+-----------------------------------------+-----------+------+
| txt                                     | incre_col | b    |
+-----------------------------------------+-----------+------+
| table1_default 默认order模式            |       -25 |    1 |
| insert...on duplicate key update 语句   |         1 |    2 |
| table1_default 默认order模式            |         2 |    1 |
| table1_default 默认order模式            |         3 |    1 |
| table1_default 默认order模式            |        10 |    1 |
| 最新自增值=>                            |        11 |    1 |
| table1_default 默认order模式            |        12 |    1 |
| table1_default 默认order模式            |        13 |    1 |
| table1_default 默认order模式            |        14 |    1 |
| table1_default 默认order模式            |        15 |    1 |
| table1_default 默认order模式            |        35 |    1 |
| table1_default 默认order模式            |        46 |    1 |
| 最新自增值=>                            |        47 |    1 |
| table0_date                             |       110 |    0 |
| table0_date                             |       111 |    0 |
| table0_date                             |       112 |    0 |
| 最新自增值=>                            |       113 |    1 |
| 最新自增值1=>                           |       114 |    1 |
| 不重复场合                              |       150 |    1 |
| 最新自增值2=>                           |       151 |    1 |
+-----------------------------------------+-----------+------+
insert into  v2_order (a,b,txt) values (1,2,'重复场合') on duplicate key update b=b+1,txt='insert...on duplicate key update 语句';
insert into  v2_order(a,txt) values(0,'最新自增值1=>');
select txt,a incre_col,b from v2_order order by a;
+-----------------------------------------+-----------+------+
| txt                                     | incre_col | b    |
+-----------------------------------------+-----------+------+
| table2_order order模式                  |       -25 |    2 |
| insert...on duplicate key update 语句   |         1 |    3 |
| table2_order order模式                  |         2 |    2 |
| table2_order order模式                  |         3 |    2 |
| table2_order order模式                  |        10 |    2 |
| 最新自增值=>                            |        11 |    2 |
| table2_order order模式                  |        12 |    2 |
| table2_order order模式                  |        13 |    2 |
| table2_order order模式                  |        14 |    2 |
| table2_order order模式                  |        15 |    2 |
| table2_order order模式                  |        35 |    2 |
| table2_order order模式                  |        46 |    2 |
| 最新自增值=>                            |        47 |    2 |
| table0_date                             |       110 |    0 |
| table0_date                             |       111 |    0 |
| table0_date                             |       112 |    0 |
| 最新自增值=>                            |       113 |    2 |
| 最新自增值1=>                           |       114 |    2 |
+-----------------------------------------+-----------+------+
insert into  v2_order (a,b,txt) values (150,2,'不重复场合') on duplicate key update b=b+1,txt='insert...on duplicate key update 语句';
insert into  v2_order(a,txt) values(0,'最新自增值2=>');
select txt,a incre_col,b from v2_order order by a;
+-----------------------------------------+-----------+------+
| txt                                     | incre_col | b    |
+-----------------------------------------+-----------+------+
| table2_order order模式                  |       -25 |    2 |
| insert...on duplicate key update 语句   |         1 |    3 |
| table2_order order模式                  |         2 |    2 |
| table2_order order模式                  |         3 |    2 |
| table2_order order模式                  |        10 |    2 |
| 最新自增值=>                            |        11 |    2 |
| table2_order order模式                  |        12 |    2 |
| table2_order order模式                  |        13 |    2 |
| table2_order order模式                  |        14 |    2 |
| table2_order order模式                  |        15 |    2 |
| table2_order order模式                  |        35 |    2 |
| table2_order order模式                  |        46 |    2 |
| 最新自增值=>                            |        47 |    2 |
| table0_date                             |       110 |    0 |
| table0_date                             |       111 |    0 |
| table0_date                             |       112 |    0 |
| 最新自增值=>                            |       113 |    2 |
| 最新自增值1=>                           |       114 |    2 |
| 不重复场合                              |       150 |    2 |
| 最新自增值2=>                           |       151 |    2 |
+-----------------------------------------+-----------+------+
insert into v3_noorder (a,b,txt) values (1,3,'重复场合') on duplicate key update b=b+1,txt='insert...on duplicate key update 语句';
insert into v3_noorder(a,txt) values(0,'最新自增值1=>');
select txt,a incre_col,b from v3_noorder order by a;
+-----------------------------------------+-----------+------+
| txt                                     | incre_col | b    |
+-----------------------------------------+-----------+------+
| table3_noorder noorder模式              |       -25 |    3 |
| insert...on duplicate key update 语句   |         1 |    4 |
| table3_noorder noorder模式              |         2 |    3 |
| table3_noorder noorder模式              |         3 |    3 |
| table3_noorder noorder模式              |        10 |    3 |
| table3_noorder noorder模式              |        15 |    3 |
| table3_noorder noorder模式              |        35 |    3 |
| table3_noorder noorder模式              |        46 |    3 |
| table0_date                             |       110 |    0 |
| table0_date                             |       111 |    0 |
| table0_date                             |       112 |    0 |
| 最新自增值=>                            |   1000001 |    3 |
| table3_noorder noorder模式              |   1000002 |    3 |
| table3_noorder noorder模式              |   1000003 |    3 |
| table3_noorder noorder模式              |   1000004 |    3 |
| 最新自增值=>                            |   1000005 |    3 |
| 最新自增值=>                            |   1000006 |    3 |
| 最新自增值1=>                           |   1000007 |    3 |
+-----------------------------------------+-----------+------+
insert into v3_noorder (a,b,txt) values (2000001,3,'不重复场合') on duplicate key update b=b+1,txt='insert...on duplicate key update 语句';
insert into v3_noorder(a,txt) values(0,'最新自增值2=>');
select txt,a incre_col,b from v3_noorder order by a;
+-----------------------------------------+-----------+------+
| txt                                     | incre_col | b    |
+-----------------------------------------+-----------+------+
| table3_noorder noorder模式              |       -25 |    3 |
| insert...on duplicate key update 语句   |         1 |    4 |
| table3_noorder noorder模式              |         2 |    3 |
| table3_noorder noorder模式              |         3 |    3 |
| table3_noorder noorder模式              |        10 |    3 |
| table3_noorder noorder模式              |        15 |    3 |
| table3_noorder noorder模式              |        35 |    3 |
| table3_noorder noorder模式              |        46 |    3 |
| table0_date                             |       110 |    0 |
| table0_date                             |       111 |    0 |
| table0_date                             |       112 |    0 |
| 最新自增值=>                            |   1000001 |    3 |
| table3_noorder noorder模式              |   1000002 |    3 |
| table3_noorder noorder模式              |   1000003 |    3 |
| table3_noorder noorder模式              |   1000004 |    3 |
| 最新自增值=>                            |   1000005 |    3 |
| 最新自增值=>                            |   1000006 |    3 |
| 最新自增值1=>                           |   1000007 |    3 |
| 不重复场合                              |   2000001 |    3 |
| 最新自增值2=>                           |   3000001 |    3 |
+-----------------------------------------+-----------+------+
##将NULL和任何其他值混合插入 AUTO_INCREMENT列
##INSERT 语句
drop table table1_default;
create table table1_default (
  a int not null auto_increment primary key,
  b int default 1,
  txt varchar(64) default 'table1_default 默认order模式',
  unique index(a)
);
drop table table2_order;
create table table2_order (
  a int not null auto_increment primary key,
  b int default 2,
  txt varchar(64) default 'table2_order order模式',
  unique index(a)
) auto_increment_mode = 'order';
drop table table3_noorder;
create table table3_noorder (
  a int not null auto_increment primary key,
  b int default 3,
  txt varchar(64) default 'table3_noorder noorder模式',
  unique index(a)
) auto_increment_mode = 'noorder';
insert into v1_default(a) values(null),(15),(null),(null),(25);
insert into v1_default(a,txt) values(0,'最新自增值1=>');
select txt,a incre_col,b from v1_default order by a;
+----------------------------------+-----------+------+
| txt                              | incre_col | b    |
+----------------------------------+-----------+------+
| table1_default 默认order模式     |         1 |    1 |
| table1_default 默认order模式     |        15 |    1 |
| table1_default 默认order模式     |        16 |    1 |
| table1_default 默认order模式     |        17 |    1 |
| table1_default 默认order模式     |        25 |    1 |
| 最新自增值1=>                    |        26 |    1 |
+----------------------------------+-----------+------+
insert into v1_default(a) values(null),(null),(null),(35);
insert into v1_default(a,txt) values(0,'最新自增值2=>');
select txt,a incre_col,b from v1_default order by a;
+----------------------------------+-----------+------+
| txt                              | incre_col | b    |
+----------------------------------+-----------+------+
| table1_default 默认order模式     |         1 |    1 |
| table1_default 默认order模式     |        15 |    1 |
| table1_default 默认order模式     |        16 |    1 |
| table1_default 默认order模式     |        17 |    1 |
| table1_default 默认order模式     |        25 |    1 |
| 最新自增值1=>                    |        26 |    1 |
| table1_default 默认order模式     |        27 |    1 |
| table1_default 默认order模式     |        28 |    1 |
| table1_default 默认order模式     |        29 |    1 |
| table1_default 默认order模式     |        35 |    1 |
| 最新自增值2=>                    |        36 |    1 |
+----------------------------------+-----------+------+
insert into v2_order(a) values(null),(15),(null),(null),(25);
insert into  v2_order(a,txt) values(0,'最新自增值1=>');
select txt,a incre_col,b from v2_order order by a;
+--------------------------+-----------+------+
| txt                      | incre_col | b    |
+--------------------------+-----------+------+
| table2_order order模式   |         1 |    2 |
| table2_order order模式   |        15 |    2 |
| table2_order order模式   |        16 |    2 |
| table2_order order模式   |        17 |    2 |
| table2_order order模式   |        25 |    2 |
| 最新自增值1=>            |        26 |    2 |
+--------------------------+-----------+------+
insert into v2_order(a) values(null),(null),(null),(35);
insert into  v2_order(a,txt) values(0,'最新自增值2=>');
select txt,a incre_col,b from v2_order order by a;
+--------------------------+-----------+------+
| txt                      | incre_col | b    |
+--------------------------+-----------+------+
| table2_order order模式   |         1 |    2 |
| table2_order order模式   |        15 |    2 |
| table2_order order模式   |        16 |    2 |
| table2_order order模式   |        17 |    2 |
| table2_order order模式   |        25 |    2 |
| 最新自增值1=>            |        26 |    2 |
| table2_order order模式   |        27 |    2 |
| table2_order order模式   |        28 |    2 |
| table2_order order模式   |        29 |    2 |
| table2_order order模式   |        35 |    2 |
| 最新自增值2=>            |        36 |    2 |
+--------------------------+-----------+------+
insert into v3_noorder(a) values(null),(15),(null),(null),(25);
insert into v3_noorder(a,txt) values(0,'最新自增值1=>');
select txt,a incre_col,b from v3_noorder order by a;
+------------------------------+-----------+------+
| txt                          | incre_col | b    |
+------------------------------+-----------+------+
| table3_noorder noorder模式   |         1 |    3 |
| table3_noorder noorder模式   |        15 |    3 |
| table3_noorder noorder模式   |        25 |    3 |
| table3_noorder noorder模式   |   1000001 |    3 |
| table3_noorder noorder模式   |   1000002 |    3 |
| 最新自增值1=>                |   1000004 |    3 |
+------------------------------+-----------+------+
insert into v3_noorder(a) values(null),(null),(null),(35);
insert into v3_noorder(a,txt) values(0,'最新自增值2=>');
select txt,a incre_col,b from v3_noorder order by a;
+------------------------------+-----------+------+
| txt                          | incre_col | b    |
+------------------------------+-----------+------+
| table3_noorder noorder模式   |         1 |    3 |
| table3_noorder noorder模式   |        15 |    3 |
| table3_noorder noorder模式   |        25 |    3 |
| table3_noorder noorder模式   |        35 |    3 |
| table3_noorder noorder模式   |   1000001 |    3 |
| table3_noorder noorder模式   |   1000002 |    3 |
| 最新自增值1=>                |   1000004 |    3 |
| table3_noorder noorder模式   |   1000005 |    3 |
| table3_noorder noorder模式   |   1000006 |    3 |
| table3_noorder noorder模式   |   1000007 |    3 |
| 最新自增值2=>                |   1000009 |    3 |
+------------------------------+-----------+------+
###### auto_incre_3-1-2 ②DELETE操作
insert into v1_default(a,b) values(null,11);
insert into v1_default(a,b) values(null,11);
select txt,a incre_col,b from v1_default order by a;
+----------------------------------+-----------+------+
| txt                              | incre_col | b    |
+----------------------------------+-----------+------+
| table1_default 默认order模式     |         1 |    1 |
| table1_default 默认order模式     |        15 |    1 |
| table1_default 默认order模式     |        16 |    1 |
| table1_default 默认order模式     |        17 |    1 |
| table1_default 默认order模式     |        25 |    1 |
| 最新自增值1=>                    |        26 |    1 |
| table1_default 默认order模式     |        27 |    1 |
| table1_default 默认order模式     |        28 |    1 |
| table1_default 默认order模式     |        29 |    1 |
| table1_default 默认order模式     |        35 |    1 |
| 最新自增值2=>                    |        36 |    1 |
| table1_default 默认order模式     |        37 |   11 |
| table1_default 默认order模式     |        38 |   11 |
+----------------------------------+-----------+------+
delete from v1_default where b=11;
insert into v1_default(a,txt) values(0,'最新自增值=>');
select txt,a incre_col,b from v1_default order by a;
+----------------------------------+-----------+------+
| txt                              | incre_col | b    |
+----------------------------------+-----------+------+
| table1_default 默认order模式     |         1 |    1 |
| table1_default 默认order模式     |        15 |    1 |
| table1_default 默认order模式     |        16 |    1 |
| table1_default 默认order模式     |        17 |    1 |
| table1_default 默认order模式     |        25 |    1 |
| 最新自增值1=>                    |        26 |    1 |
| table1_default 默认order模式     |        27 |    1 |
| table1_default 默认order模式     |        28 |    1 |
| table1_default 默认order模式     |        29 |    1 |
| table1_default 默认order模式     |        35 |    1 |
| 最新自增值2=>                    |        36 |    1 |
| 最新自增值=>                     |        39 |    1 |
+----------------------------------+-----------+------+
insert into  v2_order(a,b) values(null,22);
insert into  v2_order(a,b) values(null,22);
select txt,a incre_col,b from v2_order order by a;
+--------------------------+-----------+------+
| txt                      | incre_col | b    |
+--------------------------+-----------+------+
| table2_order order模式   |         1 |    2 |
| table2_order order模式   |        15 |    2 |
| table2_order order模式   |        16 |    2 |
| table2_order order模式   |        17 |    2 |
| table2_order order模式   |        25 |    2 |
| 最新自增值1=>            |        26 |    2 |
| table2_order order模式   |        27 |    2 |
| table2_order order模式   |        28 |    2 |
| table2_order order模式   |        29 |    2 |
| table2_order order模式   |        35 |    2 |
| 最新自增值2=>            |        36 |    2 |
| table2_order order模式   |        37 |   22 |
| table2_order order模式   |        38 |   22 |
+--------------------------+-----------+------+
delete from  v2_order where b=22;
insert into  v2_order(a,txt) values(0,'最新自增值=>');
select txt,a incre_col,b from v2_order order by a;
+--------------------------+-----------+------+
| txt                      | incre_col | b    |
+--------------------------+-----------+------+
| table2_order order模式   |         1 |    2 |
| table2_order order模式   |        15 |    2 |
| table2_order order模式   |        16 |    2 |
| table2_order order模式   |        17 |    2 |
| table2_order order模式   |        25 |    2 |
| 最新自增值1=>            |        26 |    2 |
| table2_order order模式   |        27 |    2 |
| table2_order order模式   |        28 |    2 |
| table2_order order模式   |        29 |    2 |
| table2_order order模式   |        35 |    2 |
| 最新自增值2=>            |        36 |    2 |
| 最新自增值=>             |        39 |    2 |
+--------------------------+-----------+------+
insert into v3_noorder(a,b) values(null,33);
insert into v3_noorder(a,b) values(null,33);
select txt,a incre_col,b from v3_noorder order by a;
+------------------------------+-----------+------+
| txt                          | incre_col | b    |
+------------------------------+-----------+------+
| table3_noorder noorder模式   |         1 |    3 |
| table3_noorder noorder模式   |        15 |    3 |
| table3_noorder noorder模式   |        25 |    3 |
| table3_noorder noorder模式   |        35 |    3 |
| table3_noorder noorder模式   |   1000001 |    3 |
| table3_noorder noorder模式   |   1000002 |    3 |
| 最新自增值1=>                |   1000004 |    3 |
| table3_noorder noorder模式   |   1000005 |    3 |
| table3_noorder noorder模式   |   1000006 |    3 |
| table3_noorder noorder模式   |   1000007 |    3 |
| 最新自增值2=>                |   1000009 |    3 |
| table3_noorder noorder模式   |   1000010 |   33 |
| table3_noorder noorder模式   |   1000011 |   33 |
+------------------------------+-----------+------+
delete from v3_noorder where b=33;
insert into v3_noorder(a,txt) values(0,'最新自增值=>');
select txt,a incre_col,b from table3_noorder order by a;
+------------------------------+-----------+------+
| txt                          | incre_col | b    |
+------------------------------+-----------+------+
| table3_noorder noorder模式   |         1 |    3 |
| table3_noorder noorder模式   |        15 |    3 |
| table3_noorder noorder模式   |        25 |    3 |
| table3_noorder noorder模式   |        35 |    3 |
| table3_noorder noorder模式   |   1000001 |    3 |
| table3_noorder noorder模式   |   1000002 |    3 |
| 最新自增值1=>                |   1000004 |    3 |
| table3_noorder noorder模式   |   1000005 |    3 |
| table3_noorder noorder模式   |   1000006 |    3 |
| table3_noorder noorder模式   |   1000007 |    3 |
| 最新自增值2=>                |   1000009 |    3 |
| 最新自增值=>                 |   1000012 |    3 |
+------------------------------+-----------+------+
###### auto_incre_3-1-3 ③UPDATE操作
# mysql 5.x update没有推高这个自增值，和我们现在是兼容的；8.x update会推高
##更新现有AUTO_INCREMENT列值
insert into v1_default(a,b) values(null,111);
select txt,a incre_col,b from v1_default order by a;
+----------------------------------+-----------+------+
| txt                              | incre_col | b    |
+----------------------------------+-----------+------+
| table1_default 默认order模式     |         1 |    1 |
| table1_default 默认order模式     |        15 |    1 |
| table1_default 默认order模式     |        16 |    1 |
| table1_default 默认order模式     |        17 |    1 |
| table1_default 默认order模式     |        25 |    1 |
| 最新自增值1=>                    |        26 |    1 |
| table1_default 默认order模式     |        27 |    1 |
| table1_default 默认order模式     |        28 |    1 |
| table1_default 默认order模式     |        29 |    1 |
| table1_default 默认order模式     |        35 |    1 |
| 最新自增值2=>                    |        36 |    1 |
| 最新自增值=>                     |        39 |    1 |
| table1_default 默认order模式     |        40 |  111 |
+----------------------------------+-----------+------+
update v1_default set a = 0,txt = '将AUTO_INCREMENT列值设置为小于/等于当前最大自增值的值' where b = 111;
insert into v1_default values(null,11,'1当前自增值=>');
select txt,a incre_col,b from v1_default order by a;
+--------------------------------------------------------------------------+-----------+------+
| txt                                                                      | incre_col | b    |
+--------------------------------------------------------------------------+-----------+------+
| 将AUTO_INCREMENT列值设置为小于/等于当前最大自增值的值                    |         0 |  111 |
| table1_default 默认order模式                                             |         1 |    1 |
| table1_default 默认order模式                                             |        15 |    1 |
| table1_default 默认order模式                                             |        16 |    1 |
| table1_default 默认order模式                                             |        17 |    1 |
| table1_default 默认order模式                                             |        25 |    1 |
| 最新自增值1=>                                                            |        26 |    1 |
| table1_default 默认order模式                                             |        27 |    1 |
| table1_default 默认order模式                                             |        28 |    1 |
| table1_default 默认order模式                                             |        29 |    1 |
| table1_default 默认order模式                                             |        35 |    1 |
| 最新自增值2=>                                                            |        36 |    1 |
| 最新自增值=>                                                             |        39 |    1 |
| 1当前自增值=>                                                            |        41 |   11 |
+--------------------------------------------------------------------------+-----------+------+
update v1_default set a = 60 ,txt = '将AUTO_INCREMENT列值设置为大于当前最大自增值的值' where b = 111;
insert into v1_default values(null,11,'2当前自增值=>');
select txt,a incre_col,b from v1_default order by a;
+-------------------------------------------------------------------+-----------+------+
| txt                                                               | incre_col | b    |
+-------------------------------------------------------------------+-----------+------+
| table1_default 默认order模式                                      |         1 |    1 |
| table1_default 默认order模式                                      |        15 |    1 |
| table1_default 默认order模式                                      |        16 |    1 |
| table1_default 默认order模式                                      |        17 |    1 |
| table1_default 默认order模式                                      |        25 |    1 |
| 最新自增值1=>                                                     |        26 |    1 |
| table1_default 默认order模式                                      |        27 |    1 |
| table1_default 默认order模式                                      |        28 |    1 |
| table1_default 默认order模式                                      |        29 |    1 |
| table1_default 默认order模式                                      |        35 |    1 |
| 最新自增值2=>                                                     |        36 |    1 |
| 最新自增值=>                                                      |        39 |    1 |
| 1当前自增值=>                                                     |        41 |   11 |
| 2当前自增值=>                                                     |        42 |   11 |
| 将AUTO_INCREMENT列值设置为大于当前最大自增值的值                  |        60 |  111 |
+-------------------------------------------------------------------+-----------+------+
insert into  v2_order(a,b) values(null,222);
select txt,a incre_col,b from v2_order order by a;
+--------------------------+-----------+------+
| txt                      | incre_col | b    |
+--------------------------+-----------+------+
| table2_order order模式   |         1 |    2 |
| table2_order order模式   |        15 |    2 |
| table2_order order模式   |        16 |    2 |
| table2_order order模式   |        17 |    2 |
| table2_order order模式   |        25 |    2 |
| 最新自增值1=>            |        26 |    2 |
| table2_order order模式   |        27 |    2 |
| table2_order order模式   |        28 |    2 |
| table2_order order模式   |        29 |    2 |
| table2_order order模式   |        35 |    2 |
| 最新自增值2=>            |        36 |    2 |
| 最新自增值=>             |        39 |    2 |
| table2_order order模式   |        40 |  222 |
+--------------------------+-----------+------+
update  v2_order set a = 0,txt = '将AUTO_INCREMENT列值设置为小于/等于当前最大自增值的值' where b = 222;
insert into  v2_order values(null,22,'1当前自增值=>');
select txt,a incre_col,b from v2_order order by a;
+--------------------------------------------------------------------------+-----------+------+
| txt                                                                      | incre_col | b    |
+--------------------------------------------------------------------------+-----------+------+
| 将AUTO_INCREMENT列值设置为小于/等于当前最大自增值的值                    |         0 |  222 |
| table2_order order模式                                                   |         1 |    2 |
| table2_order order模式                                                   |        15 |    2 |
| table2_order order模式                                                   |        16 |    2 |
| table2_order order模式                                                   |        17 |    2 |
| table2_order order模式                                                   |        25 |    2 |
| 最新自增值1=>                                                            |        26 |    2 |
| table2_order order模式                                                   |        27 |    2 |
| table2_order order模式                                                   |        28 |    2 |
| table2_order order模式                                                   |        29 |    2 |
| table2_order order模式                                                   |        35 |    2 |
| 最新自增值2=>                                                            |        36 |    2 |
| 最新自增值=>                                                             |        39 |    2 |
| 1当前自增值=>                                                            |        41 |   22 |
+--------------------------------------------------------------------------+-----------+------+
update  v2_order set a = 60 ,txt = '将AUTO_INCREMENT列值设置为大于当前最大自增值的值' where b = 222;
insert into  v2_order values(null,22,'2当前自增值=>');
select txt,a incre_col,b from v2_order order by a;
+-------------------------------------------------------------------+-----------+------+
| txt                                                               | incre_col | b    |
+-------------------------------------------------------------------+-----------+------+
| table2_order order模式                                            |         1 |    2 |
| table2_order order模式                                            |        15 |    2 |
| table2_order order模式                                            |        16 |    2 |
| table2_order order模式                                            |        17 |    2 |
| table2_order order模式                                            |        25 |    2 |
| 最新自增值1=>                                                     |        26 |    2 |
| table2_order order模式                                            |        27 |    2 |
| table2_order order模式                                            |        28 |    2 |
| table2_order order模式                                            |        29 |    2 |
| table2_order order模式                                            |        35 |    2 |
| 最新自增值2=>                                                     |        36 |    2 |
| 最新自增值=>                                                      |        39 |    2 |
| 1当前自增值=>                                                     |        41 |   22 |
| 2当前自增值=>                                                     |        42 |   22 |
| 将AUTO_INCREMENT列值设置为大于当前最大自增值的值                  |        60 |  222 |
+-------------------------------------------------------------------+-----------+------+
insert into v3_noorder(a,b) values(null,333);
select txt,a incre_col,b from v3_noorder order by a;
+------------------------------+-----------+------+
| txt                          | incre_col | b    |
+------------------------------+-----------+------+
| table3_noorder noorder模式   |         1 |    3 |
| table3_noorder noorder模式   |        15 |    3 |
| table3_noorder noorder模式   |        25 |    3 |
| table3_noorder noorder模式   |        35 |    3 |
| table3_noorder noorder模式   |   1000001 |    3 |
| table3_noorder noorder模式   |   1000002 |    3 |
| 最新自增值1=>                |   1000004 |    3 |
| table3_noorder noorder模式   |   1000005 |    3 |
| table3_noorder noorder模式   |   1000006 |    3 |
| table3_noorder noorder模式   |   1000007 |    3 |
| 最新自增值2=>                |   1000009 |    3 |
| 最新自增值=>                 |   1000012 |    3 |
| table3_noorder noorder模式   |   1000013 |  333 |
+------------------------------+-----------+------+
update v3_noorder set a = 0,txt = '将AUTO_INCREMENT列值设置为小于/等于当前最大自增值的值' where b = 333;
insert into v3_noorder values(null,33,'1当前自增值=>');
select txt,a incre_col,b from v3_noorder order by a;
+--------------------------------------------------------------------------+-----------+------+
| txt                                                                      | incre_col | b    |
+--------------------------------------------------------------------------+-----------+------+
| 将AUTO_INCREMENT列值设置为小于/等于当前最大自增值的值                    |         0 |  333 |
| table3_noorder noorder模式                                               |         1 |    3 |
| table3_noorder noorder模式                                               |        15 |    3 |
| table3_noorder noorder模式                                               |        25 |    3 |
| table3_noorder noorder模式                                               |        35 |    3 |
| table3_noorder noorder模式                                               |   1000001 |    3 |
| table3_noorder noorder模式                                               |   1000002 |    3 |
| 最新自增值1=>                                                            |   1000004 |    3 |
| table3_noorder noorder模式                                               |   1000005 |    3 |
| table3_noorder noorder模式                                               |   1000006 |    3 |
| table3_noorder noorder模式                                               |   1000007 |    3 |
| 最新自增值2=>                                                            |   1000009 |    3 |
| 最新自增值=>                                                             |   1000012 |    3 |
| 1当前自增值=>                                                            |   1000014 |   33 |
+--------------------------------------------------------------------------+-----------+------+
update v3_noorder set a = 1000022 ,txt = '将AUTO_INCREMENT列值设置为大于当前最大自增值的值' where b = 333;
insert into v3_noorder values(null,33,'2当前自增值=>');
select txt,a incre_col,b from v3_noorder order by a;
+-------------------------------------------------------------------+-----------+------+
| txt                                                               | incre_col | b    |
+-------------------------------------------------------------------+-----------+------+
| table3_noorder noorder模式                                        |         1 |    3 |
| table3_noorder noorder模式                                        |        15 |    3 |
| table3_noorder noorder模式                                        |        25 |    3 |
| table3_noorder noorder模式                                        |        35 |    3 |
| table3_noorder noorder模式                                        |   1000001 |    3 |
| table3_noorder noorder模式                                        |   1000002 |    3 |
| 最新自增值1=>                                                     |   1000004 |    3 |
| table3_noorder noorder模式                                        |   1000005 |    3 |
| table3_noorder noorder模式                                        |   1000006 |    3 |
| table3_noorder noorder模式                                        |   1000007 |    3 |
| 最新自增值2=>                                                     |   1000009 |    3 |
| 最新自增值=>                                                      |   1000012 |    3 |
| 1当前自增值=>                                                     |   1000014 |   33 |
| 2当前自增值=>                                                     |   1000015 |   33 |
| 将AUTO_INCREMENT列值设置为大于当前最大自增值的值                  |   1000022 |  333 |
+-------------------------------------------------------------------+-----------+------+
##更新其他列值时引用AUTO_INCREMENT列
delete from v1_default;
insert into v1_default(a,b,txt) values(null,0,'update');
select txt,a incre_col,b from v1_default order by a;
+--------+-----------+------+
| txt    | incre_col | b    |
+--------+-----------+------+
| update |        43 |    0 |
+--------+-----------+------+
update v1_default set b = a+1 where txt = 'update';
insert into v1_default values(null,11,'当前自增值==>');
select txt,a incre_col,b from v1_default order by a;
+--------------------+-----------+------+
| txt                | incre_col | b    |
+--------------------+-----------+------+
| update             |        43 |   44 |
| 当前自增值==>      |        44 |   11 |
+--------------------+-----------+------+
delete from  v2_order;
insert into  v2_order(a,b,txt) values(null,0,'update');
select txt,a incre_col,b from v2_order order by a;
+--------+-----------+------+
| txt    | incre_col | b    |
+--------+-----------+------+
| update |        43 |    0 |
+--------+-----------+------+
update  v2_order set b = a+2 where txt = 'update';
insert into  v2_order values(null,22,'当前自增值==>');
select txt,a incre_col,b from v2_order order by a;
+--------------------+-----------+------+
| txt                | incre_col | b    |
+--------------------+-----------+------+
| update             |        43 |   45 |
| 当前自增值==>      |        44 |   22 |
+--------------------+-----------+------+
delete from v3_noorder;
insert into v3_noorder(a,b,txt) values(null,0,'update');
select txt,a incre_col,b from v3_noorder order by a;
+--------+-----------+------+
| txt    | incre_col | b    |
+--------+-----------+------+
| update |   1000016 |    0 |
+--------+-----------+------+
update v3_noorder set b = a+3 where txt = 'update';
insert into v3_noorder values(null,33,'当前自增值==>');
select txt,a incre_col,b from v3_noorder order by a;
+--------------------+-----------+---------+
| txt                | incre_col | b       |
+--------------------+-----------+---------+
| update             |   1000016 | 1000019 |
| 当前自增值==>      |   1000017 |      33 |
+--------------------+-----------+---------+
###### auto_incre_3-1-4 ④SELECT操作
select a incre_col from v1_default order by a;
+-----------+
| incre_col |
+-----------+
|        43 |
|        44 |
+-----------+
select abs(a) from v1_default order by a;
+--------+
| abs(a) |
+--------+
|     43 |
|     44 |
+--------+
select a+b from v1_default order by a;
+------+
| a+b  |
+------+
|   87 |
|   55 |
+------+
select a incre_col from v2_order order by a;
+-----------+
| incre_col |
+-----------+
|        43 |
|        44 |
+-----------+
select abs(a) from v2_order order by a;
+--------+
| abs(a) |
+--------+
|     43 |
|     44 |
+--------+
select a+b from v2_order order by a;
+------+
| a+b  |
+------+
|   88 |
|   66 |
+------+
select a incre_col from v3_noorder order by a;
+-----------+
| incre_col |
+-----------+
|   1000016 |
|   1000017 |
+-----------+
select abs(a) from v3_noorder order by a;
+---------+
| abs(a)  |
+---------+
| 1000016 |
| 1000017 |
+---------+
select a+b from v3_noorder order by a;
+---------+
| a+b     |
+---------+
| 2000035 |
| 1000050 |
+---------+
############ auto_incre_2-4 ④模式切换 ############
##建表
set auto_increment_increment=1;
alter system set default_auto_increment_mode = 'order';
drop table table1_default;
create table table1_default (
  a int not null auto_increment primary key,
  b int default 1,
  txt varchar(64) default 'table1_default 默认order模式',
  unique index(a)
);
drop view v1_default;
create view v1_default as select * from table1_default;
## ORDER
insert into v1_default(a) values(0),(0),(0),(0),(0);
select txt,a incre_col, b from v1_default order by a;
+----------------------------------+-----------+------+
| txt                              | incre_col | b    |
+----------------------------------+-----------+------+
| table1_default 默认order模式     |         1 |    1 |
| table1_default 默认order模式     |         2 |    1 |
| table1_default 默认order模式     |         3 |    1 |
| table1_default 默认order模式     |         4 |    1 |
| table1_default 默认order模式     |         5 |    1 |
+----------------------------------+-----------+------+
## ORDER==>ORDER
alter table table1_default auto_increment_mode = 'ORDER';
insert into v1_default values(0,2,'ORDER==>ORDER'),(0,2,'ORDER==>ORDER'),(0,2,'ORDER==>ORDER'),(0,2,'ORDER==>ORDER');
select txt,a incre_col, b from v1_default order by a;
+----------------------------------+-----------+------+
| txt                              | incre_col | b    |
+----------------------------------+-----------+------+
| table1_default 默认order模式     |         1 |    1 |
| table1_default 默认order模式     |         2 |    1 |
| table1_default 默认order模式     |         3 |    1 |
| table1_default 默认order模式     |         4 |    1 |
| table1_default 默认order模式     |         5 |    1 |
| ORDER==>ORDER                    |         6 |    2 |
| ORDER==>ORDER                    |         7 |    2 |
| ORDER==>ORDER                    |         8 |    2 |
| ORDER==>ORDER                    |         9 |    2 |
+----------------------------------+-----------+------+
## ORDER==>NOORDER
alter table table1_default auto_increment_mode = 'NOORDER';
insert into v1_default values(0,3,'ORDER==>NOORDER'),(0,3,'ORDER==>NOORDER'),(0,3,'ORDER==>NOORDER'),(0,3,'ORDER==>NOORDER');
select txt,a incre_col, b from v1_default order by a;
+----------------------------------+-----------+------+
| txt                              | incre_col | b    |
+----------------------------------+-----------+------+
| table1_default 默认order模式     |         1 |    1 |
| table1_default 默认order模式     |         2 |    1 |
| table1_default 默认order模式     |         3 |    1 |
| table1_default 默认order模式     |         4 |    1 |
| table1_default 默认order模式     |         5 |    1 |
| ORDER==>ORDER                    |         6 |    2 |
| ORDER==>ORDER                    |         7 |    2 |
| ORDER==>ORDER                    |         8 |    2 |
| ORDER==>ORDER                    |         9 |    2 |
| ORDER==>NOORDER                  |   1000001 |    3 |
| ORDER==>NOORDER                  |   1000002 |    3 |
| ORDER==>NOORDER                  |   1000003 |    3 |
| ORDER==>NOORDER                  |   1000004 |    3 |
+----------------------------------+-----------+------+
## NOORDER==>NOORDER
alter table table1_default auto_increment_mode = 'NOORDER';
insert into v1_default values(0,4,'NOORDER==>NOORDER'),(0,4,'NOORDER==>NOORDER'),(0,4,'NOORDER==>NOORDER'),(0,4,'NOORDER==>NOORDER');
select txt,a incre_col, b from v1_default order by a;
+----------------------------------+-----------+------+
| txt                              | incre_col | b    |
+----------------------------------+-----------+------+
| table1_default 默认order模式     |         1 |    1 |
| table1_default 默认order模式     |         2 |    1 |
| table1_default 默认order模式     |         3 |    1 |
| table1_default 默认order模式     |         4 |    1 |
| table1_default 默认order模式     |         5 |    1 |
| ORDER==>ORDER                    |         6 |    2 |
| ORDER==>ORDER                    |         7 |    2 |
| ORDER==>ORDER                    |         8 |    2 |
| ORDER==>ORDER                    |         9 |    2 |
| ORDER==>NOORDER                  |   1000001 |    3 |
| ORDER==>NOORDER                  |   1000002 |    3 |
| ORDER==>NOORDER                  |   1000003 |    3 |
| ORDER==>NOORDER                  |   1000004 |    3 |
| NOORDER==>NOORDER                |   1000005 |    4 |
| NOORDER==>NOORDER                |   1000006 |    4 |
| NOORDER==>NOORDER                |   1000007 |    4 |
| NOORDER==>NOORDER                |   1000008 |    4 |
+----------------------------------+-----------+------+
## NOORDER==>ORDER
alter table table1_default auto_increment_mode = 'ORDER';
insert into v1_default values(0,5,'NOORDER==>ORDER'),(0,5,'NOORDER==>ORDER'),(0,5,'NOORDER==>ORDER'),(0,5,'NOORDER==>ORDER');
select txt,a incre_col, b from v1_default order by a;
+----------------------------------+-----------+------+
| txt                              | incre_col | b    |
+----------------------------------+-----------+------+
| table1_default 默认order模式     |         1 |    1 |
| table1_default 默认order模式     |         2 |    1 |
| table1_default 默认order模式     |         3 |    1 |
| table1_default 默认order模式     |         4 |    1 |
| table1_default 默认order模式     |         5 |    1 |
| ORDER==>ORDER                    |         6 |    2 |
| ORDER==>ORDER                    |         7 |    2 |
| ORDER==>ORDER                    |         8 |    2 |
| ORDER==>ORDER                    |         9 |    2 |
| ORDER==>NOORDER                  |   1000001 |    3 |
| ORDER==>NOORDER                  |   1000002 |    3 |
| ORDER==>NOORDER                  |   1000003 |    3 |
| ORDER==>NOORDER                  |   1000004 |    3 |
| NOORDER==>NOORDER                |   1000005 |    4 |
| NOORDER==>NOORDER                |   1000006 |    4 |
| NOORDER==>NOORDER                |   1000007 |    4 |
| NOORDER==>NOORDER                |   1000008 |    4 |
| NOORDER==>ORDER                  |   2000001 |    5 |
| NOORDER==>ORDER                  |   2000002 |    5 |
| NOORDER==>ORDER                  |   2000003 |    5 |
| NOORDER==>ORDER                  |   2000004 |    5 |
+----------------------------------+-----------+------+
insert into v1_default values(0,6,'NOORDER==>ORDER test');
select txt,a incre_col, b from v1_default order by a;
+----------------------------------+-----------+------+
| txt                              | incre_col | b    |
+----------------------------------+-----------+------+
| table1_default 默认order模式     |         1 |    1 |
| table1_default 默认order模式     |         2 |    1 |
| table1_default 默认order模式     |         3 |    1 |
| table1_default 默认order模式     |         4 |    1 |
| table1_default 默认order模式     |         5 |    1 |
| ORDER==>ORDER                    |         6 |    2 |
| ORDER==>ORDER                    |         7 |    2 |
| ORDER==>ORDER                    |         8 |    2 |
| ORDER==>ORDER                    |         9 |    2 |
| ORDER==>NOORDER                  |   1000001 |    3 |
| ORDER==>NOORDER                  |   1000002 |    3 |
| ORDER==>NOORDER                  |   1000003 |    3 |
| ORDER==>NOORDER                  |   1000004 |    3 |
| NOORDER==>NOORDER                |   1000005 |    4 |
| NOORDER==>NOORDER                |   1000006 |    4 |
| NOORDER==>NOORDER                |   1000007 |    4 |
| NOORDER==>NOORDER                |   1000008 |    4 |
| NOORDER==>ORDER                  |   2000001 |    5 |
| NOORDER==>ORDER                  |   2000002 |    5 |
| NOORDER==>ORDER                  |   2000003 |    5 |
| NOORDER==>ORDER                  |   2000004 |    5 |
| NOORDER==>ORDER test             |   2000005 |    6 |
+----------------------------------+-----------+------+
update v1_default set a = 10 where b = 6;
insert into v1_default(a,txt) values(0,'最新自增值=>');
select txt,a incre_col, b from v1_default order by a;
+----------------------------------+-----------+------+
| txt                              | incre_col | b    |
+----------------------------------+-----------+------+
| table1_default 默认order模式     |         1 |    1 |
| table1_default 默认order模式     |         2 |    1 |
| table1_default 默认order模式     |         3 |    1 |
| table1_default 默认order模式     |         4 |    1 |
| table1_default 默认order模式     |         5 |    1 |
| ORDER==>ORDER                    |         6 |    2 |
| ORDER==>ORDER                    |         7 |    2 |
| ORDER==>ORDER                    |         8 |    2 |
| ORDER==>ORDER                    |         9 |    2 |
| NOORDER==>ORDER test             |        10 |    6 |
| ORDER==>NOORDER                  |   1000001 |    3 |
| ORDER==>NOORDER                  |   1000002 |    3 |
| ORDER==>NOORDER                  |   1000003 |    3 |
| ORDER==>NOORDER                  |   1000004 |    3 |
| NOORDER==>NOORDER                |   1000005 |    4 |
| NOORDER==>NOORDER                |   1000006 |    4 |
| NOORDER==>NOORDER                |   1000007 |    4 |
| NOORDER==>NOORDER                |   1000008 |    4 |
| NOORDER==>ORDER                  |   2000001 |    5 |
| NOORDER==>ORDER                  |   2000002 |    5 |
| NOORDER==>ORDER                  |   2000003 |    5 |
| NOORDER==>ORDER                  |   2000004 |    5 |
| 最新自增值=>                     |   2000006 |    1 |
+----------------------------------+-----------+------+
#多基表视图
drop table table2_order;
create table table2_order (
  a1 int not null auto_increment primary key,
  b1 int default 2,
  txt1 varchar(64) default 'table2_order order模式',
  unique index(a1)
) auto_increment_mode = 'order';
drop table table3_noorder;
create table table3_noorder (
  a2 int not null auto_increment primary key,
  b2 int default 3,
  txt2 varchar(64) default 'table3_noorder noorder模式',
  unique index(a2)
) auto_increment_mode = 'noorder';
drop view v1_order;
create view v1_order as select t1.a1,t1.b1,t2.txt1 from table2_order t1 join table2_order t2 on t1.a1=t2.a1;
drop view v2_noorder;
create view v2_noorder as select t1.a2,t1.b2,t2.txt2 from table3_noorder t1 join table3_noorder t2 on t1.a2=t2.a2;
drop view v3_order_noorder;
create view v3_order_noorder as select t1.a1,t1.b1,t1.txt1,t2.a2,t2.b2,t2.txt2 from table2_order t1 join table3_noorder t2 on t1.a1=t2.a2;
##简单插入
##INSERT 语句
# 不能通过连接视图修改多个基表，不能测试
insert into v1_order(a1) values(0),(0),(0);
ERROR HY000: The target table v1_order of the INSERT is not insertable-into
select txt1,a1 incre_col,b1 from v1_order order by a1;
+------+-----------+------+
| txt1 | incre_col | b1   |
+------+-----------+------+
+------+-----------+------+
insert into v2_noorder(a2) values(0),(0),(0);
ERROR HY000: The target table v2_noorder of the INSERT is not insertable-into
select txt2,a2 incre_col,b2 from v2_noorder order by a2;
+------+-----------+------+
| txt2 | incre_col | b2   |
+------+-----------+------+
+------+-----------+------+
insert into v3_order_noorder(a1,a2) values(0),(0),(0);
ERROR HY000: Can not modify more than one base table through a join view 'whh.v3_order_noorder'
select txt1,a1 incre_col1,b1,txt2,a2 incre_col2,b2 from v3_order_noorder order by a1;
+------+------------+------+------+------------+------+
| txt1 | incre_col1 | b1   | txt2 | incre_col2 | b2   |
+------+------------+------+------+------------+------+
+------+------------+------+------+------------+------+
##########################################################################################################################
###### 标签：auto_incre_4
###### 功能：异常场景
##表有多个AUTO_INCREMENT列
drop table table2_order;
create table table2_order (
  a int not null auto_increment primary key,
  b int auto_increment,
  txt varchar(64) default 'table2_order order模式',
  unique index(a)
) auto_increment_mode = 'order';
ERROR 42000: Incorrect table definition; there can be only one auto column
drop table table3_noorder;
create table table3_noorder (
  a int not null auto_increment primary key,
  b int auto_increment,
  txt varchar(64) default 'table3_noorder noorder模式',
  unique index(a)
) auto_increment_mode = 'noorder';
ERROR 42000: Incorrect table definition; there can be only one auto column
##表中AUTO_INCREMENT列设置 DEFAULT值
drop table table2_order;
create table table2_order (
  a int not null auto_increment default 1,
  b int default 2,
  txt varchar(64) default 'table2_order order模式',
  unique index(a)
) auto_increment_mode = 'order';
ERROR 42000: Invalid default value for 'a'
drop table table3_noorder;
create table table3_noorder (
  a int not null auto_increment default 1,
  b int default 3,
  txt varchar(64) default 'table3_noorder noorder模式',
  unique index(a)
) auto_increment_mode = 'noorder';
ERROR 42000: Invalid default value for 'a'
##表中AUTO_INCREMENT列定义为某个索引的非第一列
##echo # mysql不支持，ob支持
drop table table1_default;
create table table1_default (
  a tinyint auto_increment,
  b tinyint default 1,
  txt varchar(64) default 'table1_default 默认noorder模式',
  index index_name (b,a)
);
insert into table1_default(a) values(null),(null),(null);
select txt,a incre_col,b from table1_default order by a;
+------------------------------------+-----------+------+
| txt                                | incre_col | b    |
+------------------------------------+-----------+------+
| table1_default 默认noorder模式     |         1 |    1 |
| table1_default 默认noorder模式     |         2 |    1 |
| table1_default 默认noorder模式     |         3 |    1 |
+------------------------------------+-----------+------+
drop table table2_order;
create table table2_order (
  a tinyint auto_increment,
  b tinyint default 2,
  txt varchar(64) default 'table2_order order模式',
  index index_name (b,a)
) auto_increment_mode = 'order';
insert into table2_order(a) values(null),(null),(null);
select txt,a incre_col,b from table2_order order by a;
+--------------------------+-----------+------+
| txt                      | incre_col | b    |
+--------------------------+-----------+------+
| table2_order order模式   |         1 |    2 |
| table2_order order模式   |         2 |    2 |
| table2_order order模式   |         3 |    2 |
+--------------------------+-----------+------+
drop table table3_noorder;
create table table3_noorder (
  a tinyint auto_increment,
  b tinyint default 3,
  txt varchar(64) default 'table3_noorder noorder模式',
  index index_name (b,a)
) auto_increment_mode = 'noorder';
insert into table3_noorder(a) values(null),(null),(null);
select txt,a incre_col,b from table3_noorder order by a;
+------------------------------+-----------+------+
| txt                          | incre_col | b    |
+------------------------------+-----------+------+
| table3_noorder noorder模式   |         1 |    3 |
| table3_noorder noorder模式   |         2 |    3 |
| table3_noorder noorder模式   |         3 |    3 |
+------------------------------+-----------+------+
##生成列引用AUTO_INCREMENT列
drop table table2_order;
create table table2_order (
  a tinyint auto_increment,
  b tinyint default 2,
  c INT GENERATED ALWAYS AS (a + b) STORED,
  txt varchar(64) default 'table2_order order模式',
  index index_name (a)
) auto_increment_mode = 'order';
ERROR 0A000: generated column refer to auto-increment column not supported
drop table table3_noorder;
create table table3_noorder (
  a tinyint auto_increment,
  b tinyint default 3,
  c INT GENERATED ALWAYS AS (a + b) STORED,
  txt varchar(64) default 'table3_noorder noorder模式',
  index index_name (a)
) auto_increment_mode = 'noorder';
ERROR 0A000: generated column refer to auto-increment column not supported
##检查约束引用AUTO_INCREMENT列
drop table table2_order;
create table table2_order (
  a tinyint auto_increment,
  b tinyint default 2,
  txt varchar(64) default 'table2_order order模式',
  index index_name (a),
  check (a > b)
) auto_increment_mode = 'order';
ERROR HY000: Check constraint cannot refer to an auto-increment column.
drop table table3_noorder;
create table table3_noorder (
  a tinyint auto_increment,
  b tinyint default 3,
  txt varchar(64) default 'table3_noorder noorder模式',
  index index_name (a),
  check (a > b)
) auto_increment_mode = 'noorder';
ERROR HY000: Check constraint cannot refer to an auto-increment column.
##########################################################################################################################
###### auto_incre_1-1-1 数据类型边界值补充用例
## INT SIGNED: -2147483648~2147483647
drop table table1_default;
create table table1_default (
  a int signed auto_increment,
  b int default 1,
  txt varchar(64) default 'table1_default 默认order模式',
  index(a)
);
drop table table2_order;
create table table2_order (
  a int signed auto_increment,
  b int default 2,
  txt varchar(64) default 'table2_order order模式',
  index(a)
) auto_increment_mode = 'order';
drop table table3_noorder;
create table table3_noorder (
  a int signed auto_increment,
  b int default 3,
  txt varchar(64) default 'table3_noorder noorder模式',
  index(a)
) auto_increment_mode = 'noorder';
###### auto_incre_3-1-1 ①INSERT操作 
##table1_default
insert into table1_default(a) values(null);
select txt,a incre_col,b from table1_default order by a;
+----------------------------------+-----------+------+
| txt                              | incre_col | b    |
+----------------------------------+-----------+------+
| table1_default 默认order模式     |         1 |    1 |
+----------------------------------+-----------+------+
alter table table1_default AUTO_INCREMENT = 2147483647;
insert into table1_default(a) values(null);
insert into table1_default(a) values(null),(null);
select txt,a incre_col,b from table1_default order by a;
+----------------------------------+------------+------+
| txt                              | incre_col  | b    |
+----------------------------------+------------+------+
| table1_default 默认order模式     |          1 |    1 |
| table1_default 默认order模式     | 2147483647 |    1 |
| table1_default 默认order模式     | 2147483647 |    1 |
| table1_default 默认order模式     | 2147483647 |    1 |
+----------------------------------+------------+------+
insert into table1_default(a) values(10);
insert into table1_default(a,txt) values(0,'最新自增值1=>');
select txt,a incre_col,b from table1_default order by a;
+----------------------------------+------------+------+
| txt                              | incre_col  | b    |
+----------------------------------+------------+------+
| table1_default 默认order模式     |          1 |    1 |
| table1_default 默认order模式     |         10 |    1 |
| table1_default 默认order模式     | 2147483647 |    1 |
| table1_default 默认order模式     | 2147483647 |    1 |
| table1_default 默认order模式     | 2147483647 |    1 |
| 最新自增值1=>                    | 2147483647 |    1 |
+----------------------------------+------------+------+
##table2_order
insert into table2_order(a) values(null);
select txt,a incre_col,b from table2_order order by a;
+--------------------------+-----------+------+
| txt                      | incre_col | b    |
+--------------------------+-----------+------+
| table2_order order模式   |         1 |    2 |
+--------------------------+-----------+------+
alter table table2_order AUTO_INCREMENT = 2147483647;
insert into table2_order(a) values(null),(null),(null),(null);
select txt,a incre_col,b from table2_order order by a;
+--------------------------+------------+------+
| txt                      | incre_col  | b    |
+--------------------------+------------+------+
| table2_order order模式   |          1 |    2 |
| table2_order order模式   | 2147483647 |    2 |
| table2_order order模式   | 2147483647 |    2 |
| table2_order order模式   | 2147483647 |    2 |
| table2_order order模式   | 2147483647 |    2 |
+--------------------------+------------+------+
insert into table2_order(a) values(10);
insert into table2_order(a,txt) values(0,'最新自增值=>');
select txt,a incre_col,b from table2_order order by a;
+--------------------------+------------+------+
| txt                      | incre_col  | b    |
+--------------------------+------------+------+
| table2_order order模式   |          1 |    2 |
| table2_order order模式   |         10 |    2 |
| table2_order order模式   | 2147483647 |    2 |
| table2_order order模式   | 2147483647 |    2 |
| table2_order order模式   | 2147483647 |    2 |
| table2_order order模式   | 2147483647 |    2 |
| 最新自增值=>             | 2147483647 |    2 |
+--------------------------+------------+------+
##table3_noorder
insert into table3_noorder(a) values(null);
select txt,a incre_col,b from table3_noorder order by a;
+------------------------------+-----------+------+
| txt                          | incre_col | b    |
+------------------------------+-----------+------+
| table3_noorder noorder模式   |         1 |    3 |
+------------------------------+-----------+------+
alter table table3_noorder AUTO_INCREMENT = 2147483647;
insert into table3_noorder(a) values(null),(null),(null),(null);
select txt,a incre_col,b from table3_noorder order by a;
+------------------------------+------------+------+
| txt                          | incre_col  | b    |
+------------------------------+------------+------+
| table3_noorder noorder模式   |          1 |    3 |
| table3_noorder noorder模式   | 2147483647 |    3 |
| table3_noorder noorder模式   | 2147483647 |    3 |
| table3_noorder noorder模式   | 2147483647 |    3 |
| table3_noorder noorder模式   | 2147483647 |    3 |
+------------------------------+------------+------+
insert into table3_noorder(a) values(10);
insert into table3_noorder(a,txt) values(0,'最新自增值=>');
select txt,a incre_col,b from table3_noorder order by a;
+------------------------------+------------+------+
| txt                          | incre_col  | b    |
+------------------------------+------------+------+
| table3_noorder noorder模式   |          1 |    3 |
| table3_noorder noorder模式   |         10 |    3 |
| table3_noorder noorder模式   | 2147483647 |    3 |
| table3_noorder noorder模式   | 2147483647 |    3 |
| table3_noorder noorder模式   | 2147483647 |    3 |
| table3_noorder noorder模式   | 2147483647 |    3 |
| 最新自增值=>                 | 2147483647 |    3 |
+------------------------------+------------+------+
## INT UNSIGNED: 0~4294967295
drop table table1_default;
create table table1_default (
  a int unsigned auto_increment,
  b int default 1,
  txt varchar(64) default 'table1_default 默认noorder模式',
  index(a)
);
drop table table2_order;
create table table2_order (
  a int unsigned auto_increment,
  b int default 2,
  txt varchar(64) default 'table2_order order模式',
  index(a)
) auto_increment_mode = 'order';
drop table table3_noorder;
create table table3_noorder (
  a int unsigned auto_increment,
  b int default 3,
  txt varchar(64) default 'table3_noorder noorder模式',
  index(a)
) auto_increment_mode = 'noorder';
###### auto_incre_3-1-1 ①INSERT操作 
##table1_default
insert into table1_default(a) values(null);
select txt,a incre_col,b from table1_default order by a;
+------------------------------------+-----------+------+
| txt                                | incre_col | b    |
+------------------------------------+-----------+------+
| table1_default 默认noorder模式     |         1 |    1 |
+------------------------------------+-----------+------+
alter table table1_default AUTO_INCREMENT = 4294967295;
insert into table1_default(a) values(null);
insert into table1_default(a) values(null),(null);
select txt,a incre_col,b from table1_default order by a;
+------------------------------------+------------+------+
| txt                                | incre_col  | b    |
+------------------------------------+------------+------+
| table1_default 默认noorder模式     |          1 |    1 |
| table1_default 默认noorder模式     | 4294967295 |    1 |
| table1_default 默认noorder模式     | 4294967295 |    1 |
| table1_default 默认noorder模式     | 4294967295 |    1 |
+------------------------------------+------------+------+
insert into table1_default(a) values(10);
insert into table1_default(a,txt) values(0,'最新自增值=>');
select txt,a incre_col,b from table1_default order by a;
+------------------------------------+------------+------+
| txt                                | incre_col  | b    |
+------------------------------------+------------+------+
| table1_default 默认noorder模式     |          1 |    1 |
| table1_default 默认noorder模式     |         10 |    1 |
| table1_default 默认noorder模式     | 4294967295 |    1 |
| table1_default 默认noorder模式     | 4294967295 |    1 |
| table1_default 默认noorder模式     | 4294967295 |    1 |
| 最新自增值=>                       | 4294967295 |    1 |
+------------------------------------+------------+------+
##table2_order
insert into table2_order(a) values(null);
select txt,a incre_col,b from table2_order order by a;
+--------------------------+-----------+------+
| txt                      | incre_col | b    |
+--------------------------+-----------+------+
| table2_order order模式   |         1 |    2 |
+--------------------------+-----------+------+
alter table table2_order AUTO_INCREMENT = 4294967295;
insert into table2_order(a) values(null),(null),(null),(null);
select txt,a incre_col,b from table2_order order by a;
+--------------------------+------------+------+
| txt                      | incre_col  | b    |
+--------------------------+------------+------+
| table2_order order模式   |          1 |    2 |
| table2_order order模式   | 4294967295 |    2 |
| table2_order order模式   | 4294967295 |    2 |
| table2_order order模式   | 4294967295 |    2 |
| table2_order order模式   | 4294967295 |    2 |
+--------------------------+------------+------+
insert into table2_order(a) values(10);
insert into table2_order(a,txt) values(0,'最新自增值=>');
select txt,a incre_col,b from table2_order order by a;
+--------------------------+------------+------+
| txt                      | incre_col  | b    |
+--------------------------+------------+------+
| table2_order order模式   |          1 |    2 |
| table2_order order模式   |         10 |    2 |
| table2_order order模式   | 4294967295 |    2 |
| table2_order order模式   | 4294967295 |    2 |
| table2_order order模式   | 4294967295 |    2 |
| table2_order order模式   | 4294967295 |    2 |
| 最新自增值=>             | 4294967295 |    2 |
+--------------------------+------------+------+
##table3_noorder
insert into table3_noorder(a) values(null);
select txt,a incre_col,b from table3_noorder order by a;
+------------------------------+-----------+------+
| txt                          | incre_col | b    |
+------------------------------+-----------+------+
| table3_noorder noorder模式   |         1 |    3 |
+------------------------------+-----------+------+
alter table table3_noorder AUTO_INCREMENT = 4294967295;
insert into table3_noorder(a) values(null),(null),(null),(null);
select txt,a incre_col,b from table3_noorder order by a;
+------------------------------+------------+------+
| txt                          | incre_col  | b    |
+------------------------------+------------+------+
| table3_noorder noorder模式   |          1 |    3 |
| table3_noorder noorder模式   | 4294967295 |    3 |
| table3_noorder noorder模式   | 4294967295 |    3 |
| table3_noorder noorder模式   | 4294967295 |    3 |
| table3_noorder noorder模式   | 4294967295 |    3 |
+------------------------------+------------+------+
insert into table3_noorder(a) values(10);
insert into table3_noorder(a,txt) values(0,'最新自增值=>');
select txt,a incre_col,b from table3_noorder order by a;
+------------------------------+------------+------+
| txt                          | incre_col  | b    |
+------------------------------+------------+------+
| table3_noorder noorder模式   |          1 |    3 |
| table3_noorder noorder模式   |         10 |    3 |
| table3_noorder noorder模式   | 4294967295 |    3 |
| table3_noorder noorder模式   | 4294967295 |    3 |
| table3_noorder noorder模式   | 4294967295 |    3 |
| table3_noorder noorder模式   | 4294967295 |    3 |
| 最新自增值=>                 | 4294967295 |    3 |
+------------------------------+------------+------+
############ TINYINT UNSIGNED: 0~255
##建表
drop table table1_default;
create table table1_default (
  a tinyint unsigned auto_increment,
  b tinyint default 1,
  txt varchar(64) default 'table1_default 默认order模式',
  index index_name (a,b)
);
drop table table2_order;
create table table2_order (
  a tinyint unsigned auto_increment,
  b tinyint default 2,
  txt varchar(64) default 'table2_order order模式',
  index index_name (a,b)
) auto_increment_mode = 'order';
drop table table3_noorder;
create table table3_noorder (
  a tinyint unsigned auto_increment,
  b tinyint default 3,
  txt varchar(64) default 'table3_noorder noorder模式',
  index index_name (a,b)
) auto_increment_mode = 'noorder';
############ auto_incre_3-1 DML操作 ############
###### auto_incre_3-1-1 ①INSERT操作 
##table1_default
insert into table1_default(a) values(null);
select txt,a incre_col,b from table1_default order by a;
+----------------------------------+-----------+------+
| txt                              | incre_col | b    |
+----------------------------------+-----------+------+
| table1_default 默认order模式     |         1 |    1 |
+----------------------------------+-----------+------+
alter table table1_default AUTO_INCREMENT = 255;
insert into table1_default(a) values(null);
insert into table1_default(a) values(null),(null),(null);
select txt,a incre_col,b from table1_default order by a;
+----------------------------------+-----------+------+
| txt                              | incre_col | b    |
+----------------------------------+-----------+------+
| table1_default 默认order模式     |         1 |    1 |
| table1_default 默认order模式     |       255 |    1 |
| table1_default 默认order模式     |       255 |    1 |
| table1_default 默认order模式     |       255 |    1 |
| table1_default 默认order模式     |       255 |    1 |
+----------------------------------+-----------+------+
insert into table1_default(a) values(10);
insert into table1_default(a,txt) values(0,'最新自增值=>');
select txt,a incre_col,b from table1_default order by a;
+----------------------------------+-----------+------+
| txt                              | incre_col | b    |
+----------------------------------+-----------+------+
| table1_default 默认order模式     |         1 |    1 |
| table1_default 默认order模式     |        10 |    1 |
| table1_default 默认order模式     |       255 |    1 |
| table1_default 默认order模式     |       255 |    1 |
| table1_default 默认order模式     |       255 |    1 |
| table1_default 默认order模式     |       255 |    1 |
| 最新自增值=>                     |       255 |    1 |
+----------------------------------+-----------+------+
##table2_order
insert into table2_order(a) values(null);
select txt,a incre_col,b from table2_order order by a;
+--------------------------+-----------+------+
| txt                      | incre_col | b    |
+--------------------------+-----------+------+
| table2_order order模式   |         1 |    2 |
+--------------------------+-----------+------+
alter table table2_order AUTO_INCREMENT = 255;
insert into table2_order(a) values(null),(null),(null),(null);
select txt,a incre_col,b from table2_order order by a;
+--------------------------+-----------+------+
| txt                      | incre_col | b    |
+--------------------------+-----------+------+
| table2_order order模式   |         1 |    2 |
| table2_order order模式   |       255 |    2 |
| table2_order order模式   |       255 |    2 |
| table2_order order模式   |       255 |    2 |
| table2_order order模式   |       255 |    2 |
+--------------------------+-----------+------+
insert into table2_order(a) values(10);
insert into table2_order(a,txt) values(0,'最新自增值=>');
select txt,a incre_col,b from table2_order order by a;
+--------------------------+-----------+------+
| txt                      | incre_col | b    |
+--------------------------+-----------+------+
| table2_order order模式   |         1 |    2 |
| table2_order order模式   |        10 |    2 |
| table2_order order模式   |       255 |    2 |
| table2_order order模式   |       255 |    2 |
| table2_order order模式   |       255 |    2 |
| table2_order order模式   |       255 |    2 |
| 最新自增值=>             |       255 |    2 |
+--------------------------+-----------+------+
##table3_noorder
insert into table3_noorder(a) values(null);
select txt,a incre_col,b from table3_noorder order by a;
+------------------------------+-----------+------+
| txt                          | incre_col | b    |
+------------------------------+-----------+------+
| table3_noorder noorder模式   |         1 |    3 |
+------------------------------+-----------+------+
alter table table3_noorder AUTO_INCREMENT = 255;
insert into table3_noorder(a) values(null),(null),(null),(null);
select txt,a incre_col,b from table3_noorder order by a;
+------------------------------+-----------+------+
| txt                          | incre_col | b    |
+------------------------------+-----------+------+
| table3_noorder noorder模式   |         1 |    3 |
| table3_noorder noorder模式   |       255 |    3 |
| table3_noorder noorder模式   |       255 |    3 |
| table3_noorder noorder模式   |       255 |    3 |
| table3_noorder noorder模式   |       255 |    3 |
+------------------------------+-----------+------+
insert into table3_noorder(a) values(10);
insert into table3_noorder(a,txt) values(0,'最新自增值=>');
select txt,a incre_col,b from table3_noorder order by a;
+------------------------------+-----------+------+
| txt                          | incre_col | b    |
+------------------------------+-----------+------+
| table3_noorder noorder模式   |         1 |    3 |
| table3_noorder noorder模式   |        10 |    3 |
| table3_noorder noorder模式   |       255 |    3 |
| table3_noorder noorder模式   |       255 |    3 |
| table3_noorder noorder模式   |       255 |    3 |
| table3_noorder noorder模式   |       255 |    3 |
| 最新自增值=>                 |       255 |    3 |
+------------------------------+-----------+------+
############ SMALLINT UNSIGNED: 0~65535
drop table table1_default;
create table table1_default (
  a smallint unsigned auto_increment,
  b smallint default 1,
  txt varchar(64) default 'table1_default',
  index (a)
);
drop table table2_order;
create table table2_order (
  a smallint unsigned auto_increment,
  b smallint default 2,
  txt varchar(64) default 'table2_order',
  index (a)
) auto_increment_mode = 'order';
drop table table3_noorder;
create table table3_noorder (
  a smallint unsigned auto_increment,
  b smallint default 3,
  txt varchar(64) default 'table3_noorder',
  index (a)
) auto_increment_mode = 'noorder';
############ auto_incre_3-1 DML操作 ############
###### auto_incre_3-1-1 ①INSERT操作 
##table1_default
insert into table1_default(a) values(null);
select txt,a incre_col,b from table1_default order by a;
+----------------+-----------+------+
| txt            | incre_col | b    |
+----------------+-----------+------+
| table1_default |         1 |    1 |
+----------------+-----------+------+
alter table table1_default AUTO_INCREMENT = 65535;
insert into table1_default(a) values(null);
insert into table1_default(a) values(null),(null);
select txt,a incre_col,b from table1_default order by a;
+----------------+-----------+------+
| txt            | incre_col | b    |
+----------------+-----------+------+
| table1_default |         1 |    1 |
| table1_default |     65535 |    1 |
| table1_default |     65535 |    1 |
| table1_default |     65535 |    1 |
+----------------+-----------+------+
insert into table1_default(a) values(10);
insert into table1_default(a,txt) values(0,'最新自增值=>');
select txt,a incre_col,b from table1_default order by a;
+-------------------+-----------+------+
| txt               | incre_col | b    |
+-------------------+-----------+------+
| table1_default    |         1 |    1 |
| table1_default    |        10 |    1 |
| table1_default    |     65535 |    1 |
| table1_default    |     65535 |    1 |
| table1_default    |     65535 |    1 |
| 最新自增值=>      |     65535 |    1 |
+-------------------+-----------+------+
##table2_order
insert into table2_order(a) values(null);
select txt,a incre_col,b from table2_order order by a;
+--------------+-----------+------+
| txt          | incre_col | b    |
+--------------+-----------+------+
| table2_order |         1 |    2 |
+--------------+-----------+------+
alter table table2_order AUTO_INCREMENT = 65535;
insert into table2_order(a) values(null),(null),(null),(null);
select txt,a incre_col,b from table2_order order by a;
+--------------+-----------+------+
| txt          | incre_col | b    |
+--------------+-----------+------+
| table2_order |         1 |    2 |
| table2_order |     65535 |    2 |
| table2_order |     65535 |    2 |
| table2_order |     65535 |    2 |
| table2_order |     65535 |    2 |
+--------------+-----------+------+
insert into table2_order(a) values(10);
insert into table2_order(a,txt) values(0,'最新自增值=>');
select txt,a incre_col,b from table2_order order by a;
+-------------------+-----------+------+
| txt               | incre_col | b    |
+-------------------+-----------+------+
| table2_order      |         1 |    2 |
| table2_order      |        10 |    2 |
| table2_order      |     65535 |    2 |
| table2_order      |     65535 |    2 |
| table2_order      |     65535 |    2 |
| table2_order      |     65535 |    2 |
| 最新自增值=>      |     65535 |    2 |
+-------------------+-----------+------+
##table3_noorder
insert into table3_noorder(a) values(null);
select txt,a incre_col,b from table3_noorder order by a;
+----------------+-----------+------+
| txt            | incre_col | b    |
+----------------+-----------+------+
| table3_noorder |         1 |    3 |
+----------------+-----------+------+
alter table table3_noorder AUTO_INCREMENT = 65535;
insert into table3_noorder(a) values(null),(null),(null),(null);
select txt,a incre_col,b from table3_noorder order by a;
+----------------+-----------+------+
| txt            | incre_col | b    |
+----------------+-----------+------+
| table3_noorder |         1 |    3 |
| table3_noorder |     65535 |    3 |
| table3_noorder |     65535 |    3 |
| table3_noorder |     65535 |    3 |
| table3_noorder |     65535 |    3 |
+----------------+-----------+------+
insert into table3_noorder(a) values(10);
insert into table3_noorder(a,txt) values(0,'最新自增值=>');
select txt,a incre_col,b from table3_noorder order by a;
+-------------------+-----------+------+
| txt               | incre_col | b    |
+-------------------+-----------+------+
| table3_noorder    |         1 |    3 |
| table3_noorder    |        10 |    3 |
| table3_noorder    |     65535 |    3 |
| table3_noorder    |     65535 |    3 |
| table3_noorder    |     65535 |    3 |
| table3_noorder    |     65535 |    3 |
| 最新自增值=>      |     65535 |    3 |
+-------------------+-----------+------+
############ MEDIUMINT UNSIGNED: 0~16777215
##建表
drop table table1_default;
create table table1_default (
  a mediumint unsigned auto_increment,
  b mediumint default 1,
  txt varchar(64) default 'table1_default',
  index (a)
);
drop table table2_order;
create table table2_order (
  a mediumint unsigned auto_increment,
  b mediumint default 2,
  txt varchar(64) default 'table2_order',
  index (a)
) auto_increment_mode = 'order';
drop table table3_noorder;
create table table3_noorder (
  a mediumint unsigned auto_increment,
  b mediumint default 3,
  txt varchar(64) default 'table3_noorder',
  index (a)
) auto_increment_mode = 'noorder';
############ auto_incre_3-1 DML操作 ############
###### auto_incre_3-1-1 ①INSERT操作 
##table1_default
insert into table1_default(a) values(null);
select txt,a incre_col,b from table1_default order by a;
+----------------+-----------+------+
| txt            | incre_col | b    |
+----------------+-----------+------+
| table1_default |         1 |    1 |
+----------------+-----------+------+
alter table table1_default AUTO_INCREMENT = 16777215;
insert into table1_default(a) values(null),(null),(null),(null);
select txt,a incre_col,b from table1_default order by a;
+----------------+-----------+------+
| txt            | incre_col | b    |
+----------------+-----------+------+
| table1_default |         1 |    1 |
| table1_default |  16777215 |    1 |
| table1_default |  16777215 |    1 |
| table1_default |  16777215 |    1 |
| table1_default |  16777215 |    1 |
+----------------+-----------+------+
insert into table1_default(a) values(10);
insert into table1_default(a,txt) values(0,'最新自增值=>');
select txt,a incre_col,b from table1_default order by a;
+-------------------+-----------+------+
| txt               | incre_col | b    |
+-------------------+-----------+------+
| table1_default    |         1 |    1 |
| table1_default    |        10 |    1 |
| table1_default    |  16777215 |    1 |
| table1_default    |  16777215 |    1 |
| table1_default    |  16777215 |    1 |
| table1_default    |  16777215 |    1 |
| 最新自增值=>      |  16777215 |    1 |
+-------------------+-----------+------+
insert into table1_default(a) values(16777216);
ERROR 22003: Out of range value for column 'a' at row 1
##table2_order
insert into table2_order(a) values(null);
select txt,a incre_col,b from table2_order order by a;
+--------------+-----------+------+
| txt          | incre_col | b    |
+--------------+-----------+------+
| table2_order |         1 |    2 |
+--------------+-----------+------+
alter table table2_order AUTO_INCREMENT = 16777215;
insert into table2_order(a) values(null),(null),(null),(null);
select txt,a incre_col,b from table2_order order by a;
+--------------+-----------+------+
| txt          | incre_col | b    |
+--------------+-----------+------+
| table2_order |         1 |    2 |
| table2_order |  16777215 |    2 |
| table2_order |  16777215 |    2 |
| table2_order |  16777215 |    2 |
| table2_order |  16777215 |    2 |
+--------------+-----------+------+
insert into table2_order(a) values(10);
insert into table2_order(a,txt) values(0,'最新自增值=>');
select txt,a incre_col,b from table2_order order by a;
+-------------------+-----------+------+
| txt               | incre_col | b    |
+-------------------+-----------+------+
| table2_order      |         1 |    2 |
| table2_order      |        10 |    2 |
| table2_order      |  16777215 |    2 |
| table2_order      |  16777215 |    2 |
| table2_order      |  16777215 |    2 |
| table2_order      |  16777215 |    2 |
| 最新自增值=>      |  16777215 |    2 |
+-------------------+-----------+------+
insert into table2_order(a) values(16777216);
ERROR 22003: Out of range value for column 'a' at row 1
##table3_noorder
insert into table3_noorder(a) values(null);
select txt,a incre_col,b from table3_noorder order by a;
+----------------+-----------+------+
| txt            | incre_col | b    |
+----------------+-----------+------+
| table3_noorder |         1 |    3 |
+----------------+-----------+------+
alter table table3_noorder AUTO_INCREMENT = 16777215;
insert into table3_noorder(a) values(null),(null),(null),(null);
select txt,a incre_col,b from table3_noorder order by a;
+----------------+-----------+------+
| txt            | incre_col | b    |
+----------------+-----------+------+
| table3_noorder |         1 |    3 |
| table3_noorder |  16777215 |    3 |
| table3_noorder |  16777215 |    3 |
| table3_noorder |  16777215 |    3 |
| table3_noorder |  16777215 |    3 |
+----------------+-----------+------+
insert into table3_noorder(a) values(10);
insert into table3_noorder(a,txt) values(0,'最新自增值=>');
select txt,a incre_col,b from table3_noorder order by a;
+-------------------+-----------+------+
| txt               | incre_col | b    |
+-------------------+-----------+------+
| table3_noorder    |         1 |    3 |
| table3_noorder    |        10 |    3 |
| table3_noorder    |  16777215 |    3 |
| table3_noorder    |  16777215 |    3 |
| table3_noorder    |  16777215 |    3 |
| table3_noorder    |  16777215 |    3 |
| 最新自增值=>      |  16777215 |    3 |
+-------------------+-----------+------+
insert into table3_noorder(a) values(16777216);
ERROR 22003: Out of range value for column 'a' at row 1
##########################################################################################################################
###### 标签：auto_incre_5
###### 功能：补充场景
##########################################################################################################################
###### 先修改自增列初始值，然后truncate table删除数据，查看自增值
# issue: 42512437 bug2:【auto_increment】order/noorder模式，自增值达到数据类型极限值后，truncate table删除表数据，mysql自增列从头开始计数，ob没有
drop table table1_default;
create table table1_default (
  a int signed auto_increment,
  b int default 1,
  txt varchar(64) default 'table1_default 默认order模式',
  index(a)
);
insert into table1_default(a) values(null),(null),(null),(null);
select txt,a incre_col,b from table1_default order by a;
+----------------------------------+-----------+------+
| txt                              | incre_col | b    |
+----------------------------------+-----------+------+
| table1_default 默认order模式     |         1 |    1 |
| table1_default 默认order模式     |         2 |    1 |
| table1_default 默认order模式     |         3 |    1 |
| table1_default 默认order模式     |         4 |    1 |
+----------------------------------+-----------+------+
alter table table1_default AUTO_INCREMENT = 12345;
truncate table table1_default;
insert into table1_default(a,txt) values(0,'最新自增值2=>');
select txt,a incre_col,b from table1_default order by a;
+--------------------+-----------+------+
| txt                | incre_col | b    |
+--------------------+-----------+------+
| 最新自增值2=>      |         1 |    1 |
+--------------------+-----------+------+
###### 先删除当前最大自增值x，然后修改自增值初始值y(y<=x)
# mysql自增值改变，ob正常递增（没法兼容mysql）
drop table table1_default;
create table table1_default (
  a int signed auto_increment,
  b int default 1,
  txt varchar(64) default 'table1_default 默认order模式',
  index(a)
);
insert into table1_default(a) values(null),(null),(null),(null),(null);
select txt,a incre_col,b from table1_default order by a;
+----------------------------------+-----------+------+
| txt                              | incre_col | b    |
+----------------------------------+-----------+------+
| table1_default 默认order模式     |         1 |    1 |
| table1_default 默认order模式     |         2 |    1 |
| table1_default 默认order模式     |         3 |    1 |
| table1_default 默认order模式     |         4 |    1 |
| table1_default 默认order模式     |         5 |    1 |
+----------------------------------+-----------+------+
delete from table1_default where a >=4;
select txt,a incre_col,b from table1_default order by a;
+----------------------------------+-----------+------+
| txt                              | incre_col | b    |
+----------------------------------+-----------+------+
| table1_default 默认order模式     |         1 |    1 |
| table1_default 默认order模式     |         2 |    1 |
| table1_default 默认order模式     |         3 |    1 |
+----------------------------------+-----------+------+
alter table table1_default auto_increment = 4;
insert into table1_default(a,txt) values(0,'最新自增值=>');
select txt,a incre_col,b from table1_default order by a;
+----------------------------------+-----------+------+
| txt                              | incre_col | b    |
+----------------------------------+-----------+------+
| table1_default 默认order模式     |         1 |    1 |
| table1_default 默认order模式     |         2 |    1 |
| table1_default 默认order模式     |         3 |    1 |
| 最新自增值=>                     |         4 |    1 |
+----------------------------------+-----------+------+
###### 事务中先插入数据，更新自增值大于当前自增值，然后回滚事务，查看自增值
SET @@AUTOCOMMIT=0;
drop table table1_default;
create table table1_default (
  a int not null auto_increment primary key,
  b int default 1,
  txt varchar(64) default 'table1_default',
  unique index(a)
);
insert into table1_default(a) values(0),(0),(0);
select txt,a incre_col, b from table1_default order by a;
+----------------+-----------+------+
| txt            | incre_col | b    |
+----------------+-----------+------+
| table1_default |         1 |    1 |
| table1_default |         2 |    1 |
| table1_default |         3 |    1 |
+----------------+-----------+------+
begin;
insert into table1_default values(0,11,'事务中插入数据'),(0,22,'事务中插入数据'),(0,33,'事务中插入数据');
update table1_default set a=10 ,txt = '事务中修改数据' where b=33;
select txt,a incre_col, b from table1_default order by a;
+-----------------------+-----------+------+
| txt                   | incre_col | b    |
+-----------------------+-----------+------+
| table1_default        |         1 |    1 |
| table1_default        |         2 |    1 |
| table1_default        |         3 |    1 |
| 事务中插入数据        |         4 |   11 |
| 事务中插入数据        |         5 |   22 |
| 事务中修改数据        |        10 |   33 |
+-----------------------+-----------+------+
rollback;
insert into table1_default values(0,11,'当前自增值==>');
select txt,a incre_col, b from table1_default order by a;
+--------------------+-----------+------+
| txt                | incre_col | b    |
+--------------------+-----------+------+
| table1_default     |         1 |    1 |
| table1_default     |         2 |    1 |
| table1_default     |         3 |    1 |
| 当前自增值==>      |         7 |   11 |
+--------------------+-----------+------+
drop table table1_default;
drop table table2_order;
drop table table3_noorder;
drop table table0_date;
# Clean up users
drop user whh@'%';
drop database if exists whh ;
