purge recyclebin;
result_format: 4
drop user whh@'%';
drop database if exists whh ;
create user whh identified by 'whh';
create database whh ;
grant all on *.* to whh with grant option;


##测试每种场合时，起始条件可能不同，可以删除再重新创建表
set sql_mode='strict_all_tables,no_zero_in_date';
alter system set default_auto_increment_mode = 'noorder';
##########################################################################################################################
###### 标签：auto_incre_1-1，auto_incre_1-2，auto_incre_2-1，auto_incre_2-2，auto_incre_2-3，auto_incre_3-1
###### 功能：数据类型（BIGINT、TINYINT），普通表（普通索引，复合索引），自增模式，DML操作 
########################################################################################################################## 
############ auto_incre_1-2-1，auto_incre_1-2-2 
############ 索引 - 普通索引，约束 - 唯一约束
############ BIGINT 类型 
##建表
drop table table1_default;
drop table table2_order;
drop table table3_noorder;
drop table table0_date;
create table table0_date (
  a bigint unique auto_increment,
  b bigint default 0,
  txt varchar(64) default 'table0_date'
);
insert into table0_date(a) values(100),(101),(102),(103),(104),(105);
drop table table1_default;
create table table1_default (
  a bigint unique auto_increment,
  b bigint default 1,
  txt varchar(64) default 'table1_default 默认noorder模式',
  index(a)
);
drop table table2_order;
create table table2_order (
  a bigint unique auto_increment,
  b bigint default 2,
  txt varchar(64) default 'table2_order order模式',
 index(a)
) auto_increment_mode = 'order';
drop table table3_noorder;
create table table3_noorder (
  a bigint unique auto_increment,
  b bigint default 3,
  txt varchar(64) default 'table3_noorder noorder模式',
 index(a)
) auto_increment_mode = 'noorder';
############ auto_incre_3-1 DML操作 ############
###### auto_incre_3-1-1 ①INSERT操作 
##简单插入
##INSERT 语句
##table1_default
insert into table1_default(a) values(null);
select txt,a incre_col,b from table1_default order by a;
+------------------------------------+-----------+------+
| txt                                | incre_col | b    |
+------------------------------------+-----------+------+
| table1_default 默认noorder模式     |         1 |    1 |
+------------------------------------+-----------+------+
insert into table1_default(a) values(null),(null),(null);
select txt,a incre_col,b from table1_default order by a;
+------------------------------------+-----------+------+
| txt                                | incre_col | b    |
+------------------------------------+-----------+------+
| table1_default 默认noorder模式     |         1 |    1 |
| table1_default 默认noorder模式     |         2 |    1 |
| table1_default 默认noorder模式     |         3 |    1 |
| table1_default 默认noorder模式     |         4 |    1 |
+------------------------------------+-----------+------+
insert into table1_default(a) values(10);
insert into table1_default(a,txt) values(0,'最新自增值=>');
select txt,a incre_col,b from table1_default order by a;
+------------------------------------+-----------+------+
| txt                                | incre_col | b    |
+------------------------------------+-----------+------+
| table1_default 默认noorder模式     |         1 |    1 |
| table1_default 默认noorder模式     |         2 |    1 |
| table1_default 默认noorder模式     |         3 |    1 |
| table1_default 默认noorder模式     |         4 |    1 |
| table1_default 默认noorder模式     |        10 |    1 |
| 最新自增值=>                       |   1000001 |    1 |
+------------------------------------+-----------+------+
##table2_order
insert into table2_order(a) values(null);
select txt,a incre_col,b from table2_order order by a;
+--------------------------+-----------+------+
| txt                      | incre_col | b    |
+--------------------------+-----------+------+
| table2_order order模式   |         1 |    2 |
+--------------------------+-----------+------+
insert into table2_order(a) values(null),(null),(null);
select txt,a incre_col,b from table2_order order by a;
+--------------------------+-----------+------+
| txt                      | incre_col | b    |
+--------------------------+-----------+------+
| table2_order order模式   |         1 |    2 |
| table2_order order模式   |         2 |    2 |
| table2_order order模式   |         3 |    2 |
| table2_order order模式   |         4 |    2 |
+--------------------------+-----------+------+
insert into table2_order(a) values(10);
insert into table2_order(a,txt) values(0,'最新自增值=>');
select txt,a incre_col,b from table2_order order by a;
+--------------------------+-----------+------+
| txt                      | incre_col | b    |
+--------------------------+-----------+------+
| table2_order order模式   |         1 |    2 |
| table2_order order模式   |         2 |    2 |
| table2_order order模式   |         3 |    2 |
| table2_order order模式   |         4 |    2 |
| table2_order order模式   |        10 |    2 |
| 最新自增值=>             |        11 |    2 |
+--------------------------+-----------+------+
##table3_noorder
insert into table3_noorder(a) values(null);
select txt,a incre_col,b from table3_noorder order by a;
+------------------------------+-----------+------+
| txt                          | incre_col | b    |
+------------------------------+-----------+------+
| table3_noorder noorder模式   |         1 |    3 |
+------------------------------+-----------+------+
insert into table3_noorder(a) values(null),(null),(null);
select txt,a incre_col,b from table3_noorder order by a;
+------------------------------+-----------+------+
| txt                          | incre_col | b    |
+------------------------------+-----------+------+
| table3_noorder noorder模式   |         1 |    3 |
| table3_noorder noorder模式   |         2 |    3 |
| table3_noorder noorder模式   |         3 |    3 |
| table3_noorder noorder模式   |         4 |    3 |
+------------------------------+-----------+------+
insert into table3_noorder(a) values(10);
insert into table3_noorder(a,txt) values(0,'最新自增值=>');
select txt,a incre_col,b from table3_noorder order by a;
+------------------------------+-----------+------+
| txt                          | incre_col | b    |
+------------------------------+-----------+------+
| table3_noorder noorder模式   |         1 |    3 |
| table3_noorder noorder模式   |         2 |    3 |
| table3_noorder noorder模式   |         3 |    3 |
| table3_noorder noorder模式   |         4 |    3 |
| table3_noorder noorder模式   |        10 |    3 |
| 最新自增值=>                 |   1000001 |    3 |
+------------------------------+-----------+------+
##REPLACE 语句
replace into table1_default(a) values(0),(0),(0);
select txt,a incre_col,b from table1_default order by a;
+------------------------------------+-----------+------+
| txt                                | incre_col | b    |
+------------------------------------+-----------+------+
| table1_default 默认noorder模式     |         1 |    1 |
| table1_default 默认noorder模式     |         2 |    1 |
| table1_default 默认noorder模式     |         3 |    1 |
| table1_default 默认noorder模式     |         4 |    1 |
| table1_default 默认noorder模式     |        10 |    1 |
| 最新自增值=>                       |   1000001 |    1 |
| table1_default 默认noorder模式     |   1000002 |    1 |
| table1_default 默认noorder模式     |   1000003 |    1 |
| table1_default 默认noorder模式     |   1000004 |    1 |
+------------------------------------+-----------+------+
replace into table1_default values(5,22,'replace');
insert into table1_default(a,txt) values(0,'最新自增值=>');
select txt,a incre_col,b from table1_default order by a;
+------------------------------------+-----------+------+
| txt                                | incre_col | b    |
+------------------------------------+-----------+------+
| table1_default 默认noorder模式     |         1 |    1 |
| table1_default 默认noorder模式     |         2 |    1 |
| table1_default 默认noorder模式     |         3 |    1 |
| table1_default 默认noorder模式     |         4 |    1 |
| replace                            |         5 |   22 |
| table1_default 默认noorder模式     |        10 |    1 |
| 最新自增值=>                       |   1000001 |    1 |
| table1_default 默认noorder模式     |   1000002 |    1 |
| table1_default 默认noorder模式     |   1000003 |    1 |
| table1_default 默认noorder模式     |   1000004 |    1 |
| 最新自增值=>                       |   1000005 |    1 |
+------------------------------------+-----------+------+
replace into table2_order(a) values(0),(0),(0);
select txt,a incre_col,b from table2_order order by a;
+--------------------------+-----------+------+
| txt                      | incre_col | b    |
+--------------------------+-----------+------+
| table2_order order模式   |         1 |    2 |
| table2_order order模式   |         2 |    2 |
| table2_order order模式   |         3 |    2 |
| table2_order order模式   |         4 |    2 |
| table2_order order模式   |        10 |    2 |
| 最新自增值=>             |        11 |    2 |
| table2_order order模式   |        12 |    2 |
| table2_order order模式   |        13 |    2 |
| table2_order order模式   |        14 |    2 |
+--------------------------+-----------+------+
replace into table2_order values(5,22,'replace');
insert into table2_order(a,txt) values(0,'最新自增值=>');
select txt,a incre_col,b from table2_order order by a;
+--------------------------+-----------+------+
| txt                      | incre_col | b    |
+--------------------------+-----------+------+
| table2_order order模式   |         1 |    2 |
| table2_order order模式   |         2 |    2 |
| table2_order order模式   |         3 |    2 |
| table2_order order模式   |         4 |    2 |
| replace                  |         5 |   22 |
| table2_order order模式   |        10 |    2 |
| 最新自增值=>             |        11 |    2 |
| table2_order order模式   |        12 |    2 |
| table2_order order模式   |        13 |    2 |
| table2_order order模式   |        14 |    2 |
| 最新自增值=>             |        15 |    2 |
+--------------------------+-----------+------+
replace into table3_noorder(a) values(null),(null),(null);
select txt,a incre_col,b from table3_noorder order by a;
+------------------------------+-----------+------+
| txt                          | incre_col | b    |
+------------------------------+-----------+------+
| table3_noorder noorder模式   |         1 |    3 |
| table3_noorder noorder模式   |         2 |    3 |
| table3_noorder noorder模式   |         3 |    3 |
| table3_noorder noorder模式   |         4 |    3 |
| table3_noorder noorder模式   |        10 |    3 |
| 最新自增值=>                 |   1000001 |    3 |
| table3_noorder noorder模式   |   1000002 |    3 |
| table3_noorder noorder模式   |   1000003 |    3 |
| table3_noorder noorder模式   |   1000004 |    3 |
+------------------------------+-----------+------+
replace into table3_noorder values(5,22,'replace');
insert into table3_noorder(a,txt) values(0,'最新自增值=>');
select txt,a incre_col,b from table3_noorder order by a;
+------------------------------+-----------+------+
| txt                          | incre_col | b    |
+------------------------------+-----------+------+
| table3_noorder noorder模式   |         1 |    3 |
| table3_noorder noorder模式   |         2 |    3 |
| table3_noorder noorder模式   |         3 |    3 |
| table3_noorder noorder模式   |         4 |    3 |
| replace                      |         5 |   22 |
| table3_noorder noorder模式   |        10 |    3 |
| 最新自增值=>                 |   1000001 |    3 |
| table3_noorder noorder模式   |   1000002 |    3 |
| table3_noorder noorder模式   |   1000003 |    3 |
| table3_noorder noorder模式   |   1000004 |    3 |
| 最新自增值=>                 |   1000005 |    3 |
+------------------------------+-----------+------+
##测试点 - 将任何其他值插入 AUTO_INCREMENT列
##INSERT 语句
truncate table table1_default;
insert into table1_default(a) values(15),(-25),(35),(45.5);
insert into table1_default(a,txt) values(0,'最新自增值=>');
select txt,a incre_col,b from table1_default order by a;
+------------------------------------+-----------+------+
| txt                                | incre_col | b    |
+------------------------------------+-----------+------+
| table1_default 默认noorder模式     |       -25 |    1 |
| table1_default 默认noorder模式     |        15 |    1 |
| table1_default 默认noorder模式     |        35 |    1 |
| table1_default 默认noorder模式     |        46 |    1 |
| 最新自增值=>                       |   1000001 |    1 |
+------------------------------------+-----------+------+
truncate table table2_order;
insert into table2_order(a) values(15),(-25),(35),(45.5);
insert into table2_order(a,txt) values(0,'最新自增值=>');
select txt,a incre_col,b from table2_order order by a;
+--------------------------+-----------+------+
| txt                      | incre_col | b    |
+--------------------------+-----------+------+
| table2_order order模式   |       -25 |    2 |
| table2_order order模式   |        15 |    2 |
| table2_order order模式   |        35 |    2 |
| table2_order order模式   |        46 |    2 |
| 最新自增值=>             |        47 |    2 |
+--------------------------+-----------+------+
truncate table table3_noorder;
insert into table3_noorder(a) values(15),(-25),(35),(45.5);
insert into table3_noorder(a,txt) values(0,'最新自增值=>');
select txt,a incre_col,b from table3_noorder order by a;
+------------------------------+-----------+------+
| txt                          | incre_col | b    |
+------------------------------+-----------+------+
| table3_noorder noorder模式   |       -25 |    3 |
| table3_noorder noorder模式   |        15 |    3 |
| table3_noorder noorder模式   |        35 |    3 |
| table3_noorder noorder模式   |        46 |    3 |
| 最新自增值=>                 |   1000001 |    3 |
+------------------------------+-----------+------+
##REPLACE 语句
replace into table1_default(a,txt) values(3,'new-3'),(-5,'new--5'),(10,'new-10'),(15.5,'new-15.5');
select txt,a incre_col,b from table1_default order by a;
+------------------------------------+-----------+------+
| txt                                | incre_col | b    |
+------------------------------------+-----------+------+
| table1_default 默认noorder模式     |       -25 |    1 |
| new--5                             |        -5 |    1 |
| new-3                              |         3 |    1 |
| new-10                             |        10 |    1 |
| table1_default 默认noorder模式     |        15 |    1 |
| new-15.5                           |        16 |    1 |
| table1_default 默认noorder模式     |        35 |    1 |
| table1_default 默认noorder模式     |        46 |    1 |
| 最新自增值=>                       |   1000001 |    1 |
+------------------------------------+-----------+------+
insert into table1_default(a,txt) values(0,'最新自增值=>');
select txt,a incre_col,b from table1_default order by a;
+------------------------------------+-----------+------+
| txt                                | incre_col | b    |
+------------------------------------+-----------+------+
| table1_default 默认noorder模式     |       -25 |    1 |
| new--5                             |        -5 |    1 |
| new-3                              |         3 |    1 |
| new-10                             |        10 |    1 |
| table1_default 默认noorder模式     |        15 |    1 |
| new-15.5                           |        16 |    1 |
| table1_default 默认noorder模式     |        35 |    1 |
| table1_default 默认noorder模式     |        46 |    1 |
| 最新自增值=>                       |   1000001 |    1 |
| 最新自增值=>                       |   1000002 |    1 |
+------------------------------------+-----------+------+
replace into table2_order(a,txt) values(3,'new-3'),(-5,'new--5'),(10,'new-10'),(15.5,'new-15.5');
select txt,a incre_col,b from table2_order order by a;
+--------------------------+-----------+------+
| txt                      | incre_col | b    |
+--------------------------+-----------+------+
| table2_order order模式   |       -25 |    2 |
| new--5                   |        -5 |    2 |
| new-3                    |         3 |    2 |
| new-10                   |        10 |    2 |
| table2_order order模式   |        15 |    2 |
| new-15.5                 |        16 |    2 |
| table2_order order模式   |        35 |    2 |
| table2_order order模式   |        46 |    2 |
| 最新自增值=>             |        47 |    2 |
+--------------------------+-----------+------+
insert into table2_order(a,txt) values(0,'最新自增值=>');
select txt,a incre_col,b from table2_order order by a;
+--------------------------+-----------+------+
| txt                      | incre_col | b    |
+--------------------------+-----------+------+
| table2_order order模式   |       -25 |    2 |
| new--5                   |        -5 |    2 |
| new-3                    |         3 |    2 |
| new-10                   |        10 |    2 |
| table2_order order模式   |        15 |    2 |
| new-15.5                 |        16 |    2 |
| table2_order order模式   |        35 |    2 |
| table2_order order模式   |        46 |    2 |
| 最新自增值=>             |        47 |    2 |
| 最新自增值=>             |        48 |    2 |
+--------------------------+-----------+------+
replace into table3_noorder(a,txt) values(3,'new-3'),(-5,'new--5'),(10,'new-10'),(15.5,'new-15.5');
select txt,a incre_col,b from table3_noorder order by a;
+------------------------------+-----------+------+
| txt                          | incre_col | b    |
+------------------------------+-----------+------+
| table3_noorder noorder模式   |       -25 |    3 |
| new--5                       |        -5 |    3 |
| new-3                        |         3 |    3 |
| new-10                       |        10 |    3 |
| table3_noorder noorder模式   |        15 |    3 |
| new-15.5                     |        16 |    3 |
| table3_noorder noorder模式   |        35 |    3 |
| table3_noorder noorder模式   |        46 |    3 |
| 最新自增值=>                 |   1000001 |    3 |
+------------------------------+-----------+------+
insert into table3_noorder(a,txt) values(0,'最新自增值=>');
select txt,a incre_col,b from table3_noorder order by a;
+------------------------------+-----------+------+
| txt                          | incre_col | b    |
+------------------------------+-----------+------+
| table3_noorder noorder模式   |       -25 |    3 |
| new--5                       |        -5 |    3 |
| new-3                        |         3 |    3 |
| new-10                       |        10 |    3 |
| table3_noorder noorder模式   |        15 |    3 |
| new-15.5                     |        16 |    3 |
| table3_noorder noorder模式   |        35 |    3 |
| table3_noorder noorder模式   |        46 |    3 |
| 最新自增值=>                 |   1000001 |    3 |
| 最新自增值=>                 |   1000002 |    3 |
+------------------------------+-----------+------+
##测试点 - 给AUTO_INCREMENT列插入下一个自增值（当前最大自增值+1），再查看最新自增值
##INSERT 语句
truncate table table1_default;
insert into table1_default(a) values(0);
insert into table1_default(a,txt) values(2,'插入下一个自增值2（当前最大自增值+1）');
insert into table1_default(a,txt) values(0,'最新自增值=>');
select txt,a incre_col,b from table1_default order by a;
+--------------------------------------------------------+-----------+------+
| txt                                                    | incre_col | b    |
+--------------------------------------------------------+-----------+------+
| table1_default 默认noorder模式                         |         1 |    1 |
| 插入下一个自增值2（当前最大自增值+1）                  |         2 |    1 |
| 最新自增值=>                                           |   1000001 |    1 |
+--------------------------------------------------------+-----------+------+
truncate table table2_order;
insert into table2_order(a) values(0);
insert into table2_order(a,txt) values(2,'插入下一个自增值2（当前最大自增值+1）');
insert into table2_order(a,txt) values(0,'最新自增值=>');
select txt,a incre_col,b from table2_order order by a;
+--------------------------------------------------------+-----------+------+
| txt                                                    | incre_col | b    |
+--------------------------------------------------------+-----------+------+
| table2_order order模式                                 |         1 |    2 |
| 插入下一个自增值2（当前最大自增值+1）                  |         2 |    2 |
| 最新自增值=>                                           |         3 |    2 |
+--------------------------------------------------------+-----------+------+
truncate table table3_noorder;
insert into table3_noorder(a) values(0);
insert into table3_noorder(a,txt) values(2,'插入下一个自增值2（当前最大自增值+1）');
insert into table3_noorder(a,txt) values(0,'最新自增值=>');
select txt,a incre_col,b from table3_noorder order by a;
+--------------------------------------------------------+-----------+------+
| txt                                                    | incre_col | b    |
+--------------------------------------------------------+-----------+------+
| table3_noorder noorder模式                             |         1 |    3 |
| 插入下一个自增值2（当前最大自增值+1）                  |         2 |    3 |
| 最新自增值=>                                           |   1000001 |    3 |
+--------------------------------------------------------+-----------+------+
##REPLACE 语句
replace into table1_default(a,txt) values(4,'插入下一个自增值4（当前最大自增值+1）');
insert into table1_default(a,txt) values(0,'最新自增值=>');
select txt,a incre_col,b from table1_default order by a;
+--------------------------------------------------------+-----------+------+
| txt                                                    | incre_col | b    |
+--------------------------------------------------------+-----------+------+
| table1_default 默认noorder模式                         |         1 |    1 |
| 插入下一个自增值2（当前最大自增值+1）                  |         2 |    1 |
| 插入下一个自增值4（当前最大自增值+1）                  |         4 |    1 |
| 最新自增值=>                                           |   1000001 |    1 |
| 最新自增值=>                                           |   1000002 |    1 |
+--------------------------------------------------------+-----------+------+
replace into table2_order(a,txt) values(4,'插入下一个自增值4（当前最大自增值+1）');
insert into table2_order(a,txt) values(0,'最新自增值=>');
select txt,a incre_col,b from table2_order order by a;
+--------------------------------------------------------+-----------+------+
| txt                                                    | incre_col | b    |
+--------------------------------------------------------+-----------+------+
| table2_order order模式                                 |         1 |    2 |
| 插入下一个自增值2（当前最大自增值+1）                  |         2 |    2 |
| 最新自增值=>                                           |         3 |    2 |
| 插入下一个自增值4（当前最大自增值+1）                  |         4 |    2 |
| 最新自增值=>                                           |         5 |    2 |
+--------------------------------------------------------+-----------+------+
replace into table3_noorder(a,txt) values(1000002,'插入下一个自增值2（当前最大自增值+1）');
insert into table3_noorder(a,txt) values(0,'最新自增值=>');
select txt,a incre_col,b from table3_noorder order by a;
+--------------------------------------------------------+-----------+------+
| txt                                                    | incre_col | b    |
+--------------------------------------------------------+-----------+------+
| table3_noorder noorder模式                             |         1 |    3 |
| 插入下一个自增值2（当前最大自增值+1）                  |         2 |    3 |
| 最新自增值=>                                           |   1000001 |    3 |
| 插入下一个自增值2（当前最大自增值+1）                  |   1000002 |    3 |
| 最新自增值=>                                           |   2000001 |    3 |
+--------------------------------------------------------+-----------+------+
##测试点 - 给表插入数据时引用AUTO_INCREMENT列的值
##INSERT 语句
insert into table1_default values(null,a*2,'引用AUTO_INCREMENT列的值');
insert into table1_default(a,txt) values(0,'最新自增值=>');
select txt,a incre_col,b from table1_default order by a;
+--------------------------------------------------------+-----------+---------+
| txt                                                    | incre_col | b       |
+--------------------------------------------------------+-----------+---------+
| table1_default 默认noorder模式                         |         1 |       1 |
| 插入下一个自增值2（当前最大自增值+1）                  |         2 |       1 |
| 插入下一个自增值4（当前最大自增值+1）                  |         4 |       1 |
| 最新自增值=>                                           |   1000001 |       1 |
| 最新自增值=>                                           |   1000002 |       1 |
| 引用AUTO_INCREMENT列的值                               |   1000003 | 2000006 |
| 最新自增值=>                                           |   2000001 |       1 |
+--------------------------------------------------------+-----------+---------+
insert into table2_order values(null,a*2,'引用AUTO_INCREMENT列的值');
insert into table2_order(a,txt) values(0,'最新自增值=>');
select txt,a incre_col,b from table2_order order by a;
+--------------------------------------------------------+-----------+------+
| txt                                                    | incre_col | b    |
+--------------------------------------------------------+-----------+------+
| table2_order order模式                                 |         1 |    2 |
| 插入下一个自增值2（当前最大自增值+1）                  |         2 |    2 |
| 最新自增值=>                                           |         3 |    2 |
| 插入下一个自增值4（当前最大自增值+1）                  |         4 |    2 |
| 最新自增值=>                                           |         5 |    2 |
| 引用AUTO_INCREMENT列的值                               |         6 |   12 |
| 最新自增值=>                                           |         7 |    2 |
+--------------------------------------------------------+-----------+------+
insert into table3_noorder values(null,a*2,'引用AUTO_INCREMENT列的值');
insert into table3_noorder(a,txt) values(0,'最新自增值=>');
select txt,a incre_col,b from table3_noorder order by a;
+--------------------------------------------------------+-----------+---------+
| txt                                                    | incre_col | b       |
+--------------------------------------------------------+-----------+---------+
| table3_noorder noorder模式                             |         1 |       3 |
| 插入下一个自增值2（当前最大自增值+1）                  |         2 |       3 |
| 最新自增值=>                                           |   1000001 |       3 |
| 插入下一个自增值2（当前最大自增值+1）                  |   1000002 |       3 |
| 最新自增值=>                                           |   2000001 |       3 |
| 引用AUTO_INCREMENT列的值                               |   2000002 | 4000004 |
| 最新自增值=>                                           |   3000001 |       3 |
+--------------------------------------------------------+-----------+---------+
##REPLACE 语句
replace into table1_default values(null,a*2,'引用AUTO_INCREMENT列的值');
insert into table1_default(a,txt) values(0,'最新自增值=>');
select txt,a incre_col,b from table1_default order by a;
+--------------------------------------------------------+-----------+---------+
| txt                                                    | incre_col | b       |
+--------------------------------------------------------+-----------+---------+
| table1_default 默认noorder模式                         |         1 |       1 |
| 插入下一个自增值2（当前最大自增值+1）                  |         2 |       1 |
| 插入下一个自增值4（当前最大自增值+1）                  |         4 |       1 |
| 最新自增值=>                                           |   1000001 |       1 |
| 最新自增值=>                                           |   1000002 |       1 |
| 引用AUTO_INCREMENT列的值                               |   1000003 | 2000006 |
| 最新自增值=>                                           |   2000001 |       1 |
| 引用AUTO_INCREMENT列的值                               |   2000002 | 4000004 |
| 最新自增值=>                                           |   3000001 |       1 |
+--------------------------------------------------------+-----------+---------+
replace into table2_order values(null,a*2,'引用AUTO_INCREMENT列的值');
insert into table2_order(a,txt) values(0,'最新自增值=>');
select txt,a incre_col,b from table2_order order by a;
+--------------------------------------------------------+-----------+------+
| txt                                                    | incre_col | b    |
+--------------------------------------------------------+-----------+------+
| table2_order order模式                                 |         1 |    2 |
| 插入下一个自增值2（当前最大自增值+1）                  |         2 |    2 |
| 最新自增值=>                                           |         3 |    2 |
| 插入下一个自增值4（当前最大自增值+1）                  |         4 |    2 |
| 最新自增值=>                                           |         5 |    2 |
| 引用AUTO_INCREMENT列的值                               |         6 |   12 |
| 最新自增值=>                                           |         7 |    2 |
| 引用AUTO_INCREMENT列的值                               |         8 |   16 |
| 最新自增值=>                                           |         9 |    2 |
+--------------------------------------------------------+-----------+------+
replace into table3_noorder values(null,a*2,'引用AUTO_INCREMENT列的值');
insert into table3_noorder(a,txt) values(0,'最新自增值=>');
select txt,a incre_col,b from table3_noorder order by a;
+--------------------------------------------------------+-----------+---------+
| txt                                                    | incre_col | b       |
+--------------------------------------------------------+-----------+---------+
| table3_noorder noorder模式                             |         1 |       3 |
| 插入下一个自增值2（当前最大自增值+1）                  |         2 |       3 |
| 最新自增值=>                                           |   1000001 |       3 |
| 插入下一个自增值2（当前最大自增值+1）                  |   1000002 |       3 |
| 最新自增值=>                                           |   2000001 |       3 |
| 引用AUTO_INCREMENT列的值                               |   2000002 | 4000004 |
| 最新自增值=>                                           |   3000001 |       3 |
| 引用AUTO_INCREMENT列的值                               |   3000002 | 6000004 |
| 最新自增值=>                                           |   4000001 |       3 |
+--------------------------------------------------------+-----------+---------+
##批量插入
##INSERT ... SELECT语句
insert into table1_default select a,b,txt from table0_date where a <= 102;
select txt,a incre_col,b from table1_default order by a;
+--------------------------------------------------------+-----------+---------+
| txt                                                    | incre_col | b       |
+--------------------------------------------------------+-----------+---------+
| table1_default 默认noorder模式                         |         1 |       1 |
| 插入下一个自增值2（当前最大自增值+1）                  |         2 |       1 |
| 插入下一个自增值4（当前最大自增值+1）                  |         4 |       1 |
| table0_date                                            |       100 |       0 |
| table0_date                                            |       101 |       0 |
| table0_date                                            |       102 |       0 |
| 最新自增值=>                                           |   1000001 |       1 |
| 最新自增值=>                                           |   1000002 |       1 |
| 引用AUTO_INCREMENT列的值                               |   1000003 | 2000006 |
| 最新自增值=>                                           |   2000001 |       1 |
| 引用AUTO_INCREMENT列的值                               |   2000002 | 4000004 |
| 最新自增值=>                                           |   3000001 |       1 |
+--------------------------------------------------------+-----------+---------+
insert into table1_default(a,txt) values(0,'最新自增值=>');
select txt,a incre_col,b from table1_default order by a;
+--------------------------------------------------------+-----------+---------+
| txt                                                    | incre_col | b       |
+--------------------------------------------------------+-----------+---------+
| table1_default 默认noorder模式                         |         1 |       1 |
| 插入下一个自增值2（当前最大自增值+1）                  |         2 |       1 |
| 插入下一个自增值4（当前最大自增值+1）                  |         4 |       1 |
| table0_date                                            |       100 |       0 |
| table0_date                                            |       101 |       0 |
| table0_date                                            |       102 |       0 |
| 最新自增值=>                                           |   1000001 |       1 |
| 最新自增值=>                                           |   1000002 |       1 |
| 引用AUTO_INCREMENT列的值                               |   1000003 | 2000006 |
| 最新自增值=>                                           |   2000001 |       1 |
| 引用AUTO_INCREMENT列的值                               |   2000002 | 4000004 |
| 最新自增值=>                                           |   3000001 |       1 |
| 最新自增值=>                                           |   3000002 |       1 |
+--------------------------------------------------------+-----------+---------+
insert into table2_order select a,b,txt from table0_date where a <= 102;
select txt,a incre_col,b from table2_order order by a;
+--------------------------------------------------------+-----------+------+
| txt                                                    | incre_col | b    |
+--------------------------------------------------------+-----------+------+
| table2_order order模式                                 |         1 |    2 |
| 插入下一个自增值2（当前最大自增值+1）                  |         2 |    2 |
| 最新自增值=>                                           |         3 |    2 |
| 插入下一个自增值4（当前最大自增值+1）                  |         4 |    2 |
| 最新自增值=>                                           |         5 |    2 |
| 引用AUTO_INCREMENT列的值                               |         6 |   12 |
| 最新自增值=>                                           |         7 |    2 |
| 引用AUTO_INCREMENT列的值                               |         8 |   16 |
| 最新自增值=>                                           |         9 |    2 |
| table0_date                                            |       100 |    0 |
| table0_date                                            |       101 |    0 |
| table0_date                                            |       102 |    0 |
+--------------------------------------------------------+-----------+------+
insert into table2_order(a,txt) values(0,'最新自增值=>');
select txt,a incre_col,b from table2_order order by a;
+--------------------------------------------------------+-----------+------+
| txt                                                    | incre_col | b    |
+--------------------------------------------------------+-----------+------+
| table2_order order模式                                 |         1 |    2 |
| 插入下一个自增值2（当前最大自增值+1）                  |         2 |    2 |
| 最新自增值=>                                           |         3 |    2 |
| 插入下一个自增值4（当前最大自增值+1）                  |         4 |    2 |
| 最新自增值=>                                           |         5 |    2 |
| 引用AUTO_INCREMENT列的值                               |         6 |   12 |
| 最新自增值=>                                           |         7 |    2 |
| 引用AUTO_INCREMENT列的值                               |         8 |   16 |
| 最新自增值=>                                           |         9 |    2 |
| table0_date                                            |       100 |    0 |
| table0_date                                            |       101 |    0 |
| table0_date                                            |       102 |    0 |
| 最新自增值=>                                           |       103 |    2 |
+--------------------------------------------------------+-----------+------+
insert into table3_noorder select a,b,txt from table0_date where a <= 102;
select txt,a incre_col,b from table3_noorder order by a;
+--------------------------------------------------------+-----------+---------+
| txt                                                    | incre_col | b       |
+--------------------------------------------------------+-----------+---------+
| table3_noorder noorder模式                             |         1 |       3 |
| 插入下一个自增值2（当前最大自增值+1）                  |         2 |       3 |
| table0_date                                            |       100 |       0 |
| table0_date                                            |       101 |       0 |
| table0_date                                            |       102 |       0 |
| 最新自增值=>                                           |   1000001 |       3 |
| 插入下一个自增值2（当前最大自增值+1）                  |   1000002 |       3 |
| 最新自增值=>                                           |   2000001 |       3 |
| 引用AUTO_INCREMENT列的值                               |   2000002 | 4000004 |
| 最新自增值=>                                           |   3000001 |       3 |
| 引用AUTO_INCREMENT列的值                               |   3000002 | 6000004 |
| 最新自增值=>                                           |   4000001 |       3 |
+--------------------------------------------------------+-----------+---------+
insert into table3_noorder(a,txt) values(0,'最新自增值=>');
select txt,a incre_col,b from table3_noorder order by a;
+--------------------------------------------------------+-----------+---------+
| txt                                                    | incre_col | b       |
+--------------------------------------------------------+-----------+---------+
| table3_noorder noorder模式                             |         1 |       3 |
| 插入下一个自增值2（当前最大自增值+1）                  |         2 |       3 |
| table0_date                                            |       100 |       0 |
| table0_date                                            |       101 |       0 |
| table0_date                                            |       102 |       0 |
| 最新自增值=>                                           |   1000001 |       3 |
| 插入下一个自增值2（当前最大自增值+1）                  |   1000002 |       3 |
| 最新自增值=>                                           |   2000001 |       3 |
| 引用AUTO_INCREMENT列的值                               |   2000002 | 4000004 |
| 最新自增值=>                                           |   3000001 |       3 |
| 引用AUTO_INCREMENT列的值                               |   3000002 | 6000004 |
| 最新自增值=>                                           |   4000001 |       3 |
| 最新自增值=>                                           |   4000002 |       3 |
+--------------------------------------------------------+-----------+---------+
##REPLACE ... SELECT语句
replace into table1_default select a,b,txt from table0_date where a >= 102;
select txt,a incre_col,b from table1_default order by a;
+--------------------------------------------------------+-----------+---------+
| txt                                                    | incre_col | b       |
+--------------------------------------------------------+-----------+---------+
| table1_default 默认noorder模式                         |         1 |       1 |
| 插入下一个自增值2（当前最大自增值+1）                  |         2 |       1 |
| 插入下一个自增值4（当前最大自增值+1）                  |         4 |       1 |
| table0_date                                            |       100 |       0 |
| table0_date                                            |       101 |       0 |
| table0_date                                            |       102 |       0 |
| table0_date                                            |       103 |       0 |
| table0_date                                            |       104 |       0 |
| table0_date                                            |       105 |       0 |
| 最新自增值=>                                           |   1000001 |       1 |
| 最新自增值=>                                           |   1000002 |       1 |
| 引用AUTO_INCREMENT列的值                               |   1000003 | 2000006 |
| 最新自增值=>                                           |   2000001 |       1 |
| 引用AUTO_INCREMENT列的值                               |   2000002 | 4000004 |
| 最新自增值=>                                           |   3000001 |       1 |
| 最新自增值=>                                           |   3000002 |       1 |
+--------------------------------------------------------+-----------+---------+
insert into table1_default(a,txt) values(0,'最新自增值=>');
select txt,a incre_col,b from table1_default order by a;
+--------------------------------------------------------+-----------+---------+
| txt                                                    | incre_col | b       |
+--------------------------------------------------------+-----------+---------+
| table1_default 默认noorder模式                         |         1 |       1 |
| 插入下一个自增值2（当前最大自增值+1）                  |         2 |       1 |
| 插入下一个自增值4（当前最大自增值+1）                  |         4 |       1 |
| table0_date                                            |       100 |       0 |
| table0_date                                            |       101 |       0 |
| table0_date                                            |       102 |       0 |
| table0_date                                            |       103 |       0 |
| table0_date                                            |       104 |       0 |
| table0_date                                            |       105 |       0 |
| 最新自增值=>                                           |   1000001 |       1 |
| 最新自增值=>                                           |   1000002 |       1 |
| 引用AUTO_INCREMENT列的值                               |   1000003 | 2000006 |
| 最新自增值=>                                           |   2000001 |       1 |
| 引用AUTO_INCREMENT列的值                               |   2000002 | 4000004 |
| 最新自增值=>                                           |   3000001 |       1 |
| 最新自增值=>                                           |   3000002 |       1 |
| 最新自增值=>                                           |   3000003 |       1 |
+--------------------------------------------------------+-----------+---------+
replace into table2_order select a,b,txt from table0_date where a >= 102;
select txt,a incre_col,b from table2_order order by a;
+--------------------------------------------------------+-----------+------+
| txt                                                    | incre_col | b    |
+--------------------------------------------------------+-----------+------+
| table2_order order模式                                 |         1 |    2 |
| 插入下一个自增值2（当前最大自增值+1）                  |         2 |    2 |
| 最新自增值=>                                           |         3 |    2 |
| 插入下一个自增值4（当前最大自增值+1）                  |         4 |    2 |
| 最新自增值=>                                           |         5 |    2 |
| 引用AUTO_INCREMENT列的值                               |         6 |   12 |
| 最新自增值=>                                           |         7 |    2 |
| 引用AUTO_INCREMENT列的值                               |         8 |   16 |
| 最新自增值=>                                           |         9 |    2 |
| table0_date                                            |       100 |    0 |
| table0_date                                            |       101 |    0 |
| table0_date                                            |       102 |    0 |
| table0_date                                            |       103 |    0 |
| table0_date                                            |       104 |    0 |
| table0_date                                            |       105 |    0 |
+--------------------------------------------------------+-----------+------+
insert into table2_order(a,txt) values(0,'最新自增值=>');
select txt,a incre_col,b from table2_order order by a;
+--------------------------------------------------------+-----------+------+
| txt                                                    | incre_col | b    |
+--------------------------------------------------------+-----------+------+
| table2_order order模式                                 |         1 |    2 |
| 插入下一个自增值2（当前最大自增值+1）                  |         2 |    2 |
| 最新自增值=>                                           |         3 |    2 |
| 插入下一个自增值4（当前最大自增值+1）                  |         4 |    2 |
| 最新自增值=>                                           |         5 |    2 |
| 引用AUTO_INCREMENT列的值                               |         6 |   12 |
| 最新自增值=>                                           |         7 |    2 |
| 引用AUTO_INCREMENT列的值                               |         8 |   16 |
| 最新自增值=>                                           |         9 |    2 |
| table0_date                                            |       100 |    0 |
| table0_date                                            |       101 |    0 |
| table0_date                                            |       102 |    0 |
| table0_date                                            |       103 |    0 |
| table0_date                                            |       104 |    0 |
| table0_date                                            |       105 |    0 |
| 最新自增值=>                                           |       106 |    2 |
+--------------------------------------------------------+-----------+------+
replace into table3_noorder select a,b,txt from table0_date where a >= 102;
select txt,a incre_col,b from table3_noorder order by a;
+--------------------------------------------------------+-----------+---------+
| txt                                                    | incre_col | b       |
+--------------------------------------------------------+-----------+---------+
| table3_noorder noorder模式                             |         1 |       3 |
| 插入下一个自增值2（当前最大自增值+1）                  |         2 |       3 |
| table0_date                                            |       100 |       0 |
| table0_date                                            |       101 |       0 |
| table0_date                                            |       102 |       0 |
| table0_date                                            |       103 |       0 |
| table0_date                                            |       104 |       0 |
| table0_date                                            |       105 |       0 |
| 最新自增值=>                                           |   1000001 |       3 |
| 插入下一个自增值2（当前最大自增值+1）                  |   1000002 |       3 |
| 最新自增值=>                                           |   2000001 |       3 |
| 引用AUTO_INCREMENT列的值                               |   2000002 | 4000004 |
| 最新自增值=>                                           |   3000001 |       3 |
| 引用AUTO_INCREMENT列的值                               |   3000002 | 6000004 |
| 最新自增值=>                                           |   4000001 |       3 |
| 最新自增值=>                                           |   4000002 |       3 |
+--------------------------------------------------------+-----------+---------+
insert into table3_noorder(a,txt) values(0,'最新自增值=>');
select txt,a incre_col,b from table3_noorder order by a;
+--------------------------------------------------------+-----------+---------+
| txt                                                    | incre_col | b       |
+--------------------------------------------------------+-----------+---------+
| table3_noorder noorder模式                             |         1 |       3 |
| 插入下一个自增值2（当前最大自增值+1）                  |         2 |       3 |
| table0_date                                            |       100 |       0 |
| table0_date                                            |       101 |       0 |
| table0_date                                            |       102 |       0 |
| table0_date                                            |       103 |       0 |
| table0_date                                            |       104 |       0 |
| table0_date                                            |       105 |       0 |
| 最新自增值=>                                           |   1000001 |       3 |
| 插入下一个自增值2（当前最大自增值+1）                  |   1000002 |       3 |
| 最新自增值=>                                           |   2000001 |       3 |
| 引用AUTO_INCREMENT列的值                               |   2000002 | 4000004 |
| 最新自增值=>                                           |   3000001 |       3 |
| 引用AUTO_INCREMENT列的值                               |   3000002 | 6000004 |
| 最新自增值=>                                           |   4000001 |       3 |
| 最新自增值=>                                           |   4000002 |       3 |
| 最新自增值=>                                           |   4000003 |       3 |
+--------------------------------------------------------+-----------+---------+
##混合插入
##INSERT ... ON DUPLICATE KEY UPDATE 语句
insert into table1_default (a,b,txt) values (1,1,'重复场合') on duplicate key update b=b+1,txt='insert...on duplicate key update 语句';
insert into table1_default(a,txt) values(0,'最新自增值=>');
select txt,a incre_col,b from table1_default order by a;
+--------------------------------------------------------+-----------+---------+
| txt                                                    | incre_col | b       |
+--------------------------------------------------------+-----------+---------+
| insert...on duplicate key update 语句                  |         1 |       2 |
| 插入下一个自增值2（当前最大自增值+1）                  |         2 |       1 |
| 插入下一个自增值4（当前最大自增值+1）                  |         4 |       1 |
| table0_date                                            |       100 |       0 |
| table0_date                                            |       101 |       0 |
| table0_date                                            |       102 |       0 |
| table0_date                                            |       103 |       0 |
| table0_date                                            |       104 |       0 |
| table0_date                                            |       105 |       0 |
| 最新自增值=>                                           |   1000001 |       1 |
| 最新自增值=>                                           |   1000002 |       1 |
| 引用AUTO_INCREMENT列的值                               |   1000003 | 2000006 |
| 最新自增值=>                                           |   2000001 |       1 |
| 引用AUTO_INCREMENT列的值                               |   2000002 | 4000004 |
| 最新自增值=>                                           |   3000001 |       1 |
| 最新自增值=>                                           |   3000002 |       1 |
| 最新自增值=>                                           |   3000003 |       1 |
| 最新自增值=>                                           |   3000004 |       1 |
+--------------------------------------------------------+-----------+---------+
insert into table1_default (a,b,txt) values (50,1,'不重复场合') on duplicate key update b=b+1,txt='insert...on duplicate key update 语句';
insert into table1_default(a,txt) values(0,'最新自增值=>');
select txt,a incre_col,b from table1_default order by a;
+--------------------------------------------------------+-----------+---------+
| txt                                                    | incre_col | b       |
+--------------------------------------------------------+-----------+---------+
| insert...on duplicate key update 语句                  |         1 |       2 |
| 插入下一个自增值2（当前最大自增值+1）                  |         2 |       1 |
| 插入下一个自增值4（当前最大自增值+1）                  |         4 |       1 |
| 不重复场合                                             |        50 |       1 |
| table0_date                                            |       100 |       0 |
| table0_date                                            |       101 |       0 |
| table0_date                                            |       102 |       0 |
| table0_date                                            |       103 |       0 |
| table0_date                                            |       104 |       0 |
| table0_date                                            |       105 |       0 |
| 最新自增值=>                                           |   1000001 |       1 |
| 最新自增值=>                                           |   1000002 |       1 |
| 引用AUTO_INCREMENT列的值                               |   1000003 | 2000006 |
| 最新自增值=>                                           |   2000001 |       1 |
| 引用AUTO_INCREMENT列的值                               |   2000002 | 4000004 |
| 最新自增值=>                                           |   3000001 |       1 |
| 最新自增值=>                                           |   3000002 |       1 |
| 最新自增值=>                                           |   3000003 |       1 |
| 最新自增值=>                                           |   3000004 |       1 |
| 最新自增值=>                                           |   3000005 |       1 |
+--------------------------------------------------------+-----------+---------+
insert into table2_order (a,b,txt) values (1,2,'重复场合') on duplicate key update b=b+1,txt='insert...on duplicate key update 语句';
insert into table2_order(a,txt) values(0,'最新自增值=>');
select txt,a incre_col,b from table2_order order by a;
+--------------------------------------------------------+-----------+------+
| txt                                                    | incre_col | b    |
+--------------------------------------------------------+-----------+------+
| insert...on duplicate key update 语句                  |         1 |    3 |
| 插入下一个自增值2（当前最大自增值+1）                  |         2 |    2 |
| 最新自增值=>                                           |         3 |    2 |
| 插入下一个自增值4（当前最大自增值+1）                  |         4 |    2 |
| 最新自增值=>                                           |         5 |    2 |
| 引用AUTO_INCREMENT列的值                               |         6 |   12 |
| 最新自增值=>                                           |         7 |    2 |
| 引用AUTO_INCREMENT列的值                               |         8 |   16 |
| 最新自增值=>                                           |         9 |    2 |
| table0_date                                            |       100 |    0 |
| table0_date                                            |       101 |    0 |
| table0_date                                            |       102 |    0 |
| table0_date                                            |       103 |    0 |
| table0_date                                            |       104 |    0 |
| table0_date                                            |       105 |    0 |
| 最新自增值=>                                           |       106 |    2 |
| 最新自增值=>                                           |       107 |    2 |
+--------------------------------------------------------+-----------+------+
insert into table2_order (a,b,txt) values (50,2,'不重复场合') on duplicate key update b=b+1,txt='insert...on duplicate key update 语句';
insert into table2_order(a,txt) values(0,'最新自增值=>');
select txt,a incre_col,b from table2_order order by a;
+--------------------------------------------------------+-----------+------+
| txt                                                    | incre_col | b    |
+--------------------------------------------------------+-----------+------+
| insert...on duplicate key update 语句                  |         1 |    3 |
| 插入下一个自增值2（当前最大自增值+1）                  |         2 |    2 |
| 最新自增值=>                                           |         3 |    2 |
| 插入下一个自增值4（当前最大自增值+1）                  |         4 |    2 |
| 最新自增值=>                                           |         5 |    2 |
| 引用AUTO_INCREMENT列的值                               |         6 |   12 |
| 最新自增值=>                                           |         7 |    2 |
| 引用AUTO_INCREMENT列的值                               |         8 |   16 |
| 最新自增值=>                                           |         9 |    2 |
| 不重复场合                                             |        50 |    2 |
| table0_date                                            |       100 |    0 |
| table0_date                                            |       101 |    0 |
| table0_date                                            |       102 |    0 |
| table0_date                                            |       103 |    0 |
| table0_date                                            |       104 |    0 |
| table0_date                                            |       105 |    0 |
| 最新自增值=>                                           |       106 |    2 |
| 最新自增值=>                                           |       107 |    2 |
| 最新自增值=>                                           |       108 |    2 |
+--------------------------------------------------------+-----------+------+
insert into table3_noorder (a,b,txt) values (1,3,'重复场合') on duplicate key update b=b+1,txt='insert...on duplicate key update 语句';
insert into table3_noorder(a,txt) values(0,'最新自增值=>');
select txt,a incre_col,b from table3_noorder order by a;
+--------------------------------------------------------+-----------+---------+
| txt                                                    | incre_col | b       |
+--------------------------------------------------------+-----------+---------+
| insert...on duplicate key update 语句                  |         1 |       4 |
| 插入下一个自增值2（当前最大自增值+1）                  |         2 |       3 |
| table0_date                                            |       100 |       0 |
| table0_date                                            |       101 |       0 |
| table0_date                                            |       102 |       0 |
| table0_date                                            |       103 |       0 |
| table0_date                                            |       104 |       0 |
| table0_date                                            |       105 |       0 |
| 最新自增值=>                                           |   1000001 |       3 |
| 插入下一个自增值2（当前最大自增值+1）                  |   1000002 |       3 |
| 最新自增值=>                                           |   2000001 |       3 |
| 引用AUTO_INCREMENT列的值                               |   2000002 | 4000004 |
| 最新自增值=>                                           |   3000001 |       3 |
| 引用AUTO_INCREMENT列的值                               |   3000002 | 6000004 |
| 最新自增值=>                                           |   4000001 |       3 |
| 最新自增值=>                                           |   4000002 |       3 |
| 最新自增值=>                                           |   4000003 |       3 |
| 最新自增值=>                                           |   4000004 |       3 |
+--------------------------------------------------------+-----------+---------+
insert into table3_noorder (a,b,txt) values (50,3,'不重复场合') on duplicate key update b=b+1,txt='insert...on duplicate key update 语句';
insert into table3_noorder(a,txt) values(0,'最新自增值=>');
select txt,a incre_col,b from table3_noorder order by a;
+--------------------------------------------------------+-----------+---------+
| txt                                                    | incre_col | b       |
+--------------------------------------------------------+-----------+---------+
| insert...on duplicate key update 语句                  |         1 |       4 |
| 插入下一个自增值2（当前最大自增值+1）                  |         2 |       3 |
| 不重复场合                                             |        50 |       3 |
| table0_date                                            |       100 |       0 |
| table0_date                                            |       101 |       0 |
| table0_date                                            |       102 |       0 |
| table0_date                                            |       103 |       0 |
| table0_date                                            |       104 |       0 |
| table0_date                                            |       105 |       0 |
| 最新自增值=>                                           |   1000001 |       3 |
| 插入下一个自增值2（当前最大自增值+1）                  |   1000002 |       3 |
| 最新自增值=>                                           |   2000001 |       3 |
| 引用AUTO_INCREMENT列的值                               |   2000002 | 4000004 |
| 最新自增值=>                                           |   3000001 |       3 |
| 引用AUTO_INCREMENT列的值                               |   3000002 | 6000004 |
| 最新自增值=>                                           |   4000001 |       3 |
| 最新自增值=>                                           |   4000002 |       3 |
| 最新自增值=>                                           |   4000003 |       3 |
| 最新自增值=>                                           |   4000004 |       3 |
| 最新自增值=>                                           |   4000005 |       3 |
+--------------------------------------------------------+-----------+---------+
##将NULL和任何其他值混合插入 AUTO_INCREMENT列
##INSERT 语句
insert into table1_default(a) values(null),(10),(null),(20);
insert into table1_default(a,txt) values(0,'最新自增值1=>');
select txt,a incre_col,b from table1_default order by a;
+--------------------------------------------------------+-----------+---------+
| txt                                                    | incre_col | b       |
+--------------------------------------------------------+-----------+---------+
| insert...on duplicate key update 语句                  |         1 |       2 |
| 插入下一个自增值2（当前最大自增值+1）                  |         2 |       1 |
| 插入下一个自增值4（当前最大自增值+1）                  |         4 |       1 |
| table1_default 默认noorder模式                         |        10 |       1 |
| table1_default 默认noorder模式                         |        20 |       1 |
| 不重复场合                                             |        50 |       1 |
| table0_date                                            |       100 |       0 |
| table0_date                                            |       101 |       0 |
| table0_date                                            |       102 |       0 |
| table0_date                                            |       103 |       0 |
| table0_date                                            |       104 |       0 |
| table0_date                                            |       105 |       0 |
| 最新自增值=>                                           |   1000001 |       1 |
| 最新自增值=>                                           |   1000002 |       1 |
| 引用AUTO_INCREMENT列的值                               |   1000003 | 2000006 |
| 最新自增值=>                                           |   2000001 |       1 |
| 引用AUTO_INCREMENT列的值                               |   2000002 | 4000004 |
| 最新自增值=>                                           |   3000001 |       1 |
| 最新自增值=>                                           |   3000002 |       1 |
| 最新自增值=>                                           |   3000003 |       1 |
| 最新自增值=>                                           |   3000004 |       1 |
| 最新自增值=>                                           |   3000005 |       1 |
| table1_default 默认noorder模式                         |   3000006 |       1 |
| table1_default 默认noorder模式                         |   3000007 |       1 |
| 最新自增值1=>                                          |   3000010 |       1 |
+--------------------------------------------------------+-----------+---------+
insert into table2_order(a) values(null),(10),(null),(20);
insert into table2_order(a,txt) values(0,'最新自增值=>');
select txt,a incre_col,b from table2_order order by a;
+--------------------------------------------------------+-----------+------+
| txt                                                    | incre_col | b    |
+--------------------------------------------------------+-----------+------+
| insert...on duplicate key update 语句                  |         1 |    3 |
| 插入下一个自增值2（当前最大自增值+1）                  |         2 |    2 |
| 最新自增值=>                                           |         3 |    2 |
| 插入下一个自增值4（当前最大自增值+1）                  |         4 |    2 |
| 最新自增值=>                                           |         5 |    2 |
| 引用AUTO_INCREMENT列的值                               |         6 |   12 |
| 最新自增值=>                                           |         7 |    2 |
| 引用AUTO_INCREMENT列的值                               |         8 |   16 |
| 最新自增值=>                                           |         9 |    2 |
| table2_order order模式                                 |        10 |    2 |
| table2_order order模式                                 |        20 |    2 |
| 不重复场合                                             |        50 |    2 |
| table0_date                                            |       100 |    0 |
| table0_date                                            |       101 |    0 |
| table0_date                                            |       102 |    0 |
| table0_date                                            |       103 |    0 |
| table0_date                                            |       104 |    0 |
| table0_date                                            |       105 |    0 |
| 最新自增值=>                                           |       106 |    2 |
| 最新自增值=>                                           |       107 |    2 |
| 最新自增值=>                                           |       108 |    2 |
| table2_order order模式                                 |       109 |    2 |
| table2_order order模式                                 |       110 |    2 |
| 最新自增值=>                                           |       113 |    2 |
+--------------------------------------------------------+-----------+------+
insert into table3_noorder(a) values(null),(10),(null),(20);
insert into table3_noorder(a,txt) values(0,'最新自增值=>');
select txt,a incre_col,b from table3_noorder order by a;
+--------------------------------------------------------+-----------+---------+
| txt                                                    | incre_col | b       |
+--------------------------------------------------------+-----------+---------+
| insert...on duplicate key update 语句                  |         1 |       4 |
| 插入下一个自增值2（当前最大自增值+1）                  |         2 |       3 |
| table3_noorder noorder模式                             |        10 |       3 |
| table3_noorder noorder模式                             |        20 |       3 |
| 不重复场合                                             |        50 |       3 |
| table0_date                                            |       100 |       0 |
| table0_date                                            |       101 |       0 |
| table0_date                                            |       102 |       0 |
| table0_date                                            |       103 |       0 |
| table0_date                                            |       104 |       0 |
| table0_date                                            |       105 |       0 |
| 最新自增值=>                                           |   1000001 |       3 |
| 插入下一个自增值2（当前最大自增值+1）                  |   1000002 |       3 |
| 最新自增值=>                                           |   2000001 |       3 |
| 引用AUTO_INCREMENT列的值                               |   2000002 | 4000004 |
| 最新自增值=>                                           |   3000001 |       3 |
| 引用AUTO_INCREMENT列的值                               |   3000002 | 6000004 |
| 最新自增值=>                                           |   4000001 |       3 |
| 最新自增值=>                                           |   4000002 |       3 |
| 最新自增值=>                                           |   4000003 |       3 |
| 最新自增值=>                                           |   4000004 |       3 |
| 最新自增值=>                                           |   4000005 |       3 |
| table3_noorder noorder模式                             |   4000006 |       3 |
| table3_noorder noorder模式                             |   4000007 |       3 |
| 最新自增值=>                                           |   4000010 |       3 |
+--------------------------------------------------------+-----------+---------+
##REPLACE 语句
replace into table1_default(a) values(null),(30),(null),(40);
insert into table1_default(a,txt) values(0,'最新自增值=>');
select txt,a incre_col,b from table1_default order by a;
+--------------------------------------------------------+-----------+---------+
| txt                                                    | incre_col | b       |
+--------------------------------------------------------+-----------+---------+
| insert...on duplicate key update 语句                  |         1 |       2 |
| 插入下一个自增值2（当前最大自增值+1）                  |         2 |       1 |
| 插入下一个自增值4（当前最大自增值+1）                  |         4 |       1 |
| table1_default 默认noorder模式                         |        10 |       1 |
| table1_default 默认noorder模式                         |        20 |       1 |
| table1_default 默认noorder模式                         |        30 |       1 |
| table1_default 默认noorder模式                         |        40 |       1 |
| 不重复场合                                             |        50 |       1 |
| table0_date                                            |       100 |       0 |
| table0_date                                            |       101 |       0 |
| table0_date                                            |       102 |       0 |
| table0_date                                            |       103 |       0 |
| table0_date                                            |       104 |       0 |
| table0_date                                            |       105 |       0 |
| 最新自增值=>                                           |   1000001 |       1 |
| 最新自增值=>                                           |   1000002 |       1 |
| 引用AUTO_INCREMENT列的值                               |   1000003 | 2000006 |
| 最新自增值=>                                           |   2000001 |       1 |
| 引用AUTO_INCREMENT列的值                               |   2000002 | 4000004 |
| 最新自增值=>                                           |   3000001 |       1 |
| 最新自增值=>                                           |   3000002 |       1 |
| 最新自增值=>                                           |   3000003 |       1 |
| 最新自增值=>                                           |   3000004 |       1 |
| 最新自增值=>                                           |   3000005 |       1 |
| table1_default 默认noorder模式                         |   3000006 |       1 |
| table1_default 默认noorder模式                         |   3000007 |       1 |
| 最新自增值1=>                                          |   3000010 |       1 |
| table1_default 默认noorder模式                         |   3000011 |       1 |
| table1_default 默认noorder模式                         |   3000012 |       1 |
| 最新自增值=>                                           |   3000015 |       1 |
+--------------------------------------------------------+-----------+---------+
replace into table2_order(a) values(null),(30),(null),(40);
insert into table2_order(a,txt) values(0,'最新自增值=>');
select txt,a incre_col,b from table2_order order by a;
+--------------------------------------------------------+-----------+------+
| txt                                                    | incre_col | b    |
+--------------------------------------------------------+-----------+------+
| insert...on duplicate key update 语句                  |         1 |    3 |
| 插入下一个自增值2（当前最大自增值+1）                  |         2 |    2 |
| 最新自增值=>                                           |         3 |    2 |
| 插入下一个自增值4（当前最大自增值+1）                  |         4 |    2 |
| 最新自增值=>                                           |         5 |    2 |
| 引用AUTO_INCREMENT列的值                               |         6 |   12 |
| 最新自增值=>                                           |         7 |    2 |
| 引用AUTO_INCREMENT列的值                               |         8 |   16 |
| 最新自增值=>                                           |         9 |    2 |
| table2_order order模式                                 |        10 |    2 |
| table2_order order模式                                 |        20 |    2 |
| table2_order order模式                                 |        30 |    2 |
| table2_order order模式                                 |        40 |    2 |
| 不重复场合                                             |        50 |    2 |
| table0_date                                            |       100 |    0 |
| table0_date                                            |       101 |    0 |
| table0_date                                            |       102 |    0 |
| table0_date                                            |       103 |    0 |
| table0_date                                            |       104 |    0 |
| table0_date                                            |       105 |    0 |
| 最新自增值=>                                           |       106 |    2 |
| 最新自增值=>                                           |       107 |    2 |
| 最新自增值=>                                           |       108 |    2 |
| table2_order order模式                                 |       109 |    2 |
| table2_order order模式                                 |       110 |    2 |
| 最新自增值=>                                           |       113 |    2 |
| table2_order order模式                                 |       114 |    2 |
| table2_order order模式                                 |       115 |    2 |
| 最新自增值=>                                           |       118 |    2 |
+--------------------------------------------------------+-----------+------+
replace into table3_noorder(a) values(null),(30),(null),(40);
insert into table3_noorder(a,txt) values(0,'最新自增值=>');
select txt,a incre_col,b from table3_noorder order by a;
+--------------------------------------------------------+-----------+---------+
| txt                                                    | incre_col | b       |
+--------------------------------------------------------+-----------+---------+
| insert...on duplicate key update 语句                  |         1 |       4 |
| 插入下一个自增值2（当前最大自增值+1）                  |         2 |       3 |
| table3_noorder noorder模式                             |        10 |       3 |
| table3_noorder noorder模式                             |        20 |       3 |
| table3_noorder noorder模式                             |        30 |       3 |
| table3_noorder noorder模式                             |        40 |       3 |
| 不重复场合                                             |        50 |       3 |
| table0_date                                            |       100 |       0 |
| table0_date                                            |       101 |       0 |
| table0_date                                            |       102 |       0 |
| table0_date                                            |       103 |       0 |
| table0_date                                            |       104 |       0 |
| table0_date                                            |       105 |       0 |
| 最新自增值=>                                           |   1000001 |       3 |
| 插入下一个自增值2（当前最大自增值+1）                  |   1000002 |       3 |
| 最新自增值=>                                           |   2000001 |       3 |
| 引用AUTO_INCREMENT列的值                               |   2000002 | 4000004 |
| 最新自增值=>                                           |   3000001 |       3 |
| 引用AUTO_INCREMENT列的值                               |   3000002 | 6000004 |
| 最新自增值=>                                           |   4000001 |       3 |
| 最新自增值=>                                           |   4000002 |       3 |
| 最新自增值=>                                           |   4000003 |       3 |
| 最新自增值=>                                           |   4000004 |       3 |
| 最新自增值=>                                           |   4000005 |       3 |
| table3_noorder noorder模式                             |   4000006 |       3 |
| table3_noorder noorder模式                             |   4000007 |       3 |
| 最新自增值=>                                           |   4000010 |       3 |
| table3_noorder noorder模式                             |   4000011 |       3 |
| table3_noorder noorder模式                             |   4000012 |       3 |
| 最新自增值=>                                           |   4000015 |       3 |
+--------------------------------------------------------+-----------+---------+
###### auto_incre_3-1-2 ②DELETE操作
insert into table1_default(a,b) values(null,11);
insert into table1_default(a,b) values(null,11);
select txt,a incre_col,b from table1_default order by a;
+--------------------------------------------------------+-----------+---------+
| txt                                                    | incre_col | b       |
+--------------------------------------------------------+-----------+---------+
| insert...on duplicate key update 语句                  |         1 |       2 |
| 插入下一个自增值2（当前最大自增值+1）                  |         2 |       1 |
| 插入下一个自增值4（当前最大自增值+1）                  |         4 |       1 |
| table1_default 默认noorder模式                         |        10 |       1 |
| table1_default 默认noorder模式                         |        20 |       1 |
| table1_default 默认noorder模式                         |        30 |       1 |
| table1_default 默认noorder模式                         |        40 |       1 |
| 不重复场合                                             |        50 |       1 |
| table0_date                                            |       100 |       0 |
| table0_date                                            |       101 |       0 |
| table0_date                                            |       102 |       0 |
| table0_date                                            |       103 |       0 |
| table0_date                                            |       104 |       0 |
| table0_date                                            |       105 |       0 |
| 最新自增值=>                                           |   1000001 |       1 |
| 最新自增值=>                                           |   1000002 |       1 |
| 引用AUTO_INCREMENT列的值                               |   1000003 | 2000006 |
| 最新自增值=>                                           |   2000001 |       1 |
| 引用AUTO_INCREMENT列的值                               |   2000002 | 4000004 |
| 最新自增值=>                                           |   3000001 |       1 |
| 最新自增值=>                                           |   3000002 |       1 |
| 最新自增值=>                                           |   3000003 |       1 |
| 最新自增值=>                                           |   3000004 |       1 |
| 最新自增值=>                                           |   3000005 |       1 |
| table1_default 默认noorder模式                         |   3000006 |       1 |
| table1_default 默认noorder模式                         |   3000007 |       1 |
| 最新自增值1=>                                          |   3000010 |       1 |
| table1_default 默认noorder模式                         |   3000011 |       1 |
| table1_default 默认noorder模式                         |   3000012 |       1 |
| 最新自增值=>                                           |   3000015 |       1 |
| table1_default 默认noorder模式                         |   3000016 |      11 |
| table1_default 默认noorder模式                         |   3000017 |      11 |
+--------------------------------------------------------+-----------+---------+
delete from table1_default where b=11;
insert into table1_default(a,txt) values(0,'最新自增值=>');
select txt,a incre_col,b from table1_default order by a;
+--------------------------------------------------------+-----------+---------+
| txt                                                    | incre_col | b       |
+--------------------------------------------------------+-----------+---------+
| insert...on duplicate key update 语句                  |         1 |       2 |
| 插入下一个自增值2（当前最大自增值+1）                  |         2 |       1 |
| 插入下一个自增值4（当前最大自增值+1）                  |         4 |       1 |
| table1_default 默认noorder模式                         |        10 |       1 |
| table1_default 默认noorder模式                         |        20 |       1 |
| table1_default 默认noorder模式                         |        30 |       1 |
| table1_default 默认noorder模式                         |        40 |       1 |
| 不重复场合                                             |        50 |       1 |
| table0_date                                            |       100 |       0 |
| table0_date                                            |       101 |       0 |
| table0_date                                            |       102 |       0 |
| table0_date                                            |       103 |       0 |
| table0_date                                            |       104 |       0 |
| table0_date                                            |       105 |       0 |
| 最新自增值=>                                           |   1000001 |       1 |
| 最新自增值=>                                           |   1000002 |       1 |
| 引用AUTO_INCREMENT列的值                               |   1000003 | 2000006 |
| 最新自增值=>                                           |   2000001 |       1 |
| 引用AUTO_INCREMENT列的值                               |   2000002 | 4000004 |
| 最新自增值=>                                           |   3000001 |       1 |
| 最新自增值=>                                           |   3000002 |       1 |
| 最新自增值=>                                           |   3000003 |       1 |
| 最新自增值=>                                           |   3000004 |       1 |
| 最新自增值=>                                           |   3000005 |       1 |
| table1_default 默认noorder模式                         |   3000006 |       1 |
| table1_default 默认noorder模式                         |   3000007 |       1 |
| 最新自增值1=>                                          |   3000010 |       1 |
| table1_default 默认noorder模式                         |   3000011 |       1 |
| table1_default 默认noorder模式                         |   3000012 |       1 |
| 最新自增值=>                                           |   3000015 |       1 |
| 最新自增值=>                                           |   3000018 |       1 |
+--------------------------------------------------------+-----------+---------+
insert into table2_order(a,b) values(null,22);
insert into table2_order(a,b) values(null,22);
select txt,a incre_col,b from table2_order order by a;
+--------------------------------------------------------+-----------+------+
| txt                                                    | incre_col | b    |
+--------------------------------------------------------+-----------+------+
| insert...on duplicate key update 语句                  |         1 |    3 |
| 插入下一个自增值2（当前最大自增值+1）                  |         2 |    2 |
| 最新自增值=>                                           |         3 |    2 |
| 插入下一个自增值4（当前最大自增值+1）                  |         4 |    2 |
| 最新自增值=>                                           |         5 |    2 |
| 引用AUTO_INCREMENT列的值                               |         6 |   12 |
| 最新自增值=>                                           |         7 |    2 |
| 引用AUTO_INCREMENT列的值                               |         8 |   16 |
| 最新自增值=>                                           |         9 |    2 |
| table2_order order模式                                 |        10 |    2 |
| table2_order order模式                                 |        20 |    2 |
| table2_order order模式                                 |        30 |    2 |
| table2_order order模式                                 |        40 |    2 |
| 不重复场合                                             |        50 |    2 |
| table0_date                                            |       100 |    0 |
| table0_date                                            |       101 |    0 |
| table0_date                                            |       102 |    0 |
| table0_date                                            |       103 |    0 |
| table0_date                                            |       104 |    0 |
| table0_date                                            |       105 |    0 |
| 最新自增值=>                                           |       106 |    2 |
| 最新自增值=>                                           |       107 |    2 |
| 最新自增值=>                                           |       108 |    2 |
| table2_order order模式                                 |       109 |    2 |
| table2_order order模式                                 |       110 |    2 |
| 最新自增值=>                                           |       113 |    2 |
| table2_order order模式                                 |       114 |    2 |
| table2_order order模式                                 |       115 |    2 |
| 最新自增值=>                                           |       118 |    2 |
| table2_order order模式                                 |       119 |   22 |
| table2_order order模式                                 |       120 |   22 |
+--------------------------------------------------------+-----------+------+
delete from table2_order where b=22;
insert into table2_order(a,txt) values(0,'最新自增值=>');
select txt,a incre_col,b from table2_order order by a;
+--------------------------------------------------------+-----------+------+
| txt                                                    | incre_col | b    |
+--------------------------------------------------------+-----------+------+
| insert...on duplicate key update 语句                  |         1 |    3 |
| 插入下一个自增值2（当前最大自增值+1）                  |         2 |    2 |
| 最新自增值=>                                           |         3 |    2 |
| 插入下一个自增值4（当前最大自增值+1）                  |         4 |    2 |
| 最新自增值=>                                           |         5 |    2 |
| 引用AUTO_INCREMENT列的值                               |         6 |   12 |
| 最新自增值=>                                           |         7 |    2 |
| 引用AUTO_INCREMENT列的值                               |         8 |   16 |
| 最新自增值=>                                           |         9 |    2 |
| table2_order order模式                                 |        10 |    2 |
| table2_order order模式                                 |        20 |    2 |
| table2_order order模式                                 |        30 |    2 |
| table2_order order模式                                 |        40 |    2 |
| 不重复场合                                             |        50 |    2 |
| table0_date                                            |       100 |    0 |
| table0_date                                            |       101 |    0 |
| table0_date                                            |       102 |    0 |
| table0_date                                            |       103 |    0 |
| table0_date                                            |       104 |    0 |
| table0_date                                            |       105 |    0 |
| 最新自增值=>                                           |       106 |    2 |
| 最新自增值=>                                           |       107 |    2 |
| 最新自增值=>                                           |       108 |    2 |
| table2_order order模式                                 |       109 |    2 |
| table2_order order模式                                 |       110 |    2 |
| 最新自增值=>                                           |       113 |    2 |
| table2_order order模式                                 |       114 |    2 |
| table2_order order模式                                 |       115 |    2 |
| 最新自增值=>                                           |       118 |    2 |
| 最新自增值=>                                           |       121 |    2 |
+--------------------------------------------------------+-----------+------+
insert into table3_noorder(a,b) values(null,33);
insert into table3_noorder(a,b) values(null,33);
select txt,a incre_col,b from table3_noorder order by a;
+--------------------------------------------------------+-----------+---------+
| txt                                                    | incre_col | b       |
+--------------------------------------------------------+-----------+---------+
| insert...on duplicate key update 语句                  |         1 |       4 |
| 插入下一个自增值2（当前最大自增值+1）                  |         2 |       3 |
| table3_noorder noorder模式                             |        10 |       3 |
| table3_noorder noorder模式                             |        20 |       3 |
| table3_noorder noorder模式                             |        30 |       3 |
| table3_noorder noorder模式                             |        40 |       3 |
| 不重复场合                                             |        50 |       3 |
| table0_date                                            |       100 |       0 |
| table0_date                                            |       101 |       0 |
| table0_date                                            |       102 |       0 |
| table0_date                                            |       103 |       0 |
| table0_date                                            |       104 |       0 |
| table0_date                                            |       105 |       0 |
| 最新自增值=>                                           |   1000001 |       3 |
| 插入下一个自增值2（当前最大自增值+1）                  |   1000002 |       3 |
| 最新自增值=>                                           |   2000001 |       3 |
| 引用AUTO_INCREMENT列的值                               |   2000002 | 4000004 |
| 最新自增值=>                                           |   3000001 |       3 |
| 引用AUTO_INCREMENT列的值                               |   3000002 | 6000004 |
| 最新自增值=>                                           |   4000001 |       3 |
| 最新自增值=>                                           |   4000002 |       3 |
| 最新自增值=>                                           |   4000003 |       3 |
| 最新自增值=>                                           |   4000004 |       3 |
| 最新自增值=>                                           |   4000005 |       3 |
| table3_noorder noorder模式                             |   4000006 |       3 |
| table3_noorder noorder模式                             |   4000007 |       3 |
| 最新自增值=>                                           |   4000010 |       3 |
| table3_noorder noorder模式                             |   4000011 |       3 |
| table3_noorder noorder模式                             |   4000012 |       3 |
| 最新自增值=>                                           |   4000015 |       3 |
| table3_noorder noorder模式                             |   4000016 |      33 |
| table3_noorder noorder模式                             |   4000017 |      33 |
+--------------------------------------------------------+-----------+---------+
delete from table3_noorder where b=33;
insert into table3_noorder(a,txt) values(0,'最新自增值=>');
select txt,a incre_col,b from table3_noorder order by a;
+--------------------------------------------------------+-----------+---------+
| txt                                                    | incre_col | b       |
+--------------------------------------------------------+-----------+---------+
| insert...on duplicate key update 语句                  |         1 |       4 |
| 插入下一个自增值2（当前最大自增值+1）                  |         2 |       3 |
| table3_noorder noorder模式                             |        10 |       3 |
| table3_noorder noorder模式                             |        20 |       3 |
| table3_noorder noorder模式                             |        30 |       3 |
| table3_noorder noorder模式                             |        40 |       3 |
| 不重复场合                                             |        50 |       3 |
| table0_date                                            |       100 |       0 |
| table0_date                                            |       101 |       0 |
| table0_date                                            |       102 |       0 |
| table0_date                                            |       103 |       0 |
| table0_date                                            |       104 |       0 |
| table0_date                                            |       105 |       0 |
| 最新自增值=>                                           |   1000001 |       3 |
| 插入下一个自增值2（当前最大自增值+1）                  |   1000002 |       3 |
| 最新自增值=>                                           |   2000001 |       3 |
| 引用AUTO_INCREMENT列的值                               |   2000002 | 4000004 |
| 最新自增值=>                                           |   3000001 |       3 |
| 引用AUTO_INCREMENT列的值                               |   3000002 | 6000004 |
| 最新自增值=>                                           |   4000001 |       3 |
| 最新自增值=>                                           |   4000002 |       3 |
| 最新自增值=>                                           |   4000003 |       3 |
| 最新自增值=>                                           |   4000004 |       3 |
| 最新自增值=>                                           |   4000005 |       3 |
| table3_noorder noorder模式                             |   4000006 |       3 |
| table3_noorder noorder模式                             |   4000007 |       3 |
| 最新自增值=>                                           |   4000010 |       3 |
| table3_noorder noorder模式                             |   4000011 |       3 |
| table3_noorder noorder模式                             |   4000012 |       3 |
| 最新自增值=>                                           |   4000015 |       3 |
| 最新自增值=>                                           |   4000018 |       3 |
+--------------------------------------------------------+-----------+---------+
###### auto_incre_3-1-3 ③UPDATE操作
# mysql 5.x update没有推高这个自增值，和我们现在是兼容的；8.x update会推高
##更新现有AUTO_INCREMENT列值
truncate table table1_default;
insert into table1_default(a,b) values(null,111);
select txt,a incre_col,b from table1_default order by a;
+------------------------------------+-----------+------+
| txt                                | incre_col | b    |
+------------------------------------+-----------+------+
| table1_default 默认noorder模式     |         1 |  111 |
+------------------------------------+-----------+------+
update table1_default set a = 0,txt = '将AUTO_INCREMENT列值设置为小于/等于当前最大自增值的值' where b = 111;
insert into table1_default values(null,11,'1当前自增值=>');
select txt,a incre_col,b from table1_default order by a;
+--------------------------------------------------------------------------+-----------+------+
| txt                                                                      | incre_col | b    |
+--------------------------------------------------------------------------+-----------+------+
| 将AUTO_INCREMENT列值设置为小于/等于当前最大自增值的值                    |         0 |  111 |
| 1当前自增值=>                                                            |         2 |   11 |
+--------------------------------------------------------------------------+-----------+------+
update table1_default set a = 1111111 ,txt = '将AUTO_INCREMENT列值设置为大于当前最大自增值的值' where b = 111;
insert into table1_default values(null,11,'2当前自增值=>');
select txt,a incre_col,b from table1_default order by a;
+-------------------------------------------------------------------+-----------+------+
| txt                                                               | incre_col | b    |
+-------------------------------------------------------------------+-----------+------+
| 1当前自增值=>                                                     |         2 |   11 |
| 2当前自增值=>                                                     |         3 |   11 |
| 将AUTO_INCREMENT列值设置为大于当前最大自增值的值                  |   1111111 |  111 |
+-------------------------------------------------------------------+-----------+------+
truncate table table2_order;
insert into table2_order(a,b) values(null,222);
select txt,a incre_col,b from table2_order order by a;
+--------------------------+-----------+------+
| txt                      | incre_col | b    |
+--------------------------+-----------+------+
| table2_order order模式   |         1 |  222 |
+--------------------------+-----------+------+
update table2_order set a = 0,txt = '将AUTO_INCREMENT列值设置为小于/等于当前最大自增值的值' where b = 222;
insert into table2_order values(null,22,'1当前自增值=>');
select txt,a incre_col,b from table2_order order by a;
+--------------------------------------------------------------------------+-----------+------+
| txt                                                                      | incre_col | b    |
+--------------------------------------------------------------------------+-----------+------+
| 将AUTO_INCREMENT列值设置为小于/等于当前最大自增值的值                    |         0 |  222 |
| 1当前自增值=>                                                            |         2 |   22 |
+--------------------------------------------------------------------------+-----------+------+
update table2_order set a = 20 ,txt = '将AUTO_INCREMENT列值设置为大于当前最大自增值的值' where b = 222;
insert into table2_order values(null,22,'2当前自增值=>');
select txt,a incre_col,b from table2_order order by a;
+-------------------------------------------------------------------+-----------+------+
| txt                                                               | incre_col | b    |
+-------------------------------------------------------------------+-----------+------+
| 1当前自增值=>                                                     |         2 |   22 |
| 2当前自增值=>                                                     |         3 |   22 |
| 将AUTO_INCREMENT列值设置为大于当前最大自增值的值                  |        20 |  222 |
+-------------------------------------------------------------------+-----------+------+
truncate table table3_noorder;
insert into table3_noorder(a,b) values(null,333);
select txt,a incre_col,b from table3_noorder order by a;
+------------------------------+-----------+------+
| txt                          | incre_col | b    |
+------------------------------+-----------+------+
| table3_noorder noorder模式   |         1 |  333 |
+------------------------------+-----------+------+
update table3_noorder set a = 0,txt = '将AUTO_INCREMENT列值设置为小于/等于当前最大自增值的值' where b = 333;
insert into table3_noorder values(null,33,'1当前自增值=>');
select txt,a incre_col,b from table3_noorder order by a;
+--------------------------------------------------------------------------+-----------+------+
| txt                                                                      | incre_col | b    |
+--------------------------------------------------------------------------+-----------+------+
| 将AUTO_INCREMENT列值设置为小于/等于当前最大自增值的值                    |         0 |  333 |
| 1当前自增值=>                                                            |         2 |   33 |
+--------------------------------------------------------------------------+-----------+------+
update table3_noorder set a = 20 ,txt = '将AUTO_INCREMENT列值设置为大于当前最大自增值的值' where b = 333;
insert into table3_noorder values(null,33,'2当前自增值=>');
select txt,a incre_col,b from table3_noorder order by a;
+-------------------------------------------------------------------+-----------+------+
| txt                                                               | incre_col | b    |
+-------------------------------------------------------------------+-----------+------+
| 1当前自增值=>                                                     |         2 |   33 |
| 2当前自增值=>                                                     |         3 |   33 |
| 将AUTO_INCREMENT列值设置为大于当前最大自增值的值                  |        20 |  333 |
+-------------------------------------------------------------------+-----------+------+
##更新其他列值时引用AUTO_INCREMENT列
delete from table1_default;
insert into table1_default(a,b,txt) values(null,0,'update');
select txt,a incre_col,b from table1_default order by a;
+--------+-----------+------+
| txt    | incre_col | b    |
+--------+-----------+------+
| update |         4 |    0 |
+--------+-----------+------+
update table1_default set b = a+1 where txt = 'update';
insert into table1_default values(null,11,'当前自增值==>');
select txt,a incre_col,b from table1_default order by a;
+--------------------+-----------+------+
| txt                | incre_col | b    |
+--------------------+-----------+------+
| update             |         4 |    5 |
| 当前自增值==>      |         5 |   11 |
+--------------------+-----------+------+
delete from table2_order;
insert into table2_order(a,b,txt) values(null,0,'update');
select txt,a incre_col,b from table2_order order by a;
+--------+-----------+------+
| txt    | incre_col | b    |
+--------+-----------+------+
| update |         4 |    0 |
+--------+-----------+------+
update table2_order set b = a+2 where txt = 'update';
insert into table2_order values(null,22,'当前自增值==>');
select txt,a incre_col,b from table2_order order by a;
+--------------------+-----------+------+
| txt                | incre_col | b    |
+--------------------+-----------+------+
| update             |         4 |    6 |
| 当前自增值==>      |         5 |   22 |
+--------------------+-----------+------+
delete from table3_noorder;
insert into table3_noorder(a,b,txt) values(null,0,'update');
select txt,a incre_col,b from table3_noorder order by a;
+--------+-----------+------+
| txt    | incre_col | b    |
+--------+-----------+------+
| update |         4 |    0 |
+--------+-----------+------+
update table3_noorder set b = a+3 where txt = 'update';
insert into table3_noorder values(null,33,'当前自增值==>');
select txt,a incre_col,b from table3_noorder order by a;
+--------------------+-----------+------+
| txt                | incre_col | b    |
+--------------------+-----------+------+
| update             |         4 |    7 |
| 当前自增值==>      |         5 |   33 |
+--------------------+-----------+------+
###### auto_incre_3-1-4 ④SELECT操作
select a incre_col from table1_default order by a;
+-----------+
| incre_col |
+-----------+
|         4 |
|         5 |
+-----------+
select abs(a) from table1_default order by a;
+--------+
| abs(a) |
+--------+
|      4 |
|      5 |
+--------+
select a+b from table1_default order by a;
+------+
| a+b  |
+------+
|    9 |
|   16 |
+------+
select a incre_col from table2_order order by a;
+-----------+
| incre_col |
+-----------+
|         4 |
|         5 |
+-----------+
select abs(a) from table2_order order by a;
+--------+
| abs(a) |
+--------+
|      4 |
|      5 |
+--------+
select a+b from table2_order order by a;
+------+
| a+b  |
+------+
|   10 |
|   27 |
+------+
select a incre_col from table3_noorder order by a;
+-----------+
| incre_col |
+-----------+
|         4 |
|         5 |
+-----------+
select abs(a) from table3_noorder order by a;
+--------+
| abs(a) |
+--------+
|      4 |
|      5 |
+--------+
select a+b from table3_noorder order by a;
+------+
| a+b  |
+------+
|   11 |
|   38 |
+------+
########################################################################################################################## 
############ auto_incre_1-2-1，auto_incre_1-2-2 
############ 索引 - 复合索引，约束 - 默认约束 
############ TINYINT 类型 
alter system set default_auto_increment_mode = 'order';
##建表
drop table table0_date;
create table table0_date (
  a tinyint not null,
  b tinyint default 0,
  txt varchar(64) default 'table0_date'
);
insert into table0_date(a) values(100),(101),(102),(103),(104),(105);
drop table table1_default;
create table table1_default (
  a tinyint auto_increment,
  b tinyint default 1,
  txt varchar(64) default 'table1_default 默认noorder模式',
  index index_name (a,b)
);
drop table table2_order;
create table table2_order (
  a tinyint auto_increment,
  b tinyint default 2,
  txt varchar(64) default 'table2_order order模式',
  index index_name (a,b)
) auto_increment_mode = 'order';
drop table table3_noorder;
create table table3_noorder (
  a tinyint auto_increment,
  b tinyint default 3,
  txt varchar(64) default 'table3_noorder noorder模式',
  index index_name (a,b)
) auto_increment_mode = 'noorder';
############ auto_incre_3-1 DML操作 ############
###### auto_incre_3-1-1 ①INSERT操作 
##简单插入
##INSERT 语句
##table1_default
insert into table1_default(a) values(null);
select txt,a incre_col,b from table1_default order by a;
+------------------------------------+-----------+------+
| txt                                | incre_col | b    |
+------------------------------------+-----------+------+
| table1_default 默认noorder模式     |         1 |    1 |
+------------------------------------+-----------+------+
alter table table1_default AUTO_INCREMENT = 127;
insert into table1_default(a) values(null);
insert into table1_default(a) values(null),(null),(null);
select txt,a incre_col,b from table1_default order by a;
+------------------------------------+-----------+------+
| txt                                | incre_col | b    |
+------------------------------------+-----------+------+
| table1_default 默认noorder模式     |         1 |    1 |
| table1_default 默认noorder模式     |       127 |    1 |
| table1_default 默认noorder模式     |       127 |    1 |
| table1_default 默认noorder模式     |       127 |    1 |
| table1_default 默认noorder模式     |       127 |    1 |
+------------------------------------+-----------+------+
insert into table1_default(a) values(10);
insert into table1_default(a,txt) values(0,'最新自增值=>');
select txt,a incre_col,b from table1_default order by a;
+------------------------------------+-----------+------+
| txt                                | incre_col | b    |
+------------------------------------+-----------+------+
| table1_default 默认noorder模式     |         1 |    1 |
| table1_default 默认noorder模式     |        10 |    1 |
| table1_default 默认noorder模式     |       127 |    1 |
| table1_default 默认noorder模式     |       127 |    1 |
| table1_default 默认noorder模式     |       127 |    1 |
| table1_default 默认noorder模式     |       127 |    1 |
| 最新自增值=>                       |       127 |    1 |
+------------------------------------+-----------+------+
##table2_order
insert into table2_order(a) values(null);
select txt,a incre_col,b from table2_order order by a;
+--------------------------+-----------+------+
| txt                      | incre_col | b    |
+--------------------------+-----------+------+
| table2_order order模式   |         1 |    2 |
+--------------------------+-----------+------+
alter table table2_order AUTO_INCREMENT = 127;
insert into table2_order(a) values(null),(null),(null),(null);
select txt,a incre_col,b from table2_order order by a;
+--------------------------+-----------+------+
| txt                      | incre_col | b    |
+--------------------------+-----------+------+
| table2_order order模式   |         1 |    2 |
| table2_order order模式   |       127 |    2 |
| table2_order order模式   |       127 |    2 |
| table2_order order模式   |       127 |    2 |
| table2_order order模式   |       127 |    2 |
+--------------------------+-----------+------+
insert into table2_order(a) values(10);
insert into table2_order(a,txt) values(0,'最新自增值=>');
select txt,a incre_col,b from table2_order order by a;
+--------------------------+-----------+------+
| txt                      | incre_col | b    |
+--------------------------+-----------+------+
| table2_order order模式   |         1 |    2 |
| table2_order order模式   |        10 |    2 |
| table2_order order模式   |       127 |    2 |
| table2_order order模式   |       127 |    2 |
| table2_order order模式   |       127 |    2 |
| table2_order order模式   |       127 |    2 |
| 最新自增值=>             |       127 |    2 |
+--------------------------+-----------+------+
##table3_noorder
insert into table3_noorder(a) values(null);
select txt,a incre_col,b from table3_noorder order by a;
+------------------------------+-----------+------+
| txt                          | incre_col | b    |
+------------------------------+-----------+------+
| table3_noorder noorder模式   |         1 |    3 |
+------------------------------+-----------+------+
alter table table3_noorder AUTO_INCREMENT = 127;
insert into table3_noorder(a) values(null),(null),(null),(null);
select txt,a incre_col,b from table3_noorder order by a;
+------------------------------+-----------+------+
| txt                          | incre_col | b    |
+------------------------------+-----------+------+
| table3_noorder noorder模式   |         1 |    3 |
| table3_noorder noorder模式   |       127 |    3 |
| table3_noorder noorder模式   |       127 |    3 |
| table3_noorder noorder模式   |       127 |    3 |
| table3_noorder noorder模式   |       127 |    3 |
+------------------------------+-----------+------+
insert into table3_noorder(a) values(10);
insert into table3_noorder(a,txt) values(0,'最新自增值=>');
select txt,a incre_col,b from table3_noorder order by a;
+------------------------------+-----------+------+
| txt                          | incre_col | b    |
+------------------------------+-----------+------+
| table3_noorder noorder模式   |         1 |    3 |
| table3_noorder noorder模式   |        10 |    3 |
| table3_noorder noorder模式   |       127 |    3 |
| table3_noorder noorder模式   |       127 |    3 |
| table3_noorder noorder模式   |       127 |    3 |
| table3_noorder noorder模式   |       127 |    3 |
| 最新自增值=>                 |       127 |    3 |
+------------------------------+-----------+------+
##REPLACE 语句
replace into table1_default(a) values(0),(0),(0);
select txt,a incre_col,b from table1_default order by a;
+------------------------------------+-----------+------+
| txt                                | incre_col | b    |
+------------------------------------+-----------+------+
| table1_default 默认noorder模式     |         1 |    1 |
| table1_default 默认noorder模式     |        10 |    1 |
| table1_default 默认noorder模式     |       127 |    1 |
| table1_default 默认noorder模式     |       127 |    1 |
| table1_default 默认noorder模式     |       127 |    1 |
| table1_default 默认noorder模式     |       127 |    1 |
| 最新自增值=>                       |       127 |    1 |
| table1_default 默认noorder模式     |       127 |    1 |
| table1_default 默认noorder模式     |       127 |    1 |
| table1_default 默认noorder模式     |       127 |    1 |
+------------------------------------+-----------+------+
replace into table1_default values(5,11,'replace');
insert into table1_default(a,txt) values(0,'最新自增值=>');
select txt,a incre_col,b from table1_default order by a;
+------------------------------------+-----------+------+
| txt                                | incre_col | b    |
+------------------------------------+-----------+------+
| table1_default 默认noorder模式     |         1 |    1 |
| replace                            |         5 |   11 |
| table1_default 默认noorder模式     |        10 |    1 |
| table1_default 默认noorder模式     |       127 |    1 |
| table1_default 默认noorder模式     |       127 |    1 |
| table1_default 默认noorder模式     |       127 |    1 |
| table1_default 默认noorder模式     |       127 |    1 |
| 最新自增值=>                       |       127 |    1 |
| table1_default 默认noorder模式     |       127 |    1 |
| table1_default 默认noorder模式     |       127 |    1 |
| table1_default 默认noorder模式     |       127 |    1 |
| 最新自增值=>                       |       127 |    1 |
+------------------------------------+-----------+------+
replace into table2_order(a) values(0),(0),(0);
select txt,a incre_col,b from table2_order order by a;
+--------------------------+-----------+------+
| txt                      | incre_col | b    |
+--------------------------+-----------+------+
| table2_order order模式   |         1 |    2 |
| table2_order order模式   |        10 |    2 |
| table2_order order模式   |       127 |    2 |
| table2_order order模式   |       127 |    2 |
| table2_order order模式   |       127 |    2 |
| table2_order order模式   |       127 |    2 |
| 最新自增值=>             |       127 |    2 |
| table2_order order模式   |       127 |    2 |
| table2_order order模式   |       127 |    2 |
| table2_order order模式   |       127 |    2 |
+--------------------------+-----------+------+
replace into table2_order values(5,22,'replace');
insert into table2_order(a,txt) values(0,'最新自增值=>');
select txt,a incre_col,b from table2_order order by a;
+--------------------------+-----------+------+
| txt                      | incre_col | b    |
+--------------------------+-----------+------+
| table2_order order模式   |         1 |    2 |
| replace                  |         5 |   22 |
| table2_order order模式   |        10 |    2 |
| table2_order order模式   |       127 |    2 |
| table2_order order模式   |       127 |    2 |
| table2_order order模式   |       127 |    2 |
| table2_order order模式   |       127 |    2 |
| 最新自增值=>             |       127 |    2 |
| table2_order order模式   |       127 |    2 |
| table2_order order模式   |       127 |    2 |
| table2_order order模式   |       127 |    2 |
| 最新自增值=>             |       127 |    2 |
+--------------------------+-----------+------+
replace into table3_noorder(a) values(null),(null),(null);
select txt,a incre_col,b from table3_noorder order by a;
+------------------------------+-----------+------+
| txt                          | incre_col | b    |
+------------------------------+-----------+------+
| table3_noorder noorder模式   |         1 |    3 |
| table3_noorder noorder模式   |        10 |    3 |
| table3_noorder noorder模式   |       127 |    3 |
| table3_noorder noorder模式   |       127 |    3 |
| table3_noorder noorder模式   |       127 |    3 |
| table3_noorder noorder模式   |       127 |    3 |
| 最新自增值=>                 |       127 |    3 |
| table3_noorder noorder模式   |       127 |    3 |
| table3_noorder noorder模式   |       127 |    3 |
| table3_noorder noorder模式   |       127 |    3 |
+------------------------------+-----------+------+
replace into table3_noorder values(5,33,'replace');
insert into table3_noorder(a,txt) values(0,'最新自增值=>');
select txt,a incre_col,b from table3_noorder order by a;
+------------------------------+-----------+------+
| txt                          | incre_col | b    |
+------------------------------+-----------+------+
| table3_noorder noorder模式   |         1 |    3 |
| replace                      |         5 |   33 |
| table3_noorder noorder模式   |        10 |    3 |
| table3_noorder noorder模式   |       127 |    3 |
| table3_noorder noorder模式   |       127 |    3 |
| table3_noorder noorder模式   |       127 |    3 |
| table3_noorder noorder模式   |       127 |    3 |
| 最新自增值=>                 |       127 |    3 |
| table3_noorder noorder模式   |       127 |    3 |
| table3_noorder noorder模式   |       127 |    3 |
| table3_noorder noorder模式   |       127 |    3 |
| 最新自增值=>                 |       127 |    3 |
+------------------------------+-----------+------+
##测试点 - 将任何其他值插入 AUTO_INCREMENT列
##INSERT 语句
truncate table table1_default;
insert into table1_default(a) values(0);
insert into table1_default(a) values(15),(-25),(35),(45.5);
insert into table1_default(a,txt) values(0,'最新自增值=>');
select txt,a incre_col,b from table1_default order by a;
+------------------------------------+-----------+------+
| txt                                | incre_col | b    |
+------------------------------------+-----------+------+
| table1_default 默认noorder模式     |       -25 |    1 |
| table1_default 默认noorder模式     |         1 |    1 |
| table1_default 默认noorder模式     |        15 |    1 |
| table1_default 默认noorder模式     |        35 |    1 |
| table1_default 默认noorder模式     |        46 |    1 |
| 最新自增值=>                       |        47 |    1 |
+------------------------------------+-----------+------+
truncate table table2_order;
insert into table2_order(a) values(0);
insert into table2_order(a) values(15),(-25),(35),(45.5);
insert into table2_order(a,txt) values(0,'最新自增值=>');
select txt,a incre_col,b from table2_order order by a;
+--------------------------+-----------+------+
| txt                      | incre_col | b    |
+--------------------------+-----------+------+
| table2_order order模式   |       -25 |    2 |
| table2_order order模式   |         1 |    2 |
| table2_order order模式   |        15 |    2 |
| table2_order order模式   |        35 |    2 |
| table2_order order模式   |        46 |    2 |
| 最新自增值=>             |        47 |    2 |
+--------------------------+-----------+------+
truncate table table3_noorder;
insert into table3_noorder(a) values(0);
insert into table3_noorder(a) values(15),(-25),(35),(45.5);
insert into table3_noorder(a,txt) values(0,'最新自增值=>');
select txt,a incre_col,b from table3_noorder order by a;
+------------------------------+-----------+------+
| txt                          | incre_col | b    |
+------------------------------+-----------+------+
| table3_noorder noorder模式   |       -25 |    3 |
| table3_noorder noorder模式   |         1 |    3 |
| table3_noorder noorder模式   |        15 |    3 |
| table3_noorder noorder模式   |        35 |    3 |
| table3_noorder noorder模式   |        46 |    3 |
| 最新自增值=>                 |       127 |    3 |
+------------------------------+-----------+------+
##REPLACE 语句
truncate table table1_default;
replace into table1_default(a,txt) values(3,'new-3'),(-5,'new--5'),(10,'new-10'),(15.5,'new-15.5');
select txt,a incre_col,b from table1_default order by a;
+----------+-----------+------+
| txt      | incre_col | b    |
+----------+-----------+------+
| new--5   |        -5 |    1 |
| new-3    |         3 |    1 |
| new-10   |        10 |    1 |
| new-15.5 |        16 |    1 |
+----------+-----------+------+
insert into table1_default(a,txt) values(0,'最新自增值1=>');
select txt,a incre_col,b from table1_default order by a;
+--------------------+-----------+------+
| txt                | incre_col | b    |
+--------------------+-----------+------+
| new--5             |        -5 |    1 |
| new-3              |         3 |    1 |
| new-10             |        10 |    1 |
| new-15.5           |        16 |    1 |
| 最新自增值1=>      |        17 |    1 |
+--------------------+-----------+------+
truncate table table2_order;
replace into table2_order(a,txt) values(3,'new-3'),(-5,'new--5'),(10,'new-10'),(15.5,'new-15.5');
select txt,a incre_col,b from table2_order order by a;
+----------+-----------+------+
| txt      | incre_col | b    |
+----------+-----------+------+
| new--5   |        -5 |    2 |
| new-3    |         3 |    2 |
| new-10   |        10 |    2 |
| new-15.5 |        16 |    2 |
+----------+-----------+------+
insert into table2_order(a,txt) values(0,'最新自增值1=>');
select txt,a incre_col,b from table2_order order by a;
+--------------------+-----------+------+
| txt                | incre_col | b    |
+--------------------+-----------+------+
| new--5             |        -5 |    2 |
| new-3              |         3 |    2 |
| new-10             |        10 |    2 |
| new-15.5           |        16 |    2 |
| 最新自增值1=>      |        17 |    2 |
+--------------------+-----------+------+
truncate table table3_noorder;
replace into table3_noorder(a,txt) values(3,'new-3'),(-5,'new--5'),(10,'new-10'),(15.5,'new-15.5');
select txt,a incre_col,b from table3_noorder order by a;
+----------+-----------+------+
| txt      | incre_col | b    |
+----------+-----------+------+
| new--5   |        -5 |    3 |
| new-3    |         3 |    3 |
| new-10   |        10 |    3 |
| new-15.5 |        16 |    3 |
+----------+-----------+------+
insert into table3_noorder(a,txt) values(0,'最新自增值1=>');
select txt,a incre_col,b from table3_noorder order by a;
+--------------------+-----------+------+
| txt                | incre_col | b    |
+--------------------+-----------+------+
| new--5             |        -5 |    3 |
| new-3              |         3 |    3 |
| new-10             |        10 |    3 |
| new-15.5           |        16 |    3 |
| 最新自增值1=>      |       127 |    3 |
+--------------------+-----------+------+
##测试点 - 给AUTO_INCREMENT列插入下一个自增值（当前最大自增值+1），再查看最新自增值
##INSERT 语句
truncate table table1_default;
insert into table1_default(a) values(0);
insert into table1_default(a,txt) values(2,'插入下一个自增值2（当前最大自增值+1）');
insert into table1_default(a,txt) values(0,'最新自增值=>');
select txt,a incre_col,b from table1_default order by a;
+--------------------------------------------------------+-----------+------+
| txt                                                    | incre_col | b    |
+--------------------------------------------------------+-----------+------+
| table1_default 默认noorder模式                         |         1 |    1 |
| 插入下一个自增值2（当前最大自增值+1）                  |         2 |    1 |
| 最新自增值=>                                           |         3 |    1 |
+--------------------------------------------------------+-----------+------+
truncate table table2_order;
insert into table2_order(a) values(0);
insert into table2_order(a,txt) values(2,'插入下一个自增值2（当前最大自增值+1）');
insert into table2_order(a,txt) values(0,'最新自增值=>');
select txt,a incre_col,b from table2_order order by a;
+--------------------------------------------------------+-----------+------+
| txt                                                    | incre_col | b    |
+--------------------------------------------------------+-----------+------+
| table2_order order模式                                 |         1 |    2 |
| 插入下一个自增值2（当前最大自增值+1）                  |         2 |    2 |
| 最新自增值=>                                           |         3 |    2 |
+--------------------------------------------------------+-----------+------+
truncate table table3_noorder;
insert into table3_noorder(a) values(0);
insert into table3_noorder(a,txt) values(2,'插入下一个自增值2（当前最大自增值+1）');
insert into table3_noorder(a,txt) values(0,'最新自增值=>');
select txt,a incre_col,b from table3_noorder order by a;
+--------------------------------------------------------+-----------+------+
| txt                                                    | incre_col | b    |
+--------------------------------------------------------+-----------+------+
| table3_noorder noorder模式                             |         1 |    3 |
| 插入下一个自增值2（当前最大自增值+1）                  |         2 |    3 |
| 最新自增值=>                                           |       127 |    3 |
+--------------------------------------------------------+-----------+------+
##REPLACE 语句
truncate table table1_default;
insert into table1_default(a) values(0);
replace into table1_default(a,txt) values(2,'插入下一个自增值2（当前最大自增值+1）');
insert into table1_default(a,txt) values(0,'最新自增值=>');
select txt,a incre_col,b from table1_default order by a;
+--------------------------------------------------------+-----------+------+
| txt                                                    | incre_col | b    |
+--------------------------------------------------------+-----------+------+
| table1_default 默认noorder模式                         |         1 |    1 |
| 插入下一个自增值2（当前最大自增值+1）                  |         2 |    1 |
| 最新自增值=>                                           |         3 |    1 |
+--------------------------------------------------------+-----------+------+
truncate table table2_order;
insert into table2_order(a) values(0);
replace into table2_order(a,txt) values(2,'插入下一个自增值2（当前最大自增值+1）');
insert into table2_order(a,txt) values(0,'最新自增值=>');
select txt,a incre_col,b from table2_order order by a;
+--------------------------------------------------------+-----------+------+
| txt                                                    | incre_col | b    |
+--------------------------------------------------------+-----------+------+
| table2_order order模式                                 |         1 |    2 |
| 插入下一个自增值2（当前最大自增值+1）                  |         2 |    2 |
| 最新自增值=>                                           |         3 |    2 |
+--------------------------------------------------------+-----------+------+
truncate table table3_noorder;
insert into table3_noorder(a) values(0);
replace into table3_noorder(a,txt) values(2,'插入下一个自增值2（当前最大自增值+1）');
insert into table3_noorder(a,txt) values(0,'最新自增值=>');
select txt,a incre_col,b from table3_noorder order by a;
+--------------------------------------------------------+-----------+------+
| txt                                                    | incre_col | b    |
+--------------------------------------------------------+-----------+------+
| table3_noorder noorder模式                             |         1 |    3 |
| 插入下一个自增值2（当前最大自增值+1）                  |         2 |    3 |
| 最新自增值=>                                           |       127 |    3 |
+--------------------------------------------------------+-----------+------+
##测试点 - 给表插入数据时引用AUTO_INCREMENT列的值
##INSERT 语句
drop table table1_default;
create table table1_default (
  a tinyint auto_increment,
  b tinyint default 1,
  txt varchar(64) default 'table1_default 默认noorder模式',
  index index_name (a,b)
);
drop table table2_order;
create table table2_order (
  a tinyint auto_increment,
  b tinyint default 2,
  txt varchar(64) default 'table2_order order模式',
  index index_name (a,b)
) auto_increment_mode = 'order';
drop table table3_noorder;
create table table3_noorder (
  a tinyint auto_increment,
  b tinyint default 3,
  txt varchar(64) default 'table3_noorder noorder模式',
  index index_name (a,b)
) auto_increment_mode = 'noorder';
truncate table table1_default;
insert into table1_default(a) values(0);
insert into table1_default values(null,a*2,'引用AUTO_INCREMENT列的值');
insert into table1_default(a,txt) values(0,'最新自增值=>');
select txt,a incre_col,b from table1_default order by a;
+------------------------------------+-----------+------+
| txt                                | incre_col | b    |
+------------------------------------+-----------+------+
| table1_default 默认noorder模式     |         1 |    1 |
| 引用AUTO_INCREMENT列的值           |         2 |    4 |
| 最新自增值=>                       |         3 |    1 |
+------------------------------------+-----------+------+
truncate table table2_order;
insert into table2_order(a) values(0);
insert into table2_order values(null,a*2,'引用AUTO_INCREMENT列的值');
insert into table2_order(a,txt) values(0,'最新自增值=>');
select txt,a incre_col,b from table2_order order by a;
+-------------------------------+-----------+------+
| txt                           | incre_col | b    |
+-------------------------------+-----------+------+
| table2_order order模式        |         1 |    2 |
| 引用AUTO_INCREMENT列的值      |         2 |    4 |
| 最新自增值=>                  |         3 |    2 |
+-------------------------------+-----------+------+
truncate table table3_noorder;
insert into table3_noorder(a) values(0);
insert into table3_noorder values(null,a*2,'引用AUTO_INCREMENT列的值');
insert into table3_noorder(a,txt) values(0,'最新自增值=>');
select txt,a incre_col,b from table3_noorder order by a;
+-------------------------------+-----------+------+
| txt                           | incre_col | b    |
+-------------------------------+-----------+------+
| table3_noorder noorder模式    |         1 |    3 |
| 引用AUTO_INCREMENT列的值      |         2 |    4 |
| 最新自增值=>                  |       127 |    3 |
+-------------------------------+-----------+------+
##REPLACE 语句 
truncate table table1_default;
insert into table1_default(a) values(0);
replace into table1_default values(null,a*2,'引用AUTO_INCREMENT列的值');
insert into table1_default(a,txt) values(0,'最新自增值=>');
select txt,a incre_col,b from table1_default order by a;
+------------------------------------+-----------+------+
| txt                                | incre_col | b    |
+------------------------------------+-----------+------+
| table1_default 默认noorder模式     |         1 |    1 |
| 引用AUTO_INCREMENT列的值           |         2 |    4 |
| 最新自增值=>                       |         3 |    1 |
+------------------------------------+-----------+------+
truncate table table2_order;
insert into table2_order(a) values(0);
replace into table2_order values(null,a*2,'引用AUTO_INCREMENT列的值');
insert into table2_order(a,txt) values(0,'最新自增值=>');
select txt,a incre_col,b from table2_order order by a;
+-------------------------------+-----------+------+
| txt                           | incre_col | b    |
+-------------------------------+-----------+------+
| table2_order order模式        |         1 |    2 |
| 引用AUTO_INCREMENT列的值      |         2 |    4 |
| 最新自增值=>                  |         3 |    2 |
+-------------------------------+-----------+------+
truncate table table3_noorder;
insert into table3_noorder(a) values(0);
replace into table3_noorder values(null,a*2,'引用AUTO_INCREMENT列的值');
insert into table3_noorder(a,txt) values(0,'最新自增值=>');
select txt,a incre_col,b from table3_noorder order by a;
+-------------------------------+-----------+------+
| txt                           | incre_col | b    |
+-------------------------------+-----------+------+
| table3_noorder noorder模式    |         1 |    3 |
| 引用AUTO_INCREMENT列的值      |         2 |    4 |
| 最新自增值=>                  |       127 |    3 |
+-------------------------------+-----------+------+
##批量插入
##INSERT ... SELECT语句
truncate table table1_default;
insert into table1_default(a) values(0);
insert into table1_default select a,b,txt from table0_date where a <= 102;
select txt,a incre_col,b from table1_default order by a;
+------------------------------------+-----------+------+
| txt                                | incre_col | b    |
+------------------------------------+-----------+------+
| table1_default 默认noorder模式     |         1 |    1 |
| table0_date                        |       100 |    0 |
| table0_date                        |       101 |    0 |
| table0_date                        |       102 |    0 |
+------------------------------------+-----------+------+
insert into table1_default(a,txt) values(0,'最新自增值=>');
select txt,a incre_col,b from table1_default order by a;
+------------------------------------+-----------+------+
| txt                                | incre_col | b    |
+------------------------------------+-----------+------+
| table1_default 默认noorder模式     |         1 |    1 |
| table0_date                        |       100 |    0 |
| table0_date                        |       101 |    0 |
| table0_date                        |       102 |    0 |
| 最新自增值=>                       |       103 |    1 |
+------------------------------------+-----------+------+
truncate table table2_order;
insert into table2_order(a) values(0);
insert into table2_order select a,b,txt from table0_date where a <= 102;
select txt,a incre_col,b from table2_order order by a;
+--------------------------+-----------+------+
| txt                      | incre_col | b    |
+--------------------------+-----------+------+
| table2_order order模式   |         1 |    2 |
| table0_date              |       100 |    0 |
| table0_date              |       101 |    0 |
| table0_date              |       102 |    0 |
+--------------------------+-----------+------+
insert into table2_order(a,txt) values(0,'最新自增值=>');
select txt,a incre_col,b from table2_order order by a;
+--------------------------+-----------+------+
| txt                      | incre_col | b    |
+--------------------------+-----------+------+
| table2_order order模式   |         1 |    2 |
| table0_date              |       100 |    0 |
| table0_date              |       101 |    0 |
| table0_date              |       102 |    0 |
| 最新自增值=>             |       103 |    2 |
+--------------------------+-----------+------+
truncate table table3_noorder;
insert into table3_noorder(a) values(0);
insert into table3_noorder select a,b,txt from table0_date where a <= 102;
select txt,a incre_col,b from table3_noorder order by a;
+------------------------------+-----------+------+
| txt                          | incre_col | b    |
+------------------------------+-----------+------+
| table3_noorder noorder模式   |         1 |    3 |
| table0_date                  |       100 |    0 |
| table0_date                  |       101 |    0 |
| table0_date                  |       102 |    0 |
+------------------------------+-----------+------+
insert into table3_noorder(a,txt) values(0,'最新自增值=>');
select txt,a incre_col,b from table3_noorder order by a;
+------------------------------+-----------+------+
| txt                          | incre_col | b    |
+------------------------------+-----------+------+
| table3_noorder noorder模式   |         1 |    3 |
| table0_date                  |       100 |    0 |
| table0_date                  |       101 |    0 |
| table0_date                  |       102 |    0 |
| 最新自增值=>                 |       127 |    3 |
+------------------------------+-----------+------+
##REPLACE ... SELECT语句 
truncate table table1_default;
insert into table1_default(a) values(0);
replace into table1_default select a,b,txt from table0_date where a >= 102;
select txt,a incre_col,b from table1_default order by a;
+------------------------------------+-----------+------+
| txt                                | incre_col | b    |
+------------------------------------+-----------+------+
| table1_default 默认noorder模式     |         1 |    1 |
| table0_date                        |       102 |    0 |
| table0_date                        |       103 |    0 |
| table0_date                        |       104 |    0 |
| table0_date                        |       105 |    0 |
+------------------------------------+-----------+------+
insert into table1_default(a,txt) values(0,'最新自增值=>');
select txt,a incre_col,b from table1_default order by a;
+------------------------------------+-----------+------+
| txt                                | incre_col | b    |
+------------------------------------+-----------+------+
| table1_default 默认noorder模式     |         1 |    1 |
| table0_date                        |       102 |    0 |
| table0_date                        |       103 |    0 |
| table0_date                        |       104 |    0 |
| table0_date                        |       105 |    0 |
| 最新自增值=>                       |       106 |    1 |
+------------------------------------+-----------+------+
truncate table table2_order;
insert into table2_order(a) values(0);
replace into table2_order select a,b,txt from table0_date where a >= 102;
select txt,a incre_col,b from table2_order order by a;
+--------------------------+-----------+------+
| txt                      | incre_col | b    |
+--------------------------+-----------+------+
| table2_order order模式   |         1 |    2 |
| table0_date              |       102 |    0 |
| table0_date              |       103 |    0 |
| table0_date              |       104 |    0 |
| table0_date              |       105 |    0 |
+--------------------------+-----------+------+
insert into table2_order(a,txt) values(0,'最新自增值=>');
select txt,a incre_col,b from table2_order order by a;
+--------------------------+-----------+------+
| txt                      | incre_col | b    |
+--------------------------+-----------+------+
| table2_order order模式   |         1 |    2 |
| table0_date              |       102 |    0 |
| table0_date              |       103 |    0 |
| table0_date              |       104 |    0 |
| table0_date              |       105 |    0 |
| 最新自增值=>             |       106 |    2 |
+--------------------------+-----------+------+
truncate table table3_noorder;
insert into table3_noorder(a) values(0);
replace into table3_noorder select a,b,txt from table0_date where a >= 102;
select txt,a incre_col,b from table3_noorder order by a;
+------------------------------+-----------+------+
| txt                          | incre_col | b    |
+------------------------------+-----------+------+
| table3_noorder noorder模式   |         1 |    3 |
| table0_date                  |       102 |    0 |
| table0_date                  |       103 |    0 |
| table0_date                  |       104 |    0 |
| table0_date                  |       105 |    0 |
+------------------------------+-----------+------+
insert into table3_noorder(a,txt) values(0,'最新自增值=>');
select txt,a incre_col,b from table3_noorder order by a;
+------------------------------+-----------+------+
| txt                          | incre_col | b    |
+------------------------------+-----------+------+
| table3_noorder noorder模式   |         1 |    3 |
| table0_date                  |       102 |    0 |
| table0_date                  |       103 |    0 |
| table0_date                  |       104 |    0 |
| table0_date                  |       105 |    0 |
| 最新自增值=>                 |       127 |    3 |
+------------------------------+-----------+------+
##混合插入
##INSERT ... ON DUPLICATE KEY UPDATE 语句 
truncate table table1_default;
insert into table1_default(a) values(0);
insert into table1_default (a,b,txt) values (1,1,'table1_default 默认noorder模式') on duplicate key update b=b+1,txt='insert...on duplicate key update 语句';
insert into table1_default(a,txt) values(0,'最新自增值=>');
select txt,a incre_col,b from table1_default order by a;
+------------------------------------+-----------+------+
| txt                                | incre_col | b    |
+------------------------------------+-----------+------+
| table1_default 默认noorder模式     |         1 |    1 |
| table1_default 默认noorder模式     |         1 |    1 |
| 最新自增值=>                       |         2 |    1 |
+------------------------------------+-----------+------+
insert into table1_default (a,b,txt) values (50,1,'不重复场合') on duplicate key update b=b+1,txt='insert...on duplicate key update 语句';
insert into table1_default(a,txt) values(0,'最新自增值=>');
select txt,a incre_col,b from table1_default order by a;
+------------------------------------+-----------+------+
| txt                                | incre_col | b    |
+------------------------------------+-----------+------+
| table1_default 默认noorder模式     |         1 |    1 |
| table1_default 默认noorder模式     |         1 |    1 |
| 最新自增值=>                       |         2 |    1 |
| 不重复场合                         |        50 |    1 |
| 最新自增值=>                       |        51 |    1 |
+------------------------------------+-----------+------+
truncate table table2_order;
insert into table2_order(a) values(0);
insert into table2_order (a,b,txt) values (1,2,'table2_order order模式') on duplicate key update b=b+1,txt='insert...on duplicate key update 语句';
insert into table2_order(a,txt) values(0,'最新自增值=>');
select txt,a incre_col,b from table2_order order by a;
+--------------------------+-----------+------+
| txt                      | incre_col | b    |
+--------------------------+-----------+------+
| table2_order order模式   |         1 |    2 |
| table2_order order模式   |         1 |    2 |
| 最新自增值=>             |         2 |    2 |
+--------------------------+-----------+------+
insert into table2_order (a,b,txt) values (50,2,'不重复场合') on duplicate key update b=b+1,txt='insert...on duplicate key update 语句';
insert into table2_order(a,txt) values(0,'最新自增值=>');
select txt,a incre_col,b from table2_order order by a;
+--------------------------+-----------+------+
| txt                      | incre_col | b    |
+--------------------------+-----------+------+
| table2_order order模式   |         1 |    2 |
| table2_order order模式   |         1 |    2 |
| 最新自增值=>             |         2 |    2 |
| 不重复场合               |        50 |    2 |
| 最新自增值=>             |        51 |    2 |
+--------------------------+-----------+------+
truncate table table3_noorder;
insert into table3_noorder(a) values(0);
insert into table3_noorder (a,b,txt) values (1,3,'table3_noorder noorder模式') on duplicate key update b=b+1,txt='insert...on duplicate key update 语句';
insert into table3_noorder(a,txt) values(0,'最新自增值=>');
select txt,a incre_col,b from table3_noorder order by a;
+------------------------------+-----------+------+
| txt                          | incre_col | b    |
+------------------------------+-----------+------+
| table3_noorder noorder模式   |         1 |    3 |
| table3_noorder noorder模式   |         1 |    3 |
| 最新自增值=>                 |       127 |    3 |
+------------------------------+-----------+------+
insert into table3_noorder (a,b,txt) values (50,3,'不重复场合') on duplicate key update b=b+1,txt='insert...on duplicate key update 语句';
insert into table3_noorder(a,txt) values(0,'最新自增值=>');
select txt,a incre_col,b from table3_noorder order by a;
+------------------------------+-----------+------+
| txt                          | incre_col | b    |
+------------------------------+-----------+------+
| table3_noorder noorder模式   |         1 |    3 |
| table3_noorder noorder模式   |         1 |    3 |
| 不重复场合                   |        50 |    3 |
| 最新自增值=>                 |       127 |    3 |
| 最新自增值=>                 |       127 |    3 |
+------------------------------+-----------+------+
##将NULL和任何其他值混合插入 AUTO_INCREMENT列
##INSERT 语句
truncate table table1_default;
insert into table1_default(a) values(0);
insert into table1_default(a) values(null),(10),(null),(20);
insert into table1_default(a,txt) values(0,'最新自增值1=>');
select txt,a incre_col,b from table1_default order by a;
+------------------------------------+-----------+------+
| txt                                | incre_col | b    |
+------------------------------------+-----------+------+
| table1_default 默认noorder模式     |         1 |    1 |
| table1_default 默认noorder模式     |         2 |    1 |
| table1_default 默认noorder模式     |        10 |    1 |
| table1_default 默认noorder模式     |        11 |    1 |
| table1_default 默认noorder模式     |        20 |    1 |
| 最新自增值1=>                      |        21 |    1 |
+------------------------------------+-----------+------+
truncate table table2_order;
insert into table2_order(a) values(0);
insert into table2_order(a) values(null),(10),(null),(20);
insert into table2_order(a,txt) values(0,'最新自增值=>');
select txt,a incre_col,b from table2_order order by a;
+--------------------------+-----------+------+
| txt                      | incre_col | b    |
+--------------------------+-----------+------+
| table2_order order模式   |         1 |    2 |
| table2_order order模式   |         2 |    2 |
| table2_order order模式   |        10 |    2 |
| table2_order order模式   |        11 |    2 |
| table2_order order模式   |        20 |    2 |
| 最新自增值=>             |        21 |    2 |
+--------------------------+-----------+------+
truncate table table3_noorder;
insert into table3_noorder(a) values(0);
insert into table3_noorder(a) values(null),(10),(null),(20);
select txt,a incre_col,b from table3_noorder order by a;
+------------------------------+-----------+------+
| txt                          | incre_col | b    |
+------------------------------+-----------+------+
| table3_noorder noorder模式   |         1 |    3 |
| table3_noorder noorder模式   |         2 |    3 |
| table3_noorder noorder模式   |        10 |    3 |
| table3_noorder noorder模式   |        20 |    3 |
| table3_noorder noorder模式   |       127 |    3 |
+------------------------------+-----------+------+
##REPLACE 语句
truncate table table1_default;
insert into table1_default(a) values(0);
replace into table1_default(a) values(null),(30),(null),(40);
insert into table1_default(a,txt) values(0,'最新自增值=>');
select txt,a incre_col,b from table1_default order by a;
+------------------------------------+-----------+------+
| txt                                | incre_col | b    |
+------------------------------------+-----------+------+
| table1_default 默认noorder模式     |         1 |    1 |
| table1_default 默认noorder模式     |         2 |    1 |
| table1_default 默认noorder模式     |        30 |    1 |
| table1_default 默认noorder模式     |        31 |    1 |
| table1_default 默认noorder模式     |        40 |    1 |
| 最新自增值=>                       |        41 |    1 |
+------------------------------------+-----------+------+
truncate table table2_order;
insert into table2_order(a) values(0);
replace into table2_order(a) values(null),(30),(null),(40);
insert into table2_order(a,txt) values(0,'最新自增值=>');
select txt,a incre_col,b from table2_order order by a;
+--------------------------+-----------+------+
| txt                      | incre_col | b    |
+--------------------------+-----------+------+
| table2_order order模式   |         1 |    2 |
| table2_order order模式   |         2 |    2 |
| table2_order order模式   |        30 |    2 |
| table2_order order模式   |        31 |    2 |
| table2_order order模式   |        40 |    2 |
| 最新自增值=>             |        41 |    2 |
+--------------------------+-----------+------+
truncate table table3_noorder;
insert into table3_noorder(a) values(0);
replace into table3_noorder(a) values(null),(30),(null),(40);
select txt,a incre_col,b from table3_noorder order by a;
+------------------------------+-----------+------+
| txt                          | incre_col | b    |
+------------------------------+-----------+------+
| table3_noorder noorder模式   |         1 |    3 |
| table3_noorder noorder模式   |         2 |    3 |
| table3_noorder noorder模式   |        30 |    3 |
| table3_noorder noorder模式   |        40 |    3 |
| table3_noorder noorder模式   |       127 |    3 |
+------------------------------+-----------+------+
###### auto_incre_3-1-2 ②DELETE操作
truncate table table1_default;
insert into table1_default(a) values(0);
insert into table1_default(a,b) values(null,11),(null,11);
select txt,a incre_col,b from table1_default order by a;
+------------------------------------+-----------+------+
| txt                                | incre_col | b    |
+------------------------------------+-----------+------+
| table1_default 默认noorder模式     |         1 |    1 |
| table1_default 默认noorder模式     |         2 |   11 |
| table1_default 默认noorder模式     |         3 |   11 |
+------------------------------------+-----------+------+
delete from table1_default where b=11;
insert into table1_default(a,txt) values(0,'最新自增值=>');
select txt,a incre_col,b from table1_default order by a;
+------------------------------------+-----------+------+
| txt                                | incre_col | b    |
+------------------------------------+-----------+------+
| table1_default 默认noorder模式     |         1 |    1 |
| 最新自增值=>                       |         4 |    1 |
+------------------------------------+-----------+------+
truncate table table2_order;
insert into table2_order(a) values(0);
insert into table2_order(a,b) values(null,22),(null,22);
select txt,a incre_col,b from table2_order order by a;
+--------------------------+-----------+------+
| txt                      | incre_col | b    |
+--------------------------+-----------+------+
| table2_order order模式   |         1 |    2 |
| table2_order order模式   |         2 |   22 |
| table2_order order模式   |         3 |   22 |
+--------------------------+-----------+------+
delete from table2_order where b=22;
insert into table2_order(a,txt) values(0,'最新自增值=>');
select txt,a incre_col,b from table2_order order by a;
+--------------------------+-----------+------+
| txt                      | incre_col | b    |
+--------------------------+-----------+------+
| table2_order order模式   |         1 |    2 |
| 最新自增值=>             |         4 |    2 |
+--------------------------+-----------+------+
truncate table table3_noorder;
insert into table3_noorder(a) values(0);
insert into table3_noorder(a,b) values(null,33),(null,33);
select txt,a incre_col,b from table3_noorder order by a;
+------------------------------+-----------+------+
| txt                          | incre_col | b    |
+------------------------------+-----------+------+
| table3_noorder noorder模式   |         1 |    3 |
| table3_noorder noorder模式   |         2 |   33 |
| table3_noorder noorder模式   |         3 |   33 |
+------------------------------+-----------+------+
delete from table3_noorder where b=33;
insert into table3_noorder(a,txt) values(0,'最新自增值=>');
select txt,a incre_col,b from table3_noorder order by a;
+------------------------------+-----------+------+
| txt                          | incre_col | b    |
+------------------------------+-----------+------+
| table3_noorder noorder模式   |         1 |    3 |
| 最新自增值=>                 |         4 |    3 |
+------------------------------+-----------+------+
###### auto_incre_3-1-3 ③UPDATE操作
# mysql 5.x update没有推高这个自增值，和我们现在是兼容的；8.x update会推高
##更新现有AUTO_INCREMENT列值
truncate table table1_default;
insert into table1_default(a) values(0);
insert into table1_default(a,b) values(null,111);
select txt,a incre_col,b from table1_default order by a;
+------------------------------------+-----------+------+
| txt                                | incre_col | b    |
+------------------------------------+-----------+------+
| table1_default 默认noorder模式     |         1 |    1 |
| table1_default 默认noorder模式     |         2 |  111 |
+------------------------------------+-----------+------+
update table1_default set a = 0,txt = '将AUTO_INCREMENT列值设置为小于/等于当前最大自增值的值' where b = 111;
insert into table1_default values(null,11,'1当前自增值=>');
select txt,a incre_col,b from table1_default order by a;
+--------------------------------------------------------------------------+-----------+------+
| txt                                                                      | incre_col | b    |
+--------------------------------------------------------------------------+-----------+------+
| 将AUTO_INCREMENT列值设置为小于/等于当前最大自增值的值                    |         0 |  111 |
| table1_default 默认noorder模式                                           |         1 |    1 |
| 1当前自增值=>                                                            |         3 |   11 |
+--------------------------------------------------------------------------+-----------+------+
update table1_default set a = 20 ,txt = '将AUTO_INCREMENT列值设置为大于当前最大自增值的值' where b = 111;
insert into table1_default values(null,11,'2当前自增值=>');
select txt,a incre_col,b from table1_default order by a;
+-------------------------------------------------------------------+-----------+------+
| txt                                                               | incre_col | b    |
+-------------------------------------------------------------------+-----------+------+
| table1_default 默认noorder模式                                    |         1 |    1 |
| 1当前自增值=>                                                     |         3 |   11 |
| 2当前自增值=>                                                     |         4 |   11 |
| 将AUTO_INCREMENT列值设置为大于当前最大自增值的值                  |        20 |  111 |
+-------------------------------------------------------------------+-----------+------+
##table2_order
truncate table table2_order;
insert into table2_order(a) values(0);
insert into table2_order(a,b) values(null,20);
select txt,a incre_col,b from table2_order order by a;
+--------------------------+-----------+------+
| txt                      | incre_col | b    |
+--------------------------+-----------+------+
| table2_order order模式   |         1 |    2 |
| table2_order order模式   |         2 |   20 |
+--------------------------+-----------+------+
update table2_order set a = 0,txt = '将AUTO_INCREMENT列值设置为小于/等于当前最大自增值的值' where b = 20;
insert into table2_order values(null,22,'1当前自增值=>');
select txt,a incre_col,b from table2_order order by a;
+--------------------------------------------------------------------------+-----------+------+
| txt                                                                      | incre_col | b    |
+--------------------------------------------------------------------------+-----------+------+
| 将AUTO_INCREMENT列值设置为小于/等于当前最大自增值的值                    |         0 |   20 |
| table2_order order模式                                                   |         1 |    2 |
| 1当前自增值=>                                                            |         3 |   22 |
+--------------------------------------------------------------------------+-----------+------+
update table2_order set a = 30 ,txt = '将AUTO_INCREMENT列值设置为大于当前最大自增值的值' where b = 20;
insert into table2_order values(null,22,'2当前自增值=>');
select txt,a incre_col,b from table2_order order by a;
+-------------------------------------------------------------------+-----------+------+
| txt                                                               | incre_col | b    |
+-------------------------------------------------------------------+-----------+------+
| table2_order order模式                                            |         1 |    2 |
| 1当前自增值=>                                                     |         3 |   22 |
| 2当前自增值=>                                                     |         4 |   22 |
| 将AUTO_INCREMENT列值设置为大于当前最大自增值的值                  |        30 |   20 |
+-------------------------------------------------------------------+-----------+------+
##table3_noorder
truncate table table3_noorder;
insert into table3_noorder(a) values(0);
insert into table3_noorder(a,b) values(null,30);
select txt,a incre_col,b from table3_noorder order by a;
+------------------------------+-----------+------+
| txt                          | incre_col | b    |
+------------------------------+-----------+------+
| table3_noorder noorder模式   |         1 |    3 |
| table3_noorder noorder模式   |         2 |   30 |
+------------------------------+-----------+------+
update table3_noorder set a = 0,txt = '将AUTO_INCREMENT列值设置为小于/等于当前最大自增值的值' where b = 30;
insert into table3_noorder values(null,33,'1当前自增值=>');
select txt,a incre_col,b from table3_noorder order by a;
+--------------------------------------------------------------------------+-----------+------+
| txt                                                                      | incre_col | b    |
+--------------------------------------------------------------------------+-----------+------+
| 将AUTO_INCREMENT列值设置为小于/等于当前最大自增值的值                    |         0 |   30 |
| table3_noorder noorder模式                                               |         1 |    3 |
| 1当前自增值=>                                                            |         3 |   33 |
+--------------------------------------------------------------------------+-----------+------+
update table3_noorder set a = 20 ,txt = '将AUTO_INCREMENT列值设置为大于当前最大自增值的值' where b = 30;
insert into table3_noorder values(null,33,'2当前自增值=>');
select txt,a incre_col,b from table3_noorder order by a;
+-------------------------------------------------------------------+-----------+------+
| txt                                                               | incre_col | b    |
+-------------------------------------------------------------------+-----------+------+
| table3_noorder noorder模式                                        |         1 |    3 |
| 1当前自增值=>                                                     |         3 |   33 |
| 2当前自增值=>                                                     |         4 |   33 |
| 将AUTO_INCREMENT列值设置为大于当前最大自增值的值                  |        20 |   30 |
+-------------------------------------------------------------------+-----------+------+
##更新其他列值时引用AUTO_INCREMENT列
delete from table1_default;
insert into table1_default(a,b,txt) values(null,0,'update');
select txt,a incre_col,b from table1_default order by a;
+--------+-----------+------+
| txt    | incre_col | b    |
+--------+-----------+------+
| update |         5 |    0 |
+--------+-----------+------+
update table1_default set b = a+1 where txt = 'update';
insert into table1_default values(null,11,'当前自增值==>');
select txt,a incre_col,b from table1_default order by a;
+--------------------+-----------+------+
| txt                | incre_col | b    |
+--------------------+-----------+------+
| update             |         5 |    6 |
| 当前自增值==>      |         6 |   11 |
+--------------------+-----------+------+
delete from table2_order;
insert into table2_order(a,b,txt) values(null,0,'update');
select txt,a incre_col,b from table2_order order by a;
+--------+-----------+------+
| txt    | incre_col | b    |
+--------+-----------+------+
| update |         5 |    0 |
+--------+-----------+------+
update table2_order set b = a+2 where txt = 'update';
insert into table2_order values(null,22,'当前自增值==>');
select txt,a incre_col,b from table2_order order by a;
+--------------------+-----------+------+
| txt                | incre_col | b    |
+--------------------+-----------+------+
| update             |         5 |    7 |
| 当前自增值==>      |         6 |   22 |
+--------------------+-----------+------+
delete from table3_noorder;
insert into table3_noorder(a,b,txt) values(null,0,'update');
select txt,a incre_col,b from table3_noorder order by a;
+--------+-----------+------+
| txt    | incre_col | b    |
+--------+-----------+------+
| update |         5 |    0 |
+--------+-----------+------+
update table3_noorder set b = a+3 where txt = 'update';
insert into table3_noorder values(null,33,'当前自增值==>');
select txt,a incre_col,b from table3_noorder order by a;
+--------------------+-----------+------+
| txt                | incre_col | b    |
+--------------------+-----------+------+
| update             |         5 |    8 |
| 当前自增值==>      |         6 |   33 |
+--------------------+-----------+------+
###### auto_incre_3-1-4 ④SELECT操作
select a incre_col from table1_default order by a;
+-----------+
| incre_col |
+-----------+
|         5 |
|         6 |
+-----------+
select abs(a) from table1_default order by a;
+--------+
| abs(a) |
+--------+
|      5 |
|      6 |
+--------+
select a+b from table1_default order by a;
+------+
| a+b  |
+------+
|   11 |
|   17 |
+------+
select a incre_col from table2_order order by a;
+-----------+
| incre_col |
+-----------+
|         5 |
|         6 |
+-----------+
select abs(a) from table2_order order by a;
+--------+
| abs(a) |
+--------+
|      5 |
|      6 |
+--------+
select a+b from table2_order order by a;
+------+
| a+b  |
+------+
|   12 |
|   28 |
+------+
select a incre_col from table3_noorder order by a;
+-----------+
| incre_col |
+-----------+
|         5 |
|         6 |
+-----------+
select abs(a) from table3_noorder order by a;
+--------+
| abs(a) |
+--------+
|      5 |
|      6 |
+--------+
select a+b from table3_noorder order by a;
+------+
| a+b  |
+------+
|   13 |
|   39 |
+------+
############ auto_incre_1-2-1，auto_incre_1-2-2 
############ 索引 - 普通索引，约束 - 外键约束
############ BIGINT 类型 
##建表
drop table table1_default;
drop table table2_order;
drop table table3_noorder;
drop table table0_date;
create table table0_date (
  a bigint unique auto_increment,
  b bigint default 0,
  txt varchar(64) default 'table0_date'
);
insert into table0_date(a) values(-10),(1),(2),(3),(4),(5),(6),(7),(8),(9);
insert into table0_date(a) values(10),(11),(12),(13),(14),(15),(16),(17),(50),(51);
insert into table0_date(a) values(1000001),(1000002),(1000003),(1000004),(1000005),(1000006),(1000007),(1000008);
insert into table0_date(a) values(2000001),(2000002),(2000003),(2000004),(2000005),(2000006),(2000007),(2000008);
insert into table0_date(a) values(3000001),(3000002),(3000003),(3000004),(3000005),(3000006),(3000007),(3000008);
drop table table1_default;
create table table1_default (
  a bigint unique auto_increment,
  b bigint default 1,
  txt varchar(64) default 'table1_default 默认noorder模式',
  index(a),
  constraint fk1 foreign key (a) references table0_date(a)on delete cascade
);
drop table table2_order;
create table table2_order (
  a bigint unique auto_increment,
  b bigint default 2,
  txt varchar(64) default 'table2_order order模式',
  index(a),
  constraint fk2 foreign key (a) references table0_date(a)on delete cascade
) auto_increment_mode = 'order';
drop table table3_noorder;
create table table3_noorder (
  a bigint unique auto_increment,
  b bigint default 3,
  txt varchar(64) default 'table3_noorder noorder模式',
  index(a),
  constraint fk3 foreign key (a) references table0_date(a)on delete cascade
) auto_increment_mode = 'noorder';
############ auto_incre_3-1 DML操作 ############
###### auto_incre_3-1-1 ①INSERT操作 
##简单插入
##INSERT 语句 
##table1_default
insert into table1_default(a) values(null),(null),(null);
select txt,a incre_col,b from table1_default order by a;
+------------------------------------+-----------+------+
| txt                                | incre_col | b    |
+------------------------------------+-----------+------+
| table1_default 默认noorder模式     |         1 |    1 |
| table1_default 默认noorder模式     |         2 |    1 |
| table1_default 默认noorder模式     |         3 |    1 |
+------------------------------------+-----------+------+
insert into table1_default(a) values(-10);
insert into table1_default(a,txt) values(0,'最新自增值=>');
select txt,a incre_col,b from table1_default order by a;
+------------------------------------+-----------+------+
| txt                                | incre_col | b    |
+------------------------------------+-----------+------+
| table1_default 默认noorder模式     |       -10 |    1 |
| table1_default 默认noorder模式     |         1 |    1 |
| table1_default 默认noorder模式     |         2 |    1 |
| table1_default 默认noorder模式     |         3 |    1 |
| 最新自增值=>                       |         4 |    1 |
+------------------------------------+-----------+------+
##table2_order
insert into table2_order(a) values(null),(null),(null);
select txt,a incre_col,b from table2_order order by a;
+--------------------------+-----------+------+
| txt                      | incre_col | b    |
+--------------------------+-----------+------+
| table2_order order模式   |         1 |    2 |
| table2_order order模式   |         2 |    2 |
| table2_order order模式   |         3 |    2 |
+--------------------------+-----------+------+
insert into table2_order(a) values(-10);
insert into table2_order(a,txt) values(0,'最新自增值=>');
select txt,a incre_col,b from table2_order order by a;
+--------------------------+-----------+------+
| txt                      | incre_col | b    |
+--------------------------+-----------+------+
| table2_order order模式   |       -10 |    2 |
| table2_order order模式   |         1 |    2 |
| table2_order order模式   |         2 |    2 |
| table2_order order模式   |         3 |    2 |
| 最新自增值=>             |         4 |    2 |
+--------------------------+-----------+------+
##table3_noorder
insert into table3_noorder(a) values(null),(null),(null);
select txt,a incre_col,b from table3_noorder order by a;
+------------------------------+-----------+------+
| txt                          | incre_col | b    |
+------------------------------+-----------+------+
| table3_noorder noorder模式   |         1 |    3 |
| table3_noorder noorder模式   |         2 |    3 |
| table3_noorder noorder模式   |         3 |    3 |
+------------------------------+-----------+------+
insert into table3_noorder(a) values(-10);
insert into table3_noorder(a,txt) values(0,'最新自增值=>');
select txt,a incre_col,b from table3_noorder order by a;
+------------------------------+-----------+------+
| txt                          | incre_col | b    |
+------------------------------+-----------+------+
| table3_noorder noorder模式   |       -10 |    3 |
| table3_noorder noorder模式   |         1 |    3 |
| table3_noorder noorder模式   |         2 |    3 |
| table3_noorder noorder模式   |         3 |    3 |
| 最新自增值=>                 |         4 |    3 |
+------------------------------+-----------+------+
##批量插入
##INSERT ... SELECT语句 
drop table table1_default;
create table table1_default (
  a bigint unique auto_increment,
  b bigint default 1,
  txt varchar(64) default 'table1_default 默认noorder模式',
  index(a),
  constraint fk1 foreign key (a) references table0_date(a)on delete cascade
);
drop table table2_order;
create table table2_order (
  a bigint unique auto_increment,
  b bigint default 2,
  txt varchar(64) default 'table2_order order模式',
  index(a),
  constraint fk2 foreign key (a) references table0_date(a)on delete cascade
) auto_increment_mode = 'order';
drop table table3_noorder;
create table table3_noorder (
  a bigint unique auto_increment,
  b bigint default 3,
  txt varchar(64) default 'table3_noorder noorder模式',
  index(a),
  constraint fk3 foreign key (a) references table0_date(a)on delete cascade
) auto_increment_mode = 'noorder';
insert into table1_default select a,b,txt from table0_date where a <= 4;
select txt,a incre_col,b from table1_default order by a;
+-------------+-----------+------+
| txt         | incre_col | b    |
+-------------+-----------+------+
| table0_date |       -10 |    0 |
| table0_date |         1 |    0 |
| table0_date |         2 |    0 |
| table0_date |         3 |    0 |
| table0_date |         4 |    0 |
+-------------+-----------+------+
insert into table1_default(a,txt) values(0,'最新自增值=>');
select txt,a incre_col,b from table1_default order by a;
+-------------------+-----------+------+
| txt               | incre_col | b    |
+-------------------+-----------+------+
| table0_date       |       -10 |    0 |
| table0_date       |         1 |    0 |
| table0_date       |         2 |    0 |
| table0_date       |         3 |    0 |
| table0_date       |         4 |    0 |
| 最新自增值=>      |         5 |    1 |
+-------------------+-----------+------+
insert into table2_order select a,b,txt from table0_date where a <= 4;
select txt,a incre_col,b from table2_order order by a;
+-------------+-----------+------+
| txt         | incre_col | b    |
+-------------+-----------+------+
| table0_date |       -10 |    0 |
| table0_date |         1 |    0 |
| table0_date |         2 |    0 |
| table0_date |         3 |    0 |
| table0_date |         4 |    0 |
+-------------+-----------+------+
insert into table2_order(a,txt) values(0,'最新自增值=>');
select txt,a incre_col,b from table2_order order by a;
+-------------------+-----------+------+
| txt               | incre_col | b    |
+-------------------+-----------+------+
| table0_date       |       -10 |    0 |
| table0_date       |         1 |    0 |
| table0_date       |         2 |    0 |
| table0_date       |         3 |    0 |
| table0_date       |         4 |    0 |
| 最新自增值=>      |         5 |    2 |
+-------------------+-----------+------+
insert into table3_noorder select a,b,txt from table0_date where a <= 4;
select txt,a incre_col,b from table3_noorder order by a;
+-------------+-----------+------+
| txt         | incre_col | b    |
+-------------+-----------+------+
| table0_date |       -10 |    0 |
| table0_date |         1 |    0 |
| table0_date |         2 |    0 |
| table0_date |         3 |    0 |
| table0_date |         4 |    0 |
+-------------+-----------+------+
insert into table3_noorder(a,txt) values(0,'最新自增值=>');
select txt,a incre_col,b from table3_noorder order by a;
+-------------------+-----------+------+
| txt               | incre_col | b    |
+-------------------+-----------+------+
| table0_date       |       -10 |    0 |
| table0_date       |         1 |    0 |
| table0_date       |         2 |    0 |
| table0_date       |         3 |    0 |
| table0_date       |         4 |    0 |
| 最新自增值=>      |   1000001 |    3 |
+-------------------+-----------+------+
##混合插入
##INSERT ... ON DUPLICATE KEY UPDATE 语句
insert into table1_default (a,b,txt) values (1,1,'重复场合') on duplicate key update b=b+1,txt='insert...on duplicate key update 语句';
insert into table1_default(a,txt) values(0,'最新自增值=>');
select txt,a incre_col,b from table1_default order by a;
+-----------------------------------------+-----------+------+
| txt                                     | incre_col | b    |
+-----------------------------------------+-----------+------+
| table0_date                             |       -10 |    0 |
| insert...on duplicate key update 语句   |         1 |    1 |
| table0_date                             |         2 |    0 |
| table0_date                             |         3 |    0 |
| table0_date                             |         4 |    0 |
| 最新自增值=>                            |         5 |    1 |
| 最新自增值=>                            |         6 |    1 |
+-----------------------------------------+-----------+------+
insert into table1_default (a,b,txt) values (50,1,'不重复场合') on duplicate key update b=b+1,txt='insert...on duplicate key update 语句';
insert into table1_default(a,txt) values(0,'最新自增值=>');
select txt,a incre_col,b from table1_default order by a;
+-----------------------------------------+-----------+------+
| txt                                     | incre_col | b    |
+-----------------------------------------+-----------+------+
| table0_date                             |       -10 |    0 |
| insert...on duplicate key update 语句   |         1 |    1 |
| table0_date                             |         2 |    0 |
| table0_date                             |         3 |    0 |
| table0_date                             |         4 |    0 |
| 最新自增值=>                            |         5 |    1 |
| 最新自增值=>                            |         6 |    1 |
| 不重复场合                              |        50 |    1 |
| 最新自增值=>                            |        51 |    1 |
+-----------------------------------------+-----------+------+
insert into table2_order (a,b,txt) values (1,2,'重复场合') on duplicate key update b=b+1,txt='insert...on duplicate key update 语句';
insert into table2_order(a,txt) values(0,'最新自增值=>');
select txt,a incre_col,b from table2_order order by a;
+-----------------------------------------+-----------+------+
| txt                                     | incre_col | b    |
+-----------------------------------------+-----------+------+
| table0_date                             |       -10 |    0 |
| insert...on duplicate key update 语句   |         1 |    1 |
| table0_date                             |         2 |    0 |
| table0_date                             |         3 |    0 |
| table0_date                             |         4 |    0 |
| 最新自增值=>                            |         5 |    2 |
| 最新自增值=>                            |         6 |    2 |
+-----------------------------------------+-----------+------+
insert into table2_order (a,b,txt) values (50,2,'不重复场合') on duplicate key update b=b+1,txt='insert...on duplicate key update 语句';
insert into table2_order(a,txt) values(0,'最新自增值=>');
select txt,a incre_col,b from table2_order order by a;
+-----------------------------------------+-----------+------+
| txt                                     | incre_col | b    |
+-----------------------------------------+-----------+------+
| table0_date                             |       -10 |    0 |
| insert...on duplicate key update 语句   |         1 |    1 |
| table0_date                             |         2 |    0 |
| table0_date                             |         3 |    0 |
| table0_date                             |         4 |    0 |
| 最新自增值=>                            |         5 |    2 |
| 最新自增值=>                            |         6 |    2 |
| 不重复场合                              |        50 |    2 |
| 最新自增值=>                            |        51 |    2 |
+-----------------------------------------+-----------+------+
insert into table3_noorder (a,b,txt) values (1,3,'重复场合') on duplicate key update b=b+1,txt='insert...on duplicate key update 语句';
insert into table3_noorder(a,txt) values(0,'最新自增值=>');
select txt,a incre_col,b from table3_noorder order by a;
+-----------------------------------------+-----------+------+
| txt                                     | incre_col | b    |
+-----------------------------------------+-----------+------+
| table0_date                             |       -10 |    0 |
| insert...on duplicate key update 语句   |         1 |    1 |
| table0_date                             |         2 |    0 |
| table0_date                             |         3 |    0 |
| table0_date                             |         4 |    0 |
| 最新自增值=>                            |   1000001 |    3 |
| 最新自增值=>                            |   1000002 |    3 |
+-----------------------------------------+-----------+------+
insert into table3_noorder (a,b,txt) values (50,3,'不重复场合') on duplicate key update b=b+1,txt='insert...on duplicate key update 语句';
insert into table3_noorder(a,txt) values(0,'最新自增值=>');
select txt,a incre_col,b from table3_noorder order by a;
+-----------------------------------------+-----------+------+
| txt                                     | incre_col | b    |
+-----------------------------------------+-----------+------+
| table0_date                             |       -10 |    0 |
| insert...on duplicate key update 语句   |         1 |    1 |
| table0_date                             |         2 |    0 |
| table0_date                             |         3 |    0 |
| table0_date                             |         4 |    0 |
| 不重复场合                              |        50 |    3 |
| 最新自增值=>                            |   1000001 |    3 |
| 最新自增值=>                            |   1000002 |    3 |
| 最新自增值=>                            |   1000003 |    3 |
+-----------------------------------------+-----------+------+
##将NULL和任何其他值混合插入 AUTO_INCREMENT列
##INSERT 语句
drop table table1_default;
create table table1_default (
  a bigint unique auto_increment,
  b bigint default 1,
  txt varchar(64) default 'table1_default 默认noorder模式',
  index(a),
  constraint fk1 foreign key (a) references table0_date(a)on delete cascade
);
drop table table2_order;
create table table2_order (
  a bigint unique auto_increment,
  b bigint default 2,
  txt varchar(64) default 'table2_order order模式',
  index(a),
  constraint fk2 foreign key (a) references table0_date(a)on delete cascade
) auto_increment_mode = 'order';
drop table table3_noorder;
create table table3_noorder (
  a bigint unique auto_increment,
  b bigint default 3,
  txt varchar(64) default 'table3_noorder noorder模式',
  index(a),
  constraint fk3 foreign key (a) references table0_date(a)on delete cascade
) auto_increment_mode = 'noorder';
insert into table1_default(a) values(null),(-10),(null),(3);
insert into table1_default(a,txt) values(0,'最新自增值=>');
select txt,a incre_col,b from table1_default order by a;
+------------------------------------+-----------+------+
| txt                                | incre_col | b    |
+------------------------------------+-----------+------+
| table1_default 默认noorder模式     |       -10 |    1 |
| table1_default 默认noorder模式     |         1 |    1 |
| table1_default 默认noorder模式     |         2 |    1 |
| table1_default 默认noorder模式     |         3 |    1 |
| 最新自增值=>                       |         5 |    1 |
+------------------------------------+-----------+------+
insert into table2_order(a) values(null),(-10),(null),(3);
insert into table2_order(a,txt) values(0,'最新自增值=>');
select txt,a incre_col,b from table2_order order by a;
+--------------------------+-----------+------+
| txt                      | incre_col | b    |
+--------------------------+-----------+------+
| table2_order order模式   |       -10 |    2 |
| table2_order order模式   |         1 |    2 |
| table2_order order模式   |         2 |    2 |
| table2_order order模式   |         3 |    2 |
| 最新自增值=>             |         5 |    2 |
+--------------------------+-----------+------+
insert into table3_noorder(a) values(null),(-10),(null),(3);
insert into table3_noorder(a,txt) values(0,'最新自增值=>');
select txt,a incre_col,b from table3_noorder order by a;
+------------------------------+-----------+------+
| txt                          | incre_col | b    |
+------------------------------+-----------+------+
| table3_noorder noorder模式   |       -10 |    3 |
| table3_noorder noorder模式   |         1 |    3 |
| table3_noorder noorder模式   |         2 |    3 |
| table3_noorder noorder模式   |         3 |    3 |
| 最新自增值=>                 |   1000001 |    3 |
+------------------------------+-----------+------+
###### auto_incre_3-1-2 ②DELETE操作
insert into table1_default(a,b) values(null,11);
select txt,a incre_col,b from table1_default order by a;
+------------------------------------+-----------+------+
| txt                                | incre_col | b    |
+------------------------------------+-----------+------+
| table1_default 默认noorder模式     |       -10 |    1 |
| table1_default 默认noorder模式     |         1 |    1 |
| table1_default 默认noorder模式     |         2 |    1 |
| table1_default 默认noorder模式     |         3 |    1 |
| 最新自增值=>                       |         5 |    1 |
| table1_default 默认noorder模式     |         6 |   11 |
+------------------------------------+-----------+------+
delete from table1_default where b=11;
insert into table1_default(a,txt) values(0,'最新自增值=>');
select txt,a incre_col,b from table1_default order by a;
+------------------------------------+-----------+------+
| txt                                | incre_col | b    |
+------------------------------------+-----------+------+
| table1_default 默认noorder模式     |       -10 |    1 |
| table1_default 默认noorder模式     |         1 |    1 |
| table1_default 默认noorder模式     |         2 |    1 |
| table1_default 默认noorder模式     |         3 |    1 |
| 最新自增值=>                       |         5 |    1 |
| 最新自增值=>                       |         7 |    1 |
+------------------------------------+-----------+------+
insert into table2_order(a,b) values(null,22);
insert into table2_order(a,b) values(null,22);
select txt,a incre_col,b from table2_order order by a;
+--------------------------+-----------+------+
| txt                      | incre_col | b    |
+--------------------------+-----------+------+
| table2_order order模式   |       -10 |    2 |
| table2_order order模式   |         1 |    2 |
| table2_order order模式   |         2 |    2 |
| table2_order order模式   |         3 |    2 |
| 最新自增值=>             |         5 |    2 |
| table2_order order模式   |         6 |   22 |
| table2_order order模式   |         7 |   22 |
+--------------------------+-----------+------+
delete from table2_order where b=22;
insert into table2_order(a,txt) values(0,'最新自增值=>');
select txt,a incre_col,b from table2_order order by a;
+--------------------------+-----------+------+
| txt                      | incre_col | b    |
+--------------------------+-----------+------+
| table2_order order模式   |       -10 |    2 |
| table2_order order模式   |         1 |    2 |
| table2_order order模式   |         2 |    2 |
| table2_order order模式   |         3 |    2 |
| 最新自增值=>             |         5 |    2 |
| 最新自增值=>             |         8 |    2 |
+--------------------------+-----------+------+
insert into table3_noorder(a,b) values(null,33);
insert into table3_noorder(a,b) values(null,33);
select txt,a incre_col,b from table3_noorder order by a;
+------------------------------+-----------+------+
| txt                          | incre_col | b    |
+------------------------------+-----------+------+
| table3_noorder noorder模式   |       -10 |    3 |
| table3_noorder noorder模式   |         1 |    3 |
| table3_noorder noorder模式   |         2 |    3 |
| table3_noorder noorder模式   |         3 |    3 |
| 最新自增值=>                 |   1000001 |    3 |
| table3_noorder noorder模式   |   1000002 |   33 |
| table3_noorder noorder模式   |   1000003 |   33 |
+------------------------------+-----------+------+
delete from table3_noorder where b=33;
insert into table3_noorder(a,txt) values(0,'最新自增值=>');
select txt,a incre_col,b from table3_noorder order by a;
+------------------------------+-----------+------+
| txt                          | incre_col | b    |
+------------------------------+-----------+------+
| table3_noorder noorder模式   |       -10 |    3 |
| table3_noorder noorder模式   |         1 |    3 |
| table3_noorder noorder模式   |         2 |    3 |
| table3_noorder noorder模式   |         3 |    3 |
| 最新自增值=>                 |   1000001 |    3 |
| 最新自增值=>                 |   1000004 |    3 |
+------------------------------+-----------+------+
###### auto_incre_3-1-3 ③UPDATE操作
# mysql 5.x update没有推高这个自增值，和我们现在是兼容的；8.x update会推高
##更新现有AUTO_INCREMENT列值
truncate table table1_default;
insert into table1_default(a,b) values(null,111);
update table1_default set a = -10,txt = '将AUTO_INCREMENT列值设置为小于/等于当前最大自增值的值' where b = 111;
select txt,a incre_col,b from table1_default order by a;
+--------------------------------------------------------------------------+-----------+------+
| txt                                                                      | incre_col | b    |
+--------------------------------------------------------------------------+-----------+------+
| 将AUTO_INCREMENT列值设置为小于/等于当前最大自增值的值                    |       -10 |  111 |
+--------------------------------------------------------------------------+-----------+------+
insert into table1_default values(null,11,'1当前自增值=>');
select txt,a incre_col,b from table1_default order by a;
+--------------------------------------------------------------------------+-----------+------+
| txt                                                                      | incre_col | b    |
+--------------------------------------------------------------------------+-----------+------+
| 将AUTO_INCREMENT列值设置为小于/等于当前最大自增值的值                    |       -10 |  111 |
| 1当前自增值=>                                                            |         2 |   11 |
+--------------------------------------------------------------------------+-----------+------+
update table1_default set a = 10 ,txt = '将AUTO_INCREMENT列值设置为大于当前最大自增值的值' where b = 111;
insert into table1_default values(null,11,'2当前自增值=>');
select txt,a incre_col,b from table1_default order by a;
+-------------------------------------------------------------------+-----------+------+
| txt                                                               | incre_col | b    |
+-------------------------------------------------------------------+-----------+------+
| 1当前自增值=>                                                     |         2 |   11 |
| 2当前自增值=>                                                     |         3 |   11 |
| 将AUTO_INCREMENT列值设置为大于当前最大自增值的值                  |        10 |  111 |
+-------------------------------------------------------------------+-----------+------+
truncate table table2_order;
insert into table2_order(a,b) values(null,222);
select txt,a incre_col,b from table2_order order by a;
+--------------------------+-----------+------+
| txt                      | incre_col | b    |
+--------------------------+-----------+------+
| table2_order order模式   |         1 |  222 |
+--------------------------+-----------+------+
update table2_order set a = -10,txt = '将AUTO_INCREMENT列值设置为小于/等于当前最大自增值的值' where b = 222;
insert into table2_order values(null,22,'1当前自增值=>');
select txt,a incre_col,b from table2_order order by a;
+--------------------------------------------------------------------------+-----------+------+
| txt                                                                      | incre_col | b    |
+--------------------------------------------------------------------------+-----------+------+
| 将AUTO_INCREMENT列值设置为小于/等于当前最大自增值的值                    |       -10 |  222 |
| 1当前自增值=>                                                            |         2 |   22 |
+--------------------------------------------------------------------------+-----------+------+
update table2_order set a = 10 ,txt = '将AUTO_INCREMENT列值设置为大于当前最大自增值的值' where b = 222;
insert into table2_order values(null,22,'2当前自增值=>');
select txt,a incre_col,b from table2_order order by a;
+-------------------------------------------------------------------+-----------+------+
| txt                                                               | incre_col | b    |
+-------------------------------------------------------------------+-----------+------+
| 1当前自增值=>                                                     |         2 |   22 |
| 2当前自增值=>                                                     |         3 |   22 |
| 将AUTO_INCREMENT列值设置为大于当前最大自增值的值                  |        10 |  222 |
+-------------------------------------------------------------------+-----------+------+
truncate table table3_noorder;
insert into table3_noorder(a,b) values(null,333);
select txt,a incre_col,b from table3_noorder order by a;
+------------------------------+-----------+------+
| txt                          | incre_col | b    |
+------------------------------+-----------+------+
| table3_noorder noorder模式   |         1 |  333 |
+------------------------------+-----------+------+
update table3_noorder set a = -10,txt = '将AUTO_INCREMENT列值设置为小于/等于当前最大自增值的值' where b = 333;
insert into table3_noorder values(null,33,'1当前自增值=>');
select txt,a incre_col,b from table3_noorder order by a;
+--------------------------------------------------------------------------+-----------+------+
| txt                                                                      | incre_col | b    |
+--------------------------------------------------------------------------+-----------+------+
| 将AUTO_INCREMENT列值设置为小于/等于当前最大自增值的值                    |       -10 |  333 |
| 1当前自增值=>                                                            |         2 |   33 |
+--------------------------------------------------------------------------+-----------+------+
update table3_noorder set a = 10 ,txt = '将AUTO_INCREMENT列值设置为大于当前最大自增值的值' where b = 333;
insert into table3_noorder values(null,33,'2当前自增值=>');
select txt,a incre_col,b from table3_noorder order by a;
+-------------------------------------------------------------------+-----------+------+
| txt                                                               | incre_col | b    |
+-------------------------------------------------------------------+-----------+------+
| 1当前自增值=>                                                     |         2 |   33 |
| 2当前自增值=>                                                     |         3 |   33 |
| 将AUTO_INCREMENT列值设置为大于当前最大自增值的值                  |        10 |  333 |
+-------------------------------------------------------------------+-----------+------+
############ auto_incre_2-4 ④模式切换 ############
drop table table1_default;
create table table1_default (
  a bigint auto_increment,
  b bigint default 1,
  txt varchar(64) default 'table1_default 默认order模式',
  index(a),
  constraint fk1 foreign key (a) references table0_date(a)on delete cascade
);
## ORDER
insert into table1_default(a) values(0),(0),(0);
select txt,a incre_col, b from table1_default order by a;
+----------------------------------+-----------+------+
| txt                              | incre_col | b    |
+----------------------------------+-----------+------+
| table1_default 默认order模式     |         1 |    1 |
| table1_default 默认order模式     |         2 |    1 |
| table1_default 默认order模式     |         3 |    1 |
+----------------------------------+-----------+------+
insert into table1_default values(0,11,'update test');
update table1_default set a = -10 where b = 11;
insert into table1_default values(null,11,'当前自增值1==>');
select txt,a incre_col, b from table1_default order by a;
+----------------------------------+-----------+------+
| txt                              | incre_col | b    |
+----------------------------------+-----------+------+
| update test                      |       -10 |   11 |
| table1_default 默认order模式     |         1 |    1 |
| table1_default 默认order模式     |         2 |    1 |
| table1_default 默认order模式     |         3 |    1 |
| 当前自增值1==>                   |         5 |   11 |
+----------------------------------+-----------+------+
## ORDER==>ORDER
alter table table1_default auto_increment_mode = 'ORDER';
insert into table1_default values(0,2,'ORDER==>ORDER'),(0,2,'ORDER==>ORDER'),(0,2,'ORDER==>ORDER');
select txt,a incre_col, b from table1_default order by a;
+----------------------------------+-----------+------+
| txt                              | incre_col | b    |
+----------------------------------+-----------+------+
| update test                      |       -10 |   11 |
| table1_default 默认order模式     |         1 |    1 |
| table1_default 默认order模式     |         2 |    1 |
| table1_default 默认order模式     |         3 |    1 |
| 当前自增值1==>                   |         5 |   11 |
| ORDER==>ORDER                    |         6 |    2 |
| ORDER==>ORDER                    |         7 |    2 |
| ORDER==>ORDER                    |         8 |    2 |
+----------------------------------+-----------+------+
insert into table1_default values(0,22,'update test');
update table1_default set a = -10 where b = 22;
insert into table1_default values(null,22,'当前自增值1==>');
select txt,a incre_col, b from table1_default order by a;
+----------------------------------+-----------+------+
| txt                              | incre_col | b    |
+----------------------------------+-----------+------+
| update test                      |       -10 |   11 |
| update test                      |       -10 |   22 |
| table1_default 默认order模式     |         1 |    1 |
| table1_default 默认order模式     |         2 |    1 |
| table1_default 默认order模式     |         3 |    1 |
| 当前自增值1==>                   |         5 |   11 |
| ORDER==>ORDER                    |         6 |    2 |
| ORDER==>ORDER                    |         7 |    2 |
| ORDER==>ORDER                    |         8 |    2 |
| 当前自增值1==>                   |        10 |   22 |
+----------------------------------+-----------+------+
## ORDER==>NOORDER
alter table table1_default auto_increment_mode = 'NOORDER';
insert into table1_default values(0,3,'ORDER==>NOORDER'),(0,3,'ORDER==>NOORDER'),(0,3,'ORDER==>NOORDER');
select txt,a incre_col, b from table1_default order by a;
+----------------------------------+-----------+------+
| txt                              | incre_col | b    |
+----------------------------------+-----------+------+
| update test                      |       -10 |   11 |
| update test                      |       -10 |   22 |
| table1_default 默认order模式     |         1 |    1 |
| table1_default 默认order模式     |         2 |    1 |
| table1_default 默认order模式     |         3 |    1 |
| 当前自增值1==>                   |         5 |   11 |
| ORDER==>ORDER                    |         6 |    2 |
| ORDER==>ORDER                    |         7 |    2 |
| ORDER==>ORDER                    |         8 |    2 |
| 当前自增值1==>                   |        10 |   22 |
| ORDER==>NOORDER                  |   1000001 |    3 |
| ORDER==>NOORDER                  |   1000002 |    3 |
| ORDER==>NOORDER                  |   1000003 |    3 |
+----------------------------------+-----------+------+
insert into table1_default values(0,33,'update test');
update table1_default set a = -10 where b = 33;
insert into table1_default values(null,33,'当前自增值1==>');
select txt,a incre_col, b from table1_default order by a;
+----------------------------------+-----------+------+
| txt                              | incre_col | b    |
+----------------------------------+-----------+------+
| update test                      |       -10 |   11 |
| update test                      |       -10 |   22 |
| update test                      |       -10 |   33 |
| table1_default 默认order模式     |         1 |    1 |
| table1_default 默认order模式     |         2 |    1 |
| table1_default 默认order模式     |         3 |    1 |
| 当前自增值1==>                   |         5 |   11 |
| ORDER==>ORDER                    |         6 |    2 |
| ORDER==>ORDER                    |         7 |    2 |
| ORDER==>ORDER                    |         8 |    2 |
| 当前自增值1==>                   |        10 |   22 |
| ORDER==>NOORDER                  |   1000001 |    3 |
| ORDER==>NOORDER                  |   1000002 |    3 |
| ORDER==>NOORDER                  |   1000003 |    3 |
| 当前自增值1==>                   |   1000005 |   33 |
+----------------------------------+-----------+------+
## NOORDER==>NOORDER
alter table table1_default auto_increment_mode = 'NOORDER';
insert into table1_default values(0,4,'NOORDER==>NOORDER'),(0,4,'NOORDER==>NOORDER'),(0,4,'NOORDER==>NOORDER');
select txt,a incre_col, b from table1_default order by a;
+----------------------------------+-----------+------+
| txt                              | incre_col | b    |
+----------------------------------+-----------+------+
| update test                      |       -10 |   33 |
| update test                      |       -10 |   11 |
| update test                      |       -10 |   22 |
| table1_default 默认order模式     |         1 |    1 |
| table1_default 默认order模式     |         2 |    1 |
| table1_default 默认order模式     |         3 |    1 |
| 当前自增值1==>                   |         5 |   11 |
| ORDER==>ORDER                    |         6 |    2 |
| ORDER==>ORDER                    |         7 |    2 |
| ORDER==>ORDER                    |         8 |    2 |
| 当前自增值1==>                   |        10 |   22 |
| ORDER==>NOORDER                  |   1000001 |    3 |
| ORDER==>NOORDER                  |   1000002 |    3 |
| ORDER==>NOORDER                  |   1000003 |    3 |
| 当前自增值1==>                   |   1000005 |   33 |
| NOORDER==>NOORDER                |   1000006 |    4 |
| NOORDER==>NOORDER                |   1000007 |    4 |
| NOORDER==>NOORDER                |   1000008 |    4 |
+----------------------------------+-----------+------+
## NOORDER==>ORDER
alter table table1_default auto_increment_mode = 'ORDER';
insert into table1_default values(0,5,'NOORDER==>ORDER'),(0,5,'NOORDER==>ORDER'),(0,5,'NOORDER==>ORDER');
select txt,a incre_col, b from table1_default order by a;
+----------------------------------+-----------+------+
| txt                              | incre_col | b    |
+----------------------------------+-----------+------+
| update test                      |       -10 |   33 |
| update test                      |       -10 |   11 |
| update test                      |       -10 |   22 |
| table1_default 默认order模式     |         1 |    1 |
| table1_default 默认order模式     |         2 |    1 |
| table1_default 默认order模式     |         3 |    1 |
| 当前自增值1==>                   |         5 |   11 |
| ORDER==>ORDER                    |         6 |    2 |
| ORDER==>ORDER                    |         7 |    2 |
| ORDER==>ORDER                    |         8 |    2 |
| 当前自增值1==>                   |        10 |   22 |
| ORDER==>NOORDER                  |   1000001 |    3 |
| ORDER==>NOORDER                  |   1000002 |    3 |
| ORDER==>NOORDER                  |   1000003 |    3 |
| 当前自增值1==>                   |   1000005 |   33 |
| NOORDER==>NOORDER                |   1000006 |    4 |
| NOORDER==>NOORDER                |   1000007 |    4 |
| NOORDER==>NOORDER                |   1000008 |    4 |
| NOORDER==>ORDER                  |   2000001 |    5 |
| NOORDER==>ORDER                  |   2000002 |    5 |
| NOORDER==>ORDER                  |   2000003 |    5 |
+----------------------------------+-----------+------+
insert into table1_default values(0,6,'NOORDER==>ORDER test');
select txt,a incre_col, b from table1_default order by a;
+----------------------------------+-----------+------+
| txt                              | incre_col | b    |
+----------------------------------+-----------+------+
| update test                      |       -10 |   33 |
| update test                      |       -10 |   11 |
| update test                      |       -10 |   22 |
| table1_default 默认order模式     |         1 |    1 |
| table1_default 默认order模式     |         2 |    1 |
| table1_default 默认order模式     |         3 |    1 |
| 当前自增值1==>                   |         5 |   11 |
| ORDER==>ORDER                    |         6 |    2 |
| ORDER==>ORDER                    |         7 |    2 |
| ORDER==>ORDER                    |         8 |    2 |
| 当前自增值1==>                   |        10 |   22 |
| ORDER==>NOORDER                  |   1000001 |    3 |
| ORDER==>NOORDER                  |   1000002 |    3 |
| ORDER==>NOORDER                  |   1000003 |    3 |
| 当前自增值1==>                   |   1000005 |   33 |
| NOORDER==>NOORDER                |   1000006 |    4 |
| NOORDER==>NOORDER                |   1000007 |    4 |
| NOORDER==>NOORDER                |   1000008 |    4 |
| NOORDER==>ORDER                  |   2000001 |    5 |
| NOORDER==>ORDER                  |   2000002 |    5 |
| NOORDER==>ORDER                  |   2000003 |    5 |
| NOORDER==>ORDER test             |   2000004 |    6 |
+----------------------------------+-----------+------+
update table1_default set a = -10 where b = 6;
insert into table1_default values(null,55,'当前自增值1==>');
select txt,a incre_col, b from table1_default order by a;
+----------------------------------+-----------+------+
| txt                              | incre_col | b    |
+----------------------------------+-----------+------+
| NOORDER==>ORDER test             |       -10 |    6 |
| update test                      |       -10 |   11 |
| update test                      |       -10 |   22 |
| update test                      |       -10 |   33 |
| table1_default 默认order模式     |         1 |    1 |
| table1_default 默认order模式     |         2 |    1 |
| table1_default 默认order模式     |         3 |    1 |
| 当前自增值1==>                   |         5 |   11 |
| ORDER==>ORDER                    |         6 |    2 |
| ORDER==>ORDER                    |         7 |    2 |
| ORDER==>ORDER                    |         8 |    2 |
| 当前自增值1==>                   |        10 |   22 |
| ORDER==>NOORDER                  |   1000001 |    3 |
| ORDER==>NOORDER                  |   1000002 |    3 |
| ORDER==>NOORDER                  |   1000003 |    3 |
| 当前自增值1==>                   |   1000005 |   33 |
| NOORDER==>NOORDER                |   1000006 |    4 |
| NOORDER==>NOORDER                |   1000007 |    4 |
| NOORDER==>NOORDER                |   1000008 |    4 |
| NOORDER==>ORDER                  |   2000001 |    5 |
| NOORDER==>ORDER                  |   2000002 |    5 |
| NOORDER==>ORDER                  |   2000003 |    5 |
| 当前自增值1==>                   |   2000005 |   55 |
+----------------------------------+-----------+------+
drop table table1_default;
drop table table2_order;
drop table table3_noorder;
drop table table0_date;
# Clean up users
drop user whh@'%';
drop database if exists whh ;
purge recyclebin;
