purge recyclebin;
result_format: 4
drop user whh@'%';
drop database if exists whh ;
create user whh identified by 'whh';
create database whh ;
grant all on *.* to whh with grant option;


##测试每种场合时，起始条件可能不同，可以删除再重新创建表
set sql_mode='strict_all_tables,no_zero_in_date';
alter system set default_auto_increment_mode = 'order';
##########################################################################################################################
###### 标签：auto_incre_1-1，auto_incre_1-2，auto_incre_2，auto_incre_3-1，auto_incre_3-2
###### 功能：数据类型（INT），普通表（唯一索引），自增模式，DML操作 ，DDL操作
########################################################################################################################## 
############ auto_incre_1-2-1，auto_incre_1-2-2 
############ 索引 - 唯一索引，约束 - 主键，非空约束 
############ INT 类型 
##建表
drop table table1_default;
create table table1_default (
  a int not null auto_increment primary key,
  b int default 1,
  txt varchar(64) default 'table1_default 默认order模式',
  unique index(a)
);
drop table table2_order;
create table table2_order (
  a int not null auto_increment primary key,
  b int default 2,
  txt varchar(64) default 'table2_order order模式',
  unique index(a)
) auto_increment_mode = 'order';
drop table table3_noorder;
create table table3_noorder (
  a int not null auto_increment primary key,
  b int default 3,
  txt varchar(64) default 'table3_noorder noorder模式',
  unique index(a)
) auto_increment_mode = 'noorder';
drop table table4_alter;
create table table4_alter (
  a int,
  txt varchar(64) default 'table4_alter'
);
drop table table0_date;
create table table0_date (
  a int,
  b int default 0,
  txt varchar(64) default 'table0_date'
);
insert into table0_date(a) values(100),(101),(102),(103),(104),(105);
############ auto_incre_3-1 DML操作 ############
###### auto_incre_3-1-1 ①INSERT操作 
##简单插入
##INSERT 语句
##table1_default
insert into table1_default(b,txt) values(1,'insert a,txt');
insert into table1_default(a) values(null),(null),(null);
select txt,a incre_col,b from table1_default order by a;
+----------------------------------+-----------+------+
| txt                              | incre_col | b    |
+----------------------------------+-----------+------+
| insert a,txt                     |         1 |    1 |
| table1_default 默认order模式     |         2 |    1 |
| table1_default 默认order模式     |         3 |    1 |
| table1_default 默认order模式     |         4 |    1 |
+----------------------------------+-----------+------+
insert into table1_default(a) values(10);
insert into table1_default(a,txt) values(0,'最新自增值=>');
select txt,a incre_col,b from table1_default order by a;
+----------------------------------+-----------+------+
| txt                              | incre_col | b    |
+----------------------------------+-----------+------+
| insert a,txt                     |         1 |    1 |
| table1_default 默认order模式     |         2 |    1 |
| table1_default 默认order模式     |         3 |    1 |
| table1_default 默认order模式     |         4 |    1 |
| table1_default 默认order模式     |        10 |    1 |
| 最新自增值=>                     |        11 |    1 |
+----------------------------------+-----------+------+
##table2_order
insert into table2_order(a) values(null);
insert into table2_order(a) values(null),(null),(null);
select txt,a incre_col,b from table2_order order by a;
+--------------------------+-----------+------+
| txt                      | incre_col | b    |
+--------------------------+-----------+------+
| table2_order order模式   |         1 |    2 |
| table2_order order模式   |         2 |    2 |
| table2_order order模式   |         3 |    2 |
| table2_order order模式   |         4 |    2 |
+--------------------------+-----------+------+
insert into table2_order(a) values(10);
insert into table2_order(a,txt) values(0,'最新自增值=>');
select txt,a incre_col,b from table2_order order by a;
+--------------------------+-----------+------+
| txt                      | incre_col | b    |
+--------------------------+-----------+------+
| table2_order order模式   |         1 |    2 |
| table2_order order模式   |         2 |    2 |
| table2_order order模式   |         3 |    2 |
| table2_order order模式   |         4 |    2 |
| table2_order order模式   |        10 |    2 |
| 最新自增值=>             |        11 |    2 |
+--------------------------+-----------+------+
##table3_noorder
insert into table3_noorder(a) values(null);
insert into table3_noorder(a) values(null),(null),(null);
select txt,a incre_col,b from table3_noorder order by a;
+------------------------------+-----------+------+
| txt                          | incre_col | b    |
+------------------------------+-----------+------+
| table3_noorder noorder模式   |         1 |    3 |
| table3_noorder noorder模式   |         2 |    3 |
| table3_noorder noorder模式   |         3 |    3 |
| table3_noorder noorder模式   |         4 |    3 |
+------------------------------+-----------+------+
insert into table3_noorder(a) values(10);
insert into table3_noorder(a,txt) values(0,'最新自增值=>');
select txt,a incre_col,b from table3_noorder order by a;
+------------------------------+-----------+------+
| txt                          | incre_col | b    |
+------------------------------+-----------+------+
| table3_noorder noorder模式   |         1 |    3 |
| table3_noorder noorder模式   |         2 |    3 |
| table3_noorder noorder模式   |         3 |    3 |
| table3_noorder noorder模式   |         4 |    3 |
| table3_noorder noorder模式   |        10 |    3 |
| 最新自增值=>                 |   1000001 |    3 |
+------------------------------+-----------+------+
##REPLACE 语句
replace into table1_default(a) values(0),(0),(0);
select txt,a incre_col,b from table1_default order by a;
+----------------------------------+-----------+------+
| txt                              | incre_col | b    |
+----------------------------------+-----------+------+
| insert a,txt                     |         1 |    1 |
| table1_default 默认order模式     |         2 |    1 |
| table1_default 默认order模式     |         3 |    1 |
| table1_default 默认order模式     |         4 |    1 |
| table1_default 默认order模式     |        10 |    1 |
| 最新自增值=>                     |        11 |    1 |
| table1_default 默认order模式     |        12 |    1 |
| table1_default 默认order模式     |        13 |    1 |
| table1_default 默认order模式     |        14 |    1 |
+----------------------------------+-----------+------+
replace into table2_order(a) values(0),(0),(0);
select txt,a incre_col,b from table2_order order by a;
+--------------------------+-----------+------+
| txt                      | incre_col | b    |
+--------------------------+-----------+------+
| table2_order order模式   |         1 |    2 |
| table2_order order模式   |         2 |    2 |
| table2_order order模式   |         3 |    2 |
| table2_order order模式   |         4 |    2 |
| table2_order order模式   |        10 |    2 |
| 最新自增值=>             |        11 |    2 |
| table2_order order模式   |        12 |    2 |
| table2_order order模式   |        13 |    2 |
| table2_order order模式   |        14 |    2 |
+--------------------------+-----------+------+
replace into table3_noorder(a) values(null),(null),(null);
select txt,a incre_col,b from table3_noorder order by a;
+------------------------------+-----------+------+
| txt                          | incre_col | b    |
+------------------------------+-----------+------+
| table3_noorder noorder模式   |         1 |    3 |
| table3_noorder noorder模式   |         2 |    3 |
| table3_noorder noorder模式   |         3 |    3 |
| table3_noorder noorder模式   |         4 |    3 |
| table3_noorder noorder模式   |        10 |    3 |
| 最新自增值=>                 |   1000001 |    3 |
| table3_noorder noorder模式   |   1000002 |    3 |
| table3_noorder noorder模式   |   1000003 |    3 |
| table3_noorder noorder模式   |   1000004 |    3 |
+------------------------------+-----------+------+
##测试点 - 将任何其他值插入 AUTO_INCREMENT列
##INSERT 语句
truncate table table1_default;
insert into table1_default(a) values(15),(-25),(35),(45.5);
insert into table1_default(a,txt) values(0,'最新自增值=>');
select txt,a incre_col,b from table1_default order by a;
+----------------------------------+-----------+------+
| txt                              | incre_col | b    |
+----------------------------------+-----------+------+
| table1_default 默认order模式     |       -25 |    1 |
| table1_default 默认order模式     |        15 |    1 |
| table1_default 默认order模式     |        35 |    1 |
| table1_default 默认order模式     |        46 |    1 |
| 最新自增值=>                     |        47 |    1 |
+----------------------------------+-----------+------+
truncate table table2_order;
insert into table2_order(a) values(15),(-25),(35),(45.5);
insert into table2_order(a,txt) values(0,'最新自增值=>');
select txt,a incre_col,b from table2_order order by a;
+--------------------------+-----------+------+
| txt                      | incre_col | b    |
+--------------------------+-----------+------+
| table2_order order模式   |       -25 |    2 |
| table2_order order模式   |        15 |    2 |
| table2_order order模式   |        35 |    2 |
| table2_order order模式   |        46 |    2 |
| 最新自增值=>             |        47 |    2 |
+--------------------------+-----------+------+
truncate table table3_noorder;
insert into table3_noorder(a) values(15),(-25),(35),(45.5);
insert into table3_noorder(a,txt) values(0,'最新自增值=>');
select txt,a incre_col,b from table3_noorder order by a;
+------------------------------+-----------+------+
| txt                          | incre_col | b    |
+------------------------------+-----------+------+
| table3_noorder noorder模式   |       -25 |    3 |
| table3_noorder noorder模式   |        15 |    3 |
| table3_noorder noorder模式   |        35 |    3 |
| table3_noorder noorder模式   |        46 |    3 |
| 最新自增值=>                 |   1000001 |    3 |
+------------------------------+-----------+------+
##REPLACE 语句
replace into table1_default(a,txt) values(3,'new-3'),(-5,'new--5'),(10,'new-10'),(15.5,'new-15.5');
select txt,a incre_col,b from table1_default order by a;
+----------------------------------+-----------+------+
| txt                              | incre_col | b    |
+----------------------------------+-----------+------+
| table1_default 默认order模式     |       -25 |    1 |
| new--5                           |        -5 |    1 |
| new-3                            |         3 |    1 |
| new-10                           |        10 |    1 |
| table1_default 默认order模式     |        15 |    1 |
| new-15.5                         |        16 |    1 |
| table1_default 默认order模式     |        35 |    1 |
| table1_default 默认order模式     |        46 |    1 |
| 最新自增值=>                     |        47 |    1 |
+----------------------------------+-----------+------+
insert into table1_default(a,txt) values(0,'最新自增值=>');
select txt,a incre_col,b from table1_default order by a;
+----------------------------------+-----------+------+
| txt                              | incre_col | b    |
+----------------------------------+-----------+------+
| table1_default 默认order模式     |       -25 |    1 |
| new--5                           |        -5 |    1 |
| new-3                            |         3 |    1 |
| new-10                           |        10 |    1 |
| table1_default 默认order模式     |        15 |    1 |
| new-15.5                         |        16 |    1 |
| table1_default 默认order模式     |        35 |    1 |
| table1_default 默认order模式     |        46 |    1 |
| 最新自增值=>                     |        47 |    1 |
| 最新自增值=>                     |        48 |    1 |
+----------------------------------+-----------+------+
replace into table2_order(a,txt) values(3,'new-3'),(-5,'new--5'),(10,'new-10'),(15.5,'new-15.5');
select txt,a incre_col,b from table2_order order by a;
+--------------------------+-----------+------+
| txt                      | incre_col | b    |
+--------------------------+-----------+------+
| table2_order order模式   |       -25 |    2 |
| new--5                   |        -5 |    2 |
| new-3                    |         3 |    2 |
| new-10                   |        10 |    2 |
| table2_order order模式   |        15 |    2 |
| new-15.5                 |        16 |    2 |
| table2_order order模式   |        35 |    2 |
| table2_order order模式   |        46 |    2 |
| 最新自增值=>             |        47 |    2 |
+--------------------------+-----------+------+
insert into table2_order(a,txt) values(0,'最新自增值=>');
select txt,a incre_col,b from table2_order order by a;
+--------------------------+-----------+------+
| txt                      | incre_col | b    |
+--------------------------+-----------+------+
| table2_order order模式   |       -25 |    2 |
| new--5                   |        -5 |    2 |
| new-3                    |         3 |    2 |
| new-10                   |        10 |    2 |
| table2_order order模式   |        15 |    2 |
| new-15.5                 |        16 |    2 |
| table2_order order模式   |        35 |    2 |
| table2_order order模式   |        46 |    2 |
| 最新自增值=>             |        47 |    2 |
| 最新自增值=>             |        48 |    2 |
+--------------------------+-----------+------+
replace into table3_noorder(a,txt) values(3,'new-3'),(-5,'new--5'),(10,'new-10'),(15.5,'new-15.5');
select txt,a incre_col,b from table3_noorder order by a;
+------------------------------+-----------+------+
| txt                          | incre_col | b    |
+------------------------------+-----------+------+
| table3_noorder noorder模式   |       -25 |    3 |
| new--5                       |        -5 |    3 |
| new-3                        |         3 |    3 |
| new-10                       |        10 |    3 |
| table3_noorder noorder模式   |        15 |    3 |
| new-15.5                     |        16 |    3 |
| table3_noorder noorder模式   |        35 |    3 |
| table3_noorder noorder模式   |        46 |    3 |
| 最新自增值=>                 |   1000001 |    3 |
+------------------------------+-----------+------+
insert into table3_noorder(a,txt) values(0,'最新自增值=>');
select txt,a incre_col,b from table3_noorder order by a;
+------------------------------+-----------+------+
| txt                          | incre_col | b    |
+------------------------------+-----------+------+
| table3_noorder noorder模式   |       -25 |    3 |
| new--5                       |        -5 |    3 |
| new-3                        |         3 |    3 |
| new-10                       |        10 |    3 |
| table3_noorder noorder模式   |        15 |    3 |
| new-15.5                     |        16 |    3 |
| table3_noorder noorder模式   |        35 |    3 |
| table3_noorder noorder模式   |        46 |    3 |
| 最新自增值=>                 |   1000001 |    3 |
| 最新自增值=>                 |   1000002 |    3 |
+------------------------------+-----------+------+
##测试点 - 给AUTO_INCREMENT列插入下一个自增值（当前最大自增值+1），再查看最新自增值
##INSERT 语句
truncate table table1_default;
insert into table1_default(a) values(0);
insert into table1_default(a,txt) values(2,'插入下一个自增值2（当前最大自增值+1）');
insert into table1_default(a,txt) values(0,'最新自增值=>');
select txt,a incre_col,b from table1_default order by a;
+--------------------------------------------------------+-----------+------+
| txt                                                    | incre_col | b    |
+--------------------------------------------------------+-----------+------+
| table1_default 默认order模式                           |         1 |    1 |
| 插入下一个自增值2（当前最大自增值+1）                  |         2 |    1 |
| 最新自增值=>                                           |         3 |    1 |
+--------------------------------------------------------+-----------+------+
truncate table table2_order;
insert into table2_order(a) values(0);
insert into table2_order(a,txt) values(2,'插入下一个自增值2（当前最大自增值+1）');
insert into table2_order(a,txt) values(0,'最新自增值=>');
select txt,a incre_col,b from table2_order order by a;
+--------------------------------------------------------+-----------+------+
| txt                                                    | incre_col | b    |
+--------------------------------------------------------+-----------+------+
| table2_order order模式                                 |         1 |    2 |
| 插入下一个自增值2（当前最大自增值+1）                  |         2 |    2 |
| 最新自增值=>                                           |         3 |    2 |
+--------------------------------------------------------+-----------+------+
truncate table table3_noorder;
insert into table3_noorder(a) values(0);
insert into table3_noorder(a,txt) values(2,'插入下一个自增值2（当前最大自增值+1）');
insert into table3_noorder(a,txt) values(0,'最新自增值=>');
select txt,a incre_col,b from table3_noorder order by a;
+--------------------------------------------------------+-----------+------+
| txt                                                    | incre_col | b    |
+--------------------------------------------------------+-----------+------+
| table3_noorder noorder模式                             |         1 |    3 |
| 插入下一个自增值2（当前最大自增值+1）                  |         2 |    3 |
| 最新自增值=>                                           |   1000001 |    3 |
+--------------------------------------------------------+-----------+------+
##REPLACE 语句
replace into table1_default(a,txt) values(5,'插入下一个自增值2（当前最大自增值+1）');
replace into table1_default(a,txt) values(0,'最新自增值=>');
select txt,a incre_col,b from table1_default order by a;
+--------------------------------------------------------+-----------+------+
| txt                                                    | incre_col | b    |
+--------------------------------------------------------+-----------+------+
| table1_default 默认order模式                           |         1 |    1 |
| 插入下一个自增值2（当前最大自增值+1）                  |         2 |    1 |
| 最新自增值=>                                           |         3 |    1 |
| 插入下一个自增值2（当前最大自增值+1）                  |         5 |    1 |
| 最新自增值=>                                           |         6 |    1 |
+--------------------------------------------------------+-----------+------+
replace into table2_order(a,txt) values(5,'插入下一个自增值2（当前最大自增值+1）');
replace into table2_order(a,txt) values(0,'最新自增值=>');
select txt,a incre_col,b from table2_order order by a;
+--------------------------------------------------------+-----------+------+
| txt                                                    | incre_col | b    |
+--------------------------------------------------------+-----------+------+
| table2_order order模式                                 |         1 |    2 |
| 插入下一个自增值2（当前最大自增值+1）                  |         2 |    2 |
| 最新自增值=>                                           |         3 |    2 |
| 插入下一个自增值2（当前最大自增值+1）                  |         5 |    2 |
| 最新自增值=>                                           |         6 |    2 |
+--------------------------------------------------------+-----------+------+
replace into table3_noorder(a,txt) values(1000002,'插入下一个自增值2（当前最大自增值+1）');
replace into table3_noorder(a,txt) values(0,'最新自增值=>');
select txt,a incre_col,b from table3_noorder order by a;
+--------------------------------------------------------+-----------+------+
| txt                                                    | incre_col | b    |
+--------------------------------------------------------+-----------+------+
| table3_noorder noorder模式                             |         1 |    3 |
| 插入下一个自增值2（当前最大自增值+1）                  |         2 |    3 |
| 最新自增值=>                                           |   1000001 |    3 |
| 插入下一个自增值2（当前最大自增值+1）                  |   1000002 |    3 |
| 最新自增值=>                                           |   2000001 |    3 |
+--------------------------------------------------------+-----------+------+
##测试点 - 给表插入数据时引用AUTO_INCREMENT列的值
##INSERT 语句
insert into table1_default values(null,a*2,'引用AUTO_INCREMENT列的值');
insert into table1_default(a,txt) values(0,'最新自增值=>');
select txt,a incre_col,b from table1_default order by a;
+--------------------------------------------------------+-----------+------+
| txt                                                    | incre_col | b    |
+--------------------------------------------------------+-----------+------+
| table1_default 默认order模式                           |         1 |    1 |
| 插入下一个自增值2（当前最大自增值+1）                  |         2 |    1 |
| 最新自增值=>                                           |         3 |    1 |
| 插入下一个自增值2（当前最大自增值+1）                  |         5 |    1 |
| 最新自增值=>                                           |         6 |    1 |
| 引用AUTO_INCREMENT列的值                               |         7 |   14 |
| 最新自增值=>                                           |         8 |    1 |
+--------------------------------------------------------+-----------+------+
insert into table2_order values(null,a*2,'引用AUTO_INCREMENT列的值');
insert into table2_order(a,txt) values(0,'最新自增值=>');
select txt,a incre_col,b from table2_order order by a;
+--------------------------------------------------------+-----------+------+
| txt                                                    | incre_col | b    |
+--------------------------------------------------------+-----------+------+
| table2_order order模式                                 |         1 |    2 |
| 插入下一个自增值2（当前最大自增值+1）                  |         2 |    2 |
| 最新自增值=>                                           |         3 |    2 |
| 插入下一个自增值2（当前最大自增值+1）                  |         5 |    2 |
| 最新自增值=>                                           |         6 |    2 |
| 引用AUTO_INCREMENT列的值                               |         7 |   14 |
| 最新自增值=>                                           |         8 |    2 |
+--------------------------------------------------------+-----------+------+
insert into table3_noorder values(null,a*2,'引用AUTO_INCREMENT列的值');
insert into table3_noorder(a,txt) values(0,'最新自增值=>');
select txt,a incre_col,b from table3_noorder order by a;
+--------------------------------------------------------+-----------+---------+
| txt                                                    | incre_col | b       |
+--------------------------------------------------------+-----------+---------+
| table3_noorder noorder模式                             |         1 |       3 |
| 插入下一个自增值2（当前最大自增值+1）                  |         2 |       3 |
| 最新自增值=>                                           |   1000001 |       3 |
| 插入下一个自增值2（当前最大自增值+1）                  |   1000002 |       3 |
| 最新自增值=>                                           |   2000001 |       3 |
| 引用AUTO_INCREMENT列的值                               |   2000002 | 4000004 |
| 最新自增值=>                                           |   3000001 |       3 |
+--------------------------------------------------------+-----------+---------+
##REPLACE 语句
replace into table1_default values(null,a*2,'引用AUTO_INCREMENT列的值');
replace into table1_default(a,txt) values(0,'最新自增值=>');
select txt,a incre_col,b from table1_default order by a;
+--------------------------------------------------------+-----------+------+
| txt                                                    | incre_col | b    |
+--------------------------------------------------------+-----------+------+
| table1_default 默认order模式                           |         1 |    1 |
| 插入下一个自增值2（当前最大自增值+1）                  |         2 |    1 |
| 最新自增值=>                                           |         3 |    1 |
| 插入下一个自增值2（当前最大自增值+1）                  |         5 |    1 |
| 最新自增值=>                                           |         6 |    1 |
| 引用AUTO_INCREMENT列的值                               |         7 |   14 |
| 最新自增值=>                                           |         8 |    1 |
| 引用AUTO_INCREMENT列的值                               |         9 |   18 |
| 最新自增值=>                                           |        10 |    1 |
+--------------------------------------------------------+-----------+------+
replace into table2_order values(null,a*2,'引用AUTO_INCREMENT列的值');
replace into table2_order(a,txt) values(0,'最新自增值=>');
select txt,a incre_col,b from table2_order order by a;
+--------------------------------------------------------+-----------+------+
| txt                                                    | incre_col | b    |
+--------------------------------------------------------+-----------+------+
| table2_order order模式                                 |         1 |    2 |
| 插入下一个自增值2（当前最大自增值+1）                  |         2 |    2 |
| 最新自增值=>                                           |         3 |    2 |
| 插入下一个自增值2（当前最大自增值+1）                  |         5 |    2 |
| 最新自增值=>                                           |         6 |    2 |
| 引用AUTO_INCREMENT列的值                               |         7 |   14 |
| 最新自增值=>                                           |         8 |    2 |
| 引用AUTO_INCREMENT列的值                               |         9 |   18 |
| 最新自增值=>                                           |        10 |    2 |
+--------------------------------------------------------+-----------+------+
replace into table3_noorder values(null,a*2,'引用AUTO_INCREMENT列的值');
replace into table3_noorder(a,txt) values(0,'最新自增值=>');
select txt,a incre_col,b from table3_noorder order by a;
+--------------------------------------------------------+-----------+---------+
| txt                                                    | incre_col | b       |
+--------------------------------------------------------+-----------+---------+
| table3_noorder noorder模式                             |         1 |       3 |
| 插入下一个自增值2（当前最大自增值+1）                  |         2 |       3 |
| 最新自增值=>                                           |   1000001 |       3 |
| 插入下一个自增值2（当前最大自增值+1）                  |   1000002 |       3 |
| 最新自增值=>                                           |   2000001 |       3 |
| 引用AUTO_INCREMENT列的值                               |   2000002 | 4000004 |
| 最新自增值=>                                           |   3000001 |       3 |
| 引用AUTO_INCREMENT列的值                               |   3000002 | 6000004 |
| 最新自增值=>                                           |   4000001 |       3 |
+--------------------------------------------------------+-----------+---------+
##批量插入
##INSERT ... SELECT语句
insert into table1_default select a,b,txt from table0_date where a <= 102;
select txt,a incre_col,b from table1_default order by a;
+--------------------------------------------------------+-----------+------+
| txt                                                    | incre_col | b    |
+--------------------------------------------------------+-----------+------+
| table1_default 默认order模式                           |         1 |    1 |
| 插入下一个自增值2（当前最大自增值+1）                  |         2 |    1 |
| 最新自增值=>                                           |         3 |    1 |
| 插入下一个自增值2（当前最大自增值+1）                  |         5 |    1 |
| 最新自增值=>                                           |         6 |    1 |
| 引用AUTO_INCREMENT列的值                               |         7 |   14 |
| 最新自增值=>                                           |         8 |    1 |
| 引用AUTO_INCREMENT列的值                               |         9 |   18 |
| 最新自增值=>                                           |        10 |    1 |
| table0_date                                            |       100 |    0 |
| table0_date                                            |       101 |    0 |
| table0_date                                            |       102 |    0 |
+--------------------------------------------------------+-----------+------+
insert into table1_default(a,txt) values(0,'最新自增值=>');
select txt,a incre_col,b from table1_default order by a;
+--------------------------------------------------------+-----------+------+
| txt                                                    | incre_col | b    |
+--------------------------------------------------------+-----------+------+
| table1_default 默认order模式                           |         1 |    1 |
| 插入下一个自增值2（当前最大自增值+1）                  |         2 |    1 |
| 最新自增值=>                                           |         3 |    1 |
| 插入下一个自增值2（当前最大自增值+1）                  |         5 |    1 |
| 最新自增值=>                                           |         6 |    1 |
| 引用AUTO_INCREMENT列的值                               |         7 |   14 |
| 最新自增值=>                                           |         8 |    1 |
| 引用AUTO_INCREMENT列的值                               |         9 |   18 |
| 最新自增值=>                                           |        10 |    1 |
| table0_date                                            |       100 |    0 |
| table0_date                                            |       101 |    0 |
| table0_date                                            |       102 |    0 |
| 最新自增值=>                                           |       103 |    1 |
+--------------------------------------------------------+-----------+------+
insert into table2_order select a,b,txt from table0_date where a <= 102;
select txt,a incre_col,b from table2_order order by a;
+--------------------------------------------------------+-----------+------+
| txt                                                    | incre_col | b    |
+--------------------------------------------------------+-----------+------+
| table2_order order模式                                 |         1 |    2 |
| 插入下一个自增值2（当前最大自增值+1）                  |         2 |    2 |
| 最新自增值=>                                           |         3 |    2 |
| 插入下一个自增值2（当前最大自增值+1）                  |         5 |    2 |
| 最新自增值=>                                           |         6 |    2 |
| 引用AUTO_INCREMENT列的值                               |         7 |   14 |
| 最新自增值=>                                           |         8 |    2 |
| 引用AUTO_INCREMENT列的值                               |         9 |   18 |
| 最新自增值=>                                           |        10 |    2 |
| table0_date                                            |       100 |    0 |
| table0_date                                            |       101 |    0 |
| table0_date                                            |       102 |    0 |
+--------------------------------------------------------+-----------+------+
insert into table2_order(a,txt) values(0,'最新自增值=>');
select txt,a incre_col,b from table2_order order by a;
+--------------------------------------------------------+-----------+------+
| txt                                                    | incre_col | b    |
+--------------------------------------------------------+-----------+------+
| table2_order order模式                                 |         1 |    2 |
| 插入下一个自增值2（当前最大自增值+1）                  |         2 |    2 |
| 最新自增值=>                                           |         3 |    2 |
| 插入下一个自增值2（当前最大自增值+1）                  |         5 |    2 |
| 最新自增值=>                                           |         6 |    2 |
| 引用AUTO_INCREMENT列的值                               |         7 |   14 |
| 最新自增值=>                                           |         8 |    2 |
| 引用AUTO_INCREMENT列的值                               |         9 |   18 |
| 最新自增值=>                                           |        10 |    2 |
| table0_date                                            |       100 |    0 |
| table0_date                                            |       101 |    0 |
| table0_date                                            |       102 |    0 |
| 最新自增值=>                                           |       103 |    2 |
+--------------------------------------------------------+-----------+------+
insert into table3_noorder select a,b,txt from table0_date where a <= 102;
select txt,a incre_col,b from table3_noorder order by a;
+--------------------------------------------------------+-----------+---------+
| txt                                                    | incre_col | b       |
+--------------------------------------------------------+-----------+---------+
| table3_noorder noorder模式                             |         1 |       3 |
| 插入下一个自增值2（当前最大自增值+1）                  |         2 |       3 |
| table0_date                                            |       100 |       0 |
| table0_date                                            |       101 |       0 |
| table0_date                                            |       102 |       0 |
| 最新自增值=>                                           |   1000001 |       3 |
| 插入下一个自增值2（当前最大自增值+1）                  |   1000002 |       3 |
| 最新自增值=>                                           |   2000001 |       3 |
| 引用AUTO_INCREMENT列的值                               |   2000002 | 4000004 |
| 最新自增值=>                                           |   3000001 |       3 |
| 引用AUTO_INCREMENT列的值                               |   3000002 | 6000004 |
| 最新自增值=>                                           |   4000001 |       3 |
+--------------------------------------------------------+-----------+---------+
insert into table3_noorder(a,txt) values(0,'最新自增值=>');
select txt,a incre_col,b from table3_noorder order by a;
+--------------------------------------------------------+-----------+---------+
| txt                                                    | incre_col | b       |
+--------------------------------------------------------+-----------+---------+
| table3_noorder noorder模式                             |         1 |       3 |
| 插入下一个自增值2（当前最大自增值+1）                  |         2 |       3 |
| table0_date                                            |       100 |       0 |
| table0_date                                            |       101 |       0 |
| table0_date                                            |       102 |       0 |
| 最新自增值=>                                           |   1000001 |       3 |
| 插入下一个自增值2（当前最大自增值+1）                  |   1000002 |       3 |
| 最新自增值=>                                           |   2000001 |       3 |
| 引用AUTO_INCREMENT列的值                               |   2000002 | 4000004 |
| 最新自增值=>                                           |   3000001 |       3 |
| 引用AUTO_INCREMENT列的值                               |   3000002 | 6000004 |
| 最新自增值=>                                           |   4000001 |       3 |
| 最新自增值=>                                           |   4000002 |       3 |
+--------------------------------------------------------+-----------+---------+
##REPLACE ... SELECT语句
replace into table1_default select a,b,txt from table0_date where a > 102;
select txt,a incre_col,b from table1_default order by a;
+--------------------------------------------------------+-----------+------+
| txt                                                    | incre_col | b    |
+--------------------------------------------------------+-----------+------+
| table1_default 默认order模式                           |         1 |    1 |
| 插入下一个自增值2（当前最大自增值+1）                  |         2 |    1 |
| 最新自增值=>                                           |         3 |    1 |
| 插入下一个自增值2（当前最大自增值+1）                  |         5 |    1 |
| 最新自增值=>                                           |         6 |    1 |
| 引用AUTO_INCREMENT列的值                               |         7 |   14 |
| 最新自增值=>                                           |         8 |    1 |
| 引用AUTO_INCREMENT列的值                               |         9 |   18 |
| 最新自增值=>                                           |        10 |    1 |
| table0_date                                            |       100 |    0 |
| table0_date                                            |       101 |    0 |
| table0_date                                            |       102 |    0 |
| table0_date                                            |       103 |    0 |
| table0_date                                            |       104 |    0 |
| table0_date                                            |       105 |    0 |
+--------------------------------------------------------+-----------+------+
insert into table1_default(a,txt) values(0,'最新自增值=>');
select txt,a incre_col,b from table1_default order by a;
+--------------------------------------------------------+-----------+------+
| txt                                                    | incre_col | b    |
+--------------------------------------------------------+-----------+------+
| table1_default 默认order模式                           |         1 |    1 |
| 插入下一个自增值2（当前最大自增值+1）                  |         2 |    1 |
| 最新自增值=>                                           |         3 |    1 |
| 插入下一个自增值2（当前最大自增值+1）                  |         5 |    1 |
| 最新自增值=>                                           |         6 |    1 |
| 引用AUTO_INCREMENT列的值                               |         7 |   14 |
| 最新自增值=>                                           |         8 |    1 |
| 引用AUTO_INCREMENT列的值                               |         9 |   18 |
| 最新自增值=>                                           |        10 |    1 |
| table0_date                                            |       100 |    0 |
| table0_date                                            |       101 |    0 |
| table0_date                                            |       102 |    0 |
| table0_date                                            |       103 |    0 |
| table0_date                                            |       104 |    0 |
| table0_date                                            |       105 |    0 |
| 最新自增值=>                                           |       106 |    1 |
+--------------------------------------------------------+-----------+------+
replace into table2_order select a,b,txt from table0_date where a > 102;
select txt,a incre_col,b from table2_order order by a;
+--------------------------------------------------------+-----------+------+
| txt                                                    | incre_col | b    |
+--------------------------------------------------------+-----------+------+
| table2_order order模式                                 |         1 |    2 |
| 插入下一个自增值2（当前最大自增值+1）                  |         2 |    2 |
| 最新自增值=>                                           |         3 |    2 |
| 插入下一个自增值2（当前最大自增值+1）                  |         5 |    2 |
| 最新自增值=>                                           |         6 |    2 |
| 引用AUTO_INCREMENT列的值                               |         7 |   14 |
| 最新自增值=>                                           |         8 |    2 |
| 引用AUTO_INCREMENT列的值                               |         9 |   18 |
| 最新自增值=>                                           |        10 |    2 |
| table0_date                                            |       100 |    0 |
| table0_date                                            |       101 |    0 |
| table0_date                                            |       102 |    0 |
| table0_date                                            |       103 |    0 |
| table0_date                                            |       104 |    0 |
| table0_date                                            |       105 |    0 |
+--------------------------------------------------------+-----------+------+
insert into table2_order(a,txt) values(0,'最新自增值=>');
select txt,a incre_col,b from table2_order order by a;
+--------------------------------------------------------+-----------+------+
| txt                                                    | incre_col | b    |
+--------------------------------------------------------+-----------+------+
| table2_order order模式                                 |         1 |    2 |
| 插入下一个自增值2（当前最大自增值+1）                  |         2 |    2 |
| 最新自增值=>                                           |         3 |    2 |
| 插入下一个自增值2（当前最大自增值+1）                  |         5 |    2 |
| 最新自增值=>                                           |         6 |    2 |
| 引用AUTO_INCREMENT列的值                               |         7 |   14 |
| 最新自增值=>                                           |         8 |    2 |
| 引用AUTO_INCREMENT列的值                               |         9 |   18 |
| 最新自增值=>                                           |        10 |    2 |
| table0_date                                            |       100 |    0 |
| table0_date                                            |       101 |    0 |
| table0_date                                            |       102 |    0 |
| table0_date                                            |       103 |    0 |
| table0_date                                            |       104 |    0 |
| table0_date                                            |       105 |    0 |
| 最新自增值=>                                           |       106 |    2 |
+--------------------------------------------------------+-----------+------+
replace into table3_noorder select a,b,txt from table0_date where a > 102;
select txt,a incre_col,b from table3_noorder order by a;
+--------------------------------------------------------+-----------+---------+
| txt                                                    | incre_col | b       |
+--------------------------------------------------------+-----------+---------+
| table3_noorder noorder模式                             |         1 |       3 |
| 插入下一个自增值2（当前最大自增值+1）                  |         2 |       3 |
| table0_date                                            |       100 |       0 |
| table0_date                                            |       101 |       0 |
| table0_date                                            |       102 |       0 |
| table0_date                                            |       103 |       0 |
| table0_date                                            |       104 |       0 |
| table0_date                                            |       105 |       0 |
| 最新自增值=>                                           |   1000001 |       3 |
| 插入下一个自增值2（当前最大自增值+1）                  |   1000002 |       3 |
| 最新自增值=>                                           |   2000001 |       3 |
| 引用AUTO_INCREMENT列的值                               |   2000002 | 4000004 |
| 最新自增值=>                                           |   3000001 |       3 |
| 引用AUTO_INCREMENT列的值                               |   3000002 | 6000004 |
| 最新自增值=>                                           |   4000001 |       3 |
| 最新自增值=>                                           |   4000002 |       3 |
+--------------------------------------------------------+-----------+---------+
insert into table3_noorder(a,txt) values(0,'最新自增值=>');
select txt,a incre_col,b from table3_noorder order by a;
+--------------------------------------------------------+-----------+---------+
| txt                                                    | incre_col | b       |
+--------------------------------------------------------+-----------+---------+
| table3_noorder noorder模式                             |         1 |       3 |
| 插入下一个自增值2（当前最大自增值+1）                  |         2 |       3 |
| table0_date                                            |       100 |       0 |
| table0_date                                            |       101 |       0 |
| table0_date                                            |       102 |       0 |
| table0_date                                            |       103 |       0 |
| table0_date                                            |       104 |       0 |
| table0_date                                            |       105 |       0 |
| 最新自增值=>                                           |   1000001 |       3 |
| 插入下一个自增值2（当前最大自增值+1）                  |   1000002 |       3 |
| 最新自增值=>                                           |   2000001 |       3 |
| 引用AUTO_INCREMENT列的值                               |   2000002 | 4000004 |
| 最新自增值=>                                           |   3000001 |       3 |
| 引用AUTO_INCREMENT列的值                               |   3000002 | 6000004 |
| 最新自增值=>                                           |   4000001 |       3 |
| 最新自增值=>                                           |   4000002 |       3 |
| 最新自增值=>                                           |   4000003 |       3 |
+--------------------------------------------------------+-----------+---------+
##混合插入
##INSERT ... ON DUPLICATE KEY UPDATE 语句
insert into table1_default (a,b,txt) values (1,1,'重复场合') on duplicate key update b=b+1,txt='insert...on duplicate key update 语句';
insert into table1_default(a,txt) values(0,'最新自增值=>');
select txt,a incre_col,b from table1_default order by a;
+--------------------------------------------------------+-----------+------+
| txt                                                    | incre_col | b    |
+--------------------------------------------------------+-----------+------+
| insert...on duplicate key update 语句                  |         1 |    2 |
| 插入下一个自增值2（当前最大自增值+1）                  |         2 |    1 |
| 最新自增值=>                                           |         3 |    1 |
| 插入下一个自增值2（当前最大自增值+1）                  |         5 |    1 |
| 最新自增值=>                                           |         6 |    1 |
| 引用AUTO_INCREMENT列的值                               |         7 |   14 |
| 最新自增值=>                                           |         8 |    1 |
| 引用AUTO_INCREMENT列的值                               |         9 |   18 |
| 最新自增值=>                                           |        10 |    1 |
| table0_date                                            |       100 |    0 |
| table0_date                                            |       101 |    0 |
| table0_date                                            |       102 |    0 |
| table0_date                                            |       103 |    0 |
| table0_date                                            |       104 |    0 |
| table0_date                                            |       105 |    0 |
| 最新自增值=>                                           |       106 |    1 |
| 最新自增值=>                                           |       107 |    1 |
+--------------------------------------------------------+-----------+------+
insert into table1_default (a,b,txt) values (50,1,'不重复场合') on duplicate key update b=b+1,txt='insert...on duplicate key update 语句';
insert into table1_default(a,txt) values(0,'最新自增值=>');
select txt,a incre_col,b from table1_default order by a;
+--------------------------------------------------------+-----------+------+
| txt                                                    | incre_col | b    |
+--------------------------------------------------------+-----------+------+
| insert...on duplicate key update 语句                  |         1 |    2 |
| 插入下一个自增值2（当前最大自增值+1）                  |         2 |    1 |
| 最新自增值=>                                           |         3 |    1 |
| 插入下一个自增值2（当前最大自增值+1）                  |         5 |    1 |
| 最新自增值=>                                           |         6 |    1 |
| 引用AUTO_INCREMENT列的值                               |         7 |   14 |
| 最新自增值=>                                           |         8 |    1 |
| 引用AUTO_INCREMENT列的值                               |         9 |   18 |
| 最新自增值=>                                           |        10 |    1 |
| 不重复场合                                             |        50 |    1 |
| table0_date                                            |       100 |    0 |
| table0_date                                            |       101 |    0 |
| table0_date                                            |       102 |    0 |
| table0_date                                            |       103 |    0 |
| table0_date                                            |       104 |    0 |
| table0_date                                            |       105 |    0 |
| 最新自增值=>                                           |       106 |    1 |
| 最新自增值=>                                           |       107 |    1 |
| 最新自增值=>                                           |       108 |    1 |
+--------------------------------------------------------+-----------+------+
insert into table2_order (a,b,txt) values (1,2,'重复场合') on duplicate key update b=b+1,txt='insert...on duplicate key update 语句';
insert into table2_order(a,txt) values(0,'最新自增值=>');
select txt,a incre_col,b from table2_order order by a;
+--------------------------------------------------------+-----------+------+
| txt                                                    | incre_col | b    |
+--------------------------------------------------------+-----------+------+
| insert...on duplicate key update 语句                  |         1 |    3 |
| 插入下一个自增值2（当前最大自增值+1）                  |         2 |    2 |
| 最新自增值=>                                           |         3 |    2 |
| 插入下一个自增值2（当前最大自增值+1）                  |         5 |    2 |
| 最新自增值=>                                           |         6 |    2 |
| 引用AUTO_INCREMENT列的值                               |         7 |   14 |
| 最新自增值=>                                           |         8 |    2 |
| 引用AUTO_INCREMENT列的值                               |         9 |   18 |
| 最新自增值=>                                           |        10 |    2 |
| table0_date                                            |       100 |    0 |
| table0_date                                            |       101 |    0 |
| table0_date                                            |       102 |    0 |
| table0_date                                            |       103 |    0 |
| table0_date                                            |       104 |    0 |
| table0_date                                            |       105 |    0 |
| 最新自增值=>                                           |       106 |    2 |
| 最新自增值=>                                           |       107 |    2 |
+--------------------------------------------------------+-----------+------+
insert into table2_order (a,b,txt) values (50,2,'不重复场合') on duplicate key update b=b+1,txt='insert...on duplicate key update 语句';
insert into table2_order(a,txt) values(0,'最新自增值=>');
select txt,a incre_col,b from table2_order order by a;
+--------------------------------------------------------+-----------+------+
| txt                                                    | incre_col | b    |
+--------------------------------------------------------+-----------+------+
| insert...on duplicate key update 语句                  |         1 |    3 |
| 插入下一个自增值2（当前最大自增值+1）                  |         2 |    2 |
| 最新自增值=>                                           |         3 |    2 |
| 插入下一个自增值2（当前最大自增值+1）                  |         5 |    2 |
| 最新自增值=>                                           |         6 |    2 |
| 引用AUTO_INCREMENT列的值                               |         7 |   14 |
| 最新自增值=>                                           |         8 |    2 |
| 引用AUTO_INCREMENT列的值                               |         9 |   18 |
| 最新自增值=>                                           |        10 |    2 |
| 不重复场合                                             |        50 |    2 |
| table0_date                                            |       100 |    0 |
| table0_date                                            |       101 |    0 |
| table0_date                                            |       102 |    0 |
| table0_date                                            |       103 |    0 |
| table0_date                                            |       104 |    0 |
| table0_date                                            |       105 |    0 |
| 最新自增值=>                                           |       106 |    2 |
| 最新自增值=>                                           |       107 |    2 |
| 最新自增值=>                                           |       108 |    2 |
+--------------------------------------------------------+-----------+------+
insert into table3_noorder (a,b,txt) values (1,3,'重复场合') on duplicate key update b=b+1,txt='insert...on duplicate key update 语句';
insert into table3_noorder(a,txt) values(0,'最新自增值=>');
select txt,a incre_col,b from table3_noorder order by a;
+--------------------------------------------------------+-----------+---------+
| txt                                                    | incre_col | b       |
+--------------------------------------------------------+-----------+---------+
| insert...on duplicate key update 语句                  |         1 |       4 |
| 插入下一个自增值2（当前最大自增值+1）                  |         2 |       3 |
| table0_date                                            |       100 |       0 |
| table0_date                                            |       101 |       0 |
| table0_date                                            |       102 |       0 |
| table0_date                                            |       103 |       0 |
| table0_date                                            |       104 |       0 |
| table0_date                                            |       105 |       0 |
| 最新自增值=>                                           |   1000001 |       3 |
| 插入下一个自增值2（当前最大自增值+1）                  |   1000002 |       3 |
| 最新自增值=>                                           |   2000001 |       3 |
| 引用AUTO_INCREMENT列的值                               |   2000002 | 4000004 |
| 最新自增值=>                                           |   3000001 |       3 |
| 引用AUTO_INCREMENT列的值                               |   3000002 | 6000004 |
| 最新自增值=>                                           |   4000001 |       3 |
| 最新自增值=>                                           |   4000002 |       3 |
| 最新自增值=>                                           |   4000003 |       3 |
| 最新自增值=>                                           |   4000004 |       3 |
+--------------------------------------------------------+-----------+---------+
insert into table3_noorder (a,b,txt) values (50,3,'不重复场合') on duplicate key update b=b+1,txt='insert...on duplicate key update 语句';
insert into table3_noorder(a,txt) values(0,'最新自增值=>');
select txt,a incre_col,b from table3_noorder order by a;
+--------------------------------------------------------+-----------+---------+
| txt                                                    | incre_col | b       |
+--------------------------------------------------------+-----------+---------+
| insert...on duplicate key update 语句                  |         1 |       4 |
| 插入下一个自增值2（当前最大自增值+1）                  |         2 |       3 |
| 不重复场合                                             |        50 |       3 |
| table0_date                                            |       100 |       0 |
| table0_date                                            |       101 |       0 |
| table0_date                                            |       102 |       0 |
| table0_date                                            |       103 |       0 |
| table0_date                                            |       104 |       0 |
| table0_date                                            |       105 |       0 |
| 最新自增值=>                                           |   1000001 |       3 |
| 插入下一个自增值2（当前最大自增值+1）                  |   1000002 |       3 |
| 最新自增值=>                                           |   2000001 |       3 |
| 引用AUTO_INCREMENT列的值                               |   2000002 | 4000004 |
| 最新自增值=>                                           |   3000001 |       3 |
| 引用AUTO_INCREMENT列的值                               |   3000002 | 6000004 |
| 最新自增值=>                                           |   4000001 |       3 |
| 最新自增值=>                                           |   4000002 |       3 |
| 最新自增值=>                                           |   4000003 |       3 |
| 最新自增值=>                                           |   4000004 |       3 |
| 最新自增值=>                                           |   4000005 |       3 |
+--------------------------------------------------------+-----------+---------+
##将NULL和任何其他值混合插入 AUTO_INCREMENT列
##INSERT 语句
truncate table table1_default;
insert into table1_default(a) values(null),(100),(null),(150);
insert into table1_default(a,txt) values(0,'最新自增值=>');
select txt,a incre_col,b from table1_default order by a;
+----------------------------------+-----------+------+
| txt                              | incre_col | b    |
+----------------------------------+-----------+------+
| table1_default 默认order模式     |         1 |    1 |
| table1_default 默认order模式     |       100 |    1 |
| table1_default 默认order模式     |       101 |    1 |
| table1_default 默认order模式     |       150 |    1 |
| 最新自增值=>                     |       151 |    1 |
+----------------------------------+-----------+------+
truncate table table2_order;
insert into table2_order(a) values(null),(100),(null),(150);
insert into table2_order(a,txt) values(0,'最新自增值=>');
select txt,a incre_col,b from table2_order order by a;
+--------------------------+-----------+------+
| txt                      | incre_col | b    |
+--------------------------+-----------+------+
| table2_order order模式   |         1 |    2 |
| table2_order order模式   |       100 |    2 |
| table2_order order模式   |       101 |    2 |
| table2_order order模式   |       150 |    2 |
| 最新自增值=>             |       151 |    2 |
+--------------------------+-----------+------+
truncate table table3_noorder;
insert into table3_noorder(a) values(null),(100),(null),(150);
insert into table3_noorder(a,txt) values(0,'最新自增值=>');
select txt,a incre_col,b from table3_noorder order by a;
+------------------------------+-----------+------+
| txt                          | incre_col | b    |
+------------------------------+-----------+------+
| table3_noorder noorder模式   |         1 |    3 |
| table3_noorder noorder模式   |       100 |    3 |
| table3_noorder noorder模式   |       150 |    3 |
| table3_noorder noorder模式   |   1000001 |    3 |
| 最新自增值=>                 |   1000003 |    3 |
+------------------------------+-----------+------+
##REPLACE 语句
replace into table1_default(a) values(null),(160),(null),(200);
insert into table1_default(a,txt) values(0,'最新自增值=>');
select txt,a incre_col,b from table1_default order by a;
+----------------------------------+-----------+------+
| txt                              | incre_col | b    |
+----------------------------------+-----------+------+
| table1_default 默认order模式     |         1 |    1 |
| table1_default 默认order模式     |       100 |    1 |
| table1_default 默认order模式     |       101 |    1 |
| table1_default 默认order模式     |       150 |    1 |
| 最新自增值=>                     |       151 |    1 |
| table1_default 默认order模式     |       152 |    1 |
| table1_default 默认order模式     |       160 |    1 |
| table1_default 默认order模式     |       161 |    1 |
| table1_default 默认order模式     |       200 |    1 |
| 最新自增值=>                     |       201 |    1 |
+----------------------------------+-----------+------+
replace into table2_order(a) values(null),(160),(null),(200);
insert into table2_order(a,txt) values(0,'最新自增值=>');
select txt,a incre_col,b from table2_order order by a;
+--------------------------+-----------+------+
| txt                      | incre_col | b    |
+--------------------------+-----------+------+
| table2_order order模式   |         1 |    2 |
| table2_order order模式   |       100 |    2 |
| table2_order order模式   |       101 |    2 |
| table2_order order模式   |       150 |    2 |
| 最新自增值=>             |       151 |    2 |
| table2_order order模式   |       152 |    2 |
| table2_order order模式   |       160 |    2 |
| table2_order order模式   |       161 |    2 |
| table2_order order模式   |       200 |    2 |
| 最新自增值=>             |       201 |    2 |
+--------------------------+-----------+------+
replace into table3_noorder(a) values(null),(160),(null),(200);
insert into table3_noorder(a,txt) values(0,'最新自增值=>');
select txt,a incre_col,b from table3_noorder order by a;
+------------------------------+-----------+------+
| txt                          | incre_col | b    |
+------------------------------+-----------+------+
| table3_noorder noorder模式   |         1 |    3 |
| table3_noorder noorder模式   |       100 |    3 |
| table3_noorder noorder模式   |       150 |    3 |
| table3_noorder noorder模式   |       160 |    3 |
| table3_noorder noorder模式   |       200 |    3 |
| table3_noorder noorder模式   |   1000001 |    3 |
| 最新自增值=>                 |   1000003 |    3 |
| table3_noorder noorder模式   |   1000004 |    3 |
| table3_noorder noorder模式   |   1000005 |    3 |
| 最新自增值=>                 |   1000008 |    3 |
+------------------------------+-----------+------+
###### auto_incre_3-1-2 ②DELETE操作
insert into table1_default(a,b) values(null,11);
insert into table1_default(a,b) values(null,11);
select txt,a incre_col,b from table1_default order by a;
+----------------------------------+-----------+------+
| txt                              | incre_col | b    |
+----------------------------------+-----------+------+
| table1_default 默认order模式     |         1 |    1 |
| table1_default 默认order模式     |       100 |    1 |
| table1_default 默认order模式     |       101 |    1 |
| table1_default 默认order模式     |       150 |    1 |
| 最新自增值=>                     |       151 |    1 |
| table1_default 默认order模式     |       152 |    1 |
| table1_default 默认order模式     |       160 |    1 |
| table1_default 默认order模式     |       161 |    1 |
| table1_default 默认order模式     |       200 |    1 |
| 最新自增值=>                     |       201 |    1 |
| table1_default 默认order模式     |       202 |   11 |
| table1_default 默认order模式     |       203 |   11 |
+----------------------------------+-----------+------+
delete from table1_default where b=11;
insert into table1_default(a,txt) values(0,'最新自增值=>');
select txt,a incre_col,b from table1_default order by a;
+----------------------------------+-----------+------+
| txt                              | incre_col | b    |
+----------------------------------+-----------+------+
| table1_default 默认order模式     |         1 |    1 |
| table1_default 默认order模式     |       100 |    1 |
| table1_default 默认order模式     |       101 |    1 |
| table1_default 默认order模式     |       150 |    1 |
| 最新自增值=>                     |       151 |    1 |
| table1_default 默认order模式     |       152 |    1 |
| table1_default 默认order模式     |       160 |    1 |
| table1_default 默认order模式     |       161 |    1 |
| table1_default 默认order模式     |       200 |    1 |
| 最新自增值=>                     |       201 |    1 |
| 最新自增值=>                     |       204 |    1 |
+----------------------------------+-----------+------+
insert into table2_order(a,b) values(null,22);
insert into table2_order(a,b) values(null,22);
select txt,a incre_col,b from table2_order order by a;
+--------------------------+-----------+------+
| txt                      | incre_col | b    |
+--------------------------+-----------+------+
| table2_order order模式   |         1 |    2 |
| table2_order order模式   |       100 |    2 |
| table2_order order模式   |       101 |    2 |
| table2_order order模式   |       150 |    2 |
| 最新自增值=>             |       151 |    2 |
| table2_order order模式   |       152 |    2 |
| table2_order order模式   |       160 |    2 |
| table2_order order模式   |       161 |    2 |
| table2_order order模式   |       200 |    2 |
| 最新自增值=>             |       201 |    2 |
| table2_order order模式   |       202 |   22 |
| table2_order order模式   |       203 |   22 |
+--------------------------+-----------+------+
delete from table2_order where b=22;
insert into table2_order(a,txt) values(0,'最新自增值=>');
select txt,a incre_col,b from table2_order order by a;
+--------------------------+-----------+------+
| txt                      | incre_col | b    |
+--------------------------+-----------+------+
| table2_order order模式   |         1 |    2 |
| table2_order order模式   |       100 |    2 |
| table2_order order模式   |       101 |    2 |
| table2_order order模式   |       150 |    2 |
| 最新自增值=>             |       151 |    2 |
| table2_order order模式   |       152 |    2 |
| table2_order order模式   |       160 |    2 |
| table2_order order模式   |       161 |    2 |
| table2_order order模式   |       200 |    2 |
| 最新自增值=>             |       201 |    2 |
| 最新自增值=>             |       204 |    2 |
+--------------------------+-----------+------+
insert into table3_noorder(a,b) values(null,33);
insert into table3_noorder(a,b) values(null,33);
select txt,a incre_col,b from table3_noorder order by a;
+------------------------------+-----------+------+
| txt                          | incre_col | b    |
+------------------------------+-----------+------+
| table3_noorder noorder模式   |         1 |    3 |
| table3_noorder noorder模式   |       100 |    3 |
| table3_noorder noorder模式   |       150 |    3 |
| table3_noorder noorder模式   |       160 |    3 |
| table3_noorder noorder模式   |       200 |    3 |
| table3_noorder noorder模式   |   1000001 |    3 |
| 最新自增值=>                 |   1000003 |    3 |
| table3_noorder noorder模式   |   1000004 |    3 |
| table3_noorder noorder模式   |   1000005 |    3 |
| 最新自增值=>                 |   1000008 |    3 |
| table3_noorder noorder模式   |   1000009 |   33 |
| table3_noorder noorder模式   |   1000010 |   33 |
+------------------------------+-----------+------+
delete from table3_noorder where b=33;
insert into table3_noorder(a,txt) values(0,'最新自增值=>');
select txt,a incre_col,b from table3_noorder order by a;
+------------------------------+-----------+------+
| txt                          | incre_col | b    |
+------------------------------+-----------+------+
| table3_noorder noorder模式   |         1 |    3 |
| table3_noorder noorder模式   |       100 |    3 |
| table3_noorder noorder模式   |       150 |    3 |
| table3_noorder noorder模式   |       160 |    3 |
| table3_noorder noorder模式   |       200 |    3 |
| table3_noorder noorder模式   |   1000001 |    3 |
| 最新自增值=>                 |   1000003 |    3 |
| table3_noorder noorder模式   |   1000004 |    3 |
| table3_noorder noorder模式   |   1000005 |    3 |
| 最新自增值=>                 |   1000008 |    3 |
| 最新自增值=>                 |   1000011 |    3 |
+------------------------------+-----------+------+
###### auto_incre_3-1-3 ③UPDATE操作
# mysql 5.x update没有推高这个自增值，和我们现在是兼容的；8.x update会推高
##更新现有AUTO_INCREMENT列值
insert into table1_default(a,b) values(null,111);
select txt,a incre_col,b from table1_default order by a;
+----------------------------------+-----------+------+
| txt                              | incre_col | b    |
+----------------------------------+-----------+------+
| table1_default 默认order模式     |         1 |    1 |
| table1_default 默认order模式     |       100 |    1 |
| table1_default 默认order模式     |       101 |    1 |
| table1_default 默认order模式     |       150 |    1 |
| 最新自增值=>                     |       151 |    1 |
| table1_default 默认order模式     |       152 |    1 |
| table1_default 默认order模式     |       160 |    1 |
| table1_default 默认order模式     |       161 |    1 |
| table1_default 默认order模式     |       200 |    1 |
| 最新自增值=>                     |       201 |    1 |
| 最新自增值=>                     |       204 |    1 |
| table1_default 默认order模式     |       205 |  111 |
+----------------------------------+-----------+------+
update table1_default set a = 0,txt = '将AUTO_INCREMENT列值设置为小于/等于当前最大自增值的值' where b = 111;
insert into table1_default values(null,11,'1当前自增值=>');
select txt,a incre_col,b from table1_default order by a;
+--------------------------------------------------------------------------+-----------+------+
| txt                                                                      | incre_col | b    |
+--------------------------------------------------------------------------+-----------+------+
| 将AUTO_INCREMENT列值设置为小于/等于当前最大自增值的值                    |         0 |  111 |
| table1_default 默认order模式                                             |         1 |    1 |
| table1_default 默认order模式                                             |       100 |    1 |
| table1_default 默认order模式                                             |       101 |    1 |
| table1_default 默认order模式                                             |       150 |    1 |
| 最新自增值=>                                                             |       151 |    1 |
| table1_default 默认order模式                                             |       152 |    1 |
| table1_default 默认order模式                                             |       160 |    1 |
| table1_default 默认order模式                                             |       161 |    1 |
| table1_default 默认order模式                                             |       200 |    1 |
| 最新自增值=>                                                             |       201 |    1 |
| 最新自增值=>                                                             |       204 |    1 |
| 1当前自增值=>                                                            |       206 |   11 |
+--------------------------------------------------------------------------+-----------+------+
update table1_default set a = 20 ,txt = '将AUTO_INCREMENT列值设置为大于当前最大自增值的值' where b = 111;
insert into table1_default values(null,11,'2当前自增值=>');
select txt,a incre_col,b from table1_default order by a;
+-------------------------------------------------------------------+-----------+------+
| txt                                                               | incre_col | b    |
+-------------------------------------------------------------------+-----------+------+
| table1_default 默认order模式                                      |         1 |    1 |
| 将AUTO_INCREMENT列值设置为大于当前最大自增值的值                  |        20 |  111 |
| table1_default 默认order模式                                      |       100 |    1 |
| table1_default 默认order模式                                      |       101 |    1 |
| table1_default 默认order模式                                      |       150 |    1 |
| 最新自增值=>                                                      |       151 |    1 |
| table1_default 默认order模式                                      |       152 |    1 |
| table1_default 默认order模式                                      |       160 |    1 |
| table1_default 默认order模式                                      |       161 |    1 |
| table1_default 默认order模式                                      |       200 |    1 |
| 最新自增值=>                                                      |       201 |    1 |
| 最新自增值=>                                                      |       204 |    1 |
| 1当前自增值=>                                                     |       206 |   11 |
| 2当前自增值=>                                                     |       207 |   11 |
+-------------------------------------------------------------------+-----------+------+
insert into table2_order(a,b) values(null,222);
select txt,a incre_col,b from table2_order order by a;
+--------------------------+-----------+------+
| txt                      | incre_col | b    |
+--------------------------+-----------+------+
| table2_order order模式   |         1 |    2 |
| table2_order order模式   |       100 |    2 |
| table2_order order模式   |       101 |    2 |
| table2_order order模式   |       150 |    2 |
| 最新自增值=>             |       151 |    2 |
| table2_order order模式   |       152 |    2 |
| table2_order order模式   |       160 |    2 |
| table2_order order模式   |       161 |    2 |
| table2_order order模式   |       200 |    2 |
| 最新自增值=>             |       201 |    2 |
| 最新自增值=>             |       204 |    2 |
| table2_order order模式   |       205 |  222 |
+--------------------------+-----------+------+
update table2_order set a = 0,txt = '将AUTO_INCREMENT列值设置为小于/等于当前最大自增值的值' where b = 222;
insert into table2_order values(null,22,'1当前自增值=>');
select txt,a incre_col,b from table2_order order by a;
+--------------------------------------------------------------------------+-----------+------+
| txt                                                                      | incre_col | b    |
+--------------------------------------------------------------------------+-----------+------+
| 将AUTO_INCREMENT列值设置为小于/等于当前最大自增值的值                    |         0 |  222 |
| table2_order order模式                                                   |         1 |    2 |
| table2_order order模式                                                   |       100 |    2 |
| table2_order order模式                                                   |       101 |    2 |
| table2_order order模式                                                   |       150 |    2 |
| 最新自增值=>                                                             |       151 |    2 |
| table2_order order模式                                                   |       152 |    2 |
| table2_order order模式                                                   |       160 |    2 |
| table2_order order模式                                                   |       161 |    2 |
| table2_order order模式                                                   |       200 |    2 |
| 最新自增值=>                                                             |       201 |    2 |
| 最新自增值=>                                                             |       204 |    2 |
| 1当前自增值=>                                                            |       206 |   22 |
+--------------------------------------------------------------------------+-----------+------+
update table2_order set a = 20 ,txt = '将AUTO_INCREMENT列值设置为大于当前最大自增值的值' where b = 222;
insert into table2_order values(null,22,'2当前自增值=>');
select txt,a incre_col,b from table2_order order by a;
+-------------------------------------------------------------------+-----------+------+
| txt                                                               | incre_col | b    |
+-------------------------------------------------------------------+-----------+------+
| table2_order order模式                                            |         1 |    2 |
| 将AUTO_INCREMENT列值设置为大于当前最大自增值的值                  |        20 |  222 |
| table2_order order模式                                            |       100 |    2 |
| table2_order order模式                                            |       101 |    2 |
| table2_order order模式                                            |       150 |    2 |
| 最新自增值=>                                                      |       151 |    2 |
| table2_order order模式                                            |       152 |    2 |
| table2_order order模式                                            |       160 |    2 |
| table2_order order模式                                            |       161 |    2 |
| table2_order order模式                                            |       200 |    2 |
| 最新自增值=>                                                      |       201 |    2 |
| 最新自增值=>                                                      |       204 |    2 |
| 1当前自增值=>                                                     |       206 |   22 |
| 2当前自增值=>                                                     |       207 |   22 |
+-------------------------------------------------------------------+-----------+------+
insert into table3_noorder(a,b) values(null,333);
select txt,a incre_col,b from table3_noorder order by a;
+------------------------------+-----------+------+
| txt                          | incre_col | b    |
+------------------------------+-----------+------+
| table3_noorder noorder模式   |         1 |    3 |
| table3_noorder noorder模式   |       100 |    3 |
| table3_noorder noorder模式   |       150 |    3 |
| table3_noorder noorder模式   |       160 |    3 |
| table3_noorder noorder模式   |       200 |    3 |
| table3_noorder noorder模式   |   1000001 |    3 |
| 最新自增值=>                 |   1000003 |    3 |
| table3_noorder noorder模式   |   1000004 |    3 |
| table3_noorder noorder模式   |   1000005 |    3 |
| 最新自增值=>                 |   1000008 |    3 |
| 最新自增值=>                 |   1000011 |    3 |
| table3_noorder noorder模式   |   1000012 |  333 |
+------------------------------+-----------+------+
update table3_noorder set a = 0,txt = '将AUTO_INCREMENT列值设置为小于/等于当前最大自增值的值' where b = 333;
insert into table3_noorder values(null,33,'1当前自增值=>');
select txt,a incre_col,b from table3_noorder order by a;
+--------------------------------------------------------------------------+-----------+------+
| txt                                                                      | incre_col | b    |
+--------------------------------------------------------------------------+-----------+------+
| 将AUTO_INCREMENT列值设置为小于/等于当前最大自增值的值                    |         0 |  333 |
| table3_noorder noorder模式                                               |         1 |    3 |
| table3_noorder noorder模式                                               |       100 |    3 |
| table3_noorder noorder模式                                               |       150 |    3 |
| table3_noorder noorder模式                                               |       160 |    3 |
| table3_noorder noorder模式                                               |       200 |    3 |
| table3_noorder noorder模式                                               |   1000001 |    3 |
| 最新自增值=>                                                             |   1000003 |    3 |
| table3_noorder noorder模式                                               |   1000004 |    3 |
| table3_noorder noorder模式                                               |   1000005 |    3 |
| 最新自增值=>                                                             |   1000008 |    3 |
| 最新自增值=>                                                             |   1000011 |    3 |
| 1当前自增值=>                                                            |   1000013 |   33 |
+--------------------------------------------------------------------------+-----------+------+
update table3_noorder set a = 20 ,txt = '将AUTO_INCREMENT列值设置为大于当前最大自增值的值' where b = 333;
insert into table3_noorder values(null,33,'2当前自增值=>');
select txt,a incre_col,b from table3_noorder order by a;
+-------------------------------------------------------------------+-----------+------+
| txt                                                               | incre_col | b    |
+-------------------------------------------------------------------+-----------+------+
| table3_noorder noorder模式                                        |         1 |    3 |
| 将AUTO_INCREMENT列值设置为大于当前最大自增值的值                  |        20 |  333 |
| table3_noorder noorder模式                                        |       100 |    3 |
| table3_noorder noorder模式                                        |       150 |    3 |
| table3_noorder noorder模式                                        |       160 |    3 |
| table3_noorder noorder模式                                        |       200 |    3 |
| table3_noorder noorder模式                                        |   1000001 |    3 |
| 最新自增值=>                                                      |   1000003 |    3 |
| table3_noorder noorder模式                                        |   1000004 |    3 |
| table3_noorder noorder模式                                        |   1000005 |    3 |
| 最新自增值=>                                                      |   1000008 |    3 |
| 最新自增值=>                                                      |   1000011 |    3 |
| 1当前自增值=>                                                     |   1000013 |   33 |
| 2当前自增值=>                                                     |   1000014 |   33 |
+-------------------------------------------------------------------+-----------+------+
##更新其他列值时引用AUTO_INCREMENT列
delete from table1_default;
insert into table1_default(a,b,txt) values(null,0,'update');
select txt,a incre_col,b from table1_default order by a;
+--------+-----------+------+
| txt    | incre_col | b    |
+--------+-----------+------+
| update |       208 |    0 |
+--------+-----------+------+
update table1_default set b = a+1 where txt = 'update';
insert into table1_default values(null,11,'当前自增值==>');
select txt,a incre_col,b from table1_default order by a;
+--------------------+-----------+------+
| txt                | incre_col | b    |
+--------------------+-----------+------+
| update             |       208 |  209 |
| 当前自增值==>      |       209 |   11 |
+--------------------+-----------+------+
delete from table2_order;
insert into table2_order(a,b,txt) values(null,0,'update');
select txt,a incre_col,b from table2_order order by a;
+--------+-----------+------+
| txt    | incre_col | b    |
+--------+-----------+------+
| update |       208 |    0 |
+--------+-----------+------+
update table2_order set b = a+2 where txt = 'update';
insert into table2_order values(null,22,'当前自增值==>');
select txt,a incre_col,b from table2_order order by a;
+--------------------+-----------+------+
| txt                | incre_col | b    |
+--------------------+-----------+------+
| update             |       208 |  210 |
| 当前自增值==>      |       209 |   22 |
+--------------------+-----------+------+
delete from table3_noorder;
insert into table3_noorder(a,b,txt) values(null,0,'update');
select txt,a incre_col,b from table3_noorder order by a;
+--------+-----------+------+
| txt    | incre_col | b    |
+--------+-----------+------+
| update |   1000015 |    0 |
+--------+-----------+------+
update table3_noorder set b = a+3 where txt = 'update';
insert into table3_noorder values(null,33,'当前自增值==>');
select txt,a incre_col,b from table3_noorder order by a;
+--------------------+-----------+---------+
| txt                | incre_col | b       |
+--------------------+-----------+---------+
| update             |   1000015 | 1000018 |
| 当前自增值==>      |   1000016 |      33 |
+--------------------+-----------+---------+
###### auto_incre_3-1-4 ④SELECT操作
select a incre_col from table1_default order by a;
+-----------+
| incre_col |
+-----------+
|       208 |
|       209 |
+-----------+
select abs(a) from table1_default order by a;
+--------+
| abs(a) |
+--------+
|    208 |
|    209 |
+--------+
select a+b from table1_default order by a;
+------+
| a+b  |
+------+
|  417 |
|  220 |
+------+
select a incre_col from table2_order order by a;
+-----------+
| incre_col |
+-----------+
|       208 |
|       209 |
+-----------+
select abs(a) from table2_order order by a;
+--------+
| abs(a) |
+--------+
|    208 |
|    209 |
+--------+
select a+b from table2_order order by a;
+------+
| a+b  |
+------+
|  418 |
|  231 |
+------+
select a incre_col from table3_noorder order by a;
+-----------+
| incre_col |
+-----------+
|   1000015 |
|   1000016 |
+-----------+
select abs(a) from table3_noorder order by a;
+---------+
| abs(a)  |
+---------+
| 1000015 |
| 1000016 |
+---------+
select a+b from table3_noorder order by a;
+---------+
| a+b     |
+---------+
| 2000033 |
| 1000049 |
+---------+
###### auto_incre_3-1-5 ⑤TRUNCATE操作    
select a incre_col from table1_default order by a;
+-----------+
| incre_col |
+-----------+
|       208 |
|       209 |
+-----------+
truncate table table1_default;
insert into table1_default(a) values(0),(0),(0);
select a incre_col from table1_default order by a;
+-----------+
| incre_col |
+-----------+
|         1 |
|         2 |
|         3 |
+-----------+
select a incre_col from table2_order order by a;
+-----------+
| incre_col |
+-----------+
|       208 |
|       209 |
+-----------+
truncate table table2_order;
insert into table2_order(a) values(0),(0),(0);
select a incre_col from table2_order order by a;
+-----------+
| incre_col |
+-----------+
|         1 |
|         2 |
|         3 |
+-----------+
select a incre_col from table3_noorder order by a;
+-----------+
| incre_col |
+-----------+
|   1000015 |
|   1000016 |
+-----------+
truncate table table3_noorder;
insert into table3_noorder(a) values(0),(0),(0);
select a incre_col from table3_noorder order by a;
+-----------+
| incre_col |
+-----------+
|         1 |
|         2 |
|         3 |
+-----------+
############ auto_incre_3-2 DDL操作 ############
###### auto_incre_3-2-1 ALTER TABLE 语句
##①修改AUTO_INCREMENT列初始值
select txt,a incre_col,b from table1_default order by a;
+----------------------------------+-----------+------+
| txt                              | incre_col | b    |
+----------------------------------+-----------+------+
| table1_default 默认order模式     |         1 |    1 |
| table1_default 默认order模式     |         2 |    1 |
| table1_default 默认order模式     |         3 |    1 |
+----------------------------------+-----------+------+
alter table table1_default auto_increment = 2;
insert into table1_default values(null,11,'当前自增值1==>');
select txt,a incre_col,b from table1_default order by a;
+----------------------------------+-----------+------+
| txt                              | incre_col | b    |
+----------------------------------+-----------+------+
| table1_default 默认order模式     |         1 |    1 |
| table1_default 默认order模式     |         2 |    1 |
| table1_default 默认order模式     |         3 |    1 |
| 当前自增值1==>                   |         4 |   11 |
+----------------------------------+-----------+------+
alter table table1_default auto_increment = 90;
insert into table1_default values(null,11,'当前自增值2==>');
select txt,a incre_col,b from table1_default order by a;
+----------------------------------+-----------+------+
| txt                              | incre_col | b    |
+----------------------------------+-----------+------+
| table1_default 默认order模式     |         1 |    1 |
| table1_default 默认order模式     |         2 |    1 |
| table1_default 默认order模式     |         3 |    1 |
| 当前自增值1==>                   |         4 |   11 |
| 当前自增值2==>                   |        90 |   11 |
+----------------------------------+-----------+------+
select txt,a incre_col,b from table2_order order by a;
+--------------------------+-----------+------+
| txt                      | incre_col | b    |
+--------------------------+-----------+------+
| table2_order order模式   |         1 |    2 |
| table2_order order模式   |         2 |    2 |
| table2_order order模式   |         3 |    2 |
+--------------------------+-----------+------+
alter table table2_order auto_increment = 2;
insert into table2_order values(null,11,'当前自增值1==>');
select txt,a incre_col,b from table2_order order by a;
+--------------------------+-----------+------+
| txt                      | incre_col | b    |
+--------------------------+-----------+------+
| table2_order order模式   |         1 |    2 |
| table2_order order模式   |         2 |    2 |
| table2_order order模式   |         3 |    2 |
| 当前自增值1==>           |         4 |   11 |
+--------------------------+-----------+------+
alter table table2_order auto_increment = 90;
insert into table2_order values(null,11,'当前自增值2==>');
select txt,a incre_col,b from table2_order order by a;
+--------------------------+-----------+------+
| txt                      | incre_col | b    |
+--------------------------+-----------+------+
| table2_order order模式   |         1 |    2 |
| table2_order order模式   |         2 |    2 |
| table2_order order模式   |         3 |    2 |
| 当前自增值1==>           |         4 |   11 |
| 当前自增值2==>           |        90 |   11 |
+--------------------------+-----------+------+
select txt,a incre_col,b from table3_noorder order by a;
+------------------------------+-----------+------+
| txt                          | incre_col | b    |
+------------------------------+-----------+------+
| table3_noorder noorder模式   |         1 |    3 |
| table3_noorder noorder模式   |         2 |    3 |
| table3_noorder noorder模式   |         3 |    3 |
+------------------------------+-----------+------+
alter table table3_noorder auto_increment = 2;
insert into table3_noorder values(null,11,'当前自增值1==>');
select txt,a incre_col,b from table3_noorder order by a;
+------------------------------+-----------+------+
| txt                          | incre_col | b    |
+------------------------------+-----------+------+
| table3_noorder noorder模式   |         1 |    3 |
| table3_noorder noorder模式   |         2 |    3 |
| table3_noorder noorder模式   |         3 |    3 |
| 当前自增值1==>               |         4 |   11 |
+------------------------------+-----------+------+
alter table table3_noorder auto_increment = 90;
insert into table3_noorder values(null,11,'当前自增值2==>');
select txt,a incre_col,b from table3_noorder order by a;
+------------------------------+-----------+------+
| txt                          | incre_col | b    |
+------------------------------+-----------+------+
| table3_noorder noorder模式   |         1 |    3 |
| table3_noorder noorder模式   |         2 |    3 |
| table3_noorder noorder模式   |         3 |    3 |
| 当前自增值1==>               |         4 |   11 |
| 当前自增值2==>               |        90 |   11 |
+------------------------------+-----------+------+
##③向表中添加 AUTO_INCREMENT 列
##echo ## ob不支持向表中添加 AUTO_INCREMENT 列，报ERROR 1235.暂时注释
##④重命名表名
##table1_default
select txt,a incre_col,b from table1_default order by a;
+----------------------------------+-----------+------+
| txt                              | incre_col | b    |
+----------------------------------+-----------+------+
| table1_default 默认order模式     |         1 |    1 |
| table1_default 默认order模式     |         2 |    1 |
| table1_default 默认order模式     |         3 |    1 |
| 当前自增值1==>                   |         4 |   11 |
| 当前自增值2==>                   |        90 |   11 |
+----------------------------------+-----------+------+
drop table t1_default;
alter table table1_default rename to t1_default;
insert into t1_default values(null,1,'④重命名表名 insert');
insert into t1_default values(null,1,'④重命名表名 insert');
select txt,a incre_col,b from t1_default order by a;
+----------------------------------+-----------+------+
| txt                              | incre_col | b    |
+----------------------------------+-----------+------+
| table1_default 默认order模式     |         1 |    1 |
| table1_default 默认order模式     |         2 |    1 |
| table1_default 默认order模式     |         3 |    1 |
| 当前自增值1==>                   |         4 |   11 |
| 当前自增值2==>                   |        90 |   11 |
| ④重命名表名 insert               |        91 |    1 |
| ④重命名表名 insert               |        92 |    1 |
+----------------------------------+-----------+------+
delete from t1_default where a = 1;
select txt,a incre_col,b from t1_default order by a;
+----------------------------------+-----------+------+
| txt                              | incre_col | b    |
+----------------------------------+-----------+------+
| table1_default 默认order模式     |         2 |    1 |
| table1_default 默认order模式     |         3 |    1 |
| 当前自增值1==>                   |         4 |   11 |
| 当前自增值2==>                   |        90 |   11 |
| ④重命名表名 insert               |        91 |    1 |
| ④重命名表名 insert               |        92 |    1 |
+----------------------------------+-----------+------+
update t1_default set txt = '④重命名表名-update操作' where a = 2;
select txt,a incre_col,b from t1_default order by a;
+----------------------------------+-----------+------+
| txt                              | incre_col | b    |
+----------------------------------+-----------+------+
| ④重命名表名-update操作           |         2 |    1 |
| table1_default 默认order模式     |         3 |    1 |
| 当前自增值1==>                   |         4 |   11 |
| 当前自增值2==>                   |        90 |   11 |
| ④重命名表名 insert               |        91 |    1 |
| ④重命名表名 insert               |        92 |    1 |
+----------------------------------+-----------+------+
##table2_order
select txt,a incre_col,b from table2_order order by a;
+--------------------------+-----------+------+
| txt                      | incre_col | b    |
+--------------------------+-----------+------+
| table2_order order模式   |         1 |    2 |
| table2_order order模式   |         2 |    2 |
| table2_order order模式   |         3 |    2 |
| 当前自增值1==>           |         4 |   11 |
| 当前自增值2==>           |        90 |   11 |
+--------------------------+-----------+------+
drop table t2_order;
alter table table2_order rename to t2_order;
insert into t2_order values(null,2,'④重命名表名 insert');
insert into t2_order values(null,2,'④重命名表名 insert');
select txt,a incre_col,b from t2_order order by a;
+---------------------------+-----------+------+
| txt                       | incre_col | b    |
+---------------------------+-----------+------+
| table2_order order模式    |         1 |    2 |
| table2_order order模式    |         2 |    2 |
| table2_order order模式    |         3 |    2 |
| 当前自增值1==>            |         4 |   11 |
| 当前自增值2==>            |        90 |   11 |
| ④重命名表名 insert        |        91 |    2 |
| ④重命名表名 insert        |        92 |    2 |
+---------------------------+-----------+------+
delete from t2_order where a = 1;
update t2_order set txt = '④重命名表名-update操作' where a = 2;
select txt,a incre_col,b from t2_order order by a;
+---------------------------------+-----------+------+
| txt                             | incre_col | b    |
+---------------------------------+-----------+------+
| ④重命名表名-update操作          |         2 |    2 |
| table2_order order模式          |         3 |    2 |
| 当前自增值1==>                  |         4 |   11 |
| 当前自增值2==>                  |        90 |   11 |
| ④重命名表名 insert              |        91 |    2 |
| ④重命名表名 insert              |        92 |    2 |
+---------------------------------+-----------+------+
##table3_noorder
select txt,a incre_col,b from table3_noorder order by a;
+------------------------------+-----------+------+
| txt                          | incre_col | b    |
+------------------------------+-----------+------+
| table3_noorder noorder模式   |         1 |    3 |
| table3_noorder noorder模式   |         2 |    3 |
| table3_noorder noorder模式   |         3 |    3 |
| 当前自增值1==>               |         4 |   11 |
| 当前自增值2==>               |        90 |   11 |
+------------------------------+-----------+------+
drop table t3_noorder;
alter table table3_noorder rename to t3_noorder;
insert into t3_noorder values(null,3,'④重命名表名 insert');
insert into t3_noorder values(null,3,'④重命名表名 insert');
select txt,a incre_col,b from t3_noorder order by a;
+------------------------------+-----------+------+
| txt                          | incre_col | b    |
+------------------------------+-----------+------+
| table3_noorder noorder模式   |         1 |    3 |
| table3_noorder noorder模式   |         2 |    3 |
| table3_noorder noorder模式   |         3 |    3 |
| 当前自增值1==>               |         4 |   11 |
| 当前自增值2==>               |        90 |   11 |
| ④重命名表名 insert           |        91 |    3 |
| ④重命名表名 insert           |        92 |    3 |
+------------------------------+-----------+------+
delete from t3_noorder where a = 1;
insert into t3_noorder values(null,11,'当前自增值1==>');
select txt,a incre_col,b from t3_noorder order by a;
+------------------------------+-----------+------+
| txt                          | incre_col | b    |
+------------------------------+-----------+------+
| table3_noorder noorder模式   |         2 |    3 |
| table3_noorder noorder模式   |         3 |    3 |
| 当前自增值1==>               |         4 |   11 |
| 当前自增值2==>               |        90 |   11 |
| ④重命名表名 insert           |        91 |    3 |
| ④重命名表名 insert           |        92 |    3 |
| 当前自增值1==>               |        93 |   11 |
+------------------------------+-----------+------+
update t3_noorder set txt = '④重命名表名-update操作' where a = 2;
insert into t3_noorder values(null,11,'当前自增值2==>');
select txt,a incre_col,b from t3_noorder order by a;
+---------------------------------+-----------+------+
| txt                             | incre_col | b    |
+---------------------------------+-----------+------+
| ④重命名表名-update操作          |         2 |    3 |
| table3_noorder noorder模式      |         3 |    3 |
| 当前自增值1==>                  |         4 |   11 |
| 当前自增值2==>                  |        90 |   11 |
| ④重命名表名 insert              |        91 |    3 |
| ④重命名表名 insert              |        92 |    3 |
| 当前自增值1==>                  |        93 |   11 |
| 当前自增值2==>                  |        94 |   11 |
+---------------------------------+-----------+------+
##⑤重命名AUTO_INCREMENT列名
##echo ## ob不支持重命名列名，报ERROR 1064.暂时注释
##⑥修改AUTO_INCREMENT列属性
##t1_default
drop table t1_default;
create table t1_default (
  col_a int not null primary key,
  b int ,
  txt varchar(64) default 't1_default',
  unique index(b)
);
insert into t1_default values(1,11,'t1_default'),(2,22,'t1_default'),(3,33,'t1_default');
alter table t1_default modify b int auto_increment;
insert into t1_default values(4,null,'⑥修改auto_increment列属性');
insert into t1_default values(5,null,'⑥修改auto_increment列属性');
insert into t1_default values(6,null,'⑥修改auto_increment列属性');
select txt,b incre_col,col_a from t1_default order by b;
+----------------------------------+-----------+-------+
| txt                              | incre_col | col_a |
+----------------------------------+-----------+-------+
| t1_default                       |        11 |     1 |
| t1_default                       |        22 |     2 |
| t1_default                       |        33 |     3 |
| ⑥修改auto_increment列属性        |        34 |     4 |
| ⑥修改auto_increment列属性        |        35 |     5 |
| ⑥修改auto_increment列属性        |        36 |     6 |
+----------------------------------+-----------+-------+
delete from t1_default where b = 33;
insert into t1_default values(7,null,'当前自增值1==>');
select txt,b incre_col,col_a from t1_default order by b;
+----------------------------------+-----------+-------+
| txt                              | incre_col | col_a |
+----------------------------------+-----------+-------+
| t1_default                       |        11 |     1 |
| t1_default                       |        22 |     2 |
| ⑥修改auto_increment列属性        |        34 |     4 |
| ⑥修改auto_increment列属性        |        35 |     5 |
| ⑥修改auto_increment列属性        |        36 |     6 |
| 当前自增值1==>                   |        37 |     7 |
+----------------------------------+-----------+-------+
update t1_default set txt = '⑥修改auto_increment列属性-update操作' where b = 34;
insert into t1_default values(8,null,'当前自增值2==>');
select txt,b incre_col,col_a from t1_default order by b;
+-----------------------------------------------+-----------+-------+
| txt                                           | incre_col | col_a |
+-----------------------------------------------+-----------+-------+
| t1_default                                    |        11 |     1 |
| t1_default                                    |        22 |     2 |
| ⑥修改auto_increment列属性-update操作          |        34 |     4 |
| ⑥修改auto_increment列属性                     |        35 |     5 |
| ⑥修改auto_increment列属性                     |        36 |     6 |
| 当前自增值1==>                                |        37 |     7 |
| 当前自增值2==>                                |        38 |     8 |
+-----------------------------------------------+-----------+-------+
##t2_order
drop table t2_order;
create table t2_order (
  col_a int not null primary key,
  b int default 2,
  txt varchar(64) default 't2_order',
  unique index(b)
) auto_increment_mode = 'order';
insert into t2_order values(1,11,'t2_order'),(2,22,'t2_order'),(3,33,'t2_order');
alter table t2_order modify b int auto_increment;
insert into t2_order values(4,null,'⑥修改auto_increment列属性');
insert into t2_order values(5,null,'⑥修改auto_increment列属性');
insert into t2_order values(6,null,'⑥修改auto_increment列属性');
select txt,b incre_col,col_a from t2_order order by b;
+----------------------------------+-----------+-------+
| txt                              | incre_col | col_a |
+----------------------------------+-----------+-------+
| t2_order                         |        11 |     1 |
| t2_order                         |        22 |     2 |
| t2_order                         |        33 |     3 |
| ⑥修改auto_increment列属性        |        34 |     4 |
| ⑥修改auto_increment列属性        |        35 |     5 |
| ⑥修改auto_increment列属性        |        36 |     6 |
+----------------------------------+-----------+-------+
delete from t2_order where b = 33;
insert into t2_order values(7,null,'当前自增值1==>');
select txt,b incre_col,col_a from t2_order order by b;
+----------------------------------+-----------+-------+
| txt                              | incre_col | col_a |
+----------------------------------+-----------+-------+
| t2_order                         |        11 |     1 |
| t2_order                         |        22 |     2 |
| ⑥修改auto_increment列属性        |        34 |     4 |
| ⑥修改auto_increment列属性        |        35 |     5 |
| ⑥修改auto_increment列属性        |        36 |     6 |
| 当前自增值1==>                   |        37 |     7 |
+----------------------------------+-----------+-------+
update t2_order set txt = '⑥修改auto_increment列属性-update操作' where b = 34;
insert into t2_order values(8,null,'当前自增值2==>');
select txt,b incre_col,col_a from t2_order order by b;
+-----------------------------------------------+-----------+-------+
| txt                                           | incre_col | col_a |
+-----------------------------------------------+-----------+-------+
| t2_order                                      |        11 |     1 |
| t2_order                                      |        22 |     2 |
| ⑥修改auto_increment列属性-update操作          |        34 |     4 |
| ⑥修改auto_increment列属性                     |        35 |     5 |
| ⑥修改auto_increment列属性                     |        36 |     6 |
| 当前自增值1==>                                |        37 |     7 |
| 当前自增值2==>                                |        38 |     8 |
+-----------------------------------------------+-----------+-------+
##t3_noorder
drop table t3_noorder;
create table t3_noorder (
  col_a int not null primary key,
  b int default 3,
  txt varchar(64) default 't3_noorder',
  unique index(col_a)
) auto_increment_mode = 'noorder';
insert into t3_noorder values(1,11,'t3_noorder'),(2,22,'t3_noorder'),(3,33,'t3_noorder');
alter table t3_noorder modify b int auto_increment;
insert into t3_noorder values(4,null,'⑥修改auto_increment列属性');
insert into t3_noorder values(5,null,'⑥修改auto_increment列属性');
insert into t3_noorder values(6,null,'⑥修改auto_increment列属性');
select txt,b incre_col,col_a from t3_noorder order by b;
+----------------------------------+-----------+-------+
| txt                              | incre_col | col_a |
+----------------------------------+-----------+-------+
| t3_noorder                       |        11 |     1 |
| t3_noorder                       |        22 |     2 |
| t3_noorder                       |        33 |     3 |
| ⑥修改auto_increment列属性        |        34 |     4 |
| ⑥修改auto_increment列属性        |        35 |     5 |
| ⑥修改auto_increment列属性        |        36 |     6 |
+----------------------------------+-----------+-------+
delete from t3_noorder where b = 33;
insert into t3_noorder values(7,null,'当前自增值1==>');
select txt,b incre_col,col_a from t3_noorder order by b;
+----------------------------------+-----------+-------+
| txt                              | incre_col | col_a |
+----------------------------------+-----------+-------+
| t3_noorder                       |        11 |     1 |
| t3_noorder                       |        22 |     2 |
| ⑥修改auto_increment列属性        |        34 |     4 |
| ⑥修改auto_increment列属性        |        35 |     5 |
| ⑥修改auto_increment列属性        |        36 |     6 |
| 当前自增值1==>                   |        37 |     7 |
+----------------------------------+-----------+-------+
update t3_noorder set txt = '⑥修改auto_increment列属性-update操作' where b = 34;
insert into t3_noorder values(8,null,'当前自增值2==>');
select txt,b incre_col,col_a from t3_noorder order by b;
+-----------------------------------------------+-----------+-------+
| txt                                           | incre_col | col_a |
+-----------------------------------------------+-----------+-------+
| t3_noorder                                    |        11 |     1 |
| t3_noorder                                    |        22 |     2 |
| ⑥修改auto_increment列属性-update操作          |        34 |     4 |
| ⑥修改auto_increment列属性                     |        35 |     5 |
| ⑥修改auto_increment列属性                     |        36 |     6 |
| 当前自增值1==>                                |        37 |     7 |
| 当前自增值2==>                                |        38 |     8 |
+-----------------------------------------------+-----------+-------+
##⑦修改AUTO_INCREMENT列属性
##t1_default
drop table t1_default;
create table t1_default (
  a int not null auto_increment primary key,
  col_b int default 1,
  txt varchar(64) default 't1_default',
  unique index(col_b)
);
insert into t1_default(a,col_b) values(0,10),(0,20),(0,30);
select txt,a,col_b from t1_default order by a;
+------------+---+-------+
| txt        | a | col_b |
+------------+---+-------+
| t1_default | 1 |    10 |
| t1_default | 2 |    20 |
| t1_default | 3 |    30 |
+------------+---+-------+
alter table t1_default change a col_a int;
alter table t1_default change col_b b int auto_increment;
insert into t1_default values(4,null,'⑥修改auto_increment列属性');
insert into t1_default values(5,null,'⑥修改auto_increment列属性');
insert into t1_default values(6,null,'⑥修改auto_increment列属性');
select txt,b incre_col,col_a from t1_default order by b;
+----------------------------------+-----------+-------+
| txt                              | incre_col | col_a |
+----------------------------------+-----------+-------+
| t1_default                       |        10 |     1 |
| t1_default                       |        20 |     2 |
| t1_default                       |        30 |     3 |
| ⑥修改auto_increment列属性        |        31 |     4 |
| ⑥修改auto_increment列属性        |        32 |     5 |
| ⑥修改auto_increment列属性        |        33 |     6 |
+----------------------------------+-----------+-------+
delete from t1_default where b = 33;
insert into t1_default values(7,null,'当前自增值1==>');
select txt,b incre_col,col_a from t1_default order by b;
+----------------------------------+-----------+-------+
| txt                              | incre_col | col_a |
+----------------------------------+-----------+-------+
| t1_default                       |        10 |     1 |
| t1_default                       |        20 |     2 |
| t1_default                       |        30 |     3 |
| ⑥修改auto_increment列属性        |        31 |     4 |
| ⑥修改auto_increment列属性        |        32 |     5 |
| 当前自增值1==>                   |        34 |     7 |
+----------------------------------+-----------+-------+
update t1_default set txt = '⑥修改auto_increment列属性-update操作' where b = 32;
insert into t1_default values(8,null,'当前自增值2==>');
select txt,b incre_col,col_a from t1_default order by b;
+-----------------------------------------------+-----------+-------+
| txt                                           | incre_col | col_a |
+-----------------------------------------------+-----------+-------+
| t1_default                                    |        10 |     1 |
| t1_default                                    |        20 |     2 |
| t1_default                                    |        30 |     3 |
| ⑥修改auto_increment列属性                     |        31 |     4 |
| ⑥修改auto_increment列属性-update操作          |        32 |     5 |
| 当前自增值1==>                                |        34 |     7 |
| 当前自增值2==>                                |        35 |     8 |
+-----------------------------------------------+-----------+-------+
##t2_order
drop table t2_order;
create table t2_order (
  a int not null auto_increment primary key,
  col_b int default 2,
  txt varchar(64) default 't2_order',
  unique index(col_b)
) auto_increment_mode = 'order';
insert into t2_order(a,col_b) values(0,10),(0,20),(0,30);
select txt,a,col_b from t2_order order by a;
+----------+---+-------+
| txt      | a | col_b |
+----------+---+-------+
| t2_order | 1 |    10 |
| t2_order | 2 |    20 |
| t2_order | 3 |    30 |
+----------+---+-------+
alter table t2_order change a col_a int;
alter table t2_order change col_b b int auto_increment;
insert into t2_order values(4,null,'⑥修改auto_increment列属性');
insert into t2_order values(5,null,'⑥修改auto_increment列属性');
insert into t2_order values(6,null,'⑥修改auto_increment列属性');
select txt,b incre_col,col_a from t2_order order by b;
+----------------------------------+-----------+-------+
| txt                              | incre_col | col_a |
+----------------------------------+-----------+-------+
| t2_order                         |        10 |     1 |
| t2_order                         |        20 |     2 |
| t2_order                         |        30 |     3 |
| ⑥修改auto_increment列属性        |        31 |     4 |
| ⑥修改auto_increment列属性        |        32 |     5 |
| ⑥修改auto_increment列属性        |        33 |     6 |
+----------------------------------+-----------+-------+
delete from t2_order where b = 33;
insert into t2_order values(7,null,'当前自增值1==>');
select txt,b incre_col,col_a from t2_order order by b;
+----------------------------------+-----------+-------+
| txt                              | incre_col | col_a |
+----------------------------------+-----------+-------+
| t2_order                         |        10 |     1 |
| t2_order                         |        20 |     2 |
| t2_order                         |        30 |     3 |
| ⑥修改auto_increment列属性        |        31 |     4 |
| ⑥修改auto_increment列属性        |        32 |     5 |
| 当前自增值1==>                   |        34 |     7 |
+----------------------------------+-----------+-------+
update t2_order set txt = '⑥修改auto_increment列属性-update操作' where b = 32;
insert into t2_order values(8,null,'当前自增值2==>');
select txt,b incre_col,col_a from t2_order order by b;
+-----------------------------------------------+-----------+-------+
| txt                                           | incre_col | col_a |
+-----------------------------------------------+-----------+-------+
| t2_order                                      |        10 |     1 |
| t2_order                                      |        20 |     2 |
| t2_order                                      |        30 |     3 |
| ⑥修改auto_increment列属性                     |        31 |     4 |
| ⑥修改auto_increment列属性-update操作          |        32 |     5 |
| 当前自增值1==>                                |        34 |     7 |
| 当前自增值2==>                                |        35 |     8 |
+-----------------------------------------------+-----------+-------+
##t3_noorder
drop table t3_noorder;
create table t3_noorder (
  a int not null auto_increment primary key,
  col_b int default 3,
  txt varchar(64) default 't3_noorder',
  unique index(col_b)
) auto_increment_mode = 'noorder';
insert into t3_noorder(a,col_b) values(0,10),(0,20),(0,30);
select txt,a,col_b from t3_noorder order by a;
+------------+---+-------+
| txt        | a | col_b |
+------------+---+-------+
| t3_noorder | 1 |    10 |
| t3_noorder | 2 |    20 |
| t3_noorder | 3 |    30 |
+------------+---+-------+
alter table t3_noorder change a col_a int;
alter table t3_noorder change col_b b int auto_increment;
insert into t3_noorder values(4,null,'⑥修改auto_increment列属性');
insert into t3_noorder values(5,null,'⑥修改auto_increment列属性');
insert into t3_noorder values(6,null,'⑥修改auto_increment列属性');
select txt,b incre_col,col_a from t3_noorder order by b;
+----------------------------------+-----------+-------+
| txt                              | incre_col | col_a |
+----------------------------------+-----------+-------+
| t3_noorder                       |        10 |     1 |
| t3_noorder                       |        20 |     2 |
| t3_noorder                       |        30 |     3 |
| ⑥修改auto_increment列属性        |        31 |     4 |
| ⑥修改auto_increment列属性        |        32 |     5 |
| ⑥修改auto_increment列属性        |        33 |     6 |
+----------------------------------+-----------+-------+
delete from t3_noorder where b = 33;
insert into t3_noorder values(7,null,'当前自增值1==>');
select txt,b incre_col,col_a from t3_noorder order by b;
+----------------------------------+-----------+-------+
| txt                              | incre_col | col_a |
+----------------------------------+-----------+-------+
| t3_noorder                       |        10 |     1 |
| t3_noorder                       |        20 |     2 |
| t3_noorder                       |        30 |     3 |
| ⑥修改auto_increment列属性        |        31 |     4 |
| ⑥修改auto_increment列属性        |        32 |     5 |
| 当前自增值1==>                   |        34 |     7 |
+----------------------------------+-----------+-------+
update t3_noorder set txt = '⑥修改auto_increment列属性-update操作' where b = 32;
insert into t3_noorder values(8,null,'当前自增值2==>');
select txt,b incre_col,col_a from t3_noorder order by b;
+-----------------------------------------------+-----------+-------+
| txt                                           | incre_col | col_a |
+-----------------------------------------------+-----------+-------+
| t3_noorder                                    |        10 |     1 |
| t3_noorder                                    |        20 |     2 |
| t3_noorder                                    |        30 |     3 |
| ⑥修改auto_increment列属性                     |        31 |     4 |
| ⑥修改auto_increment列属性-update操作          |        32 |     5 |
| 当前自增值1==>                                |        34 |     7 |
| 当前自增值2==>                                |        35 |     8 |
+-----------------------------------------------+-----------+-------+
############ auto_incre_3-3 PL/SQL操作 ############
###### auto_incre_3-3-1 函数 
##table1_default
drop table table1_default;//
create table table1_default (
  a int not null auto_increment primary key,
  b int default 1,
  txt varchar(64) default 'table1_default',
  unique index(a)
);//
DROP FUNCTION fun1;//
CREATE FUNCTION fun1() RETURNS VARCHAR(100)
BEGIN  
  insert into table1_default values(null,1,'函数 insert1'),(null,2,'函数 insert1'),(null,3,'函数 insert1');
  
  delete from table1_default where b = 2;
  insert into table1_default values(null,11,'delete后当前自增值1==>');

  update table1_default set txt = '函数 update' where b = 3;
  insert into table1_default values(null,11,'update后当前自增值2==>');
  RETURN 'fun1 ok';
END;
//
select txt,a incre_col,b from table1_default order by a;//
+------+-----------+------+
| txt  | incre_col | b    |
+------+-----------+------+
+------+-----------+------+
SELECT fun1();//
+---------+
| fun1()  |
+---------+
| fun1 ok |
+---------+
select txt,a incre_col, b from table1_default order by a;//
+------------------------------+-----------+------+
| txt                          | incre_col | b    |
+------------------------------+-----------+------+
| 函数 insert1                 |         1 |    1 |
| 函数 update                  |         3 |    3 |
| delete后当前自增值1==>       |         4 |   11 |
| update后当前自增值2==>       |         5 |   11 |
+------------------------------+-----------+------+
##table2_order
drop table table2_order;//
create table table2_order (
  a int not null auto_increment primary key,
  b int default 2,
  txt varchar(64) default 'table2_order',
  unique index(a)
) auto_increment_mode = 'order';
//
DROP FUNCTION fun1;//
CREATE FUNCTION fun1() RETURNS VARCHAR(100)
BEGIN  
  insert into table2_order values(null,1,'函数 insert1'),(null,2,'函数 insert1'),(null,3,'函数 insert1');
  
  delete from table2_order where b = 2;
  insert into table2_order values(null,11,'delete后当前自增值1==>');

  update table2_order set txt = '函数 update' where b = 3;
  insert into table2_order values(null,11,'update后当前自增值2==>');
  RETURN 'fun1 ok';
END;
//
select txt,a incre_col,b from table2_order order by a;//
+------+-----------+------+
| txt  | incre_col | b    |
+------+-----------+------+
+------+-----------+------+
SELECT fun1();//
+---------+
| fun1()  |
+---------+
| fun1 ok |
+---------+
select txt,a incre_col, b from table2_order order by a;//
+------------------------------+-----------+------+
| txt                          | incre_col | b    |
+------------------------------+-----------+------+
| 函数 insert1                 |         1 |    1 |
| 函数 update                  |         3 |    3 |
| delete后当前自增值1==>       |         4 |   11 |
| update后当前自增值2==>       |         5 |   11 |
+------------------------------+-----------+------+
##table3_noorder
drop table table3_noorder;//
create table table3_noorder (
  a int not null auto_increment primary key,
  b int default 3,
  txt varchar(64) default 'table3_noorder',
  unique index(a)
) auto_increment_mode = 'noorder';
//
DROP FUNCTION fun1;//
CREATE FUNCTION fun1() RETURNS VARCHAR(100)
BEGIN  
  insert into table3_noorder values(null,1,'函数 insert1'),(null,2,'函数 insert1'),(null,3,'函数 insert1');
  
  delete from table3_noorder where b = 2;
  insert into table3_noorder values(null,11,'delete后当前自增值1==>');

  update table3_noorder set txt = '函数 update' where b = 3;
  insert into table3_noorder values(null,11,'update后当前自增值2==>');
  RETURN 'fun1 ok';
END;
//
select txt,a incre_col,b from table3_noorder order by a;//
+------+-----------+------+
| txt  | incre_col | b    |
+------+-----------+------+
+------+-----------+------+
SELECT fun1();//
+---------+
| fun1()  |
+---------+
| fun1 ok |
+---------+
select txt,a incre_col, b from table3_noorder order by a;//
+------------------------------+-----------+------+
| txt                          | incre_col | b    |
+------------------------------+-----------+------+
| 函数 insert1                 |         1 |    1 |
| 函数 update                  |         3 |    3 |
| delete后当前自增值1==>       |         4 |   11 |
| update后当前自增值2==>       |         5 |   11 |
+------------------------------+-----------+------+
###### auto_incre_3-3-2 触发器 
##table1_default1
drop table table1_default1;//
create table table1_default1 (
  a int not null auto_increment primary key,
  b int default 1,
  txt varchar(64) default 'table1_default1',
  unique index(a)
);//
insert into table1_default1(a) values(0),(0),(0),(0),(0);//
drop table table1_default2;//
create table table1_default2 (
  a int not null auto_increment primary key,
  b int default 1,
  txt varchar(64) default 'table1_default2',
  unique index(a)
);//
drop trigger trg_insert;//
create trigger trg_insert after insert on table1_default2 for each row
begin
  if new.a >2 then
    insert into table1_default1 values(0,new.a,'触发器中insert');
  else
    update table1_default1 set txt = '触发器中update' where a = new.a;
  end if;
end;
//
insert into table1_default2 (a) values(null),(null),(null);//
select txt,a incre_col, b from table1_default1 order by a;//
+--------------------+-----------+------+
| txt                | incre_col | b    |
+--------------------+-----------+------+
| 触发器中update     |         1 |    1 |
| 触发器中update     |         2 |    1 |
| table1_default1    |         3 |    1 |
| table1_default1    |         4 |    1 |
| table1_default1    |         5 |    1 |
| 触发器中insert     |         6 |    3 |
+--------------------+-----------+------+
select txt,a incre_col, b from table1_default2 order by a;//
+-----------------+-----------+------+
| txt             | incre_col | b    |
+-----------------+-----------+------+
| table1_default2 |         1 |    1 |
| table1_default2 |         2 |    1 |
| table1_default2 |         3 |    1 |
+-----------------+-----------+------+
##table2_order
drop table table2_order1;//
create table table2_order1 (
  a int not null auto_increment primary key,
  b int default 2,
  txt varchar(64) default 'table2_order1',
  unique index(a)
) auto_increment_mode = 'order';//
insert into table2_order1(a) values(0),(0),(0),(0),(0);//
drop table table2_order2;//
create table table2_order2 (
  a int not null auto_increment primary key,
  b int default 2,
  txt varchar(64) default 'table2_order2',
  unique index(a)
) auto_increment_mode = 'order';//
drop trigger trg_insert;//
create trigger trg_insert after insert on table2_order2 for each row
begin
  if new.a >2 then
    insert into table2_order1 values(0,new.a,'触发器中insert');
  else
    update table2_order1 set txt = '触发器中update' where a = new.a;
  end if;
end;
//
insert into table2_order2 (a) values(null),(null),(null);//
select txt,a incre_col, b from table2_order1 order by a;//
+--------------------+-----------+------+
| txt                | incre_col | b    |
+--------------------+-----------+------+
| 触发器中update     |         1 |    2 |
| 触发器中update     |         2 |    2 |
| table2_order1      |         3 |    2 |
| table2_order1      |         4 |    2 |
| table2_order1      |         5 |    2 |
| 触发器中insert     |         6 |    3 |
+--------------------+-----------+------+
select txt,a incre_col, b from table2_order2 order by a;//
+---------------+-----------+------+
| txt           | incre_col | b    |
+---------------+-----------+------+
| table2_order2 |         1 |    2 |
| table2_order2 |         2 |    2 |
| table2_order2 |         3 |    2 |
+---------------+-----------+------+
##table3_noorder
drop table table3_noorder1;//
create table table3_noorder1 (
  a int not null auto_increment primary key,
  b int default 3,
  txt varchar(64) default 'table3_noorder1',
  unique index(a)
) auto_increment_mode = 'noorder';//
insert into table3_noorder1(a) values(0),(0),(0),(0),(0);//
drop table table3_noorder2;//
create table table3_noorder2 (
  a int not null auto_increment primary key,
  b int default 3,
  txt varchar(64) default 'table3_noorder2',
  unique index(a)
) auto_increment_mode = 'noorder';//
drop trigger trg_insert;//
create trigger trg_insert after insert on table3_noorder2 for each row
begin
  if new.a >2 then
    insert into table3_noorder1 values(0,new.a,'触发器中insert');
  else
    update table3_noorder1 set txt = '触发器中update' where a = new.a;
  end if;
end;
//
insert into table3_noorder2 (a) values(null),(null),(null);//
select txt,a incre_col, b from table3_noorder1 order by a;//
+--------------------+-----------+------+
| txt                | incre_col | b    |
+--------------------+-----------+------+
| 触发器中update     |         1 |    3 |
| 触发器中update     |         2 |    3 |
| table3_noorder1    |         3 |    3 |
| table3_noorder1    |         4 |    3 |
| table3_noorder1    |         5 |    3 |
| 触发器中insert     |         6 |    3 |
+--------------------+-----------+------+
select txt,a incre_col, b from table3_noorder2 order by a;//
+-----------------+-----------+------+
| txt             | incre_col | b    |
+-----------------+-----------+------+
| table3_noorder2 |         1 |    3 |
| table3_noorder2 |         2 |    3 |
| table3_noorder2 |         3 |    3 |
+-----------------+-----------+------+
###### auto_incre_3-3-3 存储过程 
##table1_default
drop table table1_default;//
create table table1_default (
  a int not null auto_increment primary key,
  b int default 1,
  txt varchar(64) default 'table1_default',
  unique index(a)
);//
DROP PROCEDURE pro1;//
CREATE PROCEDURE pro1()
BEGIN
   insert into table1_default(a,b) values(0,1),(0,1),(0,11),(0,22),(0,1);
   delete from table1_default where b=11;
   update table1_default set txt = '存储过程中update' where b=22;
   insert into table1_default values(0,1,'最新自增值');
END;
//
call pro1()//
select txt,a incre_col, b from table1_default order by a;//
+-----------------------+-----------+------+
| txt                   | incre_col | b    |
+-----------------------+-----------+------+
| table1_default        |         1 |    1 |
| table1_default        |         2 |    1 |
| 存储过程中update      |         4 |   22 |
| table1_default        |         5 |    1 |
| 最新自增值            |         6 |    1 |
+-----------------------+-----------+------+
##table2_order
drop table table2_order;//
create table table2_order (
  a int not null auto_increment primary key,
  b int default 2,
  txt varchar(64) default 'table2_order',
  unique index(a)
) auto_increment_mode = 'order';
//
DROP PROCEDURE pro1;//
CREATE PROCEDURE pro1()
BEGIN
   insert into table2_order(a,b) values(0,1),(0,1),(0,11),(0,22),(0,1);
   delete from table2_order where b=11;
   update table2_order set txt = '存储过程中update' where b=22;
   insert into table2_order values(0,1,'最新自增值');
END;
//
call pro1()//
select txt,a incre_col, b from table2_order order by a;//
+-----------------------+-----------+------+
| txt                   | incre_col | b    |
+-----------------------+-----------+------+
| table2_order          |         1 |    1 |
| table2_order          |         2 |    1 |
| 存储过程中update      |         4 |   22 |
| table2_order          |         5 |    1 |
| 最新自增值            |         6 |    1 |
+-----------------------+-----------+------+
##table3_noorder
drop table table3_noorder;//
create table table3_noorder (
  a int not null auto_increment primary key,
  b int default 3,
  txt varchar(64) default 'table3_noorder',
  unique index(a)
) auto_increment_mode = 'noorder';
//
DROP PROCEDURE pro1;//
CREATE PROCEDURE pro1()
BEGIN
   insert into table3_noorder(a,b) values(0,1),(0,1),(0,11),(0,22),(0,1);
   delete from table3_noorder where b=11;
   update table3_noorder set txt = '存储过程中update' where b=22;
   insert into table3_noorder values(0,1,'最新自增值');
END;
//
call pro1()//
select txt,a incre_col, b from table3_noorder order by a;//
+-----------------------+-----------+------+
| txt                   | incre_col | b    |
+-----------------------+-----------+------+
| table3_noorder        |         1 |    1 |
| table3_noorder        |         2 |    1 |
| 存储过程中update      |         4 |   22 |
| table3_noorder        |         5 |    1 |
| 最新自增值            |         6 |    1 |
+-----------------------+-----------+------+
############ auto_incre_3-4 事务操作 ############
SET @@AUTOCOMMIT=0;
##表
##table1_default
drop table table1_default;
create table table1_default (
  a int not null auto_increment primary key,
  b int default 1,
  txt varchar(64) default 'table1_default',
  unique index(a)
);
insert into table1_default(a) values(0),(0),(0),(0),(0);
select txt,a incre_col, b from table1_default order by a;
+----------------+-----------+------+
| txt            | incre_col | b    |
+----------------+-----------+------+
| table1_default |         1 |    1 |
| table1_default |         2 |    1 |
| table1_default |         3 |    1 |
| table1_default |         4 |    1 |
| table1_default |         5 |    1 |
+----------------+-----------+------+
##table2_order
drop table table2_order;
create table table2_order (
  a int not null auto_increment primary key,
  b int default 2,
  txt varchar(64) default 'table2_order',
  unique index(a)
) auto_increment_mode = 'order';
insert into table2_order(a) values(0),(0),(0),(0),(0);
select txt,a incre_col, b from table2_order order by a;
+--------------+-----------+------+
| txt          | incre_col | b    |
+--------------+-----------+------+
| table2_order |         1 |    2 |
| table2_order |         2 |    2 |
| table2_order |         3 |    2 |
| table2_order |         4 |    2 |
| table2_order |         5 |    2 |
+--------------+-----------+------+
##table3_noorder
drop table table3_noorder;
create table table3_noorder (
  a int not null auto_increment primary key,
  b int default 3,
  txt varchar(64) default 'table3_noorder',
  unique index(a)
) auto_increment_mode = 'noorder';
insert into table3_noorder(a) values(0),(0),(0),(0),(0);
select txt,a incre_col, b from table3_noorder order by a;
+----------------+-----------+------+
| txt            | incre_col | b    |
+----------------+-----------+------+
| table3_noorder |         1 |    3 |
| table3_noorder |         2 |    3 |
| table3_noorder |         3 |    3 |
| table3_noorder |         4 |    3 |
| table3_noorder |         5 |    3 |
+----------------+-----------+------+
###### 给AUTO_INCREMENT列插入值后回滚，再查看最新自增值
begin;
insert into table1_default values(0,11,'插入数据'),(0,11,'插入数据'),(0,11,'插入数据');
rollback;
insert into table1_default values(0,11,'当前自增值==>');
select txt,a incre_col, b from table1_default order by a;
+--------------------+-----------+------+
| txt                | incre_col | b    |
+--------------------+-----------+------+
| table1_default     |         1 |    1 |
| table1_default     |         2 |    1 |
| table1_default     |         3 |    1 |
| table1_default     |         4 |    1 |
| table1_default     |         5 |    1 |
| 当前自增值==>      |         9 |   11 |
+--------------------+-----------+------+
begin;
insert into table2_order values(0,11,'插入数据'),(0,11,'插入数据'),(0,11,'插入数据');
rollback;
insert into table2_order values(0,11,'当前自增值==>');
select txt,a incre_col, b from table2_order order by a;
+--------------------+-----------+------+
| txt                | incre_col | b    |
+--------------------+-----------+------+
| table2_order       |         1 |    2 |
| table2_order       |         2 |    2 |
| table2_order       |         3 |    2 |
| table2_order       |         4 |    2 |
| table2_order       |         5 |    2 |
| 当前自增值==>      |         9 |   11 |
+--------------------+-----------+------+
begin;
insert into table3_noorder values(0,11,'插入数据'),(0,11,'插入数据'),(0,11,'插入数据');
rollback;
insert into table3_noorder values(0,11,'当前自增值==>');
select txt,a incre_col, b from table3_noorder order by a;
+--------------------+-----------+------+
| txt                | incre_col | b    |
+--------------------+-----------+------+
| table3_noorder     |         1 |    3 |
| table3_noorder     |         2 |    3 |
| table3_noorder     |         3 |    3 |
| table3_noorder     |         4 |    3 |
| table3_noorder     |         5 |    3 |
| 当前自增值==>      |         9 |   11 |
+--------------------+-----------+------+
###### 给AUTO_INCREMENT列删除后回滚，再查看最新自增值
##table1_default
insert into table1_default values(0,11,'删除对象1'),(0,11,'删除对象2');
select txt,a incre_col, b from table1_default order by a;
+--------------------+-----------+------+
| txt                | incre_col | b    |
+--------------------+-----------+------+
| table1_default     |         1 |    1 |
| table1_default     |         2 |    1 |
| table1_default     |         3 |    1 |
| table1_default     |         4 |    1 |
| table1_default     |         5 |    1 |
| 当前自增值==>      |         9 |   11 |
| 删除对象1          |        10 |   11 |
| 删除对象2          |        11 |   11 |
+--------------------+-----------+------+
begin;
delete from table1_default where b = 11;
rollback;
insert into table1_default values(0,11,'当前自增值==>');
select txt,a incre_col, b from table1_default order by a;
+--------------------+-----------+------+
| txt                | incre_col | b    |
+--------------------+-----------+------+
| table1_default     |         1 |    1 |
| table1_default     |         2 |    1 |
| table1_default     |         3 |    1 |
| table1_default     |         4 |    1 |
| table1_default     |         5 |    1 |
| 当前自增值==>      |         9 |   11 |
| 删除对象1          |        10 |   11 |
| 删除对象2          |        11 |   11 |
| 当前自增值==>      |        12 |   11 |
+--------------------+-----------+------+
select txt,a incre_col, b from table1_default order by a;
+--------------------+-----------+------+
| txt                | incre_col | b    |
+--------------------+-----------+------+
| table1_default     |         1 |    1 |
| table1_default     |         2 |    1 |
| table1_default     |         3 |    1 |
| table1_default     |         4 |    1 |
| table1_default     |         5 |    1 |
| 当前自增值==>      |         9 |   11 |
| 删除对象1          |        10 |   11 |
| 删除对象2          |        11 |   11 |
| 当前自增值==>      |        12 |   11 |
+--------------------+-----------+------+
begin;
truncate table table1_default;
rollback;
insert into table1_default values(0,11,'当前自增值==>');
select txt,a incre_col, b from table1_default order by a;
+--------------------+-----------+------+
| txt                | incre_col | b    |
+--------------------+-----------+------+
| 当前自增值==>      |         1 |   11 |
+--------------------+-----------+------+
##table2_order
insert into table2_order values(0,22,'删除对象');
select txt,a incre_col, b from table2_order order by a;
+--------------------+-----------+------+
| txt                | incre_col | b    |
+--------------------+-----------+------+
| table2_order       |         1 |    2 |
| table2_order       |         2 |    2 |
| table2_order       |         3 |    2 |
| table2_order       |         4 |    2 |
| table2_order       |         5 |    2 |
| 当前自增值==>      |         9 |   11 |
| 删除对象           |        10 |   22 |
+--------------------+-----------+------+
begin;
delete from table2_order where b = 22;
rollback;
insert into table2_order values(0,22,'当前自增值==>');
select txt,a incre_col, b from table2_order order by a;
+--------------------+-----------+------+
| txt                | incre_col | b    |
+--------------------+-----------+------+
| table2_order       |         1 |    2 |
| table2_order       |         2 |    2 |
| table2_order       |         3 |    2 |
| table2_order       |         4 |    2 |
| table2_order       |         5 |    2 |
| 当前自增值==>      |         9 |   11 |
| 删除对象           |        10 |   22 |
| 当前自增值==>      |        11 |   22 |
+--------------------+-----------+------+
insert into table2_order values(0,22,'删除对象');
select txt,a incre_col, b from table2_order order by a;
+--------------------+-----------+------+
| txt                | incre_col | b    |
+--------------------+-----------+------+
| table2_order       |         1 |    2 |
| table2_order       |         2 |    2 |
| table2_order       |         3 |    2 |
| table2_order       |         4 |    2 |
| table2_order       |         5 |    2 |
| 当前自增值==>      |         9 |   11 |
| 删除对象           |        10 |   22 |
| 当前自增值==>      |        11 |   22 |
| 删除对象           |        12 |   22 |
+--------------------+-----------+------+
begin;
truncate table table2_order;
rollback;
insert into table2_order values(0,22,'当前自增值==>');
select txt,a incre_col, b from table2_order order by a;
+--------------------+-----------+------+
| txt                | incre_col | b    |
+--------------------+-----------+------+
| 当前自增值==>      |         1 |   22 |
+--------------------+-----------+------+
##table3_noorder
insert into table3_noorder values(0,33,'删除对象');
select txt,a incre_col, b from table3_noorder order by a;
+--------------------+-----------+------+
| txt                | incre_col | b    |
+--------------------+-----------+------+
| table3_noorder     |         1 |    3 |
| table3_noorder     |         2 |    3 |
| table3_noorder     |         3 |    3 |
| table3_noorder     |         4 |    3 |
| table3_noorder     |         5 |    3 |
| 当前自增值==>      |         9 |   11 |
| 删除对象           |        10 |   33 |
+--------------------+-----------+------+
begin;
delete from table3_noorder where b = 33;
rollback;
insert into table3_noorder values(0,33,'当前自增值==>');
select txt,a incre_col, b from table3_noorder order by a;
+--------------------+-----------+------+
| txt                | incre_col | b    |
+--------------------+-----------+------+
| table3_noorder     |         1 |    3 |
| table3_noorder     |         2 |    3 |
| table3_noorder     |         3 |    3 |
| table3_noorder     |         4 |    3 |
| table3_noorder     |         5 |    3 |
| 当前自增值==>      |         9 |   11 |
| 删除对象           |        10 |   33 |
| 当前自增值==>      |        11 |   33 |
+--------------------+-----------+------+
insert into table3_noorder values(0,33,'删除对象');
select txt,a incre_col, b from table3_noorder order by a;
+--------------------+-----------+------+
| txt                | incre_col | b    |
+--------------------+-----------+------+
| table3_noorder     |         1 |    3 |
| table3_noorder     |         2 |    3 |
| table3_noorder     |         3 |    3 |
| table3_noorder     |         4 |    3 |
| table3_noorder     |         5 |    3 |
| 当前自增值==>      |         9 |   11 |
| 删除对象           |        10 |   33 |
| 当前自增值==>      |        11 |   33 |
| 删除对象           |        12 |   33 |
+--------------------+-----------+------+
begin;
truncate table table3_noorder;
rollback;
insert into table3_noorder values(0,33,'当前自增值==>');
select txt,a incre_col, b from table3_noorder order by a;
+--------------------+-----------+------+
| txt                | incre_col | b    |
+--------------------+-----------+------+
| 当前自增值==>      |         1 |   33 |
+--------------------+-----------+------+
###### 修改AUTO_INCREMENT列初始值后回滚，再查看最新自增值
begin;
alter table table1_default AUTO_INCREMENT = 100;
rollback;
insert into table1_default values(0,11,'当前自增值==>');
select txt,a incre_col, b from table1_default order by a;
+--------------------+-----------+------+
| txt                | incre_col | b    |
+--------------------+-----------+------+
| 当前自增值==>      |         1 |   11 |
| 当前自增值==>      |       100 |   11 |
+--------------------+-----------+------+
begin;
alter table table2_order AUTO_INCREMENT = 100;
rollback;
insert into table2_order values(0,22,'当前自增值==>');
select txt,a incre_col, b from table2_order order by a;
+--------------------+-----------+------+
| txt                | incre_col | b    |
+--------------------+-----------+------+
| 当前自增值==>      |         1 |   22 |
| 当前自增值==>      |       100 |   22 |
+--------------------+-----------+------+
begin;
alter table table3_noorder AUTO_INCREMENT = 100;
rollback;
insert into table3_noorder values(0,33,'当前自增值==>');
select txt,a incre_col, b from table3_noorder order by a;
+--------------------+-----------+------+
| txt                | incre_col | b    |
+--------------------+-----------+------+
| 当前自增值==>      |         1 |   33 |
| 当前自增值==>      |       100 |   33 |
+--------------------+-----------+------+
###### 修改AUTO_INCREMENT自增列模式后回滚，再查看最新自增值
begin;
alter table table1_default auto_increment_mode = 'NOORDER';
rollback;
insert into table1_default values(0,11,'当前自增值==>');
select txt,a incre_col, b from table1_default order by a;
+--------------------+-----------+------+
| txt                | incre_col | b    |
+--------------------+-----------+------+
| 当前自增值==>      |         1 |   11 |
| 当前自增值==>      |       100 |   11 |
| 当前自增值==>      |   1000001 |   11 |
+--------------------+-----------+------+
begin;
alter table table2_order auto_increment_mode = 'NOORDER';
rollback;
insert into table2_order values(0,22,'当前自增值==>');
select txt,a incre_col, b from table2_order order by a;
+--------------------+-----------+------+
| txt                | incre_col | b    |
+--------------------+-----------+------+
| 当前自增值==>      |         1 |   22 |
| 当前自增值==>      |       100 |   22 |
| 当前自增值==>      |   1000001 |   22 |
+--------------------+-----------+------+
begin;
alter table table3_noorder auto_increment_mode = 'ORDER';
rollback;
insert into table3_noorder values(0,33,'当前自增值==>');
select txt,a incre_col, b from table3_noorder order by a;
+--------------------+-----------+------+
| txt                | incre_col | b    |
+--------------------+-----------+------+
| 当前自增值==>      |         1 |   33 |
| 当前自增值==>      |       100 |   33 |
| 当前自增值==>      |   1000100 |   33 |
+--------------------+-----------+------+
###### 设置SAVEPOINT，给AUTO_INCREMENT列插入值后再回滚
##table1_default
drop table table1_default;
create table table1_default (
  a int not null auto_increment primary key,
  b int default 1,
  txt varchar(64) default 'table1_default',
  unique index(a)
);
insert into table1_default(a) values(0),(0),(0),(0),(0);
select txt,a incre_col, b from table1_default order by a;
+----------------+-----------+------+
| txt            | incre_col | b    |
+----------------+-----------+------+
| table1_default |         1 |    1 |
| table1_default |         2 |    1 |
| table1_default |         3 |    1 |
| table1_default |         4 |    1 |
| table1_default |         5 |    1 |
+----------------+-----------+------+
begin;
savepoint s1;
insert into table1_default values(null,100,'s1'),(null,101,'s1'),(null,102,'s1'),(null,103,'s1');
savepoint s2;
insert into table1_default values(null,104,'s2'),(null,105,'s2');
rollback to s2;
select txt,a incre_col, b from table1_default order by a;
+----------------+-----------+------+
| txt            | incre_col | b    |
+----------------+-----------+------+
| table1_default |         1 |    1 |
| table1_default |         2 |    1 |
| table1_default |         3 |    1 |
| table1_default |         4 |    1 |
| table1_default |         5 |    1 |
| s1             |         6 |  100 |
| s1             |         7 |  101 |
| s1             |         8 |  102 |
| s1             |         9 |  103 |
+----------------+-----------+------+
commit;
begin;
savepoint s11;
insert into table1_default values(null,110,'s11'),(null,111,'s11'),(null,112,'s11'),(null,113,'s11');
savepoint s22;
insert into table1_default values(null,114,'s22'),(null,115,'s22');
rollback to s11;
select txt,a incre_col, b from table1_default order by a;
+----------------+-----------+------+
| txt            | incre_col | b    |
+----------------+-----------+------+
| table1_default |         1 |    1 |
| table1_default |         2 |    1 |
| table1_default |         3 |    1 |
| table1_default |         4 |    1 |
| table1_default |         5 |    1 |
| s1             |         6 |  100 |
| s1             |         7 |  101 |
| s1             |         8 |  102 |
| s1             |         9 |  103 |
+----------------+-----------+------+
commit;
insert into table1_default values(0,11,'当前自增值==>');
select txt,a incre_col, b from table1_default order by a;
+--------------------+-----------+------+
| txt                | incre_col | b    |
+--------------------+-----------+------+
| table1_default     |         1 |    1 |
| table1_default     |         2 |    1 |
| table1_default     |         3 |    1 |
| table1_default     |         4 |    1 |
| table1_default     |         5 |    1 |
| s1                 |         6 |  100 |
| s1                 |         7 |  101 |
| s1                 |         8 |  102 |
| s1                 |         9 |  103 |
| 当前自增值==>      |        18 |   11 |
+--------------------+-----------+------+
##table2_order
drop table table2_order;
create table table2_order (
  a int not null auto_increment primary key,
  b int default 2,
  txt varchar(64) default 'table2_order',
  unique index(a)
) auto_increment_mode = 'order';
insert into table2_order(a) values(0),(0),(0),(0),(0);
select txt,a incre_col, b from table2_order order by a;
+--------------+-----------+------+
| txt          | incre_col | b    |
+--------------+-----------+------+
| table2_order |         1 |    2 |
| table2_order |         2 |    2 |
| table2_order |         3 |    2 |
| table2_order |         4 |    2 |
| table2_order |         5 |    2 |
+--------------+-----------+------+
begin;
savepoint s1;
insert into table2_order values(null,100,'s1'),(null,101,'s1'),(null,102,'s1'),(null,103,'s1');
savepoint s2;
insert into table2_order values(null,104,'s2'),(null,105,'s2');
rollback to s2;
select txt,a incre_col, b from table2_order order by a;
+--------------+-----------+------+
| txt          | incre_col | b    |
+--------------+-----------+------+
| table2_order |         1 |    2 |
| table2_order |         2 |    2 |
| table2_order |         3 |    2 |
| table2_order |         4 |    2 |
| table2_order |         5 |    2 |
| s1           |         6 |  100 |
| s1           |         7 |  101 |
| s1           |         8 |  102 |
| s1           |         9 |  103 |
+--------------+-----------+------+
commit;
begin;
savepoint s11;
insert into table2_order values(null,110,'s11'),(null,111,'s11'),(null,112,'s11'),(null,113,'s11');
savepoint s22;
insert into table2_order values(null,114,'s22'),(null,115,'s22');
rollback to s11;
select txt,a incre_col, b from table2_order order by a;
+--------------+-----------+------+
| txt          | incre_col | b    |
+--------------+-----------+------+
| table2_order |         1 |    2 |
| table2_order |         2 |    2 |
| table2_order |         3 |    2 |
| table2_order |         4 |    2 |
| table2_order |         5 |    2 |
| s1           |         6 |  100 |
| s1           |         7 |  101 |
| s1           |         8 |  102 |
| s1           |         9 |  103 |
+--------------+-----------+------+
commit;
insert into table2_order values(0,11,'当前自增值==>');
select txt,a incre_col, b from table2_order order by a;
+--------------------+-----------+------+
| txt                | incre_col | b    |
+--------------------+-----------+------+
| table2_order       |         1 |    2 |
| table2_order       |         2 |    2 |
| table2_order       |         3 |    2 |
| table2_order       |         4 |    2 |
| table2_order       |         5 |    2 |
| s1                 |         6 |  100 |
| s1                 |         7 |  101 |
| s1                 |         8 |  102 |
| s1                 |         9 |  103 |
| 当前自增值==>      |        18 |   11 |
+--------------------+-----------+------+
##table3_noorder
drop table table3_noorder;
create table table3_noorder (
  a int not null auto_increment primary key,
  b int default 3,
  txt varchar(64) default 'table3_noorder',
  unique index(a)
) auto_increment_mode = 'noorder';
insert into table3_noorder(a) values(0),(0),(0),(0),(0);
select txt,a incre_col, b from table3_noorder order by a;
+----------------+-----------+------+
| txt            | incre_col | b    |
+----------------+-----------+------+
| table3_noorder |         1 |    3 |
| table3_noorder |         2 |    3 |
| table3_noorder |         3 |    3 |
| table3_noorder |         4 |    3 |
| table3_noorder |         5 |    3 |
+----------------+-----------+------+
begin;
savepoint s1;
insert into table3_noorder values(null,100,'s1'),(null,101,'s1'),(null,102,'s1'),(null,103,'s1');
savepoint s2;
insert into table3_noorder values(null,104,'s2'),(null,105,'s2');
rollback to s2;
select txt,a incre_col, b from table3_noorder order by a;
+----------------+-----------+------+
| txt            | incre_col | b    |
+----------------+-----------+------+
| table3_noorder |         1 |    3 |
| table3_noorder |         2 |    3 |
| table3_noorder |         3 |    3 |
| table3_noorder |         4 |    3 |
| table3_noorder |         5 |    3 |
| s1             |         6 |  100 |
| s1             |         7 |  101 |
| s1             |         8 |  102 |
| s1             |         9 |  103 |
+----------------+-----------+------+
commit;
begin;
savepoint s11;
insert into table3_noorder values(null,110,'s11'),(null,111,'s11'),(null,112,'s11'),(null,113,'s11');
savepoint s22;
insert into table3_noorder values(null,114,'s22'),(null,115,'s22');
rollback to s11;
select txt,a incre_col, b from table3_noorder order by a;
+----------------+-----------+------+
| txt            | incre_col | b    |
+----------------+-----------+------+
| table3_noorder |         1 |    3 |
| table3_noorder |         2 |    3 |
| table3_noorder |         3 |    3 |
| table3_noorder |         4 |    3 |
| table3_noorder |         5 |    3 |
| s1             |         6 |  100 |
| s1             |         7 |  101 |
| s1             |         8 |  102 |
| s1             |         9 |  103 |
+----------------+-----------+------+
commit;
insert into table3_noorder values(0,11,'当前自增值==>');
select txt,a incre_col, b from table3_noorder order by a;
+--------------------+-----------+------+
| txt                | incre_col | b    |
+--------------------+-----------+------+
| table3_noorder     |         1 |    3 |
| table3_noorder     |         2 |    3 |
| table3_noorder     |         3 |    3 |
| table3_noorder     |         4 |    3 |
| table3_noorder     |         5 |    3 |
| s1                 |         6 |  100 |
| s1                 |         7 |  101 |
| s1                 |         8 |  102 |
| s1                 |         9 |  103 |
| 当前自增值==>      |        18 |   11 |
+--------------------+-----------+------+
SET @@AUTOCOMMIT=1;
############ auto_incre_3-5 其他场景测试 ############
###### 数据库连接中断，重新连接，查看AUTO_INCREMENT列自增值
##table1_default
drop table table1_default;
create table table1_default (
  a int not null auto_increment primary key,
  b int default 1,
  txt varchar(64) default 'table1_default',
  unique index(a)
);
insert into table1_default(a) values(0),(0),(0),(0),(0);
insert into table1_default values(0,1,'数据库中断前自增值==>');
select txt,a incre_col, b from table1_default order by a;
+--------------------------------+-----------+------+
| txt                            | incre_col | b    |
+--------------------------------+-----------+------+
| table1_default                 |         1 |    1 |
| table1_default                 |         2 |    1 |
| table1_default                 |         3 |    1 |
| table1_default                 |         4 |    1 |
| table1_default                 |         5 |    1 |
| 数据库中断前自增值==>          |         6 |    1 |
+--------------------------------+-----------+------+
##table2_order
drop table table2_order;
create table table2_order (
  a int not null auto_increment primary key,
  b int default 2,
  txt varchar(64) default 'table2_order',
  unique index(a)
) auto_increment_mode = 'order';
insert into table2_order(a) values(0),(0),(0),(0),(0);
insert into table2_order values(0,1,'数据库中断前自增值==>');
select txt,a incre_col, b from table2_order order by a;
+--------------------------------+-----------+------+
| txt                            | incre_col | b    |
+--------------------------------+-----------+------+
| table2_order                   |         1 |    2 |
| table2_order                   |         2 |    2 |
| table2_order                   |         3 |    2 |
| table2_order                   |         4 |    2 |
| table2_order                   |         5 |    2 |
| 数据库中断前自增值==>          |         6 |    1 |
+--------------------------------+-----------+------+
##table3_noorder
drop table table3_noorder;
create table table3_noorder (
  a int not null auto_increment primary key,
  b int default 3,
  txt varchar(64) default 'table3_noorder',
  unique index(a)
) auto_increment_mode = 'noorder';
insert into table3_noorder(a) values(0),(0),(0),(0),(0);
insert into table3_noorder values(0,1,'数据库中断前自增值==>');
select txt,a incre_col, b from table3_noorder order by a;
+--------------------------------+-----------+------+
| txt                            | incre_col | b    |
+--------------------------------+-----------+------+
| table3_noorder                 |         1 |    3 |
| table3_noorder                 |         2 |    3 |
| table3_noorder                 |         3 |    3 |
| table3_noorder                 |         4 |    3 |
| table3_noorder                 |         5 |    3 |
| 数据库中断前自增值==>          |         6 |    1 |
+--------------------------------+-----------+------+
##重启数据库
insert into table1_default values(0,1,'数据库中断后自增值==>');
select txt,a incre_col, b from table1_default order by a;
+--------------------------------+-----------+------+
| txt                            | incre_col | b    |
+--------------------------------+-----------+------+
| table1_default                 |         1 |    1 |
| table1_default                 |         2 |    1 |
| table1_default                 |         3 |    1 |
| table1_default                 |         4 |    1 |
| table1_default                 |         5 |    1 |
| 数据库中断前自增值==>          |         6 |    1 |
| 数据库中断后自增值==>          |         7 |    1 |
+--------------------------------+-----------+------+
insert into table2_order values(0,1,'数据库中断后自增值==>');
select txt,a incre_col, b from table2_order order by a;
+--------------------------------+-----------+------+
| txt                            | incre_col | b    |
+--------------------------------+-----------+------+
| table2_order                   |         1 |    2 |
| table2_order                   |         2 |    2 |
| table2_order                   |         3 |    2 |
| table2_order                   |         4 |    2 |
| table2_order                   |         5 |    2 |
| 数据库中断前自增值==>          |         6 |    1 |
| 数据库中断后自增值==>          |         7 |    1 |
+--------------------------------+-----------+------+
insert into table3_noorder values(0,1,'数据库中断后自增值==>');
select txt,a incre_col, b from table3_noorder order by a;
+--------------------------------+-----------+------+
| txt                            | incre_col | b    |
+--------------------------------+-----------+------+
| table3_noorder                 |         1 |    3 |
| table3_noorder                 |         2 |    3 |
| table3_noorder                 |         3 |    3 |
| table3_noorder                 |         4 |    3 |
| table3_noorder                 |         5 |    3 |
| 数据库中断前自增值==>          |         6 |    1 |
| 数据库中断后自增值==>          |         7 |    1 |
+--------------------------------+-----------+------+
###### 通过SET auto_increment_increment=x 修改步长，查看不同增长模式的自增值
SET auto_increment_increment=3;
select txt,a incre_col, b from table1_default order by a;
+--------------------------------+-----------+------+
| txt                            | incre_col | b    |
+--------------------------------+-----------+------+
| table1_default                 |         1 |    1 |
| table1_default                 |         2 |    1 |
| table1_default                 |         3 |    1 |
| table1_default                 |         4 |    1 |
| table1_default                 |         5 |    1 |
| 数据库中断前自增值==>          |         6 |    1 |
| 数据库中断后自增值==>          |         7 |    1 |
+--------------------------------+-----------+------+
insert into table1_default values(0,1,'修改步长后'),(0,1,'修改步长后'),(0,1,'修改步长后');
select txt,a incre_col, b from table1_default order by a;
+--------------------------------+-----------+------+
| txt                            | incre_col | b    |
+--------------------------------+-----------+------+
| table1_default                 |         1 |    1 |
| table1_default                 |         2 |    1 |
| table1_default                 |         3 |    1 |
| table1_default                 |         4 |    1 |
| table1_default                 |         5 |    1 |
| 数据库中断前自增值==>          |         6 |    1 |
| 数据库中断后自增值==>          |         7 |    1 |
| 修改步长后                     |        10 |    1 |
| 修改步长后                     |        13 |    1 |
| 修改步长后                     |        16 |    1 |
+--------------------------------+-----------+------+
select txt,a incre_col, b from table2_order order by a;
+--------------------------------+-----------+------+
| txt                            | incre_col | b    |
+--------------------------------+-----------+------+
| table2_order                   |         1 |    2 |
| table2_order                   |         2 |    2 |
| table2_order                   |         3 |    2 |
| table2_order                   |         4 |    2 |
| table2_order                   |         5 |    2 |
| 数据库中断前自增值==>          |         6 |    1 |
| 数据库中断后自增值==>          |         7 |    1 |
+--------------------------------+-----------+------+
insert into table2_order values(0,1,'修改步长后'),(0,1,'修改步长后'),(0,1,'修改步长后');
select txt,a incre_col, b from table2_order order by a;
+--------------------------------+-----------+------+
| txt                            | incre_col | b    |
+--------------------------------+-----------+------+
| table2_order                   |         1 |    2 |
| table2_order                   |         2 |    2 |
| table2_order                   |         3 |    2 |
| table2_order                   |         4 |    2 |
| table2_order                   |         5 |    2 |
| 数据库中断前自增值==>          |         6 |    1 |
| 数据库中断后自增值==>          |         7 |    1 |
| 修改步长后                     |        10 |    1 |
| 修改步长后                     |        13 |    1 |
| 修改步长后                     |        16 |    1 |
+--------------------------------+-----------+------+
select txt,a incre_col, b from table3_noorder order by a;
+--------------------------------+-----------+------+
| txt                            | incre_col | b    |
+--------------------------------+-----------+------+
| table3_noorder                 |         1 |    3 |
| table3_noorder                 |         2 |    3 |
| table3_noorder                 |         3 |    3 |
| table3_noorder                 |         4 |    3 |
| table3_noorder                 |         5 |    3 |
| 数据库中断前自增值==>          |         6 |    1 |
| 数据库中断后自增值==>          |         7 |    1 |
+--------------------------------+-----------+------+
insert into table3_noorder values(0,1,'修改步长后'),(0,1,'修改步长后'),(0,1,'修改步长后');
select txt,a incre_col, b from table3_noorder order by a;
+--------------------------------+-----------+------+
| txt                            | incre_col | b    |
+--------------------------------+-----------+------+
| table3_noorder                 |         1 |    3 |
| table3_noorder                 |         2 |    3 |
| table3_noorder                 |         3 |    3 |
| table3_noorder                 |         4 |    3 |
| table3_noorder                 |         5 |    3 |
| 数据库中断前自增值==>          |         6 |    1 |
| 数据库中断后自增值==>          |         7 |    1 |
| 修改步长后                     |        10 |    1 |
| 修改步长后                     |        13 |    1 |
| 修改步长后                     |        16 |    1 |
+--------------------------------+-----------+------+
############ auto_incre_2-4 ④模式切换 ############
##建表
###### INT 类型，索引 - 唯一索引
set auto_increment_increment=1;
alter system set default_auto_increment_mode = 'order';
drop table table1_default;
create table table1_default (
  a int not null auto_increment,
  b int default 1,
  txt varchar(64) default 'table1_default',
  index(a)
);
## ORDER
insert into table1_default(a) values(0),(0),(0),(0),(0);
select txt,a incre_col, b from table1_default order by a;
+----------------+-----------+------+
| txt            | incre_col | b    |
+----------------+-----------+------+
| table1_default |         1 |    1 |
| table1_default |         2 |    1 |
| table1_default |         3 |    1 |
| table1_default |         4 |    1 |
| table1_default |         5 |    1 |
+----------------+-----------+------+
insert into table1_default values(0,11,'update test');
update table1_default set a = 0 where b = 11;
insert into table1_default values(null,11,'当前自增值1==>');
select txt,a incre_col, b from table1_default order by a;
+---------------------+-----------+------+
| txt                 | incre_col | b    |
+---------------------+-----------+------+
| update test         |         0 |   11 |
| table1_default      |         1 |    1 |
| table1_default      |         2 |    1 |
| table1_default      |         3 |    1 |
| table1_default      |         4 |    1 |
| table1_default      |         5 |    1 |
| 当前自增值1==>      |         7 |   11 |
+---------------------+-----------+------+
## ORDER==>ORDER
alter table table1_default auto_increment_mode = 'ORDER';
insert into table1_default values(0,2,'ORDER==>ORDER'),(0,2,'ORDER==>ORDER'),(0,2,'ORDER==>ORDER'),(0,2,'ORDER==>ORDER');
select txt,a incre_col, b from table1_default order by a;
+---------------------+-----------+------+
| txt                 | incre_col | b    |
+---------------------+-----------+------+
| update test         |         0 |   11 |
| table1_default      |         1 |    1 |
| table1_default      |         2 |    1 |
| table1_default      |         3 |    1 |
| table1_default      |         4 |    1 |
| table1_default      |         5 |    1 |
| 当前自增值1==>      |         7 |   11 |
| ORDER==>ORDER       |         8 |    2 |
| ORDER==>ORDER       |         9 |    2 |
| ORDER==>ORDER       |        10 |    2 |
| ORDER==>ORDER       |        11 |    2 |
+---------------------+-----------+------+
insert into table1_default values(0,22,'update test');
update table1_default set a = 0 where b = 22;
insert into table1_default values(null,22,'当前自增值1==>');
select txt,a incre_col, b from table1_default order by a;
+---------------------+-----------+------+
| txt                 | incre_col | b    |
+---------------------+-----------+------+
| update test         |         0 |   11 |
| update test         |         0 |   22 |
| table1_default      |         1 |    1 |
| table1_default      |         2 |    1 |
| table1_default      |         3 |    1 |
| table1_default      |         4 |    1 |
| table1_default      |         5 |    1 |
| 当前自增值1==>      |         7 |   11 |
| ORDER==>ORDER       |         8 |    2 |
| ORDER==>ORDER       |         9 |    2 |
| ORDER==>ORDER       |        10 |    2 |
| ORDER==>ORDER       |        11 |    2 |
| 当前自增值1==>      |        13 |   22 |
+---------------------+-----------+------+
## ORDER==>NOORDER
alter table table1_default auto_increment_mode = 'NOORDER';
insert into table1_default values(0,3,'ORDER==>NOORDER'),(0,3,'ORDER==>NOORDER'),(0,3,'ORDER==>NOORDER'),(0,3,'ORDER==>NOORDER');
select txt,a incre_col, b from table1_default order by a;
+---------------------+-----------+------+
| txt                 | incre_col | b    |
+---------------------+-----------+------+
| update test         |         0 |   22 |
| update test         |         0 |   11 |
| table1_default      |         1 |    1 |
| table1_default      |         2 |    1 |
| table1_default      |         3 |    1 |
| table1_default      |         4 |    1 |
| table1_default      |         5 |    1 |
| 当前自增值1==>      |         7 |   11 |
| ORDER==>ORDER       |         8 |    2 |
| ORDER==>ORDER       |         9 |    2 |
| ORDER==>ORDER       |        10 |    2 |
| ORDER==>ORDER       |        11 |    2 |
| 当前自增值1==>      |        13 |   22 |
| ORDER==>NOORDER     |   1000001 |    3 |
| ORDER==>NOORDER     |   1000002 |    3 |
| ORDER==>NOORDER     |   1000003 |    3 |
| ORDER==>NOORDER     |   1000004 |    3 |
+---------------------+-----------+------+
insert into table1_default values(0,33,'update test');
update table1_default set a = 0 where b = 33;
insert into table1_default values(null,33,'当前自增值1==>');
select txt,a incre_col, b from table1_default order by a;
+---------------------+-----------+------+
| txt                 | incre_col | b    |
+---------------------+-----------+------+
| update test         |         0 |   33 |
| update test         |         0 |   11 |
| update test         |         0 |   22 |
| table1_default      |         1 |    1 |
| table1_default      |         2 |    1 |
| table1_default      |         3 |    1 |
| table1_default      |         4 |    1 |
| table1_default      |         5 |    1 |
| 当前自增值1==>      |         7 |   11 |
| ORDER==>ORDER       |         8 |    2 |
| ORDER==>ORDER       |         9 |    2 |
| ORDER==>ORDER       |        10 |    2 |
| ORDER==>ORDER       |        11 |    2 |
| 当前自增值1==>      |        13 |   22 |
| ORDER==>NOORDER     |   1000001 |    3 |
| ORDER==>NOORDER     |   1000002 |    3 |
| ORDER==>NOORDER     |   1000003 |    3 |
| ORDER==>NOORDER     |   1000004 |    3 |
| 当前自增值1==>      |   1000006 |   33 |
+---------------------+-----------+------+
## NOORDER==>NOORDER
alter table table1_default auto_increment_mode = 'NOORDER';
insert into table1_default values(0,4,'NOORDER==>NOORDER'),(0,4,'NOORDER==>NOORDER'),(0,4,'NOORDER==>NOORDER'),(0,4,'NOORDER==>NOORDER');
select txt,a incre_col, b from table1_default order by a;
+---------------------+-----------+------+
| txt                 | incre_col | b    |
+---------------------+-----------+------+
| update test         |         0 |   33 |
| update test         |         0 |   11 |
| update test         |         0 |   22 |
| table1_default      |         1 |    1 |
| table1_default      |         2 |    1 |
| table1_default      |         3 |    1 |
| table1_default      |         4 |    1 |
| table1_default      |         5 |    1 |
| 当前自增值1==>      |         7 |   11 |
| ORDER==>ORDER       |         8 |    2 |
| ORDER==>ORDER       |         9 |    2 |
| ORDER==>ORDER       |        10 |    2 |
| ORDER==>ORDER       |        11 |    2 |
| 当前自增值1==>      |        13 |   22 |
| ORDER==>NOORDER     |   1000001 |    3 |
| ORDER==>NOORDER     |   1000002 |    3 |
| ORDER==>NOORDER     |   1000003 |    3 |
| ORDER==>NOORDER     |   1000004 |    3 |
| 当前自增值1==>      |   1000006 |   33 |
| NOORDER==>NOORDER   |   1000007 |    4 |
| NOORDER==>NOORDER   |   1000008 |    4 |
| NOORDER==>NOORDER   |   1000009 |    4 |
| NOORDER==>NOORDER   |   1000010 |    4 |
+---------------------+-----------+------+
insert into table1_default values(0,44,'update test');
update table1_default set a = 0 where b = 44;
insert into table1_default values(null,44,'当前自增值1==>');
select txt,a incre_col, b from table1_default order by a;
+---------------------+-----------+------+
| txt                 | incre_col | b    |
+---------------------+-----------+------+
| update test         |         0 |   33 |
| update test         |         0 |   11 |
| update test         |         0 |   22 |
| update test         |         0 |   44 |
| table1_default      |         1 |    1 |
| table1_default      |         2 |    1 |
| table1_default      |         3 |    1 |
| table1_default      |         4 |    1 |
| table1_default      |         5 |    1 |
| 当前自增值1==>      |         7 |   11 |
| ORDER==>ORDER       |         8 |    2 |
| ORDER==>ORDER       |         9 |    2 |
| ORDER==>ORDER       |        10 |    2 |
| ORDER==>ORDER       |        11 |    2 |
| 当前自增值1==>      |        13 |   22 |
| ORDER==>NOORDER     |   1000001 |    3 |
| ORDER==>NOORDER     |   1000002 |    3 |
| ORDER==>NOORDER     |   1000003 |    3 |
| ORDER==>NOORDER     |   1000004 |    3 |
| 当前自增值1==>      |   1000006 |   33 |
| NOORDER==>NOORDER   |   1000007 |    4 |
| NOORDER==>NOORDER   |   1000008 |    4 |
| NOORDER==>NOORDER   |   1000009 |    4 |
| NOORDER==>NOORDER   |   1000010 |    4 |
| 当前自增值1==>      |   1000012 |   44 |
+---------------------+-----------+------+
## NOORDER==>ORDER
alter table table1_default auto_increment_mode = 'ORDER';
insert into table1_default values(0,5,'NOORDER==>ORDER'),(0,5,'NOORDER==>ORDER'),(0,5,'NOORDER==>ORDER'),(0,5,'NOORDER==>ORDER');
select txt,a incre_col, b from table1_default order by a;
+---------------------+-----------+------+
| txt                 | incre_col | b    |
+---------------------+-----------+------+
| update test         |         0 |   33 |
| update test         |         0 |   11 |
| update test         |         0 |   22 |
| update test         |         0 |   44 |
| table1_default      |         1 |    1 |
| table1_default      |         2 |    1 |
| table1_default      |         3 |    1 |
| table1_default      |         4 |    1 |
| table1_default      |         5 |    1 |
| 当前自增值1==>      |         7 |   11 |
| ORDER==>ORDER       |         8 |    2 |
| ORDER==>ORDER       |         9 |    2 |
| ORDER==>ORDER       |        10 |    2 |
| ORDER==>ORDER       |        11 |    2 |
| 当前自增值1==>      |        13 |   22 |
| ORDER==>NOORDER     |   1000001 |    3 |
| ORDER==>NOORDER     |   1000002 |    3 |
| ORDER==>NOORDER     |   1000003 |    3 |
| ORDER==>NOORDER     |   1000004 |    3 |
| 当前自增值1==>      |   1000006 |   33 |
| NOORDER==>NOORDER   |   1000007 |    4 |
| NOORDER==>NOORDER   |   1000008 |    4 |
| NOORDER==>NOORDER   |   1000009 |    4 |
| NOORDER==>NOORDER   |   1000010 |    4 |
| 当前自增值1==>      |   1000012 |   44 |
| NOORDER==>ORDER     |   2000001 |    5 |
| NOORDER==>ORDER     |   2000002 |    5 |
| NOORDER==>ORDER     |   2000003 |    5 |
| NOORDER==>ORDER     |   2000004 |    5 |
+---------------------+-----------+------+
insert into table1_default values(0,6,'NOORDER==>ORDER test');
select txt,a incre_col, b from table1_default order by a;
+----------------------+-----------+------+
| txt                  | incre_col | b    |
+----------------------+-----------+------+
| update test          |         0 |   33 |
| update test          |         0 |   11 |
| update test          |         0 |   22 |
| update test          |         0 |   44 |
| table1_default       |         1 |    1 |
| table1_default       |         2 |    1 |
| table1_default       |         3 |    1 |
| table1_default       |         4 |    1 |
| table1_default       |         5 |    1 |
| 当前自增值1==>       |         7 |   11 |
| ORDER==>ORDER        |         8 |    2 |
| ORDER==>ORDER        |         9 |    2 |
| ORDER==>ORDER        |        10 |    2 |
| ORDER==>ORDER        |        11 |    2 |
| 当前自增值1==>       |        13 |   22 |
| ORDER==>NOORDER      |   1000001 |    3 |
| ORDER==>NOORDER      |   1000002 |    3 |
| ORDER==>NOORDER      |   1000003 |    3 |
| ORDER==>NOORDER      |   1000004 |    3 |
| 当前自增值1==>       |   1000006 |   33 |
| NOORDER==>NOORDER    |   1000007 |    4 |
| NOORDER==>NOORDER    |   1000008 |    4 |
| NOORDER==>NOORDER    |   1000009 |    4 |
| NOORDER==>NOORDER    |   1000010 |    4 |
| 当前自增值1==>       |   1000012 |   44 |
| NOORDER==>ORDER      |   2000001 |    5 |
| NOORDER==>ORDER      |   2000002 |    5 |
| NOORDER==>ORDER      |   2000003 |    5 |
| NOORDER==>ORDER      |   2000004 |    5 |
| NOORDER==>ORDER test |   2000005 |    6 |
+----------------------+-----------+------+
update table1_default set a = 10 where b = 6;
insert into table1_default values(null,55,'当前自增值1==>');
select txt,a incre_col, b from table1_default order by a;
+----------------------+-----------+------+
| txt                  | incre_col | b    |
+----------------------+-----------+------+
| update test          |         0 |   22 |
| update test          |         0 |   11 |
| update test          |         0 |   44 |
| update test          |         0 |   33 |
| table1_default       |         1 |    1 |
| table1_default       |         2 |    1 |
| table1_default       |         3 |    1 |
| table1_default       |         4 |    1 |
| table1_default       |         5 |    1 |
| 当前自增值1==>       |         7 |   11 |
| ORDER==>ORDER        |         8 |    2 |
| ORDER==>ORDER        |         9 |    2 |
| NOORDER==>ORDER test |        10 |    6 |
| ORDER==>ORDER        |        10 |    2 |
| ORDER==>ORDER        |        11 |    2 |
| 当前自增值1==>       |        13 |   22 |
| ORDER==>NOORDER      |   1000001 |    3 |
| ORDER==>NOORDER      |   1000002 |    3 |
| ORDER==>NOORDER      |   1000003 |    3 |
| ORDER==>NOORDER      |   1000004 |    3 |
| 当前自增值1==>       |   1000006 |   33 |
| NOORDER==>NOORDER    |   1000007 |    4 |
| NOORDER==>NOORDER    |   1000008 |    4 |
| NOORDER==>NOORDER    |   1000009 |    4 |
| NOORDER==>NOORDER    |   1000010 |    4 |
| 当前自增值1==>       |   1000012 |   44 |
| NOORDER==>ORDER      |   2000001 |    5 |
| NOORDER==>ORDER      |   2000002 |    5 |
| NOORDER==>ORDER      |   2000003 |    5 |
| NOORDER==>ORDER      |   2000004 |    5 |
| 当前自增值1==>       |   2000006 |   55 |
+----------------------+-----------+------+
drop table table1_default;
drop table table2_order;
drop table table3_noorder;
drop table table0_date;
# Clean up users
drop user whh@'%';
drop database if exists whh ;
