purge recyclebin;
result_format: 4
drop user whh@'%';
drop database if exists whh ;
create user whh identified by 'whh';
create database whh ;
grant all on *.* to whh with grant option;


##测试每种场合时，起始条件可能不同，可以删除再重新创建表
set sql_mode='strict_all_tables,no_zero_in_date';
alter system set default_auto_increment_mode = 'noorder';
##########################################################################################################################
###### 标签：auto_incre_1-1，auto_incre_1-2，auto_incre_2-1，auto_incre_2-2，auto_incre_2-3，auto_incre_3-1
###### 功能：数据类型（SMALLINT、MEDIUMINT、FLOAT、DOUBLE、DECIMAL/NUMERIC），普通表，自增模式，DML操作 
########################################################################################################################## 
############ auto_incre_1-1-1
############ 数据类型（SMALLINT 类型）
##建表
drop table table0_date;
create table table0_date (
  a smallint,
  b smallint default 0,
  txt varchar(64) default 'table0_date'
);
insert into table0_date(a) values(100),(101),(102),(103),(104),(105);
drop table table1_default;
create table table1_default (
  a smallint auto_increment,
  b smallint default 1,
  txt varchar(64) default 'table1_default',
  index (a)
);
drop table table2_order;
create table table2_order (
  a smallint auto_increment,
  b smallint default 2,
  txt varchar(64) default 'table2_order',
  index (a)
) auto_increment_mode = 'order';
drop table table3_noorder;
create table table3_noorder (
  a smallint auto_increment,
  b smallint default 3,
  txt varchar(64) default 'table3_noorder',
  index (a)
) auto_increment_mode = 'noorder';
############ auto_incre_3-1 DML操作 ############
###### auto_incre_3-1-1 ①INSERT操作 
##简单插入
##INSERT 语句
##table1_default
insert into table1_default(a) values(null);
select txt,a incre_col,b from table1_default order by a;
+----------------+-----------+------+
| txt            | incre_col | b    |
+----------------+-----------+------+
| table1_default |         1 |    1 |
+----------------+-----------+------+
alter table table1_default AUTO_INCREMENT = 32767;
insert into table1_default(a) values(null);
insert into table1_default(a) values(null),(null);
select txt,a incre_col,b from table1_default order by a;
+----------------+-----------+------+
| txt            | incre_col | b    |
+----------------+-----------+------+
| table1_default |         1 |    1 |
| table1_default |     32767 |    1 |
| table1_default |     32767 |    1 |
| table1_default |     32767 |    1 |
+----------------+-----------+------+
insert into table1_default(a) values(10);
insert into table1_default(a,txt) values(0,'最新自增值=>');
select txt,a incre_col,b from table1_default order by a;
+-------------------+-----------+------+
| txt               | incre_col | b    |
+-------------------+-----------+------+
| table1_default    |         1 |    1 |
| table1_default    |        10 |    1 |
| table1_default    |     32767 |    1 |
| table1_default    |     32767 |    1 |
| table1_default    |     32767 |    1 |
| 最新自增值=>      |     32767 |    1 |
+-------------------+-----------+------+
##table2_order
insert into table2_order(a) values(null);
select txt,a incre_col,b from table2_order order by a;
+--------------+-----------+------+
| txt          | incre_col | b    |
+--------------+-----------+------+
| table2_order |         1 |    2 |
+--------------+-----------+------+
alter table table2_order AUTO_INCREMENT = 32767;
insert into table2_order(a) values(null),(null),(null),(null);
select txt,a incre_col,b from table2_order order by a;
+--------------+-----------+------+
| txt          | incre_col | b    |
+--------------+-----------+------+
| table2_order |         1 |    2 |
| table2_order |     32767 |    2 |
| table2_order |     32767 |    2 |
| table2_order |     32767 |    2 |
| table2_order |     32767 |    2 |
+--------------+-----------+------+
insert into table2_order(a) values(10);
insert into table2_order(a,txt) values(0,'最新自增值=>');
select txt,a incre_col,b from table2_order order by a;
+-------------------+-----------+------+
| txt               | incre_col | b    |
+-------------------+-----------+------+
| table2_order      |         1 |    2 |
| table2_order      |        10 |    2 |
| table2_order      |     32767 |    2 |
| table2_order      |     32767 |    2 |
| table2_order      |     32767 |    2 |
| table2_order      |     32767 |    2 |
| 最新自增值=>      |     32767 |    2 |
+-------------------+-----------+------+
##table3_noorder
insert into table3_noorder(a) values(null);
select txt,a incre_col,b from table3_noorder order by a;
+----------------+-----------+------+
| txt            | incre_col | b    |
+----------------+-----------+------+
| table3_noorder |         1 |    3 |
+----------------+-----------+------+
alter table table3_noorder AUTO_INCREMENT = 32767;
insert into table3_noorder(a) values(null),(null),(null),(null);
select txt,a incre_col,b from table3_noorder order by a;
+----------------+-----------+------+
| txt            | incre_col | b    |
+----------------+-----------+------+
| table3_noorder |         1 |    3 |
| table3_noorder |     32767 |    3 |
| table3_noorder |     32767 |    3 |
| table3_noorder |     32767 |    3 |
| table3_noorder |     32767 |    3 |
+----------------+-----------+------+
insert into table3_noorder(a) values(10);
insert into table3_noorder(a,txt) values(0,'最新自增值=>');
select txt,a incre_col,b from table3_noorder order by a;
+-------------------+-----------+------+
| txt               | incre_col | b    |
+-------------------+-----------+------+
| table3_noorder    |         1 |    3 |
| table3_noorder    |        10 |    3 |
| table3_noorder    |     32767 |    3 |
| table3_noorder    |     32767 |    3 |
| table3_noorder    |     32767 |    3 |
| table3_noorder    |     32767 |    3 |
| 最新自增值=>      |     32767 |    3 |
+-------------------+-----------+------+
##REPLACE 语句
replace into table1_default(a) values(0),(0),(0);
select txt,a incre_col,b from table1_default order by a;
+-------------------+-----------+------+
| txt               | incre_col | b    |
+-------------------+-----------+------+
| table1_default    |         1 |    1 |
| table1_default    |        10 |    1 |
| table1_default    |     32767 |    1 |
| table1_default    |     32767 |    1 |
| table1_default    |     32767 |    1 |
| 最新自增值=>      |     32767 |    1 |
| table1_default    |     32767 |    1 |
| table1_default    |     32767 |    1 |
| table1_default    |     32767 |    1 |
+-------------------+-----------+------+
replace into table1_default values(5,22,'replace');
insert into table1_default(a,txt) values(0,'最新自增值=>');
select txt,a incre_col,b from table1_default order by a;
+-------------------+-----------+------+
| txt               | incre_col | b    |
+-------------------+-----------+------+
| table1_default    |         1 |    1 |
| replace           |         5 |   22 |
| table1_default    |        10 |    1 |
| table1_default    |     32767 |    1 |
| table1_default    |     32767 |    1 |
| table1_default    |     32767 |    1 |
| 最新自增值=>      |     32767 |    1 |
| table1_default    |     32767 |    1 |
| table1_default    |     32767 |    1 |
| table1_default    |     32767 |    1 |
| 最新自增值=>      |     32767 |    1 |
+-------------------+-----------+------+
replace into table2_order(a) values(0),(0),(0);
select txt,a incre_col,b from table2_order order by a;
+-------------------+-----------+------+
| txt               | incre_col | b    |
+-------------------+-----------+------+
| table2_order      |         1 |    2 |
| table2_order      |        10 |    2 |
| table2_order      |     32767 |    2 |
| table2_order      |     32767 |    2 |
| table2_order      |     32767 |    2 |
| table2_order      |     32767 |    2 |
| 最新自增值=>      |     32767 |    2 |
| table2_order      |     32767 |    2 |
| table2_order      |     32767 |    2 |
| table2_order      |     32767 |    2 |
+-------------------+-----------+------+
replace into table2_order values(5,22,'replace');
insert into table2_order(a,txt) values(0,'最新自增值=>');
select txt,a incre_col,b from table2_order order by a;
+-------------------+-----------+------+
| txt               | incre_col | b    |
+-------------------+-----------+------+
| table2_order      |         1 |    2 |
| replace           |         5 |   22 |
| table2_order      |        10 |    2 |
| table2_order      |     32767 |    2 |
| table2_order      |     32767 |    2 |
| table2_order      |     32767 |    2 |
| table2_order      |     32767 |    2 |
| 最新自增值=>      |     32767 |    2 |
| table2_order      |     32767 |    2 |
| table2_order      |     32767 |    2 |
| table2_order      |     32767 |    2 |
| 最新自增值=>      |     32767 |    2 |
+-------------------+-----------+------+
replace into table3_noorder(a) values(null),(null),(null);
select txt,a incre_col,b from table3_noorder order by a;
+-------------------+-----------+------+
| txt               | incre_col | b    |
+-------------------+-----------+------+
| table3_noorder    |         1 |    3 |
| table3_noorder    |        10 |    3 |
| table3_noorder    |     32767 |    3 |
| table3_noorder    |     32767 |    3 |
| table3_noorder    |     32767 |    3 |
| table3_noorder    |     32767 |    3 |
| 最新自增值=>      |     32767 |    3 |
| table3_noorder    |     32767 |    3 |
| table3_noorder    |     32767 |    3 |
| table3_noorder    |     32767 |    3 |
+-------------------+-----------+------+
replace into table3_noorder values(5,22,'replace');
insert into table3_noorder(a,txt) values(0,'最新自增值=>');
select txt,a incre_col,b from table3_noorder order by a;
+-------------------+-----------+------+
| txt               | incre_col | b    |
+-------------------+-----------+------+
| table3_noorder    |         1 |    3 |
| replace           |         5 |   22 |
| table3_noorder    |        10 |    3 |
| table3_noorder    |     32767 |    3 |
| table3_noorder    |     32767 |    3 |
| table3_noorder    |     32767 |    3 |
| table3_noorder    |     32767 |    3 |
| 最新自增值=>      |     32767 |    3 |
| table3_noorder    |     32767 |    3 |
| table3_noorder    |     32767 |    3 |
| table3_noorder    |     32767 |    3 |
| 最新自增值=>      |     32767 |    3 |
+-------------------+-----------+------+
insert into table3_noorder(a) values(null),(null),(null);
select txt,a incre_col,b from table3_noorder order by a;
+-------------------+-----------+------+
| txt               | incre_col | b    |
+-------------------+-----------+------+
| table3_noorder    |         1 |    3 |
| replace           |         5 |   22 |
| table3_noorder    |        10 |    3 |
| table3_noorder    |     32767 |    3 |
| table3_noorder    |     32767 |    3 |
| table3_noorder    |     32767 |    3 |
| table3_noorder    |     32767 |    3 |
| 最新自增值=>      |     32767 |    3 |
| table3_noorder    |     32767 |    3 |
| table3_noorder    |     32767 |    3 |
| table3_noorder    |     32767 |    3 |
| 最新自增值=>      |     32767 |    3 |
| table3_noorder    |     32767 |    3 |
| table3_noorder    |     32767 |    3 |
| table3_noorder    |     32767 |    3 |
+-------------------+-----------+------+
##批量插入
##INSERT ... SELECT语句
truncate table table1_default;
insert into table1_default select a,b,txt from table0_date where a <= 102;
select txt,a incre_col,b from table1_default order by a;
+-------------+-----------+------+
| txt         | incre_col | b    |
+-------------+-----------+------+
| table0_date |       100 |    0 |
| table0_date |       101 |    0 |
| table0_date |       102 |    0 |
+-------------+-----------+------+
insert into table1_default(a,txt) values(0,'最新自增值=>');
select txt,a incre_col,b from table1_default order by a;
+-------------------+-----------+------+
| txt               | incre_col | b    |
+-------------------+-----------+------+
| table0_date       |       100 |    0 |
| table0_date       |       101 |    0 |
| table0_date       |       102 |    0 |
| 最新自增值=>      |     32767 |    1 |
+-------------------+-----------+------+
truncate table table2_order;
insert into table2_order select a,b,txt from table0_date where a <= 102;
select txt,a incre_col,b from table2_order order by a;
+-------------+-----------+------+
| txt         | incre_col | b    |
+-------------+-----------+------+
| table0_date |       100 |    0 |
| table0_date |       101 |    0 |
| table0_date |       102 |    0 |
+-------------+-----------+------+
insert into table2_order(a,txt) values(0,'最新自增值=>');
select txt,a incre_col,b from table2_order order by a;
+-------------------+-----------+------+
| txt               | incre_col | b    |
+-------------------+-----------+------+
| table0_date       |       100 |    0 |
| table0_date       |       101 |    0 |
| table0_date       |       102 |    0 |
| 最新自增值=>      |       103 |    2 |
+-------------------+-----------+------+
truncate table table3_noorder;
insert into table3_noorder select a,b,txt from table0_date where a <= 102;
select txt,a incre_col,b from table3_noorder order by a;
+-------------+-----------+------+
| txt         | incre_col | b    |
+-------------+-----------+------+
| table0_date |       100 |    0 |
| table0_date |       101 |    0 |
| table0_date |       102 |    0 |
+-------------+-----------+------+
insert into table3_noorder(a,txt) values(0,'最新自增值=>');
select txt,a incre_col,b from table3_noorder order by a;
+-------------------+-----------+------+
| txt               | incre_col | b    |
+-------------------+-----------+------+
| table0_date       |       100 |    0 |
| table0_date       |       101 |    0 |
| table0_date       |       102 |    0 |
| 最新自增值=>      |     32767 |    3 |
+-------------------+-----------+------+
##REPLACE ... SELECT语句
truncate table table1_default;
replace into table1_default select a,b,txt from table0_date where a >= 102;
select txt,a incre_col,b from table1_default order by a;
+-------------+-----------+------+
| txt         | incre_col | b    |
+-------------+-----------+------+
| table0_date |       102 |    0 |
| table0_date |       103 |    0 |
| table0_date |       104 |    0 |
| table0_date |       105 |    0 |
+-------------+-----------+------+
insert into table1_default(a,txt) values(0,'最新自增值=>');
select txt,a incre_col,b from table1_default order by a;
+-------------------+-----------+------+
| txt               | incre_col | b    |
+-------------------+-----------+------+
| table0_date       |       102 |    0 |
| table0_date       |       103 |    0 |
| table0_date       |       104 |    0 |
| table0_date       |       105 |    0 |
| 最新自增值=>      |     32767 |    1 |
+-------------------+-----------+------+
truncate table table2_order;
replace into table2_order select a,b,txt from table0_date where a >= 102;
select txt,a incre_col,b from table2_order order by a;
+-------------+-----------+------+
| txt         | incre_col | b    |
+-------------+-----------+------+
| table0_date |       102 |    0 |
| table0_date |       103 |    0 |
| table0_date |       104 |    0 |
| table0_date |       105 |    0 |
+-------------+-----------+------+
insert into table2_order(a,txt) values(0,'最新自增值=>');
select txt,a incre_col,b from table2_order order by a;
+-------------------+-----------+------+
| txt               | incre_col | b    |
+-------------------+-----------+------+
| table0_date       |       102 |    0 |
| table0_date       |       103 |    0 |
| table0_date       |       104 |    0 |
| table0_date       |       105 |    0 |
| 最新自增值=>      |       106 |    2 |
+-------------------+-----------+------+
truncate table table3_noorder;
replace into table3_noorder select a,b,txt from table0_date where a >= 102;
select txt,a incre_col,b from table3_noorder order by a;
+-------------+-----------+------+
| txt         | incre_col | b    |
+-------------+-----------+------+
| table0_date |       102 |    0 |
| table0_date |       103 |    0 |
| table0_date |       104 |    0 |
| table0_date |       105 |    0 |
+-------------+-----------+------+
insert into table3_noorder(a,txt) values(0,'最新自增值=>');
select txt,a incre_col,b from table3_noorder order by a;
+-------------------+-----------+------+
| txt               | incre_col | b    |
+-------------------+-----------+------+
| table0_date       |       102 |    0 |
| table0_date       |       103 |    0 |
| table0_date       |       104 |    0 |
| table0_date       |       105 |    0 |
| 最新自增值=>      |     32767 |    3 |
+-------------------+-----------+------+
##混合插入
##INSERT ... ON DUPLICATE KEY UPDATE 语句
truncate table table1_default;
insert into table1_default (a,b,txt) values (1,1,'重复场合') on duplicate key update b=b+1,txt='insert...on duplicate key update 语句';
insert into table1_default(a,txt) values(0,'最新自增值=>');
select txt,a incre_col,b from table1_default order by a;
+-------------------+-----------+------+
| txt               | incre_col | b    |
+-------------------+-----------+------+
| 重复场合          |         1 |    1 |
| 最新自增值=>      |     32767 |    1 |
+-------------------+-----------+------+
insert into table1_default (a,b,txt) values (50,1,'不重复场合') on duplicate key update b=b+1,txt='insert...on duplicate key update 语句';
insert into table1_default(a,txt) values(0,'最新自增值=>');
select txt,a incre_col,b from table1_default order by a;
+-------------------+-----------+------+
| txt               | incre_col | b    |
+-------------------+-----------+------+
| 重复场合          |         1 |    1 |
| 不重复场合        |        50 |    1 |
| 最新自增值=>      |     32767 |    1 |
| 最新自增值=>      |     32767 |    1 |
+-------------------+-----------+------+
truncate table table2_order;
insert into table2_order (a,b,txt) values (1,2,'重复场合') on duplicate key update b=b+1,txt='insert...on duplicate key update 语句';
insert into table2_order(a,txt) values(0,'最新自增值=>');
select txt,a incre_col,b from table2_order order by a;
+-------------------+-----------+------+
| txt               | incre_col | b    |
+-------------------+-----------+------+
| 重复场合          |         1 |    2 |
| 最新自增值=>      |         2 |    2 |
+-------------------+-----------+------+
insert into table2_order (a,b,txt) values (50,2,'不重复场合') on duplicate key update b=b+1,txt='insert...on duplicate key update 语句';
insert into table2_order(a,txt) values(0,'最新自增值=>');
select txt,a incre_col,b from table2_order order by a;
+-------------------+-----------+------+
| txt               | incre_col | b    |
+-------------------+-----------+------+
| 重复场合          |         1 |    2 |
| 最新自增值=>      |         2 |    2 |
| 不重复场合        |        50 |    2 |
| 最新自增值=>      |        51 |    2 |
+-------------------+-----------+------+
truncate table table3_noorder;
insert into table3_noorder (a,b,txt) values (1,3,'重复场合') on duplicate key update b=b+1,txt='insert...on duplicate key update 语句';
insert into table3_noorder(a,txt) values(0,'最新自增值=>');
select txt,a incre_col,b from table3_noorder order by a;
+-------------------+-----------+------+
| txt               | incre_col | b    |
+-------------------+-----------+------+
| 重复场合          |         1 |    3 |
| 最新自增值=>      |     32767 |    3 |
+-------------------+-----------+------+
insert into table3_noorder (a,b,txt) values (50,3,'不重复场合') on duplicate key update b=b+1,txt='insert...on duplicate key update 语句';
select txt,a incre_col,b from table3_noorder order by a;
+-------------------+-----------+------+
| txt               | incre_col | b    |
+-------------------+-----------+------+
| 重复场合          |         1 |    3 |
| 不重复场合        |        50 |    3 |
| 最新自增值=>      |     32767 |    3 |
+-------------------+-----------+------+
##将NULL和任何其他值混合插入 AUTO_INCREMENT列
##INSERT 语句
truncate table table1_default;
insert into table1_default(a) values(null),(10),(null),(20);
insert into table1_default(a,txt) values(0,'最新自增值1=>');
select txt,a incre_col,b from table1_default order by a;
+--------------------+-----------+------+
| txt                | incre_col | b    |
+--------------------+-----------+------+
| table1_default     |         1 |    1 |
| table1_default     |        10 |    1 |
| table1_default     |        20 |    1 |
| table1_default     |     32767 |    1 |
| 最新自增值1=>      |     32767 |    1 |
+--------------------+-----------+------+
truncate table table2_order;
insert into table2_order(a) values(null),(10),(null),(20);
insert into table2_order(a,txt) values(0,'最新自增值=>');
select txt,a incre_col,b from table2_order order by a;
+-------------------+-----------+------+
| txt               | incre_col | b    |
+-------------------+-----------+------+
| table2_order      |         1 |    2 |
| table2_order      |        10 |    2 |
| table2_order      |        11 |    2 |
| table2_order      |        20 |    2 |
| 最新自增值=>      |        21 |    2 |
+-------------------+-----------+------+
truncate table table3_noorder;
insert into table3_noorder(a) values(null),(10),(null),(20);
select txt,a incre_col,b from table3_noorder order by a;
+----------------+-----------+------+
| txt            | incre_col | b    |
+----------------+-----------+------+
| table3_noorder |         1 |    3 |
| table3_noorder |        10 |    3 |
| table3_noorder |        20 |    3 |
| table3_noorder |     32767 |    3 |
+----------------+-----------+------+
###### auto_incre_3-1-2 ②DELETE操作
truncate table table1_default;
insert into table1_default(a,b) values(null,11),(null,11);
select txt,a incre_col,b from table1_default order by a;
+----------------+-----------+------+
| txt            | incre_col | b    |
+----------------+-----------+------+
| table1_default |         1 |   11 |
| table1_default |         2 |   11 |
+----------------+-----------+------+
delete from table1_default where b=11;
insert into table1_default(a,txt) values(0,'最新自增值=>');
select txt,a incre_col,b from table1_default order by a;
+-------------------+-----------+------+
| txt               | incre_col | b    |
+-------------------+-----------+------+
| 最新自增值=>      |         3 |    1 |
+-------------------+-----------+------+
truncate table table2_order;
insert into table2_order(a,b) values(null,22),(null,22);
select txt,a incre_col,b from table2_order order by a;
+--------------+-----------+------+
| txt          | incre_col | b    |
+--------------+-----------+------+
| table2_order |         1 |   22 |
| table2_order |         2 |   22 |
+--------------+-----------+------+
delete from table2_order where b=22;
insert into table2_order(a,txt) values(0,'最新自增值=>');
select txt,a incre_col,b from table2_order order by a;
+-------------------+-----------+------+
| txt               | incre_col | b    |
+-------------------+-----------+------+
| 最新自增值=>      |         3 |    2 |
+-------------------+-----------+------+
truncate table table3_noorder;
insert into table3_noorder(a,b) values(null,33),(null,33);
select txt,a incre_col,b from table3_noorder order by a;
+----------------+-----------+------+
| txt            | incre_col | b    |
+----------------+-----------+------+
| table3_noorder |         1 |   33 |
| table3_noorder |         2 |   33 |
+----------------+-----------+------+
delete from table3_noorder where b=33;
insert into table3_noorder(a,txt) values(0,'最新自增值=>');
select txt,a incre_col,b from table3_noorder order by a;
+-------------------+-----------+------+
| txt               | incre_col | b    |
+-------------------+-----------+------+
| 最新自增值=>      |         3 |    3 |
+-------------------+-----------+------+
###### auto_incre_3-1-3 ③UPDATE操作
# mysql 5.x update没有推高这个自增值，和我们现在是兼容的；8.x update会推高
##更新现有AUTO_INCREMENT列值
truncate table table1_default;
insert into table1_default(a,b) values(null,111);
select txt,a incre_col,b from table1_default order by a;
+----------------+-----------+------+
| txt            | incre_col | b    |
+----------------+-----------+------+
| table1_default |         1 |  111 |
+----------------+-----------+------+
update table1_default set a = 0,txt = '将AUTO_INCREMENT列值设置为小于/等于当前最大自增值的值' where b = 111;
insert into table1_default values(null,11,'1当前自增值=>');
select txt,a incre_col,b from table1_default order by a;
+--------------------------------------------------------------------------+-----------+------+
| txt                                                                      | incre_col | b    |
+--------------------------------------------------------------------------+-----------+------+
| 将AUTO_INCREMENT列值设置为小于/等于当前最大自增值的值                    |         0 |  111 |
| 1当前自增值=>                                                            |         2 |   11 |
+--------------------------------------------------------------------------+-----------+------+
update table1_default set a = 1000 ,txt = '将AUTO_INCREMENT列值设置为大于当前最大自增值的值' where b = 111;
insert into table1_default values(null,11,'2当前自增值=>');
select txt,a incre_col,b from table1_default order by a;
+-------------------------------------------------------------------+-----------+------+
| txt                                                               | incre_col | b    |
+-------------------------------------------------------------------+-----------+------+
| 1当前自增值=>                                                     |         2 |   11 |
| 2当前自增值=>                                                     |         3 |   11 |
| 将AUTO_INCREMENT列值设置为大于当前最大自增值的值                  |      1000 |  111 |
+-------------------------------------------------------------------+-----------+------+
##table2_order
truncate table table2_order;
insert into table2_order(a,b) values(null,222);
select txt,a incre_col,b from table2_order order by a;
+--------------+-----------+------+
| txt          | incre_col | b    |
+--------------+-----------+------+
| table2_order |         1 |  222 |
+--------------+-----------+------+
update table2_order set a = 0,txt = '将AUTO_INCREMENT列值设置为小于/等于当前最大自增值的值' where b = 222;
insert into table2_order values(null,22,'1当前自增值=>');
select txt,a incre_col,b from table2_order order by a;
+--------------------------------------------------------------------------+-----------+------+
| txt                                                                      | incre_col | b    |
+--------------------------------------------------------------------------+-----------+------+
| 将AUTO_INCREMENT列值设置为小于/等于当前最大自增值的值                    |         0 |  222 |
| 1当前自增值=>                                                            |         2 |   22 |
+--------------------------------------------------------------------------+-----------+------+
update table2_order set a = 20 ,txt = '将AUTO_INCREMENT列值设置为大于当前最大自增值的值' where b = 222;
insert into table2_order values(null,22,'2当前自增值=>');
select txt,a incre_col,b from table2_order order by a;
+-------------------------------------------------------------------+-----------+------+
| txt                                                               | incre_col | b    |
+-------------------------------------------------------------------+-----------+------+
| 1当前自增值=>                                                     |         2 |   22 |
| 2当前自增值=>                                                     |         3 |   22 |
| 将AUTO_INCREMENT列值设置为大于当前最大自增值的值                  |        20 |  222 |
+-------------------------------------------------------------------+-----------+------+
##table3_noorder
truncate table table3_noorder;
insert into table3_noorder(a,b) values(null,333);
select txt,a incre_col,b from table3_noorder order by a;
+----------------+-----------+------+
| txt            | incre_col | b    |
+----------------+-----------+------+
| table3_noorder |         1 |  333 |
+----------------+-----------+------+
update table3_noorder set a = 0,txt = '将AUTO_INCREMENT列值设置为小于/等于当前最大自增值的值' where b = 333;
insert into table3_noorder values(null,33,'1当前自增值=>');
select txt,a incre_col,b from table3_noorder order by a;
+--------------------------------------------------------------------------+-----------+------+
| txt                                                                      | incre_col | b    |
+--------------------------------------------------------------------------+-----------+------+
| 将AUTO_INCREMENT列值设置为小于/等于当前最大自增值的值                    |         0 |  333 |
| 1当前自增值=>                                                            |         2 |   33 |
+--------------------------------------------------------------------------+-----------+------+
update table3_noorder set a = 20 ,txt = '将AUTO_INCREMENT列值设置为大于当前最大自增值的值' where b = 333;
insert into table3_noorder values(null,33,'2当前自增值=>');
select txt,a incre_col,b from table3_noorder order by a;
+-------------------------------------------------------------------+-----------+------+
| txt                                                               | incre_col | b    |
+-------------------------------------------------------------------+-----------+------+
| 1当前自增值=>                                                     |         2 |   33 |
| 2当前自增值=>                                                     |         3 |   33 |
| 将AUTO_INCREMENT列值设置为大于当前最大自增值的值                  |        20 |  333 |
+-------------------------------------------------------------------+-----------+------+
##更新其他列值时引用AUTO_INCREMENT列
##table1_default
drop table table1_default;
create table table1_default (
  a smallint auto_increment,
  b smallint default 1,
  txt varchar(64) default 'table1_default',
  index (a)
);
drop table table2_order;
create table table2_order (
  a smallint auto_increment,
  b smallint default 2,
  txt varchar(64) default 'table2_order',
  index (a)
) auto_increment_mode = 'order';
drop table table3_noorder;
create table table3_noorder (
  a smallint auto_increment,
  b smallint default 3,
  txt varchar(64) default 'table3_noorder',
  index (a)
) auto_increment_mode = 'noorder';
truncate table table1_default;
insert into table1_default(a,b,txt) values(null,0,'update');
select txt,a incre_col,b from table1_default order by a;
+--------+-----------+------+
| txt    | incre_col | b    |
+--------+-----------+------+
| update |         1 |    0 |
+--------+-----------+------+
update table1_default set b = a+1 where txt = 'update';
insert into table1_default values(null,11,'当前自增值==>');
select txt,a incre_col,b from table1_default order by a;
+--------------------+-----------+------+
| txt                | incre_col | b    |
+--------------------+-----------+------+
| update             |         1 |    2 |
| 当前自增值==>      |         2 |   11 |
+--------------------+-----------+------+
##table2_order
truncate table table2_order;
insert into table2_order(a,b,txt) values(null,0,'update');
select txt,a incre_col,b from table2_order order by a;
+--------+-----------+------+
| txt    | incre_col | b    |
+--------+-----------+------+
| update |         1 |    0 |
+--------+-----------+------+
update table2_order set b = a+2 where txt = 'update';
insert into table2_order values(null,22,'当前自增值==>');
select txt,a incre_col,b from table2_order order by a;
+--------------------+-----------+------+
| txt                | incre_col | b    |
+--------------------+-----------+------+
| update             |         1 |    3 |
| 当前自增值==>      |         2 |   22 |
+--------------------+-----------+------+
##table3_noorder
truncate table table3_noorder;
insert into table3_noorder(a,b,txt) values(null,0,'update');
select txt,a incre_col,b from table3_noorder order by a;
+--------+-----------+------+
| txt    | incre_col | b    |
+--------+-----------+------+
| update |         1 |    0 |
+--------+-----------+------+
update table3_noorder set b = a+3 where txt = 'update';
insert into table3_noorder values(null,33,'当前自增值==>');
select txt,a incre_col,b from table3_noorder order by a;
+--------------------+-----------+------+
| txt                | incre_col | b    |
+--------------------+-----------+------+
| update             |         1 |    4 |
| 当前自增值==>      |         2 |   33 |
+--------------------+-----------+------+
###### auto_incre_3-1-4 ④SELECT操作
select a incre_col from table1_default order by a;
+-----------+
| incre_col |
+-----------+
|         1 |
|         2 |
+-----------+
select abs(a) from table1_default order by a;
+--------+
| abs(a) |
+--------+
|      1 |
|      2 |
+--------+
select a+b from table1_default order by a;
+------+
| a+b  |
+------+
|    3 |
|   13 |
+------+
select a incre_col from table2_order order by a;
+-----------+
| incre_col |
+-----------+
|         1 |
|         2 |
+-----------+
select abs(a) from table2_order order by a;
+--------+
| abs(a) |
+--------+
|      1 |
|      2 |
+--------+
select a+b from table2_order order by a;
+------+
| a+b  |
+------+
|    4 |
|   24 |
+------+
select a incre_col from table3_noorder order by a;
+-----------+
| incre_col |
+-----------+
|         1 |
|         2 |
+-----------+
select abs(a) from table3_noorder order by a;
+--------+
| abs(a) |
+--------+
|      1 |
|      2 |
+--------+
select a+b from table3_noorder order by a;
+------+
| a+b  |
+------+
|    5 |
|   35 |
+------+
###### auto_incre_3-1-5 ⑤TRUNCATE操作
insert into table1_default(a) values(null),(11),(0),(0),(20);
select txt,a incre_col,b from table1_default order by a;
+--------------------+-----------+------+
| txt                | incre_col | b    |
+--------------------+-----------+------+
| update             |         1 |    2 |
| 当前自增值==>      |         2 |   11 |
| table1_default     |         3 |    1 |
| table1_default     |        11 |    1 |
| table1_default     |        20 |    1 |
| table1_default     |     32767 |    1 |
| table1_default     |     32767 |    1 |
+--------------------+-----------+------+
truncate table table1_default;
insert into table1_default(a,txt) values(0,'最新自增值=>');
select txt,a incre_col,b from table1_default order by a;
+-------------------+-----------+------+
| txt               | incre_col | b    |
+-------------------+-----------+------+
| 最新自增值=>      |         1 |    1 |
+-------------------+-----------+------+
insert into table2_order(a) values(null),(11),(0),(0),(20);
select txt,a incre_col,b from table2_order order by a;
+--------------------+-----------+------+
| txt                | incre_col | b    |
+--------------------+-----------+------+
| update             |         1 |    3 |
| 当前自增值==>      |         2 |   22 |
| table2_order       |         3 |    2 |
| table2_order       |        11 |    2 |
| table2_order       |        12 |    2 |
| table2_order       |        13 |    2 |
| table2_order       |        20 |    2 |
+--------------------+-----------+------+
truncate table table2_order;
insert into table2_order(a,txt) values(0,'最新自增值=>');
select txt,a incre_col,b from table2_order order by a;
+-------------------+-----------+------+
| txt               | incre_col | b    |
+-------------------+-----------+------+
| 最新自增值=>      |         1 |    2 |
+-------------------+-----------+------+
insert into table3_noorder(a) values(null),(11),(0),(0),(20);
select txt,a incre_col,b from table3_noorder order by a;
+--------------------+-----------+------+
| txt                | incre_col | b    |
+--------------------+-----------+------+
| update             |         1 |    4 |
| 当前自增值==>      |         2 |   33 |
| table3_noorder     |         3 |    3 |
| table3_noorder     |        11 |    3 |
| table3_noorder     |        20 |    3 |
| table3_noorder     |     32767 |    3 |
| table3_noorder     |     32767 |    3 |
+--------------------+-----------+------+
truncate table table3_noorder;
insert into table3_noorder(a,txt) values(0,'最新自增值=>');
select txt,a incre_col,b from table3_noorder order by a;
+-------------------+-----------+------+
| txt               | incre_col | b    |
+-------------------+-----------+------+
| 最新自增值=>      |         1 |    3 |
+-------------------+-----------+------+
############ auto_incre_2-4 ④模式切换 ############
##建表
drop table table2_order;
create table table2_order (
  a smallint auto_increment primary key,
  b smallint default 2,
  txt varchar(64) default 'table2_order'
) auto_increment_mode = 'order';
## ORDER==>ORDER
insert into table2_order(a) values(0),(0),(0),(0),(0);
select txt,a incre_col, b from table2_order order by a;
+--------------+-----------+------+
| txt          | incre_col | b    |
+--------------+-----------+------+
| table2_order |         1 |    2 |
| table2_order |         2 |    2 |
| table2_order |         3 |    2 |
| table2_order |         4 |    2 |
| table2_order |         5 |    2 |
+--------------+-----------+------+
alter table table2_order auto_increment_mode = 'ORDER';
insert into table2_order values(0,2,'ORDER==>ORDER'),(0,2,'ORDER==>ORDER'),(0,2,'ORDER==>ORDER'),(0,2,'ORDER==>ORDER');
select txt,a incre_col, b from table2_order order by a;
+---------------+-----------+------+
| txt           | incre_col | b    |
+---------------+-----------+------+
| table2_order  |         1 |    2 |
| table2_order  |         2 |    2 |
| table2_order  |         3 |    2 |
| table2_order  |         4 |    2 |
| table2_order  |         5 |    2 |
| ORDER==>ORDER |         6 |    2 |
| ORDER==>ORDER |         7 |    2 |
| ORDER==>ORDER |         8 |    2 |
| ORDER==>ORDER |         9 |    2 |
+---------------+-----------+------+
## ORDER==>NOORDER
alter table table2_order auto_increment_mode = 'NOORDER';
insert into table2_order values(0,3,'ORDER==>NOORDER'),(0,3,'ORDER==>NOORDER'),(0,3,'ORDER==>NOORDER'),(0,3,'ORDER==>NOORDER');
ERROR 23000: Duplicate entry '32767' for key 'PRIMARY'
select txt,a incre_col, b from table2_order order by a;
+---------------+-----------+------+
| txt           | incre_col | b    |
+---------------+-----------+------+
| table2_order  |         1 |    2 |
| table2_order  |         2 |    2 |
| table2_order  |         3 |    2 |
| table2_order  |         4 |    2 |
| table2_order  |         5 |    2 |
| ORDER==>ORDER |         6 |    2 |
| ORDER==>ORDER |         7 |    2 |
| ORDER==>ORDER |         8 |    2 |
| ORDER==>ORDER |         9 |    2 |
+---------------+-----------+------+
## NOORDER==>NOORDER
alter table table2_order auto_increment_mode = 'NOORDER';
insert into table2_order values(0,4,'NOORDER==>NOORDER'),(0,4,'NOORDER==>NOORDER'),(0,4,'NOORDER==>NOORDER'),(0,4,'NOORDER==>NOORDER');
ERROR 23000: Duplicate entry '32767' for key 'PRIMARY'
select txt,a incre_col, b from table2_order order by a;
+---------------+-----------+------+
| txt           | incre_col | b    |
+---------------+-----------+------+
| table2_order  |         1 |    2 |
| table2_order  |         2 |    2 |
| table2_order  |         3 |    2 |
| table2_order  |         4 |    2 |
| table2_order  |         5 |    2 |
| ORDER==>ORDER |         6 |    2 |
| ORDER==>ORDER |         7 |    2 |
| ORDER==>ORDER |         8 |    2 |
| ORDER==>ORDER |         9 |    2 |
+---------------+-----------+------+
## NOORDER==>ORDER
alter table table2_order auto_increment_mode = 'ORDER';
insert into table2_order values(0,5,'NOORDER==>ORDER'),(0,5,'NOORDER==>ORDER'),(0,5,'NOORDER==>ORDER'),(0,5,'NOORDER==>ORDER');
ERROR 23000: Duplicate entry '32767' for key 'PRIMARY'
select txt,a incre_col, b from table2_order order by a;
+---------------+-----------+------+
| txt           | incre_col | b    |
+---------------+-----------+------+
| table2_order  |         1 |    2 |
| table2_order  |         2 |    2 |
| table2_order  |         3 |    2 |
| table2_order  |         4 |    2 |
| table2_order  |         5 |    2 |
| ORDER==>ORDER |         6 |    2 |
| ORDER==>ORDER |         7 |    2 |
| ORDER==>ORDER |         8 |    2 |
| ORDER==>ORDER |         9 |    2 |
+---------------+-----------+------+
insert into table2_order values(0,6,'NOORDER==>ORDER test');
select txt,a incre_col, b from table2_order order by a;
+----------------------+-----------+------+
| txt                  | incre_col | b    |
+----------------------+-----------+------+
| table2_order         |         1 |    2 |
| table2_order         |         2 |    2 |
| table2_order         |         3 |    2 |
| table2_order         |         4 |    2 |
| table2_order         |         5 |    2 |
| ORDER==>ORDER        |         6 |    2 |
| ORDER==>ORDER        |         7 |    2 |
| ORDER==>ORDER        |         8 |    2 |
| ORDER==>ORDER        |         9 |    2 |
| NOORDER==>ORDER test |     32767 |    6 |
+----------------------+-----------+------+
update table2_order set a = 10 where b = 6;
select txt,a incre_col, b from table2_order order by a;
+----------------------+-----------+------+
| txt                  | incre_col | b    |
+----------------------+-----------+------+
| table2_order         |         1 |    2 |
| table2_order         |         2 |    2 |
| table2_order         |         3 |    2 |
| table2_order         |         4 |    2 |
| table2_order         |         5 |    2 |
| ORDER==>ORDER        |         6 |    2 |
| ORDER==>ORDER        |         7 |    2 |
| ORDER==>ORDER        |         8 |    2 |
| ORDER==>ORDER        |         9 |    2 |
| NOORDER==>ORDER test |        10 |    6 |
+----------------------+-----------+------+
##########################################################################################################################
############ auto_incre_1-1-1
############ 数据类型（MEDIUMINT 类型）
##建表
drop table table0_date;
create table table0_date (
  a mediumint,
  b mediumint default 0,
  txt varchar(64) default 'table0_date'
);
insert into table0_date(a) values(100),(101),(102),(103),(104),(105);
drop table table1_default;
create table table1_default (
  a mediumint auto_increment,
  b mediumint default 1,
  txt varchar(64) default 'table1_default',
  index (a)
);
drop table table2_order;
create table table2_order (
  a mediumint auto_increment,
  b mediumint default 2,
  txt varchar(64) default 'table2_order',
  index (a)
) auto_increment_mode = 'order';
drop table table3_noorder;
create table table3_noorder (
  a mediumint auto_increment,
  b mediumint default 3,
  txt varchar(64) default 'table3_noorder',
  index (a)
) auto_increment_mode = 'noorder';
############ auto_incre_3-1 DML操作 ############
###### auto_incre_3-1-1 ①INSERT操作 
##简单插入
##INSERT 语句
##table1_default
insert into table1_default(a) values(null);
select txt,a incre_col,b from table1_default order by a;
+----------------+-----------+------+
| txt            | incre_col | b    |
+----------------+-----------+------+
| table1_default |         1 |    1 |
+----------------+-----------+------+
alter table table1_default AUTO_INCREMENT = 8388607;
insert into table1_default(a) values(null),(null),(null),(null);
select txt,a incre_col,b from table1_default order by a;
+----------------+-----------+------+
| txt            | incre_col | b    |
+----------------+-----------+------+
| table1_default |         1 |    1 |
| table1_default |   8388607 |    1 |
| table1_default |   8388607 |    1 |
| table1_default |   8388607 |    1 |
| table1_default |   8388607 |    1 |
+----------------+-----------+------+
insert into table1_default(a) values(10);
insert into table1_default(a,txt) values(0,'最新自增值=>');
select txt,a incre_col,b from table1_default order by a;
+-------------------+-----------+------+
| txt               | incre_col | b    |
+-------------------+-----------+------+
| table1_default    |         1 |    1 |
| table1_default    |        10 |    1 |
| table1_default    |   8388607 |    1 |
| table1_default    |   8388607 |    1 |
| table1_default    |   8388607 |    1 |
| table1_default    |   8388607 |    1 |
| 最新自增值=>      |   8388607 |    1 |
+-------------------+-----------+------+
##table2_order
insert into table2_order(a) values(null);
select txt,a incre_col,b from table2_order order by a;
+--------------+-----------+------+
| txt          | incre_col | b    |
+--------------+-----------+------+
| table2_order |         1 |    2 |
+--------------+-----------+------+
alter table table2_order AUTO_INCREMENT = 8388607;
insert into table2_order(a) values(null),(null),(null),(null);
select txt,a incre_col,b from table2_order order by a;
+--------------+-----------+------+
| txt          | incre_col | b    |
+--------------+-----------+------+
| table2_order |         1 |    2 |
| table2_order |   8388607 |    2 |
| table2_order |   8388607 |    2 |
| table2_order |   8388607 |    2 |
| table2_order |   8388607 |    2 |
+--------------+-----------+------+
insert into table2_order(a) values(10);
insert into table2_order(a,txt) values(0,'最新自增值=>');
select txt,a incre_col,b from table2_order order by a;
+-------------------+-----------+------+
| txt               | incre_col | b    |
+-------------------+-----------+------+
| table2_order      |         1 |    2 |
| table2_order      |        10 |    2 |
| table2_order      |   8388607 |    2 |
| table2_order      |   8388607 |    2 |
| table2_order      |   8388607 |    2 |
| table2_order      |   8388607 |    2 |
| 最新自增值=>      |   8388607 |    2 |
+-------------------+-----------+------+
##table3_noorder
insert into table3_noorder(a) values(null);
select txt,a incre_col,b from table3_noorder order by a;
+----------------+-----------+------+
| txt            | incre_col | b    |
+----------------+-----------+------+
| table3_noorder |         1 |    3 |
+----------------+-----------+------+
alter table table3_noorder AUTO_INCREMENT = 8388607;
insert into table3_noorder(a) values(null),(null),(null),(null);
select txt,a incre_col,b from table3_noorder order by a;
+----------------+-----------+------+
| txt            | incre_col | b    |
+----------------+-----------+------+
| table3_noorder |         1 |    3 |
| table3_noorder |   8388607 |    3 |
| table3_noorder |   8388607 |    3 |
| table3_noorder |   8388607 |    3 |
| table3_noorder |   8388607 |    3 |
+----------------+-----------+------+
insert into table3_noorder(a) values(10);
insert into table3_noorder(a,txt) values(0,'最新自增值=>');
select txt,a incre_col,b from table3_noorder order by a;
+-------------------+-----------+------+
| txt               | incre_col | b    |
+-------------------+-----------+------+
| table3_noorder    |         1 |    3 |
| table3_noorder    |        10 |    3 |
| table3_noorder    |   8388607 |    3 |
| table3_noorder    |   8388607 |    3 |
| table3_noorder    |   8388607 |    3 |
| table3_noorder    |   8388607 |    3 |
| 最新自增值=>      |   8388607 |    3 |
+-------------------+-----------+------+
##REPLACE 语句
replace into table1_default(a) values(0),(0),(0);
select txt,a incre_col,b from table1_default order by a;
+-------------------+-----------+------+
| txt               | incre_col | b    |
+-------------------+-----------+------+
| table1_default    |         1 |    1 |
| table1_default    |        10 |    1 |
| table1_default    |   8388607 |    1 |
| table1_default    |   8388607 |    1 |
| table1_default    |   8388607 |    1 |
| table1_default    |   8388607 |    1 |
| 最新自增值=>      |   8388607 |    1 |
| table1_default    |   8388607 |    1 |
| table1_default    |   8388607 |    1 |
| table1_default    |   8388607 |    1 |
+-------------------+-----------+------+
replace into table1_default values(5,22,'replace');
insert into table1_default(a,txt) values(0,'最新自增值=>');
select txt,a incre_col,b from table1_default order by a;
+-------------------+-----------+------+
| txt               | incre_col | b    |
+-------------------+-----------+------+
| table1_default    |         1 |    1 |
| replace           |         5 |   22 |
| table1_default    |        10 |    1 |
| table1_default    |   8388607 |    1 |
| table1_default    |   8388607 |    1 |
| table1_default    |   8388607 |    1 |
| table1_default    |   8388607 |    1 |
| 最新自增值=>      |   8388607 |    1 |
| table1_default    |   8388607 |    1 |
| table1_default    |   8388607 |    1 |
| table1_default    |   8388607 |    1 |
| 最新自增值=>      |   8388607 |    1 |
+-------------------+-----------+------+
replace into table2_order(a) values(0),(0),(0);
select txt,a incre_col,b from table2_order order by a;
+-------------------+-----------+------+
| txt               | incre_col | b    |
+-------------------+-----------+------+
| table2_order      |         1 |    2 |
| table2_order      |        10 |    2 |
| table2_order      |   8388607 |    2 |
| table2_order      |   8388607 |    2 |
| table2_order      |   8388607 |    2 |
| table2_order      |   8388607 |    2 |
| 最新自增值=>      |   8388607 |    2 |
| table2_order      |   8388607 |    2 |
| table2_order      |   8388607 |    2 |
| table2_order      |   8388607 |    2 |
+-------------------+-----------+------+
replace into table2_order values(5,22,'replace');
insert into table2_order(a,txt) values(0,'最新自增值=>');
select txt,a incre_col,b from table2_order order by a;
+-------------------+-----------+------+
| txt               | incre_col | b    |
+-------------------+-----------+------+
| table2_order      |         1 |    2 |
| replace           |         5 |   22 |
| table2_order      |        10 |    2 |
| table2_order      |   8388607 |    2 |
| table2_order      |   8388607 |    2 |
| table2_order      |   8388607 |    2 |
| table2_order      |   8388607 |    2 |
| 最新自增值=>      |   8388607 |    2 |
| table2_order      |   8388607 |    2 |
| table2_order      |   8388607 |    2 |
| table2_order      |   8388607 |    2 |
| 最新自增值=>      |   8388607 |    2 |
+-------------------+-----------+------+
replace into table3_noorder(a) values(null),(null),(null);
select txt,a incre_col,b from table3_noorder order by a;
+-------------------+-----------+------+
| txt               | incre_col | b    |
+-------------------+-----------+------+
| table3_noorder    |         1 |    3 |
| table3_noorder    |        10 |    3 |
| table3_noorder    |   8388607 |    3 |
| table3_noorder    |   8388607 |    3 |
| table3_noorder    |   8388607 |    3 |
| table3_noorder    |   8388607 |    3 |
| 最新自增值=>      |   8388607 |    3 |
| table3_noorder    |   8388607 |    3 |
| table3_noorder    |   8388607 |    3 |
| table3_noorder    |   8388607 |    3 |
+-------------------+-----------+------+
replace into table3_noorder values(5,22,'replace');
insert into table3_noorder(a,txt) values(0,'最新自增值=>');
select txt,a incre_col,b from table3_noorder order by a;
+-------------------+-----------+------+
| txt               | incre_col | b    |
+-------------------+-----------+------+
| table3_noorder    |         1 |    3 |
| replace           |         5 |   22 |
| table3_noorder    |        10 |    3 |
| table3_noorder    |   8388607 |    3 |
| table3_noorder    |   8388607 |    3 |
| table3_noorder    |   8388607 |    3 |
| table3_noorder    |   8388607 |    3 |
| 最新自增值=>      |   8388607 |    3 |
| table3_noorder    |   8388607 |    3 |
| table3_noorder    |   8388607 |    3 |
| table3_noorder    |   8388607 |    3 |
| 最新自增值=>      |   8388607 |    3 |
+-------------------+-----------+------+
##批量插入
##INSERT ... SELECT语句
drop table table1_default;
create table table1_default (
  a mediumint auto_increment,
  b mediumint default 1,
  txt varchar(64) default 'table1_default',
  index (a)
);
drop table table2_order;
create table table2_order (
  a mediumint auto_increment,
  b mediumint default 2,
  txt varchar(64) default 'table2_order',
  index (a)
) auto_increment_mode = 'order';
drop table table3_noorder;
create table table3_noorder (
  a mediumint auto_increment,
  b mediumint default 3,
  txt varchar(64) default 'table3_noorder',
  index (a)
) auto_increment_mode = 'noorder';
insert into table1_default select a,b,txt from table0_date where a <= 102;
select txt,a incre_col,b from table1_default order by a;
+-------------+-----------+------+
| txt         | incre_col | b    |
+-------------+-----------+------+
| table0_date |       100 |    0 |
| table0_date |       101 |    0 |
| table0_date |       102 |    0 |
+-------------+-----------+------+
insert into table1_default(a,txt) values(0,'最新自增值=>');
select txt,a incre_col,b from table1_default order by a;
+-------------------+-----------+------+
| txt               | incre_col | b    |
+-------------------+-----------+------+
| table0_date       |       100 |    0 |
| table0_date       |       101 |    0 |
| table0_date       |       102 |    0 |
| 最新自增值=>      |   1000001 |    1 |
+-------------------+-----------+------+
insert into table2_order select a,b,txt from table0_date where a <= 102;
select txt,a incre_col,b from table2_order order by a;
+-------------+-----------+------+
| txt         | incre_col | b    |
+-------------+-----------+------+
| table0_date |       100 |    0 |
| table0_date |       101 |    0 |
| table0_date |       102 |    0 |
+-------------+-----------+------+
insert into table2_order(a,txt) values(0,'最新自增值=>');
select txt,a incre_col,b from table2_order order by a;
+-------------------+-----------+------+
| txt               | incre_col | b    |
+-------------------+-----------+------+
| table0_date       |       100 |    0 |
| table0_date       |       101 |    0 |
| table0_date       |       102 |    0 |
| 最新自增值=>      |       103 |    2 |
+-------------------+-----------+------+
insert into table3_noorder select a,b,txt from table0_date where a <= 102;
select txt,a incre_col,b from table3_noorder order by a;
+-------------+-----------+------+
| txt         | incre_col | b    |
+-------------+-----------+------+
| table0_date |       100 |    0 |
| table0_date |       101 |    0 |
| table0_date |       102 |    0 |
+-------------+-----------+------+
insert into table3_noorder(a,txt) values(0,'最新自增值=>');
select txt,a incre_col,b from table3_noorder order by a;
+-------------------+-----------+------+
| txt               | incre_col | b    |
+-------------------+-----------+------+
| table0_date       |       100 |    0 |
| table0_date       |       101 |    0 |
| table0_date       |       102 |    0 |
| 最新自增值=>      |   1000001 |    3 |
+-------------------+-----------+------+
##REPLACE ... SELECT语句
drop table table1_default;
create table table1_default (
  a mediumint auto_increment,
  b mediumint default 1,
  txt varchar(64) default 'table1_default',
  index (a)
);
drop table table2_order;
create table table2_order (
  a mediumint auto_increment,
  b mediumint default 2,
  txt varchar(64) default 'table2_order',
  index (a)
) auto_increment_mode = 'order';
drop table table3_noorder;
create table table3_noorder (
  a mediumint auto_increment,
  b mediumint default 3,
  txt varchar(64) default 'table3_noorder',
  index (a)
) auto_increment_mode = 'noorder';
replace into table1_default select a,b,txt from table0_date where a >= 102;
select txt,a incre_col,b from table1_default order by a;
+-------------+-----------+------+
| txt         | incre_col | b    |
+-------------+-----------+------+
| table0_date |       102 |    0 |
| table0_date |       103 |    0 |
| table0_date |       104 |    0 |
| table0_date |       105 |    0 |
+-------------+-----------+------+
insert into table1_default(a,txt) values(0,'最新自增值=>');
select txt,a incre_col,b from table1_default order by a;
+-------------------+-----------+------+
| txt               | incre_col | b    |
+-------------------+-----------+------+
| table0_date       |       102 |    0 |
| table0_date       |       103 |    0 |
| table0_date       |       104 |    0 |
| table0_date       |       105 |    0 |
| 最新自增值=>      |   1000001 |    1 |
+-------------------+-----------+------+
replace into table2_order select a,b,txt from table0_date where a >= 102;
select txt,a incre_col,b from table2_order order by a;
+-------------+-----------+------+
| txt         | incre_col | b    |
+-------------+-----------+------+
| table0_date |       102 |    0 |
| table0_date |       103 |    0 |
| table0_date |       104 |    0 |
| table0_date |       105 |    0 |
+-------------+-----------+------+
insert into table2_order(a,txt) values(0,'最新自增值=>');
select txt,a incre_col,b from table2_order order by a;
+-------------------+-----------+------+
| txt               | incre_col | b    |
+-------------------+-----------+------+
| table0_date       |       102 |    0 |
| table0_date       |       103 |    0 |
| table0_date       |       104 |    0 |
| table0_date       |       105 |    0 |
| 最新自增值=>      |       106 |    2 |
+-------------------+-----------+------+
replace into table3_noorder select a,b,txt from table0_date where a >= 102;
select txt,a incre_col,b from table3_noorder order by a;
+-------------+-----------+------+
| txt         | incre_col | b    |
+-------------+-----------+------+
| table0_date |       102 |    0 |
| table0_date |       103 |    0 |
| table0_date |       104 |    0 |
| table0_date |       105 |    0 |
+-------------+-----------+------+
insert into table3_noorder(a,txt) values(0,'最新自增值=>');
select txt,a incre_col,b from table3_noorder order by a;
+-------------------+-----------+------+
| txt               | incre_col | b    |
+-------------------+-----------+------+
| table0_date       |       102 |    0 |
| table0_date       |       103 |    0 |
| table0_date       |       104 |    0 |
| table0_date       |       105 |    0 |
| 最新自增值=>      |   1000001 |    3 |
+-------------------+-----------+------+
##混合插入
##INSERT ... ON DUPLICATE KEY UPDATE 语句
drop table table1_default;
create table table1_default (
  a mediumint auto_increment,
  b mediumint default 1,
  txt varchar(64) default 'table1_default',
  index (a)
);
insert into table1_default (a) values (0);
drop table table2_order;
create table table2_order (
  a mediumint auto_increment,
  b mediumint default 2,
  txt varchar(64) default 'table2_order',
  index (a)
) auto_increment_mode = 'order';
insert into table2_order (a) values (0);
drop table table3_noorder;
create table table3_noorder (
  a mediumint auto_increment,
  b mediumint default 3,
  txt varchar(64) default 'table3_noorder',
  index (a)
) auto_increment_mode = 'noorder';
insert into table3_noorder (a) values (0);
insert into table1_default (a,b,txt) values (1,1,'重复场合') on duplicate key update b=b+1,txt='insert...on duplicate key update 语句';
insert into table1_default(a,txt) values(0,'最新自增值=>');
select txt,a incre_col,b from table1_default order by a;
+-------------------+-----------+------+
| txt               | incre_col | b    |
+-------------------+-----------+------+
| table1_default    |         1 |    1 |
| 重复场合          |         1 |    1 |
| 最新自增值=>      |   1000001 |    1 |
+-------------------+-----------+------+
insert into table1_default (a,b,txt) values (50,1,'不重复场合') on duplicate key update b=b+1,txt='insert...on duplicate key update 语句';
insert into table1_default(a,txt) values(0,'最新自增值=>');
select txt,a incre_col,b from table1_default order by a;
+-------------------+-----------+------+
| txt               | incre_col | b    |
+-------------------+-----------+------+
| table1_default    |         1 |    1 |
| 重复场合          |         1 |    1 |
| 不重复场合        |        50 |    1 |
| 最新自增值=>      |   1000001 |    1 |
| 最新自增值=>      |   1000002 |    1 |
+-------------------+-----------+------+
insert into table2_order (a,b,txt) values (1,2,'重复场合') on duplicate key update b=b+1,txt='insert...on duplicate key update 语句';
insert into table2_order(a,txt) values(0,'最新自增值=>');
select txt,a incre_col,b from table2_order order by a;
+-------------------+-----------+------+
| txt               | incre_col | b    |
+-------------------+-----------+------+
| table2_order      |         1 |    2 |
| 重复场合          |         1 |    2 |
| 最新自增值=>      |         2 |    2 |
+-------------------+-----------+------+
insert into table2_order (a,b,txt) values (50,2,'不重复场合') on duplicate key update b=b+1,txt='insert...on duplicate key update 语句';
insert into table2_order(a,txt) values(0,'最新自增值=>');
select txt,a incre_col,b from table2_order order by a;
+-------------------+-----------+------+
| txt               | incre_col | b    |
+-------------------+-----------+------+
| table2_order      |         1 |    2 |
| 重复场合          |         1 |    2 |
| 最新自增值=>      |         2 |    2 |
| 不重复场合        |        50 |    2 |
| 最新自增值=>      |        51 |    2 |
+-------------------+-----------+------+
insert into table3_noorder (a,b,txt) values (1,3,'重复场合') on duplicate key update b=b+1,txt='insert...on duplicate key update 语句';
insert into table3_noorder(a,txt) values(0,'最新自增值=>');
select txt,a incre_col,b from table3_noorder order by a;
+-------------------+-----------+------+
| txt               | incre_col | b    |
+-------------------+-----------+------+
| table3_noorder    |         1 |    3 |
| 重复场合          |         1 |    3 |
| 最新自增值=>      |   1000001 |    3 |
+-------------------+-----------+------+
insert into table3_noorder (a,b,txt) values (50,3,'不重复场合') on duplicate key update b=b+1,txt='insert...on duplicate key update 语句';
insert into table3_noorder(a,txt) values(0,'最新自增值=>');
select txt,a incre_col,b from table3_noorder order by a;
+-------------------+-----------+------+
| txt               | incre_col | b    |
+-------------------+-----------+------+
| table3_noorder    |         1 |    3 |
| 重复场合          |         1 |    3 |
| 不重复场合        |        50 |    3 |
| 最新自增值=>      |   1000001 |    3 |
| 最新自增值=>      |   1000002 |    3 |
+-------------------+-----------+------+
##将NULL和任何其他值混合插入 AUTO_INCREMENT列
##INSERT 语句
drop table table1_default;
create table table1_default (
  a mediumint auto_increment,
  b mediumint default 1,
  txt varchar(64) default 'table1_default',
  index (a)
);
drop table table2_order;
create table table2_order (
  a mediumint auto_increment,
  b mediumint default 2,
  txt varchar(64) default 'table2_order',
  index (a)
) auto_increment_mode = 'order';
drop table table3_noorder;
create table table3_noorder (
  a mediumint auto_increment,
  b mediumint default 3,
  txt varchar(64) default 'table3_noorder',
  index (a)
) auto_increment_mode = 'noorder';
insert into table1_default(a) values(null),(10),(null),(20);
insert into table1_default(a,txt) values(0,'最新自增值1=>');
select txt,a incre_col,b from table1_default order by a;
+--------------------+-----------+------+
| txt                | incre_col | b    |
+--------------------+-----------+------+
| table1_default     |         1 |    1 |
| table1_default     |        10 |    1 |
| table1_default     |        20 |    1 |
| table1_default     |   1000001 |    1 |
| 最新自增值1=>      |   1000003 |    1 |
+--------------------+-----------+------+
insert into table2_order(a) values(null),(10),(null),(20);
insert into table2_order(a,txt) values(0,'最新自增值=>');
select txt,a incre_col,b from table2_order order by a;
+-------------------+-----------+------+
| txt               | incre_col | b    |
+-------------------+-----------+------+
| table2_order      |         1 |    2 |
| table2_order      |        10 |    2 |
| table2_order      |        11 |    2 |
| table2_order      |        20 |    2 |
| 最新自增值=>      |        21 |    2 |
+-------------------+-----------+------+
insert into table3_noorder(a) values(null),(10),(null),(20);
insert into table3_noorder(a,txt) values(0,'最新自增值=>');
select txt,a incre_col,b from table3_noorder order by a;
+-------------------+-----------+------+
| txt               | incre_col | b    |
+-------------------+-----------+------+
| table3_noorder    |         1 |    3 |
| table3_noorder    |        10 |    3 |
| table3_noorder    |        20 |    3 |
| table3_noorder    |   1000001 |    3 |
| 最新自增值=>      |   1000003 |    3 |
+-------------------+-----------+------+
###### auto_incre_3-1-2 ②DELETE操作
drop table table1_default;
create table table1_default (
  a mediumint auto_increment,
  b mediumint default 1,
  txt varchar(64) default 'table1_default',
  index (a)
);
drop table table2_order;
create table table2_order (
  a mediumint auto_increment,
  b mediumint default 2,
  txt varchar(64) default 'table2_order',
  index (a)
) auto_increment_mode = 'order';
drop table table3_noorder;
create table table3_noorder (
  a mediumint auto_increment,
  b mediumint default 3,
  txt varchar(64) default 'table3_noorder',
  index (a)
) auto_increment_mode = 'noorder';
insert into table1_default(a,b) values(null,11);
insert into table1_default(a,b) values(null,11);
select txt,a incre_col,b from table1_default order by a;
+----------------+-----------+------+
| txt            | incre_col | b    |
+----------------+-----------+------+
| table1_default |         1 |   11 |
| table1_default |         2 |   11 |
+----------------+-----------+------+
delete from table1_default where b=11;
insert into table1_default(a,txt) values(0,'最新自增值=>');
select txt,a incre_col,b from table1_default order by a;
+-------------------+-----------+------+
| txt               | incre_col | b    |
+-------------------+-----------+------+
| 最新自增值=>      |         3 |    1 |
+-------------------+-----------+------+
insert into table2_order(a,b) values(null,22);
insert into table2_order(a,b) values(null,22);
select txt,a incre_col,b from table2_order order by a;
+--------------+-----------+------+
| txt          | incre_col | b    |
+--------------+-----------+------+
| table2_order |         1 |   22 |
| table2_order |         2 |   22 |
+--------------+-----------+------+
delete from table2_order where b=22;
insert into table2_order(a,txt) values(0,'最新自增值=>');
select txt,a incre_col,b from table2_order order by a;
+-------------------+-----------+------+
| txt               | incre_col | b    |
+-------------------+-----------+------+
| 最新自增值=>      |         3 |    2 |
+-------------------+-----------+------+
insert into table3_noorder(a,b) values(null,33);
insert into table3_noorder(a,b) values(null,33);
select txt,a incre_col,b from table3_noorder order by a;
+----------------+-----------+------+
| txt            | incre_col | b    |
+----------------+-----------+------+
| table3_noorder |         1 |   33 |
| table3_noorder |         2 |   33 |
+----------------+-----------+------+
delete from table3_noorder where b=33;
insert into table3_noorder(a,txt) values(0,'最新自增值=>');
select txt,a incre_col,b from table3_noorder order by a;
+-------------------+-----------+------+
| txt               | incre_col | b    |
+-------------------+-----------+------+
| 最新自增值=>      |         3 |    3 |
+-------------------+-----------+------+
###### auto_incre_3-1-3 ③UPDATE操作
# mysql 5.x update没有推高这个自增值，和我们现在是兼容的；8.x update会推高
##更新现有AUTO_INCREMENT列值
drop table table1_default;
create table table1_default (
  a mediumint auto_increment,
  b mediumint default 1,
  txt varchar(64) default 'table1_default',
  index (a)
);
drop table table2_order;
create table table2_order (
  a mediumint auto_increment,
  b mediumint default 2,
  txt varchar(64) default 'table2_order',
  index (a)
) auto_increment_mode = 'order';
drop table table3_noorder;
create table table3_noorder (
  a mediumint auto_increment,
  b mediumint default 3,
  txt varchar(64) default 'table3_noorder',
  index (a)
) auto_increment_mode = 'noorder';
insert into table1_default(a,b) values(null,111);
select txt,a incre_col,b from table1_default order by a;
+----------------+-----------+------+
| txt            | incre_col | b    |
+----------------+-----------+------+
| table1_default |         1 |  111 |
+----------------+-----------+------+
update table1_default set a = 0,txt = '将AUTO_INCREMENT列值设置为小于/等于当前最大自增值的值' where b = 111;
insert into table1_default values(null,11,'1当前自增值=>');
select txt,a incre_col,b from table1_default order by a;
+--------------------------------------------------------------------------+-----------+------+
| txt                                                                      | incre_col | b    |
+--------------------------------------------------------------------------+-----------+------+
| 将AUTO_INCREMENT列值设置为小于/等于当前最大自增值的值                    |         0 |  111 |
| 1当前自增值=>                                                            |         2 |   11 |
+--------------------------------------------------------------------------+-----------+------+
update table1_default set a = 1000 ,txt = '将AUTO_INCREMENT列值设置为大于当前最大自增值的值' where b = 111;
insert into table1_default values(null,11,'2当前自增值=>');
select txt,a incre_col,b from table1_default order by a;
+-------------------------------------------------------------------+-----------+------+
| txt                                                               | incre_col | b    |
+-------------------------------------------------------------------+-----------+------+
| 1当前自增值=>                                                     |         2 |   11 |
| 2当前自增值=>                                                     |         3 |   11 |
| 将AUTO_INCREMENT列值设置为大于当前最大自增值的值                  |      1000 |  111 |
+-------------------------------------------------------------------+-----------+------+
insert into table2_order(a,b) values(null,222);
select txt,a incre_col,b from table2_order order by a;
+--------------+-----------+------+
| txt          | incre_col | b    |
+--------------+-----------+------+
| table2_order |         1 |  222 |
+--------------+-----------+------+
update table2_order set a = 0,txt = '将AUTO_INCREMENT列值设置为小于/等于当前最大自增值的值' where b = 222;
insert into table2_order values(null,22,'1当前自增值=>');
select txt,a incre_col,b from table2_order order by a;
+--------------------------------------------------------------------------+-----------+------+
| txt                                                                      | incre_col | b    |
+--------------------------------------------------------------------------+-----------+------+
| 将AUTO_INCREMENT列值设置为小于/等于当前最大自增值的值                    |         0 |  222 |
| 1当前自增值=>                                                            |         2 |   22 |
+--------------------------------------------------------------------------+-----------+------+
update table2_order set a = 20 ,txt = '将AUTO_INCREMENT列值设置为大于当前最大自增值的值' where b = 222;
insert into table2_order values(null,22,'2当前自增值=>');
select txt,a incre_col,b from table2_order order by a;
+-------------------------------------------------------------------+-----------+------+
| txt                                                               | incre_col | b    |
+-------------------------------------------------------------------+-----------+------+
| 1当前自增值=>                                                     |         2 |   22 |
| 2当前自增值=>                                                     |         3 |   22 |
| 将AUTO_INCREMENT列值设置为大于当前最大自增值的值                  |        20 |  222 |
+-------------------------------------------------------------------+-----------+------+
insert into table3_noorder(a,b) values(null,333);
select txt,a incre_col,b from table3_noorder order by a;
+----------------+-----------+------+
| txt            | incre_col | b    |
+----------------+-----------+------+
| table3_noorder |         1 |  333 |
+----------------+-----------+------+
update table3_noorder set a = 0,txt = '将AUTO_INCREMENT列值设置为小于/等于当前最大自增值的值' where b = 333;
insert into table3_noorder values(null,33,'1当前自增值=>');
select txt,a incre_col,b from table3_noorder order by a;
+--------------------------------------------------------------------------+-----------+------+
| txt                                                                      | incre_col | b    |
+--------------------------------------------------------------------------+-----------+------+
| 将AUTO_INCREMENT列值设置为小于/等于当前最大自增值的值                    |         0 |  333 |
| 1当前自增值=>                                                            |         2 |   33 |
+--------------------------------------------------------------------------+-----------+------+
update table3_noorder set a = 20 ,txt = '将AUTO_INCREMENT列值设置为大于当前最大自增值的值' where b = 333;
insert into table3_noorder values(null,33,'2当前自增值=>');
select txt,a incre_col,b from table3_noorder order by a;
+-------------------------------------------------------------------+-----------+------+
| txt                                                               | incre_col | b    |
+-------------------------------------------------------------------+-----------+------+
| 1当前自增值=>                                                     |         2 |   33 |
| 2当前自增值=>                                                     |         3 |   33 |
| 将AUTO_INCREMENT列值设置为大于当前最大自增值的值                  |        20 |  333 |
+-------------------------------------------------------------------+-----------+------+
##更新其他列值时引用AUTO_INCREMENT列
drop table table1_default;
create table table1_default (
  a mediumint auto_increment,
  b mediumint default 1,
  txt varchar(64) default 'table1_default',
  index (a)
);
drop table table2_order;
create table table2_order (
  a mediumint auto_increment,
  b mediumint default 2,
  txt varchar(64) default 'table2_order',
  index (a)
) auto_increment_mode = 'order';
drop table table3_noorder;
create table table3_noorder (
  a mediumint auto_increment,
  b mediumint default 3,
  txt varchar(64) default 'table3_noorder',
  index (a)
) auto_increment_mode = 'noorder';
insert into table1_default(a,b,txt) values(null,0,'update');
select txt,a incre_col,b from table1_default order by a;
+--------+-----------+------+
| txt    | incre_col | b    |
+--------+-----------+------+
| update |         1 |    0 |
+--------+-----------+------+
update table1_default set b = a+1 where txt = 'update';
insert into table1_default values(null,11,'当前自增值==>');
select txt,a incre_col,b from table1_default order by a;
+--------------------+-----------+------+
| txt                | incre_col | b    |
+--------------------+-----------+------+
| update             |         1 |    2 |
| 当前自增值==>      |         2 |   11 |
+--------------------+-----------+------+
insert into table2_order(a,b,txt) values(null,0,'update');
select txt,a incre_col,b from table2_order order by a;
+--------+-----------+------+
| txt    | incre_col | b    |
+--------+-----------+------+
| update |         1 |    0 |
+--------+-----------+------+
update table2_order set b = a+2 where txt = 'update';
insert into table2_order values(null,22,'当前自增值==>');
select txt,a incre_col,b from table2_order order by a;
+--------------------+-----------+------+
| txt                | incre_col | b    |
+--------------------+-----------+------+
| update             |         1 |    3 |
| 当前自增值==>      |         2 |   22 |
+--------------------+-----------+------+
insert into table3_noorder(a,b,txt) values(null,0,'update');
select txt,a incre_col,b from table3_noorder order by a;
+--------+-----------+------+
| txt    | incre_col | b    |
+--------+-----------+------+
| update |         1 |    0 |
+--------+-----------+------+
update table3_noorder set b = a+3 where txt = 'update';
insert into table3_noorder values(null,33,'当前自增值==>');
select txt,a incre_col,b from table3_noorder order by a;
+--------------------+-----------+------+
| txt                | incre_col | b    |
+--------------------+-----------+------+
| update             |         1 |    4 |
| 当前自增值==>      |         2 |   33 |
+--------------------+-----------+------+
###### auto_incre_3-1-4 ④SELECT操作
select a incre_col from table1_default order by a;
+-----------+
| incre_col |
+-----------+
|         1 |
|         2 |
+-----------+
select abs(a) from table1_default order by a;
+--------+
| abs(a) |
+--------+
|      1 |
|      2 |
+--------+
select a+b from table1_default order by a;
+------+
| a+b  |
+------+
|    3 |
|   13 |
+------+
select a incre_col from table2_order order by a;
+-----------+
| incre_col |
+-----------+
|         1 |
|         2 |
+-----------+
select abs(a) from table2_order order by a;
+--------+
| abs(a) |
+--------+
|      1 |
|      2 |
+--------+
select a+b from table2_order order by a;
+------+
| a+b  |
+------+
|    4 |
|   24 |
+------+
select a incre_col from table3_noorder order by a;
+-----------+
| incre_col |
+-----------+
|         1 |
|         2 |
+-----------+
select abs(a) from table3_noorder order by a;
+--------+
| abs(a) |
+--------+
|      1 |
|      2 |
+--------+
select a+b from table3_noorder order by a;
+------+
| a+b  |
+------+
|    5 |
|   35 |
+------+
############ auto_incre_2-4 ④模式切换 ############
##建表
drop table table2_order;
create table table2_order (
  a mediumint auto_increment,
  b mediumint default 2,
  txt varchar(64) default 'table2_order',
  index (a)
) auto_increment_mode = 'order';
## ORDER==>ORDER
insert into table2_order(a) values(0),(0),(0),(0),(0);
select txt,a incre_col, b from table2_order order by a;
+--------------+-----------+------+
| txt          | incre_col | b    |
+--------------+-----------+------+
| table2_order |         1 |    2 |
| table2_order |         2 |    2 |
| table2_order |         3 |    2 |
| table2_order |         4 |    2 |
| table2_order |         5 |    2 |
+--------------+-----------+------+
alter table table2_order auto_increment_mode = 'ORDER';
insert into table2_order values(0,2,'ORDER==>ORDER'),(0,2,'ORDER==>ORDER'),(0,2,'ORDER==>ORDER'),(0,2,'ORDER==>ORDER');
select txt,a incre_col, b from table2_order order by a;
+---------------+-----------+------+
| txt           | incre_col | b    |
+---------------+-----------+------+
| table2_order  |         1 |    2 |
| table2_order  |         2 |    2 |
| table2_order  |         3 |    2 |
| table2_order  |         4 |    2 |
| table2_order  |         5 |    2 |
| ORDER==>ORDER |         6 |    2 |
| ORDER==>ORDER |         7 |    2 |
| ORDER==>ORDER |         8 |    2 |
| ORDER==>ORDER |         9 |    2 |
+---------------+-----------+------+
## ORDER==>NOORDER
alter table table2_order auto_increment_mode = 'NOORDER';
insert into table2_order values(0,3,'ORDER==>NOORDER'),(0,3,'ORDER==>NOORDER'),(0,3,'ORDER==>NOORDER'),(0,3,'ORDER==>NOORDER');
select txt,a incre_col, b from table2_order order by a;
+-----------------+-----------+------+
| txt             | incre_col | b    |
+-----------------+-----------+------+
| table2_order    |         1 |    2 |
| table2_order    |         2 |    2 |
| table2_order    |         3 |    2 |
| table2_order    |         4 |    2 |
| table2_order    |         5 |    2 |
| ORDER==>ORDER   |         6 |    2 |
| ORDER==>ORDER   |         7 |    2 |
| ORDER==>ORDER   |         8 |    2 |
| ORDER==>ORDER   |         9 |    2 |
| ORDER==>NOORDER |   1000001 |    3 |
| ORDER==>NOORDER |   1000002 |    3 |
| ORDER==>NOORDER |   1000003 |    3 |
| ORDER==>NOORDER |   1000004 |    3 |
+-----------------+-----------+------+
## NOORDER==>NOORDER
alter table table2_order auto_increment_mode = 'NOORDER';
insert into table2_order values(0,4,'NOORDER==>NOORDER'),(0,4,'NOORDER==>NOORDER'),(0,4,'NOORDER==>NOORDER'),(0,4,'NOORDER==>NOORDER');
select txt,a incre_col, b from table2_order order by a;
+-------------------+-----------+------+
| txt               | incre_col | b    |
+-------------------+-----------+------+
| table2_order      |         1 |    2 |
| table2_order      |         2 |    2 |
| table2_order      |         3 |    2 |
| table2_order      |         4 |    2 |
| table2_order      |         5 |    2 |
| ORDER==>ORDER     |         6 |    2 |
| ORDER==>ORDER     |         7 |    2 |
| ORDER==>ORDER     |         8 |    2 |
| ORDER==>ORDER     |         9 |    2 |
| ORDER==>NOORDER   |   1000001 |    3 |
| ORDER==>NOORDER   |   1000002 |    3 |
| ORDER==>NOORDER   |   1000003 |    3 |
| ORDER==>NOORDER   |   1000004 |    3 |
| NOORDER==>NOORDER |   1000005 |    4 |
| NOORDER==>NOORDER |   1000006 |    4 |
| NOORDER==>NOORDER |   1000007 |    4 |
| NOORDER==>NOORDER |   1000008 |    4 |
+-------------------+-----------+------+
## NOORDER==>ORDER
alter table table2_order auto_increment_mode = 'ORDER';
insert into table2_order values(0,5,'NOORDER==>ORDER'),(0,5,'NOORDER==>ORDER'),(0,5,'NOORDER==>ORDER'),(0,5,'NOORDER==>ORDER');
select txt,a incre_col, b from table2_order order by a;
+-------------------+-----------+------+
| txt               | incre_col | b    |
+-------------------+-----------+------+
| table2_order      |         1 |    2 |
| table2_order      |         2 |    2 |
| table2_order      |         3 |    2 |
| table2_order      |         4 |    2 |
| table2_order      |         5 |    2 |
| ORDER==>ORDER     |         6 |    2 |
| ORDER==>ORDER     |         7 |    2 |
| ORDER==>ORDER     |         8 |    2 |
| ORDER==>ORDER     |         9 |    2 |
| ORDER==>NOORDER   |   1000001 |    3 |
| ORDER==>NOORDER   |   1000002 |    3 |
| ORDER==>NOORDER   |   1000003 |    3 |
| ORDER==>NOORDER   |   1000004 |    3 |
| NOORDER==>NOORDER |   1000005 |    4 |
| NOORDER==>NOORDER |   1000006 |    4 |
| NOORDER==>NOORDER |   1000007 |    4 |
| NOORDER==>NOORDER |   1000008 |    4 |
| NOORDER==>ORDER   |   1083887 |    5 |
| NOORDER==>ORDER   |   1083888 |    5 |
| NOORDER==>ORDER   |   1083889 |    5 |
| NOORDER==>ORDER   |   1083890 |    5 |
+-------------------+-----------+------+
insert into table2_order values(0,6,'NOORDER==>ORDER test');
select txt,a incre_col, b from table2_order order by a;
+----------------------+-----------+------+
| txt                  | incre_col | b    |
+----------------------+-----------+------+
| table2_order         |         1 |    2 |
| table2_order         |         2 |    2 |
| table2_order         |         3 |    2 |
| table2_order         |         4 |    2 |
| table2_order         |         5 |    2 |
| ORDER==>ORDER        |         6 |    2 |
| ORDER==>ORDER        |         7 |    2 |
| ORDER==>ORDER        |         8 |    2 |
| ORDER==>ORDER        |         9 |    2 |
| ORDER==>NOORDER      |   1000001 |    3 |
| ORDER==>NOORDER      |   1000002 |    3 |
| ORDER==>NOORDER      |   1000003 |    3 |
| ORDER==>NOORDER      |   1000004 |    3 |
| NOORDER==>NOORDER    |   1000005 |    4 |
| NOORDER==>NOORDER    |   1000006 |    4 |
| NOORDER==>NOORDER    |   1000007 |    4 |
| NOORDER==>NOORDER    |   1000008 |    4 |
| NOORDER==>ORDER      |   1083887 |    5 |
| NOORDER==>ORDER      |   1083888 |    5 |
| NOORDER==>ORDER      |   1083889 |    5 |
| NOORDER==>ORDER      |   1083890 |    5 |
| NOORDER==>ORDER test |   1083891 |    6 |
+----------------------+-----------+------+
update table2_order set a = 10 where b = 6;
insert into table2_order values(null,22,'当前自增值==>');
select txt,a incre_col, b from table2_order order by a;
+----------------------+-----------+------+
| txt                  | incre_col | b    |
+----------------------+-----------+------+
| table2_order         |         1 |    2 |
| table2_order         |         2 |    2 |
| table2_order         |         3 |    2 |
| table2_order         |         4 |    2 |
| table2_order         |         5 |    2 |
| ORDER==>ORDER        |         6 |    2 |
| ORDER==>ORDER        |         7 |    2 |
| ORDER==>ORDER        |         8 |    2 |
| ORDER==>ORDER        |         9 |    2 |
| NOORDER==>ORDER test |        10 |    6 |
| ORDER==>NOORDER      |   1000001 |    3 |
| ORDER==>NOORDER      |   1000002 |    3 |
| ORDER==>NOORDER      |   1000003 |    3 |
| ORDER==>NOORDER      |   1000004 |    3 |
| NOORDER==>NOORDER    |   1000005 |    4 |
| NOORDER==>NOORDER    |   1000006 |    4 |
| NOORDER==>NOORDER    |   1000007 |    4 |
| NOORDER==>NOORDER    |   1000008 |    4 |
| NOORDER==>ORDER      |   1083887 |    5 |
| NOORDER==>ORDER      |   1083888 |    5 |
| NOORDER==>ORDER      |   1083889 |    5 |
| NOORDER==>ORDER      |   1083890 |    5 |
| 当前自增值==>        |   1083892 |   22 |
+----------------------+-----------+------+
############ auto_incre_1-1-1
############ 数据类型（FLOAT 类型）
##建表
drop table table0_date;
create table table0_date (
  a float(5) primary key,
  b float(5) default 0,
  txt varchar(64) default 'table0_date'
);
insert into table0_date(a) values(100),(101),(102),(103),(104),(105);
drop table table1_default;
create table table1_default (
  a float(5) auto_increment primary key,
  b float(5) default 1,
  txt varchar(64) default 'table1_default'
);
drop table table2_order;
create table table2_order (
  a float(5) auto_increment primary key,
  b float(5) default 2,
  txt varchar(64) default 'table2_order'
) auto_increment_mode = 'order';
drop table table3_noorder;
create table table3_noorder (
  a float(5) auto_increment primary key,
  b float(5) default 3,
  txt varchar(64) default 'table3_noorder'
) auto_increment_mode = 'noorder';
############ auto_incre_3-1 DML操作 ############
###### auto_incre_3-1-1 ①INSERT操作 
##简单插入
##INSERT 语句
insert into table1_default(a) values(0),(0),(0);
select txt,a incre_col,b from table1_default order by a;
+----------------+-----------+------+
| txt            | incre_col | b    |
+----------------+-----------+------+
| table1_default |         1 |    1 |
| table1_default |         2 |    1 |
| table1_default |         3 |    1 |
+----------------+-----------+------+
insert into table1_default(a) values(10.5);
insert into table1_default(a,txt) values(0,'最新自增值=>');
select txt,a incre_col,b from table1_default order by a;
+-------------------+-----------+------+
| txt               | incre_col | b    |
+-------------------+-----------+------+
| table1_default    |         1 |    1 |
| table1_default    |         2 |    1 |
| table1_default    |         3 |    1 |
| table1_default    |      10.5 |    1 |
| 最新自增值=>      |   1000000 |    1 |
+-------------------+-----------+------+
insert into table1_default(a) values(20.3);
insert into table1_default(a,txt) values(0,'最新自增值=>');
select txt,a incre_col,b from table1_default order by a;
+-------------------+-----------+------+
| txt               | incre_col | b    |
+-------------------+-----------+------+
| table1_default    |         1 |    1 |
| table1_default    |         2 |    1 |
| table1_default    |         3 |    1 |
| table1_default    |      10.5 |    1 |
| table1_default    |      20.3 |    1 |
| 最新自增值=>      |   1000000 |    1 |
| 最新自增值=>      |   1000000 |    1 |
+-------------------+-----------+------+
insert into table1_default(a) values(1000000);
insert into table1_default(a) values(0),(0),(0);
select txt,a incre_col,b from table1_default order by a;
+-------------------+-----------+------+
| txt               | incre_col | b    |
+-------------------+-----------+------+
| table1_default    |         1 |    1 |
| table1_default    |         2 |    1 |
| table1_default    |         3 |    1 |
| table1_default    |      10.5 |    1 |
| table1_default    |      20.3 |    1 |
| table1_default    |   1000000 |    1 |
| 最新自增值=>      |   1000000 |    1 |
| 最新自增值=>      |   1000000 |    1 |
| table1_default    |   1000000 |    1 |
| table1_default    |   1000000 |    1 |
| table1_default    |   1000000 |    1 |
+-------------------+-----------+------+
insert into table2_order(a) values(0),(0),(0);
select txt,a incre_col,b from table2_order order by a;
+--------------+-----------+------+
| txt          | incre_col | b    |
+--------------+-----------+------+
| table2_order |         1 |    2 |
| table2_order |         2 |    2 |
| table2_order |         3 |    2 |
+--------------+-----------+------+
insert into table1_default(a) values(100.2);
insert into table1_default(a,txt) values(0,'最新自增值=>');
select txt,a incre_col,b from table1_default order by a;
+-------------------+-----------+------+
| txt               | incre_col | b    |
+-------------------+-----------+------+
| table1_default    |         1 |    1 |
| table1_default    |         2 |    1 |
| table1_default    |         3 |    1 |
| table1_default    |      10.5 |    1 |
| table1_default    |      20.3 |    1 |
| table1_default    |     100.2 |    1 |
| table1_default    |   1000000 |    1 |
| 最新自增值=>      |   1000000 |    1 |
| 最新自增值=>      |   1000000 |    1 |
| table1_default    |   1000000 |    1 |
| table1_default    |   1000000 |    1 |
| table1_default    |   1000000 |    1 |
| 最新自增值=>      |   1000010 |    1 |
+-------------------+-----------+------+
insert into table3_noorder(a) values(null),(null),(null);
select txt,a incre_col,b from table3_noorder order by a;
+----------------+-----------+------+
| txt            | incre_col | b    |
+----------------+-----------+------+
| table3_noorder |         1 |    3 |
| table3_noorder |         2 |    3 |
| table3_noorder |         3 |    3 |
+----------------+-----------+------+
insert into table3_noorder(a) values(111.21);
insert into table3_noorder(a,txt) values(0,'最新自增值=>');
select txt,a incre_col,b from table3_noorder order by a;
+-------------------+-----------+------+
| txt               | incre_col | b    |
+-------------------+-----------+------+
| table3_noorder    |         1 |    3 |
| table3_noorder    |         2 |    3 |
| table3_noorder    |         3 |    3 |
| table3_noorder    |    111.21 |    3 |
| 最新自增值=>      |   1000000 |    3 |
+-------------------+-----------+------+
##REPLACE 语句
replace into table1_default(a) values(0),(0),(0);
select txt,a incre_col,b from table1_default order by a;
+-------------------+-----------+------+
| txt               | incre_col | b    |
+-------------------+-----------+------+
| table1_default    |         1 |    1 |
| table1_default    |         2 |    1 |
| table1_default    |         3 |    1 |
| table1_default    |      10.5 |    1 |
| table1_default    |      20.3 |    1 |
| table1_default    |     100.2 |    1 |
| table1_default    |   1000000 |    1 |
| 最新自增值=>      |   1000000 |    1 |
| 最新自增值=>      |   1000000 |    1 |
| table1_default    |   1000000 |    1 |
| table1_default    |   1000000 |    1 |
| table1_default    |   1000000 |    1 |
| 最新自增值=>      |   1000010 |    1 |
| table1_default    |   1000010 |    1 |
| table1_default    |   1000010 |    1 |
| table1_default    |   1000010 |    1 |
+-------------------+-----------+------+
replace into table1_default values(5,22,'replace');
insert into table1_default(a,txt) values(0,'最新自增值=>');
select txt,a incre_col,b from table1_default order by a;
+-------------------+-----------+------+
| txt               | incre_col | b    |
+-------------------+-----------+------+
| table1_default    |         1 |    1 |
| table1_default    |         2 |    1 |
| table1_default    |         3 |    1 |
| replace           |         5 |   22 |
| table1_default    |      10.5 |    1 |
| table1_default    |      20.3 |    1 |
| table1_default    |     100.2 |    1 |
| table1_default    |   1000000 |    1 |
| 最新自增值=>      |   1000000 |    1 |
| 最新自增值=>      |   1000000 |    1 |
| table1_default    |   1000000 |    1 |
| table1_default    |   1000000 |    1 |
| table1_default    |   1000000 |    1 |
| 最新自增值=>      |   1000010 |    1 |
| table1_default    |   1000010 |    1 |
| table1_default    |   1000010 |    1 |
| table1_default    |   1000010 |    1 |
| 最新自增值=>      |   1000010 |    1 |
+-------------------+-----------+------+
replace into table2_order(a) values(0),(0),(0);
select txt,a incre_col,b from table2_order order by a;
+--------------+-----------+------+
| txt          | incre_col | b    |
+--------------+-----------+------+
| table2_order |         1 |    2 |
| table2_order |         2 |    2 |
| table2_order |         3 |    2 |
| table2_order |         4 |    2 |
| table2_order |         5 |    2 |
| table2_order |         6 |    2 |
+--------------+-----------+------+
replace into table2_order values(5,22,'replace');
insert into table2_order(a,txt) values(0,'最新自增值=>');
select txt,a incre_col,b from table2_order order by a;
+-------------------+-----------+------+
| txt               | incre_col | b    |
+-------------------+-----------+------+
| table2_order      |         1 |    2 |
| table2_order      |         2 |    2 |
| table2_order      |         3 |    2 |
| table2_order      |         4 |    2 |
| replace           |         5 |   22 |
| table2_order      |         6 |    2 |
| 最新自增值=>      |         7 |    2 |
+-------------------+-----------+------+
replace into table3_noorder(a) values(null),(null),(null);
select txt,a incre_col,b from table3_noorder order by a;
+-------------------+-----------+------+
| txt               | incre_col | b    |
+-------------------+-----------+------+
| table3_noorder    |         1 |    3 |
| table3_noorder    |         2 |    3 |
| table3_noorder    |         3 |    3 |
| table3_noorder    |    111.21 |    3 |
| 最新自增值=>      |   1000000 |    3 |
| table3_noorder    |   1000000 |    3 |
| table3_noorder    |   1000000 |    3 |
| table3_noorder    |   1000000 |    3 |
+-------------------+-----------+------+
replace into table3_noorder values(5,22,'replace');
insert into table3_noorder(a,txt) values(0,'最新自增值=>');
select txt,a incre_col,b from table3_noorder order by a;
+-------------------+-----------+------+
| txt               | incre_col | b    |
+-------------------+-----------+------+
| table3_noorder    |         1 |    3 |
| table3_noorder    |         2 |    3 |
| table3_noorder    |         3 |    3 |
| replace           |         5 |   22 |
| table3_noorder    |    111.21 |    3 |
| 最新自增值=>      |   1000000 |    3 |
| table3_noorder    |   1000000 |    3 |
| table3_noorder    |   1000000 |    3 |
| table3_noorder    |   1000000 |    3 |
| 最新自增值=>      |   1000000 |    3 |
+-------------------+-----------+------+
insert into table3_noorder(a) values(null),(null),(null);
select txt,a incre_col,b from table3_noorder order by a;
+-------------------+-----------+------+
| txt               | incre_col | b    |
+-------------------+-----------+------+
| table3_noorder    |         1 |    3 |
| table3_noorder    |         2 |    3 |
| table3_noorder    |         3 |    3 |
| replace           |         5 |   22 |
| table3_noorder    |    111.21 |    3 |
| 最新自增值=>      |   1000000 |    3 |
| table3_noorder    |   1000000 |    3 |
| table3_noorder    |   1000000 |    3 |
| table3_noorder    |   1000000 |    3 |
| 最新自增值=>      |   1000000 |    3 |
| table3_noorder    |   1000010 |    3 |
| table3_noorder    |   1000010 |    3 |
| table3_noorder    |   1000010 |    3 |
+-------------------+-----------+------+
##批量插入
##INSERT ... SELECT语句
insert into table1_default select a,b,txt from table0_date where a <= 102;
select txt,a incre_col,b from table1_default order by a;
+-------------------+-----------+------+
| txt               | incre_col | b    |
+-------------------+-----------+------+
| table1_default    |         1 |    1 |
| table1_default    |         2 |    1 |
| table1_default    |         3 |    1 |
| replace           |         5 |   22 |
| table1_default    |      10.5 |    1 |
| table1_default    |      20.3 |    1 |
| table0_date       |       100 |    0 |
| table1_default    |     100.2 |    1 |
| table0_date       |       101 |    0 |
| table0_date       |       102 |    0 |
| table1_default    |   1000000 |    1 |
| 最新自增值=>      |   1000000 |    1 |
| 最新自增值=>      |   1000000 |    1 |
| table1_default    |   1000000 |    1 |
| table1_default    |   1000000 |    1 |
| table1_default    |   1000000 |    1 |
| 最新自增值=>      |   1000010 |    1 |
| table1_default    |   1000010 |    1 |
| table1_default    |   1000010 |    1 |
| table1_default    |   1000010 |    1 |
| 最新自增值=>      |   1000010 |    1 |
+-------------------+-----------+------+
insert into table1_default(a,txt) values(0,'最新自增值=>');
select txt,a incre_col,b from table1_default order by a;
+-------------------+-----------+------+
| txt               | incre_col | b    |
+-------------------+-----------+------+
| table1_default    |         1 |    1 |
| table1_default    |         2 |    1 |
| table1_default    |         3 |    1 |
| replace           |         5 |   22 |
| table1_default    |      10.5 |    1 |
| table1_default    |      20.3 |    1 |
| table0_date       |       100 |    0 |
| table1_default    |     100.2 |    1 |
| table0_date       |       101 |    0 |
| table0_date       |       102 |    0 |
| table1_default    |   1000000 |    1 |
| 最新自增值=>      |   1000000 |    1 |
| 最新自增值=>      |   1000000 |    1 |
| table1_default    |   1000000 |    1 |
| table1_default    |   1000000 |    1 |
| table1_default    |   1000000 |    1 |
| 最新自增值=>      |   1000010 |    1 |
| table1_default    |   1000010 |    1 |
| table1_default    |   1000010 |    1 |
| table1_default    |   1000010 |    1 |
| 最新自增值=>      |   1000010 |    1 |
| 最新自增值=>      |   1000010 |    1 |
+-------------------+-----------+------+
insert into table2_order select a,b,txt from table0_date where a <= 102;
select txt,a incre_col,b from table2_order order by a;
+-------------------+-----------+------+
| txt               | incre_col | b    |
+-------------------+-----------+------+
| table2_order      |         1 |    2 |
| table2_order      |         2 |    2 |
| table2_order      |         3 |    2 |
| table2_order      |         4 |    2 |
| replace           |         5 |   22 |
| table2_order      |         6 |    2 |
| 最新自增值=>      |         7 |    2 |
| table0_date       |       100 |    0 |
| table0_date       |       101 |    0 |
| table0_date       |       102 |    0 |
+-------------------+-----------+------+
insert into table2_order(a,txt) values(0,'最新自增值=>');
select txt,a incre_col,b from table2_order order by a;
+-------------------+-----------+------+
| txt               | incre_col | b    |
+-------------------+-----------+------+
| table2_order      |         1 |    2 |
| table2_order      |         2 |    2 |
| table2_order      |         3 |    2 |
| table2_order      |         4 |    2 |
| replace           |         5 |   22 |
| table2_order      |         6 |    2 |
| 最新自增值=>      |         7 |    2 |
| table0_date       |       100 |    0 |
| table0_date       |       101 |    0 |
| table0_date       |       102 |    0 |
| 最新自增值=>      |       103 |    2 |
+-------------------+-----------+------+
insert into table3_noorder select a,b,txt from table0_date where a <= 102;
select txt,a incre_col,b from table3_noorder order by a;
+-------------------+-----------+------+
| txt               | incre_col | b    |
+-------------------+-----------+------+
| table3_noorder    |         1 |    3 |
| table3_noorder    |         2 |    3 |
| table3_noorder    |         3 |    3 |
| replace           |         5 |   22 |
| table0_date       |       100 |    0 |
| table0_date       |       101 |    0 |
| table0_date       |       102 |    0 |
| table3_noorder    |    111.21 |    3 |
| 最新自增值=>      |   1000000 |    3 |
| table3_noorder    |   1000000 |    3 |
| table3_noorder    |   1000000 |    3 |
| table3_noorder    |   1000000 |    3 |
| 最新自增值=>      |   1000000 |    3 |
| table3_noorder    |   1000010 |    3 |
| table3_noorder    |   1000010 |    3 |
| table3_noorder    |   1000010 |    3 |
+-------------------+-----------+------+
insert into table3_noorder(a,txt) values(0,'最新自增值=>');
select txt,a incre_col,b from table3_noorder order by a;
+-------------------+-----------+------+
| txt               | incre_col | b    |
+-------------------+-----------+------+
| table3_noorder    |         1 |    3 |
| table3_noorder    |         2 |    3 |
| table3_noorder    |         3 |    3 |
| replace           |         5 |   22 |
| table0_date       |       100 |    0 |
| table0_date       |       101 |    0 |
| table0_date       |       102 |    0 |
| table3_noorder    |    111.21 |    3 |
| 最新自增值=>      |   1000000 |    3 |
| table3_noorder    |   1000000 |    3 |
| table3_noorder    |   1000000 |    3 |
| table3_noorder    |   1000000 |    3 |
| 最新自增值=>      |   1000000 |    3 |
| table3_noorder    |   1000010 |    3 |
| table3_noorder    |   1000010 |    3 |
| table3_noorder    |   1000010 |    3 |
| 最新自增值=>      |   1000010 |    3 |
+-------------------+-----------+------+
##REPLACE ... SELECT语句
replace into table1_default select a,b,txt from table0_date where a >= 102;
select txt,a incre_col,b from table1_default order by a;
+-------------------+-----------+------+
| txt               | incre_col | b    |
+-------------------+-----------+------+
| table1_default    |         1 |    1 |
| table1_default    |         2 |    1 |
| table1_default    |         3 |    1 |
| replace           |         5 |   22 |
| table1_default    |      10.5 |    1 |
| table1_default    |      20.3 |    1 |
| table0_date       |       100 |    0 |
| table1_default    |     100.2 |    1 |
| table0_date       |       101 |    0 |
| table0_date       |       102 |    0 |
| table0_date       |       103 |    0 |
| table0_date       |       104 |    0 |
| table0_date       |       105 |    0 |
| table1_default    |   1000000 |    1 |
| 最新自增值=>      |   1000000 |    1 |
| 最新自增值=>      |   1000000 |    1 |
| table1_default    |   1000000 |    1 |
| table1_default    |   1000000 |    1 |
| table1_default    |   1000000 |    1 |
| 最新自增值=>      |   1000010 |    1 |
| table1_default    |   1000010 |    1 |
| table1_default    |   1000010 |    1 |
| table1_default    |   1000010 |    1 |
| 最新自增值=>      |   1000010 |    1 |
| 最新自增值=>      |   1000010 |    1 |
+-------------------+-----------+------+
insert into table1_default(a,txt) values(0,'最新自增值=>');
select txt,a incre_col,b from table1_default order by a;
+-------------------+-----------+------+
| txt               | incre_col | b    |
+-------------------+-----------+------+
| table1_default    |         1 |    1 |
| table1_default    |         2 |    1 |
| table1_default    |         3 |    1 |
| replace           |         5 |   22 |
| table1_default    |      10.5 |    1 |
| table1_default    |      20.3 |    1 |
| table0_date       |       100 |    0 |
| table1_default    |     100.2 |    1 |
| table0_date       |       101 |    0 |
| table0_date       |       102 |    0 |
| table0_date       |       103 |    0 |
| table0_date       |       104 |    0 |
| table0_date       |       105 |    0 |
| table1_default    |   1000000 |    1 |
| 最新自增值=>      |   1000000 |    1 |
| 最新自增值=>      |   1000000 |    1 |
| table1_default    |   1000000 |    1 |
| table1_default    |   1000000 |    1 |
| table1_default    |   1000000 |    1 |
| 最新自增值=>      |   1000010 |    1 |
| table1_default    |   1000010 |    1 |
| table1_default    |   1000010 |    1 |
| table1_default    |   1000010 |    1 |
| 最新自增值=>      |   1000010 |    1 |
| 最新自增值=>      |   1000010 |    1 |
| 最新自增值=>      |   1000010 |    1 |
+-------------------+-----------+------+
replace into table2_order select a,b,txt from table0_date where a >= 102;
select txt,a incre_col,b from table2_order order by a;
+-------------------+-----------+------+
| txt               | incre_col | b    |
+-------------------+-----------+------+
| table2_order      |         1 |    2 |
| table2_order      |         2 |    2 |
| table2_order      |         3 |    2 |
| table2_order      |         4 |    2 |
| replace           |         5 |   22 |
| table2_order      |         6 |    2 |
| 最新自增值=>      |         7 |    2 |
| table0_date       |       100 |    0 |
| table0_date       |       101 |    0 |
| table0_date       |       102 |    0 |
| table0_date       |       103 |    0 |
| table0_date       |       104 |    0 |
| table0_date       |       105 |    0 |
+-------------------+-----------+------+
insert into table2_order(a,txt) values(0,'最新自增值=>');
select txt,a incre_col,b from table2_order order by a;
+-------------------+-----------+------+
| txt               | incre_col | b    |
+-------------------+-----------+------+
| table2_order      |         1 |    2 |
| table2_order      |         2 |    2 |
| table2_order      |         3 |    2 |
| table2_order      |         4 |    2 |
| replace           |         5 |   22 |
| table2_order      |         6 |    2 |
| 最新自增值=>      |         7 |    2 |
| table0_date       |       100 |    0 |
| table0_date       |       101 |    0 |
| table0_date       |       102 |    0 |
| table0_date       |       103 |    0 |
| table0_date       |       104 |    0 |
| table0_date       |       105 |    0 |
| 最新自增值=>      |       106 |    2 |
+-------------------+-----------+------+
replace into table3_noorder select a,b,txt from table0_date where a >= 102;
select txt,a incre_col,b from table3_noorder order by a;
+-------------------+-----------+------+
| txt               | incre_col | b    |
+-------------------+-----------+------+
| table3_noorder    |         1 |    3 |
| table3_noorder    |         2 |    3 |
| table3_noorder    |         3 |    3 |
| replace           |         5 |   22 |
| table0_date       |       100 |    0 |
| table0_date       |       101 |    0 |
| table0_date       |       102 |    0 |
| table0_date       |       103 |    0 |
| table0_date       |       104 |    0 |
| table0_date       |       105 |    0 |
| table3_noorder    |    111.21 |    3 |
| 最新自增值=>      |   1000000 |    3 |
| table3_noorder    |   1000000 |    3 |
| table3_noorder    |   1000000 |    3 |
| table3_noorder    |   1000000 |    3 |
| 最新自增值=>      |   1000000 |    3 |
| table3_noorder    |   1000010 |    3 |
| table3_noorder    |   1000010 |    3 |
| table3_noorder    |   1000010 |    3 |
| 最新自增值=>      |   1000010 |    3 |
+-------------------+-----------+------+
insert into table3_noorder(a,txt) values(0,'最新自增值=>');
select txt,a incre_col,b from table3_noorder order by a;
+-------------------+-----------+------+
| txt               | incre_col | b    |
+-------------------+-----------+------+
| table3_noorder    |         1 |    3 |
| table3_noorder    |         2 |    3 |
| table3_noorder    |         3 |    3 |
| replace           |         5 |   22 |
| table0_date       |       100 |    0 |
| table0_date       |       101 |    0 |
| table0_date       |       102 |    0 |
| table0_date       |       103 |    0 |
| table0_date       |       104 |    0 |
| table0_date       |       105 |    0 |
| table3_noorder    |    111.21 |    3 |
| 最新自增值=>      |   1000000 |    3 |
| table3_noorder    |   1000000 |    3 |
| table3_noorder    |   1000000 |    3 |
| table3_noorder    |   1000000 |    3 |
| 最新自增值=>      |   1000000 |    3 |
| table3_noorder    |   1000010 |    3 |
| table3_noorder    |   1000010 |    3 |
| table3_noorder    |   1000010 |    3 |
| 最新自增值=>      |   1000010 |    3 |
| 最新自增值=>      |   1000010 |    3 |
+-------------------+-----------+------+
##混合插入
##INSERT ... ON DUPLICATE KEY UPDATE 语句
insert into table1_default (a,b,txt) values (1,1,'重复场合') on duplicate key update b=b+1,txt='insert...on duplicate key update 语句';
insert into table1_default(a,txt) values(0,'最新自增值=>');
select txt,a incre_col,b from table1_default order by a;
+-----------------------------------------+-----------+------+
| txt                                     | incre_col | b    |
+-----------------------------------------+-----------+------+
| insert...on duplicate key update 语句   |         1 |    2 |
| table1_default                          |         2 |    1 |
| table1_default                          |         3 |    1 |
| replace                                 |         5 |   22 |
| table1_default                          |      10.5 |    1 |
| table1_default                          |      20.3 |    1 |
| table0_date                             |       100 |    0 |
| table1_default                          |     100.2 |    1 |
| table0_date                             |       101 |    0 |
| table0_date                             |       102 |    0 |
| table0_date                             |       103 |    0 |
| table0_date                             |       104 |    0 |
| table0_date                             |       105 |    0 |
| table1_default                          |   1000000 |    1 |
| 最新自增值=>                            |   1000000 |    1 |
| 最新自增值=>                            |   1000000 |    1 |
| table1_default                          |   1000000 |    1 |
| table1_default                          |   1000000 |    1 |
| table1_default                          |   1000000 |    1 |
| 最新自增值=>                            |   1000010 |    1 |
| table1_default                          |   1000010 |    1 |
| table1_default                          |   1000010 |    1 |
| table1_default                          |   1000010 |    1 |
| 最新自增值=>                            |   1000010 |    1 |
| 最新自增值=>                            |   1000010 |    1 |
| 最新自增值=>                            |   1000010 |    1 |
| 最新自增值=>                            |   1000010 |    1 |
+-----------------------------------------+-----------+------+
insert into table1_default (a,b,txt) values (50,1,'不重复场合') on duplicate key update b=b+1,txt='insert...on duplicate key update 语句';
insert into table1_default(a,txt) values(0,'最新自增值=>');
select txt,a incre_col,b from table1_default order by a;
+-----------------------------------------+-----------+------+
| txt                                     | incre_col | b    |
+-----------------------------------------+-----------+------+
| insert...on duplicate key update 语句   |         1 |    2 |
| table1_default                          |         2 |    1 |
| table1_default                          |         3 |    1 |
| replace                                 |         5 |   22 |
| table1_default                          |      10.5 |    1 |
| table1_default                          |      20.3 |    1 |
| 不重复场合                              |        50 |    1 |
| table0_date                             |       100 |    0 |
| table1_default                          |     100.2 |    1 |
| table0_date                             |       101 |    0 |
| table0_date                             |       102 |    0 |
| table0_date                             |       103 |    0 |
| table0_date                             |       104 |    0 |
| table0_date                             |       105 |    0 |
| table1_default                          |   1000000 |    1 |
| 最新自增值=>                            |   1000000 |    1 |
| 最新自增值=>                            |   1000000 |    1 |
| table1_default                          |   1000000 |    1 |
| table1_default                          |   1000000 |    1 |
| table1_default                          |   1000000 |    1 |
| 最新自增值=>                            |   1000010 |    1 |
| table1_default                          |   1000010 |    1 |
| table1_default                          |   1000010 |    1 |
| table1_default                          |   1000010 |    1 |
| 最新自增值=>                            |   1000010 |    1 |
| 最新自增值=>                            |   1000010 |    1 |
| 最新自增值=>                            |   1000010 |    1 |
| 最新自增值=>                            |   1000010 |    1 |
| 最新自增值=>                            |   1000010 |    1 |
+-----------------------------------------+-----------+------+
insert into table2_order (a,b,txt) values (1,2,'重复场合') on duplicate key update b=b+1,txt='insert...on duplicate key update 语句';
insert into table2_order(a,txt) values(0,'最新自增值=>');
select txt,a incre_col,b from table2_order order by a;
+-----------------------------------------+-----------+------+
| txt                                     | incre_col | b    |
+-----------------------------------------+-----------+------+
| insert...on duplicate key update 语句   |         1 |    3 |
| table2_order                            |         2 |    2 |
| table2_order                            |         3 |    2 |
| table2_order                            |         4 |    2 |
| replace                                 |         5 |   22 |
| table2_order                            |         6 |    2 |
| 最新自增值=>                            |         7 |    2 |
| table0_date                             |       100 |    0 |
| table0_date                             |       101 |    0 |
| table0_date                             |       102 |    0 |
| table0_date                             |       103 |    0 |
| table0_date                             |       104 |    0 |
| table0_date                             |       105 |    0 |
| 最新自增值=>                            |       106 |    2 |
| 最新自增值=>                            |       107 |    2 |
+-----------------------------------------+-----------+------+
insert into table2_order (a,b,txt) values (50,2,'不重复场合') on duplicate key update b=b+1,txt='insert...on duplicate key update 语句';
insert into table2_order(a,txt) values(0,'最新自增值=>');
select txt,a incre_col,b from table2_order order by a;
+-----------------------------------------+-----------+------+
| txt                                     | incre_col | b    |
+-----------------------------------------+-----------+------+
| insert...on duplicate key update 语句   |         1 |    3 |
| table2_order                            |         2 |    2 |
| table2_order                            |         3 |    2 |
| table2_order                            |         4 |    2 |
| replace                                 |         5 |   22 |
| table2_order                            |         6 |    2 |
| 最新自增值=>                            |         7 |    2 |
| 不重复场合                              |        50 |    2 |
| table0_date                             |       100 |    0 |
| table0_date                             |       101 |    0 |
| table0_date                             |       102 |    0 |
| table0_date                             |       103 |    0 |
| table0_date                             |       104 |    0 |
| table0_date                             |       105 |    0 |
| 最新自增值=>                            |       106 |    2 |
| 最新自增值=>                            |       107 |    2 |
| 最新自增值=>                            |       108 |    2 |
+-----------------------------------------+-----------+------+
insert into table3_noorder (a,b,txt) values (1,3,'重复场合') on duplicate key update b=b+1,txt='insert...on duplicate key update 语句';
insert into table3_noorder(a,txt) values(0,'最新自增值=>');
select txt,a incre_col,b from table3_noorder order by a;
+-----------------------------------------+-----------+------+
| txt                                     | incre_col | b    |
+-----------------------------------------+-----------+------+
| insert...on duplicate key update 语句   |         1 |    4 |
| table3_noorder                          |         2 |    3 |
| table3_noorder                          |         3 |    3 |
| replace                                 |         5 |   22 |
| table0_date                             |       100 |    0 |
| table0_date                             |       101 |    0 |
| table0_date                             |       102 |    0 |
| table0_date                             |       103 |    0 |
| table0_date                             |       104 |    0 |
| table0_date                             |       105 |    0 |
| table3_noorder                          |    111.21 |    3 |
| 最新自增值=>                            |   1000000 |    3 |
| table3_noorder                          |   1000000 |    3 |
| table3_noorder                          |   1000000 |    3 |
| table3_noorder                          |   1000000 |    3 |
| 最新自增值=>                            |   1000000 |    3 |
| table3_noorder                          |   1000010 |    3 |
| table3_noorder                          |   1000010 |    3 |
| table3_noorder                          |   1000010 |    3 |
| 最新自增值=>                            |   1000010 |    3 |
| 最新自增值=>                            |   1000010 |    3 |
| 最新自增值=>                            |   1000010 |    3 |
+-----------------------------------------+-----------+------+
insert into table3_noorder (a,b,txt) values (50,3,'不重复场合') on duplicate key update b=b+1,txt='insert...on duplicate key update 语句';
insert into table3_noorder(a,txt) values(0,'最新自增值=>');
select txt,a incre_col,b from table3_noorder order by a;
+-----------------------------------------+-----------+------+
| txt                                     | incre_col | b    |
+-----------------------------------------+-----------+------+
| insert...on duplicate key update 语句   |         1 |    4 |
| table3_noorder                          |         2 |    3 |
| table3_noorder                          |         3 |    3 |
| replace                                 |         5 |   22 |
| 不重复场合                              |        50 |    3 |
| table0_date                             |       100 |    0 |
| table0_date                             |       101 |    0 |
| table0_date                             |       102 |    0 |
| table0_date                             |       103 |    0 |
| table0_date                             |       104 |    0 |
| table0_date                             |       105 |    0 |
| table3_noorder                          |    111.21 |    3 |
| 最新自增值=>                            |   1000000 |    3 |
| table3_noorder                          |   1000000 |    3 |
| table3_noorder                          |   1000000 |    3 |
| table3_noorder                          |   1000000 |    3 |
| 最新自增值=>                            |   1000000 |    3 |
| table3_noorder                          |   1000010 |    3 |
| table3_noorder                          |   1000010 |    3 |
| table3_noorder                          |   1000010 |    3 |
| 最新自增值=>                            |   1000010 |    3 |
| 最新自增值=>                            |   1000010 |    3 |
| 最新自增值=>                            |   1000010 |    3 |
| 最新自增值=>                            |   1000010 |    3 |
+-----------------------------------------+-----------+------+
##将NULL和任何其他值混合插入 AUTO_INCREMENT列
##INSERT 语句
truncate table table1_default;
insert into table1_default(a) values(null),(10),(null),(20);
insert into table1_default(a,txt) values(0,'最新自增值1=>');
select txt,a incre_col,b from table1_default order by a;
+--------------------+-----------+------+
| txt                | incre_col | b    |
+--------------------+-----------+------+
| table1_default     |         1 |    1 |
| table1_default     |        10 |    1 |
| table1_default     |        20 |    1 |
| table1_default     |   1000000 |    1 |
| 最新自增值1=>      |   1000000 |    1 |
+--------------------+-----------+------+
truncate table table2_order;
insert into table2_order(a) values(null),(10),(null),(20);
insert into table2_order(a,txt) values(0,'最新自增值=>');
select txt,a incre_col,b from table2_order order by a;
+-------------------+-----------+------+
| txt               | incre_col | b    |
+-------------------+-----------+------+
| table2_order      |         1 |    2 |
| table2_order      |        10 |    2 |
| table2_order      |        11 |    2 |
| table2_order      |        20 |    2 |
| 最新自增值=>      |        21 |    2 |
+-------------------+-----------+------+
truncate table table3_noorder;
insert into table3_noorder(a) values(null),(10),(null),(20);
insert into table3_noorder(a,txt) values(0,'最新自增值=>');
select txt,a incre_col,b from table3_noorder order by a;
+-------------------+-----------+------+
| txt               | incre_col | b    |
+-------------------+-----------+------+
| table3_noorder    |         1 |    3 |
| table3_noorder    |        10 |    3 |
| table3_noorder    |        20 |    3 |
| table3_noorder    |   1000000 |    3 |
| 最新自增值=>      |   1000000 |    3 |
+-------------------+-----------+------+
###### auto_incre_3-1-2 ②DELETE操作
insert into table1_default(a,b) values(null,11);
insert into table1_default(a,b) values(null,11);
select txt,a incre_col,b from table1_default order by a;
+--------------------+-----------+------+
| txt                | incre_col | b    |
+--------------------+-----------+------+
| table1_default     |         1 |    1 |
| table1_default     |        10 |    1 |
| table1_default     |        20 |    1 |
| table1_default     |   1000000 |    1 |
| 最新自增值1=>      |   1000000 |    1 |
| table1_default     |   1000000 |   11 |
| table1_default     |   1000000 |   11 |
+--------------------+-----------+------+
delete from table1_default where b=11;
insert into table1_default(a,txt) values(0,'最新自增值=>');
select txt,a incre_col,b from table1_default order by a;
+--------------------+-----------+------+
| txt                | incre_col | b    |
+--------------------+-----------+------+
| table1_default     |         1 |    1 |
| table1_default     |        10 |    1 |
| table1_default     |        20 |    1 |
| table1_default     |   1000000 |    1 |
| 最新自增值1=>      |   1000000 |    1 |
| 最新自增值=>       |   1000010 |    1 |
+--------------------+-----------+------+
insert into table2_order(a,b) values(null,22);
insert into table2_order(a,b) values(null,22);
select txt,a incre_col,b from table2_order order by a;
+-------------------+-----------+------+
| txt               | incre_col | b    |
+-------------------+-----------+------+
| table2_order      |         1 |    2 |
| table2_order      |        10 |    2 |
| table2_order      |        11 |    2 |
| table2_order      |        20 |    2 |
| 最新自增值=>      |        21 |    2 |
| table2_order      |        22 |   22 |
| table2_order      |        23 |   22 |
+-------------------+-----------+------+
delete from table2_order where b=22;
insert into table2_order(a,txt) values(0,'最新自增值=>');
select txt,a incre_col,b from table2_order order by a;
+-------------------+-----------+------+
| txt               | incre_col | b    |
+-------------------+-----------+------+
| table2_order      |         1 |    2 |
| table2_order      |        10 |    2 |
| table2_order      |        11 |    2 |
| table2_order      |        20 |    2 |
| 最新自增值=>      |        21 |    2 |
| 最新自增值=>      |        24 |    2 |
+-------------------+-----------+------+
insert into table3_noorder(a,b) values(null,33);
insert into table3_noorder(a,b) values(null,33);
select txt,a incre_col,b from table3_noorder order by a;
+-------------------+-----------+------+
| txt               | incre_col | b    |
+-------------------+-----------+------+
| table3_noorder    |         1 |    3 |
| table3_noorder    |        10 |    3 |
| table3_noorder    |        20 |    3 |
| table3_noorder    |   1000000 |    3 |
| 最新自增值=>      |   1000000 |    3 |
| table3_noorder    |   1000000 |   33 |
| table3_noorder    |   1000000 |   33 |
+-------------------+-----------+------+
delete from table3_noorder where b=33;
insert into table3_noorder(a,txt) values(0,'最新自增值=>');
select txt,a incre_col,b from table3_noorder order by a;
+-------------------+-----------+------+
| txt               | incre_col | b    |
+-------------------+-----------+------+
| table3_noorder    |         1 |    3 |
| table3_noorder    |        10 |    3 |
| table3_noorder    |        20 |    3 |
| table3_noorder    |   1000000 |    3 |
| 最新自增值=>      |   1000000 |    3 |
| 最新自增值=>      |   1000010 |    3 |
+-------------------+-----------+------+
###### auto_incre_3-1-3 ③UPDATE操作
# mysql 5.x update没有推高这个自增值，和我们现在是兼容的；8.x update会推高
##更新现有AUTO_INCREMENT列值
truncate table table1_default;
insert into table1_default(a,b) values(null,111);
select txt,a incre_col,b from table1_default order by a;
+----------------+-----------+------+
| txt            | incre_col | b    |
+----------------+-----------+------+
| table1_default |         1 |  111 |
+----------------+-----------+------+
update table1_default set a = 0,txt = '将AUTO_INCREMENT列值设置为小于/等于当前最大自增值的值' where b = 111;
insert into table1_default values(null,11,'1当前自增值=>');
select txt,a incre_col,b from table1_default order by a;
+--------------------------------------------------------------------------+-----------+------+
| txt                                                                      | incre_col | b    |
+--------------------------------------------------------------------------+-----------+------+
| 将AUTO_INCREMENT列值设置为小于/等于当前最大自增值的值                    |         0 |  111 |
| 1当前自增值=>                                                            |         2 |   11 |
+--------------------------------------------------------------------------+-----------+------+
update table1_default set a = 1111111 ,txt = '将AUTO_INCREMENT列值设置为大于当前最大自增值的值' where b = 111;
insert into table1_default values(null,11,'2当前自增值=>');
select txt,a incre_col,b from table1_default order by a;
+-------------------------------------------------------------------+-----------+------+
| txt                                                               | incre_col | b    |
+-------------------------------------------------------------------+-----------+------+
| 1当前自增值=>                                                     |         2 |   11 |
| 2当前自增值=>                                                     |         3 |   11 |
| 将AUTO_INCREMENT列值设置为大于当前最大自增值的值                  |   1111110 |  111 |
+-------------------------------------------------------------------+-----------+------+
##table2_order
truncate table table2_order;
insert into table2_order(a,b) values(null,222);
select txt,a incre_col,b from table2_order order by a;
+--------------+-----------+------+
| txt          | incre_col | b    |
+--------------+-----------+------+
| table2_order |         1 |  222 |
+--------------+-----------+------+
update table2_order set a = 0,txt = '将AUTO_INCREMENT列值设置为小于/等于当前最大自增值的值' where b = 222;
insert into table2_order values(null,22,'1当前自增值=>');
select txt,a incre_col,b from table2_order order by a;
+--------------------------------------------------------------------------+-----------+------+
| txt                                                                      | incre_col | b    |
+--------------------------------------------------------------------------+-----------+------+
| 将AUTO_INCREMENT列值设置为小于/等于当前最大自增值的值                    |         0 |  222 |
| 1当前自增值=>                                                            |         2 |   22 |
+--------------------------------------------------------------------------+-----------+------+
update table2_order set a = 20 ,txt = '将AUTO_INCREMENT列值设置为大于当前最大自增值的值' where b = 222;
insert into table2_order values(null,22,'2当前自增值=>');
select txt,a incre_col,b from table2_order order by a;
+-------------------------------------------------------------------+-----------+------+
| txt                                                               | incre_col | b    |
+-------------------------------------------------------------------+-----------+------+
| 1当前自增值=>                                                     |         2 |   22 |
| 2当前自增值=>                                                     |         3 |   22 |
| 将AUTO_INCREMENT列值设置为大于当前最大自增值的值                  |        20 |  222 |
+-------------------------------------------------------------------+-----------+------+
##table3_noorder
truncate table table3_noorder;
insert into table3_noorder(a,b) values(null,333);
select txt,a incre_col,b from table3_noorder order by a;
+----------------+-----------+------+
| txt            | incre_col | b    |
+----------------+-----------+------+
| table3_noorder |         1 |  333 |
+----------------+-----------+------+
update table3_noorder set a = 0,txt = '将AUTO_INCREMENT列值设置为小于/等于当前最大自增值的值' where b = 333;
insert into table3_noorder values(null,33,'1当前自增值=>');
select txt,a incre_col,b from table3_noorder order by a;
+--------------------------------------------------------------------------+-----------+------+
| txt                                                                      | incre_col | b    |
+--------------------------------------------------------------------------+-----------+------+
| 将AUTO_INCREMENT列值设置为小于/等于当前最大自增值的值                    |         0 |  333 |
| 1当前自增值=>                                                            |         2 |   33 |
+--------------------------------------------------------------------------+-----------+------+
update table3_noorder set a = 20 ,txt = '将AUTO_INCREMENT列值设置为大于当前最大自增值的值' where b = 333;
insert into table3_noorder values(null,33,'2当前自增值=>');
select txt,a incre_col,b from table3_noorder order by a;
+-------------------------------------------------------------------+-----------+------+
| txt                                                               | incre_col | b    |
+-------------------------------------------------------------------+-----------+------+
| 1当前自增值=>                                                     |         2 |   33 |
| 2当前自增值=>                                                     |         3 |   33 |
| 将AUTO_INCREMENT列值设置为大于当前最大自增值的值                  |        20 |  333 |
+-------------------------------------------------------------------+-----------+------+
##更新其他列值时引用AUTO_INCREMENT列
delete from table1_default;
insert into table1_default(a,b,txt) values(null,0,'update');
select txt,a incre_col,b from table1_default order by a;
+--------+-----------+------+
| txt    | incre_col | b    |
+--------+-----------+------+
| update |         4 |    0 |
+--------+-----------+------+
update table1_default set b = a+1 where txt = 'update';
insert into table1_default values(null,11,'当前自增值==>');
select txt,a incre_col,b from table1_default order by a;
+--------------------+-----------+------+
| txt                | incre_col | b    |
+--------------------+-----------+------+
| update             |         4 |    5 |
| 当前自增值==>      |         5 |   11 |
+--------------------+-----------+------+
delete from table2_order;
insert into table2_order(a,b,txt) values(null,0,'update');
select txt,a incre_col,b from table2_order order by a;
+--------+-----------+------+
| txt    | incre_col | b    |
+--------+-----------+------+
| update |         4 |    0 |
+--------+-----------+------+
update table2_order set b = a+2 where txt = 'update';
insert into table2_order values(null,22,'当前自增值==>');
select txt,a incre_col,b from table2_order order by a;
+--------------------+-----------+------+
| txt                | incre_col | b    |
+--------------------+-----------+------+
| update             |         4 |    6 |
| 当前自增值==>      |         5 |   22 |
+--------------------+-----------+------+
delete from table3_noorder;
insert into table3_noorder(a,b,txt) values(null,0,'update');
select txt,a incre_col,b from table3_noorder order by a;
+--------+-----------+------+
| txt    | incre_col | b    |
+--------+-----------+------+
| update |         4 |    0 |
+--------+-----------+------+
update table3_noorder set b = a+3 where txt = 'update';
insert into table3_noorder values(null,33,'当前自增值==>');
select txt,a incre_col,b from table3_noorder order by a;
+--------------------+-----------+------+
| txt                | incre_col | b    |
+--------------------+-----------+------+
| update             |         4 |    7 |
| 当前自增值==>      |         5 |   33 |
+--------------------+-----------+------+
###### auto_incre_3-1-4 ④SELECT操作
select a incre_col from table1_default order by a;
+-----------+
| incre_col |
+-----------+
|         4 |
|         5 |
+-----------+
select abs(a) from table1_default order by a;
+--------+
| abs(a) |
+--------+
|      4 |
|      5 |
+--------+
select a+b from table1_default order by a;
+------+
| a+b  |
+------+
|    9 |
|   16 |
+------+
select a incre_col from table2_order order by a;
+-----------+
| incre_col |
+-----------+
|         4 |
|         5 |
+-----------+
select abs(a) from table2_order order by a;
+--------+
| abs(a) |
+--------+
|      4 |
|      5 |
+--------+
select a+b from table2_order order by a;
+------+
| a+b  |
+------+
|   10 |
|   27 |
+------+
select a incre_col from table3_noorder order by a;
+-----------+
| incre_col |
+-----------+
|         4 |
|         5 |
+-----------+
select abs(a) from table3_noorder order by a;
+--------+
| abs(a) |
+--------+
|      4 |
|      5 |
+--------+
select a+b from table3_noorder order by a;
+------+
| a+b  |
+------+
|   11 |
|   38 |
+------+
############ auto_incre_2-4 ④模式切换 ############
##建表
drop table table2_order;
create table table2_order (
  a float(5) auto_increment primary key,
  b float(5) default 2,
  txt varchar(64) default 'table2_order'
) auto_increment_mode = 'order';
## ORDER==>ORDER
insert into table2_order(a) values(0),(0),(0),(0),(0);
select txt,a incre_col, b from table2_order order by a;
+--------------+-----------+------+
| txt          | incre_col | b    |
+--------------+-----------+------+
| table2_order |         1 |    2 |
| table2_order |         2 |    2 |
| table2_order |         3 |    2 |
| table2_order |         4 |    2 |
| table2_order |         5 |    2 |
+--------------+-----------+------+
alter table table2_order auto_increment_mode = 'ORDER';
insert into table2_order values(0,2,'ORDER==>ORDER'),(0,2,'ORDER==>ORDER'),(0,2,'ORDER==>ORDER'),(0,2,'ORDER==>ORDER');
select txt,a incre_col, b from table2_order order by a;
+---------------+-----------+------+
| txt           | incre_col | b    |
+---------------+-----------+------+
| table2_order  |         1 |    2 |
| table2_order  |         2 |    2 |
| table2_order  |         3 |    2 |
| table2_order  |         4 |    2 |
| table2_order  |         5 |    2 |
| ORDER==>ORDER |         6 |    2 |
| ORDER==>ORDER |         7 |    2 |
| ORDER==>ORDER |         8 |    2 |
| ORDER==>ORDER |         9 |    2 |
+---------------+-----------+------+
## ORDER==>NOORDER
alter table table2_order auto_increment_mode = 'NOORDER';
insert into table2_order values(0,3,'ORDER==>NOORDER'),(0,3,'ORDER==>NOORDER'),(0,3,'ORDER==>NOORDER'),(0,3,'ORDER==>NOORDER');
select txt,a incre_col, b from table2_order order by a;
+-----------------+-----------+------+
| txt             | incre_col | b    |
+-----------------+-----------+------+
| table2_order    |         1 |    2 |
| table2_order    |         2 |    2 |
| table2_order    |         3 |    2 |
| table2_order    |         4 |    2 |
| table2_order    |         5 |    2 |
| ORDER==>ORDER   |         6 |    2 |
| ORDER==>ORDER   |         7 |    2 |
| ORDER==>ORDER   |         8 |    2 |
| ORDER==>ORDER   |         9 |    2 |
| ORDER==>NOORDER |   1000000 |    3 |
| ORDER==>NOORDER |   1000000 |    3 |
| ORDER==>NOORDER |   1000000 |    3 |
| ORDER==>NOORDER |   1000000 |    3 |
+-----------------+-----------+------+
## NOORDER==>NOORDER
alter table table2_order auto_increment_mode = 'NOORDER';
insert into table2_order values(0,4,'NOORDER==>NOORDER'),(0,4,'NOORDER==>NOORDER'),(0,4,'NOORDER==>NOORDER'),(0,4,'NOORDER==>NOORDER');
select txt,a incre_col, b from table2_order order by a;
+-------------------+-----------+------+
| txt               | incre_col | b    |
+-------------------+-----------+------+
| table2_order      |         1 |    2 |
| table2_order      |         2 |    2 |
| table2_order      |         3 |    2 |
| table2_order      |         4 |    2 |
| table2_order      |         5 |    2 |
| ORDER==>ORDER     |         6 |    2 |
| ORDER==>ORDER     |         7 |    2 |
| ORDER==>ORDER     |         8 |    2 |
| ORDER==>ORDER     |         9 |    2 |
| ORDER==>NOORDER   |   1000000 |    3 |
| ORDER==>NOORDER   |   1000000 |    3 |
| ORDER==>NOORDER   |   1000000 |    3 |
| ORDER==>NOORDER   |   1000000 |    3 |
| NOORDER==>NOORDER |   1000000 |    4 |
| NOORDER==>NOORDER |   1000010 |    4 |
| NOORDER==>NOORDER |   1000010 |    4 |
| NOORDER==>NOORDER |   1000010 |    4 |
+-------------------+-----------+------+
## NOORDER==>ORDER
alter table table2_order auto_increment_mode = 'ORDER';
insert into table2_order values(0,5,'NOORDER==>ORDER'),(0,5,'NOORDER==>ORDER'),(0,5,'NOORDER==>ORDER'),(0,5,'NOORDER==>ORDER');
select txt,a incre_col, b from table2_order order by a;
+-------------------+-----------+------+
| txt               | incre_col | b    |
+-------------------+-----------+------+
| table2_order      |         1 |    2 |
| table2_order      |         2 |    2 |
| table2_order      |         3 |    2 |
| table2_order      |         4 |    2 |
| table2_order      |         5 |    2 |
| ORDER==>ORDER     |         6 |    2 |
| ORDER==>ORDER     |         7 |    2 |
| ORDER==>ORDER     |         8 |    2 |
| ORDER==>ORDER     |         9 |    2 |
| ORDER==>NOORDER   |   1000000 |    3 |
| ORDER==>NOORDER   |   1000000 |    3 |
| ORDER==>NOORDER   |   1000000 |    3 |
| ORDER==>NOORDER   |   1000000 |    3 |
| NOORDER==>NOORDER |   1000000 |    4 |
| NOORDER==>NOORDER |   1000010 |    4 |
| NOORDER==>NOORDER |   1000010 |    4 |
| NOORDER==>NOORDER |   1000010 |    4 |
| NOORDER==>ORDER   |   1167770 |    5 |
| NOORDER==>ORDER   |   1167770 |    5 |
| NOORDER==>ORDER   |   1167780 |    5 |
| NOORDER==>ORDER   |   1167780 |    5 |
+-------------------+-----------+------+
insert into table2_order values(0,6,'NOORDER==>ORDER test');
select txt,a incre_col, b from table2_order order by a;
+----------------------+-----------+------+
| txt                  | incre_col | b    |
+----------------------+-----------+------+
| table2_order         |         1 |    2 |
| table2_order         |         2 |    2 |
| table2_order         |         3 |    2 |
| table2_order         |         4 |    2 |
| table2_order         |         5 |    2 |
| ORDER==>ORDER        |         6 |    2 |
| ORDER==>ORDER        |         7 |    2 |
| ORDER==>ORDER        |         8 |    2 |
| ORDER==>ORDER        |         9 |    2 |
| ORDER==>NOORDER      |   1000000 |    3 |
| ORDER==>NOORDER      |   1000000 |    3 |
| ORDER==>NOORDER      |   1000000 |    3 |
| ORDER==>NOORDER      |   1000000 |    3 |
| NOORDER==>NOORDER    |   1000000 |    4 |
| NOORDER==>NOORDER    |   1000010 |    4 |
| NOORDER==>NOORDER    |   1000010 |    4 |
| NOORDER==>NOORDER    |   1000010 |    4 |
| NOORDER==>ORDER      |   1167770 |    5 |
| NOORDER==>ORDER      |   1167770 |    5 |
| NOORDER==>ORDER      |   1167780 |    5 |
| NOORDER==>ORDER      |   1167780 |    5 |
| NOORDER==>ORDER test |   1167780 |    6 |
+----------------------+-----------+------+
update table2_order set a = 10 where b = 6;
insert into table2_order values(null,22,'当前自增值==>');
select txt,a incre_col, b from table2_order order by a;
+----------------------+-----------+------+
| txt                  | incre_col | b    |
+----------------------+-----------+------+
| table2_order         |         1 |    2 |
| table2_order         |         2 |    2 |
| table2_order         |         3 |    2 |
| table2_order         |         4 |    2 |
| table2_order         |         5 |    2 |
| ORDER==>ORDER        |         6 |    2 |
| ORDER==>ORDER        |         7 |    2 |
| ORDER==>ORDER        |         8 |    2 |
| ORDER==>ORDER        |         9 |    2 |
| NOORDER==>ORDER test |        10 |    6 |
| ORDER==>NOORDER      |   1000000 |    3 |
| ORDER==>NOORDER      |   1000000 |    3 |
| ORDER==>NOORDER      |   1000000 |    3 |
| ORDER==>NOORDER      |   1000000 |    3 |
| NOORDER==>NOORDER    |   1000000 |    4 |
| NOORDER==>NOORDER    |   1000010 |    4 |
| NOORDER==>NOORDER    |   1000010 |    4 |
| NOORDER==>NOORDER    |   1000010 |    4 |
| NOORDER==>ORDER      |   1167770 |    5 |
| NOORDER==>ORDER      |   1167770 |    5 |
| NOORDER==>ORDER      |   1167780 |    5 |
| NOORDER==>ORDER      |   1167780 |    5 |
| 当前自增值==>        |   1167780 |   22 |
+----------------------+-----------+------+
##########################################################################################################################
############ auto_incre_1-1-1
############ 数据类型（DOUBLE 类型）
##建表
drop table table0_date;
create table table0_date (
  a double primary key,
  b double default 0,
  txt varchar(64) default 'table0_date'
);
insert into table0_date(a) values(100),(101),(102),(103),(104),(105);
drop table table1_default;
create table table1_default (
  a double auto_increment primary key,
  b double default 1,
  txt varchar(64) default 'table1_default'
);
drop table table2_order;
create table table2_order (
  a double auto_increment primary key,
  b double default 2,
  txt varchar(64) default 'table2_order'
) auto_increment_mode = 'order';
drop table table3_noorder;
create table table3_noorder (
  a double auto_increment primary key,
  b double default 3,
  txt varchar(64) default 'table3_noorder'
) auto_increment_mode = 'noorder';
############ auto_incre_3-1 DML操作 ############
###### auto_incre_3-1-1 ①INSERT操作 
##简单插入
##INSERT 语句
insert into table1_default(a) values(0),(0),(0);
select txt,a incre_col,b from table1_default order by a;
+----------------+-----------+------+
| txt            | incre_col | b    |
+----------------+-----------+------+
| table1_default |         1 |    1 |
| table1_default |         2 |    1 |
| table1_default |         3 |    1 |
+----------------+-----------+------+
insert into table1_default(a) values(10.5);
insert into table1_default(a,txt) values(0,'最新自增值=>');
select txt,a incre_col,b from table1_default order by a;
+-------------------+-----------+------+
| txt               | incre_col | b    |
+-------------------+-----------+------+
| table1_default    |         1 |    1 |
| table1_default    |         2 |    1 |
| table1_default    |         3 |    1 |
| table1_default    |      10.5 |    1 |
| 最新自增值=>      |   1000001 |    1 |
+-------------------+-----------+------+
insert into table1_default(a) values(20.3);
insert into table1_default(a,txt) values(0,'最新自增值=>');
select txt,a incre_col,b from table1_default order by a;
+-------------------+-----------+------+
| txt               | incre_col | b    |
+-------------------+-----------+------+
| table1_default    |         1 |    1 |
| table1_default    |         2 |    1 |
| table1_default    |         3 |    1 |
| table1_default    |      10.5 |    1 |
| table1_default    |      20.3 |    1 |
| 最新自增值=>      |   1000001 |    1 |
| 最新自增值=>      |   1000002 |    1 |
+-------------------+-----------+------+
insert into table1_default(a) values(1000000);
insert into table1_default(a) values(0),(0),(0);
select txt,a incre_col,b from table1_default order by a;
+-------------------+-----------+------+
| txt               | incre_col | b    |
+-------------------+-----------+------+
| table1_default    |         1 |    1 |
| table1_default    |         2 |    1 |
| table1_default    |         3 |    1 |
| table1_default    |      10.5 |    1 |
| table1_default    |      20.3 |    1 |
| table1_default    |   1000000 |    1 |
| 最新自增值=>      |   1000001 |    1 |
| 最新自增值=>      |   1000002 |    1 |
| table1_default    |   1000003 |    1 |
| table1_default    |   1000004 |    1 |
| table1_default    |   1000005 |    1 |
+-------------------+-----------+------+
insert into table2_order(a) values(0),(0),(0);
select txt,a incre_col,b from table2_order order by a;
+--------------+-----------+------+
| txt          | incre_col | b    |
+--------------+-----------+------+
| table2_order |         1 |    2 |
| table2_order |         2 |    2 |
| table2_order |         3 |    2 |
+--------------+-----------+------+
insert into table2_order(a) values(100.2);
insert into table2_order(a,txt) values(0,'最新自增值=>');
select txt,a incre_col,b from table2_order order by a;
+-------------------+-----------+------+
| txt               | incre_col | b    |
+-------------------+-----------+------+
| table2_order      |         1 |    2 |
| table2_order      |         2 |    2 |
| table2_order      |         3 |    2 |
| table2_order      |     100.2 |    2 |
| 最新自增值=>      |       101 |    2 |
+-------------------+-----------+------+
insert into table3_noorder(a) values(null),(null),(null);
select txt,a incre_col,b from table3_noorder order by a;
+----------------+-----------+------+
| txt            | incre_col | b    |
+----------------+-----------+------+
| table3_noorder |         1 |    3 |
| table3_noorder |         2 |    3 |
| table3_noorder |         3 |    3 |
+----------------+-----------+------+
##REPLACE 语句
replace into table1_default(a) values(0),(0),(0);
select txt,a incre_col,b from table1_default order by a;
+-------------------+-----------+------+
| txt               | incre_col | b    |
+-------------------+-----------+------+
| table1_default    |         1 |    1 |
| table1_default    |         2 |    1 |
| table1_default    |         3 |    1 |
| table1_default    |      10.5 |    1 |
| table1_default    |      20.3 |    1 |
| table1_default    |   1000000 |    1 |
| 最新自增值=>      |   1000001 |    1 |
| 最新自增值=>      |   1000002 |    1 |
| table1_default    |   1000003 |    1 |
| table1_default    |   1000004 |    1 |
| table1_default    |   1000005 |    1 |
| table1_default    |   1000006 |    1 |
| table1_default    |   1000007 |    1 |
| table1_default    |   1000008 |    1 |
+-------------------+-----------+------+
replace into table1_default values(5,22,'replace');
insert into table1_default(a,txt) values(0,'最新自增值=>');
select txt,a incre_col,b from table1_default order by a;
+-------------------+-----------+------+
| txt               | incre_col | b    |
+-------------------+-----------+------+
| table1_default    |         1 |    1 |
| table1_default    |         2 |    1 |
| table1_default    |         3 |    1 |
| replace           |         5 |   22 |
| table1_default    |      10.5 |    1 |
| table1_default    |      20.3 |    1 |
| table1_default    |   1000000 |    1 |
| 最新自增值=>      |   1000001 |    1 |
| 最新自增值=>      |   1000002 |    1 |
| table1_default    |   1000003 |    1 |
| table1_default    |   1000004 |    1 |
| table1_default    |   1000005 |    1 |
| table1_default    |   1000006 |    1 |
| table1_default    |   1000007 |    1 |
| table1_default    |   1000008 |    1 |
| 最新自增值=>      |   1000009 |    1 |
+-------------------+-----------+------+
replace into table2_order(a) values(0),(0),(0);
select txt,a incre_col,b from table2_order order by a;
+-------------------+-----------+------+
| txt               | incre_col | b    |
+-------------------+-----------+------+
| table2_order      |         1 |    2 |
| table2_order      |         2 |    2 |
| table2_order      |         3 |    2 |
| table2_order      |     100.2 |    2 |
| 最新自增值=>      |       101 |    2 |
| table2_order      |       102 |    2 |
| table2_order      |       103 |    2 |
| table2_order      |       104 |    2 |
+-------------------+-----------+------+
replace into table2_order values(5,22,'replace');
insert into table2_order(a,txt) values(0,'最新自增值=>');
select txt,a incre_col,b from table2_order order by a;
+-------------------+-----------+------+
| txt               | incre_col | b    |
+-------------------+-----------+------+
| table2_order      |         1 |    2 |
| table2_order      |         2 |    2 |
| table2_order      |         3 |    2 |
| replace           |         5 |   22 |
| table2_order      |     100.2 |    2 |
| 最新自增值=>      |       101 |    2 |
| table2_order      |       102 |    2 |
| table2_order      |       103 |    2 |
| table2_order      |       104 |    2 |
| 最新自增值=>      |       105 |    2 |
+-------------------+-----------+------+
replace into table3_noorder(a) values(null),(null),(null);
select txt,a incre_col,b from table3_noorder order by a;
+----------------+-----------+------+
| txt            | incre_col | b    |
+----------------+-----------+------+
| table3_noorder |         1 |    3 |
| table3_noorder |         2 |    3 |
| table3_noorder |         3 |    3 |
| table3_noorder |         4 |    3 |
| table3_noorder |         5 |    3 |
| table3_noorder |         6 |    3 |
+----------------+-----------+------+
replace into table3_noorder values(5,22,'replace');
insert into table3_noorder(a,txt) values(0,'最新自增值=>');
select txt,a incre_col,b from table3_noorder order by a;
+-------------------+-----------+------+
| txt               | incre_col | b    |
+-------------------+-----------+------+
| table3_noorder    |         1 |    3 |
| table3_noorder    |         2 |    3 |
| table3_noorder    |         3 |    3 |
| table3_noorder    |         4 |    3 |
| replace           |         5 |   22 |
| table3_noorder    |         6 |    3 |
| 最新自增值=>      |   1000001 |    3 |
+-------------------+-----------+------+
insert into table3_noorder(a) values(null),(null),(null);
select txt,a incre_col,b from table3_noorder order by a;
+-------------------+-----------+------+
| txt               | incre_col | b    |
+-------------------+-----------+------+
| table3_noorder    |         1 |    3 |
| table3_noorder    |         2 |    3 |
| table3_noorder    |         3 |    3 |
| table3_noorder    |         4 |    3 |
| replace           |         5 |   22 |
| table3_noorder    |         6 |    3 |
| 最新自增值=>      |   1000001 |    3 |
| table3_noorder    |   1000002 |    3 |
| table3_noorder    |   1000003 |    3 |
| table3_noorder    |   1000004 |    3 |
+-------------------+-----------+------+
##批量插入
##INSERT ... SELECT语句
##table1_default
truncate table table1_default;
insert into table1_default select a,b,txt from table0_date where a <= 102;
select txt,a incre_col,b from table1_default order by a;
+-------------+-----------+------+
| txt         | incre_col | b    |
+-------------+-----------+------+
| table0_date |       100 |    0 |
| table0_date |       101 |    0 |
| table0_date |       102 |    0 |
+-------------+-----------+------+
insert into table1_default(a,txt) values(0,'最新自增值=>');
select txt,a incre_col,b from table1_default order by a;
+-------------------+-----------+------+
| txt               | incre_col | b    |
+-------------------+-----------+------+
| table0_date       |       100 |    0 |
| table0_date       |       101 |    0 |
| table0_date       |       102 |    0 |
| 最新自增值=>      |   1000001 |    1 |
+-------------------+-----------+------+
##table2_order
truncate table table2_order;
insert into table2_order select a,b,txt from table0_date where a <= 102;
select txt,a incre_col,b from table2_order order by a;
+-------------+-----------+------+
| txt         | incre_col | b    |
+-------------+-----------+------+
| table0_date |       100 |    0 |
| table0_date |       101 |    0 |
| table0_date |       102 |    0 |
+-------------+-----------+------+
insert into table2_order(a,txt) values(0,'最新自增值=>');
select txt,a incre_col,b from table2_order order by a;
+-------------------+-----------+------+
| txt               | incre_col | b    |
+-------------------+-----------+------+
| table0_date       |       100 |    0 |
| table0_date       |       101 |    0 |
| table0_date       |       102 |    0 |
| 最新自增值=>      |       103 |    2 |
+-------------------+-----------+------+
##table3_noorder
truncate table table3_noorder;
insert into table3_noorder select a,b,txt from table0_date where a <= 102;
select txt,a incre_col,b from table3_noorder order by a;
+-------------+-----------+------+
| txt         | incre_col | b    |
+-------------+-----------+------+
| table0_date |       100 |    0 |
| table0_date |       101 |    0 |
| table0_date |       102 |    0 |
+-------------+-----------+------+
insert into table3_noorder(a,txt) values(0,'最新自增值=>');
select txt,a incre_col,b from table3_noorder order by a;
+-------------------+-----------+------+
| txt               | incre_col | b    |
+-------------------+-----------+------+
| table0_date       |       100 |    0 |
| table0_date       |       101 |    0 |
| table0_date       |       102 |    0 |
| 最新自增值=>      |   1000001 |    3 |
+-------------------+-----------+------+
##REPLACE ... SELECT语句
replace into table1_default select a,b,txt from table0_date where a >= 102;
select txt,a incre_col,b from table1_default order by a;
+-------------------+-----------+------+
| txt               | incre_col | b    |
+-------------------+-----------+------+
| table0_date       |       100 |    0 |
| table0_date       |       101 |    0 |
| table0_date       |       102 |    0 |
| table0_date       |       103 |    0 |
| table0_date       |       104 |    0 |
| table0_date       |       105 |    0 |
| 最新自增值=>      |   1000001 |    1 |
+-------------------+-----------+------+
insert into table1_default(a,txt) values(0,'最新自增值=>');
select txt,a incre_col,b from table1_default order by a;
+-------------------+-----------+------+
| txt               | incre_col | b    |
+-------------------+-----------+------+
| table0_date       |       100 |    0 |
| table0_date       |       101 |    0 |
| table0_date       |       102 |    0 |
| table0_date       |       103 |    0 |
| table0_date       |       104 |    0 |
| table0_date       |       105 |    0 |
| 最新自增值=>      |   1000001 |    1 |
| 最新自增值=>      |   1000002 |    1 |
+-------------------+-----------+------+
replace into table2_order select a,b,txt from table0_date where a >= 102;
select txt,a incre_col,b from table2_order order by a;
+-------------+-----------+------+
| txt         | incre_col | b    |
+-------------+-----------+------+
| table0_date |       100 |    0 |
| table0_date |       101 |    0 |
| table0_date |       102 |    0 |
| table0_date |       103 |    0 |
| table0_date |       104 |    0 |
| table0_date |       105 |    0 |
+-------------+-----------+------+
insert into table2_order(a,txt) values(0,'最新自增值=>');
select txt,a incre_col,b from table2_order order by a;
+-------------------+-----------+------+
| txt               | incre_col | b    |
+-------------------+-----------+------+
| table0_date       |       100 |    0 |
| table0_date       |       101 |    0 |
| table0_date       |       102 |    0 |
| table0_date       |       103 |    0 |
| table0_date       |       104 |    0 |
| table0_date       |       105 |    0 |
| 最新自增值=>      |       106 |    2 |
+-------------------+-----------+------+
replace into table3_noorder select a,b,txt from table0_date where a >= 102;
select txt,a incre_col,b from table3_noorder order by a;
+-------------------+-----------+------+
| txt               | incre_col | b    |
+-------------------+-----------+------+
| table0_date       |       100 |    0 |
| table0_date       |       101 |    0 |
| table0_date       |       102 |    0 |
| table0_date       |       103 |    0 |
| table0_date       |       104 |    0 |
| table0_date       |       105 |    0 |
| 最新自增值=>      |   1000001 |    3 |
+-------------------+-----------+------+
insert into table3_noorder(a,txt) values(0,'最新自增值=>');
select txt,a incre_col,b from table3_noorder order by a;
+-------------------+-----------+------+
| txt               | incre_col | b    |
+-------------------+-----------+------+
| table0_date       |       100 |    0 |
| table0_date       |       101 |    0 |
| table0_date       |       102 |    0 |
| table0_date       |       103 |    0 |
| table0_date       |       104 |    0 |
| table0_date       |       105 |    0 |
| 最新自增值=>      |   1000001 |    3 |
| 最新自增值=>      |   1000002 |    3 |
+-------------------+-----------+------+
##混合插入
##INSERT ... ON DUPLICATE KEY UPDATE 语句
##table1_default
truncate table table1_default;
insert into table1_default (a,b,txt) values (1,1,'重复场合') on duplicate key update b=b+1,txt='insert...on duplicate key update 语句';
insert into table1_default(a,txt) values(0,'最新自增值=>');
select txt,a incre_col,b from table1_default order by a;
+-------------------+-----------+------+
| txt               | incre_col | b    |
+-------------------+-----------+------+
| 重复场合          |         1 |    1 |
| 最新自增值=>      |   1000001 |    1 |
+-------------------+-----------+------+
insert into table1_default (a,b,txt) values (50,1,'不重复场合') on duplicate key update b=b+1,txt='insert...on duplicate key update 语句';
insert into table1_default(a,txt) values(0,'最新自增值=>');
select txt,a incre_col,b from table1_default order by a;
+-------------------+-----------+------+
| txt               | incre_col | b    |
+-------------------+-----------+------+
| 重复场合          |         1 |    1 |
| 不重复场合        |        50 |    1 |
| 最新自增值=>      |   1000001 |    1 |
| 最新自增值=>      |   1000002 |    1 |
+-------------------+-----------+------+
##table2_order
truncate table table2_order;
insert into table2_order (a,b,txt) values (1,2,'重复场合') on duplicate key update b=b+1,txt='insert...on duplicate key update 语句';
insert into table2_order(a,txt) values(0,'最新自增值=>');
select txt,a incre_col,b from table2_order order by a;
+-------------------+-----------+------+
| txt               | incre_col | b    |
+-------------------+-----------+------+
| 重复场合          |         1 |    2 |
| 最新自增值=>      |         2 |    2 |
+-------------------+-----------+------+
insert into table2_order (a,b,txt) values (50,2,'不重复场合') on duplicate key update b=b+1,txt='insert...on duplicate key update 语句';
insert into table2_order(a,txt) values(0,'最新自增值=>');
select txt,a incre_col,b from table2_order order by a;
+-------------------+-----------+------+
| txt               | incre_col | b    |
+-------------------+-----------+------+
| 重复场合          |         1 |    2 |
| 最新自增值=>      |         2 |    2 |
| 不重复场合        |        50 |    2 |
| 最新自增值=>      |        51 |    2 |
+-------------------+-----------+------+
##table3_noorder
truncate table table3_noorder;
insert into table3_noorder (a,b,txt) values (1,3,'重复场合') on duplicate key update b=b+1,txt='insert...on duplicate key update 语句';
insert into table3_noorder(a,txt) values(0,'最新自增值=>');
select txt,a incre_col,b from table3_noorder order by a;
+-------------------+-----------+------+
| txt               | incre_col | b    |
+-------------------+-----------+------+
| 重复场合          |         1 |    3 |
| 最新自增值=>      |   1000001 |    3 |
+-------------------+-----------+------+
insert into table3_noorder (a,b,txt) values (50,3,'不重复场合') on duplicate key update b=b+1,txt='insert...on duplicate key update 语句';
insert into table3_noorder(a,txt) values(0,'最新自增值=>');
select txt,a incre_col,b from table3_noorder order by a;
+-------------------+-----------+------+
| txt               | incre_col | b    |
+-------------------+-----------+------+
| 重复场合          |         1 |    3 |
| 不重复场合        |        50 |    3 |
| 最新自增值=>      |   1000001 |    3 |
| 最新自增值=>      |   1000002 |    3 |
+-------------------+-----------+------+
##将NULL和任何其他值混合插入 AUTO_INCREMENT列
##INSERT 语句
##table1_default
truncate table table1_default;
insert into table1_default(a) values(null),(10),(null),(20);
insert into table1_default(a,txt) values(0,'最新自增值1=>');
select txt,a incre_col,b from table1_default order by a;
+--------------------+-----------+------+
| txt                | incre_col | b    |
+--------------------+-----------+------+
| table1_default     |         1 |    1 |
| table1_default     |        10 |    1 |
| table1_default     |        20 |    1 |
| table1_default     |   1000001 |    1 |
| 最新自增值1=>      |   1000003 |    1 |
+--------------------+-----------+------+
##table2_order
truncate table table2_order;
insert into table2_order(a) values(null),(10),(null),(20);
insert into table2_order(a,txt) values(0,'最新自增值=>');
select txt,a incre_col,b from table2_order order by a;
+-------------------+-----------+------+
| txt               | incre_col | b    |
+-------------------+-----------+------+
| table2_order      |         1 |    2 |
| table2_order      |        10 |    2 |
| table2_order      |        11 |    2 |
| table2_order      |        20 |    2 |
| 最新自增值=>      |        21 |    2 |
+-------------------+-----------+------+
##table3_noorder
truncate table table3_noorder;
insert into table3_noorder(a) values(null),(10),(null),(20);
insert into table3_noorder(a,txt) values(0,'最新自增值=>');
select txt,a incre_col,b from table3_noorder order by a;
+-------------------+-----------+------+
| txt               | incre_col | b    |
+-------------------+-----------+------+
| table3_noorder    |         1 |    3 |
| table3_noorder    |        10 |    3 |
| table3_noorder    |        20 |    3 |
| table3_noorder    |   1000001 |    3 |
| 最新自增值=>      |   1000003 |    3 |
+-------------------+-----------+------+
###### auto_incre_3-1-2 ②DELETE操作
insert into table1_default(a,b) values(null,11);
insert into table1_default(a,b) values(null,11);
select txt,a incre_col,b from table1_default order by a;
+--------------------+-----------+------+
| txt                | incre_col | b    |
+--------------------+-----------+------+
| table1_default     |         1 |    1 |
| table1_default     |        10 |    1 |
| table1_default     |        20 |    1 |
| table1_default     |   1000001 |    1 |
| 最新自增值1=>      |   1000003 |    1 |
| table1_default     |   1000004 |   11 |
| table1_default     |   1000005 |   11 |
+--------------------+-----------+------+
delete from table1_default where b=11;
insert into table1_default(a,txt) values(0,'最新自增值=>');
select txt,a incre_col,b from table1_default order by a;
+--------------------+-----------+------+
| txt                | incre_col | b    |
+--------------------+-----------+------+
| table1_default     |         1 |    1 |
| table1_default     |        10 |    1 |
| table1_default     |        20 |    1 |
| table1_default     |   1000001 |    1 |
| 最新自增值1=>      |   1000003 |    1 |
| 最新自增值=>       |   1000006 |    1 |
+--------------------+-----------+------+
insert into table2_order(a,b) values(null,22);
insert into table2_order(a,b) values(null,22);
select txt,a incre_col,b from table2_order order by a;
+-------------------+-----------+------+
| txt               | incre_col | b    |
+-------------------+-----------+------+
| table2_order      |         1 |    2 |
| table2_order      |        10 |    2 |
| table2_order      |        11 |    2 |
| table2_order      |        20 |    2 |
| 最新自增值=>      |        21 |    2 |
| table2_order      |        22 |   22 |
| table2_order      |        23 |   22 |
+-------------------+-----------+------+
delete from table2_order where b=22;
insert into table2_order(a,txt) values(0,'最新自增值=>');
select txt,a incre_col,b from table2_order order by a;
+-------------------+-----------+------+
| txt               | incre_col | b    |
+-------------------+-----------+------+
| table2_order      |         1 |    2 |
| table2_order      |        10 |    2 |
| table2_order      |        11 |    2 |
| table2_order      |        20 |    2 |
| 最新自增值=>      |        21 |    2 |
| 最新自增值=>      |        24 |    2 |
+-------------------+-----------+------+
insert into table3_noorder(a,b) values(null,33);
insert into table3_noorder(a,b) values(null,33);
select txt,a incre_col,b from table3_noorder order by a;
+-------------------+-----------+------+
| txt               | incre_col | b    |
+-------------------+-----------+------+
| table3_noorder    |         1 |    3 |
| table3_noorder    |        10 |    3 |
| table3_noorder    |        20 |    3 |
| table3_noorder    |   1000001 |    3 |
| 最新自增值=>      |   1000003 |    3 |
| table3_noorder    |   1000004 |   33 |
| table3_noorder    |   1000005 |   33 |
+-------------------+-----------+------+
delete from table3_noorder where b=33;
insert into table3_noorder(a,txt) values(0,'最新自增值=>');
select txt,a incre_col,b from table3_noorder order by a;
+-------------------+-----------+------+
| txt               | incre_col | b    |
+-------------------+-----------+------+
| table3_noorder    |         1 |    3 |
| table3_noorder    |        10 |    3 |
| table3_noorder    |        20 |    3 |
| table3_noorder    |   1000001 |    3 |
| 最新自增值=>      |   1000003 |    3 |
| 最新自增值=>      |   1000006 |    3 |
+-------------------+-----------+------+
###### auto_incre_3-1-3 ③UPDATE操作
# mysql 5.x update没有推高这个自增值，和我们现在是兼容的；8.x update会推高
##更新现有AUTO_INCREMENT列值
##table1_default
truncate table table1_default;
insert into table1_default(a,b) values(null,111);
select txt,a incre_col,b from table1_default order by a;
+----------------+-----------+------+
| txt            | incre_col | b    |
+----------------+-----------+------+
| table1_default |         1 |  111 |
+----------------+-----------+------+
update table1_default set a = 0,txt = '将AUTO_INCREMENT列值设置为小于/等于当前最大自增值的值' where b = 111;
insert into table1_default values(null,11,'1当前自增值=>');
select txt,a incre_col,b from table1_default order by a;
+--------------------------------------------------------------------------+-----------+------+
| txt                                                                      | incre_col | b    |
+--------------------------------------------------------------------------+-----------+------+
| 将AUTO_INCREMENT列值设置为小于/等于当前最大自增值的值                    |         0 |  111 |
| 1当前自增值=>                                                            |         2 |   11 |
+--------------------------------------------------------------------------+-----------+------+
update table1_default set a = 1111111 ,txt = '将AUTO_INCREMENT列值设置为大于当前最大自增值的值' where b = 111;
insert into table1_default values(null,11,'2当前自增值=>');
select txt,a incre_col,b from table1_default order by a;
+-------------------------------------------------------------------+-----------+------+
| txt                                                               | incre_col | b    |
+-------------------------------------------------------------------+-----------+------+
| 1当前自增值=>                                                     |         2 |   11 |
| 2当前自增值=>                                                     |         3 |   11 |
| 将AUTO_INCREMENT列值设置为大于当前最大自增值的值                  |   1111111 |  111 |
+-------------------------------------------------------------------+-----------+------+
##table2_order
truncate table table2_order;
insert into table2_order(a,b) values(null,222);
select txt,a incre_col,b from table2_order order by a;
+--------------+-----------+------+
| txt          | incre_col | b    |
+--------------+-----------+------+
| table2_order |         1 |  222 |
+--------------+-----------+------+
update table2_order set a = 0,txt = '将AUTO_INCREMENT列值设置为小于/等于当前最大自增值的值' where b = 222;
insert into table2_order values(null,22,'1当前自增值=>');
select txt,a incre_col,b from table2_order order by a;
+--------------------------------------------------------------------------+-----------+------+
| txt                                                                      | incre_col | b    |
+--------------------------------------------------------------------------+-----------+------+
| 将AUTO_INCREMENT列值设置为小于/等于当前最大自增值的值                    |         0 |  222 |
| 1当前自增值=>                                                            |         2 |   22 |
+--------------------------------------------------------------------------+-----------+------+
update table2_order set a = 20 ,txt = '将AUTO_INCREMENT列值设置为大于当前最大自增值的值' where b = 222;
insert into table2_order values(null,22,'2当前自增值=>');
select txt,a incre_col,b from table2_order order by a;
+-------------------------------------------------------------------+-----------+------+
| txt                                                               | incre_col | b    |
+-------------------------------------------------------------------+-----------+------+
| 1当前自增值=>                                                     |         2 |   22 |
| 2当前自增值=>                                                     |         3 |   22 |
| 将AUTO_INCREMENT列值设置为大于当前最大自增值的值                  |        20 |  222 |
+-------------------------------------------------------------------+-----------+------+
##table3_noorder
truncate table table3_noorder;
insert into table3_noorder(a,b) values(null,333);
select txt,a incre_col,b from table3_noorder order by a;
+----------------+-----------+------+
| txt            | incre_col | b    |
+----------------+-----------+------+
| table3_noorder |         1 |  333 |
+----------------+-----------+------+
update table3_noorder set a = 0,txt = '将AUTO_INCREMENT列值设置为小于/等于当前最大自增值的值' where b = 333;
insert into table3_noorder values(null,33,'1当前自增值=>');
select txt,a incre_col,b from table3_noorder order by a;
+--------------------------------------------------------------------------+-----------+------+
| txt                                                                      | incre_col | b    |
+--------------------------------------------------------------------------+-----------+------+
| 将AUTO_INCREMENT列值设置为小于/等于当前最大自增值的值                    |         0 |  333 |
| 1当前自增值=>                                                            |         2 |   33 |
+--------------------------------------------------------------------------+-----------+------+
update table3_noorder set a = 20 ,txt = '将AUTO_INCREMENT列值设置为大于当前最大自增值的值' where b = 333;
insert into table3_noorder values(null,33,'2当前自增值=>');
select txt,a incre_col,b from table3_noorder order by a;
+-------------------------------------------------------------------+-----------+------+
| txt                                                               | incre_col | b    |
+-------------------------------------------------------------------+-----------+------+
| 1当前自增值=>                                                     |         2 |   33 |
| 2当前自增值=>                                                     |         3 |   33 |
| 将AUTO_INCREMENT列值设置为大于当前最大自增值的值                  |        20 |  333 |
+-------------------------------------------------------------------+-----------+------+
##更新其他列值时引用AUTO_INCREMENT列
delete from table1_default;
insert into table1_default(a,b,txt) values(null,0,'update');
select txt,a incre_col,b from table1_default order by a;
+--------+-----------+------+
| txt    | incre_col | b    |
+--------+-----------+------+
| update |         4 |    0 |
+--------+-----------+------+
update table1_default set b = a+1 where txt = 'update';
insert into table1_default values(null,11,'当前自增值==>');
select txt,a incre_col,b from table1_default order by a;
+--------------------+-----------+------+
| txt                | incre_col | b    |
+--------------------+-----------+------+
| update             |         4 |    5 |
| 当前自增值==>      |         5 |   11 |
+--------------------+-----------+------+
delete from table2_order;
insert into table2_order(a,b,txt) values(null,0,'update');
select txt,a incre_col,b from table2_order order by a;
+--------+-----------+------+
| txt    | incre_col | b    |
+--------+-----------+------+
| update |         4 |    0 |
+--------+-----------+------+
update table2_order set b = a+2 where txt = 'update';
insert into table2_order values(null,22,'当前自增值==>');
select txt,a incre_col,b from table2_order order by a;
+--------------------+-----------+------+
| txt                | incre_col | b    |
+--------------------+-----------+------+
| update             |         4 |    6 |
| 当前自增值==>      |         5 |   22 |
+--------------------+-----------+------+
delete from table3_noorder;
insert into table3_noorder(a,b,txt) values(null,0,'update');
select txt,a incre_col,b from table3_noorder order by a;
+--------+-----------+------+
| txt    | incre_col | b    |
+--------+-----------+------+
| update |         4 |    0 |
+--------+-----------+------+
update table3_noorder set b = a+3 where txt = 'update';
insert into table3_noorder values(null,33,'当前自增值==>');
select txt,a incre_col,b from table3_noorder order by a;
+--------------------+-----------+------+
| txt                | incre_col | b    |
+--------------------+-----------+------+
| update             |         4 |    7 |
| 当前自增值==>      |         5 |   33 |
+--------------------+-----------+------+
###### auto_incre_3-1-4 ④SELECT操作
select a incre_col from table1_default order by a;
+-----------+
| incre_col |
+-----------+
|         4 |
|         5 |
+-----------+
select abs(a) from table1_default order by a;
+--------+
| abs(a) |
+--------+
|      4 |
|      5 |
+--------+
select a+b from table1_default order by a;
+------+
| a+b  |
+------+
|    9 |
|   16 |
+------+
select a incre_col from table2_order order by a;
+-----------+
| incre_col |
+-----------+
|         4 |
|         5 |
+-----------+
select abs(a) from table2_order order by a;
+--------+
| abs(a) |
+--------+
|      4 |
|      5 |
+--------+
select a+b from table2_order order by a;
+------+
| a+b  |
+------+
|   10 |
|   27 |
+------+
select a incre_col from table3_noorder order by a;
+-----------+
| incre_col |
+-----------+
|         4 |
|         5 |
+-----------+
select abs(a) from table3_noorder order by a;
+--------+
| abs(a) |
+--------+
|      4 |
|      5 |
+--------+
select a+b from table3_noorder order by a;
+------+
| a+b  |
+------+
|   11 |
|   38 |
+------+
############ auto_incre_2-4 ④模式切换 ############
##建表
drop table table2_order;
create table table2_order (
  a double auto_increment primary key,
  b double default 2,
  txt varchar(64) default 'table2_order'
) auto_increment_mode = 'order';
## ORDER==>ORDER
insert into table2_order(a) values(0),(0),(0),(0),(0);
select txt,a incre_col, b from table2_order order by a;
+--------------+-----------+------+
| txt          | incre_col | b    |
+--------------+-----------+------+
| table2_order |         1 |    2 |
| table2_order |         2 |    2 |
| table2_order |         3 |    2 |
| table2_order |         4 |    2 |
| table2_order |         5 |    2 |
+--------------+-----------+------+
alter table table2_order auto_increment_mode = 'ORDER';
insert into table2_order values(0,2,'ORDER==>ORDER'),(0,2,'ORDER==>ORDER'),(0,2,'ORDER==>ORDER'),(0,2,'ORDER==>ORDER');
select txt,a incre_col, b from table2_order order by a;
+---------------+-----------+------+
| txt           | incre_col | b    |
+---------------+-----------+------+
| table2_order  |         1 |    2 |
| table2_order  |         2 |    2 |
| table2_order  |         3 |    2 |
| table2_order  |         4 |    2 |
| table2_order  |         5 |    2 |
| ORDER==>ORDER |         6 |    2 |
| ORDER==>ORDER |         7 |    2 |
| ORDER==>ORDER |         8 |    2 |
| ORDER==>ORDER |         9 |    2 |
+---------------+-----------+------+
## ORDER==>NOORDER
alter table table2_order auto_increment_mode = 'NOORDER';
insert into table2_order values(0,3,'ORDER==>NOORDER'),(0,3,'ORDER==>NOORDER'),(0,3,'ORDER==>NOORDER'),(0,3,'ORDER==>NOORDER');
select txt,a incre_col, b from table2_order order by a;
+-----------------+-----------+------+
| txt             | incre_col | b    |
+-----------------+-----------+------+
| table2_order    |         1 |    2 |
| table2_order    |         2 |    2 |
| table2_order    |         3 |    2 |
| table2_order    |         4 |    2 |
| table2_order    |         5 |    2 |
| ORDER==>ORDER   |         6 |    2 |
| ORDER==>ORDER   |         7 |    2 |
| ORDER==>ORDER   |         8 |    2 |
| ORDER==>ORDER   |         9 |    2 |
| ORDER==>NOORDER |   1000001 |    3 |
| ORDER==>NOORDER |   1000002 |    3 |
| ORDER==>NOORDER |   1000003 |    3 |
| ORDER==>NOORDER |   1000004 |    3 |
+-----------------+-----------+------+
## NOORDER==>NOORDER
alter table table2_order auto_increment_mode = 'NOORDER';
insert into table2_order values(0,4,'NOORDER==>NOORDER'),(0,4,'NOORDER==>NOORDER'),(0,4,'NOORDER==>NOORDER'),(0,4,'NOORDER==>NOORDER');
select txt,a incre_col, b from table2_order order by a;
+-------------------+-----------+------+
| txt               | incre_col | b    |
+-------------------+-----------+------+
| table2_order      |         1 |    2 |
| table2_order      |         2 |    2 |
| table2_order      |         3 |    2 |
| table2_order      |         4 |    2 |
| table2_order      |         5 |    2 |
| ORDER==>ORDER     |         6 |    2 |
| ORDER==>ORDER     |         7 |    2 |
| ORDER==>ORDER     |         8 |    2 |
| ORDER==>ORDER     |         9 |    2 |
| ORDER==>NOORDER   |   1000001 |    3 |
| ORDER==>NOORDER   |   1000002 |    3 |
| ORDER==>NOORDER   |   1000003 |    3 |
| ORDER==>NOORDER   |   1000004 |    3 |
| NOORDER==>NOORDER |   1000005 |    4 |
| NOORDER==>NOORDER |   1000006 |    4 |
| NOORDER==>NOORDER |   1000007 |    4 |
| NOORDER==>NOORDER |   1000008 |    4 |
+-------------------+-----------+------+
## NOORDER==>ORDER
alter table table2_order auto_increment_mode = 'ORDER';
insert into table2_order values(0,5,'NOORDER==>ORDER'),(0,5,'NOORDER==>ORDER'),(0,5,'NOORDER==>ORDER'),(0,5,'NOORDER==>ORDER');
select txt,a incre_col, b from table2_order order by a;
+-------------------+-----------+------+
| txt               | incre_col | b    |
+-------------------+-----------+------+
| table2_order      |         1 |    2 |
| table2_order      |         2 |    2 |
| table2_order      |         3 |    2 |
| table2_order      |         4 |    2 |
| table2_order      |         5 |    2 |
| ORDER==>ORDER     |         6 |    2 |
| ORDER==>ORDER     |         7 |    2 |
| ORDER==>ORDER     |         8 |    2 |
| ORDER==>ORDER     |         9 |    2 |
| ORDER==>NOORDER   |   1000001 |    3 |
| ORDER==>NOORDER   |   1000002 |    3 |
| ORDER==>NOORDER   |   1000003 |    3 |
| ORDER==>NOORDER   |   1000004 |    3 |
| NOORDER==>NOORDER |   1000005 |    4 |
| NOORDER==>NOORDER |   1000006 |    4 |
| NOORDER==>NOORDER |   1000007 |    4 |
| NOORDER==>NOORDER |   1000008 |    4 |
| NOORDER==>ORDER   |   2000001 |    5 |
| NOORDER==>ORDER   |   2000002 |    5 |
| NOORDER==>ORDER   |   2000003 |    5 |
| NOORDER==>ORDER   |   2000004 |    5 |
+-------------------+-----------+------+
insert into table2_order values(0,6,'NOORDER==>ORDER test');
select txt,a incre_col, b from table2_order order by a;
+----------------------+-----------+------+
| txt                  | incre_col | b    |
+----------------------+-----------+------+
| table2_order         |         1 |    2 |
| table2_order         |         2 |    2 |
| table2_order         |         3 |    2 |
| table2_order         |         4 |    2 |
| table2_order         |         5 |    2 |
| ORDER==>ORDER        |         6 |    2 |
| ORDER==>ORDER        |         7 |    2 |
| ORDER==>ORDER        |         8 |    2 |
| ORDER==>ORDER        |         9 |    2 |
| ORDER==>NOORDER      |   1000001 |    3 |
| ORDER==>NOORDER      |   1000002 |    3 |
| ORDER==>NOORDER      |   1000003 |    3 |
| ORDER==>NOORDER      |   1000004 |    3 |
| NOORDER==>NOORDER    |   1000005 |    4 |
| NOORDER==>NOORDER    |   1000006 |    4 |
| NOORDER==>NOORDER    |   1000007 |    4 |
| NOORDER==>NOORDER    |   1000008 |    4 |
| NOORDER==>ORDER      |   2000001 |    5 |
| NOORDER==>ORDER      |   2000002 |    5 |
| NOORDER==>ORDER      |   2000003 |    5 |
| NOORDER==>ORDER      |   2000004 |    5 |
| NOORDER==>ORDER test |   2000005 |    6 |
+----------------------+-----------+------+
update table2_order set a = 10 where b = 6;
insert into table2_order values(null,22,'当前自增值==>');
select txt,a incre_col, b from table2_order order by a;
+----------------------+-----------+------+
| txt                  | incre_col | b    |
+----------------------+-----------+------+
| table2_order         |         1 |    2 |
| table2_order         |         2 |    2 |
| table2_order         |         3 |    2 |
| table2_order         |         4 |    2 |
| table2_order         |         5 |    2 |
| ORDER==>ORDER        |         6 |    2 |
| ORDER==>ORDER        |         7 |    2 |
| ORDER==>ORDER        |         8 |    2 |
| ORDER==>ORDER        |         9 |    2 |
| NOORDER==>ORDER test |        10 |    6 |
| ORDER==>NOORDER      |   1000001 |    3 |
| ORDER==>NOORDER      |   1000002 |    3 |
| ORDER==>NOORDER      |   1000003 |    3 |
| ORDER==>NOORDER      |   1000004 |    3 |
| NOORDER==>NOORDER    |   1000005 |    4 |
| NOORDER==>NOORDER    |   1000006 |    4 |
| NOORDER==>NOORDER    |   1000007 |    4 |
| NOORDER==>NOORDER    |   1000008 |    4 |
| NOORDER==>ORDER      |   2000001 |    5 |
| NOORDER==>ORDER      |   2000002 |    5 |
| NOORDER==>ORDER      |   2000003 |    5 |
| NOORDER==>ORDER      |   2000004 |    5 |
| 当前自增值==>        |   2000006 |   22 |
+----------------------+-----------+------+
##########################################################################################################################
############ auto_incre_1-1-1
############ 数据类型（DECIMAL/NUMERIC 类型）
##建表
drop table table1_default;
create table table1_default (
  a decimal auto_increment,
  b decimal default 1,
  txt varchar(64) default 'table1_default'
);
ERROR 42000: Incorrect column specifier for column 'a'
drop table table2_order;
create table table2_order (
  a decimal auto_increment,
  b decimal default 2,
  txt varchar(64) default 'table2_order'
) auto_increment_mode = 'order';
ERROR 42000: Incorrect column specifier for column 'a'
drop table table3_noorder;
create table table3_noorder (
  a decimal auto_increment,
  b decimal default 3,
  txt varchar(64) default 'table3_noorder'
) auto_increment_mode = 'noorder';
ERROR 42000: Incorrect column specifier for column 'a'
##建表
drop table table1_default;
create table table1_default (
  a numeric auto_increment,
  b numeric default 1,
  txt varchar(64) default 'table1_default'
);
ERROR 42000: Incorrect column specifier for column 'a'
drop table table2_order;
create table table2_order (
  a numeric auto_increment,
  b numeric default 2,
  txt varchar(64) default 'table2_order'
) auto_increment_mode = 'order';
ERROR 42000: Incorrect column specifier for column 'a'
drop table table3_noorder;
create table table3_noorder (
  a numeric auto_increment,
  b numeric default 3,
  txt varchar(64) default 'table3_noorder'
) auto_increment_mode = 'noorder';
ERROR 42000: Incorrect column specifier for column 'a'
drop table table1_default;
drop table table2_order;
drop table table3_noorder;
drop table table0_date;
# Clean up users
drop user whh@'%';
drop database if exists whh ;
