purge recyclebin;
result_format: 4
drop user whh@'%';
drop database if exists whh ;
create user whh identified by 'whh';
create database whh ;
grant all on *.* to whh with grant option;


##测试每种场合时，起始条件可能不同，可以删除再重新创建表
set sql_mode='strict_all_tables,no_zero_in_date';
alter system set default_auto_increment_mode = 'order';
##########################################################################################################################
###### 标签：auto_incre_1-1，auto_incre_1-3，auto_incre_2，auto_incre_3-1
###### 功能：数据类型（INT），分区表，自增模式，DML操作 
########################################################################################################################## 
############ key分区
##建表
drop table table0_date;
create table table0_date (
  a int,
  b int default 0,
  txt varchar(64) default 'table0_date'
);
insert into table0_date(a) values(110),(111),(112),(210),(211),(212);
drop table table1_default;
create table table1_default (
  a int not null auto_increment primary key,
  b int default 1,
  txt varchar(64) default 'table1_default 默认order模式',
  unique index(a)
)partition by key(a) partitions 4;
drop table table2_order;
create table table2_order (
  a int not null auto_increment primary key,
  b int default 2,
  txt varchar(64) default 'table2_order order模式',
  unique index(a)
) auto_increment_mode = 'order' 
partition by key(a) partitions 4;
drop table table3_noorder;
create table table3_noorder (
  a int not null auto_increment primary key,
  b int default 3,
  txt varchar(64) default 'table3_noorder noorder模式',
  unique index(a)
) auto_increment_mode = 'noorder' 
partition by key(a) partitions 4;
############ auto_incre_3-1 DML操作 ############
###### auto_incre_3-1-1 ①INSERT操作 
##简单插入
##INSERT 语句
##table1_default
insert into table1_default(a) values(null);
insert into table1_default(a) values(null),(null),(null);
select txt,a incre_col,b from table1_default order by a;
+----------------------------------+-----------+------+
| txt                              | incre_col | b    |
+----------------------------------+-----------+------+
| table1_default 默认order模式     |         1 |    1 |
| table1_default 默认order模式     |         2 |    1 |
| table1_default 默认order模式     |         3 |    1 |
| table1_default 默认order模式     |         4 |    1 |
+----------------------------------+-----------+------+
insert into table1_default(a) values(10);
insert into table1_default(a,txt) values(0,'最新自增值=>');
select txt,a incre_col,b from table1_default order by a;
+----------------------------------+-----------+------+
| txt                              | incre_col | b    |
+----------------------------------+-----------+------+
| table1_default 默认order模式     |         1 |    1 |
| table1_default 默认order模式     |         2 |    1 |
| table1_default 默认order模式     |         3 |    1 |
| table1_default 默认order模式     |         4 |    1 |
| table1_default 默认order模式     |        10 |    1 |
| 最新自增值=>                     |        11 |    1 |
+----------------------------------+-----------+------+
##table2_order
insert into table2_order(a) values(null);
insert into table2_order(a) values(null),(null),(null);
select txt,a incre_col,b from table2_order order by a;
+--------------------------+-----------+------+
| txt                      | incre_col | b    |
+--------------------------+-----------+------+
| table2_order order模式   |         1 |    2 |
| table2_order order模式   |         2 |    2 |
| table2_order order模式   |         3 |    2 |
| table2_order order模式   |         4 |    2 |
+--------------------------+-----------+------+
insert into table2_order(a) values(10);
insert into table2_order(a,txt) values(0,'最新自增值=>');
select txt,a incre_col,b from table2_order order by a;
+--------------------------+-----------+------+
| txt                      | incre_col | b    |
+--------------------------+-----------+------+
| table2_order order模式   |         1 |    2 |
| table2_order order模式   |         2 |    2 |
| table2_order order模式   |         3 |    2 |
| table2_order order模式   |         4 |    2 |
| table2_order order模式   |        10 |    2 |
| 最新自增值=>             |        11 |    2 |
+--------------------------+-----------+------+
##table3_noorder
insert into table3_noorder(a) values(null);
insert into table3_noorder(a) values(null),(null),(null);
select txt,a incre_col,b from table3_noorder order by a;
+------------------------------+-----------+------+
| txt                          | incre_col | b    |
+------------------------------+-----------+------+
| table3_noorder noorder模式   |         1 |    3 |
| table3_noorder noorder模式   |         2 |    3 |
| table3_noorder noorder模式   |         3 |    3 |
| table3_noorder noorder模式   |         4 |    3 |
+------------------------------+-----------+------+
insert into table3_noorder(a) values(10);
insert into table3_noorder(a,txt) values(0,'最新自增值=>');
select txt,a incre_col,b from table3_noorder order by a;
+------------------------------+-----------+------+
| txt                          | incre_col | b    |
+------------------------------+-----------+------+
| table3_noorder noorder模式   |         1 |    3 |
| table3_noorder noorder模式   |         2 |    3 |
| table3_noorder noorder模式   |         3 |    3 |
| table3_noorder noorder模式   |         4 |    3 |
| table3_noorder noorder模式   |        10 |    3 |
| 最新自增值=>                 |   1000001 |    3 |
+------------------------------+-----------+------+
##REPLACE 语句
replace into table1_default(a) values(0),(0),(0);
select txt,a incre_col,b from table1_default order by a;
+----------------------------------+-----------+------+
| txt                              | incre_col | b    |
+----------------------------------+-----------+------+
| table1_default 默认order模式     |         1 |    1 |
| table1_default 默认order模式     |         2 |    1 |
| table1_default 默认order模式     |         3 |    1 |
| table1_default 默认order模式     |         4 |    1 |
| table1_default 默认order模式     |        10 |    1 |
| 最新自增值=>                     |        11 |    1 |
| table1_default 默认order模式     |        12 |    1 |
| table1_default 默认order模式     |        13 |    1 |
| table1_default 默认order模式     |        14 |    1 |
+----------------------------------+-----------+------+
replace into table2_order(a) values(0),(0),(0);
select txt,a incre_col,b from table2_order order by a;
+--------------------------+-----------+------+
| txt                      | incre_col | b    |
+--------------------------+-----------+------+
| table2_order order模式   |         1 |    2 |
| table2_order order模式   |         2 |    2 |
| table2_order order模式   |         3 |    2 |
| table2_order order模式   |         4 |    2 |
| table2_order order模式   |        10 |    2 |
| 最新自增值=>             |        11 |    2 |
| table2_order order模式   |        12 |    2 |
| table2_order order模式   |        13 |    2 |
| table2_order order模式   |        14 |    2 |
+--------------------------+-----------+------+
replace into table3_noorder(a) values(null),(null),(null);
select txt,a incre_col,b from table3_noorder order by a;
+------------------------------+-----------+------+
| txt                          | incre_col | b    |
+------------------------------+-----------+------+
| table3_noorder noorder模式   |         1 |    3 |
| table3_noorder noorder模式   |         2 |    3 |
| table3_noorder noorder模式   |         3 |    3 |
| table3_noorder noorder模式   |         4 |    3 |
| table3_noorder noorder模式   |        10 |    3 |
| 最新自增值=>                 |   1000001 |    3 |
| table3_noorder noorder模式   |   1000002 |    3 |
| table3_noorder noorder模式   |   1000003 |    3 |
| table3_noorder noorder模式   |   1000004 |    3 |
+------------------------------+-----------+------+
##测试点 - 将任何其他值插入 AUTO_INCREMENT列
##INSERT 语句
insert into table1_default(a) values(15),(-25),(35),(45.5);
insert into table1_default(a,txt) values(0,'最新自增值=>');
select txt,a incre_col,b from table1_default order by a;
+----------------------------------+-----------+------+
| txt                              | incre_col | b    |
+----------------------------------+-----------+------+
| table1_default 默认order模式     |       -25 |    1 |
| table1_default 默认order模式     |         1 |    1 |
| table1_default 默认order模式     |         2 |    1 |
| table1_default 默认order模式     |         3 |    1 |
| table1_default 默认order模式     |         4 |    1 |
| table1_default 默认order模式     |        10 |    1 |
| 最新自增值=>                     |        11 |    1 |
| table1_default 默认order模式     |        12 |    1 |
| table1_default 默认order模式     |        13 |    1 |
| table1_default 默认order模式     |        14 |    1 |
| table1_default 默认order模式     |        15 |    1 |
| table1_default 默认order模式     |        35 |    1 |
| table1_default 默认order模式     |        46 |    1 |
| 最新自增值=>                     |        47 |    1 |
+----------------------------------+-----------+------+
insert into table2_order(a) values(15),(-25),(35),(45.5);
insert into table2_order(a,txt) values(0,'最新自增值=>');
select txt,a incre_col,b from table2_order order by a;
+--------------------------+-----------+------+
| txt                      | incre_col | b    |
+--------------------------+-----------+------+
| table2_order order模式   |       -25 |    2 |
| table2_order order模式   |         1 |    2 |
| table2_order order模式   |         2 |    2 |
| table2_order order模式   |         3 |    2 |
| table2_order order模式   |         4 |    2 |
| table2_order order模式   |        10 |    2 |
| 最新自增值=>             |        11 |    2 |
| table2_order order模式   |        12 |    2 |
| table2_order order模式   |        13 |    2 |
| table2_order order模式   |        14 |    2 |
| table2_order order模式   |        15 |    2 |
| table2_order order模式   |        35 |    2 |
| table2_order order模式   |        46 |    2 |
| 最新自增值=>             |        47 |    2 |
+--------------------------+-----------+------+
insert into table3_noorder(a) values(15),(-25),(35),(45.5);
insert into table3_noorder(a,txt) values(0,'最新自增值=>');
select txt,a incre_col,b from table3_noorder order by a;
+------------------------------+-----------+------+
| txt                          | incre_col | b    |
+------------------------------+-----------+------+
| table3_noorder noorder模式   |       -25 |    3 |
| table3_noorder noorder模式   |         1 |    3 |
| table3_noorder noorder模式   |         2 |    3 |
| table3_noorder noorder模式   |         3 |    3 |
| table3_noorder noorder模式   |         4 |    3 |
| table3_noorder noorder模式   |        10 |    3 |
| table3_noorder noorder模式   |        15 |    3 |
| table3_noorder noorder模式   |        35 |    3 |
| table3_noorder noorder模式   |        46 |    3 |
| 最新自增值=>                 |   1000001 |    3 |
| table3_noorder noorder模式   |   1000002 |    3 |
| table3_noorder noorder模式   |   1000003 |    3 |
| table3_noorder noorder模式   |   1000004 |    3 |
| 最新自增值=>                 |   1000005 |    3 |
+------------------------------+-----------+------+
##批量插入
##INSERT ... SELECT语句
insert into table1_default select a,b,txt from table0_date where a <= 200;
select txt,a incre_col,b from table1_default order by a;
+----------------------------------+-----------+------+
| txt                              | incre_col | b    |
+----------------------------------+-----------+------+
| table1_default 默认order模式     |       -25 |    1 |
| table1_default 默认order模式     |         1 |    1 |
| table1_default 默认order模式     |         2 |    1 |
| table1_default 默认order模式     |         3 |    1 |
| table1_default 默认order模式     |         4 |    1 |
| table1_default 默认order模式     |        10 |    1 |
| 最新自增值=>                     |        11 |    1 |
| table1_default 默认order模式     |        12 |    1 |
| table1_default 默认order模式     |        13 |    1 |
| table1_default 默认order模式     |        14 |    1 |
| table1_default 默认order模式     |        15 |    1 |
| table1_default 默认order模式     |        35 |    1 |
| table1_default 默认order模式     |        46 |    1 |
| 最新自增值=>                     |        47 |    1 |
| table0_date                      |       110 |    0 |
| table0_date                      |       111 |    0 |
| table0_date                      |       112 |    0 |
+----------------------------------+-----------+------+
insert into table1_default(a,txt) values(0,'最新自增值=>');
select txt,a incre_col,b from table1_default order by a;
+----------------------------------+-----------+------+
| txt                              | incre_col | b    |
+----------------------------------+-----------+------+
| table1_default 默认order模式     |       -25 |    1 |
| table1_default 默认order模式     |         1 |    1 |
| table1_default 默认order模式     |         2 |    1 |
| table1_default 默认order模式     |         3 |    1 |
| table1_default 默认order模式     |         4 |    1 |
| table1_default 默认order模式     |        10 |    1 |
| 最新自增值=>                     |        11 |    1 |
| table1_default 默认order模式     |        12 |    1 |
| table1_default 默认order模式     |        13 |    1 |
| table1_default 默认order模式     |        14 |    1 |
| table1_default 默认order模式     |        15 |    1 |
| table1_default 默认order模式     |        35 |    1 |
| table1_default 默认order模式     |        46 |    1 |
| 最新自增值=>                     |        47 |    1 |
| table0_date                      |       110 |    0 |
| table0_date                      |       111 |    0 |
| table0_date                      |       112 |    0 |
| 最新自增值=>                     |       113 |    1 |
+----------------------------------+-----------+------+
insert into table2_order select a,b,txt from table0_date where a <= 200;
select txt,a incre_col,b from table2_order order by a;
+--------------------------+-----------+------+
| txt                      | incre_col | b    |
+--------------------------+-----------+------+
| table2_order order模式   |       -25 |    2 |
| table2_order order模式   |         1 |    2 |
| table2_order order模式   |         2 |    2 |
| table2_order order模式   |         3 |    2 |
| table2_order order模式   |         4 |    2 |
| table2_order order模式   |        10 |    2 |
| 最新自增值=>             |        11 |    2 |
| table2_order order模式   |        12 |    2 |
| table2_order order模式   |        13 |    2 |
| table2_order order模式   |        14 |    2 |
| table2_order order模式   |        15 |    2 |
| table2_order order模式   |        35 |    2 |
| table2_order order模式   |        46 |    2 |
| 最新自增值=>             |        47 |    2 |
| table0_date              |       110 |    0 |
| table0_date              |       111 |    0 |
| table0_date              |       112 |    0 |
+--------------------------+-----------+------+
insert into table2_order(a,txt) values(0,'最新自增值=>');
select txt,a incre_col,b from table2_order order by a;
+--------------------------+-----------+------+
| txt                      | incre_col | b    |
+--------------------------+-----------+------+
| table2_order order模式   |       -25 |    2 |
| table2_order order模式   |         1 |    2 |
| table2_order order模式   |         2 |    2 |
| table2_order order模式   |         3 |    2 |
| table2_order order模式   |         4 |    2 |
| table2_order order模式   |        10 |    2 |
| 最新自增值=>             |        11 |    2 |
| table2_order order模式   |        12 |    2 |
| table2_order order模式   |        13 |    2 |
| table2_order order模式   |        14 |    2 |
| table2_order order模式   |        15 |    2 |
| table2_order order模式   |        35 |    2 |
| table2_order order模式   |        46 |    2 |
| 最新自增值=>             |        47 |    2 |
| table0_date              |       110 |    0 |
| table0_date              |       111 |    0 |
| table0_date              |       112 |    0 |
| 最新自增值=>             |       113 |    2 |
+--------------------------+-----------+------+
insert into table3_noorder select a,b,txt from table0_date where a <= 200;
select txt,a incre_col,b from table3_noorder order by a;
+------------------------------+-----------+------+
| txt                          | incre_col | b    |
+------------------------------+-----------+------+
| table3_noorder noorder模式   |       -25 |    3 |
| table3_noorder noorder模式   |         1 |    3 |
| table3_noorder noorder模式   |         2 |    3 |
| table3_noorder noorder模式   |         3 |    3 |
| table3_noorder noorder模式   |         4 |    3 |
| table3_noorder noorder模式   |        10 |    3 |
| table3_noorder noorder模式   |        15 |    3 |
| table3_noorder noorder模式   |        35 |    3 |
| table3_noorder noorder模式   |        46 |    3 |
| table0_date                  |       110 |    0 |
| table0_date                  |       111 |    0 |
| table0_date                  |       112 |    0 |
| 最新自增值=>                 |   1000001 |    3 |
| table3_noorder noorder模式   |   1000002 |    3 |
| table3_noorder noorder模式   |   1000003 |    3 |
| table3_noorder noorder模式   |   1000004 |    3 |
| 最新自增值=>                 |   1000005 |    3 |
+------------------------------+-----------+------+
insert into table3_noorder(a,txt) values(0,'最新自增值=>');
select txt,a incre_col,b from table3_noorder order by a;
+------------------------------+-----------+------+
| txt                          | incre_col | b    |
+------------------------------+-----------+------+
| table3_noorder noorder模式   |       -25 |    3 |
| table3_noorder noorder模式   |         1 |    3 |
| table3_noorder noorder模式   |         2 |    3 |
| table3_noorder noorder模式   |         3 |    3 |
| table3_noorder noorder模式   |         4 |    3 |
| table3_noorder noorder模式   |        10 |    3 |
| table3_noorder noorder模式   |        15 |    3 |
| table3_noorder noorder模式   |        35 |    3 |
| table3_noorder noorder模式   |        46 |    3 |
| table0_date                  |       110 |    0 |
| table0_date                  |       111 |    0 |
| table0_date                  |       112 |    0 |
| 最新自增值=>                 |   1000001 |    3 |
| table3_noorder noorder模式   |   1000002 |    3 |
| table3_noorder noorder模式   |   1000003 |    3 |
| table3_noorder noorder模式   |   1000004 |    3 |
| 最新自增值=>                 |   1000005 |    3 |
| 最新自增值=>                 |   1000006 |    3 |
+------------------------------+-----------+------+
##混合插入
##INSERT ... ON DUPLICATE KEY UPDATE 语句
insert into table1_default (a,b,txt) values (1,1,'重复场合') on duplicate key update b=b+1,txt='insert...on duplicate key update 语句';
insert into table1_default(a,txt) values(0,'最新自增值1=>');
select txt,a incre_col,b from table1_default order by a;
+-----------------------------------------+-----------+------+
| txt                                     | incre_col | b    |
+-----------------------------------------+-----------+------+
| table1_default 默认order模式            |       -25 |    1 |
| insert...on duplicate key update 语句   |         1 |    2 |
| table1_default 默认order模式            |         2 |    1 |
| table1_default 默认order模式            |         3 |    1 |
| table1_default 默认order模式            |         4 |    1 |
| table1_default 默认order模式            |        10 |    1 |
| 最新自增值=>                            |        11 |    1 |
| table1_default 默认order模式            |        12 |    1 |
| table1_default 默认order模式            |        13 |    1 |
| table1_default 默认order模式            |        14 |    1 |
| table1_default 默认order模式            |        15 |    1 |
| table1_default 默认order模式            |        35 |    1 |
| table1_default 默认order模式            |        46 |    1 |
| 最新自增值=>                            |        47 |    1 |
| table0_date                             |       110 |    0 |
| table0_date                             |       111 |    0 |
| table0_date                             |       112 |    0 |
| 最新自增值=>                            |       113 |    1 |
| 最新自增值1=>                           |       114 |    1 |
+-----------------------------------------+-----------+------+
insert into table1_default (a,b,txt) values (50,1,'不重复场合') on duplicate key update b=b+1,txt='insert...on duplicate key update 语句';
insert into table1_default(a,txt) values(0,'最新自增值2=>');
select txt,a incre_col,b from table1_default order by a;
+-----------------------------------------+-----------+------+
| txt                                     | incre_col | b    |
+-----------------------------------------+-----------+------+
| table1_default 默认order模式            |       -25 |    1 |
| insert...on duplicate key update 语句   |         1 |    2 |
| table1_default 默认order模式            |         2 |    1 |
| table1_default 默认order模式            |         3 |    1 |
| table1_default 默认order模式            |         4 |    1 |
| table1_default 默认order模式            |        10 |    1 |
| 最新自增值=>                            |        11 |    1 |
| table1_default 默认order模式            |        12 |    1 |
| table1_default 默认order模式            |        13 |    1 |
| table1_default 默认order模式            |        14 |    1 |
| table1_default 默认order模式            |        15 |    1 |
| table1_default 默认order模式            |        35 |    1 |
| table1_default 默认order模式            |        46 |    1 |
| 最新自增值=>                            |        47 |    1 |
| 不重复场合                              |        50 |    1 |
| table0_date                             |       110 |    0 |
| table0_date                             |       111 |    0 |
| table0_date                             |       112 |    0 |
| 最新自增值=>                            |       113 |    1 |
| 最新自增值1=>                           |       114 |    1 |
| 最新自增值2=>                           |       115 |    1 |
+-----------------------------------------+-----------+------+
insert into table2_order (a,b,txt) values (1,2,'重复场合') on duplicate key update b=b+1,txt='insert...on duplicate key update 语句';
insert into table2_order(a,txt) values(0,'最新自增值1=>');
select txt,a incre_col,b from table2_order order by a;
+-----------------------------------------+-----------+------+
| txt                                     | incre_col | b    |
+-----------------------------------------+-----------+------+
| table2_order order模式                  |       -25 |    2 |
| insert...on duplicate key update 语句   |         1 |    3 |
| table2_order order模式                  |         2 |    2 |
| table2_order order模式                  |         3 |    2 |
| table2_order order模式                  |         4 |    2 |
| table2_order order模式                  |        10 |    2 |
| 最新自增值=>                            |        11 |    2 |
| table2_order order模式                  |        12 |    2 |
| table2_order order模式                  |        13 |    2 |
| table2_order order模式                  |        14 |    2 |
| table2_order order模式                  |        15 |    2 |
| table2_order order模式                  |        35 |    2 |
| table2_order order模式                  |        46 |    2 |
| 最新自增值=>                            |        47 |    2 |
| table0_date                             |       110 |    0 |
| table0_date                             |       111 |    0 |
| table0_date                             |       112 |    0 |
| 最新自增值=>                            |       113 |    2 |
| 最新自增值1=>                           |       114 |    2 |
+-----------------------------------------+-----------+------+
insert into table2_order (a,b,txt) values (50,2,'不重复场合') on duplicate key update b=b+1,txt='insert...on duplicate key update 语句';
insert into table2_order(a,txt) values(0,'最新自增值2=>');
select txt,a incre_col,b from table2_order order by a;
+-----------------------------------------+-----------+------+
| txt                                     | incre_col | b    |
+-----------------------------------------+-----------+------+
| table2_order order模式                  |       -25 |    2 |
| insert...on duplicate key update 语句   |         1 |    3 |
| table2_order order模式                  |         2 |    2 |
| table2_order order模式                  |         3 |    2 |
| table2_order order模式                  |         4 |    2 |
| table2_order order模式                  |        10 |    2 |
| 最新自增值=>                            |        11 |    2 |
| table2_order order模式                  |        12 |    2 |
| table2_order order模式                  |        13 |    2 |
| table2_order order模式                  |        14 |    2 |
| table2_order order模式                  |        15 |    2 |
| table2_order order模式                  |        35 |    2 |
| table2_order order模式                  |        46 |    2 |
| 最新自增值=>                            |        47 |    2 |
| 不重复场合                              |        50 |    2 |
| table0_date                             |       110 |    0 |
| table0_date                             |       111 |    0 |
| table0_date                             |       112 |    0 |
| 最新自增值=>                            |       113 |    2 |
| 最新自增值1=>                           |       114 |    2 |
| 最新自增值2=>                           |       115 |    2 |
+-----------------------------------------+-----------+------+
insert into table3_noorder (a,b,txt) values (1,3,'重复场合') on duplicate key update b=b+1,txt='insert...on duplicate key update 语句';
insert into table3_noorder(a,txt) values(0,'最新自增值1=>');
select txt,a incre_col,b from table3_noorder order by a;
+-----------------------------------------+-----------+------+
| txt                                     | incre_col | b    |
+-----------------------------------------+-----------+------+
| table3_noorder noorder模式              |       -25 |    3 |
| insert...on duplicate key update 语句   |         1 |    4 |
| table3_noorder noorder模式              |         2 |    3 |
| table3_noorder noorder模式              |         3 |    3 |
| table3_noorder noorder模式              |         4 |    3 |
| table3_noorder noorder模式              |        10 |    3 |
| table3_noorder noorder模式              |        15 |    3 |
| table3_noorder noorder模式              |        35 |    3 |
| table3_noorder noorder模式              |        46 |    3 |
| table0_date                             |       110 |    0 |
| table0_date                             |       111 |    0 |
| table0_date                             |       112 |    0 |
| 最新自增值=>                            |   1000001 |    3 |
| table3_noorder noorder模式              |   1000002 |    3 |
| table3_noorder noorder模式              |   1000003 |    3 |
| table3_noorder noorder模式              |   1000004 |    3 |
| 最新自增值=>                            |   1000005 |    3 |
| 最新自增值=>                            |   1000006 |    3 |
| 最新自增值1=>                           |   1000007 |    3 |
+-----------------------------------------+-----------+------+
insert into table3_noorder (a,b,txt) values (50,3,'不重复场合') on duplicate key update b=b+1,txt='insert...on duplicate key update 语句';
insert into table3_noorder(a,txt) values(0,'最新自增值2=>');
select txt,a incre_col,b from table3_noorder order by a;
+-----------------------------------------+-----------+------+
| txt                                     | incre_col | b    |
+-----------------------------------------+-----------+------+
| table3_noorder noorder模式              |       -25 |    3 |
| insert...on duplicate key update 语句   |         1 |    4 |
| table3_noorder noorder模式              |         2 |    3 |
| table3_noorder noorder模式              |         3 |    3 |
| table3_noorder noorder模式              |         4 |    3 |
| table3_noorder noorder模式              |        10 |    3 |
| table3_noorder noorder模式              |        15 |    3 |
| table3_noorder noorder模式              |        35 |    3 |
| table3_noorder noorder模式              |        46 |    3 |
| 不重复场合                              |        50 |    3 |
| table0_date                             |       110 |    0 |
| table0_date                             |       111 |    0 |
| table0_date                             |       112 |    0 |
| 最新自增值=>                            |   1000001 |    3 |
| table3_noorder noorder模式              |   1000002 |    3 |
| table3_noorder noorder模式              |   1000003 |    3 |
| table3_noorder noorder模式              |   1000004 |    3 |
| 最新自增值=>                            |   1000005 |    3 |
| 最新自增值=>                            |   1000006 |    3 |
| 最新自增值1=>                           |   1000007 |    3 |
| 最新自增值2=>                           |   1000008 |    3 |
+-----------------------------------------+-----------+------+
##将NULL和任何其他值混合插入 AUTO_INCREMENT列
##INSERT 语句
drop table table1_default;
create table table1_default (
  a int not null auto_increment primary key,
  b int default 1,
  txt varchar(64) default 'table1_default 默认order模式',
  unique index(a)
)partition by key(a) partitions 4;
drop table table2_order;
create table table2_order (
  a int not null auto_increment primary key,
  b int default 2,
  txt varchar(64) default 'table2_order order模式',
  unique index(a)
) auto_increment_mode = 'order' 
partition by key(a) partitions 4;
drop table table3_noorder;
create table table3_noorder (
  a int not null auto_increment primary key,
  b int default 3,
  txt varchar(64) default 'table3_noorder noorder模式',
  unique index(a)
) auto_increment_mode = 'noorder' 
partition by key(a) partitions 4;
insert into table1_default(a) values(null),(15),(null),(null),(25);
insert into table1_default(a,txt) values(0,'最新自增值1=>');
select txt,a incre_col,b from table1_default order by a;
+----------------------------------+-----------+------+
| txt                              | incre_col | b    |
+----------------------------------+-----------+------+
| table1_default 默认order模式     |         1 |    1 |
| table1_default 默认order模式     |        15 |    1 |
| table1_default 默认order模式     |        16 |    1 |
| table1_default 默认order模式     |        17 |    1 |
| table1_default 默认order模式     |        25 |    1 |
| 最新自增值1=>                    |        26 |    1 |
+----------------------------------+-----------+------+
insert into table1_default(a) values(null),(null),(null),(35);
insert into table1_default(a,txt) values(0,'最新自增值2=>');
select txt,a incre_col,b from table1_default order by a;
+----------------------------------+-----------+------+
| txt                              | incre_col | b    |
+----------------------------------+-----------+------+
| table1_default 默认order模式     |         1 |    1 |
| table1_default 默认order模式     |        15 |    1 |
| table1_default 默认order模式     |        16 |    1 |
| table1_default 默认order模式     |        17 |    1 |
| table1_default 默认order模式     |        25 |    1 |
| 最新自增值1=>                    |        26 |    1 |
| table1_default 默认order模式     |        27 |    1 |
| table1_default 默认order模式     |        28 |    1 |
| table1_default 默认order模式     |        29 |    1 |
| table1_default 默认order模式     |        35 |    1 |
| 最新自增值2=>                    |        36 |    1 |
+----------------------------------+-----------+------+
insert into table2_order(a) values(null),(15),(null),(null),(25);
insert into table2_order(a,txt) values(0,'最新自增值1=>');
select txt,a incre_col,b from table2_order order by a;
+--------------------------+-----------+------+
| txt                      | incre_col | b    |
+--------------------------+-----------+------+
| table2_order order模式   |         1 |    2 |
| table2_order order模式   |        15 |    2 |
| table2_order order模式   |        16 |    2 |
| table2_order order模式   |        17 |    2 |
| table2_order order模式   |        25 |    2 |
| 最新自增值1=>            |        26 |    2 |
+--------------------------+-----------+------+
insert into table2_order(a) values(null),(null),(null),(35);
insert into table2_order(a,txt) values(0,'最新自增值2=>');
select txt,a incre_col,b from table2_order order by a;
+--------------------------+-----------+------+
| txt                      | incre_col | b    |
+--------------------------+-----------+------+
| table2_order order模式   |         1 |    2 |
| table2_order order模式   |        15 |    2 |
| table2_order order模式   |        16 |    2 |
| table2_order order模式   |        17 |    2 |
| table2_order order模式   |        25 |    2 |
| 最新自增值1=>            |        26 |    2 |
| table2_order order模式   |        27 |    2 |
| table2_order order模式   |        28 |    2 |
| table2_order order模式   |        29 |    2 |
| table2_order order模式   |        35 |    2 |
| 最新自增值2=>            |        36 |    2 |
+--------------------------+-----------+------+
insert into table3_noorder(a) values(null),(15),(null),(null),(25);
insert into table3_noorder(a,txt) values(0,'最新自增值1=>');
select txt,a incre_col,b from table3_noorder order by a;
+------------------------------+-----------+------+
| txt                          | incre_col | b    |
+------------------------------+-----------+------+
| table3_noorder noorder模式   |         1 |    3 |
| table3_noorder noorder模式   |        15 |    3 |
| table3_noorder noorder模式   |        25 |    3 |
| table3_noorder noorder模式   |   1000001 |    3 |
| table3_noorder noorder模式   |   1000002 |    3 |
| 最新自增值1=>                |   1000004 |    3 |
+------------------------------+-----------+------+
insert into table3_noorder(a) values(null),(null),(null),(35);
insert into table3_noorder(a,txt) values(0,'最新自增值2=>');
select txt,a incre_col,b from table3_noorder order by a;
+------------------------------+-----------+------+
| txt                          | incre_col | b    |
+------------------------------+-----------+------+
| table3_noorder noorder模式   |         1 |    3 |
| table3_noorder noorder模式   |        15 |    3 |
| table3_noorder noorder模式   |        25 |    3 |
| table3_noorder noorder模式   |        35 |    3 |
| table3_noorder noorder模式   |   1000001 |    3 |
| table3_noorder noorder模式   |   1000002 |    3 |
| 最新自增值1=>                |   1000004 |    3 |
| table3_noorder noorder模式   |   1000005 |    3 |
| table3_noorder noorder模式   |   1000006 |    3 |
| table3_noorder noorder模式   |   1000007 |    3 |
| 最新自增值2=>                |   1000009 |    3 |
+------------------------------+-----------+------+
###### auto_incre_3-1-2 ②DELETE操作
insert into table1_default(a,b) values(null,11);
insert into table1_default(a,b) values(null,11);
select txt,a incre_col,b from table1_default order by a;
+----------------------------------+-----------+------+
| txt                              | incre_col | b    |
+----------------------------------+-----------+------+
| table1_default 默认order模式     |         1 |    1 |
| table1_default 默认order模式     |        15 |    1 |
| table1_default 默认order模式     |        16 |    1 |
| table1_default 默认order模式     |        17 |    1 |
| table1_default 默认order模式     |        25 |    1 |
| 最新自增值1=>                    |        26 |    1 |
| table1_default 默认order模式     |        27 |    1 |
| table1_default 默认order模式     |        28 |    1 |
| table1_default 默认order模式     |        29 |    1 |
| table1_default 默认order模式     |        35 |    1 |
| 最新自增值2=>                    |        36 |    1 |
| table1_default 默认order模式     |        37 |   11 |
| table1_default 默认order模式     |        38 |   11 |
+----------------------------------+-----------+------+
delete from table1_default where b=11;
insert into table1_default(a,txt) values(0,'最新自增值=>');
select txt,a incre_col,b from table1_default order by a;
+----------------------------------+-----------+------+
| txt                              | incre_col | b    |
+----------------------------------+-----------+------+
| table1_default 默认order模式     |         1 |    1 |
| table1_default 默认order模式     |        15 |    1 |
| table1_default 默认order模式     |        16 |    1 |
| table1_default 默认order模式     |        17 |    1 |
| table1_default 默认order模式     |        25 |    1 |
| 最新自增值1=>                    |        26 |    1 |
| table1_default 默认order模式     |        27 |    1 |
| table1_default 默认order模式     |        28 |    1 |
| table1_default 默认order模式     |        29 |    1 |
| table1_default 默认order模式     |        35 |    1 |
| 最新自增值2=>                    |        36 |    1 |
| 最新自增值=>                     |        39 |    1 |
+----------------------------------+-----------+------+
insert into table2_order(a,b) values(null,22);
insert into table2_order(a,b) values(null,22);
select txt,a incre_col,b from table2_order order by a;
+--------------------------+-----------+------+
| txt                      | incre_col | b    |
+--------------------------+-----------+------+
| table2_order order模式   |         1 |    2 |
| table2_order order模式   |        15 |    2 |
| table2_order order模式   |        16 |    2 |
| table2_order order模式   |        17 |    2 |
| table2_order order模式   |        25 |    2 |
| 最新自增值1=>            |        26 |    2 |
| table2_order order模式   |        27 |    2 |
| table2_order order模式   |        28 |    2 |
| table2_order order模式   |        29 |    2 |
| table2_order order模式   |        35 |    2 |
| 最新自增值2=>            |        36 |    2 |
| table2_order order模式   |        37 |   22 |
| table2_order order模式   |        38 |   22 |
+--------------------------+-----------+------+
delete from table2_order where b=22;
insert into table2_order(a,txt) values(0,'最新自增值=>');
select txt,a incre_col,b from table2_order order by a;
+--------------------------+-----------+------+
| txt                      | incre_col | b    |
+--------------------------+-----------+------+
| table2_order order模式   |         1 |    2 |
| table2_order order模式   |        15 |    2 |
| table2_order order模式   |        16 |    2 |
| table2_order order模式   |        17 |    2 |
| table2_order order模式   |        25 |    2 |
| 最新自增值1=>            |        26 |    2 |
| table2_order order模式   |        27 |    2 |
| table2_order order模式   |        28 |    2 |
| table2_order order模式   |        29 |    2 |
| table2_order order模式   |        35 |    2 |
| 最新自增值2=>            |        36 |    2 |
| 最新自增值=>             |        39 |    2 |
+--------------------------+-----------+------+
insert into table3_noorder(a,b) values(null,33);
insert into table3_noorder(a,b) values(null,33);
select txt,a incre_col,b from table3_noorder order by a;
+------------------------------+-----------+------+
| txt                          | incre_col | b    |
+------------------------------+-----------+------+
| table3_noorder noorder模式   |         1 |    3 |
| table3_noorder noorder模式   |        15 |    3 |
| table3_noorder noorder模式   |        25 |    3 |
| table3_noorder noorder模式   |        35 |    3 |
| table3_noorder noorder模式   |   1000001 |    3 |
| table3_noorder noorder模式   |   1000002 |    3 |
| 最新自增值1=>                |   1000004 |    3 |
| table3_noorder noorder模式   |   1000005 |    3 |
| table3_noorder noorder模式   |   1000006 |    3 |
| table3_noorder noorder模式   |   1000007 |    3 |
| 最新自增值2=>                |   1000009 |    3 |
| table3_noorder noorder模式   |   1000010 |   33 |
| table3_noorder noorder模式   |   1000011 |   33 |
+------------------------------+-----------+------+
delete from table3_noorder where b=33;
insert into table3_noorder(a,txt) values(0,'最新自增值=>');
select txt,a incre_col,b from table3_noorder order by a;
+------------------------------+-----------+------+
| txt                          | incre_col | b    |
+------------------------------+-----------+------+
| table3_noorder noorder模式   |         1 |    3 |
| table3_noorder noorder模式   |        15 |    3 |
| table3_noorder noorder模式   |        25 |    3 |
| table3_noorder noorder模式   |        35 |    3 |
| table3_noorder noorder模式   |   1000001 |    3 |
| table3_noorder noorder模式   |   1000002 |    3 |
| 最新自增值1=>                |   1000004 |    3 |
| table3_noorder noorder模式   |   1000005 |    3 |
| table3_noorder noorder模式   |   1000006 |    3 |
| table3_noorder noorder模式   |   1000007 |    3 |
| 最新自增值2=>                |   1000009 |    3 |
| 最新自增值=>                 |   1000012 |    3 |
+------------------------------+-----------+------+
###### auto_incre_3-1-3 ③UPDATE操作
# mysql 5.x update没有推高这个自增值，和我们现在是兼容的；8.x update会推高
##更新现有AUTO_INCREMENT列值
insert into table1_default(a,b) values(null,111);
select txt,a incre_col,b from table1_default order by a;
+----------------------------------+-----------+------+
| txt                              | incre_col | b    |
+----------------------------------+-----------+------+
| table1_default 默认order模式     |         1 |    1 |
| table1_default 默认order模式     |        15 |    1 |
| table1_default 默认order模式     |        16 |    1 |
| table1_default 默认order模式     |        17 |    1 |
| table1_default 默认order模式     |        25 |    1 |
| 最新自增值1=>                    |        26 |    1 |
| table1_default 默认order模式     |        27 |    1 |
| table1_default 默认order模式     |        28 |    1 |
| table1_default 默认order模式     |        29 |    1 |
| table1_default 默认order模式     |        35 |    1 |
| 最新自增值2=>                    |        36 |    1 |
| 最新自增值=>                     |        39 |    1 |
| table1_default 默认order模式     |        40 |  111 |
+----------------------------------+-----------+------+
update table1_default set a = 0,txt = '将AUTO_INCREMENT列值设置为小于/等于当前最大自增值的值' where b = 111;
insert into table1_default values(null,11,'1当前自增值=>');
select txt,a incre_col,b from table1_default order by a;
+--------------------------------------------------------------------------+-----------+------+
| txt                                                                      | incre_col | b    |
+--------------------------------------------------------------------------+-----------+------+
| 将AUTO_INCREMENT列值设置为小于/等于当前最大自增值的值                    |         0 |  111 |
| table1_default 默认order模式                                             |         1 |    1 |
| table1_default 默认order模式                                             |        15 |    1 |
| table1_default 默认order模式                                             |        16 |    1 |
| table1_default 默认order模式                                             |        17 |    1 |
| table1_default 默认order模式                                             |        25 |    1 |
| 最新自增值1=>                                                            |        26 |    1 |
| table1_default 默认order模式                                             |        27 |    1 |
| table1_default 默认order模式                                             |        28 |    1 |
| table1_default 默认order模式                                             |        29 |    1 |
| table1_default 默认order模式                                             |        35 |    1 |
| 最新自增值2=>                                                            |        36 |    1 |
| 最新自增值=>                                                             |        39 |    1 |
| 1当前自增值=>                                                            |        41 |   11 |
+--------------------------------------------------------------------------+-----------+------+
update table1_default set a = 60 ,txt = '将AUTO_INCREMENT列值设置为大于当前最大自增值的值' where b = 111;
insert into table1_default values(null,11,'2当前自增值=>');
select txt,a incre_col,b from table1_default order by a;
+-------------------------------------------------------------------+-----------+------+
| txt                                                               | incre_col | b    |
+-------------------------------------------------------------------+-----------+------+
| table1_default 默认order模式                                      |         1 |    1 |
| table1_default 默认order模式                                      |        15 |    1 |
| table1_default 默认order模式                                      |        16 |    1 |
| table1_default 默认order模式                                      |        17 |    1 |
| table1_default 默认order模式                                      |        25 |    1 |
| 最新自增值1=>                                                     |        26 |    1 |
| table1_default 默认order模式                                      |        27 |    1 |
| table1_default 默认order模式                                      |        28 |    1 |
| table1_default 默认order模式                                      |        29 |    1 |
| table1_default 默认order模式                                      |        35 |    1 |
| 最新自增值2=>                                                     |        36 |    1 |
| 最新自增值=>                                                      |        39 |    1 |
| 1当前自增值=>                                                     |        41 |   11 |
| 2当前自增值=>                                                     |        42 |   11 |
| 将AUTO_INCREMENT列值设置为大于当前最大自增值的值                  |        60 |  111 |
+-------------------------------------------------------------------+-----------+------+
insert into table2_order(a,b) values(null,222);
select txt,a incre_col,b from table2_order order by a;
+--------------------------+-----------+------+
| txt                      | incre_col | b    |
+--------------------------+-----------+------+
| table2_order order模式   |         1 |    2 |
| table2_order order模式   |        15 |    2 |
| table2_order order模式   |        16 |    2 |
| table2_order order模式   |        17 |    2 |
| table2_order order模式   |        25 |    2 |
| 最新自增值1=>            |        26 |    2 |
| table2_order order模式   |        27 |    2 |
| table2_order order模式   |        28 |    2 |
| table2_order order模式   |        29 |    2 |
| table2_order order模式   |        35 |    2 |
| 最新自增值2=>            |        36 |    2 |
| 最新自增值=>             |        39 |    2 |
| table2_order order模式   |        40 |  222 |
+--------------------------+-----------+------+
update table2_order set a = 0,txt = '将AUTO_INCREMENT列值设置为小于/等于当前最大自增值的值' where b = 222;
insert into table2_order values(null,22,'1当前自增值=>');
select txt,a incre_col,b from table2_order order by a;
+--------------------------------------------------------------------------+-----------+------+
| txt                                                                      | incre_col | b    |
+--------------------------------------------------------------------------+-----------+------+
| 将AUTO_INCREMENT列值设置为小于/等于当前最大自增值的值                    |         0 |  222 |
| table2_order order模式                                                   |         1 |    2 |
| table2_order order模式                                                   |        15 |    2 |
| table2_order order模式                                                   |        16 |    2 |
| table2_order order模式                                                   |        17 |    2 |
| table2_order order模式                                                   |        25 |    2 |
| 最新自增值1=>                                                            |        26 |    2 |
| table2_order order模式                                                   |        27 |    2 |
| table2_order order模式                                                   |        28 |    2 |
| table2_order order模式                                                   |        29 |    2 |
| table2_order order模式                                                   |        35 |    2 |
| 最新自增值2=>                                                            |        36 |    2 |
| 最新自增值=>                                                             |        39 |    2 |
| 1当前自增值=>                                                            |        41 |   22 |
+--------------------------------------------------------------------------+-----------+------+
update table2_order set a = 60 ,txt = '将AUTO_INCREMENT列值设置为大于当前最大自增值的值' where b = 222;
insert into table2_order values(null,22,'2当前自增值=>');
select txt,a incre_col,b from table2_order order by a;
+-------------------------------------------------------------------+-----------+------+
| txt                                                               | incre_col | b    |
+-------------------------------------------------------------------+-----------+------+
| table2_order order模式                                            |         1 |    2 |
| table2_order order模式                                            |        15 |    2 |
| table2_order order模式                                            |        16 |    2 |
| table2_order order模式                                            |        17 |    2 |
| table2_order order模式                                            |        25 |    2 |
| 最新自增值1=>                                                     |        26 |    2 |
| table2_order order模式                                            |        27 |    2 |
| table2_order order模式                                            |        28 |    2 |
| table2_order order模式                                            |        29 |    2 |
| table2_order order模式                                            |        35 |    2 |
| 最新自增值2=>                                                     |        36 |    2 |
| 最新自增值=>                                                      |        39 |    2 |
| 1当前自增值=>                                                     |        41 |   22 |
| 2当前自增值=>                                                     |        42 |   22 |
| 将AUTO_INCREMENT列值设置为大于当前最大自增值的值                  |        60 |  222 |
+-------------------------------------------------------------------+-----------+------+
insert into table3_noorder(a,b) values(null,333);
select txt,a incre_col,b from table3_noorder order by a;
+------------------------------+-----------+------+
| txt                          | incre_col | b    |
+------------------------------+-----------+------+
| table3_noorder noorder模式   |         1 |    3 |
| table3_noorder noorder模式   |        15 |    3 |
| table3_noorder noorder模式   |        25 |    3 |
| table3_noorder noorder模式   |        35 |    3 |
| table3_noorder noorder模式   |   1000001 |    3 |
| table3_noorder noorder模式   |   1000002 |    3 |
| 最新自增值1=>                |   1000004 |    3 |
| table3_noorder noorder模式   |   1000005 |    3 |
| table3_noorder noorder模式   |   1000006 |    3 |
| table3_noorder noorder模式   |   1000007 |    3 |
| 最新自增值2=>                |   1000009 |    3 |
| 最新自增值=>                 |   1000012 |    3 |
| table3_noorder noorder模式   |   1000013 |  333 |
+------------------------------+-----------+------+
update table3_noorder set a = 0,txt = '将AUTO_INCREMENT列值设置为小于/等于当前最大自增值的值' where b = 333;
insert into table3_noorder values(null,33,'1当前自增值=>');
select txt,a incre_col,b from table3_noorder order by a;
+--------------------------------------------------------------------------+-----------+------+
| txt                                                                      | incre_col | b    |
+--------------------------------------------------------------------------+-----------+------+
| 将AUTO_INCREMENT列值设置为小于/等于当前最大自增值的值                    |         0 |  333 |
| table3_noorder noorder模式                                               |         1 |    3 |
| table3_noorder noorder模式                                               |        15 |    3 |
| table3_noorder noorder模式                                               |        25 |    3 |
| table3_noorder noorder模式                                               |        35 |    3 |
| table3_noorder noorder模式                                               |   1000001 |    3 |
| table3_noorder noorder模式                                               |   1000002 |    3 |
| 最新自增值1=>                                                            |   1000004 |    3 |
| table3_noorder noorder模式                                               |   1000005 |    3 |
| table3_noorder noorder模式                                               |   1000006 |    3 |
| table3_noorder noorder模式                                               |   1000007 |    3 |
| 最新自增值2=>                                                            |   1000009 |    3 |
| 最新自增值=>                                                             |   1000012 |    3 |
| 1当前自增值=>                                                            |   1000014 |   33 |
+--------------------------------------------------------------------------+-----------+------+
update table3_noorder set a = 1000022 ,txt = '将AUTO_INCREMENT列值设置为大于当前最大自增值的值' where b = 333;
insert into table3_noorder values(null,33,'2当前自增值=>');
select txt,a incre_col,b from table3_noorder order by a;
+-------------------------------------------------------------------+-----------+------+
| txt                                                               | incre_col | b    |
+-------------------------------------------------------------------+-----------+------+
| table3_noorder noorder模式                                        |         1 |    3 |
| table3_noorder noorder模式                                        |        15 |    3 |
| table3_noorder noorder模式                                        |        25 |    3 |
| table3_noorder noorder模式                                        |        35 |    3 |
| table3_noorder noorder模式                                        |   1000001 |    3 |
| table3_noorder noorder模式                                        |   1000002 |    3 |
| 最新自增值1=>                                                     |   1000004 |    3 |
| table3_noorder noorder模式                                        |   1000005 |    3 |
| table3_noorder noorder模式                                        |   1000006 |    3 |
| table3_noorder noorder模式                                        |   1000007 |    3 |
| 最新自增值2=>                                                     |   1000009 |    3 |
| 最新自增值=>                                                      |   1000012 |    3 |
| 1当前自增值=>                                                     |   1000014 |   33 |
| 2当前自增值=>                                                     |   1000015 |   33 |
| 将AUTO_INCREMENT列值设置为大于当前最大自增值的值                  |   1000022 |  333 |
+-------------------------------------------------------------------+-----------+------+
##更新其他列值时引用AUTO_INCREMENT列
delete from table1_default;
insert into table1_default(a,b,txt) values(null,0,'update');
select txt,a incre_col,b from table1_default order by a;
+--------+-----------+------+
| txt    | incre_col | b    |
+--------+-----------+------+
| update |        43 |    0 |
+--------+-----------+------+
update table1_default set b = a+1 where txt = 'update';
insert into table1_default values(null,11,'当前自增值==>');
select txt,a incre_col,b from table1_default order by a;
+--------------------+-----------+------+
| txt                | incre_col | b    |
+--------------------+-----------+------+
| update             |        43 |   44 |
| 当前自增值==>      |        44 |   11 |
+--------------------+-----------+------+
delete from table2_order;
insert into table2_order(a,b,txt) values(null,0,'update');
select txt,a incre_col,b from table2_order order by a;
+--------+-----------+------+
| txt    | incre_col | b    |
+--------+-----------+------+
| update |        43 |    0 |
+--------+-----------+------+
update table2_order set b = a+2 where txt = 'update';
insert into table2_order values(null,22,'当前自增值==>');
select txt,a incre_col,b from table2_order order by a;
+--------------------+-----------+------+
| txt                | incre_col | b    |
+--------------------+-----------+------+
| update             |        43 |   45 |
| 当前自增值==>      |        44 |   22 |
+--------------------+-----------+------+
delete from table3_noorder;
insert into table3_noorder(a,b,txt) values(null,0,'update');
select txt,a incre_col,b from table3_noorder order by a;
+--------+-----------+------+
| txt    | incre_col | b    |
+--------+-----------+------+
| update |   1000016 |    0 |
+--------+-----------+------+
update table3_noorder set b = a+3 where txt = 'update';
insert into table3_noorder values(null,33,'当前自增值==>');
select txt,a incre_col,b from table3_noorder order by a;
+--------------------+-----------+---------+
| txt                | incre_col | b       |
+--------------------+-----------+---------+
| update             |   1000016 | 1000019 |
| 当前自增值==>      |   1000017 |      33 |
+--------------------+-----------+---------+
###### auto_incre_3-1-4 ④SELECT操作
select a incre_col from table1_default order by a;
+-----------+
| incre_col |
+-----------+
|        43 |
|        44 |
+-----------+
select abs(a) from table1_default order by a;
+--------+
| abs(a) |
+--------+
|     43 |
|     44 |
+--------+
select a+b from table1_default order by a;
+------+
| a+b  |
+------+
|   87 |
|   55 |
+------+
select a incre_col from table2_order order by a;
+-----------+
| incre_col |
+-----------+
|        43 |
|        44 |
+-----------+
select abs(a) from table2_order order by a;
+--------+
| abs(a) |
+--------+
|     43 |
|     44 |
+--------+
select a+b from table2_order order by a;
+------+
| a+b  |
+------+
|   88 |
|   66 |
+------+
select a incre_col from table3_noorder order by a;
+-----------+
| incre_col |
+-----------+
|   1000016 |
|   1000017 |
+-----------+
select abs(a) from table3_noorder order by a;
+---------+
| abs(a)  |
+---------+
| 1000016 |
| 1000017 |
+---------+
select a+b from table3_noorder order by a;
+---------+
| a+b     |
+---------+
| 2000035 |
| 1000050 |
+---------+
############ auto_incre_2-4 ④模式切换 ############
##建表
###### INT 类型，索引 - 唯一索引
set auto_increment_increment=1;
alter system set default_auto_increment_mode = 'order';
drop table table1_default;
create table table1_default (
  a int not null auto_increment primary key,
  b int default 1,
  txt varchar(64) default 'table1_default 默认order模式',
  unique index(a)
)partition by key(a) partitions 4;
## ORDER==>ORDER
insert into table1_default(a) values(0),(0),(0),(0),(0);
select txt,a incre_col, b from table1_default order by a;
+----------------------------------+-----------+------+
| txt                              | incre_col | b    |
+----------------------------------+-----------+------+
| table1_default 默认order模式     |         1 |    1 |
| table1_default 默认order模式     |         2 |    1 |
| table1_default 默认order模式     |         3 |    1 |
| table1_default 默认order模式     |         4 |    1 |
| table1_default 默认order模式     |         5 |    1 |
+----------------------------------+-----------+------+
alter table table1_default auto_increment_mode = 'ORDER';
insert into table1_default values(0,2,'ORDER==>ORDER'),(0,2,'ORDER==>ORDER'),(0,2,'ORDER==>ORDER'),(0,2,'ORDER==>ORDER');
select txt,a incre_col, b from table1_default order by a;
+----------------------------------+-----------+------+
| txt                              | incre_col | b    |
+----------------------------------+-----------+------+
| table1_default 默认order模式     |         1 |    1 |
| table1_default 默认order模式     |         2 |    1 |
| table1_default 默认order模式     |         3 |    1 |
| table1_default 默认order模式     |         4 |    1 |
| table1_default 默认order模式     |         5 |    1 |
| ORDER==>ORDER                    |         6 |    2 |
| ORDER==>ORDER                    |         7 |    2 |
| ORDER==>ORDER                    |         8 |    2 |
| ORDER==>ORDER                    |         9 |    2 |
+----------------------------------+-----------+------+
## ORDER==>NOORDER
alter table table1_default auto_increment_mode = 'NOORDER';
insert into table1_default values(0,3,'ORDER==>NOORDER'),(0,3,'ORDER==>NOORDER'),(0,3,'ORDER==>NOORDER'),(0,3,'ORDER==>NOORDER');
select txt,a incre_col, b from table1_default order by a;
+----------------------------------+-----------+------+
| txt                              | incre_col | b    |
+----------------------------------+-----------+------+
| table1_default 默认order模式     |         1 |    1 |
| table1_default 默认order模式     |         2 |    1 |
| table1_default 默认order模式     |         3 |    1 |
| table1_default 默认order模式     |         4 |    1 |
| table1_default 默认order模式     |         5 |    1 |
| ORDER==>ORDER                    |         6 |    2 |
| ORDER==>ORDER                    |         7 |    2 |
| ORDER==>ORDER                    |         8 |    2 |
| ORDER==>ORDER                    |         9 |    2 |
| ORDER==>NOORDER                  |   1000001 |    3 |
| ORDER==>NOORDER                  |   1000002 |    3 |
| ORDER==>NOORDER                  |   1000003 |    3 |
| ORDER==>NOORDER                  |   1000004 |    3 |
+----------------------------------+-----------+------+
## NOORDER==>NOORDER
alter table table1_default auto_increment_mode = 'NOORDER';
insert into table1_default values(0,4,'NOORDER==>NOORDER'),(0,4,'NOORDER==>NOORDER'),(0,4,'NOORDER==>NOORDER'),(0,4,'NOORDER==>NOORDER');
select txt,a incre_col, b from table1_default order by a;
+----------------------------------+-----------+------+
| txt                              | incre_col | b    |
+----------------------------------+-----------+------+
| table1_default 默认order模式     |         1 |    1 |
| table1_default 默认order模式     |         2 |    1 |
| table1_default 默认order模式     |         3 |    1 |
| table1_default 默认order模式     |         4 |    1 |
| table1_default 默认order模式     |         5 |    1 |
| ORDER==>ORDER                    |         6 |    2 |
| ORDER==>ORDER                    |         7 |    2 |
| ORDER==>ORDER                    |         8 |    2 |
| ORDER==>ORDER                    |         9 |    2 |
| ORDER==>NOORDER                  |   1000001 |    3 |
| ORDER==>NOORDER                  |   1000002 |    3 |
| ORDER==>NOORDER                  |   1000003 |    3 |
| ORDER==>NOORDER                  |   1000004 |    3 |
| NOORDER==>NOORDER                |   1000005 |    4 |
| NOORDER==>NOORDER                |   1000006 |    4 |
| NOORDER==>NOORDER                |   1000007 |    4 |
| NOORDER==>NOORDER                |   1000008 |    4 |
+----------------------------------+-----------+------+
## NOORDER==>ORDER
alter table table1_default auto_increment_mode = 'ORDER';
insert into table1_default values(0,5,'NOORDER==>ORDER'),(0,5,'NOORDER==>ORDER'),(0,5,'NOORDER==>ORDER'),(0,5,'NOORDER==>ORDER');
select txt,a incre_col, b from table1_default order by a;
+----------------------------------+-----------+------+
| txt                              | incre_col | b    |
+----------------------------------+-----------+------+
| table1_default 默认order模式     |         1 |    1 |
| table1_default 默认order模式     |         2 |    1 |
| table1_default 默认order模式     |         3 |    1 |
| table1_default 默认order模式     |         4 |    1 |
| table1_default 默认order模式     |         5 |    1 |
| ORDER==>ORDER                    |         6 |    2 |
| ORDER==>ORDER                    |         7 |    2 |
| ORDER==>ORDER                    |         8 |    2 |
| ORDER==>ORDER                    |         9 |    2 |
| ORDER==>NOORDER                  |   1000001 |    3 |
| ORDER==>NOORDER                  |   1000002 |    3 |
| ORDER==>NOORDER                  |   1000003 |    3 |
| ORDER==>NOORDER                  |   1000004 |    3 |
| NOORDER==>NOORDER                |   1000005 |    4 |
| NOORDER==>NOORDER                |   1000006 |    4 |
| NOORDER==>NOORDER                |   1000007 |    4 |
| NOORDER==>NOORDER                |   1000008 |    4 |
| NOORDER==>ORDER                  |   2000001 |    5 |
| NOORDER==>ORDER                  |   2000002 |    5 |
| NOORDER==>ORDER                  |   2000003 |    5 |
| NOORDER==>ORDER                  |   2000004 |    5 |
+----------------------------------+-----------+------+
insert into table1_default values(0,6,'NOORDER==>ORDER test');
select txt,a incre_col, b from table1_default order by a;
+----------------------------------+-----------+------+
| txt                              | incre_col | b    |
+----------------------------------+-----------+------+
| table1_default 默认order模式     |         1 |    1 |
| table1_default 默认order模式     |         2 |    1 |
| table1_default 默认order模式     |         3 |    1 |
| table1_default 默认order模式     |         4 |    1 |
| table1_default 默认order模式     |         5 |    1 |
| ORDER==>ORDER                    |         6 |    2 |
| ORDER==>ORDER                    |         7 |    2 |
| ORDER==>ORDER                    |         8 |    2 |
| ORDER==>ORDER                    |         9 |    2 |
| ORDER==>NOORDER                  |   1000001 |    3 |
| ORDER==>NOORDER                  |   1000002 |    3 |
| ORDER==>NOORDER                  |   1000003 |    3 |
| ORDER==>NOORDER                  |   1000004 |    3 |
| NOORDER==>NOORDER                |   1000005 |    4 |
| NOORDER==>NOORDER                |   1000006 |    4 |
| NOORDER==>NOORDER                |   1000007 |    4 |
| NOORDER==>NOORDER                |   1000008 |    4 |
| NOORDER==>ORDER                  |   2000001 |    5 |
| NOORDER==>ORDER                  |   2000002 |    5 |
| NOORDER==>ORDER                  |   2000003 |    5 |
| NOORDER==>ORDER                  |   2000004 |    5 |
| NOORDER==>ORDER test             |   2000005 |    6 |
+----------------------------------+-----------+------+
update table1_default set a = 10 where b = 6;
insert into table1_default(a,txt) values(0,'最新自增值=>');
select txt,a incre_col, b from table1_default order by a;
+----------------------------------+-----------+------+
| txt                              | incre_col | b    |
+----------------------------------+-----------+------+
| table1_default 默认order模式     |         1 |    1 |
| table1_default 默认order模式     |         2 |    1 |
| table1_default 默认order模式     |         3 |    1 |
| table1_default 默认order模式     |         4 |    1 |
| table1_default 默认order模式     |         5 |    1 |
| ORDER==>ORDER                    |         6 |    2 |
| ORDER==>ORDER                    |         7 |    2 |
| ORDER==>ORDER                    |         8 |    2 |
| ORDER==>ORDER                    |         9 |    2 |
| NOORDER==>ORDER test             |        10 |    6 |
| ORDER==>NOORDER                  |   1000001 |    3 |
| ORDER==>NOORDER                  |   1000002 |    3 |
| ORDER==>NOORDER                  |   1000003 |    3 |
| ORDER==>NOORDER                  |   1000004 |    3 |
| NOORDER==>NOORDER                |   1000005 |    4 |
| NOORDER==>NOORDER                |   1000006 |    4 |
| NOORDER==>NOORDER                |   1000007 |    4 |
| NOORDER==>NOORDER                |   1000008 |    4 |
| NOORDER==>ORDER                  |   2000001 |    5 |
| NOORDER==>ORDER                  |   2000002 |    5 |
| NOORDER==>ORDER                  |   2000003 |    5 |
| NOORDER==>ORDER                  |   2000004 |    5 |
| 最新自增值=>                     |   2000006 |    1 |
+----------------------------------+-----------+------+
############ 复合分区
##建表
drop table table0_date;
create table table0_date (
  a int,
  b int default 0,
  txt varchar(64) default 'table0_date'
);
insert into table0_date(a) values(11),(12),(13),(16),(17),(18);
drop table table1_default;
create table table1_default (
  a int not null auto_increment primary key,
  b int default 1,
  txt varchar(64) default 'table1_default 默认order模式',
  unique index(a)
)partition by range(a) 
 subpartition by hash(a) subpartitions 4  
(partition p0 values less than (10),  
 partition p1 values less than (20),  
 partition p2 values less than maxvalue);
drop table table2_order;
create table table2_order (
  a int not null auto_increment primary key,
  b int default 2,
  txt varchar(64) default 'table2_order order模式',
  unique index(a)
) auto_increment_mode = 'order' 
 partition by range(a) 
 subpartition by hash(a) subpartitions 4  
(partition p0 values less than (10),  
 partition p1 values less than (20),  
 partition p2 values less than maxvalue);
drop table table3_noorder;
create table table3_noorder (
  a int not null auto_increment primary key,
  b int default 3,
  txt varchar(64) default 'table3_noorder noorder模式',
  unique index(a)
) auto_increment_mode = 'noorder' 
 partition by range(a) 
 subpartition by hash(a) subpartitions 4  
(partition p0 values less than (10),  
 partition p1 values less than (20),  
 partition p2 values less than maxvalue);
############ auto_incre_3-1 DML操作 ############
###### auto_incre_3-1-1 ①INSERT操作 
##简单插入
##INSERT 语句
##table1_default
insert into table1_default(a) values(null);
insert into table1_default(a) values(null),(null);
select txt,a incre_col,b from table1_default order by a;
+----------------------------------+-----------+------+
| txt                              | incre_col | b    |
+----------------------------------+-----------+------+
| table1_default 默认order模式     |         1 |    1 |
| table1_default 默认order模式     |         2 |    1 |
| table1_default 默认order模式     |         3 |    1 |
+----------------------------------+-----------+------+
insert into table1_default(a) values(5);
insert into table1_default(a,txt) values(0,'最新自增值=>');
select txt,a incre_col,b from table1_default order by a;
+----------------------------------+-----------+------+
| txt                              | incre_col | b    |
+----------------------------------+-----------+------+
| table1_default 默认order模式     |         1 |    1 |
| table1_default 默认order模式     |         2 |    1 |
| table1_default 默认order模式     |         3 |    1 |
| table1_default 默认order模式     |         5 |    1 |
| 最新自增值=>                     |         6 |    1 |
+----------------------------------+-----------+------+
##table2_order
insert into table2_order(a) values(null);
insert into table2_order(a) values(null),(null),(null),(null);
select txt,a incre_col,b from table2_order order by a;
+--------------------------+-----------+------+
| txt                      | incre_col | b    |
+--------------------------+-----------+------+
| table2_order order模式   |         1 |    2 |
| table2_order order模式   |         2 |    2 |
| table2_order order模式   |         3 |    2 |
| table2_order order模式   |         4 |    2 |
| table2_order order模式   |         5 |    2 |
+--------------------------+-----------+------+
insert into table2_order(a) values(6);
insert into table2_order(a,txt) values(0,'1最新自增值=>');
select txt,a incre_col,b from table2_order order by a;
+--------------------------+-----------+------+
| txt                      | incre_col | b    |
+--------------------------+-----------+------+
| table2_order order模式   |         1 |    2 |
| table2_order order模式   |         2 |    2 |
| table2_order order模式   |         3 |    2 |
| table2_order order模式   |         4 |    2 |
| table2_order order模式   |         5 |    2 |
| table2_order order模式   |         6 |    2 |
| 1最新自增值=>            |         7 |    2 |
+--------------------------+-----------+------+
##table3_noorder
insert into table3_noorder(a) values(null);
insert into table3_noorder(a) values(null),(null),(null),(null);
select txt,a incre_col,b from table3_noorder order by a;
+------------------------------+-----------+------+
| txt                          | incre_col | b    |
+------------------------------+-----------+------+
| table3_noorder noorder模式   |         1 |    3 |
| table3_noorder noorder模式   |         2 |    3 |
| table3_noorder noorder模式   |         3 |    3 |
| table3_noorder noorder模式   |         4 |    3 |
| table3_noorder noorder模式   |         5 |    3 |
+------------------------------+-----------+------+
insert into table3_noorder(a) values(6);
insert into table3_noorder(a,txt) values(0,'最新自增值=>');
select txt,a incre_col,b from table3_noorder order by a;
+------------------------------+-----------+------+
| txt                          | incre_col | b    |
+------------------------------+-----------+------+
| table3_noorder noorder模式   |         1 |    3 |
| table3_noorder noorder模式   |         2 |    3 |
| table3_noorder noorder模式   |         3 |    3 |
| table3_noorder noorder模式   |         4 |    3 |
| table3_noorder noorder模式   |         5 |    3 |
| table3_noorder noorder模式   |         6 |    3 |
| 最新自增值=>                 |   1000001 |    3 |
+------------------------------+-----------+------+
##批量插入
##INSERT ... SELECT语句
insert into table1_default select a,b,txt from table0_date where a <= 15;
select txt,a incre_col,b from table1_default order by a;
+----------------------------------+-----------+------+
| txt                              | incre_col | b    |
+----------------------------------+-----------+------+
| table1_default 默认order模式     |         1 |    1 |
| table1_default 默认order模式     |         2 |    1 |
| table1_default 默认order模式     |         3 |    1 |
| table1_default 默认order模式     |         5 |    1 |
| 最新自增值=>                     |         6 |    1 |
| table0_date                      |        11 |    0 |
| table0_date                      |        12 |    0 |
| table0_date                      |        13 |    0 |
+----------------------------------+-----------+------+
insert into table1_default(a,txt) values(0,'最新自增值=>');
select txt,a incre_col,b from table1_default order by a;
+----------------------------------+-----------+------+
| txt                              | incre_col | b    |
+----------------------------------+-----------+------+
| table1_default 默认order模式     |         1 |    1 |
| table1_default 默认order模式     |         2 |    1 |
| table1_default 默认order模式     |         3 |    1 |
| table1_default 默认order模式     |         5 |    1 |
| 最新自增值=>                     |         6 |    1 |
| table0_date                      |        11 |    0 |
| table0_date                      |        12 |    0 |
| table0_date                      |        13 |    0 |
| 最新自增值=>                     |        14 |    1 |
+----------------------------------+-----------+------+
insert into table2_order select a,b,txt from table0_date where a <= 15;
select txt,a incre_col,b from table2_order order by a;
+--------------------------+-----------+------+
| txt                      | incre_col | b    |
+--------------------------+-----------+------+
| table2_order order模式   |         1 |    2 |
| table2_order order模式   |         2 |    2 |
| table2_order order模式   |         3 |    2 |
| table2_order order模式   |         4 |    2 |
| table2_order order模式   |         5 |    2 |
| table2_order order模式   |         6 |    2 |
| 1最新自增值=>            |         7 |    2 |
| table0_date              |        11 |    0 |
| table0_date              |        12 |    0 |
| table0_date              |        13 |    0 |
+--------------------------+-----------+------+
insert into table2_order(a,txt) values(0,'最新自增值=>');
select txt,a incre_col,b from table2_order order by a;
+--------------------------+-----------+------+
| txt                      | incre_col | b    |
+--------------------------+-----------+------+
| table2_order order模式   |         1 |    2 |
| table2_order order模式   |         2 |    2 |
| table2_order order模式   |         3 |    2 |
| table2_order order模式   |         4 |    2 |
| table2_order order模式   |         5 |    2 |
| table2_order order模式   |         6 |    2 |
| 1最新自增值=>            |         7 |    2 |
| table0_date              |        11 |    0 |
| table0_date              |        12 |    0 |
| table0_date              |        13 |    0 |
| 最新自增值=>             |        14 |    2 |
+--------------------------+-----------+------+
insert into table3_noorder select a,b,txt from table0_date where a <= 15;
insert into table3_noorder(a,txt) values(0,'最新自增值=>');
select txt,a incre_col,b from table3_noorder order by a;
+------------------------------+-----------+------+
| txt                          | incre_col | b    |
+------------------------------+-----------+------+
| table3_noorder noorder模式   |         1 |    3 |
| table3_noorder noorder模式   |         2 |    3 |
| table3_noorder noorder模式   |         3 |    3 |
| table3_noorder noorder模式   |         4 |    3 |
| table3_noorder noorder模式   |         5 |    3 |
| table3_noorder noorder模式   |         6 |    3 |
| table0_date                  |        11 |    0 |
| table0_date                  |        12 |    0 |
| table0_date                  |        13 |    0 |
| 最新自增值=>                 |   1000001 |    3 |
| 最新自增值=>                 |   1000002 |    3 |
+------------------------------+-----------+------+
##混合插入
##INSERT ... ON DUPLICATE KEY UPDATE 语句
insert into table1_default (a,b,txt) values (1,1,'重复场合') on duplicate key update b=b+1,txt='insert...on duplicate key update 语句';
insert into table1_default(a,txt) values(0,'最新自增值1=>');
select txt,a incre_col,b from table1_default order by a;
+-----------------------------------------+-----------+------+
| txt                                     | incre_col | b    |
+-----------------------------------------+-----------+------+
| insert...on duplicate key update 语句   |         1 |    2 |
| table1_default 默认order模式            |         2 |    1 |
| table1_default 默认order模式            |         3 |    1 |
| table1_default 默认order模式            |         5 |    1 |
| 最新自增值=>                            |         6 |    1 |
| table0_date                             |        11 |    0 |
| table0_date                             |        12 |    0 |
| table0_date                             |        13 |    0 |
| 最新自增值=>                            |        14 |    1 |
| 最新自增值1=>                           |        15 |    1 |
+-----------------------------------------+-----------+------+
insert into table1_default (a,b,txt) values (20,1,'不重复场合') on duplicate key update b=b+1,txt='insert...on duplicate key update 语句';
insert into table1_default(a,txt) values(0,'最新自增值2=>');
select txt,a incre_col,b from table1_default order by a;
+-----------------------------------------+-----------+------+
| txt                                     | incre_col | b    |
+-----------------------------------------+-----------+------+
| insert...on duplicate key update 语句   |         1 |    2 |
| table1_default 默认order模式            |         2 |    1 |
| table1_default 默认order模式            |         3 |    1 |
| table1_default 默认order模式            |         5 |    1 |
| 最新自增值=>                            |         6 |    1 |
| table0_date                             |        11 |    0 |
| table0_date                             |        12 |    0 |
| table0_date                             |        13 |    0 |
| 最新自增值=>                            |        14 |    1 |
| 最新自增值1=>                           |        15 |    1 |
| 不重复场合                              |        20 |    1 |
| 最新自增值2=>                           |        21 |    1 |
+-----------------------------------------+-----------+------+
insert into table2_order (a,b,txt) values (1,2,'重复场合') on duplicate key update b=b+1,txt='insert...on duplicate key update 语句';
insert into table2_order(a,txt) values(0,'最新自增值1=>');
select txt,a incre_col,b from table2_order order by a;
+-----------------------------------------+-----------+------+
| txt                                     | incre_col | b    |
+-----------------------------------------+-----------+------+
| insert...on duplicate key update 语句   |         1 |    3 |
| table2_order order模式                  |         2 |    2 |
| table2_order order模式                  |         3 |    2 |
| table2_order order模式                  |         4 |    2 |
| table2_order order模式                  |         5 |    2 |
| table2_order order模式                  |         6 |    2 |
| 1最新自增值=>                           |         7 |    2 |
| table0_date                             |        11 |    0 |
| table0_date                             |        12 |    0 |
| table0_date                             |        13 |    0 |
| 最新自增值=>                            |        14 |    2 |
| 最新自增值1=>                           |        15 |    2 |
+-----------------------------------------+-----------+------+
insert into table2_order (a,b,txt) values (20,2,'不重复场合') on duplicate key update b=b+1,txt='insert...on duplicate key update 语句';
insert into table2_order(a,txt) values(0,'最新自增值2=>');
select txt,a incre_col,b from table2_order order by a;
+-----------------------------------------+-----------+------+
| txt                                     | incre_col | b    |
+-----------------------------------------+-----------+------+
| insert...on duplicate key update 语句   |         1 |    3 |
| table2_order order模式                  |         2 |    2 |
| table2_order order模式                  |         3 |    2 |
| table2_order order模式                  |         4 |    2 |
| table2_order order模式                  |         5 |    2 |
| table2_order order模式                  |         6 |    2 |
| 1最新自增值=>                           |         7 |    2 |
| table0_date                             |        11 |    0 |
| table0_date                             |        12 |    0 |
| table0_date                             |        13 |    0 |
| 最新自增值=>                            |        14 |    2 |
| 最新自增值1=>                           |        15 |    2 |
| 不重复场合                              |        20 |    2 |
| 最新自增值2=>                           |        21 |    2 |
+-----------------------------------------+-----------+------+
drop table table3_noorder;
create table table3_noorder (
  a int not null auto_increment primary key,
  b int default 3,
  txt varchar(64) default 'table3_noorder noorder模式',
  unique index(a)
) auto_increment_mode = 'noorder' 
 partition by range(a) 
 subpartition by hash(a) subpartitions 4  
(partition p0 values less than (10),  
 partition p1 values less than (20),  
 partition p2 values less than maxvalue);
insert into table3_noorder(a) values(null),(null);
insert into table3_noorder (a,b,txt) values (1,3,'重复场合') on duplicate key update b=b+1,txt='insert...on duplicate key update 语句';
insert into table3_noorder(a,txt) values(0,'最新自增值1=>');
select txt,a incre_col,b from table3_noorder order by a;
+-----------------------------------------+-----------+------+
| txt                                     | incre_col | b    |
+-----------------------------------------+-----------+------+
| insert...on duplicate key update 语句   |         1 |    4 |
| table3_noorder noorder模式              |         2 |    3 |
| 最新自增值1=>                           |         3 |    3 |
+-----------------------------------------+-----------+------+
insert into table3_noorder (a,b,txt) values (20,3,'不重复场合') on duplicate key update b=b+1,txt='insert...on duplicate key update 语句';
insert into table3_noorder(a,txt) values(0,'最新自增值1=>');
select txt,a incre_col,b from table3_noorder order by a;
+-----------------------------------------+-----------+------+
| txt                                     | incre_col | b    |
+-----------------------------------------+-----------+------+
| insert...on duplicate key update 语句   |         1 |    4 |
| table3_noorder noorder模式              |         2 |    3 |
| 最新自增值1=>                           |         3 |    3 |
| 不重复场合                              |        20 |    3 |
| 最新自增值1=>                           |   1000001 |    3 |
+-----------------------------------------+-----------+------+
##将NULL和任何其他值混合插入 AUTO_INCREMENT列
##INSERT 语句
insert into table1_default(a) values(null),(25),(null),(30);
insert into table1_default(a,txt) values(0,'最新自增值1=>');
select txt,a incre_col,b from table1_default order by a;
+-----------------------------------------+-----------+------+
| txt                                     | incre_col | b    |
+-----------------------------------------+-----------+------+
| insert...on duplicate key update 语句   |         1 |    2 |
| table1_default 默认order模式            |         2 |    1 |
| table1_default 默认order模式            |         3 |    1 |
| table1_default 默认order模式            |         5 |    1 |
| 最新自增值=>                            |         6 |    1 |
| table0_date                             |        11 |    0 |
| table0_date                             |        12 |    0 |
| table0_date                             |        13 |    0 |
| 最新自增值=>                            |        14 |    1 |
| 最新自增值1=>                           |        15 |    1 |
| 不重复场合                              |        20 |    1 |
| 最新自增值2=>                           |        21 |    1 |
| table1_default 默认order模式            |        22 |    1 |
| table1_default 默认order模式            |        25 |    1 |
| table1_default 默认order模式            |        26 |    1 |
| table1_default 默认order模式            |        30 |    1 |
| 最新自增值1=>                           |        31 |    1 |
+-----------------------------------------+-----------+------+
insert into table2_order(a) values(null),(25),(null),(30);
insert into table2_order(a,txt) values(0,'最新自增值=>');
select txt,a incre_col,b from table2_order order by a;
+-----------------------------------------+-----------+------+
| txt                                     | incre_col | b    |
+-----------------------------------------+-----------+------+
| insert...on duplicate key update 语句   |         1 |    3 |
| table2_order order模式                  |         2 |    2 |
| table2_order order模式                  |         3 |    2 |
| table2_order order模式                  |         4 |    2 |
| table2_order order模式                  |         5 |    2 |
| table2_order order模式                  |         6 |    2 |
| 1最新自增值=>                           |         7 |    2 |
| table0_date                             |        11 |    0 |
| table0_date                             |        12 |    0 |
| table0_date                             |        13 |    0 |
| 最新自增值=>                            |        14 |    2 |
| 最新自增值1=>                           |        15 |    2 |
| 不重复场合                              |        20 |    2 |
| 最新自增值2=>                           |        21 |    2 |
| table2_order order模式                  |        22 |    2 |
| table2_order order模式                  |        25 |    2 |
| table2_order order模式                  |        26 |    2 |
| table2_order order模式                  |        30 |    2 |
| 最新自增值=>                            |        31 |    2 |
+-----------------------------------------+-----------+------+
insert into table3_noorder(a) values(null),(25),(null),(30);
select txt,a incre_col,b from table3_noorder order by a;
+-----------------------------------------+-----------+------+
| txt                                     | incre_col | b    |
+-----------------------------------------+-----------+------+
| insert...on duplicate key update 语句   |         1 |    4 |
| table3_noorder noorder模式              |         2 |    3 |
| 最新自增值1=>                           |         3 |    3 |
| 不重复场合                              |        20 |    3 |
| table3_noorder noorder模式              |        25 |    3 |
| table3_noorder noorder模式              |        30 |    3 |
| 最新自增值1=>                           |   1000001 |    3 |
| table3_noorder noorder模式              |   1000002 |    3 |
| table3_noorder noorder模式              |   1000003 |    3 |
+-----------------------------------------+-----------+------+
###### auto_incre_3-1-2 ②DELETE操作
insert into table1_default(a,b) values(null,11);
insert into table1_default(a,b) values(null,11);
select txt,a incre_col,b from table1_default order by a;
+-----------------------------------------+-----------+------+
| txt                                     | incre_col | b    |
+-----------------------------------------+-----------+------+
| insert...on duplicate key update 语句   |         1 |    2 |
| table1_default 默认order模式            |         2 |    1 |
| table1_default 默认order模式            |         3 |    1 |
| table1_default 默认order模式            |         5 |    1 |
| 最新自增值=>                            |         6 |    1 |
| table0_date                             |        11 |    0 |
| table0_date                             |        12 |    0 |
| table0_date                             |        13 |    0 |
| 最新自增值=>                            |        14 |    1 |
| 最新自增值1=>                           |        15 |    1 |
| 不重复场合                              |        20 |    1 |
| 最新自增值2=>                           |        21 |    1 |
| table1_default 默认order模式            |        22 |    1 |
| table1_default 默认order模式            |        25 |    1 |
| table1_default 默认order模式            |        26 |    1 |
| table1_default 默认order模式            |        30 |    1 |
| 最新自增值1=>                           |        31 |    1 |
| table1_default 默认order模式            |        32 |   11 |
| table1_default 默认order模式            |        33 |   11 |
+-----------------------------------------+-----------+------+
delete from table1_default where b=11;
insert into table1_default(a,txt) values(0,'最新自增值=>');
select txt,a incre_col,b from table1_default order by a;
+-----------------------------------------+-----------+------+
| txt                                     | incre_col | b    |
+-----------------------------------------+-----------+------+
| insert...on duplicate key update 语句   |         1 |    2 |
| table1_default 默认order模式            |         2 |    1 |
| table1_default 默认order模式            |         3 |    1 |
| table1_default 默认order模式            |         5 |    1 |
| 最新自增值=>                            |         6 |    1 |
| table0_date                             |        11 |    0 |
| table0_date                             |        12 |    0 |
| table0_date                             |        13 |    0 |
| 最新自增值=>                            |        14 |    1 |
| 最新自增值1=>                           |        15 |    1 |
| 不重复场合                              |        20 |    1 |
| 最新自增值2=>                           |        21 |    1 |
| table1_default 默认order模式            |        22 |    1 |
| table1_default 默认order模式            |        25 |    1 |
| table1_default 默认order模式            |        26 |    1 |
| table1_default 默认order模式            |        30 |    1 |
| 最新自增值1=>                           |        31 |    1 |
| 最新自增值=>                            |        34 |    1 |
+-----------------------------------------+-----------+------+
insert into table2_order(a,b) values(null,22);
insert into table2_order(a,b) values(null,22);
select txt,a incre_col,b from table2_order order by a;
+-----------------------------------------+-----------+------+
| txt                                     | incre_col | b    |
+-----------------------------------------+-----------+------+
| insert...on duplicate key update 语句   |         1 |    3 |
| table2_order order模式                  |         2 |    2 |
| table2_order order模式                  |         3 |    2 |
| table2_order order模式                  |         4 |    2 |
| table2_order order模式                  |         5 |    2 |
| table2_order order模式                  |         6 |    2 |
| 1最新自增值=>                           |         7 |    2 |
| table0_date                             |        11 |    0 |
| table0_date                             |        12 |    0 |
| table0_date                             |        13 |    0 |
| 最新自增值=>                            |        14 |    2 |
| 最新自增值1=>                           |        15 |    2 |
| 不重复场合                              |        20 |    2 |
| 最新自增值2=>                           |        21 |    2 |
| table2_order order模式                  |        22 |    2 |
| table2_order order模式                  |        25 |    2 |
| table2_order order模式                  |        26 |    2 |
| table2_order order模式                  |        30 |    2 |
| 最新自增值=>                            |        31 |    2 |
| table2_order order模式                  |        32 |   22 |
| table2_order order模式                  |        33 |   22 |
+-----------------------------------------+-----------+------+
delete from table2_order where b=22;
insert into table2_order(a,txt) values(0,'最新自增值=>');
select txt,a incre_col,b from table2_order order by a;
+-----------------------------------------+-----------+------+
| txt                                     | incre_col | b    |
+-----------------------------------------+-----------+------+
| insert...on duplicate key update 语句   |         1 |    3 |
| table2_order order模式                  |         2 |    2 |
| table2_order order模式                  |         3 |    2 |
| table2_order order模式                  |         4 |    2 |
| table2_order order模式                  |         5 |    2 |
| table2_order order模式                  |         6 |    2 |
| 1最新自增值=>                           |         7 |    2 |
| table0_date                             |        11 |    0 |
| table0_date                             |        12 |    0 |
| table0_date                             |        13 |    0 |
| 最新自增值=>                            |        14 |    2 |
| 最新自增值1=>                           |        15 |    2 |
| 不重复场合                              |        20 |    2 |
| 最新自增值2=>                           |        21 |    2 |
| table2_order order模式                  |        22 |    2 |
| table2_order order模式                  |        25 |    2 |
| table2_order order模式                  |        26 |    2 |
| table2_order order模式                  |        30 |    2 |
| 最新自增值=>                            |        31 |    2 |
| 最新自增值=>                            |        34 |    2 |
+-----------------------------------------+-----------+------+
insert into table3_noorder(a,b) values(null,33);
insert into table3_noorder(a,b) values(null,33);
select txt,a incre_col,b from table3_noorder order by a;
+-----------------------------------------+-----------+------+
| txt                                     | incre_col | b    |
+-----------------------------------------+-----------+------+
| insert...on duplicate key update 语句   |         1 |    4 |
| table3_noorder noorder模式              |         2 |    3 |
| 最新自增值1=>                           |         3 |    3 |
| 不重复场合                              |        20 |    3 |
| table3_noorder noorder模式              |        25 |    3 |
| table3_noorder noorder模式              |        30 |    3 |
| 最新自增值1=>                           |   1000001 |    3 |
| table3_noorder noorder模式              |   1000002 |    3 |
| table3_noorder noorder模式              |   1000003 |    3 |
| table3_noorder noorder模式              |   1000006 |   33 |
| table3_noorder noorder模式              |   1000007 |   33 |
+-----------------------------------------+-----------+------+
delete from table3_noorder where b=33;
insert into table3_noorder(a,txt) values(0,'最新自增值=>');
select txt,a incre_col,b from table3_noorder order by a;
+-----------------------------------------+-----------+------+
| txt                                     | incre_col | b    |
+-----------------------------------------+-----------+------+
| insert...on duplicate key update 语句   |         1 |    4 |
| table3_noorder noorder模式              |         2 |    3 |
| 最新自增值1=>                           |         3 |    3 |
| 不重复场合                              |        20 |    3 |
| table3_noorder noorder模式              |        25 |    3 |
| table3_noorder noorder模式              |        30 |    3 |
| 最新自增值1=>                           |   1000001 |    3 |
| table3_noorder noorder模式              |   1000002 |    3 |
| table3_noorder noorder模式              |   1000003 |    3 |
| 最新自增值=>                            |   1000008 |    3 |
+-----------------------------------------+-----------+------+
###### auto_incre_3-1-3 ③UPDATE操作
# mysql 5.x update没有推高这个自增值，和我们现在是兼容的；8.x update会推高
##更新现有AUTO_INCREMENT列值
drop table table1_default;
create table table1_default (
  a int not null auto_increment primary key,
  b int default 1,
  txt varchar(64) default 'table1_default 默认order模式',
  unique index(a)
) partition by range(a) 
 subpartition by hash(a) subpartitions 4  
(partition p0 values less than (10),  
 partition p1 values less than (20),  
 partition p2 values less than maxvalue);
insert into table1_default(a,b) values(null,111);
select txt,a incre_col,b from table1_default order by a;
+----------------------------------+-----------+------+
| txt                              | incre_col | b    |
+----------------------------------+-----------+------+
| table1_default 默认order模式     |         1 |  111 |
+----------------------------------+-----------+------+
update table1_default set a = 0,txt = '将AUTO_INCREMENT列值设置为小于/等于当前最大自增值的值' where b = 111;
insert into table1_default values(null,11,'1当前自增值=>');
select txt,a incre_col,b from table1_default order by a;
+--------------------------------------------------------------------------+-----------+------+
| txt                                                                      | incre_col | b    |
+--------------------------------------------------------------------------+-----------+------+
| 将AUTO_INCREMENT列值设置为小于/等于当前最大自增值的值                    |         0 |  111 |
| 1当前自增值=>                                                            |         2 |   11 |
+--------------------------------------------------------------------------+-----------+------+
update table1_default set a = 30 ,txt = '将AUTO_INCREMENT列值设置为大于当前最大自增值的值' where b = 111;
insert into table1_default values(null,11,'2当前自增值=>');
select txt,a incre_col,b from table1_default order by a;
+-------------------------------------------------------------------+-----------+------+
| txt                                                               | incre_col | b    |
+-------------------------------------------------------------------+-----------+------+
| 1当前自增值=>                                                     |         2 |   11 |
| 2当前自增值=>                                                     |         3 |   11 |
| 将AUTO_INCREMENT列值设置为大于当前最大自增值的值                  |        30 |  111 |
+-------------------------------------------------------------------+-----------+------+
drop table table2_order;
create table table2_order (
  a int not null auto_increment primary key,
  b int default 2,
  txt varchar(64) default 'table2_order order模式',
  unique index(a)
) auto_increment_mode = 'order' 
 partition by range(a) 
 subpartition by hash(a) subpartitions 4  
(partition p0 values less than (10),  
 partition p1 values less than (20),  
 partition p2 values less than maxvalue);
insert into table2_order(a,b) values(null,222);
select txt,a incre_col,b from table2_order order by a;
+--------------------------+-----------+------+
| txt                      | incre_col | b    |
+--------------------------+-----------+------+
| table2_order order模式   |         1 |  222 |
+--------------------------+-----------+------+
update table2_order set a = 0,txt = '将AUTO_INCREMENT列值设置为小于/等于当前最大自增值的值' where b = 222;
insert into table2_order values(null,22,'1当前自增值=>');
select txt,a incre_col,b from table2_order order by a;
+--------------------------------------------------------------------------+-----------+------+
| txt                                                                      | incre_col | b    |
+--------------------------------------------------------------------------+-----------+------+
| 将AUTO_INCREMENT列值设置为小于/等于当前最大自增值的值                    |         0 |  222 |
| 1当前自增值=>                                                            |         2 |   22 |
+--------------------------------------------------------------------------+-----------+------+
update table2_order set a = 30 ,txt = '将AUTO_INCREMENT列值设置为大于当前最大自增值的值' where b = 222;
insert into table2_order values(null,22,'2当前自增值=>');
select txt,a incre_col,b from table2_order order by a;
+-------------------------------------------------------------------+-----------+------+
| txt                                                               | incre_col | b    |
+-------------------------------------------------------------------+-----------+------+
| 1当前自增值=>                                                     |         2 |   22 |
| 2当前自增值=>                                                     |         3 |   22 |
| 将AUTO_INCREMENT列值设置为大于当前最大自增值的值                  |        30 |  222 |
+-------------------------------------------------------------------+-----------+------+
drop table table3_noorder;
create table table3_noorder (
  a int not null auto_increment primary key,
  b int default 3,
  txt varchar(64) default 'table3_noorder noorder模式',
  unique index(a)
) auto_increment_mode = 'noorder' 
 partition by range(a) 
 subpartition by hash(a) subpartitions 4  
(partition p0 values less than (10),  
 partition p1 values less than (20),  
 partition p2 values less than maxvalue);
insert into table3_noorder(a,b) values(null,333);
select txt,a incre_col,b from table3_noorder order by a;
+------------------------------+-----------+------+
| txt                          | incre_col | b    |
+------------------------------+-----------+------+
| table3_noorder noorder模式   |         1 |  333 |
+------------------------------+-----------+------+
update table3_noorder set a = 0,txt = '将AUTO_INCREMENT列值设置为小于/等于当前最大自增值的值' where b = 333;
insert into table3_noorder values(null,33,'1当前自增值=>');
select txt,a incre_col,b from table3_noorder order by a;
+--------------------------------------------------------------------------+-----------+------+
| txt                                                                      | incre_col | b    |
+--------------------------------------------------------------------------+-----------+------+
| 将AUTO_INCREMENT列值设置为小于/等于当前最大自增值的值                    |         0 |  333 |
| 1当前自增值=>                                                            |         2 |   33 |
+--------------------------------------------------------------------------+-----------+------+
update table3_noorder set a = 30 ,txt = '将AUTO_INCREMENT列值设置为大于当前最大自增值的值' where b = 333;
insert into table3_noorder values(null,33,'2当前自增值=>');
select txt,a incre_col,b from table3_noorder order by a;
+-------------------------------------------------------------------+-----------+------+
| txt                                                               | incre_col | b    |
+-------------------------------------------------------------------+-----------+------+
| 1当前自增值=>                                                     |         2 |   33 |
| 2当前自增值=>                                                     |         3 |   33 |
| 将AUTO_INCREMENT列值设置为大于当前最大自增值的值                  |        30 |  333 |
+-------------------------------------------------------------------+-----------+------+
##更新其他列值时引用AUTO_INCREMENT列
insert into table1_default(a,b,txt) values(null,0,'update');
select txt,a incre_col,b from table1_default order by a;
+-------------------------------------------------------------------+-----------+------+
| txt                                                               | incre_col | b    |
+-------------------------------------------------------------------+-----------+------+
| 1当前自增值=>                                                     |         2 |   11 |
| 2当前自增值=>                                                     |         3 |   11 |
| update                                                            |         4 |    0 |
| 将AUTO_INCREMENT列值设置为大于当前最大自增值的值                  |        30 |  111 |
+-------------------------------------------------------------------+-----------+------+
update table1_default set b = a+1 where txt = 'update';
insert into table1_default values(null,11,'当前自增值==>');
select txt,a incre_col,b from table1_default order by a;
+-------------------------------------------------------------------+-----------+------+
| txt                                                               | incre_col | b    |
+-------------------------------------------------------------------+-----------+------+
| 1当前自增值=>                                                     |         2 |   11 |
| 2当前自增值=>                                                     |         3 |   11 |
| update                                                            |         4 |    5 |
| 当前自增值==>                                                     |         5 |   11 |
| 将AUTO_INCREMENT列值设置为大于当前最大自增值的值                  |        30 |  111 |
+-------------------------------------------------------------------+-----------+------+
insert into table2_order(a,b,txt) values(null,0,'update');
select txt,a incre_col,b from table2_order order by a;
+-------------------------------------------------------------------+-----------+------+
| txt                                                               | incre_col | b    |
+-------------------------------------------------------------------+-----------+------+
| 1当前自增值=>                                                     |         2 |   22 |
| 2当前自增值=>                                                     |         3 |   22 |
| update                                                            |         4 |    0 |
| 将AUTO_INCREMENT列值设置为大于当前最大自增值的值                  |        30 |  222 |
+-------------------------------------------------------------------+-----------+------+
update table2_order set b = a+2 where txt = 'update';
insert into table2_order values(null,22,'当前自增值==>');
select txt,a incre_col,b from table2_order order by a;
+-------------------------------------------------------------------+-----------+------+
| txt                                                               | incre_col | b    |
+-------------------------------------------------------------------+-----------+------+
| 1当前自增值=>                                                     |         2 |   22 |
| 2当前自增值=>                                                     |         3 |   22 |
| update                                                            |         4 |    6 |
| 当前自增值==>                                                     |         5 |   22 |
| 将AUTO_INCREMENT列值设置为大于当前最大自增值的值                  |        30 |  222 |
+-------------------------------------------------------------------+-----------+------+
insert into table3_noorder(a,b,txt) values(null,0,'update');
select txt,a incre_col,b from table3_noorder order by a;
+-------------------------------------------------------------------+-----------+------+
| txt                                                               | incre_col | b    |
+-------------------------------------------------------------------+-----------+------+
| 1当前自增值=>                                                     |         2 |   33 |
| 2当前自增值=>                                                     |         3 |   33 |
| update                                                            |         4 |    0 |
| 将AUTO_INCREMENT列值设置为大于当前最大自增值的值                  |        30 |  333 |
+-------------------------------------------------------------------+-----------+------+
update table3_noorder set b = a+3 where txt = 'update';
insert into table3_noorder values(null,33,'当前自增值==>');
select txt,a incre_col,b from table3_noorder order by a;
+-------------------------------------------------------------------+-----------+------+
| txt                                                               | incre_col | b    |
+-------------------------------------------------------------------+-----------+------+
| 1当前自增值=>                                                     |         2 |   33 |
| 2当前自增值=>                                                     |         3 |   33 |
| update                                                            |         4 |    7 |
| 当前自增值==>                                                     |         5 |   33 |
| 将AUTO_INCREMENT列值设置为大于当前最大自增值的值                  |        30 |  333 |
+-------------------------------------------------------------------+-----------+------+
###### auto_incre_3-1-4 ④SELECT操作
drop table table1_default;
create table table1_default (
  a int not null auto_increment primary key,
  b int default 1,
  txt varchar(64) default 'table1_default 默认order模式',
  unique index(a)
)partition by range(a) 
 subpartition by hash(a) subpartitions 4  
(partition p0 values less than (10),  
 partition p1 values less than (20),  
 partition p2 values less than maxvalue);
insert into table1_default(a) values(null),(null),(null);
insert into table1_default(a,b,txt) values(null,0,'update');
update table1_default set b = a*100 where txt = 'update';
insert into table1_default values(null,11,'当前自增值==>');
select txt,a incre_col,b from table1_default order by a;
+----------------------------------+-----------+------+
| txt                              | incre_col | b    |
+----------------------------------+-----------+------+
| table1_default 默认order模式     |         1 |    1 |
| table1_default 默认order模式     |         2 |    1 |
| table1_default 默认order模式     |         3 |    1 |
| update                           |         4 |  400 |
| 当前自增值==>                    |         5 |   11 |
+----------------------------------+-----------+------+
select a incre_col from table1_default order by a;
+-----------+
| incre_col |
+-----------+
|         1 |
|         2 |
|         3 |
|         4 |
|         5 |
+-----------+
select abs(a) from table1_default order by a;
+--------+
| abs(a) |
+--------+
|      1 |
|      2 |
|      3 |
|      4 |
|      5 |
+--------+
select a+b from table1_default order by a;
+------+
| a+b  |
+------+
|    2 |
|    3 |
|    4 |
|  404 |
|   16 |
+------+
select txt,a incre_col,b from table1_default order by a;
+----------------------------------+-----------+------+
| txt                              | incre_col | b    |
+----------------------------------+-----------+------+
| table1_default 默认order模式     |         1 |    1 |
| table1_default 默认order模式     |         2 |    1 |
| table1_default 默认order模式     |         3 |    1 |
| update                           |         4 |  400 |
| 当前自增值==>                    |         5 |   11 |
+----------------------------------+-----------+------+
drop table table2_order;
create table table2_order (
  a int not null auto_increment primary key,
  b int default 2,
  txt varchar(64) default 'table2_order order模式',
  unique index(a)
) auto_increment_mode = 'order' 
 partition by range(a) 
 subpartition by hash(a) subpartitions 4  
(partition p0 values less than (10),  
 partition p1 values less than (20),  
 partition p2 values less than maxvalue);
insert into table2_order(a) values(null),(null),(null);
insert into table2_order(a,b,txt) values(null,0,'update');
update table2_order set b = a*100 where txt = 'update';
insert into table2_order values(null,11,'当前自增值==>');
select txt,a incre_col,b from table2_order order by a;
+--------------------------+-----------+------+
| txt                      | incre_col | b    |
+--------------------------+-----------+------+
| table2_order order模式   |         1 |    2 |
| table2_order order模式   |         2 |    2 |
| table2_order order模式   |         3 |    2 |
| update                   |         4 |  400 |
| 当前自增值==>            |         5 |   11 |
+--------------------------+-----------+------+
select a incre_col from table2_order order by a;
+-----------+
| incre_col |
+-----------+
|         1 |
|         2 |
|         3 |
|         4 |
|         5 |
+-----------+
select abs(a) from table2_order order by a;
+--------+
| abs(a) |
+--------+
|      1 |
|      2 |
|      3 |
|      4 |
|      5 |
+--------+
select a+b from table2_order order by a;
+------+
| a+b  |
+------+
|    3 |
|    4 |
|    5 |
|  404 |
|   16 |
+------+
select txt,a incre_col,b from table2_order order by a;
+--------------------------+-----------+------+
| txt                      | incre_col | b    |
+--------------------------+-----------+------+
| table2_order order模式   |         1 |    2 |
| table2_order order模式   |         2 |    2 |
| table2_order order模式   |         3 |    2 |
| update                   |         4 |  400 |
| 当前自增值==>            |         5 |   11 |
+--------------------------+-----------+------+
drop table table3_noorder;
create table table3_noorder (
  a int not null auto_increment primary key,
  b int default 3,
  txt varchar(64) default 'table3_noorder noorder模式',
  unique index(a)
) auto_increment_mode = 'noorder' 
 partition by range(a) 
 subpartition by hash(a) subpartitions 4  
(partition p0 values less than (10),  
 partition p1 values less than (20),  
 partition p2 values less than maxvalue);
insert into table3_noorder(a) values(null),(null),(null);
insert into table3_noorder(a,b,txt) values(null,0,'update');
update table3_noorder set b = a*100 where txt = 'update';
insert into table3_noorder values(null,11,'当前自增值==>');
select txt,a incre_col,b from table3_noorder order by a;
+------------------------------+-----------+------+
| txt                          | incre_col | b    |
+------------------------------+-----------+------+
| table3_noorder noorder模式   |         1 |    3 |
| table3_noorder noorder模式   |         2 |    3 |
| table3_noorder noorder模式   |         3 |    3 |
| update                       |         4 |  400 |
| 当前自增值==>                |         5 |   11 |
+------------------------------+-----------+------+
select a incre_col from table3_noorder order by a;
+-----------+
| incre_col |
+-----------+
|         1 |
|         2 |
|         3 |
|         4 |
|         5 |
+-----------+
select abs(a) from table3_noorder order by a;
+--------+
| abs(a) |
+--------+
|      1 |
|      2 |
|      3 |
|      4 |
|      5 |
+--------+
select a+b from table3_noorder order by a;
+------+
| a+b  |
+------+
|    4 |
|    5 |
|    6 |
|  404 |
|   16 |
+------+
select txt,a incre_col,b from table3_noorder order by a;
+------------------------------+-----------+------+
| txt                          | incre_col | b    |
+------------------------------+-----------+------+
| table3_noorder noorder模式   |         1 |    3 |
| table3_noorder noorder模式   |         2 |    3 |
| table3_noorder noorder模式   |         3 |    3 |
| update                       |         4 |  400 |
| 当前自增值==>                |         5 |   11 |
+------------------------------+-----------+------+
############ auto_incre_2-4 ④模式切换 ############
##建表
drop table table2_order;
create table table2_order (
  a int auto_increment,
  b int default 2,
  txt varchar(64) default 'table2_order'
) auto_increment_mode = 'order'
 partition by range(a) 
 subpartition by hash(a) subpartitions 4  
(partition p0 values less than (10),  
 partition p1 values less than (20),  
 partition p2 values less than maxvalue);
## ORDER==>ORDER
insert into table2_order(a) values(0),(0),(0),(0);
select txt,a incre_col, b from table2_order order by a;
+--------------+-----------+------+
| txt          | incre_col | b    |
+--------------+-----------+------+
| table2_order |         1 |    2 |
| table2_order |         2 |    2 |
| table2_order |         3 |    2 |
| table2_order |         4 |    2 |
+--------------+-----------+------+
insert into table2_order values(0,11,'ORDER test1');
update table2_order set a = 4 where b = 11;
insert into table2_order values(null,0,'当前自增值1==>');
select txt,a incre_col, b from table2_order order by a;
+---------------------+-----------+------+
| txt                 | incre_col | b    |
+---------------------+-----------+------+
| table2_order        |         1 |    2 |
| table2_order        |         2 |    2 |
| table2_order        |         3 |    2 |
| table2_order        |         4 |    2 |
| ORDER test1         |         4 |   11 |
| 当前自增值1==>      |         6 |    0 |
+---------------------+-----------+------+
alter table table2_order auto_increment_mode = 'ORDER';
insert into table2_order values(0,2,'ORDER==>ORDER'),(0,2,'ORDER==>ORDER'),(0,2,'ORDER==>ORDER'),(0,2,'ORDER==>ORDER');
select txt,a incre_col, b from table2_order order by a;
+---------------------+-----------+------+
| txt                 | incre_col | b    |
+---------------------+-----------+------+
| table2_order        |         1 |    2 |
| table2_order        |         2 |    2 |
| table2_order        |         3 |    2 |
| table2_order        |         4 |    2 |
| ORDER test1         |         4 |   11 |
| 当前自增值1==>      |         6 |    0 |
| ORDER==>ORDER       |         7 |    2 |
| ORDER==>ORDER       |         8 |    2 |
| ORDER==>ORDER       |         9 |    2 |
| ORDER==>ORDER       |        10 |    2 |
+---------------------+-----------+------+
insert into table2_order values(0,22,'ORDER==>ORDER test2');
update table2_order set a = 4 where b = 22;
insert into table2_order values(null,0,'当前自增值2==>');
select txt,a incre_col, b from table2_order order by a;
+---------------------+-----------+------+
| txt                 | incre_col | b    |
+---------------------+-----------+------+
| table2_order        |         1 |    2 |
| table2_order        |         2 |    2 |
| table2_order        |         3 |    2 |
| table2_order        |         4 |    2 |
| ORDER test1         |         4 |   11 |
| ORDER==>ORDER test2 |         4 |   22 |
| 当前自增值1==>      |         6 |    0 |
| ORDER==>ORDER       |         7 |    2 |
| ORDER==>ORDER       |         8 |    2 |
| ORDER==>ORDER       |         9 |    2 |
| ORDER==>ORDER       |        10 |    2 |
| 当前自增值2==>      |        12 |    0 |
+---------------------+-----------+------+
## ORDER==>NOORDER
alter table table2_order auto_increment_mode = 'NOORDER';
insert into table2_order values(0,3,'ORDER==>NOORDER'),(0,3,'ORDER==>NOORDER'),(0,3,'ORDER==>NOORDER'),(0,3,'ORDER==>NOORDER');
select txt,a incre_col, b from table2_order order by a;
+---------------------+-----------+------+
| txt                 | incre_col | b    |
+---------------------+-----------+------+
| table2_order        |         1 |    2 |
| table2_order        |         2 |    2 |
| table2_order        |         3 |    2 |
| table2_order        |         4 |    2 |
| ORDER test1         |         4 |   11 |
| ORDER==>ORDER test2 |         4 |   22 |
| 当前自增值1==>      |         6 |    0 |
| ORDER==>ORDER       |         7 |    2 |
| ORDER==>ORDER       |         8 |    2 |
| ORDER==>ORDER       |         9 |    2 |
| ORDER==>ORDER       |        10 |    2 |
| 当前自增值2==>      |        12 |    0 |
| ORDER==>NOORDER     |   1000001 |    3 |
| ORDER==>NOORDER     |   1000002 |    3 |
| ORDER==>NOORDER     |   1000003 |    3 |
| ORDER==>NOORDER     |   1000004 |    3 |
+---------------------+-----------+------+
insert into table2_order values(0,33,'ORDER==>NOORDE test3');
update table2_order set a = 4 where b = 33;
insert into table2_order values(null,0,'当前自增值3==>');
select txt,a incre_col, b from table2_order order by a;
+----------------------+-----------+------+
| txt                  | incre_col | b    |
+----------------------+-----------+------+
| table2_order         |         1 |    2 |
| table2_order         |         2 |    2 |
| table2_order         |         3 |    2 |
| table2_order         |         4 |    2 |
| ORDER==>NOORDE test3 |         4 |   33 |
| ORDER test1          |         4 |   11 |
| ORDER==>ORDER test2  |         4 |   22 |
| 当前自增值1==>       |         6 |    0 |
| ORDER==>ORDER        |         7 |    2 |
| ORDER==>ORDER        |         8 |    2 |
| ORDER==>ORDER        |         9 |    2 |
| ORDER==>ORDER        |        10 |    2 |
| 当前自增值2==>       |        12 |    0 |
| ORDER==>NOORDER      |   1000001 |    3 |
| ORDER==>NOORDER      |   1000002 |    3 |
| ORDER==>NOORDER      |   1000003 |    3 |
| ORDER==>NOORDER      |   1000004 |    3 |
| 当前自增值3==>       |   1000006 |    0 |
+----------------------+-----------+------+
## NOORDER==>NOORDER
alter table table2_order auto_increment_mode = 'NOORDER';
insert into table2_order values(0,4,'NOORDER==>NOORDER'),(0,4,'NOORDER==>NOORDER'),(0,4,'NOORDER==>NOORDER'),(0,4,'NOORDER==>NOORDER');
select txt,a incre_col, b from table2_order order by a;
+----------------------+-----------+------+
| txt                  | incre_col | b    |
+----------------------+-----------+------+
| table2_order         |         1 |    2 |
| table2_order         |         2 |    2 |
| table2_order         |         3 |    2 |
| ORDER test1          |         4 |   11 |
| ORDER==>ORDER test2  |         4 |   22 |
| ORDER==>NOORDE test3 |         4 |   33 |
| table2_order         |         4 |    2 |
| 当前自增值1==>       |         6 |    0 |
| ORDER==>ORDER        |         7 |    2 |
| ORDER==>ORDER        |         8 |    2 |
| ORDER==>ORDER        |         9 |    2 |
| ORDER==>ORDER        |        10 |    2 |
| 当前自增值2==>       |        12 |    0 |
| ORDER==>NOORDER      |   1000001 |    3 |
| ORDER==>NOORDER      |   1000002 |    3 |
| ORDER==>NOORDER      |   1000003 |    3 |
| ORDER==>NOORDER      |   1000004 |    3 |
| 当前自增值3==>       |   1000006 |    0 |
| NOORDER==>NOORDER    |   1000007 |    4 |
| NOORDER==>NOORDER    |   1000008 |    4 |
| NOORDER==>NOORDER    |   1000009 |    4 |
| NOORDER==>NOORDER    |   1000010 |    4 |
+----------------------+-----------+------+
insert into table2_order values(0,44,'NOORDER==>NOORDER test4');
update table2_order set a = 4 where b = 44;
insert into table2_order values(null,0,'当前自增值4==>');
select txt,a incre_col, b from table2_order order by a;
+-------------------------+-----------+------+
| txt                     | incre_col | b    |
+-------------------------+-----------+------+
| table2_order            |         1 |    2 |
| table2_order            |         2 |    2 |
| table2_order            |         3 |    2 |
| NOORDER==>NOORDER test4 |         4 |   44 |
| ORDER test1             |         4 |   11 |
| ORDER==>ORDER test2     |         4 |   22 |
| ORDER==>NOORDE test3    |         4 |   33 |
| table2_order            |         4 |    2 |
| 当前自增值1==>          |         6 |    0 |
| ORDER==>ORDER           |         7 |    2 |
| ORDER==>ORDER           |         8 |    2 |
| ORDER==>ORDER           |         9 |    2 |
| ORDER==>ORDER           |        10 |    2 |
| 当前自增值2==>          |        12 |    0 |
| ORDER==>NOORDER         |   1000001 |    3 |
| ORDER==>NOORDER         |   1000002 |    3 |
| ORDER==>NOORDER         |   1000003 |    3 |
| ORDER==>NOORDER         |   1000004 |    3 |
| 当前自增值3==>          |   1000006 |    0 |
| NOORDER==>NOORDER       |   1000007 |    4 |
| NOORDER==>NOORDER       |   1000008 |    4 |
| NOORDER==>NOORDER       |   1000009 |    4 |
| NOORDER==>NOORDER       |   1000010 |    4 |
| 当前自增值4==>          |   1000012 |    0 |
+-------------------------+-----------+------+
## NOORDER==>ORDER
alter table table2_order auto_increment_mode = 'ORDER';
insert into table2_order values(0,5,'NOORDER==>ORDER'),(0,5,'NOORDER==>ORDER'),(0,5,'NOORDER==>ORDER'),(0,5,'NOORDER==>ORDER');
select txt,a incre_col, b from table2_order order by a;
+-------------------------+-----------+------+
| txt                     | incre_col | b    |
+-------------------------+-----------+------+
| table2_order            |         1 |    2 |
| table2_order            |         2 |    2 |
| table2_order            |         3 |    2 |
| ORDER test1             |         4 |   11 |
| ORDER==>ORDER test2     |         4 |   22 |
| ORDER==>NOORDE test3    |         4 |   33 |
| NOORDER==>NOORDER test4 |         4 |   44 |
| table2_order            |         4 |    2 |
| 当前自增值1==>          |         6 |    0 |
| ORDER==>ORDER           |         7 |    2 |
| ORDER==>ORDER           |         8 |    2 |
| ORDER==>ORDER           |         9 |    2 |
| ORDER==>ORDER           |        10 |    2 |
| 当前自增值2==>          |        12 |    0 |
| ORDER==>NOORDER         |   1000001 |    3 |
| ORDER==>NOORDER         |   1000002 |    3 |
| ORDER==>NOORDER         |   1000003 |    3 |
| ORDER==>NOORDER         |   1000004 |    3 |
| 当前自增值3==>          |   1000006 |    0 |
| NOORDER==>NOORDER       |   1000007 |    4 |
| NOORDER==>NOORDER       |   1000008 |    4 |
| NOORDER==>NOORDER       |   1000009 |    4 |
| NOORDER==>NOORDER       |   1000010 |    4 |
| 当前自增值4==>          |   1000012 |    0 |
| NOORDER==>ORDER         |   2000001 |    5 |
| NOORDER==>ORDER         |   2000002 |    5 |
| NOORDER==>ORDER         |   2000003 |    5 |
| NOORDER==>ORDER         |   2000004 |    5 |
+-------------------------+-----------+------+
insert into table2_order values(0,55,'NOORDER==>ORDER test5');
select txt,a incre_col, b from table2_order order by a;
+-------------------------+-----------+------+
| txt                     | incre_col | b    |
+-------------------------+-----------+------+
| table2_order            |         1 |    2 |
| table2_order            |         2 |    2 |
| table2_order            |         3 |    2 |
| ORDER test1             |         4 |   11 |
| ORDER==>ORDER test2     |         4 |   22 |
| ORDER==>NOORDE test3    |         4 |   33 |
| NOORDER==>NOORDER test4 |         4 |   44 |
| table2_order            |         4 |    2 |
| 当前自增值1==>          |         6 |    0 |
| ORDER==>ORDER           |         7 |    2 |
| ORDER==>ORDER           |         8 |    2 |
| ORDER==>ORDER           |         9 |    2 |
| ORDER==>ORDER           |        10 |    2 |
| 当前自增值2==>          |        12 |    0 |
| ORDER==>NOORDER         |   1000001 |    3 |
| ORDER==>NOORDER         |   1000002 |    3 |
| ORDER==>NOORDER         |   1000003 |    3 |
| ORDER==>NOORDER         |   1000004 |    3 |
| 当前自增值3==>          |   1000006 |    0 |
| NOORDER==>NOORDER       |   1000007 |    4 |
| NOORDER==>NOORDER       |   1000008 |    4 |
| NOORDER==>NOORDER       |   1000009 |    4 |
| NOORDER==>NOORDER       |   1000010 |    4 |
| 当前自增值4==>          |   1000012 |    0 |
| NOORDER==>ORDER         |   2000001 |    5 |
| NOORDER==>ORDER         |   2000002 |    5 |
| NOORDER==>ORDER         |   2000003 |    5 |
| NOORDER==>ORDER         |   2000004 |    5 |
| NOORDER==>ORDER test5   |   2000005 |   55 |
+-------------------------+-----------+------+
update table2_order set a = 4 where b = 55;
insert into table2_order values(null,0,'当前自增值5==>');
select txt,a incre_col, b from table2_order order by a;
+-------------------------+-----------+------+
| txt                     | incre_col | b    |
+-------------------------+-----------+------+
| table2_order            |         1 |    2 |
| table2_order            |         2 |    2 |
| table2_order            |         3 |    2 |
| ORDER test1             |         4 |   11 |
| ORDER==>ORDER test2     |         4 |   22 |
| ORDER==>NOORDE test3    |         4 |   33 |
| NOORDER==>NOORDER test4 |         4 |   44 |
| NOORDER==>ORDER test5   |         4 |   55 |
| table2_order            |         4 |    2 |
| 当前自增值1==>          |         6 |    0 |
| ORDER==>ORDER           |         7 |    2 |
| ORDER==>ORDER           |         8 |    2 |
| ORDER==>ORDER           |         9 |    2 |
| ORDER==>ORDER           |        10 |    2 |
| 当前自增值2==>          |        12 |    0 |
| ORDER==>NOORDER         |   1000001 |    3 |
| ORDER==>NOORDER         |   1000002 |    3 |
| ORDER==>NOORDER         |   1000003 |    3 |
| ORDER==>NOORDER         |   1000004 |    3 |
| 当前自增值3==>          |   1000006 |    0 |
| NOORDER==>NOORDER       |   1000007 |    4 |
| NOORDER==>NOORDER       |   1000008 |    4 |
| NOORDER==>NOORDER       |   1000009 |    4 |
| NOORDER==>NOORDER       |   1000010 |    4 |
| 当前自增值4==>          |   1000012 |    0 |
| NOORDER==>ORDER         |   2000001 |    5 |
| NOORDER==>ORDER         |   2000002 |    5 |
| NOORDER==>ORDER         |   2000003 |    5 |
| NOORDER==>ORDER         |   2000004 |    5 |
| 当前自增值5==>          |   2000006 |    0 |
+-------------------------+-----------+------+
##########################################################################################################################
###### 标签：auto_incre_1-1，auto_incre_1-4，auto_incre_2，auto_incre_3-1
###### 功能：数据类型（INT），临时表，自增模式，DML操作 
########################################################################################################################## 
alter system set default_auto_increment_mode = 'order';
############ auto_incre_3-1 DML操作 ############
###### auto_incre_3-1-1 ①INSERT操作 
##简单插入
##INSERT 语句
##table1_default
insert into table1_default(a) values(null);
insert into table1_default(a) values(null),(null),(null);
select txt,a incre_col,b from table1_default order by a;
+----------------------------------+-----------+------+
| txt                              | incre_col | b    |
+----------------------------------+-----------+------+
| table1_default 默认order模式     |         1 |    1 |
| table1_default 默认order模式     |         2 |    1 |
| table1_default 默认order模式     |         3 |    1 |
| update                           |         4 |  400 |
| 当前自增值==>                    |         5 |   11 |
| table1_default 默认order模式     |         6 |    1 |
| table1_default 默认order模式     |         7 |    1 |
| table1_default 默认order模式     |         8 |    1 |
| table1_default 默认order模式     |         9 |    1 |
+----------------------------------+-----------+------+
insert into table1_default(a) values(10);
insert into table1_default(a,txt) values(0,'最新自增值=>');
select txt,a incre_col,b from table1_default order by a;
+----------------------------------+-----------+------+
| txt                              | incre_col | b    |
+----------------------------------+-----------+------+
| table1_default 默认order模式     |         1 |    1 |
| table1_default 默认order模式     |         2 |    1 |
| table1_default 默认order模式     |         3 |    1 |
| update                           |         4 |  400 |
| 当前自增值==>                    |         5 |   11 |
| table1_default 默认order模式     |         6 |    1 |
| table1_default 默认order模式     |         7 |    1 |
| table1_default 默认order模式     |         8 |    1 |
| table1_default 默认order模式     |         9 |    1 |
| table1_default 默认order模式     |        10 |    1 |
| 最新自增值=>                     |        11 |    1 |
+----------------------------------+-----------+------+
##table2_order
insert into table2_order(a) values(null);
insert into table2_order(a) values(null),(null),(null);
select txt,a incre_col,b from table2_order order by a;
+-------------------------+-----------+------+
| txt                     | incre_col | b    |
+-------------------------+-----------+------+
| table2_order            |         1 |    2 |
| table2_order            |         2 |    2 |
| table2_order            |         3 |    2 |
| ORDER test1             |         4 |   11 |
| ORDER==>ORDER test2     |         4 |   22 |
| ORDER==>NOORDE test3    |         4 |   33 |
| NOORDER==>NOORDER test4 |         4 |   44 |
| NOORDER==>ORDER test5   |         4 |   55 |
| table2_order            |         4 |    2 |
| 当前自增值1==>          |         6 |    0 |
| ORDER==>ORDER           |         7 |    2 |
| ORDER==>ORDER           |         8 |    2 |
| ORDER==>ORDER           |         9 |    2 |
| ORDER==>ORDER           |        10 |    2 |
| 当前自增值2==>          |        12 |    0 |
| ORDER==>NOORDER         |   1000001 |    3 |
| ORDER==>NOORDER         |   1000002 |    3 |
| ORDER==>NOORDER         |   1000003 |    3 |
| ORDER==>NOORDER         |   1000004 |    3 |
| 当前自增值3==>          |   1000006 |    0 |
| NOORDER==>NOORDER       |   1000007 |    4 |
| NOORDER==>NOORDER       |   1000008 |    4 |
| NOORDER==>NOORDER       |   1000009 |    4 |
| NOORDER==>NOORDER       |   1000010 |    4 |
| 当前自增值4==>          |   1000012 |    0 |
| NOORDER==>ORDER         |   2000001 |    5 |
| NOORDER==>ORDER         |   2000002 |    5 |
| NOORDER==>ORDER         |   2000003 |    5 |
| NOORDER==>ORDER         |   2000004 |    5 |
| 当前自增值5==>          |   2000006 |    0 |
| table2_order            |   2000007 |    2 |
| table2_order            |   2000008 |    2 |
| table2_order            |   2000009 |    2 |
| table2_order            |   2000010 |    2 |
+-------------------------+-----------+------+
insert into table2_order(a) values(10);
insert into table2_order(a,txt) values(0,'最新自增值=>');
select txt,a incre_col,b from table2_order order by a;
+-------------------------+-----------+------+
| txt                     | incre_col | b    |
+-------------------------+-----------+------+
| table2_order            |         1 |    2 |
| table2_order            |         2 |    2 |
| table2_order            |         3 |    2 |
| ORDER test1             |         4 |   11 |
| NOORDER==>NOORDER test4 |         4 |   44 |
| NOORDER==>ORDER test5   |         4 |   55 |
| table2_order            |         4 |    2 |
| ORDER==>ORDER test2     |         4 |   22 |
| ORDER==>NOORDE test3    |         4 |   33 |
| 当前自增值1==>          |         6 |    0 |
| ORDER==>ORDER           |         7 |    2 |
| ORDER==>ORDER           |         8 |    2 |
| ORDER==>ORDER           |         9 |    2 |
| ORDER==>ORDER           |        10 |    2 |
| table2_order            |        10 |    2 |
| 当前自增值2==>          |        12 |    0 |
| ORDER==>NOORDER         |   1000001 |    3 |
| ORDER==>NOORDER         |   1000002 |    3 |
| ORDER==>NOORDER         |   1000003 |    3 |
| ORDER==>NOORDER         |   1000004 |    3 |
| 当前自增值3==>          |   1000006 |    0 |
| NOORDER==>NOORDER       |   1000007 |    4 |
| NOORDER==>NOORDER       |   1000008 |    4 |
| NOORDER==>NOORDER       |   1000009 |    4 |
| NOORDER==>NOORDER       |   1000010 |    4 |
| 当前自增值4==>          |   1000012 |    0 |
| NOORDER==>ORDER         |   2000001 |    5 |
| NOORDER==>ORDER         |   2000002 |    5 |
| NOORDER==>ORDER         |   2000003 |    5 |
| NOORDER==>ORDER         |   2000004 |    5 |
| 当前自增值5==>          |   2000006 |    0 |
| table2_order            |   2000007 |    2 |
| table2_order            |   2000008 |    2 |
| table2_order            |   2000009 |    2 |
| table2_order            |   2000010 |    2 |
| 最新自增值=>            |   2000011 |    2 |
+-------------------------+-----------+------+
##table3_noorder
insert into table3_noorder(a) values(null);
insert into table3_noorder(a) values(null),(null),(null);
select txt,a incre_col,b from table3_noorder order by a;
+------------------------------+-----------+------+
| txt                          | incre_col | b    |
+------------------------------+-----------+------+
| table3_noorder noorder模式   |         1 |    3 |
| table3_noorder noorder模式   |         2 |    3 |
| table3_noorder noorder模式   |         3 |    3 |
| update                       |         4 |  400 |
| 当前自增值==>                |         5 |   11 |
| table3_noorder noorder模式   |         6 |    3 |
| table3_noorder noorder模式   |         7 |    3 |
| table3_noorder noorder模式   |         8 |    3 |
| table3_noorder noorder模式   |         9 |    3 |
+------------------------------+-----------+------+
insert into table3_noorder(a) values(10);
insert into table3_noorder(a,txt) values(0,'最新自增值=>');
select txt,a incre_col,b from table3_noorder order by a;
+------------------------------+-----------+------+
| txt                          | incre_col | b    |
+------------------------------+-----------+------+
| table3_noorder noorder模式   |         1 |    3 |
| table3_noorder noorder模式   |         2 |    3 |
| table3_noorder noorder模式   |         3 |    3 |
| update                       |         4 |  400 |
| 当前自增值==>                |         5 |   11 |
| table3_noorder noorder模式   |         6 |    3 |
| table3_noorder noorder模式   |         7 |    3 |
| table3_noorder noorder模式   |         8 |    3 |
| table3_noorder noorder模式   |         9 |    3 |
| table3_noorder noorder模式   |        10 |    3 |
| 最新自增值=>                 |   1000001 |    3 |
+------------------------------+-----------+------+
##REPLACE 语句
replace into table1_default(a) values(0),(0),(0);
select txt,a incre_col,b from table1_default order by a;
+----------------------------------+-----------+------+
| txt                              | incre_col | b    |
+----------------------------------+-----------+------+
| table1_default 默认order模式     |         1 |    1 |
| table1_default 默认order模式     |         2 |    1 |
| table1_default 默认order模式     |         3 |    1 |
| update                           |         4 |  400 |
| 当前自增值==>                    |         5 |   11 |
| table1_default 默认order模式     |         6 |    1 |
| table1_default 默认order模式     |         7 |    1 |
| table1_default 默认order模式     |         8 |    1 |
| table1_default 默认order模式     |         9 |    1 |
| table1_default 默认order模式     |        10 |    1 |
| 最新自增值=>                     |        11 |    1 |
| table1_default 默认order模式     |        12 |    1 |
| table1_default 默认order模式     |        13 |    1 |
| table1_default 默认order模式     |        14 |    1 |
+----------------------------------+-----------+------+
replace into table2_order(a) values(0),(0),(0);
select txt,a incre_col,b from table2_order order by a;
+-------------------------+-----------+------+
| txt                     | incre_col | b    |
+-------------------------+-----------+------+
| table2_order            |         1 |    2 |
| table2_order            |         2 |    2 |
| table2_order            |         3 |    2 |
| ORDER test1             |         4 |   11 |
| NOORDER==>NOORDER test4 |         4 |   44 |
| NOORDER==>ORDER test5   |         4 |   55 |
| table2_order            |         4 |    2 |
| ORDER==>ORDER test2     |         4 |   22 |
| ORDER==>NOORDE test3    |         4 |   33 |
| 当前自增值1==>          |         6 |    0 |
| ORDER==>ORDER           |         7 |    2 |
| ORDER==>ORDER           |         8 |    2 |
| ORDER==>ORDER           |         9 |    2 |
| ORDER==>ORDER           |        10 |    2 |
| table2_order            |        10 |    2 |
| 当前自增值2==>          |        12 |    0 |
| ORDER==>NOORDER         |   1000001 |    3 |
| ORDER==>NOORDER         |   1000002 |    3 |
| ORDER==>NOORDER         |   1000003 |    3 |
| ORDER==>NOORDER         |   1000004 |    3 |
| 当前自增值3==>          |   1000006 |    0 |
| NOORDER==>NOORDER       |   1000007 |    4 |
| NOORDER==>NOORDER       |   1000008 |    4 |
| NOORDER==>NOORDER       |   1000009 |    4 |
| NOORDER==>NOORDER       |   1000010 |    4 |
| 当前自增值4==>          |   1000012 |    0 |
| NOORDER==>ORDER         |   2000001 |    5 |
| NOORDER==>ORDER         |   2000002 |    5 |
| NOORDER==>ORDER         |   2000003 |    5 |
| NOORDER==>ORDER         |   2000004 |    5 |
| 当前自增值5==>          |   2000006 |    0 |
| table2_order            |   2000007 |    2 |
| table2_order            |   2000008 |    2 |
| table2_order            |   2000009 |    2 |
| table2_order            |   2000010 |    2 |
| 最新自增值=>            |   2000011 |    2 |
| table2_order            |   2000012 |    2 |
| table2_order            |   2000013 |    2 |
| table2_order            |   2000014 |    2 |
+-------------------------+-----------+------+
replace into table3_noorder(a) values(null),(null),(null);
select txt,a incre_col,b from table3_noorder order by a;
+------------------------------+-----------+------+
| txt                          | incre_col | b    |
+------------------------------+-----------+------+
| table3_noorder noorder模式   |         1 |    3 |
| table3_noorder noorder模式   |         2 |    3 |
| table3_noorder noorder模式   |         3 |    3 |
| update                       |         4 |  400 |
| 当前自增值==>                |         5 |   11 |
| table3_noorder noorder模式   |         6 |    3 |
| table3_noorder noorder模式   |         7 |    3 |
| table3_noorder noorder模式   |         8 |    3 |
| table3_noorder noorder模式   |         9 |    3 |
| table3_noorder noorder模式   |        10 |    3 |
| 最新自增值=>                 |   1000001 |    3 |
| table3_noorder noorder模式   |   1000002 |    3 |
| table3_noorder noorder模式   |   1000003 |    3 |
| table3_noorder noorder模式   |   1000004 |    3 |
+------------------------------+-----------+------+
##测试点 - 将任何其他值插入 AUTO_INCREMENT列
##INSERT 语句
insert into table1_default(a) values(15),(-25),(35),(45.5);
insert into table1_default(a,txt) values(0,'最新自增值=>');
select txt,a incre_col,b from table1_default order by a;
+----------------------------------+-----------+------+
| txt                              | incre_col | b    |
+----------------------------------+-----------+------+
| table1_default 默认order模式     |       -25 |    1 |
| table1_default 默认order模式     |         1 |    1 |
| table1_default 默认order模式     |         2 |    1 |
| table1_default 默认order模式     |         3 |    1 |
| update                           |         4 |  400 |
| 当前自增值==>                    |         5 |   11 |
| table1_default 默认order模式     |         6 |    1 |
| table1_default 默认order模式     |         7 |    1 |
| table1_default 默认order模式     |         8 |    1 |
| table1_default 默认order模式     |         9 |    1 |
| table1_default 默认order模式     |        10 |    1 |
| 最新自增值=>                     |        11 |    1 |
| table1_default 默认order模式     |        12 |    1 |
| table1_default 默认order模式     |        13 |    1 |
| table1_default 默认order模式     |        14 |    1 |
| table1_default 默认order模式     |        15 |    1 |
| table1_default 默认order模式     |        35 |    1 |
| table1_default 默认order模式     |        46 |    1 |
| 最新自增值=>                     |        47 |    1 |
+----------------------------------+-----------+------+
insert into table2_order(a) values(15),(-25),(35),(45.5);
insert into table2_order(a,txt) values(0,'最新自增值=>');
select txt,a incre_col,b from table2_order order by a;
+-------------------------+-----------+------+
| txt                     | incre_col | b    |
+-------------------------+-----------+------+
| table2_order            |       -25 |    2 |
| table2_order            |         1 |    2 |
| table2_order            |         2 |    2 |
| table2_order            |         3 |    2 |
| ORDER==>NOORDE test3    |         4 |   33 |
| NOORDER==>NOORDER test4 |         4 |   44 |
| NOORDER==>ORDER test5   |         4 |   55 |
| ORDER test1             |         4 |   11 |
| ORDER==>ORDER test2     |         4 |   22 |
| table2_order            |         4 |    2 |
| 当前自增值1==>          |         6 |    0 |
| ORDER==>ORDER           |         7 |    2 |
| ORDER==>ORDER           |         8 |    2 |
| ORDER==>ORDER           |         9 |    2 |
| ORDER==>ORDER           |        10 |    2 |
| table2_order            |        10 |    2 |
| 当前自增值2==>          |        12 |    0 |
| table2_order            |        15 |    2 |
| table2_order            |        35 |    2 |
| table2_order            |        46 |    2 |
| ORDER==>NOORDER         |   1000001 |    3 |
| ORDER==>NOORDER         |   1000002 |    3 |
| ORDER==>NOORDER         |   1000003 |    3 |
| ORDER==>NOORDER         |   1000004 |    3 |
| 当前自增值3==>          |   1000006 |    0 |
| NOORDER==>NOORDER       |   1000007 |    4 |
| NOORDER==>NOORDER       |   1000008 |    4 |
| NOORDER==>NOORDER       |   1000009 |    4 |
| NOORDER==>NOORDER       |   1000010 |    4 |
| 当前自增值4==>          |   1000012 |    0 |
| NOORDER==>ORDER         |   2000001 |    5 |
| NOORDER==>ORDER         |   2000002 |    5 |
| NOORDER==>ORDER         |   2000003 |    5 |
| NOORDER==>ORDER         |   2000004 |    5 |
| 当前自增值5==>          |   2000006 |    0 |
| table2_order            |   2000007 |    2 |
| table2_order            |   2000008 |    2 |
| table2_order            |   2000009 |    2 |
| table2_order            |   2000010 |    2 |
| 最新自增值=>            |   2000011 |    2 |
| table2_order            |   2000012 |    2 |
| table2_order            |   2000013 |    2 |
| table2_order            |   2000014 |    2 |
| 最新自增值=>            |   2000015 |    2 |
+-------------------------+-----------+------+
insert into table3_noorder(a) values(15),(-25),(35),(45.5);
insert into table3_noorder(a,txt) values(0,'最新自增值=>');
select txt,a incre_col,b from table3_noorder order by a;
+------------------------------+-----------+------+
| txt                          | incre_col | b    |
+------------------------------+-----------+------+
| table3_noorder noorder模式   |       -25 |    3 |
| table3_noorder noorder模式   |         1 |    3 |
| table3_noorder noorder模式   |         2 |    3 |
| table3_noorder noorder模式   |         3 |    3 |
| update                       |         4 |  400 |
| 当前自增值==>                |         5 |   11 |
| table3_noorder noorder模式   |         6 |    3 |
| table3_noorder noorder模式   |         7 |    3 |
| table3_noorder noorder模式   |         8 |    3 |
| table3_noorder noorder模式   |         9 |    3 |
| table3_noorder noorder模式   |        10 |    3 |
| table3_noorder noorder模式   |        15 |    3 |
| table3_noorder noorder模式   |        35 |    3 |
| table3_noorder noorder模式   |        46 |    3 |
| 最新自增值=>                 |   1000001 |    3 |
| table3_noorder noorder模式   |   1000002 |    3 |
| table3_noorder noorder模式   |   1000003 |    3 |
| table3_noorder noorder模式   |   1000004 |    3 |
| 最新自增值=>                 |   1000005 |    3 |
+------------------------------+-----------+------+
############ auto_incre_2-4 ④模式切换 ############
##建表
###### INT 类型，索引 - 唯一索引
###预处理有问题，暂时注释掉
drop table table1_default;
drop table table2_order;
drop table table3_noorder;
drop table table0_date;
# Clean up users
drop user whh@'%';
drop database if exists whh ;
