purge recyclebin;
result_format: 4
drop user whh@'%';
drop database if exists whh ;
create user whh identified by 'whh';
create database whh ;
grant all on *.* to whh with grant option;


##测试每种场合时，起始条件可能不同，可以删除再重新创建表
set sql_mode='strict_all_tables,no_zero_in_date';
alter system set default_auto_increment_mode = 'noorder';
##########################################################################################################################
###### 标签：auto_incre_1-1，auto_incre_1-3，auto_incre_2，auto_incre_3-1
###### 功能：数据类型（INT），分区表，自增模式，DML操作 
########################################################################################################################## 
############ range分区
##建表
drop table table0_date;
create table table0_date (
  a int,
  b int default 0,
  txt varchar(64) default 'table0_date'
);
insert into table0_date(a) values(110),(111),(112),(210),(211),(212);
drop table table1_default;
create table table1_default (
  a int not null auto_increment primary key,
  b int default 1,
  txt varchar(64) default 'table1_default 默认noorder模式',
  unique index(a)
)partition by range (a) ( 
partition p0 values less than (3), 
partition p1 values less than (6),  
partition p2 values less than (9), 
partition p3 values less than MAXVALUE);
drop table table2_order;
create table table2_order (
  a int not null auto_increment primary key,
  b int default 2,
  txt varchar(64) default 'table2_order order模式',
  unique index(a)
) auto_increment_mode = 'order' 
partition by range (a) ( 
partition p0 values less than (3), 
partition p1 values less than (6),  
partition p2 values less than (9), 
partition p3 values less than MAXVALUE);
drop table table3_noorder;
create table table3_noorder (
  a int not null auto_increment primary key,
  b int default 3,
  txt varchar(64) default 'table3_noorder noorder模式',
  unique index(a)
) auto_increment_mode = 'noorder' 
partition by range (a) ( 
partition p0 values less than (3), 
partition p1 values less than (6),  
partition p2 values less than (9), 
partition p3 values less than MAXVALUE);
############ auto_incre_3-1 DML操作 ############
###### auto_incre_3-1-1 ①INSERT操作 
##简单插入
##INSERT 语句
##table1_default
insert into table1_default(a) values(null);
insert into table1_default(a) values(null),(null),(null);
select txt,a incre_col,b from table1_default order by a;
+------------------------------------+-----------+------+
| txt                                | incre_col | b    |
+------------------------------------+-----------+------+
| table1_default 默认noorder模式     |         1 |    1 |
| table1_default 默认noorder模式     |         2 |    1 |
| table1_default 默认noorder模式     |         3 |    1 |
| table1_default 默认noorder模式     |         4 |    1 |
+------------------------------------+-----------+------+
insert into table1_default(a) values(10);
insert into table1_default(a,txt) values(0,'最新自增值=>');
select txt,a incre_col,b from table1_default order by a;
+------------------------------------+-----------+------+
| txt                                | incre_col | b    |
+------------------------------------+-----------+------+
| table1_default 默认noorder模式     |         1 |    1 |
| table1_default 默认noorder模式     |         2 |    1 |
| table1_default 默认noorder模式     |         3 |    1 |
| table1_default 默认noorder模式     |         4 |    1 |
| table1_default 默认noorder模式     |        10 |    1 |
| 最新自增值=>                       |   1000001 |    1 |
+------------------------------------+-----------+------+
##table2_order
insert into table2_order(a) values(null);
insert into table2_order(a) values(null),(null),(null);
select txt,a incre_col,b from table2_order order by a;
+--------------------------+-----------+------+
| txt                      | incre_col | b    |
+--------------------------+-----------+------+
| table2_order order模式   |         1 |    2 |
| table2_order order模式   |         2 |    2 |
| table2_order order模式   |         3 |    2 |
| table2_order order模式   |         4 |    2 |
+--------------------------+-----------+------+
insert into table2_order(a) values(10);
insert into table2_order(a,txt) values(0,'最新自增值=>');
select txt,a incre_col,b from table2_order order by a;
+--------------------------+-----------+------+
| txt                      | incre_col | b    |
+--------------------------+-----------+------+
| table2_order order模式   |         1 |    2 |
| table2_order order模式   |         2 |    2 |
| table2_order order模式   |         3 |    2 |
| table2_order order模式   |         4 |    2 |
| table2_order order模式   |        10 |    2 |
| 最新自增值=>             |        11 |    2 |
+--------------------------+-----------+------+
##table3_noorder
insert into table3_noorder(a) values(null);
insert into table3_noorder(a) values(null),(null),(null);
select txt,a incre_col,b from table3_noorder order by a;
+------------------------------+-----------+------+
| txt                          | incre_col | b    |
+------------------------------+-----------+------+
| table3_noorder noorder模式   |         1 |    3 |
| table3_noorder noorder模式   |         2 |    3 |
| table3_noorder noorder模式   |         3 |    3 |
| table3_noorder noorder模式   |         4 |    3 |
+------------------------------+-----------+------+
insert into table3_noorder(a) values(10);
insert into table3_noorder(a,txt) values(0,'最新自增值=>');
select txt,a incre_col,b from table3_noorder order by a;
+------------------------------+-----------+------+
| txt                          | incre_col | b    |
+------------------------------+-----------+------+
| table3_noorder noorder模式   |         1 |    3 |
| table3_noorder noorder模式   |         2 |    3 |
| table3_noorder noorder模式   |         3 |    3 |
| table3_noorder noorder模式   |         4 |    3 |
| table3_noorder noorder模式   |        10 |    3 |
| 最新自增值=>                 |   1000001 |    3 |
+------------------------------+-----------+------+
##REPLACE 语句
replace into table1_default(a) values(0),(0),(0);
select txt,a incre_col,b from table1_default order by a;
+------------------------------------+-----------+------+
| txt                                | incre_col | b    |
+------------------------------------+-----------+------+
| table1_default 默认noorder模式     |         1 |    1 |
| table1_default 默认noorder模式     |         2 |    1 |
| table1_default 默认noorder模式     |         3 |    1 |
| table1_default 默认noorder模式     |         4 |    1 |
| table1_default 默认noorder模式     |        10 |    1 |
| 最新自增值=>                       |   1000001 |    1 |
| table1_default 默认noorder模式     |   1000002 |    1 |
| table1_default 默认noorder模式     |   1000003 |    1 |
| table1_default 默认noorder模式     |   1000004 |    1 |
+------------------------------------+-----------+------+
replace into table2_order(a) values(0),(0),(0);
select txt,a incre_col,b from table2_order order by a;
+--------------------------+-----------+------+
| txt                      | incre_col | b    |
+--------------------------+-----------+------+
| table2_order order模式   |         1 |    2 |
| table2_order order模式   |         2 |    2 |
| table2_order order模式   |         3 |    2 |
| table2_order order模式   |         4 |    2 |
| table2_order order模式   |        10 |    2 |
| 最新自增值=>             |        11 |    2 |
| table2_order order模式   |        12 |    2 |
| table2_order order模式   |        13 |    2 |
| table2_order order模式   |        14 |    2 |
+--------------------------+-----------+------+
replace into table3_noorder(a) values(null),(null),(null);
select txt,a incre_col,b from table3_noorder order by a;
+------------------------------+-----------+------+
| txt                          | incre_col | b    |
+------------------------------+-----------+------+
| table3_noorder noorder模式   |         1 |    3 |
| table3_noorder noorder模式   |         2 |    3 |
| table3_noorder noorder模式   |         3 |    3 |
| table3_noorder noorder模式   |         4 |    3 |
| table3_noorder noorder模式   |        10 |    3 |
| 最新自增值=>                 |   1000001 |    3 |
| table3_noorder noorder模式   |   1000002 |    3 |
| table3_noorder noorder模式   |   1000003 |    3 |
| table3_noorder noorder模式   |   1000004 |    3 |
+------------------------------+-----------+------+
##测试点 - 将任何其他值插入 AUTO_INCREMENT列
##INSERT 语句
insert into table1_default(a) values(15),(-25),(35),(45.5);
insert into table1_default(a,txt) values(0,'最新自增值=>');
select txt,a incre_col,b from table1_default order by a;
+------------------------------------+-----------+------+
| txt                                | incre_col | b    |
+------------------------------------+-----------+------+
| table1_default 默认noorder模式     |       -25 |    1 |
| table1_default 默认noorder模式     |         1 |    1 |
| table1_default 默认noorder模式     |         2 |    1 |
| table1_default 默认noorder模式     |         3 |    1 |
| table1_default 默认noorder模式     |         4 |    1 |
| table1_default 默认noorder模式     |        10 |    1 |
| table1_default 默认noorder模式     |        15 |    1 |
| table1_default 默认noorder模式     |        35 |    1 |
| table1_default 默认noorder模式     |        46 |    1 |
| 最新自增值=>                       |   1000001 |    1 |
| table1_default 默认noorder模式     |   1000002 |    1 |
| table1_default 默认noorder模式     |   1000003 |    1 |
| table1_default 默认noorder模式     |   1000004 |    1 |
| 最新自增值=>                       |   1000005 |    1 |
+------------------------------------+-----------+------+
insert into table2_order(a) values(15),(-25),(35),(45.5);
insert into table2_order(a,txt) values(0,'最新自增值=>');
select txt,a incre_col,b from table2_order order by a;
+--------------------------+-----------+------+
| txt                      | incre_col | b    |
+--------------------------+-----------+------+
| table2_order order模式   |       -25 |    2 |
| table2_order order模式   |         1 |    2 |
| table2_order order模式   |         2 |    2 |
| table2_order order模式   |         3 |    2 |
| table2_order order模式   |         4 |    2 |
| table2_order order模式   |        10 |    2 |
| 最新自增值=>             |        11 |    2 |
| table2_order order模式   |        12 |    2 |
| table2_order order模式   |        13 |    2 |
| table2_order order模式   |        14 |    2 |
| table2_order order模式   |        15 |    2 |
| table2_order order模式   |        35 |    2 |
| table2_order order模式   |        46 |    2 |
| 最新自增值=>             |        47 |    2 |
+--------------------------+-----------+------+
insert into table3_noorder(a) values(15),(-25),(35),(45.5);
insert into table3_noorder(a,txt) values(0,'最新自增值=>');
select txt,a incre_col,b from table3_noorder order by a;
+------------------------------+-----------+------+
| txt                          | incre_col | b    |
+------------------------------+-----------+------+
| table3_noorder noorder模式   |       -25 |    3 |
| table3_noorder noorder模式   |         1 |    3 |
| table3_noorder noorder模式   |         2 |    3 |
| table3_noorder noorder模式   |         3 |    3 |
| table3_noorder noorder模式   |         4 |    3 |
| table3_noorder noorder模式   |        10 |    3 |
| table3_noorder noorder模式   |        15 |    3 |
| table3_noorder noorder模式   |        35 |    3 |
| table3_noorder noorder模式   |        46 |    3 |
| 最新自增值=>                 |   1000001 |    3 |
| table3_noorder noorder模式   |   1000002 |    3 |
| table3_noorder noorder模式   |   1000003 |    3 |
| table3_noorder noorder模式   |   1000004 |    3 |
| 最新自增值=>                 |   1000005 |    3 |
+------------------------------+-----------+------+
##REPLACE 语句
replace into table1_default(a,txt) values(3,'new-3'),(-5,'new--5'),(10,'new-10'),(15.5,'new-15.5');
select txt,a incre_col,b from table1_default order by a;
+------------------------------------+-----------+------+
| txt                                | incre_col | b    |
+------------------------------------+-----------+------+
| table1_default 默认noorder模式     |       -25 |    1 |
| new--5                             |        -5 |    1 |
| table1_default 默认noorder模式     |         1 |    1 |
| table1_default 默认noorder模式     |         2 |    1 |
| new-3                              |         3 |    1 |
| table1_default 默认noorder模式     |         4 |    1 |
| new-10                             |        10 |    1 |
| table1_default 默认noorder模式     |        15 |    1 |
| new-15.5                           |        16 |    1 |
| table1_default 默认noorder模式     |        35 |    1 |
| table1_default 默认noorder模式     |        46 |    1 |
| 最新自增值=>                       |   1000001 |    1 |
| table1_default 默认noorder模式     |   1000002 |    1 |
| table1_default 默认noorder模式     |   1000003 |    1 |
| table1_default 默认noorder模式     |   1000004 |    1 |
| 最新自增值=>                       |   1000005 |    1 |
+------------------------------------+-----------+------+
insert into table1_default(a,txt) values(0,'最新自增值=>');
select txt,a incre_col,b from table1_default order by a;
+------------------------------------+-----------+------+
| txt                                | incre_col | b    |
+------------------------------------+-----------+------+
| table1_default 默认noorder模式     |       -25 |    1 |
| new--5                             |        -5 |    1 |
| table1_default 默认noorder模式     |         1 |    1 |
| table1_default 默认noorder模式     |         2 |    1 |
| new-3                              |         3 |    1 |
| table1_default 默认noorder模式     |         4 |    1 |
| new-10                             |        10 |    1 |
| table1_default 默认noorder模式     |        15 |    1 |
| new-15.5                           |        16 |    1 |
| table1_default 默认noorder模式     |        35 |    1 |
| table1_default 默认noorder模式     |        46 |    1 |
| 最新自增值=>                       |   1000001 |    1 |
| table1_default 默认noorder模式     |   1000002 |    1 |
| table1_default 默认noorder模式     |   1000003 |    1 |
| table1_default 默认noorder模式     |   1000004 |    1 |
| 最新自增值=>                       |   1000005 |    1 |
| 最新自增值=>                       |   1000006 |    1 |
+------------------------------------+-----------+------+
replace into table2_order(a,txt) values(3,'new-3'),(-5,'new--5'),(10,'new-10'),(15.5,'new-15.5');
select txt,a incre_col,b from table2_order order by a;
+--------------------------+-----------+------+
| txt                      | incre_col | b    |
+--------------------------+-----------+------+
| table2_order order模式   |       -25 |    2 |
| new--5                   |        -5 |    2 |
| table2_order order模式   |         1 |    2 |
| table2_order order模式   |         2 |    2 |
| new-3                    |         3 |    2 |
| table2_order order模式   |         4 |    2 |
| new-10                   |        10 |    2 |
| 最新自增值=>             |        11 |    2 |
| table2_order order模式   |        12 |    2 |
| table2_order order模式   |        13 |    2 |
| table2_order order模式   |        14 |    2 |
| table2_order order模式   |        15 |    2 |
| new-15.5                 |        16 |    2 |
| table2_order order模式   |        35 |    2 |
| table2_order order模式   |        46 |    2 |
| 最新自增值=>             |        47 |    2 |
+--------------------------+-----------+------+
insert into table2_order(a,txt) values(0,'最新自增值=>');
select txt,a incre_col,b from table2_order order by a;
+--------------------------+-----------+------+
| txt                      | incre_col | b    |
+--------------------------+-----------+------+
| table2_order order模式   |       -25 |    2 |
| new--5                   |        -5 |    2 |
| table2_order order模式   |         1 |    2 |
| table2_order order模式   |         2 |    2 |
| new-3                    |         3 |    2 |
| table2_order order模式   |         4 |    2 |
| new-10                   |        10 |    2 |
| 最新自增值=>             |        11 |    2 |
| table2_order order模式   |        12 |    2 |
| table2_order order模式   |        13 |    2 |
| table2_order order模式   |        14 |    2 |
| table2_order order模式   |        15 |    2 |
| new-15.5                 |        16 |    2 |
| table2_order order模式   |        35 |    2 |
| table2_order order模式   |        46 |    2 |
| 最新自增值=>             |        47 |    2 |
| 最新自增值=>             |        48 |    2 |
+--------------------------+-----------+------+
replace into table3_noorder(a,txt) values(3,'new-3'),(-5,'new--5'),(10,'new-10'),(15.5,'new-15.5');
select txt,a incre_col,b from table3_noorder order by a;
+------------------------------+-----------+------+
| txt                          | incre_col | b    |
+------------------------------+-----------+------+
| table3_noorder noorder模式   |       -25 |    3 |
| new--5                       |        -5 |    3 |
| table3_noorder noorder模式   |         1 |    3 |
| table3_noorder noorder模式   |         2 |    3 |
| new-3                        |         3 |    3 |
| table3_noorder noorder模式   |         4 |    3 |
| new-10                       |        10 |    3 |
| table3_noorder noorder模式   |        15 |    3 |
| new-15.5                     |        16 |    3 |
| table3_noorder noorder模式   |        35 |    3 |
| table3_noorder noorder模式   |        46 |    3 |
| 最新自增值=>                 |   1000001 |    3 |
| table3_noorder noorder模式   |   1000002 |    3 |
| table3_noorder noorder模式   |   1000003 |    3 |
| table3_noorder noorder模式   |   1000004 |    3 |
| 最新自增值=>                 |   1000005 |    3 |
+------------------------------+-----------+------+
insert into table3_noorder(a,txt) values(0,'最新自增值=>');
select txt,a incre_col,b from table3_noorder order by a;
+------------------------------+-----------+------+
| txt                          | incre_col | b    |
+------------------------------+-----------+------+
| table3_noorder noorder模式   |       -25 |    3 |
| new--5                       |        -5 |    3 |
| table3_noorder noorder模式   |         1 |    3 |
| table3_noorder noorder模式   |         2 |    3 |
| new-3                        |         3 |    3 |
| table3_noorder noorder模式   |         4 |    3 |
| new-10                       |        10 |    3 |
| table3_noorder noorder模式   |        15 |    3 |
| new-15.5                     |        16 |    3 |
| table3_noorder noorder模式   |        35 |    3 |
| table3_noorder noorder模式   |        46 |    3 |
| 最新自增值=>                 |   1000001 |    3 |
| table3_noorder noorder模式   |   1000002 |    3 |
| table3_noorder noorder模式   |   1000003 |    3 |
| table3_noorder noorder模式   |   1000004 |    3 |
| 最新自增值=>                 |   1000005 |    3 |
| 最新自增值=>                 |   1000006 |    3 |
+------------------------------+-----------+------+
##测试点 - 给AUTO_INCREMENT列插入下一个自增值（当前最大自增值+1），再查看最新自增值
##INSERT 语句
drop table table1_default;
create table table1_default (
  a int not null auto_increment primary key,
  b int default 1,
  txt varchar(64) default 'table1_default 默认order模式',
  unique index(a)
)partition by range (a) ( 
partition p0 values less than (3), 
partition p1 values less than (6),  
partition p2 values less than (9), 
partition p3 values less than MAXVALUE);
drop table table2_order;
create table table2_order (
  a int not null auto_increment primary key,
  b int default 2,
  txt varchar(64) default 'table2_order order模式',
  unique index(a)
) auto_increment_mode = 'order' 
partition by range (a) ( 
partition p0 values less than (3), 
partition p1 values less than (6),  
partition p2 values less than (9), 
partition p3 values less than MAXVALUE);
drop table table3_noorder;
create table table3_noorder (
  a int not null auto_increment primary key,
  b int default 3,
  txt varchar(64) default 'table3_noorder noorder模式',
  unique index(a)
) auto_increment_mode = 'noorder' 
partition by range (a) ( 
partition p0 values less than (3), 
partition p1 values less than (6),  
partition p2 values less than (9), 
partition p3 values less than MAXVALUE);
insert into table1_default(a) values(0);
insert into table1_default(a,txt) values(2,'插入下一个自增值2（当前最大自增值+1）');
insert into table1_default(a,txt) values(0,'最新自增值=>');
select txt,a incre_col,b from table1_default order by a;
+--------------------------------------------------------+-----------+------+
| txt                                                    | incre_col | b    |
+--------------------------------------------------------+-----------+------+
| table1_default 默认order模式                           |         1 |    1 |
| 插入下一个自增值2（当前最大自增值+1）                  |         2 |    1 |
| 最新自增值=>                                           |   1000001 |    1 |
+--------------------------------------------------------+-----------+------+
insert into table2_order(a) values(0);
insert into table2_order(a,txt) values(2,'插入下一个自增值2（当前最大自增值+1）');
insert into table2_order(a,txt) values(0,'最新自增值=>');
select txt,a incre_col,b from table2_order order by a;
+--------------------------------------------------------+-----------+------+
| txt                                                    | incre_col | b    |
+--------------------------------------------------------+-----------+------+
| table2_order order模式                                 |         1 |    2 |
| 插入下一个自增值2（当前最大自增值+1）                  |         2 |    2 |
| 最新自增值=>                                           |         3 |    2 |
+--------------------------------------------------------+-----------+------+
insert into table3_noorder(a) values(0);
insert into table3_noorder(a,txt) values(2,'插入下一个自增值2（当前最大自增值+1）');
insert into table3_noorder(a,txt) values(0,'最新自增值=>');
select txt,a incre_col,b from table3_noorder order by a;
+--------------------------------------------------------+-----------+------+
| txt                                                    | incre_col | b    |
+--------------------------------------------------------+-----------+------+
| table3_noorder noorder模式                             |         1 |    3 |
| 插入下一个自增值2（当前最大自增值+1）                  |         2 |    3 |
| 最新自增值=>                                           |   1000001 |    3 |
+--------------------------------------------------------+-----------+------+
##REPLACE 语句
replace into table1_default(a,txt) values(4,'replace插入下一个自增值2（当前最大自增值+1）');
replace into table1_default(a,txt) values(0,'最新自增值=>');
select txt,a incre_col,b from table1_default order by a;
+---------------------------------------------------------------+-----------+------+
| txt                                                           | incre_col | b    |
+---------------------------------------------------------------+-----------+------+
| table1_default 默认order模式                                  |         1 |    1 |
| 插入下一个自增值2（当前最大自增值+1）                         |         2 |    1 |
| replace插入下一个自增值2（当前最大自增值+1）                  |         4 |    1 |
| 最新自增值=>                                                  |   1000001 |    1 |
| 最新自增值=>                                                  |   1000002 |    1 |
+---------------------------------------------------------------+-----------+------+
replace into table2_order(a,txt) values(4,'replace插入下一个自增值2（当前最大自增值+1）');
replace into table2_order(a,txt) values(0,'最新自增值=>');
select txt,a incre_col,b from table2_order order by a;
+---------------------------------------------------------------+-----------+------+
| txt                                                           | incre_col | b    |
+---------------------------------------------------------------+-----------+------+
| table2_order order模式                                        |         1 |    2 |
| 插入下一个自增值2（当前最大自增值+1）                         |         2 |    2 |
| 最新自增值=>                                                  |         3 |    2 |
| replace插入下一个自增值2（当前最大自增值+1）                  |         4 |    2 |
| 最新自增值=>                                                  |         5 |    2 |
+---------------------------------------------------------------+-----------+------+
replace into table3_noorder(a,txt) values(1000002,'replace插入下一个自增值2（当前最大自增值+1）');
replace into table3_noorder(a,txt) values(0,'最新自增值=>');
select txt,a incre_col,b from table3_noorder order by a;
+---------------------------------------------------------------+-----------+------+
| txt                                                           | incre_col | b    |
+---------------------------------------------------------------+-----------+------+
| table3_noorder noorder模式                                    |         1 |    3 |
| 插入下一个自增值2（当前最大自增值+1）                         |         2 |    3 |
| 最新自增值=>                                                  |   1000001 |    3 |
| replace插入下一个自增值2（当前最大自增值+1）                  |   1000002 |    3 |
| 最新自增值=>                                                  |   2000001 |    3 |
+---------------------------------------------------------------+-----------+------+
##测试点 - 给表插入数据时引用AUTO_INCREMENT列的值
##INSERT 语句
insert into table1_default values(null,a*2,'引用AUTO_INCREMENT列的值');
insert into table1_default(a,txt) values(0,'最新自增值=>');
select txt,a incre_col,b from table1_default order by a;
+---------------------------------------------------------------+-----------+---------+
| txt                                                           | incre_col | b       |
+---------------------------------------------------------------+-----------+---------+
| table1_default 默认order模式                                  |         1 |       1 |
| 插入下一个自增值2（当前最大自增值+1）                         |         2 |       1 |
| replace插入下一个自增值2（当前最大自增值+1）                  |         4 |       1 |
| 最新自增值=>                                                  |   1000001 |       1 |
| 最新自增值=>                                                  |   1000002 |       1 |
| 引用AUTO_INCREMENT列的值                                      |   1000003 | 2000006 |
| 最新自增值=>                                                  |   2000001 |       1 |
+---------------------------------------------------------------+-----------+---------+
insert into table2_order values(null,a*2,'引用AUTO_INCREMENT列的值');
insert into table2_order(a,txt) values(0,'最新自增值=>');
select txt,a incre_col,b from table2_order order by a;
+---------------------------------------------------------------+-----------+------+
| txt                                                           | incre_col | b    |
+---------------------------------------------------------------+-----------+------+
| table2_order order模式                                        |         1 |    2 |
| 插入下一个自增值2（当前最大自增值+1）                         |         2 |    2 |
| 最新自增值=>                                                  |         3 |    2 |
| replace插入下一个自增值2（当前最大自增值+1）                  |         4 |    2 |
| 最新自增值=>                                                  |         5 |    2 |
| 引用AUTO_INCREMENT列的值                                      |         6 |   12 |
| 最新自增值=>                                                  |         7 |    2 |
+---------------------------------------------------------------+-----------+------+
insert into table3_noorder values(null,a*2,'引用AUTO_INCREMENT列的值');
insert into table3_noorder(a,txt) values(0,'最新自增值=>');
select txt,a incre_col,b from table3_noorder order by a;
+---------------------------------------------------------------+-----------+---------+
| txt                                                           | incre_col | b       |
+---------------------------------------------------------------+-----------+---------+
| table3_noorder noorder模式                                    |         1 |       3 |
| 插入下一个自增值2（当前最大自增值+1）                         |         2 |       3 |
| 最新自增值=>                                                  |   1000001 |       3 |
| replace插入下一个自增值2（当前最大自增值+1）                  |   1000002 |       3 |
| 最新自增值=>                                                  |   2000001 |       3 |
| 引用AUTO_INCREMENT列的值                                      |   2000002 | 4000004 |
| 最新自增值=>                                                  |   3000001 |       3 |
+---------------------------------------------------------------+-----------+---------+
##REPLACE 语句
replace into table1_default values(null,a*2,'引用AUTO_INCREMENT列的值');
replace into table1_default(a,txt) values(0,'最新自增值=>');
select txt,a incre_col,b from table1_default order by a;
+---------------------------------------------------------------+-----------+---------+
| txt                                                           | incre_col | b       |
+---------------------------------------------------------------+-----------+---------+
| table1_default 默认order模式                                  |         1 |       1 |
| 插入下一个自增值2（当前最大自增值+1）                         |         2 |       1 |
| replace插入下一个自增值2（当前最大自增值+1）                  |         4 |       1 |
| 最新自增值=>                                                  |   1000001 |       1 |
| 最新自增值=>                                                  |   1000002 |       1 |
| 引用AUTO_INCREMENT列的值                                      |   1000003 | 2000006 |
| 最新自增值=>                                                  |   2000001 |       1 |
| 引用AUTO_INCREMENT列的值                                      |   2000002 | 4000004 |
| 最新自增值=>                                                  |   3000001 |       1 |
+---------------------------------------------------------------+-----------+---------+
replace into table2_order values(null,a*2,'引用AUTO_INCREMENT列的值');
replace into table2_order(a,txt) values(0,'最新自增值=>');
select txt,a incre_col,b from table2_order order by a;
+---------------------------------------------------------------+-----------+------+
| txt                                                           | incre_col | b    |
+---------------------------------------------------------------+-----------+------+
| table2_order order模式                                        |         1 |    2 |
| 插入下一个自增值2（当前最大自增值+1）                         |         2 |    2 |
| 最新自增值=>                                                  |         3 |    2 |
| replace插入下一个自增值2（当前最大自增值+1）                  |         4 |    2 |
| 最新自增值=>                                                  |         5 |    2 |
| 引用AUTO_INCREMENT列的值                                      |         6 |   12 |
| 最新自增值=>                                                  |         7 |    2 |
| 引用AUTO_INCREMENT列的值                                      |         8 |   16 |
| 最新自增值=>                                                  |         9 |    2 |
+---------------------------------------------------------------+-----------+------+
replace into table3_noorder values(null,a*2,'引用AUTO_INCREMENT列的值');
replace into table3_noorder(a,txt) values(0,'最新自增值=>');
select txt,a incre_col,b from table3_noorder order by a;
+---------------------------------------------------------------+-----------+---------+
| txt                                                           | incre_col | b       |
+---------------------------------------------------------------+-----------+---------+
| table3_noorder noorder模式                                    |         1 |       3 |
| 插入下一个自增值2（当前最大自增值+1）                         |         2 |       3 |
| 最新自增值=>                                                  |   1000001 |       3 |
| replace插入下一个自增值2（当前最大自增值+1）                  |   1000002 |       3 |
| 最新自增值=>                                                  |   2000001 |       3 |
| 引用AUTO_INCREMENT列的值                                      |   2000002 | 4000004 |
| 最新自增值=>                                                  |   3000001 |       3 |
| 引用AUTO_INCREMENT列的值                                      |   3000002 | 6000004 |
| 最新自增值=>                                                  |   4000001 |       3 |
+---------------------------------------------------------------+-----------+---------+
##批量插入
##INSERT ... SELECT语句
insert into table1_default select a,b,txt from table0_date where a <= 200;
select txt,a incre_col,b from table1_default order by a;
+---------------------------------------------------------------+-----------+---------+
| txt                                                           | incre_col | b       |
+---------------------------------------------------------------+-----------+---------+
| table1_default 默认order模式                                  |         1 |       1 |
| 插入下一个自增值2（当前最大自增值+1）                         |         2 |       1 |
| replace插入下一个自增值2（当前最大自增值+1）                  |         4 |       1 |
| table0_date                                                   |       110 |       0 |
| table0_date                                                   |       111 |       0 |
| table0_date                                                   |       112 |       0 |
| 最新自增值=>                                                  |   1000001 |       1 |
| 最新自增值=>                                                  |   1000002 |       1 |
| 引用AUTO_INCREMENT列的值                                      |   1000003 | 2000006 |
| 最新自增值=>                                                  |   2000001 |       1 |
| 引用AUTO_INCREMENT列的值                                      |   2000002 | 4000004 |
| 最新自增值=>                                                  |   3000001 |       1 |
+---------------------------------------------------------------+-----------+---------+
insert into table1_default(a,txt) values(0,'最新自增值=>');
select txt,a incre_col,b from table1_default order by a;
+---------------------------------------------------------------+-----------+---------+
| txt                                                           | incre_col | b       |
+---------------------------------------------------------------+-----------+---------+
| table1_default 默认order模式                                  |         1 |       1 |
| 插入下一个自增值2（当前最大自增值+1）                         |         2 |       1 |
| replace插入下一个自增值2（当前最大自增值+1）                  |         4 |       1 |
| table0_date                                                   |       110 |       0 |
| table0_date                                                   |       111 |       0 |
| table0_date                                                   |       112 |       0 |
| 最新自增值=>                                                  |   1000001 |       1 |
| 最新自增值=>                                                  |   1000002 |       1 |
| 引用AUTO_INCREMENT列的值                                      |   1000003 | 2000006 |
| 最新自增值=>                                                  |   2000001 |       1 |
| 引用AUTO_INCREMENT列的值                                      |   2000002 | 4000004 |
| 最新自增值=>                                                  |   3000001 |       1 |
| 最新自增值=>                                                  |   3000002 |       1 |
+---------------------------------------------------------------+-----------+---------+
insert into table2_order select a,b,txt from table0_date where a <= 200;
select txt,a incre_col,b from table2_order order by a;
+---------------------------------------------------------------+-----------+------+
| txt                                                           | incre_col | b    |
+---------------------------------------------------------------+-----------+------+
| table2_order order模式                                        |         1 |    2 |
| 插入下一个自增值2（当前最大自增值+1）                         |         2 |    2 |
| 最新自增值=>                                                  |         3 |    2 |
| replace插入下一个自增值2（当前最大自增值+1）                  |         4 |    2 |
| 最新自增值=>                                                  |         5 |    2 |
| 引用AUTO_INCREMENT列的值                                      |         6 |   12 |
| 最新自增值=>                                                  |         7 |    2 |
| 引用AUTO_INCREMENT列的值                                      |         8 |   16 |
| 最新自增值=>                                                  |         9 |    2 |
| table0_date                                                   |       110 |    0 |
| table0_date                                                   |       111 |    0 |
| table0_date                                                   |       112 |    0 |
+---------------------------------------------------------------+-----------+------+
insert into table2_order(a,txt) values(0,'最新自增值=>');
select txt,a incre_col,b from table2_order order by a;
+---------------------------------------------------------------+-----------+------+
| txt                                                           | incre_col | b    |
+---------------------------------------------------------------+-----------+------+
| table2_order order模式                                        |         1 |    2 |
| 插入下一个自增值2（当前最大自增值+1）                         |         2 |    2 |
| 最新自增值=>                                                  |         3 |    2 |
| replace插入下一个自增值2（当前最大自增值+1）                  |         4 |    2 |
| 最新自增值=>                                                  |         5 |    2 |
| 引用AUTO_INCREMENT列的值                                      |         6 |   12 |
| 最新自增值=>                                                  |         7 |    2 |
| 引用AUTO_INCREMENT列的值                                      |         8 |   16 |
| 最新自增值=>                                                  |         9 |    2 |
| table0_date                                                   |       110 |    0 |
| table0_date                                                   |       111 |    0 |
| table0_date                                                   |       112 |    0 |
| 最新自增值=>                                                  |       113 |    2 |
+---------------------------------------------------------------+-----------+------+
insert into table3_noorder select a,b,txt from table0_date where a <= 200;
select txt,a incre_col,b from table3_noorder order by a;
+---------------------------------------------------------------+-----------+---------+
| txt                                                           | incre_col | b       |
+---------------------------------------------------------------+-----------+---------+
| table3_noorder noorder模式                                    |         1 |       3 |
| 插入下一个自增值2（当前最大自增值+1）                         |         2 |       3 |
| table0_date                                                   |       110 |       0 |
| table0_date                                                   |       111 |       0 |
| table0_date                                                   |       112 |       0 |
| 最新自增值=>                                                  |   1000001 |       3 |
| replace插入下一个自增值2（当前最大自增值+1）                  |   1000002 |       3 |
| 最新自增值=>                                                  |   2000001 |       3 |
| 引用AUTO_INCREMENT列的值                                      |   2000002 | 4000004 |
| 最新自增值=>                                                  |   3000001 |       3 |
| 引用AUTO_INCREMENT列的值                                      |   3000002 | 6000004 |
| 最新自增值=>                                                  |   4000001 |       3 |
+---------------------------------------------------------------+-----------+---------+
insert into table3_noorder(a,txt) values(0,'最新自增值=>');
select txt,a incre_col,b from table3_noorder order by a;
+---------------------------------------------------------------+-----------+---------+
| txt                                                           | incre_col | b       |
+---------------------------------------------------------------+-----------+---------+
| table3_noorder noorder模式                                    |         1 |       3 |
| 插入下一个自增值2（当前最大自增值+1）                         |         2 |       3 |
| table0_date                                                   |       110 |       0 |
| table0_date                                                   |       111 |       0 |
| table0_date                                                   |       112 |       0 |
| 最新自增值=>                                                  |   1000001 |       3 |
| replace插入下一个自增值2（当前最大自增值+1）                  |   1000002 |       3 |
| 最新自增值=>                                                  |   2000001 |       3 |
| 引用AUTO_INCREMENT列的值                                      |   2000002 | 4000004 |
| 最新自增值=>                                                  |   3000001 |       3 |
| 引用AUTO_INCREMENT列的值                                      |   3000002 | 6000004 |
| 最新自增值=>                                                  |   4000001 |       3 |
| 最新自增值=>                                                  |   4000002 |       3 |
+---------------------------------------------------------------+-----------+---------+
##REPLACE ... SELECT语句
replace into table1_default select a,b,txt from table0_date where a > 200;
select txt,a incre_col,b from table1_default order by a;
+---------------------------------------------------------------+-----------+---------+
| txt                                                           | incre_col | b       |
+---------------------------------------------------------------+-----------+---------+
| table1_default 默认order模式                                  |         1 |       1 |
| 插入下一个自增值2（当前最大自增值+1）                         |         2 |       1 |
| replace插入下一个自增值2（当前最大自增值+1）                  |         4 |       1 |
| table0_date                                                   |       110 |       0 |
| table0_date                                                   |       111 |       0 |
| table0_date                                                   |       112 |       0 |
| table0_date                                                   |       210 |       0 |
| table0_date                                                   |       211 |       0 |
| table0_date                                                   |       212 |       0 |
| 最新自增值=>                                                  |   1000001 |       1 |
| 最新自增值=>                                                  |   1000002 |       1 |
| 引用AUTO_INCREMENT列的值                                      |   1000003 | 2000006 |
| 最新自增值=>                                                  |   2000001 |       1 |
| 引用AUTO_INCREMENT列的值                                      |   2000002 | 4000004 |
| 最新自增值=>                                                  |   3000001 |       1 |
| 最新自增值=>                                                  |   3000002 |       1 |
+---------------------------------------------------------------+-----------+---------+
insert into table1_default(a,txt) values(0,'最新自增值=>');
select txt,a incre_col,b from table1_default order by a;
+---------------------------------------------------------------+-----------+---------+
| txt                                                           | incre_col | b       |
+---------------------------------------------------------------+-----------+---------+
| table1_default 默认order模式                                  |         1 |       1 |
| 插入下一个自增值2（当前最大自增值+1）                         |         2 |       1 |
| replace插入下一个自增值2（当前最大自增值+1）                  |         4 |       1 |
| table0_date                                                   |       110 |       0 |
| table0_date                                                   |       111 |       0 |
| table0_date                                                   |       112 |       0 |
| table0_date                                                   |       210 |       0 |
| table0_date                                                   |       211 |       0 |
| table0_date                                                   |       212 |       0 |
| 最新自增值=>                                                  |   1000001 |       1 |
| 最新自增值=>                                                  |   1000002 |       1 |
| 引用AUTO_INCREMENT列的值                                      |   1000003 | 2000006 |
| 最新自增值=>                                                  |   2000001 |       1 |
| 引用AUTO_INCREMENT列的值                                      |   2000002 | 4000004 |
| 最新自增值=>                                                  |   3000001 |       1 |
| 最新自增值=>                                                  |   3000002 |       1 |
| 最新自增值=>                                                  |   3000003 |       1 |
+---------------------------------------------------------------+-----------+---------+
replace into table2_order select a,b,txt from table0_date where a > 200;
select txt,a incre_col,b from table2_order order by a;
+---------------------------------------------------------------+-----------+------+
| txt                                                           | incre_col | b    |
+---------------------------------------------------------------+-----------+------+
| table2_order order模式                                        |         1 |    2 |
| 插入下一个自增值2（当前最大自增值+1）                         |         2 |    2 |
| 最新自增值=>                                                  |         3 |    2 |
| replace插入下一个自增值2（当前最大自增值+1）                  |         4 |    2 |
| 最新自增值=>                                                  |         5 |    2 |
| 引用AUTO_INCREMENT列的值                                      |         6 |   12 |
| 最新自增值=>                                                  |         7 |    2 |
| 引用AUTO_INCREMENT列的值                                      |         8 |   16 |
| 最新自增值=>                                                  |         9 |    2 |
| table0_date                                                   |       110 |    0 |
| table0_date                                                   |       111 |    0 |
| table0_date                                                   |       112 |    0 |
| 最新自增值=>                                                  |       113 |    2 |
| table0_date                                                   |       210 |    0 |
| table0_date                                                   |       211 |    0 |
| table0_date                                                   |       212 |    0 |
+---------------------------------------------------------------+-----------+------+
insert into table2_order(a,txt) values(0,'最新自增值=>');
select txt,a incre_col,b from table2_order order by a;
+---------------------------------------------------------------+-----------+------+
| txt                                                           | incre_col | b    |
+---------------------------------------------------------------+-----------+------+
| table2_order order模式                                        |         1 |    2 |
| 插入下一个自增值2（当前最大自增值+1）                         |         2 |    2 |
| 最新自增值=>                                                  |         3 |    2 |
| replace插入下一个自增值2（当前最大自增值+1）                  |         4 |    2 |
| 最新自增值=>                                                  |         5 |    2 |
| 引用AUTO_INCREMENT列的值                                      |         6 |   12 |
| 最新自增值=>                                                  |         7 |    2 |
| 引用AUTO_INCREMENT列的值                                      |         8 |   16 |
| 最新自增值=>                                                  |         9 |    2 |
| table0_date                                                   |       110 |    0 |
| table0_date                                                   |       111 |    0 |
| table0_date                                                   |       112 |    0 |
| 最新自增值=>                                                  |       113 |    2 |
| table0_date                                                   |       210 |    0 |
| table0_date                                                   |       211 |    0 |
| table0_date                                                   |       212 |    0 |
| 最新自增值=>                                                  |       213 |    2 |
+---------------------------------------------------------------+-----------+------+
replace into table3_noorder select a,b,txt from table0_date where a > 200;
select txt,a incre_col,b from table3_noorder order by a;
+---------------------------------------------------------------+-----------+---------+
| txt                                                           | incre_col | b       |
+---------------------------------------------------------------+-----------+---------+
| table3_noorder noorder模式                                    |         1 |       3 |
| 插入下一个自增值2（当前最大自增值+1）                         |         2 |       3 |
| table0_date                                                   |       110 |       0 |
| table0_date                                                   |       111 |       0 |
| table0_date                                                   |       112 |       0 |
| table0_date                                                   |       210 |       0 |
| table0_date                                                   |       211 |       0 |
| table0_date                                                   |       212 |       0 |
| 最新自增值=>                                                  |   1000001 |       3 |
| replace插入下一个自增值2（当前最大自增值+1）                  |   1000002 |       3 |
| 最新自增值=>                                                  |   2000001 |       3 |
| 引用AUTO_INCREMENT列的值                                      |   2000002 | 4000004 |
| 最新自增值=>                                                  |   3000001 |       3 |
| 引用AUTO_INCREMENT列的值                                      |   3000002 | 6000004 |
| 最新自增值=>                                                  |   4000001 |       3 |
| 最新自增值=>                                                  |   4000002 |       3 |
+---------------------------------------------------------------+-----------+---------+
insert into table3_noorder(a,txt) values(0,'最新自增值=>');
select txt,a incre_col,b from table3_noorder order by a;
+---------------------------------------------------------------+-----------+---------+
| txt                                                           | incre_col | b       |
+---------------------------------------------------------------+-----------+---------+
| table3_noorder noorder模式                                    |         1 |       3 |
| 插入下一个自增值2（当前最大自增值+1）                         |         2 |       3 |
| table0_date                                                   |       110 |       0 |
| table0_date                                                   |       111 |       0 |
| table0_date                                                   |       112 |       0 |
| table0_date                                                   |       210 |       0 |
| table0_date                                                   |       211 |       0 |
| table0_date                                                   |       212 |       0 |
| 最新自增值=>                                                  |   1000001 |       3 |
| replace插入下一个自增值2（当前最大自增值+1）                  |   1000002 |       3 |
| 最新自增值=>                                                  |   2000001 |       3 |
| 引用AUTO_INCREMENT列的值                                      |   2000002 | 4000004 |
| 最新自增值=>                                                  |   3000001 |       3 |
| 引用AUTO_INCREMENT列的值                                      |   3000002 | 6000004 |
| 最新自增值=>                                                  |   4000001 |       3 |
| 最新自增值=>                                                  |   4000002 |       3 |
| 最新自增值=>                                                  |   4000003 |       3 |
+---------------------------------------------------------------+-----------+---------+
##混合插入
##INSERT ... ON DUPLICATE KEY UPDATE 语句
insert into table1_default (a,b,txt) values (1,1,'重复场合') on duplicate key update b=b+1,txt='insert...on duplicate key update 语句';
insert into table1_default(a,txt) values(0,'最新自增值1=>');
select txt,a incre_col,b from table1_default order by a;
+---------------------------------------------------------------+-----------+---------+
| txt                                                           | incre_col | b       |
+---------------------------------------------------------------+-----------+---------+
| insert...on duplicate key update 语句                         |         1 |       2 |
| 插入下一个自增值2（当前最大自增值+1）                         |         2 |       1 |
| replace插入下一个自增值2（当前最大自增值+1）                  |         4 |       1 |
| table0_date                                                   |       110 |       0 |
| table0_date                                                   |       111 |       0 |
| table0_date                                                   |       112 |       0 |
| table0_date                                                   |       210 |       0 |
| table0_date                                                   |       211 |       0 |
| table0_date                                                   |       212 |       0 |
| 最新自增值=>                                                  |   1000001 |       1 |
| 最新自增值=>                                                  |   1000002 |       1 |
| 引用AUTO_INCREMENT列的值                                      |   1000003 | 2000006 |
| 最新自增值=>                                                  |   2000001 |       1 |
| 引用AUTO_INCREMENT列的值                                      |   2000002 | 4000004 |
| 最新自增值=>                                                  |   3000001 |       1 |
| 最新自增值=>                                                  |   3000002 |       1 |
| 最新自增值=>                                                  |   3000003 |       1 |
| 最新自增值1=>                                                 |   3000004 |       1 |
+---------------------------------------------------------------+-----------+---------+
insert into table1_default (a,b,txt) values (50,1,'不重复场合') on duplicate key update b=b+1,txt='insert...on duplicate key update 语句';
insert into table1_default(a,txt) values(0,'最新自增值2=>');
select txt,a incre_col,b from table1_default order by a;
+---------------------------------------------------------------+-----------+---------+
| txt                                                           | incre_col | b       |
+---------------------------------------------------------------+-----------+---------+
| insert...on duplicate key update 语句                         |         1 |       2 |
| 插入下一个自增值2（当前最大自增值+1）                         |         2 |       1 |
| replace插入下一个自增值2（当前最大自增值+1）                  |         4 |       1 |
| 不重复场合                                                    |        50 |       1 |
| table0_date                                                   |       110 |       0 |
| table0_date                                                   |       111 |       0 |
| table0_date                                                   |       112 |       0 |
| table0_date                                                   |       210 |       0 |
| table0_date                                                   |       211 |       0 |
| table0_date                                                   |       212 |       0 |
| 最新自增值=>                                                  |   1000001 |       1 |
| 最新自增值=>                                                  |   1000002 |       1 |
| 引用AUTO_INCREMENT列的值                                      |   1000003 | 2000006 |
| 最新自增值=>                                                  |   2000001 |       1 |
| 引用AUTO_INCREMENT列的值                                      |   2000002 | 4000004 |
| 最新自增值=>                                                  |   3000001 |       1 |
| 最新自增值=>                                                  |   3000002 |       1 |
| 最新自增值=>                                                  |   3000003 |       1 |
| 最新自增值1=>                                                 |   3000004 |       1 |
| 最新自增值2=>                                                 |   3000005 |       1 |
+---------------------------------------------------------------+-----------+---------+
insert into table2_order (a,b,txt) values (1,2,'重复场合') on duplicate key update b=b+1,txt='insert...on duplicate key update 语句';
insert into table2_order(a,txt) values(0,'最新自增值1=>');
select txt,a incre_col,b from table2_order order by a;
+---------------------------------------------------------------+-----------+------+
| txt                                                           | incre_col | b    |
+---------------------------------------------------------------+-----------+------+
| insert...on duplicate key update 语句                         |         1 |    3 |
| 插入下一个自增值2（当前最大自增值+1）                         |         2 |    2 |
| 最新自增值=>                                                  |         3 |    2 |
| replace插入下一个自增值2（当前最大自增值+1）                  |         4 |    2 |
| 最新自增值=>                                                  |         5 |    2 |
| 引用AUTO_INCREMENT列的值                                      |         6 |   12 |
| 最新自增值=>                                                  |         7 |    2 |
| 引用AUTO_INCREMENT列的值                                      |         8 |   16 |
| 最新自增值=>                                                  |         9 |    2 |
| table0_date                                                   |       110 |    0 |
| table0_date                                                   |       111 |    0 |
| table0_date                                                   |       112 |    0 |
| 最新自增值=>                                                  |       113 |    2 |
| table0_date                                                   |       210 |    0 |
| table0_date                                                   |       211 |    0 |
| table0_date                                                   |       212 |    0 |
| 最新自增值=>                                                  |       213 |    2 |
| 最新自增值1=>                                                 |       214 |    2 |
+---------------------------------------------------------------+-----------+------+
insert into table2_order (a,b,txt) values (50,2,'不重复场合') on duplicate key update b=b+1,txt='insert...on duplicate key update 语句';
insert into table2_order(a,txt) values(0,'最新自增值2=>');
select txt,a incre_col,b from table2_order order by a;
+---------------------------------------------------------------+-----------+------+
| txt                                                           | incre_col | b    |
+---------------------------------------------------------------+-----------+------+
| insert...on duplicate key update 语句                         |         1 |    3 |
| 插入下一个自增值2（当前最大自增值+1）                         |         2 |    2 |
| 最新自增值=>                                                  |         3 |    2 |
| replace插入下一个自增值2（当前最大自增值+1）                  |         4 |    2 |
| 最新自增值=>                                                  |         5 |    2 |
| 引用AUTO_INCREMENT列的值                                      |         6 |   12 |
| 最新自增值=>                                                  |         7 |    2 |
| 引用AUTO_INCREMENT列的值                                      |         8 |   16 |
| 最新自增值=>                                                  |         9 |    2 |
| 不重复场合                                                    |        50 |    2 |
| table0_date                                                   |       110 |    0 |
| table0_date                                                   |       111 |    0 |
| table0_date                                                   |       112 |    0 |
| 最新自增值=>                                                  |       113 |    2 |
| table0_date                                                   |       210 |    0 |
| table0_date                                                   |       211 |    0 |
| table0_date                                                   |       212 |    0 |
| 最新自增值=>                                                  |       213 |    2 |
| 最新自增值1=>                                                 |       214 |    2 |
| 最新自增值2=>                                                 |       215 |    2 |
+---------------------------------------------------------------+-----------+------+
insert into table3_noorder (a,b,txt) values (1,3,'重复场合') on duplicate key update b=b+1,txt='insert...on duplicate key update 语句';
insert into table3_noorder(a,txt) values(0,'最新自增值1=>');
select txt,a incre_col,b from table3_noorder order by a;
+---------------------------------------------------------------+-----------+---------+
| txt                                                           | incre_col | b       |
+---------------------------------------------------------------+-----------+---------+
| insert...on duplicate key update 语句                         |         1 |       4 |
| 插入下一个自增值2（当前最大自增值+1）                         |         2 |       3 |
| table0_date                                                   |       110 |       0 |
| table0_date                                                   |       111 |       0 |
| table0_date                                                   |       112 |       0 |
| table0_date                                                   |       210 |       0 |
| table0_date                                                   |       211 |       0 |
| table0_date                                                   |       212 |       0 |
| 最新自增值=>                                                  |   1000001 |       3 |
| replace插入下一个自增值2（当前最大自增值+1）                  |   1000002 |       3 |
| 最新自增值=>                                                  |   2000001 |       3 |
| 引用AUTO_INCREMENT列的值                                      |   2000002 | 4000004 |
| 最新自增值=>                                                  |   3000001 |       3 |
| 引用AUTO_INCREMENT列的值                                      |   3000002 | 6000004 |
| 最新自增值=>                                                  |   4000001 |       3 |
| 最新自增值=>                                                  |   4000002 |       3 |
| 最新自增值=>                                                  |   4000003 |       3 |
| 最新自增值1=>                                                 |   4000004 |       3 |
+---------------------------------------------------------------+-----------+---------+
insert into table3_noorder (a,b,txt) values (50,3,'不重复场合') on duplicate key update b=b+1,txt='insert...on duplicate key update 语句';
insert into table3_noorder(a,txt) values(0,'最新自增值2=>');
select txt,a incre_col,b from table3_noorder order by a;
+---------------------------------------------------------------+-----------+---------+
| txt                                                           | incre_col | b       |
+---------------------------------------------------------------+-----------+---------+
| insert...on duplicate key update 语句                         |         1 |       4 |
| 插入下一个自增值2（当前最大自增值+1）                         |         2 |       3 |
| 不重复场合                                                    |        50 |       3 |
| table0_date                                                   |       110 |       0 |
| table0_date                                                   |       111 |       0 |
| table0_date                                                   |       112 |       0 |
| table0_date                                                   |       210 |       0 |
| table0_date                                                   |       211 |       0 |
| table0_date                                                   |       212 |       0 |
| 最新自增值=>                                                  |   1000001 |       3 |
| replace插入下一个自增值2（当前最大自增值+1）                  |   1000002 |       3 |
| 最新自增值=>                                                  |   2000001 |       3 |
| 引用AUTO_INCREMENT列的值                                      |   2000002 | 4000004 |
| 最新自增值=>                                                  |   3000001 |       3 |
| 引用AUTO_INCREMENT列的值                                      |   3000002 | 6000004 |
| 最新自增值=>                                                  |   4000001 |       3 |
| 最新自增值=>                                                  |   4000002 |       3 |
| 最新自增值=>                                                  |   4000003 |       3 |
| 最新自增值1=>                                                 |   4000004 |       3 |
| 最新自增值2=>                                                 |   4000005 |       3 |
+---------------------------------------------------------------+-----------+---------+
##将NULL和任何其他值混合插入 AUTO_INCREMENT列
##INSERT 语句
drop table table1_default;
create table table1_default (
  a int not null auto_increment primary key,
  b int default 1,
  txt varchar(64) default 'table1_default 默认order模式',
  unique index(a)
)partition by range (a) ( 
partition p0 values less than (3), 
partition p1 values less than (6),  
partition p2 values less than (9), 
partition p3 values less than MAXVALUE);
drop table table2_order;
create table table2_order (
  a int not null auto_increment primary key,
  b int default 2,
  txt varchar(64) default 'table2_order order模式',
  unique index(a)
) auto_increment_mode = 'order' 
partition by range (a) ( 
partition p0 values less than (3), 
partition p1 values less than (6),  
partition p2 values less than (9), 
partition p3 values less than MAXVALUE);
drop table table3_noorder;
create table table3_noorder (
  a int not null auto_increment primary key,
  b int default 3,
  txt varchar(64) default 'table3_noorder noorder模式',
  unique index(a)
) auto_increment_mode = 'noorder' 
partition by range (a) ( 
partition p0 values less than (3), 
partition p1 values less than (6),  
partition p2 values less than (9), 
partition p3 values less than MAXVALUE);
insert into table1_default(a) values(null),(15),(null),(null),(25);
insert into table1_default(a,txt) values(0,'最新自增值1=>');
select txt,a incre_col,b from table1_default order by a;
+----------------------------------+-----------+------+
| txt                              | incre_col | b    |
+----------------------------------+-----------+------+
| table1_default 默认order模式     |         1 |    1 |
| table1_default 默认order模式     |        15 |    1 |
| table1_default 默认order模式     |        25 |    1 |
| table1_default 默认order模式     |   1000001 |    1 |
| table1_default 默认order模式     |   1000002 |    1 |
| 最新自增值1=>                    |   1000004 |    1 |
+----------------------------------+-----------+------+
insert into table1_default(a) values(null),(null),(null),(35);
insert into table1_default(a,txt) values(0,'最新自增值2=>');
select txt,a incre_col,b from table1_default order by a;
+----------------------------------+-----------+------+
| txt                              | incre_col | b    |
+----------------------------------+-----------+------+
| table1_default 默认order模式     |         1 |    1 |
| table1_default 默认order模式     |        15 |    1 |
| table1_default 默认order模式     |        25 |    1 |
| table1_default 默认order模式     |        35 |    1 |
| table1_default 默认order模式     |   1000001 |    1 |
| table1_default 默认order模式     |   1000002 |    1 |
| 最新自增值1=>                    |   1000004 |    1 |
| table1_default 默认order模式     |   1000005 |    1 |
| table1_default 默认order模式     |   1000006 |    1 |
| table1_default 默认order模式     |   1000007 |    1 |
| 最新自增值2=>                    |   1000009 |    1 |
+----------------------------------+-----------+------+
insert into table2_order(a) values(null),(15),(null),(null),(25);
insert into table2_order(a,txt) values(0,'最新自增值1=>');
select txt,a incre_col,b from table2_order order by a;
+--------------------------+-----------+------+
| txt                      | incre_col | b    |
+--------------------------+-----------+------+
| table2_order order模式   |         1 |    2 |
| table2_order order模式   |        15 |    2 |
| table2_order order模式   |        16 |    2 |
| table2_order order模式   |        17 |    2 |
| table2_order order模式   |        25 |    2 |
| 最新自增值1=>            |        26 |    2 |
+--------------------------+-----------+------+
insert into table2_order(a) values(null),(null),(null),(35);
insert into table2_order(a,txt) values(0,'最新自增值2=>');
select txt,a incre_col,b from table2_order order by a;
+--------------------------+-----------+------+
| txt                      | incre_col | b    |
+--------------------------+-----------+------+
| table2_order order模式   |         1 |    2 |
| table2_order order模式   |        15 |    2 |
| table2_order order模式   |        16 |    2 |
| table2_order order模式   |        17 |    2 |
| table2_order order模式   |        25 |    2 |
| 最新自增值1=>            |        26 |    2 |
| table2_order order模式   |        27 |    2 |
| table2_order order模式   |        28 |    2 |
| table2_order order模式   |        29 |    2 |
| table2_order order模式   |        35 |    2 |
| 最新自增值2=>            |        36 |    2 |
+--------------------------+-----------+------+
insert into table3_noorder(a) values(null),(15),(null),(null),(25);
insert into table3_noorder(a,txt) values(0,'最新自增值1=>');
select txt,a incre_col,b from table3_noorder order by a;
+------------------------------+-----------+------+
| txt                          | incre_col | b    |
+------------------------------+-----------+------+
| table3_noorder noorder模式   |         1 |    3 |
| table3_noorder noorder模式   |        15 |    3 |
| table3_noorder noorder模式   |        25 |    3 |
| table3_noorder noorder模式   |   1000001 |    3 |
| table3_noorder noorder模式   |   1000002 |    3 |
| 最新自增值1=>                |   1000004 |    3 |
+------------------------------+-----------+------+
insert into table3_noorder(a) values(null),(null),(null),(35);
insert into table3_noorder(a,txt) values(0,'最新自增值2=>');
select txt,a incre_col,b from table3_noorder order by a;
+------------------------------+-----------+------+
| txt                          | incre_col | b    |
+------------------------------+-----------+------+
| table3_noorder noorder模式   |         1 |    3 |
| table3_noorder noorder模式   |        15 |    3 |
| table3_noorder noorder模式   |        25 |    3 |
| table3_noorder noorder模式   |        35 |    3 |
| table3_noorder noorder模式   |   1000001 |    3 |
| table3_noorder noorder模式   |   1000002 |    3 |
| 最新自增值1=>                |   1000004 |    3 |
| table3_noorder noorder模式   |   1000005 |    3 |
| table3_noorder noorder模式   |   1000006 |    3 |
| table3_noorder noorder模式   |   1000007 |    3 |
| 最新自增值2=>                |   1000009 |    3 |
+------------------------------+-----------+------+
##REPLACE 语句
replace into table1_default(a) values(null),(35),(null),(45);
insert into table1_default(a,txt) values(0,'最新自增值2=>');
select txt,a incre_col,b from table1_default order by a;
+----------------------------------+-----------+------+
| txt                              | incre_col | b    |
+----------------------------------+-----------+------+
| table1_default 默认order模式     |         1 |    1 |
| table1_default 默认order模式     |        15 |    1 |
| table1_default 默认order模式     |        25 |    1 |
| table1_default 默认order模式     |        35 |    1 |
| table1_default 默认order模式     |        45 |    1 |
| table1_default 默认order模式     |   1000001 |    1 |
| table1_default 默认order模式     |   1000002 |    1 |
| 最新自增值1=>                    |   1000004 |    1 |
| table1_default 默认order模式     |   1000005 |    1 |
| table1_default 默认order模式     |   1000006 |    1 |
| table1_default 默认order模式     |   1000007 |    1 |
| 最新自增值2=>                    |   1000009 |    1 |
| table1_default 默认order模式     |   1000010 |    1 |
| table1_default 默认order模式     |   1000011 |    1 |
| 最新自增值2=>                    |   1000014 |    1 |
+----------------------------------+-----------+------+
replace into table2_order(a) values(null),(35),(null),(45);
insert into table2_order(a,txt) values(0,'最新自增值2=>');
select txt,a incre_col,b from table2_order order by a;
+--------------------------+-----------+------+
| txt                      | incre_col | b    |
+--------------------------+-----------+------+
| table2_order order模式   |         1 |    2 |
| table2_order order模式   |        15 |    2 |
| table2_order order模式   |        16 |    2 |
| table2_order order模式   |        17 |    2 |
| table2_order order模式   |        25 |    2 |
| 最新自增值1=>            |        26 |    2 |
| table2_order order模式   |        27 |    2 |
| table2_order order模式   |        28 |    2 |
| table2_order order模式   |        29 |    2 |
| table2_order order模式   |        35 |    2 |
| 最新自增值2=>            |        36 |    2 |
| table2_order order模式   |        37 |    2 |
| table2_order order模式   |        38 |    2 |
| table2_order order模式   |        45 |    2 |
| 最新自增值2=>            |        46 |    2 |
+--------------------------+-----------+------+
replace into table3_noorder(a) values(null),(35),(null),(45);
insert into table3_noorder(a,txt) values(0,'最新自增值2=>');
select txt,a incre_col,b from table3_noorder order by a;
+------------------------------+-----------+------+
| txt                          | incre_col | b    |
+------------------------------+-----------+------+
| table3_noorder noorder模式   |         1 |    3 |
| table3_noorder noorder模式   |        15 |    3 |
| table3_noorder noorder模式   |        25 |    3 |
| table3_noorder noorder模式   |        35 |    3 |
| table3_noorder noorder模式   |        45 |    3 |
| table3_noorder noorder模式   |   1000001 |    3 |
| table3_noorder noorder模式   |   1000002 |    3 |
| 最新自增值1=>                |   1000004 |    3 |
| table3_noorder noorder模式   |   1000005 |    3 |
| table3_noorder noorder模式   |   1000006 |    3 |
| table3_noorder noorder模式   |   1000007 |    3 |
| 最新自增值2=>                |   1000009 |    3 |
| table3_noorder noorder模式   |   1000010 |    3 |
| table3_noorder noorder模式   |   1000011 |    3 |
| 最新自增值2=>                |   1000014 |    3 |
+------------------------------+-----------+------+
###### auto_incre_3-1-2 ②DELETE操作
insert into table1_default(a,b) values(null,11);
insert into table1_default(a,b) values(null,11);
select txt,a incre_col,b from table1_default order by a;
+----------------------------------+-----------+------+
| txt                              | incre_col | b    |
+----------------------------------+-----------+------+
| table1_default 默认order模式     |         1 |    1 |
| table1_default 默认order模式     |        15 |    1 |
| table1_default 默认order模式     |        25 |    1 |
| table1_default 默认order模式     |        35 |    1 |
| table1_default 默认order模式     |        45 |    1 |
| table1_default 默认order模式     |   1000001 |    1 |
| table1_default 默认order模式     |   1000002 |    1 |
| 最新自增值1=>                    |   1000004 |    1 |
| table1_default 默认order模式     |   1000005 |    1 |
| table1_default 默认order模式     |   1000006 |    1 |
| table1_default 默认order模式     |   1000007 |    1 |
| 最新自增值2=>                    |   1000009 |    1 |
| table1_default 默认order模式     |   1000010 |    1 |
| table1_default 默认order模式     |   1000011 |    1 |
| 最新自增值2=>                    |   1000014 |    1 |
| table1_default 默认order模式     |   1000015 |   11 |
| table1_default 默认order模式     |   1000016 |   11 |
+----------------------------------+-----------+------+
delete from table1_default where b=11;
insert into table1_default(a,txt) values(0,'最新自增值=>');
select txt,a incre_col,b from table1_default order by a;
+----------------------------------+-----------+------+
| txt                              | incre_col | b    |
+----------------------------------+-----------+------+
| table1_default 默认order模式     |         1 |    1 |
| table1_default 默认order模式     |        15 |    1 |
| table1_default 默认order模式     |        25 |    1 |
| table1_default 默认order模式     |        35 |    1 |
| table1_default 默认order模式     |        45 |    1 |
| table1_default 默认order模式     |   1000001 |    1 |
| table1_default 默认order模式     |   1000002 |    1 |
| 最新自增值1=>                    |   1000004 |    1 |
| table1_default 默认order模式     |   1000005 |    1 |
| table1_default 默认order模式     |   1000006 |    1 |
| table1_default 默认order模式     |   1000007 |    1 |
| 最新自增值2=>                    |   1000009 |    1 |
| table1_default 默认order模式     |   1000010 |    1 |
| table1_default 默认order模式     |   1000011 |    1 |
| 最新自增值2=>                    |   1000014 |    1 |
| 最新自增值=>                     |   1000017 |    1 |
+----------------------------------+-----------+------+
insert into table2_order(a,b) values(null,22);
insert into table2_order(a,b) values(null,22);
select txt,a incre_col,b from table2_order order by a;
+--------------------------+-----------+------+
| txt                      | incre_col | b    |
+--------------------------+-----------+------+
| table2_order order模式   |         1 |    2 |
| table2_order order模式   |        15 |    2 |
| table2_order order模式   |        16 |    2 |
| table2_order order模式   |        17 |    2 |
| table2_order order模式   |        25 |    2 |
| 最新自增值1=>            |        26 |    2 |
| table2_order order模式   |        27 |    2 |
| table2_order order模式   |        28 |    2 |
| table2_order order模式   |        29 |    2 |
| table2_order order模式   |        35 |    2 |
| 最新自增值2=>            |        36 |    2 |
| table2_order order模式   |        37 |    2 |
| table2_order order模式   |        38 |    2 |
| table2_order order模式   |        45 |    2 |
| 最新自增值2=>            |        46 |    2 |
| table2_order order模式   |        47 |   22 |
| table2_order order模式   |        48 |   22 |
+--------------------------+-----------+------+
delete from table2_order where b=22;
insert into table2_order(a,txt) values(0,'最新自增值=>');
select txt,a incre_col,b from table2_order order by a;
+--------------------------+-----------+------+
| txt                      | incre_col | b    |
+--------------------------+-----------+------+
| table2_order order模式   |         1 |    2 |
| table2_order order模式   |        15 |    2 |
| table2_order order模式   |        16 |    2 |
| table2_order order模式   |        17 |    2 |
| table2_order order模式   |        25 |    2 |
| 最新自增值1=>            |        26 |    2 |
| table2_order order模式   |        27 |    2 |
| table2_order order模式   |        28 |    2 |
| table2_order order模式   |        29 |    2 |
| table2_order order模式   |        35 |    2 |
| 最新自增值2=>            |        36 |    2 |
| table2_order order模式   |        37 |    2 |
| table2_order order模式   |        38 |    2 |
| table2_order order模式   |        45 |    2 |
| 最新自增值2=>            |        46 |    2 |
| 最新自增值=>             |        49 |    2 |
+--------------------------+-----------+------+
insert into table3_noorder(a,b) values(null,33);
insert into table3_noorder(a,b) values(null,33);
select txt,a incre_col,b from table3_noorder order by a;
+------------------------------+-----------+------+
| txt                          | incre_col | b    |
+------------------------------+-----------+------+
| table3_noorder noorder模式   |         1 |    3 |
| table3_noorder noorder模式   |        15 |    3 |
| table3_noorder noorder模式   |        25 |    3 |
| table3_noorder noorder模式   |        35 |    3 |
| table3_noorder noorder模式   |        45 |    3 |
| table3_noorder noorder模式   |   1000001 |    3 |
| table3_noorder noorder模式   |   1000002 |    3 |
| 最新自增值1=>                |   1000004 |    3 |
| table3_noorder noorder模式   |   1000005 |    3 |
| table3_noorder noorder模式   |   1000006 |    3 |
| table3_noorder noorder模式   |   1000007 |    3 |
| 最新自增值2=>                |   1000009 |    3 |
| table3_noorder noorder模式   |   1000010 |    3 |
| table3_noorder noorder模式   |   1000011 |    3 |
| 最新自增值2=>                |   1000014 |    3 |
| table3_noorder noorder模式   |   1000015 |   33 |
| table3_noorder noorder模式   |   1000016 |   33 |
+------------------------------+-----------+------+
delete from table3_noorder where b=33;
insert into table3_noorder(a,txt) values(0,'最新自增值=>');
select txt,a incre_col,b from table3_noorder order by a;
+------------------------------+-----------+------+
| txt                          | incre_col | b    |
+------------------------------+-----------+------+
| table3_noorder noorder模式   |         1 |    3 |
| table3_noorder noorder模式   |        15 |    3 |
| table3_noorder noorder模式   |        25 |    3 |
| table3_noorder noorder模式   |        35 |    3 |
| table3_noorder noorder模式   |        45 |    3 |
| table3_noorder noorder模式   |   1000001 |    3 |
| table3_noorder noorder模式   |   1000002 |    3 |
| 最新自增值1=>                |   1000004 |    3 |
| table3_noorder noorder模式   |   1000005 |    3 |
| table3_noorder noorder模式   |   1000006 |    3 |
| table3_noorder noorder模式   |   1000007 |    3 |
| 最新自增值2=>                |   1000009 |    3 |
| table3_noorder noorder模式   |   1000010 |    3 |
| table3_noorder noorder模式   |   1000011 |    3 |
| 最新自增值2=>                |   1000014 |    3 |
| 最新自增值=>                 |   1000017 |    3 |
+------------------------------+-----------+------+
###### auto_incre_3-1-3 ③UPDATE操作
# mysql 5.x update没有推高这个自增值，和我们现在是兼容的；8.x update会推高
##更新现有AUTO_INCREMENT列值
insert into table1_default(a,b) values(null,111);
select txt,a incre_col,b from table1_default order by a;
+----------------------------------+-----------+------+
| txt                              | incre_col | b    |
+----------------------------------+-----------+------+
| table1_default 默认order模式     |         1 |    1 |
| table1_default 默认order模式     |        15 |    1 |
| table1_default 默认order模式     |        25 |    1 |
| table1_default 默认order模式     |        35 |    1 |
| table1_default 默认order模式     |        45 |    1 |
| table1_default 默认order模式     |   1000001 |    1 |
| table1_default 默认order模式     |   1000002 |    1 |
| 最新自增值1=>                    |   1000004 |    1 |
| table1_default 默认order模式     |   1000005 |    1 |
| table1_default 默认order模式     |   1000006 |    1 |
| table1_default 默认order模式     |   1000007 |    1 |
| 最新自增值2=>                    |   1000009 |    1 |
| table1_default 默认order模式     |   1000010 |    1 |
| table1_default 默认order模式     |   1000011 |    1 |
| 最新自增值2=>                    |   1000014 |    1 |
| 最新自增值=>                     |   1000017 |    1 |
| table1_default 默认order模式     |   1000018 |  111 |
+----------------------------------+-----------+------+
update table1_default set a = 0,txt = '将AUTO_INCREMENT列值设置为小于/等于当前最大自增值的值' where b = 111;
insert into table1_default values(null,11,'1当前自增值=>');
select txt,a incre_col,b from table1_default order by a;
+--------------------------------------------------------------------------+-----------+------+
| txt                                                                      | incre_col | b    |
+--------------------------------------------------------------------------+-----------+------+
| 将AUTO_INCREMENT列值设置为小于/等于当前最大自增值的值                    |         0 |  111 |
| table1_default 默认order模式                                             |         1 |    1 |
| table1_default 默认order模式                                             |        15 |    1 |
| table1_default 默认order模式                                             |        25 |    1 |
| table1_default 默认order模式                                             |        35 |    1 |
| table1_default 默认order模式                                             |        45 |    1 |
| table1_default 默认order模式                                             |   1000001 |    1 |
| table1_default 默认order模式                                             |   1000002 |    1 |
| 最新自增值1=>                                                            |   1000004 |    1 |
| table1_default 默认order模式                                             |   1000005 |    1 |
| table1_default 默认order模式                                             |   1000006 |    1 |
| table1_default 默认order模式                                             |   1000007 |    1 |
| 最新自增值2=>                                                            |   1000009 |    1 |
| table1_default 默认order模式                                             |   1000010 |    1 |
| table1_default 默认order模式                                             |   1000011 |    1 |
| 最新自增值2=>                                                            |   1000014 |    1 |
| 最新自增值=>                                                             |   1000017 |    1 |
| 1当前自增值=>                                                            |   1000019 |   11 |
+--------------------------------------------------------------------------+-----------+------+
update table1_default set a = 60 ,txt = '将AUTO_INCREMENT列值设置为大于当前最大自增值的值' where b = 111;
insert into table1_default values(null,11,'2当前自增值=>');
select txt,a incre_col,b from table1_default order by a;
+-------------------------------------------------------------------+-----------+------+
| txt                                                               | incre_col | b    |
+-------------------------------------------------------------------+-----------+------+
| table1_default 默认order模式                                      |         1 |    1 |
| table1_default 默认order模式                                      |        15 |    1 |
| table1_default 默认order模式                                      |        25 |    1 |
| table1_default 默认order模式                                      |        35 |    1 |
| table1_default 默认order模式                                      |        45 |    1 |
| 将AUTO_INCREMENT列值设置为大于当前最大自增值的值                  |        60 |  111 |
| table1_default 默认order模式                                      |   1000001 |    1 |
| table1_default 默认order模式                                      |   1000002 |    1 |
| 最新自增值1=>                                                     |   1000004 |    1 |
| table1_default 默认order模式                                      |   1000005 |    1 |
| table1_default 默认order模式                                      |   1000006 |    1 |
| table1_default 默认order模式                                      |   1000007 |    1 |
| 最新自增值2=>                                                     |   1000009 |    1 |
| table1_default 默认order模式                                      |   1000010 |    1 |
| table1_default 默认order模式                                      |   1000011 |    1 |
| 最新自增值2=>                                                     |   1000014 |    1 |
| 最新自增值=>                                                      |   1000017 |    1 |
| 1当前自增值=>                                                     |   1000019 |   11 |
| 2当前自增值=>                                                     |   1000020 |   11 |
+-------------------------------------------------------------------+-----------+------+
insert into table2_order(a,b) values(null,222);
select txt,a incre_col,b from table2_order order by a;
+--------------------------+-----------+------+
| txt                      | incre_col | b    |
+--------------------------+-----------+------+
| table2_order order模式   |         1 |    2 |
| table2_order order模式   |        15 |    2 |
| table2_order order模式   |        16 |    2 |
| table2_order order模式   |        17 |    2 |
| table2_order order模式   |        25 |    2 |
| 最新自增值1=>            |        26 |    2 |
| table2_order order模式   |        27 |    2 |
| table2_order order模式   |        28 |    2 |
| table2_order order模式   |        29 |    2 |
| table2_order order模式   |        35 |    2 |
| 最新自增值2=>            |        36 |    2 |
| table2_order order模式   |        37 |    2 |
| table2_order order模式   |        38 |    2 |
| table2_order order模式   |        45 |    2 |
| 最新自增值2=>            |        46 |    2 |
| 最新自增值=>             |        49 |    2 |
| table2_order order模式   |        50 |  222 |
+--------------------------+-----------+------+
update table2_order set a = 0,txt = '将AUTO_INCREMENT列值设置为小于/等于当前最大自增值的值' where b = 222;
insert into table2_order values(null,22,'1当前自增值=>');
select txt,a incre_col,b from table2_order order by a;
+--------------------------------------------------------------------------+-----------+------+
| txt                                                                      | incre_col | b    |
+--------------------------------------------------------------------------+-----------+------+
| 将AUTO_INCREMENT列值设置为小于/等于当前最大自增值的值                    |         0 |  222 |
| table2_order order模式                                                   |         1 |    2 |
| table2_order order模式                                                   |        15 |    2 |
| table2_order order模式                                                   |        16 |    2 |
| table2_order order模式                                                   |        17 |    2 |
| table2_order order模式                                                   |        25 |    2 |
| 最新自增值1=>                                                            |        26 |    2 |
| table2_order order模式                                                   |        27 |    2 |
| table2_order order模式                                                   |        28 |    2 |
| table2_order order模式                                                   |        29 |    2 |
| table2_order order模式                                                   |        35 |    2 |
| 最新自增值2=>                                                            |        36 |    2 |
| table2_order order模式                                                   |        37 |    2 |
| table2_order order模式                                                   |        38 |    2 |
| table2_order order模式                                                   |        45 |    2 |
| 最新自增值2=>                                                            |        46 |    2 |
| 最新自增值=>                                                             |        49 |    2 |
| 1当前自增值=>                                                            |        51 |   22 |
+--------------------------------------------------------------------------+-----------+------+
update table2_order set a = 60 ,txt = '将AUTO_INCREMENT列值设置为大于当前最大自增值的值' where b = 222;
insert into table2_order values(null,22,'2当前自增值=>');
select txt,a incre_col,b from table2_order order by a;
+-------------------------------------------------------------------+-----------+------+
| txt                                                               | incre_col | b    |
+-------------------------------------------------------------------+-----------+------+
| table2_order order模式                                            |         1 |    2 |
| table2_order order模式                                            |        15 |    2 |
| table2_order order模式                                            |        16 |    2 |
| table2_order order模式                                            |        17 |    2 |
| table2_order order模式                                            |        25 |    2 |
| 最新自增值1=>                                                     |        26 |    2 |
| table2_order order模式                                            |        27 |    2 |
| table2_order order模式                                            |        28 |    2 |
| table2_order order模式                                            |        29 |    2 |
| table2_order order模式                                            |        35 |    2 |
| 最新自增值2=>                                                     |        36 |    2 |
| table2_order order模式                                            |        37 |    2 |
| table2_order order模式                                            |        38 |    2 |
| table2_order order模式                                            |        45 |    2 |
| 最新自增值2=>                                                     |        46 |    2 |
| 最新自增值=>                                                      |        49 |    2 |
| 1当前自增值=>                                                     |        51 |   22 |
| 2当前自增值=>                                                     |        52 |   22 |
| 将AUTO_INCREMENT列值设置为大于当前最大自增值的值                  |        60 |  222 |
+-------------------------------------------------------------------+-----------+------+
insert into table3_noorder(a,b) values(null,333);
select txt,a incre_col,b from table3_noorder order by a;
+------------------------------+-----------+------+
| txt                          | incre_col | b    |
+------------------------------+-----------+------+
| table3_noorder noorder模式   |         1 |    3 |
| table3_noorder noorder模式   |        15 |    3 |
| table3_noorder noorder模式   |        25 |    3 |
| table3_noorder noorder模式   |        35 |    3 |
| table3_noorder noorder模式   |        45 |    3 |
| table3_noorder noorder模式   |   1000001 |    3 |
| table3_noorder noorder模式   |   1000002 |    3 |
| 最新自增值1=>                |   1000004 |    3 |
| table3_noorder noorder模式   |   1000005 |    3 |
| table3_noorder noorder模式   |   1000006 |    3 |
| table3_noorder noorder模式   |   1000007 |    3 |
| 最新自增值2=>                |   1000009 |    3 |
| table3_noorder noorder模式   |   1000010 |    3 |
| table3_noorder noorder模式   |   1000011 |    3 |
| 最新自增值2=>                |   1000014 |    3 |
| 最新自增值=>                 |   1000017 |    3 |
| table3_noorder noorder模式   |   1000018 |  333 |
+------------------------------+-----------+------+
update table3_noorder set a = 0,txt = '将AUTO_INCREMENT列值设置为小于/等于当前最大自增值的值' where b = 333;
insert into table3_noorder values(null,33,'1当前自增值=>');
select txt,a incre_col,b from table3_noorder order by a;
+--------------------------------------------------------------------------+-----------+------+
| txt                                                                      | incre_col | b    |
+--------------------------------------------------------------------------+-----------+------+
| 将AUTO_INCREMENT列值设置为小于/等于当前最大自增值的值                    |         0 |  333 |
| table3_noorder noorder模式                                               |         1 |    3 |
| table3_noorder noorder模式                                               |        15 |    3 |
| table3_noorder noorder模式                                               |        25 |    3 |
| table3_noorder noorder模式                                               |        35 |    3 |
| table3_noorder noorder模式                                               |        45 |    3 |
| table3_noorder noorder模式                                               |   1000001 |    3 |
| table3_noorder noorder模式                                               |   1000002 |    3 |
| 最新自增值1=>                                                            |   1000004 |    3 |
| table3_noorder noorder模式                                               |   1000005 |    3 |
| table3_noorder noorder模式                                               |   1000006 |    3 |
| table3_noorder noorder模式                                               |   1000007 |    3 |
| 最新自增值2=>                                                            |   1000009 |    3 |
| table3_noorder noorder模式                                               |   1000010 |    3 |
| table3_noorder noorder模式                                               |   1000011 |    3 |
| 最新自增值2=>                                                            |   1000014 |    3 |
| 最新自增值=>                                                             |   1000017 |    3 |
| 1当前自增值=>                                                            |   1000019 |   33 |
+--------------------------------------------------------------------------+-----------+------+
update table3_noorder set a = 1000022 ,txt = '将AUTO_INCREMENT列值设置为大于当前最大自增值的值' where b = 333;
insert into table3_noorder values(null,33,'2当前自增值=>');
select txt,a incre_col,b from table3_noorder order by a;
+-------------------------------------------------------------------+-----------+------+
| txt                                                               | incre_col | b    |
+-------------------------------------------------------------------+-----------+------+
| table3_noorder noorder模式                                        |         1 |    3 |
| table3_noorder noorder模式                                        |        15 |    3 |
| table3_noorder noorder模式                                        |        25 |    3 |
| table3_noorder noorder模式                                        |        35 |    3 |
| table3_noorder noorder模式                                        |        45 |    3 |
| table3_noorder noorder模式                                        |   1000001 |    3 |
| table3_noorder noorder模式                                        |   1000002 |    3 |
| 最新自增值1=>                                                     |   1000004 |    3 |
| table3_noorder noorder模式                                        |   1000005 |    3 |
| table3_noorder noorder模式                                        |   1000006 |    3 |
| table3_noorder noorder模式                                        |   1000007 |    3 |
| 最新自增值2=>                                                     |   1000009 |    3 |
| table3_noorder noorder模式                                        |   1000010 |    3 |
| table3_noorder noorder模式                                        |   1000011 |    3 |
| 最新自增值2=>                                                     |   1000014 |    3 |
| 最新自增值=>                                                      |   1000017 |    3 |
| 1当前自增值=>                                                     |   1000019 |   33 |
| 2当前自增值=>                                                     |   1000020 |   33 |
| 将AUTO_INCREMENT列值设置为大于当前最大自增值的值                  |   1000022 |  333 |
+-------------------------------------------------------------------+-----------+------+
##更新其他列值时引用AUTO_INCREMENT列
delete from table1_default;
insert into table1_default(a,b,txt) values(null,0,'update');
select txt,a incre_col,b from table1_default order by a;
+--------+-----------+------+
| txt    | incre_col | b    |
+--------+-----------+------+
| update |   1000021 |    0 |
+--------+-----------+------+
update table1_default set b = a+1 where txt = 'update';
insert into table1_default values(null,11,'当前自增值==>');
select txt,a incre_col,b from table1_default order by a;
+--------------------+-----------+---------+
| txt                | incre_col | b       |
+--------------------+-----------+---------+
| update             |   1000021 | 1000022 |
| 当前自增值==>      |   1000022 |      11 |
+--------------------+-----------+---------+
delete from table2_order;
insert into table2_order(a,b,txt) values(null,0,'update');
select txt,a incre_col,b from table2_order order by a;
+--------+-----------+------+
| txt    | incre_col | b    |
+--------+-----------+------+
| update |        53 |    0 |
+--------+-----------+------+
update table2_order set b = a+2 where txt = 'update';
insert into table2_order values(null,22,'当前自增值==>');
select txt,a incre_col,b from table2_order order by a;
+--------------------+-----------+------+
| txt                | incre_col | b    |
+--------------------+-----------+------+
| update             |        53 |   55 |
| 当前自增值==>      |        54 |   22 |
+--------------------+-----------+------+
delete from table3_noorder;
insert into table3_noorder(a,b,txt) values(null,0,'update');
select txt,a incre_col,b from table3_noorder order by a;
+--------+-----------+------+
| txt    | incre_col | b    |
+--------+-----------+------+
| update |   1000021 |    0 |
+--------+-----------+------+
update table3_noorder set b = a+3 where txt = 'update';
insert into table3_noorder values(null,33,'当前自增值==>');
select txt,a incre_col,b from table3_noorder order by a;
+--------------------+-----------+---------+
| txt                | incre_col | b       |
+--------------------+-----------+---------+
| update             |   1000021 | 1000024 |
| 当前自增值==>      |   1000022 |      33 |
+--------------------+-----------+---------+
###### auto_incre_3-1-4 ④SELECT操作
select a incre_col from table1_default order by a;
+-----------+
| incre_col |
+-----------+
|   1000021 |
|   1000022 |
+-----------+
select abs(a) from table1_default order by a;
+---------+
| abs(a)  |
+---------+
| 1000021 |
| 1000022 |
+---------+
select a+b from table1_default order by a;
+---------+
| a+b     |
+---------+
| 2000043 |
| 1000033 |
+---------+
select a incre_col from table2_order order by a;
+-----------+
| incre_col |
+-----------+
|        53 |
|        54 |
+-----------+
select abs(a) from table2_order order by a;
+--------+
| abs(a) |
+--------+
|     53 |
|     54 |
+--------+
select a+b from table2_order order by a;
+------+
| a+b  |
+------+
|  108 |
|   76 |
+------+
select a incre_col from table3_noorder order by a;
+-----------+
| incre_col |
+-----------+
|   1000021 |
|   1000022 |
+-----------+
select abs(a) from table3_noorder order by a;
+---------+
| abs(a)  |
+---------+
| 1000021 |
| 1000022 |
+---------+
select a+b from table3_noorder order by a;
+---------+
| a+b     |
+---------+
| 2000045 |
| 1000055 |
+---------+
############ auto_incre_3-2 DDL操作 ############
###### auto_incre_3-2-1 ALTER TABLE 语句
##①修改AUTO_INCREMENT列初始值
select txt,a incre_col,b from table1_default order by a;
+--------------------+-----------+---------+
| txt                | incre_col | b       |
+--------------------+-----------+---------+
| update             |   1000021 | 1000022 |
| 当前自增值==>      |   1000022 |      11 |
+--------------------+-----------+---------+
alter table table1_default auto_increment = 100;
insert into table1_default values(null,11,'当前自增值1==>');
select txt,a incre_col,b from table1_default order by a;
+---------------------+-----------+---------+
| txt                 | incre_col | b       |
+---------------------+-----------+---------+
| update              |   1000021 | 1000022 |
| 当前自增值==>       |   1000022 |      11 |
| 当前自增值1==>      |   1000023 |      11 |
+---------------------+-----------+---------+
alter table table1_default auto_increment = 10;
insert into table1_default values(null,11,'当前自增值2==>');
select txt,a incre_col,b from table1_default order by a;
+---------------------+-----------+---------+
| txt                 | incre_col | b       |
+---------------------+-----------+---------+
| update              |   1000021 | 1000022 |
| 当前自增值==>       |   1000022 |      11 |
| 当前自增值1==>      |   1000023 |      11 |
| 当前自增值2==>      |   1000024 |      11 |
+---------------------+-----------+---------+
select txt,a incre_col,b from table2_order order by a;
+--------------------+-----------+------+
| txt                | incre_col | b    |
+--------------------+-----------+------+
| update             |        53 |   55 |
| 当前自增值==>      |        54 |   22 |
+--------------------+-----------+------+
alter table table2_order auto_increment = 2;
insert into table2_order values(null,11,'当前自增值1==>');
select txt,a incre_col,b from table2_order order by a;
+---------------------+-----------+------+
| txt                 | incre_col | b    |
+---------------------+-----------+------+
| update              |        53 |   55 |
| 当前自增值==>       |        54 |   22 |
| 当前自增值1==>      |        55 |   11 |
+---------------------+-----------+------+
alter table table2_order auto_increment = 90;
insert into table2_order values(null,11,'当前自增值2==>');
select txt,a incre_col,b from table2_order order by a;
+---------------------+-----------+------+
| txt                 | incre_col | b    |
+---------------------+-----------+------+
| update              |        53 |   55 |
| 当前自增值==>       |        54 |   22 |
| 当前自增值1==>      |        55 |   11 |
| 当前自增值2==>      |        90 |   11 |
+---------------------+-----------+------+
select txt,a incre_col,b from table3_noorder order by a;
+--------------------+-----------+---------+
| txt                | incre_col | b       |
+--------------------+-----------+---------+
| update             |   1000021 | 1000024 |
| 当前自增值==>      |   1000022 |      33 |
+--------------------+-----------+---------+
alter table table3_noorder auto_increment = 2;
insert into table3_noorder values(null,11,'当前自增值1==>');
select txt,a incre_col,b from table3_noorder order by a;
+---------------------+-----------+---------+
| txt                 | incre_col | b       |
+---------------------+-----------+---------+
| update              |   1000021 | 1000024 |
| 当前自增值==>       |   1000022 |      33 |
| 当前自增值1==>      |   1000023 |      11 |
+---------------------+-----------+---------+
alter table table3_noorder auto_increment = 2000001;
insert into table3_noorder values(null,11,'当前自增值2==>');
select txt,a incre_col,b from table3_noorder order by a;
+---------------------+-----------+---------+
| txt                 | incre_col | b       |
+---------------------+-----------+---------+
| update              |   1000021 | 1000024 |
| 当前自增值==>       |   1000022 |      33 |
| 当前自增值1==>      |   1000023 |      11 |
| 当前自增值2==>      |   2000001 |      11 |
+---------------------+-----------+---------+
##④重命名表名
##table1_default
select txt,a incre_col,b from table1_default order by a;
+---------------------+-----------+---------+
| txt                 | incre_col | b       |
+---------------------+-----------+---------+
| update              |   1000021 | 1000022 |
| 当前自增值==>       |   1000022 |      11 |
| 当前自增值1==>      |   1000023 |      11 |
| 当前自增值2==>      |   1000024 |      11 |
+---------------------+-----------+---------+
drop table t1_default;
alter table table1_default rename to t1_default;
insert into t1_default values(null,1,'④重命名表名 insert');
insert into t1_default values(null,1,'④重命名表名 insert');
select txt,a incre_col,b from t1_default order by a;
+---------------------------+-----------+---------+
| txt                       | incre_col | b       |
+---------------------------+-----------+---------+
| update                    |   1000021 | 1000022 |
| 当前自增值==>             |   1000022 |      11 |
| 当前自增值1==>            |   1000023 |      11 |
| 当前自增值2==>            |   1000024 |      11 |
| ④重命名表名 insert        |   1000025 |       1 |
| ④重命名表名 insert        |   1000026 |       1 |
+---------------------------+-----------+---------+
delete from t1_default where a = 1;
select txt,a incre_col,b from t1_default order by a;
+---------------------------+-----------+---------+
| txt                       | incre_col | b       |
+---------------------------+-----------+---------+
| update                    |   1000021 | 1000022 |
| 当前自增值==>             |   1000022 |      11 |
| 当前自增值1==>            |   1000023 |      11 |
| 当前自增值2==>            |   1000024 |      11 |
| ④重命名表名 insert        |   1000025 |       1 |
| ④重命名表名 insert        |   1000026 |       1 |
+---------------------------+-----------+---------+
update t1_default set txt = '④重命名表名-update操作' where a = 2;
insert into t1_default values(null,11,'当前自增值2==>');
select txt,a incre_col,b from t1_default order by a;
+---------------------------+-----------+---------+
| txt                       | incre_col | b       |
+---------------------------+-----------+---------+
| update                    |   1000021 | 1000022 |
| 当前自增值==>             |   1000022 |      11 |
| 当前自增值1==>            |   1000023 |      11 |
| 当前自增值2==>            |   1000024 |      11 |
| ④重命名表名 insert        |   1000025 |       1 |
| ④重命名表名 insert        |   1000026 |       1 |
| 当前自增值2==>            |   1000027 |      11 |
+---------------------------+-----------+---------+
##table2_order
select txt,a incre_col,b from table2_order order by a;
+---------------------+-----------+------+
| txt                 | incre_col | b    |
+---------------------+-----------+------+
| update              |        53 |   55 |
| 当前自增值==>       |        54 |   22 |
| 当前自增值1==>      |        55 |   11 |
| 当前自增值2==>      |        90 |   11 |
+---------------------+-----------+------+
drop table t2_order;
alter table table2_order rename to t2_order;
insert into t2_order values(null,2,'④重命名表名 insert');
insert into t2_order values(null,2,'④重命名表名 insert');
select txt,a incre_col,b from t2_order order by a;
+---------------------------+-----------+------+
| txt                       | incre_col | b    |
+---------------------------+-----------+------+
| update                    |        53 |   55 |
| 当前自增值==>             |        54 |   22 |
| 当前自增值1==>            |        55 |   11 |
| 当前自增值2==>            |        90 |   11 |
| ④重命名表名 insert        |        91 |    2 |
| ④重命名表名 insert        |        92 |    2 |
+---------------------------+-----------+------+
delete from t2_order where a = 1;
update t2_order set txt = '④重命名表名-update操作' where a = 2;
insert into t2_order values(null,11,'当前自增值2==>');
select txt,a incre_col,b from t2_order order by a;
+---------------------------+-----------+------+
| txt                       | incre_col | b    |
+---------------------------+-----------+------+
| update                    |        53 |   55 |
| 当前自增值==>             |        54 |   22 |
| 当前自增值1==>            |        55 |   11 |
| 当前自增值2==>            |        90 |   11 |
| ④重命名表名 insert        |        91 |    2 |
| ④重命名表名 insert        |        92 |    2 |
| 当前自增值2==>            |        93 |   11 |
+---------------------------+-----------+------+
##table3_noorder
select txt,a incre_col,b from table3_noorder order by a;
+---------------------+-----------+---------+
| txt                 | incre_col | b       |
+---------------------+-----------+---------+
| update              |   1000021 | 1000024 |
| 当前自增值==>       |   1000022 |      33 |
| 当前自增值1==>      |   1000023 |      11 |
| 当前自增值2==>      |   2000001 |      11 |
+---------------------+-----------+---------+
drop table t3_noorder;
alter table table3_noorder rename to t3_noorder;
insert into t3_noorder values(null,3,'④重命名表名 insert');
insert into t3_noorder values(null,3,'④重命名表名 insert');
select txt,a incre_col,b from t3_noorder order by a;
+---------------------------+-----------+---------+
| txt                       | incre_col | b       |
+---------------------------+-----------+---------+
| update                    |   1000021 | 1000024 |
| 当前自增值==>             |   1000022 |      33 |
| 当前自增值1==>            |   1000023 |      11 |
| 当前自增值2==>            |   2000001 |      11 |
| ④重命名表名 insert        |   2000002 |       3 |
| ④重命名表名 insert        |   2000003 |       3 |
+---------------------------+-----------+---------+
delete from t3_noorder where a = 1;
insert into t3_noorder values(null,11,'当前自增值1==>');
select txt,a incre_col,b from t3_noorder order by a;
+---------------------------+-----------+---------+
| txt                       | incre_col | b       |
+---------------------------+-----------+---------+
| update                    |   1000021 | 1000024 |
| 当前自增值==>             |   1000022 |      33 |
| 当前自增值1==>            |   1000023 |      11 |
| 当前自增值2==>            |   2000001 |      11 |
| ④重命名表名 insert        |   2000002 |       3 |
| ④重命名表名 insert        |   2000003 |       3 |
| 当前自增值1==>            |   2000004 |      11 |
+---------------------------+-----------+---------+
update t3_noorder set txt = '④重命名表名-update操作' where a = 2;
insert into t3_noorder values(null,11,'当前自增值2==>');
select txt,a incre_col,b from t3_noorder order by a;
+---------------------------+-----------+---------+
| txt                       | incre_col | b       |
+---------------------------+-----------+---------+
| update                    |   1000021 | 1000024 |
| 当前自增值==>             |   1000022 |      33 |
| 当前自增值1==>            |   1000023 |      11 |
| 当前自增值2==>            |   2000001 |      11 |
| ④重命名表名 insert        |   2000002 |       3 |
| ④重命名表名 insert        |   2000003 |       3 |
| 当前自增值1==>            |   2000004 |      11 |
| 当前自增值2==>            |   2000005 |      11 |
+---------------------------+-----------+---------+
##⑥修改AUTO_INCREMENT列属性
##t1_default
drop table t1_default;
create table t1_default (
  col_a int not null,
  b int default 1,
  txt varchar(64) default 't1_default 默认order模式',
  unique index(b)
)partition by range (b) ( 
partition p0 values less than (3), 
partition p1 values less than (6),  
partition p2 values less than (9), 
partition p3 values less than MAXVALUE);
insert into t1_default values(1,11,'t1_default'),(2,22,'t1_default'),(3,33,'t1_default');
alter table t1_default modify b int auto_increment;
insert into t1_default values(4,null,'⑥修改auto_increment列属性');
insert into t1_default values(5,null,'⑥修改auto_increment列属性');
insert into t1_default values(6,null,'⑥修改auto_increment列属性');
select txt,b incre_col,col_a from t1_default order by b;
+----------------------------------+-----------+-------+
| txt                              | incre_col | col_a |
+----------------------------------+-----------+-------+
| t1_default                       |        11 |     1 |
| t1_default                       |        22 |     2 |
| t1_default                       |        33 |     3 |
| ⑥修改auto_increment列属性        |        34 |     4 |
| ⑥修改auto_increment列属性        |        35 |     5 |
| ⑥修改auto_increment列属性        |        36 |     6 |
+----------------------------------+-----------+-------+
delete from t1_default where b = 33;
insert into t1_default values(7,null,'当前自增值1==>');
select txt,b incre_col,col_a from t1_default order by b;
+----------------------------------+-----------+-------+
| txt                              | incre_col | col_a |
+----------------------------------+-----------+-------+
| t1_default                       |        11 |     1 |
| t1_default                       |        22 |     2 |
| ⑥修改auto_increment列属性        |        34 |     4 |
| ⑥修改auto_increment列属性        |        35 |     5 |
| ⑥修改auto_increment列属性        |        36 |     6 |
| 当前自增值1==>                   |        37 |     7 |
+----------------------------------+-----------+-------+
update t1_default set txt = '⑥修改auto_increment列属性-update操作' where b = 34;
insert into t1_default values(8,null,'当前自增值2==>');
select txt,b incre_col,col_a from t1_default order by b;
+-----------------------------------------------+-----------+-------+
| txt                                           | incre_col | col_a |
+-----------------------------------------------+-----------+-------+
| t1_default                                    |        11 |     1 |
| t1_default                                    |        22 |     2 |
| ⑥修改auto_increment列属性-update操作          |        34 |     4 |
| ⑥修改auto_increment列属性                     |        35 |     5 |
| ⑥修改auto_increment列属性                     |        36 |     6 |
| 当前自增值1==>                                |        37 |     7 |
| 当前自增值2==>                                |        38 |     8 |
+-----------------------------------------------+-----------+-------+
##t2_order
drop table t2_order;
create table t2_order (
  col_a int not null,
  b int default 2,
  txt varchar(64) default 't2_order order模式',
  unique index(b)
) auto_increment_mode = 'order' 
partition by range (b) ( 
partition p0 values less than (3), 
partition p1 values less than (6),  
partition p2 values less than (9), 
partition p3 values less than MAXVALUE);
insert into t2_order values(1,11,'t2_order'),(2,22,'t2_order'),(3,33,'t2_order');
alter table t2_order modify b int auto_increment;
insert into t2_order values(4,null,'⑥修改auto_increment列属性');
insert into t2_order values(5,null,'⑥修改auto_increment列属性');
insert into t2_order values(6,null,'⑥修改auto_increment列属性');
select txt,b incre_col,col_a from t2_order order by b;
+----------------------------------+-----------+-------+
| txt                              | incre_col | col_a |
+----------------------------------+-----------+-------+
| t2_order                         |        11 |     1 |
| t2_order                         |        22 |     2 |
| t2_order                         |        33 |     3 |
| ⑥修改auto_increment列属性        |        34 |     4 |
| ⑥修改auto_increment列属性        |        35 |     5 |
| ⑥修改auto_increment列属性        |        36 |     6 |
+----------------------------------+-----------+-------+
delete from t2_order where b = 33;
insert into t2_order values(7,null,'当前自增值1==>');
select txt,b incre_col,col_a from t2_order order by b;
+----------------------------------+-----------+-------+
| txt                              | incre_col | col_a |
+----------------------------------+-----------+-------+
| t2_order                         |        11 |     1 |
| t2_order                         |        22 |     2 |
| ⑥修改auto_increment列属性        |        34 |     4 |
| ⑥修改auto_increment列属性        |        35 |     5 |
| ⑥修改auto_increment列属性        |        36 |     6 |
| 当前自增值1==>                   |        37 |     7 |
+----------------------------------+-----------+-------+
update t2_order set txt = '⑥修改auto_increment列属性-update操作' where b = 34;
insert into t2_order values(8,null,'当前自增值2==>');
select txt,b incre_col,col_a from t2_order order by b;
+-----------------------------------------------+-----------+-------+
| txt                                           | incre_col | col_a |
+-----------------------------------------------+-----------+-------+
| t2_order                                      |        11 |     1 |
| t2_order                                      |        22 |     2 |
| ⑥修改auto_increment列属性-update操作          |        34 |     4 |
| ⑥修改auto_increment列属性                     |        35 |     5 |
| ⑥修改auto_increment列属性                     |        36 |     6 |
| 当前自增值1==>                                |        37 |     7 |
| 当前自增值2==>                                |        38 |     8 |
+-----------------------------------------------+-----------+-------+
##t3_noorder
drop table t3_noorder;
create table t3_noorder (
  a int not null,
  b int default 3,
  txt varchar(64) default 't3_noorder noorder模式',
  unique index(b)
) auto_increment_mode = 'noorder' 
partition by range (b) ( 
partition p0 values less than (3), 
partition p1 values less than (6),  
partition p2 values less than (9), 
partition p3 values less than MAXVALUE);
insert into t3_noorder values(1,11,'t3_noorder'),(2,22,'t3_noorder'),(3,33,'t3_noorder');
alter table t3_noorder modify b int auto_increment;
insert into t3_noorder values(4,null,'⑥修改auto_increment列属性');
insert into t3_noorder values(5,null,'⑥修改auto_increment列属性');
insert into t3_noorder values(6,null,'⑥修改auto_increment列属性');
select txt,b incre_col,a from t3_noorder order by b;
+----------------------------------+-----------+---+
| txt                              | incre_col | a |
+----------------------------------+-----------+---+
| t3_noorder                       |        11 | 1 |
| t3_noorder                       |        22 | 2 |
| t3_noorder                       |        33 | 3 |
| ⑥修改auto_increment列属性        |        34 | 4 |
| ⑥修改auto_increment列属性        |        35 | 5 |
| ⑥修改auto_increment列属性        |        36 | 6 |
+----------------------------------+-----------+---+
delete from t3_noorder where b = 33;
insert into t3_noorder values(7,null,'当前自增值1==>');
select txt,b incre_col,a from t3_noorder order by b;
+----------------------------------+-----------+---+
| txt                              | incre_col | a |
+----------------------------------+-----------+---+
| t3_noorder                       |        11 | 1 |
| t3_noorder                       |        22 | 2 |
| ⑥修改auto_increment列属性        |        34 | 4 |
| ⑥修改auto_increment列属性        |        35 | 5 |
| ⑥修改auto_increment列属性        |        36 | 6 |
| 当前自增值1==>                   |        37 | 7 |
+----------------------------------+-----------+---+
update t3_noorder set txt = '⑥修改auto_increment列属性-update操作' where b = 34;
insert into t3_noorder values(8,null,'当前自增值2==>');
select txt,b incre_col,a from t3_noorder order by b;
+-----------------------------------------------+-----------+---+
| txt                                           | incre_col | a |
+-----------------------------------------------+-----------+---+
| t3_noorder                                    |        11 | 1 |
| t3_noorder                                    |        22 | 2 |
| ⑥修改auto_increment列属性-update操作          |        34 | 4 |
| ⑥修改auto_increment列属性                     |        35 | 5 |
| ⑥修改auto_increment列属性                     |        36 | 6 |
| 当前自增值1==>                                |        37 | 7 |
| 当前自增值2==>                                |        38 | 8 |
+-----------------------------------------------+-----------+---+
##⑦修改AUTO_INCREMENT列属性
##t1_default
drop table t1_default;
create table t1_default (
  a int not null auto_increment primary key,
  col_b int default 1,
  txt varchar(64) default 't1_default',
  unique index(col_b)
);
insert into t1_default(a,col_b) values(0,10),(0,20),(0,30);
select txt,a,col_b from t1_default order by a;
+------------+---+-------+
| txt        | a | col_b |
+------------+---+-------+
| t1_default | 1 |    10 |
| t1_default | 2 |    20 |
| t1_default | 3 |    30 |
+------------+---+-------+
alter table t1_default change a col_a int;
alter table t1_default change col_b b int auto_increment;
insert into t1_default values(4,null,'⑥修改auto_increment列属性');
insert into t1_default values(5,null,'⑥修改auto_increment列属性');
insert into t1_default values(6,null,'⑥修改auto_increment列属性');
select txt,b incre_col,col_a from t1_default order by b;
+----------------------------------+-----------+-------+
| txt                              | incre_col | col_a |
+----------------------------------+-----------+-------+
| t1_default                       |        10 |     1 |
| t1_default                       |        20 |     2 |
| t1_default                       |        30 |     3 |
| ⑥修改auto_increment列属性        |        31 |     4 |
| ⑥修改auto_increment列属性        |        32 |     5 |
| ⑥修改auto_increment列属性        |        33 |     6 |
+----------------------------------+-----------+-------+
delete from t1_default where b = 33;
insert into t1_default values(7,null,'当前自增值1==>');
select txt,b incre_col,col_a from t1_default order by b;
+----------------------------------+-----------+-------+
| txt                              | incre_col | col_a |
+----------------------------------+-----------+-------+
| t1_default                       |        10 |     1 |
| t1_default                       |        20 |     2 |
| t1_default                       |        30 |     3 |
| ⑥修改auto_increment列属性        |        31 |     4 |
| ⑥修改auto_increment列属性        |        32 |     5 |
| 当前自增值1==>                   |        34 |     7 |
+----------------------------------+-----------+-------+
update t1_default set txt = '⑥修改auto_increment列属性-update操作' where b = 32;
insert into t1_default values(8,null,'当前自增值2==>');
select txt,b incre_col,col_a from t1_default order by b;
+-----------------------------------------------+-----------+-------+
| txt                                           | incre_col | col_a |
+-----------------------------------------------+-----------+-------+
| t1_default                                    |        10 |     1 |
| t1_default                                    |        20 |     2 |
| t1_default                                    |        30 |     3 |
| ⑥修改auto_increment列属性                     |        31 |     4 |
| ⑥修改auto_increment列属性-update操作          |        32 |     5 |
| 当前自增值1==>                                |        34 |     7 |
| 当前自增值2==>                                |        35 |     8 |
+-----------------------------------------------+-----------+-------+
##t2_order
drop table t2_order;
create table t2_order (
  a int not null auto_increment,
  col_b int default 2,
  txt varchar(64) default 't2_order order模式',
  unique index(col_b)
) auto_increment_mode = 'order' 
partition by range (col_b) ( 
partition p0 values less than (3), 
partition p1 values less than (6),  
partition p2 values less than (9), 
partition p3 values less than MAXVALUE);
insert into t2_order(a,col_b) values(0,10),(0,20),(0,30);
select txt,a,col_b from t2_order order by a;
+----------------------+---+-------+
| txt                  | a | col_b |
+----------------------+---+-------+
| t2_order order模式   | 1 |    10 |
| t2_order order模式   | 2 |    20 |
| t2_order order模式   | 3 |    30 |
+----------------------+---+-------+
alter table t2_order change a col_a int;
alter table t2_order change col_b b int auto_increment;
insert into t2_order values(4,null,'⑥修改auto_increment列属性');
insert into t2_order values(5,null,'⑥修改auto_increment列属性');
insert into t2_order values(6,null,'⑥修改auto_increment列属性');
select txt,b incre_col,col_a from t2_order order by b;
+----------------------------------+-----------+-------+
| txt                              | incre_col | col_a |
+----------------------------------+-----------+-------+
| t2_order order模式               |        10 |     1 |
| t2_order order模式               |        20 |     2 |
| t2_order order模式               |        30 |     3 |
| ⑥修改auto_increment列属性        |        31 |     4 |
| ⑥修改auto_increment列属性        |        32 |     5 |
| ⑥修改auto_increment列属性        |        33 |     6 |
+----------------------------------+-----------+-------+
delete from t2_order where b = 33;
insert into t2_order values(7,null,'当前自增值1==>');
select txt,b incre_col,col_a from t2_order order by b;
+----------------------------------+-----------+-------+
| txt                              | incre_col | col_a |
+----------------------------------+-----------+-------+
| t2_order order模式               |        10 |     1 |
| t2_order order模式               |        20 |     2 |
| t2_order order模式               |        30 |     3 |
| ⑥修改auto_increment列属性        |        31 |     4 |
| ⑥修改auto_increment列属性        |        32 |     5 |
| 当前自增值1==>                   |        34 |     7 |
+----------------------------------+-----------+-------+
update t2_order set txt = '⑥修改auto_increment列属性-update操作' where b = 32;
insert into t2_order values(8,null,'当前自增值2==>');
select txt,b incre_col,col_a from t2_order order by b;
+-----------------------------------------------+-----------+-------+
| txt                                           | incre_col | col_a |
+-----------------------------------------------+-----------+-------+
| t2_order order模式                            |        10 |     1 |
| t2_order order模式                            |        20 |     2 |
| t2_order order模式                            |        30 |     3 |
| ⑥修改auto_increment列属性                     |        31 |     4 |
| ⑥修改auto_increment列属性-update操作          |        32 |     5 |
| 当前自增值1==>                                |        34 |     7 |
| 当前自增值2==>                                |        35 |     8 |
+-----------------------------------------------+-----------+-------+
##t3_noorder
drop table t3_noorder;
create table t3_noorder (
  a int not null auto_increment,
  col_b int default 3,
  txt varchar(64) default 't3_noorder noorder模式',
  unique index(col_b)
) auto_increment_mode = 'noorder' 
partition by range (col_b) ( 
partition p0 values less than (3), 
partition p1 values less than (6),  
partition p2 values less than (9), 
partition p3 values less than MAXVALUE);
insert into t3_noorder(a,col_b) values(0,10),(0,20),(0,30);
select txt,a,col_b from t3_noorder order by a;
+--------------------------+---+-------+
| txt                      | a | col_b |
+--------------------------+---+-------+
| t3_noorder noorder模式   | 1 |    10 |
| t3_noorder noorder模式   | 2 |    20 |
| t3_noorder noorder模式   | 3 |    30 |
+--------------------------+---+-------+
alter table t3_noorder change a col_a int;
alter table t3_noorder change col_b b int auto_increment;
insert into t3_noorder values(4,null,'⑥修改auto_increment列属性');
insert into t3_noorder values(5,null,'⑥修改auto_increment列属性');
insert into t3_noorder values(6,null,'⑥修改auto_increment列属性');
select txt,b incre_col,col_a from t3_noorder order by b;
+----------------------------------+-----------+-------+
| txt                              | incre_col | col_a |
+----------------------------------+-----------+-------+
| t3_noorder noorder模式           |        10 |     1 |
| t3_noorder noorder模式           |        20 |     2 |
| t3_noorder noorder模式           |        30 |     3 |
| ⑥修改auto_increment列属性        |        31 |     4 |
| ⑥修改auto_increment列属性        |        32 |     5 |
| ⑥修改auto_increment列属性        |        33 |     6 |
+----------------------------------+-----------+-------+
delete from t3_noorder where b = 33;
insert into t3_noorder values(7,null,'当前自增值1==>');
select txt,b incre_col,col_a from t3_noorder order by b;
+----------------------------------+-----------+-------+
| txt                              | incre_col | col_a |
+----------------------------------+-----------+-------+
| t3_noorder noorder模式           |        10 |     1 |
| t3_noorder noorder模式           |        20 |     2 |
| t3_noorder noorder模式           |        30 |     3 |
| ⑥修改auto_increment列属性        |        31 |     4 |
| ⑥修改auto_increment列属性        |        32 |     5 |
| 当前自增值1==>                   |        34 |     7 |
+----------------------------------+-----------+-------+
update t3_noorder set txt = '⑥修改auto_increment列属性-update操作' where b = 32;
insert into t3_noorder values(8,null,'当前自增值2==>');
select txt,b incre_col,col_a from t3_noorder order by b;
+-----------------------------------------------+-----------+-------+
| txt                                           | incre_col | col_a |
+-----------------------------------------------+-----------+-------+
| t3_noorder noorder模式                        |        10 |     1 |
| t3_noorder noorder模式                        |        20 |     2 |
| t3_noorder noorder模式                        |        30 |     3 |
| ⑥修改auto_increment列属性                     |        31 |     4 |
| ⑥修改auto_increment列属性-update操作          |        32 |     5 |
| 当前自增值1==>                                |        34 |     7 |
| 当前自增值2==>                                |        35 |     8 |
+-----------------------------------------------+-----------+-------+
############ auto_incre_2-4 ④模式切换 ############
##建表
###### INT 类型，索引 - 唯一索引
set auto_increment_increment=1;
alter system set default_auto_increment_mode = 'order';
drop table table1_default;
create table table1_default (
  a int not null auto_increment primary key,
  b int default 1,
  txt varchar(64) default 'table1_default 默认order模式',
  unique index(a)
)partition by range (a) ( 
partition p0 values less than (3), 
partition p1 values less than (6),  
partition p2 values less than (9), 
partition p3 values less than MAXVALUE);
## ORDER==>ORDER
insert into table1_default(a) values(0),(0),(0),(0),(0);
select txt,a incre_col, b from table1_default order by a;
+----------------------------------+-----------+------+
| txt                              | incre_col | b    |
+----------------------------------+-----------+------+
| table1_default 默认order模式     |         1 |    1 |
| table1_default 默认order模式     |         2 |    1 |
| table1_default 默认order模式     |         3 |    1 |
| table1_default 默认order模式     |         4 |    1 |
| table1_default 默认order模式     |         5 |    1 |
+----------------------------------+-----------+------+
alter table table1_default auto_increment_mode = 'ORDER';
insert into table1_default values(0,2,'ORDER==>ORDER'),(0,2,'ORDER==>ORDER'),(0,2,'ORDER==>ORDER'),(0,2,'ORDER==>ORDER');
select txt,a incre_col, b from table1_default order by a;
+----------------------------------+-----------+------+
| txt                              | incre_col | b    |
+----------------------------------+-----------+------+
| table1_default 默认order模式     |         1 |    1 |
| table1_default 默认order模式     |         2 |    1 |
| table1_default 默认order模式     |         3 |    1 |
| table1_default 默认order模式     |         4 |    1 |
| table1_default 默认order模式     |         5 |    1 |
| ORDER==>ORDER                    |         6 |    2 |
| ORDER==>ORDER                    |         7 |    2 |
| ORDER==>ORDER                    |         8 |    2 |
| ORDER==>ORDER                    |         9 |    2 |
+----------------------------------+-----------+------+
## ORDER==>NOORDER
alter table table1_default auto_increment_mode = 'NOORDER';
insert into table1_default values(0,3,'ORDER==>NOORDER'),(0,3,'ORDER==>NOORDER'),(0,3,'ORDER==>NOORDER'),(0,3,'ORDER==>NOORDER');
select txt,a incre_col, b from table1_default order by a;
+----------------------------------+-----------+------+
| txt                              | incre_col | b    |
+----------------------------------+-----------+------+
| table1_default 默认order模式     |         1 |    1 |
| table1_default 默认order模式     |         2 |    1 |
| table1_default 默认order模式     |         3 |    1 |
| table1_default 默认order模式     |         4 |    1 |
| table1_default 默认order模式     |         5 |    1 |
| ORDER==>ORDER                    |         6 |    2 |
| ORDER==>ORDER                    |         7 |    2 |
| ORDER==>ORDER                    |         8 |    2 |
| ORDER==>ORDER                    |         9 |    2 |
| ORDER==>NOORDER                  |   1000001 |    3 |
| ORDER==>NOORDER                  |   1000002 |    3 |
| ORDER==>NOORDER                  |   1000003 |    3 |
| ORDER==>NOORDER                  |   1000004 |    3 |
+----------------------------------+-----------+------+
## NOORDER==>NOORDER
alter table table1_default auto_increment_mode = 'NOORDER';
insert into table1_default values(0,4,'NOORDER==>NOORDER'),(0,4,'NOORDER==>NOORDER'),(0,4,'NOORDER==>NOORDER'),(0,4,'NOORDER==>NOORDER');
select txt,a incre_col, b from table1_default order by a;
+----------------------------------+-----------+------+
| txt                              | incre_col | b    |
+----------------------------------+-----------+------+
| table1_default 默认order模式     |         1 |    1 |
| table1_default 默认order模式     |         2 |    1 |
| table1_default 默认order模式     |         3 |    1 |
| table1_default 默认order模式     |         4 |    1 |
| table1_default 默认order模式     |         5 |    1 |
| ORDER==>ORDER                    |         6 |    2 |
| ORDER==>ORDER                    |         7 |    2 |
| ORDER==>ORDER                    |         8 |    2 |
| ORDER==>ORDER                    |         9 |    2 |
| ORDER==>NOORDER                  |   1000001 |    3 |
| ORDER==>NOORDER                  |   1000002 |    3 |
| ORDER==>NOORDER                  |   1000003 |    3 |
| ORDER==>NOORDER                  |   1000004 |    3 |
| NOORDER==>NOORDER                |   1000005 |    4 |
| NOORDER==>NOORDER                |   1000006 |    4 |
| NOORDER==>NOORDER                |   1000007 |    4 |
| NOORDER==>NOORDER                |   1000008 |    4 |
+----------------------------------+-----------+------+
## NOORDER==>ORDER
alter table table1_default auto_increment_mode = 'ORDER';
insert into table1_default values(0,5,'NOORDER==>ORDER'),(0,5,'NOORDER==>ORDER'),(0,5,'NOORDER==>ORDER'),(0,5,'NOORDER==>ORDER');
select txt,a incre_col, b from table1_default order by a;
+----------------------------------+-----------+------+
| txt                              | incre_col | b    |
+----------------------------------+-----------+------+
| table1_default 默认order模式     |         1 |    1 |
| table1_default 默认order模式     |         2 |    1 |
| table1_default 默认order模式     |         3 |    1 |
| table1_default 默认order模式     |         4 |    1 |
| table1_default 默认order模式     |         5 |    1 |
| ORDER==>ORDER                    |         6 |    2 |
| ORDER==>ORDER                    |         7 |    2 |
| ORDER==>ORDER                    |         8 |    2 |
| ORDER==>ORDER                    |         9 |    2 |
| ORDER==>NOORDER                  |   1000001 |    3 |
| ORDER==>NOORDER                  |   1000002 |    3 |
| ORDER==>NOORDER                  |   1000003 |    3 |
| ORDER==>NOORDER                  |   1000004 |    3 |
| NOORDER==>NOORDER                |   1000005 |    4 |
| NOORDER==>NOORDER                |   1000006 |    4 |
| NOORDER==>NOORDER                |   1000007 |    4 |
| NOORDER==>NOORDER                |   1000008 |    4 |
| NOORDER==>ORDER                  |   2000001 |    5 |
| NOORDER==>ORDER                  |   2000002 |    5 |
| NOORDER==>ORDER                  |   2000003 |    5 |
| NOORDER==>ORDER                  |   2000004 |    5 |
+----------------------------------+-----------+------+
insert into table1_default values(0,6,'NOORDER==>ORDER test');
select txt,a incre_col, b from table1_default order by a;
+----------------------------------+-----------+------+
| txt                              | incre_col | b    |
+----------------------------------+-----------+------+
| table1_default 默认order模式     |         1 |    1 |
| table1_default 默认order模式     |         2 |    1 |
| table1_default 默认order模式     |         3 |    1 |
| table1_default 默认order模式     |         4 |    1 |
| table1_default 默认order模式     |         5 |    1 |
| ORDER==>ORDER                    |         6 |    2 |
| ORDER==>ORDER                    |         7 |    2 |
| ORDER==>ORDER                    |         8 |    2 |
| ORDER==>ORDER                    |         9 |    2 |
| ORDER==>NOORDER                  |   1000001 |    3 |
| ORDER==>NOORDER                  |   1000002 |    3 |
| ORDER==>NOORDER                  |   1000003 |    3 |
| ORDER==>NOORDER                  |   1000004 |    3 |
| NOORDER==>NOORDER                |   1000005 |    4 |
| NOORDER==>NOORDER                |   1000006 |    4 |
| NOORDER==>NOORDER                |   1000007 |    4 |
| NOORDER==>NOORDER                |   1000008 |    4 |
| NOORDER==>ORDER                  |   2000001 |    5 |
| NOORDER==>ORDER                  |   2000002 |    5 |
| NOORDER==>ORDER                  |   2000003 |    5 |
| NOORDER==>ORDER                  |   2000004 |    5 |
| NOORDER==>ORDER test             |   2000005 |    6 |
+----------------------------------+-----------+------+
update table1_default set a = 10 where b = 6;
insert into table1_default(a,txt) values(0,'最新自增值=>');
select txt,a incre_col, b from table1_default order by a;
+----------------------------------+-----------+------+
| txt                              | incre_col | b    |
+----------------------------------+-----------+------+
| table1_default 默认order模式     |         1 |    1 |
| table1_default 默认order模式     |         2 |    1 |
| table1_default 默认order模式     |         3 |    1 |
| table1_default 默认order模式     |         4 |    1 |
| table1_default 默认order模式     |         5 |    1 |
| ORDER==>ORDER                    |         6 |    2 |
| ORDER==>ORDER                    |         7 |    2 |
| ORDER==>ORDER                    |         8 |    2 |
| ORDER==>ORDER                    |         9 |    2 |
| NOORDER==>ORDER test             |        10 |    6 |
| ORDER==>NOORDER                  |   1000001 |    3 |
| ORDER==>NOORDER                  |   1000002 |    3 |
| ORDER==>NOORDER                  |   1000003 |    3 |
| ORDER==>NOORDER                  |   1000004 |    3 |
| NOORDER==>NOORDER                |   1000005 |    4 |
| NOORDER==>NOORDER                |   1000006 |    4 |
| NOORDER==>NOORDER                |   1000007 |    4 |
| NOORDER==>NOORDER                |   1000008 |    4 |
| NOORDER==>ORDER                  |   2000001 |    5 |
| NOORDER==>ORDER                  |   2000002 |    5 |
| NOORDER==>ORDER                  |   2000003 |    5 |
| NOORDER==>ORDER                  |   2000004 |    5 |
| 最新自增值=>                     |   2000006 |    1 |
+----------------------------------+-----------+------+
############ list分区
##建表
drop table table0_date;
create table table0_date (
  a int,
  b int default 0,
  txt varchar(64) default 'table0_date'
);
insert into table0_date(a) values(11),(12),(13),(16),(17),(18);
drop table table1_default;
create table table1_default (
  a int not null auto_increment primary key,
  b int default 1,
  txt varchar(64) default 'table1_default 默认order模式',
  unique index(a)
)partition by list(a)( 
 partition p0 values in (1,2,3,4,5,24,25,27,29),
 partition p1 values in (6,7,8,9,10,23,26,30,32),
 partition p2 values in (11,12,13,14,15,22,31,33),
 partition p3 values in (16,17,18,19,20,21,28,34));
drop table table2_order;
create table table2_order (
  a int not null auto_increment primary key,
  b int default 2,
  txt varchar(64) default 'table2_order order模式',
  unique index(a)
) auto_increment_mode = 'order' 
partition by list(a)( 
 partition p0 values in (1,2,3,4,5,24,25,27,29),
 partition p1 values in (6,7,8,9,10,23,26,30,32),
 partition p2 values in (11,12,13,14,15,22,31,33),
 partition p3 values in (16,17,18,19,20,21,28,34));
drop table table3_noorder;
create table table3_noorder (
  a int not null auto_increment primary key,
  b int default 3,
  txt varchar(64) default 'table3_noorder noorder模式',
  unique index(a)
) auto_increment_mode = 'noorder' 
partition by list(a)( 
 partition p0 values in (1,2,3,4,5,24,25,27,29),
 partition p1 values in (6,7,8,9,10,23,26,30,32),
 partition p2 values in (11,12,13,14,15,22,31,33),
 partition p3 values in (16,17,18,19,20,21,28,34),
 partition p4 values in (1000001,2000001,3000001,4000001));
############ auto_incre_3-1 DML操作 ############
###### auto_incre_3-1-1 ①INSERT操作 
##简单插入
##INSERT 语句
##table1_default
insert into table1_default(a) values(null);
insert into table1_default(a) values(null),(null);
select txt,a incre_col,b from table1_default order by a;
+----------------------------------+-----------+------+
| txt                              | incre_col | b    |
+----------------------------------+-----------+------+
| table1_default 默认order模式     |         1 |    1 |
| table1_default 默认order模式     |         2 |    1 |
| table1_default 默认order模式     |         3 |    1 |
+----------------------------------+-----------+------+
insert into table1_default(a) values(5);
insert into table1_default(a,txt) values(0,'最新自增值=>');
select txt,a incre_col,b from table1_default order by a;
+----------------------------------+-----------+------+
| txt                              | incre_col | b    |
+----------------------------------+-----------+------+
| table1_default 默认order模式     |         1 |    1 |
| table1_default 默认order模式     |         2 |    1 |
| table1_default 默认order模式     |         3 |    1 |
| table1_default 默认order模式     |         5 |    1 |
| 最新自增值=>                     |         6 |    1 |
+----------------------------------+-----------+------+
##table2_order
insert into table2_order(a) values(null);
insert into table2_order(a) values(null),(null),(null),(null);
select txt,a incre_col,b from table2_order order by a;
+--------------------------+-----------+------+
| txt                      | incre_col | b    |
+--------------------------+-----------+------+
| table2_order order模式   |         1 |    2 |
| table2_order order模式   |         2 |    2 |
| table2_order order模式   |         3 |    2 |
| table2_order order模式   |         4 |    2 |
| table2_order order模式   |         5 |    2 |
+--------------------------+-----------+------+
insert into table2_order(a) values(6);
insert into table2_order(a,txt) values(0,'1最新自增值=>');
select txt,a incre_col,b from table2_order order by a;
+--------------------------+-----------+------+
| txt                      | incre_col | b    |
+--------------------------+-----------+------+
| table2_order order模式   |         1 |    2 |
| table2_order order模式   |         2 |    2 |
| table2_order order模式   |         3 |    2 |
| table2_order order模式   |         4 |    2 |
| table2_order order模式   |         5 |    2 |
| table2_order order模式   |         6 |    2 |
| 1最新自增值=>            |         7 |    2 |
+--------------------------+-----------+------+
##table3_noorder
insert into table3_noorder(a) values(null);
insert into table3_noorder(a) values(null),(null),(null),(null);
select txt,a incre_col,b from table3_noorder order by a;
+------------------------------+-----------+------+
| txt                          | incre_col | b    |
+------------------------------+-----------+------+
| table3_noorder noorder模式   |         1 |    3 |
| table3_noorder noorder模式   |         2 |    3 |
| table3_noorder noorder模式   |         3 |    3 |
| table3_noorder noorder模式   |         4 |    3 |
| table3_noorder noorder模式   |         5 |    3 |
+------------------------------+-----------+------+
insert into table3_noorder(a) values(6);
insert into table3_noorder(a,txt) values(0,'最新自增值=>');
select txt,a incre_col,b from table3_noorder order by a;
+------------------------------+-----------+------+
| txt                          | incre_col | b    |
+------------------------------+-----------+------+
| table3_noorder noorder模式   |         1 |    3 |
| table3_noorder noorder模式   |         2 |    3 |
| table3_noorder noorder模式   |         3 |    3 |
| table3_noorder noorder模式   |         4 |    3 |
| table3_noorder noorder模式   |         5 |    3 |
| table3_noorder noorder模式   |         6 |    3 |
| 最新自增值=>                 |   1000001 |    3 |
+------------------------------+-----------+------+
##批量插入
##INSERT ... SELECT语句
insert into table1_default select a,b,txt from table0_date where a <= 15;
select txt,a incre_col,b from table1_default order by a;
+----------------------------------+-----------+------+
| txt                              | incre_col | b    |
+----------------------------------+-----------+------+
| table1_default 默认order模式     |         1 |    1 |
| table1_default 默认order模式     |         2 |    1 |
| table1_default 默认order模式     |         3 |    1 |
| table1_default 默认order模式     |         5 |    1 |
| 最新自增值=>                     |         6 |    1 |
| table0_date                      |        11 |    0 |
| table0_date                      |        12 |    0 |
| table0_date                      |        13 |    0 |
+----------------------------------+-----------+------+
insert into table1_default(a,txt) values(0,'最新自增值=>');
select txt,a incre_col,b from table1_default order by a;
+----------------------------------+-----------+------+
| txt                              | incre_col | b    |
+----------------------------------+-----------+------+
| table1_default 默认order模式     |         1 |    1 |
| table1_default 默认order模式     |         2 |    1 |
| table1_default 默认order模式     |         3 |    1 |
| table1_default 默认order模式     |         5 |    1 |
| 最新自增值=>                     |         6 |    1 |
| table0_date                      |        11 |    0 |
| table0_date                      |        12 |    0 |
| table0_date                      |        13 |    0 |
| 最新自增值=>                     |        14 |    1 |
+----------------------------------+-----------+------+
insert into table2_order select a,b,txt from table0_date where a <= 15;
select txt,a incre_col,b from table2_order order by a;
+--------------------------+-----------+------+
| txt                      | incre_col | b    |
+--------------------------+-----------+------+
| table2_order order模式   |         1 |    2 |
| table2_order order模式   |         2 |    2 |
| table2_order order模式   |         3 |    2 |
| table2_order order模式   |         4 |    2 |
| table2_order order模式   |         5 |    2 |
| table2_order order模式   |         6 |    2 |
| 1最新自增值=>            |         7 |    2 |
| table0_date              |        11 |    0 |
| table0_date              |        12 |    0 |
| table0_date              |        13 |    0 |
+--------------------------+-----------+------+
insert into table2_order(a,txt) values(0,'最新自增值=>');
select txt,a incre_col,b from table2_order order by a;
+--------------------------+-----------+------+
| txt                      | incre_col | b    |
+--------------------------+-----------+------+
| table2_order order模式   |         1 |    2 |
| table2_order order模式   |         2 |    2 |
| table2_order order模式   |         3 |    2 |
| table2_order order模式   |         4 |    2 |
| table2_order order模式   |         5 |    2 |
| table2_order order模式   |         6 |    2 |
| 1最新自增值=>            |         7 |    2 |
| table0_date              |        11 |    0 |
| table0_date              |        12 |    0 |
| table0_date              |        13 |    0 |
| 最新自增值=>             |        14 |    2 |
+--------------------------+-----------+------+
insert into table3_noorder select a,b,txt from table0_date where a <= 15;
select txt,a incre_col,b from table3_noorder order by a;
+------------------------------+-----------+------+
| txt                          | incre_col | b    |
+------------------------------+-----------+------+
| table3_noorder noorder模式   |         1 |    3 |
| table3_noorder noorder模式   |         2 |    3 |
| table3_noorder noorder模式   |         3 |    3 |
| table3_noorder noorder模式   |         4 |    3 |
| table3_noorder noorder模式   |         5 |    3 |
| table3_noorder noorder模式   |         6 |    3 |
| table0_date                  |        11 |    0 |
| table0_date                  |        12 |    0 |
| table0_date                  |        13 |    0 |
| 最新自增值=>                 |   1000001 |    3 |
+------------------------------+-----------+------+
##混合插入
##INSERT ... ON DUPLICATE KEY UPDATE 语句
insert into table1_default (a,b,txt) values (1,1,'重复场合') on duplicate key update b=b+1,txt='insert...on duplicate key update 语句';
insert into table1_default(a,txt) values(0,'最新自增值1=>');
select txt,a incre_col,b from table1_default order by a;
+-----------------------------------------+-----------+------+
| txt                                     | incre_col | b    |
+-----------------------------------------+-----------+------+
| insert...on duplicate key update 语句   |         1 |    2 |
| table1_default 默认order模式            |         2 |    1 |
| table1_default 默认order模式            |         3 |    1 |
| table1_default 默认order模式            |         5 |    1 |
| 最新自增值=>                            |         6 |    1 |
| table0_date                             |        11 |    0 |
| table0_date                             |        12 |    0 |
| table0_date                             |        13 |    0 |
| 最新自增值=>                            |        14 |    1 |
| 最新自增值1=>                           |        15 |    1 |
+-----------------------------------------+-----------+------+
insert into table1_default (a,b,txt) values (20,1,'不重复场合') on duplicate key update b=b+1,txt='insert...on duplicate key update 语句';
insert into table1_default(a,txt) values(0,'最新自增值2=>');
select txt,a incre_col,b from table1_default order by a;
+-----------------------------------------+-----------+------+
| txt                                     | incre_col | b    |
+-----------------------------------------+-----------+------+
| insert...on duplicate key update 语句   |         1 |    2 |
| table1_default 默认order模式            |         2 |    1 |
| table1_default 默认order模式            |         3 |    1 |
| table1_default 默认order模式            |         5 |    1 |
| 最新自增值=>                            |         6 |    1 |
| table0_date                             |        11 |    0 |
| table0_date                             |        12 |    0 |
| table0_date                             |        13 |    0 |
| 最新自增值=>                            |        14 |    1 |
| 最新自增值1=>                           |        15 |    1 |
| 不重复场合                              |        20 |    1 |
| 最新自增值2=>                           |        21 |    1 |
+-----------------------------------------+-----------+------+
insert into table2_order (a,b,txt) values (1,2,'重复场合') on duplicate key update b=b+1,txt='insert...on duplicate key update 语句';
insert into table2_order(a,txt) values(0,'最新自增值1=>');
select txt,a incre_col,b from table2_order order by a;
+-----------------------------------------+-----------+------+
| txt                                     | incre_col | b    |
+-----------------------------------------+-----------+------+
| insert...on duplicate key update 语句   |         1 |    3 |
| table2_order order模式                  |         2 |    2 |
| table2_order order模式                  |         3 |    2 |
| table2_order order模式                  |         4 |    2 |
| table2_order order模式                  |         5 |    2 |
| table2_order order模式                  |         6 |    2 |
| 1最新自增值=>                           |         7 |    2 |
| table0_date                             |        11 |    0 |
| table0_date                             |        12 |    0 |
| table0_date                             |        13 |    0 |
| 最新自增值=>                            |        14 |    2 |
| 最新自增值1=>                           |        15 |    2 |
+-----------------------------------------+-----------+------+
insert into table2_order (a,b,txt) values (20,2,'不重复场合') on duplicate key update b=b+1,txt='insert...on duplicate key update 语句';
insert into table2_order(a,txt) values(0,'最新自增值2=>');
select txt,a incre_col,b from table2_order order by a;
+-----------------------------------------+-----------+------+
| txt                                     | incre_col | b    |
+-----------------------------------------+-----------+------+
| insert...on duplicate key update 语句   |         1 |    3 |
| table2_order order模式                  |         2 |    2 |
| table2_order order模式                  |         3 |    2 |
| table2_order order模式                  |         4 |    2 |
| table2_order order模式                  |         5 |    2 |
| table2_order order模式                  |         6 |    2 |
| 1最新自增值=>                           |         7 |    2 |
| table0_date                             |        11 |    0 |
| table0_date                             |        12 |    0 |
| table0_date                             |        13 |    0 |
| 最新自增值=>                            |        14 |    2 |
| 最新自增值1=>                           |        15 |    2 |
| 不重复场合                              |        20 |    2 |
| 最新自增值2=>                           |        21 |    2 |
+-----------------------------------------+-----------+------+
drop table table3_noorder;
create table table3_noorder (
  a int not null auto_increment primary key,
  b int default 3,
  txt varchar(64) default 'table3_noorder noorder模式',
  unique index(a)
) auto_increment_mode = 'noorder' 
partition by list(a)( 
 partition p0 values in (1,2,3,4,5,24,25,27,29,35,36),
 partition p1 values in (6,7,8,9,10,23,26,30,32,37,38),
 partition p2 values in (11,12,13,14,15,22,31,33,34,1000008),
 partition p3 values in (16,17,18,19,20,21,28,39,44,1000007),
 partition p4 values in (1000001,1000002,1000003,1000004,1000005,1000006),
 partition p5 values in (2000001,2000002,2000003,2000004,2000005,2000006));
insert into table3_noorder(a) values(null),(null);
insert into table3_noorder (a,b,txt) values (1,3,'重复场合') on duplicate key update b=b+1,txt='insert...on duplicate key update 语句';
insert into table3_noorder(a,txt) values(0,'最新自增值1=>');
select txt,a incre_col,b from table3_noorder order by a;
+-----------------------------------------+-----------+------+
| txt                                     | incre_col | b    |
+-----------------------------------------+-----------+------+
| insert...on duplicate key update 语句   |         1 |    4 |
| table3_noorder noorder模式              |         2 |    3 |
| 最新自增值1=>                           |         3 |    3 |
+-----------------------------------------+-----------+------+
insert into table3_noorder (a,b,txt) values (20,3,'不重复场合') on duplicate key update b=b+1,txt='insert...on duplicate key update 语句';
insert into table3_noorder(a,txt) values(0,'最新自增值1=>');
select txt,a incre_col,b from table3_noorder order by a;
+-----------------------------------------+-----------+------+
| txt                                     | incre_col | b    |
+-----------------------------------------+-----------+------+
| insert...on duplicate key update 语句   |         1 |    4 |
| table3_noorder noorder模式              |         2 |    3 |
| 最新自增值1=>                           |         3 |    3 |
| 不重复场合                              |        20 |    3 |
| 最新自增值1=>                           |   1000001 |    3 |
+-----------------------------------------+-----------+------+
##将NULL和任何其他值混合插入 AUTO_INCREMENT列
##INSERT 语句
insert into table1_default(a) values(null),(25),(null),(30);
insert into table1_default(a,txt) values(0,'最新自增值1=>');
select txt,a incre_col,b from table1_default order by a;
+-----------------------------------------+-----------+------+
| txt                                     | incre_col | b    |
+-----------------------------------------+-----------+------+
| insert...on duplicate key update 语句   |         1 |    2 |
| table1_default 默认order模式            |         2 |    1 |
| table1_default 默认order模式            |         3 |    1 |
| table1_default 默认order模式            |         5 |    1 |
| 最新自增值=>                            |         6 |    1 |
| table0_date                             |        11 |    0 |
| table0_date                             |        12 |    0 |
| table0_date                             |        13 |    0 |
| 最新自增值=>                            |        14 |    1 |
| 最新自增值1=>                           |        15 |    1 |
| 不重复场合                              |        20 |    1 |
| 最新自增值2=>                           |        21 |    1 |
| table1_default 默认order模式            |        22 |    1 |
| table1_default 默认order模式            |        25 |    1 |
| table1_default 默认order模式            |        26 |    1 |
| table1_default 默认order模式            |        30 |    1 |
| 最新自增值1=>                           |        31 |    1 |
+-----------------------------------------+-----------+------+
insert into table2_order(a) values(null),(25),(null),(30);
insert into table2_order(a,txt) values(0,'最新自增值=>');
select txt,a incre_col,b from table2_order order by a;
+-----------------------------------------+-----------+------+
| txt                                     | incre_col | b    |
+-----------------------------------------+-----------+------+
| insert...on duplicate key update 语句   |         1 |    3 |
| table2_order order模式                  |         2 |    2 |
| table2_order order模式                  |         3 |    2 |
| table2_order order模式                  |         4 |    2 |
| table2_order order模式                  |         5 |    2 |
| table2_order order模式                  |         6 |    2 |
| 1最新自增值=>                           |         7 |    2 |
| table0_date                             |        11 |    0 |
| table0_date                             |        12 |    0 |
| table0_date                             |        13 |    0 |
| 最新自增值=>                            |        14 |    2 |
| 最新自增值1=>                           |        15 |    2 |
| 不重复场合                              |        20 |    2 |
| 最新自增值2=>                           |        21 |    2 |
| table2_order order模式                  |        22 |    2 |
| table2_order order模式                  |        25 |    2 |
| table2_order order模式                  |        26 |    2 |
| table2_order order模式                  |        30 |    2 |
| 最新自增值=>                            |        31 |    2 |
+-----------------------------------------+-----------+------+
insert into table3_noorder(a) values(null),(25),(null),(30);
select txt,a incre_col,b from table3_noorder order by a;
+-----------------------------------------+-----------+------+
| txt                                     | incre_col | b    |
+-----------------------------------------+-----------+------+
| insert...on duplicate key update 语句   |         1 |    4 |
| table3_noorder noorder模式              |         2 |    3 |
| 最新自增值1=>                           |         3 |    3 |
| 不重复场合                              |        20 |    3 |
| table3_noorder noorder模式              |        25 |    3 |
| table3_noorder noorder模式              |        30 |    3 |
| 最新自增值1=>                           |   1000001 |    3 |
| table3_noorder noorder模式              |   1000002 |    3 |
| table3_noorder noorder模式              |   1000003 |    3 |
+-----------------------------------------+-----------+------+
###### auto_incre_3-1-2 ②DELETE操作
insert into table1_default(a,b) values(null,11),(null,11);
select txt,a incre_col,b from table1_default order by a;
+-----------------------------------------+-----------+------+
| txt                                     | incre_col | b    |
+-----------------------------------------+-----------+------+
| insert...on duplicate key update 语句   |         1 |    2 |
| table1_default 默认order模式            |         2 |    1 |
| table1_default 默认order模式            |         3 |    1 |
| table1_default 默认order模式            |         5 |    1 |
| 最新自增值=>                            |         6 |    1 |
| table0_date                             |        11 |    0 |
| table0_date                             |        12 |    0 |
| table0_date                             |        13 |    0 |
| 最新自增值=>                            |        14 |    1 |
| 最新自增值1=>                           |        15 |    1 |
| 不重复场合                              |        20 |    1 |
| 最新自增值2=>                           |        21 |    1 |
| table1_default 默认order模式            |        22 |    1 |
| table1_default 默认order模式            |        25 |    1 |
| table1_default 默认order模式            |        26 |    1 |
| table1_default 默认order模式            |        30 |    1 |
| 最新自增值1=>                           |        31 |    1 |
| table1_default 默认order模式            |        32 |   11 |
| table1_default 默认order模式            |        33 |   11 |
+-----------------------------------------+-----------+------+
delete from table1_default where b=11;
insert into table1_default(a,txt) values(0,'最新自增值=>');
select txt,a incre_col,b from table1_default order by a;
+-----------------------------------------+-----------+------+
| txt                                     | incre_col | b    |
+-----------------------------------------+-----------+------+
| insert...on duplicate key update 语句   |         1 |    2 |
| table1_default 默认order模式            |         2 |    1 |
| table1_default 默认order模式            |         3 |    1 |
| table1_default 默认order模式            |         5 |    1 |
| 最新自增值=>                            |         6 |    1 |
| table0_date                             |        11 |    0 |
| table0_date                             |        12 |    0 |
| table0_date                             |        13 |    0 |
| 最新自增值=>                            |        14 |    1 |
| 最新自增值1=>                           |        15 |    1 |
| 不重复场合                              |        20 |    1 |
| 最新自增值2=>                           |        21 |    1 |
| table1_default 默认order模式            |        22 |    1 |
| table1_default 默认order模式            |        25 |    1 |
| table1_default 默认order模式            |        26 |    1 |
| table1_default 默认order模式            |        30 |    1 |
| 最新自增值1=>                           |        31 |    1 |
| 最新自增值=>                            |        34 |    1 |
+-----------------------------------------+-----------+------+
insert into table2_order(a,b) values(null,22),(null,22);
select txt,a incre_col,b from table2_order order by a;
+-----------------------------------------+-----------+------+
| txt                                     | incre_col | b    |
+-----------------------------------------+-----------+------+
| insert...on duplicate key update 语句   |         1 |    3 |
| table2_order order模式                  |         2 |    2 |
| table2_order order模式                  |         3 |    2 |
| table2_order order模式                  |         4 |    2 |
| table2_order order模式                  |         5 |    2 |
| table2_order order模式                  |         6 |    2 |
| 1最新自增值=>                           |         7 |    2 |
| table0_date                             |        11 |    0 |
| table0_date                             |        12 |    0 |
| table0_date                             |        13 |    0 |
| 最新自增值=>                            |        14 |    2 |
| 最新自增值1=>                           |        15 |    2 |
| 不重复场合                              |        20 |    2 |
| 最新自增值2=>                           |        21 |    2 |
| table2_order order模式                  |        22 |    2 |
| table2_order order模式                  |        25 |    2 |
| table2_order order模式                  |        26 |    2 |
| table2_order order模式                  |        30 |    2 |
| 最新自增值=>                            |        31 |    2 |
| table2_order order模式                  |        32 |   22 |
| table2_order order模式                  |        33 |   22 |
+-----------------------------------------+-----------+------+
delete from table2_order where b=22;
insert into table2_order(a,txt) values(0,'最新自增值=>');
select txt,a incre_col,b from table2_order order by a;
+-----------------------------------------+-----------+------+
| txt                                     | incre_col | b    |
+-----------------------------------------+-----------+------+
| insert...on duplicate key update 语句   |         1 |    3 |
| table2_order order模式                  |         2 |    2 |
| table2_order order模式                  |         3 |    2 |
| table2_order order模式                  |         4 |    2 |
| table2_order order模式                  |         5 |    2 |
| table2_order order模式                  |         6 |    2 |
| 1最新自增值=>                           |         7 |    2 |
| table0_date                             |        11 |    0 |
| table0_date                             |        12 |    0 |
| table0_date                             |        13 |    0 |
| 最新自增值=>                            |        14 |    2 |
| 最新自增值1=>                           |        15 |    2 |
| 不重复场合                              |        20 |    2 |
| 最新自增值2=>                           |        21 |    2 |
| table2_order order模式                  |        22 |    2 |
| table2_order order模式                  |        25 |    2 |
| table2_order order模式                  |        26 |    2 |
| table2_order order模式                  |        30 |    2 |
| 最新自增值=>                            |        31 |    2 |
| 最新自增值=>                            |        34 |    2 |
+-----------------------------------------+-----------+------+
insert into table3_noorder(a,b) values(null,33),(null,33);
select txt,a incre_col,b from table3_noorder order by a;
+-----------------------------------------+-----------+------+
| txt                                     | incre_col | b    |
+-----------------------------------------+-----------+------+
| insert...on duplicate key update 语句   |         1 |    4 |
| table3_noorder noorder模式              |         2 |    3 |
| 最新自增值1=>                           |         3 |    3 |
| 不重复场合                              |        20 |    3 |
| table3_noorder noorder模式              |        25 |    3 |
| table3_noorder noorder模式              |        30 |    3 |
| 最新自增值1=>                           |   1000001 |    3 |
| table3_noorder noorder模式              |   1000002 |    3 |
| table3_noorder noorder模式              |   1000003 |    3 |
| table3_noorder noorder模式              |   1000006 |   33 |
| table3_noorder noorder模式              |   1000007 |   33 |
+-----------------------------------------+-----------+------+
delete from table3_noorder where b=33;
insert into table3_noorder(a,txt) values(0,'最新自增值=>');
select txt,a incre_col,b from table3_noorder order by a;
+-----------------------------------------+-----------+------+
| txt                                     | incre_col | b    |
+-----------------------------------------+-----------+------+
| insert...on duplicate key update 语句   |         1 |    4 |
| table3_noorder noorder模式              |         2 |    3 |
| 最新自增值1=>                           |         3 |    3 |
| 不重复场合                              |        20 |    3 |
| table3_noorder noorder模式              |        25 |    3 |
| table3_noorder noorder模式              |        30 |    3 |
| 最新自增值1=>                           |   1000001 |    3 |
| table3_noorder noorder模式              |   1000002 |    3 |
| table3_noorder noorder模式              |   1000003 |    3 |
| 最新自增值=>                            |   1000008 |    3 |
+-----------------------------------------+-----------+------+
###### auto_incre_3-1-3 ③UPDATE操作
# mysql 5.x update没有推高这个自增值，和我们现在是兼容的；8.x update会推高
##更新现有AUTO_INCREMENT列值
drop table table1_default;
create table table1_default (
  a int not null auto_increment primary key,
  b int default 1,
  txt varchar(64) default 'table1_default 默认order模式',
  unique index(a)
)partition by list(a)( 
 partition p0 values in (0,1,2,3,4,5,24,25,27,29),
 partition p1 values in (6,7,8,9,10,23,26,30,32),
 partition p2 values in (11,12,13,14,15,22,31,33),
 partition p3 values in (16,17,18,19,20,21,28,34));
insert into table1_default(a,b) values(null,111);
select txt,a incre_col,b from table1_default order by a;
+----------------------------------+-----------+------+
| txt                              | incre_col | b    |
+----------------------------------+-----------+------+
| table1_default 默认order模式     |         1 |  111 |
+----------------------------------+-----------+------+
update table1_default set a = 0,txt = '将AUTO_INCREMENT列值设置为小于/等于当前最大自增值的值' where b = 111;
insert into table1_default values(null,11,'1当前自增值=>');
select txt,a incre_col,b from table1_default order by a;
+--------------------------------------------------------------------------+-----------+------+
| txt                                                                      | incre_col | b    |
+--------------------------------------------------------------------------+-----------+------+
| 将AUTO_INCREMENT列值设置为小于/等于当前最大自增值的值                    |         0 |  111 |
| 1当前自增值=>                                                            |         2 |   11 |
+--------------------------------------------------------------------------+-----------+------+
update table1_default set a = 30 ,txt = '将AUTO_INCREMENT列值设置为大于当前最大自增值的值' where b = 111;
insert into table1_default values(null,11,'2当前自增值=>');
select txt,a incre_col,b from table1_default order by a;
+-------------------------------------------------------------------+-----------+------+
| txt                                                               | incre_col | b    |
+-------------------------------------------------------------------+-----------+------+
| 1当前自增值=>                                                     |         2 |   11 |
| 2当前自增值=>                                                     |         3 |   11 |
| 将AUTO_INCREMENT列值设置为大于当前最大自增值的值                  |        30 |  111 |
+-------------------------------------------------------------------+-----------+------+
drop table table2_order;
create table table2_order (
  a int not null auto_increment primary key,
  b int default 2,
  txt varchar(64) default 'table2_order order模式',
  unique index(a)
) auto_increment_mode = 'order' 
partition by list(a)( 
 partition p0 values in (0,1,2,3,4,5,24,25,27,29),
 partition p1 values in (6,7,8,9,10,23,26,30,32),
 partition p2 values in (11,12,13,14,15,22,31,33),
 partition p3 values in (16,17,18,19,20,21,28,34));
insert into table2_order(a,b) values(null,222);
select txt,a incre_col,b from table2_order order by a;
+--------------------------+-----------+------+
| txt                      | incre_col | b    |
+--------------------------+-----------+------+
| table2_order order模式   |         1 |  222 |
+--------------------------+-----------+------+
update table2_order set a = 0,txt = '将AUTO_INCREMENT列值设置为小于/等于当前最大自增值的值' where b = 222;
insert into table2_order values(null,22,'1当前自增值=>');
select txt,a incre_col,b from table2_order order by a;
+--------------------------------------------------------------------------+-----------+------+
| txt                                                                      | incre_col | b    |
+--------------------------------------------------------------------------+-----------+------+
| 将AUTO_INCREMENT列值设置为小于/等于当前最大自增值的值                    |         0 |  222 |
| 1当前自增值=>                                                            |         2 |   22 |
+--------------------------------------------------------------------------+-----------+------+
update table2_order set a = 30 ,txt = '将AUTO_INCREMENT列值设置为大于当前最大自增值的值' where b = 222;
insert into table2_order values(null,22,'2当前自增值=>');
select txt,a incre_col,b from table2_order order by a;
+-------------------------------------------------------------------+-----------+------+
| txt                                                               | incre_col | b    |
+-------------------------------------------------------------------+-----------+------+
| 1当前自增值=>                                                     |         2 |   22 |
| 2当前自增值=>                                                     |         3 |   22 |
| 将AUTO_INCREMENT列值设置为大于当前最大自增值的值                  |        30 |  222 |
+-------------------------------------------------------------------+-----------+------+
drop table table3_noorder;
create table table3_noorder (
  a int not null auto_increment primary key,
  b int default 3,
  txt varchar(64) default 'table3_noorder noorder模式',
  unique index(a)
) auto_increment_mode = 'noorder' 
partition by list(a)( 
 partition p0 values in (0,1,2,3,4,5,24,25,27,29),
 partition p1 values in (6,7,8,9,10,23,26,30,32),
 partition p2 values in (11,12,13,14,15,22,31,33),
 partition p3 values in (16,17,18,19,20,21,28,34),
 partition p4 values in (1000001,1000002,1000003,1000004,1000005,1000006),
 partition p5 values in (2000001,2000002,2000003,2000004,2000005,2000006));
delete from table3_noorder;
insert into table3_noorder(a,b) values(null,333);
select txt,a incre_col,b from table3_noorder order by a;
+------------------------------+-----------+------+
| txt                          | incre_col | b    |
+------------------------------+-----------+------+
| table3_noorder noorder模式   |         1 |  333 |
+------------------------------+-----------+------+
update table3_noorder set a = 0,txt = '将AUTO_INCREMENT列值设置为小于/等于当前最大自增值的值' where b = 333;
insert into table3_noorder values(null,33,'1当前自增值=>');
select txt,a incre_col,b from table3_noorder order by a;
+--------------------------------------------------------------------------+-----------+------+
| txt                                                                      | incre_col | b    |
+--------------------------------------------------------------------------+-----------+------+
| 将AUTO_INCREMENT列值设置为小于/等于当前最大自增值的值                    |         0 |  333 |
| 1当前自增值=>                                                            |         2 |   33 |
+--------------------------------------------------------------------------+-----------+------+
update table3_noorder set a = 30 ,txt = '将AUTO_INCREMENT列值设置为大于当前最大自增值的值' where b = 333;
insert into table3_noorder values(null,33,'2当前自增值=>');
select txt,a incre_col,b from table3_noorder order by a;
+-------------------------------------------------------------------+-----------+------+
| txt                                                               | incre_col | b    |
+-------------------------------------------------------------------+-----------+------+
| 1当前自增值=>                                                     |         2 |   33 |
| 2当前自增值=>                                                     |         3 |   33 |
| 将AUTO_INCREMENT列值设置为大于当前最大自增值的值                  |        30 |  333 |
+-------------------------------------------------------------------+-----------+------+
##更新其他列值时引用AUTO_INCREMENT列
insert into table1_default(a,b,txt) values(null,0,'update');
select txt,a incre_col,b from table1_default order by a;
+-------------------------------------------------------------------+-----------+------+
| txt                                                               | incre_col | b    |
+-------------------------------------------------------------------+-----------+------+
| 1当前自增值=>                                                     |         2 |   11 |
| 2当前自增值=>                                                     |         3 |   11 |
| update                                                            |         4 |    0 |
| 将AUTO_INCREMENT列值设置为大于当前最大自增值的值                  |        30 |  111 |
+-------------------------------------------------------------------+-----------+------+
update table1_default set b = a+1 where txt = 'update';
insert into table1_default values(null,11,'当前自增值==>');
select txt,a incre_col,b from table1_default order by a;
+-------------------------------------------------------------------+-----------+------+
| txt                                                               | incre_col | b    |
+-------------------------------------------------------------------+-----------+------+
| 1当前自增值=>                                                     |         2 |   11 |
| 2当前自增值=>                                                     |         3 |   11 |
| update                                                            |         4 |    5 |
| 当前自增值==>                                                     |         5 |   11 |
| 将AUTO_INCREMENT列值设置为大于当前最大自增值的值                  |        30 |  111 |
+-------------------------------------------------------------------+-----------+------+
insert into table2_order(a,b,txt) values(null,0,'update');
select txt,a incre_col,b from table2_order order by a;
+-------------------------------------------------------------------+-----------+------+
| txt                                                               | incre_col | b    |
+-------------------------------------------------------------------+-----------+------+
| 1当前自增值=>                                                     |         2 |   22 |
| 2当前自增值=>                                                     |         3 |   22 |
| update                                                            |         4 |    0 |
| 将AUTO_INCREMENT列值设置为大于当前最大自增值的值                  |        30 |  222 |
+-------------------------------------------------------------------+-----------+------+
update table2_order set b = a+2 where txt = 'update';
insert into table2_order values(null,22,'当前自增值==>');
select txt,a incre_col,b from table2_order order by a;
+-------------------------------------------------------------------+-----------+------+
| txt                                                               | incre_col | b    |
+-------------------------------------------------------------------+-----------+------+
| 1当前自增值=>                                                     |         2 |   22 |
| 2当前自增值=>                                                     |         3 |   22 |
| update                                                            |         4 |    6 |
| 当前自增值==>                                                     |         5 |   22 |
| 将AUTO_INCREMENT列值设置为大于当前最大自增值的值                  |        30 |  222 |
+-------------------------------------------------------------------+-----------+------+
insert into table3_noorder(a,b,txt) values(null,0,'update');
select txt,a incre_col,b from table3_noorder order by a;
+-------------------------------------------------------------------+-----------+------+
| txt                                                               | incre_col | b    |
+-------------------------------------------------------------------+-----------+------+
| 1当前自增值=>                                                     |         2 |   33 |
| 2当前自增值=>                                                     |         3 |   33 |
| update                                                            |         4 |    0 |
| 将AUTO_INCREMENT列值设置为大于当前最大自增值的值                  |        30 |  333 |
+-------------------------------------------------------------------+-----------+------+
update table3_noorder set b = a+3 where txt = 'update';
insert into table3_noorder values(null,33,'当前自增值==>');
select txt,a incre_col,b from table3_noorder order by a;
+-------------------------------------------------------------------+-----------+------+
| txt                                                               | incre_col | b    |
+-------------------------------------------------------------------+-----------+------+
| 1当前自增值=>                                                     |         2 |   33 |
| 2当前自增值=>                                                     |         3 |   33 |
| update                                                            |         4 |    7 |
| 当前自增值==>                                                     |         5 |   33 |
| 将AUTO_INCREMENT列值设置为大于当前最大自增值的值                  |        30 |  333 |
+-------------------------------------------------------------------+-----------+------+
###### auto_incre_3-1-4 ④SELECT操作
select a incre_col from table1_default order by a;
+-----------+
| incre_col |
+-----------+
|         2 |
|         3 |
|         4 |
|         5 |
|        30 |
+-----------+
select abs(a) from table1_default order by a;
+--------+
| abs(a) |
+--------+
|      2 |
|      3 |
|      4 |
|      5 |
|     30 |
+--------+
select a+b from table1_default order by a;
+------+
| a+b  |
+------+
|   13 |
|   14 |
|    9 |
|   16 |
|  141 |
+------+
select a incre_col from table2_order order by a;
+-----------+
| incre_col |
+-----------+
|         2 |
|         3 |
|         4 |
|         5 |
|        30 |
+-----------+
select abs(a) from table2_order order by a;
+--------+
| abs(a) |
+--------+
|      2 |
|      3 |
|      4 |
|      5 |
|     30 |
+--------+
select a+b from table2_order order by a;
+------+
| a+b  |
+------+
|   24 |
|   25 |
|   10 |
|   27 |
|  252 |
+------+
select a incre_col from table3_noorder order by a;
+-----------+
| incre_col |
+-----------+
|         2 |
|         3 |
|         4 |
|         5 |
|        30 |
+-----------+
select abs(a) from table3_noorder order by a;
+--------+
| abs(a) |
+--------+
|      2 |
|      3 |
|      4 |
|      5 |
|     30 |
+--------+
select a+b from table3_noorder order by a;
+------+
| a+b  |
+------+
|   35 |
|   36 |
|   11 |
|   38 |
|  363 |
+------+
############ auto_incre_2-4 ④模式切换 ############
##建表
drop table table2_order;
create table table2_order (
  a int auto_increment,
  b int default 2,
  txt varchar(64) default 'table2_order'
) auto_increment_mode = 'order'
 partition by list(a)( 
 partition p0 values in (0,1,2,3,4,5,24,25,27,29),
 partition p1 values in (6,7,8,9,10,23,26,30,32),
 partition p2 values in (11,12,13,14,15,22,31,33),
 partition p3 values in (16,17,18,19,20,21,28,34),
 partition p4 values in (1000001,1000002,1000003,1000004,1000005,1000006,1000007,1000008,1000009,1000010),
 partition p5 values in (1000011,1000012,1000013,1000014,2000001,2000002,2000003,2000004),
 partition p6 values in (2000005,2000006,2000007,2000008,3000001,3000002,3000003,3000004)
);
## ORDER==>ORDER
insert into table2_order(a) values(0),(0),(0),(0);
select txt,a incre_col, b from table2_order order by a;
+--------------+-----------+------+
| txt          | incre_col | b    |
+--------------+-----------+------+
| table2_order |         1 |    2 |
| table2_order |         2 |    2 |
| table2_order |         3 |    2 |
| table2_order |         4 |    2 |
+--------------+-----------+------+
insert into table2_order values(0,11,'update test1');
update table2_order set a = 0 where b = 11;
insert into table2_order values(null,0,'当前自增值1==>');
select txt,a incre_col, b from table2_order order by a;
+---------------------+-----------+------+
| txt                 | incre_col | b    |
+---------------------+-----------+------+
| update test1        |         0 |   11 |
| table2_order        |         1 |    2 |
| table2_order        |         2 |    2 |
| table2_order        |         3 |    2 |
| table2_order        |         4 |    2 |
| 当前自增值1==>      |         6 |    0 |
+---------------------+-----------+------+
alter table table2_order auto_increment_mode = 'ORDER';
insert into table2_order values(0,2,'ORDER==>ORDER'),(0,2,'ORDER==>ORDER'),(0,2,'ORDER==>ORDER'),(0,2,'ORDER==>ORDER');
select txt,a incre_col, b from table2_order order by a;
+---------------------+-----------+------+
| txt                 | incre_col | b    |
+---------------------+-----------+------+
| update test1        |         0 |   11 |
| table2_order        |         1 |    2 |
| table2_order        |         2 |    2 |
| table2_order        |         3 |    2 |
| table2_order        |         4 |    2 |
| 当前自增值1==>      |         6 |    0 |
| ORDER==>ORDER       |         7 |    2 |
| ORDER==>ORDER       |         8 |    2 |
| ORDER==>ORDER       |         9 |    2 |
| ORDER==>ORDER       |        10 |    2 |
+---------------------+-----------+------+
insert into table2_order values(0,22,'update test2');
update table2_order set a = 1 where b = 22;
insert into table2_order values(null,0,'当前自增值2==>');
select txt,a incre_col, b from table2_order order by a;
+---------------------+-----------+------+
| txt                 | incre_col | b    |
+---------------------+-----------+------+
| update test1        |         0 |   11 |
| table2_order        |         1 |    2 |
| update test2        |         1 |   22 |
| table2_order        |         2 |    2 |
| table2_order        |         3 |    2 |
| table2_order        |         4 |    2 |
| 当前自增值1==>      |         6 |    0 |
| ORDER==>ORDER       |         7 |    2 |
| ORDER==>ORDER       |         8 |    2 |
| ORDER==>ORDER       |         9 |    2 |
| ORDER==>ORDER       |        10 |    2 |
| 当前自增值2==>      |        12 |    0 |
+---------------------+-----------+------+
## ORDER==>NOORDER
alter table table2_order auto_increment_mode = 'NOORDER';
insert into table2_order values(0,3,'ORDER==>NOORDER'),(0,3,'ORDER==>NOORDER'),(0,3,'ORDER==>NOORDER'),(0,3,'ORDER==>NOORDER');
select txt,a incre_col, b from table2_order order by a;
+---------------------+-----------+------+
| txt                 | incre_col | b    |
+---------------------+-----------+------+
| update test1        |         0 |   11 |
| update test2        |         1 |   22 |
| table2_order        |         1 |    2 |
| table2_order        |         2 |    2 |
| table2_order        |         3 |    2 |
| table2_order        |         4 |    2 |
| 当前自增值1==>      |         6 |    0 |
| ORDER==>ORDER       |         7 |    2 |
| ORDER==>ORDER       |         8 |    2 |
| ORDER==>ORDER       |         9 |    2 |
| ORDER==>ORDER       |        10 |    2 |
| 当前自增值2==>      |        12 |    0 |
| ORDER==>NOORDER     |   1000001 |    3 |
| ORDER==>NOORDER     |   1000002 |    3 |
| ORDER==>NOORDER     |   1000003 |    3 |
| ORDER==>NOORDER     |   1000004 |    3 |
+---------------------+-----------+------+
insert into table2_order values(0,33,'update test3');
update table2_order set a = 15 where b = 33;
insert into table2_order values(null,0,'当前自增值3==>');
select txt,a incre_col, b from table2_order order by a;
+---------------------+-----------+------+
| txt                 | incre_col | b    |
+---------------------+-----------+------+
| update test1        |         0 |   11 |
| update test2        |         1 |   22 |
| table2_order        |         1 |    2 |
| table2_order        |         2 |    2 |
| table2_order        |         3 |    2 |
| table2_order        |         4 |    2 |
| 当前自增值1==>      |         6 |    0 |
| ORDER==>ORDER       |         7 |    2 |
| ORDER==>ORDER       |         8 |    2 |
| ORDER==>ORDER       |         9 |    2 |
| ORDER==>ORDER       |        10 |    2 |
| 当前自增值2==>      |        12 |    0 |
| update test3        |        15 |   33 |
| ORDER==>NOORDER     |   1000001 |    3 |
| ORDER==>NOORDER     |   1000002 |    3 |
| ORDER==>NOORDER     |   1000003 |    3 |
| ORDER==>NOORDER     |   1000004 |    3 |
| 当前自增值3==>      |   1000006 |    0 |
+---------------------+-----------+------+
## NOORDER==>NOORDER
alter table table2_order auto_increment_mode = 'NOORDER';
insert into table2_order values(0,4,'NOORDER==>NOORDER'),(0,4,'NOORDER==>NOORDER'),(0,4,'NOORDER==>NOORDER'),(0,4,'NOORDER==>NOORDER');
select txt,a incre_col, b from table2_order order by a;
+---------------------+-----------+------+
| txt                 | incre_col | b    |
+---------------------+-----------+------+
| update test1        |         0 |   11 |
| update test2        |         1 |   22 |
| table2_order        |         1 |    2 |
| table2_order        |         2 |    2 |
| table2_order        |         3 |    2 |
| table2_order        |         4 |    2 |
| 当前自增值1==>      |         6 |    0 |
| ORDER==>ORDER       |         7 |    2 |
| ORDER==>ORDER       |         8 |    2 |
| ORDER==>ORDER       |         9 |    2 |
| ORDER==>ORDER       |        10 |    2 |
| 当前自增值2==>      |        12 |    0 |
| update test3        |        15 |   33 |
| ORDER==>NOORDER     |   1000001 |    3 |
| ORDER==>NOORDER     |   1000002 |    3 |
| ORDER==>NOORDER     |   1000003 |    3 |
| ORDER==>NOORDER     |   1000004 |    3 |
| 当前自增值3==>      |   1000006 |    0 |
| NOORDER==>NOORDER   |   1000007 |    4 |
| NOORDER==>NOORDER   |   1000008 |    4 |
| NOORDER==>NOORDER   |   1000009 |    4 |
| NOORDER==>NOORDER   |   1000010 |    4 |
+---------------------+-----------+------+
insert into table2_order values(0,44,'update test4');
update table2_order set a = 3 where b = 44;
insert into table2_order values(null,0,'当前自增值4==>');
select txt,a incre_col, b from table2_order order by a;
+---------------------+-----------+------+
| txt                 | incre_col | b    |
+---------------------+-----------+------+
| update test1        |         0 |   11 |
| update test2        |         1 |   22 |
| table2_order        |         1 |    2 |
| table2_order        |         2 |    2 |
| table2_order        |         3 |    2 |
| update test4        |         3 |   44 |
| table2_order        |         4 |    2 |
| 当前自增值1==>      |         6 |    0 |
| ORDER==>ORDER       |         7 |    2 |
| ORDER==>ORDER       |         8 |    2 |
| ORDER==>ORDER       |         9 |    2 |
| ORDER==>ORDER       |        10 |    2 |
| 当前自增值2==>      |        12 |    0 |
| update test3        |        15 |   33 |
| ORDER==>NOORDER     |   1000001 |    3 |
| ORDER==>NOORDER     |   1000002 |    3 |
| ORDER==>NOORDER     |   1000003 |    3 |
| ORDER==>NOORDER     |   1000004 |    3 |
| 当前自增值3==>      |   1000006 |    0 |
| NOORDER==>NOORDER   |   1000007 |    4 |
| NOORDER==>NOORDER   |   1000008 |    4 |
| NOORDER==>NOORDER   |   1000009 |    4 |
| NOORDER==>NOORDER   |   1000010 |    4 |
| 当前自增值4==>      |   1000012 |    0 |
+---------------------+-----------+------+
## NOORDER==>ORDER
alter table table2_order auto_increment_mode = 'ORDER';
insert into table2_order values(0,5,'NOORDER==>ORDER'),(0,5,'NOORDER==>ORDER'),(0,5,'NOORDER==>ORDER'),(0,5,'NOORDER==>ORDER');
select txt,a incre_col, b from table2_order order by a;
+---------------------+-----------+------+
| txt                 | incre_col | b    |
+---------------------+-----------+------+
| update test1        |         0 |   11 |
| update test2        |         1 |   22 |
| table2_order        |         1 |    2 |
| table2_order        |         2 |    2 |
| table2_order        |         3 |    2 |
| update test4        |         3 |   44 |
| table2_order        |         4 |    2 |
| 当前自增值1==>      |         6 |    0 |
| ORDER==>ORDER       |         7 |    2 |
| ORDER==>ORDER       |         8 |    2 |
| ORDER==>ORDER       |         9 |    2 |
| ORDER==>ORDER       |        10 |    2 |
| 当前自增值2==>      |        12 |    0 |
| update test3        |        15 |   33 |
| ORDER==>NOORDER     |   1000001 |    3 |
| ORDER==>NOORDER     |   1000002 |    3 |
| ORDER==>NOORDER     |   1000003 |    3 |
| ORDER==>NOORDER     |   1000004 |    3 |
| 当前自增值3==>      |   1000006 |    0 |
| NOORDER==>NOORDER   |   1000007 |    4 |
| NOORDER==>NOORDER   |   1000008 |    4 |
| NOORDER==>NOORDER   |   1000009 |    4 |
| NOORDER==>NOORDER   |   1000010 |    4 |
| 当前自增值4==>      |   1000012 |    0 |
| NOORDER==>ORDER     |   2000001 |    5 |
| NOORDER==>ORDER     |   2000002 |    5 |
| NOORDER==>ORDER     |   2000003 |    5 |
| NOORDER==>ORDER     |   2000004 |    5 |
+---------------------+-----------+------+
insert into table2_order values(0,55,'NOORDER==>ORDER test5');
select txt,a incre_col, b from table2_order order by a;
+-----------------------+-----------+------+
| txt                   | incre_col | b    |
+-----------------------+-----------+------+
| update test1          |         0 |   11 |
| update test2          |         1 |   22 |
| table2_order          |         1 |    2 |
| table2_order          |         2 |    2 |
| table2_order          |         3 |    2 |
| update test4          |         3 |   44 |
| table2_order          |         4 |    2 |
| 当前自增值1==>        |         6 |    0 |
| ORDER==>ORDER         |         7 |    2 |
| ORDER==>ORDER         |         8 |    2 |
| ORDER==>ORDER         |         9 |    2 |
| ORDER==>ORDER         |        10 |    2 |
| 当前自增值2==>        |        12 |    0 |
| update test3          |        15 |   33 |
| ORDER==>NOORDER       |   1000001 |    3 |
| ORDER==>NOORDER       |   1000002 |    3 |
| ORDER==>NOORDER       |   1000003 |    3 |
| ORDER==>NOORDER       |   1000004 |    3 |
| 当前自增值3==>        |   1000006 |    0 |
| NOORDER==>NOORDER     |   1000007 |    4 |
| NOORDER==>NOORDER     |   1000008 |    4 |
| NOORDER==>NOORDER     |   1000009 |    4 |
| NOORDER==>NOORDER     |   1000010 |    4 |
| 当前自增值4==>        |   1000012 |    0 |
| NOORDER==>ORDER       |   2000001 |    5 |
| NOORDER==>ORDER       |   2000002 |    5 |
| NOORDER==>ORDER       |   2000003 |    5 |
| NOORDER==>ORDER       |   2000004 |    5 |
| NOORDER==>ORDER test5 |   2000005 |   55 |
+-----------------------+-----------+------+
update table2_order set a = 4 where b = 55;
insert into table2_order values(null,0,'当前自增值5==>');
select txt,a incre_col, b from table2_order order by a;
+-----------------------+-----------+------+
| txt                   | incre_col | b    |
+-----------------------+-----------+------+
| update test1          |         0 |   11 |
| update test2          |         1 |   22 |
| table2_order          |         1 |    2 |
| table2_order          |         2 |    2 |
| table2_order          |         3 |    2 |
| update test4          |         3 |   44 |
| table2_order          |         4 |    2 |
| NOORDER==>ORDER test5 |         4 |   55 |
| 当前自增值1==>        |         6 |    0 |
| ORDER==>ORDER         |         7 |    2 |
| ORDER==>ORDER         |         8 |    2 |
| ORDER==>ORDER         |         9 |    2 |
| ORDER==>ORDER         |        10 |    2 |
| 当前自增值2==>        |        12 |    0 |
| update test3          |        15 |   33 |
| ORDER==>NOORDER       |   1000001 |    3 |
| ORDER==>NOORDER       |   1000002 |    3 |
| ORDER==>NOORDER       |   1000003 |    3 |
| ORDER==>NOORDER       |   1000004 |    3 |
| 当前自增值3==>        |   1000006 |    0 |
| NOORDER==>NOORDER     |   1000007 |    4 |
| NOORDER==>NOORDER     |   1000008 |    4 |
| NOORDER==>NOORDER     |   1000009 |    4 |
| NOORDER==>NOORDER     |   1000010 |    4 |
| 当前自增值4==>        |   1000012 |    0 |
| NOORDER==>ORDER       |   2000001 |    5 |
| NOORDER==>ORDER       |   2000002 |    5 |
| NOORDER==>ORDER       |   2000003 |    5 |
| NOORDER==>ORDER       |   2000004 |    5 |
| 当前自增值5==>        |   2000006 |    0 |
+-----------------------+-----------+------+
############ hash分区
##建表
drop table table0_date;
create table table0_date (
  a int,
  b int default 0,
  txt varchar(64) default 'table0_date'
);
insert into table0_date(a) values(11),(12),(13),(16),(17),(18);
drop table table1_default;
create table table1_default (
  a int not null auto_increment primary key,
  b int default 1,
  txt varchar(64) default 'table1_default 默认order模式',
  unique index(a)
)partition by hash(a) partitions 4;
drop table table2_order;
create table table2_order (
  a int not null auto_increment primary key,
  b int default 2,
  txt varchar(64) default 'table2_order order模式',
  unique index(a)
) auto_increment_mode = 'order' 
partition by hash(a) partitions 4;
drop table table3_noorder;
create table table3_noorder (
  a int not null auto_increment primary key,
  b int default 3,
  txt varchar(64) default 'table3_noorder noorder模式',
  unique index(a)
) auto_increment_mode = 'noorder' 
partition by hash(a) partitions 4;
############ auto_incre_3-1 DML操作 ############
###### auto_incre_3-1-1 ①INSERT操作 
##简单插入
##INSERT 语句
##table1_default
insert into table1_default(a) values(null);
insert into table1_default(a) values(null),(null);
select txt,a incre_col,b from table1_default order by a;
+----------------------------------+-----------+------+
| txt                              | incre_col | b    |
+----------------------------------+-----------+------+
| table1_default 默认order模式     |         1 |    1 |
| table1_default 默认order模式     |         2 |    1 |
| table1_default 默认order模式     |         3 |    1 |
+----------------------------------+-----------+------+
insert into table1_default(a) values(5.5);
insert into table1_default(a,txt) values(0,'最新自增值1=>');
select txt,a incre_col,b from table1_default order by a;
+----------------------------------+-----------+------+
| txt                              | incre_col | b    |
+----------------------------------+-----------+------+
| table1_default 默认order模式     |         1 |    1 |
| table1_default 默认order模式     |         2 |    1 |
| table1_default 默认order模式     |         3 |    1 |
| table1_default 默认order模式     |         6 |    1 |
| 最新自增值1=>                    |         7 |    1 |
+----------------------------------+-----------+------+
insert into table1_default(a) values(-5);
insert into table1_default(a,txt) values(0,'最新自增值2=>');
select txt,a incre_col,b from table1_default order by a;
+----------------------------------+-----------+------+
| txt                              | incre_col | b    |
+----------------------------------+-----------+------+
| table1_default 默认order模式     |        -5 |    1 |
| table1_default 默认order模式     |         1 |    1 |
| table1_default 默认order模式     |         2 |    1 |
| table1_default 默认order模式     |         3 |    1 |
| table1_default 默认order模式     |         6 |    1 |
| 最新自增值1=>                    |         7 |    1 |
| 最新自增值2=>                    |         8 |    1 |
+----------------------------------+-----------+------+
##table2_order
insert into table2_order(a) values(null);
insert into table2_order(a) values(null),(null),(null),(null);
select txt,a incre_col,b from table2_order order by a;
+--------------------------+-----------+------+
| txt                      | incre_col | b    |
+--------------------------+-----------+------+
| table2_order order模式   |         1 |    2 |
| table2_order order模式   |         2 |    2 |
| table2_order order模式   |         3 |    2 |
| table2_order order模式   |         4 |    2 |
| table2_order order模式   |         5 |    2 |
+--------------------------+-----------+------+
insert into table2_order(a) values(5.5);
insert into table2_order(a,txt) values(0,'最新自增值=>');
select txt,a incre_col,b from table2_order order by a;
+--------------------------+-----------+------+
| txt                      | incre_col | b    |
+--------------------------+-----------+------+
| table2_order order模式   |         1 |    2 |
| table2_order order模式   |         2 |    2 |
| table2_order order模式   |         3 |    2 |
| table2_order order模式   |         4 |    2 |
| table2_order order模式   |         5 |    2 |
| table2_order order模式   |         6 |    2 |
| 最新自增值=>             |         7 |    2 |
+--------------------------+-----------+------+
insert into table2_order(a) values(-5);
insert into table2_order(a,txt) values(0,'最新自增值2=>');
select txt,a incre_col,b from table2_order order by a;
+--------------------------+-----------+------+
| txt                      | incre_col | b    |
+--------------------------+-----------+------+
| table2_order order模式   |        -5 |    2 |
| table2_order order模式   |         1 |    2 |
| table2_order order模式   |         2 |    2 |
| table2_order order模式   |         3 |    2 |
| table2_order order模式   |         4 |    2 |
| table2_order order模式   |         5 |    2 |
| table2_order order模式   |         6 |    2 |
| 最新自增值=>             |         7 |    2 |
| 最新自增值2=>            |         8 |    2 |
+--------------------------+-----------+------+
##table3_noorder
insert into table3_noorder(a) values(null);
insert into table3_noorder(a) values(null),(null),(null),(null);
select txt,a incre_col,b from table3_noorder order by a;
+------------------------------+-----------+------+
| txt                          | incre_col | b    |
+------------------------------+-----------+------+
| table3_noorder noorder模式   |         1 |    3 |
| table3_noorder noorder模式   |         2 |    3 |
| table3_noorder noorder模式   |         3 |    3 |
| table3_noorder noorder模式   |         4 |    3 |
| table3_noorder noorder模式   |         5 |    3 |
+------------------------------+-----------+------+
insert into table3_noorder(a) values(5.5);
insert into table3_noorder(a,txt) values(0,'最新自增值=>');
select txt,a incre_col,b from table3_noorder order by a;
+------------------------------+-----------+------+
| txt                          | incre_col | b    |
+------------------------------+-----------+------+
| table3_noorder noorder模式   |         1 |    3 |
| table3_noorder noorder模式   |         2 |    3 |
| table3_noorder noorder模式   |         3 |    3 |
| table3_noorder noorder模式   |         4 |    3 |
| table3_noorder noorder模式   |         5 |    3 |
| table3_noorder noorder模式   |         6 |    3 |
| 最新自增值=>                 |   1000001 |    3 |
+------------------------------+-----------+------+
insert into table3_noorder(a) values(-5);
insert into table3_noorder(a,txt) values(0,'最新自增值2=>');
select txt,a incre_col,b from table3_noorder order by a;
+------------------------------+-----------+------+
| txt                          | incre_col | b    |
+------------------------------+-----------+------+
| table3_noorder noorder模式   |        -5 |    3 |
| table3_noorder noorder模式   |         1 |    3 |
| table3_noorder noorder模式   |         2 |    3 |
| table3_noorder noorder模式   |         3 |    3 |
| table3_noorder noorder模式   |         4 |    3 |
| table3_noorder noorder模式   |         5 |    3 |
| table3_noorder noorder模式   |         6 |    3 |
| 最新自增值=>                 |   1000001 |    3 |
| 最新自增值2=>                |   1000002 |    3 |
+------------------------------+-----------+------+
##批量插入
##INSERT ... SELECT语句
insert into table1_default select a,b,txt from table0_date where a <= 15;
select txt,a incre_col,b from table1_default order by a;
+----------------------------------+-----------+------+
| txt                              | incre_col | b    |
+----------------------------------+-----------+------+
| table1_default 默认order模式     |        -5 |    1 |
| table1_default 默认order模式     |         1 |    1 |
| table1_default 默认order模式     |         2 |    1 |
| table1_default 默认order模式     |         3 |    1 |
| table1_default 默认order模式     |         6 |    1 |
| 最新自增值1=>                    |         7 |    1 |
| 最新自增值2=>                    |         8 |    1 |
| table0_date                      |        11 |    0 |
| table0_date                      |        12 |    0 |
| table0_date                      |        13 |    0 |
+----------------------------------+-----------+------+
insert into table1_default(a,txt) values(0,'最新自增值=>');
select txt,a incre_col,b from table1_default order by a;
+----------------------------------+-----------+------+
| txt                              | incre_col | b    |
+----------------------------------+-----------+------+
| table1_default 默认order模式     |        -5 |    1 |
| table1_default 默认order模式     |         1 |    1 |
| table1_default 默认order模式     |         2 |    1 |
| table1_default 默认order模式     |         3 |    1 |
| table1_default 默认order模式     |         6 |    1 |
| 最新自增值1=>                    |         7 |    1 |
| 最新自增值2=>                    |         8 |    1 |
| table0_date                      |        11 |    0 |
| table0_date                      |        12 |    0 |
| table0_date                      |        13 |    0 |
| 最新自增值=>                     |        14 |    1 |
+----------------------------------+-----------+------+
insert into table2_order select a,b,txt from table0_date where a <= 15;
select txt,a incre_col,b from table2_order order by a;
+--------------------------+-----------+------+
| txt                      | incre_col | b    |
+--------------------------+-----------+------+
| table2_order order模式   |        -5 |    2 |
| table2_order order模式   |         1 |    2 |
| table2_order order模式   |         2 |    2 |
| table2_order order模式   |         3 |    2 |
| table2_order order模式   |         4 |    2 |
| table2_order order模式   |         5 |    2 |
| table2_order order模式   |         6 |    2 |
| 最新自增值=>             |         7 |    2 |
| 最新自增值2=>            |         8 |    2 |
| table0_date              |        11 |    0 |
| table0_date              |        12 |    0 |
| table0_date              |        13 |    0 |
+--------------------------+-----------+------+
insert into table2_order(a,txt) values(0,'最新自增值=>');
select txt,a incre_col,b from table2_order order by a;
+--------------------------+-----------+------+
| txt                      | incre_col | b    |
+--------------------------+-----------+------+
| table2_order order模式   |        -5 |    2 |
| table2_order order模式   |         1 |    2 |
| table2_order order模式   |         2 |    2 |
| table2_order order模式   |         3 |    2 |
| table2_order order模式   |         4 |    2 |
| table2_order order模式   |         5 |    2 |
| table2_order order模式   |         6 |    2 |
| 最新自增值=>             |         7 |    2 |
| 最新自增值2=>            |         8 |    2 |
| table0_date              |        11 |    0 |
| table0_date              |        12 |    0 |
| table0_date              |        13 |    0 |
| 最新自增值=>             |        14 |    2 |
+--------------------------+-----------+------+
insert into table3_noorder select a,b,txt from table0_date where a <= 15;
select txt,a incre_col,b from table3_noorder order by a;
+------------------------------+-----------+------+
| txt                          | incre_col | b    |
+------------------------------+-----------+------+
| table3_noorder noorder模式   |        -5 |    3 |
| table3_noorder noorder模式   |         1 |    3 |
| table3_noorder noorder模式   |         2 |    3 |
| table3_noorder noorder模式   |         3 |    3 |
| table3_noorder noorder模式   |         4 |    3 |
| table3_noorder noorder模式   |         5 |    3 |
| table3_noorder noorder模式   |         6 |    3 |
| table0_date                  |        11 |    0 |
| table0_date                  |        12 |    0 |
| table0_date                  |        13 |    0 |
| 最新自增值=>                 |   1000001 |    3 |
| 最新自增值2=>                |   1000002 |    3 |
+------------------------------+-----------+------+
insert into table3_noorder(a,txt) values(0,'最新自增值=>');
select txt,a incre_col,b from table3_noorder order by a;
+------------------------------+-----------+------+
| txt                          | incre_col | b    |
+------------------------------+-----------+------+
| table3_noorder noorder模式   |        -5 |    3 |
| table3_noorder noorder模式   |         1 |    3 |
| table3_noorder noorder模式   |         2 |    3 |
| table3_noorder noorder模式   |         3 |    3 |
| table3_noorder noorder模式   |         4 |    3 |
| table3_noorder noorder模式   |         5 |    3 |
| table3_noorder noorder模式   |         6 |    3 |
| table0_date                  |        11 |    0 |
| table0_date                  |        12 |    0 |
| table0_date                  |        13 |    0 |
| 最新自增值=>                 |   1000001 |    3 |
| 最新自增值2=>                |   1000002 |    3 |
| 最新自增值=>                 |   1000003 |    3 |
+------------------------------+-----------+------+
##混合插入
##INSERT ... ON DUPLICATE KEY UPDATE 语句
insert into table1_default (a,b,txt) values (1,1,'重复场合') on duplicate key update b=b+1,txt='insert...on duplicate key update 语句';
insert into table1_default(a,txt) values(0,'最新自增值1=>');
select txt,a incre_col,b from table1_default order by a;
+-----------------------------------------+-----------+------+
| txt                                     | incre_col | b    |
+-----------------------------------------+-----------+------+
| table1_default 默认order模式            |        -5 |    1 |
| insert...on duplicate key update 语句   |         1 |    2 |
| table1_default 默认order模式            |         2 |    1 |
| table1_default 默认order模式            |         3 |    1 |
| table1_default 默认order模式            |         6 |    1 |
| 最新自增值1=>                           |         7 |    1 |
| 最新自增值2=>                           |         8 |    1 |
| table0_date                             |        11 |    0 |
| table0_date                             |        12 |    0 |
| table0_date                             |        13 |    0 |
| 最新自增值=>                            |        14 |    1 |
| 最新自增值1=>                           |        15 |    1 |
+-----------------------------------------+-----------+------+
insert into table1_default (a,b,txt) values (20,1,'不重复场合') on duplicate key update b=b+1,txt='insert...on duplicate key update 语句';
insert into table1_default(a,txt) values(0,'最新自增值2=>');
select txt,a incre_col,b from table1_default order by a;
+-----------------------------------------+-----------+------+
| txt                                     | incre_col | b    |
+-----------------------------------------+-----------+------+
| table1_default 默认order模式            |        -5 |    1 |
| insert...on duplicate key update 语句   |         1 |    2 |
| table1_default 默认order模式            |         2 |    1 |
| table1_default 默认order模式            |         3 |    1 |
| table1_default 默认order模式            |         6 |    1 |
| 最新自增值1=>                           |         7 |    1 |
| 最新自增值2=>                           |         8 |    1 |
| table0_date                             |        11 |    0 |
| table0_date                             |        12 |    0 |
| table0_date                             |        13 |    0 |
| 最新自增值=>                            |        14 |    1 |
| 最新自增值1=>                           |        15 |    1 |
| 不重复场合                              |        20 |    1 |
| 最新自增值2=>                           |        21 |    1 |
+-----------------------------------------+-----------+------+
insert into table2_order (a,b,txt) values (1,2,'重复场合') on duplicate key update b=b+1,txt='insert...on duplicate key update 语句';
insert into table2_order(a,txt) values(0,'最新自增值1=>');
select txt,a incre_col,b from table2_order order by a;
+-----------------------------------------+-----------+------+
| txt                                     | incre_col | b    |
+-----------------------------------------+-----------+------+
| table2_order order模式                  |        -5 |    2 |
| insert...on duplicate key update 语句   |         1 |    3 |
| table2_order order模式                  |         2 |    2 |
| table2_order order模式                  |         3 |    2 |
| table2_order order模式                  |         4 |    2 |
| table2_order order模式                  |         5 |    2 |
| table2_order order模式                  |         6 |    2 |
| 最新自增值=>                            |         7 |    2 |
| 最新自增值2=>                           |         8 |    2 |
| table0_date                             |        11 |    0 |
| table0_date                             |        12 |    0 |
| table0_date                             |        13 |    0 |
| 最新自增值=>                            |        14 |    2 |
| 最新自增值1=>                           |        15 |    2 |
+-----------------------------------------+-----------+------+
insert into table2_order (a,b,txt) values (20,2,'不重复场合') on duplicate key update b=b+1,txt='insert...on duplicate key update 语句';
insert into table2_order(a,txt) values(0,'最新自增值2=>');
select txt,a incre_col,b from table2_order order by a;
+-----------------------------------------+-----------+------+
| txt                                     | incre_col | b    |
+-----------------------------------------+-----------+------+
| table2_order order模式                  |        -5 |    2 |
| insert...on duplicate key update 语句   |         1 |    3 |
| table2_order order模式                  |         2 |    2 |
| table2_order order模式                  |         3 |    2 |
| table2_order order模式                  |         4 |    2 |
| table2_order order模式                  |         5 |    2 |
| table2_order order模式                  |         6 |    2 |
| 最新自增值=>                            |         7 |    2 |
| 最新自增值2=>                           |         8 |    2 |
| table0_date                             |        11 |    0 |
| table0_date                             |        12 |    0 |
| table0_date                             |        13 |    0 |
| 最新自增值=>                            |        14 |    2 |
| 最新自增值1=>                           |        15 |    2 |
| 不重复场合                              |        20 |    2 |
| 最新自增值2=>                           |        21 |    2 |
+-----------------------------------------+-----------+------+
insert into table3_noorder (a,b,txt) values (1,3,'重复场合') on duplicate key update b=b+1,txt='insert...on duplicate key update 语句';
insert into table3_noorder(a,txt) values(0,'最新自增值1=>');
select txt,a incre_col,b from table3_noorder order by a;
+-----------------------------------------+-----------+------+
| txt                                     | incre_col | b    |
+-----------------------------------------+-----------+------+
| table3_noorder noorder模式              |        -5 |    3 |
| insert...on duplicate key update 语句   |         1 |    4 |
| table3_noorder noorder模式              |         2 |    3 |
| table3_noorder noorder模式              |         3 |    3 |
| table3_noorder noorder模式              |         4 |    3 |
| table3_noorder noorder模式              |         5 |    3 |
| table3_noorder noorder模式              |         6 |    3 |
| table0_date                             |        11 |    0 |
| table0_date                             |        12 |    0 |
| table0_date                             |        13 |    0 |
| 最新自增值=>                            |   1000001 |    3 |
| 最新自增值2=>                           |   1000002 |    3 |
| 最新自增值=>                            |   1000003 |    3 |
| 最新自增值1=>                           |   1000004 |    3 |
+-----------------------------------------+-----------+------+
insert into table3_noorder (a,b,txt) values (20,3,'不重复场合') on duplicate key update b=b+1,txt='insert...on duplicate key update 语句';
select txt,a incre_col,b from table3_noorder order by a;
+-----------------------------------------+-----------+------+
| txt                                     | incre_col | b    |
+-----------------------------------------+-----------+------+
| table3_noorder noorder模式              |        -5 |    3 |
| insert...on duplicate key update 语句   |         1 |    4 |
| table3_noorder noorder模式              |         2 |    3 |
| table3_noorder noorder模式              |         3 |    3 |
| table3_noorder noorder模式              |         4 |    3 |
| table3_noorder noorder模式              |         5 |    3 |
| table3_noorder noorder模式              |         6 |    3 |
| table0_date                             |        11 |    0 |
| table0_date                             |        12 |    0 |
| table0_date                             |        13 |    0 |
| 不重复场合                              |        20 |    3 |
| 最新自增值=>                            |   1000001 |    3 |
| 最新自增值2=>                           |   1000002 |    3 |
| 最新自增值=>                            |   1000003 |    3 |
| 最新自增值1=>                           |   1000004 |    3 |
+-----------------------------------------+-----------+------+
##将NULL和任何其他值混合插入 AUTO_INCREMENT列
##INSERT 语句
insert into table1_default(a) values(null),(25),(null),(30);
insert into table1_default(a,txt) values(0,'最新自增值1=>');
select txt,a incre_col,b from table1_default order by a;
+-----------------------------------------+-----------+------+
| txt                                     | incre_col | b    |
+-----------------------------------------+-----------+------+
| table1_default 默认order模式            |        -5 |    1 |
| insert...on duplicate key update 语句   |         1 |    2 |
| table1_default 默认order模式            |         2 |    1 |
| table1_default 默认order模式            |         3 |    1 |
| table1_default 默认order模式            |         6 |    1 |
| 最新自增值1=>                           |         7 |    1 |
| 最新自增值2=>                           |         8 |    1 |
| table0_date                             |        11 |    0 |
| table0_date                             |        12 |    0 |
| table0_date                             |        13 |    0 |
| 最新自增值=>                            |        14 |    1 |
| 最新自增值1=>                           |        15 |    1 |
| 不重复场合                              |        20 |    1 |
| 最新自增值2=>                           |        21 |    1 |
| table1_default 默认order模式            |        22 |    1 |
| table1_default 默认order模式            |        25 |    1 |
| table1_default 默认order模式            |        26 |    1 |
| table1_default 默认order模式            |        30 |    1 |
| 最新自增值1=>                           |        31 |    1 |
+-----------------------------------------+-----------+------+
insert into table2_order(a) values(null),(25),(null),(30);
insert into table2_order(a,txt) values(0,'最新自增值=>');
select txt,a incre_col,b from table2_order order by a;
+-----------------------------------------+-----------+------+
| txt                                     | incre_col | b    |
+-----------------------------------------+-----------+------+
| table2_order order模式                  |        -5 |    2 |
| insert...on duplicate key update 语句   |         1 |    3 |
| table2_order order模式                  |         2 |    2 |
| table2_order order模式                  |         3 |    2 |
| table2_order order模式                  |         4 |    2 |
| table2_order order模式                  |         5 |    2 |
| table2_order order模式                  |         6 |    2 |
| 最新自增值=>                            |         7 |    2 |
| 最新自增值2=>                           |         8 |    2 |
| table0_date                             |        11 |    0 |
| table0_date                             |        12 |    0 |
| table0_date                             |        13 |    0 |
| 最新自增值=>                            |        14 |    2 |
| 最新自增值1=>                           |        15 |    2 |
| 不重复场合                              |        20 |    2 |
| 最新自增值2=>                           |        21 |    2 |
| table2_order order模式                  |        22 |    2 |
| table2_order order模式                  |        25 |    2 |
| table2_order order模式                  |        26 |    2 |
| table2_order order模式                  |        30 |    2 |
| 最新自增值=>                            |        31 |    2 |
+-----------------------------------------+-----------+------+
delete from table3_noorder;
insert into table3_noorder(a) values(null),(25),(null),(30);
select txt,a incre_col,b from table3_noorder order by a;
+------------------------------+-----------+------+
| txt                          | incre_col | b    |
+------------------------------+-----------+------+
| table3_noorder noorder模式   |        25 |    3 |
| table3_noorder noorder模式   |        30 |    3 |
| table3_noorder noorder模式   |   1000005 |    3 |
| table3_noorder noorder模式   |   1000006 |    3 |
+------------------------------+-----------+------+
###### auto_incre_3-1-2 ②DELETE操作
insert into table1_default(a,b) values(null,11);
insert into table1_default(a,b) values(null,11);
select txt,a incre_col,b from table1_default order by a;
+-----------------------------------------+-----------+------+
| txt                                     | incre_col | b    |
+-----------------------------------------+-----------+------+
| table1_default 默认order模式            |        -5 |    1 |
| insert...on duplicate key update 语句   |         1 |    2 |
| table1_default 默认order模式            |         2 |    1 |
| table1_default 默认order模式            |         3 |    1 |
| table1_default 默认order模式            |         6 |    1 |
| 最新自增值1=>                           |         7 |    1 |
| 最新自增值2=>                           |         8 |    1 |
| table0_date                             |        11 |    0 |
| table0_date                             |        12 |    0 |
| table0_date                             |        13 |    0 |
| 最新自增值=>                            |        14 |    1 |
| 最新自增值1=>                           |        15 |    1 |
| 不重复场合                              |        20 |    1 |
| 最新自增值2=>                           |        21 |    1 |
| table1_default 默认order模式            |        22 |    1 |
| table1_default 默认order模式            |        25 |    1 |
| table1_default 默认order模式            |        26 |    1 |
| table1_default 默认order模式            |        30 |    1 |
| 最新自增值1=>                           |        31 |    1 |
| table1_default 默认order模式            |        32 |   11 |
| table1_default 默认order模式            |        33 |   11 |
+-----------------------------------------+-----------+------+
delete from table1_default where b=11;
insert into table1_default(a,txt) values(0,'最新自增值=>');
select txt,a incre_col,b from table1_default order by a;
+-----------------------------------------+-----------+------+
| txt                                     | incre_col | b    |
+-----------------------------------------+-----------+------+
| table1_default 默认order模式            |        -5 |    1 |
| insert...on duplicate key update 语句   |         1 |    2 |
| table1_default 默认order模式            |         2 |    1 |
| table1_default 默认order模式            |         3 |    1 |
| table1_default 默认order模式            |         6 |    1 |
| 最新自增值1=>                           |         7 |    1 |
| 最新自增值2=>                           |         8 |    1 |
| table0_date                             |        11 |    0 |
| table0_date                             |        12 |    0 |
| table0_date                             |        13 |    0 |
| 最新自增值=>                            |        14 |    1 |
| 最新自增值1=>                           |        15 |    1 |
| 不重复场合                              |        20 |    1 |
| 最新自增值2=>                           |        21 |    1 |
| table1_default 默认order模式            |        22 |    1 |
| table1_default 默认order模式            |        25 |    1 |
| table1_default 默认order模式            |        26 |    1 |
| table1_default 默认order模式            |        30 |    1 |
| 最新自增值1=>                           |        31 |    1 |
| 最新自增值=>                            |        34 |    1 |
+-----------------------------------------+-----------+------+
insert into table2_order(a,b) values(null,22);
insert into table2_order(a,b) values(null,22);
select txt,a incre_col,b from table2_order order by a;
+-----------------------------------------+-----------+------+
| txt                                     | incre_col | b    |
+-----------------------------------------+-----------+------+
| table2_order order模式                  |        -5 |    2 |
| insert...on duplicate key update 语句   |         1 |    3 |
| table2_order order模式                  |         2 |    2 |
| table2_order order模式                  |         3 |    2 |
| table2_order order模式                  |         4 |    2 |
| table2_order order模式                  |         5 |    2 |
| table2_order order模式                  |         6 |    2 |
| 最新自增值=>                            |         7 |    2 |
| 最新自增值2=>                           |         8 |    2 |
| table0_date                             |        11 |    0 |
| table0_date                             |        12 |    0 |
| table0_date                             |        13 |    0 |
| 最新自增值=>                            |        14 |    2 |
| 最新自增值1=>                           |        15 |    2 |
| 不重复场合                              |        20 |    2 |
| 最新自增值2=>                           |        21 |    2 |
| table2_order order模式                  |        22 |    2 |
| table2_order order模式                  |        25 |    2 |
| table2_order order模式                  |        26 |    2 |
| table2_order order模式                  |        30 |    2 |
| 最新自增值=>                            |        31 |    2 |
| table2_order order模式                  |        32 |   22 |
| table2_order order模式                  |        33 |   22 |
+-----------------------------------------+-----------+------+
delete from table2_order where b=22;
insert into table2_order(a,txt) values(0,'最新自增值=>');
select txt,a incre_col,b from table2_order order by a;
+-----------------------------------------+-----------+------+
| txt                                     | incre_col | b    |
+-----------------------------------------+-----------+------+
| table2_order order模式                  |        -5 |    2 |
| insert...on duplicate key update 语句   |         1 |    3 |
| table2_order order模式                  |         2 |    2 |
| table2_order order模式                  |         3 |    2 |
| table2_order order模式                  |         4 |    2 |
| table2_order order模式                  |         5 |    2 |
| table2_order order模式                  |         6 |    2 |
| 最新自增值=>                            |         7 |    2 |
| 最新自增值2=>                           |         8 |    2 |
| table0_date                             |        11 |    0 |
| table0_date                             |        12 |    0 |
| table0_date                             |        13 |    0 |
| 最新自增值=>                            |        14 |    2 |
| 最新自增值1=>                           |        15 |    2 |
| 不重复场合                              |        20 |    2 |
| 最新自增值2=>                           |        21 |    2 |
| table2_order order模式                  |        22 |    2 |
| table2_order order模式                  |        25 |    2 |
| table2_order order模式                  |        26 |    2 |
| table2_order order模式                  |        30 |    2 |
| 最新自增值=>                            |        31 |    2 |
| 最新自增值=>                            |        34 |    2 |
+-----------------------------------------+-----------+------+
insert into table3_noorder(a,b) values(null,33);
insert into table3_noorder(a,b) values(null,33);
select txt,a incre_col,b from table3_noorder order by a;
+------------------------------+-----------+------+
| txt                          | incre_col | b    |
+------------------------------+-----------+------+
| table3_noorder noorder模式   |        25 |    3 |
| table3_noorder noorder模式   |        30 |    3 |
| table3_noorder noorder模式   |   1000005 |    3 |
| table3_noorder noorder模式   |   1000006 |    3 |
| table3_noorder noorder模式   |   1000009 |   33 |
| table3_noorder noorder模式   |   1000010 |   33 |
+------------------------------+-----------+------+
delete from table3_noorder where b=33;
insert into table3_noorder(a,txt) values(0,'最新自增值=>');
select txt,a incre_col,b from table3_noorder order by a;
+------------------------------+-----------+------+
| txt                          | incre_col | b    |
+------------------------------+-----------+------+
| table3_noorder noorder模式   |        25 |    3 |
| table3_noorder noorder模式   |        30 |    3 |
| table3_noorder noorder模式   |   1000005 |    3 |
| table3_noorder noorder模式   |   1000006 |    3 |
| 最新自增值=>                 |   1000011 |    3 |
+------------------------------+-----------+------+
###### auto_incre_3-1-3 ③UPDATE操作
# mysql 5.x update没有推高这个自增值，和我们现在是兼容的；8.x update会推高
##更新现有AUTO_INCREMENT列值
drop table table1_default;
create table table1_default (
  a int not null auto_increment primary key,
  b int default 1,
  txt varchar(64) default 'table1_default 默认order模式',
  unique index(a)
)partition by hash(a) partitions 4;
insert into table1_default(a,b) values(null,111);
select txt,a incre_col,b from table1_default order by a;
+----------------------------------+-----------+------+
| txt                              | incre_col | b    |
+----------------------------------+-----------+------+
| table1_default 默认order模式     |         1 |  111 |
+----------------------------------+-----------+------+
update table1_default set a = 0,txt = '将AUTO_INCREMENT列值设置为小于/等于当前最大自增值的值' where b = 111;
insert into table1_default values(null,11,'1当前自增值=>');
select txt,a incre_col,b from table1_default order by a;
+--------------------------------------------------------------------------+-----------+------+
| txt                                                                      | incre_col | b    |
+--------------------------------------------------------------------------+-----------+------+
| 将AUTO_INCREMENT列值设置为小于/等于当前最大自增值的值                    |         0 |  111 |
| 1当前自增值=>                                                            |         2 |   11 |
+--------------------------------------------------------------------------+-----------+------+
update table1_default set a = 30 ,txt = '将AUTO_INCREMENT列值设置为大于当前最大自增值的值' where b = 111;
insert into table1_default values(null,11,'2当前自增值=>');
select txt,a incre_col,b from table1_default order by a;
+-------------------------------------------------------------------+-----------+------+
| txt                                                               | incre_col | b    |
+-------------------------------------------------------------------+-----------+------+
| 1当前自增值=>                                                     |         2 |   11 |
| 2当前自增值=>                                                     |         3 |   11 |
| 将AUTO_INCREMENT列值设置为大于当前最大自增值的值                  |        30 |  111 |
+-------------------------------------------------------------------+-----------+------+
drop table table2_order;
create table table2_order (
  a int not null auto_increment primary key,
  b int default 2,
  txt varchar(64) default 'table2_order order模式',
  unique index(a)
) auto_increment_mode = 'order' 
partition by hash(a) partitions 4;
insert into table2_order(a,b) values(null,222);
select txt,a incre_col,b from table2_order order by a;
+--------------------------+-----------+------+
| txt                      | incre_col | b    |
+--------------------------+-----------+------+
| table2_order order模式   |         1 |  222 |
+--------------------------+-----------+------+
update table2_order set a = 0,txt = '将AUTO_INCREMENT列值设置为小于/等于当前最大自增值的值' where b = 222;
insert into table2_order values(null,22,'1当前自增值=>');
select txt,a incre_col,b from table2_order order by a;
+--------------------------------------------------------------------------+-----------+------+
| txt                                                                      | incre_col | b    |
+--------------------------------------------------------------------------+-----------+------+
| 将AUTO_INCREMENT列值设置为小于/等于当前最大自增值的值                    |         0 |  222 |
| 1当前自增值=>                                                            |         2 |   22 |
+--------------------------------------------------------------------------+-----------+------+
update table2_order set a = 30 ,txt = '将AUTO_INCREMENT列值设置为大于当前最大自增值的值' where b = 222;
insert into table2_order values(null,22,'2当前自增值=>');
select txt,a incre_col,b from table2_order order by a;
+-------------------------------------------------------------------+-----------+------+
| txt                                                               | incre_col | b    |
+-------------------------------------------------------------------+-----------+------+
| 1当前自增值=>                                                     |         2 |   22 |
| 2当前自增值=>                                                     |         3 |   22 |
| 将AUTO_INCREMENT列值设置为大于当前最大自增值的值                  |        30 |  222 |
+-------------------------------------------------------------------+-----------+------+
insert into table3_noorder(a,b) values(null,333);
select txt,a incre_col,b from table3_noorder order by a;
+------------------------------+-----------+------+
| txt                          | incre_col | b    |
+------------------------------+-----------+------+
| table3_noorder noorder模式   |        25 |    3 |
| table3_noorder noorder模式   |        30 |    3 |
| table3_noorder noorder模式   |   1000005 |    3 |
| table3_noorder noorder模式   |   1000006 |    3 |
| 最新自增值=>                 |   1000011 |    3 |
| table3_noorder noorder模式   |   1000012 |  333 |
+------------------------------+-----------+------+
update table3_noorder set a = 0,txt = '将AUTO_INCREMENT列值设置为小于/等于当前最大自增值的值' where b = 333;
insert into table3_noorder values(null,33,'1当前自增值=>');
select txt,a incre_col,b from table3_noorder order by a;
+--------------------------------------------------------------------------+-----------+------+
| txt                                                                      | incre_col | b    |
+--------------------------------------------------------------------------+-----------+------+
| 将AUTO_INCREMENT列值设置为小于/等于当前最大自增值的值                    |         0 |  333 |
| table3_noorder noorder模式                                               |        25 |    3 |
| table3_noorder noorder模式                                               |        30 |    3 |
| table3_noorder noorder模式                                               |   1000005 |    3 |
| table3_noorder noorder模式                                               |   1000006 |    3 |
| 最新自增值=>                                                             |   1000011 |    3 |
| 1当前自增值=>                                                            |   1000013 |   33 |
+--------------------------------------------------------------------------+-----------+------+
update table3_noorder set a = 1000050 ,txt = '将AUTO_INCREMENT列值设置为大于当前最大自增值的值' where b = 333;
insert into table3_noorder values(null,33,'2当前自增值=>');
select txt,a incre_col,b from table3_noorder order by a;
+-------------------------------------------------------------------+-----------+------+
| txt                                                               | incre_col | b    |
+-------------------------------------------------------------------+-----------+------+
| table3_noorder noorder模式                                        |        25 |    3 |
| table3_noorder noorder模式                                        |        30 |    3 |
| table3_noorder noorder模式                                        |   1000005 |    3 |
| table3_noorder noorder模式                                        |   1000006 |    3 |
| 最新自增值=>                                                      |   1000011 |    3 |
| 1当前自增值=>                                                     |   1000013 |   33 |
| 2当前自增值=>                                                     |   1000014 |   33 |
| 将AUTO_INCREMENT列值设置为大于当前最大自增值的值                  |   1000050 |  333 |
+-------------------------------------------------------------------+-----------+------+
##更新其他列值时引用AUTO_INCREMENT列
insert into table1_default(a,b,txt) values(null,0,'update');
select txt,a incre_col,b from table1_default order by a;
+-------------------------------------------------------------------+-----------+------+
| txt                                                               | incre_col | b    |
+-------------------------------------------------------------------+-----------+------+
| 1当前自增值=>                                                     |         2 |   11 |
| 2当前自增值=>                                                     |         3 |   11 |
| update                                                            |         4 |    0 |
| 将AUTO_INCREMENT列值设置为大于当前最大自增值的值                  |        30 |  111 |
+-------------------------------------------------------------------+-----------+------+
update table1_default set b = a+1 where txt = 'update';
insert into table1_default values(null,11,'当前自增值==>');
select txt,a incre_col,b from table1_default order by a;
+-------------------------------------------------------------------+-----------+------+
| txt                                                               | incre_col | b    |
+-------------------------------------------------------------------+-----------+------+
| 1当前自增值=>                                                     |         2 |   11 |
| 2当前自增值=>                                                     |         3 |   11 |
| update                                                            |         4 |    5 |
| 当前自增值==>                                                     |         5 |   11 |
| 将AUTO_INCREMENT列值设置为大于当前最大自增值的值                  |        30 |  111 |
+-------------------------------------------------------------------+-----------+------+
insert into table2_order(a,b,txt) values(null,0,'update');
select txt,a incre_col,b from table2_order order by a;
+-------------------------------------------------------------------+-----------+------+
| txt                                                               | incre_col | b    |
+-------------------------------------------------------------------+-----------+------+
| 1当前自增值=>                                                     |         2 |   22 |
| 2当前自增值=>                                                     |         3 |   22 |
| update                                                            |         4 |    0 |
| 将AUTO_INCREMENT列值设置为大于当前最大自增值的值                  |        30 |  222 |
+-------------------------------------------------------------------+-----------+------+
update table2_order set b = a+2 where txt = 'update';
insert into table2_order values(null,22,'当前自增值==>');
select txt,a incre_col,b from table2_order order by a;
+-------------------------------------------------------------------+-----------+------+
| txt                                                               | incre_col | b    |
+-------------------------------------------------------------------+-----------+------+
| 1当前自增值=>                                                     |         2 |   22 |
| 2当前自增值=>                                                     |         3 |   22 |
| update                                                            |         4 |    6 |
| 当前自增值==>                                                     |         5 |   22 |
| 将AUTO_INCREMENT列值设置为大于当前最大自增值的值                  |        30 |  222 |
+-------------------------------------------------------------------+-----------+------+
insert into table3_noorder(a,b,txt) values(null,0,'update');
select txt,a incre_col,b from table3_noorder order by a;
+-------------------------------------------------------------------+-----------+------+
| txt                                                               | incre_col | b    |
+-------------------------------------------------------------------+-----------+------+
| table3_noorder noorder模式                                        |        25 |    3 |
| table3_noorder noorder模式                                        |        30 |    3 |
| table3_noorder noorder模式                                        |   1000005 |    3 |
| table3_noorder noorder模式                                        |   1000006 |    3 |
| 最新自增值=>                                                      |   1000011 |    3 |
| 1当前自增值=>                                                     |   1000013 |   33 |
| 2当前自增值=>                                                     |   1000014 |   33 |
| update                                                            |   1000015 |    0 |
| 将AUTO_INCREMENT列值设置为大于当前最大自增值的值                  |   1000050 |  333 |
+-------------------------------------------------------------------+-----------+------+
update table3_noorder set b = a+3 where txt = 'update';
insert into table3_noorder values(null,33,'当前自增值==>');
select txt,a incre_col,b from table3_noorder order by a;
+-------------------------------------------------------------------+-----------+---------+
| txt                                                               | incre_col | b       |
+-------------------------------------------------------------------+-----------+---------+
| table3_noorder noorder模式                                        |        25 |       3 |
| table3_noorder noorder模式                                        |        30 |       3 |
| table3_noorder noorder模式                                        |   1000005 |       3 |
| table3_noorder noorder模式                                        |   1000006 |       3 |
| 最新自增值=>                                                      |   1000011 |       3 |
| 1当前自增值=>                                                     |   1000013 |      33 |
| 2当前自增值=>                                                     |   1000014 |      33 |
| update                                                            |   1000015 | 1000018 |
| 当前自增值==>                                                     |   1000016 |      33 |
| 将AUTO_INCREMENT列值设置为大于当前最大自增值的值                  |   1000050 |     333 |
+-------------------------------------------------------------------+-----------+---------+
###### auto_incre_3-1-4 ④SELECT操作
select a incre_col from table1_default order by a;
+-----------+
| incre_col |
+-----------+
|         2 |
|         3 |
|         4 |
|         5 |
|        30 |
+-----------+
select abs(a) from table1_default order by a;
+--------+
| abs(a) |
+--------+
|      2 |
|      3 |
|      4 |
|      5 |
|     30 |
+--------+
select a+b from table1_default order by a;
+------+
| a+b  |
+------+
|   13 |
|   14 |
|    9 |
|   16 |
|  141 |
+------+
select a incre_col from table2_order order by a;
+-----------+
| incre_col |
+-----------+
|         2 |
|         3 |
|         4 |
|         5 |
|        30 |
+-----------+
select abs(a) from table2_order order by a;
+--------+
| abs(a) |
+--------+
|      2 |
|      3 |
|      4 |
|      5 |
|     30 |
+--------+
select a+b from table2_order order by a;
+------+
| a+b  |
+------+
|   24 |
|   25 |
|   10 |
|   27 |
|  252 |
+------+
select a incre_col from table3_noorder order by a;
+-----------+
| incre_col |
+-----------+
|        25 |
|        30 |
|   1000005 |
|   1000006 |
|   1000011 |
|   1000013 |
|   1000014 |
|   1000015 |
|   1000016 |
|   1000050 |
+-----------+
select abs(a) from table3_noorder order by a;
+---------+
| abs(a)  |
+---------+
|      25 |
|      30 |
| 1000005 |
| 1000006 |
| 1000011 |
| 1000013 |
| 1000014 |
| 1000015 |
| 1000016 |
| 1000050 |
+---------+
select a+b from table3_noorder order by a;
+---------+
| a+b     |
+---------+
|      28 |
|      33 |
| 1000008 |
| 1000009 |
| 1000014 |
| 1000046 |
| 1000047 |
| 2000033 |
| 1000049 |
| 1000383 |
+---------+
############ auto_incre_2-4 ④模式切换 ############
##建表
drop table table2_order;
create table table2_order (
  a int not null auto_increment,
  b int default 2,
  txt varchar(64) default 'table2_order order模式',
  index(a)
) auto_increment_mode = 'order' 
partition by hash(a) partitions 4;
## ORDER==>ORDER
insert into table2_order(a) values(0),(0),(0),(0);
select txt,a incre_col, b from table2_order order by a;
+--------------------------+-----------+------+
| txt                      | incre_col | b    |
+--------------------------+-----------+------+
| table2_order order模式   |         1 |    2 |
| table2_order order模式   |         2 |    2 |
| table2_order order模式   |         3 |    2 |
| table2_order order模式   |         4 |    2 |
+--------------------------+-----------+------+
insert into table2_order values(0,11,'update test1');
update table2_order set a = 0 where b = 11;
insert into table2_order values(null,0,'当前自增值1==>');
select txt,a incre_col, b from table2_order order by a;
+--------------------------+-----------+------+
| txt                      | incre_col | b    |
+--------------------------+-----------+------+
| update test1             |         0 |   11 |
| table2_order order模式   |         1 |    2 |
| table2_order order模式   |         2 |    2 |
| table2_order order模式   |         3 |    2 |
| table2_order order模式   |         4 |    2 |
| 当前自增值1==>           |         6 |    0 |
+--------------------------+-----------+------+
alter table table2_order auto_increment_mode = 'ORDER';
insert into table2_order values(0,2,'ORDER==>ORDER'),(0,2,'ORDER==>ORDER'),(0,2,'ORDER==>ORDER'),(0,2,'ORDER==>ORDER');
select txt,a incre_col, b from table2_order order by a;
+--------------------------+-----------+------+
| txt                      | incre_col | b    |
+--------------------------+-----------+------+
| update test1             |         0 |   11 |
| table2_order order模式   |         1 |    2 |
| table2_order order模式   |         2 |    2 |
| table2_order order模式   |         3 |    2 |
| table2_order order模式   |         4 |    2 |
| 当前自增值1==>           |         6 |    0 |
| ORDER==>ORDER            |         7 |    2 |
| ORDER==>ORDER            |         8 |    2 |
| ORDER==>ORDER            |         9 |    2 |
| ORDER==>ORDER            |        10 |    2 |
+--------------------------+-----------+------+
insert into table2_order values(0,22,'update test2');
update table2_order set a = 1 where b = 22;
insert into table2_order values(null,0,'当前自增值2==>');
select txt,a incre_col, b from table2_order order by a;
+--------------------------+-----------+------+
| txt                      | incre_col | b    |
+--------------------------+-----------+------+
| update test1             |         0 |   11 |
| table2_order order模式   |         1 |    2 |
| update test2             |         1 |   22 |
| table2_order order模式   |         2 |    2 |
| table2_order order模式   |         3 |    2 |
| table2_order order模式   |         4 |    2 |
| 当前自增值1==>           |         6 |    0 |
| ORDER==>ORDER            |         7 |    2 |
| ORDER==>ORDER            |         8 |    2 |
| ORDER==>ORDER            |         9 |    2 |
| ORDER==>ORDER            |        10 |    2 |
| 当前自增值2==>           |        12 |    0 |
+--------------------------+-----------+------+
## ORDER==>NOORDER
alter table table2_order auto_increment_mode = 'NOORDER';
insert into table2_order values(0,3,'ORDER==>NOORDER'),(0,3,'ORDER==>NOORDER'),(0,3,'ORDER==>NOORDER'),(0,3,'ORDER==>NOORDER');
select txt,a incre_col, b from table2_order order by a;
+--------------------------+-----------+------+
| txt                      | incre_col | b    |
+--------------------------+-----------+------+
| update test1             |         0 |   11 |
| table2_order order模式   |         1 |    2 |
| update test2             |         1 |   22 |
| table2_order order模式   |         2 |    2 |
| table2_order order模式   |         3 |    2 |
| table2_order order模式   |         4 |    2 |
| 当前自增值1==>           |         6 |    0 |
| ORDER==>ORDER            |         7 |    2 |
| ORDER==>ORDER            |         8 |    2 |
| ORDER==>ORDER            |         9 |    2 |
| ORDER==>ORDER            |        10 |    2 |
| 当前自增值2==>           |        12 |    0 |
| ORDER==>NOORDER          |   1000001 |    3 |
| ORDER==>NOORDER          |   1000002 |    3 |
| ORDER==>NOORDER          |   1000003 |    3 |
| ORDER==>NOORDER          |   1000004 |    3 |
+--------------------------+-----------+------+
insert into table2_order values(0,33,'update test3');
update table2_order set a = 15 where b = 33;
insert into table2_order values(null,0,'当前自增值3==>');
select txt,a incre_col, b from table2_order order by a;
+--------------------------+-----------+------+
| txt                      | incre_col | b    |
+--------------------------+-----------+------+
| update test1             |         0 |   11 |
| table2_order order模式   |         1 |    2 |
| update test2             |         1 |   22 |
| table2_order order模式   |         2 |    2 |
| table2_order order模式   |         3 |    2 |
| table2_order order模式   |         4 |    2 |
| 当前自增值1==>           |         6 |    0 |
| ORDER==>ORDER            |         7 |    2 |
| ORDER==>ORDER            |         8 |    2 |
| ORDER==>ORDER            |         9 |    2 |
| ORDER==>ORDER            |        10 |    2 |
| 当前自增值2==>           |        12 |    0 |
| update test3             |        15 |   33 |
| ORDER==>NOORDER          |   1000001 |    3 |
| ORDER==>NOORDER          |   1000002 |    3 |
| ORDER==>NOORDER          |   1000003 |    3 |
| ORDER==>NOORDER          |   1000004 |    3 |
| 当前自增值3==>           |   1000006 |    0 |
+--------------------------+-----------+------+
## NOORDER==>NOORDER
alter table table2_order auto_increment_mode = 'NOORDER';
insert into table2_order values(0,4,'NOORDER==>NOORDER'),(0,4,'NOORDER==>NOORDER'),(0,4,'NOORDER==>NOORDER'),(0,4,'NOORDER==>NOORDER');
select txt,a incre_col, b from table2_order order by a;
+--------------------------+-----------+------+
| txt                      | incre_col | b    |
+--------------------------+-----------+------+
| update test1             |         0 |   11 |
| table2_order order模式   |         1 |    2 |
| update test2             |         1 |   22 |
| table2_order order模式   |         2 |    2 |
| table2_order order模式   |         3 |    2 |
| table2_order order模式   |         4 |    2 |
| 当前自增值1==>           |         6 |    0 |
| ORDER==>ORDER            |         7 |    2 |
| ORDER==>ORDER            |         8 |    2 |
| ORDER==>ORDER            |         9 |    2 |
| ORDER==>ORDER            |        10 |    2 |
| 当前自增值2==>           |        12 |    0 |
| update test3             |        15 |   33 |
| ORDER==>NOORDER          |   1000001 |    3 |
| ORDER==>NOORDER          |   1000002 |    3 |
| ORDER==>NOORDER          |   1000003 |    3 |
| ORDER==>NOORDER          |   1000004 |    3 |
| 当前自增值3==>           |   1000006 |    0 |
| NOORDER==>NOORDER        |   1000007 |    4 |
| NOORDER==>NOORDER        |   1000008 |    4 |
| NOORDER==>NOORDER        |   1000009 |    4 |
| NOORDER==>NOORDER        |   1000010 |    4 |
+--------------------------+-----------+------+
insert into table2_order values(0,44,'update test4');
update table2_order set a = 3 where b = 44;
insert into table2_order values(null,0,'当前自增值4==>');
select txt,a incre_col, b from table2_order order by a;
+--------------------------+-----------+------+
| txt                      | incre_col | b    |
+--------------------------+-----------+------+
| update test1             |         0 |   11 |
| table2_order order模式   |         1 |    2 |
| update test2             |         1 |   22 |
| table2_order order模式   |         2 |    2 |
| update test4             |         3 |   44 |
| table2_order order模式   |         3 |    2 |
| table2_order order模式   |         4 |    2 |
| 当前自增值1==>           |         6 |    0 |
| ORDER==>ORDER            |         7 |    2 |
| ORDER==>ORDER            |         8 |    2 |
| ORDER==>ORDER            |         9 |    2 |
| ORDER==>ORDER            |        10 |    2 |
| 当前自增值2==>           |        12 |    0 |
| update test3             |        15 |   33 |
| ORDER==>NOORDER          |   1000001 |    3 |
| ORDER==>NOORDER          |   1000002 |    3 |
| ORDER==>NOORDER          |   1000003 |    3 |
| ORDER==>NOORDER          |   1000004 |    3 |
| 当前自增值3==>           |   1000006 |    0 |
| NOORDER==>NOORDER        |   1000007 |    4 |
| NOORDER==>NOORDER        |   1000008 |    4 |
| NOORDER==>NOORDER        |   1000009 |    4 |
| NOORDER==>NOORDER        |   1000010 |    4 |
| 当前自增值4==>           |   1000012 |    0 |
+--------------------------+-----------+------+
## NOORDER==>ORDER
alter table table2_order auto_increment_mode = 'ORDER';
insert into table2_order values(0,5,'NOORDER==>ORDER'),(0,5,'NOORDER==>ORDER'),(0,5,'NOORDER==>ORDER'),(0,5,'NOORDER==>ORDER');
select txt,a incre_col, b from table2_order order by a;
+--------------------------+-----------+------+
| txt                      | incre_col | b    |
+--------------------------+-----------+------+
| update test1             |         0 |   11 |
| table2_order order模式   |         1 |    2 |
| update test2             |         1 |   22 |
| table2_order order模式   |         2 |    2 |
| table2_order order模式   |         3 |    2 |
| update test4             |         3 |   44 |
| table2_order order模式   |         4 |    2 |
| 当前自增值1==>           |         6 |    0 |
| ORDER==>ORDER            |         7 |    2 |
| ORDER==>ORDER            |         8 |    2 |
| ORDER==>ORDER            |         9 |    2 |
| ORDER==>ORDER            |        10 |    2 |
| 当前自增值2==>           |        12 |    0 |
| update test3             |        15 |   33 |
| ORDER==>NOORDER          |   1000001 |    3 |
| ORDER==>NOORDER          |   1000002 |    3 |
| ORDER==>NOORDER          |   1000003 |    3 |
| ORDER==>NOORDER          |   1000004 |    3 |
| 当前自增值3==>           |   1000006 |    0 |
| NOORDER==>NOORDER        |   1000007 |    4 |
| NOORDER==>NOORDER        |   1000008 |    4 |
| NOORDER==>NOORDER        |   1000009 |    4 |
| NOORDER==>NOORDER        |   1000010 |    4 |
| 当前自增值4==>           |   1000012 |    0 |
| NOORDER==>ORDER          |   2000001 |    5 |
| NOORDER==>ORDER          |   2000002 |    5 |
| NOORDER==>ORDER          |   2000003 |    5 |
| NOORDER==>ORDER          |   2000004 |    5 |
+--------------------------+-----------+------+
insert into table2_order values(0,55,'NOORDER==>ORDER test5');
select txt,a incre_col, b from table2_order order by a;
+--------------------------+-----------+------+
| txt                      | incre_col | b    |
+--------------------------+-----------+------+
| update test1             |         0 |   11 |
| table2_order order模式   |         1 |    2 |
| update test2             |         1 |   22 |
| table2_order order模式   |         2 |    2 |
| table2_order order模式   |         3 |    2 |
| update test4             |         3 |   44 |
| table2_order order模式   |         4 |    2 |
| 当前自增值1==>           |         6 |    0 |
| ORDER==>ORDER            |         7 |    2 |
| ORDER==>ORDER            |         8 |    2 |
| ORDER==>ORDER            |         9 |    2 |
| ORDER==>ORDER            |        10 |    2 |
| 当前自增值2==>           |        12 |    0 |
| update test3             |        15 |   33 |
| ORDER==>NOORDER          |   1000001 |    3 |
| ORDER==>NOORDER          |   1000002 |    3 |
| ORDER==>NOORDER          |   1000003 |    3 |
| ORDER==>NOORDER          |   1000004 |    3 |
| 当前自增值3==>           |   1000006 |    0 |
| NOORDER==>NOORDER        |   1000007 |    4 |
| NOORDER==>NOORDER        |   1000008 |    4 |
| NOORDER==>NOORDER        |   1000009 |    4 |
| NOORDER==>NOORDER        |   1000010 |    4 |
| 当前自增值4==>           |   1000012 |    0 |
| NOORDER==>ORDER          |   2000001 |    5 |
| NOORDER==>ORDER          |   2000002 |    5 |
| NOORDER==>ORDER          |   2000003 |    5 |
| NOORDER==>ORDER          |   2000004 |    5 |
| NOORDER==>ORDER test5    |   2000005 |   55 |
+--------------------------+-----------+------+
update table2_order set a = 4 where b = 55;
insert into table2_order values(null,0,'当前自增值5==>');
select txt,a incre_col, b from table2_order order by a;
+--------------------------+-----------+------+
| txt                      | incre_col | b    |
+--------------------------+-----------+------+
| update test1             |         0 |   11 |
| table2_order order模式   |         1 |    2 |
| update test2             |         1 |   22 |
| table2_order order模式   |         2 |    2 |
| table2_order order模式   |         3 |    2 |
| update test4             |         3 |   44 |
| table2_order order模式   |         4 |    2 |
| NOORDER==>ORDER test5    |         4 |   55 |
| 当前自增值1==>           |         6 |    0 |
| ORDER==>ORDER            |         7 |    2 |
| ORDER==>ORDER            |         8 |    2 |
| ORDER==>ORDER            |         9 |    2 |
| ORDER==>ORDER            |        10 |    2 |
| 当前自增值2==>           |        12 |    0 |
| update test3             |        15 |   33 |
| ORDER==>NOORDER          |   1000001 |    3 |
| ORDER==>NOORDER          |   1000002 |    3 |
| ORDER==>NOORDER          |   1000003 |    3 |
| ORDER==>NOORDER          |   1000004 |    3 |
| 当前自增值3==>           |   1000006 |    0 |
| NOORDER==>NOORDER        |   1000007 |    4 |
| NOORDER==>NOORDER        |   1000008 |    4 |
| NOORDER==>NOORDER        |   1000009 |    4 |
| NOORDER==>NOORDER        |   1000010 |    4 |
| 当前自增值4==>           |   1000012 |    0 |
| NOORDER==>ORDER          |   2000001 |    5 |
| NOORDER==>ORDER          |   2000002 |    5 |
| NOORDER==>ORDER          |   2000003 |    5 |
| NOORDER==>ORDER          |   2000004 |    5 |
| 当前自增值5==>           |   2000006 |    0 |
+--------------------------+-----------+------+
drop table table1_default;
drop table table2_order;
drop table table3_noorder;
drop table table0_date;
# Clean up users
drop user whh@'%';
drop database if exists whh ;
