result_format: 4
set ob_query_timeout = 100000000;

drop materialized view log on t1;
drop table if exists t1;
drop table if exists t2;
drop view if exists t1_v1;
drop view if exists t1_v2;
drop materialized view t1_rt_mv1;
drop materialized view t1_rt_mv2;
create table t1(c1 int primary key auto_increment, c2 int, c3 int, c4 int, c5 int);
create table t2(c1 int primary key auto_increment, c2 int, c3 int, c4 int, c5 int);
insert into t1(c2, c3, c4) values(1,1,1);
create materialized view log on t1 with primary key, rowid, sequence (c2, c3, c4) including new values;

create materialized view t1_rt_mv1
refresh fast on demand
enable on query computation
disable query rewrite
as
select a.c4 as group_col, count(*) cnt from t1 a, t1 b where a.c2 = b.c3 group by a.c4;

create or replace view t1_v1 
as
select a.c4 as group_col, count(*) cnt from t1 a, t1 b where a.c2 = b.c3 group by a.c4;

create or replace view res_com1
as
with mv as (select /*+materialize*/ * from t1_rt_mv1),
     v as (select /*+materialize*/ * from t1_v1)
select 2 * (select count(*) from (select * from v union select * from mv))
       -  (select count(*) from (select * from v union all select * from mv)) as expect_0
from dual;

create materialized view t1_rt_mv2
refresh fast on demand
enable on query computation
disable query rewrite
as
select a.c3 a_c3, b.c2 b_c2,
       count(*) cnt,
       count(e.c4) cnt_e_c4,
       sum(e.c4) sum_e_c4,
       count(c.c3) cnt_c_c3,
       sum(c.c3) sum_c_c3,
       avg(e.c4) avg_e_c4,
       sum(c.c3) * avg(e.c4) calc_1
from t1 a, t1 b, t1 c, t1 d, t1 e
where a.c2 = b.c3 and b.c2 = c.c4 and c.c2 = d.c3 and d.c4 = e.c2
group by a.c3, b.c2
;

create or replace view t1_v2 as
select a.c3 a_c3, b.c2 b_c2,
       count(*) cnt,
       count(e.c4) cnt_e_c4,
       sum(e.c4) sum_e_c4,
       count(c.c3) cnt_c_c3,
       sum(c.c3) sum_c_c3,
       avg(e.c4) avg_e_c4,
       sum(c.c3) * avg(e.c4) calc_1
from t1 a, t1 b, t1 c, t1 d, t1 e
where a.c2 = b.c3 and b.c2 = c.c4 and c.c2 = d.c3 and d.c4 = e.c2
group by a.c3, b.c2
;

create or replace view res_com2
as
with mv as (select /*+materialize*/ * from t1_rt_mv2),
     v as (select /*+materialize*/ * from t1_v2)
select 2 * (select count(*) from (select * from v union select * from mv))
       -  (select count(*) from (select * from v union all select * from mv)) as expect_0
from dual;

explain basic select * from t1_rt_mv1;
Query Plan
====================================================
|ID|OPERATOR                         |NAME         |
----------------------------------------------------
|0 |HASH GROUP BY                    |             |
|1 |└─SUBPLAN SCAN                   |INNER_RT_MV$$|
|2 |  └─UNION ALL                    |             |
|3 |    ├─TABLE FULL SCAN            |t1_rt_mv1    |
|4 |    ├─HASH GROUP BY              |             |
|5 |    │ └─HASH JOIN                |             |
|6 |    │   ├─SUBPLAN SCAN           |PRE_b        |
|7 |    │   │ └─UNION ALL            |             |
|8 |    │   │   ├─MERGE ANTI JOIN    |             |
|9 |    │   │   │ ├─TABLE FULL SCAN  |b            |
|10|    │   │   │ └─SUBPLAN SCAN     |VIEW2        |
|11|    │   │   │   └─TABLE FULL SCAN|mlog$_t1     |
|12|    │   │   └─SUBPLAN SCAN       |DLT_T$$      |
|13|    │   │     └─WINDOW FUNCTION  |             |
|14|    │   │       └─TABLE FULL SCAN|mlog$_t1     |
|15|    │   └─SUBPLAN SCAN           |DLT_a        |
|16|    │     └─TABLE FULL SCAN      |mlog$_t1     |
|17|    └─HASH GROUP BY              |             |
|18|      └─HASH JOIN                |             |
|19|        ├─SUBPLAN SCAN           |DLT_b        |
|20|        │ └─TABLE FULL SCAN      |mlog$_t1     |
|21|        └─TABLE FULL SCAN        |a            |
====================================================
Outputs & filters:
-------------------------------------
  0 - output([INNER_RT_MV$$.group_col], [cast(T_FUN_SUM(INNER_RT_MV$$.cnt), BIGINT(20, 0))]), filter([T_FUN_SUM(INNER_RT_MV$$.cnt) > cast(0, DECIMAL_INT(64,
       0))]), rowset=16
      group([INNER_RT_MV$$.group_col]), agg_func([T_FUN_SUM(INNER_RT_MV$$.cnt)])
  1 - output([INNER_RT_MV$$.group_col], [INNER_RT_MV$$.cnt]), filter(nil), rowset=16
      access([INNER_RT_MV$$.group_col], [INNER_RT_MV$$.cnt])
  2 - output([UNION([1])], [UNION([2])]), filter(nil), rowset=16
  3 - output([t1_rt_mv1.group_col], [cast(t1_rt_mv1.cnt, DECIMAL_INT(42, 0))]), filter(nil), rowset=16
      access([t1_rt_mv1.group_col], [t1_rt_mv1.cnt]), partitions(p0)
      is_index_back=false, is_global_index=false, 
      range_key([t1_rt_mv1.__pk_increment]), range(MIN ; MAX)always true
  4 - output([DLT_a.c4], [T_FUN_SUM(DLT_a.DMLFACTOR$$)]), filter(nil), rowset=16
      group([DLT_a.c4]), agg_func([T_FUN_SUM(DLT_a.DMLFACTOR$$)])
  5 - output([DLT_a.c4], [DLT_a.DMLFACTOR$$]), filter(nil), rowset=16
      equal_conds([DLT_a.c2 = PRE_b.c3]), other_conds(nil)
  6 - output([PRE_b.c3]), filter(nil), rowset=16
      access([PRE_b.c3])
  7 - output([UNION([1])]), filter(nil), rowset=16
  8 - output([b.c3]), filter(nil), rowset=16
      equal_conds([VIEW2.mlog$_t1.c1 = b.c1]), other_conds(nil)
      merge_directions([ASC])
  9 - output([b.c1], [b.c3]), filter(nil), rowset=16
      access([b.c1], [b.c3]), partitions(p0)
      is_index_back=false, is_global_index=false, 
      range_key([b.c1]), range(MIN ; MAX)always true
 10 - output([VIEW2.mlog$_t1.c1]), filter(nil), rowset=16
      access([VIEW2.mlog$_t1.c1])
 11 - output([mlog$_t1.c1]), filter([ORA_ROWSCN > last_refresh_scn(xxxxxx)]), rowset=16
      access([mlog$_t1.c1], [ORA_ROWSCN]), partitions(p0)
      is_index_back=false, is_global_index=false, filter_before_indexback[false], 
      range_key([mlog$_t1.c1], [mlog$_t1.SEQUENCE$$]), range(MIN,MIN ; MAX,MAX)always true
 12 - output([DLT_T$$.c3]), filter([DLT_T$$.OLD_NEW$$ = 'O'], [DLT_T$$.SEQUENCE$$ = DLT_T$$.MINSEQ$$]), rowset=16
      access([DLT_T$$.OLD_NEW$$], [DLT_T$$.SEQUENCE$$], [DLT_T$$.MINSEQ$$], [DLT_T$$.c3])
 13 - output([mlog$_t1.OLD_NEW$$], [mlog$_t1.SEQUENCE$$], [T_FUN_MIN(mlog$_t1.SEQUENCE$$)], [mlog$_t1.c3]), filter(nil), rowset=16
      win_expr(T_FUN_MIN(mlog$_t1.SEQUENCE$$)), partition_by([mlog$_t1.c1]), order_by(nil), window_type(RANGE), upper(UNBOUNDED PRECEDING), lower(UNBOUNDED 
      FOLLOWING)
 14 - output([mlog$_t1.c1], [mlog$_t1.SEQUENCE$$], [mlog$_t1.OLD_NEW$$], [mlog$_t1.c3], [ORA_ROWSCN]), filter([ORA_ROWSCN > last_refresh_scn(xxxxxx)]), rowset=16
      access([mlog$_t1.c1], [mlog$_t1.SEQUENCE$$], [mlog$_t1.OLD_NEW$$], [mlog$_t1.c3], [ORA_ROWSCN]), partitions(p0)
      is_index_back=false, is_global_index=false, filter_before_indexback[false], 
      range_key([mlog$_t1.c1], [mlog$_t1.SEQUENCE$$]), range(MIN,MIN ; MAX,MAX)always true
 15 - output([DLT_a.DMLFACTOR$$], [DLT_a.c2], [DLT_a.c4]), filter(nil), rowset=16
      access([DLT_a.DMLFACTOR$$], [DLT_a.c2], [DLT_a.c4])
 16 - output([CASE WHEN mlog$_t1.OLD_NEW$$ = 'N' THEN 1 ELSE -1 END], [mlog$_t1.c2], [mlog$_t1.c4]), filter([ORA_ROWSCN > last_refresh_scn(xxxxxx)]), rowset=16
      access([mlog$_t1.OLD_NEW$$], [mlog$_t1.c2], [mlog$_t1.c4], [ORA_ROWSCN]), partitions(p0)
      is_index_back=false, is_global_index=false, filter_before_indexback[false], 
      range_key([mlog$_t1.c1], [mlog$_t1.SEQUENCE$$]), range(MIN,MIN ; MAX,MAX)always true
 17 - output([a.c4], [T_FUN_SUM(DLT_b.DMLFACTOR$$)]), filter(nil), rowset=16
      group([a.c4]), agg_func([T_FUN_SUM(DLT_b.DMLFACTOR$$)])
 18 - output([a.c4], [DLT_b.DMLFACTOR$$]), filter(nil), rowset=16
      equal_conds([a.c2 = DLT_b.c3]), other_conds(nil)
 19 - output([DLT_b.DMLFACTOR$$], [DLT_b.c3]), filter(nil), rowset=16
      access([DLT_b.DMLFACTOR$$], [DLT_b.c3])
 20 - output([CASE WHEN mlog$_t1.OLD_NEW$$ = 'N' THEN 1 ELSE -1 END], [mlog$_t1.c3]), filter([ORA_ROWSCN > last_refresh_scn(xxxxxx)]), rowset=16
      access([mlog$_t1.OLD_NEW$$], [mlog$_t1.c3], [ORA_ROWSCN]), partitions(p0)
      is_index_back=false, is_global_index=false, filter_before_indexback[false], 
      range_key([mlog$_t1.c1], [mlog$_t1.SEQUENCE$$]), range(MIN,MIN ; MAX,MAX)always true
 21 - output([a.c2], [a.c4]), filter(nil), rowset=16
      access([a.c2], [a.c4]), partitions(p0)
      is_index_back=false, is_global_index=false, 
      range_key([a.c1]), range(MIN ; MAX)always true
explain basic select * from t1_rt_mv2;
Query Plan
===========================================================
|ID |OPERATOR                               |NAME         |
-----------------------------------------------------------
|0  |HASH GROUP BY                          |             |
|1  |└─SUBPLAN SCAN                         |INNER_RT_MV$$|
|2  |  └─UNION ALL                          |             |
|3  |    ├─TABLE FULL SCAN                  |t1_rt_mv2    |
|4  |    ├─HASH GROUP BY                    |             |
|5  |    │ └─HASH JOIN                      |             |
|6  |    │   ├─HASH JOIN                    |             |
|7  |    │   │ ├─HASH JOIN                  |             |
|8  |    │   │ │ ├─HASH JOIN                |             |
|9  |    │   │ │ │ ├─SUBPLAN SCAN           |PRE_d        |
|10 |    │   │ │ │ │ └─UNION ALL            |             |
|11 |    │   │ │ │ │   ├─MERGE ANTI JOIN    |             |
|12 |    │   │ │ │ │   │ ├─TABLE FULL SCAN  |d            |
|13 |    │   │ │ │ │   │ └─SUBPLAN SCAN     |VIEW4        |
|14 |    │   │ │ │ │   │   └─TABLE FULL SCAN|mlog$_t1     |
|15 |    │   │ │ │ │   └─SUBPLAN SCAN       |DLT_T$$      |
|16 |    │   │ │ │ │     └─WINDOW FUNCTION  |             |
|17 |    │   │ │ │ │       └─TABLE FULL SCAN|mlog$_t1     |
|18 |    │   │ │ │ └─SUBPLAN SCAN           |PRE_e        |
|19 |    │   │ │ │   └─UNION ALL            |             |
|20 |    │   │ │ │     ├─MERGE ANTI JOIN    |             |
|21 |    │   │ │ │     │ ├─TABLE FULL SCAN  |e            |
|22 |    │   │ │ │     │ └─SUBPLAN SCAN     |VIEW5        |
|23 |    │   │ │ │     │   └─TABLE FULL SCAN|mlog$_t1     |
|24 |    │   │ │ │     └─SUBPLAN SCAN       |DLT_T$$      |
|25 |    │   │ │ │       └─WINDOW FUNCTION  |             |
|26 |    │   │ │ │         └─TABLE FULL SCAN|mlog$_t1     |
|27 |    │   │ │ └─SUBPLAN SCAN             |PRE_c        |
|28 |    │   │ │   └─UNION ALL              |             |
|29 |    │   │ │     ├─MERGE ANTI JOIN      |             |
|30 |    │   │ │     │ ├─TABLE FULL SCAN    |c            |
|31 |    │   │ │     │ └─SUBPLAN SCAN       |VIEW3        |
|32 |    │   │ │     │   └─TABLE FULL SCAN  |mlog$_t1     |
|33 |    │   │ │     └─SUBPLAN SCAN         |DLT_T$$      |
|34 |    │   │ │       └─WINDOW FUNCTION    |             |
|35 |    │   │ │         └─TABLE FULL SCAN  |mlog$_t1     |
|36 |    │   │ └─SUBPLAN SCAN               |PRE_b        |
|37 |    │   │   └─UNION ALL                |             |
|38 |    │   │     ├─MERGE ANTI JOIN        |             |
|39 |    │   │     │ ├─TABLE FULL SCAN      |b            |
|40 |    │   │     │ └─SUBPLAN SCAN         |VIEW2        |
|41 |    │   │     │   └─TABLE FULL SCAN    |mlog$_t1     |
|42 |    │   │     └─SUBPLAN SCAN           |DLT_T$$      |
|43 |    │   │       └─WINDOW FUNCTION      |             |
|44 |    │   │         └─TABLE FULL SCAN    |mlog$_t1     |
|45 |    │   └─SUBPLAN SCAN                 |DLT_a        |
|46 |    │     └─TABLE FULL SCAN            |mlog$_t1     |
|47 |    ├─HASH GROUP BY                    |             |
|48 |    │ └─HASH JOIN                      |             |
|49 |    │   ├─HASH JOIN                    |             |
|50 |    │   │ ├─HASH JOIN                  |             |
|51 |    │   │ │ ├─HASH JOIN                |             |
|52 |    │   │ │ │ ├─SUBPLAN SCAN           |PRE_d        |
|53 |    │   │ │ │ │ └─UNION ALL            |             |
|54 |    │   │ │ │ │   ├─MERGE ANTI JOIN    |             |
|55 |    │   │ │ │ │   │ ├─TABLE FULL SCAN  |d            |
|56 |    │   │ │ │ │   │ └─SUBPLAN SCAN     |VIEW7        |
|57 |    │   │ │ │ │   │   └─TABLE FULL SCAN|mlog$_t1     |
|58 |    │   │ │ │ │   └─SUBPLAN SCAN       |DLT_T$$      |
|59 |    │   │ │ │ │     └─WINDOW FUNCTION  |             |
|60 |    │   │ │ │ │       └─TABLE FULL SCAN|mlog$_t1     |
|61 |    │   │ │ │ └─SUBPLAN SCAN           |PRE_e        |
|62 |    │   │ │ │   └─UNION ALL            |             |
|63 |    │   │ │ │     ├─MERGE ANTI JOIN    |             |
|64 |    │   │ │ │     │ ├─TABLE FULL SCAN  |e            |
|65 |    │   │ │ │     │ └─SUBPLAN SCAN     |VIEW8        |
|66 |    │   │ │ │     │   └─TABLE FULL SCAN|mlog$_t1     |
|67 |    │   │ │ │     └─SUBPLAN SCAN       |DLT_T$$      |
|68 |    │   │ │ │       └─WINDOW FUNCTION  |             |
|69 |    │   │ │ │         └─TABLE FULL SCAN|mlog$_t1     |
|70 |    │   │ │ └─SUBPLAN SCAN             |PRE_c        |
|71 |    │   │ │   └─UNION ALL              |             |
|72 |    │   │ │     ├─MERGE ANTI JOIN      |             |
|73 |    │   │ │     │ ├─TABLE FULL SCAN    |c            |
|74 |    │   │ │     │ └─SUBPLAN SCAN       |VIEW6        |
|75 |    │   │ │     │   └─TABLE FULL SCAN  |mlog$_t1     |
|76 |    │   │ │     └─SUBPLAN SCAN         |DLT_T$$      |
|77 |    │   │ │       └─WINDOW FUNCTION    |             |
|78 |    │   │ │         └─TABLE FULL SCAN  |mlog$_t1     |
|79 |    │   │ └─SUBPLAN SCAN               |DLT_b        |
|80 |    │   │   └─TABLE FULL SCAN          |mlog$_t1     |
|81 |    │   └─TABLE FULL SCAN              |a            |
|82 |    ├─HASH GROUP BY                    |             |
|83 |    │ └─HASH JOIN                      |             |
|84 |    │   ├─HASH JOIN                    |             |
|85 |    │   │ ├─HASH JOIN                  |             |
|86 |    │   │ │ ├─HASH JOIN                |             |
|87 |    │   │ │ │ ├─SUBPLAN SCAN           |PRE_d        |
|88 |    │   │ │ │ │ └─UNION ALL            |             |
|89 |    │   │ │ │ │   ├─MERGE ANTI JOIN    |             |
|90 |    │   │ │ │ │   │ ├─TABLE FULL SCAN  |d            |
|91 |    │   │ │ │ │   │ └─SUBPLAN SCAN     |VIEW9        |
|92 |    │   │ │ │ │   │   └─TABLE FULL SCAN|mlog$_t1     |
|93 |    │   │ │ │ │   └─SUBPLAN SCAN       |DLT_T$$      |
|94 |    │   │ │ │ │     └─WINDOW FUNCTION  |             |
|95 |    │   │ │ │ │       └─TABLE FULL SCAN|mlog$_t1     |
|96 |    │   │ │ │ └─SUBPLAN SCAN           |PRE_e        |
|97 |    │   │ │ │   └─UNION ALL            |             |
|98 |    │   │ │ │     ├─MERGE ANTI JOIN    |             |
|99 |    │   │ │ │     │ ├─TABLE FULL SCAN  |e            |
|100|    │   │ │ │     │ └─SUBPLAN SCAN     |VIEW10       |
|101|    │   │ │ │     │   └─TABLE FULL SCAN|mlog$_t1     |
|102|    │   │ │ │     └─SUBPLAN SCAN       |DLT_T$$      |
|103|    │   │ │ │       └─WINDOW FUNCTION  |             |
|104|    │   │ │ │         └─TABLE FULL SCAN|mlog$_t1     |
|105|    │   │ │ └─SUBPLAN SCAN             |DLT_c        |
|106|    │   │ │   └─TABLE FULL SCAN        |mlog$_t1     |
|107|    │   │ └─TABLE FULL SCAN            |b            |
|108|    │   └─TABLE FULL SCAN              |a            |
|109|    ├─HASH GROUP BY                    |             |
|110|    │ └─HASH JOIN                      |             |
|111|    │   ├─HASH JOIN                    |             |
|112|    │   │ ├─HASH JOIN                  |             |
|113|    │   │ │ ├─HASH JOIN                |             |
|114|    │   │ │ │ ├─SUBPLAN SCAN           |PRE_e        |
|115|    │   │ │ │ │ └─UNION ALL            |             |
|116|    │   │ │ │ │   ├─MERGE ANTI JOIN    |             |
|117|    │   │ │ │ │   │ ├─TABLE FULL SCAN  |e            |
|118|    │   │ │ │ │   │ └─SUBPLAN SCAN     |VIEW11       |
|119|    │   │ │ │ │   │   └─TABLE FULL SCAN|mlog$_t1     |
|120|    │   │ │ │ │   └─SUBPLAN SCAN       |DLT_T$$      |
|121|    │   │ │ │ │     └─WINDOW FUNCTION  |             |
|122|    │   │ │ │ │       └─TABLE FULL SCAN|mlog$_t1     |
|123|    │   │ │ │ └─SUBPLAN SCAN           |DLT_d        |
|124|    │   │ │ │   └─TABLE FULL SCAN      |mlog$_t1     |
|125|    │   │ │ └─TABLE FULL SCAN          |c            |
|126|    │   │ └─TABLE FULL SCAN            |b            |
|127|    │   └─TABLE FULL SCAN              |a            |
|128|    └─HASH GROUP BY                    |             |
|129|      └─HASH JOIN                      |             |
|130|        ├─HASH JOIN                    |             |
|131|        │ ├─HASH JOIN                  |             |
|132|        │ │ ├─HASH JOIN                |             |
|133|        │ │ │ ├─SUBPLAN SCAN           |DLT_e        |
|134|        │ │ │ │ └─TABLE FULL SCAN      |mlog$_t1     |
|135|        │ │ │ └─TABLE FULL SCAN        |d            |
|136|        │ │ └─TABLE FULL SCAN          |c            |
|137|        │ └─TABLE FULL SCAN            |b            |
|138|        └─TABLE FULL SCAN              |a            |
===========================================================
Outputs & filters:
-------------------------------------
  0 - output([INNER_RT_MV$$.a_c3], [INNER_RT_MV$$.b_c2], [cast(T_FUN_SUM(INNER_RT_MV$$.cnt), BIGINT(20, 0))], [cast(T_FUN_SUM(INNER_RT_MV$$.cnt_e_c4), BIGINT(20,
       0))], [cast(CASE WHEN T_FUN_SUM(INNER_RT_MV$$.cnt_e_c4) = cast(0, DECIMAL_INT(81, 0)) THEN NULL ELSE T_FUN_SUM(INNER_RT_MV$$.sum_e_c4) END, DECIMAL_INT(33,
       0))], [cast(T_FUN_SUM(INNER_RT_MV$$.cnt_c_c3), BIGINT(20, 0))], [cast(CASE WHEN T_FUN_SUM(INNER_RT_MV$$.cnt_c_c3) = cast(0, DECIMAL_INT(81, 0)) THEN NULL 
      ELSE T_FUN_SUM(INNER_RT_MV$$.sum_c_c3) END, DECIMAL_INT(33, 0))], [cast(cast(CASE WHEN T_FUN_SUM(INNER_RT_MV$$.cnt_e_c4) = cast(0, DECIMAL_INT(81, 0)) THEN 
      NULL ELSE T_FUN_SUM(INNER_RT_MV$$.sum_e_c4) END, DECIMAL(75, 0)) / cast(T_FUN_SUM(INNER_RT_MV$$.cnt_e_c4), DECIMAL(81, 0)), DECIMAL(15, 4))], [cast(cast(CASE 
      WHEN T_FUN_SUM(INNER_RT_MV$$.cnt_c_c3) = cast(0, DECIMAL_INT(81, 0)) THEN NULL ELSE T_FUN_SUM(INNER_RT_MV$$.sum_c_c3) END, DECIMAL(75, 0)) * cast(CASE WHEN 
      T_FUN_SUM(INNER_RT_MV$$.cnt_e_c4) = cast(0, DECIMAL_INT(81, 0)) THEN NULL ELSE T_FUN_SUM(INNER_RT_MV$$.sum_e_c4) END, DECIMAL(75, 0)) / cast(T_FUN_SUM(INNER_RT_MV$$.cnt_e_c4),
       DECIMAL(81, 0)), DECIMAL(48, 4))]), filter([T_FUN_SUM(INNER_RT_MV$$.cnt) > cast(0, DECIMAL_INT(64, 0))]), rowset=16
      group([INNER_RT_MV$$.a_c3], [INNER_RT_MV$$.b_c2]), agg_func([T_FUN_SUM(INNER_RT_MV$$.cnt)], [T_FUN_SUM(INNER_RT_MV$$.cnt_e_c4)], [T_FUN_SUM(INNER_RT_MV$$.sum_e_c4)],
       [T_FUN_SUM(INNER_RT_MV$$.cnt_c_c3)], [T_FUN_SUM(INNER_RT_MV$$.sum_c_c3)])
  1 - output([INNER_RT_MV$$.a_c3], [INNER_RT_MV$$.b_c2], [INNER_RT_MV$$.cnt], [INNER_RT_MV$$.cnt_e_c4], [INNER_RT_MV$$.sum_e_c4], [INNER_RT_MV$$.cnt_c_c3],
       [INNER_RT_MV$$.sum_c_c3]), filter(nil), rowset=16
      access([INNER_RT_MV$$.a_c3], [INNER_RT_MV$$.b_c2], [INNER_RT_MV$$.cnt], [INNER_RT_MV$$.cnt_e_c4], [INNER_RT_MV$$.sum_e_c4], [INNER_RT_MV$$.cnt_c_c3],
       [INNER_RT_MV$$.sum_c_c3])
  2 - output([UNION([1])], [UNION([2])], [UNION([3])], [UNION([4])], [UNION([5])], [UNION([6])], [UNION([7])]), filter(nil), rowset=16
  3 - output([t1_rt_mv2.a_c3], [t1_rt_mv2.b_c2], [cast(t1_rt_mv2.cnt, DECIMAL_INT(42, 0))], [cast(t1_rt_mv2.cnt_e_c4, DECIMAL_INT(62, 0))], [cast(t1_rt_mv2.sum_e_c4,
       DECIMAL_INT(53, 0))], [cast(t1_rt_mv2.cnt_c_c3, DECIMAL_INT(62, 0))], [cast(t1_rt_mv2.sum_c_c3, DECIMAL_INT(53, 0))]), filter(nil), rowset=16
      access([t1_rt_mv2.a_c3], [t1_rt_mv2.b_c2], [t1_rt_mv2.cnt], [t1_rt_mv2.cnt_e_c4], [t1_rt_mv2.sum_e_c4], [t1_rt_mv2.cnt_c_c3], [t1_rt_mv2.sum_c_c3]), partitions(p0)
      is_index_back=false, is_global_index=false, 
      range_key([t1_rt_mv2.__pk_increment]), range(MIN ; MAX)always true
  4 - output([DLT_a.c3], [PRE_b.c2], [T_FUN_SUM(DLT_a.DMLFACTOR$$)], [T_FUN_SUM(DLT_a.DMLFACTOR$$ * CASE WHEN PRE_e.c4 IS NULL THEN 0 ELSE 1 END)], [T_FUN_SUM(DLT_a.DMLFACTOR$$ 
      * PRE_e.c4)], [T_FUN_SUM(DLT_a.DMLFACTOR$$ * CASE WHEN PRE_c.c3 IS NULL THEN 0 ELSE 1 END)], [T_FUN_SUM(DLT_a.DMLFACTOR$$ * PRE_c.c3)]), filter(nil), rowset=16
      group([DLT_a.c3], [PRE_b.c2]), agg_func([T_FUN_SUM(DLT_a.DMLFACTOR$$)], [T_FUN_SUM(DLT_a.DMLFACTOR$$ * CASE WHEN PRE_e.c4 IS NULL THEN 0 ELSE 1 END)],
       [T_FUN_SUM(DLT_a.DMLFACTOR$$ * PRE_e.c4)], [T_FUN_SUM(DLT_a.DMLFACTOR$$ * CASE WHEN PRE_c.c3 IS NULL THEN 0 ELSE 1 END)], [T_FUN_SUM(DLT_a.DMLFACTOR$$ 
      * PRE_c.c3)])
  5 - output([DLT_a.c3], [PRE_b.c2], [DLT_a.DMLFACTOR$$], [PRE_e.c4], [PRE_c.c3]), filter(nil), rowset=16
      equal_conds([DLT_a.c2 = PRE_b.c3]), other_conds(nil)
  6 - output([PRE_b.c2], [PRE_e.c4], [PRE_c.c3], [PRE_b.c3]), filter(nil), rowset=16
      equal_conds([PRE_b.c2 = PRE_c.c4]), other_conds(nil)
  7 - output([PRE_e.c4], [PRE_c.c3], [PRE_c.c4]), filter(nil), rowset=16
      equal_conds([PRE_c.c2 = PRE_d.c3]), other_conds(nil)
  8 - output([PRE_e.c4], [PRE_d.c3]), filter(nil), rowset=16
      equal_conds([PRE_d.c4 = PRE_e.c2]), other_conds(nil)
  9 - output([PRE_d.c3], [PRE_d.c4]), filter(nil), rowset=16
      access([PRE_d.c3], [PRE_d.c4])
 10 - output([UNION([1])], [UNION([2])]), filter(nil), rowset=16
 11 - output([d.c3], [d.c4]), filter(nil), rowset=16
      equal_conds([VIEW4.mlog$_t1.c1 = d.c1]), other_conds(nil)
      merge_directions([ASC])
 12 - output([d.c1], [d.c3], [d.c4]), filter(nil), rowset=16
      access([d.c1], [d.c3], [d.c4]), partitions(p0)
      is_index_back=false, is_global_index=false, 
      range_key([d.c1]), range(MIN ; MAX)always true
 13 - output([VIEW4.mlog$_t1.c1]), filter(nil), rowset=16
      access([VIEW4.mlog$_t1.c1])
 14 - output([mlog$_t1.c1]), filter([ORA_ROWSCN > last_refresh_scn(xxxxxx)]), rowset=16
      access([mlog$_t1.c1], [ORA_ROWSCN]), partitions(p0)
      is_index_back=false, is_global_index=false, filter_before_indexback[false], 
      range_key([mlog$_t1.c1], [mlog$_t1.SEQUENCE$$]), range(MIN,MIN ; MAX,MAX)always true
 15 - output([DLT_T$$.c3], [DLT_T$$.c4]), filter([DLT_T$$.OLD_NEW$$ = 'O'], [DLT_T$$.SEQUENCE$$ = DLT_T$$.MINSEQ$$]), rowset=16
      access([DLT_T$$.OLD_NEW$$], [DLT_T$$.SEQUENCE$$], [DLT_T$$.MINSEQ$$], [DLT_T$$.c3], [DLT_T$$.c4])
 16 - output([mlog$_t1.OLD_NEW$$], [mlog$_t1.SEQUENCE$$], [T_FUN_MIN(mlog$_t1.SEQUENCE$$)], [mlog$_t1.c3], [mlog$_t1.c4]), filter(nil), rowset=16
      win_expr(T_FUN_MIN(mlog$_t1.SEQUENCE$$)), partition_by([mlog$_t1.c1]), order_by(nil), window_type(RANGE), upper(UNBOUNDED PRECEDING), lower(UNBOUNDED 
      FOLLOWING)
 17 - output([mlog$_t1.c1], [mlog$_t1.SEQUENCE$$], [mlog$_t1.OLD_NEW$$], [mlog$_t1.c3], [mlog$_t1.c4], [ORA_ROWSCN]), filter([ORA_ROWSCN > last_refresh_scn(xxxxxx)]), rowset=16
      access([mlog$_t1.c1], [mlog$_t1.SEQUENCE$$], [mlog$_t1.OLD_NEW$$], [mlog$_t1.c3], [mlog$_t1.c4], [ORA_ROWSCN]), partitions(p0)
      is_index_back=false, is_global_index=false, filter_before_indexback[false], 
      range_key([mlog$_t1.c1], [mlog$_t1.SEQUENCE$$]), range(MIN,MIN ; MAX,MAX)always true
 18 - output([PRE_e.c2], [PRE_e.c4]), filter(nil), rowset=16
      access([PRE_e.c2], [PRE_e.c4])
 19 - output([UNION([1])], [UNION([2])]), filter(nil), rowset=16
 20 - output([e.c2], [e.c4]), filter(nil), rowset=16
      equal_conds([VIEW5.mlog$_t1.c1 = e.c1]), other_conds(nil)
      merge_directions([ASC])
 21 - output([e.c1], [e.c2], [e.c4]), filter(nil), rowset=16
      access([e.c1], [e.c2], [e.c4]), partitions(p0)
      is_index_back=false, is_global_index=false, 
      range_key([e.c1]), range(MIN ; MAX)always true
 22 - output([VIEW5.mlog$_t1.c1]), filter(nil), rowset=16
      access([VIEW5.mlog$_t1.c1])
 23 - output([mlog$_t1.c1]), filter([ORA_ROWSCN > last_refresh_scn(xxxxxx)]), rowset=16
      access([mlog$_t1.c1], [ORA_ROWSCN]), partitions(p0)
      is_index_back=false, is_global_index=false, filter_before_indexback[false], 
      range_key([mlog$_t1.c1], [mlog$_t1.SEQUENCE$$]), range(MIN,MIN ; MAX,MAX)always true
 24 - output([DLT_T$$.c2], [DLT_T$$.c4]), filter([DLT_T$$.OLD_NEW$$ = 'O'], [DLT_T$$.SEQUENCE$$ = DLT_T$$.MINSEQ$$]), rowset=16
      access([DLT_T$$.OLD_NEW$$], [DLT_T$$.SEQUENCE$$], [DLT_T$$.MINSEQ$$], [DLT_T$$.c2], [DLT_T$$.c4])
 25 - output([mlog$_t1.OLD_NEW$$], [mlog$_t1.SEQUENCE$$], [T_FUN_MIN(mlog$_t1.SEQUENCE$$)], [mlog$_t1.c2], [mlog$_t1.c4]), filter(nil), rowset=16
      win_expr(T_FUN_MIN(mlog$_t1.SEQUENCE$$)), partition_by([mlog$_t1.c1]), order_by(nil), window_type(RANGE), upper(UNBOUNDED PRECEDING), lower(UNBOUNDED 
      FOLLOWING)
 26 - output([mlog$_t1.c1], [mlog$_t1.SEQUENCE$$], [mlog$_t1.OLD_NEW$$], [mlog$_t1.c2], [mlog$_t1.c4], [ORA_ROWSCN]), filter([ORA_ROWSCN > last_refresh_scn(xxxxxx)]), rowset=16
      access([mlog$_t1.c1], [mlog$_t1.SEQUENCE$$], [mlog$_t1.OLD_NEW$$], [mlog$_t1.c2], [mlog$_t1.c4], [ORA_ROWSCN]), partitions(p0)
      is_index_back=false, is_global_index=false, filter_before_indexback[false], 
      range_key([mlog$_t1.c1], [mlog$_t1.SEQUENCE$$]), range(MIN,MIN ; MAX,MAX)always true
 27 - output([PRE_c.c4], [PRE_c.c2], [PRE_c.c3]), filter(nil), rowset=16
      access([PRE_c.c4], [PRE_c.c2], [PRE_c.c3])
 28 - output([UNION([1])], [UNION([2])], [UNION([3])]), filter(nil), rowset=16
 29 - output([c.c4], [c.c2], [c.c3]), filter(nil), rowset=16
      equal_conds([VIEW3.mlog$_t1.c1 = c.c1]), other_conds(nil)
      merge_directions([ASC])
 30 - output([c.c1], [c.c4], [c.c2], [c.c3]), filter(nil), rowset=16
      access([c.c1], [c.c4], [c.c2], [c.c3]), partitions(p0)
      is_index_back=false, is_global_index=false, 
      range_key([c.c1]), range(MIN ; MAX)always true
 31 - output([VIEW3.mlog$_t1.c1]), filter(nil), rowset=16
      access([VIEW3.mlog$_t1.c1])
 32 - output([mlog$_t1.c1]), filter([ORA_ROWSCN > last_refresh_scn(xxxxxx)]), rowset=16
      access([mlog$_t1.c1], [ORA_ROWSCN]), partitions(p0)
      is_index_back=false, is_global_index=false, filter_before_indexback[false], 
      range_key([mlog$_t1.c1], [mlog$_t1.SEQUENCE$$]), range(MIN,MIN ; MAX,MAX)always true
 33 - output([DLT_T$$.c4], [DLT_T$$.c2], [DLT_T$$.c3]), filter([DLT_T$$.OLD_NEW$$ = 'O'], [DLT_T$$.SEQUENCE$$ = DLT_T$$.MINSEQ$$]), rowset=16
      access([DLT_T$$.OLD_NEW$$], [DLT_T$$.SEQUENCE$$], [DLT_T$$.MINSEQ$$], [DLT_T$$.c4], [DLT_T$$.c2], [DLT_T$$.c3])
 34 - output([mlog$_t1.OLD_NEW$$], [mlog$_t1.SEQUENCE$$], [T_FUN_MIN(mlog$_t1.SEQUENCE$$)], [mlog$_t1.c4], [mlog$_t1.c2], [mlog$_t1.c3]), filter(nil), rowset=16
      win_expr(T_FUN_MIN(mlog$_t1.SEQUENCE$$)), partition_by([mlog$_t1.c1]), order_by(nil), window_type(RANGE), upper(UNBOUNDED PRECEDING), lower(UNBOUNDED 
      FOLLOWING)
 35 - output([mlog$_t1.c1], [mlog$_t1.SEQUENCE$$], [mlog$_t1.OLD_NEW$$], [mlog$_t1.c4], [mlog$_t1.c2], [mlog$_t1.c3], [ORA_ROWSCN]), filter([ORA_ROWSCN 
      > last_refresh_scn(xxxxxx)]), rowset=16
      access([mlog$_t1.c1], [mlog$_t1.SEQUENCE$$], [mlog$_t1.OLD_NEW$$], [mlog$_t1.c4], [mlog$_t1.c2], [mlog$_t1.c3], [ORA_ROWSCN]), partitions(p0)
      is_index_back=false, is_global_index=false, filter_before_indexback[false], 
      range_key([mlog$_t1.c1], [mlog$_t1.SEQUENCE$$]), range(MIN,MIN ; MAX,MAX)always true
 36 - output([PRE_b.c3], [PRE_b.c2]), filter(nil), rowset=16
      access([PRE_b.c3], [PRE_b.c2])
 37 - output([UNION([1])], [UNION([2])]), filter(nil), rowset=16
 38 - output([b.c3], [b.c2]), filter(nil), rowset=16
      equal_conds([VIEW2.mlog$_t1.c1 = b.c1]), other_conds(nil)
      merge_directions([ASC])
 39 - output([b.c1], [b.c3], [b.c2]), filter(nil), rowset=16
      access([b.c1], [b.c3], [b.c2]), partitions(p0)
      is_index_back=false, is_global_index=false, 
      range_key([b.c1]), range(MIN ; MAX)always true
 40 - output([VIEW2.mlog$_t1.c1]), filter(nil), rowset=16
      access([VIEW2.mlog$_t1.c1])
 41 - output([mlog$_t1.c1]), filter([ORA_ROWSCN > last_refresh_scn(xxxxxx)]), rowset=16
      access([mlog$_t1.c1], [ORA_ROWSCN]), partitions(p0)
      is_index_back=false, is_global_index=false, filter_before_indexback[false], 
      range_key([mlog$_t1.c1], [mlog$_t1.SEQUENCE$$]), range(MIN,MIN ; MAX,MAX)always true
 42 - output([DLT_T$$.c3], [DLT_T$$.c2]), filter([DLT_T$$.OLD_NEW$$ = 'O'], [DLT_T$$.SEQUENCE$$ = DLT_T$$.MINSEQ$$]), rowset=16
      access([DLT_T$$.OLD_NEW$$], [DLT_T$$.SEQUENCE$$], [DLT_T$$.MINSEQ$$], [DLT_T$$.c3], [DLT_T$$.c2])
 43 - output([mlog$_t1.OLD_NEW$$], [mlog$_t1.SEQUENCE$$], [T_FUN_MIN(mlog$_t1.SEQUENCE$$)], [mlog$_t1.c3], [mlog$_t1.c2]), filter(nil), rowset=16
      win_expr(T_FUN_MIN(mlog$_t1.SEQUENCE$$)), partition_by([mlog$_t1.c1]), order_by(nil), window_type(RANGE), upper(UNBOUNDED PRECEDING), lower(UNBOUNDED 
      FOLLOWING)
 44 - output([mlog$_t1.c1], [mlog$_t1.SEQUENCE$$], [mlog$_t1.OLD_NEW$$], [mlog$_t1.c3], [mlog$_t1.c2], [ORA_ROWSCN]), filter([ORA_ROWSCN > last_refresh_scn(xxxxxx)]), rowset=16
      access([mlog$_t1.c1], [mlog$_t1.SEQUENCE$$], [mlog$_t1.OLD_NEW$$], [mlog$_t1.c3], [mlog$_t1.c2], [ORA_ROWSCN]), partitions(p0)
      is_index_back=false, is_global_index=false, filter_before_indexback[false], 
      range_key([mlog$_t1.c1], [mlog$_t1.SEQUENCE$$]), range(MIN,MIN ; MAX,MAX)always true
 45 - output([DLT_a.DMLFACTOR$$], [DLT_a.c2], [DLT_a.c3]), filter(nil), rowset=16
      access([DLT_a.DMLFACTOR$$], [DLT_a.c2], [DLT_a.c3])
 46 - output([CASE WHEN mlog$_t1.OLD_NEW$$ = 'N' THEN 1 ELSE -1 END], [mlog$_t1.c2], [mlog$_t1.c3]), filter([ORA_ROWSCN > last_refresh_scn(xxxxxx)]), rowset=16
      access([mlog$_t1.OLD_NEW$$], [mlog$_t1.c2], [mlog$_t1.c3], [ORA_ROWSCN]), partitions(p0)
      is_index_back=false, is_global_index=false, filter_before_indexback[false], 
      range_key([mlog$_t1.c1], [mlog$_t1.SEQUENCE$$]), range(MIN,MIN ; MAX,MAX)always true
 47 - output([a.c3], [DLT_b.c2], [T_FUN_SUM(DLT_b.DMLFACTOR$$)], [T_FUN_SUM(DLT_b.DMLFACTOR$$ * CASE WHEN PRE_e.c4 IS NULL THEN 0 ELSE 1 END)], [T_FUN_SUM(DLT_b.DMLFACTOR$$ 
      * PRE_e.c4)], [T_FUN_SUM(DLT_b.DMLFACTOR$$ * CASE WHEN PRE_c.c3 IS NULL THEN 0 ELSE 1 END)], [T_FUN_SUM(DLT_b.DMLFACTOR$$ * PRE_c.c3)]), filter(nil), rowset=16
      group([a.c3], [DLT_b.c2]), agg_func([T_FUN_SUM(DLT_b.DMLFACTOR$$)], [T_FUN_SUM(DLT_b.DMLFACTOR$$ * CASE WHEN PRE_e.c4 IS NULL THEN 0 ELSE 1 END)],
       [T_FUN_SUM(DLT_b.DMLFACTOR$$ * PRE_e.c4)], [T_FUN_SUM(DLT_b.DMLFACTOR$$ * CASE WHEN PRE_c.c3 IS NULL THEN 0 ELSE 1 END)], [T_FUN_SUM(DLT_b.DMLFACTOR$$ 
      * PRE_c.c3)])
 48 - output([a.c3], [DLT_b.c2], [DLT_b.DMLFACTOR$$], [PRE_e.c4], [PRE_c.c3]), filter(nil), rowset=16
      equal_conds([a.c2 = DLT_b.c3]), other_conds(nil)
 49 - output([DLT_b.c2], [DLT_b.DMLFACTOR$$], [PRE_e.c4], [PRE_c.c3], [DLT_b.c3]), filter(nil), rowset=16
      equal_conds([DLT_b.c2 = PRE_c.c4]), other_conds(nil)
 50 - output([PRE_e.c4], [PRE_c.c3], [PRE_c.c4]), filter(nil), rowset=16
      equal_conds([PRE_c.c2 = PRE_d.c3]), other_conds(nil)
 51 - output([PRE_e.c4], [PRE_d.c3]), filter(nil), rowset=16
      equal_conds([PRE_d.c4 = PRE_e.c2]), other_conds(nil)
 52 - output([PRE_d.c3], [PRE_d.c4]), filter(nil), rowset=16
      access([PRE_d.c3], [PRE_d.c4])
 53 - output([UNION([1])], [UNION([2])]), filter(nil), rowset=16
 54 - output([d.c3], [d.c4]), filter(nil), rowset=16
      equal_conds([VIEW7.mlog$_t1.c1 = d.c1]), other_conds(nil)
      merge_directions([ASC])
 55 - output([d.c1], [d.c3], [d.c4]), filter(nil), rowset=16
      access([d.c1], [d.c3], [d.c4]), partitions(p0)
      is_index_back=false, is_global_index=false, 
      range_key([d.c1]), range(MIN ; MAX)always true
 56 - output([VIEW7.mlog$_t1.c1]), filter(nil), rowset=16
      access([VIEW7.mlog$_t1.c1])
 57 - output([mlog$_t1.c1]), filter([ORA_ROWSCN > last_refresh_scn(xxxxxx)]), rowset=16
      access([mlog$_t1.c1], [ORA_ROWSCN]), partitions(p0)
      is_index_back=false, is_global_index=false, filter_before_indexback[false], 
      range_key([mlog$_t1.c1], [mlog$_t1.SEQUENCE$$]), range(MIN,MIN ; MAX,MAX)always true
 58 - output([DLT_T$$.c3], [DLT_T$$.c4]), filter([DLT_T$$.OLD_NEW$$ = 'O'], [DLT_T$$.SEQUENCE$$ = DLT_T$$.MINSEQ$$]), rowset=16
      access([DLT_T$$.OLD_NEW$$], [DLT_T$$.SEQUENCE$$], [DLT_T$$.MINSEQ$$], [DLT_T$$.c3], [DLT_T$$.c4])
 59 - output([mlog$_t1.OLD_NEW$$], [mlog$_t1.SEQUENCE$$], [T_FUN_MIN(mlog$_t1.SEQUENCE$$)], [mlog$_t1.c3], [mlog$_t1.c4]), filter(nil), rowset=16
      win_expr(T_FUN_MIN(mlog$_t1.SEQUENCE$$)), partition_by([mlog$_t1.c1]), order_by(nil), window_type(RANGE), upper(UNBOUNDED PRECEDING), lower(UNBOUNDED 
      FOLLOWING)
 60 - output([mlog$_t1.c1], [mlog$_t1.SEQUENCE$$], [mlog$_t1.OLD_NEW$$], [mlog$_t1.c3], [mlog$_t1.c4], [ORA_ROWSCN]), filter([ORA_ROWSCN > last_refresh_scn(xxxxxx)]), rowset=16
      access([mlog$_t1.c1], [mlog$_t1.SEQUENCE$$], [mlog$_t1.OLD_NEW$$], [mlog$_t1.c3], [mlog$_t1.c4], [ORA_ROWSCN]), partitions(p0)
      is_index_back=false, is_global_index=false, filter_before_indexback[false], 
      range_key([mlog$_t1.c1], [mlog$_t1.SEQUENCE$$]), range(MIN,MIN ; MAX,MAX)always true
 61 - output([PRE_e.c2], [PRE_e.c4]), filter(nil), rowset=16
      access([PRE_e.c2], [PRE_e.c4])
 62 - output([UNION([1])], [UNION([2])]), filter(nil), rowset=16
 63 - output([e.c2], [e.c4]), filter(nil), rowset=16
      equal_conds([VIEW8.mlog$_t1.c1 = e.c1]), other_conds(nil)
      merge_directions([ASC])
 64 - output([e.c1], [e.c2], [e.c4]), filter(nil), rowset=16
      access([e.c1], [e.c2], [e.c4]), partitions(p0)
      is_index_back=false, is_global_index=false, 
      range_key([e.c1]), range(MIN ; MAX)always true
 65 - output([VIEW8.mlog$_t1.c1]), filter(nil), rowset=16
      access([VIEW8.mlog$_t1.c1])
 66 - output([mlog$_t1.c1]), filter([ORA_ROWSCN > last_refresh_scn(xxxxxx)]), rowset=16
      access([mlog$_t1.c1], [ORA_ROWSCN]), partitions(p0)
      is_index_back=false, is_global_index=false, filter_before_indexback[false], 
      range_key([mlog$_t1.c1], [mlog$_t1.SEQUENCE$$]), range(MIN,MIN ; MAX,MAX)always true
 67 - output([DLT_T$$.c2], [DLT_T$$.c4]), filter([DLT_T$$.OLD_NEW$$ = 'O'], [DLT_T$$.SEQUENCE$$ = DLT_T$$.MINSEQ$$]), rowset=16
      access([DLT_T$$.OLD_NEW$$], [DLT_T$$.SEQUENCE$$], [DLT_T$$.MINSEQ$$], [DLT_T$$.c2], [DLT_T$$.c4])
 68 - output([mlog$_t1.OLD_NEW$$], [mlog$_t1.SEQUENCE$$], [T_FUN_MIN(mlog$_t1.SEQUENCE$$)], [mlog$_t1.c2], [mlog$_t1.c4]), filter(nil), rowset=16
      win_expr(T_FUN_MIN(mlog$_t1.SEQUENCE$$)), partition_by([mlog$_t1.c1]), order_by(nil), window_type(RANGE), upper(UNBOUNDED PRECEDING), lower(UNBOUNDED 
      FOLLOWING)
 69 - output([mlog$_t1.c1], [mlog$_t1.SEQUENCE$$], [mlog$_t1.OLD_NEW$$], [mlog$_t1.c2], [mlog$_t1.c4], [ORA_ROWSCN]), filter([ORA_ROWSCN > last_refresh_scn(xxxxxx)]), rowset=16
      access([mlog$_t1.c1], [mlog$_t1.SEQUENCE$$], [mlog$_t1.OLD_NEW$$], [mlog$_t1.c2], [mlog$_t1.c4], [ORA_ROWSCN]), partitions(p0)
      is_index_back=false, is_global_index=false, filter_before_indexback[false], 
      range_key([mlog$_t1.c1], [mlog$_t1.SEQUENCE$$]), range(MIN,MIN ; MAX,MAX)always true
 70 - output([PRE_c.c4], [PRE_c.c2], [PRE_c.c3]), filter(nil), rowset=16
      access([PRE_c.c4], [PRE_c.c2], [PRE_c.c3])
 71 - output([UNION([1])], [UNION([2])], [UNION([3])]), filter(nil), rowset=16
 72 - output([c.c4], [c.c2], [c.c3]), filter(nil), rowset=16
      equal_conds([VIEW6.mlog$_t1.c1 = c.c1]), other_conds(nil)
      merge_directions([ASC])
 73 - output([c.c1], [c.c4], [c.c2], [c.c3]), filter(nil), rowset=16
      access([c.c1], [c.c4], [c.c2], [c.c3]), partitions(p0)
      is_index_back=false, is_global_index=false, 
      range_key([c.c1]), range(MIN ; MAX)always true
 74 - output([VIEW6.mlog$_t1.c1]), filter(nil), rowset=16
      access([VIEW6.mlog$_t1.c1])
 75 - output([mlog$_t1.c1]), filter([ORA_ROWSCN > last_refresh_scn(xxxxxx)]), rowset=16
      access([mlog$_t1.c1], [ORA_ROWSCN]), partitions(p0)
      is_index_back=false, is_global_index=false, filter_before_indexback[false], 
      range_key([mlog$_t1.c1], [mlog$_t1.SEQUENCE$$]), range(MIN,MIN ; MAX,MAX)always true
 76 - output([DLT_T$$.c4], [DLT_T$$.c2], [DLT_T$$.c3]), filter([DLT_T$$.OLD_NEW$$ = 'O'], [DLT_T$$.SEQUENCE$$ = DLT_T$$.MINSEQ$$]), rowset=16
      access([DLT_T$$.OLD_NEW$$], [DLT_T$$.SEQUENCE$$], [DLT_T$$.MINSEQ$$], [DLT_T$$.c4], [DLT_T$$.c2], [DLT_T$$.c3])
 77 - output([mlog$_t1.OLD_NEW$$], [mlog$_t1.SEQUENCE$$], [T_FUN_MIN(mlog$_t1.SEQUENCE$$)], [mlog$_t1.c4], [mlog$_t1.c2], [mlog$_t1.c3]), filter(nil), rowset=16
      win_expr(T_FUN_MIN(mlog$_t1.SEQUENCE$$)), partition_by([mlog$_t1.c1]), order_by(nil), window_type(RANGE), upper(UNBOUNDED PRECEDING), lower(UNBOUNDED 
      FOLLOWING)
 78 - output([mlog$_t1.c1], [mlog$_t1.SEQUENCE$$], [mlog$_t1.OLD_NEW$$], [mlog$_t1.c4], [mlog$_t1.c2], [mlog$_t1.c3], [ORA_ROWSCN]), filter([ORA_ROWSCN 
      > last_refresh_scn(xxxxxx)]), rowset=16
      access([mlog$_t1.c1], [mlog$_t1.SEQUENCE$$], [mlog$_t1.OLD_NEW$$], [mlog$_t1.c4], [mlog$_t1.c2], [mlog$_t1.c3], [ORA_ROWSCN]), partitions(p0)
      is_index_back=false, is_global_index=false, filter_before_indexback[false], 
      range_key([mlog$_t1.c1], [mlog$_t1.SEQUENCE$$]), range(MIN,MIN ; MAX,MAX)always true
 79 - output([DLT_b.DMLFACTOR$$], [DLT_b.c3], [DLT_b.c2]), filter(nil), rowset=16
      access([DLT_b.DMLFACTOR$$], [DLT_b.c3], [DLT_b.c2])
 80 - output([CASE WHEN mlog$_t1.OLD_NEW$$ = 'N' THEN 1 ELSE -1 END], [mlog$_t1.c3], [mlog$_t1.c2]), filter([ORA_ROWSCN > last_refresh_scn(xxxxxx)]), rowset=16
      access([mlog$_t1.OLD_NEW$$], [mlog$_t1.c3], [mlog$_t1.c2], [ORA_ROWSCN]), partitions(p0)
      is_index_back=false, is_global_index=false, filter_before_indexback[false], 
      range_key([mlog$_t1.c1], [mlog$_t1.SEQUENCE$$]), range(MIN,MIN ; MAX,MAX)always true
 81 - output([a.c2], [a.c3]), filter(nil), rowset=16
      access([a.c2], [a.c3]), partitions(p0)
      is_index_back=false, is_global_index=false, 
      range_key([a.c1]), range(MIN ; MAX)always true
 82 - output([a.c3], [b.c2], [T_FUN_SUM(DLT_c.DMLFACTOR$$)], [T_FUN_SUM(DLT_c.DMLFACTOR$$ * CASE WHEN PRE_e.c4 IS NULL THEN 0 ELSE 1 END)], [T_FUN_SUM(DLT_c.DMLFACTOR$$ 
      * PRE_e.c4)], [T_FUN_SUM(DLT_c.DMLFACTOR$$ * CASE WHEN DLT_c.c3 IS NULL THEN 0 ELSE 1 END)], [T_FUN_SUM(DLT_c.DMLFACTOR$$ * DLT_c.c3)]), filter(nil), rowset=16
      group([a.c3], [b.c2]), agg_func([T_FUN_SUM(DLT_c.DMLFACTOR$$)], [T_FUN_SUM(DLT_c.DMLFACTOR$$ * CASE WHEN PRE_e.c4 IS NULL THEN 0 ELSE 1 END)], [T_FUN_SUM(DLT_c.DMLFACTOR$$ 
      * PRE_e.c4)], [T_FUN_SUM(DLT_c.DMLFACTOR$$ * CASE WHEN DLT_c.c3 IS NULL THEN 0 ELSE 1 END)], [T_FUN_SUM(DLT_c.DMLFACTOR$$ * DLT_c.c3)])
 83 - output([a.c3], [b.c2], [DLT_c.DMLFACTOR$$], [PRE_e.c4], [DLT_c.c3]), filter(nil), rowset=16
      equal_conds([a.c2 = b.c3]), other_conds(nil)
 84 - output([b.c2], [DLT_c.DMLFACTOR$$], [PRE_e.c4], [DLT_c.c3], [b.c3]), filter(nil), rowset=16
      equal_conds([b.c2 = DLT_c.c4]), other_conds(nil)
 85 - output([DLT_c.DMLFACTOR$$], [PRE_e.c4], [DLT_c.c3], [DLT_c.c4]), filter(nil), rowset=16
      equal_conds([DLT_c.c2 = PRE_d.c3]), other_conds(nil)
 86 - output([PRE_e.c4], [PRE_d.c3]), filter(nil), rowset=16
      equal_conds([PRE_d.c4 = PRE_e.c2]), other_conds(nil)
 87 - output([PRE_d.c3], [PRE_d.c4]), filter(nil), rowset=16
      access([PRE_d.c3], [PRE_d.c4])
 88 - output([UNION([1])], [UNION([2])]), filter(nil), rowset=16
 89 - output([d.c3], [d.c4]), filter(nil), rowset=16
      equal_conds([VIEW9.mlog$_t1.c1 = d.c1]), other_conds(nil)
      merge_directions([ASC])
 90 - output([d.c1], [d.c3], [d.c4]), filter(nil), rowset=16
      access([d.c1], [d.c3], [d.c4]), partitions(p0)
      is_index_back=false, is_global_index=false, 
      range_key([d.c1]), range(MIN ; MAX)always true
 91 - output([VIEW9.mlog$_t1.c1]), filter(nil), rowset=16
      access([VIEW9.mlog$_t1.c1])
 92 - output([mlog$_t1.c1]), filter([ORA_ROWSCN > last_refresh_scn(xxxxxx)]), rowset=16
      access([mlog$_t1.c1], [ORA_ROWSCN]), partitions(p0)
      is_index_back=false, is_global_index=false, filter_before_indexback[false], 
      range_key([mlog$_t1.c1], [mlog$_t1.SEQUENCE$$]), range(MIN,MIN ; MAX,MAX)always true
 93 - output([DLT_T$$.c3], [DLT_T$$.c4]), filter([DLT_T$$.OLD_NEW$$ = 'O'], [DLT_T$$.SEQUENCE$$ = DLT_T$$.MINSEQ$$]), rowset=16
      access([DLT_T$$.OLD_NEW$$], [DLT_T$$.SEQUENCE$$], [DLT_T$$.MINSEQ$$], [DLT_T$$.c3], [DLT_T$$.c4])
 94 - output([mlog$_t1.OLD_NEW$$], [mlog$_t1.SEQUENCE$$], [T_FUN_MIN(mlog$_t1.SEQUENCE$$)], [mlog$_t1.c3], [mlog$_t1.c4]), filter(nil), rowset=16
      win_expr(T_FUN_MIN(mlog$_t1.SEQUENCE$$)), partition_by([mlog$_t1.c1]), order_by(nil), window_type(RANGE), upper(UNBOUNDED PRECEDING), lower(UNBOUNDED 
      FOLLOWING)
 95 - output([mlog$_t1.c1], [mlog$_t1.SEQUENCE$$], [mlog$_t1.OLD_NEW$$], [mlog$_t1.c3], [mlog$_t1.c4], [ORA_ROWSCN]), filter([ORA_ROWSCN > last_refresh_scn(xxxxxx)]), rowset=16
      access([mlog$_t1.c1], [mlog$_t1.SEQUENCE$$], [mlog$_t1.OLD_NEW$$], [mlog$_t1.c3], [mlog$_t1.c4], [ORA_ROWSCN]), partitions(p0)
      is_index_back=false, is_global_index=false, filter_before_indexback[false], 
      range_key([mlog$_t1.c1], [mlog$_t1.SEQUENCE$$]), range(MIN,MIN ; MAX,MAX)always true
 96 - output([PRE_e.c2], [PRE_e.c4]), filter(nil), rowset=16
      access([PRE_e.c2], [PRE_e.c4])
 97 - output([UNION([1])], [UNION([2])]), filter(nil), rowset=16
 98 - output([e.c2], [e.c4]), filter(nil), rowset=16
      equal_conds([VIEW10.mlog$_t1.c1 = e.c1]), other_conds(nil)
      merge_directions([ASC])
 99 - output([e.c1], [e.c2], [e.c4]), filter(nil), rowset=16
      access([e.c1], [e.c2], [e.c4]), partitions(p0)
      is_index_back=false, is_global_index=false, 
      range_key([e.c1]), range(MIN ; MAX)always true
100 - output([VIEW10.mlog$_t1.c1]), filter(nil), rowset=16
      access([VIEW10.mlog$_t1.c1])
101 - output([mlog$_t1.c1]), filter([ORA_ROWSCN > last_refresh_scn(xxxxxx)]), rowset=16
      access([mlog$_t1.c1], [ORA_ROWSCN]), partitions(p0)
      is_index_back=false, is_global_index=false, filter_before_indexback[false], 
      range_key([mlog$_t1.c1], [mlog$_t1.SEQUENCE$$]), range(MIN,MIN ; MAX,MAX)always true
102 - output([DLT_T$$.c2], [DLT_T$$.c4]), filter([DLT_T$$.OLD_NEW$$ = 'O'], [DLT_T$$.SEQUENCE$$ = DLT_T$$.MINSEQ$$]), rowset=16
      access([DLT_T$$.OLD_NEW$$], [DLT_T$$.SEQUENCE$$], [DLT_T$$.MINSEQ$$], [DLT_T$$.c2], [DLT_T$$.c4])
103 - output([mlog$_t1.OLD_NEW$$], [mlog$_t1.SEQUENCE$$], [T_FUN_MIN(mlog$_t1.SEQUENCE$$)], [mlog$_t1.c2], [mlog$_t1.c4]), filter(nil), rowset=16
      win_expr(T_FUN_MIN(mlog$_t1.SEQUENCE$$)), partition_by([mlog$_t1.c1]), order_by(nil), window_type(RANGE), upper(UNBOUNDED PRECEDING), lower(UNBOUNDED 
      FOLLOWING)
104 - output([mlog$_t1.c1], [mlog$_t1.SEQUENCE$$], [mlog$_t1.OLD_NEW$$], [mlog$_t1.c2], [mlog$_t1.c4], [ORA_ROWSCN]), filter([ORA_ROWSCN > last_refresh_scn(xxxxxx)]), rowset=16
      access([mlog$_t1.c1], [mlog$_t1.SEQUENCE$$], [mlog$_t1.OLD_NEW$$], [mlog$_t1.c2], [mlog$_t1.c4], [ORA_ROWSCN]), partitions(p0)
      is_index_back=false, is_global_index=false, filter_before_indexback[false], 
      range_key([mlog$_t1.c1], [mlog$_t1.SEQUENCE$$]), range(MIN,MIN ; MAX,MAX)always true
105 - output([DLT_c.DMLFACTOR$$], [DLT_c.c4], [DLT_c.c2], [DLT_c.c3]), filter(nil), rowset=16
      access([DLT_c.DMLFACTOR$$], [DLT_c.c4], [DLT_c.c2], [DLT_c.c3])
106 - output([CASE WHEN mlog$_t1.OLD_NEW$$ = 'N' THEN 1 ELSE -1 END], [mlog$_t1.c4], [mlog$_t1.c2], [mlog$_t1.c3]), filter([ORA_ROWSCN > last_refresh_scn(xxxxxx)]), rowset=16
      access([mlog$_t1.OLD_NEW$$], [mlog$_t1.c4], [mlog$_t1.c2], [mlog$_t1.c3], [ORA_ROWSCN]), partitions(p0)
      is_index_back=false, is_global_index=false, filter_before_indexback[false], 
      range_key([mlog$_t1.c1], [mlog$_t1.SEQUENCE$$]), range(MIN,MIN ; MAX,MAX)always true
107 - output([b.c3], [b.c2]), filter(nil), rowset=16
      access([b.c3], [b.c2]), partitions(p0)
      is_index_back=false, is_global_index=false, 
      range_key([b.c1]), range(MIN ; MAX)always true
108 - output([a.c2], [a.c3]), filter(nil), rowset=16
      access([a.c2], [a.c3]), partitions(p0)
      is_index_back=false, is_global_index=false, 
      range_key([a.c1]), range(MIN ; MAX)always true
109 - output([a.c3], [b.c2], [T_FUN_SUM(DLT_d.DMLFACTOR$$)], [T_FUN_SUM(DLT_d.DMLFACTOR$$ * CASE WHEN PRE_e.c4 IS NULL THEN 0 ELSE 1 END)], [T_FUN_SUM(DLT_d.DMLFACTOR$$ 
      * PRE_e.c4)], [T_FUN_SUM(DLT_d.DMLFACTOR$$ * CASE WHEN c.c3 IS NULL THEN 0 ELSE 1 END)], [T_FUN_SUM(DLT_d.DMLFACTOR$$ * c.c3)]), filter(nil), rowset=16
      group([a.c3], [b.c2]), agg_func([T_FUN_SUM(DLT_d.DMLFACTOR$$)], [T_FUN_SUM(DLT_d.DMLFACTOR$$ * CASE WHEN PRE_e.c4 IS NULL THEN 0 ELSE 1 END)], [T_FUN_SUM(DLT_d.DMLFACTOR$$ 
      * PRE_e.c4)], [T_FUN_SUM(DLT_d.DMLFACTOR$$ * CASE WHEN c.c3 IS NULL THEN 0 ELSE 1 END)], [T_FUN_SUM(DLT_d.DMLFACTOR$$ * c.c3)])
110 - output([a.c3], [b.c2], [DLT_d.DMLFACTOR$$], [PRE_e.c4], [c.c3]), filter(nil), rowset=16
      equal_conds([a.c2 = b.c3]), other_conds(nil)
111 - output([b.c2], [DLT_d.DMLFACTOR$$], [PRE_e.c4], [c.c3], [b.c3]), filter(nil), rowset=16
      equal_conds([b.c2 = c.c4]), other_conds(nil)
112 - output([DLT_d.DMLFACTOR$$], [PRE_e.c4], [c.c3], [c.c4]), filter(nil), rowset=16
      equal_conds([c.c2 = DLT_d.c3]), other_conds(nil)
113 - output([DLT_d.DMLFACTOR$$], [PRE_e.c4], [DLT_d.c3]), filter(nil), rowset=16
      equal_conds([DLT_d.c4 = PRE_e.c2]), other_conds(nil)
114 - output([PRE_e.c2], [PRE_e.c4]), filter(nil), rowset=16
      access([PRE_e.c2], [PRE_e.c4])
115 - output([UNION([1])], [UNION([2])]), filter(nil), rowset=16
116 - output([e.c2], [e.c4]), filter(nil), rowset=16
      equal_conds([VIEW11.mlog$_t1.c1 = e.c1]), other_conds(nil)
      merge_directions([ASC])
117 - output([e.c1], [e.c2], [e.c4]), filter(nil), rowset=16
      access([e.c1], [e.c2], [e.c4]), partitions(p0)
      is_index_back=false, is_global_index=false, 
      range_key([e.c1]), range(MIN ; MAX)always true
118 - output([VIEW11.mlog$_t1.c1]), filter(nil), rowset=16
      access([VIEW11.mlog$_t1.c1])
119 - output([mlog$_t1.c1]), filter([ORA_ROWSCN > last_refresh_scn(xxxxxx)]), rowset=16
      access([mlog$_t1.c1], [ORA_ROWSCN]), partitions(p0)
      is_index_back=false, is_global_index=false, filter_before_indexback[false], 
      range_key([mlog$_t1.c1], [mlog$_t1.SEQUENCE$$]), range(MIN,MIN ; MAX,MAX)always true
120 - output([DLT_T$$.c2], [DLT_T$$.c4]), filter([DLT_T$$.OLD_NEW$$ = 'O'], [DLT_T$$.SEQUENCE$$ = DLT_T$$.MINSEQ$$]), rowset=16
      access([DLT_T$$.OLD_NEW$$], [DLT_T$$.SEQUENCE$$], [DLT_T$$.MINSEQ$$], [DLT_T$$.c2], [DLT_T$$.c4])
121 - output([mlog$_t1.OLD_NEW$$], [mlog$_t1.SEQUENCE$$], [T_FUN_MIN(mlog$_t1.SEQUENCE$$)], [mlog$_t1.c2], [mlog$_t1.c4]), filter(nil), rowset=16
      win_expr(T_FUN_MIN(mlog$_t1.SEQUENCE$$)), partition_by([mlog$_t1.c1]), order_by(nil), window_type(RANGE), upper(UNBOUNDED PRECEDING), lower(UNBOUNDED 
      FOLLOWING)
122 - output([mlog$_t1.c1], [mlog$_t1.SEQUENCE$$], [mlog$_t1.OLD_NEW$$], [mlog$_t1.c2], [mlog$_t1.c4], [ORA_ROWSCN]), filter([ORA_ROWSCN > last_refresh_scn(xxxxxx)]), rowset=16
      access([mlog$_t1.c1], [mlog$_t1.SEQUENCE$$], [mlog$_t1.OLD_NEW$$], [mlog$_t1.c2], [mlog$_t1.c4], [ORA_ROWSCN]), partitions(p0)
      is_index_back=false, is_global_index=false, filter_before_indexback[false], 
      range_key([mlog$_t1.c1], [mlog$_t1.SEQUENCE$$]), range(MIN,MIN ; MAX,MAX)always true
123 - output([DLT_d.DMLFACTOR$$], [DLT_d.c3], [DLT_d.c4]), filter(nil), rowset=16
      access([DLT_d.DMLFACTOR$$], [DLT_d.c3], [DLT_d.c4])
124 - output([CASE WHEN mlog$_t1.OLD_NEW$$ = 'N' THEN 1 ELSE -1 END], [mlog$_t1.c3], [mlog$_t1.c4]), filter([ORA_ROWSCN > last_refresh_scn(xxxxxx)]), rowset=16
      access([mlog$_t1.OLD_NEW$$], [mlog$_t1.c3], [mlog$_t1.c4], [ORA_ROWSCN]), partitions(p0)
      is_index_back=false, is_global_index=false, filter_before_indexback[false], 
      range_key([mlog$_t1.c1], [mlog$_t1.SEQUENCE$$]), range(MIN,MIN ; MAX,MAX)always true
125 - output([c.c4], [c.c2], [c.c3]), filter(nil), rowset=16
      access([c.c4], [c.c2], [c.c3]), partitions(p0)
      is_index_back=false, is_global_index=false, 
      range_key([c.c1]), range(MIN ; MAX)always true
126 - output([b.c3], [b.c2]), filter(nil), rowset=16
      access([b.c3], [b.c2]), partitions(p0)
      is_index_back=false, is_global_index=false, 
      range_key([b.c1]), range(MIN ; MAX)always true
127 - output([a.c2], [a.c3]), filter(nil), rowset=16
      access([a.c2], [a.c3]), partitions(p0)
      is_index_back=false, is_global_index=false, 
      range_key([a.c1]), range(MIN ; MAX)always true
128 - output([a.c3], [b.c2], [T_FUN_SUM(DLT_e.DMLFACTOR$$)], [T_FUN_SUM(DLT_e.DMLFACTOR$$ * CASE WHEN DLT_e.c4 IS NULL THEN 0 ELSE 1 END)], [T_FUN_SUM(DLT_e.DMLFACTOR$$ 
      * DLT_e.c4)], [T_FUN_SUM(DLT_e.DMLFACTOR$$ * CASE WHEN c.c3 IS NULL THEN 0 ELSE 1 END)], [T_FUN_SUM(DLT_e.DMLFACTOR$$ * c.c3)]), filter(nil), rowset=16
      group([a.c3], [b.c2]), agg_func([T_FUN_SUM(DLT_e.DMLFACTOR$$)], [T_FUN_SUM(DLT_e.DMLFACTOR$$ * CASE WHEN DLT_e.c4 IS NULL THEN 0 ELSE 1 END)], [T_FUN_SUM(DLT_e.DMLFACTOR$$ 
      * DLT_e.c4)], [T_FUN_SUM(DLT_e.DMLFACTOR$$ * CASE WHEN c.c3 IS NULL THEN 0 ELSE 1 END)], [T_FUN_SUM(DLT_e.DMLFACTOR$$ * c.c3)])
129 - output([a.c3], [b.c2], [DLT_e.DMLFACTOR$$], [DLT_e.c4], [c.c3]), filter(nil), rowset=16
      equal_conds([a.c2 = b.c3]), other_conds(nil)
130 - output([b.c2], [DLT_e.DMLFACTOR$$], [DLT_e.c4], [c.c3], [b.c3]), filter(nil), rowset=16
      equal_conds([b.c2 = c.c4]), other_conds(nil)
131 - output([DLT_e.DMLFACTOR$$], [DLT_e.c4], [c.c3], [c.c4]), filter(nil), rowset=16
      equal_conds([c.c2 = d.c3]), other_conds(nil)
132 - output([DLT_e.DMLFACTOR$$], [DLT_e.c4], [d.c3]), filter(nil), rowset=16
      equal_conds([d.c4 = DLT_e.c2]), other_conds(nil)
133 - output([DLT_e.DMLFACTOR$$], [DLT_e.c2], [DLT_e.c4]), filter(nil), rowset=16
      access([DLT_e.DMLFACTOR$$], [DLT_e.c2], [DLT_e.c4])
134 - output([CASE WHEN mlog$_t1.OLD_NEW$$ = 'N' THEN 1 ELSE -1 END], [mlog$_t1.c2], [mlog$_t1.c4]), filter([ORA_ROWSCN > last_refresh_scn(xxxxxx)]), rowset=16
      access([mlog$_t1.OLD_NEW$$], [mlog$_t1.c2], [mlog$_t1.c4], [ORA_ROWSCN]), partitions(p0)
      is_index_back=false, is_global_index=false, filter_before_indexback[false], 
      range_key([mlog$_t1.c1], [mlog$_t1.SEQUENCE$$]), range(MIN,MIN ; MAX,MAX)always true
135 - output([d.c3], [d.c4]), filter(nil), rowset=16
      access([d.c3], [d.c4]), partitions(p0)
      is_index_back=false, is_global_index=false, 
      range_key([d.c1]), range(MIN ; MAX)always true
136 - output([c.c4], [c.c2], [c.c3]), filter(nil), rowset=16
      access([c.c4], [c.c2], [c.c3]), partitions(p0)
      is_index_back=false, is_global_index=false, 
      range_key([c.c1]), range(MIN ; MAX)always true
137 - output([b.c3], [b.c2]), filter(nil), rowset=16
      access([b.c3], [b.c2]), partitions(p0)
      is_index_back=false, is_global_index=false, 
      range_key([b.c1]), range(MIN ; MAX)always true
138 - output([a.c2], [a.c3]), filter(nil), rowset=16
      access([a.c2], [a.c3]), partitions(p0)
      is_index_back=false, is_global_index=false, 
      range_key([a.c1]), range(MIN ; MAX)always true

select * from res_com1;
+----------+
| expect_0 |
+----------+
|        0 |
+----------+
select * from res_com2;
+----------+
| expect_0 |
+----------+
|        0 |
+----------+

insert into t1(c2, c3, c4) select uniform(1, 5, random()), uniform(1, 5, random()), uniform(1, 5, random()) from table(generator(20));
select * from res_com1;
+----------+
| expect_0 |
+----------+
|        0 |
+----------+
select * from res_com2;
+----------+
| expect_0 |
+----------+
|        0 |
+----------+

insert into t1(c2, c3, c4) select uniform(1, 5, random()), uniform(1, 5, random()), uniform(1, 5, random()) from table(generator(20));
update t1 set c2 = c4 where c3 > 3;
delete from t1 where c4 < 2;
select * from res_com1;
+----------+
| expect_0 |
+----------+
|        0 |
+----------+
select * from res_com2;
+----------+
| expect_0 |
+----------+
|        0 |
+----------+

delete from t1;
select * from res_com1;
+----------+
| expect_0 |
+----------+
|        0 |
+----------+
select * from res_com2;
+----------+
| expect_0 |
+----------+
|        0 |
+----------+

insert into t1(c2, c3, c4) select uniform(1, 5, random()), uniform(1, 5, random()), uniform(1, 5, random()) from table(generator(40));
select * from res_com1;
+----------+
| expect_0 |
+----------+
|        0 |
+----------+
select * from res_com2;
+----------+
| expect_0 |
+----------+
|        0 |
+----------+

call DBMS_MVIEW.REFRESH('t1_rt_mv1', 'f');
call DBMS_MVIEW.REFRESH('t1_rt_mv2', 'f');

update t1 set c4 = c2 where c3 > 2;
select * from res_com1;
+----------+
| expect_0 |
+----------+
|        0 |
+----------+
select * from res_com2;
+----------+
| expect_0 |
+----------+
|        0 |
+----------+

delete from t1 where c3 < 2 and c2 < 3;
select * from res_com1;
+----------+
| expect_0 |
+----------+
|        0 |
+----------+
select * from res_com2;
+----------+
| expect_0 |
+----------+
|        0 |
+----------+

drop materialized view log on t1;
drop table if exists t1;
drop table if exists t2;
drop view if exists t1_v1;
drop view if exists t1_v2;
drop materialized view t1_rt_mv1;
drop materialized view t1_rt_mv2;
