set sql_mode = 'ONLY_FULL_GROUP_BY,STRICT_TRANS_TABLES';
SELECT @@SESSION.SQL_MODE;
@@SESSION.SQL_MODE
ONLY_FULL_GROUP_BY,STRICT_TRANS_TABLES
CREATE DATABASE IF NOT EXISTS db_test DEFAULT CHARSET utf8 COLLATE utf8_general_ci;
USE db_test;
# 环境清理
DROP TABLE test_2t CASCADE;
ERROR 42S02: Unknown table 'db_test.test_2t'
DROP TABLE test_1t CASCADE;
ERROR 42S02: Unknown table 'db_test.test_1t'
CREATE TABLE test_1t(id int primary key,name VARCHAR(20),class VARCHAR(20),age int);
INSERT INTO test_1t VALUES(1,'aa','三一',13),
(2,'aa','三一',12),
(3,'cc','三二',14),
(4,'cc','三二',14),
(5,'ee','三三',15),
(6,'ff','三三',16),
(7,'ee','三四',13);
SELECT * FROM test_1t;
id	name	class	age
1	aa	三一	13
2	aa	三一	12
3	cc	三二	14
4	cc	三二	14
5	ee	三三	15
6	ff	三三	16
7	ee	三四	13
SELECT ANY_VALUE(name+'b'),class,ANY_VALUE(age+1) FROM test_1t GROUP BY(class);
ANY_VALUE(name+'b')	class	ANY_VALUE(age+1)
0	三一	14
0	三二	15
0	三三	16
0	三四	14
Warnings:
Warning	1292	Truncated incorrect DOUBLE value: 'aa'
Warning	1292	Truncated incorrect DOUBLE value: 'b'
Warning	1292	Truncated incorrect DOUBLE value: 'cc'
Warning	1292	Truncated incorrect DOUBLE value: 'ee'
Warning	1292	Truncated incorrect DOUBLE value: 'ee'
SELECT ANY_VALUE(name-'b'),class,ANY_VALUE(age-1) FROM test_1t GROUP BY(class);
ANY_VALUE(name-'b')	class	ANY_VALUE(age-1)
0	三一	12
0	三二	13
0	三三	14
0	三四	12
Warnings:
Warning	1292	Truncated incorrect DOUBLE value: 'aa'
Warning	1292	Truncated incorrect DOUBLE value: 'b'
Warning	1292	Truncated incorrect DOUBLE value: 'cc'
Warning	1292	Truncated incorrect DOUBLE value: 'ee'
Warning	1292	Truncated incorrect DOUBLE value: 'ee'
SELECT ANY_VALUE(name*'b'),class,ANY_VALUE(age*2) FROM test_1t GROUP BY(class);
ANY_VALUE(name*'b')	class	ANY_VALUE(age*2)
0	三一	26
0	三二	28
0	三三	30
0	三四	26
Warnings:
Warning	1292	Truncated incorrect DOUBLE value: 'aa'
Warning	1292	Truncated incorrect DOUBLE value: 'b'
Warning	1292	Truncated incorrect DOUBLE value: 'cc'
Warning	1292	Truncated incorrect DOUBLE value: 'ee'
Warning	1292	Truncated incorrect DOUBLE value: 'ee'
SELECT ANY_VALUE(name),class,ANY_VALUE(age/2) FROM test_1t GROUP BY(class);
ANY_VALUE(name)	class	ANY_VALUE(age/2)
aa	三一	6.5000
cc	三二	7.0000
ee	三三	7.5000
ee	三四	6.5000
SELECT ANY_VALUE(name/'b'),class,ANY_VALUE(age/2) FROM test_1t GROUP BY(class);
ANY_VALUE(name/'b')	class	ANY_VALUE(age/2)
NULL	三一	6.5000
NULL	三二	7.0000
NULL	三三	7.5000
NULL	三四	6.5000
Warnings:
Warning	1292	Truncated incorrect DOUBLE value: 'aa'
Warning	1292	Truncated incorrect DOUBLE value: 'b'
Warning	1292	Truncated incorrect DOUBLE value: 'cc'
Warning	1292	Truncated incorrect DOUBLE value: 'ee'
Warning	1292	Truncated incorrect DOUBLE value: 'ee'
UPDATE test_1t SET name='ee',age=15 WHERE id=6;
SELECT * FROM test_1t;
id	name	class	age
1	aa	三一	13
2	aa	三一	12
3	cc	三二	14
4	cc	三二	14
5	ee	三三	15
6	ee	三三	15
7	ee	三四	13
SELECT ANY_VALUE(name),class,ANY_VALUE(age) FROM test_1t WHERE name='ee' AND age<18 GROUP BY(class);
ANY_VALUE(name)	class	ANY_VALUE(age)
ee	三三	15
ee	三四	13
SELECT ANY_VALUE(name),class,ANY_VALUE(age) FROM test_1t WHERE name='ee' OR name='aa' GROUP BY(class);
ANY_VALUE(name)	class	ANY_VALUE(age)
aa	三一	13
ee	三三	15
ee	三四	13
SELECT ANY_VALUE(name),class,ANY_VALUE(age) FROM test_1t WHERE name NOT IN('ee')  GROUP BY(class);
ANY_VALUE(name)	class	ANY_VALUE(age)
aa	三一	13
cc	三二	14
SELECT ANY_VALUE(name AND age),class FROM test_1t WHERE name NOT IN('ee')  GROUP BY(class);
ANY_VALUE(name AND age)	class
0	三一
0	三二
Warnings:
Warning	1292	Truncated incorrect DOUBLE value: 'aa'
Warning	1292	Truncated incorrect DOUBLE value: 'cc'
SELECT ANY_VALUE(name OR age),class FROM test_1t WHERE name NOT IN('ee')  GROUP BY(class);
ANY_VALUE(name OR age)	class
1	三一
1	三二
Warnings:
Warning	1292	Truncated incorrect DOUBLE value: 'aa'
Warning	1292	Truncated incorrect DOUBLE value: 'cc'
SELECT ANY_VALUE(name NOT age),class FROM test_1t WHERE name NOT IN('ee')  GROUP BY(class);
ERROR 42000: You have an error in your SQL syntax; check the manual that corresponds to your OceanBase version for the right syntax to use near 'age),class FROM test_1t WHERE name NOT IN('ee')  GROUP BY(class)' at line 1
SELECT ANY_VALUE(name),class,ANY_VALUE(age) FROM test_1t WHERE name='ee' GROUP BY(class);
ANY_VALUE(name)	class	ANY_VALUE(age)
ee	三三	15
ee	三四	13
SELECT ANY_VALUE(name),class,ANY_VALUE(age=15) FROM test_1t WHERE name='ee' GROUP BY(class);
ANY_VALUE(name)	class	ANY_VALUE(age=15)
ee	三三	1
ee	三四	0
SELECT ANY_VALUE(name),class,ANY_VALUE(age) FROM test_1t WHERE id>=2 GROUP BY(class);
ANY_VALUE(name)	class	ANY_VALUE(age)
aa	三一	12
cc	三二	14
ee	三三	15
ee	三四	13
SELECT ANY_VALUE(name),class,ANY_VALUE(age>=13) FROM test_1t WHERE id>=2 GROUP BY(class);
ANY_VALUE(name)	class	ANY_VALUE(age>=13)
aa	三一	0
cc	三二	1
ee	三三	1
ee	三四	1
SELECT ANY_VALUE(name),class,ANY_VALUE(age) FROM test_1t WHERE id<=5 GROUP BY(class);
ANY_VALUE(name)	class	ANY_VALUE(age)
aa	三一	13
cc	三二	14
ee	三三	15
SELECT ANY_VALUE(name),class,ANY_VALUE(age>=15) FROM test_1t WHERE id<=5 GROUP BY(class);
ANY_VALUE(name)	class	ANY_VALUE(age>=15)
aa	三一	0
cc	三二	0
ee	三三	1
SELECT ANY_VALUE(name),class,ANY_VALUE(age) FROM test_1t WHERE id<5 GROUP BY(class);
ANY_VALUE(name)	class	ANY_VALUE(age)
aa	三一	13
cc	三二	14
SELECT ANY_VALUE(name),class,ANY_VALUE(age>15) FROM test_1t WHERE id<5 GROUP BY(class);
ANY_VALUE(name)	class	ANY_VALUE(age>15)
aa	三一	0
cc	三二	0
SELECT ANY_VALUE(name),class,ANY_VALUE(age) FROM test_1t WHERE id<>2 GROUP BY(class);
ANY_VALUE(name)	class	ANY_VALUE(age)
aa	三一	13
cc	三二	14
ee	三三	15
ee	三四	13
SELECT ANY_VALUE(name),class,ANY_VALUE(age<>14) FROM test_1t WHERE id<>2 GROUP BY(class);
ANY_VALUE(name)	class	ANY_VALUE(age<>14)
aa	三一	1
cc	三二	0
ee	三三	1
ee	三四	1
SELECT ANY_VALUE(name),class,ANY_VALUE(age) FROM test_1t WHERE name!='ee' GROUP BY(class);
ANY_VALUE(name)	class	ANY_VALUE(age)
aa	三一	13
cc	三二	14
SELECT ANY_VALUE(name),class,ANY_VALUE(age!=14) FROM test_1t WHERE name!='ee' GROUP BY(class);
ANY_VALUE(name)	class	ANY_VALUE(age!=14)
aa	三一	1
cc	三二	0
SELECT ANY_VALUE(name),class,ANY_VALUE(age) FROM test_1t WHERE id<4||id>6 GROUP BY(class);
ANY_VALUE(name)	class	ANY_VALUE(age)
aa	三一	13
cc	三二	14
ee	三四	13
SELECT ANY_VALUE(name),class,ANY_VALUE(age>15||age<14) FROM test_1t WHERE id<4||id>6 GROUP BY(class);
ANY_VALUE(name)	class	ANY_VALUE(age>15||age<14)
aa	三一	1
cc	三二	0
ee	三四	1
SELECT ANY_VALUE(name),class,ANY_VALUE(age) FROM test_1t WHERE id = ANY(SELECT id FROM test_1t WHERE name='ee') GROUP BY(class);
ANY_VALUE(name)	class	ANY_VALUE(age)
ee	三三	15
ee	三四	13
SELECT ANY_VALUE(name),class,ANY_VALUE(age > ANY(SELECT age FROM test_1t WHERE id=1)) FROM test_1t GROUP BY(class);
ANY_VALUE(name)	class	ANY_VALUE(age > ANY(SELECT age FROM test_1t WHERE id=1))
aa	三一	0
cc	三二	1
ee	三三	1
ee	三四	0
SELECT ANY_VALUE(name),class,ANY_VALUE(age) FROM test_1t WHERE id = SOME(SELECT id FROM test_1t WHERE name='ee') GROUP BY(class);
ANY_VALUE(name)	class	ANY_VALUE(age)
ee	三三	15
ee	三四	13
SELECT ANY_VALUE(name),class,ANY_VALUE(age > SOME(SELECT age FROM test_1t WHERE id=1)) FROM test_1t GROUP BY(class);
ANY_VALUE(name)	class	ANY_VALUE(age > SOME(SELECT age FROM test_1t WHERE id=1))
aa	三一	0
cc	三二	1
ee	三三	1
ee	三四	0
SELECT ANY_VALUE(name),class,ANY_VALUE(age) FROM test_1t WHERE id > ALL(SELECT id FROM test_1t WHERE name='aa') GROUP BY(class);
ANY_VALUE(name)	class	ANY_VALUE(age)
cc	三二	14
ee	三三	15
ee	三四	13
SELECT ANY_VALUE(name),class,ANY_VALUE(age > ALL(SELECT age FROM test_1t WHERE id=1)) FROM test_1t GROUP BY(class);
ANY_VALUE(name)	class	ANY_VALUE(age > ALL(SELECT age FROM test_1t WHERE id=1))
aa	三一	0
cc	三二	1
ee	三三	1
ee	三四	0
SELECT ANY_VALUE(name),class,ANY_VALUE(age) FROM test_1t WHERE name LIKE '%e' GROUP BY(class);
ANY_VALUE(name)	class	ANY_VALUE(age)
ee	三三	15
ee	三四	13
SELECT ANY_VALUE(name LIKE '%e'),class,ANY_VALUE(age) FROM test_1t GROUP BY(class);
ANY_VALUE(name LIKE '%e')	class	ANY_VALUE(age)
0	三一	13
0	三二	14
1	三三	15
1	三四	13
SELECT ANY_VALUE(name),class,ANY_VALUE(age) FROM test_1t WHERE age REGEXP '3|5' GROUP BY(class);
ANY_VALUE(name)	class	ANY_VALUE(age)
aa	三一	13
ee	三三	15
ee	三四	13
SELECT ANY_VALUE(name REGEXP 'a|c'),class,ANY_VALUE(age) FROM test_1t GROUP BY(class);
ANY_VALUE(name REGEXP 'a|c')	class	ANY_VALUE(age)
1	三一	13
1	三二	14
0	三三	15
0	三四	13
CREATE TABLE test_2t(id int primary key,name VARCHAR(20),class VARCHAR(20));
INSERT INTO test_2t VALUES(1,'a','三一'),
(2,'a','三一'),
(3,'cc',NULL),
(4,'ee',NULL),
(5,'ee',NULL),
(6,'ff','三三'),
(7,'ee',NULL);
SELECT * FROM test_2t;
id	name	class
1	a	三一
2	a	三一
3	cc	NULL
4	ee	NULL
5	ee	NULL
6	ff	三三
7	ee	NULL
SELECT ANY_VALUE(name),class,ANY_VALUE(age) FROM test_1t WHERE EXISTS(SELECT name FROM test_2t WHERE name=test_1t.name) GROUP BY(class);
ANY_VALUE(name)	class	ANY_VALUE(age)
cc	三二	14
ee	三三	15
ee	三四	13
SELECT ANY_VALUE(EXISTS(SELECT name FROM test_2t WHERE name=test_1t.name) ),class,ANY_VALUE(age) FROM test_1t GROUP BY(class);
ANY_VALUE(EXISTS(SELECT name FROM test_2t WHERE name=test_1t.name) )	class	ANY_VALUE(age)
0	三一	13
1	三二	14
1	三三	15
1	三四	13
UPDATE test_2t SET class=NULL WHERE id IN(3,4,5,7);
SELECT * FROM test_2t;
id	name	class
1	a	三一
2	a	三一
3	cc	NULL
4	ee	NULL
5	ee	NULL
6	ff	三三
7	ee	NULL
SELECT ANY_VALUE(name),class FROM test_2t WHERE class IS NULL GROUP BY(class);
ANY_VALUE(name)	class
cc	NULL
SELECT ANY_VALUE(name),ANY_VALUE(ISNULL(class)) FROM test_2t GROUP BY(class);
ANY_VALUE(name)	ANY_VALUE(ISNULL(class))
a	0
cc	1
ff	0
SELECT ANY_VALUE(name),class FROM test_2t WHERE class IS NOT NULL GROUP BY(class);
ANY_VALUE(name)	class
a	三一
ff	三三
SELECT ANY_VALUE(name),ANY_VALUE(class IS NOT NULL) FROM test_2t GROUP BY(class);
ANY_VALUE(name)	ANY_VALUE(class IS NOT NULL)
a	1
cc	0
ff	1
SELECT ANY_VALUE(name),class FROM test_2t WHERE id IN(1,2,4,5,7) GROUP BY(class);
ANY_VALUE(name)	class
a	三一
ee	NULL
SELECT ANY_VALUE(name IN('a')),class FROM test_2t GROUP BY(class);
ANY_VALUE(name IN('a'))	class
1	三一
0	NULL
0	三三
SELECT ANY_VALUE(name),class FROM test_2t WHERE id NOT IN(3,6) GROUP BY(class);
ANY_VALUE(name)	class
a	三一
ee	NULL
SELECT ANY_VALUE(name NOT IN('a')),class FROM test_2t GROUP BY(class);
ANY_VALUE(name NOT IN('a'))	class
0	三一
1	NULL
1	三三
SELECT ANY_VALUE(name),class FROM test_1t WHERE id BETWEEN 1 AND 6 GROUP BY(class);
ANY_VALUE(name)	class
aa	三一
cc	三二
ee	三三
SELECT ANY_VALUE(name),class,ANY_VALUE(age BETWEEN 12 AND 14) FROM test_1t GROUP BY(class);
ANY_VALUE(name)	class	ANY_VALUE(age BETWEEN 12 AND 14)
aa	三一	1
cc	三二	1
ee	三三	0
ee	三四	1
SELECT ANY_VALUE(name)+'n',class,ANY_VALUE(age)+1 FROM test_1t GROUP BY(class);
ANY_VALUE(name)+'n'	class	ANY_VALUE(age)+1
0	三一	14
0	三二	15
0	三三	16
0	三四	14
Warnings:
Warning	1292	Truncated incorrect DOUBLE value: 'aa'
Warning	1292	Truncated incorrect DOUBLE value: 'cc'
Warning	1292	Truncated incorrect DOUBLE value: 'ee'
Warning	1292	Truncated incorrect DOUBLE value: 'ee'
Warning	1292	Truncated incorrect DOUBLE value: 'n'
SELECT ANY_VALUE(name)-'n',class,ANY_VALUE(age)-1 FROM test_1t GROUP BY(class);
ANY_VALUE(name)-'n'	class	ANY_VALUE(age)-1
0	三一	12
0	三二	13
0	三三	14
0	三四	12
Warnings:
Warning	1292	Truncated incorrect DOUBLE value: 'aa'
Warning	1292	Truncated incorrect DOUBLE value: 'cc'
Warning	1292	Truncated incorrect DOUBLE value: 'ee'
Warning	1292	Truncated incorrect DOUBLE value: 'ee'
Warning	1292	Truncated incorrect DOUBLE value: 'n'
SELECT ANY_VALUE(name)*n,class,ANY_VALUE(age)*2 FROM test_1t GROUP BY(class);
ERROR 42S22: Unknown column 'n' in 'field list'
SELECT ANY_VALUE(name),class,ANY_VALUE(age)*2 FROM test_1t GROUP BY(class);
ANY_VALUE(name)	class	ANY_VALUE(age)*2
aa	三一	26
cc	三二	28
ee	三三	30
ee	三四	26
SELECT ANY_VALUE(name)/'b',class,ANY_VALUE(age)/2 FROM test_1t GROUP BY(class);
ANY_VALUE(name)/'b'	class	ANY_VALUE(age)/2
NULL	三一	6.5000
NULL	三二	7.0000
NULL	三三	7.5000
NULL	三四	6.5000
Warnings:
Warning	1292	Truncated incorrect DOUBLE value: 'aa'
Warning	1292	Truncated incorrect DOUBLE value: 'cc'
Warning	1292	Truncated incorrect DOUBLE value: 'ee'
Warning	1292	Truncated incorrect DOUBLE value: 'ee'
Warning	1292	Truncated incorrect DOUBLE value: 'b'
SELECT * FROM test_1t;
id	name	class	age
1	aa	三一	13
2	aa	三一	12
3	cc	三二	14
4	cc	三二	14
5	ee	三三	15
6	ee	三三	15
7	ee	三四	13
SELECT ANY_VALUE(name) AND age,class FROM test_1t WHERE name NOT IN('ee')  GROUP BY(class);
ERROR 42000: nonaggregated column 'db_test.test_1t.age' is not functionally dependent on columns in GROUP BY clause; this is incompatible with sql_mode=only_full_group_by
SELECT ANY_VALUE(name) OR age,class FROM test_1t WHERE name NOT IN('ee')  GROUP BY(class);
ERROR 42000: nonaggregated column 'db_test.test_1t.age' is not functionally dependent on columns in GROUP BY clause; this is incompatible with sql_mode=only_full_group_by
SELECT ANY_VALUE(name) NOT age,class FROM test_1t WHERE name NOT IN('ee')  GROUP BY(class);
ERROR 42000: You have an error in your SQL syntax; check the manual that corresponds to your OceanBase version for the right syntax to use near 'age,class FROM test_1t WHERE name NOT IN('ee')  GROUP BY(class)' at line 1
SELECT ANY_VALUE(name),class,ANY_VALUE(age)=15 FROM test_1t WHERE name='ee' GROUP BY(class);
ANY_VALUE(name)	class	ANY_VALUE(age)=15
ee	三三	1
ee	三四	0
SELECT ANY_VALUE(name),class,ANY_VALUE(age)>=13 FROM test_1t WHERE id>=2 GROUP BY(class);
ANY_VALUE(name)	class	ANY_VALUE(age)>=13
aa	三一	0
cc	三二	1
ee	三三	1
ee	三四	1
SELECT ANY_VALUE(name),class,ANY_VALUE(age)>=15 FROM test_1t WHERE id<=5 GROUP BY(class);
ANY_VALUE(name)	class	ANY_VALUE(age)>=15
aa	三一	0
cc	三二	0
ee	三三	1
SELECT ANY_VALUE(name),class,ANY_VALUE(age)>15 FROM test_1t WHERE id<5 GROUP BY(class);
ANY_VALUE(name)	class	ANY_VALUE(age)>15
aa	三一	0
cc	三二	0
SELECT ANY_VALUE(name),class,ANY_VALUE(age)<>14 FROM test_1t WHERE id<>2 GROUP BY(class);
ANY_VALUE(name)	class	ANY_VALUE(age)<>14
aa	三一	1
cc	三二	0
ee	三三	1
ee	三四	1
SELECT ANY_VALUE(name),class,ANY_VALUE(age)!=14 FROM test_1t WHERE name!='ee' GROUP BY(class);
ANY_VALUE(name)	class	ANY_VALUE(age)!=14
aa	三一	1
cc	三二	0
SELECT ANY_VALUE(name),class,ANY_VALUE(age)>15||ANY_VALUE(age)<14 FROM test_1t WHERE id<4||id>6 GROUP BY(class);
ANY_VALUE(name)	class	ANY_VALUE(age)>15||ANY_VALUE(age)<14
aa	三一	1
cc	三二	0
ee	三四	1
SELECT ANY_VALUE(name),class,ANY_VALUE(age) > ANY(SELECT age FROM test_1t WHERE id=1) FROM test_1t GROUP BY(class);
ANY_VALUE(name)	class	ANY_VALUE(age) > ANY(SELECT age FROM test_1t WHERE id=1)
aa	三一	0
cc	三二	1
ee	三三	1
ee	三四	0
SELECT ANY_VALUE(name),class,ANY_VALUE(age) > SOME(SELECT age FROM test_1t WHERE id=1) FROM test_1t GROUP BY(class);
ANY_VALUE(name)	class	ANY_VALUE(age) > SOME(SELECT age FROM test_1t WHERE id=1)
aa	三一	0
cc	三二	1
ee	三三	1
ee	三四	0
SELECT ANY_VALUE(name),class,ANY_VALUE(age) > ALL(SELECT age FROM test_1t WHERE id=1) FROM test_1t GROUP BY(class);
ANY_VALUE(name)	class	ANY_VALUE(age) > ALL(SELECT age FROM test_1t WHERE id=1)
aa	三一	0
cc	三二	1
ee	三三	1
ee	三四	0
SELECT ANY_VALUE(name) LIKE '%e',class,ANY_VALUE(age) FROM test_1t GROUP BY(class);
ANY_VALUE(name) LIKE '%e'	class	ANY_VALUE(age)
0	三一	13
0	三二	14
1	三三	15
1	三四	13
SELECT ANY_VALUE(name) REGEXP 'a|c',class,ANY_VALUE(age) FROM test_1t GROUP BY(class);
ANY_VALUE(name) REGEXP 'a|c'	class	ANY_VALUE(age)
1	三一	13
1	三二	14
0	三三	15
0	三四	13
UPDATE test_2t SET class='三二' WHERE id IN(3,4);
UPDATE test_2t SET class='三三' WHERE id=5;
UPDATE test_2t SET class='三四' WHERE id=7;
SELECT * FROM test_2t;
id	name	class
1	a	三一
2	a	三一
3	cc	三二
4	ee	三二
5	ee	三三
6	ff	三三
7	ee	三四
SELECT ANY_VALUE(name) EXISTS(SELECT name FROM test_2t WHERE name=test_1t.name) ,class,ANY_VALUE(age) FROM test_1t GROUP BY(class);
ERROR 42000: You have an error in your SQL syntax; check the manual that corresponds to your OceanBase version for the right syntax to use near 'EXISTS(SELECT name FROM test_2t WHERE name=test_1t.name) ,class,ANY_VALUE(age) F' at line 1
UPDATE test_2t SET class=NULL WHERE id IN(3,4,5,7);
SELECT * FROM test_2t;
id	name	class
1	a	三一
2	a	三一
3	cc	NULL
4	ee	NULL
5	ee	NULL
6	ff	三三
7	ee	NULL
SELECT ANY_VALUE(name),ANY_VALUE(class) IS NULL(class) FROM test_2t GROUP BY(class);
ERROR 42000: You have an error in your SQL syntax; check the manual that corresponds to your OceanBase version for the right syntax to use near '(class) FROM test_2t GROUP BY(class)' at line 1
SELECT ANY_VALUE(name),IS NULL(ANY_VALUE(class)) FROM test_2t GROUP BY(class);
ERROR 42000: You have an error in your SQL syntax; check the manual that corresponds to your OceanBase version for the right syntax to use near 'NULL(ANY_VALUE(class)) FROM test_2t GROUP BY(class)' at line 1
SELECT ANY_VALUE(name),ANY_VALUE(class) IS NULL FROM test_2t GROUP BY(class);
ANY_VALUE(name)	ANY_VALUE(class) IS NULL
a	0
cc	1
ff	0
SELECT ANY_VALUE(name),ANY_VALUE(class) IS NOT NULL FROM test_2t GROUP BY(class);
ANY_VALUE(name)	ANY_VALUE(class) IS NOT NULL
a	1
cc	0
ff	1
SELECT ANY_VALUE(name),IS NOT NULL(ANY_VALUE(class) ) FROM test_2t GROUP BY(class);
ERROR 42000: You have an error in your SQL syntax; check the manual that corresponds to your OceanBase version for the right syntax to use near 'NOT NULL(ANY_VALUE(class) ) FROM test_2t GROUP BY(class)' at line 1
SELECT ANY_VALUE(name),ANY_VALUE(class) IS NOT NULL(class) FROM test_2t GROUP BY(class);
ERROR 42000: You have an error in your SQL syntax; check the manual that corresponds to your OceanBase version for the right syntax to use near '(class) FROM test_2t GROUP BY(class)' at line 1
SELECT ANY_VALUE(name) IN('a'),class FROM test_2t GROUP BY(class);
ANY_VALUE(name) IN('a')	class
1	三一
0	NULL
0	三三
SELECT ANY_VALUE(name) NOT IN('a'),class FROM test_2t GROUP BY(class);
ANY_VALUE(name) NOT IN('a')	class
0	三一
1	NULL
1	三三
SELECT ANY_VALUE(name),class,ANY_VALUE(age) BETWEEN 12 AND 14 FROM test_1t GROUP BY(class);
ANY_VALUE(name)	class	ANY_VALUE(age) BETWEEN 12 AND 14
aa	三一	1
cc	三二	1
ee	三三	0
ee	三四	1
DROP TABLE test_2t;
DROP TABLE test_1t;
DROP DATABASE db_test;
