set sql_mode = 'ONLY_FULL_GROUP_BY,STRICT_TRANS_TABLES';
SELECT @@SESSION.SQL_MODE;
@@SESSION.SQL_MODE
ONLY_FULL_GROUP_BY,STRICT_TRANS_TABLES
CREATE DATABASE IF NOT EXISTS db_test DEFAULT CHARSET utf8 COLLATE utf8_general_ci;
USE db_test;
# 环境清理
DROP TABLE test_2t CASCADE;
ERROR 42S02: Unknown table 'db_test.test_2t'
DROP TABLE test_1t CASCADE;
ERROR 42S02: Unknown table 'db_test.test_1t'
CREATE TABLE test_1t(id int,name VARCHAR(20),pdate DATETIME,class VARCHAR(20),age int);
INSERT INTO test_1t VALUES(1,'aa','2021-07-27 14:59:31','三一',11);
INSERT INTO test_1t VALUES(2,'aa','2021-07-28 14:59:31','三一',12);
INSERT INTO test_1t VALUES(3,'cc','2021-07-29 14:59:31','三二',14);
INSERT INTO test_1t VALUES(4,'cc','2021-07-27 14:59:31','三二',15);
INSERT INTO test_1t VALUES(5,'ee','2021-07-27 14:59:31','三三',17);
INSERT INTO test_1t VALUES(6,'ee','2021-07-17 14:59:31','三三',16);
INSERT INTO test_1t VALUES(7,'ee','2021-07-07 14:59:31','三三',14);
INSERT INTO test_1t VALUES(8,'aa','2021-07-27 14:59:31','三一',14);
INSERT INTO test_1t VALUES(9,'aa','2021-07-28 14:59:31','三一',12);
INSERT INTO test_1t VALUES(10,'cc','2021-07-29 14:59:31','三二',13);
INSERT INTO test_1t VALUES(11,'cc','2021-07-27 14:59:31','三二',15);
INSERT INTO test_1t VALUES(12,'ee','2021-07-27 14:59:31','三三',15);
INSERT INTO test_1t VALUES(13,'ee','2021-07-17 14:59:31','三三',10);
INSERT INTO test_1t VALUES(14,'ee','2021-07-07 14:59:31','三三',11);
INSERT INTO test_1t VALUES(15,'dd','2021-07-28 14:59:31','三四',12);
INSERT INTO test_1t VALUES(16,'dd','2021-07-29 14:59:31','三四',18);
INSERT INTO test_1t VALUES(17,'dd','2021-07-27 14:59:31','三五',15);
INSERT INTO test_1t VALUES(18,'ff','2021-07-27 14:59:31','三五',15);
INSERT INTO test_1t VALUES(19,'gg','2021-07-17 14:59:31','三五',16);
INSERT INTO test_1t VALUES(20,'gg','2021-07-07 14:59:31','三五',16);
SELECT * FROM test_1t;
id	name	pdate	class	age
1	aa	2021-07-27 14:59:31	三一	11
2	aa	2021-07-28 14:59:31	三一	12
3	cc	2021-07-29 14:59:31	三二	14
4	cc	2021-07-27 14:59:31	三二	15
5	ee	2021-07-27 14:59:31	三三	17
6	ee	2021-07-17 14:59:31	三三	16
7	ee	2021-07-07 14:59:31	三三	14
8	aa	2021-07-27 14:59:31	三一	14
9	aa	2021-07-28 14:59:31	三一	12
10	cc	2021-07-29 14:59:31	三二	13
11	cc	2021-07-27 14:59:31	三二	15
12	ee	2021-07-27 14:59:31	三三	15
13	ee	2021-07-17 14:59:31	三三	10
14	ee	2021-07-07 14:59:31	三三	11
15	dd	2021-07-28 14:59:31	三四	12
16	dd	2021-07-29 14:59:31	三四	18
17	dd	2021-07-27 14:59:31	三五	15
18	ff	2021-07-27 14:59:31	三五	15
19	gg	2021-07-17 14:59:31	三五	16
20	gg	2021-07-07 14:59:31	三五	16
CREATE VIEW test_1v AS SELECT name,class FROM test_1t GROUP BY(class);
ERROR 42000: nonaggregated column 'db_test.test_1t.name' is not functionally dependent on columns in GROUP BY clause; this is incompatible with sql_mode=only_full_group_by
CREATE VIEW test_1v AS SELECT ANY_VALUE(name),class FROM test_1t GROUP BY(class);
SELECT * FROM test_1v;
ANY_VALUE(name)	class
aa	三一
cc	三二
ee	三三
dd	三四
dd	三五
DROP VIEW test_1v;
CREATE VIEW test_1v AS SELECT name,class FROM test_1t WHERE age >=(SELECT AVG(age) FROM test_1t) GROUP BY(class);
ERROR 42000: nonaggregated column 'db_test.test_1t.name' is not functionally dependent on columns in GROUP BY clause; this is incompatible with sql_mode=only_full_group_by
CREATE OR REPLACE VIEW test_1v AS SELECT ANY_VALUE(name),class FROM test_1t WHERE age >(SELECT AVG(age) FROM test_1t) GROUP BY(class);
SELECT * FROM test_1v;
ANY_VALUE(name)	class
cc	三二
ee	三三
dd	三四
dd	三五
DROP VIEW test_1v;
CREATE OR REPLACE VIEW test_1v AS SELECT name,class FROM test_1t WHERE age IN((SELECT ANY_VALUE(age) FROM test_1t WHERE age<15) UNION (SELECT age FROM test_1t WHERE age>15)) GROUP BY(class) HAVING class IN('三一','三三','三五');
ERROR 42000: nonaggregated column 'db_test.test_1t.name' is not functionally dependent on columns in GROUP BY clause; this is incompatible with sql_mode=only_full_group_by
CREATE OR REPLACE VIEW test_1v AS SELECT ANY_VALUE(name),class FROM test_1t WHERE age IN((SELECT ANY_VALUE(age) FROM test_1t WHERE age<15) UNION (SELECT age FROM test_1t WHERE age>15)) GROUP BY(class) HAVING class IN('三一','三三','三五');
SELECT * FROM test_1v;
ANY_VALUE(name)	class
aa	三一
ee	三三
gg	三五
DROP VIEW test_1v;
CREATE OR REPLACE VIEW test_1v AS SELECT name,class FROM (SELECT name,class FROM test_1t WHERE age IN((SELECT ANY_VALUE(age) FROM test_1t WHERE age<15) UNION (SELECT age FROM test_1t WHERE age>15)) GROUP BY(class) HAVING class IN('三一','三三','三五')) AS t1;
ERROR 42000: nonaggregated column 'db_test.test_1t.name' is not functionally dependent on columns in GROUP BY clause; this is incompatible with sql_mode=only_full_group_by
CREATE OR REPLACE VIEW test_1v AS SELECT name,class FROM (SELECT ANY_VALUE(name) AS name,class FROM test_1t WHERE age IN((SELECT ANY_VALUE(age) FROM test_1t WHERE age<15) UNION (SELECT age FROM test_1t WHERE age>15)) GROUP BY(class) HAVING class IN('三一','三三','三五')) AS t1;
SELECT * FROM test_1v;
name	class
aa	三一
ee	三三
gg	三五
DROP VIEW test_1v;
CREATE OR REPLACE VIEW test_1v AS SELECT name,class FROM test_1t WHERE EXISTS(SELECT name,class FROM test_1t GROUP BY(class));
ERROR 42000: nonaggregated column 'db_test.test_1t.name' is not functionally dependent on columns in GROUP BY clause; this is incompatible with sql_mode=only_full_group_by
CREATE OR REPLACE VIEW test_1v AS SELECT name,class FROM test_1t WHERE EXISTS(SELECT ANY_VALUE(name) AS name,class FROM test_1t GROUP BY(class) HAVING class IN('三一'));
SELECT * FROM test_1v;
name	class
aa	三一
aa	三一
cc	三二
cc	三二
ee	三三
ee	三三
ee	三三
aa	三一
aa	三一
cc	三二
cc	三二
ee	三三
ee	三三
ee	三三
dd	三四
dd	三四
dd	三五
ff	三五
gg	三五
gg	三五
DROP VIEW test_1v;
CREATE OR REPLACE VIEW test_1v AS SELECT * FROM test_1t;
CREATE TABLE test_2t(id int,name VARCHAR(20),pdate DATETIME,class VARCHAR(20),age int);
CREATE OR REPLACE VIEW test_2v AS SELECT * FROM test_2t;
SELECT * FROM test_1v;
id	name	pdate	class	age
1	aa	2021-07-27 14:59:31	三一	11
2	aa	2021-07-28 14:59:31	三一	12
3	cc	2021-07-29 14:59:31	三二	14
4	cc	2021-07-27 14:59:31	三二	15
5	ee	2021-07-27 14:59:31	三三	17
6	ee	2021-07-17 14:59:31	三三	16
7	ee	2021-07-07 14:59:31	三三	14
8	aa	2021-07-27 14:59:31	三一	14
9	aa	2021-07-28 14:59:31	三一	12
10	cc	2021-07-29 14:59:31	三二	13
11	cc	2021-07-27 14:59:31	三二	15
12	ee	2021-07-27 14:59:31	三三	15
13	ee	2021-07-17 14:59:31	三三	10
14	ee	2021-07-07 14:59:31	三三	11
15	dd	2021-07-28 14:59:31	三四	12
16	dd	2021-07-29 14:59:31	三四	18
17	dd	2021-07-27 14:59:31	三五	15
18	ff	2021-07-27 14:59:31	三五	15
19	gg	2021-07-17 14:59:31	三五	16
20	gg	2021-07-07 14:59:31	三五	16
SELECT * FROM test_2v;
id	name	pdate	class	age
INSERT INTO test_2v(name,class)SELECT name,class FROM test_1v GROUP BY(class);
ERROR 42000: nonaggregated column 'db_test.test_1v.name' is not functionally dependent on columns in GROUP BY clause; this is incompatible with sql_mode=only_full_group_by
INSERT INTO test_2v(name,class)SELECT ANY_VALUE(name),class FROM test_1v GROUP BY(class);
SELECT * FROM test_2v;
id	name	pdate	class	age
NULL	aa	NULL	三一	NULL
NULL	cc	NULL	三二	NULL
NULL	ee	NULL	三三	NULL
NULL	dd	NULL	三四	NULL
NULL	dd	NULL	三五	NULL
SELECT * FROM test_2t;
id	name	pdate	class	age
NULL	aa	NULL	三一	NULL
NULL	cc	NULL	三二	NULL
NULL	ee	NULL	三三	NULL
NULL	dd	NULL	三四	NULL
NULL	dd	NULL	三五	NULL
DELETE FROM test_2v;
INSERT INTO test_2v(name,class)SELECT ANY_VALUE(name),class FROM test_1v WHERE EXISTS(SELECT ANY_VALUE(name) AS name,class FROM test_1v WHERE age IN((SELECT ANY_VALUE(age) FROM test_1v WHERE age<15) UNION (SELECT age FROM test_1v WHERE age>15)) GROUP BY(class) HAVING class IN('三一','三三','三五'));
SELECT * FROM test_2v;
id	name	pdate	class	age
NULL	aa	NULL	三一	NULL
NULL	aa	NULL	三一	NULL
NULL	cc	NULL	三二	NULL
NULL	cc	NULL	三二	NULL
NULL	ee	NULL	三三	NULL
NULL	ee	NULL	三三	NULL
NULL	ee	NULL	三三	NULL
NULL	aa	NULL	三一	NULL
NULL	aa	NULL	三一	NULL
NULL	cc	NULL	三二	NULL
NULL	cc	NULL	三二	NULL
NULL	ee	NULL	三三	NULL
NULL	ee	NULL	三三	NULL
NULL	ee	NULL	三三	NULL
NULL	dd	NULL	三四	NULL
NULL	dd	NULL	三四	NULL
NULL	dd	NULL	三五	NULL
NULL	ff	NULL	三五	NULL
NULL	gg	NULL	三五	NULL
NULL	gg	NULL	三五	NULL
SELECT * FROM test_2t;
id	name	pdate	class	age
NULL	aa	NULL	三一	NULL
NULL	aa	NULL	三一	NULL
NULL	cc	NULL	三二	NULL
NULL	cc	NULL	三二	NULL
NULL	ee	NULL	三三	NULL
NULL	ee	NULL	三三	NULL
NULL	ee	NULL	三三	NULL
NULL	aa	NULL	三一	NULL
NULL	aa	NULL	三一	NULL
NULL	cc	NULL	三二	NULL
NULL	cc	NULL	三二	NULL
NULL	ee	NULL	三三	NULL
NULL	ee	NULL	三三	NULL
NULL	ee	NULL	三三	NULL
NULL	dd	NULL	三四	NULL
NULL	dd	NULL	三四	NULL
NULL	dd	NULL	三五	NULL
NULL	ff	NULL	三五	NULL
NULL	gg	NULL	三五	NULL
NULL	gg	NULL	三五	NULL
DELETE FROM test_2v;
INSERT INTO test_2v(name,class)SELECT name,class FROM (SELECT ANY_VALUE(name) AS name,class FROM test_1v WHERE age IN((SELECT ANY_VALUE(age) FROM test_1v WHERE age<15) UNION (SELECT age FROM test_1v WHERE age>15)) GROUP BY(class) HAVING class IN('三一','三三','三五')) AS t1;
SELECT * FROM test_2v;
id	name	pdate	class	age
NULL	aa	NULL	三一	NULL
NULL	ee	NULL	三三	NULL
NULL	gg	NULL	三五	NULL
SELECT * FROM test_2t;
id	name	pdate	class	age
NULL	aa	NULL	三一	NULL
NULL	ee	NULL	三三	NULL
NULL	gg	NULL	三五	NULL
UPDATE test_2v SET name='A';
SELECT * FROM test_2v;
id	name	pdate	class	age
NULL	A	NULL	三一	NULL
NULL	A	NULL	三三	NULL
NULL	A	NULL	三五	NULL
SELECT * FROM test_2t;
id	name	pdate	class	age
NULL	A	NULL	三一	NULL
NULL	A	NULL	三三	NULL
NULL	A	NULL	三五	NULL
UPDATE test_2v v2,(SELECT name,class FROM test_1v GROUP BY(class)) v1 SET v2.name=v1.name WHERE v1.class=v2.class;
ERROR 42000: nonaggregated column 'db_test.test_1v.name' is not functionally dependent on columns in GROUP BY clause; this is incompatible with sql_mode=only_full_group_by
SELECT * FROM test_2v;
id	name	pdate	class	age
NULL	A	NULL	三一	NULL
NULL	A	NULL	三三	NULL
NULL	A	NULL	三五	NULL
SELECT * FROM test_2t;
id	name	pdate	class	age
NULL	A	NULL	三一	NULL
NULL	A	NULL	三三	NULL
NULL	A	NULL	三五	NULL
UPDATE test_2v v2,(SELECT ANY_VALUE(name) AS name,class FROM test_1v GROUP BY(class)) v1 SET v2.name=v1.name WHERE v1.class=v2.class;
SELECT * FROM test_2v;
id	name	pdate	class	age
NULL	aa	NULL	三一	NULL
NULL	ee	NULL	三三	NULL
NULL	dd	NULL	三五	NULL
SELECT * FROM test_2t;
id	name	pdate	class	age
NULL	aa	NULL	三一	NULL
NULL	ee	NULL	三三	NULL
NULL	dd	NULL	三五	NULL
UPDATE test_2v SET name='a';
SELECT * FROM test_2v;
id	name	pdate	class	age
NULL	a	NULL	三一	NULL
NULL	a	NULL	三三	NULL
NULL	a	NULL	三五	NULL
SELECT * FROM test_2t;
id	name	pdate	class	age
NULL	a	NULL	三一	NULL
NULL	a	NULL	三三	NULL
NULL	a	NULL	三五	NULL
UPDATE test_2v v2,(SELECT name,class FROM test_1v WHERE age IN((SELECT ANY_VALUE(age) FROM test_1v WHERE age<15) UNION (SELECT age FROM test_1v WHERE age>15)) GROUP BY(class) HAVING class IN('三一')) v1 SET v2.name=v1.name WHERE v1.class=v2.class;
ERROR 42000: nonaggregated column 'db_test.test_1v.name' is not functionally dependent on columns in GROUP BY clause; this is incompatible with sql_mode=only_full_group_by
SELECT * FROM test_2v;
id	name	pdate	class	age
NULL	a	NULL	三一	NULL
NULL	a	NULL	三三	NULL
NULL	a	NULL	三五	NULL
SELECT * FROM test_2t;
id	name	pdate	class	age
NULL	a	NULL	三一	NULL
NULL	a	NULL	三三	NULL
NULL	a	NULL	三五	NULL
UPDATE test_2v v2,(SELECT ANY_VALUE(name) AS name,class FROM test_1v WHERE age IN((SELECT ANY_VALUE(age) FROM test_1v WHERE age<15) UNION (SELECT age FROM test_1v WHERE age>15)) GROUP BY(class) HAVING class IN('三一')) v1 SET v2.name=v1.name WHERE v1.class=v2.class;
SELECT * FROM test_2v;
id	name	pdate	class	age
NULL	aa	NULL	三一	NULL
NULL	a	NULL	三三	NULL
NULL	a	NULL	三五	NULL
SELECT * FROM test_2t;
id	name	pdate	class	age
NULL	aa	NULL	三一	NULL
NULL	a	NULL	三三	NULL
NULL	a	NULL	三五	NULL
UPDATE test_2v SET name='B' WHERE class IN(SELECT class FROM test_1v GROUP BY(name));
ERROR 42000: nonaggregated column 'db_test.test_1v.class' is not functionally dependent on columns in GROUP BY clause; this is incompatible with sql_mode=only_full_group_by
UPDATE test_2v SET name='C' WHERE class IN(SELECT ANY_VALUE(class) FROM test_1v GROUP BY(name));
SELECT * FROM test_2t;
id	name	pdate	class	age
NULL	C	NULL	三一	NULL
NULL	C	NULL	三三	NULL
NULL	C	NULL	三五	NULL
UPDATE test_2v SET name='a' WHERE class IN(SELECT class FROM (SELECT ANY_VALUE(name) AS name,class FROM test_1v WHERE age IN((SELECT ANY_VALUE(age) FROM test_1v WHERE age<15) UNION (SELECT age FROM test_1v WHERE age>15)) GROUP BY(class) HAVING class IN('三一','三三','三五')) AS v1);
SELECT * FROM test_2v;
id	name	pdate	class	age
NULL	a	NULL	三一	NULL
NULL	a	NULL	三三	NULL
NULL	a	NULL	三五	NULL
DELETE FROM test_2v;
INSERT INTO test_2v VALUES(1,'AA','2021-07-27 14:59:31','三一',11);
INSERT INTO test_2v VALUES(2,'BB','2021-07-28 14:59:31','三一',12);
INSERT INTO test_2v VALUES(3,'CC','2021-07-29 14:59:31','三九',14);
SELECT * FROM test_2v;
id	name	pdate	class	age
1	AA	2021-07-27 14:59:31	三一	11
2	BB	2021-07-28 14:59:31	三一	12
3	CC	2021-07-29 14:59:31	三九	14
DELETE FROM test_2v  WHERE class IN(SELECT class FROM test_1v GROUP BY(name));
ERROR 42000: nonaggregated column 'db_test.test_1v.class' is not functionally dependent on columns in GROUP BY clause; this is incompatible with sql_mode=only_full_group_by
SELECT * FROM test_2v;
id	name	pdate	class	age
1	AA	2021-07-27 14:59:31	三一	11
2	BB	2021-07-28 14:59:31	三一	12
3	CC	2021-07-29 14:59:31	三九	14
DELETE FROM test_2v  WHERE class IN(SELECT ANY_VALUE(class) FROM test_1v GROUP BY(name));
SELECT * FROM test_2v;
id	name	pdate	class	age
3	CC	2021-07-29 14:59:31	三九	14
INSERT INTO test_2v VALUES(1,'AA','2021-07-27 14:59:31','三一',11);
INSERT INTO test_2v VALUES(2,'BB','2021-07-28 14:59:31','三一',12);
DELETE FROM test_2v WHERE class IN(SELECT class FROM (SELECT ANY_VALUE(name) AS name,class FROM test_1v WHERE age IN((SELECT ANY_VALUE(age) FROM test_1v WHERE age<15) UNION (SELECT age FROM test_1v WHERE age>15)) GROUP BY(class) HAVING class IN('三一','三三','三五')) AS v1);
SELECT * FROM test_2v;
id	name	pdate	class	age
3	CC	2021-07-29 14:59:31	三九	14
DROP TABLE test_2t;
DROP TABLE test_1t;
DROP VIEW test_2v;
DROP VIEW test_1v;
DROP DATABASE db_test;
