result_format: 4

alter system set enable_async_syslog = false;

set @@ob_enable_plan_cache = 0;
drop table if exists t1;
drop table if exists t2;
create table t1 (c1 int, c2 int unsigned,
    c3 tinyint, c4 tinyint unsigned,
    c5 smallint, c6 smallint unsigned,
    c7 mediumint, c8 mediumint unsigned,
    c9 integer, c10 integer unsigned,
    c11 bigint, c12 bigint unsigned,
    c13 float, c14 float unsigned,
    c15 double, c16 double unsigned,
    c17 decimal, c18 decimal unsigned,
    c19 datetime, c20 timestamp,
    c21 year, c22 date, c23 time,
    c24 varchar(30), c25 char(30),
    c26 varbinary(30), c27 binary(30),
    c28 enum("","0","1","2","3","5","6","7","8","9"),
    c29 set("","0","1","2","3","5","6","7","8","9")
    );

select * from t1;
+------+------+------+------+------+------+------+------+------+------+------+------+------+------+------+------+------+------+------+------+------+------+------+------+------+------+------+------+------+
| c1   | c2   | c3   | c4   | c5   | c6   | c7   | c8   | c9   | c10  | c11  | c12  | c13  | c14  | c15  | c16  | c17  | c18  | c19  | c20  | c21  | c22  | c23  | c24  | c25  | c26  | c27  | c28  | c29  |
+------+------+------+------+------+------+------+------+------+------+------+------+------+------+------+------+------+------+------+------+------+------+------+------+------+------+------+------+------+
+------+------+------+------+------+------+------+------+------+------+------+------+------+------+------+------+------+------+------+------+------+------+------+------+------+------+------+------+------+

insert into t1 values(1, 2,
    1, 2,
    1, 2,
    1, 2,
    1, 2,
    1, 2,
    3.1, 4.1,
    5.1, 6.1,
    7.1, 8.1,
    '2019-12-01 12:00:00', '2019-12-13 06:00:00',
    2020,'2020-01-01','12:34:56',
    '9.1', '10.1',
    '9.1', '10.1',
    2, 2);
Warnings:
Warning	1265	Data truncated for column 'c17' at row 1
Warning	1265	Data truncated for column '"test"."t1"."c18"' at row 1
insert into t1 values(-1, 2,
    -1, 2,
    -1, 2,
    -1, 2,
    -1, 2,
    -1, 2,
    -3.6, 4.6,
    -5.6, 6.6,
    -7.6, 8.6,
    '2019-12-11 12:00:00', '2019-12-03 06:00:00',
    2021,'2020-01-11','12:35:56',
    '-9.6', '10.6',
    '-9.6', '10.6',
    '2', '2');
Warnings:
Warning	1265	Data truncated for column 'c17' at row 1
Warning	1265	Data truncated for column '"test"."t1"."c18"' at row 1

insert into t1 values(0, 0,
    0, 0,
    0, 0,
    0, 0,
    0, 0,
    0, 0,
    0, 0,
    0, 0,
    0, 0,
    '2019-12-11 12:00:00', '2019-12-03 06:00:00',
    2021,'2020-01-11','12:35:56',
    '0', '0',
    '0', '0',
    '', '');

select * from t1;
+------+------+------+------+------+------+------+------+------+------+------+------+------+------+------+------+------+------+---------------------+---------------------+------+------------+----------+------+------+------+--------------------------------+------+------+
| c1   | c2   | c3   | c4   | c5   | c6   | c7   | c8   | c9   | c10  | c11  | c12  | c13  | c14  | c15  | c16  | c17  | c18  | c19                 | c20                 | c21  | c22        | c23      | c24  | c25  | c26  | c27                            | c28  | c29  |
+------+------+------+------+------+------+------+------+------+------+------+------+------+------+------+------+------+------+---------------------+---------------------+------+------------+----------+------+------+------+--------------------------------+------+------+
|    1 |    2 |    1 |    2 |    1 |    2 |    1 |    2 |    1 |    2 |    1 |    2 |  3.1 |  4.1 |  5.1 |  6.1 |    7 |    8 | 2019-12-01 12:00:00 | 2019-12-13 06:00:00 | 2020 | 2020-01-01 | 12:34:56 | 9.1  | 10.1 | 9.1  | 10.1                           | 0    | 0    |
|   -1 |    2 |   -1 |    2 |   -1 |    2 |   -1 |    2 |   -1 |    2 |   -1 |    2 | -3.6 |  4.6 | -5.6 |  6.6 |   -8 |    9 | 2019-12-11 12:00:00 | 2019-12-03 06:00:00 | 2021 | 2020-01-11 | 12:35:56 | -9.6 | 10.6 | -9.6 | 10.6                           | 2    | 2    |
|    0 |    0 |    0 |    0 |    0 |    0 |    0 |    0 |    0 |    0 |    0 |    0 |    0 |    0 |    0 |    0 |    0 |    0 | 2019-12-11 12:00:00 | 2019-12-03 06:00:00 | 2021 | 2020-01-11 | 12:35:56 | 0    | 0    | 0    | 0                              |      |      |
+------+------+------+------+------+------+------+------+------+------+------+------+------+------+------+------+------+------+---------------------+---------------------+------+------------+----------+------+------+------+--------------------------------+------+------+

create table t2 (c1 enum("","0","1","2","3","5","6","7","8","9"),
                 c2 set("","0","1","2","3","5","6","7","8","9"));

explain_protocol: 0
#### test add expr and limit operator in new engine
select c28, c29, c28 + c1, c29 + c1 from t1 order by 1, 2, 3;
Catalog	Database	Table	Table_alias	Column	Column_alias	Type	Length	Max length	Is_null	Flags	Decimals	Charsetnr
def	test	t1	t1	c28	c28	254	4	1	Y	0	0	45
def	test	t1	t1	c29	c29	254	72	1	Y	0	0	45
def					c28 + c1	5	23	1	Y	32896	31	63
def					c29 + c1	5	23	1	Y	32896	31	63
+------+------+----------+----------+
| c28  | c29  | c28 + c1 | c29 + c1 |
+------+------+----------+----------+
|      |      |        1 |        0 |
| 0    | 0    |        3 |        3 |
| 2    | 2    |        3 |        7 |
+------+------+----------+----------+
select c28, c29, concat("-", c28, c1, "-"), concat("-", c29, c1, "-") from t1 order by 1, 2, 3;
Catalog	Database	Table	Table_alias	Column	Column_alias	Type	Length	Max length	Is_null	Flags	Decimals	Charsetnr
def	test	t1	t1	c28	c28	254	4	1	Y	0	0	45
def	test	t1	t1	c29	c29	254	72	1	Y	0	0	45
def					concat("-", c28, c1, "-")	253	56	5	Y	0	0	45
def					concat("-", c29, c1, "-")	253	124	5	Y	0	0	45
+------+------+---------------------------+---------------------------+
| c28  | c29  | concat("-", c28, c1, "-") | concat("-", c29, c1, "-") |
+------+------+---------------------------+---------------------------+
|      |      | -0-                       | -0-                       |
| 0    | 0    | -01-                      | -01-                      |
| 2    | 2    | -2-1-                     | -2-1-                     |
+------+------+---------------------------+---------------------------+
select c28, c29, c28 + c2, c29 + c2 from t1 order by 1, 2, 3;
Catalog	Database	Table	Table_alias	Column	Column_alias	Type	Length	Max length	Is_null	Flags	Decimals	Charsetnr
def	test	t1	t1	c28	c28	254	4	1	Y	0	0	45
def	test	t1	t1	c29	c29	254	72	1	Y	0	0	45
def					c28 + c2	5	23	1	Y	32896	31	63
def					c29 + c2	5	23	2	Y	32896	31	63
+------+------+----------+----------+
| c28  | c29  | c28 + c2 | c29 + c2 |
+------+------+----------+----------+
|      |      |        1 |        0 |
| 0    | 0    |        4 |        4 |
| 2    | 2    |        6 |       10 |
+------+------+----------+----------+
select c28, c29, concat("-", c28, c2, "-"), concat("-", c29, c2, "-") from t1 order by 1, 2, 3;
Catalog	Database	Table	Table_alias	Column	Column_alias	Type	Length	Max length	Is_null	Flags	Decimals	Charsetnr
def	test	t1	t1	c28	c28	254	4	1	Y	0	0	45
def	test	t1	t1	c29	c29	254	72	1	Y	0	0	45
def					concat("-", c28, c2, "-")	253	52	4	Y	0	0	45
def					concat("-", c29, c2, "-")	253	120	4	Y	0	0	45
+------+------+---------------------------+---------------------------+
| c28  | c29  | concat("-", c28, c2, "-") | concat("-", c29, c2, "-") |
+------+------+---------------------------+---------------------------+
|      |      | -0-                       | -0-                       |
| 0    | 0    | -02-                      | -02-                      |
| 2    | 2    | -22-                      | -22-                      |
+------+------+---------------------------+---------------------------+
select c28, c29, c28 + c3, c29 + c3 from t1 order by 1, 2, 3;
Catalog	Database	Table	Table_alias	Column	Column_alias	Type	Length	Max length	Is_null	Flags	Decimals	Charsetnr
def	test	t1	t1	c28	c28	254	4	1	Y	0	0	45
def	test	t1	t1	c29	c29	254	72	1	Y	0	0	45
def					c28 + c3	5	23	1	Y	32896	31	63
def					c29 + c3	5	23	1	Y	32896	31	63
+------+------+----------+----------+
| c28  | c29  | c28 + c3 | c29 + c3 |
+------+------+----------+----------+
|      |      |        1 |        0 |
| 0    | 0    |        3 |        3 |
| 2    | 2    |        3 |        7 |
+------+------+----------+----------+
select c28, c29, concat("-", c28, c3, "-"), concat("-", c29, c3, "-") from t1 order by 1, 2, 3;
Catalog	Database	Table	Table_alias	Column	Column_alias	Type	Length	Max length	Is_null	Flags	Decimals	Charsetnr
def	test	t1	t1	c28	c28	254	4	1	Y	0	0	45
def	test	t1	t1	c29	c29	254	72	1	Y	0	0	45
def					concat("-", c28, c3, "-")	253	28	5	Y	0	0	45
def					concat("-", c29, c3, "-")	253	96	5	Y	0	0	45
+------+------+---------------------------+---------------------------+
| c28  | c29  | concat("-", c28, c3, "-") | concat("-", c29, c3, "-") |
+------+------+---------------------------+---------------------------+
|      |      | -0-                       | -0-                       |
| 0    | 0    | -01-                      | -01-                      |
| 2    | 2    | -2-1-                     | -2-1-                     |
+------+------+---------------------------+---------------------------+
select c28, c29, c28 + c4, c29 + c4 from t1 order by 1, 2, 3;
Catalog	Database	Table	Table_alias	Column	Column_alias	Type	Length	Max length	Is_null	Flags	Decimals	Charsetnr
def	test	t1	t1	c28	c28	254	4	1	Y	0	0	45
def	test	t1	t1	c29	c29	254	72	1	Y	0	0	45
def					c28 + c4	5	23	1	Y	32896	31	63
def					c29 + c4	5	23	2	Y	32896	31	63
+------+------+----------+----------+
| c28  | c29  | c28 + c4 | c29 + c4 |
+------+------+----------+----------+
|      |      |        1 |        0 |
| 0    | 0    |        4 |        4 |
| 2    | 2    |        6 |       10 |
+------+------+----------+----------+
select c28, c29, concat("-", c28, c4, "-"), concat("-", c29, c4, "-") from t1 order by 1, 2, 3;
Catalog	Database	Table	Table_alias	Column	Column_alias	Type	Length	Max length	Is_null	Flags	Decimals	Charsetnr
def	test	t1	t1	c28	c28	254	4	1	Y	0	0	45
def	test	t1	t1	c29	c29	254	72	1	Y	0	0	45
def					concat("-", c28, c4, "-")	253	24	4	Y	0	0	45
def					concat("-", c29, c4, "-")	253	92	4	Y	0	0	45
+------+------+---------------------------+---------------------------+
| c28  | c29  | concat("-", c28, c4, "-") | concat("-", c29, c4, "-") |
+------+------+---------------------------+---------------------------+
|      |      | -0-                       | -0-                       |
| 0    | 0    | -02-                      | -02-                      |
| 2    | 2    | -22-                      | -22-                      |
+------+------+---------------------------+---------------------------+
select c28, c29, c28 + c5, c29 + c5 from t1 order by 1, 2, 3;
Catalog	Database	Table	Table_alias	Column	Column_alias	Type	Length	Max length	Is_null	Flags	Decimals	Charsetnr
def	test	t1	t1	c28	c28	254	4	1	Y	0	0	45
def	test	t1	t1	c29	c29	254	72	1	Y	0	0	45
def					c28 + c5	5	23	1	Y	32896	31	63
def					c29 + c5	5	23	1	Y	32896	31	63
+------+------+----------+----------+
| c28  | c29  | c28 + c5 | c29 + c5 |
+------+------+----------+----------+
|      |      |        1 |        0 |
| 0    | 0    |        3 |        3 |
| 2    | 2    |        3 |        7 |
+------+------+----------+----------+
select c28, c29, concat("-", c28, c5, "-"), concat("-", c29, c5, "-") from t1 order by 1, 2, 3;
Catalog	Database	Table	Table_alias	Column	Column_alias	Type	Length	Max length	Is_null	Flags	Decimals	Charsetnr
def	test	t1	t1	c28	c28	254	4	1	Y	0	0	45
def	test	t1	t1	c29	c29	254	72	1	Y	0	0	45
def					concat("-", c28, c5, "-")	253	36	5	Y	0	0	45
def					concat("-", c29, c5, "-")	253	104	5	Y	0	0	45
+------+------+---------------------------+---------------------------+
| c28  | c29  | concat("-", c28, c5, "-") | concat("-", c29, c5, "-") |
+------+------+---------------------------+---------------------------+
|      |      | -0-                       | -0-                       |
| 0    | 0    | -01-                      | -01-                      |
| 2    | 2    | -2-1-                     | -2-1-                     |
+------+------+---------------------------+---------------------------+
select c28, c29, c28 + c6, c29 + c6 from t1 order by 1, 2, 3;
Catalog	Database	Table	Table_alias	Column	Column_alias	Type	Length	Max length	Is_null	Flags	Decimals	Charsetnr
def	test	t1	t1	c28	c28	254	4	1	Y	0	0	45
def	test	t1	t1	c29	c29	254	72	1	Y	0	0	45
def					c28 + c6	5	23	1	Y	32896	31	63
def					c29 + c6	5	23	2	Y	32896	31	63
+------+------+----------+----------+
| c28  | c29  | c28 + c6 | c29 + c6 |
+------+------+----------+----------+
|      |      |        1 |        0 |
| 0    | 0    |        4 |        4 |
| 2    | 2    |        6 |       10 |
+------+------+----------+----------+
select c28, c29, concat("-", c28, c6, "-"), concat("-", c29, c6, "-") from t1 order by 1, 2, 3;
Catalog	Database	Table	Table_alias	Column	Column_alias	Type	Length	Max length	Is_null	Flags	Decimals	Charsetnr
def	test	t1	t1	c28	c28	254	4	1	Y	0	0	45
def	test	t1	t1	c29	c29	254	72	1	Y	0	0	45
def					concat("-", c28, c6, "-")	253	32	4	Y	0	0	45
def					concat("-", c29, c6, "-")	253	100	4	Y	0	0	45
+------+------+---------------------------+---------------------------+
| c28  | c29  | concat("-", c28, c6, "-") | concat("-", c29, c6, "-") |
+------+------+---------------------------+---------------------------+
|      |      | -0-                       | -0-                       |
| 0    | 0    | -02-                      | -02-                      |
| 2    | 2    | -22-                      | -22-                      |
+------+------+---------------------------+---------------------------+
select c28, c29, c28 + c7, c29 + c7 from t1 order by 1, 2, 3;
Catalog	Database	Table	Table_alias	Column	Column_alias	Type	Length	Max length	Is_null	Flags	Decimals	Charsetnr
def	test	t1	t1	c28	c28	254	4	1	Y	0	0	45
def	test	t1	t1	c29	c29	254	72	1	Y	0	0	45
def					c28 + c7	5	23	1	Y	32896	31	63
def					c29 + c7	5	23	1	Y	32896	31	63
+------+------+----------+----------+
| c28  | c29  | c28 + c7 | c29 + c7 |
+------+------+----------+----------+
|      |      |        1 |        0 |
| 0    | 0    |        3 |        3 |
| 2    | 2    |        3 |        7 |
+------+------+----------+----------+
select c28, c29, concat("-", c28, c7, "-"), concat("-", c29, c7, "-") from t1 order by 1, 2, 3;
Catalog	Database	Table	Table_alias	Column	Column_alias	Type	Length	Max length	Is_null	Flags	Decimals	Charsetnr
def	test	t1	t1	c28	c28	254	4	1	Y	0	0	45
def	test	t1	t1	c29	c29	254	72	1	Y	0	0	45
def					concat("-", c28, c7, "-")	253	48	5	Y	0	0	45
def					concat("-", c29, c7, "-")	253	116	5	Y	0	0	45
+------+------+---------------------------+---------------------------+
| c28  | c29  | concat("-", c28, c7, "-") | concat("-", c29, c7, "-") |
+------+------+---------------------------+---------------------------+
|      |      | -0-                       | -0-                       |
| 0    | 0    | -01-                      | -01-                      |
| 2    | 2    | -2-1-                     | -2-1-                     |
+------+------+---------------------------+---------------------------+
select c28, c29, c28 + c8, c29 + c8 from t1 order by 1, 2, 3;
Catalog	Database	Table	Table_alias	Column	Column_alias	Type	Length	Max length	Is_null	Flags	Decimals	Charsetnr
def	test	t1	t1	c28	c28	254	4	1	Y	0	0	45
def	test	t1	t1	c29	c29	254	72	1	Y	0	0	45
def					c28 + c8	5	23	1	Y	32896	31	63
def					c29 + c8	5	23	2	Y	32896	31	63
+------+------+----------+----------+
| c28  | c29  | c28 + c8 | c29 + c8 |
+------+------+----------+----------+
|      |      |        1 |        0 |
| 0    | 0    |        4 |        4 |
| 2    | 2    |        6 |       10 |
+------+------+----------+----------+
select c28, c29, concat("-", c28, c8, "-"), concat("-", c29, c8, "-") from t1 order by 1, 2, 3;
Catalog	Database	Table	Table_alias	Column	Column_alias	Type	Length	Max length	Is_null	Flags	Decimals	Charsetnr
def	test	t1	t1	c28	c28	254	4	1	Y	0	0	45
def	test	t1	t1	c29	c29	254	72	1	Y	0	0	45
def					concat("-", c28, c8, "-")	253	44	4	Y	0	0	45
def					concat("-", c29, c8, "-")	253	112	4	Y	0	0	45
+------+------+---------------------------+---------------------------+
| c28  | c29  | concat("-", c28, c8, "-") | concat("-", c29, c8, "-") |
+------+------+---------------------------+---------------------------+
|      |      | -0-                       | -0-                       |
| 0    | 0    | -02-                      | -02-                      |
| 2    | 2    | -22-                      | -22-                      |
+------+------+---------------------------+---------------------------+
select c28, c29, c28 + c9, c29 + c9 from t1 order by 1, 2, 3;
Catalog	Database	Table	Table_alias	Column	Column_alias	Type	Length	Max length	Is_null	Flags	Decimals	Charsetnr
def	test	t1	t1	c28	c28	254	4	1	Y	0	0	45
def	test	t1	t1	c29	c29	254	72	1	Y	0	0	45
def					c28 + c9	5	23	1	Y	32896	31	63
def					c29 + c9	5	23	1	Y	32896	31	63
+------+------+----------+----------+
| c28  | c29  | c28 + c9 | c29 + c9 |
+------+------+----------+----------+
|      |      |        1 |        0 |
| 0    | 0    |        3 |        3 |
| 2    | 2    |        3 |        7 |
+------+------+----------+----------+
select c28, c29, concat("-", c28, c9, "-"), concat("-", c29, c9, "-") from t1 order by 1, 2, 3;
Catalog	Database	Table	Table_alias	Column	Column_alias	Type	Length	Max length	Is_null	Flags	Decimals	Charsetnr
def	test	t1	t1	c28	c28	254	4	1	Y	0	0	45
def	test	t1	t1	c29	c29	254	72	1	Y	0	0	45
def					concat("-", c28, c9, "-")	253	56	5	Y	0	0	45
def					concat("-", c29, c9, "-")	253	124	5	Y	0	0	45
+------+------+---------------------------+---------------------------+
| c28  | c29  | concat("-", c28, c9, "-") | concat("-", c29, c9, "-") |
+------+------+---------------------------+---------------------------+
|      |      | -0-                       | -0-                       |
| 0    | 0    | -01-                      | -01-                      |
| 2    | 2    | -2-1-                     | -2-1-                     |
+------+------+---------------------------+---------------------------+
select c28, c29, c28 + c10, c29 + c10 from t1 order by 1, 2, 3;
Catalog	Database	Table	Table_alias	Column	Column_alias	Type	Length	Max length	Is_null	Flags	Decimals	Charsetnr
def	test	t1	t1	c28	c28	254	4	1	Y	0	0	45
def	test	t1	t1	c29	c29	254	72	1	Y	0	0	45
def					c28 + c10	5	23	1	Y	32896	31	63
def					c29 + c10	5	23	2	Y	32896	31	63
+------+------+-----------+-----------+
| c28  | c29  | c28 + c10 | c29 + c10 |
+------+------+-----------+-----------+
|      |      |         1 |         0 |
| 0    | 0    |         4 |         4 |
| 2    | 2    |         6 |        10 |
+------+------+-----------+-----------+
select c28, c29, concat("-", c28, c10, "-"), concat("-", c29, c10, "-") from t1 order by 1, 2, 3;
Catalog	Database	Table	Table_alias	Column	Column_alias	Type	Length	Max length	Is_null	Flags	Decimals	Charsetnr
def	test	t1	t1	c28	c28	254	4	1	Y	0	0	45
def	test	t1	t1	c29	c29	254	72	1	Y	0	0	45
def					concat("-", c28, c10, "-")	253	52	4	Y	0	0	45
def					concat("-", c29, c10, "-")	253	120	4	Y	0	0	45
+------+------+----------------------------+----------------------------+
| c28  | c29  | concat("-", c28, c10, "-") | concat("-", c29, c10, "-") |
+------+------+----------------------------+----------------------------+
|      |      | -0-                        | -0-                        |
| 0    | 0    | -02-                       | -02-                       |
| 2    | 2    | -22-                       | -22-                       |
+------+------+----------------------------+----------------------------+
select c28, c29, c28 + c11, c29 + c11 from t1 order by 1, 2, 3;
Catalog	Database	Table	Table_alias	Column	Column_alias	Type	Length	Max length	Is_null	Flags	Decimals	Charsetnr
def	test	t1	t1	c28	c28	254	4	1	Y	0	0	45
def	test	t1	t1	c29	c29	254	72	1	Y	0	0	45
def					c28 + c11	5	23	1	Y	32896	31	63
def					c29 + c11	5	23	1	Y	32896	31	63
+------+------+-----------+-----------+
| c28  | c29  | c28 + c11 | c29 + c11 |
+------+------+-----------+-----------+
|      |      |         1 |         0 |
| 0    | 0    |         3 |         3 |
| 2    | 2    |         3 |         7 |
+------+------+-----------+-----------+
select c28, c29, concat("-", c28, c11, "-"), concat("-", c29, c11, "-") from t1 order by 1, 2, 3;
Catalog	Database	Table	Table_alias	Column	Column_alias	Type	Length	Max length	Is_null	Flags	Decimals	Charsetnr
def	test	t1	t1	c28	c28	254	4	1	Y	0	0	45
def	test	t1	t1	c29	c29	254	72	1	Y	0	0	45
def					concat("-", c28, c11, "-")	253	92	5	Y	0	0	45
def					concat("-", c29, c11, "-")	253	160	5	Y	0	0	45
+------+------+----------------------------+----------------------------+
| c28  | c29  | concat("-", c28, c11, "-") | concat("-", c29, c11, "-") |
+------+------+----------------------------+----------------------------+
|      |      | -0-                        | -0-                        |
| 0    | 0    | -01-                       | -01-                       |
| 2    | 2    | -2-1-                      | -2-1-                      |
+------+------+----------------------------+----------------------------+
select c28, c29, c28 + c12, c29 + c12 from t1 order by 1, 2, 3;
Catalog	Database	Table	Table_alias	Column	Column_alias	Type	Length	Max length	Is_null	Flags	Decimals	Charsetnr
def	test	t1	t1	c28	c28	254	4	1	Y	0	0	45
def	test	t1	t1	c29	c29	254	72	1	Y	0	0	45
def					c28 + c12	5	23	1	Y	32896	31	63
def					c29 + c12	5	23	2	Y	32896	31	63
+------+------+-----------+-----------+
| c28  | c29  | c28 + c12 | c29 + c12 |
+------+------+-----------+-----------+
|      |      |         1 |         0 |
| 0    | 0    |         4 |         4 |
| 2    | 2    |         6 |        10 |
+------+------+-----------+-----------+
select c28, c29, concat("-", c28, c12, "-"), concat("-", c29, c12, "-") from t1 order by 1, 2, 3;
Catalog	Database	Table	Table_alias	Column	Column_alias	Type	Length	Max length	Is_null	Flags	Decimals	Charsetnr
def	test	t1	t1	c28	c28	254	4	1	Y	0	0	45
def	test	t1	t1	c29	c29	254	72	1	Y	0	0	45
def					concat("-", c28, c12, "-")	253	92	4	Y	0	0	45
def					concat("-", c29, c12, "-")	253	160	4	Y	0	0	45
+------+------+----------------------------+----------------------------+
| c28  | c29  | concat("-", c28, c12, "-") | concat("-", c29, c12, "-") |
+------+------+----------------------------+----------------------------+
|      |      | -0-                        | -0-                        |
| 0    | 0    | -02-                       | -02-                       |
| 2    | 2    | -22-                       | -22-                       |
+------+------+----------------------------+----------------------------+
select c28, c29, c28 + c13, c29 + c13 from t1 order by 1, 2, 3;
Catalog	Database	Table	Table_alias	Column	Column_alias	Type	Length	Max length	Is_null	Flags	Decimals	Charsetnr
def	test	t1	t1	c28	c28	254	4	1	Y	0	0	45
def	test	t1	t1	c29	c29	254	72	1	Y	0	0	45
def					c28 + c13	5	23	19	Y	32896	31	63
def					c29 + c13	5	23	17	Y	32896	31	63
+------+------+---------------------+-------------------+
| c28  | c29  | c28 + c13           | c29 + c13         |
+------+------+---------------------+-------------------+
|      |      |                   1 |                 0 |
| 0    | 0    |   5.099999904632568 | 5.099999904632568 |
| 2    | 2    | 0.40000009536743164 | 4.400000095367432 |
+------+------+---------------------+-------------------+
select c28, c29, concat("-", c28, c13, "-"), concat("-", c29, c13, "-") from t1 order by 1, 2, 3;
Catalog	Database	Table	Table_alias	Column	Column_alias	Type	Length	Max length	Is_null	Flags	Decimals	Charsetnr
def	test	t1	t1	c28	c28	254	4	1	Y	0	0	45
def	test	t1	t1	c29	c29	254	72	1	Y	0	0	45
def					concat("-", c28, c13, "-")	253	60	7	Y	0	0	45
def					concat("-", c29, c13, "-")	253	128	7	Y	0	0	45
+------+------+----------------------------+----------------------------+
| c28  | c29  | concat("-", c28, c13, "-") | concat("-", c29, c13, "-") |
+------+------+----------------------------+----------------------------+
|      |      | -0-                        | -0-                        |
| 0    | 0    | -03.1-                     | -03.1-                     |
| 2    | 2    | -2-3.6-                    | -2-3.6-                    |
+------+------+----------------------------+----------------------------+
select c28, c29, c28 + c14, c29 + c14 from t1 order by 1, 2, 3;
Catalog	Database	Table	Table_alias	Column	Column_alias	Type	Length	Max length	Is_null	Flags	Decimals	Charsetnr
def	test	t1	t1	c28	c28	254	4	1	Y	0	0	45
def	test	t1	t1	c29	c29	254	72	1	Y	0	0	45
def					c28 + c14	5	23	17	Y	32896	31	63
def					c29 + c14	5	23	18	Y	32896	31	63
+------+------+-------------------+--------------------+
| c28  | c29  | c28 + c14         | c29 + c14          |
+------+------+-------------------+--------------------+
|      |      |                 1 |                  0 |
| 0    | 0    | 6.099999904632568 |  6.099999904632568 |
| 2    | 2    | 8.599999904632568 | 12.599999904632568 |
+------+------+-------------------+--------------------+
select c28, c29, concat("-", c28, c14, "-"), concat("-", c29, c14, "-") from t1 order by 1, 2, 3;
Catalog	Database	Table	Table_alias	Column	Column_alias	Type	Length	Max length	Is_null	Flags	Decimals	Charsetnr
def	test	t1	t1	c28	c28	254	4	1	Y	0	0	45
def	test	t1	t1	c29	c29	254	72	1	Y	0	0	45
def					concat("-", c28, c14, "-")	253	60	6	Y	0	0	45
def					concat("-", c29, c14, "-")	253	128	6	Y	0	0	45
+------+------+----------------------------+----------------------------+
| c28  | c29  | concat("-", c28, c14, "-") | concat("-", c29, c14, "-") |
+------+------+----------------------------+----------------------------+
|      |      | -0-                        | -0-                        |
| 0    | 0    | -04.1-                     | -04.1-                     |
| 2    | 2    | -24.6-                     | -24.6-                     |
+------+------+----------------------------+----------------------------+
select c28, c29, c28 + c15, c29 + c15 from t1 order by 1, 2, 3;
Catalog	Database	Table	Table_alias	Column	Column_alias	Type	Length	Max length	Is_null	Flags	Decimals	Charsetnr
def	test	t1	t1	c28	c28	254	4	1	Y	0	0	45
def	test	t1	t1	c29	c29	254	72	1	Y	0	0	45
def					c28 + c15	5	23	19	Y	32896	31	63
def					c29 + c15	5	23	18	Y	32896	31	63
+------+------+---------------------+--------------------+
| c28  | c29  | c28 + c15           | c29 + c15          |
+------+------+---------------------+--------------------+
|      |      |                   1 |                  0 |
| 0    | 0    |                 7.1 |                7.1 |
| 2    | 2    | -1.5999999999999996 | 2.4000000000000004 |
+------+------+---------------------+--------------------+
select c28, c29, concat("-", c28, c15, "-"), concat("-", c29, c15, "-") from t1 order by 1, 2, 3;
Catalog	Database	Table	Table_alias	Column	Column_alias	Type	Length	Max length	Is_null	Flags	Decimals	Charsetnr
def	test	t1	t1	c28	c28	254	4	1	Y	0	0	45
def	test	t1	t1	c29	c29	254	72	1	Y	0	0	45
def					concat("-", c28, c15, "-")	253	104	7	Y	0	0	45
def					concat("-", c29, c15, "-")	253	172	7	Y	0	0	45
+------+------+----------------------------+----------------------------+
| c28  | c29  | concat("-", c28, c15, "-") | concat("-", c29, c15, "-") |
+------+------+----------------------------+----------------------------+
|      |      | -0-                        | -0-                        |
| 0    | 0    | -05.1-                     | -05.1-                     |
| 2    | 2    | -2-5.6-                    | -2-5.6-                    |
+------+------+----------------------------+----------------------------+
select c28, c29, c28 + c16, c29 + c16 from t1 order by 1, 2, 3;
Catalog	Database	Table	Table_alias	Column	Column_alias	Type	Length	Max length	Is_null	Flags	Decimals	Charsetnr
def	test	t1	t1	c28	c28	254	4	1	Y	0	0	45
def	test	t1	t1	c29	c29	254	72	1	Y	0	0	45
def					c28 + c16	5	23	4	Y	32896	31	63
def					c29 + c16	5	23	4	Y	32896	31	63
+------+------+-----------+-----------+
| c28  | c29  | c28 + c16 | c29 + c16 |
+------+------+-----------+-----------+
|      |      |         1 |         0 |
| 0    | 0    |       8.1 |       8.1 |
| 2    | 2    |      10.6 |      14.6 |
+------+------+-----------+-----------+
select c28, c29, concat("-", c28, c16, "-"), concat("-", c29, c16, "-") from t1 order by 1, 2, 3;
Catalog	Database	Table	Table_alias	Column	Column_alias	Type	Length	Max length	Is_null	Flags	Decimals	Charsetnr
def	test	t1	t1	c28	c28	254	4	1	Y	0	0	45
def	test	t1	t1	c29	c29	254	72	1	Y	0	0	45
def					concat("-", c28, c16, "-")	253	104	6	Y	0	0	45
def					concat("-", c29, c16, "-")	253	172	6	Y	0	0	45
+------+------+----------------------------+----------------------------+
| c28  | c29  | concat("-", c28, c16, "-") | concat("-", c29, c16, "-") |
+------+------+----------------------------+----------------------------+
|      |      | -0-                        | -0-                        |
| 0    | 0    | -06.1-                     | -06.1-                     |
| 2    | 2    | -26.6-                     | -26.6-                     |
+------+------+----------------------------+----------------------------+
select c28, c29, c28 + c17, c29 + c17 from t1 order by 1, 2, 3;
Catalog	Database	Table	Table_alias	Column	Column_alias	Type	Length	Max length	Is_null	Flags	Decimals	Charsetnr
def	test	t1	t1	c28	c28	254	4	1	Y	0	0	45
def	test	t1	t1	c29	c29	254	72	1	Y	0	0	45
def					c28 + c17	5	23	2	Y	32896	31	63
def					c29 + c17	5	23	1	Y	32896	31	63
+------+------+-----------+-----------+
| c28  | c29  | c28 + c17 | c29 + c17 |
+------+------+-----------+-----------+
|      |      |         1 |         0 |
| 0    | 0    |         9 |         9 |
| 2    | 2    |        -4 |         0 |
+------+------+-----------+-----------+
select c28, c29, concat("-", c28, c17, "-"), concat("-", c29, c17, "-") from t1 order by 1, 2, 3;
Catalog	Database	Table	Table_alias	Column	Column_alias	Type	Length	Max length	Is_null	Flags	Decimals	Charsetnr
def	test	t1	t1	c28	c28	254	4	1	Y	0	0	45
def	test	t1	t1	c29	c29	254	72	1	Y	0	0	45
def					concat("-", c28, c17, "-")	253	56	5	Y	0	0	45
def					concat("-", c29, c17, "-")	253	124	5	Y	0	0	45
+------+------+----------------------------+----------------------------+
| c28  | c29  | concat("-", c28, c17, "-") | concat("-", c29, c17, "-") |
+------+------+----------------------------+----------------------------+
|      |      | -0-                        | -0-                        |
| 0    | 0    | -07-                       | -07-                       |
| 2    | 2    | -2-8-                      | -2-8-                      |
+------+------+----------------------------+----------------------------+
select c28, c29, c28 + c18, c29 + c18 from t1 order by 1, 2, 3;
Catalog	Database	Table	Table_alias	Column	Column_alias	Type	Length	Max length	Is_null	Flags	Decimals	Charsetnr
def	test	t1	t1	c28	c28	254	4	1	Y	0	0	45
def	test	t1	t1	c29	c29	254	72	1	Y	0	0	45
def					c28 + c18	5	23	2	Y	32896	31	63
def					c29 + c18	5	23	2	Y	32896	31	63
+------+------+-----------+-----------+
| c28  | c29  | c28 + c18 | c29 + c18 |
+------+------+-----------+-----------+
|      |      |         1 |         0 |
| 0    | 0    |        10 |        10 |
| 2    | 2    |        13 |        17 |
+------+------+-----------+-----------+
select c28, c29, concat("-", c28, c18, "-"), concat("-", c29, c18, "-") from t1 order by 1, 2, 3;
Catalog	Database	Table	Table_alias	Column	Column_alias	Type	Length	Max length	Is_null	Flags	Decimals	Charsetnr
def	test	t1	t1	c28	c28	254	4	1	Y	0	0	45
def	test	t1	t1	c29	c29	254	72	1	Y	0	0	45
def					concat("-", c28, c18, "-")	253	52	4	Y	0	0	45
def					concat("-", c29, c18, "-")	253	120	4	Y	0	0	45
+------+------+----------------------------+----------------------------+
| c28  | c29  | concat("-", c28, c18, "-") | concat("-", c29, c18, "-") |
+------+------+----------------------------+----------------------------+
|      |      | -0-                        | -0-                        |
| 0    | 0    | -08-                       | -08-                       |
| 2    | 2    | -29-                       | -29-                       |
+------+------+----------------------------+----------------------------+
select c28, c29, c28 + c19, c29 + c19 from t1 order by 1, 2, 3;
Catalog	Database	Table	Table_alias	Column	Column_alias	Type	Length	Max length	Is_null	Flags	Decimals	Charsetnr
def	test	t1	t1	c28	c28	254	4	1	Y	0	0	45
def	test	t1	t1	c29	c29	254	72	1	Y	0	0	45
def					c28 + c19	5	23	14	Y	32896	31	63
def					c29 + c19	5	23	14	Y	32896	31	63
+------+------+----------------+----------------+
| c28  | c29  | c28 + c19      | c29 + c19      |
+------+------+----------------+----------------+
|      |      | 20191211120001 | 20191211120000 |
| 0    | 0    | 20191201120002 | 20191201120002 |
| 2    | 2    | 20191211120004 | 20191211120008 |
+------+------+----------------+----------------+
select c28, c29, concat("-", c28, c19, "-"), concat("-", c29, c19, "-") from t1 order by 1, 2, 3;
Catalog	Database	Table	Table_alias	Column	Column_alias	Type	Length	Max length	Is_null	Flags	Decimals	Charsetnr
def	test	t1	t1	c28	c28	254	4	1	Y	0	0	45
def	test	t1	t1	c29	c29	254	72	1	Y	0	0	45
def					concat("-", c28, c19, "-")	253	88	22	Y	0	0	45
def					concat("-", c29, c19, "-")	253	156	22	Y	0	0	45
+------+------+----------------------------+----------------------------+
| c28  | c29  | concat("-", c28, c19, "-") | concat("-", c29, c19, "-") |
+------+------+----------------------------+----------------------------+
|      |      | -2019-12-11 12:00:00-      | -2019-12-11 12:00:00-      |
| 0    | 0    | -02019-12-01 12:00:00-     | -02019-12-01 12:00:00-     |
| 2    | 2    | -22019-12-11 12:00:00-     | -22019-12-11 12:00:00-     |
+------+------+----------------------------+----------------------------+
select c28, c29, c28 + c20, c29 + c20 from t1 order by 1, 2, 3;
Catalog	Database	Table	Table_alias	Column	Column_alias	Type	Length	Max length	Is_null	Flags	Decimals	Charsetnr
def	test	t1	t1	c28	c28	254	4	1	Y	0	0	45
def	test	t1	t1	c29	c29	254	72	1	Y	0	0	45
def					c28 + c20	5	23	14	Y	32896	31	63
def					c29 + c20	5	23	14	Y	32896	31	63
+------+------+----------------+----------------+
| c28  | c29  | c28 + c20      | c29 + c20      |
+------+------+----------------+----------------+
|      |      | 20191203060001 | 20191203060000 |
| 0    | 0    | 20191213060002 | 20191213060002 |
| 2    | 2    | 20191203060004 | 20191203060008 |
+------+------+----------------+----------------+
select c28, c29, concat("-", c28, c20, "-"), concat("-", c29, c20, "-") from t1 order by 1, 2, 3;
Catalog	Database	Table	Table_alias	Column	Column_alias	Type	Length	Max length	Is_null	Flags	Decimals	Charsetnr
def	test	t1	t1	c28	c28	254	4	1	Y	0	0	45
def	test	t1	t1	c29	c29	254	72	1	Y	0	0	45
def					concat("-", c28, c20, "-")	253	88	22	Y	0	0	45
def					concat("-", c29, c20, "-")	253	156	22	Y	0	0	45
+------+------+----------------------------+----------------------------+
| c28  | c29  | concat("-", c28, c20, "-") | concat("-", c29, c20, "-") |
+------+------+----------------------------+----------------------------+
|      |      | -2019-12-03 06:00:00-      | -2019-12-03 06:00:00-      |
| 0    | 0    | -02019-12-13 06:00:00-     | -02019-12-13 06:00:00-     |
| 2    | 2    | -22019-12-03 06:00:00-     | -22019-12-03 06:00:00-     |
+------+------+----------------------------+----------------------------+
select c28, c29, c28 + c21, c29 + c21 from t1 order by 1, 2, 3;
Catalog	Database	Table	Table_alias	Column	Column_alias	Type	Length	Max length	Is_null	Flags	Decimals	Charsetnr
def	test	t1	t1	c28	c28	254	4	1	Y	0	0	45
def	test	t1	t1	c29	c29	254	72	1	Y	0	0	45
def					c28 + c21	5	23	4	Y	32896	31	63
def					c29 + c21	5	23	4	Y	32896	31	63
+------+------+-----------+-----------+
| c28  | c29  | c28 + c21 | c29 + c21 |
+------+------+-----------+-----------+
|      |      |      2022 |      2021 |
| 0    | 0    |      2022 |      2022 |
| 2    | 2    |      2025 |      2029 |
+------+------+-----------+-----------+
select c28, c29, concat("-", c28, c21, "-"), concat("-", c29, c21, "-") from t1 order by 1, 2, 3;
Catalog	Database	Table	Table_alias	Column	Column_alias	Type	Length	Max length	Is_null	Flags	Decimals	Charsetnr
def	test	t1	t1	c28	c28	254	4	1	Y	0	0	45
def	test	t1	t1	c29	c29	254	72	1	Y	0	0	45
def					concat("-", c28, c21, "-")	253	28	7	Y	0	0	45
def					concat("-", c29, c21, "-")	253	96	7	Y	0	0	45
+------+------+----------------------------+----------------------------+
| c28  | c29  | concat("-", c28, c21, "-") | concat("-", c29, c21, "-") |
+------+------+----------------------------+----------------------------+
|      |      | -2021-                     | -2021-                     |
| 0    | 0    | -02020-                    | -02020-                    |
| 2    | 2    | -22021-                    | -22021-                    |
+------+------+----------------------------+----------------------------+
select c28, c29, c28 + c22, c29 + c22 from t1 order by 1, 2, 3;
Catalog	Database	Table	Table_alias	Column	Column_alias	Type	Length	Max length	Is_null	Flags	Decimals	Charsetnr
def	test	t1	t1	c28	c28	254	4	1	Y	0	0	45
def	test	t1	t1	c29	c29	254	72	1	Y	0	0	45
def					c28 + c22	5	23	8	Y	32896	31	63
def					c29 + c22	5	23	8	Y	32896	31	63
+------+------+-----------+-----------+
| c28  | c29  | c28 + c22 | c29 + c22 |
+------+------+-----------+-----------+
|      |      |  20200112 |  20200111 |
| 0    | 0    |  20200103 |  20200103 |
| 2    | 2    |  20200115 |  20200119 |
+------+------+-----------+-----------+
select c28, c29, concat("-", c28, c22, "-"), concat("-", c29, c22, "-") from t1 order by 1, 2, 3;
Catalog	Database	Table	Table_alias	Column	Column_alias	Type	Length	Max length	Is_null	Flags	Decimals	Charsetnr
def	test	t1	t1	c28	c28	254	4	1	Y	0	0	45
def	test	t1	t1	c29	c29	254	72	1	Y	0	0	45
def					concat("-", c28, c22, "-")	253	52	13	Y	0	0	45
def					concat("-", c29, c22, "-")	253	120	13	Y	0	0	45
+------+------+----------------------------+----------------------------+
| c28  | c29  | concat("-", c28, c22, "-") | concat("-", c29, c22, "-") |
+------+------+----------------------------+----------------------------+
|      |      | -2020-01-11-               | -2020-01-11-               |
| 0    | 0    | -02020-01-01-              | -02020-01-01-              |
| 2    | 2    | -22020-01-11-              | -22020-01-11-              |
+------+------+----------------------------+----------------------------+
select c28, c29, c28 + c23, c29 + c23 from t1 order by 1, 2, 3;
Catalog	Database	Table	Table_alias	Column	Column_alias	Type	Length	Max length	Is_null	Flags	Decimals	Charsetnr
def	test	t1	t1	c28	c28	254	4	1	Y	0	0	45
def	test	t1	t1	c29	c29	254	72	1	Y	0	0	45
def					c28 + c23	5	23	6	Y	32896	31	63
def					c29 + c23	5	23	6	Y	32896	31	63
+------+------+-----------+-----------+
| c28  | c29  | c28 + c23 | c29 + c23 |
+------+------+-----------+-----------+
|      |      |    123557 |    123556 |
| 0    | 0    |    123458 |    123458 |
| 2    | 2    |    123560 |    123564 |
+------+------+-----------+-----------+
select c28, c29, concat("-", c28, c23, "-"), concat("-", c29, c23, "-") from t1 order by 1, 2, 3;
Catalog	Database	Table	Table_alias	Column	Column_alias	Type	Length	Max length	Is_null	Flags	Decimals	Charsetnr
def	test	t1	t1	c28	c28	254	4	1	Y	0	0	45
def	test	t1	t1	c29	c29	254	72	1	Y	0	0	45
def					concat("-", c28, c23, "-")	253	52	11	Y	0	0	45
def					concat("-", c29, c23, "-")	253	120	11	Y	0	0	45
+------+------+----------------------------+----------------------------+
| c28  | c29  | concat("-", c28, c23, "-") | concat("-", c29, c23, "-") |
+------+------+----------------------------+----------------------------+
|      |      | -12:35:56-                 | -12:35:56-                 |
| 0    | 0    | -012:34:56-                | -012:34:56-                |
| 2    | 2    | -212:35:56-                | -212:35:56-                |
+------+------+----------------------------+----------------------------+
select c28, c29, c28 + c24, c29 + c24 from t1 order by 1, 2, 3;
Catalog	Database	Table	Table_alias	Column	Column_alias	Type	Length	Max length	Is_null	Flags	Decimals	Charsetnr
def	test	t1	t1	c28	c28	254	4	1	Y	0	0	45
def	test	t1	t1	c29	c29	254	72	1	Y	0	0	45
def					c28 + c24	5	23	4	Y	32896	31	63
def					c29 + c24	5	23	19	Y	32896	31	63
+------+------+-----------+---------------------+
| c28  | c29  | c28 + c24 | c29 + c24           |
+------+------+-----------+---------------------+
|      |      |         1 |                   0 |
| 0    | 0    |      11.1 |                11.1 |
| 2    | 2    |      -5.6 | -1.5999999999999996 |
+------+------+-----------+---------------------+
select c28, c29, concat("-", c28, c24, "-"), concat("-", c29, c24, "-") from t1 order by 1, 2, 3;
Catalog	Database	Table	Table_alias	Column	Column_alias	Type	Length	Max length	Is_null	Flags	Decimals	Charsetnr
def	test	t1	t1	c28	c28	254	4	1	Y	0	0	45
def	test	t1	t1	c29	c29	254	72	1	Y	0	0	45
def					concat("-", c28, c24, "-")	253	132	7	Y	0	0	45
def					concat("-", c29, c24, "-")	253	200	7	Y	0	0	45
+------+------+----------------------------+----------------------------+
| c28  | c29  | concat("-", c28, c24, "-") | concat("-", c29, c24, "-") |
+------+------+----------------------------+----------------------------+
|      |      | -0-                        | -0-                        |
| 0    | 0    | -09.1-                     | -09.1-                     |
| 2    | 2    | -2-9.6-                    | -2-9.6-                    |
+------+------+----------------------------+----------------------------+
select c28, c29, c28 + c25, c29 + c25 from t1 order by 1, 2, 3;
Catalog	Database	Table	Table_alias	Column	Column_alias	Type	Length	Max length	Is_null	Flags	Decimals	Charsetnr
def	test	t1	t1	c28	c28	254	4	1	Y	0	0	45
def	test	t1	t1	c29	c29	254	72	1	Y	0	0	45
def					c28 + c25	5	23	4	Y	32896	31	63
def					c29 + c25	5	23	4	Y	32896	31	63
+------+------+-----------+-----------+
| c28  | c29  | c28 + c25 | c29 + c25 |
+------+------+-----------+-----------+
|      |      |         1 |         0 |
| 0    | 0    |      12.1 |      12.1 |
| 2    | 2    |      14.6 |      18.6 |
+------+------+-----------+-----------+
select c28, c29, concat("-", c28, c25, "-"), concat("-", c29, c25, "-") from t1 order by 1, 2, 3;
Catalog	Database	Table	Table_alias	Column	Column_alias	Type	Length	Max length	Is_null	Flags	Decimals	Charsetnr
def	test	t1	t1	c28	c28	254	4	1	Y	0	0	45
def	test	t1	t1	c29	c29	254	72	1	Y	0	0	45
def					concat("-", c28, c25, "-")	253	132	7	Y	0	0	45
def					concat("-", c29, c25, "-")	253	200	7	Y	0	0	45
+------+------+----------------------------+----------------------------+
| c28  | c29  | concat("-", c28, c25, "-") | concat("-", c29, c25, "-") |
+------+------+----------------------------+----------------------------+
|      |      | -0-                        | -0-                        |
| 0    | 0    | -010.1-                    | -010.1-                    |
| 2    | 2    | -210.6-                    | -210.6-                    |
+------+------+----------------------------+----------------------------+
select c28, c29, c28 + c26, c29 + c26 from t1 order by 1, 2, 3;
Catalog	Database	Table	Table_alias	Column	Column_alias	Type	Length	Max length	Is_null	Flags	Decimals	Charsetnr
def	test	t1	t1	c28	c28	254	4	1	Y	0	0	45
def	test	t1	t1	c29	c29	254	72	1	Y	0	0	45
def					c28 + c26	5	23	4	Y	32896	31	63
def					c29 + c26	5	23	19	Y	32896	31	63
+------+------+-----------+---------------------+
| c28  | c29  | c28 + c26 | c29 + c26           |
+------+------+-----------+---------------------+
|      |      |         1 |                   0 |
| 0    | 0    |      11.1 |                11.1 |
| 2    | 2    |      -5.6 | -1.5999999999999996 |
+------+------+-----------+---------------------+
select c28, c29, concat("-", c28, c26, "-"), concat("-", c29, c26, "-") from t1 order by 1, 2, 3;
Catalog	Database	Table	Table_alias	Column	Column_alias	Type	Length	Max length	Is_null	Flags	Decimals	Charsetnr
def	test	t1	t1	c28	c28	254	4	1	Y	0	0	45
def	test	t1	t1	c29	c29	254	72	1	Y	0	0	45
def					concat("-", c28, c26, "-")	253	33	7	Y	128	0	63
def					concat("-", c29, c26, "-")	253	50	7	Y	128	0	63
+------+------+----------------------------+----------------------------+
| c28  | c29  | concat("-", c28, c26, "-") | concat("-", c29, c26, "-") |
+------+------+----------------------------+----------------------------+
|      |      | -0-                        | -0-                        |
| 0    | 0    | -09.1-                     | -09.1-                     |
| 2    | 2    | -2-9.6-                    | -2-9.6-                    |
+------+------+----------------------------+----------------------------+
select c28, c29, c28 + c27, c29 + c27 from t1 order by 1, 2, 3;
Catalog	Database	Table	Table_alias	Column	Column_alias	Type	Length	Max length	Is_null	Flags	Decimals	Charsetnr
def	test	t1	t1	c28	c28	254	4	1	Y	0	0	45
def	test	t1	t1	c29	c29	254	72	1	Y	0	0	45
def					c28 + c27	5	23	4	Y	32896	31	63
def					c29 + c27	5	23	4	Y	32896	31	63
+------+------+-----------+-----------+
| c28  | c29  | c28 + c27 | c29 + c27 |
+------+------+-----------+-----------+
|      |      |         1 |         0 |
| 0    | 0    |      12.1 |      12.1 |
| 2    | 2    |      14.6 |      18.6 |
+------+------+-----------+-----------+
Warnings:
Warning	1292	Truncated incorrect DOUBLE value: '10.1'
Warning	1292	Truncated incorrect DOUBLE value: '10.6'
Warning	1292	Truncated incorrect DOUBLE value: '0'
Warning	1292	Truncated incorrect DOUBLE value: '0'
Warning	1292	Truncated incorrect DOUBLE value: '10.1'
Warning	1292	Truncated incorrect DOUBLE value: '10.6'
select c28, c29, concat("-", c28, c27, "-"), concat("-", c29, c27, "-") from t1 order by 1, 2, 3;
Catalog	Database	Table	Table_alias	Column	Column_alias	Type	Length	Max length	Is_null	Flags	Decimals	Charsetnr
def	test	t1	t1	c28	c28	254	4	1	Y	0	0	45
def	test	t1	t1	c29	c29	254	72	1	Y	0	0	45
def					concat("-", c28, c27, "-")	253	33	33	Y	128	0	63
def					concat("-", c29, c27, "-")	253	50	33	Y	128	0	63
+------+------+-----------------------------------+-----------------------------------+
| c28  | c29  | concat("-", c28, c27, "-")        | concat("-", c29, c27, "-")        |
+------+------+-----------------------------------+-----------------------------------+
|      |      | -0                             -  | -0                             -  |
| 0    | 0    | -010.1                          - | -010.1                          - |
| 2    | 2    | -210.6                          - | -210.6                          - |
+------+------+-----------------------------------+-----------------------------------+

delete from t2;
insert into t2 (c1) select c1 from t1;
ERROR 01000: Data truncated for column 'c1' at row 2
insert into t2 (c2) select c1 from t1;
ERROR 01000: Data truncated for column 'c2' at row 2
explain_protocol: 0
select c1, c2 from t2 order by 1, 2;
Catalog	Database	Table	Table_alias	Column	Column_alias	Type	Length	Max length	Is_null	Flags	Decimals	Charsetnr
def	test	t2	t2	c1	c1	254	4	0	Y	0	0	45
def	test	t2	t2	c2	c2	254	72	0	Y	0	0	45
+------+------+
| c1   | c2   |
+------+------+
+------+------+
explain_protocol: 0
update t2 set c2 = c2 + c1;
update t2 set c1 = c1 + c1;
select c1, c2 from t2 order by 1, 2;
Catalog	Database	Table	Table_alias	Column	Column_alias	Type	Length	Max length	Is_null	Flags	Decimals	Charsetnr
def	test	t2	t2	c1	c1	254	4	0	Y	0	0	45
def	test	t2	t2	c2	c2	254	72	0	Y	0	0	45
+------+------+
| c1   | c2   |
+------+------+
+------+------+
delete from t2;
insert into t2 (c1) select c2 from t1;
ERROR 01000: Data truncated for column 'c1' at row 3
insert into t2 (c2) select c2 from t1;
explain_protocol: 0
select c1, c2 from t2 order by 1, 2;
Catalog	Database	Table	Table_alias	Column	Column_alias	Type	Length	Max length	Is_null	Flags	Decimals	Charsetnr
def	test	t2	t2	c1	c1	254	4	0	Y	0	0	45
def	test	t2	t2	c2	c2	254	72	1	Y	0	0	45
+------+------+
| c1   | c2   |
+------+------+
| NULL |      |
| NULL | 0    |
| NULL | 0    |
+------+------+
explain_protocol: 0
update t2 set c2 = c2 + c2;
update t2 set c1 = c1 + c2;
select c1, c2 from t2 order by 1, 2;
Catalog	Database	Table	Table_alias	Column	Column_alias	Type	Length	Max length	Is_null	Flags	Decimals	Charsetnr
def	test	t2	t2	c1	c1	254	4	0	Y	0	0	45
def	test	t2	t2	c2	c2	254	72	1	Y	0	0	45
+------+------+
| c1   | c2   |
+------+------+
| NULL |      |
| NULL | 1    |
| NULL | 1    |
+------+------+
delete from t2;
insert into t2 (c1) select c3 from t1;
ERROR 01000: Data truncated for column 'c1' at row 2
insert into t2 (c2) select c3 from t1;
ERROR 01000: Data truncated for column 'c2' at row 2
explain_protocol: 0
select c1, c2 from t2 order by 1, 2;
Catalog	Database	Table	Table_alias	Column	Column_alias	Type	Length	Max length	Is_null	Flags	Decimals	Charsetnr
def	test	t2	t2	c1	c1	254	4	0	Y	0	0	45
def	test	t2	t2	c2	c2	254	72	0	Y	0	0	45
+------+------+
| c1   | c2   |
+------+------+
+------+------+
explain_protocol: 0
update t2 set c2 = c2 + c3;
ERROR 42S22: Unknown column 'c3' in 'field list'
update t2 set c1 = c1 + c3;
ERROR 42S22: Unknown column 'c3' in 'field list'
select c1, c2 from t2 order by 1, 2;
Catalog	Database	Table	Table_alias	Column	Column_alias	Type	Length	Max length	Is_null	Flags	Decimals	Charsetnr
def	test	t2	t2	c1	c1	254	4	0	Y	0	0	45
def	test	t2	t2	c2	c2	254	72	0	Y	0	0	45
+------+------+
| c1   | c2   |
+------+------+
+------+------+
delete from t2;
insert into t2 (c1) select c4 from t1;
ERROR 01000: Data truncated for column 'c1' at row 3
insert into t2 (c2) select c4 from t1;
explain_protocol: 0
select c1, c2 from t2 order by 1, 2;
Catalog	Database	Table	Table_alias	Column	Column_alias	Type	Length	Max length	Is_null	Flags	Decimals	Charsetnr
def	test	t2	t2	c1	c1	254	4	0	Y	0	0	45
def	test	t2	t2	c2	c2	254	72	1	Y	0	0	45
+------+------+
| c1   | c2   |
+------+------+
| NULL |      |
| NULL | 0    |
| NULL | 0    |
+------+------+
explain_protocol: 0
update t2 set c2 = c2 + c4;
ERROR 42S22: Unknown column 'c4' in 'field list'
update t2 set c1 = c1 + c4;
ERROR 42S22: Unknown column 'c4' in 'field list'
select c1, c2 from t2 order by 1, 2;
Catalog	Database	Table	Table_alias	Column	Column_alias	Type	Length	Max length	Is_null	Flags	Decimals	Charsetnr
def	test	t2	t2	c1	c1	254	4	0	Y	0	0	45
def	test	t2	t2	c2	c2	254	72	1	Y	0	0	45
+------+------+
| c1   | c2   |
+------+------+
| NULL |      |
| NULL | 0    |
| NULL | 0    |
+------+------+
delete from t2;
insert into t2 (c1) select c5 from t1;
ERROR 01000: Data truncated for column 'c1' at row 2
insert into t2 (c2) select c5 from t1;
ERROR 01000: Data truncated for column 'c2' at row 2
explain_protocol: 0
select c1, c2 from t2 order by 1, 2;
Catalog	Database	Table	Table_alias	Column	Column_alias	Type	Length	Max length	Is_null	Flags	Decimals	Charsetnr
def	test	t2	t2	c1	c1	254	4	0	Y	0	0	45
def	test	t2	t2	c2	c2	254	72	0	Y	0	0	45
+------+------+
| c1   | c2   |
+------+------+
+------+------+
explain_protocol: 0
update t2 set c2 = c2 + c5;
ERROR 42S22: Unknown column 'c5' in 'field list'
update t2 set c1 = c1 + c5;
ERROR 42S22: Unknown column 'c5' in 'field list'
select c1, c2 from t2 order by 1, 2;
Catalog	Database	Table	Table_alias	Column	Column_alias	Type	Length	Max length	Is_null	Flags	Decimals	Charsetnr
def	test	t2	t2	c1	c1	254	4	0	Y	0	0	45
def	test	t2	t2	c2	c2	254	72	0	Y	0	0	45
+------+------+
| c1   | c2   |
+------+------+
+------+------+
delete from t2;
insert into t2 (c1) select c6 from t1;
ERROR 01000: Data truncated for column 'c1' at row 3
insert into t2 (c2) select c6 from t1;
explain_protocol: 0
select c1, c2 from t2 order by 1, 2;
Catalog	Database	Table	Table_alias	Column	Column_alias	Type	Length	Max length	Is_null	Flags	Decimals	Charsetnr
def	test	t2	t2	c1	c1	254	4	0	Y	0	0	45
def	test	t2	t2	c2	c2	254	72	1	Y	0	0	45
+------+------+
| c1   | c2   |
+------+------+
| NULL |      |
| NULL | 0    |
| NULL | 0    |
+------+------+
explain_protocol: 0
update t2 set c2 = c2 + c6;
ERROR 42S22: Unknown column 'c6' in 'field list'
update t2 set c1 = c1 + c6;
ERROR 42S22: Unknown column 'c6' in 'field list'
select c1, c2 from t2 order by 1, 2;
Catalog	Database	Table	Table_alias	Column	Column_alias	Type	Length	Max length	Is_null	Flags	Decimals	Charsetnr
def	test	t2	t2	c1	c1	254	4	0	Y	0	0	45
def	test	t2	t2	c2	c2	254	72	1	Y	0	0	45
+------+------+
| c1   | c2   |
+------+------+
| NULL |      |
| NULL | 0    |
| NULL | 0    |
+------+------+
delete from t2;
insert into t2 (c1) select c7 from t1;
ERROR 01000: Data truncated for column 'c1' at row 2
insert into t2 (c2) select c7 from t1;
ERROR 01000: Data truncated for column 'c2' at row 2
explain_protocol: 0
select c1, c2 from t2 order by 1, 2;
Catalog	Database	Table	Table_alias	Column	Column_alias	Type	Length	Max length	Is_null	Flags	Decimals	Charsetnr
def	test	t2	t2	c1	c1	254	4	0	Y	0	0	45
def	test	t2	t2	c2	c2	254	72	0	Y	0	0	45
+------+------+
| c1   | c2   |
+------+------+
+------+------+
explain_protocol: 0
update t2 set c2 = c2 + c7;
ERROR 42S22: Unknown column 'c7' in 'field list'
update t2 set c1 = c1 + c7;
ERROR 42S22: Unknown column 'c7' in 'field list'
select c1, c2 from t2 order by 1, 2;
Catalog	Database	Table	Table_alias	Column	Column_alias	Type	Length	Max length	Is_null	Flags	Decimals	Charsetnr
def	test	t2	t2	c1	c1	254	4	0	Y	0	0	45
def	test	t2	t2	c2	c2	254	72	0	Y	0	0	45
+------+------+
| c1   | c2   |
+------+------+
+------+------+
delete from t2;
insert into t2 (c1) select c8 from t1;
ERROR 01000: Data truncated for column 'c1' at row 3
insert into t2 (c2) select c8 from t1;
explain_protocol: 0
select c1, c2 from t2 order by 1, 2;
Catalog	Database	Table	Table_alias	Column	Column_alias	Type	Length	Max length	Is_null	Flags	Decimals	Charsetnr
def	test	t2	t2	c1	c1	254	4	0	Y	0	0	45
def	test	t2	t2	c2	c2	254	72	1	Y	0	0	45
+------+------+
| c1   | c2   |
+------+------+
| NULL |      |
| NULL | 0    |
| NULL | 0    |
+------+------+
explain_protocol: 0
update t2 set c2 = c2 + c8;
ERROR 42S22: Unknown column 'c8' in 'field list'
update t2 set c1 = c1 + c8;
ERROR 42S22: Unknown column 'c8' in 'field list'
select c1, c2 from t2 order by 1, 2;
Catalog	Database	Table	Table_alias	Column	Column_alias	Type	Length	Max length	Is_null	Flags	Decimals	Charsetnr
def	test	t2	t2	c1	c1	254	4	0	Y	0	0	45
def	test	t2	t2	c2	c2	254	72	1	Y	0	0	45
+------+------+
| c1   | c2   |
+------+------+
| NULL |      |
| NULL | 0    |
| NULL | 0    |
+------+------+
delete from t2;
insert into t2 (c1) select c9 from t1;
ERROR 01000: Data truncated for column 'c1' at row 2
insert into t2 (c2) select c9 from t1;
ERROR 01000: Data truncated for column 'c2' at row 2
explain_protocol: 0
select c1, c2 from t2 order by 1, 2;
Catalog	Database	Table	Table_alias	Column	Column_alias	Type	Length	Max length	Is_null	Flags	Decimals	Charsetnr
def	test	t2	t2	c1	c1	254	4	0	Y	0	0	45
def	test	t2	t2	c2	c2	254	72	0	Y	0	0	45
+------+------+
| c1   | c2   |
+------+------+
+------+------+
explain_protocol: 0
update t2 set c2 = c2 + c9;
ERROR 42S22: Unknown column 'c9' in 'field list'
update t2 set c1 = c1 + c9;
ERROR 42S22: Unknown column 'c9' in 'field list'
select c1, c2 from t2 order by 1, 2;
Catalog	Database	Table	Table_alias	Column	Column_alias	Type	Length	Max length	Is_null	Flags	Decimals	Charsetnr
def	test	t2	t2	c1	c1	254	4	0	Y	0	0	45
def	test	t2	t2	c2	c2	254	72	0	Y	0	0	45
+------+------+
| c1   | c2   |
+------+------+
+------+------+
delete from t2;
insert into t2 (c1) select c10 from t1;
ERROR 01000: Data truncated for column 'c1' at row 3
insert into t2 (c2) select c10 from t1;
explain_protocol: 0
select c1, c2 from t2 order by 1, 2;
Catalog	Database	Table	Table_alias	Column	Column_alias	Type	Length	Max length	Is_null	Flags	Decimals	Charsetnr
def	test	t2	t2	c1	c1	254	4	0	Y	0	0	45
def	test	t2	t2	c2	c2	254	72	1	Y	0	0	45
+------+------+
| c1   | c2   |
+------+------+
| NULL |      |
| NULL | 0    |
| NULL | 0    |
+------+------+
explain_protocol: 0
update t2 set c2 = c2 + c10;
ERROR 42S22: Unknown column 'c10' in 'field list'
update t2 set c1 = c1 + c10;
ERROR 42S22: Unknown column 'c10' in 'field list'
select c1, c2 from t2 order by 1, 2;
Catalog	Database	Table	Table_alias	Column	Column_alias	Type	Length	Max length	Is_null	Flags	Decimals	Charsetnr
def	test	t2	t2	c1	c1	254	4	0	Y	0	0	45
def	test	t2	t2	c2	c2	254	72	1	Y	0	0	45
+------+------+
| c1   | c2   |
+------+------+
| NULL |      |
| NULL | 0    |
| NULL | 0    |
+------+------+
delete from t2;
insert into t2 (c1) select c11 from t1;
ERROR 01000: Data truncated for column 'c1' at row 2
insert into t2 (c2) select c11 from t1;
ERROR 01000: Data truncated for column 'c2' at row 2
explain_protocol: 0
select c1, c2 from t2 order by 1, 2;
Catalog	Database	Table	Table_alias	Column	Column_alias	Type	Length	Max length	Is_null	Flags	Decimals	Charsetnr
def	test	t2	t2	c1	c1	254	4	0	Y	0	0	45
def	test	t2	t2	c2	c2	254	72	0	Y	0	0	45
+------+------+
| c1   | c2   |
+------+------+
+------+------+
explain_protocol: 0
update t2 set c2 = c2 + c11;
ERROR 42S22: Unknown column 'c11' in 'field list'
update t2 set c1 = c1 + c11;
ERROR 42S22: Unknown column 'c11' in 'field list'
select c1, c2 from t2 order by 1, 2;
Catalog	Database	Table	Table_alias	Column	Column_alias	Type	Length	Max length	Is_null	Flags	Decimals	Charsetnr
def	test	t2	t2	c1	c1	254	4	0	Y	0	0	45
def	test	t2	t2	c2	c2	254	72	0	Y	0	0	45
+------+------+
| c1   | c2   |
+------+------+
+------+------+
delete from t2;
insert into t2 (c1) select c12 from t1;
ERROR 01000: Data truncated for column 'c1' at row 3
insert into t2 (c2) select c12 from t1;
explain_protocol: 0
select c1, c2 from t2 order by 1, 2;
Catalog	Database	Table	Table_alias	Column	Column_alias	Type	Length	Max length	Is_null	Flags	Decimals	Charsetnr
def	test	t2	t2	c1	c1	254	4	0	Y	0	0	45
def	test	t2	t2	c2	c2	254	72	1	Y	0	0	45
+------+------+
| c1   | c2   |
+------+------+
| NULL |      |
| NULL | 0    |
| NULL | 0    |
+------+------+
explain_protocol: 0
update t2 set c2 = c2 + c12;
ERROR 42S22: Unknown column 'c12' in 'field list'
update t2 set c1 = c1 + c12;
ERROR 42S22: Unknown column 'c12' in 'field list'
select c1, c2 from t2 order by 1, 2;
Catalog	Database	Table	Table_alias	Column	Column_alias	Type	Length	Max length	Is_null	Flags	Decimals	Charsetnr
def	test	t2	t2	c1	c1	254	4	0	Y	0	0	45
def	test	t2	t2	c2	c2	254	72	1	Y	0	0	45
+------+------+
| c1   | c2   |
+------+------+
| NULL |      |
| NULL | 0    |
| NULL | 0    |
+------+------+
delete from t2;
insert into t2 (c1) select c13 from t1;
ERROR 01000: Data truncated for column 'c1' at row 2
insert into t2 (c2) select c13 from t1;
ERROR 01000: Data truncated for column 'c2' at row 2
explain_protocol: 0
select c1, c2 from t2 order by 1, 2;
Catalog	Database	Table	Table_alias	Column	Column_alias	Type	Length	Max length	Is_null	Flags	Decimals	Charsetnr
def	test	t2	t2	c1	c1	254	4	0	Y	0	0	45
def	test	t2	t2	c2	c2	254	72	0	Y	0	0	45
+------+------+
| c1   | c2   |
+------+------+
+------+------+
explain_protocol: 0
update t2 set c2 = c2 + c13;
ERROR 42S22: Unknown column 'c13' in 'field list'
update t2 set c1 = c1 + c13;
ERROR 42S22: Unknown column 'c13' in 'field list'
select c1, c2 from t2 order by 1, 2;
Catalog	Database	Table	Table_alias	Column	Column_alias	Type	Length	Max length	Is_null	Flags	Decimals	Charsetnr
def	test	t2	t2	c1	c1	254	4	0	Y	0	0	45
def	test	t2	t2	c2	c2	254	72	0	Y	0	0	45
+------+------+
| c1   | c2   |
+------+------+
+------+------+
delete from t2;
insert into t2 (c1) select c14 from t1;
ERROR 01000: Data truncated for column 'c1' at row 3
insert into t2 (c2) select c14 from t1;
explain_protocol: 0
select c1, c2 from t2 order by 1, 2;
Catalog	Database	Table	Table_alias	Column	Column_alias	Type	Length	Max length	Is_null	Flags	Decimals	Charsetnr
def	test	t2	t2	c1	c1	254	4	0	Y	0	0	45
def	test	t2	t2	c2	c2	254	72	1	Y	0	0	45
+------+------+
| c1   | c2   |
+------+------+
| NULL |      |
| NULL | 1    |
| NULL | 1    |
+------+------+
explain_protocol: 0
update t2 set c2 = c2 + c14;
ERROR 42S22: Unknown column 'c14' in 'field list'
update t2 set c1 = c1 + c14;
ERROR 42S22: Unknown column 'c14' in 'field list'
select c1, c2 from t2 order by 1, 2;
Catalog	Database	Table	Table_alias	Column	Column_alias	Type	Length	Max length	Is_null	Flags	Decimals	Charsetnr
def	test	t2	t2	c1	c1	254	4	0	Y	0	0	45
def	test	t2	t2	c2	c2	254	72	1	Y	0	0	45
+------+------+
| c1   | c2   |
+------+------+
| NULL |      |
| NULL | 1    |
| NULL | 1    |
+------+------+
delete from t2;
insert into t2 (c1) select c15 from t1;
ERROR 01000: Data truncated for column 'c1' at row 2
insert into t2 (c2) select c15 from t1;
ERROR 01000: Data truncated for column 'c2' at row 2
explain_protocol: 0
select c1, c2 from t2 order by 1, 2;
Catalog	Database	Table	Table_alias	Column	Column_alias	Type	Length	Max length	Is_null	Flags	Decimals	Charsetnr
def	test	t2	t2	c1	c1	254	4	0	Y	0	0	45
def	test	t2	t2	c2	c2	254	72	0	Y	0	0	45
+------+------+
| c1   | c2   |
+------+------+
+------+------+
explain_protocol: 0
update t2 set c2 = c2 + c15;
ERROR 42S22: Unknown column 'c15' in 'field list'
update t2 set c1 = c1 + c15;
ERROR 42S22: Unknown column 'c15' in 'field list'
select c1, c2 from t2 order by 1, 2;
Catalog	Database	Table	Table_alias	Column	Column_alias	Type	Length	Max length	Is_null	Flags	Decimals	Charsetnr
def	test	t2	t2	c1	c1	254	4	0	Y	0	0	45
def	test	t2	t2	c2	c2	254	72	0	Y	0	0	45
+------+------+
| c1   | c2   |
+------+------+
+------+------+
delete from t2;
insert into t2 (c1) select c16 from t1;
ERROR 01000: Data truncated for column 'c1' at row 3
insert into t2 (c2) select c16 from t1;
explain_protocol: 0
select c1, c2 from t2 order by 1, 2;
Catalog	Database	Table	Table_alias	Column	Column_alias	Type	Length	Max length	Is_null	Flags	Decimals	Charsetnr
def	test	t2	t2	c1	c1	254	4	0	Y	0	0	45
def	test	t2	t2	c2	c2	254	72	3	Y	0	0	45
+------+------+
| c1   | c2   |
+------+------+
| NULL |      |
| NULL | 0,1  |
| NULL | 0,1  |
+------+------+
explain_protocol: 0
update t2 set c2 = c2 + c16;
ERROR 42S22: Unknown column 'c16' in 'field list'
update t2 set c1 = c1 + c16;
ERROR 42S22: Unknown column 'c16' in 'field list'
select c1, c2 from t2 order by 1, 2;
Catalog	Database	Table	Table_alias	Column	Column_alias	Type	Length	Max length	Is_null	Flags	Decimals	Charsetnr
def	test	t2	t2	c1	c1	254	4	0	Y	0	0	45
def	test	t2	t2	c2	c2	254	72	3	Y	0	0	45
+------+------+
| c1   | c2   |
+------+------+
| NULL |      |
| NULL | 0,1  |
| NULL | 0,1  |
+------+------+
delete from t2;
insert into t2 (c1) select c17 from t1;
ERROR 01000: Data truncated for column 'c1' at row 2
insert into t2 (c2) select c17 from t1;
ERROR 01000: Data truncated for column 'c2' at row 2
explain_protocol: 0
select c1, c2 from t2 order by 1, 2;
Catalog	Database	Table	Table_alias	Column	Column_alias	Type	Length	Max length	Is_null	Flags	Decimals	Charsetnr
def	test	t2	t2	c1	c1	254	4	0	Y	0	0	45
def	test	t2	t2	c2	c2	254	72	0	Y	0	0	45
+------+------+
| c1   | c2   |
+------+------+
+------+------+
explain_protocol: 0
update t2 set c2 = c2 + c17;
ERROR 42S22: Unknown column 'c17' in 'field list'
update t2 set c1 = c1 + c17;
ERROR 42S22: Unknown column 'c17' in 'field list'
select c1, c2 from t2 order by 1, 2;
Catalog	Database	Table	Table_alias	Column	Column_alias	Type	Length	Max length	Is_null	Flags	Decimals	Charsetnr
def	test	t2	t2	c1	c1	254	4	0	Y	0	0	45
def	test	t2	t2	c2	c2	254	72	0	Y	0	0	45
+------+------+
| c1   | c2   |
+------+------+
+------+------+
delete from t2;
insert into t2 (c1) select c18 from t1;
ERROR 01000: Data truncated for column 'c1' at row 3
insert into t2 (c2) select c18 from t1;
explain_protocol: 0
select c1, c2 from t2 order by 1, 2;
Catalog	Database	Table	Table_alias	Column	Column_alias	Type	Length	Max length	Is_null	Flags	Decimals	Charsetnr
def	test	t2	t2	c1	c1	254	4	0	Y	0	0	45
def	test	t2	t2	c2	c2	254	72	1	Y	0	0	45
+------+------+
| c1   | c2   |
+------+------+
| NULL |      |
| NULL | 2    |
| NULL | 2    |
+------+------+
explain_protocol: 0
update t2 set c2 = c2 + c18;
ERROR 42S22: Unknown column 'c18' in 'field list'
update t2 set c1 = c1 + c18;
ERROR 42S22: Unknown column 'c18' in 'field list'
select c1, c2 from t2 order by 1, 2;
Catalog	Database	Table	Table_alias	Column	Column_alias	Type	Length	Max length	Is_null	Flags	Decimals	Charsetnr
def	test	t2	t2	c1	c1	254	4	0	Y	0	0	45
def	test	t2	t2	c2	c2	254	72	1	Y	0	0	45
+------+------+
| c1   | c2   |
+------+------+
| NULL |      |
| NULL | 2    |
| NULL | 2    |
+------+------+
delete from t2;
insert into t2 (c1) select c19 from t1;
ERROR 01000: Data truncated for column 'c1' at row 1
insert into t2 (c2) select c19 from t1;
ERROR 01000: Data truncated for column 'c2' at row 1
explain_protocol: 0
select c1, c2 from t2 order by 1, 2;
Catalog	Database	Table	Table_alias	Column	Column_alias	Type	Length	Max length	Is_null	Flags	Decimals	Charsetnr
def	test	t2	t2	c1	c1	254	4	0	Y	0	0	45
def	test	t2	t2	c2	c2	254	72	0	Y	0	0	45
+------+------+
| c1   | c2   |
+------+------+
+------+------+
explain_protocol: 0
update t2 set c2 = c2 + c19;
ERROR 42S22: Unknown column 'c19' in 'field list'
update t2 set c1 = c1 + c19;
ERROR 42S22: Unknown column 'c19' in 'field list'
select c1, c2 from t2 order by 1, 2;
Catalog	Database	Table	Table_alias	Column	Column_alias	Type	Length	Max length	Is_null	Flags	Decimals	Charsetnr
def	test	t2	t2	c1	c1	254	4	0	Y	0	0	45
def	test	t2	t2	c2	c2	254	72	0	Y	0	0	45
+------+------+
| c1   | c2   |
+------+------+
+------+------+
delete from t2;
insert into t2 (c1) select c20 from t1;
ERROR 01000: Data truncated for column 'c1' at row 1
insert into t2 (c2) select c20 from t1;
ERROR 01000: Data truncated for column 'c2' at row 1
explain_protocol: 0
select c1, c2 from t2 order by 1, 2;
Catalog	Database	Table	Table_alias	Column	Column_alias	Type	Length	Max length	Is_null	Flags	Decimals	Charsetnr
def	test	t2	t2	c1	c1	254	4	0	Y	0	0	45
def	test	t2	t2	c2	c2	254	72	0	Y	0	0	45
+------+------+
| c1   | c2   |
+------+------+
+------+------+
explain_protocol: 0
update t2 set c2 = c2 + c20;
ERROR 42S22: Unknown column 'c20' in 'field list'
update t2 set c1 = c1 + c20;
ERROR 42S22: Unknown column 'c20' in 'field list'
select c1, c2 from t2 order by 1, 2;
Catalog	Database	Table	Table_alias	Column	Column_alias	Type	Length	Max length	Is_null	Flags	Decimals	Charsetnr
def	test	t2	t2	c1	c1	254	4	0	Y	0	0	45
def	test	t2	t2	c2	c2	254	72	0	Y	0	0	45
+------+------+
| c1   | c2   |
+------+------+
+------+------+
delete from t2;
insert into t2 (c1) select c21 from t1;
ERROR 01000: Data truncated for column 'c1' at row 1
insert into t2 (c2) select c21 from t1;
ERROR 01000: Data truncated for column 'c2' at row 1
explain_protocol: 0
select c1, c2 from t2 order by 1, 2;
Catalog	Database	Table	Table_alias	Column	Column_alias	Type	Length	Max length	Is_null	Flags	Decimals	Charsetnr
def	test	t2	t2	c1	c1	254	4	0	Y	0	0	45
def	test	t2	t2	c2	c2	254	72	0	Y	0	0	45
+------+------+
| c1   | c2   |
+------+------+
+------+------+
explain_protocol: 0
update t2 set c2 = c2 + c21;
ERROR 42S22: Unknown column 'c21' in 'field list'
update t2 set c1 = c1 + c21;
ERROR 42S22: Unknown column 'c21' in 'field list'
select c1, c2 from t2 order by 1, 2;
Catalog	Database	Table	Table_alias	Column	Column_alias	Type	Length	Max length	Is_null	Flags	Decimals	Charsetnr
def	test	t2	t2	c1	c1	254	4	0	Y	0	0	45
def	test	t2	t2	c2	c2	254	72	0	Y	0	0	45
+------+------+
| c1   | c2   |
+------+------+
+------+------+
delete from t2;
insert into t2 (c1) select c22 from t1;
ERROR 01000: Data truncated for column 'c1' at row 1
insert into t2 (c2) select c22 from t1;
ERROR 01000: Data truncated for column 'c2' at row 1
explain_protocol: 0
select c1, c2 from t2 order by 1, 2;
Catalog	Database	Table	Table_alias	Column	Column_alias	Type	Length	Max length	Is_null	Flags	Decimals	Charsetnr
def	test	t2	t2	c1	c1	254	4	0	Y	0	0	45
def	test	t2	t2	c2	c2	254	72	0	Y	0	0	45
+------+------+
| c1   | c2   |
+------+------+
+------+------+
explain_protocol: 0
update t2 set c2 = c2 + c22;
ERROR 42S22: Unknown column 'c22' in 'field list'
update t2 set c1 = c1 + c22;
ERROR 42S22: Unknown column 'c22' in 'field list'
select c1, c2 from t2 order by 1, 2;
Catalog	Database	Table	Table_alias	Column	Column_alias	Type	Length	Max length	Is_null	Flags	Decimals	Charsetnr
def	test	t2	t2	c1	c1	254	4	0	Y	0	0	45
def	test	t2	t2	c2	c2	254	72	0	Y	0	0	45
+------+------+
| c1   | c2   |
+------+------+
+------+------+
delete from t2;
insert into t2 (c1) select c23 from t1;
ERROR 01000: Data truncated for column 'c1' at row 1
insert into t2 (c2) select c23 from t1;
ERROR 01000: Data truncated for column 'c2' at row 1
explain_protocol: 0
select c1, c2 from t2 order by 1, 2;
Catalog	Database	Table	Table_alias	Column	Column_alias	Type	Length	Max length	Is_null	Flags	Decimals	Charsetnr
def	test	t2	t2	c1	c1	254	4	0	Y	0	0	45
def	test	t2	t2	c2	c2	254	72	0	Y	0	0	45
+------+------+
| c1   | c2   |
+------+------+
+------+------+
explain_protocol: 0
update t2 set c2 = c2 + c23;
ERROR 42S22: Unknown column 'c23' in 'field list'
update t2 set c1 = c1 + c23;
ERROR 42S22: Unknown column 'c23' in 'field list'
select c1, c2 from t2 order by 1, 2;
Catalog	Database	Table	Table_alias	Column	Column_alias	Type	Length	Max length	Is_null	Flags	Decimals	Charsetnr
def	test	t2	t2	c1	c1	254	4	0	Y	0	0	45
def	test	t2	t2	c2	c2	254	72	0	Y	0	0	45
+------+------+
| c1   | c2   |
+------+------+
+------+------+
delete from t2;
insert into t2 (c1) select c24 from t1;
ERROR 01000: Data truncated for column 'c1' at row 1
insert into t2 (c2) select c24 from t1;
ERROR 01000: Data truncated for column 'c2' at row 1
explain_protocol: 0
select c1, c2 from t2 order by 1, 2;
Catalog	Database	Table	Table_alias	Column	Column_alias	Type	Length	Max length	Is_null	Flags	Decimals	Charsetnr
def	test	t2	t2	c1	c1	254	4	0	Y	0	0	45
def	test	t2	t2	c2	c2	254	72	0	Y	0	0	45
+------+------+
| c1   | c2   |
+------+------+
+------+------+
explain_protocol: 0
update t2 set c2 = c2 + c24;
ERROR 42S22: Unknown column 'c24' in 'field list'
update t2 set c1 = c1 + c24;
ERROR 42S22: Unknown column 'c24' in 'field list'
select c1, c2 from t2 order by 1, 2;
Catalog	Database	Table	Table_alias	Column	Column_alias	Type	Length	Max length	Is_null	Flags	Decimals	Charsetnr
def	test	t2	t2	c1	c1	254	4	0	Y	0	0	45
def	test	t2	t2	c2	c2	254	72	0	Y	0	0	45
+------+------+
| c1   | c2   |
+------+------+
+------+------+
delete from t2;
insert into t2 (c1) select c25 from t1;
ERROR 01000: Data truncated for column 'c1' at row 1
insert into t2 (c2) select c25 from t1;
ERROR 01000: Data truncated for column 'c2' at row 1
explain_protocol: 0
select c1, c2 from t2 order by 1, 2;
Catalog	Database	Table	Table_alias	Column	Column_alias	Type	Length	Max length	Is_null	Flags	Decimals	Charsetnr
def	test	t2	t2	c1	c1	254	4	0	Y	0	0	45
def	test	t2	t2	c2	c2	254	72	0	Y	0	0	45
+------+------+
| c1   | c2   |
+------+------+
+------+------+
explain_protocol: 0
update t2 set c2 = c2 + c25;
ERROR 42S22: Unknown column 'c25' in 'field list'
update t2 set c1 = c1 + c25;
ERROR 42S22: Unknown column 'c25' in 'field list'
select c1, c2 from t2 order by 1, 2;
Catalog	Database	Table	Table_alias	Column	Column_alias	Type	Length	Max length	Is_null	Flags	Decimals	Charsetnr
def	test	t2	t2	c1	c1	254	4	0	Y	0	0	45
def	test	t2	t2	c2	c2	254	72	0	Y	0	0	45
+------+------+
| c1   | c2   |
+------+------+
+------+------+
delete from t2;
insert into t2 (c1) select c26 from t1;
ERROR 01000: Data truncated for column 'c1' at row 1
insert into t2 (c2) select c26 from t1;
ERROR 01000: Data truncated for column 'c2' at row 1
explain_protocol: 0
select c1, c2 from t2 order by 1, 2;
Catalog	Database	Table	Table_alias	Column	Column_alias	Type	Length	Max length	Is_null	Flags	Decimals	Charsetnr
def	test	t2	t2	c1	c1	254	4	0	Y	0	0	45
def	test	t2	t2	c2	c2	254	72	0	Y	0	0	45
+------+------+
| c1   | c2   |
+------+------+
+------+------+
explain_protocol: 0
update t2 set c2 = c2 + c26;
ERROR 42S22: Unknown column 'c26' in 'field list'
update t2 set c1 = c1 + c26;
ERROR 42S22: Unknown column 'c26' in 'field list'
select c1, c2 from t2 order by 1, 2;
Catalog	Database	Table	Table_alias	Column	Column_alias	Type	Length	Max length	Is_null	Flags	Decimals	Charsetnr
def	test	t2	t2	c1	c1	254	4	0	Y	0	0	45
def	test	t2	t2	c2	c2	254	72	0	Y	0	0	45
+------+------+
| c1   | c2   |
+------+------+
+------+------+
delete from t2;
insert into t2 (c1) select c27 from t1;
ERROR 01000: Data truncated for column 'c1' at row 1
insert into t2 (c2) select c27 from t1;
ERROR 01000: Data truncated for column 'c2' at row 1
explain_protocol: 0
select c1, c2 from t2 order by 1, 2;
Catalog	Database	Table	Table_alias	Column	Column_alias	Type	Length	Max length	Is_null	Flags	Decimals	Charsetnr
def	test	t2	t2	c1	c1	254	4	0	Y	0	0	45
def	test	t2	t2	c2	c2	254	72	0	Y	0	0	45
+------+------+
| c1   | c2   |
+------+------+
+------+------+
explain_protocol: 0
update t2 set c2 = c2 + c27;
ERROR 42S22: Unknown column 'c27' in 'field list'
update t2 set c1 = c1 + c27;
ERROR 42S22: Unknown column 'c27' in 'field list'
select c1, c2 from t2 order by 1, 2;
Catalog	Database	Table	Table_alias	Column	Column_alias	Type	Length	Max length	Is_null	Flags	Decimals	Charsetnr
def	test	t2	t2	c1	c1	254	4	0	Y	0	0	45
def	test	t2	t2	c2	c2	254	72	0	Y	0	0	45
+------+------+
| c1   | c2   |
+------+------+
+------+------+

delete from t1;
insert into t1 (c1) select c1 from t2;
insert into t1 (c1) select c2 from t2;
select c1 from t1 order by 1;
Catalog	Database	Table	Table_alias	Column	Column_alias	Type	Length	Max length	Is_null	Flags	Decimals	Charsetnr
def	test	t1	t1	c1	c1	3	11	0	Y	32768	0	63
+------+
| c1   |
+------+
+------+
delete from t1;
insert into t1 (c2) select c1 from t2;
insert into t1 (c2) select c2 from t2;
select c2 from t1 order by 1;
Catalog	Database	Table	Table_alias	Column	Column_alias	Type	Length	Max length	Is_null	Flags	Decimals	Charsetnr
def	test	t1	t1	c2	c2	3	10	0	Y	32800	0	63
+------+
| c2   |
+------+
+------+
delete from t1;
insert into t1 (c3) select c1 from t2;
insert into t1 (c3) select c2 from t2;
select c3 from t1 order by 1;
Catalog	Database	Table	Table_alias	Column	Column_alias	Type	Length	Max length	Is_null	Flags	Decimals	Charsetnr
def	test	t1	t1	c3	c3	1	4	0	Y	32768	0	63
+------+
| c3   |
+------+
+------+
delete from t1;
insert into t1 (c4) select c1 from t2;
insert into t1 (c4) select c2 from t2;
select c4 from t1 order by 1;
Catalog	Database	Table	Table_alias	Column	Column_alias	Type	Length	Max length	Is_null	Flags	Decimals	Charsetnr
def	test	t1	t1	c4	c4	1	3	0	Y	32800	0	63
+------+
| c4   |
+------+
+------+
delete from t1;
insert into t1 (c5) select c1 from t2;
insert into t1 (c5) select c2 from t2;
select c5 from t1 order by 1;
Catalog	Database	Table	Table_alias	Column	Column_alias	Type	Length	Max length	Is_null	Flags	Decimals	Charsetnr
def	test	t1	t1	c5	c5	2	6	0	Y	32768	0	63
+------+
| c5   |
+------+
+------+
delete from t1;
insert into t1 (c6) select c1 from t2;
insert into t1 (c6) select c2 from t2;
select c6 from t1 order by 1;
Catalog	Database	Table	Table_alias	Column	Column_alias	Type	Length	Max length	Is_null	Flags	Decimals	Charsetnr
def	test	t1	t1	c6	c6	2	5	0	Y	32800	0	63
+------+
| c6   |
+------+
+------+
delete from t1;
insert into t1 (c7) select c1 from t2;
insert into t1 (c7) select c2 from t2;
select c7 from t1 order by 1;
Catalog	Database	Table	Table_alias	Column	Column_alias	Type	Length	Max length	Is_null	Flags	Decimals	Charsetnr
def	test	t1	t1	c7	c7	9	9	0	Y	32768	0	63
+------+
| c7   |
+------+
+------+
delete from t1;
insert into t1 (c8) select c1 from t2;
insert into t1 (c8) select c2 from t2;
select c8 from t1 order by 1;
Catalog	Database	Table	Table_alias	Column	Column_alias	Type	Length	Max length	Is_null	Flags	Decimals	Charsetnr
def	test	t1	t1	c8	c8	9	8	0	Y	32800	0	63
+------+
| c8   |
+------+
+------+
delete from t1;
insert into t1 (c9) select c1 from t2;
insert into t1 (c9) select c2 from t2;
select c9 from t1 order by 1;
Catalog	Database	Table	Table_alias	Column	Column_alias	Type	Length	Max length	Is_null	Flags	Decimals	Charsetnr
def	test	t1	t1	c9	c9	3	11	0	Y	32768	0	63
+------+
| c9   |
+------+
+------+
delete from t1;
insert into t1 (c10) select c1 from t2;
insert into t1 (c10) select c2 from t2;
select c10 from t1 order by 1;
Catalog	Database	Table	Table_alias	Column	Column_alias	Type	Length	Max length	Is_null	Flags	Decimals	Charsetnr
def	test	t1	t1	c10	c10	3	10	0	Y	32800	0	63
+------+
| c10  |
+------+
+------+
delete from t1;
insert into t1 (c11) select c1 from t2;
insert into t1 (c11) select c2 from t2;
select c11 from t1 order by 1;
Catalog	Database	Table	Table_alias	Column	Column_alias	Type	Length	Max length	Is_null	Flags	Decimals	Charsetnr
def	test	t1	t1	c11	c11	8	20	0	Y	32768	0	63
+------+
| c11  |
+------+
+------+
delete from t1;
insert into t1 (c12) select c1 from t2;
insert into t1 (c12) select c2 from t2;
select c12 from t1 order by 1;
Catalog	Database	Table	Table_alias	Column	Column_alias	Type	Length	Max length	Is_null	Flags	Decimals	Charsetnr
def	test	t1	t1	c12	c12	8	20	0	Y	32800	0	63
+------+
| c12  |
+------+
+------+
delete from t1;
insert into t1 (c13) select c1 from t2;
insert into t1 (c13) select c2 from t2;
select c13 from t1 order by 1;
Catalog	Database	Table	Table_alias	Column	Column_alias	Type	Length	Max length	Is_null	Flags	Decimals	Charsetnr
def	test	t1	t1	c13	c13	4	12	0	Y	32768	31	63
+------+
| c13  |
+------+
+------+
delete from t1;
insert into t1 (c14) select c1 from t2;
insert into t1 (c14) select c2 from t2;
select c14 from t1 order by 1;
Catalog	Database	Table	Table_alias	Column	Column_alias	Type	Length	Max length	Is_null	Flags	Decimals	Charsetnr
def	test	t1	t1	c14	c14	4	12	0	Y	32800	31	63
+------+
| c14  |
+------+
+------+
delete from t1;
insert into t1 (c15) select c1 from t2;
insert into t1 (c15) select c2 from t2;
select c15 from t1 order by 1;
Catalog	Database	Table	Table_alias	Column	Column_alias	Type	Length	Max length	Is_null	Flags	Decimals	Charsetnr
def	test	t1	t1	c15	c15	5	23	0	Y	32768	31	63
+------+
| c15  |
+------+
+------+
delete from t1;
insert into t1 (c16) select c1 from t2;
insert into t1 (c16) select c2 from t2;
select c16 from t1 order by 1;
Catalog	Database	Table	Table_alias	Column	Column_alias	Type	Length	Max length	Is_null	Flags	Decimals	Charsetnr
def	test	t1	t1	c16	c16	5	23	0	Y	32800	31	63
+------+
| c16  |
+------+
+------+
delete from t1;
insert into t1 (c17) select c1 from t2;
insert into t1 (c17) select c2 from t2;
select c17 from t1 order by 1;
Catalog	Database	Table	Table_alias	Column	Column_alias	Type	Length	Max length	Is_null	Flags	Decimals	Charsetnr
def	test	t1	t1	c17	c17	246	11	0	Y	32768	0	63
+------+
| c17  |
+------+
+------+
delete from t1;
insert into t1 (c18) select c1 from t2;
insert into t1 (c18) select c2 from t2;
select c18 from t1 order by 1;
Catalog	Database	Table	Table_alias	Column	Column_alias	Type	Length	Max length	Is_null	Flags	Decimals	Charsetnr
def	test	t1	t1	c18	c18	246	10	0	Y	32800	0	63
+------+
| c18  |
+------+
+------+
delete from t1;
insert into t1 (c19) select c1 from t2;
insert into t1 (c19) select c2 from t2;
select c19 from t1 order by 1;
Catalog	Database	Table	Table_alias	Column	Column_alias	Type	Length	Max length	Is_null	Flags	Decimals	Charsetnr
def	test	t1	t1	c19	c19	12	19	0	Y	128	0	63
+------+
| c19  |
+------+
+------+
delete from t1;
insert into t1 (c20) select c1 from t2;
insert into t1 (c20) select c2 from t2;
select c20 from t1 order by 1;
Catalog	Database	Table	Table_alias	Column	Column_alias	Type	Length	Max length	Is_null	Flags	Decimals	Charsetnr
def	test	t1	t1	c20	c20	7	19	0	Y	1152	0	63
+------+
| c20  |
+------+
+------+
delete from t1;
insert into t1 (c21) select c1 from t2;
insert into t1 (c21) select c2 from t2;
select c21 from t1 order by 1;
Catalog	Database	Table	Table_alias	Column	Column_alias	Type	Length	Max length	Is_null	Flags	Decimals	Charsetnr
def	test	t1	t1	c21	c21	13	4	0	Y	32864	0	63
+------+
| c21  |
+------+
+------+
delete from t1;
insert into t1 (c22) select c1 from t2;
insert into t1 (c22) select c2 from t2;
select c22 from t1 order by 1;
Catalog	Database	Table	Table_alias	Column	Column_alias	Type	Length	Max length	Is_null	Flags	Decimals	Charsetnr
def	test	t1	t1	c22	c22	10	10	0	Y	128	0	63
+------+
| c22  |
+------+
+------+
delete from t1;
insert into t1 (c23) select c1 from t2;
insert into t1 (c23) select c2 from t2;
select c23 from t1 order by 1;
Catalog	Database	Table	Table_alias	Column	Column_alias	Type	Length	Max length	Is_null	Flags	Decimals	Charsetnr
def	test	t1	t1	c23	c23	11	10	0	Y	128	0	63
+------+
| c23  |
+------+
+------+
delete from t1;
insert into t1 (c24) select c1 from t2;
insert into t1 (c24) select c2 from t2;
select c24 from t1 order by 1;
Catalog	Database	Table	Table_alias	Column	Column_alias	Type	Length	Max length	Is_null	Flags	Decimals	Charsetnr
def	test	t1	t1	c24	c24	253	120	0	Y	0	0	45
+------+
| c24  |
+------+
+------+
delete from t1;
insert into t1 (c25) select c1 from t2;
insert into t1 (c25) select c2 from t2;
select c25 from t1 order by 1;
Catalog	Database	Table	Table_alias	Column	Column_alias	Type	Length	Max length	Is_null	Flags	Decimals	Charsetnr
def	test	t1	t1	c25	c25	254	120	0	Y	0	0	45
+------+
| c25  |
+------+
+------+
delete from t1;
insert into t1 (c26) select c1 from t2;
insert into t1 (c26) select c2 from t2;
select c26 from t1 order by 1;
Catalog	Database	Table	Table_alias	Column	Column_alias	Type	Length	Max length	Is_null	Flags	Decimals	Charsetnr
def	test	t1	t1	c26	c26	253	30	0	Y	128	0	63
+------+
| c26  |
+------+
+------+
delete from t1;
insert into t1 (c27) select c1 from t2;
insert into t1 (c27) select c2 from t2;
select c27 from t1 order by 1;
Catalog	Database	Table	Table_alias	Column	Column_alias	Type	Length	Max length	Is_null	Flags	Decimals	Charsetnr
def	test	t1	t1	c27	c27	254	30	0	Y	128	0	63
+------+
| c27  |
+------+
+------+

drop table t1, t2;
drop table if exists z0case, z1case;
explain_protocol: 0
create table z0case(z0_test0 enum('中文字符 ','123456','ABCabc ','!@#$%^&*','2020-11-10'),z0_test1 char(100) );
insert into z0case values('中文字符','中文字符');
insert into z0case values('123456','123456');
insert into z0case values('ABCabc','ABC abc');
insert into z0case values('!@#$%^&*','!@#$%^&*');

create table z1case(z1_test5 DECIMAL);
insert into z1case values('123456');

update z0case set z0_test0=(select z1_test5 from z1case where z1_test5='1234156') limit 1;

update z0case set z0_test0=null limit 1;
update z0case set z0_test0=cast(null as decimal) limit 1;
update z0case set z0_test0=cast(null as number) limit 1;

drop table z0case;

##bugfix: 
drop table if exists tbl_19;
CREATE TABLE `tbl_19` (
  `col_111` int(11) NOT NULL,
  `col_112` float NOT NULL,
  `col_113` set('Alice','Bob','Charlie','David') NOT NULL,
  `col_114` enum('Alice','Bob','Charlie','David') NOT NULL,
  `col_115` mediumint(8) unsigned NOT NULL DEFAULT '10109932',
  `col_116` tinyint(3) unsigned NOT NULL DEFAULT '118',
  `col_117` json DEFAULT NULL,
  `col_118` varbinary(488) NOT NULL DEFAULT 'v@',
  `col_119` bigint(20) NOT NULL DEFAULT '5717840293670355732',
  `col_120` json DEFAULT NULL,
  `col_121` varbinary(88) NOT NULL,
  `col_122` decimal(28,1) NOT NULL,
  `col_123` bigint(20) NOT NULL DEFAULT '6623545682150549061',
  `col_124` double DEFAULT NULL,
  `col_125` date DEFAULT '2007-10-23',
  `col_126` date DEFAULT NULL,
  `col_127` varbinary(348) DEFAULT NULL,
  `col_128` text NOT NULL,
  `col_129` blob NOT NULL,
  `col_130` double DEFAULT '1992.2454747031088',
  `col_131` bigint(20) unsigned NOT NULL,
  `col_132` enum('Alice','Bob','Charlie','David') NOT NULL,
  `col_133` datetime NOT NULL,
  `col_134` set('Alice','Bob','Charlie','David') DEFAULT 'Alice',
  PRIMARY KEY (`col_116`, `col_123`, `col_114`, `col_132`, `col_115`),
  UNIQUE KEY `idx_15` (`col_116`, `col_111`, `col_133`) BLOCK_SIZE 16384 GLOBAL,
  UNIQUE KEY `idx_2196` (`col_116`, `col_124`, `col_126`) BLOCK_SIZE 16384 GLOBAL,
  KEY `idx_14` (`col_126`) BLOCK_SIZE 16384 GLOBAL
);
update tbl_19 set col_113 = tbl_19.col_128,  col_129 =(tbl_19.col_113 not  in ( cast(null as CHAR),  tbl_19.col_118));
drop table tbl_19;
