explain_protocol: 2
result_format: 4
alter system set enable_async_syslog = false;


drop table if exists xy_t;
create table xy_t(a int, b int, c int, d int, e int, primary key(a,b,c), unique index g_idx_bc(b,c) global) partition by hash(b) partitions 2;
insert/*trace*/ into xy_t values(0,0,0,0,0), (1,1,1,1,1), (2,2,2,2,2);

********************** case 1: 主键、唯一索引均冲突的的情况
EXPLAIN replace into xy_t value(0, 0, 0, 0, 1);
Query Plan
===================================================
|ID|OPERATOR           |NAME|EST.ROWS|EST.TIME(us)|
---------------------------------------------------
|0 |DISTRIBUTED REPLACE|    |1       |20          |
|1 |└─EXPRESSION       |    |1       |1           |
===================================================
Outputs & filters:
-------------------------------------
  0 - output(nil), filter(nil)
      columns([{xy_t: ({xy_t: (xy_t.a, xy_t.b, xy_t.c, xy_t.d, xy_t.e)}, {g_idx_bc: (xy_t.b, xy_t.c, xy_t.a)})}]), 
      column_values([column_conv(INT,PS:(11,0),NOT NULL,__values.a)], [column_conv(INT,PS:(11,0),NOT NULL,__values.b)], [column_conv(INT,PS:(11,0),NOT NULL,
      __values.c)], [column_conv(INT,PS:(11,0),NULL,__values.d)], [column_conv(INT,PS:(11,0),NULL,__values.e)])
  1 - output([__values.a], [__values.b], [__values.c], [__values.d], [__values.e]), filter(nil)
      values({0, 0, 0, 0, 1})
replace into xy_t value(0, 0, 0, 0, 1);
# 验证索引结果正确
EXPLAIN select /*+ index(xy_t primary)*/ * from xy_t;
Query Plan
=============================================================
|ID|OPERATOR                 |NAME    |EST.ROWS|EST.TIME(us)|
-------------------------------------------------------------
|0 |PX COORDINATOR           |        |3       |12          |
|1 |└─EXCHANGE OUT DISTR     |:EX10000|3       |10          |
|2 |  └─PX PARTITION ITERATOR|        |3       |5           |
|3 |    └─TABLE FULL SCAN    |xy_t    |3       |5           |
=============================================================
Outputs & filters:
-------------------------------------
  0 - output([INTERNAL_FUNCTION(xy_t.a, xy_t.b, xy_t.c, xy_t.d, xy_t.e)]), filter(nil), rowset=16
  1 - output([INTERNAL_FUNCTION(xy_t.a, xy_t.b, xy_t.c, xy_t.d, xy_t.e)]), filter(nil), rowset=16
      dop=1
  2 - output([xy_t.a], [xy_t.b], [xy_t.c], [xy_t.d], [xy_t.e]), filter(nil), rowset=16
      force partition granule
  3 - output([xy_t.a], [xy_t.b], [xy_t.c], [xy_t.d], [xy_t.e]), filter(nil), rowset=16
      access([xy_t.a], [xy_t.b], [xy_t.c], [xy_t.d], [xy_t.e]), partitions(p[0-1])
      is_index_back=false, is_global_index=false, 
      range_key([xy_t.a], [xy_t.b], [xy_t.c]), range(MIN,MIN,MIN ; MAX,MAX,MAX)always true
select /*+ index(xy_t primary)*/ * from xy_t;
+---+---+---+------+------+
| a | b | c | d    | e    |
+---+---+---+------+------+
| 0 | 0 | 0 |    0 |    1 |
| 2 | 2 | 2 |    2 |    2 |
| 1 | 1 | 1 |    1 |    1 |
+---+---+---+------+------+
EXPLAIN select /*+ index(xy_t g_idx_bc)*/ b, c from xy_t;
Query Plan
=========================================================
|ID|OPERATOR       |NAME          |EST.ROWS|EST.TIME(us)|
---------------------------------------------------------
|0 |TABLE FULL SCAN|xy_t(g_idx_bc)|3       |3           |
=========================================================
Outputs & filters:
-------------------------------------
  0 - output([xy_t.b], [xy_t.c]), filter(nil), rowset=16
      access([xy_t.b], [xy_t.c]), partitions(p0)
      is_index_back=false, is_global_index=true, 
      range_key([xy_t.b], [xy_t.c], [xy_t.shadow_pk_0], [xy_t.shadow_pk_1], [xy_t.shadow_pk_2]), range(MIN,MIN,MIN,MIN,MIN ; MAX,MAX,MAX,MAX,MAX)always 
      true
select /*+ index(xy_t g_idx_bc)*/ b, c from xy_t;
+---+---+
| b | c |
+---+---+
| 0 | 0 |
| 1 | 1 |
| 2 | 2 |
+---+---+

********************** case 2: 索引冲突的的情况
EXPLAIN replace into xy_t value(0, 0, 0, 1, 2);
Query Plan
===================================================
|ID|OPERATOR           |NAME|EST.ROWS|EST.TIME(us)|
---------------------------------------------------
|0 |DISTRIBUTED REPLACE|    |1       |20          |
|1 |└─EXPRESSION       |    |1       |1           |
===================================================
Outputs & filters:
-------------------------------------
  0 - output(nil), filter(nil)
      columns([{xy_t: ({xy_t: (xy_t.a, xy_t.b, xy_t.c, xy_t.d, xy_t.e)}, {g_idx_bc: (xy_t.b, xy_t.c, xy_t.a)})}]), 
      column_values([column_conv(INT,PS:(11,0),NOT NULL,__values.a)], [column_conv(INT,PS:(11,0),NOT NULL,__values.b)], [column_conv(INT,PS:(11,0),NOT NULL,
      __values.c)], [column_conv(INT,PS:(11,0),NULL,__values.d)], [column_conv(INT,PS:(11,0),NULL,__values.e)])
  1 - output([__values.a], [__values.b], [__values.c], [__values.d], [__values.e]), filter(nil)
      values({0, 0, 0, 1, 2})
replace into xy_t value(0, 0, 0, 1, 2);
# 验证索引结果正确
EXPLAIN select /*+ index(xy_t primary)*/ * from xy_t;
Query Plan
=============================================================
|ID|OPERATOR                 |NAME    |EST.ROWS|EST.TIME(us)|
-------------------------------------------------------------
|0 |PX COORDINATOR           |        |3       |12          |
|1 |└─EXCHANGE OUT DISTR     |:EX10000|3       |10          |
|2 |  └─PX PARTITION ITERATOR|        |3       |5           |
|3 |    └─TABLE FULL SCAN    |xy_t    |3       |5           |
=============================================================
Outputs & filters:
-------------------------------------
  0 - output([INTERNAL_FUNCTION(xy_t.a, xy_t.b, xy_t.c, xy_t.d, xy_t.e)]), filter(nil), rowset=16
  1 - output([INTERNAL_FUNCTION(xy_t.a, xy_t.b, xy_t.c, xy_t.d, xy_t.e)]), filter(nil), rowset=16
      dop=1
  2 - output([xy_t.a], [xy_t.b], [xy_t.c], [xy_t.d], [xy_t.e]), filter(nil), rowset=16
      force partition granule
  3 - output([xy_t.a], [xy_t.b], [xy_t.c], [xy_t.d], [xy_t.e]), filter(nil), rowset=16
      access([xy_t.a], [xy_t.b], [xy_t.c], [xy_t.d], [xy_t.e]), partitions(p[0-1])
      is_index_back=false, is_global_index=false, 
      range_key([xy_t.a], [xy_t.b], [xy_t.c]), range(MIN,MIN,MIN ; MAX,MAX,MAX)always true
select /*+ index(xy_t primary)*/ * from xy_t;
+---+---+---+------+------+
| a | b | c | d    | e    |
+---+---+---+------+------+
| 0 | 0 | 0 |    1 |    2 |
| 2 | 2 | 2 |    2 |    2 |
| 1 | 1 | 1 |    1 |    1 |
+---+---+---+------+------+
EXPLAIN select /*+ index(xy_t g_idx_bc)*/ b, c from xy_t;
Query Plan
=========================================================
|ID|OPERATOR       |NAME          |EST.ROWS|EST.TIME(us)|
---------------------------------------------------------
|0 |TABLE FULL SCAN|xy_t(g_idx_bc)|3       |3           |
=========================================================
Outputs & filters:
-------------------------------------
  0 - output([xy_t.b], [xy_t.c]), filter(nil), rowset=16
      access([xy_t.b], [xy_t.c]), partitions(p0)
      is_index_back=false, is_global_index=true, 
      range_key([xy_t.b], [xy_t.c], [xy_t.shadow_pk_0], [xy_t.shadow_pk_1], [xy_t.shadow_pk_2]), range(MIN,MIN,MIN,MIN,MIN ; MAX,MAX,MAX,MAX,MAX)always 
      true
select /*+ index(xy_t g_idx_bc)*/ b, c from xy_t;
+---+---+
| b | c |
+---+---+
| 0 | 0 |
| 1 | 1 |
| 2 | 2 |
+---+---+

********************** case 3: 多行插入, 增量自身主键冲突的情况
EXPLAIN replace into xy_t value(2,1,1,3,2), (2,1,1,4,3);
Query Plan
===================================================
|ID|OPERATOR           |NAME|EST.ROWS|EST.TIME(us)|
---------------------------------------------------
|0 |DISTRIBUTED REPLACE|    |2       |26          |
|1 |└─EXPRESSION       |    |2       |1           |
===================================================
Outputs & filters:
-------------------------------------
  0 - output(nil), filter(nil)
      columns([{xy_t: ({xy_t: (xy_t.a, xy_t.b, xy_t.c, xy_t.d, xy_t.e)}, {g_idx_bc: (xy_t.b, xy_t.c, xy_t.a)})}]), 
      column_values([column_conv(INT,PS:(11,0),NOT NULL,__values.a)], [column_conv(INT,PS:(11,0),NOT NULL,__values.b)], [column_conv(INT,PS:(11,0),NOT NULL,
      __values.c)], [column_conv(INT,PS:(11,0),NULL,__values.d)], [column_conv(INT,PS:(11,0),NULL,__values.e)])
  1 - output([__values.a], [__values.b], [__values.c], [__values.d], [__values.e]), filter(nil)
      values({2, 1, 1, 3, 2}, {2, 1, 1, 4, 3})
replace into xy_t value(2,1,1,3,2), (2,1,1,4,3);
# 验证索引结果正确
EXPLAIN select /*+ index(xy_t primary)*/ * from xy_t;
Query Plan
=============================================================
|ID|OPERATOR                 |NAME    |EST.ROWS|EST.TIME(us)|
-------------------------------------------------------------
|0 |PX COORDINATOR           |        |3       |13          |
|1 |└─EXCHANGE OUT DISTR     |:EX10000|3       |10          |
|2 |  └─PX PARTITION ITERATOR|        |3       |5           |
|3 |    └─TABLE FULL SCAN    |xy_t    |3       |5           |
=============================================================
Outputs & filters:
-------------------------------------
  0 - output([INTERNAL_FUNCTION(xy_t.a, xy_t.b, xy_t.c, xy_t.d, xy_t.e)]), filter(nil), rowset=16
  1 - output([INTERNAL_FUNCTION(xy_t.a, xy_t.b, xy_t.c, xy_t.d, xy_t.e)]), filter(nil), rowset=16
      dop=1
  2 - output([xy_t.a], [xy_t.b], [xy_t.c], [xy_t.d], [xy_t.e]), filter(nil), rowset=16
      force partition granule
  3 - output([xy_t.a], [xy_t.b], [xy_t.c], [xy_t.d], [xy_t.e]), filter(nil), rowset=16
      access([xy_t.a], [xy_t.b], [xy_t.c], [xy_t.d], [xy_t.e]), partitions(p[0-1])
      is_index_back=false, is_global_index=false, 
      range_key([xy_t.a], [xy_t.b], [xy_t.c]), range(MIN,MIN,MIN ; MAX,MAX,MAX)always true
select /*+ index(xy_t primary)*/ * from xy_t;
+---+---+---+------+------+
| a | b | c | d    | e    |
+---+---+---+------+------+
| 0 | 0 | 0 |    1 |    2 |
| 2 | 2 | 2 |    2 |    2 |
| 2 | 1 | 1 |    4 |    3 |
+---+---+---+------+------+
EXPLAIN select /*+ index(xy_t g_idx_bc)*/ b, c from xy_t;
Query Plan
=========================================================
|ID|OPERATOR       |NAME          |EST.ROWS|EST.TIME(us)|
---------------------------------------------------------
|0 |TABLE FULL SCAN|xy_t(g_idx_bc)|3       |3           |
=========================================================
Outputs & filters:
-------------------------------------
  0 - output([xy_t.b], [xy_t.c]), filter(nil), rowset=16
      access([xy_t.b], [xy_t.c]), partitions(p0)
      is_index_back=false, is_global_index=true, 
      range_key([xy_t.b], [xy_t.c], [xy_t.shadow_pk_0], [xy_t.shadow_pk_1], [xy_t.shadow_pk_2]), range(MIN,MIN,MIN,MIN,MIN ; MAX,MAX,MAX,MAX,MAX)always 
      true
select /*+ index(xy_t g_idx_bc)*/ b, c from xy_t;
+---+---+
| b | c |
+---+---+
| 0 | 0 |
| 1 | 1 |
| 2 | 2 |
+---+---+

bug: 
drop table if exists test;
create table test(c1 int primary key, c2 int, c3 varchar(32), c4 int, c5 int, unique key u_idx(c1, c4), unique key t_index3(c1,c3) local) partition by hash(c1) partitions 3;
EXPLAIN insert into test values(12, 1, 4, 8, 4), (1, 2 , 2, 3, 3);
Query Plan
==================================================
|ID|OPERATOR          |NAME|EST.ROWS|EST.TIME(us)|
--------------------------------------------------
|0 |DISTRIBUTED INSERT|    |2       |20          |
|1 |└─EXPRESSION      |    |2       |1           |
==================================================
Outputs & filters:
-------------------------------------
  0 - output(nil), filter(nil)
      columns([{test: ({test: (test.c1, test.c2, test.c3, test.c4, test.c5)})}]), 
      column_values([column_conv(INT,PS:(11,0),NOT NULL,__values.c1)], [column_conv(INT,PS:(11,0),NULL,__values.c2)], [column_conv(VARCHAR,utf8mb4_general_ci,
      length:32,NULL,__values.c3)], [column_conv(INT,PS:(11,0),NULL,__values.c4)], [column_conv(INT,PS:(11,0),NULL,__values.c5)])
  1 - output([__values.c1], [__values.c2], [__values.c3], [__values.c4], [__values.c5]), filter(nil)
      values({12, 1, 4, 8, 4}, {1, 2, 2, 3, 3})
insert into test values(12, 1, 4, 8, 4), (1, 2 , 2, 3, 3);
EXPLAIN replace into test set c1 = c1+1, c2=0;
Query Plan
===================================================
|ID|OPERATOR           |NAME|EST.ROWS|EST.TIME(us)|
---------------------------------------------------
|0 |DISTRIBUTED REPLACE|    |1       |13          |
|1 |└─EXPRESSION       |    |1       |1           |
===================================================
Outputs & filters:
-------------------------------------
  0 - output(nil), filter(nil)
      columns([{test: ({test: (test.c1, test.c2, test.c3, test.c4, test.c5)})}]), 
      column_values([column_conv(INT,PS:(11,0),NOT NULL,__values.c1)], [column_conv(INT,PS:(11,0),NULL,__values.c2)], [column_conv(VARCHAR,utf8mb4_general_ci,
      length:32,NULL,cast(NULL, VARCHAR(1048576)))], [column_conv(INT,PS:(11,0),NULL,cast(NULL, INT(11, 0)))], [column_conv(INT,PS:(11,0),NULL,cast(NULL, INT(11,
       0)))])
  1 - output([__values.c1], [__values.c2]), filter(nil)
      values({column_conv(INT,PS:(11,0),NOT NULL,cast(0 + 1, INT(-1, 0))), column_conv(INT,PS:(11,0),NULL,0)})
replace into test set c1 = c1+1, c2=0;
EXPLAIN select * from test;
Query Plan
=============================================================
|ID|OPERATOR                 |NAME    |EST.ROWS|EST.TIME(us)|
-------------------------------------------------------------
|0 |PX COORDINATOR           |        |2       |13          |
|1 |└─EXCHANGE OUT DISTR     |:EX10000|2       |11          |
|2 |  └─PX PARTITION ITERATOR|        |2       |7           |
|3 |    └─TABLE FULL SCAN    |test    |2       |7           |
=============================================================
Outputs & filters:
-------------------------------------
  0 - output([INTERNAL_FUNCTION(test.c1, test.c2, test.c3, test.c4, test.c5)]), filter(nil), rowset=16
  1 - output([INTERNAL_FUNCTION(test.c1, test.c2, test.c3, test.c4, test.c5)]), filter(nil), rowset=16
      dop=1
  2 - output([test.c1], [test.c2], [test.c3], [test.c4], [test.c5]), filter(nil), rowset=16
      force partition granule
  3 - output([test.c1], [test.c2], [test.c3], [test.c4], [test.c5]), filter(nil), rowset=16
      access([test.c1], [test.c2], [test.c3], [test.c4], [test.c5]), partitions(p[0-2])
      is_index_back=false, is_global_index=false, 
      range_key([test.c1]), range(MIN ; MAX)always true
select * from test;
+----+------+------+------+------+
| c1 | c2   | c3   | c4   | c5   |
+----+------+------+------+------+
| 12 |    1 | 4    |    8 |    4 |
|  1 |    0 | NULL | NULL | NULL |
+----+------+------+------+------+
select/*+index(test t_index3)*/c1, c3 from test;
+----+------+
| c1 | c3   |
+----+------+
| 12 | 4    |
|  1 | NULL |
+----+------+

bug: 
drop table if exists test;
create table test(c1 int primary key, c2 int, c3 int, c4 char, c5 int default 0, unique key(c2,c3) global) partition by hash(c1) partitions 2;
EXPLAIN insert into test values
("2","2","4","1","1")
,("12","3",NULL,NULL,"0")
,("16","16","32","2","16")
,("1008","1011","2019","H","120000")
,("1","1","2",NULL,"1")
,("3",NULL,NULL,NULL,"2147483647")
,("5",NULL,NULL,NULL,"0");
Query Plan
==================================================
|ID|OPERATOR          |NAME|EST.ROWS|EST.TIME(us)|
--------------------------------------------------
|0 |DISTRIBUTED INSERT|    |7       |58          |
|1 |└─EXPRESSION      |    |7       |1           |
==================================================
Outputs & filters:
-------------------------------------
  0 - output(nil), filter(nil)
      columns([{test: ({test: (test.c1, test.c2, test.c3, test.c4, test.c5)}, {c2: (test.c2, test.c3, test.c1)})}]), 
      column_values([column_conv(INT,PS:(11,0),NOT NULL,__values.c1)], [column_conv(INT,PS:(11,0),NULL,__values.c2)], [column_conv(INT,PS:(11,0),NULL,__values.c3)],
       [column_conv(CHAR,utf8mb4_general_ci,length:1,NULL,__values.c4)], [column_conv(INT,PS:(11,0),NULL,__values.c5)])
  1 - output([__values.c1], [__values.c2], [__values.c3], [__values.c4], [__values.c5]), filter(nil)
      values({'2', '2', '4', '1', '1'}, {'12', '3', NULL, NULL, '0'}, {'16', '16', '32', '2', '16'}, {'1008', '1011', '2019', 'H', '120000'}, {'1', '1',
       '2', NULL, '1'}, {'3', NULL, NULL, NULL, '2147483647'}, {'5', NULL, NULL, NULL, '0'})
insert into test values
("2","2","4","1","1")
,("12","3",NULL,NULL,"0")
,("16","16","32","2","16")
,("1008","1011","2019","H","120000")
,("1","1","2",NULL,"1")
,("3",NULL,NULL,NULL,"2147483647")
,("5",NULL,NULL,NULL,"0");
EXPLAIN replace into test set c1 = 1, c2= 0;
Query Plan
===================================================
|ID|OPERATOR           |NAME|EST.ROWS|EST.TIME(us)|
---------------------------------------------------
|0 |DISTRIBUTED REPLACE|    |1       |20          |
|1 |└─EXPRESSION       |    |1       |1           |
===================================================
Outputs & filters:
-------------------------------------
  0 - output(nil), filter(nil)
      columns([{test: ({test: (test.c1, test.c2, test.c3, test.c4, test.c5)}, {c2: (test.c2, test.c3, test.c1)})}]), 
      column_values([column_conv(INT,PS:(11,0),NOT NULL,__values.c1)], [column_conv(INT,PS:(11,0),NULL,__values.c2)], [column_conv(INT,PS:(11,0),NULL,cast(NULL,
       INT(11, 0)))], [column_conv(CHAR,utf8mb4_general_ci,length:1,NULL,cast(NULL, CHAR(1048576)))], [column_conv(INT,PS:(11,0),NULL,0)])
  1 - output([__values.c1], [__values.c2]), filter(nil)
      values({column_conv(INT,PS:(11,0),NOT NULL,1), column_conv(INT,PS:(11,0),NULL,0)})
replace into test set c1 = 1, c2= 0;
EXPLAIN update test set c2 = 2;
Query Plan
===============================================================
|ID|OPERATOR                   |NAME    |EST.ROWS|EST.TIME(us)|
---------------------------------------------------------------
|0 |DISTRIBUTED UPDATE         |        |7       |123         |
|1 |└─PX COORDINATOR           |        |7       |22          |
|2 |  └─EXCHANGE OUT DISTR     |:EX10000|7       |17          |
|3 |    └─PX PARTITION ITERATOR|        |7       |5           |
|4 |      └─TABLE FULL SCAN    |test    |7       |5           |
===============================================================
Outputs & filters:
-------------------------------------
  0 - output(nil), filter(nil)
      table_columns([{test: ({test: (test.c1, test.c2, test.c3, test.c4, test.c5)}, {c2: (test.c2, test.c3, test.c1)})}]),
      update([test.c2=column_conv(INT,PS:(11,0),NULL,2)])
  1 - output([test.c1], [test.c2], [test.c3], [test.c4], [test.c5]), filter(nil), rowset=16
  2 - output([test.c1], [test.c2], [test.c3], [test.c4], [test.c5]), filter(nil), rowset=16
      dop=1
  3 - output([test.c1], [test.c2], [test.c3], [test.c4], [test.c5]), filter(nil), rowset=16
      force partition granule
  4 - output([test.c1], [test.c2], [test.c3], [test.c4], [test.c5]), filter(nil), rowset=16
      access([test.c1], [test.c2], [test.c3], [test.c4], [test.c5]), partitions(p[0-1])
      is_index_back=false, is_global_index=false, 
      range_key([test.c1]), range(MIN ; MAX)always true
update test set c2 = 2;
EXPLAIN select * from test;
Query Plan
=============================================================
|ID|OPERATOR                 |NAME    |EST.ROWS|EST.TIME(us)|
-------------------------------------------------------------
|0 |PX COORDINATOR           |        |7       |22          |
|1 |└─EXCHANGE OUT DISTR     |:EX10000|7       |17          |
|2 |  └─PX PARTITION ITERATOR|        |7       |5           |
|3 |    └─TABLE FULL SCAN    |test    |7       |5           |
=============================================================
Outputs & filters:
-------------------------------------
  0 - output([INTERNAL_FUNCTION(test.c1, test.c2, test.c3, test.c4, test.c5)]), filter(nil), rowset=16
  1 - output([INTERNAL_FUNCTION(test.c1, test.c2, test.c3, test.c4, test.c5)]), filter(nil), rowset=16
      dop=1
  2 - output([test.c1], [test.c2], [test.c3], [test.c4], [test.c5]), filter(nil), rowset=16
      force partition granule
  3 - output([test.c1], [test.c2], [test.c3], [test.c4], [test.c5]), filter(nil), rowset=16
      access([test.c1], [test.c2], [test.c3], [test.c4], [test.c5]), partitions(p[0-1])
      is_index_back=false, is_global_index=false, 
      range_key([test.c1]), range(MIN ; MAX)always true
select * from test;
+------+------+------+------+------------+
| c1   | c2   | c3   | c4   | c5         |
+------+------+------+------+------------+
|    2 |    2 |    4 | 1    |          1 |
|   12 |    2 | NULL | NULL |          0 |
|   16 |    2 |   32 | 2    |         16 |
| 1008 |    2 | 2019 | H    |     120000 |
|    1 |    2 | NULL | NULL |          0 |
|    3 |    2 | NULL | NULL | 2147483647 |
|    5 |    2 | NULL | NULL |          0 |
+------+------+------+------+------------+
select/*+index(test c2)*/ c2,c3,c1 from test;
+------+------+------+
| c2   | c3   | c1   |
+------+------+------+
|    2 | NULL |    1 |
|    2 | NULL |    3 |
|    2 | NULL |    5 |
|    2 | NULL |   12 |
|    2 |    4 |    2 |
|    2 |   32 |   16 |
|    2 | 2019 | 1008 |
+------+------+------+

drop table xy_t;
drop table test;

