explain_protocol: 1
result_format: 4
alter system set enable_async_syslog = false;


drop table if exists xy_t;
create table xy_t(a int, b int, c int, d int, e int, primary key(a,b,c), unique index g_idx_bc(b,c)) partition by hash(b) partitions 2;
create index g_idx_bde on xy_t(b, d, e) global partition by hash(b) partitions 3;

insert/*trace*/ into xy_t values(0,0,0,0,0), (1,1,1,1,1), (2,2,2,2,2), (3,3,3,3,3), (4,4,4,4,4);
EXPLAIN BASIC update /*+index(xy_t primary)*/ xy_t set c = 3 where b = 0 or b = 4 or b = 2;
Query Plan
============================
|ID|OPERATOR          |NAME|
----------------------------
|0 |DISTRIBUTED UPDATE|    |
|1 |└─TABLE FULL SCAN |xy_t|
============================
Outputs & filters:
-------------------------------------
  0 - output(nil), filter(nil)
      table_columns([{xy_t: ({xy_t: (xy_t.a, xy_t.b, xy_t.c, xy_t.d, xy_t.e)}, {g_idx_bde: (xy_t.b, xy_t.d, xy_t.e, xy_t.a, xy_t.c)})}]),
      update([xy_t.c=column_conv(INT,PS:(11,0),NOT NULL,3)])
  1 - output([xy_t.a], [xy_t.b], [xy_t.c], [xy_t.d], [xy_t.e]), filter([(T_OP_OR, xy_t.b = 0, xy_t.b = 4, xy_t.b = 2)]), rowset=16
      access([xy_t.a], [xy_t.b], [xy_t.c], [xy_t.d], [xy_t.e]), partitions(p0)
      is_index_back=false, is_global_index=false, filter_before_indexback[false], 
      range_key([xy_t.a], [xy_t.b], [xy_t.c]), range(MIN,MIN,MIN ; MAX,MAX,MAX)always true
update /*+index(xy_t primary)*/ xy_t set c = 3 where b = 0 or b = 4 or b = 2;
EXPLAIN BASIC update /*+index(xy_t primary)*/ xy_t set d = 8 where b = 0 or b = 4 or b = 2;
Query Plan
============================
|ID|OPERATOR          |NAME|
----------------------------
|0 |DISTRIBUTED UPDATE|    |
|1 |└─TABLE FULL SCAN |xy_t|
============================
Outputs & filters:
-------------------------------------
  0 - output(nil), filter(nil)
      table_columns([{xy_t: ({xy_t: (xy_t.a, xy_t.b, xy_t.c, xy_t.d, xy_t.e)}, {g_idx_bde: (xy_t.b, xy_t.d, xy_t.e, xy_t.a, xy_t.c)})}]),
      update([xy_t.d=column_conv(INT,PS:(11,0),NULL,8)])
  1 - output([xy_t.a], [xy_t.b], [xy_t.c], [xy_t.d], [xy_t.e]), filter([(T_OP_OR, xy_t.b = 0, xy_t.b = 4, xy_t.b = 2)]), rowset=16
      access([xy_t.a], [xy_t.b], [xy_t.c], [xy_t.d], [xy_t.e]), partitions(p0)
      is_index_back=false, is_global_index=false, filter_before_indexback[false], 
      range_key([xy_t.a], [xy_t.b], [xy_t.c]), range(MIN,MIN,MIN ; MAX,MAX,MAX)always true
update /*+index(xy_t primary)*/ xy_t set d = 8 where b = 0 or b = 4 or b = 2;
# 验证全局索引结果正确
EXPLAIN BASIC select /*+ index(xy_t primary)*/ * from xy_t;
Query Plan
=======================================
|ID|OPERATOR                 |NAME    |
---------------------------------------
|0 |PX COORDINATOR           |        |
|1 |└─EXCHANGE OUT DISTR     |:EX10000|
|2 |  └─PX PARTITION ITERATOR|        |
|3 |    └─TABLE FULL SCAN    |xy_t    |
=======================================
Outputs & filters:
-------------------------------------
  0 - output([INTERNAL_FUNCTION(xy_t.a, xy_t.b, xy_t.c, xy_t.d, xy_t.e)]), filter(nil), rowset=16
  1 - output([INTERNAL_FUNCTION(xy_t.a, xy_t.b, xy_t.c, xy_t.d, xy_t.e)]), filter(nil), rowset=16
      dop=1
  2 - output([xy_t.a], [xy_t.b], [xy_t.c], [xy_t.d], [xy_t.e]), filter(nil), rowset=16
      force partition granule
  3 - output([xy_t.a], [xy_t.b], [xy_t.c], [xy_t.d], [xy_t.e]), filter(nil), rowset=16
      access([xy_t.a], [xy_t.b], [xy_t.c], [xy_t.d], [xy_t.e]), partitions(p[0-1])
      is_index_back=false, is_global_index=false, 
      range_key([xy_t.a], [xy_t.b], [xy_t.c]), range(MIN,MIN,MIN ; MAX,MAX,MAX)always true
select /*+ index(xy_t primary)*/ * from xy_t;
+---+---+---+------+------+
| a | b | c | d    | e    |
+---+---+---+------+------+
| 0 | 0 | 3 |    8 |    0 |
| 2 | 2 | 3 |    8 |    2 |
| 4 | 4 | 3 |    8 |    4 |
| 1 | 1 | 1 |    1 |    1 |
| 3 | 3 | 3 |    3 |    3 |
+---+---+---+------+------+
EXPLAIN BASIC select /*+ index(xy_t g_idx_bc)*/ b, c from xy_t;
Query Plan
=============================================
|ID|OPERATOR                 |NAME          |
---------------------------------------------
|0 |PX COORDINATOR           |              |
|1 |└─EXCHANGE OUT DISTR     |:EX10000      |
|2 |  └─PX PARTITION ITERATOR|              |
|3 |    └─TABLE FULL SCAN    |xy_t(g_idx_bc)|
=============================================
Outputs & filters:
-------------------------------------
  0 - output([INTERNAL_FUNCTION(xy_t.b, xy_t.c)]), filter(nil), rowset=16
  1 - output([INTERNAL_FUNCTION(xy_t.b, xy_t.c)]), filter(nil), rowset=16
      dop=1
  2 - output([xy_t.b], [xy_t.c]), filter(nil), rowset=16
      force partition granule
  3 - output([xy_t.b], [xy_t.c]), filter(nil), rowset=16
      access([xy_t.b], [xy_t.c]), partitions(p[0-1])
      is_index_back=false, is_global_index=false, 
      range_key([xy_t.b], [xy_t.c], [xy_t.shadow_pk_0], [xy_t.shadow_pk_1], [xy_t.shadow_pk_2]), range(MIN,MIN,MIN,MIN,MIN ; MAX,MAX,MAX,MAX,MAX)always 
      true
select /*+ index(xy_t g_idx_bc)*/ b, c from xy_t;
+---+---+
| b | c |
+---+---+
| 0 | 3 |
| 2 | 3 |
| 4 | 3 |
| 1 | 1 |
| 3 | 3 |
+---+---+
EXPLAIN BASIC select /*+ index(xy_t g_idx_bde)*/ c, d, e from xy_t;
Query Plan
==============================================
|ID|OPERATOR                 |NAME           |
----------------------------------------------
|0 |PX COORDINATOR           |               |
|1 |└─EXCHANGE OUT DISTR     |:EX10000       |
|2 |  └─PX PARTITION ITERATOR|               |
|3 |    └─TABLE FULL SCAN    |xy_t(g_idx_bde)|
==============================================
Outputs & filters:
-------------------------------------
  0 - output([INTERNAL_FUNCTION(xy_t.c, xy_t.d, xy_t.e)]), filter(nil), rowset=16
  1 - output([INTERNAL_FUNCTION(xy_t.c, xy_t.d, xy_t.e)]), filter(nil), rowset=16
      dop=1
  2 - output([xy_t.c], [xy_t.d], [xy_t.e]), filter(nil), rowset=16
      force partition granule
  3 - output([xy_t.c], [xy_t.d], [xy_t.e]), filter(nil), rowset=16
      access([xy_t.c], [xy_t.d], [xy_t.e]), partitions(p[0-2])
      is_index_back=false, is_global_index=true, 
      range_key([xy_t.b], [xy_t.d], [xy_t.e], [xy_t.a], [xy_t.c]), range(MIN,MIN,MIN,MIN,MIN ; MAX,MAX,MAX,MAX,MAX)always true
select /*+ index(xy_t g_idx_bde)*/ c, d, e from xy_t;
+---+------+------+
| c | d    | e    |
+---+------+------+
| 3 |    8 |    0 |
| 3 |    3 |    3 |
| 1 |    1 |    1 |
| 3 |    8 |    4 |
| 3 |    8 |    2 |
+---+------+------+
drop table xy_t;


#bug: 
drop table if exists pindex1rujmz;
create table pindex1rujmz (c1 int primary key, c2 int, c3 int) partition by hash(c1) partitions 3;
create unique index pindex_i2 on pindex1rujmz(c2) global;
EXPLAIN BASIC insert into pindex1rujmz values (1,null,3),(2,null,4),(3,null,5);
Query Plan
============================
|ID|OPERATOR          |NAME|
----------------------------
|0 |DISTRIBUTED INSERT|    |
|1 |└─EXPRESSION      |    |
============================
Outputs & filters:
-------------------------------------
  0 - output(nil), filter(nil)
      columns([{pindex1rujmz: ({pindex1rujmz: (pindex1rujmz.c1, pindex1rujmz.c2, pindex1rujmz.c3)}, {pindex_i2: (pindex1rujmz.c2, pindex1rujmz.c1)})}]),
       
      column_values([column_conv(INT,PS:(11,0),NOT NULL,__values.c1)], [column_conv(INT,PS:(11,0),NULL,__values.c2)], [column_conv(INT,PS:(11,0),NULL,__values.c3)])
  1 - output([__values.c1], [__values.c2], [__values.c3]), filter(nil)
      values({1, NULL, 3}, {2, NULL, 4}, {3, NULL, 5})
insert into pindex1rujmz values (1,null,3),(2,null,4),(3,null,5);
EXPLAIN BASIC update pindex1rujmz set c2 = c3, c3 = 5;
Query Plan
=============================================
|ID|OPERATOR                   |NAME        |
---------------------------------------------
|0 |DISTRIBUTED UPDATE         |            |
|1 |└─PX COORDINATOR           |            |
|2 |  └─EXCHANGE OUT DISTR     |:EX10000    |
|3 |    └─PX PARTITION ITERATOR|            |
|4 |      └─TABLE FULL SCAN    |pindex1rujmz|
=============================================
Outputs & filters:
-------------------------------------
  0 - output(nil), filter(nil)
      table_columns([{pindex1rujmz: ({pindex1rujmz: (pindex1rujmz.c1, pindex1rujmz.c2, pindex1rujmz.c3)}, {pindex_i2: (pindex1rujmz.c2, pindex1rujmz.c1)})}]),
      
      update([pindex1rujmz.c2=column_conv(INT,PS:(11,0),NULL,pindex1rujmz.c3)], [pindex1rujmz.c3=column_conv(INT,PS:(11,0),NULL,5)])
  1 - output([pindex1rujmz.c1], [pindex1rujmz.c2], [pindex1rujmz.c3]), filter(nil), rowset=16
  2 - output([pindex1rujmz.c1], [pindex1rujmz.c2], [pindex1rujmz.c3]), filter(nil), rowset=16
      dop=1
  3 - output([pindex1rujmz.c1], [pindex1rujmz.c2], [pindex1rujmz.c3]), filter(nil), rowset=16
      force partition granule
  4 - output([pindex1rujmz.c1], [pindex1rujmz.c2], [pindex1rujmz.c3]), filter(nil), rowset=16
      access([pindex1rujmz.c1], [pindex1rujmz.c2], [pindex1rujmz.c3]), partitions(p[0-2])
      is_index_back=false, is_global_index=false, 
      range_key([pindex1rujmz.c1]), range(MIN ; MAX)always true
update pindex1rujmz set c2 = c3, c3 = 5;
# 验证结果正确
EXPLAIN BASIC select * from pindex1rujmz;
Query Plan
===========================================
|ID|OPERATOR                 |NAME        |
-------------------------------------------
|0 |PX COORDINATOR           |            |
|1 |└─EXCHANGE OUT DISTR     |:EX10000    |
|2 |  └─PX PARTITION ITERATOR|            |
|3 |    └─TABLE FULL SCAN    |pindex1rujmz|
===========================================
Outputs & filters:
-------------------------------------
  0 - output([INTERNAL_FUNCTION(pindex1rujmz.c1, pindex1rujmz.c2, pindex1rujmz.c3)]), filter(nil), rowset=16
  1 - output([INTERNAL_FUNCTION(pindex1rujmz.c1, pindex1rujmz.c2, pindex1rujmz.c3)]), filter(nil), rowset=16
      dop=1
  2 - output([pindex1rujmz.c1], [pindex1rujmz.c2], [pindex1rujmz.c3]), filter(nil), rowset=16
      force partition granule
  3 - output([pindex1rujmz.c1], [pindex1rujmz.c2], [pindex1rujmz.c3]), filter(nil), rowset=16
      access([pindex1rujmz.c1], [pindex1rujmz.c2], [pindex1rujmz.c3]), partitions(p[0-2])
      is_index_back=false, is_global_index=false, 
      range_key([pindex1rujmz.c1]), range(MIN ; MAX)always true
select * from pindex1rujmz;
+----+------+------+
| c1 | c2   | c3   |
+----+------+------+
|  3 |    5 |    5 |
|  1 |    3 |    5 |
|  2 |    4 |    5 |
+----+------+------+
EXPLAIN BASIC select /*+index(t pindex_i2)*/ c2 from pindex1rujmz t;
Query Plan
=================================
|ID|OPERATOR       |NAME        |
---------------------------------
|0 |TABLE FULL SCAN|t(pindex_i2)|
=================================
Outputs & filters:
-------------------------------------
  0 - output([t.c2]), filter(nil), rowset=16
      access([t.c2]), partitions(p0)
      is_index_back=false, is_global_index=true, 
      range_key([t.c2], [t.shadow_pk_0]), range(MIN,MIN ; MAX,MAX)always true
select /*+index(t pindex_i2)*/ c2 from pindex1rujmz t;
+------+
| c2   |
+------+
|    3 |
|    4 |
|    5 |
+------+
drop table pindex1rujmz;


#bug: 
drop table if exists t1;
CREATE TABLE `t1` (
  `c0` float DEFAULT NULL COMMENT 'asdf',
  `c1` float DEFAULT NULL,
  UNIQUE KEY `c0` (`c0`) BLOCK_SIZE 16384 GLOBAL,
  UNIQUE KEY i450(c0) global,
  key i950(c1, c0)
) partition by key(c1, c0) partitions 2;
EXPLAIN BASIC insert into t1 values(1,1);
Query Plan
============================
|ID|OPERATOR          |NAME|
----------------------------
|0 |DISTRIBUTED INSERT|    |
|1 |└─EXPRESSION      |    |
============================
Outputs & filters:
-------------------------------------
  0 - output(nil), filter(nil)
      columns([{t1: ({t1: (t1.__pk_increment, t1.c0, t1.c1)}, {c0: (t1.c0, t1.__pk_increment, t1.c1)}, {i450: (t1.c0, t1.__pk_increment, t1.c1)})}]), 
      column_values([T_HIDDEN_PK], [column_conv(FLOAT,PS:(-1,-1),NULL,__values.c0)], [column_conv(FLOAT,PS:(-1,-1),NULL,__values.c1)])
  1 - output([__values.c0], [__values.c1]), filter(nil)
      values({1, 1})
insert into t1 values(1,1);
EXPLAIN BASIC UPDATE t1 SET c0= EXISTS (SELECT 1 from dual wHERE FALSE), c1=1.165811464E9;
Query Plan
==============================
|ID|OPERATOR          |NAME  |
------------------------------
|0 |DISTRIBUTED UPDATE|      |
|1 |└─TABLE FULL SCAN |t1(c0)|
==============================
Outputs & filters:
-------------------------------------
  0 - output(nil), filter(nil)
      table_columns([{t1: ({t1: (t1.__pk_increment, t1.c0, t1.c1)}, {c0: (t1.c0, t1.__pk_increment, t1.c1)}, {i450: (t1.c0, t1.__pk_increment, t1.c1)})}]),
      
      update([t1.c0=column_conv(FLOAT,PS:(-1,-1),NULL,cast(0, FLOAT(-1, -1)))], [t1.c1=column_conv(FLOAT,PS:(-1,-1),NULL,1165811464)], [t1.__pk_increment=T_HIDDEN_PK])
  1 - output([t1.__pk_increment], [t1.c1], [t1.c0]), filter(nil), rowset=16
      access([t1.__pk_increment], [t1.c1], [t1.c0]), partitions(p0)
      is_index_back=false, is_global_index=true, 
      range_key([t1.c0], [t1.shadow_pk_0], [t1.shadow_pk_1], [t1.shadow_pk_2]), range(MIN,MIN,MIN,MIN ; MAX,MAX,MAX,MAX)always true
UPDATE t1 SET c0= EXISTS (SELECT 1 from dual wHERE FALSE), c1=1.165811464E9;
#验证结果
select/*trace*/ * from t1;
+------+------------+
| c0   | c1         |
+------+------------+
|    0 | 1165810000 |
+------+------------+
drop table t1;

