explain_protocol: 2
result_format: 4
alter system set enable_async_syslog = false;


drop table if exists t1;
create table xy_t(a int, b int, c int, d int, e int, primary key(a,b,c,d), index g_idx(b,c)) partition by hash(b) partitions 2;
insert/*trace*/ into xy_t values(1,1,1,1,1);
insert/*trace*/ into xy_t values(2,2,2,2,2);
insert/*trace*/ into xy_t values(3,3,3,3,3);

EXPLAIN select /*+ index(xy_t g_idx)*/ * from xy_t  where a > 0;
Query Plan
================================================================
|ID|OPERATOR                 |NAME       |EST.ROWS|EST.TIME(us)|
----------------------------------------------------------------
|0 |PX COORDINATOR           |           |1       |11          |
|1 |└─EXCHANGE OUT DISTR     |:EX10000   |1       |11          |
|2 |  └─PX PARTITION ITERATOR|           |1       |10          |
|3 |    └─TABLE FULL SCAN    |xy_t(g_idx)|1       |10          |
================================================================
Outputs & filters:
-------------------------------------
  0 - output([INTERNAL_FUNCTION(xy_t.a, xy_t.b, xy_t.c, xy_t.d, xy_t.e)]), filter(nil), rowset=16
  1 - output([INTERNAL_FUNCTION(xy_t.a, xy_t.b, xy_t.c, xy_t.d, xy_t.e)]), filter(nil), rowset=16
      dop=1
  2 - output([xy_t.a], [xy_t.b], [xy_t.c], [xy_t.d], [xy_t.e]), filter(nil), rowset=16
      force partition granule
  3 - output([xy_t.a], [xy_t.b], [xy_t.c], [xy_t.d], [xy_t.e]), filter([xy_t.a > 0]), rowset=16
      access([xy_t.a], [xy_t.b], [xy_t.c], [xy_t.d], [xy_t.e]), partitions(p[0-1])
      is_index_back=true, is_global_index=false, filter_before_indexback[true], 
      range_key([xy_t.b], [xy_t.c], [xy_t.a], [xy_t.d]), range(MIN,MIN,MIN,MIN ; MAX,MAX,MAX,MAX)always true
select /*+ index(xy_t g_idx)*/ * from xy_t  where a > 0;
+---+---+---+---+------+
| a | b | c | d | e    |
+---+---+---+---+------+
| 2 | 2 | 2 | 2 |    2 |
| 1 | 1 | 1 | 1 |    1 |
| 3 | 3 | 3 | 3 |    3 |
+---+---+---+---+------+
EXPLAIN select /*+ index(xy_t g_idx)*/ * from xy_t  where b = 1;
Query Plan
=======================================================
|ID|OPERATOR        |NAME       |EST.ROWS|EST.TIME(us)|
-------------------------------------------------------
|0 |TABLE RANGE SCAN|xy_t(g_idx)|1       |7           |
=======================================================
Outputs & filters:
-------------------------------------
  0 - output([xy_t.a], [xy_t.b], [xy_t.c], [xy_t.d], [xy_t.e]), filter(nil), rowset=16
      access([xy_t.a], [xy_t.b], [xy_t.c], [xy_t.d], [xy_t.e]), partitions(p1)
      is_index_back=true, is_global_index=false, 
      range_key([xy_t.b], [xy_t.c], [xy_t.a], [xy_t.d]), range(1,MIN,MIN,MIN ; 1,MAX,MAX,MAX), 
      range_cond([xy_t.b = 1])
select /*+ index(xy_t g_idx)*/ * from xy_t  where b = 1;
+---+---+---+---+------+
| a | b | c | d | e    |
+---+---+---+---+------+
| 1 | 1 | 1 | 1 |    1 |
+---+---+---+---+------+

bug:
drop table if exists obright_part;
CREATE TABLE `obright_part` (
  `grp_id` bigint(20) NOT NULL,
  `row_id` bigint(20) NOT NULL,
  `row_hex` varchar(2048) NOT NULL,
  `trx_grp` bigint(20) DEFAULT NULL,
  `v1` varchar(65536) DEFAULT NULL,
  `v1_check` bigint(20) DEFAULT NULL,
  `v2` varchar(65536) DEFAULT NULL,
  `v2_check` bigint(20) DEFAULT NULL,
  `r1` int(11) DEFAULT NULL,
  `r2` int(11) DEFAULT NULL,
  `glike` varchar(4096) DEFAULT NULL,
  `c1` bigint(20) DEFAULT NULL,
  `c2` bigint(20) DEFAULT NULL,
  `c3` bigint(20) DEFAULT NULL,
  `c4` bigint(20) DEFAULT NULL,
  `c5` bigint(20) DEFAULT NULL,
  `c6` tinyint(4) DEFAULT NULL,
  `c7` bigint(20) DEFAULT NULL,
  `c8` bigint(20) DEFAULT NULL,
  `c9` bigint(20) DEFAULT NULL,
  `c10` bigint(20) DEFAULT NULL,
  `v3` varchar(1024) DEFAULT NULL,
  `ts` timestamp(6) NULL DEFAULT CURRENT_TIMESTAMP(6) ON UPDATE CURRENT_TIMESTAMP(6),
  `t1` timestamp(6) NULL DEFAULT NULL,
  `t2` datetime(6) DEFAULT NULL,
  `dec1` decimal(16,4) DEFAULT NULL,
  `dec2` decimal(16,4) DEFAULT NULL,
  `dec3` decimal(16,6) DEFAULT NULL,
  `b1` tinyint(1) DEFAULT NULL,
  `d1` bigint(20) DEFAULT '0',
  `ac1` bigint(20) NOT NULL AUTO_INCREMENT,
  `gmt_create` timestamp(6) NULL DEFAULT CURRENT_TIMESTAMP(6),
  `gmt_modified` timestamp(6) NULL DEFAULT CURRENT_TIMESTAMP(6),
  `gen_v1` varchar(10) GENERATED ALWAYS AS (substr(`v1`,1,10)) VIRTUAL,
  `gen_v2` varchar(10) GENERATED ALWAYS AS (substr(`v1`,1,10)) STORED,
  PRIMARY KEY (`grp_id`, `row_id`, `row_hex`),
  UNIQUE KEY `obright_part1_uniq` (`t1`, `grp_id`, `row_id`, `row_hex`) BLOCK_SIZE 16384 GLOBAL,
  UNIQUE KEY `obright_part2_uniq` (`trx_grp`, `r1`, `row_hex`, `row_id`, `grp_id`) BLOCK_SIZE 16384 GLOBAL,
  UNIQUE KEY `obright_part3_uniq` (`row_hex`, `grp_id`, `row_id`) BLOCK_SIZE 16384 GLOBAL,
  UNIQUE KEY `obright_part4_uniq` (`trx_grp`, `row_hex`, `grp_id`) STORING (`v1`, `v1_check`, `r1`, `r2`) BLOCK_SIZE 16384 LOCAL,
  KEY `obright_part2` (`trx_grp`, `row_id`, `ac1`) BLOCK_SIZE 16384 GLOBAL,
  KEY `obright_part3` (`glike`) BLOCK_SIZE 16384 GLOBAL,
  KEY `obright_part4` (`t1`, `ts`, `dec1`, `dec2`) STORING (`v1`, `v1_check`, `r1`, `r2`) BLOCK_SIZE 16384 GLOBAL,
  KEY `obright_part5` (`v1_check`, `v2_check`) BLOCK_SIZE 16384 GLOBAL,
  KEY `obright_part6` (`row_hex`, `v1_check`) STORING (`r1`, `glike`, `t1`) BLOCK_SIZE 16384 GLOBAL,
  KEY `obright_part7` (`grp_id`, `row_id`, `row_hex`, `trx_grp`, `v1_check`, `r1`, `r2`) STORING (`v1`) BLOCK_SIZE 16384 LOCAL,
  KEY `obright_part8` (`ac1`) BLOCK_SIZE 16384 LOCAL,
  KEY `obright_part9` (`grp_id`, `row_id`, `row_hex`) BLOCK_SIZE 16384 LOCAL,
  KEY `obright_part10` (`gen_v1`, `gen_v2`) BLOCK_SIZE 16384 LOCAL,
  KEY `obright_part1` (`row_id`) BLOCK_SIZE 16384 GLOBAL
) AUTO_INCREMENT = 1000001 DEFAULT CHARSET = utf8mb4 ROW_FORMAT = DYNAMIC COMPRESSION = 'zstd_1.3.8' REPLICA_NUM = 3 BLOCK_SIZE = 16384 USE_BLOOM_FILTER = FALSE TABLET_SIZE = 134217728 PCTFREE = 10
 partition by key(grp_id) partitions 100;

insert/*trace*/ into obright_part(grp_id,row_id,row_hex,trx_grp,v1,v1_check,v2,v2_check,r1,r2,glike,c1,c2,c3,c4,c5,c6,c7,c8,c9,c10,v3,t1,t2,dec1,dec2,dec3,b1) values(209,2508,'00000000000000000000000000000000000000000000000000000000000009cc',418,'l1uCs2LDfYp3pTrHAK78LnG1ODEnTp4GmiJCeW56PYjlQeOqspTsRr6f7f6F5Rgd9cIiHsQILI9PWCaZpEVrKAU1LB32nj2F4h6XMWKOK3H5kNADsPfgXPCpOSn4WokhFdMYnJBvc1i8IP3vHzK3tL5iryt1LQlWAy770k4YD0uaDPl0Tu5e9n5U1RLd0KHEF2uZoEmcm7RzmPWDqr01ZMjNekRCskqgc47KBVKJeu9sNlkt8csOqoaf7mr7Ynu1Stjl7V8imLrhxW3KrTVcnctSedkWhKScRPs0EjsIXkOsv4LDDH0zVJbshoyZHO1R6ceVND5yKbx4vJgnEuuy4j6LWurQLzX0qQH3nzGebiWV2D8P18gnN5QIECFjEplQnC4qMVlafaICBwyjPgXUXnfliPcLVnSIT5lhobSKajFOeh9aAmVPkJri8qYkIf6EUd3iSFRlKcIeCqdmKu60OUBLTgK9mTPt58V3wbLBS3EneHSjukq9ZvU5PqNpLtLpPiwiL1PCNyPQ5AkVj4DFrvRmM5EfzIAWmt4SsNIESEHOjU4BKXBYJUshrQbuTXuixU5dngd39Tubbtoj1t9hRTY9stobbHAcFOb5KvZC00IIekE6Pw14dZrk9R3G3ic09W05Lba9WG9uLCKJTqGNGGTyNGqBBBhETJU9rRHcoeEbjKxcWcWb520LyVvUiF8RhcIcoGcM1NntFEnXm7NnCVwfDoVBJW6PHo2QrCtbkaaWR6TO4wdfYwMJKSIqD2RJucTB0aTTnDaFtE7',3579053637,'ktoTUOMfjmyreqZ0ea9UZHjgoXkFfSSQEUnC5FX6v6esAreaDz7cGCqcAQhOGI8X',3926922792,-354,-353,'209&00000000000000000000000000000000000000000000000000000000000009cc',0,0,1254,836,1254,null,2508,2508,2508,2508,'2508','1992-01-01 08:41:48','1992-01-01 08:41:48',-37119.5904,-37014.7328,0.002508,1),(209,2509,'00000000000000000000000000000000000000000000000000000000000009cd',418,'SWh3KZ58IXXZRtlcCOwobllwPUK83u9iQT3ulGzTWVsVq9rRSVHl9Hn6et9gYpoYjh6e3U7wdkAG0SsJjSySoqkG8cr9IqlqHmlPjSVhob9Z61bXn8d4nQ6LNOEIFVTUVXdNV4pniGa7SnvJ6D0Xx16s9NAo63mGYZpO4jg9oVQVvh1YP56litN9BVumRqzhw2MZQS03rIJUDlye3WYywZ47kSeXnRmCsSQgbx04zPmyeRNPqm59hgGYr6voGQZtIPUcR52LBSFsmnmrjDP8WaCvVCOI1Qn5p3zvlIgZkRCS7LqmK6yjgOQPaHuKIDf0myEo56IuuKa2pt9nHZrAQGeQumQiqmYpIJGzYkjNb877U1PhDKgcephtd7LaSzndXuSU2fHEMvjWa8vdC12GpWkkziNyHf9uq9eJkicVLENOrBRXRa7EpN6abEJ9LWbXDLaK3LVX5yW2F73XCVz76uAgOPN32Sa0eBPCixCedw7wKdeNgg2b1pP2sDwcsQNO4HK',2552147509,'43k8I1sA7lKYW0fM35LPPm9QHOUOIYm8JrmD9sVZbIkDSI7LTMNXOtj8XrvYz2dQ',2085950575,-352,-351,'209&00000000000000000000000000000000000000000000000000000000000009cd',1,1,1254,836,1255,1,2508,2508,2509,2509,'2509','1992-01-01 08:41:49','1992-01-01 08:41:49',-36909.8752,-36805.0176,0.002509,0),(209,2510,'00000000000000000000000000000000000000000000000000000000000009ce',418,'deTZigkRnucJcEu3j6MAaPoud3MoY7mIEV0AUvylo7vxa8afeepU21TuE6BnPSLA1G5NzStgfPtZByMPmu0CMEVlwKE8FMGaZjdGhFJxJaHF1QBa4keYAChgMy0daccdk0sBSzbIahhL93u4IiJP5CSG0f21bGZd8qrxg3a6rP7ZcaDcnvMv56oMeRlhxzDsOtq0W9jdPJ8WMFOQSWL2P22RYgwuNGxxX25C5xr5Z8M60jZbXsQnCxnxqcVYTijKfkTeJrBOzC4JsNFFRFgC07dBR4eVwvwm2Mj1vpGlQiaDlKzQe3pcAFwJrs1rlGNOEERsncQulFkuhMIcLFv95nnddTHDzCHGmuGL30OSMNkRhdOxf3KWNeGkN7BPnMHI5Nx3xnNRIbBqBNkgTBWYlEM71ZXdAEZ1mZ1N64FiEJ4t8Ssdv2NwcBSqH4ofjNsAEOID2r3hl68w4QMiKKsMMMOiAnzrGGZWO3IifmFUyCxlPmJKFkS5VAVbM7FBtyfMjsfpqeeDOQUwMnJ38e28mAdUZkW78rF5MTR8SxByBRznGYhbPuBtRxYEdNj72EJerEDzeTtMwjXsL8PWUDYTXvqwlBRKkClzglcx4cCS7l4kBC5Lv5jgQn3f47l5dGz04FdXKNIrZp4l1hoN1NBqHoRjbbRF5MpRR99JrGmKh0x2ZSdsv9enf0alVebTT7IgNZ161x5zoR781mCKhGQbHcvsyfxE2XTtto9yYJBAOYsYUWrmVstDMrmDjZYVWv2IYUmXpwVux06mh2yXC1zvmVErd4PCCtLyGeq0PriXjn819GOL3TpXGn71UTbLIgiyWnxTLRsiO492hRVVT30ifhBByx5wvEBMPLEZbyolBb2fzHX3bitZXu3ileZO0YPVKzziSFhCk8icEbVnzqpQoX5FfNDLNIzta6KnRX65IfV9BA4w',3434692376,'LZ49QRHhGBKK3p5t0em17DRHJhKw5rwIEQNtDlRkFiFS6pgmfSK55DmxwH4dr450',2396460149,-350,-349,'209&00000000000000000000000000000000000000000000000000000000000009ce',0,2,1255,836,1257,null,2510,2508,2510,2510,'2510','1992-01-01 08:41:50','1992-01-01 08:41:50',-36700.16,-36595.3024,0.00251,1),(209,2511,'00000000000000000000000000000000000000000000000000000000000009cf',418,'shecJbGF4oUdEpuTC8VylwzL9eKyBJMx7wAJDkH7Cx251BBTImyK5mihObGaIDKYvPQ5BAKE4cRuL0bbvvxuNQaLpexpXkEyqXGgEt9Fc4tB4QC4o4jinm9orfUXGQ0hN8JtWk6ox1TrYIIFg0MVutGq5PoXTMrUTmJQi7ZTqTcqAbYVzewOW5A4RHn6r4TBOYDCGCPUvYnt4UlAvD2whxWfTROVUU304TzDRjGqbm2kibESBN7GQm6N4xOiRi0PS3Rx1QhKXuFdPfDRlA8LNifX20vITt249WQJJTGH6EnmrSioYfDfkKwDaESqsOnpvK7cE7lyFjC692vhLnr6lHPIzur6AfQBT1JPnJKD1dS19W2PxDcoqXGYi3uBSHsfzhTuUt4LJMszdSqZSFanPM4yXLXLd0XHX8POYXX1G4KCfuLAUZdXJAlgLZtEF3GPwEfZwhKhVplU7D5tA6zb4Vwmw7jjFJt8kmpO0mtvyZfppzkfmtk62EvM1duM0MrjWn3GYRuxMgtuLXmiXVAjpsEIQ1H6eNlnmkevLGNDAEEwisMiuIzDnVi3UAytgGTxFQEh9ghHDzIaS5q1Hd6WNXglNivqTp3Nx2UoBhYRO5Wuvmr1v66r1gooXtYBBaOGdK4I1ZILNCC2pFKo9q2WgMVfrcIcUN65TbmJK86mSJPg4r6IQ3c19BTzCzqiJEdZylVRUAF9hNsENOr',871559877,'FFLHAegCR22AQN5cNGmpm2YTciCQSqvZt8NGEljKDefyHE8pmDiWvPIGRCmW4SRj',2643203352,-348,-347,'209&00000000000000000000000000000000000000000000000000000000000009cf',1,0,1255,837,1255,1,2510,2511,2511,2511,'2511','1992-01-01 08:41:51','1992-01-01 08:41:51',-36490.4448,-36385.5872,0.002511,0),(209,2512,'00000000000000000000000000000000000000000000000000000000000009d0',418,'MP12Kv6LN8kP7FBDe3QM1bFhokL7IJ4RsSbSInjaFcOgseW1kr2y8gP6xGVfhPEzJxikdkip2H2wxTbygV13EIqvy2zsTfjNAGSShbhfl7EV3EkwGtAsxqw8G4Cyv9LfFjMuJ1fNOdml6SarQYppQ1s6ko2fO8g17sBJKqOAhZhoH1Yam8FbAoo58WjjAUjf1K2005SVF2PU7jnUFx5bLRXu6HRLT3JriymoAJaS6bk544sJG8Y0YK5NknBAktbbHGiohLYmAuC7NRCYQA9C5l99ymG9RNgocumif1FqZZKWzgguLnJbmjj3NstKWAdM8bjkB8ZxvR9MAjmf06E43O8RAFnUZHPW16T0FeKYRrKa0n91GVYtgYoC5UftBPA3QiZf6YRoprqhhXbmjpKsgSvUEykYaAhKIfEFVwRcqrgrfBYEbfDwL6Iomgw1FH5dTSCeKrM56p66XLAjfBmWuiKT7ir61JOhqAvkSwYsM0lrLUj0loX4lvScy5rsZrLaICux2ipurpEKQkP7kUspHya0TpGAf2jOoN0cYG3nNRWNaOoHqk1QOkWzSBAFjsje89kCVXjTtWUF4A3fe76SXph7r4QN8kbLEpznWw4yeFfMSfVwZvT83qpfWs1UyZI5wchDjpuPMZMygTwJAZwhaee1C6CC6TDDWpdTHzruxkOGnlanX',2608589220,'pkBFA9uMwBVovx3pojI8ZVWJYEWpCmkwehiRcGAFg1AXolfGtvbvJMmThq8fdxOa',3720812256,-346,-345,'209&00000000000000000000000000000000000000000000000000000000000009d0',0,1,1256,837,1257,null,2512,2511,2512,2512,'2512','1992-01-01 08:41:52','1992-01-01 08:41:52',-36280.7296,-36175.872,0.002512,1),(209,2513,'00000000000000000000000000000000000000000000000000000000000009d1',418,'tyi64v8FmxyUq3qL8HGInuemecccUXfilsaC7ZZSC12X6vDpnGBvmDw25sO9HDX3tUPts5cLCyr8IeB3LBWZ0XKsE6lBHNknY24DoFx1at8x1mgLW8Nqw106VVAOq1Se0NRfth5fuQHNwKueBhcEYsTZKyM5LdOWT6b5TQSrRSB0KLxS8faylqoHSActXG0wH0kmFEIqOOXR0l4a2xFvh1zXyqoBoWvlmBI74tMx5MfYUUMqf2Rw9Z4domkWZsNJ7noww0ByEjeaEofWrySY5y0DB9xxfSM0FcVmWhzbSrQ8jMUqw9GEH6MCFAF2lxTOaIGeFhDMkbwruTy5UrfdFICaSf8gNJEFT7fZJjZpL1drbzJzgPSYwrBIWVDi2p2IcF8utRxolJNuLCwje9SWOYvdya9GQxvKD7jt9wDvIv2oIoEhGZw79pnWOAYB7vNIBm2q7gT05je0slscWVIAsEOk6XdeLZxdFLM3aidGW6lEd6JtXHJFVH2l0Uu5tnquNee09Jdw5QSI5eUMY96HMbkyiLNU5WM3eOQ0fZqJM0qHFLeJ5wh2im1RxLLbhadHR7Zz4Frt7vvh4CTBRkkUqGzPqgM4z9eMBa4XsZhWkitfoMz29LfdvxCqojUUQpnDQv05iaqEkVZgWjJs3O6ufzFHert0xlKL80LXX0e9iPRrBIdAacYEjkZLVTE9CUE8oqeHf1ynaVfVXjo7uK0sLdaXUddKuVBnbf6sc1rWG6bVxur9kDav9LWL7QrQUjrQuYoH0ZWdoOSJ8sCt9Suscdzq6BBW5ziUY8zuSi4uQvofvjq1rFfEKU6BNEV4v9AJTuDEiCDkXd0Yf9bo1AzKLleVcAiUO5UgG8UQLSpWEQQ4p3kuVUs9ex4jy0c2iJh8UJuGaCSErwdWOfWCyZwGiBtAzKsvQEKDrhQ4CjEM5jNiEG2dkwbE4S2e27qFivnsnx5o1LTsmXat6AJey7wdqX0ur0P',1435848659,'xPfWuBs5aqC9EnH8KbNHpLN7SXUmQ70WbuICJajzUWGmFQQhvHrLtRUsdRhrta0e',3186824716,-344,3839,'209&00000000000000000000000000000000000000000000000000000000000009d1',1,2,1256,837,1258,1,2512,2511,2513,2513,'2513','1992-01-01 08:41:53','1992-01-01 08:41:53',-36071.0144,402548.3264,0.002513,0);
EXPLAIN update obright_part set r1=711,r2=712,gmt_modified=now(6) where row_id=2512;
Query Plan
=====================================================================================
|ID|OPERATOR                      |NAME                       |EST.ROWS|EST.TIME(us)|
-------------------------------------------------------------------------------------
|0 |DISTRIBUTED UPDATE            |                           |1       |137         |
|1 |└─DISTRIBUTED TABLE RANGE SCAN|obright_part(obright_part1)|1       |34          |
=====================================================================================
Outputs & filters:
-------------------------------------
  0 - output(nil), filter(nil)
      table_columns([{obright_part: ({obright_part: (obright_part.grp_id, obright_part.row_id, obright_part.row_hex, obright_part.trx_grp, obright_part.v1,
       obright_part.v1_check, obright_part.v2, obright_part.v2_check, obright_part.r1, obright_part.r2, obright_part.glike, obright_part.c1, obright_part.c2, 
      obright_part.c3, obright_part.c4, obright_part.c5, obright_part.c6, obright_part.c7, obright_part.c8, obright_part.c9, obright_part.c10, obright_part.v3,
       obright_part.ts, obright_part.t1, obright_part.t2, obright_part.dec1, obright_part.dec2, obright_part.dec3, obright_part.b1, obright_part.d1, obright_part.ac1,
       obright_part.gmt_create, obright_part.gmt_modified, obright_part.gen_v1, obright_part.gen_v2)}, {obright_part2_uniq: (obright_part.trx_grp, obright_part.r1,
       obright_part.row_hex, obright_part.row_id, obright_part.grp_id)}, {obright_part4: (obright_part.t1, obright_part.ts, obright_part.dec1, obright_part.dec2,
       obright_part.grp_id, obright_part.row_id, obright_part.row_hex, obright_part.v1, obright_part.v1_check, obright_part.r1, obright_part.r2)}, {obright_part6: 
      (obright_part.row_hex, obright_part.v1_check, obright_part.grp_id, obright_part.row_id, obright_part.r1, obright_part.glike, obright_part.t1)})}]),
      update([obright_part.r1=column_conv(INT,PS:(11,0),NULL,711)], [obright_part.r2=column_conv(INT,PS:(11,0),NULL,712)], [obright_part.gmt_modified=column_conv(TIMESTAMP,
      PS:(25,6),NULL,cast(current_timestamp(), TIMESTAMP(-1, 6)))], [obright_part.ts=column_conv(TIMESTAMP,PS:(25,6),NULL,cast(current_timestamp(), TIMESTAMP(25,
       6)))])
  1 - output([obright_part.grp_id], [obright_part.row_id], [obright_part.row_hex], [obright_part.v1], [column_conv(VARCHAR,utf8mb4_general_ci,length:10,
      NULL,substr(obright_part.v1, 1, 10))], [obright_part.gen_v2], [obright_part.r1], [obright_part.r2], [obright_part.gmt_modified], [obright_part.ts], [obright_part.trx_grp],
       [obright_part.v1_check], [obright_part.v2], [obright_part.v2_check], [obright_part.glike], [obright_part.c1], [obright_part.c2], [obright_part.c3], [obright_part.c4],
       [obright_part.c5], [obright_part.c6], [obright_part.c7], [obright_part.c8], [obright_part.c9], [obright_part.c10], [obright_part.v3], [obright_part.t1],
       [obright_part.t2], [obright_part.dec1], [obright_part.dec2], [obright_part.dec3], [obright_part.b1], [obright_part.d1], [obright_part.ac1], [obright_part.gmt_create]), filter(nil), rowset=16
      access([obright_part.grp_id], [obright_part.row_id], [obright_part.row_hex], [obright_part.v1], [obright_part.gen_v2], [obright_part.r1], [obright_part.r2],
       [obright_part.gmt_modified], [obright_part.ts], [obright_part.trx_grp], [obright_part.v1_check], [obright_part.v2], [obright_part.v2_check], [obright_part.glike],
       [obright_part.c1], [obright_part.c2], [obright_part.c3], [obright_part.c4], [obright_part.c5], [obright_part.c6], [obright_part.c7], [obright_part.c8],
       [obright_part.c9], [obright_part.c10], [obright_part.v3], [obright_part.t1], [obright_part.t2], [obright_part.dec1], [obright_part.dec2], [obright_part.dec3],
       [obright_part.b1], [obright_part.d1], [obright_part.ac1], [obright_part.gmt_create]), partitions(p0)
      is_index_back=true, is_global_index=true, 
      range_key([obright_part.row_id], [obright_part.grp_id], [obright_part.row_hex]), range(2512,MIN,MIN ; 2512,MAX,MAX), 
      range_cond([obright_part.row_id = 2512])
update obright_part set r1=711,r2=712,gmt_modified=now(6) where row_id=2512;
EXPLAIN select grp_id, trx_grp, row_id, row_hex from obright_part;
Query Plan
======================================================================
|ID|OPERATOR       |NAME                       |EST.ROWS|EST.TIME(us)|
----------------------------------------------------------------------
|0 |TABLE FULL SCAN|obright_part(obright_part2)|6       |3           |
======================================================================
Outputs & filters:
-------------------------------------
  0 - output([obright_part.grp_id], [obright_part.trx_grp], [obright_part.row_id], [obright_part.row_hex]), filter(nil), rowset=16
      access([obright_part.grp_id], [obright_part.row_id], [obright_part.row_hex], [obright_part.trx_grp]), partitions(p0)
      is_index_back=false, is_global_index=true, 
      range_key([obright_part.trx_grp], [obright_part.row_id], [obright_part.ac1], [obright_part.grp_id], [obright_part.row_hex]), range(MIN,MIN,MIN,MIN,
      MIN ; MAX,MAX,MAX,MAX,MAX)always true
select grp_id, trx_grp, row_id, row_hex from obright_part;
+--------+---------+--------+------------------------------------------------------------------+
| grp_id | trx_grp | row_id | row_hex                                                          |
+--------+---------+--------+------------------------------------------------------------------+
|    209 |     418 |   2508 | 00000000000000000000000000000000000000000000000000000000000009cc |
|    209 |     418 |   2509 | 00000000000000000000000000000000000000000000000000000000000009cd |
|    209 |     418 |   2510 | 00000000000000000000000000000000000000000000000000000000000009ce |
|    209 |     418 |   2511 | 00000000000000000000000000000000000000000000000000000000000009cf |
|    209 |     418 |   2512 | 00000000000000000000000000000000000000000000000000000000000009d0 |
|    209 |     418 |   2513 | 00000000000000000000000000000000000000000000000000000000000009d1 |
+--------+---------+--------+------------------------------------------------------------------+

drop table xy_t;
drop table obright_part;

explain_protocol: 0
drop table if exists t2;
create table t2 (c1 int, c2 int ,c3 int, c4 int);
create index aaa_t2 on t2(c1,c2);
insert into t2 values (1,1,1,1);
insert into t2 values (2,2,2,2);
insert into t2 values (2,2,2,2);
select * from t2 where c1 =2;
+------+------+------+------+
| c1   | c2   | c3   | c4   |
+------+------+------+------+
|    2 |    2 |    2 |    2 |
|    2 |    2 |    2 |    2 |
+------+------+------+------+
alter system set_tp tp_no=306, error_code=4016, frequency=1;
select * from t2 where c1 =2;
ERROR HY000: Internal error
alter system set_tp tp_no=306, error_code=0, frequency=1;
select * from t2 where c1 =2;
+------+------+------+------+
| c1   | c2   | c3   | c4   |
+------+------+------+------+
|    2 |    2 |    2 |    2 |
|    2 |    2 |    2 |    2 |
+------+------+------+------+
drop table t2;
