result_format: 4

drop table if exists t1;
create table t1 (c1 int primary key, c2 int, c3 int);
drop table if exists t2;
create table t2 (c1 int primary key, c2 int, c3 int, c4 int, index i1(c2), unique index i2(c3));
drop table if exists t3;
create table t3 (c1 int, c2 int, c3 int, primary key(c2, c3));
drop table if exists t4;
create table t4 (c1 int, c2 int, c3 int);

insert into t1 (c1, c2, c3) values (1, 1, 1);
insert into t1 (c1, c2, c3) values (2, 2, 2);

insert into t2 (c1, c2, c3, c4) values (1, 1, 1, 1);
insert into t2 (c1, c2, c3, c4) values (2, 2, 2, 2);

insert into t3 (c1, c2, c3) values (1, 1, 1);
insert into t3 (c1, c2, c3) values (2, 2, 2);

insert into t4 (c1, c2, c3) values (1, 1, 1);
insert into t4 (c1, c2, c3) values (1, 1, 1);


set @@ob_enable_plan_cache = 0;

update t1 set c3 = 3;
select * from t1;
+----+------+------+
| c1 | c2   | c3   |
+----+------+------+
|  1 |    1 |    3 |
|  2 |    2 |    3 |
+----+------+------+
update t1 set c3 = 3;

update t1 set c1 = 3;
ERROR 23000: Duplicate entry '3' for key 'PRIMARY'

update t2 set c2 = 3;
select * from t2 where c2 = 3;
+----+------+------+------+
| c1 | c2   | c3   | c4   |
+----+------+------+------+
|  1 |    3 |    1 |    1 |
|  2 |    3 |    2 |    2 |
+----+------+------+------+
update t2 set c3 = 1;
ERROR 23000: Duplicate entry '1' for key 'i2'
update t2 set c3 = NULL;
select * from t2 where c3 is null;
+----+------+------+------+
| c1 | c2   | c3   | c4   |
+----+------+------+------+
|  1 |    3 | NULL |    1 |
|  2 |    3 | NULL |    2 |
+----+------+------+------+

update t3 set c1 = 3;
select * from t3;
+------+----+----+
| c1   | c2 | c3 |
+------+----+----+
|    3 |  1 |  1 |
|    3 |  2 |  2 |
+------+----+----+
update t3 set c2 = 3;
select * from t3;
+------+----+----+
| c1   | c2 | c3 |
+------+----+----+
|    3 |  3 |  1 |
|    3 |  3 |  2 |
+------+----+----+
update t3 set c3 = 3;
ERROR 23000: Duplicate entry '3-3' for key 'PRIMARY'

update t4 set c2 = 3;
select * from t4;
+------+------+------+
| c1   | c2   | c3   |
+------+------+------+
|    1 |    3 |    1 |
|    1 |    3 |    1 |
+------+------+------+

update t1 set c1 = NULL;
ERROR 23000: Column 'c1' cannot be null
update t1, t2 set t1.c2 = 11 where t1.c3 = t2.c2;
select * from t1;
+----+------+------+
| c1 | c2   | c3   |
+----+------+------+
|  1 |   11 |    3 |
|  2 |   11 |    3 |
+----+------+------+

// test shadow key
drop table t1;
CREATE TABLE t1(c0 FLOAT NULL, c1 int)  PARTITION BY hash (c1) partitions 2;
CREATE UNIQUE INDEX idx_c0 on t1(c0) GLOBAL;
insert into t1 values(1, 2), (3, 4), (5, 6);
update t1 set c0 = c1, c1 = c0;
select * from t1;
+------+------+
| c0   | c1   |
+------+------+
|    2 |    2 |
|    4 |    4 |
|    6 |    6 |
+------+------+
drop table t1, t2, t3, t4;
DROP TABLE IF EXISTS tbl_t1;
DROP VIEW IF EXISTS info_year;
// test update view
// test range partition
CREATE TABLE tbl_t1 (
	id INT NOT NULL,
	year INT,
	month INT
)
PARTITION BY RANGE COLUMNS (year) (
	PARTITION Dec2020 VALUES LESS THAN (2021),
	PARTITION Dec2021 VALUES LESS THAN (2022),
	PARTITION Dec2024 VALUES LESS THAN (2025)
);
INSERT INTO tbl_t1 VALUES (1, 2019, 2);
INSERT INTO tbl_t1 VALUES (2, 2020, 5);
INSERT INTO tbl_t1 VALUES (3, 2020, 10);
INSERT INTO tbl_t1 VALUES (4, 2021, 2);
INSERT INTO tbl_t1 VALUES (5, 2021, 5);
INSERT INTO tbl_t1 VALUES (6, 2022, 1);
CREATE OR REPLACE VIEW info_year AS SELECT * FROM tbl_t1 PARTITION (Dec2020);
SELECT * FROM info_year;
+----+------+-------+
| id | year | month |
+----+------+-------+
|  1 | 2019 |     2 |
|  2 | 2020 |     5 |
|  3 | 2020 |    10 |
+----+------+-------+
INSERT INTO info_year VALUES (7, 2020, 11);
UPDATE info_year SET year = 2022 WHERE id = 7;
ERROR HY000: Found a row not matching the given partition set
UPDATE info_year SET year = 2000 WHERE id = 7;
SELECT * FROM info_year;
+----+------+-------+
| id | year | month |
+----+------+-------+
|  1 | 2019 |     2 |
|  2 | 2020 |     5 |
|  3 | 2020 |    10 |
|  7 | 2000 |    11 |
+----+------+-------+
// test single partition
UPDATE info_year SET id = 100 WHERE year = 2019;
UPDATE info_year SET id = 200 WHERE year = 2022;
SELECT * FROM info_year;
+-----+------+-------+
| id  | year | month |
+-----+------+-------+
| 100 | 2019 |     2 |
|   2 | 2020 |     5 |
|   3 | 2020 |    10 |
|   7 | 2000 |    11 |
+-----+------+-------+
SELECT * FROM tbl_t1;
+-----+------+-------+
| id  | year | month |
+-----+------+-------+
| 100 | 2019 |     2 |
|   2 | 2020 |     5 |
|   3 | 2020 |    10 |
|   7 | 2000 |    11 |
|   4 | 2021 |     2 |
|   5 | 2021 |     5 |
|   6 | 2022 |     1 |
+-----+------+-------+
DROP TABLE tbl_t1;
DROP VIEW info_year;
// test hash partition
DROP TABLE IF EXISTS TEST_HASH;
DROP VIEW IF EXISTS INFO_YEAR_HASH;
CREATE TABLE TEST_HASH (C1 INT, YEAR INT, C4 INT, PRIMARY KEY(C1,C4)) PARTITION BY HASH(C4) PARTITIONS 4;
CREATE OR REPLACE VIEW INFO_YEAR_HASH AS SELECT * FROM TEST_HASH PARTITION(P1);
INSERT INTO TEST_HASH VALUES(1, 2021, 1);
INSERT INTO TEST_HASH VALUES(2, 2022, 2);
INSERT INTO TEST_HASH VALUES(3, 2023, 3);
INSERT INTO TEST_HASH VALUES(4, 2024, 4);
INSERT INTO TEST_HASH VALUES(5, 2025, 5);
SELECT * FROM TEST_HASH;
+----+------+----+
| C1 | YEAR | C4 |
+----+------+----+
|  4 | 2024 |  4 |
|  1 | 2021 |  1 |
|  5 | 2025 |  5 |
|  2 | 2022 |  2 |
|  3 | 2023 |  3 |
+----+------+----+
SELECT * FROM INFO_YEAR_HASH;
+----+------+----+
| C1 | YEAR | C4 |
+----+------+----+
|  1 | 2021 |  1 |
|  5 | 2025 |  5 |
+----+------+----+
UPDATE INFO_YEAR_HASH SET C4 = 9 WHERE YEAR = 2021;
UPDATE INFO_YEAR_HASH SET C4 = 8 WHERE YEAR = 2021;
ERROR HY000: Found a row not matching the given partition set
// test single partition
UPDATE INFO_YEAR_HASH SET YEAR = 2048 WHERE C4 = 3;
UPDATE INFO_YEAR_HASH SET YEAR = 2048 WHERE C4 = 1;
SELECT * FROM INFO_YEAR_HASH;
+----+------+----+
| C1 | YEAR | C4 |
+----+------+----+
|  1 | 2021 |  9 |
|  5 | 2025 |  5 |
+----+------+----+
SELECT * FROM TEST_HASH;
+----+------+----+
| C1 | YEAR | C4 |
+----+------+----+
|  4 | 2024 |  4 |
|  1 | 2021 |  9 |
|  5 | 2025 |  5 |
|  2 | 2022 |  2 |
|  3 | 2023 |  3 |
+----+------+----+
DROP TABLE TEST_HASH;
DROP VIEW INFO_YEAR_HASH;
// test list partition
DROP TABLE IF EXISTS TEST_LIST;
DROP VIEW IF EXISTS INFO_YEAR_LIST;
CREATE TABLE TEST_LIST (
	C1 INT,
	YEAR INT,
	C3 INT,
	PRIMARY KEY(C1,C3)
)
PARTITION BY LIST (C1) (
	PARTITION P0 VALUES IN (1, 2, 3, 4, 5, 6, 7, 10),
	PARTITION P1 VALUES IN (11, 20, 30, 40, 50, 100),
	PARTITION P2 VALUES IN (102, 203, 8, 9, 1000)
);
CREATE OR REPLACE VIEW INFO_YEAR_LIST AS SELECT * FROM TEST_LIST PARTITION(P1);
INSERT INTO TEST_LIST VALUES(1, 2021, 1);
INSERT INTO TEST_LIST VALUES(2, 2022, 2);
INSERT INTO TEST_LIST VALUES(11, 20211, 11);
INSERT INTO TEST_LIST VALUES(20, 20220, 20);
INSERT INTO TEST_LIST VALUES(102, 202102, 102);
INSERT INTO TEST_LIST VALUES(203, 202203, 203);
SELECT * FROM TEST_LIST;
+-----+--------+-----+
| C1  | YEAR   | C3  |
+-----+--------+-----+
|   1 |   2021 |   1 |
|   2 |   2022 |   2 |
|  11 |  20211 |  11 |
|  20 |  20220 |  20 |
| 102 | 202102 | 102 |
| 203 | 202203 | 203 |
+-----+--------+-----+
SELECT * FROM INFO_YEAR_LIST;
+----+-------+----+
| C1 | YEAR  | C3 |
+----+-------+----+
| 11 | 20211 | 11 |
| 20 | 20220 | 20 |
+----+-------+----+
UPDATE INFO_YEAR_LIST SET C1 = 100 WHERE YEAR = 20211;
UPDATE INFO_YEAR_LIST SET C1 = 1 WHERE YEAR = 20220;
ERROR HY000: Found a row not matching the given partition set
// test single partition
UPDATE INFO_YEAR_LIST SET YEAR = 2048 WHERE C1 = 203;
UPDATE INFO_YEAR_LIST SET YEAR = 2048 WHERE C1 = 20;
SELECT * FROM TEST_LIST;
+-----+--------+-----+
| C1  | YEAR   | C3  |
+-----+--------+-----+
|   1 |   2021 |   1 |
|   2 |   2022 |   2 |
|  20 |   2048 |  20 |
| 100 |  20211 |  11 |
| 102 | 202102 | 102 |
| 203 | 202203 | 203 |
+-----+--------+-----+
SELECT * FROM INFO_YEAR_LIST;
+-----+-------+----+
| C1  | YEAR  | C3 |
+-----+-------+----+
|  20 |  2048 | 20 |
| 100 | 20211 | 11 |
+-----+-------+----+
DROP TABLE TEST_LIST;
DROP VIEW INFO_YEAR_LIST;
