drop database  IF EXISTS  db1;
create database db1;
use db1;
SET wait_timeout=30000000;
SET ob_trx_timeout = 30000000;
SET ob_query_timeout = 30000000;
##设置相同sql_mode;
SET @@sql_mode='STRICT_TRANS_TABLES,NO_ENGINE_SUBSTITUTION,no_zero_date,no_zero_in_date,PIPES_AS_CONCAT';
##参数验证
select dayname();
ERROR 42000: Incorrect parameter count in the call to native function 'dayname'
select dayname(" ");
dayname(" ")
NULL
Warnings:
Warning	5086	Not timestamp Can not cast varchar value to timestamp type
select dayname("null");
dayname("null")
NULL
Warnings:
Warning	5086	Not timestamp Can not cast varchar value to timestamp type
select dayname(0);
dayname(0)
NULL
Warnings:
Warning	5086	Not timestamp Can not cast varchar value to timestamp type
##结果不一致,ob输出工作日名称,mysql结果为null--已修复
select dayname("0000-00-00");
dayname("0000-00-00")
NULL
Warnings:
Warning	5086	Not timestamp Can not cast varchar value to timestamp type
##ob和MySQL5.7结果不一致,mysql会自动跳到下一天;
select dayname('1969-12-31 23:59:59.9999999');
dayname('1969-12-31 23:59:59.9999999')
Thursday
##ob和MySQL5.7结果不一致;OB默认00年2月有29天,mysql默认28天
select dayname('0000-02-29');
dayname('0000-02-29')
NULL
Warnings:
Warning	5086	Not timestamp Can not cast varchar value to timestamp type
select dayname(current_time(),current_timestamp());
ERROR 42000: Incorrect parameter count in the call to native function 'dayname'
select dayname('monday'), dayname('Tuesday'), dayname('Wednesday'),dayname('Sunday'),dayname('Thursday'),dayname('Friday'),dayname('Saturday');
dayname('monday')	dayname('Tuesday')	dayname('Wednesday')	dayname('Sunday')	dayname('Thursday')	dayname('Friday')	dayname('Saturday')
NULL	NULL	NULL	NULL	NULL	NULL	NULL
Warnings:
Warning	5086	Not timestamp Can not cast varchar value to timestamp type
Warning	5086	Not timestamp Can not cast varchar value to timestamp type
Warning	5086	Not timestamp Can not cast varchar value to timestamp type
Warning	5086	Not timestamp Can not cast varchar value to timestamp type
Warning	5086	Not timestamp Can not cast varchar value to timestamp type
Warning	5086	Not timestamp Can not cast varchar value to timestamp type
Warning	5086	Not timestamp Can not cast varchar value to timestamp type
select dayname('0.01.01');
dayname('0.01.01')
Saturday
select dayname('9999.12.31');
dayname('9999.12.31')
Friday
select dayname(+"2022-09-05");
dayname(+"2022-09-05")
Monday
select dayname(-"2022-09-05");
dayname(-"2022-09-05")
NULL
Warnings:
Warning	1292	Truncated incorrect DOUBLE value: '2022-09-05'
Warning	5086	Not timestamp Can not cast varchar value to timestamp type
select dayname('a');
dayname('a')
NULL
Warnings:
Warning	5086	Not timestamp Can not cast varchar value to timestamp type
select dayname('@@@');
dayname('@@@')
NULL
Warnings:
Warning	5086	Not timestamp Can not cast varchar value to timestamp type
select dayname('#');
dayname('#')
NULL
Warnings:
Warning	5086	Not timestamp Can not cast varchar value to timestamp type
select dayname('""');
dayname('""')
NULL
Warnings:
Warning	5086	Not timestamp Can not cast varchar value to timestamp type
select dayname('_');
dayname('_')
NULL
Warnings:
Warning	5086	Not timestamp Can not cast varchar value to timestamp type
select dayname('false');
dayname('false')
NULL
Warnings:
Warning	5086	Not timestamp Can not cast varchar value to timestamp type
select dayname('true');
dayname('true')
NULL
Warnings:
Warning	5086	Not timestamp Can not cast varchar value to timestamp type
select dayname('2022-09-05')+4;
dayname('2022-09-05')+4
4
Warnings:
Warning	1292	Truncated incorrect DOUBLE value: 'Monday'
select dayname('2022-09-05')+false;
dayname('2022-09-05')+false
0
Warnings:
Warning	1292	Truncated incorrect DOUBLE value: 'Monday'
select dayname('2022-09-05')+true;
dayname('2022-09-05')+true
1
Warnings:
Warning	1292	Truncated incorrect DOUBLE value: 'Monday'
select dayname('星期一');
dayname('星期一')
NULL
Warnings:
Warning	5086	Not timestamp Can not cast varchar value to timestamp type
select dayname('星期一1999-12-31');
dayname('星期一1999-12-31')
NULL
Warnings:
Warning	5086	Not timestamp Can not cast varchar value to timestamp type
select dayname('星期一@#');
dayname('星期一@#')
NULL
Warnings:
Warning	5086	Not timestamp Can not cast varchar value to timestamp type
select dayname('1999-12-31星期一');
dayname('1999-12-31星期一')
Friday
select dayname(1.175494351E-38) From dual;
dayname(1.175494351E-38)
NULL
Warnings:
Warning	5086	Not timestamp Can not cast varchar value to timestamp type
select dayname('-1970-12-31');
dayname('-1970-12-31')
NULL
Warnings:
Warning	5086	Not timestamp Can not cast varchar value to timestamp type
select dayname('にににににににに');
dayname('にににににににに')
NULL
Warnings:
Warning	5086	Not timestamp Can not cast varchar value to timestamp type
select dayname('천구백구십칠년 일월 오일');
dayname('천구백구십칠년 일월 오일')
NULL
Warnings:
Warning	5086	Not timestamp Can not cast varchar value to timestamp type
select dayname('一九九九零二二六');
dayname('一九九九零二二六')
NULL
Warnings:
Warning	5086	Not timestamp Can not cast varchar value to timestamp type
select dayname('壹玖玖捌零伍贰贰');
dayname('壹玖玖捌零伍贰贰')
NULL
Warnings:
Warning	5086	Not timestamp Can not cast varchar value to timestamp type
select dayname('2022-09-07')<'monday';
dayname('2022-09-07')<'monday'
0
select dayname('2022-09-07')>'monday';
dayname('2022-09-07')>'monday'
1
select dayname('2022-09-07') != 'Wednesday';
dayname('2022-09-07') != 'Wednesday'
0
select dayname('2022-09-07') >= 'Wednesday';
dayname('2022-09-07') >= 'Wednesday'
1
select dayname('2022-09-07') <= 'Wednesday';
dayname('2022-09-07') <= 'Wednesday'
1
select dayname('2022-09-07') = 'Wednesday';
dayname('2022-09-07') = 'Wednesday'
1
##ob和MySQL5.7结果不一致;
select dayname('1999-12-31星期1999-12-30');
dayname('1999-12-31星期1999-12-30')
NULL
Warnings:
Warning	5086	Not timestamp Can not cast varchar value to timestamp type
##ob与mysql表现形式不一致
select dayname('1995.02.28')+2000000000000000;
dayname('1995.02.28')+2000000000000000
2e15
Warnings:
Warning	1292	Truncated incorrect DOUBLE value: 'Tuesday'
##经过和山庭老师确认,此处是by design的，mysql有时候会根据外层表达式，改变内层表达式的返回值，比如这里dayname外面是加一个int，那dayname会返回是一周的第几天，而不是一个字符串
select dayname('9999-12-31 23:59:59.999999')+0;
dayname('9999-12-31 23:59:59.999999')+0
0
Warnings:
Warning	1292	Truncated incorrect DOUBLE value: 'Friday'
select dayname('9999-12-31 23:59:59.999999')-0;
dayname('9999-12-31 23:59:59.999999')-0
0
Warnings:
Warning	1292	Truncated incorrect DOUBLE value: 'Friday'
select dayname('9999-12-31 23:59:59.999999')*1;
dayname('9999-12-31 23:59:59.999999')*1
0
Warnings:
Warning	1292	Truncated incorrect DOUBLE value: 'Friday'
select dayname('9999-12-31 23:59:59.999999')/1;
dayname('9999-12-31 23:59:59.999999')/1
0
Warnings:
Warning	1292	Truncated incorrect DOUBLE value: 'Friday'
表字符集测试
set names binary;
select dayname('');
dayname('')
NULL
Warnings:
Warning	5086	Not timestamp Can not cast varchar value to timestamp type
select dayname('0');
dayname('0')
NULL
Warnings:
Warning	5086	Not timestamp Can not cast varchar value to timestamp type
select dayname(0);
dayname(0)
NULL
Warnings:
Warning	5086	Not timestamp Can not cast varchar value to timestamp type
select dayname('+1');
dayname('+1')
NULL
Warnings:
Warning	5086	Not timestamp Can not cast varchar value to timestamp type
select dayname('-1');
dayname('-1')
NULL
Warnings:
Warning	5086	Not timestamp Can not cast varchar value to timestamp type
select dayname('-false');
dayname('-false')
NULL
Warnings:
Warning	5086	Not timestamp Can not cast varchar value to timestamp type
select dayname('-true');
dayname('-true')
NULL
Warnings:
Warning	5086	Not timestamp Can not cast varchar value to timestamp type
select dayname('null');
dayname('null')
NULL
Warnings:
Warning	5086	Not timestamp Can not cast varchar value to timestamp type
select dayname('1970-01-01');
dayname('1970-01-01')
Thursday
select dayname('9999-12-31');
dayname('9999-12-31')
Friday
select dayname('1000-01-01');
dayname('1000-01-01')
Wednesday
drop table  IF EXISTS  t1;
Warnings:
Note	1051	Unknown table 'db1.t1'
CREATE TABLE t1(c1 TIME ,
c2 date ,
c3 DATETIME ,
c4 TIMESTAMP DEFAULT '2000-01-01 00:00:00',
c5 YEAR ) default charset=binary;
INSERT INTO t1 VALUES('20:12:12','2000-12-12','2000-01-01 01:01:01','2001-01-01 23:59:59.9999999','2000'),
('21:12:13','2001-12-22','2001-01-02 13:01:01','2001-11-02 00:00:01.999999','2001'),
('22:12:14','2002-12-02','2002-01-03 14:01:01','2002-12-03 02:01:01.299999','2002'),
('23:12:15','2003-12-11','2003-01-04 15:01:01','2002-11-04 03:01:01.399999','2003'),
('20:22:16','2004-12-12','2004-01-05 16:01:01','2002-02-05 05:01:01.499999','2004'),
('20:32:17','2021-12-13','2010-01-06 21:01:01','2003-03-06 04:01:01.599999','2005'),
('20:12:18','2005-12-12','2000-01-07 01:01:01','2001-01-07 12:01:01.699999','2006'),
('11:12:19','2006-12-22','2011-01-08 13:01:01','2001-11-08 11:01:01.799999','2007'),
('02:12:20','2007-12-02','2012-01-09 14:01:01','2002-12-09 02:01:01.899999','2008'),
('03:12:21','2008-12-11','2013-01-10 15:01:01','2002-11-10 03:01:01.999999','2009'),
('00:22:22','2009-12-12','2010-01-11 16:01:01','2002-02-11 05:01:01.000001','2010'),
('00:32:23','2001-12-13','2010-01-12 21:01:01','2003-03-31 04:59:59.000000','2011');
select dayname(c2) from t1 where c2 ='2008-12-11';
dayname(c2)
Thursday
select dayname(c3) from t1 where c3 ='2010-01-12 21:01:01';
dayname(c3)
Tuesday
select dayname(c4) from t1 where c4 ='2001-01-01 23:59:59.9999999';
dayname(c4)
Tuesday
select dayname(c5) from t1 where c5 ='2011';
dayname(c5)
NULL
Warnings:
Warning	5086	Not timestamp Can not cast varchar value to timestamp type
drop table t1;
SET NAMES 'utf8mb4';
select dayname('');
dayname('')
NULL
Warnings:
Warning	5086	Not timestamp Can not cast varchar value to timestamp type
select dayname('0');
dayname('0')
NULL
Warnings:
Warning	5086	Not timestamp Can not cast varchar value to timestamp type
select dayname(0);
dayname(0)
NULL
Warnings:
Warning	5086	Not timestamp Can not cast varchar value to timestamp type
select dayname('+1');
dayname('+1')
NULL
Warnings:
Warning	5086	Not timestamp Can not cast varchar value to timestamp type
select dayname('-1');
dayname('-1')
NULL
Warnings:
Warning	5086	Not timestamp Can not cast varchar value to timestamp type
select dayname('-false');
dayname('-false')
NULL
Warnings:
Warning	5086	Not timestamp Can not cast varchar value to timestamp type
select dayname('-true');
dayname('-true')
NULL
Warnings:
Warning	5086	Not timestamp Can not cast varchar value to timestamp type
select dayname('null');
dayname('null')
NULL
Warnings:
Warning	5086	Not timestamp Can not cast varchar value to timestamp type
select dayname('1970-01-01');
dayname('1970-01-01')
Thursday
select dayname('9999-12-31');
dayname('9999-12-31')
Friday
select dayname('1000-01-01');
dayname('1000-01-01')
Wednesday
CREATE TABLE t1(c1 TIME ,
c2 date ,
c3 DATETIME ,
c4 TIMESTAMP DEFAULT '2000-01-01 00:00:00',
c5 YEAR ) default charset=utf8mb4;
INSERT INTO t1 VALUES('20:12:12','2000-12-12','2000-01-01 01:01:01','2001-01-01 23:59:59.9999999','2000'),
('21:12:13','2001-12-22','2001-01-02 13:01:01','2001-11-02 00:00:01.999999','2001'),
('22:12:14','2002-12-02','2002-01-03 14:01:01','2002-12-03 02:01:01.299999','2002'),
('23:12:15','2003-12-11','2003-01-04 15:01:01','2002-11-04 03:01:01.399999','2003'),
('20:22:16','2004-12-12','2004-01-05 16:01:01','2002-02-05 05:01:01.499999','2004'),
('20:32:17','2021-12-13','2010-01-06 21:01:01','2003-03-06 04:01:01.599999','2005'),
('20:12:18','2005-12-12','2000-01-07 01:01:01','2001-01-07 12:01:01.699999','2006'),
('11:12:19','2006-12-22','2011-01-08 13:01:01','2001-11-08 11:01:01.799999','2007'),
('02:12:20','2007-12-02','2012-01-09 14:01:01','2002-12-09 02:01:01.899999','2008'),
('03:12:21','2008-12-11','2013-01-10 15:01:01','2002-11-10 03:01:01.999999','2009'),
('00:22:22','2009-12-12','2010-01-11 16:01:01','2002-02-11 05:01:01.000001','2010'),
('00:32:23','2001-12-13','2010-01-12 21:01:01','2003-03-31 04:59:59.000000','2011');
select dayname(c2) from t1 where c2 ='2008-12-11';
dayname(c2)
Thursday
select dayname(c3) from t1 where c3 ='2010-01-12 21:01:01';
dayname(c3)
Tuesday
select dayname(c4) from t1 where c4 ='2001-01-01 23:59:59.9999999';
dayname(c4)
Tuesday
select dayname(c5) from t1 where c5 ='2011';
dayname(c5)
NULL
Warnings:
Warning	5086	Not timestamp Can not cast varchar value to timestamp type
drop table t1;
SET NAMES 'gbk';
select dayname('');
dayname('')
NULL
Warnings:
Warning	5086	Not timestamp Can not cast varchar value to timestamp type
select dayname('0');
dayname('0')
NULL
Warnings:
Warning	5086	Not timestamp Can not cast varchar value to timestamp type
select dayname(0);
dayname(0)
NULL
Warnings:
Warning	5086	Not timestamp Can not cast varchar value to timestamp type
select dayname('+1');
dayname('+1')
NULL
Warnings:
Warning	5086	Not timestamp Can not cast varchar value to timestamp type
select dayname('-1');
dayname('-1')
NULL
Warnings:
Warning	5086	Not timestamp Can not cast varchar value to timestamp type
select dayname('-false');
dayname('-false')
NULL
Warnings:
Warning	5086	Not timestamp Can not cast varchar value to timestamp type
select dayname('-true');
dayname('-true')
NULL
Warnings:
Warning	5086	Not timestamp Can not cast varchar value to timestamp type
select dayname('null');
dayname('null')
NULL
Warnings:
Warning	5086	Not timestamp Can not cast varchar value to timestamp type
select dayname('1970-01-01');
dayname('1970-01-01')
Thursday
select dayname('9999-12-31');
dayname('9999-12-31')
Friday
select dayname('1000-01-01');
dayname('1000-01-01')
Wednesday
CREATE TABLE t1(c1 TIME ,
c2 date ,
c3 DATETIME ,
c4 TIMESTAMP DEFAULT '2000-01-01 00:00:00',
c5 YEAR ) default charset=gbk;
INSERT INTO t1 VALUES('20:12:12','2000-12-12','2000-01-01 01:01:01','2001-01-01 23:59:59.9999999','2000'),
('21:12:13','2001-12-22','2001-01-02 13:01:01','2001-11-02 00:00:01.999999','2001'),
('22:12:14','2002-12-02','2002-01-03 14:01:01','2002-12-03 02:01:01.299999','2002'),
('23:12:15','2003-12-11','2003-01-04 15:01:01','2002-11-04 03:01:01.399999','2003'),
('20:22:16','2004-12-12','2004-01-05 16:01:01','2002-02-05 05:01:01.499999','2004'),
('20:32:17','2021-12-13','2010-01-06 21:01:01','2003-03-06 04:01:01.599999','2005'),
('20:12:18','2005-12-12','2000-01-07 01:01:01','2001-01-07 12:01:01.699999','2006'),
('11:12:19','2006-12-22','2011-01-08 13:01:01','2001-11-08 11:01:01.799999','2007'),
('02:12:20','2007-12-02','2012-01-09 14:01:01','2002-12-09 02:01:01.899999','2008'),
('03:12:21','2008-12-11','2013-01-10 15:01:01','2002-11-10 03:01:01.999999','2009'),
('00:22:22','2009-12-12','2010-01-11 16:01:01','2002-02-11 05:01:01.000001','2010'),
('00:32:23','2001-12-13','2010-01-12 21:01:01','2003-03-31 04:59:59.000000','2011');
select dayname(c2) from t1 where c2 ='2008-12-11';
dayname(c2)
Thursday
select dayname(c3) from t1 where c3 ='2010-01-12 21:01:01';
dayname(c3)
Tuesday
select dayname(c4) from t1 where c4 ='2001-01-01 23:59:59.9999999';
dayname(c4)
Tuesday
select dayname(c5) from t1 where c5 ='2011';
dayname(c5)
NULL
Warnings:
Warning	5086	Not timestamp Can not cast varchar value to timestamp type
drop table t1;
SET NAMES 'gb18030';
select dayname('');
dayname('')
NULL
Warnings:
Warning	5086	Not timestamp Can not cast varchar value to timestamp type
select dayname('0');
dayname('0')
NULL
Warnings:
Warning	5086	Not timestamp Can not cast varchar value to timestamp type
select dayname(0);
dayname(0)
NULL
Warnings:
Warning	5086	Not timestamp Can not cast varchar value to timestamp type
select dayname('+1');
dayname('+1')
NULL
Warnings:
Warning	5086	Not timestamp Can not cast varchar value to timestamp type
select dayname('-1');
dayname('-1')
NULL
Warnings:
Warning	5086	Not timestamp Can not cast varchar value to timestamp type
select dayname('-false');
dayname('-false')
NULL
Warnings:
Warning	5086	Not timestamp Can not cast varchar value to timestamp type
select dayname('-true');
dayname('-true')
NULL
Warnings:
Warning	5086	Not timestamp Can not cast varchar value to timestamp type
select dayname('null');
dayname('null')
NULL
Warnings:
Warning	5086	Not timestamp Can not cast varchar value to timestamp type
select dayname('1970-01-01');
dayname('1970-01-01')
Thursday
select dayname('9999-12-31');
dayname('9999-12-31')
Friday
select dayname('1000-01-01');
dayname('1000-01-01')
Wednesday
CREATE TABLE t1(c1 TIME ,
c2 date ,
c3 DATETIME ,
c4 TIMESTAMP DEFAULT '2000-01-01 00:00:00',
c5 YEAR ) default charset=gb18030;
INSERT INTO t1 VALUES('20:12:12','2000-12-12','2000-01-01 01:01:01','2001-01-01 23:59:59.9999999','2000'),
('21:12:13','2001-12-22','2001-01-02 13:01:01','2001-11-02 00:00:01.999999','2001'),
('22:12:14','2002-12-02','2002-01-03 14:01:01','2002-12-03 02:01:01.299999','2002'),
('23:12:15','2003-12-11','2003-01-04 15:01:01','2002-11-04 03:01:01.399999','2003'),
('20:22:16','2004-12-12','2004-01-05 16:01:01','2002-02-05 05:01:01.499999','2004'),
('20:32:17','2021-12-13','2010-01-06 21:01:01','2003-03-06 04:01:01.599999','2005'),
('20:12:18','2005-12-12','2000-01-07 01:01:01','2001-01-07 12:01:01.699999','2006'),
('11:12:19','2006-12-22','2011-01-08 13:01:01','2001-11-08 11:01:01.799999','2007'),
('02:12:20','2007-12-02','2012-01-09 14:01:01','2002-12-09 02:01:01.899999','2008'),
('03:12:21','2008-12-11','2013-01-10 15:01:01','2002-11-10 03:01:01.999999','2009'),
('00:22:22','2009-12-12','2010-01-11 16:01:01','2002-02-11 05:01:01.000001','2010'),
('00:32:23','2001-12-13','2010-01-12 21:01:01','2003-03-31 04:59:59.000000','2011');
select dayname(c2) from t1 where c2 ='2008-12-11';
dayname(c2)
Thursday
select dayname(c3) from t1 where c3 ='2010-01-12 21:01:01';
dayname(c3)
Tuesday
select dayname(c4) from t1 where c4 ='2001-01-01 23:59:59.9999999';
dayname(c4)
Tuesday
select dayname(c5) from t1 where c5 ='2011';
dayname(c5)
NULL
Warnings:
Warning	5086	Not timestamp Can not cast varchar value to timestamp type
drop table t1;
##数据类型验证
##TINYINT,SMALLINT,MEDIUMINT,int,BIGINT,FLOAT,DOUBLE,DECIMAL
create table t1(c1 TINYINT,c2 SMALLINT,c3 MEDIUMINT,c4 int,c5 BIGINT,c6 FLOAT,c7 DOUBLE,c8 DECIMAL(5,2));
insert into t1 values(22,621,0721,0621,1221,0621.221,0621.01,0621.02);
insert into t1 values(23,622,0722,0622,1222,0622.221,0622.01,0622.02);
insert into t1 values(24,null,null,null,null,null,null,null);
select * from t1 ORDER by c1 asc;
c1	c2	c3	c4	c5	c6	c7	c8
22	621	721	621	1221	621.221	621.01	621.02
23	622	722	622	1222	622.221	622.01	622.02
24	NULL	NULL	NULL	NULL	NULL	NULL	NULL
select * from t1 ORDER by dayname(c1) asc;
c1	c2	c3	c4	c5	c6	c7	c8
22	621	721	621	1221	621.221	621.01	621.02
23	622	722	622	1222	622.221	622.01	622.02
24	NULL	NULL	NULL	NULL	NULL	NULL	NULL
Warnings:
Warning	5086	Not timestamp Can not cast varchar value to timestamp type
Warning	5086	Not timestamp Can not cast varchar value to timestamp type
Warning	5086	Not timestamp Can not cast varchar value to timestamp type
select dayname(c2+1) from t1;
dayname(c2+1)
Thursday
Friday
NULL
select dayname(c2-1) from t1;
dayname(c2-1)
Tuesday
Wednesday
NULL
select dayname(c2*1) from t1;
dayname(c2*1)
Wednesday
Thursday
NULL
select dayname(c2/1) from t1;
dayname(c2/1)
Wednesday
Thursday
NULL
select c1,dayname(c1) from t1;
c1	dayname(c1)
22	NULL
23	NULL
24	NULL
Warnings:
Warning	5086	Not timestamp Can not cast varchar value to timestamp type
Warning	5086	Not timestamp Can not cast varchar value to timestamp type
Warning	5086	Not timestamp Can not cast varchar value to timestamp type
select c2,dayname(c2) from t1;
c2	dayname(c2)
621	Wednesday
622	Thursday
NULL	NULL
select c3,dayname(c3) from t1;
c3	dayname(c3)
721	Friday
722	Saturday
NULL	NULL
select c4,dayname(c4) from t1;
c4	dayname(c4)
621	Wednesday
622	Thursday
NULL	NULL
select c5,dayname(c5) from t1;
c5	dayname(c5)
1221	Thursday
1222	Friday
NULL	NULL
select c6,dayname(c6) from t1;
c6	dayname(c6)
621.221	Wednesday
622.221	Thursday
NULL	NULL
select c7,dayname(c7) from t1;
c7	dayname(c7)
621.01	Wednesday
622.01	Thursday
NULL	NULL
select c8,dayname(c8) from t1;
c8	dayname(c8)
621.02	Wednesday
622.02	Thursday
NULL	NULL
##ob空集,mysql正常查询
SELECT * FROM t1 WHERE dayname(c2) ORDER by c1 asc;
c1	c2	c3	c4	c5	c6	c7	c8
Warnings:
Warning	1292	Truncated incorrect DOUBLE value: 'Wednesday'
Warning	1292	Truncated incorrect DOUBLE value: 'Thursday'
drop table t1;
##CHAR,VARCHAR,TINYBLOB,TINYTEXT,BLOB,TEXT,MEDIUMBLOB,MEDIUMTEXT,LONGBLOB,LONGTEXT
create table t1(c1 CHAR(20),c2 VARCHAR(50),c3 TINYBLOB,c4 TINYTEXT,c5 BLOB,c6 TEXT,c7 MEDIUMBLOB,c8 MEDIUMTEXT,c9 LONGBLOB,c10 LONGTEXT);
insert into t1 values('5好好2','','疯为来','#啊啊#','大懂','18','2019-01-12','21:00:00','2018-11-13 17:16:25','2015-07-05 20:18:18');
insert into t1 values('上的','','撒法发','￥@#','发送方','59','2019-05-23','11:29:29','2012-12-19 01:59:03','2008-05-13 10:25:19');
insert into t1 values('房贷首付','','阿斯蒂芬','#@#@','咳咳咳','','2020-01-07','13:59:12','2020-01-07 13:59:59','2020-09-23 11:22:33');
insert into t1 values('ADK','','反馈卡','','覆盖掉开发','','1995-01-07','23:59:59','1995-12-07 18:59:59','1998-09-23 11:22:33');
insert into t1 values('大苏','','sss','99mmhn','222手动','so','2010-05-09','07:59:19','2011-11-01 23:59:59','2015-07-21 10:11:23');
select c1,dayname(c1) from t1;
c1	dayname(c1)
5好好2	NULL
上的	NULL
房贷首付	NULL
ADK	NULL
大苏	NULL
Warnings:
Warning	5086	Not timestamp Can not cast varchar value to timestamp type
Warning	5086	Not timestamp Can not cast varchar value to timestamp type
Warning	5086	Not timestamp Can not cast varchar value to timestamp type
Warning	5086	Not timestamp Can not cast varchar value to timestamp type
Warning	5086	Not timestamp Can not cast varchar value to timestamp type
select c2,dayname(c2) from t1;
c2	dayname(c2)
	NULL
	NULL
	NULL
	NULL
	NULL
Warnings:
Warning	5086	Not timestamp Can not cast varchar value to timestamp type
Warning	5086	Not timestamp Can not cast varchar value to timestamp type
Warning	5086	Not timestamp Can not cast varchar value to timestamp type
Warning	5086	Not timestamp Can not cast varchar value to timestamp type
Warning	5086	Not timestamp Can not cast varchar value to timestamp type
select c3,dayname(c3) from t1;
c3	dayname(c3)
疯为来	NULL
撒法发	NULL
阿斯蒂芬	NULL
反馈卡	NULL
sss	NULL
Warnings:
Warning	5086	Not timestamp Can not cast varchar value to timestamp type
Warning	5086	Not timestamp Can not cast varchar value to timestamp type
Warning	5086	Not timestamp Can not cast varchar value to timestamp type
Warning	5086	Not timestamp Can not cast varchar value to timestamp type
Warning	5086	Not timestamp Can not cast varchar value to timestamp type
select c4,dayname(c4) from t1;
c4	dayname(c4)
#啊啊#	NULL
￥@#	NULL
#@#@	NULL
	NULL
99mmhn	NULL
Warnings:
Warning	5086	Not timestamp Can not cast varchar value to timestamp type
Warning	5086	Not timestamp Can not cast varchar value to timestamp type
Warning	5086	Not timestamp Can not cast varchar value to timestamp type
Warning	5086	Not timestamp Can not cast varchar value to timestamp type
Warning	5086	Not timestamp Can not cast varchar value to timestamp type
select c5,dayname(c5) from t1;
c5	dayname(c5)
大懂	NULL
发送方	NULL
咳咳咳	NULL
覆盖掉开发	NULL
222手动	NULL
Warnings:
Warning	5086	Not timestamp Can not cast varchar value to timestamp type
Warning	5086	Not timestamp Can not cast varchar value to timestamp type
Warning	5086	Not timestamp Can not cast varchar value to timestamp type
Warning	5086	Not timestamp Can not cast varchar value to timestamp type
Warning	5086	Not timestamp Can not cast varchar value to timestamp type
select c6,dayname(c6) from t1;
c6	dayname(c6)
18	NULL
59	NULL
	NULL
	NULL
so	NULL
Warnings:
Warning	5086	Not timestamp Can not cast varchar value to timestamp type
Warning	5086	Not timestamp Can not cast varchar value to timestamp type
Warning	5086	Not timestamp Can not cast varchar value to timestamp type
Warning	5086	Not timestamp Can not cast varchar value to timestamp type
Warning	5086	Not timestamp Can not cast varchar value to timestamp type
select c7,dayname(c7) from t1;
c7	dayname(c7)
2019-01-12	Saturday
2019-05-23	Thursday
2020-01-07	Tuesday
1995-01-07	Saturday
2010-05-09	Sunday
select c8,dayname(c8) from t1;
c8	dayname(c8)
21:00:00	NULL
11:29:29	NULL
13:59:12	NULL
23:59:59	NULL
07:59:19	NULL
Warnings:
Warning	5086	Not timestamp Can not cast varchar value to timestamp type
Warning	5086	Not timestamp Can not cast varchar value to timestamp type
Warning	5086	Not timestamp Can not cast varchar value to timestamp type
Warning	5086	Not timestamp Can not cast varchar value to timestamp type
Warning	5086	Not timestamp Can not cast varchar value to timestamp type
select c9,dayname(c9) from t1;
c9	dayname(c9)
2018-11-13 17:16:25	Tuesday
2012-12-19 01:59:03	Wednesday
2020-01-07 13:59:59	Tuesday
1995-12-07 18:59:59	Thursday
2011-11-01 23:59:59	Tuesday
select c10,dayname(c10) from t1;
c10	dayname(c10)
2015-07-05 20:18:18	Sunday
2008-05-13 10:25:19	Tuesday
2020-09-23 11:22:33	Wednesday
1998-09-23 11:22:33	Wednesday
2015-07-21 10:11:23	Tuesday
drop table t1;
## TIME,date,DATETIME,TIMESTAMP,YEAR
CREATE TABLE t1(c1 TIME ,
c2 date ,
c3 DATETIME ,
c4 TIMESTAMP DEFAULT '2000-01-01 00:00:00',
c5 YEAR ) ;
INSERT INTO t1 VALUES('20:12:12','2000-12-12','2000-01-01 01:01:01','2001-01-01 23:59:59.9999999','2000'),
('21:12:13','2001-12-22','2001-01-02 13:01:01','2001-11-02 00:00:01.999999','2001'),
('22:12:14','2002-12-02','2002-01-03 14:01:01','2002-12-03 02:01:01.299999','2002'),
('23:12:15','2003-12-11','2003-01-04 15:01:01','2002-11-04 03:01:01.399999','2003'),
('20:22:16','2004-12-12','2004-01-05 16:01:01','2002-02-05 05:01:01.499999','2004'),
('20:32:17','2021-12-13','2010-01-06 21:01:01','2003-03-06 04:01:01.599999','2005'),
('20:12:18','2005-12-12','2000-01-07 01:01:01','2001-01-07 12:01:01.699999','2006'),
('11:12:19','2006-12-22','2011-01-08 13:01:01','2001-11-08 11:01:01.799999','2007'),
('02:12:20','2007-12-02','2012-01-09 14:01:01','2002-12-09 02:01:01.899999','2008'),
('03:12:21','2008-12-11','2013-01-10 15:01:01','2002-11-10 03:01:01.999999','2009'),
('00:22:22','2009-12-12','2010-01-11 16:01:01','2002-02-11 05:01:01.000001','2010'),
('00:32:23','2001-12-13','2010-01-12 21:01:01','2003-03-31 04:59:59.000000','2011');
select c2,dayname(c2) from t1;
c2	dayname(c2)
2000-12-12	Tuesday
2001-12-22	Saturday
2002-12-02	Monday
2003-12-11	Thursday
2004-12-12	Sunday
2021-12-13	Monday
2005-12-12	Monday
2006-12-22	Friday
2007-12-02	Sunday
2008-12-11	Thursday
2009-12-12	Saturday
2001-12-13	Thursday
select c3,dayname(c3) from t1;
c3	dayname(c3)
2000-01-01 01:01:01	Saturday
2001-01-02 13:01:01	Tuesday
2002-01-03 14:01:01	Thursday
2003-01-04 15:01:01	Saturday
2004-01-05 16:01:01	Monday
2010-01-06 21:01:01	Wednesday
2000-01-07 01:01:01	Friday
2011-01-08 13:01:01	Saturday
2012-01-09 14:01:01	Monday
2013-01-10 15:01:01	Thursday
2010-01-11 16:01:01	Monday
2010-01-12 21:01:01	Tuesday
select c4,dayname(c4) from t1;
c4	dayname(c4)
2001-01-02 00:00:00	Tuesday
2001-11-02 00:00:02	Friday
2002-12-03 02:01:01	Tuesday
2002-11-04 03:01:01	Monday
2002-02-05 05:01:01	Tuesday
2003-03-06 04:01:02	Thursday
2001-01-07 12:01:02	Sunday
2001-11-08 11:01:02	Thursday
2002-12-09 02:01:02	Monday
2002-11-10 03:01:02	Sunday
2002-02-11 05:01:01	Monday
2003-03-31 04:59:59	Monday
select c5,dayname(c5) from t1;
c5	dayname(c5)
2000	NULL
2001	NULL
2002	NULL
2003	NULL
2004	NULL
2005	NULL
2006	NULL
2007	NULL
2008	NULL
2009	NULL
2010	NULL
2011	NULL
Warnings:
Warning	5086	Not timestamp Can not cast varchar value to timestamp type
Warning	5086	Not timestamp Can not cast varchar value to timestamp type
Warning	5086	Not timestamp Can not cast varchar value to timestamp type
Warning	5086	Not timestamp Can not cast varchar value to timestamp type
Warning	5086	Not timestamp Can not cast varchar value to timestamp type
Warning	5086	Not timestamp Can not cast varchar value to timestamp type
Warning	5086	Not timestamp Can not cast varchar value to timestamp type
Warning	5086	Not timestamp Can not cast varchar value to timestamp type
Warning	5086	Not timestamp Can not cast varchar value to timestamp type
Warning	5086	Not timestamp Can not cast varchar value to timestamp type
Warning	5086	Not timestamp Can not cast varchar value to timestamp type
Warning	5086	Not timestamp Can not cast varchar value to timestamp type
drop table t1;
##运算符验证
##算数运算符
##当前使用表达式进行运算时,结果与MySQL5.7不一致，MySQL会以工作日索引进行计算（周一到周日对应0-6）,mysql有时候会根据外层表达式,改变内层表达式的返回值,ob无论如何都为0；
select +dayname('2022-09-07');
+dayname('2022-09-07')
Wednesday
select dayname('2022-09-07')-dayname('2022-09-07');
dayname('2022-09-07')-dayname('2022-09-07')
0
Warnings:
Warning	1292	Truncated incorrect DOUBLE value: 'Wednesday'
Warning	1292	Truncated incorrect DOUBLE value: 'Wednesday'
##比较运算符
##当前使用表达式进行运算时,结果与MySQL5.7不一致，MySQL会以工作日索引进行计算（周一到周日对应0-6）,mysql有时候会根据外层表达式,改变内层表达式的返回值,ob无论如何都为0；
select dayname('2022-09-07') = dayname('2022-09-07');
dayname('2022-09-07') = dayname('2022-09-07')
1
select dayname('2022-09-07') <> dayname('2022-09-07');
dayname('2022-09-07') <> dayname('2022-09-07')
0
select dayname('2022-09-07') < dayname('2022-09-07');
dayname('2022-09-07') < dayname('2022-09-07')
0
select dayname('2022-09-07') != dayname('2022-09-07');
dayname('2022-09-07') != dayname('2022-09-07')
0
select dayname('2022-09-07') > dayname('2022-09-07');
dayname('2022-09-07') > dayname('2022-09-07')
0
select dayname('2022-09-07') >= dayname('2022-09-07');
dayname('2022-09-07') >= dayname('2022-09-07')
1
select dayname('2022-09-07') <= dayname('2022-09-07');
dayname('2022-09-07') <= dayname('2022-09-07')
1
select dayname('2022-09-07') <=> dayname('2022-09-07');
dayname('2022-09-07') <=> dayname('2022-09-07')
1
select dayname('2022-09-07') in ('monday','Tuesday','Wednesday','Thursday','Friday','Saturday','Sunday');
dayname('2022-09-07') in ('monday','Tuesday','Wednesday','Thursday','Friday','Saturday','Sunday')
1
select dayname('null') in ('monday','Tuesday','Wednesday','Thursday','Friday','Saturday','Sunday');
dayname('null') in ('monday','Tuesday','Wednesday','Thursday','Friday','Saturday','Sunday')
NULL
Warnings:
Warning	5086	Not timestamp Can not cast varchar value to timestamp type
select dayname('null')  not in ('monday','Tuesday','Wednesday','Thursday','Friday','Saturday','Sunday');
dayname('null')  not in ('monday','Tuesday','Wednesday','Thursday','Friday','Saturday','Sunday')
NULL
Warnings:
Warning	5086	Not timestamp Can not cast varchar value to timestamp type
select dayname('2022-09-07')  not in ('monday','Tuesday','Wednesday','Thursday','Friday','Saturday','Sunday');
dayname('2022-09-07')  not in ('monday','Tuesday','Wednesday','Thursday','Friday','Saturday','Sunday')
0
select dayname('2022-09-07') between dayname('2022-09-07') and dayname('2022-09-08');
dayname('2022-09-07') between dayname('2022-09-07') and dayname('2022-09-08')
0
select dayname('2022-09-07') not between dayname('2022-09-07') and dayname('2022-09-07');
dayname('2022-09-07') not between dayname('2022-09-07') and dayname('2022-09-07')
0
select dayname('2022-09-07') is null;
dayname('2022-09-07') is null
0
select dayname('2022-09-07') is not null;
dayname('2022-09-07') is not null
1
select dayname('0') is null;
dayname('0') is null
1
Warnings:
Warning	5086	Not timestamp Can not cast varchar value to timestamp type
select dayname('null') is null;
dayname('null') is null
1
Warnings:
Warning	5086	Not timestamp Can not cast varchar value to timestamp type
select dayname('null') is true;
dayname('null') is true
0
Warnings:
Warning	5086	Not timestamp Can not cast varchar value to timestamp type
select dayname('null') is false;
dayname('null') is false
0
Warnings:
Warning	5086	Not timestamp Can not cast varchar value to timestamp type
位运算符和逻辑运算符
##mysql有时候会根据外层表达式，改变内层表达式的返回值,以下结果均不一致；
select dayname('2022-09-07') xor dayname('2022-09-07');
dayname('2022-09-07') xor dayname('2022-09-07')
0
Warnings:
Warning	1292	Truncated incorrect DOUBLE value: 'Wednesday'
select dayname('2022-09-07')+1 xor dayname('2022-09-07')-1;
dayname('2022-09-07')+1 xor dayname('2022-09-07')-1
0
Warnings:
Warning	1292	Truncated incorrect DOUBLE value: 'Wednesday'
Warning	1292	Truncated incorrect DOUBLE value: 'Wednesday'
drop table t1;
##日期时间函数校验
select CURRENT_TIME(dayname('2022-09-07'));
ERROR 42000: You have an error in your SQL syntax; check the manual that corresponds to your OceanBase version for the right syntax to use near 'dayname('2022-09-07'))' at line 1
select CURRENT_TIME(dayname('2022-09-07')-dayname('2022-09-07'));
ERROR 42000: You have an error in your SQL syntax; check the manual that corresponds to your OceanBase version for the right syntax to use near 'dayname('2022-09-07')-dayname('2022-09-07'))' at line 1
select CURRENT_TIMESTAMP(dayname('2022-09-07')-dayname('2022-09-07'));
ERROR 42000: You have an error in your SQL syntax; check the manual that corresponds to your OceanBase version for the right syntax to use near 'dayname('2022-09-07')-dayname('2022-09-07'))' at line 1
select DATE_ADD(dayname('2022-09-07 23:59:59'),INTERVAL '1:1' MINUTE_SECOND);
DATE_ADD(dayname('2022-09-07 23:59:59'),INTERVAL '1:1' MINUTE_SECOND)
NULL
SELECT dayname(DATE_ADD('2022-09-07 23:59:59',INTERVAL '1:1' MINUTE_SECOND));
dayname(DATE_ADD('2022-09-07 23:59:59',INTERVAL '1:1' MINUTE_SECOND))
Thursday
select dayname(date_format('2022-01-27 13:23:00', '%Y-%c-%d'))as result;
result
Thursday
select date_format(dayname('2022-01-27 13:23:00'),'%Y %c %d')as result;
result
NULL
select dayname('2009-10-01') = DATE_FORMAT('2009-10-01 22:23:00', '%W');
dayname('2009-10-01') = DATE_FORMAT('2009-10-01 22:23:00', '%W')
1
select dayname(date_sub(date '2022-01-22',interval '3' day));
dayname(date_sub(date '2022-01-22',interval '3' day))
Wednesday
select DATE_SUB(dayname('2022-09-07'),INTERVAL 5 DAY);
DATE_SUB(dayname('2022-09-07'),INTERVAL 5 DAY)
NULL
select DATEDIFF(dayname('2022-09-07'),dayname('2021-09-07'));
DATEDIFF(dayname('2022-09-07'),dayname('2021-09-07'))
NULL
select dayname(DATEDIFF('2000-01-22 23:59:59','1000-01-21'));
dayname(DATEDIFF('2000-01-22 23:59:59','1000-01-21'))
NULL
Warnings:
Warning	5086	Not timestamp Can not cast varchar value to timestamp type
select EXTRACT(week from dayname('2022-09-07'));
EXTRACT(week from dayname('2022-09-07'))
NULL
select EXTRACT(week from dayname('2022-09-07'));
EXTRACT(week from dayname('2022-09-07'))
NULL
select from_days(dayname('2022-09-07'));
from_days(dayname('2022-09-07'))
0000-00-00
select dayname(from_days(738565));
dayname(from_days(738565))
Monday
select FROM_UNIXTIME(dayname('2022-09-07'),GET_FORMAT(DATE,'USA'));
FROM_UNIXTIME(dayname('2022-09-07'),GET_FORMAT(DATE,'USA'))
01.01.1970
Warnings:
Warning	1292	Truncated incorrect DECIMAL value: 'Wednesday'
select dayname(FROM_UNIXTIME(1647738456));
dayname(FROM_UNIXTIME(1647738456))
Sunday
select MONTH(dayname('2022-09-07'));
MONTH(dayname('2022-09-07'))
NULL
Warnings:
Warning	5086	Not timestamp Can not cast varchar value to timestamp type
select dayname(month('2022-09-07'));
dayname(month('2022-09-07'))
NULL
Warnings:
Warning	5086	Not timestamp Can not cast varchar value to timestamp type
select PERIOD_DIFF(dayname('2022-09-07'),dayname('2022-09-07'));
PERIOD_DIFF(dayname('2022-09-07'),dayname('2022-09-07'))
0
Warnings:
Warning	1292	Truncated incorrect INTEGER value: 'Wednesday'
Warning	1292	Truncated incorrect INTEGER value: 'Wednesday'
select dayname(PERIOD_DIFF(200802,200703));
dayname(PERIOD_DIFF(200802,200703))
NULL
Warnings:
Warning	5086	Not timestamp Can not cast varchar value to timestamp type
select dayname(str_to_date('2022-01-06 10:20:30','%Y-%m-%d %H:%i:%s')) as result;
result
Thursday
select STR_TO_DATE(dayname('2022-09-07'));
ERROR 42000: Incorrect parameter count in the call to native function 'STR_TO_DATE'
##MySQL5.7与ob结果不一致;
select time(dayname('2022-09-07 23:59:59.999999'));
time(dayname('2022-09-07 23:59:59.999999'))
00:00:00.000000
select TIME_TO_SEC(dayname('2022-09-07'));
TIME_TO_SEC(dayname('2022-09-07'))
0
select dayname(TIME_TO_SEC('2022-09-07'));
dayname(TIME_TO_SEC('2022-09-07'))
Friday
##MySQL5.7与ob结果不一致;
select TIMEDIFF(dayname('2022-09-07'),dayname('2022-09-07'));
TIMEDIFF(dayname('2022-09-07'),dayname('2022-09-07'))
NULL
SELECT TIMESTAMPADD(WEEK,1,dayname('2003-01-02'));
TIMESTAMPADD(WEEK,1,dayname('2003-01-02'))
NULL
select TIMESTAMPDIFF(day,dayname('2022-09-07') , dayname('2022-09-07'));
TIMESTAMPDIFF(day,dayname('2022-09-07') , dayname('2022-09-07'))
NULL
select dayname(TIMESTAMPDIFF(MONTH,'2003-02-01','2003-05-01'));
dayname(TIMESTAMPDIFF(MONTH,'2003-02-01','2003-05-01'))
NULL
Warnings:
Warning	5086	Not timestamp Can not cast varchar value to timestamp type
select TO_DAYS(dayname('2003-02-01'));
TO_DAYS(dayname('2003-02-01'))
NULL
select dayname(TO_DAYS('2003-02-01'));
dayname(TO_DAYS('2003-02-01'))
NULL
Warnings:
Warning	5086	Not timestamp Can not cast varchar value to timestamp type
##MySQL5.7与ob结果不一致;
select SEC_TO_TIME(dayname('2003-02-01'));
SEC_TO_TIME(dayname('2003-02-01'))
00:00:00.000000
Warnings:
Warning	1292	Truncated incorrect DECIMAL value: 'Saturday'
##MySQL5.7与ob结果不一致;
select UNIX_TIMESTAMP(dayname('2022-09-07'));
UNIX_TIMESTAMP(dayname('2022-09-07'))
0.000000
select dayname(UNIX_TIMESTAMP('2022-09-07'));
dayname(UNIX_TIMESTAMP('2022-09-07'))
NULL
Warnings:
Warning	5086	Not timestamp Can not cast varchar value to timestamp type
select UTC_TIMESTAMP(dayname('2022-09-07'));
ERROR 42000: You have an error in your SQL syntax; check the manual that corresponds to your OceanBase version for the right syntax to use near 'dayname('2022-09-07'))' at line 1
select YEAR(dayname('2022-09-07'));
YEAR(dayname('2022-09-07'))
NULL
Warnings:
Warning	5086	Not timestamp Can not cast varchar value to timestamp type
select dayname(year('2022-09-07'));
dayname(year('2022-09-07'))
NULL
Warnings:
Warning	5086	Not timestamp Can not cast varchar value to timestamp type
#此处year函数的问题;已经提了
select YEAR(dayname('2022-09-07')+10000);
YEAR(dayname('2022-09-07')+10000)
2001
Warnings:
Warning	1292	Truncated incorrect DOUBLE value: 'Wednesday'
##字符串函数
select CONCAT(dayname('2022-09-07'),dayname('2022-09-07'));
CONCAT(dayname('2022-09-07'),dayname('2022-09-07'))
WednesdayWednesday
select CONCAT_WS('_',dayname('2022-09-07'),dayname('2022-09-07'));
CONCAT_WS('_',dayname('2022-09-07'),dayname('2022-09-07'))
Wednesday_Wednesday
select FORMAT(dayname('2022-09-08'),3);
FORMAT(dayname('2022-09-08'),3)
0.000
Warnings:
Warning	1292	Truncated incorrect DOUBLE value: 'Thursday'
select dayname(FORMAT(1025.12356,2));
dayname(FORMAT(1025.12356,2))
NULL
Warnings:
Warning	5086	Not timestamp Can not cast varchar value to timestamp type
select SUBSTR(dayname('2022-09-07'),1);
SUBSTR(dayname('2022-09-07'),1)
Wednesday
select dayname(SUBSTR('20220907',1));
dayname(SUBSTR('20220907',1))
Wednesday
select SUBSTRING(dayname('2022-09-07'),1,1);
SUBSTRING(dayname('2022-09-07'),1,1)
W
select dayname(SUBSTRING('2022-09-07',1,10));
dayname(SUBSTRING('2022-09-07',1,10))
Wednesday
select TRIM(  dayname(' 2022-09-07  ')  );
TRIM(  dayname(' 2022-09-07  ')  )
Wednesday
select dayname(TRIM(' 2022-09-07 '));
dayname(TRIM(' 2022-09-07 '))
Wednesday
select RTRIM(dayname('2022-09-07'));
RTRIM(dayname('2022-09-07'))
Wednesday
select dayname(RTRIM('2022-09-07'));
dayname(RTRIM('2022-09-07'))
Wednesday
select ascii(dayname('2022-09-07'));
ascii(dayname('2022-09-07'))
87
select dayname(ascii('2022-09-07'));
dayname(ascii('2022-09-07'))
NULL
Warnings:
Warning	5086	Not timestamp Can not cast varchar value to timestamp type
select ORD(dayname('2022-09-07'));
ORD(dayname('2022-09-07'))
87
select dayname(ORD('2022-09-07'));
dayname(ORD('2022-09-07'))
NULL
Warnings:
Warning	5086	Not timestamp Can not cast varchar value to timestamp type
select LENGTH(dayname('2022-09-07'));
LENGTH(dayname('2022-09-07'))
9
select dayname(LENGTH('2022-09-07'));
dayname(LENGTH('2022-09-07'))
NULL
Warnings:
Warning	5086	Not timestamp Can not cast varchar value to timestamp type
select CHAR_LENGTH(dayname('2022-09-07'));
CHAR_LENGTH(dayname('2022-09-07'))
9
select dayname(CHAR_LENGTH('2022-09-07'));
dayname(CHAR_LENGTH('2022-09-07'))
NULL
Warnings:
Warning	5086	Not timestamp Can not cast varchar value to timestamp type
select UPPER(dayname('2022-09-07'));
UPPER(dayname('2022-09-07'))
WEDNESDAY
select dayname(UPPER('2022-09-07'));
dayname(UPPER('2022-09-07'))
Wednesday
select lower(dayname('2022-09-07'));
lower(dayname('2022-09-07'))
wednesday
select dayname(lower('2022-09-07'));
dayname(lower('2022-09-07'))
Wednesday
select HEX(dayname('2022-09-07'));
HEX(dayname('2022-09-07'))
5765646E6573646179
select dayname(HEX('2022-09-07'));
dayname(HEX('2022-09-07'))
NULL
Warnings:
Warning	5086	Not timestamp Can not cast varchar value to timestamp type
select UNHEX(dayname('2022-09-07'));
UNHEX(dayname('2022-09-07'))
NULL
select dayname(UNHEX('2022-09-07'));
dayname(UNHEX('2022-09-07'))
NULL
select MD5(dayname('2022-09-07'));
MD5(dayname('2022-09-07'))
796c163589f295373e171842f37265d5
select dayname(MD5('2022-09-07'));
dayname(MD5('2022-09-07'))
NULL
Warnings:
Warning	5086	Not timestamp Can not cast varchar value to timestamp type
select INT2IP(dayname('2022-09-07'));
INT2IP(dayname('2022-09-07'))
0.0.0.0
Warnings:
Warning	1292	Truncated incorrect INTEGER value: 'Wednesday'
select dayname(INT2IP('2022-09-07'));
dayname(INT2IP('2022-09-07'))
NULL
Warnings:
Warning	1292	Truncated incorrect INTEGER value: '2022-09-07'
Warning	5086	Not timestamp Can not cast varchar value to timestamp type
SELECT dayname('2022-09-07') LIKE 'W%';
dayname('2022-09-07') LIKE 'W%'
1
SELECT dayname('2022-09-07') REGEXP dayname('2022-09-08');
dayname('2022-09-07') REGEXP dayname('2022-09-08')
0
SELECT REPEAT(dayname('2022-09-07'), 5);
REPEAT(dayname('2022-09-07'), 5)
WednesdayWednesdayWednesdayWednesdayWednesday
SELECT dayname(REPEAT('2022-09-07',1));
dayname(REPEAT('2022-09-07',1))
Wednesday
##MySQL5.7与ob结果不一致;
SELECT REPEAT(dayname('2022-09-07'), dayname('2022-09-07'));
REPEAT(dayname('2022-09-07'), dayname('2022-09-07'))

Warnings:
Warning	1292	Truncated incorrect INTEGER value: 'Wednesday'
SELECT SPACE(dayname('2022-09-07'),0);
ERROR 42000: Incorrect parameter count in the call to native function 'SPACE'
SELECT dayname(SPACE('2022-09-07'));
dayname(SPACE('2022-09-07'))
NULL
Warnings:
Warning	1292	Truncated incorrect INTEGER value: '2022-09-07'
Warning	5086	Not timestamp Can not cast varchar value to timestamp type
SELECT SUBSTRING_INDEX(dayname('2022-09-07'),' ',1);
SUBSTRING_INDEX(dayname('2022-09-07'),' ',1)
Wednesday
SELECT dayname(SUBSTRING_INDEX('2022-09-07','-',3));
dayname(SUBSTRING_INDEX('2022-09-07','-',3))
Wednesday
SELECT LOCATE(dayname('2022-09-07'),dayname('2022-09-07'));
LOCATE(dayname('2022-09-07'),dayname('2022-09-07'))
1
SELECT LOCATE(dayname('2022-09-07'),dayname('2022-09-08'));
LOCATE(dayname('2022-09-07'),dayname('2022-09-08'))
0
SELECT POSITION(dayname('2022-09-07') in dayname('2022-09-07'));
POSITION(dayname('2022-09-07') in dayname('2022-09-07'))
1
SELECT POSITION(dayname('2022-09-07') in dayname('2022-09-08'));
POSITION(dayname('2022-09-07') in dayname('2022-09-08'))
0
SELECT INSTR(dayname('2022-09-07'),dayname('2022-09-07'));
INSTR(dayname('2022-09-07'),dayname('2022-09-07'))
1
SELECT INSTR(dayname('2022-09-07'),dayname('2022-09-08'));
INSTR(dayname('2022-09-07'),dayname('2022-09-08'))
0
SELECT REPLACE(dayname('2022-09-07'),dayname('2022-09-07'),dayname('2022-09-07'));
REPLACE(dayname('2022-09-07'),dayname('2022-09-07'),dayname('2022-09-07'))
Wednesday
SELECT REPLACE(dayname('2022-09-07'),dayname('2022-09-07'),dayname('2022-09-08'));
REPLACE(dayname('2022-09-07'),dayname('2022-09-07'),dayname('2022-09-08'))
Thursday
SELECT FIELD(dayname('2022-09-07'),dayname('2022-09-07'),dayname('2022-09-07'));
FIELD(dayname('2022-09-07'),dayname('2022-09-07'),dayname('2022-09-07'))
1
SELECT FIELD(dayname('2022-09-07'),dayname('2022-09-07'),dayname('2022-09-08'));
FIELD(dayname('2022-09-07'),dayname('2022-09-07'),dayname('2022-09-08'))
1
SELECT ELT(1,dayname('2022-09-07'),dayname('2022-09-07'));
ELT(1,dayname('2022-09-07'),dayname('2022-09-07'))
Wednesday
SELECT ELT(2,dayname('2022-09-07'),dayname('2022-09-08'));
ELT(2,dayname('2022-09-07'),dayname('2022-09-08'))
Thursday
##MySQL5.7与ob结果不一致;
SELECT LPAD(dayname('2022-09-07'),dayname('2022-09-07'),dayname('2022-09-07'));
LPAD(dayname('2022-09-07'),dayname('2022-09-07'),dayname('2022-09-07'))

##MySQL5.7与ob结果不一致;
SELECT RPAD(dayname('2022-09-07'),dayname('2022-09-07'),dayname('2022-09-07'));
RPAD(dayname('2022-09-07'),dayname('2022-09-07'),dayname('2022-09-07'))

SELECT bin(dayname('2022-09-07'));
bin(dayname('2022-09-07'))
0
SELECT bin(dayname('2022-09-08'));
bin(dayname('2022-09-08'))
0
SELECT quote(dayname('2022-09-07'));
quote(dayname('2022-09-07'))
'Wednesday'
SELECT quote(dayname('2022-09-08'));
quote(dayname('2022-09-08'))
'Thursday'
SELECT REGEXP_SUBSTR(dayname('2022-09-07'));
ERROR 42000: Incorrect parameter count in the call to native function 'REGEXP_SUBSTR'
##转换函数与数学函数
select CAST(dayname('2022-09-07') as date);
CAST(dayname('2022-09-07') as date)
NULL
select CAST(dayname('2022-09-07') as time);
CAST(dayname('2022-09-07') as time)
00:00:00
select dayname(CAST('2022-09-07' as date));
dayname(CAST('2022-09-07' as date))
Wednesday
select ROUND(dayname(2022-09-07),1);
ROUND(dayname(2022-09-07),1)
NULL
Warnings:
Warning	5086	Not timestamp Can not cast varchar value to timestamp type
select dayname(round(20220907.984));
dayname(round(20220907.984))
Thursday
select dayname(ROUND('2022-09-07'),ROUND('2022-09-07'));
ERROR 42000: Incorrect parameter count in the call to native function 'dayname'
select ROUND(dayname('2022-09-07'),dayname('2022-09-07')-20200916);
ROUND(dayname('2022-09-07'),dayname('2022-09-07')-20200916)
0
Warnings:
Warning	1292	Truncated incorrect DOUBLE value: 'Wednesday'
Warning	1292	Truncated incorrect DOUBLE value: 'Wednesday'
select dayname(CEIL('20220907'));
dayname(CEIL('20220907'))
Wednesday
select dayname(CEIL('20220908 23:59:59.999999'));
dayname(CEIL('20220908 23:59:59.999999'))
Thursday
Warnings:
Warning	1292	Truncated incorrect DOUBLE value: '20220908 23:59:59.999999'
select dayname(FLOOR('20220907'));
dayname(FLOOR('20220907'))
Wednesday
select dayname(FLOOR('20220908 23:59:59.999999'));
dayname(FLOOR('20220908 23:59:59.999999'))
Thursday
Warnings:
Warning	1292	Truncated incorrect DOUBLE value: '20220908 23:59:59.999999'
select dayname(ABS(20220907+1));
dayname(ABS(20220907+1))
Thursday
select dayname(ABS(20220908-1));
dayname(ABS(20220908-1))
Wednesday
select dayname(SIGN(20220907));
dayname(SIGN(20220907))
NULL
Warnings:
Warning	5086	Not timestamp Can not cast varchar value to timestamp type
select dayname(CONV(20220907+1));
ERROR 42000: Incorrect parameter count in the call to native function 'CONV'
select MOD(dayname('2022-09-07'),1);
MOD(dayname('2022-09-07'),1)
0
Warnings:
Warning	1292	Truncated incorrect DOUBLE value: 'Wednesday'
select dayname(MOD(20220907,1));
dayname(MOD(20220907,1))
NULL
Warnings:
Warning	5086	Not timestamp Can not cast varchar value to timestamp type
select POW(dayname(20220907),null);
POW(dayname(20220907),null)
NULL
Warnings:
Warning	1292	Truncated incorrect DOUBLE value: 'Wednesday'
select dayname(POW(20220907),1);
ERROR 42000: Incorrect parameter count in the call to native function 'dayname'
select POWER(dayname(20220907),null);
POWER(dayname(20220907),null)
NULL
Warnings:
Warning	1292	Truncated incorrect DOUBLE value: 'Wednesday'
select dayname(POWER(20220907),1);
ERROR 42000: Incorrect parameter count in the call to native function 'dayname'
select rand(dayname(2022-09-07));
rand(dayname(2022-09-07))
0.15522042769493574
Warnings:
Warning	5086	Not timestamp Can not cast varchar value to timestamp type
select dayname(rand(2022-09-07));
dayname(rand(2022-09-07))
NULL
Warnings:
Warning	5086	Not timestamp Can not cast varchar value to timestamp type
##流程控制函数与比较函数
select GREATEST(dayname('2022-09-07'),'1');
GREATEST(dayname('2022-09-07'),'1')
Wednesday
select LEAST(dayname('2022-09-07'),'1');
LEAST(dayname('2022-09-07'),'1')
1
select isnull(dayname('2022-09-07'));
isnull(dayname('2022-09-07'))
0
select isnull(dayname('2022-09-07')+0);
isnull(dayname('2022-09-07')+0)
0
Warnings:
Warning	1292	Truncated incorrect DOUBLE value: 'Wednesday'
select CASE dayname('2022-09-08') when dayname('2022-09-08') then 1 when dayname('2022-09-07') then 2 END as result;
result
1
select if(dayname('2022-09-07')<dayname('2022-09-08'),dayname('2022-09-07'),dayname('2022-09-08')) as result;
result
Thursday
select ifnull(null,dayname('2022-09-07'));
ifnull(null,dayname('2022-09-07'))
Wednesday
select nullif(dayname('2022-09-07'),dayname('2022-09-07'));
nullif(dayname('2022-09-07'),dayname('2022-09-07'))
NULL
select COALESCE(dayname('2022-09-07'));
COALESCE(dayname('2022-09-07'))
Wednesday
select sleep(dayname(20200912));
sleep(dayname(20200912))
0
Warnings:
Warning	1292	Truncated incorrect DECIMAL value: 'Saturday'
##使用场景 
##表table
##create as select
drop table t1;
drop table t2;
create table t1 (c1 int ,c2 varchar(20),c3 date);
insert into t1 values(1,'test01','20220907');
insert into t1 values(2,'test02','20220909');
insert into t1 values(3,'test03','2022-08-20');
insert into t1 values(4,'test04','2022-09-15');
insert into t1 values(5,'test05','2022-09-16');
select dayname(c3) as a from t1;
a
Wednesday
Friday
Saturday
Thursday
Friday
create table t2 as select dayname(c3) from t1;
drop table t2;
##聚合函数
select count(dayname(c3)) from t1;
count(dayname(c3))
5
select min(dayname(c3)) from t1;
min(dayname(c3))
Friday
select max(dayname(c3)) from t1;
max(dayname(c3))
Wednesday
select GROUP_CONCAT(dayname(c3)) from t1;
GROUP_CONCAT(dayname(c3))
Wednesday,Friday,Saturday,Thursday,Friday
##where子句
select t1.*, dayname(c3) from t1 where dayname(c3)='Friday';
c1	c2	c3	dayname(c3)
2	test02	2022-09-09	Friday
5	test05	2022-09-16	Friday
select t1.*, dayname(c3) from t1 where dayname(c3)>='Friday';
c1	c2	c3	dayname(c3)
1	test01	2022-09-07	Wednesday
2	test02	2022-09-09	Friday
3	test03	2022-08-20	Saturday
4	test04	2022-09-15	Thursday
5	test05	2022-09-16	Friday
select t1.*, dayname(c3) from t1 where dayname(c3)<='Friday';
c1	c2	c3	dayname(c3)
2	test02	2022-09-09	Friday
5	test05	2022-09-16	Friday
select t1.*, dayname(c3) from t1 where dayname(c3)='Friday';
c1	c2	c3	dayname(c3)
2	test02	2022-09-09	Friday
5	test05	2022-09-16	Friday
select t1.*, dayname(c3) from t1 where dayname(c3)<'Wednesday';
c1	c2	c3	dayname(c3)
2	test02	2022-09-09	Friday
3	test03	2022-08-20	Saturday
4	test04	2022-09-15	Thursday
5	test05	2022-09-16	Friday
select t1.*, dayname(c3) from t1 where dayname(c3)>'Friday';
c1	c2	c3	dayname(c3)
1	test01	2022-09-07	Wednesday
3	test03	2022-08-20	Saturday
4	test04	2022-09-15	Thursday
select t1.*, dayname(c3) from t1 where dayname(c3) between 'Friday' and 'Saturday';
c1	c2	c3	dayname(c3)
2	test02	2022-09-09	Friday
3	test03	2022-08-20	Saturday
5	test05	2022-09-16	Friday
select t1.*, dayname(c3) from t1 where dayname(c3) like 'Friday%';
c1	c2	c3	dayname(c3)
2	test02	2022-09-09	Friday
5	test05	2022-09-16	Friday
select t1.*, dayname(c3) from t1 where exists (select dayname(c3),dayname(c3));
c1	c2	c3	dayname(c3)
1	test01	2022-09-07	Wednesday
2	test02	2022-09-09	Friday
3	test03	2022-08-20	Saturday
4	test04	2022-09-15	Thursday
5	test05	2022-09-16	Friday
select t1.*, dayname(c3) from t1 where 'Friday' in  (select dayname(c3));
c1	c2	c3	dayname(c3)
2	test02	2022-09-09	Friday
5	test05	2022-09-16	Friday
select t1.*, dayname(c3) from t1 where 'Wednesday' > all(select dayname(c3));
c1	c2	c3	dayname(c3)
2	test02	2022-09-09	Friday
3	test03	2022-08-20	Saturday
4	test04	2022-09-15	Thursday
5	test05	2022-09-16	Friday
select t1.*, dayname(c3) from t1 where c1 =2 or c2 ='test03';
c1	c2	c3	dayname(c3)
2	test02	2022-09-09	Friday
3	test03	2022-08-20	Saturday
select t1.*, dayname(c3) from t1 where c1 =2 and c2 ='test02';
c1	c2	c3	dayname(c3)
2	test02	2022-09-09	Friday
create table t2(a1 int ,a2 int);
insert into t2 values(1,1);
insert into t2 values(2,2);
insert into t2 values(3,3);
select t1.*,dayname(c3) from t1 inner join t2 on t1.c1=t2.a1;
c1	c2	c3	dayname(c3)
1	test01	2022-09-07	Wednesday
2	test02	2022-09-09	Friday
3	test03	2022-08-20	Saturday
select t1.*,dayname(c3) from t1 left join t2 on t1.c1=t2.a1;
c1	c2	c3	dayname(c3)
1	test01	2022-09-07	Wednesday
2	test02	2022-09-09	Friday
3	test03	2022-08-20	Saturday
4	test04	2022-09-15	Thursday
5	test05	2022-09-16	Friday
select t1.*,dayname(c3) from t1 right join t2 on t1.c1=t2.a1;
c1	c2	c3	dayname(c3)
1	test01	2022-09-07	Wednesday
2	test02	2022-09-09	Friday
3	test03	2022-08-20	Saturday
##mysql5.7不支持
with tt as (select dayname(c3)  from t1)  select * from tt;
dayname(c3)
Wednesday
Friday
Saturday
Thursday
Friday
select distinct dayname(c3) from t1;
dayname(c3)
Wednesday
Friday
Saturday
Thursday
select t1.*,dayname(c3) from t1 group by c1;
c1	c2	c3	dayname(c3)
1	test01	2022-09-07	Wednesday
2	test02	2022-09-09	Friday
3	test03	2022-08-20	Saturday
4	test04	2022-09-15	Thursday
5	test05	2022-09-16	Friday
select t1.*,dayname(c3) from t1 group by dayname(c3);
c1	c2	c3	dayname(c3)
1	test01	2022-09-07	Wednesday
2	test02	2022-09-09	Friday
3	test03	2022-08-20	Saturday
4	test04	2022-09-15	Thursday
select t1.*,dayname(c3) from t1 group by dayname(c3) having dayname(c3)>='2020-09-13';
c1	c2	c3	dayname(c3)
1	test01	2022-09-07	Wednesday
2	test02	2022-09-09	Friday
3	test03	2022-08-20	Saturday
4	test04	2022-09-15	Thursday
select t1.*,dayname(c3) from t1 order by dayname(c3);
c1	c2	c3	dayname(c3)
2	test02	2022-09-09	Friday
5	test05	2022-09-16	Friday
3	test03	2022-08-20	Saturday
4	test04	2022-09-15	Thursday
1	test01	2022-09-07	Wednesday
select t1.*,dayname(c3) from t1 order by dayname(c3) desc ;
c1	c2	c3	dayname(c3)
1	test01	2022-09-07	Wednesday
4	test04	2022-09-15	Thursday
3	test03	2022-08-20	Saturday
2	test02	2022-09-09	Friday
5	test05	2022-09-16	Friday
#case when 内部错误;已知bug
drop table t2;
drop table t1;
##insert into
create table t1(a bool,b bool);
insert into t1 values(0000.999999,111.999999);
select dayname(a) from t1;
dayname(a)
NULL
Warnings:
Warning	5086	Not timestamp Can not cast varchar value to timestamp type
select dayname(b) from t1;
dayname(b)
Wednesday
drop table t1;
create table t1(a BOOLEAN,b BOOLEAN);
insert into t1 values(0000.999999,111.999999);
select dayname(a) from t1;
dayname(a)
NULL
Warnings:
Warning	5086	Not timestamp Can not cast varchar value to timestamp type
select dayname(b) from t1;
dayname(b)
Wednesday
drop table t1;
create table t1(a TINYINT,b TINYINT);
insert into t1 values(126.999999,12.22);
select dayname(a) from t1;
dayname(a)
Thursday
select dayname(b) from t1;
dayname(b)
NULL
Warnings:
Warning	5086	Not timestamp Can not cast varchar value to timestamp type
drop table t1;
create table t1(a SMALLINT,b SMALLINT);
insert into t1 values(20913.999999,927.1111);
select dayname(a) from t1;
dayname(a)
Saturday
select dayname(b) from t1;
dayname(b)
Wednesday
drop table t1;
create table t1(a MEDIUMINT,b MEDIUMINT);
insert into t1 values(220929.99,220927.1111);
select dayname(a) from t1;
dayname(a)
Friday
select dayname(b) from t1;
dayname(b)
Tuesday
drop table t1;
create table t1(a INT,b int);
insert into t1 values(220913.999999,220927.1111);
select dayname(a) from t1;
dayname(a)
Wednesday
select dayname(b) from t1;
dayname(b)
Tuesday
drop table t1;
create table t1(a INTEGER,b INTEGER);
insert into t1 values(220913.999999,220927.1111);
select dayname(a) from t1;
dayname(a)
Wednesday
select dayname(b) from t1;
dayname(b)
Tuesday
drop table t1;
create table t1(a BIGINT,b BIGINT);
insert into t1 values(220913.999999,220927.1111);
select dayname(a) from t1;
dayname(a)
Wednesday
select dayname(b) from t1;
dayname(b)
Tuesday
drop table t1;
create table t1(a DECIMAL,b DECIMAL);
insert into t1 values(220913.999999,220927.1111);
Warnings:
Warning	1265	Data truncated for column 'a' at row 1
Warning	1265	Data truncated for column 'b' at row 1
select dayname(a) from t1;
dayname(a)
Wednesday
select dayname(b) from t1;
dayname(b)
Tuesday
drop table t1;
create table t1(a NUMERIC,b NUMERIC);
insert into t1 values(220913.999999,220927.1111);
Warnings:
Warning	1265	Data truncated for column 'a' at row 1
Warning	1265	Data truncated for column 'b' at row 1
select dayname(a) from t1;
dayname(a)
Wednesday
select dayname(b) from t1;
dayname(b)
Tuesday
drop table t1;
create table t1(a FLOAT,b FLOAT);
insert into t1 values(220913.999999,220927.1111);
select dayname(a) from t1;
dayname(a)
Wednesday
select dayname(b) from t1;
dayname(b)
Tuesday
drop table t1;
create table t1(a DOUBLE,b DOUBLE);
insert into t1 values(220913.999999,220927.1111);
#此处为已知bug，关于double类型导致的结果正确性;
#
select dayname(a) from t1;
dayname(a)
Wednesday
select dayname(b) from t1;
dayname(b)
Tuesday
drop table t1;
create table t1(a BIT,b bit);
insert into t1 values(0,1);
select dayname(a) from t1;
dayname(a)
NULL
Warnings:
Warning	5086	Not timestamp Can not cast varchar value to timestamp type
select dayname(b) from t1;
dayname(b)
NULL
Warnings:
Warning	5086	Not timestamp Can not cast varchar value to timestamp type
drop table t1;
create table t1(a DATETIME,b DATETIME);
insert into t1 values(220913,220927);
select dayname(a) from t1;
dayname(a)
Tuesday
select dayname(b) from t1;
dayname(b)
Tuesday
drop table t1;
create table t1(a TIMESTAMP,b TIMESTAMP);
insert into t1 values('2022-09-13 23:59:59.999999','2038-01-19 03:14:07.999999');
select dayname(a) from t1;
dayname(a)
Wednesday
select dayname(b) from t1;
dayname(b)
Tuesday
drop table t1;
create table t1(a DATE,b DATE);
insert into t1 values('1970-01-01 23:59:59','2038-01-19 03:14:07');
select dayname(a) from t1;
dayname(a)
Thursday
select dayname(b) from t1;
dayname(b)
Tuesday
drop table t1;
create table t1(a TIME,b TIME);
insert into t1 values('23:59:59.999999','2038-01-19 23:59:59.999999');
drop table t1;
create table t1(a YEAR,b year);
insert into t1 values('2022','2038');
select dayname(a) from t1;
dayname(a)
NULL
Warnings:
Warning	5086	Not timestamp Can not cast varchar value to timestamp type
select dayname(b) from t1;
dayname(b)
NULL
Warnings:
Warning	5086	Not timestamp Can not cast varchar value to timestamp type
drop table t1;
create table t1(a VARCHAR(50),b VARCHAR(50));
insert into t1 values('2022-09-27 23:59:59.999999','2038-01-19 23:59:59.999999');
select dayname(a) from t1;
dayname(a)
Tuesday
select dayname(b) from t1;
dayname(b)
Tuesday
drop table t1;
create table t1(a VARBINARY(50),b VARBINARY(50));
insert into t1 values('2022-09-27 23:59:59.999999','2038-01-19 23:59:59.999999');
select dayname(a) from t1;
dayname(a)
Tuesday
select dayname(b) from t1;
dayname(b)
Tuesday
drop table t1;
create table t1(a CHAR(50),b CHAR(50));
insert into t1 values('2022-09-27 23:59:59.999999','2038-01-19 23:59:59.999999');
select dayname(a) from t1;
dayname(a)
Tuesday
select dayname(b) from t1;
dayname(b)
Tuesday
drop table t1;
create table t1(a BINARY(10),b BINARY(10));
insert into t1 values('10111101','11111011');
select dayname(a) from t1;
dayname(a)
NULL
Warnings:
Warning	5086	Not timestamp Can not cast varchar value to timestamp type
select dayname(b) from t1;
dayname(b)
NULL
Warnings:
Warning	5086	Not timestamp Can not cast varchar value to timestamp type
drop table t1;
create table t1(a enum ('2022-09-27 23:59:59.999999','2038-01-19 23:59:59.999999'),b enum ('10111101','11111011'));
insert into t1 values('2022-09-27 23:59:59.999999','10111101');
select dayname(a) from t1;
dayname(a)
Tuesday
select dayname(b) from t1;
dayname(b)
Friday
drop table t1;
create table t1(a set ('2022-09-27 23:59:59.999999','2038-01-19 23:59:59.999999'),b set ('10111101','11111011'));
insert into t1 values('2022-09-27 23:59:59.999999','10111101');
select dayname(a) from t1;
dayname(a)
Tuesday
select dayname(b) from t1;
dayname(b)
Friday
drop table t1;
create table t1(a TINYTEXT,b TINYTEXT);
insert into t1 values('2022-09-27 23:59:59.999999','10111101');
select dayname(a) from t1;
dayname(a)
Tuesday
select dayname(b) from t1;
dayname(b)
Friday
drop table t1;
create table t1(a TINYBLOB,b TINYBLOB);
insert into t1 values('2022-09-27 23:59:59.999999','10111101');
select dayname(a) from t1;
dayname(a)
Tuesday
select dayname(b) from t1;
dayname(b)
Friday
drop table t1;
create table t1(a TEXT,b TEXT);
insert into t1 values('2022-09-27 23:59:59.999999','10111101');
select dayname(a) from t1;
dayname(a)
Tuesday
select dayname(b) from t1;
dayname(b)
Friday
drop table t1;
create table t1(a BLOB,b BLOB);
insert into t1 values('2022-09-27 23:59:59.999999','10111101');
select dayname(a) from t1;
dayname(a)
Tuesday
select dayname(b) from t1;
dayname(b)
Friday
drop table t1;
create table t1(a MEDIUMTEXT,b MEDIUMTEXT);
insert into t1 values('2022-09-27 23:59:59.999999','10111101');
select dayname(a) from t1;
dayname(a)
Tuesday
select dayname(b) from t1;
dayname(b)
Friday
drop table t1;
create table t1(a MEDIUMBLOB,b MEDIUMBLOB);
insert into t1 values('2022-09-27 23:59:59.999999','10111101');
select dayname(a) from t1;
dayname(a)
Tuesday
select dayname(b) from t1;
dayname(b)
Friday
drop table t1;
create table t1(a LONGTEXT,b LONGTEXT);
insert into t1 values('2022-09-27 23:59:59.999999','10111101');
select dayname(a) from t1;
dayname(a)
Tuesday
select dayname(b) from t1;
dayname(b)
Friday
drop table t1;
create table t1(a LONGBLOB,b LONGBLOB);
insert into t1 values('2022-09-27 23:59:59.999999','10111101');
select dayname(a) from t1;
dayname(a)
Tuesday
select dayname(b) from t1;
dayname(b)
Friday
drop table t1;
create table t1 (c1 int ,c2 varchar(40),c3 date);
insert into t1 values(1,'test01','20220811');
insert into t1 values(2,'test02','20220915');
insert into t1 values(3,'test03','2022-08-20');
insert into t1 values(4,'test04','2022-09-15');
select * from t1;
c1	c2	c3
1	test01	2022-08-11
2	test02	2022-09-15
3	test03	2022-08-20
4	test04	2022-09-15
drop table t2;
create table t2 (a1 int ,a2 varchar(20));
insert into t2(a1, a2)  select 1,dayname('2022-09-15');
select * from t2;
a1	a2
1	Thursday
drop table t2;
insert into t1 values(abs(dayname(c3)),UPPER(dayname(c3)),STR_TO_DATE(dayname(c3),GET_FORMAT(DATETIME,'EUR')));
select * from t1;
c1	c2	c3
1	test01	2022-08-11
2	test02	2022-09-15
3	test03	2022-08-20
4	test04	2022-09-15
NULL	NULL	NULL
drop table t1;
## update
create table t1 (c1 int ,c2 varchar(20),c3 date);
insert into t1 values(1,'test01','20220907');
insert into t1 values(2,'test02','20220909');
insert into t1 values(3,'test03','2022-08-20');
insert into t1 values(4,'test04','2022-09-15');
insert into t1 values(5,'test05','2022-09-16');
update t1 set c2= dayname('20220907') where c2='test01';
select * from t1;
c1	c2	c3
1	Wednesday	2022-09-07
2	test02	2022-09-09
3	test03	2022-08-20
4	test04	2022-09-15
5	test05	2022-09-16
update t1 set c2= dayname('2022-08-20'),c1=1 where c2 in ('test01','test02');
update t1 set c2= DATE_ADD(dayname(c3),INTERVAL 5 DAY);
ERROR 22007: Incorrect datetime value for column 'c2' at row 1
select * from t1;
c1	c2	c3
1	Wednesday	2022-09-07
1	Saturday	2022-09-09
3	test03	2022-08-20
4	test04	2022-09-15
5	test05	2022-09-16
drop table t1;
create table t1(c2 varchar(dayname('2022-09-16')-'Tuesday'));
ERROR 42000: You have an error in your SQL syntax; check the manual that corresponds to your OceanBase version for the right syntax to use near 'dayname('2022-09-16')-'Tuesday'))' at line 1
create table t1(c1 int ,c2 varchar(20) default dayname('2022-09-13'));
ERROR 42000: You have an error in your SQL syntax; check the manual that corresponds to your OceanBase version for the right syntax to use near 'dayname('2022-09-13'))' at line 1
create table t1(c1 int, c2 varchar(20) GENERATED ALWAYS AS (dayname('2022-09-13')) STORED NOT NULL COMMENT '日期');
##delete
drop table t1;
create table t1 (c1 int ,c2 varchar(20),c3 date);
insert into t1 values(1,dayname('20220907'),'20220907');
insert into t1 values(2,dayname(20220909),'20220909');
insert into t1 values(3,dayname('2022-08-20'),'2022-08-20');
insert into t1 values(4,dayname('2022-09-15'),'2022-09-15');
insert into t1 values(5,dayname('2022-09-16'),'2022-09-16');
select * from t1;
c1	c2	c3
1	Wednesday	2022-09-07
2	Friday	2022-09-09
3	Saturday	2022-08-20
4	Thursday	2022-09-15
5	Friday	2022-09-16
delete  from t1 where c2 = dayname('2022-09-16');
delete from t1 where dayname(c3) = 'Saturday';
select * from t1;
c1	c2	c3
1	Wednesday	2022-09-07
4	Thursday	2022-09-15
drop table t1;
create table t1(c1 int, c2 varchar(30));
alter  table t1 modify  column c1 int(dayname('2022-09-13'));
ERROR 42000: You have an error in your SQL syntax; check the manual that corresponds to your OceanBase version for the right syntax to use near 'dayname('2022-09-13'))' at line 1
alter  table t1 modify  column c1 varchar(30)  DEFAULT dayname('2022-09-13');
ERROR 42000: You have an error in your SQL syntax; check the manual that corresponds to your OceanBase version for the right syntax to use near 'dayname('2022-09-13')' at line 1
alter  table t1 modify  column c1 varchar(30)  GENERATED ALWAYS AS (dayname('2022-09-13')) STORED NOT NULL COMMENT '日期';
ERROR HY000: 'Changing the STORED status' is not supported for generated columns.
drop table t1;
create table t1 (c1 int primary key, c2 varchar(30)) partition by hash(dayname(c1)) partitions 3;
ERROR HY000: This partition function is not allowed
create table t1 (c1 int primary key, c2 varchar(30)) partition by hash(c1) partitions 3;
insert into t1 values(1,dayname('2022-09-15'));
insert into t1 values(2,dayname('2022-09-16'));
insert into t1 values(3,dayname('2022-09-17'));
insert into t1 values(4,dayname('2022-09-18'));
select * from t1;
c1	c2
3	Saturday
1	Thursday
4	Sunday
2	Friday
update t1 set c2 =dayname('2022-09-19');
delete from t1 where c2 =dayname('2022-09-19');
select * from t1;
c1	c2
drop table t1;
drop table t1;
create table t1 (c1 int primary key, c2 varchar(30)) partition by range(c1) (
PARTITION p0 VALUES LESS THAN (2),
PARTITION p1 VALUES LESS THAN (4),
PARTITION p2 VALUES LESS THAN (6)
);
insert into t1 values(1,dayname('2022-09-15'));
insert into t1 values(2,dayname('2022-09-16'));
insert into t1 values(3,dayname('2022-09-17'));
insert into t1 values(5,dayname('2022-09-18'));
select * from t1;
c1	c2
1	Thursday
2	Friday
3	Saturday
5	Sunday
update t1 set c2 =dayname('2022-09-19');
delete from t1 where c2 =dayname('2022-09-19');
select * from t1;
c1	c2
drop table t1;
drop table t1;
create table t1 (c1 int primary key, c2 varchar(30)) partition by list(c1) (
PARTITION p0 VALUES IN (1,2),
PARTITION p1 VALUES IN (3,4),
PARTITION p2 VALUES IN (5,6)
);
insert into t1 values(1,dayname('2022-09-15'));
insert into t1 values(2,dayname('2022-09-16'));
insert into t1 values(3,dayname('2022-09-17'));
insert into t1 values(5,dayname('2022-09-18'));
select * from t1;
c1	c2
1	Thursday
2	Friday
3	Saturday
5	Sunday
update t1 set c2 =dayname('2022-09-19');
delete from t1 where c2 =dayname('2022-09-19');
select * from t1;
c1	c2
drop table t1;
drop table t1;
create table t1 (c1 int primary key, c2 varchar(30)) partition by key(dayname(c1)) partitions 3;
ERROR 42000: You have an error in your SQL syntax; check the manual that corresponds to your OceanBase version for the right syntax to use near '(c1)) partitions 3' at line 1
create table t1 (c1 int primary key, c2 varchar(30)) partition by key(c1) partitions 3;
insert into t1 values(1,dayname('2022-09-15'));
insert into t1 values(2,dayname('2022-09-16'));
insert into t1 values(3,dayname('2022-09-17'));
insert into t1 values(4,dayname('2022-09-18'));
select * from t1;
c1	c2
4	Sunday
3	Saturday
1	Thursday
2	Friday
update t1 set c2 =dayname('2022-09-19');
delete from t1 where c2 =dayname('2022-09-19');
select * from t1;
c1	c2
drop table t1;
## 视图
drop table t1;
create table t1 (c1 int ,c2 varchar(20),c3 date);
insert into t1 values(1,'test01','20220907');
insert into t1 values(2,'test02','20220909');
insert into t1 values(3,'test03','2022-08-20');
insert into t1 values(4,'test04','2022-09-15');
insert into t1 values(5,'test05','2022-09-16');
drop view t1_view;
create view t1_view as select * from t1;
select * from t1_view;
c1	c2	c3
1	test01	2022-09-07
2	test02	2022-09-09
3	test03	2022-08-20
4	test04	2022-09-15
5	test05	2022-09-16
select t1_view.*, dayname(c3) from t1_view where dayname(c3)='Friday';
c1	c2	c3	dayname(c3)
2	test02	2022-09-09	Friday
5	test05	2022-09-16	Friday
select t1_view.*, dayname(c3) from t1_view where dayname(c3)>='Friday';
c1	c2	c3	dayname(c3)
1	test01	2022-09-07	Wednesday
2	test02	2022-09-09	Friday
3	test03	2022-08-20	Saturday
4	test04	2022-09-15	Thursday
5	test05	2022-09-16	Friday
select t1_view.*, dayname(c3) from t1_view where dayname(c3)<='Friday';
c1	c2	c3	dayname(c3)
2	test02	2022-09-09	Friday
5	test05	2022-09-16	Friday
select t1_view.*, dayname(c3) from t1_view where dayname(c3)='Friday';
c1	c2	c3	dayname(c3)
2	test02	2022-09-09	Friday
5	test05	2022-09-16	Friday
select t1_view.*, dayname(c3) from t1_view where dayname(c3)<'Wednesday';
c1	c2	c3	dayname(c3)
2	test02	2022-09-09	Friday
3	test03	2022-08-20	Saturday
4	test04	2022-09-15	Thursday
5	test05	2022-09-16	Friday
select t1_view.*, dayname(c3) from t1_view where dayname(c3)>'Friday';
c1	c2	c3	dayname(c3)
1	test01	2022-09-07	Wednesday
3	test03	2022-08-20	Saturday
4	test04	2022-09-15	Thursday
select t1_view.*, dayname(c3) from t1_view where dayname(c3) between 'Friday' and 'Saturday';
c1	c2	c3	dayname(c3)
2	test02	2022-09-09	Friday
3	test03	2022-08-20	Saturday
5	test05	2022-09-16	Friday
select t1_view.*, dayname(c3) from t1_view where dayname(c3) like 'Friday%';
c1	c2	c3	dayname(c3)
2	test02	2022-09-09	Friday
5	test05	2022-09-16	Friday
select t1_view.*, dayname(c3) from t1_view where exists (select dayname(c3),dayname(c3));
c1	c2	c3	dayname(c3)
1	test01	2022-09-07	Wednesday
2	test02	2022-09-09	Friday
3	test03	2022-08-20	Saturday
4	test04	2022-09-15	Thursday
5	test05	2022-09-16	Friday
select t1_view.*, dayname(c3) from t1_view where 'Friday' in  (select dayname(c3));
c1	c2	c3	dayname(c3)
2	test02	2022-09-09	Friday
5	test05	2022-09-16	Friday
select t1_view.*, dayname(c3) from t1_view where 'Wednesday' > all(select dayname(c3));
c1	c2	c3	dayname(c3)
2	test02	2022-09-09	Friday
3	test03	2022-08-20	Saturday
4	test04	2022-09-15	Thursday
5	test05	2022-09-16	Friday
select t1_view.*, dayname(c3) from t1_view where c1 =2 or c2 ='test03';
c1	c2	c3	dayname(c3)
2	test02	2022-09-09	Friday
3	test03	2022-08-20	Saturday
select t1_view.*, dayname(c3) from t1_view where c1 =2 and c2 ='test02';
c1	c2	c3	dayname(c3)
2	test02	2022-09-09	Friday
insert into t1_view(c2) values(dayname('202209167'));
ERROR 22007: Incorrect datetime value for column 'c2' at row 1
insert into t1_view(c2) values(dayname('20220916'));
insert into t1_view(c1,c2,c3) values(0,dayname('20220914'),'20220914');
insert into t1_view(c1,c2,c3) values(6,dayname('20220918'),'20220918');
delete from t1_view where c2=dayname('20220918');
drop table t1;
drop view t1_view;
##PL块
drop table t1;
drop table t2;
DROP PROCEDURE pro1;
CREATE  PROCEDURE pro1( out a varchar(30))
begin
select dayname('2022-09-14') into a;
end;
//
CALL pro1(@aa);
select @aa;
@aa
Wednesday
DROP PROCEDURE pro1;
DROP PROCEDURE pro2;
CREATE  PROCEDURE pro2( out b int)
begin
select dayname('2022-09-14') into b;
end;
//
CALL pro2(@bb);
ERROR HY000: Incorrect integer value
select @bb;
@bb
NULL
DROP PROCEDURE pro2;
drop table t1;
create table t1(c1 int,c2 varchar(30));
DROP PROCEDURE pro3;
CREATE PROCEDURE pro3(in a varchar(20))
begin
declare i int;
set i=20220910;
while i <=20220914  DO
if i > a then
select dayname(i);
end if;
insert into t1 values(i,dayname(i));
set i = i + 1;
end WHILE;
end;
//
CALL pro3(20220920);
DROP PROCEDURE pro3;
drop table t1;
create table t1(c1 int,c2 varchar(30));
DROP PROCEDURE pro4;
CREATE PROCEDURE pro4(in a int)
begin
declare i int;
declare b int;
set i=20220910;
while i <=20220914  DO
if a =20220920 then
select dayname(a);
end if;
insert into t1 values(a ,dayname(a));
set i = i + 1;
end WHILE;
select a into b;
end;
//
CALL pro4(20220920);
dayname(a)
dayname(a)
dayname(a)
dayname(a)
dayname(a)
Tuesday
Tuesday
Tuesday
Tuesday
Tuesday
select * from t1;
c1	c2
20220920	Tuesday
20220920	Tuesday
20220920	Tuesday
20220920	Tuesday
20220920	Tuesday
DROP PROCEDURE pro4;
drop table t1;
create table t1(c1 int,c2 varchar(30));
drop function  f1;
create function f1(aa  int) returns varchar(30)
begin
return dayname(aa);
end;
//
select f1(20220914);
f1(20220914)
Wednesday
drop table t1;
drop function  f1;
##insert型触发器
drop table t1;
drop table t2;
drop trigger t1_trigger;
create table t1 (c1 int ,c2 varchar(20),c3 date);
insert into t1 values(1,'test01','20220907');
insert into t1 values(2,'test02','20220909');
insert into t1 values(3,'test03','2022-08-20');
insert into t1 values(4,'test04','2022-09-15');
insert into t1 values(5,'test05','2022-09-16');
select * from t1;
c1	c2	c3
1	test01	2022-09-07
2	test02	2022-09-09
3	test03	2022-08-20
4	test04	2022-09-15
5	test05	2022-09-16
create table t2 (a1 int ,a2 varchar(20));
insert into t2 values(1,'test08');
insert into t2 values(2,'test09');
select * from t2;
a1	a2
1	test08
2	test09
create trigger t1_trigger after insert on  t2
for each row
begin 
update t1 set c2=dayname('2022-09-16') where c3="2022-09-16";
end //
insert into t2 values(3,'test03');
##update型触发器
drop table t1;
drop table t2;
drop trigger t1_trigger;
create table t1 (c1 int ,c2 varchar(20),c3 date);
insert into t1 values(1,'test01','20220907');
insert into t1 values(2,'test02','20220909');
insert into t1 values(3,'test03','2022-08-20');
insert into t1 values(4,'test04','2022-09-15');
insert into t1 values(5,'test05','2022-09-16');
select * from t1;
c1	c2	c3
1	test01	2022-09-07
2	test02	2022-09-09
3	test03	2022-08-20
4	test04	2022-09-15
5	test05	2022-09-16
create table t2 (a1 int ,a2 varchar(20));
insert into t2 values(1,'test08');
insert into t2 values(2,'test09');
select * from t2;
a1	a2
1	test08
2	test09
create trigger t1_trigger after update on  t2
for each row
begin 
update t1 set c2=dayname('2022-09-16') where c3="2022-09-16";
end //
update t2 set a2=dayname('2022-09-15') where a1=1;
##delete型触发器
drop table t1;
drop table t2;
drop trigger t1_trigger;
create table t1 (c1 int ,c2 varchar(20),c3 date);
insert into t1 values(1,'test01','20220907');
insert into t1 values(2,'test02','20220909');
insert into t1 values(3,'test03','2022-08-20');
insert into t1 values(4,'test04','2022-09-15');
insert into t1 values(5,'test05','2022-09-16');
select * from t1;
c1	c2	c3
1	test01	2022-09-07
2	test02	2022-09-09
3	test03	2022-08-20
4	test04	2022-09-15
5	test05	2022-09-16
create table t2 (a1 int ,a2 varchar(20));
insert into t2 values(1,'test08');
insert into t2 values(2,'test09');
select * from t2;
a1	a2
1	test08
2	test09
create trigger t1_trigger after delete on  t2
for each row
begin 
update t1 set c2=dayname('2022-09-16') where c3="2022-09-16";
end //
delete from t2 where a1=2;
drop table t1;
drop table t2;
drop trigger t1_trigger;
##约束
drop table t1;
create table t1(c1 varchar(20) primary key,c2 varchar(20) default '10');
drop table t2;
create table t2(a1 varchar(20) unique key ,a2 varchar(20),a3 varchar(20),CONSTRAINT for_key FOREIGN KEY (a3) REFERENCES  t1 (c1));
drop table t3;
create table t3(b1 varchar(20) not null ,b2 varchar(20));
insert into t1 values(dayname('2022-09-14'),dayname('2022-09-15'));
insert into t1(c1) values(dayname('2022-09-16'));
update t1 set c1=dayname('2022-09-17'),c2=dayname('2022-09-18') where c2='10';
select * from t1;
c1	c2
Saturday	Sunday
Wednesday	Thursday
insert into t2 values(dayname('2022-09-14'),'test',dayname('2022-09-15'));
ERROR 23000: Cannot add or update a child row: a foreign key constraint fails
insert into t2 values('test',dayname('2022-09-18'),dayname('2022-09-17'));
select * from t2;
a1	a2	a3
test	Sunday	Saturday
update t2 set a1=dayname('2022-09-18') where a3=dayname('2022-09-17');
update t2 set a3=dayname('2022-09-19');
ERROR 23000: Cannot add or update a child row: a foreign key constraint fails
update t3 set b1=null;
insert into t3 values(dayname('2022-09-18'),dayname('2022-09-16'));
select * from t3;
b1	b2
Sunday	Friday
##索引
CREATE INDEX indexName ON t1 (c1);
insert into t1 values(dayname('2022-09-18'),dayname('2022-09-19'));
update t1 set c2=('2022-09-20')  where c2=dayname('2022-09-19');
select * from t1 ;
c1	c2
Saturday	Sunday
Sunday	2022-09-20
Wednesday	Thursday
########清空回收站，删除测试数据库，表等 ##########
drop table t2;
drop table t1;
drop database  IF EXISTS db1;
