drop database  IF EXISTS  db1;
create database db1;
use db1;
SET wait_timeout=30000000;
SET ob_trx_timeout = 30000000;
SET ob_query_timeout = 30000000;
##设置相同sql_mode;
SET @@sql_mode='STRICT_TRANS_TABLES,NO_ENGINE_SUBSTITUTION,no_zero_date,no_zero_in_date,PIPES_AS_CONCAT';
##参数验证
select dayofyear();
ERROR 42000: Incorrect parameter count in the call to native function 'dayofyear'
select dayofyear(" ");
dayofyear(" ")
NULL
Warnings:
Warning	5086	Not timestamp Can not cast varchar value to timestamp type
select dayofyear("null");
dayofyear("null")
NULL
Warnings:
Warning	5086	Not timestamp Can not cast varchar value to timestamp type
select dayofyear(0);
dayofyear(0)
NULL
Warnings:
Warning	5086	Not timestamp Can not cast varchar value to timestamp type
select dayofyear(1);
dayofyear(1)
NULL
Warnings:
Warning	5086	Not timestamp Can not cast varchar value to timestamp type
select dayofyear("0000-00-00");
dayofyear("0000-00-00")
NULL
Warnings:
Warning	5086	Not timestamp Can not cast varchar value to timestamp type
select dayofyear('2022年9月19日');
dayofyear('2022年9月19日')
262
select dayofyear('二零二二年九月十九日');
dayofyear('二零二二年九月十九日')
NULL
Warnings:
Warning	5086	Not timestamp Can not cast varchar value to timestamp type
select dayofyear('1969-12-31 23:59:59.9999999');
dayofyear('1969-12-31 23:59:59.9999999')
1
##ob和MySQL5.7结果不一致;
select dayofyear('0000-02-29');
dayofyear('0000-02-29')
NULL
Warnings:
Warning	5086	Not timestamp Can not cast varchar value to timestamp type
select dayofyear(current_time(),current_timestamp());
ERROR 42000: Incorrect parameter count in the call to native function 'dayofyear'
select dayofyear('monday'), dayofyear('Tuesday'), dayofyear('Wednesday'),dayofyear('Sunday'),dayofyear('Thursday'),dayofyear('Friday'),dayofyear('Saturday');
dayofyear('monday')	dayofyear('Tuesday')	dayofyear('Wednesday')	dayofyear('Sunday')	dayofyear('Thursday')	dayofyear('Friday')	dayofyear('Saturday')
NULL	NULL	NULL	NULL	NULL	NULL	NULL
Warnings:
Warning	5086	Not timestamp Can not cast varchar value to timestamp type
Warning	5086	Not timestamp Can not cast varchar value to timestamp type
Warning	5086	Not timestamp Can not cast varchar value to timestamp type
Warning	5086	Not timestamp Can not cast varchar value to timestamp type
Warning	5086	Not timestamp Can not cast varchar value to timestamp type
Warning	5086	Not timestamp Can not cast varchar value to timestamp type
Warning	5086	Not timestamp Can not cast varchar value to timestamp type
select dayofyear('0.01.01');
dayofyear('0.01.01')
1
select dayofyear('9999.12.31');
dayofyear('9999.12.31')
365
select dayofyear(+"2022-09-05");
dayofyear(+"2022-09-05")
248
select dayofyear(-"2022-09-05");
dayofyear(-"2022-09-05")
NULL
Warnings:
Warning	1292	Truncated incorrect DOUBLE value: '2022-09-05'
Warning	5086	Not timestamp Can not cast varchar value to timestamp type
select dayofyear('a');
dayofyear('a')
NULL
Warnings:
Warning	5086	Not timestamp Can not cast varchar value to timestamp type
select dayofyear('@@@');
dayofyear('@@@')
NULL
Warnings:
Warning	5086	Not timestamp Can not cast varchar value to timestamp type
select dayofyear('#');
dayofyear('#')
NULL
Warnings:
Warning	5086	Not timestamp Can not cast varchar value to timestamp type
select dayofyear('""');
dayofyear('""')
NULL
Warnings:
Warning	5086	Not timestamp Can not cast varchar value to timestamp type
select dayofyear('_');
dayofyear('_')
NULL
Warnings:
Warning	5086	Not timestamp Can not cast varchar value to timestamp type
select dayofyear('false');
dayofyear('false')
NULL
Warnings:
Warning	5086	Not timestamp Can not cast varchar value to timestamp type
select dayofyear('true');
dayofyear('true')
NULL
Warnings:
Warning	5086	Not timestamp Can not cast varchar value to timestamp type
select dayofyear('2022-09-05')+4;
dayofyear('2022-09-05')+4
252
select dayofyear('2022-09-05')+false;
dayofyear('2022-09-05')+false
248
select dayofyear('2022-09-05')+true;
dayofyear('2022-09-05')+true
249
select dayofyear('星期一');
dayofyear('星期一')
NULL
Warnings:
Warning	5086	Not timestamp Can not cast varchar value to timestamp type
select dayofyear('星期一1999-12-31');
dayofyear('星期一1999-12-31')
NULL
Warnings:
Warning	5086	Not timestamp Can not cast varchar value to timestamp type
select dayofyear('星期一@#');
dayofyear('星期一@#')
NULL
Warnings:
Warning	5086	Not timestamp Can not cast varchar value to timestamp type
select dayofyear('1999-12-31星期一');
dayofyear('1999-12-31星期一')
365
select dayofyear(1.175494351E-38) From dual;
dayofyear(1.175494351E-38)
NULL
Warnings:
Warning	5086	Not timestamp Can not cast varchar value to timestamp type
select dayofyear('-1970-12-31');
dayofyear('-1970-12-31')
NULL
Warnings:
Warning	5086	Not timestamp Can not cast varchar value to timestamp type
select dayofyear('にににににににに');
dayofyear('にににににににに')
NULL
Warnings:
Warning	5086	Not timestamp Can not cast varchar value to timestamp type
select dayofyear('천구백구십칠년 일월 오일');
dayofyear('천구백구십칠년 일월 오일')
NULL
Warnings:
Warning	5086	Not timestamp Can not cast varchar value to timestamp type
select dayofyear('一九九九零二二六');
dayofyear('一九九九零二二六')
NULL
Warnings:
Warning	5086	Not timestamp Can not cast varchar value to timestamp type
select dayofyear('壹玖玖捌零伍贰贰');
dayofyear('壹玖玖捌零伍贰贰')
NULL
Warnings:
Warning	5086	Not timestamp Can not cast varchar value to timestamp type
select dayofyear('2022-09-07')<'monday';
dayofyear('2022-09-07')<'monday'
0
Warnings:
Warning	1292	Truncated incorrect DECIMAL value: 'monday'
select dayofyear('2022-09-07')>'monday';
dayofyear('2022-09-07')>'monday'
1
Warnings:
Warning	1292	Truncated incorrect DECIMAL value: 'monday'
select dayofyear('2022-09-07') != 'Wednesday';
dayofyear('2022-09-07') != 'Wednesday'
1
Warnings:
Warning	1292	Truncated incorrect DECIMAL value: 'Wednesday'
select dayofyear('2022-09-07') >= 'Wednesday';
dayofyear('2022-09-07') >= 'Wednesday'
1
Warnings:
Warning	1292	Truncated incorrect DECIMAL value: 'Wednesday'
select dayofyear('2022-09-07') <= 'Wednesday';
dayofyear('2022-09-07') <= 'Wednesday'
0
Warnings:
Warning	1292	Truncated incorrect DECIMAL value: 'Wednesday'
select dayofyear('2022-09-07') = 'Wednesday';
dayofyear('2022-09-07') = 'Wednesday'
0
Warnings:
Warning	1292	Truncated incorrect DECIMAL value: 'Wednesday'
select dayofyear(date '2022-09-15');
dayofyear(date '2022-09-15')
258
##MYSQL5.7报错1525,OB显示为null
select dayofyear(date '0000-00-00');
ERROR HY000: Incorrect DATE value: '0000-00-00'
select dayofyear(date '9999-12-31');
dayofyear(date '9999-12-31')
365
OB会显示系统时间,MySQL5.7直接报错;
select dayofyear(time '17:01:60');
ERROR HY000: Incorrect TIME value: '17:01:60'
select dayofyear('2022-09-15 23:59:59');
dayofyear('2022-09-15 23:59:59')
258
select dayofyear('2022-09-15 00:00:00');
dayofyear('2022-09-15 00:00:00')
258
select dayofyear('2022-09-15 00:59:59');
dayofyear('2022-09-15 00:59:59')
258
##ob和MySQL5.7结果不一致;
select dayofyear('1999-12-31星期1999-12-30');
dayofyear('1999-12-31星期1999-12-30')
NULL
Warnings:
Warning	5086	Not timestamp Can not cast varchar value to timestamp type
select dayofyear('1995.02.28')+2000000000000000;
dayofyear('1995.02.28')+2000000000000000
2000000000000059
select dayofyear('9999-12-31 23:59:59.999999')+0;
dayofyear('9999-12-31 23:59:59.999999')+0
365
select dayofyear('9999-12-31 23:59:59.999999')-0;
dayofyear('9999-12-31 23:59:59.999999')-0
365
select dayofyear('9999-12-31 23:59:59.999999')*1;
dayofyear('9999-12-31 23:59:59.999999')*1
365
select dayofyear('9999-12-31 23:59:59.999999')/1;
dayofyear('9999-12-31 23:59:59.999999')/1
365.0000
表字符集测试
set names binary;
select dayofyear('');
dayofyear('')
NULL
Warnings:
Warning	5086	Not timestamp Can not cast varchar value to timestamp type
select dayofyear('0');
dayofyear('0')
NULL
Warnings:
Warning	5086	Not timestamp Can not cast varchar value to timestamp type
select dayofyear(0);
dayofyear(0)
NULL
Warnings:
Warning	5086	Not timestamp Can not cast varchar value to timestamp type
select dayofyear('+1');
dayofyear('+1')
NULL
Warnings:
Warning	5086	Not timestamp Can not cast varchar value to timestamp type
select dayofyear('-1');
dayofyear('-1')
NULL
Warnings:
Warning	5086	Not timestamp Can not cast varchar value to timestamp type
select dayofyear('-false');
dayofyear('-false')
NULL
Warnings:
Warning	5086	Not timestamp Can not cast varchar value to timestamp type
select dayofyear('-true');
dayofyear('-true')
NULL
Warnings:
Warning	5086	Not timestamp Can not cast varchar value to timestamp type
select dayofyear('null');
dayofyear('null')
NULL
Warnings:
Warning	5086	Not timestamp Can not cast varchar value to timestamp type
select dayofyear('1970-01-01');
dayofyear('1970-01-01')
1
select dayofyear('9999-12-31');
dayofyear('9999-12-31')
365
select dayofyear('1000-01-01');
dayofyear('1000-01-01')
1
CREATE TABLE t1(c1 TIME ,
c2 date ,
c3 DATETIME ,
c4 TIMESTAMP DEFAULT '2000-01-01 00:00:00',
c5 YEAR ) default charset=binary;
INSERT INTO t1 VALUES('20:12:12','2000-12-12','2000-01-01 01:01:01','2001-01-01 23:59:59.9999999','2000'),
('21:12:13','2001-12-22','2001-01-02 13:01:01','2001-11-02 00:00:01.999999','2001'),
('22:12:14','2002-12-02','2002-01-03 14:01:01','2002-12-03 02:01:01.299999','2002'),
('23:12:15','2003-12-11','2003-01-04 15:01:01','2002-11-04 03:01:01.399999','2003'),
('20:22:16','2004-12-12','2004-01-05 16:01:01','2002-02-05 05:01:01.499999','2004'),
('20:32:17','2021-12-13','2010-01-06 21:01:01','2003-03-06 04:01:01.599999','2005'),
('20:12:18','2005-12-12','2000-01-07 01:01:01','2001-01-07 12:01:01.699999','2006'),
('11:12:19','2006-12-22','2011-01-08 13:01:01','2001-11-08 11:01:01.799999','2007'),
('02:12:20','2007-12-02','2012-01-09 14:01:01','2002-12-09 02:01:01.899999','2008'),
('03:12:21','2008-12-11','2013-01-10 15:01:01','2002-11-10 03:01:01.999999','2009'),
('00:22:22','2009-12-12','2010-01-11 16:01:01','2002-02-11 05:01:01.000001','2010'),
('00:32:23','2001-12-13','2010-01-12 21:01:01','2003-03-31 04:59:59.000000','2011');
select dayofyear(c2) from t1 where c2 ='2008-12-11';
dayofyear(c2)
346
select dayofyear(c3) from t1 where c3 ='2010-01-12 21:01:01';
dayofyear(c3)
12
select dayofyear(c4) from t1 where c4 ='2001-01-01 23:59:59.9999999';
dayofyear(c4)
2
select dayofyear(c5) from t1 where c5 ='2011';
dayofyear(c5)
NULL
Warnings:
Warning	5086	Not timestamp Can not cast varchar value to timestamp type
drop table t1;
SET NAMES 'utf8mb4';
select dayofyear('');
dayofyear('')
NULL
Warnings:
Warning	5086	Not timestamp Can not cast varchar value to timestamp type
select dayofyear('0');
dayofyear('0')
NULL
Warnings:
Warning	5086	Not timestamp Can not cast varchar value to timestamp type
select dayofyear(0);
dayofyear(0)
NULL
Warnings:
Warning	5086	Not timestamp Can not cast varchar value to timestamp type
select dayofyear('+1');
dayofyear('+1')
NULL
Warnings:
Warning	5086	Not timestamp Can not cast varchar value to timestamp type
select dayofyear('-1');
dayofyear('-1')
NULL
Warnings:
Warning	5086	Not timestamp Can not cast varchar value to timestamp type
select dayofyear('-false');
dayofyear('-false')
NULL
Warnings:
Warning	5086	Not timestamp Can not cast varchar value to timestamp type
select dayofyear('-true');
dayofyear('-true')
NULL
Warnings:
Warning	5086	Not timestamp Can not cast varchar value to timestamp type
select dayofyear('null');
dayofyear('null')
NULL
Warnings:
Warning	5086	Not timestamp Can not cast varchar value to timestamp type
select dayofyear('1970-01-01');
dayofyear('1970-01-01')
1
select dayofyear('9999-12-31');
dayofyear('9999-12-31')
365
select dayofyear('1000-01-01');
dayofyear('1000-01-01')
1
CREATE TABLE t1(c1 TIME ,
c2 date ,
c3 DATETIME ,
c4 TIMESTAMP DEFAULT '2000-01-01 00:00:00',
c5 YEAR ) default charset=utf8mb4;
INSERT INTO t1 VALUES('20:12:12','2000-12-12','2000-01-01 01:01:01','2001-01-01 23:59:59.9999999','2000'),
('21:12:13','2001-12-22','2001-01-02 13:01:01','2001-11-02 00:00:01.999999','2001'),
('22:12:14','2002-12-02','2002-01-03 14:01:01','2002-12-03 02:01:01.299999','2002'),
('23:12:15','2003-12-11','2003-01-04 15:01:01','2002-11-04 03:01:01.399999','2003'),
('20:22:16','2004-12-12','2004-01-05 16:01:01','2002-02-05 05:01:01.499999','2004'),
('20:32:17','2021-12-13','2010-01-06 21:01:01','2003-03-06 04:01:01.599999','2005'),
('20:12:18','2005-12-12','2000-01-07 01:01:01','2001-01-07 12:01:01.699999','2006'),
('11:12:19','2006-12-22','2011-01-08 13:01:01','2001-11-08 11:01:01.799999','2007'),
('02:12:20','2007-12-02','2012-01-09 14:01:01','2002-12-09 02:01:01.899999','2008'),
('03:12:21','2008-12-11','2013-01-10 15:01:01','2002-11-10 03:01:01.999999','2009'),
('00:22:22','2009-12-12','2010-01-11 16:01:01','2002-02-11 05:01:01.000001','2010'),
('00:32:23','2001-12-13','2010-01-12 21:01:01','2003-03-31 04:59:59.000000','2011');
select dayofyear(c2) from t1 where c2 ='2008-12-11';
dayofyear(c2)
346
select dayofyear(c3) from t1 where c3 ='2010-01-12 21:01:01';
dayofyear(c3)
12
select dayofyear(c4) from t1 where c4 ='2001-01-01 23:59:59.9999999';
dayofyear(c4)
2
select dayofyear(c5) from t1 where c5 ='2011';
dayofyear(c5)
NULL
Warnings:
Warning	5086	Not timestamp Can not cast varchar value to timestamp type
drop table t1;
SET NAMES 'gbk';
select dayofyear('');
dayofyear('')
NULL
Warnings:
Warning	5086	Not timestamp Can not cast varchar value to timestamp type
select dayofyear('0');
dayofyear('0')
NULL
Warnings:
Warning	5086	Not timestamp Can not cast varchar value to timestamp type
select dayofyear(0);
dayofyear(0)
NULL
Warnings:
Warning	5086	Not timestamp Can not cast varchar value to timestamp type
select dayofyear('+1');
dayofyear('+1')
NULL
Warnings:
Warning	5086	Not timestamp Can not cast varchar value to timestamp type
select dayofyear('-1');
dayofyear('-1')
NULL
Warnings:
Warning	5086	Not timestamp Can not cast varchar value to timestamp type
select dayofyear('-false');
dayofyear('-false')
NULL
Warnings:
Warning	5086	Not timestamp Can not cast varchar value to timestamp type
select dayofyear('-true');
dayofyear('-true')
NULL
Warnings:
Warning	5086	Not timestamp Can not cast varchar value to timestamp type
select dayofyear('null');
dayofyear('null')
NULL
Warnings:
Warning	5086	Not timestamp Can not cast varchar value to timestamp type
select dayofyear('1970-01-01');
dayofyear('1970-01-01')
1
select dayofyear('9999-12-31');
dayofyear('9999-12-31')
365
select dayofyear('1000-01-01');
dayofyear('1000-01-01')
1
CREATE TABLE t1(c1 TIME ,
c2 date ,
c3 DATETIME ,
c4 TIMESTAMP DEFAULT '2000-01-01 00:00:00',
c5 YEAR ) default charset=gbk;
INSERT INTO t1 VALUES('20:12:12','2000-12-12','2000-01-01 01:01:01','2001-01-01 23:59:59.9999999','2000'),
('21:12:13','2001-12-22','2001-01-02 13:01:01','2001-11-02 00:00:01.999999','2001'),
('22:12:14','2002-12-02','2002-01-03 14:01:01','2002-12-03 02:01:01.299999','2002'),
('23:12:15','2003-12-11','2003-01-04 15:01:01','2002-11-04 03:01:01.399999','2003'),
('20:22:16','2004-12-12','2004-01-05 16:01:01','2002-02-05 05:01:01.499999','2004'),
('20:32:17','2021-12-13','2010-01-06 21:01:01','2003-03-06 04:01:01.599999','2005'),
('20:12:18','2005-12-12','2000-01-07 01:01:01','2001-01-07 12:01:01.699999','2006'),
('11:12:19','2006-12-22','2011-01-08 13:01:01','2001-11-08 11:01:01.799999','2007'),
('02:12:20','2007-12-02','2012-01-09 14:01:01','2002-12-09 02:01:01.899999','2008'),
('03:12:21','2008-12-11','2013-01-10 15:01:01','2002-11-10 03:01:01.999999','2009'),
('00:22:22','2009-12-12','2010-01-11 16:01:01','2002-02-11 05:01:01.000001','2010'),
('00:32:23','2001-12-13','2010-01-12 21:01:01','2003-03-31 04:59:59.000000','2011');
select dayofyear(c2) from t1 where c2 ='2008-12-11';
dayofyear(c2)
346
select dayofyear(c3) from t1 where c3 ='2010-01-12 21:01:01';
dayofyear(c3)
12
select dayofyear(c4) from t1 where c4 ='2001-01-01 23:59:59.9999999';
dayofyear(c4)
2
select dayofyear(c5) from t1 where c5 ='2011';
dayofyear(c5)
NULL
Warnings:
Warning	5086	Not timestamp Can not cast varchar value to timestamp type
drop table t1;
SET NAMES 'gb18030';
select dayofyear('');
dayofyear('')
NULL
Warnings:
Warning	5086	Not timestamp Can not cast varchar value to timestamp type
select dayofyear('0');
dayofyear('0')
NULL
Warnings:
Warning	5086	Not timestamp Can not cast varchar value to timestamp type
select dayofyear(0);
dayofyear(0)
NULL
Warnings:
Warning	5086	Not timestamp Can not cast varchar value to timestamp type
select dayofyear('+1');
dayofyear('+1')
NULL
Warnings:
Warning	5086	Not timestamp Can not cast varchar value to timestamp type
select dayofyear('-1');
dayofyear('-1')
NULL
Warnings:
Warning	5086	Not timestamp Can not cast varchar value to timestamp type
select dayofyear('-false');
dayofyear('-false')
NULL
Warnings:
Warning	5086	Not timestamp Can not cast varchar value to timestamp type
select dayofyear('-true');
dayofyear('-true')
NULL
Warnings:
Warning	5086	Not timestamp Can not cast varchar value to timestamp type
select dayofyear('null');
dayofyear('null')
NULL
Warnings:
Warning	5086	Not timestamp Can not cast varchar value to timestamp type
select dayofyear('1970-01-01');
dayofyear('1970-01-01')
1
select dayofyear('9999-12-31');
dayofyear('9999-12-31')
365
select dayofyear('1000-01-01');
dayofyear('1000-01-01')
1
CREATE TABLE t1(c1 TIME ,
c2 date ,
c3 DATETIME ,
c4 TIMESTAMP DEFAULT '2000-01-01 00:00:00',
c5 YEAR ) default charset=gb18030;
INSERT INTO t1 VALUES('20:12:12','2000-12-12','2000-01-01 01:01:01','2001-01-01 23:59:59.9999999','2000'),
('21:12:13','2001-12-22','2001-01-02 13:01:01','2001-11-02 00:00:01.999999','2001'),
('22:12:14','2002-12-02','2002-01-03 14:01:01','2002-12-03 02:01:01.299999','2002'),
('23:12:15','2003-12-11','2003-01-04 15:01:01','2002-11-04 03:01:01.399999','2003'),
('20:22:16','2004-12-12','2004-01-05 16:01:01','2002-02-05 05:01:01.499999','2004'),
('20:32:17','2021-12-13','2010-01-06 21:01:01','2003-03-06 04:01:01.599999','2005'),
('20:12:18','2005-12-12','2000-01-07 01:01:01','2001-01-07 12:01:01.699999','2006'),
('11:12:19','2006-12-22','2011-01-08 13:01:01','2001-11-08 11:01:01.799999','2007'),
('02:12:20','2007-12-02','2012-01-09 14:01:01','2002-12-09 02:01:01.899999','2008'),
('03:12:21','2008-12-11','2013-01-10 15:01:01','2002-11-10 03:01:01.999999','2009'),
('00:22:22','2009-12-12','2010-01-11 16:01:01','2002-02-11 05:01:01.000001','2010'),
('00:32:23','2001-12-13','2010-01-12 21:01:01','2003-03-31 04:59:59.000000','2011');
select dayofyear(c2) from t1 where c2 ='2008-12-11';
dayofyear(c2)
346
select dayofyear(c3) from t1 where c3 ='2010-01-12 21:01:01';
dayofyear(c3)
12
select dayofyear(c4) from t1 where c4 ='2001-01-01 23:59:59.9999999';
dayofyear(c4)
2
select dayofyear(c5) from t1 where c5 ='2011';
dayofyear(c5)
NULL
Warnings:
Warning	5086	Not timestamp Can not cast varchar value to timestamp type
drop table t1;
##数据类型验证
##TINYINT,SMALLINT,MEDIUMINT,int,BIGINT,FLOAT,DOUBLE,DECIMAL
create table t1(c1 TINYINT,c2 SMALLINT,c3 MEDIUMINT,c4 int,c5 BIGINT,c6 FLOAT,c7 DOUBLE,c8 DECIMAL(5,2));
insert into t1 values(22,621,0721,0621,1221,0621.221,0621.01,0621.02);
insert into t1 values(23,622,0722,0622,1222,0622.221,0622.01,0622.02);
insert into t1 values(24,null,null,null,null,null,null,null);
select * from t1 ORDER by c1 asc;
c1	c2	c3	c4	c5	c6	c7	c8
22	621	721	621	1221	621.221	621.01	621.02
23	622	722	622	1222	622.221	622.01	622.02
24	NULL	NULL	NULL	NULL	NULL	NULL	NULL
select * from t1 ORDER by dayofyear(c1) asc;
c1	c2	c3	c4	c5	c6	c7	c8
22	621	721	621	1221	621.221	621.01	621.02
23	622	722	622	1222	622.221	622.01	622.02
24	NULL	NULL	NULL	NULL	NULL	NULL	NULL
Warnings:
Warning	5086	Not timestamp Can not cast varchar value to timestamp type
Warning	5086	Not timestamp Can not cast varchar value to timestamp type
Warning	5086	Not timestamp Can not cast varchar value to timestamp type
select dayofyear(c2+1) from t1;
dayofyear(c2+1)
174
175
NULL
select dayofyear(c2-1) from t1;
dayofyear(c2-1)
172
173
NULL
select dayofyear(c2*1) from t1;
dayofyear(c2*1)
173
174
NULL
select dayofyear(c2/1) from t1;
dayofyear(c2/1)
173
174
NULL
select c1,dayofyear(c1) from t1;
c1	dayofyear(c1)
22	NULL
23	NULL
24	NULL
Warnings:
Warning	5086	Not timestamp Can not cast varchar value to timestamp type
Warning	5086	Not timestamp Can not cast varchar value to timestamp type
Warning	5086	Not timestamp Can not cast varchar value to timestamp type
select c2,dayofyear(c2) from t1;
c2	dayofyear(c2)
621	173
622	174
NULL	NULL
select c3,dayofyear(c3) from t1;
c3	dayofyear(c3)
721	203
722	204
NULL	NULL
select c4,dayofyear(c4) from t1;
c4	dayofyear(c4)
621	173
622	174
NULL	NULL
select c5,dayofyear(c5) from t1;
c5	dayofyear(c5)
1221	356
1222	357
NULL	NULL
select c6,dayofyear(c6) from t1;
c6	dayofyear(c6)
621.221	173
622.221	174
NULL	NULL
select c7,dayofyear(c7) from t1;
c7	dayofyear(c7)
621.01	173
622.01	174
NULL	NULL
select c8,dayofyear(c8) from t1;
c8	dayofyear(c8)
621.02	173
622.02	174
NULL	NULL
SELECT * FROM t1 WHERE dayofyear(c2) ORDER by c1 asc;
c1	c2	c3	c4	c5	c6	c7	c8
22	621	721	621	1221	621.221	621.01	621.02
23	622	722	622	1222	622.221	622.01	622.02
drop table t1;
##CHAR,VARCHAR,TINYBLOB,TINYTEXT,BLOB,TEXT,MEDIUMBLOB,MEDIUMTEXT,LONGBLOB,LONGTEXT
create table t1(c1 CHAR(20),c2 VARCHAR(50),c3 TINYBLOB,c4 TINYTEXT,c5 BLOB,c6 TEXT,c7 MEDIUMBLOB,c8 MEDIUMTEXT,c9 LONGBLOB,c10 LONGTEXT);
insert into t1 values('5好好2','','疯为来','#啊啊#','大懂','18','2019-01-12','21:00:00','2018-11-13 17:16:25','2015-07-05 20:18:18');
insert into t1 values('上的','','撒法发','￥@#','发送方','59','2019-05-23','11:29:29','2012-12-19 01:59:03','2008-05-13 10:25:19');
insert into t1 values('房贷首付','','阿斯蒂芬','#@#@','咳咳咳','','2020-01-07','13:59:12','2020-01-07 13:59:59','2020-09-23 11:22:33');
insert into t1 values('ADK','','反馈卡','','覆盖掉开发','','1995-01-07','23:59:59','1995-12-07 18:59:59','1998-09-23 11:22:33');
insert into t1 values('大苏','','sss','99mmhn','222手动','so','2010-05-09','07:59:19','2011-11-01 23:59:59','2015-07-21 10:11:23');
select c1,dayofyear(c1) from t1;
c1	dayofyear(c1)
5好好2	NULL
上的	NULL
房贷首付	NULL
ADK	NULL
大苏	NULL
Warnings:
Warning	5086	Not timestamp Can not cast varchar value to timestamp type
Warning	5086	Not timestamp Can not cast varchar value to timestamp type
Warning	5086	Not timestamp Can not cast varchar value to timestamp type
Warning	5086	Not timestamp Can not cast varchar value to timestamp type
Warning	5086	Not timestamp Can not cast varchar value to timestamp type
select c2,dayofyear(c2) from t1;
c2	dayofyear(c2)
	NULL
	NULL
	NULL
	NULL
	NULL
Warnings:
Warning	5086	Not timestamp Can not cast varchar value to timestamp type
Warning	5086	Not timestamp Can not cast varchar value to timestamp type
Warning	5086	Not timestamp Can not cast varchar value to timestamp type
Warning	5086	Not timestamp Can not cast varchar value to timestamp type
Warning	5086	Not timestamp Can not cast varchar value to timestamp type
select c3,dayofyear(c3) from t1;
c3	dayofyear(c3)
疯为来	NULL
撒法发	NULL
阿斯蒂芬	NULL
反馈卡	NULL
sss	NULL
Warnings:
Warning	5086	Not timestamp Can not cast varchar value to timestamp type
Warning	5086	Not timestamp Can not cast varchar value to timestamp type
Warning	5086	Not timestamp Can not cast varchar value to timestamp type
Warning	5086	Not timestamp Can not cast varchar value to timestamp type
Warning	5086	Not timestamp Can not cast varchar value to timestamp type
select c4,dayofyear(c4) from t1;
c4	dayofyear(c4)
#啊啊#	NULL
￥@#	NULL
#@#@	NULL
	NULL
99mmhn	NULL
Warnings:
Warning	5086	Not timestamp Can not cast varchar value to timestamp type
Warning	5086	Not timestamp Can not cast varchar value to timestamp type
Warning	5086	Not timestamp Can not cast varchar value to timestamp type
Warning	5086	Not timestamp Can not cast varchar value to timestamp type
Warning	5086	Not timestamp Can not cast varchar value to timestamp type
select c5,dayofyear(c5) from t1;
c5	dayofyear(c5)
大懂	NULL
发送方	NULL
咳咳咳	NULL
覆盖掉开发	NULL
222手动	NULL
Warnings:
Warning	5086	Not timestamp Can not cast varchar value to timestamp type
Warning	5086	Not timestamp Can not cast varchar value to timestamp type
Warning	5086	Not timestamp Can not cast varchar value to timestamp type
Warning	5086	Not timestamp Can not cast varchar value to timestamp type
Warning	5086	Not timestamp Can not cast varchar value to timestamp type
select c6,dayofyear(c6) from t1;
c6	dayofyear(c6)
18	NULL
59	NULL
	NULL
	NULL
so	NULL
Warnings:
Warning	5086	Not timestamp Can not cast varchar value to timestamp type
Warning	5086	Not timestamp Can not cast varchar value to timestamp type
Warning	5086	Not timestamp Can not cast varchar value to timestamp type
Warning	5086	Not timestamp Can not cast varchar value to timestamp type
Warning	5086	Not timestamp Can not cast varchar value to timestamp type
select c7,dayofyear(c7) from t1;
c7	dayofyear(c7)
2019-01-12	12
2019-05-23	143
2020-01-07	7
1995-01-07	7
2010-05-09	129
select c8,dayofyear(c8) from t1;
c8	dayofyear(c8)
21:00:00	NULL
11:29:29	NULL
13:59:12	NULL
23:59:59	NULL
07:59:19	NULL
Warnings:
Warning	5086	Not timestamp Can not cast varchar value to timestamp type
Warning	5086	Not timestamp Can not cast varchar value to timestamp type
Warning	5086	Not timestamp Can not cast varchar value to timestamp type
Warning	5086	Not timestamp Can not cast varchar value to timestamp type
Warning	5086	Not timestamp Can not cast varchar value to timestamp type
select c9,dayofyear(c9) from t1;
c9	dayofyear(c9)
2018-11-13 17:16:25	317
2012-12-19 01:59:03	354
2020-01-07 13:59:59	7
1995-12-07 18:59:59	341
2011-11-01 23:59:59	305
select c10,dayofyear(c10) from t1;
c10	dayofyear(c10)
2015-07-05 20:18:18	186
2008-05-13 10:25:19	134
2020-09-23 11:22:33	267
1998-09-23 11:22:33	266
2015-07-21 10:11:23	202
drop table t1;
## TIME,date,DATETIME,TIMESTAMP,YEAR
CREATE TABLE t1(c1 TIME ,
c2 date ,
c3 DATETIME ,
c4 TIMESTAMP DEFAULT '2000-01-01 00:00:00',
c5 YEAR ) ;
INSERT INTO t1 VALUES('20:12:12','2000-12-12','2000-01-01 01:01:01','2001-01-01 23:59:59.9999999','2000'),
('21:12:13','2001-12-22','2001-01-02 13:01:01','2001-11-02 00:00:01.999999','2001'),
('22:12:14','2002-12-02','2002-01-03 14:01:01','2002-12-03 02:01:01.299999','2002'),
('23:12:15','2003-12-11','2003-01-04 15:01:01','2002-11-04 03:01:01.399999','2003'),
('20:22:16','2004-12-12','2004-01-05 16:01:01','2002-02-05 05:01:01.499999','2004'),
('20:32:17','2021-12-13','2010-01-06 21:01:01','2003-03-06 04:01:01.599999','2005'),
('20:12:18','2005-12-12','2000-01-07 01:01:01','2001-01-07 12:01:01.699999','2006'),
('11:12:19','2006-12-22','2011-01-08 13:01:01','2001-11-08 11:01:01.799999','2007'),
('02:12:20','2007-12-02','2012-01-09 14:01:01','2002-12-09 02:01:01.899999','2008'),
('03:12:21','2008-12-11','2013-01-10 15:01:01','2002-11-10 03:01:01.999999','2009'),
('00:22:22','2009-12-12','2010-01-11 16:01:01','2002-02-11 05:01:01.000001','2010'),
('00:32:23','2001-12-13','2010-01-12 21:01:01','2003-03-31 04:59:59.000000','2011');
select c2,dayofyear(c2) from t1;
c2	dayofyear(c2)
2000-12-12	347
2001-12-22	356
2002-12-02	336
2003-12-11	345
2004-12-12	347
2021-12-13	347
2005-12-12	346
2006-12-22	356
2007-12-02	336
2008-12-11	346
2009-12-12	346
2001-12-13	347
select c3,dayofyear(c3) from t1;
c3	dayofyear(c3)
2000-01-01 01:01:01	1
2001-01-02 13:01:01	2
2002-01-03 14:01:01	3
2003-01-04 15:01:01	4
2004-01-05 16:01:01	5
2010-01-06 21:01:01	6
2000-01-07 01:01:01	7
2011-01-08 13:01:01	8
2012-01-09 14:01:01	9
2013-01-10 15:01:01	10
2010-01-11 16:01:01	11
2010-01-12 21:01:01	12
select c4,dayofyear(c4) from t1;
c4	dayofyear(c4)
2001-01-02 00:00:00	2
2001-11-02 00:00:02	306
2002-12-03 02:01:01	337
2002-11-04 03:01:01	308
2002-02-05 05:01:01	36
2003-03-06 04:01:02	65
2001-01-07 12:01:02	7
2001-11-08 11:01:02	312
2002-12-09 02:01:02	343
2002-11-10 03:01:02	314
2002-02-11 05:01:01	42
2003-03-31 04:59:59	90
select c5,dayofyear(c5) from t1;
c5	dayofyear(c5)
2000	NULL
2001	NULL
2002	NULL
2003	NULL
2004	NULL
2005	NULL
2006	NULL
2007	NULL
2008	NULL
2009	NULL
2010	NULL
2011	NULL
Warnings:
Warning	5086	Not timestamp Can not cast varchar value to timestamp type
Warning	5086	Not timestamp Can not cast varchar value to timestamp type
Warning	5086	Not timestamp Can not cast varchar value to timestamp type
Warning	5086	Not timestamp Can not cast varchar value to timestamp type
Warning	5086	Not timestamp Can not cast varchar value to timestamp type
Warning	5086	Not timestamp Can not cast varchar value to timestamp type
Warning	5086	Not timestamp Can not cast varchar value to timestamp type
Warning	5086	Not timestamp Can not cast varchar value to timestamp type
Warning	5086	Not timestamp Can not cast varchar value to timestamp type
Warning	5086	Not timestamp Can not cast varchar value to timestamp type
Warning	5086	Not timestamp Can not cast varchar value to timestamp type
Warning	5086	Not timestamp Can not cast varchar value to timestamp type
drop table t1;
##运算符验证
##算数运算符
select +dayofyear('2022-09-15');
+dayofyear('2022-09-15')
258
select -dayofyear('2022-09-15');
-dayofyear('2022-09-15')
-258
select dayofyear('2022-09-15')+1;
dayofyear('2022-09-15')+1
259
select dayofyear('2022-09-15')-0;
dayofyear('2022-09-15')-0
258
select dayofyear('2022-09-15')+9999999999999999999;
dayofyear('2022-09-15')+9999999999999999999
10000000000000000257
select dayofyear('2022-09-15')-9999999999999999999;
ERROR 22003: BIGINT UNSIGNED value is out of range in ''(258 - 9999999999999999999)''
select dayofyear('2022-09-15')-20210618;
dayofyear('2022-09-15')-20210618
-20210360
select dayofyear('2022-09-15')-'a';
dayofyear('2022-09-15')-'a'
258
Warnings:
Warning	1292	Truncated incorrect DOUBLE value: 'a'
select dayofyear('2022-09-15')+'bb';
dayofyear('2022-09-15')+'bb'
258
Warnings:
Warning	1292	Truncated incorrect DOUBLE value: 'bb'
select dayofyear('2022-09-15');
dayofyear('2022-09-15')
258
select dayofyear('2022-09-15')+'2020-06-17';
dayofyear('2022-09-15')+'2020-06-17'
2278
Warnings:
Warning	1292	Truncated incorrect DOUBLE value: '2020-06-17'
select dayofyear('2022-09-15')+dayofyear('2022-09-15');
dayofyear('2022-09-15')+dayofyear('2022-09-15')
516
select dayofyear('2022-09-15')+dayofyear('2022-09-15');
dayofyear('2022-09-15')+dayofyear('2022-09-15')
516
select dayofyear('2022-09-15')-'2020-06-17';
dayofyear('2022-09-15')-'2020-06-17'
-1762
Warnings:
Warning	1292	Truncated incorrect DOUBLE value: '2020-06-17'
select 1+dayofyear('2022-09-15');
1+dayofyear('2022-09-15')
259
select 1-dayofyear('2022-09-15');
1-dayofyear('2022-09-15')
-257
select 20200913-dayofyear('2022-09-15');
20200913-dayofyear('2022-09-15')
20200655
select 20200913*dayofyear('2022-09-15');
20200913*dayofyear('2022-09-15')
5211835554
select 20200913/dayofyear('2022-09-15');
20200913/dayofyear('2022-09-15')
78298.1124
select 20200913%dayofyear('2022-09-15');
20200913%dayofyear('2022-09-15')
29
select 20200913 div dayofyear('2022-09-15');
20200913 div dayofyear('2022-09-15')
78298
select 20200913 mod dayofyear('2022-09-15');
20200913 mod dayofyear('2022-09-15')
29
select dayofyear('2022-09-15')*0;
dayofyear('2022-09-15')*0
0
select dayofyear('2022-09-15')*10;
dayofyear('2022-09-15')*10
2580
select dayofyear('2022-09-15')*'a';
dayofyear('2022-09-15')*'a'
0
Warnings:
Warning	1292	Truncated incorrect DOUBLE value: 'a'
select dayofyear('2022-09-15')*'2020-06-17';
dayofyear('2022-09-15')*'2020-06-17'
521160
Warnings:
Warning	1292	Truncated incorrect DOUBLE value: '2020-06-17'
select (dayofyear('2022-09-15')+9)*1000;
(dayofyear('2022-09-15')+9)*1000
267000
select (dayofyear('2022-09-15')+9)*-1000.632;
(dayofyear('2022-09-15')+9)*-1000.632
-267168.744
select dayofyear('2022-09-15')/0;
dayofyear('2022-09-15')/0
NULL
select dayofyear('2022-09-15')/10;
dayofyear('2022-09-15')/10
25.8000
select dayofyear('2022-09-15')/'a';
dayofyear('2022-09-15')/'a'
NULL
Warnings:
Warning	1292	Truncated incorrect DOUBLE value: 'a'
select dayofyear('2022-09-15')/'2020-06-17';
dayofyear('2022-09-15')/'2020-06-17'
0.12772277227722773
Warnings:
Warning	1292	Truncated incorrect DOUBLE value: '2020-06-17'
select (dayofyear('2022-09-15')+1)/CURRENT_DATE();
(dayofyear('2022-09-15')+1)/CURRENT_DATE()
0.0000
select (dayofyear('2022-09-15')+1)/50.55;
(dayofyear('2022-09-15')+1)/50.55
5.1236
select (dayofyear('2022-09-15')+1)/-50.55;
(dayofyear('2022-09-15')+1)/-50.55
-5.1236
select dayofyear('2022-09-15')%0;
dayofyear('2022-09-15')%0
NULL
select dayofyear('2022-09-15')%10;
dayofyear('2022-09-15')%10
8
select dayofyear('2022-09-15')%'a';
dayofyear('2022-09-15')%'a'
NULL
Warnings:
Warning	1292	Truncated incorrect DOUBLE value: 'a'
select dayofyear('2022-09-15')%'2020-06-17';
dayofyear('2022-09-15')%'2020-06-17'
258
Warnings:
Warning	1292	Truncated incorrect DOUBLE value: '2020-06-17'
select (dayofyear('2022-09-15')+0)%0;
(dayofyear('2022-09-15')+0)%0
NULL
select (dayofyear('2022-09-15')+0)%2;
(dayofyear('2022-09-15')+0)%2
0
select (dayofyear('2022-09-15')+0)%3.2;
(dayofyear('2022-09-15')+0)%3.2
2.0
select dayofyear('2022-09-15')DIV0;
DIV0
258
select dayofyear('2022-09-15')DIV10;
DIV10
258
select dayofyear('2022-09-15')DIV'a';
dayofyear('2022-09-15')DIV'a'
NULL
Warnings:
Warning	1292	Truncated incorrect DECIMAL value: 'a'
select dayofyear('2022-09-15')DIV'2020-06-17';
dayofyear('2022-09-15')DIV'2020-06-17'
0
Warnings:
Warning	1292	Truncated incorrect DECIMAL value: '2020-06-17'
select (dayofyear('2022-09-15')+0) DIV -8;
(dayofyear('2022-09-15')+0) DIV -8
-32
select dayofyear('2022-09-15') MOD 0;
dayofyear('2022-09-15') MOD 0
NULL
select dayofyear('2022-09-15') MOD 10;
dayofyear('2022-09-15') MOD 10
8
select dayofyear('2022-09-15') MOD 'a';
dayofyear('2022-09-15') MOD 'a'
NULL
Warnings:
Warning	1292	Truncated incorrect DOUBLE value: 'a'
select dayofyear('2022-09-15') MOD '2020-06-17';
dayofyear('2022-09-15') MOD '2020-06-17'
258
Warnings:
Warning	1292	Truncated incorrect DOUBLE value: '2020-06-17'
select dayofyear('2022-09-15') || dayofyear('2022-09-15')+0;
dayofyear('2022-09-15') || dayofyear('2022-09-15')+0
258258
select dayofyear('2022-09-15')+0+1000;
dayofyear('2022-09-15')+0+1000
1258
select dayofyear('2022-09-15')-1-1000;
dayofyear('2022-09-15')-1-1000
-743
select (dayofyear('2022-09-15')-1)*1000;
(dayofyear('2022-09-15')-1)*1000
257000
select (dayofyear('2022-09-15')-1)/1000;
(dayofyear('2022-09-15')-1)/1000
0.2570
select (dayofyear('2022-09-15')-1)%1000;
(dayofyear('2022-09-15')-1)%1000
257
select (dayofyear('2022-09-15')-1) DIV 1000;
(dayofyear('2022-09-15')-1) DIV 1000
0
select (dayofyear('2022-09-15')-1) MOD 1000;
(dayofyear('2022-09-15')-1) MOD 1000
257
select dayofyear('2022-09-15')|| dayofyear('2022-09-15');
dayofyear('2022-09-15')|| dayofyear('2022-09-15')
258258
select dayofyear('2022-09-15')|| 'a';
dayofyear('2022-09-15')|| 'a'
258a
select dayofyear('2022-09-15')|| 1000;
dayofyear('2022-09-15')|| 1000
2581000
select dayofyear('2022-09-15')|| '2020-06-17';
dayofyear('2022-09-15')|| '2020-06-17'
2582020-06-17
select dayofyear('2022-09-15')+1|| 'b';
dayofyear('2022-09-15')+1|| 'b'
259
Warnings:
Warning	1292	Truncated incorrect DOUBLE value: '1b'
select dayofyear('2022-09-15')+1|| DATE_FORMAT(dayofyear('2022-09-15'),GET_FORMAT(DATETIME,'EUR'));
dayofyear('2022-09-15')+1|| DATE_FORMAT(dayofyear('2022-09-15'),GET_FORMAT(DATETIME,'EUR'))
NULL
select dayofyear('2022-09-15')+1|| dayofyear('2022-09-15')+1;
dayofyear('2022-09-15')+1|| dayofyear('2022-09-15')+1
1517
select dayofyear('2022-09-15')+1|| dayofyear('2022-09-15')+1;
dayofyear('2022-09-15')+1|| dayofyear('2022-09-15')+1
1517
select dayofyear('2022-09-15')+1+ dayofyear('2022-09-15')+1;
dayofyear('2022-09-15')+1+ dayofyear('2022-09-15')+1
518
select dayofyear('2022-09-15')+1- dayofyear('2022-09-15')+1;
dayofyear('2022-09-15')+1- dayofyear('2022-09-15')+1
2
select (dayofyear('2022-09-15')+1)*(dayofyear('2022-09-15')+1);
(dayofyear('2022-09-15')+1)*(dayofyear('2022-09-15')+1)
67081
select (dayofyear('2022-09-15')+1)/(dayofyear('2022-09-15')+1);
(dayofyear('2022-09-15')+1)/(dayofyear('2022-09-15')+1)
1.0000
select (dayofyear('2022-09-15')+1)%(dayofyear('2022-09-15')+1);
(dayofyear('2022-09-15')+1)%(dayofyear('2022-09-15')+1)
0
select (dayofyear('2022-09-15')+1) MOD (dayofyear('2022-09-15')+1);
(dayofyear('2022-09-15')+1) MOD (dayofyear('2022-09-15')+1)
0
select (dayofyear('2022-09-15')+1) div (dayofyear('2022-09-15')+1);
(dayofyear('2022-09-15')+1) div (dayofyear('2022-09-15')+1)
1
select dayofyear('2022-09-15')+ dayofyear('2022-09-15');
dayofyear('2022-09-15')+ dayofyear('2022-09-15')
516
select dayofyear('2022-09-15')- dayofyear('2022-09-15');
dayofyear('2022-09-15')- dayofyear('2022-09-15')
0
select dayofyear('2022-09-15')*dayofyear('2022-09-15');
dayofyear('2022-09-15')*dayofyear('2022-09-15')
66564
select dayofyear('2022-09-15')/dayofyear('2022-09-15');
dayofyear('2022-09-15')/dayofyear('2022-09-15')
1.0000
select dayofyear('2022-09-15')%dayofyear('2022-09-15');
dayofyear('2022-09-15')%dayofyear('2022-09-15')
0
select dayofyear('2022-09-15') MOD dayofyear('2022-09-15');
dayofyear('2022-09-15') MOD dayofyear('2022-09-15')
0
select dayofyear('2022-09-15') div dayofyear('2022-09-15');
dayofyear('2022-09-15') div dayofyear('2022-09-15')
1
select dayofyear('2022-09-15')+dayofyear('2022-09-15');
dayofyear('2022-09-15')+dayofyear('2022-09-15')
516
select dayofyear('2022-09-15')+GET_FORMAT(DATETIME,'EUR');
dayofyear('2022-09-15')+GET_FORMAT(DATETIME,'EUR')
258
Warnings:
Warning	1292	Truncated incorrect DOUBLE value: '%Y-%m-%d %H.%i.%s'
select dayofyear('2022-09-15')-GET_FORMAT(DATETIME,'EUR');
dayofyear('2022-09-15')-GET_FORMAT(DATETIME,'EUR')
258
Warnings:
Warning	1292	Truncated incorrect DOUBLE value: '%Y-%m-%d %H.%i.%s'
select dayofyear('2022-09-15')=dayofyear('2022-09-15');
dayofyear('2022-09-15')=dayofyear('2022-09-15')
1
select dayofyear('2022-09-15')=dayofyear('2022-09-15')+1;
dayofyear('2022-09-15')=dayofyear('2022-09-15')+1
0
select dayofyear('2022-09-15')+1=dayofyear('2022-09-15')+1;
dayofyear('2022-09-15')+1=dayofyear('2022-09-15')+1
1
select dayofyear('2022-09-15')<>dayofyear('2022-09-15');
dayofyear('2022-09-15')<>dayofyear('2022-09-15')
0
select dayofyear('2022-09-15')<>dayofyear('2022-09-15')+1;
dayofyear('2022-09-15')<>dayofyear('2022-09-15')+1
1
select dayofyear('2022-09-15')+1<>dayofyear('2022-09-15')+1;
dayofyear('2022-09-15')+1<>dayofyear('2022-09-15')+1
0
select dayofyear('2022-09-15')<=>dayofyear('2022-09-15');
dayofyear('2022-09-15')<=>dayofyear('2022-09-15')
1
select dayofyear('2022-09-15')<=>dayofyear('2022-09-15')+1;
dayofyear('2022-09-15')<=>dayofyear('2022-09-15')+1
0
select dayofyear('2022-09-15')+1<=>dayofyear('2022-09-15')+1;
dayofyear('2022-09-15')+1<=>dayofyear('2022-09-15')+1
1
select dayofyear('2022-09-15')<dayofyear('2022-09-15');
dayofyear('2022-09-15')<dayofyear('2022-09-15')
0
select dayofyear('2022-09-15')<dayofyear('2022-09-15')+1;
dayofyear('2022-09-15')<dayofyear('2022-09-15')+1
1
select dayofyear('2022-09-15')+1<dayofyear('2022-09-15')+1;
dayofyear('2022-09-15')+1<dayofyear('2022-09-15')+1
0
select dayofyear('2022-09-15')<=dayofyear('2022-09-15');
dayofyear('2022-09-15')<=dayofyear('2022-09-15')
1
select dayofyear('2022-09-15')<=dayofyear('2022-09-15')+1;
dayofyear('2022-09-15')<=dayofyear('2022-09-15')+1
1
select dayofyear('2022-09-15')+1<=dayofyear('2022-09-15')+1;
dayofyear('2022-09-15')+1<=dayofyear('2022-09-15')+1
1
select dayofyear('2022-09-15')>=dayofyear('2022-09-15');
dayofyear('2022-09-15')>=dayofyear('2022-09-15')
1
select dayofyear('2022-09-15')>=dayofyear('2022-09-15')+1;
dayofyear('2022-09-15')>=dayofyear('2022-09-15')+1
0
select dayofyear('2022-09-15')+1>=dayofyear('2022-09-15')+1;
dayofyear('2022-09-15')+1>=dayofyear('2022-09-15')+1
1
select dayofyear('2022-09-15')>dayofyear('2022-09-15');
dayofyear('2022-09-15')>dayofyear('2022-09-15')
0
select dayofyear('2022-09-15')>dayofyear('2022-09-15')+1;
dayofyear('2022-09-15')>dayofyear('2022-09-15')+1
0
select dayofyear('2022-09-15')+1>dayofyear('2022-09-15')+1;
dayofyear('2022-09-15')+1>dayofyear('2022-09-15')+1
0
select dayofyear('2022-09-15') between dayofyear('2022-09-15')-1 and dayofyear('2022-09-15')+9;
dayofyear('2022-09-15') between dayofyear('2022-09-15')-1 and dayofyear('2022-09-15')+9
1
select dayofyear('2022-09-15') between dayofyear('2022-09-15')+1 and dayofyear('2022-09-15')+9;
dayofyear('2022-09-15') between dayofyear('2022-09-15')+1 and dayofyear('2022-09-15')+9
0
select dayofyear('2022-09-15')-1 between dayofyear('2022-09-15') and dayofyear('2022-09-15')+9;
dayofyear('2022-09-15')-1 between dayofyear('2022-09-15') and dayofyear('2022-09-15')+9
0
select dayofyear('2022-09-15')+7 between dayofyear('2022-09-15')+1 and dayofyear('2022-09-15')+9;
dayofyear('2022-09-15')+7 between dayofyear('2022-09-15')+1 and dayofyear('2022-09-15')+9
1
select dayofyear('2022-09-15')-20200912 in (1,2,3,4,5);
dayofyear('2022-09-15')-20200912 in (1,2,3,4,5)
0
select dayofyear('2022-09-15') in (1,2,3,4,5);
dayofyear('2022-09-15') in (1,2,3,4,5)
0
select dayofyear('2022-09-15') in (dayofyear('2022-09-15'),dayofyear('2022-09-15')+1,dayofyear('2022-09-15')+2);
dayofyear('2022-09-15') in (dayofyear('2022-09-15'),dayofyear('2022-09-15')+1,dayofyear('2022-09-15')+2)
1
select dayofyear('2022-09-15')-1 in (dayofyear('2022-09-15'),dayofyear('2022-09-15')+1,dayofyear('2022-09-15')+2);
dayofyear('2022-09-15')-1 in (dayofyear('2022-09-15'),dayofyear('2022-09-15')+1,dayofyear('2022-09-15')+2)
0
select dayofyear('2022-09-15') in (dayofyear('2022-09-15')+1,dayofyear('2022-09-15')+2);
dayofyear('2022-09-15') in (dayofyear('2022-09-15')+1,dayofyear('2022-09-15')+2)
0
select dayofyear('2022-09-15')-1 in (dayofyear('2022-09-15')-5,dayofyear('2022-09-15')+1,dayofyear('2022-09-15')+2);
dayofyear('2022-09-15')-1 in (dayofyear('2022-09-15')-5,dayofyear('2022-09-15')+1,dayofyear('2022-09-15')+2)
0
select dayofyear('2022-09-15')-1 in (dayofyear('2022-09-15')-5,dayofyear('2022-09-15')-1,dayofyear('2022-09-15')+2);
dayofyear('2022-09-15')-1 in (dayofyear('2022-09-15')-5,dayofyear('2022-09-15')-1,dayofyear('2022-09-15')+2)
1
select dayofyear('2022-09-15') not in (dayofyear('2022-09-15'),dayofyear('2022-09-15')+1,dayofyear('2022-09-15')+2);
dayofyear('2022-09-15') not in (dayofyear('2022-09-15'),dayofyear('2022-09-15')+1,dayofyear('2022-09-15')+2)
0
select dayofyear('2022-09-15')-1 not in (dayofyear('2022-09-15'),dayofyear('2022-09-15')+1,dayofyear('2022-09-15')+2);
dayofyear('2022-09-15')-1 not in (dayofyear('2022-09-15'),dayofyear('2022-09-15')+1,dayofyear('2022-09-15')+2)
1
select dayofyear('2022-09-15') not in (dayofyear('2022-09-15')+1,dayofyear('2022-09-15')+2);
dayofyear('2022-09-15') not in (dayofyear('2022-09-15')+1,dayofyear('2022-09-15')+2)
1
select dayofyear('2022-09-15')-1 not in (dayofyear('2022-09-15')-5,dayofyear('2022-09-15')+1,dayofyear('2022-09-15')+2);
dayofyear('2022-09-15')-1 not in (dayofyear('2022-09-15')-5,dayofyear('2022-09-15')+1,dayofyear('2022-09-15')+2)
1
select dayofyear('2022-09-15')-1  not in (dayofyear('2022-09-15')-5,dayofyear('2022-09-15')-1,dayofyear('2022-09-15')+2);
dayofyear('2022-09-15')-1  not in (dayofyear('2022-09-15')-5,dayofyear('2022-09-15')-1,dayofyear('2022-09-15')+2)
0
select dayofyear('2022-09-15') is NULL;
dayofyear('2022-09-15') is NULL
0
select dayofyear('2022-09-15')+0 is NULL;
dayofyear('2022-09-15')+0 is NULL
0
select dayofyear('2022-09-15')  like '20%';
dayofyear('2022-09-15')  like '20%'
0
select dayofyear('2022-09-15')+0  like dayofyear('2022-09-15');
dayofyear('2022-09-15')+0  like dayofyear('2022-09-15')
1
select dayofyear('2022-09-15')  like dayofyear('2022-09-15');
dayofyear('2022-09-15')  like dayofyear('2022-09-15')
1
select dayofyear('2022-09-15')+0 not like '20%';
dayofyear('2022-09-15')+0 not like '20%'
1
select dayofyear('2022-09-15')+0 not  like dayofyear('2022-09-15');
dayofyear('2022-09-15')+0 not  like dayofyear('2022-09-15')
0
select dayofyear('2022-09-15') REGEXP dayofyear('2022-09-15');
dayofyear('2022-09-15') REGEXP dayofyear('2022-09-15')
1
select dayofyear('2022-09-15') REGEXP dayofyear('2022-09-15')+0;
dayofyear('2022-09-15') REGEXP dayofyear('2022-09-15')+0
1
select dayofyear('2022-09-15')+0 REGEXP dayofyear('2022-09-15');
dayofyear('2022-09-15')+0 REGEXP dayofyear('2022-09-15')
1
select dayofyear('2022-09-15')+0 REGEXP dayofyear('2022-09-15')+0;
dayofyear('2022-09-15')+0 REGEXP dayofyear('2022-09-15')+0
1
select dayofyear('2022-09-15')&dayofyear('2022-09-15');
dayofyear('2022-09-15')&dayofyear('2022-09-15')
258
select dayofyear('2022-09-15')+0&dayofyear('2022-09-15');
dayofyear('2022-09-15')+0&dayofyear('2022-09-15')
258
select dayofyear('2022-09-15')+0&dayofyear('2022-09-15')+0;
dayofyear('2022-09-15')+0&dayofyear('2022-09-15')+0
258
select dayofyear('2022-09-15')|dayofyear('2022-09-15');
dayofyear('2022-09-15')|dayofyear('2022-09-15')
258
select dayofyear('2022-09-15')|dayofyear('2022-09-15')+1;
dayofyear('2022-09-15')|dayofyear('2022-09-15')+1
259
select dayofyear('2022-09-15')+0|dayofyear('2022-09-15')+0;
dayofyear('2022-09-15')+0|dayofyear('2022-09-15')+0
258
select dayofyear('2022-09-15')^dayofyear('2022-09-15');
dayofyear('2022-09-15')^dayofyear('2022-09-15')
0
select dayofyear('2022-09-15')^dayofyear('2022-09-15')+1;
dayofyear('2022-09-15')^dayofyear('2022-09-15')+1
1
select dayofyear('2022-09-15')+0^dayofyear('2022-09-15')+0;
dayofyear('2022-09-15')+0^dayofyear('2022-09-15')+0
516
select dayofyear('2022-09-15')>>dayofyear('2022-09-15');
dayofyear('2022-09-15')>>dayofyear('2022-09-15')
0
select dayofyear('2022-09-15')>>dayofyear('2022-09-15')+1;
dayofyear('2022-09-15')>>dayofyear('2022-09-15')+1
0
select dayofyear('2022-09-15')+0>>dayofyear('2022-09-15')+0;
dayofyear('2022-09-15')+0>>dayofyear('2022-09-15')+0
0
select dayofyear('2022-09-15')<<dayofyear('2022-09-15');
dayofyear('2022-09-15')<<dayofyear('2022-09-15')
0
select dayofyear('2022-09-15')<<dayofyear('2022-09-15')+1;
dayofyear('2022-09-15')<<dayofyear('2022-09-15')+1
0
select dayofyear('2022-09-15')+0<<dayofyear('2022-09-15')+0;
dayofyear('2022-09-15')+0<<dayofyear('2022-09-15')+0
0
select ~dayofyear('2022-09-15');
~dayofyear('2022-09-15')
18446744073709551357
select ~dayofyear('2022-09-15')-10;
~dayofyear('2022-09-15')-10
18446744073709551347
select dayofyear('2022-09-15') and dayofyear('2022-09-15');
dayofyear('2022-09-15') and dayofyear('2022-09-15')
1
select dayofyear('2022-09-15')+1 and dayofyear('2022-09-15')-1;
dayofyear('2022-09-15')+1 and dayofyear('2022-09-15')-1
1
select dayofyear('2022-09-15') and dayofyear('2022-09-15')-1;
dayofyear('2022-09-15') and dayofyear('2022-09-15')-1
1
select dayofyear('2022-09-15') or dayofyear('2022-09-15');
dayofyear('2022-09-15') or dayofyear('2022-09-15')
1
select dayofyear('2022-09-15') or null;
dayofyear('2022-09-15') or null
1
select dayofyear('2022-09-15')+1 or null;
dayofyear('2022-09-15')+1 or null
1
select dayofyear('2022-09-15')+1 or dayofyear('2022-09-15')-1;
dayofyear('2022-09-15')+1 or dayofyear('2022-09-15')-1
1
select dayofyear('2022-09-15') or dayofyear('2022-09-15')-1;
dayofyear('2022-09-15') or dayofyear('2022-09-15')-1
1
select not dayofyear('2022-09-15')-1;
not dayofyear('2022-09-15')-1
0
select not dayofyear('2022-09-15');
not dayofyear('2022-09-15')
0
select !dayofyear('2022-09-15')-1;
!dayofyear('2022-09-15')-1
-1
select !dayofyear('2022-09-15');
!dayofyear('2022-09-15')
0
select dayofyear('2022-09-15') xor dayofyear('2022-09-15');
dayofyear('2022-09-15') xor dayofyear('2022-09-15')
0
select dayofyear('2022-09-15')+1 xor dayofyear('2022-09-15')-1;
dayofyear('2022-09-15')+1 xor dayofyear('2022-09-15')-1
0
select dayofyear('2022-09-15') xor dayofyear('2022-09-15')-1;
dayofyear('2022-09-15') xor dayofyear('2022-09-15')-1
0
drop table t1;
##日期时间函数校验
select CURRENT_TIME(dayofyear('2022-09-07'));
ERROR 42000: You have an error in your SQL syntax; check the manual that corresponds to your OceanBase version for the right syntax to use near 'dayofyear('2022-09-07'))' at line 1
select CURRENT_TIME(dayofyear('2022-09-07')-dayofyear('2022-09-07'));
ERROR 42000: You have an error in your SQL syntax; check the manual that corresponds to your OceanBase version for the right syntax to use near 'dayofyear('2022-09-07')-dayofyear('2022-09-07'))' at line 1
select CURRENT_TIMESTAMP(dayofyear('2022-09-07')-dayofyear('2022-09-07'));
ERROR 42000: You have an error in your SQL syntax; check the manual that corresponds to your OceanBase version for the right syntax to use near 'dayofyear('2022-09-07')-dayofyear('2022-09-07'))' at line 1
select DATE_ADD(dayofyear('2022-09-07 23:59:59'),INTERVAL '1:1' MINUTE_SECOND);
DATE_ADD(dayofyear('2022-09-07 23:59:59'),INTERVAL '1:1' MINUTE_SECOND)
NULL
SELECT dayofyear(DATE_ADD('2022-09-07 23:59:59',INTERVAL '1:1' MINUTE_SECOND));
dayofyear(DATE_ADD('2022-09-07 23:59:59',INTERVAL '1:1' MINUTE_SECOND))
251
select dayofyear(date_format('2022-01-27 13:23:00', '%Y-%c-%d'))as result;
result
27
select date_format(dayofyear('2022-01-27 13:23:00'),'%Y %c %d')as result;
result
NULL
select dayofyear('2009-10-01') = DATE_FORMAT('2009-10-01 22:23:00', '%W');
dayofyear('2009-10-01') = DATE_FORMAT('2009-10-01 22:23:00', '%W')
0
Warnings:
Warning	1292	Truncated incorrect DECIMAL value: 'Thursday'
select dayofyear(date_sub(date '2022-01-22',interval '3' day));
dayofyear(date_sub(date '2022-01-22',interval '3' day))
19
select DATE_SUB(dayofyear('2022-09-07'),INTERVAL 5 DAY);
DATE_SUB(dayofyear('2022-09-07'),INTERVAL 5 DAY)
NULL
select DATEDIFF(dayofyear('2022-09-07'),dayofyear('2021-09-07'));
DATEDIFF(dayofyear('2022-09-07'),dayofyear('2021-09-07'))
NULL
select dayofyear(DATEDIFF('2000-01-22 23:59:59','1000-01-21'));
dayofyear(DATEDIFF('2000-01-22 23:59:59','1000-01-21'))
NULL
Warnings:
Warning	5086	Not timestamp Can not cast varchar value to timestamp type
select EXTRACT(week from dayofyear('2022-09-07'));
EXTRACT(week from dayofyear('2022-09-07'))
NULL
select EXTRACT(week from dayofyear('2022-09-07'));
EXTRACT(week from dayofyear('2022-09-07'))
NULL
select from_days(dayofyear('2022-09-07'));
from_days(dayofyear('2022-09-07'))
0000-00-00
select dayofyear(from_days(738565));
dayofyear(from_days(738565))
45
select FROM_UNIXTIME(dayofyear('2022-09-07'),GET_FORMAT(DATE,'USA'));
FROM_UNIXTIME(dayofyear('2022-09-07'),GET_FORMAT(DATE,'USA'))
01.01.1970
select dayofyear(FROM_UNIXTIME(1647738456));
dayofyear(FROM_UNIXTIME(1647738456))
79
select MONTH(dayofyear('2022-09-07'));
MONTH(dayofyear('2022-09-07'))
NULL
Warnings:
Warning	5086	Not timestamp Can not cast varchar value to timestamp type
select dayofyear(month('2022-09-07'));
dayofyear(month('2022-09-07'))
NULL
Warnings:
Warning	5086	Not timestamp Can not cast varchar value to timestamp type
select PERIOD_DIFF(dayofyear('2022-09-07'),dayofyear('2022-09-07'));
PERIOD_DIFF(dayofyear('2022-09-07'),dayofyear('2022-09-07'))
0
select dayofyear(str_to_date('2022-01-06 10:20:30','%Y-%m-%d %H:%i:%s')) as result;
result
6
select STR_TO_DATE(dayofyear('2022-09-07'));
ERROR 42000: Incorrect parameter count in the call to native function 'STR_TO_DATE'
select time(dayofyear('2022-09-07 23:59:59.999999'));
time(dayofyear('2022-09-07 23:59:59.999999'))
00:02:50
select TIME_TO_SEC(dayofyear('2022-09-07'));
TIME_TO_SEC(dayofyear('2022-09-07'))
170
select dayofyear(TIME_TO_SEC('2022-09-07'));
dayofyear(TIME_TO_SEC('2022-09-07'))
357
select TIMEDIFF(dayofyear('2022-09-07'),dayofyear('2022-09-07'));
TIMEDIFF(dayofyear('2022-09-07'),dayofyear('2022-09-07'))
00:00:00
SELECT dayofyear(TIMESTAMPADD(MINUTE,1,'2003-01-02'));
dayofyear(TIMESTAMPADD(MINUTE,1,'2003-01-02'))
2
SELECT TIMESTAMPADD(WEEK,1,dayofyear('2003-01-02'));
TIMESTAMPADD(WEEK,1,dayofyear('2003-01-02'))
NULL
select TIMESTAMPDIFF(day,dayofyear('2022-09-07') , dayofyear('2022-09-07'));
TIMESTAMPDIFF(day,dayofyear('2022-09-07') , dayofyear('2022-09-07'))
NULL
select dayofyear(TIMESTAMPDIFF(MONTH,'2003-02-01','2003-05-01'));
dayofyear(TIMESTAMPDIFF(MONTH,'2003-02-01','2003-05-01'))
NULL
Warnings:
Warning	5086	Not timestamp Can not cast varchar value to timestamp type
select TO_DAYS(dayofyear('2003-02-01'));
TO_DAYS(dayofyear('2003-02-01'))
NULL
select dayofyear(TO_DAYS('2003-02-01'));
dayofyear(TO_DAYS('2003-02-01'))
NULL
Warnings:
Warning	5086	Not timestamp Can not cast varchar value to timestamp type
select SEC_TO_TIME(dayofyear('2003-02-01'));
SEC_TO_TIME(dayofyear('2003-02-01'))
00:00:32
select UNIX_TIMESTAMP(dayofyear('2022-09-07'));
UNIX_TIMESTAMP(dayofyear('2022-09-07'))
0
select dayofyear(UNIX_TIMESTAMP('2022-09-07'));
dayofyear(UNIX_TIMESTAMP('2022-09-07'))
NULL
Warnings:
Warning	5086	Not timestamp Can not cast varchar value to timestamp type
select UTC_TIMESTAMP(dayofyear('2022-09-07'));
ERROR 42000: You have an error in your SQL syntax; check the manual that corresponds to your OceanBase version for the right syntax to use near 'dayofyear('2022-09-07'))' at line 1
select YEAR(dayofyear('2022-09-07'));
YEAR(dayofyear('2022-09-07'))
NULL
Warnings:
Warning	5086	Not timestamp Can not cast varchar value to timestamp type
select dayofyear(year('2022-09-07'));
dayofyear(year('2022-09-07'))
NULL
Warnings:
Warning	5086	Not timestamp Can not cast varchar value to timestamp type
select YEAR(dayofyear('2022-09-07')+10000);
YEAR(dayofyear('2022-09-07')+10000)
NULL
Warnings:
Warning	5086	Not timestamp Can not cast varchar value to timestamp type
##字符串函数
select CONCAT(dayofyear('2022-09-07'),dayofyear('2022-09-07'));
CONCAT(dayofyear('2022-09-07'),dayofyear('2022-09-07'))
250250
select CONCAT_WS('_',dayofyear('2022-09-07'),dayofyear('2022-09-07'));
CONCAT_WS('_',dayofyear('2022-09-07'),dayofyear('2022-09-07'))
250_250
select FORMAT(dayofyear('2022-09-08'),3);
FORMAT(dayofyear('2022-09-08'),3)
251.000
select dayofyear(FORMAT(1025.12356,2));
dayofyear(FORMAT(1025.12356,2))
NULL
Warnings:
Warning	5086	Not timestamp Can not cast varchar value to timestamp type
select SUBSTR(dayofyear('2022-09-07'),1);
SUBSTR(dayofyear('2022-09-07'),1)
250
select dayofyear(SUBSTR('20220907',1));
dayofyear(SUBSTR('20220907',1))
250
select SUBSTRING(dayofyear('2022-09-07'),1,1);
SUBSTRING(dayofyear('2022-09-07'),1,1)
2
select dayofyear(SUBSTRING('2022-09-07',1,10));
dayofyear(SUBSTRING('2022-09-07',1,10))
250
select TRIM(  dayofyear(' 2022-09-07  ')  );
TRIM(  dayofyear(' 2022-09-07  ')  )
250
select dayofyear(TRIM(' 2022-09-07 '));
dayofyear(TRIM(' 2022-09-07 '))
250
select RTRIM(dayofyear('2022-09-07'));
RTRIM(dayofyear('2022-09-07'))
250
select dayofyear(RTRIM('2022-09-07'));
dayofyear(RTRIM('2022-09-07'))
250
select ascii(dayofyear('2022-09-07'));
ascii(dayofyear('2022-09-07'))
50
select dayofyear(ascii('2022-09-07'));
dayofyear(ascii('2022-09-07'))
NULL
Warnings:
Warning	5086	Not timestamp Can not cast varchar value to timestamp type
select ORD(dayofyear('2022-09-07'));
ORD(dayofyear('2022-09-07'))
50
select dayofyear(ORD('2022-09-07'));
dayofyear(ORD('2022-09-07'))
NULL
Warnings:
Warning	5086	Not timestamp Can not cast varchar value to timestamp type
select LENGTH(dayofyear('2022-09-07'));
LENGTH(dayofyear('2022-09-07'))
3
select dayofyear(LENGTH('2022-09-07'));
dayofyear(LENGTH('2022-09-07'))
NULL
Warnings:
Warning	5086	Not timestamp Can not cast varchar value to timestamp type
select CHAR_LENGTH(dayofyear('2022-09-07'));
CHAR_LENGTH(dayofyear('2022-09-07'))
3
select dayofyear(CHAR_LENGTH('2022-09-07'));
dayofyear(CHAR_LENGTH('2022-09-07'))
NULL
Warnings:
Warning	5086	Not timestamp Can not cast varchar value to timestamp type
select UPPER(dayofyear('2022-09-07'));
UPPER(dayofyear('2022-09-07'))
250
select dayofyear(UPPER('2022-09-07'));
dayofyear(UPPER('2022-09-07'))
250
select lower(dayofyear('2022-09-07'));
lower(dayofyear('2022-09-07'))
250
select dayofyear(lower('2022-09-07'));
dayofyear(lower('2022-09-07'))
250
select HEX(dayofyear('2022-09-07'));
HEX(dayofyear('2022-09-07'))
FA
select dayofyear(HEX('2022-09-07'));
dayofyear(HEX('2022-09-07'))
NULL
Warnings:
Warning	5086	Not timestamp Can not cast varchar value to timestamp type
select UNHEX(dayofyear('2022-09-07'));
UNHEX(dayofyear('2022-09-07'))
P
select dayofyear(UNHEX('2022-09-07'));
dayofyear(UNHEX('2022-09-07'))
NULL
select MD5(dayofyear('2022-09-07'));
MD5(dayofyear('2022-09-07'))
6c9882bbac1c7093bd25041881277658
select dayofyear(MD5('2022-09-07'));
dayofyear(MD5('2022-09-07'))
NULL
Warnings:
Warning	5086	Not timestamp Can not cast varchar value to timestamp type
select INT2IP(dayofyear('2022-09-07'));
INT2IP(dayofyear('2022-09-07'))
0.0.0.250
select dayofyear(INT2IP('2022-09-07'));
dayofyear(INT2IP('2022-09-07'))
NULL
Warnings:
Warning	1292	Truncated incorrect INTEGER value: '2022-09-07'
Warning	5086	Not timestamp Can not cast varchar value to timestamp type
SELECT dayofyear('2022-09-07') LIKE 'W%';
dayofyear('2022-09-07') LIKE 'W%'
0
SELECT dayofyear('2022-09-07') REGEXP dayofyear('2022-09-08');
dayofyear('2022-09-07') REGEXP dayofyear('2022-09-08')
0
SELECT REPEAT(dayofyear('2022-09-07'), 5);
REPEAT(dayofyear('2022-09-07'), 5)
250250250250250
SELECT dayofyear(REPEAT('2022-09-07',1));
dayofyear(REPEAT('2022-09-07',1))
250
SELECT REPEAT(dayofyear('2022-09-07'), dayofyear('2022-01-02'));
REPEAT(dayofyear('2022-09-07'), dayofyear('2022-01-02'))
250250
SELECT SPACE(dayofyear('2022-09-07'),0);
ERROR 42000: Incorrect parameter count in the call to native function 'SPACE'
SELECT dayofyear(SPACE('2022-09-07'));
dayofyear(SPACE('2022-09-07'))
NULL
Warnings:
Warning	1292	Truncated incorrect INTEGER value: '2022-09-07'
Warning	5086	Not timestamp Can not cast varchar value to timestamp type
SELECT SUBSTRING_INDEX(dayofyear('2022-09-07'),' ',1);
SUBSTRING_INDEX(dayofyear('2022-09-07'),' ',1)
250
SELECT dayofyear(SUBSTRING_INDEX('2022-09-07','-',3));
dayofyear(SUBSTRING_INDEX('2022-09-07','-',3))
250
SELECT LOCATE(dayofyear('2022-09-07'),dayofyear('2022-09-07'));
LOCATE(dayofyear('2022-09-07'),dayofyear('2022-09-07'))
1
SELECT LOCATE(dayofyear('2022-09-07'),dayofyear('2022-09-08'));
LOCATE(dayofyear('2022-09-07'),dayofyear('2022-09-08'))
0
SELECT POSITION(dayofyear('2022-09-07') in dayofyear('2022-09-07'));
POSITION(dayofyear('2022-09-07') in dayofyear('2022-09-07'))
1
SELECT POSITION(dayofyear('2022-09-07') in dayofyear('2022-09-08'));
POSITION(dayofyear('2022-09-07') in dayofyear('2022-09-08'))
0
SELECT INSTR(dayofyear('2022-09-07'),dayofyear('2022-09-07'));
INSTR(dayofyear('2022-09-07'),dayofyear('2022-09-07'))
1
SELECT INSTR(dayofyear('2022-09-07'),dayofyear('2022-09-08'));
INSTR(dayofyear('2022-09-07'),dayofyear('2022-09-08'))
0
SELECT REPLACE(dayofyear('2022-09-07'),dayofyear('2022-09-07'),dayofyear('2022-09-07'));
REPLACE(dayofyear('2022-09-07'),dayofyear('2022-09-07'),dayofyear('2022-09-07'))
250
SELECT REPLACE(dayofyear('2022-09-07'),dayofyear('2022-09-07'),dayofyear('2022-09-08'));
REPLACE(dayofyear('2022-09-07'),dayofyear('2022-09-07'),dayofyear('2022-09-08'))
251
SELECT FIELD(dayofyear('2022-09-07'),dayofyear('2022-09-07'),dayofyear('2022-09-07'));
FIELD(dayofyear('2022-09-07'),dayofyear('2022-09-07'),dayofyear('2022-09-07'))
1
SELECT FIELD(dayofyear('2022-09-07'),dayofyear('2022-09-07'),dayofyear('2022-09-08'));
FIELD(dayofyear('2022-09-07'),dayofyear('2022-09-07'),dayofyear('2022-09-08'))
1
SELECT ELT(1,dayofyear('2022-09-07'),dayofyear('2022-09-07'));
ELT(1,dayofyear('2022-09-07'),dayofyear('2022-09-07'))
250
SELECT ELT(2,dayofyear('2022-09-07'),dayofyear('2022-09-08'));
ELT(2,dayofyear('2022-09-07'),dayofyear('2022-09-08'))
251
SELECT LPAD(dayofyear('2022-09-07'),dayofyear('2022-09-07'),dayofyear('2022-09-07'));
LPAD(dayofyear('2022-09-07'),dayofyear('2022-09-07'),dayofyear('2022-09-07'))
2502502502502502502502502502502502502502502502502502502502502502502502502502502502502502502502502502502502502502502502502502502502502502502502502502502502502502502502502502502502502502502502502502502502502502502502502502502502502502502502502502502250
SELECT RPAD(dayofyear('2022-09-07'),dayofyear('2022-09-07'),dayofyear('2022-09-08'));
RPAD(dayofyear('2022-09-07'),dayofyear('2022-09-07'),dayofyear('2022-09-08'))
2502512512512512512512512512512512512512512512512512512512512512512512512512512512512512512512512512512512512512512512512512512512512512512512512512512512512512512512512512512512512512512512512512512512512512512512512512512512512512512512512512512512
SELECT bin(dayofyear('2022-09-07'));
bin(dayofyear('2022-09-07'))
11111010
SELECT bin(dayofyear('2022-09-08'));
bin(dayofyear('2022-09-08'))
11111011
SELECT quote(dayofyear('2022-09-07'));
quote(dayofyear('2022-09-07'))
'250'
SELECT quote(dayofyear('2022-09-08'));
quote(dayofyear('2022-09-08'))
'251'
SELECT REGEXP_SUBSTR(dayofyear('2022-09-07'));
ERROR 42000: Incorrect parameter count in the call to native function 'REGEXP_SUBSTR'
##转换函数与数学函数
select CAST(dayofyear('2022-09-07') as date);
CAST(dayofyear('2022-09-07') as date)
NULL
select CAST(dayofyear('2022-09-07') as time);
CAST(dayofyear('2022-09-07') as time)
00:02:50
select dayofyear(CAST('2022-09-07' as date));
dayofyear(CAST('2022-09-07' as date))
250
select ROUND(dayofyear(2022-09-07),1);
ROUND(dayofyear(2022-09-07),1)
NULL
Warnings:
Warning	5086	Not timestamp Can not cast varchar value to timestamp type
select dayofyear(round(20220907.984));
dayofyear(round(20220907.984))
251
select dayofyear(ROUND('2022-09-07'),ROUND('2022-09-07'));
ERROR 42000: Incorrect parameter count in the call to native function 'dayofyear'
select ROUND(dayofyear('2022-09-07'),dayofyear('2022-09-07')-20200916);
ROUND(dayofyear('2022-09-07'),dayofyear('2022-09-07')-20200916)
0
select dayofyear(CEIL('20220907'));
dayofyear(CEIL('20220907'))
250
select dayofyear(CEIL('20220908 23:59:59.999999'));
dayofyear(CEIL('20220908 23:59:59.999999'))
251
Warnings:
Warning	1292	Truncated incorrect DOUBLE value: '20220908 23:59:59.999999'
select dayofyear(FLOOR('20220907'));
dayofyear(FLOOR('20220907'))
250
select dayofyear(FLOOR('20220908 23:59:59.999999'));
dayofyear(FLOOR('20220908 23:59:59.999999'))
251
Warnings:
Warning	1292	Truncated incorrect DOUBLE value: '20220908 23:59:59.999999'
select dayofyear(ABS(20220907+1));
dayofyear(ABS(20220907+1))
251
select dayofyear(ABS(20220908-1));
dayofyear(ABS(20220908-1))
250
select dayofyear(SIGN(20220907));
dayofyear(SIGN(20220907))
NULL
Warnings:
Warning	5086	Not timestamp Can not cast varchar value to timestamp type
select dayofyear(CONV(20220907+1));
ERROR 42000: Incorrect parameter count in the call to native function 'CONV'
select dayofyear(CONV(20220907-1));
ERROR 42000: Incorrect parameter count in the call to native function 'CONV'
select MOD(dayofyear('2022-09-07'),1);
MOD(dayofyear('2022-09-07'),1)
0
select dayofyear(MOD(20220907,1));
dayofyear(MOD(20220907,1))
NULL
Warnings:
Warning	5086	Not timestamp Can not cast varchar value to timestamp type
select POW(dayofyear(20220907),null);
POW(dayofyear(20220907),null)
NULL
select dayofyear(POW(20220907),1);
ERROR 42000: Incorrect parameter count in the call to native function 'dayofyear'
select POWER(dayofyear(20220907),null);
POWER(dayofyear(20220907),null)
NULL
select dayofyear(POWER(20220907),1);
ERROR 42000: Incorrect parameter count in the call to native function 'dayofyear'
select rand(dayofyear(2022-09-07));
rand(dayofyear(2022-09-07))
0.15522042769493574
Warnings:
Warning	5086	Not timestamp Can not cast varchar value to timestamp type
select dayofyear(rand(2022-09-07));
dayofyear(rand(2022-09-07))
NULL
Warnings:
Warning	5086	Not timestamp Can not cast varchar value to timestamp type
##流程控制函数与比较函数
select GREATEST(dayofyear('2022-09-07'),'1');
GREATEST(dayofyear('2022-09-07'),'1')
250
select LEAST(dayofyear('2022-09-07'),'1');
LEAST(dayofyear('2022-09-07'),'1')
1
select isnull(dayofyear('2022-09-07'));
isnull(dayofyear('2022-09-07'))
0
select isnull(dayofyear('2022-09-07')+0);
isnull(dayofyear('2022-09-07')+0)
0
select CASE dayofyear('2022-09-08') when dayofyear('2022-09-08') then 1 when dayofyear('2022-09-07') then 2 END as result;
result
1
select if(dayofyear('2022-09-07')<dayofyear('2022-09-08'),dayofyear('2022-09-07'),dayofyear('2022-09-08')) as result;
result
250
select ifnull(null,dayofyear('2022-09-07'));
ifnull(null,dayofyear('2022-09-07'))
250
select nullif(dayofyear('2022-09-07'),dayofyear('2022-09-07'));
nullif(dayofyear('2022-09-07'),dayofyear('2022-09-07'))
NULL
select COALESCE(dayofyear('2022-09-07'));
COALESCE(dayofyear('2022-09-07'))
250
select sleep(dayofyear(20200101));
sleep(dayofyear(20200101))
0
##使用场景 
##表table
##create as select
drop table t1;
drop table t2;
create table t1 (c1 int ,c2 varchar(20),c3 date);
insert into t1 values(1,'test01','20220907');
insert into t1 values(2,'test02','20220909');
insert into t1 values(3,'test03','2022-08-20');
insert into t1 values(4,'test04','2022-09-15');
insert into t1 values(5,'test05','2022-09-16');
select dayofyear(c3) as a from t1;
a
250
252
232
258
259
create table t2 as select dayofyear(c3) from t1;
select * from t2;
dayofyear(c3)
250
252
232
258
259
drop table t2;
select DATEDIFF(dayofyear(c3)-1,dayofyear(c3)) from t1;
DATEDIFF(dayofyear(c3)-1,dayofyear(c3))
NULL
NULL
NULL
NULL
NULL
select MOD(dayofyear('2022-09-15')+5,dayofyear('2022-09-15')) from t1;
MOD(dayofyear('2022-09-15')+5,dayofyear('2022-09-15'))
5
5
5
5
5
select time(dayofyear('2022-09-15')),COALESCE(dayofyear('2022-09-15')) from t1;
time(dayofyear('2022-09-15'))	COALESCE(dayofyear('2022-09-15'))
00:02:58	258
00:02:58	258
00:02:58	258
00:02:58	258
00:02:58	258
SELECT INSTR(dayofyear('2022-09-15'),dayofyear('2022-09-15')+0) from t1;
INSTR(dayofyear('2022-09-15'),dayofyear('2022-09-15')+0)
1
1
1
1
1
select LENGTH(dayofyear('2022-09-15')+1),LENGTH(dayofyear('2022-09-15')) from t1;
LENGTH(dayofyear('2022-09-15')+1)	LENGTH(dayofyear('2022-09-15'))
3	3
3	3
3	3
3	3
3	3
SELECT LOCATE(2,dayofyear('2022-09-15')+0,dayofyear('2022-09-15')-20200911) from t1;
LOCATE(2,dayofyear('2022-09-15')+0,dayofyear('2022-09-15')-20200911)
0
0
0
0
0
select MD5(dayofyear('2022-09-15')),MD5(dayofyear('2022-09-15')+1) from t1;
MD5(dayofyear('2022-09-15'))	MD5(dayofyear('2022-09-15')+1)
502e4a16930e414107ee22b6198c578f	cfa0860e83a4c3a763a7e62d825349f7
502e4a16930e414107ee22b6198c578f	cfa0860e83a4c3a763a7e62d825349f7
502e4a16930e414107ee22b6198c578f	cfa0860e83a4c3a763a7e62d825349f7
502e4a16930e414107ee22b6198c578f	cfa0860e83a4c3a763a7e62d825349f7
502e4a16930e414107ee22b6198c578f	cfa0860e83a4c3a763a7e62d825349f7
##聚合函数
select c3,count(dayofyear(c3)) from t1;
c3	count(dayofyear(c3))
2022-09-07	5
select c3,dayofyear(count(c3)) from t1;
c3	dayofyear(count(c3))
2022-09-07	NULL
Warnings:
Warning	5086	Not timestamp Can not cast varchar value to timestamp type
select c3,sum(dayofyear(c3)) from t1;
c3	sum(dayofyear(c3))
2022-09-07	1251
select c3,dayofyear(sum(c3)) from t1;
c3	dayofyear(sum(c3))
2022-09-07	NULL
Warnings:
Warning	5086	Not timestamp Can not cast varchar value to timestamp type
select c3,avg(dayofyear(c3)) from t1;
c3	avg(dayofyear(c3))
2022-09-07	250.2000
select c3,dayofyear(avg(c3)) from t1;
c3	dayofyear(avg(c3))
2022-09-07	NULL
Warnings:
Warning	5086	Not timestamp Can not cast varchar value to timestamp type
select c3,min(dayofyear(c3)) from t1;
c3	min(dayofyear(c3))
2022-09-07	232
select c3,dayofyear(min(c3)) from t1;
c3	dayofyear(min(c3))
2022-09-07	232
select c3,max(dayofyear(c3)) from t1;
c3	max(dayofyear(c3))
2022-09-07	259
select c3,dayofyear(max(c3)) from t1;
c3	dayofyear(max(c3))
2022-09-07	259
select c3,GROUP_CONCAT(dayofyear(c3)) from t1;
c3	GROUP_CONCAT(dayofyear(c3))
2022-09-07	250,252,232,258,259
select c3,dayofyear(GROUP_CONCAT(c3)) from t1;
c3	dayofyear(GROUP_CONCAT(c3))
2022-09-07	NULL
Warnings:
Warning	5086	Not timestamp Can not cast varchar value to timestamp type
##where子句
select t1.*, dayofyear(c3) from t1 where dayofyear(c3)=252;
c1	c2	c3	dayofyear(c3)
2	test02	2022-09-09	252
select t1.*, dayofyear(c3) from t1 where dayofyear(c3)>='252';
c1	c2	c3	dayofyear(c3)
2	test02	2022-09-09	252
4	test04	2022-09-15	258
5	test05	2022-09-16	259
select t1.*, dayofyear(c3) from t1 where dayofyear(c3)<='252';
c1	c2	c3	dayofyear(c3)
1	test01	2022-09-07	250
2	test02	2022-09-09	252
3	test03	2022-08-20	232
select t1.*, dayofyear(c3) from t1 where dayofyear(c3)='252';
c1	c2	c3	dayofyear(c3)
2	test02	2022-09-09	252
select t1.*, dayofyear(c3) from t1 where dayofyear(c3)<'252';
c1	c2	c3	dayofyear(c3)
1	test01	2022-09-07	250
3	test03	2022-08-20	232
select t1.*, dayofyear(c3) from t1 where dayofyear(c3)>'252';
c1	c2	c3	dayofyear(c3)
4	test04	2022-09-15	258
5	test05	2022-09-16	259
select t1.*, dayofyear(c3) from t1 where dayofyear(c3) between '252' and '232';
c1	c2	c3	dayofyear(c3)
select t1.*, dayofyear(c3) from t1 where dayofyear(c3) like '7%';
c1	c2	c3	dayofyear(c3)
select t1.*, dayofyear(c3) from t1 where exists (select dayofyear(c3));
c1	c2	c3	dayofyear(c3)
1	test01	2022-09-07	250
2	test02	2022-09-09	252
3	test03	2022-08-20	232
4	test04	2022-09-15	258
5	test05	2022-09-16	259
select t1.*, dayofyear(c3) from t1 where '252' in  (select dayofyear(c3));
c1	c2	c3	dayofyear(c3)
2	test02	2022-09-09	252
select t1.*, dayofyear(c3) from t1 where '252' > all(select dayofyear(c3));
c1	c2	c3	dayofyear(c3)
1	test01	2022-09-07	250
3	test03	2022-08-20	232
select t1.*, dayofyear(c3) from t1 where c1 =2 or c2 ='test03';
c1	c2	c3	dayofyear(c3)
2	test02	2022-09-09	252
3	test03	2022-08-20	232
select t1.*, dayofyear(c3) from t1 where c1 =2 and c2 ='test02';
c1	c2	c3	dayofyear(c3)
2	test02	2022-09-09	252
create table t2(a1 int ,a2 int);
insert into t2 values(1,1);
insert into t2 values(2,2);
insert into t2 values(3,3);
select t1.*,dayofyear(c3) from t1 inner join t2 on t1.c1=t2.a1;
c1	c2	c3	dayofyear(c3)
1	test01	2022-09-07	250
2	test02	2022-09-09	252
3	test03	2022-08-20	232
select t1.*,dayofyear(c3) from t1 left join t2 on t1.c1=t2.a1;
c1	c2	c3	dayofyear(c3)
1	test01	2022-09-07	250
2	test02	2022-09-09	252
3	test03	2022-08-20	232
4	test04	2022-09-15	258
5	test05	2022-09-16	259
select t1.*,dayofyear(c3) from t1 right join t2 on t1.c1=t2.a1;
c1	c2	c3	dayofyear(c3)
1	test01	2022-09-07	250
2	test02	2022-09-09	252
3	test03	2022-08-20	232
mysql不支持
with tt as (select dayofyear(c3)  from t1)  select * from tt;
dayofyear(c3)
250
252
232
258
259
select dayofyear(c3)+dayofyear(c3) from t1 where c1>3;
dayofyear(c3)+dayofyear(c3)
516
518
select dayofyear(c3)-dayofyear(c3) from t1;
dayofyear(c3)-dayofyear(c3)
0
0
0
0
0
select dayofyear(c3)*dayofyear(c3) from t1;
dayofyear(c3)*dayofyear(c3)
62500
63504
53824
66564
67081
select dayofyear(c3)/dayofyear(c3) from t1;
dayofyear(c3)/dayofyear(c3)
1.0000
1.0000
1.0000
1.0000
1.0000
select dayofyear(c3)%dayofyear(c3) from t1;
dayofyear(c3)%dayofyear(c3)
0
0
0
0
0
select dayofyear(c3) div dayofyear(c3) from t1;
dayofyear(c3) div dayofyear(c3)
1
1
1
1
1
select dayofyear(c3) mod dayofyear(c3) from t1;
dayofyear(c3) mod dayofyear(c3)
0
0
0
0
0
select -dayofyear(c3) from t1;
-dayofyear(c3)
-250
-252
-232
-258
-259
select +dayofyear(c3) from t1;
+dayofyear(c3)
250
252
232
258
259
select dayofyear(c3)+0+dayofyear(c3) from t1 where c1>3;
dayofyear(c3)+0+dayofyear(c3)
516
518
select dayofyear(c3)-dayofyear(c3)+0 from t1;
dayofyear(c3)-dayofyear(c3)+0
0
0
0
0
0
select dayofyear(c3)*dayofyear(c3)+0 from t1;
dayofyear(c3)*dayofyear(c3)+0
62500
63504
53824
66564
67081
select dayofyear(c3)+0/dayofyear(c3) from t1;
dayofyear(c3)+0/dayofyear(c3)
250.0000
252.0000
232.0000
258.0000
259.0000
select dayofyear(c3)%dayofyear(c3)+0 from t1;
dayofyear(c3)%dayofyear(c3)+0
0
0
0
0
0
select dayofyear(c3)+0 div dayofyear(c3) from t1;
dayofyear(c3)+0 div dayofyear(c3)
250
252
232
258
259
select dayofyear(c3) mod dayofyear(c3)+0 from t1;
dayofyear(c3) mod dayofyear(c3)+0
0
0
0
0
0
select -dayofyear(c3)+0 from t1;
-dayofyear(c3)+0
-250
-252
-232
-258
-259
select +dayofyear(c3)+0 from t1;
+dayofyear(c3)+0
250
252
232
258
259
select dayofyear(c3)+0+dayofyear(c3)+0 from t1 where c1=3;
dayofyear(c3)+0+dayofyear(c3)+0
464
select dayofyear(c3)+0-dayofyear(c3)+0 from t1;
dayofyear(c3)+0-dayofyear(c3)+0
0
0
0
0
0
select dayofyear(c3)+0*dayofyear(c3)+0 from t1;
dayofyear(c3)+0*dayofyear(c3)+0
250
252
232
258
259
select dayofyear(c3)+0/dayofyear(c3)+0 from t1;
dayofyear(c3)+0/dayofyear(c3)+0
250.0000
252.0000
232.0000
258.0000
259.0000
select dayofyear(c3)+0%dayofyear(c3)+0 from t1;
dayofyear(c3)+0%dayofyear(c3)+0
250
252
232
258
259
select dayofyear(c3)+0 div dayofyear(c3)+0 from t1;
dayofyear(c3)+0 div dayofyear(c3)+0
250
252
232
258
259
select dayofyear(c3)+0 mod dayofyear(c3)+0 from t1;
dayofyear(c3)+0 mod dayofyear(c3)+0
250
252
232
258
259
select distinct dayofyear(c3) from t1;
dayofyear(c3)
250
252
232
258
259
select distinct dayofyear(c3)+20 from t1;
dayofyear(c3)+20
270
272
252
278
279
select  dayofyear(c3) from t1;
dayofyear(c3)
250
252
232
258
259
select  dayofyear(c3)+1 from t1;
dayofyear(c3)+1
251
253
233
259
260
select t1.*,dayofyear(c3)-0, dayofyear(c3) from t1 group by c1;
c1	c2	c3	dayofyear(c3)-0	dayofyear(c3)
1	test01	2022-09-07	250	250
2	test02	2022-09-09	252	252
3	test03	2022-08-20	232	232
4	test04	2022-09-15	258	258
5	test05	2022-09-16	259	259
select t1.*,dayofyear(c3)-0, dayofyear(c3) from t1 group by dayofyear(c3),dayofyear(c3)+0;
c1	c2	c3	dayofyear(c3)-0	dayofyear(c3)
1	test01	2022-09-07	250	250
2	test02	2022-09-09	252	252
3	test03	2022-08-20	232	232
4	test04	2022-09-15	258	258
5	test05	2022-09-16	259	259
select t1.*,dayofyear(c3)-0, dayofyear(c3) from t1 group by dayofyear(c3) having dayofyear(c3)>='2020-09-13';
c1	c2	c3	dayofyear(c3)-0	dayofyear(c3)
Warnings:
Warning	1292	Truncated incorrect DECIMAL value: '2020-09-13'
Warning	1292	Truncated incorrect DECIMAL value: '2020-09-13'
select t1.*,dayofyear(c3)-0, dayofyear(c3) from t1 group by dayofyear(c3) having dayofyear(c3)-0>='2020-09-13';
c1	c2	c3	dayofyear(c3)-0	dayofyear(c3)
Warnings:
Warning	1292	Truncated incorrect DECIMAL value: '2020-09-13'
Warning	1292	Truncated incorrect DECIMAL value: '2020-09-13'
select t1.*,dayofyear(c3)-0, dayofyear(c3) from t1 order by dayofyear(c3);
c1	c2	c3	dayofyear(c3)-0	dayofyear(c3)
3	test03	2022-08-20	232	232
1	test01	2022-09-07	250	250
2	test02	2022-09-09	252	252
4	test04	2022-09-15	258	258
5	test05	2022-09-16	259	259
select t1.*,dayofyear(c3)-0, dayofyear(c3) from t1 order by dayofyear(c3)+0;
c1	c2	c3	dayofyear(c3)-0	dayofyear(c3)
3	test03	2022-08-20	232	232
1	test01	2022-09-07	250	250
2	test02	2022-09-09	252	252
4	test04	2022-09-15	258	258
5	test05	2022-09-16	259	259
select t1.*,dayofyear(c3)-0, dayofyear(c3) from t1  where 9 =dayofyear(c3) order by dayofyear(c3);
c1	c2	c3	dayofyear(c3)-0	dayofyear(c3)
select t1.*,dayofyear(c3)-0, dayofyear(c3) from t1 where 9 =dayofyear(c3)+0 order by dayofyear(c3)+0;
c1	c2	c3	dayofyear(c3)-0	dayofyear(c3)
select t1.* , case dayofyear(c3)  when dayofyear(c3)  then dayofyear(c3)  when dayofyear(c3)+1  then    dayofyear(c3)+1  end as a  from t1;
c1	c2	c3	a
1	test01	2022-09-07	250
2	test02	2022-09-09	252
3	test03	2022-08-20	232
4	test04	2022-09-15	258
5	test05	2022-09-16	259
select t1.* , case dayofyear(c3)+1  when dayofyear(c3)  then dayofyear(c3)  when dayofyear(c3)+1  then    dayofyear(c3)+1  end as a  from t1;
c1	c2	c3	a
1	test01	2022-09-07	251
2	test02	2022-09-09	253
3	test03	2022-08-20	233
4	test04	2022-09-15	259
5	test05	2022-09-16	260
select count(dayofyear(c3)) from t1;
count(dayofyear(c3))
5
select count(dayofyear(c3)+0) from t1;
count(dayofyear(c3)+0)
5
select sum(dayofyear(c3)) from t1;
sum(dayofyear(c3))
1251
select sum(dayofyear(c3)+0) from t1;
sum(dayofyear(c3)+0)
1251
select avg(dayofyear(c3)) from t1;
avg(dayofyear(c3))
250.2000
select avg(dayofyear(c3)+0) from t1;
avg(dayofyear(c3)+0)
250.2000
select min(dayofyear(c3)) from t1;
min(dayofyear(c3))
232
select min(dayofyear(c3)+0) from t1;
min(dayofyear(c3)+0)
232
select max(dayofyear(c3)) from t1;
max(dayofyear(c3))
259
select max(dayofyear(c3)+0) from t1;
max(dayofyear(c3)+0)
259
select GROUP_CONCAT(dayofyear(c3)) from t1;
GROUP_CONCAT(dayofyear(c3))
250,252,232,258,259
select GROUP_CONCAT(dayofyear(c3)+0) from t1;
GROUP_CONCAT(dayofyear(c3)+0)
250,252,232,258,259
drop table t2;
drop table t1;
create table t1(c1 int,c2 varchar(20));
create table t2(c1 int,c2 varchar(20));
insert into t1 values(1,'2022-09-15');
insert into t1 values(2,'2022-09-14');
insert into t2 values(1,'2022-09-14');
insert into t1 values(3,'2022-09-13');
select dayofyear(c2),dayofyear(c2)+0 from t1 union select dayofyear(c2),dayofyear(c2)+0 from t2;
dayofyear(c2)	dayofyear(c2)+0
258	258
257	257
256	256
select dayofyear(c2),dayofyear(c2)+0 from t1 union all select dayofyear(c2),dayofyear(c2)+0 from t2;
dayofyear(c2)	dayofyear(c2)+0
258	258
257	257
256	256
257	257
select dayofyear(c2),dayofyear(c2)+0 from t1 intersect select dayofyear(c2),dayofyear(c2)+0 from t2;
dayofyear(c2)	dayofyear(c2)+0
257	257
select dayofyear(c2),dayofyear(c2)+1 from t1 except select dayofyear(c2),dayofyear(c2)+0 from t2;
dayofyear(c2)	dayofyear(c2)+1
258	259
257	258
256	257
select dayofyear(c2),dayofyear(c2)+2 from t1 minus select dayofyear(c2),dayofyear(c2)+0 from t2;
dayofyear(c2)	dayofyear(c2)+2
258	260
257	259
256	258
drop table t2;
drop table t1;
##insert into
create table t1(a bool,b bool);
insert into t1 values(111,111.999999);
select dayofyear(a) from t1;
dayofyear(a)
11
select dayofyear(b) from t1;
dayofyear(b)
12
drop table t1;
create table t1(a BOOLEAN,b BOOLEAN);
insert into t1 values(111,111.999999);
select dayofyear(a) from t1;
dayofyear(a)
11
select dayofyear(b) from t1;
dayofyear(b)
12
drop table t1;
create table t1(a TINYINT,b TINYINT);
insert into t1 values(126.999999,12.22);
select dayofyear(a) from t1;
dayofyear(a)
27
select dayofyear(b) from t1;
dayofyear(b)
NULL
Warnings:
Warning	5086	Not timestamp Can not cast varchar value to timestamp type
drop table t1;
create table t1(a SMALLINT,b SMALLINT);
insert into t1 values(20913.999999,927.1111);
select dayofyear(a) from t1;
dayofyear(a)
257
select dayofyear(b) from t1;
dayofyear(b)
271
drop table t1;
create table t1(a MEDIUMINT,b MEDIUMINT);
insert into t1 values(220929.99,220927.1111);
select dayofyear(a) from t1;
dayofyear(a)
273
select dayofyear(b) from t1;
dayofyear(b)
270
drop table t1;
create table t1(a INT,b int);
insert into t1 values(220913.999999,220927.1111);
select dayofyear(a) from t1;
dayofyear(a)
257
select dayofyear(b) from t1;
dayofyear(b)
270
drop table t1;
create table t1(a INTEGER,b INTEGER);
insert into t1 values(220913.999999,220927.1111);
select dayofyear(a) from t1;
dayofyear(a)
257
select dayofyear(b) from t1;
dayofyear(b)
270
drop table t1;
create table t1(a BIGINT,b BIGINT);
insert into t1 values(220913.999999,220927.1111);
select dayofyear(a) from t1;
dayofyear(a)
257
select dayofyear(b) from t1;
dayofyear(b)
270
drop table t1;
create table t1(a DECIMAL,b DECIMAL);
insert into t1 values(220913.999999,220927.1111);
Warnings:
Warning	1265	Data truncated for column 'a' at row 1
Warning	1265	Data truncated for column 'b' at row 1
select dayofyear(a) from t1;
dayofyear(a)
257
select dayofyear(b) from t1;
dayofyear(b)
270
drop table t1;
create table t1(a NUMERIC,b NUMERIC);
insert into t1 values(220913.999999,220927.1111);
Warnings:
Warning	1265	Data truncated for column 'a' at row 1
Warning	1265	Data truncated for column 'b' at row 1
select dayofyear(a) from t1;
dayofyear(a)
257
select dayofyear(b) from t1;
dayofyear(b)
270
drop table t1;
create table t1(a FLOAT,b FLOAT);
insert into t1 values(220913.999999,220927.1111);
select dayofyear(a) from t1;
dayofyear(a)
257
select dayofyear(b) from t1;
dayofyear(b)
270
drop table t1;
create table t1(a DOUBLE,b DOUBLE);
insert into t1 values(220913.999999,220927.1111);
select dayofyear(a) from t1;
dayofyear(a)
256
select dayofyear(b) from t1;
dayofyear(b)
270
drop table t1;
create table t1(a BIT,b bit);
insert into t1 values(0,1);
select dayofyear(a) from t1;
dayofyear(a)
NULL
Warnings:
Warning	5086	Not timestamp Can not cast varchar value to timestamp type
select dayofyear(b) from t1;
dayofyear(b)
NULL
Warnings:
Warning	5086	Not timestamp Can not cast varchar value to timestamp type
drop table t1;
create table t1(a DATETIME,b DATETIME);
insert into t1 values(220913,220927);
select dayofyear(a) from t1;
dayofyear(a)
256
select dayofyear(b) from t1;
dayofyear(b)
270
drop table t1;
create table t1(a TIMESTAMP,b TIMESTAMP);
insert into t1 values('2022-09-13 23:59:59.999999','2038-01-19 03:14:07.999999');
select dayofyear(a) from t1;
dayofyear(a)
257
select dayofyear(b) from t1;
dayofyear(b)
19
drop table t1;
create table t1(a DATE,b DATE);
insert into t1 values('1970-01-01 23:59:59','2038-01-19 03:14:07');
select dayofyear(a) from t1;
dayofyear(a)
1
select dayofyear(b) from t1;
dayofyear(b)
19
drop table t1;
create table t1(a TIME,b TIME);
insert into t1 values('23:59:59.999999','2038-01-19 23:59:59.999999');
drop table t1;
create table t1(a YEAR,b year);
insert into t1 values('2022','2038');
select dayofyear(a) from t1;
dayofyear(a)
NULL
Warnings:
Warning	5086	Not timestamp Can not cast varchar value to timestamp type
select dayofyear(b) from t1;
dayofyear(b)
NULL
Warnings:
Warning	5086	Not timestamp Can not cast varchar value to timestamp type
drop table t1;
create table t1(a VARCHAR(50),b VARCHAR(50));
insert into t1 values('2022-09-27 23:59:59.999999','2038-01-19 23:59:59.999999');
select dayofyear(a) from t1;
dayofyear(a)
270
select dayofyear(b) from t1;
dayofyear(b)
19
drop table t1;
create table t1(a VARBINARY(50),b VARBINARY(50));
insert into t1 values('2022-09-27 23:59:59.999999','2038-01-19 23:59:59.999999');
select dayofyear(a) from t1;
dayofyear(a)
270
select dayofyear(b) from t1;
dayofyear(b)
19
drop table t1;
create table t1(a CHAR(50),b CHAR(50));
insert into t1 values('2022-09-27 23:59:59.999999','2038-01-19 23:59:59.999999');
select dayofyear(a) from t1;
dayofyear(a)
270
select dayofyear(b) from t1;
dayofyear(b)
19
drop table t1;
create table t1(a BINARY(10),b BINARY(10));
insert into t1 values('10111101','11111011');
select dayofyear(a) from t1;
dayofyear(a)
NULL
Warnings:
Warning	5086	Not timestamp Can not cast varchar value to timestamp type
select dayofyear(b) from t1;
dayofyear(b)
NULL
Warnings:
Warning	5086	Not timestamp Can not cast varchar value to timestamp type
drop table t1;
create table t1(a enum ('2022-09-27 23:59:59.999999','2038-01-19 23:59:59.999999'),b enum ('10111101','11111011'));
insert into t1 values('2022-09-27 23:59:59.999999','10111101');
select dayofyear(a) from t1;
dayofyear(a)
270
select dayofyear(b) from t1;
dayofyear(b)
305
drop table t1;
create table t1(a set ('2022-09-27 23:59:59.999999','2038-01-19 23:59:59.999999'),b set ('10111101','11111011'));
insert into t1 values('2022-09-27 23:59:59.999999','10111101');
select dayofyear(a) from t1;
dayofyear(a)
270
select dayofyear(b) from t1;
dayofyear(b)
305
drop table t1;
create table t1(a TINYTEXT,b TINYTEXT);
insert into t1 values('2022-09-27 23:59:59.999999','10111101');
select dayofyear(a) from t1;
dayofyear(a)
270
select dayofyear(b) from t1;
dayofyear(b)
305
drop table t1;
create table t1(a TINYBLOB,b TINYBLOB);
insert into t1 values('2022-09-27 23:59:59.999999','10111101');
select dayofyear(a) from t1;
dayofyear(a)
270
select dayofyear(b) from t1;
dayofyear(b)
305
drop table t1;
create table t1(a TEXT,b TEXT);
insert into t1 values('2022-09-27 23:59:59.999999','10111101');
select dayofyear(a) from t1;
dayofyear(a)
270
select dayofyear(b) from t1;
dayofyear(b)
305
drop table t1;
create table t1(a BLOB,b BLOB);
insert into t1 values('2022-09-27 23:59:59.999999','10111101');
select dayofyear(a) from t1;
dayofyear(a)
270
select dayofyear(b) from t1;
dayofyear(b)
305
drop table t1;
create table t1(a MEDIUMTEXT,b MEDIUMTEXT);
insert into t1 values('2022-09-27 23:59:59.999999','10111101');
select dayofyear(a) from t1;
dayofyear(a)
270
select dayofyear(b) from t1;
dayofyear(b)
305
drop table t1;
create table t1(a MEDIUMBLOB,b MEDIUMBLOB);
insert into t1 values('2022-09-27 23:59:59.999999','10111101');
select dayofyear(a) from t1;
dayofyear(a)
270
select dayofyear(b) from t1;
dayofyear(b)
305
drop table t1;
create table t1(a LONGTEXT,b LONGTEXT);
insert into t1 values('2022-09-27 23:59:59.999999','10111101');
select dayofyear(a) from t1;
dayofyear(a)
270
select dayofyear(b) from t1;
dayofyear(b)
305
drop table t1;
create table t1(a LONGBLOB,b LONGBLOB);
insert into t1 values('2022-09-27 23:59:59.999999','10111101');
select dayofyear(a) from t1;
dayofyear(a)
270
select dayofyear(b) from t1;
dayofyear(b)
305
drop table t1;
create table t1 (c1 int ,c2 varchar(40),c3 date);
insert into t1 values(1,'test01','20220811');
insert into t1 values(2,'test02','20220915');
insert into t1 values(3,'test03','2022-08-20');
insert into t1 values(4,'test04','2022-09-15');
insert into t1 values(dayofyear('2022-08-088'),'test04','2022-09-15');
ERROR 22007: Incorrect value
select * from t1;
c1	c2	c3
1	test01	2022-08-11
2	test02	2022-09-15
3	test03	2022-08-20
4	test04	2022-09-15
drop table t2;
create table t2 (a1 int ,a2 varchar(20));
insert into t2(a1, a2)  select 1,dayofyear('2022-09-15');
select * from t2;
a1	a2
1	258
drop table t2;
insert into t1(c1) values(-dayofyear('2022-09-15'));
insert into t1(c1) values(+dayofyear('2022-09-15'));
insert into t1(c2) values(-dayofyear('2022-09-15'));
insert into t1(c1) values(dayofyear('2022-09-15')+dayofyear('2022-09-15'));
insert into t1(c1) values(dayofyear('2022-09-15')*dayofyear('2022-09-15'));
insert into t1(c1) values(dayofyear('2022-09-15')/1);
##预期插入失败,OB插入成功,此处bug
insert into t1 values(dayofyear('2022-09-15')%1,dayofyear('2022-09-15')%1,dayofyear('2022-09-15')%1);
insert into t1 values(dayofyear('2022-09-15') mod 1,dayofyear('2022-09-15') mod 1,dayofyear('2022-09-15') mod 1);
insert into t1 values(dayofyear('2022-09-15') div 1,dayofyear('2022-09-15') div 1,dayofyear('2022-09-15') div 1);
ERROR 22007: Incorrect datetime value for column 'c3' at row 1
insert into t1 values(dayofyear('2022-09-15')+0%1,dayofyear('2022-09-15')+1%1,dayofyear('2022-09-15')+1%1);
ERROR 22007: Incorrect datetime value for column 'c3' at row 1
insert into t1 values(dayofyear('2022-09-15')-1 div 1,dayofyear('2022-09-15')-2 div 1,dayofyear('2022-09-15')-1 div 1);
ERROR 22007: Incorrect datetime value for column 'c3' at row 1
insert into t1 values(dayofyear('2022-09-15')-1 mod 1,dayofyear('2022-09-15')-1 mod 1,dayofyear('2022-09-15')-1 mod 1);
ERROR 22007: Incorrect datetime value for column 'c3' at row 1
insert into t1 values(dayofyear('2022-09-15')-1 * 1,dayofyear('2022-09-15')-1 * 1,dayofyear('2022-09-15')-1 * 1);
ERROR 22007: Incorrect datetime value for column 'c3' at row 1
select * from t1;
c1	c2	c3
1	test01	2022-08-11
2	test02	2022-09-15
3	test03	2022-08-20
4	test04	2022-09-15
-258	NULL	NULL
258	NULL	NULL
NULL	-258	NULL
516	NULL	NULL
66564	NULL	NULL
258	NULL	NULL
0	0	0000-00-00
0	0	0000-00-00
drop table t1;
## update
create table t1 (c1 int ,c2 varchar(20),c3 date);
insert into t1 values(1,'test01','20220811');
insert into t1 values(2,'test02','20220915');
insert into t1 values(3,'test03','2022-08-20');
insert into t1 values(4,'test04','2022-09-15');
update t1 set c1= dayofyear(20220811) where c2='test01';
update t1 set c1= dayofyear(20220811)+0 where c2='test01';
update t1 set c1= dayofyear(20220811) where c2 in ('test01','test02');
update t1 set c1= dayofyear(20220811),c3=dayofyear(20220811) where c2 in ('test01','test02');
update t1 set c1= dayofyear(20220811),c3=dayofyear(20220811)+0 where c2 in ('test01','test02');
update t1 set c1= dayofyear(20220811) where c3>dayofyear(20220811);
update t1 set c1= dayofyear(20220811)+0  where c3>dayofyear(20220811)+0;
update t1 set c1= dayofyear(20220811) where c3>dayofyear(20220811);
update t1 set c1= dayofyear(20220811)+0  where c3<dayofyear(20220811)+0;
update t1 set c1= dayofyear(20220811) where c3=dayofyear(20220811);
update t1 set c1= dayofyear(20220811) where c3<=dayofyear(20220811);
update t1 set c1= dayofyear(20220811) where c3 between dayofyear() and dayofyear(20220811)+3 ;
ERROR 42000: Incorrect parameter count in the call to native function 'dayofyear'
update t1 set c1= dayofyear(20220811)+0 where c3 = dayofyear(20220811)  or c1=dayofyear(20220811) ;
update t1 set c1= dayofyear(20220811)+0 where c2 like 'test%' ;
update t1 set c1= dayofyear(20220811) where c2 not like 'test%' ;
update t1 set c1= dayofyear(20220812) where c3>any(select dayofyear(20220811));
update t1 set c1= dayofyear(20220811)+1 where c3<all(select dayofyear(20220811));
update t1 set c1= abs(dayofyear(20220811));
update t1 set c1= abs(dayofyear(20220811)+1);
update t1 set c1= TO_DAYS(dayofyear(20220811));
update t1 set c1= LOCATE(dayofyear(20220811)-1,dayofyear(20220811));
update t1 set c1= DATE_ADD(dayofyear()+0,INTERVAL 5 DAY);
ERROR 42000: Incorrect parameter count in the call to native function 'dayofyear'
select * from t1;
c1	c2	c3
0	test01	2000-02-23
0	test02	2000-02-23
0	test03	2022-08-20
0	test04	2022-09-15
drop table t1;
##delete
create table t1 (c1 int ,c2 varchar(20),c3 date);
insert into t1 values(1,dayofyear('20220907'),'20220907');
insert into t1 values(2,dayofyear(20220909),'20220909');
insert into t1 values(3,dayofyear('2022-08-20'),'2022-08-20');
insert into t1 values(4,dayofyear('2022-09-15'),'2022-09-15');
insert into t1 values(5,dayofyear('2022-09-16'),'2022-09-16');
select * from t1;
c1	c2	c3
1	250	2022-09-07
2	252	2022-09-09
3	232	2022-08-20
4	258	2022-09-15
5	259	2022-09-16
delete  from t1 where c2 = dayofyear('2022-09-16');
delete from t1 where dayofyear(c3) = 252;
select * from t1;
c1	c2	c3
1	250	2022-09-07
3	232	2022-08-20
4	258	2022-09-15
drop table t1;
create table t1(c1 int, c2 varchar(30));
alter  table t1 modify  column c1 int(dayofyear('2022-09-13'));
ERROR 42000: You have an error in your SQL syntax; check the manual that corresponds to your OceanBase version for the right syntax to use near 'dayofyear('2022-09-13'))' at line 1
alter  table t1 modify  column c1 varchar(30)  DEFAULT dayofyear('2022-09-13');
ERROR 42000: You have an error in your SQL syntax; check the manual that corresponds to your OceanBase version for the right syntax to use near 'dayofyear('2022-09-13')' at line 1
##目前 OB 不支持这样改变列类型。小类型可以改大，大的不能改小。也不能跨大类型改。
alter  table t1 modify  column c1 varchar(30)  GENERATED ALWAYS AS (dayofyear('2022-09-13')) STORED NOT NULL COMMENT '日期';
ERROR HY000: 'Changing the STORED status' is not supported for generated columns.
drop table t1;
create table t1 (c1 int primary key, c2 varchar(30)) partition by hash(dayofyear(c1)) partitions 3;
ERROR HY000: Constant or random or timezone-dependent expressions in (sub)partitioning function are not allowed
create table t1 (c1 int primary key, c2 varchar(30)) partition by hash(c1) partitions 3;
insert into t1 values(1,dayofyear('2022-09-15'));
insert into t1 values(2,dayofyear('2022-09-16'));
insert into t1 values(3,dayofyear('2022-09-17'));
insert into t1 values(4,dayofyear('2022-09-18'));
select * from t1;
c1	c2
3	260
1	258
4	261
2	259
update t1 set c2 =dayofyear('2022-09-19');
delete from t1 where c2 =dayofyear('2022-09-19');
select * from t1;
c1	c2
drop table t1;
drop table t1;
create table t1 (c1 int primary key, c2 varchar(30)) partition by range(c1) (
PARTITION p0 VALUES LESS THAN (2),
PARTITION p1 VALUES LESS THAN (4),
PARTITION p2 VALUES LESS THAN (6)
);
insert into t1 values(dayofyear('2022-01-02'),'2022-09-01');
insert into t1 values(dayofyear('2022-01-03'),'2022-09-02');
insert into t1 values(dayofyear('2022-01-04'),'2022-09-03');
insert into t1 values(dayofyear('2022-01-05'),'2022-09-04');
select * from t1;
c1	c2
2	2022-09-01
3	2022-09-02
4	2022-09-03
5	2022-09-04
update t1 set c2 =dayofyear('2022-09-19');
delete from t1 where c2 =dayofyear('2022-09-19');
select * from t1;
c1	c2
drop table t1;
drop table t1;
create table t1 (c1 int primary key, c2 varchar(30)) partition by list(c1) (
PARTITION p0 VALUES IN (1,2),
PARTITION p1 VALUES IN (3,4),
PARTITION p2 VALUES IN (5,6)
);
insert into t1 values(dayofyear('2022-01-01'),'2022-09-01');
insert into t1 values(dayofyear('2022-01-02'),'2022-09-02');
insert into t1 values(dayofyear('2022-01-03'),'2022-09-03');
insert into t1 values(dayofyear('2022-01-05'),'2022-09-05');
select * from t1;
c1	c2
1	2022-09-01
2	2022-09-02
3	2022-09-03
5	2022-09-05
update t1 set c2 =dayofyear('2022-09-19');
delete from t1 where c2 =dayofyear('2022-09-19');
select * from t1;
c1	c2
drop table t1;
drop table t1;
create table t1 (c1 int primary key, c2 varchar(30)) partition by key(dayofyear(c1)) partitions 3;
ERROR 42000: You have an error in your SQL syntax; check the manual that corresponds to your OceanBase version for the right syntax to use near '(c1)) partitions 3' at line 1
create table t1 (c1 int primary key, c2 varchar(30)) partition by key(c1) partitions 3;
insert into t1 values(dayofyear('2022-09-01'),'2022-09-01');
insert into t1 values(dayofyear('2022-09-02'),'2022-09-02');
insert into t1 values(dayofyear('2022-09-03'),'2022-09-03');
insert into t1 values(dayofyear('2022-09-05'),'2022-09-05');
select * from t1 order by dayofyear(c2);
c1	c2
244	2022-09-01
245	2022-09-02
246	2022-09-03
248	2022-09-05
update t1 set c2 =dayofyear('2022-09-19');
delete from t1 where c2 =dayofyear('2022-09-19');
select * from t1;
c1	c2
drop table t1;
## 视图
drop table t1;
create table t1 (c1 int ,c2 varchar(20),c3 date);
insert into t1 values(1,'test01','20220907');
insert into t1 values(2,'test02','20220909');
insert into t1 values(3,'test03','2022-08-20');
insert into t1 values(4,'test04','2022-09-15');
insert into t1 values(5,'test05','2022-09-16');
drop view t1_view;
create view t1_view as select * from t1;
select * from t1_view;
c1	c2	c3
1	test01	2022-09-07
2	test02	2022-09-09
3	test03	2022-08-20
4	test04	2022-09-15
5	test05	2022-09-16
select t1_view.*, dayofyear(c3) from t1_view where dayofyear(c3)=252;
c1	c2	c3	dayofyear(c3)
2	test02	2022-09-09	252
select t1_view.*, dayofyear(c3) from t1_view where dayofyear(c3)>=252;
c1	c2	c3	dayofyear(c3)
2	test02	2022-09-09	252
4	test04	2022-09-15	258
5	test05	2022-09-16	259
select t1_view.*, dayofyear(c3) from t1_view where dayofyear(c3)<=252;
c1	c2	c3	dayofyear(c3)
1	test01	2022-09-07	250
2	test02	2022-09-09	252
3	test03	2022-08-20	232
select t1_view.*, dayofyear(c3) from t1_view where dayofyear(c3)=252;
c1	c2	c3	dayofyear(c3)
2	test02	2022-09-09	252
select t1_view.*, dayofyear(c3) from t1_view where dayofyear(c3)<252;
c1	c2	c3	dayofyear(c3)
1	test01	2022-09-07	250
3	test03	2022-08-20	232
select t1_view.*, dayofyear(c3) from t1_view where dayofyear(c3)>252;
c1	c2	c3	dayofyear(c3)
4	test04	2022-09-15	258
5	test05	2022-09-16	259
select t1_view.*, dayofyear(c3) from t1_view where dayofyear(c3) between 252 and 250;
c1	c2	c3	dayofyear(c3)
select t1_view.*, dayofyear(c3) from t1_view where dayofyear(c3) like '2%';
c1	c2	c3	dayofyear(c3)
1	test01	2022-09-07	250
2	test02	2022-09-09	252
3	test03	2022-08-20	232
4	test04	2022-09-15	258
5	test05	2022-09-16	259
select t1_view.*, dayofyear(c3) from t1_view where exists (select dayofyear(c3),dayofyear(c3));
c1	c2	c3	dayofyear(c3)
1	test01	2022-09-07	250
2	test02	2022-09-09	252
3	test03	2022-08-20	232
4	test04	2022-09-15	258
5	test05	2022-09-16	259
select t1_view.*, dayofyear(c3) from t1_view where 252 in  (select dayofyear(c3));
c1	c2	c3	dayofyear(c3)
2	test02	2022-09-09	252
select t1_view.*, dayofyear(c3) from t1_view where 252 > all(select dayofyear(c3));
c1	c2	c3	dayofyear(c3)
1	test01	2022-09-07	250
3	test03	2022-08-20	232
select t1_view.*, dayofyear(c3) from t1_view where c1 =2 or c2 ='test03';
c1	c2	c3	dayofyear(c3)
2	test02	2022-09-09	252
3	test03	2022-08-20	232
select t1_view.*, dayofyear(c3) from t1_view where c1 =2 and c2 ='test02';
c1	c2	c3	dayofyear(c3)
2	test02	2022-09-09	252
insert into t1_view(c1) values(dayofyear('202209167'));
ERROR 22007: Incorrect value
insert into t1_view(c1) values(dayofyear('20220916'));
insert into t1_view(c1,c2,c3) values(0,dayofyear('20220914'),'20220914');
insert into t1_view(c1,c2,c3) values(6,dayofyear('20220918'),'20220918');
delete from t1_view where c1=dayofyear('2022-09-16');
drop table t1;
drop view t1_view;
##PL块
drop table t1;
drop table t2;
DROP PROCEDURE pro1;
CREATE  PROCEDURE pro1( out a varchar(30))
begin
select dayofyear('2022-09-14') into a;
end;
//
CALL pro1(@aa);
select @aa;
@aa
257
DROP PROCEDURE pro1;
DROP PROCEDURE pro2;
CREATE  PROCEDURE pro2( out b int)
begin
select dayofyear('2022-09-14') into b;
end;
//
CALL pro2(@bb);
select @bb;
@bb
257
DROP PROCEDURE pro2;
drop table t1;
create table t1(c1 int,c2 varchar(30));
DROP PROCEDURE pro3;
CREATE PROCEDURE pro3(in a varchar(20))
begin
declare i int;
set i=20220910;
while i <=20220914  DO
if i > a then
select dayofyear(i);
end if;
insert into t1 values(i,dayofyear(i));
set i = i + 1;
end WHILE;
end;
//
CALL pro3(20220920);
DROP PROCEDURE pro3;
drop table t1;
create table t1(c1 int,c2 varchar(30));
DROP PROCEDURE pro4;
CREATE PROCEDURE pro4(in a int)
begin
declare i int;
declare b int;
set i=20220910;
while i <=20220914  DO
if a =20220920 then
select dayofyear(a);
end if;
insert into t1 values(a ,dayofyear(a));
set i = i + 1;
end WHILE;
select a into b;
end;
//
CALL pro4(20220920);
dayofyear(a)
dayofyear(a)
dayofyear(a)
dayofyear(a)
dayofyear(a)
263
263
263
263
263
select * from t1;
c1	c2
20220920	263
20220920	263
20220920	263
20220920	263
20220920	263
DROP PROCEDURE pro4;
drop table t1;
create table t1(c1 int,c2 varchar(30));
drop function  f1;
create function f1(aa  int) returns varchar(30)
begin
return dayofyear(aa);
end;
//
select f1(20220914);
f1(20220914)
257
drop table t1;
drop function  f1;
##insert型触发器
drop table t1;
drop table t2;
drop trigger t1_trigger;
create table t1 (c1 int ,c2 varchar(20),c3 date);
insert into t1 values(1,'test01','20220907');
insert into t1 values(2,'test02','20220909');
insert into t1 values(3,'test03','2022-08-20');
insert into t1 values(4,'test04','2022-09-15');
insert into t1 values(5,'test05','2022-09-16');
select * from t1;
c1	c2	c3
1	test01	2022-09-07
2	test02	2022-09-09
3	test03	2022-08-20
4	test04	2022-09-15
5	test05	2022-09-16
create table t2 (a1 int ,a2 varchar(20));
insert into t2 values(1,'test08');
insert into t2 values(2,'test09');
select * from t2;
a1	a2
1	test08
2	test09
create trigger t1_trigger after insert on  t2
for each row
begin 
update t1 set c2=dayofyear('2022-09-16') where c3="2022-09-16";
end //
insert into t2 values(3,'test03');
##update型触发器
drop table t1;
drop table t2;
drop trigger t1_trigger;
create table t1 (c1 int ,c2 varchar(20),c3 date);
insert into t1 values(1,'test01','20220907');
insert into t1 values(2,'test02','20220909');
insert into t1 values(3,'test03','2022-08-20');
insert into t1 values(4,'test04','2022-09-15');
insert into t1 values(5,'test05','2022-09-16');
select * from t1;
c1	c2	c3
1	test01	2022-09-07
2	test02	2022-09-09
3	test03	2022-08-20
4	test04	2022-09-15
5	test05	2022-09-16
create table t2 (a1 int ,a2 varchar(20));
insert into t2 values(1,'test08');
insert into t2 values(2,'test09');
select * from t2;
a1	a2
1	test08
2	test09
create trigger t1_trigger after update on  t2
for each row
begin 
update t1 set c2=dayofyear('2022-09-16') where c3="2022-09-16";
end //
update t2 set a2=dayofyear('2022-09-15') where a1=1;
##delete型触发器
drop table t1;
drop table t2;
drop trigger t1_trigger;
create table t1 (c1 int ,c2 varchar(20),c3 date);
insert into t1 values(1,'test01','20220907');
insert into t1 values(2,'test02','20220909');
insert into t1 values(3,'test03','2022-08-20');
insert into t1 values(4,'test04','2022-09-15');
insert into t1 values(5,'test05','2022-09-16');
select * from t1;
c1	c2	c3
1	test01	2022-09-07
2	test02	2022-09-09
3	test03	2022-08-20
4	test04	2022-09-15
5	test05	2022-09-16
create table t2 (a1 int ,a2 varchar(20));
insert into t2 values(1,'test08');
insert into t2 values(2,'test09');
select * from t2;
a1	a2
1	test08
2	test09
create trigger t1_trigger after delete on  t2
for each row
begin 
update t1 set c2=dayofyear('2022-09-16') where c3="2022-09-16";
end //
delete from t2 where a1=2;
drop table t1;
drop table t2;
drop trigger t1_trigger;
##约束
drop table t1;
create table t1(c1 varchar(20) primary key,c2 varchar(20) default '10');
drop table t2;
create table t2(a1 varchar(20) unique key ,a2 varchar(20),a3 varchar(20),CONSTRAINT for_key FOREIGN KEY (a3) REFERENCES  t1 (c1));
drop table t3;
create table t3(b1 varchar(20) not null ,b2 varchar(20));
insert into t1 values(dayofyear('2022-09-14'),dayofyear('2022-09-15'));
insert into t1(c1) values(dayofyear('2022-09-16'));
update t1 set c1=dayofyear('2022-09-17'),c2=dayofyear('2022-09-18') where c2='10';
select * from t1;
c1	c2
257	258
260	261
insert into t2 values(dayofyear('2022-09-14'),'test',dayofyear('2022-09-15'));
ERROR 23000: Cannot add or update a child row: a foreign key constraint fails
insert into t2 values('test',dayofyear('2022-09-18'),dayofyear('2022-09-17'));
select * from t2;
a1	a2	a3
test	261	260
update t2 set a1=dayofyear('2022-09-18') where a3=dayofyear('2022-09-17');
update t2 set a3=dayofyear('2022-09-19');
ERROR 23000: Cannot add or update a child row: a foreign key constraint fails
update t3 set b1=null;
insert into t3 values(dayofyear('2022-09-18'),dayofyear('2022-09-16'));
select * from t3;
b1	b2
261	259
##索引
CREATE INDEX indexName ON t1 (c1);
insert into t1 values(dayofyear('2022-09-18'),dayofyear('2022-09-19'));
update t1 set c2=('2022-09-20')  where c2=dayofyear('2022-09-19');
select * from t1 ;
c1	c2
257	258
260	261
261	2022-09-20
########清空回收站，删除测试数据库，表等 ##########
drop table t2;
drop table t1;
drop database  IF EXISTS db1;
