drop database  IF EXISTS  db1;
create database db1;
use db1;
SET wait_timeout=30000000;
SET ob_trx_timeout = 30000000;
SET ob_query_timeout = 30000000;
##设置相同sql_mode;
SET @@sql_mode='STRICT_TRANS_TABLES,NO_ENGINE_SUBSTITUTION,no_zero_date,no_zero_in_date,PIPES_AS_CONCAT';
##参数验证
select dayofmonth();
ERROR 42000: Incorrect parameter count in the call to native function 'dayofmonth'
select dayofmonth(" ");
dayofmonth(" ")
NULL
Warnings:
Warning	5086	Not timestamp Can not cast varchar value to timestamp type
select dayofmonth("null");
dayofmonth("null")
NULL
Warnings:
Warning	5086	Not timestamp Can not cast varchar value to timestamp type
select dayofmonth(0);
dayofmonth(0)
0
select dayofmonth(1);
dayofmonth(1)
NULL
Warnings:
Warning	5086	Not timestamp Can not cast varchar value to timestamp type
##结果不一致,ob输出工作日名称,mysql结果为null
select dayofmonth("0000-00-00");
dayofmonth("0000-00-00")
NULL
Warnings:
Warning	5086	Not timestamp Can not cast varchar value to timestamp type
select dayofmonth('1969-12-31 23:59:59.9999999');
dayofmonth('1969-12-31 23:59:59.9999999')
1
##ob和MySQL5.7结果不一致;
select dayofmonth('0000-02-29');
dayofmonth('0000-02-29')
NULL
Warnings:
Warning	5086	Not timestamp Can not cast varchar value to timestamp type
select dayofmonth(current_time(),current_timestamp());
ERROR 42000: Incorrect parameter count in the call to native function 'dayofmonth'
select dayofmonth('monday'), dayofmonth('Tuesday'), dayofmonth('Wednesday'),dayofmonth('Sunday'),dayofmonth('Thursday'),dayofmonth('Friday'),dayofmonth('Saturday');
dayofmonth('monday')	dayofmonth('Tuesday')	dayofmonth('Wednesday')	dayofmonth('Sunday')	dayofmonth('Thursday')	dayofmonth('Friday')	dayofmonth('Saturday')
NULL	NULL	NULL	NULL	NULL	NULL	NULL
Warnings:
Warning	5086	Not timestamp Can not cast varchar value to timestamp type
Warning	5086	Not timestamp Can not cast varchar value to timestamp type
Warning	5086	Not timestamp Can not cast varchar value to timestamp type
Warning	5086	Not timestamp Can not cast varchar value to timestamp type
Warning	5086	Not timestamp Can not cast varchar value to timestamp type
Warning	5086	Not timestamp Can not cast varchar value to timestamp type
Warning	5086	Not timestamp Can not cast varchar value to timestamp type
select dayofmonth('0.01.01');
dayofmonth('0.01.01')
1
select dayofmonth('9999.12.31');
dayofmonth('9999.12.31')
31
select dayofmonth(+"2022-09-05");
dayofmonth(+"2022-09-05")
5
select dayofmonth(-"2022-09-05");
dayofmonth(-"2022-09-05")
NULL
Warnings:
Warning	1292	Truncated incorrect DOUBLE value: '2022-09-05'
Warning	5086	Not timestamp Can not cast varchar value to timestamp type
select dayofmonth('a');
dayofmonth('a')
NULL
Warnings:
Warning	5086	Not timestamp Can not cast varchar value to timestamp type
select dayofmonth('@@@');
dayofmonth('@@@')
NULL
Warnings:
Warning	5086	Not timestamp Can not cast varchar value to timestamp type
select dayofmonth('#');
dayofmonth('#')
NULL
Warnings:
Warning	5086	Not timestamp Can not cast varchar value to timestamp type
select dayofmonth('""');
dayofmonth('""')
NULL
Warnings:
Warning	5086	Not timestamp Can not cast varchar value to timestamp type
select dayofmonth('_');
dayofmonth('_')
NULL
Warnings:
Warning	5086	Not timestamp Can not cast varchar value to timestamp type
select dayofmonth('false');
dayofmonth('false')
NULL
Warnings:
Warning	5086	Not timestamp Can not cast varchar value to timestamp type
select dayofmonth('true');
dayofmonth('true')
NULL
Warnings:
Warning	5086	Not timestamp Can not cast varchar value to timestamp type
select dayofmonth('2022-09-05')+4;
dayofmonth('2022-09-05')+4
9
select dayofmonth('2022-09-05')+false;
dayofmonth('2022-09-05')+false
5
select dayofmonth('2022-09-05')+true;
dayofmonth('2022-09-05')+true
6
select dayofmonth('星期一');
dayofmonth('星期一')
NULL
Warnings:
Warning	5086	Not timestamp Can not cast varchar value to timestamp type
select dayofmonth('星期一1999-12-31');
dayofmonth('星期一1999-12-31')
NULL
Warnings:
Warning	5086	Not timestamp Can not cast varchar value to timestamp type
select dayofmonth('星期一@#');
dayofmonth('星期一@#')
NULL
Warnings:
Warning	5086	Not timestamp Can not cast varchar value to timestamp type
select dayofmonth('1999-12-31星期一');
dayofmonth('1999-12-31星期一')
31
select dayofmonth(1.175494351E-38) From dual;
dayofmonth(1.175494351E-38)
0
select dayofmonth('-1970-12-31');
dayofmonth('-1970-12-31')
NULL
Warnings:
Warning	5086	Not timestamp Can not cast varchar value to timestamp type
select dayofmonth('にににににににに');
dayofmonth('にににににににに')
NULL
Warnings:
Warning	5086	Not timestamp Can not cast varchar value to timestamp type
select dayofmonth('천구백구십칠년 일월 오일');
dayofmonth('천구백구십칠년 일월 오일')
NULL
Warnings:
Warning	5086	Not timestamp Can not cast varchar value to timestamp type
select dayofmonth('一九九九零二二六');
dayofmonth('一九九九零二二六')
NULL
Warnings:
Warning	5086	Not timestamp Can not cast varchar value to timestamp type
select dayofmonth('壹玖玖捌零伍贰贰');
dayofmonth('壹玖玖捌零伍贰贰')
NULL
Warnings:
Warning	5086	Not timestamp Can not cast varchar value to timestamp type
select dayofmonth('2022-09-07')<'monday';
dayofmonth('2022-09-07')<'monday'
0
Warnings:
Warning	1292	Truncated incorrect DECIMAL value: 'monday'
select dayofmonth('2022-09-07')>'monday';
dayofmonth('2022-09-07')>'monday'
1
Warnings:
Warning	1292	Truncated incorrect DECIMAL value: 'monday'
select dayofmonth('2022-09-07') != 'Wednesday';
dayofmonth('2022-09-07') != 'Wednesday'
1
Warnings:
Warning	1292	Truncated incorrect DECIMAL value: 'Wednesday'
select dayofmonth('2022-09-07') >= 'Wednesday';
dayofmonth('2022-09-07') >= 'Wednesday'
1
Warnings:
Warning	1292	Truncated incorrect DECIMAL value: 'Wednesday'
select dayofmonth('2022-09-07') <= 'Wednesday';
dayofmonth('2022-09-07') <= 'Wednesday'
0
Warnings:
Warning	1292	Truncated incorrect DECIMAL value: 'Wednesday'
select dayofmonth('2022-09-07') = 'Wednesday';
dayofmonth('2022-09-07') = 'Wednesday'
0
Warnings:
Warning	1292	Truncated incorrect DECIMAL value: 'Wednesday'
select dayofmonth(date '2022-09-15');
dayofmonth(date '2022-09-15')
15
select dayofmonth(date '0000-00-00');
ERROR HY000: Incorrect DATE value: '0000-00-00'
select dayofmonth(date '9999-12-31');
dayofmonth(date '9999-12-31')
31
OB会显示系统时间,MySQL5.7直接报错;
select dayofmonth(time '17:01:60');
ERROR HY000: Incorrect TIME value: '17:01:60'
select dayofmonth('2022-09-15 23:59:59');
dayofmonth('2022-09-15 23:59:59')
15
select dayofmonth('2022-09-15 00:00:00');
dayofmonth('2022-09-15 00:00:00')
15
select dayofmonth('2022-09-15 00:59:59');
dayofmonth('2022-09-15 00:59:59')
15
##ob和MySQL5.7结果不一致;
select dayofmonth('1999-12-31星期1999-12-30');
dayofmonth('1999-12-31星期1999-12-30')
NULL
Warnings:
Warning	5086	Not timestamp Can not cast varchar value to timestamp type
select dayofmonth('1995.02.28')+2000000000000000;
dayofmonth('1995.02.28')+2000000000000000
2000000000000028
select dayofmonth('9999-12-31 23:59:59.999999')+0;
dayofmonth('9999-12-31 23:59:59.999999')+0
31
select dayofmonth('9999-12-31 23:59:59.999999')-0;
dayofmonth('9999-12-31 23:59:59.999999')-0
31
select dayofmonth('9999-12-31 23:59:59.999999')*1;
dayofmonth('9999-12-31 23:59:59.999999')*1
31
select dayofmonth('9999-12-31 23:59:59.999999')/1;
dayofmonth('9999-12-31 23:59:59.999999')/1
31.0000
表字符集测试
set names binary;
select dayofmonth('');
dayofmonth('')
NULL
Warnings:
Warning	5086	Not timestamp Can not cast varchar value to timestamp type
select dayofmonth('0');
dayofmonth('0')
NULL
Warnings:
Warning	5086	Not timestamp Can not cast varchar value to timestamp type
select dayofmonth(0);
dayofmonth(0)
0
select dayofmonth('+1');
dayofmonth('+1')
NULL
Warnings:
Warning	5086	Not timestamp Can not cast varchar value to timestamp type
select dayofmonth('-1');
dayofmonth('-1')
NULL
Warnings:
Warning	5086	Not timestamp Can not cast varchar value to timestamp type
select dayofmonth('-false');
dayofmonth('-false')
NULL
Warnings:
Warning	5086	Not timestamp Can not cast varchar value to timestamp type
select dayofmonth('-true');
dayofmonth('-true')
NULL
Warnings:
Warning	5086	Not timestamp Can not cast varchar value to timestamp type
select dayofmonth('null');
dayofmonth('null')
NULL
Warnings:
Warning	5086	Not timestamp Can not cast varchar value to timestamp type
select dayofmonth('1970-01-01');
dayofmonth('1970-01-01')
1
select dayofmonth('9999-12-31');
dayofmonth('9999-12-31')
31
select dayofmonth('1000-01-01');
dayofmonth('1000-01-01')
1
CREATE TABLE t1(c1 TIME ,
c2 date ,
c3 DATETIME ,
c4 TIMESTAMP DEFAULT '2000-01-01 00:00:00',
c5 YEAR ) default charset=binary;
INSERT INTO t1 VALUES('20:12:12','2000-12-12','2000-01-01 01:01:01','2001-01-01 23:59:59.9999999','2000'),
('21:12:13','2001-12-22','2001-01-02 13:01:01','2001-11-02 00:00:01.999999','2001'),
('22:12:14','2002-12-02','2002-01-03 14:01:01','2002-12-03 02:01:01.299999','2002'),
('23:12:15','2003-12-11','2003-01-04 15:01:01','2002-11-04 03:01:01.399999','2003'),
('20:22:16','2004-12-12','2004-01-05 16:01:01','2002-02-05 05:01:01.499999','2004'),
('20:32:17','2021-12-13','2010-01-06 21:01:01','2003-03-06 04:01:01.599999','2005'),
('20:12:18','2005-12-12','2000-01-07 01:01:01','2001-01-07 12:01:01.699999','2006'),
('11:12:19','2006-12-22','2011-01-08 13:01:01','2001-11-08 11:01:01.799999','2007'),
('02:12:20','2007-12-02','2012-01-09 14:01:01','2002-12-09 02:01:01.899999','2008'),
('03:12:21','2008-12-11','2013-01-10 15:01:01','2002-11-10 03:01:01.999999','2009'),
('00:22:22','2009-12-12','2010-01-11 16:01:01','2002-02-11 05:01:01.000001','2010'),
('00:32:23','2001-12-13','2010-01-12 21:01:01','2003-03-31 04:59:59.000000','2011');
select dayofmonth(c2) from t1 where c2 ='2008-12-11';
dayofmonth(c2)
11
select dayofmonth(c3) from t1 where c3 ='2010-01-12 21:01:01';
dayofmonth(c3)
12
select dayofmonth(c4) from t1 where c4 ='2001-01-01 23:59:59.9999999';
dayofmonth(c4)
2
select dayofmonth(c5) from t1 where c5 ='2011';
dayofmonth(c5)
NULL
Warnings:
Warning	5086	Not timestamp Can not cast varchar value to timestamp type
drop table t1;
SET NAMES 'utf8mb4';
select dayofmonth('');
dayofmonth('')
NULL
Warnings:
Warning	5086	Not timestamp Can not cast varchar value to timestamp type
select dayofmonth('0');
dayofmonth('0')
NULL
Warnings:
Warning	5086	Not timestamp Can not cast varchar value to timestamp type
select dayofmonth(0);
dayofmonth(0)
0
select dayofmonth('+1');
dayofmonth('+1')
NULL
Warnings:
Warning	5086	Not timestamp Can not cast varchar value to timestamp type
select dayofmonth('-1');
dayofmonth('-1')
NULL
Warnings:
Warning	5086	Not timestamp Can not cast varchar value to timestamp type
select dayofmonth('-false');
dayofmonth('-false')
NULL
Warnings:
Warning	5086	Not timestamp Can not cast varchar value to timestamp type
select dayofmonth('-true');
dayofmonth('-true')
NULL
Warnings:
Warning	5086	Not timestamp Can not cast varchar value to timestamp type
select dayofmonth('null');
dayofmonth('null')
NULL
Warnings:
Warning	5086	Not timestamp Can not cast varchar value to timestamp type
select dayofmonth('1970-01-01');
dayofmonth('1970-01-01')
1
select dayofmonth('9999-12-31');
dayofmonth('9999-12-31')
31
select dayofmonth('1000-01-01');
dayofmonth('1000-01-01')
1
CREATE TABLE t1(c1 TIME ,
c2 date ,
c3 DATETIME ,
c4 TIMESTAMP DEFAULT '2000-01-01 00:00:00',
c5 YEAR ) default charset=utf8mb4;
INSERT INTO t1 VALUES('20:12:12','2000-12-12','2000-01-01 01:01:01','2001-01-01 23:59:59.9999999','2000'),
('21:12:13','2001-12-22','2001-01-02 13:01:01','2001-11-02 00:00:01.999999','2001'),
('22:12:14','2002-12-02','2002-01-03 14:01:01','2002-12-03 02:01:01.299999','2002'),
('23:12:15','2003-12-11','2003-01-04 15:01:01','2002-11-04 03:01:01.399999','2003'),
('20:22:16','2004-12-12','2004-01-05 16:01:01','2002-02-05 05:01:01.499999','2004'),
('20:32:17','2021-12-13','2010-01-06 21:01:01','2003-03-06 04:01:01.599999','2005'),
('20:12:18','2005-12-12','2000-01-07 01:01:01','2001-01-07 12:01:01.699999','2006'),
('11:12:19','2006-12-22','2011-01-08 13:01:01','2001-11-08 11:01:01.799999','2007'),
('02:12:20','2007-12-02','2012-01-09 14:01:01','2002-12-09 02:01:01.899999','2008'),
('03:12:21','2008-12-11','2013-01-10 15:01:01','2002-11-10 03:01:01.999999','2009'),
('00:22:22','2009-12-12','2010-01-11 16:01:01','2002-02-11 05:01:01.000001','2010'),
('00:32:23','2001-12-13','2010-01-12 21:01:01','2003-03-31 04:59:59.000000','2011');
select dayofmonth(c2) from t1 where c2 ='2008-12-11';
dayofmonth(c2)
11
select dayofmonth(c3) from t1 where c3 ='2010-01-12 21:01:01';
dayofmonth(c3)
12
select dayofmonth(c4) from t1 where c4 ='2001-01-01 23:59:59.9999999';
dayofmonth(c4)
2
select dayofmonth(c5) from t1 where c5 ='2011';
dayofmonth(c5)
NULL
Warnings:
Warning	5086	Not timestamp Can not cast varchar value to timestamp type
drop table t1;
SET NAMES 'gbk';
select dayofmonth('');
dayofmonth('')
NULL
Warnings:
Warning	5086	Not timestamp Can not cast varchar value to timestamp type
select dayofmonth('0');
dayofmonth('0')
NULL
Warnings:
Warning	5086	Not timestamp Can not cast varchar value to timestamp type
select dayofmonth(0);
dayofmonth(0)
0
select dayofmonth('+1');
dayofmonth('+1')
NULL
Warnings:
Warning	5086	Not timestamp Can not cast varchar value to timestamp type
select dayofmonth('-1');
dayofmonth('-1')
NULL
Warnings:
Warning	5086	Not timestamp Can not cast varchar value to timestamp type
select dayofmonth('-false');
dayofmonth('-false')
NULL
Warnings:
Warning	5086	Not timestamp Can not cast varchar value to timestamp type
select dayofmonth('-true');
dayofmonth('-true')
NULL
Warnings:
Warning	5086	Not timestamp Can not cast varchar value to timestamp type
select dayofmonth('null');
dayofmonth('null')
NULL
Warnings:
Warning	5086	Not timestamp Can not cast varchar value to timestamp type
select dayofmonth('1970-01-01');
dayofmonth('1970-01-01')
1
select dayofmonth('9999-12-31');
dayofmonth('9999-12-31')
31
select dayofmonth('1000-01-01');
dayofmonth('1000-01-01')
1
CREATE TABLE t1(c1 TIME ,
c2 date ,
c3 DATETIME ,
c4 TIMESTAMP DEFAULT '2000-01-01 00:00:00',
c5 YEAR ) default charset=gbk;
INSERT INTO t1 VALUES('20:12:12','2000-12-12','2000-01-01 01:01:01','2001-01-01 23:59:59.9999999','2000'),
('21:12:13','2001-12-22','2001-01-02 13:01:01','2001-11-02 00:00:01.999999','2001'),
('22:12:14','2002-12-02','2002-01-03 14:01:01','2002-12-03 02:01:01.299999','2002'),
('23:12:15','2003-12-11','2003-01-04 15:01:01','2002-11-04 03:01:01.399999','2003'),
('20:22:16','2004-12-12','2004-01-05 16:01:01','2002-02-05 05:01:01.499999','2004'),
('20:32:17','2021-12-13','2010-01-06 21:01:01','2003-03-06 04:01:01.599999','2005'),
('20:12:18','2005-12-12','2000-01-07 01:01:01','2001-01-07 12:01:01.699999','2006'),
('11:12:19','2006-12-22','2011-01-08 13:01:01','2001-11-08 11:01:01.799999','2007'),
('02:12:20','2007-12-02','2012-01-09 14:01:01','2002-12-09 02:01:01.899999','2008'),
('03:12:21','2008-12-11','2013-01-10 15:01:01','2002-11-10 03:01:01.999999','2009'),
('00:22:22','2009-12-12','2010-01-11 16:01:01','2002-02-11 05:01:01.000001','2010'),
('00:32:23','2001-12-13','2010-01-12 21:01:01','2003-03-31 04:59:59.000000','2011');
select dayofmonth(c2) from t1 where c2 ='2008-12-11';
dayofmonth(c2)
11
select dayofmonth(c3) from t1 where c3 ='2010-01-12 21:01:01';
dayofmonth(c3)
12
select dayofmonth(c4) from t1 where c4 ='2001-01-01 23:59:59.9999999';
dayofmonth(c4)
2
select dayofmonth(c5) from t1 where c5 ='2011';
dayofmonth(c5)
NULL
Warnings:
Warning	5086	Not timestamp Can not cast varchar value to timestamp type
drop table t1;
SET NAMES 'gb18030';
select dayofmonth('');
dayofmonth('')
NULL
Warnings:
Warning	5086	Not timestamp Can not cast varchar value to timestamp type
select dayofmonth('0');
dayofmonth('0')
NULL
Warnings:
Warning	5086	Not timestamp Can not cast varchar value to timestamp type
select dayofmonth(0);
dayofmonth(0)
0
select dayofmonth('+1');
dayofmonth('+1')
NULL
Warnings:
Warning	5086	Not timestamp Can not cast varchar value to timestamp type
select dayofmonth('-1');
dayofmonth('-1')
NULL
Warnings:
Warning	5086	Not timestamp Can not cast varchar value to timestamp type
select dayofmonth('-false');
dayofmonth('-false')
NULL
Warnings:
Warning	5086	Not timestamp Can not cast varchar value to timestamp type
select dayofmonth('-true');
dayofmonth('-true')
NULL
Warnings:
Warning	5086	Not timestamp Can not cast varchar value to timestamp type
select dayofmonth('null');
dayofmonth('null')
NULL
Warnings:
Warning	5086	Not timestamp Can not cast varchar value to timestamp type
select dayofmonth('1970-01-01');
dayofmonth('1970-01-01')
1
select dayofmonth('9999-12-31');
dayofmonth('9999-12-31')
31
select dayofmonth('1000-01-01');
dayofmonth('1000-01-01')
1
CREATE TABLE t1(c1 TIME ,
c2 date ,
c3 DATETIME ,
c4 TIMESTAMP DEFAULT '2000-01-01 00:00:00',
c5 YEAR ) default charset=gb18030;
INSERT INTO t1 VALUES('20:12:12','2000-12-12','2000-01-01 01:01:01','2001-01-01 23:59:59.9999999','2000'),
('21:12:13','2001-12-22','2001-01-02 13:01:01','2001-11-02 00:00:01.999999','2001'),
('22:12:14','2002-12-02','2002-01-03 14:01:01','2002-12-03 02:01:01.299999','2002'),
('23:12:15','2003-12-11','2003-01-04 15:01:01','2002-11-04 03:01:01.399999','2003'),
('20:22:16','2004-12-12','2004-01-05 16:01:01','2002-02-05 05:01:01.499999','2004'),
('20:32:17','2021-12-13','2010-01-06 21:01:01','2003-03-06 04:01:01.599999','2005'),
('20:12:18','2005-12-12','2000-01-07 01:01:01','2001-01-07 12:01:01.699999','2006'),
('11:12:19','2006-12-22','2011-01-08 13:01:01','2001-11-08 11:01:01.799999','2007'),
('02:12:20','2007-12-02','2012-01-09 14:01:01','2002-12-09 02:01:01.899999','2008'),
('03:12:21','2008-12-11','2013-01-10 15:01:01','2002-11-10 03:01:01.999999','2009'),
('00:22:22','2009-12-12','2010-01-11 16:01:01','2002-02-11 05:01:01.000001','2010'),
('00:32:23','2001-12-13','2010-01-12 21:01:01','2003-03-31 04:59:59.000000','2011');
select dayofmonth(c2) from t1 where c2 ='2008-12-11';
dayofmonth(c2)
11
select dayofmonth(c3) from t1 where c3 ='2010-01-12 21:01:01';
dayofmonth(c3)
12
select dayofmonth(c4) from t1 where c4 ='2001-01-01 23:59:59.9999999';
dayofmonth(c4)
2
select dayofmonth(c5) from t1 where c5 ='2011';
dayofmonth(c5)
NULL
Warnings:
Warning	5086	Not timestamp Can not cast varchar value to timestamp type
drop table t1;
##数据类型验证
##TINYINT,SMALLINT,MEDIUMINT,int,BIGINT,FLOAT,DOUBLE,DECIMAL
create table t1(c1 TINYINT,c2 SMALLINT,c3 MEDIUMINT,c4 int,c5 BIGINT,c6 FLOAT,c7 DOUBLE,c8 DECIMAL(5,2));
insert into t1 values(22,621,0721,0621,1221,0621.221,0621.01,0621.02);
insert into t1 values(23,622,0722,0622,1222,0622.221,0622.01,0622.02);
insert into t1 values(24,null,null,null,null,null,null,null);
select * from t1 ORDER by c1 asc;
c1	c2	c3	c4	c5	c6	c7	c8
22	621	721	621	1221	621.221	621.01	621.02
23	622	722	622	1222	622.221	622.01	622.02
24	NULL	NULL	NULL	NULL	NULL	NULL	NULL
select * from t1 ORDER by dayofmonth(c1) asc;
c1	c2	c3	c4	c5	c6	c7	c8
22	621	721	621	1221	621.221	621.01	621.02
23	622	722	622	1222	622.221	622.01	622.02
24	NULL	NULL	NULL	NULL	NULL	NULL	NULL
Warnings:
Warning	5086	Not timestamp Can not cast varchar value to timestamp type
Warning	5086	Not timestamp Can not cast varchar value to timestamp type
Warning	5086	Not timestamp Can not cast varchar value to timestamp type
select dayofmonth(c2+1) from t1;
dayofmonth(c2+1)
22
23
NULL
select dayofmonth(c2-1) from t1;
dayofmonth(c2-1)
20
21
NULL
select dayofmonth(c2*1) from t1;
dayofmonth(c2*1)
21
22
NULL
select dayofmonth(c2/1) from t1;
dayofmonth(c2/1)
21
22
NULL
select c1,dayofmonth(c1) from t1;
c1	dayofmonth(c1)
22	NULL
23	NULL
24	NULL
Warnings:
Warning	5086	Not timestamp Can not cast varchar value to timestamp type
Warning	5086	Not timestamp Can not cast varchar value to timestamp type
Warning	5086	Not timestamp Can not cast varchar value to timestamp type
select c2,dayofmonth(c2) from t1;
c2	dayofmonth(c2)
621	21
622	22
NULL	NULL
select c3,dayofmonth(c3) from t1;
c3	dayofmonth(c3)
721	21
722	22
NULL	NULL
select c4,dayofmonth(c4) from t1;
c4	dayofmonth(c4)
621	21
622	22
NULL	NULL
select c5,dayofmonth(c5) from t1;
c5	dayofmonth(c5)
1221	21
1222	22
NULL	NULL
select c6,dayofmonth(c6) from t1;
c6	dayofmonth(c6)
621.221	21
622.221	22
NULL	NULL
select c7,dayofmonth(c7) from t1;
c7	dayofmonth(c7)
621.01	21
622.01	22
NULL	NULL
select c8,dayofmonth(c8) from t1;
c8	dayofmonth(c8)
621.02	21
622.02	22
NULL	NULL
SELECT * FROM t1 WHERE dayofmonth(c2) ORDER by c1 asc;
c1	c2	c3	c4	c5	c6	c7	c8
22	621	721	621	1221	621.221	621.01	621.02
23	622	722	622	1222	622.221	622.01	622.02
drop table t1;
##CHAR,VARCHAR,TINYBLOB,TINYTEXT,BLOB,TEXT,MEDIUMBLOB,MEDIUMTEXT,LONGBLOB,LONGTEXT
create table t1(c1 CHAR(20),c2 VARCHAR(50),c3 TINYBLOB,c4 TINYTEXT,c5 BLOB,c6 TEXT,c7 MEDIUMBLOB,c8 MEDIUMTEXT,c9 LONGBLOB,c10 LONGTEXT);
insert into t1 values('5好好2','','疯为来','#啊啊#','大懂','18','2019-01-12','21:00:00','2018-11-13 17:16:25','2015-07-05 20:18:18');
insert into t1 values('上的','','撒法发','￥@#','发送方','59','2019-05-23','11:29:29','2012-12-19 01:59:03','2008-05-13 10:25:19');
insert into t1 values('房贷首付','','阿斯蒂芬','#@#@','咳咳咳','','2020-01-07','13:59:12','2020-01-07 13:59:59','2020-09-23 11:22:33');
insert into t1 values('ADK','','反馈卡','','覆盖掉开发','','1995-01-07','23:59:59','1995-12-07 18:59:59','1998-09-23 11:22:33');
insert into t1 values('大苏','','sss','99mmhn','222手动','so','2010-05-09','07:59:19','2011-11-01 23:59:59','2015-07-21 10:11:23');
select c1,dayofmonth(c1) from t1;
c1	dayofmonth(c1)
5好好2	NULL
上的	NULL
房贷首付	NULL
ADK	NULL
大苏	NULL
Warnings:
Warning	5086	Not timestamp Can not cast varchar value to timestamp type
Warning	5086	Not timestamp Can not cast varchar value to timestamp type
Warning	5086	Not timestamp Can not cast varchar value to timestamp type
Warning	5086	Not timestamp Can not cast varchar value to timestamp type
Warning	5086	Not timestamp Can not cast varchar value to timestamp type
select c2,dayofmonth(c2) from t1;
c2	dayofmonth(c2)
	NULL
	NULL
	NULL
	NULL
	NULL
Warnings:
Warning	5086	Not timestamp Can not cast varchar value to timestamp type
Warning	5086	Not timestamp Can not cast varchar value to timestamp type
Warning	5086	Not timestamp Can not cast varchar value to timestamp type
Warning	5086	Not timestamp Can not cast varchar value to timestamp type
Warning	5086	Not timestamp Can not cast varchar value to timestamp type
select c3,dayofmonth(c3) from t1;
c3	dayofmonth(c3)
疯为来	NULL
撒法发	NULL
阿斯蒂芬	NULL
反馈卡	NULL
sss	NULL
Warnings:
Warning	5086	Not timestamp Can not cast varchar value to timestamp type
Warning	5086	Not timestamp Can not cast varchar value to timestamp type
Warning	5086	Not timestamp Can not cast varchar value to timestamp type
Warning	5086	Not timestamp Can not cast varchar value to timestamp type
Warning	5086	Not timestamp Can not cast varchar value to timestamp type
select c4,dayofmonth(c4) from t1;
c4	dayofmonth(c4)
#啊啊#	NULL
￥@#	NULL
#@#@	NULL
	NULL
99mmhn	NULL
Warnings:
Warning	5086	Not timestamp Can not cast varchar value to timestamp type
Warning	5086	Not timestamp Can not cast varchar value to timestamp type
Warning	5086	Not timestamp Can not cast varchar value to timestamp type
Warning	5086	Not timestamp Can not cast varchar value to timestamp type
Warning	5086	Not timestamp Can not cast varchar value to timestamp type
select c5,dayofmonth(c5) from t1;
c5	dayofmonth(c5)
大懂	NULL
发送方	NULL
咳咳咳	NULL
覆盖掉开发	NULL
222手动	NULL
Warnings:
Warning	5086	Not timestamp Can not cast varchar value to timestamp type
Warning	5086	Not timestamp Can not cast varchar value to timestamp type
Warning	5086	Not timestamp Can not cast varchar value to timestamp type
Warning	5086	Not timestamp Can not cast varchar value to timestamp type
Warning	5086	Not timestamp Can not cast varchar value to timestamp type
select c6,dayofmonth(c6) from t1;
c6	dayofmonth(c6)
18	NULL
59	NULL
	NULL
	NULL
so	NULL
Warnings:
Warning	5086	Not timestamp Can not cast varchar value to timestamp type
Warning	5086	Not timestamp Can not cast varchar value to timestamp type
Warning	5086	Not timestamp Can not cast varchar value to timestamp type
Warning	5086	Not timestamp Can not cast varchar value to timestamp type
Warning	5086	Not timestamp Can not cast varchar value to timestamp type
select c7,dayofmonth(c7) from t1;
c7	dayofmonth(c7)
2019-01-12	12
2019-05-23	23
2020-01-07	7
1995-01-07	7
2010-05-09	9
select c8,dayofmonth(c8) from t1;
c8	dayofmonth(c8)
21:00:00	0
11:29:29	NULL
13:59:12	NULL
23:59:59	NULL
07:59:19	NULL
Warnings:
Warning	5086	Not timestamp Can not cast varchar value to timestamp type
Warning	5086	Not timestamp Can not cast varchar value to timestamp type
Warning	5086	Not timestamp Can not cast varchar value to timestamp type
Warning	5086	Not timestamp Can not cast varchar value to timestamp type
select c9,dayofmonth(c9) from t1;
c9	dayofmonth(c9)
2018-11-13 17:16:25	13
2012-12-19 01:59:03	19
2020-01-07 13:59:59	7
1995-12-07 18:59:59	7
2011-11-01 23:59:59	1
select c10,dayofmonth(c10) from t1;
c10	dayofmonth(c10)
2015-07-05 20:18:18	5
2008-05-13 10:25:19	13
2020-09-23 11:22:33	23
1998-09-23 11:22:33	23
2015-07-21 10:11:23	21
drop table t1;
## TIME,date,DATETIME,TIMESTAMP,YEAR
CREATE TABLE t1(c1 TIME ,
c2 date ,
c3 DATETIME ,
c4 TIMESTAMP DEFAULT '2000-01-01 00:00:00',
c5 YEAR ) ;
INSERT INTO t1 VALUES('20:12:12','2000-12-12','2000-01-01 01:01:01','2001-01-01 23:59:59.9999999','2000'),
('21:12:13','2001-12-22','2001-01-02 13:01:01','2001-11-02 00:00:01.999999','2001'),
('22:12:14','2002-12-02','2002-01-03 14:01:01','2002-12-03 02:01:01.299999','2002'),
('23:12:15','2003-12-11','2003-01-04 15:01:01','2002-11-04 03:01:01.399999','2003'),
('20:22:16','2004-12-12','2004-01-05 16:01:01','2002-02-05 05:01:01.499999','2004'),
('20:32:17','2021-12-13','2010-01-06 21:01:01','2003-03-06 04:01:01.599999','2005'),
('20:12:18','2005-12-12','2000-01-07 01:01:01','2001-01-07 12:01:01.699999','2006'),
('11:12:19','2006-12-22','2011-01-08 13:01:01','2001-11-08 11:01:01.799999','2007'),
('02:12:20','2007-12-02','2012-01-09 14:01:01','2002-12-09 02:01:01.899999','2008'),
('03:12:21','2008-12-11','2013-01-10 15:01:01','2002-11-10 03:01:01.999999','2009'),
('00:22:22','2009-12-12','2010-01-11 16:01:01','2002-02-11 05:01:01.000001','2010'),
('00:32:23','2001-12-13','2010-01-12 21:01:01','2003-03-31 04:59:59.000000','2011');
select c2,dayofmonth(c2) from t1;
c2	dayofmonth(c2)
2000-12-12	12
2001-12-22	22
2002-12-02	2
2003-12-11	11
2004-12-12	12
2021-12-13	13
2005-12-12	12
2006-12-22	22
2007-12-02	2
2008-12-11	11
2009-12-12	12
2001-12-13	13
select c3,dayofmonth(c3) from t1;
c3	dayofmonth(c3)
2000-01-01 01:01:01	1
2001-01-02 13:01:01	2
2002-01-03 14:01:01	3
2003-01-04 15:01:01	4
2004-01-05 16:01:01	5
2010-01-06 21:01:01	6
2000-01-07 01:01:01	7
2011-01-08 13:01:01	8
2012-01-09 14:01:01	9
2013-01-10 15:01:01	10
2010-01-11 16:01:01	11
2010-01-12 21:01:01	12
select c4,dayofmonth(c4) from t1;
c4	dayofmonth(c4)
2001-01-02 00:00:00	2
2001-11-02 00:00:02	2
2002-12-03 02:01:01	3
2002-11-04 03:01:01	4
2002-02-05 05:01:01	5
2003-03-06 04:01:02	6
2001-01-07 12:01:02	7
2001-11-08 11:01:02	8
2002-12-09 02:01:02	9
2002-11-10 03:01:02	10
2002-02-11 05:01:01	11
2003-03-31 04:59:59	31
select c5,dayofmonth(c5) from t1;
c5	dayofmonth(c5)
2000	NULL
2001	NULL
2002	NULL
2003	NULL
2004	NULL
2005	NULL
2006	NULL
2007	NULL
2008	NULL
2009	NULL
2010	NULL
2011	NULL
Warnings:
Warning	5086	Not timestamp Can not cast varchar value to timestamp type
Warning	5086	Not timestamp Can not cast varchar value to timestamp type
Warning	5086	Not timestamp Can not cast varchar value to timestamp type
Warning	5086	Not timestamp Can not cast varchar value to timestamp type
Warning	5086	Not timestamp Can not cast varchar value to timestamp type
Warning	5086	Not timestamp Can not cast varchar value to timestamp type
Warning	5086	Not timestamp Can not cast varchar value to timestamp type
Warning	5086	Not timestamp Can not cast varchar value to timestamp type
Warning	5086	Not timestamp Can not cast varchar value to timestamp type
Warning	5086	Not timestamp Can not cast varchar value to timestamp type
Warning	5086	Not timestamp Can not cast varchar value to timestamp type
Warning	5086	Not timestamp Can not cast varchar value to timestamp type
drop table t1;
##运算符验证
##算数运算符
select +dayofmonth('2022-09-15');
+dayofmonth('2022-09-15')
15
select -dayofmonth('2022-09-15');
-dayofmonth('2022-09-15')
-15
select dayofmonth('2022-09-15')+1;
dayofmonth('2022-09-15')+1
16
select dayofmonth('2022-09-15')-0;
dayofmonth('2022-09-15')-0
15
select dayofmonth('2022-09-15')+9999999999999999999;
dayofmonth('2022-09-15')+9999999999999999999
10000000000000000014
select dayofmonth('2022-09-15')-9999999999999999999;
ERROR 22003: BIGINT UNSIGNED value is out of range in ''(15 - 9999999999999999999)''
select dayofmonth('2022-09-15')-20210618;
dayofmonth('2022-09-15')-20210618
-20210603
select dayofmonth('2022-09-15')-'a';
dayofmonth('2022-09-15')-'a'
15
Warnings:
Warning	1292	Truncated incorrect DOUBLE value: 'a'
select dayofmonth('2022-09-15')+'bb';
dayofmonth('2022-09-15')+'bb'
15
Warnings:
Warning	1292	Truncated incorrect DOUBLE value: 'bb'
select dayofmonth('2022-09-15');
dayofmonth('2022-09-15')
15
select dayofmonth('2022-09-15')+'2020-06-17';
dayofmonth('2022-09-15')+'2020-06-17'
2035
Warnings:
Warning	1292	Truncated incorrect DOUBLE value: '2020-06-17'
select dayofmonth('2022-09-15')+dayofmonth('2022-09-15');
dayofmonth('2022-09-15')+dayofmonth('2022-09-15')
30
select dayofmonth('2022-09-15')+dayofmonth('2022-09-15');
dayofmonth('2022-09-15')+dayofmonth('2022-09-15')
30
select dayofmonth('2022-09-15')-'2020-06-17';
dayofmonth('2022-09-15')-'2020-06-17'
-2005
Warnings:
Warning	1292	Truncated incorrect DOUBLE value: '2020-06-17'
select 1+dayofmonth('2022-09-15');
1+dayofmonth('2022-09-15')
16
select 1-dayofmonth('2022-09-15');
1-dayofmonth('2022-09-15')
-14
select 20200913-dayofmonth('2022-09-15');
20200913-dayofmonth('2022-09-15')
20200898
select 20200913*dayofmonth('2022-09-15');
20200913*dayofmonth('2022-09-15')
303013695
select 20200913/dayofmonth('2022-09-15');
20200913/dayofmonth('2022-09-15')
1346727.5333
select 20200913%dayofmonth('2022-09-15');
20200913%dayofmonth('2022-09-15')
8
select 20200913 div dayofmonth('2022-09-15');
20200913 div dayofmonth('2022-09-15')
1346727
select 20200913 mod dayofmonth('2022-09-15');
20200913 mod dayofmonth('2022-09-15')
8
select dayofmonth('2022-09-15')*0;
dayofmonth('2022-09-15')*0
0
select dayofmonth('2022-09-15')*10;
dayofmonth('2022-09-15')*10
150
select dayofmonth('2022-09-15')*'a';
dayofmonth('2022-09-15')*'a'
0
Warnings:
Warning	1292	Truncated incorrect DOUBLE value: 'a'
select dayofmonth('2022-09-15')*'2020-06-17';
dayofmonth('2022-09-15')*'2020-06-17'
30300
Warnings:
Warning	1292	Truncated incorrect DOUBLE value: '2020-06-17'
select (dayofmonth('2022-09-15')+9)*1000;
(dayofmonth('2022-09-15')+9)*1000
24000
select (dayofmonth('2022-09-15')+9)*-1000.632;
(dayofmonth('2022-09-15')+9)*-1000.632
-24015.168
select dayofmonth('2022-09-15')/0;
dayofmonth('2022-09-15')/0
NULL
select dayofmonth('2022-09-15')/10;
dayofmonth('2022-09-15')/10
1.5000
select dayofmonth('2022-09-15')/'a';
dayofmonth('2022-09-15')/'a'
NULL
Warnings:
Warning	1292	Truncated incorrect DOUBLE value: 'a'
select dayofmonth('2022-09-15')/'2020-06-17';
dayofmonth('2022-09-15')/'2020-06-17'
0.007425742574257425
Warnings:
Warning	1292	Truncated incorrect DOUBLE value: '2020-06-17'
select (dayofmonth('2022-09-15')+1)/50.55;
(dayofmonth('2022-09-15')+1)/50.55
0.3165
select (dayofmonth('2022-09-15')+1)/-50.55;
(dayofmonth('2022-09-15')+1)/-50.55
-0.3165
select dayofmonth('2022-09-15')%0;
dayofmonth('2022-09-15')%0
NULL
select dayofmonth('2022-09-15')%10;
dayofmonth('2022-09-15')%10
5
select dayofmonth('2022-09-15')%'a';
dayofmonth('2022-09-15')%'a'
NULL
Warnings:
Warning	1292	Truncated incorrect DOUBLE value: 'a'
select dayofmonth('2022-09-15')%'2020-06-17';
dayofmonth('2022-09-15')%'2020-06-17'
15
Warnings:
Warning	1292	Truncated incorrect DOUBLE value: '2020-06-17'
select (dayofmonth('2022-09-15')+0)%0;
(dayofmonth('2022-09-15')+0)%0
NULL
select (dayofmonth('2022-09-15')+0)%2;
(dayofmonth('2022-09-15')+0)%2
1
select (dayofmonth('2022-09-15')+0)%3.2;
(dayofmonth('2022-09-15')+0)%3.2
2.2
select dayofmonth('2022-09-15')DIV0;
DIV0
15
select dayofmonth('2022-09-15')DIV10;
DIV10
15
select dayofmonth('2022-09-15')DIV'a';
dayofmonth('2022-09-15')DIV'a'
NULL
Warnings:
Warning	1292	Truncated incorrect DECIMAL value: 'a'
select dayofmonth('2022-09-15')DIV'2020-06-17';
dayofmonth('2022-09-15')DIV'2020-06-17'
0
Warnings:
Warning	1292	Truncated incorrect DECIMAL value: '2020-06-17'
select (dayofmonth('2022-09-15')+0) DIV -8;
(dayofmonth('2022-09-15')+0) DIV -8
-1
select dayofmonth('2022-09-15') MOD 0;
dayofmonth('2022-09-15') MOD 0
NULL
select dayofmonth('2022-09-15') MOD 10;
dayofmonth('2022-09-15') MOD 10
5
select dayofmonth('2022-09-15') MOD 'a';
dayofmonth('2022-09-15') MOD 'a'
NULL
Warnings:
Warning	1292	Truncated incorrect DOUBLE value: 'a'
select dayofmonth('2022-09-15') MOD '2020-06-17';
dayofmonth('2022-09-15') MOD '2020-06-17'
15
Warnings:
Warning	1292	Truncated incorrect DOUBLE value: '2020-06-17'
select dayofmonth('2022-09-15') || dayofmonth('2022-09-15')+0;
dayofmonth('2022-09-15') || dayofmonth('2022-09-15')+0
1515
select dayofmonth('2022-09-15')+0+1000;
dayofmonth('2022-09-15')+0+1000
1015
select dayofmonth('2022-09-15')-1-1000;
dayofmonth('2022-09-15')-1-1000
-986
select (dayofmonth('2022-09-15')-1)*1000;
(dayofmonth('2022-09-15')-1)*1000
14000
select (dayofmonth('2022-09-15')-1)/1000;
(dayofmonth('2022-09-15')-1)/1000
0.0140
select (dayofmonth('2022-09-15')-1)%1000;
(dayofmonth('2022-09-15')-1)%1000
14
select (dayofmonth('2022-09-15')-1) DIV 1000;
(dayofmonth('2022-09-15')-1) DIV 1000
0
select (dayofmonth('2022-09-15')-1) MOD 1000;
(dayofmonth('2022-09-15')-1) MOD 1000
14
select dayofmonth('2022-09-15')|| dayofmonth('2022-09-15');
dayofmonth('2022-09-15')|| dayofmonth('2022-09-15')
1515
select dayofmonth('2022-09-15')|| 'a';
dayofmonth('2022-09-15')|| 'a'
15a
select dayofmonth('2022-09-15')|| 1000;
dayofmonth('2022-09-15')|| 1000
151000
select dayofmonth('2022-09-15')|| '2020-06-17';
dayofmonth('2022-09-15')|| '2020-06-17'
152020-06-17
select dayofmonth('2022-09-15')+1|| 'b';
dayofmonth('2022-09-15')+1|| 'b'
16
Warnings:
Warning	1292	Truncated incorrect DOUBLE value: '1b'
select dayofmonth('2022-09-15')+1|| DATE_FORMAT(dayofmonth('2022-09-15'),GET_FORMAT(DATETIME,'EUR'));
dayofmonth('2022-09-15')+1|| DATE_FORMAT(dayofmonth('2022-09-15'),GET_FORMAT(DATETIME,'EUR'))
NULL
select dayofmonth('2022-09-15')+1|| dayofmonth('2022-09-15')+1;
dayofmonth('2022-09-15')+1|| dayofmonth('2022-09-15')+1
131
select dayofmonth('2022-09-15')+1|| dayofmonth('2022-09-15')+1;
dayofmonth('2022-09-15')+1|| dayofmonth('2022-09-15')+1
131
select dayofmonth('2022-09-15')+1+ dayofmonth('2022-09-15')+1;
dayofmonth('2022-09-15')+1+ dayofmonth('2022-09-15')+1
32
select dayofmonth('2022-09-15')+1- dayofmonth('2022-09-15')+1;
dayofmonth('2022-09-15')+1- dayofmonth('2022-09-15')+1
2
select (dayofmonth('2022-09-15')+1)*(dayofmonth('2022-09-15')+1);
(dayofmonth('2022-09-15')+1)*(dayofmonth('2022-09-15')+1)
256
select (dayofmonth('2022-09-15')+1)/(dayofmonth('2022-09-15')+1);
(dayofmonth('2022-09-15')+1)/(dayofmonth('2022-09-15')+1)
1.0000
select (dayofmonth('2022-09-15')+1)%(dayofmonth('2022-09-15')+1);
(dayofmonth('2022-09-15')+1)%(dayofmonth('2022-09-15')+1)
0
select (dayofmonth('2022-09-15')+1) MOD (dayofmonth('2022-09-15')+1);
(dayofmonth('2022-09-15')+1) MOD (dayofmonth('2022-09-15')+1)
0
select (dayofmonth('2022-09-15')+1) div (dayofmonth('2022-09-15')+1);
(dayofmonth('2022-09-15')+1) div (dayofmonth('2022-09-15')+1)
1
select dayofmonth('2022-09-15')+ dayofmonth('2022-09-15');
dayofmonth('2022-09-15')+ dayofmonth('2022-09-15')
30
select dayofmonth('2022-09-15')- dayofmonth('2022-09-15');
dayofmonth('2022-09-15')- dayofmonth('2022-09-15')
0
select dayofmonth('2022-09-15')*dayofmonth('2022-09-15');
dayofmonth('2022-09-15')*dayofmonth('2022-09-15')
225
select dayofmonth('2022-09-15')/dayofmonth('2022-09-15');
dayofmonth('2022-09-15')/dayofmonth('2022-09-15')
1.0000
select dayofmonth('2022-09-15')%dayofmonth('2022-09-15');
dayofmonth('2022-09-15')%dayofmonth('2022-09-15')
0
select dayofmonth('2022-09-15') MOD dayofmonth('2022-09-15');
dayofmonth('2022-09-15') MOD dayofmonth('2022-09-15')
0
select dayofmonth('2022-09-15') div dayofmonth('2022-09-15');
dayofmonth('2022-09-15') div dayofmonth('2022-09-15')
1
select dayofmonth('2022-09-15')+dayofmonth('2022-09-15');
dayofmonth('2022-09-15')+dayofmonth('2022-09-15')
30
select dayofmonth('2022-09-15')+GET_FORMAT(DATETIME,'EUR');
dayofmonth('2022-09-15')+GET_FORMAT(DATETIME,'EUR')
15
Warnings:
Warning	1292	Truncated incorrect DOUBLE value: '%Y-%m-%d %H.%i.%s'
select dayofmonth('2022-09-15')-GET_FORMAT(DATETIME,'EUR');
dayofmonth('2022-09-15')-GET_FORMAT(DATETIME,'EUR')
15
Warnings:
Warning	1292	Truncated incorrect DOUBLE value: '%Y-%m-%d %H.%i.%s'
select dayofmonth('2022-09-15')=dayofmonth('2022-09-15');
dayofmonth('2022-09-15')=dayofmonth('2022-09-15')
1
select dayofmonth('2022-09-15')=dayofmonth('2022-09-15')+1;
dayofmonth('2022-09-15')=dayofmonth('2022-09-15')+1
0
select dayofmonth('2022-09-15')+1=dayofmonth('2022-09-15')+1;
dayofmonth('2022-09-15')+1=dayofmonth('2022-09-15')+1
1
select dayofmonth('2022-09-15')<>dayofmonth('2022-09-15');
dayofmonth('2022-09-15')<>dayofmonth('2022-09-15')
0
select dayofmonth('2022-09-15')<>dayofmonth('2022-09-15')+1;
dayofmonth('2022-09-15')<>dayofmonth('2022-09-15')+1
1
select dayofmonth('2022-09-15')+1<>dayofmonth('2022-09-15')+1;
dayofmonth('2022-09-15')+1<>dayofmonth('2022-09-15')+1
0
select dayofmonth('2022-09-15')<=>dayofmonth('2022-09-15');
dayofmonth('2022-09-15')<=>dayofmonth('2022-09-15')
1
select dayofmonth('2022-09-15')<=>dayofmonth('2022-09-15')+1;
dayofmonth('2022-09-15')<=>dayofmonth('2022-09-15')+1
0
select dayofmonth('2022-09-15')+1<=>dayofmonth('2022-09-15')+1;
dayofmonth('2022-09-15')+1<=>dayofmonth('2022-09-15')+1
1
select dayofmonth('2022-09-15')<dayofmonth('2022-09-15');
dayofmonth('2022-09-15')<dayofmonth('2022-09-15')
0
select dayofmonth('2022-09-15')<dayofmonth('2022-09-15')+1;
dayofmonth('2022-09-15')<dayofmonth('2022-09-15')+1
1
select dayofmonth('2022-09-15')+1<dayofmonth('2022-09-15')+1;
dayofmonth('2022-09-15')+1<dayofmonth('2022-09-15')+1
0
select dayofmonth('2022-09-15')<=dayofmonth('2022-09-15');
dayofmonth('2022-09-15')<=dayofmonth('2022-09-15')
1
select dayofmonth('2022-09-15')<=dayofmonth('2022-09-15')+1;
dayofmonth('2022-09-15')<=dayofmonth('2022-09-15')+1
1
select dayofmonth('2022-09-15')+1<=dayofmonth('2022-09-15')+1;
dayofmonth('2022-09-15')+1<=dayofmonth('2022-09-15')+1
1
select dayofmonth('2022-09-15')>=dayofmonth('2022-09-15');
dayofmonth('2022-09-15')>=dayofmonth('2022-09-15')
1
select dayofmonth('2022-09-15')>=dayofmonth('2022-09-15')+1;
dayofmonth('2022-09-15')>=dayofmonth('2022-09-15')+1
0
select dayofmonth('2022-09-15')+1>=dayofmonth('2022-09-15')+1;
dayofmonth('2022-09-15')+1>=dayofmonth('2022-09-15')+1
1
select dayofmonth('2022-09-15')>dayofmonth('2022-09-15');
dayofmonth('2022-09-15')>dayofmonth('2022-09-15')
0
select dayofmonth('2022-09-15')>dayofmonth('2022-09-15')+1;
dayofmonth('2022-09-15')>dayofmonth('2022-09-15')+1
0
select dayofmonth('2022-09-15')+1>dayofmonth('2022-09-15')+1;
dayofmonth('2022-09-15')+1>dayofmonth('2022-09-15')+1
0
select dayofmonth('2022-09-15') between dayofmonth('2022-09-15')-1 and dayofmonth('2022-09-15')+9;
dayofmonth('2022-09-15') between dayofmonth('2022-09-15')-1 and dayofmonth('2022-09-15')+9
1
select dayofmonth('2022-09-15') between dayofmonth('2022-09-15')+1 and dayofmonth('2022-09-15')+9;
dayofmonth('2022-09-15') between dayofmonth('2022-09-15')+1 and dayofmonth('2022-09-15')+9
0
select dayofmonth('2022-09-15')-1 between dayofmonth('2022-09-15') and dayofmonth('2022-09-15')+9;
dayofmonth('2022-09-15')-1 between dayofmonth('2022-09-15') and dayofmonth('2022-09-15')+9
0
select dayofmonth('2022-09-15')+7 between dayofmonth('2022-09-15')+1 and dayofmonth('2022-09-15')+9;
dayofmonth('2022-09-15')+7 between dayofmonth('2022-09-15')+1 and dayofmonth('2022-09-15')+9
1
select dayofmonth('2022-09-15')-20200912 in (1,2,3,4,5);
dayofmonth('2022-09-15')-20200912 in (1,2,3,4,5)
0
select dayofmonth('2022-09-15') in (11,12,13,14,15);
dayofmonth('2022-09-15') in (11,12,13,14,15)
1
select dayofmonth('2022-09-15') in (dayofmonth('2022-09-15'),dayofmonth('2022-09-15')+1,dayofmonth('2022-09-15')+2);
dayofmonth('2022-09-15') in (dayofmonth('2022-09-15'),dayofmonth('2022-09-15')+1,dayofmonth('2022-09-15')+2)
1
select dayofmonth('2022-09-15')-1 in (dayofmonth('2022-09-15'),dayofmonth('2022-09-15')+1,dayofmonth('2022-09-15')+2);
dayofmonth('2022-09-15')-1 in (dayofmonth('2022-09-15'),dayofmonth('2022-09-15')+1,dayofmonth('2022-09-15')+2)
0
select dayofmonth('2022-09-15') in (dayofmonth('2022-09-15')+1,dayofmonth('2022-09-15')+2);
dayofmonth('2022-09-15') in (dayofmonth('2022-09-15')+1,dayofmonth('2022-09-15')+2)
0
select dayofmonth('2022-09-15')-1 in (dayofmonth('2022-09-15')-5,dayofmonth('2022-09-15')+1,dayofmonth('2022-09-15')+2);
dayofmonth('2022-09-15')-1 in (dayofmonth('2022-09-15')-5,dayofmonth('2022-09-15')+1,dayofmonth('2022-09-15')+2)
0
select dayofmonth('2022-09-15')-1 in (dayofmonth('2022-09-15')-5,dayofmonth('2022-09-15')-1,dayofmonth('2022-09-15')+2);
dayofmonth('2022-09-15')-1 in (dayofmonth('2022-09-15')-5,dayofmonth('2022-09-15')-1,dayofmonth('2022-09-15')+2)
1
select dayofmonth('2022-09-15') not in (dayofmonth('2022-09-15'),dayofmonth('2022-09-15')+1,dayofmonth('2022-09-15')+2);
dayofmonth('2022-09-15') not in (dayofmonth('2022-09-15'),dayofmonth('2022-09-15')+1,dayofmonth('2022-09-15')+2)
0
select dayofmonth('2022-09-15')-1 not in (dayofmonth('2022-09-15'),dayofmonth('2022-09-15')+1,dayofmonth('2022-09-15')+2);
dayofmonth('2022-09-15')-1 not in (dayofmonth('2022-09-15'),dayofmonth('2022-09-15')+1,dayofmonth('2022-09-15')+2)
1
select dayofmonth('2022-09-15') not in (dayofmonth('2022-09-15')+1,dayofmonth('2022-09-15')+2);
dayofmonth('2022-09-15') not in (dayofmonth('2022-09-15')+1,dayofmonth('2022-09-15')+2)
1
select dayofmonth('2022-09-15')-1 not in (dayofmonth('2022-09-15')-5,dayofmonth('2022-09-15')+1,dayofmonth('2022-09-15')+2);
dayofmonth('2022-09-15')-1 not in (dayofmonth('2022-09-15')-5,dayofmonth('2022-09-15')+1,dayofmonth('2022-09-15')+2)
1
select dayofmonth('2022-09-15')-1  not in (dayofmonth('2022-09-15')-5,dayofmonth('2022-09-15')-1,dayofmonth('2022-09-15')+2);
dayofmonth('2022-09-15')-1  not in (dayofmonth('2022-09-15')-5,dayofmonth('2022-09-15')-1,dayofmonth('2022-09-15')+2)
0
select dayofmonth('2022-09-15') is NULL;
dayofmonth('2022-09-15') is NULL
0
select dayofmonth('2022-09-15')+0 is NULL;
dayofmonth('2022-09-15')+0 is NULL
0
select dayofmonth('2022-09-15')  like '20%';
dayofmonth('2022-09-15')  like '20%'
0
select dayofmonth('2022-09-15')+0  like dayofmonth('2022-09-15');
dayofmonth('2022-09-15')+0  like dayofmonth('2022-09-15')
1
select dayofmonth('2022-09-15')  like dayofmonth('2022-09-15');
dayofmonth('2022-09-15')  like dayofmonth('2022-09-15')
1
select dayofmonth('2022-09-15')+0 not like '20%';
dayofmonth('2022-09-15')+0 not like '20%'
1
select dayofmonth('2022-09-15')+0 not  like dayofmonth('2022-09-15');
dayofmonth('2022-09-15')+0 not  like dayofmonth('2022-09-15')
0
select dayofmonth('2022-09-15') REGEXP dayofmonth('2022-09-15');
dayofmonth('2022-09-15') REGEXP dayofmonth('2022-09-15')
1
select dayofmonth('2022-09-15') REGEXP dayofmonth('2022-09-15')+0;
dayofmonth('2022-09-15') REGEXP dayofmonth('2022-09-15')+0
1
select dayofmonth('2022-09-15')+0 REGEXP dayofmonth('2022-09-15');
dayofmonth('2022-09-15')+0 REGEXP dayofmonth('2022-09-15')
1
select dayofmonth('2022-09-15')+0 REGEXP dayofmonth('2022-09-15')+0;
dayofmonth('2022-09-15')+0 REGEXP dayofmonth('2022-09-15')+0
1
select dayofmonth('2022-09-15')&dayofmonth('2022-09-15');
dayofmonth('2022-09-15')&dayofmonth('2022-09-15')
15
select dayofmonth('2022-09-15')+0&dayofmonth('2022-09-15');
dayofmonth('2022-09-15')+0&dayofmonth('2022-09-15')
15
select dayofmonth('2022-09-15')+0&dayofmonth('2022-09-15')+0;
dayofmonth('2022-09-15')+0&dayofmonth('2022-09-15')+0
15
select dayofmonth('2022-09-15')|dayofmonth('2022-09-15');
dayofmonth('2022-09-15')|dayofmonth('2022-09-15')
15
select dayofmonth('2022-09-15')|dayofmonth('2022-09-15')+1;
dayofmonth('2022-09-15')|dayofmonth('2022-09-15')+1
31
select dayofmonth('2022-09-15')+0|dayofmonth('2022-09-15')+0;
dayofmonth('2022-09-15')+0|dayofmonth('2022-09-15')+0
15
select dayofmonth('2022-09-15')^dayofmonth('2022-09-15');
dayofmonth('2022-09-15')^dayofmonth('2022-09-15')
0
select dayofmonth('2022-09-15')^dayofmonth('2022-09-15')+1;
dayofmonth('2022-09-15')^dayofmonth('2022-09-15')+1
1
select dayofmonth('2022-09-15')+0^dayofmonth('2022-09-15')+0;
dayofmonth('2022-09-15')+0^dayofmonth('2022-09-15')+0
30
select dayofmonth('2022-09-15')>>dayofmonth('2022-09-15');
dayofmonth('2022-09-15')>>dayofmonth('2022-09-15')
0
select dayofmonth('2022-09-15')>>dayofmonth('2022-09-15')+1;
dayofmonth('2022-09-15')>>dayofmonth('2022-09-15')+1
0
select dayofmonth('2022-09-15')+0>>dayofmonth('2022-09-15')+0;
dayofmonth('2022-09-15')+0>>dayofmonth('2022-09-15')+0
0
select dayofmonth('2022-09-15')<<dayofmonth('2022-09-15');
dayofmonth('2022-09-15')<<dayofmonth('2022-09-15')
491520
select dayofmonth('2022-09-15')<<dayofmonth('2022-09-15')+1;
dayofmonth('2022-09-15')<<dayofmonth('2022-09-15')+1
983040
select dayofmonth('2022-09-15')+0<<dayofmonth('2022-09-15')+0;
dayofmonth('2022-09-15')+0<<dayofmonth('2022-09-15')+0
491520
select ~dayofmonth('2022-09-15');
~dayofmonth('2022-09-15')
18446744073709551600
select ~dayofmonth('2022-09-15')-10;
~dayofmonth('2022-09-15')-10
18446744073709551590
select dayofmonth('2022-09-15') and dayofmonth('2022-09-15');
dayofmonth('2022-09-15') and dayofmonth('2022-09-15')
1
select dayofmonth('2022-09-15')+1 and dayofmonth('2022-09-15')-1;
dayofmonth('2022-09-15')+1 and dayofmonth('2022-09-15')-1
1
select dayofmonth('2022-09-15') and dayofmonth('2022-09-15')-1;
dayofmonth('2022-09-15') and dayofmonth('2022-09-15')-1
1
select dayofmonth('2022-09-15') or dayofmonth('2022-09-15');
dayofmonth('2022-09-15') or dayofmonth('2022-09-15')
1
select dayofmonth('2022-09-15') or null;
dayofmonth('2022-09-15') or null
1
select dayofmonth('2022-09-15')+1 or null;
dayofmonth('2022-09-15')+1 or null
1
select dayofmonth('2022-09-15')+1 or dayofmonth('2022-09-15')-1;
dayofmonth('2022-09-15')+1 or dayofmonth('2022-09-15')-1
1
select dayofmonth('2022-09-15') or dayofmonth('2022-09-15')-1;
dayofmonth('2022-09-15') or dayofmonth('2022-09-15')-1
1
select not dayofmonth('2022-09-15')-1;
not dayofmonth('2022-09-15')-1
0
select not dayofmonth('2022-09-15');
not dayofmonth('2022-09-15')
0
select !dayofmonth('2022-09-15')-1;
!dayofmonth('2022-09-15')-1
-1
select !dayofmonth('2022-09-15');
!dayofmonth('2022-09-15')
0
select dayofmonth('2022-09-15') xor dayofmonth('2022-09-15');
dayofmonth('2022-09-15') xor dayofmonth('2022-09-15')
0
select dayofmonth('2022-09-15')+1 xor dayofmonth('2022-09-15')-1;
dayofmonth('2022-09-15')+1 xor dayofmonth('2022-09-15')-1
0
select dayofmonth('2022-09-15') xor dayofmonth('2022-09-15')-1;
dayofmonth('2022-09-15') xor dayofmonth('2022-09-15')-1
0
drop table t1;
##日期时间函数校验
select CURRENT_TIME(dayofmonth('2022-09-07'));
ERROR 42000: You have an error in your SQL syntax; check the manual that corresponds to your OceanBase version for the right syntax to use near 'dayofmonth('2022-09-07'))' at line 1
select CURRENT_TIME(dayofmonth('2022-09-07')-dayofmonth('2022-09-07'));
ERROR 42000: You have an error in your SQL syntax; check the manual that corresponds to your OceanBase version for the right syntax to use near 'dayofmonth('2022-09-07')-dayofmonth('2022-09-07'))' at line 1
select CURRENT_TIMESTAMP(dayofmonth('2022-09-07')-dayofmonth('2022-09-07'));
ERROR 42000: You have an error in your SQL syntax; check the manual that corresponds to your OceanBase version for the right syntax to use near 'dayofmonth('2022-09-07')-dayofmonth('2022-09-07'))' at line 1
select DATE_ADD(dayofmonth('2022-09-07 23:59:59'),INTERVAL '1:1' MINUTE_SECOND);
DATE_ADD(dayofmonth('2022-09-07 23:59:59'),INTERVAL '1:1' MINUTE_SECOND)
NULL
SELECT dayofmonth(DATE_ADD('2022-09-07 23:59:59',INTERVAL '1:1' MINUTE_SECOND));
dayofmonth(DATE_ADD('2022-09-07 23:59:59',INTERVAL '1:1' MINUTE_SECOND))
8
select dayofmonth(date_format('2022-01-27 13:23:00', '%Y-%c-%d'))as result;
result
27
select date_format(dayofmonth('2022-01-27 13:23:00'),'%Y %c %d')as result;
result
NULL
select dayofmonth('2009-10-01') = DATE_FORMAT('2009-10-01 22:23:00', '%W');
dayofmonth('2009-10-01') = DATE_FORMAT('2009-10-01 22:23:00', '%W')
0
Warnings:
Warning	1292	Truncated incorrect DECIMAL value: 'Thursday'
select dayofmonth(date_sub(date '2022-01-22',interval '3' day));
dayofmonth(date_sub(date '2022-01-22',interval '3' day))
19
select DATE_SUB(dayofmonth('2022-09-07'),INTERVAL 5 DAY);
DATE_SUB(dayofmonth('2022-09-07'),INTERVAL 5 DAY)
NULL
select DATEDIFF(dayofmonth('2022-09-07'),dayofmonth('2021-09-07'));
DATEDIFF(dayofmonth('2022-09-07'),dayofmonth('2021-09-07'))
NULL
select dayofmonth(DATEDIFF('2000-01-22 23:59:59','1000-01-21'));
dayofmonth(DATEDIFF('2000-01-22 23:59:59','1000-01-21'))
NULL
Warnings:
Warning	5086	Not timestamp Can not cast varchar value to timestamp type
select EXTRACT(week from dayofmonth('2022-09-07'));
EXTRACT(week from dayofmonth('2022-09-07'))
NULL
select EXTRACT(week from dayofmonth('2022-09-07'));
EXTRACT(week from dayofmonth('2022-09-07'))
NULL
select from_days(dayofmonth('2022-09-07'));
from_days(dayofmonth('2022-09-07'))
0000-00-00
select dayofmonth(from_days(738565));
dayofmonth(from_days(738565))
14
select FROM_UNIXTIME(dayofmonth('2022-09-07'),GET_FORMAT(DATE,'USA'));
FROM_UNIXTIME(dayofmonth('2022-09-07'),GET_FORMAT(DATE,'USA'))
01.01.1970
select dayofmonth(FROM_UNIXTIME(1647738456));
dayofmonth(FROM_UNIXTIME(1647738456))
20
select MONTH(dayofmonth('2022-09-07'));
MONTH(dayofmonth('2022-09-07'))
NULL
Warnings:
Warning	5086	Not timestamp Can not cast varchar value to timestamp type
select dayofmonth(month('2022-09-07'));
dayofmonth(month('2022-09-07'))
NULL
Warnings:
Warning	5086	Not timestamp Can not cast varchar value to timestamp type
select PERIOD_DIFF(dayofmonth('2022-09-07'),dayofmonth('2022-09-07'));
PERIOD_DIFF(dayofmonth('2022-09-07'),dayofmonth('2022-09-07'))
0
select dayofmonth(str_to_date('2022-01-06 10:20:30','%Y-%m-%d %H:%i:%s')) as result;
result
6
select STR_TO_DATE(dayofmonth('2022-09-07'));
ERROR 42000: Incorrect parameter count in the call to native function 'STR_TO_DATE'
select time(dayofmonth('2022-09-07 23:59:59.999999'));
time(dayofmonth('2022-09-07 23:59:59.999999'))
00:00:07
select TIME_TO_SEC(dayofmonth('2022-09-07'));
TIME_TO_SEC(dayofmonth('2022-09-07'))
7
select dayofmonth(TIME_TO_SEC('2022-09-07'));
dayofmonth(TIME_TO_SEC('2022-09-07'))
22
select TIMEDIFF(dayofmonth('2022-09-07'),dayofmonth('2022-09-07'));
TIMEDIFF(dayofmonth('2022-09-07'),dayofmonth('2022-09-07'))
00:00:00
SELECT dayofmonth(TIMESTAMPADD(MINUTE,1,'2003-01-02'));
dayofmonth(TIMESTAMPADD(MINUTE,1,'2003-01-02'))
2
SELECT TIMESTAMPADD(WEEK,1,dayofmonth('2003-01-02'));
TIMESTAMPADD(WEEK,1,dayofmonth('2003-01-02'))
NULL
select TIMESTAMPDIFF(day,dayofmonth('2022-09-07') , dayofmonth('2022-09-07'));
TIMESTAMPDIFF(day,dayofmonth('2022-09-07') , dayofmonth('2022-09-07'))
NULL
select dayofmonth(TIMESTAMPDIFF(MONTH,'2003-02-01','2003-05-01'));
dayofmonth(TIMESTAMPDIFF(MONTH,'2003-02-01','2003-05-01'))
NULL
Warnings:
Warning	5086	Not timestamp Can not cast varchar value to timestamp type
select TO_DAYS(dayofmonth('2003-02-01'));
TO_DAYS(dayofmonth('2003-02-01'))
NULL
select dayofmonth(TO_DAYS('2003-02-01'));
dayofmonth(TO_DAYS('2003-02-01'))
NULL
Warnings:
Warning	5086	Not timestamp Can not cast varchar value to timestamp type
select SEC_TO_TIME(dayofmonth('2003-02-01'));
SEC_TO_TIME(dayofmonth('2003-02-01'))
00:00:01
select UNIX_TIMESTAMP(dayofmonth('2022-09-07'));
UNIX_TIMESTAMP(dayofmonth('2022-09-07'))
0
select dayofmonth(UNIX_TIMESTAMP('2022-09-07'));
dayofmonth(UNIX_TIMESTAMP('2022-09-07'))
NULL
Warnings:
Warning	5086	Not timestamp Can not cast varchar value to timestamp type
select UTC_TIMESTAMP(dayofmonth('2022-09-07'));
ERROR 42000: You have an error in your SQL syntax; check the manual that corresponds to your OceanBase version for the right syntax to use near 'dayofmonth('2022-09-07'))' at line 1
select YEAR(dayofmonth('2022-09-07'));
YEAR(dayofmonth('2022-09-07'))
NULL
Warnings:
Warning	5086	Not timestamp Can not cast varchar value to timestamp type
select dayofmonth(year('2022-09-07'));
dayofmonth(year('2022-09-07'))
NULL
Warnings:
Warning	5086	Not timestamp Can not cast varchar value to timestamp type
select YEAR(dayofmonth('2022-09-07')+10000);
YEAR(dayofmonth('2022-09-07')+10000)
2001
##字符串函数
select CONCAT(dayofmonth('2022-09-07'),dayofmonth('2022-09-07'));
CONCAT(dayofmonth('2022-09-07'),dayofmonth('2022-09-07'))
77
select CONCAT_WS('_',dayofmonth('2022-09-07'),dayofmonth('2022-09-07'));
CONCAT_WS('_',dayofmonth('2022-09-07'),dayofmonth('2022-09-07'))
7_7
select FORMAT(dayofmonth('2022-09-08'),3);
FORMAT(dayofmonth('2022-09-08'),3)
8.000
select dayofmonth(FORMAT(1025.12356,2));
dayofmonth(FORMAT(1025.12356,2))
NULL
Warnings:
Warning	5086	Not timestamp Can not cast varchar value to timestamp type
select SUBSTR(dayofmonth('2022-09-07'),1);
SUBSTR(dayofmonth('2022-09-07'),1)
7
select dayofmonth(SUBSTR('20220907',1));
dayofmonth(SUBSTR('20220907',1))
7
select SUBSTRING(dayofmonth('2022-09-07'),1,1);
SUBSTRING(dayofmonth('2022-09-07'),1,1)
7
select dayofmonth(SUBSTRING('2022-09-07',1,10));
dayofmonth(SUBSTRING('2022-09-07',1,10))
7
select TRIM(  dayofmonth(' 2022-09-07  ')  );
TRIM(  dayofmonth(' 2022-09-07  ')  )
7
select dayofmonth(TRIM(' 2022-09-07 '));
dayofmonth(TRIM(' 2022-09-07 '))
7
select RTRIM(dayofmonth('2022-09-07'));
RTRIM(dayofmonth('2022-09-07'))
7
select dayofmonth(RTRIM('2022-09-07'));
dayofmonth(RTRIM('2022-09-07'))
7
select ascii(dayofmonth('2022-09-07'));
ascii(dayofmonth('2022-09-07'))
55
select dayofmonth(ascii('2022-09-07'));
dayofmonth(ascii('2022-09-07'))
NULL
Warnings:
Warning	5086	Not timestamp Can not cast varchar value to timestamp type
select ORD(dayofmonth('2022-09-07'));
ORD(dayofmonth('2022-09-07'))
55
select dayofmonth(ORD('2022-09-07'));
dayofmonth(ORD('2022-09-07'))
NULL
Warnings:
Warning	5086	Not timestamp Can not cast varchar value to timestamp type
select LENGTH(dayofmonth('2022-09-07'));
LENGTH(dayofmonth('2022-09-07'))
1
select dayofmonth(LENGTH('2022-09-07'));
dayofmonth(LENGTH('2022-09-07'))
NULL
Warnings:
Warning	5086	Not timestamp Can not cast varchar value to timestamp type
select CHAR_LENGTH(dayofmonth('2022-09-07'));
CHAR_LENGTH(dayofmonth('2022-09-07'))
1
select dayofmonth(CHAR_LENGTH('2022-09-07'));
dayofmonth(CHAR_LENGTH('2022-09-07'))
NULL
Warnings:
Warning	5086	Not timestamp Can not cast varchar value to timestamp type
select UPPER(dayofmonth('2022-09-07'));
UPPER(dayofmonth('2022-09-07'))
7
select dayofmonth(UPPER('2022-09-07'));
dayofmonth(UPPER('2022-09-07'))
7
select lower(dayofmonth('2022-09-07'));
lower(dayofmonth('2022-09-07'))
7
select dayofmonth(lower('2022-09-07'));
dayofmonth(lower('2022-09-07'))
7
select HEX(dayofmonth('2022-09-07'));
HEX(dayofmonth('2022-09-07'))
7
select dayofmonth(HEX('2022-09-07'));
dayofmonth(HEX('2022-09-07'))
NULL
Warnings:
Warning	5086	Not timestamp Can not cast varchar value to timestamp type
select UNHEX(dayofmonth('2022-09-07'));
UNHEX(dayofmonth('2022-09-07'))

select dayofmonth(UNHEX('2022-09-07'));
dayofmonth(UNHEX('2022-09-07'))
NULL
select MD5(dayofmonth('2022-09-07'));
MD5(dayofmonth('2022-09-07'))
8f14e45fceea167a5a36dedd4bea2543
select dayofmonth(MD5('2022-09-07'));
dayofmonth(MD5('2022-09-07'))
NULL
Warnings:
Warning	5086	Not timestamp Can not cast varchar value to timestamp type
select INT2IP(dayofmonth('2022-09-07'));
INT2IP(dayofmonth('2022-09-07'))
0.0.0.7
select dayofmonth(INT2IP('2022-09-07'));
dayofmonth(INT2IP('2022-09-07'))
7
Warnings:
Warning	1292	Truncated incorrect INTEGER value: '2022-09-07'
SELECT dayofmonth('2022-09-07') LIKE 'W%';
dayofmonth('2022-09-07') LIKE 'W%'
0
SELECT dayofmonth('2022-09-07') REGEXP dayofmonth('2022-09-08');
dayofmonth('2022-09-07') REGEXP dayofmonth('2022-09-08')
0
SELECT REPEAT(dayofmonth('2022-09-07'), 5);
REPEAT(dayofmonth('2022-09-07'), 5)
77777
SELECT dayofmonth(REPEAT('2022-09-07',1));
dayofmonth(REPEAT('2022-09-07',1))
7
SELECT REPEAT(dayofmonth('2022-09-07'), dayofmonth('2022-09-07'));
REPEAT(dayofmonth('2022-09-07'), dayofmonth('2022-09-07'))
7777777
SELECT SPACE(dayofmonth('2022-09-07'),0);
ERROR 42000: Incorrect parameter count in the call to native function 'SPACE'
SELECT dayofmonth(SPACE('2022-09-07'));
dayofmonth(SPACE('2022-09-07'))
NULL
Warnings:
Warning	1292	Truncated incorrect INTEGER value: '2022-09-07'
Warning	5086	Not timestamp Can not cast varchar value to timestamp type
SELECT SUBSTRING_INDEX(dayofmonth('2022-09-07'),' ',1);
SUBSTRING_INDEX(dayofmonth('2022-09-07'),' ',1)
7
SELECT dayofmonth(SUBSTRING_INDEX('2022-09-07','-',3));
dayofmonth(SUBSTRING_INDEX('2022-09-07','-',3))
7
SELECT LOCATE(dayofmonth('2022-09-07'),dayofmonth('2022-09-07'));
LOCATE(dayofmonth('2022-09-07'),dayofmonth('2022-09-07'))
1
SELECT LOCATE(dayofmonth('2022-09-07'),dayofmonth('2022-09-08'));
LOCATE(dayofmonth('2022-09-07'),dayofmonth('2022-09-08'))
0
SELECT POSITION(dayofmonth('2022-09-07') in dayofmonth('2022-09-07'));
POSITION(dayofmonth('2022-09-07') in dayofmonth('2022-09-07'))
1
SELECT POSITION(dayofmonth('2022-09-07') in dayofmonth('2022-09-08'));
POSITION(dayofmonth('2022-09-07') in dayofmonth('2022-09-08'))
0
SELECT INSTR(dayofmonth('2022-09-07'),dayofmonth('2022-09-07'));
INSTR(dayofmonth('2022-09-07'),dayofmonth('2022-09-07'))
1
SELECT INSTR(dayofmonth('2022-09-07'),dayofmonth('2022-09-08'));
INSTR(dayofmonth('2022-09-07'),dayofmonth('2022-09-08'))
0
SELECT REPLACE(dayofmonth('2022-09-07'),dayofmonth('2022-09-07'),dayofmonth('2022-09-07'));
REPLACE(dayofmonth('2022-09-07'),dayofmonth('2022-09-07'),dayofmonth('2022-09-07'))
7
SELECT REPLACE(dayofmonth('2022-09-07'),dayofmonth('2022-09-07'),dayofmonth('2022-09-08'));
REPLACE(dayofmonth('2022-09-07'),dayofmonth('2022-09-07'),dayofmonth('2022-09-08'))
8
SELECT FIELD(dayofmonth('2022-09-07'),dayofmonth('2022-09-07'),dayofmonth('2022-09-07'));
FIELD(dayofmonth('2022-09-07'),dayofmonth('2022-09-07'),dayofmonth('2022-09-07'))
1
SELECT FIELD(dayofmonth('2022-09-07'),dayofmonth('2022-09-07'),dayofmonth('2022-09-08'));
FIELD(dayofmonth('2022-09-07'),dayofmonth('2022-09-07'),dayofmonth('2022-09-08'))
1
SELECT ELT(1,dayofmonth('2022-09-07'),dayofmonth('2022-09-07'));
ELT(1,dayofmonth('2022-09-07'),dayofmonth('2022-09-07'))
7
SELECT ELT(2,dayofmonth('2022-09-07'),dayofmonth('2022-09-08'));
ELT(2,dayofmonth('2022-09-07'),dayofmonth('2022-09-08'))
8
SELECT LPAD(dayofmonth('2022-09-07'),dayofmonth('2022-09-07'),dayofmonth('2022-09-07'));
LPAD(dayofmonth('2022-09-07'),dayofmonth('2022-09-07'),dayofmonth('2022-09-07'))
7777777
SELECT RPAD(dayofmonth('2022-09-07'),dayofmonth('2022-09-07'),dayofmonth('2022-09-07'));
RPAD(dayofmonth('2022-09-07'),dayofmonth('2022-09-07'),dayofmonth('2022-09-07'))
7777777
SELECT bin(dayofmonth('2022-09-07'));
bin(dayofmonth('2022-09-07'))
111
SELECT bin(dayofmonth('2022-09-08'));
bin(dayofmonth('2022-09-08'))
1000
SELECT quote(dayofmonth('2022-09-07'));
quote(dayofmonth('2022-09-07'))
'7'
SELECT quote(dayofmonth('2022-09-08'));
quote(dayofmonth('2022-09-08'))
'8'
SELECT REGEXP_SUBSTR(dayofmonth('2022-09-07'));
ERROR 42000: Incorrect parameter count in the call to native function 'REGEXP_SUBSTR'
##转换函数与数学函数
select CAST(dayofmonth('2022-09-07') as date);
CAST(dayofmonth('2022-09-07') as date)
NULL
select CAST(dayofmonth('2022-09-07') as time);
CAST(dayofmonth('2022-09-07') as time)
00:00:07
select dayofmonth(CAST('2022-09-07' as date));
dayofmonth(CAST('2022-09-07' as date))
7
select ROUND(dayofmonth(2022-09-07),1);
ROUND(dayofmonth(2022-09-07),1)
NULL
Warnings:
Warning	5086	Not timestamp Can not cast varchar value to timestamp type
select dayofmonth(round(20220907.984));
dayofmonth(round(20220907.984))
8
select dayofmonth(ROUND('2022-09-07'),ROUND('2022-09-07'));
ERROR 42000: Incorrect parameter count in the call to native function 'dayofmonth'
select ROUND(dayofmonth('2022-09-07'),dayofmonth('2022-09-07')-20200916);
ROUND(dayofmonth('2022-09-07'),dayofmonth('2022-09-07')-20200916)
0
select dayofmonth(CEIL('20220907'));
dayofmonth(CEIL('20220907'))
7
select dayofmonth(CEIL('20220908 23:59:59.999999'));
dayofmonth(CEIL('20220908 23:59:59.999999'))
8
Warnings:
Warning	1292	Truncated incorrect DOUBLE value: '20220908 23:59:59.999999'
select dayofmonth(FLOOR('20220907'));
dayofmonth(FLOOR('20220907'))
7
select dayofmonth(FLOOR('20220908 23:59:59.999999'));
dayofmonth(FLOOR('20220908 23:59:59.999999'))
8
Warnings:
Warning	1292	Truncated incorrect DOUBLE value: '20220908 23:59:59.999999'
select dayofmonth(ABS(20220907+1));
dayofmonth(ABS(20220907+1))
8
select dayofmonth(ABS(20220908-1));
dayofmonth(ABS(20220908-1))
7
select dayofmonth(SIGN(20220907));
dayofmonth(SIGN(20220907))
NULL
Warnings:
Warning	5086	Not timestamp Can not cast varchar value to timestamp type
select dayofmonth(SIGN(20220907));
dayofmonth(SIGN(20220907))
NULL
Warnings:
Warning	5086	Not timestamp Can not cast varchar value to timestamp type
select dayofmonth(CONV(20220907+1));
ERROR 42000: Incorrect parameter count in the call to native function 'CONV'
select dayofmonth(CONV(20220907-1));
ERROR 42000: Incorrect parameter count in the call to native function 'CONV'
select MOD(dayofmonth('2022-09-07'),1);
MOD(dayofmonth('2022-09-07'),1)
0
select dayofmonth(MOD(20220907,1));
dayofmonth(MOD(20220907,1))
0
select POW(dayofmonth(20220907),null);
POW(dayofmonth(20220907),null)
NULL
select dayofmonth(POW(20220907),1);
ERROR 42000: Incorrect parameter count in the call to native function 'dayofmonth'
select POWER(dayofmonth(20220907),null);
POWER(dayofmonth(20220907),null)
NULL
select dayofmonth(POWER(20220907),1);
ERROR 42000: Incorrect parameter count in the call to native function 'dayofmonth'
select rand(dayofmonth(2022-09-07));
rand(dayofmonth(2022-09-07))
0.15522042769493574
Warnings:
Warning	5086	Not timestamp Can not cast varchar value to timestamp type
select dayofmonth(rand(2022-09-07));
dayofmonth(rand(2022-09-07))
0
##流程控制函数与比较函数
select GREATEST(dayofmonth('2022-09-07'),'1');
GREATEST(dayofmonth('2022-09-07'),'1')
7
select LEAST(dayofmonth('2022-09-07'),'1');
LEAST(dayofmonth('2022-09-07'),'1')
1
select isnull(dayofmonth('2022-09-07'));
isnull(dayofmonth('2022-09-07'))
0
select isnull(dayofmonth('2022-09-07')+0);
isnull(dayofmonth('2022-09-07')+0)
0
select CASE dayofmonth('2022-09-08') when dayofmonth('2022-09-08') then 1 when dayofmonth('2022-09-07') then 2 END as result;
result
1
select if(dayofmonth('2022-09-07')<dayofmonth('2022-09-08'),dayofmonth('2022-09-07'),dayofmonth('2022-09-08')) as result;
result
7
select ifnull(null,dayofmonth('2022-09-07'));
ifnull(null,dayofmonth('2022-09-07'))
7
select nullif(dayofmonth('2022-09-07'),dayofmonth('2022-09-07'));
nullif(dayofmonth('2022-09-07'),dayofmonth('2022-09-07'))
NULL
select COALESCE(dayofmonth('2022-09-07'));
COALESCE(dayofmonth('2022-09-07'))
7
select sleep(dayofmonth(20200900));
sleep(dayofmonth(20200900))
0
##使用场景 
##表table
##create as select
drop table t1;
drop table t2;
create table t1 (c1 int ,c2 varchar(20),c3 date);
insert into t1 values(1,'test01','20220907');
insert into t1 values(2,'test02','20220909');
insert into t1 values(3,'test03','2022-08-20');
insert into t1 values(4,'test04','2022-09-15');
insert into t1 values(5,'test05','2022-09-16');
select dayofmonth(c3) as a from t1;
a
7
9
20
15
16
create table t2 as select dayofmonth(c3) from t1;
select * from t2;
dayofmonth(c3)
7
9
20
15
16
drop table t2;
select DATEDIFF(dayofmonth(c3)-1,dayofmonth(c3)) from t1;
DATEDIFF(dayofmonth(c3)-1,dayofmonth(c3))
NULL
NULL
NULL
NULL
NULL
select MOD(dayofmonth('2022-09-15')+5,dayofmonth('2022-09-15')) from t1;
MOD(dayofmonth('2022-09-15')+5,dayofmonth('2022-09-15'))
5
5
5
5
5
select time(dayofmonth('2022-09-15')),COALESCE(dayofmonth('2022-09-15')) from t1;
time(dayofmonth('2022-09-15'))	COALESCE(dayofmonth('2022-09-15'))
00:00:15	15
00:00:15	15
00:00:15	15
00:00:15	15
00:00:15	15
SELECT INSTR(dayofmonth('2022-09-15'),dayofmonth('2022-09-15')+0) from t1;
INSTR(dayofmonth('2022-09-15'),dayofmonth('2022-09-15')+0)
1
1
1
1
1
select LENGTH(dayofmonth('2022-09-15')+1),LENGTH(dayofmonth('2022-09-15')) from t1;
LENGTH(dayofmonth('2022-09-15')+1)	LENGTH(dayofmonth('2022-09-15'))
2	2
2	2
2	2
2	2
2	2
SELECT LOCATE(2,dayofmonth('2022-09-15')+0,dayofmonth('2022-09-15')-20200911) from t1;
LOCATE(2,dayofmonth('2022-09-15')+0,dayofmonth('2022-09-15')-20200911)
0
0
0
0
0
select MD5(dayofmonth('2022-09-15')),MD5(dayofmonth('2022-09-15')+1) from t1;
MD5(dayofmonth('2022-09-15'))	MD5(dayofmonth('2022-09-15')+1)
9bf31c7ff062936a96d3c8bd1f8f2ff3	c74d97b01eae257e44aa9d5bade97baf
9bf31c7ff062936a96d3c8bd1f8f2ff3	c74d97b01eae257e44aa9d5bade97baf
9bf31c7ff062936a96d3c8bd1f8f2ff3	c74d97b01eae257e44aa9d5bade97baf
9bf31c7ff062936a96d3c8bd1f8f2ff3	c74d97b01eae257e44aa9d5bade97baf
9bf31c7ff062936a96d3c8bd1f8f2ff3	c74d97b01eae257e44aa9d5bade97baf
##聚合函数
select count(dayofmonth(c3)) from t1;
count(dayofmonth(c3))
5
select sum(dayofmonth(c3)) from t1;
sum(dayofmonth(c3))
67
select avg(dayofmonth(c3)) from t1;
avg(dayofmonth(c3))
13.4000
select min(dayofmonth(c3)) from t1;
min(dayofmonth(c3))
7
select max(dayofmonth(c3)) from t1;
max(dayofmonth(c3))
20
select GROUP_CONCAT(dayofmonth(c3)) from t1;
GROUP_CONCAT(dayofmonth(c3))
7,9,20,15,16
##where子句
select t1.*, dayofmonth(c3) from t1 where dayofmonth(c3)=7;
c1	c2	c3	dayofmonth(c3)
1	test01	2022-09-07	7
select t1.*, dayofmonth(c3) from t1 where dayofmonth(c3)>='7';
c1	c2	c3	dayofmonth(c3)
1	test01	2022-09-07	7
2	test02	2022-09-09	9
3	test03	2022-08-20	20
4	test04	2022-09-15	15
5	test05	2022-09-16	16
select t1.*, dayofmonth(c3) from t1 where dayofmonth(c3)<='7';
c1	c2	c3	dayofmonth(c3)
1	test01	2022-09-07	7
select t1.*, dayofmonth(c3) from t1 where dayofmonth(c3)='7';
c1	c2	c3	dayofmonth(c3)
1	test01	2022-09-07	7
select t1.*, dayofmonth(c3) from t1 where dayofmonth(c3)<'9';
c1	c2	c3	dayofmonth(c3)
1	test01	2022-09-07	7
select t1.*, dayofmonth(c3) from t1 where dayofmonth(c3)>'9';
c1	c2	c3	dayofmonth(c3)
3	test03	2022-08-20	20
4	test04	2022-09-15	15
5	test05	2022-09-16	16
select t1.*, dayofmonth(c3) from t1 where dayofmonth(c3) between '9' and '7';
c1	c2	c3	dayofmonth(c3)
select t1.*, dayofmonth(c3) from t1 where dayofmonth(c3) like '7%';
c1	c2	c3	dayofmonth(c3)
1	test01	2022-09-07	7
select t1.*, dayofmonth(c3) from t1 where exists (select dayofmonth(c3));
c1	c2	c3	dayofmonth(c3)
1	test01	2022-09-07	7
2	test02	2022-09-09	9
3	test03	2022-08-20	20
4	test04	2022-09-15	15
5	test05	2022-09-16	16
select t1.*, dayofmonth(c3) from t1 where '7' in  (select dayofmonth(c3));
c1	c2	c3	dayofmonth(c3)
1	test01	2022-09-07	7
select t1.*, dayofmonth(c3) from t1 where '50' > all(select dayofmonth(c3));
c1	c2	c3	dayofmonth(c3)
1	test01	2022-09-07	7
2	test02	2022-09-09	9
3	test03	2022-08-20	20
4	test04	2022-09-15	15
5	test05	2022-09-16	16
select t1.*, dayofmonth(c3) from t1 where c1 =2 or c2 ='test03';
c1	c2	c3	dayofmonth(c3)
2	test02	2022-09-09	9
3	test03	2022-08-20	20
select t1.*, dayofmonth(c3) from t1 where c1 =2 and c2 ='test02';
c1	c2	c3	dayofmonth(c3)
2	test02	2022-09-09	9
create table t2(a1 int ,a2 int);
insert into t2 values(1,1);
insert into t2 values(2,2);
insert into t2 values(3,3);
select t1.*,dayofmonth(c3) from t1 inner join t2 on t1.c1=t2.a1;
c1	c2	c3	dayofmonth(c3)
1	test01	2022-09-07	7
2	test02	2022-09-09	9
3	test03	2022-08-20	20
select t1.*,dayofmonth(c3) from t1 left join t2 on t1.c1=t2.a1;
c1	c2	c3	dayofmonth(c3)
1	test01	2022-09-07	7
2	test02	2022-09-09	9
3	test03	2022-08-20	20
4	test04	2022-09-15	15
5	test05	2022-09-16	16
select t1.*,dayofmonth(c3) from t1 right join t2 on t1.c1=t2.a1;
c1	c2	c3	dayofmonth(c3)
1	test01	2022-09-07	7
2	test02	2022-09-09	9
3	test03	2022-08-20	20
mysql不支持
with tt as (select dayofmonth(c3)  from t1)  select * from tt;
dayofmonth(c3)
7
9
20
15
16
select dayofmonth(c3)+dayofmonth(c3) from t1 where c1>3;
dayofmonth(c3)+dayofmonth(c3)
30
32
select dayofmonth(c3)-dayofmonth(c3) from t1;
dayofmonth(c3)-dayofmonth(c3)
0
0
0
0
0
select dayofmonth(c3)*dayofmonth(c3) from t1;
dayofmonth(c3)*dayofmonth(c3)
49
81
400
225
256
select dayofmonth(c3)/dayofmonth(c3) from t1;
dayofmonth(c3)/dayofmonth(c3)
1.0000
1.0000
1.0000
1.0000
1.0000
select dayofmonth(c3)%dayofmonth(c3) from t1;
dayofmonth(c3)%dayofmonth(c3)
0
0
0
0
0
select dayofmonth(c3) div dayofmonth(c3) from t1;
dayofmonth(c3) div dayofmonth(c3)
1
1
1
1
1
select dayofmonth(c3) mod dayofmonth(c3) from t1;
dayofmonth(c3) mod dayofmonth(c3)
0
0
0
0
0
select -dayofmonth(c3) from t1;
-dayofmonth(c3)
-7
-9
-20
-15
-16
select +dayofmonth(c3) from t1;
+dayofmonth(c3)
7
9
20
15
16
select dayofmonth(c3)+0+dayofmonth(c3) from t1 where c1>3;
dayofmonth(c3)+0+dayofmonth(c3)
30
32
select dayofmonth(c3)-dayofmonth(c3)+0 from t1;
dayofmonth(c3)-dayofmonth(c3)+0
0
0
0
0
0
select dayofmonth(c3)*dayofmonth(c3)+0 from t1;
dayofmonth(c3)*dayofmonth(c3)+0
49
81
400
225
256
select dayofmonth(c3)+0/dayofmonth(c3) from t1;
dayofmonth(c3)+0/dayofmonth(c3)
7.0000
9.0000
20.0000
15.0000
16.0000
select dayofmonth(c3)%dayofmonth(c3)+0 from t1;
dayofmonth(c3)%dayofmonth(c3)+0
0
0
0
0
0
select dayofmonth(c3)+0 div dayofmonth(c3) from t1;
dayofmonth(c3)+0 div dayofmonth(c3)
7
9
20
15
16
select dayofmonth(c3) mod dayofmonth(c3)+0 from t1;
dayofmonth(c3) mod dayofmonth(c3)+0
0
0
0
0
0
select -dayofmonth(c3)+0 from t1;
-dayofmonth(c3)+0
-7
-9
-20
-15
-16
select +dayofmonth(c3)+0 from t1;
+dayofmonth(c3)+0
7
9
20
15
16
select dayofmonth(c3)+0+dayofmonth(c3)+0 from t1 where c1=3;
dayofmonth(c3)+0+dayofmonth(c3)+0
40
select dayofmonth(c3)+0-dayofmonth(c3)+0 from t1;
dayofmonth(c3)+0-dayofmonth(c3)+0
0
0
0
0
0
select dayofmonth(c3)+0*dayofmonth(c3)+0 from t1;
dayofmonth(c3)+0*dayofmonth(c3)+0
7
9
20
15
16
select dayofmonth(c3)+0/dayofmonth(c3)+0 from t1;
dayofmonth(c3)+0/dayofmonth(c3)+0
7.0000
9.0000
20.0000
15.0000
16.0000
select dayofmonth(c3)+0%dayofmonth(c3)+0 from t1;
dayofmonth(c3)+0%dayofmonth(c3)+0
7
9
20
15
16
select dayofmonth(c3)+0 div dayofmonth(c3)+0 from t1;
dayofmonth(c3)+0 div dayofmonth(c3)+0
7
9
20
15
16
select dayofmonth(c3)+0 mod dayofmonth(c3)+0 from t1;
dayofmonth(c3)+0 mod dayofmonth(c3)+0
7
9
20
15
16
select distinct dayofmonth(c3) from t1;
dayofmonth(c3)
7
9
20
15
16
select distinct dayofmonth(c3)+20 from t1;
dayofmonth(c3)+20
27
29
40
35
36
select  dayofmonth(c3) from t1;
dayofmonth(c3)
7
9
20
15
16
select  dayofmonth(c3)+1 from t1;
dayofmonth(c3)+1
8
10
21
16
17
select t1.*,dayofmonth(c3)-0, dayofmonth(c3) from t1 group by c1;
c1	c2	c3	dayofmonth(c3)-0	dayofmonth(c3)
1	test01	2022-09-07	7	7
2	test02	2022-09-09	9	9
3	test03	2022-08-20	20	20
4	test04	2022-09-15	15	15
5	test05	2022-09-16	16	16
select t1.*,dayofmonth(c3)-0, dayofmonth(c3) from t1 group by dayofmonth(c3),dayofmonth(c3)+0;
c1	c2	c3	dayofmonth(c3)-0	dayofmonth(c3)
1	test01	2022-09-07	7	7
2	test02	2022-09-09	9	9
3	test03	2022-08-20	20	20
4	test04	2022-09-15	15	15
5	test05	2022-09-16	16	16
select t1.*,dayofmonth(c3)-0, dayofmonth(c3) from t1 group by dayofmonth(c3) having dayofmonth(c3)>='2020-09-13';
c1	c2	c3	dayofmonth(c3)-0	dayofmonth(c3)
Warnings:
Warning	1292	Truncated incorrect DECIMAL value: '2020-09-13'
Warning	1292	Truncated incorrect DECIMAL value: '2020-09-13'
select t1.*,dayofmonth(c3)-0, dayofmonth(c3) from t1 group by dayofmonth(c3) having dayofmonth(c3)-0>='2020-09-13';
c1	c2	c3	dayofmonth(c3)-0	dayofmonth(c3)
Warnings:
Warning	1292	Truncated incorrect DECIMAL value: '2020-09-13'
Warning	1292	Truncated incorrect DECIMAL value: '2020-09-13'
select t1.*,dayofmonth(c3)-0, dayofmonth(c3) from t1 order by dayofmonth(c3);
c1	c2	c3	dayofmonth(c3)-0	dayofmonth(c3)
1	test01	2022-09-07	7	7
2	test02	2022-09-09	9	9
4	test04	2022-09-15	15	15
5	test05	2022-09-16	16	16
3	test03	2022-08-20	20	20
select t1.*,dayofmonth(c3)-0, dayofmonth(c3) from t1 order by dayofmonth(c3)+0;
c1	c2	c3	dayofmonth(c3)-0	dayofmonth(c3)
1	test01	2022-09-07	7	7
2	test02	2022-09-09	9	9
4	test04	2022-09-15	15	15
5	test05	2022-09-16	16	16
3	test03	2022-08-20	20	20
select t1.*,dayofmonth(c3)-0, dayofmonth(c3) from t1  where 9 =dayofmonth(c3) order by dayofmonth(c3);
c1	c2	c3	dayofmonth(c3)-0	dayofmonth(c3)
2	test02	2022-09-09	9	9
select t1.*,dayofmonth(c3)-0, dayofmonth(c3) from t1 where 9 =dayofmonth(c3)+0 order by dayofmonth(c3)+0;
c1	c2	c3	dayofmonth(c3)-0	dayofmonth(c3)
2	test02	2022-09-09	9	9
select t1.* , case dayofmonth(c3)  when dayofmonth(c3)  then dayofmonth(c3)  when dayofmonth(c3)+1  then    dayofmonth(c3)+1  end as a  from t1;
c1	c2	c3	a
1	test01	2022-09-07	7
2	test02	2022-09-09	9
3	test03	2022-08-20	20
4	test04	2022-09-15	15
5	test05	2022-09-16	16
select t1.* , case dayofmonth(c3)+1  when dayofmonth(c3)  then dayofmonth(c3)  when dayofmonth(c3)+1  then    dayofmonth(c3)+1  end as a  from t1;
c1	c2	c3	a
1	test01	2022-09-07	8
2	test02	2022-09-09	10
3	test03	2022-08-20	21
4	test04	2022-09-15	16
5	test05	2022-09-16	17
select count(dayofmonth(c3)) from t1;
count(dayofmonth(c3))
5
select count(dayofmonth(c3)+0) from t1;
count(dayofmonth(c3)+0)
5
select sum(dayofmonth(c3)) from t1;
sum(dayofmonth(c3))
67
select sum(dayofmonth(c3)+0) from t1;
sum(dayofmonth(c3)+0)
67
select avg(dayofmonth(c3)) from t1;
avg(dayofmonth(c3))
13.4000
select avg(dayofmonth(c3)+0) from t1;
avg(dayofmonth(c3)+0)
13.4000
select min(dayofmonth(c3)) from t1;
min(dayofmonth(c3))
7
select min(dayofmonth(c3)+0) from t1;
min(dayofmonth(c3)+0)
7
select max(dayofmonth(c3)) from t1;
max(dayofmonth(c3))
20
select max(dayofmonth(c3)+0) from t1;
max(dayofmonth(c3)+0)
20
select GROUP_CONCAT(dayofmonth(c3)) from t1;
GROUP_CONCAT(dayofmonth(c3))
7,9,20,15,16
select GROUP_CONCAT(dayofmonth(c3)+0) from t1;
GROUP_CONCAT(dayofmonth(c3)+0)
7,9,20,15,16
drop table t2;
drop table t1;
create table t1(c1 int,c2 varchar(20));
create table t2(c1 int,c2 varchar(20));
insert into t1 values(1,'2022-09-15');
insert into t1 values(2,'2022-09-14');
insert into t2 values(1,'2022-09-16');
insert into t1 values(3,'2022-09-13');
select dayofmonth(c2),dayofmonth(c2)+0 from t1 union select dayofmonth(c2),dayofmonth(c2)+0 from t2;
dayofmonth(c2)	dayofmonth(c2)+0
15	15
14	14
13	13
16	16
select dayofmonth(c2),dayofmonth(c2)+0 from t1 union all select dayofmonth(c2),dayofmonth(c2)+0 from t2;
dayofmonth(c2)	dayofmonth(c2)+0
15	15
14	14
13	13
16	16
select dayofmonth(c2),dayofmonth(c2)+0 from t1 intersect select dayofmonth(c2),dayofmonth(c2)+0 from t2;
dayofmonth(c2)	dayofmonth(c2)+0
select dayofmonth(c2),dayofmonth(c2)+1 from t1 except select dayofmonth(c2),dayofmonth(c2)+0 from t2;
dayofmonth(c2)	dayofmonth(c2)+1
15	16
14	15
13	14
select dayofmonth(c2),dayofmonth(c2)+2 from t1 minus select dayofmonth(c2),dayofmonth(c2)+0 from t2;
dayofmonth(c2)	dayofmonth(c2)+2
15	17
14	16
13	15
drop table t2;
drop table t1;
##insert into
create table t1(a bool,b bool);
insert into t1 values(111,111.999999);
select dayofmonth(a) from t1;
dayofmonth(a)
11
select dayofmonth(b) from t1;
dayofmonth(b)
12
drop table t1;
create table t1(a BOOLEAN,b BOOLEAN);
insert into t1 values(111,111.999999);
select dayofmonth(a) from t1;
dayofmonth(a)
11
select dayofmonth(b) from t1;
dayofmonth(b)
12
drop table t1;
create table t1(a TINYINT,b TINYINT);
insert into t1 values(126.999999,12.22);
select dayofmonth(a) from t1;
dayofmonth(a)
27
select dayofmonth(b) from t1;
dayofmonth(b)
NULL
Warnings:
Warning	5086	Not timestamp Can not cast varchar value to timestamp type
drop table t1;
create table t1(a SMALLINT,b SMALLINT);
insert into t1 values(20913.999999,927.1111);
select dayofmonth(a) from t1;
dayofmonth(a)
14
select dayofmonth(b) from t1;
dayofmonth(b)
27
drop table t1;
create table t1(a MEDIUMINT,b MEDIUMINT);
insert into t1 values(220929.99,220927.1111);
select dayofmonth(a) from t1;
dayofmonth(a)
30
select dayofmonth(b) from t1;
dayofmonth(b)
27
drop table t1;
create table t1(a INT,b int);
insert into t1 values(220913.999999,220927.1111);
select dayofmonth(a) from t1;
dayofmonth(a)
14
select dayofmonth(b) from t1;
dayofmonth(b)
27
drop table t1;
create table t1(a INTEGER,b INTEGER);
insert into t1 values(220913.999999,220927.1111);
select dayofmonth(a) from t1;
dayofmonth(a)
14
select dayofmonth(b) from t1;
dayofmonth(b)
27
drop table t1;
create table t1(a BIGINT,b BIGINT);
insert into t1 values(220913.999999,220927.1111);
select dayofmonth(a) from t1;
dayofmonth(a)
14
select dayofmonth(b) from t1;
dayofmonth(b)
27
drop table t1;
create table t1(a DECIMAL,b DECIMAL);
insert into t1 values(220913.999999,220927.1111);
Warnings:
Warning	1265	Data truncated for column 'a' at row 1
Warning	1265	Data truncated for column 'b' at row 1
select dayofmonth(a) from t1;
dayofmonth(a)
14
select dayofmonth(b) from t1;
dayofmonth(b)
27
drop table t1;
create table t1(a NUMERIC,b NUMERIC);
insert into t1 values(220913.999999,220927.1111);
Warnings:
Warning	1265	Data truncated for column 'a' at row 1
Warning	1265	Data truncated for column 'b' at row 1
select dayofmonth(a) from t1;
dayofmonth(a)
14
select dayofmonth(b) from t1;
dayofmonth(b)
27
drop table t1;
create table t1(a FLOAT,b FLOAT);
insert into t1 values(220913.999999,220927.1111);
select dayofmonth(a) from t1;
dayofmonth(a)
14
select dayofmonth(b) from t1;
dayofmonth(b)
27
drop table t1;
create table t1(a DOUBLE,b DOUBLE);
insert into t1 values(220913.999999,220927.1111);
select dayofmonth(a) from t1;
dayofmonth(a)
13
select dayofmonth(b) from t1;
dayofmonth(b)
27
drop table t1;
create table t1(a BIT,b bit);
insert into t1 values(0,1);
select dayofmonth(a) from t1;
dayofmonth(a)
NULL
Warnings:
Warning	5086	Not timestamp Can not cast varchar value to timestamp type
select dayofmonth(b) from t1;
dayofmonth(b)
NULL
Warnings:
Warning	5086	Not timestamp Can not cast varchar value to timestamp type
drop table t1;
create table t1(a DATETIME,b DATETIME);
insert into t1 values(220913,220927);
select dayofmonth(a) from t1;
dayofmonth(a)
13
select dayofmonth(b) from t1;
dayofmonth(b)
27
drop table t1;
create table t1(a TIMESTAMP,b TIMESTAMP);
insert into t1 values('2022-09-13 23:59:59.999999','2038-01-19 03:14:07.999999');
select dayofmonth(a) from t1;
dayofmonth(a)
14
select dayofmonth(b) from t1;
dayofmonth(b)
19
drop table t1;
create table t1(a DATE,b DATE);
insert into t1 values('1970-01-01 23:59:59','2038-01-19 03:14:07');
select dayofmonth(a) from t1;
dayofmonth(a)
1
select dayofmonth(b) from t1;
dayofmonth(b)
19
drop table t1;
create table t1(a TIME,b TIME);
insert into t1 values('23:59:59.999999','2038-01-19 23:59:59.999999');
drop table t1;
create table t1(a YEAR,b year);
insert into t1 values('2022','2038');
select dayofmonth(a) from t1;
dayofmonth(a)
NULL
Warnings:
Warning	5086	Not timestamp Can not cast varchar value to timestamp type
select dayofmonth(b) from t1;
dayofmonth(b)
NULL
Warnings:
Warning	5086	Not timestamp Can not cast varchar value to timestamp type
drop table t1;
create table t1(a VARCHAR(50),b VARCHAR(50));
insert into t1 values('2022-09-27 23:59:59.999999','2038-01-19 23:59:59.999999');
select dayofmonth(a) from t1;
dayofmonth(a)
27
select dayofmonth(b) from t1;
dayofmonth(b)
19
drop table t1;
create table t1(a VARBINARY(50),b VARBINARY(50));
insert into t1 values('2022-09-27 23:59:59.999999','2038-01-19 23:59:59.999999');
select dayofmonth(a) from t1;
dayofmonth(a)
27
select dayofmonth(b) from t1;
dayofmonth(b)
19
drop table t1;
create table t1(a CHAR(50),b CHAR(50));
insert into t1 values('2022-09-27 23:59:59.999999','2038-01-19 23:59:59.999999');
select dayofmonth(a) from t1;
dayofmonth(a)
27
select dayofmonth(b) from t1;
dayofmonth(b)
19
drop table t1;
create table t1(a BINARY(10),b BINARY(10));
insert into t1 values('10111101','11111011');
select dayofmonth(a) from t1;
dayofmonth(a)
NULL
Warnings:
Warning	5086	Not timestamp Can not cast varchar value to timestamp type
select dayofmonth(b) from t1;
dayofmonth(b)
NULL
Warnings:
Warning	5086	Not timestamp Can not cast varchar value to timestamp type
drop table t1;
create table t1(a enum ('2022-09-27 23:59:59.999999','2038-01-19 23:59:59.999999'),b enum ('10111101','11111011'));
insert into t1 values('2022-09-27 23:59:59.999999','10111101');
select dayofmonth(a) from t1;
dayofmonth(a)
27
select dayofmonth(b) from t1;
dayofmonth(b)
1
drop table t1;
create table t1(a set ('2022-09-27 23:59:59.999999','2038-01-19 23:59:59.999999'),b set ('10111101','11111011'));
insert into t1 values('2022-09-27 23:59:59.999999','10111101');
select dayofmonth(a) from t1;
dayofmonth(a)
27
select dayofmonth(b) from t1;
dayofmonth(b)
1
drop table t1;
create table t1(a TINYTEXT,b TINYTEXT);
insert into t1 values('2022-09-27 23:59:59.999999','10111101');
select dayofmonth(a) from t1;
dayofmonth(a)
27
select dayofmonth(b) from t1;
dayofmonth(b)
1
drop table t1;
create table t1(a TINYBLOB,b TINYBLOB);
insert into t1 values('2022-09-27 23:59:59.999999','10111101');
select dayofmonth(a) from t1;
dayofmonth(a)
27
select dayofmonth(b) from t1;
dayofmonth(b)
1
drop table t1;
create table t1(a TEXT,b TEXT);
insert into t1 values('2022-09-27 23:59:59.999999','10111101');
select dayofmonth(a) from t1;
dayofmonth(a)
27
select dayofmonth(b) from t1;
dayofmonth(b)
1
drop table t1;
create table t1(a BLOB,b BLOB);
insert into t1 values('2022-09-27 23:59:59.999999','10111101');
select dayofmonth(a) from t1;
dayofmonth(a)
27
select dayofmonth(b) from t1;
dayofmonth(b)
1
drop table t1;
create table t1(a MEDIUMTEXT,b MEDIUMTEXT);
insert into t1 values('2022-09-27 23:59:59.999999','10111101');
select dayofmonth(a) from t1;
dayofmonth(a)
27
select dayofmonth(b) from t1;
dayofmonth(b)
1
drop table t1;
create table t1(a MEDIUMBLOB,b MEDIUMBLOB);
insert into t1 values('2022-09-27 23:59:59.999999','10111101');
select dayofmonth(a) from t1;
dayofmonth(a)
27
select dayofmonth(b) from t1;
dayofmonth(b)
1
drop table t1;
create table t1(a LONGTEXT,b LONGTEXT);
insert into t1 values('2022-09-27 23:59:59.999999','10111101');
select dayofmonth(a) from t1;
dayofmonth(a)
27
select dayofmonth(b) from t1;
dayofmonth(b)
1
drop table t1;
create table t1(a LONGBLOB,b LONGBLOB);
insert into t1 values('2022-09-27 23:59:59.999999','10111101');
select dayofmonth(a) from t1;
dayofmonth(a)
27
select dayofmonth(b) from t1;
dayofmonth(b)
1
drop table t1;
create table t1 (c1 int ,c2 varchar(40),c3 date);
insert into t1 values(1,'test01','20220811');
insert into t1 values(2,'test02','20220915');
insert into t1 values(3,'test03','2022-08-20');
insert into t1 values(4,'test04','2022-09-15');
select * from t1;
c1	c2	c3
1	test01	2022-08-11
2	test02	2022-09-15
3	test03	2022-08-20
4	test04	2022-09-15
drop table t2;
create table t2 (a1 int ,a2 varchar(20));
insert into t2(a1, a2)  select 1,dayofmonth('2022-09-15');
select * from t2;
a1	a2
1	15
drop table t2;
insert into t1(c1) values(-dayofmonth('2022-09-15'));
insert into t1(c1) values(+dayofmonth('2022-09-15'));
insert into t1(c2) values(-dayofmonth('2022-09-15'));
insert into t1(c1) values(dayofmonth('2022-09-15')+dayofmonth('2022-09-15'));
insert into t1(c1) values(dayofmonth('2022-09-15')*dayofmonth('2022-09-15'));
insert into t1(c1) values(dayofmonth('2022-09-15')/1);
##预期插入失败,OB插入成功,此处bug
insert into t1 values(dayofmonth('2022-09-15')%1,dayofmonth('2022-09-15')%1,dayofmonth('2022-09-15')%1);
insert into t1 values(dayofmonth('2022-09-15') mod 1,dayofmonth('2022-09-15') mod 1,dayofmonth('2022-09-15') mod 1);
insert into t1 values(dayofmonth('2022-09-15') div 1,dayofmonth('2022-09-15') div 1,dayofmonth('2022-09-15') div 1);
ERROR 22007: Incorrect datetime value for column 'c3' at row 1
insert into t1 values(dayofmonth('2022-09-15')+0%1,dayofmonth('2022-09-15')+1%1,dayofmonth('2022-09-15')+1%1);
ERROR 22007: Incorrect datetime value for column 'c3' at row 1
insert into t1 values(dayofmonth('2022-09-15')-1 div 1,dayofmonth('2022-09-15')-2 div 1,dayofmonth('2022-09-15')-1 div 1);
ERROR 22007: Incorrect datetime value for column 'c3' at row 1
insert into t1 values(dayofmonth('2022-09-15')-1 mod 1,dayofmonth('2022-09-15')-1 mod 1,dayofmonth('2022-09-15')-1 mod 1);
ERROR 22007: Incorrect datetime value for column 'c3' at row 1
insert into t1 values(dayofmonth('2022-09-15')-1 * 1,dayofmonth('2022-09-15')-1 * 1,dayofmonth('2022-09-15')-1 * 1);
ERROR 22007: Incorrect datetime value for column 'c3' at row 1
select * from t1;
c1	c2	c3
1	test01	2022-08-11
2	test02	2022-09-15
3	test03	2022-08-20
4	test04	2022-09-15
-15	NULL	NULL
15	NULL	NULL
NULL	-15	NULL
30	NULL	NULL
225	NULL	NULL
15	NULL	NULL
0	0	0000-00-00
0	0	0000-00-00
drop table t1;
## update
create table t1 (c1 int ,c2 varchar(20),c3 date);
insert into t1 values(1,'test01','20220811');
insert into t1 values(2,'test02','20220915');
insert into t1 values(3,'test03','2022-08-20');
insert into t1 values(4,'test04','2022-09-15');
update t1 set c1= dayofmonth(20220811) where c2='test01';
update t1 set c1= dayofmonth(20220811)+0 where c2='test01';
update t1 set c1= dayofmonth(20220811) where c2 in ('test01','test02');
update t1 set c1= dayofmonth(20220811),c3=dayofmonth(20220811) where c2 in ('test01','test02');
ERROR 22007: Incorrect datetime value for column 'c3' at row 1
update t1 set c1= dayofmonth(20220811),c3=dayofmonth(20220811)+0 where c2 in ('test01','test02');
ERROR 22007: Incorrect datetime value for column 'c3' at row 1
update t1 set c1= dayofmonth(20220811) where c3>dayofmonth(20220811);
ERROR 22007: Incorrect value
update t1 set c1= dayofmonth(20220811)+0  where c3>dayofmonth(20220811)+0;
ERROR 22007: Incorrect value
update t1 set c1= dayofmonth(20220811) where c3>dayofmonth(20220811);
ERROR 22007: Incorrect value
update t1 set c1= dayofmonth(20220811)+0  where c3<dayofmonth(20220811)+0;
ERROR 22007: Incorrect value
update t1 set c1= dayofmonth(20220811) where c3=dayofmonth(20220811);
ERROR 22007: Incorrect value
update t1 set c1= dayofmonth(20220811) where c3<=dayofmonth(20220811);
ERROR 22007: Incorrect value
update t1 set c1= dayofmonth(20220811) where c3 between dayofmonth() and dayofmonth(20220811)+3 ;
ERROR 42000: Incorrect parameter count in the call to native function 'dayofmonth'
update t1 set c1= dayofmonth(20220811)+0 where c3 = dayofmonth(20220811)  or c1=dayofmonth(20220811) ;
ERROR 22007: Incorrect value
update t1 set c1= dayofmonth(20220811)+0 where c2 like 'test%' ;
update t1 set c1= dayofmonth(20220811) where c2 not like 'test%' ;
##OB and mysql5.7 returns success ; mysq8.0 returns error 1292;
update t1 set c1= dayofmonth(20220812) where c3>any(select dayofmonth(20220811));
ERROR 22007: Incorrect value
update t1 set c1= dayofmonth(20220811)+1 where c3<all(select dayofmonth(20220811));
ERROR 22007: Incorrect value
update t1 set c1= abs(dayofmonth(20220811));
update t1 set c1= abs(dayofmonth(20220811)+1);
update t1 set c1= TO_DAYS(dayofmonth(20220811));
ERROR 22007: Incorrect datetime value for column 'c1' at row 1
update t1 set c1= LOCATE(dayofmonth(20220811)-1,dayofmonth(20220811));
update t1 set c1= DATE_ADD(dayofmonth()+0,INTERVAL 5 DAY);
ERROR 42000: Incorrect parameter count in the call to native function 'dayofmonth'
select * from t1;
c1	c2	c3
0	test01	2022-08-11
0	test02	2022-09-15
0	test03	2022-08-20
0	test04	2022-09-15
drop table t1;
##delete
create table t1 (c1 int ,c2 varchar(20),c3 date);
insert into t1 values(1,dayofmonth('20220907'),'20220907');
insert into t1 values(2,dayofmonth(20220909),'20220909');
insert into t1 values(3,dayofmonth('2022-08-20'),'2022-08-20');
insert into t1 values(4,dayofmonth('2022-09-15'),'2022-09-15');
insert into t1 values(5,dayofmonth('2022-09-16'),'2022-09-16');
select * from t1;
c1	c2	c3
1	7	2022-09-07
2	9	2022-09-09
3	20	2022-08-20
4	15	2022-09-15
5	16	2022-09-16
delete  from t1 where c2 = dayofmonth('2022-09-16');
delete from t1 where dayofmonth(c3) = 15;
select * from t1;
c1	c2	c3
1	7	2022-09-07
2	9	2022-09-09
3	20	2022-08-20
drop table t1;
create table t1(c1 int, c2 varchar(30));
alter  table t1 modify  column c1 int(dayofmonth('2022-09-13'));
ERROR 42000: You have an error in your SQL syntax; check the manual that corresponds to your OceanBase version for the right syntax to use near 'dayofmonth('2022-09-13'))' at line 1
alter  table t1 modify  column c1 varchar(30)  DEFAULT dayofmonth('2022-09-13');
ERROR 42000: You have an error in your SQL syntax; check the manual that corresponds to your OceanBase version for the right syntax to use near 'dayofmonth('2022-09-13')' at line 1
目前 OB 不支持这样改变列类型。小类型可以改大，大的不能改小。也不能跨大类型改。
alter  table t1 modify  column c1 varchar(30)  GENERATED ALWAYS AS (dayofmonth('2022-09-13')) STORED NOT NULL COMMENT '日期';
ERROR HY000: 'Changing the STORED status' is not supported for generated columns.
drop table t1;
create table t1 (c1 int primary key, c2 varchar(30)) partition by hash(dayofmonth(c1)) partitions 3;
ERROR HY000: Constant or random or timezone-dependent expressions in (sub)partitioning function are not allowed
create table t1 (c1 int primary key, c2 varchar(30)) partition by hash(c1) partitions 3;
insert into t1 values(1,dayofmonth('2022-09-15'));
insert into t1 values(2,dayofmonth('2022-09-16'));
insert into t1 values(3,dayofmonth('2022-09-17'));
insert into t1 values(4,dayofmonth('2022-09-18'));
select * from t1;
c1	c2
3	17
1	15
4	18
2	16
update t1 set c2 =dayofmonth('2022-09-19');
delete from t1 where c2 =dayofmonth('2022-09-19');
select * from t1;
c1	c2
drop table t1;
drop table t1;
create table t1 (c1 int primary key, c2 varchar(30)) partition by range(c1) (
PARTITION p0 VALUES LESS THAN (2),
PARTITION p1 VALUES LESS THAN (4),
PARTITION p2 VALUES LESS THAN (6)
);
insert into t1 values(dayofmonth('2022-09-01'),'2022-09-01');
insert into t1 values(dayofmonth('2022-09-02'),'2022-09-02');
insert into t1 values(dayofmonth('2022-09-03'),'2022-09-03');
insert into t1 values(dayofmonth('2022-09-04'),'2022-09-04');
select * from t1;
c1	c2
1	2022-09-01
2	2022-09-02
3	2022-09-03
4	2022-09-04
update t1 set c2 =dayofmonth('2022-09-19');
delete from t1 where c2 =dayofmonth('2022-09-19');
select * from t1;
c1	c2
drop table t1;
drop table t1;
create table t1 (c1 int primary key, c2 varchar(30)) partition by list(c1) (
PARTITION p0 VALUES IN (1,2),
PARTITION p1 VALUES IN (3,4),
PARTITION p2 VALUES IN (5,6)
);
insert into t1 values(dayofmonth('2022-09-01'),'2022-09-01');
insert into t1 values(dayofmonth('2022-09-02'),'2022-09-02');
insert into t1 values(dayofmonth('2022-09-03'),'2022-09-03');
insert into t1 values(dayofmonth('2022-09-05'),'2022-09-05');
select * from t1;
c1	c2
1	2022-09-01
2	2022-09-02
3	2022-09-03
5	2022-09-05
update t1 set c2 =dayofmonth('2022-09-19');
delete from t1 where c2 =dayofmonth('2022-09-19');
select * from t1;
c1	c2
drop table t1;
drop table t1;
create table t1 (c1 int primary key, c2 varchar(30)) partition by key(dayofmonth(c1)) partitions 3;
ERROR 42000: You have an error in your SQL syntax; check the manual that corresponds to your OceanBase version for the right syntax to use near '(c1)) partitions 3' at line 1
create table t1 (c1 int primary key, c2 varchar(30)) partition by key(c1) partitions 3;
insert into t1 values(dayofmonth('2022-09-01'),'2022-09-01');
insert into t1 values(dayofmonth('2022-09-02'),'2022-09-02');
insert into t1 values(dayofmonth('2022-09-03'),'2022-09-03');
insert into t1 values(dayofmonth('2022-09-05'),'2022-09-05');
select * from t1 order by dayofmonth(c2);
c1	c2
1	2022-09-01
2	2022-09-02
3	2022-09-03
5	2022-09-05
update t1 set c2 =dayofmonth('2022-09-19');
delete from t1 where c2 =dayofmonth('2022-09-19');
select * from t1;
c1	c2
drop table t1;
## 视图
drop table t1;
create table t1 (c1 int ,c2 varchar(20),c3 date);
insert into t1 values(1,'test01','20220907');
insert into t1 values(2,'test02','20220909');
insert into t1 values(3,'test03','2022-08-20');
insert into t1 values(4,'test04','2022-09-15');
insert into t1 values(5,'test05','2022-09-16');
drop view t1_view;
create view t1_view as select * from t1;
select * from t1_view;
c1	c2	c3
1	test01	2022-09-07
2	test02	2022-09-09
3	test03	2022-08-20
4	test04	2022-09-15
5	test05	2022-09-16
select t1_view.*, dayofmonth(c3) from t1_view where dayofmonth(c3)=15;
c1	c2	c3	dayofmonth(c3)
4	test04	2022-09-15	15
select t1_view.*, dayofmonth(c3) from t1_view where dayofmonth(c3)>=15;
c1	c2	c3	dayofmonth(c3)
3	test03	2022-08-20	20
4	test04	2022-09-15	15
5	test05	2022-09-16	16
select t1_view.*, dayofmonth(c3) from t1_view where dayofmonth(c3)<=15;
c1	c2	c3	dayofmonth(c3)
1	test01	2022-09-07	7
2	test02	2022-09-09	9
4	test04	2022-09-15	15
select t1_view.*, dayofmonth(c3) from t1_view where dayofmonth(c3)=15;
c1	c2	c3	dayofmonth(c3)
4	test04	2022-09-15	15
select t1_view.*, dayofmonth(c3) from t1_view where dayofmonth(c3)<15;
c1	c2	c3	dayofmonth(c3)
1	test01	2022-09-07	7
2	test02	2022-09-09	9
select t1_view.*, dayofmonth(c3) from t1_view where dayofmonth(c3)>15;
c1	c2	c3	dayofmonth(c3)
3	test03	2022-08-20	20
5	test05	2022-09-16	16
select t1_view.*, dayofmonth(c3) from t1_view where dayofmonth(c3) between 15 and 16;
c1	c2	c3	dayofmonth(c3)
4	test04	2022-09-15	15
5	test05	2022-09-16	16
select t1_view.*, dayofmonth(c3) from t1_view where dayofmonth(c3) like '1%';
c1	c2	c3	dayofmonth(c3)
4	test04	2022-09-15	15
5	test05	2022-09-16	16
select t1_view.*, dayofmonth(c3) from t1_view where exists (select dayofmonth(c3),dayofmonth(c3));
c1	c2	c3	dayofmonth(c3)
1	test01	2022-09-07	7
2	test02	2022-09-09	9
3	test03	2022-08-20	20
4	test04	2022-09-15	15
5	test05	2022-09-16	16
select t1_view.*, dayofmonth(c3) from t1_view where 20 in  (select dayofmonth(c3));
c1	c2	c3	dayofmonth(c3)
3	test03	2022-08-20	20
select t1_view.*, dayofmonth(c3) from t1_view where 20 > all(select dayofmonth(c3));
c1	c2	c3	dayofmonth(c3)
1	test01	2022-09-07	7
2	test02	2022-09-09	9
4	test04	2022-09-15	15
5	test05	2022-09-16	16
select t1_view.*, dayofmonth(c3) from t1_view where c1 =2 or c2 ='test03';
c1	c2	c3	dayofmonth(c3)
2	test02	2022-09-09	9
3	test03	2022-08-20	20
select t1_view.*, dayofmonth(c3) from t1_view where c1 =2 and c2 ='test02';
c1	c2	c3	dayofmonth(c3)
2	test02	2022-09-09	9
insert into t1_view(c1) values(dayofmonth('202209167'));
ERROR 22007: Incorrect value
insert into t1_view(c1) values(dayofmonth('20220916'));
insert into t1_view(c1,c2,c3) values(0,dayofmonth('20220914'),'20220914');
insert into t1_view(c1,c2,c3) values(6,dayofmonth('20220918'),'20220918');
delete from t1_view where c1=dayofmonth('20220918');
drop table t1;
drop view t1_view;
##PL块
drop table t1;
drop table t2;
DROP PROCEDURE pro1;
CREATE  PROCEDURE pro1( out a varchar(30))
begin
select dayofmonth('2022-09-14') into a;
end;
//
CALL pro1(@aa);
select @aa;
@aa
14
DROP PROCEDURE pro1;
DROP PROCEDURE pro2;
CREATE  PROCEDURE pro2( out b int)
begin
select dayofmonth('2022-09-14') into b;
end;
//
CALL pro2(@bb);
select @bb;
@bb
14
DROP PROCEDURE pro2;
drop table t1;
create table t1(c1 int,c2 varchar(30));
DROP PROCEDURE pro3;
CREATE PROCEDURE pro3(in a varchar(20))
begin
declare i int;
set i=20220910;
while i <=20220914  DO
if i > a then
select dayofmonth(i);
end if;
insert into t1 values(i,dayofmonth(i));
set i = i + 1;
end WHILE;
end;
//
CALL pro3(20220920);
DROP PROCEDURE pro3;
drop table t1;
create table t1(c1 int,c2 varchar(30));
DROP PROCEDURE pro4;
CREATE PROCEDURE pro4(in a int)
begin
declare i int;
declare b int;
set i=20220910;
while i <=20220914  DO
if a =20220920 then
select dayofmonth(a);
end if;
insert into t1 values(a ,dayofmonth(a));
set i = i + 1;
end WHILE;
select a into b;
end;
//
CALL pro4(20220920);
dayofmonth(a)
dayofmonth(a)
dayofmonth(a)
dayofmonth(a)
dayofmonth(a)
20
20
20
20
20
select * from t1;
c1	c2
20220920	20
20220920	20
20220920	20
20220920	20
20220920	20
DROP PROCEDURE pro4;
drop table t1;
create table t1(c1 int,c2 varchar(30));
drop function  f1;
create function f1(aa  int) returns varchar(30)
begin
return dayofmonth(aa);
end;
//
select f1(20220914);
f1(20220914)
14
drop table t1;
drop function  f1;
##insert型触发器
drop table t1;
drop table t2;
drop trigger t1_trigger;
create table t1 (c1 int ,c2 varchar(20),c3 date);
insert into t1 values(1,'test01','20220907');
insert into t1 values(2,'test02','20220909');
insert into t1 values(3,'test03','2022-08-20');
insert into t1 values(4,'test04','2022-09-15');
insert into t1 values(5,'test05','2022-09-16');
select * from t1;
c1	c2	c3
1	test01	2022-09-07
2	test02	2022-09-09
3	test03	2022-08-20
4	test04	2022-09-15
5	test05	2022-09-16
create table t2 (a1 int ,a2 varchar(20));
insert into t2 values(1,'test08');
insert into t2 values(2,'test09');
select * from t2;
a1	a2
1	test08
2	test09
create trigger t1_trigger after insert on  t2
for each row
begin 
update t1 set c2=dayofmonth('2022-09-16') where c3="2022-09-16";
end //
insert into t2 values(3,'test03');
##update型触发器
drop table t1;
drop table t2;
drop trigger t1_trigger;
create table t1 (c1 int ,c2 varchar(20),c3 date);
insert into t1 values(1,'test01','20220907');
insert into t1 values(2,'test02','20220909');
insert into t1 values(3,'test03','2022-08-20');
insert into t1 values(4,'test04','2022-09-15');
insert into t1 values(5,'test05','2022-09-16');
select * from t1;
c1	c2	c3
1	test01	2022-09-07
2	test02	2022-09-09
3	test03	2022-08-20
4	test04	2022-09-15
5	test05	2022-09-16
create table t2 (a1 int ,a2 varchar(20));
insert into t2 values(1,'test08');
insert into t2 values(2,'test09');
select * from t2;
a1	a2
1	test08
2	test09
create trigger t1_trigger after update on  t2
for each row
begin 
update t1 set c2=dayofmonth('2022-09-16') where c3="2022-09-16";
end //
update t2 set a2=dayofmonth('2022-09-15') where a1=1;
##delete型触发器
drop table t1;
drop table t2;
drop trigger t1_trigger;
create table t1 (c1 int ,c2 varchar(20),c3 date);
insert into t1 values(1,'test01','20220907');
insert into t1 values(2,'test02','20220909');
insert into t1 values(3,'test03','2022-08-20');
insert into t1 values(4,'test04','2022-09-15');
insert into t1 values(5,'test05','2022-09-16');
select * from t1;
c1	c2	c3
1	test01	2022-09-07
2	test02	2022-09-09
3	test03	2022-08-20
4	test04	2022-09-15
5	test05	2022-09-16
create table t2 (a1 int ,a2 varchar(20));
insert into t2 values(1,'test08');
insert into t2 values(2,'test09');
select * from t2;
a1	a2
1	test08
2	test09
create trigger t1_trigger after delete on  t2
for each row
begin 
update t1 set c2=dayofmonth('2022-09-16') where c3="2022-09-16";
end //
delete from t2 where a1=2;
drop table t1;
drop table t2;
drop trigger t1_trigger;
##约束
drop table t1;
create table t1(c1 varchar(20) primary key,c2 varchar(20) default '10');
drop table t2;
create table t2(a1 varchar(20) unique key ,a2 varchar(20),a3 varchar(20),CONSTRAINT for_key FOREIGN KEY (a3) REFERENCES  t1 (c1));
drop table t3;
create table t3(b1 varchar(20) not null ,b2 varchar(20));
insert into t1 values(dayofmonth('2022-09-14'),dayofmonth('2022-09-15'));
insert into t1(c1) values(dayofmonth('2022-09-16'));
update t1 set c1=dayofmonth('2022-09-17'),c2=dayofmonth('2022-09-18') where c2='10';
select * from t1;
c1	c2
14	15
17	18
insert into t2 values(dayofmonth('2022-09-14'),'test',dayofmonth('2022-09-15'));
ERROR 23000: Cannot add or update a child row: a foreign key constraint fails
insert into t2 values('test',dayofmonth('2022-09-18'),dayofmonth('2022-09-17'));
select * from t2;
a1	a2	a3
test	18	17
update t2 set a1=dayofmonth('2022-09-18') where a3=dayofmonth('2022-09-17');
update t2 set a3=dayofmonth('2022-09-19');
ERROR 23000: Cannot add or update a child row: a foreign key constraint fails
update t3 set b1=null;
insert into t3 values(dayofmonth('2022-09-18'),dayofmonth('2022-09-16'));
select * from t3;
b1	b2
18	16
##索引
CREATE INDEX indexName ON t1 (c1);
insert into t1 values(dayofmonth('2022-09-18'),dayofmonth('2022-09-19'));
update t1 set c2=('2022-09-20')  where c2=dayofmonth('2022-09-19');
select * from t1 ;
c1	c2
14	15
17	18
18	2022-09-20
########清空回收站，删除测试数据库，表等 ##########
drop table t2;
drop table t1;
drop database  IF EXISTS db1;
