drop database if exists db1;
create database db1;
use db1;
#PL
#procedure
drop table if exists t1;
Warnings:
Note	1051	Unknown table 'db1.t1'
create table t1(c1 int,c2 int,c3 char(100));
drop procedure if exists pro1;
CREATE  PROCEDURE pro1()
begin
declare j int;
declare i int;
set j = 5;
set i = 1;
while i <= j DO
insert into t1 values(i,hour(20201212155050),hour('2022-02-02 18:06:06'));
set i = i + 1;
end WHILE;
end
//
call pro1();
select * from t1;
c1	c2	c3
1	15	18
2	15	18
3	15	18
4	15	18
5	15	18
drop   procedure if   exists   pro1;
create procedure pro1(aa int,bb int)
begin
if aa = bb then
update t1 set c2 = hour('2008-08-08 10:15:15') where c1 = 2 ;
elseif aa > bb then
update t1 set c2 = hour('1998-08-08 12:12:12') where c1 = 1 ;
else
update t1 set c2 = hour('14:14:14') where c1 = 3 ;
end if;
end
//
call pro1(1,1);
call pro1(2,1);
call pro1(0,1);
select * from t1;
c1	c2	c3
1	12	18
2	10	18
3	14	18
4	15	18
5	15	18
drop   procedure if   exists   pro1;
create procedure pro1()
begin
declare i int default 1;
while i <= 10 do
if mod(i,10) = 0 then
insert into t1 values(6,hour('1981-01-01 08:08:08'),hour(010101));
elseif mod(i,8)=0 then
insert into t1 values(7,hour('1987-07-07 09:09:09'),hour(020202));
elseif mod(i,7)=0 then
insert into t1 values(8,hour('1988-08-08 10:10:10'),hour(030303));
elseif mod(i,5)=0 then
insert into t1 values(9,hour('1909-09-09 11:11:11'),hour(040404));
elseif mod(i,3)=0 then
insert into t1 values(10,hour('2010-10-10 12:12:12'),hour(050505));
else
insert into t1 values(11,hour('2011-11-11 13:13:13'),hour(060606));
end if;
set i = i+1;
end while;
end
//
call pro1();
select * from t1;
c1	c2	c3
1	12	18
2	10	18
3	14	18
4	15	18
5	15	18
11	13	6
11	13	6
10	12	5
11	13	6
9	11	4
10	12	5
8	10	3
7	9	2
10	12	5
6	8	1
drop   procedure if   exists   pro1;
create procedure pro1(aa int,bb int)
begin
if aa = bb then
delete from t1 where c1 > 1 and c2 = hour('1988-10-02 10:10:10');
elseif aa > bb then
delete from t1 where c2 > hour('2011-02-02 10:10:10') and c3 = hour('2011-02-02 05:05:05');
else
delete from t1 where c3 = hour('1998-02-02 06:06:06');
end if;
end
//
call pro1(1,1);
call pro1(2,1);
call pro1(0,1);
select * from t1;
c1	c2	c3
1	12	18
3	14	18
4	15	18
5	15	18
9	11	4
7	9	2
6	8	1
drop   procedure if   exists   pro1;
create procedure pro1(aa int,bb int)
begin
if aa = bb then
select hour('2020-10-10 07:07:07'),hour(201010),hour('20220927141516');
elseif aa > bb then
select hour('0001-10-10 08:08:08'),hour(991231),hour('20001010050505');
else
select hour('5000-10-10 09:09:09'),hour(501010),hour('19990909090909');
end if;
end
//
call pro1(1,1);
hour('2020-10-10 07:07:07')	hour(201010)	hour('20220927141516')
7	20	14
call pro1(2,1);
hour('0001-10-10 08:08:08')	hour(991231)	hour('20001010050505')
8	99	5
call pro1(0,1);
hour('5000-10-10 09:09:09')	hour(501010)	hour('19990909090909')
9	50	9
#function
drop table if exists t1;
create table t1(c1 int,c2 int,c3 char(100));
drop function if exists func1;
CREATE  function func1() returns int
begin
declare j int;
declare i int;
set j = 5;
set i = 1;
while i <= j DO
insert into t1 values(i,hour(20201212155050),hour('2022-02-02 18:06:06'));
set i = i + 1;
end WHILE;
return hour('08:08:08');
end
//
select func1();
func1()
8
select * from t1;
c1	c2	c3
1	15	18
2	15	18
3	15	18
4	15	18
5	15	18
drop function if exists func1;
CREATE  function func1(aa int,bb int) returns int
begin
if aa = bb then
update t1 set c2 = hour('2008-08-08 10:15:15') where c1 = 2 ;
elseif aa > bb then
update t1 set c2 = hour('1998-08-08 12:12:12') where c1 = 1 ;
else
update t1 set c2 = hour('14:14:14') where c1 = 3 ;
end if;
return hour('08:08:08');
end
//
select func1(1,1);
func1(1,1)
8
select func1(2,1);
func1(2,1)
8
select func1(0,1);
func1(0,1)
8
select * from t1;
c1	c2	c3
1	12	18
2	10	18
3	14	18
4	15	18
5	15	18
drop function if exists func1;
CREATE  function func1() returns int
begin
declare i int default 1;
while i <= 10 do
if mod(i,10) = 0 then
insert into t1 values(6,hour('1981-01-01 08:08:08'),hour(010101));
elseif mod(i,8)=0 then
insert into t1 values(7,hour('1987-07-07 09:09:09'),hour(020202));
elseif mod(i,7)=0 then
insert into t1 values(8,hour('1988-08-08 10:10:10'),hour(030303));
elseif mod(i,5)=0 then
insert into t1 values(9,hour('1909-09-09 11:11:11'),hour(040404));
elseif mod(i,3)=0 then
insert into t1 values(10,hour('2010-10-10 12:12:12'),hour(050505));
else
insert into t1 values(11,hour('2011-11-11 13:13:13'),hour(060606));
end if;
set i = i+1;
end while;
return hour('06:06:06');
end
//
select func1();
func1()
6
select * from t1;
c1	c2	c3
1	12	18
2	10	18
3	14	18
4	15	18
5	15	18
11	13	6
11	13	6
10	12	5
11	13	6
9	11	4
10	12	5
8	10	3
7	9	2
10	12	5
6	8	1
drop function if exists func1;
create function func1(aa int,bb int) returns int
begin
if aa = bb then
delete from t1 where c1 > 1 and c2 = hour('1988-10-02 10:10:10');
elseif aa > bb then
delete from t1 where c2 > hour('2011-02-02 10:10:10') and c3 = hour('2011-02-02 05:05:05');
else
delete from t1 where c3 = hour('1998-02-02 06:06:06');
end if;
return hour('05:05:05');
end
//
select func1(1,1);
func1(1,1)
5
select func1(2,1);
func1(2,1)
5
select func1(0,1);
func1(0,1)
5
select * from t1;
c1	c2	c3
1	12	18
3	14	18
4	15	18
5	15	18
9	11	4
7	9	2
6	8	1
#trigger
drop   table     if   exists   t1;
drop   table     if   exists   t2;
Warnings:
Note	1051	Unknown table 'db1.t2'
create table t1(c1 int,c2 int);
insert into t1 values(1,21);
insert into t1 values(2,20);
create table t2(a1 int,a2 varchar(20));
insert into t2 values(2,'AA');
insert into t2 values(3,'cc');
drop trigger if exists tg1;
Warnings:
Note	1360	Trigger does not exist
create trigger tg1
AFTER
insert on t2
for each ROW
BEGIN
insert t1 values(hour('20:16:17'),hour('2000-08-08 14:15:16'));
END
//
insert into t2 values(1,1);
select * from t1;
c1	c2
1	21
2	20
20	14
drop trigger if exists tg1;
create trigger tg1
AFTER
update on t2
for each ROW
BEGIN
update t1 set c1 = hour('01:01:01') where c2 = hour('2001/01/01 20:20:20');
END
//
update t2 set a1 = 4 where a2 = 'AA';
select * from t1;
c1	c2
1	21
1	20
20	14
drop trigger if exists tg1;
create trigger tg1
AFTER
delete on t2
for each ROW
BEGIN
delete from t1 where c1 = hour('19990909201516');
END
//
delete from t2 where a1 = 3;
select * from t1;
c1	c2
1	21
1	20
drop database db1;
