drop database if exists db1;
create database db1;
use db1;
#参数
#最大返回值 838
select hour('838:00:00');
hour('838:00:00')
838
select hour('839:00:00');
hour('839:00:00')
838
select hour('0:59:59');
hour('0:59:59')
0
select hour('-12:05:05');
hour('-12:05:05')
12
select hour('-838:05:05');
hour('-838:05:05')
838
select hour('-839:05:05');
hour('-839:05:05')
838
select hour('22:12:-10');
hour('22:12:-10')
22
select hour('22:-12:-10');
hour('22:-12:-10')
0
select hour('-24:-22:-22');
hour('-24:-22:-22')
0
select hour('00:00:00');
hour('00:00:00')
0
select hour('00:00:71');
hour('00:00:71')
NULL
Warnings:
Warning	5086	Not timestamp Can not cast varchar value to timestamp type
select hour('00:60:00');
hour('00:60:00')
NULL
Warnings:
Warning	5086	Not timestamp Can not cast varchar value to timestamp type
select hour('60:00:00');
hour('60:00:00')
60
select hour('0:0:0');
hour('0:0:0')
0
select hour('000018:0001:01');
hour('000018:0001:01')
18
select hour('1:0000000101:1');
hour('1:0000000101:1')
NULL
Warnings:
Warning	5086	Not timestamp Can not cast varchar value to timestamp type
select hour('20');
hour('20')
0
select hour('88:08');
hour('88:08')
88
select hour('66:6:66');
hour('66:6:66')
NULL
Warnings:
Warning	5086	Not timestamp Can not cast varchar value to timestamp type
select hour('22:05:-05');
hour('22:05:-05')
22
#mysql返回3，OB返回2(精度超过6位后 MYSQL视为下一小时，OB不变)
select hour('2:59:59.9999999');
hour('2:59:59.9999999')
3
select hour('2022-09-20 23:59:59.9999999');
hour('2022-09-20 23:59:59.9999999')
0
select hour('0.555:55:55');
hour('0.555:55:55')
0
select hour('0.5:55:60');
hour('0.5:55:60')
0
select hour('0.99:71:88');
hour('0.99:71:88')
0
select hour('66:0.5:0.6');
hour('66:0.5:0.6')
66
select hour('1:59.9999999:60.00');
hour('1:59.9999999:60.00')
1
select hour('20:60:05');
hour('20:60:05')
NULL
Warnings:
Warning	5086	Not timestamp Can not cast varchar value to timestamp type
select hour('20:59.9:61.00');
hour('20:59.9:61.00')
20
select hour('5.9:20:02');
hour('5.9:20:02')
0
select hour('20.0001:20:02');
hour('20.0001:20:02')
0
#日期格式
select hour('2020-02-02 16:26:00');
hour('2020-02-02 16:26:00')
16
select hour('2020-02-02 25:26:00');
hour('2020-02-02 25:26:00')
NULL
Warnings:
Warning	5086	Not timestamp Can not cast varchar value to timestamp type
select hour('2020-02-02 24:00:00');
hour('2020-02-02 24:00:00')
NULL
Warnings:
Warning	5086	Not timestamp Can not cast varchar value to timestamp type
select hour('2020-02-02 23:59:59');
hour('2020-02-02 23:59:59')
23
select hour('2020-02-29 23:59:59');
hour('2020-02-29 23:59:59')
23
select hour('0000-01-01 01:00:00');
hour('0000-01-01 01:00:00')
1
#OB与MYSQL不一致。(OB返回NULL,MYSQL返回1)
select hour('2008-08-08 -23:50:50');
hour('2008-08-08 -23:50:50')
23
select hour('2008-08-08 -24:50:50');
hour('2008-08-08 -24:50:50')
NULL
Warnings:
Warning	5086	Not timestamp Can not cast varchar value to timestamp type
select hour('2008-08-08 -23:-50:50');
hour('2008-08-08 -23:-50:50')
23
select hour('2008-08-08 -23:-50:-50');
hour('2008-08-08 -23:-50:-50')
23
select hour('2008-08-08 -2.3:50:50');
hour('2008-08-08 -2.3:50:50')
2
select hour('1999-09-09 22:5.55:6');
hour('1999-09-09 22:5.55:6')
22
select hour('1999-09-09 22:5.555:6.666');
hour('1999-09-09 22:5.555:6.666')
NULL
Warnings:
Warning	5086	Not timestamp Can not cast varchar value to timestamp type
#字符串
select hour('20220921143456');
hour('20220921143456')
14
select hour('20080808121212');
hour('20080808121212')
12
select hour('2000.02.29 15:33:33');
hour('2000.02.29 15:33:33')
15
#OB与MYSQL不一致。
select hour('155959');
hour('155959')
15
select hour('0050505');
hour('0050505')
5
select hour('080000');
hour('080000')
8
select hour('125960');
hour('125960')
NULL
Warnings:
Warning	5086	Not timestamp Can not cast varchar value to timestamp type
select hour('9991111');
hour('9991111')
838
select hour('1');
hour('1')
0
select hour('11');
hour('11')
0
select hour('111');
hour('111')
0
select hour('1111');
hour('1111')
0
select hour('11111');
hour('11111')
1
#多个参数
select hour('10:10:10','10:10:10');
ERROR 42000: You have an error in your SQL syntax; check the manual that corresponds to your OceanBase version for the right syntax to use near ','10:10:10')' at line 1
#为空
select hour();
ERROR 42000: You have an error in your SQL syntax; check the manual that corresponds to your OceanBase version for the right syntax to use near ')' at line 1
select hour('');
hour('')
NULL
Warnings:
Warning	5086	Not timestamp Can not cast varchar value to timestamp type
#OB返回0，mysql返回NULL
select hour(' ');
hour(' ')
NULL
Warnings:
Warning	5086	Not timestamp Can not cast varchar value to timestamp type
#参数为数字
select hour(111111);
hour(111111)
11
select hour(000000);
hour(000000)
0
select hour(010000);
hour(010000)
1
select hour(9999999);
hour(9999999)
NULL
Warnings:
Warning	5086	Not timestamp Can not cast varchar value to timestamp type
select hour(-121212);
hour(-121212)
12
select hour(634);
hour(634)
0
select hour(060304);
hour(060304)
6
select hour(055660);
hour(055660)
NULL
Warnings:
Warning	5086	Not timestamp Can not cast varchar value to timestamp type
#中文
select hour('12时22分2秒');
hour('12时22分2秒')
0
select hour('2022年9月21日 12时22分2秒');
hour('2022年9月21日 12时22分2秒')
12
select hour('年月日');
hour('年月日')
NULL
Warnings:
Warning	5086	Not timestamp Can not cast varchar value to timestamp type
#特殊字符
#OB为NULL,MYSQL为0
select hour('@##%');
hour('@##%')
NULL
Warnings:
Warning	5086	Not timestamp Can not cast varchar value to timestamp type
select hour('@222#1#%$%3');
hour('@222#1#%$%3')
NULL
Warnings:
Warning	5086	Not timestamp Can not cast varchar value to timestamp type
select hour('@#%#%^#%');
hour('@#%#%^#%')
NULL
Warnings:
Warning	5086	Not timestamp Can not cast varchar value to timestamp type
select hour('/*-+*-*-');
hour('/*-+*-*-')
NULL
Warnings:
Warning	5086	Not timestamp Can not cast varchar value to timestamp type
select hour('{:}}{":"');
hour('{:}}{":"')
NULL
Warnings:
Warning	5086	Not timestamp Can not cast varchar value to timestamp type
#参数为不同类型测试
#INT
create table test1(c1 int , c2 int);
insert into test1 values(163535,020260);
select hour(c1) from test1;
hour(c1)
16
select hour(c2) from test1;
hour(c2)
NULL
Warnings:
Warning	5086	Not timestamp Can not cast varchar value to timestamp type
drop table test1;
#FLOAT
create table test1(c1 float , c2 float);
insert into test1 values(60.6060,121212.1212);
select hour(c1) from test1;
hour(c1)
NULL
Warnings:
Warning	5086	Not timestamp Can not cast varchar value to timestamp type
select hour(c2) from test1;
hour(c2)
12
drop table test1;
#DOUBLE
create table test1(c1 double , c2 double);
insert into test1 values(23.5959,161616.11111);
select hour(c1) from test1;
hour(c1)
0
select hour(c2) from test1;
hour(c2)
16
drop table test1;
#CHAR
create table test1(c1 char(100),c2 char(100));
insert into test1 values('181818','2022-09-21 16:38:00');
select hour(c1) from test1;
hour(c1)
18
select hour(c2) from test1;
hour(c2)
16
drop table test1;
#varchar
create table test1(c1 varchar(100),c2 varchar(100));
insert into test1 values('2000-01-01','20200202020202');
select hour(c1) from test1;
hour(c1)
0
select hour(c2) from test1;
hour(c2)
2
drop table test1;
#date
create table test1(c1 date,c2 date);
insert into test1 values('1000-01-01 10:10:55','10000101121231');
select hour(c1) from test1;
hour(c1)
0
select hour(c2) from test1;
hour(c2)
0
drop table test1;
#time
create table test1(c1 time,c2 time);
insert into test1 values('10:10:10','15:41:20');
select hour(c1) from test1;
hour(c1)
10
select hour(c2) from test1;
hour(c2)
15
drop table test1;
#year
create table test1(c1 year,c2 year);
insert into test1 values('1901','2155');
#OB返回NULL,mysql返回0
select hour(c1) from test1;
hour(c1)
NULL
Warnings:
Warning	5086	Not timestamp Can not cast varchar value to timestamp type
select hour(c2) from test1;
hour(c2)
NULL
Warnings:
Warning	5086	Not timestamp Can not cast varchar value to timestamp type
drop table test1;
#datetime
create table test1(c1 datetime,c2 datetime);
insert into test1 values('9999-12-31 23:59:59','1000-01-01 00:00:00');
select hour(c1) from test1;
hour(c1)
23
select hour(c2) from test1;
hour(c2)
0
drop table test1;
#timestamp
create table test1(c1 timestamp,c2 timestamp);
insert into test1 values('1970-01-01 00:00:01','2038-01-19 03:14:07');
select hour(c1) from test1;
hour(c1)
0
select hour(c2) from test1;
hour(c2)
3
drop table test1;
#decimal
create table test1(c1 decimal(5,2),c2 decimal(15,5));
insert into test1 values(202.12,20210922.1030);
select hour(c1) from test1;
hour(c1)
0
#OB返回838，MYQSL返回NULL
select hour(c2) from test1;
hour(c2)
NULL
Warnings:
Warning	5086	Not timestamp Can not cast varchar value to timestamp type
drop table test1;
#bit
create table test1(c1 bit(64),c2 bit(64));
insert into test1 values(20200202,b'11101010101');
select hour(c1) from test1;
hour(c1)
NULL
Warnings:
Warning	5086	Not timestamp Can not cast varchar value to timestamp type
select hour(c2) from test1;
hour(c2)
NULL
Warnings:
Warning	5086	Not timestamp Can not cast varchar value to timestamp type
drop table test1;
#enum
create table test1(c1 enum('16:50:59','101010','2020-02-02 13:13:13'));
insert into test1 values('16:50:59');
insert into test1 values('101010');
insert into test1 values('2020-02-02 13:13:13');
select hour(c1) from test1;
hour(c1)
16
10
13
drop table test1;
#set
create table test1(c1 set('16:50:59','101010','2020-02-02 13:13:13'));
insert into test1 values('16:50:59');
insert into test1 values('101010');
insert into test1 values('2020-02-02 13:13:13');
select hour(c1) from test1;
hour(c1)
16
10
13
drop table test1;
#select
drop table if exists t1;
Warnings:
Note	1051	Unknown table 'db1.t1'
create table t1(c1 int ,c2 varchar(60) not null,c3 datetime default '1999-09-09 18:16:30');
insert into t1 values(165050,'18:30:30','2001-02-02 03:03:03');
insert into t1(c1,c2) values(050101,'04:50:50');
insert into t1 values(071313,'080808','1880-05-05 05:05:05');
insert into t1 values(101010,'11:11:11','0001-01-01 01:01:01');
insert into t1(c1,c2) values(121212,'15:20:20');
insert into t1 values(165050,'99990909090909','0001-01-01 01:01:01');
insert into t1 values(101010,'2020.02.02','0001-01-01 01:01:01');
select hour(c1),hour(c2),hour(c3) from t1 order by hour(c1);
hour(c1)	hour(c2)	hour(c3)
5	4	18
7	8	5
10	11	1
10	0	1
12	15	18
16	18	3
16	9	1
#where
select hour(c1) from t1 where hour(c1) > 5 and hour(c2) <10;
hour(c1)
7
16
10
select hour(c3) from t1 where hour(c2) < 3 and hour(c3) >0;
hour(c3)
1
select hour(c2) from t1 where hour(c1)>3 order by hour(c2);
hour(c2)
0
4
8
9
11
15
18
select c1,case hour(c1) when hour(c1)> 5 then hour('202020') else hour('101010') end as a from t1;
c1	a
165050	10
50101	10
71313	10
101010	10
121212	10
165050	10
101010	10
select c1, case c2 when '11111111' then hour('1111') else hour('080808') end as a from t1;
c1	a
165050	8
50101	8
71313	8
101010	8
121212	8
165050	8
101010	8
select distinct hour(c1),c2,c3 from t1 order by hour(c1);
hour(c1)	c2	c3
5	04:50:50	1999-09-09 18:16:30
7	080808	1880-05-05 05:05:05
10	11:11:11	0001-01-01 01:01:01
10	2020.02.02	0001-01-01 01:01:01
12	15:20:20	1999-09-09 18:16:30
16	18:30:30	2001-02-02 03:03:03
16	99990909090909	0001-01-01 01:01:01
select distinct hour(c3) ,c1,c3 from t1 order by hour(c3);
hour(c3)	c1	c3
1	101010	0001-01-01 01:01:01
1	165050	0001-01-01 01:01:01
3	165050	2001-02-02 03:03:03
5	71313	1880-05-05 05:05:05
18	50101	1999-09-09 18:16:30
18	121212	1999-09-09 18:16:30
select hour(c1) from t1 group by c1 having hour(c1) >3;
hour(c1)
16
5
7
10
12
#insert    不同数据类型插入
#INT
create table test1(c1 int , c2 int);
insert into test1 values(hour('18:50:50'),hour('101515'));
insert into test1 values(hour('20:08:08'),hour('90:59:59'));
select * from test1;
c1	c2
18	10
20	90
drop table test1;
#FLOAT
create table test1(c1 float , c2 float);
insert into test1 values(hour('195045'),hour('2020-02-02 12:30:30'));
insert into test1 values(hour('13:01:01'),hour('19980909090909'));
select * from test1;
c1	c2
19	12
13	9
drop table test1;
#double
create table test1(c1 double , c2 double);
insert into test1 values(hour('aaaa'),hour('12:12:12'));
ERROR 22007: Incorrect value
insert into test1 values(hour('08:50:50'),hour('101112'));
select * from test1;
c1	c2
8	10
drop table test1;
#char(100)
create table test1(c1 char(100),c2 char(100));
insert into test1 values(hour('341122'),hour('2121-01-01 23:30:30'));
insert into test1 values(hour('1101-01-01 14:20:20'),hour('222201'));
select * from test1;
c1	c2
34	23
14	22
drop table test1;
#varchar
create table test1(c1 varchar(100),c2 varchar(100));
insert into test1 values(hour('1998-09-09 20:20:20'),hour(101010));
insert into test1 values(hour('222211'),hour('9999-09-19 09:09:09'));
select * from test1;
c1	c2
20	10
22	9
drop table test1;
#date
create table test1(c1 date,c2 date);
insert into test1 values(hour('010101'),hour('020202'));
ERROR 22007: Incorrect datetime value for column 'c1' at row 1
insert into test1 values(hour('665040'),hour(992121));
ERROR 22007: Incorrect datetime value for column 'c1' at row 1
select * from test1;
c1	c2
drop table test1;
#time
create table test1(c1 time,c2 time);
insert into test1 values(hour('2020-08-08 20:00:00'),hour('055059'));
insert into test1 values(hour('1998-08-08 3:00:00'),hour('771717'));
ERROR 22007: Incorrect datetime value for column 'c2' at row 1
select * from test1;
c1	c2
00:00:20	00:00:05
drop table test1;
#year
create table test1(c1 year,c2 year);
insert into test1 values(hour('201010'),hour('990909'));
insert into test1 values(hour('162020'),hour(111516));
select * from test1;
c1	c2
2020	1999
2016	2011
drop table test1;
#datetime
create table test1(c1 datetime,c2 datetime);
insert into test1 values(hour('2001-01-01 01:01:01'),hour(010101));
ERROR 22007: Incorrect datetime value for column 'c1' at row 1
insert into test1 values(hour('222211'),hour('22:20:20'));
ERROR 22007: Incorrect datetime value for column 'c1' at row 1
select * from test1;
c1	c2
drop table test1;
#datetime
create table test1(c1 timestamp,c2 timestamp);
insert into test1 values(hour('2001-01-01 01:01:01'),hour(010101));
ERROR 22007: Incorrect datetime value for column 'c1' at row 1
insert into test1 values(hour('222211'),hour('22:20:20'));
ERROR 22007: Incorrect datetime value for column 'c1' at row 1
select * from test1;
c1	c2
drop table test1;
#decimal
#MYSQL报错，OB正常执行
#bit
create table test1(c1 bit(64),c2 bit(64));
insert into test1 values(hour('06:30:31'),hour('2007-07-07 07:32:33'));
insert into test1 values(hour('08:33:34'),hour(093536));
select bin(c1),bin(c2) from test1;
bin(c1)	bin(c2)
110	111
1000	1001
drop table test1;
#enum
create table test1(c1 enum('10','11','12'));
insert into test1 values(hour('10:50:59'));
ERROR 01000: Data truncated for column 'c1' at row 1
insert into test1 values(hour('11:51:58'));
ERROR 01000: Data truncated for column 'c1' at row 1
select * from test1;
c1
drop table test1;
#set
create table test1(c1 set('10','11','12'));
insert into test1 values(hour('10:50:59'));
ERROR 01000: Data truncated for column 'c1' at row 1
insert into test1 values(hour('11:51:58'));
ERROR 01000: Data truncated for column 'c1' at row 1
select * from test1;
c1
drop table test1;
#update、delete
drop table if exists test1;
Warnings:
Note	1051	Unknown table 'db1.test1'
create table test1(a1 int,a2 char(20),c1 datetime,c2 datetime);
insert into test1 values(1,'1998-12-12 02:02:02','1998-12-12 03:12:12','2038-01-19 11:14:07');
insert into test1 values(2,'2002-02-02 04:04:04','2002-02-02 05:00:00','2034-02-22 12:50:20');
insert into test1 values(3,'2006-04-15 06:06:06','2006-04-15 07:06:20','2026-05-08 13:16:50');
insert into test1 values(4,'2012-12-12 08:08:08','2012-12-12 09:12:12','2030-08-16 14:05:50');
select * from test1;
a1	a2	c1	c2
1	1998-12-12 02:02:02	1998-12-12 03:12:12	2038-01-19 11:14:07
2	2002-02-02 04:04:04	2002-02-02 05:00:00	2034-02-22 12:50:20
3	2006-04-15 06:06:06	2006-04-15 07:06:20	2026-05-08 13:16:50
4	2012-12-12 08:08:08	2012-12-12 09:12:12	2030-08-16 14:05:50
create table test2(a1 int,a2 int);
insert into test2 values(1,1),(2,2),(3,3),(4,4),(5,5),(6,6),(7,7),(8,8),(9,9),(10,10),(11,11),(12,12),(13,13),(14,14);
update test1 set a1 = hour('11:11:11') where hour(a2) = (select a1 from test2 where a1 = 2);
update test1 set a1 = hour('12:12:12') where hour(c1) = 3 and hour(c2) = 11;
delete from test1 where hour(c1)> hour('2006-04-15 07:06:20') and hour(c2) > hour('2038-01-19 01:14:07');
delete from test1 where hour(c2) =(select a1 from test2 where a1 = 11);
delete from test1 where hour(c1) != 1;
drop table test1;
#复制表
drop table if exists t1;
create table t1(c1 int ,c2 varchar(60) not null,c3 datetime default '1999-09-09 18:16:30');
insert into t1 values(165050,'18:30:30','2001-02-02 03:03:03');
insert into t1(c1,c2) values(050101,'04:50:50');
insert into t1 values(071313,'080808','1880-05-05 05:05:05');
insert into t1 values(101010,'11:11:11','0001-01-01 01:01:01');
insert into t1(c1,c2) values(121212,'15:20:20');
insert into t1 values(165050,'99990909090909','0001-01-01 01:01:01');
create table tt1 as select * from t1;
#select
select hour(c1),hour(c2),hour(c3) from tt1 order by hour(c1);
hour(c1)	hour(c2)	hour(c3)
5	4	18
7	8	5
10	11	1
12	15	18
16	18	3
16	9	1
select hour(c1) from tt1 where hour(c1) > 5 and hour(c2) <10;
hour(c1)
7
16
select hour(c2) from tt1 where hour(c1)>3 order by hour(c2);
hour(c2)
4
8
9
11
15
18
select c1,case hour(c1) when hour(c1)> 5 then hour('202020') else hour('101010') end as a from tt1;
c1	a
165050	10
50101	10
71313	10
101010	10
121212	10
165050	10
select c1, case c2 when '11111111' then hour('1111') else hour('080808') end as a from tt1;
c1	a
165050	8
50101	8
71313	8
101010	8
121212	8
165050	8
select distinct hour(c1),c2,c3 from tt1 order by hour(c1);
hour(c1)	c2	c3
5	04:50:50	1999-09-09 18:16:30
7	080808	1880-05-05 05:05:05
10	11:11:11	0001-01-01 01:01:01
12	15:20:20	1999-09-09 18:16:30
16	18:30:30	2001-02-02 03:03:03
16	99990909090909	0001-01-01 01:01:01
select distinct hour(c3) ,c1,c3 from tt1 order by hour(c3);
hour(c3)	c1	c3
1	101010	0001-01-01 01:01:01
1	165050	0001-01-01 01:01:01
3	165050	2001-02-02 03:03:03
5	71313	1880-05-05 05:05:05
18	50101	1999-09-09 18:16:30
18	121212	1999-09-09 18:16:30
select hour(c1) from tt1 group by c1 having hour(c1) >3;
hour(c1)
16
5
7
10
12
#update
update tt1 set c1 = hour('665959') where hour(c2) > 5 and hour(c3) < 5;
update tt1 set c2 = hour('01:01:01') where hour(c3) = (select a1 from test2 where a1 = 5);
select * from tt1;
c1	c2	c3
66	18:30:30	2001-02-02 03:03:03
50101	04:50:50	1999-09-09 18:16:30
71313	1	1880-05-05 05:05:05
66	11:11:11	0001-01-01 01:01:01
121212	15:20:20	1999-09-09 18:16:30
66	99990909090909	0001-01-01 01:01:01
#delete
delete from tt1 where c1 = (select hour('66:59:58') from test2 limit 1);
delete from tt1 where hour(c2) != hour('010101');
select * from tt1;
c1	c2	c3
drop table t1;
drop table tt1;
#分区
#hash
drop table if exists t1;
Warnings:
Note	1051	Unknown table 'db1.t1'
create table t1(c1 int,c2 datetime) partition by hash(c1)
(
partition p1,
partition p2
);
insert into t1 values(114040,'1991-01-01 02:08:08');
insert into t1 values(123020,'2001-03-01 04:08:08');
insert into t1 values(131516,'2011-05-01 06:08:08');
insert into t1 values(141516,'2021-07-01 08:08:08');
insert into t1 values(141617,'2021-07-01 10:08:08');
select * from t1;
c1	c2
114040	1991-01-01 02:08:08
123020	2001-03-01 04:08:08
131516	2011-05-01 06:08:08
141516	2021-07-01 08:08:08
141617	2021-07-01 10:08:08
select * from t1 where hour(c2) > 1 group by hour(c1) having max(hour(c2))<10;
c1	c2
114040	1991-01-01 02:08:08
123020	2001-03-01 04:08:08
131516	2011-05-01 06:08:08
update t1 set c1 = hour('060606') where hour(c2) > 5;
delete from t1 where hour(c2) > 5 and hour(c1) = 6;
select * from t1;
c1	c2
114040	1991-01-01 02:08:08
123020	2001-03-01 04:08:08
6	2011-05-01 06:08:08
6	2021-07-01 08:08:08
6	2021-07-01 10:08:08
drop table t1;
#range
drop table if exists t1;
Warnings:
Note	1051	Unknown table 'db1.t1'
create table t1(c1 int ,c2 datetime) partition by range(c1)
(
partition p1 values less than(400000),
partition p2 values less than(maxvalue)
);
insert into t1 values(200102,'1991-02-01 4:08:08');
insert into t1 values(300304,'2001-04-01 8:08:08');
insert into t1 values(400506,'2011-06-01 12:08:08');
insert into t1 values(500607,'2021-08-01 16:08:08');
insert into t1 values(600708,'2021-08-01 20:08:08');
select * from t1;
c1	c2
200102	1991-02-01 04:08:08
300304	2001-04-01 08:08:08
400506	2011-06-01 12:08:08
500607	2021-08-01 16:08:08
600708	2021-08-01 20:08:08
select * from t1 where hour(c2) > 1 group by c1 having max(hour(c2))<6;
c1	c2
200102	1991-02-01 04:08:08
update t1 set c1 = hour('020202') where hour(c2) > 5;
select * from t1;
c1	c2
200102	1991-02-01 04:08:08
2	2001-04-01 08:08:08
2	2011-06-01 12:08:08
2	2021-08-01 16:08:08
2	2021-08-01 20:08:08
delete from t1 where hour(c2) > 2;
select * from t1;
c1	c2
drop table t1;
#list
drop table if exists t1;
Warnings:
Note	1051	Unknown table 'db1.t1'
create table t1(c1 int,c2 int) partition by list(c1)
(
partition p1 values in(080808,070707,060606,050505),
partition p2 values in(101010,111111,121212,131313)
);
insert into t1 values(080808,1),(070707,2),(060606,3),(050505,4);
insert into t1 values(101010,5),(111111,6),(121212,7),(131313,8);
select * from t1 order by c1;
c1	c2
50505	4
60606	3
70707	2
80808	1
101010	5
111111	6
121212	7
131313	8
select * from t1 partition(p1) where hour(c1) >5 and hour(c2)<5 order by hour(c1);
c1	c2
60606	3
70707	2
80808	1
update t1 partition(p2) set c2 = hour('060606') where hour(c1) = hour('131010');
delete from t1 where hour(c1) > 6 and c2 < hour('12:59:59');
select * from t1;
c1	c2
60606	3
50505	4
drop table t1;
#key
drop table if exists t1;
Warnings:
Note	1051	Unknown table 'db1.t1'
create table t1(c1 int primary key , c2 datetime)
partition by key(c1)
partitions 2;
insert into t1 values(114040,'1991-01-01 02:08:08');
insert into t1 values(123020,'2001-03-01 04:08:08');
insert into t1 values(131516,'2011-05-01 06:08:08');
insert into t1 values(141516,'2021-07-01 08:08:08');
insert into t1 values(141617,'2021-07-01 10:08:08');
select * from t1;
c1	c2
123020	2001-03-01 04:08:08
131516	2011-05-01 06:08:08
141516	2021-07-01 08:08:08
114040	1991-01-01 02:08:08
141617	2021-07-01 10:08:08
select * from t1 where hour(c2) > 1 group by hour(c1) having max(hour(c2))<10;
c1	c2
123020	2001-03-01 04:08:08
131516	2011-05-01 06:08:08
114040	1991-01-01 02:08:08
update t1 set c1 = hour('060606') where hour(c2) > 9;
delete from t1 where hour(c2) > 5 and hour(c1) = 6;
select * from t1 order by c1;
c1	c2
6	2021-07-01 10:08:08
114040	1991-01-01 02:08:08
123020	2001-03-01 04:08:08
131516	2011-05-01 06:08:08
141516	2021-07-01 08:08:08
drop table t1;
#range columns
drop table if exists t1;
Warnings:
Note	1051	Unknown table 'db1.t1'
CREATE TABLE t1 (
c1 int,
c2 datetime
)
PARTITION BY RANGE COLUMNS(c1) (
partition p1 values less than(400000),
partition p2 values less than(maxvalue)
);
insert into t1 values(200102,'1991-02-01 4:08:08');
insert into t1 values(300304,'2001-04-01 8:08:08');
insert into t1 values(400506,'2011-06-01 12:08:08');
insert into t1 values(500607,'2021-08-01 16:08:08');
insert into t1 values(600708,'2021-08-01 20:08:08');
select * from t1;
c1	c2
200102	1991-02-01 04:08:08
300304	2001-04-01 08:08:08
400506	2011-06-01 12:08:08
500607	2021-08-01 16:08:08
600708	2021-08-01 20:08:08
select * from t1 where hour(c2) > 1 group by c1 having max(hour(c2))<6;
c1	c2
200102	1991-02-01 04:08:08
update t1 set c1 = hour('020202') where hour(c2) > 5;
select * from t1;
c1	c2
200102	1991-02-01 04:08:08
2	2001-04-01 08:08:08
2	2011-06-01 12:08:08
2	2021-08-01 16:08:08
2	2021-08-01 20:08:08
delete from t1 where hour(c2) > 2;
select * from t1;
c1	c2
drop table t1;
#columns list
drop table if exists t1;
Warnings:
Note	1051	Unknown table 'db1.t1'
create table t1(c1 int,c2 int) partition by list columns(c1)
(
partition p1 values in(080808,070707,060606,050505),
partition p2 values in(101010,111111,121212,131313)
);
insert into t1 values(080808,1),(070707,2),(060606,3),(050505,4);
insert into t1 values(101010,5),(111111,6),(121212,7),(131313,8);
select * from t1 order by c1;
c1	c2
50505	4
60606	3
70707	2
80808	1
101010	5
111111	6
121212	7
131313	8
select * from t1 partition(p1) where hour(c1) >5 and hour(c2)<5 order by hour(c1);
c1	c2
60606	3
70707	2
80808	1
update t1 partition(p2) set c2 = hour('060606') where hour(c1) = hour('131010');
delete from t1 where hour(c1) > 6 and c2 < hour('12:59:59');
select * from t1;
c1	c2
60606	3
50505	4
drop table t1;
#view
drop table if exists t1;
Warnings:
Note	1051	Unknown table 'db1.t1'
create table t1(c1 int ,c2 varchar(60) not null,c3 datetime default '1999-09-09 18:16:30');
insert into t1 values(165050,'18:30:30','2001-02-02 03:03:03');
insert into t1(c1,c2) values(050101,'04:50:50');
insert into t1 values(071313,'080808','1880-05-05 05:05:05');
insert into t1 values(101010,'11:11:11','0001-01-01 01:01:01');
insert into t1(c1,c2) values(121212,'15:20:20');
insert into t1 values(165050,'99990909090909','0001-01-01 01:01:01');
create view v_t1 as select * from t1;
#select
select hour(c1),hour(c2),hour(c3) from v_t1 order by hour(c1);
hour(c1)	hour(c2)	hour(c3)
5	4	18
7	8	5
10	11	1
12	15	18
16	18	3
16	9	1
select hour(c1) from v_t1 where hour(c1) > 5 and hour(c2) <10;
hour(c1)
7
16
select hour(c2) from v_t1 where hour(c1)>3 order by hour(c2);
hour(c2)
4
8
9
11
15
18
select c1,case hour(c1) when hour(c1)> 5 then hour('202020') else hour('101010') end as a from v_t1;
c1	a
165050	10
50101	10
71313	10
101010	10
121212	10
165050	10
select c1, case c2 when '11111111' then hour('1111') else hour('080808') end as a from v_t1;
c1	a
165050	8
50101	8
71313	8
101010	8
121212	8
165050	8
select distinct hour(c1),c2,c3 from v_t1 order by hour(c1);
hour(c1)	c2	c3
5	04:50:50	1999-09-09 18:16:30
7	080808	1880-05-05 05:05:05
10	11:11:11	0001-01-01 01:01:01
12	15:20:20	1999-09-09 18:16:30
16	18:30:30	2001-02-02 03:03:03
16	99990909090909	0001-01-01 01:01:01
select distinct hour(c3) ,c1,c3 from v_t1 order by hour(c3);
hour(c3)	c1	c3
1	101010	0001-01-01 01:01:01
1	165050	0001-01-01 01:01:01
3	165050	2001-02-02 03:03:03
5	71313	1880-05-05 05:05:05
18	50101	1999-09-09 18:16:30
18	121212	1999-09-09 18:16:30
select hour(c1) from v_t1 group by c1 having hour(c1) >3;
hour(c1)
16
5
7
10
12
#update
update v_t1 set c1 = hour('665959') where hour(c2) > 5 and hour(c3) < 5;
update v_t1 set c2 = hour('01:01:01') where hour(c3) = (select a1 from test2 where a1 = 5);
select * from v_t1;
c1	c2	c3
66	18:30:30	2001-02-02 03:03:03
50101	04:50:50	1999-09-09 18:16:30
71313	1	1880-05-05 05:05:05
66	11:11:11	0001-01-01 01:01:01
121212	15:20:20	1999-09-09 18:16:30
66	99990909090909	0001-01-01 01:01:01
#delete
delete from v_t1 where c1 = (select hour('66:59:58') from test2 limit 1);
delete from v_t1 where hour(c2) != hour('010101');
select * from v_t1;
c1	c2	c3
drop table t1;
drop view v_t1;
#生成列
drop table if exists t1;
Warnings:
Note	1051	Unknown table 'db1.t1'
CREATE TABLE t1(c1 int,c2 int GENERATED ALWAYS AS (hour('660606')) VIRTUAL);
insert into t1(c1) values(1);
insert into t1(c1) values(2);
select * from t1;
c1	c2
1	66
2	66
drop table t1;
#算数运算符
#'+'
select hour('AAA'+060606);
hour('AAA'+060606)
6
Warnings:
Warning	1292	Truncated incorrect DOUBLE value: 'AAA'
select hour('77'+12121);
hour('77'+12121)
NULL
Warnings:
Warning	5086	Not timestamp Can not cast varchar value to timestamp type
select hour('张三'+'050505');
hour('张三'+'050505')
5
Warnings:
Warning	1292	Truncated incorrect DOUBLE value: '张三'
select hour(060606+'AAA');
hour(060606+'AAA')
6
Warnings:
Warning	1292	Truncated incorrect DOUBLE value: 'AAA'
select hour(12121+'77');
hour(12121+'77')
NULL
Warnings:
Warning	5086	Not timestamp Can not cast varchar value to timestamp type
select hour('050505'+'张三');
hour('050505'+'张三')
5
Warnings:
Warning	1292	Truncated incorrect DOUBLE value: '张三'
select hour('010101'+'20:50:60');
hour('010101'+'20:50:60')
1
Warnings:
Warning	1292	Truncated incorrect DOUBLE value: '20:50:60'
select hour('020202'+'');
hour('020202'+'')
2
select hour('03:03:03'+' ');
hour('03:03:03'+' ')
0
Warnings:
Warning	1292	Truncated incorrect DOUBLE value: '03:03:03'
select hour('040404'+0001);
hour('040404'+0001)
4
select hour('1010-01-01 05:05:05'+2001);
hour('1010-01-01 05:05:05'+2001)
0
Warnings:
Warning	1292	Truncated incorrect DOUBLE value: '1010-01-01 05:05:05'
select hour('10101')+hour('123232');
hour('10101')+hour('123232')
13
select hour('202020' )+hour('2003-02-29');
hour('202020' )+hour('2003-02-29')
20
select hour('211818')+hour('aaa');
hour('211818')+hour('aaa')
NULL
Warnings:
Warning	5086	Not timestamp Can not cast varchar value to timestamp type
#'-'
select hour('202020'-'212121');
hour('202020'-'212121')
1
select hour('232323'-080808);
hour('232323'-080808)
15
select hour('235959'-606060);
hour('235959'-606060)
37
select hour('906060'-606060);
hour('906060'-606060)
30
select hour('1005050'-'AA');
hour('1005050'-'AA')
100
Warnings:
Warning	1292	Truncated incorrect DOUBLE value: 'AA'
select hour('885050'-'张三/');
hour('885050'-'张三/')
88
Warnings:
Warning	1292	Truncated incorrect DOUBLE value: '张三/'
select hour('ABC'-'060606');
hour('ABC'-'060606')
6
Warnings:
Warning	1292	Truncated incorrect DOUBLE value: 'ABC'
select hour('周五周五'-'2010-10-10 10:10:10');
hour('周五周五'-'2010-10-10 10:10:10')
0
Warnings:
Warning	1292	Truncated incorrect DOUBLE value: '周五周五'
Warning	1292	Truncated incorrect DOUBLE value: '2010-10-10 10:10:10'
#'*'
select hour(2020*121);
hour(2020*121)
24
select hour('1'*'2020-03-03 14:20:20');
hour('1'*'2020-03-03 14:20:20')
0
Warnings:
Warning	1292	Truncated incorrect DOUBLE value: '2020-03-03 14:20:20'
select hour('14:20:20'+501010);
hour('14:20:20'+501010)
50
Warnings:
Warning	1292	Truncated incorrect DOUBLE value: '14:20:20'
select hour('020202'*'张三');
hour('020202'*'张三')
0
Warnings:
Warning	1292	Truncated incorrect DOUBLE value: '张三'
select hour('AAA'*060606);
hour('AAA'*060606)
0
Warnings:
Warning	1292	Truncated incorrect DOUBLE value: 'AAA'
select hour('77'*12121);
hour('77'*12121)
93
select hour('张三'*'050505');
hour('张三'*'050505')
0
Warnings:
Warning	1292	Truncated incorrect DOUBLE value: '张三'
#'/'
select hour(21212121/333);
hour(21212121/333)
6
select hour('18:18:18'/66);
hour('18:18:18'/66)
0
Warnings:
Warning	1292	Truncated incorrect DOUBLE value: '18:18:18'
select hour(33333333/'33');
hour(33333333/'33')
101
select hour('3333a333'/6);
hour('3333a333'/6)
0
Warnings:
Warning	1292	Truncated incorrect DOUBLE value: '3333a333'
select hour(2222222/2);
hour(2222222/2)
111
select hour('11110101'/2);
hour('11110101'/2)
555
select hour(121212*3/2+121-61321);
hour(121212*3/2+121-61321)
12
select hour(300000/2*4+615-3.666666);
hour(300000/2*4+615-3.666666)
60
#逻辑运算符
select hour('030303') and hour(0305011);
hour('030303') and hour(0305011)
1
select hour('1921-10-10 06:06:07') and hour('06:09:09');
hour('1921-10-10 06:06:07') and hour('06:09:09')
1
select not hour('1111-01-01 15:24:25') ;
not hour('1111-01-01 15:24:25')
0
select not hour('111101') ;
not hour('111101')
0
select hour('202101') or hour('222222');
hour('202101') or hour('222222')
1
select hour('192110') or hour('198808');
hour('192110') or hour('198808')
1
select hour('180110') or hour('180010');
hour('180110') or hour('180010')
1
select hour('212112') or ('2');
hour('212112') or ('2')
1
select hour('212112') or 'aa';
hour('212112') or 'aa'
1
#比较运算符
select hour('200101') > hour('20:21:02');
hour('200101') > hour('20:21:02')
0
select hour('380101') > hour('200102');
hour('380101') > hour('200102')
1
select hour('AASA22CCC') > hour('0000-01-01');
hour('AASA22CCC') > hour('0000-01-01')
NULL
Warnings:
Warning	5086	Not timestamp Can not cast varchar value to timestamp type
select hour('202020') > 'AA';
hour('202020') > 'AA'
1
Warnings:
Warning	1292	Truncated incorrect DECIMAL value: 'AA'
select hour('00010101') >1;
hour('00010101') >1
0
select hour('2020-01-01 16:13:21') < hour('2020-01-02 19:16:18');
hour('2020-01-01 16:13:21') < hour('2020-01-02 19:16:18')
1
select hour('22:34:56') < hour('230516');
hour('22:34:56') < hour('230516')
1
select hour('2221212') < hour('9991231');
hour('2221212') < hour('9991231')
1
select hour('1500-01-01 15:13:12') < 'Abc';
hour('1500-01-01 15:13:12') < 'Abc'
0
Warnings:
Warning	1292	Truncated incorrect DECIMAL value: 'Abc'
select hour('2000-01-01 14:18:19') < 14;
hour('2000-01-01 14:18:19') < 14
0
select hour('2020-01-01 11:12:11') >= hour('2020-01-02 08:09:10');
hour('2020-01-01 11:12:11') >= hour('2020-01-02 08:09:10')
1
select hour('3800-01-01 10:11:11') >= hour('2050-01-01 08:08:08');
hour('3800-01-01 10:11:11') >= hour('2050-01-01 08:08:08')
1
select hour('0001-01-01 22:30:50') >= hour('0000-01-01 23:23:23');
hour('0001-01-01 22:30:50') >= hour('0000-01-01 23:23:23')
0
select hour('14:13:15') >= 'AA';
hour('14:13:15') >= 'AA'
1
Warnings:
Warning	1292	Truncated incorrect DECIMAL value: 'AA'
select hour('16:18:18') >=1;
hour('16:18:18') >=1
1
select hour('20201111') <= hour('2020-011-11 22:22:22');
hour('20201111') <= hour('2020-011-11 22:22:22')
0
select hour(12341122) <= hour(05711212);
hour(12341122) <= hour(05711212)
NULL
Warnings:
Warning	5086	Not timestamp Can not cast varchar value to timestamp type
select hour('1500101') < 'CCC';
hour('1500101') < 'CCC'
0
Warnings:
Warning	1292	Truncated incorrect DECIMAL value: 'CCC'
select hour('241231') < 25;
hour('241231') < 25
1
#时间函数嵌套
#now
#localtime/localtimestamp
#date
select hour(date('2003-12-31 01:02:03'));
hour(date('2003-12-31 01:02:03'))
0
#curdate
#date_add/sub
select hour(DATE_ADD('2018-05-01 12:12:12',INTERVAL 1 DAY));
hour(DATE_ADD('2018-05-01 12:12:12',INTERVAL 1 DAY))
12
select hour(DATE_SUB('2018-05-01 16:12:12',INTERVAL 1 hour));
hour(DATE_SUB('2018-05-01 16:12:12',INTERVAL 1 hour))
15
select hour(DATE_ADD('2020-12-31 23:59:58',INTERVAL 1 SECOND));
hour(DATE_ADD('2020-12-31 23:59:58',INTERVAL 1 SECOND))
23
select hour(DATE_ADD('2018-12-31 23:59:59',INTERVAL 1 DAY));
hour(DATE_ADD('2018-12-31 23:59:59',INTERVAL 1 DAY))
23
select hour(DATE_ADD('2100-12-31 22:59:57',INTERVAL '1:1' MINUTE_SECOND));
hour(DATE_ADD('2100-12-31 22:59:57',INTERVAL '1:1' MINUTE_SECOND))
23
select hour(DATE_SUB('2025-01-01 00:00:00',INTERVAL '1 1:1:1' DAY_SECOND));
hour(DATE_SUB('2025-01-01 00:00:00',INTERVAL '1 1:1:1' DAY_SECOND))
22
select hour(DATE_ADD('1900-01-01 00:00:00',INTERVAL '-1 10' DAY_HOUR));
hour(DATE_ADD('1900-01-01 00:00:00',INTERVAL '-1 10' DAY_HOUR))
14
select hour(DATE_SUB('1998-01-02', INTERVAL 31 DAY));
hour(DATE_SUB('1998-01-02', INTERVAL 31 DAY))
NULL
Warnings:
Warning	5086	Not timestamp Can not cast varchar value to timestamp type
select hour(DATE_ADD('1992-12-31 23:59:59.000002',INTERVAL '1.999999' SECOND_MICROSECOND));
hour(DATE_ADD('1992-12-31 23:59:59.000002',INTERVAL '1.999999' SECOND_MICROSECOND))
0
#date_format
select hour(DATE_FORMAT('2009-10-04 22:23:00', '%W %M %Y'));
hour(DATE_FORMAT('2009-10-04 22:23:00', '%W %M %Y'))
NULL
Warnings:
Warning	5086	Not timestamp Can not cast varchar value to timestamp type
select hour(DATE_FORMAT('2007-10-04 22:23:00', '%H:%i:%s'));
hour(DATE_FORMAT('2007-10-04 22:23:00', '%H:%i:%s'))
22
select hour(DATE_FORMAT('1900-10-04 22:23:00','%D %y %a %d %m %b %j'));
hour(DATE_FORMAT('1900-10-04 22:23:00','%D %y %a %d %m %b %j'))
0
select hour(DATE_FORMAT('1997-10-04 22:23:00','%H %k %I %r %T %S %w'));
hour(DATE_FORMAT('1997-10-04 22:23:00','%H %k %I %r %T %S %w'))
550
select hour(DATE_FORMAT('1999-01-01 06:06:06', '%X %V'));
hour(DATE_FORMAT('1999-01-01 06:06:06', '%X %V'))
838
select hour(DATE_FORMAT('2006-06-00 12:12:12', '%d'));
hour(DATE_FORMAT('2006-06-00 12:12:12', '%d'))
NULL
#form_days
select hour(from_days(730669));
hour(from_days(730669))
0
select hour(from_days(999999));
hour(from_days(999999))
0
select hour(from_days(110000));
hour(from_days(110000))
0
#from_unixtime
select hour(FROM_UNIXTIME(1447430881));
hour(FROM_UNIXTIME(1447430881))
0
select hour(FROM_UNIXTIME(1447430881) + 0);
hour(FROM_UNIXTIME(1447430881) + 0)
0
select hour(FROM_UNIXTIME(1447430881,'%Y %D %M %h:%i:%s %x'));
hour(FROM_UNIXTIME(1447430881,'%Y %D %M %h:%i:%s %x'))
838
select hour(DATE_FORMAT('2003-10-03',GET_FORMAT(DATE,'EUR')));
hour(DATE_FORMAT('2003-10-03',GET_FORMAT(DATE,'EUR')))
0
select hour(STR_TO_DATE('10.31.2003',GET_FORMAT(DATE,'USA')));
hour(STR_TO_DATE('10.31.2003',GET_FORMAT(DATE,'USA')))
0
#last_day
select hour(LAST_DAY('2003-02-05'));
hour(LAST_DAY('2003-02-05'))
0
select hour(LAST_DAY('2004-02-05'));
hour(LAST_DAY('2004-02-05'))
0
select hour(LAST_DAY('2004-01-01 01:01:01'));
hour(LAST_DAY('2004-01-01 01:01:01'))
0
select hour(LAST_DAY('2003-03-32'));
hour(LAST_DAY('2003-03-32'))
NULL
#makedate
select hour(MAKEDATE(2011,31));
hour(MAKEDATE(2011,31))
0
select hour(MAKEDATE(2011,32));
hour(MAKEDATE(2011,32))
0
select hour(MAKEDATE(2011,365));
hour(MAKEDATE(2011,365))
0
select hour(MAKEDATE(2014,365));
hour(MAKEDATE(2014,365))
0
select hour(MAKEDATE(2011,0));
hour(MAKEDATE(2011,0))
NULL
select hour(PERIOD_ADD(200801,2));
hour(PERIOD_ADD(200801,2))
20
#str_to_date
select hour(STR_TO_DATE('01,5,2013','%d,%m,%Y'));
hour(STR_TO_DATE('01,5,2013','%d,%m,%Y'))
0
select hour(STR_TO_DATE('May 1, 2013','%M %d,%Y'));
hour(STR_TO_DATE('May 1, 2013','%M %d,%Y'))
0
select hour(STR_TO_DATE('abc','abc'));
hour(STR_TO_DATE('abc','abc'))
0
select hour(STR_TO_DATE('9','%m'));
hour(STR_TO_DATE('9','%m'))
NULL
Warnings:
Warning	1411	Incorrect datetime value: '9' for function str_to_date
select hour(STR_TO_DATE('00/00/0000', '%m/%d/%Y'));
hour(STR_TO_DATE('00/00/0000', '%m/%d/%Y'))
0
select hour(STR_TO_DATE('04/31/2004', '%m/%d/%Y'));
hour(STR_TO_DATE('04/31/2004', '%m/%d/%Y'))
NULL
Warnings:
Warning	1411	Incorrect datetime value: '04/31/2004' for function str_to_date
select hour(STR_TO_DATE('200442 Monday', '%X%V %W'));
hour(STR_TO_DATE('200442 Monday', '%X%V %W'))
0
#subdate/time
select hour(DATE_SUB('2008-01-02', INTERVAL 31 DAY));
hour(DATE_SUB('2008-01-02', INTERVAL 31 DAY))
0
select hour(SUBDATE('2008-01-02', INTERVAL 31 DAY));
hour(SUBDATE('2008-01-02', INTERVAL 31 DAY))
0
select hour(SUBDATE('2008-01-02 12:00:00', 31));
hour(SUBDATE('2008-01-02 12:00:00', 31))
12
select hour(SUBTIME('2007-12-31 23:59:59.999999','1 1:1:1.000002'));
hour(SUBTIME('2007-12-31 23:59:59.999999','1 1:1:1.000002'))
22
#timestamp
select hour(TIMESTAMP('2003-12-31 08:08:08'));
hour(TIMESTAMP('2003-12-31 08:08:08'))
8
select hour(TIMESTAMP('2003-12-31 12:00:00','12:00:00'));
hour(TIMESTAMP('2003-12-31 12:00:00','12:00:00'))
0
select hour(TIMESTAMPADD(MINUTE,1,'2003-01-02 15:16:17'));
hour(TIMESTAMPADD(MINUTE,1,'2003-01-02 15:16:17'))
15
select hour(TIMESTAMPADD(WEEK,1,'2003-01-02 18:18:18'));
hour(TIMESTAMPADD(WEEK,1,'2003-01-02 18:18:18'))
18
#utc_date/timestamp
select hour(ADDTIME('2007-12-31 23:59:59.999999', '1 1:1:1.000002'));
hour(ADDTIME('2007-12-31 23:59:59.999999', '1 1:1:1.000002'))
1
#convert_tz
select hour(CONVERT_TZ('2004-01-01 12:00:00','+00:00','+10:00'));
hour(CONVERT_TZ('2004-01-01 12:00:00','+00:00','+10:00'))
22
select hour(CONVERT_TZ('2004-01-01 12:00:00','+00:00','+20:00'));
hour(CONVERT_TZ('2004-01-01 12:00:00','+00:00','+20:00'))
NULL
#其他函数
#concat
select hour(concat('2020','12'));
hour(concat('2020','12'))
20
select hour(concat('2021','1111'));
hour(concat('2021','1111'))
838
select hour(concat('19980715','aa'));
hour(concat('19980715','aa'))
838
#ceil
select hour(ceil(213121.0111111));
hour(ceil(213121.0111111))
21
#cast
select hour(cast('2021-10-08 12:12:00' as int));
ERROR 42000: You have an error in your SQL syntax; check the manual that corresponds to your OceanBase version for the right syntax to use near 'int))' at line 1
select hour(cast('2021-10-08 12:12:00' as double));
hour(cast('2021-10-08 12:12:00' as double))
0
Warnings:
Warning	1292	Truncated incorrect DOUBLE value: '2021-10-08 12:12:00'
select hour(cast('2021-10-08 14:14:00' as float));
hour(cast('2021-10-08 14:14:00' as float))
0
Warnings:
Warning	1292	Truncated incorrect DOUBLE value: '2021-10-08 14:14:00'
select hour(cast('2021-10-08 14:14:00' as char(100)));
hour(cast('2021-10-08 14:14:00' as char(100)))
14
select hour(cast('2021-10-08 14:14:00' as varchar(100)));
ERROR 42000: You have an error in your SQL syntax; check the manual that corresponds to your OceanBase version for the right syntax to use near 'varchar(100)))' at line 1
select hour(cast('2021-10-08 14:14:00' as date));
hour(cast('2021-10-08 14:14:00' as date))
0
select hour(cast('2021-10-08 14:14:00' as time));
hour(cast('2021-10-08 14:14:00' as time))
14
select hour(cast('20211008141400' as datetime));
hour(cast('20211008141400' as datetime))
14
select hour(cast('2021-10-08 14:14:00' as timestamp));
ERROR 42000: You have an error in your SQL syntax; check the manual that corresponds to your OceanBase version for the right syntax to use near 'timestamp))' at line 1
select hour(cast('2021-10-08 14:14:00' as decimal(15,5)));
hour(cast('2021-10-08 14:14:00' as decimal(15,5)))
0
Warnings:
Warning	1292	Truncated incorrect DECIMAL value: '2021-10-08 14:14:00'
#length
select hour(length(11111111));
hour(length(11111111))
0
#substr
select hour(substr('0012120021',5));
hour(substr('0012120021',5))
12
select hour(substr('012300021212' from 8));
hour(substr('012300021212' from 8))
2
select hour(substr('012300021212' from 7));
hour(substr('012300021212' from 7))
2
select hour(substr('1111121211121212121212121',5,13));
hour(substr('1111121211121212121212121',5,13))
12
select hour(substr('212312313-030303',2));
hour(substr('212312313-030303',2))
NULL
Warnings:
Warning	5086	Not timestamp Can not cast varchar value to timestamp type
#reverse
select hour(reverse('20120229'));
hour(reverse('20120229'))
838
select hour(reverse('92202102'));
hour(reverse('92202102'))
838
select hour(reverse(cast('2021-10-08 14:14:00' as datetime)));
hour(reverse(cast('2021-10-08 14:14:00' as datetime)))
NULL
Warnings:
Warning	5086	Not timestamp Can not cast varchar value to timestamp type
#聚合函数
drop table if exists test1;
Warnings:
Note	1051	Unknown table 'db1.test1'
create table test1(a1 int,a2 int,c1 datetime,c2 datetime);
insert into test1 values(1,080606,'1998-12-12 12:12:12','2038-01-19 03:14:07');
insert into test1 values(2,090909,'2002-02-02 10:00:00','2034-02-22 00:50:20');
insert into test1 values(3,101010,'2006-04-15 06:06:20','2026-05-08 05:16:50');
insert into test1 values(4,111111,'2012-12-12 12:12:12','2030-08-16 14:05:50');
select * from test1;
a1	a2	c1	c2
1	80606	1998-12-12 12:12:12	2038-01-19 03:14:07
2	90909	2002-02-02 10:00:00	2034-02-22 00:50:20
3	101010	2006-04-15 06:06:20	2026-05-08 05:16:50
4	111111	2012-12-12 12:12:12	2030-08-16 14:05:50
#count
select count(hour(c1)) from test1;
count(hour(c1))
4
select hour(count(c1)) from test1;
hour(count(c1))
0
select count(hour(c2)) from test1;
count(hour(c2))
4
select hour(count(c2)) from test1;
hour(count(c2))
0
#max
select max(hour(c1)) from test1;
max(hour(c1))
12
select hour(max(c1)) from test1;
hour(max(c1))
12
select max(hour(c2)) from test1;
max(hour(c2))
14
select hour(max(c2)) from test1;
hour(max(c2))
3
#min
select min(hour(c1)) from test1;
min(hour(c1))
6
select hour(min(c1)) from test1;
hour(min(c1))
12
select max(hour(c2)) from test1;
max(hour(c2))
14
select hour(max(c2)) from test1;
hour(max(c2))
3
#avg
select avg(hour(c1)) from test1;
avg(hour(c1))
10.0000
select hour(avg(c1)) from test1;
hour(avg(c1))
NULL
Warnings:
Warning	5086	Not timestamp Can not cast varchar value to timestamp type
select max(hour(c2)) from test1;
max(hour(c2))
14
select hour(max(c2)) from test1;
hour(max(c2))
3
#sum
select sum(hour(c1)) from test1;
sum(hour(c1))
40
select hour(sum(c1)) from test1;
hour(sum(c1))
NULL
Warnings:
Warning	5086	Not timestamp Can not cast varchar value to timestamp type
select max(hour(c2)) from test1;
max(hour(c2))
14
select hour(max(c2)) from test1;
hour(max(c2))
3
#addtime
select hour(ADDTIME('2007-12-31 23:59:59.999999', '1 1:1:1.000002'));
hour(ADDTIME('2007-12-31 23:59:59.999999', '1 1:1:1.000002'))
1
select hour(ADDTIME('01:00:00.999999', '02:00:00.999998'));
hour(ADDTIME('01:00:00.999999', '02:00:00.999998'))
3
#maketime
select hour(maketime(01,00,01));
hour(maketime(01,00,01))
1
select hour(maketime(15,16,16));
hour(maketime(15,16,16))
15
select hour(maketime(888,10,15));
hour(maketime(888,10,15))
838
#period_add
select hour(PERIOD_ADD(200801,2));
hour(PERIOD_ADD(200801,2))
20
select hour(PERIOD_ADD(100801,-2));
hour(PERIOD_ADD(100801,-2))
10
#sec_to_time
select hour(sec_to_time(321513));
hour(sec_to_time(321513))
89
select hour(sec_to_time(321513)+0);
hour(sec_to_time(321513)+0)
89
select hour(sec_to_time(0));
hour(sec_to_time(0))
0
select hour(sec_to_time(9999999999999999));
hour(sec_to_time(9999999999999999))
838
drop database db1;
