drop database if exists db1;
create database db1;
use db1;
#参数
select microsecond('01:01:01.000001');
microsecond('01:01:01.000001')
1
select microsecond('01:01:01.0000001');
microsecond('01:01:01.0000001')
0
select microsecond('01:01:01.1');
microsecond('01:01:01.1')
100000
select microsecond('01:01:01.000001.123');
microsecond('01:01:01.000001.123')
1
SELECT MICROSECOND('2019-12-31 23:59:59.000010');
MICROSECOND('2019-12-31 23:59:59.000010')
10
SELECT MICROSECOND('12:00:00.123456');
MICROSECOND('12:00:00.123456')
123456
select microsecond('1900-08-08 23:59:59.999999');
microsecond('1900-08-08 23:59:59.999999')
999999
select microsecond('05:05:05.09999999');
microsecond('05:05:05.09999999')
100000
#YYYYY^MM^DD HH+MM+SS
select microsecond('2020^01^02 16+01+30.123456');
microsecond('2020^01^02 16+01+30.123456')
123456
select microsecond('2020^07^02 24+26.5+00.00500');
microsecond('2020^07^02 24+26.5+00.00500')
NULL
Warnings:
Warning	5086	Not timestamp Can not cast varchar value to timestamp type
select microsecond('2020^09^02 22+30+20.678910');
microsecond('2020^09^02 22+30+20.678910')
678910
select microsecond('2020^12^02 23+30+33.22222');
microsecond('2020^12^02 23+30+33.22222')
222220
select microsecond('2020^03^29 23+6+11.010203');
microsecond('2020^03^29 23+6+11.010203')
10203
select microsecond('2020^13^29 23+8+22.123');
microsecond('2020^13^29 23+8+22.123')
NULL
Warnings:
Warning	5086	Not timestamp Can not cast varchar value to timestamp type
#YY^MM^DD HH+MM+SS
#OB与MYSQL不一致。OB返回NULL
select microsecond('88^00^02 16+20+11.1');
microsecond('88^00^02 16+20+11.1')
100000
select microsecond('77^01^02 24+26.5+05.00001');
microsecond('77^01^02 24+26.5+05.00001')
NULL
Warnings:
Warning	5086	Not timestamp Can not cast varchar value to timestamp type
select microsecond('66^03^02 22+05+17.20050');
microsecond('66^03^02 22+05+17.20050')
200500
select microsecond('55^5^02 15+07+29.34564');
microsecond('55^5^02 15+07+29.34564')
345640
select microsecond('44^7^29 12+59+03.456782');
microsecond('44^7^29 12+59+03.456782')
456782
select microsecond('33^13^29 20+59+59.531237');
microsecond('33^13^29 20+59+59.531237')
NULL
Warnings:
Warning	5086	Not timestamp Can not cast varchar value to timestamp type
#YYYY@MM@DD HH^MM^SS
select microsecond('2020@09@02 22^15^66.1234');
microsecond('2020@09@02 22^15^66.1234')
NULL
Warnings:
Warning	5086	Not timestamp Can not cast varchar value to timestamp type
select microsecond('2020@12@02 23^45^50.6457');
microsecond('2020@12@02 23^45^50.6457')
645700
select microsecond('2020@03@29 23^30^30.01010');
microsecond('2020@03@29 23^30^30.01010')
10100
select microsecond('2020@13@29 23^59^59.999999');
microsecond('2020@13@29 23^59^59.999999')
NULL
Warnings:
Warning	5086	Not timestamp Can not cast varchar value to timestamp type
#YY@MM@DD HH^MM^SS
select microsecond('01@09@02 22^15^66.000001');
microsecond('01@09@02 22^15^66.000001')
NULL
Warnings:
Warning	5086	Not timestamp Can not cast varchar value to timestamp type
select microsecond('80@12@02 23^45^50.000000001');
microsecond('80@12@02 23^45^50.000000001')
0
select microsecond('10@13@29 23^59^59.4536434');
microsecond('10@13@29 23^59^59.4536434')
NULL
Warnings:
Warning	5086	Not timestamp Can not cast varchar value to timestamp type
#OB与MYSQL不一致。
select microsecond('50@03@29 23^30^30.9999999');
microsecond('50@03@29 23^30^30.9999999')
0
#参数为字符串
select microsecond('15595966996');
microsecond('15595966996')
NULL
Warnings:
Warning	5086	Not timestamp Can not cast varchar value to timestamp type
select microsecond('0050.123456');
microsecond('0050.123456')
123456
select microsecond('080000.123456');
microsecond('080000.123456')
123456
select microsecond('125960.334123');
microsecond('125960.334123')
NULL
Warnings:
Warning	5086	Not timestamp Can not cast varchar value to timestamp type
select microsecond('9991111.11231');
microsecond('9991111.11231')
0
select microsecond('20220926151050.11111');
microsecond('20220926151050.11111')
111110
select microsecond('20220926155000.2222');
microsecond('20220926155000.2222')
222200
select microsecond('202209261500AA50');
microsecond('202209261500AA50')
NULL
Warnings:
Warning	5086	Not timestamp Can not cast varchar value to timestamp type
#多个参数
select microsecond('10:10:10','11:11:11');
ERROR 42000: You have an error in your SQL syntax; check the manual that corresponds to your OceanBase version for the right syntax to use near ','11:11:11')' at line 1
#为空
select microsecond('');
microsecond('')
NULL
Warnings:
Warning	5086	Not timestamp Can not cast varchar value to timestamp type
select microsecond('0');
microsecond('0')
0
#参数位数值类型
select microsecond(15595966996);
microsecond(15595966996)
NULL
Warnings:
Warning	5086	Not timestamp Can not cast varchar value to timestamp type
select microsecond(0050.123456);
microsecond(0050.123456)
123456
select microsecond(080000.123456);
microsecond(080000.123456)
123456
select microsecond(125960.334123);
microsecond(125960.334123)
NULL
Warnings:
Warning	5086	Not timestamp Can not cast varchar value to timestamp type
select microsecond(9991111.11231);
microsecond(9991111.11231)
NULL
Warnings:
Warning	5086	Not timestamp Can not cast varchar value to timestamp type
select microsecond(20220926151050.11111);
microsecond(20220926151050.11111)
111110
select microsecond(20220926155000.2222);
microsecond(20220926155000.2222)
222200
#中文
select microsecond('12时22分2.123456秒');
microsecond('12时22分2.123456秒')
0
select microsecond('2022年9月21日 12时22分2.11222333秒');
microsecond('2022年9月21日 12时22分2.11222333秒')
112223
select microsecond('咚咚咚');
microsecond('咚咚咚')
NULL
Warnings:
Warning	5086	Not timestamp Can not cast varchar value to timestamp type
#特殊字符
select microsecond('@##%');
microsecond('@##%')
NULL
Warnings:
Warning	5086	Not timestamp Can not cast varchar value to timestamp type
select microsecond('@222#1#%$%3');
microsecond('@222#1#%$%3')
NULL
Warnings:
Warning	5086	Not timestamp Can not cast varchar value to timestamp type
select microsecond('@#%#%^#%');
microsecond('@#%#%^#%')
NULL
Warnings:
Warning	5086	Not timestamp Can not cast varchar value to timestamp type
select microsecond('/*-+*-*-');
microsecond('/*-+*-*-')
NULL
Warnings:
Warning	5086	Not timestamp Can not cast varchar value to timestamp type
select microsecond('{:}}{":"');
microsecond('{:}}{":"')
NULL
Warnings:
Warning	5086	Not timestamp Can not cast varchar value to timestamp type
#参数为不同数据类型
#INT
create table test1(c1 int , c2 int);
insert into test1 values(163535.1321,020260.1231);
select microsecond(c1) from test1;
microsecond(c1)
0
select microsecond(c2) from test1;
microsecond(c2)
NULL
Warnings:
Warning	5086	Not timestamp Can not cast varchar value to timestamp type
drop table test1;
#FLOAT
create table test1(c1 float , c2 float);
insert into test1 values(60.6060,121212.1212);
select microsecond(c1) from test1;
microsecond(c1)
NULL
Warnings:
Warning	5086	Not timestamp Can not cast varchar value to timestamp type
select microsecond(c2) from test1;
microsecond(c2)
125000
drop table test1;
#DOUBLE
create table test1(c1 double , c2 double);
insert into test1 values(23.5959,161616.11111);
select microsecond(c1) from test1;
microsecond(c1)
595900
select microsecond(c2) from test1;
microsecond(c2)
111110
drop table test1;
#CHAR
create table test1(c1 char(100),c2 char(100));
insert into test1 values('181818.331121','2022-09-21 16:38:00.211231');
select microsecond(c1) from test1;
microsecond(c1)
331121
select microsecond(c2) from test1;
microsecond(c2)
211231
drop table test1;
#varchar
create table test1(c1 varchar(100),c2 varchar(100));
insert into test1 values('010101.12315','20200202020202.1231');
select microsecond(c1) from test1;
microsecond(c1)
123150
select microsecond(c2) from test1;
microsecond(c2)
123100
drop table test1;
#date
create table test1(c1 date,c2 date);
insert into test1 values('1000-01-01 10:10:55.11111','10000101121231.222222');
select microsecond(c1) from test1;
microsecond(c1)
0
select microsecond(c2) from test1;
microsecond(c2)
0
drop table test1;
#time
create table test1(c1 time,c2 time);
insert into test1 values('10:10:10.8888','15:41:20.9999');
select microsecond(c1) from test1;
microsecond(c1)
0
select microsecond(c2) from test1;
microsecond(c2)
0
drop table test1;
#year
create table test1(c1 year,c2 year);
insert into test1 values('1901','2155');
#OB返回NULL,mysql返回 0
select microsecond(c1) from test1;
microsecond(c1)
NULL
Warnings:
Warning	5086	Not timestamp Can not cast varchar value to timestamp type
select microsecond(c2) from test1;
microsecond(c2)
NULL
Warnings:
Warning	5086	Not timestamp Can not cast varchar value to timestamp type
drop table test1;
#datetime
create table test1(c1 datetime,c2 datetime);
insert into test1 values('9999-12-31 23:59:59.999999','1000-01-01 00:00:00.111101');
select microsecond(c1) from test1;
microsecond(c1)
NULL
select microsecond(c2) from test1;
microsecond(c2)
0
drop table test1;
#timestamp
create table test1(c1 timestamp,c2 timestamp);
insert into test1 values('1970-01-01 01:01:01.000001','2038-01-19 03:14:07.000002');
select microsecond(c1) from test1;
microsecond(c1)
0
select microsecond(c2) from test1;
microsecond(c2)
0
drop table test1;
#decimal
create table test1(c1 decimal(5,2),c2 decimal(15,5));
insert into test1 values(202.12,20210922.1030);
select microsecond(c1) from test1;
microsecond(c1)
120000
#OB返回0，MYSQL返回NULL
drop table test1;
#bit
create table test1(c1 bit(64),c2 bit(64));
insert into test1 values(2020020220202,b'11101010101');
select microsecond(c1) from test1;
microsecond(c1)
NULL
Warnings:
Warning	5086	Not timestamp Can not cast varchar value to timestamp type
select microsecond(c2) from test1;
microsecond(c2)
NULL
Warnings:
Warning	5086	Not timestamp Can not cast varchar value to timestamp type
drop table test1;
#enum
create table test1(c1 enum('16:50:59.99','101010.88','2020-02-02 13:13:13.77'));
insert into test1 values('16:50:59.99');
insert into test1 values('101010.88');
insert into test1 values('2020-02-02 13:13:13.77');
select microsecond(c1) from test1;
microsecond(c1)
990000
880000
770000
drop table test1;
#set
create table test1(c1 set('16:50:59.11','101010.22','2020-02-02 13:13:13.33'));
insert into test1 values('16:50:59.11');
insert into test1 values('101010.22');
insert into test1 values('2020-02-02 13:13:13.33');
select microsecond(c1) from test1;
microsecond(c1)
110000
220000
330000
drop table test1;
#select
drop table if exists t1;
Warnings:
Note	1051	Unknown table 'db1.t1'
create table t1(c1 char(30) ,c2 varchar(60) not null,c3 char(30) default '1999-09-09 18:16:16.00016');
insert into t1 values(161050.01,'18:20:30.011','2001-02-02 03:30:03.00017');
insert into t1(c1,c2) values(051501.02,'04:25:50.022');
insert into t1 values(071313.03,'082308.033','1880-05-05 05:33:05.00018');
insert into t1 values(101010.04,'11:11:11.044','0001-01-01 01:01:01.00019');
insert into t1(c1,c2) values(121212.05,'15:20:20.055.00020');
insert into t1 values(164050.06,'20220926055005.066','0001-01-01 01:01:01.00021');
insert into t1 values(101010.07,'2020.02.02.077','0001-01-01 01:01:01.00022');
select microsecond(c1),microsecond(c2),microsecond(c3) from t1 order by microsecond(c1);
microsecond(c1)	microsecond(c2)	microsecond(c3)
10000	11000	170
20000	22000	160
30000	33000	180
40000	44000	190
50000	55000	160
60000	66000	210
70000	20000	220
#where
select microsecond(c1) from t1 where microsecond(c1) > 20000 and microsecond(c2) <=50000;
microsecond(c1)
30000
40000
70000
select microsecond(c3) from t1 where microsecond(c2) < 30000 and microsecond(c3) >100;
microsecond(c3)
170
160
220
select microsecond(c2) from t1 where microsecond(c1)<30000 order by microsecond(c2);
microsecond(c2)
11000
22000
select c1,case microsecond(c1) when microsecond(c1)> 5000 then microsecond('202020.11') else microsecond('101010.22') end as a from t1;
c1	a
161050.01	220000
51501.02	220000
71313.03	220000
101010.04	220000
121212.05	220000
164050.06	220000
101010.07	220000
select c1, case c2 when '111111.0001' then microsecond('111111.002') else microsecond('080808.003') end as a from t1;
c1	a
161050.01	3000
51501.02	3000
71313.03	3000
101010.04	3000
121212.05	3000
164050.06	3000
101010.07	3000
select distinct microsecond(c1),c2,c3 from t1 order by microsecond(c1);
microsecond(c1)	c2	c3
10000	18:20:30.011	2001-02-02 03:30:03.00017
20000	04:25:50.022	1999-09-09 18:16:16.00016
30000	082308.033	1880-05-05 05:33:05.00018
40000	11:11:11.044	0001-01-01 01:01:01.00019
50000	15:20:20.055.00020	1999-09-09 18:16:16.00016
60000	20220926055005.066	0001-01-01 01:01:01.00021
70000	2020.02.02.077	0001-01-01 01:01:01.00022
select distinct microsecond(c3) ,c1,c3 from t1 order by microsecond(c3);
microsecond(c3)	c1	c3
160	121212.05	1999-09-09 18:16:16.00016
160	51501.02	1999-09-09 18:16:16.00016
170	161050.01	2001-02-02 03:30:03.00017
180	71313.03	1880-05-05 05:33:05.00018
190	101010.04	0001-01-01 01:01:01.00019
210	164050.06	0001-01-01 01:01:01.00021
220	101010.07	0001-01-01 01:01:01.00022
select microsecond(c1) from t1 group by c1 having microsecond(c1) >=10000;
microsecond(c1)
10000
20000
30000
40000
50000
60000
70000
drop table t1;
#insert    不同数据类型插入
#INT
create table test1(c1 int , c2 int);
insert into test1 values(microsecond('18:50:50.00050'),microsecond('101515.00015'));
insert into test1 values(microsecond('20:08:08.00008'),microsecond('90:59:59.00059'));
select * from test1;
c1	c2
500	150
80	590
drop table test1;
#FLOAT
create table test1(c1 float , c2 float);
insert into test1 values(microsecond('195045.00045'),microsecond('2020-02-02 12:30:30.00030'));
insert into test1 values(microsecond('13:01:01.000001'),microsecond('19980909090909.000009'));
select * from test1;
c1	c2
450	300
1	9
drop table test1;
#double
create table test1(c1 double , c2 double);
insert into test1 values(microsecond('20220926161010.01'),microsecond('12:12:12.456342'));
insert into test1 values(microsecond('08:50:50.04345'),microsecond('101112.1231'));
select * from test1;
c1	c2
10000	456342
43450	123100
drop table test1;
#char(100)
create table test1(c1 char(100),c2 char(100));
insert into test1 values(microsecond('341122.222'),microsecond('2121-01-01 23:30:30.12343'));
insert into test1 values(microsecond('1101-01-01 14:20:20.111'),microsecond('222201.634321'));
select * from test1;
c1	c2
222000	123430
111000	634321
drop table test1;
#varchar
create table test1(c1 varchar(100),c2 varchar(100));
insert into test1 values(microsecond('1998-09-09 20:20:20.34151'),microsecond(101010.10));
insert into test1 values(microsecond('222211.02132'),microsecond('9999-09-19 09:09:09.10101'));
select * from test1;
c1	c2
341510	100000
21320	101010
drop table test1;
#date
create table test1(c1 date,c2 date);
insert into test1 values(microsecond('010101.1'),microsecond('020202.3'));
ERROR 22007: Incorrect datetime value for column 'c1' at row 1
insert into test1 values(microsecond('665040.2'),microsecond(992121.4));
ERROR 22007: Incorrect datetime value for column 'c1' at row 1
select * from test1;
c1	c2
drop table test1;
#time
create table test1(c1 time,c2 time);
insert into test1 values(microsecond('2020-08-08 20:00:00.001'),microsecond('055059.003'));
insert into test1 values(microsecond('1998-08-08 3:00:00.002'),microsecond('771717.004'));
select * from test1;
c1	c2
00:10:00	00:30:00
00:20:00	00:40:00
drop table test1;
#year
create table test1(c1 year,c2 year);
insert into test1 values(microsecond('201010.001112'),microsecond('990909.002556'));
ERROR 22003: Out of range value for column 'c1' at row 1
insert into test1 values(microsecond('162020.002334'),microsecond(111516.003199));
ERROR 22003: Out of range value for column 'c1' at row 1
select * from test1;
c1	c2
drop table test1;
#datetime
create table test1(c1 datetime,c2 datetime);
insert into test1 values(microsecond('2001-01-01 01:01:01.002'),microsecond(010101.003));
ERROR 22007: Incorrect datetime value for column 'c1' at row 1
insert into test1 values(microsecond('222211.123'),microsecond('22:20:20.553'));
ERROR 22007: Incorrect datetime value for column 'c1' at row 1
select * from test1;
c1	c2
drop table test1;
#timestamp
create table test1(c1 timestamp,c2 timestamp);
insert into test1 values(microsecond('2001-01-01 01:01:01.01'),microsecond(010101.002));
ERROR 22007: Incorrect datetime value for column 'c1' at row 1
insert into test1 values(microsecond('222211.5443'),microsecond('22:20:20.6432'));
ERROR 22007: Incorrect datetime value for column 'c1' at row 1
select * from test1;
c1	c2
drop table test1;
#decimal
create table test1(c1 decimal(10,2),c2 decimal(15,5));
insert into test1 values(microsecond('122020.00005'),microsecond('08:18:28.00031'));
insert into test1 values(microsecond('092939.000013'),microsecond(101112.1215));
select * from test1;
c1	c2
50.00	310.00000
13.00	121500.00000
drop table test1;
#bit
create table test1(c1 bit(64),c2 bit(64));
insert into test1 values(microsecond('06:30:31.005'),microsecond('2007-07-07 07:32:33.00232'));
insert into test1 values(microsecond('08:33:34.000123'),microsecond(093536.66));
select bin(c1),bin(c2) from test1;
bin(c1)	bin(c2)
1001110001000	100100010000
1111011	10100001001000100000
drop table test1;
#enum
create table test1(c1 enum('50','51','52'));
insert into test1 values(microsecond('10:50:51.000051'));
ERROR 01000: Data truncated for column 'c1' at row 1
insert into test1 values(microsecond('11:51:52.000052'));
ERROR 01000: Data truncated for column 'c1' at row 1
select * from test1;
c1
drop table test1;
#set
create table test1(c1 set('50','51','52'));
insert into test1 values(microsecond('10:50:50.000050'));
ERROR 01000: Data truncated for column 'c1' at row 1
insert into test1 values(microsecond('11:51:51.000051'));
ERROR 01000: Data truncated for column 'c1' at row 1
select * from test1;
c1
drop table test1;
#update、delete
drop table if exists test1;
Warnings:
Note	1051	Unknown table 'db1.test1'
create table test1(a1 int,a2 char(30),c1 varchar(60),c2 varchar(60));
insert into test1 values(1,'1998-12-12 02:02:02.000002','1998-12-12 03:12:12.000012','2038-01-19 11:20:20.000020');
insert into test1 values(2,'2002-02-02 04:04:04.000004','2002-02-02 05:14:14.000014','2034-02-22 12:22:22.000022');
insert into test1 values(3,'2006-04-15 06:06:06.000006','2006-04-15 07:16:16.000016','2026-05-08 13:24:24.000024');
insert into test1 values(4,'2012-12-12 08:08:08.000008','2012-12-12 09:18:18.000018','2030-08-16 14:26:26.000026');
select * from test1;
a1	a2	c1	c2
1	1998-12-12 02:02:02.000002	1998-12-12 03:12:12.000012	2038-01-19 11:20:20.000020
2	2002-02-02 04:04:04.000004	2002-02-02 05:14:14.000014	2034-02-22 12:22:22.000022
3	2006-04-15 06:06:06.000006	2006-04-15 07:16:16.000016	2026-05-08 13:24:24.000024
4	2012-12-12 08:08:08.000008	2012-12-12 09:18:18.000018	2030-08-16 14:26:26.000026
create table test2(a1 int,a2 int);
insert into test2 values(1,2),(2,4),(3,6),(4,8),(5,10),(6,12),(7,14),(8,16),(9,18),(10,20),(11,22),(12,24),(13,26),(14,28);
update test1 set a1 = microsecond('11:11:11.000011') where microsecond(a2) = (select a2 from test2 where a1 = 2);
update test1 set a1 = microsecond('12:12:12.000012') where microsecond(c1) = 3 or microsecond(c2) = (select a2 from test2 where a1 = 11);
select * from test1;
a1	a2	c1	c2
1	1998-12-12 02:02:02.000002	1998-12-12 03:12:12.000012	2038-01-19 11:20:20.000020
12	2002-02-02 04:04:04.000004	2002-02-02 05:14:14.000014	2034-02-22 12:22:22.000022
3	2006-04-15 06:06:06.000006	2006-04-15 07:16:16.000016	2026-05-08 13:24:24.000024
4	2012-12-12 08:08:08.000008	2012-12-12 09:18:18.000018	2030-08-16 14:26:26.000026
delete from test1 where microsecond(c1)> microsecond('2006-04-15 07:06:06.000006') and microsecond(c2) > microsecond('2038-01-19 01:14:14.000014');
delete from test1 where microsecond(c2) =(select a2 from test2 where a1 = 13);
select * from test1;
a1	a2	c1	c2
drop table test1;
#复制表
drop table if exists t1;
Warnings:
Note	1051	Unknown table 'db1.t1'
create table t1(c1 char(60) ,c2 varchar(60) not null,c3 char(30) default '1999-09-09 18:16:30.000030');
insert into t1 values('161010.000010','18:20:20.000020','2001-02-02 03:30:30.000030');
insert into t1(c1,c2) values('051515.000015.000015','04:25:25.000025');
insert into t1 values('071313.000013','082323.000023','1880-05-05 05:33:33.000033');
insert into t1 values('101010.000010','11:11:11.000011','0001-01-01 01:01:01.000001');
insert into t1(c1,c2) values('121212.000012.000012','15:20:20.000020');
insert into t1 values('164040.000040','20220926055050.000050','0001-01-01 01:01:01.000001');
insert into t1 values('101010.000010','200202.000002','0001-01-01 01:01:01.000001');
create table tt1 as select * from t1;
select microsecond(c1),microsecond(c2),microsecond(c3) from tt1 order by microsecond(c1);
microsecond(c1)	microsecond(c2)	microsecond(c3)
10	20	30
10	11	1
10	2	1
12	20	30
13	23	33
15	25	30
40	50	1
#select
select microsecond(c1) from tt1 where microsecond(c1) > 20 and microsecond(c2) <=50;
microsecond(c1)
40
select microsecond(c3) from tt1 where microsecond(c2) < 30 and microsecond(c3) >10;
microsecond(c3)
30
30
33
30
select microsecond(c2) from tt1 where microsecond(c1)<30 order by microsecond(c2);
microsecond(c2)
2
11
20
20
23
25
select c1,case microsecond(c1) when microsecond(c1)> 5 then microsecond('202020.000020') else microsecond('101010.000010') end as a from tt1;
c1	a
161010.000010	10
051515.000015.000015	10
071313.000013	10
101010.000010	10
121212.000012.000012	10
164040.000040	10
101010.000010	10
select c1, case c2 when '11111111' then microsecond('111111.000011') else microsecond('080808.000008') end as a from tt1;
c1	a
161010.000010	8
051515.000015.000015	8
071313.000013	8
101010.000010	8
121212.000012.000012	8
164040.000040	8
101010.000010	8
select distinct microsecond(c1),c2,c3 from tt1 order by microsecond(c1);
microsecond(c1)	c2	c3
10	11:11:11.000011	0001-01-01 01:01:01.000001
10	18:20:20.000020	2001-02-02 03:30:30.000030
10	200202.000002	0001-01-01 01:01:01.000001
12	15:20:20.000020	1999-09-09 18:16:30.000030
13	082323.000023	1880-05-05 05:33:33.000033
15	04:25:25.000025	1999-09-09 18:16:30.000030
40	20220926055050.000050	0001-01-01 01:01:01.000001
select distinct microsecond(c3) ,c1,c3 from tt1 order by microsecond(c3);
microsecond(c3)	c1	c3
1	101010.000010	0001-01-01 01:01:01.000001
1	164040.000040	0001-01-01 01:01:01.000001
30	051515.000015.000015	1999-09-09 18:16:30.000030
30	121212.000012.000012	1999-09-09 18:16:30.000030
30	161010.000010	2001-02-02 03:30:30.000030
33	071313.000013	1880-05-05 05:33:33.000033
select microsecond(c1) from tt1 group by c1 having microsecond(c1) >=10 order by c1;
microsecond(c1)
15
13
10
12
10
40
#update
update tt1 set c1 = microsecond('080808.000008') where microsecond(c2) > microsecond('011010.000010') and microsecond(c2)<microsecond('011515.000015');
update tt1 set c2 = microsecond('010101.000001') where microsecond(c1) = microsecond('011313.000013') or microsecond(c3) = microsecond('16:30:31.000031');
update tt1 set c1 = microsecond('12:30:30.000030') where microsecond(c3) in (select a2 from test2);
select * from tt1;
c1	c2	c3
161010.000010	18:20:20.000020	2001-02-02 03:30:30.000030
051515.000015.000015	04:25:25.000025	1999-09-09 18:16:30.000030
071313.000013	1	1880-05-05 05:33:33.000033
8	11:11:11.000011	0001-01-01 01:01:01.000001
121212.000012.000012	15:20:20.000020	1999-09-09 18:16:30.000030
164040.000040	20220926055050.000050	0001-01-01 01:01:01.000001
101010.000010	200202.000002	0001-01-01 01:01:01.000001
#delete
delete from tt1 where microsecond(c1) >microsecond('12:10:30') and microsecond(c1) < microsecond('161531');
delete from tt1 where microsecond(c2) not in (select a2 from test2);
delete from tt1 where microsecond(c3) != 0;
drop table t1;
drop table tt1;
#分区
#hash
drop table if exists t1;
Warnings:
Note	1051	Unknown table 'db1.t1'
create table t1(c1 int,c2 char(30)) partition by hash(c1)
(
partition p1,
partition p2
);
insert into t1 values(114040,'1991-01-01 02:08:02.000002');
insert into t1 values(123030,'2001-03-01 04:08:04.000004');
insert into t1 values(131515,'2011-05-01 06:08:06.000006');
insert into t1 values(141515,'2021-07-01 08:08:08.000008');
insert into t1 values(141616,'2021-07-01 10:08:10.000010');
select * from t1;
c1	c2
114040	1991-01-01 02:08:02.000002
123030	2001-03-01 04:08:04.000004
141616	2021-07-01 10:08:10.000010
131515	2011-05-01 06:08:06.000006
141515	2021-07-01 08:08:08.000008
select c1 from t1 where microsecond(c2) > 1 and microsecond(c2)< 7 order by microsecond(c2);
c1
114040
123030
131515
update t1 set c1 = microsecond('060606') where microsecond(c2) > 5;
delete from t1 where microsecond(c2) > 5 or microsecond(c1) = 6;
select * from t1;
c1	c2
114040	1991-01-01 02:08:02.000002
123030	2001-03-01 04:08:04.000004
drop table t1;
#range
drop table if exists t1;
Warnings:
Note	1051	Unknown table 'db1.t1'
create table t1(c1 int ,c2 varchar(30)) partition by range(c1)
(
partition p1 values less than(400000),
partition p2 values less than(maxvalue)
);
insert into t1 values(200101,'1991-02-01 4:02:02.000002');
insert into t1 values(300303,'2001-04-01 8:04:04.000004');
insert into t1 values(400505,'2011-06-01 12:06:06.000006');
insert into t1 values(500606,'2021-08-01 16:08:08.000008');
insert into t1 values(600707,'2021-08-01 20:10:10.000010');
select * from t1;
c1	c2
200101	1991-02-01 4:02:02.000002
300303	2001-04-01 8:04:04.000004
400505	2011-06-01 12:06:06.000006
500606	2021-08-01 16:08:08.000008
600707	2021-08-01 20:10:10.000010
select c1 from t1 where microsecond(c2) > 1 and microsecond(c2)< 7 order by microsecond(c2);
c1
200101
300303
400505
update t1 set c1 = microsecond('020202') where microsecond(c2) > 5 and microsecond(c2) < 8;
select * from t1;
c1	c2
200101	1991-02-01 4:02:02.000002
300303	2001-04-01 8:04:04.000004
0	2011-06-01 12:06:06.000006
500606	2021-08-01 16:08:08.000008
600707	2021-08-01 20:10:10.000010
delete from t1 where microsecond(c2) > 2;
select * from t1;
c1	c2
200101	1991-02-01 4:02:02.000002
drop table t1;
#list
drop table if exists t1;
Warnings:
Note	1051	Unknown table 'db1.t1'
create table t1(c1 int,c2 varchar(60)) partition by list(c1)
(
partition p1 values in(1,2,3,4),
partition p2 values in(5,6,7,8)
);
insert into t1 values(1,'1991-01-01 02:08:02.000002');
insert into t1 values(2,'2001-03-01 04:08:04.000004');
insert into t1 values(5,'2011-05-01 06:08:06.000006');
insert into t1 values(7,'2021-07-01 08:08:08.000008');
insert into t1 values(8,'2021-07-01 10:08:10.000010');
select * from t1;
c1	c2
1	1991-01-01 02:08:02.000002
2	2001-03-01 04:08:04.000004
5	2011-05-01 06:08:06.000006
7	2021-07-01 08:08:08.000008
8	2021-07-01 10:08:10.000010
select c1 from t1 where microsecond(c2) > 1 and microsecond(c2)< 7 order by microsecond(c2);
c1
1
2
5
update t1 set c1 = microsecond('060606.000006') where microsecond(c2) > 5;
delete from t1 where microsecond(c2) > 5 or microsecond(c1) = 6;
select * from t1;
c1	c2
1	1991-01-01 02:08:02.000002
2	2001-03-01 04:08:04.000004
drop table t1;
#key
drop table if exists t1;
Warnings:
Note	1051	Unknown table 'db1.t1'
create table t1(c1 int primary key , c2 varchar(60))
partition by key(c1)
partitions 2;
insert into t1 values(114040,'1991-01-01 02:02:02.000002');
insert into t1 values(123030,'2001-03-01 04:04:04.000004');
insert into t1 values(131515,'2011-05-01 06:06:06.000006');
insert into t1 values(141515,'2021-07-01 08:08:08.000008');
insert into t1 values(141616,'2021-07-01 10:10:10.000010');
select * from t1;
c1	c2
131515	2011-05-01 06:06:06.000006
141616	2021-07-01 10:10:10.000010
114040	1991-01-01 02:02:02.000002
123030	2001-03-01 04:04:04.000004
141515	2021-07-01 08:08:08.000008
select c1 from t1 where microsecond(c2) > 1 group by second(c1) having max(microsecond(c2))<10;
c1
131515
114040
123030
update t1 set c1 = microsecond('060606.000006') where microsecond(c2) > 9;
delete from t1 where microsecond(c2) > 5 and second(c1) = 6;
select * from t1 order by c1;
c1	c2
114040	1991-01-01 02:02:02.000002
123030	2001-03-01 04:04:04.000004
131515	2011-05-01 06:06:06.000006
141515	2021-07-01 08:08:08.000008
drop table t1;
#range columns
drop table if exists t1;
Warnings:
Note	1051	Unknown table 'db1.t1'
CREATE TABLE t1 (
c1 int,
c2 varchar(60)
)
PARTITION BY RANGE COLUMNS(c1) (
partition p1 values less than(400000),
partition p2 values less than(maxvalue)
);
insert into t1 values(200101,'1991-02-01 4:04:04.000004');
insert into t1 values(300303,'2001-04-01 8:08:08.000008');
insert into t1 values(400505,'2011-06-01 12:12:12.000012');
insert into t1 values(500606,'2021-08-01 16:16:16.000016');
insert into t1 values(600707,'2021-08-01 20:20:20.000020');
select * from t1;
c1	c2
200101	1991-02-01 4:04:04.000004
300303	2001-04-01 8:08:08.000008
400505	2011-06-01 12:12:12.000012
500606	2021-08-01 16:16:16.000016
600707	2021-08-01 20:20:20.000020
select c1 from t1 where microsecond(c2) > 1 group by c1 having max(microsecond(c2))<6;
c1
200101
update t1 set c1 = microsecond('020202') where microsecond(c2) > 5;
select * from t1;
c1	c2
200101	1991-02-01 4:04:04.000004
0	2001-04-01 8:08:08.000008
0	2011-06-01 12:12:12.000012
0	2021-08-01 16:16:16.000016
0	2021-08-01 20:20:20.000020
delete from t1 where microsecond(c2) > 2;
select * from t1;
c1	c2
drop table t1;
#list columns
drop table if exists t1;
Warnings:
Note	1051	Unknown table 'db1.t1'
create table t1(c1 int,c2 varchar(60)) partition by list columns(c1)
(
partition p1 values in(1,2,3,4),
partition p2 values in(5,6,7,8)
);
insert into t1 values(1,'1991-01-01 02:08:02.000002');
insert into t1 values(2,'2001-03-01 04:08:04.000004');
insert into t1 values(5,'2011-05-01 06:08:06.000006');
insert into t1 values(7,'2021-07-01 08:08:08.000008');
insert into t1 values(8,'2021-07-01 10:08:10.000010');
select * from t1;
c1	c2
1	1991-01-01 02:08:02.000002
2	2001-03-01 04:08:04.000004
5	2011-05-01 06:08:06.000006
7	2021-07-01 08:08:08.000008
8	2021-07-01 10:08:10.000010
select c1 from t1 where microsecond(c2) > 1 and microsecond(c2)< 7 order by microsecond(c2);
c1
1
2
5
update t1 set c1 = microsecond('060606.000006') where microsecond(c2) > 5;
delete from t1 where microsecond(c2) > 5 or microsecond(c1) = 6;
select * from t1;
c1	c2
1	1991-01-01 02:08:02.000002
2	2001-03-01 04:08:04.000004
drop table t1;
#view
drop table if exists t1;
Warnings:
Note	1051	Unknown table 'db1.t1'
create table t1(c1 char(60) ,c2 varchar(60) not null,c3 char(30) default '1999-09-09 18:16:30.000030');
insert into t1 values('161010.000010','18:20:20.000020','2001-02-02 03:30:30.000030');
insert into t1(c1,c2) values('051515.000015.000015','04:25:25.000025');
insert into t1 values('071313.000013','082323.000023','1880-05-05 05:33:33.000033');
insert into t1 values('101010.000010','11:11:11.000011','0001-01-01 01:01:01.000001');
insert into t1(c1,c2) values('121212.000012.000012','15:20:20.000020');
insert into t1 values('164040.000040','20220926055050.000050','0001-01-01 01:01:01.000001');
insert into t1 values('101010.000010','200202.000002','0001-01-01 01:01:01.000001');
create view v_t1 as select * from t1;
select microsecond(c1),microsecond(c2),microsecond(c3) from v_t1 order by microsecond(c1);
microsecond(c1)	microsecond(c2)	microsecond(c3)
10	20	30
10	11	1
10	2	1
12	20	30
13	23	33
15	25	30
40	50	1
#select
select microsecond(c1) from v_t1 where microsecond(c1) > 20 and microsecond(c2) <=50;
microsecond(c1)
40
select microsecond(c3) from v_t1 where microsecond(c2) < 30 and microsecond(c3) >10;
microsecond(c3)
30
30
33
30
select microsecond(c2) from v_t1 where microsecond(c1)<30 order by microsecond(c2);
microsecond(c2)
2
11
20
20
23
25
select c1,case microsecond(c1) when microsecond(c1)> 5 then microsecond('202020.000020') else microsecond('101010.000010') end as a from v_t1;
c1	a
161010.000010	10
051515.000015.000015	10
071313.000013	10
101010.000010	10
121212.000012.000012	10
164040.000040	10
101010.000010	10
select c1, case c2 when '11111111' then microsecond('111111.000011') else microsecond('080808.000008') end as a from v_t1;
c1	a
161010.000010	8
051515.000015.000015	8
071313.000013	8
101010.000010	8
121212.000012.000012	8
164040.000040	8
101010.000010	8
select distinct microsecond(c1),c2,c3 from v_t1 order by microsecond(c1);
microsecond(c1)	c2	c3
10	11:11:11.000011	0001-01-01 01:01:01.000001
10	18:20:20.000020	2001-02-02 03:30:30.000030
10	200202.000002	0001-01-01 01:01:01.000001
12	15:20:20.000020	1999-09-09 18:16:30.000030
13	082323.000023	1880-05-05 05:33:33.000033
15	04:25:25.000025	1999-09-09 18:16:30.000030
40	20220926055050.000050	0001-01-01 01:01:01.000001
select distinct microsecond(c3) ,c1,c3 from v_t1 order by microsecond(c3);
microsecond(c3)	c1	c3
1	101010.000010	0001-01-01 01:01:01.000001
1	164040.000040	0001-01-01 01:01:01.000001
30	051515.000015.000015	1999-09-09 18:16:30.000030
30	121212.000012.000012	1999-09-09 18:16:30.000030
30	161010.000010	2001-02-02 03:30:30.000030
33	071313.000013	1880-05-05 05:33:33.000033
select microsecond(c1) from v_t1 group by c1 having microsecond(c1) >=10 order by c1;
microsecond(c1)
15
13
10
12
10
40
#update
update v_t1 set c1 = microsecond('080808.000008') where microsecond(c2) > microsecond('011010.000010') and microsecond(c2)<microsecond('011515.000015');
update v_t1 set c2 = microsecond('010101.000001') where microsecond(c1) = microsecond('011313.000013') or microsecond(c3) = microsecond('16:30:31.000031');
update v_t1 set c1 = microsecond('12:30:30.000030') where microsecond(c3) in (select a2 from test2);
select * from v_t1;
c1	c2	c3
161010.000010	18:20:20.000020	2001-02-02 03:30:30.000030
051515.000015.000015	04:25:25.000025	1999-09-09 18:16:30.000030
071313.000013	1	1880-05-05 05:33:33.000033
8	11:11:11.000011	0001-01-01 01:01:01.000001
121212.000012.000012	15:20:20.000020	1999-09-09 18:16:30.000030
164040.000040	20220926055050.000050	0001-01-01 01:01:01.000001
101010.000010	200202.000002	0001-01-01 01:01:01.000001
#delete
delete from v_t1 where microsecond(c1) >microsecond('12:10:30') and microsecond(c1) < microsecond('161531');
delete from v_t1 where microsecond(c2) not in (select a2 from test2);
delete from v_t1 where microsecond(c3) != 0;
drop table t1;
drop view v_t1;
drop table test2;
#生成列
drop table if exists t1;
Warnings:
Note	1051	Unknown table 'db1.t1'
CREATE TABLE t1(c1 int,c2 int GENERATED ALWAYS AS (microsecond('060606.000006')) VIRTUAL);
insert into t1(c1) values(1);
insert into t1(c1) values(2);
select * from t1;
c1	c2
1	6
2	6
drop table t1;
#算数运算符
select microsecond('200505.001'+'050505.005');
microsecond('200505.001'+'050505.005')
6000
select microsecond('200505.001'-'050505.0005');
microsecond('200505.001'-'050505.0005')
500
select microsecond('200505.001'*'050505.0005');
microsecond('200505.001'*'050505.0005')
NULL
Warnings:
Warning	5086	Not timestamp Can not cast varchar value to timestamp type
select microsecond('200505.001'/'050505.0005');
microsecond('200505.001'/'050505.0005')
970003
#逻辑运算符
select microsecond('030303.000003') and microsecond(0305011.000011);
microsecond('030303.000003') and microsecond(0305011.000011)
1
select microsecond('1921-10-10 06:06:07.000007') and microsecond('06:09:09.000009');
microsecond('1921-10-10 06:06:07.000007') and microsecond('06:09:09.000009')
1
select not microsecond('1111-01-01 15:24:25.000025') ;
not microsecond('1111-01-01 15:24:25.000025')
0
select not microsecond('111101.000001') ;
not microsecond('111101.000001')
0
select microsecond('202101.1') or microsecond('222222.22');
microsecond('202101.1') or microsecond('222222.22')
1
select microsecond('192110.00') or microsecond('198808.08');
microsecond('192110.00') or microsecond('198808.08')
NULL
Warnings:
Warning	5086	Not timestamp Can not cast varchar value to timestamp type
select microsecond('180110.010') or microsecond('180010.10');
microsecond('180110.010') or microsecond('180010.10')
1
select microsecond('212112.12') or ('2');
microsecond('212112.12') or ('2')
1
select microsecond('212112.12') or 'aa';
microsecond('212112.12') or 'aa'
1
#比较运算符
select microsecond('200101.1') > microsecond('20:21:02.02');
microsecond('200101.1') > microsecond('20:21:02.02')
1
select microsecond('380101.1') > microsecond('200102.2');
microsecond('380101.1') > microsecond('200102.2')
0
select microsecond('AASA22CCC') > microsecond('0000-01-01.000001');
microsecond('AASA22CCC') > microsecond('0000-01-01.000001')
NULL
Warnings:
Warning	5086	Not timestamp Can not cast varchar value to timestamp type
select microsecond('202020.000020') > 'AA';
microsecond('202020.000020') > 'AA'
1
Warnings:
Warning	1292	Truncated incorrect DECIMAL value: 'AA'
select microsecond('00010101.0001') >1;
microsecond('00010101.0001') >1
1
select microsecond('2020-01-01 16:13:21.000021') < microsecond('2020-01-02 19:16:18.000018');
microsecond('2020-01-01 16:13:21.000021') < microsecond('2020-01-02 19:16:18.000018')
0
select microsecond('22:34:56.00056') < microsecond('230516.00016');
microsecond('22:34:56.00056') < microsecond('230516.00016')
0
select microsecond('2221212.00012') < microsecond('9991231.00031');
microsecond('2221212.00012') < microsecond('9991231.00031')
0
select microsecond('1500-01-01 15:13:12.00012') < 'Abc';
microsecond('1500-01-01 15:13:12.00012') < 'Abc'
0
Warnings:
Warning	1292	Truncated incorrect DECIMAL value: 'Abc'
select microsecond('2000-01-01 14:18:19.000019') < 14;
microsecond('2000-01-01 14:18:19.000019') < 14
0
select microsecond('2020-01-01 11:12:11.00011') >= microsecond('2020-01-02 08:09:10.00010');
microsecond('2020-01-01 11:12:11.00011') >= microsecond('2020-01-02 08:09:10.00010')
1
select microsecond('3800-01-01 10:11:11.11') >= microsecond('2050-01-01 08:08:08.000008');
microsecond('3800-01-01 10:11:11.11') >= microsecond('2050-01-01 08:08:08.000008')
1
select microsecond('0001-01-01 22:30:50.50') >= microsecond('0000-01-01 23:23:23.000023');
microsecond('0001-01-01 22:30:50.50') >= microsecond('0000-01-01 23:23:23.000023')
1
select microsecond('14:13:15.15') >= 'AA';
microsecond('14:13:15.15') >= 'AA'
1
Warnings:
Warning	1292	Truncated incorrect DECIMAL value: 'AA'
select microsecond('16:18:18.18') >=1;
microsecond('16:18:18.18') >=1
1
select microsecond('20201111.000011') <= microsecond('2020-011-11 22:22:22.00022');
microsecond('20201111.000011') <= microsecond('2020-011-11 22:22:22.00022')
1
select microsecond('1500101.0010') < 'CCC';
microsecond('1500101.0010') < 'CCC'
0
Warnings:
Warning	1292	Truncated incorrect DECIMAL value: 'CCC'
select microsecond('241231.1') < 25;
microsecond('241231.1') < 25
0
#时间函数嵌套
#addtime
select microsecond(ADDTIME('2007-12-31 23:59:59.999999', '11:1:1.000002'));
microsecond(ADDTIME('2007-12-31 23:59:59.999999', '11:1:1.000002'))
1
select microsecond(ADDTIME('01:00:00.999999', '02:00:00.999998'));
microsecond(ADDTIME('01:00:00.999999', '02:00:00.999998'))
999997
select microsecond(ADDTIME('2007-12-31 23:59:59.999999', '1 1:1:1.000002'));
microsecond(ADDTIME('2007-12-31 23:59:59.999999', '1 1:1:1.000002'))
1
#date_add/sub
select microsecond(DATE_ADD('2018-05-01 12:12:12.0001',INTERVAL 1 DAY));
microsecond(DATE_ADD('2018-05-01 12:12:12.0001',INTERVAL 1 DAY))
100
select microsecond(DATE_SUB('2018-05-01 16:12:12.0002',INTERVAL 1 microsecond));
microsecond(DATE_SUB('2018-05-01 16:12:12.0002',INTERVAL 1 microsecond))
199
select microsecond(DATE_ADD('2020-12-31 23:59:58.0003',INTERVAL 1 microsecond));
microsecond(DATE_ADD('2020-12-31 23:59:58.0003',INTERVAL 1 microsecond))
301
select microsecond(DATE_ADD('2018-12-31 23:59:59.0004',INTERVAL 1 DAY));
microsecond(DATE_ADD('2018-12-31 23:59:59.0004',INTERVAL 1 DAY))
400
select microsecond(DATE_ADD('2100-12-31 22:59:57.0005',INTERVAL '1:1' MINUTE_SECOND));
microsecond(DATE_ADD('2100-12-31 22:59:57.0005',INTERVAL '1:1' MINUTE_SECOND))
500
select microsecond(DATE_SUB('2025-01-01 00:00:00.0006',INTERVAL '1 1:1:1' DAY_SECOND));
microsecond(DATE_SUB('2025-01-01 00:00:00.0006',INTERVAL '1 1:1:1' DAY_SECOND))
600
select microsecond(DATE_ADD('1900-01-01 00:00:00.0007',INTERVAL '-1 10' DAY_HOUR));
microsecond(DATE_ADD('1900-01-01 00:00:00.0007',INTERVAL '-1 10' DAY_HOUR))
700
select microsecond(DATE_SUB('1998-01-02 15:15:15.000015', INTERVAL 31 DAY));
microsecond(DATE_SUB('1998-01-02 15:15:15.000015', INTERVAL 31 DAY))
15
select microsecond(DATE_ADD('1992-12-31 23:59:59.000002',INTERVAL '1.999999' SECOND_MICROSECOND));
microsecond(DATE_ADD('1992-12-31 23:59:59.000002',INTERVAL '1.999999' SECOND_MICROSECOND))
1
select microsecond(DATE_FORMAT('2003-10-03',GET_FORMAT(DATE,'EUR')));
microsecond(DATE_FORMAT('2003-10-03',GET_FORMAT(DATE,'EUR')))
100000
select microsecond(STR_TO_DATE('10.31.2003',GET_FORMAT(DATE,'USA')));
microsecond(STR_TO_DATE('10.31.2003',GET_FORMAT(DATE,'USA')))
0
#subdate/time
select microsecond(DATE_SUB('2008-01-02 08:08:08.001', INTERVAL 31 DAY));
microsecond(DATE_SUB('2008-01-02 08:08:08.001', INTERVAL 31 DAY))
1000
select microsecond(SUBDATE('2008-01-02 13:13:13.003', INTERVAL 31 DAY));
microsecond(SUBDATE('2008-01-02 13:13:13.003', INTERVAL 31 DAY))
3000
select microsecond(SUBDATE('2008-01-02 12:00:00.123', 31));
microsecond(SUBDATE('2008-01-02 12:00:00.123', 31))
123000
select microsecond(SUBTIME('2007-12-31 23:59:59.999999','1 1:1:1.000002'));
microsecond(SUBTIME('2007-12-31 23:59:59.999999','1 1:1:1.000002'))
999997
#timestamp
select microsecond(TIMESTAMP('2003-12-31 08:08:08.005'));
microsecond(TIMESTAMP('2003-12-31 08:08:08.005'))
5000
select microsecond(TIMESTAMP('2003-12-31 12:00:00','12:00:00.007'));
microsecond(TIMESTAMP('2003-12-31 12:00:00','12:00:00.007'))
7000
select microsecond(TIMESTAMPADD(microsecond,1,'2003-01-02 15:16:17.00003'));
microsecond(TIMESTAMPADD(microsecond,1,'2003-01-02 15:16:17.00003'))
31
select microsecond(TIMESTAMPADD(WEEK,1,'2003-01-02 18:18:18.2020'));
microsecond(TIMESTAMPADD(WEEK,1,'2003-01-02 18:18:18.2020'))
202000
#convert_tz
select microsecond(CONVERT_TZ('2004-01-01 12:05:20.00789','+00:00','+10:00'));
microsecond(CONVERT_TZ('2004-01-01 12:05:20.00789','+00:00','+10:00'))
7890
select microsecond(CONVERT_TZ('2004-01-01 12:05:50.180','+00:00','+20:00'));
microsecond(CONVERT_TZ('2004-01-01 12:05:50.180','+00:00','+20:00'))
NULL
#其他函数
#concat
select microsecond(concat('2020','12.1321'));
microsecond(concat('2020','12.1321'))
132100
select microsecond(concat('2021','1111.123'));
microsecond(concat('2021','1111.123'))
0
select microsecond(concat('199807.15','aa'));
microsecond(concat('199807.15','aa'))
NULL
Warnings:
Warning	5086	Not timestamp Can not cast varchar value to timestamp type
#ceil
select microsecond(ceil(213121.0111111));
microsecond(ceil(213121.0111111))
0
#cast
select microsecond(cast('2021-10-08 12:12:00.00001' as int));
ERROR 42000: You have an error in your SQL syntax; check the manual that corresponds to your OceanBase version for the right syntax to use near 'int))' at line 1
select microsecond(cast('2021-10-08 12:12:12.00012' as double));
microsecond(cast('2021-10-08 12:12:12.00012' as double))
0
Warnings:
Warning	1292	Truncated incorrect DOUBLE value: '2021-10-08 12:12:12.00012'
select microsecond(cast('2021-10-08 14:14:14.000014' as float));
microsecond(cast('2021-10-08 14:14:14.000014' as float))
0
Warnings:
Warning	1292	Truncated incorrect DOUBLE value: '2021-10-08 14:14:14.000014'
select microsecond(cast('2021-10-08 14:14:14.00014' as char(100)));
microsecond(cast('2021-10-08 14:14:14.00014' as char(100)))
140
select microsecond(cast('2021-10-08 14:14:50.000050' as varchar(100)));
ERROR 42000: You have an error in your SQL syntax; check the manual that corresponds to your OceanBase version for the right syntax to use near 'varchar(100)))' at line 1
select microsecond(cast('2021-10-08 14:14:59.000059' as date));
microsecond(cast('2021-10-08 14:14:59.000059' as date))
0
select microsecond(cast('2021-10-08 14:14:44.000044' as time));
microsecond(cast('2021-10-08 14:14:44.000044' as time))
0
select microsecond(cast('20211008141400.000010' as datetime));
microsecond(cast('20211008141400.000010' as datetime))
0
select microsecond(cast('2021-10-08 14:14:00' as timestamp));
ERROR 42000: You have an error in your SQL syntax; check the manual that corresponds to your OceanBase version for the right syntax to use near 'timestamp))' at line 1
select microsecond(cast('2021-10-08 14:14:00' as decimal(15,5)));
microsecond(cast('2021-10-08 14:14:00' as decimal(15,5)))
0
Warnings:
Warning	1292	Truncated incorrect DECIMAL value: '2021-10-08 14:14:00'
#length
select microsecond(length(11111111));
microsecond(length(11111111))
0
#substr
select microsecond(substr('0012.120021',5));
microsecond(substr('0012.120021',5))
NULL
Warnings:
Warning	5086	Not timestamp Can not cast varchar value to timestamp type
select microsecond(substr('01230.0021212' from 8));
microsecond(substr('01230.0021212' from 8))
0
select microsecond(substr('0123000.21212' from 7));
microsecond(substr('0123000.21212' from 7))
212120
select microsecond(substr('1111.121211121212121212121',5,13));
microsecond(substr('1111.121211121212121212121',5,13))
NULL
Warnings:
Warning	5086	Not timestamp Can not cast varchar value to timestamp type
#reverse
select microsecond(reverse('2012.0229'));
microsecond(reverse('2012.0229'))
NULL
Warnings:
Warning	5086	Not timestamp Can not cast varchar value to timestamp type
select microsecond(reverse('9220.2102'));
microsecond(reverse('9220.2102'))
22900
#聚合函数
drop table if exists test1;
Warnings:
Note	1051	Unknown table 'db1.test1'
create table test1(a1 int,a2 int,c1 varchar(60),c2 varchar(60));
insert into test1 values(1,080606.000006,'1998-12-12 12:12:12.000012','2038-01-19 03:14:14.000014');
insert into test1 values(2,090909.000009,'2002-02-02 10:00:00.000','2034-02-22 00:50:50.000050');
insert into test1 values(3,101010.000010,'2006-04-15 06:06:20.000020','2026-05-08 05:16:16.000016');
insert into test1 values(4,111111.000011,'2012-12-12 12:12:12.000012','2030-08-16 14:05:05.000005');
select * from test1;
a1	a2	c1	c2
1	80606	1998-12-12 12:12:12.000012	2038-01-19 03:14:14.000014
2	90909	2002-02-02 10:00:00.000	2034-02-22 00:50:50.000050
3	101010	2006-04-15 06:06:20.000020	2026-05-08 05:16:16.000016
4	111111	2012-12-12 12:12:12.000012	2030-08-16 14:05:05.000005
#count
select count(microsecond(c1)) from test1;
count(microsecond(c1))
4
select microsecond(count(c1)) from test1;
microsecond(count(c1))
0
select count(microsecond(c2)) from test1;
count(microsecond(c2))
4
select microsecond(count(c2)) from test1;
microsecond(count(c2))
0
#max
select max(microsecond(c1)) from test1;
max(microsecond(c1))
20
select microsecond(max(c1)) from test1;
microsecond(max(c1))
12
select max(microsecond(c2)) from test1;
max(microsecond(c2))
50
select microsecond(max(c2)) from test1;
microsecond(max(c2))
14
#min
select min(microsecond(c1)) from test1;
min(microsecond(c1))
0
select microsecond(min(c1)) from test1;
microsecond(min(c1))
12
select max(microsecond(c2)) from test1;
max(microsecond(c2))
50
select microsecond(max(c2)) from test1;
microsecond(max(c2))
14
#avg
select avg(microsecond(c1)) from test1;
avg(microsecond(c1))
11.0000
#OB与MYSQL不一致
select max(microsecond(c2)) from test1;
max(microsecond(c2))
50
select microsecond(max(c2)) from test1;
microsecond(max(c2))
14
#sum
select sum(microsecond(c1)) from test1;
sum(microsecond(c1))
44
select microsecond(sum(c1)) from test1;
microsecond(sum(c1))
NULL
Warnings:
Warning	1292	Truncated incorrect DOUBLE value: '1998-12-12 12:12:12.000012'
Warning	1292	Truncated incorrect DOUBLE value: '2002-02-02 10:00:00.000'
Warning	1292	Truncated incorrect DOUBLE value: '2006-04-15 06:06:20.000020'
Warning	1292	Truncated incorrect DOUBLE value: '2012-12-12 12:12:12.000012'
Warning	5086	Not timestamp Can not cast varchar value to timestamp type
select max(microsecond(c2)) from test1;
max(microsecond(c2))
50
select microsecond(max(c2)) from test1;
microsecond(max(c2))
14
drop database db1;
