drop database if exists db1;
create database db1;
use db1;
#参数
select minute('00:00:00');
minute('00:00:00')
0
select minute('00:59:59');
minute('00:59:59')
59
select minute('00:60:59');
minute('00:60:59')
NULL
Warnings:
Warning	5086	Not timestamp Can not cast varchar value to timestamp type
select minute('24:15:16');
minute('24:15:16')
15
select minute('23:01:599');
minute('23:01:599')
NULL
Warnings:
Warning	5086	Not timestamp Can not cast varchar value to timestamp type
select minute('838:22:00');
minute('838:22:00')
22
select minute('839:33:00');
minute('839:33:00')
59
select minute('0:59:59');
minute('0:59:59')
59
select minute('25:15:60');
minute('25:15:60')
NULL
Warnings:
Warning	5086	Not timestamp Can not cast varchar value to timestamp type
select minute('-12:05:05');
minute('-12:05:05')
5
select minute('-838:05:05');
minute('-838:05:05')
5
select minute('-839:33:05');
minute('-839:33:05')
59
select minute('22:12:-10');
minute('22:12:-10')
12
select minute('22:-12:-10');
minute('22:-12:-10')
0
select minute('-24:-22:-22');
minute('-24:-22:-22')
0
select minute('02:-59:-59');
minute('02:-59:-59')
0
select minute('000018:0001:01');
minute('000018:0001:01')
1
select minute('1:0000000101:1');
minute('1:0000000101:1')
NULL
Warnings:
Warning	5086	Not timestamp Can not cast varchar value to timestamp type
select minute('15:2.6789:3.111');
minute('15:2.6789:3.111')
2
#OB返回NULL,与MYSQL不一致。
select minute('15:2.12345678911:3');
minute('15:2.12345678911:3')
NULL
Warnings:
Warning	5086	Not timestamp Can not cast varchar value to timestamp type
#OB返回NULL,与MYSQL不一致。
select minute('1:59.9999999999:1');
minute('1:59.9999999999:1')
NULL
Warnings:
Warning	5086	Not timestamp Can not cast varchar value to timestamp type
select minute('0.555:55:55');
minute('0.555:55:55')
0
select minute('0.5:55:60');
minute('0.5:55:60')
0
select minute('0.99:71:88');
minute('0.99:71:88')
0
select minute('66:05.5:0.6');
minute('66:05.5:0.6')
5
select minute('1:59.9999999:60.00');
minute('1:59.9999999:60.00')
59
select minute('20:60:05');
minute('20:60:05')
NULL
Warnings:
Warning	5086	Not timestamp Can not cast varchar value to timestamp type
select minute('20:59.9:61.00');
minute('20:59.9:61.00')
59
SELECT minute('AA:05:05');
minute('AA:05:05')
NULL
Warnings:
Warning	5086	Not timestamp Can not cast varchar value to timestamp type
#参数为日期格式
select minute('2020-02-02 16:00:00');
minute('2020-02-02 16:00:00')
0
select minute('2020-02-02 24:26.5:00');
minute('2020-02-02 24:26.5:00')
NULL
Warnings:
Warning	5086	Not timestamp Can not cast varchar value to timestamp type
select minute('2020-02-02 22:30:00');
minute('2020-02-02 22:30:00')
30
select minute('2020-02-02 23:59:59');
minute('2020-02-02 23:59:59')
59
select minute('2020-02-29 23:59:59');
minute('2020-02-29 23:59:59')
59
#OB返回NULL,与MYSQL不一致
select minute('0000-00-00 00:01:00');
minute('0000-00-00 00:01:00')
1
select minute('2008-08-08 23:00:50');
minute('2008-08-08 23:00:50')
0
select minute('2008-08-08 24:-1:50');
minute('2008-08-08 24:-1:50')
NULL
Warnings:
Warning	5086	Not timestamp Can not cast varchar value to timestamp type
select minute('2008-08-08 23:-00:50');
minute('2008-08-08 23:-00:50')
0
select minute('2008-08-08 23:-50:-50');
minute('2008-08-08 23:-50:-50')
50
select minute('2008-08-08 2:50:50');
minute('2008-08-08 2:50:50')
50
#YYYYY^MM^DD HH+MM+SS
select minute('2020^00^02 16+00+00');
minute('2020^00^02 16+00+00')
0
select minute('2020^07^02 24+26.5+00');
minute('2020^07^02 24+26.5+00')
NULL
Warnings:
Warning	5086	Not timestamp Can not cast varchar value to timestamp type
select minute('2020^09^02 22+30+00');
minute('2020^09^02 22+30+00')
30
select minute('2020^12^02 23+30+59');
minute('2020^12^02 23+30+59')
30
select minute('2020^03^29 23+6+59');
minute('2020^03^29 23+6+59')
6
select minute('2020^13^29 23+8+59');
minute('2020^13^29 23+8+59')
NULL
Warnings:
Warning	5086	Not timestamp Can not cast varchar value to timestamp type
#YY^MM^DD HH+MM+SS
#OB与MYSQL不一致。OB返回NULL,MYSQL返回'20'
select minute('88^00^02 16+20+00');
minute('88^00^02 16+20+00')
20
select minute('77^01^02 24+26.5+00');
minute('77^01^02 24+26.5+00')
NULL
Warnings:
Warning	5086	Not timestamp Can not cast varchar value to timestamp type
select minute('66^03^02 22+05+00');
minute('66^03^02 22+05+00')
5
select minute('55^5^02 15+07+59');
minute('55^5^02 15+07+59')
7
select minute('44^7^29 12+59+59');
minute('44^7^29 12+59+59')
59
select minute('33^13^29 20+59+59');
minute('33^13^29 20+59+59')
NULL
Warnings:
Warning	5086	Not timestamp Can not cast varchar value to timestamp type
#YYYY@MM@DD HH^MM^SS
select minute('2020@09@02 22^15^00');
minute('2020@09@02 22^15^00')
15
select minute('2020@12@02 23^45^59');
minute('2020@12@02 23^45^59')
45
select minute('2020@03@29 23^30^59');
minute('2020@03@29 23^30^59')
30
select minute('2020@13@29 23^59^59');
minute('2020@13@29 23^59^59')
NULL
Warnings:
Warning	5086	Not timestamp Can not cast varchar value to timestamp type
#YY@MM@DD HH^MM^SS
select minute('25@09@02 22^30^00');
minute('25@09@02 22^30^00')
30
select minute('33@12@02 23^20^59');
minute('33@12@02 23^20^59')
20
select minute('55@03@29 23^33^59');
minute('55@03@29 23^33^59')
33
select minute('77@13@29 23^59^59');
minute('77@13@29 23^59^59')
NULL
Warnings:
Warning	5086	Not timestamp Can not cast varchar value to timestamp type
#参数为字符串
select minute('155959');
minute('155959')
59
select minute('0050505');
minute('0050505')
5
select minute('080000');
minute('080000')
0
select minute('125960');
minute('125960')
NULL
Warnings:
Warning	5086	Not timestamp Can not cast varchar value to timestamp type
select minute('9991111');
minute('9991111')
59
select minute('12h22m33s');
minute('12h22m33s')
0
select minute('20A15B16C');
minute('20A15B16C')
0
select minute('1');
minute('1')
0
select minute('11');
minute('11')
0
select minute('111');
minute('111')
1
select minute('1111');
minute('1111')
11
select minute('11111');
minute('11111')
11
select minute('111111');
minute('111111')
11
select minute('1111111');
minute('1111111')
11
select minute('11111111');
minute('11111111')
59
select minute('20220926151050');
minute('20220926151050')
10
select minute('20220926150050');
minute('20220926150050')
0
select minute('202209261500AA50');
minute('202209261500AA50')
NULL
Warnings:
Warning	5086	Not timestamp Can not cast varchar value to timestamp type
#多个参数
select minute('101516','171819');
ERROR 42000: You have an error in your SQL syntax; check the manual that corresponds to your OceanBase version for the right syntax to use near ','171819')' at line 1
#为空
select minute('');
minute('')
NULL
Warnings:
Warning	5086	Not timestamp Can not cast varchar value to timestamp type
select minute('0');
minute('0')
0
#OB与MYSQL结果不一致。
select minute(' ');
minute(' ')
NULL
Warnings:
Warning	5086	Not timestamp Can not cast varchar value to timestamp type
#参数为数字
select minute(155959);
minute(155959)
59
select minute(0050505);
minute(0050505)
5
select minute(080000);
minute(080000)
0
select minute(125960);
minute(125960)
NULL
Warnings:
Warning	5086	Not timestamp Can not cast varchar value to timestamp type
select minute(9991111);
minute(9991111)
NULL
Warnings:
Warning	5086	Not timestamp Can not cast varchar value to timestamp type
select minute(-121212);
minute(-121212)
12
select minute(634);
minute(634)
6
select minute(060304);
minute(060304)
3
select minute(055660);
minute(055660)
NULL
Warnings:
Warning	5086	Not timestamp Can not cast varchar value to timestamp type
#参数为中文
select minute('12时22分2秒');
minute('12时22分2秒')
0
select minute('2022年9月21日 12时22分2秒');
minute('2022年9月21日 12时22分2秒')
22
select minute('2022年9月21日 12时02分60秒');
minute('2022年9月21日 12时02分60秒')
NULL
Warnings:
Warning	5086	Not timestamp Can not cast varchar value to timestamp type
select minute('2022年9月21日 12时60分2秒');
minute('2022年9月21日 12时60分2秒')
NULL
Warnings:
Warning	5086	Not timestamp Can not cast varchar value to timestamp type
select minute('十时四分二十秒');
minute('十时四分二十秒')
NULL
Warnings:
Warning	5086	Not timestamp Can not cast varchar value to timestamp type
#特殊字符
select minute('@##%');
minute('@##%')
NULL
Warnings:
Warning	5086	Not timestamp Can not cast varchar value to timestamp type
select minute('@222#1#%$%3');
minute('@222#1#%$%3')
NULL
Warnings:
Warning	5086	Not timestamp Can not cast varchar value to timestamp type
select minute('@#%#%^#%');
minute('@#%#%^#%')
NULL
Warnings:
Warning	5086	Not timestamp Can not cast varchar value to timestamp type
select minute('/*-+*-*-');
minute('/*-+*-*-')
NULL
Warnings:
Warning	5086	Not timestamp Can not cast varchar value to timestamp type
select minute('{:}}{":"');
minute('{:}}{":"')
NULL
Warnings:
Warning	5086	Not timestamp Can not cast varchar value to timestamp type
#参数为不同类型测试
#INT
create table test1(c1 int , c2 int);
insert into test1 values(163535,020260);
select minute(c1) from test1;
minute(c1)
35
select minute(c2) from test1;
minute(c2)
NULL
Warnings:
Warning	5086	Not timestamp Can not cast varchar value to timestamp type
drop table test1;
#FLOAT
create table test1(c1 float , c2 float);
insert into test1 values(60.6060,121212.1212);
select minute(c1) from test1;
minute(c1)
NULL
Warnings:
Warning	5086	Not timestamp Can not cast varchar value to timestamp type
select minute(c2) from test1;
minute(c2)
12
drop table test1;
#DOUBLE
create table test1(c1 double , c2 double);
insert into test1 values(23.5959,161616.11111);
select minute(c1) from test1;
minute(c1)
0
select minute(c2) from test1;
minute(c2)
16
drop table test1;
#CHAR
create table test1(c1 char(100),c2 char(100));
insert into test1 values('181818','2022-09-21 16:38:00');
select minute(c1) from test1;
minute(c1)
18
select minute(c2) from test1;
minute(c2)
38
drop table test1;
#varchar
create table test1(c1 varchar(100),c2 varchar(100));
insert into test1 values('2000-01-01','20200202020202');
select minute(c1) from test1;
minute(c1)
20
select minute(c2) from test1;
minute(c2)
2
drop table test1;
#date
create table test1(c1 date,c2 date);
insert into test1 values('1000-01-01 10:10:55','10000101121231');
select minute(c1) from test1;
minute(c1)
0
select minute(c2) from test1;
minute(c2)
0
drop table test1;
#time
create table test1(c1 time,c2 time);
insert into test1 values('10:10:10','15:41:20');
select minute(c1) from test1;
minute(c1)
10
select minute(c2) from test1;
minute(c2)
41
drop table test1;
#year
create table test1(c1 year,c2 year);
insert into test1 values('1901','2155');
select minute(c1) from test1;
minute(c1)
NULL
Warnings:
Warning	5086	Not timestamp Can not cast varchar value to timestamp type
select minute(c2) from test1;
minute(c2)
NULL
Warnings:
Warning	5086	Not timestamp Can not cast varchar value to timestamp type
drop table test1;
#datetime
create table test1(c1 datetime,c2 datetime);
insert into test1 values('9999-12-31 23:59:59','1000-01-01 00:00:00');
select minute(c1) from test1;
minute(c1)
59
select minute(c2) from test1;
minute(c2)
0
drop table test1;
#timestamp
create table test1(c1 timestamp,c2 timestamp);
insert into test1 values('1970-01-01 01:01:01','2038-01-19 03:14:07');
select minute(c1) from test1;
minute(c1)
1
select minute(c2) from test1;
minute(c2)
14
drop table test1;
#decimal
create table test1(c1 decimal(5,2),c2 decimal(15,5));
insert into test1 values(202.12,20210922.1030);
select minute(c1) from test1;
minute(c1)
2
#OB与MYSQL结果不一致。
drop table test1;
#bit
create table test1(c1 bit(64),c2 bit(64));
insert into test1 values(20200202,b'11101010101');
#OB返回NULL,MYSQL返回0
select minute(c1) from test1;
minute(c1)
NULL
Warnings:
Warning	5086	Not timestamp Can not cast varchar value to timestamp type
select minute(c2) from test1;
minute(c2)
NULL
Warnings:
Warning	5086	Not timestamp Can not cast varchar value to timestamp type
drop table test1;
#enum
create table test1(c1 enum('16:50:59','101010','2020-02-02 13:13:13'));
insert into test1 values('16:50:59');
insert into test1 values('101010');
insert into test1 values('2020-02-02 13:13:13');
select minute(c1) from test1;
minute(c1)
50
10
13
drop table test1;
#set
create table test1(c1 set('16:50:59','101010','2020-02-02 13:13:13'));
insert into test1 values('16:50:59');
insert into test1 values('101010');
insert into test1 values('2020-02-02 13:13:13');
select minute(c1) from test1;
minute(c1)
50
10
13
drop table test1;
#select
drop table if exists t1;
Warnings:
Note	1051	Unknown table 'db1.t1'
create table t1(c1 int ,c2 varchar(60) not null,c3 datetime default '1999-09-09 18:16:30');
insert into t1 values(161050,'18:20:30','2001-02-02 03:30:03');
insert into t1(c1,c2) values(051501,'04:25:50');
insert into t1 values(071313,'082308','1880-05-05 05:33:05');
insert into t1 values(101010,'11:11:11','0001-01-01 01:01:01');
insert into t1(c1,c2) values(121212,'15:20:20');
insert into t1 values(164050,'20220926055005','0001-01-01 01:01:01');
insert into t1 values(101010,'2020.02.02','0001-01-01 01:01:01');
select minute(c1),minute(c2),minute(c3) from t1 order by minute(c1);
minute(c1)	minute(c2)	minute(c3)
10	20	30
10	11	1
10	20	1
12	20	16
13	23	33
15	25	16
40	50	1
#where
select minute(c1) from t1 where minute(c1) > 20 and minute(c2) <=50;
minute(c1)
40
select minute(c3) from t1 where minute(c2) < 30 and minute(c3) >10;
minute(c3)
30
16
33
16
select minute(c2) from t1 where minute(c1)<30 order by minute(c2);
minute(c2)
11
20
20
20
23
25
select c1,case minute(c1) when minute(c1)> 5 then minute('202020') else minute('101010') end as a from t1;
c1	a
161050	10
51501	10
71313	10
101010	10
121212	10
164050	10
101010	10
select c1, case c2 when '11111111' then minute('1111') else minute('080808') end as a from t1;
c1	a
161050	8
51501	8
71313	8
101010	8
121212	8
164050	8
101010	8
select distinct minute(c1),c2,c3 from t1 order by minute(c1);
minute(c1)	c2	c3
10	11:11:11	0001-01-01 01:01:01
10	18:20:30	2001-02-02 03:30:03
10	2020.02.02	0001-01-01 01:01:01
12	15:20:20	1999-09-09 18:16:30
13	082308	1880-05-05 05:33:05
15	04:25:50	1999-09-09 18:16:30
40	20220926055005	0001-01-01 01:01:01
select distinct minute(c3) ,c1,c3 from t1 order by minute(c3);
minute(c3)	c1	c3
1	101010	0001-01-01 01:01:01
1	164050	0001-01-01 01:01:01
16	51501	1999-09-09 18:16:30
16	121212	1999-09-09 18:16:30
30	161050	2001-02-02 03:30:03
33	71313	1880-05-05 05:33:05
select minute(c1) from t1 group by c1 having minute(c1) >=10;
minute(c1)
10
15
13
10
12
40
drop table t1;
#insert    不同数据类型插入
#INT
create table test1(c1 int , c2 int);
insert into test1 values(minute('18:50:50'),minute('101515'));
insert into test1 values(minute('20:08:08'),minute('90:59:59'));
select * from test1;
c1	c2
50	15
8	59
drop table test1;
#FLOAT
create table test1(c1 float , c2 float);
insert into test1 values(minute('195045'),minute('2020-02-02 12:30:30'));
insert into test1 values(minute('13:01:01'),minute('19980909090909'));
select * from test1;
c1	c2
50	30
1	9
drop table test1;
#double
create table test1(c1 double , c2 double);
insert into test1 values(minute('20220926161010'),minute('12:12:12'));
insert into test1 values(minute('08:50:50'),minute('101112'));
select * from test1;
c1	c2
10	12
50	11
drop table test1;
#char(100)
create table test1(c1 char(100),c2 char(100));
insert into test1 values(minute('341122'),minute('2121-01-01 23:30:30'));
insert into test1 values(minute('1101-01-01 14:20:20'),minute('222201'));
select * from test1;
c1	c2
11	30
20	22
drop table test1;
#varchar
create table test1(c1 varchar(100),c2 varchar(100));
insert into test1 values(minute('1998-09-09 20:20:20'),minute(101010));
insert into test1 values(minute('222211'),minute('9999-09-19 09:09:09'));
select * from test1;
c1	c2
20	10
22	9
drop table test1;
#date
create table test1(c1 date,c2 date);
insert into test1 values(minute('010101'),minute('020202'));
ERROR 22007: Incorrect datetime value for column 'c1' at row 1
insert into test1 values(minute('665040'),minute(992121));
ERROR 22007: Incorrect datetime value for column 'c1' at row 1
select * from test1;
c1	c2
drop table test1;
#time
create table test1(c1 time,c2 time);
insert into test1 values(minute('2020-08-08 20:00:00'),minute('055059'));
insert into test1 values(minute('1998-08-08 3:00:00'),minute('771717'));
select * from test1;
c1	c2
00:00:00	00:00:50
00:00:00	00:00:17
drop table test1;
#year
create table test1(c1 year,c2 year);
insert into test1 values(minute('201010'),minute('990909'));
insert into test1 values(minute('162020'),minute(111516));
select * from test1;
c1	c2
2010	2009
2020	2015
drop table test1;
#datetime
create table test1(c1 datetime,c2 datetime);
insert into test1 values(minute('2001-01-01 01:01:01'),minute(010101));
ERROR 22007: Incorrect datetime value for column 'c1' at row 1
insert into test1 values(minute('222211'),minute('22:20:20'));
ERROR 22007: Incorrect datetime value for column 'c1' at row 1
select * from test1;
c1	c2
drop table test1;
#datetime
create table test1(c1 timestamp,c2 timestamp);
insert into test1 values(minute('2001-01-01 01:01:01'),minute(010101));
ERROR 22007: Incorrect datetime value for column 'c1' at row 1
insert into test1 values(minute('222211'),minute('22:20:20'));
ERROR 22007: Incorrect datetime value for column 'c1' at row 1
select * from test1;
c1	c2
drop table test1;
#decimal
create table test1(c1 decimal(10,2),c2 decimal(15,5));
insert into test1 values(minute('122020'),minute('08:18:28'));
insert into test1 values(minute('092939'),minute(101112));
select * from test1;
c1	c2
20.00	18.00000
29.00	11.00000
drop table test1;
#bit
create table test1(c1 bit(64),c2 bit(64));
insert into test1 values(minute('06:30:31'),minute('2007-07-07 07:32:33'));
insert into test1 values(minute('08:33:34'),minute(093536));
select bin(c1),bin(c2) from test1;
bin(c1)	bin(c2)
11110	100000
100001	100011
drop table test1;
#enum
create table test1(c1 enum('50','51','52'));
insert into test1 values(minute('10:50:59'));
ERROR 01000: Data truncated for column 'c1' at row 1
insert into test1 values(minute('11:51:58'));
ERROR 01000: Data truncated for column 'c1' at row 1
select * from test1;
c1
drop table test1;
#set
create table test1(c1 set('50','51','52'));
insert into test1 values(minute('10:50:59'));
ERROR 01000: Data truncated for column 'c1' at row 1
insert into test1 values(minute('11:51:58'));
ERROR 01000: Data truncated for column 'c1' at row 1
select * from test1;
c1
drop table test1;
#update、delete
drop table if exists test1;
Warnings:
Note	1051	Unknown table 'db1.test1'
create table test1(a1 int,a2 char(20),c1 datetime,c2 datetime);
insert into test1 values(1,'1998-12-12 02:02:02','1998-12-12 03:12:12','2038-01-19 11:20:07');
insert into test1 values(2,'2002-02-02 04:04:04','2002-02-02 05:14:00','2034-02-22 12:22:20');
insert into test1 values(3,'2006-04-15 06:06:06','2006-04-15 07:16:20','2026-05-08 13:24:50');
insert into test1 values(4,'2012-12-12 08:08:08','2012-12-12 09:18:12','2030-08-16 14:26:50');
select * from test1;
a1	a2	c1	c2
1	1998-12-12 02:02:02	1998-12-12 03:12:12	2038-01-19 11:20:07
2	2002-02-02 04:04:04	2002-02-02 05:14:00	2034-02-22 12:22:20
3	2006-04-15 06:06:06	2006-04-15 07:16:20	2026-05-08 13:24:50
4	2012-12-12 08:08:08	2012-12-12 09:18:12	2030-08-16 14:26:50
create table test2(a1 int,a2 int);
insert into test2 values(1,2),(2,4),(3,6),(4,8),(5,10),(6,12),(7,14),(8,16),(9,18),(10,20),(11,22),(12,24),(13,26),(14,28);
update test1 set a1 = minute('11:11:11') where minute(a2) = (select a2 from test2 where a1 = 2);
update test1 set a1 = minute('12:12:12') where minute(c1) = 3 or minute(c2) = (select a2 from test2 where a1 = 11);
delete from test1 where minute(c1)> minute('2006-04-15 07:06:20') and minute(c2) > minute('2038-01-19 01:14:07');
delete from test1 where minute(c2) =(select a2 from test2 where a1 = 13);
drop table test1;
#复制表
drop table if exists t1;
Warnings:
Note	1051	Unknown table 'db1.t1'
create table t1(c1 int ,c2 varchar(60) not null,c3 datetime default '1999-09-09 18:16:30');
insert into t1 values(161050,'18:20:30','2001-02-02 03:30:03');
insert into t1(c1,c2) values(051501,'04:25:50');
insert into t1 values(071313,'082308','1880-05-05 05:33:05');
insert into t1 values(101010,'11:11:11','0001-01-01 01:01:01');
insert into t1(c1,c2) values(121212,'15:20:20');
insert into t1 values(164050,'20220926055005','0001-01-01 01:01:01');
insert into t1 values(101010,'200202','0001-01-01 01:01:01');
create table tt1 as select * from t1;
select minute(c1),minute(c2),minute(c3) from tt1 order by minute(c1);
minute(c1)	minute(c2)	minute(c3)
10	20	30
10	11	1
10	2	1
12	20	16
13	23	33
15	25	16
40	50	1
#select
select minute(c1) from tt1 where minute(c1) > 20 and minute(c2) <=50;
minute(c1)
40
select minute(c3) from tt1 where minute(c2) < 30 and minute(c3) >10;
minute(c3)
30
16
33
16
select minute(c2) from tt1 where minute(c1)<30 order by minute(c2);
minute(c2)
2
11
20
20
23
25
select c1,case minute(c1) when minute(c1)> 5 then minute('202020') else minute('101010') end as a from tt1;
c1	a
161050	10
51501	10
71313	10
101010	10
121212	10
164050	10
101010	10
select c1, case c2 when '11111111' then minute('1111') else minute('080808') end as a from tt1;
c1	a
161050	8
51501	8
71313	8
101010	8
121212	8
164050	8
101010	8
select distinct minute(c1),c2,c3 from tt1 order by minute(c1);
minute(c1)	c2	c3
10	11:11:11	0001-01-01 01:01:01
10	18:20:30	2001-02-02 03:30:03
10	200202	0001-01-01 01:01:01
12	15:20:20	1999-09-09 18:16:30
13	082308	1880-05-05 05:33:05
15	04:25:50	1999-09-09 18:16:30
40	20220926055005	0001-01-01 01:01:01
select distinct minute(c3) ,c1,c3 from tt1 order by minute(c3);
minute(c3)	c1	c3
1	101010	0001-01-01 01:01:01
1	164050	0001-01-01 01:01:01
16	51501	1999-09-09 18:16:30
16	121212	1999-09-09 18:16:30
30	161050	2001-02-02 03:30:03
33	71313	1880-05-05 05:33:05
select minute(c1) from tt1 group by c1 having minute(c1) >=10 order by c1;
minute(c1)
15
13
10
12
10
40
#update
update tt1 set c1 = minute('080808') where minute(c2) > minute('011010') and minute(c2)<minute('011515');
update tt1 set c2 = minute('010101') where minute(c1) = minute('011313') or minute(c3) = minute('16:30:31');
update tt1 set c1 = minute('12:30:30') where minute(c3) in (select a2 from test2);
#delete
delete from tt1 where minute(c1) >minute('12:10:30') and minute(c1) < minute('161531');
delete from tt1 where minute(c2) not in (select a2 from test2);
delete from tt1 where minute(c3) != 0;
drop table t1;
drop table tt1;
#分区
#hash
drop table if exists t1;
Warnings:
Note	1051	Unknown table 'db1.t1'
create table t1(c1 int,c2 datetime) partition by hash(c1)
(
partition p1,
partition p2
);
insert into t1 values(114040,'1991-01-01 02:08:08');
insert into t1 values(123020,'2001-03-01 04:08:08');
insert into t1 values(131516,'2011-05-01 06:08:08');
insert into t1 values(141516,'2021-07-01 08:08:08');
insert into t1 values(141617,'2021-07-01 10:08:08');
select * from t1;
c1	c2
114040	1991-01-01 02:08:08
123020	2001-03-01 04:08:08
131516	2011-05-01 06:08:08
141516	2021-07-01 08:08:08
141617	2021-07-01 10:08:08
select c1 from t1 where minute(c2) > 1 group by minute(c1) having max(minute(c2))<10;
c1
114040
123020
131516
141617
update t1 set c1 = minute('060606') where minute(c2) > 5;
delete from t1 where minute(c2) > 5 and minute(c1) = 6;
select * from t1;
c1	c2
6	1991-01-01 02:08:08
6	2001-03-01 04:08:08
6	2011-05-01 06:08:08
6	2021-07-01 08:08:08
6	2021-07-01 10:08:08
drop table t1;
#range
drop table if exists t1;
Warnings:
Note	1051	Unknown table 'db1.t1'
create table t1(c1 int ,c2 datetime) partition by range(c1)
(
partition p1 values less than(400000),
partition p2 values less than(maxvalue)
);
insert into t1 values(200102,'1991-02-01 4:02:08');
insert into t1 values(300304,'2001-04-01 8:04:08');
insert into t1 values(400506,'2011-06-01 12:06:08');
insert into t1 values(500607,'2021-08-01 16:08:08');
insert into t1 values(600708,'2021-08-01 20:10:08');
select * from t1;
c1	c2
200102	1991-02-01 04:02:08
300304	2001-04-01 08:04:08
400506	2011-06-01 12:06:08
500607	2021-08-01 16:08:08
600708	2021-08-01 20:10:08
select c1 from t1 where minute(c2) > 1 group by c1 having max(minute(c2))<6;
c1
200102
300304
update t1 set c1 = minute('020202') where minute(c2) > 5 and minute(c2) < 8;
select * from t1;
c1	c2
200102	1991-02-01 04:02:08
300304	2001-04-01 08:04:08
2	2011-06-01 12:06:08
500607	2021-08-01 16:08:08
600708	2021-08-01 20:10:08
delete from t1 where minute(c2) > 2;
select * from t1;
c1	c2
200102	1991-02-01 04:02:08
drop table t1;
#list
drop table if exists t1;
Warnings:
Note	1051	Unknown table 'db1.t1'
create table t1(c1 int,c2 int) partition by list(c1)
(
partition p1 values in(080808,070707,060606,050505),
partition p2 values in(101010,111111,121212,131313)
);
insert into t1 values(080808,1),(070707,2),(060606,3),(050505,4);
insert into t1 values(101010,5),(111111,6),(121212,7),(131313,8);
select * from t1 order by c1;
c1	c2
50505	4
60606	3
70707	2
80808	1
101010	5
111111	6
121212	7
131313	8
select * from t1 partition(p1) where minute(c1) >5 and minute(c2)<5 order by minute(c1);
c1	c2
60606	3
70707	2
80808	1
update t1 partition(p2) set c2 = minute('060606') where minute(c1) = minute('131010');
delete from t1 where minute(c1) > 6 and c2 < minute('12:59:59');
select * from t1;
c1	c2
60606	3
50505	4
drop table t1;
#key
drop table if exists t1;
Warnings:
Note	1051	Unknown table 'db1.t1'
create table t1(c1 int primary key , c2 datetime)
partition by key(c1)
partitions 2;
insert into t1 values(114040,'1991-01-01 02:02:08');
insert into t1 values(123020,'2001-03-01 04:04:08');
insert into t1 values(131516,'2011-05-01 06:06:08');
insert into t1 values(141516,'2021-07-01 08:08:08');
insert into t1 values(141617,'2021-07-01 10:10:08');
select * from t1;
c1	c2
123020	2001-03-01 04:04:08
131516	2011-05-01 06:06:08
141516	2021-07-01 08:08:08
114040	1991-01-01 02:02:08
141617	2021-07-01 10:10:08
select c1 from t1 where minute(c2) > 1 group by minute(c1) having max(minute(c2))<10;
c1
123020
131516
114040
update t1 set c1 = minute('060606') where minute(c2) > 9;
delete from t1 where minute(c2) > 5 and minute(c1) = 6;
select * from t1 order by c1;
c1	c2
6	2021-07-01 10:10:08
114040	1991-01-01 02:02:08
123020	2001-03-01 04:04:08
131516	2011-05-01 06:06:08
141516	2021-07-01 08:08:08
drop table t1;
#range columns
drop table if exists t1;
Warnings:
Note	1051	Unknown table 'db1.t1'
CREATE TABLE t1 (
c1 int,
c2 datetime
)
PARTITION BY RANGE COLUMNS(c1) (
partition p1 values less than(400000),
partition p2 values less than(maxvalue)
);
insert into t1 values(200102,'1991-02-01 4:04:08');
insert into t1 values(300304,'2001-04-01 8:08:08');
insert into t1 values(400506,'2011-06-01 12:12:08');
insert into t1 values(500607,'2021-08-01 16:16:08');
insert into t1 values(600708,'2021-08-01 20:20:08');
select * from t1;
c1	c2
200102	1991-02-01 04:04:08
300304	2001-04-01 08:08:08
400506	2011-06-01 12:12:08
500607	2021-08-01 16:16:08
600708	2021-08-01 20:20:08
select c1 from t1 where minute(c2) > 1 group by c1 having max(minute(c2))<6;
c1
200102
update t1 set c1 = minute('020202') where minute(c2) > 5;
select * from t1;
c1	c2
200102	1991-02-01 04:04:08
2	2001-04-01 08:08:08
2	2011-06-01 12:12:08
2	2021-08-01 16:16:08
2	2021-08-01 20:20:08
delete from t1 where minute(c2) > 2;
select * from t1;
c1	c2
drop table t1;
#columns list
drop table if exists t1;
Warnings:
Note	1051	Unknown table 'db1.t1'
create table t1(c1 int,c2 int) partition by list columns(c1)
(
partition p1 values in(080808,070707,060606,050505),
partition p2 values in(101010,111111,121212,131313)
);
insert into t1 values(080808,1),(070707,2),(060606,3),(050505,4);
insert into t1 values(101010,5),(111111,6),(121212,7),(131313,8);
select * from t1 order by c1;
c1	c2
50505	4
60606	3
70707	2
80808	1
101010	5
111111	6
121212	7
131313	8
select * from t1 partition(p1) where minute(c1) >5 and minute(c2)<5 order by minute(c1);
c1	c2
60606	3
70707	2
80808	1
update t1 partition(p2) set c2 = minute('060606') where minute(c1) = minute('131010');
delete from t1 where minute(c1) > 6 and c2 < minute('12:59:59');
select * from t1;
c1	c2
60606	3
50505	4
drop table t1;
#view
drop table if exists t1;
Warnings:
Note	1051	Unknown table 'db1.t1'
drop view if exists v_t1;
Warnings:
Note	1051	Unknown table 'db1.v_t1'
create table t1(c1 int ,c2 varchar(60) not null,c3 datetime default '1999-09-09 18:16:30');
insert into t1 values(161050,'18:20:30','2001-02-02 03:30:03');
insert into t1(c1,c2) values(051501,'04:25:50');
insert into t1 values(071313,'082308','1880-05-05 05:33:05');
insert into t1 values(101010,'11:11:11','0001-01-01 01:01:01');
insert into t1(c1,c2) values(121212,'15:20:20');
insert into t1 values(164050,'20220926055005','0001-01-01 01:01:01');
insert into t1 values(101010,'200202','0001-01-01 01:01:01');
create view v_t1 as select * from t1;
select minute(c1),minute(c2),minute(c3) from v_t1 order by minute(c1);
minute(c1)	minute(c2)	minute(c3)
10	20	30
10	11	1
10	2	1
12	20	16
13	23	33
15	25	16
40	50	1
#select
select minute(c1) from v_t1 where minute(c1) > 20 and minute(c2) <=50;
minute(c1)
40
select minute(c3) from v_t1 where minute(c2) < 30 and minute(c3) >10;
minute(c3)
30
16
33
16
select minute(c2) from v_t1 where minute(c1)<30 order by minute(c2);
minute(c2)
2
11
20
20
23
25
select c1,case minute(c1) when minute(c1)> 5 then minute('202020') else minute('101010') end as a from v_t1;
c1	a
161050	10
51501	10
71313	10
101010	10
121212	10
164050	10
101010	10
select c1, case c2 when '11111111' then minute('1111') else minute('080808') end as a from v_t1;
c1	a
161050	8
51501	8
71313	8
101010	8
121212	8
164050	8
101010	8
select distinct minute(c1),c2,c3 from v_t1 order by minute(c1);
minute(c1)	c2	c3
10	11:11:11	0001-01-01 01:01:01
10	18:20:30	2001-02-02 03:30:03
10	200202	0001-01-01 01:01:01
12	15:20:20	1999-09-09 18:16:30
13	082308	1880-05-05 05:33:05
15	04:25:50	1999-09-09 18:16:30
40	20220926055005	0001-01-01 01:01:01
select distinct minute(c3) ,c1,c3 from v_t1 order by minute(c3);
minute(c3)	c1	c3
1	101010	0001-01-01 01:01:01
1	164050	0001-01-01 01:01:01
16	51501	1999-09-09 18:16:30
16	121212	1999-09-09 18:16:30
30	161050	2001-02-02 03:30:03
33	71313	1880-05-05 05:33:05
select minute(c1) from v_t1 group by c1 having minute(c1) >=10 order by c1;
minute(c1)
15
13
10
12
10
40
#update
update v_t1 set c1 = minute('080808') where minute(c2) > minute('011010') and minute(c2)<minute('011515');
update v_t1 set c2 = minute('010101') where minute(c1) = minute('011313') or minute(c3) = minute('16:30:31');
update v_t1 set c1 = minute('12:30:30') where minute(c3) in (select a2 from test2);
#delete
delete from v_t1 where minute(c1) >minute('12:10:30') and minute(c1) < minute('161531');
delete from v_t1 where minute(c2) not in (select a2 from test2);
delete from v_t1 where minute(c3) != 0;
drop table test2;
drop table t1;
drop view v_t1;
#生成列
drop table if exists t1;
Warnings:
Note	1051	Unknown table 'db1.t1'
CREATE TABLE t1(c1 int,c2 int GENERATED ALWAYS AS (minute('060606')) VIRTUAL);
insert into t1(c1) values(1);
insert into t1(c1) values(2);
select * from t1;
c1	c2
1	6
2	6
drop table t1;
#算数运算符
#'+'
select minute('AAA'+060606);
minute('AAA'+060606)
6
Warnings:
Warning	1292	Truncated incorrect DOUBLE value: 'AAA'
select minute('77'+12121);
minute('77'+12121)
NULL
Warnings:
Warning	5086	Not timestamp Can not cast varchar value to timestamp type
select minute('张三'+'050505');
minute('张三'+'050505')
5
Warnings:
Warning	1292	Truncated incorrect DOUBLE value: '张三'
select minute(060606+'AAA');
minute(060606+'AAA')
6
Warnings:
Warning	1292	Truncated incorrect DOUBLE value: 'AAA'
select minute(12121+'77');
minute(12121+'77')
NULL
Warnings:
Warning	5086	Not timestamp Can not cast varchar value to timestamp type
select minute('050505'+'张三');
minute('050505'+'张三')
5
Warnings:
Warning	1292	Truncated incorrect DOUBLE value: '张三'
select minute('010101'+'20:50:60');
minute('010101'+'20:50:60')
1
Warnings:
Warning	1292	Truncated incorrect DOUBLE value: '20:50:60'
select minute('020202'+'');
minute('020202'+'')
2
select minute('03:03:03'+' ');
minute('03:03:03'+' ')
0
Warnings:
Warning	1292	Truncated incorrect DOUBLE value: '03:03:03'
select minute('040404'+0001);
minute('040404'+0001)
4
select minute('1010-01-01 05:05:05'+2001);
minute('1010-01-01 05:05:05'+2001)
30
Warnings:
Warning	1292	Truncated incorrect DOUBLE value: '1010-01-01 05:05:05'
select minute('10101')+minute('123232');
minute('10101')+minute('123232')
33
select minute('202020' )+minute('2003-02-29');
minute('202020' )+minute('2003-02-29')
40
select minute('211818')+minute('aaa');
minute('211818')+minute('aaa')
NULL
Warnings:
Warning	5086	Not timestamp Can not cast varchar value to timestamp type
#'-'
select minute('202020'-'212121');
minute('202020'-'212121')
1
select minute('232323'-080808);
minute('232323'-080808)
15
select minute('235959'-606060);
minute('235959'-606060)
1
select minute('906060'-606060);
minute('906060'-606060)
0
select minute('1005050'-'AA');
minute('1005050'-'AA')
50
Warnings:
Warning	1292	Truncated incorrect DOUBLE value: 'AA'
select minute('885050'-'张三/');
minute('885050'-'张三/')
50
Warnings:
Warning	1292	Truncated incorrect DOUBLE value: '张三/'
select minute('ABC'-'060606');
minute('ABC'-'060606')
6
Warnings:
Warning	1292	Truncated incorrect DOUBLE value: 'ABC'
select minute('周五周五'-'2010-10-10 10:10:10');
minute('周五周五'-'2010-10-10 10:10:10')
20
Warnings:
Warning	1292	Truncated incorrect DOUBLE value: '周五周五'
Warning	1292	Truncated incorrect DOUBLE value: '2010-10-10 10:10:10'
#'*'
select minute(2020*121);
minute(2020*121)
44
select minute('1'*'2020-03-03 14:20:20');
minute('1'*'2020-03-03 14:20:20')
20
Warnings:
Warning	1292	Truncated incorrect DOUBLE value: '2020-03-03 14:20:20'
select minute('14:20:20'+501010);
minute('14:20:20'+501010)
10
Warnings:
Warning	1292	Truncated incorrect DOUBLE value: '14:20:20'
select minute('020202'*'张三');
minute('020202'*'张三')
0
Warnings:
Warning	1292	Truncated incorrect DOUBLE value: '张三'
select minute('AAA'*060606);
minute('AAA'*060606)
0
Warnings:
Warning	1292	Truncated incorrect DOUBLE value: 'AAA'
select minute('77'*12121);
minute('77'*12121)
33
select minute('张三'*'050505');
minute('张三'*'050505')
0
Warnings:
Warning	1292	Truncated incorrect DOUBLE value: '张三'
#'/'
select minute(21212121/333);
minute(21212121/333)
37
select minute('18:18:18'/66);
minute('18:18:18'/66)
0
Warnings:
Warning	1292	Truncated incorrect DOUBLE value: '18:18:18'
select minute(33333333/'33');
minute(33333333/'33')
1
select minute('3333a333'/6);
minute('3333a333'/6)
5
Warnings:
Warning	1292	Truncated incorrect DOUBLE value: '3333a333'
select minute(2222222/2);
minute(2222222/2)
11
select minute('11110101'/2);
minute('11110101'/2)
50
select minute(121212*3/2+121-61321);
minute(121212*3/2+121-61321)
6
select minute(300000/2*4+615-3.666666);
minute(300000/2*4+615-3.666666)
6
#逻辑运算符
select minute('030303') and minute(0305011);
minute('030303') and minute(0305011)
1
select minute('1921-10-10 06:06:07') and minute('06:09:09');
minute('1921-10-10 06:06:07') and minute('06:09:09')
1
select not minute('1111-01-01 15:24:25') ;
not minute('1111-01-01 15:24:25')
0
select not minute('111101') ;
not minute('111101')
0
select minute('202101') or minute('222222');
minute('202101') or minute('222222')
1
select minute('192110') or minute('198808');
minute('192110') or minute('198808')
1
select minute('180110') or minute('180010');
minute('180110') or minute('180010')
1
select minute('212112') or ('2');
minute('212112') or ('2')
1
select minute('212112') or 'aa';
minute('212112') or 'aa'
1
#比较运算符
select minute('200101') > minute('20:21:02');
minute('200101') > minute('20:21:02')
0
select minute('380101') > minute('200102');
minute('380101') > minute('200102')
0
select minute('AASA22CCC') > minute('0000-01-01');
minute('AASA22CCC') > minute('0000-01-01')
NULL
Warnings:
Warning	5086	Not timestamp Can not cast varchar value to timestamp type
select minute('202020') > 'AA';
minute('202020') > 'AA'
1
Warnings:
Warning	1292	Truncated incorrect DECIMAL value: 'AA'
select minute('00010101') >1;
minute('00010101') >1
0
select minute('2020-01-01 16:13:21') < minute('2020-01-02 19:16:18');
minute('2020-01-01 16:13:21') < minute('2020-01-02 19:16:18')
1
select minute('22:34:56') < minute('230516');
minute('22:34:56') < minute('230516')
0
select minute('2221212') < minute('9991231');
minute('2221212') < minute('9991231')
1
select minute('1500-01-01 15:13:12') < 'Abc';
minute('1500-01-01 15:13:12') < 'Abc'
0
Warnings:
Warning	1292	Truncated incorrect DECIMAL value: 'Abc'
select minute('2000-01-01 14:18:19') < 14;
minute('2000-01-01 14:18:19') < 14
0
select minute('2020-01-01 11:12:11') >= minute('2020-01-02 08:09:10');
minute('2020-01-01 11:12:11') >= minute('2020-01-02 08:09:10')
1
select minute('3800-01-01 10:11:11') >= minute('2050-01-01 08:08:08');
minute('3800-01-01 10:11:11') >= minute('2050-01-01 08:08:08')
1
select minute('0001-01-01 22:30:50') >= minute('0000-01-01 23:23:23');
minute('0001-01-01 22:30:50') >= minute('0000-01-01 23:23:23')
1
select minute('14:13:15') >= 'AA';
minute('14:13:15') >= 'AA'
1
Warnings:
Warning	1292	Truncated incorrect DECIMAL value: 'AA'
select minute('16:18:18') >=1;
minute('16:18:18') >=1
1
select minute('20201111') <= minute('2020-011-11 22:22:22');
minute('20201111') <= minute('2020-011-11 22:22:22')
0
select minute(12341122) <= minute(05711212);
minute(12341122) <= minute(05711212)
NULL
Warnings:
Warning	5086	Not timestamp Can not cast varchar value to timestamp type
select minute('1500101') < 'CCC';
minute('1500101') < 'CCC'
0
Warnings:
Warning	1292	Truncated incorrect DECIMAL value: 'CCC'
select minute('241231') < 25;
minute('241231') < 25
1
#时间函数嵌套
#now
#localtime/localtimestamp
#date
select minute(date('2003-12-31 01:02:03'));
minute(date('2003-12-31 01:02:03'))
0
#curdate
#addtime
select minute(ADDTIME('2007-12-31 23:59:59.999999', '1 1:1:1.000002'));
minute(ADDTIME('2007-12-31 23:59:59.999999', '1 1:1:1.000002'))
1
select minute(ADDTIME('01:00:00.999999', '02:00:00.999998'));
minute(ADDTIME('01:00:00.999999', '02:00:00.999998'))
0
#curtime 返回当前时间
#maketime
select minute(maketime(01,00,01));
minute(maketime(01,00,01))
0
select minute(maketime(15,16,16));
minute(maketime(15,16,16))
16
select minute(maketime(888,10,15));
minute(maketime(888,10,15))
59
#period_add
select minute(PERIOD_ADD(200801,2));
minute(PERIOD_ADD(200801,2))
8
select minute(PERIOD_ADD(100801,-2));
minute(PERIOD_ADD(100801,-2))
7
#sec_to_time
select minute(sec_to_time(321513));
minute(sec_to_time(321513))
18
select minute(sec_to_time(321513)+0);
minute(sec_to_time(321513)+0)
18
select minute(sec_to_time(0));
minute(sec_to_time(0))
0
select minute(sec_to_time(9999999999999999));
minute(sec_to_time(9999999999999999))
59
#date_add/sub
select minute(DATE_ADD('2018-05-01 12:12:12',INTERVAL 1 DAY));
minute(DATE_ADD('2018-05-01 12:12:12',INTERVAL 1 DAY))
12
select minute(DATE_SUB('2018-05-01 16:12:12',INTERVAL 1 minute));
minute(DATE_SUB('2018-05-01 16:12:12',INTERVAL 1 minute))
11
select minute(DATE_ADD('2020-12-31 23:59:58',INTERVAL 1 SECOND));
minute(DATE_ADD('2020-12-31 23:59:58',INTERVAL 1 SECOND))
59
select minute(DATE_ADD('2018-12-31 23:59:59',INTERVAL 1 DAY));
minute(DATE_ADD('2018-12-31 23:59:59',INTERVAL 1 DAY))
59
select minute(DATE_ADD('2100-12-31 22:59:57',INTERVAL '1:1' MINUTE_SECOND));
minute(DATE_ADD('2100-12-31 22:59:57',INTERVAL '1:1' MINUTE_SECOND))
0
select minute(DATE_SUB('2025-01-01 00:00:00',INTERVAL '1 1:1:1' DAY_SECOND));
minute(DATE_SUB('2025-01-01 00:00:00',INTERVAL '1 1:1:1' DAY_SECOND))
58
select minute(DATE_ADD('1900-01-01 00:00:00',INTERVAL '-1 10' DAY_HOUR));
minute(DATE_ADD('1900-01-01 00:00:00',INTERVAL '-1 10' DAY_HOUR))
0
select minute(DATE_SUB('1998-01-02', INTERVAL 31 DAY));
minute(DATE_SUB('1998-01-02', INTERVAL 31 DAY))
NULL
Warnings:
Warning	5086	Not timestamp Can not cast varchar value to timestamp type
select minute(DATE_ADD('1992-12-31 23:59:59.000002',INTERVAL '1.999999' SECOND_MICROSECOND));
minute(DATE_ADD('1992-12-31 23:59:59.000002',INTERVAL '1.999999' SECOND_MICROSECOND))
0
#date_format
select minute(DATE_FORMAT('2009-10-04 22:23:00', '%W %M %Y'));
minute(DATE_FORMAT('2009-10-04 22:23:00', '%W %M %Y'))
NULL
Warnings:
Warning	5086	Not timestamp Can not cast varchar value to timestamp type
select minute(DATE_FORMAT('2007-10-04 22:23:00', '%H:%i:%s'));
minute(DATE_FORMAT('2007-10-04 22:23:00', '%H:%i:%s'))
23
#OB与MYSQL结果不一致。
select minute(DATE_FORMAT('1900-10-04 22:23:00','%D %y %a %d %m %b %j'));
minute(DATE_FORMAT('1900-10-04 22:23:00','%D %y %a %d %m %b %j'))
0
select minute(DATE_FORMAT('1997-10-04 22:23:00','%H %k %I %r %T %S %w'));
minute(DATE_FORMAT('1997-10-04 22:23:00','%H %k %I %r %T %S %w'))
0
select minute(DATE_FORMAT('1999-01-01 06:06:06', '%X %V'));
minute(DATE_FORMAT('1999-01-01 06:06:06', '%X %V'))
59
select minute(DATE_FORMAT('2006-06-00 12:12:12', '%d'));
minute(DATE_FORMAT('2006-06-00 12:12:12', '%d'))
NULL
#form_days
select minute(from_days(730669));
minute(from_days(730669))
0
select minute(from_days(999999));
minute(from_days(999999))
0
select minute(from_days(110000));
minute(from_days(110000))
0
#from_unixtime
select minute(FROM_UNIXTIME(1447430881));
minute(FROM_UNIXTIME(1447430881))
8
select minute(FROM_UNIXTIME(1447430881) + 0);
minute(FROM_UNIXTIME(1447430881) + 0)
8
select minute(FROM_UNIXTIME(1447430881,'%Y %D %M %h:%i:%s %x'));
minute(FROM_UNIXTIME(1447430881,'%Y %D %M %h:%i:%s %x'))
59
select minute(DATE_FORMAT('2003-10-03',GET_FORMAT(DATE,'EUR')));
minute(DATE_FORMAT('2003-10-03',GET_FORMAT(DATE,'EUR')))
0
select minute(STR_TO_DATE('10.31.2003',GET_FORMAT(DATE,'USA')));
minute(STR_TO_DATE('10.31.2003',GET_FORMAT(DATE,'USA')))
0
#last_day
select minute(LAST_DAY('2003-02-05'));
minute(LAST_DAY('2003-02-05'))
0
select minute(LAST_DAY('2004-02-05'));
minute(LAST_DAY('2004-02-05'))
0
select minute(LAST_DAY('2004-01-01 01:01:01'));
minute(LAST_DAY('2004-01-01 01:01:01'))
0
select minute(LAST_DAY('2003-03-32'));
minute(LAST_DAY('2003-03-32'))
NULL
#makedate
select minute(MAKEDATE(2011,31));
minute(MAKEDATE(2011,31))
0
select minute(MAKEDATE(2011,32));
minute(MAKEDATE(2011,32))
0
select minute(MAKEDATE(2011,365));
minute(MAKEDATE(2011,365))
0
select minute(MAKEDATE(2014,365));
minute(MAKEDATE(2014,365))
0
select minute(MAKEDATE(2011,0));
minute(MAKEDATE(2011,0))
NULL
select minute(PERIOD_ADD(200801,2));
minute(PERIOD_ADD(200801,2))
8
#str_to_date
select minute(STR_TO_DATE('01,5,2013','%d,%m,%Y'));
minute(STR_TO_DATE('01,5,2013','%d,%m,%Y'))
0
select minute(STR_TO_DATE('May 1, 2013','%M %d,%Y'));
minute(STR_TO_DATE('May 1, 2013','%M %d,%Y'))
0
select minute(STR_TO_DATE('abc','abc'));
minute(STR_TO_DATE('abc','abc'))
0
select minute(STR_TO_DATE('9','%m'));
minute(STR_TO_DATE('9','%m'))
NULL
Warnings:
Warning	1411	Incorrect datetime value: '9' for function str_to_date
select minute(STR_TO_DATE('00/00/0000', '%m/%d/%Y'));
minute(STR_TO_DATE('00/00/0000', '%m/%d/%Y'))
0
select minute(STR_TO_DATE('04/31/2004', '%m/%d/%Y'));
minute(STR_TO_DATE('04/31/2004', '%m/%d/%Y'))
NULL
Warnings:
Warning	1411	Incorrect datetime value: '04/31/2004' for function str_to_date
select minute(STR_TO_DATE('200442 Monday', '%X%V %W'));
minute(STR_TO_DATE('200442 Monday', '%X%V %W'))
0
#subdate/time
select minute(DATE_SUB('2008-01-02', INTERVAL 31 DAY));
minute(DATE_SUB('2008-01-02', INTERVAL 31 DAY))
20
select minute(SUBDATE('2008-01-02', INTERVAL 31 DAY));
minute(SUBDATE('2008-01-02', INTERVAL 31 DAY))
20
select minute(SUBDATE('2008-01-02 12:00:00', 31));
minute(SUBDATE('2008-01-02 12:00:00', 31))
0
select minute(SUBTIME('2007-12-31 23:59:59.999999','1 1:1:1.000002'));
minute(SUBTIME('2007-12-31 23:59:59.999999','1 1:1:1.000002'))
58
#timestamp
select minute(TIMESTAMP('2003-12-31 08:08:08'));
minute(TIMESTAMP('2003-12-31 08:08:08'))
8
select minute(TIMESTAMP('2003-12-31 12:00:00','12:00:00'));
minute(TIMESTAMP('2003-12-31 12:00:00','12:00:00'))
0
select minute(TIMESTAMPADD(MINUTE,1,'2003-01-02 15:16:17'));
minute(TIMESTAMPADD(MINUTE,1,'2003-01-02 15:16:17'))
17
select minute(TIMESTAMPADD(WEEK,1,'2003-01-02 18:18:18'));
minute(TIMESTAMPADD(WEEK,1,'2003-01-02 18:18:18'))
18
#utc_date/timestamp
#convert_tz
select minute(CONVERT_TZ('2004-01-01 12:00:00','+00:00','+10:00'));
minute(CONVERT_TZ('2004-01-01 12:00:00','+00:00','+10:00'))
0
select minute(CONVERT_TZ('2004-01-01 12:00:00','+00:00','+20:00'));
minute(CONVERT_TZ('2004-01-01 12:00:00','+00:00','+20:00'))
NULL
#其他函数
#concat
select minute(concat('2020','12'));
minute(concat('2020','12'))
20
select minute(concat('2021','1111'));
minute(concat('2021','1111'))
59
select minute(concat('19980715','aa'));
minute(concat('19980715','aa'))
59
#ceil
select minute(ceil(213121.0111111));
minute(ceil(213121.0111111))
31
#cast
select minute(cast('2021-10-08 12:12:00' as int));
ERROR 42000: You have an error in your SQL syntax; check the manual that corresponds to your OceanBase version for the right syntax to use near 'int))' at line 1
select minute(cast('2021-10-08 12:12:00' as double));
minute(cast('2021-10-08 12:12:00' as double))
20
Warnings:
Warning	1292	Truncated incorrect DOUBLE value: '2021-10-08 12:12:00'
select minute(cast('2021-10-08 14:14:00' as float));
minute(cast('2021-10-08 14:14:00' as float))
20
Warnings:
Warning	1292	Truncated incorrect DOUBLE value: '2021-10-08 14:14:00'
select minute(cast('2021-10-08 14:14:00' as char(100)));
minute(cast('2021-10-08 14:14:00' as char(100)))
14
select minute(cast('2021-10-08 14:14:00' as varchar(100)));
ERROR 42000: You have an error in your SQL syntax; check the manual that corresponds to your OceanBase version for the right syntax to use near 'varchar(100)))' at line 1
select minute(cast('2021-10-08 14:14:00' as date));
minute(cast('2021-10-08 14:14:00' as date))
0
select minute(cast('2021-10-08 14:14:00' as time));
minute(cast('2021-10-08 14:14:00' as time))
14
select minute(cast('20211008141400' as datetime));
minute(cast('20211008141400' as datetime))
14
select minute(cast('2021-10-08 14:14:00' as timestamp));
ERROR 42000: You have an error in your SQL syntax; check the manual that corresponds to your OceanBase version for the right syntax to use near 'timestamp))' at line 1
select minute(cast('2021-10-08 14:14:00' as decimal(15,5)));
minute(cast('2021-10-08 14:14:00' as decimal(15,5)))
20
Warnings:
Warning	1292	Truncated incorrect DECIMAL value: '2021-10-08 14:14:00'
#length
select minute(length(11111111));
minute(length(11111111))
0
#substr
select minute(substr('0012120021',5));
minute(substr('0012120021',5))
0
select minute(substr('012300021212' from 8));
minute(substr('012300021212' from 8))
12
select minute(substr('012300021212' from 7));
minute(substr('012300021212' from 7))
12
select minute(substr('1111121211121212121212121',5,13));
minute(substr('1111121211121212121212121',5,13))
12
select minute(substr('212312313-030303',2));
minute(substr('212312313-030303',2))
NULL
Warnings:
Warning	5086	Not timestamp Can not cast varchar value to timestamp type
#reverse
select minute(reverse('20120229'));
minute(reverse('20120229'))
59
select minute(reverse('92202102'));
minute(reverse('92202102'))
59
select minute(reverse(cast('2021-10-08 14:14:00' as datetime)));
minute(reverse(cast('2021-10-08 14:14:00' as datetime)))
NULL
Warnings:
Warning	5086	Not timestamp Can not cast varchar value to timestamp type
#聚合函数
drop table if exists test1;
Warnings:
Note	1051	Unknown table 'db1.test1'
create table test1(a1 int,a2 int,c1 datetime,c2 datetime);
insert into test1 values(1,080606,'1998-12-12 12:12:12','2038-01-19 03:14:14');
insert into test1 values(2,090909,'2002-02-02 10:00:00','2034-02-22 00:50:50');
insert into test1 values(3,101010,'2006-04-15 06:06:20','2026-05-08 05:16:16');
insert into test1 values(4,111111,'2012-12-12 12:12:12','2030-08-16 14:05:05');
select * from test1;
a1	a2	c1	c2
1	80606	1998-12-12 12:12:12	2038-01-19 03:14:14
2	90909	2002-02-02 10:00:00	2034-02-22 00:50:50
3	101010	2006-04-15 06:06:20	2026-05-08 05:16:16
4	111111	2012-12-12 12:12:12	2030-08-16 14:05:05
#count
select count(minute(c1)) from test1;
count(minute(c1))
4
select minute(count(c1)) from test1;
minute(count(c1))
0
select count(minute(c2)) from test1;
count(minute(c2))
4
select minute(count(c2)) from test1;
minute(count(c2))
0
#max
select max(minute(c1)) from test1;
max(minute(c1))
12
select minute(max(c1)) from test1;
minute(max(c1))
12
select max(minute(c2)) from test1;
max(minute(c2))
50
select minute(max(c2)) from test1;
minute(max(c2))
14
#min
select min(minute(c1)) from test1;
min(minute(c1))
0
select minute(min(c1)) from test1;
minute(min(c1))
12
select max(minute(c2)) from test1;
max(minute(c2))
50
select minute(max(c2)) from test1;
minute(max(c2))
14
#avg
select avg(minute(c1)) from test1;
avg(minute(c1))
7.5000
select minute(avg(c1)) from test1;
minute(avg(c1))
NULL
Warnings:
Warning	5086	Not timestamp Can not cast varchar value to timestamp type
select max(minute(c2)) from test1;
max(minute(c2))
50
select minute(max(c2)) from test1;
minute(max(c2))
14
#sum
select sum(minute(c1)) from test1;
sum(minute(c1))
30
select minute(sum(c1)) from test1;
minute(sum(c1))
NULL
Warnings:
Warning	5086	Not timestamp Can not cast varchar value to timestamp type
select max(minute(c2)) from test1;
max(minute(c2))
50
select minute(max(c2)) from test1;
minute(max(c2))
14
drop database db1;
