drop database if exists db1;
set timestamp = 1600000000;
create database db1;
use db1;
set timestamp = 1600000000;
#参数
#YYYY-MM-DD
select month('0000-01-01');
month('0000-01-01')
1
select month('01-01');
month('01-01')
NULL
Warnings:
Warning	5086	Not timestamp Can not cast varchar value to timestamp type
select month('0000-13-01');
month('0000-13-01')
NULL
Warnings:
Warning	5086	Not timestamp Can not cast varchar value to timestamp type
select month('2021-02-30');
month('2021-02-30')
NULL
Warnings:
Warning	5086	Not timestamp Can not cast varchar value to timestamp type
select month('2021-2-28');
month('2021-2-28')
2
select month('2021-0002-28');
month('2021-0002-28')
2
#OB返回0，mysql返回NULL
select month('0000-00-00');
month('0000-00-00')
0
select month('00000000');
month('00000000')
0
select month('2-02-02');
month('2-02-02')
2
select month('09-10');
month('09-10')
NULL
Warnings:
Warning	5086	Not timestamp Can not cast varchar value to timestamp type
select month('121212-02-02');
month('121212-02-02')
NULL
Warnings:
Warning	5086	Not timestamp Can not cast varchar value to timestamp type
select month('0020012-02-02');
month('0020012-02-02')
NULL
Warnings:
Warning	5086	Not timestamp Can not cast varchar value to timestamp type
select month('2020-00-32');
month('2020-00-32')
NULL
Warnings:
Warning	5086	Not timestamp Can not cast varchar value to timestamp type
select month('2020-01-32');
month('2020-01-32')
NULL
Warnings:
Warning	5086	Not timestamp Can not cast varchar value to timestamp type
select month('2008-02-30');
month('2008-02-30')
NULL
Warnings:
Warning	5086	Not timestamp Can not cast varchar value to timestamp type
select month('2000-13-11');
month('2000-13-11')
NULL
Warnings:
Warning	5086	Not timestamp Can not cast varchar value to timestamp type
select month('1999-000000120-15');
month('1999-000000120-15')
NULL
Warnings:
Warning	5086	Not timestamp Can not cast varchar value to timestamp type
select month('1999-0000012-15');
month('1999-0000012-15')
12
select month('0001-0.1-13');
month('0001-0.1-13')
0
select month('0001-2.8-13');
month('0001-2.8-13')
2
select month('-2000-02-02');
month('-2000-02-02')
NULL
Warnings:
Warning	5086	Not timestamp Can not cast varchar value to timestamp type
select month('3030--2-02');
month('3030--2-02')
2
select month('3030--12--20');
month('3030--12--20')
12
select month('1111--21-21');
month('1111--21-21')
NULL
Warnings:
Warning	5086	Not timestamp Can not cast varchar value to timestamp type
select month('9996-02-29');
month('9996-02-29')
2
#warning不一致。
select month('9996-120-29');
month('9996-120-29')
NULL
Warnings:
Warning	5086	Not timestamp Can not cast varchar value to timestamp type
select month('2020.002.13');
month('2020.002.13')
0
select month('2020.02.30');
month('2020.02.30')
NULL
Warnings:
Warning	5086	Not timestamp Can not cast varchar value to timestamp type
select month('0000.01.01');
month('0000.01.01')
1
select month('0000.01.00000000000000000000000000');
month('0000.01.00000000000000000000000000')
1
select month('9999.12.31');
month('9999.12.31')
12
select month('9999.12.00.00000000000000000000000000');
month('9999.12.00.00000000000000000000000000')
12
select month('9999.120.13');
month('9999.120.13')
12
select month('202020.12.12');
month('202020.12.12')
NULL
Warnings:
Warning	5086	Not timestamp Can not cast varchar value to timestamp type
select month('20200000.12.12');
month('20200000.12.12')
0
select month('1999-000000000000000000000009-09');
month('1999-000000000000000000000009-09')
9
select month('1999.000000000000000000000009.09');
month('1999.000000000000000000000009.09')
0
select month('2020-02-02 16:00:00');
month('2020-02-02 16:00:00')
2
select month('2020-02-02 24:26.5:00');
month('2020-02-02 24:26.5:00')
NULL
Warnings:
Warning	5086	Not timestamp Can not cast varchar value to timestamp type
select month('2020-02-02 22:30:00');
month('2020-02-02 22:30:00')
2
select month('2020-02-02 23:59:59');
month('2020-02-02 23:59:59')
2
select month('2020-02-29 23:59:59');
month('2020-02-29 23:59:59')
2
#YYYYY^MM^DD HH+MM+SS
select month('2020^00^02 16+00+00');
month('2020^00^02 16+00+00')
0
select month('2020^07^02 24+26.5+00');
month('2020^07^02 24+26.5+00')
NULL
Warnings:
Warning	5086	Not timestamp Can not cast varchar value to timestamp type
select month('2020^09^02 22+30+00');
month('2020^09^02 22+30+00')
9
select month('2020^12^02 23+59+59');
month('2020^12^02 23+59+59')
12
select month('2020^03^29 23+59+59');
month('2020^03^29 23+59+59')
3
select month('2020^13^29 23+59+59');
month('2020^13^29 23+59+59')
NULL
Warnings:
Warning	5086	Not timestamp Can not cast varchar value to timestamp type
#YY^MM^DD HH+MM+SS
select month('88^00^02 16+00+00');
month('88^00^02 16+00+00')
0
select month('77^01^02 24+26.5+00');
month('77^01^02 24+26.5+00')
NULL
Warnings:
Warning	5086	Not timestamp Can not cast varchar value to timestamp type
select month('66^03^02 22+30+00');
month('66^03^02 22+30+00')
3
select month('55^5^02 23+59+59');
month('55^5^02 23+59+59')
5
select month('44^7^29 23+59+59');
month('44^7^29 23+59+59')
7
select month('33^13^29 23+59+59');
month('33^13^29 23+59+59')
NULL
Warnings:
Warning	5086	Not timestamp Can not cast varchar value to timestamp type
#YYYY^MM^DD
select month('0000^05^02');
month('0000^05^02')
5
select month('9999^07^02');
month('9999^07^02')
7
select month('2010^09^02');
month('2010^09^02')
9
select month('1950^12^02');
month('1950^12^02')
12
select month('1660^03^29');
month('1660^03^29')
3
select month('2070^13^29');
month('2070^13^29')
NULL
Warnings:
Warning	5086	Not timestamp Can not cast varchar value to timestamp type
#YY^MM^DD
select month('01^05^02');
month('01^05^02')
5
select month('99^07^02');
month('99^07^02')
7
select month('10^09^02');
month('10^09^02')
9
select month('50^12^02');
month('50^12^02')
12
select month('60^03^29');
month('60^03^29')
3
select month('70^13^29');
month('70^13^29')
NULL
Warnings:
Warning	5086	Not timestamp Can not cast varchar value to timestamp type
#YYYY@MM@DD HH^MM^SS
select month('2020@00@02 16^00^00');
month('2020@00@02 16^00^00')
0
select month('2020@07@02 24^26.5^00');
month('2020@07@02 24^26.5^00')
NULL
Warnings:
Warning	5086	Not timestamp Can not cast varchar value to timestamp type
select month('2020@09@02 22^30^00');
month('2020@09@02 22^30^00')
9
select month('2020@12@02 23^59^59');
month('2020@12@02 23^59^59')
12
select month('2020@03@29 23^59^59');
month('2020@03@29 23^59^59')
3
select month('2020@13@29 23^59^59');
month('2020@13@29 23^59^59')
NULL
Warnings:
Warning	5086	Not timestamp Can not cast varchar value to timestamp type
#YY@MM@DD HH^MM^SS
select month('01@00@02 16^00^00');
month('01@00@02 16^00^00')
0
select month('15@07@02 24^26.5^00');
month('15@07@02 24^26.5^00')
NULL
Warnings:
Warning	5086	Not timestamp Can not cast varchar value to timestamp type
select month('25@09@02 22^30^00');
month('25@09@02 22^30^00')
9
select month('33@12@02 23^59^59');
month('33@12@02 23^59^59')
12
select month('55@03@29 23^59^59');
month('55@03@29 23^59^59')
3
select month('77@13@29 23^59^59');
month('77@13@29 23^59^59')
NULL
Warnings:
Warning	5086	Not timestamp Can not cast varchar value to timestamp type
#多个参数
select month('1111-01-01','2222-02-02');
ERROR 42000: You have an error in your SQL syntax; check the manual that corresponds to your OceanBase version for the right syntax to use near ','2222-02-02')' at line 1
#为空
select month('');
month('')
NULL
Warnings:
Warning	5086	Not timestamp Can not cast varchar value to timestamp type
select month(' ');
month(' ')
NULL
Warnings:
Warning	5086	Not timestamp Can not cast varchar value to timestamp type
select month();
ERROR 42000: You have an error in your SQL syntax; check the manual that corresponds to your OceanBase version for the right syntax to use near ')' at line 1
#为NULL
select month(null);
month(null)
NULL
select month('null');
month('null')
NULL
Warnings:
Warning	5086	Not timestamp Can not cast varchar value to timestamp type
#参数为数字
select month(20200202);
month(20200202)
2
select month(00000101);
month(00000101)
1
select month(99991231);
month(99991231)
12
select month(12121212);
month(12121212)
12
select month(11110100202);
month(11110100202)
11
select month(1111010022);
month(1111010022)
11
select month(111101002);
month(111101002)
1
select month(20120229);
month(20120229)
2
select month(201202290);
month(201202290)
NULL
Warnings:
Warning	5086	Not timestamp Can not cast varchar value to timestamp type
select month(20120230);
month(20120230)
NULL
Warnings:
Warning	5086	Not timestamp Can not cast varchar value to timestamp type
select month(18881312);
month(18881312)
NULL
Warnings:
Warning	5086	Not timestamp Can not cast varchar value to timestamp type
select month(-20220202);
month(-20220202)
NULL
Warnings:
Warning	5086	Not timestamp Can not cast varchar value to timestamp type
#参数为字符串
select month('00010101');
month('00010101')
1
select month('99991231');
month('99991231')
12
select month('20180230');
month('20180230')
NULL
Warnings:
Warning	5086	Not timestamp Can not cast varchar value to timestamp type
select month('11010');
month('11010')
1
select month('111');
month('111')
NULL
Warnings:
Warning	5086	Not timestamp Can not cast varchar value to timestamp type
#OB与MYSQL不一致
select month('2020.12.12 12:12:12');
month('2020.12.12 12:12:12')
12
select month('0000.02.02 03:03:33');
month('0000.02.02 03:03:33')
2
select month('1888-00008-08 12:59:61');
month('1888-00008-08 12:59:61')
NULL
Warnings:
Warning	5086	Not timestamp Can not cast varchar value to timestamp type
select month('0018.0012.0022 12.12.12');
month('0018.0012.0022 12.12.12')
NULL
Warnings:
Warning	5086	Not timestamp Can not cast varchar value to timestamp type
select month('0018.0012.0022 12:12:12');
month('0018.0012.0022 12:12:12')
NULL
Warnings:
Warning	5086	Not timestamp Can not cast varchar value to timestamp type
#中文
#OB可以返回值，MYSQL返回NULL
select month('2020-2月-12');
month('2020-2月-12')
2
select month("2018年8月28日");
month("2018年8月28日")
8
select month('2020年2月29日');
month('2020年2月29日')
2
select hour('12时22分2秒');
hour('12时22分2秒')
0
select hour('2022年9月21日 12时22分2秒');
hour('2022年9月21日 12时22分2秒')
12
#特殊字符
select month('@##%');
month('@##%')
NULL
Warnings:
Warning	5086	Not timestamp Can not cast varchar value to timestamp type
select month('@222#1#%$%3');
month('@222#1#%$%3')
NULL
Warnings:
Warning	5086	Not timestamp Can not cast varchar value to timestamp type
select month('@#%#%^#%');
month('@#%#%^#%')
NULL
Warnings:
Warning	5086	Not timestamp Can not cast varchar value to timestamp type
select month('/*-+*-*-');
month('/*-+*-*-')
NULL
Warnings:
Warning	5086	Not timestamp Can not cast varchar value to timestamp type
select month('{:}}{":"');
month('{:}}{":"')
NULL
Warnings:
Warning	5086	Not timestamp Can not cast varchar value to timestamp type
#参数为不同类型测试。
#INT
create table test1(c1 int , c2 int);
insert into test1 values(1111111,20210918);
select month(c1) from test1;
month(c1)
11
select month(c2) from test1;
month(c2)
9
drop table test1;
#FLOAT
create table test1(c1 float , c2 float);
insert into test1 values(123.456,2021.0918);
select month(c1) from test1;
month(c1)
1
select month(c2) from test1;
month(c2)
NULL
Warnings:
Warning	5086	Not timestamp Can not cast varchar value to timestamp type
drop table test1;
#DOUBLE
create table test1(c1 double , c2 double);
insert into test1 values(20200202.00002,2021.0918);
select month(c1) from test1;
month(c1)
2
select month(c2) from test1;
month(c2)
NULL
Warnings:
Warning	5086	Not timestamp Can not cast varchar value to timestamp type
drop table test1;
#CHAR
create table test1(c1 char(100),c2 char(100));
insert into test1 values('20210918','2020-02-02');
select month(c1) from test1;
month(c1)
9
select month(c2) from test1;
month(c2)
2
drop table test1;
#varchar
create table test1(c1 varchar(100),c2 varchar(100));
insert into test1 values('20210918','1000-01-01 12:33:33');
select month(c1) from test1;
month(c1)
9
select month(c2) from test1;
month(c2)
1
drop table test1;
#date
create table test1(c1 date,c2 date);
insert into test1 values('1000-01-01','10000101');
select month(c1) from test1;
month(c1)
1
select month(c2) from test1;
month(c2)
1
drop table test1;
#time
create table test1(c1 time,c2 time);
insert into test1 values('10:10:10','15:41:20');
select month(c1) from test1;
month(c1)
9
select month(c2) from test1;
month(c2)
9
drop table test1;
#month
create table test1(c1 year,c2 year);
insert into test1 values('1901','2155');
select month(c1) from test1;
month(c1)
NULL
Warnings:
Warning	5086	Not timestamp Can not cast varchar value to timestamp type
select month(c2) from test1;
month(c2)
NULL
Warnings:
Warning	5086	Not timestamp Can not cast varchar value to timestamp type
drop table test1;
#datetime
create table test1(c1 datetime,c2 datetime);
insert into test1 values('9999-12-31 23:59:59','1000-01-01 00:00:00');
select month(c1) from test1;
month(c1)
12
select month(c2) from test1;
month(c2)
1
drop table test1;
#timestamp
create table test1(c1 timestamp,c2 timestamp);
insert into test1 values('1970-01-01 00:00:01','2038-01-19 03:14:07');
select month(c1) from test1;
month(c1)
1
select month(c2) from test1;
month(c2)
1
drop table test1;
#decimal
create table test1(c1 decimal(5,2),c2 decimal(15,5));
insert into test1 values(202.12,20210922.1030);
select month(c1) from test1;
month(c1)
2
select month(c2) from test1;
month(c2)
9
drop table test1;
#bit
create table test1(c1 bit(64),c2 bit(1));
insert into test1 values(20200202,b'1');
select month(c1) from test1;
month(c1)
NULL
Warnings:
Warning	5086	Not timestamp Can not cast varchar value to timestamp type
select month(c2) from test1;
month(c2)
NULL
Warnings:
Warning	5086	Not timestamp Can not cast varchar value to timestamp type
drop table test1;
#enum
create table test1(c1 enum('2020-02-02','10100101','88880808'));
insert into test1 values('2020-02-02');
insert into test1 values('10100101');
insert into test1 values('88880808');
select month(c1) from test1;
month(c1)
2
1
8
drop table test1;
#set
create table test1(c1 set('0001-01-01','9999-12-31','2024-2-29'));
insert into test1 values('0001-01-01');
insert into test1 values('9999-12-31');
insert into test1 values('2024-2-29');
select month(c1) from test1;
month(c1)
1
12
2
drop table test1;
#select
drop table if exists t1;
Warnings:
Note	1051	Unknown table 'db1.t1'
create table t1(c1 int ,c2 varchar(60) not null,c3 datetime default '1999-09-09');
insert into t1 values(19990909,'2000-01-01','2001-02-02 03:03:03');
insert into t1(c1,c2) values(10000101,'33330303');
insert into t1 values(99991231,'00010101','1880-05-05 05:05:05');
insert into t1 values(66660606,'99990909090909','0001-01-01 01:01:01');
insert into t1(c1,c2) values(20000808,'11111111');
insert into t1 values(66660606,'99990909090909','0001-01-01 01:01:01');
insert into t1 values(66660606,'2020.02.02','0001-01-01 01:01:01');
select month(c1),month(c2),month(c3) from t1 order by month(c1);
month(c1)	month(c2)	month(c3)
1	3	9
6	9	1
6	9	1
6	2	1
8	11	9
9	1	2
12	1	5
#where
select month(c1) from t1 where month(c1) > 5 and month(c2) <10;
month(c1)
9
12
6
6
6
select month(c3) from t1 where month(c2) < 3 and month(c3) >0;
month(c3)
2
5
1
select month(c2) from t1 where month(c1)>3 order by month(c2);
month(c2)
1
1
2
9
9
11
select c1,case month(c1) when month(c1)> 5 then month('0101-01-01') else month('2000-10-10') end as a from t1;
c1	a
19990909	10
10000101	10
99991231	10
66660606	10
20000808	10
66660606	10
66660606	10
select c1, case c2 when '11111111' then month('1111') else month('2020-02-02') end as a from t1;
c1	a
19990909	2
10000101	2
99991231	2
66660606	2
20000808	NULL
66660606	2
66660606	2
Warnings:
Warning	5086	Not timestamp Can not cast varchar value to timestamp type
select distinct month(c1),c2,c3 from t1 order by month(c1);
month(c1)	c2	c3
1	33330303	1999-09-09 00:00:00
6	2020.02.02	0001-01-01 01:01:01
6	99990909090909	0001-01-01 01:01:01
8	11111111	1999-09-09 00:00:00
9	2000-01-01	2001-02-02 03:03:03
12	00010101	1880-05-05 05:05:05
select distinct month(c3) ,c1,c3 from t1 order by month(c3);
month(c3)	c1	c3
1	66660606	0001-01-01 01:01:01
2	19990909	2001-02-02 03:03:03
5	99991231	1880-05-05 05:05:05
9	10000101	1999-09-09 00:00:00
9	20000808	1999-09-09 00:00:00
select month(c1) from t1 group by c1 having month(c1) >3;
month(c1)
9
12
6
8
#insert 不同类型插入 month函数
#INT
create table test1(c1 int , c2 int);
insert into test1 values(month('1999-09-09'),month('2222-02-02'));
#OB正常执行，MYSQL报错
insert into test1 values(month('2000-00-00'),month('3333-33-03'));
Warnings:
Warning	5086	Not timestamp Can not cast varchar value to timestamp type
select * from test1;
c1	c2
9	2
0	NULL
drop table test1;
#FLOAT
#OB正常插入，mysql报错。
#DOUBLE
create table test1(c1 double , c2 double);
insert into test1 values(month('2022-09-13'),month('2021-01-01 11:11:11'));
insert into test1 values(month('aa'),month('1000'));
ERROR 22007: Incorrect datetime value for column 'c1' at row 1
select * from test1;
c1	c2
9	1
drop table test1;
#CHAR
create table test1(c1 char(100),c2 char(100));
insert into test1 values(month('12341122'),month('2121-01-01'));
insert into test1 values(month('1101-01-01'),month('2222-01-02'));
select * from test1;
c1	c2
11	1
1	1
drop table test1;
#varchar
create table test1(c1 varchar(100),c2 varchar(100));
insert into test1 values(month('1998-09-09'),month(10101010));
insert into test1 values(month('22221111'),month('9999-09-19'));
select * from test1;
c1	c2
9	10
11	9
drop table test1;
#date
create table test1(c1 date,c2 date);
insert into test1 values(month('1212-12-12'),month('32580931'));
ERROR 22007: Incorrect datetime value for column 'c1' at row 1
insert into test1 values(month('77771211'),month(88880808));
ERROR 22007: Incorrect datetime value for column 'c1' at row 1
select * from test1;
c1	c2
drop table test1;
#time
create table test1(c1 time,c2 time);
insert into test1 values(month('2020-08-08'),month('1111-12-12'));
insert into test1 values(month('1998-08-08'),month('2050-05-05'));
select * from test1;
c1	c2
00:00:08	00:00:12
00:00:08	00:00:05
drop table test1;
#year
create table test1(c1 year,c2 year);
insert into test1 values(month('2010-10-10'),month('9999-09-09'));
insert into test1 values(month('1977-07-07'),month(20200220));
select * from test1;
c1	c2
2010	2009
2007	2002
drop table test1;
#datetime
create table test1(c1 datetime,c2 datetime);
insert into test1 values(month('1998-09-09'),month(10101010));
ERROR 22007: Incorrect datetime value for column 'c1' at row 1
insert into test1 values(month('22221111'),month('9999-09-19'));
ERROR 22007: Incorrect datetime value for column 'c1' at row 1
select * from test1;
c1	c2
drop table test1;
#timestamp
create table test1(c1 timestamp,c2 timestamp);
insert into test1 values(month('1998-09-09'),month(10101010));
ERROR 22007: Incorrect datetime value for column 'c1' at row 1
insert into test1 values(month('22221111'),month('9999-09-19'));
ERROR 22007: Incorrect datetime value for column 'c1' at row 1
select * from test1;
c1	c2
drop table test1;
#decimal
create table test1(c1 decimal(10,2),c2 decimal(15,5));
insert into test1 values(month('2020-08-08'),month('1111-12-12'));
insert into test1 values(month('1998-08-08'),month('2050-05-05'));
select * from test1;
c1	c2
8.00	12.00000
8.00	5.00000
drop table test1;
#bit
create table test1(c1 bit(64),c2 bit(64));
insert into test1 values(month('1212-12-12'),month('32580930'));
insert into test1 values(month('77771211'),month(88880808));
select bin(c1),bin(c2) from test1;
bin(c1)	bin(c2)
1100	1001
1100	1000
drop table test1;
#enum
create table test1(c1 enum('2','8','10'));
insert into test1 values(month('2020-02-02'));
insert into test1 values(month('88880808'));
ERROR 01000: Data truncated for column 'c1' at row 1
select * from test1;
c1
8
drop table test1;
#set
create table test1(c1 set('1','2','12'));
insert into test1 values(month('0001-01-01'));
insert into test1 values(month('9999-12-31'));
ERROR 01000: Data truncated for column 'c1' at row 1
select * from test1;
c1
1
drop table test1;
#update、delete
drop table if exists test1;
Warnings:
Note	1051	Unknown table 'db1.test1'
create table test1(a1 int,a2 int,c1 datetime,c2 datetime);
insert into test1 values(1,month('1998-12-12 12:12:12'),convert_tz('1998-12-12 12:12:12','+00:00','+00:00'),convert_tz('2038-01-19 03:14:07','+00:00','+00:00'));
insert into test1 values(2,month('2002-02-02 10:00:00'),convert_tz('2002-02-02 10:00:00','+00:00','+00:00'),convert_tz('2034-02-22 00:50:20','+00:00','+00:00'));
insert into test1 values(3,month('2006-04-15 06:06:20'),convert_tz('2006-04-15 06:06:20','+00:00','+00:00'),convert_tz('2026-05-08 05:16:50','+00:00','+00:00'));
insert into test1 values(4,month('2012-12-12 12:12:12'),convert_tz('2012-12-12 12:12:12','+00:00','+00:00'),convert_tz('2030-08-16 14:05:50','+00:00','+00:00'));
select * from test1;
a1	a2	c1	c2
1	12	1998-12-12 12:12:12	2038-01-19 03:14:07
2	2	2002-02-02 10:00:00	2034-02-22 00:50:20
3	4	2006-04-15 06:06:20	2026-05-08 05:16:50
4	12	2012-12-12 12:12:12	2030-08-16 14:05:50
update test1 set a1 = month('2008-08-08') where month(c1)=2;
update test1 set a2 = month('2019-10-01') where month(c1) = (select max(month(c1)) from test1);
select * from test1;
a1	a2	c1	c2
1	10	1998-12-12 12:12:12	2038-01-19 03:14:07
8	2	2002-02-02 10:00:00	2034-02-22 00:50:20
3	4	2006-04-15 06:06:20	2026-05-08 05:16:50
4	10	2012-12-12 12:12:12	2030-08-16 14:05:50
delete from test1 where month(c1) > 10 and month(c2)<5;
delete from test1 where month(c1) != 2;
drop table test1;
#复制表
drop table if exists t1;
create table t1(c1 int ,c2 varchar(60) not null,c3 datetime default '1999-09-09');
insert into t1 values(19990909,'2000-01-01','2001-02-02 03:03:03');
insert into t1(c1,c2) values(10000101,'33330303');
insert into t1 values(99991231,'00010101','1880-05-05 05:05:05');
insert into t1 values(66660606,'99990909090909','0001-01-01 01:01:01');
insert into t1(c1,c2) values(20000808,'11111111');
insert into t1 values(66660606,'99990909090909','0001-01-01 01:01:01');
insert into t1 values(66660606,'2020.02.02','0001-01-01 01:01:01');
create table tt1 as select * from t1;
select month(c1),month(c2),month(c3) from tt1 order by month(c1);
month(c1)	month(c2)	month(c3)
1	3	9
6	9	1
6	9	1
6	2	1
8	11	9
9	1	2
12	1	5
#where
select month(c1) from tt1 where month(c1) > 5 and month(c2) <10;
month(c1)
9
12
6
6
6
select month(c3) from tt1 where month(c2) < 3 and month(c3) >0;
month(c3)
2
5
1
select month(c2) from tt1 where month(c1)>3 order by month(c2);
month(c2)
1
1
2
9
9
11
select c1,case month(c1) when month(c1)> 5 then month('0101-01-01') else month('2000-10-10') end as a from tt1;
c1	a
19990909	10
10000101	10
99991231	10
66660606	10
20000808	10
66660606	10
66660606	10
select c1, case c2 when '11111111' then month('1111') else month('2020-02-02') end as a from tt1;
c1	a
19990909	2
10000101	2
99991231	2
66660606	2
20000808	NULL
66660606	2
66660606	2
Warnings:
Warning	5086	Not timestamp Can not cast varchar value to timestamp type
select distinct month(c1),c2,c3 from tt1 order by month(c1);
month(c1)	c2	c3
1	33330303	1999-09-09 00:00:00
6	2020.02.02	0001-01-01 01:01:01
6	99990909090909	0001-01-01 01:01:01
8	11111111	1999-09-09 00:00:00
9	2000-01-01	2001-02-02 03:03:03
12	00010101	1880-05-05 05:05:05
select distinct month(c3) ,c1,c3 from tt1 order by month(c3);
month(c3)	c1	c3
1	66660606	0001-01-01 01:01:01
2	19990909	2001-02-02 03:03:03
5	99991231	1880-05-05 05:05:05
9	10000101	1999-09-09 00:00:00
9	20000808	1999-09-09 00:00:00
select month(c1) from tt1 group by c1 having month(c1) >3;
month(c1)
9
12
6
8
#update,delete
update tt1 set c1 = month('2012.12.12') where month(c2) = 3;
update tt1 set c2 = month('99990909') where month(c3)=2;
delete from tt1 where month(c3) = 5 and month(c1) = 12;
select * from tt1;
c1	c2	c3
19990909	9	2001-02-02 03:03:03
12	33330303	1999-09-09 00:00:00
99991231	00010101	1880-05-05 05:05:05
66660606	99990909090909	0001-01-01 01:01:01
20000808	11111111	1999-09-09 00:00:00
66660606	99990909090909	0001-01-01 01:01:01
66660606	2020.02.02	0001-01-01 01:01:01
drop table tt1;
drop table t1;
#分区
#hash
drop table if exists t1;
Warnings:
Note	1051	Unknown table 'db1.t1'
create table t1(c1 int,c2 datetime) partition by hash(c1)
(
partition p1,
partition p2
);
insert into t1 values(month('1991-01-01'),'1991-01-01 08:08:08');
insert into t1 values(month('2001-03-01'),'2001-03-01 08:08:08');
insert into t1 values(month('2011-05-01'),'2011-05-01 08:08:08');
insert into t1 values(month('2021-07-01'),'2021-07-01 08:08:08');
insert into t1 values(month('2021-07-01'),'2021-07-01 08:08:08');
select * from t1;
c1	c2
1	1991-01-01 08:08:08
3	2001-03-01 08:08:08
5	2011-05-01 08:08:08
7	2021-07-01 08:08:08
7	2021-07-01 08:08:08
select * from t1 where month(c2) > 1 group by c1 having max(month(c2))<10;
c1	c2
3	2001-03-01 08:08:08
5	2011-05-01 08:08:08
7	2021-07-01 08:08:08
update t1 set c1 = month('2009-09-09') where month(c2) > 5;
select * from t1;
c1	c2
1	1991-01-01 08:08:08
3	2001-03-01 08:08:08
5	2011-05-01 08:08:08
9	2021-07-01 08:08:08
9	2021-07-01 08:08:08
delete from t1 where month(c2) > 2;
select * from t1;
c1	c2
1	1991-01-01 08:08:08
drop table t1;
#range
drop table if exists t1;
Warnings:
Note	1051	Unknown table 'db1.t1'
create table t1(c1 int ,c2 datetime) partition by range(c1)
(
partition p1 values less than(month('1980-5-01')),
partition p2 values less than(maxvalue)
);
insert into t1 values(month('1991-02-01'),'1991-02-01 08:08:08');
insert into t1 values(month('2001-04-01'),'2001-04-01 08:08:08');
insert into t1 values(month('2011-06-01'),'2011-06-01 08:08:08');
insert into t1 values(month('2021-08-01'),'2021-08-01 08:08:08');
insert into t1 values(month('2021-08-01'),'2021-08-01 08:08:08');
select * from t1;
c1	c2
2	1991-02-01 08:08:08
4	2001-04-01 08:08:08
6	2011-06-01 08:08:08
8	2021-08-01 08:08:08
8	2021-08-01 08:08:08
select * from t1 where month(c2) > 1 group by c1 having max(month(c2))<6;
c1	c2
2	1991-02-01 08:08:08
4	2001-04-01 08:08:08
update t1 set c1 = month('2009-09-09') where month(c2) > 5;
select * from t1;
c1	c2
2	1991-02-01 08:08:08
4	2001-04-01 08:08:08
9	2011-06-01 08:08:08
9	2021-08-01 08:08:08
9	2021-08-01 08:08:08
delete from t1 where month(c2) > 2;
select * from t1;
c1	c2
2	1991-02-01 08:08:08
drop table t1;
#list
drop table if exists t1;
Warnings:
Note	1051	Unknown table 'db1.t1'
create table t1(c1 int,c2 int) partition by list(c1)
(
partition p0 values in(month('1900-01-01'),month('1950-01-01'),month('2020-01-01'),month('2070-01-01')),
partition p1 values in(month('3030-12-31'),month('4030-12-31'),month('5030-12-31'),month('6030-12-31'))
);
ERROR HY000: Multiple definition of same constant in list partitioning
#key
drop table if exists t1;
Warnings:
Note	1051	Unknown table 'db1.t1'
create table t1(c1 int primary key , c2 datetime)
partition by key(c1)
partitions 2;
insert into t1 values(month('1970-01-01'),'1970-01-01 08:08:08');
insert into t1 values(month('1981-03-01'),'1971-05-01 08:08:08');
insert into t1 values(month('1991-05-01'),'1971-08-01 08:08:08');
insert into t1 values(month('2021-07-01'),'2021-11-01 08:08:08');
insert into t1 values(month('2031-09-01'),'2021-12-01 08:08:08');
select * from t1;
c1	c2
1	1970-01-01 08:08:08
3	1971-05-01 08:08:08
5	1971-08-01 08:08:08
9	2021-12-01 08:08:08
7	2021-11-01 08:08:08
select * from t1 partition(p0) where month(c2)>2 group by c1 having max(month(c2)>3);
c1	c2
3	1971-05-01 08:08:08
5	1971-08-01 08:08:08
9	2021-12-01 08:08:08
update t1 partition(p1) set c1 = month('2010-10-10') where month(c2)> 2;
delete from t1 partition(p1) where month(c2)>2;
select * from t1;
c1	c2
1	1970-01-01 08:08:08
3	1971-05-01 08:08:08
5	1971-08-01 08:08:08
9	2021-12-01 08:08:08
drop table t1;
#range columns
drop table if exists t1;
Warnings:
Note	1051	Unknown table 'db1.t1'
CREATE TABLE t1 (
c1 int,
c2 datetime
)
PARTITION BY RANGE COLUMNS(c1) (
partition p1 values less than(month('1980-05-01')),
partition p2 values less than(maxvalue)
);
insert into t1 values(month('1991-02-01'),'1991-02-01 08:08:08');
insert into t1 values(month('2001-04-01'),'2001-04-01 08:08:08');
insert into t1 values(month('2011-06-01'),'2011-06-01 08:08:08');
insert into t1 values(month('2021-08-01'),'2021-08-01 08:08:08');
insert into t1 values(month('2021-08-01'),'2021-08-01 08:08:08');
select * from t1;
c1	c2
2	1991-02-01 08:08:08
4	2001-04-01 08:08:08
6	2011-06-01 08:08:08
8	2021-08-01 08:08:08
8	2021-08-01 08:08:08
select * from t1 where month(c2) > 1 group by c1 having max(month(c2))<6;
c1	c2
2	1991-02-01 08:08:08
4	2001-04-01 08:08:08
update t1 set c1 = month('2009-09-09') where month(c2) > 5;
select * from t1;
c1	c2
2	1991-02-01 08:08:08
4	2001-04-01 08:08:08
9	2011-06-01 08:08:08
9	2021-08-01 08:08:08
9	2021-08-01 08:08:08
delete from t1 where month(c2) > 2;
select * from t1;
c1	c2
2	1991-02-01 08:08:08
drop table t1;
#columns list
drop table if exists t1;
Warnings:
Note	1051	Unknown table 'db1.t1'
create table t1(c1 int,c2 datetime)
partition by list columns(c1)
(
partition p0 values in(month('1900-01-01'),month('1950-01-01'),month('2020-01-01'),month('2070-01-01')),
partition p1 values in(month('3030-12-31'),month('4030-12-31'),month('5030-12-31'),month('6030-12-31'))
);
ERROR HY000: Multiple definition of same constant in list partitioning
#view
drop table if exists test1;
Warnings:
Note	1051	Unknown table 'db1.test1'
create table test1(a1 int,a2 int,c1 datetime,c2 datetime);
insert into test1 values(1,month('1998-12-12 12:12:12'),convert_tz('1998-12-12 12:12:12','+00:00','+00:00'),convert_tz('2038-01-19 03:14:07','+00:00','+00:00'));
insert into test1 values(2,month('2002-02-02 10:00:00'),convert_tz('2002-02-02 10:00:00','+00:00','+00:00'),convert_tz('2034-02-22 00:50:20','+00:00','+00:00'));
insert into test1 values(3,month('2006-04-15 06:06:20'),convert_tz('2006-04-15 06:06:20','+00:00','+00:00'),convert_tz('2026-05-08 05:16:50','+00:00','+00:00'));
insert into test1 values(4,month('2012-12-12 12:12:12'),convert_tz('2012-12-12 12:12:12','+00:00','+00:00'),convert_tz('2030-08-16 14:05:50','+00:00','+00:00'));
insert into test1 values(4,month('2012-12-12 12:12:12'),convert_tz('2012-12-12 12:12:12','+00:00','+00:00'),convert_tz('2030-08-16 14:05:50','+00:00','+00:00'));
create view v_t1 as select * from test1;
select * from v_t1;
a1	a2	c1	c2
1	12	1998-12-12 12:12:12	2038-01-19 03:14:07
2	2	2002-02-02 10:00:00	2034-02-22 00:50:20
3	4	2006-04-15 06:06:20	2026-05-08 05:16:50
4	12	2012-12-12 12:12:12	2030-08-16 14:05:50
4	12	2012-12-12 12:12:12	2030-08-16 14:05:50
select * from v_t1 where month(c1) >=5;
a1	a2	c1	c2
1	12	1998-12-12 12:12:12	2038-01-19 03:14:07
4	12	2012-12-12 12:12:12	2030-08-16 14:05:50
4	12	2012-12-12 12:12:12	2030-08-16 14:05:50
select * from v_t1 where a2 = month(c1) and a2 >2 order by month(c2);
a1	a2	c1	c2
1	12	1998-12-12 12:12:12	2038-01-19 03:14:07
3	4	2006-04-15 06:06:20	2026-05-08 05:16:50
4	12	2012-12-12 12:12:12	2030-08-16 14:05:50
4	12	2012-12-12 12:12:12	2030-08-16 14:05:50
select * from v_t1 where a2 = month(c1) and  month(c1)>3 group by a2;
a1	a2	c1	c2
1	12	1998-12-12 12:12:12	2038-01-19 03:14:07
3	4	2006-04-15 06:06:20	2026-05-08 05:16:50
select * from v_t1 where a2 = month(c1) and  month(c1)>5 group by a2 having max(month(c2)>2);
a1	a2	c1	c2
1	12	1998-12-12 12:12:12	2038-01-19 03:14:07
select c1,case month(c1) when month(c1)> 3 then month('0101-01-01') else month('2000-10-10') end as a from v_t1;
c1	a
1998-12-12 12:12:12	10
2002-02-02 10:00:00	10
2006-04-15 06:06:20	10
2012-12-12 12:12:12	10
2012-12-12 12:12:12	10
select c1, case c2 when '11111111' then month('1111') else month('2020-02-02') end as a from v_t1;
c1	a
1998-12-12 12:12:12	2
2002-02-02 10:00:00	2
2006-04-15 06:06:20	2
2012-12-12 12:12:12	2
2012-12-12 12:12:12	2
select distinct month(c1),c2 from v_t1;
month(c1)	c2
12	2038-01-19 03:14:07
2	2034-02-22 00:50:20
4	2026-05-08 05:16:50
12	2030-08-16 14:05:50
update v_t1 set a1 = month(c1) where month(c1)>2;
delete from v_t1 where month(c2) > 1;
drop table test1;
drop view v_t1;
#生成列
drop table if exists t1;
Warnings:
Note	1051	Unknown table 'db1.t1'
CREATE TABLE t1(c1 int,c2 int GENERATED ALWAYS AS (month('2020-02-02')) VIRTUAL);
insert into t1(c1) values(1);
insert into t1(c1) values(2);
select * from t1;
c1	c2
1	2
2	2
drop table t1;
#算术运算符
#'+'
select month('1010-01-01'+'1019-09-09');
month('1010-01-01'+'1019-09-09')
NULL
Warnings:
Warning	1292	Truncated incorrect DOUBLE value: '1010-01-01'
Warning	1292	Truncated incorrect DOUBLE value: '1019-09-09'
Warning	5086	Not timestamp Can not cast varchar value to timestamp type
select month('1010-01-01'+'');
month('1010-01-01'+'')
10
Warnings:
Warning	1292	Truncated incorrect DOUBLE value: '1010-01-01'
select month('1010-01-01'+' ');
month('1010-01-01'+' ')
10
Warnings:
Warning	1292	Truncated incorrect DOUBLE value: '1010-01-01'
select month('1010-01-01'+0001);
month('1010-01-01'+0001)
10
Warnings:
Warning	1292	Truncated incorrect DOUBLE value: '1010-01-01'
select month('1010-01-01'+2001);
month('1010-01-01'+2001)
NULL
Warnings:
Warning	1292	Truncated incorrect DOUBLE value: '1010-01-01'
Warning	5086	Not timestamp Can not cast varchar value to timestamp type
select month('0001-01-01')+month('9999-12-31');
month('0001-01-01')+month('9999-12-31')
13
select month('2020-02-02')+month('2003-02-29');
month('2020-02-02')+month('2003-02-29')
NULL
Warnings:
Warning	5086	Not timestamp Can not cast varchar value to timestamp type
select month('2020-02-02')+month('aaa');
month('2020-02-02')+month('aaa')
NULL
Warnings:
Warning	5086	Not timestamp Can not cast varchar value to timestamp type
#'-'
select month('1010-01-01'-'1019-09-09');
month('1010-01-01'-'1019-09-09')
NULL
Warnings:
Warning	1292	Truncated incorrect DOUBLE value: '1010-01-01'
Warning	1292	Truncated incorrect DOUBLE value: '1019-09-09'
Warning	5086	Not timestamp Can not cast varchar value to timestamp type
select month('1010-01-01'-'');
month('1010-01-01'-'')
10
Warnings:
Warning	1292	Truncated incorrect DOUBLE value: '1010-01-01'
select month('1010-01-01'-' ');
month('1010-01-01'-' ')
10
Warnings:
Warning	1292	Truncated incorrect DOUBLE value: '1010-01-01'
select month('1010-01-01'-0001);
month('1010-01-01'-0001)
10
Warnings:
Warning	1292	Truncated incorrect DOUBLE value: '1010-01-01'
select month('1010-01-01'-2001);
month('1010-01-01'-2001)
NULL
Warnings:
Warning	1292	Truncated incorrect DOUBLE value: '1010-01-01'
Warning	5086	Not timestamp Can not cast varchar value to timestamp type
select month('0001-01-01')-month('9999-12-31');
month('0001-01-01')-month('9999-12-31')
-11
select month('2020-02-02')-month('2003-02-29');
month('2020-02-02')-month('2003-02-29')
NULL
Warnings:
Warning	5086	Not timestamp Can not cast varchar value to timestamp type
select month('2020-02-02')-month('aaa');
month('2020-02-02')-month('aaa')
NULL
Warnings:
Warning	5086	Not timestamp Can not cast varchar value to timestamp type
#'*'
select month('2020'*'2021');
month('2020'*'2021')
NULL
Warnings:
Warning	5086	Not timestamp Can not cast varchar value to timestamp type
select month(2020*2021);
month(2020*2021)
NULL
Warnings:
Warning	5086	Not timestamp Can not cast varchar value to timestamp type
select month(1234011*10);
month(1234011*10)
1
#'/'
select month(202001010/10);
month(202001010/10)
1
select month(2222222/2);
month(2222222/2)
11
select month('11110101'/2);
month('11110101'/2)
NULL
Warnings:
Warning	5086	Not timestamp Can not cast varchar value to timestamp type
#逻辑运算符
select month('2021-01-01') and month('22222222222');
month('2021-01-01') and month('22222222222')
NULL
Warnings:
Warning	5086	Not timestamp Can not cast varchar value to timestamp type
select month('1921-10-10') and month('1988-08-08');
month('1921-10-10') and month('1988-08-08')
1
select not month('1111-01-01') ;
not month('1111-01-01')
0
select not month(' ') ;
not month(' ')
NULL
Warnings:
Warning	5086	Not timestamp Can not cast varchar value to timestamp type
select not month('1111-01-0111') ;
not month('1111-01-0111')
NULL
Warnings:
Warning	5086	Not timestamp Can not cast varchar value to timestamp type
select month('2021-01-01') or month('22222222222');
month('2021-01-01') or month('22222222222')
1
select month('1921-10-10') or month('1988-08-08');
month('1921-10-10') or month('1988-08-08')
1
select month('1800-10-10') or month('1800-10-10');
month('1800-10-10') or month('1800-10-10')
1
select month('2121-12-12') or ('2');
month('2121-12-12') or ('2')
1
select month('2121-12-12') or 'aa';
month('2121-12-12') or 'aa'
1
#比较运算符
select month('2020-01-01') > month('2020-01-02');
month('2020-01-01') > month('2020-01-02')
0
select month('3800-01-01') > month('2050-01-02');
month('3800-01-01') > month('2050-01-02')
0
select month('0001-01-01') > month('0000-01-01');
month('0001-01-01') > month('0000-01-01')
0
select month('0001-01-01') > 'AA';
month('0001-01-01') > 'AA'
1
Warnings:
Warning	1292	Truncated incorrect DECIMAL value: 'AA'
select month('0001-01-01') >1;
month('0001-01-01') >1
0
select month('2020-01-01') < month('2020-01-02');
month('2020-01-01') < month('2020-01-02')
0
select month('3800-01-01') < month('2050-01-02');
month('3800-01-01') < month('2050-01-02')
0
select month('2020-01-01') < month('0000-01-01');
month('2020-01-01') < month('0000-01-01')
0
select month('1500-01-01') < 'Abc';
month('1500-01-01') < 'Abc'
0
Warnings:
Warning	1292	Truncated incorrect DECIMAL value: 'Abc'
select month('2000-01-01') < 1998;
month('2000-01-01') < 1998
1
select month('2020-01-01') >= month('2020-01-02');
month('2020-01-01') >= month('2020-01-02')
1
select month('3800-01-01 10:11:11') >= month('2050-01-01 08:08:08');
month('3800-01-01 10:11:11') >= month('2050-01-01 08:08:08')
1
select month('0001-01-01') >= month('0000-01-01');
month('0001-01-01') >= month('0000-01-01')
1
select month('0001-01-01') >= 'AA';
month('0001-01-01') >= 'AA'
1
Warnings:
Warning	1292	Truncated incorrect DECIMAL value: 'AA'
select month('0001-01-01') >=1;
month('0001-01-01') >=1
1
select month('20201111') <= month('2020-011-11');
month('20201111') <= month('2020-011-11')
1
select month(12341122) <= month(05711212);
month(12341122) <= month(05711212)
1
select month('1500-01-01') < 'CCC';
month('1500-01-01') < 'CCC'
0
Warnings:
Warning	1292	Truncated incorrect DECIMAL value: 'CCC'
select month('2499-12-31') < 2500;
month('2499-12-31') < 2500
1
#时间函数嵌套
#now
#localtime/localtimestamp
#date
select month(date('2003-12-31 01:02:03'));
month(date('2003-12-31 01:02:03'))
12
#curdate
#date_add/sub
select month(DATE_ADD('2018-05-01',INTERVAL 1 DAY));
month(DATE_ADD('2018-05-01',INTERVAL 1 DAY))
5
select month(DATE_SUB('2018-05-01',INTERVAL 1 month));
month(DATE_SUB('2018-05-01',INTERVAL 1 month))
4
select month(DATE_ADD('2020-12-31 23:59:59',INTERVAL 1 SECOND));
month(DATE_ADD('2020-12-31 23:59:59',INTERVAL 1 SECOND))
1
select month(DATE_ADD('2018-12-31 23:59:59',INTERVAL 1 DAY));
month(DATE_ADD('2018-12-31 23:59:59',INTERVAL 1 DAY))
1
select month(DATE_ADD('2100-12-31 23:59:59',INTERVAL '1:1' MINUTE_SECOND));
month(DATE_ADD('2100-12-31 23:59:59',INTERVAL '1:1' MINUTE_SECOND))
1
select month(DATE_SUB('2025-01-01 00:00:00',INTERVAL '1 1:1:1' DAY_SECOND));
month(DATE_SUB('2025-01-01 00:00:00',INTERVAL '1 1:1:1' DAY_SECOND))
12
select month(DATE_ADD('1900-01-01 00:00:00',INTERVAL '-1 10' DAY_HOUR));
month(DATE_ADD('1900-01-01 00:00:00',INTERVAL '-1 10' DAY_HOUR))
12
select month(DATE_SUB('1998-01-02', INTERVAL 31 DAY));
month(DATE_SUB('1998-01-02', INTERVAL 31 DAY))
12
select month(DATE_ADD('1992-12-31 23:59:59.000002',INTERVAL '1.999999' SECOND_MICROSECOND));
month(DATE_ADD('1992-12-31 23:59:59.000002',INTERVAL '1.999999' SECOND_MICROSECOND))
1
#date_format
select month(DATE_FORMAT('2009-10-04 22:23:00', '%W %M %Y'));
month(DATE_FORMAT('2009-10-04 22:23:00', '%W %M %Y'))
NULL
Warnings:
Warning	5086	Not timestamp Can not cast varchar value to timestamp type
select month(DATE_FORMAT('2007-10-04 22:23:00', '%H:%i:%s'));
month(DATE_FORMAT('2007-10-04 22:23:00', '%H:%i:%s'))
NULL
Warnings:
Warning	5086	Not timestamp Can not cast varchar value to timestamp type
select month(DATE_FORMAT('1900-10-04 22:23:00','%D %y %a %d %m %b %j'));
month(DATE_FORMAT('1900-10-04 22:23:00','%D %y %a %d %m %b %j'))
NULL
Warnings:
Warning	5086	Not timestamp Can not cast varchar value to timestamp type
select month(DATE_FORMAT('1997-10-04 22:23:00','%H %k %I %r %T %S %w'));
month(DATE_FORMAT('1997-10-04 22:23:00','%H %k %I %r %T %S %w'))
NULL
Warnings:
Warning	5086	Not timestamp Can not cast varchar value to timestamp type
select month(DATE_FORMAT('1999-01-01', '%X %V'));
month(DATE_FORMAT('1999-01-01', '%X %V'))
NULL
Warnings:
Warning	5086	Not timestamp Can not cast varchar value to timestamp type
select month(DATE_FORMAT('2006-06-00', '%d'));
month(DATE_FORMAT('2006-06-00', '%d'))
NULL
#form_days
select month(from_days(730669));
month(from_days(730669))
7
select month(from_days(999999));
month(from_days(999999))
11
select month(from_days(110000));
month(from_days(110000))
3
#from_unixtime
select month(FROM_UNIXTIME(1447430881));
month(FROM_UNIXTIME(1447430881))
11
select month(FROM_UNIXTIME(1447430881) + 0);
month(FROM_UNIXTIME(1447430881) + 0)
11
select month(FROM_UNIXTIME(1447430881,'%Y %D %M %h:%i:%s %x'));
month(FROM_UNIXTIME(1447430881,'%Y %D %M %h:%i:%s %x'))
NULL
Warnings:
Warning	5086	Not timestamp Can not cast varchar value to timestamp type
select month(DATE_FORMAT('2003-10-03',GET_FORMAT(DATE,'EUR')));
month(DATE_FORMAT('2003-10-03',GET_FORMAT(DATE,'EUR')))
10
select month(STR_TO_DATE('10.31.2003',GET_FORMAT(DATE,'USA')));
month(STR_TO_DATE('10.31.2003',GET_FORMAT(DATE,'USA')))
10
#last_day
select month(LAST_DAY('2003-02-05'));
month(LAST_DAY('2003-02-05'))
2
select month(LAST_DAY('2004-02-05'));
month(LAST_DAY('2004-02-05'))
2
select month(LAST_DAY('2004-01-01 01:01:01'));
month(LAST_DAY('2004-01-01 01:01:01'))
1
select month(LAST_DAY('2003-03-32'));
month(LAST_DAY('2003-03-32'))
NULL
#makedate
select month(MAKEDATE(2011,31));
month(MAKEDATE(2011,31))
1
select month(MAKEDATE(2011,32));
month(MAKEDATE(2011,32))
2
select month(MAKEDATE(2011,365));
month(MAKEDATE(2011,365))
12
select month(MAKEDATE(2014,365));
month(MAKEDATE(2014,365))
12
select month(MAKEDATE(2011,0));
month(MAKEDATE(2011,0))
NULL
select month(PERIOD_ADD(200801,2));
month(PERIOD_ADD(200801,2))
8
#str_to_date
select month(STR_TO_DATE('01,5,2013','%d,%m,%Y'));
month(STR_TO_DATE('01,5,2013','%d,%m,%Y'))
5
select month(STR_TO_DATE('May 1, 2013','%M %d,%Y'));
month(STR_TO_DATE('May 1, 2013','%M %d,%Y'))
5
select month(STR_TO_DATE('abc','abc'));
month(STR_TO_DATE('abc','abc'))
0
select month(STR_TO_DATE('9','%m'));
month(STR_TO_DATE('9','%m'))
NULL
Warnings:
Warning	1411	Incorrect datetime value: '9' for function str_to_date
select month(STR_TO_DATE('00/00/0000', '%m/%d/%Y'));
month(STR_TO_DATE('00/00/0000', '%m/%d/%Y'))
0
select month(STR_TO_DATE('04/31/2004', '%m/%d/%Y'));
month(STR_TO_DATE('04/31/2004', '%m/%d/%Y'))
NULL
Warnings:
Warning	1411	Incorrect datetime value: '04/31/2004' for function str_to_date
select month(STR_TO_DATE('200442 Monday', '%X%V %W'));
month(STR_TO_DATE('200442 Monday', '%X%V %W'))
10
#subdate/time
select month(DATE_SUB('2008-01-02', INTERVAL 31 DAY));
month(DATE_SUB('2008-01-02', INTERVAL 31 DAY))
12
select month(SUBDATE('2008-01-02', INTERVAL 31 DAY));
month(SUBDATE('2008-01-02', INTERVAL 31 DAY))
12
select month(SUBDATE('2008-01-02 12:00:00', 31));
month(SUBDATE('2008-01-02 12:00:00', 31))
12
select month(SUBTIME('2007-12-31 23:59:59.999999','1 1:1:1.000002'));
month(SUBTIME('2007-12-31 23:59:59.999999','1 1:1:1.000002'))
12
#timestamp
select month(TIMESTAMP('2003-12-31'));
month(TIMESTAMP('2003-12-31'))
12
select month(TIMESTAMP('2003-12-31 12:00:00','12:00:00'));
month(TIMESTAMP('2003-12-31 12:00:00','12:00:00'))
1
select month(TIMESTAMPADD(MINUTE,1,'2003-01-02'));
month(TIMESTAMPADD(MINUTE,1,'2003-01-02'))
1
select month(TIMESTAMPADD(WEEK,1,'2003-01-02'));
month(TIMESTAMPADD(WEEK,1,'2003-01-02'))
1
#utc_date/timestamp
select month(UTC_DATE());
month(UTC_DATE())
9
select month(UTC_DATE() + 0);
month(UTC_DATE() + 0)
9
select month(UTC_TIMESTAMP());
month(UTC_TIMESTAMP())
9
select month(UTC_TIMESTAMP() + 0);
month(UTC_TIMESTAMP() + 0)
9
select month(ADDTIME('2007-12-31 23:59:59.999999', '1 1:1:1.000002'));
month(ADDTIME('2007-12-31 23:59:59.999999', '1 1:1:1.000002'))
1
#convert_tz
select month(CONVERT_TZ('2004-01-01 12:00:00','+00:00','+10:00'));
month(CONVERT_TZ('2004-01-01 12:00:00','+00:00','+10:00'))
1
select month(CONVERT_TZ('2004-01-01 12:00:00','+00:00','+20:00'));
month(CONVERT_TZ('2004-01-01 12:00:00','+00:00','+20:00'))
NULL
#其他函数
#concat
select month(concat('2020-','12-12'));
month(concat('2020-','12-12'))
12
select month(concat('2021','1111'));
month(concat('2021','1111'))
11
select month(concat('19980715','aa'));
month(concat('19980715','aa'))
NULL
Warnings:
Warning	5086	Not timestamp Can not cast varchar value to timestamp type
#ceil
select month(ceil(2.0111111));
month(ceil(2.0111111))
NULL
Warnings:
Warning	5086	Not timestamp Can not cast varchar value to timestamp type
select month(ceil(20121212.123456789));
month(ceil(20121212.123456789))
12
select month(ceil(-20121212.123456789));
month(ceil(-20121212.123456789))
NULL
Warnings:
Warning	5086	Not timestamp Can not cast varchar value to timestamp type
#cast
select month(cast('2021-10-08 12:12:00' as int));
ERROR 42000: You have an error in your SQL syntax; check the manual that corresponds to your OceanBase version for the right syntax to use near 'int))' at line 1
select month(cast('2021-10-08 12:12:00' as double));
month(cast('2021-10-08 12:12:00' as double))
NULL
Warnings:
Warning	1292	Truncated incorrect DOUBLE value: '2021-10-08 12:12:00'
Warning	5086	Not timestamp Can not cast varchar value to timestamp type
#MYSQL报错，OB执行成功
select month(cast('2021-10-08 14:14:00' as float));
month(cast('2021-10-08 14:14:00' as float))
NULL
Warnings:
Warning	1292	Truncated incorrect DOUBLE value: '2021-10-08 14:14:00'
Warning	5086	Not timestamp Can not cast varchar value to timestamp type
select month(cast('2021-10-08 14:14:00' as char(100)));
month(cast('2021-10-08 14:14:00' as char(100)))
10
select month(cast('2021-10-08 14:14:00' as varchar(100)));
ERROR 42000: You have an error in your SQL syntax; check the manual that corresponds to your OceanBase version for the right syntax to use near 'varchar(100)))' at line 1
select month(cast('2021-10-08 14:14:00' as date));
month(cast('2021-10-08 14:14:00' as date))
10
select month(cast('2021-10-08 14:14:00' as time));
month(cast('2021-10-08 14:14:00' as time))
9
select month(cast('2021-10-08 14:14:00' as datetime));
month(cast('2021-10-08 14:14:00' as datetime))
10
select month(cast('2021-10-08 14:14:00' as timestamp));
ERROR 42000: You have an error in your SQL syntax; check the manual that corresponds to your OceanBase version for the right syntax to use near 'timestamp))' at line 1
select month(cast('2021-10-08 14:14:00' as decimal(15,5)));
month(cast('2021-10-08 14:14:00' as decimal(15,5)))
NULL
Warnings:
Warning	1292	Truncated incorrect DECIMAL value: '2021-10-08 14:14:00'
Warning	5086	Not timestamp Can not cast varchar value to timestamp type
#length
select month(length(11111111));
month(length(11111111))
NULL
Warnings:
Warning	5086	Not timestamp Can not cast varchar value to timestamp type
#substr
select month(substr('00000002121-01-01',5));
month(substr('00000002121-01-01',5))
1
select month(substr('012300021212' from 8));
month(substr('012300021212' from 8))
NULL
Warnings:
Warning	5086	Not timestamp Can not cast varchar value to timestamp type
select month(substr('012300021212' from 7));
month(substr('012300021212' from 7))
12
select month(substr('1111121211121212121212121',5,13));
month(substr('1111121211121212121212121',5,13))
12
select month(substr('212312313-030303',2));
month(substr('212312313-030303',2))
NULL
Warnings:
Warning	5086	Not timestamp Can not cast varchar value to timestamp type
#reverse
select month(reverse('20120229'));
month(reverse('20120229'))
NULL
Warnings:
Warning	5086	Not timestamp Can not cast varchar value to timestamp type
select month(reverse('92202102'));
month(reverse('92202102'))
2
select month(reverse(cast('2021-10-08 14:14:00' as datetime)));
month(reverse(cast('2021-10-08 14:14:00' as datetime)))
NULL
Warnings:
Warning	5086	Not timestamp Can not cast varchar value to timestamp type
#聚合函数
drop table if exists test1;
Warnings:
Note	1051	Unknown table 'db1.test1'
create table test1(a1 int,a2 year,c1 datetime,c2 datetime);
insert into test1 values(1,'1998','1998-12-12 12:12:12','2038-01-19 03:14:07');
insert into test1 values(2,'2002','2002-02-02 10:00:00','2034-02-22 00:50:20');
insert into test1 values(3,'2006','2006-04-15 06:06:20','2026-05-08 05:16:50');
insert into test1 values(4,'2012','2012-12-12 12:12:12','2030-08-16 14:05:50');
select * from test1;
a1	a2	c1	c2
1	1998	1998-12-12 12:12:12	2038-01-19 03:14:07
2	2002	2002-02-02 10:00:00	2034-02-22 00:50:20
3	2006	2006-04-15 06:06:20	2026-05-08 05:16:50
4	2012	2012-12-12 12:12:12	2030-08-16 14:05:50
#count
select count(month(c1)) from test1;
count(month(c1))
4
select month(count(c1)) from test1;
month(count(c1))
NULL
Warnings:
Warning	5086	Not timestamp Can not cast varchar value to timestamp type
select count(month(c2)) from test1;
count(month(c2))
4
select month(count(c2)) from test1;
month(count(c2))
NULL
Warnings:
Warning	5086	Not timestamp Can not cast varchar value to timestamp type
#max
select max(month(c1)) from test1;
max(month(c1))
12
select month(max(c1)) from test1;
month(max(c1))
12
select max(month(c2)) from test1;
max(month(c2))
8
select month(max(c2)) from test1;
month(max(c2))
1
#min
select min(month(c1)) from test1;
min(month(c1))
2
select month(min(c1)) from test1;
month(min(c1))
12
select max(month(c2)) from test1;
max(month(c2))
8
select month(max(c2)) from test1;
month(max(c2))
1
#avg
select avg(month(c1)) from test1;
avg(month(c1))
7.5000
select month(avg(c1)) from test1;
month(avg(c1))
NULL
Warnings:
Warning	5086	Not timestamp Can not cast varchar value to timestamp type
select max(month(c2)) from test1;
max(month(c2))
8
select month(max(c2)) from test1;
month(max(c2))
1
#sum
select sum(month(c1)) from test1;
sum(month(c1))
30
select month(sum(c1)) from test1;
month(sum(c1))
NULL
Warnings:
Warning	5086	Not timestamp Can not cast varchar value to timestamp type
select max(month(c2)) from test1;
max(month(c2))
8
select month(max(c2)) from test1;
month(max(c2))
1
drop database db1;
