drop database  IF EXISTS  db1;
create database db1;
use db1;
SET wait_timeout=30000000;
SET ob_trx_timeout = 30000000;
SET ob_query_timeout = 30000000;
##参数验证
select monthname();
ERROR 42000: Incorrect parameter count in the call to native function 'monthname'
select monthname(" ");
monthname(" ")
NULL
Warnings:
Warning	5086	Not timestamp Can not cast varchar value to timestamp type
select monthname("null");
monthname("null")
NULL
Warnings:
Warning	5086	Not timestamp Can not cast varchar value to timestamp type
select monthname(0);
monthname(0)
NULL
select monthname("0000-00-00");
monthname("0000-00-00")
NULL
##ob和MySQL5.7结果不一致;
select monthname('1969-12-31 23:59:59.9999999');
monthname('1969-12-31 23:59:59.9999999')
January
##ob和MySQL5.7结果不一致;
select monthname('0000-02-29');
monthname('0000-02-29')
NULL
Warnings:
Warning	5086	Not timestamp Can not cast varchar value to timestamp type
select monthname(current_time(),current_timestamp());
ERROR 42000: Incorrect parameter count in the call to native function 'monthname'
select monthname('monday'), monthname('Tuesday'), monthname('Wednesday'),monthname('Sunday'),monthname('Thursday'),monthname('Friday'),monthname('Saturday');
monthname('monday')	monthname('Tuesday')	monthname('Wednesday')	monthname('Sunday')	monthname('Thursday')	monthname('Friday')	monthname('Saturday')
NULL	NULL	NULL	NULL	NULL	NULL	NULL
Warnings:
Warning	5086	Not timestamp Can not cast varchar value to timestamp type
Warning	5086	Not timestamp Can not cast varchar value to timestamp type
Warning	5086	Not timestamp Can not cast varchar value to timestamp type
Warning	5086	Not timestamp Can not cast varchar value to timestamp type
Warning	5086	Not timestamp Can not cast varchar value to timestamp type
Warning	5086	Not timestamp Can not cast varchar value to timestamp type
Warning	5086	Not timestamp Can not cast varchar value to timestamp type
select monthname('0.01.01');
monthname('0.01.01')
January
select monthname('9999.12.31');
monthname('9999.12.31')
December
select monthname(+"2022-09-05");
monthname(+"2022-09-05")
September
select monthname(-"2022-09-05");
monthname(-"2022-09-05")
NULL
Warnings:
Warning	1292	Truncated incorrect DOUBLE value: '2022-09-05'
Warning	5086	Not timestamp Can not cast varchar value to timestamp type
select monthname('a');
monthname('a')
NULL
Warnings:
Warning	5086	Not timestamp Can not cast varchar value to timestamp type
select monthname('@@@');
monthname('@@@')
NULL
Warnings:
Warning	5086	Not timestamp Can not cast varchar value to timestamp type
select monthname('#');
monthname('#')
NULL
Warnings:
Warning	5086	Not timestamp Can not cast varchar value to timestamp type
select monthname('""');
monthname('""')
NULL
Warnings:
Warning	5086	Not timestamp Can not cast varchar value to timestamp type
select monthname('_');
monthname('_')
NULL
Warnings:
Warning	5086	Not timestamp Can not cast varchar value to timestamp type
select monthname('false');
monthname('false')
NULL
Warnings:
Warning	5086	Not timestamp Can not cast varchar value to timestamp type
select monthname('true');
monthname('true')
NULL
Warnings:
Warning	5086	Not timestamp Can not cast varchar value to timestamp type
select monthname('2022-09-05')+4;
monthname('2022-09-05')+4
4
Warnings:
Warning	1292	Truncated incorrect DOUBLE value: 'September'
select monthname('2022-09-05')+false;
monthname('2022-09-05')+false
0
Warnings:
Warning	1292	Truncated incorrect DOUBLE value: 'September'
select monthname('2022-09-05')+true;
monthname('2022-09-05')+true
1
Warnings:
Warning	1292	Truncated incorrect DOUBLE value: 'September'
select monthname('星期一');
monthname('星期一')
NULL
Warnings:
Warning	5086	Not timestamp Can not cast varchar value to timestamp type
select monthname('星期一1999-12-31');
monthname('星期一1999-12-31')
NULL
Warnings:
Warning	5086	Not timestamp Can not cast varchar value to timestamp type
select monthname('星期一@#');
monthname('星期一@#')
NULL
Warnings:
Warning	5086	Not timestamp Can not cast varchar value to timestamp type
select monthname('1999-12-31星期一');
monthname('1999-12-31星期一')
December
select monthname(1.175494351E-38) From dual;
monthname(1.175494351E-38)
NULL
select monthname('-1970-12-31');
monthname('-1970-12-31')
NULL
Warnings:
Warning	5086	Not timestamp Can not cast varchar value to timestamp type
select monthname('にににににににに');
monthname('にににににににに')
NULL
Warnings:
Warning	5086	Not timestamp Can not cast varchar value to timestamp type
select monthname('천구백구십칠년 일월 오일');
monthname('천구백구십칠년 일월 오일')
NULL
Warnings:
Warning	5086	Not timestamp Can not cast varchar value to timestamp type
select monthname('一九九九零二二六');
monthname('一九九九零二二六')
NULL
Warnings:
Warning	5086	Not timestamp Can not cast varchar value to timestamp type
select monthname('壹玖玖捌零伍贰贰');
monthname('壹玖玖捌零伍贰贰')
NULL
Warnings:
Warning	5086	Not timestamp Can not cast varchar value to timestamp type
select monthname('2022-09-07')<'monday';
monthname('2022-09-07')<'monday'
0
select monthname('2022-09-07')>'monday';
monthname('2022-09-07')>'monday'
1
select monthname('2022-09-07') != 'Wednesday';
monthname('2022-09-07') != 'Wednesday'
1
select monthname('2022-09-07') >= 'Wednesday';
monthname('2022-09-07') >= 'Wednesday'
0
select monthname('2022-09-07') <= 'Wednesday';
monthname('2022-09-07') <= 'Wednesday'
1
select monthname('2022-09-07') = 'Wednesday';
monthname('2022-09-07') = 'Wednesday'
0
##ob和MySQL5.7结果不一致;
select monthname('1999-12-31星期1999-12-30');
monthname('1999-12-31星期1999-12-30')
NULL
Warnings:
Warning	5086	Not timestamp Can not cast varchar value to timestamp type
##ob与mysql表现形式不一致
select monthname('1995.02.28')+2000000000000000;
monthname('1995.02.28')+2000000000000000
2e15
Warnings:
Warning	1292	Truncated incorrect DOUBLE value: 'February'
select monthname('9999-12-31 23:59:59.999999')+0;
monthname('9999-12-31 23:59:59.999999')+0
0
Warnings:
Warning	1292	Truncated incorrect DOUBLE value: 'December'
select monthname('9999-12-31 23:59:59.999999')-0;
monthname('9999-12-31 23:59:59.999999')-0
0
Warnings:
Warning	1292	Truncated incorrect DOUBLE value: 'December'
select monthname('9999-12-31 23:59:59.999999')*1;
monthname('9999-12-31 23:59:59.999999')*1
0
Warnings:
Warning	1292	Truncated incorrect DOUBLE value: 'December'
select monthname('9999-12-31 23:59:59.999999')/1;
monthname('9999-12-31 23:59:59.999999')/1
0
Warnings:
Warning	1292	Truncated incorrect DOUBLE value: 'December'
##MYSQL5.7报错1525,OB显示为null
select monthname(date '0000-00-00');
monthname(date '0000-00-00')
NULL
select monthname(date '9999-12-31');
monthname(date '9999-12-31')
December
OB会显示系统时间,MySQL5.7直接报错;
表字符集测试
set names binary;
select monthname('');
monthname('')
NULL
Warnings:
Warning	5086	Not timestamp Can not cast varchar value to timestamp type
select monthname('0');
monthname('0')
NULL
Warnings:
Warning	5086	Not timestamp Can not cast varchar value to timestamp type
select monthname(0);
monthname(0)
NULL
select monthname('+1');
monthname('+1')
NULL
Warnings:
Warning	5086	Not timestamp Can not cast varchar value to timestamp type
select monthname('-1');
monthname('-1')
NULL
Warnings:
Warning	5086	Not timestamp Can not cast varchar value to timestamp type
select monthname('-false');
monthname('-false')
NULL
Warnings:
Warning	5086	Not timestamp Can not cast varchar value to timestamp type
select monthname('-true');
monthname('-true')
NULL
Warnings:
Warning	5086	Not timestamp Can not cast varchar value to timestamp type
select monthname('null');
monthname('null')
NULL
Warnings:
Warning	5086	Not timestamp Can not cast varchar value to timestamp type
select monthname('1970-01-01');
monthname('1970-01-01')
January
select monthname('9999-12-31');
monthname('9999-12-31')
December
select monthname('1000-01-01');
monthname('1000-01-01')
January
CREATE TABLE t1(c1 TIME ,
c2 date ,
c3 DATETIME ,
c4 TIMESTAMP DEFAULT '2000-01-01 00:00:00',
c5 YEAR ) default charset=binary;
INSERT INTO t1 VALUES('20:12:12','2000-12-12','2000-01-01 01:01:01','2001-01-01 23:59:59.9999999','2000'),
('21:12:13','2001-12-22','2001-01-02 13:01:01','2001-11-02 00:00:01.999999','2001'),
('22:12:14','2002-12-02','2002-01-03 14:01:01','2002-12-03 02:01:01.299999','2002'),
('23:12:15','2003-12-11','2003-01-04 15:01:01','2002-11-04 03:01:01.399999','2003'),
('20:22:16','2004-12-12','2004-01-05 16:01:01','2002-02-05 05:01:01.499999','2004'),
('20:32:17','2021-12-13','2010-01-06 21:01:01','2003-03-06 04:01:01.599999','2005'),
('20:12:18','2005-12-12','2000-01-07 01:01:01','2001-01-07 12:01:01.699999','2006'),
('11:12:19','2006-12-22','2011-01-08 13:01:01','2001-11-08 11:01:01.799999','2007'),
('02:12:20','2007-12-02','2012-01-09 14:01:01','2002-12-09 02:01:01.899999','2008'),
('03:12:21','2008-12-11','2013-01-10 15:01:01','2002-11-10 03:01:01.999999','2009'),
('00:22:22','2009-12-12','2010-01-11 16:01:01','2002-02-11 05:01:01.000001','2010'),
('00:32:23','2001-12-13','2010-01-12 21:01:01','2003-03-31 04:59:59.000000','2011');
select monthname(c2) from t1 where c2 ='2008-12-11';
monthname(c2)
December
select monthname(c3) from t1 where c3 ='2010-01-12 21:01:01';
monthname(c3)
January
select monthname(c4) from t1 where c4 ='2001-01-01 23:59:59.9999999';
monthname(c4)
January
select monthname(c5) from t1 where c5 ='2011';
monthname(c5)
NULL
Warnings:
Warning	5086	Not timestamp Can not cast varchar value to timestamp type
drop table t1;
SET NAMES 'utf8mb4';
select monthname('');
monthname('')
NULL
Warnings:
Warning	5086	Not timestamp Can not cast varchar value to timestamp type
select monthname('0');
monthname('0')
NULL
Warnings:
Warning	5086	Not timestamp Can not cast varchar value to timestamp type
select monthname(0);
monthname(0)
NULL
select monthname('+1');
monthname('+1')
NULL
Warnings:
Warning	5086	Not timestamp Can not cast varchar value to timestamp type
select monthname('-1');
monthname('-1')
NULL
Warnings:
Warning	5086	Not timestamp Can not cast varchar value to timestamp type
select monthname('-false');
monthname('-false')
NULL
Warnings:
Warning	5086	Not timestamp Can not cast varchar value to timestamp type
select monthname('-true');
monthname('-true')
NULL
Warnings:
Warning	5086	Not timestamp Can not cast varchar value to timestamp type
select monthname('null');
monthname('null')
NULL
Warnings:
Warning	5086	Not timestamp Can not cast varchar value to timestamp type
select monthname('1970-01-01');
monthname('1970-01-01')
January
select monthname('9999-12-31');
monthname('9999-12-31')
December
select monthname('1000-01-01');
monthname('1000-01-01')
January
CREATE TABLE t1(c1 TIME ,
c2 date ,
c3 DATETIME ,
c4 TIMESTAMP DEFAULT '2000-01-01 00:00:00',
c5 YEAR ) default charset=utf8mb4;
INSERT INTO t1 VALUES('20:12:12','2000-12-12','2000-01-01 01:01:01','2001-01-01 23:59:59.9999999','2000'),
('21:12:13','2001-12-22','2001-01-02 13:01:01','2001-11-02 00:00:01.999999','2001'),
('22:12:14','2002-12-02','2002-01-03 14:01:01','2002-12-03 02:01:01.299999','2002'),
('23:12:15','2003-12-11','2003-01-04 15:01:01','2002-11-04 03:01:01.399999','2003'),
('20:22:16','2004-12-12','2004-01-05 16:01:01','2002-02-05 05:01:01.499999','2004'),
('20:32:17','2021-12-13','2010-01-06 21:01:01','2003-03-06 04:01:01.599999','2005'),
('20:12:18','2005-12-12','2000-01-07 01:01:01','2001-01-07 12:01:01.699999','2006'),
('11:12:19','2006-12-22','2011-01-08 13:01:01','2001-11-08 11:01:01.799999','2007'),
('02:12:20','2007-12-02','2012-01-09 14:01:01','2002-12-09 02:01:01.899999','2008'),
('03:12:21','2008-12-11','2013-01-10 15:01:01','2002-11-10 03:01:01.999999','2009'),
('00:22:22','2009-12-12','2010-01-11 16:01:01','2002-02-11 05:01:01.000001','2010'),
('00:32:23','2001-12-13','2010-01-12 21:01:01','2003-03-31 04:59:59.000000','2011');
select monthname(c2) from t1 where c2 ='2008-12-11';
monthname(c2)
December
select monthname(c3) from t1 where c3 ='2010-01-12 21:01:01';
monthname(c3)
January
select monthname(c4) from t1 where c4 ='2001-01-01 23:59:59.9999999';
monthname(c4)
January
select monthname(c5) from t1 where c5 ='2011';
monthname(c5)
NULL
Warnings:
Warning	5086	Not timestamp Can not cast varchar value to timestamp type
drop table t1;
SET NAMES 'gbk';
select monthname('');
monthname('')
NULL
Warnings:
Warning	5086	Not timestamp Can not cast varchar value to timestamp type
select monthname('0');
monthname('0')
NULL
Warnings:
Warning	5086	Not timestamp Can not cast varchar value to timestamp type
select monthname(0);
monthname(0)
NULL
select monthname('+1');
monthname('+1')
NULL
Warnings:
Warning	5086	Not timestamp Can not cast varchar value to timestamp type
select monthname('-1');
monthname('-1')
NULL
Warnings:
Warning	5086	Not timestamp Can not cast varchar value to timestamp type
select monthname('-false');
monthname('-false')
NULL
Warnings:
Warning	5086	Not timestamp Can not cast varchar value to timestamp type
select monthname('-true');
monthname('-true')
NULL
Warnings:
Warning	5086	Not timestamp Can not cast varchar value to timestamp type
select monthname('null');
monthname('null')
NULL
Warnings:
Warning	5086	Not timestamp Can not cast varchar value to timestamp type
select monthname('1970-01-01');
monthname('1970-01-01')
January
select monthname('9999-12-31');
monthname('9999-12-31')
December
select monthname('1000-01-01');
monthname('1000-01-01')
January
CREATE TABLE t1(c1 TIME ,
c2 date ,
c3 DATETIME ,
c4 TIMESTAMP DEFAULT '2000-01-01 00:00:00',
c5 YEAR ) default charset=gbk;
INSERT INTO t1 VALUES('20:12:12','2000-12-12','2000-01-01 01:01:01','2001-01-01 23:59:59.9999999','2000'),
('21:12:13','2001-12-22','2001-01-02 13:01:01','2001-11-02 00:00:01.999999','2001'),
('22:12:14','2002-12-02','2002-01-03 14:01:01','2002-12-03 02:01:01.299999','2002'),
('23:12:15','2003-12-11','2003-01-04 15:01:01','2002-11-04 03:01:01.399999','2003'),
('20:22:16','2004-12-12','2004-01-05 16:01:01','2002-02-05 05:01:01.499999','2004'),
('20:32:17','2021-12-13','2010-01-06 21:01:01','2003-03-06 04:01:01.599999','2005'),
('20:12:18','2005-12-12','2000-01-07 01:01:01','2001-01-07 12:01:01.699999','2006'),
('11:12:19','2006-12-22','2011-01-08 13:01:01','2001-11-08 11:01:01.799999','2007'),
('02:12:20','2007-12-02','2012-01-09 14:01:01','2002-12-09 02:01:01.899999','2008'),
('03:12:21','2008-12-11','2013-01-10 15:01:01','2002-11-10 03:01:01.999999','2009'),
('00:22:22','2009-12-12','2010-01-11 16:01:01','2002-02-11 05:01:01.000001','2010'),
('00:32:23','2001-12-13','2010-01-12 21:01:01','2003-03-31 04:59:59.000000','2011');
select monthname(c2) from t1 where c2 ='2008-12-11';
monthname(c2)
December
select monthname(c3) from t1 where c3 ='2010-01-12 21:01:01';
monthname(c3)
January
select monthname(c4) from t1 where c4 ='2001-01-01 23:59:59.9999999';
monthname(c4)
January
select monthname(c5) from t1 where c5 ='2011';
monthname(c5)
NULL
Warnings:
Warning	5086	Not timestamp Can not cast varchar value to timestamp type
drop table t1;
SET NAMES 'gb18030';
select monthname('');
monthname('')
NULL
Warnings:
Warning	5086	Not timestamp Can not cast varchar value to timestamp type
select monthname('0');
monthname('0')
NULL
Warnings:
Warning	5086	Not timestamp Can not cast varchar value to timestamp type
select monthname(0);
monthname(0)
NULL
select monthname('+1');
monthname('+1')
NULL
Warnings:
Warning	5086	Not timestamp Can not cast varchar value to timestamp type
select monthname('-1');
monthname('-1')
NULL
Warnings:
Warning	5086	Not timestamp Can not cast varchar value to timestamp type
select monthname('-false');
monthname('-false')
NULL
Warnings:
Warning	5086	Not timestamp Can not cast varchar value to timestamp type
select monthname('-true');
monthname('-true')
NULL
Warnings:
Warning	5086	Not timestamp Can not cast varchar value to timestamp type
select monthname('null');
monthname('null')
NULL
Warnings:
Warning	5086	Not timestamp Can not cast varchar value to timestamp type
select monthname('1970-01-01');
monthname('1970-01-01')
January
select monthname('9999-12-31');
monthname('9999-12-31')
December
select monthname('1000-01-01');
monthname('1000-01-01')
January
CREATE TABLE t1(c1 TIME ,
c2 date ,
c3 DATETIME ,
c4 TIMESTAMP DEFAULT '2000-01-01 00:00:00',
c5 YEAR ) default charset=gb18030;
INSERT INTO t1 VALUES('20:12:12','2000-12-12','2000-01-01 01:01:01','2001-01-01 23:59:59.9999999','2000'),
('21:12:13','2001-12-22','2001-01-02 13:01:01','2001-11-02 00:00:01.999999','2001'),
('22:12:14','2002-12-02','2002-01-03 14:01:01','2002-12-03 02:01:01.299999','2002'),
('23:12:15','2003-12-11','2003-01-04 15:01:01','2002-11-04 03:01:01.399999','2003'),
('20:22:16','2004-12-12','2004-01-05 16:01:01','2002-02-05 05:01:01.499999','2004'),
('20:32:17','2021-12-13','2010-01-06 21:01:01','2003-03-06 04:01:01.599999','2005'),
('20:12:18','2005-12-12','2000-01-07 01:01:01','2001-01-07 12:01:01.699999','2006'),
('11:12:19','2006-12-22','2011-01-08 13:01:01','2001-11-08 11:01:01.799999','2007'),
('02:12:20','2007-12-02','2012-01-09 14:01:01','2002-12-09 02:01:01.899999','2008'),
('03:12:21','2008-12-11','2013-01-10 15:01:01','2002-11-10 03:01:01.999999','2009'),
('00:22:22','2009-12-12','2010-01-11 16:01:01','2002-02-11 05:01:01.000001','2010'),
('00:32:23','2001-12-13','2010-01-12 21:01:01','2003-03-31 04:59:59.000000','2011');
select monthname(c2) from t1 where c2 ='2008-12-11';
monthname(c2)
December
select monthname(c3) from t1 where c3 ='2010-01-12 21:01:01';
monthname(c3)
January
select monthname(c4) from t1 where c4 ='2001-01-01 23:59:59.9999999';
monthname(c4)
January
select monthname(c5) from t1 where c5 ='2011';
monthname(c5)
NULL
Warnings:
Warning	5086	Not timestamp Can not cast varchar value to timestamp type
drop table t1;
##数据类型验证
##TINYINT,SMALLINT,MEDIUMINT,int,BIGINT,FLOAT,DOUBLE,DECIMAL
create table t1(c1 TINYINT,c2 SMALLINT,c3 MEDIUMINT,c4 int,c5 BIGINT,c6 FLOAT,c7 DOUBLE,c8 DECIMAL(5,2));
insert into t1 values(22,621,0721,0621,1221,0621.221,0621.01,0621.02);
insert into t1 values(23,622,0722,0622,1222,0622.221,0622.01,0622.02);
insert into t1 values(24,null,null,null,null,null,null,null);
select * from t1 ORDER by c1 asc;
c1	c2	c3	c4	c5	c6	c7	c8
22	621	721	621	1221	621.221	621.01	621.02
23	622	722	622	1222	622.221	622.01	622.02
24	NULL	NULL	NULL	NULL	NULL	NULL	NULL
select * from t1 ORDER by monthname(c1) asc;
c1	c2	c3	c4	c5	c6	c7	c8
22	621	721	621	1221	621.221	621.01	621.02
23	622	722	622	1222	622.221	622.01	622.02
24	NULL	NULL	NULL	NULL	NULL	NULL	NULL
Warnings:
Warning	5086	Not timestamp Can not cast varchar value to timestamp type
Warning	5086	Not timestamp Can not cast varchar value to timestamp type
Warning	5086	Not timestamp Can not cast varchar value to timestamp type
select monthname(c2+1) from t1;
monthname(c2+1)
June
June
NULL
select monthname(c2-1) from t1;
monthname(c2-1)
June
June
NULL
select monthname(c2*1) from t1;
monthname(c2*1)
June
June
NULL
select monthname(c2/1) from t1;
monthname(c2/1)
June
June
NULL
select c1,monthname(c1) from t1;
c1	monthname(c1)
22	NULL
23	NULL
24	NULL
Warnings:
Warning	5086	Not timestamp Can not cast varchar value to timestamp type
Warning	5086	Not timestamp Can not cast varchar value to timestamp type
Warning	5086	Not timestamp Can not cast varchar value to timestamp type
select c2,monthname(c2) from t1;
c2	monthname(c2)
621	June
622	June
NULL	NULL
select c3,monthname(c3) from t1;
c3	monthname(c3)
721	July
722	July
NULL	NULL
select c4,monthname(c4) from t1;
c4	monthname(c4)
621	June
622	June
NULL	NULL
select c5,monthname(c5) from t1;
c5	monthname(c5)
1221	December
1222	December
NULL	NULL
select c6,monthname(c6) from t1;
c6	monthname(c6)
621.221	June
622.221	June
NULL	NULL
select c7,monthname(c7) from t1;
c7	monthname(c7)
621.01	June
622.01	June
NULL	NULL
select c8,monthname(c8) from t1;
c8	monthname(c8)
621.02	June
622.02	June
NULL	NULL
OB断开连接 待修复;
drop table t1;
##CHAR,VARCHAR,TINYBLOB,TINYTEXT,BLOB,TEXT,MEDIUMBLOB,MEDIUMTEXT,LONGBLOB,LONGTEXT
create table t1(c1 CHAR(20),c2 VARCHAR(50),c3 TINYBLOB,c4 TINYTEXT,c5 BLOB,c6 TEXT,c7 MEDIUMBLOB,c8 MEDIUMTEXT,c9 LONGBLOB,c10 LONGTEXT);
insert into t1 values('5好好2','','疯为来','#啊啊#','大懂','18','2019-01-12','21:00:00','2018-11-13 17:16:25','2015-07-05 20:18:18');
insert into t1 values('上的','','撒法发','￥@#','发送方','59','2019-05-23','11:29:29','2012-12-19 01:59:03','2008-05-13 10:25:19');
insert into t1 values('房贷首付','','阿斯蒂芬','#@#@','咳咳咳','','2020-01-07','13:59:12','2020-01-07 13:59:59','2020-09-23 11:22:33');
insert into t1 values('ADK','','反馈卡','','覆盖掉开发','','1995-01-07','23:59:59','1995-12-07 18:59:59','1998-09-23 11:22:33');
insert into t1 values('大苏','','sss','99mmhn','222手动','so','2010-05-09','07:59:19','2011-11-01 23:59:59','2015-07-21 10:11:23');
select c1,monthname(c1) from t1;
c1	monthname(c1)
5好好2	NULL
上的	NULL
房贷首付	NULL
ADK	NULL
大苏	NULL
Warnings:
Warning	5086	Not timestamp Can not cast varchar value to timestamp type
Warning	5086	Not timestamp Can not cast varchar value to timestamp type
Warning	5086	Not timestamp Can not cast varchar value to timestamp type
Warning	5086	Not timestamp Can not cast varchar value to timestamp type
Warning	5086	Not timestamp Can not cast varchar value to timestamp type
select c2,monthname(c2) from t1;
c2	monthname(c2)
	NULL
	NULL
	NULL
	NULL
	NULL
Warnings:
Warning	5086	Not timestamp Can not cast varchar value to timestamp type
Warning	5086	Not timestamp Can not cast varchar value to timestamp type
Warning	5086	Not timestamp Can not cast varchar value to timestamp type
Warning	5086	Not timestamp Can not cast varchar value to timestamp type
Warning	5086	Not timestamp Can not cast varchar value to timestamp type
select c3,monthname(c3) from t1;
c3	monthname(c3)
疯为来	NULL
撒法发	NULL
阿斯蒂芬	NULL
反馈卡	NULL
sss	NULL
Warnings:
Warning	5086	Not timestamp Can not cast varchar value to timestamp type
Warning	5086	Not timestamp Can not cast varchar value to timestamp type
Warning	5086	Not timestamp Can not cast varchar value to timestamp type
Warning	5086	Not timestamp Can not cast varchar value to timestamp type
Warning	5086	Not timestamp Can not cast varchar value to timestamp type
select c4,monthname(c4) from t1;
c4	monthname(c4)
#啊啊#	NULL
￥@#	NULL
#@#@	NULL
	NULL
99mmhn	NULL
Warnings:
Warning	5086	Not timestamp Can not cast varchar value to timestamp type
Warning	5086	Not timestamp Can not cast varchar value to timestamp type
Warning	5086	Not timestamp Can not cast varchar value to timestamp type
Warning	5086	Not timestamp Can not cast varchar value to timestamp type
Warning	5086	Not timestamp Can not cast varchar value to timestamp type
select c5,monthname(c5) from t1;
c5	monthname(c5)
大懂	NULL
发送方	NULL
咳咳咳	NULL
覆盖掉开发	NULL
222手动	NULL
Warnings:
Warning	5086	Not timestamp Can not cast varchar value to timestamp type
Warning	5086	Not timestamp Can not cast varchar value to timestamp type
Warning	5086	Not timestamp Can not cast varchar value to timestamp type
Warning	5086	Not timestamp Can not cast varchar value to timestamp type
Warning	5086	Not timestamp Can not cast varchar value to timestamp type
select c6,monthname(c6) from t1;
c6	monthname(c6)
18	NULL
59	NULL
	NULL
	NULL
so	NULL
Warnings:
Warning	5086	Not timestamp Can not cast varchar value to timestamp type
Warning	5086	Not timestamp Can not cast varchar value to timestamp type
Warning	5086	Not timestamp Can not cast varchar value to timestamp type
Warning	5086	Not timestamp Can not cast varchar value to timestamp type
Warning	5086	Not timestamp Can not cast varchar value to timestamp type
select c7,monthname(c7) from t1;
c7	monthname(c7)
2019-01-12	January
2019-05-23	May
2020-01-07	January
1995-01-07	January
2010-05-09	May
select c8,monthname(c8) from t1;
c8	monthname(c8)
21:00:00	NULL
11:29:29	NULL
13:59:12	NULL
23:59:59	NULL
07:59:19	NULL
Warnings:
Warning	5086	Not timestamp Can not cast varchar value to timestamp type
Warning	5086	Not timestamp Can not cast varchar value to timestamp type
Warning	5086	Not timestamp Can not cast varchar value to timestamp type
Warning	5086	Not timestamp Can not cast varchar value to timestamp type
select c9,monthname(c9) from t1;
c9	monthname(c9)
2018-11-13 17:16:25	November
2012-12-19 01:59:03	December
2020-01-07 13:59:59	January
1995-12-07 18:59:59	December
2011-11-01 23:59:59	November
select c10,monthname(c10) from t1;
c10	monthname(c10)
2015-07-05 20:18:18	July
2008-05-13 10:25:19	May
2020-09-23 11:22:33	September
1998-09-23 11:22:33	September
2015-07-21 10:11:23	July
drop table t1;
## TIME,date,DATETIME,TIMESTAMP,YEAR
CREATE TABLE t1(c1 TIME ,
c2 date ,
c3 DATETIME ,
c4 TIMESTAMP DEFAULT '2000-01-01 00:00:00',
c5 YEAR ) ;
INSERT INTO t1 VALUES('20:12:12','2000-12-12','2000-01-01 01:01:01','2001-01-01 23:59:59.9999999','2000'),
('21:12:13','2001-12-22','2001-01-02 13:01:01','2001-11-02 00:00:01.999999','2001'),
('22:12:14','2002-12-02','2002-01-03 14:01:01','2002-12-03 02:01:01.299999','2002'),
('23:12:15','2003-12-11','2003-01-04 15:01:01','2002-11-04 03:01:01.399999','2003'),
('20:22:16','2004-12-12','2004-01-05 16:01:01','2002-02-05 05:01:01.499999','2004'),
('20:32:17','2021-12-13','2010-01-06 21:01:01','2003-03-06 04:01:01.599999','2005'),
('20:12:18','2005-12-12','2000-01-07 01:01:01','2001-01-07 12:01:01.699999','2006'),
('11:12:19','2006-12-22','2011-01-08 13:01:01','2001-11-08 11:01:01.799999','2007'),
('02:12:20','2007-12-02','2012-01-09 14:01:01','2002-12-09 02:01:01.899999','2008'),
('03:12:21','2008-12-11','2013-01-10 15:01:01','2002-11-10 03:01:01.999999','2009'),
('00:22:22','2009-12-12','2010-01-11 16:01:01','2002-02-11 05:01:01.000001','2010'),
('00:32:23','2001-12-13','2010-01-12 21:01:01','2003-03-31 04:59:59.000000','2011');
select c2,monthname(c2) from t1;
c2	monthname(c2)
2000-12-12	December
2001-12-22	December
2002-12-02	December
2003-12-11	December
2004-12-12	December
2021-12-13	December
2005-12-12	December
2006-12-22	December
2007-12-02	December
2008-12-11	December
2009-12-12	December
2001-12-13	December
select c3,monthname(c3) from t1;
c3	monthname(c3)
2000-01-01 01:01:01	January
2001-01-02 13:01:01	January
2002-01-03 14:01:01	January
2003-01-04 15:01:01	January
2004-01-05 16:01:01	January
2010-01-06 21:01:01	January
2000-01-07 01:01:01	January
2011-01-08 13:01:01	January
2012-01-09 14:01:01	January
2013-01-10 15:01:01	January
2010-01-11 16:01:01	January
2010-01-12 21:01:01	January
select c4,monthname(c4) from t1;
c4	monthname(c4)
2001-01-02 00:00:00	January
2001-11-02 00:00:02	November
2002-12-03 02:01:01	December
2002-11-04 03:01:01	November
2002-02-05 05:01:01	February
2003-03-06 04:01:02	March
2001-01-07 12:01:02	January
2001-11-08 11:01:02	November
2002-12-09 02:01:02	December
2002-11-10 03:01:02	November
2002-02-11 05:01:01	February
2003-03-31 04:59:59	March
select c5,monthname(c5) from t1;
c5	monthname(c5)
2000	NULL
2001	NULL
2002	NULL
2003	NULL
2004	NULL
2005	NULL
2006	NULL
2007	NULL
2008	NULL
2009	NULL
2010	NULL
2011	NULL
Warnings:
Warning	5086	Not timestamp Can not cast varchar value to timestamp type
Warning	5086	Not timestamp Can not cast varchar value to timestamp type
Warning	5086	Not timestamp Can not cast varchar value to timestamp type
Warning	5086	Not timestamp Can not cast varchar value to timestamp type
Warning	5086	Not timestamp Can not cast varchar value to timestamp type
Warning	5086	Not timestamp Can not cast varchar value to timestamp type
Warning	5086	Not timestamp Can not cast varchar value to timestamp type
Warning	5086	Not timestamp Can not cast varchar value to timestamp type
Warning	5086	Not timestamp Can not cast varchar value to timestamp type
Warning	5086	Not timestamp Can not cast varchar value to timestamp type
Warning	5086	Not timestamp Can not cast varchar value to timestamp type
Warning	5086	Not timestamp Can not cast varchar value to timestamp type
drop table t1;
##运算符验证
##算数运算符
select +monthname('2022-09-07');
+monthname('2022-09-07')
September
select monthname('2022-09-07')-monthname('2022-09-07');
monthname('2022-09-07')-monthname('2022-09-07')
0
Warnings:
Warning	1292	Truncated incorrect DOUBLE value: 'September'
Warning	1292	Truncated incorrect DOUBLE value: 'September'
##比较运算符
select monthname('2022-09-07') = monthname('2022-09-07');
monthname('2022-09-07') = monthname('2022-09-07')
1
select monthname('2022-09-07') <> monthname('2022-09-07');
monthname('2022-09-07') <> monthname('2022-09-07')
0
select monthname('2022-09-07') < monthname('2022-09-07');
monthname('2022-09-07') < monthname('2022-09-07')
0
select monthname('2022-09-07') != monthname('2022-09-07');
monthname('2022-09-07') != monthname('2022-09-07')
0
select monthname('2022-09-07') > monthname('2022-09-07');
monthname('2022-09-07') > monthname('2022-09-07')
0
select monthname('2022-09-07') >= monthname('2022-09-07');
monthname('2022-09-07') >= monthname('2022-09-07')
1
select monthname('2022-09-07') <= monthname('2022-09-07');
monthname('2022-09-07') <= monthname('2022-09-07')
1
select monthname('2022-09-07') <=> monthname('2022-09-07');
monthname('2022-09-07') <=> monthname('2022-09-07')
1
select monthname('2022-09-07') = 1;
monthname('2022-09-07') = 1
0
Warnings:
Warning	1292	Truncated incorrect DECIMAL value: 'September'
select monthname('2022-09-07') < 1;
monthname('2022-09-07') < 1
1
Warnings:
Warning	1292	Truncated incorrect DECIMAL value: 'September'
select monthname('2022-09-07') <> 1;
monthname('2022-09-07') <> 1
1
Warnings:
Warning	1292	Truncated incorrect DECIMAL value: 'September'
select monthname('2022-09-07') != 1;
monthname('2022-09-07') != 1
1
Warnings:
Warning	1292	Truncated incorrect DECIMAL value: 'September'
select monthname('2022-09-07') > 1;
monthname('2022-09-07') > 1
0
Warnings:
Warning	1292	Truncated incorrect DECIMAL value: 'September'
select monthname('2022-09-07') >= 1;
monthname('2022-09-07') >= 1
0
Warnings:
Warning	1292	Truncated incorrect DECIMAL value: 'September'
select monthname('2022-09-07') <= 1;
monthname('2022-09-07') <= 1
1
Warnings:
Warning	1292	Truncated incorrect DECIMAL value: 'September'
select monthname('2022-09-07') <=> 1;
monthname('2022-09-07') <=> 1
0
Warnings:
Warning	1292	Truncated incorrect DECIMAL value: 'September'
select monthname('2022-09-07') in ('January','February','March','April','May','June','July','August','September','October','November','December');
monthname('2022-09-07') in ('January','February','March','April','May','June','July','August','September','October','November','December')
1
select monthname('null') in ('January','February','March','April','May','June','July','August','September','October','November','December');
monthname('null') in ('January','February','March','April','May','June','July','August','September','October','November','December')
NULL
Warnings:
Warning	5086	Not timestamp Can not cast varchar value to timestamp type
select monthname('null')  not in ('January','February','March','April','May','June','July','August','September','October','November','December');
monthname('null')  not in ('January','February','March','April','May','June','July','August','September','October','November','December')
NULL
Warnings:
Warning	5086	Not timestamp Can not cast varchar value to timestamp type
select monthname('2022-09-07')  not in ('January','February','March','April','May','June','July','August','September','October','November','December');
monthname('2022-09-07')  not in ('January','February','March','April','May','June','July','August','September','October','November','December')
0
select monthname('2022-09-07') between monthname('2022-09-07') and monthname('2022-09-08');
monthname('2022-09-07') between monthname('2022-09-07') and monthname('2022-09-08')
1
select monthname('2022-09-07') not between monthname('2022-09-07') and monthname('2022-09-07');
monthname('2022-09-07') not between monthname('2022-09-07') and monthname('2022-09-07')
0
select monthname('2022-09-07') is null;
monthname('2022-09-07') is null
0
select monthname('2022-09-07') is not null;
monthname('2022-09-07') is not null
1
select monthname('0') is null;
monthname('0') is null
1
Warnings:
Warning	5086	Not timestamp Can not cast varchar value to timestamp type
select monthname('null') is null;
monthname('null') is null
1
Warnings:
Warning	5086	Not timestamp Can not cast varchar value to timestamp type
select monthname('null') is true;
monthname('null') is true
0
Warnings:
Warning	5086	Not timestamp Can not cast varchar value to timestamp type
select monthname('null') is false;
monthname('null') is false
0
Warnings:
Warning	5086	Not timestamp Can not cast varchar value to timestamp type
位运算符和逻辑运算符
select monthname('2022-09-07')+0&monthname('2022-09-07');
monthname('2022-09-07')+0&monthname('2022-09-07')
0
Warnings:
Warning	1292	Truncated incorrect DOUBLE value: 'September'
Warning	1292	Truncated incorrect INTEGER value: 'September'
select monthname('2022-09-07')+0&monthname('2022-09-07')+0;
monthname('2022-09-07')+0&monthname('2022-09-07')+0
0
Warnings:
Warning	1292	Truncated incorrect DOUBLE value: 'September'
select monthname('2022-09-07')|monthname('2022-09-07');
monthname('2022-09-07')|monthname('2022-09-07')
0
Warnings:
Warning	1292	Truncated incorrect INTEGER value: 'September'
Warning	1292	Truncated incorrect INTEGER value: 'September'
select monthname('2022-09-07')|monthname('2022-09-07')+1;
monthname('2022-09-07')|monthname('2022-09-07')+1
1
Warnings:
Warning	1292	Truncated incorrect INTEGER value: 'September'
Warning	1292	Truncated incorrect DOUBLE value: 'September'
select monthname('2022-09-07')+0|monthname('2022-09-07')+0;
monthname('2022-09-07')+0|monthname('2022-09-07')+0
0
Warnings:
Warning	1292	Truncated incorrect DOUBLE value: 'September'
select monthname('2022-09-07')^monthname('2022-09-07');
monthname('2022-09-07')^monthname('2022-09-07')
0
Warnings:
Warning	1292	Truncated incorrect INTEGER value: 'September'
Warning	1292	Truncated incorrect INTEGER value: 'September'
select monthname('2022-09-07')^monthname('2022-09-07')+1;
monthname('2022-09-07')^monthname('2022-09-07')+1
1
Warnings:
Warning	1292	Truncated incorrect INTEGER value: 'September'
Warning	1292	Truncated incorrect INTEGER value: 'September'
select monthname('2022-09-07')+0^monthname('2022-09-07')+0;
monthname('2022-09-07')+0^monthname('2022-09-07')+0
0
Warnings:
Warning	1292	Truncated incorrect DOUBLE value: 'September'
Warning	1292	Truncated incorrect INTEGER value: 'September'
select monthname('2022-09-07')>>monthname('2022-09-07');
monthname('2022-09-07')>>monthname('2022-09-07')
0
Warnings:
Warning	1292	Truncated incorrect INTEGER value: 'September'
Warning	1292	Truncated incorrect INTEGER value: 'September'
select monthname('2022-09-07')>>monthname('2022-09-07')+1;
monthname('2022-09-07')>>monthname('2022-09-07')+1
0
Warnings:
Warning	1292	Truncated incorrect INTEGER value: 'September'
Warning	1292	Truncated incorrect DOUBLE value: 'September'
select monthname('2022-09-07')+0>>monthname('2022-09-07')+0;
monthname('2022-09-07')+0>>monthname('2022-09-07')+0
0
Warnings:
Warning	1292	Truncated incorrect DOUBLE value: 'September'
select monthname('2022-09-07')<<monthname('2022-09-07');
monthname('2022-09-07')<<monthname('2022-09-07')
0
Warnings:
Warning	1292	Truncated incorrect INTEGER value: 'September'
Warning	1292	Truncated incorrect INTEGER value: 'September'
select monthname('2022-09-07')<<monthname('2022-09-07')+1;
monthname('2022-09-07')<<monthname('2022-09-07')+1
0
Warnings:
Warning	1292	Truncated incorrect INTEGER value: 'September'
Warning	1292	Truncated incorrect DOUBLE value: 'September'
select monthname('2022-09-07')+0<<monthname('2022-09-07')+0;
monthname('2022-09-07')+0<<monthname('2022-09-07')+0
0
Warnings:
Warning	1292	Truncated incorrect DOUBLE value: 'September'
select ~monthname('2022-09-07');
~monthname('2022-09-07')
18446744073709551615
Warnings:
Warning	1292	Truncated incorrect INTEGER value: 'September'
select ~monthname('2022-09-07')-10;
~monthname('2022-09-07')-10
18446744073709551605
Warnings:
Warning	1292	Truncated incorrect INTEGER value: 'September'
select monthname('2022-09-07') and monthname('2022-09-07');
monthname('2022-09-07') and monthname('2022-09-07')
0
Warnings:
Warning	1292	Truncated incorrect DOUBLE value: 'September'
select monthname('2022-09-07')+1 and monthname('2022-09-07')-1;
monthname('2022-09-07')+1 and monthname('2022-09-07')-1
1
Warnings:
Warning	1292	Truncated incorrect DOUBLE value: 'September'
Warning	1292	Truncated incorrect DOUBLE value: 'September'
select monthname('2022-09-07') and monthname('2022-09-07')-1;
monthname('2022-09-07') and monthname('2022-09-07')-1
0
Warnings:
Warning	1292	Truncated incorrect DOUBLE value: 'September'
select monthname('2022-09-07') or monthname('2022-09-07');
monthname('2022-09-07') or monthname('2022-09-07')
0
Warnings:
Warning	1292	Truncated incorrect DOUBLE value: 'September'
Warning	1292	Truncated incorrect DOUBLE value: 'September'
select monthname('2022-09-07') or null;
monthname('2022-09-07') or null
NULL
Warnings:
Warning	1292	Truncated incorrect DOUBLE value: 'September'
select monthname('2022-09-07')+1 or null;
monthname('2022-09-07')+1 or null
1
Warnings:
Warning	1292	Truncated incorrect DOUBLE value: 'September'
select monthname('2022-09-07')+1 or monthname('2022-09-07')-1;
monthname('2022-09-07')+1 or monthname('2022-09-07')-1
1
Warnings:
Warning	1292	Truncated incorrect DOUBLE value: 'September'
select monthname('2022-09-07') or monthname('2022-09-07')-1;
monthname('2022-09-07') or monthname('2022-09-07')-1
1
Warnings:
Warning	1292	Truncated incorrect DOUBLE value: 'September'
Warning	1292	Truncated incorrect DOUBLE value: 'September'
select not monthname('2022-09-07')-1;
not monthname('2022-09-07')-1
0
Warnings:
Warning	1292	Truncated incorrect DOUBLE value: 'September'
select not monthname('2022-09-07');
not monthname('2022-09-07')
1
Warnings:
Warning	1292	Truncated incorrect DOUBLE value: 'September'
select !monthname('2022-09-07')-1;
!monthname('2022-09-07')-1
0
Warnings:
Warning	1292	Truncated incorrect DOUBLE value: 'September'
select !monthname('2022-09-07');
!monthname('2022-09-07')
1
Warnings:
Warning	1292	Truncated incorrect DOUBLE value: 'September'
select monthname('2022-09-07') xor monthname('2022-09-07');
monthname('2022-09-07') xor monthname('2022-09-07')
0
Warnings:
Warning	1292	Truncated incorrect DOUBLE value: 'September'
select monthname('2022-09-07')+1 xor monthname('2022-09-07')-1;
monthname('2022-09-07')+1 xor monthname('2022-09-07')-1
0
Warnings:
Warning	1292	Truncated incorrect DOUBLE value: 'September'
Warning	1292	Truncated incorrect DOUBLE value: 'September'
drop table t1;
##日期时间函数校验
select CURRENT_TIME(monthname('2022-09-07'));
ERROR 42000: You have an error in your SQL syntax; check the manual that corresponds to your OceanBase version for the right syntax to use near 'monthname('2022-09-07'))' at line 1
select CURRENT_TIME(monthname('2022-09-07')-monthname('2022-09-07'));
ERROR 42000: You have an error in your SQL syntax; check the manual that corresponds to your OceanBase version for the right syntax to use near 'monthname('2022-09-07')-monthname('2022-09-07'))' at line 1
select CURRENT_TIMESTAMP(monthname('2022-09-07')-monthname('2022-09-07'));
ERROR 42000: You have an error in your SQL syntax; check the manual that corresponds to your OceanBase version for the right syntax to use near 'monthname('2022-09-07')-monthname('2022-09-07'))' at line 1
select DATE_ADD(monthname('2022-09-07 23:59:59'),INTERVAL '1:1' MINUTE_SECOND);
DATE_ADD(monthname('2022-09-07 23:59:59'),INTERVAL '1:1' MINUTE_SECOND)
NULL
SELECT monthname(DATE_ADD('2022-09-07 23:59:59',INTERVAL '1:1' MINUTE_SECOND));
monthname(DATE_ADD('2022-09-07 23:59:59',INTERVAL '1:1' MINUTE_SECOND))
September
select monthname(date_format('2022-01-27 13:23:00', '%Y-%c-%d'))as result;
result
January
select date_format(monthname('2022-01-27 13:23:00'),'%Y %c %d')as result;
result
NULL
select monthname('2009-10-01') = DATE_FORMAT('2009-10-01 22:23:00', '%W');
monthname('2009-10-01') = DATE_FORMAT('2009-10-01 22:23:00', '%W')
0
select monthname(date_sub(date '2022-01-22',interval '3' day));
monthname(date_sub(date '2022-01-22',interval '3' day))
January
select DATE_SUB(monthname('2022-09-07'),INTERVAL 5 DAY);
DATE_SUB(monthname('2022-09-07'),INTERVAL 5 DAY)
NULL
select DATEDIFF(monthname('2022-09-07'),monthname('2021-09-07'));
DATEDIFF(monthname('2022-09-07'),monthname('2021-09-07'))
NULL
select monthname(DATEDIFF('2000-01-22 23:59:59','1000-01-21'));
monthname(DATEDIFF('2000-01-22 23:59:59','1000-01-21'))
NULL
Warnings:
Warning	5086	Not timestamp Can not cast varchar value to timestamp type
select EXTRACT(week from monthname('2022-09-07'));
EXTRACT(week from monthname('2022-09-07'))
NULL
select EXTRACT(week from monthname('2022-09-07'));
EXTRACT(week from monthname('2022-09-07'))
NULL
select from_days(monthname('2022-09-07'));
from_days(monthname('2022-09-07'))
0000-00-00
select monthname(from_days(738565));
monthname(from_days(738565))
February
select FROM_UNIXTIME(monthname('2022-09-07'),GET_FORMAT(DATE,'USA'));
FROM_UNIXTIME(monthname('2022-09-07'),GET_FORMAT(DATE,'USA'))
01.01.1970
Warnings:
Warning	1292	Truncated incorrect DECIMAL value: 'September'
select monthname(FROM_UNIXTIME(1647738456));
monthname(FROM_UNIXTIME(1647738456))
March
select MONTH(monthname('2022-09-07'));
MONTH(monthname('2022-09-07'))
NULL
Warnings:
Warning	5086	Not timestamp Can not cast varchar value to timestamp type
select monthname(month('2022-09-07'));
monthname(month('2022-09-07'))
NULL
Warnings:
Warning	5086	Not timestamp Can not cast varchar value to timestamp type
select PERIOD_DIFF(monthname('2022-09-07'),monthname('2022-09-07'));
PERIOD_DIFF(monthname('2022-09-07'),monthname('2022-09-07'))
0
Warnings:
Warning	1292	Truncated incorrect INTEGER value: 'September'
Warning	1292	Truncated incorrect INTEGER value: 'September'
select monthname(PERIOD_DIFF(200802,200703));
monthname(PERIOD_DIFF(200802,200703))
NULL
Warnings:
Warning	5086	Not timestamp Can not cast varchar value to timestamp type
select monthname(str_to_date('2022-01-06 10:20:30','%Y-%m-%d %H:%i:%s')) as result;
result
January
select STR_TO_DATE(monthname('2022-09-07'));
ERROR 42000: Incorrect parameter count in the call to native function 'STR_TO_DATE'
##MySQL5.7与ob结果不一致;
select time(monthname('2022-09-07 23:59:59.999999'));
time(monthname('2022-09-07 23:59:59.999999'))
00:00:00.000000
select TIME_TO_SEC(monthname('2022-09-07'));
TIME_TO_SEC(monthname('2022-09-07'))
0
select monthname(TIME_TO_SEC('2022-09-07'));
monthname(TIME_TO_SEC('2022-09-07'))
December
##MySQL5.7与ob结果不一致;
select TIMEDIFF(monthname('2022-09-07'),monthname('2022-09-07'));
TIMEDIFF(monthname('2022-09-07'),monthname('2022-09-07'))
NULL
SELECT TIMESTAMPADD(WEEK,1,monthname('2003-01-02'));
TIMESTAMPADD(WEEK,1,monthname('2003-01-02'))
NULL
select TIMESTAMPDIFF(day,monthname('2022-09-07') , monthname('2022-09-07'));
TIMESTAMPDIFF(day,monthname('2022-09-07') , monthname('2022-09-07'))
NULL
select monthname(TIMESTAMPDIFF(MONTH,'2003-02-01','2003-05-01'));
monthname(TIMESTAMPDIFF(MONTH,'2003-02-01','2003-05-01'))
NULL
Warnings:
Warning	5086	Not timestamp Can not cast varchar value to timestamp type
select TO_DAYS(monthname('2003-02-01'));
TO_DAYS(monthname('2003-02-01'))
NULL
select monthname(TO_DAYS('2003-02-01'));
monthname(TO_DAYS('2003-02-01'))
NULL
Warnings:
Warning	5086	Not timestamp Can not cast varchar value to timestamp type
##MySQL5.7与ob结果不一致;
select SEC_TO_TIME(monthname('2003-02-01'));
SEC_TO_TIME(monthname('2003-02-01'))
00:00:00.000000
Warnings:
Warning	1292	Truncated incorrect DECIMAL value: 'February'
##MySQL5.7与ob结果不一致;
select UNIX_TIMESTAMP(monthname('2022-09-07'));
UNIX_TIMESTAMP(monthname('2022-09-07'))
0.000000
select monthname(UNIX_TIMESTAMP('2022-09-07'));
monthname(UNIX_TIMESTAMP('2022-09-07'))
NULL
Warnings:
Warning	5086	Not timestamp Can not cast varchar value to timestamp type
select UTC_TIMESTAMP(monthname('2022-09-07'));
ERROR 42000: You have an error in your SQL syntax; check the manual that corresponds to your OceanBase version for the right syntax to use near 'monthname('2022-09-07'))' at line 1
select YEAR(monthname('2022-09-07'));
YEAR(monthname('2022-09-07'))
NULL
Warnings:
Warning	5086	Not timestamp Can not cast varchar value to timestamp type
select monthname(year('2022-09-07'));
monthname(year('2022-09-07'))
NULL
Warnings:
Warning	5086	Not timestamp Can not cast varchar value to timestamp type
##MySQL5.7与ob结果不一致;
select YEAR(monthname('2022-09-07')+10000);
YEAR(monthname('2022-09-07')+10000)
2001
Warnings:
Warning	1292	Truncated incorrect DOUBLE value: 'September'
##字符串函数
select CONCAT(monthname('2022-09-07'),monthname('2022-09-07'));
CONCAT(monthname('2022-09-07'),monthname('2022-09-07'))
SeptemberSeptember
select CONCAT_WS('_',monthname('2022-09-07'),monthname('2022-09-07'));
CONCAT_WS('_',monthname('2022-09-07'),monthname('2022-09-07'))
September_September
select FORMAT(monthname('2022-09-08'),3);
FORMAT(monthname('2022-09-08'),3)
0.000
Warnings:
Warning	1292	Truncated incorrect DOUBLE value: 'September'
select monthname(FORMAT(1025.12356,2));
monthname(FORMAT(1025.12356,2))
NULL
Warnings:
Warning	5086	Not timestamp Can not cast varchar value to timestamp type
select SUBSTR(monthname('2022-09-07'),1);
SUBSTR(monthname('2022-09-07'),1)
September
select monthname(SUBSTR('20220907',1));
monthname(SUBSTR('20220907',1))
September
select SUBSTRING(monthname('2022-09-07'),1,1);
SUBSTRING(monthname('2022-09-07'),1,1)
S
select monthname(SUBSTRING('2022-09-07',1,10));
monthname(SUBSTRING('2022-09-07',1,10))
September
select TRIM(  monthname(' 2022-09-07  ')  );
TRIM(  monthname(' 2022-09-07  ')  )
September
select monthname(TRIM(' 2022-09-07 '));
monthname(TRIM(' 2022-09-07 '))
September
select RTRIM(monthname('2022-09-07'));
RTRIM(monthname('2022-09-07'))
September
select monthname(RTRIM('2022-09-07'));
monthname(RTRIM('2022-09-07'))
September
select ascii(monthname('2022-09-07'));
ascii(monthname('2022-09-07'))
83
select monthname(ascii('2022-09-07'));
monthname(ascii('2022-09-07'))
NULL
Warnings:
Warning	5086	Not timestamp Can not cast varchar value to timestamp type
select ORD(monthname('2022-09-07'));
ORD(monthname('2022-09-07'))
83
select monthname(ORD('2022-09-07'));
monthname(ORD('2022-09-07'))
NULL
Warnings:
Warning	5086	Not timestamp Can not cast varchar value to timestamp type
select LENGTH(monthname('2022-09-07'));
LENGTH(monthname('2022-09-07'))
9
select monthname(LENGTH('2022-09-07'));
monthname(LENGTH('2022-09-07'))
NULL
Warnings:
Warning	5086	Not timestamp Can not cast varchar value to timestamp type
select CHAR_LENGTH(monthname('2022-09-07'));
CHAR_LENGTH(monthname('2022-09-07'))
9
select monthname(CHAR_LENGTH('2022-09-07'));
monthname(CHAR_LENGTH('2022-09-07'))
NULL
Warnings:
Warning	5086	Not timestamp Can not cast varchar value to timestamp type
select UPPER(monthname('2022-09-07'));
UPPER(monthname('2022-09-07'))
SEPTEMBER
select monthname(UPPER('2022-09-07'));
monthname(UPPER('2022-09-07'))
September
select lower(monthname('2022-09-07'));
lower(monthname('2022-09-07'))
september
select monthname(lower('2022-09-07'));
monthname(lower('2022-09-07'))
September
select HEX(monthname('2022-09-07'));
HEX(monthname('2022-09-07'))
53657074656D626572
select monthname(HEX('2022-09-07'));
monthname(HEX('2022-09-07'))
NULL
Warnings:
Warning	5086	Not timestamp Can not cast varchar value to timestamp type
select UNHEX(monthname('2022-09-07'));
UNHEX(monthname('2022-09-07'))
NULL
select monthname(UNHEX('2022-09-07'));
monthname(UNHEX('2022-09-07'))
NULL
select MD5(monthname('2022-09-07'));
MD5(monthname('2022-09-07'))
cc5d90569e1c8313c2b1c2aab1401174
select monthname(MD5('2022-09-07'));
monthname(MD5('2022-09-07'))
NULL
Warnings:
Warning	5086	Not timestamp Can not cast varchar value to timestamp type
select INT2IP(monthname('2022-09-07'));
INT2IP(monthname('2022-09-07'))
0.0.0.0
Warnings:
Warning	1292	Truncated incorrect INTEGER value: 'September'
select monthname(INT2IP('2022-09-07'));
monthname(INT2IP('2022-09-07'))
NULL
Warnings:
Warning	1292	Truncated incorrect INTEGER value: '2022-09-07'
SELECT monthname('2022-09-07') LIKE 'W%';
monthname('2022-09-07') LIKE 'W%'
0
SELECT monthname('2022-09-07') REGEXP monthname('2022-09-08');
monthname('2022-09-07') REGEXP monthname('2022-09-08')
1
SELECT REPEAT(monthname('2022-09-07'), 5);
REPEAT(monthname('2022-09-07'), 5)
SeptemberSeptemberSeptemberSeptemberSeptember
SELECT monthname(REPEAT('2022-09-07',1));
monthname(REPEAT('2022-09-07',1))
September
SELECT REPEAT(monthname('2022-09-07'), monthname('2022-09-07'));
REPEAT(monthname('2022-09-07'), monthname('2022-09-07'))

Warnings:
Warning	1292	Truncated incorrect INTEGER value: 'September'
SELECT SPACE(monthname('2022-09-07'),0);
ERROR 42000: Incorrect parameter count in the call to native function 'SPACE'
SELECT monthname(SPACE('2022-09-07'));
monthname(SPACE('2022-09-07'))
NULL
Warnings:
Warning	1292	Truncated incorrect INTEGER value: '2022-09-07'
Warning	5086	Not timestamp Can not cast varchar value to timestamp type
SELECT SUBSTRING_INDEX(monthname('2022-09-07'),' ',1);
SUBSTRING_INDEX(monthname('2022-09-07'),' ',1)
September
SELECT monthname(SUBSTRING_INDEX('2022-09-07','-',3));
monthname(SUBSTRING_INDEX('2022-09-07','-',3))
September
SELECT LOCATE(monthname('2022-09-07'),monthname('2022-09-07'));
LOCATE(monthname('2022-09-07'),monthname('2022-09-07'))
1
SELECT LOCATE(monthname('2022-09-07'),monthname('2022-09-08'));
LOCATE(monthname('2022-09-07'),monthname('2022-09-08'))
1
SELECT POSITION(monthname('2022-09-07') in monthname('2022-09-07'));
POSITION(monthname('2022-09-07') in monthname('2022-09-07'))
1
SELECT POSITION(monthname('2022-09-07') in monthname('2022-09-08'));
POSITION(monthname('2022-09-07') in monthname('2022-09-08'))
1
SELECT INSTR(monthname('2022-09-07'),monthname('2022-09-07'));
INSTR(monthname('2022-09-07'),monthname('2022-09-07'))
1
SELECT INSTR(monthname('2022-09-07'),monthname('2022-09-08'));
INSTR(monthname('2022-09-07'),monthname('2022-09-08'))
1
SELECT REPLACE(monthname('2022-09-07'),monthname('2022-09-07'),monthname('2022-09-07'));
REPLACE(monthname('2022-09-07'),monthname('2022-09-07'),monthname('2022-09-07'))
September
SELECT REPLACE(monthname('2022-09-07'),monthname('2022-09-07'),monthname('2022-09-08'));
REPLACE(monthname('2022-09-07'),monthname('2022-09-07'),monthname('2022-09-08'))
September
SELECT FIELD(monthname('2022-09-07'),monthname('2022-09-07'),monthname('2022-09-07'));
FIELD(monthname('2022-09-07'),monthname('2022-09-07'),monthname('2022-09-07'))
1
SELECT FIELD(monthname('2022-09-07'),monthname('2022-09-07'),monthname('2022-09-08'));
FIELD(monthname('2022-09-07'),monthname('2022-09-07'),monthname('2022-09-08'))
1
SELECT ELT(1,monthname('2022-09-07'),monthname('2022-09-07'));
ELT(1,monthname('2022-09-07'),monthname('2022-09-07'))
September
SELECT ELT(2,monthname('2022-09-07'),monthname('2022-09-08'));
ELT(2,monthname('2022-09-07'),monthname('2022-09-08'))
September
SELECT LPAD(monthname('2022-09-07'),monthname('2022-09-07'),monthname('2022-09-07'));
LPAD(monthname('2022-09-07'),monthname('2022-09-07'),monthname('2022-09-07'))

SELECT RPAD(monthname('2022-09-07'),monthname('2022-09-07'),monthname('2022-09-07'));
RPAD(monthname('2022-09-07'),monthname('2022-09-07'),monthname('2022-09-07'))

SELECT bin(monthname('2022-09-07'));
bin(monthname('2022-09-07'))
0
SELECT bin(monthname('2022-09-08'));
bin(monthname('2022-09-08'))
0
SELECT quote(monthname('2022-09-07'));
quote(monthname('2022-09-07'))
'September'
SELECT quote(monthname('2022-09-08'));
quote(monthname('2022-09-08'))
'September'
SELECT REGEXP_SUBSTR(monthname('2022-09-07'));
ERROR 42000: Incorrect parameter count in the call to native function 'REGEXP_SUBSTR'
##转换函数与数学函数
select CAST(monthname('2022-09-07') as date);
CAST(monthname('2022-09-07') as date)
NULL
select CAST(monthname('2022-09-07') as time);
CAST(monthname('2022-09-07') as time)
00:00:00
select monthname(CAST('2022-09-07' as date));
monthname(CAST('2022-09-07' as date))
September
select ROUND(monthname(2022-09-07),1);
ROUND(monthname(2022-09-07),1)
NULL
Warnings:
Warning	5086	Not timestamp Can not cast varchar value to timestamp type
select monthname(round(20220907.984));
monthname(round(20220907.984))
September
select monthname(ROUND('2022-09-07'),ROUND('2022-09-07'));
ERROR 42000: Incorrect parameter count in the call to native function 'monthname'
select ROUND(monthname('2022-09-07'),monthname('2022-09-07')-20200916);
ROUND(monthname('2022-09-07'),monthname('2022-09-07')-20200916)
0
Warnings:
Warning	1292	Truncated incorrect DOUBLE value: 'September'
Warning	1292	Truncated incorrect DOUBLE value: 'September'
select monthname(CEIL('20220907'));
monthname(CEIL('20220907'))
September
select monthname(CEIL('20220908 23:59:59.999999'));
monthname(CEIL('20220908 23:59:59.999999'))
September
Warnings:
Warning	1292	Truncated incorrect DOUBLE value: '20220908 23:59:59.999999'
select monthname(FLOOR('20220907'));
monthname(FLOOR('20220907'))
September
select monthname(FLOOR('20220908 23:59:59.999999'));
monthname(FLOOR('20220908 23:59:59.999999'))
September
Warnings:
Warning	1292	Truncated incorrect DOUBLE value: '20220908 23:59:59.999999'
select monthname(ABS(20220907+1));
monthname(ABS(20220907+1))
September
select monthname(ABS(20220908-1));
monthname(ABS(20220908-1))
September
select monthname(SIGN(20220907));
monthname(SIGN(20220907))
NULL
Warnings:
Warning	5086	Not timestamp Can not cast varchar value to timestamp type
select monthname(SIGN(20220907));
monthname(SIGN(20220907))
NULL
Warnings:
Warning	5086	Not timestamp Can not cast varchar value to timestamp type
select monthname(CONV(20220907+1));
ERROR 42000: Incorrect parameter count in the call to native function 'CONV'
select monthname(CONV(20220907-1));
ERROR 42000: Incorrect parameter count in the call to native function 'CONV'
select MOD(monthname('2022-09-07'),1);
MOD(monthname('2022-09-07'),1)
0
Warnings:
Warning	1292	Truncated incorrect DOUBLE value: 'September'
select monthname(MOD(20220907,1));
monthname(MOD(20220907,1))
NULL
select POW(monthname(20220907),null);
POW(monthname(20220907),null)
NULL
Warnings:
Warning	1292	Truncated incorrect DOUBLE value: 'September'
select monthname(POW(20220907),1);
ERROR 42000: Incorrect parameter count in the call to native function 'monthname'
select POWER(monthname(20220907),null);
POWER(monthname(20220907),null)
NULL
Warnings:
Warning	1292	Truncated incorrect DOUBLE value: 'September'
select monthname(POWER(20220907),1);
ERROR 42000: Incorrect parameter count in the call to native function 'monthname'
select rand(monthname(2022-09-07));
rand(monthname(2022-09-07))
0.15522042769493574
Warnings:
Warning	5086	Not timestamp Can not cast varchar value to timestamp type
select monthname(rand(2022-09-07));
monthname(rand(2022-09-07))
NULL
##流程控制函数与比较函数
select GREATEST(monthname('2022-09-07'),'1');
GREATEST(monthname('2022-09-07'),'1')
September
select LEAST(monthname('2022-09-07'),'1');
LEAST(monthname('2022-09-07'),'1')
1
select isnull(monthname('2022-09-07'));
isnull(monthname('2022-09-07'))
0
select isnull(monthname('2022-09-07')+0);
isnull(monthname('2022-09-07')+0)
0
Warnings:
Warning	1292	Truncated incorrect DOUBLE value: 'September'
select CASE monthname('2022-09-08') when monthname('2022-09-08') then 1 when monthname('2022-09-07') then 2 END as result;
result
1
select if(monthname('2022-09-07')<monthname('2022-09-08'),monthname('2022-09-07'),monthname('2022-09-08')) as result;
result
September
select ifnull(null,monthname('2022-09-07'));
ifnull(null,monthname('2022-09-07'))
September
select nullif(monthname('2022-09-07'),monthname('2022-09-07'));
nullif(monthname('2022-09-07'),monthname('2022-09-07'))
NULL
select COALESCE(monthname('2022-09-07'));
COALESCE(monthname('2022-09-07'))
September
select sleep(monthname(20200912));
sleep(monthname(20200912))
0
Warnings:
Warning	1292	Truncated incorrect DECIMAL value: 'September'
##使用场景 
##表table
##create as select
drop table t1;
drop table t2;
create table t1 (c1 int ,c2 varchar(20),c3 date);
insert into t1 values(1,'test01','20220907');
insert into t1 values(2,'test02','20220909');
insert into t1 values(3,'test03','2022-08-20');
insert into t1 values(4,'test04','2022-09-15');
insert into t1 values(5,'test05','2022-09-16');
select monthname(c3) as a from t1;
a
September
September
August
September
September
create table t2 as select monthname(c3) from t1;
drop table t2;
##聚合函数
select count(monthname(c3)) from t1;
count(monthname(c3))
5
select sum(monthname(c3)) from t1;
sum(monthname(c3))
0
Warnings:
Warning	1292	Truncated incorrect DOUBLE value: 'September'
Warning	1292	Truncated incorrect DOUBLE value: 'September'
Warning	1292	Truncated incorrect DOUBLE value: 'August'
Warning	1292	Truncated incorrect DOUBLE value: 'September'
Warning	1292	Truncated incorrect DOUBLE value: 'September'
select avg(monthname(c3)) from t1;
avg(monthname(c3))
0
Warnings:
Warning	1292	Truncated incorrect DOUBLE value: 'September'
Warning	1292	Truncated incorrect DOUBLE value: 'September'
Warning	1292	Truncated incorrect DOUBLE value: 'August'
Warning	1292	Truncated incorrect DOUBLE value: 'September'
Warning	1292	Truncated incorrect DOUBLE value: 'September'
select min(monthname(c3)) from t1;
min(monthname(c3))
August
select max(monthname(c3)) from t1;
max(monthname(c3))
September
select GROUP_CONCAT(monthname(c3)) from t1;
GROUP_CONCAT(monthname(c3))
September,September,August,September,September
##where子句 当前ob会断开连接,待修复后再测试
create table t2(a1 int ,a2 int);
insert into t2 values(1,1);
insert into t2 values(2,2);
insert into t2 values(3,3);
select t1.*,monthname(c3) from t1 inner join t2 on t1.c1=t2.a1;
c1	c2	c3	monthname(c3)
1	test01	2022-09-07	September
2	test02	2022-09-09	September
3	test03	2022-08-20	August
select t1.*,monthname(c3) from t1 left join t2 on t1.c1=t2.a1;
c1	c2	c3	monthname(c3)
1	test01	2022-09-07	September
2	test02	2022-09-09	September
3	test03	2022-08-20	August
4	test04	2022-09-15	September
5	test05	2022-09-16	September
select t1.*,monthname(c3) from t1 right join t2 on t1.c1=t2.a1;
c1	c2	c3	monthname(c3)
1	test01	2022-09-07	September
2	test02	2022-09-09	September
3	test03	2022-08-20	August
mysql5.7不支持
with tt as (select monthname(c3)  from t1)  select * from tt;
monthname(c3)
September
September
August
September
September
select monthname(c3)+monthname(c3) from t1;
monthname(c3)+monthname(c3)
0
0
0
0
0
Warnings:
Warning	1292	Truncated incorrect DOUBLE value: 'September'
Warning	1292	Truncated incorrect DOUBLE value: 'September'
Warning	1292	Truncated incorrect DOUBLE value: 'August'
Warning	1292	Truncated incorrect DOUBLE value: 'September'
Warning	1292	Truncated incorrect DOUBLE value: 'September'
Warning	1292	Truncated incorrect DOUBLE value: 'September'
Warning	1292	Truncated incorrect DOUBLE value: 'September'
Warning	1292	Truncated incorrect DOUBLE value: 'August'
Warning	1292	Truncated incorrect DOUBLE value: 'September'
Warning	1292	Truncated incorrect DOUBLE value: 'September'
select monthname(c3)-monthname(c3) from t1;
monthname(c3)-monthname(c3)
0
0
0
0
0
Warnings:
Warning	1292	Truncated incorrect DOUBLE value: 'September'
Warning	1292	Truncated incorrect DOUBLE value: 'September'
Warning	1292	Truncated incorrect DOUBLE value: 'August'
Warning	1292	Truncated incorrect DOUBLE value: 'September'
Warning	1292	Truncated incorrect DOUBLE value: 'September'
Warning	1292	Truncated incorrect DOUBLE value: 'September'
Warning	1292	Truncated incorrect DOUBLE value: 'September'
Warning	1292	Truncated incorrect DOUBLE value: 'August'
Warning	1292	Truncated incorrect DOUBLE value: 'September'
Warning	1292	Truncated incorrect DOUBLE value: 'September'
select monthname(c3)*monthname(c3) from t1;
monthname(c3)*monthname(c3)
0
0
0
0
0
Warnings:
Warning	1292	Truncated incorrect DOUBLE value: 'September'
Warning	1292	Truncated incorrect DOUBLE value: 'September'
Warning	1292	Truncated incorrect DOUBLE value: 'August'
Warning	1292	Truncated incorrect DOUBLE value: 'September'
Warning	1292	Truncated incorrect DOUBLE value: 'September'
Warning	1292	Truncated incorrect DOUBLE value: 'September'
Warning	1292	Truncated incorrect DOUBLE value: 'September'
Warning	1292	Truncated incorrect DOUBLE value: 'August'
Warning	1292	Truncated incorrect DOUBLE value: 'September'
Warning	1292	Truncated incorrect DOUBLE value: 'September'
select monthname(c3)/monthname(c3) from t1;
monthname(c3)/monthname(c3)
NULL
NULL
NULL
NULL
NULL
Warnings:
Warning	1292	Truncated incorrect DOUBLE value: 'September'
Warning	1292	Truncated incorrect DOUBLE value: 'September'
Warning	1292	Truncated incorrect DOUBLE value: 'August'
Warning	1292	Truncated incorrect DOUBLE value: 'September'
Warning	1292	Truncated incorrect DOUBLE value: 'September'
Warning	1292	Truncated incorrect DOUBLE value: 'September'
Warning	1292	Truncated incorrect DOUBLE value: 'September'
Warning	1292	Truncated incorrect DOUBLE value: 'August'
Warning	1292	Truncated incorrect DOUBLE value: 'September'
Warning	1292	Truncated incorrect DOUBLE value: 'September'
select monthname(c3)%monthname(c3) from t1;
monthname(c3)%monthname(c3)
NULL
NULL
NULL
NULL
NULL
Warnings:
Warning	1292	Truncated incorrect DOUBLE value: 'September'
Warning	1292	Truncated incorrect DOUBLE value: 'September'
Warning	1292	Truncated incorrect DOUBLE value: 'September'
Warning	1292	Truncated incorrect DOUBLE value: 'September'
Warning	1292	Truncated incorrect DOUBLE value: 'August'
Warning	1292	Truncated incorrect DOUBLE value: 'August'
Warning	1292	Truncated incorrect DOUBLE value: 'September'
Warning	1292	Truncated incorrect DOUBLE value: 'September'
Warning	1292	Truncated incorrect DOUBLE value: 'September'
Warning	1292	Truncated incorrect DOUBLE value: 'September'
select monthname(c3) div monthname(c3) from t1;
monthname(c3) div monthname(c3)
NULL
NULL
NULL
NULL
NULL
Warnings:
Warning	1292	Truncated incorrect DECIMAL value: 'September'
Warning	1292	Truncated incorrect DECIMAL value: 'September'
Warning	1292	Truncated incorrect DECIMAL value: 'September'
Warning	1292	Truncated incorrect DECIMAL value: 'September'
Warning	1292	Truncated incorrect DECIMAL value: 'August'
Warning	1292	Truncated incorrect DECIMAL value: 'August'
Warning	1292	Truncated incorrect DECIMAL value: 'September'
Warning	1292	Truncated incorrect DECIMAL value: 'September'
Warning	1292	Truncated incorrect DECIMAL value: 'September'
Warning	1292	Truncated incorrect DECIMAL value: 'September'
select monthname(c3) mod monthname(c3) from t1;
monthname(c3) mod monthname(c3)
NULL
NULL
NULL
NULL
NULL
Warnings:
Warning	1292	Truncated incorrect DOUBLE value: 'September'
Warning	1292	Truncated incorrect DOUBLE value: 'September'
Warning	1292	Truncated incorrect DOUBLE value: 'September'
Warning	1292	Truncated incorrect DOUBLE value: 'September'
Warning	1292	Truncated incorrect DOUBLE value: 'August'
Warning	1292	Truncated incorrect DOUBLE value: 'August'
Warning	1292	Truncated incorrect DOUBLE value: 'September'
Warning	1292	Truncated incorrect DOUBLE value: 'September'
Warning	1292	Truncated incorrect DOUBLE value: 'September'
Warning	1292	Truncated incorrect DOUBLE value: 'September'
select -monthname(c3) from t1;
-monthname(c3)
-0
-0
-0
-0
-0
Warnings:
Warning	1292	Truncated incorrect DOUBLE value: 'September'
Warning	1292	Truncated incorrect DOUBLE value: 'September'
Warning	1292	Truncated incorrect DOUBLE value: 'August'
Warning	1292	Truncated incorrect DOUBLE value: 'September'
Warning	1292	Truncated incorrect DOUBLE value: 'September'
select +monthname(c3) from t1;
+monthname(c3)
September
September
August
September
September
select distinct monthname(c3) from t1;
monthname(c3)
September
August
select t1.*,monthname(c3) from t1 group by c1;
c1	c2	c3	monthname(c3)
1	test01	2022-09-07	September
2	test02	2022-09-09	September
3	test03	2022-08-20	August
4	test04	2022-09-15	September
5	test05	2022-09-16	September
select t1.*,monthname(c3) from t1 group by monthname(c3);
c1	c2	c3	monthname(c3)
1	test01	2022-09-07	September
3	test03	2022-08-20	August
select t1.*,monthname(c3) from t1 group by monthname(c3) having monthname(c3)>='2020-09-13';
c1	c2	c3	monthname(c3)
1	test01	2022-09-07	September
3	test03	2022-08-20	August
select t1.*,monthname(c3) from t1 order by monthname(c3);
c1	c2	c3	monthname(c3)
3	test03	2022-08-20	August
1	test01	2022-09-07	September
2	test02	2022-09-09	September
4	test04	2022-09-15	September
5	test05	2022-09-16	September
select t1.*,monthname(c3) from t1 order by monthname(c3) desc ;
c1	c2	c3	monthname(c3)
1	test01	2022-09-07	September
2	test02	2022-09-09	September
4	test04	2022-09-15	September
5	test05	2022-09-16	September
3	test03	2022-08-20	August
case when 不支持;已知bug
drop table t2;
drop table t1;
##insert into
create table t1(a bool,b bool);
insert into t1 values(111,111.999999);
select monthname(a) from t1;
monthname(a)
January
select monthname(b) from t1;
monthname(b)
January
drop table t1;
create table t1(a BOOLEAN,b BOOLEAN);
insert into t1 values(111,111.999999);
select monthname(a) from t1;
monthname(a)
January
select monthname(b) from t1;
monthname(b)
January
drop table t1;
create table t1(a TINYINT,b TINYINT);
insert into t1 values(126.999999,12.22);
select monthname(a) from t1;
monthname(a)
January
select monthname(b) from t1;
monthname(b)
NULL
Warnings:
Warning	5086	Not timestamp Can not cast varchar value to timestamp type
drop table t1;
create table t1(a SMALLINT,b SMALLINT);
insert into t1 values(20913.999999,927.1111);
select monthname(a) from t1;
monthname(a)
September
select monthname(b) from t1;
monthname(b)
September
drop table t1;
create table t1(a MEDIUMINT,b MEDIUMINT);
insert into t1 values(220929.99,220927.1111);
select monthname(a) from t1;
monthname(a)
September
select monthname(b) from t1;
monthname(b)
September
drop table t1;
create table t1(a INT,b int);
insert into t1 values(220913.999999,220927.1111);
select monthname(a) from t1;
monthname(a)
September
select monthname(b) from t1;
monthname(b)
September
drop table t1;
create table t1(a INTEGER,b INTEGER);
insert into t1 values(220913.999999,220927.1111);
select monthname(a) from t1;
monthname(a)
September
select monthname(b) from t1;
monthname(b)
September
drop table t1;
create table t1(a BIGINT,b BIGINT);
insert into t1 values(220913.999999,220927.1111);
select monthname(a) from t1;
monthname(a)
September
select monthname(b) from t1;
monthname(b)
September
drop table t1;
create table t1(a DECIMAL,b DECIMAL);
insert into t1 values(220913.999999,220927.1111);
Warnings:
Warning	1265	Data truncated for column 'a' at row 1
Warning	1265	Data truncated for column 'b' at row 1
select monthname(a) from t1;
monthname(a)
September
select monthname(b) from t1;
monthname(b)
September
drop table t1;
create table t1(a NUMERIC,b NUMERIC);
insert into t1 values(220913.999999,220927.1111);
Warnings:
Warning	1265	Data truncated for column 'a' at row 1
Warning	1265	Data truncated for column 'b' at row 1
select monthname(a) from t1;
monthname(a)
September
select monthname(b) from t1;
monthname(b)
September
drop table t1;
create table t1(a FLOAT,b FLOAT);
insert into t1 values(220913.999999,220927.1111);
select monthname(a) from t1;
monthname(a)
September
select monthname(b) from t1;
monthname(b)
September
drop table t1;
create table t1(a DOUBLE,b DOUBLE);
insert into t1 values(220930.999999,220927.1111);
#此处为已知bug，关于double类型导致的结果正确性;
#
select monthname(a) from t1;
monthname(a)
NULL
Warnings:
Warning	5086	Not timestamp Can not cast varchar value to timestamp type
select monthname(b) from t1;
monthname(b)
September
drop table t1;
create table t1(a BIT,b bit);
insert into t1 values(0,1);
select monthname(a) from t1;
monthname(a)
NULL
Warnings:
Warning	5086	Not timestamp Can not cast varchar value to timestamp type
select monthname(b) from t1;
monthname(b)
NULL
Warnings:
Warning	5086	Not timestamp Can not cast varchar value to timestamp type
drop table t1;
create table t1(a DATETIME,b DATETIME);
insert into t1 values(220913,220927);
select monthname(a) from t1;
monthname(a)
September
select monthname(b) from t1;
monthname(b)
September
drop table t1;
create table t1(a TIMESTAMP,b TIMESTAMP);
insert into t1 values('2022-09-13 23:59:59.999999','2038-01-19 03:14:07.999999');
select monthname(a) from t1;
monthname(a)
September
select monthname(b) from t1;
monthname(b)
January
drop table t1;
create table t1(a DATE,b DATE);
insert into t1 values('1970-01-01 23:59:59','2038-01-19 03:14:07');
select monthname(a) from t1;
monthname(a)
January
select monthname(b) from t1;
monthname(b)
January
drop table t1;
create table t1(a TIME,b TIME);
insert into t1 values('23:59:59.999999','2038-01-19 23:59:59.999999');
drop table t1;
create table t1(a YEAR,b year);
insert into t1 values('2022','2038');
select monthname(a) from t1;
monthname(a)
NULL
Warnings:
Warning	5086	Not timestamp Can not cast varchar value to timestamp type
select monthname(b) from t1;
monthname(b)
NULL
Warnings:
Warning	5086	Not timestamp Can not cast varchar value to timestamp type
drop table t1;
create table t1(a VARCHAR(50),b VARCHAR(50));
insert into t1 values('2022-09-27 23:59:59.999999','2038-01-19 23:59:59.999999');
select monthname(a) from t1;
monthname(a)
September
select monthname(b) from t1;
monthname(b)
January
drop table t1;
create table t1(a VARBINARY(50),b VARBINARY(50));
insert into t1 values('2022-09-27 23:59:59.999999','2038-01-19 23:59:59.999999');
select monthname(a) from t1;
monthname(a)
September
select monthname(b) from t1;
monthname(b)
January
drop table t1;
create table t1(a CHAR(50),b CHAR(50));
insert into t1 values('2022-09-27 23:59:59.999999','2038-01-19 23:59:59.999999');
select monthname(a) from t1;
monthname(a)
September
select monthname(b) from t1;
monthname(b)
January
drop table t1;
create table t1(a BINARY(10),b BINARY(10));
insert into t1 values('10111101','11111011');
select monthname(a) from t1;
monthname(a)
NULL
Warnings:
Warning	5086	Not timestamp Can not cast varchar value to timestamp type
select monthname(b) from t1;
monthname(b)
NULL
Warnings:
Warning	5086	Not timestamp Can not cast varchar value to timestamp type
drop table t1;
create table t1(a enum ('2022-09-27 23:59:59.999999','2038-01-19 23:59:59.999999'),b enum ('10111101','11111011'));
insert into t1 values('2022-09-27 23:59:59.999999','10111101');
select monthname(a) from t1;
monthname(a)
September
select monthname(b) from t1;
monthname(b)
November
drop table t1;
create table t1(a set ('2022-09-27 23:59:59.999999','2038-01-19 23:59:59.999999'),b set ('10111101','11111011'));
insert into t1 values('2022-09-27 23:59:59.999999','10111101');
select monthname(a) from t1;
monthname(a)
September
select monthname(b) from t1;
monthname(b)
November
drop table t1;
create table t1(a TINYTEXT,b TINYTEXT);
insert into t1 values('2022-09-27 23:59:59.999999','10111101');
select monthname(a) from t1;
monthname(a)
September
select monthname(b) from t1;
monthname(b)
November
drop table t1;
create table t1(a TINYBLOB,b TINYBLOB);
insert into t1 values('2022-09-27 23:59:59.999999','10111101');
select monthname(a) from t1;
monthname(a)
September
select monthname(b) from t1;
monthname(b)
November
drop table t1;
create table t1(a TEXT,b TEXT);
insert into t1 values('2022-09-27 23:59:59.999999','10111101');
select monthname(a) from t1;
monthname(a)
September
select monthname(b) from t1;
monthname(b)
November
drop table t1;
create table t1(a BLOB,b BLOB);
insert into t1 values('2022-09-27 23:59:59.999999','10111101');
select monthname(a) from t1;
monthname(a)
September
select monthname(b) from t1;
monthname(b)
November
drop table t1;
create table t1(a MEDIUMTEXT,b MEDIUMTEXT);
insert into t1 values('2022-09-27 23:59:59.999999','10111101');
select monthname(a) from t1;
monthname(a)
September
select monthname(b) from t1;
monthname(b)
November
drop table t1;
create table t1(a MEDIUMBLOB,b MEDIUMBLOB);
insert into t1 values('2022-09-27 23:59:59.999999','10111101');
select monthname(a) from t1;
monthname(a)
September
select monthname(b) from t1;
monthname(b)
November
drop table t1;
create table t1(a LONGTEXT,b LONGTEXT);
insert into t1 values('2022-09-27 23:59:59.999999','10111101');
select monthname(a) from t1;
monthname(a)
September
select monthname(b) from t1;
monthname(b)
November
drop table t1;
create table t1(a LONGBLOB,b LONGBLOB);
insert into t1 values('2022-09-27 23:59:59.999999','10111101');
select monthname(a) from t1;
monthname(a)
September
select monthname(b) from t1;
monthname(b)
November
drop table t1;
create table t1 (c1 int ,c2 varchar(40),c3 date);
insert into t1 values(1,'test01','20220811');
insert into t1 values(2,'test02','20220915');
insert into t1 values(3,'test03','2022-08-20');
insert into t1 values(4,'test04','2022-09-15');
select * from t1;
c1	c2	c3
1	test01	2022-08-11
2	test02	2022-09-15
3	test03	2022-08-20
4	test04	2022-09-15
drop table t2;
create table t2 (a1 int ,a2 varchar(20));
insert into t2(a1, a2)  select 1,monthname('2022-09-15');
select * from t2;
a1	a2
1	September
drop table t2;
insert into t1 values(abs(monthname(c3)),UPPER(monthname(c3)),STR_TO_DATE(monthname(c3),GET_FORMAT(DATETIME,'EUR')));
select * from t1;
c1	c2	c3
1	test01	2022-08-11
2	test02	2022-09-15
3	test03	2022-08-20
4	test04	2022-09-15
NULL	NULL	NULL
drop table t1;
## update
create table t1 (c1 int ,c2 varchar(20),c3 date);
insert into t1 values(1,'test01','20220907');
insert into t1 values(2,'test02','20220909');
insert into t1 values(3,'test03','2022-08-20');
insert into t1 values(4,'test04','2022-09-15');
insert into t1 values(5,'test05','2022-09-16');
update t1 set c2= monthname('20220907') where c2='test01';
select * from t1;
c1	c2	c3
1	September	2022-09-07
2	test02	2022-09-09
3	test03	2022-08-20
4	test04	2022-09-15
5	test05	2022-09-16
update t1 set c2= monthname('2022-08-20'),c1=1 where c2 in ('test01','test02');
update t1 set c2= DATE_ADD(monthname(c3),INTERVAL 5 DAY);
ERROR 22007: Incorrect datetime value for column 'c2' at row 1
select * from t1;
c1	c2	c3
1	September	2022-09-07
1	August	2022-09-09
3	test03	2022-08-20
4	test04	2022-09-15
5	test05	2022-09-16
drop table t1;
create table t1(c2 varchar(monthname('2022-09-16')-'Tuesday'));
ERROR 42000: You have an error in your SQL syntax; check the manual that corresponds to your OceanBase version for the right syntax to use near 'monthname('2022-09-16')-'Tuesday'))' at line 1
create table t1(c1 int ,c2 varchar(20) default monthname('2022-09-13'));
ERROR 42000: You have an error in your SQL syntax; check the manual that corresponds to your OceanBase version for the right syntax to use near 'monthname('2022-09-13'))' at line 1
create table t1(c1 int, c2 varchar(20) GENERATED ALWAYS AS (monthname('2022-09-13')) STORED NOT NULL COMMENT '日期');
drop table t1;
##delete
create table t1 (c1 int ,c2 varchar(20),c3 date);
insert into t1 values(1,monthname('20220907'),'20220907');
insert into t1 values(2,monthname(20220909),'20220909');
insert into t1 values(3,monthname('2022-08-20'),'2022-08-20');
insert into t1 values(4,monthname('2022-09-15'),'2022-09-15');
insert into t1 values(5,monthname('2022-09-16'),'2022-09-16');
select * from t1;
c1	c2	c3
1	September	2022-09-07
2	September	2022-09-09
3	August	2022-08-20
4	September	2022-09-15
5	September	2022-09-16
delete  from t1 where c2 = monthname('2022-09-16');
delete from t1 where monthname(c3) = 'Saturday';
select * from t1;
c1	c2	c3
3	August	2022-08-20
drop table t1;
create table t1(c1 int, c2 varchar(30));
alter  table t1 modify  column c1 int(monthname('2022-09-13'));
ERROR 42000: You have an error in your SQL syntax; check the manual that corresponds to your OceanBase version for the right syntax to use near 'monthname('2022-09-13'))' at line 1
alter  table t1 modify  column c1 varchar(30)  DEFAULT monthname('2022-09-13');
ERROR 42000: You have an error in your SQL syntax; check the manual that corresponds to your OceanBase version for the right syntax to use near 'monthname('2022-09-13')' at line 1
alter  table t1 modify  column c1 varchar(30)  GENERATED ALWAYS AS (monthname('2022-09-13')) STORED NOT NULL COMMENT '日期';
ERROR HY000: 'Changing the STORED status' is not supported for generated columns.
drop table t1;
create table t1 (c1 int primary key, c2 varchar(30)) partition by hash(monthname(c1)) partitions 3;
ERROR HY000: This partition function is not allowed
create table t1 (c1 int primary key, c2 varchar(30)) partition by hash(c1) partitions 3;
insert into t1 values(1,monthname('2022-09-15'));
insert into t1 values(2,monthname('2022-09-16'));
insert into t1 values(3,monthname('2022-09-17'));
insert into t1 values(4,monthname('2022-09-18'));
select * from t1;
c1	c2
3	September
1	September
4	September
2	September
update t1 set c2 =monthname('2022-09-19');
delete from t1 where c2 =monthname('2022-09-19');
select * from t1;
c1	c2
drop table t1;
drop table t1;
create table t1 (c1 int primary key, c2 varchar(30)) partition by range(c1) (
PARTITION p0 VALUES LESS THAN (2),
PARTITION p1 VALUES LESS THAN (4),
PARTITION p2 VALUES LESS THAN (6)
);
insert into t1 values(1,monthname('2022-09-15'));
insert into t1 values(2,monthname('2022-09-16'));
insert into t1 values(3,monthname('2022-09-17'));
insert into t1 values(5,monthname('2022-09-18'));
select * from t1;
c1	c2
1	September
2	September
3	September
5	September
update t1 set c2 =monthname('2022-09-19');
delete from t1 where c2 =monthname('2022-09-19');
select * from t1;
c1	c2
drop table t1;
drop table t1;
create table t1 (c1 int primary key, c2 varchar(30)) partition by list(c1) (
PARTITION p0 VALUES IN (1,2),
PARTITION p1 VALUES IN (3,4),
PARTITION p2 VALUES IN (5,6)
);
insert into t1 values(1,monthname('2022-09-15'));
insert into t1 values(2,monthname('2022-09-16'));
insert into t1 values(3,monthname('2022-09-17'));
insert into t1 values(5,monthname('2022-09-18'));
select * from t1;
c1	c2
1	September
2	September
3	September
5	September
update t1 set c2 =monthname('2022-09-19');
delete from t1 where c2 =monthname('2022-09-19');
select * from t1;
c1	c2
drop table t1;
drop table t1;
create table t1 (c1 int primary key, c2 varchar(30)) partition by key(monthname(c1)) partitions 3;
ERROR 42000: You have an error in your SQL syntax; check the manual that corresponds to your OceanBase version for the right syntax to use near '(c1)) partitions 3' at line 1
create table t1 (c1 int primary key, c2 varchar(30)) partition by key(c1) partitions 3;
insert into t1 values(1,monthname('2022-09-15'));
insert into t1 values(2,monthname('2022-09-16'));
insert into t1 values(3,monthname('2022-09-17'));
insert into t1 values(4,monthname('2022-09-18'));
select * from t1;
c1	c2
4	September
3	September
1	September
2	September
update t1 set c2 =monthname('2022-09-19');
delete from t1 where c2 =monthname('2022-09-19');
select * from t1;
c1	c2
drop table t1;
## 视图
drop table t1;
create table t1 (c1 int ,c2 varchar(20),c3 date);
insert into t1 values(1,'test01','20220907');
insert into t1 values(2,'test02','20220909');
insert into t1 values(3,'test03','2022-08-20');
insert into t1 values(4,'test04','2022-09-15');
insert into t1 values(5,'test05','2022-09-16');
drop view t1_view;
create view t1_view as select * from t1;
select * from t1_view;
c1	c2	c3
1	test01	2022-09-07
2	test02	2022-09-09
3	test03	2022-08-20
4	test04	2022-09-15
5	test05	2022-09-16
##where条件后跟表达式会导致断开连接 为已知BUG 待修复测试;
insert into t1_view(c2) values(monthname('202209167'));
ERROR 22007: Incorrect datetime value for column 'c2' at row 1
insert into t1_view(c2) values(monthname('20220916'));
insert into t1_view(c1,c2,c3) values(0,monthname('20220914'),'20220914');
insert into t1_view(c1,c2,c3) values(6,monthname('20220918'),'20220918');
delete from t1_view where c2=monthname('20220918');
delete from t1_view where c2=monthname('0000');
ERROR 22007: Incorrect value
drop table t1;
drop view t1_view;
##PL块
drop table t1;
drop table t2;
DROP PROCEDURE pro1;
CREATE  PROCEDURE pro1( out a varchar(30))
begin
select monthname('2022-09-14') into a;
end;
//
CALL pro1(@aa);
select @aa;
@aa
September
DROP PROCEDURE pro1;
DROP PROCEDURE pro2;
CREATE  PROCEDURE pro2( out b int)
begin
select monthname('2022-09-14') into b;
end;
//
CALL pro2(@bb);
ERROR HY000: Incorrect integer value
select @bb;
@bb
NULL
DROP PROCEDURE pro2;
drop table t1;
create table t1(c1 int,c2 varchar(30));
DROP PROCEDURE pro3;
CREATE PROCEDURE pro3(in a varchar(20))
begin
declare i int;
set i=20220910;
while i <=20220914  DO
if i > a then
select monthname(i);
end if;
insert into t1 values(i,monthname(i));
set i = i + 1;
end WHILE;
end;
//
CALL pro3(20220920);
DROP PROCEDURE pro3;
drop table t1;
create table t1(c1 int,c2 varchar(30));
DROP PROCEDURE pro4;
CREATE PROCEDURE pro4(in a int)
begin
declare i int;
declare b int;
set i=20220910;
while i <=20220914  DO
if a =20220920 then
select monthname(a);
end if;
insert into t1 values(a ,monthname(a));
set i = i + 1;
end WHILE;
select a into b;
end;
//
CALL pro4(20220920);
monthname(a)
monthname(a)
monthname(a)
monthname(a)
monthname(a)
September
September
September
September
September
select * from t1;
c1	c2
20220920	September
20220920	September
20220920	September
20220920	September
20220920	September
DROP PROCEDURE pro4;
drop table t1;
create table t1(c1 int,c2 varchar(30));
drop function  f1;
create function f1(aa  int) returns varchar(30)
begin
return monthname(aa);
end;
//
select f1(20220914);
f1(20220914)
September
drop table t1;
drop function  f1;
##insert型触发器
drop table t1;
drop table t2;
drop trigger t1_trigger;
create table t1 (c1 int ,c2 varchar(20),c3 date);
insert into t1 values(1,'test01','20220907');
insert into t1 values(2,'test02','20220909');
insert into t1 values(3,'test03','2022-08-20');
insert into t1 values(4,'test04','2022-09-15');
insert into t1 values(5,'test05','2022-09-16');
select * from t1;
c1	c2	c3
1	test01	2022-09-07
2	test02	2022-09-09
3	test03	2022-08-20
4	test04	2022-09-15
5	test05	2022-09-16
create table t2 (a1 int ,a2 varchar(20));
insert into t2 values(1,'test08');
insert into t2 values(2,'test09');
select * from t2;
a1	a2
1	test08
2	test09
create trigger t1_trigger after insert on  t2
for each row
begin 
update t1 set c2=monthname('2022-09-16') where c3="2022-09-16";
end //
insert into t2 values(3,'test03');
##update型触发器
drop table t1;
drop table t2;
drop trigger t1_trigger;
create table t1 (c1 int ,c2 varchar(20),c3 date);
insert into t1 values(1,'test01','20220907');
insert into t1 values(2,'test02','20220909');
insert into t1 values(3,'test03','2022-08-20');
insert into t1 values(4,'test04','2022-09-15');
insert into t1 values(5,'test05','2022-09-16');
select * from t1;
c1	c2	c3
1	test01	2022-09-07
2	test02	2022-09-09
3	test03	2022-08-20
4	test04	2022-09-15
5	test05	2022-09-16
create table t2 (a1 int ,a2 varchar(20));
insert into t2 values(1,'test08');
insert into t2 values(2,'test09');
select * from t2;
a1	a2
1	test08
2	test09
create trigger t1_trigger after update on  t2
for each row
begin 
update t1 set c2=monthname('2022-09-16') where c3="2022-09-16";
end //
update t2 set a2=monthname('2022-09-15') where a1=1;
##delete型触发器
drop table t1;
drop table t2;
drop trigger t1_trigger;
create table t1 (c1 int ,c2 varchar(20),c3 date);
insert into t1 values(1,'test01','20220907');
insert into t1 values(2,'test02','20220909');
insert into t1 values(3,'test03','2022-08-20');
insert into t1 values(4,'test04','2022-09-15');
insert into t1 values(5,'test05','2022-09-16');
select * from t1;
c1	c2	c3
1	test01	2022-09-07
2	test02	2022-09-09
3	test03	2022-08-20
4	test04	2022-09-15
5	test05	2022-09-16
create table t2 (a1 int ,a2 varchar(20));
insert into t2 values(1,'test08');
insert into t2 values(2,'test09');
select * from t2;
a1	a2
1	test08
2	test09
create trigger t1_trigger after delete on  t2
for each row
begin 
update t1 set c2=monthname('2022-09-16') where c3="2022-09-16";
end //
delete from t2 where a1=2;
drop table t1;
drop table t2;
drop trigger t1_trigger;
##约束
drop table t1;
create table t1(c1 varchar(20) primary key,c2 varchar(20) default '10');
drop table t2;
create table t2(a1 varchar(20) unique key ,a2 varchar(20),a3 varchar(20),CONSTRAINT for_key FOREIGN KEY (a3) REFERENCES  t1 (c1));
drop table t3;
create table t3(b1 varchar(20) not null ,b2 varchar(20));
insert into t1 values(monthname('2022-09-14'),monthname('2022-09-15'));
insert into t1(c1) values(monthname('2022-09-16'));
ERROR 23000: Duplicate entry 'September' for key 'PRIMARY'
update t1 set c1=monthname('2022-09-17'),c2=monthname('2022-09-18') where c2='10';
select * from t1;
c1	c2
September	September
insert into t2 values(monthname('2022-09-14'),'test',monthname('2022-09-15'));
insert into t2 values('test',monthname('2022-09-18'),monthname('2022-09-17'));
select * from t2;
a1	a2	a3
September	test	September
test	September	September
update t2 set a1=monthname('2022-09-18') where a3=monthname('2022-09-17');
ERROR 23000: Duplicate entry 'September' for key 'a1'
update t2 set a3=monthname('2022-09-19');
update t3 set b1=null;
insert into t3 values(monthname('2022-09-18'),monthname('2022-09-16'));
select * from t3;
b1	b2
September	September
##索引
CREATE INDEX indexName ON t1 (c1);
insert into t1 values(monthname('2022-09-18'),monthname('2022-09-19'));
ERROR 23000: Duplicate entry 'September' for key 'PRIMARY'
update t1 set c2=('2022-09-20')  where c2=monthname('2022-09-19');
select * from t1 ;
c1	c2
September	2022-09-20
########清空回收站，删除测试数据库，表等 ##########
drop table t2;
drop table t1;
drop database  IF EXISTS db1;
