drop database if exists db1;
create database db1;
use db1;
#PL
#procedure
drop table if exists t1;
Warnings:
Note	1051	Unknown table 'db1.t1'
create table t1(c1 int,c2 int,c3 char(100));
drop procedure if exists pro1;
CREATE  PROCEDURE pro1()
begin
declare j int;
declare i int;
set j = 5;
set i = 1;
while i <= j DO
insert into t1 values(i,month(20201212+1),month('2022-02-02'));
set i = i + 1;
end WHILE;
end
//
call pro1();
select * from t1;
c1	c2	c3
1	12	2
2	12	2
3	12	2
4	12	2
5	12	2
drop   procedure if   exists   pro1;
create procedure pro1(aa int,bb int)
begin
if aa = bb then
update t1 set c2 = month('2008-08-08') where c1 = 2 ;
elseif aa > bb then
update t1 set c2 = month('1998-08-08') where c1 = 1 ;
else
update t1 set c2 = month('1978-08-08') where c1 = 3 ;
end if;
end
//
call pro1(1,1);
call pro1(2,1);
call pro1(0,1);
select * from t1;
c1	c2	c3
1	8	2
2	8	2
3	8	2
4	12	2
5	12	2
drop   procedure if   exists   pro1;
create procedure pro1()
begin
declare i int default 1;
while i <= 10 do
if mod(i,10) = 0 then
insert into t1 values(6,month('1981-01-01'),month(19810101));
elseif mod(i,8)=0 then
insert into t1 values(7,month('1987-07-07'),month(19870707));
elseif mod(i,7)=0 then
insert into t1 values(8,month('1988-08-08'),month(19880808));
elseif mod(i,5)=0 then
insert into t1 values(9,month('1909-09-09'),month(19990909));
elseif mod(i,3)=0 then
insert into t1 values(10,month('2010-10-10'),month(20101010));
else
insert into t1 values(11,month('2011-11-11'),month(20111101));
end if;
set i = i+1;
end while;
end
//
call pro1();
select * from t1;
c1	c2	c3
1	8	2
2	8	2
3	8	2
4	12	2
5	12	2
11	11	11
11	11	11
10	10	10
11	11	11
9	9	9
10	10	10
8	8	8
7	7	7
10	10	10
6	1	1
drop   procedure if   exists   pro1;
create procedure pro1(aa int,bb int)
begin
if aa = bb then
delete from t1 where c1 > 1 and c2 = month('1988-10-02');
elseif aa > bb then
delete from t1 where c2 > month('2011-02-02') and c3 = month('2011-02-02');
else
delete from t1 where c3 = month('1998-02-02');
end if;
end
//
call pro1(1,1);
call pro1(2,1);
call pro1(0,1);
select * from t1;
c1	c2	c3
11	11	11
11	11	11
11	11	11
9	9	9
8	8	8
7	7	7
6	1	1
drop   procedure if   exists   pro1;
create procedure pro1(aa int,bb int)
begin
if aa = bb then
select month('2020-10-10'),month(20201010),month('2004-02-30');
elseif aa > bb then
select month('0001-10-10'),month(99991231),month('0002-02-30');
else
select month('5000-10-10'),month(50001010),month('2999-02-30');
end if;
end
//
call pro1(1,1);
month('2020-10-10')	month(20201010)	month('2004-02-30')
10	10	NULL
Warnings:
Warning	5086	Not timestamp Can not cast varchar value to timestamp type
call pro1(2,1);
month('0001-10-10')	month(99991231)	month('0002-02-30')
10	12	NULL
Warnings:
Warning	5086	Not timestamp Can not cast varchar value to timestamp type
call pro1(0,1);
month('5000-10-10')	month(50001010)	month('2999-02-30')
10	10	NULL
Warnings:
Warning	5086	Not timestamp Can not cast varchar value to timestamp type
#function
drop table if exists t1;
create table t1(c1 int,c2 int,c3 char(100));
drop function if exists func1;
CREATE  function func1() returns int
begin
declare j int;
declare i int;
set j = 5;
set i = 1;
while i <= j DO
insert into t1 values(i,month(20201212+1),month('2022-02-02'));
set i = i + 1;
end WHILE;
return month('2022-09-15');
end
//
select func1();
func1()
9
select * from t1;
c1	c2	c3
1	12	2
2	12	2
3	12	2
4	12	2
5	12	2
drop function if exists func1;
create function func1(aa int,bb int) returns int
begin
if aa = bb then
update t1 set c2 = month('2008-08-08') where c1 = 2 ;
elseif aa > bb then
update t1 set c2 = month('1998-08-08') where c1 = 1 ;
else
update t1 set c2 = month('1978-08-08') where c1 = 3 ;
end if;
return month('0001-01-01');
end
//
select func1(1,1);
func1(1,1)
1
select func1(2,1);
func1(2,1)
1
select func1(0,1);
func1(0,1)
1
select * from t1;
c1	c2	c3
1	8	2
2	8	2
3	8	2
4	12	2
5	12	2
drop function if exists func1;
create function func1() returns int
begin
declare i int default 1;
while i <= 10 do
if mod(i,10) = 0 then
insert into t1 values(6,month('1981-01-01'),month(19810101));
elseif mod(i,8)=0 then
insert into t1 values(7,month('1987-07-07'),month(19870707));
elseif mod(i,7)=0 then
insert into t1 values(8,month('1988-08-08'),month(19880808));
elseif mod(i,5)=0 then
insert into t1 values(9,month('1909-09-09'),month(19990909));
elseif mod(i,3)=0 then
insert into t1 values(10,month('2010-10-10'),month(20101010));
else
insert into t1 values(11,month('2011-11-11'),month(20111101));
end if;
set i = i+1;
end while;
return month('2008-08-08');
end
//
select func1();
func1()
8
select * from t1;
c1	c2	c3
1	8	2
2	8	2
3	8	2
4	12	2
5	12	2
11	11	11
11	11	11
10	10	10
11	11	11
9	9	9
10	10	10
8	8	8
7	7	7
10	10	10
6	1	1
drop function if exists func1;
create function func1(aa int,bb int) returns int
begin
if aa = bb then
delete from t1 where c1 > 1 and c2 = month('1988-02-02');
elseif aa > bb then
delete from t1 where c2 > month('2011-02-02') and c3 = month('2011-02-02');
else
delete from t1 where c3 = month('1998-02-02');
end if;
return month(19980909);
end
//
select func1(1,1);
func1(1,1)
9
select func1(2,1);
func1(2,1)
9
select func1(0,1);
func1(0,1)
9
select * from t1;
c1	c2	c3
11	11	11
11	11	11
10	10	10
11	11	11
9	9	9
10	10	10
8	8	8
7	7	7
10	10	10
6	1	1
#trigger
drop   table     if   exists   t1;
drop   table     if   exists   t2;
Warnings:
Note	1051	Unknown table 'db1.t2'
create table t1(c1 int,c2 int);
insert into t1 values(1,10);
insert into t1 values(2,11);
create table t2(a1 int,a2 varchar(20));
insert into t2 values(2,'AA');
insert into t2 values(3,'cc');
drop trigger if exists tg1;
Warnings:
Note	1360	Trigger does not exist
create trigger tg1
AFTER
insert on t2
for each ROW
BEGIN
insert t1 values(month('2001-03-05'),month('2000/04/06'));
END
//
insert into t2 values(1,1);
select * from t1;
c1	c2
1	10
2	11
3	4
drop trigger if exists tg1;
create trigger tg1
AFTER
update on t2
for each ROW
BEGIN
update t1 set c1 = month('20100909') where c2 = month('2010-10-10');
END
//
update t2 set a1 = 4 where a2 = 'AA';
select * from t1;
c1	c2
9	10
2	11
3	4
drop trigger if exists tg1;
create trigger tg1
AFTER
delete on t2
for each ROW
BEGIN
delete from t1 where c1 = month('2010^09^09');
END
//
delete from t2 where a1 = 3;
select * from t1;
c1	c2
2	11
3	4
drop database db1;
