drop database if exists db1;
create database db1;
use db1;
#参数
select second('01:01:01');
second('01:01:01')
1
select second('00:00:01');
second('00:00:01')
1
select second('23:59:59.9');
second('23:59:59.9')
59
select second('00:00:00');
second('00:00:00')
0
select second('08:08:60');
second('08:08:60')
NULL
Warnings:
Warning	5086	Not timestamp Can not cast varchar value to timestamp type
select second('22:12:-10');
second('22:12:-10')
0
select second('22:-12:-10');
second('22:-12:-10')
22
select second('-24:-22:-22');
second('-24:-22:-22')
24
select second('02:-59:-59');
second('02:-59:-59')
2
select second('08:08:8.11223344');
second('08:08:8.11223344')
8
select second('15:2.6789:3.111');
second('15:2.6789:3.111')
0
select second('0.555:55:55');
second('0.555:55:55')
0
select second('0.5:55:60');
second('0.5:55:60')
0
select second('0.99:71:88');
second('0.99:71:88')
0
select second('66:05.5:0.6');
second('66:05.5:0.6')
0
select second('20:60:05');
second('20:60:05')
NULL
Warnings:
Warning	5086	Not timestamp Can not cast varchar value to timestamp type
select second('20:59.9:61.00');
second('20:59.9:61.00')
0
SELECT second('AA:05:05');
second('AA:05:05')
NULL
Warnings:
Warning	5086	Not timestamp Can not cast varchar value to timestamp type
select second('12:12:AA');
second('12:12:AA')
0
#YYYYY^MM^DD HH+MM+SS
select second('2020^01^02 16+01+30');
second('2020^01^02 16+01+30')
30
select second('2020^07^02 24+26.5+00');
second('2020^07^02 24+26.5+00')
NULL
Warnings:
Warning	5086	Not timestamp Can not cast varchar value to timestamp type
select second('2020^09^02 22+30+20');
second('2020^09^02 22+30+20')
20
select second('2020^12^02 23+30+33');
second('2020^12^02 23+30+33')
33
select second('2020^03^29 23+6+11');
second('2020^03^29 23+6+11')
11
select second('2020^13^29 23+8+22');
second('2020^13^29 23+8+22')
NULL
Warnings:
Warning	5086	Not timestamp Can not cast varchar value to timestamp type
#YY^MM^DD HH+MM+SS
#OB与MYSQL不一致。OB返回NULL,MYSQL返回'20'
select second('88^00^02 16+20+11');
second('88^00^02 16+20+11')
11
select second('77^01^02 24+26.5+05');
second('77^01^02 24+26.5+05')
NULL
Warnings:
Warning	5086	Not timestamp Can not cast varchar value to timestamp type
select second('66^03^02 22+05+17');
second('66^03^02 22+05+17')
17
select second('55^5^02 15+07+29');
second('55^5^02 15+07+29')
29
select second('44^7^29 12+59+03');
second('44^7^29 12+59+03')
3
select second('33^13^29 20+59+59');
second('33^13^29 20+59+59')
NULL
Warnings:
Warning	5086	Not timestamp Can not cast varchar value to timestamp type
#YYYY@MM@DD HH^MM^SS
select second('2020@09@02 22^15^66');
second('2020@09@02 22^15^66')
NULL
Warnings:
Warning	5086	Not timestamp Can not cast varchar value to timestamp type
select second('2020@12@02 23^45^50');
second('2020@12@02 23^45^50')
50
select second('2020@03@29 23^30^30');
second('2020@03@29 23^30^30')
30
select second('2020@13@29 23^59^59');
second('2020@13@29 23^59^59')
NULL
Warnings:
Warning	5086	Not timestamp Can not cast varchar value to timestamp type
#YY@MM@DD HH^MM^SS
select second('01@09@02 22^15^66');
second('01@09@02 22^15^66')
NULL
Warnings:
Warning	5086	Not timestamp Can not cast varchar value to timestamp type
select second('80@12@02 23^45^50');
second('80@12@02 23^45^50')
50
select second('50@03@29 23^30^30');
second('50@03@29 23^30^30')
30
select second('10@13@29 23^59^59');
second('10@13@29 23^59^59')
NULL
Warnings:
Warning	5086	Not timestamp Can not cast varchar value to timestamp type
#参数为字符串
select second('155959');
second('155959')
59
select second('0050505');
second('0050505')
5
select second('080000');
second('080000')
0
select second('125960');
second('125960')
NULL
Warnings:
Warning	5086	Not timestamp Can not cast varchar value to timestamp type
select second('9991111');
second('9991111')
59
select second('12h22m33s');
second('12h22m33s')
12
select second('20A15B16C');
second('20A15B16C')
20
select second('2');
second('2')
2
select second('2');
second('2')
2
select second('222');
second('222')
22
select second('2222');
second('2222')
22
select second('22222');
second('22222')
22
select second('222222');
second('222222')
22
select second('2222222');
second('2222222')
22
select second('22222222');
second('22222222')
59
select second('20220926151050');
second('20220926151050')
50
select second('20220926155000');
second('20220926155000')
0
select second('202209261500AA50');
second('202209261500AA50')
NULL
Warnings:
Warning	5086	Not timestamp Can not cast varchar value to timestamp type
#参数为日期格式
select second('2020-02-02 16:00:00');
second('2020-02-02 16:00:00')
0
select second('2020-02-02 24:26:27.7');
second('2020-02-02 24:26:27.7')
NULL
Warnings:
Warning	5086	Not timestamp Can not cast varchar value to timestamp type
select second('2020-02-02 22:00:30');
second('2020-02-02 22:00:30')
30
select second('2020-02-02 23:59:59');
second('2020-02-02 23:59:59')
59
select second('2020-02-30 23:59:59');
second('2020-02-30 23:59:59')
NULL
Warnings:
Warning	5086	Not timestamp Can not cast varchar value to timestamp type
#OB返回NULL，与MYSQL不一致。
select second('0000-00-00 00:00:01');
second('0000-00-00 00:00:01')
1
select second('2008-08-08 23:50:00');
second('2008-08-08 23:50:00')
0
select second('2008-08-08 24:50:-1');
second('2008-08-08 24:50:-1')
NULL
Warnings:
Warning	5086	Not timestamp Can not cast varchar value to timestamp type
select second('2008-08-08 23:00:50');
second('2008-08-08 23:00:50')
50
select second('2008-08-08 23:-50:-2');
second('2008-08-08 23:-50:-2')
2
select second('2008-08-08 2:50:50');
second('2008-08-08 2:50:50')
50
#多个参数
select second('10:10:10','11:11:11');
ERROR 42000: You have an error in your SQL syntax; check the manual that corresponds to your OceanBase version for the right syntax to use near ','11:11:11')' at line 1
#为空
select second('');
second('')
NULL
Warnings:
Warning	5086	Not timestamp Can not cast varchar value to timestamp type
select second('0');
second('0')
0
#OB与MYSQL结果不一致。
select second(' ');
second(' ')
NULL
Warnings:
Warning	5086	Not timestamp Can not cast varchar value to timestamp type
#参数为数字
select second(155959);
second(155959)
59
select second(0050505);
second(0050505)
5
select second(080000);
second(080000)
0
select second(125960);
second(125960)
NULL
Warnings:
Warning	5086	Not timestamp Can not cast varchar value to timestamp type
select second(9991111);
second(9991111)
NULL
Warnings:
Warning	5086	Not timestamp Can not cast varchar value to timestamp type
select second(-121212);
second(-121212)
12
select second(634);
second(634)
34
select second(060304);
second(060304)
4
select second(055660);
second(055660)
NULL
Warnings:
Warning	5086	Not timestamp Can not cast varchar value to timestamp type
select second(20220927141516);
second(20220927141516)
16
#参数为中文
select second('12时22分2秒');
second('12时22分2秒')
12
select second('2022年9月21日 12时22分2秒');
second('2022年9月21日 12时22分2秒')
2
select second('2022年9月21日 12时02分60秒');
second('2022年9月21日 12时02分60秒')
NULL
Warnings:
Warning	5086	Not timestamp Can not cast varchar value to timestamp type
select second('2022年9月21日 12时60分2秒');
second('2022年9月21日 12时60分2秒')
NULL
Warnings:
Warning	5086	Not timestamp Can not cast varchar value to timestamp type
select second('十时四分二十秒');
second('十时四分二十秒')
NULL
Warnings:
Warning	5086	Not timestamp Can not cast varchar value to timestamp type
select second('张三');
second('张三')
NULL
Warnings:
Warning	5086	Not timestamp Can not cast varchar value to timestamp type
#特殊字符
select second('@##%');
second('@##%')
NULL
Warnings:
Warning	5086	Not timestamp Can not cast varchar value to timestamp type
select second('@222#1#%$%3');
second('@222#1#%$%3')
NULL
Warnings:
Warning	5086	Not timestamp Can not cast varchar value to timestamp type
select second('@#%#%^#%');
second('@#%#%^#%')
NULL
Warnings:
Warning	5086	Not timestamp Can not cast varchar value to timestamp type
select second('/*-+*-*-');
second('/*-+*-*-')
NULL
Warnings:
Warning	5086	Not timestamp Can not cast varchar value to timestamp type
select second('{:}}{":"');
second('{:}}{":"')
NULL
Warnings:
Warning	5086	Not timestamp Can not cast varchar value to timestamp type
#参数为不同数据类型
#INT
create table test1(c1 int , c2 int);
insert into test1 values(163535,020260);
select second(c1) from test1;
second(c1)
35
select second(c2) from test1;
second(c2)
NULL
Warnings:
Warning	5086	Not timestamp Can not cast varchar value to timestamp type
drop table test1;
#FLOAT
create table test1(c1 float , c2 float);
insert into test1 values(60.6060,121212.1212);
select second(c1) from test1;
second(c1)
NULL
Warnings:
Warning	5086	Not timestamp Can not cast varchar value to timestamp type
select second(c2) from test1;
second(c2)
12
drop table test1;
#DOUBLE
create table test1(c1 double , c2 double);
insert into test1 values(23.5959,161616.11111);
select second(c1) from test1;
second(c1)
23
select second(c2) from test1;
second(c2)
16
drop table test1;
#CHAR
create table test1(c1 char(100),c2 char(100));
insert into test1 values('181818','2022-09-21 16:38:00');
select second(c1) from test1;
second(c1)
18
select second(c2) from test1;
second(c2)
0
drop table test1;
#varchar
create table test1(c1 varchar(100),c2 varchar(100));
insert into test1 values('2000-01-01','20200202020202');
select second(c1) from test1;
second(c1)
0
select second(c2) from test1;
second(c2)
2
drop table test1;
#date
create table test1(c1 date,c2 date);
insert into test1 values('1000-01-01 10:10:55','10000101121231');
select second(c1) from test1;
second(c1)
0
select second(c2) from test1;
second(c2)
0
drop table test1;
#time
create table test1(c1 time,c2 time);
insert into test1 values('10:10:10','15:41:20');
select second(c1) from test1;
second(c1)
10
select second(c2) from test1;
second(c2)
20
drop table test1;
#year
#OB与MYSQL结果不一致
#datetime
create table test1(c1 datetime,c2 datetime);
insert into test1 values('9999-12-31 23:59:59','1000-01-01 00:00:00');
select second(c1) from test1;
second(c1)
59
select second(c2) from test1;
second(c2)
0
drop table test1;
#timestamp
create table test1(c1 timestamp,c2 timestamp);
insert into test1 values('1970-01-01 01:01:01','2038-01-19 03:14:07');
select second(c1) from test1;
second(c1)
1
select second(c2) from test1;
second(c2)
7
drop table test1;
#decimal
create table test1(c1 decimal(5,2),c2 decimal(15,5));
insert into test1 values(202.12,20210922.1030);
select second(c1) from test1;
second(c1)
2
#OB与MYSQL结果不一致。
drop table test1;
#bit
create table test1(c1 bit(64),c2 bit(64));
insert into test1 values(20200202,b'11101010101');
select second(c1) from test1;
second(c1)
NULL
Warnings:
Warning	5086	Not timestamp Can not cast varchar value to timestamp type
select second(c2) from test1;
second(c2)
NULL
Warnings:
Warning	5086	Not timestamp Can not cast varchar value to timestamp type
drop table test1;
#enum
create table test1(c1 enum('16:50:59','101010','2020-02-02 13:13:13'));
insert into test1 values('16:50:59');
insert into test1 values('101010');
insert into test1 values('2020-02-02 13:13:13');
select second(c1) from test1;
second(c1)
59
10
13
drop table test1;
#set
create table test1(c1 set('16:50:59','101010','2020-02-02 13:13:13'));
insert into test1 values('16:50:59');
insert into test1 values('101010');
insert into test1 values('2020-02-02 13:13:13');
select second(c1) from test1;
second(c1)
59
10
13
drop table test1;
#select
drop table if exists t1;
Warnings:
Note	1051	Unknown table 'db1.t1'
create table t1(c1 int ,c2 varchar(60) not null,c3 datetime default '1999-09-09 18:16:16');
insert into t1 values(161050,'18:20:30','2001-02-02 03:30:03');
insert into t1(c1,c2) values(051501,'04:25:50');
insert into t1 values(071313,'082308','1880-05-05 05:33:05');
insert into t1 values(101010,'11:11:11','0001-01-01 01:01:01');
insert into t1(c1,c2) values(121212,'15:20:20');
insert into t1 values(164050,'20220926055005','0001-01-01 01:01:01');
insert into t1 values(101010,'2020.02.02','0001-01-01 01:01:01');
select second(c1),second(c2),second(c3) from t1 order by second(c1);
second(c1)	second(c2)	second(c3)
1	50	16
10	11	1
10	20	1
12	20	16
13	8	5
50	30	3
50	5	1
#where
select second(c1) from t1 where second(c1) > 20 and second(c2) <=50;
second(c1)
50
50
select second(c3) from t1 where second(c2) < 30 and second(c3) >10;
second(c3)
16
select second(c2) from t1 where second(c1)<30 order by second(c2);
second(c2)
8
11
20
20
50
select c1,case second(c1) when second(c1)> 5 then second('202020') else second('101010') end as a from t1;
c1	a
161050	10
51501	10
71313	10
101010	10
121212	10
164050	10
101010	10
select c1, case c2 when '11111111' then second('1111') else second('080808') end as a from t1;
c1	a
161050	8
51501	8
71313	8
101010	8
121212	8
164050	8
101010	8
select distinct second(c1),c2,c3 from t1 order by second(c1);
second(c1)	c2	c3
1	04:25:50	1999-09-09 18:16:16
10	11:11:11	0001-01-01 01:01:01
10	2020.02.02	0001-01-01 01:01:01
12	15:20:20	1999-09-09 18:16:16
13	082308	1880-05-05 05:33:05
50	18:20:30	2001-02-02 03:30:03
50	20220926055005	0001-01-01 01:01:01
select distinct second(c3) ,c1,c3 from t1 order by second(c3);
second(c3)	c1	c3
1	101010	0001-01-01 01:01:01
1	164050	0001-01-01 01:01:01
3	161050	2001-02-02 03:30:03
5	71313	1880-05-05 05:33:05
16	51501	1999-09-09 18:16:16
16	121212	1999-09-09 18:16:16
select second(c1) from t1 group by c1 having second(c1) >=10;
second(c1)
50
13
10
12
50
drop table t1;
#insert    不同数据类型插入
#INT
create table test1(c1 int , c2 int);
insert into test1 values(second('18:50:50'),second('101515'));
insert into test1 values(second('20:08:08'),second('90:59:59'));
select * from test1;
c1	c2
50	15
8	59
drop table test1;
#FLOAT
create table test1(c1 float , c2 float);
insert into test1 values(second('195045'),second('2020-02-02 12:30:30'));
insert into test1 values(second('13:01:01'),second('19980909090909'));
select * from test1;
c1	c2
45	30
1	9
drop table test1;
#double
create table test1(c1 double , c2 double);
insert into test1 values(second('20220926161010'),second('12:12:12'));
insert into test1 values(second('08:50:50'),second('101112'));
select * from test1;
c1	c2
10	12
50	12
drop table test1;
#char(100)
create table test1(c1 char(100),c2 char(100));
insert into test1 values(second('341122'),second('2121-01-01 23:30:30'));
insert into test1 values(second('1101-01-01 14:20:20'),second('222201'));
select * from test1;
c1	c2
22	30
20	1
drop table test1;
#varchar
create table test1(c1 varchar(100),c2 varchar(100));
insert into test1 values(second('1998-09-09 20:20:20'),second(101010));
insert into test1 values(second('222211'),second('9999-09-19 09:09:09'));
select * from test1;
c1	c2
20	10
11	9
drop table test1;
#date
create table test1(c1 date,c2 date);
insert into test1 values(second('010101'),second('020202'));
ERROR 22007: Incorrect datetime value for column 'c1' at row 1
insert into test1 values(second('665040'),second(992121));
ERROR 22007: Incorrect datetime value for column 'c1' at row 1
select * from test1;
c1	c2
drop table test1;
#time
create table test1(c1 time,c2 time);
insert into test1 values(second('2020-08-08 20:00:00'),second('055059'));
insert into test1 values(second('1998-08-08 3:00:00'),second('771717'));
select * from test1;
c1	c2
00:00:00	00:00:59
00:00:00	00:00:17
drop table test1;
#year
create table test1(c1 year,c2 year);
insert into test1 values(second('201010'),second('990909'));
insert into test1 values(second('162020'),second(111516));
select * from test1;
c1	c2
2010	2009
2020	2016
drop table test1;
#datetime
create table test1(c1 datetime,c2 datetime);
insert into test1 values(second('2001-01-01 01:01:01'),second(010101));
ERROR 22007: Incorrect datetime value for column 'c1' at row 1
insert into test1 values(second('222211'),second('22:20:20'));
ERROR 22007: Incorrect datetime value for column 'c1' at row 1
select * from test1;
c1	c2
drop table test1;
#datetime
create table test1(c1 timestamp,c2 timestamp);
insert into test1 values(second('2001-01-01 01:01:01'),second(010101));
ERROR 22007: Incorrect datetime value for column 'c1' at row 1
insert into test1 values(second('222211'),second('22:20:20'));
ERROR 22007: Incorrect datetime value for column 'c1' at row 1
select * from test1;
c1	c2
drop table test1;
#decimal
create table test1(c1 decimal(10,2),c2 decimal(15,5));
insert into test1 values(second('122020'),second('08:18:28'));
insert into test1 values(second('092939'),second(101112));
select * from test1;
c1	c2
20.00	28.00000
39.00	12.00000
drop table test1;
#bit
create table test1(c1 bit(64),c2 bit(64));
insert into test1 values(second('06:30:31'),second('2007-07-07 07:32:33'));
insert into test1 values(second('08:33:34'),second(093536));
select bin(c1),bin(c2) from test1;
bin(c1)	bin(c2)
11111	100001
100010	100100
drop table test1;
#enum
create table test1(c1 enum('50','51','52'));
insert into test1 values(second('10:50:51'));
ERROR 01000: Data truncated for column 'c1' at row 1
insert into test1 values(second('11:51:52'));
ERROR 01000: Data truncated for column 'c1' at row 1
select * from test1;
c1
drop table test1;
#set
create table test1(c1 set('50','51','52'));
insert into test1 values(second('10:50:50'));
ERROR 01000: Data truncated for column 'c1' at row 1
insert into test1 values(second('11:51:51'));
ERROR 01000: Data truncated for column 'c1' at row 1
select * from test1;
c1
drop table test1;
#update、delete
drop table if exists test1;
Warnings:
Note	1051	Unknown table 'db1.test1'
create table test1(a1 int,a2 char(20),c1 datetime,c2 datetime);
insert into test1 values(1,'1998-12-12 02:02:02','1998-12-12 03:12:12','2038-01-19 11:20:20');
insert into test1 values(2,'2002-02-02 04:04:04','2002-02-02 05:14:14','2034-02-22 12:22:22');
insert into test1 values(3,'2006-04-15 06:06:06','2006-04-15 07:16:16','2026-05-08 13:24:24');
insert into test1 values(4,'2012-12-12 08:08:08','2012-12-12 09:18:18','2030-08-16 14:26:26');
select * from test1;
a1	a2	c1	c2
1	1998-12-12 02:02:02	1998-12-12 03:12:12	2038-01-19 11:20:20
2	2002-02-02 04:04:04	2002-02-02 05:14:14	2034-02-22 12:22:22
3	2006-04-15 06:06:06	2006-04-15 07:16:16	2026-05-08 13:24:24
4	2012-12-12 08:08:08	2012-12-12 09:18:18	2030-08-16 14:26:26
create table test2(a1 int,a2 int);
insert into test2 values(1,2),(2,4),(3,6),(4,8),(5,10),(6,12),(7,14),(8,16),(9,18),(10,20),(11,22),(12,24),(13,26),(14,28);
update test1 set a1 = second('11:11:11') where second(a2) = (select a2 from test2 where a1 = 2);
update test1 set a1 = second('12:12:12') where second(c1) = 3 or second(c2) = (select a2 from test2 where a1 = 11);
select * from test1;
a1	a2	c1	c2
1	1998-12-12 02:02:02	1998-12-12 03:12:12	2038-01-19 11:20:20
12	2002-02-02 04:04:04	2002-02-02 05:14:14	2034-02-22 12:22:22
3	2006-04-15 06:06:06	2006-04-15 07:16:16	2026-05-08 13:24:24
4	2012-12-12 08:08:08	2012-12-12 09:18:18	2030-08-16 14:26:26
delete from test1 where second(c1)> second('2006-04-15 07:06:06') and second(c2) > second('2038-01-19 01:14:14');
delete from test1 where second(c2) =(select a2 from test2 where a1 = 13);
select * from test1;
a1	a2	c1	c2
drop table test1;
#复制表
drop table if exists t1;
Warnings:
Note	1051	Unknown table 'db1.t1'
create table t1(c1 int ,c2 varchar(60) not null,c3 datetime default '1999-09-09 18:16:30');
insert into t1 values(161010,'18:20:20','2001-02-02 03:30:30');
insert into t1(c1,c2) values(051515,'04:25:25');
insert into t1 values(071313,'082323','1880-05-05 05:33:33');
insert into t1 values(101010,'11:11:11','0001-01-01 01:01:01');
insert into t1(c1,c2) values(121212,'15:20:20');
insert into t1 values(164040,'20220926055050','0001-01-01 01:01:01');
insert into t1 values(101010,'200202','0001-01-01 01:01:01');
create table tt1 as select * from t1;
select second(c1),second(c2),second(c3) from tt1 order by second(c1);
second(c1)	second(c2)	second(c3)
10	20	30
10	11	1
10	2	1
12	20	30
13	23	33
15	25	30
40	50	1
#select
select second(c1) from tt1 where second(c1) > 20 and second(c2) <=50;
second(c1)
40
select second(c3) from tt1 where second(c2) < 30 and second(c3) >10;
second(c3)
30
30
33
30
select second(c2) from tt1 where second(c1)<30 order by second(c2);
second(c2)
2
11
20
20
23
25
select c1,case second(c1) when second(c1)> 5 then second('202020') else second('101010') end as a from tt1;
c1	a
161010	10
51515	10
71313	10
101010	10
121212	10
164040	10
101010	10
select c1, case c2 when '11111111' then second('1111') else second('080808') end as a from tt1;
c1	a
161010	8
51515	8
71313	8
101010	8
121212	8
164040	8
101010	8
select distinct second(c1),c2,c3 from tt1 order by second(c1);
second(c1)	c2	c3
10	11:11:11	0001-01-01 01:01:01
10	18:20:20	2001-02-02 03:30:30
10	200202	0001-01-01 01:01:01
12	15:20:20	1999-09-09 18:16:30
13	082323	1880-05-05 05:33:33
15	04:25:25	1999-09-09 18:16:30
40	20220926055050	0001-01-01 01:01:01
select distinct second(c3) ,c1,c3 from tt1 order by second(c3);
second(c3)	c1	c3
1	101010	0001-01-01 01:01:01
1	164040	0001-01-01 01:01:01
30	161010	2001-02-02 03:30:30
30	51515	1999-09-09 18:16:30
30	121212	1999-09-09 18:16:30
33	71313	1880-05-05 05:33:33
select second(c1) from tt1 group by c1 having second(c1) >=10 order by c1;
second(c1)
15
13
10
12
10
40
#update
update tt1 set c1 = second('080808') where second(c2) > second('011010') and second(c2)<second('011515');
update tt1 set c2 = second('010101') where second(c1) = second('011313') or second(c3) = second('16:30:31');
update tt1 set c1 = second('12:30:30') where second(c3) in (select a2 from test2);
select * from tt1;
c1	c2	c3
161010	18:20:20	2001-02-02 03:30:30
51515	04:25:25	1999-09-09 18:16:30
71313	1	1880-05-05 05:33:33
8	11:11:11	0001-01-01 01:01:01
121212	15:20:20	1999-09-09 18:16:30
164040	20220926055050	0001-01-01 01:01:01
101010	200202	0001-01-01 01:01:01
#delete
delete from tt1 where second(c1) >second('12:10:30') and second(c1) < second('161531');
delete from tt1 where second(c2) not in (select a2 from test2);
delete from tt1 where second(c3) != 0;
drop table t1;
drop table tt1;
#分区
#hash
drop table if exists t1;
Warnings:
Note	1051	Unknown table 'db1.t1'
create table t1(c1 int,c2 datetime) partition by hash(c1)
(
partition p1,
partition p2
);
insert into t1 values(114040,'1991-01-01 02:02:02');
insert into t1 values(123030,'2001-03-01 04:04:04');
insert into t1 values(131515,'2011-05-01 06:06:06');
insert into t1 values(141515,'2021-07-01 08:08:08');
insert into t1 values(141616,'2021-07-01 10:10:10');
select * from t1;
c1	c2
114040	1991-01-01 02:02:02
123030	2001-03-01 04:04:04
141616	2021-07-01 10:10:10
131515	2011-05-01 06:06:06
141515	2021-07-01 08:08:08
select c1 from t1 where second(c2) > 1 group by second(c1) having max(second(c2))<10;
c1
114040
123030
131515
update t1 set c1 = second('060606') where second(c2) > 5;
delete from t1 where second(c2) > 5 and second(c1) = 6;
select * from t1;
c1	c2
114040	1991-01-01 02:02:02
123030	2001-03-01 04:04:04
drop table t1;
#range
drop table if exists t1;
Warnings:
Note	1051	Unknown table 'db1.t1'
create table t1(c1 int ,c2 datetime) partition by range(c1)
(
partition p1 values less than(400000),
partition p2 values less than(maxvalue)
);
insert into t1 values(200101,'1991-02-01 4:02:02');
insert into t1 values(300303,'2001-04-01 8:04:04');
insert into t1 values(400505,'2011-06-01 12:06:06');
insert into t1 values(500606,'2021-08-01 16:08:08');
insert into t1 values(600707,'2021-08-01 20:10:10');
select * from t1;
c1	c2
200101	1991-02-01 04:02:02
300303	2001-04-01 08:04:04
400505	2011-06-01 12:06:06
500606	2021-08-01 16:08:08
600707	2021-08-01 20:10:10
select c1 from t1 where second(c2) > 1 group by c1 having max(second(c2))<6;
c1
200101
300303
update t1 set c1 = second('020202') where second(c2) > 5 and second(c2) < 8;
select * from t1;
c1	c2
200101	1991-02-01 04:02:02
300303	2001-04-01 08:04:04
2	2011-06-01 12:06:06
500606	2021-08-01 16:08:08
600707	2021-08-01 20:10:10
delete from t1 where second(c2) > 2;
select * from t1;
c1	c2
200101	1991-02-01 04:02:02
drop table t1;
#list
drop table if exists t1;
Warnings:
Note	1051	Unknown table 'db1.t1'
create table t1(c1 int,c2 int) partition by list(c1)
(
partition p1 values in(080808,070707,060606,050505),
partition p2 values in(101010,111111,121212,131313)
);
insert into t1 values(080808,1),(070707,2),(060606,3),(050505,4);
insert into t1 values(101010,5),(111111,6),(121212,7),(131313,8);
select * from t1 order by c1;
c1	c2
50505	4
60606	3
70707	2
80808	1
101010	5
111111	6
121212	7
131313	8
select * from t1 partition(p1) where second(c1) >5 and second(c2)<5 order by second(c1);
c1	c2
60606	3
70707	2
80808	1
update t1 partition(p2) set c2 = second('060606') where second(c1) = second('131010');
delete from t1 where second(c1) > 6 and c2 < second('12:59:59');
select * from t1;
c1	c2
60606	3
50505	4
drop table t1;
#key
drop table if exists t1;
Warnings:
Note	1051	Unknown table 'db1.t1'
create table t1(c1 int primary key , c2 datetime)
partition by key(c1)
partitions 2;
insert into t1 values(114040,'1991-01-01 02:02:02');
insert into t1 values(123030,'2001-03-01 04:04:04');
insert into t1 values(131515,'2011-05-01 06:06:06');
insert into t1 values(141515,'2021-07-01 08:08:08');
insert into t1 values(141616,'2021-07-01 10:10:10');
select * from t1;
c1	c2
131515	2011-05-01 06:06:06
141616	2021-07-01 10:10:10
114040	1991-01-01 02:02:02
123030	2001-03-01 04:04:04
141515	2021-07-01 08:08:08
select c1 from t1 where second(c2) > 1 group by second(c1) having max(second(c2))<10;
c1
131515
114040
123030
update t1 set c1 = second('060606') where second(c2) > 9;
delete from t1 where second(c2) > 5 and second(c1) = 6;
select * from t1 order by c1;
c1	c2
114040	1991-01-01 02:02:02
123030	2001-03-01 04:04:04
131515	2011-05-01 06:06:06
141515	2021-07-01 08:08:08
drop table t1;
#range columns
drop table if exists t1;
Warnings:
Note	1051	Unknown table 'db1.t1'
CREATE TABLE t1 (
c1 int,
c2 datetime
)
PARTITION BY RANGE COLUMNS(c1) (
partition p1 values less than(400000),
partition p2 values less than(maxvalue)
);
insert into t1 values(200101,'1991-02-01 4:04:04');
insert into t1 values(300303,'2001-04-01 8:08:08');
insert into t1 values(400505,'2011-06-01 12:12:12');
insert into t1 values(500606,'2021-08-01 16:16:16');
insert into t1 values(600707,'2021-08-01 20:20:20');
select * from t1;
c1	c2
200101	1991-02-01 04:04:04
300303	2001-04-01 08:08:08
400505	2011-06-01 12:12:12
500606	2021-08-01 16:16:16
600707	2021-08-01 20:20:20
select c1 from t1 where second(c2) > 1 group by c1 having max(second(c2))<6;
c1
200101
update t1 set c1 = second('020202') where second(c2) > 5;
select * from t1;
c1	c2
200101	1991-02-01 04:04:04
2	2001-04-01 08:08:08
2	2011-06-01 12:12:12
2	2021-08-01 16:16:16
2	2021-08-01 20:20:20
delete from t1 where second(c2) > 2;
select * from t1;
c1	c2
drop table t1;
#columns list
drop table if exists t1;
Warnings:
Note	1051	Unknown table 'db1.t1'
create table t1(c1 int,c2 int) partition by list columns(c1)
(
partition p1 values in(080808,070707,060606,050505),
partition p2 values in(101010,111111,121212,131313)
);
insert into t1 values(080808,1),(070707,2),(060606,3),(050505,4);
insert into t1 values(101010,5),(111111,6),(121212,7),(131313,8);
select * from t1 order by c1;
c1	c2
50505	4
60606	3
70707	2
80808	1
101010	5
111111	6
121212	7
131313	8
select * from t1 partition(p1) where second(c1) >5 and second(c2)<5 order by second(c1);
c1	c2
60606	3
70707	2
80808	1
update t1 partition(p2) set c2 = second('060606') where second(c1) = second('131010');
delete from t1 where second(c1) > 6 and c2 < second('12:59:59');
select * from t1;
c1	c2
60606	3
50505	4
drop table t1;
#view
drop table if exists t1;
Warnings:
Note	1051	Unknown table 'db1.t1'
drop view if exists v_t1;
Warnings:
Note	1051	Unknown table 'db1.v_t1'
create table t1(c1 int ,c2 varchar(60) not null,c3 datetime default '1999-09-09 18:16:16');
insert into t1 values(161010,'18:20:20','2001-02-02 03:30:30');
insert into t1(c1,c2) values(051515,'04:25:25');
insert into t1 values(071313,'082323','1880-05-05 05:33:33');
insert into t1 values(101010,'11:11:11','0001-01-01 01:01:01');
insert into t1(c1,c2) values(121212,'15:20:20');
insert into t1 values(164040,'20220926055050','0001-01-01 01:01:01');
insert into t1 values(101010,'200202','0001-01-01 01:01:01');
create view v_t1 as select * from t1;
select second(c1),second(c2),second(c3) from v_t1 order by second(c1);
second(c1)	second(c2)	second(c3)
10	20	30
10	11	1
10	2	1
12	20	16
13	23	33
15	25	16
40	50	1
#select
select second(c1) from v_t1 where second(c1) > 20 and second(c2) <=50;
second(c1)
40
select second(c3) from v_t1 where second(c2) < 30 and second(c3) >10;
second(c3)
30
16
33
16
select second(c2) from v_t1 where second(c1)<30 order by second(c2);
second(c2)
2
11
20
20
23
25
select c1,case second(c1) when second(c1)> 5 then second('202020') else second('101010') end as a from v_t1;
c1	a
161010	10
51515	10
71313	10
101010	10
121212	10
164040	10
101010	10
select c1, case c2 when '11111111' then second('1111') else second('080808') end as a from v_t1;
c1	a
161010	8
51515	8
71313	8
101010	8
121212	8
164040	8
101010	8
select distinct second(c1),c2,c3 from v_t1 order by second(c1);
second(c1)	c2	c3
10	11:11:11	0001-01-01 01:01:01
10	18:20:20	2001-02-02 03:30:30
10	200202	0001-01-01 01:01:01
12	15:20:20	1999-09-09 18:16:16
13	082323	1880-05-05 05:33:33
15	04:25:25	1999-09-09 18:16:16
40	20220926055050	0001-01-01 01:01:01
select distinct second(c3) ,c1,c3 from v_t1 order by second(c3);
second(c3)	c1	c3
1	101010	0001-01-01 01:01:01
1	164040	0001-01-01 01:01:01
16	51515	1999-09-09 18:16:16
16	121212	1999-09-09 18:16:16
30	161010	2001-02-02 03:30:30
33	71313	1880-05-05 05:33:33
select second(c1) from v_t1 group by c1 having second(c1) >=10 order by c1;
second(c1)
15
13
10
12
10
40
#update
update v_t1 set c1 = second('080808') where second(c2) > second('011010') and second(c2)<second('011515');
update v_t1 set c2 = second('010101') where second(c1) = second('011313') or second(c3) = second('16:30:31');
update v_t1 set c1 = second('12:30:30') where second(c3) in (select a2 from test2);
select * from v_T1;
c1	c2	c3
161010	18:20:20	2001-02-02 03:30:30
30	04:25:25	1999-09-09 18:16:16
71313	1	1880-05-05 05:33:33
8	11:11:11	0001-01-01 01:01:01
30	15:20:20	1999-09-09 18:16:16
164040	20220926055050	0001-01-01 01:01:01
101010	200202	0001-01-01 01:01:01
#delete
delete from v_t1 where second(c1) >second('12:10:30') and second(c1) < second('161531');
delete from v_t1 where second(c2) not in (select a2 from test2);
delete from v_t1 where second(c3) != 0;
select * from v_T1;
c1	c2	c3
drop table test2;
drop table t1;
drop view v_t1;
#生成列
drop table if exists t1;
Warnings:
Note	1051	Unknown table 'db1.t1'
CREATE TABLE t1(c1 int,c2 int GENERATED ALWAYS AS (second('060606')) VIRTUAL);
insert into t1(c1) values(1);
insert into t1(c1) values(2);
select * from t1;
c1	c2
1	6
2	6
drop table t1;
#算数运算符
#'+'
select second('AAA'+060606);
second('AAA'+060606)
6
Warnings:
Warning	1292	Truncated incorrect DOUBLE value: 'AAA'
select second('77'+12121);
second('77'+12121)
NULL
Warnings:
Warning	5086	Not timestamp Can not cast varchar value to timestamp type
select second('张三'+'050505');
second('张三'+'050505')
5
Warnings:
Warning	1292	Truncated incorrect DOUBLE value: '张三'
select second(060606+'AAA');
second(060606+'AAA')
6
Warnings:
Warning	1292	Truncated incorrect DOUBLE value: 'AAA'
select second(12121+'77');
second(12121+'77')
NULL
Warnings:
Warning	5086	Not timestamp Can not cast varchar value to timestamp type
select second('050505'+'张三');
second('050505'+'张三')
5
Warnings:
Warning	1292	Truncated incorrect DOUBLE value: '张三'
select second('010101'+'20:50:60');
second('010101'+'20:50:60')
21
Warnings:
Warning	1292	Truncated incorrect DOUBLE value: '20:50:60'
select second('020202'+'');
second('020202'+'')
2
select second('03:03:03'+' ');
second('03:03:03'+' ')
3
Warnings:
Warning	1292	Truncated incorrect DOUBLE value: '03:03:03'
select second('040404'+0001);
second('040404'+0001)
5
select second('1010-01-01 05:05:05'+2001);
second('1010-01-01 05:05:05'+2001)
11
Warnings:
Warning	1292	Truncated incorrect DOUBLE value: '1010-01-01 05:05:05'
select second('10101')+second('123232');
second('10101')+second('123232')
33
select second('202020' )+second('2003-02-29');
second('202020' )+second('2003-02-29')
23
select second('211818')+second('aaa');
second('211818')+second('aaa')
NULL
Warnings:
Warning	5086	Not timestamp Can not cast varchar value to timestamp type
#'-'
select second('202020'-'212121');
second('202020'-'212121')
1
select second('232323'-080808);
second('232323'-080808)
15
select second('235959'-606060);
second('235959'-606060)
1
select second('906060'-606060);
second('906060'-606060)
0
select second('1005050'-'AA');
second('1005050'-'AA')
50
Warnings:
Warning	1292	Truncated incorrect DOUBLE value: 'AA'
select second('885050'-'张三/');
second('885050'-'张三/')
50
Warnings:
Warning	1292	Truncated incorrect DOUBLE value: '张三/'
select second('ABC'-'060606');
second('ABC'-'060606')
6
Warnings:
Warning	1292	Truncated incorrect DOUBLE value: 'ABC'
select second('周五周五'-'2010-10-10 10:10:10');
second('周五周五'-'2010-10-10 10:10:10')
10
Warnings:
Warning	1292	Truncated incorrect DOUBLE value: '周五周五'
Warning	1292	Truncated incorrect DOUBLE value: '2010-10-10 10:10:10'
#'*'
select second(2020*121);
second(2020*121)
20
select second('1'*'2020-03-03 14:20:20');
second('1'*'2020-03-03 14:20:20')
20
Warnings:
Warning	1292	Truncated incorrect DOUBLE value: '2020-03-03 14:20:20'
select second('14:20:20'+501010);
second('14:20:20'+501010)
24
Warnings:
Warning	1292	Truncated incorrect DOUBLE value: '14:20:20'
select second('020202'*'张三');
second('020202'*'张三')
0
Warnings:
Warning	1292	Truncated incorrect DOUBLE value: '张三'
select second('AAA'*060606);
second('AAA'*060606)
0
Warnings:
Warning	1292	Truncated incorrect DOUBLE value: 'AAA'
select second('77'*12121);
second('77'*12121)
17
select second('张三'*'050505');
second('张三'*'050505')
0
Warnings:
Warning	1292	Truncated incorrect DOUBLE value: '张三'
#'/'
select second(21212121/333);
second(21212121/333)
0
select second('18:18:18'/66);
second('18:18:18'/66)
0
Warnings:
Warning	1292	Truncated incorrect DOUBLE value: '18:18:18'
select second(33333333/'33');
second(33333333/'33')
1
select second(2222222/2);
second(2222222/2)
11
select second('11110101'/2);
second('11110101'/2)
50
select second(121212*3/2+121-61321);
second(121212*3/2+121-61321)
18
select second(300000/2*4+615-3.666666);
second(300000/2*4+615-3.666666)
11
#逻辑运算符
select second('030303') and second(0305011);
second('030303') and second(0305011)
1
select second('1921-10-10 06:06:07') and second('06:09:09');
second('1921-10-10 06:06:07') and second('06:09:09')
1
select not second('1111-01-01 15:24:25') ;
not second('1111-01-01 15:24:25')
0
select not second('111101') ;
not second('111101')
0
select second('202101') or second('222222');
second('202101') or second('222222')
1
select second('192110') or second('198808');
second('192110') or second('198808')
1
select second('180110') or second('180010');
second('180110') or second('180010')
1
select second('212112') or ('2');
second('212112') or ('2')
1
select second('212112') or 'aa';
second('212112') or 'aa'
1
#比较运算符
select second('200101') > second('20:21:02');
second('200101') > second('20:21:02')
0
select second('380101') > second('200102');
second('380101') > second('200102')
0
select second('AASA22CCC') > second('0000-01-01');
second('AASA22CCC') > second('0000-01-01')
NULL
Warnings:
Warning	5086	Not timestamp Can not cast varchar value to timestamp type
select second('202020') > 'AA';
second('202020') > 'AA'
1
Warnings:
Warning	1292	Truncated incorrect DECIMAL value: 'AA'
select second('00010101') >1;
second('00010101') >1
0
select second('2020-01-01 16:13:21') < second('2020-01-02 19:16:18');
second('2020-01-01 16:13:21') < second('2020-01-02 19:16:18')
0
select second('22:34:56') < second('230516');
second('22:34:56') < second('230516')
0
select second('2221212') < second('9991231');
second('2221212') < second('9991231')
1
select second('1500-01-01 15:13:12') < 'Abc';
second('1500-01-01 15:13:12') < 'Abc'
0
Warnings:
Warning	1292	Truncated incorrect DECIMAL value: 'Abc'
select second('2000-01-01 14:18:19') < 14;
second('2000-01-01 14:18:19') < 14
0
select second('2020-01-01 11:12:11') >= second('2020-01-02 08:09:10');
second('2020-01-01 11:12:11') >= second('2020-01-02 08:09:10')
1
select second('3800-01-01 10:11:11') >= second('2050-01-01 08:08:08');
second('3800-01-01 10:11:11') >= second('2050-01-01 08:08:08')
1
select second('0001-01-01 22:30:50') >= second('0000-01-01 23:23:23');
second('0001-01-01 22:30:50') >= second('0000-01-01 23:23:23')
1
select second('14:13:15') >= 'AA';
second('14:13:15') >= 'AA'
1
Warnings:
Warning	1292	Truncated incorrect DECIMAL value: 'AA'
select second('16:18:18') >=1;
second('16:18:18') >=1
1
select second('20201111') <= second('2020-011-11 22:22:22');
second('20201111') <= second('2020-011-11 22:22:22')
0
select second(12341122) <= second(05711212);
second(12341122) <= second(05711212)
NULL
Warnings:
Warning	5086	Not timestamp Can not cast varchar value to timestamp type
select second('1500101') < 'CCC';
second('1500101') < 'CCC'
0
Warnings:
Warning	1292	Truncated incorrect DECIMAL value: 'CCC'
select second('241231') < 25;
second('241231') < 25
0
#时间函数嵌套
#now
#localtime/localtimestamp
#date
select second(date('2003-12-31 01:02:03'));
second(date('2003-12-31 01:02:03'))
0
#curdate
#addtime
select second(ADDTIME('2007-12-31 23:59:59.999999', '1 1:1:1.000002'));
second(ADDTIME('2007-12-31 23:59:59.999999', '1 1:1:1.000002'))
1
select second(ADDTIME('01:00:00.999999', '02:00:00.999998'));
second(ADDTIME('01:00:00.999999', '02:00:00.999998'))
1
#curtime 返回当前时间
#maketime
select second(maketime(01,00,01));
second(maketime(01,00,01))
1
select second(maketime(15,16,16));
second(maketime(15,16,16))
16
select second(maketime(888,10,15));
second(maketime(888,10,15))
59
#period_add
select second(PERIOD_ADD(200801,2));
second(PERIOD_ADD(200801,2))
3
select second(PERIOD_ADD(100801,-2));
second(PERIOD_ADD(100801,-2))
11
#sec_to_time
select second(sec_to_time(321513));
second(sec_to_time(321513))
33
select second(sec_to_time(321513)+0);
second(sec_to_time(321513)+0)
33
select second(sec_to_time(0));
second(sec_to_time(0))
0
select second(sec_to_time(9999999999999999));
second(sec_to_time(9999999999999999))
59
#date_add/sub
select second(DATE_ADD('2018-05-01 12:12:12',INTERVAL 1 DAY));
second(DATE_ADD('2018-05-01 12:12:12',INTERVAL 1 DAY))
12
select second(DATE_SUB('2018-05-01 16:12:12',INTERVAL 1 second));
second(DATE_SUB('2018-05-01 16:12:12',INTERVAL 1 second))
11
select second(DATE_ADD('2020-12-31 23:59:58',INTERVAL 1 SECOND));
second(DATE_ADD('2020-12-31 23:59:58',INTERVAL 1 SECOND))
59
select second(DATE_ADD('2018-12-31 23:59:59',INTERVAL 1 DAY));
second(DATE_ADD('2018-12-31 23:59:59',INTERVAL 1 DAY))
59
select second(DATE_ADD('2100-12-31 22:59:57',INTERVAL '1:1' MINUTE_SECOND));
second(DATE_ADD('2100-12-31 22:59:57',INTERVAL '1:1' MINUTE_SECOND))
58
select second(DATE_SUB('2025-01-01 00:00:00',INTERVAL '1 1:1:1' DAY_SECOND));
second(DATE_SUB('2025-01-01 00:00:00',INTERVAL '1 1:1:1' DAY_SECOND))
59
select second(DATE_ADD('1900-01-01 00:00:00',INTERVAL '-1 10' DAY_HOUR));
second(DATE_ADD('1900-01-01 00:00:00',INTERVAL '-1 10' DAY_HOUR))
0
select second(DATE_SUB('1998-01-02', INTERVAL 31 DAY));
second(DATE_SUB('1998-01-02', INTERVAL 31 DAY))
NULL
Warnings:
Warning	5086	Not timestamp Can not cast varchar value to timestamp type
select second(DATE_ADD('1992-12-31 23:59:59.000002',INTERVAL '1.999999' SECOND_MICROSECOND));
second(DATE_ADD('1992-12-31 23:59:59.000002',INTERVAL '1.999999' SECOND_MICROSECOND))
1
#date_format
select second(DATE_FORMAT('2009-10-04 22:23:15', '%W %M %Y'));
second(DATE_FORMAT('2009-10-04 22:23:15', '%W %M %Y'))
NULL
Warnings:
Warning	5086	Not timestamp Can not cast varchar value to timestamp type
select second(DATE_FORMAT('2007-10-04 22:23:16', '%H:%i:%s'));
second(DATE_FORMAT('2007-10-04 22:23:16', '%H:%i:%s'))
16
#OB与MYSQL结果不一致。
select second(DATE_FORMAT('1900-10-04 22:23:20','%D %y %a %d %m %b %j'));
second(DATE_FORMAT('1900-10-04 22:23:20','%D %y %a %d %m %b %j'))
4
select second(DATE_FORMAT('1997-10-04 22:23:06','%H %k %I %r %T %S %w'));
second(DATE_FORMAT('1997-10-04 22:23:06','%H %k %I %r %T %S %w'))
0
select second(DATE_FORMAT('1999-01-01 06:06:06', '%X %V'));
second(DATE_FORMAT('1999-01-01 06:06:06', '%X %V'))
59
#OB与MYSQL结果不一致。
select second(DATE_FORMAT('2006-06-00 12:12:12', '%d'));
second(DATE_FORMAT('2006-06-00 12:12:12', '%d'))
NULL
#form_days
select second(from_days(730669));
second(from_days(730669))
0
select second(from_days(999999));
second(from_days(999999))
0
select second(from_days(111111));
second(from_days(111111))
0
#from_unixtime
select second(FROM_UNIXTIME(1447430881));
second(FROM_UNIXTIME(1447430881))
1
select second(FROM_UNIXTIME(1447430881) + 0);
second(FROM_UNIXTIME(1447430881) + 0)
1
select second(FROM_UNIXTIME(1447430881,'%Y %D %M %h:%i:%s %x'));
second(FROM_UNIXTIME(1447430881,'%Y %D %M %h:%i:%s %x'))
59
select second(DATE_FORMAT('2003-10-03',GET_FORMAT(DATE,'EUR')));
second(DATE_FORMAT('2003-10-03',GET_FORMAT(DATE,'EUR')))
3
select second(STR_TO_DATE('10.31.2003',GET_FORMAT(DATE,'USA')));
second(STR_TO_DATE('10.31.2003',GET_FORMAT(DATE,'USA')))
0
#last_day
select second(LAST_DAY('2003-02-05'));
second(LAST_DAY('2003-02-05'))
0
select second(LAST_DAY('2004-02-05'));
second(LAST_DAY('2004-02-05'))
0
select second(LAST_DAY('2004-01-01 01:01:01'));
second(LAST_DAY('2004-01-01 01:01:01'))
0
select second(LAST_DAY('2003-03-32'));
second(LAST_DAY('2003-03-32'))
NULL
#makedate
select second(MAKEDATE(2011,31));
second(MAKEDATE(2011,31))
0
select second(MAKEDATE(2011,32));
second(MAKEDATE(2011,32))
0
select second(MAKEDATE(2011,365));
second(MAKEDATE(2011,365))
0
select second(MAKEDATE(2014,365));
second(MAKEDATE(2014,365))
0
select second(MAKEDATE(2011,0));
second(MAKEDATE(2011,0))
NULL
select second(PERIOD_ADD(200801,2));
second(PERIOD_ADD(200801,2))
3
#subdate/time
select second(DATE_SUB('2008-01-02 08:08:08', INTERVAL 31 DAY));
second(DATE_SUB('2008-01-02 08:08:08', INTERVAL 31 DAY))
8
select second(SUBDATE('2008-01-02 13:13:13', INTERVAL 31 DAY));
second(SUBDATE('2008-01-02 13:13:13', INTERVAL 31 DAY))
13
select second(SUBDATE('2008-01-02 12:00:00', 31));
second(SUBDATE('2008-01-02 12:00:00', 31))
0
select second(SUBTIME('2007-12-31 23:59:59.999999','1 1:1:1.000002'));
second(SUBTIME('2007-12-31 23:59:59.999999','1 1:1:1.000002'))
58
#timestamp
select second(TIMESTAMP('2003-12-31 08:08:08'));
second(TIMESTAMP('2003-12-31 08:08:08'))
8
select second(TIMESTAMP('2003-12-31 12:00:00','12:00:00'));
second(TIMESTAMP('2003-12-31 12:00:00','12:00:00'))
0
select second(TIMESTAMPADD(second,1,'2003-01-02 15:16:17'));
second(TIMESTAMPADD(second,1,'2003-01-02 15:16:17'))
18
select second(TIMESTAMPADD(WEEK,1,'2003-01-02 18:18:18'));
second(TIMESTAMPADD(WEEK,1,'2003-01-02 18:18:18'))
18
#utc_date/timestamp
#convert_tz
select second(CONVERT_TZ('2004-01-01 12:05:20','+00:00','+10:00'));
second(CONVERT_TZ('2004-01-01 12:05:20','+00:00','+10:00'))
20
select second(CONVERT_TZ('2004-01-01 12:05:50','+00:00','+20:00'));
second(CONVERT_TZ('2004-01-01 12:05:50','+00:00','+20:00'))
NULL
#其他函数
#concat
select second(concat('2020','12'));
second(concat('2020','12'))
12
select second(concat('2021','1111'));
second(concat('2021','1111'))
59
select second(concat('19980715','aa'));
second(concat('19980715','aa'))
59
#ceil
select second(ceil(213121.0111111));
second(ceil(213121.0111111))
22
#cast
select second(cast('2021-10-08 12:12:00' as int));
ERROR 42000: You have an error in your SQL syntax; check the manual that corresponds to your OceanBase version for the right syntax to use near 'int))' at line 1
select second(cast('2021-10-08 12:12:12' as double));
second(cast('2021-10-08 12:12:12' as double))
21
Warnings:
Warning	1292	Truncated incorrect DOUBLE value: '2021-10-08 12:12:12'
select second(cast('2021-10-08 14:14:14' as float));
second(cast('2021-10-08 14:14:14' as float))
21
Warnings:
Warning	1292	Truncated incorrect DOUBLE value: '2021-10-08 14:14:14'
select second(cast('2021-10-08 14:14:14' as char(100)));
second(cast('2021-10-08 14:14:14' as char(100)))
14
select second(cast('2021-10-08 14:14:50' as varchar(100)));
ERROR 42000: You have an error in your SQL syntax; check the manual that corresponds to your OceanBase version for the right syntax to use near 'varchar(100)))' at line 1
select second(cast('2021-10-08 14:14:59' as date));
second(cast('2021-10-08 14:14:59' as date))
0
select second(cast('2021-10-08 14:14:44' as time));
second(cast('2021-10-08 14:14:44' as time))
44
select second(cast('20211008141400' as datetime));
second(cast('20211008141400' as datetime))
0
select second(cast('2021-10-08 14:14:00' as timestamp));
ERROR 42000: You have an error in your SQL syntax; check the manual that corresponds to your OceanBase version for the right syntax to use near 'timestamp))' at line 1
select second(cast('2021-10-08 14:14:00' as decimal(15,5)));
second(cast('2021-10-08 14:14:00' as decimal(15,5)))
21
Warnings:
Warning	1292	Truncated incorrect DECIMAL value: '2021-10-08 14:14:00'
#length
select second(length(11111111));
second(length(11111111))
8
#substr
select second(substr('0012120021',5));
second(substr('0012120021',5))
21
select second(substr('012300021212' from 8));
second(substr('012300021212' from 8))
12
select second(substr('012300021212' from 7));
second(substr('012300021212' from 7))
12
select second(substr('1111121211121212121212121',5,13));
second(substr('1111121211121212121212121',5,13))
12
#reverse
select second(reverse('20120229'));
second(reverse('20120229'))
59
select second(reverse('92202102'));
second(reverse('92202102'))
59
select second(reverse(cast('2021-10-08 14:14:00' as datetime)));
second(reverse(cast('2021-10-08 14:14:00' as datetime)))
NULL
Warnings:
Warning	5086	Not timestamp Can not cast varchar value to timestamp type
#聚合函数
drop table if exists test1;
Warnings:
Note	1051	Unknown table 'db1.test1'
create table test1(a1 int,a2 int,c1 datetime,c2 datetime);
insert into test1 values(1,080606,'1998-12-12 12:12:12','2038-01-19 03:14:14');
insert into test1 values(2,090909,'2002-02-02 10:00:00','2034-02-22 00:50:50');
insert into test1 values(3,101010,'2006-04-15 06:06:20','2026-05-08 05:16:16');
insert into test1 values(4,111111,'2012-12-12 12:12:12','2030-08-16 14:05:05');
select * from test1;
a1	a2	c1	c2
1	80606	1998-12-12 12:12:12	2038-01-19 03:14:14
2	90909	2002-02-02 10:00:00	2034-02-22 00:50:50
3	101010	2006-04-15 06:06:20	2026-05-08 05:16:16
4	111111	2012-12-12 12:12:12	2030-08-16 14:05:05
#count
select count(second(c1)) from test1;
count(second(c1))
4
select second(count(c1)) from test1;
second(count(c1))
4
select count(second(c2)) from test1;
count(second(c2))
4
select second(count(c2)) from test1;
second(count(c2))
4
#max
select max(second(c1)) from test1;
max(second(c1))
20
select second(max(c1)) from test1;
second(max(c1))
12
select max(second(c2)) from test1;
max(second(c2))
50
select second(max(c2)) from test1;
second(max(c2))
14
#min
select min(second(c1)) from test1;
min(second(c1))
0
select second(min(c1)) from test1;
second(min(c1))
12
select max(second(c2)) from test1;
max(second(c2))
50
select second(max(c2)) from test1;
second(max(c2))
14
#avg
select avg(second(c1)) from test1;
avg(second(c1))
11.0000
select second(avg(c1)) from test1;
second(avg(c1))
NULL
Warnings:
Warning	5086	Not timestamp Can not cast varchar value to timestamp type
select max(second(c2)) from test1;
max(second(c2))
50
select second(max(c2)) from test1;
second(max(c2))
14
#sum
select sum(second(c1)) from test1;
sum(second(c1))
44
select second(sum(c1)) from test1;
second(sum(c1))
NULL
Warnings:
Warning	5086	Not timestamp Can not cast varchar value to timestamp type
select max(second(c2)) from test1;
max(second(c2))
50
select second(max(c2)) from test1;
second(max(c2))
14
select second(1.9999994);
second(1.9999994)
1
select second(1.9999995);
second(1.9999995)
2
select second('2020');
second('2020')
20
select second('20200101');
second('20200101')
59
select second('20200101122436');
second('20200101122436')
36
create table t0(c1 varchar(100) collate utf16_bin);
insert into t0 values('20200101122436');
select second(c1) from t0;
second(c1)
36
select minute(105959.9999994);
minute(105959.9999994)
59
select minute(105959.9999995);
minute(105959.9999995)
0
select minute(102030.9999994);
minute(102030.9999994)
20
select minute(102030.9999995);
minute(102030.9999995)
20
delete from t0;
insert into t0 values('105959.9999994');
insert into t0 values('105959.9999995');
insert into t0 values('102030.9999994');
insert into t0 values('102030.9999995');
select c1, minute(c1) from t0;
c1	minute(c1)
105959.9999994	59
105959.9999995	0
102030.9999994	20
102030.9999995	20
select hour(105959.9999994);
hour(105959.9999994)
10
select hour(105959.9999995);
hour(105959.9999995)
11
select hour(102030.9999994);
hour(102030.9999994)
10
select hour(102030.9999995);
hour(102030.9999995)
10
select c1, hour(c1) from t0;
c1	hour(c1)
105959.9999994	10
105959.9999995	11
102030.9999994	10
102030.9999995	10
select day(20200101235959.9999994);
day(20200101235959.9999994)
1
select day(20200101235959.9999995);
day(20200101235959.9999995)
2
select day(20200131235959.9999994);
day(20200131235959.9999994)
31
select day(20200131235959.9999995);
day(20200131235959.9999995)
1
delete from t0;
insert into t0 values('20200101235959.9999994');
insert into t0 values('20200101235959.9999995');
insert into t0 values('20200131235959.9999994');
insert into t0 values('20200131235959.9999995');
select c1, day(c1) from t0;
c1	day(c1)
20200101235959.9999994	1
20200101235959.9999995	2
20200131235959.9999994	31
20200131235959.9999995	1
select month(20200131235959.9999994);
month(20200131235959.9999994)
1
select month(20200131235959.9999995);
month(20200131235959.9999995)
2
select month(20201231235959.9999994);
month(20201231235959.9999994)
12
select month(20201231235959.9999995);
month(20201231235959.9999995)
1
delete from t0;
insert into t0 values('20200131235959.9999994');
insert into t0 values('20200131235959.9999995');
insert into t0 values('20201231235959.9999994');
insert into t0 values('20201231235959.9999995');
select c1, month(c1) from t0;
c1	month(c1)
20200131235959.9999994	1
20200131235959.9999995	2
20201231235959.9999994	12
20201231235959.9999995	1
select year(20201231235959.9999994);
year(20201231235959.9999994)
2020
select year(20201231235959.9999995);
year(20201231235959.9999995)
2021
delete from t0;
insert into t0 values('20201231235959.9999994');
insert into t0 values('20201231235959.9999995');
select c1, year(c1) from t0;
c1	year(c1)
20201231235959.9999994	2020
20201231235959.9999995	2021
drop database db1;
