drop database if exists db1;
create database db1;
use db1;
#PL
#procedure
drop table if exists t1;
Warnings:
Note	1051	Unknown table 'db1.t1'
create table t1(c1 int,c2 int,c3 char(100));
drop procedure if exists pro1;
CREATE  PROCEDURE pro1()
begin
declare j int;
declare i int;
set j = 5;
set i = 1;
while i <= j DO
insert into t1 values(i,second(20201212155050),second('2022-02-02 18:06:06'));
set i = i + 1;
end WHILE;
end
//
call pro1();
select * from t1;
c1	c2	c3
1	50	6
2	50	6
3	50	6
4	50	6
5	50	6
drop   procedure if   exists   pro1;
create procedure pro1(aa int,bb int)
begin
if aa = bb then
update t1 set c2 = second('2008-08-08 10:15:15') where c1 = 2 ;
elseif aa > bb then
update t1 set c2 = second('1998-08-08 12:12:12') where c1 = 1 ;
else
update t1 set c2 = second('14:14:14') where c1 = 3 ;
end if;
end
//
call pro1(1,1);
call pro1(2,1);
call pro1(0,1);
select * from t1;
c1	c2	c3
1	12	6
2	15	6
3	14	6
4	50	6
5	50	6
drop   procedure if   exists   pro1;
create procedure pro1()
begin
declare i int default 1;
while i <= 10 do
if mod(i,10) = 0 then
insert into t1 values(6,second('1981-01-01 08:08:08'),second(010101));
elseif mod(i,8)=0 then
insert into t1 values(7,second('1987-07-07 09:09:09'),second(020202));
elseif mod(i,7)=0 then
insert into t1 values(8,second('1988-08-08 10:10:10'),second(030303));
elseif mod(i,5)=0 then
insert into t1 values(9,second('1909-09-09 11:11:11'),second(040404));
elseif mod(i,3)=0 then
insert into t1 values(10,second('2010-10-10 12:12:12'),second(050505));
else
insert into t1 values(11,second('2011-11-11 13:13:13'),second(060606));
end if;
set i = i+1;
end while;
end
//
call pro1();
select * from t1;
c1	c2	c3
1	12	6
2	15	6
3	14	6
4	50	6
5	50	6
11	13	6
11	13	6
10	12	5
11	13	6
9	11	4
10	12	5
8	10	3
7	9	2
10	12	5
6	8	1
drop   procedure if   exists   pro1;
create procedure pro1(aa int,bb int)
begin
if aa = bb then
delete from t1 where c1 > 1 and c2 = second('1988-10-02 10:10:10');
elseif aa > bb then
delete from t1 where c2 > second('2011-02-02 10:10:10') and c3 = second('2011-02-02 05:05:05');
else
delete from t1 where c3 = second('1998-02-02 06:06:06');
end if;
end
//
call pro1(1,1);
call pro1(2,1);
call pro1(0,1);
select * from t1;
c1	c2	c3
9	11	4
7	9	2
6	8	1
drop   procedure if   exists   pro1;
create procedure pro1(aa int,bb int)
begin
if aa = bb then
select second('2020-10-10 07:07:07'),second(201010),second('20220927141516');
elseif aa > bb then
select second('0001-10-10 08:08:08'),second(991231),second('20001010050505');
else
select second('5000-10-10 09:09:09'),second(501010),second('19990909090909');
end if;
end
//
call pro1(1,1);
second('2020-10-10 07:07:07')	second(201010)	second('20220927141516')
7	10	16
call pro1(2,1);
second('0001-10-10 08:08:08')	second(991231)	second('20001010050505')
8	31	5
call pro1(0,1);
second('5000-10-10 09:09:09')	second(501010)	second('19990909090909')
9	10	9
#function
drop table if exists t1;
create table t1(c1 int,c2 int,c3 char(100));
drop function if exists func1;
CREATE  function func1() returns int
begin
declare j int;
declare i int;
set j = 5;
set i = 1;
while i <= j DO
insert into t1 values(i,second(20201212155050),second('2022-02-02 18:06:06'));
set i = i + 1;
end WHILE;
return second('08:08:08');
end
//
select func1();
func1()
8
select * from t1;
c1	c2	c3
1	50	6
2	50	6
3	50	6
4	50	6
5	50	6
drop function if exists func1;
CREATE  function func1(aa int,bb int) returns int
begin
if aa = bb then
update t1 set c2 = second('2008-08-08 10:15:15') where c1 = 2 ;
elseif aa > bb then
update t1 set c2 = second('1998-08-08 12:12:12') where c1 = 1 ;
else
update t1 set c2 = second('14:14:14') where c1 = 3 ;
end if;
return second('08:08:08');
end
//
select func1(1,1);
func1(1,1)
8
select func1(2,1);
func1(2,1)
8
select func1(0,1);
func1(0,1)
8
select * from t1;
c1	c2	c3
1	12	6
2	15	6
3	14	6
4	50	6
5	50	6
drop function if exists func1;
CREATE  function func1() returns int
begin
declare i int default 1;
while i <= 10 do
if mod(i,10) = 0 then
insert into t1 values(6,second('1981-01-01 08:08:08'),second(010101));
elseif mod(i,8)=0 then
insert into t1 values(7,second('1987-07-07 09:09:09'),second(020202));
elseif mod(i,7)=0 then
insert into t1 values(8,second('1988-08-08 10:10:10'),second(030303));
elseif mod(i,5)=0 then
insert into t1 values(9,second('1909-09-09 11:11:11'),second(040404));
elseif mod(i,3)=0 then
insert into t1 values(10,second('2010-10-10 12:12:12'),second(050505));
else
insert into t1 values(11,second('2011-11-11 13:13:13'),second(060606));
end if;
set i = i+1;
end while;
return second('06:06:06');
end
//
select func1();
func1()
6
select * from t1;
c1	c2	c3
1	12	6
2	15	6
3	14	6
4	50	6
5	50	6
11	13	6
11	13	6
10	12	5
11	13	6
9	11	4
10	12	5
8	10	3
7	9	2
10	12	5
6	8	1
drop function if exists func1;
create function func1(aa int,bb int) returns int
begin
if aa = bb then
delete from t1 where c1 > 1 and c2 = second('1988-10-02 10:10:10');
elseif aa > bb then
delete from t1 where c2 > second('2011-02-02 10:10:10') and c3 = second('2011-02-02 05:05:05');
else
delete from t1 where c3 = second('1998-02-02 06:06:06');
end if;
return second('05:05:05');
end
//
select func1(1,1);
func1(1,1)
5
select func1(2,1);
func1(2,1)
5
select func1(0,1);
func1(0,1)
5
select * from t1;
c1	c2	c3
9	11	4
7	9	2
6	8	1
#trigger
drop   table     if   exists   t1;
drop   table     if   exists   t2;
Warnings:
Note	1051	Unknown table 'db1.t2'
create table t1(c1 int,c2 int);
insert into t1 values(1,21);
insert into t1 values(2,20);
create table t2(a1 int,a2 varchar(20));
insert into t2 values(2,'AA');
insert into t2 values(3,'cc');
drop trigger if exists tg1;
Warnings:
Note	1360	Trigger does not exist
create trigger tg1
AFTER
insert on t2
for each ROW
BEGIN
insert t1 values(second('1999/09/09 02:20:20'),second('2000-08-08 05:06:14'));
END
//
insert into t2 values(1,1);
select * from t1;
c1	c2
1	21
2	20
20	14
drop trigger if exists tg1;
create trigger tg1
AFTER
update on t2
for each ROW
BEGIN
update t1 set c1 = second('01:01:01') where c2 = second('2001/01/01 20:20:20');
END
//
update t2 set a1 = 4 where a2 = 'AA';
select * from t1;
c1	c2
1	21
1	20
20	14
drop trigger if exists tg1;
create trigger tg1
AFTER
delete on t2
for each ROW
BEGIN
delete from t1 where c1 = second('19990909152020');
END
//
delete from t2 where a1 = 3;
select * from t1;
c1	c2
1	21
1	20
drop database db1;
