drop database if exists db1;
create database db1;
use db1;
set timestamp = 1600000000;
#参数YYYY-MM-DD HH:MM:SS
select year('0001-01-01');
year('0001-01-01')
1
select year('0000-01-01');
year('0000-01-01')
0
select year('-2001-01-01');
year('-2001-01-01')
NULL
Warnings:
Warning	5086	Not timestamp Can not cast varchar value to timestamp type
select year('2001-1-01');
year('2001-1-01')
2001
select year('1999-1-1');
year('1999-1-1')
1999
select year('1888-111-1');
year('1888-111-1')
NULL
Warnings:
Warning	5086	Not timestamp Can not cast varchar value to timestamp type
select year('0001-02-31');
year('0001-02-31')
NULL
Warnings:
Warning	5086	Not timestamp Can not cast varchar value to timestamp type
select year('1000-000000000000000000000000000000000000000000000000000000000000000000000000000000000000001-000000000000000000000000000000000000000000000000000000000000001');
year('1000-000000000000000000000000000000000000000000000000000000000000000000000000000000000000001-000000000000000000000000000000000000000000000000000000000000001')
1000
select year('0001-12-32');
year('0001-12-32')
NULL
Warnings:
Warning	5086	Not timestamp Can not cast varchar value to timestamp type
select year('001-1-1');
year('001-1-1')
1
select year('0010000-12-12');
year('0010000-12-12')
NULL
Warnings:
Warning	5086	Not timestamp Can not cast varchar value to timestamp type
select year('00100-12-12');
year('00100-12-12')
100
select year('00000000000000000000000000000000000000000000000000000000100-00000000000012-00000012');
year('00000000000000000000000000000000000000000000000000000000100-00000000000012-00000012')
100
select year('9999-12-31');
year('9999-12-31')
9999
select year('99909-12-31');
year('99909-12-31')
NULL
Warnings:
Warning	5086	Not timestamp Can not cast varchar value to timestamp type
select year('9999-12-31-01-01-01');
year('9999-12-31-01-01-01')
9999
select year('2000-02-29');
year('2000-02-29')
2000
select year('2000-02-29');
year('2000-02-29')
2000
select year('2020-02-02 14:11:11');
year('2020-02-02 14:11:11')
2020
select year('9999-12-31 10:61:11');
year('9999-12-31 10:61:11')
NULL
Warnings:
Warning	5086	Not timestamp Can not cast varchar value to timestamp type
select year('9999-12-31 24:01:01');
year('9999-12-31 24:01:01')
NULL
Warnings:
Warning	5086	Not timestamp Can not cast varchar value to timestamp type
select year('2020-2-2 14:11:11');
year('2020-2-2 14:11:11')
2020
select year('2020-2-2 14:11:60');
year('2020-2-2 14:11:60')
NULL
Warnings:
Warning	5086	Not timestamp Can not cast varchar value to timestamp type
#YY-MM-DD HH:MM:SS
select year('01-01-01 01:01:01');
year('01-01-01 01:01:01')
2001
select year('00-01-01 02:02:02');
year('00-01-01 02:02:02')
2000
select year('-01-01-01 03:03:03');
year('-01-01-01 03:03:03')
NULL
Warnings:
Warning	5086	Not timestamp Can not cast varchar value to timestamp type
select year('01-1-01 04:04:04');
year('01-1-01 04:04:04')
2001
select year('99-1-1 05:05:05');
year('99-1-1 05:05:05')
1999
select year('88-111-1 06:06:06');
year('88-111-1 06:06:06')
NULL
Warnings:
Warning	5086	Not timestamp Can not cast varchar value to timestamp type
select year('01-02-31 07:07:07');
year('01-02-31 07:07:07')
NULL
Warnings:
Warning	5086	Not timestamp Can not cast varchar value to timestamp type
#YYYYY^MM^DD HH+MM+SS
select year('0001^01^01 17+03+15');
year('0001^01^01 17+03+15')
1
select year('0000^01^01 15+15+15');
year('0000^01^01 15+15+15')
0
select year('-2001^01^01 16+15+30');
year('-2001^01^01 16+15+30')
NULL
Warnings:
Warning	5086	Not timestamp Can not cast varchar value to timestamp type
select year('2001^1^01 17+15+18');
year('2001^1^01 17+15+18')
2001
select year('1999^1^1 16+30+30');
year('1999^1^1 16+30+30')
1999
select year('1888^111^1 20+20+20');
year('1888^111^1 20+20+20')
NULL
Warnings:
Warning	5086	Not timestamp Can not cast varchar value to timestamp type
select year('0001^02^31 10+10+10');
year('0001^02^31 10+10+10')
NULL
Warnings:
Warning	5086	Not timestamp Can not cast varchar value to timestamp type
#YY^MM^DD HH+MM+SS
select year('01^01^01 01+01+01');
year('01^01^01 01+01+01')
2001
select year('00^01^01 2+2+2');
year('00^01^01 2+2+2')
2000
select year('-01^01^01 3+3+3');
year('-01^01^01 3+3+3')
NULL
Warnings:
Warning	5086	Not timestamp Can not cast varchar value to timestamp type
select year('01^1^01 4+4+4');
year('01^1^01 4+4+4')
2001
select year('99^1^1 5+5+5');
year('99^1^1 5+5+5')
1999
select year('88^111^1 6+6+6');
year('88^111^1 6+6+6')
NULL
Warnings:
Warning	5086	Not timestamp Can not cast varchar value to timestamp type
select year('01^02^31 7+7+7');
year('01^02^31 7+7+7')
NULL
Warnings:
Warning	5086	Not timestamp Can not cast varchar value to timestamp type
#YYYYY^MM^DD
select year('2020^02^02');
year('2020^02^02')
2020
select year('9999^12^31');
year('9999^12^31')
9999
select year('2020^2^2');
year('2020^2^2')
2020
select year('0001^12^32');
year('0001^12^32')
NULL
Warnings:
Warning	5086	Not timestamp Can not cast varchar value to timestamp type
select year('0001^1^1');
year('0001^1^1')
1
select year('0010000^12^12');
year('0010000^12^12')
NULL
Warnings:
Warning	5086	Not timestamp Can not cast varchar value to timestamp type
select year('00100^12^12');
year('00100^12^12')
100
#YY^MM^DD
select year('01^01^01');
year('01^01^01')
2001
select year('00^01^01');
year('00^01^01')
2000
select year('-01^01^01');
year('-01^01^01')
NULL
Warnings:
Warning	5086	Not timestamp Can not cast varchar value to timestamp type
select year('01^1^01');
year('01^1^01')
2001
select year('99^1^1');
year('99^1^1')
1999
select year('88^111^1');
year('88^111^1')
NULL
Warnings:
Warning	5086	Not timestamp Can not cast varchar value to timestamp type
select year('01^02^31');
year('01^02^31')
NULL
Warnings:
Warning	5086	Not timestamp Can not cast varchar value to timestamp type
#YYYY@MM@DD HH^MM^SS
select year('2018@09@13 21^15^10');
year('2018@09@13 21^15^10')
2018
select year('0001@09@13 21^15^10');
year('0001@09@13 21^15^10')
1
select year('0000@09@13 21^15^10');
year('0000@09@13 21^15^10')
0
select year('9999@09@13 21^15^10');
year('9999@09@13 21^15^10')
9999
select year('99999@09@13 21^15^10');
year('99999@09@13 21^15^10')
NULL
Warnings:
Warning	5086	Not timestamp Can not cast varchar value to timestamp type
#YY@MM@DD HH^MM^SS
select year('18@09@13 21^15^10');
year('18@09@13 21^15^10')
2018
select year('01@09@13 21^15^10');
year('01@09@13 21^15^10')
2001
select year('00@09@13 21^15^10');
year('00@09@13 21^15^10')
2000
select year('99@09@13 21^15^10');
year('99@09@13 21^15^10')
1999
select year('999@09@13 21^15^10');
year('999@09@13 21^15^10')
999
#参数为数字
select year(20200229);
year(20200229)
2020
select year(20200230);
year(20200230)
NULL
Warnings:
Warning	5086	Not timestamp Can not cast varchar value to timestamp type
select year(1);
year(1)
NULL
Warnings:
Warning	5086	Not timestamp Can not cast varchar value to timestamp type
select year(11);
year(11)
NULL
Warnings:
Warning	5086	Not timestamp Can not cast varchar value to timestamp type
select year(111);
year(111)
2000
select year(1111);
year(1111)
2000
select year(11111);
year(11111)
2001
select year(111111);
year(111111)
2011
select year(1111111);
year(1111111)
111
select year(11111111);
year(11111111)
1111
select year(00010101);
year(00010101)
2001
select year(00010101);
year(00010101)
2001
select year(00000101);
year(00000101)
2000
select year(99991231);
year(99991231)
9999
select year(99991232);
year(99991232)
NULL
Warnings:
Warning	5086	Not timestamp Can not cast varchar value to timestamp type
select year(20200229);
year(20200229)
2020
select year(20200230);
year(20200230)
NULL
Warnings:
Warning	5086	Not timestamp Can not cast varchar value to timestamp type
select year(19980909);
year(19980909)
1998
#参数为字符串
select year('1');
year('1')
NULL
Warnings:
Warning	5086	Not timestamp Can not cast varchar value to timestamp type
select year('11');
year('11')
NULL
Warnings:
Warning	5086	Not timestamp Can not cast varchar value to timestamp type
select year('111');
year('111')
NULL
Warnings:
Warning	5086	Not timestamp Can not cast varchar value to timestamp type
select year('1111');
year('1111')
NULL
Warnings:
Warning	5086	Not timestamp Can not cast varchar value to timestamp type
select year('11111');
year('11111')
2011
select year('111111');
year('111111')
2011
select year('1111111');
year('1111111')
2011
select year('11111111');
year('11111111')
1111
select year('19980909');
year('19980909')
1998
select year('00010101');
year('00010101')
1
select year('00000101');
year('00000101')
0
select year('99991231');
year('99991231')
9999
select year('99991132');
year('99991132')
NULL
Warnings:
Warning	5086	Not timestamp Can not cast varchar value to timestamp type
select year('99991232');
year('99991232')
NULL
Warnings:
Warning	5086	Not timestamp Can not cast varchar value to timestamp type
#多个参数
select year(2011-01-01,11);
ERROR 42000: You have an error in your SQL syntax; check the manual that corresponds to your OceanBase version for the right syntax to use near ',11)' at line 1
select year(2011-01-01,2011-01-01);
ERROR 42000: You have an error in your SQL syntax; check the manual that corresponds to your OceanBase version for the right syntax to use near ',2011-01-01)' at line 1
#为空
select year();
ERROR 42000: You have an error in your SQL syntax; check the manual that corresponds to your OceanBase version for the right syntax to use near ')' at line 1
select year( );
ERROR 42000: You have an error in your SQL syntax; check the manual that corresponds to your OceanBase version for the right syntax to use near ')' at line 1
select year('');
year('')
NULL
Warnings:
Warning	5086	Not timestamp Can not cast varchar value to timestamp type
select year(' ');
year(' ')
NULL
Warnings:
Warning	5086	Not timestamp Can not cast varchar value to timestamp type
select year(null);
year(null)
NULL
select year('null');
year('null')
NULL
Warnings:
Warning	5086	Not timestamp Can not cast varchar value to timestamp type
#字符串
select year('2020a0202');
year('2020a0202')
NULL
Warnings:
Warning	5086	Not timestamp Can not cast varchar value to timestamp type
select year('AAABBBCCC');
year('AAABBBCCC')
NULL
Warnings:
Warning	5086	Not timestamp Can not cast varchar value to timestamp type
select year('a1b1c2c3c5c2');
year('a1b1c2c3c5c2')
NULL
Warnings:
Warning	5086	Not timestamp Can not cast varchar value to timestamp type
#中文
select year('2020年');
year('2020年')
NULL
Warnings:
Warning	5086	Not timestamp Can not cast varchar value to timestamp type
select year('吱吱吱吱');
year('吱吱吱吱')
NULL
Warnings:
Warning	5086	Not timestamp Can not cast varchar value to timestamp type
#特殊字符
select year('@#%#%^#%');
year('@#%#%^#%')
NULL
Warnings:
Warning	5086	Not timestamp Can not cast varchar value to timestamp type
select year('/*-+*-*-');
year('/*-+*-*-')
NULL
Warnings:
Warning	5086	Not timestamp Can not cast varchar value to timestamp type
select year('{:}}{":"');
year('{:}}{":"')
NULL
Warnings:
Warning	5086	Not timestamp Can not cast varchar value to timestamp type
#参数为不同类型测试。
#INT
create table test1(c1 int , c2 int);
insert into test1 values(123456,20210918);
select year(c1) from test1;
year(c1)
NULL
Warnings:
Warning	5086	Not timestamp Can not cast varchar value to timestamp type
select year(c2) from test1;
year(c2)
2021
drop table test1;
#FLOAT
create table test1(c1 float , c2 float);
insert into test1 values(123.456,2021.0918);
select year(c1) from test1;
year(c1)
2000
select year(c2) from test1;
year(c2)
NULL
Warnings:
Warning	5086	Not timestamp Can not cast varchar value to timestamp type
drop table test1;
#DOUBLE
create table test1(c1 double , c2 double);
insert into test1 values(20200202.00002,2021.0918);
select year(c1) from test1;
year(c1)
2020
select year(c2) from test1;
year(c2)
NULL
Warnings:
Warning	5086	Not timestamp Can not cast varchar value to timestamp type
drop table test1;
#CHAR
create table test1(c1 char(100),c2 char(100));
insert into test1 values('20210918','2020-02-02');
select year(c1) from test1;
year(c1)
2021
select year(c2) from test1;
year(c2)
2020
drop table test1;
#varchar
create table test1(c1 varchar(100),c2 varchar(100));
insert into test1 values('20210918','1000-01-01 12:33:33');
select year(c1) from test1;
year(c1)
2021
select year(c2) from test1;
year(c2)
1000
drop table test1;
#date
create table test1(c1 date,c2 date);
insert into test1 values('1000-01-01','10000101');
select year(c1) from test1;
year(c1)
1000
select year(c2) from test1;
year(c2)
1000
drop table test1;
#time
create table test1(c1 time,c2 time);
insert into test1 values('10:10:10','15:41:20');
select year(c1) from test1;
year(c1)
2020
select year(c2) from test1;
year(c2)
2020
drop table test1;
#year
create table test1(c1 year,c2 year);
insert into test1 values('1901','2155');
select year(c1) from test1;
year(c1)
NULL
Warnings:
Warning	5086	Not timestamp Can not cast varchar value to timestamp type
select year(c2) from test1;
year(c2)
NULL
Warnings:
Warning	5086	Not timestamp Can not cast varchar value to timestamp type
drop table test1;
#datetime
create table test1(c1 datetime,c2 datetime);
insert into test1 values('9999-12-31 23:59:59','1000-01-01 00:00:00');
select year(c1) from test1;
year(c1)
9999
select year(c2) from test1;
year(c2)
1000
drop table test1;
#timestamp
create table test1(c1 timestamp,c2 timestamp);
insert into test1 values('1970-01-01 00:00:01','2038-01-19 03:14:07');
select year(c1) from test1;
year(c1)
1970
select year(c2) from test1;
year(c2)
2038
drop table test1;
#decimal
create table test1(c1 decimal(5,2),c2 decimal(15,5));
insert into test1 values(202.12,20210922.1030);
select year(c1) from test1;
year(c1)
2000
select year(c2) from test1;
year(c2)
2021
drop table test1;
#bit
create table test1(c1 bit(64),c2 bit(1));
insert into test1 values(20200202,b'1');
select year(c1) from test1;
year(c1)
NULL
Warnings:
Warning	5086	Not timestamp Can not cast varchar value to timestamp type
select year(c2) from test1;
year(c2)
NULL
Warnings:
Warning	5086	Not timestamp Can not cast varchar value to timestamp type
drop table test1;
#enum
create table test1(c1 enum('2020-02-02','10100101','88880808'));
insert into test1 values('2020-02-02');
insert into test1 values('10100101');
insert into test1 values('88880808');
select year(c1) from test1;
year(c1)
2020
1010
8888
drop table test1;
#set
create table test1(c1 set('0001-01-01','9999-12-31','2024-2-29'));
insert into test1 values('0001-01-01');
insert into test1 values('9999-12-31');
insert into test1 values('2024-2-29');
select year(c1) from test1;
year(c1)
1
9999
2024
drop table test1;
#select
drop table if exists t1;
Warnings:
Note	1051	Unknown table 'db1.t1'
create table t1(c1 int ,c2 varchar(60) not null,c3 datetime default '2020-08-08');
insert into t1 values(19990909,'2000-01-01','2001-02-02 03:03:03');
insert into t1(c1,c2) values(10000101,'33330303');
insert into t1 values(99991231,'00010101','1880-05-05 05:05:05');
insert into t1 values(66660606,'99990909090909','0001-01-01 01:01:01');
insert into t1(c1,c2) values(20000808,'11111111');
insert into t1 values(66660606,'99990909090909','0001-01-01 01:01:01');
select year(c1),year(c2),year(c3) from t1;
year(c1)	year(c2)	year(c3)
1999	2000	2001
1000	3333	2020
9999	1	1880
6666	9999	1
2000	1111	2020
6666	9999	1
#where
select year(c1) from t1 where year(c1) > 5000 and year(c2) < 7000;
year(c1)
9999
select year(c3) from t1 where year(c2) < 2000 and year(c3) >2000;
year(c3)
2020
select * from t1 where year(c1)>year(c2) order by year(c1);
c1	c2	c3
20000808	11111111	2020-08-08 00:00:00
99991231	00010101	1880-05-05 05:05:05
select c1,case year(c1) when year(c1)> 5000 then year('0101-01-01') else year('2000-10-10') end as a from t1;
c1	a
19990909	2000
10000101	2000
99991231	2000
66660606	2000
20000808	2000
66660606	2000
select c1, case c2 when '11111111' then year('1111') else year('2020-02-02') end as a from t1;
c1	a
19990909	2020
10000101	2020
99991231	2020
66660606	2020
20000808	NULL
66660606	2020
Warnings:
Warning	5086	Not timestamp Can not cast varchar value to timestamp type
select distinct year(c1),c2,c3 from t1;
year(c1)	c2	c3
1999	2000-01-01	2001-02-02 03:03:03
1000	33330303	2020-08-08 00:00:00
9999	00010101	1880-05-05 05:05:05
6666	99990909090909	0001-01-01 01:01:01
2000	11111111	2020-08-08 00:00:00
select distinct year(c3) ,c1,c3 from t1;
year(c3)	c1	c3
2001	19990909	2001-02-02 03:03:03
2020	10000101	2020-08-08 00:00:00
1880	99991231	1880-05-05 05:05:05
1	66660606	0001-01-01 01:01:01
2020	20000808	2020-08-08 00:00:00
#参数为不同类型测试。
#INT
create table test1(c1 int , c2 int);
insert into test1 values(year('1999-09-09'),year('2222-02-02'));
insert into test1 values(year('2000-00-00'),year('3333-33-03'));
Warnings:
Warning	5086	Not timestamp Can not cast varchar value to timestamp type
select * from test1;
c1	c2
1999	2222
2000	NULL
drop table test1;
#FLOAT
#DOUBLE
create table test1(c1 double , c2 double);
insert into test1 values(year('2022-09-13'),year('2021-01-01 11:11:11'));
insert into test1 values(year('aa'),year('1000'));
ERROR 22007: Incorrect datetime value for column 'c1' at row 1
select * from test1;
c1	c2
2022	2021
drop table test1;
#CHAR
create table test1(c1 char(100),c2 char(100));
insert into test1 values(year('12341122'),year('2121-01-01'));
insert into test1 values(year('1101-01-01'),year('2222-01-02'));
select * from test1;
c1	c2
1234	2121
1101	2222
drop table test1;
#varchar
create table test1(c1 varchar(100),c2 varchar(100));
insert into test1 values(year('1998-09-09'),year(10101010));
insert into test1 values(year('22221111'),year('9999-09-19'));
select * from test1;
c1	c2
1998	1010
2222	9999
drop table test1;
#date
#OB插入数据成功，mysql报错
#time
create table test1(c1 time,c2 time);
insert into test1 values(year('2020-08-08'),year('1111-12-12'));
insert into test1 values(year('1998-08-08'),year('2050-05-05'));
ERROR 22007: Incorrect datetime value for column 'c1' at row 1
select * from test1;
c1	c2
00:20:20	00:11:11
drop table test1;
#year
create table test1(c1 year,c2 year);
insert into test1 values(year('2010-10-10'),year('9999-09-09'));
ERROR 22003: Out of range value for column 'c2' at row 1
insert into test1 values(year('1977-07-07'),year(20200220));
select * from test1;
c1	c2
1977	2020
drop table test1;
#datetime
create table test1(c1 datetime,c2 datetime);
insert into test1 values(year('1998-09-09'),year(10101010));
ERROR 22007: Incorrect datetime value for column 'c1' at row 1
insert into test1 values(year('22221111'),year('9999-09-19'));
ERROR 22007: Incorrect datetime value for column 'c1' at row 1
select * from test1;
c1	c2
drop table test1;
#timestamp
create table test1(c1 timestamp,c2 timestamp);
insert into test1 values(year('1998-09-09'),year(10101010));
ERROR 22007: Incorrect datetime value for column 'c1' at row 1
insert into test1 values(year('22221111'),year('9999-09-19'));
ERROR 22007: Incorrect datetime value for column 'c1' at row 1
select * from test1;
c1	c2
drop table test1;
#decimal
create table test1(c1 decimal(10,2),c2 decimal(15,5));
insert into test1 values(year('2020-08-08'),year('1111-12-12'));
insert into test1 values(year('1998-08-08'),year('2050-05-05'));
select * from test1;
c1	c2
2020.00	1111.00000
1998.00	2050.00000
drop table test1;
#bit
create table test1(c1 bit(64),c2 bit(64));
insert into test1 values(year('1212-12-12'),year('32580930'));
insert into test1 values(year('77771211'),year(88880808));
select bin(c1),bin(c2) from test1;
bin(c1)	bin(c2)
10010111100	110010111010
1111001100001	10001010111000
drop table test1;
#enum
create table test1(c1 enum('2020','1010','8888'));
insert into test1 values(year('2020-02-02'));
ERROR 01000: Data truncated for column 'c1' at row 1
insert into test1 values(year('88880808'));
ERROR 01000: Data truncated for column 'c1' at row 1
select * from test1;
c1
drop table test1;
#set
create table test1(c1 set('0001','9999','2024'));
insert into test1 values(year('0001-01-01'));
insert into test1 values(year('9999-12-31'));
ERROR 01000: Data truncated for column 'c1' at row 1
select * from test1;
c1
0001
drop table test1;
drop table if exists test1;
Warnings:
Note	1051	Unknown table 'db1.test1'
create table test1(a1 int,a2 year,c1 datetime,c2 datetime);
insert into test1 values(1,year('1998-12-12 12:12:12'),convert_tz('1998-12-12 12:12:12','+00:00','+00:00'),convert_tz('2038-01-19 03:14:07','+00:00','+00:00'));
insert into test1 values(2,year('2002-02-02 10:00:00'),convert_tz('2002-02-02 10:00:00','+00:00','+00:00'),convert_tz('2034-02-22 00:50:20','+00:00','+00:00'));
insert into test1 values(3,year('2006-04-15 06:06:20'),convert_tz('2006-04-15 06:06:20','+00:00','+00:00'),convert_tz('2026-05-08 05:16:50','+00:00','+00:00'));
insert into test1 values(4,year('2012-12-12 12:12:12'),convert_tz('2012-12-12 12:12:12','+00:00','+00:00'),convert_tz('2030-08-16 14:05:50','+00:00','+00:00'));
select * from test1;
a1	a2	c1	c2
1	1998	1998-12-12 12:12:12	2038-01-19 03:14:07
2	2002	2002-02-02 10:00:00	2034-02-22 00:50:20
3	2006	2006-04-15 06:06:20	2026-05-08 05:16:50
4	2012	2012-12-12 12:12:12	2030-08-16 14:05:50
update test1 set a1 = year('2008-08-08') where year(c1)>'2010';
update test1 set a2 = year('2019-10-01') where year(c1) = (select max(year(c1)) from test1);
select * from test1;
a1	a2	c1	c2
1	1998	1998-12-12 12:12:12	2038-01-19 03:14:07
2	2002	2002-02-02 10:00:00	2034-02-22 00:50:20
3	2006	2006-04-15 06:06:20	2026-05-08 05:16:50
2008	2019	2012-12-12 12:12:12	2030-08-16 14:05:50
delete from test1 where a2 = (select min(year(c1)) from test1);
delete from test1 where year(c2) < '2050';
select * from test1;
a1	a2	c1	c2
drop table test1;
#复制表
create table test1(a1 int,a2 year,c1 datetime,c2 datetime);
insert into test1 values(1,year('1998-12-12 12:12:12'),convert_tz('1998-12-12 12:12:12','+00:00','+00:00'),convert_tz('2038-01-19 03:14:07','+00:00','+00:00'));
insert into test1 values(2,year('2002-02-02 10:00:00'),convert_tz('2002-02-02 10:00:00','+00:00','+00:00'),convert_tz('2034-02-22 00:50:20','+00:00','+00:00'));
insert into test1 values(3,year('2006-04-15 06:06:20'),convert_tz('2006-04-15 06:06:20','+00:00','+00:00'),convert_tz('2026-05-08 05:16:50','+00:00','+00:00'));
insert into test1 values(4,year('2012-12-12 12:12:12'),convert_tz('2012-12-12 12:12:12','+00:00','+00:00'),convert_tz('2030-08-16 14:05:50','+00:00','+00:00'));
insert into test1 values(4,year('2012-12-12 12:12:12'),convert_tz('2012-12-12 12:12:12','+00:00','+00:00'),convert_tz('2030-08-16 14:05:50','+00:00','+00:00'));
create table tt1 as select * from test1;
select * from tt1;
a1	a2	c1	c2
1	1998	1998-12-12 12:12:12	2038-01-19 03:14:07
2	2002	2002-02-02 10:00:00	2034-02-22 00:50:20
3	2006	2006-04-15 06:06:20	2026-05-08 05:16:50
4	2012	2012-12-12 12:12:12	2030-08-16 14:05:50
4	2012	2012-12-12 12:12:12	2030-08-16 14:05:50
select * from tt1 where year(c1) >='2006';
a1	a2	c1	c2
3	2006	2006-04-15 06:06:20	2026-05-08 05:16:50
4	2012	2012-12-12 12:12:12	2030-08-16 14:05:50
4	2012	2012-12-12 12:12:12	2030-08-16 14:05:50
select * from tt1 where a2 = year(c1) and a2 >2000 order by year(c2);
a1	a2	c1	c2
3	2006	2006-04-15 06:06:20	2026-05-08 05:16:50
4	2012	2012-12-12 12:12:12	2030-08-16 14:05:50
4	2012	2012-12-12 12:12:12	2030-08-16 14:05:50
2	2002	2002-02-02 10:00:00	2034-02-22 00:50:20
select * from tt1 where a2 = year(c1) and  year(c1)>'1900' group by a2;
a1	a2	c1	c2
1	1998	1998-12-12 12:12:12	2038-01-19 03:14:07
2	2002	2002-02-02 10:00:00	2034-02-22 00:50:20
3	2006	2006-04-15 06:06:20	2026-05-08 05:16:50
4	2012	2012-12-12 12:12:12	2030-08-16 14:05:50
select * from tt1 where a2 = year(c1) and  year(c1)>'1900' group by a2 having max(year(c2)>'2030');
a1	a2	c1	c2
1	1998	1998-12-12 12:12:12	2038-01-19 03:14:07
2	2002	2002-02-02 10:00:00	2034-02-22 00:50:20
select c1,case year(c1) when year(c1)> 2005 then year('0101-01-01') else year('2000-10-10') end as a from tt1;
c1	a
1998-12-12 12:12:12	2000
2002-02-02 10:00:00	2000
2006-04-15 06:06:20	2000
2012-12-12 12:12:12	2000
2012-12-12 12:12:12	2000
select c1, case c2 when '11111111' then year('1111') else year('2020-02-02') end as a from tt1;
c1	a
1998-12-12 12:12:12	2020
2002-02-02 10:00:00	2020
2006-04-15 06:06:20	2020
2012-12-12 12:12:12	2020
2012-12-12 12:12:12	2020
select distinct year(c1),c2 from tt1;
year(c1)	c2
1998	2038-01-19 03:14:07
2002	2034-02-22 00:50:20
2006	2026-05-08 05:16:50
2012	2030-08-16 14:05:50
update tt1 set a1 = year(c1) where year(c1)>'2010';
delete from tt1 where year(c2) > '1900';
drop table tt1,test1;
#分区
#hash
drop table if exists t1;
create table t1(c1 year,c2 datetime) partition by hash(c1)
(
partition p1,
partition p2
);
insert into t1 values(year('1991-01-01'),'1991-01-01 08:08:08');
insert into t1 values(year('2001-01-01'),'2001-01-01 08:08:08');
insert into t1 values(year('2011-01-01'),'2011-01-01 08:08:08');
insert into t1 values(year('2021-01-01'),'2021-01-01 08:08:08');
insert into t1 values(year('2021-01-01'),'2021-01-01 08:08:08');
select * from t1;
c1	c2
1991	1991-01-01 08:08:08
2001	2001-01-01 08:08:08
2011	2011-01-01 08:08:08
2021	2021-01-01 08:08:08
2021	2021-01-01 08:08:08
select * from t1 where year(c2) > '1990' group by c1 having max(year(c2))<'2015';
c1	c2
1991	1991-01-01 08:08:08
2001	2001-01-01 08:08:08
2011	2011-01-01 08:08:08
update t1 set c1 = year('2009-09-09') where year(c2) > '2020';
select * from t1;
c1	c2
1991	1991-01-01 08:08:08
2001	2001-01-01 08:08:08
2011	2011-01-01 08:08:08
2009	2021-01-01 08:08:08
2009	2021-01-01 08:08:08
delete from t1 where year(c2) > '1999';
select * from t1;
c1	c2
1991	1991-01-01 08:08:08
drop table t1;
#range
drop table if exists t1;
Warnings:
Note	1051	Unknown table 'db1.t1'
create table t1(c1 year ,c2 datetime) partition by range(c1)
(
partition p1 values less than(year('1980-01-01')),
partition p2 values less than(maxvalue)
);
insert into t1 values(year('1970-01-01'),'1970-01-01 08:08:08');
insert into t1 values(year('1971-01-01'),'1971-01-01 08:08:08');
insert into t1 values(year('1971-01-01'),'1971-01-01 08:08:08');
insert into t1 values(year('2021-01-01'),'2021-01-01 08:08:08');
insert into t1 values(year('2021-01-01'),'2021-01-01 08:08:08');
select * from t1;
c1	c2
1970	1970-01-01 08:08:08
1971	1971-01-01 08:08:08
1971	1971-01-01 08:08:08
2021	2021-01-01 08:08:08
2021	2021-01-01 08:08:08
select * from t1 partition(p1) where year(c2)>'1969' group by c1 having max(year(c2)>'1970');
c1	c2
1971	1971-01-01 08:08:08
update t1 partition(p2) set c1 = year('2010-10-10') where year(c2)> '1999';
select * from t1;
c1	c2
1970	1970-01-01 08:08:08
1971	1971-01-01 08:08:08
1971	1971-01-01 08:08:08
2010	2021-01-01 08:08:08
2010	2021-01-01 08:08:08
delete from t1 partition(p2) where year(c2)>'2000';
select * from t1;
c1	c2
1970	1970-01-01 08:08:08
1971	1971-01-01 08:08:08
1971	1971-01-01 08:08:08
drop table t1;
#list
drop table if exists t1;
Warnings:
Note	1051	Unknown table 'db1.t1'
#OB报错，mysql执行成功
create table t1(c1 year,c2 year) partition by list(c1)
(
partition p0 values in(year('1900-01-01'),year('1950-01-01'),year('2020-01-01'),year('2070-01-01')),
partition p1 values in(year('3030-12-31'),year('4030-12-31'),year('5030-12-31'),year('6030-12-31'))
);
ERROR HY000: Multiple definition of same constant in list partitioning
#key
drop table if exists t1;
Warnings:
Note	1051	Unknown table 'db1.t1'
create table t1(c1 year primary key , c2 datetime)
partition by key(c1)
partitions 2;
insert into t1 values(year('1970-01-01'),'1970-01-01 08:08:08');
insert into t1 values(year('1981-01-01'),'1971-01-01 08:08:08');
insert into t1 values(year('1991-01-01'),'1971-01-01 08:08:08');
insert into t1 values(year('2021-01-01'),'2021-01-01 08:08:08');
insert into t1 values(year('2031-01-01'),'2021-01-01 08:08:08');
select * from t1;
c1	c2
1981	1971-01-01 08:08:08
2021	2021-01-01 08:08:08
1970	1970-01-01 08:08:08
1991	1971-01-01 08:08:08
2031	2021-01-01 08:08:08
select * from t1 partition(p0) where year(c2)>'1969' group by c1 having max(year(c2)>'1970');
c1	c2
1981	1971-01-01 08:08:08
2021	2021-01-01 08:08:08
#OB报错，mysql执行成功
update t1 partition(p1) set c1 = year('2010-10-10') where year(c2)> '1999';
ERROR HY000: Found a row not matching the given partition set
delete from t1 partition(p1) where year(c2)>'2000';
select * from t1;
c1	c2
1981	1971-01-01 08:08:08
2021	2021-01-01 08:08:08
1970	1970-01-01 08:08:08
1991	1971-01-01 08:08:08
drop table t1;
#range columns
drop table if exists t1;
Warnings:
Note	1051	Unknown table 'db1.t1'
CREATE TABLE t1 (
c1 year,
c2 datetime
)
PARTITION BY RANGE COLUMNS(c1) (
partition p1 values less than(year('1980-01-01')),
partition p2 values less than(maxvalue)
);
#columns list
drop table if exists t1;
create table t1(c1 year,c2 datetime)
partition by list columns(c1)
(
partition p0 values in(year('1900-01-01'),year('1950-01-01'),year('2020-01-01'),year('2070-01-01')),
partition p1 values in(year('3030-12-31'),year('4030-12-31'),year('5030-12-31'),year('6030-12-31'))
);
ERROR HY000: Multiple definition of same constant in list partitioning
#view
drop table if exists test1;
Warnings:
Note	1051	Unknown table 'db1.test1'
create table test1(a1 int,a2 year,c1 datetime,c2 datetime);
insert into test1 values(1,year('1998-12-12 12:12:12'),convert_tz('1998-12-12 12:12:12','+00:00','+00:00'),convert_tz('2038-01-19 03:14:07','+00:00','+00:00'));
insert into test1 values(2,year('2002-02-02 10:00:00'),convert_tz('2002-02-02 10:00:00','+00:00','+00:00'),convert_tz('2034-02-22 00:50:20','+00:00','+00:00'));
insert into test1 values(3,year('2006-04-15 06:06:20'),convert_tz('2006-04-15 06:06:20','+00:00','+00:00'),convert_tz('2026-05-08 05:16:50','+00:00','+00:00'));
insert into test1 values(4,year('2012-12-12 12:12:12'),convert_tz('2012-12-12 12:12:12','+00:00','+00:00'),convert_tz('2030-08-16 14:05:50','+00:00','+00:00'));
insert into test1 values(4,year('2012-12-12 12:12:12'),convert_tz('2012-12-12 12:12:12','+00:00','+00:00'),convert_tz('2030-08-16 14:05:50','+00:00','+00:00'));
create view v_t1 as select * from test1;
select * from v_t1;
a1	a2	c1	c2
1	1998	1998-12-12 12:12:12	2038-01-19 03:14:07
2	2002	2002-02-02 10:00:00	2034-02-22 00:50:20
3	2006	2006-04-15 06:06:20	2026-05-08 05:16:50
4	2012	2012-12-12 12:12:12	2030-08-16 14:05:50
4	2012	2012-12-12 12:12:12	2030-08-16 14:05:50
select * from v_t1 where year(c1) >='2006';
a1	a2	c1	c2
3	2006	2006-04-15 06:06:20	2026-05-08 05:16:50
4	2012	2012-12-12 12:12:12	2030-08-16 14:05:50
4	2012	2012-12-12 12:12:12	2030-08-16 14:05:50
select * from v_t1 where a2 = year(c1) and a2 >2000 order by year(c2);
a1	a2	c1	c2
3	2006	2006-04-15 06:06:20	2026-05-08 05:16:50
4	2012	2012-12-12 12:12:12	2030-08-16 14:05:50
4	2012	2012-12-12 12:12:12	2030-08-16 14:05:50
2	2002	2002-02-02 10:00:00	2034-02-22 00:50:20
select * from v_t1 where a2 = year(c1) and  year(c1)>'1900' group by a2;
a1	a2	c1	c2
1	1998	1998-12-12 12:12:12	2038-01-19 03:14:07
2	2002	2002-02-02 10:00:00	2034-02-22 00:50:20
3	2006	2006-04-15 06:06:20	2026-05-08 05:16:50
4	2012	2012-12-12 12:12:12	2030-08-16 14:05:50
select * from v_t1 where a2 = year(c1) and  year(c1)>'1900' group by a2 having max(year(c2)>'2030');
a1	a2	c1	c2
1	1998	1998-12-12 12:12:12	2038-01-19 03:14:07
2	2002	2002-02-02 10:00:00	2034-02-22 00:50:20
select c1,case year(c1) when year(c1)> 2005 then year('0101-01-01') else year('2000-10-10') end as a from v_t1;
c1	a
1998-12-12 12:12:12	2000
2002-02-02 10:00:00	2000
2006-04-15 06:06:20	2000
2012-12-12 12:12:12	2000
2012-12-12 12:12:12	2000
select c1, case c2 when '11111111' then year('1111') else year('2020-02-02') end as a from v_t1;
c1	a
1998-12-12 12:12:12	2020
2002-02-02 10:00:00	2020
2006-04-15 06:06:20	2020
2012-12-12 12:12:12	2020
2012-12-12 12:12:12	2020
select distinct year(c1),c2 from v_t1;
year(c1)	c2
1998	2038-01-19 03:14:07
2002	2034-02-22 00:50:20
2006	2026-05-08 05:16:50
2012	2030-08-16 14:05:50
update v_t1 set a1 = year(c1) where year(c1)>'2010';
delete from v_t1 where year(c2) > '1900';
drop table test1;
drop view v_t1;
#生成列
drop table if exists t1;
Warnings:
Note	1051	Unknown table 'db1.t1'
CREATE TABLE t1(c1 int,c2 int GENERATED ALWAYS AS (year('2020-02-02')) VIRTUAL);
insert into t1(c1) values(year('0001-01-01'));
insert into t1(c1) values(year('9999-12-31'));
select * from t1;
c1	c2
1	2020
9999	2020
drop table t1;
#算术运算符
#'+'
select year('1010-01-01'+'1019-09-09');
year('1010-01-01'+'1019-09-09')
NULL
Warnings:
Warning	1292	Truncated incorrect DOUBLE value: '1010-01-01'
Warning	1292	Truncated incorrect DOUBLE value: '1019-09-09'
Warning	5086	Not timestamp Can not cast varchar value to timestamp type
select year('1010-01-01'+'');
year('1010-01-01'+'')
2000
Warnings:
Warning	1292	Truncated incorrect DOUBLE value: '1010-01-01'
select year('1010-01-01'+' ');
year('1010-01-01'+' ')
2000
Warnings:
Warning	1292	Truncated incorrect DOUBLE value: '1010-01-01'
select year('1010-01-01'+0001);
year('1010-01-01'+0001)
2000
Warnings:
Warning	1292	Truncated incorrect DOUBLE value: '1010-01-01'
select year('1010-01-01'+2001);
year('1010-01-01'+2001)
NULL
Warnings:
Warning	1292	Truncated incorrect DOUBLE value: '1010-01-01'
Warning	5086	Not timestamp Can not cast varchar value to timestamp type
select year('0001-01-01')+year('9999-12-31');
year('0001-01-01')+year('9999-12-31')
10000
select year('2020-02-02')+year('2003-02-29');
year('2020-02-02')+year('2003-02-29')
NULL
Warnings:
Warning	5086	Not timestamp Can not cast varchar value to timestamp type
select year('2020-02-02')+year('aaa');
year('2020-02-02')+year('aaa')
NULL
Warnings:
Warning	5086	Not timestamp Can not cast varchar value to timestamp type
#'-'
select year('1010-01-01'-'1019-09-09');
year('1010-01-01'-'1019-09-09')
NULL
Warnings:
Warning	1292	Truncated incorrect DOUBLE value: '1010-01-01'
Warning	1292	Truncated incorrect DOUBLE value: '1019-09-09'
Warning	5086	Not timestamp Can not cast varchar value to timestamp type
select year('1010-01-01'-'');
year('1010-01-01'-'')
2000
Warnings:
Warning	1292	Truncated incorrect DOUBLE value: '1010-01-01'
select year('1010-01-01'-' ');
year('1010-01-01'-' ')
2000
Warnings:
Warning	1292	Truncated incorrect DOUBLE value: '1010-01-01'
select year('1010-01-01'-0001);
year('1010-01-01'-0001)
2000
Warnings:
Warning	1292	Truncated incorrect DOUBLE value: '1010-01-01'
select year('1010-01-01'-2001);
year('1010-01-01'-2001)
NULL
Warnings:
Warning	1292	Truncated incorrect DOUBLE value: '1010-01-01'
Warning	5086	Not timestamp Can not cast varchar value to timestamp type
select year('0001-01-01')-year('9999-12-31');
year('0001-01-01')-year('9999-12-31')
-9998
select year('2020-02-02')-year('2003-02-29');
year('2020-02-02')-year('2003-02-29')
NULL
Warnings:
Warning	5086	Not timestamp Can not cast varchar value to timestamp type
select year('2020-02-02')-year('aaa');
year('2020-02-02')-year('aaa')
NULL
Warnings:
Warning	5086	Not timestamp Can not cast varchar value to timestamp type
#'*'
select year('2020'*'2021');
year('2020'*'2021')
NULL
Warnings:
Warning	5086	Not timestamp Can not cast varchar value to timestamp type
select year(2020*2021);
year(2020*2021)
NULL
Warnings:
Warning	5086	Not timestamp Can not cast varchar value to timestamp type
select year(1234011*10);
year(1234011*10)
1234
#'/'
select year(202001010/10);
year(202001010/10)
2020
select year(2222222/2);
year(2222222/2)
111
select year('11110101'/2);
year('11110101'/2)
NULL
Warnings:
Warning	5086	Not timestamp Can not cast varchar value to timestamp type
#逻辑运算符
select year('2021-01-01') and year('22222222222');
year('2021-01-01') and year('22222222222')
NULL
Warnings:
Warning	5086	Not timestamp Can not cast varchar value to timestamp type
select year('1921-10-10') and year('1988-08-08');
year('1921-10-10') and year('1988-08-08')
1
select not year('1111-01-01') ;
not year('1111-01-01')
0
select not year(' ') ;
not year(' ')
NULL
Warnings:
Warning	5086	Not timestamp Can not cast varchar value to timestamp type
select not year('1111-01-0111') ;
not year('1111-01-0111')
NULL
Warnings:
Warning	5086	Not timestamp Can not cast varchar value to timestamp type
select year('2021-01-01') or year('22222222222');
year('2021-01-01') or year('22222222222')
1
select year('1921-10-10') or year('1988-08-08');
year('1921-10-10') or year('1988-08-08')
1
select year('1800-10-10') or year('1800-10-10');
year('1800-10-10') or year('1800-10-10')
1
select year('2121-12-12') or ('2');
year('2121-12-12') or ('2')
1
select year('2121-12-12') or 'aa';
year('2121-12-12') or 'aa'
1
#比较运算符
select year('2020-01-01') > year('2020-01-02');
year('2020-01-01') > year('2020-01-02')
0
select year('3800-01-01') > year('2050-01-02');
year('3800-01-01') > year('2050-01-02')
1
select year('0001-01-01') > year('0000-01-01');
year('0001-01-01') > year('0000-01-01')
1
select year('0001-01-01') > 'AA';
year('0001-01-01') > 'AA'
1
Warnings:
Warning	1292	Truncated incorrect DECIMAL value: 'AA'
select year('0001-01-01') >1;
year('0001-01-01') >1
0
select year('2020-01-01') < year('2020-01-02');
year('2020-01-01') < year('2020-01-02')
0
select year('3800-01-01') < year('2050-01-02');
year('3800-01-01') < year('2050-01-02')
0
select year('2020-01-01') < year('0000-01-01');
year('2020-01-01') < year('0000-01-01')
0
select year('1500-01-01') < 'Abc';
year('1500-01-01') < 'Abc'
0
Warnings:
Warning	1292	Truncated incorrect DECIMAL value: 'Abc'
select year('2000-01-01') < 1998;
year('2000-01-01') < 1998
0
select year('2020-01-01') >= year('2020-01-02');
year('2020-01-01') >= year('2020-01-02')
1
select year('3800-01-01 10:11:11') >= year('2050-01-01 08:08:08');
year('3800-01-01 10:11:11') >= year('2050-01-01 08:08:08')
1
select year('0001-01-01') >= year('0000-01-01');
year('0001-01-01') >= year('0000-01-01')
1
select year('0001-01-01') >= 'AA';
year('0001-01-01') >= 'AA'
1
Warnings:
Warning	1292	Truncated incorrect DECIMAL value: 'AA'
select year('0001-01-01') >=1;
year('0001-01-01') >=1
1
select year('20201111') <= year('2020-011-11');
year('20201111') <= year('2020-011-11')
1
select year(12341122) <= year(05711212);
year(12341122) <= year(05711212)
0
select year('1500-01-01') < 'CCC';
year('1500-01-01') < 'CCC'
0
Warnings:
Warning	1292	Truncated incorrect DECIMAL value: 'CCC'
select year('2499-12-31') < 2500;
year('2499-12-31') < 2500
1
#时间函数嵌套
#now
#localtime/localtimestamp
#date
select year(date('2003-12-31 01:02:03'));
year(date('2003-12-31 01:02:03'))
2003
#date_add/sub
select year(DATE_ADD('2018-05-01',INTERVAL 1 DAY));
year(DATE_ADD('2018-05-01',INTERVAL 1 DAY))
2018
select year(DATE_SUB('2018-05-01',INTERVAL 1 YEAR));
year(DATE_SUB('2018-05-01',INTERVAL 1 YEAR))
2017
select year(DATE_ADD('2020-12-31 23:59:59',INTERVAL 1 SECOND));
year(DATE_ADD('2020-12-31 23:59:59',INTERVAL 1 SECOND))
2021
select year(DATE_ADD('2018-12-31 23:59:59',INTERVAL 1 DAY));
year(DATE_ADD('2018-12-31 23:59:59',INTERVAL 1 DAY))
2019
select year(DATE_ADD('2100-12-31 23:59:59',INTERVAL '1:1' MINUTE_SECOND));
year(DATE_ADD('2100-12-31 23:59:59',INTERVAL '1:1' MINUTE_SECOND))
2101
select year(DATE_SUB('2025-01-01 00:00:00',INTERVAL '1 1:1:1' DAY_SECOND));
year(DATE_SUB('2025-01-01 00:00:00',INTERVAL '1 1:1:1' DAY_SECOND))
2024
select year(DATE_ADD('1900-01-01 00:00:00',INTERVAL '-1 10' DAY_HOUR));
year(DATE_ADD('1900-01-01 00:00:00',INTERVAL '-1 10' DAY_HOUR))
1899
select year(DATE_SUB('1998-01-02', INTERVAL 31 DAY));
year(DATE_SUB('1998-01-02', INTERVAL 31 DAY))
1997
select year(DATE_ADD('1992-12-31 23:59:59.000002',INTERVAL '1.999999' SECOND_MICROSECOND));
year(DATE_ADD('1992-12-31 23:59:59.000002',INTERVAL '1.999999' SECOND_MICROSECOND))
1993
#date_format
select year(DATE_FORMAT('2009-10-04 22:23:00', '%W %M %Y'));
year(DATE_FORMAT('2009-10-04 22:23:00', '%W %M %Y'))
NULL
Warnings:
Warning	5086	Not timestamp Can not cast varchar value to timestamp type
select year(DATE_FORMAT('2007-10-04 22:23:00', '%H:%i:%s'));
year(DATE_FORMAT('2007-10-04 22:23:00', '%H:%i:%s'))
NULL
Warnings:
Warning	5086	Not timestamp Can not cast varchar value to timestamp type
select year(DATE_FORMAT('1900-10-04 22:23:00','%D %y %a %d %m %b %j'));
year(DATE_FORMAT('1900-10-04 22:23:00','%D %y %a %d %m %b %j'))
NULL
Warnings:
Warning	5086	Not timestamp Can not cast varchar value to timestamp type
select year(DATE_FORMAT('1997-10-04 22:23:00','%H %k %I %r %T %S %w'));
year(DATE_FORMAT('1997-10-04 22:23:00','%H %k %I %r %T %S %w'))
NULL
Warnings:
Warning	5086	Not timestamp Can not cast varchar value to timestamp type
select year(DATE_FORMAT('1999-01-01', '%X %V'));
year(DATE_FORMAT('1999-01-01', '%X %V'))
NULL
Warnings:
Warning	5086	Not timestamp Can not cast varchar value to timestamp type
select year(DATE_FORMAT('2006-06-00', '%d'));
year(DATE_FORMAT('2006-06-00', '%d'))
NULL
#form_days
select year(from_days(730669));
year(from_days(730669))
2000
select year(from_days(999999));
year(from_days(999999))
2737
select year(from_days(110000));
year(from_days(110000))
301
#from_unixtime
select year(FROM_UNIXTIME(1447430881));
year(FROM_UNIXTIME(1447430881))
2015
select year(FROM_UNIXTIME(1447430881) + 0);
year(FROM_UNIXTIME(1447430881) + 0)
2015
select year(FROM_UNIXTIME(1447430881,'%Y %D %M %h:%i:%s %x'));
year(FROM_UNIXTIME(1447430881,'%Y %D %M %h:%i:%s %x'))
NULL
Warnings:
Warning	5086	Not timestamp Can not cast varchar value to timestamp type
select year(DATE_FORMAT('2003-10-03',GET_FORMAT(DATE,'EUR')));
year(DATE_FORMAT('2003-10-03',GET_FORMAT(DATE,'EUR')))
2003
select year(STR_TO_DATE('10.31.2003',GET_FORMAT(DATE,'USA')));
year(STR_TO_DATE('10.31.2003',GET_FORMAT(DATE,'USA')))
2003
#last_day
select year(LAST_DAY('2003-02-05'));
year(LAST_DAY('2003-02-05'))
2003
select year(LAST_DAY('2004-02-05'));
year(LAST_DAY('2004-02-05'))
2004
select year(LAST_DAY('2004-01-01 01:01:01'));
year(LAST_DAY('2004-01-01 01:01:01'))
2004
select year(LAST_DAY('2003-03-32'));
year(LAST_DAY('2003-03-32'))
NULL
#makedate
select year(MAKEDATE(2011,31));
year(MAKEDATE(2011,31))
2011
select year(MAKEDATE(2011,32));
year(MAKEDATE(2011,32))
2011
select year(MAKEDATE(2011,365));
year(MAKEDATE(2011,365))
2011
select year(MAKEDATE(2014,365));
year(MAKEDATE(2014,365))
2014
select year(MAKEDATE(2011,0));
year(MAKEDATE(2011,0))
NULL
select year(PERIOD_ADD(200801,2));
year(PERIOD_ADD(200801,2))
2020
#str_to_date
select year(STR_TO_DATE('01,5,2013','%d,%m,%Y'));
year(STR_TO_DATE('01,5,2013','%d,%m,%Y'))
2013
select year(STR_TO_DATE('May 1, 2013','%M %d,%Y'));
year(STR_TO_DATE('May 1, 2013','%M %d,%Y'))
2013
select year(STR_TO_DATE('abc','abc'));
year(STR_TO_DATE('abc','abc'))
0
select year(STR_TO_DATE('9','%m'));
year(STR_TO_DATE('9','%m'))
NULL
Warnings:
Warning	1411	Incorrect datetime value: '9' for function str_to_date
select year(STR_TO_DATE('00/00/0000', '%m/%d/%Y'));
year(STR_TO_DATE('00/00/0000', '%m/%d/%Y'))
0
select year(STR_TO_DATE('04/31/2004', '%m/%d/%Y'));
year(STR_TO_DATE('04/31/2004', '%m/%d/%Y'))
NULL
Warnings:
Warning	1411	Incorrect datetime value: '04/31/2004' for function str_to_date
select year(STR_TO_DATE('200442 Monday', '%X%V %W'));
year(STR_TO_DATE('200442 Monday', '%X%V %W'))
2004
#subdate/time
select year(DATE_SUB('2008-01-02', INTERVAL 31 DAY));
year(DATE_SUB('2008-01-02', INTERVAL 31 DAY))
2007
select year(SUBDATE('2008-01-02', INTERVAL 31 DAY));
year(SUBDATE('2008-01-02', INTERVAL 31 DAY))
2007
select year(SUBDATE('2008-01-02 12:00:00', 31));
year(SUBDATE('2008-01-02 12:00:00', 31))
2007
select year(SUBTIME('2007-12-31 23:59:59.999999','1 1:1:1.000002'));
year(SUBTIME('2007-12-31 23:59:59.999999','1 1:1:1.000002'))
2007
#timestamp
select year(TIMESTAMP('2003-12-31'));
year(TIMESTAMP('2003-12-31'))
2003
select year(TIMESTAMP('2003-12-31 12:00:00','12:00:00'));
year(TIMESTAMP('2003-12-31 12:00:00','12:00:00'))
2004
select year(TIMESTAMPADD(MINUTE,1,'2003-01-02'));
year(TIMESTAMPADD(MINUTE,1,'2003-01-02'))
2003
select year(TIMESTAMPADD(WEEK,1,'2003-01-02'));
year(TIMESTAMPADD(WEEK,1,'2003-01-02'))
2003
#utc_date/timestamp
#convert_tz
select year(CONVERT_TZ('2004-01-01 12:00:00','+00:00','+10:00'));
year(CONVERT_TZ('2004-01-01 12:00:00','+00:00','+10:00'))
2004
select year(CONVERT_TZ('2004-01-01 12:00:00','+00:00','+20:00'));
year(CONVERT_TZ('2004-01-01 12:00:00','+00:00','+20:00'))
NULL
#其他函数
#concat
select year(concat('2020-','12-12'));
year(concat('2020-','12-12'))
2020
select year(concat('2021','1111'));
year(concat('2021','1111'))
2021
select year(concat('19980715','aa'));
year(concat('19980715','aa'))
NULL
Warnings:
Warning	5086	Not timestamp Can not cast varchar value to timestamp type
#ceil
select year(ceil(2.0111111));
year(ceil(2.0111111))
NULL
Warnings:
Warning	5086	Not timestamp Can not cast varchar value to timestamp type
select year(ceil(20121212.123456789));
year(ceil(20121212.123456789))
2012
select year(ceil(-20121212.123456789));
year(ceil(-20121212.123456789))
NULL
Warnings:
Warning	5086	Not timestamp Can not cast varchar value to timestamp type
#cast
select year(cast('2021-10-08 12:12:00' as int));
ERROR 42000: You have an error in your SQL syntax; check the manual that corresponds to your OceanBase version for the right syntax to use near 'int))' at line 1
select year(cast('2021-10-08 12:12:00' as double));
year(cast('2021-10-08 12:12:00' as double))
NULL
Warnings:
Warning	1292	Truncated incorrect DOUBLE value: '2021-10-08 12:12:00'
Warning	5086	Not timestamp Can not cast varchar value to timestamp type
#MYSQL报错，OB执行成功
select year(cast('2021-10-08 14:14:00' as float));
year(cast('2021-10-08 14:14:00' as float))
NULL
Warnings:
Warning	1292	Truncated incorrect DOUBLE value: '2021-10-08 14:14:00'
Warning	5086	Not timestamp Can not cast varchar value to timestamp type
select year(cast('2021-10-08 14:14:00' as char(100)));
year(cast('2021-10-08 14:14:00' as char(100)))
2021
select year(cast('2021-10-08 14:14:00' as varchar(100)));
ERROR 42000: You have an error in your SQL syntax; check the manual that corresponds to your OceanBase version for the right syntax to use near 'varchar(100)))' at line 1
select year(cast('2021-10-08 14:14:00' as date));
year(cast('2021-10-08 14:14:00' as date))
2021
select year(cast('2021-10-08 14:14:00' as time));
year(cast('2021-10-08 14:14:00' as time))
2020
select year(cast('2021-10-08 14:14:00' as datetime));
year(cast('2021-10-08 14:14:00' as datetime))
2021
select year(cast('2021-10-08 14:14:00' as timestamp));
ERROR 42000: You have an error in your SQL syntax; check the manual that corresponds to your OceanBase version for the right syntax to use near 'timestamp))' at line 1
select year(cast('2021-10-08 14:14:00' as decimal(15,5)));
year(cast('2021-10-08 14:14:00' as decimal(15,5)))
NULL
Warnings:
Warning	1292	Truncated incorrect DECIMAL value: '2021-10-08 14:14:00'
Warning	5086	Not timestamp Can not cast varchar value to timestamp type
#length
select year(length(11111111));
year(length(11111111))
NULL
Warnings:
Warning	5086	Not timestamp Can not cast varchar value to timestamp type
#substr
select year(substr('00000002121-01-01',5));
year(substr('00000002121-01-01',5))
2121
select year(substr('012300021212' from 8));
year(substr('012300021212' from 8))
NULL
Warnings:
Warning	5086	Not timestamp Can not cast varchar value to timestamp type
select year(substr('012300021212' from 7));
year(substr('012300021212' from 7))
2002
select year(substr('1111121211121212121212121',5,13));
year(substr('1111121211121212121212121',5,13))
2012
select year(substr('212312313-030303',2));
year(substr('212312313-030303',2))
NULL
Warnings:
Warning	5086	Not timestamp Can not cast varchar value to timestamp type
#reverse
select year(reverse('20120229'));
year(reverse('20120229'))
NULL
Warnings:
Warning	5086	Not timestamp Can not cast varchar value to timestamp type
select year(reverse('92202102'));
year(reverse('92202102'))
2012
select year(reverse(cast('2021-10-08 14:14:00' as datetime)));
year(reverse(cast('2021-10-08 14:14:00' as datetime)))
NULL
Warnings:
Warning	5086	Not timestamp Can not cast varchar value to timestamp type
#聚合函数
drop table if exists test1;
Warnings:
Note	1051	Unknown table 'db1.test1'
create table test1(a1 int,a2 year,c1 datetime,c2 datetime);
insert into test1 values(1,'1998','1998-12-12 12:12:12','2038-01-19 03:14:07');
insert into test1 values(2,'2002','2002-02-02 10:00:00','2034-02-22 00:50:20');
insert into test1 values(3,'2006','2006-04-15 06:06:20','2026-05-08 05:16:50');
insert into test1 values(4,'2012','2012-12-12 12:12:12','2030-08-16 14:05:50');
select * from test1;
a1	a2	c1	c2
1	1998	1998-12-12 12:12:12	2038-01-19 03:14:07
2	2002	2002-02-02 10:00:00	2034-02-22 00:50:20
3	2006	2006-04-15 06:06:20	2026-05-08 05:16:50
4	2012	2012-12-12 12:12:12	2030-08-16 14:05:50
#count
select count(year(c1)) from test1;
count(year(c1))
4
select year(count(c1)) from test1;
year(count(c1))
NULL
Warnings:
Warning	5086	Not timestamp Can not cast varchar value to timestamp type
select count(year(c2)) from test1;
count(year(c2))
4
select year(count(c2)) from test1;
year(count(c2))
NULL
Warnings:
Warning	5086	Not timestamp Can not cast varchar value to timestamp type
#max
select max(year(c1)) from test1;
max(year(c1))
2012
select year(max(c1)) from test1;
year(max(c1))
2012
select max(year(c2)) from test1;
max(year(c2))
2038
select year(max(c2)) from test1;
year(max(c2))
2038
#min
select min(year(c1)) from test1;
min(year(c1))
1998
select year(min(c1)) from test1;
year(min(c1))
1998
select max(year(c2)) from test1;
max(year(c2))
2038
select year(max(c2)) from test1;
year(max(c2))
2038
#avg
select avg(year(c1)) from test1;
avg(year(c1))
2004.5000
select year(avg(c1)) from test1;
year(avg(c1))
NULL
Warnings:
Warning	5086	Not timestamp Can not cast varchar value to timestamp type
select max(year(c2)) from test1;
max(year(c2))
2038
select year(max(c2)) from test1;
year(max(c2))
2038
#sum
select sum(year(c1)) from test1;
sum(year(c1))
8018
select year(sum(c1)) from test1;
year(sum(c1))
NULL
Warnings:
Warning	5086	Not timestamp Can not cast varchar value to timestamp type
select max(year(c2)) from test1;
max(year(c2))
2038
select year(max(c2)) from test1;
year(max(c2))
2038
drop table test1;
drop database db1;
