drop database if exists db1;
create database db1;
use db1;
#参数
#正常参数个数
#数字
select degrees(1),degrees(-1);
degrees(1)	degrees(-1)
57.29577951308232	-57.29577951308232
select degrees(1111111111111111111111111111111111111111111111111111111111111111);
degrees(1111111111111111111111111111111111111111111111111111111111111111)
6.366197723675815e64
select degrees(-12345678933333333333333333333333333333333333333333333333333333333333333333333333333333);
degrees(-12345678933333333333333333333333333333333333333333333333333333333333333333333333333333)
-7.07355298103572e86
select degrees(0.123456),degrees(-1.1111111);
degrees(0.123456)	degrees(-1.1111111)
7.073507755567091	-63.66197660013837
#OB返回结果为5.729577951308232e-71,mysql最接近0的正数
select degrees(0.000000000000000000000000000000000000000000000000000000000000000000000001);
degrees(0.000000000000000000000000000000000000000000000000000000000000000000000001)
5.729577951308232e-71
#OB返回5.729577951308232e-72,mysql返回0
select degrees(0.0000000000000000000000000000000000000000000000000000000000000000000000001);
degrees(0.0000000000000000000000000000000000000000000000000000000000000000000000001)
5.729577951308232e-72
#OB最接近0的正数,返回结果为5.729577951308233e-134,mysql 返回0
select degrees(0.000000000000000000000000000000000000000000000000000000000000000000000000000000000000000000000000000000000000000000000000000000000000001);
degrees(0.000000000000000000000000000000000000000000000000000000000000000000000000000000000000000000000000000000000000000000000000000000000000001)
5.729577951308233e-134
#OB返回0,mysql返回0
select degrees(0.0000000000000000000000000000000000000000000000000000000000000000000000000000000000000000000000000000000000000000000000000000000000000001);
degrees(0.0000000000000000000000000000000000000000000000000000000000000000000000000000000000000000000000000000000000000000000000000000000000000001)
0
#OB返回结果为-5.729577951308232e-71,mysql最接近0的负数
select degrees(-0.000000000000000000000000000000000000000000000000000000000000000000000001);
degrees(-0.000000000000000000000000000000000000000000000000000000000000000000000001)
-5.729577951308232e-71
#OB返回-5.729577951308232e-72,mysql返回0
select degrees(-0.0000000000000000000000000000000000000000000000000000000000000000000000001);
degrees(-0.0000000000000000000000000000000000000000000000000000000000000000000000001)
-5.729577951308232e-72
#OB最接近0的负数,返回结果为-5.729577951308233e-134,mysql 返回0
select degrees(-0.000000000000000000000000000000000000000000000000000000000000000000000000000000000000000000000000000000000000000000000000000000000000001);
degrees(-0.000000000000000000000000000000000000000000000000000000000000000000000000000000000000000000000000000000000000000000000000000000000000001)
-5.729577951308233e-134
#OB返回0,mysql返回0
select degrees(-0.0000000000000000000000000000000000000000000000000000000000000000000000000000000000000000000000000000000000000000000000000000000000000001);
degrees(-0.0000000000000000000000000000000000000000000000000000000000000000000000000000000000000000000000000000000000000000000000000000000000000001)
0
#字母
select degrees('a'),degrees('abcdefg');
degrees('a')	degrees('abcdefg')
0	0
Warnings:
Warning	1292	Truncated incorrect DOUBLE value: 'a'
Warning	1292	Truncated incorrect DOUBLE value: 'abcdefg'
select degrees('ccccccccccccccccccccccccccccccccc'),degrees('dddddddddddddddddddddddddddddddd');
degrees('ccccccccccccccccccccccccccccccccc')	degrees('dddddddddddddddddddddddddddddddd')
0	0
Warnings:
Warning	1292	Truncated incorrect DOUBLE value: 'ccccccccccccccccccccccccccccccccc'
Warning	1292	Truncated incorrect DOUBLE value: 'dddddddddddddddddddddddddddddddd'
#字符串
select degrees('a1111bac156132csaghg'),degrees('1245ascb4sd412asd');
degrees('a1111bac156132csaghg')	degrees('1245ascb4sd412asd')
0	71333.24549378749
Warnings:
Warning	1292	Truncated incorrect DOUBLE value: 'a1111bac156132csaghg'
Warning	1292	Truncated incorrect DOUBLE value: '1245ascb4sd412asd'
#特殊符号
select degrees('-'),degrees('$#');
degrees('-')	degrees('$#')
0	0
Warnings:
Warning	1292	Truncated incorrect DOUBLE value: '-'
Warning	1292	Truncated incorrect DOUBLE value: '$#'
select degrees('#$%^&*#%^*&#%'),degrees('/*-+-。‘’；；【‘；’‘；');
degrees('#$%^&*#%^*&#%')	degrees('/*-+-。‘’；；【‘；’‘；')
0	0
Warnings:
Warning	1292	Truncated incorrect DOUBLE value: '#$%^&*#%^*&#%'
Warning	1292	Truncated incorrect DOUBLE value: '/*-+-。‘’；；【‘；’‘；'
#中文
select degrees('奥运'),degrees('气枪');
degrees('奥运')	degrees('气枪')
0	0
Warnings:
Warning	1292	Truncated incorrect DOUBLE value: '奥运'
Warning	1292	Truncated incorrect DOUBLE value: '气枪'
select degrees('金金金金金金金金金');
degrees('金金金金金金金金金')
0
Warnings:
Warning	1292	Truncated incorrect DOUBLE value: '金金金金金金金金金'
select degrees('abc金#&￥……123');
degrees('abc金#&￥……123')
0
Warnings:
Warning	1292	Truncated incorrect DOUBLE value: 'abc金#&￥……123'
#null
select degrees(null);
degrees(null)
NULL
#参数为不同的数学函数
#pi()
select degrees(pi()),degrees(-pi());
degrees(pi())	degrees(-pi())
180	-180
select degrees(pi()*2),degrees(-pi()-pi());
degrees(pi()*2)	degrees(-pi()-pi())
360	-360
#asin()
select degrees(asin(1)),degrees(asin(-1));
degrees(asin(1))	degrees(asin(-1))
90	-90
select degrees(asin(0)),degrees(asin(0.5));
degrees(asin(0))	degrees(asin(0.5))
0	30.000000000000004
#acos()
select degrees(acos(-1)),degrees(acos(1));
degrees(acos(-1))	degrees(acos(1))
180	0
select degrees(acos(0.1)),degrees(-acos(0.5));
degrees(acos(0.1))	degrees(-acos(0.5))
84.26082952273322	-60.00000000000001
#atan()
select degrees(atan(1111111111111111));
degrees(atan(1111111111111111))
89.99999999999994
select degrees(atan(-333333333333333));
degrees(atan(-333333333333333))
-89.99999999999983
select degrees(atan(1.5,-0.5));
degrees(atan(1.5,-0.5))
108.43494882292202
select degrees(atan(-0.5,1));
degrees(atan(-0.5,1))
-26.56505117707799
#cot()
select degrees(cot(1.11111111111111));
degrees(cot(1.11111111111111))
28.364663883130188
select degrees(cot(-0.666666666666666));
degrees(cot(-0.666666666666666))
-72.8173060716845
#cos()
select degrees(cos(pi()));
degrees(cos(pi()))
-57.29577951308232
select degrees(cos(0.00000001));
degrees(cos(0.00000001))
57.29577951308232
select degrees(cos(-0.5555555));
degrees(cos(-0.5555555))
48.678929272489015
#radians()
select degrees(radians(90));
degrees(radians(90))
90
select degrees(radians(180));
degrees(radians(180))
180
#参数为不同的数据类型
#int
create  table   t1(c1  int,c2  int,c3  int);
insert  into    t1  values(111,-321,0);
select  degrees(c1),degrees(c2),degrees(c3) from t1;
degrees(c1)	degrees(c2)	degrees(c3)
6359.831525952138	-18391.945223699426	0
drop 	tables  t1;
#float
create  table   t1(c1  float,c2  float,c3 float);
insert  into    t1  values(1.555555,-0.11111111,10.000101);
select  degrees(c1),degrees(c2),degrees(c3) from t1;
degrees(c1)	degrees(c2)	degrees(c3)
89.12673549833535	-6.366197771107683	572.9635871312394
drop    tables  t1;
#double
create  table   t1(c1  double,c2  double,c3 double);
insert  into    t1  values(0.22222222222,-0.1531315313,0.00000000001);
select  degrees(c1),degrees(c2),degrees(c3) from t1;
degrees(c1)	degrees(c2)	degrees(c3)
12.732395447224302	-8.773790453865464	0.0000000005729577951308232
drop    tables  t1;
#char
create  table   t1(c1  char(20),c2  char(20),c3  char(20));
insert  into    t1  values('a1b1c1d1','qwerrttyuiop','123');
select  degrees(c1),degrees(c2),degrees(c3) from t1;
degrees(c1)	degrees(c2)	degrees(c3)
0	0	7047.380880109125
Warnings:
Warning	1292	Truncated incorrect DOUBLE value: 'a1b1c1d1'
Warning	1292	Truncated incorrect DOUBLE value: 'qwerrttyuiop'
drop    tables  t1;
#varchar
create  table   t1(c1  varchar(60),c2  varchar(60),c3  varchar(60));
insert  into    t1  values('qwertyuipasdfghjklzxcbvnm','11a22b33cdefg','00000000000000000001');
select  degrees(c1),degrees(c2),degrees(c3) from t1;
degrees(c1)	degrees(c2)	degrees(c3)
0	630.2535746439055	57.29577951308232
Warnings:
Warning	1292	Truncated incorrect DOUBLE value: 'qwertyuipasdfghjklzxcbvnm'
Warning	1292	Truncated incorrect DOUBLE value: '11a22b33cdefg'
drop    tables  t1;
#date
create 	table   t1(c1  date,c2  date,c3  date);
insert  into    t1  values(11111111,'11110101','1111-01-01');
select	degrees(c1),degrees(c2),degrees(c3) from t1;
degrees(c1)	degrees(c2)	degrees(c3)
636619766.0013837	636561897.2640754	636561897.2640754
drop 	table   t1;
#time
create  table   t1(c1  time,c2  time,c3  time);
insert  into    t1  values(140651,'140651','13:00:00');
select  degrees(c1),degrees(c2),degrees(c3) from t1;
degrees(c1)	degrees(c2)	degrees(c3)
8058708.684294541	8058708.684294541	7448451.336700702
drop    table   t1;
#year
create  table   t1(c1  year,c2  year,c3  year);
insert  into    t1  values(1999,'2020','1');
select  degrees(c1),degrees(c2),degrees(c3) from t1;
degrees(c1)	degrees(c2)	degrees(c3)
114534.26324665156	115737.47461642629	114648.85480567772
drop    table   t1;
#datetime
create  table   t1(c1  datetime,c2  datetime,c3  datetime);
insert  into    t1  values(20210729140823,'2021-07-29 14:08:23','1111-01-01 00:00:00');
select  degrees(c1),degrees(c2),degrees(c3) from t1;
degrees(c1)	degrees(c2)	degrees(c3)
1157989480651222.2	1157989480651222.2	636561897264075.4
drop    table   t1;
#timestamp
create  table   t1(c1  timestamp,c2  timestamp,c3  timestamp);
insert  into    t1  values(19990909090909,'1999-09-09 09:09:09.0001','1111-11-11 00:00:00.0001');
select  degrees(c1),degrees(c2),degrees(c3) from t1;
degrees(c1)	degrees(c2)	degrees(c3)
1.145394719538795e15	1.145394719538795e15	636619766001383.6
drop    table   t1;
#decimal
create  table 	t1(c1  decimal(30,20),c2  decimal(30,10),c3  decimal(60,15));
insert  into	t1  values(1.000000000000000000001,0.222221,-0.5555777777);
Warnings:
Warning	1265	Data truncated for column 'c1' at row 1
select  degrees(c1),degrees(c2),degrees(c3) from t1;
degrees(c1)	degrees(c2)	degrees(c3)
57.29577951308232	12.732325419176666	-31.832261853467468
drop	table   t1;
#bit
create  table   t1(c1  bit(64),c2  bit(64),c3  bit(64));
insert  into    t1  values(123,b'10011',700);
select  degrees(c1),degrees(c2),degrees(c3) from t1;
degrees(c1)	degrees(c2)	degrees(c3)
7047.380880109125	1088.619810748564	40107.04565915763
drop    tables  t1;
#enum
create table t1(c1 enum("","0","1","2","3","5","6","7","8","9"),c2 enum('0.1','0.2','0.3','0.4','0.5','0.6'),c3 enum('-0.1','-0.2','-0.3','-0.4'));
insert into t1 values('1','0.2','-0.4');
select  degrees(c1),degrees(c2),degrees(c3) from t1;
degrees(c1)	degrees(c2)	degrees(c3)
171.88733853924697	114.59155902616465	229.1831180523293
drop    tables  t1;
#set
create table t1(c1 set("1","2","3","5","6","7","8","9"),c2 set('a','b','c','d'),c3 set('0.1111','-1.321654','1','0.5'));
insert into t1 values('5','d','0.5');
select  degrees(c1),degrees(c2),degrees(c3) from t1;
degrees(c1)	degrees(c2)	degrees(c3)
458.3662361046586	458.3662361046586	458.3662361046586
drop    tables  t1;
#多个参数
select degrees(1,2);
ERROR 42000: Incorrect parameter count in the call to native function 'degrees'
select degrees('',1);
ERROR 42000: Incorrect parameter count in the call to native function 'degrees'
select degrees(null,1);
ERROR 42000: Incorrect parameter count in the call to native function 'degrees'
#0个参数
select degrees('');
degrees('')
0
select degrees();
ERROR 42000: Incorrect parameter count in the call to native function 'degrees'
#select
create  table   t1(id  int,name  char(20),a1  double,a2  double);
insert  into    t1   values(1,'zhangsan',degrees(-1),degrees(0.8)),(1,'li1111111',degrees(0.5),degrees(-0.4));
insert  into    t1   values(2,'lisisi',degrees(-0.1),degrees(0.3)),(2,'liu111111',degrees(0.6),degrees(-0.7));
insert  into    t1   values(3,'wangwuwu',degrees(5),degrees(2.5)),(3,'lan111111',degrees(-1.5),degrees(-2));
insert  into    t1   values(4,'maliuliu',degrees(6),degrees(7)),(4,'ni11111111',degrees(8),degrees(-9));
insert  into    t1   values(5,'tianqiqi',degrees(-10),degrees(15)),(5,'mu111111111',degrees(20),degrees(-15));
insert  into    t1   values(6,'ninenine',degrees(-2.2),degrees(2)),(6,'tian111111111',degrees(2.5),degrees(0));
select    *    from   t1 ;
id	name	a1	a2
1	zhangsan	-57.29577951308232	45.836623610465864
1	li1111111	28.64788975654116	-22.918311805232932
2	lisisi	-5.729577951308233	17.188733853924695
2	liu111111	34.37746770784939	-40.10704565915762
3	wangwuwu	286.4788975654116	143.2394487827058
3	lan111111	-85.94366926962348	-114.59155902616465
4	maliuliu	343.77467707849394	401.07045659157626
4	ni11111111	458.3662361046586	-515.662015617741
5	tianqiqi	-572.9577951308232	859.4366926962348
5	mu111111111	1145.9155902616465	-859.4366926962348
6	ninenine	-126.05071492878112	114.59155902616465
6	tian111111111	143.2394487827058	0
#where
select * from t1 where a1 = degrees(-1) and a2 =degrees(0.8);
id	name	a1	a2
1	zhangsan	-57.29577951308232	45.836623610465864
select * from t1 where a1 > degrees(10) or a2 < degrees(0);
id	name	a1	a2
1	li1111111	28.64788975654116	-22.918311805232932
2	liu111111	34.37746770784939	-40.10704565915762
3	lan111111	-85.94366926962348	-114.59155902616465
4	ni11111111	458.3662361046586	-515.662015617741
5	mu111111111	1145.9155902616465	-859.4366926962348
#order by
select * from t1 order by degrees(a1) desc;
id	name	a1	a2
5	mu111111111	1145.9155902616465	-859.4366926962348
4	ni11111111	458.3662361046586	-515.662015617741
4	maliuliu	343.77467707849394	401.07045659157626
3	wangwuwu	286.4788975654116	143.2394487827058
6	tian111111111	143.2394487827058	0
2	liu111111	34.37746770784939	-40.10704565915762
1	li1111111	28.64788975654116	-22.918311805232932
2	lisisi	-5.729577951308233	17.188733853924695
1	zhangsan	-57.29577951308232	45.836623610465864
3	lan111111	-85.94366926962348	-114.59155902616465
6	ninenine	-126.05071492878112	114.59155902616465
5	tianqiqi	-572.9577951308232	859.4366926962348
select * from t1 order by degrees(a2) asc;
id	name	a1	a2
5	mu111111111	1145.9155902616465	-859.4366926962348
4	ni11111111	458.3662361046586	-515.662015617741
3	lan111111	-85.94366926962348	-114.59155902616465
2	liu111111	34.37746770784939	-40.10704565915762
1	li1111111	28.64788975654116	-22.918311805232932
6	tian111111111	143.2394487827058	0
2	lisisi	-5.729577951308233	17.188733853924695
1	zhangsan	-57.29577951308232	45.836623610465864
6	ninenine	-126.05071492878112	114.59155902616465
3	wangwuwu	286.4788975654116	143.2394487827058
4	maliuliu	343.77467707849394	401.07045659157626
5	tianqiqi	-572.9577951308232	859.4366926962348
select * from t1 where a1 > degrees(0) or a2 <degrees(0) order by degrees(a1) desc;
id	name	a1	a2
5	mu111111111	1145.9155902616465	-859.4366926962348
4	ni11111111	458.3662361046586	-515.662015617741
4	maliuliu	343.77467707849394	401.07045659157626
3	wangwuwu	286.4788975654116	143.2394487827058
6	tian111111111	143.2394487827058	0
2	liu111111	34.37746770784939	-40.10704565915762
1	li1111111	28.64788975654116	-22.918311805232932
3	lan111111	-85.94366926962348	-114.59155902616465
select * from t1 where id >3 and a1 > degrees(-1) order by degrees(a2) asc;
id	name	a1	a2
5	mu111111111	1145.9155902616465	-859.4366926962348
4	ni11111111	458.3662361046586	-515.662015617741
6	tian111111111	143.2394487827058	0
4	maliuliu	343.77467707849394	401.07045659157626
#group by
select * from t1 group by degrees(id);
id	name	a1	a2
1	zhangsan	-57.29577951308232	45.836623610465864
2	lisisi	-5.729577951308233	17.188733853924695
3	wangwuwu	286.4788975654116	143.2394487827058
4	maliuliu	343.77467707849394	401.07045659157626
5	tianqiqi	-572.9577951308232	859.4366926962348
6	ninenine	-126.05071492878112	114.59155902616465
select * from t1 group by degrees(id) order by degrees(a1) desc;
id	name	a1	a2
4	maliuliu	343.77467707849394	401.07045659157626
3	wangwuwu	286.4788975654116	143.2394487827058
2	lisisi	-5.729577951308233	17.188733853924695
1	zhangsan	-57.29577951308232	45.836623610465864
6	ninenine	-126.05071492878112	114.59155902616465
5	tianqiqi	-572.9577951308232	859.4366926962348
select * from t1 where a1 < degrees(10) and a2 > degrees(-2) group by degrees(id);
id	name	a1	a2
1	zhangsan	-57.29577951308232	45.836623610465864
2	lisisi	-5.729577951308233	17.188733853924695
3	wangwuwu	286.4788975654116	143.2394487827058
4	maliuliu	343.77467707849394	401.07045659157626
5	tianqiqi	-572.9577951308232	859.4366926962348
6	ninenine	-126.05071492878112	114.59155902616465
select * from t1 where a1 > degrees(-5) and a2 < degrees(6) group by degrees(id) order by degrees(a2) asc;
id	name	a1	a2
5	mu111111111	1145.9155902616465	-859.4366926962348
4	ni11111111	458.3662361046586	-515.662015617741
2	lisisi	-5.729577951308233	17.188733853924695
1	zhangsan	-57.29577951308232	45.836623610465864
6	ninenine	-126.05071492878112	114.59155902616465
3	wangwuwu	286.4788975654116	143.2394487827058
#group by having
select * from t1 group by degrees(id) having degrees(a1)>0;
id	name	a1	a2
3	wangwuwu	286.4788975654116	143.2394487827058
4	maliuliu	343.77467707849394	401.07045659157626
select * from t1 group by degrees(id) having degrees(a2)>0 order by degrees(a1) desc;
id	name	a1	a2
4	maliuliu	343.77467707849394	401.07045659157626
3	wangwuwu	286.4788975654116	143.2394487827058
2	lisisi	-5.729577951308233	17.188733853924695
1	zhangsan	-57.29577951308232	45.836623610465864
6	ninenine	-126.05071492878112	114.59155902616465
5	tianqiqi	-572.9577951308232	859.4366926962348
select * from t1 where a1 < degrees(10) and a2 > degrees(-2) group by degrees(id) having degrees(a1)>0;
id	name	a1	a2
3	wangwuwu	286.4788975654116	143.2394487827058
4	maliuliu	343.77467707849394	401.07045659157626
select * from t1 where a1 <> degrees(0) and a2 <> degrees(0) group by degrees(id) having degrees(a2)>0 order by degrees(a2) desc;
id	name	a1	a2
5	tianqiqi	-572.9577951308232	859.4366926962348
4	maliuliu	343.77467707849394	401.07045659157626
3	wangwuwu	286.4788975654116	143.2394487827058
6	ninenine	-126.05071492878112	114.59155902616465
1	zhangsan	-57.29577951308232	45.836623610465864
2	lisisi	-5.729577951308233	17.188733853924695
#case when
select id,name,a1,max(a2) ,case a2 when a2 < degrees(-1) then degrees(1) else degrees(0) end as c1 from t1  where a2  like '%11%'  group  by  degrees(id)  having degrees(max(a2)) > degrees(0) order  by  degrees(id) desc  limit 3 ;
id	name	a1	max(a2)	c1
6	ninenine	-126.05071492878112	114.59155902616465	0
select id,name,a1,a2, case a1 when a1> degrees(0.5) then degrees(-0.5) else degrees(0) end as c1 from t1  where a1 <degrees(0) and a2 > degrees(0) order by degrees(id) desc limit 6;
id	name	a1	a2	c1
6	ninenine	-126.05071492878112	114.59155902616465	0
5	tianqiqi	-572.9577951308232	859.4366926962348	0
2	lisisi	-5.729577951308233	17.188733853924695	0
1	zhangsan	-57.29577951308232	45.836623610465864	0
select id,name,a1,a2, case when a1>degrees(-0.5) and a1 <degrees(0.5) then degrees(1) else degrees(-1) end as c1 from t1 where a1>degrees(0) and a2 < degrees(0.9) group by degrees(id) order by degrees(id) desc limit 5;
id	name	a1	a2	c1
6	tian111111111	143.2394487827058	0	-57.29577951308232
5	mu111111111	1145.9155902616465	-859.4366926962348	-57.29577951308232
4	ni11111111	458.3662361046586	-515.662015617741	-57.29577951308232
2	liu111111	34.37746770784939	-40.10704565915762	-57.29577951308232
1	li1111111	28.64788975654116	-22.918311805232932	-57.29577951308232
#distinct
select distinct degrees(id) from t1 where a1 >degrees(1);
degrees(id)
171.88733853924697
229.1831180523293
286.4788975654116
343.77467707849394
select distinct degrees(a1) from t1 where a1 > degrees(0) or a2 <degrees(0) order by degrees(a1) desc;
degrees(a1)
65656.12700023488
26262.450800093953
19696.838100070465
16414.03175005872
8207.01587502936
1969.6838100070463
1641.403175005872
-4924.209525017616
#insert 
create  table   t2(id  int,name  char(20),a1  double,a2  double);
#单行多行
insert	into	t2  values(1,'aa',0.1,1.2);
insert 	into	t2  values(2,'bb',1.5,-0.5),(3,'cc',3.0,-0.333);
#嵌套select
#insert ...select...order by
insert  into	t2  select * from t1 order by degrees(a2) asc;
insert  into	t2  select * from t1 order by degrees(a1) desc;
select * from t2;
id	name	a1	a2
1	aa	0.1	1.2
2	bb	1.5	-0.5
3	cc	3	-0.333
5	mu111111111	1145.9155902616465	-859.4366926962348
4	ni11111111	458.3662361046586	-515.662015617741
3	lan111111	-85.94366926962348	-114.59155902616465
2	liu111111	34.37746770784939	-40.10704565915762
1	li1111111	28.64788975654116	-22.918311805232932
6	tian111111111	143.2394487827058	0
2	lisisi	-5.729577951308233	17.188733853924695
1	zhangsan	-57.29577951308232	45.836623610465864
6	ninenine	-126.05071492878112	114.59155902616465
3	wangwuwu	286.4788975654116	143.2394487827058
4	maliuliu	343.77467707849394	401.07045659157626
5	tianqiqi	-572.9577951308232	859.4366926962348
5	mu111111111	1145.9155902616465	-859.4366926962348
4	ni11111111	458.3662361046586	-515.662015617741
4	maliuliu	343.77467707849394	401.07045659157626
3	wangwuwu	286.4788975654116	143.2394487827058
6	tian111111111	143.2394487827058	0
2	liu111111	34.37746770784939	-40.10704565915762
1	li1111111	28.64788975654116	-22.918311805232932
2	lisisi	-5.729577951308233	17.188733853924695
1	zhangsan	-57.29577951308232	45.836623610465864
3	lan111111	-85.94366926962348	-114.59155902616465
6	ninenine	-126.05071492878112	114.59155902616465
5	tianqiqi	-572.9577951308232	859.4366926962348
#insert ...select...group by+ having
insert  into    t2  select * from t1 group by degrees(id);
insert  into    t2  select * from t1 group by degrees(id) having degrees(a1)>0;
select * from t2;
id	name	a1	a2
1	aa	0.1	1.2
2	bb	1.5	-0.5
3	cc	3	-0.333
5	mu111111111	1145.9155902616465	-859.4366926962348
4	ni11111111	458.3662361046586	-515.662015617741
3	lan111111	-85.94366926962348	-114.59155902616465
2	liu111111	34.37746770784939	-40.10704565915762
1	li1111111	28.64788975654116	-22.918311805232932
6	tian111111111	143.2394487827058	0
2	lisisi	-5.729577951308233	17.188733853924695
1	zhangsan	-57.29577951308232	45.836623610465864
6	ninenine	-126.05071492878112	114.59155902616465
3	wangwuwu	286.4788975654116	143.2394487827058
4	maliuliu	343.77467707849394	401.07045659157626
5	tianqiqi	-572.9577951308232	859.4366926962348
5	mu111111111	1145.9155902616465	-859.4366926962348
4	ni11111111	458.3662361046586	-515.662015617741
4	maliuliu	343.77467707849394	401.07045659157626
3	wangwuwu	286.4788975654116	143.2394487827058
6	tian111111111	143.2394487827058	0
2	liu111111	34.37746770784939	-40.10704565915762
1	li1111111	28.64788975654116	-22.918311805232932
2	lisisi	-5.729577951308233	17.188733853924695
1	zhangsan	-57.29577951308232	45.836623610465864
3	lan111111	-85.94366926962348	-114.59155902616465
6	ninenine	-126.05071492878112	114.59155902616465
5	tianqiqi	-572.9577951308232	859.4366926962348
1	zhangsan	-57.29577951308232	45.836623610465864
2	lisisi	-5.729577951308233	17.188733853924695
3	wangwuwu	286.4788975654116	143.2394487827058
4	maliuliu	343.77467707849394	401.07045659157626
5	tianqiqi	-572.9577951308232	859.4366926962348
6	ninenine	-126.05071492878112	114.59155902616465
3	wangwuwu	286.4788975654116	143.2394487827058
4	maliuliu	343.77467707849394	401.07045659157626
#insert ...select...where
insert  into    t2  select * from t1 where a1 > degrees(10) or a2 < degrees(0);
#insert ...select...where...order by
insert  into    t2  select * from t1 where id >3 and a1 > degrees(-1) order by degrees(a2) asc;
select * from t2;
id	name	a1	a2
1	aa	0.1	1.2
2	bb	1.5	-0.5
3	cc	3	-0.333
5	mu111111111	1145.9155902616465	-859.4366926962348
4	ni11111111	458.3662361046586	-515.662015617741
3	lan111111	-85.94366926962348	-114.59155902616465
2	liu111111	34.37746770784939	-40.10704565915762
1	li1111111	28.64788975654116	-22.918311805232932
6	tian111111111	143.2394487827058	0
2	lisisi	-5.729577951308233	17.188733853924695
1	zhangsan	-57.29577951308232	45.836623610465864
6	ninenine	-126.05071492878112	114.59155902616465
3	wangwuwu	286.4788975654116	143.2394487827058
4	maliuliu	343.77467707849394	401.07045659157626
5	tianqiqi	-572.9577951308232	859.4366926962348
5	mu111111111	1145.9155902616465	-859.4366926962348
4	ni11111111	458.3662361046586	-515.662015617741
4	maliuliu	343.77467707849394	401.07045659157626
3	wangwuwu	286.4788975654116	143.2394487827058
6	tian111111111	143.2394487827058	0
2	liu111111	34.37746770784939	-40.10704565915762
1	li1111111	28.64788975654116	-22.918311805232932
2	lisisi	-5.729577951308233	17.188733853924695
1	zhangsan	-57.29577951308232	45.836623610465864
3	lan111111	-85.94366926962348	-114.59155902616465
6	ninenine	-126.05071492878112	114.59155902616465
5	tianqiqi	-572.9577951308232	859.4366926962348
1	zhangsan	-57.29577951308232	45.836623610465864
2	lisisi	-5.729577951308233	17.188733853924695
3	wangwuwu	286.4788975654116	143.2394487827058
4	maliuliu	343.77467707849394	401.07045659157626
5	tianqiqi	-572.9577951308232	859.4366926962348
6	ninenine	-126.05071492878112	114.59155902616465
3	wangwuwu	286.4788975654116	143.2394487827058
4	maliuliu	343.77467707849394	401.07045659157626
1	li1111111	28.64788975654116	-22.918311805232932
2	liu111111	34.37746770784939	-40.10704565915762
3	lan111111	-85.94366926962348	-114.59155902616465
4	ni11111111	458.3662361046586	-515.662015617741
5	mu111111111	1145.9155902616465	-859.4366926962348
5	mu111111111	1145.9155902616465	-859.4366926962348
4	ni11111111	458.3662361046586	-515.662015617741
6	tian111111111	143.2394487827058	0
4	maliuliu	343.77467707849394	401.07045659157626
#insert ...select...where...order by+group by
insert  into    t2  select * from t1 group by degrees(id) order by degrees(a1) desc;
#insert ...select...where...order by+group by having
insert  into	t2  select * from t1 where a1 <> degrees(0) and a2 <> degrees(0) group by degrees(id) having degrees(a2)>0 order by degrees(a2) desc;
select * from t2;
id	name	a1	a2
1	aa	0.1	1.2
2	bb	1.5	-0.5
3	cc	3	-0.333
5	mu111111111	1145.9155902616465	-859.4366926962348
4	ni11111111	458.3662361046586	-515.662015617741
3	lan111111	-85.94366926962348	-114.59155902616465
2	liu111111	34.37746770784939	-40.10704565915762
1	li1111111	28.64788975654116	-22.918311805232932
6	tian111111111	143.2394487827058	0
2	lisisi	-5.729577951308233	17.188733853924695
1	zhangsan	-57.29577951308232	45.836623610465864
6	ninenine	-126.05071492878112	114.59155902616465
3	wangwuwu	286.4788975654116	143.2394487827058
4	maliuliu	343.77467707849394	401.07045659157626
5	tianqiqi	-572.9577951308232	859.4366926962348
5	mu111111111	1145.9155902616465	-859.4366926962348
4	ni11111111	458.3662361046586	-515.662015617741
4	maliuliu	343.77467707849394	401.07045659157626
3	wangwuwu	286.4788975654116	143.2394487827058
6	tian111111111	143.2394487827058	0
2	liu111111	34.37746770784939	-40.10704565915762
1	li1111111	28.64788975654116	-22.918311805232932
2	lisisi	-5.729577951308233	17.188733853924695
1	zhangsan	-57.29577951308232	45.836623610465864
3	lan111111	-85.94366926962348	-114.59155902616465
6	ninenine	-126.05071492878112	114.59155902616465
5	tianqiqi	-572.9577951308232	859.4366926962348
1	zhangsan	-57.29577951308232	45.836623610465864
2	lisisi	-5.729577951308233	17.188733853924695
3	wangwuwu	286.4788975654116	143.2394487827058
4	maliuliu	343.77467707849394	401.07045659157626
5	tianqiqi	-572.9577951308232	859.4366926962348
6	ninenine	-126.05071492878112	114.59155902616465
3	wangwuwu	286.4788975654116	143.2394487827058
4	maliuliu	343.77467707849394	401.07045659157626
1	li1111111	28.64788975654116	-22.918311805232932
2	liu111111	34.37746770784939	-40.10704565915762
3	lan111111	-85.94366926962348	-114.59155902616465
4	ni11111111	458.3662361046586	-515.662015617741
5	mu111111111	1145.9155902616465	-859.4366926962348
5	mu111111111	1145.9155902616465	-859.4366926962348
4	ni11111111	458.3662361046586	-515.662015617741
6	tian111111111	143.2394487827058	0
4	maliuliu	343.77467707849394	401.07045659157626
4	maliuliu	343.77467707849394	401.07045659157626
3	wangwuwu	286.4788975654116	143.2394487827058
2	lisisi	-5.729577951308233	17.188733853924695
1	zhangsan	-57.29577951308232	45.836623610465864
6	ninenine	-126.05071492878112	114.59155902616465
5	tianqiqi	-572.9577951308232	859.4366926962348
5	tianqiqi	-572.9577951308232	859.4366926962348
4	maliuliu	343.77467707849394	401.07045659157626
3	wangwuwu	286.4788975654116	143.2394487827058
6	ninenine	-126.05071492878112	114.59155902616465
1	zhangsan	-57.29577951308232	45.836623610465864
2	lisisi	-5.729577951308233	17.188733853924695
drop table t2;
#在不同字段中插入degrees函数
#int
create table t2(c1 int,c2 int,c3 int);
insert into t2 values(degrees(0.1),degrees(-0.5),degrees(pi()));
select * from t2;
c1	c2	c3
6	-29	180
drop table t2;
#float
create table t2(c1 float,c2 float,c3 float);
insert into t2 values(degrees(asin(1)),degrees(20),degrees(-10));
select * from t2;
c1	c2	c3
90	1145.92	-572.958
drop table t2;
#double
create table t2(c1 double,c2 double,c3 double);
insert into t2 values(degrees(acos(0)),degrees(5),degrees(-6));
select * from t2;
c1	c2	c3
90	286.4788975654116	-343.77467707849394
drop table t2;
#char
create table t2(c1 char(30),c2 char(30),c3 char(30));
insert into t2 values(degrees(atan(2)),degrees(atan(1,2)),degrees(-2));
select * from t2;
c1	c2	c3
63.43494882292201	26.56505117707799	-114.59155902616465
drop table t2;
#varchar
create table t2(c1 varchar(60),c2 varchar(60),c3 varchar(60));
insert into t2 values(degrees(cos(pi())),degrees(3.5),degrees(-4));
select * from t2;
c1	c2	c3
-57.29577951308232	200.53522829578813	-229.1831180523293
drop table t2;
#date
create table t2(c1 date,c2 date,c3 date);
insert into t2 values(degrees(cot(111)),degrees(20),degrees(-19));
ERROR 22007: Incorrect datetime value for column 'c1' at row 1
drop table t2;
#time
create table t2(c1 time,c2 time,c3 time);
insert into t2 values(degrees(cot(111)),degrees(20),degrees(-19));
ERROR 22007: Incorrect datetime value for column 'c3' at row 1
drop table t2;
#year, OB 1235,MYSQL执行成功 degrees函数返回值大于100 mysql报错。
#datetime
create table t2(c1 datetime,c2 datetime,c3 datetime);
insert into t2 values(degrees(0.5),degrees(1.7),degrees(0.9));
ERROR 22007: Incorrect datetime value for column 'c1' at row 1
drop table t2;
#timestamp
create table t2(c1 timestamp,c2 timestamp,c3 timestamp);
insert into t2 values(degrees(0.5),degrees(1.7),degrees(0.9));
ERROR 22007: Incorrect datetime value for column 'c1' at row 1
drop table t2;
#decimal
create table t2(c1 decimal(30,20),c2 decimal(30,10),c3 decimal(60,15));
insert into t2 values(degrees(atan(1,1)),degrees(asin(0.5)),degrees(cot(1.1)));
Warnings:
Warning	1265	Data truncated for column 'c2' at row 1
select * from t2;
c1	c2	c3
45.00000000000000000000	30.0000000000	29.161724336968710
drop table t2;
#bit
create table t2(c1 bit(64),c2 bit(64),c3 bit(64));
insert into t2 values(degrees(radians(180)),degrees(-0.5),degrees(pi()));
select hex(c1),hex(c2),hex(c3) from t2;
hex(c1)	hex(c2)	hex(c3)
B4	FFFFFFFFFFFFFFE4	B4
drop table t2;
#update
#单行多行
update t1 set a1 = degrees(pi()) where a1 = degrees(-1) and a2 = degrees(0.8) limit 1;
update t1 set a1 = degrees(radians(20)) where id<2;
select * from t1;
id	name	a1	a2
1	zhangsan	20	45.836623610465864
1	li1111111	20	-22.918311805232932
2	lisisi	-5.729577951308233	17.188733853924695
2	liu111111	34.37746770784939	-40.10704565915762
3	wangwuwu	286.4788975654116	143.2394487827058
3	lan111111	-85.94366926962348	-114.59155902616465
4	maliuliu	343.77467707849394	401.07045659157626
4	ni11111111	458.3662361046586	-515.662015617741
5	tianqiqi	-572.9577951308232	859.4366926962348
5	mu111111111	1145.9155902616465	-859.4366926962348
6	ninenine	-126.05071492878112	114.59155902616465
6	tian111111111	143.2394487827058	0
#set,嵌套order 子句
update t1 set a2 = degrees(radians(30)) order by degrees(id) desc limit 1;
select * from t1;
id	name	a1	a2
1	zhangsan	20	45.836623610465864
1	li1111111	20	-22.918311805232932
2	lisisi	-5.729577951308233	17.188733853924695
2	liu111111	34.37746770784939	-40.10704565915762
3	wangwuwu	286.4788975654116	143.2394487827058
3	lan111111	-85.94366926962348	-114.59155902616465
4	maliuliu	343.77467707849394	401.07045659157626
4	ni11111111	458.3662361046586	-515.662015617741
5	tianqiqi	-572.9577951308232	859.4366926962348
5	mu111111111	1145.9155902616465	-859.4366926962348
6	ninenine	-126.05071492878112	29.999999999999996
6	tian111111111	143.2394487827058	0
#嵌套group by + having子句
update t1 set a1 = degrees(0) where id = (select id  from t1 group by degrees(id) limit 1);
update t1 set a2 = degrees(0) where id = (select id from t1 group by degrees(id) having degrees(a1)>0 limit 1);
select * from t1;
id	name	a1	a2
1	zhangsan	0	45.836623610465864
1	li1111111	0	-22.918311805232932
2	lisisi	-5.729577951308233	17.188733853924695
2	liu111111	34.37746770784939	-40.10704565915762
3	wangwuwu	286.4788975654116	143.2394487827058
3	lan111111	-85.94366926962348	-114.59155902616465
4	maliuliu	343.77467707849394	401.07045659157626
4	ni11111111	458.3662361046586	-515.662015617741
5	tianqiqi	-572.9577951308232	859.4366926962348
5	mu111111111	1145.9155902616465	-859.4366926962348
6	ninenine	-126.05071492878112	29.999999999999996
6	tian111111111	143.2394487827058	0
#where
update t1 set a1 = degrees(radians(1)) where  id < degrees(0.02);
#where +order by
update t1 set id = degrees(pi()) where a1 < degrees(2) and a1 > degrees(0) order by id asc limit 1;
select * from t1;
id	name	a1	a2
180	zhangsan	1	45.836623610465864
1	li1111111	1	-22.918311805232932
2	lisisi	-5.729577951308233	17.188733853924695
2	liu111111	34.37746770784939	-40.10704565915762
3	wangwuwu	286.4788975654116	143.2394487827058
3	lan111111	-85.94366926962348	-114.59155902616465
4	maliuliu	343.77467707849394	401.07045659157626
4	ni11111111	458.3662361046586	-515.662015617741
5	tianqiqi	-572.9577951308232	859.4366926962348
5	mu111111111	1145.9155902616465	-859.4366926962348
6	ninenine	-126.05071492878112	29.999999999999996
6	tian111111111	143.2394487827058	0
#where + group by having + order by
update t1 set a2 = degrees(0) where id = (select id from t1 group by degrees(id) having degrees(a2)<0 limit 1);
update t1 set a1 = degrees(radians(55)) where id = (select id from t1 where a1 <> degrees(0) and a2 <> degrees(0) group by degrees(id) having degrees(a2)>0 order by degrees(a2) desc limit 1);
select * from t1;
id	name	a1	a2
180	zhangsan	1	45.836623610465864
1	li1111111	1	-22.918311805232932
2	lisisi	-5.729577951308233	17.188733853924695
2	liu111111	34.37746770784939	-40.10704565915762
3	wangwuwu	286.4788975654116	143.2394487827058
3	lan111111	-85.94366926962348	-114.59155902616465
4	maliuliu	343.77467707849394	401.07045659157626
4	ni11111111	458.3662361046586	-515.662015617741
5	tianqiqi	55	859.4366926962348
5	mu111111111	1145.9155902616465	-859.4366926962348
6	ninenine	-126.05071492878112	29.999999999999996
6	tian111111111	143.2394487827058	0
#delete
#单行
delete from t1 where id = degrees(radians(180));
select * from t1;
id	name	a1	a2
1	li1111111	1	-22.918311805232932
2	lisisi	-5.729577951308233	17.188733853924695
2	liu111111	34.37746770784939	-40.10704565915762
3	wangwuwu	286.4788975654116	143.2394487827058
3	lan111111	-85.94366926962348	-114.59155902616465
4	maliuliu	343.77467707849394	401.07045659157626
4	ni11111111	458.3662361046586	-515.662015617741
5	tianqiqi	55	859.4366926962348
5	mu111111111	1145.9155902616465	-859.4366926962348
6	ninenine	-126.05071492878112	29.999999999999996
6	tian111111111	143.2394487827058	0
#多行
delete from t1 where a1 > degrees(0) and a2 < degrees(0) limit 2;
select * from t1;
id	name	a1	a2
2	lisisi	-5.729577951308233	17.188733853924695
3	wangwuwu	286.4788975654116	143.2394487827058
3	lan111111	-85.94366926962348	-114.59155902616465
4	maliuliu	343.77467707849394	401.07045659157626
4	ni11111111	458.3662361046586	-515.662015617741
5	tianqiqi	55	859.4366926962348
5	mu111111111	1145.9155902616465	-859.4366926962348
6	ninenine	-126.05071492878112	29.999999999999996
6	tian111111111	143.2394487827058	0
#where
delete from t1 where a1 > degrees(0) and id < degrees(0.019);
select * from t1;
id	name	a1	a2
2	lisisi	-5.729577951308233	17.188733853924695
3	wangwuwu	286.4788975654116	143.2394487827058
3	lan111111	-85.94366926962348	-114.59155902616465
4	maliuliu	343.77467707849394	401.07045659157626
4	ni11111111	458.3662361046586	-515.662015617741
5	tianqiqi	55	859.4366926962348
5	mu111111111	1145.9155902616465	-859.4366926962348
6	ninenine	-126.05071492878112	29.999999999999996
6	tian111111111	143.2394487827058	0
#order by
delete from t1 where a1> degrees(0) order by degrees(a2) desc limit 2;
#group by having + order by
delete from t1 where id =(select id from t1 where degrees(a1) < 0 and degrees(a2) != degrees(0) group by degrees(id) order by degrees(a1)desc limit 1);
delete from t1;
#replace
replace into t1 values(1,'zhangsan',degrees(0.5),degrees(pi()));
replace into t1 values(2,'lisi',degrees(-1.5),degrees(cos(111)));
replace into t1(a1,a2) values(degrees(9999999999),degrees(asin(1)));
replace into t1(id,name,a1,a2) values(3,'wangwu',degrees(7777),degrees(acos(0)));
select * from t1;
id	name	a1	a2
1	zhangsan	28.64788975654116	180
2	lisi	-85.94366926962348	-28.793668505306066
NULL	NULL	572957795073.5275	90
3	wangwu	445589.2772732412	90
drop table t1;
drop database db1;
