drop table if exists t1;
CREATE TABLE t1 (id CHAR(12) not null, PRIMARY KEY (id));
insert into t1 values ('000000000001'),('000000000002');
select * from t1 where id=000000000001;
id
000000000001
delete from t1 where id=000000000002;
select * from t1;
id
000000000001
drop table t1;
set names latin1;
SELECT 'a' = 'a ';
'a' = 'a '
1
SELECT 'a\0' < 'a';
'a\0' < 'a'
1
SELECT 'a\0' < 'a ';
'a\0' < 'a '
1
SELECT 'a\t' < 'a';
'a\t' < 'a'
1
SELECT 'a\t' < 'a ';
'a\t' < 'a '
1
CREATE TABLE t1 (a char(10) not null) charset latin1;
INSERT INTO t1 VALUES ('a'),('a\0'),('a\t'),('a ');
SELECT hex(a),STRCMP(a,'a'), STRCMP(a,'a ') FROM t1;
hex(a)	STRCMP(a,'a')	STRCMP(a,'a ')
61	0	0
6100	-1	-1
6109	-1	-1
61	0	0
DROP TABLE t1;
set names default;
SELECT CHAR(31) = '', '' = CHAR(31);
CHAR(31) = ''	'' = CHAR(31)
0	0
SELECT CHAR(30) = '', '' = CHAR(30);
CHAR(30) = ''	'' = CHAR(30)
0	0
create table t1 (a tinyint(1),b binary(1));
insert into t1 values (0x01,0x01);
select * from t1 where a=b;
a	b
Warnings:
Warning	1292	Truncated incorrect DECIMAL value: ''
select * from t1 where a=b and b=0x01;
a	b
Warnings:
Warning	1292	Truncated incorrect DECIMAL value: ''
Warning	1292	Truncated incorrect DECIMAL value: ''
drop table if exists t1;
CREATE TABLE  t1 (b int(2) zerofill, c int(2) zerofill);
INSERT INTO t1 (b,c) VALUES (1,2), (1,1), (2,2);
SELECT CONCAT(b,c), CONCAT(b,c) = '0101' FROM t1;
CONCAT(b,c)	CONCAT(b,c) = '0101'
0102	0
0101	1
0202	0
SELECT b,c FROM t1 WHERE b = 1 AND CONCAT(b,c) = '0101';
b	c
01	01
CREATE TABLE t2 (a int);
INSERT INTO t2 VALUES (1),(2);
SELECT a, 
(SELECT COUNT(*) FROM t1 
WHERE b = t2.a AND CONCAT(b,c) = CONCAT('0',t2.a,'01')) x 
FROM t2 ORDER BY a;
a	x
1	1
2	0
DROP TABLE t1,t2;
SET sql_mode = 'NO_ENGINE_SUBSTITUTION';
CREATE TABLE t1 (a TIMESTAMP);
INSERT INTO t1 VALUES (NOW()),(NOW()),(NOW());
SELECT * FROM t1 WHERE a > '2008-01-01' AND a = '0000-00-00';
a
DROP TABLE t1;
SET sql_mode = default;
End of 5.0 tests
CREATE TABLE t1(a INT ZEROFILL);
SELECT 1 FROM t1 WHERE t1.a IN (1, t1.a) AND t1.a=2;
1
DROP TABLE t1;

Bug #27452148: ASSERTION FAILED: (SLEN % 4) == 0 IN
MY_STRNNCOLLSP_UTF32_BIN

SET NAMES default;
#
# Bug#30961924 AND OF TWO PREDICATES WITH DIFFERENT COLLATION ON SAME COLUMN GIVES WRONG RESULT
#
CREATE TABLE t1(
firstname CHAR(20),
lastname CHAR(20)
) CHARACTER SET utf8mb4 COLLATE utf8mb4_0900_ai_ci;
drop table t1;
CREATE TABLE t1(
firstname CHAR(20),
lastname CHAR(20)
) CHARACTER SET utf8mb4;
INSERT INTO t1 VALUES("john","doe"), ("John","Doe");
SELECT * FROM t1 WHERE firstname = 'john';
firstname	lastname
john	doe
John	Doe
SELECT * FROM t1 WHERE firstname = 'john' COLLATE utf8mb4_0900_ai_ci;
firstname	lastname
john	doe
John	Doe
DROP TABLE t1;
Comparisons with parameters and extreme values
DROP TABLE t;
CREATE TABLE t(a DECIMAL(30,0));
INSERT INTO t VALUES(0);
SELECT * FROM t;
a
0
set @maxint=18446744073709551615;
SELECT @maxint;
@maxint
18446744073709551615
SELECT * FROM t WHERE a < @maxint;
a
0
SELECT * FROM t WHERE a < 18446744073709551615;
a
0
SELECT * FROM t WHERE 0 < 18446744073709551615;
a
0
SELECT * FROM t WHERE 0 < @maxint;
a
0
DROP TABLE t;
