SET sql_mode = 'NO_ENGINE_SUBSTITUTION';
drop table if exists t1,t2,t3,t4,t5;
drop database if exists mysqltest;
drop view if exists v1;
drop view t1;
create table t1 (b char(0));
insert into t1 values (""),(null);
select * from t1;
b

NULL
drop table if exists t1;
create table t1 (b char(0) not null);
create table if not exists t1 (b char(0) not null);
insert into t1 values (""),(null);
Warnings:
Warning	1048	Column 'b' cannot be null
select * from t1;
b


drop table t1;
create table t1 (a int not null auto_increment,primary key (a)) engine=heap;
Warnings:
Warning	1286	Unknown storage engine 'heap'
drop table t1;
create table t2 engine=heap select * from t1;
ERROR 42S02: Table 'test.t1' doesn't exist
create table t2 select auto+1 from t1;
ERROR 42S02: Table 'test.t1' doesn't exist
drop table if exists t1,t2;
Warnings:
Note	1051	Unknown table 'test.t1'
Note	1051	Unknown table 'test.t2'
create table t1 (b char(0) not null, index(b));
ERROR 42000: The used storage engine can't index column 'b'
create table t1 (a int not null,b text) engine=heap;
Warnings:
Warning	1286	Unknown storage engine 'heap'
drop table if exists t1;
create table t1 (ordid int(8) not null auto_increment, ord  varchar(50) not null, primary key (ord,ordid)) engine=heap;
Warnings:
Warning	1286	Unknown storage engine 'heap'
drop table if exists t1;
create table not_existing_database.test (a int);
ERROR 42000: Unknown database 'not_existing_database'
create /* temporary*/ table not_existing_database.test (a int);
ERROR 42000: Unknown database 'not_existing_database'
create table `a/a` (a int);
create table t1 like `a/a`;
drop table `a/a`;
drop table `t1`;
create table `aaaaaaaaaaaaaaaaaaaaaaaaaaaaaaaaaaaaaaaaaaaaaaaaaaaaaaaaaaaaaaaaaaa` (aaaaaaaaaaaaaaaaaaaaaaaaaaaaaaaaaaaaaaaaaaaaaaaaaaaaaaaaaaaaaaaaaa int);
ERROR 42000: Identifier name 'aaaaaaaaaaaaaaaaaaaaaaaaaaaaaaaaaaaaaaaaaaaaaaaaaaaaaaaaaaaaaaaaaaa' is too long
drop table a;
create table a (`aaaaaaaaaaaaaaaaaaaaaaaaaaaaaaaaaaaaaaaaaaaaaaaaaaaaaaaaaaaaaaaaaa` int);
drop table a;
create table t1 (a int default 100 auto_increment);
ERROR 42000: Invalid default value for 'a'
create table t1 (a tinyint default 1000);
ERROR 42000: Invalid default value for 'a'
create table t1 (a varchar(5) default 'abcdef');
ERROR 42000: Invalid default value for 'a'
create table t1 (a varchar(5) default 'abcde');
insert into t1 values();
select * from t1;
a
abcde
alter table t1 alter column a set default 'abcdef';
ERROR 42000: Invalid default value for 'a'
drop table t1;
drop table 1ea10;
create table 1ea10 (1a20 int,1e int);
insert into 1ea10 values(1,1);
select 1ea10.1a20,1e+ 1e+10 from 1ea10;
1a20	1e+ 1e+10
1	10000000001
drop table 1ea10;
create table t1 (`index` int);
drop table t1;
drop database if exists mysqltest;
Warnings:
Note	1008	Can't drop database 'mysqltest'; database doesn't exist
create database mysqltest;
create table mysqltest.`$test1` (a$1 int, `$b` int, c$ int);
insert into mysqltest.`$test1` values (1,2,3);
select a$1, `$b`, c$ from mysqltest.`$test1`;
a$1	$b	c$
1	2	3
create table mysqltest.test2$ (a int);
drop table mysqltest.test2$;
drop database mysqltest;
create table `` (a int);
ERROR 42000: Incorrect table name ''
drop table if exists ``;
ERROR 42000: Incorrect table name ''
create table t1 (`` int);
ERROR 42000: Incorrect column name ''
create table t1 (i int, index `` (i));
ERROR 42000: Incorrect index name ''
create table t1 (i int);
lock tables t1 read;
drop table t2;
drop view t2;
create table t2 (j int);
unlock tables;
drop table t1;
drop table t2;
create table t1 (a int auto_increment not null primary key, B CHAR(20));
insert into t1 (b) values ("hello"),("my"),("world");
create table t2 (key (b)) select * from t1;
ERROR HY000: table must have at least one column that is not invisible
drop table t1;
create table t1(x varchar(50) );
create table t2 select x from t1 where 1=2;
describe t1;
Field	Type	Null	Key	Default	Extra
x	varchar(50)	YES		NULL	
describe t2;
Field	Type	Null	Key	Default	Extra
x	varchar(50)	YES		NULL	
drop table t2;
create table t2 select now() as a , curtime() as b, curdate() as c , 1+1 as d , 1.0 + 1 as e , 33333333333333333 + 3 as f;
describe t2;
Field	Type	Null	Key	Default	Extra
a	datetime	YES		NULL	
b	time	YES		NULL	
c	date	YES		NULL	
d	bigint(2)	NO		0	
e	decimal(3,1)	NO		0.0	
f	bigint(18)	NO		0	
drop table t2;
create table t2 select CAST("2001-12-29" AS DATE) as d, CAST("20:45:11" AS TIME) as t, CAST("2001-12-29  20:45:11" AS DATETIME) as dt;
describe t2;
Field	Type	Null	Key	Default	Extra
d	date	YES		NULL	
t	time	YES		NULL	
dt	datetime	YES		NULL	
drop table t1,t2;
create table t1 (a tinyint);
create table t2 (a int) select * from t1;
describe t1;
Field	Type	Null	Key	Default	Extra
a	tinyint(4)	YES		NULL	
describe t2;
Field	Type	Null	Key	Default	Extra
a	int(11)	YES		NULL	
drop table if exists t2;
create table t2 (a int, a float) select * from t1;
ERROR 42S21: Duplicate column name 'a'
drop table if exists t2;
Warnings:
Note	1051	Unknown table 'test.t2'
create table t2 (a int) select a as b, a+1 as b from t1;
ERROR 42S21: Duplicate column name 'b'
drop table if exists t2;
Warnings:
Note	1051	Unknown table 'test.t2'
create table t2 (b int) select a as b, a+1 as b from t1;
ERROR 42S21: Duplicate column name 'b'
drop table if exists t1,t2;
Warnings:
Note	1051	Unknown table 'test.t2'
CREATE TABLE t1 (a int not null);
INSERT INTO t1 values (1),(2),(1);
CREATE TABLE t2 (primary key(a)) SELECT * FROM t1;
ERROR HY000: table must have at least one column that is not invisible
DROP TABLE t1;
DROP TABLE IF EXISTS t2;
Warnings:
Note	1051	Unknown table 'test.t2'
create table t1 (a int not null, b int, primary key(a), key (b), key (b), key (b), key (b), key (b), key (b), key (b), key (b), key (b), key (b), key (b), key (b), key (b), key (b), key (b), key (b), key (b), key (b), key (b), key (b), key (b), key (b), key (b), key (b), key (b), key (b), key (b), key (b), key (b), key (b), key (b));
drop table t1;
create table t1 select if(1,'1','0'), month("2002-08-02");
drop table t1;
create table t1 select if('2002'='2002','Y','N');
select * from t1;
if('2002'='2002','Y','N')
Y
drop table if exists t1;
SET SESSION default_storage_engine="heap";
ERROR HY000: parameter cannot be modified because specified value is invalid
SELECT @@default_storage_engine;
@@default_storage_engine
OceanBase
CREATE TABLE t1 (a int not null);
drop table t1;
SET SESSION default_storage_engine="gemini";
ERROR HY000: parameter cannot be modified because specified value is invalid
SELECT @@default_storage_engine;
@@default_storage_engine
OceanBase
CREATE TABLE t1 (a int not null);
SET SESSION default_storage_engine=default;
ERROR HY000: parameter cannot be modified because specified value is invalid
drop table t1;
create table t1 ( k1 varchar(2), k2 int, primary key(k1,k2));
insert into t1 values ("a", 1), ("b", 2);
insert into t1 values ("c", NULL);
ERROR 23000: Column 'k2' cannot be null
insert into t1 values (NULL, 3);
ERROR 23000: Column 'k1' cannot be null
insert into t1 values (NULL, NULL);
ERROR 23000: Column 'k1' cannot be null
drop table t1;
create table t1 select x'4132';
drop table t1;
create table t1 select 1,2,3;
create table if not exists t1 select 1,2;
create table if not exists t1 select 1,2,3,4;
create table if not exists t1 select 1;
select * from t1;
1	2	3
1	2	3
drop table t1;
create table t1 (a int not null, b int, primary key (a));
insert into t1 values (1,1);
create table if not exists t1 select 2;
select * from t1;
a	b
1	1
create table if not exists t1 select 3 as 'a',4 as 'b';
select * from t1;
a	b
1	1
drop table t1;
create table `t1 `(a int);
ERROR 42000: Incorrect table name 't1 '
create database `db1 `;
ERROR 42000: Incorrect database name 'db1 '
create table t1(`a ` int);
ERROR 42000: Incorrect column name 'a '
create table t1 (a int,);
ERROR 42000: You have an error in your SQL syntax; check the manual that corresponds to your OceanBase version for the right syntax to use near ')' at line 1
create table t1 (a int,,b int);
ERROR 42000: You have an error in your SQL syntax; check the manual that corresponds to your OceanBase version for the right syntax to use near ',b int)' at line 1
create table t1 (,b int);
ERROR 42000: You have an error in your SQL syntax; check the manual that corresponds to your OceanBase version for the right syntax to use near ',b int)' at line 1
create table t1 (a int, key(a));
create table t2 (b int, foreign key(b) references t1(a), key(b));
drop table if exists t2;
drop table if exists t1;
create table t1(id int not null, name char(20));
insert into t1 values(10,'mysql'),(20,'monty- the creator');
create table t2(id int not null);
insert into t2 values(10),(20);
create table t3 like t1;
select * from t3;
id	name
create table if not exists t3 like t1;
Warnings:
Note	1050	Table 't3' already exists
select @@warning_count;
@@warning_count
0
select * from t3;
id	name
drop table t3;
drop table t2;
create database mysqltest;
create table mysqltest.t3 like t1;
create /* temporary*/ table t3 like mysqltest.t3;
create table t2 like t3;
select * from t2;
id	name
create table t3 like t1;
ERROR 42S01: Table 't3' already exists
create table t3 like mysqltest.t3;
ERROR 42S01: Table 't3' already exists
create table non_existing_database.t1 like t1;
ERROR 42000: Unknown database 'non_existing_database'
create table t3 like non_existing_table;
ERROR 42S02: Table 'test.non_existing_table' doesn't exist
drop table t1, t2, t3;
drop database mysqltest;
create table t1 (i int);
create table t2 (j int);
lock tables t1 read;
create table t3 like t1;
unlock tables;
drop tables t1, t2;
SET SESSION default_storage_engine="heap";
ERROR HY000: parameter cannot be modified because specified value is invalid
SELECT @@default_storage_engine;
@@default_storage_engine
OceanBase
CREATE TABLE t1 (a int not null);
drop table t1;
SET SESSION default_storage_engine="gemini";
ERROR HY000: parameter cannot be modified because specified value is invalid
SELECT @@default_storage_engine;
@@default_storage_engine
OceanBase
CREATE TABLE t1 (a int not null);
SET SESSION default_storage_engine=default;
ERROR HY000: parameter cannot be modified because specified value is invalid
drop table t1;
create table t1(a int,b int,c int unsigned,d date,e char,f datetime,g time,h blob);
insert into t1(a)values(1);
insert into t1(a,b,c,d,e,f,g,h)
values(2,-2,2,'1825-12-14','a','2003-1-1 3:2:1','4:3:2','binary data');
select * from t1;
a	b	c	d	e	f	g	h
1	NULL	NULL	NULL	NULL	NULL	NULL	NULL
2	-2	2	1825-12-14	a	2003-01-01 03:02:01	04:03:02	binary data
select a, 
ifnull(b,cast(-7 as signed)) as b, 
ifnull(c,cast(7 as unsigned)) as c, 
ifnull(d,cast('2000-01-01' as date)) as d, 
ifnull(e,cast('b' as char)) as e,
ifnull(f,cast('2000-01-01' as datetime)) as f, 
ifnull(g,cast('5:4:3' as time)) as g,
ifnull(h,cast('yet another binary data' as binary)) as h,
addtime(cast('1:0:0' as time),cast('1:0:0' as time)) as dd 
from t1;
a	b	c	d	e	f	g	h	dd
1	-7	7	2000-01-01	b	2000-01-01 00:00:00	05:04:03	yet another binary data	02:00:00
2	-2	2	1825-12-14	a	2003-01-01 03:02:01	04:03:02	binary data	02:00:00
create table t2
select
a, 
ifnull(b,cast(-7                        as signed))   as b,
ifnull(c,cast(7                         as unsigned)) as c,
ifnull(d,cast('2000-01-01'              as date))     as d,
ifnull(e,cast('b'                       as char))     as e,
ifnull(f,cast('2000-01-01'              as datetime)) as f,
ifnull(g,cast('5:4:3'                   as time))     as g,
ifnull(h,cast('yet another binary data' as binary))   as h,
addtime(cast('1:0:0' as time),cast('1:0:0' as time))  as dd
from t1;
select * from t2;
a	b	c	d	e	f	g	h	dd
1	-7	7	2000-01-01	b	2000-01-01 00:00:00	05:04:03	yet another binary data	02:00:00
2	-2	2	1825-12-14	a	2003-01-01 03:02:01	04:03:02	binary data	02:00:00
drop table t1, t2;
create table t1 (a tinyint, b smallint, c mediumint, d int, e bigint, f float(3,2), g double(4,3), h decimal(5,4), i year, j date, k timestamp NOT NULL DEFAULT CURRENT_TIMESTAMP ON UPDATE CURRENT_TIMESTAMP, l datetime, m enum('a','b'), n set('a','b'), o char(10));
create table t2 select ifnull(a,a), ifnull(b,b), ifnull(c,c), ifnull(d,d), ifnull(e,e), ifnull(f,f), ifnull(g,g), ifnull(h,h), ifnull(i,i), ifnull(j,j), ifnull(k,k), ifnull(l,l), ifnull(m,m), ifnull(n,n), ifnull(o,o) from t1;
drop table t1,t2;
create table t1(str varchar(10) default 'def',strnull varchar(10),intg int default '10',rel double default '3.14');
insert into t1 values ('','',0,0.0);
describe t1;
Field	Type	Null	Key	Default	Extra
str	varchar(10)	YES		def	
strnull	varchar(10)	YES		NULL	
intg	int(11)	YES		10	
rel	double	YES		3.14	
create table t2 select default(str) as str, default(strnull) as strnull, default(intg) as intg, default(rel) as rel from t1;
ERROR 42000: You have an error in your SQL syntax; check the manual that corresponds to your OceanBase version for the right syntax to use near '22) AS `str`,default(22) AS `strnull`,default(4) AS `intg`,default(12) AS `rel` ' at line 1
drop table t1;
create table t1(name varchar(10), age smallint default -1);
describe t1;
Field	Type	Null	Key	Default	Extra
name	varchar(10)	YES		NULL	
age	smallint(6)	YES		-1	
create table t2(name varchar(10), age smallint default - 1);
describe t2;
Field	Type	Null	Key	Default	Extra
name	varchar(10)	YES		NULL	
age	smallint(6)	YES		-1	
drop table t1, t2;
create table t1(cenum enum('a'), cset set('b'));
create table t2(cenum enum('a','a'), cset set('b','b'));
Warnings:
Warning	1291	Column 'cenum' has duplicated value 'a' in ENUM 
Warning	1291	Column 'cset' has duplicated value 'b' in SET 
drop table t3;
create table t3(cenum enum('a','A','a','c','c'), cset set('b','B','b','d','d'));
Warnings:
Warning	1291	Column 'cenum' has duplicated value 'a' in ENUM 
Warning	1291	Column 'cenum' has duplicated value 'A' in ENUM 
Warning	1291	Column 'cenum' has duplicated value 'c' in ENUM 
Warning	1291	Column 'cset' has duplicated value 'b' in SET 
Warning	1291	Column 'cset' has duplicated value 'B' in SET 
Warning	1291	Column 'cset' has duplicated value 'd' in SET 
drop table t1, t2, t3;
create database mysqltest;
use mysqltest;
select database();
database()
mysqltest
drop database mysqltest;
select database();
database()
NULL
use test;
create table t1 (a int, index `primary` (a));
ERROR 42000: Incorrect index name 'primary'
create table t1 (a int, index `PRIMARY` (a));
ERROR 42000: Incorrect index name 'PRIMARY'
create table t1 (`primary` int, index(`primary`));
create table t2 (`PRIMARY` int, index(`PRIMARY`));
create table t3 (a int);
alter table t3 add index `primary` (a);
alter table t3 add index `PRIMARY` (a);
ERROR 42000: Duplicate key name 'PRIMARY'
create table t4 (`primary` int);
alter table t4 add index(`primary`);
create table t5 (`PRIMARY` int);
alter table t5 add index(`PRIMARY`);
drop table t1, t2, t3, t4, t5;
CREATE TABLE t1(id varchar(10) NOT NULL PRIMARY KEY, dsc longtext);
INSERT INTO t1 VALUES ('5000000001', NULL),('5000000003', 'Test'),('5000000004', NULL);
CREATE TABLE t2(id varchar(15) NOT NULL, proc varchar(100) NOT NULL, runID varchar(16) NOT NULL, start datetime NOT NULL, PRIMARY KEY  (id,proc,runID,start));
INSERT INTO t2 VALUES ('5000000001', 'proc01', '20031029090650', '2003-10-29 13:38:40'),('5000000001', 'proc02', '20031029090650', '2003-10-29 13:38:51'),('5000000001', 'proc03', '20031029090650', '2003-10-29 13:38:11'),('5000000002', 'proc09', '20031024013310', '2003-10-24 01:33:11'),('5000000002', 'proc09', '20031024153537', '2003-10-24 15:36:04'),('5000000004', 'proc01', '20031024013641', '2003-10-24 01:37:29'),('5000000004', 'proc02', '20031024013641', '2003-10-24 01:37:39');
CREATE TABLE t3  SELECT t1.dsc,COUNT(DISTINCT t2.id) AS countOfRuns  FROM t1 LEFT JOIN t2 ON (t1.id=t2.id) GROUP BY t1.id;
SELECT * FROM t3;
dsc	countOfRuns
NULL	1
Test	0
NULL	1
drop table t1, t2, t3;
create table t1 (b bool not null default false);
create table t2 (b bool not null default true);
insert into t1 values ();
insert into t2 values ();
select * from t1;
b
0
select * from t2;
b
1
drop table t1,t2;
create table t1 (a int);
create table t1 select * from t1;
ERROR 42S01: Table 't1' already exists
create table t2 union = (t1) select * from t1;
unlock tables;
drop table t1;
drop table t2;
create table t1(column.name int);
ERROR 42000: Incorrect table name 'column'
create table t1(test.column.name int);
ERROR 42000: Incorrect table name 'column'
create table t1(xyz.t1.name int);
ERROR 42000: Incorrect database name 'xyz'
create table t1(t1.name int);
create table t2(test.t2.name int);
drop table t1;
drop table t2;
CREATE TABLE t1 (f1 VARCHAR(255) CHARACTER SET utf8);
CREATE TABLE t2 AS SELECT LEFT(f1,171) AS f2 FROM t1 UNION SELECT LEFT(f1,171) AS f2 FROM t1;
DESC t2;
Field	Type	Null	Key	Default	Extra
f2	varchar(171)	YES		NULL	
DROP TABLE t1,t2;
CREATE TABLE t12913 (f1 ENUM ('a','b')) AS SELECT 'a' AS f1;
SELECT * FROM t12913;
f1
a
DROP TABLE t12913;
create database mysqltest;
use mysqltest;
drop database mysqltest;
create table test.t1 like x;
ERROR 3D000: No database selected
drop table if exists test.t1;
create database mysqltest;
use mysqltest;
create view v1 as select 'foo' from dual;
create table t1 like v1;
ERROR HY000: 'mysqltest.v1' is not BASE TABLE
drop view v1;
drop database mysqltest;
create database mysqltest;
create database if not exists mysqltest character set latin2;
ERROR 42000: Unknown character set: 'latin2'
create database if not exists mysqltest character set latin1;
Warnings:
Note	1007	Can't create database 'mysqltest'; database exists
drop database mysqltest;
use test;
create table t1 (a int);
create table if not exists t1 (a int);
drop table t1;
create table t1 (
a varchar(112) charset utf8 collate utf8_bin not null,
primary key (a)
) select 'test' as a ;
drop table t1;
CREATE TABLE t2 (
a int(11) default NULL
);
insert into t2 values(111);
create table t1 ( 
a varchar(12) charset utf8 collate utf8_bin not null, 
b int not null, primary key (a)
) select a, 1 as b from t2 ;
drop table t1;
create table t1 ( 
a varchar(12) charset utf8 collate utf8_bin not null, 
b int not null, primary key (a)
) select a, 1 as c from t2 ;
Warnings:
Warning	1364	Field 'b' doesn't have a default value
drop table t1;
create table t1 ( 
a varchar(12) charset utf8 collate utf8_bin not null, 
b int null, primary key (a)
) select a, 1 as c from t2 ;
drop table t1;
create table t1 ( 
a varchar(12) charset utf8 collate utf8_bin not null,
b int not null, primary key (a)
) select 'a' as a , 1 as b from t2 ;
drop table t1;
create table t1 ( 
a varchar(12) charset utf8 collate utf8_bin,
b int not null, primary key (a)
) select 'a' as a , 1 as b from t2 ;
drop table t1, t2;
create table t1 ( 
a1 int not null,
a2 int, a3 int, a4 int, a5 int, a6 int, a7 int, a8 int, a9 int
);
insert into t1 values (1,1,1, 1,1,1, 1,1,1);
create table t2 ( 
a1 varchar(12) charset utf8 collate utf8_bin not null,
a2 int, a3 int, a4 int, a5 int, a6 int, a7 int, a8 int, a9 int,
primary key (a1)
) select a1,a2,a3,a4,a5,a6,a7,a8,a9 from t1 ;
drop table t2;
create table t2 ( 
a1 varchar(12) charset utf8 collate utf8_bin,
a2 int, a3 int, a4 int, a5 int, a6 int, a7 int, a8 int, a9 int
) select a1,a2,a3,a4,a5,a6,a7,a8,a9 from t1;
drop table t1, t2;
create table t1 ( 
a1 int, a2 int, a3 int, a4 int, a5 int, a6 int, a7 int, a8 int, a9 int
);
insert into t1 values (1,1,1, 1,1,1, 1,1,1);
create table t2 ( 
a1 varchar(12) charset utf8 collate utf8_bin not null,
a2 int, a3 int, a4 int, a5 int, a6 int, a7 int, a8 int, a9 int,
primary key (a1)
) select a1,a2,a3,a4,a5,a6,a7,a8,a9 from t1 ;
drop table t2;
create table t2 ( a int default 3, b int default 3)
select a1,a2 from t1;
drop table t1, t2;
create table t1(a set("a,b","c,d") not null);
ERROR 22007: Illegal set 'a,b' value found during parsing
create table t1 select * from t2;
ERROR 42S02: Table 'test.t2' doesn't exist
create table t1 select * from t1;
ERROR 42S02: Table 'test.t1' doesn't exist
create table t1 select coalesce(_latin1 'a' collate latin1_swedish_ci,_latin1 'b' collate latin1_bin);
ERROR HY000: Illegal mix of collations (latin1_swedish_ci,EXPLICIT), (latin1_bin,EXPLICIT)
create table t1 (primary key(a)) select "b" as b;
ERROR HY000: table must have at least one column that is not invisible
create table t1 (a int);
create table if not exists t1 select 1 as a, 2 as b;
drop table t1;
create table t1 (primary key (a)) (select 1 as a) union all (select 1 as a);
ERROR HY000: table must have at least one column that is not invisible
create table t1 (i int);
create table t1 select 1 as i;
ERROR 42S01: Table 't1' already exists
create table if not exists t1 select 1 as i;
select * from t1;
i
create table if not exists t1 select * from t1;
select * from t1;
i
drop table t1;
create table t1 select coalesce(_latin1 'a' collate latin1_swedish_ci,_latin1 'b' collate latin1_bin);
ERROR HY000: Illegal mix of collations (latin1_swedish_ci,EXPLICIT), (latin1_bin,EXPLICIT)
create table t1 (i int);
insert into t1 values (1), (2);
lock tables t1 read;
create table t2 select * from t1;
drop table t2;
create table if not exists t2 select * from t1;
unlock tables;
drop table t2;
create table t2 (j int);
lock tables t1 read;
drop table t2;
create table t2 select * from t1;
drop table t2;
create table if not exists t2 select * from t1;
unlock tables;
lock table t1 read, t2 read;
drop table t2;
create table t2 select * from t1;
create table if not exists t2 select * from t1;
unlock tables;
lock table t1 read, t2 write;
drop table t2;
create table t2 select * from t1;
create table if not exists t2 select * from t1;
select * from t1;
i
1
2
unlock tables;
drop table t2;
lock tables t1 read;
create /* temporary*/ table t2 select * from t1;
select * from t2;
i
1
2
unlock tables;
drop table t1, t2;
create table t1 (upgrade int);
drop table t1;

Bug #26104 Bug on foreign key class constructor

Check that ref_columns is initalized correctly in the constructor
and semantic checks in mysql_prepare_table work.

We do not need a storage engine that supports foreign keys
for this test, as the checks are purely syntax-based, and the
syntax is supported for all engines.

drop table if exists t1,t2;
create table t1(a int not null, b int not null, primary key (a, b));
create table t2(a int not null, b int not null, c int not null, primary key (a),
constraint fk_bug26104 foreign key (b,c) references t1(a));
ERROR 42000: Incorrect foreign key definition: Key reference and table reference don't match
drop table t1;
create table t1(f1 int,f2 int);
insert into t1 value(1,1),(1,2),(1,3),(2,1),(2,2),(2,3);
create table t2 select sql_big_result f1,count(f2) from t1 group by f1;
drop table t2;
create table t2 select f1,count(f2) from t1 group by f1;
drop table t1,t2;
CREATE TABLE t1(c1 VARCHAR(33), KEY USING BTREE (c1));
DROP TABLE t1;
CREATE TABLE t1(c1 VARCHAR(33), KEY (c1) USING BTREE);
DROP TABLE t1;
CREATE TABLE t1(c1 VARCHAR(33), KEY USING BTREE (c1) USING HASH) ENGINE=MEMORY;
Warnings:
Warning	1286	Unknown storage engine 'MEMORY'
DROP TABLE t1;
CREATE TABLE t1(c1 VARCHAR(33), KEY USING HASH (c1) USING BTREE) ENGINE=MEMORY;
Warnings:
Warning	1286	Unknown storage engine 'MEMORY'
DROP TABLE t1;
create user mysqltest_1@'test@test';
ERROR 42000: You have an error in your SQL syntax; check the manual that corresponds to your OceanBase version for the right syntax to use near '@'test@test'' at line 1
CREATE TABLE t1 (a INTEGER AUTO_INCREMENT PRIMARY KEY, b INTEGER NOT NULL);
INSERT IGNORE INTO t1 (b) VALUES (5);
CREATE TABLE IF NOT EXISTS t2 (a INTEGER NOT NULL AUTO_INCREMENT PRIMARY KEY)
SELECT a FROM t1;
INSERT INTO t2 SELECT a FROM t1;
ERROR 23000: Duplicate entry '1' for key 'PRIMARY'
INSERT INTO t2 SELECT a FROM t1;
ERROR 23000: Duplicate entry '1' for key 'PRIMARY'
DROP TABLE t1, t2;
#
# BUG#46384 - mysqld segfault when trying to create table with same 
#             name as existing view
#
CREATE TABLE t1 (a INT);
CREATE TABLE t2 (a INT);
INSERT INTO t1 VALUES (1),(2),(3);
INSERT INTO t2 VALUES (1),(2),(3);
CREATE VIEW v1 AS SELECT t1.a FROM t1, t2;
CREATE TABLE v1 AS SELECT * FROM t1;
ERROR 42S01: Table 'v1' already exists
DROP VIEW v1;
DROP TABLE t1,t2;
End of 5.0 tests
CREATE TABLE t1 (a int, b int);
insert into t1 values (1,1),(1,2);
CREATE TABLE t2 (primary key (a)) select * from t1;
ERROR HY000: table must have at least one column that is not invisible
drop table if exists t2;
Warnings:
Note	1051	Unknown table 'test.t2'
create /* temporary*/ table t2 (primary key (a)) select * from t1;
ERROR HY000: table must have at least one column that is not invisible
drop table if exists t2;
Warnings:
Note	1051	Unknown table 'test.t2'
CREATE TABLE t2 (a int, b int, primary key (a));
INSERT INTO t2 select * from t1;
ERROR 23000: Duplicate entry '1' for key 'PRIMARY'
SELECT * from t2;
a	b
TRUNCATE table t2;
INSERT INTO t2 select * from t1;
ERROR 23000: Duplicate entry '1' for key 'PRIMARY'
SELECT * from t2;
a	b
drop table t2;
create /* temporary*/ table t2 (a int, b int, primary key (a)) ENGINE=InnoDB;
Warnings:
Warning	1286	Unknown storage engine 'InnoDB'
INSERT INTO t2 SELECT * FROM t1;
ERROR 23000: Duplicate entry '1' for key 'PRIMARY'
SELECT * from t2;
a	b
drop table t1,t2;
CREATE DATABASE aaaaaaaaaaaaaaaaaaaaaaaaaaaaaaaaaaaaaaaaaaaaaaaaaaaaaaaaaaaaaaaaaaaaaaaaaaaaaaaaaaaaaaaaaaaaaaaaaaaa;
DROP DATABASE aaaaaaaaaaaaaaaaaaaaaaaaaaaaaaaaaaaaaaaaaaaaaaaaaaaaaaaaaaaaaaaaaaaaaaaaaaaaaaaaaaaaaaaaaaaaaaaaaaaa;
set names utf8;
create database имя_базы_в_кодировке_утф8_длиной_больше_чем_45;
use имя_базы_в_кодировке_утф8_длиной_больше_чем_45;
select database();
database()
имя_базы_в_кодировке_утф8_длиной_больше_чем_45
use test;
select SCHEMA_NAME from information_schema.schemata
where schema_name='имя_базы_в_кодировке_утф8_длиной_больше_чем_45';
drop database имя_базы_в_кодировке_утф8_длиной_больше_чем_45;
create table имя_таблицы_в_кодировке_утф8_длиной_больше_чем_48
(
имя_поля_в_кодировке_утф8_длиной_больше_чем_45 int,
index имя_индекса_в_кодировке_утф8_длиной_больше_чем_48 (имя_поля_в_кодировке_утф8_длиной_больше_чем_45)
);
create view имя_вью_кодировке_утф8_длиной_больше_чем_42 as
select имя_поля_в_кодировке_утф8_длиной_больше_чем_45
from имя_таблицы_в_кодировке_утф8_длиной_больше_чем_48;
select * from имя_таблицы_в_кодировке_утф8_длиной_больше_чем_48;
select TABLE_NAME from information_schema.tables where
table_schema='test' order by TABLE_NAME;
select COLUMN_NAME from information_schema.columns where
table_schema='test' order by COLUMN_NAME;
select INDEX_NAME from information_schema.statistics where
table_schema='test' order by INDEX_NAME;
select TABLE_NAME from information_schema.views where
table_schema='test' order by TABLE_NAME;
create trigger имя_триггера_в_кодировке_утф8_длиной_больше_чем_49
before insert on имя_таблицы_в_кодировке_утф8_длиной_больше_чем_48 for each row set @a:=1;
ERROR 42000: Identifier name is too long
create trigger
очень_очень_очень_очень_очень_очень_очень_очень_длинная_строка_66
before insert on имя_таблицы_в_кодировке_утф8_длиной_больше_чем_48 for each row set @a:=1;
ERROR 42000: Identifier name is too long
drop trigger очень_очень_очень_очень_очень_очень_очень_очень_длинная_строка_66;
ERROR 42000: Identifier name is too long
create procedure имя_процедуры_в_кодировке_утф8_длиной_больше_чем_50()
begin
end;
ERROR 42000: Identifier name is too long
create procedure очень_очень_очень_очень_очень_очень_очень_очень_длинная_строка_66()
begin
end;
ERROR 42000: Identifier name is too long
create function имя_функции_в_кодировке_утф8_длиной_больше_чем_49()
returns int
return 0;
ERROR 42000: Identifier name is too long
drop function имя_функции_в_кодировке_утф8_длиной_больше_чем_49;
ERROR 42000: Identifier name is too long
create function очень_очень_очень_очень_очень_очень_очень_очень_длинная_строка_66()
returns int
return 0;
ERROR 42000: Identifier name is too long
drop table имя_таблицы_в_кодировке_утф8_длиной_больше_чем_48;
set names default;
drop table if exists t1,t2,t3;
drop function if exists f1;
create function f1() returns int
begin
declare res int;
create table t3 select 1 i;
set res:= (select count(*) from t1);
drop table t3;
return res;
end|
ERROR HY000: Explicit or implicit commit is not allowed in stored function or trigger.
create table t1 like information_schema.processlist;
ERROR HY000: 'information_schema.processlist' is not BASE TABLE

# --
# -- Bug#21380: DEFAULT definition not always transfered by CREATE
# -- TABLE/SELECT to the new table.
# --

DROP TABLE IF EXISTS t1;
DROP TABLE IF EXISTS t2;

CREATE TABLE t1(
c1 INT DEFAULT 12 COMMENT 'column1',
c2 INT NULL COMMENT 'column2',
c3 INT NOT NULL COMMENT 'column3',
c4 VARCHAR(255) CHARACTER SET utf8 NOT NULL DEFAULT 'a',
c5 VARCHAR(255) COLLATE utf8_unicode_ci NULL DEFAULT 'b',
c6 VARCHAR(255))
COLLATE latin1_bin;


CREATE TABLE t2 AS SELECT * FROM t1;


DROP TABLE t2;
DROP TABLE t1;

# -- End of test case for Bug#21380.

# --
# -- Bug#18834: ALTER TABLE ADD INDEX on table with two timestamp fields
# --

DROP TABLE IF EXISTS t1;
DROP TABLE IF EXISTS t2;
DROP TABLE IF EXISTS t3;

CREATE TABLE t1(c1 TIMESTAMP NOT NULL DEFAULT CURRENT_TIMESTAMP ON UPDATE CURRENT_TIMESTAMP, c2 TIMESTAMP NOT NULL DEFAULT '0000-00-00 00:00:00');

SET sql_mode = 'NO_ZERO_DATE';

CREATE TABLE t2(c1 TIMESTAMP, c2 TIMESTAMP DEFAULT 0);
DROP TABLE t2;

# -- Check that NULL column still can be created.
CREATE TABLE t2(c1 TIMESTAMP NULL);

# -- Check ALTER TABLE.
ALTER TABLE t1 ADD INDEX(c1);

# -- Check DATETIME.
SET sql_mode = '';

# -- Cleanup.
SET sql_mode = '';
DROP TABLE t1;
DROP TABLE t2;

# -- End of Bug#18834.

# --
# -- Bug#34274: Invalid handling of 'DEFAULT 0' for YEAR data type.
# --

DROP TABLE IF EXISTS t1;

CREATE TABLE t1(c1 YEAR DEFAULT 2008, c2 YEAR DEFAULT 0);


INSERT INTO t1 VALUES();

SELECT * FROM t1;
c1	c2
2008	0000

ALTER TABLE t1 MODIFY c1 YEAR DEFAULT 0;


INSERT INTO t1 VALUES();

SELECT * FROM t1;
c1	c2
2008	0000
0000	0000

DROP TABLE t1;

# -- End of Bug#34274
create table `me:i`(id int);
drop table `me:i`;

# --
# -- Bug#45829: CREATE TABLE TRANSACTIONAL PAGE_CHECKSUM ROW_FORMAT=PAGE accepted, does nothing
# --

drop table if exists t1,t2,t3;
create table t1 (a int) transactional=0;
ERROR 42000: You have an error in your SQL syntax; check the manual that corresponds to your OceanBase version for the right syntax to use near 'transactional=0' at line 1
create table t2 (a int) page_checksum=1;
ERROR 42000: You have an error in your SQL syntax; check the manual that corresponds to your OceanBase version for the right syntax to use near 'page_checksum=1' at line 1
create table t3 (a int) row_format=page;
ERROR 42000: You have an error in your SQL syntax; check the manual that corresponds to your OceanBase version for the right syntax to use near 'page' at line 1

# -- End of Bug#45829

End of 5.1 tests

# --
# -- Bug #43054 	Assertion `!table->auto_increment_field_not_null' 
# --       failed when redefining trigger

drop table B;
CREATE TABLE B (
pk INTEGER AUTO_INCREMENT,
int_key INTEGER NOT NULL,
PRIMARY KEY (pk),
KEY (int_key)
);
INSERT IGNORE INTO B VALUES ('9', '9');
CREATE TABLE IF NOT EXISTS t1 ( 
`pk` INTEGER NOT NULL AUTO_INCREMENT , 
`int` INTEGER ,
PRIMARY KEY ( `pk` ) 
) SELECT `pk` , `int_key` FROM B ;
CREATE TRIGGER f BEFORE INSERT ON t1 FOR EACH ROW 
BEGIN 
INSERT INTO t1 ( `int` ) VALUES (4 ),( 8 ),( 2 ) ; 
END ; |
INSERT INTO t1 (pk, int_key) SELECT `pk` , `int_key` FROM B ;
ERROR HY000: Can't update table 't1' in stored function/trigger because it is already used by statement which invoked this stored function/trigger.
CREATE TRIGGER f BEFORE INSERT ON t1 FOR EACH ROW 
BEGIN 
UPDATE A SET `pk`=1 WHERE `pk`=0 ; 
END ;|
ERROR HY000: trigger 'f' already exist
DROP TABLE t1;
DROP TABLE B;
#
# Bug #47107 assert in notify_shared_lock on incorrect 
#            CREATE TABLE , HANDLER
#
DROP TABLE IF EXISTS t1;
CREATE TABLE t1(f1 integer);
# The following CREATE TABLEs before gave an assert.
HANDLER t1 OPEN AS A;
ERROR 42000: You have an error in your SQL syntax; check the manual that corresponds to your OceanBase version for the right syntax to use near 'AS A' at line 1
CREATE TABLE t1 SELECT 1 AS f2;
ERROR 42S01: Table 't1' already exists
HANDLER t1 OPEN AS A;
ERROR 42000: You have an error in your SQL syntax; check the manual that corresponds to your OceanBase version for the right syntax to use near 'AS A' at line 1
CREATE TABLE t1(f1 integer);
ERROR 42S01: Table 't1' already exists
CREATE TABLE t2(f1 integer);
HANDLER t1 OPEN AS A;
ERROR 42000: You have an error in your SQL syntax; check the manual that corresponds to your OceanBase version for the right syntax to use near 'AS A' at line 1
CREATE TABLE t1 LIKE t2;
ERROR 42S01: Table 't1' already exists
DROP TABLE t2;
DROP TABLE t1;
#
# Bug #48800 CREATE TABLE t...SELECT fails if t is a 
#            temporary table
#
CREATE TABLE t1 (a INT);
CREATE VIEW t2 AS SELECT 1;
CREATE TABLE t3 (a INT);
CREATE TABLE t4 AS SELECT 1;
DROP TABLE t1, t3, t4;
DROP VIEW t2;
#
# Bug #49193 CREATE TABLE reacts differently depending 
#            on whether data is selected or not
#
drop table t2;
create /* temporary*/ table t2 (ID INT);
INSERT INTO t2 VALUES (1),(2),(3);
CREATE TABLE IF NOT EXISTS t1 (ID INT);
INSERT INTO t1 SELECT * FROM t2;
SELECT * FROM t1;
ID
1
2
3
SELECT * FROM t1;
ID
1
2
3
DROP TABLE t1;
CREATE TABLE IF NOT EXISTS t1 SELECT * FROM t2;
SELECT * FROM t1;
ID
1
2
3
DROP TABLE t1;
CREATE TABLE t1 SELECT * FROM t2;
SELECT * FROM t1;
ID
1
2
3
DROP TABLE t1;
DROP TABLE t2;
# 
# Bug #22909 "Using CREATE ... LIKE is possible to create field
#             with invalid default value"
#
# Altough original bug report suggests to use older version of MySQL
# for producing .FRM with invalid defaults we use sql_mode to achieve
# the same effect.
drop tables if exists t1, t2;
# Attempt to create table with invalid default should fail in normal mode
create table t1 (dt datetime default '2008-02-31 00:00:00');
ERROR 42000: Invalid default value for 'dt'
set @old_mode= @@sql_mode;
set @@sql_mode='ALLOW_INVALID_DATES';
# The same should be possible in relaxed mode
create table t1 (dt datetime default '2008-02-31 00:00:00');
set @@sql_mode= @old_mode;
# In normal mode attempt to create copy of table with invalid
# default should fail
drop table t2;
create table t2 like t1;
set @@sql_mode='ALLOW_INVALID_DATES';
# But should work in relaxed mode
drop table t2;
create table t2 like t1;
# Check that table definitions match
set @@sql_mode= @old_mode;
drop tables t1, t2;
CREATE TABLE t1 (id int);
CREATE TABLE t2 (id int);
INSERT INTO t1 VALUES (1), (1);
INSERT INTO t2 VALUES (2), (2);
CREATE VIEW v1 AS SELECT id FROM t2;
CREATE TABLE IF NOT EXISTS v1(a int, b int) SELECT id, id FROM t1;
ERROR 42S21: Duplicate column name 'id'
SELECT * FROM t2;
id
2
2
DROP TABLE t1, t2;
#
# WL#5370 "Changing 'CREATE TABLE IF NOT EXISTS ... SELECT'
# behaviour.
# 
#
# 1. Basic case: a base table.
# 
create table if not exists t1 (a int) select 1 as a;
select * from t1;
a
1
create table t1 (a int) select 2 as a;
ERROR 42S01: Table 't1' already exists
select * from t1;
a
1
# Produces an essential warning ER_TABLE_EXISTS.
create table if not exists t1 (a int) select 2 as a;
# No new data in t1.
select * from t1;
a
1
drop table t1;
# 
# 2. A temporary table.
#
create /* temporary*/ table if not exists t1 (a int) select 1 as a;
select * from t1;
a
1
drop  table t1;
create /* temporary*/ table t1 (a int) select 2 as a;
select * from t1;
a
2
# An essential warning.
drop  table t1;
create /* temporary*/ table if not exists t1 (a int) select 2 as a;
# No new data in t1.
select * from t1;
a
2
drop  table t1;
# 
# 3. Creating a base table in presence of a temporary table.
#
create table t1 (a int);
# Create a view for convenience of querying t1 shadowed by a temp.
DROP VIEW v1;
create view v1 as select a from t1;
drop table t1;
create table if not exists t1 (a int) select 2 as a;
select * from t1;
a
2
select * from v1;
a
2
# Note: an essential warning.
drop table t1;
create table if not exists t1 (a int) select 3 as a;
select * from t1;
a
3
select * from v1;
a
3
select * from t1;
a
3
drop view v1;
drop table t1;
# 
# 4. Creating a temporary table in presence of a base table.
#
create table t1 (a int) select 1 as a;
select * from t1;
a
1
# Note: an essential warning.
select * from t1;
a
1
drop table t1;
#
# 5. Creating a base table in presence of an updatable view.
# 
create table t2 (a int unique);
create view t1 as select a from t2;
insert into t1 (a) values (1);
create table t1 (a int);
ERROR 42S01: Table 't1' already exists
# Note: an essential warning.
create table if not exists t1 (a int);
create table t1 (a int) select 2 as a;
ERROR 42S01: Table 't1' already exists
select * from t1;
a
1
# Note: an essential warning.
create table if not exists t1 (a int) select 2 as a;
select * from t1;
a
1
select * from t2;
a
1
select * from t1;
a
1
select * from t2;
a
1
# Note: an essential warning.
select * from t1;
a
1
select * from t2;
a
1
#
# Repeating the test with a non-updatable view.
#
drop view t1;
create view t1 as select a + 5 as a from t2;
insert into t1 (a) values (1);
ERROR HY000: Column 'a' is not updatable
update t1 set a=3 where a=2;
ERROR HY000: Column 'a' is not updatable
create table t1 (a int);
ERROR 42S01: Table 't1' already exists
# Note: an essential warning.
create table if not exists t1 (a int);
create table t1 (a int) select 2 as a;
ERROR 42S01: Table 't1' already exists
select * from t1;
a
6
# Note: an essential warning.
create table if not exists t1 (a int) select 2 as a;
select * from t1;
a
6
select * from t2;
a
1
drop table t1;
drop table t1 ;
drop view t1;
drop view t1 ;
drop table t2;
#
# Repeating the test with a view select a constant number
#
create view t1 as select 1 as a;
insert into t1 (a) values (1);
ERROR HY000: The target table t1 of the INSERT is not insertable-into
update t1 set a=3 where a=2;
ERROR HY000: The target table t1 of the UPDATE is not updatable
create table t1 (a int);
ERROR 42S01: Table 't1' already exists
# Note: an essential warning.
create table if not exists t1 (a int);
create table t1 (a int) select 2 as a;
ERROR 42S01: Table 't1' already exists
select * from t1;
a
1
# Note: an essential warning.
create table if not exists t1 (a int) select 2 as a;
select * from t1;
a
1
create /* temporary*/ table if not exists t1 (a int) select 3 as a;
select * from t1;
a
1
# Note: an essential warning.
create /* temporary*/ table if not exists t1 (a int) select 4 as a;
select * from t1;
a
1
drop table t1;
drop view t1;
#
# 6. Test of unique_table().
#
create table t1 (a int) select 1 as a;
create /* temporary*/ table if not exists t1 (a int) select * from t1;
create /* temporary*/ table if not exists t1 (a int) select * from t1;
select * from t1;
a
1
select * from t1;
a
1
drop table t1;
create table if not exists t1 (a int) select * from t1;
ERROR 42S02: Table 'test.t1' doesn't exist
#
# 7. Test of non-matching columns, REPLACE and IGNORE.
#
create table t1 (a int) select 1 as b, 2 as c;
select * from t1;
a	b	c
NULL	1	2
drop table t1;
create table if not exists t1 (a int, b date, c date) select 1 as b, 2 as c;
drop table t1;
set @@session.sql_mode=default;
create table if not exists t1 (a int, b date, c date) select 1 as b, 2 as c;
ERROR 22007: Incorrect value
select * from t1;
ERROR 42S02: Table 'test.t1' doesn't exist
create table if not exists t1 (a int, b date, c date) 
replace select 1 as b, 2 as c;
ERROR 22007: Incorrect value
select * from t1;
ERROR 42S02: Table 'test.t1' doesn't exist
create table if not exists t1 (a int, b date, c date) 
ignore select 1 as b, 2 as c;
select * from t1;
a	b	c
NULL	0000-00-00	0000-00-00
drop table t1;
create table if not exists t1 (a int unique, b int)
replace select 1 as a, 1 as b union select 1 as a, 2 as b;
select * from t1;
a	b
1	2
drop table t1;
create table if not exists t1 (a int unique, b int)
ignore select 1 as a, 1 as b union select 1 as a, 2 as b;
select * from t1;
a	b
1	1
drop table t1;
#
#
# WL#5576 Prohibit CREATE TABLE ... SELECT to modify other tables
#
drop function f;
create function f()
returns int
begin
insert into t2 values(1);
return 1;
end|
#
# 1. The function updates a base table
#
create table t2(c1 int);
create table t1 select f();
ERROR HY000: Can't update table while ctas is being created.
drop table t2;
#
# 2. The function updates a view which derives from a base table
#
create table t3(c1 int);
create view t2 as select c1 from t3;
create table t1 select f();
ERROR HY000: Can't update table while ctas is being created.
drop view t2;
#
# 3. The function updates a view which derives from two base tables
#
create table t4(c1 int);
create view t2 as select t3.c1 as c1 from t3, t4;
create table t1 select f();
ERROR HY000: Can't update table while ctas is being created.
drop view t2;
drop tables t3, t4;
#
# 4. The function updates a view which selects a constant number
#
create view t2 as select 1;
create table t1 select f();
ERROR HY000: Can't update table while ctas is being created.
drop view t2;
drop function f;
#
# BUG#11762377 - 54963: ENHANCE THE ERROR MESSAGE TO 
#                       REDUCE USER CONFUSION 
#
CREATE TABLE t1 (v varchar(65535) CHARACTER SET latin1);
#
# Bug#11746295 - 25168: "INCORRECT TABLE NAME" INSTEAD OF "IDENTIFIER TOO
#                       LONG" IF TABLE NAME > 64 CHARACTERS
#
CREATE TABLE t01234567890123456789012345678901234567890123456789012345678901234567890123456789(a int);
ERROR 42000: Identifier name 't01234567890123456789012345678901234567890123456789012345678901234567890123456789' is too long
DROP DATABASE t01234567890123456789012345678901234567890123456789012345678901234567890123456789;
CREATE DATABASE t01234567890123456789012345678901234567890123456789012345678901234567890123456789;
DROP DATABASE t01234567890123456789012345678901234567890123456789012345678901234567890123456789;
#
# Bug #20573701 DROP DATABASE ASSERT ON DEBUG WHEN OTHER FILES PRESENT IN
#               DB FOLDER.
#
#
# Bug#20857556: IMPROPER ERROR DURING CREATE TABLE
#
# Without the patch ER_WRONG_TABLE_NAME was getting reported.
drop table t1;
CREATE TABLE t1 (id INT) INDEX DIRECTORY = 'a#######################################################b#######################################################################################b#####################################################################################b######################################################################################b######################################################################################b#############################################################################################################';
CREATE TABLE t2 (id INT NOT NULL, name VARCHAR(30))
ENGINE = InnoDB
PARTITION BY RANGE (id) (
PARTITION p0 VALUES LESS THAN (10) INDEX DIRECTORY = 'a#######################################################b#######################################################################################b#####################################################################################b######################################################################################b######################################################################################b#############################################################################################################'
);
ERROR 42000: You have an error in your SQL syntax; check the manual that corresponds to your OceanBase version for the right syntax to use near 'INDEX DIRECTORY = 'a#######################################################b####' at line 4
CREATE TABLE t3 (id INT) INDEX DIRECTORY = 'test';
CREATE TABLE t4 (id INT NOT NULL, name VARCHAR(30))
ENGINE = InnoDB
PARTITION BY RANGE (id) (
PARTITION p0 VALUES LESS THAN (10) INDEX DIRECTORY = 'test'
);
ERROR 42000: You have an error in your SQL syntax; check the manual that corresponds to your OceanBase version for the right syntax to use near 'INDEX DIRECTORY = 'test'
)' at line 4
#
# BUG 27516741 - MYSQL SERVER DOES NOT WRITE INNODB ROW_TYPE
#                TO .FRM FILE WHEN DEFAULT USED
# Set up.
SET @saved_innodb_default_row_format= @@global.innodb_default_row_format;
SET @saved_show_create_table_verbosity= @@session.show_create_table_verbosity;
# Current InnoDB default row format and 'show_create_table_verbosity'
# values respectively.
SELECT @@global.innodb_default_row_format;
@@global.innodb_default_row_format
DYNAMIC
SELECT @@session.show_create_table_verbosity;
@@session.show_create_table_verbosity
0
drop table t1;
drop table t2;
drop view t2;
CREATE TABLE t1(fld1 INT) ENGINE= InnoDB;
Warnings:
Warning	1286	Unknown storage engine 'InnoDB'
CREATE TABLE t2(fld1 INT) ENGINE= InnoDB, ROW_FORMAT= DEFAULT;
Warnings:
Warning	1286	Unknown storage engine 'InnoDB'
SET GLOBAL innodb_default_row_format= 'COMPACT';
drop table t3;
drop table t4;
CREATE TABLE t3(fld1 INT) ENGINE= InnoDB;
Warnings:
Warning	1286	Unknown storage engine 'InnoDB'
CREATE TABLE t4(fl1 INT) ENGINE= InnoDB, ROW_FORMAT= COMPRESSED;
Warnings:
Warning	1286	Unknown storage engine 'InnoDB'
# Test without show_create_table_verbosity enabled.
# Row format used is not displayed for all tables
# except t4 where it is explicitly specified.
# Test with show_create_table_verbosity enabled.
# Row format used is displayed for all tables.
SET SESSION show_create_table_verbosity= ON;
Warnings:
Warning	1235	This system variable now is mock not supported
SET GLOBAL innodb_default_row_format= 'DYNAMIC';
SET SESSION show_create_table_verbosity= OFF;
Warnings:
Warning	1235	This system variable now is mock not supported
# Test with corresponding temporary tables.
drop table t1;
drop table t2;
drop table t3;
drop table t4;
create /* temporary*/ table t1(fld1 INT) ENGINE= InnoDB;
Warnings:
Warning	1286	Unknown storage engine 'InnoDB'
create /* temporary*/ table t2(fld1 INT) ENGINE= InnoDB, ROW_FORMAT= DEFAULT;
Warnings:
Warning	1286	Unknown storage engine 'InnoDB'
SET GLOBAL innodb_default_row_format= 'COMPACT';
create /* temporary*/ table t3(fld1 INT) ENGINE= InnoDB;
Warnings:
Warning	1286	Unknown storage engine 'InnoDB'
create /* temporary*/ table t4(fl1 INT) ENGINE= InnoDB, ROW_FORMAT= REDUNDANT;
Warnings:
Warning	1286	Unknown storage engine 'InnoDB'
# Test without show_create_table_verbosity enabled.
# Row format used is not displayed for all tables
# except t4 where it is explicitly specified.
# Test with show_create_table_verbosity enabled.
# Row format used is displayed for all tables.
SET SESSION show_create_table_verbosity= ON;
Warnings:
Warning	1235	This system variable now is mock not supported
# Clean up.
DROP TABLE t1, t2, t3, t4;
SET GLOBAL innodb_default_row_format= @saved_innodb_default_row_format;
SET SESSION show_create_table_verbosity= @saved_show_create_table_verbosity;
Warnings:
Warning	1235	This system variable now is mock not supported
#
# Bug#27592803: ASSERTION FAILED: RC == TYPE_OK,
#
# Make sure that it is possible to create enums using binary string
# values that are not valid utf8
DROP TABLE t0;
CREATE TABLE t0(a ENUM('aaa', 'bbb', 'ccc') BYTE);
ERROR 42000: You have an error in your SQL syntax; check the manual that corresponds to your OceanBase version for the right syntax to use near 'BYTE)' at line 1
DROP TABLE t0;
# Tables t1 and t2 uses a binary value that is legal as utf8, so they
# would not trigger an assert.
CREATE TABLE t1(a ENUM( b'1001001'));
DROP TABLE t1;
DROP TABLE t2;
CREATE TABLE t2(a ENUM( b'1001001') BYTE);
ERROR 42000: You have an error in your SQL syntax; check the manual that corresponds to your OceanBase version for the right syntax to use near 'BYTE)' at line 1
# Tables t3 - t6 contains binary values that are not valid utf8
# which would previously result in assert. With the fix we get the hex
# representation of the binary value instead.
DROP TABLE t3;
CREATE TABLE t3(a ENUM( b'10010010') BYTE);
ERROR 42000: You have an error in your SQL syntax; check the manual that corresponds to your OceanBase version for the right syntax to use near 'BYTE)' at line 1
DROP TABLE t4;
CREATE TABLE t4(a ENUM( b'1001001101101111') BYTE);
ERROR 42000: You have an error in your SQL syntax; check the manual that corresponds to your OceanBase version for the right syntax to use near 'BYTE)' at line 1
DROP TABLE t5;
CREATE TABLE t5(a ENUM( b'10010011011011111111011000011') BYTE);
ERROR 42000: You have an error in your SQL syntax; check the manual that corresponds to your OceanBase version for the right syntax to use near 'BYTE)' at line 1
DROP TABLE t6;
CREATE TABLE t6 (a INT);
ALTER TABLE t6
MODIFY COLUMN a ENUM( b'10010011011011111111011000011') BYTE UNIQUE FIRST;
ERROR 42000: You have an error in your SQL syntax; check the manual that corresponds to your OceanBase version for the right syntax to use near 'BYTE UNIQUE FIRST' at line 2
# Bug#17468242/Wl#11807: Provide an option to prevent creation of tables
# without a unique/pk
#
SET GLOBAL sql_require_primary_key= ON;
ERROR HY000: Unknown system variable 'sql_require_primary_key'
SELECT @@global.sql_require_primary_key;
ERROR HY000: Unknown system variable 'sql_require_primary_key'
# Checking variable at session level
# Should not affect this session
SELECT @@session.sql_require_primary_key;
ERROR HY000: Unknown system variable 'sql_require_primary_key'
CREATE TABLE t1(i INT);
CREATE TABLE t2(i INT PRIMARY KEY, j INT);
ALTER TABLE t2 DROP COLUMN i;
ERROR 0A000: drop rowkey column is not supported
DROP TABLE t2;
DROP TABLE t1;
# Create new connection which will inherit global setting
SELECT @@session.sql_require_primary_key;
ERROR HY000: Unknown system variable 'sql_require_primary_key'
CREATE TABLE t1(i INT);
drop table t1;
CREATE TABLE t1(i INT PRIMARY KEY, j INT);
ALTER TABLE t1 DROP COLUMN i;
ERROR 0A000: drop rowkey column is not supported
DROP TABLE t1;
# Overdide inherited global setting locally
SET SESSION sql_require_primary_key= OFF;
ERROR HY000: Unknown system variable 'sql_require_primary_key'
SELECT @@session.sql_require_primary_key;
ERROR HY000: Unknown system variable 'sql_require_primary_key'
CREATE TABLE t1(i INT);
CREATE TABLE t2(i INT PRIMARY KEY, j INT);
ALTER TABLE t2 DROP COLUMN i;
ERROR 0A000: drop rowkey column is not supported
DROP TABLE t2;
DROP TABLE t1;
# Verify CREATE LIKE
CREATE TABLE t1(i INT);
SET SESSION sql_require_primary_key= ON;
ERROR HY000: Unknown system variable 'sql_require_primary_key'
CREATE TABLE t2 LIKE t1;
# Verify CREATE AS SELECT ...
DROP TABLE t3;
CREATE TABLE t3 (I INT PRIMARY KEY);
DROP TABLE t4;
CREATE TABLE t4 AS SELECT 1;
DROP TABLE t4;
CREATE TABLE t4 AS SELECT * FROM t1;
# PK attribute is not propagated by CREATE AS
DROP TABLE t4;
CREATE TABLE t4 AS SELECT * FROM t3;
# PK attribute specified explicitly is ok
DROP TABLE t4;
CREATE TABLE t4(i INT PRIMARY KEY) AS SELECT * FROM t3;
# Drop and add PK in same ALTER statement should be ok
DROP TABLE t5;
CREATE TABLE t5(i INT PRIMARY KEY, j INT);
ALTER TABLE t5 DROP PRIMARY KEY, ADD CONSTRAINT PRIMARY KEY (j);
# Restriction also applies to temporary tables
DROP TABLE t6;
create /* temporary*/ table t6(i INT);
# Cleanup
DROP TABLE t1;
DROP TABLE t2;
DROP TABLE t3;
DROP TABLE t4;
DROP TABLE t5;
DROP TABLE t6;
# Create user without SUPER privilege.
SET GLOBAL sql_require_primary_key= OFF;
ERROR HY000: Unknown system variable 'sql_require_primary_key'
#
# Bug#28022129: NOW() DOESN?T HONOR NO_ZERO_DATE SQL_MODE
#
SET @saved_mode= @@sql_mode;
CREATE TABLE t1(fld1 int);
# NO_ZERO_DATE and STRICT SQL mode.
CREATE TABLE t2 SELECT fld1, CURDATE() fld2 FROM t1;
CREATE TABLE t3 AS SELECT now();
# With patch, zero date is not generated as default.
DROP TABLE t2, t3;
SET SQL_MODE= "NO_ZERO_DATE";
# NO_ZERO_DATE SQL mode.
CREATE TABLE t2 SELECT fld1, CURDATE() fld2 FROM t1;
CREATE TABLE t3 AS SELECT now();
# Zero date is generated as default in non strict mode.
DROP TABLE t1, t2, t3;
SET SQL_MODE= DEFAULT;
# Test cases added for coverage.
CREATE TABLE t1(fld1 DATETIME NOT NULL DEFAULT '1111:11:11');
# CREATE TABLE..SELECT using fields of another table.
CREATE TABLE t2 AS SELECT * FROM t1;
# Default value is copied from the source table column.
DROP TABLE t1, t2;
# CREATE TABLE..SELECT based on trigger fields.
CREATE TABLE t1 (fld1 INT, fld2 DATETIME DEFAULT '1211:1:1');
CREATE TRIGGER t1_bi BEFORE INSERT ON t1
FOR EACH ROW
BEGIN
create /* temporary*/ table t2 AS SELECT NEW.fld1, NEW.fld2;
END
|
ERROR HY000: Explicit or implicit commit is not allowed in stored function or trigger.
INSERT INTO t1 VALUES (1, '1111:11:11');
DROP TABLE t1;
SET SQL_MODE= @saved_mode;
#
# Bug #29283055: CREATE TABLE IF NOT EXISTS .. SHOULD NOT ALWAYS
# FAIL ON SQL_REQUIRE_PRIMARY_KEY
#
# Create table without PK
CREATE TABLE t1(i INT);
SET SESSION sql_require_primary_key=1;
ERROR HY000: Unknown system variable 'sql_require_primary_key'
# This must not fail when t1 already exists, even if it does not have
# a pk
CREATE TABLE IF NOT EXISTS t1(i INT);
# Cleanup
SET SESSION sql_require_primary_key=DEFAULT;
ERROR HY000: Unknown system variable 'sql_require_primary_key'
DROP TABLE t1;
#
# WL#13127: Deprecate integer display width and ZEROFILL option
#
#
# WL#13528: Remove integer display width from show create output
#
CREATE TABLE t1(
a TINYINT,
b SMALLINT,
c MEDIUMINT,
d INT,
e BIGINT,
f TINYINT(1),
g SMALLINT(1),
h MEDIUMINT(1),
i INT(1),
j BIGINT(1),
k TINYINT ZEROFILL,
l SMALLINT ZEROFILL,
m MEDIUMINT ZEROFILL,
n INT ZEROFILL,
o BIGINT ZEROFILL
);
SELECT COLUMN_TYPE FROM INFORMATION_SCHEMA.COLUMNS WHERE TABLE_NAME = 't1';
COLUMN_TYPE
bigint(1)
bigint(20)
bigint(20) unsigned zerofill
int(1)
int(10) unsigned zerofill
int(11)
mediumint(1)
mediumint(8) unsigned zerofill
mediumint(9)
smallint(1)
smallint(5) unsigned zerofill
smallint(6)
tinyint(1)
tinyint(3) unsigned zerofill
tinyint(4)
DESCRIBE t1;
Field	Type	Null	Key	Default	Extra
a	tinyint(4)	YES		NULL	
b	smallint(6)	YES		NULL	
c	mediumint(9)	YES		NULL	
d	int(11)	YES		NULL	
e	bigint(20)	YES		NULL	
f	tinyint(1)	YES		NULL	
g	smallint(1)	YES		NULL	
h	mediumint(1)	YES		NULL	
i	int(1)	YES		NULL	
j	bigint(1)	YES		NULL	
k	tinyint(3) unsigned	YES		NULL	
l	smallint(5) unsigned	YES		NULL	
m	mediumint(8) unsigned	YES		NULL	
n	int(10) unsigned	YES		NULL	
o	bigint(20) unsigned	YES		NULL	
CREATE VIEW v1 AS SELECT * FROM t1;
SELECT COLUMN_TYPE FROM INFORMATION_SCHEMA.COLUMNS WHERE TABLE_NAME = 'v1';
COLUMN_TYPE
bigint(1)
bigint(20)
bigint(20) unsigned zerofill
int(1)
int(10) unsigned zerofill
int(11)
mediumint(1)
mediumint(8) unsigned zerofill
mediumint(9)
smallint(1)
smallint(5) unsigned zerofill
smallint(6)
tinyint(1)
tinyint(3) unsigned zerofill
tinyint(4)
DESCRIBE v1;
Field	Type	Null	Key	Default	Extra
a	tinyint(4)	YES		NULL	
b	smallint(6)	YES		NULL	
c	mediumint(9)	YES		NULL	
d	int(11)	YES		NULL	
e	bigint(20)	YES		NULL	
f	tinyint(1)	YES		NULL	
g	smallint(1)	YES		NULL	
h	mediumint(1)	YES		NULL	
i	int(1)	YES		NULL	
j	bigint(1)	YES		NULL	
k	tinyint(3) unsigned	YES		NULL	
l	smallint(5) unsigned	YES		NULL	
m	mediumint(8) unsigned	YES		NULL	
n	int(10) unsigned	YES		NULL	
o	bigint(20) unsigned	YES		NULL	
DROP VIEW v1;
DROP TABLE t1;
CREATE FUNCTION f1(a INT) RETURNS INT RETURN 1;
CREATE FUNCTION f2(a INT ZEROFILL) RETURNS INT ZEROFILL RETURN 1;
SELECT DTD_IDENTIFIER FROM INFORMATION_SCHEMA.ROUTINES WHERE ROUTINE_NAME = 'f1';
SELECT DTD_IDENTIFIER FROM INFORMATION_SCHEMA.ROUTINES WHERE ROUTINE_NAME = 'f2';
SELECT DTD_IDENTIFIER FROM INFORMATION_SCHEMA.PARAMETERS WHERE SPECIFIC_NAME = 'f1';
SELECT DTD_IDENTIFIER FROM INFORMATION_SCHEMA.PARAMETERS WHERE SPECIFIC_NAME = 'f2';
DROP FUNCTION f1;
DROP FUNCTION f2;
DROP PROCEDURE p1;
CREATE PROCEDURE p1(a INT, b INT ZEROFILL) BEGIN END;
SELECT DTD_IDENTIFIER FROM INFORMATION_SCHEMA.PARAMETERS WHERE SPECIFIC_NAME = 'p1';
DTD_IDENTIFIER
int unsigned zerofill
int(11)
DROP PROCEDURE p1;
#
# Bug#30556657: REVERT I_S show create CHANGES REGARDING TINYINT(1)
#
CREATE TABLE t1(a BOOLEAN, b TINYINT(1), c TINYINT(1) UNSIGNED, d TINYINT(1) ZEROFILL);
SELECT * FROM INFORMATION_SCHEMA.COLUMNS WHERE TABLE_NAME = 't1';
TABLE_CATALOG	TABLE_SCHEMA	TABLE_NAME	COLUMN_NAME	ORDINAL_POSITION	COLUMN_DEFAULT	IS_NULLABLE	DATA_TYPE	CHARACTER_MAXIMUM_LENGTH	CHARACTER_OCTET_LENGTH	NUMERIC_PRECISION	NUMERIC_SCALE	DATETIME_PRECISION	CHARACTER_SET_NAME	COLLATION_NAME	COLUMN_TYPE	COLUMN_KEY	EXTRA	PRIVILEGES	COLUMN_COMMENT	GENERATION_EXPRESSION	SRS_ID
def	test	t1	a	1	NULL	YES	tinyint	NULL	NULL	1	0	NULL	NULL	NULL	tinyint(1)			select,insert,update,reference			NULL
def	test	t1	b	2	NULL	YES	tinyint	NULL	NULL	1	0	NULL	NULL	NULL	tinyint(1)			select,insert,update,reference			NULL
def	test	t1	c	3	NULL	YES	tinyint	NULL	NULL	1	0	NULL	NULL	NULL	tinyint(1) unsigned			select,insert,update,reference			NULL
def	test	t1	d	4	NULL	YES	tinyint	NULL	NULL	1	0	NULL	NULL	NULL	tinyint(1) unsigned zerofill			select,insert,update,reference			NULL
DESCRIBE t1;
Field	Type	Null	Key	Default	Extra
a	tinyint(1)	YES		NULL	
b	tinyint(1)	YES		NULL	
c	tinyint(1) unsigned	YES		NULL	
d	tinyint(1) unsigned	YES		NULL	
CREATE VIEW v1 AS SELECT * FROM t1;
SELECT COLUMN_TYPE FROM INFORMATION_SCHEMA.COLUMNS WHERE TABLE_NAME = 'v1';
COLUMN_TYPE
tinyint(1)
tinyint(1)
tinyint(1) unsigned
tinyint(1) unsigned zerofill
DESCRIBE v1;
Field	Type	Null	Key	Default	Extra
a	tinyint(1)	YES		NULL	
b	tinyint(1)	YES		NULL	
c	tinyint(1) unsigned	YES		NULL	
d	tinyint(1) unsigned	YES		NULL	
DROP VIEW v1;
DROP TABLE t1;
CREATE FUNCTION f1(a BOOLEAN, b TINYINT(1), c TINYINT(1) UNSIGNED,
d TINYINT(1) ZEROFILL) RETURNS BOOLEAN RETURN 1;
SELECT DTD_IDENTIFIER FROM INFORMATION_SCHEMA.ROUTINES WHERE ROUTINE_NAME = 'f1';
SELECT DTD_IDENTIFIER FROM INFORMATION_SCHEMA.PARAMETERS WHERE SPECIFIC_NAME = 'f1';
DROP FUNCTION f1;
CREATE PROCEDURE p1(a BOOLEAN, b TINYINT(1), c TINYINT(1) UNSIGNED,
d TINYINT(1) ZEROFILL) BEGIN END;
SELECT DTD_IDENTIFIER FROM INFORMATION_SCHEMA.PARAMETERS WHERE SPECIFIC_NAME = 'p1';
DTD_IDENTIFIER
tinyint unsigned
tinyint unsigned zerofill
tinyint(1)
tinyint(1)
DROP PROCEDURE p1;
#
# Bug#32227101: CREATE TABLE PRODUCES CORE
#
# Bug#33114368: 'SHOW TABLE STATUS' WITH HUGE AVG_ROW_LENGTH:
# DD::PROPERTIES::GET: ASSERTION `FALSE' FAILED.
#
# These issues are related and arise from insufficient input checking
# of numeric table options.
# From bug#33114368 we see that even if no overflow occurs on CREATE,
# there can be a risk of overflow when the option value is used
# elsewhere.
# The safest thing to do is to constrain values to the largest
# value permitted by the frm-file format (unless the range of the option
# value has been explicitly changed in 8.0).
#
# key_block_size, parser type: signed_num (int)
# std::uint32_t HA_CREATE_INFO::key_block_size
# 2 bytes in frm
# Only settable for myisam, but also used in Innodb
# key_block_size = 2^31-1 - rejected by explicit check 
CREATE TABLE t1(i INT PRIMARY KEY) KEY_BLOCK_SIZE = 2147483647;
DROP TABLE t1;
# key_block_size = -(2^31)+1 - rejected by parser (parser switched
# back to using ulong_num now that there is an explicit check).
CREATE TABLE t1(i INT PRIMARY KEY) KEY_BLOCK_SIZE = -2147483647;
ERROR 42000: You have an error in your SQL syntax; check the manual that corresponds to your OceanBase version for the right syntax to use near '-2147483647' at line 1
# key_block_size = 2^31 - rejected by explicit check
CREATE TABLE t1(i INT PRIMARY KEY) KEY_BLOCK_SIZE = 2147483648;
DROP TABLE t1;
# key_block_size = -2^31 - rejected by parser (parser switched
# back to using ulong_num now that there is an explicit check).
CREATE TABLE t1(i INT PRIMARY KEY) KEY_BLOCK_SIZE = -2147483648;
ERROR 42000: You have an error in your SQL syntax; check the manual that corresponds to your OceanBase version for the right syntax to use near '-2147483648' at line 1
# key_block_size = 2^32-1 - rejected by explicit check
CREATE TABLE t2(i INT PRIMARY KEY) KEY_BLOCK_SIZE = 4294967295;
DROP TABLE t2;
# key_block_size = 2^32 - rejected by explicit check
CREATE TABLE t3(i INT PRIMARY KEY) KEY_BLOCK_SIZE = 4294967296;
DROP TABLE t3;
# key_block_size = 3927749503218772669 - now rejected by parser
CREATE TABLE t4(
c0 DECIMAL ZEROFILL  UNIQUE KEY STORAGE MEMORY,
c1 DECIMAL ZEROFILL  PRIMARY KEY COLUMN_FORMAT DYNAMIC UNIQUE KEY STORAGE MEMORY NOT NULL,
c2 FLOAT ZEROFILL  COMMENT 'asdf'  COLUMN_FORMAT FIXED NULL STORAGE MEMORY,
c3 TINYINT(120) ZEROFILL   STORAGE DISK UNIQUE KEY NULL COMMENT 'asdf'
) CHECKSUM = 1, AUTO_INCREMENT = 1093400439, KEY_BLOCK_SIZE = 3927749503218772669, COMPRESSION = 'NONE';
# Only values which will fit in the two bytes allocated in the frm file
# format are accepted.
CREATE TABLE t1(a INT) ENGINE=myisam key_block_size=65535;
Warnings:
Warning	1286	Unknown storage engine 'myisam'
DROP TABLE t1;
#
# Bug #33114368	'SHOW TABLE STATUS' WITH HUGE AVG_ROW_LENGTH:
# DD::PROPERTIES::GET: ASSERTION `FALSE' FAILED.
#
# avg_row_length, parser type: ulong_num (ulong) 
# ulong HA_CREATE_INFO::avg_row_length
# 4 bytes in frm
CREATE TABLE t1(a INT) avg_row_length=18446744073709551615;
ERROR 42000: You have an error in your SQL syntax; check the manual that corresponds to your OceanBase version for the right syntax to use near 'avg_row_length=18446744073709551615' at line 1
CREATE TABLE t1(a INT) avg_row_length=4294967296;
DROP TABLE t1;
# Only values which will fit in the four bytes allocated in the frm file
# format are accepted.
CREATE TABLE t1(a INT) avg_row_length=4294967295;
DROP TABLE t1;
# max_rows, parser type: ulonglong_num (ulonglong)
# ulonglong HA_CREATE_INFO::max_rows
# 4 bytes in frm
# max_rows is capped and a warning produced
CREATE TABLE t1(a INT) max_rows=18446744073709551615;
DROP TABLE t1;
# min_rows, parser type: ulonglong_num (ulonglong)
# ulonglong HA_CREATE_INFO::min_rows
# 4 bytes in frm
# min_rows is capped and a warning produced
CREATE TABLE t1(a INT) min_rows=18446744073709551615;
DROP TABLE t1;
# Bug#34523475: Inconsequent type derivation when using @variable
drop table t2;
CREATE TABLE t1 AS SELECT @max_error_count UNION SELECT 'a';
CREATE TABLE t2 AS SELECT @max_error_count UNION SELECT 'a';
DROP TABLE t1, t2;
