drop table if exists t1,t2;
#
# Start of 5.5 tests
#
set names utf8mb4;
select left(_utf8mb4 0xD0B0D0B1D0B2,1);
left(_utf8mb4 0xD0B0D0B1D0B2,1)
а
select right(_utf8mb4 0xD0B0D0B2D0B2,1);
right(_utf8mb4 0xD0B0D0B2D0B2,1)
в
select locate('he','hello');
locate('he','hello')
1
select locate('he','hello',2);
locate('he','hello',2)
0
select locate('lo','hello',2);
locate('lo','hello',2)
4
select locate('HE','hello');
locate('HE','hello')
1
select locate('HE','hello',2);
locate('HE','hello',2)
0
select locate('LO','hello',2);
locate('LO','hello',2)
4
select locate('HE','hello' collate utf8mb4_bin);
locate('HE','hello' collate utf8mb4_bin)
0
select locate('HE','hello' collate utf8mb4_bin,2);
locate('HE','hello' collate utf8mb4_bin,2)
0
select locate('LO','hello' collate utf8mb4_bin,2);
locate('LO','hello' collate utf8mb4_bin,2)
0
select locate(_utf8mb4 0xD0B1, _utf8mb4 0xD0B0D0B1D0B2);
locate(_utf8mb4 0xD0B1, _utf8mb4 0xD0B0D0B1D0B2)
2
select locate(_utf8mb4 0xD091, _utf8mb4 0xD0B0D0B1D0B2);
locate(_utf8mb4 0xD091, _utf8mb4 0xD0B0D0B1D0B2)
2
select locate(_utf8mb4 0xD0B1, _utf8mb4 0xD0B0D091D0B2);
locate(_utf8mb4 0xD0B1, _utf8mb4 0xD0B0D091D0B2)
2
select locate(_utf8mb4 0xD091, _utf8mb4 0xD0B0D0B1D0B2 collate utf8mb4_bin);
locate(_utf8mb4 0xD091, _utf8mb4 0xD0B0D0B1D0B2 collate utf8mb4_bin)
0
select locate(_utf8mb4 0xD0B1, _utf8mb4 0xD0B0D091D0B2 collate utf8mb4_bin);
locate(_utf8mb4 0xD0B1, _utf8mb4 0xD0B0D091D0B2 collate utf8mb4_bin)
0
select length(_utf8mb4 0xD0B1), bit_length(_utf8mb4 0xD0B1), char_length(_utf8mb4 0xD0B1);
length(_utf8mb4 0xD0B1)	bit_length(_utf8mb4 0xD0B1)	char_length(_utf8mb4 0xD0B1)
2	16	1
select 'a' like 'a';
'a' like 'a'
1
select 'A' like 'a';
'A' like 'a'
1
select 'A' like 'a' collate utf8mb4_bin;
'A' like 'a' collate utf8mb4_bin
0
select _utf8mb4 0xD0B0D0B1D0B2 like concat(_utf8mb4'%',_utf8mb4 0xD0B1,_utf8mb4 '%');
_utf8mb4 0xD0B0D0B1D0B2 like concat(_utf8mb4'%',_utf8mb4 0xD0B1,_utf8mb4 '%')
1
SELECT 'a' = 'a ';
'a' = 'a '
1
SELECT 'a\0' < 'a';
'a\0' < 'a'
1
SELECT 'a\0' < 'a ';
'a\0' < 'a '
1
SELECT 'a\t' < 'a';
'a\t' < 'a'
1
SELECT 'a\t' < 'a ';
'a\t' < 'a '
1
SELECT 'a' = 'a ' collate utf8mb4_bin;
'a' = 'a ' collate utf8mb4_bin
1
SELECT 'a\0' < 'a' collate utf8mb4_bin;
'a\0' < 'a' collate utf8mb4_bin
1
SELECT 'a\0' < 'a ' collate utf8mb4_bin;
'a\0' < 'a ' collate utf8mb4_bin
1
SELECT 'a\t' < 'a' collate utf8mb4_bin;
'a\t' < 'a' collate utf8mb4_bin
1
SELECT 'a\t' < 'a ' collate utf8mb4_bin;
'a\t' < 'a ' collate utf8mb4_bin
1
CREATE TABLE t1 (a char(10) character set utf8mb4 not null);
INSERT INTO t1 VALUES ('a'),('a\0'),('a\t'),('a ');
SELECT hex(a),STRCMP(a,'a'), STRCMP(a,'a ') FROM t1;
hex(a)	STRCMP(a,'a')	STRCMP(a,'a ')
61	0	0
6100	-1	-1
6109	-1	-1
61	0	0
DROP TABLE t1;
select insert('txs',2,1,'hi'),insert('is ',4,0,'a'),insert('txxxxt',2,4,'es');
insert('txs',2,1,'hi')	insert('is ',4,0,'a')	insert('txxxxt',2,4,'es')
this	is 	test
select insert("aa",100,1,"b"),insert("aa",1,3,"b");
insert("aa",100,1,"b")	insert("aa",1,3,"b")
aa	b
select char_length(left(@a:='褌械褋褌',5)), length(@a), @a;
char_length(left(@a:='褌械褋褌',5))	length(@a)	@a
4	12	褌械褋褌
create table t1 select date_format("2004-01-19 10:10:10", "%Y-%m-%d");
select * from t1;
date_format("2004-01-19 10:10:10", "%Y-%m-%d")
2004-01-19
drop table t1;
set names utf8mb4;
set LC_TIME_NAMES='fr_FR';
ERROR 42000: Variable 'lc_time_names' can't be set to the value of 'fr_FR'
create table t1 (s1 char(20) character set latin1);
insert into t1 values (date_format('2004-02-02','%M'));
select hex(s1) from t1;
hex(s1)
4665627275617279
drop table t1;
create table t1 (s1 char(20) character set koi8r);
ERROR 42000: Unknown character set: 'koi8r'
create table t1 (s1 char(20) character set utf8mb4);
set LC_TIME_NAMES='ru_RU';
ERROR 42000: Variable 'lc_time_names' can't be set to the value of 'ru_RU'
insert into t1 values (date_format('2004-02-02','%M'));
insert into t1 values (date_format('2004-02-02','%b'));
insert into t1 values (date_format('2004-02-02','%W'));
insert into t1 values (date_format('2004-02-02','%a'));
select hex(s1), s1 from t1;
hex(s1)	s1
4665627275617279	February
466562	Feb
4D6F6E646179	Monday
4D6F6E	Mon
drop table t1;
set LC_TIME_NAMES='en_US';
SET sql_mode = 'NO_ENGINE_SUBSTITUTION';
set names koi8r;
ERROR 42000: Unknown character set: 'koi8r'
create table t1 (s1 char(1) character set utf8mb4);
select s1,hex(s1),char_length(s1),octet_length(s1) from t1;
s1	hex(s1)	char_length(s1)	octet_length(s1)
drop table t1;
create table t1 (s1 tinytext character set utf8mb4);
insert into t1 select repeat('a',300);
Warnings:
Warning	1265	Data truncated for column '"test"."t1"."s1"' at row 1
insert into t1 select repeat('?',300);
Warnings:
Warning	1265	Data truncated for column '"test"."t1"."s1"' at row 1
insert into t1 select repeat('a',300);
Warnings:
Warning	1265	Data truncated for column '"test"."t1"."s1"' at row 1
insert into t1 select repeat('補',300);
Warnings:
Warning	1265	Data truncated for column '"test"."t1"."s1"' at row 1
insert into t1 select repeat('蜒',300);
Warnings:
Warning	1265	Data truncated for column '"test"."t1"."s1"' at row 1
select hex(s1) from t1;
hex(s1)
616161616161616161616161616161616161616161616161616161616161616161616161616161616161616161616161616161616161616161616161616161616161616161616161616161616161616161616161616161616161616161616161616161616161616161616161616161616161616161616161616161616161616161616161616161616161616161616161616161616161616161616161616161616161616161616161616161616161616161616161616161616161616161616161616161616161616161616161616161616161616161616161616161616161616161616161616161616161616161616161616161616161616161616161616161
3F3F3F3F3F3F3F3F3F3F3F3F3F3F3F3F3F3F3F3F3F3F3F3F3F3F3F3F3F3F3F3F3F3F3F3F3F3F3F3F3F3F3F3F3F3F3F3F3F3F3F3F3F3F3F3F3F3F3F3F3F3F3F3F3F3F3F3F3F3F3F3F3F3F3F3F3F3F3F3F3F3F3F3F3F3F3F3F3F3F3F3F3F3F3F3F3F3F3F3F3F3F3F3F3F3F3F3F3F3F3F3F3F3F3F3F3F3F3F3F3F3F3F3F3F3F3F3F3F3F3F3F3F3F3F3F3F3F3F3F3F3F3F3F3F3F3F3F3F3F3F3F3F3F3F3F3F3F3F3F3F3F3F3F3F3F3F3F3F3F3F3F3F3F3F3F3F3F3F3F3F3F3F3F3F3F3F3F3F3F3F3F3F3F3F3F3F3F3F3F3F3F3F3F3F3F3F3F3F3F3F3F3F3F3F3F3F3F3F3F3F3F3F3F3F3F3F3F3F3F3F3F3F3F3F3F3F3F3F3F3F3F3F3F3F3F3F3F3F3F3F3F3F3F3F
616161616161616161616161616161616161616161616161616161616161616161616161616161616161616161616161616161616161616161616161616161616161616161616161616161616161616161616161616161616161616161616161616161616161616161616161616161616161616161616161616161616161616161616161616161616161616161616161616161616161616161616161616161616161616161616161616161616161616161616161616161616161616161616161616161616161616161616161616161616161616161616161616161616161616161616161616161616161616161616161616161616161616161616161616161
E8A39CE8A39CE8A39CE8A39CE8A39CE8A39CE8A39CE8A39CE8A39CE8A39CE8A39CE8A39CE8A39CE8A39CE8A39CE8A39CE8A39CE8A39CE8A39CE8A39CE8A39CE8A39CE8A39CE8A39CE8A39CE8A39CE8A39CE8A39CE8A39CE8A39CE8A39CE8A39CE8A39CE8A39CE8A39CE8A39CE8A39CE8A39CE8A39CE8A39CE8A39CE8A39CE8A39CE8A39CE8A39CE8A39CE8A39CE8A39CE8A39CE8A39CE8A39CE8A39CE8A39CE8A39CE8A39CE8A39CE8A39CE8A39CE8A39CE8A39CE8A39CE8A39CE8A39CE8A39CE8A39CE8A39CE8A39CE8A39CE8A39CE8A39CE8A39CE8A39CE8A39CE8A39CE8A39CE8A39CE8A39CE8A39CE8A39CE8A39CE8A39CE8A39CE8A39CE8A39CE8A39C
E89C92E89C92E89C92E89C92E89C92E89C92E89C92E89C92E89C92E89C92E89C92E89C92E89C92E89C92E89C92E89C92E89C92E89C92E89C92E89C92E89C92E89C92E89C92E89C92E89C92E89C92E89C92E89C92E89C92E89C92E89C92E89C92E89C92E89C92E89C92E89C92E89C92E89C92E89C92E89C92E89C92E89C92E89C92E89C92E89C92E89C92E89C92E89C92E89C92E89C92E89C92E89C92E89C92E89C92E89C92E89C92E89C92E89C92E89C92E89C92E89C92E89C92E89C92E89C92E89C92E89C92E89C92E89C92E89C92E89C92E89C92E89C92E89C92E89C92E89C92E89C92E89C92E89C92E89C92E89C92E89C92E89C92E89C92E89C92E89C92
select length(s1),char_length(s1) from t1;
length(s1)	char_length(s1)
255	255
255	255
255	255
255	85
255	85
drop table t1;
create table t1 (s1 text character set utf8mb4);
insert into t1 select repeat('a',66000);
Warnings:
Warning	1265	Data truncated for column '"test"."t1"."s1"' at row 1
insert into t1 select repeat('?',66000);
Warnings:
Warning	1265	Data truncated for column '"test"."t1"."s1"' at row 1
insert into t1 select repeat('a',66000);
Warnings:
Warning	1265	Data truncated for column '"test"."t1"."s1"' at row 1
insert into t1 select repeat('補',66000);
Warnings:
Warning	1265	Data truncated for column '"test"."t1"."s1"' at row 1
insert into t1 select repeat('蜒',66000);
Warnings:
Warning	1265	Data truncated for column '"test"."t1"."s1"' at row 1
select length(s1),char_length(s1) from t1;
length(s1)	char_length(s1)
65535	65535
65535	65535
65535	65535
65535	21845
65535	21845
drop table t1;
SET sql_mode = default;
create table t1 (s1 char(10) character set utf8mb4);
insert ignore into t1 values (0x41FF);
select hex(s1) from t1;
hex(s1)
41
drop table t1;
create table t1 (s1 varchar(10) character set utf8mb4);
insert ignore into t1 values (0x41FF);
select hex(s1) from t1;
hex(s1)
41
drop table t1;
create table t1 (s1 text character set utf8mb4);
insert ignore into t1 values (0x41FF);
select hex(s1) from t1;
hex(s1)
41
drop table t1;
create table t1 (a text character set utf8mb4, primary key(a(371)));
ERROR 42000: You have an error in your SQL syntax; check the manual that corresponds to your OceanBase version for the right syntax to use near '(371)))' at line 1
CREATE TABLE t1 ( a varchar(10) ) CHARACTER SET utf8mb4;
INSERT INTO t1 VALUES ( 'test' );
SELECT a.a, b.a FROM t1 a, t1 b WHERE a.a = b.a;
a	a
test	test
SELECT a.a, b.a FROM t1 a, t1 b WHERE a.a = 'test' and b.a = 'test';
a	a
test	test
SELECT a.a, b.a FROM t1 a, t1 b WHERE a.a = b.a and a.a = 'test';
a	a
test	test
DROP TABLE t1;
create table t1 (a char(255) character set utf8mb4);
insert into t1 values('b'),('b');
select * from t1 where a = 'b';
a
b
b
select * from t1 where a = 'b' and a = 'b';
a
b
b
select * from t1 where a = 'b' and a != 'b';
a
drop table t1;
set collation_connection=utf8mb4_general_ci;
drop table if exists t1;
create table t1 as
select repeat(' ', 64) as s1, repeat(' ',64) as s2
union
select null, null;
show create table t1;
Table	Create Table
t1	CREATE TABLE `t1` (
  `s1` varchar(512) DEFAULT NULL,
  `s2` varchar(512) DEFAULT NULL
) ORGANIZATION INDEX DEFAULT CHARSET = utf8mb4 ROW_FORMAT = DYNAMIC COMPRESSION = 'zstd_1.3.8' REPLICA_NUM = replica_num BLOCK_SIZE = 16384 USE_BLOOM_FILTER = FALSE TABLET_SIZE = 134217728 PCTFREE = 0
delete from t1;
insert into t1 values('aaa','aaa');
insert into t1 values('aaa|qqq','qqq');
insert into t1 values('gheis','^[^a-dXYZ]+$');
insert into t1 values('aab','^aa?b');
insert into t1 values('Baaan','^Ba*n');
insert into t1 values('aaa','qqq|aaa');
insert into t1 values('qqq','qqq|aaa');
insert into t1 values('bbb','qqq|aaa');
insert into t1 values('bbb','qqq');
insert into t1 values('aaa','aba');
insert into t1 values(null,'abc');
insert into t1 values('def',null);
insert into t1 values(null,null);
SELECT 'ghi' REGEXP 'ghi[';
ERROR HY000: unmatched bracket in regular expression
drop table t1;
set names utf8mb4;
CREATE TABLE t1 (a enum ('Y', 'N') DEFAULT 'N' COLLATE utf8mb4_unicode_ci);
ALTER TABLE t1 ADD COLUMN b CHAR(20);
DROP TABLE t1;
set names utf8mb4;
create table t1 (a enum('aaaa','锌褉芯斜邪') character set utf8mb4);
insert into t1 values ('锌褉芯斜邪');
select * from t1;
a
锌褉芯斜邪
create table t2 select ifnull(a,a) from t1;
show create table t2;
Table	Create Table
t2	CREATE TABLE `t2` (
  `ifnull(a,a)` varchar(5) DEFAULT NULL
) ORGANIZATION INDEX DEFAULT CHARSET = utf8mb4 ROW_FORMAT = DYNAMIC COMPRESSION = 'zstd_1.3.8' REPLICA_NUM = replica_num BLOCK_SIZE = 16384 USE_BLOOM_FILTER = FALSE TABLET_SIZE = 134217728 PCTFREE = 0
select * from t2;
ifnull(a,a)
锌褉芯斜邪
drop table t1;
drop table t2;
create table t1 (c varchar(30) character set utf8mb4, unique(c(10)));
insert into t1 values ('1'),('2'),('3'),('x'),('y'),('z');
insert into t1 values ('aaaaaaaaaa');
insert into t1 values ('aaaaaaaaaaa');
ERROR 23000: Duplicate entry 'aaaaaaaaaa' for key 'c'
insert into t1 values ('aaaaaaaaaaaa');
ERROR 23000: Duplicate entry 'aaaaaaaaaa' for key 'c'
insert into t1 values (repeat('b',20));
select c c1 from t1 where c='1';
c1
1
select c c2 from t1 where c='2';
c2
2
select c c3 from t1 where c='3';
c3
3
select c cx from t1 where c='x';
cx
x
select c cy from t1 where c='y';
cy
y
select c cz from t1 where c='z';
cz
z
select c ca10 from t1 where c='aaaaaaaaaa';
ca10
aaaaaaaaaa
select c cb20 from t1 where c=repeat('b',20);
cb20
bbbbbbbbbbbbbbbbbbbb
drop table t1;
create table t1 (c char(3) character set utf8mb4, unique (c(2)));
insert into t1 values ('1'),('2'),('3'),('4'),('x'),('y'),('z');
insert into t1 values ('a');
insert into t1 values ('aa');
insert into t1 values ('aaa');
ERROR 23000: Duplicate entry 'aa' for key 'c'
insert into t1 values ('b');
insert into t1 values ('bb');
insert into t1 values ('bbb');
ERROR 23000: Duplicate entry 'bb' for key 'c'
insert into t1 values ('邪');
insert into t1 values ('邪邪');
insert into t1 values ('邪邪邪');
ERROR 23000: Duplicate entry '邪邪' for key 'c'
insert into t1 values ('斜');
insert into t1 values ('斜斜');
insert into t1 values ('斜斜斜');
ERROR 23000: Duplicate entry '斜斜' for key 'c'
insert into t1 values ('戟');
insert into t1 values ('戟');
insert into t1 values ('戟戟');
Got one of the listed errors
drop table t1;
create table t1 (
c char(10) character set utf8mb4,
unique key a using hash (c(1))
) engine=heap;
Warnings:
Warning	1286	Unknown storage engine 'heap'
insert into t1 values ('a'),('b'),('c'),('d'),('e'),('f');
insert into t1 values ('aa');
ERROR 23000: Duplicate entry 'a' for key 'a'
insert into t1 values ('aaa');
ERROR 23000: Duplicate entry 'a' for key 'a'
insert into t1 values ('斜');
insert into t1 values ('斜斜');
ERROR 23000: Duplicate entry '斜' for key 'a'
insert into t1 values ('斜斜斜');
ERROR 23000: Duplicate entry '斜' for key 'a'
select c as c_all from t1 order by c;
c_all
a
b
c
d
e
f
斜
select c as c_a from t1 where c='a';
c_a
a
select c as c_a from t1 where c='斜';
c_a
斜
drop table t1;
create table t1 (
c char(10) character set utf8mb4,
unique key a using btree (c(1))
) engine=heap;
Warnings:
Warning	1286	Unknown storage engine 'heap'
insert into t1 values ('a'),('b'),('c'),('d'),('e'),('f');
insert into t1 values ('aa');
ERROR 23000: Duplicate entry 'a' for key 'a'
insert into t1 values ('aaa');
ERROR 23000: Duplicate entry 'a' for key 'a'
insert into t1 values ('斜');
insert into t1 values ('斜斜');
ERROR 23000: Duplicate entry '斜' for key 'a'
insert into t1 values ('斜斜斜');
ERROR 23000: Duplicate entry '斜' for key 'a'
select c as c_all from t1 order by c;
c_all
a
b
c
d
e
f
斜
select c as c_a from t1 where c='a';
c_a
a
select c as c_a from t1 where c='斜';
c_a
斜
drop table t1;
create table t1 (c varchar(30) character set utf8mb4 collate utf8mb4_bin, unique(c(10)));
insert into t1 values ('1'),('2'),('3'),('x'),('y'),('z');
insert into t1 values ('aaaaaaaaaa');
insert into t1 values ('aaaaaaaaaaa');
ERROR 23000: Duplicate entry 'aaaaaaaaaa' for key 'c'
insert into t1 values ('aaaaaaaaaaaa');
ERROR 23000: Duplicate entry 'aaaaaaaaaa' for key 'c'
insert into t1 values (repeat('b',20));
select c c1 from t1 where c='1';
c1
1
select c c2 from t1 where c='2';
c2
2
select c c3 from t1 where c='3';
c3
3
select c cx from t1 where c='x';
cx
x
select c cy from t1 where c='y';
cy
y
select c cz from t1 where c='z';
cz
z
select c ca10 from t1 where c='aaaaaaaaaa';
ca10
aaaaaaaaaa
select c cb20 from t1 where c=repeat('b',20);
cb20
bbbbbbbbbbbbbbbbbbbb
drop table t1;
create table t1 (c char(3) character set utf8mb4 collate utf8mb4_bin, unique (c(2)));
insert into t1 values ('1'),('2'),('3'),('4'),('x'),('y'),('z');
insert into t1 values ('a');
insert into t1 values ('aa');
insert into t1 values ('aaa');
ERROR 23000: Duplicate entry 'aa' for key 'c'
insert into t1 values ('b');
insert into t1 values ('bb');
insert into t1 values ('bbb');
ERROR 23000: Duplicate entry 'bb' for key 'c'
insert into t1 values ('邪');
insert into t1 values ('邪邪');
insert into t1 values ('邪邪邪');
ERROR 23000: Duplicate entry '邪邪' for key 'c'
insert into t1 values ('斜');
insert into t1 values ('斜斜');
insert into t1 values ('斜斜斜');
ERROR 23000: Duplicate entry '斜斜' for key 'c'
insert into t1 values ('戟');
insert into t1 values ('戟');
insert into t1 values ('戟戟');
Got one of the listed errors
drop table t1;
create table t1 (
c char(10) character set utf8mb4 collate utf8mb4_bin,
unique key a using hash (c(1))
) engine=heap;
Warnings:
Warning	1286	Unknown storage engine 'heap'
insert into t1 values ('a'),('b'),('c'),('d'),('e'),('f');
insert into t1 values ('aa');
ERROR 23000: Duplicate entry 'a' for key 'a'
insert into t1 values ('aaa');
ERROR 23000: Duplicate entry 'a' for key 'a'
insert into t1 values ('斜');
insert into t1 values ('斜斜');
ERROR 23000: Duplicate entry '斜' for key 'a'
insert into t1 values ('斜斜斜');
ERROR 23000: Duplicate entry '斜' for key 'a'
select c as c_all from t1 order by c;
c_all
a
b
c
d
e
f
斜
select c as c_a from t1 where c='a';
c_a
a
select c as c_a from t1 where c='斜';
c_a
斜
drop table t1;
create table t1 (
c char(10) character set utf8mb4 collate utf8mb4_bin,
unique key a using btree (c(1))
) engine=heap;
Warnings:
Warning	1286	Unknown storage engine 'heap'
insert into t1 values ('a'),('b'),('c'),('d'),('e'),('f');
insert into t1 values ('aa');
ERROR 23000: Duplicate entry 'a' for key 'a'
insert into t1 values ('aaa');
ERROR 23000: Duplicate entry 'a' for key 'a'
insert into t1 values ('斜');
insert into t1 values ('斜斜');
ERROR 23000: Duplicate entry '斜' for key 'a'
insert into t1 values ('斜斜斜');
ERROR 23000: Duplicate entry '斜' for key 'a'
select c as c_all from t1 order by c;
c_all
a
b
c
d
e
f
斜
select c as c_a from t1 where c='a';
c_a
a
select c as c_a from t1 where c='斜';
c_a
斜
drop table t1;
create table t1 (
str varchar(255) character set utf8mb4 not null,
key str  (str(2))
);
INSERT INTO t1 VALUES ('str');
INSERT INTO t1 VALUES ('str2');
select * from t1 where str='str';
str
str
drop table t1;
create table t1 (
str varchar(255) character set utf8mb4 not null,
key str using btree (str(2))
) engine=heap;
Warnings:
Warning	1286	Unknown storage engine 'heap'
INSERT INTO t1 VALUES ('str');
INSERT INTO t1 VALUES ('str2');
select * from t1 where str='str';
str
str
drop table t1;
create table t1 (
str varchar(255) character set utf8mb4 not null,
key str using hash (str(2))
) engine=heap;
Warnings:
Warning	1286	Unknown storage engine 'heap'
INSERT INTO t1 VALUES ('str');
INSERT INTO t1 VALUES ('str2');
select * from t1 where str='str';
str
str
drop table t1;
CREATE TABLE t1 (a varchar(32) BINARY) CHARACTER SET utf8mb4;
INSERT INTO t1 VALUES ('test');
SELECT a FROM t1 WHERE a LIKE '%te';
a
DROP TABLE t1;
CREATE TABLE t1 (
id       int unsigned NOT NULL auto_increment,
list_id  smallint unsigned NOT NULL,
term     TEXT NOT NULL,
PRIMARY KEY(id),
INDEX(list_id, term(4))
) CHARSET=utf8mb4;
INSERT INTO t1 SET list_id = 1, term = "letterc";
INSERT INTO t1 SET list_id = 1, term = "letterb";
INSERT INTO t1 SET list_id = 1, term = "lettera";
INSERT INTO t1 SET list_id = 1, term = "letterd";
SELECT id FROM t1 WHERE (list_id = 1) AND (term = "letterc");
id
1
SELECT id FROM t1 WHERE (list_id = 1) AND (term = "letterb");
id
2
SELECT id FROM t1 WHERE (list_id = 1) AND (term = "lettera");
id
3
SELECT id FROM t1 WHERE (list_id = 1) AND (term = "letterd");
id
4
DROP TABLE t1;
SET NAMES latin1;
CREATE TABLE t1 (
id int unsigned NOT NULL auto_increment,
list_id smallint unsigned NOT NULL,
term text NOT NULL,
PRIMARY KEY(id),
INDEX(list_id, term(19))
) ENGINE=MyISAM CHARSET=utf8mb4;
Warnings:
Warning	1286	Unknown storage engine 'MyISAM'
INSERT INTO t1 set list_id = 1, term = "test閠est";
INSERT INTO t1 set list_id = 1, term = "testetest";
INSERT INTO t1 set list_id = 1, term = "test鑤est";
SELECT id, term FROM t1 where (list_id = 1) AND (term = "test閠est");
id	term
1	test閠est
SELECT id, term FROM t1 where (list_id = 1) AND (term = "testetest");
id	term
2	testetest
SELECT id, term FROM t1 where (list_id = 1) AND (term = "test鑤est");
id	term
3	test鑤est
DROP TABLE t1;
set names utf8mb4;
create table t1 (
a enum('锌械褌褟','胁邪褋褟','邪薪褞褌邪') character set utf8mb4 not null default '邪薪褞褌邪',
b set('锌械褌褟','胁邪褋褟','邪薪褞褌邪') character set utf8mb4 not null default '邪薪褞褌邪'
);
create table t2 select concat(a,_utf8mb4'') as a, concat(b,_utf8mb4'')as b from t1;
show create table t2;
Table	Create Table
t2	CREATE TABLE `t2` (
  `a` varchar(5) DEFAULT NULL,
  `b` varchar(15) DEFAULT NULL
) ORGANIZATION INDEX DEFAULT CHARSET = utf8mb4 ROW_FORMAT = DYNAMIC COMPRESSION = 'zstd_1.3.8' REPLICA_NUM = replica_num BLOCK_SIZE = 16384 USE_BLOOM_FILTER = FALSE TABLET_SIZE = 134217728 PCTFREE = 0
drop table t2;
drop table t1;
select 'c' like '\_' as want0;
want0
0
SELECT SUBSTR('胁邪褋褟',-2);
SUBSTR('胁邪褋褟',-2)
褋褟
create table t1 (id integer, a varchar(100) character set utf8mb4 collate utf8mb4_unicode_ci);
insert into t1 values (1, 'Test');
select * from t1 where soundex(a) = soundex('Test');
id	a
1	Test
select * from t1 where soundex(a) = soundex('TEST');
id	a
1	Test
select * from t1 where soundex(a) = soundex('test');
id	a
1	Test
drop table t1;
select soundex(_utf8mb4 0xE99885E8A788E99A8FE697B6E69BB4E696B0E79A84E696B0E997BB);
soundex(_utf8mb4 0xE99885E8A788E99A8FE697B6E69BB4E696B0E79A84E696B0E997BB)

select hex(soundex(_utf8mb4 0xE99885E8A788E99A8FE697B6E69BB4E696B0E79A84E696B0E997BB));
hex(soundex(_utf8mb4 0xE99885E8A788E99A8FE697B6E69BB4E696B0E79A84E696B0E997BB))

select soundex(_utf8mb4 0xD091D092D093);
soundex(_utf8mb4 0xD091D092D093)

select hex(soundex(_utf8mb4 0xD091D092D093));
hex(soundex(_utf8mb4 0xD091D092D093))

SET collation_connection='utf8mb4_general_ci';
create table t1 select repeat('a',4000) a;
delete from t1;
insert into t1 values ('a'), ('a '), ('a\t');
select collation(a),hex(a) from t1 order by a;
collation(a)	hex(a)
utf8mb4_general_ci	6109
utf8mb4_general_ci	61
utf8mb4_general_ci	6120
drop table t1;
select @@collation_connection;
@@collation_connection
utf8mb4_general_ci
create table t1 ROW_FORMAT=DYNAMIC select repeat('a',50) as c1 ;
insert into t1 values('abcdef');
insert into t1 values('_bcdef');
insert into t1 values('a_cdef');
insert into t1 values('ab_def');
insert into t1 values('abc_ef');
insert into t1 values('abcd_f');
insert into t1 values('abcde_');
select c1 as c1u from t1 where c1 like 'ab\_def';
c1u
ab_def
select c1 as c2h from t1 where c1 like 'ab#_def' escape '#';
c2h
ab_def
drop table t1;
"BEGIN ctype_german.inc"
drop table if exists t1;
create table t1 as select repeat(' ', 64) as s1;
select collation(s1) from t1;
collation(s1)
utf8mb4_general_ci
delete from t1;
INSERT INTO t1 VALUES ('ud'),('uf');
INSERT INTO t1 VALUES ('od'),('of');
INSERT INTO t1 VALUES ('e');
INSERT INTO t1 VALUES ('ad'),('af');
insert into t1 values ('a'),('ae'),(_latin1 0xE4);
insert into t1 values ('o'),('oe'),(_latin1 0xF6);
insert into t1 values ('s'),('ss'),(_latin1 0xDF);
insert into t1 values ('u'),('ue'),(_latin1 0xFC);
INSERT INTO t1 VALUES (_latin1 0xE6), (_latin1 0xC6);
INSERT INTO t1 VALUES (_latin1 0x9C), (_latin1 0x8C);
select s1, hex(s1) from t1 order by s1, binary s1;
s1	hex(s1)
a	61
ä	C3A4
ad	6164
ae	6165
af	6166
e	65
o	6F
ö	C3B6
od	6F64
oe	6F65
of	6F66
s	73
ß	C39F
ss	7373
u	75
ü	C3BC
ud	7564
ue	7565
uf	7566
Æ	C386
æ	C3A6
Œ	C592
œ	C593
select group_concat(s1 order by binary s1) from t1 group by s1;
group_concat(s1 order by binary s1)
oe
Æ,æ
s,ß
ue
Œ,œ
u,ü
ud
ad
of
ae
uf
a,ä
od
o,ö
af
ss
e
SELECT s1, hex(s1), hex(weight_string(s1)) FROM t1 ORDER BY s1, BINARY(s1);
s1	hex(s1)	hex(weight_string(s1))
a	61	0041
ä	C3A4	0041
ad	6164	00410044
ae	6165	00410045
af	6166	00410046
e	65	0045
o	6F	004F
ö	C3B6	004F
od	6F64	004F0044
oe	6F65	004F0045
of	6F66	004F0046
s	73	0053
ß	C39F	0053
ss	7373	00530053
u	75	0055
ü	C3BC	0055
ud	7564	00550044
ue	7565	00550045
uf	7566	00550046
Æ	C386	00C6
æ	C3A6	00C6
Œ	C592	0152
œ	C593	0152
SELECT s1, hex(s1) FROM t1 WHERE s1='ae' ORDER BY s1, BINARY(s1);
s1	hex(s1)
ae	6165
drop table t1;
"END ctype_german.inc"
SET collation_connection='utf8mb4_bin';
create table t1 select repeat('a',4000) a;
delete from t1;
insert into t1 values ('a'), ('a '), ('a\t');
select collation(a),hex(a) from t1 order by a;
collation(a)	hex(a)
utf8mb4_bin	6109
utf8mb4_bin	61
utf8mb4_bin	6120
drop table t1;
#
# Bug#55980 Character sets: supplementary character _bin ordering is wrong
#
CREATE TABLE t1 AS SELECT REPEAT('a',1) AS a LIMIT 0;
SHOW CREATE TABLE t1;
Table	Create Table
t1	CREATE TABLE `t1` (
  `a` varchar(512) CHARACTER SET utf8mb4 COLLATE utf8mb4_bin DEFAULT NULL
) ORGANIZATION INDEX DEFAULT CHARSET = utf8mb4 ROW_FORMAT = DYNAMIC COMPRESSION = 'zstd_1.3.8' REPLICA_NUM = replica_num BLOCK_SIZE = 16384 USE_BLOOM_FILTER = FALSE TABLET_SIZE = 134217728 PCTFREE = 0
INSERT INTO t1 VALUES (_utf8mb4 0xEFBE9D),(_utf8mb4 0xF0908E84);
INSERT INTO t1 VALUES (_utf8mb4 0xCE85),(_utf8mb4 0xF4808080);
SELECT HEX(a), HEX(CONVERT(a USING utf8mb4)) FROM t1 ORDER BY a;
HEX(a)	HEX(CONVERT(a USING utf8mb4))
CE85	CE85
EFBE9D	EFBE9D
F0908E84	F0908E84
F4808080	F4808080
ALTER TABLE t1 ADD KEY(a);
SELECT HEX(a), HEX(CONVERT(a USING utf8mb4)) FROM t1 ORDER BY a;
HEX(a)	HEX(CONVERT(a USING utf8mb4))
CE85	CE85
EFBE9D	EFBE9D
F0908E84	F0908E84
F4808080	F4808080
# Additional test for bug#37244 Character sets: short utf8_bin weight_string value
SELECT HEX(a), HEX(WEIGHT_STRING(a)) FROM t1 ORDER BY a;
HEX(a)	HEX(WEIGHT_STRING(a))
CE85	000385
EFBE9D	00FF9D
F0908E84	010384
F4808080	100000
DROP TABLE IF EXISTS t1;
#
# BUG#16691598 - ORDER BY LOWER(COLUMN) PRODUCES 
#                OUT-OF-ORDER RESULTS
#
CREATE TABLE  t1 SELECT ('a a') as n;
INSERT INTO t1 VALUES('a b');
SELECT * FROM t1 ORDER BY LOWER(n) ASC;
n
a a
a b
SELECT * FROM t1 ORDER BY LOWER(n) DESC;
n
a b
a a
DROP TABLE t1;
select @@collation_connection;
@@collation_connection
utf8mb4_bin
create table t1 ROW_FORMAT=DYNAMIC select repeat('a',50) as c1 ;
insert into t1 values('abcdef');
insert into t1 values('_bcdef');
insert into t1 values('a_cdef');
insert into t1 values('ab_def');
insert into t1 values('abc_ef');
insert into t1 values('abcd_f');
insert into t1 values('abcde_');
select c1 as c1u from t1 where c1 like 'ab\_def';
c1u
ab_def
select c1 as c2h from t1 where c1 like 'ab#_def' escape '#';
c2h
ab_def
drop table t1;
CREATE TABLE t1 (
user varchar(255) NOT NULL default ''
) DEFAULT CHARSET=latin1;
INSERT INTO t1 VALUES ('one'),('two');
SELECT CHARSET('a');
CHARSET('a')
utf8mb4
SELECT user, CONCAT('<', user, '>') AS c FROM t1;
user	c
one	<one>
two	<two>
DROP TABLE t1;
create table t1 (f1 varchar(1) not null) default charset utf8mb4;
insert into t1 values (''), ('');
select concat(concat(_latin1'->',f1),_latin1'<-') from t1;
concat(concat(_latin1'->',f1),_latin1'<-')
-><-
-><-
drop table t1;
set names latin1;
create table t1 (a varchar(10)) character set utf8mb4;
insert into t1 values ('test');
select ifnull(a,'') from t1;
ifnull(a,'')
test
drop table t1;
select repeat(_utf8mb4'+',3) as h union select NULL;
h
NULL
+++
select ifnull(NULL, _utf8mb4'string');
ifnull(NULL, _utf8mb4'string')
string
set names utf8mb4;
create table t1 (s1 char(5) character set utf8mb4 collate utf8mb4_lithuanian_ci);
drop table t1;
create table t1 (s1 char(5) character set utf8mb4);
insert into t1 values ('I'),('K'),('Y');
select * from t1 where s1 < 'K' and s1 = 'Y';
s1
select * from t1 where 'K' > s1 and s1 = 'Y';
s1
drop table t1;
create table t1 (s1 char(5) character set utf8mb4 collate utf8mb4_czech_ci);
insert into t1 values ('c'),('d'),('h'),('ch'),('CH'),('cH'),('Ch'),('i');
select * from t1 where s1 > 'd' and s1 = 'CH';
s1
ch
CH
Ch
select * from t1 where 'd' < s1 and s1 = 'CH';
s1
ch
CH
Ch
select * from t1 where s1 = 'cH' and s1 <> 'ch';
s1
cH
select * from t1 where 'cH' = s1 and s1 <> 'ch';
s1
cH
drop table t1;
create table t1 (a varchar(255)) default character set utf8mb4;
insert into t1 values (1.0);
drop table t1;
create table t1 (
id int not null,
city varchar(20) not null,
key (city(7),id)
) character set=utf8mb4;
insert into t1 values (1,'Durban North');
insert into t1 values (2,'Durban');
select * from t1 where city = 'Durban';
id	city
2	Durban
select * from t1 where city = 'Durban ';
id	city
2	Durban
drop table t1;
create table t1 (x set('A', 'B') default 0) character set utf8mb4;
ERROR 42000: Invalid default value for 'x'
create table t1 (x enum('A', 'B') default 0) character set utf8mb4;
ERROR 42000: Invalid default value for 'x'
SET NAMES UTF8;
SET sql_mode = 'NO_ENGINE_SUBSTITUTION';
CREATE TABLE t1 (
`id` int(20) NOT NULL auto_increment,
`country` varchar(100) NOT NULL default '',
`shortcode` varchar(100) NOT NULL default '',
`operator` varchar(100) NOT NULL default '',
`momid` varchar(30) NOT NULL default '',
`keyword` varchar(160) NOT NULL default '',
`content` varchar(160) NOT NULL default '',
`second_token` varchar(160) default NULL,
`gateway_id` int(11) NOT NULL default '0',
`created` datetime NOT NULL default '0000-00-00 00:00:00',
`msisdn` varchar(15) NOT NULL default '',
PRIMARY KEY  (`id`),
UNIQUE KEY `MSCCSPK_20030521130957121` (`momid`),
KEY `IX_mobile_originated_message_keyword` (`keyword`),
KEY `IX_mobile_originated_message_created` (`created`),
KEY `IX_mobile_originated_message_support` (`msisdn`,`momid`,`keyword`,`gateway_id`,`created`)
) DEFAULT CHARSET=utf8mb4;
INSERT INTO t1 VALUES 
(1,'blah','464','aaa','fkc1c9ilc20x0hgae7lx6j09','ERR','ERR 袠屑褉懈.袗褎懈屑懈屑.袗械懈屑懈屑褉懈屑写屑褉懈屑褉屑褉懈褉芯褉 懈屑褉懈屑褉懈屑褉懈屑褉 懈屑褉懈写屑 懈褉斜写薪褉懈屑褉褎屑褉懈褉懈褉懈屑褉褎屑褎屑懈屑.袗写.袛 懈屑写懈屑褉懈屑褉邪写.袗写懈屑褉懈屑褉懈屑褉屑写懈褉懈屑褉懈屑褉懈屑褉 屑.袛邪写懈屑褎褕褜屑褉懈屑写 懈屑.袗写懈屑懈屑褉薪 懈屑邪写屑懈','袠袦袪袠.袗肖袠袦袠袦.袗袝袠袦袠袦袪袠袦袛袦袪袠袦袪袦袪袠袪袨袪',3,'2005-06-01 17:30:43','1234567890'),
(2,'blah','464','aaa','haxpl2ilc20x00bj4tt2m5ti','11','11 g','G',3,'2005-06-02 22:43:10','1234567890');
CREATE TABLE t2 (
`msisdn` varchar(15) NOT NULL default '',
`operator_id` int(11) NOT NULL default '0',
`created` datetime NOT NULL default '0000-00-00 00:00:00',
UNIQUE KEY `PK_user` (`msisdn`)
) ENGINE=InnoDB DEFAULT CHARSET=utf8mb4;
INSERT INTO t2 VALUES ('1234567890',2,'2005-05-24 13:53:25');
SELECT content, t2.msisdn FROM t1, t2 WHERE t1.msisdn = '1234567890';
content	msisdn
11 g	1234567890
ERR 袠屑褉懈.袗褎懈屑懈屑.袗械懈屑懈屑褉懈屑写屑褉懈屑褉屑褉懈褉芯褉 懈屑褉懈屑褉懈屑褉懈屑褉 懈屑褉懈写屑 懈褉斜写薪褉懈屑褉褎屑褉懈褉懈褉懈屑褉褎屑褎屑懈屑.袗写.袛 懈屑写懈屑褉懈屑褉邪写.袗写懈屑褉懈屑褉懈屑褉屑写懈褉懈屑褉懈屑褉懈屑褉 屑.袛邪写懈屑褎褕褜屑褉懈屑写 懈屑.袗写懈屑懈屑褉薪 懈屑邪写屑懈	1234567890
DROP TABLE t1,t2;
create table t1 (a char(20) character set utf8mb4);
insert into t1 values ('123456'),('邪薪写褉械泄');
alter table t1 modify a char(2) character set utf8mb4;
select char_length(a), length(a), a from t1 order by a;
char_length(a)	length(a)	a
2	2	12
2	6	邪薪
drop table t1;
SET sql_mode = default;
set names utf8mb4;
select 'andre%' like 'andre帽%' escape '帽';
'andre%' like 'andre帽%' escape '帽'
1
set names utf8mb4;
select 'a\\' like 'a\\';
'a\\' like 'a\\'
1
select 'aa\\' like 'a%\\';
'aa\\' like 'a%\\'
1
create table t1 (a char(10), key(a)) character set utf8mb4;
insert into t1 values ("a"),("abc"),("abcd"),("hello"),("test");
select * from t1 where a like "abc%";
a
abc
abcd
select * from t1 where a like concat("abc","%");
a
abc
abcd
select * from t1 where a like "ABC%";
a
abc
abcd
select * from t1 where a like "test%";
a
test
select * from t1 where a like "te_t";
a
test
select * from t1 where a like "%a%";
a
a
abc
abcd
select * from t1 where a like "%abcd%";
a
abcd
select * from t1 where a like "%abc\d%";
a
abcd
drop table t1;
SET sql_mode = 'NO_ENGINE_SUBSTITUTION';
CREATE TABLE t1 (
a varchar(255) NOT NULL default '',
KEY a (a)
) DEFAULT CHARSET=utf8mb4 COLLATE utf8mb4_general_ci;
insert into t1 values (_utf8mb4 0xe880bd);
insert into t1 values (_utf8mb4 0x5b);
select hex(a) from t1;
hex(a)
5B
E880BD
drop table t1;
SET sql_mode = default;
set names 'latin1';
create table t1 (a varchar(255)) default charset=utf8mb4;
select * from t1 where find_in_set('-1', a);
a
drop table t1;
create table t1 (a int);
insert into t1 values (48),(49),(50);
set names utf8mb4;
select distinct char(a) from t1;
char(a)
0
1
2
drop table t1;
CREATE TABLE t1 (t TINYTEXT CHARACTER SET utf8mb4);
INSERT INTO t1 VALUES(REPEAT('a', 100));
CREATE TEMPORARY TABLE t2 SELECT COALESCE(t) AS bug FROM t1;
ERROR 0A000: MySQL compatible temporary table not supported
CREATE TABLE t2 SELECT COALESCE(t) AS bug FROM t1;
SELECT LENGTH(bug) FROM t2;
LENGTH(bug)
100
DROP TABLE t2;
DROP TABLE t1;
CREATE TABLE t1 (item varchar(255)) default character set utf8mb4;
INSERT INTO t1 VALUES (N'\\');
INSERT INTO t1 VALUES (_utf8mb4'\\');
INSERT INTO t1 VALUES (N'Cote d\'Ivoire');
INSERT INTO t1 VALUES (_utf8mb4'Cote d\'Ivoire');
SELECT item FROM t1 ORDER BY item;
item
Cote d'Ivoire
Cote d'Ivoire
\
\
DROP TABLE t1;
SET sql_mode = 'NO_ENGINE_SUBSTITUTION';
SET NAMES utf8mb4;
DROP TABLE IF EXISTS t1;
Warnings:
Note	1051	Unknown table 'test.t1'
CREATE TABLE t1(a VARCHAR(255), KEY(a)) DEFAULT CHARSET=utf8mb4;
INSERT INTO t1 VALUES('uuABCDEFGHIGKLMNOPRSTUVWXYZ虉bbbbbbbbbbbbbbbbbbbbbbbbbbbbbbbbbbbbbbbbbbbbbbbbbbbbbbbbbbbbbbbbbbbbbbbbbbbbbbbbbbbbbbbbbbbbbbbbbbbbbbbbbbbbbbbbbbbbbbbbbbbbbbbbbbbbbbbbbbbbbbbbbbbbbbbbbbbbbbbbbbbbbbbbbbbbbbbbbbbbbbbbbbbbbbbbbbbbbbbbbbbbbbbbbbbbbbbbbbbbbbbbbbb');
INSERT INTO t1 VALUES('uu');
INSERT INTO t1 VALUES('uU');
INSERT INTO t1 VALUES('uu');
INSERT INTO t1 VALUES('uuABC');
INSERT INTO t1 VALUES('UuABC');
INSERT INTO t1 VALUES('uuABC');
alter table t1 add b int;
INSERT INTO t1 VALUES('uuABCDEFGHIGKLMNOPRSTUVWXYZ虉bbbbbbbbbbbbbbbbbbbbbbbbbbbbbbbbbbbbbbbbbbbbbbbbbbbbbbbbbbbbbbbbbbbbbbbbbbbbbbbbbbbbbbbbbbbbbbbbbbbbbbbbbbbbbbbbbbbbbbbbbbbbbbbbbbbbbbbbbbbbbbbbbbbbbbbbbbbbbbbbbbbbbbbbbbbbbbbbbbbbbbbbbbbbbbbbbbbbbbbbbbbbbbbbbbbbbbbbbbbbbbbbbbb',1);
INSERT INTO t1 VALUES('uuABCDEFGHIGKLMNOPRSTUVWXYZ虉bbbbbbbbbbbbbbbbbbbbbbbbbbbbbbbbbbbbbbbbbbbbbbbbbbbbbbbbbbbbbbbbbbbbbbbbbbbbbbbbbbbbbbbbbbbbbbbbbbbbbbbbbbbbbbbbbbbbbbbbbbbbbbbbbbbbbbbbbbbbbbbbbbbbbbbbbbbbbbbbbbbbbbbbbbbbbbbbbbbbbbbbbbbbbbbbbbbbbbbbbbbbbbbbbbbbbbbbbbbbbbbbbbb',2);
delete from t1 where b=1;
INSERT INTO t1 VALUES('UUABCDEFGHIGKLMNOPRSTUVWXYZ虉bbbbbbbbbbbbbbbbbbbbbbbbbbbbbbbbbbbbbbbbbbbbbbbbbbbbbbbbbbbbbbbbbbbbbbbbbbbbbbbbbbbbbbbbbbbbbbbbbbbbbbbbbbbbbbbbbbbbbbbbbbbbbbbbbbbbbbbbbbbbbbbbbbbbbbbbbbbbbbbbbbbbbbbbbbbbbbbbbbbbbbbbbbbbbbbbbbbbbbbbbbbbbbbbbbbbbbbbbbbbbbbbbbb',1);
INSERT INTO t1 VALUES('uuABCDEFGHIGKLMNOPRSTUVWXYZ虉bbbbbbbbbbbbbbbbbbbbbbbbbbbbbbbbbbbbbbbbbbbbbbbbbbbbbbbbbbbbbbbbbbbbbbbbbbbbbbbbbbbbbbbbbbbbbbbbbbbbbbbbbbbbbbbbbbbbbbbbbbbbbbbbbbbbbbbbbbbbbbbbbbbbbbbbbbbbbbbbbbbbbbbbbbbbbbbbbbbbbbbbbbbbbbbbbbbbbbbbbbbbbbbbbbbbbbbbbbbbbbbbbbb',3);
INSERT INTO t1 VALUES('uuABCDEFGHIGKLMNOPRSTUVWXYZ虉bbbbbbbbbbbbbbbbbbbbbbbbbbbbbbbbbbbbbbbbbbbbbbbbbbbbbbbbbbbbbbbbbbbbbbbbbbbbbbbbbbbbbbbbbbbbbbbbbbbbbbbbbbbbbbbbbbbbbbbbbbbbbbbbbbbbbbbbbbbbbbbbbbbbbbbbbbbbbbbbbbbbbbbbbbbbbbbbbbbbbbbbbbbbbbbbbbbbbbbbbbbbbbbbbbbbbbbbbbbbbbbbbbb',4);
delete from t1 where b=3;
INSERT INTO t1 VALUES('uUABCDEFGHIGKLMNOPRSTUVWXYZ虉bbbbbbbbbbbbbbbbbbbbbbbbbbbbbbbbbbbbbbbbbbbbbbbbbbbbbbbbbbbbbbbbbbbbbbbbbbbbbbbbbbbbbbbbbbbbbbbbbbbbbbbbbbbbbbbbbbbbbbbbbbbbbbbbbbbbbbbbbbbbbbbbbbbbbbbbbbbbbbbbbbbbbbbbbbbbbbbbbbbbbbbbbbbbbbbbbbbbbbbbbbbbbbbbbbbbbbbbbbbbbbbbbbb',3);
drop table t1;
SET sql_mode = default;
set names utf8mb4;
create table t1 (s1 char(5) character set utf8mb4);
insert into t1 values
('a'),('b'),(null),('銉'),('眉'),('Y');
create index it1 on t1 (s1);
select s1 as before_delete_general_ci from t1 where s1 like '銉氥儐%';
before_delete_general_ci
delete from t1 where s1 = 'Y';
select s1 as after_delete_general_ci from t1 where s1 like '銉氥儐%';
after_delete_general_ci
drop table t1;
set names utf8mb4;
create table t1 (s1 char(5) character set utf8mb4 collate utf8mb4_unicode_ci);
insert into t1 values
('a'),('b'),(null),('銉'),('眉'),('Y');
create index it1 on t1 (s1);
select s1 as before_delete_unicode_ci from t1 where s1 like '銉氥儐%';
before_delete_unicode_ci
delete from t1 where s1 = 'Y';
select s1 as after_delete_unicode_ci from t1 where s1 like '銉氥儐%';
after_delete_unicode_ci
drop table t1;
set names utf8mb4;
create table t1 (s1 char(5) character set utf8mb4 collate utf8mb4_bin);
insert into t1 values
('a'),('b'),(null),('銉'),('眉'),('Y');
create index it1 on t1 (s1);
select s1 as before_delete_bin from t1 where s1 like '銉氥儐%';
before_delete_bin
delete from t1 where s1 = 'Y';
select s1 as after_delete_bin from t1 where s1 like '銉氥儐%';
after_delete_bin
drop table t1;
SET NAMES utf8mb4;
CREATE TABLE t1 (id int PRIMARY KEY,
a varchar(16) collate utf8mb4_unicode_ci NOT NULL default '',
b int,
f varchar(128) default 'XXX',
INDEX (a(4))
) DEFAULT CHARSET=utf8mb4 COLLATE=utf8mb4_unicode_ci;
INSERT INTO t1(id, a, b) VALUES
(1, 'cccc', 50), (2, 'cccc', 70), (3, 'cccc', 30),
(4, 'cccc', 30), (5, 'cccc', 20), (6, 'bbbbbb', 40),
(7, 'dddd', 30), (8, 'aaaa', 10), (9, 'aaaa', 50),
(10, 'eeeee', 40), (11, 'bbbbbb', 60);
SELECT id, a, b FROM t1;
id	a	b
1	cccc	50
10	eeeee	40
11	bbbbbb	60
2	cccc	70
3	cccc	30
4	cccc	30
5	cccc	20
6	bbbbbb	40
7	dddd	30
8	aaaa	10
9	aaaa	50
SELECT id, a, b FROM t1 WHERE a BETWEEN 'aaaa' AND 'bbbbbb';
id	a	b
11	bbbbbb	60
6	bbbbbb	40
8	aaaa	10
9	aaaa	50
SELECT id, a FROM t1 WHERE a='bbbbbb';
id	a
6	bbbbbb
11	bbbbbb
SELECT id, a FROM t1 WHERE a='bbbbbb' ORDER BY b;
id	a
6	bbbbbb
11	bbbbbb
DROP TABLE t1;
SET NAMES utf8mb4;
CREATE TABLE t1 (
a CHAR(13) DEFAULT '',
INDEX(a)
) DEFAULT CHARSET=utf8mb4 COLLATE=utf8mb4_general_ci;
INSERT INTO t1 VALUES 
('K盲li K盲li 2-4'), ('K盲li K盲li 2-4'),
('K盲li K盲li 2+4'), ('K盲li K盲li 2+4'),
('K盲li K盲li 2-6'), ('K盲li K盲li 2-6');
INSERT INTO t1 SELECT * FROM t1;
CREATE TABLE t2 (
a CHAR(13) DEFAULT '',
INDEX(a)
) DEFAULT CHARSET=latin1 COLLATE=latin1_general_ci;
drop table t2;
CREATE TABLE t2 (
a CHAR(13) DEFAULT '',
INDEX(a)
) DEFAULT CHARSET=latin1;
INSERT INTO t2 VALUES
('Kali Kali 2-4'), ('Kali Kali 2-4'),
('Kali Kali 2+4'), ('Kali Kali 2+4'),
('Kali Kali 2-6'), ('Kali Kali 2-6');
INSERT INTO t2 SELECT * FROM t2;
SELECT a FROM t1 WHERE a LIKE 'K盲li K盲li 2+4';
a
K盲li K盲li 2+4
K盲li K盲li 2+4
K盲li K盲li 2+4
K盲li K盲li 2+4
SELECT a FROM t2 WHERE a LIKE 'Kali Kali 2+4';
a
Kali Kali 2+4
Kali Kali 2+4
Kali Kali 2+4
Kali Kali 2+4
DROP TABLE t1,t2;
CREATE TABLE t1 (
a char(255) DEFAULT '', 
KEY(a(10))
) DEFAULT CHARSET=utf8mb4 COLLATE=utf8mb4_general_ci;
INSERT INTO t1 VALUES ('K盲li K盲li 2-4');
SELECT * FROM t1 WHERE a LIKE 'K盲li K盲li 2%';
a
K盲li K盲li 2-4
INSERT INTO t1 VALUES ('K盲li K盲li 2-4');
SELECT * FROM t1 WHERE a LIKE 'K盲li K盲li 2%';
a
K盲li K盲li 2-4
K盲li K盲li 2-4
DROP TABLE t1;
CREATE TABLE t1 (
a char(255) DEFAULT ''
) DEFAULT CHARSET=utf8mb4 COLLATE=utf8mb4_general_ci;
INSERT INTO t1 VALUES ('K盲li K盲li 2-4');
INSERT INTO t1 VALUES ('K盲li K盲li 2-4');
SELECT * FROM t1 WHERE a LIKE 'K盲li K盲li 2%';
a
K盲li K盲li 2-4
K盲li K盲li 2-4
ALTER TABLE t1 ADD KEY (a(10));
SELECT * FROM t1 WHERE a LIKE 'K盲li K盲li 2%';
a
K盲li K盲li 2-4
K盲li K盲li 2-4
DROP TABLE t1;
SET NAMES latin2;
ERROR 42000: Unknown character set: 'latin2'
CREATE TABLE t1 (
id int(11) NOT NULL default '0',
tid int(11) NOT NULL default '0',
val text NOT NULL,
INDEX idx(tid, val(10))
) DEFAULT CHARSET=utf8mb4;
DROP TABLE t1;
create table t1(a char(200) collate utf8mb4_unicode_ci NOT NULL default '')
default charset=utf8mb4 collate=utf8mb4_unicode_ci;
insert into t1 values (unhex('65')), (unhex('C3A9')), (unhex('65'));
select distinct a from t1;
a
e
select a from t1 group by a;
a
e
drop table t1;
create table t1(a char(10)) default charset utf8mb4;
insert into t1 values ('123'), ('456');
select substr(z.a,-1), z.a from t1 as y join t1 as z on y.a=z.a order by 1;
substr(z.a,-1)	a
3	123
6	456
drop table t1;
SET CHARACTER SET utf8mb4;
CREATE DATABASE crashtest DEFAULT CHARACTER SET utf8mb4 COLLATE utf8mb4_bin;
USE crashtest;
CREATE TABLE crashtest (crash char(10)) DEFAULT CHARSET=utf8mb4;
INSERT INTO crashtest VALUES ('35'), ('36'), ('37');
SELECT * FROM crashtest ORDER BY CHAR(crash USING utf8mb4);
crash
35
36
37
INSERT INTO crashtest VALUES ('-1000');
SELECT * FROM crashtest ORDER BY CHAR(crash USING utf8mb4);
crash
-1000
35
36
37
Warnings:
Warning	1300	Invalid utf8mb4 character string: 'FFFFFC'
DROP TABLE crashtest;
DROP DATABASE crashtest;
USE test;
SET CHARACTER SET default;
CREATE TABLE t1(id varchar(20) NOT NULL) DEFAULT CHARSET=utf8mb4;
INSERT INTO t1 VALUES ('xxx'), ('aa'), ('yyy'), ('aa');
SELECT id FROM t1;
id
xxx
aa
yyy
aa
SELECT DISTINCT id FROM t1;
id
aa
xxx
yyy
SELECT DISTINCT id FROM t1 ORDER BY id;
id
aa
xxx
yyy
DROP TABLE t1;
SET sql_mode = 'NO_ENGINE_SUBSTITUTION';
create table t1 (
a varchar(26) not null
) default character set utf8mb4;
insert into t1 (a) values ('abcdefghijklmnopqrstuvwxyz');
select * from t1;
a
abcdefghijklmnopqrstuvwxyz
alter table t1 change a a varchar(20) character set utf8mb4 not null;
select * from t1;
a
abcdefghijklmnopqrst
alter table t1 change a a char(15) character set utf8mb4 not null;
select * from t1;
a
abcdefghijklmno
alter table t1 change a a char(10) character set utf8mb4 not null;
select * from t1;
a
abcdefghij
alter table t1 change a a varchar(5) character set utf8mb4 not null;
select * from t1;
a
abcde
drop table t1;
create table t1 (
a varchar(4000) not null
) default character set utf8mb4;
insert into t1 values (repeat('a',4000));
alter table t1 change a a varchar(3000) character set utf8mb4 not null;
select length(a) from t1;
length(a)
3000
drop table t1;
SET sql_mode = default;
set names utf8mb4;
select hex(char(1 using utf8mb4));
hex(char(1 using utf8mb4))
01
select char(0xd1,0x8f using utf8mb4);
char(0xd1,0x8f using utf8mb4)
я
select char(0xd18f using utf8mb4);
char(0xd18f using utf8mb4)
я
select char(53647 using utf8mb4);
char(53647 using utf8mb4)
я
select char(0xff,0x8f using utf8mb4);
char(0xff,0x8f using utf8mb4)
NULL
Warnings:
Warning	1300	Invalid utf8mb4 character string: 'FF8F'
select convert(char(0xff,0x8f) using utf8mb4);
convert(char(0xff,0x8f) using utf8mb4)
NULL
Warnings:
Warning	1300	Invalid utf8mb4 character string: 'FF8F'
set sql_mode=traditional;
select char(0xff,0x8f using utf8mb4);
char(0xff,0x8f using utf8mb4)
NULL
Warnings:
Warning	1300	Invalid utf8mb4 character string: 'FF8F'
select char(195 using utf8mb4);
char(195 using utf8mb4)
NULL
Warnings:
Warning	1300	Invalid utf8mb4 character string: 'C3'
select char(196 using utf8mb4);
char(196 using utf8mb4)
NULL
Warnings:
Warning	1300	Invalid utf8mb4 character string: 'C4'
select char(2557 using utf8mb4);
char(2557 using utf8mb4)
NULL
Warnings:
Warning	1300	Invalid utf8mb4 character string: 'FD'
select convert(char(0xff,0x8f) using utf8mb4);
convert(char(0xff,0x8f) using utf8mb4)
NULL
Warnings:
Warning	1300	Invalid utf8mb4 character string: 'FF8F'
select hex(convert(char(2557 using latin1) using utf8mb4));
hex(convert(char(2557 using latin1) using utf8mb4))

select hex(char(195));
hex(char(195))
C3
select hex(char(196));
hex(char(196))
C4
select hex(char(2557));
hex(char(2557))
09FD
set names utf8mb4;
create table t1 (a char(1)) default character set utf8mb4;
create table t2 (a char(1)) default character set utf8mb4;
insert into t1 values('a'),('a'),(0xE38182),(0xE38182);
insert into t1 values('i'),('i'),(0xE38184),(0xE38184);
select * from t1 union distinct select * from t2;
a
a
あ
i
い
drop table t1,t2;
set names utf8mb4;
create table t1 (a char(10), b varchar(10));
insert into t1 values ('bar','kostja');
insert into t1 values ('kostja','bar');
prepare my_stmt from "select * from t1 where a=?";
set @a:='bar';
execute my_stmt using @a;
a	b
bar	kostja
set @a:='kostja';
execute my_stmt using @a;
a	b
kostja	bar
set @a:=null;
execute my_stmt using @a;
a	b
drop table if exists t1;
drop table if exists t1;
drop view if exists v1, v2;
set names utf8mb4;
create table t1(col1 varchar(12) character set utf8mb4 collate utf8mb4_unicode_ci);
insert into t1 values('t1_val');
create view v1 as select 'v1_val' as col1;
select coercibility(col1), collation(col1) from v1;
coercibility(col1)	collation(col1)
4	utf8mb4_general_ci
create view v2 as select col1 from v1 union select col1 from t1;
select coercibility(col1), collation(col1)from v2;
coercibility(col1)	collation(col1)
2	utf8mb4_unicode_ci
2	utf8mb4_unicode_ci
drop view v1, v2;
create view v1 as select 'v1_val' collate utf8mb4_swedish_ci as col1;
drop view v1;
create view v1 as select 'v1_val' as col1;
select coercibility(col1), collation(col1) from v1;
coercibility(col1)	collation(col1)
4	utf8mb4_general_ci
create view v2 as select col1 from v1 union select col1 from t1;
select coercibility(col1), collation(col1) from v2;
coercibility(col1)	collation(col1)
2	utf8mb4_unicode_ci
2	utf8mb4_unicode_ci
drop view v1, v2;
drop table t1;
set names utf8mb4;
create table t1 (a varchar(10) character set latin1, b int);
insert into t1 values ('a',1);
select concat(a, if(b>10, N'x', N'y')) from t1;
concat(a, if(b>10, N'x', N'y'))
ay
select concat(a, if(b>10, N'忙', N'脽')) from t1;
concat(a, if(b>10, N'忙', N'脽'))
a?
drop table t1;
set names utf8mb4;
create table t1 (a varchar(10) character set latin1, b int);
insert into t1 values ('a',1);
select concat(a, if(b>10, _utf8mb4'x', _utf8mb4'y')) from t1;
concat(a, if(b>10, _utf8mb4'x', _utf8mb4'y'))
ay
select concat(a, if(b>10, _utf8mb4'忙', _utf8mb4'脽')) from t1;
concat(a, if(b>10, _utf8mb4'忙', _utf8mb4'脽'))
a?
drop table t1;
set names utf8mb4;
create table t1 (a varchar(10) character set latin1, b int);
insert into t1 values ('a',1);
select concat(a, if(b>10, _utf8mb4 0x78, _utf8mb4 0x79)) from t1;
concat(a, if(b>10, _utf8mb4 0x78, _utf8mb4 0x79))
ay
select concat(a, if(b>10, _utf8mb4 0xC3A6, _utf8mb4 0xC3AF)) from t1;
concat(a, if(b>10, _utf8mb4 0xC3A6, _utf8mb4 0xC3AF))
aï
drop table t1;
set names utf8mb4;
create table t1 (a varchar(10) character set latin1, b int);
insert into t1 values ('a',1);
select concat(a, if(b>10, 'x' 'x', 'y' 'y')) from t1;
concat(a, if(b>10, 'x' 'x', 'y' 'y'))
ayy
select concat(a, if(b>10, 'x' '忙', 'y' '脽')) from t1;
concat(a, if(b>10, 'x' '忙', 'y' '脽'))
ay?
drop table t1;
SELECT '薪1234567890' UNION SELECT _binary '1';
薪1234567890
薪1234567890
1
SELECT '薪1234567890' UNION SELECT 1;
薪1234567890
薪1234567890
1
SELECT '1' UNION SELECT '薪1234567890';
1
1
薪1234567890
SELECT 1 UNION SELECT '薪1234567890';
1
1
薪1234567890
CREATE TABLE t1 (c VARCHAR(11)) CHARACTER SET utf8mb4;
CREATE TABLE t2 (b CHAR(1) CHARACTER SET binary, i INT);
INSERT INTO t1 (c) VALUES ('薪1234567890');
INSERT INTO t2 (b, i) VALUES ('1', 1);
SELECT c FROM t1 UNION SELECT b FROM t2;
c
薪1234567890
1
SELECT c FROM t1 UNION SELECT i FROM t2;
c
薪1234567890
1
SELECT b FROM t2 UNION SELECT c FROM t1;
b
1
薪1234567890
SELECT i FROM t2 UNION SELECT c FROM t1;
i
1
薪1234567890
DROP TABLE t1, t2;
set sql_mode=traditional;
select hex(char(0xFF using utf8mb4));
hex(char(0xFF using utf8mb4))
NULL
Warnings:
Warning	1300	Invalid utf8mb4 character string: 'FF'
select hex(convert(0xFF using utf8mb4));
hex(convert(0xFF using utf8mb4))
NULL
Warnings:
Warning	1300	Invalid utf8mb4 character string: 'FF'
select hex(_utf8mb4 0x616263FF);
ERROR HY000: Invalid utf8mb4 character string: 'FF'
select hex(_utf8mb4 X'616263FF');
ERROR HY000: Invalid utf8mb4 character string: 'FF'
select hex(_utf8mb4 B'001111111111');
ERROR HY000: Invalid utf8mb4 character string: 'FF'
select (_utf8mb4 X'616263FF');
ERROR HY000: Invalid utf8mb4 character string: 'FF'
set sql_mode=default;
select hex(char(0xFF using utf8mb4));
hex(char(0xFF using utf8mb4))
NULL
Warnings:
Warning	1300	Invalid utf8mb4 character string: 'FF'
select hex(convert(0xFF using utf8mb4));
hex(convert(0xFF using utf8mb4))
NULL
Warnings:
Warning	1300	Invalid utf8mb4 character string: 'FF'
select hex(_utf8mb4 0x616263FF);
ERROR HY000: Invalid utf8mb4 character string: 'FF'
select hex(_utf8mb4 X'616263FF');
ERROR HY000: Invalid utf8mb4 character string: 'FF'
select hex(_utf8mb4 B'001111111111');
ERROR HY000: Invalid utf8mb4 character string: 'FF'
select (_utf8mb4 X'616263FF');
ERROR HY000: Invalid utf8mb4 character string: 'FF'
CREATE TABLE t1 (a INT NOT NULL, b INT NOT NULL);
INSERT INTO t1 VALUES (70000, 1092), (70001, 1085), (70002, 1065);
SELECT CONVERT(a, CHAR), CONVERT(b, CHAR) FROM t1 GROUP BY b;
CONVERT(a, CHAR)	CONVERT(b, CHAR)
70000	1092
70001	1085
70002	1065
SELECT CONVERT(a, CHAR), CONVERT(b, CHAR) FROM t1;
CONVERT(a, CHAR)	CONVERT(b, CHAR)
70000	1092
70001	1085
70002	1065
ALTER TABLE t1 ADD UNIQUE (b);
SELECT CONVERT(a, CHAR), CONVERT(b, CHAR) FROM t1 GROUP BY b;
CONVERT(a, CHAR)	CONVERT(b, CHAR)
70000	1092
70001	1085
70002	1065
DROP INDEX b ON t1;
SELECT CONVERT(a, CHAR), CONVERT(b, CHAR) FROM t1 GROUP BY b;
CONVERT(a, CHAR)	CONVERT(b, CHAR)
70000	1092
70001	1085
70002	1065
ALTER TABLE t1 ADD INDEX (b);
SELECT CONVERT(a, CHAR), CONVERT(b, CHAR) from t1 GROUP BY b;
CONVERT(a, CHAR)	CONVERT(b, CHAR)
70000	1092
70001	1085
70002	1065
DROP TABLE t1;
#
# Bug#26474: Add Sinhala script (Sri Lanka) collation to MySQL
#
DROP TABLE IF EXISTS t1;
CREATE TABLE t1 (
predicted_order int NOT NULL,
utf8mb4_encoding VARCHAR(10) NOT NULL
) CHARACTER SET utf8mb4;
INSERT INTO t1 VALUES (19, x'E0B696'), (30, x'E0B69AE0B798'), (61, x'E0B6AF'), (93, x'E0B799'), (52, x'E0B6A6'), (73, x'E0B6BBE0B78AE2808D'), (3, x'E0B686'), (56, x'E0B6AA'), (55, x'E0B6A9'), (70, x'E0B6B9'), (94, x'E0B79A'), (80, x'E0B785'), (25, x'E0B69AE0B791'), (48, x'E0B6A2'), (13, x'E0B690'), (86, x'E0B793'), (91, x'E0B79F'), (81, x'E0B786'), (79, x'E0B784'), (14, x'E0B691'), (99, x'E0B78A'), (8, x'E0B68B'), (68, x'E0B6B7'), (22, x'E0B69A'), (16, x'E0B693'), (33, x'E0B69AE0B7B3'), (38, x'E0B69AE0B79D'), (21, x'E0B683'), (11, x'E0B68E'), (77, x'E0B782'), (40, x'E0B69AE0B78A'), (101, x'E0B78AE2808DE0B6BB'), (35, x'E0B69AE0B79A'), (1, x'E0B7B4'), (9, x'E0B68C'), (96, x'E0B79C'), (6, x'E0B689'), (95, x'E0B79B'), (88, x'E0B796'), (64, x'E0B6B3'), (26, x'E0B69AE0B792'), (82, x'E0B78F'), (28, x'E0B69AE0B794'), (39, x'E0B69AE0B79E'), (97, x'E0B79D'), (2, x'E0B685'), (75, x'E0B780'), (34, x'E0B69AE0B799'), (69, x'E0B6B8'), (83, x'E0B790'), (18, x'E0B695'), (90, x'E0B7B2'), (17, x'E0B694'), (72, x'E0B6BB'), (66, x'E0B6B5'), (59, x'E0B6AD'), (44, x'E0B69E'), (15, x'E0B692'), (23, x'E0B69AE0B78F'), (65, x'E0B6B4'), (42, x'E0B69C'), (63, x'E0B6B1'), (85, x'E0B792'), (47, x'E0B6A1'), (49, x'E0B6A3'), (92, x'E0B7B3'), (78, x'E0B783'), (36, x'E0B69AE0B79B'), (4, x'E0B687'), (24, x'E0B69AE0B790'), (87, x'E0B794'), (37, x'E0B69AE0B79C'), (32, x'E0B69AE0B79F'), (29, x'E0B69AE0B796'), (43, x'E0B69D'), (62, x'E0B6B0'), (100, x'E0B78AE2808DE0B6BA'), (60, x'E0B6AE'), (45, x'E0B69F'), (12, x'E0B68F'), (46, x'E0B6A0'), (50, x'E0B6A5'), (51, x'E0B6A4'), (5, x'E0B688'), (76, x'E0B781'), (89, x'E0B798'), (74, x'E0B6BD'), (10, x'E0B68D'), (57, x'E0B6AB'), (71, x'E0B6BA'), (58, x'E0B6AC'), (27, x'E0B69AE0B793'), (54, x'E0B6A8'), (84, x'E0B791'), (31, x'E0B69AE0B7B2'), (98, x'E0B79E'), (53, x'E0B6A7'), (41, x'E0B69B'), (67, x'E0B6B6'), (7, x'E0B68A'), (20, x'E0B682');
SELECT predicted_order, hex(utf8mb4_encoding) FROM t1 ORDER BY utf8mb4_encoding COLLATE utf8mb4_sinhala_ci;
predicted_order	hex(utf8mb4_encoding)
1	E0B7B4
2	E0B685
3	E0B686
4	E0B687
5	E0B688
6	E0B689
7	E0B68A
8	E0B68B
9	E0B68C
10	E0B68D
11	E0B68E
12	E0B68F
13	E0B690
14	E0B691
15	E0B692
16	E0B693
17	E0B694
18	E0B695
19	E0B696
20	E0B682
21	E0B683
22	E0B69A
23	E0B69AE0B78F
24	E0B69AE0B790
25	E0B69AE0B791
26	E0B69AE0B792
27	E0B69AE0B793
28	E0B69AE0B794
29	E0B69AE0B796
30	E0B69AE0B798
31	E0B69AE0B7B2
32	E0B69AE0B79F
33	E0B69AE0B7B3
34	E0B69AE0B799
35	E0B69AE0B79A
36	E0B69AE0B79B
37	E0B69AE0B79C
38	E0B69AE0B79D
39	E0B69AE0B79E
40	E0B69AE0B78A
41	E0B69B
42	E0B69C
43	E0B69D
44	E0B69E
45	E0B69F
46	E0B6A0
47	E0B6A1
48	E0B6A2
49	E0B6A3
50	E0B6A5
51	E0B6A4
52	E0B6A6
53	E0B6A7
54	E0B6A8
55	E0B6A9
56	E0B6AA
57	E0B6AB
58	E0B6AC
59	E0B6AD
60	E0B6AE
61	E0B6AF
62	E0B6B0
63	E0B6B1
64	E0B6B3
65	E0B6B4
66	E0B6B5
67	E0B6B6
68	E0B6B7
69	E0B6B8
70	E0B6B9
71	E0B6BA
72	E0B6BB
73	E0B6BBE0B78AE2808D
74	E0B6BD
75	E0B780
76	E0B781
77	E0B782
78	E0B783
79	E0B784
80	E0B785
81	E0B786
82	E0B78F
83	E0B790
84	E0B791
85	E0B792
86	E0B793
87	E0B794
88	E0B796
89	E0B798
90	E0B7B2
91	E0B79F
92	E0B7B3
93	E0B799
94	E0B79A
95	E0B79B
96	E0B79C
97	E0B79D
98	E0B79E
99	E0B78A
100	E0B78AE2808DE0B6BA
101	E0B78AE2808DE0B6BB
DROP TABLE t1;
#
# Bug#32914 Character sets: illegal characters in utf8mb4 and utf32 columns
#
create table t1 (utf8mb4 char(1) character set utf8mb4);
Testing [F0][90..BF][80..BF][80..BF]
insert into t1 values (0xF0908080);
insert into t1 values (0xF0BFBFBF);
insert ignore into t1 values (0xF08F8080);
select hex(utf8mb4) from t1;
hex(utf8mb4)
F0908080
F0BFBFBF

delete from t1;
Testing [F2..F3][80..BF][80..BF][80..BF]
insert into t1 values (0xF2808080);
insert into t1 values (0xF2BFBFBF);
select hex(utf8mb4) from t1;
hex(utf8mb4)
F2808080
F2BFBFBF
delete from t1;
Testing [F4][80..8F][80..BF][80..BF]
insert into t1 values (0xF4808080);
insert into t1 values (0xF48F8080);
insert ignore into t1 values (0xF4908080);
select hex(utf8mb4) from t1;
hex(utf8mb4)

F4808080
F48F8080
drop table t1;
#
# Check strnxfrm() with odd length
#
set max_sort_length=5;
Warnings:
Warning	1235	This system variable now is mock not supported
select @@max_sort_length;
@@max_sort_length
1024
create table t1 (a varchar(128) character set utf8mb4 collate utf8mb4_general_ci);
insert into t1 values ('a'),('b'),('c');
select * from t1 order by a;
a
a
b
c
alter table t1 modify a varchar(128) character set utf8mb4 collate utf8mb4_bin;
select * from t1 order by a;
a
a
b
c
drop table t1;
set max_sort_length=default;
Warnings:
Warning	1235	This system variable now is mock not supported
#
# Bug#26180: Can't add columns to tables created with utf8mb4 text indexes
#
SET sql_mode = 'NO_ENGINE_SUBSTITUTION';
CREATE TABLE t1 (
clipid INT NOT NULL,
Tape TINYTEXT,
PRIMARY KEY (clipid),
KEY tape(Tape(255))
) CHARACTER SET=utf8mb4;
ALTER TABLE t1 ADD mos TINYINT DEFAULT 0 AFTER clipid;
DROP TABLE t1;
SET sql_mode = default;
#
# Testing 4-byte values.
#
DROP TABLE IF EXISTS t1;
CREATE TABLE t1 (
u_decimal int NOT NULL,
utf8mb4_encoding VARCHAR(10) NOT NULL
) CHARACTER SET utf8mb4;
INSERT INTO t1 VALUES (119040, x'f09d8480'),
# G CLEF
(119070, x'f09d849e'),
# HALF NOTE
(119134, x'f09d859e'),
# MUSICAL SYMBOL CROIX
(119247, x'f09d878f'),
# MATHEMATICAL BOLD ITALIC CAPITAL DELTA
(120607, x'f09d9c9f'),
# SANS-SERIF BOLD ITALIC CAPITAL PI
(120735, x'f09d9e9f'),
# <Plane 16 Private Use, Last> (last 4 byte character)
(1114111, x'f48fbfbf'),
# VARIATION SELECTOR-256
(917999, x'f3a087af');
INSERT INTO t1 VALUES (119070, x'f09d849ef09d859ef09d859ef09d8480f09d859ff09d859ff09d859ff09d85a0f09d85a0f09d8480');
INSERT INTO t1 VALUES (65131, x'efb9abf09d849ef09d859ef09d859ef09d8480f09d859fefb9abefb9abf09d85a0efb9ab');
INSERT IGNORE INTO t1 VALUES (119070, x'f09d849ef09d859ef09d859ef09d8480f09d859ff09d859ff09d859ff09d85a0f09d85a0f09d8480f09d85a0');
Warnings:
Warning	1265	Data truncated for column '"test"."t1"."utf8mb4_encoding"' at row 1
SELECT u_decimal, hex(utf8mb4_encoding) FROM t1 ORDER BY utf8mb4_encoding COLLATE utf8mb4_general_ci, BINARY utf8mb4_encoding;
u_decimal	hex(utf8mb4_encoding)
65131	EFB9ABF09D849EF09D859EF09D859EF09D8480F09D859FEFB9ABEFB9ABF09D85A0EFB9AB
119040	F09D8480
119070	F09D849E
119134	F09D859E
119247	F09D878F
120607	F09D9C9F
120735	F09D9E9F
917999	F3A087AF
1114111	F48FBFBF
119070	F09D849EF09D859EF09D859EF09D8480F09D859FF09D859FF09D859FF09D85A0F09D85A0F09D8480
119070	F09D849EF09D859EF09D859EF09D8480F09D859FF09D859FF09D859FF09D85A0F09D85A0F09D8480
INSERT IGNORE INTO t1 VALUES (1114111, x'f5808080');
SELECT character_maximum_length, character_octet_length FROM information_schema.columns WHERE
table_name= 't1' AND column_name= 'utf8mb4_encoding';
character_maximum_length	character_octet_length
10	40
DROP TABLE IF EXISTS t2;
CREATE TABLE t3 (
u_decimal int NOT NULL,
utf8mb3_encoding VARCHAR(10) NOT NULL
) CHARACTER SET utf8mb3;
CREATE TABLE t2 (
u_decimal int NOT NULL,
utf8mb3_encoding VARCHAR(10) NOT NULL
) ;
INSERT INTO t2 VALUES (42856, x'ea9da8');
INSERT INTO t2 VALUES (65131, x'efb9ab');
SELECT character_maximum_length, character_octet_length FROM information_schema.columns WHERE
table_name= 't2' AND column_name= 'utf8mb3_encoding';
character_maximum_length	character_octet_length
10	40
UPDATE IGNORE t2 SET utf8mb3_encoding= x'f48fbfbd' where u_decimal= 42856;
UPDATE t2 SET utf8mb3_encoding= _utf8mb4 x'ea9da8' where u_decimal= 42856;
SELECT HEX(CONCAT(utf8mb4_encoding, _utf8 x'ea9da8')) FROM t1;
HEX(CONCAT(utf8mb4_encoding, _utf8 x'ea9da8'))
F09D8480EA9DA8
F09D849EEA9DA8
F09D859EEA9DA8
F09D878FEA9DA8
F09D9C9FEA9DA8
F09D9E9FEA9DA8
F48FBFBFEA9DA8
F3A087AFEA9DA8
F09D849EF09D859EF09D859EF09D8480F09D859FF09D859FF09D859FF09D85A0F09D85A0F09D8480EA9DA8
EFB9ABF09D849EF09D859EF09D859EF09D8480F09D859FEFB9ABEFB9ABF09D85A0EFB9ABEA9DA8
F09D849EF09D859EF09D859EF09D8480F09D859FF09D859FF09D859FF09D85A0F09D85A0F09D8480EA9DA8
EA9DA8
SELECT HEX(CONCAT(utf8mb4_encoding, utf8mb3_encoding)) FROM t1,t2;
HEX(CONCAT(utf8mb4_encoding, utf8mb3_encoding))
EA9DA8
EFB9AB
EFB9ABF09D849EF09D859EF09D859EF09D8480F09D859FEFB9ABEFB9ABF09D85A0EFB9ABEA9DA8
EFB9ABF09D849EF09D859EF09D859EF09D8480F09D859FEFB9ABEFB9ABF09D85A0EFB9ABEFB9AB
F09D8480EA9DA8
F09D8480EFB9AB
F09D849EEA9DA8
F09D849EEFB9AB
F09D849EF09D859EF09D859EF09D8480F09D859FF09D859FF09D859FF09D85A0F09D85A0F09D8480EA9DA8
F09D849EF09D859EF09D859EF09D8480F09D859FF09D859FF09D859FF09D85A0F09D85A0F09D8480EA9DA8
F09D849EF09D859EF09D859EF09D8480F09D859FF09D859FF09D859FF09D85A0F09D85A0F09D8480EFB9AB
F09D849EF09D859EF09D859EF09D8480F09D859FF09D859FF09D859FF09D85A0F09D85A0F09D8480EFB9AB
F09D859EEA9DA8
F09D859EEFB9AB
F09D878FEA9DA8
F09D878FEFB9AB
F09D9C9FEA9DA8
F09D9C9FEFB9AB
F09D9E9FEA9DA8
F09D9E9FEFB9AB
F3A087AFEA9DA8
F3A087AFEFB9AB
F48FBFBFEA9DA8
F48FBFBFEFB9AB
SELECT count(*) FROM t1, t2
WHERE t1.utf8mb4_encoding > t2.utf8mb3_encoding;
count(*)
22
SET sql_mode = 'NO_ENGINE_SUBSTITUTION';
ALTER TABLE t1 CONVERT TO CHARACTER SET utf8;
SET sql_mode = default;
SELECT u_decimal,hex(utf8mb4_encoding),utf8mb4_encoding FROM t1;
u_decimal	hex(utf8mb4_encoding)	utf8mb4_encoding
119040	F09D8480	𝄀
119070	F09D849E	𝄞
119134	F09D859E	𝅗𝅥
119247	F09D878F	𝇏
120607	F09D9C9F	𝜟
120735	F09D9E9F	𝞟
1114111	F48FBFBF	􏿿
917999	F3A087AF	󠇯
119070	F09D849EF09D859EF09D859EF09D8480F09D859FF09D859FF09D859FF09D85A0F09D85A0F09D8480	𝄞𝅗𝅥𝅗𝅥𝄀𝅘𝅥𝅘𝅥𝅘𝅥𝅘𝅥𝅮𝅘𝅥𝅮𝄀
65131	EFB9ABF09D849EF09D859EF09D859EF09D8480F09D859FEFB9ABEFB9ABF09D85A0EFB9AB	﹫𝄞𝅗𝅥𝅗𝅥𝄀𝅘𝅥﹫﹫𝅘𝅥𝅮﹫
119070	F09D849EF09D859EF09D859EF09D8480F09D859FF09D859FF09D859FF09D85A0F09D85A0F09D8480	𝄞𝅗𝅥𝅗𝅥𝄀𝅘𝅥𝅘𝅥𝅘𝅥𝅘𝅥𝅮𝅘𝅥𝅮𝄀
1114111		
ALTER TABLE t2 CONVERT TO CHARACTER SET utf8mb4;
SHOW CREATE TABLE t2;
Table	Create Table
t2	CREATE TABLE `t2` (
  `u_decimal` int(11) NOT NULL,
  `utf8mb3_encoding` varchar(10) NOT NULL
) ORGANIZATION INDEX DEFAULT CHARSET = utf8mb4 ROW_FORMAT = DYNAMIC COMPRESSION = 'zstd_1.3.8' REPLICA_NUM = replica_num BLOCK_SIZE = 16384 USE_BLOOM_FILTER = FALSE TABLET_SIZE = 134217728 PCTFREE = 0
SELECT u_decimal,hex(utf8mb3_encoding) FROM t2;
u_decimal	hex(utf8mb3_encoding)
42856	EA9DA8
65131	EFB9AB
ALTER TABLE t1 MODIFY utf8mb4_encoding VARCHAR(10) CHARACTER SET utf8mb4;
SELECT u_decimal,hex(utf8mb4_encoding) FROM t1;
u_decimal	hex(utf8mb4_encoding)
119040	F09D8480
119070	F09D849E
119134	F09D859E
119247	F09D878F
120607	F09D9C9F
120735	F09D9E9F
1114111	F48FBFBF
917999	F3A087AF
119070	F09D849EF09D859EF09D859EF09D8480F09D859FF09D859FF09D859FF09D85A0F09D85A0F09D8480
65131	EFB9ABF09D849EF09D859EF09D859EF09D8480F09D859FEFB9ABEFB9ABF09D85A0EFB9AB
119070	F09D849EF09D859EF09D859EF09D8480F09D859FF09D859FF09D859FF09D85A0F09D85A0F09D8480
1114111	
ALTER TABLE t2 MODIFY utf8mb3_encoding VARCHAR(10) CHARACTER SET utf8mb4;
SHOW CREATE TABLE t2;
Table	Create Table
t2	CREATE TABLE `t2` (
  `u_decimal` int(11) NOT NULL,
  `utf8mb3_encoding` varchar(10) DEFAULT NULL
) ORGANIZATION INDEX DEFAULT CHARSET = utf8mb4 ROW_FORMAT = DYNAMIC COMPRESSION = 'zstd_1.3.8' REPLICA_NUM = replica_num BLOCK_SIZE = 16384 USE_BLOOM_FILTER = FALSE TABLET_SIZE = 134217728 PCTFREE = 0
SELECT u_decimal,hex(utf8mb3_encoding) FROM t2;
u_decimal	hex(utf8mb3_encoding)
42856	EA9DA8
65131	EFB9AB
DROP TABLE IF EXISTS t3;
CREATE TABLE t3 (
u_decimal int NOT NULL,
utf8mb3_encoding VARCHAR(10) NOT NULL
) CHARACTER SET utf8;
INSERT INTO t3 SELECT * FROM t1;
DROP TABLE IF EXISTS t4;
CREATE TABLE t4 (
u_decimal int NOT NULL,
utf8mb4_encoding VARCHAR(10) NOT NULL
) CHARACTER SET utf8mb4;
INSERT INTO t3 SELECT * FROM t2;
DROP TABLE t1;
DROP TABLE t2;
DROP TABLE t3;
DROP TABLE t4;
#
# Testing that mixing utf8 and utf8mb4 collations returns utf8mb4
#
SELECT CHARSET(CONCAT(_utf8mb4'a',_utf8'b'));
CHARSET(CONCAT(_utf8mb4'a',_utf8'b'))
utf8mb4
CREATE TABLE t1 (utf8mb4 VARCHAR(10) CHARACTER SET utf8mb4 NOT NULL);
INSERT INTO t1 VALUES (x'ea9da8'),(x'f48fbfbf');
SELECT CONCAT(utf8mb4, _utf8 x'ea9da8') FROM t1 LIMIT 0;
CONCAT(utf8mb4, _utf8 x'ea9da8')
DROP TABLE t1;
#
# Check that mixing utf8mb4 with an invalid utf8 constant returns error
#
CREATE TABLE t1 (utf8mb4 VARCHAR(10) CHARACTER SET utf8mb4);
INSERT INTO t1 VALUES (x'f48fbfbf');
SELECT CONCAT(utf8mb4, _utf8'?') FROM t1;
CONCAT(utf8mb4, _utf8'?')
􏿿?
SELECT CONCAT('a', _utf8 '?') FROM t1;
CONCAT('a', _utf8 '?')
a?
DROP TABLE t1;
#
# Bug#51675 Server crashes on inserting 4 byte char.
# after ALTER TABLE to 'utf8mb4' 
#
SET NAMES utf8;
CREATE TABLE t1 ( 
subject varchar(255) CHARACTER SET utf8 COLLATE utf8_unicode_ci, 
p VARCHAR(15) CHARACTER SET utf8 
) DEFAULT CHARSET=latin1;
ALTER TABLE t1 ADD INDEX (subject);
SET sql_mode = 'NO_ENGINE_SUBSTITUTION';
ALTER TABLE t1
DEFAULT CHARACTER SET utf8,
MODIFY subject varchar(255) CHARACTER SET utf8mb4 COLLATE utf8mb4_unicode_ci,
MODIFY p varchar(255) CHARACTER SET utf8;
SET sql_mode = default;
INSERT INTO t1(subject) VALUES ('abcd');
INSERT INTO t1(subject) VALUES(x'f0909080');
DROP TABLE t1;
CREATE TABLE t1 (a TEXT CHARACTER SET utf8mb4, FULLTEXT INDEX(a));
INSERT INTO t1 VALUES (0xF0A08080 /* U+20000 */ );
DROP TABLE t1;
#
# Bug #51676 Server crashes on SELECT, ORDER BY on 'utf8mb4' column
#
SET NAMES utf8mb4;
CREATE TABLE t1 ( 
subject varchar(255) character set utf8mb4 collate utf8mb4_unicode_ci, 
p varchar(15) character set utf8mb4 
) DEFAULT CHARSET=latin1;
INSERT INTO t1(subject) VALUES(0xF0909080);
INSERT INTO t1(subject) VALUES(0x616263F0909080646566);
SELECT *  FROM t1 ORDER BY 1;
subject	p
abc𐐀def	NULL
𐐀	NULL
SELECT hex(subject), length(subject), char_length(subject), octet_length(subject) FROM t1 ORDER BY 1;
hex(subject)	length(subject)	char_length(subject)	octet_length(subject)
616263F0909080646566	10	7	10
F0909080	4	1	4
SELECT subject FROM t1 ORDER BY 1;
subject
abc𐐀def
𐐀
DROP TABLE t1;
#
# Bug#52520 Difference in tinytext utf column metadata
#
CREATE TABLE t1 (
s1 TINYTEXT CHARACTER SET utf8mb4,
s2 TEXT CHARACTER SET utf8mb4,
s3 MEDIUMTEXT CHARACTER SET utf8mb4,
s4 LONGTEXT CHARACTER SET utf8mb4
);
SET NAMES utf8mb4, @@character_set_results=NULL;
SET NAMES utf8mb4;
SELECT *, HEX(s1) FROM t1;
Catalog	Database	Table	Table_alias	Column	Column_alias	Type	Length	Max length	Is_null	Flags	Decimals	Charsetnr
def	test	t1	t1	s1	s1	252	255	0	Y	16	0	45
def	test	t1	t1	s2	s2	252	65535	0	Y	16	0	45
def	test	t1	t1	s3	s3	252	16777215	0	Y	16	0	45
def	test	t1	t1	s4	s4	252	4294967295	0	Y	16	0	45
def					HEX(s1)	252	65535	0	Y	16	0	45
s1	s2	s3	s4	HEX(s1)
SET NAMES latin1;
SELECT *, HEX(s1) FROM t1;
Catalog	Database	Table	Table_alias	Column	Column_alias	Type	Length	Max length	Is_null	Flags	Decimals	Charsetnr
def	test	t1	t1	s1	s1	252	255	0	Y	16	0	8
def	test	t1	t1	s2	s2	252	65535	0	Y	16	0	8
def	test	t1	t1	s3	s3	252	16777215	0	Y	16	0	8
def	test	t1	t1	s4	s4	252	4294967295	0	Y	16	0	8
def					HEX(s1)	252	65535	0	Y	16	0	8
s1	s2	s3	s4	HEX(s1)
SET NAMES utf8mb4;
SELECT *, HEX(s1) FROM t1;
Catalog	Database	Table	Table_alias	Column	Column_alias	Type	Length	Max length	Is_null	Flags	Decimals	Charsetnr
def	test	t1	t1	s1	s1	252	255	0	Y	16	0	45
def	test	t1	t1	s2	s2	252	65535	0	Y	16	0	45
def	test	t1	t1	s3	s3	252	16777215	0	Y	16	0	45
def	test	t1	t1	s4	s4	252	4294967295	0	Y	16	0	45
def					HEX(s1)	252	65535	0	Y	16	0	45
s1	s2	s3	s4	HEX(s1)
CREATE TABLE t2 AS SELECT CONCAT(s1) FROM t1;
SHOW CREATE TABLE t2;
Table	Create Table
t2	CREATE TABLE `t2` (
  `CONCAT(s1)` varchar(255) DEFAULT NULL
) ORGANIZATION INDEX DEFAULT CHARSET = utf8mb4 ROW_FORMAT = DYNAMIC COMPRESSION = 'zstd_1.3.8' REPLICA_NUM = replica_num BLOCK_SIZE = 16384 USE_BLOOM_FILTER = FALSE TABLET_SIZE = 134217728 PCTFREE = 0
DROP TABLE t1, t2;
#
# Bug#13581962 HIGH MEMORY USAGE ATTEMPT, THEN CRASH WITH LONGTEXT, UNION, USER VARIABLE
#
CREATE TABLE t1(f1 LONGTEXT CHARACTER SET utf8mb4);
INSERT INTO t1 VALUES ('a');
SELECT @a:= CAST(f1 AS SIGNED) FROM t1
UNION ALL
SELECT CAST(f1 AS SIGNED) FROM t1;
@a:= CAST(f1 AS SIGNED)
0
0
Warnings:
Warning	1292	Truncated incorrect INTEGER value: 'a'
Warning	1292	Truncated incorrect INTEGER value: 'a'
DROP TABLE t1;
#
# End of 5.5 tests
#
#
# Start of 5.6 tests
#
#
# Bugs#12635232: VALGRIND WARNINGS: IS_IPV6, IS_IPV4, INET6_ATON,
# INET6_NTOA + MULTIBYTE CHARSET.
#
SET NAMES utf8mb4;
SELECT is_ipv4(inet_ntoa('1'));
is_ipv4(inet_ntoa('1'))
1
SELECT is_ipv6(inet_ntoa('1'));
is_ipv6(inet_ntoa('1'))
0
SELECT HEX(inet6_aton(inet_ntoa('1')));
HEX(inet6_aton(inet_ntoa('1')))
00000001
SELECT inet6_ntoa(inet_ntoa('1'));
inet6_ntoa(inet_ntoa('1'))
NULL
#
# Bug#14040277 UNINITIALIZED VALUE REFERENCED IN STR_TO_IPV6
#
SELECT inet6_aton(soundex('a'));
inet6_aton(soundex('a'))
NULL
Warnings:
Warning	1411	Incorrect string value for function inet6_aton
#
# Bug#19047425 UNINITIALISED VALUE IN STR_TO_IPV6
#
do is_ipv4_mapped(inet6_aton(convert(_ascii "a:" using utf8mb4)));
#
# End of 5.6 tests
#
#
# WL#13054: Add utf8mb4 binary no-pad collation
#
SET NAMES utf8mb4 COLLATE utf8mb4_0900_bin;
SET NAMES utf8mb4;
SET @test_character_set= 'utf8mb4';
create table t1 select repeat('a',4000) a;
delete from t1;
insert into t1 values ('a'), ('a '), ('a\t');
select collation(a),hex(a) from t1 order by a;
collation(a)	hex(a)
utf8mb4_general_ci	6109
utf8mb4_general_ci	61
utf8mb4_general_ci	6120
drop table t1;
create table t1 engine=innodb select repeat('a',50) as c1;
alter table t1 add index(c1(5));
insert into t1 values ('abcdefg'),('abcde100'),('abcde110'),('abcde111');
select collation(c1) from t1 limit 1;
collation(c1)
utf8mb4_general_ci
select c1 from t1 where c1 like 'abcdef%' order by c1;
c1
abcdefg
select c1 from t1 where c1 like 'abcde1%' order by c1;
c1
abcde100
abcde110
abcde111
select c1 from t1 where c1 like 'abcde11%' order by c1;
c1
abcde110
abcde111
select c1 from t1 where c1 like 'abcde111%' order by c1;
c1
abcde111
drop table t1;
select @@collation_connection;
@@collation_connection
utf8mb4_general_ci
create table t1 ROW_FORMAT=DYNAMIC select repeat('a',50) as c1 ;
insert into t1 values('abcdef');
insert into t1 values('_bcdef');
insert into t1 values('a_cdef');
insert into t1 values('ab_def');
insert into t1 values('abc_ef');
insert into t1 values('abcd_f');
insert into t1 values('abcde_');
select c1 as c1u from t1 where c1 like 'ab\_def';
c1u
ab_def
select c1 as c2h from t1 where c1 like 'ab#_def' escape '#';
c2h
ab_def
drop table t1;
drop table if exists t1;
create table t1 select repeat('a',10) as c1;
delete from t1;
insert into t1 values (0x20),(0x21),(0x22),(0x23),(0x24),(0x25),(0x26),(0x27),(0x28),(0x29),(0x2A),(0x2B),(0x2C),(0x2D),(0x2E),(0x2F);
insert into t1 values (0x30),(0x31),(0x32),(0x33),(0x34),(0x35),(0x36),(0x37),(0x38),(0x39),(0x3A),(0x3B),(0x3C),(0x3D),(0x3E),(0x3F);
insert into t1 values (0x40),(0x41),(0x42),(0x43),(0x44),(0x45),(0x46),(0x47),(0x48),(0x49),(0x4A),(0x4B),(0x4C),(0x4D),(0x4E),(0x4F);
insert into t1 values (0x50),(0x51),(0x52),(0x53),(0x54),(0x55),(0x56),(0x57),(0x58),(0x59),(0x5A),(0x5B),(0x5C),(0x5D),(0x5E),(0x5F);
insert into t1 values (0x60),(0x61),(0x62),(0x63),(0x64),(0x65),(0x66),(0x67),(0x68),(0x69),(0x6A),(0x6B),(0x6C),(0x6D),(0x6E),(0x6F);
insert into t1 values (0x70),(0x71),(0x72),(0x73),(0x74),(0x75),(0x76),(0x77),(0x78),(0x79),(0x7A),(0x7B),(0x7C),(0x7D),(0x7E),(0x7F);
SELECT HEX(cx), cy
FROM (SELECT GROUP_CONCAT(c1 ORDER BY binary c1 SEPARATOR '') AS cx,
GROUP_CONCAT(HEX(c1) ORDER BY BINARY c1) AS cy
FROM t1
GROUP BY c1
) AS dt;
HEX(cx)	cy
20	20
3B	3B
38	38
27	27
4969	49,69
7C	7C
5D	5D
7B	7B
2B	2B
5373	53,73
7F	7F
4868	48,68
26	26
5B	5B
3D	3D
33	33
21	21
28	28
4E6E	4E,6E
4767	47,67
35	35
4D6D	4D,6D
5979	59,79
22	22
34	34
29	29
5575	55,75
2E	2E
5878	58,78
3F	3F
2F	2F
2D	2D
39	39
23	23
7D	7D
4464	44,64
5474	54,74
2A	2A
36	36
24	24
4A6A	4A,6A
5E	5E
5676	56,76
60	60
7E	7E
32	32
3A	3A
4161	41,61
4F6F	4F,6F
31	31
5C	5C
3C	3C
2C	2C
4262	42,62
5777	57,77
4363	43,63
5272	52,72
4666	46,66
4C6C	4C,6C
5F	5F
40	40
5171	51,71
30	30
5A7A	5A,7A
3E	3E
37	37
4B6B	4B,6B
5070	50,70
4565	45,65
25	25
drop table t1;
select @@collation_connection;
@@collation_connection
utf8mb4_general_ci
select hex(weight_string('a'));
hex(weight_string('a'))
0041
select hex(weight_string('A'));
hex(weight_string('A'))
0041
select hex(weight_string('abc'));
hex(weight_string('abc'))
004100420043
select hex(weight_string('abc' as char(2)));
hex(weight_string('abc' as char(2)))
00410042
select hex(weight_string('abc' as char(3)));
hex(weight_string('abc' as char(3)))
004100420043
select hex(weight_string('abc' as char(5)));
hex(weight_string('abc' as char(5)))
00410042004300200020
select @@collation_connection;
@@collation_connection
utf8mb4_general_ci
select hex(weight_string(cast(_latin1 0x80 as char)));
hex(weight_string(cast(_latin1 0x80 as char)))
20AC
select hex(weight_string(cast(_latin1 0x808080 as char)));
hex(weight_string(cast(_latin1 0x808080 as char)))
20AC20AC20AC
select hex(weight_string(cast(_latin1 0x808080 as char) as char(2)));
hex(weight_string(cast(_latin1 0x808080 as char) as char(2)))
20AC20AC
select hex(weight_string(cast(_latin1 0x808080 as char) as char(3)));
hex(weight_string(cast(_latin1 0x808080 as char) as char(3)))
20AC20AC20AC
select hex(weight_string(cast(_latin1 0x808080 as char) as char(5)));
hex(weight_string(cast(_latin1 0x808080 as char) as char(5)))
20AC20AC20AC00200020
CREATE TABLE t1(a CHAR(10)) COLLATE utf8mb4_0900_bin;
drop table t1;
CREATE TABLE t1(a CHAR(10));
INSERT INTO t1 VALUES('aaa'), ('aaaa'), ('aaaaa');
SELECT a FROM t1 WHERE a = 'aaa ';
a
aaa
DROP TABLE t1;
CREATE TABLE t1(a CHAR(10)) COLLATE latin1_swedish_ci;
INSERT INTO t1 VALUES('aaa'), ('aaaa'), ('aaaaa');
SELECT a FROM t1 WHERE a = 'aaa ';
a
aaa
DROP TABLE t1;
