drop table if exists t1,t2;
set names utf8;
select left(_utf8 0xD0B0D0B1D0B2,1);
left(_utf8 0xD0B0D0B1D0B2,1)
а
select right(_utf8 0xD0B0D0B2D0B2,1);
right(_utf8 0xD0B0D0B2D0B2,1)
в
select locate('he','hello');
locate('he','hello')
1
select locate('he','hello',2);
locate('he','hello',2)
0
select locate('lo','hello',2);
locate('lo','hello',2)
4
select locate('HE','hello');
locate('HE','hello')
1
select locate('HE','hello',2);
locate('HE','hello',2)
0
select locate('LO','hello',2);
locate('LO','hello',2)
4
select locate('HE','hello' collate utf8_bin);
locate('HE','hello' collate utf8_bin)
0
select locate('HE','hello' collate utf8_bin,2);
locate('HE','hello' collate utf8_bin,2)
0
select locate('LO','hello' collate utf8_bin,2);
locate('LO','hello' collate utf8_bin,2)
0
select locate(_utf8 0xD0B1, _utf8 0xD0B0D0B1D0B2);
locate(_utf8 0xD0B1, _utf8 0xD0B0D0B1D0B2)
2
select locate(_utf8 0xD091, _utf8 0xD0B0D0B1D0B2);
locate(_utf8 0xD091, _utf8 0xD0B0D0B1D0B2)
2
select locate(_utf8 0xD0B1, _utf8 0xD0B0D091D0B2);
locate(_utf8 0xD0B1, _utf8 0xD0B0D091D0B2)
2
select locate(_utf8 0xD091, _utf8 0xD0B0D0B1D0B2 collate utf8_bin);
locate(_utf8 0xD091, _utf8 0xD0B0D0B1D0B2 collate utf8_bin)
0
select locate(_utf8 0xD0B1, _utf8 0xD0B0D091D0B2 collate utf8_bin);
locate(_utf8 0xD0B1, _utf8 0xD0B0D091D0B2 collate utf8_bin)
0
select length(_utf8 0xD0B1), bit_length(_utf8 0xD0B1), char_length(_utf8 0xD0B1);
length(_utf8 0xD0B1)	bit_length(_utf8 0xD0B1)	char_length(_utf8 0xD0B1)
2	16	1
select 'a' like 'a';
'a' like 'a'
1
select 'A' like 'a';
'A' like 'a'
1
select 'A' like 'a' collate utf8_bin;
'A' like 'a' collate utf8_bin
0
select _utf8 0xD0B0D0B1D0B2 like concat(_utf8'%',_utf8 0xD0B1,_utf8 '%');
_utf8 0xD0B0D0B1D0B2 like concat(_utf8'%',_utf8 0xD0B1,_utf8 '%')
1
SELECT 'a' = 'a ';
'a' = 'a '
1
SELECT 'a\0' < 'a';
'a\0' < 'a'
1
SELECT 'a\0' < 'a ';
'a\0' < 'a '
1
SELECT 'a\t' < 'a';
'a\t' < 'a'
1
SELECT 'a\t' < 'a ';
'a\t' < 'a '
1
SELECT 'a' = 'a ' collate utf8_bin;
'a' = 'a ' collate utf8_bin
1
SELECT 'a\0' < 'a' collate utf8_bin;
'a\0' < 'a' collate utf8_bin
1
SELECT 'a\0' < 'a ' collate utf8_bin;
'a\0' < 'a ' collate utf8_bin
1
SELECT 'a\t' < 'a' collate utf8_bin;
'a\t' < 'a' collate utf8_bin
1
SELECT 'a\t' < 'a ' collate utf8_bin;
'a\t' < 'a ' collate utf8_bin
1
CREATE TABLE t1 (a char(10) character set utf8 not null);
INSERT INTO t1 VALUES ('a'),('a\0'),('a\t'),('a ');
SELECT hex(a),STRCMP(a,'a'), STRCMP(a,'a ') FROM t1;
hex(a)	STRCMP(a,'a')	STRCMP(a,'a ')
61	0	0
6100	-1	-1
6109	-1	-1
61	0	0
DROP TABLE t1;
select insert('txs',2,1,'hi'),insert('is ',4,0,'a'),insert('txxxxt',2,4,'es');
insert('txs',2,1,'hi')	insert('is ',4,0,'a')	insert('txxxxt',2,4,'es')
this	is 	test
select insert("aa",100,1,"b"),insert("aa",1,3,"b");
insert("aa",100,1,"b")	insert("aa",1,3,"b")
aa	b
select char_length(left(@a:='褌械褋褌',5)), length(@a), @a;
char_length(left(@a:='褌械褋褌',5))	length(@a)	@a
4	12	褌械褋褌
create table t1 select date_format("2004-01-19 10:10:10", "%Y-%m-%d");
select * from t1;
date_format("2004-01-19 10:10:10", "%Y-%m-%d")
2004-01-19
drop table t1;
set names utf8;
set LC_TIME_NAMES='fr_FR';
ERROR 42000: Variable 'lc_time_names' can't be set to the value of 'fr_FR'
create table t1 (s1 char(20) character set latin1);
insert into t1 values (date_format('2004-02-02','%M'));
select hex(s1) from t1;
hex(s1)
4665627275617279
drop table t1;
create table t1 (s1 char(20) character set koi8r);
ERROR 42000: Unknown character set: 'koi8r'
set LC_TIME_NAMES='ru_RU';
ERROR 42000: Variable 'lc_time_names' can't be set to the value of 'ru_RU'
set LC_TIME_NAMES='en_US';
SET sql_mode = 'NO_ENGINE_SUBSTITUTION';
set names koi8r;
ERROR 42000: Unknown character set: 'koi8r'
create table t1 (s1 char(1) character set utf8);
insert into t1 values (_koi8r'谅');
ERROR 42000: You have an error in your SQL syntax; check the manual that corresponds to your OceanBase version for the right syntax to use near ''谅')' at line 1
select s1,hex(s1),char_length(s1),octet_length(s1) from t1;
s1	hex(s1)	char_length(s1)	octet_length(s1)
drop table t1;
create table t1 (s1 tinytext character set utf8);
insert into t1 select repeat('a',30);
insert into t1 select repeat('補',30);
insert into t1 select repeat('蜒',30);
select hex(s1) from t1;
hex(s1)
616161616161616161616161616161616161616161616161616161616161
E8A39CE8A39CE8A39CE8A39CE8A39CE8A39CE8A39CE8A39CE8A39CE8A39CE8A39CE8A39CE8A39CE8A39CE8A39CE8A39CE8A39CE8A39CE8A39CE8A39CE8A39CE8A39CE8A39CE8A39CE8A39CE8A39CE8A39CE8A39CE8A39CE8A39C
E89C92E89C92E89C92E89C92E89C92E89C92E89C92E89C92E89C92E89C92E89C92E89C92E89C92E89C92E89C92E89C92E89C92E89C92E89C92E89C92E89C92E89C92E89C92E89C92E89C92E89C92E89C92E89C92E89C92E89C92
select length(s1),char_length(s1) from t1;
length(s1)	char_length(s1)
30	30
90	30
90	30
drop table t1;
create table t1 (s1 text character set utf8);
insert into t1 select repeat('a',6600);
insert into t1 select repeat('補',6600);
insert into t1 select repeat('蜒',6600);
select length(s1),char_length(s1) from t1;
length(s1)	char_length(s1)
6600	6600
19800	6600
19800	6600
drop table t1;
SET sql_mode = default;
create table t1 (s1 char(10) character set utf8);
insert ignore into t1 values (0x41FF);
select hex(s1) from t1;
hex(s1)
41
drop table t1;
create table t1 (s1 varchar(10) character set utf8);
insert ignore into t1 values (0x41FF);
select hex(s1) from t1;
hex(s1)
41
drop table t1;
create table t1 (s1 text character set utf8);
insert ignore into t1 values (0x41FF);
select hex(s1) from t1;
hex(s1)
41
drop table t1;
create table t1 (a text character set utf8, primary key(a(360)));
ERROR 42000: You have an error in your SQL syntax; check the manual that corresponds to your OceanBase version for the right syntax to use near '(360)))' at line 1
CREATE TABLE t1 ( a varchar(10) ) CHARACTER SET utf8;
INSERT INTO t1 VALUES ( 'test' );
SELECT a.a, b.a FROM t1 a, t1 b WHERE a.a = b.a;
a	a
test	test
SELECT a.a, b.a FROM t1 a, t1 b WHERE a.a = 'test' and b.a = 'test';
a	a
test	test
SELECT a.a, b.a FROM t1 a, t1 b WHERE a.a = b.a and a.a = 'test';
a	a
test	test
DROP TABLE t1;
create table t1 (a char(255) character set utf8);
insert into t1 values('b'),('b');
select * from t1 where a = 'b';
a
b
b
select * from t1 where a = 'b' and a = 'b';
a
b
b
select * from t1 where a = 'b' and a != 'b';
a
drop table t1;
set collation_connection=utf8_general_ci;
drop table if exists t1;
create table t1 as
select repeat(' ', 64) as s1, repeat(' ',64) as s2
union
select null, null;
show create table t1;
Table	Create Table
t1	CREATE TABLE `t1` (
  `s1` varchar(512) DEFAULT NULL,
  `s2` varchar(512) DEFAULT NULL
) ORGANIZATION INDEX DEFAULT CHARSET = utf8mb4 ROW_FORMAT = DYNAMIC COMPRESSION = 'zstd_1.3.8' REPLICA_NUM = replica_num BLOCK_SIZE = 16384 USE_BLOOM_FILTER = FALSE ENABLE_MACRO_BLOCK_BLOOM_FILTER = FALSE TABLET_SIZE = 134217728 PCTFREE = 0
delete from t1;
insert into t1 values('aaa','aaa');
insert into t1 values('aaa|qqq','qqq');
insert into t1 values('gheis','^[^a-dXYZ]+$');
insert into t1 values('aab','^aa?b');
insert into t1 values('Baaan','^Ba*n');
insert into t1 values('aaa','qqq|aaa');
insert into t1 values('qqq','qqq|aaa');
insert into t1 values('bbb','qqq|aaa');
insert into t1 values('bbb','qqq');
insert into t1 values('aaa','aba');
insert into t1 values(null,'abc');
insert into t1 values('def',null);
insert into t1 values(null,null);
SELECT 'ghi' REGEXP 'ghi[';
ERROR HY000: unmatched bracket in regular expression
drop table t1;
set names utf8;
set names utf8;
# Not supported by ICU
select  '胁邪褋褟'  rlike '[[:<:]]胁邪褋褟[[:>:]]';
ERROR 42000: Got error 'U_REGEX_PROPERTY_SYNTAX' from regexp
# Not supported by ICU
select  '胁邪褋褟 ' rlike '[[:<:]]胁邪褋褟[[:>:]]';
ERROR 42000: Got error 'U_REGEX_PROPERTY_SYNTAX' from regexp
# Not supported by ICU
select ' 胁邪褋褟'  rlike '[[:<:]]胁邪褋褟[[:>:]]';
ERROR 42000: Got error 'U_REGEX_PROPERTY_SYNTAX' from regexp
# Not supported by ICU
select ' 胁邪褋褟 ' rlike '[[:<:]]胁邪褋褟[[:>:]]';
ERROR 42000: Got error 'U_REGEX_PROPERTY_SYNTAX' from regexp
# Not supported by ICU
select  '胁邪褋褟z' rlike '[[:<:]]胁邪褋褟[[:>:]]';
ERROR 42000: Got error 'U_REGEX_PROPERTY_SYNTAX' from regexp
# Not supported by ICU
select 'z胁邪褋褟'  rlike '[[:<:]]胁邪褋褟[[:>:]]';
ERROR 42000: Got error 'U_REGEX_PROPERTY_SYNTAX' from regexp
# Not supported by ICU
select 'z胁邪褋褟z' rlike '[[:<:]]胁邪褋褟[[:>:]]';
ERROR 42000: Got error 'U_REGEX_PROPERTY_SYNTAX' from regexp
CREATE TABLE t1 (a enum ('Y', 'N') DEFAULT 'N' COLLATE utf8_unicode_ci);
ALTER TABLE t1 ADD COLUMN b CHAR(20);
DROP TABLE t1;
set names utf8;
create table t1 (a enum('aaaa','锌褉芯斜邪') character set utf8);
insert into t1 values ('锌褉芯斜邪');
select * from t1;
a
锌褉芯斜邪
create table t2 select ifnull(a,a) from t1;
select * from t2;
ifnull(a,a)
锌褉芯斜邪
drop table t1;
drop table t2;
create table t1 (c varchar(30) character set utf8, unique(c(10)));
insert into t1 values ('1'),('2'),('3'),('x'),('y'),('z');
insert into t1 values ('aaaaaaaaaa');
insert into t1 values ('aaaaaaaaaaa');
ERROR 23000: Duplicate entry 'aaaaaaaaaa' for key 'c'
insert into t1 values ('aaaaaaaaaaaa');
ERROR 23000: Duplicate entry 'aaaaaaaaaa' for key 'c'
insert into t1 values (repeat('b',20));
select c c1 from t1 where c='1';
c1
1
select c c2 from t1 where c='2';
c2
2
select c c3 from t1 where c='3';
c3
3
select c cx from t1 where c='x';
cx
x
select c cy from t1 where c='y';
cy
y
select c cz from t1 where c='z';
cz
z
select c ca10 from t1 where c='aaaaaaaaaa';
ca10
aaaaaaaaaa
select c cb20 from t1 where c=repeat('b',20);
cb20
bbbbbbbbbbbbbbbbbbbb
drop table t1;
create table t1 (c varchar(30) character set utf8, unique(c(10))) engine=innodb;
Warnings:
Warning	1286	Unknown storage engine 'innodb'
insert into t1 values ('1'),('2'),('3'),('x'),('y'),('z');
insert into t1 values ('aaaaaaaaaa');
insert into t1 values ('aaaaaaaaaaa');
ERROR 23000: Duplicate entry 'aaaaaaaaaa' for key 'c'
insert into t1 values ('aaaaaaaaaaaa');
ERROR 23000: Duplicate entry 'aaaaaaaaaa' for key 'c'
insert into t1 values (repeat('b',20));
select c c1 from t1 where c='1';
c1
1
select c c2 from t1 where c='2';
c2
2
select c c3 from t1 where c='3';
c3
3
select c cx from t1 where c='x';
cx
x
select c cy from t1 where c='y';
cy
y
select c cz from t1 where c='z';
cz
z
select c ca10 from t1 where c='aaaaaaaaaa';
ca10
aaaaaaaaaa
select c cb20 from t1 where c=repeat('b',20);
cb20
bbbbbbbbbbbbbbbbbbbb
drop table t1;
create table t1 (c char(3) character set utf8, unique (c(2)));
insert into t1 values ('1'),('2'),('3'),('4'),('x'),('y'),('z');
insert into t1 values ('a');
insert into t1 values ('aa');
insert into t1 values ('aaa');
ERROR 23000: Duplicate entry 'aa' for key 'c'
insert into t1 values ('b');
insert into t1 values ('bb');
insert into t1 values ('bbb');
ERROR 23000: Duplicate entry 'bb' for key 'c'
insert into t1 values ('邪');
insert into t1 values ('邪邪');
insert into t1 values ('邪邪邪');
ERROR 23000: Duplicate entry '邪邪' for key 'c'
insert into t1 values ('斜');
insert into t1 values ('斜斜');
insert into t1 values ('斜斜斜');
ERROR 23000: Duplicate entry '斜斜' for key 'c'
insert into t1 values ('戟');
drop table t1;
create table t1 (c char(3) character set utf8, unique (c(2))) engine=innodb;
Warnings:
Warning	1286	Unknown storage engine 'innodb'
insert into t1 values ('1'),('2'),('3'),('4'),('x'),('y'),('z');
insert into t1 values ('a');
insert into t1 values ('aa');
insert into t1 values ('aaa');
ERROR 23000: Duplicate entry 'aa' for key 'c'
insert into t1 values ('b');
insert into t1 values ('bb');
insert into t1 values ('bbb');
ERROR 23000: Duplicate entry 'bb' for key 'c'
insert into t1 values ('邪');
insert into t1 values ('邪邪');
insert into t1 values ('邪邪邪');
ERROR 23000: Duplicate entry '邪邪' for key 'c'
insert into t1 values ('斜');
insert into t1 values ('斜斜');
insert into t1 values ('斜斜斜');
ERROR 23000: Duplicate entry '斜斜' for key 'c'
insert into t1 values ('戟');
drop table t1;
create table t1 (
c char(10) character set utf8,
unique key a using hash (c(1))
) engine=heap;
Warnings:
Warning	1286	Unknown storage engine 'heap'
insert into t1 values ('a'),('b'),('c'),('d'),('e'),('f');
insert into t1 values ('aa');
ERROR 23000: Duplicate entry 'a' for key 'a'
insert into t1 values ('aaa');
ERROR 23000: Duplicate entry 'a' for key 'a'
insert into t1 values ('斜');
insert into t1 values ('斜斜');
ERROR 23000: Duplicate entry '斜' for key 'a'
insert into t1 values ('斜斜斜');
ERROR 23000: Duplicate entry '斜' for key 'a'
select c as c_all from t1 order by c;
c_all
a
b
c
d
e
f
斜
select c as c_a from t1 where c='a';
c_a
a
select c as c_a from t1 where c='斜';
c_a
斜
drop table t1;
create table t1 (
c char(10) character set utf8,
unique key a using btree (c(1))
) engine=heap;
Warnings:
Warning	1286	Unknown storage engine 'heap'
insert into t1 values ('a'),('b'),('c'),('d'),('e'),('f');
insert into t1 values ('aa');
ERROR 23000: Duplicate entry 'a' for key 'a'
insert into t1 values ('aaa');
ERROR 23000: Duplicate entry 'a' for key 'a'
insert into t1 values ('斜');
insert into t1 values ('斜斜');
ERROR 23000: Duplicate entry '斜' for key 'a'
insert into t1 values ('斜斜斜');
ERROR 23000: Duplicate entry '斜' for key 'a'
select c as c_all from t1 order by c;
c_all
a
b
c
d
e
f
斜
select c as c_a from t1 where c='a';
c_a
a
select c as c_a from t1 where c='斜';
c_a
斜
drop table t1;
create table t1 (
c char(10) character set utf8,
unique key a (c(1))
) engine=innodb;
Warnings:
Warning	1286	Unknown storage engine 'innodb'
insert into t1 values ('a'),('b'),('c'),('d'),('e'),('f');
insert into t1 values ('aa');
ERROR 23000: Duplicate entry 'a' for key 'a'
insert into t1 values ('aaa');
ERROR 23000: Duplicate entry 'a' for key 'a'
insert into t1 values ('斜');
insert into t1 values ('斜斜');
ERROR 23000: Duplicate entry '斜' for key 'a'
insert into t1 values ('斜斜斜');
ERROR 23000: Duplicate entry '斜' for key 'a'
select c as c_all from t1 order by c;
c_all
a
b
c
d
e
f
斜
select c as c_a from t1 where c='a';
c_a
a
select c as c_a from t1 where c='斜';
c_a
斜
drop table t1;
create table t1 (c varchar(30) character set utf8 collate utf8_bin, unique(c(10)));
insert into t1 values ('1'),('2'),('3'),('x'),('y'),('z');
insert into t1 values ('aaaaaaaaaa');
insert into t1 values ('aaaaaaaaaaa');
ERROR 23000: Duplicate entry 'aaaaaaaaaa' for key 'c'
insert into t1 values ('aaaaaaaaaaaa');
ERROR 23000: Duplicate entry 'aaaaaaaaaa' for key 'c'
insert into t1 values (repeat('b',20));
select c c1 from t1 where c='1';
c1
1
select c c2 from t1 where c='2';
c2
2
select c c3 from t1 where c='3';
c3
3
select c cx from t1 where c='x';
cx
x
select c cy from t1 where c='y';
cy
y
select c cz from t1 where c='z';
cz
z
select c ca10 from t1 where c='aaaaaaaaaa';
ca10
aaaaaaaaaa
select c cb20 from t1 where c=repeat('b',20);
cb20
bbbbbbbbbbbbbbbbbbbb
drop table t1;
create table t1 (c char(3) character set utf8 collate utf8_bin, unique (c(2)));
insert into t1 values ('1'),('2'),('3'),('4'),('x'),('y'),('z');
insert into t1 values ('a');
insert into t1 values ('aa');
insert into t1 values ('aaa');
ERROR 23000: Duplicate entry 'aa' for key 'c'
insert into t1 values ('b');
insert into t1 values ('bb');
insert into t1 values ('bbb');
ERROR 23000: Duplicate entry 'bb' for key 'c'
insert into t1 values ('邪');
insert into t1 values ('邪邪');
insert into t1 values ('邪邪邪');
ERROR 23000: Duplicate entry '邪邪' for key 'c'
insert into t1 values ('斜');
insert into t1 values ('斜斜');
insert into t1 values ('斜斜斜');
ERROR 23000: Duplicate entry '斜斜' for key 'c'
insert into t1 values ('戟');
drop table t1;
create table t1 (
c char(10) character set utf8 collate utf8_bin,
unique key a using hash (c(1))
) engine=heap;
Warnings:
Warning	1286	Unknown storage engine 'heap'
insert into t1 values ('a'),('b'),('c'),('d'),('e'),('f');
insert into t1 values ('aa');
ERROR 23000: Duplicate entry 'a' for key 'a'
insert into t1 values ('aaa');
ERROR 23000: Duplicate entry 'a' for key 'a'
insert into t1 values ('斜');
insert into t1 values ('斜斜');
ERROR 23000: Duplicate entry '斜' for key 'a'
insert into t1 values ('斜斜斜');
ERROR 23000: Duplicate entry '斜' for key 'a'
select c as c_all from t1 order by c;
c_all
a
b
c
d
e
f
斜
select c as c_a from t1 where c='a';
c_a
a
select c as c_a from t1 where c='斜';
c_a
斜
drop table t1;
create table t1 (
c char(10) character set utf8 collate utf8_bin,
unique key a using btree (c(1))
) engine=heap;
Warnings:
Warning	1286	Unknown storage engine 'heap'
insert into t1 values ('a'),('b'),('c'),('d'),('e'),('f');
insert into t1 values ('aa');
ERROR 23000: Duplicate entry 'a' for key 'a'
insert into t1 values ('aaa');
ERROR 23000: Duplicate entry 'a' for key 'a'
insert into t1 values ('斜');
insert into t1 values ('斜斜');
ERROR 23000: Duplicate entry '斜' for key 'a'
insert into t1 values ('斜斜斜');
ERROR 23000: Duplicate entry '斜' for key 'a'
select c as c_all from t1 order by c;
c_all
a
b
c
d
e
f
斜
select c as c_a from t1 where c='a';
c_a
a
select c as c_a from t1 where c='斜';
c_a
斜
drop table t1;
create table t1 (
c char(10) character set utf8 collate utf8_bin,
unique key a (c(1))
) engine=innodb;
Warnings:
Warning	1286	Unknown storage engine 'innodb'
insert into t1 values ('a'),('b'),('c'),('d'),('e'),('f');
insert into t1 values ('aa');
ERROR 23000: Duplicate entry 'a' for key 'a'
insert into t1 values ('aaa');
ERROR 23000: Duplicate entry 'a' for key 'a'
insert into t1 values ('斜');
insert into t1 values ('斜斜');
ERROR 23000: Duplicate entry '斜' for key 'a'
insert into t1 values ('斜斜斜');
ERROR 23000: Duplicate entry '斜' for key 'a'
select c as c_all from t1 order by c;
c_all
a
b
c
d
e
f
斜
select c as c_a from t1 where c='a';
c_a
a
select c as c_a from t1 where c='斜';
c_a
斜
drop table t1;
create table t1 (
str varchar(255) character set utf8 not null,
key str  (str(2))
) engine=myisam;
Warnings:
Warning	1286	Unknown storage engine 'myisam'
INSERT INTO t1 VALUES ('str');
INSERT INTO t1 VALUES ('str2');
select * from t1 where str='str';
str
str
drop table t1;
create table t1 (
str varchar(255) character set utf8 not null,
key str  (str(2))
) engine=innodb;
Warnings:
Warning	1286	Unknown storage engine 'innodb'
INSERT INTO t1 VALUES ('str');
INSERT INTO t1 VALUES ('str2');
select * from t1 where str='str';
str
str
drop table t1;
create table t1 (
str varchar(255) character set utf8 not null,
key str using btree (str(2))
) engine=heap;
Warnings:
Warning	1286	Unknown storage engine 'heap'
INSERT INTO t1 VALUES ('str');
INSERT INTO t1 VALUES ('str2');
select * from t1 where str='str';
str
str
drop table t1;
create table t1 (
str varchar(255) character set utf8 not null,
key str using hash (str(2))
) engine=heap;
Warnings:
Warning	1286	Unknown storage engine 'heap'
INSERT INTO t1 VALUES ('str');
INSERT INTO t1 VALUES ('str2');
select * from t1 where str='str';
str
str
drop table t1;
create table t1 (
str varchar(255) character set utf8 not null,
key str (str(2))
) engine=innodb;
Warnings:
Warning	1286	Unknown storage engine 'innodb'
INSERT INTO t1 VALUES ('str');
INSERT INTO t1 VALUES ('str2');
select * from t1 where str='str';
str
str
drop table t1;
CREATE TABLE t1 (a varchar(32) BINARY) CHARACTER SET utf8;
INSERT INTO t1 VALUES ('test');
SELECT a FROM t1 WHERE a LIKE '%te';
a
DROP TABLE t1;
SET NAMES utf8;
CREATE TABLE t1 (
subject varchar(255) character set utf8 collate utf8_unicode_ci,
p varchar(15) character set utf8
) ENGINE=InnoDB DEFAULT CHARSET=latin1;
Warnings:
Warning	1286	Unknown storage engine 'InnoDB'
INSERT INTO t1 VALUES ('璋峰窛淇婁簩銇ㄧ敵銇椼伨銇欍亴銆併偆銉炽偪銉笺儘銉冦儓浜堢磩銇細鍝＄櫥閷层倰銇椼伨銇椼仧銇ㄣ亾銈嶃€併儭銉笺儷銈儔銉偣銈掗枔閬曘亪銇︺仐銇俱亜浼氬摗锛╋激銇屽彈銇戝彇銈嬨亾銇ㄣ亴鍑烘潵銇俱仜銈撱仹銇椼仧銆傞枔閬曘亪銈儔銉偣銇痶銈掓浉銇嶈炯銇裤伨銇椼仧銆傘仼銇嗐仚銈屻伆銈堛亜銇с仚銇嬶紵 銇濄伄浠栥€佷綇鎵€绛夈伅闁撻仌銇堛亗銈娿伨銇涖倱銆傞€ｇ怠銇忋仩銇曘亜銆傘倛銈嶃仐銇忋亰椤樸亜銇椼伨銇欍€俶(__)m','040312-000057');
INSERT INTO t1 VALUES ('aaa','bbb');
SELECT length(subject) FROM t1;
length(subject)
614
3
SELECT length(subject) FROM t1 ORDER BY 1;
length(subject)
3
614
DROP TABLE t1;
CREATE TABLE t1 (
id       int unsigned NOT NULL auto_increment,
list_id  smallint unsigned NOT NULL,
term     TEXT NOT NULL,
PRIMARY KEY(id),
INDEX(list_id, term(4))
) ENGINE=MYISAM CHARSET=utf8;
Warnings:
Warning	1286	Unknown storage engine 'MYISAM'
INSERT INTO t1 SET list_id = 1, term = "letterc";
INSERT INTO t1 SET list_id = 1, term = "letterb";
INSERT INTO t1 SET list_id = 1, term = "lettera";
INSERT INTO t1 SET list_id = 1, term = "letterd";
SELECT id FROM t1 WHERE (list_id = 1) AND (term = "letterc");
id
1
SELECT id FROM t1 WHERE (list_id = 1) AND (term = "letterb");
id
2
SELECT id FROM t1 WHERE (list_id = 1) AND (term = "lettera");
id
3
SELECT id FROM t1 WHERE (list_id = 1) AND (term = "letterd");
id
4
DROP TABLE t1;
SET NAMES latin1;
CREATE TABLE t1 (
id int unsigned NOT NULL auto_increment,
list_id smallint unsigned NOT NULL,
term text NOT NULL,
PRIMARY KEY(id),
INDEX(list_id, term(19))
) ENGINE=MyISAM CHARSET=utf8;
Warnings:
Warning	1286	Unknown storage engine 'MyISAM'
INSERT INTO t1 set list_id = 1, term = "test閠est";
INSERT INTO t1 set list_id = 1, term = "testetest";
INSERT INTO t1 set list_id = 1, term = "test鑤est";
SELECT id, term FROM t1 where (list_id = 1) AND (term = "test閠est");
id	term
1	test閠est
SELECT id, term FROM t1 where (list_id = 1) AND (term = "testetest");
id	term
2	testetest
SELECT id, term FROM t1 where (list_id = 1) AND (term = "test鑤est");
id	term
3	test鑤est
DROP TABLE t1;
set names utf8;
create table t1 (
a int primary key,
b varchar(6),
index b3(b(3))
) engine=innodb character set=utf8;
Warnings:
Warning	1286	Unknown storage engine 'innodb'
insert into t1 values(1,'foo'),(2,'foobar');
select * from t1 where b like 'foob%';
a	b
2	foobar
alter table t1 engine=innodb;
Warnings:
Warning	1286	Unknown storage engine 'innodb'
select * from t1 where b like 'foob%';
a	b
2	foobar
drop table t1;
create table t1 (
a enum('锌械褌褟','胁邪褋褟','邪薪褞褌邪') character set utf8 not null default '邪薪褞褌邪',
b set('锌械褌褟','胁邪褋褟','邪薪褞褌邪') character set utf8 not null default '邪薪褞褌邪'
);
create table t2 select concat(a,_utf8'') as a, concat(b,_utf8'')as b from t1;
drop table t2;
drop table t1;
select 'c' like '\_' as want0;
want0
0
SELECT SUBSTR('胁邪褋褟',-2);
SUBSTR('胁邪褋褟',-2)
褋褟
create table t1 (id integer, a varchar(100) character set utf8 collate utf8_unicode_ci);
insert into t1 values (1, 'Test');
select * from t1 where soundex(a) = soundex('Test');
id	a
1	Test
select * from t1 where soundex(a) = soundex('TEST');
id	a
1	Test
select * from t1 where soundex(a) = soundex('test');
id	a
1	Test
drop table t1;
select soundex(_utf8 0xE99885E8A788E99A8FE697B6E69BB4E696B0E79A84E696B0E997BB);
soundex(_utf8 0xE99885E8A788E99A8FE697B6E69BB4E696B0E79A84E696B0E997BB)

select hex(soundex(_utf8 0xE99885E8A788E99A8FE697B6E69BB4E696B0E79A84E696B0E997BB));
hex(soundex(_utf8 0xE99885E8A788E99A8FE697B6E69BB4E696B0E79A84E696B0E997BB))

select soundex(_utf8 0xD091D092D093);
soundex(_utf8 0xD091D092D093)

select hex(soundex(_utf8 0xD091D092D093));
hex(soundex(_utf8 0xD091D092D093))

SET collation_connection='utf8_general_ci';
create table t1 select repeat('a',4000) a;
delete from t1;
insert into t1 values ('a'), ('a '), ('a\t');
select collation(a),hex(a) from t1 order by a;
collation(a)	hex(a)
utf8mb4_general_ci	6109
utf8mb4_general_ci	61
utf8mb4_general_ci	6120
drop table t1;
select @@collation_connection;
@@collation_connection
utf8mb4_general_ci
create table t1 ROW_FORMAT=DYNAMIC select repeat('a',50) as c1 ;
insert into t1 values('abcdef');
insert into t1 values('_bcdef');
insert into t1 values('a_cdef');
insert into t1 values('ab_def');
insert into t1 values('abc_ef');
insert into t1 values('abcd_f');
insert into t1 values('abcde_');
select c1 as c1u from t1 where c1 like 'ab\_def';
c1u
ab_def
select c1 as c2h from t1 where c1 like 'ab#_def' escape '#';
c2h
ab_def
drop table t1;
"BEGIN ctype_german.inc"
drop table if exists t1;
create table t1 as select repeat(' ', 64) as s1;
select collation(s1) from t1;
collation(s1)
utf8mb4_general_ci
delete from t1;
INSERT INTO t1 VALUES ('ud'),('uf');
INSERT INTO t1 VALUES ('od'),('of');
INSERT INTO t1 VALUES ('e');
INSERT INTO t1 VALUES ('ad'),('af');
insert into t1 values ('a'),('ae'),(_latin1 0xE4);
insert into t1 values ('o'),('oe'),(_latin1 0xF6);
insert into t1 values ('s'),('ss'),(_latin1 0xDF);
insert into t1 values ('u'),('ue'),(_latin1 0xFC);
INSERT INTO t1 VALUES (_latin1 0xE6), (_latin1 0xC6);
INSERT INTO t1 VALUES (_latin1 0x9C), (_latin1 0x8C);
select s1, hex(s1) from t1 order by s1, binary s1;
s1	hex(s1)
a	61
ä	C3A4
ad	6164
ae	6165
af	6166
e	65
o	6F
ö	C3B6
od	6F64
oe	6F65
of	6F66
s	73
ß	C39F
ss	7373
u	75
ü	C3BC
ud	7564
ue	7565
uf	7566
Æ	C386
æ	C3A6
Œ	C592
œ	C593
select group_concat(s1 order by binary s1) from t1 group by s1;
group_concat(s1 order by binary s1)
oe
Æ,æ
s,ß
ue
Œ,œ
u,ü
ud
ad
of
ae
uf
a,ä
od
o,ö
af
ss
e
SELECT s1, hex(s1), hex(weight_string(s1)) FROM t1 ORDER BY s1, BINARY(s1);
s1	hex(s1)	hex(weight_string(s1))
a	61	0041
ä	C3A4	0041
ad	6164	00410044
ae	6165	00410045
af	6166	00410046
e	65	0045
o	6F	004F
ö	C3B6	004F
od	6F64	004F0044
oe	6F65	004F0045
of	6F66	004F0046
s	73	0053
ß	C39F	0053
ss	7373	00530053
u	75	0055
ü	C3BC	0055
ud	7564	00550044
ue	7565	00550045
uf	7566	00550046
Æ	C386	00C6
æ	C3A6	00C6
Œ	C592	0152
œ	C593	0152
SELECT s1, hex(s1) FROM t1 WHERE s1='ae' ORDER BY s1, BINARY(s1);
s1	hex(s1)
ae	6165
drop table t1;
"END ctype_german.inc"
SET collation_connection='utf8_bin';
create table t1 select repeat('a',4000) a;
delete from t1;
insert into t1 values ('a'), ('a '), ('a\t');
select collation(a),hex(a) from t1 order by a;
collation(a)	hex(a)
utf8mb4_bin	6109
utf8mb4_bin	61
utf8mb4_bin	6120
drop table t1;
select @@collation_connection;
@@collation_connection
utf8mb4_bin
create table t1 ROW_FORMAT=DYNAMIC select repeat('a',50) as c1 ;
insert into t1 values('abcdef');
insert into t1 values('_bcdef');
insert into t1 values('a_cdef');
insert into t1 values('ab_def');
insert into t1 values('abc_ef');
insert into t1 values('abcd_f');
insert into t1 values('abcde_');
select c1 as c1u from t1 where c1 like 'ab\_def';
c1u
ab_def
select c1 as c2h from t1 where c1 like 'ab#_def' escape '#';
c2h
ab_def
drop table t1;
CREATE TABLE t1 (
user varchar(255) NOT NULL default ''
) ENGINE=MyISAM DEFAULT CHARSET=latin1;
Warnings:
Warning	1286	Unknown storage engine 'MyISAM'
INSERT INTO t1 VALUES ('one'),('two');
SELECT CHARSET('a');
CHARSET('a')
utf8mb4
SELECT user, CONCAT('<', user, '>') AS c FROM t1;
user	c
one	<one>
two	<two>
DROP TABLE t1;
create table t1 (f1 varchar(1) not null) default charset utf8;
insert into t1 values (''), ('');
select concat(concat(_latin1'->',f1),_latin1'<-') from t1;
concat(concat(_latin1'->',f1),_latin1'<-')
-><-
-><-
drop table t1;
select convert(_koi8r'? using utf8) < convert(_koi8r'? using utf8);
ERROR 42000: You have an error in your SQL syntax; check the manual that corresponds to your OceanBase version for the right syntax to use near ''? using utf8) < convert(_koi8r'? using utf8)' at line 1
set names latin1;
create table t1 (a varchar(10)) character set utf8;
insert into t1 values ('test');
select ifnull(a,'') from t1;
ifnull(a,'')
test
drop table t1;
select repeat(_utf8'+',3) as h union select NULL;
h
NULL
+++
select ifnull(NULL, _utf8'string');
ifnull(NULL, _utf8'string')
string
create table t1 (a varchar(255)) default character set utf8;
insert into t1 values (1.0);
drop table t1;
create table t1 (
id int not null,
city varchar(20) not null,
key (city(7),id)
) character set=utf8;
insert into t1 values (1,'Durban North');
insert into t1 values (2,'Durban');
select * from t1 where city = 'Durban';
id	city
2	Durban
select * from t1 where city = 'Durban ';
id	city
2	Durban
drop table t1;
create table t1 (x set('A', 'B') default 0) character set utf8;
ERROR 42000: Invalid default value for 'x'
create table t1 (x enum('A', 'B') default 0) character set utf8;
ERROR 42000: Invalid default value for 'x'
SET sql_mode = 'NO_ENGINE_SUBSTITUTION';
SET NAMES UTF8;
CREATE TABLE t1 (
`id` int(20) NOT NULL auto_increment,
`country` varchar(100) NOT NULL default '',
`shortcode` varchar(100) NOT NULL default '',
`operator` varchar(100) NOT NULL default '',
`momid` varchar(30) NOT NULL default '',
`keyword` varchar(160) NOT NULL default '',
`content` varchar(160) NOT NULL default '',
`second_token` varchar(160) default NULL,
`gateway_id` int(11) NOT NULL default '0',
`created` datetime NOT NULL default '0000-00-00 00:00:00',
`msisdn` varchar(15) NOT NULL default '',
PRIMARY KEY  (`id`),
UNIQUE KEY `MSCCSPK_20030521130957121` (`momid`),
KEY `IX_mobile_originated_message_keyword` (`keyword`),
KEY `IX_mobile_originated_message_created` (`created`),
KEY `IX_mobile_originated_message_support` (`msisdn`,`momid`,`keyword`,`gateway_id`,`created`)
) ENGINE=MyISAM DEFAULT CHARSET=utf8;
Warnings:
Warning	1286	Unknown storage engine 'MyISAM'
INSERT INTO t1 VALUES 
(1,'blah','464','aaa','fkc1c9ilc20x0hgae7lx6j09','ERR','ERR 袠屑褉懈.袗褎懈屑懈屑.袗械懈屑懈屑褉懈屑写屑褉懈屑褉屑褉懈褉芯褉 懈屑褉懈屑褉懈屑褉懈屑褉 懈屑褉懈写屑 懈褉斜写薪褉懈屑褉褎屑褉懈褉懈褉懈屑褉褎屑褎屑懈屑.袗写.袛 懈屑写懈屑褉懈屑褉邪写.袗写懈屑褉懈屑褉懈屑褉屑写懈褉懈屑褉懈屑褉懈屑褉 屑.袛邪写懈屑褎褕褜屑褉懈屑写 懈屑.袗写懈屑懈屑褉薪 懈屑邪写屑懈','袠袦袪袠.袗肖袠袦袠袦.袗袝袠袦袠袦袪袠袦袛袦袪袠袦袪袦袪袠袪袨袪',3,'2005-06-01 17:30:43','1234567890'),
(2,'blah','464','aaa','haxpl2ilc20x00bj4tt2m5ti','11','11 g','G',3,'2005-06-02 22:43:10','1234567890');
CREATE TABLE t2 (
`msisdn` varchar(15) NOT NULL default '',
`operator_id` int(11) NOT NULL default '0',
`created` datetime NOT NULL default '0000-00-00 00:00:00',
UNIQUE KEY `PK_user` (`msisdn`)
) ENGINE=InnoDB DEFAULT CHARSET=utf8;
Warnings:
Warning	1286	Unknown storage engine 'InnoDB'
INSERT INTO t2 VALUES ('1234567890',2,'2005-05-24 13:53:25');
SELECT content, t2.msisdn FROM t1, t2 WHERE t1.msisdn = '1234567890';
content	msisdn
11 g	1234567890
ERR 袠屑褉懈.袗褎懈屑懈屑.袗械懈屑懈屑褉懈屑写屑褉懈屑褉屑褉懈褉芯褉 懈屑褉懈屑褉懈屑褉懈屑褉 懈屑褉懈写屑 懈褉斜写薪褉懈屑褉褎屑褉懈褉懈褉懈屑褉褎屑褎屑懈屑.袗写.袛 懈屑写懈屑褉懈屑褉邪写.袗写懈屑褉懈屑褉懈屑褉屑写懈褉懈屑褉懈屑褉懈屑褉 屑.袛邪写懈屑褎褕褜屑褉懈屑写 懈屑.袗写懈屑懈屑褉薪 懈屑邪写屑懈	1234567890
DROP TABLE t1,t2;
SET sql_mode = default;
SET sql_mode = 'NO_ENGINE_SUBSTITUTION';
create table t1 (a char(20) character set utf8);
insert into t1 values ('123456'),('邪薪写褉械泄');
alter table t1 modify a char(2) character set utf8;
select char_length(a), length(a), a from t1 order by a;
char_length(a)	length(a)	a
2	2	12
2	6	邪薪
drop table t1;
SET sql_mode = default;
set names utf8;
select 'andre%' like 'andre帽%' escape '帽';
'andre%' like 'andre帽%' escape '帽'
1
set names utf8;
select 'a\\' like 'a\\';
'a\\' like 'a\\'
1
select 'aa\\' like 'a%\\';
'aa\\' like 'a%\\'
1
create table t1 (a char(10), key(a)) character set utf8;
insert into t1 values ("a"),("abc"),("abcd"),("hello"),("test");
select * from t1 where a like "abc%";
a
abc
abcd
select * from t1 where a like concat("abc","%");
a
abc
abcd
select * from t1 where a like "ABC%";
a
abc
abcd
select * from t1 where a like "test%";
a
test
select * from t1 where a like "te_t";
a
test
select * from t1 where a like "%a%";
a
a
abc
abcd
select * from t1 where a like "%abcd%";
a
abcd
select * from t1 where a like "%abc\d%";
a
abcd
drop table t1;
CREATE TABLE t1 (
a varchar(255) NOT NULL default '',
KEY a (a)
) ENGINE=MyISAM DEFAULT CHARSET=utf8 COLLATE utf8_general_ci;
Warnings:
Warning	1286	Unknown storage engine 'MyISAM'
insert into t1 values (_utf8 0xe880bd);
insert into t1 values (_utf8 0x5b);
select hex(a) from t1;
hex(a)
5B
E880BD
drop table t1;
set names 'latin1';
create table t1 (a varchar(255)) default charset=utf8;
select * from t1 where find_in_set('-1', a);
a
drop table t1;
create table t1 (a int);
insert into t1 values (48),(49),(50);
set names utf8;
select distinct char(a) from t1;
char(a)
0
1
2
drop table t1;
CREATE TABLE t1 (t TINYTEXT CHARACTER SET utf8);
INSERT INTO t1 VALUES(REPEAT('a', 100));
CREATE TEMPORARY TABLE t2 SELECT COALESCE(t) AS bug FROM t1;
ERROR 0A000: MySQL compatible temporary table not supported
DROP TABLE t1;
CREATE TABLE t1 (item varchar(255)) default character set utf8;
INSERT INTO t1 VALUES (N'\\');
INSERT INTO t1 VALUES (_utf8'\\');
INSERT INTO t1 VALUES (N'Cote d\'Ivoire');
INSERT INTO t1 VALUES (_utf8'Cote d\'Ivoire');
SELECT item FROM t1 ORDER BY item;
item
Cote d'Ivoire
Cote d'Ivoire
\
\
DROP TABLE t1;
SET NAMES utf8;
DROP TABLE IF EXISTS t1;
Warnings:
Note	1051	Unknown table 'test.t1'
CREATE TABLE t1(a VARCHAR(255), KEY(a)) ENGINE=MyISAM DEFAULT CHARSET=utf8;
Warnings:
Warning	1286	Unknown storage engine 'MyISAM'
INSERT INTO t1 VALUES('uuABCDEFGHIGKLMNOPRSTUVWXYZ虉bbbbbbbbbbbbbbbbbbbbbbbbbbbbbbbbbbbbbbbbbbbbbbbbbbbbbbbbbbbbbbbbbbbbbbbbbbbbbbbbbbbbbbbbbbbbbbbbbbbbbbbbbbbbbbbbbbbbbbbbbbbbbbbbbbbbbbbbbbbbbbbbbbbbbbbbbbbbbbbbbbbbbbbbbbbbbbbbbbbbbbbbbbbbbbbbbbbbbbbbbbbbbbbbbbbbbbbbbbbbbbbbbbb');
INSERT INTO t1 VALUES('uu');
INSERT INTO t1 VALUES('uU');
INSERT INTO t1 VALUES('uu');
INSERT INTO t1 VALUES('uuABC');
INSERT INTO t1 VALUES('UuABC');
INSERT INTO t1 VALUES('uuABC');
alter table t1 add b int;
INSERT INTO t1 VALUES('uuABCDEFGHIGKLMNOPRSTUVWXYZ虉bbbbbbbbbbbbbbbbbbbbbbbbbbbbbbbbbbbbbbbbbbbbbbbbbbbbbbbbbbbbbbbbbbbbbbbbbbbbbbbbbbbbbbbbbbbbbbbbbbbbbbbbbbbbbbbbbbbbbbbbbbbbbbbbbbbbbbbbbbbbbbbbbbbbbbbbbbbbbbbbbbbbbbbbbbbbbbbbbbbbbbbbbbbbbbbbbbbbbbbbbbbbbbbbbbbbbbbbbbbbbbbbbbb',1);
INSERT INTO t1 VALUES('uuABCDEFGHIGKLMNOPRSTUVWXYZ虉bbbbbbbbbbbbbbbbbbbbbbbbbbbbbbbbbbbbbbbbbbbbbbbbbbbbbbbbbbbbbbbbbbbbbbbbbbbbbbbbbbbbbbbbbbbbbbbbbbbbbbbbbbbbbbbbbbbbbbbbbbbbbbbbbbbbbbbbbbbbbbbbbbbbbbbbbbbbbbbbbbbbbbbbbbbbbbbbbbbbbbbbbbbbbbbbbbbbbbbbbbbbbbbbbbbbbbbbbbbbbbbbbbb',2);
delete from t1 where b=1;
INSERT INTO t1 VALUES('UUABCDEFGHIGKLMNOPRSTUVWXYZ虉bbbbbbbbbbbbbbbbbbbbbbbbbbbbbbbbbbbbbbbbbbbbbbbbbbbbbbbbbbbbbbbbbbbbbbbbbbbbbbbbbbbbbbbbbbbbbbbbbbbbbbbbbbbbbbbbbbbbbbbbbbbbbbbbbbbbbbbbbbbbbbbbbbbbbbbbbbbbbbbbbbbbbbbbbbbbbbbbbbbbbbbbbbbbbbbbbbbbbbbbbbbbbbbbbbbbbbbbbbbbbbbbbbb',1);
INSERT INTO t1 VALUES('uuABCDEFGHIGKLMNOPRSTUVWXYZ虉bbbbbbbbbbbbbbbbbbbbbbbbbbbbbbbbbbbbbbbbbbbbbbbbbbbbbbbbbbbbbbbbbbbbbbbbbbbbbbbbbbbbbbbbbbbbbbbbbbbbbbbbbbbbbbbbbbbbbbbbbbbbbbbbbbbbbbbbbbbbbbbbbbbbbbbbbbbbbbbbbbbbbbbbbbbbbbbbbbbbbbbbbbbbbbbbbbbbbbbbbbbbbbbbbbbbbbbbbbbbbbbbbbb',3);
INSERT INTO t1 VALUES('uuABCDEFGHIGKLMNOPRSTUVWXYZ虉bbbbbbbbbbbbbbbbbbbbbbbbbbbbbbbbbbbbbbbbbbbbbbbbbbbbbbbbbbbbbbbbbbbbbbbbbbbbbbbbbbbbbbbbbbbbbbbbbbbbbbbbbbbbbbbbbbbbbbbbbbbbbbbbbbbbbbbbbbbbbbbbbbbbbbbbbbbbbbbbbbbbbbbbbbbbbbbbbbbbbbbbbbbbbbbbbbbbbbbbbbbbbbbbbbbbbbbbbbbbbbbbbbb',4);
delete from t1 where b=3;
INSERT INTO t1 VALUES('uUABCDEFGHIGKLMNOPRSTUVWXYZ虉bbbbbbbbbbbbbbbbbbbbbbbbbbbbbbbbbbbbbbbbbbbbbbbbbbbbbbbbbbbbbbbbbbbbbbbbbbbbbbbbbbbbbbbbbbbbbbbbbbbbbbbbbbbbbbbbbbbbbbbbbbbbbbbbbbbbbbbbbbbbbbbbbbbbbbbbbbbbbbbbbbbbbbbbbbbbbbbbbbbbbbbbbbbbbbbbbbbbbbbbbbbbbbbbbbbbbbbbbbbbbbbbbbb',3);
drop table t1;
set names utf8;
create table t1 (s1 char(5) character set utf8);
insert into t1 values
('a'),('b'),(null),('眉'),('Y');
create index it1 on t1 (s1);
select s1 as before_delete_general_ci from t1 where s1 like '銉氥儐%';
before_delete_general_ci
delete from t1 where s1 = 'Y';
select s1 as after_delete_general_ci from t1 where s1 like '銉氥儐%';
after_delete_general_ci
drop table t1;
set names utf8;
create table t1 (s1 char(5) character set utf8 collate utf8_unicode_ci);
insert into t1 values
('a'),('b'),(null),('眉'),('Y');
create index it1 on t1 (s1);
select s1 as before_delete_unicode_ci from t1 where s1 like '銉氥儐%';
before_delete_unicode_ci
delete from t1 where s1 = 'Y';
select s1 as after_delete_unicode_ci from t1 where s1 like '銉氥儐%';
after_delete_unicode_ci
drop table t1;
set names utf8;
create table t1 (s1 char(5) character set utf8 collate utf8_bin);
insert into t1 values
('a'),('b'),(null),('眉'),('Y');
create index it1 on t1 (s1);
select s1 as before_delete_bin from t1 where s1 like '銉氥儐%';
before_delete_bin
delete from t1 where s1 = 'Y';
select s1 as after_delete_bin from t1 where s1 like '銉氥儐%';
after_delete_bin
drop table t1;
SET NAMES utf8;
CREATE TABLE t1 (id int PRIMARY KEY,
a varchar(16) collate utf8_unicode_ci NOT NULL default '',
b int,
f varchar(128) default 'XXX',
INDEX (a(4))
) ENGINE=MyISAM DEFAULT CHARSET=utf8 COLLATE=utf8_unicode_ci;
Warnings:
Warning	1286	Unknown storage engine 'MyISAM'
INSERT INTO t1(id, a, b) VALUES
(1, 'cccc', 50), (2, 'cccc', 70), (3, 'cccc', 30),
(4, 'cccc', 30), (5, 'cccc', 20), (6, 'bbbbbb', 40),
(7, 'dddd', 30), (8, 'aaaa', 10), (9, 'aaaa', 50),
(10, 'eeeee', 40), (11, 'bbbbbb', 60);
SELECT id, a, b FROM t1;
id	a	b
1	cccc	50
10	eeeee	40
11	bbbbbb	60
2	cccc	70
3	cccc	30
4	cccc	30
5	cccc	20
6	bbbbbb	40
7	dddd	30
8	aaaa	10
9	aaaa	50
SELECT id, a, b FROM t1 WHERE a BETWEEN 'aaaa' AND 'bbbbbb';
id	a	b
11	bbbbbb	60
6	bbbbbb	40
8	aaaa	10
9	aaaa	50
SELECT id, a FROM t1 WHERE a='bbbbbb';
id	a
11	bbbbbb
6	bbbbbb
SELECT id, a FROM t1 WHERE a='bbbbbb' ORDER BY b;
id	a
6	bbbbbb
11	bbbbbb
DROP TABLE t1;
SET NAMES utf8;
CREATE TABLE t1 (
a CHAR(13) DEFAULT '',
INDEX(a)
) ENGINE=MyISAM DEFAULT CHARSET=utf8 COLLATE=utf8_general_ci;
Warnings:
Warning	1286	Unknown storage engine 'MyISAM'
INSERT INTO t1 VALUES 
('K盲li K盲li 2-4'), ('K盲li K盲li 2-4'),
('K盲li K盲li 2+4'), ('K盲li K盲li 2+4'),
('K盲li K盲li 2-6'), ('K盲li K盲li 2-6');
INSERT INTO t1 SELECT * FROM t1;
CREATE TABLE t2 (
a CHAR(13) DEFAULT '',
INDEX(a)
) ENGINE=MyISAM DEFAULT CHARSET=latin1 COLLATE=latin1_general_ci;
Warnings:
Warning	1286	Unknown storage engine 'MyISAM'
DROP TABLE t2;
CREATE TABLE t2 (
a CHAR(13) DEFAULT '',
INDEX(a)
) ENGINE=MyISAM DEFAULT CHARSET=latin1;
Warnings:
Warning	1286	Unknown storage engine 'MyISAM'
INSERT INTO t2 VALUES
('Kali Kali 2-4'), ('Kali Kali 2-4'),
('Kali Kali 2+4'), ('Kali Kali 2+4'),
('Kali Kali 2-6'), ('Kali Kali 2-6');
INSERT INTO t2 SELECT * FROM t2;
SELECT a FROM t1 WHERE a LIKE 'K盲li K盲li 2+4';
a
K盲li K盲li 2+4
K盲li K盲li 2+4
K盲li K盲li 2+4
K盲li K盲li 2+4
SELECT a FROM t2 WHERE a LIKE 'Kali Kali 2+4';
a
Kali Kali 2+4
Kali Kali 2+4
Kali Kali 2+4
Kali Kali 2+4
DROP TABLE t1,t2;
CREATE TABLE t1 (
a char(255) DEFAULT '', 
KEY(a(10))
) ENGINE=MyISAM DEFAULT CHARSET=utf8 COLLATE=utf8_general_ci;
Warnings:
Warning	1286	Unknown storage engine 'MyISAM'
INSERT INTO t1 VALUES ('K盲li K盲li 2-4');
SELECT * FROM t1 WHERE a LIKE 'K盲li K盲li 2%';
a
K盲li K盲li 2-4
INSERT INTO t1 VALUES ('K盲li K盲li 2-4');
SELECT * FROM t1 WHERE a LIKE 'K盲li K盲li 2%';
a
K盲li K盲li 2-4
K盲li K盲li 2-4
DROP TABLE t1;
CREATE TABLE t1 (
a char(255) DEFAULT ''
) ENGINE=MyISAM DEFAULT CHARSET=utf8 COLLATE=utf8_general_ci;
Warnings:
Warning	1286	Unknown storage engine 'MyISAM'
INSERT INTO t1 VALUES ('K盲li K盲li 2-4');
INSERT INTO t1 VALUES ('K盲li K盲li 2-4');
SELECT * FROM t1 WHERE a LIKE 'K盲li K盲li 2%';
a
K盲li K盲li 2-4
K盲li K盲li 2-4
ALTER TABLE t1 ADD KEY (a(10));
SELECT * FROM t1 WHERE a LIKE 'K盲li K盲li 2%';
a
K盲li K盲li 2-4
K盲li K盲li 2-4
DROP TABLE t1;
SET NAMES latin2;
ERROR 42000: Unknown character set: 'latin2'
CREATE TABLE t1 (
id int(11) NOT NULL default '0',
tid int(11) NOT NULL default '0',
val text NOT NULL,
INDEX idx(tid, val(10))
) ENGINE=MyISAM DEFAULT CHARSET=utf8;
Warnings:
Warning	1286	Unknown storage engine 'MyISAM'
ALTER TABLE t1 DROP KEY idx;
ALTER TABLE t1 ADD KEY idx (tid,val(11));
DROP TABLE t1;
create table t1(a char(200) collate utf8_unicode_ci NOT NULL default '')
default charset=utf8 collate=utf8_unicode_ci;
insert into t1 values (unhex('65')), (unhex('C3A9')), (unhex('65'));
select distinct a from t1;
a
e
select a from t1 group by a;
a
e
drop table t1;
create table t1(a char(10)) default charset utf8;
insert into t1 values ('123'), ('456');
select substr(z.a,-1), z.a from t1 as y join t1 as z on y.a=z.a order by 1;
substr(z.a,-1)	a
3	123
6	456
drop table t1;
SET CHARACTER SET utf8;
CREATE DATABASE crashtest DEFAULT CHARACTER SET utf8 COLLATE utf8_bin;
USE crashtest;
CREATE TABLE crashtest (crash char(10)) DEFAULT CHARSET=utf8;
INSERT INTO crashtest VALUES ('35'), ('36'), ('37');
SELECT * FROM crashtest ORDER BY CHAR(crash USING utf8);
crash
35
36
37
INSERT INTO crashtest VALUES ('-1000');
SELECT * FROM crashtest ORDER BY CHAR(crash USING utf8);
crash
-1000
35
36
37
Warnings:
Warning	1300	Invalid utf8mb4 character string: 'FFFFFC'
DROP TABLE crashtest;
DROP DATABASE crashtest;
USE test;
SET CHARACTER SET default;
CREATE TABLE t1(id varchar(20) NOT NULL) DEFAULT CHARSET=utf8;
INSERT INTO t1 VALUES ('xxx'), ('aa'), ('yyy'), ('aa');
SELECT id FROM t1;
id
xxx
aa
yyy
aa
SELECT DISTINCT id FROM t1;
id
aa
xxx
yyy
SELECT DISTINCT id FROM t1 ORDER BY id;
id
aa
xxx
yyy
DROP TABLE t1;
SET sql_mode = 'NO_ENGINE_SUBSTITUTION';
create table t1 (
a varchar(26) not null
) default character set utf8;
insert into t1 (a) values ('abcdefghijklmnopqrstuvwxyz');
select * from t1;
a
abcdefghijklmnopqrstuvwxyz
alter table t1 change a a varchar(20) character set utf8 not null;
select * from t1;
a
abcdefghijklmnopqrst
alter table t1 change a a char(15) character set utf8 not null;
select * from t1;
a
abcdefghijklmno
alter table t1 change a a char(10) character set utf8 not null;
select * from t1;
a
abcdefghij
alter table t1 change a a varchar(5) character set utf8 not null;
select * from t1;
a
abcde
drop table t1;
create table t1 (
a varchar(4000) not null
) default character set utf8;
insert into t1 values (repeat('a',4000));
alter table t1 change a a varchar(3000) character set utf8 not null;
select length(a) from t1;
length(a)
3000
drop table t1;
SET sql_mode = default;
set names utf8;
select hex(char(1 using utf8));
hex(char(1 using utf8))
01
select char(0xd1,0x8f using utf8);
char(0xd1,0x8f using utf8)
я
select char(0xd18f using utf8);
char(0xd18f using utf8)
я
select char(53647 using utf8);
char(53647 using utf8)
я
select char(0xff,0x8f using utf8);
char(0xff,0x8f using utf8)
NULL
Warnings:
Warning	1300	Invalid utf8mb4 character string: 'FF8F'
select convert(char(0xff,0x8f) using utf8);
convert(char(0xff,0x8f) using utf8)
NULL
Warnings:
Warning	1300	Invalid utf8mb4 character string: 'FF8F'
set sql_mode=traditional;
select char(0xff,0x8f using utf8);
char(0xff,0x8f using utf8)
NULL
Warnings:
Warning	1300	Invalid utf8mb4 character string: 'FF8F'
select char(195 using utf8);
char(195 using utf8)
NULL
Warnings:
Warning	1300	Invalid utf8mb4 character string: 'C3'
select char(196 using utf8);
char(196 using utf8)
NULL
Warnings:
Warning	1300	Invalid utf8mb4 character string: 'C4'
select char(2557 using utf8);
char(2557 using utf8)
NULL
Warnings:
Warning	1300	Invalid utf8mb4 character string: 'FD'
select convert(char(0xff,0x8f) using utf8);
convert(char(0xff,0x8f) using utf8)
NULL
Warnings:
Warning	1300	Invalid utf8mb4 character string: 'FF8F'
select hex(convert(char(2557 using latin1) using utf8));
hex(convert(char(2557 using latin1) using utf8))
select hex(char(195));
hex(char(195))
C3
select hex(char(196));
hex(char(196))
C4
select hex(char(2557));
hex(char(2557))
09FD
set names utf8;
create table t1 (a char(1)) default character set utf8;
create table t2 (a char(1)) default character set utf8;
insert into t1 values('a'),('a'),(0xE38182),(0xE38182);
insert into t1 values('i'),('i'),(0xE38184),(0xE38184);
select * from t1 union distinct select * from t2;
a
a
あ
i
い
drop table t1,t2;
set names utf8;
create table t1 (a char(10), b varchar(10));
insert into t1 values ('bar','kostja');
insert into t1 values ('kostja','bar');
prepare my_stmt from "select * from t1 where a=?";
set @a:='bar';
execute my_stmt using @a;
a	b
bar	kostja
set @a:='kostja';
execute my_stmt using @a;
a	b
kostja	bar
set @a:=null;
execute my_stmt using @a;
a	b
drop table if exists t1;
drop table if exists t1;
drop view if exists v1, v2;
set names utf8;
create table t1(col1 varchar(12) character set utf8 collate utf8_unicode_ci);
insert into t1 values('t1_val');
create view v1 as select 'v1_val' as col1;
select coercibility(col1), collation(col1) from v1;
coercibility(col1)	collation(col1)
4	utf8mb4_general_ci
create view v2 as select col1 from v1 union select col1 from t1;
select coercibility(col1), collation(col1)from v2;
coercibility(col1)	collation(col1)
2	utf8mb4_unicode_ci
2	utf8mb4_unicode_ci
drop view v1, v2;
create view v1 as select 'v1_val' collate utf8_swedish_ci as col1;
drop table t1;
set names utf8;
create table t1 (a varchar(10) character set latin1, b int);
insert into t1 values ('a',1);
select concat(a, if(b>10, N'x', N'y')) from t1;
concat(a, if(b>10, N'x', N'y'))
ay
select concat(a, if(b>10, N'忙', N'脽')) from t1;
concat(a, if(b>10, N'忙', N'脽'))
a?
drop table t1;
set names utf8;
create table t1 (a varchar(10) character set latin1, b int);
insert into t1 values ('a',1);
select concat(a, if(b>10, _utf8'x', _utf8'y')) from t1;
concat(a, if(b>10, _utf8'x', _utf8'y'))
ay
select concat(a, if(b>10, _utf8'忙', _utf8'脽')) from t1;
concat(a, if(b>10, _utf8'忙', _utf8'脽'))
a?
drop table t1;
set names utf8;
create table t1 (a varchar(10) character set latin1, b int);
insert into t1 values ('a',1);
select concat(a, if(b>10, _utf8 0x78, _utf8 0x79)) from t1;
concat(a, if(b>10, _utf8 0x78, _utf8 0x79))
ay
select concat(a, if(b>10, _utf8 0xC3A6, _utf8 0xC3AF)) from t1;
concat(a, if(b>10, _utf8 0xC3A6, _utf8 0xC3AF))
aï
drop table t1;
set names utf8;
create table t1 (a varchar(10) character set latin1, b int);
insert into t1 values ('a',1);
select concat(a, if(b>10, 'x' 'x', 'y' 'y')) from t1;
concat(a, if(b>10, 'x' 'x', 'y' 'y'))
ayy
select concat(a, if(b>10, 'x' '忙', 'y' '脽')) from t1;
concat(a, if(b>10, 'x' '忙', 'y' '脽'))
ay?
drop table t1;
CREATE TABLE t1 (
colA int(11) NOT NULL,
colB varchar(255) character set utf8 NOT NULL,
PRIMARY KEY  (colA)
) ENGINE=InnoDB DEFAULT CHARSET=latin1;
Warnings:
Warning	1286	Unknown storage engine 'InnoDB'
INSERT INTO t1 (colA, colB) VALUES (1, 'foo'), (2, 'foo bar');
CREATE TABLE t2 (
colA int(11) NOT NULL,
colB varchar(255) character set utf8 NOT NULL,
KEY bad  (colA,colB(3))
) ENGINE=InnoDB DEFAULT CHARSET=latin1;
Warnings:
Warning	1286	Unknown storage engine 'InnoDB'
INSERT INTO t2 (colA, colB) VALUES (1, 'foo'),(2, 'foo bar');
SELECT * FROM t1 JOIN t2 ON t1.colA=t2.colA AND t1.colB=t2.colB
WHERE t1.colA < 3;
colA	colB	colA	colB
1	foo	1	foo
2	foo bar	2	foo bar
DROP TABLE t1, t2;
SELECT '薪1234567890' UNION SELECT _binary '1';
薪1234567890
薪1234567890
1
SELECT '薪1234567890' UNION SELECT 1;
薪1234567890
薪1234567890
1
SELECT '1' UNION SELECT '薪1234567890';
1
1
薪1234567890
SELECT 1 UNION SELECT '薪1234567890';
1
1
薪1234567890
CREATE TABLE t1 (c VARCHAR(11)) CHARACTER SET utf8;
CREATE TABLE t2 (b CHAR(1) CHARACTER SET binary, i INT);
INSERT INTO t1 (c) VALUES ('薪1234567890');
INSERT INTO t2 (b, i) VALUES ('1', 1);
SELECT c FROM t1 UNION SELECT b FROM t2;
c
薪1234567890
1
SELECT c FROM t1 UNION SELECT i FROM t2;
c
薪1234567890
1
SELECT b FROM t2 UNION SELECT c FROM t1;
b
1
薪1234567890
SELECT i FROM t2 UNION SELECT c FROM t1;
i
1
薪1234567890
DROP TABLE t1, t2;
set sql_mode=traditional;
select hex(char(0xFF using utf8));
hex(char(0xFF using utf8))
NULL
Warnings:
Warning	1300	Invalid utf8mb4 character string: 'FF'
select hex(convert(0xFF using utf8));
hex(convert(0xFF using utf8))
NULL
Warnings:
Warning	1300	Invalid utf8mb4 character string: 'FF'
select hex(_utf8 0x616263FF);
ERROR HY000: Invalid utf8mb4 character string: 'FF'
select hex(_utf8 X'616263FF');
ERROR HY000: Invalid utf8mb4 character string: 'FF'
select hex(_utf8 B'001111111111');
ERROR HY000: Invalid utf8mb4 character string: 'FF'
select (_utf8 X'616263FF');
ERROR HY000: Invalid utf8mb4 character string: 'FF'
set sql_mode=default;
select hex(char(0xFF using utf8));
hex(char(0xFF using utf8))
NULL
Warnings:
Warning	1300	Invalid utf8mb4 character string: 'FF'
select hex(convert(0xFF using utf8));
hex(convert(0xFF using utf8))
NULL
Warnings:
Warning	1300	Invalid utf8mb4 character string: 'FF'
select hex(_utf8 0x616263FF);
ERROR HY000: Invalid utf8mb4 character string: 'FF'
select hex(_utf8 X'616263FF');
ERROR HY000: Invalid utf8mb4 character string: 'FF'
select hex(_utf8 B'001111111111');
ERROR HY000: Invalid utf8mb4 character string: 'FF'
select (_utf8 X'616263FF');
ERROR HY000: Invalid utf8mb4 character string: 'FF'
#
# Bug#44131 Binary-mode "order by" returns records in incorrect order for UTF-8 strings
#
CREATE TABLE t1 (id int not null primary key, name varchar(10)) character set utf8;
SELECT * FROM t1 ORDER BY BINARY(name);
id	name
DROP TABLE t1;
CREATE TABLE t1 (a INT NOT NULL, b INT NOT NULL);
INSERT INTO t1 VALUES (70000, 1092), (70001, 1085), (70002, 1065);
SELECT CONVERT(a, CHAR), CONVERT(b, CHAR) FROM t1 GROUP BY b;
CONVERT(a, CHAR)	CONVERT(b, CHAR)
70000	1092
70001	1085
70002	1065
SELECT CONVERT(a, CHAR), CONVERT(b, CHAR) FROM t1;
CONVERT(a, CHAR)	CONVERT(b, CHAR)
70000	1092
70001	1085
70002	1065
ALTER TABLE t1 ADD UNIQUE (b);
SELECT CONVERT(a, CHAR), CONVERT(b, CHAR) FROM t1 GROUP BY b;
CONVERT(a, CHAR)	CONVERT(b, CHAR)
70000	1092
70001	1085
70002	1065
DROP INDEX b ON t1;
SELECT CONVERT(a, CHAR), CONVERT(b, CHAR) FROM t1 GROUP BY b;
CONVERT(a, CHAR)	CONVERT(b, CHAR)
70000	1092
70001	1085
70002	1065
ALTER TABLE t1 ADD INDEX (b);
SELECT CONVERT(a, CHAR), CONVERT(b, CHAR) from t1 GROUP BY b;
CONVERT(a, CHAR)	CONVERT(b, CHAR)
70000	1092
70001	1085
70002	1065
DROP TABLE t1;
End of 5.0 tests
SELECT LENGTH(RPAD(0.0115E88, 61297, _utf8'褟褝褞褟'));
LENGTH(RPAD(0.0115E88, 61297, _utf8'褟褝褞褟'))
183877
SELECT LENGTH(RPAD(0.0115E88, 61297, _utf8'泄褑褍褟'));
LENGTH(RPAD(0.0115E88, 61297, _utf8'泄褑褍褟'))
183877
SELECT HEX(RPAD(0x20, 2, _utf8 0xD18F));
HEX(RPAD(0x20, 2, _utf8 0xD18F))
20D1
SELECT HEX(RPAD(0x20, 4, _utf8 0xD18F));
HEX(RPAD(0x20, 4, _utf8 0xD18F))
20D18FD1
SELECT HEX(LPAD(0x20, 2, _utf8 0xD18F));
HEX(LPAD(0x20, 2, _utf8 0xD18F))
D120
SELECT HEX(LPAD(0x20, 4, _utf8 0xD18F));
HEX(LPAD(0x20, 4, _utf8 0xD18F))
D18FD120
SELECT HEX(RPAD(_utf8 0xD18F, 3, 0x20));
HEX(RPAD(_utf8 0xD18F, 3, 0x20))
D18F20
SELECT HEX(LPAD(_utf8 0xD18F, 3, 0x20));
HEX(LPAD(_utf8 0xD18F, 3, 0x20))
20D18F
SELECT HEX(INSERT(_utf8 0xD18F, 2, 1, 0x20));
HEX(INSERT(_utf8 0xD18F, 2, 1, 0x20))
D120
SELECT HEX(INSERT(_utf8 0xD18FD18E, 2, 1, 0x20));
HEX(INSERT(_utf8 0xD18FD18E, 2, 1, 0x20))
D120D18E
#
# Bug#11752408 - 43593: DUMP/BACKUP/RESTORE/UPGRADE TOOLS FAILS BECAUSE OF UTF8_GENERAL_CI
#
CREATE TABLE t1 (a VARCHAR(10) CHARACTER SET utf8 COLLATE utf8_general_mysql500_ci);
ERROR HY000: Unknown collation: 'utf8_general_mysql500_ci'
CREATE TABLE t1 (a VARCHAR(10) CHARACTER SET utf8 );
INSERT INTO t1 VALUES ('a'),('r'),('s'),(_latin1 0xDF),(_latin1 0xF7),('t'),('z');
SELECT * FROM t1 ORDER BY a;
a
a
r
s
ß
t
z
÷
SELECT a, COUNT(*) FROM t1 GROUP BY a;
a	COUNT(*)
a	1
r	1
s	2
t	1
z	1
÷	1
DROP TABLE t1;
End of 5.1 tests
Start of 5.4 tests
SET NAMES utf8mb3;
CREATE TABLE t1 (a CHAR CHARACTER SET utf8mb3 COLLATE utf8mb3_bin);
DROP TABLE t1;
CREATE TABLE t1 (
clipid INT NOT NULL,
Tape TINYTEXT,
PRIMARY KEY (clipid),
KEY tape(Tape(85))
) CHARACTER SET=utf8;
ALTER TABLE t1 ADD mos TINYINT DEFAULT 0 AFTER clipid;
DROP TABLE t1;
DROP TABLE IF EXISTS t1;
CREATE TABLE t1 (
predicted_order int NOT NULL,
utf8_encoding VARCHAR(10) NOT NULL
) CHARACTER SET utf8;
INSERT INTO t1 VALUES (19, x'E0B696'), (30, x'E0B69AE0B798'), (61, x'E0B6AF'), (93, x'E0B799'), (52, x'E0B6A6'), (73, x'E0B6BBE0B78AE2808D'), (3, x'E0B686'), (56, x'E0B6AA'), (55, x'E0B6A9'), (70, x'E0B6B9'), (94, x'E0B79A'), (80, x'E0B785'), (25, x'E0B69AE0B791'), (48, x'E0B6A2'), (13, x'E0B690'), (86, x'E0B793'), (91, x'E0B79F'), (81, x'E0B786'), (79, x'E0B784'), (14, x'E0B691'), (99, x'E0B78A'), (8, x'E0B68B'), (68, x'E0B6B7'), (22, x'E0B69A'), (16, x'E0B693'), (33, x'E0B69AE0B7B3'), (38, x'E0B69AE0B79D'), (21, x'E0B683'), (11, x'E0B68E'), (77, x'E0B782'), (40, x'E0B69AE0B78A'), (101, x'E0B78AE2808DE0B6BB'), (35, x'E0B69AE0B79A'), (1, x'E0B7B4'), (9, x'E0B68C'), (96, x'E0B79C'), (6, x'E0B689'), (95, x'E0B79B'), (88, x'E0B796'), (64, x'E0B6B3'), (26, x'E0B69AE0B792'), (82, x'E0B78F'), (28, x'E0B69AE0B794'), (39, x'E0B69AE0B79E'), (97, x'E0B79D'), (2, x'E0B685'), (75, x'E0B780'), (34, x'E0B69AE0B799'), (69, x'E0B6B8'), (83, x'E0B790'), (18, x'E0B695'), (90, x'E0B7B2'), (17, x'E0B694'), (72, x'E0B6BB'), (66, x'E0B6B5'), (59, x'E0B6AD'), (44, x'E0B69E'), (15, x'E0B692'), (23, x'E0B69AE0B78F'), (65, x'E0B6B4'), (42, x'E0B69C'), (63, x'E0B6B1'), (85, x'E0B792'), (47, x'E0B6A1'), (49, x'E0B6A3'), (92, x'E0B7B3'), (78, x'E0B783'), (36, x'E0B69AE0B79B'), (4, x'E0B687'), (24, x'E0B69AE0B790'), (87, x'E0B794'), (37, x'E0B69AE0B79C'), (32, x'E0B69AE0B79F'), (29, x'E0B69AE0B796'), (43, x'E0B69D'), (62, x'E0B6B0'), (100, x'E0B78AE2808DE0B6BA'), (60, x'E0B6AE'), (45, x'E0B69F'), (12, x'E0B68F'), (46, x'E0B6A0'), (50, x'E0B6A5'), (51, x'E0B6A4'), (5, x'E0B688'), (76, x'E0B781'), (89, x'E0B798'), (74, x'E0B6BD'), (10, x'E0B68D'), (57, x'E0B6AB'), (71, x'E0B6BA'), (58, x'E0B6AC'), (27, x'E0B69AE0B793'), (54, x'E0B6A8'), (84, x'E0B791'), (31, x'E0B69AE0B7B2'), (98, x'E0B79E'), (53, x'E0B6A7'), (41, x'E0B69B'), (67, x'E0B6B6'), (7, x'E0B68A'), (20, x'E0B682');
SELECT predicted_order, hex(utf8_encoding) FROM t1 ORDER BY utf8_encoding COLLATE utf8_sinhala_ci;
predicted_order	hex(utf8_encoding)
1	E0B7B4
2	E0B685
3	E0B686
4	E0B687
5	E0B688
6	E0B689
7	E0B68A
8	E0B68B
9	E0B68C
10	E0B68D
11	E0B68E
12	E0B68F
13	E0B690
14	E0B691
15	E0B692
16	E0B693
17	E0B694
18	E0B695
19	E0B696
20	E0B682
21	E0B683
22	E0B69A
23	E0B69AE0B78F
24	E0B69AE0B790
25	E0B69AE0B791
26	E0B69AE0B792
27	E0B69AE0B793
28	E0B69AE0B794
29	E0B69AE0B796
30	E0B69AE0B798
31	E0B69AE0B7B2
32	E0B69AE0B79F
33	E0B69AE0B7B3
34	E0B69AE0B799
35	E0B69AE0B79A
36	E0B69AE0B79B
37	E0B69AE0B79C
38	E0B69AE0B79D
39	E0B69AE0B79E
40	E0B69AE0B78A
41	E0B69B
42	E0B69C
43	E0B69D
44	E0B69E
45	E0B69F
46	E0B6A0
47	E0B6A1
48	E0B6A2
49	E0B6A3
50	E0B6A5
51	E0B6A4
52	E0B6A6
53	E0B6A7
54	E0B6A8
55	E0B6A9
56	E0B6AA
57	E0B6AB
58	E0B6AC
59	E0B6AD
60	E0B6AE
61	E0B6AF
62	E0B6B0
63	E0B6B1
64	E0B6B3
65	E0B6B4
66	E0B6B5
67	E0B6B6
68	E0B6B7
69	E0B6B8
70	E0B6B9
71	E0B6BA
72	E0B6BB
73	E0B6BBE0B78AE2808D
74	E0B6BD
75	E0B780
76	E0B781
77	E0B782
78	E0B783
79	E0B784
80	E0B785
81	E0B786
82	E0B78F
83	E0B790
84	E0B791
85	E0B792
86	E0B793
87	E0B794
88	E0B796
89	E0B798
90	E0B7B2
91	E0B79F
92	E0B7B3
93	E0B799
94	E0B79A
95	E0B79B
96	E0B79C
97	E0B79D
98	E0B79E
99	E0B78A
100	E0B78AE2808DE0B6BA
101	E0B78AE2808DE0B6BB
DROP TABLE t1;
SET NAMES utf8 COLLATE utf8_sinhala_ci;
CREATE TABLE t1 (s1 VARCHAR(10) COLLATE utf8_sinhala_ci);
INSERT INTO t1 VALUES ('a'),('ae'),('af');
SELECT s1,hex(s1) FROM t1 ORDER BY s1;
s1	hex(s1)
a	61
ae	6165
af	6166
SELECT * FROM t1 ORDER BY s1;
s1
a
ae
af
DROP TABLE t1;
End of 5.4 tests
#
# Start of 5.5 tests
#
#
# Bug#52520 Difference in tinytext utf column metadata
#
CREATE TABLE t1 (
s1 TINYTEXT CHARACTER SET utf8,
s2 TEXT CHARACTER SET utf8,
s3 MEDIUMTEXT CHARACTER SET utf8,
s4 LONGTEXT CHARACTER SET utf8
);
SET NAMES utf8;
SELECT *, HEX(s1) FROM t1;
Catalog	Database	Table	Table_alias	Column	Column_alias	Type	Length	Max length	Is_null	Flags	Decimals	Charsetnr
def	test	t1	t1	s1	s1	252	255	0	Y	16	0	45
def	test	t1	t1	s2	s2	252	65535	0	Y	16	0	45
def	test	t1	t1	s3	s3	252	16777215	0	Y	16	0	45
def	test	t1	t1	s4	s4	252	4294967295	0	Y	16	0	45
def					HEX(s1)	252	65535	0	Y	16	0	45
s1	s2	s3	s4	HEX(s1)
SET NAMES latin1;
SELECT *, HEX(s1) FROM t1;
Catalog	Database	Table	Table_alias	Column	Column_alias	Type	Length	Max length	Is_null	Flags	Decimals	Charsetnr
def	test	t1	t1	s1	s1	252	255	0	Y	16	0	8
def	test	t1	t1	s2	s2	252	65535	0	Y	16	0	8
def	test	t1	t1	s3	s3	252	16777215	0	Y	16	0	8
def	test	t1	t1	s4	s4	252	4294967295	0	Y	16	0	8
def					HEX(s1)	252	65535	0	Y	16	0	8
s1	s2	s3	s4	HEX(s1)
SET NAMES utf8;
SELECT *, HEX(s1) FROM t1;
Catalog	Database	Table	Table_alias	Column	Column_alias	Type	Length	Max length	Is_null	Flags	Decimals	Charsetnr
def	test	t1	t1	s1	s1	252	255	0	Y	16	0	45
def	test	t1	t1	s2	s2	252	65535	0	Y	16	0	45
def	test	t1	t1	s3	s3	252	16777215	0	Y	16	0	45
def	test	t1	t1	s4	s4	252	4294967295	0	Y	16	0	45
def					HEX(s1)	252	65535	0	Y	16	0	45
s1	s2	s3	s4	HEX(s1)
CREATE TABLE t2 AS SELECT CONCAT(s1) FROM t1;
DROP TABLE t1, t2;
SET NAMES utf8;
#
# Bug#54916 GROUP_CONCAT + IFNULL truncates output
#
SELECT @@collation_connection;
@@collation_connection
utf8mb4_general_ci
CREATE TABLE t1 (a MEDIUMINT NULL) ENGINE=MYISAM;
Warnings:
Warning	1286	Unknown storage engine 'MYISAM'
INSERT INTO t1 VALUES (1234567);
SELECT GROUP_CONCAT(IFNULL(a,'')) FROM t1;
GROUP_CONCAT(IFNULL(a,''))
1234567
SELECT GROUP_CONCAT(IF(a,a,'')) FROM t1;
GROUP_CONCAT(IF(a,a,''))
1234567
SELECT GROUP_CONCAT(CASE WHEN a THEN a ELSE '' END) FROM t1;
GROUP_CONCAT(CASE WHEN a THEN a ELSE '' END)
1234567
SELECT COALESCE(a,'') FROM t1 GROUP BY 1;
Catalog	Database	Table	Table_alias	Column	Column_alias	Type	Length	Max length	Is_null	Flags	Decimals	Charsetnr
def					COALESCE(a,'')	253	36	7	Y	0	0	45
COALESCE(a,'')
1234567
# All columns must be VARCHAR(9) with the same length:
CREATE TABLE t2 AS
SELECT
CONCAT(a),
IFNULL(a,''),
IF(a,a,''),
CASE WHEN a THEN a ELSE '' END,
COALESCE(a,'')
FROM t1;
DROP TABLE t2;
CREATE TABLE t2 AS SELECT CONCAT_WS(1,2,3) FROM t1;
DROP TABLE t2;
CREATE TABLE t2 AS SELECT INSERT(1133,3,0,22) FROM t1;
DROP TABLE t2;
CREATE TABLE t2 AS SELECT LCASE(a) FROM t1;
DROP TABLE t2;
CREATE TABLE t2 AS SELECT UCASE(a) FROM t1;
DROP TABLE t2;
CREATE TABLE t2 AS SELECT REPEAT(1,2) FROM t1;
DROP TABLE t2;
CREATE TABLE t2 AS SELECT LEFT(123,2) FROM t1;
DROP TABLE t2;
CREATE TABLE t2 AS SELECT RIGHT(123,2) FROM t1;
DROP TABLE t2;
CREATE TABLE t2 AS SELECT LTRIM(123) FROM t1;
DROP TABLE t2;
CREATE TABLE t2 AS SELECT RTRIM(123) FROM t1;
DROP TABLE t2;
CREATE TABLE t2 AS SELECT ELT(1,111,222,333) FROM t1;
DROP TABLE t2;
CREATE TABLE t2 AS SELECT REPLACE(111,2,3) FROM t1;
DROP TABLE t2;
CREATE TABLE t2 AS SELECT SUBSTRING_INDEX(111,111,1) FROM t1;
DROP TABLE t2;
CREATE TABLE t2 AS SELECT MAKE_SET(111,222,3) FROM t1;
ERROR 22001: Data too long for column
CREATE TABLE t2 AS SELECT SOUNDEX(1) FROM t1;
DROP TABLE t2;
CREATE TABLE t2 AS SELECT EXPORT_SET(1,'ST_Y','N','',8);
DROP TABLE t2;
DROP TABLE t1;
#
# End of Bug#54916
#
#
# Bug#57687 crash when reporting duplicate group_key error and utf8
# Make sure to modify this when Bug#58081 is fixed.
#
SET NAMES utf8;
CREATE TABLE t1 (a INT);
INSERT INTO t1 VALUES (0), (0), (1), (0), (0);
SELECT COUNT(*) FROM t1, t1 t2 GROUP BY INSERT('', t2.a, t1.a, (@@global.max_binlog_size));
COUNT(*)
25
DROP TABLE t1;
#
# Bug#11764503 (Bug#57341) Query in EXPLAIN shows wrong characters
#
SET NAMES latin1;
SET NAMES utf8;
#
# Bug#11750518 41090: ORDER BY TRUNCATES GROUP_CONCAT RESULT
#
SET NAMES utf8;
SELECT id, CHAR_LENGTH(GROUP_CONCAT(body)) AS l
FROM (SELECT 'a' AS id, REPEAT('foo bar', 100) AS body
UNION ALL
SELECT 'a' AS id, REPEAT('bla bla', 100) AS body) t1
GROUP BY id
ORDER BY l DESC;
id	l
a	1024
Warnings:
Warning	1260	Row 2 was cut by GROUP_CONCAT()
#
# End of 5.5 tests
#
#
# Start of 5.6 tests
#
#
# WL#3664 WEIGHT_STRING
#
set names utf8;
select @@collation_connection;
@@collation_connection
utf8mb4_general_ci
select hex(weight_string('a'));
hex(weight_string('a'))
0041
select hex(weight_string('A'));
hex(weight_string('A'))
0041
select hex(weight_string('abc'));
hex(weight_string('abc'))
004100420043
select hex(weight_string('abc' as char(2)));
hex(weight_string('abc' as char(2)))
00410042
select hex(weight_string('abc' as char(3)));
hex(weight_string('abc' as char(3)))
004100420043
select hex(weight_string('abc' as char(5)));
hex(weight_string('abc' as char(5)))
00410042004300200020
select @@collation_connection;
@@collation_connection
utf8mb4_general_ci
select hex(weight_string(cast(_latin1 0x80 as char)));
hex(weight_string(cast(_latin1 0x80 as char)))
20AC
select hex(weight_string(cast(_latin1 0x808080 as char)));
hex(weight_string(cast(_latin1 0x808080 as char)))
20AC20AC20AC
select hex(weight_string(cast(_latin1 0x808080 as char) as char(2)));
hex(weight_string(cast(_latin1 0x808080 as char) as char(2)))
20AC20AC
select hex(weight_string(cast(_latin1 0x808080 as char) as char(3)));
hex(weight_string(cast(_latin1 0x808080 as char) as char(3)))
20AC20AC20AC
select hex(weight_string(cast(_latin1 0x808080 as char) as char(5)));
hex(weight_string(cast(_latin1 0x808080 as char) as char(5)))
20AC20AC20AC00200020
set @@collation_connection=utf8_bin;
select @@collation_connection;
@@collation_connection
utf8mb4_bin
select hex(weight_string('a'));
hex(weight_string('a'))
000061
select hex(weight_string('A'));
hex(weight_string('A'))
000041
select hex(weight_string('abc'));
hex(weight_string('abc'))
000061000062000063
select hex(weight_string('abc' as char(2)));
hex(weight_string('abc' as char(2)))
000061000062
select hex(weight_string('abc' as char(3)));
hex(weight_string('abc' as char(3)))
000061000062000063
select hex(weight_string('abc' as char(5)));
hex(weight_string('abc' as char(5)))
000061000062000063000020000020
select @@collation_connection;
@@collation_connection
utf8mb4_bin
select hex(weight_string(cast(_latin1 0x80 as char)));
hex(weight_string(cast(_latin1 0x80 as char)))
0020AC
select hex(weight_string(cast(_latin1 0x808080 as char)));
hex(weight_string(cast(_latin1 0x808080 as char)))
0020AC0020AC0020AC
select hex(weight_string(cast(_latin1 0x808080 as char) as char(2)));
hex(weight_string(cast(_latin1 0x808080 as char) as char(2)))
0020AC0020AC
select hex(weight_string(cast(_latin1 0x808080 as char) as char(3)));
hex(weight_string(cast(_latin1 0x808080 as char) as char(3)))
0020AC0020AC0020AC
select hex(weight_string(cast(_latin1 0x808080 as char) as char(5)));
hex(weight_string(cast(_latin1 0x808080 as char) as char(5)))
0020AC0020AC0020AC000020000020
#
# Checking strnxfrm() with odd length
#
set max_sort_length=5;
Warnings:
Warning	1235	This system variable now is mock not supported
select @@max_sort_length;
@@max_sort_length
1024
create table t1 (a varchar(128) character set utf8 collate utf8_general_ci);
insert into t1 values ('a'),('b'),('c');
select * from t1 order by a;
a
a
b
c
alter table t1 modify a varchar(128) character set utf8 collate utf8_bin;
select * from t1 order by a;
a
a
b
c
drop table t1;
set max_sort_length=default;
Warnings:
Warning	1235	This system variable now is mock not supported
#
# Bugs#12635232: VALGRIND WARNINGS: IS_IPV6, IS_IPV4, INET6_ATON,
# INET6_NTOA + MULTIBYTE CHARSET.
#
SET NAMES utf8;
SELECT is_ipv4(inet_ntoa('1'));
is_ipv4(inet_ntoa('1'))
1
SELECT is_ipv6(inet_ntoa('1'));
is_ipv6(inet_ntoa('1'))
0
SELECT HEX(inet6_aton(inet_ntoa('1')));
HEX(inet6_aton(inet_ntoa('1')))
00000001
SELECT inet6_ntoa(inet_ntoa('1'));
inet6_ntoa(inet_ntoa('1'))
NULL
#
# Bug#14040277 UNINITIALIZED VALUE REFERENCED IN STR_TO_IPV6
#
SELECT inet6_aton(soundex('a'));
inet6_aton(soundex('a'))
NULL
Warnings:
Warning	1411	Incorrect string value for function inet6_aton
#
# Bug#19047425 UNINITIALISED VALUE IN STR_TO_IPV6
#
do is_ipv4_mapped(inet6_aton(convert(_ascii "a:" using utf8mb4)));
#
# End of 5.6 tests
#
#
# Bug#22531111 FUNC CONVERT AND CONVERT(,BINARY) WORKS
#              INCORRECT W/ MULTI-BYTE+MULTI-ROWS
#
SET NAMES utf8;
CREATE TABLE t1(c1 INT);
INSERT INTO t1 VALUES(1),(2),(3);
SELECT hex(convert( substr(_utf8 0xE5A4A7E4B88DE58897E9A2A0E58F8AE58C97E788B1E5B094E585B0E88194E59088E78E8BE59BBD, 1, 15), BINARY)) FROM t1;
hex(convert( substr(_utf8 0xE5A4A7E4B88DE58897E9A2A0E58F8AE58C97E788B1E5B094E585B0E88194E59088E78E8BE59BBD, 1, 15), BINARY))
E5A4A7E4B88DE58897E9A2A0E58F8AE58C97E788B1E5B094E585B0E88194E59088E78E8BE59BBD
E5A4A7E4B88DE58897E9A2A0E58F8AE58C97E788B1E5B094E585B0E88194E59088E78E8BE59BBD
E5A4A7E4B88DE58897E9A2A0E58F8AE58C97E788B1E5B094E585B0E88194E59088E78E8BE59BBD
DROP TABLE t1;
#
# Bug#26475237: "INCORRECT STRING VALUE" IS DIPLAYED INSTEAD OF
#               "DATA TOO LONG" SOMETIMES.
#
CREATE TABLE t1(c1 TINYTEXT CHARACTER SET utf8mb4);
CREATE TABLE t2(c2 TINYTEXT CHARACTER SET latin1);
INSERT INTO t1 (c1) VALUES(REPEAT('A', 255));
INSERT INTO t1 (c1) VALUES(REPEAT('A', 256));
ERROR 22001: Data too long for column 'c1' at row 1
INSERT INTO t1 (c1) VALUES(REPEAT(X'C385', 127));
# Without the patch, returns an inappropriate error.
INSERT INTO t1 (c1) VALUES(REPEAT(X'C385', 128));
ERROR 22001: Data too long for column 'c1' at row 1
INSERT INTO t1 (c1) VALUES(REPEAT(X'C385', 129));
ERROR 22001: Data too long for column 'c1' at row 1
INSERT INTO t1 (c1) VALUES(CONCAT('a', REPEAT(X'C385', 128)));
ERROR 22001: Data too long for column 'c1' at row 1
INSERT INTO t2 (c2) VALUES(REPEAT(_utf8mb4 0xE0B295, 128));
ERROR HY000: Incorrect string value
DROP TABLE t1;
DROP TABLE t2;
