SET @test_character_set= 'gb18030';
SET @test_collation= 'gb18030_chinese_ci';
drop table t1;
SET @safe_character_set_server= @@character_set_server;
SET @safe_collation_server= @@collation_server;
SET @safe_character_set_client= @@character_set_client;
SET @safe_character_set_results= @@character_set_results;
SET character_set_server= @test_character_set;
SET collation_server= @test_collation;
CREATE DATABASE d1;
USE d1;
CREATE TABLE t1 (c CHAR(10), KEY(c));
SHOW FULL COLUMNS FROM t1;
Field	Type	Collation	Null	Key	Default	Extra	Privileges	Comment
c	char(10)	gb18030_chinese_ci	YES	MUL	NULL		SELECT,INSERT,UPDATE,REFERENCES	
INSERT INTO t1 VALUES ('aaa'),('aaaa'),('aaaaa');
SELECT c as want3results FROM t1 WHERE c LIKE 'aaa%';
want3results
aaa
aaaa
aaaaa
DROP TABLE t1;
CREATE TABLE t1 (c1 varchar(15), KEY c1 (c1(2)));
SHOW FULL COLUMNS FROM t1;
Field	Type	Collation	Null	Key	Default	Extra	Privileges	Comment
c1	varchar(15)	gb18030_chinese_ci	YES		NULL		SELECT,INSERT,UPDATE,REFERENCES	
INSERT INTO t1 VALUES ('location'),('loberge'),('lotre'),('boabab');
SELECT c1 as want3results from t1 where c1 like 'l%';
want3results
location
loberge
lotre
SELECT c1 as want3results from t1 where c1 like 'lo%';
want3results
location
loberge
lotre
SELECT c1 as want1result  from t1 where c1 like 'loc%';
want1result
location
SELECT c1 as want1result  from t1 where c1 like 'loca%';
want1result
location
SELECT c1 as want1result  from t1 where c1 like 'locat%';
want1result
location
SELECT c1 as want1result  from t1 where c1 like 'locati%';
want1result
location
SELECT c1 as want1result  from t1 where c1 like 'locatio%';
want1result
location
SELECT c1 as want1result  from t1 where c1 like 'location%';
want1result
location
DROP TABLE t1;
create table t1 (a set('a') not null);
insert ignore into t1 values (),();
Warnings:
Warning	1364	Field 'a' doesn't have a default value
Warning	1364	Field 'a' doesn't have a default value
select cast(a as char(1)) from t1;
cast(a as char(1))


select a sounds like a from t1;
a sounds like a
1
1
select 1 from t1 order by cast(a as char(1));
1
1
1
drop table t1;
set names utf8;
create table t1 (
name varchar(10),
level smallint unsigned);
show create table t1;
Table	Create Table
t1	CREATE TABLE `t1` (
  `name` varchar(10) DEFAULT NULL,
  `level` smallint(5) unsigned DEFAULT NULL
) ORGANIZATION INDEX DEFAULT CHARSET = gb18030 ROW_FORMAT = DYNAMIC COMPRESSION = 'zstd_1.3.8' REPLICA_NUM = 1 BLOCK_SIZE = 16384 USE_BLOOM_FILTER = FALSE ENABLE_MACRO_BLOCK_BLOOM_FILTER = FALSE TABLET_SIZE = 134217728 PCTFREE = 0
insert into t1 values ('string',1);
select concat(name,space(level)), concat(name, repeat(' ',level)) from t1;
concat(name,space(level))	concat(name, repeat(' ',level))
string 	string 
drop table t1;
DROP DATABASE d1;
USE test;
SET character_set_server= @safe_character_set_server;
SET collation_server= @safe_collation_server;
SET character_set_client= @safe_character_set_client;
SET character_set_results= @safe_character_set_results;
SET NAMES utf8;
SET collation_connection='gb18030_chinese_ci';
create table t1 select repeat('a',4000) a;
delete from t1;
insert into t1 values ('a'), ('a '), ('a\t');
select collation(a),hex(a) from t1 order by a;
collation(a)	hex(a)
gb18030_chinese_ci	6109
gb18030_chinese_ci	61
gb18030_chinese_ci	6120
drop table t1;
create table t1 engine=innodb select repeat('a',50) as c1;
alter table t1 add index(c1(5));
insert into t1 values ('abcdefg'),('abcde100'),('abcde110'),('abcde111');
select collation(c1) from t1 limit 1;
collation(c1)
gb18030_chinese_ci
select c1 from t1 where c1 like 'abcdef%' order by c1;
c1
abcdefg
select c1 from t1 where c1 like 'abcde1%' order by c1;
c1
abcde100
abcde110
abcde111
select c1 from t1 where c1 like 'abcde11%' order by c1;
c1
abcde110
abcde111
select c1 from t1 where c1 like 'abcde111%' order by c1;
c1
abcde111
drop table t1;
select @@collation_connection;
@@collation_connection
gb18030_chinese_ci
create table t1 ROW_FORMAT=DYNAMIC select repeat('a',50) as c1 ;
insert into t1 values('abcdef');
insert into t1 values('_bcdef');
insert into t1 values('a_cdef');
insert into t1 values('ab_def');
insert into t1 values('abc_ef');
insert into t1 values('abcd_f');
insert into t1 values('abcde_');
select c1 as c1u from t1 where c1 like 'ab\_def';
c1u
ab_def
select c1 as c2h from t1 where c1 like 'ab#_def' escape '#';
c2h
ab_def
drop table t1;
CREATE TABLE t1 AS
SELECT 10 AS a, REPEAT('a',20) AS b, REPEAT('a',8) AS c, REPEAT('a',8) AS d;
ALTER TABLE t1 ADD PRIMARY KEY(a), ADD KEY(b);
ERROR 0A000: add primary key and add index in single statment not supported
INSERT INTO t1 (a, b) VALUES (1, repeat(0xF1F2,5));
INSERT INTO t1 (a, b) VALUES (2, repeat(0xF1F2,10));
INSERT INTO t1 (a, b) VALUES (3, repeat(0xF1F2,11));
INSERT INTO t1 (a, b) VALUES (4, repeat(0xF1F2,12));
SELECT hex(concat(repeat(0xF1F2, 10), '%'));
hex(concat(repeat(0xF1F2, 10), '%'))
F1F2F1F2F1F2F1F2F1F2F1F2F1F2F1F2F1F2F1F225
3 rows expected
SELECT a, hex(b), c FROM t1 WHERE b LIKE concat(repeat(0xF1F2,10), '%');
a	hex(b)	c
2	F1F2F1F2F1F2F1F2F1F2F1F2F1F2F1F2F1F2F1F2	NULL
3	F1F2F1F2F1F2F1F2F1F2F1F2F1F2F1F2F1F2F1F2F1F2	NULL
4	F1F2F1F2F1F2F1F2F1F2F1F2F1F2F1F2F1F2F1F2F1F2F1F2	NULL
DROP TABLE t1;
drop table if exists t1;
create table t1 select repeat('a',10) as c1;
delete from t1;
insert into t1 values (0x20),(0x21),(0x22),(0x23),(0x24),(0x25),(0x26),(0x27),(0x28),(0x29),(0x2A),(0x2B),(0x2C),(0x2D),(0x2E),(0x2F);
insert into t1 values (0x30),(0x31),(0x32),(0x33),(0x34),(0x35),(0x36),(0x37),(0x38),(0x39),(0x3A),(0x3B),(0x3C),(0x3D),(0x3E),(0x3F);
insert into t1 values (0x40),(0x41),(0x42),(0x43),(0x44),(0x45),(0x46),(0x47),(0x48),(0x49),(0x4A),(0x4B),(0x4C),(0x4D),(0x4E),(0x4F);
insert into t1 values (0x50),(0x51),(0x52),(0x53),(0x54),(0x55),(0x56),(0x57),(0x58),(0x59),(0x5A),(0x5B),(0x5C),(0x5D),(0x5E),(0x5F);
insert into t1 values (0x60),(0x61),(0x62),(0x63),(0x64),(0x65),(0x66),(0x67),(0x68),(0x69),(0x6A),(0x6B),(0x6C),(0x6D),(0x6E),(0x6F);
insert into t1 values (0x70),(0x71),(0x72),(0x73),(0x74),(0x75),(0x76),(0x77),(0x78),(0x79),(0x7A),(0x7B),(0x7C),(0x7D),(0x7E),(0x7F);
SELECT HEX(cx), cy
FROM (SELECT GROUP_CONCAT(c1 ORDER BY binary c1 SEPARATOR '') AS cx,
GROUP_CONCAT(HEX(c1) ORDER BY BINARY c1) AS cy
FROM t1
GROUP BY c1
) AS dt;
HEX(cx)	cy
20	20
2F	2F
4363	43,63
28	28
34	34
5A7A	5A,7A
7C	7C
5F	5F
5979	59,79
37	37
7B	7B
35	35
23	23
5E	5E
4A6A	4A,6A
3D	3D
5D	5D
2C	2C
29	29
5474	54,74
5070	50,70
5676	56,76
4565	45,65
7F	7F
38	38
3F	3F
30	30
5373	53,73
3B	3B
5C	5C
5575	55,75
22	22
4868	48,68
5272	52,72
5B	5B
4767	47,67
2D	2D
2E	2E
4464	44,64
5777	57,77
4262	42,62
4F6F	4F,6F
2B	2B
60	60
21	21
24	24
7D	7D
4D6D	4D,6D
5878	58,78
2A	2A
27	27
7E	7E
25	25
33	33
4E6E	4E,6E
31	31
4B6B	4B,6B
40	40
5171	51,71
3A	3A
4161	41,61
26	26
4666	46,66
3C	3C
39	39
4C6C	4C,6C
3E	3E
4969	49,69
32	32
36	36
drop table t1;
SET collation_connection='gb18030_bin';
create table t1 select repeat('a',4000) a;
delete from t1;
insert into t1 values ('a'), ('a '), ('a\t');
select collation(a),hex(a) from t1 order by a;
collation(a)	hex(a)
gb18030_bin	6109
gb18030_bin	61
gb18030_bin	6120
drop table t1;
create table t1 engine=innodb select repeat('a',50) as c1;
alter table t1 add index(c1(5));
insert into t1 values ('abcdefg'),('abcde100'),('abcde110'),('abcde111');
select collation(c1) from t1 limit 1;
collation(c1)
gb18030_bin
select c1 from t1 where c1 like 'abcdef%' order by c1;
c1
abcdefg
select c1 from t1 where c1 like 'abcde1%' order by c1;
c1
abcde100
abcde110
abcde111
select c1 from t1 where c1 like 'abcde11%' order by c1;
c1
abcde110
abcde111
select c1 from t1 where c1 like 'abcde111%' order by c1;
c1
abcde111
drop table t1;
select @@collation_connection;
@@collation_connection
gb18030_bin
create table t1 ROW_FORMAT=DYNAMIC select repeat('a',50) as c1 ;
insert into t1 values('abcdef');
insert into t1 values('_bcdef');
insert into t1 values('a_cdef');
insert into t1 values('ab_def');
insert into t1 values('abc_ef');
insert into t1 values('abcd_f');
insert into t1 values('abcde_');
select c1 as c1u from t1 where c1 like 'ab\_def';
c1u
ab_def
select c1 as c2h from t1 where c1 like 'ab#_def' escape '#';
c2h
ab_def
drop table t1;
CREATE TABLE t1 AS
SELECT 10 AS a, REPEAT('a',20) AS b, REPEAT('a',8) AS c, REPEAT('a',8) AS d;
ALTER TABLE t1 ADD PRIMARY KEY(a), ADD KEY(b);
ERROR 0A000: add primary key and add index in single statment not supported
INSERT INTO t1 (a, b) VALUES (1, repeat(0xF1F2,5));
INSERT INTO t1 (a, b) VALUES (2, repeat(0xF1F2,10));
INSERT INTO t1 (a, b) VALUES (3, repeat(0xF1F2,11));
INSERT INTO t1 (a, b) VALUES (4, repeat(0xF1F2,12));
SELECT hex(concat(repeat(0xF1F2, 10), '%'));
hex(concat(repeat(0xF1F2, 10), '%'))
F1F2F1F2F1F2F1F2F1F2F1F2F1F2F1F2F1F2F1F225
3 rows expected
SELECT a, hex(b), c FROM t1 WHERE b LIKE concat(repeat(0xF1F2,10), '%');
a	hex(b)	c
2	F1F2F1F2F1F2F1F2F1F2F1F2F1F2F1F2F1F2F1F2	NULL
3	F1F2F1F2F1F2F1F2F1F2F1F2F1F2F1F2F1F2F1F2F1F2	NULL
4	F1F2F1F2F1F2F1F2F1F2F1F2F1F2F1F2F1F2F1F2F1F2F1F2	NULL
DROP TABLE t1;
SELECT HEX(CONVERT(_gb18030 0xA14041 USING utf8));
HEX(CONVERT(_gb18030 0xA14041 USING utf8))
EE938641
SELECT LOCATE(_gb18030 0x8140, _gb18030 0x814181408142);
LOCATE(_gb18030 0x8140, _gb18030 0x814181408142)
2
SELECT HEX(REVERSE(_gb18030 0x8140814181428130813081308131FE39FE39));
HEX(REVERSE(_gb18030 0x8140814181428130813081308131FE39FE39))
FE39FE398130813181308130814281418140
SELECT HEX(SUBSTRING(_gb18030 0x81308131813081328130813381308134, 1, 2));
HEX(SUBSTRING(_gb18030 0x81308131813081328130813381308134, 1, 2))
8130813181308132
SELECT HEX(SUBSTRING(_gb18030 0x81308131813081328130813381308134, -3, 2));
HEX(SUBSTRING(_gb18030 0x81308131813081328130813381308134, -3, 2))
8130813281308133
SELECT HEX(TRIM(_gb18030 0x20202081408141208144202020));
HEX(TRIM(_gb18030 0x20202081408141208144202020))
81408141208144
CREATE TABLE t1 (c1 TEXT not null, c2 TEXT not null) CHARACTER SET gb18030;
ALTER TABLE t1 CHANGE c1 c1 MEDIUMTEXT CHARACTER SET gb18030 NOT NULL;
DROP TABLE t1;
SET NAMES utf8mb4;
SET collation_connection=gb18030_chinese_ci;
select @@collation_connection;
@@collation_connection
gb18030_chinese_ci
select hex(weight_string('a'));
hex(weight_string('a'))
41
select hex(weight_string('A'));
hex(weight_string('A'))
41
select hex(weight_string('abc'));
hex(weight_string('abc'))
414243
select hex(weight_string('abc' as char(2)));
hex(weight_string('abc' as char(2)))
4142
select hex(weight_string('abc' as char(3)));
hex(weight_string('abc' as char(3)))
414243
select hex(weight_string('abc' as char(5)));
hex(weight_string('abc' as char(5)))
4142432020
select collation(cast(0xA1A1 as char));
collation(cast(0xA1A1 as char))
gb18030_chinese_ci
select hex(weight_string(cast(0x6141 as char)));
hex(weight_string(cast(0x6141 as char)))
4141
select hex(weight_string(cast(0xA1A1 as char)));
hex(weight_string(cast(0xA1A1 as char)))
A1A1
select hex(weight_string(cast(0xA1A1 as char) as char(1)));
hex(weight_string(cast(0xA1A1 as char) as char(1)))
A1A1
select hex(weight_string(cast(0xA1A1A1A1 as char) as char(1)));
hex(weight_string(cast(0xA1A1A1A1 as char) as char(1)))
A1A1
select hex(weight_string(cast(0xA1A1 as char) as char(3)));
hex(weight_string(cast(0xA1A1 as char) as char(3)))
A1A12020
select hex(weight_string(cast(0xA1A1A1A1 as char) as char(3)));
hex(weight_string(cast(0xA1A1A1A1 as char) as char(3)))
A1A1A1A120
select hex(weight_string(cast(0x40A1A1 as char) as char(3)));
hex(weight_string(cast(0x40A1A1 as char) as char(3)))
40A1A120
select hex(weight_string(cast(0x40A1A1A1A1 as char) as char(3)));
hex(weight_string(cast(0x40A1A1A1A1 as char) as char(3)))
40A1A1A1A1
select hex(weight_string(cast(0x40A1A1A1A1A1A1 as char) as char(3)));
hex(weight_string(cast(0x40A1A1A1A1A1A1 as char) as char(3)))
40A1A1A1A1
select hex(weight_string(cast(0x4040A1A1A1A1A1A1 as char) as char(3)));
hex(weight_string(cast(0x4040A1A1A1A1A1A1 as char) as char(3)))
4040A1A1
select collation(cast(0xA2A9 as char));
collation(cast(0xA2A9 as char))
gb18030_chinese_ci
select hex(weight_string(cast(0x6141 as char)));
hex(weight_string(cast(0x6141 as char)))
4141
select hex(weight_string(cast(0xA2A9 as char)));
hex(weight_string(cast(0xA2A9 as char)))
A2F9
select hex(weight_string(cast(0xA2A9 as char) as char(1)));
hex(weight_string(cast(0xA2A9 as char) as char(1)))
A2F9
select hex(weight_string(cast(0xA2A9A2A9 as char) as char(1)));
hex(weight_string(cast(0xA2A9A2A9 as char) as char(1)))
A2F9
select hex(weight_string(cast(0xA2A9 as char) as char(3)));
hex(weight_string(cast(0xA2A9 as char) as char(3)))
A2F92020
select hex(weight_string(cast(0xA2A9A2A9 as char) as char(3)));
hex(weight_string(cast(0xA2A9A2A9 as char) as char(3)))
A2F9A2F920
select hex(weight_string(cast(0x40A2A9 as char) as char(3)));
hex(weight_string(cast(0x40A2A9 as char) as char(3)))
40A2F920
select hex(weight_string(cast(0x40A2A9A2A9 as char) as char(3)));
hex(weight_string(cast(0x40A2A9A2A9 as char) as char(3)))
40A2F9A2F9
select hex(weight_string(cast(0x40A2A9A2A9A2A9 as char) as char(3)));
hex(weight_string(cast(0x40A2A9A2A9A2A9 as char) as char(3)))
40A2F9A2F9
select hex(weight_string(cast(0x4040A2A9A2A9A2A9 as char) as char(3)));
hex(weight_string(cast(0x4040A2A9A2A9A2A9 as char) as char(3)))
4040A2F9
SELECT collation(CAST(0x81309D30 AS CHAR));
collation(CAST(0x81309D30 AS CHAR))
gb18030_chinese_ci
SELECT HEX(WEIGHT_STRING(CAST(0x6141 AS CHAR)));
HEX(WEIGHT_STRING(CAST(0x6141 AS CHAR)))
4141
SELECT HEX(WEIGHT_STRING(CAST(0x81309D30 AS CHAR)));
HEX(WEIGHT_STRING(CAST(0x81309D30 AS CHAR)))
FF000117
SELECT HEX(WEIGHT_STRING(CAST(0x81309D30 AS CHAR) AS CHAR(1)));
HEX(WEIGHT_STRING(CAST(0x81309D30 AS CHAR) AS CHAR(1)))
FF000117
SELECT HEX(WEIGHT_STRING(CAST(0x81309D3081309D30 AS CHAR) AS CHAR(1)));
HEX(WEIGHT_STRING(CAST(0x81309D3081309D30 AS CHAR) AS CHAR(1)))
FF000117
SELECT HEX(WEIGHT_STRING(CAST(0x81309D30 AS CHAR) AS CHAR(3)));
HEX(WEIGHT_STRING(CAST(0x81309D30 AS CHAR) AS CHAR(3)))
FF0001172020
SELECT HEX(WEIGHT_STRING(CAST(0x81309D3081309D30 AS CHAR) AS CHAR(3)));
HEX(WEIGHT_STRING(CAST(0x81309D3081309D30 AS CHAR) AS CHAR(3)))
FF000117FF00011720
SELECT HEX(WEIGHT_STRING(CAST(0x4081309D30 AS CHAR) AS CHAR(3)));
HEX(WEIGHT_STRING(CAST(0x4081309D30 AS CHAR) AS CHAR(3)))
40FF00011720
SELECT HEX(WEIGHT_STRING(CAST(0x4081309D3081309D30 AS CHAR) AS CHAR(3)));
HEX(WEIGHT_STRING(CAST(0x4081309D3081309D30 AS CHAR) AS CHAR(3)))
40FF000117FF000117
SELECT HEX(WEIGHT_STRING(CAST(0x4081309D3081309D3081309D30 AS CHAR) AS CHAR(3)));
HEX(WEIGHT_STRING(CAST(0x4081309D3081309D3081309D30 AS CHAR) AS CHAR(3)))
40FF000117FF000117
SELECT HEX(WEIGHT_STRING(CAST(0x404081309D3081309D3081309D30 AS CHAR) AS CHAR(3)));
HEX(WEIGHT_STRING(CAST(0x404081309D3081309D3081309D30 AS CHAR) AS CHAR(3)))
4040FF000117
SET collation_connection=gb18030_bin;
select @@collation_connection;
@@collation_connection
gb18030_bin
select hex(weight_string('a'));
hex(weight_string('a'))
61
select hex(weight_string('A'));
hex(weight_string('A'))
41
select hex(weight_string('abc'));
hex(weight_string('abc'))
616263
select hex(weight_string('abc' as char(2)));
hex(weight_string('abc' as char(2)))
6162
select hex(weight_string('abc' as char(3)));
hex(weight_string('abc' as char(3)))
616263
select hex(weight_string('abc' as char(5)));
hex(weight_string('abc' as char(5)))
6162632020
select collation(cast(0xA1A1 as char));
collation(cast(0xA1A1 as char))
gb18030_bin
select hex(weight_string(cast(0x6141 as char)));
hex(weight_string(cast(0x6141 as char)))
6141
select hex(weight_string(cast(0xA1A1 as char)));
hex(weight_string(cast(0xA1A1 as char)))
A1A1
select hex(weight_string(cast(0xA1A1 as char) as char(1)));
hex(weight_string(cast(0xA1A1 as char) as char(1)))
A1A1
select hex(weight_string(cast(0xA1A1A1A1 as char) as char(1)));
hex(weight_string(cast(0xA1A1A1A1 as char) as char(1)))
A1A1
select hex(weight_string(cast(0xA1A1 as char) as char(3)));
hex(weight_string(cast(0xA1A1 as char) as char(3)))
A1A12020
select hex(weight_string(cast(0xA1A1A1A1 as char) as char(3)));
hex(weight_string(cast(0xA1A1A1A1 as char) as char(3)))
A1A1A1A120
select hex(weight_string(cast(0x40A1A1 as char) as char(3)));
hex(weight_string(cast(0x40A1A1 as char) as char(3)))
40A1A120
select hex(weight_string(cast(0x40A1A1A1A1 as char) as char(3)));
hex(weight_string(cast(0x40A1A1A1A1 as char) as char(3)))
40A1A1A1A1
select hex(weight_string(cast(0x40A1A1A1A1A1A1 as char) as char(3)));
hex(weight_string(cast(0x40A1A1A1A1A1A1 as char) as char(3)))
40A1A1A1A1
select hex(weight_string(cast(0x4040A1A1A1A1A1A1 as char) as char(3)));
hex(weight_string(cast(0x4040A1A1A1A1A1A1 as char) as char(3)))
4040A1A1
select collation(cast(0xA2A9 as char));
collation(cast(0xA2A9 as char))
gb18030_bin
select hex(weight_string(cast(0x6141 as char)));
hex(weight_string(cast(0x6141 as char)))
6141
select hex(weight_string(cast(0xA2A9 as char)));
hex(weight_string(cast(0xA2A9 as char)))
A2A9
select hex(weight_string(cast(0xA2A9 as char) as char(1)));
hex(weight_string(cast(0xA2A9 as char) as char(1)))
A2A9
select hex(weight_string(cast(0xA2A9A2A9 as char) as char(1)));
hex(weight_string(cast(0xA2A9A2A9 as char) as char(1)))
A2A9
select hex(weight_string(cast(0xA2A9 as char) as char(3)));
hex(weight_string(cast(0xA2A9 as char) as char(3)))
A2A92020
select hex(weight_string(cast(0xA2A9A2A9 as char) as char(3)));
hex(weight_string(cast(0xA2A9A2A9 as char) as char(3)))
A2A9A2A920
select hex(weight_string(cast(0x40A2A9 as char) as char(3)));
hex(weight_string(cast(0x40A2A9 as char) as char(3)))
40A2A920
select hex(weight_string(cast(0x40A2A9A2A9 as char) as char(3)));
hex(weight_string(cast(0x40A2A9A2A9 as char) as char(3)))
40A2A9A2A9
select hex(weight_string(cast(0x40A2A9A2A9A2A9 as char) as char(3)));
hex(weight_string(cast(0x40A2A9A2A9A2A9 as char) as char(3)))
40A2A9A2A9
select hex(weight_string(cast(0x4040A2A9A2A9A2A9 as char) as char(3)));
hex(weight_string(cast(0x4040A2A9A2A9A2A9 as char) as char(3)))
4040A2A9
SELECT collation(CAST(0x81309D30 AS CHAR));
collation(CAST(0x81309D30 AS CHAR))
gb18030_bin
SELECT HEX(WEIGHT_STRING(CAST(0x6141 AS CHAR)));
HEX(WEIGHT_STRING(CAST(0x6141 AS CHAR)))
6141
SELECT HEX(WEIGHT_STRING(CAST(0x81309D30 AS CHAR)));
HEX(WEIGHT_STRING(CAST(0x81309D30 AS CHAR)))
81309D30
SELECT HEX(WEIGHT_STRING(CAST(0x81309D30 AS CHAR) AS CHAR(1)));
HEX(WEIGHT_STRING(CAST(0x81309D30 AS CHAR) AS CHAR(1)))
81309D30
SELECT HEX(WEIGHT_STRING(CAST(0x81309D3081309D30 AS CHAR) AS CHAR(1)));
HEX(WEIGHT_STRING(CAST(0x81309D3081309D30 AS CHAR) AS CHAR(1)))
81309D30
SELECT HEX(WEIGHT_STRING(CAST(0x81309D30 AS CHAR) AS CHAR(3)));
HEX(WEIGHT_STRING(CAST(0x81309D30 AS CHAR) AS CHAR(3)))
81309D302020
SELECT HEX(WEIGHT_STRING(CAST(0x81309D3081309D30 AS CHAR) AS CHAR(3)));
HEX(WEIGHT_STRING(CAST(0x81309D3081309D30 AS CHAR) AS CHAR(3)))
81309D3081309D3020
SELECT HEX(WEIGHT_STRING(CAST(0x4081309D30 AS CHAR) AS CHAR(3)));
HEX(WEIGHT_STRING(CAST(0x4081309D30 AS CHAR) AS CHAR(3)))
4081309D3020
SELECT HEX(WEIGHT_STRING(CAST(0x4081309D3081309D30 AS CHAR) AS CHAR(3)));
HEX(WEIGHT_STRING(CAST(0x4081309D3081309D30 AS CHAR) AS CHAR(3)))
4081309D3081309D30
SELECT HEX(WEIGHT_STRING(CAST(0x4081309D3081309D3081309D30 AS CHAR) AS CHAR(3)));
HEX(WEIGHT_STRING(CAST(0x4081309D3081309D3081309D30 AS CHAR) AS CHAR(3)))
4081309D3081309D30
SELECT HEX(WEIGHT_STRING(CAST(0x404081309D3081309D3081309D30 AS CHAR) AS CHAR(3)));
HEX(WEIGHT_STRING(CAST(0x404081309D3081309D3081309D30 AS CHAR) AS CHAR(3)))
404081309D30
#
# Bugs#12635232: VALGRIND WARNINGS: IS_IPV6, IS_IPV4, INET6_ATON,
# INETTO_NTOA + MULTIBYTE CHARSET.
#
SET sql_mode = 'NO_ENGINE_SUBSTITUTION';
SELECT is_ipv4(inet_ntoa('1'));
is_ipv4(inet_ntoa('1'))
1
SELECT is_ipv6(inet_ntoa('1'));
is_ipv6(inet_ntoa('1'))
0
SELECT HEX(inet6_aton(inet_ntoa('1')));
HEX(inet6_aton(inet_ntoa('1')))
00000001
SELECT inet6_ntoa(inet_ntoa('1'));
inet6_ntoa(inet_ntoa('1'))
NULL
#
# Bug#14040277 UNINITIALIZED VALUE REFERENCED IN STR_TO_IPV6
#
SELECT inet6_aton(soundex('a'));
inet6_aton(soundex('a'))
NULL
Warnings:
Warning	1411	Incorrect string value for function inet6_aton
#
# Bug#19047425 UNINITIALISED VALUE IN STR_TO_IPV6
#
do is_ipv4_mapped(inet6_aton(convert(_ascii "a:" using utf8mb4)));
Warnings:
Warning	1411	Incorrect string value for function inet6_aton
#
# Test for gb18030_unicode_520_ci collation.
#
SET NAMES utf8mb4;
SET collation_connection=gb18030_unicode_520_ci;
ERROR HY000: Unknown collation: 'gb18030_unicode_520_ci'
SET NAMES gb18030 COLLATE gb18030_unicode_520_ci;
ERROR HY000: Unknown collation: 'gb18030_unicode_520_ci'
SELECT 1 gb18030_unicode_520_ci;
gb18030_unicode_520_ci
1
CREATE DATABASE gb18030 CHARSET=GB18030;
SET NAMES utf8mb4;
SET collation_connection='gb18030_chinese_ci';
CREATE TABLE t1(C VARCHAR(100) CHARACTER SET gb18030, KEY(c(20)));
INSERT INTO t1 VALUES(0xC4EEC5ABBDBFA1A4B3E0B1DABBB3B9C520A1A4CBD5B6ABC6C2);
INSERT INTO t1 VALUES(0xB4F3BDADB6ABC8A5A3ACC0CBCCD4BEA1A1A2C7A7B9C5B7E7C1F7C8CBCEEFA1A3);
INSERT INTO t1 VALUES(0xB9CAC0DDCEF7B1DFA3ACC8CBB5C0CAC7A1A2C8FDB9FAD6DCC0C9B3E0B1DAA1A3);
INSERT INTO t1 VALUES(0xC2D2CAAFB1C0D4C6A3ACBEAACCCEC1D1B0B6A3ACBEEDC6F0C7A7B6D1D1A9A1A3);
INSERT INTO t1 VALUES(0xBDADC9BDC8E7BBADA3ACD2BBCAB1B6E0C9D9BAC0BDDCA3A1);
INSERT INTO t1 VALUES(0xD2A3CFEBB9ABE8AAB5B1C4EAA3ACD0A1C7C7B3F5BCDEC1CBA3ACD0DBD7CBD3A2B7A2A1A3);
INSERT INTO t1 VALUES(0xD3F0C9C8C2DABDEDA3ACCCB8D0A6BCE4A1A2E9C9E9D6BBD2B7C9D1CCC3F0A1A3);
INSERT INTO t1 VALUES(0xB9CAB9FAC9F1D3CEA3ACB6E0C7E9D3A6D0A6CED2A1A2D4E7C9FABBAAB7A2A1A3);
INSERT INTO t1 VALUES(0xC8CBBCE4C8E7C3CEA3ACD2BBE9D7BBB9F5AABDADD4C2A1A3);
SELECT c, HEX(c), CONVERT(c USING utf8mb4) FROM t1;
c	HEX(c)	CONVERT(c USING utf8mb4)
念奴娇·赤壁怀古 ·苏东坡	C4EEC5ABBDBFA1A4B3E0B1DABBB3B9C520A1A4CBD5B6ABC6C2	念奴娇·赤壁怀古 ·苏东坡
大江东去，浪淘尽、千古风流人物。	B4F3BDADB6ABC8A5A3ACC0CBCCD4BEA1A1A2C7A7B9C5B7E7C1F7C8CBCEEFA1A3	大江东去，浪淘尽、千古风流人物。
故垒西边，人道是、三国周郎赤壁。	B9CAC0DDCEF7B1DFA3ACC8CBB5C0CAC7A1A2C8FDB9FAD6DCC0C9B3E0B1DAA1A3	故垒西边，人道是、三国周郎赤壁。
乱石崩云，惊涛裂岸，卷起千堆雪。	C2D2CAAFB1C0D4C6A3ACBEAACCCEC1D1B0B6A3ACBEEDC6F0C7A7B6D1D1A9A1A3	乱石崩云，惊涛裂岸，卷起千堆雪。
江山如画，一时多少豪杰！	BDADC9BDC8E7BBADA3ACD2BBCAB1B6E0C9D9BAC0BDDCA3A1	江山如画，一时多少豪杰！
遥想公瑾当年，小乔初嫁了，雄姿英发。	D2A3CFEBB9ABE8AAB5B1C4EAA3ACD0A1C7C7B3F5BCDEC1CBA3ACD0DBD7CBD3A2B7A2A1A3	遥想公瑾当年，小乔初嫁了，雄姿英发。
羽扇纶巾，谈笑间、樯橹灰飞烟灭。	D3F0C9C8C2DABDEDA3ACCCB8D0A6BCE4A1A2E9C9E9D6BBD2B7C9D1CCC3F0A1A3	羽扇纶巾，谈笑间、樯橹灰飞烟灭。
故国神游，多情应笑我、早生华发。	B9CAB9FAC9F1D3CEA3ACB6E0C7E9D3A6D0A6CED2A1A2D4E7C9FABBAAB7A2A1A3	故国神游，多情应笑我、早生华发。
人间如梦，一樽还酹江月。	C8CBBCE4C8E7C3CEA3ACD2BBE9D7BBB9F5AABDADD4C2A1A3	人间如梦，一樽还酹江月。
SELECT HEX(c), CONVERT(c USING utf8mb4) FROM t1 ORDER BY c;
HEX(c)	CONVERT(c USING utf8mb4)
B4F3BDADB6ABC8A5A3ACC0CBCCD4BEA1A1A2C7A7B9C5B7E7C1F7C8CBCEEFA1A3	大江东去，浪淘尽、千古风流人物。
B9CAB9FAC9F1D3CEA3ACB6E0C7E9D3A6D0A6CED2A1A2D4E7C9FABBAAB7A2A1A3	故国神游，多情应笑我、早生华发。
B9CAC0DDCEF7B1DFA3ACC8CBB5C0CAC7A1A2C8FDB9FAD6DCC0C9B3E0B1DAA1A3	故垒西边，人道是、三国周郎赤壁。
BDADC9BDC8E7BBADA3ACD2BBCAB1B6E0C9D9BAC0BDDCA3A1	江山如画，一时多少豪杰！
C2D2CAAFB1C0D4C6A3ACBEAACCCEC1D1B0B6A3ACBEEDC6F0C7A7B6D1D1A9A1A3	乱石崩云，惊涛裂岸，卷起千堆雪。
C4EEC5ABBDBFA1A4B3E0B1DABBB3B9C520A1A4CBD5B6ABC6C2	念奴娇·赤壁怀古 ·苏东坡
C8CBBCE4C8E7C3CEA3ACD2BBE9D7BBB9F5AABDADD4C2A1A3	人间如梦，一樽还酹江月。
D2A3CFEBB9ABE8AAB5B1C4EAA3ACD0A1C7C7B3F5BCDEC1CBA3ACD0DBD7CBD3A2B7A2A1A3	遥想公瑾当年，小乔初嫁了，雄姿英发。
D3F0C9C8C2DABDEDA3ACCCB8D0A6BCE4A1A2E9C9E9D6BBD2B7C9D1CCC3F0A1A3	羽扇纶巾，谈笑间、樯橹灰飞烟灭。
SELECT HEX(c), CONVERT(c USING utf8mb4) FROM t1 WHERE c LIKE CONCAT('%', _gb18030 0xD2BB, '%');
HEX(c)	CONVERT(c USING utf8mb4)
BDADC9BDC8E7BBADA3ACD2BBCAB1B6E0C9D9BAC0BDDCA3A1	江山如画，一时多少豪杰！
C8CBBCE4C8E7C3CEA3ACD2BBE9D7BBB9F5AABDADD4C2A1A3	人间如梦，一樽还酹江月。
SELECT HEX(c), CONVERT(c USING utf8mb4) FROM t1 WHERE c LIKE CONCAT('%', _gb18030 0xC8CB, '%');
HEX(c)	CONVERT(c USING utf8mb4)
B4F3BDADB6ABC8A5A3ACC0CBCCD4BEA1A1A2C7A7B9C5B7E7C1F7C8CBCEEFA1A3	大江东去，浪淘尽、千古风流人物。
B9CAC0DDCEF7B1DFA3ACC8CBB5C0CAC7A1A2C8FDB9FAD6DCC0C9B3E0B1DAA1A3	故垒西边，人道是、三国周郎赤壁。
C8CBBCE4C8E7C3CEA3ACD2BBE9D7BBB9F5AABDADD4C2A1A3	人间如梦，一樽还酹江月。
SELECT HEX(c), CONVERT(c USING utf8mb4) FROM t1 WHERE c > 0xD2A3;
HEX(c)	CONVERT(c USING utf8mb4)
D2A3CFEBB9ABE8AAB5B1C4EAA3ACD0A1C7C7B3F5BCDEC1CBA3ACD0DBD7CBD3A2B7A2A1A3	遥想公瑾当年，小乔初嫁了，雄姿英发。
D3F0C9C8C2DABDEDA3ACCCB8D0A6BCE4A1A2E9C9E9D6BBD2B7C9D1CCC3F0A1A3	羽扇纶巾，谈笑间、樯橹灰飞烟灭。
TRUNCATE TABLE t1;
INSERT INTO t1 VALUES(0x5373547483329330);
INSERT INTO t1 VALUES(0x8239AB318239AB358239AF3583308132833087348335EB39);
INSERT INTO t1 VALUES(0x97339631973396339733A6359831C0359831C536);
INSERT INTO t1 VALUES(0x9835CF329835CE359835F336);
INSERT INTO t1 VALUES(0x833988318339883283398539);
INSERT INTO t1 VALUES(0x823398318233973582339A3882348A32);
INSERT INTO t1 VALUES(0x8134D5318134D6328134D832);
INSERT INTO t1 VALUES(0x4A7320204B82339A35646566);
INSERT INTO t1 VALUES(0x8130883281308833);
INSERT INTO t1 VALUES(0xE05FE06A777682339230);
INSERT INTO t1 VALUES(0x814081418139FE30);
INSERT INTO t1 VALUES(0x81308130FEFE);
INSERT INTO t1 VALUES(0xE3329A35E3329A34);
INSERT INTO t1 VALUES(0xFE39FE39FE38FE38);
INSERT INTO t1 VALUES(0xFE39FE38A976);
SELECT c, HEX(c), CONVERT(c USING utf8mb4) FROM t1;
c	HEX(c)	CONVERT(c USING utf8mb4)
SsTt숿	5373547483329330	SsTt숿
둬둰뒘략럳푼	8239AB318239AB358239AF3583308132833087348335EB39	둬둰뒘략럳푼
𦠟𦠡𦣃𩄧𩅚	97339631973396339733A6359831C0359831C536	𦠟𦠡𦣃𩄧𩅚
𪕪𪕣𪛖	9835CF329835CE359835F336	𪕪𪕣𪛖
	833988318339883283398539	
䑠䑚䑻䣈	823398318233973582339A3882348A32	䑠䑚䑻䣈
᠗ᠢᠶ	8134D5318134D6328134D832	᠗ᠢᠶ
Js  K䑸def	4A7320204B82339A35646566	Js  K䑸def
ÎÏ	8130883281308833	ÎÏ
郷鄇wv䐣	E05FE06A777682339230	郷鄇wv䐣
丂丄㒙	814081418139FE30	丂丄㒙
	81308130FEFE	
􏿿􏿾	E3329A35E3329A34	􏿿􏿾
??	FE39FE39FE38FE38	??
?﹙	FE39FE38A976	?﹙
SELECT c, HEX(c), CONVERT(c USING utf8mb4) FROM t1 WHERE c LIKE CONCAT('%', _gb18030 0x9835CE35, '%');
c	HEX(c)	CONVERT(c USING utf8mb4)
𪕪𪕣𪛖	9835CF329835CE359835F336	𪕪𪕣𪛖
SELECT c, HEX(c), CONVERT(c USING utf8mb4) FROM t1 WHERE c = 0x8130883281308833;
c	HEX(c)	CONVERT(c USING utf8mb4)
ÎÏ	8130883281308833	ÎÏ
SELECT c, HEX(c), CONVERT(c USING utf8mb4) FROM t1 WHERE c > 0xE040 AND c < 0x8239AB31;
c	HEX(c)	CONVERT(c USING utf8mb4)
SELECT c, HEX(c), CONVERT(c USING utf8mb4) FROM t1 ORDER BY c;
c	HEX(c)	CONVERT(c USING utf8mb4)
Js  K䑸def	4A7320204B82339A35646566	Js  K䑸def
SsTt숿	5373547483329330	SsTt숿
	81308130FEFE	
ÎÏ	8130883281308833	ÎÏ
᠗ᠢᠶ	8134D5318134D6328134D832	᠗ᠢᠶ
둬둰뒘략럳푼	8239AB318239AB358239AF3583308132833087348335EB39	둬둰뒘략럳푼
	833988318339883283398539	
𪕪𪕣𪛖	9835CF329835CE359835F336	𪕪𪕣𪛖
􏿿􏿾	E3329A35E3329A34	􏿿􏿾
?﹙	FE39FE38A976	?﹙
丂丄㒙	814081418139FE30	丂丄㒙
䑠䑚䑻䣈	823398318233973582339A3882348A32	䑠䑚䑻䣈
郷鄇wv䐣	E05FE06A777682339230	郷鄇wv䐣
𦠟𦠡𦣃𩄧𩅚	97339631973396339733A6359831C0359831C536	𦠟𦠡𦣃𩄧𩅚
??	FE39FE39FE38FE38	??
TRUNCATE TABLE t1;
INSERT INTO t1 VALUES(0x8139818F);
INSERT INTO t1 VALUES(0x8431A530);
INSERT INTO t1 VALUES(0x9030813089398130);
INSERT INTO t1 VALUES(0xE3329A36);
INSERT INTO t1 VALUES(0xA6A78586E3329A38);
INSERT INTO t1 VALUES(0xA69C8041);
INSERT INTO t1 VALUES(0xA9C6FEFF);
INSERT INTO t1 VALUES(0xFFFF);
INSERT INTO t1 VALUES(0x81408139);
INSERT INTO t1 VALUES(0x962B);
INSERT INTO t1 VALUES(0x9F37823881308156);
INSERT INTO t1 VALUES(0xFE35FF30);
INSERT INTO t1 VALUES(0x814281309CA4);
INSERT INTO t1 VALUES(0xE3329A36);
INSERT INTO t1 VALUES(0xFE39FE39FE39FE38);
SELECT * FROM t1;
C

?
𐀀?
?
Η厗?

┢

丂

񀓎

丅
?
??
UPDATE t1 SET c=0x81308130;
SELECT COUNT(*) FROM t1 WHERE c <> 0x81308130;
COUNT(*)
0
TRUNCATE TABLE t1;
INSERT INTO t1 VALUES(_gb18030 0x9534A337), (_gb18030 0x8959), (_gb18030 0xB0F9), (_gb18030 0xB0F4), (_gb18030 0x95348B39), (_gb18030 0x9794), (_gb18030 0x8231AC35);
INSERT INTO t1 VALUES(_gb18030 0xB0F8), (_gb18030 0xAB67), (_gb18030 0x8232B632), (_gb18030 0x9630ED37), (_gb18030 0x9539F933), (_gb18030 0xB0F6), (_gb18030 0x8233B931);
INSERT INTO t1 VALUES(_gb18030 0xD143), (_gb18030 0xB2A4), (_gb18030 0xC08F), (_gb18030 0xBC9E), (_gb18030 0xB2A6), (_gb18030 0xB2A8), (_gb18030 0xB069);
INSERT INTO t1 VALUES(_gb18030 0x9833A533), (_gb18030 0xE2C4), (_gb18030 0xB2A7), (_gb18030 0x97368632), (_gb18030 0xB2A3), (_gb18030 0x8483), (_gb18030 0xB0FE);
INSERT INTO t1 VALUES(_gb18030 0x865C), (_gb18030 0xD093), (_gb18030 0xB36A), (_gb18030 0xB143);
SELECT c, HEX(c) FROM t1 ORDER BY c;
c	HEX(c)
𠬣	9534A337
𠨵	95348B39
㭋	8231AC35
玤	AB67
䂜	8232B632
蚌	B0F6
𢜗	9539F933
𢮏	9630ED37
䖫	8233B931
傍	B0F8
棒	B0F4
棓	9794
谤	B0F9
塝	8959
拨	B2A6
波	B2A8
癷	B069
𩧯	9833A533
玻	B2A3
剝	8483
剥	B0FE
哱	865C
盋	B143
砵	B36A
袚	D093
𧙄	97368632
钵	B2A7
饽	E2C4
紴	BC9E
缽	C08F
菠	B2A4
袰	D143
SELECT c, HEX(c) FROM t1 WHERE c >= 0x8483 and c < 0xE2C4 ORDER BY c;
c	HEX(c)
剝	8483
剥	B0FE
哱	865C
盋	B143
砵	B36A
袚	D093
𧙄	97368632
钵	B2A7
SELECT c, HEX(c) FROM t1 WHERE c LIKE 0xB0FE;
c	HEX(c)
剥	B0FE
TRUNCATE TABLE t1;
INSERT INTO t1 VALUES(_gb18030 0x81308130), (_gb18030 0x81308132);
INSERT INTO t1 VALUES('A'), ('a'), ('1'), ('2');
INSERT INTO t1 VALUES(_gb18030 0xCDF5), (_gb18030 0xC0EE), (_gb18030 0xD5C5), (_gb18030 0xC1F5), (_gb18030 0xB3C2), (_gb18030 0xD1EE), (_gb18030 0xBBC6);
INSERT INTO t1 VALUES(_gb18030 0xCEE2), (_gb18030 0xD5D4), (_gb18030 0xD6DC), (_gb18030 0xD0EC), (_gb18030 0xCBEF), (_gb18030 0xC2ED), (_gb18030 0xD6EC);
INSERT INTO t1 VALUES(_gb18030 0xBAFA), (_gb18030 0xC1D6), (_gb18030 0xB9F9), (_gb18030 0xBACE), (_gb18030 0xB8DF), (_gb18030 0xC2DE), (_gb18030 0xD6A3);
INSERT INTO t1 VALUES(_gb18030 0xE3329A35), (_gb18030 0xE3329A34);
SELECT c, HEX(c) FROM t1 ORDER BY c;
c	HEX(c)
1	31
2	32
A	41
a	61
	81308130
	81308132
􏿾	E3329A34
􏿿	E3329A35
陈	B3C2
高	B8DF
郭	B9F9
何	BACE
胡	BAFA
黄	BBC6
李	C0EE
林	C1D6
刘	C1F5
罗	C2DE
马	C2ED
孙	CBEF
王	CDF5
吴	CEE2
徐	D0EC
杨	D1EE
张	D5C5
赵	D5D4
郑	D6A3
周	D6DC
朱	D6EC
DROP TABLE t1;
CREATE TABLE t1 (c CHAR(1) CHARACTER SET gb18030, v VARCHAR(100) CHARACTER SET gb18030);
INSERT INTO t1 VALUES(0x8140, 0x81308132A6C9A6A985328338);
SELECT HEX(c), c, HEX(v), v FROM t1;
HEX(c)	c	HEX(v)	v
8140	丂	81308132A6C9A6A985328338	ιΙ?
ALTER TABLE t1 ADD COLUMN t TEXT CHARACTER SET gb18030;
INSERT INTO t1 VALUES(0xBC81, 0x82358132FE39FE3940414281308135, 0x84678578);
SELECT HEX(c), c, HEX(v), v, HEX(t), t FROM t1;
HEX(c)	c	HEX(v)	v	HEX(t)	t
8140	丂	81308132A6C9A6A985328338	ιΙ?	NULL	NULL
BC81	紒	82358132FE39FE3940414281308135	䵲?@AB	84678578	刧厁
DROP TABLE t1;
CREATE TABLE t1 (c VARCHAR(10) CHARACTER SET gb18030);
INSERT INTO t1 VALUES(0x81308A3181308A3181308A3181308A3181308732);
INSERT INTO t1 VALUES(0x81308A3181308A318130873281308A31);
INSERT INTO t1 VALUES(0x81308A318130873281309636);
INSERT INTO t1 VALUES(0x81308A318130873281309637);
INSERT INTO t1 VALUES(0x81308A31813087328130963781309636);
INSERT INTO t1 VALUES(0x8130963681308A31);
INSERT INTO t1 VALUES(0xA8A581308D35);
INSERT INTO t1 VALUES(0x81308D35A8A5);
INSERT INTO t1 VALUES(0x81308D35A8A5A8A5);
SELECT HEX(c) FROM t1;
HEX(c)
81308A3181308A3181308A3181308A3181308732
81308A3181308A318130873281308A31
81308A318130873281309636
81308A318130873281309637
81308A31813087328130963781309636
8130963681308A31
A8A581308D35
81308D35A8A5
81308D35A8A5A8A5
SELECT HEX(c) FROM t1 WHERE c LIKE CONCAT('%', _gb18030 0x81308A31);
HEX(c)
81308A3181308A3181308A3181308A3181308732
81308A3181308A318130873281308A31
8130963681308A31
SELECT HEX(c) FROM t1 WHERE c LIKE CONCAT('%', _gb18030 0x8130873281308A31, '%');
HEX(c)
81308A3181308A3181308A3181308A3181308732
81308A3181308A318130873281308A31
81308A318130873281309636
81308A318130873281309637
81308A31813087328130963781309636
SELECT HEX(c) FROM t1 WHERE c LIKE CONCAT('%', _gb18030 0x8130873281309636);
HEX(c)
81308A318130873281309636
81308A318130873281309637
SELECT HEX(c) FROM t1 WHERE c LIKE CONCAT('%', _gb18030 0x8130963781309636);
HEX(c)
81308A31813087328130963781309636
SELECT HEX(c) FROM t1 WHERE c LIKE CONCAT(_gb18030 0x81309636, '%');
HEX(c)
8130963681308A31
SELECT HEX(c) FROM t1 WHERE c LIKE CONCAT('%', _gb18030 0x8130963781309636);
HEX(c)
81308A31813087328130963781309636
SELECT HEX(c) FROM t1 WHERE c LIKE CONCAT('%', _gb18030 0x8130963781309636) ESCAPE _gb18030 0x81309637;
HEX(c)
81308A318130873281309636
81308A318130873281309637
81308A31813087328130963781309636
SELECT HEX(c) FROM t1 WHERE c LIKE CONCAT(_gb18030 0xA8A5, '%');
HEX(c)
A8A581308D35
81308D35A8A5
81308D35A8A5A8A5
SELECT HEX(c) FROM t1 WHERE c LIKE CONCAT(_gb18030 0xA8A5, '_');
HEX(c)
A8A581308D35
81308D35A8A5
SELECT HEX(c) FROM t1 WHERE c LIKE CONCAT(_gb18030 0xA8A5, '_', _gb18030 0x81308D35);
HEX(c)
81308D35A8A5A8A5
SELECT HEX(c) FROM t1 WHERE c LIKE CONCAT('%_', _gb18030 0xA8A5);
HEX(c)
A8A581308D35
81308D35A8A5
81308D35A8A5A8A5
DROP TABLE t1;
SET NAMES utf8mb4;
CREATE TABLE t1 (c VARCHAR(10) CHARACTER SET gb18030);
INSERT INTO t1 VALUES (_gb18030 0x8BF5819AEDC3), (_gb18030 0x99CC), (_gb18030 0x90459958), (_gb18030 0xAA95C0E59E509AED), (_gb18030 0xCCE7), (_gb18030 0x9068), (_gb18030 0x90459958);
SELECT ANY_VALUE(HEX(c)), COUNT(c) FROM t1 GROUP BY c COLLATE gb18030_chinese_ci;
ANY_VALUE(HEX(c))	COUNT(c)
8BF5819AEDC3	1
90459958	2
9068	1
99CC	1
AA95C0E59E509AED	1
CCE7	1
DROP TABLE t1;
CREATE TABLE t1 (a int) ENGINE=InnoDB;
Warnings:
Warning	1286	Unknown storage engine 'InnoDB'
DROP TABLE t1;
DROP DATABASE gb18030;
SET sql_mode = default;
#
# End of 5.7 tests
#
