drop table if exists t1, t2;
select null,isnull(null),isnull(1/0),isnull(1/0 = null),ifnull(null,1),ifnull(null,"TRUE"),ifnull("TRUE","ERROR"),1/0 is null,1 is not null;
NULL	isnull(null)	isnull(1/0)	isnull(1/0 = null)	ifnull(null,1)	ifnull(null,"TRUE")	ifnull("TRUE","ERROR")	1/0 is null	1 is not null
NULL	1	1	1	1	TRUE	TRUE	1	1
select 1 | NULL,1 & NULL,1+NULL,1-NULL;
1 | NULL	1 & NULL	1+NULL	1-NULL
NULL	NULL	NULL	NULL
select NULL=NULL,NULL<>NULL,IFNULL(NULL,1.1)+0,IFNULL(NULL,1) | 0;
NULL=NULL	NULL<>NULL	IFNULL(NULL,1.1)+0	IFNULL(NULL,1) | 0
NULL	NULL	1.1	1
select strcmp("a",NULL),(1<NULL)+0.0,NULL regexp "a",null like "a%","a%" like null;
strcmp("a",NULL)	(1<NULL)+0.0	NULL regexp "a"	null like "a%"	"a%" like null
NULL	NULL	NULL	NULL	NULL
select concat("a",NULL),replace(NULL,"a","b"),replace("string","i",NULL),replace("string",NULL,"i"),insert("abc",1,1,NULL),left(NULL,1);
concat("a",NULL)	replace(NULL,"a","b")	replace("string","i",NULL)	replace("string",NULL,"i")	insert("abc",1,1,NULL)	left(NULL,1)
NULL	NULL	NULL	NULL	NULL	NULL
select repeat("a",0),repeat("ab",5+5),repeat("ab",-1),reverse(NULL);
repeat("a",0)	repeat("ab",5+5)	repeat("ab",-1)	reverse(NULL)
	abababababababababab		NULL
select field(NULL,"a","b","c");
field(NULL,"a","b","c")
0
select 2 between null and 1,2 between 3 AND NULL,NULL between 1 and 2,2 between NULL and 3, 2 between 1 AND null;
2 between null and 1	2 between 3 AND NULL	NULL between 1 and 2	2 between NULL and 3	2 between 1 AND null
0	0	NULL	NULL	NULL
SELECT NULL AND NULL, 1 AND NULL, NULL AND 1, NULL OR NULL, 0 OR NULL, NULL OR 0;
NULL AND NULL	1 AND NULL	NULL AND 1	NULL OR NULL	0 OR NULL	NULL OR 0
NULL	NULL	NULL	NULL	NULL	NULL
SELECT (NULL OR NULL) IS NULL;
(NULL OR NULL) IS NULL
1
select NULL AND 0, 0 and NULL;
NULL AND 0	0 and NULL
0	0
select inet_ntoa(null),inet_aton(null);
inet_ntoa(null)	inet_aton(null)
NULL	NULL
select inet6_ntoa(null),inet6_aton(null);
inet6_ntoa(null)	inet6_aton(null)
NULL	NULL
create table t1 (x int);
insert into t1 values (null);
select * from t1 where x != 0;
x
drop table t1;
CREATE TABLE t1 (
indexed_field int default NULL,
KEY indexed_field (indexed_field)
);
INSERT INTO t1 VALUES (NULL),(NULL);
SELECT * FROM t1 WHERE indexed_field=NULL;
indexed_field
SELECT * FROM t1 WHERE indexed_field IS NULL;
indexed_field
NULL
NULL
SELECT * FROM t1 WHERE indexed_field<=>NULL;
indexed_field
NULL
NULL
DROP TABLE t1;
create table t1 (a int, b int);
insert into t1 values(20,null);
select t2.b, ifnull(t2.b,"this is null") from t1 as t2 left join t1 as t3 on
t2.b=t3.a;
b	ifnull(t2.b,"this is null")
NULL	this is null
select t2.b, ifnull(t2.b,"this is null") from t1 as t2 left join t1 as t3 on
t2.b=t3.a order by 1;
b	ifnull(t2.b,"this is null")
NULL	this is null
insert into t1 values(10,null);
select t2.b, ifnull(t2.b,"this is null") from t1 as t2 left join t1 as t3 on
t2.b=t3.a order by 1;
b	ifnull(t2.b,"this is null")
NULL	this is null
NULL	this is null
drop table t1;
SET sql_mode = 'NO_ENGINE_SUBSTITUTION';
CREATE TABLE t1 (a varchar(16) NOT NULL default '', b smallint(6) NOT NULL default 0, c datetime NOT NULL default '0000-00-00 00:00:00', d smallint(6) NOT NULL default 0);
INSERT INTO t1 SET a = "", d= "2003-01-14 03:54:55";
UPDATE t1 SET d=1/NULL;
Warnings:
Warning	1048	Column 'd' cannot be null
UPDATE t1 SET d=NULL;
Warnings:
Warning	1048	Column 'd' cannot be null
INSERT INTO t1 (a) values (null);
ERROR 23000: Column 'a' cannot be null
INSERT INTO t1 (a) values (1/null);
ERROR 23000: Column 'a' cannot be null
INSERT INTO t1 (a) values (null),(null);
Warnings:
Warning	1048	Column 'a' cannot be null
Warning	1048	Column 'a' cannot be null
INSERT INTO t1 (b) values (null);
ERROR 23000: Column 'b' cannot be null
INSERT INTO t1 (b) values (1/null);
ERROR 23000: Column 'b' cannot be null
INSERT INTO t1 (b) values (null),(null);
Warnings:
Warning	1048	Column 'b' cannot be null
Warning	1048	Column 'b' cannot be null
INSERT INTO t1 (c) values (null);
ERROR 23000: Column 'c' cannot be null
INSERT INTO t1 (c) values (1/null);
ERROR 23000: Column 'c' cannot be null
INSERT INTO t1 (c) values (null),(null);
Warnings:
Warning	1048	Column 'c' cannot be null
Warning	1048	Column 'c' cannot be null
INSERT INTO t1 (d) values (null);
ERROR 23000: Column 'd' cannot be null
INSERT INTO t1 (d) values (1/null);
ERROR 23000: Column 'd' cannot be null
INSERT INTO t1 (d) values (null),(null);
Warnings:
Warning	1048	Column 'd' cannot be null
Warning	1048	Column 'd' cannot be null
select * from t1;
a	b	c	d
	0	0000-00-00 00:00:00	0
	0	0000-00-00 00:00:00	0
	0	0000-00-00 00:00:00	0
	0	0000-00-00 00:00:00	0
	0	0000-00-00 00:00:00	0
	0	0000-00-00 00:00:00	0
	0	0000-00-00 00:00:00	0
	0	0000-00-00 00:00:00	0
	0	0000-00-00 00:00:00	0
drop table t1;
SET sql_mode = default;
create table t1 (a int not null, b int not null, index idx(a));
insert into t1 values
(1,1), (2,2), (3,3), (4,4), (5,5), (6,6),
(7,7), (8,8), (9,9), (10,10), (11,11), (12,12);
drop table t1;
select cast(NULL as signed);
cast(NULL as signed)
NULL
create table t1(i int, key(i));
insert into t1 values(1);
insert into t1 select i*2 from t1;
insert into t1 select i*2 from t1;
insert into t1 select i*2 from t1;
insert into t1 select i*2 from t1;
insert into t1 select i*2 from t1;
insert into t1 select i*2 from t1;
insert into t1 select i*2 from t1;
insert into t1 select i*2 from t1;
insert into t1 select i*2 from t1;
insert into t1 values(null);
select count(*) from t1 where i=2 or i is null;
count(*)
10
SET sql_mode = 'NO_ENGINE_SUBSTITUTION';
alter table t1 change i i int not null;
ERROR 22004: Invalid use of NULL value
SET sql_mode = default;
select count(*) from t1 where i=2 or i is null;
count(*)
10
drop table t1;
set names latin2;
ERROR 42000: Unknown character set: 'latin2'
create table t1 select
null as c00,
if(1, null, 'string') as c01,
if(0, null, 'string') as c02,
ifnull(null, 'string') as c03,
ifnull('string', null) as c04,
case when 0 then null else 'string' end as c05,
case when 1 then null else 'string' end as c06,
coalesce(null, 'string') as c07,
coalesce('string', null) as c08,
least('string',null) as c09,
least(null, 'string') as c10,
greatest('string',null) as c11,
greatest(null, 'string') as c12,
nullif('string', null) as c13,
### OB报错1074
###nullif(null, 'string') as c14,
trim('string' from null) as c15,
trim(null from 'string') as c16,
substring_index('string', null, 1) as c17,
substring_index(null, 'string', 1) as c18,
elt(1, null, 'string') as c19,
elt(1, 'string', null) as c20,
concat('string', null) as c21,
concat(null, 'string') as c22,
concat_ws('sep', 'string', null) as c23,
concat_ws('sep', null, 'string') as c24,
concat_ws(null, 'string', 'string') as c25,
make_set(3, 'string', null) as c26,
make_set(3, null, 'string') as c27,
export_set(3, null, 'off', 'sep') as c29,
export_set(3, 'on', null, 'sep') as c30,
export_set(3, 'on', 'off', null) as c31,
replace(null, 'from', 'to') as c32,
replace('str', null, 'to') as c33,
replace('str', 'from', null) as c34,
insert('str', 1, 2, null) as c35,
insert(null, 1, 2, 'str') as c36,
lpad('str', 10, null) as c37,
rpad(null, 10, 'str') as c38;
drop table t1;
select 
case 'str' when 'STR' then 'str' when null then 'null' end as c01,
case 'str' when null then 'null' when 'STR' then 'str' end as c02,
field(null, 'str1', 'str2') as c03,
field('str1','STR1', null) as c04,
field('str1', null, 'STR1') as c05,
'string' in ('STRING', null) as c08,
'string' in (null, 'STRING') as c09;
c01	c02	c03	c04	c05	c08	c09
str	str	0	1	2	1	1
set names latin1;
create table bug19145a (e enum('a','b','c')          default 'b' , s set('x', 'y', 'z')          default 'y' );
create table bug19145b (e enum('a','b','c')          default null, s set('x', 'y', 'z')          default null);
create table bug19145c (e enum('a','b','c') not null default 'b' , s set('x', 'y', 'z') not null default 'y' );
create table bug19145setnotnulldefaultnull (e enum('a','b','c')          default null, s set('x', 'y', 'z') not null default null);
ERROR 42000: Invalid default value for 's'
create table bug19145enumnotnulldefaultnull (e enum('a','b','c') not null default null, s set('x', 'y', 'z')          default null);
ERROR 42000: Invalid default value for 'e'
alter table bug19145a alter column e set default null;
alter table bug19145a alter column s set default null;
alter table bug19145a add column (i int);
alter table bug19145b alter column e set default null;
alter table bug19145b alter column s set default null;
alter table bug19145b add column (i int);
alter table bug19145c alter column e set default null;
ERROR 42000: Invalid default value for 'e'
alter table bug19145c alter column s set default null;
ERROR 42000: Invalid default value for 's'
alter table bug19145c add column (i int);
drop table bug19145a;
drop table bug19145b;
drop table bug19145c;
# End of 4.1 tests
#
# Bug #31471: decimal_bin_size: Assertion `scale >= 0 &&
#             precision > 0 && scale <= precision'
#
CREATE TABLE t1 (a DECIMAL (1, 0) ZEROFILL, b DECIMAL (1, 0) ZEROFILL);
INSERT INTO t1 (a, b) VALUES (0, 0);
CREATE TABLE t2 SELECT IFNULL(a, b) FROM t1;
DESCRIBE t2;
Field	Type	Null	Key	Default	Extra
IFNULL(a, b)	decimal(1,0)	YES		NULL	
DROP TABLE t2;
CREATE TABLE t2 SELECT IFNULL(a, NULL) FROM t1;
DESCRIBE t2;
Field	Type	Null	Key	Default	Extra
IFNULL(a, NULL)	decimal(1,0)	YES		NULL	
DROP TABLE t2;
CREATE TABLE t2 SELECT IFNULL(NULL, b) FROM t1;
DESCRIBE t2;
Field	Type	Null	Key	Default	Extra
IFNULL(NULL, b)	decimal(1,0)	YES		NULL	
DROP TABLE t1, t2;
# End of 5.0 tests
#
# WL#7247: Removal of \N
#
SELECT \N;
NULL
NULL
#
# Bug#29337233 'LATE NULLS FILTERING' NEEDED EVEN FOR EQ_REF JOINS KEYS
#
create table t1 (
pk int primary key,
col_int_unique int,
c char(255) not null default 'xxxx'
) engine = innoDb;
Warnings:
Warning	1286	Unknown storage engine 'innoDb'
create unique index ix1 ON t1(col_int_unique);
insert into t1(pk,col_int_unique) values (1,1), (2,NULL);
insert into t1(pk,col_int_unique) values (3,3), (4,4), (5,5), (6,6), (7,7), (8,8);
SELECT STRAIGHT_JOIN *
FROM t1 LEFT OUTER JOIN t1 AS t2
ON t1.col_int_unique = t2.col_int_unique;
pk	col_int_unique	c	pk	col_int_unique	c
1	1	xxxx	1	1	xxxx
3	3	xxxx	3	3	xxxx
4	4	xxxx	4	4	xxxx
5	5	xxxx	5	5	xxxx
6	6	xxxx	6	6	xxxx
7	7	xxxx	7	7	xxxx
8	8	xxxx	8	8	xxxx
2	NULL	xxxx	NULL	NULL	NULL
SELECT *
FROM t1 LEFT OUTER JOIN t1 AS t2
ON t1.col_int_unique = t2.col_int_unique;
pk	col_int_unique	c	pk	col_int_unique	c
1	1	xxxx	1	1	xxxx
3	3	xxxx	3	3	xxxx
4	4	xxxx	4	4	xxxx
5	5	xxxx	5	5	xxxx
6	6	xxxx	6	6	xxxx
7	7	xxxx	7	7	xxxx
8	8	xxxx	8	8	xxxx
2	NULL	xxxx	NULL	NULL	NULL
SELECT STRAIGHT_JOIN *
FROM t1 JOIN t1 AS t2
ON t1.col_int_unique = t2.col_int_unique
WHERE t1.pk = 2;
pk	col_int_unique	c	pk	col_int_unique	c
SELECT *
FROM t1 JOIN t1 AS t2
ON t1.col_int_unique = t2.col_int_unique
WHERE t1.pk = 2;
pk	col_int_unique	c	pk	col_int_unique	c
drop table t1;
# Bug#33630225: Bad caching of converted constants in NULL-safe compare
SELECT NULL <=> (0 <=> NULL);
NULL <=> (0 <=> NULL)
0
