drop table if exists t1;
#
# Bug#12725206/Bug#61765: WRONG QUERY RESULTS ON SUBPARTITIONS BASED
#                         ON USIGNED BIGINT
#
CREATE TABLE t1 (
a int(11) NOT NULL,
b bigint(20) UNSIGNED NOT NULL
)
PARTITION BY RANGE (a)
SUBPARTITION BY HASH (b)
SUBPARTITIONS 3
(PARTITION p1 VALUES LESS THAN (1308614400),
PARTITION p2 VALUES LESS THAN (1308700800),
PARTITION p3 VALUES LESS THAN (1308787200),
PARTITION p4 VALUES LESS THAN (1308873600),
PARTITION p5 VALUES LESS THAN (1308960000)
);
INSERT INTO t1 VALUES
(1308614400,18446744073709551615),
(1308700800,0xFFFFFFFFFFFFFFFE),
(1308787200,18446744073709551613),
(1308873600,18446744073709551612),
(1308873600, 12531568256096620965),
(1308873600, 12531568256096),
(1308873600, 9223372036854775808);
SELECT a,b,HEX(b) FROM t1 ORDER BY a, b;
a	b	HEX(b)
1308614400	18446744073709551615	FFFFFFFFFFFFFFFF
1308700800	18446744073709551614	FFFFFFFFFFFFFFFE
1308787200	18446744073709551613	FFFFFFFFFFFFFFFD
1308873600	12531568256096	B65BBACA460
1308873600	9223372036854775808	8000000000000000
1308873600	12531568256096620965	ADE912EF0F3351A5
1308873600	18446744073709551612	FFFFFFFFFFFFFFFC
# The following queries returned nothing
SELECT * FROM t1 WHERE b = 9223372036854775808;
a	b
1308873600	9223372036854775808
SELECT * FROM t1 WHERE b = 18446744073709551612;
a	b
1308873600	18446744073709551612
SELECT * FROM t1 WHERE b = 18446744073709551615;
a	b
1308614400	18446744073709551615
EXPLAIN SELECT * FROM t1 WHERE b = 9223372036854775808;
Query Plan
=============================================================
|ID|OPERATOR                 |NAME    |EST.ROWS|EST.TIME(us)|
-------------------------------------------------------------
|0 |PX COORDINATOR           |        |1       |12          |
|1 |└─EXCHANGE OUT DISTR     |:EX10000|1       |12          |
|2 |  └─PX PARTITION ITERATOR|        |1       |11          |
|3 |    └─TABLE FULL SCAN    |t1      |1       |11          |
=============================================================
Outputs & filters:
-------------------------------------
  0 - output([INTERNAL_FUNCTION(t1.a, t1.b)]), filter(nil), rowset=16
  1 - output([INTERNAL_FUNCTION(t1.a, t1.b)]), filter(nil), rowset=16
      dop=1
  2 - output([t1.a], [t1.b]), filter(nil), rowset=16
      force partition granule
  3 - output([t1.a], [t1.b]), filter([t1.b = 9223372036854775808]), rowset=16
      access([t1.a], [t1.b]), partitions(p0sp1, p1sp1, p2sp1, p3sp1, p4sp1)
      is_index_back=false, is_global_index=false, filter_before_indexback[false], 
      range_key([t1.__pk_increment]), range(MIN ; MAX)always true
EXPLAIN SELECT * FROM t1 WHERE b = 18446744073709551612;
Query Plan
=============================================================
|ID|OPERATOR                 |NAME    |EST.ROWS|EST.TIME(us)|
-------------------------------------------------------------
|0 |PX COORDINATOR           |        |1       |12          |
|1 |└─EXCHANGE OUT DISTR     |:EX10000|1       |12          |
|2 |  └─PX PARTITION ITERATOR|        |1       |11          |
|3 |    └─TABLE FULL SCAN    |t1      |1       |11          |
=============================================================
Outputs & filters:
-------------------------------------
  0 - output([INTERNAL_FUNCTION(t1.a, t1.b)]), filter(nil), rowset=16
  1 - output([INTERNAL_FUNCTION(t1.a, t1.b)]), filter(nil), rowset=16
      dop=1
  2 - output([t1.a], [t1.b]), filter(nil), rowset=16
      force partition granule
  3 - output([t1.a], [t1.b]), filter([t1.b = 18446744073709551612]), rowset=16
      access([t1.a], [t1.b]), partitions(p0sp1, p1sp1, p2sp1, p3sp1, p4sp1)
      is_index_back=false, is_global_index=false, filter_before_indexback[false], 
      range_key([t1.__pk_increment]), range(MIN ; MAX)always true
EXPLAIN SELECT * FROM t1 WHERE b = 18446744073709551615;
Query Plan
=============================================================
|ID|OPERATOR                 |NAME    |EST.ROWS|EST.TIME(us)|
-------------------------------------------------------------
|0 |PX COORDINATOR           |        |1       |12          |
|1 |└─EXCHANGE OUT DISTR     |:EX10000|1       |12          |
|2 |  └─PX PARTITION ITERATOR|        |1       |11          |
|3 |    └─TABLE FULL SCAN    |t1      |1       |11          |
=============================================================
Outputs & filters:
-------------------------------------
  0 - output([INTERNAL_FUNCTION(t1.a, t1.b)]), filter(nil), rowset=16
  1 - output([INTERNAL_FUNCTION(t1.a, t1.b)]), filter(nil), rowset=16
      dop=1
  2 - output([t1.a], [t1.b]), filter(nil), rowset=16
      force partition granule
  3 - output([t1.a], [t1.b]), filter([t1.b = 18446744073709551615]), rowset=16
      access([t1.a], [t1.b]), partitions(p0sp1, p1sp1, p2sp1, p3sp1, p4sp1)
      is_index_back=false, is_global_index=false, filter_before_indexback[false], 
      range_key([t1.__pk_increment]), range(MIN ; MAX)always true
DROP TABLE t1;
CREATE TABLE t1 (c1 INT)
PARTITION BY HASH (c1)
PARTITIONS 15;
INSERT INTO t1 VALUES (1), (2), (3), (4), (5);
ALTER TABLE t1 COALESCE PARTITION 13;
ERROR 42000: You have an error in your SQL syntax; check the manual that corresponds to your OceanBase version for the right syntax to use near 'COALESCE PARTITION 13' at line 1
DROP TABLE t1;
CREATE TABLE t1 (c1 INT)
PARTITION BY LINEAR HASH (c1)
PARTITIONS 5;
ERROR 42000: You have an error in your SQL syntax; check the manual that corresponds to your OceanBase version for the right syntax to use near 'LINEAR HASH (c1)
PARTITIONS 5' at line 2
CREATE TABLE t1 (c1 INT)
PARTITION BY LINEAR HASH (c1)
PARTITIONS 3;
ERROR 42000: You have an error in your SQL syntax; check the manual that corresponds to your OceanBase version for the right syntax to use near 'LINEAR HASH (c1)
PARTITIONS 3' at line 2
create table t1 (a int unsigned)
partition by hash(a div 2)
partitions 4;
insert into t1 values (null),(0),(1),(2),(3),(4),(5),(6),(7);
select * from t1 where a < 0;
a
select * from t1 where a is null or (a >= 5 and a <= 7);
a
NULL
5
6
7
select * from t1 where a is null;
a
NULL
select * from t1 where a is not null;
a
0
1
2
3
4
5
6
7
select * from t1 where a >= 1 and a < 3;
a
1
2
select * from t1 where a >= 3 and a <= 5;
a
3
4
5
select * from t1 where a > 2 and a < 4;
a
3
select * from t1 where a > 3 and a <= 6;
a
4
5
6
select * from t1 where a > 5;
a
6
7
select * from t1 where a >= 1 and a <= 5;
a
1
2
3
4
5
explain select * from t1 where a < 0;
Query Plan
=============================================================
|ID|OPERATOR                 |NAME    |EST.ROWS|EST.TIME(us)|
-------------------------------------------------------------
|0 |PX COORDINATOR           |        |1       |10          |
|1 |└─EXCHANGE OUT DISTR     |:EX10000|1       |10          |
|2 |  └─PX PARTITION ITERATOR|        |1       |9           |
|3 |    └─TABLE FULL SCAN    |t1      |1       |9           |
=============================================================
Outputs & filters:
-------------------------------------
  0 - output([INTERNAL_FUNCTION(t1.a)]), filter(nil), rowset=16
  1 - output([INTERNAL_FUNCTION(t1.a)]), filter(nil), rowset=16
      dop=1
  2 - output([t1.a]), filter(nil), rowset=16
      force partition granule
  3 - output([t1.a]), filter([t1.a < 0]), rowset=16
      access([t1.a]), partitions(p[0-3])
      is_index_back=false, is_global_index=false, filter_before_indexback[false], 
      range_key([t1.__pk_increment]), range(MIN ; MAX)always true
explain select * from t1 where a is null or (a >= 5 and a <= 7);
Query Plan
=============================================================
|ID|OPERATOR                 |NAME    |EST.ROWS|EST.TIME(us)|
-------------------------------------------------------------
|0 |PX COORDINATOR           |        |1       |9           |
|1 |└─EXCHANGE OUT DISTR     |:EX10000|1       |9           |
|2 |  └─PX PARTITION ITERATOR|        |1       |9           |
|3 |    └─TABLE FULL SCAN    |t1      |1       |9           |
=============================================================
Outputs & filters:
-------------------------------------
  0 - output([INTERNAL_FUNCTION(t1.a)]), filter(nil), rowset=16
  1 - output([INTERNAL_FUNCTION(t1.a)]), filter(nil), rowset=16
      dop=1
  2 - output([t1.a]), filter(nil), rowset=16
      force partition granule
  3 - output([t1.a]), filter([t1.a IS NULL OR t1.a >= 5 AND t1.a <= 7]), rowset=16
      access([t1.a]), partitions(p[0-3])
      is_index_back=false, is_global_index=false, filter_before_indexback[false], 
      range_key([t1.__pk_increment]), range(MIN ; MAX)always true
explain select * from t1 where a is null;
Query Plan
===============================================
|ID|OPERATOR       |NAME|EST.ROWS|EST.TIME(us)|
-----------------------------------------------
|0 |TABLE FULL SCAN|t1  |0       |3           |
===============================================
Outputs & filters:
-------------------------------------
  0 - output([t1.a]), filter([t1.a IS NULL]), rowset=16
      access([t1.a]), partitions(p0)
      is_index_back=false, is_global_index=false, filter_before_indexback[false], 
      range_key([t1.__pk_increment]), range(MIN ; MAX)always true
explain select * from t1 where a is not null;
Query Plan
=============================================================
|ID|OPERATOR                 |NAME    |EST.ROWS|EST.TIME(us)|
-------------------------------------------------------------
|0 |PX COORDINATOR           |        |9       |14          |
|1 |└─EXCHANGE OUT DISTR     |:EX10000|9       |13          |
|2 |  └─PX PARTITION ITERATOR|        |9       |9           |
|3 |    └─TABLE FULL SCAN    |t1      |9       |9           |
=============================================================
Outputs & filters:
-------------------------------------
  0 - output([INTERNAL_FUNCTION(t1.a)]), filter(nil), rowset=16
  1 - output([INTERNAL_FUNCTION(t1.a)]), filter(nil), rowset=16
      dop=1
  2 - output([t1.a]), filter(nil), rowset=16
      force partition granule
  3 - output([t1.a]), filter([t1.a IS NOT NULL]), rowset=16
      access([t1.a]), partitions(p[0-3])
      is_index_back=false, is_global_index=false, filter_before_indexback[false], 
      range_key([t1.__pk_increment]), range(MIN ; MAX)always true
explain select * from t1 where a >= 1 and a < 3;
Query Plan
=============================================================
|ID|OPERATOR                 |NAME    |EST.ROWS|EST.TIME(us)|
-------------------------------------------------------------
|0 |PX COORDINATOR           |        |1       |5           |
|1 |└─EXCHANGE OUT DISTR     |:EX10000|1       |5           |
|2 |  └─PX PARTITION ITERATOR|        |1       |5           |
|3 |    └─TABLE FULL SCAN    |t1      |1       |5           |
=============================================================
Outputs & filters:
-------------------------------------
  0 - output([INTERNAL_FUNCTION(t1.a)]), filter(nil), rowset=16
  1 - output([INTERNAL_FUNCTION(t1.a)]), filter(nil), rowset=16
      dop=1
  2 - output([t1.a]), filter(nil), rowset=16
      force partition granule
  3 - output([t1.a]), filter([t1.a >= 1], [t1.a < 3]), rowset=16
      access([t1.a]), partitions(p[0-1])
      is_index_back=false, is_global_index=false, filter_before_indexback[false,false], 
      range_key([t1.__pk_increment]), range(MIN ; MAX)always true
explain select * from t1 where a >= 3 and a <= 5;
Query Plan
=============================================================
|ID|OPERATOR                 |NAME    |EST.ROWS|EST.TIME(us)|
-------------------------------------------------------------
|0 |PX COORDINATOR           |        |1       |5           |
|1 |└─EXCHANGE OUT DISTR     |:EX10000|1       |5           |
|2 |  └─PX PARTITION ITERATOR|        |1       |5           |
|3 |    └─TABLE FULL SCAN    |t1      |1       |5           |
=============================================================
Outputs & filters:
-------------------------------------
  0 - output([INTERNAL_FUNCTION(t1.a)]), filter(nil), rowset=16
  1 - output([INTERNAL_FUNCTION(t1.a)]), filter(nil), rowset=16
      dop=1
  2 - output([t1.a]), filter(nil), rowset=16
      force partition granule
  3 - output([t1.a]), filter([t1.a >= 3], [t1.a <= 5]), rowset=16
      access([t1.a]), partitions(p[1-2])
      is_index_back=false, is_global_index=false, filter_before_indexback[false,false], 
      range_key([t1.__pk_increment]), range(MIN ; MAX)always true
explain select * from t1 where a > 2 and a < 4;
Query Plan
===============================================
|ID|OPERATOR       |NAME|EST.ROWS|EST.TIME(us)|
-----------------------------------------------
|0 |TABLE FULL SCAN|t1  |1       |3           |
===============================================
Outputs & filters:
-------------------------------------
  0 - output([t1.a]), filter([t1.a > 2], [t1.a < 4]), rowset=16
      access([t1.a]), partitions(p1)
      is_index_back=false, is_global_index=false, filter_before_indexback[false,false], 
      range_key([t1.__pk_increment]), range(MIN ; MAX)always true
explain select * from t1 where a > 3 and a <= 6;
Query Plan
=============================================================
|ID|OPERATOR                 |NAME    |EST.ROWS|EST.TIME(us)|
-------------------------------------------------------------
|0 |PX COORDINATOR           |        |1       |5           |
|1 |└─EXCHANGE OUT DISTR     |:EX10000|1       |5           |
|2 |  └─PX PARTITION ITERATOR|        |1       |5           |
|3 |    └─TABLE FULL SCAN    |t1      |1       |5           |
=============================================================
Outputs & filters:
-------------------------------------
  0 - output([INTERNAL_FUNCTION(t1.a)]), filter(nil), rowset=16
  1 - output([INTERNAL_FUNCTION(t1.a)]), filter(nil), rowset=16
      dop=1
  2 - output([t1.a]), filter(nil), rowset=16
      force partition granule
  3 - output([t1.a]), filter([t1.a > 3], [t1.a <= 6]), rowset=16
      access([t1.a]), partitions(p[2-3])
      is_index_back=false, is_global_index=false, filter_before_indexback[false,false], 
      range_key([t1.__pk_increment]), range(MIN ; MAX)always true
explain select * from t1 where a > 5;
Query Plan
=============================================================
|ID|OPERATOR                 |NAME    |EST.ROWS|EST.TIME(us)|
-------------------------------------------------------------
|0 |PX COORDINATOR           |        |1       |10          |
|1 |└─EXCHANGE OUT DISTR     |:EX10000|1       |10          |
|2 |  └─PX PARTITION ITERATOR|        |1       |9           |
|3 |    └─TABLE FULL SCAN    |t1      |1       |9           |
=============================================================
Outputs & filters:
-------------------------------------
  0 - output([INTERNAL_FUNCTION(t1.a)]), filter(nil), rowset=16
  1 - output([INTERNAL_FUNCTION(t1.a)]), filter(nil), rowset=16
      dop=1
  2 - output([t1.a]), filter(nil), rowset=16
      force partition granule
  3 - output([t1.a]), filter([t1.a > 5]), rowset=16
      access([t1.a]), partitions(p[0-3])
      is_index_back=false, is_global_index=false, filter_before_indexback[false], 
      range_key([t1.__pk_increment]), range(MIN ; MAX)always true
explain select * from t1 where a >= 1 and a <= 5;
Query Plan
=============================================================
|ID|OPERATOR                 |NAME    |EST.ROWS|EST.TIME(us)|
-------------------------------------------------------------
|0 |PX COORDINATOR           |        |1       |7           |
|1 |└─EXCHANGE OUT DISTR     |:EX10000|1       |7           |
|2 |  └─PX PARTITION ITERATOR|        |1       |7           |
|3 |    └─TABLE FULL SCAN    |t1      |1       |7           |
=============================================================
Outputs & filters:
-------------------------------------
  0 - output([INTERNAL_FUNCTION(t1.a)]), filter(nil), rowset=16
  1 - output([INTERNAL_FUNCTION(t1.a)]), filter(nil), rowset=16
      dop=1
  2 - output([t1.a]), filter(nil), rowset=16
      force partition granule
  3 - output([t1.a]), filter([t1.a >= 1], [t1.a <= 5]), rowset=16
      access([t1.a]), partitions(p[0-2])
      is_index_back=false, is_global_index=false, filter_before_indexback[false,false], 
      range_key([t1.__pk_increment]), range(MIN ; MAX)always true
drop table t1;
CREATE TABLE t1 (
a int not null,
b int not null,
c int not null,
primary key(a,b))
partition by hash (a + 2)
partitions 3
(partition x1,
partition x2,
partition x3);
insert into t1 values (1,1,1);
insert into t1 values (2,1,1);
insert into t1 values (3,1,1);
insert into t1 values (4,1,1);
insert into t1 values (5,1,1);
select * from t1;
a	b	c
1	1	1
4	1	1
2	1	1
5	1	1
3	1	1
update t1 set c=3 where b=1;
select * from t1;
a	b	c
1	1	3
4	1	3
2	1	3
5	1	3
3	1	3
select b from t1 where a=3;
b
1
select b,c from t1 where a=1 AND b=1;
b	c
1	3
delete from t1 where a=1;
delete from t1 where c=3;
select * from t1;
a	b	c
ALTER TABLE t1
partition by hash (a + 3)
partitions 3
(partition x1,
partition x2,
partition x3);
select * from t1;
a	b	c
drop table t1;
CREATE TABLE t1 (
a int not null,
b int not null,
c int not null,
primary key(a,b))
partition by hash (a)
(partition x1);
drop table t1;
CREATE TABLE t1 (
a int not null,
b int not null,
c int not null,
primary key(a,b))
partition by key (a)
(partition x1);
drop table t1;
CREATE TABLE t1 (f1 INTEGER, f2 char(20)) PARTITION BY HASH(f1) PARTITIONS 2;
INSERT INTO t1 SET f1 = 0 - 1, f2 = '#######';
select * from t1;
f1	f2
-1	#######
drop table t1;
create table t1 (c1 int DEFAULT NULL,
c2 varchar (30) DEFAULT NULL,
c3 date DEFAULT NULL)
partition by hash (to_days(c3))
partitions 12;
insert into t1 values
(136,'abc','2002-01-05'),(142,'abc','2002-02-14'),(162,'abc','2002-06-28'),
(182,'abc','2002-11-09'),(158,'abc','2002-06-01'),(184,'abc','2002-11-22');
select * from t1;
c1	c2	c3
136	abc	2002-01-05
158	abc	2002-06-01
142	abc	2002-02-14
162	abc	2002-06-28
182	abc	2002-11-09
184	abc	2002-11-22
select * from t1 where c3 between '2002-01-01' and '2002-12-31';
c1	c2	c3
136	abc	2002-01-05
158	abc	2002-06-01
142	abc	2002-02-14
162	abc	2002-06-28
182	abc	2002-11-09
184	abc	2002-11-22
drop table t1;
#
#
#  BUG#22152229 - ASSERTION FAILED: RC == TYPE_OK, FILE .\DD\IMPL\RAW\RAW_RECORD.CC
#
#
SET NAMES utf8;
CREATE TABLE T (a INT) PARTITION BY HASH('�') PARTITIONS 1;
ERROR HY000: Constant or random or timezone-dependent expressions in (sub)partitioning function are not allowed
DROP TABLE T;
CREATE TABLE T (a INT) ENGINE=InnoDB;
Warnings:
Warning	1286	Unknown storage engine 'InnoDB'
ALTER TABLE T PARTITION BY HASH('�') PARTITIONS 1;
ERROR HY000: Constant or random or timezone-dependent expressions in (sub)partitioning function are not allowed
DROP TABLE T;
SET NAMES default;
DROP TABLE IF EXISTS t1;
CREATE TABLE t1 (c1 TINYINT NULL, c2 CHAR(5)) PARTITION BY HASH(c1) PARTITIONS 1;
DROP TABLE IF EXISTS t1;
CREATE TABLE t1 (c1 SMALLINT NULL, c2 CHAR(5)) PARTITION BY HASH(c1) PARTITIONS 1;
DROP TABLE IF EXISTS t1;
CREATE TABLE t1 (c1 MEDIUMINT NULL, c2 CHAR(5)) PARTITION BY HASH(c1) PARTITIONS 1;
DROP TABLE t1;
CREATE TABLE t1 (c1 INT NULL, c2 CHAR(5)) PARTITION BY HASH(c1) PARTITIONS 1;
DROP TABLE t1;
CREATE TABLE t1 (c1 INTEGER NULL, c2 CHAR(5)) PARTITION BY HASH(c1) PARTITIONS 1;
DROP TABLE t1;
CREATE TABLE t1 (c1 BIGINT NULL, c2 CHAR(5)) PARTITION BY HASH(c1) PARTITIONS 1;
DROP TABLE t1;
CREATE TABLE t1 (c1 TINYINT NOT NULL, c2 CHAR(5)) PARTITION BY HASH(c1) PARTITIONS 1;
DROP TABLE t1;
CREATE TABLE t1 (c1 SMALLINT NOT NULL, c2 CHAR(5)) PARTITION BY HASH(c1) PARTITIONS 1;
DROP TABLE t1;
CREATE TABLE t1 (c1 MEDIUMINT NOT NULL, c2 CHAR(5)) PARTITION BY HASH(c1) PARTITIONS 1;
DROP TABLE t1;
CREATE TABLE t1 (c1 INT NOT NULL, c2 CHAR(5)) PARTITION BY HASH(c1) PARTITIONS 1;
DROP TABLE t1;
CREATE TABLE t1 (c1 INTEGER NOT NULL, c2 CHAR(5)) PARTITION BY HASH(c1) PARTITIONS 1;
DROP TABLE t1;
CREATE TABLE t1 (c1 BIGINT NOT NULL, c2 CHAR(5)) PARTITION BY HASH(c1) PARTITIONS 1;
DROP TABLE t1;
CREATE TABLE t1 (c1 TINYINT NULL, c2 CHAR(5)) PARTITION BY HASH(c1) PARTITIONS 2;
DROP TABLE t1;
CREATE TABLE t1 (c1 SMALLINT NULL, c2 CHAR(5)) PARTITION BY HASH(c1) PARTITIONS 2;
DROP TABLE t1;
CREATE TABLE t1 (c1 MEDIUMINT NULL, c2 CHAR(5)) PARTITION BY HASH(c1) PARTITIONS 2;
DROP TABLE t1;
CREATE TABLE t1 (c1 INT NULL, c2 CHAR(5)) PARTITION BY HASH(c1) PARTITIONS 2;
DROP TABLE t1;
CREATE TABLE t1 (c1 INTEGER NULL, c2 CHAR(5)) PARTITION BY HASH(c1) PARTITIONS 2;
DROP TABLE t1;
CREATE TABLE t1 (c1 BIGINT NULL, c2 CHAR(5)) PARTITION BY HASH(c1) PARTITIONS 2;
DROP TABLE t1;
CREATE TABLE t1 (c1 TINYINT NOT NULL, c2 CHAR(5)) PARTITION BY HASH(c1) PARTITIONS 2;
DROP TABLE t1;
CREATE TABLE t1 (c1 SMALLINT NOT NULL, c2 CHAR(5)) PARTITION BY HASH(c1) PARTITIONS 2;
DROP TABLE t1;
CREATE TABLE t1 (c1 MEDIUMINT NOT NULL, c2 CHAR(5)) PARTITION BY HASH(c1) PARTITIONS 2;
DROP TABLE t1;
CREATE TABLE t1 (c1 INT NOT NULL, c2 CHAR(5)) PARTITION BY HASH(c1) PARTITIONS 2;
DROP TABLE t1;
CREATE TABLE t1 (c1 INTEGER NOT NULL, c2 CHAR(5)) PARTITION BY HASH(c1) PARTITIONS 2;
DROP TABLE t1;
CREATE TABLE t1 (c1 BIGINT NOT NULL, c2 CHAR(5)) PARTITION BY HASH(c1) PARTITIONS 2;
DROP TABLE t1;
CREATE TABLE t1 (c1 TINYINT NULL, c2 CHAR(5)) PARTITION BY HASH(c1) PARTITIONS 3;
DROP TABLE t1;
CREATE TABLE t1 (c1 SMALLINT NULL, c2 CHAR(5)) PARTITION BY HASH(c1) PARTITIONS 3;
DROP TABLE t1;
CREATE TABLE t1 (c1 MEDIUMINT NULL, c2 CHAR(5)) PARTITION BY HASH(c1) PARTITIONS 3;
DROP TABLE t1;
CREATE TABLE t1 (c1 INT NULL, c2 CHAR(5)) PARTITION BY HASH(c1) PARTITIONS 3;
DROP TABLE t1;
CREATE TABLE t1 (c1 INTEGER NULL, c2 CHAR(5)) PARTITION BY HASH(c1) PARTITIONS 3;
DROP TABLE t1;
CREATE TABLE t1 (c1 BIGINT NULL, c2 CHAR(5)) PARTITION BY HASH(c1) PARTITIONS 3;
DROP TABLE t1;
CREATE TABLE t1 (c1 TINYINT NOT NULL, c2 CHAR(5)) PARTITION BY HASH(c1) PARTITIONS 3;
DROP TABLE t1;
CREATE TABLE t1 (c1 SMALLINT NOT NULL, c2 CHAR(5)) PARTITION BY HASH(c1) PARTITIONS 3;
DROP TABLE t1;
CREATE TABLE t1 (c1 MEDIUMINT NOT NULL, c2 CHAR(5)) PARTITION BY HASH(c1) PARTITIONS 3;
DROP TABLE t1;
CREATE TABLE t1 (c1 INT NOT NULL, c2 CHAR(5)) PARTITION BY HASH(c1) PARTITIONS 3;
DROP TABLE t1;
CREATE TABLE t1 (c1 INTEGER NOT NULL, c2 CHAR(5)) PARTITION BY HASH(c1) PARTITIONS 3;
DROP TABLE t1;
CREATE TABLE t1 (c1 BIGINT NOT NULL, c2 CHAR(5)) PARTITION BY HASH(c1) PARTITIONS 3;
DROP TABLE t1;
CREATE TABLE t1 (c1 TINYINT NULL, c2 CHAR(5)) PARTITION BY HASH(c1) PARTITIONS 4;
DROP TABLE t1;
CREATE TABLE t1 (c1 SMALLINT NULL, c2 CHAR(5)) PARTITION BY HASH(c1) PARTITIONS 4;
DROP TABLE t1;
CREATE TABLE t1 (c1 MEDIUMINT NULL, c2 CHAR(5)) PARTITION BY HASH(c1) PARTITIONS 4;
DROP TABLE t1;
CREATE TABLE t1 (c1 INT NULL, c2 CHAR(5)) PARTITION BY HASH(c1) PARTITIONS 4;
DROP TABLE t1;
CREATE TABLE t1 (c1 INTEGER NULL, c2 CHAR(5)) PARTITION BY HASH(c1) PARTITIONS 4;
DROP TABLE t1;
CREATE TABLE t1 (c1 BIGINT NULL, c2 CHAR(5)) PARTITION BY HASH(c1) PARTITIONS 4;
DROP TABLE t1;
CREATE TABLE t1 (c1 TINYINT NOT NULL, c2 CHAR(5)) PARTITION BY HASH(c1) PARTITIONS 4;
DROP TABLE t1;
CREATE TABLE t1 (c1 SMALLINT NOT NULL, c2 CHAR(5)) PARTITION BY HASH(c1) PARTITIONS 4;
DROP TABLE t1;
CREATE TABLE t1 (c1 MEDIUMINT NOT NULL, c2 CHAR(5)) PARTITION BY HASH(c1) PARTITIONS 4;
DROP TABLE t1;
CREATE TABLE t1 (c1 INT NOT NULL, c2 CHAR(5)) PARTITION BY HASH(c1) PARTITIONS 4;
DROP TABLE t1;
CREATE TABLE t1 (c1 INTEGER NOT NULL, c2 CHAR(5)) PARTITION BY HASH(c1) PARTITIONS 4;
DROP TABLE t1;
CREATE TABLE t1 (c1 BIGINT NOT NULL, c2 CHAR(5)) PARTITION BY HASH(c1) PARTITIONS 4;
DROP TABLE t1;
CREATE TABLE t1 (c1 TINYINT NULL, c2 CHAR(5)) PARTITION BY HASH(c1) PARTITIONS 5;
DROP TABLE t1;
CREATE TABLE t1 (c1 SMALLINT NULL, c2 CHAR(5)) PARTITION BY HASH(c1) PARTITIONS 5;
DROP TABLE t1;
CREATE TABLE t1 (c1 MEDIUMINT NULL, c2 CHAR(5)) PARTITION BY HASH(c1) PARTITIONS 5;
DROP TABLE t1;
CREATE TABLE t1 (c1 INT NULL, c2 CHAR(5)) PARTITION BY HASH(c1) PARTITIONS 5;
DROP TABLE t1;
CREATE TABLE t1 (c1 INTEGER NULL, c2 CHAR(5)) PARTITION BY HASH(c1) PARTITIONS 5;
DROP TABLE t1;
CREATE TABLE t1 (c1 BIGINT NULL, c2 CHAR(5)) PARTITION BY HASH(c1) PARTITIONS 5;
DROP TABLE t1;
CREATE TABLE t1 (c1 TINYINT NOT NULL, c2 CHAR(5)) PARTITION BY HASH(c1) PARTITIONS 5;
DROP TABLE t1;
CREATE TABLE t1 (c1 SMALLINT NOT NULL, c2 CHAR(5)) PARTITION BY HASH(c1) PARTITIONS 5;
DROP TABLE t1;
CREATE TABLE t1 (c1 MEDIUMINT NOT NULL, c2 CHAR(5)) PARTITION BY HASH(c1) PARTITIONS 5;
DROP TABLE t1;
CREATE TABLE t1 (c1 INT NOT NULL, c2 CHAR(5)) PARTITION BY HASH(c1) PARTITIONS 5;
DROP TABLE t1;
CREATE TABLE t1 (c1 INTEGER NOT NULL, c2 CHAR(5)) PARTITION BY HASH(c1) PARTITIONS 5;
DROP TABLE t1;
CREATE TABLE t1 (c1 BIGINT NOT NULL, c2 CHAR(5)) PARTITION BY HASH(c1) PARTITIONS 5;
DROP TABLE t1;
CREATE TABLE t1 (c1 TINYINT NULL, c2 CHAR(5)) PARTITION BY HASH(c1) PARTITIONS 10;
DROP TABLE t1;
CREATE TABLE t1 (c1 SMALLINT NULL, c2 CHAR(5)) PARTITION BY HASH(c1) PARTITIONS 10;
DROP TABLE t1;
CREATE TABLE t1 (c1 MEDIUMINT NULL, c2 CHAR(5)) PARTITION BY HASH(c1) PARTITIONS 10;
DROP TABLE t1;
CREATE TABLE t1 (c1 INT NULL, c2 CHAR(5)) PARTITION BY HASH(c1) PARTITIONS 10;
DROP TABLE t1;
CREATE TABLE t1 (c1 INTEGER NULL, c2 CHAR(5)) PARTITION BY HASH(c1) PARTITIONS 10;
DROP TABLE t1;
CREATE TABLE t1 (c1 BIGINT NULL, c2 CHAR(5)) PARTITION BY HASH(c1) PARTITIONS 10;
DROP TABLE t1;
CREATE TABLE t1 (c1 TINYINT NOT NULL, c2 CHAR(5)) PARTITION BY HASH(c1) PARTITIONS 10;
DROP TABLE t1;
CREATE TABLE t1 (c1 SMALLINT NOT NULL, c2 CHAR(5)) PARTITION BY HASH(c1) PARTITIONS 10;
DROP TABLE t1;
CREATE TABLE t1 (c1 MEDIUMINT NOT NULL, c2 CHAR(5)) PARTITION BY HASH(c1) PARTITIONS 10;
DROP TABLE t1;
CREATE TABLE t1 (c1 INT NOT NULL, c2 CHAR(5)) PARTITION BY HASH(c1) PARTITIONS 10;
DROP TABLE t1;
CREATE TABLE t1 (c1 INTEGER NOT NULL, c2 CHAR(5)) PARTITION BY HASH(c1) PARTITIONS 10;
DROP TABLE t1;
CREATE TABLE t1 (c1 BIGINT NOT NULL, c2 CHAR(5)) PARTITION BY HASH(c1) PARTITIONS 10;
DROP TABLE t1;
CREATE TABLE t1 (c1 TINYINT NULL, c2 CHAR(5)) PARTITION BY HASH(c1) PARTITIONS 50;
DROP TABLE t1;
CREATE TABLE t1 (c1 MEDIUMINT NULL, c2 CHAR(5)) PARTITION BY HASH(c1) PARTITIONS 50;
DROP TABLE t1;
CREATE TABLE t1 (c1 INT NULL, c2 CHAR(5)) PARTITION BY HASH(c1) PARTITIONS 50;
DROP TABLE t1;
CREATE TABLE t1 (c1 INTEGER NULL, c2 CHAR(5)) PARTITION BY HASH(c1) PARTITIONS 50;
DROP TABLE t1;
CREATE TABLE t1 (c1 BIGINT NULL, c2 CHAR(5)) PARTITION BY HASH(c1) PARTITIONS 50;
DROP TABLE t1;
CREATE TABLE t1 (c1 TINYINT NOT NULL, c2 CHAR(5)) PARTITION BY HASH(c1) PARTITIONS 50;
DROP TABLE t1;
CREATE TABLE t1 (c1 SMALLINT NOT NULL, c2 CHAR(5)) PARTITION BY HASH(c1) PARTITIONS 50;
DROP TABLE t1;
CREATE TABLE t1 (c1 MEDIUMINT NOT NULL, c2 CHAR(5)) PARTITION BY HASH(c1) PARTITIONS 50;
DROP TABLE t1;
CREATE TABLE t1 (c1 INT NOT NULL, c2 CHAR(5)) PARTITION BY HASH(c1) PARTITIONS 50;
DROP TABLE t1;
CREATE TABLE t1 (c1 INTEGER NOT NULL, c2 CHAR(5)) PARTITION BY HASH(c1) PARTITIONS 50;
DROP TABLE t1;
CREATE TABLE t1 (c1 BIGINT NOT NULL, c2 CHAR(5)) PARTITION BY HASH(c1) PARTITIONS 50;
