drop table if exists t1, t2;
create table t1 (a integer, b integer,c1 CHAR(10));
insert into t1 (a) values (1),(2);
truncate table t1;
select count(*) from t1;
count(*)
0
insert into t1 values(1,2,"test");
select count(*) from t1;
count(*)
1
delete from t1;
select * from t1;
a	b	c1
drop table t1;
select count(*) from t1;
ERROR 42S02: Table 'test.t1' doesn't exist
create table t1 (a integer auto_increment primary key);
insert into t1 (a) values (NULL),(NULL);
truncate table t1;
insert into t1 (a) values (NULL),(NULL);
SELECT * from t1;
a
1
2
delete from t1;
insert into t1 (a) values (NULL),(NULL);
SELECT * from t1;
a
3
4
drop table t1;
create table t1 (s1 int);
insert into t1 (s1) values (1), (2), (3), (4), (5);
drop view v1;
create view v1 as select * from t1;
truncate table v1;
ERROR 42S02: Table 'test.v1' doesn't exist
drop view v1;
drop table t1;
#
# Bug#20667 - Truncate table fails for a write locked table
#
#
# Bug#46452 Crash in MDL, HANDLER OPEN + TRUNCATE TABLE
#
# End of 6.0 tests
#
# Bug#25571453: ASSERTION `MDL_CHECKER::IS_READ_LOCKED(M_THD, *OBJECT)'
#               FAILED
#
CREATE TABLE t1(a INT);
CREATE SCHEMA s1;
CREATE VIEW s1.v1 AS SELECT * FROM t1;
LOCK TABLE s1.v1 WRITE;
TRUNCATE TABLE t1;
UNLOCK TABLES;
DROP VIEW s1.v1;
DROP TABLE t1;
DROP SCHEMA s1;
