set @@session.sql_mode='';
drop table if exists t1, t2;
SET SQL_WARNINGS=1;
create table t1 (a int);
create table t1 (a int);
ERROR 42S01: Table 't1' already exists
show count(*) errors;
@@session.error_count
1
show errors;
Level	Code	Message
Error	1050	Table 't1' already exists
create table t2(a int) default charset qwerty;
ERROR 42000: Unknown character set: 'qwerty'
show count(*) errors;
@@session.error_count
1
show errors;
Level	Code	Message
Error	1115	Unknown character set: 'qwerty'
create table t (i);
ERROR 42000: You have an error in your SQL syntax; check the manual that corresponds to your OceanBase version for the right syntax to use near ')' at line 1
show count(*) errors;
@@session.error_count
1
show errors;
Level	Code	Message
Error	1064	You have an error in your SQL syntax; check the manual that corresponds to your OceanBase version for the right syntax to use near ')' at line 1
insert into t1 values (1);
insert ignore into t1 values ("hej");
insert ignore into t1 values ("hej"),("då");
set SQL_WARNINGS=1;
insert ignore into t1 values ("hej");
insert ignore into t1 values ("hej"),("då");
drop table t1;
set SQL_WARNINGS=0;
drop temporary table if exists not_exists;
Warnings:
Note	1051	Unknown table 'test.not_exists'
drop table if exists not_exists_table;
Warnings:
Note	1051	Unknown table 'test.not_exists_table'
drop database if exists not_exists_db;
Warnings:
Note	1008	Can't drop database 'not_exists_db'; database doesn't exist
show count(*) warnings;
@@session.warning_count
1
create table t1(id int);
create table if not exists t1(id int);
select @@warning_count;
@@warning_count
0
drop table t1;
create table t1(a tinyint NOT NULL, b tinyint unsigned, c char(5));
insert ignore into t1 values(NULL,100,'mysql'),(10,-1,'mysql ab'),(500,256,'open source'),(20,NULL,'test');
Warnings:
Warning	1048	Column 'a' cannot be null
Warning	1265	Data truncated for column '"test"."t1"."c"' at row 2
Warning	1265	Data truncated for column '"test"."t1"."c"' at row 3
SET sql_mode = 'NO_ENGINE_SUBSTITUTION';
alter table t1 modify c char(4);
SET sql_mode = default;
alter table t1 add d char(2);
update ignore t1 set a=NULL where a=10;
Warnings:
Warning	1048	Column 'a' cannot be null
update ignore t1 set c='mysql ab' where c='test';
Warnings:
Warning	1265	Data truncated for column '"test"."t1"."c"' at row 4
update ignore t1 set d=c;
Warnings:
Warning	1265	Data truncated for column '"test"."t1"."d"' at row 1
Warning	1265	Data truncated for column '"test"."t1"."d"' at row 2
Warning	1265	Data truncated for column '"test"."t1"."d"' at row 3
Warning	1265	Data truncated for column '"test"."t1"."d"' at row 4
create table t2(a tinyint NOT NULL, b char(3));
insert ignore into t2 select b,c from t1;
Warnings:
Warning	1265	Data truncated for column '"test"."t2"."b"' at row 1
Warning	1265	Data truncated for column '"test"."t2"."b"' at row 2
Warning	1265	Data truncated for column '"test"."t2"."b"' at row 3
Warning	1265	Data truncated for column '"test"."t2"."b"' at row 4
Warning	1048	Column 'a' cannot be null
insert ignore into t2(b) values('mysqlab');
set sql_warnings=1;
insert ignore into t2(b) values('mysqlab');
set sql_warnings=0;
drop table t1, t2;
create table t1(a char(10));
alter table t1 add b char;
set max_error_count=10;
Warnings:
Warning	1235	This system variable now is mock not supported
update ignore t1 set b=a;
Warnings:
Warning	1265	Data truncated for column '"test"."t1"."b"' at row 1
Warning	1265	Data truncated for column '"test"."t1"."b"' at row 2
Warning	1265	Data truncated for column '"test"."t1"."b"' at row 3
Warning	1265	Data truncated for column '"test"."t1"."b"' at row 4
Warning	1265	Data truncated for column '"test"."t1"."b"' at row 5
Warning	1265	Data truncated for column '"test"."t1"."b"' at row 6
Warning	1265	Data truncated for column '"test"."t1"."b"' at row 7
Warning	1265	Data truncated for column '"test"."t1"."b"' at row 8
Warning	1265	Data truncated for column '"test"."t1"."b"' at row 9
Warning	1265	Data truncated for column '"test"."t1"."b"' at row 10
Warning	1265	Data truncated for column '"test"."t1"."b"' at row 11
Warning	1265	Data truncated for column '"test"."t1"."b"' at row 12
Warning	1265	Data truncated for column '"test"."t1"."b"' at row 13
Warning	1265	Data truncated for column '"test"."t1"."b"' at row 14
Warning	1265	Data truncated for column '"test"."t1"."b"' at row 15
Warning	1265	Data truncated for column '"test"."t1"."b"' at row 16
Warning	1265	Data truncated for column '"test"."t1"."b"' at row 17
Warning	1265	Data truncated for column '"test"."t1"."b"' at row 18
Warning	1265	Data truncated for column '"test"."t1"."b"' at row 19
Warning	1265	Data truncated for column '"test"."t1"."b"' at row 20
Warning	1265	Data truncated for column '"test"."t1"."b"' at row 21
Warning	1265	Data truncated for column '"test"."t1"."b"' at row 22
Warning	1265	Data truncated for column '"test"."t1"."b"' at row 23
Warning	1265	Data truncated for column '"test"."t1"."b"' at row 24
Warning	1265	Data truncated for column '"test"."t1"."b"' at row 25
Warning	1265	Data truncated for column '"test"."t1"."b"' at row 26
Warning	1265	Data truncated for column '"test"."t1"."b"' at row 27
Warning	1265	Data truncated for column '"test"."t1"."b"' at row 28
Warning	1265	Data truncated for column '"test"."t1"."b"' at row 29
Warning	1265	Data truncated for column '"test"."t1"."b"' at row 30
Warning	1265	Data truncated for column '"test"."t1"."b"' at row 31
Warning	1265	Data truncated for column '"test"."t1"."b"' at row 32
Warning	1265	Data truncated for column '"test"."t1"."b"' at row 33
Warning	1265	Data truncated for column '"test"."t1"."b"' at row 34
Warning	1265	Data truncated for column '"test"."t1"."b"' at row 35
Warning	1265	Data truncated for column '"test"."t1"."b"' at row 36
Warning	1265	Data truncated for column '"test"."t1"."b"' at row 37
Warning	1265	Data truncated for column '"test"."t1"."b"' at row 38
Warning	1265	Data truncated for column '"test"."t1"."b"' at row 39
Warning	1265	Data truncated for column '"test"."t1"."b"' at row 40
Warning	1265	Data truncated for column '"test"."t1"."b"' at row 41
Warning	1265	Data truncated for column '"test"."t1"."b"' at row 42
Warning	1265	Data truncated for column '"test"."t1"."b"' at row 43
Warning	1265	Data truncated for column '"test"."t1"."b"' at row 44
Warning	1265	Data truncated for column '"test"."t1"."b"' at row 45
Warning	1265	Data truncated for column '"test"."t1"."b"' at row 46
Warning	1265	Data truncated for column '"test"."t1"."b"' at row 47
Warning	1265	Data truncated for column '"test"."t1"."b"' at row 48
Warning	1265	Data truncated for column '"test"."t1"."b"' at row 49
Warning	1265	Data truncated for column '"test"."t1"."b"' at row 50
select @@warning_count;
@@warning_count
0
set max_error_count=0;
Warnings:
Warning	1235	This system variable now is mock not supported
show variables like 'max_error_count';
Variable_name	Value
max_error_count	64
update ignore t1 set b='hi';
Warnings:
Warning	1265	Data truncated for column '"test"."t1"."b"' at row 1
select @@warning_count;
@@warning_count
0
set max_error_count=65535;
Warnings:
Warning	1235	This system variable now is mock not supported
show variables like 'max_error_count';
Variable_name	Value
max_error_count	64
set max_error_count=10;
Warnings:
Warning	1235	This system variable now is mock not supported
show variables like 'max_error_count';
Variable_name	Value
max_error_count	64
drop table t1;
create table t1 (a int);
insert into t1 (a) values (1), (2), (3), (4), (5), (6), (7), (8), (9), (10);
update ignore t1 set a='abc';
select * from t1 limit 0;
a
select * from t1 limit 1, 0;
a
select * from t1 limit 0, 0;
a
drop table t1;
End of 4.1 tests
CREATE TABLE t1( f1 CHAR(20) );
CREATE TABLE t2( f1 CHAR(20), f2 CHAR(25) );
CREATE TABLE t3( f1 CHAR(20), f2 CHAR(25), f3 DATE );
INSERT INTO t1 VALUES ( 'a`' );
INSERT INTO t2 VALUES ( 'a`', 'a`' );
INSERT INTO t3 VALUES ( 'a`', 'a`', '1000-01-1' );
DROP PROCEDURE IF EXISTS sp1;
DROP PROCEDURE IF EXISTS sp2;
DROP PROCEDURE IF EXISTS sp3;
SET sql_mode = 'NO_ENGINE_SUBSTITUTION';
CREATE PROCEDURE sp1()
BEGIN
DECLARE x NUMERIC ZEROFILL;
SELECT f1 INTO x FROM t1 LIMIT 1;
END//
CREATE PROCEDURE sp2()
BEGIN
DECLARE x NUMERIC ZEROFILL;
SELECT f1 INTO x FROM t2 LIMIT 1;
END//
CREATE PROCEDURE sp3()
BEGIN
DECLARE x NUMERIC ZEROFILL;
SELECT f1 INTO x FROM t3 LIMIT 1;
END//
CALL sp1();
CALL sp2();
CALL sp3();
DROP PROCEDURE IF EXISTS sp1;
CREATE PROCEDURE sp1()
BEGIN
declare x numeric unsigned zerofill;
SELECT f1 into x from t2 limit 1;
END//
CALL sp1();
DROP TABLE t1;
DROP TABLE t2;
DROP TABLE t3;
DROP PROCEDURE sp1;
DROP PROCEDURE sp2;
DROP PROCEDURE sp3;
SET sql_mode = default;
create table t1 (c_char char(255), c_varchar varchar(255), c_tinytext tinytext);
create table t2 (c_tinyblob tinyblob);
set @c = repeat(' ', 256);
set @q = repeat('q', 256);
set sql_mode = '';
insert into t1 values(@c, @c, @c);
Warnings:
Warning	1265	Data truncated for column '"test"."t1"."c_char"' at row 1
Warning	1265	Data truncated for column '"test"."t1"."c_varchar"' at row 1
Warning	1265	Data truncated for column '"test"."t1"."c_tinytext"' at row 1
insert into t2 values(@c);
Warnings:
Warning	1265	Data truncated for column '"test"."t2"."c_tinyblob"' at row 1
insert into t1 values(@q, @q, @q);
Warnings:
Warning	1265	Data truncated for column '"test"."t1"."c_char"' at row 1
Warning	1265	Data truncated for column '"test"."t1"."c_varchar"' at row 1
Warning	1265	Data truncated for column '"test"."t1"."c_tinytext"' at row 1
insert into t2 values(@q);
Warnings:
Warning	1265	Data truncated for column '"test"."t2"."c_tinyblob"' at row 1
set sql_mode = 'traditional';
insert into t1 values(@c, @c, @c);
Warnings:
Warning	1265	Data truncated for column '"test"."t1"."c_char"' at row 1
Warning	1265	Data truncated for column '"test"."t1"."c_varchar"' at row 1
Warning	1265	Data truncated for column '"test"."t1"."c_tinytext"' at row 1
insert into t2 values(@c);
ERROR 22001: Data too long for column 'c_tinyblob' at row 1
insert into t1 values(@q, NULL, NULL);
ERROR 22001: Data too long for column 'c_char' at row 1
insert into t1 values(NULL, @q, NULL);
ERROR 22001: Data too long for column 'c_varchar' at row 1
insert into t1 values(NULL, NULL, @q);
ERROR 22001: Data too long for column 'c_tinytext' at row 1
insert into t2 values(@q);
ERROR 22001: Data too long for column 'c_tinyblob' at row 1
drop table t1, t2;
DROP TABLE t1;
ERROR 42S02: Unknown table 'test.t1'
SHOW ERRORS;
Level	Code	Message
Error	1051	Unknown table 'test.t1'
End of 5.0 tests

-- Bug#55847

DROP TABLE IF EXISTS t1;
DROP FUNCTION IF EXISTS f1;
CREATE TABLE t1(a INT UNIQUE);
CREATE FUNCTION f1(x INT) RETURNS INT
BEGIN
INSERT INTO t1 VALUES(x);
INSERT INTO t1 VALUES(x);
RETURN x;
END|

SHOW TABLES WHERE f1(11) = 11;
ERROR 23000: Duplicate entry '11' for key 'a'


DROP TABLE t1;
DROP FUNCTION f1;
