--   =====================================================================database:utf16=========================================================================
--   建库时指定字符集
drop database  IF EXISTS  ob100x;
create database ob100x  character set utf16;
use ob100x;
select database();
database()
ob100x
select schema();
schema()
ob100x
select collation(schema());
collation(schema())
utf8mb4_general_ci
select coercibility(schema());
coercibility(schema())
3
SET FOREIGN_KEY_CHECKS=1;
--  character-1-1-1  转移字符
SELECT 'hello', '"hello"', '""hello""', 'hel''lo', '\'hello','hel\nlo', '"hel\tlo"', '""he\rllo""', 'he\bl''lo', 'he\_l\%lo';
hello	"hello"	""hello""	hel'lo	'hello	hel
lo	"hel	lo"	""hello""	hel'lo	he\_l\%lo
hello	"hello"	""hello""	hel'lo	'hello	hel
lo	"hel	lo"	""hello""	hel'lo	he\_l\%lo
SELECT 'This\nIs\nFour\nLines';
This
Is
Four
Lines
This
Is
Four
Lines
--  character-1-1-2  图形符号
select  '❤❥웃유♋☮✌☏☢☠✔☑♚▲♪✈✞÷↑↓◆◇⊙■□△▽¿─│♥❣♂♀☿Ⓐ✍✉☣☤✘☒♛▼♫⌘☪≈←→✞✛✜✝✙✠✚†‡◉○◌◍◎●◐◑◒◓◔◕◖◗❂☢⊗⊙◘◙';
❤❥웃유♋☮✌☏☢☠✔☑♚▲♪✈✞÷↑↓◆◇⊙■□△▽¿─│♥❣♂♀☿Ⓐ✍✉☣☤✘☒♛▼♫⌘☪≈←→✞✛✜✝✙✠✚†‡◉○◌◍◎●◐◑◒◓◔◕◖◗❂☢⊗⊙◘◙
❤❥웃유♋☮✌☏☢☠✔☑♚▲♪✈✞÷↑↓◆◇⊙■□△▽¿─│♥❣♂♀☿Ⓐ✍✉☣☤✘☒♛▼♫⌘☪≈←→✞✛✜✝✙✠✚†‡◉○◌◍◎●◐◑◒◓◔◕◖◗❂☢⊗⊙◘◙
--  character-1-1-3  图形符号
select  '~@#￥%……&*（）——+：“》？《.+/';
~@#￥%……&*（）——+：“》？《.+/
~@#￥%……&*（）——+：“》？《.+/
--  character-1-2-1-1  简体字
select  '中华人民共和国中华人民共和国中华人民共和国中华人民共和国中华人民共和国中华人民共和国中华人民共和国中华人民共和国';
中华人民共和国中华人民共和国中华人民共和国中华人民共和国中华人民共和国中华人民共和国中华人民共和国中华人民共和国
中华人民共和国中华人民共和国中华人民共和国中华人民共和国中华人民共和国中华人民共和国中华人民共和国中华人民共和国
--  character-1-2-1-2  繁体字
select  '哎 哀 唉 埃 挨 锿 捱 皑 癌 嗳 矮 蔼 霭 艾 爱 砹 隘 嗌 嫒 碍 暧 瑷 僾 薆 安 桉 氨 庵 谙 腤 鹌 鞍 鮟 盫 啽 垵 俺 唵 埯 铵 揞 犴 岸 按 案 胺 暗 黯 肮 昂 枊 盎 醠 凹 坳 垇 爊 敖 嗷 嶅 廒 獒 遨 熬 璈 翱 聱 螯 謷 鳌 鏖 芺 袄 媪 岙 傲 奡 奥';
哎 哀 唉 埃 挨 锿 捱 皑 癌 嗳 矮 蔼 霭 艾 爱 砹 隘 嗌 嫒 碍 暧 瑷 僾 薆 安 桉 氨 庵 谙 腤 鹌 鞍 鮟 盫 啽 垵 俺 唵 埯 铵 揞 犴 岸 按 案 胺 暗 黯 肮 昂 枊 盎 醠 凹 坳 垇 爊 敖 嗷 嶅 廒 獒 遨 熬
哎 哀 唉 埃 挨 锿 捱 皑 癌 嗳 矮 蔼 霭 艾 爱 砹 隘 嗌 嫒 碍 暧 瑷 僾 薆 安 桉 氨 庵 谙 腤 鹌 鞍 鮟 盫 啽 垵 俺 唵 埯 铵 揞 犴 岸 按 案 胺 暗 黯 肮 昂 枊 盎 醠 凹 坳 垇 爊 敖 嗷 嶅 廒 獒 遨 熬 璈 翱 聱 螯 謷 鳌 鏖 芺 袄 媪 岙 傲 奡 奥
--  character-1-2-1-3   中文：双引号+空格/制表符
select  '“” 	
';
“” 	

“” 	

--  character-1-2-1-4   简体字和繁体字组合
select  '中华人民共和国中华唉 埃 挨 锿 捱 皑 癌 嗳 矮 蔼 霭 艾';
中华人民共和国中华唉 埃 挨 锿 捱 皑 癌 嗳 矮 蔼 霭 艾
中华人民共和国中华唉 埃 挨 锿 捱 皑 癌 嗳 矮 蔼 霭 艾
-- character-1-2-2-1   英文大小写
select  'AAAAAAAAAAAADDSGDFHGFJVGHKGHKGHLGLGLHJOLYSGSHBXsdfdsfdsgdsgdfhdfjgfmbvkyuolyhuj;lhjl.jbhn,.dfgdsgsgs';
AAAAAAAAAAAADDSGDFHGFJVGHKGHKGHLGLGLHJOLYSGSHBXsdfdsfdsgdsgdfhdfjgfmbvkyuolyhuj;lhjl.jbhn,.dfgdsgsgs
AAAAAAAAAAAADDSGDFHGFJVGHKGHKGHLGLGLHJOLYSGSHBXsdfdsfdsgdsgdfhdfjgfmbvkyuolyhuj;lhjl.jbhn,.dfgdsgsgs
-- character-1-2-2-2   英文：双引号+空格/回车/制表符
select  '"" 
	';
"" 
	
"" 
	
--  character-1-2-2-1   日韩文字
select  '関数内部には問い合わせ文を書くことはできないが,selectにより代入可能である。';
関数内部には問い合わせ文を書くことはできないが,selectにより代入可能である。
関数内部には問い合わせ文を書くことはできないが,selectにより代入可能である。
select  '함수 내부에서 조회 어구를 쓸 수 없지만 선택표를 통해 값을 정할 수 있다.';
함수 내부에서 조회 어구를 쓸 수 없지만 선택표를 통해 값을 정할 수 있다.
함수 내부에서 조회 어구를 쓸 수 없지만 선택표를 통해 값을 정할 수 있다.
--  character-1-3-1  苏州码子
select  '苏州码子（〡、〢、〣、〤、〥、〦、〧、〨、〩、十）';
苏州码子（〡、〢、〣、〤、〥、〦、〧、〨、〩、十）
苏州码子（〡、〢、〣、〤、〥、〦、〧、〨、〩、十）
--  character-1-3-2-1   正数、负数                          
select  3245356465475674;
3245356465475674
3245356465475674
select  -145646547657878;
-145646547657878
-145646547657878
--  character-1-3-2-2   整数，小数          
select  100000000000000000000;
100000000000000000000
100000000000000000000
select  1.32356464212121221646;
1.32356464212121221646
1.32356464212121221646
--   character-1-3-3  罗马数字
select   'Ⅰ Ⅱ Ⅲ Ⅳ Ⅴ Ⅵ Ⅶ Ⅷ Ⅸ Ⅹ Ⅺ Ⅻ';
Ⅰ Ⅱ Ⅲ Ⅳ Ⅴ Ⅵ Ⅶ Ⅷ Ⅸ Ⅹ Ⅺ Ⅻ
Ⅰ Ⅱ Ⅲ Ⅳ Ⅴ Ⅵ Ⅶ Ⅷ Ⅸ Ⅹ Ⅺ Ⅻ
--  character-1-3-4-1  2进制                   
select bin(12);
bin(12)
1100
--  character-1-3-4-2  8进制                   
select oct(12);
oct(12)
14
--  character-1-3-4-3  10进制                   
select 255;
255
255
--  character-1-3-4-4  16进制                   
select hex(255);
hex(255)
FF
--  character-1-4  其他
select  'defedtgtghgfjfhjf股份附 Ⅴ 쓸 수 없지만 선택표를 통해 값을 정할 수 있다わせ文を Ⅵ Ⅶ Ⅷ 加费苏州码子（放到民共和国中华唉 埃 挨 锿 捱〡、〢、〣、〤、〥、〦、〧、〨、〩、十）';
defedtgtghgfjfhjf股份附 Ⅴ 쓸 수 없지만 선택표를 통해 값을 정할 수 있다わせ文を Ⅵ Ⅶ Ⅷ 加费苏州码子（放到民共和国中华唉 埃 挨 锿 捱〡、〢、〣、〤、〥、〦、〧、〨、〩、十）
defedtgtghgfjfhjf股份附 Ⅴ 쓸 수 없지만 선택표를 통해 값을 정할 수 있다わせ文を Ⅵ Ⅶ Ⅷ 加费苏州码子（放到民共和国中华唉 埃 挨 锿 捱〡、〢、〣、〤、〥、〦、〧、〨、〩、十）
--   =====================================================================database:utf16=========================================================================
--   =====================================================================database:GBK=========================================================================
--   建库时指定字符集
drop database  IF EXISTS  ob100x;
create database ob100x  character set GBK;
use ob100x;
select database();
database()
ob100x
select schema();
schema()
ob100x
select collation(schema());
collation(schema())
utf8mb4_general_ci
select coercibility(schema());
coercibility(schema())
3
SET FOREIGN_KEY_CHECKS=1;
--  character-1-1-1  转移字符
SELECT 'hello', '"hello"', '""hello""', 'hel''lo', '\'hello','hel\nlo', '"hel\tlo"', '""he\rllo""', 'he\bl''lo', 'he\_l\%lo';
hello	"hello"	""hello""	hel'lo	'hello	hel
lo	"hel	lo"	""hello""	hel'lo	he\_l\%lo
hello	"hello"	""hello""	hel'lo	'hello	hel
lo	"hel	lo"	""hello""	hel'lo	he\_l\%lo
SELECT 'This\nIs\nFour\nLines';
This
Is
Four
Lines
This
Is
Four
Lines
--  character-1-1-2  图形符号
select  '❤❥웃유♋☮✌☏☢☠✔☑♚▲♪✈✞÷↑↓◆◇⊙■□△▽¿─│♥❣♂♀☿Ⓐ✍✉☣☤✘☒♛▼♫⌘☪≈←→✞✛✜✝✙✠✚†‡◉○◌◍◎●◐◑◒◓◔◕◖◗❂☢⊗⊙◘◙';
❤❥웃유♋☮✌☏☢☠✔☑♚▲♪✈✞÷↑↓◆◇⊙■□△▽¿─│♥❣♂♀☿Ⓐ✍✉☣☤✘☒♛▼♫⌘☪≈←→✞✛✜✝✙✠✚†‡◉○◌◍◎●◐◑◒◓◔◕◖◗❂☢⊗⊙◘◙
❤❥웃유♋☮✌☏☢☠✔☑♚▲♪✈✞÷↑↓◆◇⊙■□△▽¿─│♥❣♂♀☿Ⓐ✍✉☣☤✘☒♛▼♫⌘☪≈←→✞✛✜✝✙✠✚†‡◉○◌◍◎●◐◑◒◓◔◕◖◗❂☢⊗⊙◘◙
--  character-1-1-3  图形符号
select  '~@#￥%……&*（）——+：“》？《.+/';
~@#￥%……&*（）——+：“》？《.+/
~@#￥%……&*（）——+：“》？《.+/
--  character-1-2-1-1  简体字
select  '中华人民共和国中华人民共和国中华人民共和国中华人民共和国中华人民共和国中华人民共和国中华人民共和国中华人民共和国';
中华人民共和国中华人民共和国中华人民共和国中华人民共和国中华人民共和国中华人民共和国中华人民共和国中华人民共和国
中华人民共和国中华人民共和国中华人民共和国中华人民共和国中华人民共和国中华人民共和国中华人民共和国中华人民共和国
--  character-1-2-1-2  繁体字
select  '哎 哀 唉 埃 挨 锿 捱 皑 癌 嗳 矮 蔼 霭 艾 爱 砹 隘 嗌 嫒 碍 暧 瑷 僾 薆 安 桉 氨 庵 谙 腤 鹌 鞍 鮟 盫 啽 垵 俺 唵 埯 铵 揞 犴 岸 按 案 胺 暗 黯 肮 昂 枊 盎 醠 凹 坳 垇 爊 敖 嗷 嶅 廒 獒 遨 熬 璈 翱 聱 螯 謷 鳌 鏖 芺 袄 媪 岙 傲 奡 奥';
哎 哀 唉 埃 挨 锿 捱 皑 癌 嗳 矮 蔼 霭 艾 爱 砹 隘 嗌 嫒 碍 暧 瑷 僾 薆 安 桉 氨 庵 谙 腤 鹌 鞍 鮟 盫 啽 垵 俺 唵 埯 铵 揞 犴 岸 按 案 胺 暗 黯 肮 昂 枊 盎 醠 凹 坳 垇 爊 敖 嗷 嶅 廒 獒 遨 熬
哎 哀 唉 埃 挨 锿 捱 皑 癌 嗳 矮 蔼 霭 艾 爱 砹 隘 嗌 嫒 碍 暧 瑷 僾 薆 安 桉 氨 庵 谙 腤 鹌 鞍 鮟 盫 啽 垵 俺 唵 埯 铵 揞 犴 岸 按 案 胺 暗 黯 肮 昂 枊 盎 醠 凹 坳 垇 爊 敖 嗷 嶅 廒 獒 遨 熬 璈 翱 聱 螯 謷 鳌 鏖 芺 袄 媪 岙 傲 奡 奥
--  character-1-2-1-3   中文：双引号+空格/制表符
select  '“” 	
';
“” 	

“” 	

--  character-1-2-1-4   简体字和繁体字组合
select  '中华人民共和国中华唉 埃 挨 锿 捱 皑 癌 嗳 矮 蔼 霭 艾';
中华人民共和国中华唉 埃 挨 锿 捱 皑 癌 嗳 矮 蔼 霭 艾
中华人民共和国中华唉 埃 挨 锿 捱 皑 癌 嗳 矮 蔼 霭 艾
-- character-1-2-2-1   英文大小写
select  'AAAAAAAAAAAADDSGDFHGFJVGHKGHKGHLGLGLHJOLYSGSHBXsdfdsfdsgdsgdfhdfjgfmbvkyuolyhuj;lhjl.jbhn,.dfgdsgsgs';
AAAAAAAAAAAADDSGDFHGFJVGHKGHKGHLGLGLHJOLYSGSHBXsdfdsfdsgdsgdfhdfjgfmbvkyuolyhuj;lhjl.jbhn,.dfgdsgsgs
AAAAAAAAAAAADDSGDFHGFJVGHKGHKGHLGLGLHJOLYSGSHBXsdfdsfdsgdsgdfhdfjgfmbvkyuolyhuj;lhjl.jbhn,.dfgdsgsgs
-- character-1-2-2-2   英文：双引号+空格/回车/制表符
select  '"" 
	';
"" 
	
"" 
	
--  character-1-2-2-1   日韩文字
select  '関数内部には問い合わせ文を書くことはできないが,selectにより代入可能である。';
関数内部には問い合わせ文を書くことはできないが,selectにより代入可能である。
関数内部には問い合わせ文を書くことはできないが,selectにより代入可能である。
select  '함수 내부에서 조회 어구를 쓸 수 없지만 선택표를 통해 값을 정할 수 있다.';
함수 내부에서 조회 어구를 쓸 수 없지만 선택표를 통해 값을 정할 수 있다.
함수 내부에서 조회 어구를 쓸 수 없지만 선택표를 통해 값을 정할 수 있다.
--  character-1-3-1  苏州码子
select  '苏州码子（〡、〢、〣、〤、〥、〦、〧、〨、〩、十）';
苏州码子（〡、〢、〣、〤、〥、〦、〧、〨、〩、十）
苏州码子（〡、〢、〣、〤、〥、〦、〧、〨、〩、十）
--  character-1-3-2-1   正数、负数                          
select  3245356465475674;
3245356465475674
3245356465475674
select  -145646547657878;
-145646547657878
-145646547657878
--  character-1-3-2-2   整数，小数          
select  100000000000000000000;
100000000000000000000
100000000000000000000
select  1.32356464212121221646;
1.32356464212121221646
1.32356464212121221646
--   character-1-3-3  罗马数字
select   'Ⅰ Ⅱ Ⅲ Ⅳ Ⅴ Ⅵ Ⅶ Ⅷ Ⅸ Ⅹ Ⅺ Ⅻ';
Ⅰ Ⅱ Ⅲ Ⅳ Ⅴ Ⅵ Ⅶ Ⅷ Ⅸ Ⅹ Ⅺ Ⅻ
Ⅰ Ⅱ Ⅲ Ⅳ Ⅴ Ⅵ Ⅶ Ⅷ Ⅸ Ⅹ Ⅺ Ⅻ
--  character-1-3-4-1  2进制                   
select bin(12);
bin(12)
1100
--  character-1-3-4-2  8进制                   
select oct(12);
oct(12)
14
--  character-1-3-4-3  10进制                   
select 255;
255
255
--  character-1-3-4-4  16进制                   
select hex(255);
hex(255)
FF
--  character-1-4  其他
select  'defedtgtghgfjfhjf股份附 Ⅴ 쓸 수 없지만 선택표를 통해 값을 정할 수 있다わせ文を Ⅵ Ⅶ Ⅷ 加费苏州码子（放到民共和国中华唉 埃 挨 锿 捱〡、〢、〣、〤、〥、〦、〧、〨、〩、十）';
defedtgtghgfjfhjf股份附 Ⅴ 쓸 수 없지만 선택표를 통해 값을 정할 수 있다わせ文を Ⅵ Ⅶ Ⅷ 加费苏州码子（放到民共和国中华唉 埃 挨 锿 捱〡、〢、〣、〤、〥、〦、〧、〨、〩、十）
defedtgtghgfjfhjf股份附 Ⅴ 쓸 수 없지만 선택표를 통해 값을 정할 수 있다わせ文を Ⅵ Ⅶ Ⅷ 加费苏州码子（放到民共和国中华唉 埃 挨 锿 捱〡、〢、〣、〤、〥、〦、〧、〨、〩、十）
--   =====================================================================database:GBK=========================================================================
--   =====================================================================库，表，列UTF16=========================================================================
drop database  IF EXISTS  ob100x;
create database ob100x  character set utf16;
use ob100x;
--   character-2-1-1   表
drop table  IF EXISTS  characterset;
create table characterset(
id int not null auto_increment primary key,
fuhao varchar(100) character set utf16,
zifu char(100)  character set utf16 not null,
sage tinyint(100) not null,
sdept char(40) not null)DEFAULT CHARACTER SET = utf16,comment = '字符集表';
insert into characterset values(null,'❤❥웃유♋☮✌☏☢☠✔','hello world',100,'文字セット');
select   *  from   characterset;
id	fuhao	zifu	sage	sdept
1	❤❥웃유♋☮✌☏☢☠✔	hello world	100	文字セット
drop table  IF EXISTS  characterset;
--  新建基础表
drop table if exists emp_rg;
CREATE TABLE emp_rg(EMPNO int PRIMARY key,
ename varchar(100) character set utf16,
job char(200) character set utf16,
MGR int,HIREDATE DATE,SAL float(7,2),COMM float(7,2),DEPTNO int)CHARACTER SET = utf16;
INSERT INTO emp_rg VALUES(7369,'张三','CLERK',7902,'2016-11-1',800,NULL,20);
INSERT INTO emp_rg VALUES(7499,'李四','SALESMAN',7698,'2016-01-1',1600,300,30);
INSERT INTO emp_rg VALUES(7521,'王五','SALESMAN',7698,'1981-09-1',1250,500,30);
INSERT INTO emp_rg VALUES(7566,'赵六','MANAGER',7839,'1989-09-1',2975,NULL,20);
INSERT INTO emp_rg VALUES(7654,'唐僧','SALESMAN',7698,'1983-09-1',1250,1400,30);
INSERT INTO emp_rg VALUES(7698,'中華人民共和國','MANAGER',7839,'1985-09-1',2850,NULL,30);
INSERT INTO emp_rg VALUES(7782,'孙悟空','MANAGER',7839,'1991-09-1',2450,NULL,10);
INSERT INTO emp_rg VALUES(7788,'猪八戒','ANALYST',7566,'1955-09-1',3000,NULL,20);
INSERT INTO emp_rg VALUES(7839,'KING','PRESIDENT',NULL,'1965-09-1',5000,NULL,10);
INSERT INTO emp_rg VALUES(7844,'TURNER','SALESMAN',7698,'1975-09-1',1500,0,30);
INSERT INTO emp_rg VALUES(7876,'ADAMS','CLERK',7788,'1959-09-1',1100,NULL,20);
INSERT INTO emp_rg VALUES(7900,'JAMES','CLERK',7698,'1953-09-1',950,NULL,30);
INSERT INTO emp_rg VALUES(7902,'FORD','ANALYST',7566,'1968-09-1',3000,NULL,20);
INSERT INTO emp_rg VALUES(7934,'MILLER','CLERK',7782,'1950-09-1',1300,NULL,10);
select  *  from   emp_rg;
EMPNO	ename	job	MGR	HIREDATE	SAL	COMM	DEPTNO
7369	张三	CLERK	7902	2016-11-01	800.00	NULL	20
7499	李四	SALESMAN	7698	2016-01-01	1600.00	300.00	30
7521	王五	SALESMAN	7698	1981-09-01	1250.00	500.00	30
7566	赵六	MANAGER	7839	1989-09-01	2975.00	NULL	20
7654	唐僧	SALESMAN	7698	1983-09-01	1250.00	1400.00	30
7698	中華人民共和國	MANAGER	7839	1985-09-01	2850.00	NULL	30
7782	孙悟空	MANAGER	7839	1991-09-01	2450.00	NULL	10
7788	猪八戒	ANALYST	7566	1955-09-01	3000.00	NULL	20
7839	KING	PRESIDENT	NULL	1965-09-01	5000.00	NULL	10
7844	TURNER	SALESMAN	7698	1975-09-01	1500.00	0.00	30
7876	ADAMS	CLERK	7788	1959-09-01	1100.00	NULL	20
7900	JAMES	CLERK	7698	1953-09-01	950.00	NULL	30
7902	FORD	ANALYST	7566	1968-09-01	3000.00	NULL	20
7934	MILLER	CLERK	7782	1950-09-01	1300.00	NULL	10
--  character-2-1-2-1   创建视图
DROP VIEW IF EXISTS view_emp_rg;
create OR  REPLACE view view_emp_rg as  select * from emp_rg where sal>1500;
select   *  from   view_emp_rg;
EMPNO	ename	job	MGR	HIREDATE	SAL	COMM	DEPTNO
7499	李四	SALESMAN	7698	2016-01-01	1600.00	300.00	30
7566	赵六	MANAGER	7839	1989-09-01	2975.00	NULL	20
7698	中華人民共和國	MANAGER	7839	1985-09-01	2850.00	NULL	30
7782	孙悟空	MANAGER	7839	1991-09-01	2450.00	NULL	10
7788	猪八戒	ANALYST	7566	1955-09-01	3000.00	NULL	20
7839	KING	PRESIDENT	NULL	1965-09-01	5000.00	NULL	10
7902	FORD	ANALYST	7566	1968-09-01	3000.00	NULL	20
--  character-2-1-2-2   修改视图     ob不支持这类
ALTER  VIEW  view_emp_rg  AS  SELECT  EMPNO,ename,job  FROM  emp_rg e;
select   *  from   view_emp_rg;
EMPNO	ename	job	MGR	HIREDATE	SAL	COMM	DEPTNO
7499	李四	SALESMAN	7698	2016-01-01	1600.00	300.00	30
7566	赵六	MANAGER	7839	1989-09-01	2975.00	NULL	20
7698	中華人民共和國	MANAGER	7839	1985-09-01	2850.00	NULL	30
7782	孙悟空	MANAGER	7839	1991-09-01	2450.00	NULL	10
7788	猪八戒	ANALYST	7566	1955-09-01	3000.00	NULL	20
7839	KING	PRESIDENT	NULL	1965-09-01	5000.00	NULL	10
7902	FORD	ANALYST	7566	1968-09-01	3000.00	NULL	20
--  character-2-1-2-3 
delete from  view_emp_rg   where   empno=7369;
select   *  from   view_emp_rg;
EMPNO	ename	job	MGR	HIREDATE	SAL	COMM	DEPTNO
7499	李四	SALESMAN	7698	2016-01-01	1600.00	300.00	30
7566	赵六	MANAGER	7839	1989-09-01	2975.00	NULL	20
7698	中華人民共和國	MANAGER	7839	1985-09-01	2850.00	NULL	30
7782	孙悟空	MANAGER	7839	1991-09-01	2450.00	NULL	10
7788	猪八戒	ANALYST	7566	1955-09-01	3000.00	NULL	20
7839	KING	PRESIDENT	NULL	1965-09-01	5000.00	NULL	10
7902	FORD	ANALYST	7566	1968-09-01	3000.00	NULL	20
--   异常案例delete from  view_emp_rg e  where   e.empno=7369;删除不能表用别名   ob支持， mysql报错
--  character-2-1-2-4 
--   #给视图增加字段：异常案例
--   alter table view_emp_rg add age int  after ename;
alter table emp_rg add age int  after ename;ob支持  mysql 也支持 但是显示的结果不一致。
select   *  from   emp_rg;
--  character-2-1-2-5 
update view_emp_rg e  set ename='我是视图一号' where   e.empno=7788;
select   *  from   view_emp_rg;
EMPNO	ename	job	MGR	HIREDATE	SAL	COMM	DEPTNO
7499	李四	SALESMAN	7698	2016-01-01	1600.00	300.00	30
7566	赵六	MANAGER	7839	1989-09-01	2975.00	NULL	20
7698	中華人民共和國	MANAGER	7839	1985-09-01	2850.00	NULL	30
7782	孙悟空	MANAGER	7839	1991-09-01	2450.00	NULL	10
7788	我是视图一号	ANALYST	7566	1955-09-01	3000.00	NULL	20
7839	KING	PRESIDENT	NULL	1965-09-01	5000.00	NULL	10
7902	FORD	ANALYST	7566	1968-09-01	3000.00	NULL	20
DROP VIEW IF EXISTS view_emp_rg;
drop table if exists emp_rg;
--   列和约束
SET FOREIGN_KEY_CHECKS=1;
drop table if exists partdepent;
CREATE TABLE partdepent(
partdepentid int,  # 部门编号
DNAME VARCHAR(14)  character set utf16, 
LOC  VARCHAR(14) character set utf16, CONSTRAINT pk_dept PRIMARY KEY(partdepentid)
)DEFAULT CHARSET=utf16;
drop table if exists prize_table;
CREATE TABLE prize_table(
id int PRIMARY KEY,
name varchar(100) character set utf16,
contry char(200) character set utf16,
company int,
birty DATE,
money float(7,2),
prize float(7,2),
nameprize varchar(100) character set utf16,
workshop int,CONSTRAINT fk_deptno FOREIGN KEY(id) REFERENCES partdepent(partdepentid));
--   character-2-1-3-1   #删除主键约束：
alter table prize_table drop primary key;
--  #添加主键约束
alter table prize_table add constraint PK_id primary key prize_table(id);
--   character-2-1-3-2   非空约束
ALTER TABLE prize_table MODIFY contry varchar(150)  not null;
--   character-2-1-3-3   唯一约束
ALTER TABLE prize_table  ADD CONSTRAINT some_name UNIQUE (NAME);
--   character-2-1-3-4  #添加外键约束，空表才可以添加 主建才鞥设置为外键 ： ob不支持
--   ALTER TABLE partdepent ADD CONSTRAINT fk_sid FOREIGN KEY(partdepentid) REFERENCES prize_table(id);
--   基表的数据要先插入
INSERT INTO partdepent VALUES (10,'ACCOUNTING','湖北');
INSERT INTO partdepent VALUES (20,'RESEARCH','江苏');
INSERT INTO partdepent VALUES (30,'SALES','河南');
INSERT INTO partdepent VALUES (40,'gadles','河南');
INSERT INTO partdepent VALUES (50,'gadles','河南');
INSERT INTO prize_table VALUES(10,'Mark001','CLERK',1111,'1951-09-1',1400,NULL,'贡献奖',2000);
INSERT INTO prize_table VALUES(20,'Mark002','CLERK',2222,'1952-09-1',1500,NULL,'贡献奖',2000);
INSERT INTO prize_table VALUES(30,'Mark003','CLERK',3333,'1953-09-1',1600,NULL,'贡献奖',2000);
desc  prize_table;
Field	Type	Null	Key	Default	Extra
id	int(11)	NO	PRI	NULL	
name	varchar(100)	YES	UNI	NULL	
contry	char(200)	YES		NULL	
company	int(11)	YES		NULL	
birty	date	YES		NULL	
money	float(7,2)	YES		NULL	
prize	float(7,2)	YES		NULL	
nameprize	varchar(100)	YES		NULL	
workshop	int(11)	YES		NULL	
-- character-2-1-3-5  check 约束  ob不支持                       
--  ALTER TABLE  prize_table  ADD CONSTRAINT id_chk_1 CHECK(id>29000);
INSERT INTO prize_table VALUES(40,'MILLER001','CLERK',7781,'1950-09-1',1300,NULL,'贡献奖',1000);
-- character-2-1-3-6   FOREIGN_KEY_CHECKS=0 可以删除基表的外键了
SET FOREIGN_KEY_CHECKS=0;
delete  from   partdepent  where  partdepentid =10;
select   *  from   partdepent;
partdepentid	DNAME	LOC
20	RESEARCH	江苏
30	SALES	河南
40	gadles	河南
50	gadles	河南
SET FOREIGN_KEY_CHECKS=1;
--  character-2-1-3-7  default 约束
alter table prize_table alter column prize set default  999;
INSERT INTO prize_table(id,name,contry,company,birty,money,nameprize,workshop) values
(50,'MILLER003','CLERK003',1100,'1950-09-1',1300,'贡献奖',1000);
select  *  from    prize_table;
id	name	contry	company	birty	money	prize	nameprize	workshop
10	Mark001	CLERK	1111	1951-09-01	1400.00	NULL	贡献奖	2000
20	Mark002	CLERK	2222	1952-09-01	1500.00	NULL	贡献奖	2000
30	Mark003	CLERK	3333	1953-09-01	1600.00	NULL	贡献奖	2000
40	MILLER001	CLERK	7781	1950-09-01	1300.00	NULL	贡献奖	1000
50	MILLER003	CLERK003	1100	1950-09-01	1300.00	999.00	贡献奖	1000
-- character-2-1-3-8  #删除列（字段）：
alter table prize_table drop column workshop;
select  *  from  prize_table;
id	name	contry	company	birty	money	prize	nameprize
10	Mark001	CLERK	1111	1951-09-01	1400.00	NULL	贡献奖
20	Mark002	CLERK	2222	1952-09-01	1500.00	NULL	贡献奖
30	Mark003	CLERK	3333	1953-09-01	1600.00	NULL	贡献奖
40	MILLER001	CLERK	7781	1950-09-01	1300.00	NULL	贡献奖
50	MILLER003	CLERK003	1100	1950-09-01	1300.00	999.00	贡献奖
-- character-2-1-3-9  #添加列（字段）：
alter table prize_table add column worker varchar(30);
select  *  from  prize_table;
id	name	contry	company	birty	money	prize	nameprize	worker
10	Mark001	CLERK	1111	1951-09-01	1400.00	NULL	贡献奖	NULL
20	Mark002	CLERK	2222	1952-09-01	1500.00	NULL	贡献奖	NULL
30	Mark003	CLERK	3333	1953-09-01	1600.00	NULL	贡献奖	NULL
40	MILLER001	CLERK	7781	1950-09-01	1300.00	NULL	贡献奖	NULL
50	MILLER003	CLERK003	1100	1950-09-01	1300.00	999.00	贡献奖	NULL
-- character-2-1-3-10  #修改列名   ob不支持这句
alter table prize_table change worker worker001 int;
select  *  from  prize_table;
id	name	contry	company	birty	money	prize	nameprize	worker
10	Mark001	CLERK	1111	1951-09-01	1400.00	NULL	贡献奖	NULL
20	Mark002	CLERK	2222	1952-09-01	1500.00	NULL	贡献奖	NULL
30	Mark003	CLERK	3333	1953-09-01	1600.00	NULL	贡献奖	NULL
40	MILLER001	CLERK	7781	1950-09-01	1300.00	NULL	贡献奖	NULL
50	MILLER003	CLERK003	1100	1950-09-01	1300.00	999.00	贡献奖	NULL
--   #删除外键约束：
alter table prize_table drop foreign key fk_deptno;
--   #修改表名：
drop table if exists depent001;
alter table partdepent rename to depent001;
--   修改列（字段）：
alter table depent001 modify LOC varchar(22);
select  *  from  depent001;
partdepentid	DNAME	LOC
20	RESEARCH	江苏
30	SALES	河南
40	gadles	河南
50	gadles	河南
drop table if exists prize_table;
drop table if exists depent001;
--   索引
drop TABLE if exists my_test;
create table my_test(
id int(11) not null unique auto_increment,
name varchar(100)  CHARACTER SET  utf16,
age int(11) not null default 0,
address varchar(100) CHARACTER SET  utf16
)charset=utf16;
--  character-2-1-4-1    #创建普通索引
create index index_001 on  my_test(name);
--     修改表结构的方式添加索引  
alter table my_test add index index_004(age);
--  character-2-1-4-2   #降序索引ob不支持
create index index_002 on my_test(age DESC); 
create index index_002 on my_test(age);
--  character-2-1-4-3   #修改索引
create index index_006 on my_test(address);
DROP INDEX index_006 ON my_test;
ALTER TABLE my_test ADD index index_006(address);
DROP INDEX index_006 ON my_test;
--  character-2-1-4-4  删除索引
drop index index_001 on my_test;
alter table my_test drop index index_002;
--  character-2-1-4-5    建立复合索引 #建立表列age和name的联合索引；按照age升序后再按照name降序排序
create index index_003 on my_test(age,name);
--  character-2-1-4-6    创建唯一索引
CREATE UNIQUE INDEX index_005 ON  my_test(address);
ALTER TABLE my_test ADD UNIQUE(address);
drop TABLE if exists my_test;
--  分区表：
-- character-2-1-5-1   RANGE分区
drop TABLE if exists employees001;
CREATE TABLE employees001(  
id INT NOT NULL,  
fname VARCHAR(30) CHARACTER SET  utf16,  
lname VARCHAR(30) CHARACTER SET  utf16,  
hired DATE NOT NULL DEFAULT '1970-01-01',  
separated DATE NOT NULL DEFAULT '9999-12-31',  
job_code INT NOT NULL,  
store_id INT NOT NULL  
) charset=utf16
PARTITION BY RANGE (store_id) (  
PARTITION p0 VALUES LESS THAN (6),  
PARTITION p1 VALUES LESS THAN (11),  
PARTITION p2 VALUES LESS THAN (16),  
PARTITION p3 VALUES LESS THAN MAXVALUE  
);
insert  into  employees001(id,fname,lname,job_code,store_id) values(1,'中国人民','國軍',10,20);
select   *  from   employees001;
id	fname	lname	hired	separated	job_code	store_id
1	中国人民	國軍	1970-01-01	9999-12-31	10	20
-- character-2-1-5-2     LIST分区
drop TABLE if exists employees002;
CREATE TABLE employees002 (  
id INT NOT NULL,  
fname VARCHAR(30) CHARACTER SET  utf16,  
lname VARCHAR(30) CHARACTER SET  utf16,  
hired DATE NOT NULL DEFAULT '1970-01-01',  
separated DATE NOT NULL DEFAULT '9999-12-31',  
job_code INT,  
store_id INT
)charset=utf16
PARTITION BY LIST(store_id) (
PARTITION pNorth VALUES IN (3,5,6,9,17),
PARTITION pEast VALUES IN (1,2,10,11,19,20),
PARTITION pWest VALUES IN (4,12,13,14,18),
PARTITION pCentral VALUES IN (7,8,15,16)
);
insert  into  employees002(id,fname,lname,job_code,store_id) values(1,'中国人民','國軍',10,20);
select   *  from   employees002;
id	fname	lname	hired	separated	job_code	store_id
1	中国人民	國軍	1970-01-01	9999-12-31	10	20
-- character-2-1-5-3    普通HASH分区
drop TABLE if exists employees003;
CREATE TABLE employees003(  
id INT NOT NULL,  
fname VARCHAR(30) CHARACTER SET  utf16,   
lname VARCHAR(30) CHARACTER SET  utf16,  
hired DATE NOT NULL DEFAULT '1970-01-01',  
separated DATE NOT NULL DEFAULT '9999-12-31',  
job_code INT,  
store_id INT  
)charset=utf16  
PARTITION BY HASH(store_id)  
PARTITIONS 4;
insert  into  employees003(id,fname,lname,job_code,store_id) values(1,'中国人民','國軍',10,20);
select   *  from   employees003;
id	fname	lname	hired	separated	job_code	store_id
1	中国人民	國軍	1970-01-01	9999-12-31	10	20
-- character-2-1-5-4   KSY分区   ob不支持这个分区
drop TABLE if exists employees004;
CREATE TABLE employees004(col1 INT NOT NULL,col2 CHAR(5) CHARACTER SET  utf16,  col3 DATE)charset=utf16 PARTITION BY LINEAR KEY (col1)  PARTITIONS 3;
-- character-2-1-5-5    线性哈希功能   ob不支持
drop TABLE if exists employees005;
CREATE TABLE employees005(id INT NOT NULL,fname VARCHAR(30) CHARACTER SET  utf16,lname VARCHAR(30) CHARACTER SET  utf16,hired DATE NOT NULL DEFAULT '1970-01-01',separated DATE NOT NULL DEFAULT '9999-12-31',  job_code INT,  store_id INT  )charset=utf16   PARTITION BY LINEAR HASH(YEAR(hired)) PARTITIONS 4; 
-- 子分区：
-- character-2-1-5-6   不定义每个子分区
drop TABLE if exists employees006;
CREATE TABLE employees006(id INT, purchased DATE)charset=utf16 
PARTITION BY RANGE( YEAR(purchased) )
SUBPARTITION BY HASH( TO_DAYS(purchased) )
SUBPARTITIONS 2 (
PARTITION p0 VALUES LESS THAN (1990),
PARTITION p1 VALUES LESS THAN (2000),
PARTITION p2 VALUES LESS THAN MAXVALUE
);
insert  into  employees006(id,purchased) values(1,'1970-01-01');
select   *  from   employees006;
id	purchased
1	1970-01-01
-- character-2-1-5-6   定义每个子分区   ob不支持
drop TABLE if exists employees007;
CREATE TABLE employees007(id INT, purchased DATE)charset=utf16 PARTITION BY RANGE( YEAR(purchased) )SUBPARTITION BY HASH( TO_DAYS(purchased) ) (PARTITION p0 VALUES LESS THAN (1990) (SUBPARTITION s0,SUBPARTITION s1),PARTITION p1 VALUES LESS THAN (2000) (SUBPARTITION s2,SUBPARTITION s3),PARTITION p2 VALUES LESS THAN MAXVALUE (SUBPARTITION s4,SUBPARTITION s5));   
-- character-2-1-5-7   普通表转分区表
drop TABLE if exists employees001;
drop TABLE if exists employees002;
drop TABLE if exists employees003;
drop TABLE if exists employees004;
drop TABLE if exists employees005;
drop TABLE if exists employees006;
drop TABLE if exists employees007;
-- character-2-1-6    虚拟列  ob不支持 json
drop TABLE if exists user001;
drop TABLE if exists t;
create table t( x varchar(20) CHARACTER SET gbk, y varchar(20) CHARACTER SET utf16, z varchar(20) generated always as(concat(x,y)))charset=utf16;
insert into t(x,y) values('中华人民共和国','中華人民共和國');
select   *  from   t;
x	y	z
中华人民共和国	中華人民共和國	中华人民共和国中華人民共和國
drop TABLE if exists t;
-- character-2-1-7   别名
SELECT 100%89 AS 结果;
结果
11
drop TABLE if exists user002;
create table user002(age int(4), name varchar(20))charset=utf16;
insert into user002 values(21, 'Jack'), (23, 'Rose'), (35, '；mn人好久好久生酒馆'), (56, 'VG胡椒粉科技');
select * from user002 s where age > 30;
age	name
35	；mn人好久好久生酒馆
56	VG胡椒粉科技
select age as student_age, name as student_name from user002;
student_age	student_name
21	Jack
23	Rose
35	；mn人好久好久生酒馆
56	VG胡椒粉科技
drop TABLE if exists user002;
-- character-2-1-8   临时表
DROP TABLE IF EXISTS limit_dept;
create TABLE limit_dept(
DEPTNO INT not null auto_increment primary key, 
DNAME VARCHAR(30) CHARACTER SET  utf16,
LOC VARCHAR(40) CHARACTER SET  utf16  
)charset=utf16 ;
DROP PROCEDURE IF EXISTS limit_pro;
CREATE PROCEDURE limit_pro()
BEGIN
DECLARE v_i int unsigned DEFAULT 0;
repeat
SET v_i = v_i+1;
INSERT INTO limit_dept VALUES (null,concat(cast(v_i as char),'ACCOUNTING'),'NEW YORK');
UNTIL v_i >= 40 END REPEAT;
end//
CALL limit_pro();
select  *  from    limit_dept;
DEPTNO	DNAME	LOC
1	1ACCOUNTING	NEW YORK
2	2ACCOUNTING	NEW YORK
3	3ACCOUNTING	NEW YORK
4	4ACCOUNTING	NEW YORK
5	5ACCOUNTING	NEW YORK
6	6ACCOUNTING	NEW YORK
7	7ACCOUNTING	NEW YORK
8	8ACCOUNTING	NEW YORK
9	9ACCOUNTING	NEW YORK
10	10ACCOUNTING	NEW YORK
11	11ACCOUNTING	NEW YORK
12	12ACCOUNTING	NEW YORK
13	13ACCOUNTING	NEW YORK
14	14ACCOUNTING	NEW YORK
15	15ACCOUNTING	NEW YORK
16	16ACCOUNTING	NEW YORK
17	17ACCOUNTING	NEW YORK
18	18ACCOUNTING	NEW YORK
19	19ACCOUNTING	NEW YORK
20	20ACCOUNTING	NEW YORK
21	21ACCOUNTING	NEW YORK
22	22ACCOUNTING	NEW YORK
23	23ACCOUNTING	NEW YORK
24	24ACCOUNTING	NEW YORK
25	25ACCOUNTING	NEW YORK
26	26ACCOUNTING	NEW YORK
27	27ACCOUNTING	NEW YORK
28	28ACCOUNTING	NEW YORK
29	29ACCOUNTING	NEW YORK
30	30ACCOUNTING	NEW YORK
31	31ACCOUNTING	NEW YORK
32	32ACCOUNTING	NEW YORK
33	33ACCOUNTING	NEW YORK
34	34ACCOUNTING	NEW YORK
35	35ACCOUNTING	NEW YORK
36	36ACCOUNTING	NEW YORK
37	37ACCOUNTING	NEW YORK
38	38ACCOUNTING	NEW YORK
39	39ACCOUNTING	NEW YORK
40	40ACCOUNTING	NEW YORK
-- #直接将查询结果导入临时表  ob不支持这种方式建立临时表
CREATE TEMPORARY TABLE tmp_table001 SELECT * FROM limit_dept;
--   #查询临时表
select * from tmp_table001;
--   #删除临时表和基表
drop table tmp_table001;
DROP TABLE IF EXISTS limit_dept;
--====================================================================库，表，列utf16===============================================================================================================
--======================================================================库，表，列gbk=========================================================================
drop database  IF EXISTS  ob100x;
create database ob100x  character set gbk;
use ob100x;
--   character-2-2-1   表
drop table  IF EXISTS  characterset;
create table characterset(
id int not null auto_increment primary key,
fuhao varchar(100) character set gbk,
zifu char(100)  character set gbk not null,
sage tinyint(100) not null,
sdept char(40) not null)DEFAULT CHARACTER SET = gbk,comment = '字符集表';
insert into characterset values(null,'❤❥웃유♋☮✌☏☢☠✔','hello world',100,'文字セット');
insert into characterset values(null,'我是中国人','hello world',100,'文字セット');
select   *  from   characterset;
id	fuhao	zifu	sage	sdept
1	我是中国人	hello world	100	文字セット
drop table  IF EXISTS  characterset;
--  新建基础表
drop table if exists emp_rg;
CREATE TABLE emp_rg(EMPNO int PRIMARY key,
ename varchar(100) character set gbk,
job char(200) character set gbk,
MGR int,HIREDATE DATE,SAL float(7,2),COMM float(7,2),DEPTNO int)CHARACTER SET = gbk;
INSERT INTO emp_rg VALUES(7369,'张三','CLERK',7902,'2016-11-1',800,NULL,20);
INSERT INTO emp_rg VALUES(7499,'李四','SALESMAN',7698,'2016-01-1',1600,300,30);
INSERT INTO emp_rg VALUES(7521,'王五','SALESMAN',7698,'1981-09-1',1250,500,30);
INSERT INTO emp_rg VALUES(7566,'赵六','MANAGER',7839,'1989-09-1',2975,NULL,20);
INSERT INTO emp_rg VALUES(7654,'唐僧','SALESMAN',7698,'1983-09-1',1250,1400,30);
INSERT INTO emp_rg VALUES(7698,'中華人民共和國','MANAGER',7839,'1985-09-1',2850,NULL,30);
INSERT INTO emp_rg VALUES(7782,'孙悟空','MANAGER',7839,'1991-09-1',2450,NULL,10);
INSERT INTO emp_rg VALUES(7788,'猪八戒','ANALYST',7566,'1955-09-1',3000,NULL,20);
INSERT INTO emp_rg VALUES(7839,'KING','PRESIDENT',NULL,'1965-09-1',5000,NULL,10);
INSERT INTO emp_rg VALUES(7844,'TURNER','SALESMAN',7698,'1975-09-1',1500,0,30);
INSERT INTO emp_rg VALUES(7876,'ADAMS','CLERK',7788,'1959-09-1',1100,NULL,20);
INSERT INTO emp_rg VALUES(7900,'JAMES','CLERK',7698,'1953-09-1',950,NULL,30);
INSERT INTO emp_rg VALUES(7902,'FORD','ANALYST',7566,'1968-09-1',3000,NULL,20);
INSERT INTO emp_rg VALUES(7934,'MILLER','CLERK',7782,'1950-09-1',1300,NULL,10);
select  *  from   emp_rg;
EMPNO	ename	job	MGR	HIREDATE	SAL	COMM	DEPTNO
7369	张三	CLERK	7902	2016-11-01	800.00	NULL	20
7499	李四	SALESMAN	7698	2016-01-01	1600.00	300.00	30
7521	王五	SALESMAN	7698	1981-09-01	1250.00	500.00	30
7566	赵六	MANAGER	7839	1989-09-01	2975.00	NULL	20
7654	唐僧	SALESMAN	7698	1983-09-01	1250.00	1400.00	30
7698	中華人民共和國	MANAGER	7839	1985-09-01	2850.00	NULL	30
7782	孙悟空	MANAGER	7839	1991-09-01	2450.00	NULL	10
7788	猪八戒	ANALYST	7566	1955-09-01	3000.00	NULL	20
7839	KING	PRESIDENT	NULL	1965-09-01	5000.00	NULL	10
7844	TURNER	SALESMAN	7698	1975-09-01	1500.00	0.00	30
7876	ADAMS	CLERK	7788	1959-09-01	1100.00	NULL	20
7900	JAMES	CLERK	7698	1953-09-01	950.00	NULL	30
7902	FORD	ANALYST	7566	1968-09-01	3000.00	NULL	20
7934	MILLER	CLERK	7782	1950-09-01	1300.00	NULL	10
--  character-2-2-2-1   创建视图
DROP VIEW IF EXISTS view_emp_rg;
create OR  REPLACE view view_emp_rg as  select * from emp_rg where sal>1500;
select   *  from   view_emp_rg;
EMPNO	ename	job	MGR	HIREDATE	SAL	COMM	DEPTNO
7499	李四	SALESMAN	7698	2016-01-01	1600.00	300.00	30
7566	赵六	MANAGER	7839	1989-09-01	2975.00	NULL	20
7698	中華人民共和國	MANAGER	7839	1985-09-01	2850.00	NULL	30
7782	孙悟空	MANAGER	7839	1991-09-01	2450.00	NULL	10
7788	猪八戒	ANALYST	7566	1955-09-01	3000.00	NULL	20
7839	KING	PRESIDENT	NULL	1965-09-01	5000.00	NULL	10
7902	FORD	ANALYST	7566	1968-09-01	3000.00	NULL	20
--  character-2-2-2-2   修改视图     ob不支持这类
ALTER  VIEW  view_emp_rg  AS  SELECT  EMPNO,ename,job  FROM  emp_rg e;
select   *  from   view_emp_rg;
EMPNO	ename	job	MGR	HIREDATE	SAL	COMM	DEPTNO
7499	李四	SALESMAN	7698	2016-01-01	1600.00	300.00	30
7566	赵六	MANAGER	7839	1989-09-01	2975.00	NULL	20
7698	中華人民共和國	MANAGER	7839	1985-09-01	2850.00	NULL	30
7782	孙悟空	MANAGER	7839	1991-09-01	2450.00	NULL	10
7788	猪八戒	ANALYST	7566	1955-09-01	3000.00	NULL	20
7839	KING	PRESIDENT	NULL	1965-09-01	5000.00	NULL	10
7902	FORD	ANALYST	7566	1968-09-01	3000.00	NULL	20
--  character-2-2-2-3 
delete from  view_emp_rg   where   empno=7369;
select   *  from   view_emp_rg;
EMPNO	ename	job	MGR	HIREDATE	SAL	COMM	DEPTNO
7499	李四	SALESMAN	7698	2016-01-01	1600.00	300.00	30
7566	赵六	MANAGER	7839	1989-09-01	2975.00	NULL	20
7698	中華人民共和國	MANAGER	7839	1985-09-01	2850.00	NULL	30
7782	孙悟空	MANAGER	7839	1991-09-01	2450.00	NULL	10
7788	猪八戒	ANALYST	7566	1955-09-01	3000.00	NULL	20
7839	KING	PRESIDENT	NULL	1965-09-01	5000.00	NULL	10
7902	FORD	ANALYST	7566	1968-09-01	3000.00	NULL	20
--   异常案例delete from  view_emp_rg e  where   e.empno=7369;删除不能表用别名   ob支持， mysql报错
--  character-2-2-2-4 
--   #给视图增加字段：异常案例
--   alter table view_emp_rg add age int  after ename;
alter table emp_rg add age int  after ename;ob支持  mysql 也支持 但是显示的结果不一致。
select   *  from   emp_rg;
--  character-2-2-2-5 
update view_emp_rg e  set ename='我是视图一号' where   e.empno=7788;
select   *  from   view_emp_rg;
EMPNO	ename	job	MGR	HIREDATE	SAL	COMM	DEPTNO
7499	李四	SALESMAN	7698	2016-01-01	1600.00	300.00	30
7566	赵六	MANAGER	7839	1989-09-01	2975.00	NULL	20
7698	中華人民共和國	MANAGER	7839	1985-09-01	2850.00	NULL	30
7782	孙悟空	MANAGER	7839	1991-09-01	2450.00	NULL	10
7788	我是视图一号	ANALYST	7566	1955-09-01	3000.00	NULL	20
7839	KING	PRESIDENT	NULL	1965-09-01	5000.00	NULL	10
7902	FORD	ANALYST	7566	1968-09-01	3000.00	NULL	20
DROP VIEW IF EXISTS view_emp_rg;
drop table if exists emp_rg;
--   列和约束
SET FOREIGN_KEY_CHECKS=1;
drop table if exists partdepent;
CREATE TABLE partdepent(
partdepentid int,  # 部门编号
DNAME VARCHAR(14)  character set gbk, 
LOC  VARCHAR(14) character set gbk, CONSTRAINT pk_dept PRIMARY KEY(partdepentid)
) DEFAULT CHARSET=gbk;
drop table if exists prize_table;
CREATE TABLE prize_table(
id int PRIMARY KEY,
name varchar(100) character set gbk,
contry char(200) character set gbk,
company int,
birty DATE,
money float(7,2),
prize float(7,2),
nameprize varchar(100) character set gbk,
workshop int,CONSTRAINT fk_deptno FOREIGN KEY(id) REFERENCES partdepent(partdepentid));
--   character-2-2-3-1   #删除主键约束：
alter table prize_table drop primary key;
--  #添加主键约束
alter table prize_table add constraint PK_id primary key prize_table(id);
--   character-2-2-3-2   非空约束
ALTER TABLE prize_table MODIFY contry varchar(150)  not null;
--   character-2-2-3-3   唯一约束
ALTER TABLE prize_table  ADD CONSTRAINT some_name UNIQUE (NAME);
--   character-2-2-3-4  #添加外键约束，空表才可以添加 主建才鞥设置为外键 ： ob不支持
ALTER TABLE partdepent ADD CONSTRAINT fk_sid FOREIGN KEY(partdepentid) REFERENCES prize_table(id);
--   基表的数据要先插入
INSERT INTO partdepent VALUES (10,'ACCOUNTING','湖北');
INSERT INTO partdepent VALUES (20,'RESEARCH','江苏');
INSERT INTO partdepent VALUES (30,'SALES','河南');
INSERT INTO partdepent VALUES (40,'gadles','河南');
INSERT INTO partdepent VALUES (50,'gadles','河南');
INSERT INTO prize_table VALUES(10,'Mark001','CLERK',1111,'1951-09-1',1400,NULL,'贡献奖',2000);
INSERT INTO prize_table VALUES(20,'Mark002','CLERK',2222,'1952-09-1',1500,NULL,'贡献奖',2000);
INSERT INTO prize_table VALUES(30,'Mark003','CLERK',3333,'1953-09-1',1600,NULL,'贡献奖',2000);
desc  prize_table;
Field	Type	Null	Key	Default	Extra
id	int(11)	NO	PRI	NULL	
name	varchar(100)	YES	UNI	NULL	
contry	char(200)	YES		NULL	
company	int(11)	YES		NULL	
birty	date	YES		NULL	
money	float(7,2)	YES		NULL	
prize	float(7,2)	YES		NULL	
nameprize	varchar(100)	YES		NULL	
workshop	int(11)	YES		NULL	
-- character-2-2-3-5  check 约束  ob不支持                       
ALTER TABLE  prize_table  ADD CONSTRAINT id_chk_1 CHECK(id>29000);
INSERT INTO prize_table VALUES(40,'MILLER001','CLERK',7781,'1950-09-1',1300,NULL,'贡献奖',1000);
-- character-2-2-3-6   FOREIGN_KEY_CHECKS=0 可以删除基表的外键了
SET FOREIGN_KEY_CHECKS=0;
delete  from   partdepent  where  partdepentid =10;
select   *  from   partdepent;
partdepentid	DNAME	LOC
20	RESEARCH	江苏
30	SALES	河南
40	gadles	河南
50	gadles	河南
SET FOREIGN_KEY_CHECKS=1;
--  character-2-2-3-7  default 约束
alter table prize_table alter column prize set default  999;
INSERT INTO prize_table(id,name,contry,company,birty,money,nameprize,workshop) values
(50,'MILLER003','CLERK003',1100,'1950-09-1',1300,'贡献奖',1000);
select  *  from    prize_table;
id	name	contry	company	birty	money	prize	nameprize	workshop
10	Mark001	CLERK	1111	1951-09-01	1400.00	NULL	贡献奖	2000
20	Mark002	CLERK	2222	1952-09-01	1500.00	NULL	贡献奖	2000
30	Mark003	CLERK	3333	1953-09-01	1600.00	NULL	贡献奖	2000
40	MILLER001	CLERK	7781	1950-09-01	1300.00	NULL	贡献奖	1000
50	MILLER003	CLERK003	1100	1950-09-01	1300.00	999.00	贡献奖	1000
-- character-2-2-3-8  #删除列（字段）：
alter table prize_table drop column workshop;
select  *  from  prize_table;
id	name	contry	company	birty	money	prize	nameprize
10	Mark001	CLERK	1111	1951-09-01	1400.00	NULL	贡献奖
20	Mark002	CLERK	2222	1952-09-01	1500.00	NULL	贡献奖
30	Mark003	CLERK	3333	1953-09-01	1600.00	NULL	贡献奖
40	MILLER001	CLERK	7781	1950-09-01	1300.00	NULL	贡献奖
50	MILLER003	CLERK003	1100	1950-09-01	1300.00	999.00	贡献奖
-- character-2-2-3-9  #添加列（字段）：
alter table prize_table add column worker varchar(30);
select  *  from  prize_table;
id	name	contry	company	birty	money	prize	nameprize	worker
10	Mark001	CLERK	1111	1951-09-01	1400.00	NULL	贡献奖	NULL
20	Mark002	CLERK	2222	1952-09-01	1500.00	NULL	贡献奖	NULL
30	Mark003	CLERK	3333	1953-09-01	1600.00	NULL	贡献奖	NULL
40	MILLER001	CLERK	7781	1950-09-01	1300.00	NULL	贡献奖	NULL
50	MILLER003	CLERK003	1100	1950-09-01	1300.00	999.00	贡献奖	NULL
-- character-2-2-3-10  #修改列名   ob不支持这句
alter table prize_table change worker worker001 int;
select  *  from  prize_table;
id	name	contry	company	birty	money	prize	nameprize	worker
10	Mark001	CLERK	1111	1951-09-01	1400.00	NULL	贡献奖	NULL
20	Mark002	CLERK	2222	1952-09-01	1500.00	NULL	贡献奖	NULL
30	Mark003	CLERK	3333	1953-09-01	1600.00	NULL	贡献奖	NULL
40	MILLER001	CLERK	7781	1950-09-01	1300.00	NULL	贡献奖	NULL
50	MILLER003	CLERK003	1100	1950-09-01	1300.00	999.00	贡献奖	NULL
--   #删除外键约束：
alter table prize_table drop foreign key fk_deptno;
--   #修改表名：
drop table if exists depent001;
alter table partdepent rename to depent001;
--   修改列（字段）：
alter table depent001 modify LOC varchar(22);
select  *  from  depent001;
partdepentid	DNAME	LOC
20	RESEARCH	江苏
30	SALES	河南
40	gadles	河南
50	gadles	河南
drop table if exists prize_table;
drop table if exists depent001;
--   索引
drop TABLE if exists my_test;
create table my_test(
id int(11) not null unique auto_increment,
name varchar(100)  CHARACTER SET  gbk,
age int(11) not null default 0,
address varchar(100) CHARACTER SET  gbk
)charset=gbk;
--  character-2-2-4-1    #创建普通索引
create index index_001 on  my_test(name);
--     修改表结构的方式添加索引  
alter table my_test add index index_004(age);
--  character-2-2-4-2   #降序索引ob不支持
create index index_002 on my_test(age DESC); 
create index index_002 on my_test(age);
--  character-2-2-4-3   #修改索引
create index index_006 on my_test(address);
DROP INDEX index_006 ON my_test;
ALTER TABLE my_test ADD index index_006(address);
DROP INDEX index_006 ON my_test;
--  character-2-2-4-4  删除索引
drop index index_001 on my_test;
alter table my_test drop index index_002;
--  character-2-2-4-5    建立复合索引 #建立表列age和name的联合索引；按照age升序后再按照name降序排序
create index index_003 on my_test(age,name);
--  character-2-2-4-6    创建唯一索引
CREATE UNIQUE INDEX index_005 ON  my_test(address);
ALTER TABLE my_test ADD UNIQUE(address);
drop TABLE if exists my_test;
--  分区表：
-- character-2-2-5-1   RANGE分区
drop TABLE if exists employees001;
CREATE TABLE employees001(  
id INT NOT NULL,  
fname VARCHAR(30) CHARACTER SET  gbk,  
lname VARCHAR(30) CHARACTER SET  gbk,  
hired DATE NOT NULL DEFAULT '1970-01-01',  
separated DATE NOT NULL DEFAULT '9999-12-31',  
job_code INT NOT NULL,  
store_id INT NOT NULL  
)engine=innodb charset=gbk
PARTITION BY RANGE (store_id) (  
PARTITION p0 VALUES LESS THAN (6),  
PARTITION p1 VALUES LESS THAN (11),  
PARTITION p2 VALUES LESS THAN (16),  
PARTITION p3 VALUES LESS THAN MAXVALUE  
);
insert   into   employees001(id,fname,lname,job_code,store_id) values(1,'中華人民共和國','中華人民共和國',10,20);
select   *  from  employees001;
id	fname	lname	hired	separated	job_code	store_id
1	中華人民共和國	中華人民共和國	1970-01-01	9999-12-31	10	20
-- character-2-2-5-2     LIST分区
drop TABLE if exists employees002;
CREATE TABLE employees002 (  
id INT NOT NULL,  
fname VARCHAR(30) CHARACTER SET  gbk,  
lname VARCHAR(30) CHARACTER SET  gbk,  
hired DATE NOT NULL DEFAULT '1970-01-01',  
separated DATE NOT NULL DEFAULT '9999-12-31',  
job_code INT,  
store_id INT
)charset=gbk
PARTITION BY LIST(store_id) (
PARTITION pNorth VALUES IN (3,5,6,9,17),
PARTITION pEast VALUES IN (1,2,10,11,19,20),
PARTITION pWest VALUES IN (4,12,13,14,18),
PARTITION pCentral VALUES IN (7,8,15,16)
);
insert   into   employees002(id,fname,lname,job_code,store_id) values(1,'中華人民共和國','中華人民共和國',10,20);
select   *  from  employees002;
id	fname	lname	hired	separated	job_code	store_id
1	中華人民共和國	中華人民共和國	1970-01-01	9999-12-31	10	20
-- character-2-2-5-3    普通HASH分区
drop TABLE if exists employees003;
CREATE TABLE employees003(  
id INT NOT NULL,  
fname VARCHAR(30) CHARACTER SET  gbk,   
lname VARCHAR(30) CHARACTER SET  gbk,  
hired DATE NOT NULL DEFAULT '1970-01-01',  
separated DATE NOT NULL DEFAULT '9999-12-31',  
job_code INT,  
store_id INT  
)charset=gbk  
PARTITION BY HASH(store_id)  
PARTITIONS 4;
insert   into   employees003(id,fname,lname,job_code,store_id) values(1,'中華人民共和國','中華人民共和國',10,20);
select   *  from  employees003;
id	fname	lname	hired	separated	job_code	store_id
1	中華人民共和國	中華人民共和國	1970-01-01	9999-12-31	10	20
-- character-2-2-5-4   KSY分区   ob不支持这个分区
drop TABLE if exists employees004;
CREATE TABLE employees004(col1 INT NOT NULL,col2 CHAR(5) CHARACTER SET  gbk,  col3 DATE)charset=gbk PARTITION BY LINEAR KEY (col1)  PARTITIONS 3;
-- character-2-2-5-5    线性哈希功能   ob不支持
drop TABLE if exists employees005;
CREATE TABLE employees005(id INT NOT NULL,fname VARCHAR(30) CHARACTER SET  gbk,lname VARCHAR(30) CHARACTER SET  gbk,hired DATE NOT NULL DEFAULT '1970-01-01',separated DATE NOT NULL DEFAULT '9999-12-31',  job_code INT,  store_id INT  )charset=gbk   PARTITION BY LINEAR HASH(YEAR(hired)) PARTITIONS 4; 
-- 子分区：
-- character-2-2-5-6   不定义每个子分区
drop TABLE if exists employees006;
CREATE TABLE employees006(id INT, purchased DATE)charset=gbk 
PARTITION BY RANGE( YEAR(purchased) )
SUBPARTITION BY HASH( TO_DAYS(purchased) )
SUBPARTITIONS 2 (
PARTITION p0 VALUES LESS THAN (1990),
PARTITION p1 VALUES LESS THAN (2000),
PARTITION p2 VALUES LESS THAN MAXVALUE
);
insert   into   employees006(id,purchased) values(1,'1970-01-01');
select   *  from  employees006;
id	purchased
1	1970-01-01
-- character-2-2-5-6   定义每个子分区   ob不支持
drop TABLE if exists employees007;
CREATE TABLE employees007(id INT, purchased DATE)charset=gbk PARTITION BY RANGE( YEAR(purchased) )SUBPARTITION BY HASH( TO_DAYS(purchased) ) (PARTITION p0 VALUES LESS THAN (1990) (SUBPARTITION s0,SUBPARTITION s1),PARTITION p1 VALUES LESS THAN (2000) (SUBPARTITION s2,SUBPARTITION s3),PARTITION p2 VALUES LESS THAN MAXVALUE (SUBPARTITION s4,SUBPARTITION s5));   
-- character-2-2-5-7   普通表转分区表
drop TABLE if exists employees001;
drop TABLE if exists employees002;
drop TABLE if exists employees003;
drop TABLE if exists employees004;
drop TABLE if exists employees005;
drop TABLE if exists employees006;
drop TABLE if exists employees007;
-- character-2-2-6    虚拟列  ob不支持 json
drop TABLE if exists user001;
drop TABLE if exists t;
create table t( x varchar(20) CHARACTER SET  gbk, y varchar(20)CHARACTER SET  gbk, z varchar(20) CHARACTER SET  gbk generated always as(concat(x,y)))charset=gbk;
insert into t(x,y) values('中华人民共和国','中華人民共和國');
select   *  from   t;
x	y	z
中华人民共和国	中華人民共和國	中华人民共和国中華人民共和國
drop TABLE if exists t;
-- character-2-2-7   别名
SELECT 100%89 AS 结果;
结果
11
drop TABLE if exists user002;
create table user002(age int(4), name varchar(20));
insert into user002 values(21, 'Jack'), (23, 'Rose'), (35, 'Ann'), (56, 'Mike');
select * from user002 s where age > 30;
age	name
35	Ann
56	Mike
select age as student_age, name as student_name from user002;
student_age	student_name
21	Jack
23	Rose
35	Ann
56	Mike
drop TABLE if exists user002;
-- character-2-2-8   临时表
DROP TABLE IF EXISTS limit_dept;
create TABLE limit_dept(
DEPTNO INT not null auto_increment primary key, 
DNAME VARCHAR(30) CHARACTER SET  gbk,
LOC VARCHAR(40) CHARACTER SET  gbk  
)charset=gbk;
DROP PROCEDURE IF EXISTS limit_pro//
CREATE PROCEDURE limit_pro()
BEGIN
DECLARE v_i int unsigned DEFAULT 0;
repeat
SET v_i = v_i+1;
INSERT INTO limit_dept VALUES (null,concat(cast(v_i as char),'ACCOUNTING'),'NEW YORK');    
UNTIL v_i >= 40 END REPEAT;
END//
CALL limit_pro();
DROP TABLE IF EXISTS tmp_table001;
-- #直接将查询结果导入临时表  ob不支持这种方式建立临时表
CREATE TEMPORARY TABLE tmp_table001 SELECT * FROM limit_dept;
--   #查询临时表
select * from tmp_table001;
--   #删除临时表和基表
drop table tmp_table001;
--====================================================================普通函数测试===============================================================================================================
普通函数测试
drop database  IF EXISTS  variablesandconstants;
create database variablesandconstants character set utf16;
use variablesandconstants;
DROP TABLE IF EXISTS table001;
CREATE TABLE  table001(
c1 INT UNSIGNED AUTO_INCREMENT,
c2 VARCHAR(100) CHARACTER SET gbk NOT NULL,
c3 VARCHAR(200) CHARACTER SET utf16 NOT NULL,
c4 CHAR(200) CHARACTER SET gbk, 
c5 CHAR(200) CHARACTER SET utf16, 
c6 varchar(300) generated always as(concat(c2,c4)),#生成列的两个字段的字符集要保持一致。
PRIMARY KEY(c1)
)CHARSET=gbk;
insert into  table001(c1,c2,c3,c4,c5)values(null,'中国','美国','英国','法国');
insert into  table001(c1,c2,c3,c4,c5)values(null,'中国Longlivethegreatunityofthepeopleoftheworld','美国Longlivethegreatunityofthepeopleoftheworld','英国Longlivethegreatunityofthepeopleoftheworld','法国Longlivethegreatunityofthepeopleoftheworld');
insert into  table001(c1,c2,c3,c4,c5)values(null,'中国','中国・米国・英国・フランス','China, the United Kingdom, France','Chine États-Unis Royaume-Uni France');
select  *  from   table001;
c1	c2	c3	c4	c5	c6
1	中国	美国	英国	法国	中国英国
2	中国Longlivethegreatunityofthepeopleoftheworld	美国Longlivethegreatunityofthepeopleoftheworld	英国Longlivethegreatunityofthepeopleoftheworld	法国Longlivethegreatunityofthepeopleoftheworld	中国Longlivethegreatunityofthepeopleoftheworld英国Longlivethegreatunityofthepeopleoftheworld
3	中国	中国・米国・英国・フランス	China, the United Kingdom, France	Chine États-Unis Royaume-Uni France	中国China, the United Kingdom, France
DROP TABLE IF EXISTS table002;
CREATE TABLE  table002(
c1 INT UNSIGNED AUTO_INCREMENT,
c2 VARCHAR(100) CHARACTER SET gbk NOT NULL,
c3 VARCHAR(200) CHARACTER SET utf16 NOT NULL,
c4 CHAR(200) CHARACTER SET gbk, 
c5 CHAR(200) CHARACTER SET utf16, 
c6 varchar(300) generated always as(concat(c2,c4)),#生成列的两个字段的字符集要保持一致。
PRIMARY KEY(c1)
)CHARSET=utf16;
insert into  table002(c1,c2,c3,c4,c5)values(null,'中国','美国','英国','法国');
insert into  table002(c1,c2,c3,c4,c5)values(null,'中国Longlivethegreatunityofthepeopleoftheworld','美国Longlivethegreatunityofthepeopleoftheworld','英国Longlivethegreatunityofthepeopleoftheworld','法国Longlivethegreatunityofthepeopleoftheworld');
insert into  table002(c1,c2,c3,c4,c5)values(null,'中国','中国・米国・英国・フランス','China, the United Kingdom, France','Chine États-Unis Royaume-Uni France');
select  *  from   table002;
c1	c2	c3	c4	c5	c6
1	中国	美国	英国	法国	中国英国
2	中国Longlivethegreatunityofthepeopleoftheworld	美国Longlivethegreatunityofthepeopleoftheworld	英国Longlivethegreatunityofthepeopleoftheworld	法国Longlivethegreatunityofthepeopleoftheworld	中国Longlivethegreatunityofthepeopleoftheworld英国Longlivethegreatunityofthepeopleoftheworld
3	中国	中国・米国・英国・フランス	China, the United Kingdom, France	Chine États-Unis Royaume-Uni France	中国China, the United Kingdom, France
--#3.普通函数测试
--  character-3-1-1    返回字符串str的第一个字符的ascii值(str是空串时返回0) 
select ascii(2);
ascii(2)
50
select ascii('dete');
ascii('dete')
100
select ascii('');
ascii('')
0
select ascii('    ');
ascii('    ')
32
--  character-3-1-2   #如果字符串str句首是单字节返回与ascii()函数返回的相同值。
select ord('2');
--  character-3-1-3    
select conv("a",16,2);
select conv("6e",18,8);
select conv(-17,10,-18);
select conv(10+"10"+'10'+0xa,10,10);
select conv(c2,1,2),conv(c3,18,8)  from   table001 ;
select conv(c2,10,2),conv(c3,18,8)  from   table002 ;
--  character-3-1-4   
select bin(12);
select bin(c3) from   table001;
--  character-3-1-5   
select oct(12);
select oct(c3) from   table001;
--  character-3-1-6 
select hex(255);
select hex(c3) from   table001;
select hex(c2) from   table001;
select hex(c3) from   table002;
select hex(c2) from   table002;
--  character-3-1-7    返回由参数n,...对应的ascii代码字符组成的一个字串(参数是n,...是数字序列,null值被跳过)  
select char(77,121,83,81,'76');
select char(77,77.3,'77.3');
select char(77,77.3,null,'','77.3');
--  character-3-1-8 把参数连成一个长字符串并返回(任何参数是null时返回null) 
select concat('my', 's', 'ql');
select concat('my', null, 'ql');
select concat(14.3);
select  concat(c2, c3),concat(c4, c5) 连接   from   table001;
select  concat(c2, c3),concat(c4, c5) 连接   from   table002;
--  character-3-1-9 返回字符串str的长度
select length('text');
--  character-3-1-10   返回字符串substr在字符串str第一次出现的位置(str不包含substr时返回0)    substr函数
select position('bar' in 'foobarbar');
SELECT concat(SUBSTR(c2,6),SUBSTR(c3,6),6)     from   table001;
SELECT SUBSTR(c2 FROM 6)     from   table001;
SELECT SUBSTR(c3 FROM 6)     from   table001;
SELECT SUBSTR(c2,6,9)    from   table001;
SELECT SUBSTR(c3 FROM 6 FOR 9)   from   table001;
--  character-3-1-11  返回字符串substr在字符串str第一次出现的位置(str不包含substr时返回0)
select locate('bar', 'foobarbar');
select locate('xbar', 'foobar');
select locate('bar', 'foobarbar',5);
--  character-3-1-12
select instr('foobarbar', 'bar');
select instr('xbar', 'foobar');
select instr(c3, '中国')  from   table001;
--  character-3-1-13
select lpad('hi',4,'??');
select lpad(c2,40,'@')  from   table001;
select lpad(c2,40,'@')  from   table002;
--  character-3-1-14
select rpad('hi',5,'?');
select rpad(c2,40,'@')  from   table001;
--  character-3-1-15
select left('foobarbar', 5);
select left(c2, 5)   from   table001;
select left(c3, 5)   from   table001;
--  character-3-1-16
select right('foobarbar', 4);
--  character-3-1-17
select substring('quadratically',5,6);
select substring('quadratically',5);
select substring('foobarbar' from 4);
select substring(c2,5,6)   from   table001;
select substring(c3,5,6)   from   table001;
--  character-3-1-18
select substring_index('www.mysql.com', '.', 2);
select substring_index('www.mysql.com', '.', -2);
--  character-3-1-19
select ltrim('  barbar');
select ltrim(c2) from   table001;
select ltrim(c3) from   table001;
--  character-3-1-20   rtrim(str)  返回删除了右空格的字符串str 
select rtrim('barbar   ');
select rtrim(c2) from   table001;
select rtrim(c3) from   table001;
--  character-3-1-21     trim([[both | leading | trailing] [remstr] from] str)  
select trim('  bar   ');
select trim(leading 'x' from 'xxxbarxxx');
select trim(both 'x' from 'xxxbarxxx');
select trim(trailing 'xyz' from 'barxxyz');
select trim(c2) from   table001;
select trim(c3) from   table001;
select trim(concat(space(6),c2))  from   table001;
--  character-3-1-22
select concat(space(6),c2) from   table001;
select concat(space(6),c3) from   table001;
--  character-3-1-23     
select replace('www.mysql.com', 'w', 'ww');
--  character-3-1-24     repeat(str,count)  
select repeat('mysql', 3);
--  character-3-1-25    reverse(str) 
select reverse('abc');
select reverse(c2) from   table001;
select reverse(c3) from   table001;
--  character-3-1-26     insert(str,pos,len,newstr)  
select insert('quadratic', 3, 4, 'what');
--  character-3-1-27     elt(n,str1,str2,str3,...)  
select elt(1, 'ej', 'heja', 'hej', 'foo');
select elt(4, 'ej', 'heja', 'hej', 'foo');
select elt(1, c2, c3, c4, c5) from   table001;
select elt(4, c2, c3, c4, c5) from   table001;
select elt(1, c2, c3, c4, c5) from   table002;
select elt(4, c2, c3, c4, c5) from   table002;
--  character-3-1-28      field(str,str1,str2,str3,...)  
select field('ej', 'hej', 'ej', 'heja', 'hej','foo');
select elt(4, 'ej', 'heja', 'hej', 'foo');
select field('中国', 'hej', c2, c3, 'hej','foo') from   table001;
select field('中国', 'hej', c2, c3, 'hej','foo') from   table002;
--  character-3-1-29     find_in_set(str,strlist)  
select find_in_set('b','a,b,c,d');
--  character-3-1-30       make_set(bits,str1,str2,...) 
select make_set(1,'a','b','c');
select make_set(1 | 4,'hello','nice','world');
select make_set(0,'a','b','c');
select make_set(1,c2,c3,c4) from   table001;
select make_set(1 | 4,c2,c3,c4) from   table001;
--  character-3-1-31     小写字母
select lcase('quadratically');
select lower('quadratically');
select lcase(c2) from   table001;
select lower(c3) from   table001;
select concat(lower(c3),lcase(c2)) from   table001;
select concat(lower(c3),lcase(c2)) from   table002;
--  character-3-1-32   大写字母
select ucase('quadratically');
select upper('quadratically');
select ucase(c2) from   table001;
select concat(upper(c3),ucase(c2)) from   table001;
select concat(upper(c3),ucase(c2)) from   table002;
--  character-3-1-33      STRCMP(s1,s2)比较字符串 s1 和 s2，如果 s1 与 s2 相等返回 0 ，如果 s1>s2 返回 1，如果 s1<s2 返回 -1
SELECT STRCMP("runoob", "runoob");
SELECT STRCMP(c2, c4) from   table001;
SELECT STRCMP(c2, c4) from   table002;
--  character-3-1-34       FORMAT(x,n)函数可以将数字 x 进行格式化 “#,###.##”, 将 x 保留到小数点后 n 位，最后一位四舍五入
--====================================================================日期函数===============================================================================================================
drop database  IF EXISTS  ob100x;
create database ob100x  character set utf16;
use ob100x;
--  日期函数
--  character-3-2-1
select dayofweek('1998-02-03');
--  character-3-2-2 
select weekday('1997-10-04 22:23:00');
select weekday('1997-11-05');
--  character-3-2-3  
select dayofmonth('1998-02-03');
--  character-3-2-4
select dayofyear('1998-02-03');
--  character-3-2-5  
select month('1998-02-03');
--  dayname(date)  不存在 
--  character-3-2-2 #select dayname("1998-02-05");   
--  monthname(date)  不存在 
-- select monthname("1998-02-05");   
--  character-3-2-6 
--  select quarter('98-04-01');   ob报错mysql支持
--  character-3-2-7 
select week('1998-02-20');
select week('1998-02-20',0);
select week('1998-02-20',1);
--  character-3-2-8
select year('98-02-03');
--  character-3-2-9
select hour('10:05:03');
--  character-3-2-10 
select minute('98-02-03 10:05:03');
--  character-3-2-11
select second('10:05:03');
--   period_add(p,n)  #不存在 
--   #select period_add(9801,2);   
--  character-3-2-12 
select period_diff(9802,199703);
--  character-3-2-13 
select "1997-12-31 23:59:59" + interval 1 second;
select "1998-01-01" - interval 1 second;
select date_add("1997-12-31 23:59:59",interval 1 second);
select date_add("1997-12-31 23:59:59",interval 1 day);
select date_add("1997-12-31 23:59:59",interval "1:1" minute_second);
select date_add("1998-01-01 00:00:00",interval "11:1:1" day_second);
select date_add("1998-01-01 00:00:00", interval "-110" day_hour);
select date_sub("1998-01-02", interval 31 day);
select extract(year from "1999-07-02");
select extract(year_month from "1999-07-02 01:02:03");
select extract(day_minute from "1999-07-02 01:02:03");
--   #EXTRACT(type FROM d)从日期 d 中获取指定的值，type 指定返回的值
SELECT EXTRACT(MINUTE FROM '2011-12-13 14:15:16');
--  character-3-2-14  
select to_days(950501);
select to_days('1997-10-07');
--  character-3-2-15  
select from_days(729669);
--  character-3-2-16  
select date_format('1997-10-04 22:23:00','%w %m %y');
select date_format('1997-10-04 22:23:00','%h:%i:%s');
select date_format('1997-10-04 22:23:00','%d %y %a %d %m %b %j');
--  character-3-2-17   
select unix_timestamp('1997-10-04 22:23:00');
--  character-3-2-18   
select from_unixtime(875996580);
select from_unixtime(875996580) + 0;
--  character-3-2-19  sec_to_time(seconds)   
select sec_to_time(2378);
select sec_to_time(2378) + 0;
--  character-3-2-20  .time_to_sec(time)   
select time_to_sec('22:23:00');
select time_to_sec('00:39:38');
--  数学函数
--   character-3-3-1
select abs(2);
abs(2)
2
select abs(-32);
abs(-32)
32
--   character-3-3-2
select sign(-32);
sign(-32)
-1
select sign(0);
sign(0)
0
select sign(234);
sign(234)
1
--   character-3-3-3
select mod(234, 10);
mod(234, 10)
4
select 234 % 10;
234 % 10
4
select mod(29,9);
mod(29,9)
2
--   character-3-3-4
select floor(1.23);
floor(1.23)
1
select floor(-1.23);
floor(-1.23)
-2
--   character-3-3-5
select ceiling(1.23);
ceiling(1.23)
2
select ceiling(-1.23);
ceiling(-1.23)
-1
--   character-3-3-6
select round(-1.23);
round(-1.23)
-1
select round(-1.58);
round(-1.58)
-2
select round(1.58);
round(1.58)
2
select round(1.298, 1);
round(1.298, 1)
1.3
select round(1.298, 0);
round(1.298, 0)
1
-- #7.exp(n) 函数不存在
-- #select exp(2);   
-- #select exp(-2);   
-- #8.log(n) 
-- #select log(2);函数不存在    
-- #select log(-2);   
--  character-3-3-7   log10(n) 
select log10(2);
log10(2)
0.3010299956639812
select log10(100);
log10(100)
2
select log10(-100);
log10(-100)
NULL
--  character-3-3-8    pow(x,y)   
select pow(2,2);
pow(2,2)
4
select pow(2,-2);
pow(2,-2)
0.25
SELECT POW(5,-2),POW(10,3),POW(100,0),POWER(4,3),POWER(6,-3);
POW(5,-2)	POW(10,3)	POW(100,0)	POWER(4,3)	POWER(6,-3)
0.04	1000	1	64	0.004629629629629629
--  character-3-3-9    sqrt(n) 
select sqrt(4);
sqrt(4)
2
select sqrt(20);
sqrt(20)
4.47213595499958
--  #12.pi()     
--   #select pi();   不存在
-- #13.cos(n) 不存在
-- #select cos(pi()); 
-- #14sin(n) 不存在
-- #select sin(pi());   
-- #15.tan(n) 不存在
-- #select tan(pi()+1);   
-- #16.acos(n) 不存在
-- #select acos(1);   
-- #select acos(1.0001);   
-- #select acos(0); 不存在  
-- #17.asin(n) 
-- #select asin(0.2); 不存在  
-- #select asin('foo'); 不存在  
--  #18.atan(n) 
--   #select atan(2);   不存在
--  #select atan(-2);   
--  #19.atan2(x,y)  不存在 
--   #select atan(-2,2);   
--   #select atan(pi(),0);   
--   #20.cot(n) 不存在 
--   #select cot(12);   
--    #select cot(0);   
--  character-3-3-10 
select rand(20);
rand(20)
0.15888261251047497
select rand(20);
rand(20)
0.15888261251047497
--   #.degrees(n) 不存在 
--   #select degrees(pi());   
--   #.radians(n) 不存在
--  #select radians(90);   
--  character-3-3-11    truncate(n,d)   
select truncate(1.223,1);
truncate(1.223,1)
1.2
select truncate(1.999,1);
truncate(1.999,1)
1.9
select truncate(1.999,0);
truncate(1.999,0)
1
--  character-3-3-12    least(x,y,...)   
select least(2,0);
least(2,0)
0
select least(34.0,3.0,5.0,767.0);
least(34.0,3.0,5.0,767.0)
3.0
select least("b","a","c");
least("b","a","c")
a
--  character-3-3-13    greatest(x,y,...)   
select greatest(2,0);
greatest(2,0)
2
select greatest(34.0,3.0,5.0,767.0);
greatest(34.0,3.0,5.0,767.0)
767.0
select greatest("b","a","c");
greatest("b","a","c")
c
use ob100x;
SET FOREIGN_KEY_CHECKS=1;
--   聚合函数  新建测试表
drop table  IF EXISTS  student;
create table student
(id int(10) primary key,
name varchar(20) CHARACTER SET  gbk not null,
sex varchar(4),
birth year,
department varchar(20) not null,
address varchar(50))charset=utf16;
drop table  IF EXISTS  score;
create table score
(id int(10) primary key,
stu_id int(10) not null,
c_name varchar(20) CHARACTER SET  utf16 not null,
grade int(10))charset=utf16;
insert into student(id,name,sex,birth,department,address)values
(901,'张老大','男',1985,'计算机系','北京市海淀区'),
(902,'张老二','男',1986,'中文系','北京市昌平区'),
(903,'张三','女',1990,'中文系','湖南省永州市'),
(904,'李四','男',1990,'英语系','辽宁省阜新市'),
(905,'王五','女',1991,'英语系','福建省厦门市'),
(906,'王六','男',1988,'计算机系','湖南省衡阳市');
insert into score(id,stu_id,c_name,grade)values(1,901,'英语',80),(2,902,'计算机',65),(3,902,'中文',88),(4,903,'中文',95),
(5,904,'计算机',70),(6,904,'英语',92),(7,905,'英语',94),(8,906,'计算机',90),(9,901,'计算机',null),(10,901,'中文',null),(11,902,'英语',null);
--   character-4-1-1
select avg(grade),c_name from score group by c_name;
avg(grade)	c_name
88.6667	英语
75.0000	计算机
91.5000	中文
--   character-4-1-2
select min(grade),c_name from score group by c_name;
min(grade)	c_name
80	英语
65	计算机
88	中文
--   character-4-1-3
select max(grade),c_name from score group by c_name;
max(grade)	c_name
94	英语
90	计算机
95	中文
--   character-4-1-4
select sum(grade),c_name from score group by c_name;
sum(grade)	c_name
266	英语
225	计算机
183	中文
--   character-4-1-5
select count(*)  from student group by department;
 
2
2
2
drop database  IF EXISTS  ob100x;
create database ob100x  character set gbk;
use ob100x;
--   character-4-1-6   GROUP_CONCAT
DROP TABLE IF EXISTS course;
CREATE TABLE course (
name varchar(255) CHARACTER SET utf16,
course_name varchar(255) CHARACTER SET gbk,
mes varchar(255) CHARACTER SET gbk
)charset=utf16;
INSERT INTO course VALUES ('李明', '阅读赏析','一号');
INSERT INTO course VALUES ('李明', '摄影','二号');
INSERT INTO course VALUES ('李明', '太极剑','三号');
INSERT INTO course VALUES ('司马光', '马克思主义基本原理','四号');
INSERT INTO course VALUES ('司马光', '摄影','五号');
INSERT INTO course VALUES ('叶问', '阅读赏析','六号');
INSERT INTO course VALUES ('叶问', '法语','七号');
select t.name as '姓名',GROUP_CONCAT(t.course_name )  as '课程' from course t  group by t.name ;
姓名	课程
叶问	阅读赏析,法语
李明	阅读赏析,太极剑,摄影
司马光	马克思主义基本原理,摄影
select t.name as '姓名',GROUP_CONCAT(t.course_name  order by t.course_name SEPARATOR '@')  as '课程' from course t  group by t.name;
姓名	课程
叶问	法语@阅读赏析
李明	摄影@太极剑@阅读赏析
司马光	马克思主义基本原理@摄影
drop table  IF EXISTS  student;
drop table  IF EXISTS  score;
DROP TABLE IF EXISTS course;
--   character-4-1-6   聚合函数和when  case联合使用
--  创建表  学生表
drop table  IF EXISTS  edu_student;
CREATE TABLE edu_student(stu_id VARCHAR (16) CHARACTER SET gbk NOT NULL COMMENT '学号',
stu_name VARCHAR (20) NOT NULL COMMENT '学生姓名',PRIMARY KEY (stu_id))charset=utf16;
--   课程表 
drop table  IF EXISTS  edu_courses;
CREATE TABLE edu_courses(course_no VARCHAR (20) CHARACTER SET gbk NOT NULL COMMENT '课程编号',
course_name VARCHAR (100) NOT NULL,PRIMARY KEY (course_no))COMMENT = '课程表' charset=gbk;
--   成绩表
drop table  IF EXISTS  edu_score;
CREATE TABLE edu_score(stu_id VARCHAR (16) NOT NULL COMMENT '学号',
course_no VARCHAR (20) CHARACTER SET utf16 NOT NULL COMMENT '课程编号',scores FLOAT NULL DEFAULT NULL COMMENT '得分',
PRIMARY KEY (stu_id, course_no))charset=utf16;
--   学生表数据
INSERT INTO edu_student (stu_id, stu_name)VALUES('1001', '盲僧'),('1002', '赵信'),('1003', '皇子'),('1004', '寒冰'),('1005', '蛮王'),('1006', '狐狸');
--   课程表数据 
INSERT INTO edu_courses (course_no, course_name)VALUES('C001', '大学语文'),('C002', '新视野英语'),('C003', '离散数学'),('C004', '概率论与数理统计'),('C005', '线性代数'),('C006', '高等数学');
--  成绩表数据
INSERT INTO edu_score (stu_id, course_no, scores)values
('1001', 'C001', 67),   ('1002', 'C001', 68),   ('1003', 'C001', 69),   ('1004', 'C001', 70),   ('1005', 'C001', 71),('1006', 'C001', 72),   
('1001', 'C002', 87),   ('1002', 'C002', 88),   ('1003', 'C002', 89),   ('1004', 'C002', 90),   ('1005', 'C002', 91),('1006', 'C002', 92),
('1001', 'C003', 83),   ('1002', 'C003', 84),   ('1003', 'C003', 85),   ('1004', 'C003', 86),   ('1005', 'C003', 87),('1006', 'C003', 88),
('1001', 'C004', 88),   ('1002', 'C004', 89),   ('1003', 'C004', 90),   ('1004', 'C004', 91),   ('1005', 'C004', 92),('1006', 'C004', 93),
('1001', 'C005', 77),   ('1002', 'C005', 78),   ('1003', 'C005', 79),   ('1004', 'C005', 91),   ('1005', 'C005', 92),('1006', 'C005', 93),
('1001', 'C006', 47),   ('1002', 'C006', 79),   ('1003', 'C006', 89),   ('1004', 'C006', 81),   ('1005', 'C006', 64),('1006', 'C006', 39);
select  *  from     edu_student st  LEFT JOIN edu_score sc ON st.stu_id = sc.stu_id
LEFT JOIN edu_courses co ON co.course_no = sc.course_no     ORDER by  '';
stu_id	stu_name	stu_id	course_no	scores	course_no	course_name
1001	盲僧	1001	C001	67	C001	大学语文
1001	盲僧	1001	C002	87	C002	新视野英语
1001	盲僧	1001	C003	83	C003	离散数学
1001	盲僧	1001	C004	88	C004	概率论与数理统计
1001	盲僧	1001	C005	77	C005	线性代数
1001	盲僧	1001	C006	47	C006	高等数学
1002	赵信	1002	C001	68	C001	大学语文
1002	赵信	1002	C002	88	C002	新视野英语
1002	赵信	1002	C003	84	C003	离散数学
1002	赵信	1002	C004	89	C004	概率论与数理统计
1002	赵信	1002	C005	78	C005	线性代数
1002	赵信	1002	C006	79	C006	高等数学
1003	皇子	1003	C001	69	C001	大学语文
1003	皇子	1003	C002	89	C002	新视野英语
1003	皇子	1003	C003	85	C003	离散数学
1003	皇子	1003	C004	90	C004	概率论与数理统计
1003	皇子	1003	C005	79	C005	线性代数
1003	皇子	1003	C006	89	C006	高等数学
1004	寒冰	1004	C001	70	C001	大学语文
1004	寒冰	1004	C002	90	C002	新视野英语
1004	寒冰	1004	C003	86	C003	离散数学
1004	寒冰	1004	C004	91	C004	概率论与数理统计
1004	寒冰	1004	C005	91	C005	线性代数
1004	寒冰	1004	C006	81	C006	高等数学
1005	蛮王	1005	C001	71	C001	大学语文
1005	蛮王	1005	C002	91	C002	新视野英语
1005	蛮王	1005	C003	87	C003	离散数学
1005	蛮王	1005	C004	92	C004	概率论与数理统计
1005	蛮王	1005	C005	92	C005	线性代数
1005	蛮王	1005	C006	64	C006	高等数学
1006	狐狸	1006	C001	72	C001	大学语文
1006	狐狸	1006	C002	92	C002	新视野英语
1006	狐狸	1006	C003	88	C003	离散数学
1006	狐狸	1006	C004	93	C004	概率论与数理统计
1006	狐狸	1006	C005	93	C005	线性代数
1006	狐狸	1006	C006	39	C006	高等数学
--   聚合函数 sum 配合 case when 的简单函数实现行转列
drop table  IF EXISTS  edu_student;
drop table  IF EXISTS  edu_courses;
drop table  IF EXISTS  edu_score;
--   character-4-2-1   case..when语句
SELECT CASE  5  WHEN 1 THEN 'one'WHEN 2 THEN 'two' ELSE 'more' END;
CASE  5  WHEN 1 THEN 'one'WHEN 2 THEN 'two' ELSE 'more' END
more
SELECT CASE 3   WHEN 1>0 THEN 'true' ELSE 'false' END;
CASE 3   WHEN 1>0 THEN 'true' ELSE 'false' END
false
SELECT CASE BINARY 'B' WHEN 'a' THEN 1 WHEN 'b' THEN 2 END;
CASE BINARY 'B' WHEN 'a' THEN 1 WHEN 'b' THEN 2 END
NULL
drop table  IF EXISTS  type_table;
create table type_table(NAME varchar(20));
insert into  type_table values('helloworld');
--  #枚举这个字段所有可能的值
--   搜索函数搜索函数可以写判断，并且搜索函数只会返回第一个符合条件的值，其他case被忽略,# when 表达式中可以使用 and 连接条件
drop table  IF EXISTS  type_table;
create table type_table(NAME varchar(20),age int);
insert into  type_table values('helloworld',20);
select  NAME '英雄', age '年龄',case
WHEN age < 18 then   '少年'
        WHEN age < 30 then   '青年'
        WHEN age >= 30
AND  age < 50 then     '中年'
        else   '老年'
        END '状态'  from  type_table;
英雄	年龄	状态
helloworld	20	青年
--   character-4-2-2   IF(expr1,expr2,expr3)
SELECT IF(1>2,2,3);
IF(1>2,2,3)
3
SELECT IF(1<2,'yes ','no');
IF(1<2,'yes ','no')
yes 
SELECT IF(STRCMP('test','test1'),'no','yes');
IF(STRCMP('test','test1'),'no','yes')
no
--   character-4-2-3    IFNULL:
SELECT IFNULL(NULL, "RUNOOB");
IFNULL(NULL, "RUNOOB")
RUNOOB
SELECT IFNULL("Hello", "RUNOOB");
IFNULL("Hello", "RUNOOB")
Hello
--   character-4-2-4 
select  NULLIF(1,NULL);
NULLIF(1,NULL)
1
select NULLIF(NULL,1);
NULLIF(NULL,1)
NULL
--   character-4-2-5 
select STRCMP('text', 'text2');
STRCMP('text', 'text2')
-1
select STRCMP('text2', 'text');
STRCMP('text2', 'text')
1
select STRCMP('text', 'text');
STRCMP('text', 'text')
0
--   character-4-3-1  加密函数
select  MD5('abcd');
MD5('abcd')
e2fc714c4727ee9395f324cd2e7f331f
--   character-4-3-2  加密函数
--   character-4-3-3
--   character-4-4-1  CHARSET(str)函数返回字符串str的字符集，一般情况这个字符集就是系统的默认字符集；COLLATION(str)函数返回字符串str的字符排列方式
select  CHARSET('hello');
CHARSET('hello')
utf8mb4
--   character-4-4-2
select   COLLATION('hello');
COLLATION('hello')
utf8mb4_general_ci
--  转换函数
-- character-4-5-1   隐式类型转换
SELECT 1+'1';
1+'1'
2
SELECT concat(2,'test');
concat(2,'test')
2test
-- character-4-5-2     显式类型转换:CAST(expr AS type)
SELECT cast('28.82abc' AS DECIMAL);
cast('28.82abc' AS DECIMAL)
29
Warnings:
Warning	1292	Truncated incorrect DECIMAL value: '28.82abc'
SELECT cast('28.82abc' AS DECIMAL(4));
cast('28.82abc' AS DECIMAL(4))
29
Warnings:
Warning	1292	Truncated incorrect DECIMAL value: '28.82abc'
SELECT cast('28.82abc' AS DECIMAL(1));
cast('28.82abc' AS DECIMAL(1))
9
Warnings:
Warning	1292	Truncated incorrect DECIMAL value: '28.82abc'
SELECT cast('28.82abc' AS DECIMAL(2,1));
cast('28.82abc' AS DECIMAL(2,1))
9.9
Warnings:
Warning	1292	Truncated incorrect DECIMAL value: '28.82abc'
SELECT cast('28.82abc' AS DECIMAL(2,2));
cast('28.82abc' AS DECIMAL(2,2))
0.99
Warnings:
Warning	1292	Truncated incorrect DECIMAL value: '28.82abc'
SELECT cast('28.82abc' AS UNSIGNED);
cast('28.82abc' AS UNSIGNED)
28
Warnings:
Warning	1292	Truncated incorrect INTEGER value: '28.82abc'
SELECT cast('2007-12-25' AS DATETIME);
cast('2007-12-25' AS DATETIME)
2007-12-25 00:00:00
SELECT cast('2007-12-25' AS DATE);
cast('2007-12-25' AS DATE)
2007-12-25
SELECT cast('20:20:20' AS TIME);
cast('20:20:20' AS TIME)
20:20:20
SELECT cast('25-12-2007' AS DATETIME);
cast('25-12-2007' AS DATETIME)
NULL
SELECT cast('2007-may-25' AS DATETIME);
cast('2007-may-25' AS DATETIME)
NULL
SELECT cast(123 AS CHAR);
cast(123 AS CHAR)
123
SELECT cast(123 AS BINARY);
cast(123 AS BINARY)
123
-- character-4-5-3           Convert函数
SELECT convert('abc' USING utf16);
convert('abc' USING utf16)
abc
SELECT convert('你好' USING gbk);
convert('你好' USING gbk)
你好
-- character-5-1-1-1-1  自连接：join ，inner join
-- 多表查询：
drop table  IF EXISTS  department;
create table department
(id int,
name varchar(20) CHARACTER SET  utf16 not null
)charset=gbk;
drop table  IF EXISTS  staff;
create table staff(
id int primary key auto_increment,
name varchar(20),
sex enum('male','female') CHARACTER SET gbk not null default 'male',
age int,
dep_id int
)charset=utf16;
--  #插入数据
insert into department values
(200,'挖矿小分队'),
(201,'人力资源'),
(202,'销售'),
(203,'运营');
insert into staff(name,sex,age,dep_id) values
('程咬金','male',38,200),
('露娜','female',26,201),
('李白','male',38,201),
('王昭君','female',28,202),
('典韦','male',118,200),
('小乔','female',16,204)
;
--  character-5-1-1-1-1  自连接：join ，inner join
select * from staff inner join department on staff.dep_id=department.id;
id	name	sex	age	dep_id	id	name
1	程咬金	male	38	200	200	挖矿小分队
2	露娜	female	26	201	201	人力资源
3	李白	male	38	201	201	人力资源
4	王昭君	female	28	202	202	销售
5	典韦	male	118	200	200	挖矿小分队
--   character-5-1-1-1-2   笛卡尔积
select * from staff,department;
id	name	sex	age	dep_id	id	name
1	程咬金	male	38	200	200	挖矿小分队
1	程咬金	male	38	200	201	人力资源
1	程咬金	male	38	200	202	销售
1	程咬金	male	38	200	203	运营
2	露娜	female	26	201	200	挖矿小分队
2	露娜	female	26	201	201	人力资源
2	露娜	female	26	201	202	销售
2	露娜	female	26	201	203	运营
3	李白	male	38	201	200	挖矿小分队
3	李白	male	38	201	201	人力资源
3	李白	male	38	201	202	销售
3	李白	male	38	201	203	运营
4	王昭君	female	28	202	200	挖矿小分队
4	王昭君	female	28	202	201	人力资源
4	王昭君	female	28	202	202	销售
4	王昭君	female	28	202	203	运营
5	典韦	male	118	200	200	挖矿小分队
5	典韦	male	118	200	201	人力资源
5	典韦	male	118	200	202	销售
5	典韦	male	118	200	203	运营
6	小乔	female	16	204	200	挖矿小分队
6	小乔	female	16	204	201	人力资源
6	小乔	female	16	204	202	销售
6	小乔	female	16	204	203	运营
--  character-5-1-1-1-3    左外连接：left join 
select * from staff left join department on staff.dep_id=department.id;
id	name	sex	age	dep_id	id	name
1	程咬金	male	38	200	200	挖矿小分队
2	露娜	female	26	201	201	人力资源
3	李白	male	38	201	201	人力资源
4	王昭君	female	28	202	202	销售
5	典韦	male	118	200	200	挖矿小分队
6	小乔	female	16	204	NULL	NULL
--  character-5-1-1-1-4 
select * from staff  left join department on staff.dep_id=department.id
union
select * from staff  right join department on staff.dep_id=department.id;
id	name	sex	age	dep_id	id	name
1	程咬金	male	38	200	200	挖矿小分队
2	露娜	female	26	201	201	人力资源
3	李白	male	38	201	201	人力资源
4	王昭君	female	28	202	202	销售
5	典韦	male	118	200	200	挖矿小分队
6	小乔	female	16	204	NULL	NULL
NULL	NULL	NULL	NULL	NULL	203	运营
--  character-5-1-1-1-5    右外连接
select * from staff right join department on  staff.dep_id=department.id;
id	name	sex	age	dep_id	id	name
1	程咬金	male	38	200	200	挖矿小分队
2	露娜	female	26	201	201	人力资源
3	李白	male	38	201	201	人力资源
4	王昭君	female	28	202	202	销售
5	典韦	male	118	200	200	挖矿小分队
NULL	NULL	NULL	NULL	NULL	203	运营
--  character-5-1-1-2-1   =、!=、<>、<、<=、>、>=
select * from   staff e  where   e.id=1;
id	name	sex	age	dep_id
1	程咬金	male	38	200
select * from   staff e  where   e.id!=1;
id	name	sex	age	dep_id
2	露娜	female	26	201
3	李白	male	38	201
4	王昭君	female	28	202
5	典韦	male	118	200
6	小乔	female	16	204
select * from   staff e  where   e.id<>1;
id	name	sex	age	dep_id
2	露娜	female	26	201
3	李白	male	38	201
4	王昭君	female	28	202
5	典韦	male	118	200
6	小乔	female	16	204
select * from   staff e  where   e.id<2;
id	name	sex	age	dep_id
1	程咬金	male	38	200
select * from   staff e  where   e.id<=2;
id	name	sex	age	dep_id
1	程咬金	male	38	200
2	露娜	female	26	201
select * from   staff e  where   e.id>1;
id	name	sex	age	dep_id
2	露娜	female	26	201
3	李白	male	38	201
4	王昭君	female	28	202
5	典韦	male	118	200
6	小乔	female	16	204
select * from   staff e  where   e.id>=1;
id	name	sex	age	dep_id
1	程咬金	male	38	200
2	露娜	female	26	201
3	李白	male	38	201
4	王昭君	female	28	202
5	典韦	male	118	200
6	小乔	female	16	204
select name,age from staff where age > (select avg(age) from staff);
name	age
典韦	118
--  character-5-1-1-2-2
select * from   staff e  where   e.id between 1  and  3;
id	name	sex	age	dep_id
1	程咬金	male	38	200
2	露娜	female	26	201
3	李白	male	38	201
--  character-5-1-1-2-3
select * from   staff e  where   e.id in(1,3);
id	name	sex	age	dep_id
1	程咬金	male	38	200
3	李白	male	38	201
select * from   staff e  where   e.id not in(1,3);
id	name	sex	age	dep_id
2	露娜	female	26	201
4	王昭君	female	28	202
5	典韦	male	118	200
6	小乔	female	16	204
select name from department where id not in (select distinct dep_id from staff);
name
运营
--  character-5-1-1-2-4
select * from   staff e  where   e.id!=1  and   e.id!=4;
id	name	sex	age	dep_id
2	露娜	female	26	201
3	李白	male	38	201
5	典韦	male	118	200
6	小乔	female	16	204
--  character-5-1-1-2-5-1-1  字段设置utf16  like语句有bug
--  character-5-1-1-2-5-1-2
--  character-5-1-1-2-5-2
--   character-5-1-1-3   group by[ having]     
select id,name from department where id in (select dep_id from staff group by dep_id having avg(age) > 28);
id	name
200	挖矿小分队
201	人力资源
--   character-5-1-1-4  排序   
select id,name from department where id in (select dep_id from staff group by dep_id having avg(age) > 28)  order by  id  desc;
id	name
201	人力资源
200	挖矿小分队
select id,name from department where id in (select dep_id from staff group by dep_id having avg(age) > 28)  order by  id  asc;
id	name
200	挖矿小分队
201	人力资源
--   character-5-1-1-5   子查询
select name from staff where dep_id =(select id from department where name = '销售');
name
王昭君
select name from staff where dep_id in (select id from department where name = '销售' or name = '人力资源');
name
露娜
李白
王昭君
--    带EXISTS关键字的子查询
select * from staff where exists (select id from department where id=200);
id	name	sex	age	dep_id
1	程咬金	male	38	200
2	露娜	female	26	201
3	李白	male	38	201
4	王昭君	female	28	202
5	典韦	male	118	200
6	小乔	female	16	204
select * from staff  where exists (select id from department where id=204);
id	name	sex	age	dep_id
--   character-5-1-1-6   组合查询
select * from staff  left join department on staff.dep_id=department.id
union 
select * from staff  right join department on staff.dep_id=department.id;
id	name	sex	age	dep_id	id	name
1	程咬金	male	38	200	200	挖矿小分队
2	露娜	female	26	201	201	人力资源
3	李白	male	38	201	201	人力资源
4	王昭君	female	28	202	202	销售
5	典韦	male	118	200	200	挖矿小分队
6	小乔	female	16	204	NULL	NULL
NULL	NULL	NULL	NULL	NULL	203	运营
select * from staff  left join department on staff.dep_id=department.id
union all
select * from staff  right join department on staff.dep_id=department.id;
id	name	sex	age	dep_id	id	name
1	程咬金	male	38	200	200	挖矿小分队
2	露娜	female	26	201	201	人力资源
3	李白	male	38	201	201	人力资源
4	王昭君	female	28	202	202	销售
5	典韦	male	118	200	200	挖矿小分队
6	小乔	female	16	204	NULL	NULL
1	程咬金	male	38	200	200	挖矿小分队
2	露娜	female	26	201	201	人力资源
3	李白	male	38	201	201	人力资源
4	王昭君	female	28	202	202	销售
5	典韦	male	118	200	200	挖矿小分队
NULL	NULL	NULL	NULL	NULL	203	运营
select t1.name,t1.age from staff t1  inner join  (select dep_id,avg(age) avg_age from staff group by dep_id) t2
on t1.dep_id = t2.dep_id  where t1.age > t2.avg_age;
name	age
李白	38
典韦	118
--   character-5-1-1-7-1  伪列
SELECT @rownum:=@rownum+1 AS rownum, staff.* FROM (SELECT @rownum:=0) r, staff;
rownum	id	name	sex	age	dep_id
1	1	程咬金	male	38	200
2	2	露娜	female	26	201
3	3	李白	male	38	201
4	4	王昭君	female	28	202
5	5	典韦	male	118	200
6	6	小乔	female	16	204
--    character-5-1-2-1-1   insert  into  
drop table  IF EXISTS  staff001;
--    character-5-1-2-1-2    view
drop view  IF EXISTS  staff002;
CREATE VIEW staff002 as  select   * from staff e   where  1=2;
--  insert into   staff002  select   * from staff e   where   e.id=1;
select * from staff002;
id	name	sex	age	dep_id
--   character-5-1-2-2   insert into values           
--    character-5-1-3-1   单列
update  staff  e  set e.name='程咬金001'  where  e.id=1;
select * from staff;
id	name	sex	age	dep_id
1	程咬金001	male	38	200
2	露娜	female	26	201
3	李白	male	38	201
4	王昭君	female	28	202
5	典韦	male	118	200
6	小乔	female	16	204
--    character-5-1-3-2   多列
update  staff  e  set e.name='吕布'  where  e.id>4;
select * from staff;
id	name	sex	age	dep_id
1	程咬金001	male	38	200
2	露娜	female	26	201
3	李白	male	38	201
4	王昭君	female	28	202
5	吕布	male	118	200
6	吕布	female	16	204
--    character-5-1-3-3   全表
update  staff  e  set e.name='吕布';
select * from staff;
id	name	sex	age	dep_id
1	吕布	male	38	200
2	吕布	female	26	201
3	吕布	male	38	201
4	吕布	female	28	202
5	吕布	male	118	200
6	吕布	female	16	204
--    character-5-1-3-4    子查询
update  staff  e  set e.name='刘备'  where  e.dep_id in(select id from  department t where  t.id>201);
select * from staff;
id	name	sex	age	dep_id
1	吕布	male	38	200
2	吕布	female	26	201
3	吕布	male	38	201
4	刘备	female	28	202
5	吕布	male	118	200
6	吕布	female	16	204
--   character-5-1-4-1
delete  from   staff   where   id=1000;
select * from staff;
id	name	sex	age	dep_id
1	吕布	male	38	200
2	吕布	female	26	201
3	吕布	male	38	201
4	刘备	female	28	202
5	吕布	male	118	200
6	吕布	female	16	204
--   character-5-1-4-2
delete  from   staff   where   id=1;
select * from staff;
id	name	sex	age	dep_id
2	吕布	female	26	201
3	吕布	male	38	201
4	刘备	female	28	202
5	吕布	male	118	200
6	吕布	female	16	204
--   character-5-1-4-3
delete  from   staff   where   id>4;
select * from staff;
id	name	sex	age	dep_id
2	吕布	female	26	201
3	吕布	male	38	201
4	刘备	female	28	202
--   character-5-1-4-4
delete  from   staff;
select * from staff;
id	name	sex	age	dep_id
set session ob_query_timeout = 400000000;
--    procedure     存储过程    
--   基础表          charset=utf16;   CHARACTER SET gbk 
drop database  IF EXISTS  ob100x;
create database ob100x  character set utf16;
use ob100x;
drop table if exists salgrade;
CREATE TABLE salgrade(  
grade int, 
loosal int,  
hisal int
) DEFAULT CHARSET=utf16;
drop table if exists DEPT;
create table DEPT
(
DEPTNO int(2) not null,
DNAME varchar(14) CHARACTER SET gbk,
LOC varchar(13) CHARACTER SET utf16,constraint PK_DEPT primary key (DEPTNO)
)CHARSET=utf16;
drop table if exists EMP;
create table EMP
(
EMPNO int(4) not null,
ENAME varchar(10)  CHARACTER SET gbk,
JOB varchar(100) CHARACTER SET utf16,
MGR int(4),
HIREDATE date,
SAL int(7 ),
COMM int(7 ),
DEPTNO int(2),constraint PK_EMP primary key (EMPNO),constraint FK_DEPTNO foreign key (DEPTNO)  references DEPT (DEPTNO)
)charset=gbk;
alter table DEPT  add constraint PK_DEPT primary key (DEPTNO);ob不支持这类语句
alter table EMP  add constraint PK_EMP primary key (EMPNO);
alter table EMP  add constraint FK_DEPTNO foreign key (DEPTNO)  references DEPT (DEPTNO);
insert into DEPT (DEPTNO, DNAME, LOC)
values (10, 'ACCOUNTING', 'NEW YORK');
insert into DEPT (DEPTNO, DNAME, LOC)
values (20, 'RESEARCH', 'DALLAS');
insert into DEPT (DEPTNO, DNAME, LOC)
values (30, 'SALES', 'CHICAGO');
insert into DEPT (DEPTNO, DNAME, LOC)
values (40, 'OPERATIONS', 'BOSTON');
insert into EMP (EMPNO, ENAME, JOB, MGR, HIREDATE, SAL, COMM, DEPTNO)
values (7369, 'SMITH', 'CLERK', 7902, str_to_date('17-12-1980', '%d-%m-%Y'), 800, null, 20);
insert into EMP (EMPNO, ENAME, JOB, MGR, HIREDATE, SAL, COMM, DEPTNO)
values (7499, 'ALLEN', 'SALESMAN', 7698, str_to_date('20-02-1981', '%d-%m-%Y'), 1600, 300, 30);
insert into EMP (EMPNO, ENAME, JOB, MGR, HIREDATE, SAL, COMM, DEPTNO)
values (7521, 'WARD', 'SALESMAN', 7698, str_to_date('22-02-1981', '%d-%m-%Y'), 1250, 500, 30);
insert into EMP (EMPNO, ENAME, JOB, MGR, HIREDATE, SAL, COMM, DEPTNO)
values (7566, 'JONES', 'MANAGER', 7839, str_to_date('02-04-1981', '%d-%m-%Y'), 2975, null, 20);
insert into EMP (EMPNO, ENAME, JOB, MGR, HIREDATE, SAL, COMM, DEPTNO)
values (7654, 'MARTIN', 'SALESMAN', 7698, str_to_date('28-09-1981', '%d-%m-%Y'), 1250, 1400, 30);
insert into EMP (EMPNO, ENAME, JOB, MGR, HIREDATE, SAL, COMM, DEPTNO)
values (7698, 'BLAKE', 'MANAGER', 7839, str_to_date('01-05-1981', '%d-%m-%Y'), 2850, null, 30);
insert into EMP (EMPNO, ENAME, JOB, MGR, HIREDATE, SAL, COMM, DEPTNO)
values (7782, 'CLARK', 'MANAGER', 7839, str_to_date('09-06-1981', '%d-%m-%Y'), 2450, null, 10);
insert into EMP (EMPNO, ENAME, JOB, MGR, HIREDATE, SAL, COMM, DEPTNO)
values (7788, 'SCOTT', 'ANALYST', 7566, str_to_date('19-04-1987', '%d-%m-%Y'), 3000, null, 20);
insert into EMP (EMPNO, ENAME, JOB, MGR, HIREDATE, SAL, COMM, DEPTNO)
values (7839, 'KING', 'PRESIDENT', null, str_to_date('17-11-1981', '%d-%m-%Y'), 5000, null, 10);
insert into EMP (EMPNO, ENAME, JOB, MGR, HIREDATE, SAL, COMM, DEPTNO)
values (7844, 'TURNER', 'SALESMAN', 7698, str_to_date('08-09-1981', '%d-%m-%Y'), 1500, 0, 30);
insert into EMP (EMPNO, ENAME, JOB, MGR, HIREDATE, SAL, COMM, DEPTNO)
values (7876, 'ADAMS', 'CLERK', 7788, str_to_date('23-05-1987', '%d-%m-%Y'), 1100, null, 20);
insert into EMP (EMPNO, ENAME, JOB, MGR, HIREDATE, SAL, COMM, DEPTNO)
values (7900, 'JAMES', 'CLERK', 7698, str_to_date('03-12-1981', '%d-%m-%Y'), 950, null, 30);
insert into EMP (EMPNO, ENAME, JOB, MGR, HIREDATE, SAL, COMM, DEPTNO)
values (7902, 'FORD', 'ANALYST', 7566, str_to_date('03-12-1981', '%d-%m-%Y'), 3000, null, 20);
insert into EMP (EMPNO, ENAME, JOB, MGR, HIREDATE, SAL, COMM, DEPTNO)
values (7934, 'MILLER', 'CLERK', 7782, str_to_date('23-01-1982', '%d-%m-%Y'), 1300, null, 10);
-- character-5-2-1-1   A:无参数的存储过程
drop procedure if exists myproc1;
create procedure myproc1()
begin
INSERT INTO SALGRADE VALUES (1,700,1200); 
INSERT INTO SALGRADE VALUES (2,1201,1400); 
INSERT INTO SALGRADE VALUES (3,1401,2000); 
INSERT INTO SALGRADE VALUES (4,2001,3000); 
INSERT INTO SALGRADE VALUES (5,3001,9999);
SELECT ename,SUBSTR(hiredate FROM 1 FOR 7) FROM emp ORDER BY SUBSTR(hiredate FROM 6 FOR 2),SUBSTRING(hiredate FROM 1 FOR 4);
end //
call myproc1();
ename	SUBSTR(hiredate FROM 1 FOR 7)
MILLER	1982-01
ALLEN	1981-02
WARD	1981-02
JONES	1981-04
SCOTT	1987-04
BLAKE	1981-05
ADAMS	1987-05
CLARK	1981-06
MARTIN	1981-09
TURNER	1981-09
KING	1981-11
SMITH	1980-12
JAMES	1981-12
FORD	1981-12
select  *  from   SALGRADE;
grade	loosal	hisal
1	700	1200
2	1201	1400
3	1401	2000
4	2001	3000
5	3001	9999
--  character-5-2-1-2  B:只有一个 in 参数的存储过程
drop procedure if exists myproc2;
create procedure myproc2(in userId int)
begin
SELECT * FROM emp
WHERE empno IN(SELECT empno FROM emp WHERE deptno = userId);
end//
set @dum =10;
call myproc2(@dum);
EMPNO	ENAME	JOB	MGR	HIREDATE	SAL	COMM	DEPTNO
7782	CLARK	MANAGER	7839	1981-06-09	2450	NULL	10
7839	KING	PRESIDENT	NULL	1981-11-17	5000	NULL	10
7934	MILLER	CLERK	7782	1982-01-23	1300	NULL	10
SELECT * FROM emp   WHERE empno IN(SELECT empno FROM emp WHERE deptno = @dum);
EMPNO	ENAME	JOB	MGR	HIREDATE	SAL	COMM	DEPTNO
7782	CLARK	MANAGER	7839	1981-06-09	2450	NULL	10
7839	KING	PRESIDENT	NULL	1981-11-17	5000	NULL	10
7934	MILLER	CLERK	7782	1982-01-23	1300	NULL	10
--   character-5-2-1-3     :包含 in 参数和 out 参数的存储过程,只能将一行的查询到的用户名赋值给username 
drop procedure if exists myproc3;
create procedure myproc3(in userId int, out username varchar(20))
begin
set username= userId;	
#SELECT d.dname into  username FROM dept d  where  d.deptno in (SELECT a.deptno FROM (SELECT e.deptno FROM emp e,salgrade s  WHERE (e.sal BETWEEN s.loosal AND s.hisal)GROUP BY e.deptno ORDER BY avg(s.grade)) a) LIMIT userId;
SELECT d.dname  FROM dept d where  d.DEPTNO<> username;		
#select  username;
end//
--  调用时，传入查询的userid 和 全局变量 @username
call myproc3(10,@username);
dname
RESEARCH
SALES
OPERATIONS
--   character-5-2-1-4   D:包含 inout 参数的存储过程
drop procedure if exists myproc4;
create procedure myproc4(inout a int)
begin
SELECT d.* FROM dept d 
WHERE d. deptno NOT IN(SELECT deptno FROM emp WHERE sal < a GROUP BY deptno);
end//
--  用户变量 （全局的变量）作用域： 用户变量: 在当前连接（即当前会话）中都有效
set @num =1000;
call  myproc4(@num);
DEPTNO	DNAME	LOC
10	ACCOUNTING	NEW YORK
40	OPERATIONS	BOSTON
--   character-5-2-1-5  E:存储过程循环,in p_number int, #要循环的次数,in p_startid int #循环的起始值
drop procedure if exists myproc5;
create  procedure myproc5(
in p_number int, 
in p_startid int
)
begin  
declare v_val int;  
set v_val=p_startid;
loop_label:  loop   
set v_val=v_val+1; 
insert into EMP (EMPNO, ENAME, JOB, MGR, HIREDATE, SAL, COMM, DEPTNO)
values (v_val, concat('MARTIN',cast(v_val as char)), concat('SAMAN',cast(v_val as char)), 1698+v_val,         str_to_date('28-09-1981', '%d-%m-%Y'), 1250+v_val, 1400+v_val, 30);
if(v_val>p_number)then
leave  loop_label;  
end if;
end loop; 
select  *   from   emp  e  where   e.EMPNO<1020;
delete  from   emp   where   EMPNO<5000;
select  *   from   emp  e;
end//
call myproc5(4000,1000);
EMPNO	ENAME	JOB	MGR	HIREDATE	SAL	COMM	DEPTNO
EMPNO	ENAME	JOB	MGR	HIREDATE	SAL	COMM	DEPTNO
1001	MARTIN1001	SAMAN1001	2699	1981-09-28	2251	2401	30
1002	MARTIN1002	SAMAN1002	2700	1981-09-28	2252	2402	30
1003	MARTIN1003	SAMAN1003	2701	1981-09-28	2253	2403	30
1004	MARTIN1004	SAMAN1004	2702	1981-09-28	2254	2404	30
1005	MARTIN1005	SAMAN1005	2703	1981-09-28	2255	2405	30
1006	MARTIN1006	SAMAN1006	2704	1981-09-28	2256	2406	30
1007	MARTIN1007	SAMAN1007	2705	1981-09-28	2257	2407	30
1008	MARTIN1008	SAMAN1008	2706	1981-09-28	2258	2408	30
1009	MARTIN1009	SAMAN1009	2707	1981-09-28	2259	2409	30
1010	MARTIN1010	SAMAN1010	2708	1981-09-28	2260	2410	30
1011	MARTIN1011	SAMAN1011	2709	1981-09-28	2261	2411	30
1012	MARTIN1012	SAMAN1012	2710	1981-09-28	2262	2412	30
1013	MARTIN1013	SAMAN1013	2711	1981-09-28	2263	2413	30
1014	MARTIN1014	SAMAN1014	2712	1981-09-28	2264	2414	30
1015	MARTIN1015	SAMAN1015	2713	1981-09-28	2265	2415	30
1016	MARTIN1016	SAMAN1016	2714	1981-09-28	2266	2416	30
1017	MARTIN1017	SAMAN1017	2715	1981-09-28	2267	2417	30
1018	MARTIN1018	SAMAN1018	2716	1981-09-28	2268	2418	30
1019	MARTIN1019	SAMAN1019	2717	1981-09-28	2269	2419	30
7369	SMITH	CLERK	7902	1980-12-17	800	NULL	20
7499	ALLEN	SALESMAN	7698	1981-02-20	1600	300	30
7521	WARD	SALESMAN	7698	1981-02-22	1250	500	30
7566	JONES	MANAGER	7839	1981-04-02	2975	NULL	20
7654	MARTIN	SALESMAN	7698	1981-09-28	1250	1400	30
7698	BLAKE	MANAGER	7839	1981-05-01	2850	NULL	30
7782	CLARK	MANAGER	7839	1981-06-09	2450	NULL	10
7788	SCOTT	ANALYST	7566	1987-04-19	3000	NULL	20
7839	KING	PRESIDENT	NULL	1981-11-17	5000	NULL	10
7844	TURNER	SALESMAN	7698	1981-09-08	1500	0	30
7876	ADAMS	CLERK	7788	1987-05-23	1100	NULL	20
7900	JAMES	CLERK	7698	1981-12-03	950	NULL	30
7902	FORD	ANALYST	7566	1981-12-03	3000	NULL	20
7934	MILLER	CLERK	7782	1982-01-23	1300	NULL	10
--   character-5-2-1-6  存储过程结果作为参数传递
drop function  IF EXISTS salemp001;
CREATE FUNCTION salemp001(saller001 int) RETURNS DOUBLE
BEGIN
DECLARE ag DOUBLE DEFAULT 0;#定义局部变量并初始化
SELECT  AVG(SAL) INTO ag #为局部变量赋值
FROM emp e INNER JOIN dept d ON e.DEPTNO=d.DEPTNO where  e.sal >saller001 GROUP BY d.DEPTNO having d.DEPTNO>20;
RETURN ag;
end//
SELECT salemp001(100);
salemp001(100)
1566.666666666
drop function  IF EXISTS salemp002;
CREATE FUNCTION salemp002(saller002 DOUBLE) RETURNS DOUBLE
BEGIN
DECLARE ag DOUBLE DEFAULT 0;#定义局部变量并初始化
SELECT  AVG(SAL) INTO ag #为局部变量赋值
FROM emp e INNER JOIN dept d ON e.DEPTNO=d.DEPTNO where  e.sal >saller002 GROUP BY d.DEPTNO having d.DEPTNO>20;
RETURN ag;
end//
SELECT salemp002(salemp001(100));
salemp002(salemp001(100))
2225
drop procedure if exists demo007;
create procedure demo007(in nummax int)
BEGIN
DECLARE i int DEFAULT 300;
declare a char(255);
WHILE i < nummax-900 DO
set a=concat("测试机构helloworld中國國民黨反動派",cast(i as char));
INSERT INTO emp VALUES(i,'MILLER',a,7782,'1950-09-1',1300,NULL,10);
set i:=i+1;
END WHILE;
END
//
call demo007(salemp002(salemp001(100))-1000);
select   *  from   emp;
EMPNO	ENAME	JOB	MGR	HIREDATE	SAL	COMM	DEPTNO
300	MILLER	测试机构helloworld中國國民黨反動派300	7782	1950-09-01	1300	NULL	10
301	MILLER	测试机构helloworld中國國民黨反動派301	7782	1950-09-01	1300	NULL	10
302	MILLER	测试机构helloworld中國國民黨反動派302	7782	1950-09-01	1300	NULL	10
303	MILLER	测试机构helloworld中國國民黨反動派303	7782	1950-09-01	1300	NULL	10
304	MILLER	测试机构helloworld中國國民黨反動派304	7782	1950-09-01	1300	NULL	10
305	MILLER	测试机构helloworld中國國民黨反動派305	7782	1950-09-01	1300	NULL	10
306	MILLER	测试机构helloworld中國國民黨反動派306	7782	1950-09-01	1300	NULL	10
307	MILLER	测试机构helloworld中國國民黨反動派307	7782	1950-09-01	1300	NULL	10
308	MILLER	测试机构helloworld中國國民黨反動派308	7782	1950-09-01	1300	NULL	10
309	MILLER	测试机构helloworld中國國民黨反動派309	7782	1950-09-01	1300	NULL	10
310	MILLER	测试机构helloworld中國國民黨反動派310	7782	1950-09-01	1300	NULL	10
311	MILLER	测试机构helloworld中國國民黨反動派311	7782	1950-09-01	1300	NULL	10
312	MILLER	测试机构helloworld中國國民黨反動派312	7782	1950-09-01	1300	NULL	10
313	MILLER	测试机构helloworld中國國民黨反動派313	7782	1950-09-01	1300	NULL	10
314	MILLER	测试机构helloworld中國國民黨反動派314	7782	1950-09-01	1300	NULL	10
315	MILLER	测试机构helloworld中國國民黨反動派315	7782	1950-09-01	1300	NULL	10
316	MILLER	测试机构helloworld中國國民黨反動派316	7782	1950-09-01	1300	NULL	10
317	MILLER	测试机构helloworld中國國民黨反動派317	7782	1950-09-01	1300	NULL	10
318	MILLER	测试机构helloworld中國國民黨反動派318	7782	1950-09-01	1300	NULL	10
319	MILLER	测试机构helloworld中國國民黨反動派319	7782	1950-09-01	1300	NULL	10
320	MILLER	测试机构helloworld中國國民黨反動派320	7782	1950-09-01	1300	NULL	10
321	MILLER	测试机构helloworld中國國民黨反動派321	7782	1950-09-01	1300	NULL	10
322	MILLER	测试机构helloworld中國國民黨反動派322	7782	1950-09-01	1300	NULL	10
323	MILLER	测试机构helloworld中國國民黨反動派323	7782	1950-09-01	1300	NULL	10
324	MILLER	测试机构helloworld中國國民黨反動派324	7782	1950-09-01	1300	NULL	10
7369	SMITH	CLERK	7902	1980-12-17	800	NULL	20
7499	ALLEN	SALESMAN	7698	1981-02-20	1600	300	30
7521	WARD	SALESMAN	7698	1981-02-22	1250	500	30
7566	JONES	MANAGER	7839	1981-04-02	2975	NULL	20
7654	MARTIN	SALESMAN	7698	1981-09-28	1250	1400	30
7698	BLAKE	MANAGER	7839	1981-05-01	2850	NULL	30
7782	CLARK	MANAGER	7839	1981-06-09	2450	NULL	10
7788	SCOTT	ANALYST	7566	1987-04-19	3000	NULL	20
7839	KING	PRESIDENT	NULL	1981-11-17	5000	NULL	10
7844	TURNER	SALESMAN	7698	1981-09-08	1500	0	30
7876	ADAMS	CLERK	7788	1987-05-23	1100	NULL	20
7900	JAMES	CLERK	7698	1981-12-03	950	NULL	30
7902	FORD	ANALYST	7566	1981-12-03	3000	NULL	20
7934	MILLER	CLERK	7782	1982-01-23	1300	NULL	10
drop table  IF EXISTS  store;
CREATE TABLE IF NOT EXISTS store(
id    int(11) NOT NULL AUTO_INCREMENT,
name  varchar(20) NOT NULL,
count int(11) NOT NULL DEFAULT '1',PRIMARY KEY (id)
)DEFAULT CHARSET=gbk AUTO_INCREMENT=9;
INSERT INTO store(id, name, count) VALUES(1, 'android', 15),(2, 'iphone', 14),(3, 'iphone', 20),(4, 'android', 5),(5, 'android', 13),(6, 'iphone', 13),(7, 'iphonee', 15),(8, 'iphone9', 19);
select   *  from  store;
id	name	count
1	android	15
2	iphone	14
3	iphone	20
4	android	5
5	android	13
6	iphone	13
7	iphonee	15
8	iphone9	19
drop procedure if exists StatisticStore//
CREATE PROCEDURE StatisticStore()
begin	
# 创建接收游标数据的变量
declare c int;         #获取单条纪录的数量
declare n varchar(20); #获取名称
# 创建总数变量
declare total int default 0;
# 创建结束标志变量
declare done int default false;
# 创建游标 获取name和count的集合
declare cur cursor for select name,count from store where name = 'iphone';
# 指定游标循环结束时的返回值
declare continue HANDLER for not found set done = true;
# set赋值全局变量时 写在declare的下面。
set @total002 := 100;
# 设置初始值：set后的变量要么是前面已经定义过的局部变量，要么set后的变量前面加@定义成系统变量
set total = 0;#这里是否设置初始值都可以，上面定义变量时已经设置了默认值
# 打开游标
open cur;
# 开始循环游标里的数据
read_loop:loop
# 根据游标当前指向的一条数据 插入到上面申明的局部变量中
fetch cur into n,c;#右边循环结束时会给done赋值
# 判断游标的循环是否结束
if done then
leave read_loop;	# 跳出游标循环
end if;
# 获取一条数据时，将count值进行累加操作，这里可以做任意你想做的操作，
set @totaldone := total + c;# 每次循环都设置一个新变量@totaldone，
set total := total + c;     #total为历次循环的综合
# 有loop 就一定要有end loop
end loop;
# 关闭游标
close cur; 
# 输出结果
select total;
END//
call StatisticStore();
total
47
select @totaldone;
@totaldone
47
--  函数
-- character-5-2-2-1  A：无参数的自定义函数,赋值值from前只能有一个字段
drop function if exists myfun1;
create function myfun1() returns int
begin
declare sum001 int default 0;         		
declare sum002 int; 
SELECT MAX(sal) into sum001  FROM emp GROUP BY deptno HAVING MAX(sal) <= 3000 AND MIN(sal) >=900;
SELECT MIN(sal) into sum002  FROM emp GROUP BY deptno HAVING MAX(sal) <= 3000 AND MIN(sal) >=900;
return sum001+sum002;
end//
select  myfun1();
myfun1()
3800
-- character-5-2-2-2 B：自定义函数，sum003(只能赋一个值，不能一列值)：定义系统会话变量,函数运行后，即使删除函数，系统变量也还是存在的。
drop function if exists myfun2;
create function myfun2(userId int) returns varchar(20)
begin
set @sum003='';
select max(sal) into @sum003 from emp e where e.DEPTNO in(select t.DEPTNO   from  dept t);
return @sum003;
end//
select  myfun2(1);
myfun2(1)
5000
drop function if exists myfun2;
select   @sum003  from   dual;
@sum003
5000
drop table if exists t_user;
create table t_user (
id int not null auto_increment,
name varchar(30005) not null,primary key (id)
)auto_increment=1 default charset=gbk;
--character-5-2-2-3  C：自定义函数使用循环
drop function if exists myfun3;
create function myfun3(userId int) returns varchar(20)
begin
set @sum004='hello world';
set @tcount=userId;
WHILE userId < 3000 DO
SET userId = userId+1;
insert into t_user values(null, 'Jas'),(null, 'Joy');
select count(*) into @sum004 from t_user;
END WHILE;
return @sum004;
end//
select  myfun3(1);
myfun3(1)
5998
select   @sum004  from   dual;
@sum004
5998
select count(*) from t_user;
count(*)
5998
drop table if exists t_user;
create table t_user (
id int not null auto_increment,
name varchar(30005) not null,primary key (id)
)engine=innodb auto_increment=1 default charset=gbk;
truncate table t_user;
drop function if exists myfun4;
create function myfun4(userId int) returns varchar(20)
begin
set @sum005='hello world';
set @cccount=userId;
set @str='';
outer_label: begin
WHILE @cccount < 309 DO
SET @cccount = @cccount+1;
insert into t_user values(null, concat('Jas',cast(@str as char)));
SET @str = concat(@str,concat('Jas',cast(@cccount as char)));
select count(*) into @sum005 from t_user;
if LENGTH(@str)>300   then
leave  outer_label; 
end if;
END WHILE;
end outer_label;
-- echo --  select   *  from   t_user where id =1;#函数内部不能写查询语句，但是可以通过select进行赋值。
-- echo --  set @sum005=99999;#定义的系统变量可以不定义类型，接收多种类型的数据。
-- echo --  return @sum005;
return  LENGTH(@str); 
end//
select  myfun4(1);
myfun4(1)
302
select   @sum005  from   dual;
@sum005
62
select count(*) from t_user;
count(*)
62
select LENGTH(name)  from t_user e  where  e.id=(select count(*) from t_user);
LENGTH(name)
300
--   character-5-2-3  触发器
DROP TABLE IF EXISTS user;
CREATE TABLE user(
id bigint(20) NOT NULL AUTO_INCREMENT,
account varchar(255)character set utf16  DEFAULT null ,
name varchar(255)character set gbk  DEFAULT NULL,
address varchar(255) character set gbk DEFAULT NULL,
PRIMARY KEY(id)
)DEFAULT CHARSET=gbk;
DROP TABLE IF EXISTS user_history;
CREATE TABLE user_history(
id bigint(20) NOT NULL AUTO_INCREMENT,
user_id bigint(20) NOT NULL,
operatetype varchar(200)character set gbk NOT NULL,
operatetime datetime NOT NULL,
PRIMARY KEY(id)
)DEFAULT CHARSET=utf16;
--    character-6-1  算数运算符
select 1+2;
1+2
3
select 1-2;
1-2
-1
select 2*3;
2*3
6
select 2/3;
2/3
0.6667
select 10 DIV 4;
10 DIV 4
2
select 10 MOD 4;
10 MOD 4
2
--    character-6-2      比较运算符
select 2=3;
2=3
0
select NULL = NULL;
NULL = NULL
NULL
select 2<>3;
2<>3
1
select 2<=>3;
2<=>3
0
select null<=>null;
null<=>null
1
select 2<3;
2<3
1
select 2<=3;
2<=3
1
select 2>3;
2>3
0
select 2>=3;
2>=3
0
select 5 between 1 and 10;
5 between 1 and 10
1
select 5 in (1,2,3,4,5);
5 in (1,2,3,4,5)
1
select 5 not in (1,2,3,4,5);
5 not in (1,2,3,4,5)
0
select null is NULL;
null is NULL
1
select 'a' is NULL;
'a' is NULL
0
select null IS NOT NULL;
null IS NOT NULL
0
select 'a' IS NOT NULL;
'a' IS NOT NULL
1
select '12345' like '12%';
'12345' like '12%'
1
select '12345' like '12_';
'12345' like '12_'
0
select 'beijing' REGEXP 'jing';
'beijing' REGEXP 'jing'
1
--    character-6-3     逻辑运算符
select 2 and 0;
2 and 0
0
select 2 and 1;
2 and 1
1
select 2 or 0;
2 or 0
1
select 2 or 1;
2 or 1
1
select 0 or 0;
0 or 0
0
select 1 || 0;
1 || 0
1
select not 1;
not 1
0
select !0;
!0
1
select 1 xor 1;
1 xor 1
0
select 0 xor 0;
0 xor 0
0
select 1 xor 0;
1 xor 0
1
select null or 1;
null or 1
1
select 1 ^ 0;
1 ^ 0
1
--    character-6-4     位运算符
select 3&5;
3&5
1
select 3|5;
3|5
7
select 3^5;
3^5
6
select ~18446744073709551612;
~18446744073709551612
3
select 3>>1;
3>>1
1
select 3<<1;
3<<1
6
--    数据类型
--  character-7-1   int类型
drop database  IF EXISTS  ob100x;
create database ob100x  character set utf16;
use ob100x;
drop table   IF exists   type_table;
create table type_table(a  int) DEFAULT CHARACTER SET = gbk;
insert  into  type_table  values(1000);
select   *  from  type_table;
a
1000
select collation(a) from type_table;
collation(a)
binary
--  character-7-2   smallint类型
drop database  IF EXISTS  ob100x;
create database ob100x  character set utf16;
use ob100x;
drop table   IF exists   type_table;
create table type_table(b  smallint) DEFAULT CHARACTER SET = utf16;
insert  into  type_table  values(1000);
select   *  from  type_table;
b
1000
select collation(b) from type_table;
collation(b)
binary
--  character-7-3     mediumint  类型
drop database  IF EXISTS  ob100x;
create database ob100x  character set utf16;
use ob100x;
drop table   IF exists   type_table;
create table type_table(c  mediumint) DEFAULT CHARACTER SET = gbk;
insert  into  type_table  values(1000);
select   *  from  type_table;
c
1000
select collation(c) from type_table;
collation(c)
binary
--  character-7-4   tinyint  类型 
drop database  IF EXISTS  ob100x;
create database ob100x  character set utf16;
use ob100x;
drop table   IF exists   type_table;
create table type_table(d  tinyint) DEFAULT CHARACTER SET = gbk;
insert  into  type_table  values(100);
select   *  from  type_table;
d
100
select collation(d) from type_table;
collation(d)
binary
--  character-7-5    bigint  类型 
drop database  IF EXISTS  ob100x;
create database ob100x  character set utf16;
use ob100x;
drop table   IF exists   type_table;
create table type_table(e  bigint) DEFAULT CHARACTER SET = gbk;
insert  into  type_table  values(1000);
select   *  from  type_table;
e
1000
select collation(e) from type_table;
collation(e)
binary
--  character-7-6    float  类型 
drop database  IF EXISTS  ob100x;
create database ob100x  character set utf16;
use ob100x;
drop table   IF exists   type_table;
create table type_table(f  float(6,3)) DEFAULT CHARACTER SET = gbk;
insert  into  type_table  values(100.465);
select   *  from  type_table;
f
100.465
select collation(f) from type_table;
collation(f)
binary
--  character-7-7       double  类型 
drop database  IF EXISTS  ob100x;
create database ob100x  character set utf16;
use ob100x;
drop table   IF exists   type_table;
create table type_table(g  double(6,3)) DEFAULT CHARACTER SET = utf16;
insert  into  type_table  values(100.000);
select   *  from  type_table;
g
100.000
select collation(g) from type_table;
collation(g)
binary
--  定点数
--  character-7-8     decimal  类型 
drop database  IF EXISTS  ob100x;
create database ob100x  character set utf16;
use ob100x;
drop table   IF exists   type_table;
create table type_table(h  decimal(6,3)) DEFAULT CHARACTER SET = utf16;
insert  into  type_table  values(100.000222);
select   *  from  type_table;
h
100.000
select collation(h) from type_table;
collation(h)
binary
--  character-7-9   #   char  类型 
数据库设置utf-8
drop database  IF EXISTS  ob100x;
create database ob100x  character set utf16;
use ob100x;
drop table   IF exists   type_table;
create table type_table(i  char(10));
insert  into  type_table  values('100.000222');
select   *  from  type_table;
i
100.000222
select collation(i) from type_table;
collation(i)
utf16_general_ci
数据库设置gbk
drop database  IF EXISTS  ob100x;
create database ob100x  character set gbk;
use ob100x;
drop table   IF exists   type_table;
create table type_table(i  char(10));
insert  into  type_table  values('100.000222');
select   *  from  type_table;
i
100.000222
select collation(i) from type_table;
collation(i)
gbk_chinese_ci
数据库设置gbk  表设置utf16
drop database  IF EXISTS  ob100x;
create database ob100x  character set gbk;
use ob100x;
drop table   IF exists   type_table;
create table type_table(i  char(10))CHARSET=utf16;
insert  into  type_table  values('100.000222');
select   *  from  type_table;
i
100.000222
select collation(i) from type_table;
collation(i)
utf16_general_ci
数据库设置gbk  表设置gbk
drop database  IF EXISTS  ob100x;
create database ob100x  character set gbk;
use ob100x;
drop table   IF exists   type_table;
create table type_table(i  char(10))CHARSET=gbk;
insert  into  type_table  values('100.000222');
select   *  from  type_table;
i
100.000222
select collation(i) from type_table;
collation(i)
gbk_chinese_ci
数据库设置gbk  表设置gbk   字段设置utf16
drop database  IF EXISTS  ob100x;
create database ob100x  character set gbk;
use ob100x;
drop table   IF exists   type_table;
create table type_table(i  char(10) character set utf16)CHARSET=gbk;
insert  into  type_table  values('100.000222');
select   *  from  type_table;
i
100.000222
select collation(i) from type_table;
collation(i)
utf16_general_ci
数据库设置gbk  表设置gbk   字段设置gbk
drop database  IF EXISTS  ob100x;
create database ob100x  character set gbk;
use ob100x;
drop table   IF exists   type_table;
create table type_table(i  char(10) character set gbk)CHARSET=gbk;
insert  into  type_table  values('100.000222');
select   *  from  type_table;
i
100.000222
select collation(i) from type_table;
collation(i)
gbk_chinese_ci
--  character-7-10   varchar类型
数据库设置utf16
drop database  IF EXISTS  ob100x;
create database ob100x  character set utf16;
use ob100x;
drop table   IF exists   type_table;
create table type_table(j  varchar(10));
insert  into  type_table  values('dfgdfgdf');
select   *  from  type_table;
j
dfgdfgdf
select collation(j) from type_table;
collation(j)
utf16_general_ci
数据库设置gbk
drop database  IF EXISTS  ob100x;
create database ob100x  character set gbk;
use ob100x;
drop table   IF exists   type_table;
create table type_table(j  varchar(10));
insert  into  type_table  values('dfgdfgdf');
select   *  from  type_table;
j
dfgdfgdf
select collation(j) from type_table;
collation(j)
gbk_chinese_ci
数据库设置utf16   表设置 gbk
drop database  IF EXISTS  ob100x;
create database ob100x  character set utf16;
use ob100x;
drop table   IF exists   type_table;
create table type_table(j  varchar(10)) CHARSET=gbk;
insert  into  type_table  values('dfgdfgdf');
select   *  from  type_table;
j
dfgdfgdf
select collation(j) from type_table;
collation(j)
gbk_chinese_ci
数据库设置utf16   表设置 utf16
drop database  IF EXISTS  ob100x;
create database ob100x  character set utf16;
use ob100x;
drop table   IF exists   type_table;
create table type_table(j  varchar(10)) CHARSET=utf16;
insert  into  type_table  values('dfgdfgdf');
select   *  from  type_table;
j
dfgdfgdf
select collation(j) from type_table;
collation(j)
utf16_general_ci
数据库设置utf16   表设置 gbk  字段设置  utf16
drop database  IF EXISTS  ob100x;
create database ob100x  character set utf16;
use ob100x;
drop table   IF exists   type_table;
create table type_table(j  varchar(10)character set utf16) CHARSET=gbk;
insert  into  type_table  values('dfgdfgdf');
select   *  from  type_table;
j
dfgdfgdf
select collation(j) from type_table;
collation(j)
utf16_general_ci
数据库设置gbk  表设置 utf16  字段设置 gbk
drop database  IF EXISTS  ob100x;
create database ob100x  character set gbk;
use ob100x;
drop table   IF exists   type_table;
create table type_table(j  varchar(10) character set gbk) CHARSET=utf16;
insert  into  type_table  values('dfgdfgdf');
select   *  from  type_table;
j
dfgdfgdf
select collation(j) from type_table;
collation(j)
gbk_chinese_ci
--  下面4个都是可变长度
--  character-7-11    tinytext类型
drop table   IF exists   type_table;
create table type_table(k  tinytext) DEFAULT CHARACTER SET = utf16;
insert  into  type_table  values('dfffffffffffffffffffffffffffffffffffffffffffffffffffffffgdfgdf');
select   *  from  type_table;
k
dfffffffffffffffffffffffffffffffffffffffffffffffffffffffgdfgdf
--  character-7-12  text类型
drop table   IF exists   type_table;
create table type_table(l  text) DEFAULT CHARACTER SET = utf16;
insert  into  type_table  values('dfgdffffffffffffffffffffffffffffffffffffffffffffffffffgdf');
select   *  from  type_table;
l
dfgdffffffffffffffffffffffffffffffffffffffffffffffffffgdf
--  character-7-13   mediumtext类型
drop table   IF exists   type_table;
create table type_table(m  mediumtext) DEFAULT CHARACTER SET = utf16;
insert  into  type_table  values('dfgdf@@@@@@@@@@@@@@@@@@@@@@@@@@@@@@@@@@@@@@@@@@@@@@@@@@@@@@@@@@@@gdf');
select   *  from  type_table;
m
dfgdf@@@@@@@@@@@@@@@@@@@@@@@@@@@@@@@@@@@@@@@@@@@@@@@@@@@@@@@@@@@@gdf
--  character-7-14    longtext   类型
drop table   IF exists   type_table;
create table type_table(n  longtext) DEFAULT CHARACTER SET = utf16;
insert  into  type_table  values('dfgdfggfjfjfjfjrt!!!!!!!!!!!!!!!!!!!!!!!!!!!!!!!!!!!!!!!!!!!!!!!!!!!!!!!!!gdf');
select   *  from  type_table;
n
dfgdfggfjfjfjfjrt!!!!!!!!!!!!!!!!!!!!!!!!!!!!!!!!!!!!!!!!!!!!!!!!!!!!!!!!!gdf
--  character-7-15    date   类型
drop table   IF exists   type_table;
create table type_table(o date) DEFAULT CHARACTER SET = utf16;
insert into  type_table values('2008-12-2');
select   *  from  type_table;
o
2008-12-02
--  character-7-16    time   类型
drop table   IF exists   type_table;
create table type_table(p  time) DEFAULT CHARACTER SET = utf16;
insert into  type_table values('12:25:36');
select   *  from  type_table;
p
12:25:36
--  character-7-17    datetime   类型
drop table   IF exists   type_table;
create table type_table(w  datetime) DEFAULT CHARACTER SET = utf16;
insert into  type_table values('2008-12-2 22:06:44');
select   *  from  type_table;
w
2008-12-02 22:06:44
--  character-7-18    timestamp   类型
drop table   IF exists   type_table;
create table type_table(x  timestamp,y int) DEFAULT CHARACTER SET = utf16;
insert into  type_table(x,y) values('2008-12-2 22:06:44',10);
select   *  from  type_table;
x	y
2008-12-02 22:06:44	10
--  character-7-19    year   类型
drop table   IF exists   type_table;
create table type_table(z  year) DEFAULT CHARACTER SET = utf16;
insert into  type_table values('2008');
insert into  type_table values(date_format(date'2021-12-12','%Y'));
select   *  from  type_table;
z
2008
2021
--  character-7-20      bit   类型     ob查不出数据
drop table   IF exists   type_table;
create table type_table (id bit(8)) DEFAULT CHARACTER SET = utf16;
insert into type_table values (b'11');
insert into type_table values (11);
select   *  from  type_table;
id


-- 二进制展示数据
select bin(id) from type_table;
bin(id)
11
1011
--   八进制展示数据
select oct(id) from type_table;
oct(id)
3
13
--   十六进制展示数据
select hex(id) from type_table;
hex(id)
3
B
--   Blob的四种类型
--  character-7-21    TinyBlob   类型
drop table   IF exists   type_table;
create table type_table (id TinyBlob) DEFAULT CHARACTER SET = utf16;
insert into type_table values (11);
insert into type_table values ('11dsfdsfsfas');
select   *  from  type_table;
id
11
11dsfdsfsfas
select collation(id) from type_table;
collation(id)
binary
binary
--  character-7-22      Blob   类型
drop table   IF exists   type_table;
create table type_table (id Blob) DEFAULT CHARACTER SET = utf16;
insert into type_table values (11);
insert into type_table values ('11dsfdsfsfas');
select   *  from  type_table;
id
11
11dsfdsfsfas
select collation(id) from type_table;
collation(id)
binary
binary
--  character-7-23     MediumBlob   类型
drop table   IF exists   type_table;
create table type_table (id MediumBlob) DEFAULT CHARACTER SET = utf16;
insert into type_table values (11);
insert into type_table values ('11dsfdsfsfas');
select   *  from  type_table;
id
11
11dsfdsfsfas
select collation(id) from type_table;
collation(id)
binary
binary
--  character-7-24      LongBlob   类型   
drop table   IF exists   type_table;
create table type_table (id LongBlob) DEFAULT CHARACTER SET = utf16;
insert into type_table values (11);
insert into type_table values ('11dsfdsfsfas');
select   *  from  type_table;
id
11
11dsfdsfsfas
select collation(id) from type_table;
collation(id)
binary
binary
--  character-7-25   其他
DROP TABLE IF exists tableclass;
CREATE TABLE tableclass(uid int auto_increment,a01_int_unsigned int unsigned,a02_int_signed int signed,
b01_tinyint_unsigned tinyint unsigned,b02_tinyint_signed tinyint signed,
c01_decimal_30_5_unsigned decimal(30,5) unsigned,c02_decimal_30_signed decimal(30,5) signed,
d01_float     float(6,3), d02_double   double(6,3),  #character  set = utf16,
e01_smallint_unsigned smallint unsigned,e02_smallint   smallint,
f01_mediumint_unsigned mediumint unsigned,f02_mediumint mediumint, #character set gbk,
g01_bigint_unsigned bigint unsigned,g02_bigint bigint,
h01_integer_unsigned integer unsigned,h02_integer_signed integer signed,
i01_char_30_gbk char(30)  character set gbk,i02_char_20_utf16 varchar(20)  character set utf16,
j001_date date,j002_timestamp timestamp NULL DEFAULT NULL,j003_datetime datetime,m001  time,m002  year,
k001  tinytext   CHARACTER SET utf16,k002  text    CHARACTER SET  gbk,k003  mediumtext   CHARACTER set utf16,k008  longtext   CHARACTER SET  utf16,
n001 bit(8),n002 bit(8),
u001 TinyBlob,u002 Blob,u003 MediumBlob,u004 longblob,primary key (uid));
INSERT INTO tableclass VALUES(
NULL, 100, -100,
20, -20, 
99.99999,-99.99999,
96.123,-96.123,
30,-30,
400,-400,
500,-500,
600,-600,
'abcdefg','helloworld',
'2001-08-18','2005-12-18 20:30:32.003555','2009-09-18 15:10:49','12:15:16',date_format(date'2021-12-12','%Y'),
'100abcdefgabcdefgabcdefgabcdefg','200abcdefgabcdefgabcdefgabcdefg','3000abcdefgabcdefgabcdefgabcdefg','400abcdefgabcdefgabcdefgabcdefg',
b'11',11,
'11dsfdsfsfas','11dsfdsfsfas','11dsfdsfsfas','11dsfdsfsfas');
select   *  from  tableclass;
uid	a01_int_unsigned	a02_int_signed	b01_tinyint_unsigned	b02_tinyint_signed	c01_decimal_30_5_unsigned	c02_decimal_30_signed	d01_float	d02_double	e01_smallint_unsigned	e02_smallint	f01_mediumint_unsigned	f02_mediumint	g01_bigint_unsigned	g02_bigint	h01_integer_unsigned	h02_integer_signed	i01_char_30_gbk	i02_char_20_utf16	j001_date	j002_timestamp	j003_datetime	m001	m002	k001	k002	k003	k008	n001	n002	u001	u002	u003	u004
1	100	-100	20	-20	99.99999	-99.99999	96.123	-96.123	30	-30	400	-400	500	-500	600	-600	abcdefg	helloworld	2001-08-18	2005-12-18 20:30:32	2009-09-18 15:10:49	12:15:16	2021	100abcdefgabcdefgabcdefgabcdefg	200abcdefgabcdefgabcdefgabcdefg	3000abcdefgabcdefgabcdefgabcdefg	400abcdefgabcdefgabcdefgabcdefg			11dsfdsfsfas	11dsfdsfsfas	11dsfdsfsfas	11dsfdsfsfas
DROP TABLE IF exists tableclass;
=====================================================其他===========================================================
character-8-1   修改数据库字符集                          
drop database  IF EXISTS  enterprises;
create database enterprises  character set utf16;
use enterprises;
alter database enterprises character set gbk;
character-8-2    #修改数据表字符集
drop table if exists employees;
create table employees(c4 int,name char(10));
select  *   from  employees;
c4	name
character-8-3     修改表字段字符集
insert into employees values(1,'中国');
select  collation(name)   from  employees;
collation(name)
gbk_chinese_ci
insert into employees values(1,'中国');
character-8-4     数据库设置字符集gbk，存储过程不设置字符集
drop database  IF EXISTS  ob200x;
create database ob200x  character set gbk;
use ob200x;
drop function if exists myfun400;
create function myfun400(username varchar(20))  returns varchar(20)
begin
set @str='';
select username into @str from dual;
return  collation(@str);
end
//
drop database  IF EXISTS  ob200x;
create database ob200x  character set utf16;
use ob200x;
drop function if exists myfun400;
create function myfun400(username varchar(20))  returns varchar(20)
begin
set @str='';
select username into @str from dual;
return  collation(@str);
end//
select  myfun400('污水');
myfun400('污水')
utf8mb4_general_ci
select   collation(@str) from   dual;
collation(@str)
utf8mb4_general_ci
drop database  IF EXISTS  ob200x;
create database ob200x  character set gbk;
use ob200x;
drop function if exists myfun400;
create function myfun400(username varchar(20) character set utf16)  returns varchar(20)
begin
set @str='';
select username into @str from dual;
return  collation(@str);
end//
select  myfun400('污水');
myfun400('污水')
utf8mb4_general_ci
select   collation(@str) from   dual;
collation(@str)
utf8mb4_general_ci
drop database  IF EXISTS  ob200x;
create database ob200x  character set utf16;
use ob200x;
drop function if exists myfun400;
create function myfun400(username varchar(20) character set gbk)  returns varchar(20)
begin
set @str='';
select username into @str from dual;
return  collation(@str);
end//
select  myfun400('污水');
myfun400('污水')
utf8mb4_general_ci
select   collation(@str) from   dual;
collation(@str)
utf8mb4_general_ci
character-8-5    char在字符集下的长度测试               
drop database  IF EXISTS  ob2000x;
create database ob2000x  character set utf16;
use ob2000x;
drop table if exists userlen;
create table userlen(name char(255)character set utf16)charset=utf16;
drop function if exists myfunlen;
create function myfunlen(funuser int) returns int
begin
set @sumcount='hello world';
set @cccount=funuser;
set @countstr='';
outer_label: begin
WHILE @cccount < 300 DO
SET @cccount = @cccount+1;          
SET @countstr = concat(@countstr,'国');
insert into userlen values(@countstr);        
select count(*) into @sumcount from userlen;
if CHAR_LENGTH(@countstr)>254   then
leave  outer_label; 
end if;
END WHILE;
end outer_label;
return  LENGTH(@countstr); 
end
//
drop database  IF EXISTS  ob202x;
create database ob202x  character set utf16;
use ob202x;
drop table if exists userleng;
create table userleng(name char(255)character set gbk)charset=utf16;
drop function if exists myfunsecdy;
create function myfunsecdy(funuser int) returns int
begin
set @sumcooy='hello world';
set @cccounty=funuser;
set @countstry='';
outer_labely: begin
WHILE @cccounty < 3000 DO
SET @cccounty = @cccounty+1;          
SET @countstry = concat(@countstry,'国');
insert into userleng values(@countstry);        
select count(*) into @sumcooy from userleng;
if CHAR_LENGTH(@countstry)>254   then
leave  outer_labely; 
end if;
END WHILE;
end outer_labely;
return  LENGTH(@countstry); 
end
//
character-8-7 
--   建库时指定字符集
drop database  IF EXISTS  ob100x;
create database ob100x  character set utf16;
use ob100x;
drop   table  IF EXISTS   abc;
CREATE TABLE abc(id int(11) DEFAULT NULL, c varchar(100) DEFAULT null  )DEFAULT CHARSET=gbk;
insert into abc values(1,'我们');
select   *  from   abc;
id	c
1	我们
select * from abc;
id	c
1	我们
SELECT CHARSET(CHAR(100)), CHARSET(CHAR('aaa' USING gbk)),CHARSET(90);
CHARSET(CHAR(100))	CHARSET(CHAR('aaa' USING gbk))	CHARSET(90)
binary	gbk	binary
insert into abc values(2,concat('cardName:校园网',char(59 using utf16),'offlineCardType:campus'));
select * from abc;
id	c
1	我们
2	cardName:校园网;offlineCardType:campus
TRUNCATE   table  abc;
insert into abc values(2,char(59));
select * from abc;
id	c
2	;
--   建库时指定字符集
drop database  IF EXISTS  ob100x;
create database ob100x  character set utf16;
use ob100x;
select concat('cardName:校园网',char(59),'offlineCardType:campus');
concat('cardName:校园网',char(59),'offlineCardType:campus')
cardName:校园网;offlineCardType:campus
drop   table  IF EXISTS   abc;
CREATE TABLE abc(id int(11) DEFAULT NULL,c varchar(100) DEFAULT NULL)DEFAULT CHARSET=utf16;
insert into abc values(2,concat('我',char(59)));
select * from abc;
id	c
2	鄻
drop   table  IF EXISTS   abc;
character-8-8   utf16和utf8混合测试                                    
drop database  IF EXISTS  ob100x;
create database ob100x character set gbk;
use ob100x;
drop database  IF EXISTS  table001;
CREATE TABLE IF NOT EXISTS table001(
c1 INT UNSIGNED AUTO_INCREMENT,
c2 VARCHAR(100) CHARACTER SET gbk NOT NULL,
c3 VARCHAR(200) CHARACTER SET utf16 NOT NULL,
c4 CHAR(200) CHARACTER SET gbk, 
c5 CHAR(200) CHARACTER SET utf16, 
PRIMARY KEY(c1)
)CHARSET=utf16;
insert into  table001(c1,c2,c3,c4,c5)values(null,'中国','美国','英国','法国');
select  *  from   table001;
c1	c2	c3	c4	c5
1	中国	美国	英国	法国
select concat(e.c3, 'aâ')   from   table001   e;
concat(e.c3, 'aâ')
美国aâ
select concat(e.c5, 'aâ')   from   table001   e;
concat(e.c5, 'aâ')
法国aâ
select concat(e.c2,e.c3)   from   table001   e;
concat(e.c2,e.c3)
中国美国
select concat(concat(concat(e.c2,e.c3),e.c4),e.c5)   from   table001   e;
concat(concat(concat(e.c2,e.c3),e.c4),e.c5)
中国美国英国法国
select   char(e.c2 using utf16) from   table001   e;
char(e.c2 using utf16)
 
select   char(e.c2 using gbk) from   table001   e;
char(e.c2 using gbk)
 
select   char(e.c3 using utf16) from   table001   e;
char(e.c3 using utf16)
 
select   char(e.c3 using gbk) from   table001   e;
char(e.c3 using gbk)
 
select   char(e.c4 using utf16) from   table001   e;
char(e.c4 using utf16)
 
select   char(e.c4 using gbk) from   table001   e;
char(e.c4 using gbk)
 
select   char(e.c5 using utf16) from   table001   e;
char(e.c5 using utf16)
 
select   char(e.c5 using gbk) from   table001   e;
char(e.c5 using gbk)
 
drop database  IF EXISTS  ob100x;
create database ob100x character set utf16;
use ob100x;
drop database  IF EXISTS  table001;
CREATE TABLE IF NOT EXISTS table001(
c1 INT UNSIGNED AUTO_INCREMENT,
c2 VARCHAR(100) CHARACTER SET gbk NOT NULL,
c3 VARCHAR(200) CHARACTER SET utf16 NOT NULL,
c4 CHAR(200) CHARACTER SET gbk, 
c5 CHAR(200) CHARACTER SET utf16, 
PRIMARY KEY(c1)
)CHARSET=gbk;
insert into  table001(c1,c2,c3,c4,c5)values(null,'中国','美国','英国','法国');
select  *  from   table001;
c1	c2	c3	c4	c5
1	中国	美国	英国	法国
select concat(e.c3, 'aâ')   from   table001   e;
concat(e.c3, 'aâ')
美国aâ
select concat(e.c5, 'aâ')   from   table001   e;
concat(e.c5, 'aâ')
法国aâ
select concat(concat(concat(e.c2,e.c3),e.c4),e.c5)   from   table001   e;
concat(concat(concat(e.c2,e.c3),e.c4),e.c5)
中国美国英国法国
select   char(e.c2 using utf16) from   table001   e;
char(e.c2 using utf16)
 
select   char(e.c2 using gbk) from   table001   e;
char(e.c2 using gbk)
 
select   char(e.c3 using utf16) from   table001   e;
char(e.c3 using utf16)
 
select   char(e.c3 using gbk) from   table001   e;
char(e.c3 using gbk)
 
select   char(e.c4 using utf16) from   table001   e;
char(e.c4 using utf16)
 
select   char(e.c4 using gbk) from   table001   e;
char(e.c4 using gbk)
 
select   char(e.c5 using utf16) from   table001   e;
char(e.c5 using utf16)
 
select   char(e.c5 using gbk) from   table001   e;
char(e.c5 using gbk)
 
character-8-9  回滚
drop database  IF EXISTS  ob100x;
create database ob100x character set gbk;
use ob100x;
drop table  IF EXISTS  runoob_transaction_test;
CREATE TABLE runoob_transaction_test( id int(5),name varchar(20) CHARACTER SET gbk)CHARSET=utf16;
select * from runoob_transaction_test;
id	name
begin;
insert into runoob_transaction_test value(1,'中国');
insert into runoob_transaction_test value(2,'美国');
commit;
select * from runoob_transaction_test;
id	name
1	中国
2	美国
begin;
insert into runoob_transaction_test values(3,'日本');
rollback;
select * from runoob_transaction_test;
id	name
1	中国
2	美国
alter database ob100x character set utf16;
select * from runoob_transaction_test;
id	name
1	中国
2	美国
drop database  IF EXISTS  ob100x;
drop database  IF EXISTS  ob202x;
drop database  IF EXISTS  ob2000x;
drop database  IF EXISTS  enterprises;
drop database  IF EXISTS  variablesandconstants;
