drop table pt;
drop table nt;
create table pt (c1 number, c2 number);
create table nt (c1 number, c2 number);
alter table pt exchange partition M1 with table nt INCLUDING INDEXES WITHOUT VALIDATION;
ERROR HY000: internal error code, arguments: -5302, Partition management on a not partitioned table is not possible
drop table pt;
drop table nt;
create table pt (c1 number, c2 number) partition by range(c1) (partition M1  VALUES LESS THAN (5), partition M2 VALUES LESS THAN (10), partition M3 VALUES LESS THAN (1000));
create table nt (c1 number, c2 number) partition by range(c1) (partition M1  VALUES LESS THAN (5), partition M2 VALUES LESS THAN (10), partition M3 VALUES LESS THAN (1000));
alter table pt exchange partition M1 with table nt INCLUDING INDEXES WITHOUT VALIDATION;
ERROR 0A000: internal error code, arguments: -4007, Exchange partition except composite-partitioned and partitioned table is not supported
drop table pt;
drop table nt;
create table pt (c1 number, c2 number) partition by range(c1) (partition M1  VALUES LESS THAN (5), partition M2 VALUES LESS THAN (10), partition M3 VALUES LESS THAN (1000));
create table nt (c1 number, c2 number);
alter table pt exchange partition M1 with table nt INCLUDING INDEXES WITHOUT VALIDATION;
drop table pt;
drop table nt;
create table pt (c1 number, c2 number) partition by range(c1) (partition M1  VALUES LESS THAN (5), partition M2 VALUES LESS THAN (10), partition M3 VALUES LESS THAN (1000));
create table nt (c1 number, c2 number);
alter table pt exchange partition M1 with table nt WITH VALIDATION;
ERROR 42000: You have an error in your SQL syntax; check the manual that corresponds to your OceanBase version for the right syntax to use near 'WITH VALIDATION' at line 1
alter table pt exchange partition M1 with table nt WITHOUT VALIDATION;
ERROR 42000: You have an error in your SQL syntax; check the manual that corresponds to your OceanBase version for the right syntax to use near 'WITHOUT VALIDATION' at line 1
alter table pt exchange partition M1 with table nt WITHOUT VALIDATION UPDATE GLOBAL INDEXES;
ERROR 42000: You have an error in your SQL syntax; check the manual that corresponds to your OceanBase version for the right syntax to use near 'WITHOUT VALIDATION UPDATE GLOBAL INDEXES' at line 1
alter table pt exchange partition M1 with table nt INCLUDING INDEXES WITHOUT VALIDATION UPDATE GLOBAL INDEXES;
ERROR 42000: You have an error in your SQL syntax; check the manual that corresponds to your OceanBase version for the right syntax to use near 'UPDATE GLOBAL INDEXES' at line 1
drop table pt;
drop table nt;
create table pt (c1 int, c2 int) partition by range(c1) (partition M1  VALUES LESS THAN (5), partition M2 VALUES LESS THAN (10), partition M3 VALUES LESS THAN (1000));
create table nt (c1 int, c2 int);
alter table pt exchange partition M111 with table nt INCLUDING INDEXES WITHOUT VALIDATION;
ERROR HY000: Specified partition does not exist
alter table pt exchange partition M1 with table nt INCLUDING INDEXES WITHOUT VALIDATION;
drop table pt;
drop table nt;
CREATE TABLE pt(c1 INT,c2 INT) PARTITION BY RANGE(c1) 
SUBPARTITION BY RANGE(c1)
SUBPARTITION TEMPLATE
(SUBPARTITION mp1 VALUES LESS THAN(100),
SUBPARTITION mp2 VALUES LESS THAN(200),
SUBPARTITION mp3 VALUES LESS THAN(300)
)
(PARTITION p0 VALUES LESS THAN(2020),
PARTITION p1 VALUES LESS THAN(2021),
PARTITION p2 VALUES LESS THAN(2022)
);
CREATE TABLE nt(c1 INT,c2 INT);
alter table pt exchange partition M1 with table nt INCLUDING INDEXES WITHOUT VALIDATION;
ERROR HY000: Specified subpartition does not exist
alter table pt exchange partition p0smp1 with table nt INCLUDING INDEXES WITHOUT VALIDATION;
drop table pt;
drop table nt;
CREATE TABLE pt(
c1 VARCHAR2(10),
c2 VARCHAR2(20)
)PARTITION BY LIST(c1)
(
PARTITION PART_01 VALUES('ME','PE','QC','RD'),
PARTITION PART_02 VALUES('SMT','SALE')
);
CREATE TABLE nt(c1 VARCHAR2(10), c2 VARCHAR2(20));
alter table pt exchange partition PART_01 with table nt INCLUDING INDEXES WITHOUT VALIDATION;
ERROR 0A000: internal error code, arguments: -4007, Exchange partition except range/range columns not supported
drop table pt;
drop table nt;
CREATE TABLE pt(c1 INT,c2 INT) 
PARTITION BY LIST(c1)
SUBPARTITION BY LIST(c2)
SUBPARTITION TEMPLATE 
(SUBPARTITION mp0 VALUES (2),
SUBPARTITION mp1 VALUES (5),
SUBPARTITION mp2 VALUES (8)
)
(PARTITION p0 VALUES (1,3),
PARTITION p1 VALUES (4,6),
PARTITION p2 VALUES (7,9)
);
CREATE TABLE nt(c1 INT,c2 INT);
alter table pt exchange partition p0smp0 with table nt INCLUDING INDEXES WITHOUT VALIDATION;
ERROR 0A000: internal error code, arguments: -4007, Exchange partition except range/range columns not supported
drop table pt;
drop table nt;
create table pt (c1 number not null primary key, c2 number) partition by range(c1)(partition M1  VALUES LESS THAN (5), partition M2 VALUES LESS THAN (10), partition M3 VALUES LESS THAN (1000));
create table nt (c1 number not null primary key, c2 number);
alter table pt exchange partition M1 with table nt INCLUDING INDEXES WITHOUT VALIDATION;
drop table pt;
drop table nt;
create table pt (c1 int, c2 int, c3 blob) partition by range(c1) (partition M1  VALUES LESS THAN (5), partition M2 VALUES LESS THAN (10), partition M3 VALUES LESS THAN (20));
insert into pt(c1, c2) values(1,1);
insert into pt(c1, c2) values(2,2);
insert into pt(c1, c2) values(3,3);
insert into pt(c1, c2) values(4,4);
insert into pt(c1, c2) values(5,5);
insert into pt(c1, c2) values(6,6);
insert into pt(c1, c2) values(7,7);
insert into pt(c1, c2) values(8,8);
insert into pt(c1, c2) values(9,9);
insert into pt(c1, c2) values(10,10);
insert into pt(c1, c2) values(11,11);
insert into pt(c1, c2) values(12,12);
insert into pt(c1, c2) values(13,13);
insert into pt(c1, c2) values(14,14);
insert into pt(c1, c2) values(15,15);
create index pt_local_idx on pt(c1, c2) local;
create index pt_global_idx on pt(c2) global;
select * from pt order by c1;
C1	C2	C3
1	1	NULL
2	2	NULL
3	3	NULL
4	4	NULL
5	5	NULL
6	6	NULL
7	7	NULL
8	8	NULL
9	9	NULL
10	10	NULL
11	11	NULL
12	12	NULL
13	13	NULL
14	14	NULL
15	15	NULL
create table nt (c1 int, c2 int, c3 blob);
insert into nt(c1, c2) values(21,21);
insert into nt(c1, c2) values(22,22);
insert into nt(c1, c2) values(23,23);
insert into nt(c1, c2) values(24,24);
insert into nt(c1, c2) values(25,25);
insert into nt(c1, c2) values(26,26);
insert into nt(c1, c2) values(27,27);
insert into nt(c1, c2) values(28,28);
insert into nt(c1, c2) values(29,29);
insert into nt(c1, c2) values(30,30);
insert into nt(c1, c2) values(31,31);
insert into nt(c1, c2) values(32,32);
insert into nt(c1, c2) values(33,33);
insert into nt(c1, c2) values(34,34);
insert into nt(c1, c2) values(35,35);
create index nt_local_idx on nt(c1, c2);
select * from nt order by c1;
C1	C2	C3
21	21	NULL
22	22	NULL
23	23	NULL
24	24	NULL
25	25	NULL
26	26	NULL
27	27	NULL
28	28	NULL
29	29	NULL
30	30	NULL
31	31	NULL
32	32	NULL
33	33	NULL
34	34	NULL
35	35	NULL
ALTER TABLE pt ADD PARTITION  M4 VALUES LESS THAN(40);
select * from pt order by c1;
C1	C2	C3
1	1	NULL
2	2	NULL
3	3	NULL
4	4	NULL
5	5	NULL
6	6	NULL
7	7	NULL
8	8	NULL
9	9	NULL
10	10	NULL
11	11	NULL
12	12	NULL
13	13	NULL
14	14	NULL
15	15	NULL
select * from nt order by c1;
C1	C2	C3
21	21	NULL
22	22	NULL
23	23	NULL
24	24	NULL
25	25	NULL
26	26	NULL
27	27	NULL
28	28	NULL
29	29	NULL
30	30	NULL
31	31	NULL
32	32	NULL
33	33	NULL
34	34	NULL
35	35	NULL
alter table pt exchange partition M4 with table nt including indexes without validation;
select * from pt order by c1;
C1	C2	C3
1	1	NULL
2	2	NULL
3	3	NULL
4	4	NULL
5	5	NULL
6	6	NULL
7	7	NULL
8	8	NULL
9	9	NULL
10	10	NULL
11	11	NULL
12	12	NULL
13	13	NULL
14	14	NULL
15	15	NULL
21	21	NULL
22	22	NULL
23	23	NULL
24	24	NULL
25	25	NULL
26	26	NULL
27	27	NULL
28	28	NULL
29	29	NULL
30	30	NULL
31	31	NULL
32	32	NULL
33	33	NULL
34	34	NULL
35	35	NULL
select * from nt order by c1;
C1	C2	C3
insert into pt(c1, c2) values(36,36);
insert into pt(c1, c2) values(37,37);
insert into pt(c1, c2) values(38,38);
insert into pt(c1, c2) values(39,39);
select * from pt order by c1;
C1	C2	C3
1	1	NULL
2	2	NULL
3	3	NULL
4	4	NULL
5	5	NULL
6	6	NULL
7	7	NULL
8	8	NULL
9	9	NULL
10	10	NULL
11	11	NULL
12	12	NULL
13	13	NULL
14	14	NULL
15	15	NULL
21	21	NULL
22	22	NULL
23	23	NULL
24	24	NULL
25	25	NULL
26	26	NULL
27	27	NULL
28	28	NULL
29	29	NULL
30	30	NULL
31	31	NULL
32	32	NULL
33	33	NULL
34	34	NULL
35	35	NULL
36	36	NULL
37	37	NULL
38	38	NULL
39	39	NULL
insert into nt(c1, c2) values(1,1);
insert into nt(c1, c2) values(2,2);
insert into nt(c1, c2) values(3,3);
insert into nt(c1, c2) values(4,4);
insert into nt(c1, c2) values(5,5);
insert into nt(c1, c2) values(6,6);
insert into nt(c1, c2) values(7,7);
insert into nt(c1, c2) values(8,8);
insert into nt(c1, c2) values(9,9);
insert into nt(c1, c2) values(10,10);
select * from nt order by c1;
C1	C2	C3
1	1	NULL
2	2	NULL
3	3	NULL
4	4	NULL
5	5	NULL
6	6	NULL
7	7	NULL
8	8	NULL
9	9	NULL
10	10	NULL
update pt set c2 = -10 where c1 = 10;
update pt set c2 = -11 where c1 = 11;
update pt set c2 = -12 where c1 = 12;
select * from pt order by c1;
C1	C2	C3
1	1	NULL
2	2	NULL
3	3	NULL
4	4	NULL
5	5	NULL
6	6	NULL
7	7	NULL
8	8	NULL
9	9	NULL
10	-10	NULL
11	-11	NULL
12	-12	NULL
13	13	NULL
14	14	NULL
15	15	NULL
21	21	NULL
22	22	NULL
23	23	NULL
24	24	NULL
25	25	NULL
26	26	NULL
27	27	NULL
28	28	NULL
29	29	NULL
30	30	NULL
31	31	NULL
32	32	NULL
33	33	NULL
34	34	NULL
35	35	NULL
36	36	NULL
37	37	NULL
38	38	NULL
39	39	NULL
update nt set c2 = -1 where c1 = 1;
update nt set c2 = -2 where c1 = 2;
update nt set c2 = -3 where c1 = 3;
select * from nt order by c1;
C1	C2	C3
1	-1	NULL
2	-2	NULL
3	-3	NULL
4	4	NULL
5	5	NULL
6	6	NULL
7	7	NULL
8	8	NULL
9	9	NULL
10	10	NULL
delete from pt where c1 > 10;
select * from pt order by c1;
C1	C2	C3
1	1	NULL
2	2	NULL
3	3	NULL
4	4	NULL
5	5	NULL
6	6	NULL
7	7	NULL
8	8	NULL
9	9	NULL
10	-10	NULL
delete from nt where c1 > 5;
select * from nt order by c1;
C1	C2	C3
1	-1	NULL
2	-2	NULL
3	-3	NULL
4	4	NULL
5	5	NULL
alter table pt exchange partition M1 with table nt including indexes without validation;
select * from pt order by c1;
C1	C2	C3
1	-1	NULL
2	-2	NULL
3	-3	NULL
4	4	NULL
5	5	NULL
5	5	NULL
6	6	NULL
7	7	NULL
8	8	NULL
9	9	NULL
10	-10	NULL
select * from nt order by c1;
C1	C2	C3
1	1	NULL
2	2	NULL
3	3	NULL
4	4	NULL
drop table pt;
drop table nt;
CREATE TABLE pt(c1 INT,c2 INT)
PARTITION BY RANGE(c1)
SUBPARTITION BY RANGE(c2)
(PARTITION p0 VALUES LESS THAN(100)
(SUBPARTITION sp0 VALUES LESS THAN(2020),
SUBPARTITION sp1 VALUES LESS THAN(2120)
),
PARTITION p1 VALUES LESS THAN(200)
(SUBPARTITION sp2 VALUES LESS THAN(2320),
SUBPARTITION sp3 VALUES LESS THAN(2420),
SUBPARTITION sp4 VALUES LESS THAN(2520)
)
);
insert into pt(c1, c2) values(1,2011);
insert into pt(c1, c2) values(2,2012);
insert into pt(c1, c2) values(3,2013);
insert into pt(c1, c2) values(4,2014);
insert into pt(c1, c2) values(5,2015);
insert into pt(c1, c2) values(6,2016);
insert into pt(c1, c2) values(7,2017);
insert into pt(c1, c2) values(8,2018);
insert into pt(c1, c2) values(9,2019);
insert into pt(c1, c2) values(10,2020);
insert into pt(c1, c2) values(11,2021);
insert into pt(c1, c2) values(12,2022);
insert into pt(c1, c2) values(13,2023);
insert into pt(c1, c2) values(14,2024);
insert into pt(c1, c2) values(15,2025);
create index local_idx on pt(c1, c2) local;
create index pt_global_idx on pt(c2) global;
select * from pt order by c1;
C1	C2
1	2011
2	2012
3	2013
4	2014
5	2015
6	2016
7	2017
8	2018
9	2019
10	2020
11	2021
12	2022
13	2023
14	2024
15	2025
CREATE TABLE nt(c1 INT,c2 INT);
insert into nt(c1, c2) values(121,2421);
insert into nt(c1, c2) values(122,2422);
insert into nt(c1, c2) values(123,2423);
insert into nt(c1, c2) values(124,2424);
insert into nt(c1, c2) values(125,2425);
insert into nt(c1, c2) values(126,2426);
insert into nt(c1, c2) values(127,2427);
insert into nt(c1, c2) values(128,2428);
create index local_idx1 on nt(c1, c2);
select * from nt order by c1;
C1	C2
121	2421
122	2422
123	2423
124	2424
125	2425
126	2426
127	2427
128	2428
alter table pt exchange partition sp4 with table nt including indexes without validation;
select * from pt order by c1;
C1	C2
1	2011
2	2012
3	2013
4	2014
5	2015
6	2016
7	2017
8	2018
9	2019
10	2020
11	2021
12	2022
13	2023
14	2024
15	2025
121	2421
122	2422
123	2423
124	2424
125	2425
126	2426
127	2427
128	2428
select * from nt order by c1;
C1	C2
drop table pt;
drop table nt;
drop tablespace pt_space;
drop tablespace nt_space;
create tablespace pt_space;
create tablespace nt_space;
create table pt(c1 int primary key, c2 int) tablespace pt_space partition by range(c1)(partition M1  VALUES LESS THAN (5), partition M2 VALUES LESS THAN (10), partition M3 VALUES LESS THAN (1000));
create table nt(c1 int primary key, c2 int) tablespace nt_space;
alter table pt exchange partition M1 with table nt INCLUDING INDEXES WITHOUT VALIDATION;
ERROR 0A000: internal error code, arguments: -4007, exchange partition in different tablespaces not supported
drop table pt;
drop table nt;
create table pt(c1 int primary key, c2 int) tablespace pt_space partition by range(c1)(partition M1  VALUES LESS THAN (5), partition M2 VALUES LESS THAN (10), partition M3 VALUES LESS THAN (1000));
create table nt(c1 int primary key, c2 int) tablespace pt_space;
alter table pt exchange partition M1 with table nt INCLUDING INDEXES WITHOUT VALIDATION;
drop table pt;
drop table nt;
create table pt (c1 number, c2 number invisible) partition by range(c1) (partition M1  VALUES LESS THAN (5), partition M2 VALUES LESS THAN (10), partition M3 VALUES LESS THAN (1000));
create table nt (c1 number, c2 number);
alter table pt exchange partition M1 with table nt INCLUDING INDEXES WITHOUT VALIDATION;
ERROR HY000: column type or size mismatch in ALTER TABLE EXCHANGE PARTITION
drop table nt;
create table nt (c1 number, c2 number invisible);
alter table pt exchange partition M1 with table nt INCLUDING INDEXES WITHOUT VALIDATION;
drop table pt;
drop table nt;
drop table employees;
drop table emp_msg;
CREATE TABLE employees (id INT, name VARCHAR2(20), WORK_YEAR int);
CREATE TABLE emp_msg (id INT PRIMARY KEY, name VARCHAR2(20), address VARCHAR2(100));
CREATE OR REPLACE TRIGGER tri_emp_msg BEFORE INSERT OR UPDATE OR DELETE ON emp_msg
FOR EACH ROW
BEGIN
IF INSERTING THEN
INSERT INTO employees VALUES (:NEW.id, :NEW.name, 0);
ELSIF DELETING THEN
DELETE FROM employees WHERE id = :OLD.id;
ELSE 
UPDATE employees SET name = :NEW.name WHERE id = :NEW.id;
END IF;
END;
/
CREATE TABLE pt (id INT PRIMARY KEY, name VARCHAR2(20), address VARCHAR2(100)) partition by range(id) (partition M1  VALUES LESS THAN (5), partition M2 VALUES LESS THAN (10), partition M3 VALUES LESS THAN (1000));
alter table pt exchange partition M1 with table emp_msg INCLUDING INDEXES WITHOUT VALIDATION;
drop table pt;
drop table emp_msg;
drop table employees;
drop table pt;
drop table nt;
CREATE TABLE pt (c1 int, log int DEFAULT 1) partition by range(c1) (partition M1  VALUES LESS THAN (5), partition M2 VALUES LESS THAN (10), partition M3 VALUES LESS THAN (1000));
CREATE TABLE nt(c1 int, log int DEFAULT 1);
INSERT INTO nt (c1) VALUES (1);
INSERT INTO pt (c1) VALUES (1);
INSERT INTO nt (c1) VALUES (2);
INSERT INTO pt (c1) VALUES (2);
INSERT INTO nt (c1) VALUES (3);
INSERT INTO pt (c1) VALUES (3);
INSERT INTO nt (c1) VALUES (4);
INSERT INTO pt (c1) VALUES (4);
INSERT INTO nt (c1) VALUES (5);
INSERT INTO pt (c1) VALUES (5);
select * from pt order by c1;
C1	LOG
1	1
2	1
3	1
4	1
5	1
select * from nt order by c1;
C1	LOG
1	1
2	1
3	1
4	1
5	1
alter table pt exchange partition M1 with table nt INCLUDING INDEXES WITHOUT VALIDATION;
CREATE OR REPLACE PROCEDURE pro 
IS
BEGIN
INSERT INTO nt (c1) VALUES (100);
INSERT INTO pt (c1) VALUES (100);
END;
/
call pro();
select * from nt order by c1;
C1	LOG
1	1
2	1
3	1
4	1
100	1
select * from pt order by c1;
C1	LOG
1	1
2	1
3	1
4	1
5	1
5	1
100	1
drop table pt;
drop table nt;
drop table obdept;
drop table partitioned_obdept;
CREATE TABLE obdept(  
deptno           NUMBER(10,0),
dname            VARCHAR(15),  
loc            VARCHAR(20)
);
CREATE TABLE partitioned_obdept(  
deptno           NUMBER(10,0),  
dname            VARCHAR(15),  
loc              VARCHAR(20)
)partition by range(deptno) (partition M1  VALUES LESS THAN (5), partition M2 VALUES LESS THAN (10), partition M3 VALUES LESS THAN (1000));
insert into partitioned_obdept values(1,1,1);
insert into partitioned_obdept values(2,1,1);
insert into partitioned_obdept values(3,1,1);
insert into partitioned_obdept values(4,1,1);
insert into partitioned_obdept values(5,1,1);
insert into partitioned_obdept values(6,1,1);
insert into partitioned_obdept values(7,1,1);
insert into partitioned_obdept values(8,1,1);
insert into partitioned_obdept values(9,1,1);
Select * from partitioned_obdept order by deptno;
DEPTNO	DNAME	LOC
1	1	1
2	1	1
3	1	1
4	1	1
5	1	1
6	1	1
7	1	1
8	1	1
9	1	1
Select * from obdept order by deptno;
DEPTNO	DNAME	LOC
alter table partitioned_obdept exchange partition M1 with table obdept INCLUDING INDEXES WITHOUT VALIDATION;
Select * from partitioned_obdept order by deptno;
DEPTNO	DNAME	LOC
5	1	1
6	1	1
7	1	1
8	1	1
9	1	1
Select * from obdept order by deptno;
DEPTNO	DNAME	LOC
1	1	1
2	1	1
3	1	1
4	1	1
CREATE OR REPLACE PACKAGE obdemo_pack
IS
obDeptRec obdept%ROWTYPE;
FUNCTION add_obdept(dept_no NUMBER, dept_name VARCHAR2, location VARCHAR2)
RETURN NUMBER;
END obdemo_pack;
/
CREATE OR REPLACE PACKAGE BODY obdemo_pack
IS 
FUNCTION add_obdept(dept_no NUMBER, dept_name VARCHAR2, location VARCHAR2)
RETURN NUMBER
IS 
deptno_remaining EXCEPTION;
PRAGMA EXCEPTION_INIT(deptno_remaining, -1);  -- -1 是违反唯一约束条件的错误代码 
BEGIN
INSERT INTO obdept VALUES(dept_no, dept_name, location);
IF SQL%FOUND THEN
RETURN 1;
END IF;
EXCEPTION
WHEN deptno_remaining THEN 
RETURN 0;
WHEN OTHERS THEN
RETURN -1;
END add_obdept;
BEGIN
Null;
END obdemo_pack;
/
DECLARE
Var NUMBER;
BEGIN
Var := obdemo_pack.add_obdept(900,'Administration', 'Beijing');
IF var =-1 THEN
DBMS_OUTPUT.PUT_LINE(SQLCODE||'----'||SQLERRM);
ELSIF var =0 THEN
DBMS_OUTPUT.PUT_LINE('该部门记录已经存在！');
ELSE
DBMS_OUTPUT.PUT_LINE('添加记录成功！');
END IF;
END;
/
Select * from partitioned_obdept order by deptno;
DEPTNO	DNAME	LOC
5	1	1
6	1	1
7	1	1
8	1	1
9	1	1
Select * from obdept order by deptno;
DEPTNO	DNAME	LOC
1	1	1
2	1	1
3	1	1
4	1	1
900	Administration	Beijing
drop table obdept;
drop table partitioned_obdept;
CREATE TABLE t1 (id INT,  name VARCHAR(20));
INSERT INTO t1 VALUES (1, 'name1');
CREATE TABLE t2 (id INT, age INT);
INSERT INTO t2 VALUES (1, 23);
CREATE VIEW nt AS SELECT name, age FROM t1, t2 WHERE t1.id = t2.id;
create table pt (name VARCHAR(20), age INT) partition by range(age)(partition M1  VALUES LESS THAN (5), partition M2 VALUES LESS THAN (10), partition M3 VALUES LESS THAN (1000));
alter table pt exchange partition M1 with table nt INCLUDING INDEXES WITHOUT VALIDATION;
ERROR 0A000: internal error code, arguments: -4007, alter table type not supported
drop table t1;
drop table t2;
drop view nt;
drop table pt;
create table pt (c1 int, c2 int, primary key(c1)) partition by range(c1)(partition M1  VALUES LESS THAN (5), partition M2 VALUES LESS THAN (10), partition M3 VALUES LESS THAN (1000));
create table nt (c1 int, c2 int, primary key(c1, c2));
alter table pt exchange partition M1 with table nt INCLUDING INDEXES WITHOUT VALIDATION;
ERROR HY000: index mismatch for tables in ALTER TABLE EXCHANGE PARTITION
drop table pt;
drop table nt;
create table pt (c1 int, c2 int) partition by range(c1)(partition M1  VALUES LESS THAN (5), partition M2 VALUES LESS THAN (10), partition M3 VALUES LESS THAN (1000));
create table nt (c1 int, c2 int);
create index idx on nt(c2);
alter table pt exchange partition M1 with table nt INCLUDING INDEXES WITHOUT VALIDATION;
ERROR HY000: index mismatch for tables in ALTER TABLE EXCHANGE PARTITION
drop table pt;
drop table nt;
create table pt(c1 int generated always as identity, c2 int)partition by range(c1)(partition M1  VALUES LESS THAN (5), partition M2 VALUES LESS THAN (10), partition M3 VALUES LESS THAN (1000));
create table nt(c1 int, c2 int);
alter table pt exchange partition M1 with table nt INCLUDING INDEXES WITHOUT VALIDATION;
ERROR 0A000: internal error code, arguments: -4007, exchanging partition tables have identity column not supported
drop table pt;
drop table nt;
create table pt (c1 int, c2 int) partition by range(c1)(partition M1  VALUES LESS THAN (5), partition M2 VALUES LESS THAN (10), partition M3 VALUES LESS THAN (1000));
create table nt (c1 int, c2 int);
ALTER TABLE nt set READ ONLY;
alter table pt exchange partition M1 with table nt INCLUDING INDEXES WITHOUT VALIDATION;
ERROR HY000: internal error code, arguments: -4179, update operation not allowed
drop table pt;
drop table nt;
create table pt (c1 number, c2 number) partition by range(c1) (partition M1  VALUES LESS THAN (5), partition M2 VALUES LESS THAN (10), partition M3 VALUES LESS THAN (1000));
create table nt (c1 number, c2 number);
alter table pt compress basic;
alter table nt compress compress for oltp;
alter table pt exchange partition M1 with table nt INCLUDING INDEXES WITHOUT VALIDATION;
ERROR HY000: internal error code, arguments: -4773, Non matching attribute 'ROW_FORMAT' between partition and table
drop table pt;
drop table nt;
create table pt (c1 int, c2 int) partition by range(c1) (partition M1  VALUES LESS THAN (5), partition M2 VALUES LESS THAN (10), partition M3 VALUES LESS THAN (1000));
create table nt (c1 int, c2 int);
ALTER TABLE pt BLOCK_SIZE = 2048;
ALTER TABLE nt BLOCK_SIZE = 1024;
alter table pt exchange partition M1 with table nt INCLUDING INDEXES WITHOUT VALIDATION;
ERROR HY000: internal error code, arguments: -4772, Tables have different definitions
drop table pt;
drop table nt;
drop TABLEGROUP myTableGroup1;
drop TABLEGROUP myTableGroup2;
CREATE TABLEGROUP myTableGroup1;
CREATE TABLEGROUP myTableGroup2;
create table pt (c1 int, c2 int) TABLEGROUP = myTableGroup1 partition by range(c1) (partition M1  VALUES LESS THAN (5), partition M2 VALUES LESS THAN (10), partition M3 VALUES LESS THAN (1000));
create table nt (c1 int, c2 int) TABLEGROUP = myTableGroup2;
alter table pt exchange partition M1 with table nt INCLUDING INDEXES WITHOUT VALIDATION;
ERROR HY000: internal error code, arguments: -4772, Tables have different definitions
drop table pt;
drop table nt;
create table pt (c1 int, c2 int) partition by range(c1) (partition M1  VALUES LESS THAN (5), partition M2 VALUES LESS THAN (10), partition M3 VALUES LESS THAN (1000));
create table nt (c1 int, c2 int) duplicate_scope='cluster';
alter table pt exchange partition M1 with table nt INCLUDING INDEXES WITHOUT VALIDATION;
ERROR HY000: internal error code, arguments: -4179, exchange partition in duplicate tables not allowed
drop table pt;
drop table nt;
create table pt(c1 number, c2 char(10), c3 number) partition by range(c1)(partition M1 values less than(10), partition M2 values less than(100));
create table nt(c1 char(10), c2 number, c3 number);
alter table pt exchange partition M1 with table nt including indexes without validation;
ERROR HY000: column type or size mismatch in ALTER TABLE EXCHANGE PARTITION
drop table nt;
create table nt(c2 char(10), c1 number, c3 number);
alter table pt exchange partition M1 with table nt including indexes without validation;
ERROR HY000: column type or size mismatch in ALTER TABLE EXCHANGE PARTITION
drop table nt;
create table nt(c3 number, c2 char(10), c1 number);
alter table pt exchange partition M1 with table nt including indexes without validation;
ERROR HY000: column type or size mismatch in ALTER TABLE EXCHANGE PARTITION
drop table nt;
create table nt(c1 number, c2 char(10), c3 number);
insert into pt(c1, c2, c3) values(50, 51, 52);
insert into nt(c3, c2, c1) values(60, 61, 62);
select * from pt;
C1	C2	C3
50	51        	52
select * from nt;
C1	C2	C3
62	61        	60
alter table pt exchange partition M1 with table nt including indexes without validation;
select * from pt;
C1	C2	C3
62	61        	60
50	51        	52
select * from nt;
C1	C2	C3
drop table pt;
drop table nt;
create table pt(c1 number, c2 char(10), c3 number) partition by range(c1)(partition M1 values less than(10), partition M2 values less than(100));
create table nt(c1 number, c2 char(10), C3 number);
alter table pt exchange partition M1 with table nt including indexes without validation;
drop table pt;
drop table nt;
create table pt(c1 number, c2 char(10), c3 number generated always as (c1+10), c4 char(20), c5 number generated always as(c2+100)) partition by range(c1)(partition M1 values less than(10), partition M2 values less than(100));
create table nt(c1 number, c2 char(10), c3 number generated always as (c1+1), c4 number generated always as(c2+1), c5 char(20));
alter table pt exchange partition M1 with table nt including indexes without validation;
ERROR HY000: column type or size mismatch in ALTER TABLE EXCHANGE PARTITION
drop table nt;
create table nt(c1 number, c2 char(10), c3 number generated always as (c1+1), c4 char(20), c5 number generated always as(c2+10));
alter table pt exchange partition M1 with table nt including indexes without validation;
drop table pt;
drop table nt;
create table pt (c1 int, c2 int, primary key (c1)) partition by range(c1) (partition M1  VALUES LESS THAN (5), partition M2 VALUES LESS THAN (10), partition M3 VALUES LESS THAN (1000));
create table nt (c1 int, c2 int);
alter table pt exchange partition M1 with table nt including indexes without validation;
ERROR HY000: index mismatch for tables in ALTER TABLE EXCHANGE PARTITION
drop table pt;
drop table nt;
create table pt(c1 int, c2 char(10), primary key(c1,c2)) partition by range(c1) (partition M1 values less than(10), partition M2 values less than(100));
create table nt(c1 int, C2 char(10), primary key(c1));
alter table pt exchange partition M1 with table nt including indexes without validation;
ERROR HY000: index mismatch for tables in ALTER TABLE EXCHANGE PARTITION
drop table pt;
drop table nt;
create table pt (c1 int, c2 char(20)) partition by range(c1) (partition M1  VALUES LESS THAN (5), partition M2 VALUES LESS THAN (10), partition M3 VALUES LESS THAN (1000));
create table nt (c1 int, c2 char(10));
alter table pt exchange partition M1 with table nt including indexes without validation;
ERROR HY000: column type or size mismatch in ALTER TABLE EXCHANGE PARTITION
drop table pt;
drop table nt;
drop table pt_decimal_test1;
drop table nt_decimal_test1;
CREATE TABLE pt_decimal_test1 (c1 INT PRIMARY KEY , c2 decimal(10,5))PARTITION BY RANGE(c1) (
PARTITION p1 VALUES LESS THAN (10),
PARTITION p2 VALUES LESS THAN (20),
PARTITION p3 VALUES LESS THAN (30));
CREATE TABLE nt_decimal_test1 (c1 INT primary KEY, c2 decimal(10,5));
ALTER TABLE pt_decimal_test1 EXCHANGE PARTITION p2 WITH TABLE nt_decimal_test1 including indexes without validation;
drop table nt_decimal_test1;
CREATE TABLE nt_decimal_test1 (c1 INT primary KEY, c2 decimal(10,3));
ALTER TABLE pt_decimal_test1 EXCHANGE PARTITION p2 WITH TABLE nt_decimal_test1 including indexes without validation;
ERROR HY000: column type or size mismatch in ALTER TABLE EXCHANGE PARTITION
drop table pt_decimal_test1;
drop table nt_decimal_test1;
create table pt (c1 int, c2 TIMESTAMP(3)) partition by range(c1) (partition M1  VALUES LESS THAN (5), partition M2 VALUES LESS THAN (10), partition M3 VALUES LESS THAN (1000));
create table nt (c1 int, c2 TIMESTAMP(2));
alter table pt exchange partition M1 with table nt including indexes without validation;
ERROR HY000: column type or size mismatch in ALTER TABLE EXCHANGE PARTITION
drop table nt;
create table nt (c1 int, c2 TIMESTAMP(3));
alter table pt exchange partition M1 with table nt including indexes without validation;
drop table pt;
drop table nt;
create table pt (c1 int, c2 int not null) partition by range(c1) (partition M1  VALUES LESS THAN (5), partition M2 VALUES LESS THAN (10), partition M3 VALUES LESS THAN (1000));
create table nt (c1 int, c2 int);
alter table pt exchange partition M1 with table nt including indexes without validation;
ERROR HY000: column type or size mismatch in ALTER TABLE EXCHANGE PARTITION
drop table nt;
create table nt (c1 int, c2 int not null);
alter table pt exchange partition M1 with table nt including indexes without validation;
drop table pt;
drop table nt;
create table pt(c1 int generated always as identity, c2 int) partition by range(c1)(partition M1  VALUES LESS THAN (5), partition M2 VALUES LESS THAN (10), partition M3 VALUES LESS THAN (1000));
create table nt(c1 int , c2 int);
alter table pt exchange partition M1 with table nt including indexes without validation;
ERROR 0A000: internal error code, arguments: -4007, exchanging partition tables have identity column not supported
drop table nt;
create table nt(c1 int generated always as identity, c2 int);
alter table pt exchange partition M1 with table nt including indexes without validation;
ERROR 0A000: internal error code, arguments: -4007, exchanging partition tables have identity column not supported
drop table pt;
drop table nt;
CREATE TABLE pt(c1 INT PRIMARY KEY, c2 int DEFAULT 2) PARTITION BY RANGE(c1) (
PARTITION p1 VALUES LESS THAN (10),
PARTITION p2 VALUES LESS THAN (20),
PARTITION p3 VALUES LESS THAN (30));
CREATE TABLE nt (c1 INT primary KEY, c2 int DEFAULT 2);
alter table pt exchange partition p1 with table nt including indexes without validation;
drop table nt;
CREATE TABLE nt (c1 INT primary KEY,c2 int DEFAULT -3);
alter table pt exchange partition p1 with table nt including indexes without validation;
ERROR HY000: column type or size mismatch in ALTER TABLE EXCHANGE PARTITION
drop table pt;
drop table nt;
CREATE TABLE pt(c1 INT PRIMARY KEY, c2 int DEFAULT (10+2)) PARTITION BY RANGE(c1) (
PARTITION p1 VALUES LESS THAN (10),
PARTITION p2 VALUES LESS THAN (20),
PARTITION p3 VALUES LESS THAN (30));
CREATE TABLE nt (c1 INT primary KEY, c2 int DEFAULT 12);
alter table pt exchange partition p1 with table nt including indexes without validation;
ERROR HY000: column type or size mismatch in ALTER TABLE EXCHANGE PARTITION
drop table pt;
drop table nt;
create table pt (c1 int not null, c2 int, c3 blob) partition by range(c1)(partition M1  VALUES LESS THAN (5), partition M2 VALUES LESS THAN (10), partition M3 VALUES LESS THAN (1000));
create table nt (c1 int not null, c2 int, c3 int);
alter table pt exchange partition M1 with table nt including indexes without validation;
ERROR HY000: column type or size mismatch in ALTER TABLE EXCHANGE PARTITION
drop table nt;
create table nt (c1 int not null, c2 int, c3 blob);
alter table pt exchange partition M1 with table nt including indexes without validation;
drop table pt;
drop table nt;
create table pt (c1 int not null, c2 int, c3 XMLType) partition by range(c1)(partition M1  VALUES LESS THAN (5), partition M2 VALUES LESS THAN (10), partition M3 VALUES LESS THAN (1000));
create table nt (c1 int not null, c2 int, c3 int);
alter table pt exchange partition M1 with table nt including indexes without validation;
ERROR HY000: column type or size mismatch in ALTER TABLE EXCHANGE PARTITION
drop table nt;
create table nt (c1 int not null, c2 int, c3 XMLType);
alter table pt exchange partition M1 with table nt including indexes without validation;
drop table pt;
drop table nt;
create table pt(c1 int, c2 char(10)) partition by range(c1)(partition M1 values less than(10), partition M2 values less than(100));
create table nt(c1 int, c2 char(10));
create unique index idx on pt(c1, c2) local;
create unique index idx2 on nt(c1, c2) local;
insert into pt values(1, 1);
insert into nt values(2, 2);
select * from pt order by c1;
C1	C2
1	1         
select * from nt order by c1;
C1	C2
2	2         
alter table pt exchange partition M1 with table nt including indexes without validation;
drop table pt;
drop table nt;
create table pt(c1 int, c2 char(10)) partition by range(c1)(partition M1 values less than(10), partition M2 values less than(100));
create table nt(c1 int, c2 char(10));
create unique index idx on pt(c1, c2);
create index idx1 on nt(c1, c2);
alter table pt exchange partition M1 with table nt including indexes without validation;
ERROR HY000: index mismatch for tables in ALTER TABLE EXCHANGE PARTITION
drop table pt;
drop table nt;
create table pt(c1 int, c2 char(10)) partition by range(c1)(partition M1 values less than(10), partition M2 values less than(100));
create table nt(c1 int, c2 char(10));
create index idx on pt(c1, c2);
create index idx1 on nt(c1);
alter table pt exchange partition M1 with table nt including indexes without validation;
ERROR HY000: index mismatch for tables in ALTER TABLE EXCHANGE PARTITION
drop table pt;
drop table nt;
create table pt(c1 int, c2 char(10)) partition by range(c1)(partition M1 values less than(10), partition M2 values less than(100));
create table nt(c1 int, c2 char(10));
create index idx on pt(c1, c2) global;
create index idx1 on pt(c1) local;
create index idx2 on nt(c1) local;
alter table pt exchange partition M1 with table nt including indexes without validation;
drop table pt;
drop table nt;
create table pt(c1 int, c2 char(10)) partition by range(c1)(partition M1 values less than(10), partition M2 values less than(100));
create table nt(c1 int, c2 char(10));
create index idx on pt(c1, c2) global;
create index idx1 on nt(c1, c2) global;
alter table pt exchange partition M1 with table nt including indexes without validation;
ERROR HY000: index mismatch for tables in ALTER TABLE EXCHANGE PARTITION
drop table pt;
drop table nt;
create table pt(c1 int, c2 char(10), unique (c1)) partition by range(c1)(partition M1 values less than(10), partition M2 values less than(100));
create table nt(c1 int, c2 char(10), unique (c1));
alter table pt exchange partition M1 with table nt including indexes without validation;
ERROR HY000: index mismatch for tables in ALTER TABLE EXCHANGE PARTITION
drop table pt;
drop table nt;
create table pt(c1 int primary key, c2 char(10), c3 int, unique(c1, c3)) partition by range(c1)(partition M1 values less than(60), partition M2 values less than(100));
create table nt(c1 int primary key, c2 char(10), c3 int, unique(c1, c3));
insert into pt values(50, 50, 50);
insert into nt values(60, 60, 60);
select * from pt order by c1;
C1	C2	C3
50	50        	50
select * from nt order by c1;
C1	C2	C3
60	60        	60
alter table pt exchange partition M1 with table nt including indexes without validation;
ERROR HY000: index mismatch for tables in ALTER TABLE EXCHANGE PARTITION
select * from pt order by c1;
C1	C2	C3
50	50        	50
select * from nt order by c1;
C1	C2	C3
60	60        	60
drop table pt;
drop table nt;
create table pt(c1 int primary key, c2 char(10), c3 int, unique(c1, c3)) partition by range(c1)(partition M1 values less than(60), partition M2 values less than(100));
create table nt(c1 int primary key, c2 char(10), c3 int);
alter table pt exchange partition M1 with table nt including indexes without validation;
drop table pt;
drop table nt;
create table pt(c1 int primary key, c2 char(10), c3 int) partition by range(c1)(partition M1 values less than(60), partition M2 values less than(100));
create table nt(c1 int primary key, c2 char(10), c3 int, unique(c1, c3));
alter table pt exchange partition M1 with table nt including indexes without validation;
ERROR HY000: index mismatch for tables in ALTER TABLE EXCHANGE PARTITION
drop table pt;
drop table nt;
create table pt(c1 int primary key, c2 char(10), c3 int) partition by range(c1)(partition M1 values less than(60), partition M2 values less than(100));
create table nt(c1 int primary key, c2 char(10), c3 int, unique(c1, c3));
create unique index pt_test on pt(c3,c1) local;
alter table pt exchange partition M1 with table nt including indexes without validation;
ERROR HY000: index mismatch for tables in ALTER TABLE EXCHANGE PARTITION
drop table pt;
drop table nt;
create table pt(c1 int primary key, c2 char(10), c3 int) partition by range(c1)(partition M1 values less than(60), partition M2 values less than(100));
create table nt(c1 int primary key, c2 char(10), c3 int, unique(c1, c3));
create unique index pt_test on pt(c1,c3) local;
alter table pt exchange partition M1 with table nt including indexes without validation;
drop table pt;
drop table nt;
create table pt(c1 int, c2 char(10), c3 int not null) partition by range(c1)(partition M1 values less than(10), partition M2 values less than(100));
create table nt(c1 int, c2 char(10) not null, c3 int);
alter table pt exchange partition M1 with table nt including indexes without validation;
ERROR HY000: column type or size mismatch in ALTER TABLE EXCHANGE PARTITION
drop table pt;
drop table nt;
create table pt(c1 int, c2 char(10), c3 int not null) partition by range(c1)(partition M1 values less than(10), partition M2 values less than(100));
create table nt(c1 int, c2 char(10), c3 int);
alter table pt exchange partition M1 with table nt including indexes without validation;
ERROR HY000: column type or size mismatch in ALTER TABLE EXCHANGE PARTITION
drop table pt;
create table pt(c1 int, c2 char(10) not null, c3 int) partition by range(c1)(partition M1 values less than(10), partition M2 values less than(100));
alter table pt exchange partition M1 with table nt including indexes without validation;
ERROR HY000: column type or size mismatch in ALTER TABLE EXCHANGE PARTITION
drop table pt;
drop table nt;
create table pt(c1 int, c2 char(10), c3 int default null) partition by range(c1)(partition M1 values less than(10), partition M2 values less than(100));
create table nt(c1 int, c2 char(10), c3 int default null);
alter table pt exchange partition M1 with table nt including indexes without validation;
alter table nt modify c3 int not null;
alter table pt exchange partition M1 with table nt including indexes without validation;
ERROR HY000: column type or size mismatch in ALTER TABLE EXCHANGE PARTITION
drop table pt;
drop table nt;
CREATE TABLE pt (c1 int, c2 int, c3 int, primary key(c1, c3)) partition by range(c1) (partition M1  VALUES LESS THAN (5), partition M2 VALUES LESS THAN (10), partition M3 VALUES LESS THAN (1000));
CREATE TABLE nt (c1 int, c2 int, c3 int, primary key(c1, c3));
alter table pt exchange partition M1 with table nt including indexes without validation;
Alter table pt modify primary key(c1,c2);
Alter table nt modify primary key(c1,c2);
alter table pt exchange partition M1 with table nt including indexes without validation;
drop table pt;
drop table nt;
create table pt(c1 int, c2 char(10), c3 int, check(c1=50)) partition by range(c1)(partition M1 values less than(10), partition M2 values less than(100));
create table nt(c1 int, c2 char(10), c3 int, check(c2=c3));
alter table pt exchange partition M1 with table nt including indexes without validation;
ERROR HY000: CHECK constraint mismatch in ALTER TABLE EXCHANGE PARTITION
drop table pt;
drop table nt;
create table pt(c1 int, c2 char(10), c3 int) partition by range(c1)(partition M1 values less than(10), partition M2 values less than(100));
create table nt(c1 int, c2 char(10), c3 int);
alter table pt add constraint pt_constraint check(c2=50);
alter table nt add constraint nt_constraint check(c2=50);
alter table pt disable constraint pt_constraint;
alter table pt exchange partition M1 with table nt including indexes without validation;
ERROR HY000: CHECK constraint mismatch in ALTER TABLE EXCHANGE PARTITION
drop table pt;
drop table nt;
create table pt(c1 int, c2 char(10), c3 int, check(c1=50)) partition by range(c1)(partition M1 values less than(10), partition M2 values less than(100));
create table nt(c1 int, c2 char(10), c3 int, check(c1=50));
insert into pt values(50, 50, 50);
insert into nt values(50, 50, 50);
select * from pt order by c1;
C1	C2	C3
50	50        	50
select * from nt order by c1;
C1	C2	C3
50	50        	50
alter table pt exchange partition M1 with table nt including indexes without validation;
select * from pt order by c1;
C1	C2	C3
50	50        	50
50	50        	50
select * from nt order by c1;
C1	C2	C3
drop table pt;
drop table nt;
drop table exchange_pt_test;
drop table exchange_nt_test;
CREATE TABLE exchange_pt_test(
c1 NUMBER(10,2),
c2 varchar2(30)
) PARTITION BY RANGE (c1)
(
PARTITION c1_15 VALUES LESS THAN (15),
PARTITION c1_35 VALUES LESS THAN (35),
PARTITION c1_50 VALUES LESS THAN (50)
);
insert into exchange_pt_test(c1) values(1);
insert into exchange_pt_test(c1) values(32);
insert into exchange_pt_test(c1) values(45);
CREATE TABLE exchange_nt_test(
c1 NUMBER(10,2),
c2 varchar2(30)
);
insert into exchange_nt_test(c1) values (3);
insert into exchange_nt_test(c1) values (18);
insert into exchange_nt_test(c1) values (33);
ALTER TABLE exchange_pt_test EXCHANGE PARTITION c1_15 WITH TABLE exchange_nt_test INCLUDING INDEXES WITHOUT VALIDATION;
ALTER TABLE exchange_pt_test MODIFY c1 NUMBER(10,2) UNIQUE;
ALTER TABLE exchange_pt_test EXCHANGE PARTITION c1_15 WITH TABLE exchange_nt_test INCLUDING INDEXES WITHOUT VALIDATION;
drop table exchange_pt_test;
drop table exchange_nt_test;
CREATE TABLE exchange_pt_test(
c1 NUMBER(10,2),
c2 varchar2(30)
)
PARTITION BY RANGE (c1)
(
PARTITION c1_15 VALUES LESS THAN (15) COMPRESS basic,
PARTITION c1_35 VALUES LESS THAN (35) COMPRESS basic,
PARTITION c1_50 VALUES LESS THAN (50) COMPRESS basic
);
insert into exchange_pt_test values(1,1);
CREATE TABLE exchange_nt_test(
c1 NUMBER(10,2),
c2 varchar2(30)
);
insert into exchange_nt_test values (3,3);
ALTER TABLE exchange_pt_test ADD CONSTRAINT pt_check CHECK (c1 > 0);
ALTER TABLE exchange_nt_test ADD CONSTRAINT nt_check CHECK (c1 > 0);
ALTER TABLE exchange_pt_test MODIFY CONSTRAINT pt_check DISABLE;
ALTER TABLE exchange_pt_test EXCHANGE PARTITION c1_15 WITH TABLE exchange_nt_test INCLUDING INDEXES WITHOUT VALIDATION;
ERROR HY000: CHECK constraint mismatch in ALTER TABLE EXCHANGE PARTITION
drop table pt;
drop table nt;
drop table t0;
drop table t1;
create table nt(c1 int primary key, c2 int);
create table t0(c1 int primary key, c2 int);
create table pt(c1 int primary key, c2 int, constraint cs_pt foreign key (c2) references t0(c1)) partition by range(c1) (partition M1 values less than(10), partition M2 values less than(100));
alter table pt exchange partition M1 with table nt including indexes without validation;
ERROR 0A000: internal error code, arguments: -4007, exchanging partition tables have foreign key are not supported
drop table nt;
drop table pt;
drop table t0;
create table pt(c1 int primary key, c2 int) partition by range(c1) (partition M1 values less than(10), partition M2 values less than(100));
create table nt(c1 int primary key, c2 int);
create table t0(c1 int, c2 int, foreign key (c1) references pt(c1));
alter table pt exchange partition M1 with table nt including indexes without validation;
ERROR 0A000: internal error code, arguments: -4007, exchanging partition tables have foreign key are not supported
drop table t0;
drop table pt;
drop table nt;
create table t0(c1 int primary key, c2 int);
create table nt(c1 int primary key, c2 int, constraint cs_nt foreign key (c2) references t0(c1));
create table pt(c1 int primary key, c2 int) partition by range(c1) (partition M1 values less than(10), partition M2 values less than(100));
alter table pt exchange partition M1 with table nt including indexes without validation;
ERROR 0A000: internal error code, arguments: -4007, exchanging partition tables have foreign key are not supported
drop table nt;
drop table t0;
drop table pt;
create table pt(c1 int primary key, c2 int) partition by range(c1) (partition M1 values less than(10), partition M2 values less than(100));
create table nt(c1 int primary key, c2 int);
create table t0(c1 int, c2 int, foreign key (c1) references nt(c1));
alter table pt exchange partition M1 with table nt including indexes without validation;
ERROR 0A000: internal error code, arguments: -4007, exchanging partition tables have foreign key are not supported
drop table t0;
drop table pt;
drop table nt;
create table pt(c1 int primary key, c2 int) partition by range(c1) (partition M1 values less than(10), partition M2 values less than(100));
create table nt(c1 int primary key, c2 int);
create table t0(c1 int, c2 int, foreign key (c1) references nt(c1));
create table t1(c1 int, c2 int, foreign key (c1) references pt(c1));
alter table pt exchange partition M1 with table nt including indexes without validation;
ERROR 0A000: internal error code, arguments: -4007, exchanging partition tables have foreign key are not supported
drop table t0;
drop table t1;
drop table pt;
drop table nt;
CREATE TABLE pt(col1 NUMBER, col2 VARCHAR2(30)) partition by range(col1) (partition M1 values less than(10), partition M2 values less than(100)) WITH COLUMN GROUP(all columns, each column);
CREATE TABLE nt(col1 NUMBER, col2 VARCHAR2(30)) WITH COLUMN GROUP(all columns, each column);
alter table pt exchange partition M1 with table nt including indexes without validation;
drop table pt;
drop table nt;
CREATE TABLE pt(col1 NUMBER, col2 VARCHAR2(30)) partition by range(col1) (partition M1 values less than(10), partition M2 values less than(100)) WITH COLUMN GROUP(all columns, each column);
CREATE TABLE nt(col1 NUMBER, col2 VARCHAR2(30));
alter table pt exchange partition M1 with table nt including indexes without validation;
ERROR HY000: internal error code, arguments: -4773, Non matching attribute 'COLUMN_STORAGE_FORMAT' between partition and table
drop table pt;
drop table nt;
CREATE TABLE pt(col1 NUMBER, col2 VARCHAR2(30)) partition by range(col1) (partition M1 values less than(10), partition M2 values less than(100)) WITH COLUMN GROUP(all columns, each column);
CREATE TABLE nt(col1 NUMBER, col2 VARCHAR2(30)) WITH COLUMN GROUP(all columns);
alter table pt exchange partition M1 with table nt including indexes without validation;
ERROR HY000: internal error code, arguments: -4773, Non matching attribute 'COLUMN_STORAGE_FORMAT' between partition and table
drop table nt;
CREATE TABLE nt(col1 NUMBER, col2 VARCHAR2(30)) WITH COLUMN GROUP(each column);
alter table pt exchange partition M1 with table nt including indexes without validation;
ERROR HY000: internal error code, arguments: -4773, Non matching attribute 'COLUMN_STORAGE_FORMAT' between partition and table
drop table pt;
drop table nt;
CREATE TABLE pt(col1 NUMBER, col2 VARCHAR2(30)) partition by range(col1) (partition M1 values less than(10), partition M2 values less than(100));
CREATE TABLE nt(col1 NUMBER, col2 VARCHAR2(30));
alter table pt add column group (each column);
alter table nt add column group (each column);
alter table pt add column group (all columns);
alter table nt add column group (all columns);
alter table pt exchange partition M1 with table nt including indexes without validation;
drop table pt;
drop table nt;
CREATE TABLE pt(col1 NUMBER, col2 VARCHAR2(30)) partition by range(col1) (partition M1 values less than(10), partition M2 values less than(100));
CREATE TABLE nt(col1 NUMBER, col2 VARCHAR2(30));
alter table pt add column group (each column);
alter table nt add column group (each column);
alter table pt add column group (all columns);
alter table nt add column group (all columns);
alter table nt drop column group (all columns);
alter table nt add column group (all columns);
alter table pt exchange partition M1 with table nt including indexes without validation;
drop table pt;
drop table nt;
CREATE TABLE pt(col1 NUMBER, col2 VARCHAR2(30)) partition by range(col1) (partition M1 values less than(10), partition M2 values less than(100));
CREATE TABLE nt(col1 NUMBER, col2 VARCHAR2(30));
alter table pt add column group (each column);
alter table pt add column group (all columns);
alter table nt add column group (all columns);
alter table nt add column group (each column);
alter table pt exchange partition M1 with table nt including indexes without validation;
ERROR HY000: internal error code, arguments: -4773, Non matching attribute 'COLUMN_STORAGE_FORMAT' between partition and table
drop table pt;
drop table nt;
create table pt (c1 int, c2 int) partition by range(c1) (partition M1  VALUES LESS THAN (5), partition M2 VALUES LESS THAN (10), partition M3 VALUES LESS THAN (1000));
create table nt (c1 int, c2 int) WITH COLUMN GROUP(all columns, each column);
alter table pt add COLUMN GROUP(all columns, each column);
alter table pt exchange partition M1 with table nt including indexes without validation;
alter table nt drop COLUMN GROUP(all columns, each column);
alter table pt exchange partition M1 with table nt including indexes without validation;
ERROR HY000: internal error code, arguments: -4773, Non matching attribute 'COLUMN_STORAGE_FORMAT' between partition and table
alter table nt add COLUMN GROUP(all columns, each column);
alter table pt exchange partition M1 with table nt including indexes without validation;
alter table pt drop COLUMN GROUP(all columns, each column);
alter table pt exchange partition M1 with table nt including indexes without validation;
ERROR HY000: internal error code, arguments: -4773, Non matching attribute 'COLUMN_STORAGE_FORMAT' between partition and table
alter table pt add COLUMN GROUP(all columns, each column);
alter table pt exchange partition M1 with table nt including indexes without validation;
alter table pt drop COLUMN GROUP(all columns);
alter table pt exchange partition M1 with table nt including indexes without validation;
ERROR HY000: internal error code, arguments: -4773, Non matching attribute 'COLUMN_STORAGE_FORMAT' between partition and table
alter table pt add COLUMN GROUP(all columns);
alter table pt exchange partition M1 with table nt including indexes without validation;
ERROR HY000: internal error code, arguments: -4773, Non matching attribute 'COLUMN_STORAGE_FORMAT' between partition and table
drop table pt;
drop table nt;
create table pt (c1 int, c2 int) partition by range(c1) (partition M1  VALUES LESS THAN (5), partition M2 VALUES LESS THAN (10), partition M3 VALUES LESS THAN (1000));
create table nt (c1 int, c2 int) WITH COLUMN GROUP(all columns, each column);
alter table pt add COLUMN GROUP(all columns, each column);
alter table pt exchange partition M1 with table nt including indexes without validation;
alter table pt drop COLUMN GROUP(each column);
alter table pt add COLUMN GROUP(each column);
alter table pt exchange partition M1 with table nt including indexes without validation;
alter table pt drop COLUMN GROUP(all columns);
alter table pt add COLUMN GROUP(all columns);
alter table pt exchange partition M1 with table nt including indexes without validation;
ERROR HY000: internal error code, arguments: -4773, Non matching attribute 'COLUMN_STORAGE_FORMAT' between partition and table
drop table pt;
drop table nt;
create table pt (c1 int, c2 int) partition by range(c1) (partition M1  VALUES LESS THAN (5), partition M2 VALUES LESS THAN (10), partition M3 VALUES LESS THAN (1000));
create table nt (c1 int, c2 int);
alter table pt exchange partition M1 with table nt including indexes without validation;
alter table pt add COLUMN GROUP(each column);
alter table nt add COLUMN GROUP(each column);
alter table pt exchange partition M1 with table nt including indexes without validation;
alter table pt add COLUMN GROUP(all columns);
alter table nt add COLUMN GROUP(all columns);
alter table pt exchange partition M1 with table nt including indexes without validation;
alter table nt drop COLUMN GROUP(all columns);
alter table pt drop COLUMN GROUP(all columns);
alter table pt exchange partition M1 with table nt including indexes without validation;
alter table pt add COLUMN GROUP(all columns);
alter table nt add COLUMN GROUP(all columns);
alter table pt exchange partition M1 with table nt including indexes without validation;
alter table nt drop COLUMN GROUP(each column);
alter table pt drop COLUMN GROUP(each column);
alter table pt exchange partition M1 with table nt including indexes without validation;
alter table nt add COLUMN GROUP(each column);
alter table pt add COLUMN GROUP(each column);
alter table pt exchange partition M1 with table nt including indexes without validation;
drop table pt;
drop table nt;
create table pt (c1 number, c2 number) partition by range(c1) (partition M1  VALUES LESS THAN (5), partition M2 VALUES LESS THAN (10), partition M3 VALUES LESS THAN (1000));
create table nt (c1 number, c2 number);
INSERT INTO nt (c1) VALUES (3);
INSERT INTO nt (c1) VALUES (4);
INSERT INTO nt (c1) VALUES (5);
alter table pt exchange partition M1 with table nt INCLUDING INDEXES WITHOUT VALIDATION;
ALTER TABLE pt rename partition M1 TO M888;
select * from pt partition (M888) order by c1;
C1	C2
3	NULL
4	NULL
5	NULL
drop table heap;
drop table heap_incre;
CREATE TABLE heap( c1  char(10) default NULL, c2 date default NULL, c3 BINARY_DOUBLE  default NULL, c4  date default NULL, c5 int default null, c6 number default null, c7 nvarchar2(60), c8 raw(20) default null, c9 timestamp default null, c10 varchar(10) default null, c11 varchar2(20) default null, c12 blob default null) partition by range(c3) (partition p0 values less than (10),partition p1 values less than (20),partition p2 values less than (30),partition p3 values less than (MAXVALUE));
create unique index test42 on heap(c1,upper(c7),c3) local;
create index heap2 on heap(c10) reverse local;
CREATE TABLE heap_incre( c1  char(10) default NULL, c2 date default NULL, c3 BINARY_DOUBLE  default NULL, c4  date default NULL, c5 int default null, c6 number default null, c7 nvarchar2(60), c8 raw(20) default null, c9 timestamp default null, c10 varchar(10) default null, c11 varchar2(20) default null, c12 blob default null);
create unique index test412 on heap_incre(c1,upper(c7),c3) local;
create index heap12 on heap_incre(c10) reverse local;
ALTER TABLE heap EXCHANGE PARTITION p3 WITH TABLE heap_incre INCLUDING INDEXES WITHOUT VALIDATION;
drop  index heap12;
create index heap12 on heap_incre(c10) reverse local;
ALTER TABLE heap EXCHANGE PARTITION p3 WITH TABLE heap_incre INCLUDING INDEXES WITHOUT VALIDATION;
drop  index test42;
create unique index test42 on heap(c1,upper(c7));
drop  index test42;
create unique index test42 on heap(c1,upper(c7),c3) local;
ALTER TABLE heap EXCHANGE PARTITION p3 WITH TABLE heap_incre INCLUDING INDEXES WITHOUT VALIDATION;
drop table heap;
drop table heap_incre;
# 一级分区表与一级分区表交换，不支持
drop table t1;
drop table t2;
create table t1 (c1 int primary key, c2 int)
partition by hash(c1) partitions 5;
create table t2 (c1 int primary key, c2 int)
partition by hash(c1) partitions 5;
alter table t1 exchange partition p3 with table t2 INCLUDING INDEXES WITHOUT VALIDATION;
ERROR 0A000: internal error code, arguments: -4007, Exchange partition except composite-partitioned and partitioned table is not supported
drop table t1;
drop table t2;
# 二级分区表与二级分区表交换，不支持
drop table t1;
drop table t2;
create table t1 (c1 int primary key, c2 int)
partition by range(c1)
subpartition by hash(c1) subpartitions 5
(
partition p0 values less than (10),
partition p1 values less than (20),
partition p2 values less than (30),
Partition p3 values less than (MAXVALUE)
);
create table t2 (c1 int primary key, c2 int)
partition by range(c1)
subpartition by hash(c1) subpartitions 5
(
partition p0 values less than (10),
partition p1 values less than (20),
partition p2 values less than (30),
Partition p3 values less than (MAXVALUE)
);
alter table t1 exchange partition p1 with table t2 INCLUDING INDEXES WITHOUT VALIDATION;
ERROR 0A000: internal error code, arguments: -4007, Exchange partition except composite-partitioned and partitioned table is not supported
alter table t1 exchange partition p1sp3 with table t2 INCLUDING INDEXES WITHOUT VALIDATION;
ERROR 0A000: internal error code, arguments: -4007, Exchange partition except composite-partitioned and partitioned table is not supported
drop table t1;
drop table t2;
# 二级分区表与一级分区表交换，其中二级分区表的一级分区为hash分区，不支持
drop table t1;
drop table t2;
create table t1 (c1 int primary key, c2 int)
partition by hash(c1)
subpartition by hash(c1) subpartitions 5
(
partition p0,
partition p1,
partition p2,
partition p3,
partition p4,
partition p5,
partition p6,
partition p7,
partition p8,
partition p9
);
create table t2 (c1 int primary key, c2 int)
partition by hash(c1) partitions 5;
alter table t1 exchange partition p1 with table t2 INCLUDING INDEXES WITHOUT VALIDATION;
ERROR 0A000: internal error code, arguments: -4007, Exchange partition except range(columns) and list(columns) is not supported
alter table t1 exchange partition p1sp3 with table t2 INCLUDING INDEXES WITHOUT VALIDATION;
ERROR 0A000: internal error code, arguments: -4007, Exchange partition except range(columns) and list(columns) is not supported
drop table t1;
drop table t2;
# 二级分区表与一级分区表之间交换
drop table t1;
drop table t2;
create table t1 (c1 int primary key, c2 int)
partition by range(c1)
subpartition by hash(c1) subpartitions 5
(
partition p0 values less than (10),
partition p1 values less than (20),
partition p2 values less than (30),
Partition p3 values less than (MAXVALUE)
);
create table t2 (c1 int primary key, c2 int)
partition by hash(c1) partitions 5;
insert into t1 values (11, 30), (14, 40), (26, 150), (29, 160);
insert into t2 values (12, 20), (16, 110), (17, 170), (19, 120);
select * from t1 partition(p0);
C1	C2
select * from t1 partition(p1);
C1	C2
11	30
14	40
select * from t1 partition(p2);
C1	C2
26	150
29	160
select * from t1 partition(p3);
C1	C2
#一级分区表与二级分区表交换，不支持
alter table t2 exchange partition p1 with table t1 INCLUDING INDEXES WITHOUT VALIDATION;
ERROR 0A000: internal error code, arguments: -4007, Exchange partition except composite-partitioned and partitioned table is not supported
#二级分区表与一级分区表交换，成功
alter table t1 exchange partition p1 with table t2 INCLUDING INDEXES WITHOUT VALIDATION;
select * from t1 partition(p0);
C1	C2
select * from t1 partition(p1);
C1	C2
19	120
12	20
16	110
17	170
select * from t1 partition(p2);
C1	C2
26	150
29	160
select * from t1 partition(p3);
C1	C2
drop table t1;
drop table t2;
# 二级分区表与一级分区表之间交换，带索引
drop table t1;
drop table t2;
create table t1 (c1 int primary key, c2 int)
partition by range(c1)
subpartition by hash(c1) subpartitions 5
(
partition p0 values less than (10),
partition p1 values less than (20),
partition p2 values less than (30),
Partition p3 values less than (MAXVALUE)
);
create table t2 (c1 int primary key, c2 int)
partition by hash(c1) partitions 5;
create index k1 on t1(c1, c2) local;
create index k2 on t2(c1, c2) local;
insert into t1 values (11, 30), (14, 40), (26, 150), (29, 160);
insert into t2 values (12, 20), (16, 110), (17, 170), (19, 120);
select * from t1 partition(p0);
C1	C2
select * from t1 partition(p1);
C1	C2
11	30
14	40
select * from t1 partition(p2);
C1	C2
26	150
29	160
select * from t1 partition(p3);
C1	C2
set ob_enable_index_direct_select=1;
C1	C2
11	30
14	40
26	150
29	160
C1	C2
19	120
12	20
16	110
17	170
alter table t1 exchange partition p1 with table t2 INCLUDING INDEXES WITHOUT VALIDATION;
select * from t1 partition(p0);
C1	C2
select * from t1 partition(p1);
C1	C2
19	120
12	20
16	110
17	170
select * from t1 partition(p2);
C1	C2
26	150
29	160
select * from t1 partition(p3);
C1	C2
C1	C2
19	120
12	20
16	110
17	170
26	150
29	160
C1	C2
11	30
14	40
drop table t1;
drop table t2;
# 二级分区表与一级分区表之间交换，带lob列
drop table t1;
drop table t2;
create table t1 (c1 int primary key, c2 int, c3 clob)
partition by range(c1)
subpartition by hash(c1) subpartitions 5
(
partition p0 values less than (10),
partition p1 values less than (20),
partition p2 values less than (30),
Partition p3 values less than (MAXVALUE)
);
create table t2 (c1 int primary key, c2 int, c3 clob)
partition by hash(c1) partitions 5;
insert into t1 values (11, 30, RANDSTR(5000, 1)), (14, 40, RANDSTR(3000, 1)), (26, 150, RANDSTR(4000, 1)), (29, 160, RANDSTR(1000, 1));
insert into t2 values (12, 20, RANDSTR(3000, 2)), (16, 110, RANDSTR(4000, 2)), (17, 170, RANDSTR(5000, 2)), (19, 120, RANDSTR(6000, 2));
select * from t1 partition(p0);
C1	C2	C3
select * from t1 partition(p1);
C1	C2	C3
11	30	GLC9OlurQ30RoDyDOj47AdazyTITyxc9UnUha741olOR0LgZCxKXCpQP2J8NklubStYHurgbmbmh23CjsViLMlCpSLG7CN4f4hEvMJ63E9WRK7qD4JkjERihMX4bkjGFkve161ghcjCNOXgT4tENSxgHYXOJ2pYLa1IZKlWr2HkdqTgzibKTohgvQfI7g1ovEB0vMVarAZStSLg7STWdAH4vw3IPUnkpsHyzaRizE3yFynIJIFgxUT8VcTA1GvyxOvg1YzWR8tIHId2tuPy1oLsvgT4JyJs7CP2vqnWPKvi1SxGDW7ypG7ILoHUxgDiBKrCr8h47qpw1Y34VuHYx8F6xOtIJUvcrOzmfCnMhIpwDiPa3UXuHiRwpMvg1e9UvcHcVwLODw363Glc7KFcLQZE5En8JSfA5kxy3It6ncD8VW1srwRazmnIn8fWpMZE1EvSTOB8Tkn2t0PwTct6dQPI1mL6fs3CN4pwLK78HKzE9GFC349i721AhULORahOno3knMrQBwjQXu7ujgPQjQLmrA1MDA7wpedSNsrI7qbktiv8ZUZSJURmNIHAVSJs3MN25Ifs3o1YRWbod0LS3CVgFytSJKP4zIpoPA92pCzcxETitQ3QlexsHuFA7kjA7QBOJ4HcN2L4buzULUrgX2RYJMXYrmtkvIPkDmPCTubM3gpYvWVq7YpkDEbEvchCr4BI34vIvwvGTivEbWZwbeFMjw1C9UBiHUtc9sbAVuLuTMNgB0HKbkz6da7kxoXOZsdmLCL0xCRo5yZsZ4bi9OXcbovW7wFA38HAx6Foxifmt61gZUD4pChGNq9WtUxi5qJSlqhSD43ytIZkxaZqbwPKbYF614dkt63ixeHYNKVuZGBcXEjizSrutORunQJcjaRIJujgzITSrk5e1wbmteP0pMb2pMLgncD0x69EjEHmDej43ohSlYlM14LoHmL2J6nsXmfO36tUVwlwNaLSRGhexm1wnizePWHKDcpEXOxO7c56bUTuH0HK9IfWTIJOByZCXOFgdGvmnunMHSrE92nm5y5upeVsl6DWXsnSpKxCv0BI3wvGHoj6Dqjux81e9EZon6dAXyraDInIRyp4RmpOtWpYJ6V2RCZqF01G72DCv8NgvGRArW1QZALKr4lGZSzkNoZ0z0Jcl8vYz4NMFiPyVYry3YvKX4H47ezYRy9qrqbq7Etmj8PY54lcnGJ8FgdaruHolcT6r2pQhA5yzcbYZgBkRuNQbWtURydgFAj4vUFs9wfm5AlEByt8pQvkVShIDKRk9W5kZ4hilC5OZozeB2NyJgrWlsNs1aPYb4NQrqFKt8ZKXgTilgxkdmN2BqzS3QLQrwFoJqBora1UR0fE1EXG1otMXwFa7eJW1i1svIzEry36H8Jm9cnkF2zQZOh6P8dwDejy7QNUBG1iTWFqDMBiRkV410VKbqpWVY5qpeLEz6xEzcdgJal4JOVsXAbmpoZyvqdURO14Tefu96pSP2NwxSFMnsbQhGrsXaXKnGlMjifOpcL8Z0byxaDqPivWJOreJKj4FqBMtg9YL0xalQh2NQ7SxsbeDaxUBKnoZw7AzW1iTAhSrifMjmtEz6RoRGhY5I9y3Mbg9m1WT4lGr4Da3Yf21kxITwzkvinGP2piHeRw5mbMZ6lanipWbqPmHIrsXWZsp2LsRsRETUryr8RgtMvG7shAF0VWlIzAzOpcXol8LSN6X0BUjcne50XsLsTCPCD03Q9EVO1cl4HiPCVwDkRspyJYrsREF2HWbMTuDAP2PkrUDmjOf852l87CfyLi16l8jc7aVGt4H4d0fQtStCB2BQlC3GHgNQ7ixifADQBmxgNgRKjABWReTKrEpudy3SNSJCvG9wfWPI3qFOjqHijSnybOBGxIfQRoForS3iV09knWd01CPUBuV614pc3Ap2lglIh4fITM5y3kHEXCFg7IlynyzWxy9afEHWtMdkDufyTEhgtGvE5mjULEHUru7274dQ7KhmxUlupiPYP678pIZCpCnCF4Hsl0D8FuTgj8huBaxg7mrSNiR67i9QjK9C5IriLqVMDMJMrEnSrglSxeNwlsPyHS7k9YpUliRErsrYLoNu3YpOvcTw363ov4forevk1ylOrq94JK3czUZex0l01E5w3YBElqLwrq1W3kNSlgHiVwvivyBaNQzW9E1YBmpaHUhs3OFMlWL4JgNAtYjid8fmzCTo3OVKTqBI9utalQbynoleDgL4tCV0ZSti9y3qpixCNsxyJoHSxoVyJ2vs5oPc7oVUvAXyxmNeV4ZWDqh4fURw1ELwpSf8zsZ0XwXalUnIzkFCXg1wR0rWFePkP476pEHipe9gHEVK1O5ETAToVqZkBYvIvm1IXApgTupMl8raTsXoV8D4pqnkB2jC5C5Q9sJUjmZqlE5U1UdGLALc5CHmv4VePAZMzOtSdarKzSP2zij2rixyhS98BQzU5y98XadMz2ZENQ1oRWpeB49KjS7G3ir45AvoXCbcFC905k709AHgfOvK3QHglUlOxgXUvmlEdQNEVonSdCtspeJIFuFwr0J67o3Stk9qzSdWFsBU5c32VgFAXq5kzQ5If854pKhe1Ohe30L6RgV0dAhQvQHw5ohmLeZkHeLS3crS38JsP0ToTcX89IrOJwbwhc309cxc7wnqR27wHalYRMh2dOH23aLgxiVWR2P85OlqhMh6DkVMBezOTwT0pELc5uJ0PWXYNUNcXW3ez8PWZWD2barQVI5sjWNGZY96H0pKrq3aBiZOhqBUbKJa3yvAHG3AZQzWj6fKlSdQzuZQtMdkjQBojMDst8FmNInALC1ydObGNOXCdeJY1YFa1MNsLW9A5AHyZARm3Unu5AxIjAr6FinQXkbkB4dW5u7WTAtMjOzaTcpW58xEpEZwD6Hajut8vCxutitMlcxGhUhgvgFOzopuBuZ4tOdOPYPuLeNYHaRSZqRgdkJcbUD8jOjWRI1iZM1q5ClqnS9Ef4TapAhWJatWRkvqjcjkZqNa7svAxKhIHwhSLWxKPsT63uJYzst4x2zi5aHab4jwPaTWHMbqxO5yZizgzo3UJsLITYbGrQt4lOZ4ry5UlWFMDq3wLWFqX8t2NMBS30j6lALUbWrEH21UPmbaLS32nK3GdupSjElAb2TIF4Jgl2tmlubW1SPALyDorUjiZKXs7UF4fSp25upiBM5A7epIlKjEHgbmdUVWvKLS5Ml4vUFsjGza3UBgnUzWxSbG3e9uLktEnMR8fq3whSFOzsveRUDQb6NsHarYNCZGTo7ENUfcdelutwrYt4hAdG3Qt0zQnYRWr03urCroFQRuHCLyXuhcFsDonKxC5050zyTId8zQVC5oXWDQ3YPEJKr01w16N6Xw9eZCxopYZGVghAhgHIz2REV8p2XudgHUloTul2dIrgR8VaXSHKZgveBMnah6R2L2X4LMl25sxOhKTmzeNiJOpuHwbUncBg9yNqH6LIPejEz8nufG1IH2vinI9Sx4tWZoNULIbiF0DmvsNclK1oTyd61sf2PgLq1Cv6XaNUhSfYDctmr0HqxGDUtCVeHE3ENoVgrKHCNcbsTufg3YxkjWXajwFUd6DctSx4LQVkLChsHunwvKTohsFSHqjiZGpKP0FurM5M7ytYBQ3WTkP8nEhWpkzC9GTw7UbiLElehoJqjm1k9ObcxsxY7cHiJIZSpyRuhitYZkNMNyrCxo56zqpgLQ3u78BAheRch8fIdmbebYXuLo78linKBIzET4BmLiRwFKxYJ8p8rgjE9ADG5e5GlU30H61GxcZk3kJIV232X4rmlk1kfOfghGJMTizy7k7mvU5oVqVQz2ze3eTmHMD014BIp65ctiZaXCHk92hAZYz8HshKdQ36NK9cFwvCp6jeb6d6j8F4Z8NyDg5GPCJ8fi34Taz8tgZCl4bExm3kHqRE5KDGDmraRqt8HuL8bIDKhWNo3gHavU7IfApqfw9MdYrAPSrErq72vUpslgDwjG9s3ixONwVcfeROXI5s9Kr43cbmBgPutAx6xWrArmrwR6HuJ8JqFuJ8b63GvidSXchMTExAfwvAH2DYPIXAbkXe5kBM7stQniBS9ctMHW9Y1WP6RaVMzClyxynUJKNUlA1S5UbQ7Cbezs76vYb8faXGhoNQXQVATCVsnqB2dKBStMt2PE1gRQZafm9AHWxkxidSFexYBmR81UXATGdQVKlkF63GV4ZUFA9Ov6RKB0fK1ixcVw1EZwHSnahOfiPQFcXAjOPSx8t27gNI18VEn0VIdYRkf2pOvgva5orulmnUv8D4PE5wnS1c10RmrqHC9eFqpmxUrErKXq3Y1IZCfAdgFWRG50ZKpI3SJq9qXMDYXknGHwNCzGNYVCxOhSbEn4jIJW3WzcnWzoTWRQjUpoVAzoHePCZCp2Ha9aZoN09qN6PWrYVwf6TGrkLqXQrIhkVoVmhwpEdYhq3GjkLkRSvUDspCjK7SDSrwdynwRUH0PI9cJ0ZYdIpGDk7GFE7UzyXAD8LgLapuPqfKpuHCB8FwrWLqfaz4neV6LM3qZ0lI7wjuNgDwPcZaDsLC9qvaFWNehov27gJYN8jm96vQBOLEH8hsJgRQx8V6Jg5ezIJST4HCFYZYrGJg1CdmBkFkViz2lMxw90T0HW9Ejy9cBCVeLY9AHqHYTybS5I50Vc7gzIRod0FGP67cFKzcbqfgLKtej2LmvWJCNKLixkJSH6bwVAX4fmnofi3Gh8n2JipgdgNYhyNWzKbq1OzmLeDYti3ENOdQTkDcRSBon4J6B6zObsBQ5ejEPQZyfaNODofktqjm9uZEzkrQ12huj4N4fez8zejEJe9EdC7ah6TC3kTi1yrYdENA1eRg7Wb8VeJYjsfGFkxmNeRoNKf4dcDQlOj4LO76TkXWjMzcdYjwZ4RAhMtMxiXcHQNwVOfytUvKdIrKdsB4ZkT2huzqNCFKnqhMnmlSP2JUxKHy1cRwtYhWxQ7C7mT0XKfiv0H0f
14	40	GLC9OlurQ30RoDyDOj47AdazyTITyxc9UnUha741olOR0LgZCxKXCpQP2J8NklubStYHurgbmbmh23CjsViLMlCpSLG7CN4f4hEvMJ63E9WRK7qD4JkjERihMX4bkjGFkve161ghcjCNOXgT4tENSxgHYXOJ2pYLa1IZKlWr2HkdqTgzibKTohgvQfI7g1ovEB0vMVarAZStSLg7STWdAH4vw3IPUnkpsHyzaRizE3yFynIJIFgxUT8VcTA1GvyxOvg1YzWR8tIHId2tuPy1oLsvgT4JyJs7CP2vqnWPKvi1SxGDW7ypG7ILoHUxgDiBKrCr8h47qpw1Y34VuHYx8F6xOtIJUvcrOzmfCnMhIpwDiPa3UXuHiRwpMvg1e9UvcHcVwLODw363Glc7KFcLQZE5En8JSfA5kxy3It6ncD8VW1srwRazmnIn8fWpMZE1EvSTOB8Tkn2t0PwTct6dQPI1mL6fs3CN4pwLK78HKzE9GFC349i721AhULORahOno3knMrQBwjQXu7ujgPQjQLmrA1MDA7wpedSNsrI7qbktiv8ZUZSJURmNIHAVSJs3MN25Ifs3o1YRWbod0LS3CVgFytSJKP4zIpoPA92pCzcxETitQ3QlexsHuFA7kjA7QBOJ4HcN2L4buzULUrgX2RYJMXYrmtkvIPkDmPCTubM3gpYvWVq7YpkDEbEvchCr4BI34vIvwvGTivEbWZwbeFMjw1C9UBiHUtc9sbAVuLuTMNgB0HKbkz6da7kxoXOZsdmLCL0xCRo5yZsZ4bi9OXcbovW7wFA38HAx6Foxifmt61gZUD4pChGNq9WtUxi5qJSlqhSD43ytIZkxaZqbwPKbYF614dkt63ixeHYNKVuZGBcXEjizSrutORunQJcjaRIJujgzITSrk5e1wbmteP0pMb2pMLgncD0x69EjEHmDej43ohSlYlM14LoHmL2J6nsXmfO36tUVwlwNaLSRGhexm1wnizePWHKDcpEXOxO7c56bUTuH0HK9IfWTIJOByZCXOFgdGvmnunMHSrE92nm5y5upeVsl6DWXsnSpKxCv0BI3wvGHoj6Dqjux81e9EZon6dAXyraDInIRyp4RmpOtWpYJ6V2RCZqF01G72DCv8NgvGRArW1QZALKr4lGZSzkNoZ0z0Jcl8vYz4NMFiPyVYry3YvKX4H47ezYRy9qrqbq7Etmj8PY54lcnGJ8FgdaruHolcT6r2pQhA5yzcbYZgBkRuNQbWtURydgFAj4vUFs9wfm5AlEByt8pQvkVShIDKRk9W5kZ4hilC5OZozeB2NyJgrWlsNs1aPYb4NQrqFKt8ZKXgTilgxkdmN2BqzS3QLQrwFoJqBora1UR0fE1EXG1otMXwFa7eJW1i1svIzEry36H8Jm9cnkF2zQZOh6P8dwDejy7QNUBG1iTWFqDMBiRkV410VKbqpWVY5qpeLEz6xEzcdgJal4JOVsXAbmpoZyvqdURO14Tefu96pSP2NwxSFMnsbQhGrsXaXKnGlMjifOpcL8Z0byxaDqPivWJOreJKj4FqBMtg9YL0xalQh2NQ7SxsbeDaxUBKnoZw7AzW1iTAhSrifMjmtEz6RoRGhY5I9y3Mbg9m1WT4lGr4Da3Yf21kxITwzkvinGP2piHeRw5mbMZ6lanipWbqPmHIrsXWZsp2LsRsRETUryr8RgtMvG7shAF0VWlIzAzOpcXol8LSN6X0BUjcne50XsLsTCPCD03Q9EVO1cl4HiPCVwDkRspyJYrsREF2HWbMTuDAP2PkrUDmjOf852l87CfyLi16l8jc7aVGt4H4d0fQtStCB2BQlC3GHgNQ7ixifADQBmxgNgRKjABWReTKrEpudy3SNSJCvG9wfWPI3qFOjqHijSnybOBGxIfQRoForS3iV09knWd01CPUBuV614pc3Ap2lglIh4fITM5y3kHEXCFg7IlynyzWxy9afEHWtMdkDufyTEhgtGvE5mjULEHUru7274dQ7KhmxUlupiPYP678pIZCpCnCF4Hsl0D8FuTgj8huBaxg7mrSNiR67i9QjK9C5IriLqVMDMJMrEnSrglSxeNwlsPyHS7k9YpUliRErsrYLoNu3YpOvcTw363ov4forevk1ylOrq94JK3czUZex0l01E5w3YBElqLwrq1W3kNSlgHiVwvivyBaNQzW9E1YBmpaHUhs3OFMlWL4JgNAtYjid8fmzCTo3OVKTqBI9utalQbynoleDgL4tCV0ZSti9y3qpixCNsxyJoHSxoVyJ2vs5oPc7oVUvAXyxmNeV4ZWDqh4fURw1ELwpSf8zsZ0XwXalUnIzkFCXg1wR0rWFePkP476pEHipe9gHEVK1O5ETAToVqZkBYvIvm1IXApgTupMl8raTsXoV8D4pqnkB2jC5C5Q9sJUjmZqlE5U1UdGLALc5CHmv4VePAZMzOtSdarKzSP2zij2rixyhS98BQzU5y98XadMz2ZENQ1oRWpeB49KjS7G3ir45AvoXCbcFC905k709AHgfOvK3QHglUlOxgXUvmlEdQNEVonSdCtspeJIFuFwr0J67o3Stk9qzSdWFsBU5c32VgFAXq5kzQ5If854pKhe1Ohe30L6RgV0dAhQvQHw5ohmLeZkHeLS3crS38JsP0ToTcX89IrOJwbwhc309cxc7wnqR27wHalYRMh2dOH23aLgxiVWR2P85OlqhMh6DkVMBezOTwT0pELc5uJ0PWXYNUNcXW3ez8PWZWD2barQVI5sjWNGZY96H0pKrq3aBiZOhqBUbKJa3yvAHG3AZQzWj6fKlSdQzuZQtMdkjQBojMDst8FmNInALC1ydObGNOXCdeJY1YFa1MNsLW9A5AHyZARm3Unu5AxIjAr6FinQXkbkB4dW5u7WTAtMjOzaTcpW58xEpEZwD6Hajut8vCxutitMlcxGhUhgvgFOzopuBuZ4tOdOPYPuLeNYHaRSZqRgdkJcbUD8jOjWRI1iZM1q5ClqnS9Ef4TapAh
select * from t1 partition(p2);
C1	C2	C3
26	150	GLC9OlurQ30RoDyDOj47AdazyTITyxc9UnUha741olOR0LgZCxKXCpQP2J8NklubStYHurgbmbmh23CjsViLMlCpSLG7CN4f4hEvMJ63E9WRK7qD4JkjERihMX4bkjGFkve161ghcjCNOXgT4tENSxgHYXOJ2pYLa1IZKlWr2HkdqTgzibKTohgvQfI7g1ovEB0vMVarAZStSLg7STWdAH4vw3IPUnkpsHyzaRizE3yFynIJIFgxUT8VcTA1GvyxOvg1YzWR8tIHId2tuPy1oLsvgT4JyJs7CP2vqnWPKvi1SxGDW7ypG7ILoHUxgDiBKrCr8h47qpw1Y34VuHYx8F6xOtIJUvcrOzmfCnMhIpwDiPa3UXuHiRwpMvg1e9UvcHcVwLODw363Glc7KFcLQZE5En8JSfA5kxy3It6ncD8VW1srwRazmnIn8fWpMZE1EvSTOB8Tkn2t0PwTct6dQPI1mL6fs3CN4pwLK78HKzE9GFC349i721AhULORahOno3knMrQBwjQXu7ujgPQjQLmrA1MDA7wpedSNsrI7qbktiv8ZUZSJURmNIHAVSJs3MN25Ifs3o1YRWbod0LS3CVgFytSJKP4zIpoPA92pCzcxETitQ3QlexsHuFA7kjA7QBOJ4HcN2L4buzULUrgX2RYJMXYrmtkvIPkDmPCTubM3gpYvWVq7YpkDEbEvchCr4BI34vIvwvGTivEbWZwbeFMjw1C9UBiHUtc9sbAVuLuTMNgB0HKbkz6da7kxoXOZsdmLCL0xCRo5yZsZ4bi9OXcbovW7wFA38HAx6Foxifmt61gZUD4pChGNq9WtUxi5qJSlqhSD43ytIZkxaZqbwPKbYF614dkt63ixeHYNKVuZGBcXEjizSrutORunQJcjaRIJujgzITSrk5e1wbmteP0pMb2pMLgncD0x69EjEHmDej43ohSlYlM14LoHmL2J6nsXmfO36tUVwlwNaLSRGhexm1wnizePWHKDcpEXOxO7c56bUTuH0HK9IfWTIJOByZCXOFgdGvmnunMHSrE92nm5y5upeVsl6DWXsnSpKxCv0BI3wvGHoj6Dqjux81e9EZon6dAXyraDInIRyp4RmpOtWpYJ6V2RCZqF01G72DCv8NgvGRArW1QZALKr4lGZSzkNoZ0z0Jcl8vYz4NMFiPyVYry3YvKX4H47ezYRy9qrqbq7Etmj8PY54lcnGJ8FgdaruHolcT6r2pQhA5yzcbYZgBkRuNQbWtURydgFAj4vUFs9wfm5AlEByt8pQvkVShIDKRk9W5kZ4hilC5OZozeB2NyJgrWlsNs1aPYb4NQrqFKt8ZKXgTilgxkdmN2BqzS3QLQrwFoJqBora1UR0fE1EXG1otMXwFa7eJW1i1svIzEry36H8Jm9cnkF2zQZOh6P8dwDejy7QNUBG1iTWFqDMBiRkV410VKbqpWVY5qpeLEz6xEzcdgJal4JOVsXAbmpoZyvqdURO14Tefu96pSP2NwxSFMnsbQhGrsXaXKnGlMjifOpcL8Z0byxaDqPivWJOreJKj4FqBMtg9YL0xalQh2NQ7SxsbeDaxUBKnoZw7AzW1iTAhSrifMjmtEz6RoRGhY5I9y3Mbg9m1WT4lGr4Da3Yf21kxITwzkvinGP2piHeRw5mbMZ6lanipWbqPmHIrsXWZsp2LsRsRETUryr8RgtMvG7shAF0VWlIzAzOpcXol8LSN6X0BUjcne50XsLsTCPCD03Q9EVO1cl4HiPCVwDkRspyJYrsREF2HWbMTuDAP2PkrUDmjOf852l87CfyLi16l8jc7aVGt4H4d0fQtStCB2BQlC3GHgNQ7ixifADQBmxgNgRKjABWReTKrEpudy3SNSJCvG9wfWPI3qFOjqHijSnybOBGxIfQRoForS3iV09knWd01CPUBuV614pc3Ap2lglIh4fITM5y3kHEXCFg7IlynyzWxy9afEHWtMdkDufyTEhgtGvE5mjULEHUru7274dQ7KhmxUlupiPYP678pIZCpCnCF4Hsl0D8FuTgj8huBaxg7mrSNiR67i9QjK9C5IriLqVMDMJMrEnSrglSxeNwlsPyHS7k9YpUliRErsrYLoNu3YpOvcTw363ov4forevk1ylOrq94JK3czUZex0l01E5w3YBElqLwrq1W3kNSlgHiVwvivyBaNQzW9E1YBmpaHUhs3OFMlWL4JgNAtYjid8fmzCTo3OVKTqBI9utalQbynoleDgL4tCV0ZSti9y3qpixCNsxyJoHSxoVyJ2vs5oPc7oVUvAXyxmNeV4ZWDqh4fURw1ELwpSf8zsZ0XwXalUnIzkFCXg1wR0rWFePkP476pEHipe9gHEVK1O5ETAToVqZkBYvIvm1IXApgTupMl8raTsXoV8D4pqnkB2jC5C5Q9sJUjmZqlE5U1UdGLALc5CHmv4VePAZMzOtSdarKzSP2zij2rixyhS98BQzU5y98XadMz2ZENQ1oRWpeB49KjS7G3ir45AvoXCbcFC905k709AHgfOvK3QHglUlOxgXUvmlEdQNEVonSdCtspeJIFuFwr0J67o3Stk9qzSdWFsBU5c32VgFAXq5kzQ5If854pKhe1Ohe30L6RgV0dAhQvQHw5ohmLeZkHeLS3crS38JsP0ToTcX89IrOJwbwhc309cxc7wnqR27wHalYRMh2dOH23aLgxiVWR2P85OlqhMh6DkVMBezOTwT0pELc5uJ0PWXYNUNcXW3ez8PWZWD2barQVI5sjWNGZY96H0pKrq3aBiZOhqBUbKJa3yvAHG3AZQzWj6fKlSdQzuZQtMdkjQBojMDst8FmNInALC1ydObGNOXCdeJY1YFa1MNsLW9A5AHyZARm3Unu5AxIjAr6FinQXkbkB4dW5u7WTAtMjOzaTcpW58xEpEZwD6Hajut8vCxutitMlcxGhUhgvgFOzopuBuZ4tOdOPYPuLeNYHaRSZqRgdkJcbUD8jOjWRI1iZM1q5ClqnS9Ef4TapAhWJatWRkvqjcjkZqNa7svAxKhIHwhSLWxKPsT63uJYzst4x2zi5aHab4jwPaTWHMbqxO5yZizgzo3UJsLITYbGrQt4lOZ4ry5UlWFMDq3wLWFqX8t2NMBS30j6lALUbWrEH21UPmbaLS32nK3GdupSjElAb2TIF4Jgl2tmlubW1SPALyDorUjiZKXs7UF4fSp25upiBM5A7epIlKjEHgbmdUVWvKLS5Ml4vUFsjGza3UBgnUzWxSbG3e9uLktEnMR8fq3whSFOzsveRUDQb6NsHarYNCZGTo7ENUfcdelutwrYt4hAdG3Qt0zQnYRWr03urCroFQRuHCLyXuhcFsDonKxC5050zyTId8zQVC5oXWDQ3YPEJKr01w16N6Xw9eZCxopYZGVghAhgHIz2REV8p2XudgHUloTul2dIrgR8VaXSHKZgveBMnah6R2L2X4LMl25sxOhKTmzeNiJOpuHwbUncBg9yNqH6LIPejEz8nufG1IH2vinI9Sx4tWZoNULIbiF0DmvsNclK1oTyd61sf2PgLq1Cv6XaNUhSfYDctmr0HqxGDUtCVeHE3ENoVgrKHCNcbsTufg3YxkjWXajwFUd6DctSx4LQVkLChsHunwvKTohsFSHqjiZGpKP0FurM5M7ytYBQ3WTkP8nEhWpkzC9GTw7UbiLElehoJqjm1k9ObcxsxY7cHiJIZSpyRuhitYZkNMNyrCxo56zqpgLQ3u78BAheRch8fIdmbebYXuLo78linKBIzET4BmLiRwFKxYJ8p8rgjE9ADG5e5GlU30H61GxcZk3kJIV232X4rmlk1kfOfghGJMTizy7k7mvU5oVqVQz2ze3eTmHMD014BIp65ctiZaXCHk92hAZYz8HshKdQ36NK9cFwvCp6jeb6d6j8F4Z8NyDg5GPCJ8fi34Taz8tgZCl4bExm3kHqRE5KDGDmraRqt8HuL8bIDKhWNo3gHavU7IfApqfw9MdYrAPSrErq72vUpslgDwj
29	160	GLC9OlurQ30RoDyDOj47AdazyTITyxc9UnUha741olOR0LgZCxKXCpQP2J8NklubStYHurgbmbmh23CjsViLMlCpSLG7CN4f4hEvMJ63E9WRK7qD4JkjERihMX4bkjGFkve161ghcjCNOXgT4tENSxgHYXOJ2pYLa1IZKlWr2HkdqTgzibKTohgvQfI7g1ovEB0vMVarAZStSLg7STWdAH4vw3IPUnkpsHyzaRizE3yFynIJIFgxUT8VcTA1GvyxOvg1YzWR8tIHId2tuPy1oLsvgT4JyJs7CP2vqnWPKvi1SxGDW7ypG7ILoHUxgDiBKrCr8h47qpw1Y34VuHYx8F6xOtIJUvcrOzmfCnMhIpwDiPa3UXuHiRwpMvg1e9UvcHcVwLODw363Glc7KFcLQZE5En8JSfA5kxy3It6ncD8VW1srwRazmnIn8fWpMZE1EvSTOB8Tkn2t0PwTct6dQPI1mL6fs3CN4pwLK78HKzE9GFC349i721AhULORahOno3knMrQBwjQXu7ujgPQjQLmrA1MDA7wpedSNsrI7qbktiv8ZUZSJURmNIHAVSJs3MN25Ifs3o1YRWbod0LS3CVgFytSJKP4zIpoPA92pCzcxETitQ3QlexsHuFA7kjA7QBOJ4HcN2L4buzULUrgX2RYJMXYrmtkvIPkDmPCTubM3gpYvWVq7YpkDEbEvchCr4BI34vIvwvGTivEbWZwbeFMjw1C9UBiHUtc9sbAVuLuTMNgB0HKbkz6da7kxoXOZsdmLCL0xCRo5yZsZ4bi9OXcbovW7wFA38HAx6Foxifmt61gZUD4pChGNq9WtUxi5qJSlqhSD43ytIZkxaZqbwPKbYF614dkt63ixeHYNKVuZGBcXEjizSrutORunQJcjaRIJujgzITSrk5e1wbmteP0pMb2pMLgncD0x69EjEHmDej43ohSlYlM14LoHmL2J6nsXmfO36tUVwlwNaLSRGhexm1wnizePWHKDcpEX
select * from t1 partition(p3);
C1	C2	C3
alter table t1 exchange partition p1 with table t2 INCLUDING INDEXES WITHOUT VALIDATION;
select * from t1 partition(p0);
C1	C2	C3
select * from t1 partition(p1);
C1	C2	C3
19	120	DAPMRWNgVwJeXshG1qLuJgBcTEbOb8x8hIreteBG1kFShoz6TsF8dW18nqB2HU7aHavYLKpGrkxc3obKTOB85YBsrmPOt2Vmre7K3GtejsdYhIfYRSbSPgzybutmNwTqR0xm9UVUf0PQV0la301A1AJU50F4Tal6L0tINQB4rkJq56vEDmt01YPidc3mdmjw3kNsBoxajeR8h0fSxMfIJm5ynCpwze5qJKp6rkNUv4p8LW1IhAhqP6XgJ27CRg7QzYbCHeLEJARInoRqvWNEb6TQ9ENqZgRKF83u7KLQx0FiVOnMPYzSxm3kVk1ihoHKVcVcjsFeBSByb0Z89CtC9OvQlOVGpYDILQFIBmRmTG9O1uXaLGLmfcDEbmFWloNCXmVWJqlYbyziNc5CNSXybMT4rUV8tkL27kVQdCX0X2bSxy1ctEhKv0lwZmhITs7yNERkNOVAPejYpAbUly1o9EZw1q3qP4FIj2TsVCz8d0BijmZc5ob4f0vGjirCHcfGrkjgjqb8ryh4Dg7s5qbOTiD8RIJKR2pKhqJkPqdYrMzUP8vCLu5YN2Py5EfuzEf2LcHCf4fkhojIHiBiXi50n2tEl832fUXy9CdiLkrEfobYTMRYfqdkv6TSxOZazOHohYPczQleFgBoJKpyrijMjwXIBCPu9sFQhYbqt0Tg9Y3EtCtIVYH6nerUHiZy9EDeDq5q3kX6HUpcz0dyDUFiVchuHo7Kb6PWPwpk9EtmlIxKB0ZapOXevenSRI3ArQb4lCfEdO5k1gzIdodgN8xonqLAFmLG3YxUtqTadWx4dAN8LUF27GNqhczANkzuzA92fw1e1EzsLCZwxILSXKbupovelQr6DCJ6BK9uPU1SDwtSryFqLYNi7WhyT4pMv218nkZS5aN8RUn2BUpEP8RgDEPSvano7OLexo1u3CvOXkbalENev6VkZmdgdqXAVIrMTwBW5Itm9UZe7ufKDGFSDMLARWtmT4VuFOj8dG1sBK1MVatYrKJuzQ3eHAZY7WpCXEHCrkZSjgBOxcpifoHuTufsR6LyJejAfUPkfmDK7qH27mdGd4lirwfgJarAdudkLuhMhm5QxwTET8vkzOJI94t6ZepoL2R8JAfKHOnkx0vS78rsDmR85EhA5CrCR8RUhkrORiVO5mlmtWzMv8bMzex0zwZCfeV6luh0z8hYdy3uRQN21GHe5qvuZWXIPMvQ1ud8NQRYx6r41GXuditK9mN8NKHarOPs7k5OpeDkjUFAduTw3wrGniXC9gJgtED63GPyJEzcnM9e3SdIrCTyJG7arc9s5g1izAzcR0FkFiXafQxClg9UhKHwhCB0nu1WDy7kZ2nmPUNajcnwpI7WfGhw58rWzQnOP85Ino7WlMXw5C5w9sfIhePQfAXSR4TELs7qxAxo3uvSLk7iD43gvW3IFidSd2dA1ERWXChYHaLWp6jsfORADCdWv8PilsHGjAH6lS3qXebEbS94JA3kDIfCxc94hQxmtQlufkLmJ8TAPM74Fcz6Ds9WtC9w5yb6Fc1urGFc74jYlirolkPQFGZkPidKH0hadC9ajWvetA3Ark3EPQLa7ClITunoJW7kDUB8TQ3Kb89Ob4rQrOryFgBYDIncziFGLaDCrAnAXOdIdatU3Excp8f83KlYnCxoXWF6TKfiDIBOLaBkFIf6pIXgZCnwxuZAZ6BoZmnkL0JslgLUjstgrAbuZ2zmPApET0zk9mfynWdWjoLC92b6FG5i5kNepY30Rkb2xwHKlgdijGjMLkfk5GnyN6xgX4tYvgtOLA9obCpO1kReLkve9Mpixkhgh2b4Z0h2Vk9Srch6XAtmNiFMxux6R6by36poDonuJKjQNId0zuxYx6P2jmFInUVWBGh8zu1QLoj0BW5qhe3snCBSP4Le96NoLunWB65evaVYTINypQzknCJyfGLYnqz2TgBUJwlG1ErUhYrGBW5I54VYrCjUNcDsFcRi9shURo5Mb4pIJi3g1gPi92X2b6pg78Xsf8XCZcvozSZAT4DADghcHIHuXobK9wxszqxofMba38LYfuDCNex0rqrqN6DMF6fabyVKb2nU5OLob2FAbwlA7qjkXARsx2143InQx4dSdMlohWzi5mh4zsnYj6tYXUxODSJK78lSV4j25mXSFCFCFmLMnoFezYpm9yZm7IJedGPabYR8nAteFqHGr0383eNY783EjylAFep8t2nedO7A9crYDGvO9cz4d6DgRsDMni5wBa7spSL0l2rYP4NYRaLqNwPiR87atqBuV6Nshqx4jKViDevEnyhQLU5UjCTKPE7Sbe3mpmJqH8TWX85ipcjWbSVqtmhARsrevk5ovSjQRMzcdUFqpibsbM38J4hmFgNAfGpI1mXSxMditUp6pizOtczI3SpsPQVChI9cHaxCFiXcvqHSbWvyJUXuzqzOda7cdSPI9YHWTQHEb0taZG1gp0z6ZIPCre7onWPuDAfsXqvYzKzgzYJgl6Rg3OvMHoFqDmPAPmJK1cxgNytchCHCVY7yRul2JGJKfiBqjYLUFkLkF0rkLUvany7sL2fQVs1SfGroVYvaHaZ6LE78HwfEVoXwFKlslS92NgD4Fc3UrqZ4ZOpKZSRelMTKBelm5eJSlUJehUpYTaf874BWzMbUvmvg3EngnwDiPenilkFsHCnoNcLY3A1QX2tMLaN8JeROjQlYfmJyDMDovILmvszINwLIPefsNubglSlUjoz6vCloZCJ8dmLwREFuBg5ivkDMJepwdy94l8fiNGHGjSHOvKVMNGjU72pmtMPS9ElElshSZGHIfsZiHgxIRI1CFQxulCVgJIdaja30dmDwVQN49SV2X6twxW3GrAVIRoZiDgLUFI5c5iNkRgvOVGlq3eX2paLAxIRmNynALApEtmh6BIzuvmTAV2ny7ANAZ2zYDcxK1SHMDuvajyTa7wPIZoDMlsPKFAvML2vMfCJ4zs9kbM567ONejq7Af8li3gxCB6FkpGl8xetEVqXifAbodsrsJaDYNUlcpyt6HGPsReBkTgTEBatMBYfe1M14pC1i7AP81mzCdYTCdyV8tKR4VInCjmpi7OJEXWjYH8HaNUhSPiFSfQvktORmBctuLSDWNEFGXav8DqJWRgFk7EVKx0pKlwnEhYHUbsrEPAdaPK7YVW3IbUnmP45KdEhKbo1cvKxWlk1Cx6Xkji9uBEvEHSJqfAByl6v6loJGj8hsdaNONa3ybuPsjmbYPwF03ARYDuFibqD2pYtstK9SNCJ2Fa3m9yTMZc1I9WXCxM7ohAtg3ur0hG72PCdKv4p6ds3G9wNAVwxq9sXQlGZmXUlQ7oNiVOlIpGrsVkVADi9OlUXiB0daTgjiTWFwHODErsnEDs5kJaBGpA5OfmLkvwtcj87eRwZAlgB0zglgBSTyNQnIpszGxidqPQx8tChYhUFUJkbmRsPWB8lMRcpiNsnIHwbCFgxs5yDUJ4DuzQJWjQZcZ25EjWhuJ8vIpI7iZcLUr0f4pMVE9uDIR4xYDA5kdEfOdARo1mnYbAPMHwJUNQFYXUZ2pgHsfKfAVujsVehGpaTyr8ze3CbkVs5cFCta1ObotO7qHE9uZeHAFojkVmlIJiZorGBAVCH4zsJgtSFGd0nKRilMn6dizG5mnkn4DOHQjwVQ3y1mRkLuXOFkjQZcxihCrurmNSJqlUDGlQVUDEpSxEJelKRkj2NObEvuVgzsPodO78hyrCZeHS3Q7mXq547GLg5AJGtinWDEXQXS1iLCLCZ6n2hq3QrK3SrIhCZAhY3CdKxg1ERy9MrCNk9iniTgRCFEnKZYdEboDqp6xUZuzizwFsbWnCtyxmhy1ONqpCpiLi1gbav0Hut0XkFUfAtWhYBWvsPcDS9cHYNyTyBMnMVo32nqJaNAZ476JAB0VKTKTshAnQVGNOnIHgJwnQ1O9KJwBY1k5S9mdyj2X8Vy9AbwX8RIROfIje9On2LC3u3wh0DuJYDsVepwj0FOn21SNgPwbYREF0RwnwrkXUBU1iFybMFuXojClOR6HsfQBW7wHgN8J8TQP0dOVYRYhyTIPAtWjaHq9QJGjsLAP0VKj4p6bMLARcrGTe5u3AVG7AhGv2PaRwHyDITchmri9kX2rsb6ZsZwpUVOtc7kd8BGFqJ0PIRAT61K9Gf2rqfmfQNGpk5WxA78Xm1yxcveFMrIjStgh4xIlSNUFYlS7sTex2BoPqfOV0ZodYLA1MVW1K9qjufeXW1yZKTQRSVeXKbCdydg5MRCzAhAFaFoJg3KjGPITChqrYPWDQjYHcnYxOZQrAvEJGN4xGXQhC3S9gNKb096HUdSxqjct45o7WDc1aNWxwl4NWvqjArqx8vOhghstc7016FWrMPstGVMdqLoDgJMLadOhKLQbwLwzufMhY3GlIR4NCxeRgPInmf63g3c3w1EnG5uvylAdaF69u5IVcVQlOxmfulmPWTAtmbuBGveFuxOlGxIBIRa52NGBUjW5GtaNSrIJurI3WD0DMpq3sXkb6jyvKnKjgV0Dcp4NGvMHwz2p4neHqZwbqruvcFyBATOvw3IfUNen2pmzA76t4pKNMXivulEXszQtQXAhcVaF4fYPIr6Xix6bcTaR4bu5q5K9Qhy9WVAxYzk1s9AdIBa7OPKfQR4LwtwPeR41sb0zQhutC3SHi9CvK1MXSRizsReB8DuPKxI9w9gNSZgHAxULuxef8923EjWfGp4lAhmvgFg5aj8HEF2pSpmRkhIdQn6lmbEbivuVcFojQVkRm3W56Fwvsfo9eZe7kN4p2hct0xsJgn0r6vk3qjuvW10B4xw3aNSP25ShUdw5qZy9inarcp0vwHSbcrMf4LKbW5eH4z0TEdOpeD4t23GBmNmR29sjIViv6hul0FK78tUz63CjgpCf4livyd6liTi3Epax056rW9AXklCBwbw16L0Xs9Cz8RarCPeP4ZirMBuzWBID0nEfYTez4RsNgxaVCLcJWLeLIjkjkfq7yjSfUxaDkFaXoB8LATcf2RStyVKl43KLknUtC9wLqFCtOZiv0bOBiRkFoFwlUZGX6FsrUlujGBIVYDw3KXEFuLGN2ZOHMzGdcPkpK7kxgb0FqXUhi36zKbqPo56TMX6hkVmp8pqlaB4d6V85UpSF29Op2RABUra7ojIXe9gDOVqvWZkhubQZSRyDY9A58BcNuJCNyfqXK5C5ebG903gFKJeNynKV23CJ0LwTWXwBQTepOvkNenWHm9gRopQTEbStyzeh2Lklc7MZyPOPcPoPEjKdMlwn8NaHQH0dg78FeVyPwJQbWT43UNyTo1oxURuxsLEbsP0h61oDEPATiZMNer8fCze9MFkXk9GXS9OPQ7kZ6x2lYBIDCLM7K5eJClct8jWFWrSzu5IlCfaV6nADyZO3ydY5oT45832BaRQ9eLUnQdSpKpof8fulcvmpIDoTczUTUJYte52N4ZKB4jiZ8JqtiHIf6PaVKV81OJKPgfCxoZ09wrqjsX6FSxcN4tExoPkTqlA7SHqja9OdSbsbYzmnw7wVKxglUbo7gTkfQ7MZkRWfwF4Ledyr410FON29erMz6lgvyPq3ytQXa7At61wrclAb4RMTMxwvgJqtGFwVGXKlORcr672TCVKDanwJYboJKN2xKjsxwlU1GRQZELedIL2XSh6Z4bmREZGZ2zSDmXGJsLC7OdIRALQdYlCFUXEB07aT838hkFAloJ8HqNcFwXCN49odK7ABaZ8dCvudGlgnST0XCPKbevgJaPUDux8nE3EBabMv4LWv4vC7M1AH6Rkh0byhMbM7Y58XY3kDErO1glgxe36Hw5wVaH21ifaxWjMJE9opAVA9Iz2hej4pkjIVsRYHqdAnQRQHWr0te5kVedSlOnALoFa7sXWtO16tuBuXEzE7mjAZOfcDCPYTOV0RmVyPwFwBwNaL0N83yBY3w3wpeFW5UHSNIj8dspmNuxE9Gpqx4V8rahKBqRQJ2PQVK9GbO5QnSFo
12	20	DAPMRWNgVwJeXshG1qLuJgBcTEbOb8x8hIreteBG1kFShoz6TsF8dW18nqB2HU7aHavYLKpGrkxc3obKTOB85YBsrmPOt2Vmre7K3GtejsdYhIfYRSbSPgzybutmNwTqR0xm9UVUf0PQV0la301A1AJU50F4Tal6L0tINQB4rkJq56vEDmt01YPidc3mdmjw3kNsBoxajeR8h0fSxMfIJm5ynCpwze5qJKp6rkNUv4p8LW1IhAhqP6XgJ27CRg7QzYbCHeLEJARInoRqvWNEb6TQ9ENqZgRKF83u7KLQx0FiVOnMPYzSxm3kVk1ihoHKVcVcjsFeBSByb0Z89CtC9OvQlOVGpYDILQFIBmRmTG9O1uXaLGLmfcDEbmFWloNCXmVWJqlYbyziNc5CNSXybMT4rUV8tkL27kVQdCX0X2bSxy1ctEhKv0lwZmhITs7yNERkNOVAPejYpAbUly1o9EZw1q3qP4FIj2TsVCz8d0BijmZc5ob4f0vGjirCHcfGrkjgjqb8ryh4Dg7s5qbOTiD8RIJKR2pKhqJkPqdYrMzUP8vCLu5YN2Py5EfuzEf2LcHCf4fkhojIHiBiXi50n2tEl832fUXy9CdiLkrEfobYTMRYfqdkv6TSxOZazOHohYPczQleFgBoJKpyrijMjwXIBCPu9sFQhYbqt0Tg9Y3EtCtIVYH6nerUHiZy9EDeDq5q3kX6HUpcz0dyDUFiVchuHo7Kb6PWPwpk9EtmlIxKB0ZapOXevenSRI3ArQb4lCfEdO5k1gzIdodgN8xonqLAFmLG3YxUtqTadWx4dAN8LUF27GNqhczANkzuzA92fw1e1EzsLCZwxILSXKbupovelQr6DCJ6BK9uPU1SDwtSryFqLYNi7WhyT4pMv218nkZS5aN8RUn2BUpEP8RgDEPSvano7OLexo1u3CvOXkbalENev6VkZmdgdqXAVIrMTwBW5Itm9UZe7ufKDGFSDMLARWtmT4VuFOj8dG1sBK1MVatYrKJuzQ3eHAZY7WpCXEHCrkZSjgBOxcpifoHuTufsR6LyJejAfUPkfmDK7qH27mdGd4lirwfgJarAdudkLuhMhm5QxwTET8vkzOJI94t6ZepoL2R8JAfKHOnkx0vS78rsDmR85EhA5CrCR8RUhkrORiVO5mlmtWzMv8bMzex0zwZCfeV6luh0z8hYdy3uRQN21GHe5qvuZWXIPMvQ1ud8NQRYx6r41GXuditK9mN8NKHarOPs7k5OpeDkjUFAduTw3wrGniXC9gJgtED63GPyJEzcnM9e3SdIrCTyJG7arc9s5g1izAzcR0FkFiXafQxClg9UhKHwhCB0nu1WDy7kZ2nmPUNajcnwpI7WfGhw58rWzQnOP85Ino7WlMXw5C5w9sfIhePQfAXSR4TELs7qxAxo3uvSLk7iD43gvW3IFidSd2dA1ERWXChYHaLWp6jsfORADCdWv8PilsHGjAH6lS3qXebEbS94JA3kDIfCxc94hQxmtQlufkLmJ8TAPM74Fcz6Ds9WtC9w5yb6Fc1urGFc74jYlirolkPQFGZkPidKH0hadC9ajWvetA3Ark3EPQLa7ClITunoJW7kDUB8TQ3Kb89Ob4rQrOryFgBYDIncziFGLaDCrAnAXOdIdatU3Excp8f83KlYnCxoXWF6TKfiDIBOLaBkFIf6pIXgZCnwxuZAZ6BoZmnkL0JslgLUjstgrAbuZ2zmPApET0zk9mfynWdWjoLC92b6FG5i5kNepY30Rkb2xwHKlgdijGjMLkfk5GnyN6xgX4tYvgtOLA9obCpO1kReLkve9Mpixkhgh2b4Z0h2Vk9Srch6XAtmNiFMxux6R6by36poDonuJKjQNId0zuxYx6P2jmFInUVWBGh8zu1QLoj0BW5qhe3snCBSP4Le96NoLunWB65evaVYTINypQzknCJyfGLYnqz2TgBUJwlG1ErUhYrGBW5I54VYrCjUNcDsFcRi9shURo5Mb4pIJi3g1gPi92X2b6pg78Xsf8XCZcvozSZAT4DADghcHIHuXobK9wxszqxofMba38LYfuDCNex0rqrqN6DMF6fabyVKb2nU5OLob2FAbwlA7qjkXARsx2143InQx4dSdMlohWzi5mh4zsnYj6tYXUxODSJK78lSV4j25mXSFCFCFmLMnoFezYpm9yZm7IJedGPabYR8nAteFqHGr0383eNY783EjylAFep8t2nedO7A9crYDGvO9cz4d6DgRsDMni5wBa7spSL0l2rYP4NYRaLqNwPiR87atqBuV6Nshqx4jKViDevEnyhQLU5UjCTKPE7Sbe3mpmJqH8TWX85ipcjWbSVqtmhARsrevk5ovSjQRMzcdUFqpibsbM38J4hmFgNAfGpI1mXSxMditUp6pizOtczI3SpsPQVChI9cHaxCFiXcvqHSbWvyJUXuzqzOda7cdSPI9YHWTQHEb0taZG1gp0z6ZIPCre7onWPuDAfsXqvYzKzgzYJgl6Rg3OvMHoFqDmPAPmJK1cxgNytchCHCVY7yRul2JGJKfiBqjYLUFkLkF0rkLUvany7sL2fQVs1SfGroVYvaHaZ6LE78HwfEVoXwFKlslS92NgD4Fc3UrqZ4ZOpKZSRelMTKBelm5eJSlUJehUpYTaf874BWzMbUvmvg3EngnwDiPenilkFsHCnoNcLY3A1QX2tMLaN8JeROjQlYfmJyDMDovILmvszINwLIPefsNubglSlUjoz6vCloZCJ8dmLwREFuBg5ivkDMJepwdy94l8fiNGHGjSHOvKVMNGjU72pmtMPS9ElElshSZGHIfsZiHgxIRI1CFQxulCVgJIdaja30dmDwVQN49SV2X6twxW3GrAVIRoZiDgLUFI5c5iNkRgvOVGlq3eX2paLAxIRmNynALApEtmh6BIzuvmTAV2ny7ANAZ2zYDcxK1SHMDuvajyTa7wPIZoDMlsPKFAvML2vMfCJ4zs9kbM567ONejq7Af8li3gxCB6Fk
16	110	DAPMRWNgVwJeXshG1qLuJgBcTEbOb8x8hIreteBG1kFShoz6TsF8dW18nqB2HU7aHavYLKpGrkxc3obKTOB85YBsrmPOt2Vmre7K3GtejsdYhIfYRSbSPgzybutmNwTqR0xm9UVUf0PQV0la301A1AJU50F4Tal6L0tINQB4rkJq56vEDmt01YPidc3mdmjw3kNsBoxajeR8h0fSxMfIJm5ynCpwze5qJKp6rkNUv4p8LW1IhAhqP6XgJ27CRg7QzYbCHeLEJARInoRqvWNEb6TQ9ENqZgRKF83u7KLQx0FiVOnMPYzSxm3kVk1ihoHKVcVcjsFeBSByb0Z89CtC9OvQlOVGpYDILQFIBmRmTG9O1uXaLGLmfcDEbmFWloNCXmVWJqlYbyziNc5CNSXybMT4rUV8tkL27kVQdCX0X2bSxy1ctEhKv0lwZmhITs7yNERkNOVAPejYpAbUly1o9EZw1q3qP4FIj2TsVCz8d0BijmZc5ob4f0vGjirCHcfGrkjgjqb8ryh4Dg7s5qbOTiD8RIJKR2pKhqJkPqdYrMzUP8vCLu5YN2Py5EfuzEf2LcHCf4fkhojIHiBiXi50n2tEl832fUXy9CdiLkrEfobYTMRYfqdkv6TSxOZazOHohYPczQleFgBoJKpyrijMjwXIBCPu9sFQhYbqt0Tg9Y3EtCtIVYH6nerUHiZy9EDeDq5q3kX6HUpcz0dyDUFiVchuHo7Kb6PWPwpk9EtmlIxKB0ZapOXevenSRI3ArQb4lCfEdO5k1gzIdodgN8xonqLAFmLG3YxUtqTadWx4dAN8LUF27GNqhczANkzuzA92fw1e1EzsLCZwxILSXKbupovelQr6DCJ6BK9uPU1SDwtSryFqLYNi7WhyT4pMv218nkZS5aN8RUn2BUpEP8RgDEPSvano7OLexo1u3CvOXkbalENev6VkZmdgdqXAVIrMTwBW5Itm9UZe7ufKDGFSDMLARWtmT4VuFOj8dG1sBK1MVatYrKJuzQ3eHAZY7WpCXEHCrkZSjgBOxcpifoHuTufsR6LyJejAfUPkfmDK7qH27mdGd4lirwfgJarAdudkLuhMhm5QxwTET8vkzOJI94t6ZepoL2R8JAfKHOnkx0vS78rsDmR85EhA5CrCR8RUhkrORiVO5mlmtWzMv8bMzex0zwZCfeV6luh0z8hYdy3uRQN21GHe5qvuZWXIPMvQ1ud8NQRYx6r41GXuditK9mN8NKHarOPs7k5OpeDkjUFAduTw3wrGniXC9gJgtED63GPyJEzcnM9e3SdIrCTyJG7arc9s5g1izAzcR0FkFiXafQxClg9UhKHwhCB0nu1WDy7kZ2nmPUNajcnwpI7WfGhw58rWzQnOP85Ino7WlMXw5C5w9sfIhePQfAXSR4TELs7qxAxo3uvSLk7iD43gvW3IFidSd2dA1ERWXChYHaLWp6jsfORADCdWv8PilsHGjAH6lS3qXebEbS94JA3kDIfCxc94hQxmtQlufkLmJ8TAPM74Fcz6Ds9WtC9w5yb6Fc1urGFc74jYlirolkPQFGZkPidKH0hadC9ajWvetA3Ark3EPQLa7ClITunoJW7kDUB8TQ3Kb89Ob4rQrOryFgBYDIncziFGLaDCrAnAXOdIdatU3Excp8f83KlYnCxoXWF6TKfiDIBOLaBkFIf6pIXgZCnwxuZAZ6BoZmnkL0JslgLUjstgrAbuZ2zmPApET0zk9mfynWdWjoLC92b6FG5i5kNepY30Rkb2xwHKlgdijGjMLkfk5GnyN6xgX4tYvgtOLA9obCpO1kReLkve9Mpixkhgh2b4Z0h2Vk9Srch6XAtmNiFMxux6R6by36poDonuJKjQNId0zuxYx6P2jmFInUVWBGh8zu1QLoj0BW5qhe3snCBSP4Le96NoLunWB65evaVYTINypQzknCJyfGLYnqz2TgBUJwlG1ErUhYrGBW5I54VYrCjUNcDsFcRi9shURo5Mb4pIJi3g1gPi92X2b6pg78Xsf8XCZcvozSZAT4DADghcHIHuXobK9wxszqxofMba38LYfuDCNex0rqrqN6DMF6fabyVKb2nU5OLob2FAbwlA7qjkXARsx2143InQx4dSdMlohWzi5mh4zsnYj6tYXUxODSJK78lSV4j25mXSFCFCFmLMnoFezYpm9yZm7IJedGPabYR8nAteFqHGr0383eNY783EjylAFep8t2nedO7A9crYDGvO9cz4d6DgRsDMni5wBa7spSL0l2rYP4NYRaLqNwPiR87atqBuV6Nshqx4jKViDevEnyhQLU5UjCTKPE7Sbe3mpmJqH8TWX85ipcjWbSVqtmhARsrevk5ovSjQRMzcdUFqpibsbM38J4hmFgNAfGpI1mXSxMditUp6pizOtczI3SpsPQVChI9cHaxCFiXcvqHSbWvyJUXuzqzOda7cdSPI9YHWTQHEb0taZG1gp0z6ZIPCre7onWPuDAfsXqvYzKzgzYJgl6Rg3OvMHoFqDmPAPmJK1cxgNytchCHCVY7yRul2JGJKfiBqjYLUFkLkF0rkLUvany7sL2fQVs1SfGroVYvaHaZ6LE78HwfEVoXwFKlslS92NgD4Fc3UrqZ4ZOpKZSRelMTKBelm5eJSlUJehUpYTaf874BWzMbUvmvg3EngnwDiPenilkFsHCnoNcLY3A1QX2tMLaN8JeROjQlYfmJyDMDovILmvszINwLIPefsNubglSlUjoz6vCloZCJ8dmLwREFuBg5ivkDMJepwdy94l8fiNGHGjSHOvKVMNGjU72pmtMPS9ElElshSZGHIfsZiHgxIRI1CFQxulCVgJIdaja30dmDwVQN49SV2X6twxW3GrAVIRoZiDgLUFI5c5iNkRgvOVGlq3eX2paLAxIRmNynALApEtmh6BIzuvmTAV2ny7ANAZ2zYDcxK1SHMDuvajyTa7wPIZoDMlsPKFAvML2vMfCJ4zs9kbM567ONejq7Af8li3gxCB6FkpGl8xetEVqXifAbodsrsJaDYNUlcpyt6HGPsReBkTgTEBatMBYfe1M14pC1i7AP81mzCdYTCdyV8tKR4VInCjmpi7OJEXWjYH8HaNUhSPiFSfQvktORmBctuLSDWNEFGXav8DqJWRgFk7EVKx0pKlwnEhYHUbsrEPAdaPK7YVW3IbUnmP45KdEhKbo1cvKxWlk1Cx6Xkji9uBEvEHSJqfAByl6v6loJGj8hsdaNONa3ybuPsjmbYPwF03ARYDuFibqD2pYtstK9SNCJ2Fa3m9yTMZc1I9WXCxM7ohAtg3ur0hG72PCdKv4p6ds3G9wNAVwxq9sXQlGZmXUlQ7oNiVOlIpGrsVkVADi9OlUXiB0daTgjiTWFwHODErsnEDs5kJaBGpA5OfmLkvwtcj87eRwZAlgB0zglgBSTyNQnIpszGxidqPQx8tChYhUFUJkbmRsPWB8lMRcpiNsnIHwbCFgxs5yDUJ4DuzQJWjQZcZ25EjWhuJ8vIpI7iZcLUr0f4pMVE9uDIR4xYDA5kdEfOdARo1mnYbAPMHwJUNQFYXUZ2pgHsfKfAVujsVehGpaTyr8ze3CbkVs5cFCta1ObotO7qHE9uZeHAFojkVmlIJiZorGBAVCH4zsJgtSFGd0nKRilMn6dizG5mnkn4DOHQjwVQ3y1mRkLuXOFkjQZcxihCrurmNSJqlUDGlQVUDEpSxEJelKRkj2NObEvuVgzsPodO78hyrCZeHS3Q7mXq547GLg5AJGtinWDEXQXS1iLCLCZ6n2hq3QrK3SrIhCZAhY3CdKxg1ERy9MrCNk9iniTgRCFEnKZYdEboDqp6xUZuzizwFsbWnCtyxmhy1ONqpCpiLi1gbav0Hut0XkFUfAtWhYBWvsPcDS9cHYNyTyBMnMVo32nqJaNAZ476JAB0VKTKTshAnQVGNOnIHgJwnQ1O9KJwBY1k5S9mdyj2X8Vy9AbwX8RIROfIje9On2LC3u3wh0DuJYDsVepwj0FO
17	170	DAPMRWNgVwJeXshG1qLuJgBcTEbOb8x8hIreteBG1kFShoz6TsF8dW18nqB2HU7aHavYLKpGrkxc3obKTOB85YBsrmPOt2Vmre7K3GtejsdYhIfYRSbSPgzybutmNwTqR0xm9UVUf0PQV0la301A1AJU50F4Tal6L0tINQB4rkJq56vEDmt01YPidc3mdmjw3kNsBoxajeR8h0fSxMfIJm5ynCpwze5qJKp6rkNUv4p8LW1IhAhqP6XgJ27CRg7QzYbCHeLEJARInoRqvWNEb6TQ9ENqZgRKF83u7KLQx0FiVOnMPYzSxm3kVk1ihoHKVcVcjsFeBSByb0Z89CtC9OvQlOVGpYDILQFIBmRmTG9O1uXaLGLmfcDEbmFWloNCXmVWJqlYbyziNc5CNSXybMT4rUV8tkL27kVQdCX0X2bSxy1ctEhKv0lwZmhITs7yNERkNOVAPejYpAbUly1o9EZw1q3qP4FIj2TsVCz8d0BijmZc5ob4f0vGjirCHcfGrkjgjqb8ryh4Dg7s5qbOTiD8RIJKR2pKhqJkPqdYrMzUP8vCLu5YN2Py5EfuzEf2LcHCf4fkhojIHiBiXi50n2tEl832fUXy9CdiLkrEfobYTMRYfqdkv6TSxOZazOHohYPczQleFgBoJKpyrijMjwXIBCPu9sFQhYbqt0Tg9Y3EtCtIVYH6nerUHiZy9EDeDq5q3kX6HUpcz0dyDUFiVchuHo7Kb6PWPwpk9EtmlIxKB0ZapOXevenSRI3ArQb4lCfEdO5k1gzIdodgN8xonqLAFmLG3YxUtqTadWx4dAN8LUF27GNqhczANkzuzA92fw1e1EzsLCZwxILSXKbupovelQr6DCJ6BK9uPU1SDwtSryFqLYNi7WhyT4pMv218nkZS5aN8RUn2BUpEP8RgDEPSvano7OLexo1u3CvOXkbalENev6VkZmdgdqXAVIrMTwBW5Itm9UZe7ufKDGFSDMLARWtmT4VuFOj8dG1sBK1MVatYrKJuzQ3eHAZY7WpCXEHCrkZSjgBOxcpifoHuTufsR6LyJejAfUPkfmDK7qH27mdGd4lirwfgJarAdudkLuhMhm5QxwTET8vkzOJI94t6ZepoL2R8JAfKHOnkx0vS78rsDmR85EhA5CrCR8RUhkrORiVO5mlmtWzMv8bMzex0zwZCfeV6luh0z8hYdy3uRQN21GHe5qvuZWXIPMvQ1ud8NQRYx6r41GXuditK9mN8NKHarOPs7k5OpeDkjUFAduTw3wrGniXC9gJgtED63GPyJEzcnM9e3SdIrCTyJG7arc9s5g1izAzcR0FkFiXafQxClg9UhKHwhCB0nu1WDy7kZ2nmPUNajcnwpI7WfGhw58rWzQnOP85Ino7WlMXw5C5w9sfIhePQfAXSR4TELs7qxAxo3uvSLk7iD43gvW3IFidSd2dA1ERWXChYHaLWp6jsfORADCdWv8PilsHGjAH6lS3qXebEbS94JA3kDIfCxc94hQxmtQlufkLmJ8TAPM74Fcz6Ds9WtC9w5yb6Fc1urGFc74jYlirolkPQFGZkPidKH0hadC9ajWvetA3Ark3EPQLa7ClITunoJW7kDUB8TQ3Kb89Ob4rQrOryFgBYDIncziFGLaDCrAnAXOdIdatU3Excp8f83KlYnCxoXWF6TKfiDIBOLaBkFIf6pIXgZCnwxuZAZ6BoZmnkL0JslgLUjstgrAbuZ2zmPApET0zk9mfynWdWjoLC92b6FG5i5kNepY30Rkb2xwHKlgdijGjMLkfk5GnyN6xgX4tYvgtOLA9obCpO1kReLkve9Mpixkhgh2b4Z0h2Vk9Srch6XAtmNiFMxux6R6by36poDonuJKjQNId0zuxYx6P2jmFInUVWBGh8zu1QLoj0BW5qhe3snCBSP4Le96NoLunWB65evaVYTINypQzknCJyfGLYnqz2TgBUJwlG1ErUhYrGBW5I54VYrCjUNcDsFcRi9shURo5Mb4pIJi3g1gPi92X2b6pg78Xsf8XCZcvozSZAT4DADghcHIHuXobK9wxszqxofMba38LYfuDCNex0rqrqN6DMF6fabyVKb2nU5OLob2FAbwlA7qjkXARsx2143InQx4dSdMlohWzi5mh4zsnYj6tYXUxODSJK78lSV4j25mXSFCFCFmLMnoFezYpm9yZm7IJedGPabYR8nAteFqHGr0383eNY783EjylAFep8t2nedO7A9crYDGvO9cz4d6DgRsDMni5wBa7spSL0l2rYP4NYRaLqNwPiR87atqBuV6Nshqx4jKViDevEnyhQLU5UjCTKPE7Sbe3mpmJqH8TWX85ipcjWbSVqtmhARsrevk5ovSjQRMzcdUFqpibsbM38J4hmFgNAfGpI1mXSxMditUp6pizOtczI3SpsPQVChI9cHaxCFiXcvqHSbWvyJUXuzqzOda7cdSPI9YHWTQHEb0taZG1gp0z6ZIPCre7onWPuDAfsXqvYzKzgzYJgl6Rg3OvMHoFqDmPAPmJK1cxgNytchCHCVY7yRul2JGJKfiBqjYLUFkLkF0rkLUvany7sL2fQVs1SfGroVYvaHaZ6LE78HwfEVoXwFKlslS92NgD4Fc3UrqZ4ZOpKZSRelMTKBelm5eJSlUJehUpYTaf874BWzMbUvmvg3EngnwDiPenilkFsHCnoNcLY3A1QX2tMLaN8JeROjQlYfmJyDMDovILmvszINwLIPefsNubglSlUjoz6vCloZCJ8dmLwREFuBg5ivkDMJepwdy94l8fiNGHGjSHOvKVMNGjU72pmtMPS9ElElshSZGHIfsZiHgxIRI1CFQxulCVgJIdaja30dmDwVQN49SV2X6twxW3GrAVIRoZiDgLUFI5c5iNkRgvOVGlq3eX2paLAxIRmNynALApEtmh6BIzuvmTAV2ny7ANAZ2zYDcxK1SHMDuvajyTa7wPIZoDMlsPKFAvML2vMfCJ4zs9kbM567ONejq7Af8li3gxCB6FkpGl8xetEVqXifAbodsrsJaDYNUlcpyt6HGPsReBkTgTEBatMBYfe1M14pC1i7AP81mzCdYTCdyV8tKR4VInCjmpi7OJEXWjYH8HaNUhSPiFSfQvktORmBctuLSDWNEFGXav8DqJWRgFk7EVKx0pKlwnEhYHUbsrEPAdaPK7YVW3IbUnmP45KdEhKbo1cvKxWlk1Cx6Xkji9uBEvEHSJqfAByl6v6loJGj8hsdaNONa3ybuPsjmbYPwF03ARYDuFibqD2pYtstK9SNCJ2Fa3m9yTMZc1I9WXCxM7ohAtg3ur0hG72PCdKv4p6ds3G9wNAVwxq9sXQlGZmXUlQ7oNiVOlIpGrsVkVADi9OlUXiB0daTgjiTWFwHODErsnEDs5kJaBGpA5OfmLkvwtcj87eRwZAlgB0zglgBSTyNQnIpszGxidqPQx8tChYhUFUJkbmRsPWB8lMRcpiNsnIHwbCFgxs5yDUJ4DuzQJWjQZcZ25EjWhuJ8vIpI7iZcLUr0f4pMVE9uDIR4xYDA5kdEfOdARo1mnYbAPMHwJUNQFYXUZ2pgHsfKfAVujsVehGpaTyr8ze3CbkVs5cFCta1ObotO7qHE9uZeHAFojkVmlIJiZorGBAVCH4zsJgtSFGd0nKRilMn6dizG5mnkn4DOHQjwVQ3y1mRkLuXOFkjQZcxihCrurmNSJqlUDGlQVUDEpSxEJelKRkj2NObEvuVgzsPodO78hyrCZeHS3Q7mXq547GLg5AJGtinWDEXQXS1iLCLCZ6n2hq3QrK3SrIhCZAhY3CdKxg1ERy9MrCNk9iniTgRCFEnKZYdEboDqp6xUZuzizwFsbWnCtyxmhy1ONqpCpiLi1gbav0Hut0XkFUfAtWhYBWvsPcDS9cHYNyTyBMnMVo32nqJaNAZ476JAB0VKTKTshAnQVGNOnIHgJwnQ1O9KJwBY1k5S9mdyj2X8Vy9AbwX8RIROfIje9On2LC3u3wh0DuJYDsVepwj0FOn21SNgPwbYREF0RwnwrkXUBU1iFybMFuXojClOR6HsfQBW7wHgN8J8TQP0dOVYRYhyTIPAtWjaHq9QJGjsLAP0VKj4p6bMLARcrGTe5u3AVG7AhGv2PaRwHyDITchmri9kX2rsb6ZsZwpUVOtc7kd8BGFqJ0PIRAT61K9Gf2rqfmfQNGpk5WxA78Xm1yxcveFMrIjStgh4xIlSNUFYlS7sTex2BoPqfOV0ZodYLA1MVW1K9qjufeXW1yZKTQRSVeXKbCdydg5MRCzAhAFaFoJg3KjGPITChqrYPWDQjYHcnYxOZQrAvEJGN4xGXQhC3S9gNKb096HUdSxqjct45o7WDc1aNWxwl4NWvqjArqx8vOhghstc7016FWrMPstGVMdqLoDgJMLadOhKLQbwLwzufMhY3GlIR4NCxeRgPInmf63g3c3w1EnG5uvylAdaF69u5IVcVQlOxmfulmPWTAtmbuBGveFuxOlGxIBIRa52NGBUjW5GtaNSrIJurI3WD0DMpq3sXkb6jyvKnKjgV0Dcp4NGvMHwz2p4neHqZwbqruvcFyBATOvw3IfUNen2pmzA76t4pKNMXivulEXszQtQXAhcVaF4fYPIr6Xix6bcTaR4bu5q5K9Qhy9WVAxYzk1s9AdIBa7OPKfQR4LwtwPeR41sb0zQhutC3SHi9CvK1MXSRizsReB8DuPKxI9w9gNSZgHAxULuxef8923EjWfGp4lAhmvgFg5aj8HEF2pSpmRkhIdQn6lmbEbivuVcFojQVkRm3W56Fwvsfo9eZe7kN4p2hct0xsJgn0r6vk3qjuvW10B4xw3aNSP25ShUdw5qZy9inarcp0vwHSbcrMf4LKbW5eH4z0TEdOpeD4t23GBmNmR29sjIViv6hul0FK78tUz63CjgpCf4livyd6liTi3Epax056rW9AXklCBwbw16L0Xs9Cz8RarCPeP4ZirMBuzWBID0nEfYTez4RsNgxaVCLcJWLeLIjkjkfq
select * from t1 partition(p2);
C1	C2	C3
26	150	GLC9OlurQ30RoDyDOj47AdazyTITyxc9UnUha741olOR0LgZCxKXCpQP2J8NklubStYHurgbmbmh23CjsViLMlCpSLG7CN4f4hEvMJ63E9WRK7qD4JkjERihMX4bkjGFkve161ghcjCNOXgT4tENSxgHYXOJ2pYLa1IZKlWr2HkdqTgzibKTohgvQfI7g1ovEB0vMVarAZStSLg7STWdAH4vw3IPUnkpsHyzaRizE3yFynIJIFgxUT8VcTA1GvyxOvg1YzWR8tIHId2tuPy1oLsvgT4JyJs7CP2vqnWPKvi1SxGDW7ypG7ILoHUxgDiBKrCr8h47qpw1Y34VuHYx8F6xOtIJUvcrOzmfCnMhIpwDiPa3UXuHiRwpMvg1e9UvcHcVwLODw363Glc7KFcLQZE5En8JSfA5kxy3It6ncD8VW1srwRazmnIn8fWpMZE1EvSTOB8Tkn2t0PwTct6dQPI1mL6fs3CN4pwLK78HKzE9GFC349i721AhULORahOno3knMrQBwjQXu7ujgPQjQLmrA1MDA7wpedSNsrI7qbktiv8ZUZSJURmNIHAVSJs3MN25Ifs3o1YRWbod0LS3CVgFytSJKP4zIpoPA92pCzcxETitQ3QlexsHuFA7kjA7QBOJ4HcN2L4buzULUrgX2RYJMXYrmtkvIPkDmPCTubM3gpYvWVq7YpkDEbEvchCr4BI34vIvwvGTivEbWZwbeFMjw1C9UBiHUtc9sbAVuLuTMNgB0HKbkz6da7kxoXOZsdmLCL0xCRo5yZsZ4bi9OXcbovW7wFA38HAx6Foxifmt61gZUD4pChGNq9WtUxi5qJSlqhSD43ytIZkxaZqbwPKbYF614dkt63ixeHYNKVuZGBcXEjizSrutORunQJcjaRIJujgzITSrk5e1wbmteP0pMb2pMLgncD0x69EjEHmDej43ohSlYlM14LoHmL2J6nsXmfO36tUVwlwNaLSRGhexm1wnizePWHKDcpEXOxO7c56bUTuH0HK9IfWTIJOByZCXOFgdGvmnunMHSrE92nm5y5upeVsl6DWXsnSpKxCv0BI3wvGHoj6Dqjux81e9EZon6dAXyraDInIRyp4RmpOtWpYJ6V2RCZqF01G72DCv8NgvGRArW1QZALKr4lGZSzkNoZ0z0Jcl8vYz4NMFiPyVYry3YvKX4H47ezYRy9qrqbq7Etmj8PY54lcnGJ8FgdaruHolcT6r2pQhA5yzcbYZgBkRuNQbWtURydgFAj4vUFs9wfm5AlEByt8pQvkVShIDKRk9W5kZ4hilC5OZozeB2NyJgrWlsNs1aPYb4NQrqFKt8ZKXgTilgxkdmN2BqzS3QLQrwFoJqBora1UR0fE1EXG1otMXwFa7eJW1i1svIzEry36H8Jm9cnkF2zQZOh6P8dwDejy7QNUBG1iTWFqDMBiRkV410VKbqpWVY5qpeLEz6xEzcdgJal4JOVsXAbmpoZyvqdURO14Tefu96pSP2NwxSFMnsbQhGrsXaXKnGlMjifOpcL8Z0byxaDqPivWJOreJKj4FqBMtg9YL0xalQh2NQ7SxsbeDaxUBKnoZw7AzW1iTAhSrifMjmtEz6RoRGhY5I9y3Mbg9m1WT4lGr4Da3Yf21kxITwzkvinGP2piHeRw5mbMZ6lanipWbqPmHIrsXWZsp2LsRsRETUryr8RgtMvG7shAF0VWlIzAzOpcXol8LSN6X0BUjcne50XsLsTCPCD03Q9EVO1cl4HiPCVwDkRspyJYrsREF2HWbMTuDAP2PkrUDmjOf852l87CfyLi16l8jc7aVGt4H4d0fQtStCB2BQlC3GHgNQ7ixifADQBmxgNgRKjABWReTKrEpudy3SNSJCvG9wfWPI3qFOjqHijSnybOBGxIfQRoForS3iV09knWd01CPUBuV614pc3Ap2lglIh4fITM5y3kHEXCFg7IlynyzWxy9afEHWtMdkDufyTEhgtGvE5mjULEHUru7274dQ7KhmxUlupiPYP678pIZCpCnCF4Hsl0D8FuTgj8huBaxg7mrSNiR67i9QjK9C5IriLqVMDMJMrEnSrglSxeNwlsPyHS7k9YpUliRErsrYLoNu3YpOvcTw363ov4forevk1ylOrq94JK3czUZex0l01E5w3YBElqLwrq1W3kNSlgHiVwvivyBaNQzW9E1YBmpaHUhs3OFMlWL4JgNAtYjid8fmzCTo3OVKTqBI9utalQbynoleDgL4tCV0ZSti9y3qpixCNsxyJoHSxoVyJ2vs5oPc7oVUvAXyxmNeV4ZWDqh4fURw1ELwpSf8zsZ0XwXalUnIzkFCXg1wR0rWFePkP476pEHipe9gHEVK1O5ETAToVqZkBYvIvm1IXApgTupMl8raTsXoV8D4pqnkB2jC5C5Q9sJUjmZqlE5U1UdGLALc5CHmv4VePAZMzOtSdarKzSP2zij2rixyhS98BQzU5y98XadMz2ZENQ1oRWpeB49KjS7G3ir45AvoXCbcFC905k709AHgfOvK3QHglUlOxgXUvmlEdQNEVonSdCtspeJIFuFwr0J67o3Stk9qzSdWFsBU5c32VgFAXq5kzQ5If854pKhe1Ohe30L6RgV0dAhQvQHw5ohmLeZkHeLS3crS38JsP0ToTcX89IrOJwbwhc309cxc7wnqR27wHalYRMh2dOH23aLgxiVWR2P85OlqhMh6DkVMBezOTwT0pELc5uJ0PWXYNUNcXW3ez8PWZWD2barQVI5sjWNGZY96H0pKrq3aBiZOhqBUbKJa3yvAHG3AZQzWj6fKlSdQzuZQtMdkjQBojMDst8FmNInALC1ydObGNOXCdeJY1YFa1MNsLW9A5AHyZARm3Unu5AxIjAr6FinQXkbkB4dW5u7WTAtMjOzaTcpW58xEpEZwD6Hajut8vCxutitMlcxGhUhgvgFOzopuBuZ4tOdOPYPuLeNYHaRSZqRgdkJcbUD8jOjWRI1iZM1q5ClqnS9Ef4TapAhWJatWRkvqjcjkZqNa7svAxKhIHwhSLWxKPsT63uJYzst4x2zi5aHab4jwPaTWHMbqxO5yZizgzo3UJsLITYbGrQt4lOZ4ry5UlWFMDq3wLWFqX8t2NMBS30j6lALUbWrEH21UPmbaLS32nK3GdupSjElAb2TIF4Jgl2tmlubW1SPALyDorUjiZKXs7UF4fSp25upiBM5A7epIlKjEHgbmdUVWvKLS5Ml4vUFsjGza3UBgnUzWxSbG3e9uLktEnMR8fq3whSFOzsveRUDQb6NsHarYNCZGTo7ENUfcdelutwrYt4hAdG3Qt0zQnYRWr03urCroFQRuHCLyXuhcFsDonKxC5050zyTId8zQVC5oXWDQ3YPEJKr01w16N6Xw9eZCxopYZGVghAhgHIz2REV8p2XudgHUloTul2dIrgR8VaXSHKZgveBMnah6R2L2X4LMl25sxOhKTmzeNiJOpuHwbUncBg9yNqH6LIPejEz8nufG1IH2vinI9Sx4tWZoNULIbiF0DmvsNclK1oTyd61sf2PgLq1Cv6XaNUhSfYDctmr0HqxGDUtCVeHE3ENoVgrKHCNcbsTufg3YxkjWXajwFUd6DctSx4LQVkLChsHunwvKTohsFSHqjiZGpKP0FurM5M7ytYBQ3WTkP8nEhWpkzC9GTw7UbiLElehoJqjm1k9ObcxsxY7cHiJIZSpyRuhitYZkNMNyrCxo56zqpgLQ3u78BAheRch8fIdmbebYXuLo78linKBIzET4BmLiRwFKxYJ8p8rgjE9ADG5e5GlU30H61GxcZk3kJIV232X4rmlk1kfOfghGJMTizy7k7mvU5oVqVQz2ze3eTmHMD014BIp65ctiZaXCHk92hAZYz8HshKdQ36NK9cFwvCp6jeb6d6j8F4Z8NyDg5GPCJ8fi34Taz8tgZCl4bExm3kHqRE5KDGDmraRqt8HuL8bIDKhWNo3gHavU7IfApqfw9MdYrAPSrErq72vUpslgDwj
29	160	GLC9OlurQ30RoDyDOj47AdazyTITyxc9UnUha741olOR0LgZCxKXCpQP2J8NklubStYHurgbmbmh23CjsViLMlCpSLG7CN4f4hEvMJ63E9WRK7qD4JkjERihMX4bkjGFkve161ghcjCNOXgT4tENSxgHYXOJ2pYLa1IZKlWr2HkdqTgzibKTohgvQfI7g1ovEB0vMVarAZStSLg7STWdAH4vw3IPUnkpsHyzaRizE3yFynIJIFgxUT8VcTA1GvyxOvg1YzWR8tIHId2tuPy1oLsvgT4JyJs7CP2vqnWPKvi1SxGDW7ypG7ILoHUxgDiBKrCr8h47qpw1Y34VuHYx8F6xOtIJUvcrOzmfCnMhIpwDiPa3UXuHiRwpMvg1e9UvcHcVwLODw363Glc7KFcLQZE5En8JSfA5kxy3It6ncD8VW1srwRazmnIn8fWpMZE1EvSTOB8Tkn2t0PwTct6dQPI1mL6fs3CN4pwLK78HKzE9GFC349i721AhULORahOno3knMrQBwjQXu7ujgPQjQLmrA1MDA7wpedSNsrI7qbktiv8ZUZSJURmNIHAVSJs3MN25Ifs3o1YRWbod0LS3CVgFytSJKP4zIpoPA92pCzcxETitQ3QlexsHuFA7kjA7QBOJ4HcN2L4buzULUrgX2RYJMXYrmtkvIPkDmPCTubM3gpYvWVq7YpkDEbEvchCr4BI34vIvwvGTivEbWZwbeFMjw1C9UBiHUtc9sbAVuLuTMNgB0HKbkz6da7kxoXOZsdmLCL0xCRo5yZsZ4bi9OXcbovW7wFA38HAx6Foxifmt61gZUD4pChGNq9WtUxi5qJSlqhSD43ytIZkxaZqbwPKbYF614dkt63ixeHYNKVuZGBcXEjizSrutORunQJcjaRIJujgzITSrk5e1wbmteP0pMb2pMLgncD0x69EjEHmDej43ohSlYlM14LoHmL2J6nsXmfO36tUVwlwNaLSRGhexm1wnizePWHKDcpEX
select * from t1 partition(p3);
C1	C2	C3
drop table t1;
drop table t2;
# 二级分区表与一级分区表之间交换，分区键不同
drop table t1;
drop table t2;
create table t1 (c1 int, c2 varchar(50), c3 int)
partition by range (c1)
subpartition by hash (c3) subpartitions 2
(
partition p0 values less than (100000),
partition p1 values less than (MAXVALUE)
);
create table t2 (c1 int, c2 varchar(50), c3 int)
partition by hash (c1) partitions 2;
insert into t2 values(1,'part1', 2), (90009,'part2', 4);
alter table t1 exchange partition p0 with table t2 INCLUDING INDEXES WITHOUT VALIDATION;
ERROR 0A000: internal error code, arguments: -4007, Exchange partition between tables with different partition keys is not supported
drop table t1;
drop table t2;
# 二级分区表与一级分区表之间交换，list分区值不同
drop table t1;
drop table t2;
create table t1 (col1 int, col2 varchar(50), col3 int)
partition by list (col1)
subpartition by list (col3) (
partition p0 values (100, 200) (
subpartition sp0 values (1, 2, 3),
subpartition sp1 values (4, 5, 6)
),
partition p1 values (300, 400) (
subpartition sp2 values (7, 8, 9),
subpartition sp3 values (10, 11, 12)
)
);
create table t2 (col1 int, col2 varchar(50), col3 int)
partition by list (col3)
(
partition p0 values (1,2,3),
partition p1 values (4,5,13)
);
insert into t2 values (100, 'list partition', 13);
alter table t1 exchange partition p0 with table t2 including indexes without validation;
ERROR 0A000: internal error code, arguments: -4007, Exchange partition between tables with different partition bounds is not supported
drop table t1;
drop table t2;
#二级分区表与一级分区表之间交换，range分区范围不同
drop table t1;
drop table t2;
create table t1 (col1 int, col2 varchar(50), col3 int)
partition by list (col1)
subpartition by range (col3) (
partition p0 values (100, 200) (
subpartition sp0 values less than (10),
subpartition sp1 values less than (20)
),
partition p1 values (300, 400) (
subpartition sp2 values less than (30),
subpartition sp3 values less than (40)
)
);
create table t2 (col1 int, col2 varchar(50), col3 int)
partition by range (col3)
(
partition sp0 values less than (10),
partition sp1 values less than (30)
);
insert into t2 values(100, 'range partition', 23);
alter table t1 exchange partition p0 with table t2 including indexes without validation;
ERROR 0A000: internal error code, arguments: -4007, Exchange partition between tables with different partition bounds is not supported
drop table t1;
drop table t2;
