use test;
drop table if exists tt;
create table tt (x char(7));
insert into tt values (null), (''), ('中国'), ('China'), ('中China国'), ('中华人民共和国'), ('Chinese');
select x from tt;
x
NULL

中国
China
中China国
中华人民共和国
Chinese
select length(x) from tt;
length(x)
NULL
0
6
5
11
21
7
set sql_mode='pad_char_to_full_length';
select x from tt;
x
NULL
       
中国     
China  
中China国
中华人民共和国
Chinese
select length(x) from tt;
length(x)
NULL
7
11
7
11
21
7
drop table tt;
create table tt(c1 char(4), c5 char(6));
insert into tt values (1, 2);
set sql_mode='pad_char_to_full_length';
update tt set c1='中国', c5=concat(c1, '4');
select * from tt;
c1	c5
中国  	中国  4 
select length(c1) from tt;
length(c1)
8
drop table tt;
