obmysql-length-3 及obmysql-length-5
drop table length_table2;
drop table length_table;
drop view length_view;
create table length_table(id int, order_id double, name varchar(40),date_time datetime);
insert into length_table values(10,15.59,'kebi','2020-05-01 12:01:35'),(15,14.29,'maidi','2020-05-17 18:02:30'),(29,12.32,'yaoming','2020-05-23 23:59:59');
create table length_table2(id int, sal double, order_number varchar(40),date_time datetime);
insert into length_table2 values(10,3000.265 ,'10','2020-05-01 12:01:35'),(15,2100.25,'15.29','2020-05-17 18:02:30'),(29,1500.69,'12.32','2020-05-23 23:59:59');
select length(e.order_id) a,length(e.name) b from length_table e;
a	b
5	4
5	5
5	7
select p.a,p.b from (select length(e.order_id) a,length(e.name) b from length_table e ) p ;
a	b
5	4
5	5
5	7
select e.id,e.name,length(p.sal),p.date_time from length_table e left join length_table2 p on length(p.order_number) = e.id order by 1 desc;
id	name	length(p.sal)	date_time
29	yaoming	NULL	NULL
15	maidi	NULL	NULL
10	kebi	NULL	NULL
select e.id,e.name,length(p.sal),p.date_time from length_table e right join length_table2 p on length(p.order_number) = e.id order by 1 desc;
id	name	length(p.sal)	date_time
NULL	NULL	8	2020-05-01 12:01:35
NULL	NULL	7	2020-05-17 18:02:30
NULL	NULL	7	2020-05-23 23:59:59
select e.id,e.name,length(p.sal),p.date_time from length_table e inner join length_table2 p on length(p.order_number) = e.id order by 1 desc;
id	name	length(p.sal)	date_time
select length(e.order_id) a,length(e.name) 姓名 from length_table e;
a	姓名
5	4
5	5
5	7
select length(e.name collate utf8mb4_general_ci) as 姓名 from length_table e;
姓名
4
5
7
select length(e.name collate utf8mb4_general_ci) 姓名 from length_table e;
姓名
4
5
7
select e.id,e.name from length_table e where exists(select * from length_table2 p where length(p.order_number) = e.id ) order by 1 desc;
id	name
select e.id,e.name from length_table e where not exists(select * from length_table2 p where length(p.order_number) = e.id ) order by 1 desc;
id	name
29	yaoming
15	maidi
10	kebi
select e.id,e.name from length_table e where exists(select * from length_table2 p where p.order_number = length(e.id)) order by 1 desc;
id	name
select e.id,e.name from length_table e where not exists(select * from length_table2 p where p.order_number = length(e.id))order by 1 desc;
id	name
29	yaoming
15	maidi
10	kebi
select e.id,e.name from length_table e where e.id > any(select avg(length(p.order_number)) from length_table2 p);
id	name
10	kebi
15	maidi
29	yaoming
select e.id,e.name from length_table e where e.id < any(select avg(length(p.order_number)) from length_table2 p );
id	name
select e.id,e.name from length_table e where e.id = any(select length(p.order_number) from length_table2 p );
id	name
select e.id,e.name from length_table e where e.id > all(select length(p.order_number) from length_table2 p where p.id = 29);
id	name
10	kebi
15	maidi
29	yaoming
select e.id,e.name from length_table e where e.id < all(select length(p.order_number) from length_table2 p where p.id = 29);
id	name
select e.id,e.name from length_table e where e.id = all(select length(p.order_number) from length_table2 p where p.id = 10);
id	name
select *  from length_table a  where length(a.order_id) like '%5%';
id	order_id	name	date_time
10	15.59	kebi	2020-05-01 12:01:35
15	14.29	maidi	2020-05-17 18:02:30
29	12.32	yaoming	2020-05-23 23:59:59
select length(a.name)  from length_table a where name like '%k%';
length(a.name)
4
select length(e.sal) aab from length_table2 e;
aab
8
7
7
select length(e.sal) aab工资 from length_table2 e;
aab工资
8
7
7
select e.id,e.sal from length_table2 e where length(e.sal) > 2000 order by e.id;
id	sal
select e.id,e.sal from length_table2 e where length(e.sal) > 2000  and length(e.sal) < 3000 order by e.id;
id	sal
select e.id,e.sal from length_table2 e where length(e.sal) > 2000  or length(e.order_number) > 15 order by e.id;
id	sal
select length(e.sal) from length_table2 e where e.id>20 order by e.id desc;
length(e.sal)
7
select e.id,e.name,p.sal from length_table e left join length_table2 p on e.id = p.id where length(p.sal) > 2000 order by length(p.sal) limit 2;
id	name	sal
select e.id,e.name,p.sal from length_table e left join length_table2 p on e.id = p.id where length(p.sal) > 2000 order by length(p.sal) desc limit 2;
id	name	sal
select e.id,sum(e.sal) from length_table2 e where e.sal > 2000 group by 1 order by 1 desc;
id	sum(e.sal)
15	2100.25
10	3000.265
select e.id,sum(e.sal) from length_table2 e where e.sal > 1000 group by 1 having sum(length(e.sal)) > 2000 order by 1 desc;
id	sum(e.sal)
select e.id 编号,case when length(e.sal) < 2000 then '低' when length(e.sal) < 3000 then '一般' else '高' end '工资' from length_table2 e ;
编号	工资
10	低
15	低
29	低
select e.id 编号,case length(e.sal)  when  1501 then '低' when 2100 then '一般' else '高' end '工资' from length_table2 e;
编号	工资
10	高
15	高
29	高
insert into length_table select *  from length_table2 p where length(p.sal)  = 8;
select *  from length_table;
id	order_id	name	date_time
10	15.59	kebi	2020-05-01 12:01:35
15	14.29	maidi	2020-05-17 18:02:30
29	12.32	yaoming	2020-05-23 23:59:59
10	3000.265	10	2020-05-01 12:01:35
insert into length_table select *  from length_table2 p where length(p.order_number)  = 2;
select *  from length_table;
id	order_id	name	date_time
10	15.59	kebi	2020-05-01 12:01:35
15	14.29	maidi	2020-05-17 18:02:30
29	12.32	yaoming	2020-05-23 23:59:59
10	3000.265	10	2020-05-01 12:01:35
10	3000.265	10	2020-05-01 12:01:35
update length_table set name = 'zanms' where length(order_id) = 5;
select *  from length_table where name = 'zanms';
id	order_id	name	date_time
10	15.59	zanms	2020-05-01 12:01:35
15	14.29	zanms	2020-05-17 18:02:30
29	12.32	zanms	2020-05-23 23:59:59
delete from length_table2 where length(sal) = 4 ;
select length(sal) from length_table2;
length(sal)
8
7
7
create view length_view as select e.id,e.name,p.sal,p.date_time from length_table e left join length_table2 p on e.id = p.id order by e.id desc;
select *  from length_view;
id	name	sal	date_time
10	10	3000.265	2020-05-01 12:01:35
10	10	3000.265	2020-05-01 12:01:35
10	zanms	3000.265	2020-05-01 12:01:35
15	zanms	2100.25	2020-05-17 18:02:30
29	zanms	1500.69	2020-05-23 23:59:59
select length(e.sal) a,length(e.name) b from length_view e;
a	b
7	5
7	5
8	5
8	2
8	2
select p.a,p.b from (select length(e.sal) a,length(e.name) b from length_view e ) p ;
a	b
7	5
7	5
8	5
8	2
8	2
select e.id,e.name,length(p.sal),p.date_time from length_view e left join length_table2 p on length(p.order_number) = e.id order by 1 desc;
id	name	length(p.sal)	date_time
29	zanms	NULL	NULL
15	zanms	NULL	NULL
10	10	NULL	NULL
10	10	NULL	NULL
10	zanms	NULL	NULL
select e.id,e.name,length(p.sal),p.date_time from length_view e right join length_table2 p on length(p.order_number) = e.id order by 1 desc;
id	name	length(p.sal)	date_time
NULL	NULL	8	2020-05-01 12:01:35
NULL	NULL	7	2020-05-17 18:02:30
NULL	NULL	7	2020-05-23 23:59:59
select e.id,e.name,length(p.sal),p.date_time from length_view e inner join length_table2 p on length(p.order_number) = e.id order by 1 desc;
id	name	length(p.sal)	date_time
select length(e.name) a,length(e.sal) 姓名 from length_view e;
a	姓名
5	7
5	7
5	8
2	8
2	8
select length(e.date_time) as 时间 from length_view e;
时间
19
19
19
19
19
select length(e.date_time) 时间 from length_view e;
时间
19
19
19
19
19
select e.id,e.name from length_table e where exists(select * from length_view p where length(p.id) = e.id ) order by 1 desc;
id	name
select e.id,e.name from length_table e where not exists(select * from length_view p where length(p.id) = e.order_id ) order by 1 desc;
id	name
29	zanms
15	zanms
10	zanms
10	10
10	10
select e.id,e.name from length_table e where exists(select * from length_view p where p.id = length(e.id)) order by 1 desc;
id	name
select e.id,e.name from length_table e where not exists(select * from length_view p where p.id = length(e.order_id))order by 1 desc;
id	name
29	zanms
15	zanms
10	zanms
10	10
10	10
select e.id,e.name from length_table e where e.order_id > any(select length(p.id) from length_view p);
id	name
10	zanms
15	zanms
29	zanms
10	10
10	10
select e.id,e.name from length_table e where e.order_id < any(select length(p.id) from length_view p);
id	name
select e.id,e.name from length_table e where e.id = any(select length(p.id) from length_view p);
id	name
select e.id,e.order_number from length_table2 e where e.sal > all(select length(p.sal) from length_view p where p.id = 29);
id	order_number
10	10
15	15.29
29	12.32
select e.id,e.order_number from length_table2 e where e.sal < all(select length(p.sal) from length_view p where p.id = 29);
id	order_number
select e.id,e.order_number from length_table2 e where length(e.sal) = all(select length(p.sal) from length_view p where p.id = 10);
id	order_number
10	10
select *  from length_view a  where length(a.name) like '%m%';
id	name	sal	date_time
select length(a.name)  from length_view a where name like '%k%';
length(a.name)
select length(e.sal) aab from length_view e;
aab
7
7
8
8
8
select length(e.sal) aab工资 from length_view e;
aab工资
7
7
8
8
8
select e.id,e.sal from length_view e where length(e.sal) > 2000 order by e.id;
id	sal
select e.id,e.sal from length_view e where length(e.sal) > 2000  and length(e.sal) < 3000 order by e.id;
id	sal
select e.id,e.sal from length_view e where length(e.sal) > 2000  or length(e.id) > 15 order by e.id;
id	sal
select length(e.sal) from length_view e where e.id>20 order by e.id desc;
length(e.sal)
7
select e.id,e.name,p.sal from length_table e left join length_view p on e.id = p.id where length(p.sal) > 2000 order by length(p.sal) limit 2;
id	name	sal
select e.id,e.name,p.sal from length_table e left join length_view p on e.id = p.id where length(p.sal) > 2000 order by length(p.sal)desc limit 2;
id	name	sal
select e.id,sum(e.sal) from length_view e where e.sal > 2000 group by 1 order by 1 desc;
id	sum(e.sal)
15	2100.25
10	9000.795
select e.id,sum(e.sal) from length_view e where e.sal > 1000 group by 1 having sum(length(e.sal)) > 2000 order by 1 desc;
id	sum(e.sal)
select e.id 编号,case when length(e.sal) < 2000 then '低' when length(e.sal) < 3000 then '一般' else '高' end '工资' from length_view e ;
编号	工资
29	低
15	低
10	低
10	低
10	低
select e.id 编号,case length(e.sal)  when  1501 then '低' when 2100 then '一般' else '高' end '工资' from length_view e;
编号	工资
29	高
15	高
10	高
10	高
10	高
drop table length_table;
drop table length_table2;
drop view length_view;
