obmysql-length-5 及obmysql-length-6 及obmysql-length-7
drop table length_table;
create table length_table(id int, sal double, name varchar(40),date_time datetime);
insert into length_table values(10,3000.265 ,'kebi','2020-05-01 12:01:35'),(15,2100.25,'maidd','2020-05-17 18:02:30'),(29,1500.69,'yaoming','2020-05-23 23:59:59');
select e.id,e.name,length(length(e.sal)) from length_table e order by e.id desc;
id	name	length(length(e.sal))
29	yaoming	1
15	maidd	1
10	kebi	1
select e.id,e.name,length(sum(e.sal)) from length_table e order by e.id desc;
id	name	length(sum(e.sal))
10	kebi	8
select e.id,e.name,sum(length(e.sal)) from length_table e group by 1,2 having sum(length(e.sal)) >= 4 order by id desc;
id	name	sum(length(e.sal))
29	yaoming	7
15	maidd	7
10	kebi	8
select e.id,e.name,length(max(e.sal)) from length_table e order by e.id desc;
id	name	length(max(e.sal))
10	kebi	8
select e.id,e.name,max(length(e.sal)) from length_table e group by 1,2 having sum(length(e.sal)) > 4 order by id desc;
id	name	max(length(e.sal))
29	yaoming	7
15	maidd	7
10	kebi	8
select e.id,e.name,length(min(e.sal)) from length_table e order by e.id desc;
id	name	length(min(e.sal))
10	kebi	7
select e.id,e.name,min(length(e.sal)) from length_table e group by 1,2 having sum(length(e.sal)) > 4 order by id desc;
id	name	min(length(e.sal))
29	yaoming	7
15	maidd	7
10	kebi	8
select e.id,e.name,length(avg(e.sal)) from length_table e order by e.id desc;
id	name	length(avg(e.sal))
10	kebi	18
select e.id,e.name,avg(length(e.sal)) from length_table e group by 1,2 having avg(length(e.sal)) > 4 order by id desc;
id	name	avg(length(e.sal))
29	yaoming	7.0000
15	maidd	7.0000
10	kebi	8.0000
select e.id,e.name,length(abs(e.sal)) from length_table e order by e.id desc;
id	name	length(abs(e.sal))
29	yaoming	7
15	maidd	7
10	kebi	8
select e.id,e.name,abs(length(e.sal)) from length_table e group by 1,2  order by id desc limit 2;
id	name	abs(length(e.sal))
29	yaoming	7
15	maidd	7
select e.id,e.name,length(ceil(e.sal)) from length_table e order by e.id desc;
id	name	length(ceil(e.sal))
29	yaoming	4
15	maidd	4
10	kebi	4
select e.id,e.name,ceil(length(e.sal)) from length_table e group by 1,2  order by id desc limit 2;
id	name	ceil(length(e.sal))
29	yaoming	7
15	maidd	7
select e.id,e.name,length(floor(e.sal)) from length_table e order by e.id desc;
id	name	length(floor(e.sal))
29	yaoming	4
15	maidd	4
10	kebi	4
select e.id,e.name,floor(length(e.sal)) from length_table e group by 1,2  order by id desc limit 2;
id	name	floor(length(e.sal))
29	yaoming	7
15	maidd	7
select e.id,e.name,length(mod(e.sal,7.8)) from length_table e order by e.id desc;
id	name	length(mod(e.sal,7.8))
29	yaoming	18
15	maidd	17
10	kebi	17
select e.id,e.name,mod(length(e.sal),7.8) from length_table e group by 1,2  order by id desc;
id	name	mod(length(e.sal),7.8)
29	yaoming	7.0
15	maidd	7.0
10	kebi	0.2
select e.id,e.name,length(length(e.sal)) from length_table e order by e.id desc;
id	name	length(length(e.sal))
29	yaoming	1
15	maidd	1
10	kebi	1
select e.id,e.name,length(length(e.sal)) from length_table e group by 1,2  order by id desc;
id	name	length(length(e.sal))
29	yaoming	1
15	maidd	1
10	kebi	1
select e.id,instr(length(e.name),'i'),e.sal from length_table e order by id desc;
id	instr(length(e.name),'i')	sal
29	0	1500.69
15	0	2100.25
10	0	3000.265
select e.id,length(instr(e.name,'i')),e.sal from length_table e order by id desc;
id	length(instr(e.name,'i'))	sal
29	1	1500.69
15	1	2100.25
10	1	3000.265
select e.id,e.name,length(e.sal)+100 from length_table e ;
id	name	length(e.sal)+100
10	kebi	108
15	maidd	107
29	yaoming	107
select e.id,e.name,length(e.sal)-100 from length_table e ;
id	name	length(e.sal)-100
10	kebi	-92
15	maidd	-93
29	yaoming	-93
select e.id,e.name,length(e.sal)*100 from length_table e ;
id	name	length(e.sal)*100
10	kebi	800
15	maidd	700
29	yaoming	700
select e.id,e.name,length(e.sal)/100 from length_table e ;
id	name	length(e.sal)/100
10	kebi	0.0800
15	maidd	0.0700
29	yaoming	0.0700
select e.id,e.name,e.sal from length_table e where length(e.sal) > 1500 and length(e.sal) < 3000;
id	name	sal
select e.id,e.name,e.sal from length_table e where length(e.sal) > 2000 or e.id >20;
id	name	sal
29	yaoming	1500.69
select e.id,e.name,e.sal from length_table e where not(length(e.sal)) < 1500;
id	name	sal
select e.id,e.name,e.sal from length_table e where not(length(e.sal)) > 2000;
id	name	sal
10	kebi	3000.265
15	maidd	2100.25
29	yaoming	1500.69
select e.id,e.name,e.sal from length_table e where length(e.sal) >= 2000;
id	name	sal
select e.id,e.name,e.sal from length_table e where length(e.sal) <= 2000;
id	name	sal
10	kebi	3000.265
15	maidd	2100.25
29	yaoming	1500.69
select e.id,e.name,e.sal from length_table e where length(e.sal)  = 1501;
id	name	sal
select e.id,e.name,e.sal from length_table e where length(e.sal)  > 1501;
id	name	sal
select e.id,e.name,e.sal from length_table e where length(e.sal)  < 1502;
id	name	sal
10	kebi	3000.265
15	maidd	2100.25
29	yaoming	1500.69
select e.id,e.name,e.sal from length_table e where length(e.sal) <> 1501;
id	name	sal
10	kebi	3000.265
15	maidd	2100.25
29	yaoming	1500.69
select e.id,e.name,e.sal from length_table e where length(e.sal) != 1501;
id	name	sal
10	kebi	3000.265
15	maidd	2100.25
29	yaoming	1500.69
create index length_name on length_table(id);
select length(e.id) from length_table e;
length(e.id)
2
2
2
select e.name,e.sal from length_table e where length(e.id) = '10';
name	sal
select e.name,e.sal from length_table e where length(e.id) > '10' order by e.sal desc;
name	sal
insert into length_table  select * from length_table e where length(e.id) = '10';
select * from length_table;
id	sal	name	date_time
10	3000.265	kebi	2020-05-01 12:01:35
15	2100.25	maidd	2020-05-17 18:02:30
29	1500.69	yaoming	2020-05-23 23:59:59
update length_table e set name = 'zanms' where length(e.id) = '10';
select * from length_table;
id	sal	name	date_time
10	3000.265	kebi	2020-05-01 12:01:35
15	2100.25	maidd	2020-05-17 18:02:30
29	1500.69	yaoming	2020-05-23 23:59:59
delete from length_table  where length(id) = '10' ;
select * from length_table;
id	sal	name	date_time
10	3000.265	kebi	2020-05-01 12:01:35
15	2100.25	maidd	2020-05-17 18:02:30
29	1500.69	yaoming	2020-05-23 23:59:59
drop table length_table;
create table length_table(id int primary key, sal double unique, name varchar(40) not null,date_time datetime);
insert into length_table values(10,3000.265 ,'kebi','2020-05-01 12:01:35'),(15,2100.25,'maidd','2020-05-17 18:02:30'),(29,1500.69,'yaoming','2020-05-23 23:59:59');
select length(id),length(sal),length(name) from length_table;
length(id)	length(sal)	length(name)
2	8	4
2	7	5
2	7	7
select length(id),length(sal),length(name) from length_table where length(sal) = 6;
length(id)	length(sal)	length(name)
select length(id),length(sal),length(name) from length_table where length(sal) = 8 order by id;
length(id)	length(sal)	length(name)
2	8	4
insert into length_table  select length(id+1)id,length(e.sal),length(e.name),e.date_time from length_table e where length(e.sal) = 8 ;
select count(*) from length_table;
count(*)
4
update length_table  set name = 'zanms' where length(sal) = 8;
select * from length_table;
id	sal	name	date_time
2	8	4	2020-05-01 12:01:35
10	3000.265	zanms	2020-05-01 12:01:35
15	2100.25	maidd	2020-05-17 18:02:30
29	1500.69	yaoming	2020-05-23 23:59:59
delete from length_table  where length(sal) = 8 ;
select count(*) from length_table;
count(*)
3
drop table length_table;
