alter system set _enable_defensive_check = 2;
drop table if exists t_range_int;
alter system set _ob_enable_truncate_partition_preserve_global_index = true;
create table t_range_int(c1 int, c2 int, c3 int, primary key(c1, c2)) partition by range(c2)
(partition p0 values less than (100),
partition p1 values less than (200),
partition p2 values less than (300),
partition p3 values less than (400),
partition p4 values less than (MAXVALUE));
create index idx1 on t_range_int(c1) storing(c3) global;
create unique index idx2 on t_range_int(c1) storing(c3) global;
insert into t_range_int values(1, 2, 9), (100, 101, 199), (200, 201, 299), (400, 401, 499);
update t_range_int set c3 = 999 where c1 = 200;
delete from t_range_int where c1 = 400;
insert into t_range_int values (100, 102, 199), (200, 202, 299), (400, 402, 499);
ERROR 23000: Duplicate entry '100' for key 'idx2'
alter table t_range_int truncate partition p1, p2, p4;
###print part info after truncate t_range_int###
select * from t_range_int order by c1,c2 asc;
c1	c2	c3
1	2	9
insert into t_range_int values (100, 102, 199), (200, 202, 299), (400, 402, 499);
insert into t_range_int values (100, 103, 199), (200, 203, 399), (400, 403, 499);
ERROR 23000: Duplicate entry '100' for key 'idx2'
select * from t_range_int order by c1,c2 asc;
c1	c2	c3
1	2	9
100	102	199
200	202	299
400	402	499
alter system major freeze;
select * from t_range_int order by c1,c2 asc;
c1	c2	c3
1	2	9
100	102	199
200	202	299
400	402	499
update t_range_int set c3 = 100 where c1 = 200;
select * from t_range_int order by c1,c2 asc;
c1	c2	c3
1	2	9
100	102	199
200	202	100
400	402	499
alter table t_range_int truncate partition p1, p2, p4;
insert into t_range_int values (200, 204, 499);
alter system minor freeze;
update t_range_int set c3 = 800 where c2 = 204;
select * from t_range_int order by c1,c2 asc;
c1	c2	c3
1	2	9
200	204	800
insert into t_range_int values (200, 202, 299);
ERROR 23000: Duplicate entry '200' for key 'idx2'
select * from t_range_int order by c1,c2 asc;
c1	c2	c3
1	2	9
200	204	800
drop table t_range_int;
alter system set _enable_defensive_check = 1;
