drop table if exists jm, jm2;
create table jm (c1 int primary key, c2 double as (PI()), c3 double(8,6) as (PI()));
create index i2 on jm((PI()));
create table jm2 (c1 int primary key, c2 decimal(5,4) as (1/3), c3 decimal(10,3) as (1/3));
insert into jm2(c1) values (1);
Warnings:
Warning	1265	Data truncated for column 'c2' at row 1
Warning	1265	Data truncated for column 'c3' at row 1
result_format: 4
select c2*3, c3*3, 1/3*3 from jm2;
+--------+-------+--------+
| c2*3   | c3*3  | 1/3*3  |
+--------+-------+--------+
| 0.9999 | 0.999 | 1.0000 |
+--------+-------+--------+

set ob_enable_index_direct_select = 'ON';
insert into jm(c1) values (1);
explain select c1, c2*1000000, c3*1000000 from jm;
Query Plan
===============================================
|ID|OPERATOR       |NAME|EST.ROWS|EST.TIME(us)|
-----------------------------------------------
|0 |TABLE FULL SCAN|jm  |1       |3           |
===============================================
Outputs & filters:
-------------------------------------
  0 - output([jm.c1], [column_conv(DOUBLE,PS:(-1,-1),NULL,PI()) * cast(1000000, DOUBLE(-1, -1))], [column_conv(DOUBLE,PS:(8,6),NULL,PI()) * cast(1000000,
       DOUBLE(-1, -1))]), filter(nil), rowset=16
      access([jm.c1]), partitions(p0)
      is_index_back=false, is_global_index=false, 
      range_key([jm.c1]), range(MIN ; MAX)always true
select c1, c2*1000000, c3*1000000 from jm;
+----+-------------------+----------------+
| c1 | c2*1000000        | c3*1000000     |
+----+-------------------+----------------+
|  1 | 3141592.653589793 | 3141593.000000 |
+----+-------------------+----------------+
select * from __idx_xxxxx_i2;
+----+
| c1 |
+----+
|  1 |
+----+

delete from jm where c1 = 1;
select c1, c2*1000000, c3*1000000 from jm;
+----+------------+------------+
| c1 | c2*1000000 | c3*1000000 |
+----+------------+------------+
+----+------------+------------+
select * from __idx_xxxxx_i2;
+----+
| c1 |
+----+
+----+

alter system major freeze tenant = 'sys';

drop table jm;
