drop database if exists ufbi;
create database ufbi;
use ufbi;
result_format: 3
set sql_mode='PAD_CHAR_TO_FULL_LENGTH';
create table t_noindex(id int, c1 char(10));
insert into t_noindex values(1,'a');
insert into t_noindex values(2,'b');
alter table t_noindex add c2 varchar(20) as (concat(c1, 'ddd'));
alter table t_noindex add c3 char(20) as (concat(c1, 'eee'));
insert into t_noindex(id,c1) values(3,'c');
select * from t_noindex;
+------+------------+---------------+----------------------+
| id   | c1         | c2            | c3                   |
+------+------------+---------------+----------------------+
|    1 | a          | a         ddd | a         eee        |
|    2 | b          | b         ddd | b         eee        |
|    3 | c          | c         ddd | c         eee        |
+------+------------+---------------+----------------------+
create table t_nochar(id int, c1 varchar(10));
insert into t_nochar values(1,'a');
insert into t_nochar values(2,'b');
alter table t_nochar add c2 varchar(20) as (concat(c1, 'ddd'));
alter table t_nochar add c3 char(20) as (concat(c1, 'eee'));
create index i2 on t_nochar(c2);
create index i3 on t_nochar(c3);
insert into t_nochar(id,c1) values(3,'c');
select * from t_nochar;
+------+------+------+----------------------+
| id   | c1   | c2   | c3                   |
+------+------+------+----------------------+
|    1 | a    | addd | aeee                 |
|    2 | b    | bddd | beee                 |
|    3 | c    | cddd | ceee                 |
+------+------+------+----------------------+
create table t_pad_l(id int, c1 char(10)) partition by hash(id) partitions 2;
insert into t_pad_l values(1,'a');
insert into t_pad_l values(2,'b');
alter table t_pad_l add c2 varchar(20) as (concat(c1, 'ddd'));
alter table t_pad_l add c3 char(20) as (concat(c1, 'eee'));
insert into t_pad_l(id,c1) values(3,'c');
create index i1 on t_pad_l(c1(2)) local;
create index i2 on t_pad_l(c2) local;
create index i3 on t_pad_l(c3) local;
insert into t_pad_l(id,c1) values (4,'d');
select /*+index(t_pad_l primary)*/ c2, c3 from t_pad_l order by id;
+---------------+----------------------+
| c2            | c3                   |
+---------------+----------------------+
| a         ddd | a         eee        |
| b         ddd | b         eee        |
| c         ddd | c         eee        |
| d         ddd | d         eee        |
+---------------+----------------------+
select /*+index(t_pad_l i2)*/ c2 from t_pad_l order by id;
+---------------+
| c2            |
+---------------+
| a         ddd |
| b         ddd |
| c         ddd |
| d         ddd |
+---------------+
select /*+index(t_pad_l i2)*/ c2 from t_pad_l where c2='a         ddd';
+---------------+
| c2            |
+---------------+
| a         ddd |
+---------------+
select /*+index(t_pad_l i2)*/ c2 from t_pad_l where c2='addd';
+------+
| c2   |
+------+
+------+
select /*+index(t_pad_l i2)*/ c2 from t_pad_l where c2='c         ddd';
+---------------+
| c2            |
+---------------+
| c         ddd |
+---------------+
select /*+index(t_pad_l i2)*/ c2 from t_pad_l where c2='cddd';
+------+
| c2   |
+------+
+------+
select /*+index(t_pad_l i2)*/ c2 from t_pad_l where c2='d         ddd';
+---------------+
| c2            |
+---------------+
| d         ddd |
+---------------+
select /*+index(t_pad_l i2)*/ c2 from t_pad_l where c2='dddd';
+------+
| c2   |
+------+
+------+
select /*+index(t_pad_l primary)*/ c2 from t_pad_l where c2='a         ddd';
+---------------+
| c2            |
+---------------+
| a         ddd |
+---------------+
select /*+index(t_pad_l primary)*/ c2 from t_pad_l where c2='addd';
+------+
| c2   |
+------+
+------+
select /*+index(t_pad_l primary)*/ c2 from t_pad_l where c2='c         ddd';
+---------------+
| c2            |
+---------------+
| c         ddd |
+---------------+
select /*+index(t_pad_l primary)*/ c2 from t_pad_l where c2='cddd';
+------+
| c2   |
+------+
+------+
select /*+index(t_pad_l primary)*/ c2 from t_pad_l where c2='d         ddd';
+---------------+
| c2            |
+---------------+
| d         ddd |
+---------------+
select /*+index(t_pad_l primary)*/ c2 from t_pad_l where c2='dddd';
+------+
| c2   |
+------+
+------+
select /*+index(t_pad_l i3)*/ c3 from t_pad_l order by id;
+----------------------+
| c3                   |
+----------------------+
| a         eee        |
| b         eee        |
| c         eee        |
| d         eee        |
+----------------------+
select /*+index(t_pad_l i3)*/ c3 from t_pad_l where c3='a         eee';
+----------------------+
| c3                   |
+----------------------+
| a         eee        |
+----------------------+
select /*+index(t_pad_l i3)*/ c3 from t_pad_l where c3='aeee';
+------+
| c3   |
+------+
+------+
select /*+index(t_pad_l i3)*/ c3 from t_pad_l where c3='c         eee';
+----------------------+
| c3                   |
+----------------------+
| c         eee        |
+----------------------+
select /*+index(t_pad_l i3)*/ c3 from t_pad_l where c3='ceee';
+------+
| c3   |
+------+
+------+
select /*+index(t_pad_l i3)*/ c3 from t_pad_l where c3='d         eee';
+----------------------+
| c3                   |
+----------------------+
| d         eee        |
+----------------------+
select /*+index(t_pad_l i3)*/ c3 from t_pad_l where c3='deee';
+------+
| c3   |
+------+
+------+
select /*+index(t_pad_l primary)*/ c3 from t_pad_l where c3='a         eee';
+----------------------+
| c3                   |
+----------------------+
| a         eee        |
+----------------------+
select /*+index(t_pad_l primary)*/ c3 from t_pad_l where c3='aeee';
+------+
| c3   |
+------+
+------+
select /*+index(t_pad_l primary)*/ c3 from t_pad_l where c3='c         eee';
+----------------------+
| c3                   |
+----------------------+
| c         eee        |
+----------------------+
select /*+index(t_pad_l primary)*/ c3 from t_pad_l where c3='ceee';
+------+
| c3   |
+------+
+------+
select /*+index(t_pad_l primary)*/ c3 from t_pad_l where c3='d         eee';
+----------------------+
| c3                   |
+----------------------+
| d         eee        |
+----------------------+
select /*+index(t_pad_l primary)*/ c3 from t_pad_l where c3='deee';
+------+
| c3   |
+------+
+------+
delete from t_pad_l where c1 = 'b' or c1 = 'd';
create table t_pad_g(id int, c1 char(10)) partition by hash(id) partitions 2;
insert into t_pad_g values(1,'a');
insert into t_pad_g values(2,'b');
alter table t_pad_g add c2 varchar(20) as (concat(c1, 'ddd'));
alter table t_pad_g add c3 char(20) as (concat(c1, 'eee'));
insert into t_pad_g(id,c1) values(3,'c');
create index i1 on t_pad_g(c1(2)) global;
create index i2 on t_pad_g(c2) global;
create index i3 on t_pad_g(c3) global;
insert into t_pad_g(id,c1) values (4,'d');
select /*+index(t_pad_g primary)*/ c2, c3 from t_pad_g order by id;
+---------------+----------------------+
| c2            | c3                   |
+---------------+----------------------+
| a         ddd | a         eee        |
| b         ddd | b         eee        |
| c         ddd | c         eee        |
| d         ddd | d         eee        |
+---------------+----------------------+
select /*+index(t_pad_g i2)*/ c2 from t_pad_g order by id;
+---------------+
| c2            |
+---------------+
| a         ddd |
| b         ddd |
| c         ddd |
| d         ddd |
+---------------+
select /*+index(t_pad_g i2)*/ c2 from t_pad_g where c2='a         ddd';
+---------------+
| c2            |
+---------------+
| a         ddd |
+---------------+
select /*+index(t_pad_g i2)*/ c2 from t_pad_g where c2='addd';
+------+
| c2   |
+------+
+------+
select /*+index(t_pad_g i2)*/ c2 from t_pad_g where c2='c         ddd';
+---------------+
| c2            |
+---------------+
| c         ddd |
+---------------+
select /*+index(t_pad_g i2)*/ c2 from t_pad_g where c2='cddd';
+------+
| c2   |
+------+
+------+
select /*+index(t_pad_g i2)*/ c2 from t_pad_g where c2='d         ddd';
+---------------+
| c2            |
+---------------+
| d         ddd |
+---------------+
select /*+index(t_pad_g i2)*/ c2 from t_pad_g where c2='dddd';
+------+
| c2   |
+------+
+------+
select /*+index(t_pad_g primary)*/ c2 from t_pad_g where c2='a         ddd';
+---------------+
| c2            |
+---------------+
| a         ddd |
+---------------+
select /*+index(t_pad_g primary)*/ c2 from t_pad_g where c2='addd';
+------+
| c2   |
+------+
+------+
select /*+index(t_pad_g primary)*/ c2 from t_pad_g where c2='c         ddd';
+---------------+
| c2            |
+---------------+
| c         ddd |
+---------------+
select /*+index(t_pad_g primary)*/ c2 from t_pad_g where c2='cddd';
+------+
| c2   |
+------+
+------+
select /*+index(t_pad_g primary)*/ c2 from t_pad_g where c2='d         ddd';
+---------------+
| c2            |
+---------------+
| d         ddd |
+---------------+
select /*+index(t_pad_g primary)*/ c2 from t_pad_g where c2='dddd';
+------+
| c2   |
+------+
+------+
select /*+index(t_pad_g i3)*/ c3 from t_pad_g order by id;
+----------------------+
| c3                   |
+----------------------+
| a         eee        |
| b         eee        |
| c         eee        |
| d         eee        |
+----------------------+
select /*+index(t_pad_g i3)*/ c3 from t_pad_g where c3='a         eee';
+----------------------+
| c3                   |
+----------------------+
| a         eee        |
+----------------------+
select /*+index(t_pad_g i3)*/ c3 from t_pad_g where c3='aeee';
+------+
| c3   |
+------+
+------+
select /*+index(t_pad_g i3)*/ c3 from t_pad_g where c3='c         eee';
+----------------------+
| c3                   |
+----------------------+
| c         eee        |
+----------------------+
select /*+index(t_pad_g i3)*/ c3 from t_pad_g where c3='ceee';
+------+
| c3   |
+------+
+------+
select /*+index(t_pad_g i3)*/ c3 from t_pad_g where c3='d         eee';
+----------------------+
| c3                   |
+----------------------+
| d         eee        |
+----------------------+
select /*+index(t_pad_g i3)*/ c3 from t_pad_g where c3='deee';
+------+
| c3   |
+------+
+------+
select /*+index(t_pad_g primary)*/ c3 from t_pad_g where c3='a         eee';
+----------------------+
| c3                   |
+----------------------+
| a         eee        |
+----------------------+
select /*+index(t_pad_g primary)*/ c3 from t_pad_g where c3='aeee';
+------+
| c3   |
+------+
+------+
select /*+index(t_pad_g primary)*/ c3 from t_pad_g where c3='c         eee';
+----------------------+
| c3                   |
+----------------------+
| c         eee        |
+----------------------+
select /*+index(t_pad_g primary)*/ c3 from t_pad_g where c3='ceee';
+------+
| c3   |
+------+
+------+
select /*+index(t_pad_g primary)*/ c3 from t_pad_g where c3='d         eee';
+----------------------+
| c3                   |
+----------------------+
| d         eee        |
+----------------------+
select /*+index(t_pad_g primary)*/ c3 from t_pad_g where c3='deee';
+------+
| c3   |
+------+
+------+
delete from t_pad_g where c1 = 'b' or c1 = 'd';
set sql_mode='';
select * from t_noindex;
+------+------+---------------+----------------------+
| id   | c1   | c2            | c3                   |
+------+------+---------------+----------------------+
|    1 | a    | a         ddd | a         eee        |
|    2 | b    | b         ddd | b         eee        |
|    3 | c    | c         ddd | c         eee        |
+------+------+---------------+----------------------+
Warnings:
Warning	5540	System variable 'sql_mode' is different from the old value solidified for 'c2'(old value:2147483648).
Warning	5540	System variable 'sql_mode' is different from the old value solidified for 'c3'(old value:2147483648).
select * from t_nochar;
+------+------+------+----------------------+
| id   | c1   | c2   | c3                   |
+------+------+------+----------------------+
|    1 | a    | addd | aeee                 |
|    2 | b    | bddd | beee                 |
|    3 | c    | cddd | ceee                 |
+------+------+------+----------------------+
Warnings:
Warning	5540	System variable 'sql_mode' is different from the old value solidified for 'c2'(old value:2147483648).
Warning	5540	System variable 'sql_mode' is different from the old value solidified for 'c3'(old value:2147483648).
select /*+index(t_pad_l i1)*/ c2 from t_pad_l order by id;
ERROR 0A000: change PAD_CHAR option after created generated column not supported
select /*+index(t_pad_l primary)*/ c2 from t_pad_l order by id;
ERROR 0A000: change PAD_CHAR option after created generated column not supported
insert into t_pad_l(id,c1) values (5,'e');
ERROR 0A000: change PAD_CHAR option after created generated column not supported
delete from t_pad_l order by id;
ERROR 0A000: change PAD_CHAR option after created generated column not supported
select /*+index(t_pad_g i1)*/ c2 from t_pad_g order by id;
ERROR 0A000: change PAD_CHAR option after created generated column not supported
select /*+index(t_pad_g primary)*/ c2 from t_pad_g order by id;
ERROR 0A000: change PAD_CHAR option after created generated column not supported
insert into t_pad_g(id,c1) values (5,'e');
ERROR 0A000: change PAD_CHAR option after created generated column not supported
delete from t_pad_g order by id;
ERROR 0A000: change PAD_CHAR option after created generated column not supported
create table t_nopad_l(id int, c1 char(10)) partition by hash(id) partitions 2;
insert into t_nopad_l values(1,'a');
insert into t_nopad_l values(2,'b');
alter table t_nopad_l add c2 varchar(20) as (concat(c1, 'ddd'));
alter table t_nopad_l add c3 char(20) as (concat(c1, 'eee'));
insert into t_nopad_l(id,c1) values(3,'c');
create index i1 on t_nopad_l(c1(2)) local;
create index i2 on t_nopad_l(c2) local;
create index i3 on t_nopad_l(c3) local;
insert into t_nopad_l(id,c1) values (4,'d');
select /*+index(t_nopad_l primary)*/ c2, c3 from t_nopad_l order by id;
+------+------+
| c2   | c3   |
+------+------+
| addd | aeee |
| bddd | beee |
| cddd | ceee |
| dddd | deee |
+------+------+
select /*+index(t_nopad_l i2)*/ c2 from t_nopad_l order by id;
+------+
| c2   |
+------+
| addd |
| bddd |
| cddd |
| dddd |
+------+
select /*+index(t_nopad_l i2)*/ c2 from t_nopad_l where c2='a         ddd';
+------+
| c2   |
+------+
+------+
select /*+index(t_nopad_l i2)*/ c2 from t_nopad_l where c2='addd';
+------+
| c2   |
+------+
| addd |
+------+
select /*+index(t_nopad_l i2)*/ c2 from t_nopad_l where c2='c         ddd';
+------+
| c2   |
+------+
+------+
select /*+index(t_nopad_l i2)*/ c2 from t_nopad_l where c2='cddd';
+------+
| c2   |
+------+
| cddd |
+------+
select /*+index(t_nopad_l i2)*/ c2 from t_nopad_l where c2='d         ddd';
+------+
| c2   |
+------+
+------+
select /*+index(t_nopad_l i2)*/ c2 from t_nopad_l where c2='dddd';
+------+
| c2   |
+------+
| dddd |
+------+
select /*+index(t_nopad_l primary)*/ c2 from t_nopad_l where c2='a         ddd';
+------+
| c2   |
+------+
+------+
select /*+index(t_nopad_l primary)*/ c2 from t_nopad_l where c2='addd';
+------+
| c2   |
+------+
| addd |
+------+
select /*+index(t_nopad_l primary)*/ c2 from t_nopad_l where c2='c         ddd';
+------+
| c2   |
+------+
+------+
select /*+index(t_nopad_l primary)*/ c2 from t_nopad_l where c2='cddd';
+------+
| c2   |
+------+
| cddd |
+------+
select /*+index(t_nopad_l primary)*/ c2 from t_nopad_l where c2='d         ddd';
+------+
| c2   |
+------+
+------+
select /*+index(t_nopad_l primary)*/ c2 from t_nopad_l where c2='dddd';
+------+
| c2   |
+------+
| dddd |
+------+
select /*+index(t_nopad_l i3)*/ c3 from t_nopad_l order by id;
+------+
| c3   |
+------+
| aeee |
| beee |
| ceee |
| deee |
+------+
select /*+index(t_nopad_l i3)*/ c3 from t_nopad_l where c3='a         eee';
+------+
| c3   |
+------+
+------+
select /*+index(t_nopad_l i3)*/ c3 from t_nopad_l where c3='aeee';
+------+
| c3   |
+------+
| aeee |
+------+
select /*+index(t_nopad_l i3)*/ c3 from t_nopad_l where c3='c         eee';
+------+
| c3   |
+------+
+------+
select /*+index(t_nopad_l i3)*/ c3 from t_nopad_l where c3='ceee';
+------+
| c3   |
+------+
| ceee |
+------+
select /*+index(t_nopad_l i3)*/ c3 from t_nopad_l where c3='d         eee';
+------+
| c3   |
+------+
+------+
select /*+index(t_nopad_l i3)*/ c3 from t_nopad_l where c3='deee';
+------+
| c3   |
+------+
| deee |
+------+
select /*+index(t_nopad_l primary)*/ c3 from t_nopad_l where c3='a         eee';
+------+
| c3   |
+------+
+------+
select /*+index(t_nopad_l primary)*/ c3 from t_nopad_l where c3='aeee';
+------+
| c3   |
+------+
| aeee |
+------+
select /*+index(t_nopad_l primary)*/ c3 from t_nopad_l where c3='c         eee';
+------+
| c3   |
+------+
+------+
select /*+index(t_nopad_l primary)*/ c3 from t_nopad_l where c3='ceee';
+------+
| c3   |
+------+
| ceee |
+------+
select /*+index(t_nopad_l primary)*/ c3 from t_nopad_l where c3='d         eee';
+------+
| c3   |
+------+
+------+
select /*+index(t_nopad_l primary)*/ c3 from t_nopad_l where c3='deee';
+------+
| c3   |
+------+
| deee |
+------+
delete from t_nopad_l where c1 = 'b' or c1 = 'd';
create table t_nopad_g(id int, c1 char(10)) partition by hash(id) partitions 2;
insert into t_nopad_g values(1,'a');
insert into t_nopad_g values(2,'b');
alter table t_nopad_g add c2 varchar(20) as (concat(c1, 'ddd'));
alter table t_nopad_g add c3 char(20) as (concat(c1, 'eee'));
insert into t_nopad_g(id,c1) values(3,'c');
create index i1 on t_nopad_g(c1(2)) global;
create index i2 on t_nopad_g(c2) global;
create index i3 on t_nopad_g(c3) global;
insert into t_nopad_g(id,c1) values (4,'d');
select /*+index(t_nopad_g primary)*/ c2, c3 from t_nopad_g order by id;
+------+------+
| c2   | c3   |
+------+------+
| addd | aeee |
| bddd | beee |
| cddd | ceee |
| dddd | deee |
+------+------+
select /*+index(t_nopad_g i2)*/ c2 from t_nopad_g order by id;
+------+
| c2   |
+------+
| addd |
| bddd |
| cddd |
| dddd |
+------+
select /*+index(t_nopad_g i2)*/ c2 from t_nopad_g where c2='a         ddd';
+------+
| c2   |
+------+
+------+
select /*+index(t_nopad_g i2)*/ c2 from t_nopad_g where c2='addd';
+------+
| c2   |
+------+
| addd |
+------+
select /*+index(t_nopad_g i2)*/ c2 from t_nopad_g where c2='c         ddd';
+------+
| c2   |
+------+
+------+
select /*+index(t_nopad_g i2)*/ c2 from t_nopad_g where c2='cddd';
+------+
| c2   |
+------+
| cddd |
+------+
select /*+index(t_nopad_g i2)*/ c2 from t_nopad_g where c2='d         ddd';
+------+
| c2   |
+------+
+------+
select /*+index(t_nopad_g i2)*/ c2 from t_nopad_g where c2='dddd';
+------+
| c2   |
+------+
| dddd |
+------+
select /*+index(t_nopad_g primary)*/ c2 from t_nopad_g where c2='a         ddd';
+------+
| c2   |
+------+
+------+
select /*+index(t_nopad_g primary)*/ c2 from t_nopad_g where c2='addd';
+------+
| c2   |
+------+
| addd |
+------+
select /*+index(t_nopad_g primary)*/ c2 from t_nopad_g where c2='c         ddd';
+------+
| c2   |
+------+
+------+
select /*+index(t_nopad_g primary)*/ c2 from t_nopad_g where c2='cddd';
+------+
| c2   |
+------+
| cddd |
+------+
select /*+index(t_nopad_g primary)*/ c2 from t_nopad_g where c2='d         ddd';
+------+
| c2   |
+------+
+------+
select /*+index(t_nopad_g primary)*/ c2 from t_nopad_g where c2='dddd';
+------+
| c2   |
+------+
| dddd |
+------+
select /*+index(t_nopad_g i3)*/ c3 from t_nopad_g order by id;
+------+
| c3   |
+------+
| aeee |
| beee |
| ceee |
| deee |
+------+
select /*+index(t_nopad_g i3)*/ c3 from t_nopad_g where c3='a         eee';
+------+
| c3   |
+------+
+------+
select /*+index(t_nopad_g i3)*/ c3 from t_nopad_g where c3='aeee';
+------+
| c3   |
+------+
| aeee |
+------+
select /*+index(t_nopad_g i3)*/ c3 from t_nopad_g where c3='c         eee';
+------+
| c3   |
+------+
+------+
select /*+index(t_nopad_g i3)*/ c3 from t_nopad_g where c3='ceee';
+------+
| c3   |
+------+
| ceee |
+------+
select /*+index(t_nopad_g i3)*/ c3 from t_nopad_g where c3='d         eee';
+------+
| c3   |
+------+
+------+
select /*+index(t_nopad_g i3)*/ c3 from t_nopad_g where c3='deee';
+------+
| c3   |
+------+
| deee |
+------+
select /*+index(t_nopad_g primary)*/ c3 from t_nopad_g where c3='a         eee';
+------+
| c3   |
+------+
+------+
select /*+index(t_nopad_g primary)*/ c3 from t_nopad_g where c3='aeee';
+------+
| c3   |
+------+
| aeee |
+------+
select /*+index(t_nopad_g primary)*/ c3 from t_nopad_g where c3='c         eee';
+------+
| c3   |
+------+
+------+
select /*+index(t_nopad_g primary)*/ c3 from t_nopad_g where c3='ceee';
+------+
| c3   |
+------+
| ceee |
+------+
select /*+index(t_nopad_g primary)*/ c3 from t_nopad_g where c3='d         eee';
+------+
| c3   |
+------+
+------+
select /*+index(t_nopad_g primary)*/ c3 from t_nopad_g where c3='deee';
+------+
| c3   |
+------+
| deee |
+------+
delete from t_nopad_g where c1 = 'b' or c1 = 'd';
set sql_mode='PAD_CHAR_TO_FULL_LENGTH';
select /*+index(t_nopad_l i1)*/ c2 from t_nopad_l order by id;
ERROR 0A000: change PAD_CHAR option after created generated column not supported
select /*+index(t_nopad_l primary)*/ c2 from t_nopad_l order by id;
ERROR 0A000: change PAD_CHAR option after created generated column not supported
insert into t_nopad_l(id,c1) values (5,'e');
ERROR 0A000: change PAD_CHAR option after created generated column not supported
delete from t_nopad_l order by id;
ERROR 0A000: change PAD_CHAR option after created generated column not supported
select /*+index(t_nopad_g i1)*/ c2 from t_nopad_g order by id;
ERROR 0A000: change PAD_CHAR option after created generated column not supported
select /*+index(t_nopad_g primary)*/ c2 from t_nopad_g order by id;
ERROR 0A000: change PAD_CHAR option after created generated column not supported
insert into t_nopad_g(id,c1) values (5,'e');
ERROR 0A000: change PAD_CHAR option after created generated column not supported
delete from t_nopad_g order by id;
ERROR 0A000: change PAD_CHAR option after created generated column not supported
alter system major freeze tenant = sys;
alter system major freeze tenant = all_user;
alter system major freeze tenant = all_meta;
use ufbi;
set sql_mode='PAD_CHAR_TO_FULL_LENGTH';
select * from t_noindex;
+------+------------+---------------+----------------------+
| id   | c1         | c2            | c3                   |
+------+------------+---------------+----------------------+
|    1 | a          | a         ddd | a         eee        |
|    2 | b          | b         ddd | b         eee        |
|    3 | c          | c         ddd | c         eee        |
+------+------------+---------------+----------------------+
select * from t_nochar;
+------+------+------+----------------------+
| id   | c1   | c2   | c3                   |
+------+------+------+----------------------+
|    1 | a    | addd | aeee                 |
|    2 | b    | bddd | beee                 |
|    3 | c    | cddd | ceee                 |
+------+------+------+----------------------+
select /*+index(t_pad_l primary)*/ c2, c3 from t_pad_l order by id;
+---------------+----------------------+
| c2            | c3                   |
+---------------+----------------------+
| a         ddd | a         eee        |
| c         ddd | c         eee        |
+---------------+----------------------+
select /*+index(t_pad_l i2)*/ c2 from t_pad_l order by id;
+---------------+
| c2            |
+---------------+
| a         ddd |
| c         ddd |
+---------------+
select /*+index(t_pad_l i2)*/ c2 from t_pad_l where c2='a         ddd';
+---------------+
| c2            |
+---------------+
| a         ddd |
+---------------+
select /*+index(t_pad_l i2)*/ c2 from t_pad_l where c2='addd';
+------+
| c2   |
+------+
+------+
select /*+index(t_pad_l i2)*/ c2 from t_pad_l where c2='c         ddd';
+---------------+
| c2            |
+---------------+
| c         ddd |
+---------------+
select /*+index(t_pad_l i2)*/ c2 from t_pad_l where c2='cddd';
+------+
| c2   |
+------+
+------+
select /*+index(t_pad_l i2)*/ c2 from t_pad_l where c2='d         ddd';
+------+
| c2   |
+------+
+------+
select /*+index(t_pad_l i2)*/ c2 from t_pad_l where c2='dddd';
+------+
| c2   |
+------+
+------+
select /*+index(t_pad_l primary)*/ c2 from t_pad_l where c2='a         ddd';
+---------------+
| c2            |
+---------------+
| a         ddd |
+---------------+
select /*+index(t_pad_l primary)*/ c2 from t_pad_l where c2='addd';
+------+
| c2   |
+------+
+------+
select /*+index(t_pad_l primary)*/ c2 from t_pad_l where c2='c         ddd';
+---------------+
| c2            |
+---------------+
| c         ddd |
+---------------+
select /*+index(t_pad_l primary)*/ c2 from t_pad_l where c2='cddd';
+------+
| c2   |
+------+
+------+
select /*+index(t_pad_l primary)*/ c2 from t_pad_l where c2='d         ddd';
+------+
| c2   |
+------+
+------+
select /*+index(t_pad_l primary)*/ c2 from t_pad_l where c2='dddd';
+------+
| c2   |
+------+
+------+
select /*+index(t_pad_l i3)*/ c3 from t_pad_l order by id;
+----------------------+
| c3                   |
+----------------------+
| a         eee        |
| c         eee        |
+----------------------+
select /*+index(t_pad_l i3)*/ c3 from t_pad_l where c3='a         eee';
+----------------------+
| c3                   |
+----------------------+
| a         eee        |
+----------------------+
select /*+index(t_pad_l i3)*/ c3 from t_pad_l where c3='aeee';
+------+
| c3   |
+------+
+------+
select /*+index(t_pad_l i3)*/ c3 from t_pad_l where c3='c         eee';
+----------------------+
| c3                   |
+----------------------+
| c         eee        |
+----------------------+
select /*+index(t_pad_l i3)*/ c3 from t_pad_l where c3='ceee';
+------+
| c3   |
+------+
+------+
select /*+index(t_pad_l i3)*/ c3 from t_pad_l where c3='d         eee';
+------+
| c3   |
+------+
+------+
select /*+index(t_pad_l i3)*/ c3 from t_pad_l where c3='deee';
+------+
| c3   |
+------+
+------+
select /*+index(t_pad_l primary)*/ c3 from t_pad_l where c3='a         eee';
+----------------------+
| c3                   |
+----------------------+
| a         eee        |
+----------------------+
select /*+index(t_pad_l primary)*/ c3 from t_pad_l where c3='aeee';
+------+
| c3   |
+------+
+------+
select /*+index(t_pad_l primary)*/ c3 from t_pad_l where c3='c         eee';
+----------------------+
| c3                   |
+----------------------+
| c         eee        |
+----------------------+
select /*+index(t_pad_l primary)*/ c3 from t_pad_l where c3='ceee';
+------+
| c3   |
+------+
+------+
select /*+index(t_pad_l primary)*/ c3 from t_pad_l where c3='d         eee';
+------+
| c3   |
+------+
+------+
select /*+index(t_pad_l primary)*/ c3 from t_pad_l where c3='deee';
+------+
| c3   |
+------+
+------+
select /*+index(t_pad_g primary)*/ c2, c3 from t_pad_g order by id;
+---------------+----------------------+
| c2            | c3                   |
+---------------+----------------------+
| a         ddd | a         eee        |
| c         ddd | c         eee        |
+---------------+----------------------+
select /*+index(t_pad_g i2)*/ c2 from t_pad_g order by id;
+---------------+
| c2            |
+---------------+
| a         ddd |
| c         ddd |
+---------------+
select /*+index(t_pad_g i2)*/ c2 from t_pad_g where c2='a         ddd';
+---------------+
| c2            |
+---------------+
| a         ddd |
+---------------+
select /*+index(t_pad_g i2)*/ c2 from t_pad_g where c2='addd';
+------+
| c2   |
+------+
+------+
select /*+index(t_pad_g i2)*/ c2 from t_pad_g where c2='c         ddd';
+---------------+
| c2            |
+---------------+
| c         ddd |
+---------------+
select /*+index(t_pad_g i2)*/ c2 from t_pad_g where c2='cddd';
+------+
| c2   |
+------+
+------+
select /*+index(t_pad_g i2)*/ c2 from t_pad_g where c2='d         ddd';
+------+
| c2   |
+------+
+------+
select /*+index(t_pad_g i2)*/ c2 from t_pad_g where c2='dddd';
+------+
| c2   |
+------+
+------+
select /*+index(t_pad_g primary)*/ c2 from t_pad_g where c2='a         ddd';
+---------------+
| c2            |
+---------------+
| a         ddd |
+---------------+
select /*+index(t_pad_g primary)*/ c2 from t_pad_g where c2='addd';
+------+
| c2   |
+------+
+------+
select /*+index(t_pad_g primary)*/ c2 from t_pad_g where c2='c         ddd';
+---------------+
| c2            |
+---------------+
| c         ddd |
+---------------+
select /*+index(t_pad_g primary)*/ c2 from t_pad_g where c2='cddd';
+------+
| c2   |
+------+
+------+
select /*+index(t_pad_g primary)*/ c2 from t_pad_g where c2='d         ddd';
+------+
| c2   |
+------+
+------+
select /*+index(t_pad_g primary)*/ c2 from t_pad_g where c2='dddd';
+------+
| c2   |
+------+
+------+
select /*+index(t_pad_g i3)*/ c3 from t_pad_g order by id;
+----------------------+
| c3                   |
+----------------------+
| a         eee        |
| c         eee        |
+----------------------+
select /*+index(t_pad_g i3)*/ c3 from t_pad_g where c3='a         eee';
+----------------------+
| c3                   |
+----------------------+
| a         eee        |
+----------------------+
select /*+index(t_pad_g i3)*/ c3 from t_pad_g where c3='aeee';
+------+
| c3   |
+------+
+------+
select /*+index(t_pad_g i3)*/ c3 from t_pad_g where c3='c         eee';
+----------------------+
| c3                   |
+----------------------+
| c         eee        |
+----------------------+
select /*+index(t_pad_g i3)*/ c3 from t_pad_g where c3='ceee';
+------+
| c3   |
+------+
+------+
select /*+index(t_pad_g i3)*/ c3 from t_pad_g where c3='d         eee';
+------+
| c3   |
+------+
+------+
select /*+index(t_pad_g i3)*/ c3 from t_pad_g where c3='deee';
+------+
| c3   |
+------+
+------+
select /*+index(t_pad_g primary)*/ c3 from t_pad_g where c3='a         eee';
+----------------------+
| c3                   |
+----------------------+
| a         eee        |
+----------------------+
select /*+index(t_pad_g primary)*/ c3 from t_pad_g where c3='aeee';
+------+
| c3   |
+------+
+------+
select /*+index(t_pad_g primary)*/ c3 from t_pad_g where c3='c         eee';
+----------------------+
| c3                   |
+----------------------+
| c         eee        |
+----------------------+
select /*+index(t_pad_g primary)*/ c3 from t_pad_g where c3='ceee';
+------+
| c3   |
+------+
+------+
select /*+index(t_pad_g primary)*/ c3 from t_pad_g where c3='d         eee';
+------+
| c3   |
+------+
+------+
select /*+index(t_pad_g primary)*/ c3 from t_pad_g where c3='deee';
+------+
| c3   |
+------+
+------+
set sql_mode='';
select * from t_noindex;
+------+------+---------------+----------------------+
| id   | c1   | c2            | c3                   |
+------+------+---------------+----------------------+
|    1 | a    | a         ddd | a         eee        |
|    2 | b    | b         ddd | b         eee        |
|    3 | c    | c         ddd | c         eee        |
+------+------+---------------+----------------------+
select * from t_nochar;
+------+------+------+----------------------+
| id   | c1   | c2   | c3                   |
+------+------+------+----------------------+
|    1 | a    | addd | aeee                 |
|    2 | b    | bddd | beee                 |
|    3 | c    | cddd | ceee                 |
+------+------+------+----------------------+
select /*+index(t_nopad_l primary)*/ c2, c3 from t_nopad_l order by id;
+------+------+
| c2   | c3   |
+------+------+
| addd | aeee |
| cddd | ceee |
+------+------+
select /*+index(t_nopad_l i2)*/ c2 from t_nopad_l order by id;
+------+
| c2   |
+------+
| addd |
| cddd |
+------+
select /*+index(t_nopad_l i2)*/ c2 from t_nopad_l where c2='a         ddd';
+------+
| c2   |
+------+
+------+
select /*+index(t_nopad_l i2)*/ c2 from t_nopad_l where c2='addd';
+------+
| c2   |
+------+
| addd |
+------+
select /*+index(t_nopad_l i2)*/ c2 from t_nopad_l where c2='c         ddd';
+------+
| c2   |
+------+
+------+
select /*+index(t_nopad_l i2)*/ c2 from t_nopad_l where c2='cddd';
+------+
| c2   |
+------+
| cddd |
+------+
select /*+index(t_nopad_l i2)*/ c2 from t_nopad_l where c2='d         ddd';
+------+
| c2   |
+------+
+------+
select /*+index(t_nopad_l i2)*/ c2 from t_nopad_l where c2='dddd';
+------+
| c2   |
+------+
+------+
select /*+index(t_nopad_l primary)*/ c2 from t_nopad_l where c2='a         ddd';
+------+
| c2   |
+------+
+------+
select /*+index(t_nopad_l primary)*/ c2 from t_nopad_l where c2='addd';
+------+
| c2   |
+------+
| addd |
+------+
select /*+index(t_nopad_l primary)*/ c2 from t_nopad_l where c2='c         ddd';
+------+
| c2   |
+------+
+------+
select /*+index(t_nopad_l primary)*/ c2 from t_nopad_l where c2='cddd';
+------+
| c2   |
+------+
| cddd |
+------+
select /*+index(t_nopad_l primary)*/ c2 from t_nopad_l where c2='d         ddd';
+------+
| c2   |
+------+
+------+
select /*+index(t_nopad_l primary)*/ c2 from t_nopad_l where c2='dddd';
+------+
| c2   |
+------+
+------+
select /*+index(t_nopad_l i3)*/ c3 from t_nopad_l order by id;
+------+
| c3   |
+------+
| aeee |
| ceee |
+------+
select /*+index(t_nopad_l i3)*/ c3 from t_nopad_l where c3='a         eee';
+------+
| c3   |
+------+
+------+
select /*+index(t_nopad_l i3)*/ c3 from t_nopad_l where c3='aeee';
+------+
| c3   |
+------+
| aeee |
+------+
select /*+index(t_nopad_l i3)*/ c3 from t_nopad_l where c3='c         eee';
+------+
| c3   |
+------+
+------+
select /*+index(t_nopad_l i3)*/ c3 from t_nopad_l where c3='ceee';
+------+
| c3   |
+------+
| ceee |
+------+
select /*+index(t_nopad_l i3)*/ c3 from t_nopad_l where c3='d         eee';
+------+
| c3   |
+------+
+------+
select /*+index(t_nopad_l i3)*/ c3 from t_nopad_l where c3='deee';
+------+
| c3   |
+------+
+------+
select /*+index(t_nopad_l primary)*/ c3 from t_nopad_l where c3='a         eee';
+------+
| c3   |
+------+
+------+
select /*+index(t_nopad_l primary)*/ c3 from t_nopad_l where c3='aeee';
+------+
| c3   |
+------+
| aeee |
+------+
select /*+index(t_nopad_l primary)*/ c3 from t_nopad_l where c3='c         eee';
+------+
| c3   |
+------+
+------+
select /*+index(t_nopad_l primary)*/ c3 from t_nopad_l where c3='ceee';
+------+
| c3   |
+------+
| ceee |
+------+
select /*+index(t_nopad_l primary)*/ c3 from t_nopad_l where c3='d         eee';
+------+
| c3   |
+------+
+------+
select /*+index(t_nopad_l primary)*/ c3 from t_nopad_l where c3='deee';
+------+
| c3   |
+------+
+------+
select /*+index(t_nopad_g primary)*/ c2, c3 from t_nopad_g order by id;
+------+------+
| c2   | c3   |
+------+------+
| addd | aeee |
| cddd | ceee |
+------+------+
select /*+index(t_nopad_g i2)*/ c2 from t_nopad_g order by id;
+------+
| c2   |
+------+
| addd |
| cddd |
+------+
select /*+index(t_nopad_g i2)*/ c2 from t_nopad_g where c2='a         ddd';
+------+
| c2   |
+------+
+------+
select /*+index(t_nopad_g i2)*/ c2 from t_nopad_g where c2='addd';
+------+
| c2   |
+------+
| addd |
+------+
select /*+index(t_nopad_g i2)*/ c2 from t_nopad_g where c2='c         ddd';
+------+
| c2   |
+------+
+------+
select /*+index(t_nopad_g i2)*/ c2 from t_nopad_g where c2='cddd';
+------+
| c2   |
+------+
| cddd |
+------+
select /*+index(t_nopad_g i2)*/ c2 from t_nopad_g where c2='d         ddd';
+------+
| c2   |
+------+
+------+
select /*+index(t_nopad_g i2)*/ c2 from t_nopad_g where c2='dddd';
+------+
| c2   |
+------+
+------+
select /*+index(t_nopad_g primary)*/ c2 from t_nopad_g where c2='a         ddd';
+------+
| c2   |
+------+
+------+
select /*+index(t_nopad_g primary)*/ c2 from t_nopad_g where c2='addd';
+------+
| c2   |
+------+
| addd |
+------+
select /*+index(t_nopad_g primary)*/ c2 from t_nopad_g where c2='c         ddd';
+------+
| c2   |
+------+
+------+
select /*+index(t_nopad_g primary)*/ c2 from t_nopad_g where c2='cddd';
+------+
| c2   |
+------+
| cddd |
+------+
select /*+index(t_nopad_g primary)*/ c2 from t_nopad_g where c2='d         ddd';
+------+
| c2   |
+------+
+------+
select /*+index(t_nopad_g primary)*/ c2 from t_nopad_g where c2='dddd';
+------+
| c2   |
+------+
+------+
select /*+index(t_nopad_g i3)*/ c3 from t_nopad_g order by id;
+------+
| c3   |
+------+
| aeee |
| ceee |
+------+
select /*+index(t_nopad_g i3)*/ c3 from t_nopad_g where c3='a         eee';
+------+
| c3   |
+------+
+------+
select /*+index(t_nopad_g i3)*/ c3 from t_nopad_g where c3='aeee';
+------+
| c3   |
+------+
| aeee |
+------+
select /*+index(t_nopad_g i3)*/ c3 from t_nopad_g where c3='c         eee';
+------+
| c3   |
+------+
+------+
select /*+index(t_nopad_g i3)*/ c3 from t_nopad_g where c3='ceee';
+------+
| c3   |
+------+
| ceee |
+------+
select /*+index(t_nopad_g i3)*/ c3 from t_nopad_g where c3='d         eee';
+------+
| c3   |
+------+
+------+
select /*+index(t_nopad_g i3)*/ c3 from t_nopad_g where c3='deee';
+------+
| c3   |
+------+
+------+
select /*+index(t_nopad_g primary)*/ c3 from t_nopad_g where c3='a         eee';
+------+
| c3   |
+------+
+------+
select /*+index(t_nopad_g primary)*/ c3 from t_nopad_g where c3='aeee';
+------+
| c3   |
+------+
| aeee |
+------+
select /*+index(t_nopad_g primary)*/ c3 from t_nopad_g where c3='c         eee';
+------+
| c3   |
+------+
+------+
select /*+index(t_nopad_g primary)*/ c3 from t_nopad_g where c3='ceee';
+------+
| c3   |
+------+
| ceee |
+------+
select /*+index(t_nopad_g primary)*/ c3 from t_nopad_g where c3='d         eee';
+------+
| c3   |
+------+
+------+
select /*+index(t_nopad_g primary)*/ c3 from t_nopad_g where c3='deee';
+------+
| c3   |
+------+
+------+
result_format: 1
drop database ufbi;
