alter system set_tp tp_name = "LOAD_LICENSE_CHECK_OPTIONS", error_code = 0, frequency = 1;
alter system set_tp tp_name = "LICENSE_TIMESTAMP_SERVICE_CURRENT_SYS_TIME_SECOND", error_code = 1746892800, frequency = 1;
alter system set_tp tp_name = "LICENSE_TIMESTAMP_SERVICE_CURRENT_TIME_SECOND", error_code = 1746892800, frequency = 1;
alter system set_tp tp_name = "LICENSE_TIMESTAMP_SERVICE_FORCE_UPDATE_TIME", error_code = 1, frequency = 1;
alter system load license "/data/1/shaoyibo.syb/observer1/test_license/license-debug.txt";
create resource unit if not exists license_uc max_cpu 2, memory_size '4g', log_disk_size '8g';
create resource pool if not exists  license_rp unit 'license_uc', unit_num 1, zone_list ('zone1');
drop tenant if exists license_tenant purge;
create resource unit if not exists license_standby_uc max_cpu 2, memory_size '4g', log_disk_size '8g';
create resource pool if not exists license_standby_rp unit 'license_standby_uc', unit_num 1, zone_list ('zone1');
drop tenant if exists license_standby_tenant purge;
drop table if exists id_table;
drop table if exists im_a_table;
create table id_table(id int);
insert into id_table values(1), (2), (3);
drop table if exists id_table;
drop table if exists im_a_table;
create table id_table(id int);
insert into id_table values(1), (2), (3);
select LTS_TIME from __all_license;
LTS_TIME
2025-05-11 00:00:00.000000
alter system load license "/data/1/shaoyibo.syb/observer1/test_license/license-trial.txt";
select END_USER, LICENSE_ID, LICENSE_CODE, LICENSE_TYPE, PRODUCT_TYPE, ISSUANCE_DATE, EXPIRED_TIME, OPTIONS, NODE_NUM from DBA_OB_LICENSE;
END_USER	LICENSE_ID	LICENSE_CODE	LICENSE_TYPE	PRODUCT_TYPE	ISSUANCE_DATE	EXPIRED_TIME	OPTIONS	NODE_NUM
东雪莲	ef35a38b-19a6-486c-9500-36ca45a208b1	debug-test-06	Trial	SE	2025-02-28 00:00:00	2025-08-27 00:00:00		1
alter system load license "/data/1/shaoyibo.syb/observer1/test_license/license-commercial-all.txt";
select END_USER, LICENSE_ID, LICENSE_CODE, LICENSE_TYPE, PRODUCT_TYPE, ISSUANCE_DATE, EXPIRED_TIME, OPTIONS, NODE_NUM from DBA_OB_LICENSE;
END_USER	LICENSE_ID	LICENSE_CODE	LICENSE_TYPE	PRODUCT_TYPE	ISSUANCE_DATE	EXPIRED_TIME	OPTIONS	NODE_NUM
东雪莲	ef35a38b-19a6-486c-9500-36ca45a208b1	debug-test-01	Commercial	SE	2025-02-28 00:00:00	2999-01-01 00:00:00	AP,MT,PS,EE	1
alter system load license "/data/1/shaoyibo.syb/observer1/test_license/license-commercial-basic.txt";
ERROR HY000: exceed the license scope: there are more than one tenant, but the license does not have the Multitenant option
alter system load license "/data/1/shaoyibo.syb/observer1/test_license/license-expired.txt";
ERROR HY000: license is invalid because: license is expired
alter system load license "im/a/invalid/path";
ERROR HY000: File not exist
update __all_license set END_USER='standalone_test';
ERROR HY000: Operation not allowed now
select END_USER from __all_license;
END_USER
东雪莲
delete from __all_license;
ERROR HY000: Operation not allowed now
select count(*) from __all_license;
count(*)
1
insert into __all_license(END_USER, LICENSE_ID, LICENSE_CODE, LICENSE_TYPE, PRODUCT_TYPE, ISSUANCE_DATE, ACTIVATION_TIME, EXPIRED_TIME, OPTIONS, CORE_NUM, NODE_NUM, LTS_TIME) VALUES ('', '', '', '', '', '2022-05-11 00:00:00', '2022-05-11 00:00:00', '2022-05-11 00:00:00', '', 1, 1, '2022-05-11 00:00:00');
ERROR HY000: Operation not allowed now
select count(*) from __all_license;
count(*)
1
alter system set_tp tp_name = "LOAD_LICENSE_CHECK_OPTIONS", error_code = 1, frequency = 1;
alter system load license "/data/1/shaoyibo.syb/observer1/test_license/license-commercial-basic.txt";
create tenant license_tenant resource_pool_list=('license_rp');
ERROR HY000: exceed the license scope: current license does not have Multitenant option
alter system add server "127.0.0.1:12345";
ERROR HY000: exceed the license scope: Node Num is exceeded
create user if not exists 'license_standby_user'@'%' identified by '12345678';
grant all privileges on *.* to 'license_standby_user'@'%' with grant option;
CREATE STANDBY TENANT IF NOT EXISTS license_standby_tenant LOG_RESTORE_SOURCE = "SERVICE=127.0.0.1:50202 USER=license_standby_user PASSWORD=12345678" resource_pool_list=('license_standby_rp');
ERROR HY000: exceed the license scope: current license does not have Primary-Standby option
alter system load license "/data/1/shaoyibo.syb/observer1/test_license/license-commercial-all.txt";
CREATE STANDBY TENANT IF NOT EXISTS license_standby_tenant LOG_RESTORE_SOURCE = "SERVICE=127.0.0.1:50202 USER=license_standby_user PASSWORD=12345678" resource_pool_list=('license_standby_rp');
ALTER SYSTEM SET LOG_RESTORE_SOURCE="SERVICE=127.0.0.1:50202 USER=license_standby_user PASSWORD=12345678" TENANT = license_standby_tenant;
ALTER SYSTEM RECOVER STANDBY TENANT license_standby_tenant UNTIL UNLIMITED;
alter system load license "/data/1/shaoyibo.syb/observer1/test_license/license-commercial-mt.txt";
ALTER SYSTEM RECOVER STANDBY TENANT license_standby_tenant UNTIL UNLIMITED;
ERROR HY000: exceed the license scope: current license does not have Primary-Standby option
ALTER SYSTEM SET LOG_RESTORE_SOURCE="SERVICE=127.0.0.1:50202 USER=license_standby_user PASSWORD=12345678" TENANT = license_standby_tenant;
ERROR HY000: exceed the license scope: current license does not have Primary-Standby option
ALTER SYSTEM RECOVER STANDBY TENANT license_standby_tenant UNTIL UNLIMITED;
ERROR HY000: exceed the license scope: current license does not have Primary-Standby option
ALTER SYSTEM SET DATA_BACKUP_DEST = "file:////data/1/shaoyibo.syb/observer1/backup/data" TENANT = mysql;
alter system set_tp tp_name = "LOAD_LICENSE_CHECK_OPTIONS", error_code = 0, frequency = 1;
alter system load license "/data/1/shaoyibo.syb/observer1/test_license/license-commercial-mt.txt";
ERROR HY000: exceed the license scope: there are standby tenant, but the license does not have the Primary-Standby option
alter system set_tp tp_name = "LOAD_LICENSE_CHECK_OPTIONS", error_code = 1, frequency = 1;
alter system load license "/data/1/shaoyibo.syb/observer1/test_license/license-commercial-mt.txt";
drop table if exists test_olap_table;
SET session parallel_degree_policy = MANUAL;
create table test_olap_table(id int);
insert /*+parallel(3)*/ into test_olap_table values(1), (2), (3);
Warnings:
Warning	4407	exceed the license scope: current license does not allow OLAP, parallel dml is not allowed
select count(*) from test_olap_table;
count(*)
3
select /*+parallel(3)*/ count(*) from test_olap_table;
count(*)
3
Warnings:
Warning	4407	exceed the license scope: current license does not allow OLAP, parallel dml is not allowed
select /*+PARALLEL(AUTO)*/ count(*) from test_olap_table;
count(*)
3
Warnings:
Warning	4407	exceed the license scope: current license does not allow OLAP, parallel dml is not allowed
SET session parallel_degree_policy = AUTO;
SET session parallel_degree_policy = AUTO;
SET session parallel_degree_policy = AUTO;
select count(*) from test_olap_table;
count(*)
3
Warnings:
Warning	4407	exceed the license scope: current license does not allow OLAP, parallel dml is not allowed
SET session parallel_degree_policy = MANUAL;
drop table test_olap_table;
alter system load license "/data/1/shaoyibo.syb/observer1/test_license/license-trial.txt";
alter system set_tp tp_name = "LICENSE_TIMESTAMP_SERVICE_CURRENT_SYS_TIME_SECOND", error_code = 1893427200, frequency = 1;
alter system set_tp tp_name = "LICENSE_TIMESTAMP_SERVICE_CURRENT_TIME_SECOND", error_code = 1893427200, frequency = 1;
create table im_a_table(id int);
insert into im_a_table values(1), (2), (3);
delete from im_a_table where id = 2;
update im_a_table set id = 4 where id = 3;
select * from im_a_table;
id
1
4
drop table im_a_table;
insert into id_table values(1);
ERROR HY000: license is expired
delete from id_table where id = 2;
ERROR HY000: license is expired
update id_table set id = 4 where id = 3;
ERROR HY000: license is expired
select * from id_table;
ERROR HY000: license is expired
explain select * from id_table;
ERROR HY000: license is expired
ALTER SYSTEM SET _enable_parallel_table_creation = false;
create table im_a_table(id int);
ERROR HY000: license is expired
ALTER SYSTEM SET _enable_parallel_table_creation = true;
create table im_a_table(id int);
ERROR HY000: license is expired
alter system set_tp tp_name = "LICENSE_TIMESTAMP_SERVICE_CURRENT_SYS_TIME_SECOND", error_code = 1746892800, frequency = 1;
alter system set_tp tp_name = "LICENSE_TIMESTAMP_SERVICE_CURRENT_TIME_SECOND", error_code = 1746892800, frequency = 1;
select LTS_TIME from __all_license;
LTS_TIME
2030-01-01 00:00:00.000000
alter system set_tp tp_name = "LICENSE_TIMESTAMP_SERVICE_CURRENT_SYS_TIME_SECOND", error_code = 915120000, frequency = 1;
alter system load license "/data/1/shaoyibo.syb/observer1/test_license/license-trial.txt";
select DATE_FORMAT(LTS_TIME, '%Y-%m-%d') from __all_license;
DATE_FORMAT(LTS_TIME, '%Y-%m-%d')
2025-05-11
alter system set_tp tp_name = "LICENSE_TIMESTAMP_SERVICE_CURRENT_SYS_TIME_SECOND", error_code = 1893427200, frequency = 1;
alter system load license "/data/1/shaoyibo.syb/observer1/test_license/license-trial.txt";
select DATE_FORMAT(LTS_TIME, '%Y-%m-%d') from __all_license;
DATE_FORMAT(LTS_TIME, '%Y-%m-%d')
2025-05-11
alter system set_tp tp_name = "LICENSE_TIMESTAMP_SERVICE_CURRENT_SYS_TIME_SECOND", error_code = 0, frequency = 1;
alter system set_tp tp_name = "LICENSE_TIMESTAMP_SERVICE_CURRENT_TIME_SECOND", error_code = 0, frequency = 1;
alter system set_tp tp_name = "LICENSE_TIMESTAMP_SERVICE_FORCE_UPDATE_TIME", error_code = 0, frequency = 1;
drop tenant if exists license_standby_tenant purge;
drop resource pool if exists license_rp;
drop resource unit if exists license_uc;
drop resource pool if exists license_standby_rp;
drop resource unit if exists license_standby_uc;
alter system load license "/data/1/shaoyibo.syb/observer1/test_license/license-debug.txt";
drop user if exists 'license_standby_user'@'%';
drop table if exists id_table;
drop table if exists id_table;
