purge recyclebin;
# Environmental cleaning
DROP USER zhang;
ERROR HY000: Operation DROP USER failed for 'zhang'@'%'
CREATE USER 'zhang'@'%' IDENTIFIED BY 'zhang';
GRANT all ON *.* TO 'zhang'@'%';
CREATE DATABASE IF NOT EXISTS charset_test;
USE charset_test;
SET sql_mode='';
SELECT @@sql_mode;
@@sql_mode


DROP TABLE Z0CASE;
ERROR 42S02: Unknown table 'charset_test.z0case'
general_list_update  utf8mb4/utf8mb4_general_ci --> utf16/utf16_unicode_ci
char
CREATE TABLE Z0CASE(T1 CHAR(50)) DEFAULT charset= utf8mb4 DEFAULT collate = utf8mb4_general_ci;
INSERT INTO Z0CASE VALUES(123);
INSERT INTO Z0CASE VALUES('%^&*[];//\\');
INSERT INTO Z0CASE VALUES(NULL);
INSERT INTO Z0CASE VALUES('abc');
INSERT INTO Z0CASE VALUES('中文');
SELECT * FROM Z0CASE ORDER BY T1*1;
T1
NULL
%^&*[];//\
abc
中文
123
Warnings:
Warning	1292	Truncated incorrect DOUBLE value: '%^&*[];//\'
Warning	1292	Truncated incorrect DOUBLE value: 'abc'
Warning	1292	Truncated incorrect DOUBLE value: '中文'
SELECT table_name,column_type,COLLATION_NAME,CHARACTER_SET_NAME FROM information_schema.columns WHERE table_name='Z0CASE';
table_name	column_type	COLLATION_NAME	CHARACTER_SET_NAME
z0case	char(50)	utf8mb4_general_ci	utf8mb4
SELECT table_name,table_collation FROM information_schema.tables WHERE table_name='Z0CASE';
table_name	table_collation
z0case	utf8mb4_general_ci
ALTER TABLE Z0CASE CONVERT TO CHARACTER SET 'utf16' COLLATE 'utf16_unicode_ci';
SELECT table_name,table_collation FROM information_schema.tables WHERE table_name='Z0CASE';
table_name	table_collation
z0case	utf16_unicode_ci
SELECT * FROM Z0CASE ORDER BY T1*1;
T1
NULL
%^&*[];//\
abc
中文
123
Warnings:
Warning	1292	Truncated incorrect DOUBLE value: '%^&*[];//\'
Warning	1292	Truncated incorrect DOUBLE value: 'abc'
Warning	1292	Truncated incorrect DOUBLE value: '中文'
insert
INSERT INTO Z0CASE VALUES(111);
INSERT INTO Z0CASE VALUES('2001');
INSERT INTO Z0CASE VALUES('!*?< >aB12 中文');
INSERT INTO Z0CASE VALUES(b'0101101');
INSERT INTO Z0CASE VALUES('2021-10-01 12:23:35.54');
INSERT INTO Z0CASE VALUES('2011-11-01');
INSERT INTO Z0CASE VALUES('22:22:35');
INSERT INTO Z0CASE VALUES(12.345);
INSERT INTO Z0CASE VALUES(null);
SELECT table_name,column_type,COLLATION_NAME,CHARACTER_SET_NAME FROM information_schema.columns WHERE table_name='Z0CASE';
table_name	column_type	COLLATION_NAME	CHARACTER_SET_NAME
z0case	char(50)	utf16_unicode_ci	utf16
SELECT table_name,table_collation FROM information_schema.tables WHERE table_name='Z0CASE';
table_name	table_collation
z0case	utf16_unicode_ci
SELECT * FROM Z0CASE ORDER BY T1*1;
T1
NULL
NULL
%^&*[];//\
abc
中文
!*?< >aB12 中文
-
12.345
22:22:35
111
123
2001
2011-11-01
2021-10-01 12:23:35.54
Warnings:
Warning	1292	Truncated incorrect DOUBLE value: '%^&*[];//\'
Warning	1292	Truncated incorrect DOUBLE value: 'abc'
Warning	1292	Truncated incorrect DOUBLE value: '中文'
Warning	1292	Truncated incorrect DOUBLE value: '!*?< >aB12 中文'
Warning	1292	Truncated incorrect DOUBLE value: '-'
Warning	1292	Truncated incorrect DOUBLE value: '2021-10-01 12:23:35.54'
Warning	1292	Truncated incorrect DOUBLE value: '2011-11-01'
Warning	1292	Truncated incorrect DOUBLE value: '22:22:35'
update
UPDATE Z0CASE SET T1=NULL WHERE T1='111';
UPDATE Z0CASE SET T1='12:31:56' WHERE T1=2001;
Warnings:
Warning	1292	Truncated incorrect DECIMAL value: '%^&*[];//\'
Warning	1292	Truncated incorrect DECIMAL value: 'abc'
Warning	1292	Truncated incorrect DECIMAL value: '中文'
Warning	1292	Truncated incorrect DECIMAL value: '!*?< >aB12 中文'
Warning	1292	Truncated incorrect DECIMAL value: '2021-10-01 12:23:35.54'
Warning	1292	Truncated incorrect DECIMAL value: '2011-11-01'
Warning	1292	Truncated incorrect DECIMAL value: '22:22:35'
UPDATE Z0CASE SET T1=1221.34 WHERE T1='2011-11-01';
UPDATE Z0CASE SET T1='Aa1$< >中文' WHERE T1='12.345';
UPDATE Z0CASE SET T1=b'0101101' WHERE T1='abc';
SELECT table_name,column_type,COLLATION_NAME,CHARACTER_SET_NAME FROM information_schema.columns WHERE table_name='Z0CASE';
table_name	column_type	COLLATION_NAME	CHARACTER_SET_NAME
z0case	char(50)	utf16_unicode_ci	utf16
SELECT table_name,table_collation FROM information_schema.tables WHERE table_name='Z0CASE';
table_name	table_collation
z0case	utf16_unicode_ci
SELECT * FROM Z0CASE ORDER BY T1*1;
T1
NULL
NULL
NULL
%^&*[];//\
-
中文
!*?< >aB12 中文
-
Aa1$< >中文
12:31:56
22:22:35
123
1221.34
2021-10-01 12:23:35.54
Warnings:
Warning	1292	Truncated incorrect DOUBLE value: '%^&*[];//\'
Warning	1292	Truncated incorrect DOUBLE value: '-'
Warning	1292	Truncated incorrect DOUBLE value: '中文'
Warning	1292	Truncated incorrect DOUBLE value: '12:31:56'
Warning	1292	Truncated incorrect DOUBLE value: '!*?< >aB12 中文'
Warning	1292	Truncated incorrect DOUBLE value: '-'
Warning	1292	Truncated incorrect DOUBLE value: '2021-10-01 12:23:35.54'
Warning	1292	Truncated incorrect DOUBLE value: '22:22:35'
Warning	1292	Truncated incorrect DOUBLE value: 'Aa1$< >中文'
delete
DELETE FROM Z0CASE WHERE T1=1221.34;
Warnings:
Warning	1292	Truncated incorrect DECIMAL value: '%^&*[];//\'
Warning	1292	Truncated incorrect DECIMAL value: '中文'
Warning	1292	Truncated incorrect DECIMAL value: '12:31:56'
Warning	1292	Truncated incorrect DECIMAL value: '!*?< >aB12 中文'
Warning	1292	Truncated incorrect DECIMAL value: '2021-10-01 12:23:35.54'
Warning	1292	Truncated incorrect DECIMAL value: '22:22:35'
Warning	1292	Truncated incorrect DECIMAL value: 'Aa1$< >中文'
DELETE FROM Z0CASE WHERE T1='2021-10-01 12:23:35.54';
DELETE FROM Z0CASE WHERE T1 IS NULL;
DELETE FROM Z0CASE WHERE T1=b'0101101';
SELECT * FROM Z0CASE ORDER BY T1*1;
T1
%^&*[];//\
中文
!*?< >aB12 中文
Aa1$< >中文
12:31:56
22:22:35
123
Warnings:
Warning	1292	Truncated incorrect DOUBLE value: '%^&*[];//\'
Warning	1292	Truncated incorrect DOUBLE value: '中文'
Warning	1292	Truncated incorrect DOUBLE value: '12:31:56'
Warning	1292	Truncated incorrect DOUBLE value: '!*?< >aB12 中文'
Warning	1292	Truncated incorrect DOUBLE value: '22:22:35'
Warning	1292	Truncated incorrect DOUBLE value: 'Aa1$< >中文'
varchar
DROP TABLE Z0CASE;
CREATE TABLE Z0CASE(T1 VARCHAR(50)) DEFAULT charset= utf8mb4 DEFAULT collate = utf8mb4_general_ci;
INSERT INTO Z0CASE VALUES(123);
INSERT INTO Z0CASE VALUES('%^&*[];//\\');
INSERT INTO Z0CASE VALUES(NULL);
INSERT INTO Z0CASE VALUES('abc');
INSERT INTO Z0CASE VALUES('中文');
SELECT * FROM Z0CASE ORDER BY T1*1;
T1
NULL
%^&*[];//\
abc
中文
123
Warnings:
Warning	1292	Truncated incorrect DOUBLE value: '%^&*[];//\'
Warning	1292	Truncated incorrect DOUBLE value: 'abc'
Warning	1292	Truncated incorrect DOUBLE value: '中文'
SELECT table_name,column_type,COLLATION_NAME,CHARACTER_SET_NAME FROM information_schema.columns WHERE table_name='Z0CASE';
table_name	column_type	COLLATION_NAME	CHARACTER_SET_NAME
z0case	varchar(50)	utf8mb4_general_ci	utf8mb4
SELECT table_name,table_collation FROM information_schema.tables WHERE table_name='Z0CASE';
table_name	table_collation
z0case	utf8mb4_general_ci
ALTER TABLE Z0CASE CONVERT TO CHARACTER SET 'utf16' COLLATE 'utf16_unicode_ci';
SELECT table_name,table_collation FROM information_schema.tables WHERE table_name='Z0CASE';
table_name	table_collation
z0case	utf16_unicode_ci
SELECT * FROM Z0CASE ORDER BY T1*1;
T1
NULL
%^&*[];//\
abc
中文
123
Warnings:
Warning	1292	Truncated incorrect DOUBLE value: '%^&*[];//\'
Warning	1292	Truncated incorrect DOUBLE value: 'abc'
Warning	1292	Truncated incorrect DOUBLE value: '中文'
insert
INSERT INTO Z0CASE VALUES(111);
INSERT INTO Z0CASE VALUES('2001');
INSERT INTO Z0CASE VALUES('!*?< >aB12 中文');
INSERT INTO Z0CASE VALUES(b'0101101');
INSERT INTO Z0CASE VALUES('2021-10-01 12:23:35.54');
INSERT INTO Z0CASE VALUES('2011-11-01');
INSERT INTO Z0CASE VALUES('22:22:35');
INSERT INTO Z0CASE VALUES(12.345);
INSERT INTO Z0CASE VALUES(null);
SELECT table_name,column_type,COLLATION_NAME,CHARACTER_SET_NAME FROM information_schema.columns WHERE table_name='Z0CASE';
table_name	column_type	COLLATION_NAME	CHARACTER_SET_NAME
z0case	varchar(50)	utf16_unicode_ci	utf16
SELECT table_name,table_collation FROM information_schema.tables WHERE table_name='Z0CASE';
table_name	table_collation
z0case	utf16_unicode_ci
SELECT * FROM Z0CASE ORDER BY T1*1;
T1
NULL
NULL
%^&*[];//\
abc
中文
!*?< >aB12 中文
-
12.345
22:22:35
111
123
2001
2011-11-01
2021-10-01 12:23:35.54
Warnings:
Warning	1292	Truncated incorrect DOUBLE value: '%^&*[];//\'
Warning	1292	Truncated incorrect DOUBLE value: 'abc'
Warning	1292	Truncated incorrect DOUBLE value: '中文'
Warning	1292	Truncated incorrect DOUBLE value: '!*?< >aB12 中文'
Warning	1292	Truncated incorrect DOUBLE value: '-'
Warning	1292	Truncated incorrect DOUBLE value: '2021-10-01 12:23:35.54'
Warning	1292	Truncated incorrect DOUBLE value: '2011-11-01'
Warning	1292	Truncated incorrect DOUBLE value: '22:22:35'
update
UPDATE Z0CASE SET T1=NULL WHERE T1='111';
UPDATE Z0CASE SET T1='12:31:56' WHERE T1=2001;
Warnings:
Warning	1292	Truncated incorrect DECIMAL value: '%^&*[];//\'
Warning	1292	Truncated incorrect DECIMAL value: 'abc'
Warning	1292	Truncated incorrect DECIMAL value: '中文'
Warning	1292	Truncated incorrect DECIMAL value: '!*?< >aB12 中文'
Warning	1292	Truncated incorrect DECIMAL value: '2021-10-01 12:23:35.54'
Warning	1292	Truncated incorrect DECIMAL value: '2011-11-01'
Warning	1292	Truncated incorrect DECIMAL value: '22:22:35'
UPDATE Z0CASE SET T1=1221.34 WHERE T1='2011-11-01';
UPDATE Z0CASE SET T1='Aa1$< >中文' WHERE T1='12.345';
UPDATE Z0CASE SET T1=b'0101101' WHERE T1='abc';
SELECT table_name,column_type,COLLATION_NAME,CHARACTER_SET_NAME FROM information_schema.columns WHERE table_name='Z0CASE';
table_name	column_type	COLLATION_NAME	CHARACTER_SET_NAME
z0case	varchar(50)	utf16_unicode_ci	utf16
SELECT table_name,table_collation FROM information_schema.tables WHERE table_name='Z0CASE';
table_name	table_collation
z0case	utf16_unicode_ci
SELECT * FROM Z0CASE ORDER BY T1*1;
T1
NULL
NULL
NULL
%^&*[];//\
-
中文
!*?< >aB12 中文
-
Aa1$< >中文
12:31:56
22:22:35
123
1221.34
2021-10-01 12:23:35.54
Warnings:
Warning	1292	Truncated incorrect DOUBLE value: '%^&*[];//\'
Warning	1292	Truncated incorrect DOUBLE value: '-'
Warning	1292	Truncated incorrect DOUBLE value: '中文'
Warning	1292	Truncated incorrect DOUBLE value: '12:31:56'
Warning	1292	Truncated incorrect DOUBLE value: '!*?< >aB12 中文'
Warning	1292	Truncated incorrect DOUBLE value: '-'
Warning	1292	Truncated incorrect DOUBLE value: '2021-10-01 12:23:35.54'
Warning	1292	Truncated incorrect DOUBLE value: '22:22:35'
Warning	1292	Truncated incorrect DOUBLE value: 'Aa1$< >中文'
delete
DELETE FROM Z0CASE WHERE T1=1221.34;
Warnings:
Warning	1292	Truncated incorrect DECIMAL value: '%^&*[];//\'
Warning	1292	Truncated incorrect DECIMAL value: '中文'
Warning	1292	Truncated incorrect DECIMAL value: '12:31:56'
Warning	1292	Truncated incorrect DECIMAL value: '!*?< >aB12 中文'
Warning	1292	Truncated incorrect DECIMAL value: '2021-10-01 12:23:35.54'
Warning	1292	Truncated incorrect DECIMAL value: '22:22:35'
Warning	1292	Truncated incorrect DECIMAL value: 'Aa1$< >中文'
DELETE FROM Z0CASE WHERE T1='2021-10-01 12:23:35.54';
DELETE FROM Z0CASE WHERE T1 IS NULL;
DELETE FROM Z0CASE WHERE T1=b'0101101';
SELECT * FROM Z0CASE ORDER BY T1*1;
T1
%^&*[];//\
中文
!*?< >aB12 中文
Aa1$< >中文
12:31:56
22:22:35
123
Warnings:
Warning	1292	Truncated incorrect DOUBLE value: '%^&*[];//\'
Warning	1292	Truncated incorrect DOUBLE value: '中文'
Warning	1292	Truncated incorrect DOUBLE value: '12:31:56'
Warning	1292	Truncated incorrect DOUBLE value: '!*?< >aB12 中文'
Warning	1292	Truncated incorrect DOUBLE value: '22:22:35'
Warning	1292	Truncated incorrect DOUBLE value: 'Aa1$< >中文'
TEXT
DROP TABLE Z0CASE;
CREATE TABLE Z0CASE(T1 TEXT) DEFAULT charset= utf8mb4 DEFAULT collate = utf8mb4_general_ci;
INSERT INTO Z0CASE VALUES(123);
INSERT INTO Z0CASE VALUES('%^&*[];//\\');
INSERT INTO Z0CASE VALUES(NULL);
INSERT INTO Z0CASE VALUES('abc');
INSERT INTO Z0CASE VALUES('中文');
SELECT * FROM Z0CASE ORDER BY T1*1;
T1
NULL
%^&*[];//\
abc
中文
123
Warnings:
Warning	1292	Truncated incorrect DOUBLE value: '%^&*[];//\'
Warning	1292	Truncated incorrect DOUBLE value: 'abc'
Warning	1292	Truncated incorrect DOUBLE value: '中文'
SELECT table_name,column_type,COLLATION_NAME,CHARACTER_SET_NAME FROM information_schema.columns WHERE table_name='Z0CASE';
table_name	column_type	COLLATION_NAME	CHARACTER_SET_NAME
z0case	text	utf8mb4_general_ci	utf8mb4
SELECT table_name,table_collation FROM information_schema.tables WHERE table_name='Z0CASE';
table_name	table_collation
z0case	utf8mb4_general_ci
ALTER TABLE Z0CASE CONVERT TO CHARACTER SET 'utf16' COLLATE 'utf16_unicode_ci';
SELECT table_name,table_collation FROM information_schema.tables WHERE table_name='Z0CASE';
table_name	table_collation
z0case	utf16_unicode_ci
SELECT * FROM Z0CASE ORDER BY T1*1;
T1
NULL
%^&*[];//\
abc
中文
123
Warnings:
Warning	1292	Truncated incorrect DOUBLE value: '%^&*[];//\'
Warning	1292	Truncated incorrect DOUBLE value: 'abc'
Warning	1292	Truncated incorrect DOUBLE value: '中文'
insert
INSERT INTO Z0CASE VALUES(111);
INSERT INTO Z0CASE VALUES('2001');
INSERT INTO Z0CASE VALUES('!*?< >aB12 中文');
INSERT INTO Z0CASE VALUES(b'0101101');
INSERT INTO Z0CASE VALUES('2021-10-01 12:23:35.54');
INSERT INTO Z0CASE VALUES('2011-11-01');
INSERT INTO Z0CASE VALUES('22:22:35');
INSERT INTO Z0CASE VALUES(12.345);
INSERT INTO Z0CASE VALUES(null);
SELECT table_name,column_type,COLLATION_NAME,CHARACTER_SET_NAME FROM information_schema.columns WHERE table_name='Z0CASE';
table_name	column_type	COLLATION_NAME	CHARACTER_SET_NAME
z0case	text	utf16_unicode_ci	utf16
SELECT table_name,table_collation FROM information_schema.tables WHERE table_name='Z0CASE';
table_name	table_collation
z0case	utf16_unicode_ci
SELECT * FROM Z0CASE ORDER BY T1*1;
T1
NULL
NULL
%^&*[];//\
abc
中文
!*?< >aB12 中文
-
12.345
22:22:35
111
123
2001
2011-11-01
2021-10-01 12:23:35.54
Warnings:
Warning	1292	Truncated incorrect DOUBLE value: '%^&*[];//\'
Warning	1292	Truncated incorrect DOUBLE value: 'abc'
Warning	1292	Truncated incorrect DOUBLE value: '中文'
Warning	1292	Truncated incorrect DOUBLE value: '!*?< >aB12 中文'
Warning	1292	Truncated incorrect DOUBLE value: '-'
Warning	1292	Truncated incorrect DOUBLE value: '2021-10-01 12:23:35.54'
Warning	1292	Truncated incorrect DOUBLE value: '2011-11-01'
Warning	1292	Truncated incorrect DOUBLE value: '22:22:35'
update
UPDATE Z0CASE SET T1=NULL WHERE T1='111';
UPDATE Z0CASE SET T1='12:31:56' WHERE T1=2001;
Warnings:
Warning	1292	Truncated incorrect DECIMAL value: '%^&*[];//\'
Warning	1292	Truncated incorrect DECIMAL value: 'abc'
Warning	1292	Truncated incorrect DECIMAL value: '中文'
Warning	1292	Truncated incorrect DECIMAL value: '!*?< >aB12 中文'
Warning	1292	Truncated incorrect DECIMAL value: '2021-10-01 12:23:35.54'
Warning	1292	Truncated incorrect DECIMAL value: '2011-11-01'
Warning	1292	Truncated incorrect DECIMAL value: '22:22:35'
UPDATE Z0CASE SET T1=1221.34 WHERE T1='2011-11-01';
UPDATE Z0CASE SET T1='Aa1$< >中文' WHERE T1='12.345';
UPDATE Z0CASE SET T1=b'0101101' WHERE T1='abc';
SELECT table_name,column_type,COLLATION_NAME,CHARACTER_SET_NAME FROM information_schema.columns WHERE table_name='Z0CASE';
table_name	column_type	COLLATION_NAME	CHARACTER_SET_NAME
z0case	text	utf16_unicode_ci	utf16
SELECT table_name,table_collation FROM information_schema.tables WHERE table_name='Z0CASE';
table_name	table_collation
z0case	utf16_unicode_ci
SELECT * FROM Z0CASE ORDER BY T1*1;
T1
NULL
NULL
NULL
%^&*[];//\
-
中文
!*?< >aB12 中文
-
Aa1$< >中文
12:31:56
22:22:35
123
1221.34
2021-10-01 12:23:35.54
Warnings:
Warning	1292	Truncated incorrect DOUBLE value: '%^&*[];//\'
Warning	1292	Truncated incorrect DOUBLE value: '-'
Warning	1292	Truncated incorrect DOUBLE value: '中文'
Warning	1292	Truncated incorrect DOUBLE value: '12:31:56'
Warning	1292	Truncated incorrect DOUBLE value: '!*?< >aB12 中文'
Warning	1292	Truncated incorrect DOUBLE value: '-'
Warning	1292	Truncated incorrect DOUBLE value: '2021-10-01 12:23:35.54'
Warning	1292	Truncated incorrect DOUBLE value: '22:22:35'
Warning	1292	Truncated incorrect DOUBLE value: 'Aa1$< >中文'
delete
DELETE FROM Z0CASE WHERE T1=1221.34;
Warnings:
Warning	1292	Truncated incorrect DECIMAL value: '%^&*[];//\'
Warning	1292	Truncated incorrect DECIMAL value: '-'
Warning	1292	Truncated incorrect DECIMAL value: '中文'
Warning	1292	Truncated incorrect DECIMAL value: '12:31:56'
Warning	1292	Truncated incorrect DECIMAL value: '!*?< >aB12 中文'
Warning	1292	Truncated incorrect DECIMAL value: '-'
Warning	1292	Truncated incorrect DECIMAL value: '2021-10-01 12:23:35.54'
Warning	1292	Truncated incorrect DECIMAL value: '22:22:35'
Warning	1292	Truncated incorrect DECIMAL value: 'Aa1$< >中文'
DELETE FROM Z0CASE WHERE T1='2021-10-01 12:23:35.54';
DELETE FROM Z0CASE WHERE T1 IS NULL;
DELETE FROM Z0CASE WHERE T1=b'0101101';
SELECT * FROM Z0CASE ORDER BY T1*1;
T1
%^&*[];//\
中文
!*?< >aB12 中文
Aa1$< >中文
12:31:56
22:22:35
123
Warnings:
Warning	1292	Truncated incorrect DOUBLE value: '%^&*[];//\'
Warning	1292	Truncated incorrect DOUBLE value: '中文'
Warning	1292	Truncated incorrect DOUBLE value: '12:31:56'
Warning	1292	Truncated incorrect DOUBLE value: '!*?< >aB12 中文'
Warning	1292	Truncated incorrect DOUBLE value: '22:22:35'
Warning	1292	Truncated incorrect DOUBLE value: 'Aa1$< >中文'
LONGTEXT
DROP TABLE Z0CASE;
CREATE TABLE Z0CASE(T1 LONGTEXT) DEFAULT charset= utf8mb4 DEFAULT collate = utf8mb4_general_ci;
INSERT INTO Z0CASE VALUES(123);
INSERT INTO Z0CASE VALUES('%^&*[];//\\');
INSERT INTO Z0CASE VALUES(NULL);
INSERT INTO Z0CASE VALUES('abc');
INSERT INTO Z0CASE VALUES('中文');
SELECT * FROM Z0CASE ORDER BY T1*1;
T1
NULL
%^&*[];//\
abc
中文
123
Warnings:
Warning	1292	Truncated incorrect DOUBLE value: '%^&*[];//\'
Warning	1292	Truncated incorrect DOUBLE value: 'abc'
Warning	1292	Truncated incorrect DOUBLE value: '中文'
SELECT table_name,column_type,COLLATION_NAME,CHARACTER_SET_NAME FROM information_schema.columns WHERE table_name='Z0CASE';
table_name	column_type	COLLATION_NAME	CHARACTER_SET_NAME
z0case	longtext	utf8mb4_general_ci	utf8mb4
SELECT table_name,table_collation FROM information_schema.tables WHERE table_name='Z0CASE';
table_name	table_collation
z0case	utf8mb4_general_ci
ALTER TABLE Z0CASE CONVERT TO CHARACTER SET 'utf16' COLLATE 'utf16_unicode_ci';
SELECT table_name,table_collation FROM information_schema.tables WHERE table_name='Z0CASE';
table_name	table_collation
z0case	utf16_unicode_ci
SELECT * FROM Z0CASE ORDER BY T1*1;
T1
NULL
%^&*[];//\
abc
中文
123
Warnings:
Warning	1292	Truncated incorrect DOUBLE value: '%^&*[];//\'
Warning	1292	Truncated incorrect DOUBLE value: 'abc'
Warning	1292	Truncated incorrect DOUBLE value: '中文'
insert
INSERT INTO Z0CASE VALUES(111);
INSERT INTO Z0CASE VALUES('2001');
INSERT INTO Z0CASE VALUES('!*?< >aB12 中文');
INSERT INTO Z0CASE VALUES(b'0101101');
INSERT INTO Z0CASE VALUES('2021-10-01 12:23:35.54');
INSERT INTO Z0CASE VALUES('2011-11-01');
INSERT INTO Z0CASE VALUES('22:22:35');
INSERT INTO Z0CASE VALUES(12.345);
INSERT INTO Z0CASE VALUES(null);
SELECT table_name,column_type,COLLATION_NAME,CHARACTER_SET_NAME FROM information_schema.columns WHERE table_name='Z0CASE';
table_name	column_type	COLLATION_NAME	CHARACTER_SET_NAME
z0case	longtext	utf16_unicode_ci	utf16
SELECT table_name,table_collation FROM information_schema.tables WHERE table_name='Z0CASE';
table_name	table_collation
z0case	utf16_unicode_ci
SELECT * FROM Z0CASE ORDER BY T1*1;
T1
NULL
NULL
%^&*[];//\
abc
中文
!*?< >aB12 中文
-
12.345
22:22:35
111
123
2001
2011-11-01
2021-10-01 12:23:35.54
Warnings:
Warning	1292	Truncated incorrect DOUBLE value: '%^&*[];//\'
Warning	1292	Truncated incorrect DOUBLE value: 'abc'
Warning	1292	Truncated incorrect DOUBLE value: '中文'
Warning	1292	Truncated incorrect DOUBLE value: '!*?< >aB12 中文'
Warning	1292	Truncated incorrect DOUBLE value: '-'
Warning	1292	Truncated incorrect DOUBLE value: '2021-10-01 12:23:35.54'
Warning	1292	Truncated incorrect DOUBLE value: '2011-11-01'
Warning	1292	Truncated incorrect DOUBLE value: '22:22:35'
update
UPDATE Z0CASE SET T1=NULL WHERE T1='111';
UPDATE Z0CASE SET T1='12:31:56' WHERE T1=2001;
Warnings:
Warning	1292	Truncated incorrect DECIMAL value: '%^&*[];//\'
Warning	1292	Truncated incorrect DECIMAL value: 'abc'
Warning	1292	Truncated incorrect DECIMAL value: '中文'
Warning	1292	Truncated incorrect DECIMAL value: '!*?< >aB12 中文'
Warning	1292	Truncated incorrect DECIMAL value: '2021-10-01 12:23:35.54'
Warning	1292	Truncated incorrect DECIMAL value: '2011-11-01'
Warning	1292	Truncated incorrect DECIMAL value: '22:22:35'
UPDATE Z0CASE SET T1=1221.34 WHERE T1='2011-11-01';
UPDATE Z0CASE SET T1='Aa1$< >中文' WHERE T1='12.345';
UPDATE Z0CASE SET T1=b'0101101' WHERE T1='abc';
SELECT table_name,column_type,COLLATION_NAME,CHARACTER_SET_NAME FROM information_schema.columns WHERE table_name='Z0CASE';
table_name	column_type	COLLATION_NAME	CHARACTER_SET_NAME
z0case	longtext	utf16_unicode_ci	utf16
SELECT table_name,table_collation FROM information_schema.tables WHERE table_name='Z0CASE';
table_name	table_collation
z0case	utf16_unicode_ci
SELECT * FROM Z0CASE ORDER BY T1*1;
T1
NULL
NULL
NULL
%^&*[];//\
-
中文
!*?< >aB12 中文
-
Aa1$< >中文
12:31:56
22:22:35
123
1221.34
2021-10-01 12:23:35.54
Warnings:
Warning	1292	Truncated incorrect DOUBLE value: '%^&*[];//\'
Warning	1292	Truncated incorrect DOUBLE value: '-'
Warning	1292	Truncated incorrect DOUBLE value: '中文'
Warning	1292	Truncated incorrect DOUBLE value: '12:31:56'
Warning	1292	Truncated incorrect DOUBLE value: '!*?< >aB12 中文'
Warning	1292	Truncated incorrect DOUBLE value: '-'
Warning	1292	Truncated incorrect DOUBLE value: '2021-10-01 12:23:35.54'
Warning	1292	Truncated incorrect DOUBLE value: '22:22:35'
Warning	1292	Truncated incorrect DOUBLE value: 'Aa1$< >中文'
delete
DELETE FROM Z0CASE WHERE T1=1221.34;
Warnings:
Warning	1292	Truncated incorrect DECIMAL value: '%^&*[];//\'
Warning	1292	Truncated incorrect DECIMAL value: '-'
Warning	1292	Truncated incorrect DECIMAL value: '中文'
Warning	1292	Truncated incorrect DECIMAL value: '12:31:56'
Warning	1292	Truncated incorrect DECIMAL value: '!*?< >aB12 中文'
Warning	1292	Truncated incorrect DECIMAL value: '-'
Warning	1292	Truncated incorrect DECIMAL value: '2021-10-01 12:23:35.54'
Warning	1292	Truncated incorrect DECIMAL value: '22:22:35'
Warning	1292	Truncated incorrect DECIMAL value: 'Aa1$< >中文'
DELETE FROM Z0CASE WHERE T1='2021-10-01 12:23:35.54';
DELETE FROM Z0CASE WHERE T1 IS NULL;
DELETE FROM Z0CASE WHERE T1=b'0101101';
SELECT * FROM Z0CASE ORDER BY T1*1;
T1
%^&*[];//\
中文
!*?< >aB12 中文
Aa1$< >中文
12:31:56
22:22:35
123
Warnings:
Warning	1292	Truncated incorrect DOUBLE value: '%^&*[];//\'
Warning	1292	Truncated incorrect DOUBLE value: '中文'
Warning	1292	Truncated incorrect DOUBLE value: '12:31:56'
Warning	1292	Truncated incorrect DOUBLE value: '!*?< >aB12 中文'
Warning	1292	Truncated incorrect DOUBLE value: '22:22:35'
Warning	1292	Truncated incorrect DOUBLE value: 'Aa1$< >中文'
BLOB
DROP TABLE Z0CASE;
CREATE TABLE Z0CASE(T1 BLOB) DEFAULT charset= utf8mb4 DEFAULT collate = utf8mb4_general_ci;
INSERT INTO Z0CASE VALUES(123);
INSERT INTO Z0CASE VALUES('%^&*[];//\\');
INSERT INTO Z0CASE VALUES(NULL);
INSERT INTO Z0CASE VALUES('abc');
INSERT INTO Z0CASE VALUES('中文');
SELECT * FROM Z0CASE ORDER BY T1*1;
T1
NULL
%^&*[];//\
abc
中文
123
Warnings:
Warning	1292	Truncated incorrect DOUBLE value: '%^&*[];//\'
Warning	1292	Truncated incorrect DOUBLE value: 'abc'
Warning	1292	Truncated incorrect DOUBLE value: '中文'
SELECT table_name,column_type,COLLATION_NAME,CHARACTER_SET_NAME FROM information_schema.columns WHERE table_name='Z0CASE';
table_name	column_type	COLLATION_NAME	CHARACTER_SET_NAME
z0case	blob	NULL	NULL
SELECT table_name,table_collation FROM information_schema.tables WHERE table_name='Z0CASE';
table_name	table_collation
z0case	utf8mb4_general_ci
ALTER TABLE Z0CASE CONVERT TO CHARACTER SET 'utf16' COLLATE 'utf16_unicode_ci';
SELECT table_name,table_collation FROM information_schema.tables WHERE table_name='Z0CASE';
table_name	table_collation
z0case	utf16_unicode_ci
SELECT T1,HEX(T1) FROM Z0CASE ORDER BY T1;
T1	HEX(T1)
NULL	NULL
%^&*[];//\	255E262A5B5D3B2F2F5C
123	313233
abc	616263
中文	E4B8ADE69687
insert
INSERT INTO Z0CASE VALUES(111);
INSERT INTO Z0CASE VALUES('2001');
INSERT INTO Z0CASE VALUES('!*?< >aB12 中文');
INSERT INTO Z0CASE VALUES(b'0101101');
INSERT INTO Z0CASE VALUES('2021-10-01 12:23:35.54');
INSERT INTO Z0CASE VALUES('2011-11-01');
INSERT INTO Z0CASE VALUES('22:22:35');
INSERT INTO Z0CASE VALUES(12.345);
INSERT INTO Z0CASE VALUES(null);
SELECT table_name,column_type,COLLATION_NAME,CHARACTER_SET_NAME FROM information_schema.columns WHERE table_name='Z0CASE';
table_name	column_type	COLLATION_NAME	CHARACTER_SET_NAME
z0case	blob	NULL	NULL
SELECT table_name,table_collation FROM information_schema.tables WHERE table_name='Z0CASE';
table_name	table_collation
z0case	utf16_unicode_ci
SELECT T1,HEX(T1) FROM Z0CASE ORDER BY T1;
T1	HEX(T1)
NULL	NULL
NULL	NULL
!*?< >aB12 中文	212A3F3C203E6142313220E4B8ADE69687
%^&*[];//\	255E262A5B5D3B2F2F5C
-	2D
111	313131
12.345	31322E333435
123	313233
2001	32303031
2011-11-01	323031312D31312D3031
2021-10-01 12:23:35.54	323032312D31302D30312031323A32333A33352E3534
22:22:35	32323A32323A3335
abc	616263
中文	E4B8ADE69687
update
UPDATE Z0CASE SET T1=NULL WHERE T1='111';
UPDATE Z0CASE SET T1='12:31:56' WHERE T1=2001;
Warnings:
Warning	1292	Truncated incorrect DECIMAL value: '%^&*[];//\'
Warning	1292	Truncated incorrect DECIMAL value: 'abc'
Warning	1292	Truncated incorrect DECIMAL value: '中文'
Warning	1292	Truncated incorrect DECIMAL value: '!*?< >aB12 中文'
Warning	1292	Truncated incorrect DECIMAL value: '2021-10-01 12:23:35.54'
Warning	1292	Truncated incorrect DECIMAL value: '2011-11-01'
Warning	1292	Truncated incorrect DECIMAL value: '22:22:35'
UPDATE Z0CASE SET T1=1221.34 WHERE T1='2011-11-01';
UPDATE Z0CASE SET T1='Aa1$< >中文' WHERE T1='12.345';
UPDATE Z0CASE SET T1=b'0101101' WHERE T1='abc';
SELECT table_name,column_type,COLLATION_NAME,CHARACTER_SET_NAME FROM information_schema.columns WHERE table_name='Z0CASE';
table_name	column_type	COLLATION_NAME	CHARACTER_SET_NAME
z0case	blob	NULL	NULL
SELECT table_name,table_collation FROM information_schema.tables WHERE table_name='Z0CASE';
table_name	table_collation
z0case	utf16_unicode_ci
SELECT T1,HEX(T1) FROM Z0CASE ORDER BY T1;
T1	HEX(T1)
NULL	NULL
NULL	NULL
NULL	NULL
!*?< >aB12 中文	212A3F3C203E6142313220E4B8ADE69687
%^&*[];//\	255E262A5B5D3B2F2F5C
-	2D
-	2D
1221.34	313232312E3334
123	313233
12:31:56	31323A33313A3536
2021-10-01 12:23:35.54	323032312D31302D30312031323A32333A33352E3534
22:22:35	32323A32323A3335
Aa1$< >中文	416131243C203EE4B8ADE69687
中文	E4B8ADE69687
delete
DELETE FROM Z0CASE WHERE T1=1221.34;
Warnings:
Warning	1292	Truncated incorrect DECIMAL value: '%^&*[];//\'
Warning	1292	Truncated incorrect DECIMAL value: '-'
Warning	1292	Truncated incorrect DECIMAL value: '中文'
Warning	1292	Truncated incorrect DECIMAL value: '12:31:56'
Warning	1292	Truncated incorrect DECIMAL value: '!*?< >aB12 中文'
Warning	1292	Truncated incorrect DECIMAL value: '-'
Warning	1292	Truncated incorrect DECIMAL value: '2021-10-01 12:23:35.54'
Warning	1292	Truncated incorrect DECIMAL value: '22:22:35'
Warning	1292	Truncated incorrect DECIMAL value: 'Aa1$< >中文'
DELETE FROM Z0CASE WHERE T1='2021-10-01 12:23:35.54';
DELETE FROM Z0CASE WHERE T1 IS NULL;
DELETE FROM Z0CASE WHERE T1=b'0101101';
SELECT T1,HEX(T1) FROM Z0CASE ORDER BY T1;
T1	HEX(T1)
!*?< >aB12 中文	212A3F3C203E6142313220E4B8ADE69687
%^&*[];//\	255E262A5B5D3B2F2F5C
123	313233
12:31:56	31323A33313A3536
22:22:35	32323A32323A3335
Aa1$< >中文	416131243C203EE4B8ADE69687
中文	E4B8ADE69687
BINARY
DROP TABLE Z0CASE;
CREATE TABLE Z0CASE(T1 BINARY(50)) DEFAULT charset= utf8mb4 DEFAULT collate = utf8mb4_general_ci;
INSERT INTO Z0CASE VALUES(123);
INSERT INTO Z0CASE VALUES('%^&*[];//\\');
INSERT INTO Z0CASE VALUES(NULL);
INSERT INTO Z0CASE VALUES('abc');
INSERT INTO Z0CASE VALUES('中文');
SELECT * FROM Z0CASE ORDER BY T1*1;
T1
NULL
%^&*[];//\                                        
abc                                               
中文                                            
123                                               
Warnings:
Warning	1292	Truncated incorrect DOUBLE value: '123'
Warning	1292	Truncated incorrect DOUBLE value: '%^&*[];//\'
Warning	1292	Truncated incorrect DOUBLE value: 'abc'
Warning	1292	Truncated incorrect DOUBLE value: '中文'
SELECT table_name,column_type,COLLATION_NAME,CHARACTER_SET_NAME FROM information_schema.columns WHERE table_name='Z0CASE';
table_name	column_type	COLLATION_NAME	CHARACTER_SET_NAME
z0case	binary(50)	NULL	NULL
SELECT table_name,table_collation FROM information_schema.tables WHERE table_name='Z0CASE';
table_name	table_collation
z0case	utf8mb4_general_ci
ALTER TABLE Z0CASE CONVERT TO CHARACTER SET 'utf16' COLLATE 'utf16_unicode_ci';
SELECT table_name,table_collation FROM information_schema.tables WHERE table_name='Z0CASE';
table_name	table_collation
z0case	utf16_unicode_ci
SELECT T1,HEX(T1) FROM Z0CASE ORDER BY T1;
T1	HEX(T1)
NULL	NULL
%^&*[];//\                                        	255E262A5B5D3B2F2F5C00000000000000000000000000000000000000000000000000000000000000000000000000000000
123                                               	3132330000000000000000000000000000000000000000000000000000000000000000000000000000000000000000000000
abc                                               	6162630000000000000000000000000000000000000000000000000000000000000000000000000000000000000000000000
中文                                            	E4B8ADE696870000000000000000000000000000000000000000000000000000000000000000000000000000000000000000
insert
INSERT INTO Z0CASE VALUES(111);
INSERT INTO Z0CASE VALUES('2001');
INSERT INTO Z0CASE VALUES('!*?< >aB12 中文');
INSERT INTO Z0CASE VALUES(b'0101101');
INSERT INTO Z0CASE VALUES('2021-10-01 12:23:35.54');
INSERT INTO Z0CASE VALUES('2011-11-01');
INSERT INTO Z0CASE VALUES('22:22:35');
INSERT INTO Z0CASE VALUES(12.345);
INSERT INTO Z0CASE VALUES(null);
SELECT table_name,column_type,COLLATION_NAME,CHARACTER_SET_NAME FROM information_schema.columns WHERE table_name='Z0CASE';
table_name	column_type	COLLATION_NAME	CHARACTER_SET_NAME
z0case	binary(50)	NULL	NULL
SELECT table_name,table_collation FROM information_schema.tables WHERE table_name='Z0CASE';
table_name	table_collation
z0case	utf16_unicode_ci
SELECT T1,HEX(T1) FROM Z0CASE ORDER BY T1;
T1	HEX(T1)
NULL	NULL
NULL	NULL
!*?< >aB12 中文                                 	212A3F3C203E6142313220E4B8ADE69687000000000000000000000000000000000000000000000000000000000000000000
%^&*[];//\                                        	255E262A5B5D3B2F2F5C00000000000000000000000000000000000000000000000000000000000000000000000000000000
-                                                 	2D00000000000000000000000000000000000000000000000000000000000000000000000000000000000000000000000000
111                                               	3131310000000000000000000000000000000000000000000000000000000000000000000000000000000000000000000000
12.345                                            	31322E3334350000000000000000000000000000000000000000000000000000000000000000000000000000000000000000
123                                               	3132330000000000000000000000000000000000000000000000000000000000000000000000000000000000000000000000
2001                                              	3230303100000000000000000000000000000000000000000000000000000000000000000000000000000000000000000000
2011-11-01                                        	323031312D31312D303100000000000000000000000000000000000000000000000000000000000000000000000000000000
2021-10-01 12:23:35.54                            	323032312D31302D30312031323A32333A33352E353400000000000000000000000000000000000000000000000000000000
22:22:35                                          	32323A32323A3335000000000000000000000000000000000000000000000000000000000000000000000000000000000000
abc                                               	6162630000000000000000000000000000000000000000000000000000000000000000000000000000000000000000000000
中文                                            	E4B8ADE696870000000000000000000000000000000000000000000000000000000000000000000000000000000000000000
update
UPDATE Z0CASE SET T1=NULL WHERE T1='111';
UPDATE Z0CASE SET T1='12:31:56' WHERE T1=2001;
Warnings:
Warning	1292	Truncated incorrect DECIMAL value: '123'
Warning	1292	Truncated incorrect DECIMAL value: '%^&*[];//\'
Warning	1292	Truncated incorrect DECIMAL value: 'abc'
Warning	1292	Truncated incorrect DECIMAL value: '中文'
Warning	1292	Truncated incorrect DECIMAL value: '111'
Warning	1292	Truncated incorrect DECIMAL value: '2001'
Warning	1292	Truncated incorrect DECIMAL value: '!*?< >aB12 中文'
Warning	1292	Truncated incorrect DECIMAL value: '-'
Warning	1292	Truncated incorrect DECIMAL value: '2021-10-01 12:23:35.54'
Warning	1292	Truncated incorrect DECIMAL value: '2011-11-01'
Warning	1292	Truncated incorrect DECIMAL value: '22:22:35'
Warning	1292	Truncated incorrect DECIMAL value: '12.345'
UPDATE Z0CASE SET T1=1221.34 WHERE T1='2011-11-01';
UPDATE Z0CASE SET T1='Aa1$< >中文' WHERE T1='12.345';
UPDATE Z0CASE SET T1=b'0101101' WHERE T1='abc';
SELECT table_name,column_type,COLLATION_NAME,CHARACTER_SET_NAME FROM information_schema.columns WHERE table_name='Z0CASE';
table_name	column_type	COLLATION_NAME	CHARACTER_SET_NAME
z0case	binary(50)	NULL	NULL
SELECT table_name,table_collation FROM information_schema.tables WHERE table_name='Z0CASE';
table_name	table_collation
z0case	utf16_unicode_ci
SELECT T1,HEX(T1) FROM Z0CASE ORDER BY T1;
T1	HEX(T1)
NULL	NULL
NULL	NULL
!*?< >aB12 中文                                 	212A3F3C203E6142313220E4B8ADE69687000000000000000000000000000000000000000000000000000000000000000000
%^&*[];//\                                        	255E262A5B5D3B2F2F5C00000000000000000000000000000000000000000000000000000000000000000000000000000000
-                                                 	2D00000000000000000000000000000000000000000000000000000000000000000000000000000000000000000000000000
111                                               	3131310000000000000000000000000000000000000000000000000000000000000000000000000000000000000000000000
12.345                                            	31322E3334350000000000000000000000000000000000000000000000000000000000000000000000000000000000000000
123                                               	3132330000000000000000000000000000000000000000000000000000000000000000000000000000000000000000000000
12:31:56                                          	31323A33313A3536000000000000000000000000000000000000000000000000000000000000000000000000000000000000
2011-11-01                                        	323031312D31312D303100000000000000000000000000000000000000000000000000000000000000000000000000000000
2021-10-01 12:23:35.54                            	323032312D31302D30312031323A32333A33352E353400000000000000000000000000000000000000000000000000000000
22:22:35                                          	32323A32323A3335000000000000000000000000000000000000000000000000000000000000000000000000000000000000
abc                                               	6162630000000000000000000000000000000000000000000000000000000000000000000000000000000000000000000000
中文                                            	E4B8ADE696870000000000000000000000000000000000000000000000000000000000000000000000000000000000000000
delete
DELETE FROM Z0CASE WHERE T1=1221.34;
Warnings:
Warning	1292	Truncated incorrect DECIMAL value: '123'
Warning	1292	Truncated incorrect DECIMAL value: '%^&*[];//\'
Warning	1292	Truncated incorrect DECIMAL value: 'abc'
Warning	1292	Truncated incorrect DECIMAL value: '中文'
Warning	1292	Truncated incorrect DECIMAL value: '111'
Warning	1292	Truncated incorrect DECIMAL value: '12:31:56'
Warning	1292	Truncated incorrect DECIMAL value: '!*?< >aB12 中文'
Warning	1292	Truncated incorrect DECIMAL value: '-'
Warning	1292	Truncated incorrect DECIMAL value: '2021-10-01 12:23:35.54'
Warning	1292	Truncated incorrect DECIMAL value: '2011-11-01'
Warning	1292	Truncated incorrect DECIMAL value: '22:22:35'
Warning	1292	Truncated incorrect DECIMAL value: '12.345'
DELETE FROM Z0CASE WHERE T1='2021-10-01 12:23:35.54';
DELETE FROM Z0CASE WHERE T1 IS NULL;
DELETE FROM Z0CASE WHERE T1=b'0101101';
SELECT T1,HEX(T1) FROM Z0CASE ORDER BY T1;
T1	HEX(T1)
!*?< >aB12 中文                                 	212A3F3C203E6142313220E4B8ADE69687000000000000000000000000000000000000000000000000000000000000000000
%^&*[];//\                                        	255E262A5B5D3B2F2F5C00000000000000000000000000000000000000000000000000000000000000000000000000000000
-                                                 	2D00000000000000000000000000000000000000000000000000000000000000000000000000000000000000000000000000
111                                               	3131310000000000000000000000000000000000000000000000000000000000000000000000000000000000000000000000
12.345                                            	31322E3334350000000000000000000000000000000000000000000000000000000000000000000000000000000000000000
123                                               	3132330000000000000000000000000000000000000000000000000000000000000000000000000000000000000000000000
12:31:56                                          	31323A33313A3536000000000000000000000000000000000000000000000000000000000000000000000000000000000000
2011-11-01                                        	323031312D31312D303100000000000000000000000000000000000000000000000000000000000000000000000000000000
2021-10-01 12:23:35.54                            	323032312D31302D30312031323A32333A33352E353400000000000000000000000000000000000000000000000000000000
22:22:35                                          	32323A32323A3335000000000000000000000000000000000000000000000000000000000000000000000000000000000000
abc                                               	6162630000000000000000000000000000000000000000000000000000000000000000000000000000000000000000000000
中文                                            	E4B8ADE696870000000000000000000000000000000000000000000000000000000000000000000000000000000000000000
ENUM
DROP TABLE Z0CASE;
CREATE TABLE Z0CASE(T1 ENUM('123','abc','中文','%^&*[];//\\','111','2021-10-01 12:23:35.54','2011-11-01','12.345',b'0101101')) DEFAULT charset= utf8mb4 DEFAULT collate = utf8mb4_general_ci;
INSERT INTO Z0CASE VALUES('123');
INSERT INTO Z0CASE VALUES('%^&*[];//\\');
INSERT INTO Z0CASE VALUES(NULL);
INSERT INTO Z0CASE VALUES('abc');
INSERT INTO Z0CASE VALUES('中文');
SELECT * FROM Z0CASE ORDER BY T1*1;
T1
NULL
123
abc
中文
%^&*[];//\
SELECT table_name,column_type,COLLATION_NAME,CHARACTER_SET_NAME FROM information_schema.columns WHERE table_name='Z0CASE';
table_name	column_type	COLLATION_NAME	CHARACTER_SET_NAME
z0case	enum('123','abc','中文','%^&*[];//\','111','2021-10-01 12:23:35.54','2011-11-01','12.345','-')	utf8mb4_general_ci	utf8mb4
SELECT table_name,table_collation FROM information_schema.tables WHERE table_name='Z0CASE';
table_name	table_collation
z0case	utf8mb4_general_ci
ALTER TABLE Z0CASE CONVERT TO CHARACTER SET 'utf16' COLLATE 'utf16_unicode_ci';
SELECT table_name,table_collation FROM information_schema.tables WHERE table_name='Z0CASE';
table_name	table_collation
z0case	utf16_unicode_ci
SELECT * FROM Z0CASE ORDER BY T1*1;
T1
NULL
123
abc
中文
%^&*[];//\
BIT
DROP TABLE Z0CASE;
CREATE TABLE Z0CASE(T1 BIT(20)) DEFAULT charset= utf8mb4 DEFAULT collate = utf8mb4_general_ci;
INSERT INTO Z0CASE VALUES(b'0101001');
INSERT INTO Z0CASE VALUES(b'111010101010100');
INSERT INTO Z0CASE VALUES(NULL);
SELECT BIN(T1) FROM Z0CASE ORDER BY T1;
BIN(T1)
NULL
101001
111010101010100
SELECT table_name,column_type,COLLATION_NAME,CHARACTER_SET_NAME FROM information_schema.columns WHERE table_name='Z0CASE';
table_name	column_type	COLLATION_NAME	CHARACTER_SET_NAME
z0case	bit(20)	NULL	NULL
SELECT table_name,table_collation FROM information_schema.tables WHERE table_name='Z0CASE';
table_name	table_collation
z0case	utf8mb4_general_ci
ALTER TABLE Z0CASE CONVERT TO CHARACTER SET 'utf16' COLLATE 'utf16_unicode_ci';
SELECT table_name,table_collation FROM information_schema.tables WHERE table_name='Z0CASE';
table_name	table_collation
z0case	utf16_unicode_ci
SELECT BIN(T1) FROM Z0CASE ORDER BY T1;
BIN(T1)
NULL
101001
111010101010100
insert
INSERT INTO Z0CASE VALUES(111);
INSERT INTO Z0CASE VALUES(b'010110100');
INSERT INTO Z0CASE VALUES(12.345);
INSERT INTO Z0CASE VALUES(null);
SELECT BIN(T1) FROM Z0CASE ORDER BY T1;
BIN(T1)
NULL
NULL
1100
101001
1101111
10110100
111010101010100
INSERT INTO Z0CASE VALUES('2001');
INSERT INTO Z0CASE VALUES('!*?< >aB12 中文');
INSERT INTO Z0CASE VALUES('2021-10-01 12:23:35.54');
INSERT INTO Z0CASE VALUES('2011-11-01');
INSERT INTO Z0CASE VALUES('22:22:35');
SELECT table_name,column_type,COLLATION_NAME,CHARACTER_SET_NAME FROM information_schema.columns WHERE table_name='Z0CASE';
table_name	column_type	COLLATION_NAME	CHARACTER_SET_NAME
z0case	bit(20)	NULL	NULL
SELECT table_name,table_collation FROM information_schema.tables WHERE table_name='Z0CASE';
table_name	table_collation
z0case	utf16_unicode_ci
SELECT BIN(T1) FROM Z0CASE ORDER BY T1;
BIN(T1)
NULL
NULL
1100
101001
1101111
10110100
111010101010100
11111111111111111111
11111111111111111111
11111111111111111111
11111111111111111111
11111111111111111111
update
UPDATE Z0CASE SET T1=NULL WHERE T1=b'0101001';
UPDATE Z0CASE SET T1='22:22:35' WHERE T1=b'1101111';
UPDATE Z0CASE SET T1=12.345 WHERE T1=b'111010101010100';
UPDATE Z0CASE SET T1=b'0101101' WHERE T1=b'11111111111111111111';
SELECT table_name,column_type,COLLATION_NAME,CHARACTER_SET_NAME FROM information_schema.columns WHERE table_name='Z0CASE';
table_name	column_type	COLLATION_NAME	CHARACTER_SET_NAME
z0case	bit(20)	NULL	NULL
SELECT table_name,table_collation FROM information_schema.tables WHERE table_name='Z0CASE';
table_name	table_collation
z0case	utf16_unicode_ci
SELECT BIN(T1) FROM Z0CASE ORDER BY T1;
BIN(T1)
NULL
NULL
NULL
1100
1100
101101
101101
101101
101101
101101
101101
10110100
delete
DELETE FROM Z0CASE WHERE T1 IS NULL;
DELETE FROM Z0CASE WHERE T1=b'101101';
SELECT BIN(T1) FROM Z0CASE ORDER BY T1;
BIN(T1)
1100
1100
10110100
INT
DROP TABLE Z0CASE;
CREATE TABLE Z0CASE(T1 INT) DEFAULT charset= utf8mb4 DEFAULT collate = utf8mb4_general_ci;
INSERT INTO Z0CASE VALUES(123);
INSERT INTO Z0CASE VALUES(123.3445);
INSERT INTO Z0CASE VALUES(NULL);
SELECT * FROM Z0CASE ORDER BY T1*1;
T1
NULL
123
123
SELECT table_name,column_type,COLLATION_NAME,CHARACTER_SET_NAME FROM information_schema.columns WHERE table_name='Z0CASE';
table_name	column_type	COLLATION_NAME	CHARACTER_SET_NAME
z0case	int(11)	NULL	NULL
SELECT table_name,table_collation FROM information_schema.tables WHERE table_name='Z0CASE';
table_name	table_collation
z0case	utf8mb4_general_ci
ALTER TABLE Z0CASE CONVERT TO CHARACTER SET 'utf16' COLLATE 'utf16_unicode_ci';
SELECT table_name,table_collation FROM information_schema.tables WHERE table_name='Z0CASE';
table_name	table_collation
z0case	utf16_unicode_ci
SELECT * FROM Z0CASE ORDER BY T1*1;
T1
NULL
123
123
insert
INSERT INTO Z0CASE VALUES(111);
INSERT INTO Z0CASE VALUES('2001');
INSERT INTO Z0CASE VALUES('!*?< >aB12 中文');
INSERT INTO Z0CASE VALUES(b'0101101');
INSERT INTO Z0CASE VALUES('2021-10-01 12:23:35.54');
INSERT INTO Z0CASE VALUES('2011-11-01');
INSERT INTO Z0CASE VALUES('22:22:35');
INSERT INTO Z0CASE VALUES(12.345);
INSERT INTO Z0CASE VALUES(null);
SELECT table_name,column_type,COLLATION_NAME,CHARACTER_SET_NAME FROM information_schema.columns WHERE table_name='Z0CASE';
table_name	column_type	COLLATION_NAME	CHARACTER_SET_NAME
z0case	int(11)	NULL	NULL
SELECT table_name,table_collation FROM information_schema.tables WHERE table_name='Z0CASE';
table_name	table_collation
z0case	utf16_unicode_ci
SELECT * FROM Z0CASE ORDER BY T1*1;
T1
NULL
NULL
0
12
22
45
111
123
123
2001
2011
2021
update
UPDATE Z0CASE SET T1=NULL WHERE T1='111';
UPDATE Z0CASE SET T1='12:31:56' WHERE T1=2011;
UPDATE Z0CASE SET T1=1221.34 WHERE T1=2001;
UPDATE Z0CASE SET T1='Aa1$< >中文' WHERE T1='123';
UPDATE Z0CASE SET T1=b'0101101' WHERE T1=12;
SELECT table_name,column_type,COLLATION_NAME,CHARACTER_SET_NAME FROM information_schema.columns WHERE table_name='Z0CASE';
table_name	column_type	COLLATION_NAME	CHARACTER_SET_NAME
z0case	int(11)	NULL	NULL
SELECT table_name,table_collation FROM information_schema.tables WHERE table_name='Z0CASE';
table_name	table_collation
z0case	utf16_unicode_ci
SELECT * FROM Z0CASE ORDER BY T1*1;
T1
NULL
NULL
NULL
0
0
0
22
45
45
45
1221
2021
delete
DELETE FROM Z0CASE WHERE T1=1221;
DELETE FROM Z0CASE WHERE T1 IS NULL;
SELECT * FROM Z0CASE ORDER BY T1*1;
T1
0
0
0
22
45
45
45
2021
FLOAT
DROP TABLE Z0CASE;
CREATE TABLE Z0CASE(T1 FLOAT(20,0)) DEFAULT charset= utf8mb4 DEFAULT collate = utf8mb4_general_ci;
INSERT INTO Z0CASE VALUES(123);
INSERT INTO Z0CASE VALUES('123.3445');
INSERT INTO Z0CASE VALUES(641231122123.5445);
INSERT INTO Z0CASE VALUES(NULL);
SELECT * FROM Z0CASE ORDER BY T1*1;
T1
NULL
123
123
641231093760
SELECT table_name,column_type,COLLATION_NAME,CHARACTER_SET_NAME FROM information_schema.columns WHERE table_name='Z0CASE';
table_name	column_type	COLLATION_NAME	CHARACTER_SET_NAME
z0case	float(20,0)	NULL	NULL
SELECT table_name,table_collation FROM information_schema.tables WHERE table_name='Z0CASE';
table_name	table_collation
z0case	utf8mb4_general_ci
ALTER TABLE Z0CASE CONVERT TO CHARACTER SET 'utf16' COLLATE 'utf16_unicode_ci';
SELECT table_name,table_collation FROM information_schema.tables WHERE table_name='Z0CASE';
table_name	table_collation
z0case	utf16_unicode_ci
SELECT * FROM Z0CASE ORDER BY T1*1;
T1
NULL
123
123
641231093760
insert
INSERT INTO Z0CASE VALUES(111);
INSERT INTO Z0CASE VALUES('2001');
INSERT INTO Z0CASE VALUES('!*?< >aB12 中文');
Warnings:
Warning	1292	Truncated incorrect DOUBLE value: '!*?< >aB12 中文'
INSERT INTO Z0CASE VALUES(b'0101101');
INSERT INTO Z0CASE VALUES('2021-10-01 12:23:35.54');
Warnings:
Warning	1292	Truncated incorrect DOUBLE value: '2021-10-01 12:23:35.54'
INSERT INTO Z0CASE VALUES('2011-11-01');
Warnings:
Warning	1292	Truncated incorrect DOUBLE value: '2011-11-01'
INSERT INTO Z0CASE VALUES('22:22:35');
Warnings:
Warning	1292	Truncated incorrect DOUBLE value: '22:22:35'
INSERT INTO Z0CASE VALUES(12.3456);
INSERT INTO Z0CASE VALUES(null);
SELECT table_name,column_type,COLLATION_NAME,CHARACTER_SET_NAME FROM information_schema.columns WHERE table_name='Z0CASE';
table_name	column_type	COLLATION_NAME	CHARACTER_SET_NAME
z0case	float(20,0)	NULL	NULL
SELECT table_name,table_collation FROM information_schema.tables WHERE table_name='Z0CASE';
table_name	table_collation
z0case	utf16_unicode_ci
SELECT * FROM Z0CASE ORDER BY T1*1;
T1
NULL
NULL
0
12
22
45
111
123
123
2001
2011
2021
641231093760
update
UPDATE Z0CASE SET T1=NULL WHERE T1='111';
UPDATE Z0CASE SET T1='12:31:56' WHERE T1=2011;
Warnings:
Warning	1292	Truncated incorrect DOUBLE value: '12:31:56'
UPDATE Z0CASE SET T1=1221.34 WHERE T1=2001;
UPDATE Z0CASE SET T1='Aa1$< >中文' WHERE T1 LIKE'12.34%';
UPDATE Z0CASE SET T1=b'0101101' WHERE T1=0;
SELECT table_name,column_type,COLLATION_NAME,CHARACTER_SET_NAME FROM information_schema.columns WHERE table_name='Z0CASE';
table_name	column_type	COLLATION_NAME	CHARACTER_SET_NAME
z0case	float(20,0)	NULL	NULL
SELECT table_name,table_collation FROM information_schema.tables WHERE table_name='Z0CASE';
table_name	table_collation
z0case	utf16_unicode_ci
SELECT * FROM Z0CASE ORDER BY T1*1;
T1
NULL
NULL
NULL
12
12
22
45
45
123
123
1221
2021
641231093760
delete
DELETE FROM Z0CASE WHERE T1 LIKE'1221.34%';
DELETE FROM Z0CASE WHERE T1 IS NULL;
SELECT * FROM Z0CASE ORDER BY T1*1;
T1
12
12
22
45
45
123
123
1221
2021
641231093760
DATE
DROP TABLE Z0CASE;
CREATE TABLE Z0CASE(T1 DATE) DEFAULT charset= utf8mb4 DEFAULT collate = utf8mb4_general_ci;
INSERT INTO Z0CASE VALUES('20210321');
INSERT INTO Z0CASE VALUES('2020-11-21');
INSERT INTO Z0CASE VALUES('2021-01-21 11:58:39.456');
INSERT INTO Z0CASE VALUES(NULL);
SELECT * FROM Z0CASE ORDER BY T1*1;
T1
NULL
2020-11-21
2021-01-21
2021-03-21
SELECT table_name,column_type,COLLATION_NAME,CHARACTER_SET_NAME FROM information_schema.columns WHERE table_name='Z0CASE';
table_name	column_type	COLLATION_NAME	CHARACTER_SET_NAME
z0case	date	NULL	NULL
SELECT table_name,table_collation FROM information_schema.tables WHERE table_name='Z0CASE';
table_name	table_collation
z0case	utf8mb4_general_ci
ALTER TABLE Z0CASE CONVERT TO CHARACTER SET 'utf16' COLLATE 'utf16_unicode_ci';
SELECT table_name,table_collation FROM information_schema.tables WHERE table_name='Z0CASE';
table_name	table_collation
z0case	utf16_unicode_ci
SELECT * FROM Z0CASE ORDER BY T1*1;
T1
NULL
2020-11-21
2021-01-21
2021-03-21
insert
INSERT INTO Z0CASE VALUES(111);
INSERT INTO Z0CASE VALUES('2001');
INSERT INTO Z0CASE VALUES('!*?< >aB12 中文');
INSERT INTO Z0CASE VALUES(b'0101101');
INSERT INTO Z0CASE VALUES('2021-10-01 12:23:35.54');
INSERT INTO Z0CASE VALUES('2011-11-01');
INSERT INTO Z0CASE VALUES('22:22:35');
INSERT INTO Z0CASE VALUES(12.3456);
INSERT INTO Z0CASE VALUES(null);
SELECT table_name,column_type,COLLATION_NAME,CHARACTER_SET_NAME FROM information_schema.columns WHERE table_name='Z0CASE';
table_name	column_type	COLLATION_NAME	CHARACTER_SET_NAME
z0case	date	NULL	NULL
SELECT table_name,table_collation FROM information_schema.tables WHERE table_name='Z0CASE';
table_name	table_collation
z0case	utf16_unicode_ci
SELECT * FROM Z0CASE ORDER BY T1*1;
T1
NULL
NULL
0000-00-00
0000-00-00
0000-00-00
0000-00-00
0000-00-00
2000-01-11
2011-11-01
2020-11-21
2021-01-21
2021-03-21
2021-10-01
update
UPDATE Z0CASE SET T1=NULL WHERE T1='2021-10-01';
UPDATE Z0CASE SET T1='12:31:56' WHERE T1='2021-03-21';
UPDATE Z0CASE SET T1=1221.34 WHERE T1='2021-01-21';
UPDATE Z0CASE SET T1='Aa1$< >中文' WHERE T1='2020-11-21';
UPDATE Z0CASE SET T1=b'0101101' WHERE T1='2011-11-01';
UPDATE Z0CASE SET T1='2011-11-11' WHERE T1='2000-01-11';
UPDATE Z0CASE SET T1='2012-12-21 09:10:21' WHERE T1='0';
SELECT table_name,column_type,COLLATION_NAME,CHARACTER_SET_NAME FROM information_schema.columns WHERE table_name='Z0CASE';
table_name	column_type	COLLATION_NAME	CHARACTER_SET_NAME
z0case	date	NULL	NULL
SELECT table_name,table_collation FROM information_schema.tables WHERE table_name='Z0CASE';
table_name	table_collation
z0case	utf16_unicode_ci
SELECT * FROM Z0CASE ORDER BY T1*1;
T1
NULL
NULL
NULL
2000-12-21
2011-11-11
2012-12-21
2012-12-21
2012-12-21
2012-12-21
2012-12-21
2012-12-21
2012-12-21
2012-12-21
delete
DELETE FROM Z0CASE WHERE T1='2012-12-21';
DELETE FROM Z0CASE WHERE T1 IS NULL;
SELECT * FROM Z0CASE ORDER BY T1*1;
T1
2000-12-21
2011-11-11
TIME
DROP TABLE Z0CASE;
CREATE TABLE Z0CASE(T1 TIME) DEFAULT charset= utf8mb4 DEFAULT collate = utf8mb4_general_ci;
INSERT INTO Z0CASE VALUES('2020-11-21');
INSERT INTO Z0CASE VALUES('2021-01-21 11:58:39.456');
INSERT INTO Z0CASE VALUES('21:28:33.556');
INSERT INTO Z0CASE VALUES('2001');
INSERT INTO Z0CASE VALUES(NULL);
SELECT * FROM Z0CASE ORDER BY T1*1;
T1
NULL
00:20:01
00:20:20
11:58:39
21:28:34
SELECT table_name,column_type,COLLATION_NAME,CHARACTER_SET_NAME FROM information_schema.columns WHERE table_name='Z0CASE';
table_name	column_type	COLLATION_NAME	CHARACTER_SET_NAME
z0case	time	NULL	NULL
SELECT table_name,table_collation FROM information_schema.tables WHERE table_name='Z0CASE';
table_name	table_collation
z0case	utf8mb4_general_ci
ALTER TABLE Z0CASE CONVERT TO CHARACTER SET 'utf16' COLLATE 'utf16_unicode_ci';
SELECT table_name,table_collation FROM information_schema.tables WHERE table_name='Z0CASE';
table_name	table_collation
z0case	utf16_unicode_ci
SELECT * FROM Z0CASE ORDER BY T1*1;
T1
NULL
00:20:01
00:20:20
11:58:39
21:28:34
insert
INSERT INTO Z0CASE VALUES(71);
INSERT INTO Z0CASE VALUES('2001');
INSERT INTO Z0CASE VALUES('!*?< >aB12 中文');
INSERT INTO Z0CASE VALUES(b'0101101');
INSERT INTO Z0CASE VALUES('2021-10-01 12:23:35.54');
INSERT INTO Z0CASE VALUES('2011-11-01');
INSERT INTO Z0CASE VALUES('22:22:35');
INSERT INTO Z0CASE VALUES(72.7476);
INSERT INTO Z0CASE VALUES(null);
SELECT table_name,column_type,COLLATION_NAME,CHARACTER_SET_NAME FROM information_schema.columns WHERE table_name='Z0CASE';
table_name	column_type	COLLATION_NAME	CHARACTER_SET_NAME
z0case	time	NULL	NULL
SELECT table_name,table_collation FROM information_schema.tables WHERE table_name='Z0CASE';
table_name	table_collation
z0case	utf16_unicode_ci
SELECT * FROM Z0CASE ORDER BY T1*1;
T1
NULL
NULL
00:00:00
00:00:00
00:00:00
00:00:00
00:20:01
00:20:01
00:20:11
00:20:20
11:58:39
12:23:36
21:28:34
22:22:35
update
UPDATE Z0CASE SET T1=NULL WHERE T1='22:22:35';
UPDATE Z0CASE SET T1='12:31:56' WHERE T1='21:28:34';
UPDATE Z0CASE SET T1=1221.34 WHERE T1='12:23:36';
UPDATE Z0CASE SET T1='Aa1$< >中文' WHERE T1='11:58:39';
UPDATE Z0CASE SET T1=b'0101101' WHERE T1='00:20:20';
UPDATE Z0CASE SET T1='2011-11-11' WHERE T1='00:20:01';
UPDATE Z0CASE SET T1='2012-12-21 09:10:21' WHERE T1='0';
SELECT table_name,column_type,COLLATION_NAME,CHARACTER_SET_NAME FROM information_schema.columns WHERE table_name='Z0CASE';
table_name	column_type	COLLATION_NAME	CHARACTER_SET_NAME
z0case	time	NULL	NULL
SELECT table_name,table_collation FROM information_schema.tables WHERE table_name='Z0CASE';
table_name	table_collation
z0case	utf16_unicode_ci
SELECT * FROM Z0CASE ORDER BY T1*1;
T1
NULL
NULL
NULL
00:12:21
00:20:11
00:20:11
00:20:11
09:10:21
09:10:21
09:10:21
09:10:21
09:10:21
09:10:21
12:31:56
delete
DELETE FROM Z0CASE WHERE T1='09:10:21';
DELETE FROM Z0CASE WHERE T1 IS NULL;
SELECT * FROM Z0CASE ORDER BY T1*1;
T1
00:12:21
00:20:11
00:20:11
00:20:11
12:31:56
general_list_update  utf8mb4/utf8mb4_general_ci --> gb18030/gb18030_chinese_ci
char
DROP TABLE Z0CASE;
CREATE TABLE Z0CASE(T1 CHAR(50)) DEFAULT charset= utf8mb4 DEFAULT collate = utf8mb4_general_ci;
INSERT INTO Z0CASE VALUES(123);
INSERT INTO Z0CASE VALUES('%^&*[];//\\');
INSERT INTO Z0CASE VALUES(NULL);
INSERT INTO Z0CASE VALUES('abc');
INSERT INTO Z0CASE VALUES('中文');
SELECT * FROM Z0CASE ORDER BY T1*1;
T1
NULL
%^&*[];//\
abc
中文
123
Warnings:
Warning	1292	Truncated incorrect DOUBLE value: '%^&*[];//\'
Warning	1292	Truncated incorrect DOUBLE value: 'abc'
Warning	1292	Truncated incorrect DOUBLE value: '中文'
SELECT table_name,column_type,COLLATION_NAME,CHARACTER_SET_NAME FROM information_schema.columns WHERE table_name='Z0CASE';
table_name	column_type	COLLATION_NAME	CHARACTER_SET_NAME
z0case	char(50)	utf8mb4_general_ci	utf8mb4
SELECT table_name,table_collation FROM information_schema.tables WHERE table_name='Z0CASE';
table_name	table_collation
z0case	utf8mb4_general_ci
ALTER TABLE Z0CASE CONVERT TO CHARACTER SET 'gb18030' COLLATE 'gb18030_chinese_ci';
SELECT table_name,table_collation FROM information_schema.tables WHERE table_name='Z0CASE';
table_name	table_collation
z0case	gb18030_chinese_ci
SELECT * FROM Z0CASE ORDER BY T1*1;
T1
NULL
%^&*[];//\
abc
中文
123
Warnings:
Warning	1292	Truncated incorrect DOUBLE value: '%^&*[];//\'
Warning	1292	Truncated incorrect DOUBLE value: 'abc'
Warning	1292	Truncated incorrect DOUBLE value: '中文'
insert
INSERT INTO Z0CASE VALUES(111);
INSERT INTO Z0CASE VALUES('2001');
INSERT INTO Z0CASE VALUES('!*?< >aB12 中文');
INSERT INTO Z0CASE VALUES(b'0101101');
INSERT INTO Z0CASE VALUES('2021-10-01 12:23:35.54');
INSERT INTO Z0CASE VALUES('2011-11-01');
INSERT INTO Z0CASE VALUES('22:22:35');
INSERT INTO Z0CASE VALUES(12.345);
INSERT INTO Z0CASE VALUES(null);
SELECT table_name,column_type,COLLATION_NAME,CHARACTER_SET_NAME FROM information_schema.columns WHERE table_name='Z0CASE';
table_name	column_type	COLLATION_NAME	CHARACTER_SET_NAME
z0case	char(50)	gb18030_chinese_ci	gb18030
SELECT table_name,table_collation FROM information_schema.tables WHERE table_name='Z0CASE';
table_name	table_collation
z0case	gb18030_chinese_ci
SELECT * FROM Z0CASE ORDER BY T1*1;
T1
NULL
NULL
%^&*[];//\
abc
中文
!*?< >aB12 中文
-
12.345
22:22:35
111
123
2001
2011-11-01
2021-10-01 12:23:35.54
Warnings:
Warning	1292	Truncated incorrect DOUBLE value: '%^&*[];//\'
Warning	1292	Truncated incorrect DOUBLE value: 'abc'
Warning	1292	Truncated incorrect DOUBLE value: '中文'
Warning	1292	Truncated incorrect DOUBLE value: '!*?< >aB12 中文'
Warning	1292	Truncated incorrect DOUBLE value: '-'
Warning	1292	Truncated incorrect DOUBLE value: '2021-10-01 12:23:35.54'
Warning	1292	Truncated incorrect DOUBLE value: '2011-11-01'
Warning	1292	Truncated incorrect DOUBLE value: '22:22:35'
update
UPDATE Z0CASE SET T1=NULL WHERE T1='111';
UPDATE Z0CASE SET T1='12:31:56' WHERE T1=2001;
Warnings:
Warning	1292	Truncated incorrect DECIMAL value: '%^&*[];//\'
Warning	1292	Truncated incorrect DECIMAL value: 'abc'
Warning	1292	Truncated incorrect DECIMAL value: '中文'
Warning	1292	Truncated incorrect DECIMAL value: '!*?< >aB12 中文'
Warning	1292	Truncated incorrect DECIMAL value: '2021-10-01 12:23:35.54'
Warning	1292	Truncated incorrect DECIMAL value: '2011-11-01'
Warning	1292	Truncated incorrect DECIMAL value: '22:22:35'
UPDATE Z0CASE SET T1=1221.34 WHERE T1='2011-11-01';
UPDATE Z0CASE SET T1='Aa1$< >中文' WHERE T1='12.345';
UPDATE Z0CASE SET T1=b'0101101' WHERE T1='abc';
SELECT table_name,column_type,COLLATION_NAME,CHARACTER_SET_NAME FROM information_schema.columns WHERE table_name='Z0CASE';
table_name	column_type	COLLATION_NAME	CHARACTER_SET_NAME
z0case	char(50)	gb18030_chinese_ci	gb18030
SELECT table_name,table_collation FROM information_schema.tables WHERE table_name='Z0CASE';
table_name	table_collation
z0case	gb18030_chinese_ci
SELECT * FROM Z0CASE ORDER BY T1*1;
T1
NULL
NULL
NULL
%^&*[];//\
-
中文
!*?< >aB12 中文
-
Aa1$< >中文
12:31:56
22:22:35
123
1221.34
2021-10-01 12:23:35.54
Warnings:
Warning	1292	Truncated incorrect DOUBLE value: '%^&*[];//\'
Warning	1292	Truncated incorrect DOUBLE value: '-'
Warning	1292	Truncated incorrect DOUBLE value: '中文'
Warning	1292	Truncated incorrect DOUBLE value: '12:31:56'
Warning	1292	Truncated incorrect DOUBLE value: '!*?< >aB12 中文'
Warning	1292	Truncated incorrect DOUBLE value: '-'
Warning	1292	Truncated incorrect DOUBLE value: '2021-10-01 12:23:35.54'
Warning	1292	Truncated incorrect DOUBLE value: '22:22:35'
Warning	1292	Truncated incorrect DOUBLE value: 'Aa1$< >中文'
delete
DELETE FROM Z0CASE WHERE T1=1221.34;
Warnings:
Warning	1292	Truncated incorrect DECIMAL value: '%^&*[];//\'
Warning	1292	Truncated incorrect DECIMAL value: '中文'
Warning	1292	Truncated incorrect DECIMAL value: '12:31:56'
Warning	1292	Truncated incorrect DECIMAL value: '!*?< >aB12 中文'
Warning	1292	Truncated incorrect DECIMAL value: '2021-10-01 12:23:35.54'
Warning	1292	Truncated incorrect DECIMAL value: '22:22:35'
Warning	1292	Truncated incorrect DECIMAL value: 'Aa1$< >中文'
DELETE FROM Z0CASE WHERE T1='2021-10-01 12:23:35.54';
DELETE FROM Z0CASE WHERE T1 IS NULL;
DELETE FROM Z0CASE WHERE T1=b'0101101';
SELECT * FROM Z0CASE ORDER BY T1*1;
T1
%^&*[];//\
中文
!*?< >aB12 中文
Aa1$< >中文
12:31:56
22:22:35
123
Warnings:
Warning	1292	Truncated incorrect DOUBLE value: '%^&*[];//\'
Warning	1292	Truncated incorrect DOUBLE value: '中文'
Warning	1292	Truncated incorrect DOUBLE value: '12:31:56'
Warning	1292	Truncated incorrect DOUBLE value: '!*?< >aB12 中文'
Warning	1292	Truncated incorrect DOUBLE value: '22:22:35'
Warning	1292	Truncated incorrect DOUBLE value: 'Aa1$< >中文'
varchar
DROP TABLE Z0CASE;
CREATE TABLE Z0CASE(T1 VARCHAR(50)) DEFAULT charset= utf8mb4 DEFAULT collate = utf8mb4_general_ci;
INSERT INTO Z0CASE VALUES(123);
INSERT INTO Z0CASE VALUES('%^&*[];//\\');
INSERT INTO Z0CASE VALUES(NULL);
INSERT INTO Z0CASE VALUES('abc');
INSERT INTO Z0CASE VALUES('中文');
SELECT * FROM Z0CASE ORDER BY T1*1;
T1
NULL
%^&*[];//\
abc
中文
123
Warnings:
Warning	1292	Truncated incorrect DOUBLE value: '%^&*[];//\'
Warning	1292	Truncated incorrect DOUBLE value: 'abc'
Warning	1292	Truncated incorrect DOUBLE value: '中文'
SELECT table_name,column_type,COLLATION_NAME,CHARACTER_SET_NAME FROM information_schema.columns WHERE table_name='Z0CASE';
table_name	column_type	COLLATION_NAME	CHARACTER_SET_NAME
z0case	varchar(50)	utf8mb4_general_ci	utf8mb4
SELECT table_name,table_collation FROM information_schema.tables WHERE table_name='Z0CASE';
table_name	table_collation
z0case	utf8mb4_general_ci
ALTER TABLE Z0CASE CONVERT TO CHARACTER SET 'gb18030' COLLATE 'gb18030_chinese_ci';
SELECT table_name,table_collation FROM information_schema.tables WHERE table_name='Z0CASE';
table_name	table_collation
z0case	gb18030_chinese_ci
SELECT * FROM Z0CASE ORDER BY T1*1;
T1
NULL
%^&*[];//\
abc
中文
123
Warnings:
Warning	1292	Truncated incorrect DOUBLE value: '%^&*[];//\'
Warning	1292	Truncated incorrect DOUBLE value: 'abc'
Warning	1292	Truncated incorrect DOUBLE value: '中文'
insert
INSERT INTO Z0CASE VALUES(111);
INSERT INTO Z0CASE VALUES('2001');
INSERT INTO Z0CASE VALUES('!*?< >aB12 中文');
INSERT INTO Z0CASE VALUES(b'0101101');
INSERT INTO Z0CASE VALUES('2021-10-01 12:23:35.54');
INSERT INTO Z0CASE VALUES('2011-11-01');
INSERT INTO Z0CASE VALUES('22:22:35');
INSERT INTO Z0CASE VALUES(12.345);
INSERT INTO Z0CASE VALUES(null);
SELECT table_name,column_type,COLLATION_NAME,CHARACTER_SET_NAME FROM information_schema.columns WHERE table_name='Z0CASE';
table_name	column_type	COLLATION_NAME	CHARACTER_SET_NAME
z0case	varchar(50)	gb18030_chinese_ci	gb18030
SELECT table_name,table_collation FROM information_schema.tables WHERE table_name='Z0CASE';
table_name	table_collation
z0case	gb18030_chinese_ci
SELECT * FROM Z0CASE ORDER BY T1*1;
T1
NULL
NULL
%^&*[];//\
abc
中文
!*?< >aB12 中文
-
12.345
22:22:35
111
123
2001
2011-11-01
2021-10-01 12:23:35.54
Warnings:
Warning	1292	Truncated incorrect DOUBLE value: '%^&*[];//\'
Warning	1292	Truncated incorrect DOUBLE value: 'abc'
Warning	1292	Truncated incorrect DOUBLE value: '中文'
Warning	1292	Truncated incorrect DOUBLE value: '!*?< >aB12 中文'
Warning	1292	Truncated incorrect DOUBLE value: '-'
Warning	1292	Truncated incorrect DOUBLE value: '2021-10-01 12:23:35.54'
Warning	1292	Truncated incorrect DOUBLE value: '2011-11-01'
Warning	1292	Truncated incorrect DOUBLE value: '22:22:35'
update
UPDATE Z0CASE SET T1=NULL WHERE T1='111';
UPDATE Z0CASE SET T1='12:31:56' WHERE T1=2001;
Warnings:
Warning	1292	Truncated incorrect DECIMAL value: '%^&*[];//\'
Warning	1292	Truncated incorrect DECIMAL value: 'abc'
Warning	1292	Truncated incorrect DECIMAL value: '中文'
Warning	1292	Truncated incorrect DECIMAL value: '!*?< >aB12 中文'
Warning	1292	Truncated incorrect DECIMAL value: '2021-10-01 12:23:35.54'
Warning	1292	Truncated incorrect DECIMAL value: '2011-11-01'
Warning	1292	Truncated incorrect DECIMAL value: '22:22:35'
UPDATE Z0CASE SET T1=1221.34 WHERE T1='2011-11-01';
UPDATE Z0CASE SET T1='Aa1$< >中文' WHERE T1='12.345';
UPDATE Z0CASE SET T1=b'0101101' WHERE T1='abc';
SELECT table_name,column_type,COLLATION_NAME,CHARACTER_SET_NAME FROM information_schema.columns WHERE table_name='Z0CASE';
table_name	column_type	COLLATION_NAME	CHARACTER_SET_NAME
z0case	varchar(50)	gb18030_chinese_ci	gb18030
SELECT table_name,table_collation FROM information_schema.tables WHERE table_name='Z0CASE';
table_name	table_collation
z0case	gb18030_chinese_ci
SELECT * FROM Z0CASE ORDER BY T1*1;
T1
NULL
NULL
NULL
%^&*[];//\
-
中文
!*?< >aB12 中文
-
Aa1$< >中文
12:31:56
22:22:35
123
1221.34
2021-10-01 12:23:35.54
Warnings:
Warning	1292	Truncated incorrect DOUBLE value: '%^&*[];//\'
Warning	1292	Truncated incorrect DOUBLE value: '-'
Warning	1292	Truncated incorrect DOUBLE value: '中文'
Warning	1292	Truncated incorrect DOUBLE value: '12:31:56'
Warning	1292	Truncated incorrect DOUBLE value: '!*?< >aB12 中文'
Warning	1292	Truncated incorrect DOUBLE value: '-'
Warning	1292	Truncated incorrect DOUBLE value: '2021-10-01 12:23:35.54'
Warning	1292	Truncated incorrect DOUBLE value: '22:22:35'
Warning	1292	Truncated incorrect DOUBLE value: 'Aa1$< >中文'
delete
DELETE FROM Z0CASE WHERE T1=1221.34;
Warnings:
Warning	1292	Truncated incorrect DECIMAL value: '%^&*[];//\'
Warning	1292	Truncated incorrect DECIMAL value: '中文'
Warning	1292	Truncated incorrect DECIMAL value: '12:31:56'
Warning	1292	Truncated incorrect DECIMAL value: '!*?< >aB12 中文'
Warning	1292	Truncated incorrect DECIMAL value: '2021-10-01 12:23:35.54'
Warning	1292	Truncated incorrect DECIMAL value: '22:22:35'
Warning	1292	Truncated incorrect DECIMAL value: 'Aa1$< >中文'
DELETE FROM Z0CASE WHERE T1='2021-10-01 12:23:35.54';
DELETE FROM Z0CASE WHERE T1 IS NULL;
DELETE FROM Z0CASE WHERE T1=b'0101101';
SELECT * FROM Z0CASE ORDER BY T1*1;
T1
%^&*[];//\
中文
!*?< >aB12 中文
Aa1$< >中文
12:31:56
22:22:35
123
Warnings:
Warning	1292	Truncated incorrect DOUBLE value: '%^&*[];//\'
Warning	1292	Truncated incorrect DOUBLE value: '中文'
Warning	1292	Truncated incorrect DOUBLE value: '12:31:56'
Warning	1292	Truncated incorrect DOUBLE value: '!*?< >aB12 中文'
Warning	1292	Truncated incorrect DOUBLE value: '22:22:35'
Warning	1292	Truncated incorrect DOUBLE value: 'Aa1$< >中文'
TEXT
DROP TABLE Z0CASE;
CREATE TABLE Z0CASE(T1 TEXT) DEFAULT charset= utf8mb4 DEFAULT collate = utf8mb4_general_ci;
INSERT INTO Z0CASE VALUES(123);
INSERT INTO Z0CASE VALUES('%^&*[];//\\');
INSERT INTO Z0CASE VALUES(NULL);
INSERT INTO Z0CASE VALUES('abc');
INSERT INTO Z0CASE VALUES('中文');
SELECT * FROM Z0CASE ORDER BY T1*1;
T1
NULL
%^&*[];//\
abc
中文
123
Warnings:
Warning	1292	Truncated incorrect DOUBLE value: '%^&*[];//\'
Warning	1292	Truncated incorrect DOUBLE value: 'abc'
Warning	1292	Truncated incorrect DOUBLE value: '中文'
SELECT table_name,column_type,COLLATION_NAME,CHARACTER_SET_NAME FROM information_schema.columns WHERE table_name='Z0CASE';
table_name	column_type	COLLATION_NAME	CHARACTER_SET_NAME
z0case	text	utf8mb4_general_ci	utf8mb4
SELECT table_name,table_collation FROM information_schema.tables WHERE table_name='Z0CASE';
table_name	table_collation
z0case	utf8mb4_general_ci
ALTER TABLE Z0CASE CONVERT TO CHARACTER SET 'gb18030' COLLATE 'gb18030_chinese_ci';
SELECT table_name,table_collation FROM information_schema.tables WHERE table_name='Z0CASE';
table_name	table_collation
z0case	gb18030_chinese_ci
SELECT * FROM Z0CASE ORDER BY T1*1;
T1
NULL
%^&*[];//\
abc
中文
123
Warnings:
Warning	1292	Truncated incorrect DOUBLE value: '%^&*[];//\'
Warning	1292	Truncated incorrect DOUBLE value: 'abc'
Warning	1292	Truncated incorrect DOUBLE value: '中文'
insert
INSERT INTO Z0CASE VALUES(111);
INSERT INTO Z0CASE VALUES('2001');
INSERT INTO Z0CASE VALUES('!*?< >aB12 中文');
INSERT INTO Z0CASE VALUES(b'0101101');
INSERT INTO Z0CASE VALUES('2021-10-01 12:23:35.54');
INSERT INTO Z0CASE VALUES('2011-11-01');
INSERT INTO Z0CASE VALUES('22:22:35');
INSERT INTO Z0CASE VALUES(12.345);
INSERT INTO Z0CASE VALUES(null);
SELECT table_name,column_type,COLLATION_NAME,CHARACTER_SET_NAME FROM information_schema.columns WHERE table_name='Z0CASE';
table_name	column_type	COLLATION_NAME	CHARACTER_SET_NAME
z0case	text	gb18030_chinese_ci	gb18030
SELECT table_name,table_collation FROM information_schema.tables WHERE table_name='Z0CASE';
table_name	table_collation
z0case	gb18030_chinese_ci
SELECT * FROM Z0CASE ORDER BY T1*1;
T1
NULL
NULL
%^&*[];//\
abc
中文
!*?< >aB12 中文
-
12.345
22:22:35
111
123
2001
2011-11-01
2021-10-01 12:23:35.54
Warnings:
Warning	1292	Truncated incorrect DOUBLE value: '%^&*[];//\'
Warning	1292	Truncated incorrect DOUBLE value: 'abc'
Warning	1292	Truncated incorrect DOUBLE value: '中文'
Warning	1292	Truncated incorrect DOUBLE value: '!*?< >aB12 中文'
Warning	1292	Truncated incorrect DOUBLE value: '-'
Warning	1292	Truncated incorrect DOUBLE value: '2021-10-01 12:23:35.54'
Warning	1292	Truncated incorrect DOUBLE value: '2011-11-01'
Warning	1292	Truncated incorrect DOUBLE value: '22:22:35'
update
UPDATE Z0CASE SET T1=NULL WHERE T1='111';
UPDATE Z0CASE SET T1='12:31:56' WHERE T1=2001;
Warnings:
Warning	1292	Truncated incorrect DECIMAL value: '%^&*[];//\'
Warning	1292	Truncated incorrect DECIMAL value: 'abc'
Warning	1292	Truncated incorrect DECIMAL value: '中文'
Warning	1292	Truncated incorrect DECIMAL value: '!*?< >aB12 中文'
Warning	1292	Truncated incorrect DECIMAL value: '2021-10-01 12:23:35.54'
Warning	1292	Truncated incorrect DECIMAL value: '2011-11-01'
Warning	1292	Truncated incorrect DECIMAL value: '22:22:35'
UPDATE Z0CASE SET T1=1221.34 WHERE T1='2011-11-01';
UPDATE Z0CASE SET T1='Aa1$< >中文' WHERE T1='12.345';
UPDATE Z0CASE SET T1=b'0101101' WHERE T1='abc';
SELECT table_name,column_type,COLLATION_NAME,CHARACTER_SET_NAME FROM information_schema.columns WHERE table_name='Z0CASE';
table_name	column_type	COLLATION_NAME	CHARACTER_SET_NAME
z0case	text	gb18030_chinese_ci	gb18030
SELECT table_name,table_collation FROM information_schema.tables WHERE table_name='Z0CASE';
table_name	table_collation
z0case	gb18030_chinese_ci
SELECT * FROM Z0CASE ORDER BY T1*1;
T1
NULL
NULL
NULL
%^&*[];//\
-
中文
!*?< >aB12 中文
-
Aa1$< >中文
12:31:56
22:22:35
123
1221.34
2021-10-01 12:23:35.54
Warnings:
Warning	1292	Truncated incorrect DOUBLE value: '%^&*[];//\'
Warning	1292	Truncated incorrect DOUBLE value: '-'
Warning	1292	Truncated incorrect DOUBLE value: '中文'
Warning	1292	Truncated incorrect DOUBLE value: '12:31:56'
Warning	1292	Truncated incorrect DOUBLE value: '!*?< >aB12 中文'
Warning	1292	Truncated incorrect DOUBLE value: '-'
Warning	1292	Truncated incorrect DOUBLE value: '2021-10-01 12:23:35.54'
Warning	1292	Truncated incorrect DOUBLE value: '22:22:35'
Warning	1292	Truncated incorrect DOUBLE value: 'Aa1$< >中文'
delete
DELETE FROM Z0CASE WHERE T1=1221.34;
Warnings:
Warning	1292	Truncated incorrect DECIMAL value: '%^&*[];//\'
Warning	1292	Truncated incorrect DECIMAL value: '-'
Warning	1292	Truncated incorrect DECIMAL value: '中文'
Warning	1292	Truncated incorrect DECIMAL value: '12:31:56'
Warning	1292	Truncated incorrect DECIMAL value: '!*?< >aB12 中文'
Warning	1292	Truncated incorrect DECIMAL value: '-'
Warning	1292	Truncated incorrect DECIMAL value: '2021-10-01 12:23:35.54'
Warning	1292	Truncated incorrect DECIMAL value: '22:22:35'
Warning	1292	Truncated incorrect DECIMAL value: 'Aa1$< >中文'
DELETE FROM Z0CASE WHERE T1='2021-10-01 12:23:35.54';
DELETE FROM Z0CASE WHERE T1 IS NULL;
DELETE FROM Z0CASE WHERE T1=b'0101101';
SELECT * FROM Z0CASE ORDER BY T1*1;
T1
%^&*[];//\
中文
!*?< >aB12 中文
Aa1$< >中文
12:31:56
22:22:35
123
Warnings:
Warning	1292	Truncated incorrect DOUBLE value: '%^&*[];//\'
Warning	1292	Truncated incorrect DOUBLE value: '中文'
Warning	1292	Truncated incorrect DOUBLE value: '12:31:56'
Warning	1292	Truncated incorrect DOUBLE value: '!*?< >aB12 中文'
Warning	1292	Truncated incorrect DOUBLE value: '22:22:35'
Warning	1292	Truncated incorrect DOUBLE value: 'Aa1$< >中文'
LONGTEXT
DROP TABLE Z0CASE;
CREATE TABLE Z0CASE(T1 LONGTEXT) DEFAULT charset= utf8mb4 DEFAULT collate = utf8mb4_general_ci;
INSERT INTO Z0CASE VALUES(123);
INSERT INTO Z0CASE VALUES('%^&*[];//\\');
INSERT INTO Z0CASE VALUES(NULL);
INSERT INTO Z0CASE VALUES('abc');
INSERT INTO Z0CASE VALUES('中文');
SELECT * FROM Z0CASE ORDER BY T1*1;
T1
NULL
%^&*[];//\
abc
中文
123
Warnings:
Warning	1292	Truncated incorrect DOUBLE value: '%^&*[];//\'
Warning	1292	Truncated incorrect DOUBLE value: 'abc'
Warning	1292	Truncated incorrect DOUBLE value: '中文'
SELECT table_name,column_type,COLLATION_NAME,CHARACTER_SET_NAME FROM information_schema.columns WHERE table_name='Z0CASE';
table_name	column_type	COLLATION_NAME	CHARACTER_SET_NAME
z0case	longtext	utf8mb4_general_ci	utf8mb4
SELECT table_name,table_collation FROM information_schema.tables WHERE table_name='Z0CASE';
table_name	table_collation
z0case	utf8mb4_general_ci
ALTER TABLE Z0CASE CONVERT TO CHARACTER SET 'gb18030' COLLATE 'gb18030_chinese_ci';
SELECT table_name,table_collation FROM information_schema.tables WHERE table_name='Z0CASE';
table_name	table_collation
z0case	gb18030_chinese_ci
SELECT * FROM Z0CASE ORDER BY T1*1;
T1
NULL
%^&*[];//\
abc
中文
123
Warnings:
Warning	1292	Truncated incorrect DOUBLE value: '%^&*[];//\'
Warning	1292	Truncated incorrect DOUBLE value: 'abc'
Warning	1292	Truncated incorrect DOUBLE value: '中文'
insert
INSERT INTO Z0CASE VALUES(111);
INSERT INTO Z0CASE VALUES('2001');
INSERT INTO Z0CASE VALUES('!*?< >aB12 中文');
INSERT INTO Z0CASE VALUES(b'0101101');
INSERT INTO Z0CASE VALUES('2021-10-01 12:23:35.54');
INSERT INTO Z0CASE VALUES('2011-11-01');
INSERT INTO Z0CASE VALUES('22:22:35');
INSERT INTO Z0CASE VALUES(12.345);
INSERT INTO Z0CASE VALUES(null);
SELECT table_name,column_type,COLLATION_NAME,CHARACTER_SET_NAME FROM information_schema.columns WHERE table_name='Z0CASE';
table_name	column_type	COLLATION_NAME	CHARACTER_SET_NAME
z0case	longtext	gb18030_chinese_ci	gb18030
SELECT table_name,table_collation FROM information_schema.tables WHERE table_name='Z0CASE';
table_name	table_collation
z0case	gb18030_chinese_ci
SELECT * FROM Z0CASE ORDER BY T1*1;
T1
NULL
NULL
%^&*[];//\
abc
中文
!*?< >aB12 中文
-
12.345
22:22:35
111
123
2001
2011-11-01
2021-10-01 12:23:35.54
Warnings:
Warning	1292	Truncated incorrect DOUBLE value: '%^&*[];//\'
Warning	1292	Truncated incorrect DOUBLE value: 'abc'
Warning	1292	Truncated incorrect DOUBLE value: '中文'
Warning	1292	Truncated incorrect DOUBLE value: '!*?< >aB12 中文'
Warning	1292	Truncated incorrect DOUBLE value: '-'
Warning	1292	Truncated incorrect DOUBLE value: '2021-10-01 12:23:35.54'
Warning	1292	Truncated incorrect DOUBLE value: '2011-11-01'
Warning	1292	Truncated incorrect DOUBLE value: '22:22:35'
update
UPDATE Z0CASE SET T1=NULL WHERE T1='111';
UPDATE Z0CASE SET T1='12:31:56' WHERE T1=2001;
Warnings:
Warning	1292	Truncated incorrect DECIMAL value: '%^&*[];//\'
Warning	1292	Truncated incorrect DECIMAL value: 'abc'
Warning	1292	Truncated incorrect DECIMAL value: '中文'
Warning	1292	Truncated incorrect DECIMAL value: '!*?< >aB12 中文'
Warning	1292	Truncated incorrect DECIMAL value: '2021-10-01 12:23:35.54'
Warning	1292	Truncated incorrect DECIMAL value: '2011-11-01'
Warning	1292	Truncated incorrect DECIMAL value: '22:22:35'
UPDATE Z0CASE SET T1=1221.34 WHERE T1='2011-11-01';
UPDATE Z0CASE SET T1='Aa1$< >中文' WHERE T1='12.345';
UPDATE Z0CASE SET T1=b'0101101' WHERE T1='abc';
SELECT table_name,column_type,COLLATION_NAME,CHARACTER_SET_NAME FROM information_schema.columns WHERE table_name='Z0CASE';
table_name	column_type	COLLATION_NAME	CHARACTER_SET_NAME
z0case	longtext	gb18030_chinese_ci	gb18030
SELECT table_name,table_collation FROM information_schema.tables WHERE table_name='Z0CASE';
table_name	table_collation
z0case	gb18030_chinese_ci
SELECT * FROM Z0CASE ORDER BY T1*1;
T1
NULL
NULL
NULL
%^&*[];//\
-
中文
!*?< >aB12 中文
-
Aa1$< >中文
12:31:56
22:22:35
123
1221.34
2021-10-01 12:23:35.54
Warnings:
Warning	1292	Truncated incorrect DOUBLE value: '%^&*[];//\'
Warning	1292	Truncated incorrect DOUBLE value: '-'
Warning	1292	Truncated incorrect DOUBLE value: '中文'
Warning	1292	Truncated incorrect DOUBLE value: '12:31:56'
Warning	1292	Truncated incorrect DOUBLE value: '!*?< >aB12 中文'
Warning	1292	Truncated incorrect DOUBLE value: '-'
Warning	1292	Truncated incorrect DOUBLE value: '2021-10-01 12:23:35.54'
Warning	1292	Truncated incorrect DOUBLE value: '22:22:35'
Warning	1292	Truncated incorrect DOUBLE value: 'Aa1$< >中文'
delete
DELETE FROM Z0CASE WHERE T1=1221.34;
Warnings:
Warning	1292	Truncated incorrect DECIMAL value: '%^&*[];//\'
Warning	1292	Truncated incorrect DECIMAL value: '-'
Warning	1292	Truncated incorrect DECIMAL value: '中文'
Warning	1292	Truncated incorrect DECIMAL value: '12:31:56'
Warning	1292	Truncated incorrect DECIMAL value: '!*?< >aB12 中文'
Warning	1292	Truncated incorrect DECIMAL value: '-'
Warning	1292	Truncated incorrect DECIMAL value: '2021-10-01 12:23:35.54'
Warning	1292	Truncated incorrect DECIMAL value: '22:22:35'
Warning	1292	Truncated incorrect DECIMAL value: 'Aa1$< >中文'
DELETE FROM Z0CASE WHERE T1='2021-10-01 12:23:35.54';
DELETE FROM Z0CASE WHERE T1 IS NULL;
DELETE FROM Z0CASE WHERE T1=b'0101101';
SELECT * FROM Z0CASE ORDER BY T1*1;
T1
%^&*[];//\
中文
!*?< >aB12 中文
Aa1$< >中文
12:31:56
22:22:35
123
Warnings:
Warning	1292	Truncated incorrect DOUBLE value: '%^&*[];//\'
Warning	1292	Truncated incorrect DOUBLE value: '中文'
Warning	1292	Truncated incorrect DOUBLE value: '12:31:56'
Warning	1292	Truncated incorrect DOUBLE value: '!*?< >aB12 中文'
Warning	1292	Truncated incorrect DOUBLE value: '22:22:35'
Warning	1292	Truncated incorrect DOUBLE value: 'Aa1$< >中文'
BLOB
DROP TABLE Z0CASE;
CREATE TABLE Z0CASE(T1 BLOB) DEFAULT charset= utf8mb4 DEFAULT collate = utf8mb4_general_ci;
INSERT INTO Z0CASE VALUES(123);
INSERT INTO Z0CASE VALUES('%^&*[];//\\');
INSERT INTO Z0CASE VALUES(NULL);
INSERT INTO Z0CASE VALUES('abc');
INSERT INTO Z0CASE VALUES('中文');
SELECT * FROM Z0CASE ORDER BY T1*1;
T1
NULL
%^&*[];//\
abc
中文
123
Warnings:
Warning	1292	Truncated incorrect DOUBLE value: '%^&*[];//\'
Warning	1292	Truncated incorrect DOUBLE value: 'abc'
Warning	1292	Truncated incorrect DOUBLE value: '中文'
SELECT table_name,column_type,COLLATION_NAME,CHARACTER_SET_NAME FROM information_schema.columns WHERE table_name='Z0CASE';
table_name	column_type	COLLATION_NAME	CHARACTER_SET_NAME
z0case	blob	NULL	NULL
SELECT table_name,table_collation FROM information_schema.tables WHERE table_name='Z0CASE';
table_name	table_collation
z0case	utf8mb4_general_ci
ALTER TABLE Z0CASE CONVERT TO CHARACTER SET 'gb18030' COLLATE 'gb18030_chinese_ci';
SELECT table_name,table_collation FROM information_schema.tables WHERE table_name='Z0CASE';
table_name	table_collation
z0case	gb18030_chinese_ci
SELECT T1,HEX(T1) FROM Z0CASE ORDER BY T1*1;
insert
INSERT INTO Z0CASE VALUES(111);
INSERT INTO Z0CASE VALUES('2001');
INSERT INTO Z0CASE VALUES('!*?< >aB12 中文');
INSERT INTO Z0CASE VALUES(b'0101101');
INSERT INTO Z0CASE VALUES('2021-10-01 12:23:35.54');
INSERT INTO Z0CASE VALUES('2011-11-01');
INSERT INTO Z0CASE VALUES('22:22:35');
INSERT INTO Z0CASE VALUES(12.345);
INSERT INTO Z0CASE VALUES(null);
SELECT table_name,column_type,COLLATION_NAME,CHARACTER_SET_NAME FROM information_schema.columns WHERE table_name='Z0CASE';
table_name	column_type	COLLATION_NAME	CHARACTER_SET_NAME
z0case	blob	NULL	NULL
SELECT table_name,table_collation FROM information_schema.tables WHERE table_name='Z0CASE';
table_name	table_collation
z0case	gb18030_chinese_ci
SELECT T1,HEX(T1) FROM Z0CASE ORDER BY T1*1;
update
UPDATE Z0CASE SET T1=NULL WHERE T1='111';
UPDATE Z0CASE SET T1='12:31:56' WHERE T1=2001;
Warnings:
Warning	1292	Truncated incorrect DECIMAL value: '%^&*[];//\'
Warning	1292	Truncated incorrect DECIMAL value: 'abc'
Warning	1292	Truncated incorrect DECIMAL value: '中文'
Warning	1292	Truncated incorrect DECIMAL value: '!*?< >aB12 中文'
Warning	1292	Truncated incorrect DECIMAL value: '2021-10-01 12:23:35.54'
Warning	1292	Truncated incorrect DECIMAL value: '2011-11-01'
Warning	1292	Truncated incorrect DECIMAL value: '22:22:35'
UPDATE Z0CASE SET T1=1221.34 WHERE T1='2011-11-01';
UPDATE Z0CASE SET T1='Aa1$< >中文' WHERE T1='12.345';
UPDATE Z0CASE SET T1=b'0101101' WHERE T1='abc';
SELECT table_name,column_type,COLLATION_NAME,CHARACTER_SET_NAME FROM information_schema.columns WHERE table_name='Z0CASE';
table_name	column_type	COLLATION_NAME	CHARACTER_SET_NAME
z0case	blob	NULL	NULL
SELECT table_name,table_collation FROM information_schema.tables WHERE table_name='Z0CASE';
table_name	table_collation
z0case	gb18030_chinese_ci
SELECT T1,HEX(T1) FROM Z0CASE ORDER BY T1*1;
delete
DELETE FROM Z0CASE WHERE T1=1221.34;
Warnings:
Warning	1292	Truncated incorrect DECIMAL value: '%^&*[];//\'
Warning	1292	Truncated incorrect DECIMAL value: '-'
Warning	1292	Truncated incorrect DECIMAL value: '中文'
Warning	1292	Truncated incorrect DECIMAL value: '12:31:56'
Warning	1292	Truncated incorrect DECIMAL value: '!*?< >aB12 中文'
Warning	1292	Truncated incorrect DECIMAL value: '-'
Warning	1292	Truncated incorrect DECIMAL value: '2021-10-01 12:23:35.54'
Warning	1292	Truncated incorrect DECIMAL value: '22:22:35'
Warning	1292	Truncated incorrect DECIMAL value: 'Aa1$< >中文'
DELETE FROM Z0CASE WHERE T1='2021-10-01 12:23:35.54';
DELETE FROM Z0CASE WHERE T1 IS NULL;
DELETE FROM Z0CASE WHERE T1=b'0101101';
SELECT T1,HEX(T1) FROM Z0CASE ORDER BY T1*1;
BINARY
DROP TABLE Z0CASE;
CREATE TABLE Z0CASE(T1 BINARY(50)) DEFAULT charset= utf8mb4 DEFAULT collate = utf8mb4_general_ci;
INSERT INTO Z0CASE VALUES(123);
INSERT INTO Z0CASE VALUES('%^&*[];//\\');
INSERT INTO Z0CASE VALUES(NULL);
INSERT INTO Z0CASE VALUES('abc');
INSERT INTO Z0CASE VALUES('中文');
SELECT * FROM Z0CASE ORDER BY T1*1;
T1
NULL
%^&*[];//\                                        
abc                                               
中文                                            
123                                               
Warnings:
Warning	1292	Truncated incorrect DOUBLE value: '123'
Warning	1292	Truncated incorrect DOUBLE value: '%^&*[];//\'
Warning	1292	Truncated incorrect DOUBLE value: 'abc'
Warning	1292	Truncated incorrect DOUBLE value: '中文'
SELECT table_name,column_type,COLLATION_NAME,CHARACTER_SET_NAME FROM information_schema.columns WHERE table_name='Z0CASE';
table_name	column_type	COLLATION_NAME	CHARACTER_SET_NAME
z0case	binary(50)	NULL	NULL
SELECT table_name,table_collation FROM information_schema.tables WHERE table_name='Z0CASE';
table_name	table_collation
z0case	utf8mb4_general_ci
ALTER TABLE Z0CASE CONVERT TO CHARACTER SET 'gb18030' COLLATE 'gb18030_chinese_ci';
SELECT table_name,table_collation FROM information_schema.tables WHERE table_name='Z0CASE';
table_name	table_collation
z0case	gb18030_chinese_ci
SELECT T1,HEX(T1) FROM Z0CASE ORDER BY T1*1;
insert
INSERT INTO Z0CASE VALUES(111);
INSERT INTO Z0CASE VALUES('2001');
INSERT INTO Z0CASE VALUES('!*?< >aB12 中文');
INSERT INTO Z0CASE VALUES(b'0101101');
INSERT INTO Z0CASE VALUES('2021-10-01 12:23:35.54');
INSERT INTO Z0CASE VALUES('2011-11-01');
INSERT INTO Z0CASE VALUES('22:22:35');
INSERT INTO Z0CASE VALUES(12.345);
INSERT INTO Z0CASE VALUES(null);
SELECT table_name,column_type,COLLATION_NAME,CHARACTER_SET_NAME FROM information_schema.columns WHERE table_name='Z0CASE';
table_name	column_type	COLLATION_NAME	CHARACTER_SET_NAME
z0case	binary(50)	NULL	NULL
SELECT table_name,table_collation FROM information_schema.tables WHERE table_name='Z0CASE';
table_name	table_collation
z0case	gb18030_chinese_ci
SELECT T1,HEX(T1) FROM Z0CASE ORDER BY T1*1;
update
UPDATE Z0CASE SET T1=NULL WHERE T1='111';
UPDATE Z0CASE SET T1='12:31:56' WHERE T1=2001;
Warnings:
Warning	1292	Truncated incorrect DECIMAL value: '123'
Warning	1292	Truncated incorrect DECIMAL value: '%^&*[];//\'
Warning	1292	Truncated incorrect DECIMAL value: 'abc'
Warning	1292	Truncated incorrect DECIMAL value: '中文'
Warning	1292	Truncated incorrect DECIMAL value: '111'
Warning	1292	Truncated incorrect DECIMAL value: '2001'
Warning	1292	Truncated incorrect DECIMAL value: '!*?< >aB12 中文'
Warning	1292	Truncated incorrect DECIMAL value: '-'
Warning	1292	Truncated incorrect DECIMAL value: '2021-10-01 12:23:35.54'
Warning	1292	Truncated incorrect DECIMAL value: '2011-11-01'
Warning	1292	Truncated incorrect DECIMAL value: '22:22:35'
Warning	1292	Truncated incorrect DECIMAL value: '12.345'
UPDATE Z0CASE SET T1=1221.34 WHERE T1='2011-11-01';
UPDATE Z0CASE SET T1='Aa1$< >中文' WHERE T1='12.345';
UPDATE Z0CASE SET T1=b'0101101' WHERE T1='abc';
SELECT table_name,column_type,COLLATION_NAME,CHARACTER_SET_NAME FROM information_schema.columns WHERE table_name='Z0CASE';
table_name	column_type	COLLATION_NAME	CHARACTER_SET_NAME
z0case	binary(50)	NULL	NULL
SELECT table_name,table_collation FROM information_schema.tables WHERE table_name='Z0CASE';
table_name	table_collation
z0case	gb18030_chinese_ci
SELECT T1,HEX(T1) FROM Z0CASE ORDER BY T1*1;
delete
DELETE FROM Z0CASE WHERE T1=1221.34;
Warnings:
Warning	1292	Truncated incorrect DECIMAL value: '123'
Warning	1292	Truncated incorrect DECIMAL value: '%^&*[];//\'
Warning	1292	Truncated incorrect DECIMAL value: 'abc'
Warning	1292	Truncated incorrect DECIMAL value: '中文'
Warning	1292	Truncated incorrect DECIMAL value: '111'
Warning	1292	Truncated incorrect DECIMAL value: '12:31:56'
Warning	1292	Truncated incorrect DECIMAL value: '!*?< >aB12 中文'
Warning	1292	Truncated incorrect DECIMAL value: '-'
Warning	1292	Truncated incorrect DECIMAL value: '2021-10-01 12:23:35.54'
Warning	1292	Truncated incorrect DECIMAL value: '2011-11-01'
Warning	1292	Truncated incorrect DECIMAL value: '22:22:35'
Warning	1292	Truncated incorrect DECIMAL value: '12.345'
DELETE FROM Z0CASE WHERE T1='2021-10-01 12:23:35.54';
DELETE FROM Z0CASE WHERE T1 IS NULL;
DELETE FROM Z0CASE WHERE T1=b'0101101';
SELECT T1,HEX(T1) FROM Z0CASE ORDER BY T1*1;
ENUM
DROP TABLE Z0CASE;
CREATE TABLE Z0CASE(T1 ENUM('123','abc','中文','%^&*[];//\\','111','2021-10-01 12:23:35.54','2011-11-01','12.345',b'0101101')) DEFAULT charset= utf8mb4 DEFAULT collate = utf8mb4_general_ci;
INSERT INTO Z0CASE VALUES('123');
INSERT INTO Z0CASE VALUES('%^&*[];//\\');
INSERT INTO Z0CASE VALUES(NULL);
INSERT INTO Z0CASE VALUES('abc');
INSERT INTO Z0CASE VALUES('中文');
SELECT * FROM Z0CASE ORDER BY T1*1;
T1
NULL
123
abc
中文
%^&*[];//\
SELECT table_name,column_type,COLLATION_NAME,CHARACTER_SET_NAME FROM information_schema.columns WHERE table_name='Z0CASE';
table_name	column_type	COLLATION_NAME	CHARACTER_SET_NAME
z0case	enum('123','abc','中文','%^&*[];//\','111','2021-10-01 12:23:35.54','2011-11-01','12.345','-')	utf8mb4_general_ci	utf8mb4
SELECT table_name,table_collation FROM information_schema.tables WHERE table_name='Z0CASE';
table_name	table_collation
z0case	utf8mb4_general_ci
ALTER TABLE Z0CASE CONVERT TO CHARACTER SET 'gb18030' COLLATE 'gb18030_chinese_ci';
SELECT table_name,table_collation FROM information_schema.tables WHERE table_name='Z0CASE';
table_name	table_collation
z0case	gb18030_chinese_ci
SELECT * FROM Z0CASE ORDER BY T1*1;
T1
NULL
123
abc
中文
%^&*[];//\
BIT
DROP TABLE Z0CASE;
CREATE TABLE Z0CASE(T1 BIT(20)) DEFAULT charset= utf8mb4 DEFAULT collate = utf8mb4_general_ci;
INSERT INTO Z0CASE VALUES(b'0101001');
INSERT INTO Z0CASE VALUES(b'111010101010100');
INSERT INTO Z0CASE VALUES(NULL);
SELECT BIN(T1) FROM Z0CASE ORDER BY T1;
BIN(T1)
NULL
101001
111010101010100
SELECT table_name,column_type,COLLATION_NAME,CHARACTER_SET_NAME FROM information_schema.columns WHERE table_name='Z0CASE';
table_name	column_type	COLLATION_NAME	CHARACTER_SET_NAME
z0case	bit(20)	NULL	NULL
SELECT table_name,table_collation FROM information_schema.tables WHERE table_name='Z0CASE';
table_name	table_collation
z0case	utf8mb4_general_ci
ALTER TABLE Z0CASE CONVERT TO CHARACTER SET 'gb18030' COLLATE 'gb18030_chinese_ci';
SELECT table_name,table_collation FROM information_schema.tables WHERE table_name='Z0CASE';
table_name	table_collation
z0case	gb18030_chinese_ci
SELECT BIN(T1) FROM Z0CASE ORDER BY T1;
BIN(T1)
NULL
101001
111010101010100
insert
INSERT INTO Z0CASE VALUES(111);
INSERT INTO Z0CASE VALUES(b'010110100');
INSERT INTO Z0CASE VALUES(12.345);
INSERT INTO Z0CASE VALUES(null);
INSERT INTO Z0CASE VALUES('2001');
INSERT INTO Z0CASE VALUES('!*?< >aB12 中文');
INSERT INTO Z0CASE VALUES('2021-10-01 12:23:35.54');
INSERT INTO Z0CASE VALUES('2011-11-01');
INSERT INTO Z0CASE VALUES('22:22:35');
SELECT table_name,column_type,COLLATION_NAME,CHARACTER_SET_NAME FROM information_schema.columns WHERE table_name='Z0CASE';
table_name	column_type	COLLATION_NAME	CHARACTER_SET_NAME
z0case	bit(20)	NULL	NULL
SELECT table_name,table_collation FROM information_schema.tables WHERE table_name='Z0CASE';
table_name	table_collation
z0case	gb18030_chinese_ci
SELECT BIN(T1) FROM Z0CASE ORDER BY T1;
BIN(T1)
NULL
NULL
1100
101001
1101111
10110100
111010101010100
11111111111111111111
11111111111111111111
11111111111111111111
11111111111111111111
11111111111111111111
update
UPDATE Z0CASE SET T1=NULL WHERE T1=b'0101001';
UPDATE Z0CASE SET T1='22:22:35' WHERE T1=b'1101111';
UPDATE Z0CASE SET T1=12.345 WHERE T1=b'111010101010100';
UPDATE Z0CASE SET T1=b'0101101' WHERE T1=b'11111111111111111111';
SELECT table_name,column_type,COLLATION_NAME,CHARACTER_SET_NAME FROM information_schema.columns WHERE table_name='Z0CASE';
table_name	column_type	COLLATION_NAME	CHARACTER_SET_NAME
z0case	bit(20)	NULL	NULL
SELECT table_name,table_collation FROM information_schema.tables WHERE table_name='Z0CASE';
table_name	table_collation
z0case	gb18030_chinese_ci
SELECT BIN(T1) FROM Z0CASE ORDER BY T1;
BIN(T1)
NULL
NULL
NULL
1100
1100
101101
101101
101101
101101
101101
101101
10110100
delete
DELETE FROM Z0CASE WHERE T1 IS NULL;
DELETE FROM Z0CASE WHERE T1=b'101101';
SELECT BIN(T1) FROM Z0CASE ORDER BY T1;
BIN(T1)
1100
1100
10110100
INT
DROP TABLE Z0CASE;
CREATE TABLE Z0CASE(T1 INT) DEFAULT charset= utf8mb4 DEFAULT collate = utf8mb4_general_ci;
INSERT INTO Z0CASE VALUES(123);
INSERT INTO Z0CASE VALUES(123.3445);
INSERT INTO Z0CASE VALUES(NULL);
SELECT * FROM Z0CASE ORDER BY T1*1;
T1
NULL
123
123
SELECT table_name,column_type,COLLATION_NAME,CHARACTER_SET_NAME FROM information_schema.columns WHERE table_name='Z0CASE';
table_name	column_type	COLLATION_NAME	CHARACTER_SET_NAME
z0case	int(11)	NULL	NULL
SELECT table_name,table_collation FROM information_schema.tables WHERE table_name='Z0CASE';
table_name	table_collation
z0case	utf8mb4_general_ci
ALTER TABLE Z0CASE CONVERT TO CHARACTER SET 'gb18030' COLLATE 'gb18030_chinese_ci';
SELECT table_name,table_collation FROM information_schema.tables WHERE table_name='Z0CASE';
table_name	table_collation
z0case	gb18030_chinese_ci
SELECT * FROM Z0CASE ORDER BY T1*1;
T1
NULL
123
123
insert
INSERT INTO Z0CASE VALUES(111);
INSERT INTO Z0CASE VALUES('2001');
INSERT INTO Z0CASE VALUES('!*?< >aB12 中文');
INSERT INTO Z0CASE VALUES(b'0101101');
INSERT INTO Z0CASE VALUES('2021-10-01 12:23:35.54');
INSERT INTO Z0CASE VALUES('2011-11-01');
INSERT INTO Z0CASE VALUES('22:22:35');
INSERT INTO Z0CASE VALUES(12.345);
INSERT INTO Z0CASE VALUES(null);
SELECT table_name,column_type,COLLATION_NAME,CHARACTER_SET_NAME FROM information_schema.columns WHERE table_name='Z0CASE';
table_name	column_type	COLLATION_NAME	CHARACTER_SET_NAME
z0case	int(11)	NULL	NULL
SELECT table_name,table_collation FROM information_schema.tables WHERE table_name='Z0CASE';
table_name	table_collation
z0case	gb18030_chinese_ci
SELECT * FROM Z0CASE ORDER BY T1*1;
T1
NULL
NULL
0
12
22
45
111
123
123
2001
2011
2021
update
UPDATE Z0CASE SET T1=NULL WHERE T1='111';
UPDATE Z0CASE SET T1='12:31:56' WHERE T1=2011;
UPDATE Z0CASE SET T1=1221.34 WHERE T1=2001;
UPDATE Z0CASE SET T1='Aa1$< >中文' WHERE T1='123';
UPDATE Z0CASE SET T1=b'0101101' WHERE T1=12;
SELECT table_name,column_type,COLLATION_NAME,CHARACTER_SET_NAME FROM information_schema.columns WHERE table_name='Z0CASE';
table_name	column_type	COLLATION_NAME	CHARACTER_SET_NAME
z0case	int(11)	NULL	NULL
SELECT table_name,table_collation FROM information_schema.tables WHERE table_name='Z0CASE';
table_name	table_collation
z0case	gb18030_chinese_ci
SELECT * FROM Z0CASE ORDER BY T1*1;
T1
NULL
NULL
NULL
0
0
0
22
45
45
45
1221
2021
delete
DELETE FROM Z0CASE WHERE T1=1221;
DELETE FROM Z0CASE WHERE T1 IS NULL;
SELECT * FROM Z0CASE ORDER BY T1*1;
T1
0
0
0
22
45
45
45
2021
FLOAT
DROP TABLE Z0CASE;
CREATE TABLE Z0CASE(T1 FLOAT(20,0)) DEFAULT charset= utf8mb4 DEFAULT collate = utf8mb4_general_ci;
INSERT INTO Z0CASE VALUES(123);
INSERT INTO Z0CASE VALUES('123.3445');
INSERT INTO Z0CASE VALUES(641231122123.5445);
INSERT INTO Z0CASE VALUES(NULL);
SELECT * FROM Z0CASE ORDER BY T1*1;
T1
NULL
123
123
641231093760
SELECT table_name,column_type,COLLATION_NAME,CHARACTER_SET_NAME FROM information_schema.columns WHERE table_name='Z0CASE';
table_name	column_type	COLLATION_NAME	CHARACTER_SET_NAME
z0case	float(20,0)	NULL	NULL
SELECT table_name,table_collation FROM information_schema.tables WHERE table_name='Z0CASE';
table_name	table_collation
z0case	utf8mb4_general_ci
ALTER TABLE Z0CASE CONVERT TO CHARACTER SET 'gb18030' COLLATE 'gb18030_chinese_ci';
SELECT table_name,table_collation FROM information_schema.tables WHERE table_name='Z0CASE';
table_name	table_collation
z0case	gb18030_chinese_ci
SELECT * FROM Z0CASE ORDER BY T1*1;
T1
NULL
123
123
641231093760
insert
INSERT INTO Z0CASE VALUES(111);
INSERT INTO Z0CASE VALUES('2001');
INSERT INTO Z0CASE VALUES('!*?< >aB12 中文');
Warnings:
Warning	1292	Truncated incorrect DOUBLE value: '!*?< >aB12 中文'
INSERT INTO Z0CASE VALUES(b'0101101');
INSERT INTO Z0CASE VALUES('2021-10-01 12:23:35.54');
Warnings:
Warning	1292	Truncated incorrect DOUBLE value: '2021-10-01 12:23:35.54'
INSERT INTO Z0CASE VALUES('2011-11-01');
Warnings:
Warning	1292	Truncated incorrect DOUBLE value: '2011-11-01'
INSERT INTO Z0CASE VALUES('22:22:35');
Warnings:
Warning	1292	Truncated incorrect DOUBLE value: '22:22:35'
INSERT INTO Z0CASE VALUES(12.3456);
INSERT INTO Z0CASE VALUES(null);
SELECT table_name,column_type,COLLATION_NAME,CHARACTER_SET_NAME FROM information_schema.columns WHERE table_name='Z0CASE';
table_name	column_type	COLLATION_NAME	CHARACTER_SET_NAME
z0case	float(20,0)	NULL	NULL
SELECT table_name,table_collation FROM information_schema.tables WHERE table_name='Z0CASE';
table_name	table_collation
z0case	gb18030_chinese_ci
SELECT * FROM Z0CASE ORDER BY T1*1;
T1
NULL
NULL
0
12
22
45
111
123
123
2001
2011
2021
641231093760
update
UPDATE Z0CASE SET T1=NULL WHERE T1='111';
UPDATE Z0CASE SET T1='12:31:56' WHERE T1=2011;
Warnings:
Warning	1292	Truncated incorrect DOUBLE value: '12:31:56'
UPDATE Z0CASE SET T1=1221.34 WHERE T1=2001;
UPDATE Z0CASE SET T1='Aa1$< >中文' WHERE T1 LIKE'12.34%';
UPDATE Z0CASE SET T1=b'0101101' WHERE T1=0.0;
SELECT table_name,column_type,COLLATION_NAME,CHARACTER_SET_NAME FROM information_schema.columns WHERE table_name='Z0CASE';
table_name	column_type	COLLATION_NAME	CHARACTER_SET_NAME
z0case	float(20,0)	NULL	NULL
SELECT table_name,table_collation FROM information_schema.tables WHERE table_name='Z0CASE';
table_name	table_collation
z0case	gb18030_chinese_ci
SELECT * FROM Z0CASE ORDER BY T1*1;
T1
NULL
NULL
NULL
12
12
22
45
45
123
123
1221
2021
641231093760
delete
DELETE FROM Z0CASE WHERE T1 LIKE'1221.34%';
DELETE FROM Z0CASE WHERE T1 IS NULL;
SELECT * FROM Z0CASE ORDER BY T1*1;
T1
12
12
22
45
45
123
123
1221
2021
641231093760
DATE
DROP TABLE Z0CASE;
CREATE TABLE Z0CASE(T1 DATE) DEFAULT charset= utf8mb4 DEFAULT collate = utf8mb4_general_ci;
INSERT INTO Z0CASE VALUES('20210321');
INSERT INTO Z0CASE VALUES('2020-11-21');
INSERT INTO Z0CASE VALUES('2021-01-21 11:58:39.456');
INSERT INTO Z0CASE VALUES(NULL);
SELECT * FROM Z0CASE ORDER BY T1*1;
T1
NULL
2020-11-21
2021-01-21
2021-03-21
SELECT table_name,column_type,COLLATION_NAME,CHARACTER_SET_NAME FROM information_schema.columns WHERE table_name='Z0CASE';
table_name	column_type	COLLATION_NAME	CHARACTER_SET_NAME
z0case	date	NULL	NULL
SELECT table_name,table_collation FROM information_schema.tables WHERE table_name='Z0CASE';
table_name	table_collation
z0case	utf8mb4_general_ci
ALTER TABLE Z0CASE CONVERT TO CHARACTER SET 'gb18030' COLLATE 'gb18030_chinese_ci';
SELECT table_name,table_collation FROM information_schema.tables WHERE table_name='Z0CASE';
table_name	table_collation
z0case	gb18030_chinese_ci
SELECT * FROM Z0CASE ORDER BY T1*1;
T1
NULL
2020-11-21
2021-01-21
2021-03-21
insert
INSERT INTO Z0CASE VALUES(111);
INSERT INTO Z0CASE VALUES('2001');
INSERT INTO Z0CASE VALUES('!*?< >aB12 中文');
INSERT INTO Z0CASE VALUES(b'0101101');
INSERT INTO Z0CASE VALUES('2021-10-01 12:23:35.54');
INSERT INTO Z0CASE VALUES('2011-11-01');
INSERT INTO Z0CASE VALUES('22:22:35');
INSERT INTO Z0CASE VALUES(12.3456);
INSERT INTO Z0CASE VALUES(null);
SELECT table_name,column_type,COLLATION_NAME,CHARACTER_SET_NAME FROM information_schema.columns WHERE table_name='Z0CASE';
table_name	column_type	COLLATION_NAME	CHARACTER_SET_NAME
z0case	date	NULL	NULL
SELECT table_name,table_collation FROM information_schema.tables WHERE table_name='Z0CASE';
table_name	table_collation
z0case	gb18030_chinese_ci
SELECT * FROM Z0CASE ORDER BY T1*1;
T1
NULL
NULL
0000-00-00
0000-00-00
0000-00-00
0000-00-00
0000-00-00
2000-01-11
2011-11-01
2020-11-21
2021-01-21
2021-03-21
2021-10-01
update
UPDATE Z0CASE SET T1=NULL WHERE T1='2021-10-01';
UPDATE Z0CASE SET T1='12:31:56' WHERE T1='2021-03-21';
UPDATE Z0CASE SET T1=1221.34 WHERE T1='2021-01-21';
UPDATE Z0CASE SET T1='Aa1$< >中文' WHERE T1='2020-11-21';
UPDATE Z0CASE SET T1=b'0101101' WHERE T1='2011-11-01';
UPDATE Z0CASE SET T1='2011-11-11' WHERE T1='2000-01-11';
UPDATE Z0CASE SET T1='2012-12-21 09:10:21' WHERE T1='0';
SELECT table_name,column_type,COLLATION_NAME,CHARACTER_SET_NAME FROM information_schema.columns WHERE table_name='Z0CASE';
table_name	column_type	COLLATION_NAME	CHARACTER_SET_NAME
z0case	date	NULL	NULL
SELECT table_name,table_collation FROM information_schema.tables WHERE table_name='Z0CASE';
table_name	table_collation
z0case	gb18030_chinese_ci
SELECT * FROM Z0CASE ORDER BY T1*1;
T1
NULL
NULL
NULL
2000-12-21
2011-11-11
2012-12-21
2012-12-21
2012-12-21
2012-12-21
2012-12-21
2012-12-21
2012-12-21
2012-12-21
delete
DELETE FROM Z0CASE WHERE T1='2012-12-21';
DELETE FROM Z0CASE WHERE T1 IS NULL;
SELECT * FROM Z0CASE ORDER BY T1*1;
T1
2000-12-21
2011-11-11
TIME
DROP TABLE Z0CASE;
CREATE TABLE Z0CASE(T1 TIME) DEFAULT charset= utf8mb4 DEFAULT collate = utf8mb4_general_ci;
INSERT INTO Z0CASE VALUES('2020-11-21');
INSERT INTO Z0CASE VALUES('2021-01-21 11:58:39.456');
INSERT INTO Z0CASE VALUES('21:28:33.556');
INSERT INTO Z0CASE VALUES('2001');
INSERT INTO Z0CASE VALUES(NULL);
SELECT * FROM Z0CASE ORDER BY T1*1;
T1
NULL
00:20:01
00:20:20
11:58:39
21:28:34
SELECT table_name,column_type,COLLATION_NAME,CHARACTER_SET_NAME FROM information_schema.columns WHERE table_name='Z0CASE';
table_name	column_type	COLLATION_NAME	CHARACTER_SET_NAME
z0case	time	NULL	NULL
SELECT table_name,table_collation FROM information_schema.tables WHERE table_name='Z0CASE';
table_name	table_collation
z0case	utf8mb4_general_ci
ALTER TABLE Z0CASE CONVERT TO CHARACTER SET 'gb18030' COLLATE 'gb18030_chinese_ci';
SELECT table_name,table_collation FROM information_schema.tables WHERE table_name='Z0CASE';
table_name	table_collation
z0case	gb18030_chinese_ci
SELECT * FROM Z0CASE ORDER BY T1*1;
T1
NULL
00:20:01
00:20:20
11:58:39
21:28:34
insert
INSERT INTO Z0CASE VALUES(71);
INSERT INTO Z0CASE VALUES('2001');
INSERT INTO Z0CASE VALUES('!*?< >aB12 中文');
INSERT INTO Z0CASE VALUES(b'0101101');
INSERT INTO Z0CASE VALUES('2021-10-01 12:23:35.54');
INSERT INTO Z0CASE VALUES('2011-11-01');
INSERT INTO Z0CASE VALUES('22:22:35');
INSERT INTO Z0CASE VALUES(72.7476);
INSERT INTO Z0CASE VALUES(null);
SELECT table_name,column_type,COLLATION_NAME,CHARACTER_SET_NAME FROM information_schema.columns WHERE table_name='Z0CASE';
table_name	column_type	COLLATION_NAME	CHARACTER_SET_NAME
z0case	time	NULL	NULL
SELECT table_name,table_collation FROM information_schema.tables WHERE table_name='Z0CASE';
table_name	table_collation
z0case	gb18030_chinese_ci
SELECT * FROM Z0CASE ORDER BY T1*1;
T1
NULL
NULL
00:00:00
00:00:00
00:00:00
00:00:00
00:20:01
00:20:01
00:20:11
00:20:20
11:58:39
12:23:36
21:28:34
22:22:35
update
UPDATE Z0CASE SET T1=NULL WHERE T1='22:22:35';
UPDATE Z0CASE SET T1='12:31:56' WHERE T1='21:28:34';
UPDATE Z0CASE SET T1=1221.34 WHERE T1='12:23:36';
UPDATE Z0CASE SET T1='Aa1$< >中文' WHERE T1='11:58:39';
UPDATE Z0CASE SET T1=b'0101101' WHERE T1='00:20:20';
UPDATE Z0CASE SET T1='2011-11-11' WHERE T1='00:20:01';
UPDATE Z0CASE SET T1='2012-12-21 09:10:21' WHERE T1='0';
SELECT table_name,column_type,COLLATION_NAME,CHARACTER_SET_NAME FROM information_schema.columns WHERE table_name='Z0CASE';
table_name	column_type	COLLATION_NAME	CHARACTER_SET_NAME
z0case	time	NULL	NULL
SELECT table_name,table_collation FROM information_schema.tables WHERE table_name='Z0CASE';
table_name	table_collation
z0case	gb18030_chinese_ci
SELECT * FROM Z0CASE ORDER BY T1*1;
T1
NULL
NULL
NULL
00:12:21
00:20:11
00:20:11
00:20:11
09:10:21
09:10:21
09:10:21
09:10:21
09:10:21
09:10:21
12:31:56
delete
DELETE FROM Z0CASE WHERE T1='09:10:21';
DELETE FROM Z0CASE WHERE T1 IS NULL;
SELECT * FROM Z0CASE ORDER BY T1*1;
T1
00:12:21
00:20:11
00:20:11
00:20:11
12:31:56
general_list_update  utf8mb4/utf8mb4_general_ci --> gb18030/gb18030_bin
char
DROP TABLE Z0CASE;
CREATE TABLE Z0CASE(T1 CHAR(50)) DEFAULT charset= utf8mb4 DEFAULT collate = utf8mb4_general_ci;
INSERT INTO Z0CASE VALUES(123);
INSERT INTO Z0CASE VALUES('%^&*[];//\\');
INSERT INTO Z0CASE VALUES(NULL);
INSERT INTO Z0CASE VALUES('abc');
INSERT INTO Z0CASE VALUES('中文');
SELECT * FROM Z0CASE ORDER BY T1*1;
T1
NULL
%^&*[];//\
abc
中文
123
Warnings:
Warning	1292	Truncated incorrect DOUBLE value: '%^&*[];//\'
Warning	1292	Truncated incorrect DOUBLE value: 'abc'
Warning	1292	Truncated incorrect DOUBLE value: '中文'
SELECT table_name,column_type,COLLATION_NAME,CHARACTER_SET_NAME FROM information_schema.columns WHERE table_name='Z0CASE';
table_name	column_type	COLLATION_NAME	CHARACTER_SET_NAME
z0case	char(50)	utf8mb4_general_ci	utf8mb4
SELECT table_name,table_collation FROM information_schema.tables WHERE table_name='Z0CASE';
table_name	table_collation
z0case	utf8mb4_general_ci
ALTER TABLE Z0CASE CONVERT TO CHARACTER SET 'gb18030' COLLATE 'gb18030_bin';
SELECT table_name,table_collation FROM information_schema.tables WHERE table_name='Z0CASE';
table_name	table_collation
z0case	gb18030_bin
SELECT * FROM Z0CASE ORDER BY T1*1;
T1
NULL
%^&*[];//\
abc
中文
123
Warnings:
Warning	1292	Truncated incorrect DOUBLE value: '%^&*[];//\'
Warning	1292	Truncated incorrect DOUBLE value: 'abc'
Warning	1292	Truncated incorrect DOUBLE value: '中文'
insert
INSERT INTO Z0CASE VALUES(111);
INSERT INTO Z0CASE VALUES('2001');
INSERT INTO Z0CASE VALUES('!*?< >aB12 中文');
INSERT INTO Z0CASE VALUES(b'0101101');
INSERT INTO Z0CASE VALUES('2021-10-01 12:23:35.54');
INSERT INTO Z0CASE VALUES('2011-11-01');
INSERT INTO Z0CASE VALUES('22:22:35');
INSERT INTO Z0CASE VALUES(12.345);
INSERT INTO Z0CASE VALUES(null);
SELECT table_name,column_type,COLLATION_NAME,CHARACTER_SET_NAME FROM information_schema.columns WHERE table_name='Z0CASE';
table_name	column_type	COLLATION_NAME	CHARACTER_SET_NAME
z0case	char(50)	gb18030_bin	gb18030
SELECT table_name,table_collation FROM information_schema.tables WHERE table_name='Z0CASE';
table_name	table_collation
z0case	gb18030_bin
SELECT * FROM Z0CASE ORDER BY T1*1;
T1
NULL
NULL
%^&*[];//\
abc
中文
!*?< >aB12 中文
-
12.345
22:22:35
111
123
2001
2011-11-01
2021-10-01 12:23:35.54
Warnings:
Warning	1292	Truncated incorrect DOUBLE value: '%^&*[];//\'
Warning	1292	Truncated incorrect DOUBLE value: 'abc'
Warning	1292	Truncated incorrect DOUBLE value: '中文'
Warning	1292	Truncated incorrect DOUBLE value: '!*?< >aB12 中文'
Warning	1292	Truncated incorrect DOUBLE value: '-'
Warning	1292	Truncated incorrect DOUBLE value: '2021-10-01 12:23:35.54'
Warning	1292	Truncated incorrect DOUBLE value: '2011-11-01'
Warning	1292	Truncated incorrect DOUBLE value: '22:22:35'
update
UPDATE Z0CASE SET T1=NULL WHERE T1='111';
UPDATE Z0CASE SET T1='12:31:56' WHERE T1=2001;
Warnings:
Warning	1292	Truncated incorrect DECIMAL value: '%^&*[];//\'
Warning	1292	Truncated incorrect DECIMAL value: 'abc'
Warning	1292	Truncated incorrect DECIMAL value: '中文'
Warning	1292	Truncated incorrect DECIMAL value: '!*?< >aB12 中文'
Warning	1292	Truncated incorrect DECIMAL value: '2021-10-01 12:23:35.54'
Warning	1292	Truncated incorrect DECIMAL value: '2011-11-01'
Warning	1292	Truncated incorrect DECIMAL value: '22:22:35'
UPDATE Z0CASE SET T1=1221.34 WHERE T1='2011-11-01';
UPDATE Z0CASE SET T1='Aa1$< >中文' WHERE T1='12.345';
UPDATE Z0CASE SET T1=b'0101101' WHERE T1='abc';
SELECT table_name,column_type,COLLATION_NAME,CHARACTER_SET_NAME FROM information_schema.columns WHERE table_name='Z0CASE';
table_name	column_type	COLLATION_NAME	CHARACTER_SET_NAME
z0case	char(50)	gb18030_bin	gb18030
SELECT table_name,table_collation FROM information_schema.tables WHERE table_name='Z0CASE';
table_name	table_collation
z0case	gb18030_bin
SELECT * FROM Z0CASE ORDER BY T1*1;
T1
NULL
NULL
NULL
%^&*[];//\
-
中文
!*?< >aB12 中文
-
Aa1$< >中文
12:31:56
22:22:35
123
1221.34
2021-10-01 12:23:35.54
Warnings:
Warning	1292	Truncated incorrect DOUBLE value: '%^&*[];//\'
Warning	1292	Truncated incorrect DOUBLE value: '-'
Warning	1292	Truncated incorrect DOUBLE value: '中文'
Warning	1292	Truncated incorrect DOUBLE value: '12:31:56'
Warning	1292	Truncated incorrect DOUBLE value: '!*?< >aB12 中文'
Warning	1292	Truncated incorrect DOUBLE value: '-'
Warning	1292	Truncated incorrect DOUBLE value: '2021-10-01 12:23:35.54'
Warning	1292	Truncated incorrect DOUBLE value: '22:22:35'
Warning	1292	Truncated incorrect DOUBLE value: 'Aa1$< >中文'
delete
DELETE FROM Z0CASE WHERE T1=1221.34;
Warnings:
Warning	1292	Truncated incorrect DECIMAL value: '%^&*[];//\'
Warning	1292	Truncated incorrect DECIMAL value: '中文'
Warning	1292	Truncated incorrect DECIMAL value: '12:31:56'
Warning	1292	Truncated incorrect DECIMAL value: '!*?< >aB12 中文'
Warning	1292	Truncated incorrect DECIMAL value: '2021-10-01 12:23:35.54'
Warning	1292	Truncated incorrect DECIMAL value: '22:22:35'
Warning	1292	Truncated incorrect DECIMAL value: 'Aa1$< >中文'
DELETE FROM Z0CASE WHERE T1='2021-10-01 12:23:35.54';
DELETE FROM Z0CASE WHERE T1 IS NULL;
DELETE FROM Z0CASE WHERE T1=b'0101101';
SELECT * FROM Z0CASE ORDER BY T1*1;
T1
%^&*[];//\
中文
!*?< >aB12 中文
Aa1$< >中文
12:31:56
22:22:35
123
Warnings:
Warning	1292	Truncated incorrect DOUBLE value: '%^&*[];//\'
Warning	1292	Truncated incorrect DOUBLE value: '中文'
Warning	1292	Truncated incorrect DOUBLE value: '12:31:56'
Warning	1292	Truncated incorrect DOUBLE value: '!*?< >aB12 中文'
Warning	1292	Truncated incorrect DOUBLE value: '22:22:35'
Warning	1292	Truncated incorrect DOUBLE value: 'Aa1$< >中文'
varchar
DROP TABLE Z0CASE;
CREATE TABLE Z0CASE(T1 VARCHAR(50)) DEFAULT charset= utf8mb4 DEFAULT collate = utf8mb4_general_ci;
INSERT INTO Z0CASE VALUES(123);
INSERT INTO Z0CASE VALUES('%^&*[];//\\');
INSERT INTO Z0CASE VALUES(NULL);
INSERT INTO Z0CASE VALUES('abc');
INSERT INTO Z0CASE VALUES('中文');
SELECT * FROM Z0CASE ORDER BY T1*1;
T1
NULL
%^&*[];//\
abc
中文
123
Warnings:
Warning	1292	Truncated incorrect DOUBLE value: '%^&*[];//\'
Warning	1292	Truncated incorrect DOUBLE value: 'abc'
Warning	1292	Truncated incorrect DOUBLE value: '中文'
SELECT table_name,column_type,COLLATION_NAME,CHARACTER_SET_NAME FROM information_schema.columns WHERE table_name='Z0CASE';
table_name	column_type	COLLATION_NAME	CHARACTER_SET_NAME
z0case	varchar(50)	utf8mb4_general_ci	utf8mb4
SELECT table_name,table_collation FROM information_schema.tables WHERE table_name='Z0CASE';
table_name	table_collation
z0case	utf8mb4_general_ci
ALTER TABLE Z0CASE CONVERT TO CHARACTER SET 'gb18030' COLLATE 'gb18030_bin';
SELECT table_name,table_collation FROM information_schema.tables WHERE table_name='Z0CASE';
table_name	table_collation
z0case	gb18030_bin
SELECT * FROM Z0CASE ORDER BY T1*1;
T1
NULL
%^&*[];//\
abc
中文
123
Warnings:
Warning	1292	Truncated incorrect DOUBLE value: '%^&*[];//\'
Warning	1292	Truncated incorrect DOUBLE value: 'abc'
Warning	1292	Truncated incorrect DOUBLE value: '中文'
insert
INSERT INTO Z0CASE VALUES(111);
INSERT INTO Z0CASE VALUES('2001');
INSERT INTO Z0CASE VALUES('!*?< >aB12 中文');
INSERT INTO Z0CASE VALUES(b'0101101');
INSERT INTO Z0CASE VALUES('2021-10-01 12:23:35.54');
INSERT INTO Z0CASE VALUES('2011-11-01');
INSERT INTO Z0CASE VALUES('22:22:35');
INSERT INTO Z0CASE VALUES(12.345);
INSERT INTO Z0CASE VALUES(null);
SELECT table_name,column_type,COLLATION_NAME,CHARACTER_SET_NAME FROM information_schema.columns WHERE table_name='Z0CASE';
table_name	column_type	COLLATION_NAME	CHARACTER_SET_NAME
z0case	varchar(50)	gb18030_bin	gb18030
SELECT table_name,table_collation FROM information_schema.tables WHERE table_name='Z0CASE';
table_name	table_collation
z0case	gb18030_bin
SELECT * FROM Z0CASE ORDER BY T1*1;
T1
NULL
NULL
%^&*[];//\
abc
中文
!*?< >aB12 中文
-
12.345
22:22:35
111
123
2001
2011-11-01
2021-10-01 12:23:35.54
Warnings:
Warning	1292	Truncated incorrect DOUBLE value: '%^&*[];//\'
Warning	1292	Truncated incorrect DOUBLE value: 'abc'
Warning	1292	Truncated incorrect DOUBLE value: '中文'
Warning	1292	Truncated incorrect DOUBLE value: '!*?< >aB12 中文'
Warning	1292	Truncated incorrect DOUBLE value: '-'
Warning	1292	Truncated incorrect DOUBLE value: '2021-10-01 12:23:35.54'
Warning	1292	Truncated incorrect DOUBLE value: '2011-11-01'
Warning	1292	Truncated incorrect DOUBLE value: '22:22:35'
update
UPDATE Z0CASE SET T1=NULL WHERE T1='111';
UPDATE Z0CASE SET T1='12:31:56' WHERE T1=2001;
Warnings:
Warning	1292	Truncated incorrect DECIMAL value: '%^&*[];//\'
Warning	1292	Truncated incorrect DECIMAL value: 'abc'
Warning	1292	Truncated incorrect DECIMAL value: '中文'
Warning	1292	Truncated incorrect DECIMAL value: '!*?< >aB12 中文'
Warning	1292	Truncated incorrect DECIMAL value: '2021-10-01 12:23:35.54'
Warning	1292	Truncated incorrect DECIMAL value: '2011-11-01'
Warning	1292	Truncated incorrect DECIMAL value: '22:22:35'
UPDATE Z0CASE SET T1=1221.34 WHERE T1='2011-11-01';
UPDATE Z0CASE SET T1='Aa1$< >中文' WHERE T1='12.345';
UPDATE Z0CASE SET T1=b'0101101' WHERE T1='abc';
SELECT table_name,column_type,COLLATION_NAME,CHARACTER_SET_NAME FROM information_schema.columns WHERE table_name='Z0CASE';
table_name	column_type	COLLATION_NAME	CHARACTER_SET_NAME
z0case	varchar(50)	gb18030_bin	gb18030
SELECT table_name,table_collation FROM information_schema.tables WHERE table_name='Z0CASE';
table_name	table_collation
z0case	gb18030_bin
SELECT * FROM Z0CASE ORDER BY T1*1;
T1
NULL
NULL
NULL
%^&*[];//\
-
中文
!*?< >aB12 中文
-
Aa1$< >中文
12:31:56
22:22:35
123
1221.34
2021-10-01 12:23:35.54
Warnings:
Warning	1292	Truncated incorrect DOUBLE value: '%^&*[];//\'
Warning	1292	Truncated incorrect DOUBLE value: '-'
Warning	1292	Truncated incorrect DOUBLE value: '中文'
Warning	1292	Truncated incorrect DOUBLE value: '12:31:56'
Warning	1292	Truncated incorrect DOUBLE value: '!*?< >aB12 中文'
Warning	1292	Truncated incorrect DOUBLE value: '-'
Warning	1292	Truncated incorrect DOUBLE value: '2021-10-01 12:23:35.54'
Warning	1292	Truncated incorrect DOUBLE value: '22:22:35'
Warning	1292	Truncated incorrect DOUBLE value: 'Aa1$< >中文'
delete
DELETE FROM Z0CASE WHERE T1=1221.34;
Warnings:
Warning	1292	Truncated incorrect DECIMAL value: '%^&*[];//\'
Warning	1292	Truncated incorrect DECIMAL value: '中文'
Warning	1292	Truncated incorrect DECIMAL value: '12:31:56'
Warning	1292	Truncated incorrect DECIMAL value: '!*?< >aB12 中文'
Warning	1292	Truncated incorrect DECIMAL value: '2021-10-01 12:23:35.54'
Warning	1292	Truncated incorrect DECIMAL value: '22:22:35'
Warning	1292	Truncated incorrect DECIMAL value: 'Aa1$< >中文'
DELETE FROM Z0CASE WHERE T1='2021-10-01 12:23:35.54';
DELETE FROM Z0CASE WHERE T1 IS NULL;
DELETE FROM Z0CASE WHERE T1=b'0101101';
SELECT * FROM Z0CASE ORDER BY T1*1;
T1
%^&*[];//\
中文
!*?< >aB12 中文
Aa1$< >中文
12:31:56
22:22:35
123
Warnings:
Warning	1292	Truncated incorrect DOUBLE value: '%^&*[];//\'
Warning	1292	Truncated incorrect DOUBLE value: '中文'
Warning	1292	Truncated incorrect DOUBLE value: '12:31:56'
Warning	1292	Truncated incorrect DOUBLE value: '!*?< >aB12 中文'
Warning	1292	Truncated incorrect DOUBLE value: '22:22:35'
Warning	1292	Truncated incorrect DOUBLE value: 'Aa1$< >中文'
TEXT
DROP TABLE Z0CASE;
CREATE TABLE Z0CASE(T1 TEXT) DEFAULT charset= utf8mb4 DEFAULT collate = utf8mb4_general_ci;
INSERT INTO Z0CASE VALUES(123);
INSERT INTO Z0CASE VALUES('%^&*[];//\\');
INSERT INTO Z0CASE VALUES(NULL);
INSERT INTO Z0CASE VALUES('abc');
INSERT INTO Z0CASE VALUES('中文');
SELECT * FROM Z0CASE ORDER BY T1*1;
T1
NULL
%^&*[];//\
abc
中文
123
Warnings:
Warning	1292	Truncated incorrect DOUBLE value: '%^&*[];//\'
Warning	1292	Truncated incorrect DOUBLE value: 'abc'
Warning	1292	Truncated incorrect DOUBLE value: '中文'
SELECT table_name,column_type,COLLATION_NAME,CHARACTER_SET_NAME FROM information_schema.columns WHERE table_name='Z0CASE';
table_name	column_type	COLLATION_NAME	CHARACTER_SET_NAME
z0case	text	utf8mb4_general_ci	utf8mb4
SELECT table_name,table_collation FROM information_schema.tables WHERE table_name='Z0CASE';
table_name	table_collation
z0case	utf8mb4_general_ci
ALTER TABLE Z0CASE CONVERT TO CHARACTER SET 'gb18030' COLLATE 'gb18030_bin';
SELECT table_name,table_collation FROM information_schema.tables WHERE table_name='Z0CASE';
table_name	table_collation
z0case	gb18030_bin
SELECT * FROM Z0CASE ORDER BY T1*1;
T1
NULL
%^&*[];//\
abc
中文
123
Warnings:
Warning	1292	Truncated incorrect DOUBLE value: '%^&*[];//\'
Warning	1292	Truncated incorrect DOUBLE value: 'abc'
Warning	1292	Truncated incorrect DOUBLE value: '中文'
insert
INSERT INTO Z0CASE VALUES(111);
INSERT INTO Z0CASE VALUES('2001');
INSERT INTO Z0CASE VALUES('!*?< >aB12 中文');
INSERT INTO Z0CASE VALUES(b'0101101');
INSERT INTO Z0CASE VALUES('2021-10-01 12:23:35.54');
INSERT INTO Z0CASE VALUES('2011-11-01');
INSERT INTO Z0CASE VALUES('22:22:35');
INSERT INTO Z0CASE VALUES(12.345);
INSERT INTO Z0CASE VALUES(null);
SELECT table_name,column_type,COLLATION_NAME,CHARACTER_SET_NAME FROM information_schema.columns WHERE table_name='Z0CASE';
table_name	column_type	COLLATION_NAME	CHARACTER_SET_NAME
z0case	text	gb18030_bin	gb18030
SELECT table_name,table_collation FROM information_schema.tables WHERE table_name='Z0CASE';
table_name	table_collation
z0case	gb18030_bin
SELECT * FROM Z0CASE ORDER BY T1*1;
T1
NULL
NULL
%^&*[];//\
abc
中文
!*?< >aB12 中文
-
12.345
22:22:35
111
123
2001
2011-11-01
2021-10-01 12:23:35.54
Warnings:
Warning	1292	Truncated incorrect DOUBLE value: '%^&*[];//\'
Warning	1292	Truncated incorrect DOUBLE value: 'abc'
Warning	1292	Truncated incorrect DOUBLE value: '中文'
Warning	1292	Truncated incorrect DOUBLE value: '!*?< >aB12 中文'
Warning	1292	Truncated incorrect DOUBLE value: '-'
Warning	1292	Truncated incorrect DOUBLE value: '2021-10-01 12:23:35.54'
Warning	1292	Truncated incorrect DOUBLE value: '2011-11-01'
Warning	1292	Truncated incorrect DOUBLE value: '22:22:35'
update
UPDATE Z0CASE SET T1=NULL WHERE T1='111';
UPDATE Z0CASE SET T1='12:31:56' WHERE T1=2001;
Warnings:
Warning	1292	Truncated incorrect DECIMAL value: '%^&*[];//\'
Warning	1292	Truncated incorrect DECIMAL value: 'abc'
Warning	1292	Truncated incorrect DECIMAL value: '中文'
Warning	1292	Truncated incorrect DECIMAL value: '!*?< >aB12 中文'
Warning	1292	Truncated incorrect DECIMAL value: '2021-10-01 12:23:35.54'
Warning	1292	Truncated incorrect DECIMAL value: '2011-11-01'
Warning	1292	Truncated incorrect DECIMAL value: '22:22:35'
UPDATE Z0CASE SET T1=1221.34 WHERE T1='2011-11-01';
UPDATE Z0CASE SET T1='Aa1$< >中文' WHERE T1='12.345';
UPDATE Z0CASE SET T1=b'0101101' WHERE T1='abc';
SELECT table_name,column_type,COLLATION_NAME,CHARACTER_SET_NAME FROM information_schema.columns WHERE table_name='Z0CASE';
table_name	column_type	COLLATION_NAME	CHARACTER_SET_NAME
z0case	text	gb18030_bin	gb18030
SELECT table_name,table_collation FROM information_schema.tables WHERE table_name='Z0CASE';
table_name	table_collation
z0case	gb18030_bin
SELECT * FROM Z0CASE ORDER BY T1*1;
T1
NULL
NULL
NULL
%^&*[];//\
-
中文
!*?< >aB12 中文
-
Aa1$< >中文
12:31:56
22:22:35
123
1221.34
2021-10-01 12:23:35.54
Warnings:
Warning	1292	Truncated incorrect DOUBLE value: '%^&*[];//\'
Warning	1292	Truncated incorrect DOUBLE value: '-'
Warning	1292	Truncated incorrect DOUBLE value: '中文'
Warning	1292	Truncated incorrect DOUBLE value: '12:31:56'
Warning	1292	Truncated incorrect DOUBLE value: '!*?< >aB12 中文'
Warning	1292	Truncated incorrect DOUBLE value: '-'
Warning	1292	Truncated incorrect DOUBLE value: '2021-10-01 12:23:35.54'
Warning	1292	Truncated incorrect DOUBLE value: '22:22:35'
Warning	1292	Truncated incorrect DOUBLE value: 'Aa1$< >中文'
delete
DELETE FROM Z0CASE WHERE T1=1221.34;
Warnings:
Warning	1292	Truncated incorrect DECIMAL value: '%^&*[];//\'
Warning	1292	Truncated incorrect DECIMAL value: '-'
Warning	1292	Truncated incorrect DECIMAL value: '中文'
Warning	1292	Truncated incorrect DECIMAL value: '12:31:56'
Warning	1292	Truncated incorrect DECIMAL value: '!*?< >aB12 中文'
Warning	1292	Truncated incorrect DECIMAL value: '-'
Warning	1292	Truncated incorrect DECIMAL value: '2021-10-01 12:23:35.54'
Warning	1292	Truncated incorrect DECIMAL value: '22:22:35'
Warning	1292	Truncated incorrect DECIMAL value: 'Aa1$< >中文'
DELETE FROM Z0CASE WHERE T1='2021-10-01 12:23:35.54';
DELETE FROM Z0CASE WHERE T1 IS NULL;
DELETE FROM Z0CASE WHERE T1=b'0101101';
SELECT * FROM Z0CASE ORDER BY T1*1;
T1
%^&*[];//\
中文
!*?< >aB12 中文
Aa1$< >中文
12:31:56
22:22:35
123
Warnings:
Warning	1292	Truncated incorrect DOUBLE value: '%^&*[];//\'
Warning	1292	Truncated incorrect DOUBLE value: '中文'
Warning	1292	Truncated incorrect DOUBLE value: '12:31:56'
Warning	1292	Truncated incorrect DOUBLE value: '!*?< >aB12 中文'
Warning	1292	Truncated incorrect DOUBLE value: '22:22:35'
Warning	1292	Truncated incorrect DOUBLE value: 'Aa1$< >中文'
LONGTEXT
DROP TABLE Z0CASE;
CREATE TABLE Z0CASE(T1 LONGTEXT) DEFAULT charset= utf8mb4 DEFAULT collate = utf8mb4_general_ci;
INSERT INTO Z0CASE VALUES(123);
INSERT INTO Z0CASE VALUES('%^&*[];//\\');
INSERT INTO Z0CASE VALUES(NULL);
INSERT INTO Z0CASE VALUES('abc');
INSERT INTO Z0CASE VALUES('中文');
SELECT * FROM Z0CASE ORDER BY T1*1;
T1
NULL
%^&*[];//\
abc
中文
123
Warnings:
Warning	1292	Truncated incorrect DOUBLE value: '%^&*[];//\'
Warning	1292	Truncated incorrect DOUBLE value: 'abc'
Warning	1292	Truncated incorrect DOUBLE value: '中文'
SELECT table_name,column_type,COLLATION_NAME,CHARACTER_SET_NAME FROM information_schema.columns WHERE table_name='Z0CASE';
table_name	column_type	COLLATION_NAME	CHARACTER_SET_NAME
z0case	longtext	utf8mb4_general_ci	utf8mb4
SELECT table_name,table_collation FROM information_schema.tables WHERE table_name='Z0CASE';
table_name	table_collation
z0case	utf8mb4_general_ci
ALTER TABLE Z0CASE CONVERT TO CHARACTER SET 'gb18030' COLLATE 'gb18030_bin';
SELECT table_name,table_collation FROM information_schema.tables WHERE table_name='Z0CASE';
table_name	table_collation
z0case	gb18030_bin
SELECT * FROM Z0CASE ORDER BY T1*1;
T1
NULL
%^&*[];//\
abc
中文
123
Warnings:
Warning	1292	Truncated incorrect DOUBLE value: '%^&*[];//\'
Warning	1292	Truncated incorrect DOUBLE value: 'abc'
Warning	1292	Truncated incorrect DOUBLE value: '中文'
insert
INSERT INTO Z0CASE VALUES(111);
INSERT INTO Z0CASE VALUES('2001');
INSERT INTO Z0CASE VALUES('!*?< >aB12 中文');
INSERT INTO Z0CASE VALUES(b'0101101');
INSERT INTO Z0CASE VALUES('2021-10-01 12:23:35.54');
INSERT INTO Z0CASE VALUES('2011-11-01');
INSERT INTO Z0CASE VALUES('22:22:35');
INSERT INTO Z0CASE VALUES(12.345);
INSERT INTO Z0CASE VALUES(null);
SELECT table_name,column_type,COLLATION_NAME,CHARACTER_SET_NAME FROM information_schema.columns WHERE table_name='Z0CASE';
table_name	column_type	COLLATION_NAME	CHARACTER_SET_NAME
z0case	longtext	gb18030_bin	gb18030
SELECT table_name,table_collation FROM information_schema.tables WHERE table_name='Z0CASE';
table_name	table_collation
z0case	gb18030_bin
SELECT * FROM Z0CASE ORDER BY T1*1;
T1
NULL
NULL
%^&*[];//\
abc
中文
!*?< >aB12 中文
-
12.345
22:22:35
111
123
2001
2011-11-01
2021-10-01 12:23:35.54
Warnings:
Warning	1292	Truncated incorrect DOUBLE value: '%^&*[];//\'
Warning	1292	Truncated incorrect DOUBLE value: 'abc'
Warning	1292	Truncated incorrect DOUBLE value: '中文'
Warning	1292	Truncated incorrect DOUBLE value: '!*?< >aB12 中文'
Warning	1292	Truncated incorrect DOUBLE value: '-'
Warning	1292	Truncated incorrect DOUBLE value: '2021-10-01 12:23:35.54'
Warning	1292	Truncated incorrect DOUBLE value: '2011-11-01'
Warning	1292	Truncated incorrect DOUBLE value: '22:22:35'
update
UPDATE Z0CASE SET T1=NULL WHERE T1='111';
UPDATE Z0CASE SET T1='12:31:56' WHERE T1=2001;
Warnings:
Warning	1292	Truncated incorrect DECIMAL value: '%^&*[];//\'
Warning	1292	Truncated incorrect DECIMAL value: 'abc'
Warning	1292	Truncated incorrect DECIMAL value: '中文'
Warning	1292	Truncated incorrect DECIMAL value: '!*?< >aB12 中文'
Warning	1292	Truncated incorrect DECIMAL value: '2021-10-01 12:23:35.54'
Warning	1292	Truncated incorrect DECIMAL value: '2011-11-01'
Warning	1292	Truncated incorrect DECIMAL value: '22:22:35'
UPDATE Z0CASE SET T1=1221.34 WHERE T1='2011-11-01';
UPDATE Z0CASE SET T1='Aa1$< >中文' WHERE T1='12.345';
UPDATE Z0CASE SET T1=b'0101101' WHERE T1='abc';
SELECT table_name,column_type,COLLATION_NAME,CHARACTER_SET_NAME FROM information_schema.columns WHERE table_name='Z0CASE';
table_name	column_type	COLLATION_NAME	CHARACTER_SET_NAME
z0case	longtext	gb18030_bin	gb18030
SELECT table_name,table_collation FROM information_schema.tables WHERE table_name='Z0CASE';
table_name	table_collation
z0case	gb18030_bin
SELECT * FROM Z0CASE ORDER BY T1*1;
T1
NULL
NULL
NULL
%^&*[];//\
-
中文
!*?< >aB12 中文
-
Aa1$< >中文
12:31:56
22:22:35
123
1221.34
2021-10-01 12:23:35.54
Warnings:
Warning	1292	Truncated incorrect DOUBLE value: '%^&*[];//\'
Warning	1292	Truncated incorrect DOUBLE value: '-'
Warning	1292	Truncated incorrect DOUBLE value: '中文'
Warning	1292	Truncated incorrect DOUBLE value: '12:31:56'
Warning	1292	Truncated incorrect DOUBLE value: '!*?< >aB12 中文'
Warning	1292	Truncated incorrect DOUBLE value: '-'
Warning	1292	Truncated incorrect DOUBLE value: '2021-10-01 12:23:35.54'
Warning	1292	Truncated incorrect DOUBLE value: '22:22:35'
Warning	1292	Truncated incorrect DOUBLE value: 'Aa1$< >中文'
delete
DELETE FROM Z0CASE WHERE T1=1221.34;
Warnings:
Warning	1292	Truncated incorrect DECIMAL value: '%^&*[];//\'
Warning	1292	Truncated incorrect DECIMAL value: '-'
Warning	1292	Truncated incorrect DECIMAL value: '中文'
Warning	1292	Truncated incorrect DECIMAL value: '12:31:56'
Warning	1292	Truncated incorrect DECIMAL value: '!*?< >aB12 中文'
Warning	1292	Truncated incorrect DECIMAL value: '-'
Warning	1292	Truncated incorrect DECIMAL value: '2021-10-01 12:23:35.54'
Warning	1292	Truncated incorrect DECIMAL value: '22:22:35'
Warning	1292	Truncated incorrect DECIMAL value: 'Aa1$< >中文'
DELETE FROM Z0CASE WHERE T1='2021-10-01 12:23:35.54';
DELETE FROM Z0CASE WHERE T1 IS NULL;
DELETE FROM Z0CASE WHERE T1=b'0101101';
SELECT * FROM Z0CASE ORDER BY T1*1;
T1
%^&*[];//\
中文
!*?< >aB12 中文
Aa1$< >中文
12:31:56
22:22:35
123
Warnings:
Warning	1292	Truncated incorrect DOUBLE value: '%^&*[];//\'
Warning	1292	Truncated incorrect DOUBLE value: '中文'
Warning	1292	Truncated incorrect DOUBLE value: '12:31:56'
Warning	1292	Truncated incorrect DOUBLE value: '!*?< >aB12 中文'
Warning	1292	Truncated incorrect DOUBLE value: '22:22:35'
Warning	1292	Truncated incorrect DOUBLE value: 'Aa1$< >中文'
BLOB
DROP TABLE Z0CASE;
CREATE TABLE Z0CASE(T1 BLOB) DEFAULT charset= utf8mb4 DEFAULT collate = utf8mb4_general_ci;
INSERT INTO Z0CASE VALUES(123);
INSERT INTO Z0CASE VALUES('%^&*[];//\\');
INSERT INTO Z0CASE VALUES(NULL);
INSERT INTO Z0CASE VALUES('abc');
INSERT INTO Z0CASE VALUES('中文');
SELECT * FROM Z0CASE ORDER BY T1*1;
T1
NULL
%^&*[];//\
abc
中文
123
Warnings:
Warning	1292	Truncated incorrect DOUBLE value: '%^&*[];//\'
Warning	1292	Truncated incorrect DOUBLE value: 'abc'
Warning	1292	Truncated incorrect DOUBLE value: '中文'
SELECT table_name,column_type,COLLATION_NAME,CHARACTER_SET_NAME FROM information_schema.columns WHERE table_name='Z0CASE';
table_name	column_type	COLLATION_NAME	CHARACTER_SET_NAME
z0case	blob	NULL	NULL
SELECT table_name,table_collation FROM information_schema.tables WHERE table_name='Z0CASE';
table_name	table_collation
z0case	utf8mb4_general_ci
ALTER TABLE Z0CASE CONVERT TO CHARACTER SET 'gb18030' COLLATE 'gb18030_bin';
SELECT table_name,table_collation FROM information_schema.tables WHERE table_name='Z0CASE';
table_name	table_collation
z0case	gb18030_bin
SELECT T1,HEX(T1) FROM Z0CASE ORDER BY T1*1;
insert
INSERT INTO Z0CASE VALUES(111);
INSERT INTO Z0CASE VALUES('2001');
INSERT INTO Z0CASE VALUES('!*?< >aB12 中文');
INSERT INTO Z0CASE VALUES(b'0101101');
INSERT INTO Z0CASE VALUES('2021-10-01 12:23:35.54');
INSERT INTO Z0CASE VALUES('2011-11-01');
INSERT INTO Z0CASE VALUES('22:22:35');
INSERT INTO Z0CASE VALUES(12.345);
INSERT INTO Z0CASE VALUES(null);
SELECT table_name,column_type,COLLATION_NAME,CHARACTER_SET_NAME FROM information_schema.columns WHERE table_name='Z0CASE';
table_name	column_type	COLLATION_NAME	CHARACTER_SET_NAME
z0case	blob	NULL	NULL
SELECT table_name,table_collation FROM information_schema.tables WHERE table_name='Z0CASE';
table_name	table_collation
z0case	gb18030_bin
SELECT T1,HEX(T1) FROM Z0CASE ORDER BY T1*1;
update
UPDATE Z0CASE SET T1=NULL WHERE T1='111';
UPDATE Z0CASE SET T1='12:31:56' WHERE T1=2001;
Warnings:
Warning	1292	Truncated incorrect DECIMAL value: '%^&*[];//\'
Warning	1292	Truncated incorrect DECIMAL value: 'abc'
Warning	1292	Truncated incorrect DECIMAL value: '中文'
Warning	1292	Truncated incorrect DECIMAL value: '!*?< >aB12 中文'
Warning	1292	Truncated incorrect DECIMAL value: '2021-10-01 12:23:35.54'
Warning	1292	Truncated incorrect DECIMAL value: '2011-11-01'
Warning	1292	Truncated incorrect DECIMAL value: '22:22:35'
UPDATE Z0CASE SET T1=1221.34 WHERE T1='2011-11-01';
UPDATE Z0CASE SET T1='Aa1$< >中文' WHERE T1='12.345';
UPDATE Z0CASE SET T1=b'0101101' WHERE T1='abc';
SELECT table_name,column_type,COLLATION_NAME,CHARACTER_SET_NAME FROM information_schema.columns WHERE table_name='Z0CASE';
table_name	column_type	COLLATION_NAME	CHARACTER_SET_NAME
z0case	blob	NULL	NULL
SELECT table_name,table_collation FROM information_schema.tables WHERE table_name='Z0CASE';
table_name	table_collation
z0case	gb18030_bin
SELECT T1,HEX(T1) FROM Z0CASE ORDER BY T1*1;
delete
DELETE FROM Z0CASE WHERE T1=1221.34;
Warnings:
Warning	1292	Truncated incorrect DECIMAL value: '%^&*[];//\'
Warning	1292	Truncated incorrect DECIMAL value: '-'
Warning	1292	Truncated incorrect DECIMAL value: '中文'
Warning	1292	Truncated incorrect DECIMAL value: '12:31:56'
Warning	1292	Truncated incorrect DECIMAL value: '!*?< >aB12 中文'
Warning	1292	Truncated incorrect DECIMAL value: '-'
Warning	1292	Truncated incorrect DECIMAL value: '2021-10-01 12:23:35.54'
Warning	1292	Truncated incorrect DECIMAL value: '22:22:35'
Warning	1292	Truncated incorrect DECIMAL value: 'Aa1$< >中文'
DELETE FROM Z0CASE WHERE T1='2021-10-01 12:23:35.54';
DELETE FROM Z0CASE WHERE T1 IS NULL;
DELETE FROM Z0CASE WHERE T1=b'0101101';
SELECT T1,HEX(T1) FROM Z0CASE ORDER BY T1*1;
BINARY
DROP TABLE Z0CASE;
CREATE TABLE Z0CASE(T1 BINARY(50)) DEFAULT charset= utf8mb4 DEFAULT collate = utf8mb4_general_ci;
INSERT INTO Z0CASE VALUES(123);
INSERT INTO Z0CASE VALUES('%^&*[];//\\');
INSERT INTO Z0CASE VALUES(NULL);
INSERT INTO Z0CASE VALUES('abc');
INSERT INTO Z0CASE VALUES('中文');
SELECT * FROM Z0CASE ORDER BY T1*1;
T1
NULL
%^&*[];//\                                        
abc                                               
中文                                            
123                                               
Warnings:
Warning	1292	Truncated incorrect DOUBLE value: '123'
Warning	1292	Truncated incorrect DOUBLE value: '%^&*[];//\'
Warning	1292	Truncated incorrect DOUBLE value: 'abc'
Warning	1292	Truncated incorrect DOUBLE value: '中文'
SELECT table_name,column_type,COLLATION_NAME,CHARACTER_SET_NAME FROM information_schema.columns WHERE table_name='Z0CASE';
table_name	column_type	COLLATION_NAME	CHARACTER_SET_NAME
z0case	binary(50)	NULL	NULL
SELECT table_name,table_collation FROM information_schema.tables WHERE table_name='Z0CASE';
table_name	table_collation
z0case	utf8mb4_general_ci
ALTER TABLE Z0CASE CONVERT TO CHARACTER SET 'gb18030' COLLATE 'gb18030_bin';
SELECT table_name,table_collation FROM information_schema.tables WHERE table_name='Z0CASE';
table_name	table_collation
z0case	gb18030_bin
SELECT T1,HEX(T1) FROM Z0CASE ORDER BY T1*1;
insert
INSERT INTO Z0CASE VALUES(111);
INSERT INTO Z0CASE VALUES('2001');
INSERT INTO Z0CASE VALUES('!*?< >aB12 中文');
INSERT INTO Z0CASE VALUES(b'0101101');
INSERT INTO Z0CASE VALUES('2021-10-01 12:23:35.54');
INSERT INTO Z0CASE VALUES('2011-11-01');
INSERT INTO Z0CASE VALUES('22:22:35');
INSERT INTO Z0CASE VALUES(12.345);
INSERT INTO Z0CASE VALUES(null);
SELECT table_name,column_type,COLLATION_NAME,CHARACTER_SET_NAME FROM information_schema.columns WHERE table_name='Z0CASE';
table_name	column_type	COLLATION_NAME	CHARACTER_SET_NAME
z0case	binary(50)	NULL	NULL
SELECT table_name,table_collation FROM information_schema.tables WHERE table_name='Z0CASE';
table_name	table_collation
z0case	gb18030_bin
SELECT T1,HEX(T1) FROM Z0CASE ORDER BY T1*1;
update
UPDATE Z0CASE SET T1=NULL WHERE T1='111';
UPDATE Z0CASE SET T1='12:31:56' WHERE T1=2001;
Warnings:
Warning	1292	Truncated incorrect DECIMAL value: '123'
Warning	1292	Truncated incorrect DECIMAL value: '%^&*[];//\'
Warning	1292	Truncated incorrect DECIMAL value: 'abc'
Warning	1292	Truncated incorrect DECIMAL value: '中文'
Warning	1292	Truncated incorrect DECIMAL value: '111'
Warning	1292	Truncated incorrect DECIMAL value: '2001'
Warning	1292	Truncated incorrect DECIMAL value: '!*?< >aB12 中文'
Warning	1292	Truncated incorrect DECIMAL value: '-'
Warning	1292	Truncated incorrect DECIMAL value: '2021-10-01 12:23:35.54'
Warning	1292	Truncated incorrect DECIMAL value: '2011-11-01'
Warning	1292	Truncated incorrect DECIMAL value: '22:22:35'
Warning	1292	Truncated incorrect DECIMAL value: '12.345'
UPDATE Z0CASE SET T1=1221.34 WHERE T1='2011-11-01';
UPDATE Z0CASE SET T1='Aa1$< >中文' WHERE T1='12.345';
UPDATE Z0CASE SET T1=b'0101101' WHERE T1='abc';
SELECT table_name,column_type,COLLATION_NAME,CHARACTER_SET_NAME FROM information_schema.columns WHERE table_name='Z0CASE';
table_name	column_type	COLLATION_NAME	CHARACTER_SET_NAME
z0case	binary(50)	NULL	NULL
SELECT table_name,table_collation FROM information_schema.tables WHERE table_name='Z0CASE';
table_name	table_collation
z0case	gb18030_bin
SELECT T1,HEX(T1) FROM Z0CASE ORDER BY T1*1;
delete
DELETE FROM Z0CASE WHERE T1=1221.34;
Warnings:
Warning	1292	Truncated incorrect DECIMAL value: '123'
Warning	1292	Truncated incorrect DECIMAL value: '%^&*[];//\'
Warning	1292	Truncated incorrect DECIMAL value: 'abc'
Warning	1292	Truncated incorrect DECIMAL value: '中文'
Warning	1292	Truncated incorrect DECIMAL value: '111'
Warning	1292	Truncated incorrect DECIMAL value: '12:31:56'
Warning	1292	Truncated incorrect DECIMAL value: '!*?< >aB12 中文'
Warning	1292	Truncated incorrect DECIMAL value: '-'
Warning	1292	Truncated incorrect DECIMAL value: '2021-10-01 12:23:35.54'
Warning	1292	Truncated incorrect DECIMAL value: '2011-11-01'
Warning	1292	Truncated incorrect DECIMAL value: '22:22:35'
Warning	1292	Truncated incorrect DECIMAL value: '12.345'
DELETE FROM Z0CASE WHERE T1='2021-10-01 12:23:35.54';
DELETE FROM Z0CASE WHERE T1 IS NULL;
DELETE FROM Z0CASE WHERE T1=b'0101101';
SELECT T1,HEX(T1) FROM Z0CASE ORDER BY T1*1;
ENUM
DROP TABLE Z0CASE;
CREATE TABLE Z0CASE(T1 ENUM('123','abc','中文','%^&*[];//\\','111','2021-10-01 12:23:35.54','2011-11-01','12.345',b'0101101')) DEFAULT charset= utf8mb4 DEFAULT collate = utf8mb4_general_ci;
INSERT INTO Z0CASE VALUES('123');
INSERT INTO Z0CASE VALUES('%^&*[];//\\');
INSERT INTO Z0CASE VALUES(NULL);
INSERT INTO Z0CASE VALUES('abc');
INSERT INTO Z0CASE VALUES('中文');
SELECT * FROM Z0CASE ORDER BY T1*1;
T1
NULL
123
abc
中文
%^&*[];//\
SELECT table_name,column_type,COLLATION_NAME,CHARACTER_SET_NAME FROM information_schema.columns WHERE table_name='Z0CASE';
table_name	column_type	COLLATION_NAME	CHARACTER_SET_NAME
z0case	enum('123','abc','中文','%^&*[];//\','111','2021-10-01 12:23:35.54','2011-11-01','12.345','-')	utf8mb4_general_ci	utf8mb4
SELECT table_name,table_collation FROM information_schema.tables WHERE table_name='Z0CASE';
table_name	table_collation
z0case	utf8mb4_general_ci
ALTER TABLE Z0CASE CONVERT TO CHARACTER SET 'gb18030' COLLATE 'gb18030_bin';
SELECT table_name,table_collation FROM information_schema.tables WHERE table_name='Z0CASE';
table_name	table_collation
z0case	gb18030_bin
SELECT * FROM Z0CASE ORDER BY T1*1;
T1
NULL
123
abc
中文
%^&*[];//\
BIT
DROP TABLE Z0CASE;
CREATE TABLE Z0CASE(T1 BIT(20)) DEFAULT charset= utf8mb4 DEFAULT collate = utf8mb4_general_ci;
INSERT INTO Z0CASE VALUES(b'0101001');
INSERT INTO Z0CASE VALUES(b'111010101010100');
INSERT INTO Z0CASE VALUES(NULL);
SELECT BIN(T1) FROM Z0CASE ORDER BY T1;
BIN(T1)
NULL
101001
111010101010100
SELECT table_name,column_type,COLLATION_NAME,CHARACTER_SET_NAME FROM information_schema.columns WHERE table_name='Z0CASE';
table_name	column_type	COLLATION_NAME	CHARACTER_SET_NAME
z0case	bit(20)	NULL	NULL
SELECT table_name,table_collation FROM information_schema.tables WHERE table_name='Z0CASE';
table_name	table_collation
z0case	utf8mb4_general_ci
ALTER TABLE Z0CASE CONVERT TO CHARACTER SET 'gb18030' COLLATE 'gb18030_bin';
SELECT table_name,table_collation FROM information_schema.tables WHERE table_name='Z0CASE';
table_name	table_collation
z0case	gb18030_bin
SELECT BIN(T1) FROM Z0CASE ORDER BY T1;
BIN(T1)
NULL
101001
111010101010100
insert
INSERT INTO Z0CASE VALUES(111);
INSERT INTO Z0CASE VALUES(b'010110100');
INSERT INTO Z0CASE VALUES(12.345);
INSERT INTO Z0CASE VALUES(null);
INSERT INTO Z0CASE VALUES('2001');
INSERT INTO Z0CASE VALUES('!*?< >aB12 中文');
INSERT INTO Z0CASE VALUES('2021-10-01 12:23:35.54');
INSERT INTO Z0CASE VALUES('2011-11-01');
INSERT INTO Z0CASE VALUES('22:22:35');
SELECT table_name,column_type,COLLATION_NAME,CHARACTER_SET_NAME FROM information_schema.columns WHERE table_name='Z0CASE';
table_name	column_type	COLLATION_NAME	CHARACTER_SET_NAME
z0case	bit(20)	NULL	NULL
SELECT table_name,table_collation FROM information_schema.tables WHERE table_name='Z0CASE';
table_name	table_collation
z0case	gb18030_bin
SELECT BIN(T1) FROM Z0CASE ORDER BY T1;
BIN(T1)
NULL
NULL
1100
101001
1101111
10110100
111010101010100
11111111111111111111
11111111111111111111
11111111111111111111
11111111111111111111
11111111111111111111
update
UPDATE Z0CASE SET T1=NULL WHERE T1=b'0101001';
UPDATE Z0CASE SET T1='22:22:35' WHERE T1=b'1101111';
UPDATE Z0CASE SET T1=12.345 WHERE T1=b'111010101010100';
UPDATE Z0CASE SET T1=b'0101101' WHERE T1=b'11111111111111111111';
SELECT table_name,column_type,COLLATION_NAME,CHARACTER_SET_NAME FROM information_schema.columns WHERE table_name='Z0CASE';
table_name	column_type	COLLATION_NAME	CHARACTER_SET_NAME
z0case	bit(20)	NULL	NULL
SELECT table_name,table_collation FROM information_schema.tables WHERE table_name='Z0CASE';
table_name	table_collation
z0case	gb18030_bin
SELECT BIN(T1) FROM Z0CASE ORDER BY T1;
BIN(T1)
NULL
NULL
NULL
1100
1100
101101
101101
101101
101101
101101
101101
10110100
delete
DELETE FROM Z0CASE WHERE T1 IS NULL;
DELETE FROM Z0CASE WHERE T1=b'11111111111111111111';
SELECT BIN(T1) FROM Z0CASE ORDER BY T1;
BIN(T1)
1100
1100
101101
101101
101101
101101
101101
101101
10110100
INT
DROP TABLE Z0CASE;
CREATE TABLE Z0CASE(T1 INT) DEFAULT charset= utf8mb4 DEFAULT collate = utf8mb4_general_ci;
INSERT INTO Z0CASE VALUES(123);
INSERT INTO Z0CASE VALUES(123.3445);
INSERT INTO Z0CASE VALUES(NULL);
SELECT * FROM Z0CASE ORDER BY T1*1;
T1
NULL
123
123
SELECT table_name,column_type,COLLATION_NAME,CHARACTER_SET_NAME FROM information_schema.columns WHERE table_name='Z0CASE';
table_name	column_type	COLLATION_NAME	CHARACTER_SET_NAME
z0case	int(11)	NULL	NULL
SELECT table_name,table_collation FROM information_schema.tables WHERE table_name='Z0CASE';
table_name	table_collation
z0case	utf8mb4_general_ci
ALTER TABLE Z0CASE CONVERT TO CHARACTER SET 'gb18030' COLLATE 'gb18030_bin';
SELECT table_name,table_collation FROM information_schema.tables WHERE table_name='Z0CASE';
table_name	table_collation
z0case	gb18030_bin
SELECT * FROM Z0CASE ORDER BY T1*1;
T1
NULL
123
123
insert
INSERT INTO Z0CASE VALUES(111);
INSERT INTO Z0CASE VALUES('2001');
INSERT INTO Z0CASE VALUES('!*?< >aB12 中文');
INSERT INTO Z0CASE VALUES(b'0101101');
INSERT INTO Z0CASE VALUES('2021-10-01 12:23:35.54');
INSERT INTO Z0CASE VALUES('2011-11-01');
INSERT INTO Z0CASE VALUES('22:22:35');
INSERT INTO Z0CASE VALUES(12.345);
INSERT INTO Z0CASE VALUES(null);
SELECT table_name,column_type,COLLATION_NAME,CHARACTER_SET_NAME FROM information_schema.columns WHERE table_name='Z0CASE';
table_name	column_type	COLLATION_NAME	CHARACTER_SET_NAME
z0case	int(11)	NULL	NULL
SELECT table_name,table_collation FROM information_schema.tables WHERE table_name='Z0CASE';
table_name	table_collation
z0case	gb18030_bin
SELECT * FROM Z0CASE ORDER BY T1*1;
T1
NULL
NULL
0
12
22
45
111
123
123
2001
2011
2021
update
UPDATE Z0CASE SET T1=NULL WHERE T1='111';
UPDATE Z0CASE SET T1='12:31:56' WHERE T1=2001;
UPDATE Z0CASE SET T1=1221.34 WHERE T1=2011;
UPDATE Z0CASE SET T1='Aa1$< >中文' WHERE T1='123';
UPDATE Z0CASE SET T1=b'0101101' WHERE T1=12;
SELECT table_name,column_type,COLLATION_NAME,CHARACTER_SET_NAME FROM information_schema.columns WHERE table_name='Z0CASE';
table_name	column_type	COLLATION_NAME	CHARACTER_SET_NAME
z0case	int(11)	NULL	NULL
SELECT table_name,table_collation FROM information_schema.tables WHERE table_name='Z0CASE';
table_name	table_collation
z0case	gb18030_bin
SELECT * FROM Z0CASE ORDER BY T1*1;
T1
NULL
NULL
NULL
0
0
0
22
45
45
45
1221
2021
delete
DELETE FROM Z0CASE WHERE T1=1221;
DELETE FROM Z0CASE WHERE T1 IS NULL;
SELECT * FROM Z0CASE ORDER BY T1*1;
T1
0
0
0
22
45
45
45
2021
FLOAT
DROP TABLE Z0CASE;
CREATE TABLE Z0CASE(T1 FLOAT(20,0)) DEFAULT charset= utf8mb4 DEFAULT collate = utf8mb4_general_ci;
INSERT INTO Z0CASE VALUES(123);
INSERT INTO Z0CASE VALUES('123.3445');
INSERT INTO Z0CASE VALUES(641231122123.5445);
INSERT INTO Z0CASE VALUES(NULL);
SELECT * FROM Z0CASE ORDER BY T1*1;
T1
NULL
123
123
641231093760
SELECT table_name,column_type,COLLATION_NAME,CHARACTER_SET_NAME FROM information_schema.columns WHERE table_name='Z0CASE';
table_name	column_type	COLLATION_NAME	CHARACTER_SET_NAME
z0case	float(20,0)	NULL	NULL
SELECT table_name,table_collation FROM information_schema.tables WHERE table_name='Z0CASE';
table_name	table_collation
z0case	utf8mb4_general_ci
ALTER TABLE Z0CASE CONVERT TO CHARACTER SET 'gb18030' COLLATE 'gb18030_bin';
SELECT table_name,table_collation FROM information_schema.tables WHERE table_name='Z0CASE';
table_name	table_collation
z0case	gb18030_bin
SELECT * FROM Z0CASE ORDER BY T1*1;
T1
NULL
123
123
641231093760
insert
INSERT INTO Z0CASE VALUES(111);
INSERT INTO Z0CASE VALUES('2001');
INSERT INTO Z0CASE VALUES('!*?< >aB12 中文');
Warnings:
Warning	1292	Truncated incorrect DOUBLE value: '!*?< >aB12 中文'
INSERT INTO Z0CASE VALUES(b'0101101');
INSERT INTO Z0CASE VALUES('2021-10-01 12:23:35.54');
Warnings:
Warning	1292	Truncated incorrect DOUBLE value: '2021-10-01 12:23:35.54'
INSERT INTO Z0CASE VALUES('2011-11-01');
Warnings:
Warning	1292	Truncated incorrect DOUBLE value: '2011-11-01'
INSERT INTO Z0CASE VALUES('22:22:35');
Warnings:
Warning	1292	Truncated incorrect DOUBLE value: '22:22:35'
INSERT INTO Z0CASE VALUES(12.3456);
INSERT INTO Z0CASE VALUES(null);
SELECT table_name,column_type,COLLATION_NAME,CHARACTER_SET_NAME FROM information_schema.columns WHERE table_name='Z0CASE';
table_name	column_type	COLLATION_NAME	CHARACTER_SET_NAME
z0case	float(20,0)	NULL	NULL
SELECT table_name,table_collation FROM information_schema.tables WHERE table_name='Z0CASE';
table_name	table_collation
z0case	gb18030_bin
SELECT * FROM Z0CASE ORDER BY T1*1;
T1
NULL
NULL
0
12
22
45
111
123
123
2001
2011
2021
641231093760
update
UPDATE Z0CASE SET T1=NULL WHERE T1='111';
UPDATE Z0CASE SET T1='12:31:56' WHERE T1=2001;
Warnings:
Warning	1292	Truncated incorrect DOUBLE value: '12:31:56'
UPDATE Z0CASE SET T1=1221.34 WHERE T1=2021.0;
UPDATE Z0CASE SET T1='Aa1$< >中文' WHERE T1 LIKE'12.34%';
UPDATE Z0CASE SET T1=b'0101101' WHERE T1=0.0;
SELECT table_name,column_type,COLLATION_NAME,CHARACTER_SET_NAME FROM information_schema.columns WHERE table_name='Z0CASE';
table_name	column_type	COLLATION_NAME	CHARACTER_SET_NAME
z0case	float(20,0)	NULL	NULL
SELECT table_name,table_collation FROM information_schema.tables WHERE table_name='Z0CASE';
table_name	table_collation
z0case	gb18030_bin
SELECT * FROM Z0CASE ORDER BY T1*1;
T1
NULL
NULL
NULL
12
12
22
45
45
123
123
1221
2011
641231093760
delete
DELETE FROM Z0CASE WHERE T1 LIKE'1221.34%';
DELETE FROM Z0CASE WHERE T1 IS NULL;
SELECT * FROM Z0CASE ORDER BY T1*1;
T1
12
12
22
45
45
123
123
1221
2011
641231093760
DATE
DROP TABLE Z0CASE;
CREATE TABLE Z0CASE(T1 DATE) DEFAULT charset= utf8mb4 DEFAULT collate = utf8mb4_general_ci;
INSERT INTO Z0CASE VALUES('20210321');
INSERT INTO Z0CASE VALUES('2020-11-21');
INSERT INTO Z0CASE VALUES('2021-01-21 11:58:39.456');
INSERT INTO Z0CASE VALUES(NULL);
SELECT * FROM Z0CASE ORDER BY T1*1;
T1
NULL
2020-11-21
2021-01-21
2021-03-21
SELECT table_name,column_type,COLLATION_NAME,CHARACTER_SET_NAME FROM information_schema.columns WHERE table_name='Z0CASE';
table_name	column_type	COLLATION_NAME	CHARACTER_SET_NAME
z0case	date	NULL	NULL
SELECT table_name,table_collation FROM information_schema.tables WHERE table_name='Z0CASE';
table_name	table_collation
z0case	utf8mb4_general_ci
ALTER TABLE Z0CASE CONVERT TO CHARACTER SET 'gb18030' COLLATE 'gb18030_bin';
SELECT table_name,table_collation FROM information_schema.tables WHERE table_name='Z0CASE';
table_name	table_collation
z0case	gb18030_bin
SELECT * FROM Z0CASE ORDER BY T1*1;
T1
NULL
2020-11-21
2021-01-21
2021-03-21
insert
INSERT INTO Z0CASE VALUES(111);
INSERT INTO Z0CASE VALUES('2001');
INSERT INTO Z0CASE VALUES('!*?< >aB12 中文');
INSERT INTO Z0CASE VALUES(b'0101101');
INSERT INTO Z0CASE VALUES('2021-10-01 12:23:35.54');
INSERT INTO Z0CASE VALUES('2011-11-01');
INSERT INTO Z0CASE VALUES('22:22:35');
INSERT INTO Z0CASE VALUES(12.3456);
INSERT INTO Z0CASE VALUES(null);
SELECT table_name,column_type,COLLATION_NAME,CHARACTER_SET_NAME FROM information_schema.columns WHERE table_name='Z0CASE';
table_name	column_type	COLLATION_NAME	CHARACTER_SET_NAME
z0case	date	NULL	NULL
SELECT table_name,table_collation FROM information_schema.tables WHERE table_name='Z0CASE';
table_name	table_collation
z0case	gb18030_bin
SELECT * FROM Z0CASE ORDER BY T1*1;
T1
NULL
NULL
0000-00-00
0000-00-00
0000-00-00
0000-00-00
0000-00-00
2000-01-11
2011-11-01
2020-11-21
2021-01-21
2021-03-21
2021-10-01
update
UPDATE Z0CASE SET T1=NULL WHERE T1='2021-10-01';
UPDATE Z0CASE SET T1='12:31:56' WHERE T1='2021-03-21';
UPDATE Z0CASE SET T1=1221.34 WHERE T1='2021-01-21';
UPDATE Z0CASE SET T1='Aa1$< >中文' WHERE T1='2020-11-21';
UPDATE Z0CASE SET T1=b'0101101' WHERE T1='2011-11-01';
UPDATE Z0CASE SET T1='2011-11-11' WHERE T1='2000-01-11';
UPDATE Z0CASE SET T1='2012-12-21 09:10:21' WHERE T1='0';
SELECT table_name,column_type,COLLATION_NAME,CHARACTER_SET_NAME FROM information_schema.columns WHERE table_name='Z0CASE';
table_name	column_type	COLLATION_NAME	CHARACTER_SET_NAME
z0case	date	NULL	NULL
SELECT table_name,table_collation FROM information_schema.tables WHERE table_name='Z0CASE';
table_name	table_collation
z0case	gb18030_bin
SELECT * FROM Z0CASE ORDER BY T1*1;
T1
NULL
NULL
NULL
2000-12-21
2011-11-11
2012-12-21
2012-12-21
2012-12-21
2012-12-21
2012-12-21
2012-12-21
2012-12-21
2012-12-21
delete
DELETE FROM Z0CASE WHERE T1='2012-12-21';
DELETE FROM Z0CASE WHERE T1 IS NULL;
SELECT * FROM Z0CASE ORDER BY T1*1;
T1
2000-12-21
2011-11-11
TIME
DROP TABLE Z0CASE;
CREATE TABLE Z0CASE(T1 TIME) DEFAULT charset= utf8mb4 DEFAULT collate = utf8mb4_general_ci;
INSERT INTO Z0CASE VALUES('2020-11-21');
INSERT INTO Z0CASE VALUES('2021-01-21 11:58:39.456');
INSERT INTO Z0CASE VALUES('21:28:33.556');
INSERT INTO Z0CASE VALUES('2001');
INSERT INTO Z0CASE VALUES(NULL);
SELECT * FROM Z0CASE ORDER BY T1*1;
T1
NULL
00:20:01
00:20:20
11:58:39
21:28:34
SELECT table_name,column_type,COLLATION_NAME,CHARACTER_SET_NAME FROM information_schema.columns WHERE table_name='Z0CASE';
table_name	column_type	COLLATION_NAME	CHARACTER_SET_NAME
z0case	time	NULL	NULL
SELECT table_name,table_collation FROM information_schema.tables WHERE table_name='Z0CASE';
table_name	table_collation
z0case	utf8mb4_general_ci
ALTER TABLE Z0CASE CONVERT TO CHARACTER SET 'gb18030' COLLATE 'gb18030_bin';
SELECT table_name,table_collation FROM information_schema.tables WHERE table_name='Z0CASE';
table_name	table_collation
z0case	gb18030_bin
SELECT * FROM Z0CASE ORDER BY T1*1;
T1
NULL
00:20:01
00:20:20
11:58:39
21:28:34
insert
INSERT INTO Z0CASE VALUES(71);
INSERT INTO Z0CASE VALUES('2001');
INSERT INTO Z0CASE VALUES('!*?< >aB12 中文');
INSERT INTO Z0CASE VALUES(b'0101101');
INSERT INTO Z0CASE VALUES('2021-10-01 12:23:35.54');
INSERT INTO Z0CASE VALUES('2011-11-01');
INSERT INTO Z0CASE VALUES('22:22:35');
INSERT INTO Z0CASE VALUES(72.7476);
INSERT INTO Z0CASE VALUES(null);
SELECT table_name,column_type,COLLATION_NAME,CHARACTER_SET_NAME FROM information_schema.columns WHERE table_name='Z0CASE';
table_name	column_type	COLLATION_NAME	CHARACTER_SET_NAME
z0case	time	NULL	NULL
SELECT table_name,table_collation FROM information_schema.tables WHERE table_name='Z0CASE';
table_name	table_collation
z0case	gb18030_bin
SELECT * FROM Z0CASE ORDER BY T1*1;
T1
NULL
NULL
00:00:00
00:00:00
00:00:00
00:00:00
00:20:01
00:20:01
00:20:11
00:20:20
11:58:39
12:23:36
21:28:34
22:22:35
update
UPDATE Z0CASE SET T1=NULL WHERE T1='22:22:35';
UPDATE Z0CASE SET T1='12:31:56' WHERE T1='21:28:34';
UPDATE Z0CASE SET T1=1221.34 WHERE T1='12:23:36';
UPDATE Z0CASE SET T1='Aa1$< >中文' WHERE T1='11:58:39';
UPDATE Z0CASE SET T1=b'0101101' WHERE T1='00:20:20';
UPDATE Z0CASE SET T1='2011-11-11' WHERE T1='00:20:01';
UPDATE Z0CASE SET T1='2012-12-21 09:10:21' WHERE T1='0';
SELECT table_name,column_type,COLLATION_NAME,CHARACTER_SET_NAME FROM information_schema.columns WHERE table_name='Z0CASE';
table_name	column_type	COLLATION_NAME	CHARACTER_SET_NAME
z0case	time	NULL	NULL
SELECT table_name,table_collation FROM information_schema.tables WHERE table_name='Z0CASE';
table_name	table_collation
z0case	gb18030_bin
SELECT * FROM Z0CASE ORDER BY T1*1;
T1
NULL
NULL
NULL
00:12:21
00:20:11
00:20:11
00:20:11
09:10:21
09:10:21
09:10:21
09:10:21
09:10:21
09:10:21
12:31:56
delete
DELETE FROM Z0CASE WHERE T1='09:10:21';
DELETE FROM Z0CASE WHERE T1 IS NULL;
SELECT * FROM Z0CASE ORDER BY T1*1;
T1
00:12:21
00:20:11
00:20:11
00:20:11
12:31:56
DROP TABLE Z0CASE;
DROP USER 'zhang'@'%';
DROP DATABASE charset_test;
########Empty recycle bin, delete test database, tables, etc ##########
