purge recyclebin;
# Environmental cleaning
DROP USER zhang;
ERROR HY000: Operation DROP USER failed for 'zhang'@'%'
CREATE USER 'zhang'@'%' IDENTIFIED BY 'zhang';
GRANT all ON *.* TO 'zhang'@'%';
CREATE DATABASE IF NOT EXISTS charset_test;
USE charset_test;
SET sql_mode='';
SELECT @@sql_mode;
@@sql_mode


DROP TABLE Z0CASE;
DROP TABLE Z1CASE;
DROP VIEW V1;
stored procedure
char
CREATE TABLE Z0CASE(T1 CHAR(20) PRIMARY KEY) DEFAULT charset= utf8mb4 DEFAULT collate = utf8mb4_general_ci;
INSERT INTO Z0CASE VALUES(123);
INSERT INTO Z0CASE VALUES('%^&*[];//\\');
INSERT INTO Z0CASE VALUES('abc');
INSERT INTO Z0CASE VALUES('中文');
SELECT T1,HEX(T1) FROM Z0CASE ORDER BY T1*1;
T1	HEX(T1)
%^&*[];//\	255E262A5B5D3B2F2F5C
abc	616263
中文	E4B8ADE69687
123	313233
Warnings:
Warning	1292	Truncated incorrect DOUBLE value: '%^&*[];//\'
Warning	1292	Truncated incorrect DOUBLE value: 'abc'
Warning	1292	Truncated incorrect DOUBLE value: '中文'
SELECT table_name,table_collation FROM information_schema.tables WHERE table_name='Z0CASE';
table_name	table_collation
z0case	utf8mb4_general_ci
ALTER TABLE Z0CASE CONVERT TO CHARACTER SET 'binary' COLLATE 'binary';
SELECT table_name,table_collation FROM information_schema.tables WHERE table_name='Z0CASE';
table_name	table_collation
z0case	binary
CREATE PROCEDURE pro_t1(IN C1 CHAR(20))
BEGIN
SELECT * FROM Z0CASE WHERE T1=C1;
END;
//
CALL pro_t1('abc');
T1
DROP PROCEDURE pro_t1;
DROP TABLE Z0CASE;
CREATE TABLE Z0CASE(T1 CHAR(20) PRIMARY KEY) DEFAULT charset= 'gbk' DEFAULT collate = 'gbk_chinese_ci';
INSERT INTO Z0CASE VALUES(123);
INSERT INTO Z0CASE VALUES('%^&*[];//\\');
INSERT INTO Z0CASE VALUES('abc');
INSERT INTO Z0CASE VALUES('中文');
SELECT T1,HEX(T1) FROM Z0CASE ORDER BY T1*1;
T1	HEX(T1)
%^&*[];//\	255E262A5B5D3B2F2F5C
abc	616263
中文	D6D0CEC4
123	313233
Warnings:
Warning	1292	Truncated incorrect DOUBLE value: '%^&*[];//\'
Warning	1292	Truncated incorrect DOUBLE value: 'abc'
Warning	1292	Truncated incorrect DOUBLE value: '中文'
SELECT table_name,table_collation FROM information_schema.tables WHERE table_name='Z0CASE';
table_name	table_collation
z0case	gbk_chinese_ci
CREATE PROCEDURE pro_t1(IN C1 CHAR(20))
BEGIN
SELECT * FROM Z0CASE WHERE T1=C1;
END;
//
CALL pro_t1('abc');
T1
abc
ALTER TABLE Z0CASE CONVERT TO CHARACTER SET 'binary' COLLATE 'binary';
SELECT table_name,table_collation FROM information_schema.tables WHERE table_name='Z0CASE';
table_name	table_collation
z0case	binary
SHOW PROCEDURE STATUS;
CALL pro_t1('abc');
T1
DROP PROCEDURE pro_t1;
DROP TABLE Z0CASE;
CREATE TABLE Z0CASE(T1 CHAR(20) PRIMARY KEY) DEFAULT charset= utf8mb4 DEFAULT collate = utf8mb4_general_ci;
INSERT INTO Z0CASE VALUES(123);
INSERT INTO Z0CASE VALUES('%^&*[];//\\');
INSERT INTO Z0CASE VALUES('abc');
INSERT INTO Z0CASE VALUES('中文');
SELECT T1,HEX(T1) FROM Z0CASE ORDER BY T1*1;
T1	HEX(T1)
%^&*[];//\	255E262A5B5D3B2F2F5C
abc	616263
中文	E4B8ADE69687
123	313233
Warnings:
Warning	1292	Truncated incorrect DOUBLE value: '%^&*[];//\'
Warning	1292	Truncated incorrect DOUBLE value: 'abc'
Warning	1292	Truncated incorrect DOUBLE value: '中文'
SELECT table_name,table_collation FROM information_schema.tables WHERE table_name='Z0CASE';
table_name	table_collation
z0case	utf8mb4_general_ci
CREATE PROCEDURE pro_t1(IN C1 CHAR(20))
BEGIN
SELECT * FROM Z0CASE WHERE T1=C1;
END;
//
CALL pro_t1('abc');
T1
abc
ALTER TABLE Z0CASE CONVERT TO CHARACTER SET 'utf16' COLLATE 'utf16_unicode_ci';
SELECT table_name,table_collation FROM information_schema.tables WHERE table_name='Z0CASE';
table_name	table_collation
z0case	utf16_unicode_ci
SHOW PROCEDURE STATUS;
ALTER PROCEDURE pro_t1 MODIFIES SQL DATA SQL SECURITY INVOKER;
CALL pro_t1('abc');
T1
abc
DROP PROCEDURE pro_t1;
varchar
DROP TABLE Z0CASE;
CREATE TABLE Z0CASE(T1 VARCHAR(20)) DEFAULT charset= utf8mb4 DEFAULT collate = utf8mb4_general_ci;
INSERT INTO Z0CASE VALUES(123);
INSERT INTO Z0CASE VALUES('%^&*[];//\\');
INSERT INTO Z0CASE VALUES('abc');
INSERT INTO Z0CASE VALUES('中文');
SELECT T1,HEX(T1) FROM Z0CASE ORDER BY T1*1;
T1	HEX(T1)
%^&*[];//\	255E262A5B5D3B2F2F5C
abc	616263
中文	E4B8ADE69687
123	313233
Warnings:
Warning	1292	Truncated incorrect DOUBLE value: '%^&*[];//\'
Warning	1292	Truncated incorrect DOUBLE value: 'abc'
Warning	1292	Truncated incorrect DOUBLE value: '中文'
SELECT table_name,table_collation FROM information_schema.tables WHERE table_name='Z0CASE';
table_name	table_collation
z0case	utf8mb4_general_ci
ALTER TABLE Z0CASE CONVERT TO CHARACTER SET 'gb18030' COLLATE 'gb18030_bin';
SELECT table_name,table_collation FROM information_schema.tables WHERE table_name='Z0CASE';
table_name	table_collation
z0case	gb18030_bin
CREATE PROCEDURE pro_t1(IN C1 VARCHAR(20))
BEGIN
SELECT * FROM Z0CASE WHERE T1=C1;
END;
//
CALL pro_t1('abc');
T1
abc
DROP PROCEDURE pro_t1;
DROP TABLE Z0CASE;
CREATE TABLE Z0CASE(T1 VARCHAR(20) PRIMARY KEY) DEFAULT charset= utf8mb4 DEFAULT collate = utf8mb4_general_ci;
INSERT INTO Z0CASE VALUES(123);
INSERT INTO Z0CASE VALUES('%^&*[];//\\');
INSERT INTO Z0CASE VALUES('abc');
INSERT INTO Z0CASE VALUES('中文');
SELECT T1,HEX(T1) FROM Z0CASE ORDER BY T1*1;
T1	HEX(T1)
%^&*[];//\	255E262A5B5D3B2F2F5C
abc	616263
中文	E4B8ADE69687
123	313233
Warnings:
Warning	1292	Truncated incorrect DOUBLE value: '%^&*[];//\'
Warning	1292	Truncated incorrect DOUBLE value: 'abc'
Warning	1292	Truncated incorrect DOUBLE value: '中文'
SELECT table_name,table_collation FROM information_schema.tables WHERE table_name='Z0CASE';
table_name	table_collation
z0case	utf8mb4_general_ci
CREATE PROCEDURE pro_t1(IN C1 VARCHAR(20))
BEGIN
SELECT * FROM Z0CASE WHERE T1=C1;
END;
//
CALL pro_t1('abc');
T1
abc
ALTER TABLE Z0CASE CONVERT TO CHARACTER SET 'binary' COLLATE 'binary';
SELECT table_name,table_collation FROM information_schema.tables WHERE table_name='Z0CASE';
table_name	table_collation
z0case	binary
SHOW PROCEDURE STATUS;
CALL pro_t1('abc');
T1
abc
DROP PROCEDURE pro_t1;
DROP TABLE Z0CASE;
CREATE TABLE Z0CASE(T1 VARCHAR(20) PRIMARY KEY) DEFAULT charset= utf8mb4 DEFAULT collate = utf8mb4_general_ci;
INSERT INTO Z0CASE VALUES(123);
INSERT INTO Z0CASE VALUES('%^&*[];//\\');
INSERT INTO Z0CASE VALUES('abc');
INSERT INTO Z0CASE VALUES('中文');
SELECT T1,HEX(T1) FROM Z0CASE ORDER BY T1*1;
T1	HEX(T1)
%^&*[];//\	255E262A5B5D3B2F2F5C
abc	616263
中文	E4B8ADE69687
123	313233
Warnings:
Warning	1292	Truncated incorrect DOUBLE value: '%^&*[];//\'
Warning	1292	Truncated incorrect DOUBLE value: 'abc'
Warning	1292	Truncated incorrect DOUBLE value: '中文'
SELECT table_name,table_collation FROM information_schema.tables WHERE table_name='Z0CASE';
table_name	table_collation
z0case	utf8mb4_general_ci
CREATE PROCEDURE pro_t1(IN C1 VARCHAR(20))
BEGIN
SELECT * FROM Z0CASE WHERE T1=C1;
END;
//
CALL pro_t1('abc');
T1
abc
ALTER TABLE Z0CASE CONVERT TO CHARACTER SET 'binary' COLLATE 'binary';
SELECT table_name,table_collation FROM information_schema.tables WHERE table_name='Z0CASE';
table_name	table_collation
z0case	binary
SHOW PROCEDURE STATUS;
ALTER PROCEDURE pro_t1 MODIFIES SQL DATA SQL SECURITY INVOKER;
CALL pro_t1('abc');
T1
abc
DROP PROCEDURE pro_t1;
text
DROP TABLE Z0CASE;
CREATE TABLE Z0CASE(T1 text) DEFAULT charset= utf8mb4 DEFAULT collate = utf8mb4_general_ci;
INSERT INTO Z0CASE VALUES(123);
INSERT INTO Z0CASE VALUES('%^&*[];//\\');
INSERT INTO Z0CASE VALUES('abc');
INSERT INTO Z0CASE VALUES('中文');
SELECT T1,HEX(T1) FROM Z0CASE ORDER BY T1*1;
T1	HEX(T1)
%^&*[];//\	255E262A5B5D3B2F2F5C
abc	616263
中文	E4B8ADE69687
123	313233
Warnings:
Warning	1292	Truncated incorrect DOUBLE value: '%^&*[];//\'
Warning	1292	Truncated incorrect DOUBLE value: 'abc'
Warning	1292	Truncated incorrect DOUBLE value: '中文'
SELECT table_name,table_collation FROM information_schema.tables WHERE table_name='Z0CASE';
table_name	table_collation
z0case	utf8mb4_general_ci
ALTER TABLE Z0CASE CONVERT TO CHARACTER SET 'binary' COLLATE 'binary';
SELECT table_name,table_collation FROM information_schema.tables WHERE table_name='Z0CASE';
table_name	table_collation
z0case	binary
CREATE PROCEDURE pro_t1(IN C1 CHAR(20))
BEGIN
SELECT * FROM Z0CASE WHERE T1=C1;
END;
//
CALL pro_t1('abc');
T1
abc
DROP PROCEDURE pro_t1;
DROP TABLE Z0CASE;
CREATE TABLE Z0CASE(T1 text) DEFAULT charset= utf8mb4 DEFAULT collate = utf8mb4_general_ci;
INSERT INTO Z0CASE VALUES(123);
INSERT INTO Z0CASE VALUES('%^&*[];//\\');
INSERT INTO Z0CASE VALUES('abc');
INSERT INTO Z0CASE VALUES('中文');
SELECT T1,HEX(T1) FROM Z0CASE ORDER BY T1*1;
T1	HEX(T1)
%^&*[];//\	255E262A5B5D3B2F2F5C
abc	616263
中文	E4B8ADE69687
123	313233
Warnings:
Warning	1292	Truncated incorrect DOUBLE value: '%^&*[];//\'
Warning	1292	Truncated incorrect DOUBLE value: 'abc'
Warning	1292	Truncated incorrect DOUBLE value: '中文'
SELECT table_name,table_collation FROM information_schema.tables WHERE table_name='Z0CASE';
table_name	table_collation
z0case	utf8mb4_general_ci
CREATE PROCEDURE pro_t1(IN C1 CHAR(20))
BEGIN
SELECT * FROM Z0CASE WHERE T1=C1;
END;
//
CALL pro_t1('abc');
T1
abc
ALTER TABLE Z0CASE CONVERT TO CHARACTER SET 'binary' COLLATE 'binary';
SELECT table_name,table_collation FROM information_schema.tables WHERE table_name='Z0CASE';
table_name	table_collation
z0case	binary
SHOW PROCEDURE STATUS;
CALL pro_t1('abc');
T1
abc
DROP PROCEDURE pro_t1;
DROP TABLE Z0CASE;
CREATE TABLE Z0CASE(T1 text) DEFAULT charset= utf8mb4 DEFAULT collate = utf8mb4_general_ci;
INSERT INTO Z0CASE VALUES(123);
INSERT INTO Z0CASE VALUES('%^&*[];//\\');
INSERT INTO Z0CASE VALUES('abc');
INSERT INTO Z0CASE VALUES('中文');
SELECT T1,HEX(T1) FROM Z0CASE ORDER BY T1*1;
T1	HEX(T1)
%^&*[];//\	255E262A5B5D3B2F2F5C
abc	616263
中文	E4B8ADE69687
123	313233
Warnings:
Warning	1292	Truncated incorrect DOUBLE value: '%^&*[];//\'
Warning	1292	Truncated incorrect DOUBLE value: 'abc'
Warning	1292	Truncated incorrect DOUBLE value: '中文'
SELECT table_name,table_collation FROM information_schema.tables WHERE table_name='Z0CASE';
table_name	table_collation
z0case	utf8mb4_general_ci
CREATE PROCEDURE pro_t1(IN C1 CHAR(20))
BEGIN
SELECT * FROM Z0CASE WHERE T1=C1;
END;
//
CALL pro_t1('abc');
T1
abc
ALTER TABLE Z0CASE CONVERT TO CHARACTER SET 'binary' COLLATE 'binary';
SELECT table_name,table_collation FROM information_schema.tables WHERE table_name='Z0CASE';
table_name	table_collation
z0case	binary
SHOW PROCEDURE STATUS;
ALTER PROCEDURE pro_t1 MODIFIES SQL DATA SQL SECURITY INVOKER;
CALL pro_t1('abc');
T1
abc
DROP PROCEDURE pro_t1;
VIEW
Create a view, modify the base tables charset and collation, and finally perform DML operations on the view.
Modifying charset and collation of views is not supported.
char
DROP TABLE Z0CASE;
CREATE TABLE Z0CASE(T1 CHAR(20) PRIMARY KEY) DEFAULT charset= utf8mb4 DEFAULT collate = utf8mb4_general_ci;
INSERT INTO Z0CASE VALUES(123);
INSERT INTO Z0CASE VALUES('%^&*[];//\\');
INSERT INTO Z0CASE VALUES('abc');
INSERT INTO Z0CASE VALUES('中文');
SELECT T1,HEX(T1) FROM Z0CASE ORDER BY T1*1;
T1	HEX(T1)
%^&*[];//\	255E262A5B5D3B2F2F5C
abc	616263
中文	E4B8ADE69687
123	313233
Warnings:
Warning	1292	Truncated incorrect DOUBLE value: '%^&*[];//\'
Warning	1292	Truncated incorrect DOUBLE value: 'abc'
Warning	1292	Truncated incorrect DOUBLE value: '中文'
SELECT table_name,table_collation FROM information_schema.tables WHERE table_name='Z0CASE';
table_name	table_collation
z0case	utf8mb4_general_ci
CREATE VIEW V1 AS SELECT * FROM Z0CASE;
SELECT * FROM V1 ORDER BY T1*1;
T1
%^&*[];//\
abc
中文
123
Warnings:
Warning	1292	Truncated incorrect DOUBLE value: '%^&*[];//\'
Warning	1292	Truncated incorrect DOUBLE value: 'abc'
Warning	1292	Truncated incorrect DOUBLE value: '中文'
ALTER TABLE Z0CASE CONVERT TO CHARACTER SET 'binary' COLLATE 'binary';
SELECT table_name,table_collation FROM information_schema.tables WHERE table_name='Z0CASE';
table_name	table_collation
z0case	binary
INSERT INTO V1 VALUES('123');
ERROR 23000: Duplicate entry '123' for key 'PRIMARY'
INSERT INTO V1 VALUES(NULL);
ERROR 23000: Column 'T1' cannot be null
INSERT INTO V1 VALUES('');
SELECT * FROM V1 ORDER BY T1*1;
T1
                    
%^&*[];//\          
abc                 
中文              
123                 
Warnings:
Warning	1292	Truncated incorrect DOUBLE value: ''
Warning	1292	Truncated incorrect DOUBLE value: '%^&*[];//\'
Warning	1292	Truncated incorrect DOUBLE value: '123'
Warning	1292	Truncated incorrect DOUBLE value: 'abc'
Warning	1292	Truncated incorrect DOUBLE value: '中文'
SELECT * FROM Z0CASE ORDER BY T1*1;
T1
                    
%^&*[];//\          
abc                 
中文              
123                 
Warnings:
Warning	1292	Truncated incorrect DOUBLE value: ''
Warning	1292	Truncated incorrect DOUBLE value: '%^&*[];//\'
Warning	1292	Truncated incorrect DOUBLE value: '123'
Warning	1292	Truncated incorrect DOUBLE value: 'abc'
Warning	1292	Truncated incorrect DOUBLE value: '中文'
UPDATE V1 SET T1=NULL WHERE T1='abc';
SELECT * FROM V1 ORDER BY T1*1;
T1
                    
%^&*[];//\          
abc                 
中文              
123                 
Warnings:
Warning	1292	Truncated incorrect DOUBLE value: ''
Warning	1292	Truncated incorrect DOUBLE value: '%^&*[];//\'
Warning	1292	Truncated incorrect DOUBLE value: '123'
Warning	1292	Truncated incorrect DOUBLE value: 'abc'
Warning	1292	Truncated incorrect DOUBLE value: '中文'
SELECT * FROM Z0CASE ORDER BY T1*1;
T1
                    
%^&*[];//\          
abc                 
中文              
123                 
Warnings:
Warning	1292	Truncated incorrect DOUBLE value: ''
Warning	1292	Truncated incorrect DOUBLE value: '%^&*[];//\'
Warning	1292	Truncated incorrect DOUBLE value: '123'
Warning	1292	Truncated incorrect DOUBLE value: 'abc'
Warning	1292	Truncated incorrect DOUBLE value: '中文'
UPDATE V1 SET T1=NULL;
ERROR 23000: Duplicate entry '' for key 'PRIMARY'
UPDATE V1 SET T1='abc';
ERROR 23000: Duplicate entry 'abc' for key 'PRIMARY'
varchar
DROP VIEW V1;
DROP TABLE Z0CASE;
CREATE TABLE Z0CASE(T1 VARCHAR(20) UNIQUE) DEFAULT charset= 'binary' DEFAULT collate = 'binary';
INSERT INTO Z0CASE VALUES(123);
INSERT INTO Z0CASE VALUES('%^&*[];//\\');
INSERT INTO Z0CASE VALUES('abc');
INSERT INTO Z0CASE VALUES('中文');
SELECT * FROM Z0CASE ORDER BY T1*1;
T1
%^&*[];//\
abc
中文
123
Warnings:
Warning	1292	Truncated incorrect DOUBLE value: '%^&*[];//\'
Warning	1292	Truncated incorrect DOUBLE value: 'abc'
Warning	1292	Truncated incorrect DOUBLE value: '中文'
SELECT table_name,table_collation FROM information_schema.tables WHERE table_name='Z0CASE';
table_name	table_collation
z0case	binary
CREATE VIEW V1 AS SELECT * FROM Z0CASE;
SELECT * FROM V1 ORDER BY T1*1;
T1
%^&*[];//\
abc
中文
123
Warnings:
Warning	1292	Truncated incorrect DOUBLE value: '%^&*[];//\'
Warning	1292	Truncated incorrect DOUBLE value: 'abc'
Warning	1292	Truncated incorrect DOUBLE value: '中文'
ALTER TABLE Z0CASE CONVERT TO CHARACTER SET 'gbk' COLLATE 'gbk_bin';
SELECT table_name,table_collation FROM information_schema.tables WHERE table_name='Z0CASE';
table_name	table_collation
z0case	gbk_bin
INSERT INTO V1 VALUES('123');
ERROR 23000: Duplicate entry '123' for key 'T1'
INSERT INTO V1 VALUES(NULL);
INSERT INTO V1 VALUES('');
INSERT INTO V1 VALUES('test aa/bb/[c]');
SELECT T1,HEX(T1) FROM V1 ORDER BY T1*1;
T1	HEX(T1)
NULL	NULL
%^&*[];//\	255E262A5B5D3B2F2F5C
abc	616263
中文	E4B8ADE69687
	
test aa/bb/[c]	746573742061612F62622F5B635D
123	313233
Warnings:
Warning	1292	Truncated incorrect DOUBLE value: '%^&*[];//\'
Warning	1292	Truncated incorrect DOUBLE value: 'abc'
Warning	1292	Truncated incorrect DOUBLE value: '中文'
Warning	1292	Truncated incorrect DOUBLE value: 'test aa/bb/[c]'
SELECT T1,HEX(T1) FROM Z0CASE ORDER BY T1*1;
T1	HEX(T1)
NULL	NULL
%^&*[];//\	255E262A5B5D3B2F2F5C
abc	616263
中文	E4B8ADE69687
	
test aa/bb/[c]	746573742061612F62622F5B635D
123	313233
Warnings:
Warning	1292	Truncated incorrect DOUBLE value: '%^&*[];//\'
Warning	1292	Truncated incorrect DOUBLE value: 'abc'
Warning	1292	Truncated incorrect DOUBLE value: '中文'
Warning	1292	Truncated incorrect DOUBLE value: 'test aa/bb/[c]'
UPDATE V1 SET T1='123' WHERE T1='abc';
ERROR 23000: Duplicate entry '123' for key 'T1'
UPDATE V1 SET T1=NULL WHERE T1='abc';
UPDATE V1 SET T1=1122 WHERE T1='';
SELECT T1,HEX(T1) FROM V1 ORDER BY T1*1;
T1	HEX(T1)
NULL	NULL
NULL	NULL
%^&*[];//\	255E262A5B5D3B2F2F5C
中文	E4B8ADE69687
test aa/bb/[c]	746573742061612F62622F5B635D
123	313233
1122	31313232
Warnings:
Warning	1292	Truncated incorrect DOUBLE value: '%^&*[];//\'
Warning	1292	Truncated incorrect DOUBLE value: '中文'
Warning	1292	Truncated incorrect DOUBLE value: 'test aa/bb/[c]'
SELECT T1,HEX(T1) FROM Z0CASE ORDER BY T1*1;
T1	HEX(T1)
NULL	NULL
NULL	NULL
%^&*[];//\	255E262A5B5D3B2F2F5C
中文	E4B8ADE69687
test aa/bb/[c]	746573742061612F62622F5B635D
123	313233
1122	31313232
Warnings:
Warning	1292	Truncated incorrect DOUBLE value: '%^&*[];//\'
Warning	1292	Truncated incorrect DOUBLE value: '中文'
Warning	1292	Truncated incorrect DOUBLE value: 'test aa/bb/[c]'
text
DROP VIEW V1;
DROP TABLE Z0CASE;
CREATE TABLE Z0CASE(T1 text NOT NULL) DEFAULT charset= 'gbk' DEFAULT collate = 'gbk_bin';
INSERT INTO Z0CASE VALUES(123);
INSERT INTO Z0CASE VALUES('%^&*[];//\\');
INSERT INTO Z0CASE VALUES('abc');
INSERT INTO Z0CASE VALUES('中文');
SELECT * FROM Z0CASE ORDER BY T1*1;
T1
%^&*[];//\
abc
中文
123
Warnings:
Warning	1292	Truncated incorrect DOUBLE value: '%^&*[];//\'
Warning	1292	Truncated incorrect DOUBLE value: 'abc'
Warning	1292	Truncated incorrect DOUBLE value: '中文'
SELECT table_name,table_collation FROM information_schema.tables WHERE table_name='Z0CASE';
table_name	table_collation
z0case	gbk_bin
CREATE VIEW V1 AS SELECT * FROM Z0CASE;
SELECT * FROM V1 ORDER BY T1*1;
T1
%^&*[];//\
abc
中文
123
Warnings:
Warning	1292	Truncated incorrect DOUBLE value: '%^&*[];//\'
Warning	1292	Truncated incorrect DOUBLE value: 'abc'
Warning	1292	Truncated incorrect DOUBLE value: '中文'
ALTER TABLE Z0CASE CONVERT TO CHARACTER SET 'binary' COLLATE 'binary';
SELECT table_name,table_collation FROM information_schema.tables WHERE table_name='Z0CASE';
table_name	table_collation
z0case	binary
INSERT INTO V1 VALUES(NULL);
ERROR 23000: Column 'T1' cannot be null
INSERT INTO V1 VALUES('');
INSERT INTO V1 VALUES('国家');
SELECT * FROM V1 ORDER BY T1*1;
T1
%^&*[];//\
abc
����

国家
123
Warnings:
Warning	1292	Truncated incorrect DOUBLE value: '%^&*[];//\'
Warning	1292	Truncated incorrect DOUBLE value: 'abc'
Warning	1292	Truncated incorrect DOUBLE value: '����'
Warning	1292	Truncated incorrect DOUBLE value: '国家'
SELECT * FROM Z0CASE ORDER BY T1*1;
T1
%^&*[];//\
abc
����

国家
123
Warnings:
Warning	1292	Truncated incorrect DOUBLE value: '%^&*[];//\'
Warning	1292	Truncated incorrect DOUBLE value: 'abc'
Warning	1292	Truncated incorrect DOUBLE value: '����'
Warning	1292	Truncated incorrect DOUBLE value: '国家'
UPDATE V1 SET T1=NULL WHERE T1='';
Warnings:
Warning	1048	Column 'T1' cannot be null
UPDATE V1 SET T1='' WHERE T1='abc';
UPDATE V1 SET T1='test a/b/c' WHERE T1='';
SELECT * FROM V1 ORDER BY T1*1;
T1
%^&*[];//\
test a/b/c
����
test a/b/c
国家
123
Warnings:
Warning	1292	Truncated incorrect DOUBLE value: '%^&*[];//\'
Warning	1292	Truncated incorrect DOUBLE value: 'test a/b/c'
Warning	1292	Truncated incorrect DOUBLE value: '����'
Warning	1292	Truncated incorrect DOUBLE value: 'test a/b/c'
Warning	1292	Truncated incorrect DOUBLE value: '国家'
SELECT * FROM Z0CASE ORDER BY T1*1;
T1
%^&*[];//\
test a/b/c
����
test a/b/c
国家
123
Warnings:
Warning	1292	Truncated incorrect DOUBLE value: '%^&*[];//\'
Warning	1292	Truncated incorrect DOUBLE value: 'test a/b/c'
Warning	1292	Truncated incorrect DOUBLE value: '����'
Warning	1292	Truncated incorrect DOUBLE value: 'test a/b/c'
Warning	1292	Truncated incorrect DOUBLE value: '国家'
DROP VIEW V1;
DROP TABLE Z0CASE;
CREATE TABLE Z0CASE(T1 INT NOT NULL) DEFAULT charset= 'gbk' DEFAULT collate = 'gbk_bin';
INSERT INTO Z0CASE VALUES(123);
INSERT INTO Z0CASE VALUES('122');
SELECT * FROM Z0CASE ORDER BY T1*1;
T1
122
123
SELECT table_name,table_collation FROM information_schema.tables WHERE table_name='Z0CASE';
table_name	table_collation
z0case	gbk_bin
CREATE VIEW V1 AS SELECT * FROM Z0CASE;
SELECT * FROM V1 ORDER BY T1*1;
T1
122
123
ALTER TABLE Z0CASE CONVERT TO CHARACTER SET 'binary' COLLATE 'binary';
SELECT table_name,table_collation FROM information_schema.tables WHERE table_name='Z0CASE';
table_name	table_collation
z0case	binary
INSERT INTO V1 VALUES(NULL);
ERROR 23000: Column 'T1' cannot be null
INSERT INTO V1 VALUES('');
INSERT INTO V1 VALUES('国家');
INSERT INTO V1 VALUES(11);
SELECT * FROM V1 ORDER BY T1*1;
T1
0
0
11
122
123
SELECT * FROM Z0CASE ORDER BY T1*1;
T1
0
0
11
122
123
UPDATE V1 SET T1=NULL WHERE T1=11;
Warnings:
Warning	1048	Column 'T1' cannot be null
UPDATE V1 SET T1='' WHERE T1=11;
UPDATE V1 SET T1='test a/b/c' WHERE T1=11;
UPDATE V1 SET T1='0123' WHERE T1=11;
SELECT * FROM V1 ORDER BY T1*1;
T1
0
0
0
122
123
SELECT * FROM Z0CASE ORDER BY T1*1;
T1
0
0
0
122
123
DROP VIEW V1;
DROP TABLE Z0CASE;
CREATE TABLE Z0CASE(T1 FLOAT(10,0)) DEFAULT charset= 'gbk' DEFAULT collate = 'gbk_bin';
INSERT INTO Z0CASE VALUES(123.3456);
INSERT INTO Z0CASE VALUES('122.864534');
INSERT INTO Z0CASE VALUES('0.005534');
SELECT * FROM Z0CASE ORDER BY T1*1;
T1
0
123
123
SELECT table_name,table_collation FROM information_schema.tables WHERE table_name='Z0CASE';
table_name	table_collation
z0case	gbk_bin
CREATE VIEW V1 AS SELECT * FROM Z0CASE;
SELECT * FROM V1 ORDER BY T1*1;
T1
0
123
123
ALTER TABLE Z0CASE CONVERT TO CHARACTER SET 'utf8mb4' COLLATE 'utf8mb4_general_ci';
SELECT table_name,table_collation FROM information_schema.tables WHERE table_name='Z0CASE';
table_name	table_collation
z0case	utf8mb4_general_ci
INSERT INTO V1 VALUES('');
INSERT INTO V1 VALUES('国家');
Warnings:
Warning	1292	Truncated incorrect DOUBLE value: '国家'
INSERT INTO V1 VALUES(NULL);
INSERT INTO V1 VALUES(11);
SELECT * FROM V1 ORDER BY T1*1;
T1
NULL
0
0
0
11
123
123
SELECT * FROM Z0CASE ORDER BY T1*1;
T1
NULL
0
0
0
11
123
123
UPDATE V1 SET T1='' WHERE T1=0.01;
UPDATE V1 SET T1='test a/b/c' WHERE T1=0.01;
SELECT * FROM V1 ORDER BY T1*1;
T1
NULL
0
0
0
11
123
123
DROP VIEW V1;
DROP TABLE Z0CASE;
CREATE TABLE Z0CASE(T1 TIME(2)) DEFAULT charset= 'gbk' DEFAULT collate = 'gbk_bin';
INSERT INTO Z0CASE VALUES('20:20:14.32567');
INSERT INTO Z0CASE VALUES(0);
INSERT INTO Z0CASE VALUES('2000-12-12 11:12:14.234');
SELECT * FROM Z0CASE ORDER BY T1*1;
T1
00:00:00.00
11:12:14.23
20:20:14.33
SELECT table_name,table_collation FROM information_schema.tables WHERE table_name='Z0CASE';
table_name	table_collation
z0case	gbk_bin
CREATE VIEW V1 AS SELECT * FROM Z0CASE;
SELECT * FROM V1 ORDER BY T1*1;
T1
00:00:00.00
11:12:14.23
20:20:14.33
ALTER TABLE Z0CASE CONVERT TO CHARACTER SET 'utf8mb4' COLLATE 'utf8mb4_general_ci';
SELECT table_name,table_collation FROM information_schema.tables WHERE table_name='Z0CASE';
table_name	table_collation
z0case	utf8mb4_general_ci
INSERT INTO V1 VALUES('');
INSERT INTO V1 VALUES('国家');
INSERT INTO V1 VALUES(NULL);
INSERT INTO V1 VALUES(11);
SELECT * FROM V1 ORDER BY T1*1;
T1
NULL
00:00:00.00
00:00:00.00
00:00:00.00
00:00:11.00
11:12:14.23
20:20:14.33
SELECT * FROM Z0CASE ORDER BY T1*1;
T1
NULL
00:00:00.00
00:00:00.00
00:00:00.00
00:00:11.00
11:12:14.23
20:20:14.33
UPDATE V1 SET T1='' WHERE T1='20:20:14.33';
UPDATE V1 SET T1='test a/b/c' WHERE T1='20:20:14.33';
SELECT * FROM V1 ORDER BY T1*1;
T1
NULL
00:00:00.00
00:00:00.00
00:00:00.00
00:00:00.00
00:00:11.00
11:12:14.23
UPDATE V1 SET T1=NULL WHERE T1='20:20:14.33';
UPDATE V1 SET T1='123' WHERE T1=' 00:00:00.00';
SELECT * FROM V1 ORDER BY T1*1;
T1
NULL
00:00:11.00
00:01:23.00
00:01:23.00
00:01:23.00
00:01:23.00
11:12:14.23
SELECT * FROM Z0CASE ORDER BY T1*1;
T1
NULL
00:00:11.00
00:01:23.00
00:01:23.00
00:01:23.00
00:01:23.00
11:12:14.23
trigger
DROP VIEW V1;
DROP TABLE Z0CASE;
CREATE TABLE Z1CASE(C1 INT,C2 CHAR(20)) DEFAULT charset= utf8mb4 DEFAULT collate = utf8mb4_general_ci;
CREATE TABLE Z0CASE(T1 INT,T2 VARCHAR(20)) DEFAULT charset= 'binary' DEFAULT collate = 'binary';
INSERT INTO Z0CASE VALUES(1,123);
INSERT INTO Z0CASE VALUES(2,'aa');
INSERT INTO Z1CASE VALUES(1,'%^&*[];//\\');
INSERT INTO Z1CASE VALUES(2,'abc');
INSERT INTO Z1CASE VALUES(3,'中文');
SELECT C1,C2 FROM Z1CASE ORDER BY C1;
C1	C2
1	%^&*[];//\
2	abc
3	中文
SELECT T1,T2 FROM Z0CASE ORDER BY T1;
T1	T2
1	123
2	aa
SELECT table_name,table_collation FROM information_schema.tables WHERE table_name='Z0CASE';
table_name	table_collation
z0case	binary
SELECT table_name,table_collation FROM information_schema.tables WHERE table_name='Z1CASE';
table_name	table_collation
z1case	utf8mb4_general_ci
CREATE TRIGGER tg_t1 AFTER INSERT ON Z1CASE FOR EACH ROW
BEGIN
UPDATE Z0CASE SET T2=T2-1 WHERE T1=1;
END;
//
SHOW TRIGGERS;
Trigger	Event	Table	Statement	Timing	Created	sql_mode	Definer	character_set_client	collation_connection	Database Collation
tg_t1	INSERT	z1case	TRIGGER tg_t1 AFTER INSERT ON Z1CASE FOR EACH ROW
BEGIN
UPDATE Z0CASE SET T2=T2-1 WHERE T1=1;
END	AFTER	2022-11-16 11:16:22		zhang@%	utf8mb4	utf8mb4_general_ci	utf8mb4_general_ci
INSERT INTO Z1CASE VALUES(4,'111');
SELECT T1,T2,HEX(T2) FROM Z0CASE ORDER BY T1;
T1	T2	HEX(T2)
1	122	313232
2	aa	6161
ALTER TABLE Z0CASE CONVERT TO CHARACTER SET 'utf8mb4' COLLATE 'utf8mb4_bin';
SELECT table_name,table_collation FROM information_schema.tables WHERE table_name='Z0CASE';
table_name	table_collation
z0case	utf8mb4_bin
INSERT INTO Z1CASE VALUES(5,'C');
SELECT T1,T2,HEX(T2) FROM Z0CASE ORDER BY T1;
T1	T2	HEX(T2)
1	121	313231
2	aa	6161
UPDATE Z1CASE SET C2='国家' WHERE C1='4';
SELECT C1,C2 FROM Z1CASE ORDER BY C1;
C1	C2
1	%^&*[];//\
2	abc
3	中文
4	国家
5	C
SELECT T1,T2,HEX(T2) FROM Z0CASE ORDER BY T1;
T1	T2	HEX(T2)
1	121	313231
2	aa	6161
DROP TRIGGER tg_t1;
DROP TABLE Z1CASE;
DROP TABLE Z0CASE;
CREATE TABLE Z1CASE(C1 INT,C2 FLOAT(10,0)) DEFAULT charset= utf8mb4 DEFAULT collate = utf8mb4_general_ci;
CREATE TABLE Z0CASE(T1 INT,T2 INT) DEFAULT charset= 'binary' DEFAULT collate = 'binary';
INSERT INTO Z0CASE VALUES(1,123);
INSERT INTO Z0CASE VALUES(2,'12.454');
INSERT INTO Z1CASE VALUES(1,'11');
INSERT INTO Z1CASE VALUES(2,22);
INSERT INTO Z1CASE VALUES(3,'33');
SELECT C1,C2 FROM Z1CASE ORDER BY C1;
C1	C2
1	11
2	22
3	33
SELECT T1,T2 FROM Z0CASE ORDER BY T1;
T1	T2
1	123
2	12
SELECT table_name,table_collation FROM information_schema.tables WHERE table_name='Z0CASE';
table_name	table_collation
z0case	binary
SELECT table_name,table_collation FROM information_schema.tables WHERE table_name='Z1CASE';
table_name	table_collation
z1case	utf8mb4_general_ci
CREATE TRIGGER tg_t1 AFTER INSERT ON Z1CASE FOR EACH ROW
BEGIN
UPDATE Z0CASE SET T2=T2-1 WHERE T1=1;
END;
//
SHOW TRIGGERS;
Trigger	Event	Table	Statement	Timing	Created	sql_mode	Definer	character_set_client	collation_connection	Database Collation
tg_t1	INSERT	z1case	TRIGGER tg_t1 AFTER INSERT ON Z1CASE FOR EACH ROW
BEGIN
UPDATE Z0CASE SET T2=T2-1 WHERE T1=1;
END	AFTER	2022-11-16 11:16:22		zhang@%	utf8mb4	utf8mb4_general_ci	utf8mb4_general_ci
INSERT INTO Z1CASE VALUES(4,'111');
SELECT T1,T2,HEX(T2) FROM Z0CASE ORDER BY T1;
T1	T2	HEX(T2)
1	122	7A
2	12	C
ALTER TABLE Z0CASE CONVERT TO CHARACTER SET 'utf8mb4' COLLATE 'utf8mb4_bin';
SELECT table_name,table_collation FROM information_schema.tables WHERE table_name='Z0CASE';
table_name	table_collation
z0case	utf8mb4_bin
INSERT INTO Z1CASE VALUES(5,'55');
UPDATE Z1CASE SET C2='44' WHERE C1='4';
SELECT C1,C2 FROM Z1CASE ORDER BY C1;
C1	C2
1	11
2	22
3	33
4	44
5	55
SELECT T1,T2,HEX(T2) FROM Z0CASE ORDER BY T1;
T1	T2	HEX(T2)
1	121	79
2	12	C
DROP TRIGGER tg_t1;
DROP TABLE Z1CASE;
DROP TABLE Z0CASE;
CREATE TABLE Z1CASE(C1 INT,C2 VARCHAR(20)) DEFAULT charset= 'binary' DEFAULT collate = 'binary';
CREATE TABLE Z0CASE(T1 INT,T2 VARCHAR(20)) DEFAULT charset= 'binary' DEFAULT collate = 'binary';
INSERT INTO Z0CASE VALUES(1,123);
INSERT INTO Z0CASE VALUES(2,'AA');
INSERT INTO Z1CASE VALUES(1,'%^&*[];//\\');
INSERT INTO Z1CASE VALUES(2,'abc');
INSERT INTO Z1CASE VALUES(3,'中文');
SELECT C1,C2 FROM Z1CASE ORDER BY C1;
C1	C2
1	%^&*[];//\
2	abc
3	中文
SELECT T1,T2 FROM Z0CASE ORDER BY T1;
T1	T2
1	123
2	AA
SELECT table_name,table_collation FROM information_schema.tables WHERE table_name='Z0CASE';
table_name	table_collation
z0case	binary
SELECT table_name,table_collation FROM information_schema.tables WHERE table_name='Z1CASE';
table_name	table_collation
z1case	binary
CREATE TRIGGER tg_t1 AFTER UPDATE ON Z1CASE FOR EACH ROW
BEGIN
IF NEW.C2 IS NULL THEN
INSERT INTO Z0CASE VALUES(3,'LAL 来 2%…=…￥');
END IF;
END;
//
SHOW TRIGGERS;
Trigger	Event	Table	Statement	Timing	Created	sql_mode	Definer	character_set_client	collation_connection	Database Collation
tg_t1	UPDATE	z1case	TRIGGER tg_t1 AFTER UPDATE ON Z1CASE FOR EACH ROW
BEGIN
IF NEW.C2 IS NULL THEN
INSERT INTO Z0CASE VALUES(3,'LAL 来 2%…=…￥');
END IF;
END	AFTER	2022-11-16 11:16:22		zhang@%	utf8mb4	utf8mb4_general_ci	utf8mb4_general_ci
UPDATE Z1CASE SET C2='' WHERE C1=3;
SELECT C1,C2 FROM Z1CASE ORDER BY C1;
C1	C2
1	%^&*[];//\
2	abc
3	
SELECT T1,T2,HEX(T2) FROM Z0CASE ORDER BY T1;
T1	T2	HEX(T2)
1	123	313233
2	AA	4141
UPDATE Z1CASE SET C2=NULL WHERE C1=3;
SELECT C1,C2 FROM Z1CASE ORDER BY C1;
C1	C2
1	%^&*[];//\
2	abc
3	NULL
SELECT T1,T2,HEX(T2) FROM Z0CASE ORDER BY T1;
T1	T2	HEX(T2)
1	123	313233
2	AA	4141
3	LAL 来 2%…=…￥	4C414C20E69DA5203225E280A63DE280A6EFBFA5
ALTER TABLE Z0CASE CONVERT TO CHARACTER SET 'gbk' COLLATE 'gbk_bin';
SELECT table_name,table_collation FROM information_schema.tables WHERE table_name='Z0CASE';
table_name	table_collation
z0case	gbk_bin
UPDATE Z1CASE SET C2='' WHERE C1='3';
SELECT C1,C2 FROM Z1CASE ORDER BY C1;
C1	C2
1	%^&*[];//\
2	abc
3	
SELECT T1,T2,HEX(T2) FROM Z0CASE ORDER BY T1;
T1	T2	HEX(T2)
1	123	313233
2	AA	4141
3	LAL 来 2%…=…￥	4C414C20E69DA5203225E280A63DE280A6EFBFA5
UPDATE Z1CASE SET C2=NULL WHERE C1=3;
SELECT C1,C2 FROM Z1CASE ORDER BY C1;
C1	C2
1	%^&*[];//\
2	abc
3	NULL
SELECT T1,T2,HEX(T2) FROM Z0CASE ORDER BY T1;
T1	T2	HEX(T2)
1	123	313233
2	AA	4141
3	LAL 来 2%…=…￥	4C414C20E69DA5203225E280A63DE280A6EFBFA5
3	LAL 来 2%…=…￥	4C414C20E69DA5203225E280A63DE280A6EFBFA5
DROP TRIGGER tg_t1;
DROP TABLE Z1CASE;
DROP TABLE Z0CASE;
CREATE TABLE Z1CASE(C1 INT,C2 CHAR(20)) DEFAULT charset= utf8mb4 DEFAULT collate = utf8mb4_general_ci;
CREATE TABLE Z0CASE(T1 INT,T2 TEXT) DEFAULT charset= utf8mb4 DEFAULT collate = utf8mb4_general_ci;
INSERT INTO Z0CASE VALUES(1,123);
INSERT INTO Z0CASE VALUES(2,'AA');
INSERT INTO Z1CASE VALUES(1,'%^&*[];//\\');
INSERT INTO Z1CASE VALUES(2,'abc');
INSERT INTO Z1CASE VALUES(3,'中文');
SELECT C1,C2 FROM Z1CASE ORDER BY C1;
C1	C2
1	%^&*[];//\
2	abc
3	中文
SELECT T1,T2 FROM Z0CASE ORDER BY T1;
T1	T2
1	123
2	AA
SELECT table_name,table_collation FROM information_schema.tables WHERE table_name='Z0CASE';
table_name	table_collation
z0case	utf8mb4_general_ci
SELECT table_name,table_collation FROM information_schema.tables WHERE table_name='Z1CASE';
table_name	table_collation
z1case	utf8mb4_general_ci
CREATE TRIGGER tg_t1 AFTER DELETE ON Z1CASE FOR EACH ROW
BEGIN
IF OLD.C1=3 THEN
INSERT INTO Z0CASE VALUES(OLD.C1,'LAL 来 2%…=…￥');
END IF;
END;
//
SHOW TRIGGERS;
Trigger	Event	Table	Statement	Timing	Created	sql_mode	Definer	character_set_client	collation_connection	Database Collation
tg_t1	DELETE	z1case	TRIGGER tg_t1 AFTER DELETE ON Z1CASE FOR EACH ROW
BEGIN
IF OLD.C1=3 THEN
INSERT INTO Z0CASE VALUES(OLD.C1,'LAL 来 2%…=…￥');
END IF;
END	AFTER	2022-11-16 11:16:22		zhang@%	utf8mb4	utf8mb4_general_ci	utf8mb4_general_ci
DELETE FROM Z1CASE WHERE C1=2;
SELECT C1,C2 FROM Z1CASE ORDER BY C1;
C1	C2
1	%^&*[];//\
3	中文
SELECT T1,T2,HEX(T2) FROM Z0CASE ORDER BY T1;
T1	T2	HEX(T2)
1	123	313233
2	AA	4141
DELETE FROM Z1CASE WHERE C1=3;
SELECT C1,C2 FROM Z1CASE ORDER BY C1;
C1	C2
1	%^&*[];//\
SELECT T1,T2,HEX(T2) FROM Z0CASE ORDER BY T1;
T1	T2	HEX(T2)
1	123	313233
2	AA	4141
3	LAL 来 2%…=…￥	4C414C20E69DA5203225E280A63DE280A6EFBFA5
ALTER TABLE Z0CASE CONVERT TO CHARACTER SET 'gb18030' COLLATE 'gb18030_chinese_ci';
SELECT table_name,table_collation FROM information_schema.tables WHERE table_name='Z0CASE';
table_name	table_collation
z0case	gb18030_chinese_ci
INSERT INTO Z1CASE VALUES(2,'abc');
INSERT INTO Z1CASE VALUES(3,'中文');
DELETE FROM Z0CASE WHERE T1=3;
SELECT C1,C2 FROM Z1CASE ORDER BY C1;
C1	C2
1	%^&*[];//\
2	abc
3	中文
SELECT T1,T2,HEX(T2) FROM Z0CASE ORDER BY T1;
T1	T2	HEX(T2)
1	123	313233
2	AA	4141
DELETE FROM Z1CASE WHERE C1=2;
SELECT C1,C2 FROM Z1CASE ORDER BY C1;
C1	C2
1	%^&*[];//\
3	中文
SELECT T1,T2,HEX(T2) FROM Z0CASE ORDER BY T1;
T1	T2	HEX(T2)
1	123	313233
2	AA	4141
DELETE FROM Z1CASE WHERE C1=3;
SELECT C1,C2 FROM Z1CASE ORDER BY C1;
C1	C2
1	%^&*[];//\
SELECT T1,T2,HEX(T2) FROM Z0CASE ORDER BY T1;
T1	T2	HEX(T2)
1	123	313233
2	AA	4141
3	LAL 来 2%…=…￥	4C414C20C0B4203225A1AD3DA1ADA3A4
DROP TRIGGER tg_t1;
DROP TABLE Z1CASE;
DROP TABLE Z0CASE;
CREATE TABLE Z0CASE(T1 INT,T2 VARCHAR(20)) DEFAULT charset= utf8mb4 DEFAULT collate = utf8mb4_general_ci;
INSERT INTO Z0CASE VALUES(1,123);
INSERT INTO Z0CASE VALUES(2,'AA');
SELECT T1,T2 FROM Z0CASE ORDER BY T1;
T1	T2
1	123
2	AA
SELECT table_name,table_collation FROM information_schema.tables WHERE table_name='Z0CASE';
table_name	table_collation
z0case	utf8mb4_general_ci
CREATE TRIGGER tg_t1 AFTER INSERT ON Z0CASE FOR EACH ROW
BEGIN
UPDATE Z0CASE SET T2='美 over' WHERE T1=1;
END;
//
ALTER TABLE Z0CASE CONVERT TO CHARACTER SET 'utf16' COLLATE 'utf16_unicode_ci';
DROP TRIGGER tg_t1;
ALTER TABLE Z0CASE CONVERT TO CHARACTER SET 'utf16' COLLATE 'utf16_unicode_ci';
SELECT table_name,table_collation FROM information_schema.tables WHERE table_name='Z0CASE';
table_name	table_collation
z0case	utf16_unicode_ci
CREATE TRIGGER tg_t1 BEFORE INSERT ON Z0CASE FOR EACH ROW
BEGIN
IF NEW.T1 IS NULL THEN
SET NEW.T1='0';
END IF;
IF NEW.T2 IS NULL THEN
SET NEW.T2='123 美 over';
END IF;
END;
//
INSERT INTO Z0CASE VALUES(NULL,NULL);
INSERT INTO Z0CASE VALUES(NULL,'hahaha');
SELECT T1,T2 FROM Z0CASE ORDER BY T1;
T1	T2
0	123 美 over
0	hahaha
1	123
2	AA
DROP TABLE Z0CASE;
CREATE TABLE Z0CASE(T1 INT,T2 DATE) DEFAULT charset= utf8mb4 DEFAULT collate = utf8mb4_general_ci;
INSERT INTO Z0CASE VALUES(1,'2020-01-11 12:13:12');
INSERT INTO Z0CASE VALUES(2,'2000-01-04');
SELECT T1,T2 FROM Z0CASE ORDER BY T1;
T1	T2
1	2020-01-11
2	2000-01-04
SELECT table_name,table_collation FROM information_schema.tables WHERE table_name='Z0CASE';
table_name	table_collation
z0case	utf8mb4_general_ci
CREATE TRIGGER tg_t1 AFTER INSERT ON Z0CASE FOR EACH ROW
BEGIN
UPDATE Z0CASE SET T2='0' WHERE T1=1;
END;
//
ALTER TABLE Z0CASE CONVERT TO CHARACTER SET 'utf16' COLLATE 'utf16_unicode_ci';
DROP TRIGGER tg_t1;
ALTER TABLE Z0CASE CONVERT TO CHARACTER SET 'utf16' COLLATE 'utf16_unicode_ci';
SELECT table_name,table_collation FROM information_schema.tables WHERE table_name='Z0CASE';
table_name	table_collation
z0case	utf16_unicode_ci
CREATE TRIGGER tg_t1 BEFORE INSERT ON Z0CASE FOR EACH ROW
BEGIN
IF NEW.T1 IS NULL THEN
SET NEW.T1='0';
END IF;
IF NEW.T2 IS NULL THEN
SET NEW.T2='2021-11-02';
END IF;
END;
//
INSERT INTO Z0CASE VALUES(NULL,NULL);
INSERT INTO Z0CASE VALUES(3,NULL);
SELECT T1,T2 FROM Z0CASE ORDER BY T1;
T1	T2
0	2021-11-02
1	2020-01-11
2	2000-01-04
3	2021-11-02
DROP TABLE Z0CASE;
DROP USER 'zhang'@'%';
DROP DATABASE charset_test;
########Empty recycle bin, delete test database, tables, etc ##########
purge recyclebin;
