purge recyclebin;
# Environmental cleaning
DROP USER zhang;
ERROR HY000: Operation DROP USER failed for 'zhang'@'%'
CREATE USER 'zhang'@'%' IDENTIFIED BY 'zhang';
GRANT all ON *.* TO 'zhang'@'%';
CREATE DATABASE IF NOT EXISTS charset_test;
USE charset_test;
SET sql_mode='';
SELECT @@sql_mode;
@@sql_mode


DROP TABLE Z0CASE;
ERROR 42S02: Unknown table 'charset_test.z0case'
general_list_update  utf8mb4/utf8mb4_general_ci --> utf8mb4/utf8mb4_bin
CHAR
CREATE TABLE Z0CASE(T1 CHAR(50)) DEFAULT charset= utf8mb4 DEFAULT collate = utf8mb4_general_ci;
INSERT INTO Z0CASE VALUES(123);
INSERT INTO Z0CASE VALUES('%^&*[];//\\');
INSERT INTO Z0CASE VALUES(NULL);
INSERT INTO Z0CASE VALUES('abc');
INSERT INTO Z0CASE VALUES('中文');
SELECT * FROM Z0CASE ORDER BY T1;
T1
NULL
%^&*[];//\
123
abc
中文
SELECT table_name,column_type,COLLATION_NAME,CHARACTER_SET_NAME FROM information_schema.columns WHERE table_name='Z0CASE';
table_name	column_type	COLLATION_NAME	CHARACTER_SET_NAME
z0case	char(50)	utf8mb4_general_ci	utf8mb4
SELECT table_name,table_collation FROM information_schema.tables WHERE table_name='Z0CASE';
table_name	table_collation
z0case	utf8mb4_general_ci
ALTER TABLE Z0CASE CONVERT TO CHARACTER SET 'utf8mb4' COLLATE 'utf8mb4_bin';
SELECT table_name,table_collation FROM information_schema.tables WHERE table_name='Z0CASE';
table_name	table_collation
z0case	utf8mb4_bin
SELECT * FROM Z0CASE ORDER BY T1;
T1
NULL
%^&*[];//\
123
abc
中文
insert
INSERT INTO Z0CASE VALUES(111);
INSERT INTO Z0CASE VALUES('2001');
INSERT INTO Z0CASE VALUES('!*?< >aB12 中文');
INSERT INTO Z0CASE VALUES(b'0101101');
INSERT INTO Z0CASE VALUES('2021-10-01 12:23:35.54');
INSERT INTO Z0CASE VALUES('2011-11-01');
INSERT INTO Z0CASE VALUES('22:22:35');
INSERT INTO Z0CASE VALUES(12.345);
INSERT INTO Z0CASE VALUES(null);
SELECT table_name,column_type,COLLATION_NAME,CHARACTER_SET_NAME FROM information_schema.columns WHERE table_name='Z0CASE';
table_name	column_type	COLLATION_NAME	CHARACTER_SET_NAME
z0case	char(50)	utf8mb4_bin	utf8mb4
SELECT table_name,table_collation FROM information_schema.tables WHERE table_name='Z0CASE';
table_name	table_collation
z0case	utf8mb4_bin
SELECT * FROM Z0CASE ORDER BY T1;
T1
NULL
NULL
!*?< >aB12 中文
%^&*[];//\
-
111
12.345
123
2001
2011-11-01
2021-10-01 12:23:35.54
22:22:35
abc
中文
update
UPDATE Z0CASE SET T1=NULL WHERE T1='111';
UPDATE Z0CASE SET T1='12:31:56' WHERE T1=2001;
Warnings:
Warning	1292	Truncated incorrect DECIMAL value: '%^&*[];//\'
Warning	1292	Truncated incorrect DECIMAL value: 'abc'
Warning	1292	Truncated incorrect DECIMAL value: '中文'
Warning	1292	Truncated incorrect DECIMAL value: '!*?< >aB12 中文'
Warning	1292	Truncated incorrect DECIMAL value: '2021-10-01 12:23:35.54'
Warning	1292	Truncated incorrect DECIMAL value: '2011-11-01'
Warning	1292	Truncated incorrect DECIMAL value: '22:22:35'
UPDATE Z0CASE SET T1=1221.34 WHERE T1='2011-11-01';
UPDATE Z0CASE SET T1='Aa1$< >中文' WHERE T1='12.345';
UPDATE Z0CASE SET T1=b'0101101' WHERE T1='abc';
SELECT table_name,column_type,COLLATION_NAME,CHARACTER_SET_NAME FROM information_schema.columns WHERE table_name='Z0CASE';
table_name	column_type	COLLATION_NAME	CHARACTER_SET_NAME
z0case	char(50)	utf8mb4_bin	utf8mb4
SELECT table_name,table_collation FROM information_schema.tables WHERE table_name='Z0CASE';
table_name	table_collation
z0case	utf8mb4_bin
SELECT * FROM Z0CASE ORDER BY T1;
T1
NULL
NULL
NULL
!*?< >aB12 中文
%^&*[];//\
-
-
1221.34
123
12:31:56
2021-10-01 12:23:35.54
22:22:35
Aa1$< >中文
中文
delete
DELETE FROM Z0CASE WHERE T1=1221.34;
Warnings:
Warning	1292	Truncated incorrect DECIMAL value: '%^&*[];//\'
Warning	1292	Truncated incorrect DECIMAL value: '中文'
Warning	1292	Truncated incorrect DECIMAL value: '12:31:56'
Warning	1292	Truncated incorrect DECIMAL value: '!*?< >aB12 中文'
Warning	1292	Truncated incorrect DECIMAL value: '2021-10-01 12:23:35.54'
Warning	1292	Truncated incorrect DECIMAL value: '22:22:35'
Warning	1292	Truncated incorrect DECIMAL value: 'Aa1$< >中文'
DELETE FROM Z0CASE WHERE T1='2021-10-01 12:23:35.54';
DELETE FROM Z0CASE WHERE T1 IS NULL;
DELETE FROM Z0CASE WHERE T1=b'0101101';
SELECT * FROM Z0CASE ORDER BY T1;
T1
!*?< >aB12 中文
%^&*[];//\
123
12:31:56
22:22:35
Aa1$< >中文
中文
VARCHAR
DROP TABLE Z0CASE;
CREATE TABLE Z0CASE(T1 VARCHAR(50)) DEFAULT charset= utf8mb4 DEFAULT collate = utf8mb4_general_ci;
INSERT INTO Z0CASE VALUES(123);
INSERT INTO Z0CASE VALUES('%^&*[];//\\');
INSERT INTO Z0CASE VALUES(NULL);
INSERT INTO Z0CASE VALUES('abc');
INSERT INTO Z0CASE VALUES('中文');
SELECT * FROM Z0CASE ORDER BY T1;
T1
NULL
%^&*[];//\
123
abc
中文
SELECT table_name,column_type,COLLATION_NAME,CHARACTER_SET_NAME FROM information_schema.columns WHERE table_name='Z0CASE';
table_name	column_type	COLLATION_NAME	CHARACTER_SET_NAME
z0case	varchar(50)	utf8mb4_general_ci	utf8mb4
SELECT table_name,table_collation FROM information_schema.tables WHERE table_name='Z0CASE';
table_name	table_collation
z0case	utf8mb4_general_ci
ALTER TABLE Z0CASE CONVERT TO CHARACTER SET 'utf8mb4' COLLATE 'utf8mb4_bin';
SELECT table_name,table_collation FROM information_schema.tables WHERE table_name='Z0CASE';
table_name	table_collation
z0case	utf8mb4_bin
SELECT * FROM Z0CASE ORDER BY T1;
T1
NULL
%^&*[];//\
123
abc
中文
insert
INSERT INTO Z0CASE VALUES(111);
INSERT INTO Z0CASE VALUES('2001');
INSERT INTO Z0CASE VALUES('!*?< >aB12 中文');
INSERT INTO Z0CASE VALUES(b'0101101');
INSERT INTO Z0CASE VALUES('2021-10-01 12:23:35.54');
INSERT INTO Z0CASE VALUES('2011-11-01');
INSERT INTO Z0CASE VALUES('22:22:35');
INSERT INTO Z0CASE VALUES(12.345);
INSERT INTO Z0CASE VALUES(null);
SELECT table_name,column_type,COLLATION_NAME,CHARACTER_SET_NAME FROM information_schema.columns WHERE table_name='Z0CASE';
table_name	column_type	COLLATION_NAME	CHARACTER_SET_NAME
z0case	varchar(50)	utf8mb4_bin	utf8mb4
SELECT table_name,table_collation FROM information_schema.tables WHERE table_name='Z0CASE';
table_name	table_collation
z0case	utf8mb4_bin
SELECT * FROM Z0CASE ORDER BY T1;
T1
NULL
NULL
!*?< >aB12 中文
%^&*[];//\
-
111
12.345
123
2001
2011-11-01
2021-10-01 12:23:35.54
22:22:35
abc
中文
update
UPDATE Z0CASE SET T1=NULL WHERE T1='111';
UPDATE Z0CASE SET T1='12:31:56' WHERE T1=2001;
Warnings:
Warning	1292	Truncated incorrect DECIMAL value: '%^&*[];//\'
Warning	1292	Truncated incorrect DECIMAL value: 'abc'
Warning	1292	Truncated incorrect DECIMAL value: '中文'
Warning	1292	Truncated incorrect DECIMAL value: '!*?< >aB12 中文'
Warning	1292	Truncated incorrect DECIMAL value: '2021-10-01 12:23:35.54'
Warning	1292	Truncated incorrect DECIMAL value: '2011-11-01'
Warning	1292	Truncated incorrect DECIMAL value: '22:22:35'
UPDATE Z0CASE SET T1=1221.34 WHERE T1='2011-11-01';
UPDATE Z0CASE SET T1='Aa1$< >中文' WHERE T1='12.345';
UPDATE Z0CASE SET T1=b'0101101' WHERE T1='abc';
SELECT table_name,column_type,COLLATION_NAME,CHARACTER_SET_NAME FROM information_schema.columns WHERE table_name='Z0CASE';
table_name	column_type	COLLATION_NAME	CHARACTER_SET_NAME
z0case	varchar(50)	utf8mb4_bin	utf8mb4
SELECT table_name,table_collation FROM information_schema.tables WHERE table_name='Z0CASE';
table_name	table_collation
z0case	utf8mb4_bin
SELECT * FROM Z0CASE ORDER BY T1;
T1
NULL
NULL
NULL
!*?< >aB12 中文
%^&*[];//\
-
-
1221.34
123
12:31:56
2021-10-01 12:23:35.54
22:22:35
Aa1$< >中文
中文
delete
DELETE FROM Z0CASE WHERE T1=1221.34;
Warnings:
Warning	1292	Truncated incorrect DECIMAL value: '%^&*[];//\'
Warning	1292	Truncated incorrect DECIMAL value: '中文'
Warning	1292	Truncated incorrect DECIMAL value: '12:31:56'
Warning	1292	Truncated incorrect DECIMAL value: '!*?< >aB12 中文'
Warning	1292	Truncated incorrect DECIMAL value: '2021-10-01 12:23:35.54'
Warning	1292	Truncated incorrect DECIMAL value: '22:22:35'
Warning	1292	Truncated incorrect DECIMAL value: 'Aa1$< >中文'
DELETE FROM Z0CASE WHERE T1='2021-10-01 12:23:35.54';
DELETE FROM Z0CASE WHERE T1 IS NULL;
DELETE FROM Z0CASE WHERE T1=b'0101101';
SELECT * FROM Z0CASE ORDER BY T1;
T1
!*?< >aB12 中文
%^&*[];//\
123
12:31:56
22:22:35
Aa1$< >中文
中文
TINYTEXT
DROP TABLE Z0CASE;
CREATE TABLE Z0CASE(T1 TINYTEXT) DEFAULT charset= utf8mb4 DEFAULT collate = utf8mb4_general_ci;
INSERT INTO Z0CASE VALUES(123);
INSERT INTO Z0CASE VALUES('%^&*[];//\\');
INSERT INTO Z0CASE VALUES(NULL);
INSERT INTO Z0CASE VALUES('abc');
INSERT INTO Z0CASE VALUES('中文');
SELECT * FROM Z0CASE ORDER BY T1;
T1
NULL
%^&*[];//\
123
abc
中文
SELECT table_name,column_type,COLLATION_NAME,CHARACTER_SET_NAME FROM information_schema.columns WHERE table_name='Z0CASE';
table_name	column_type	COLLATION_NAME	CHARACTER_SET_NAME
z0case	tinytext	utf8mb4_general_ci	utf8mb4
SELECT table_name,table_collation FROM information_schema.tables WHERE table_name='Z0CASE';
table_name	table_collation
z0case	utf8mb4_general_ci
ALTER TABLE Z0CASE CONVERT TO CHARACTER SET 'utf8mb4' COLLATE 'utf8mb4_bin';
SELECT table_name,table_collation FROM information_schema.tables WHERE table_name='Z0CASE';
table_name	table_collation
z0case	utf8mb4_bin
SELECT * FROM Z0CASE ORDER BY T1;
T1
NULL
%^&*[];//\
123
abc
中文
insert
INSERT INTO Z0CASE VALUES(111);
INSERT INTO Z0CASE VALUES('2001');
INSERT INTO Z0CASE VALUES('!*?< >aB12 中文');
INSERT INTO Z0CASE VALUES(b'0101101');
INSERT INTO Z0CASE VALUES('2021-10-01 12:23:35.54');
INSERT INTO Z0CASE VALUES('2011-11-01');
INSERT INTO Z0CASE VALUES('22:22:35');
INSERT INTO Z0CASE VALUES(12.345);
INSERT INTO Z0CASE VALUES(null);
SELECT table_name,column_type,COLLATION_NAME,CHARACTER_SET_NAME FROM information_schema.columns WHERE table_name='Z0CASE';
table_name	column_type	COLLATION_NAME	CHARACTER_SET_NAME
z0case	tinytext	utf8mb4_bin	utf8mb4
SELECT table_name,table_collation FROM information_schema.tables WHERE table_name='Z0CASE';
table_name	table_collation
z0case	utf8mb4_bin
SELECT * FROM Z0CASE ORDER BY T1;
T1
NULL
NULL
!*?< >aB12 中文
%^&*[];//\
-
111
12.345
123
2001
2011-11-01
2021-10-01 12:23:35.54
22:22:35
abc
中文
update
UPDATE Z0CASE SET T1=NULL WHERE T1='111';
UPDATE Z0CASE SET T1='12:31:56' WHERE T1=2001;
Warnings:
Warning	1292	Truncated incorrect DECIMAL value: '%^&*[];//\'
Warning	1292	Truncated incorrect DECIMAL value: 'abc'
Warning	1292	Truncated incorrect DECIMAL value: '中文'
Warning	1292	Truncated incorrect DECIMAL value: '!*?< >aB12 中文'
Warning	1292	Truncated incorrect DECIMAL value: '2021-10-01 12:23:35.54'
Warning	1292	Truncated incorrect DECIMAL value: '2011-11-01'
Warning	1292	Truncated incorrect DECIMAL value: '22:22:35'
UPDATE Z0CASE SET T1=1221.34 WHERE T1='2011-11-01';
UPDATE Z0CASE SET T1='Aa1$< >中文' WHERE T1='12.345';
UPDATE Z0CASE SET T1=b'0101101' WHERE T1='abc';
SELECT table_name,column_type,COLLATION_NAME,CHARACTER_SET_NAME FROM information_schema.columns WHERE table_name='Z0CASE';
table_name	column_type	COLLATION_NAME	CHARACTER_SET_NAME
z0case	tinytext	utf8mb4_bin	utf8mb4
SELECT table_name,table_collation FROM information_schema.tables WHERE table_name='Z0CASE';
table_name	table_collation
z0case	utf8mb4_bin
SELECT * FROM Z0CASE ORDER BY T1;
T1
NULL
NULL
NULL
!*?< >aB12 中文
%^&*[];//\
-
-
1221.34
123
12:31:56
2021-10-01 12:23:35.54
22:22:35
Aa1$< >中文
中文
delete
DELETE FROM Z0CASE WHERE T1=1221.34;
Warnings:
Warning	1292	Truncated incorrect DECIMAL value: '%^&*[];//\'
Warning	1292	Truncated incorrect DECIMAL value: '-'
Warning	1292	Truncated incorrect DECIMAL value: '中文'
Warning	1292	Truncated incorrect DECIMAL value: '12:31:56'
Warning	1292	Truncated incorrect DECIMAL value: '!*?< >aB12 中文'
Warning	1292	Truncated incorrect DECIMAL value: '-'
Warning	1292	Truncated incorrect DECIMAL value: '2021-10-01 12:23:35.54'
Warning	1292	Truncated incorrect DECIMAL value: '22:22:35'
Warning	1292	Truncated incorrect DECIMAL value: 'Aa1$< >中文'
DELETE FROM Z0CASE WHERE T1='2021-10-01 12:23:35.54';
DELETE FROM Z0CASE WHERE T1 IS NULL;
DELETE FROM Z0CASE WHERE T1=b'0101101';
SELECT * FROM Z0CASE ORDER BY T1;
T1
!*?< >aB12 中文
%^&*[];//\
123
12:31:56
22:22:35
Aa1$< >中文
中文
TEXT
DROP TABLE Z0CASE;
CREATE TABLE Z0CASE(T1 TEXT) DEFAULT charset= utf8mb4 DEFAULT collate = utf8mb4_general_ci;
INSERT INTO Z0CASE VALUES(123);
INSERT INTO Z0CASE VALUES('%^&*[];//\\');
INSERT INTO Z0CASE VALUES(NULL);
INSERT INTO Z0CASE VALUES('abc');
INSERT INTO Z0CASE VALUES('中文');
SELECT * FROM Z0CASE ORDER BY T1;
T1
NULL
%^&*[];//\
123
abc
中文
SELECT table_name,column_type,COLLATION_NAME,CHARACTER_SET_NAME FROM information_schema.columns WHERE table_name='Z0CASE';
table_name	column_type	COLLATION_NAME	CHARACTER_SET_NAME
z0case	text	utf8mb4_general_ci	utf8mb4
SELECT table_name,table_collation FROM information_schema.tables WHERE table_name='Z0CASE';
table_name	table_collation
z0case	utf8mb4_general_ci
ALTER TABLE Z0CASE CONVERT TO CHARACTER SET 'utf8mb4' COLLATE 'utf8mb4_bin';
SELECT table_name,table_collation FROM information_schema.tables WHERE table_name='Z0CASE';
table_name	table_collation
z0case	utf8mb4_bin
SELECT * FROM Z0CASE ORDER BY T1;
T1
NULL
%^&*[];//\
123
abc
中文
insert
INSERT INTO Z0CASE VALUES(111);
INSERT INTO Z0CASE VALUES('2001');
INSERT INTO Z0CASE VALUES('!*?< >aB12 中文');
INSERT INTO Z0CASE VALUES(b'0101101');
INSERT INTO Z0CASE VALUES('2021-10-01 12:23:35.54');
INSERT INTO Z0CASE VALUES('2011-11-01');
INSERT INTO Z0CASE VALUES('22:22:35');
INSERT INTO Z0CASE VALUES(12.345);
INSERT INTO Z0CASE VALUES(null);
SELECT table_name,column_type,COLLATION_NAME,CHARACTER_SET_NAME FROM information_schema.columns WHERE table_name='Z0CASE';
table_name	column_type	COLLATION_NAME	CHARACTER_SET_NAME
z0case	text	utf8mb4_bin	utf8mb4
SELECT table_name,table_collation FROM information_schema.tables WHERE table_name='Z0CASE';
table_name	table_collation
z0case	utf8mb4_bin
SELECT * FROM Z0CASE ORDER BY T1;
T1
NULL
NULL
!*?< >aB12 中文
%^&*[];//\
-
111
12.345
123
2001
2011-11-01
2021-10-01 12:23:35.54
22:22:35
abc
中文
update
UPDATE Z0CASE SET T1=NULL WHERE T1='111';
UPDATE Z0CASE SET T1='12:31:56' WHERE T1=2001;
Warnings:
Warning	1292	Truncated incorrect DECIMAL value: '%^&*[];//\'
Warning	1292	Truncated incorrect DECIMAL value: 'abc'
Warning	1292	Truncated incorrect DECIMAL value: '中文'
Warning	1292	Truncated incorrect DECIMAL value: '!*?< >aB12 中文'
Warning	1292	Truncated incorrect DECIMAL value: '2021-10-01 12:23:35.54'
Warning	1292	Truncated incorrect DECIMAL value: '2011-11-01'
Warning	1292	Truncated incorrect DECIMAL value: '22:22:35'
UPDATE Z0CASE SET T1=1221.34 WHERE T1='2011-11-01';
UPDATE Z0CASE SET T1='Aa1$< >中文' WHERE T1='12.345';
UPDATE Z0CASE SET T1=b'0101101' WHERE T1='abc';
SELECT table_name,column_type,COLLATION_NAME,CHARACTER_SET_NAME FROM information_schema.columns WHERE table_name='Z0CASE';
table_name	column_type	COLLATION_NAME	CHARACTER_SET_NAME
z0case	text	utf8mb4_bin	utf8mb4
SELECT table_name,table_collation FROM information_schema.tables WHERE table_name='Z0CASE';
table_name	table_collation
z0case	utf8mb4_bin
SELECT * FROM Z0CASE ORDER BY T1;
T1
NULL
NULL
NULL
!*?< >aB12 中文
%^&*[];//\
-
-
1221.34
123
12:31:56
2021-10-01 12:23:35.54
22:22:35
Aa1$< >中文
中文
delete
DELETE FROM Z0CASE WHERE T1=1221.34;
Warnings:
Warning	1292	Truncated incorrect DECIMAL value: '%^&*[];//\'
Warning	1292	Truncated incorrect DECIMAL value: '-'
Warning	1292	Truncated incorrect DECIMAL value: '中文'
Warning	1292	Truncated incorrect DECIMAL value: '12:31:56'
Warning	1292	Truncated incorrect DECIMAL value: '!*?< >aB12 中文'
Warning	1292	Truncated incorrect DECIMAL value: '-'
Warning	1292	Truncated incorrect DECIMAL value: '2021-10-01 12:23:35.54'
Warning	1292	Truncated incorrect DECIMAL value: '22:22:35'
Warning	1292	Truncated incorrect DECIMAL value: 'Aa1$< >中文'
DELETE FROM Z0CASE WHERE T1='2021-10-01 12:23:35.54';
DELETE FROM Z0CASE WHERE T1 IS NULL;
DELETE FROM Z0CASE WHERE T1=b'0101101';
SELECT * FROM Z0CASE ORDER BY T1;
T1
!*?< >aB12 中文
%^&*[];//\
123
12:31:56
22:22:35
Aa1$< >中文
中文
MEDIUMTEXT
DROP TABLE Z0CASE;
CREATE TABLE Z0CASE(T1 MEDIUMTEXT) DEFAULT charset= utf8mb4 DEFAULT collate = utf8mb4_general_ci;
INSERT INTO Z0CASE VALUES(123);
INSERT INTO Z0CASE VALUES('%^&*[];//\\');
INSERT INTO Z0CASE VALUES(NULL);
INSERT INTO Z0CASE VALUES('abc');
INSERT INTO Z0CASE VALUES('中文');
SELECT * FROM Z0CASE ORDER BY T1;
T1
NULL
%^&*[];//\
123
abc
中文
SELECT table_name,column_type,COLLATION_NAME,CHARACTER_SET_NAME FROM information_schema.columns WHERE table_name='Z0CASE';
table_name	column_type	COLLATION_NAME	CHARACTER_SET_NAME
z0case	mediumtext	utf8mb4_general_ci	utf8mb4
SELECT table_name,table_collation FROM information_schema.tables WHERE table_name='Z0CASE';
table_name	table_collation
z0case	utf8mb4_general_ci
ALTER TABLE Z0CASE CONVERT TO CHARACTER SET 'utf8mb4' COLLATE 'utf8mb4_bin';
SELECT table_name,table_collation FROM information_schema.tables WHERE table_name='Z0CASE';
table_name	table_collation
z0case	utf8mb4_bin
SELECT * FROM Z0CASE ORDER BY T1;
T1
NULL
%^&*[];//\
123
abc
中文
insert
INSERT INTO Z0CASE VALUES(111);
INSERT INTO Z0CASE VALUES('2001');
INSERT INTO Z0CASE VALUES('!*?< >aB12 中文');
INSERT INTO Z0CASE VALUES(b'0101101');
INSERT INTO Z0CASE VALUES('2021-10-01 12:23:35.54');
INSERT INTO Z0CASE VALUES('2011-11-01');
INSERT INTO Z0CASE VALUES('22:22:35');
INSERT INTO Z0CASE VALUES(12.345);
INSERT INTO Z0CASE VALUES(null);
SELECT table_name,column_type,COLLATION_NAME,CHARACTER_SET_NAME FROM information_schema.columns WHERE table_name='Z0CASE';
table_name	column_type	COLLATION_NAME	CHARACTER_SET_NAME
z0case	mediumtext	utf8mb4_bin	utf8mb4
SELECT table_name,table_collation FROM information_schema.tables WHERE table_name='Z0CASE';
table_name	table_collation
z0case	utf8mb4_bin
SELECT * FROM Z0CASE ORDER BY T1;
T1
NULL
NULL
!*?< >aB12 中文
%^&*[];//\
-
111
12.345
123
2001
2011-11-01
2021-10-01 12:23:35.54
22:22:35
abc
中文
update
UPDATE Z0CASE SET T1=NULL WHERE T1='111';
UPDATE Z0CASE SET T1='12:31:56' WHERE T1=2001;
Warnings:
Warning	1292	Truncated incorrect DECIMAL value: '%^&*[];//\'
Warning	1292	Truncated incorrect DECIMAL value: 'abc'
Warning	1292	Truncated incorrect DECIMAL value: '中文'
Warning	1292	Truncated incorrect DECIMAL value: '!*?< >aB12 中文'
Warning	1292	Truncated incorrect DECIMAL value: '2021-10-01 12:23:35.54'
Warning	1292	Truncated incorrect DECIMAL value: '2011-11-01'
Warning	1292	Truncated incorrect DECIMAL value: '22:22:35'
UPDATE Z0CASE SET T1=1221.34 WHERE T1='2011-11-01';
UPDATE Z0CASE SET T1='Aa1$< >中文' WHERE T1='12.345';
UPDATE Z0CASE SET T1=b'0101101' WHERE T1='abc';
SELECT table_name,column_type,COLLATION_NAME,CHARACTER_SET_NAME FROM information_schema.columns WHERE table_name='Z0CASE';
table_name	column_type	COLLATION_NAME	CHARACTER_SET_NAME
z0case	mediumtext	utf8mb4_bin	utf8mb4
SELECT table_name,table_collation FROM information_schema.tables WHERE table_name='Z0CASE';
table_name	table_collation
z0case	utf8mb4_bin
SELECT * FROM Z0CASE ORDER BY T1;
T1
NULL
NULL
NULL
!*?< >aB12 中文
%^&*[];//\
-
-
1221.34
123
12:31:56
2021-10-01 12:23:35.54
22:22:35
Aa1$< >中文
中文
delete
DELETE FROM Z0CASE WHERE T1=1221.34;
Warnings:
Warning	1292	Truncated incorrect DECIMAL value: '%^&*[];//\'
Warning	1292	Truncated incorrect DECIMAL value: '-'
Warning	1292	Truncated incorrect DECIMAL value: '中文'
Warning	1292	Truncated incorrect DECIMAL value: '12:31:56'
Warning	1292	Truncated incorrect DECIMAL value: '!*?< >aB12 中文'
Warning	1292	Truncated incorrect DECIMAL value: '-'
Warning	1292	Truncated incorrect DECIMAL value: '2021-10-01 12:23:35.54'
Warning	1292	Truncated incorrect DECIMAL value: '22:22:35'
Warning	1292	Truncated incorrect DECIMAL value: 'Aa1$< >中文'
DELETE FROM Z0CASE WHERE T1='2021-10-01 12:23:35.54';
DELETE FROM Z0CASE WHERE T1 IS NULL;
DELETE FROM Z0CASE WHERE T1=b'0101101';
SELECT * FROM Z0CASE ORDER BY T1;
T1
!*?< >aB12 中文
%^&*[];//\
123
12:31:56
22:22:35
Aa1$< >中文
中文
LONGTEXT
DROP TABLE Z0CASE;
CREATE TABLE Z0CASE(T1 LONGTEXT) DEFAULT charset= utf8mb4 DEFAULT collate = utf8mb4_general_ci;
INSERT INTO Z0CASE VALUES(123);
INSERT INTO Z0CASE VALUES('%^&*[];//\\');
INSERT INTO Z0CASE VALUES(NULL);
INSERT INTO Z0CASE VALUES('abc');
INSERT INTO Z0CASE VALUES('中文');
SELECT * FROM Z0CASE ORDER BY T1;
T1
NULL
%^&*[];//\
123
abc
中文
SELECT table_name,column_type,COLLATION_NAME,CHARACTER_SET_NAME FROM information_schema.columns WHERE table_name='Z0CASE';
table_name	column_type	COLLATION_NAME	CHARACTER_SET_NAME
z0case	longtext	utf8mb4_general_ci	utf8mb4
SELECT table_name,table_collation FROM information_schema.tables WHERE table_name='Z0CASE';
table_name	table_collation
z0case	utf8mb4_general_ci
ALTER TABLE Z0CASE CONVERT TO CHARACTER SET 'utf8mb4' COLLATE 'utf8mb4_bin';
SELECT table_name,table_collation FROM information_schema.tables WHERE table_name='Z0CASE';
table_name	table_collation
z0case	utf8mb4_bin
SELECT * FROM Z0CASE ORDER BY T1;
T1
NULL
%^&*[];//\
123
abc
中文
insert
INSERT INTO Z0CASE VALUES(111);
INSERT INTO Z0CASE VALUES('2001');
INSERT INTO Z0CASE VALUES('!*?< >aB12 中文');
INSERT INTO Z0CASE VALUES(b'0101101');
INSERT INTO Z0CASE VALUES('2021-10-01 12:23:35.54');
INSERT INTO Z0CASE VALUES('2011-11-01');
INSERT INTO Z0CASE VALUES('22:22:35');
INSERT INTO Z0CASE VALUES(12.345);
INSERT INTO Z0CASE VALUES(null);
SELECT table_name,column_type,COLLATION_NAME,CHARACTER_SET_NAME FROM information_schema.columns WHERE table_name='Z0CASE';
table_name	column_type	COLLATION_NAME	CHARACTER_SET_NAME
z0case	longtext	utf8mb4_bin	utf8mb4
SELECT table_name,table_collation FROM information_schema.tables WHERE table_name='Z0CASE';
table_name	table_collation
z0case	utf8mb4_bin
SELECT * FROM Z0CASE ORDER BY T1;
T1
NULL
NULL
!*?< >aB12 中文
%^&*[];//\
-
111
12.345
123
2001
2011-11-01
2021-10-01 12:23:35.54
22:22:35
abc
中文
update
UPDATE Z0CASE SET T1=NULL WHERE T1='111';
UPDATE Z0CASE SET T1='12:31:56' WHERE T1=2001;
Warnings:
Warning	1292	Truncated incorrect DECIMAL value: '%^&*[];//\'
Warning	1292	Truncated incorrect DECIMAL value: 'abc'
Warning	1292	Truncated incorrect DECIMAL value: '中文'
Warning	1292	Truncated incorrect DECIMAL value: '!*?< >aB12 中文'
Warning	1292	Truncated incorrect DECIMAL value: '2021-10-01 12:23:35.54'
Warning	1292	Truncated incorrect DECIMAL value: '2011-11-01'
Warning	1292	Truncated incorrect DECIMAL value: '22:22:35'
UPDATE Z0CASE SET T1=1221.34 WHERE T1='2011-11-01';
UPDATE Z0CASE SET T1='Aa1$< >中文' WHERE T1='12.345';
UPDATE Z0CASE SET T1=b'0101101' WHERE T1='abc';
SELECT table_name,column_type,COLLATION_NAME,CHARACTER_SET_NAME FROM information_schema.columns WHERE table_name='Z0CASE';
table_name	column_type	COLLATION_NAME	CHARACTER_SET_NAME
z0case	longtext	utf8mb4_bin	utf8mb4
SELECT table_name,table_collation FROM information_schema.tables WHERE table_name='Z0CASE';
table_name	table_collation
z0case	utf8mb4_bin
SELECT * FROM Z0CASE ORDER BY T1;
T1
NULL
NULL
NULL
!*?< >aB12 中文
%^&*[];//\
-
-
1221.34
123
12:31:56
2021-10-01 12:23:35.54
22:22:35
Aa1$< >中文
中文
delete
DELETE FROM Z0CASE WHERE T1=1221.34;
Warnings:
Warning	1292	Truncated incorrect DECIMAL value: '%^&*[];//\'
Warning	1292	Truncated incorrect DECIMAL value: '-'
Warning	1292	Truncated incorrect DECIMAL value: '中文'
Warning	1292	Truncated incorrect DECIMAL value: '12:31:56'
Warning	1292	Truncated incorrect DECIMAL value: '!*?< >aB12 中文'
Warning	1292	Truncated incorrect DECIMAL value: '-'
Warning	1292	Truncated incorrect DECIMAL value: '2021-10-01 12:23:35.54'
Warning	1292	Truncated incorrect DECIMAL value: '22:22:35'
Warning	1292	Truncated incorrect DECIMAL value: 'Aa1$< >中文'
DELETE FROM Z0CASE WHERE T1='2021-10-01 12:23:35.54';
DELETE FROM Z0CASE WHERE T1 IS NULL;
DELETE FROM Z0CASE WHERE T1=b'0101101';
SELECT * FROM Z0CASE ORDER BY T1;
T1
!*?< >aB12 中文
%^&*[];//\
123
12:31:56
22:22:35
Aa1$< >中文
中文
BLOB
DROP TABLE Z0CASE;
CREATE TABLE Z0CASE(T1 BLOB) DEFAULT charset= utf8mb4 DEFAULT collate = utf8mb4_general_ci;
INSERT INTO Z0CASE VALUES(123);
INSERT INTO Z0CASE VALUES('%^&*[];//\\');
INSERT INTO Z0CASE VALUES(NULL);
INSERT INTO Z0CASE VALUES('abc');
INSERT INTO Z0CASE VALUES('中文');
SELECT * FROM Z0CASE ORDER BY T1;
T1
NULL
%^&*[];//\
123
abc
中文
SELECT table_name,column_type,COLLATION_NAME,CHARACTER_SET_NAME FROM information_schema.columns WHERE table_name='Z0CASE';
table_name	column_type	COLLATION_NAME	CHARACTER_SET_NAME
z0case	blob	NULL	NULL
SELECT table_name,table_collation FROM information_schema.tables WHERE table_name='Z0CASE';
table_name	table_collation
z0case	utf8mb4_general_ci
ALTER TABLE Z0CASE CONVERT TO CHARACTER SET 'utf8mb4' COLLATE 'utf8mb4_bin';
SELECT table_name,table_collation FROM information_schema.tables WHERE table_name='Z0CASE';
table_name	table_collation
z0case	utf8mb4_bin
SELECT * FROM Z0CASE ORDER BY T1;
T1
NULL
%^&*[];//\
123
abc
中文
insert
INSERT INTO Z0CASE VALUES(111);
INSERT INTO Z0CASE VALUES('2001');
INSERT INTO Z0CASE VALUES('!*?< >aB12 中文');
INSERT INTO Z0CASE VALUES(b'0101101');
INSERT INTO Z0CASE VALUES('2021-10-01 12:23:35.54');
INSERT INTO Z0CASE VALUES('2011-11-01');
INSERT INTO Z0CASE VALUES('22:22:35');
INSERT INTO Z0CASE VALUES(12.345);
INSERT INTO Z0CASE VALUES(null);
SELECT table_name,column_type,COLLATION_NAME,CHARACTER_SET_NAME FROM information_schema.columns WHERE table_name='Z0CASE';
table_name	column_type	COLLATION_NAME	CHARACTER_SET_NAME
z0case	blob	NULL	NULL
SELECT table_name,table_collation FROM information_schema.tables WHERE table_name='Z0CASE';
table_name	table_collation
z0case	utf8mb4_bin
SELECT * FROM Z0CASE ORDER BY T1;
T1
NULL
NULL
!*?< >aB12 中文
%^&*[];//\
-
111
12.345
123
2001
2011-11-01
2021-10-01 12:23:35.54
22:22:35
abc
中文
update
UPDATE Z0CASE SET T1=NULL WHERE T1='111';
UPDATE Z0CASE SET T1='12:31:56' WHERE T1=2001;
Warnings:
Warning	1292	Truncated incorrect DECIMAL value: '%^&*[];//\'
Warning	1292	Truncated incorrect DECIMAL value: 'abc'
Warning	1292	Truncated incorrect DECIMAL value: '中文'
Warning	1292	Truncated incorrect DECIMAL value: '!*?< >aB12 中文'
Warning	1292	Truncated incorrect DECIMAL value: '2021-10-01 12:23:35.54'
Warning	1292	Truncated incorrect DECIMAL value: '2011-11-01'
Warning	1292	Truncated incorrect DECIMAL value: '22:22:35'
UPDATE Z0CASE SET T1=1221.34 WHERE T1='2011-11-01';
UPDATE Z0CASE SET T1='Aa1$< >中文' WHERE T1='12.345';
UPDATE Z0CASE SET T1=b'0101101' WHERE T1='abc';
SELECT table_name,column_type,COLLATION_NAME,CHARACTER_SET_NAME FROM information_schema.columns WHERE table_name='Z0CASE';
table_name	column_type	COLLATION_NAME	CHARACTER_SET_NAME
z0case	blob	NULL	NULL
SELECT table_name,table_collation FROM information_schema.tables WHERE table_name='Z0CASE';
table_name	table_collation
z0case	utf8mb4_bin
SELECT * FROM Z0CASE ORDER BY T1;
T1
NULL
NULL
NULL
!*?< >aB12 中文
%^&*[];//\
-
-
1221.34
123
12:31:56
2021-10-01 12:23:35.54
22:22:35
Aa1$< >中文
中文
delete
DELETE FROM Z0CASE WHERE T1=1221.34;
Warnings:
Warning	1292	Truncated incorrect DECIMAL value: '%^&*[];//\'
Warning	1292	Truncated incorrect DECIMAL value: '-'
Warning	1292	Truncated incorrect DECIMAL value: '中文'
Warning	1292	Truncated incorrect DECIMAL value: '12:31:56'
Warning	1292	Truncated incorrect DECIMAL value: '!*?< >aB12 中文'
Warning	1292	Truncated incorrect DECIMAL value: '-'
Warning	1292	Truncated incorrect DECIMAL value: '2021-10-01 12:23:35.54'
Warning	1292	Truncated incorrect DECIMAL value: '22:22:35'
Warning	1292	Truncated incorrect DECIMAL value: 'Aa1$< >中文'
DELETE FROM Z0CASE WHERE T1='2021-10-01 12:23:35.54';
DELETE FROM Z0CASE WHERE T1 IS NULL;
DELETE FROM Z0CASE WHERE T1=b'0101101';
SELECT * FROM Z0CASE ORDER BY T1;
T1
!*?< >aB12 中文
%^&*[];//\
123
12:31:56
22:22:35
Aa1$< >中文
中文
VARBINARY
DROP TABLE Z0CASE;
CREATE TABLE Z0CASE(T1 VARBINARY(50)) DEFAULT charset= utf8mb4 DEFAULT collate = utf8mb4_general_ci;
INSERT INTO Z0CASE VALUES(123);
INSERT INTO Z0CASE VALUES('%^&*[];//\\');
INSERT INTO Z0CASE VALUES(NULL);
INSERT INTO Z0CASE VALUES('abc');
INSERT INTO Z0CASE VALUES('中文');
SELECT * FROM Z0CASE ORDER BY T1;
T1
NULL
%^&*[];//\
123
abc
中文
SELECT table_name,column_type,COLLATION_NAME,CHARACTER_SET_NAME FROM information_schema.columns WHERE table_name='Z0CASE';
table_name	column_type	COLLATION_NAME	CHARACTER_SET_NAME
z0case	varbinary(50)	NULL	NULL
SELECT table_name,table_collation FROM information_schema.tables WHERE table_name='Z0CASE';
table_name	table_collation
z0case	utf8mb4_general_ci
ALTER TABLE Z0CASE CONVERT TO CHARACTER SET 'utf8mb4' COLLATE 'utf8mb4_bin';
SELECT table_name,table_collation FROM information_schema.tables WHERE table_name='Z0CASE';
table_name	table_collation
z0case	utf8mb4_bin
SELECT * FROM Z0CASE ORDER BY T1;
T1
NULL
%^&*[];//\
123
abc
中文
insert
INSERT INTO Z0CASE VALUES(111);
INSERT INTO Z0CASE VALUES('2001');
INSERT INTO Z0CASE VALUES('!*?< >aB12 中文');
INSERT INTO Z0CASE VALUES(b'0101101');
INSERT INTO Z0CASE VALUES('2021-10-01 12:23:35.54');
INSERT INTO Z0CASE VALUES('2011-11-01');
INSERT INTO Z0CASE VALUES('22:22:35');
INSERT INTO Z0CASE VALUES(12.345);
INSERT INTO Z0CASE VALUES(null);
SELECT table_name,column_type,COLLATION_NAME,CHARACTER_SET_NAME FROM information_schema.columns WHERE table_name='Z0CASE';
table_name	column_type	COLLATION_NAME	CHARACTER_SET_NAME
z0case	varbinary(50)	NULL	NULL
SELECT table_name,table_collation FROM information_schema.tables WHERE table_name='Z0CASE';
table_name	table_collation
z0case	utf8mb4_bin
SELECT * FROM Z0CASE ORDER BY T1;
T1
NULL
NULL
!*?< >aB12 中文
%^&*[];//\
-
111
12.345
123
2001
2011-11-01
2021-10-01 12:23:35.54
22:22:35
abc
中文
update
UPDATE Z0CASE SET T1=NULL WHERE T1='111';
UPDATE Z0CASE SET T1='12:31:56' WHERE T1=2001;
Warnings:
Warning	1292	Truncated incorrect DECIMAL value: '%^&*[];//\'
Warning	1292	Truncated incorrect DECIMAL value: 'abc'
Warning	1292	Truncated incorrect DECIMAL value: '中文'
Warning	1292	Truncated incorrect DECIMAL value: '!*?< >aB12 中文'
Warning	1292	Truncated incorrect DECIMAL value: '2021-10-01 12:23:35.54'
Warning	1292	Truncated incorrect DECIMAL value: '2011-11-01'
Warning	1292	Truncated incorrect DECIMAL value: '22:22:35'
UPDATE Z0CASE SET T1=1221.34 WHERE T1='2011-11-01';
UPDATE Z0CASE SET T1='Aa1$< >中文' WHERE T1='12.345';
UPDATE Z0CASE SET T1=b'0101101' WHERE T1='abc';
SELECT table_name,column_type,COLLATION_NAME,CHARACTER_SET_NAME FROM information_schema.columns WHERE table_name='Z0CASE';
table_name	column_type	COLLATION_NAME	CHARACTER_SET_NAME
z0case	varbinary(50)	NULL	NULL
SELECT table_name,table_collation FROM information_schema.tables WHERE table_name='Z0CASE';
table_name	table_collation
z0case	utf8mb4_bin
SELECT * FROM Z0CASE ORDER BY T1;
T1
NULL
NULL
NULL
!*?< >aB12 中文
%^&*[];//\
-
-
1221.34
123
12:31:56
2021-10-01 12:23:35.54
22:22:35
Aa1$< >中文
中文
delete
DELETE FROM Z0CASE WHERE T1=1221.34;
Warnings:
Warning	1292	Truncated incorrect DECIMAL value: '%^&*[];//\'
Warning	1292	Truncated incorrect DECIMAL value: '中文'
Warning	1292	Truncated incorrect DECIMAL value: '12:31:56'
Warning	1292	Truncated incorrect DECIMAL value: '!*?< >aB12 中文'
Warning	1292	Truncated incorrect DECIMAL value: '2021-10-01 12:23:35.54'
Warning	1292	Truncated incorrect DECIMAL value: '22:22:35'
Warning	1292	Truncated incorrect DECIMAL value: 'Aa1$< >中文'
DELETE FROM Z0CASE WHERE T1='2021-10-01 12:23:35.54';
DELETE FROM Z0CASE WHERE T1 IS NULL;
DELETE FROM Z0CASE WHERE T1=b'0101101';
SELECT * FROM Z0CASE ORDER BY T1;
T1
!*?< >aB12 中文
%^&*[];//\
123
12:31:56
22:22:35
Aa1$< >中文
中文
SET
DROP TABLE Z0CASE;
CREATE TABLE Z0CASE(T1 SET('123','abc','中文','%^&*[];//\\','111','2021-10-01 12:23:35.54','2011-11-01','12.345',b'0101101')) DEFAULT charset= utf8mb4 DEFAULT collate = utf8mb4_general_ci;
INSERT INTO Z0CASE VALUES(123);
INSERT INTO Z0CASE VALUES('%^&*[];//\\');
INSERT INTO Z0CASE VALUES(NULL);
INSERT INTO Z0CASE VALUES('abc');
INSERT INTO Z0CASE VALUES('中文');
SELECT * FROM Z0CASE ORDER BY T1;
T1
NULL
abc
中文
%^&*[];//\
123,abc,%^&*[];//\,111,2021-10-01 12:23:35.54,2011-11-01
SELECT table_name,column_type,COLLATION_NAME,CHARACTER_SET_NAME FROM information_schema.columns WHERE table_name='Z0CASE';
table_name	column_type	COLLATION_NAME	CHARACTER_SET_NAME
z0case	set('123','abc','中文','%^&*[];//\','111','2021-10-01 12:23:35.54','2011-11-01','12.345','-')	utf8mb4_general_ci	utf8mb4
SELECT table_name,table_collation FROM information_schema.tables WHERE table_name='Z0CASE';
table_name	table_collation
z0case	utf8mb4_general_ci
ALTER TABLE Z0CASE CONVERT TO CHARACTER SET 'utf8mb4' COLLATE 'utf8mb4_bin';
SELECT table_name,table_collation FROM information_schema.tables WHERE table_name='Z0CASE';
table_name	table_collation
z0case	utf8mb4_bin
SELECT * FROM Z0CASE ORDER BY T1;
T1
NULL
abc
中文
%^&*[];//\
123,abc,%^&*[];//\,111,2021-10-01 12:23:35.54,2011-11-01
insert
INSERT INTO Z0CASE VALUES(111);
INSERT INTO Z0CASE VALUES(b'0101101');
INSERT INTO Z0CASE VALUES('2021-10-01 12:23:35.54');
INSERT INTO Z0CASE VALUES('2011-11-01');
INSERT INTO Z0CASE VALUES(12.345);
INSERT INTO Z0CASE VALUES(null);
INSERT INTO Z0CASE VALUES('2001');
INSERT INTO Z0CASE VALUES('!*?< >aB12 中文');
INSERT INTO Z0CASE VALUES('22:22:35');
SELECT table_name,column_type,COLLATION_NAME,CHARACTER_SET_NAME FROM information_schema.columns WHERE table_name='Z0CASE';
table_name	column_type	COLLATION_NAME	CHARACTER_SET_NAME
z0case	set('123','abc','中文','%^&*[];//\','111','2021-10-01 12:23:35.54','2011-11-01','12.345','-')	utf8mb4_bin	utf8mb4
SELECT table_name,table_collation FROM information_schema.tables WHERE table_name='Z0CASE';
table_name	table_collation
z0case	utf8mb4_bin
SELECT * FROM Z0CASE ORDER BY T1;
T1
NULL
NULL



abc
中文
%^&*[];//\
中文,%^&*[];//\
2021-10-01 12:23:35.54
2011-11-01
123,abc,中文,%^&*[];//\,2021-10-01 12:23:35.54,2011-11-01
123,abc,%^&*[];//\,111,2021-10-01 12:23:35.54,2011-11-01
-
update
UPDATE Z0CASE SET T1=NULL WHERE T1='111';
UPDATE Z0CASE SET T1='22:22:35' WHERE T1=2001;
UPDATE Z0CASE SET T1=12.345 WHERE T1='2011-11-01';
UPDATE Z0CASE SET T1=b'0101101' WHERE T1='abc';
SELECT table_name,column_type,COLLATION_NAME,CHARACTER_SET_NAME FROM information_schema.columns WHERE table_name='Z0CASE';
table_name	column_type	COLLATION_NAME	CHARACTER_SET_NAME
z0case	set('123','abc','中文','%^&*[];//\','111','2021-10-01 12:23:35.54','2011-11-01','12.345','-')	utf8mb4_bin	utf8mb4
SELECT table_name,table_collation FROM information_schema.tables WHERE table_name='Z0CASE';
table_name	table_collation
z0case	utf8mb4_bin
SELECT * FROM Z0CASE ORDER BY T1;
T1
NULL
NULL



中文
%^&*[];//\
中文,%^&*[];//\
中文,%^&*[];//\
2021-10-01 12:23:35.54
123,abc,中文,%^&*[];//\,2021-10-01 12:23:35.54,2011-11-01
123,abc,%^&*[];//\,111,2021-10-01 12:23:35.54,2011-11-01
-
-
delete
DELETE FROM Z0CASE WHERE T1=12.345;
DELETE FROM Z0CASE WHERE T1='2021-10-01 12:23:35.54';
DELETE FROM Z0CASE WHERE T1 IS NULL;
DELETE FROM Z0CASE WHERE T1=b'0101101';
SELECT * FROM Z0CASE ORDER BY T1;
T1



中文
%^&*[];//\
中文,%^&*[];//\
中文,%^&*[];//\
123,abc,中文,%^&*[];//\,2021-10-01 12:23:35.54,2011-11-01
123,abc,%^&*[];//\,111,2021-10-01 12:23:35.54,2011-11-01
INT
DROP TABLE Z0CASE;
CREATE TABLE Z0CASE(T1 INT) DEFAULT charset= utf8mb4 DEFAULT collate = utf8mb4_general_ci;
INSERT INTO Z0CASE VALUES(123);
INSERT INTO Z0CASE VALUES(123.3445);
INSERT INTO Z0CASE VALUES(NULL);
SELECT * FROM Z0CASE ORDER BY T1;
T1
NULL
123
123
SELECT table_name,column_type,COLLATION_NAME,CHARACTER_SET_NAME FROM information_schema.columns WHERE table_name='Z0CASE';
table_name	column_type	COLLATION_NAME	CHARACTER_SET_NAME
z0case	int(11)	NULL	NULL
SELECT table_name,table_collation FROM information_schema.tables WHERE table_name='Z0CASE';
table_name	table_collation
z0case	utf8mb4_general_ci
ALTER TABLE Z0CASE CONVERT TO CHARACTER SET 'utf8mb4' COLLATE 'utf8mb4_bin';
SELECT table_name,table_collation FROM information_schema.tables WHERE table_name='Z0CASE';
table_name	table_collation
z0case	utf8mb4_bin
SELECT * FROM Z0CASE ORDER BY T1;
T1
NULL
123
123
insert
INSERT INTO Z0CASE VALUES(111);
INSERT INTO Z0CASE VALUES('2001');
INSERT INTO Z0CASE VALUES('!*?< >aB12 中文');
INSERT INTO Z0CASE VALUES(b'0101101');
INSERT INTO Z0CASE VALUES('2021-10-01 12:23:35.54');
INSERT INTO Z0CASE VALUES('2011-11-01');
INSERT INTO Z0CASE VALUES('22:22:35');
INSERT INTO Z0CASE VALUES(12.345);
INSERT INTO Z0CASE VALUES(null);
SELECT table_name,column_type,COLLATION_NAME,CHARACTER_SET_NAME FROM information_schema.columns WHERE table_name='Z0CASE';
table_name	column_type	COLLATION_NAME	CHARACTER_SET_NAME
z0case	int(11)	NULL	NULL
SELECT table_name,table_collation FROM information_schema.tables WHERE table_name='Z0CASE';
table_name	table_collation
z0case	utf8mb4_bin
SELECT * FROM Z0CASE ORDER BY T1;
T1
NULL
NULL
0
12
22
45
111
123
123
2001
2011
2021
update
UPDATE Z0CASE SET T1=NULL WHERE T1='111';
UPDATE Z0CASE SET T1='12:31:56' WHERE T1=2001;
UPDATE Z0CASE SET T1=1221.34 WHERE T1=2001;
UPDATE Z0CASE SET T1='Aa1$< >中文' WHERE T1='111';
UPDATE Z0CASE SET T1=b'0101101' WHERE T1=111;
SELECT table_name,column_type,COLLATION_NAME,CHARACTER_SET_NAME FROM information_schema.columns WHERE table_name='Z0CASE';
table_name	column_type	COLLATION_NAME	CHARACTER_SET_NAME
z0case	int(11)	NULL	NULL
SELECT table_name,table_collation FROM information_schema.tables WHERE table_name='Z0CASE';
table_name	table_collation
z0case	utf8mb4_bin
SELECT * FROM Z0CASE ORDER BY T1;
T1
NULL
NULL
NULL
0
12
12
22
45
123
123
2011
2021
delete
DELETE FROM Z0CASE WHERE T1=1221.34;
DELETE FROM Z0CASE WHERE T1 IS NULL;
SELECT * FROM Z0CASE ORDER BY T1;
T1
0
12
12
22
45
123
123
2011
2021
DOUBLE
DROP TABLE Z0CASE;
CREATE TABLE Z0CASE(T1 DOUBLE(26,0)) DEFAULT charset= utf8mb4 DEFAULT collate = utf8mb4_general_ci;
INSERT INTO Z0CASE VALUES(123);
INSERT INTO Z0CASE VALUES('123.3445');
INSERT INTO Z0CASE VALUES(641231122123.5445);
INSERT INTO Z0CASE VALUES(NULL);
SELECT * FROM Z0CASE ORDER BY T1;
T1
NULL
123
123
641231122124
SELECT table_name,column_type,COLLATION_NAME,CHARACTER_SET_NAME FROM information_schema.columns WHERE table_name='Z0CASE';
table_name	column_type	COLLATION_NAME	CHARACTER_SET_NAME
z0case	double(26,0)	NULL	NULL
SELECT table_name,table_collation FROM information_schema.tables WHERE table_name='Z0CASE';
table_name	table_collation
z0case	utf8mb4_general_ci
ALTER TABLE Z0CASE CONVERT TO CHARACTER SET 'utf8mb4' COLLATE 'utf8mb4_bin';
SELECT table_name,table_collation FROM information_schema.tables WHERE table_name='Z0CASE';
table_name	table_collation
z0case	utf8mb4_bin
SELECT * FROM Z0CASE ORDER BY T1;
T1
NULL
123
123
641231122124
insert
INSERT INTO Z0CASE VALUES(111);
INSERT INTO Z0CASE VALUES('2001');
INSERT INTO Z0CASE VALUES('!*?< >aB12 中文');
Warnings:
Warning	1292	Truncated incorrect DOUBLE value: '!*?< >aB12 中文'
INSERT INTO Z0CASE VALUES(b'0101101');
INSERT INTO Z0CASE VALUES('2021-10-01 12:23:35.54');
Warnings:
Warning	1292	Truncated incorrect DOUBLE value: '2021-10-01 12:23:35.54'
INSERT INTO Z0CASE VALUES('2011-11-01');
Warnings:
Warning	1292	Truncated incorrect DOUBLE value: '2011-11-01'
INSERT INTO Z0CASE VALUES('22:22:35');
Warnings:
Warning	1292	Truncated incorrect DOUBLE value: '22:22:35'
INSERT INTO Z0CASE VALUES(12.3456);
INSERT INTO Z0CASE VALUES(null);
SELECT table_name,column_type,COLLATION_NAME,CHARACTER_SET_NAME FROM information_schema.columns WHERE table_name='Z0CASE';
table_name	column_type	COLLATION_NAME	CHARACTER_SET_NAME
z0case	double(26,0)	NULL	NULL
SELECT table_name,table_collation FROM information_schema.tables WHERE table_name='Z0CASE';
table_name	table_collation
z0case	utf8mb4_bin
SELECT * FROM Z0CASE ORDER BY T1;
T1
NULL
NULL
0
12
22
45
111
123
123
2001
2011
2021
641231122124
update
UPDATE Z0CASE SET T1=NULL WHERE T1='111';
UPDATE Z0CASE SET T1='12:31:56' WHERE T1=2001;
Warnings:
Warning	1292	Truncated incorrect DOUBLE value: '12:31:56'
UPDATE Z0CASE SET T1=1221.34 WHERE T1='2001';
UPDATE Z0CASE SET T1='Aa1$< >中文' WHERE T1=111;
UPDATE Z0CASE SET T1=b'0101101' WHERE T1=111;
SELECT table_name,column_type,COLLATION_NAME,CHARACTER_SET_NAME FROM information_schema.columns WHERE table_name='Z0CASE';
table_name	column_type	COLLATION_NAME	CHARACTER_SET_NAME
z0case	double(26,0)	NULL	NULL
SELECT table_name,table_collation FROM information_schema.tables WHERE table_name='Z0CASE';
table_name	table_collation
z0case	utf8mb4_bin
SELECT * FROM Z0CASE ORDER BY T1;
T1
NULL
NULL
NULL
0
12
12
22
45
123
123
2011
2021
641231122124
delete
DELETE FROM Z0CASE WHERE T1=1221.34;
DELETE FROM Z0CASE WHERE T1 IS NULL;
SELECT * FROM Z0CASE ORDER BY T1;
T1
0
12
12
22
45
123
123
2011
2021
641231122124
DATE
DROP TABLE Z0CASE;
CREATE TABLE Z0CASE(T1 DATE) DEFAULT charset= utf8mb4 DEFAULT collate = utf8mb4_general_ci;
INSERT INTO Z0CASE VALUES('20210321');
INSERT INTO Z0CASE VALUES('2020-11-21');
INSERT INTO Z0CASE VALUES('2021-01-21 11:58:39.456');
INSERT INTO Z0CASE VALUES(NULL);
SELECT * FROM Z0CASE ORDER BY T1;
T1
NULL
2020-11-21
2021-01-21
2021-03-21
SELECT table_name,column_type,COLLATION_NAME,CHARACTER_SET_NAME FROM information_schema.columns WHERE table_name='Z0CASE';
table_name	column_type	COLLATION_NAME	CHARACTER_SET_NAME
z0case	date	NULL	NULL
SELECT table_name,table_collation FROM information_schema.tables WHERE table_name='Z0CASE';
table_name	table_collation
z0case	utf8mb4_general_ci
ALTER TABLE Z0CASE CONVERT TO CHARACTER SET 'utf8mb4' COLLATE 'utf8mb4_bin';
SELECT table_name,table_collation FROM information_schema.tables WHERE table_name='Z0CASE';
table_name	table_collation
z0case	utf8mb4_bin
SELECT * FROM Z0CASE ORDER BY T1;
T1
NULL
2020-11-21
2021-01-21
2021-03-21
insert
INSERT INTO Z0CASE VALUES(111);
INSERT INTO Z0CASE VALUES('2001');
INSERT INTO Z0CASE VALUES('!*?< >aB12 中文');
INSERT INTO Z0CASE VALUES(b'0101101');
INSERT INTO Z0CASE VALUES('2021-10-01 12:23:35.54');
INSERT INTO Z0CASE VALUES('2011-11-01');
INSERT INTO Z0CASE VALUES('22:22:35');
INSERT INTO Z0CASE VALUES(12.3456);
INSERT INTO Z0CASE VALUES(null);
SELECT table_name,column_type,COLLATION_NAME,CHARACTER_SET_NAME FROM information_schema.columns WHERE table_name='Z0CASE';
table_name	column_type	COLLATION_NAME	CHARACTER_SET_NAME
z0case	date	NULL	NULL
SELECT table_name,table_collation FROM information_schema.tables WHERE table_name='Z0CASE';
table_name	table_collation
z0case	utf8mb4_bin
SELECT * FROM Z0CASE ORDER BY T1;
T1
NULL
NULL
0000-00-00
0000-00-00
0000-00-00
0000-00-00
0000-00-00
2000-01-11
2011-11-01
2020-11-21
2021-01-21
2021-03-21
2021-10-01
update
UPDATE Z0CASE SET T1=NULL WHERE T1='2020-11-21';
UPDATE Z0CASE SET T1='12:31:56' WHERE T1='2021-01-21';
UPDATE Z0CASE SET T1=1221.34 WHERE T1='2021-01-21';
UPDATE Z0CASE SET T1='Aa1$< >中文' WHERE T1='2021-01-21';
UPDATE Z0CASE SET T1=b'0101101' WHERE T1='2021-01-21';
UPDATE Z0CASE SET T1='2011-11-11' WHERE T1='2021-01-21';
UPDATE Z0CASE SET T1='2012-12-21 09:10:21' WHERE T1='2011-11-11';
SELECT table_name,column_type,COLLATION_NAME,CHARACTER_SET_NAME FROM information_schema.columns WHERE table_name='Z0CASE';
table_name	column_type	COLLATION_NAME	CHARACTER_SET_NAME
z0case	date	NULL	NULL
SELECT table_name,table_collation FROM information_schema.tables WHERE table_name='Z0CASE';
table_name	table_collation
z0case	utf8mb4_bin
SELECT * FROM Z0CASE ORDER BY T1;
T1
NULL
NULL
NULL
0000-00-00
0000-00-00
0000-00-00
0000-00-00
0000-00-00
0000-00-00
2000-01-11
2011-11-01
2021-03-21
2021-10-01
delete
DELETE FROM Z0CASE WHERE T1='2012-12-21';
DELETE FROM Z0CASE WHERE T1 IS NULL;
SELECT * FROM Z0CASE ORDER BY T1;
T1
0000-00-00
0000-00-00
0000-00-00
0000-00-00
0000-00-00
0000-00-00
2000-01-11
2011-11-01
2021-03-21
2021-10-01
TIME
DROP TABLE Z0CASE;
CREATE TABLE Z0CASE(T1 TIME) DEFAULT charset= utf8mb4 DEFAULT collate = utf8mb4_general_ci;
INSERT INTO Z0CASE VALUES('2020-11-21');
INSERT INTO Z0CASE VALUES('2021-01-21 11:58:39.456');
INSERT INTO Z0CASE VALUES('21:28:33.556');
INSERT INTO Z0CASE VALUES('2001');
INSERT INTO Z0CASE VALUES(NULL);
SELECT * FROM Z0CASE ORDER BY T1;
T1
NULL
00:20:01
00:20:20
11:58:39
21:28:34
SELECT table_name,column_type,COLLATION_NAME,CHARACTER_SET_NAME FROM information_schema.columns WHERE table_name='Z0CASE';
table_name	column_type	COLLATION_NAME	CHARACTER_SET_NAME
z0case	time	NULL	NULL
SELECT table_name,table_collation FROM information_schema.tables WHERE table_name='Z0CASE';
table_name	table_collation
z0case	utf8mb4_general_ci
ALTER TABLE Z0CASE CONVERT TO CHARACTER SET 'utf8mb4' COLLATE 'utf8mb4_bin';
SELECT table_name,table_collation FROM information_schema.tables WHERE table_name='Z0CASE';
table_name	table_collation
z0case	utf8mb4_bin
SELECT * FROM Z0CASE ORDER BY T1;
T1
NULL
00:20:01
00:20:20
11:58:39
21:28:34
insert
INSERT INTO Z0CASE VALUES(71);
INSERT INTO Z0CASE VALUES('2001');
INSERT INTO Z0CASE VALUES('!*?< >aB12 中文');
INSERT INTO Z0CASE VALUES(b'0101101');
INSERT INTO Z0CASE VALUES('2021-10-01 12:23:35.54');
INSERT INTO Z0CASE VALUES('2011-11-01');
INSERT INTO Z0CASE VALUES('22:22:35');
INSERT INTO Z0CASE VALUES(72.7476);
INSERT INTO Z0CASE VALUES(null);
SELECT table_name,column_type,COLLATION_NAME,CHARACTER_SET_NAME FROM information_schema.columns WHERE table_name='Z0CASE';
table_name	column_type	COLLATION_NAME	CHARACTER_SET_NAME
z0case	time	NULL	NULL
SELECT table_name,table_collation FROM information_schema.tables WHERE table_name='Z0CASE';
table_name	table_collation
z0case	utf8mb4_bin
SELECT * FROM Z0CASE ORDER BY T1;
T1
NULL
NULL
00:00:00
00:00:00
00:00:00
00:00:00
00:20:01
00:20:01
00:20:11
00:20:20
11:58:39
12:23:36
21:28:34
22:22:35
update
UPDATE Z0CASE SET T1=NULL WHERE T1='22:22:35';
UPDATE Z0CASE SET T1='12:31:56' WHERE T1='21:28:34';
UPDATE Z0CASE SET T1=1221.34 WHERE T1='12:31:56';
UPDATE Z0CASE SET T1='Aa1$< >中文' WHERE T1='12:31:56';
UPDATE Z0CASE SET T1=b'0101101' WHERE T1='12:31:56';
UPDATE Z0CASE SET T1='2011-11-11' WHERE T1='12:31:56';
UPDATE Z0CASE SET T1='2012-12-21 09:10:21' WHERE T1='12:31:56';
SELECT table_name,column_type,COLLATION_NAME,CHARACTER_SET_NAME FROM information_schema.columns WHERE table_name='Z0CASE';
table_name	column_type	COLLATION_NAME	CHARACTER_SET_NAME
z0case	time	NULL	NULL
SELECT table_name,table_collation FROM information_schema.tables WHERE table_name='Z0CASE';
table_name	table_collation
z0case	utf8mb4_bin
SELECT * FROM Z0CASE ORDER BY T1;
T1
NULL
NULL
NULL
00:00:00
00:00:00
00:00:00
00:00:00
00:12:21
00:20:01
00:20:01
00:20:11
00:20:20
11:58:39
12:23:36
delete
DELETE FROM Z0CASE WHERE T1='09:10:21';
DELETE FROM Z0CASE WHERE T1 IS NULL;
SELECT * FROM Z0CASE ORDER BY T1;
T1
00:00:00
00:00:00
00:00:00
00:00:00
00:12:21
00:20:01
00:20:01
00:20:11
00:20:20
11:58:39
12:23:36
TIMESTAMP
DROP TABLE Z0CASE;
CREATE TABLE Z0CASE(T1 TIMESTAMP) DEFAULT charset= utf8mb4 DEFAULT collate = utf8mb4_general_ci;
INSERT INTO Z0CASE VALUES('20210321');
INSERT INTO Z0CASE VALUES('2020-11-21');
INSERT INTO Z0CASE VALUES('2021-01-21 11:58:39.456');
INSERT INTO Z0CASE VALUES(NULL);
SELECT * FROM Z0CASE ORDER BY T1;
T1
NULL
2020-11-21 00:00:00
2021-01-21 11:58:39
2021-03-21 00:00:00
SELECT table_name,column_type,COLLATION_NAME,CHARACTER_SET_NAME FROM information_schema.columns WHERE table_name='Z0CASE';
table_name	column_type	COLLATION_NAME	CHARACTER_SET_NAME
z0case	timestamp	NULL	NULL
SELECT table_name,table_collation FROM information_schema.tables WHERE table_name='Z0CASE';
table_name	table_collation
z0case	utf8mb4_general_ci
ALTER TABLE Z0CASE CONVERT TO CHARACTER SET 'utf8mb4' COLLATE 'utf8mb4_bin';
SELECT table_name,table_collation FROM information_schema.tables WHERE table_name='Z0CASE';
table_name	table_collation
z0case	utf8mb4_bin
SELECT * FROM Z0CASE ORDER BY T1;
T1
NULL
2020-11-21 00:00:00
2021-01-21 11:58:39
2021-03-21 00:00:00
insert
INSERT INTO Z0CASE VALUES(71);
INSERT INTO Z0CASE VALUES('2001');
INSERT INTO Z0CASE VALUES('!*?< >aB12 中文');
INSERT INTO Z0CASE VALUES(b'0101101');
INSERT INTO Z0CASE VALUES('2021-10-01 12:23:35.54');
INSERT INTO Z0CASE VALUES('2011-11-01');
INSERT INTO Z0CASE VALUES('22:22:35');
INSERT INTO Z0CASE VALUES(12.1416);
INSERT INTO Z0CASE VALUES(null);
SELECT table_name,column_type,COLLATION_NAME,CHARACTER_SET_NAME FROM information_schema.columns WHERE table_name='Z0CASE';
table_name	column_type	COLLATION_NAME	CHARACTER_SET_NAME
z0case	timestamp	NULL	NULL
SELECT table_name,table_collation FROM information_schema.tables WHERE table_name='Z0CASE';
table_name	table_collation
z0case	utf8mb4_bin
SELECT * FROM Z0CASE ORDER BY T1;
T1
NULL
NULL
0000-00-00 00:00:00
0000-00-00 00:00:00
0000-00-00 00:00:00
0000-00-00 00:00:00
0000-00-00 00:00:00
0000-00-00 00:00:00
2011-11-01 00:00:00
2020-11-21 00:00:00
2021-01-21 11:58:39
2021-03-21 00:00:00
2021-10-01 12:23:36
update
UPDATE Z0CASE SET T1=NULL WHERE T1='2021-10-01 12:23:36';
UPDATE Z0CASE SET T1='12:31:56' WHERE T1='2011-11-01 00:00:00';
UPDATE Z0CASE SET T1=1221.34 WHERE T1='12:31:56';
UPDATE Z0CASE SET T1='Aa1$< >中文' WHERE T1='2021-01-21 11:58:40';
UPDATE Z0CASE SET T1=b'0101101' WHERE T1='2021-01-21 11:58:40';
UPDATE Z0CASE SET T1='2011-11-11' WHERE T1='2021-01-21 11:58:40';
UPDATE Z0CASE SET T1='2012-12-21 09:10:21' WHERE T1='2011-11-11 00:00:00';
SELECT table_name,column_type,COLLATION_NAME,CHARACTER_SET_NAME FROM information_schema.columns WHERE table_name='Z0CASE';
table_name	column_type	COLLATION_NAME	CHARACTER_SET_NAME
z0case	timestamp	NULL	NULL
SELECT table_name,table_collation FROM information_schema.tables WHERE table_name='Z0CASE';
table_name	table_collation
z0case	utf8mb4_bin
SELECT * FROM Z0CASE ORDER BY T1;
T1
NULL
NULL
NULL
2000-12-21 00:00:00
2000-12-21 00:00:00
2000-12-21 00:00:00
2000-12-21 00:00:00
2000-12-21 00:00:00
2000-12-21 00:00:00
2000-12-21 00:00:00
2020-11-21 00:00:00
2021-01-21 11:58:39
2021-03-21 00:00:00
delete
DELETE FROM Z0CASE WHERE T1='09:10:21';
DELETE FROM Z0CASE WHERE T1 IS NULL;
SELECT * FROM Z0CASE ORDER BY T1;
T1
2000-12-21 00:00:00
2000-12-21 00:00:00
2000-12-21 00:00:00
2000-12-21 00:00:00
2000-12-21 00:00:00
2000-12-21 00:00:00
2000-12-21 00:00:00
2020-11-21 00:00:00
2021-01-21 11:58:39
2021-03-21 00:00:00
general_list_update  utf8mb4/utf8mb4_general_ci --> utf8mb4/utf8mb4_unicode_ci
char
DROP TABLE Z0CASE;
CREATE TABLE Z0CASE(T1 CHAR(50)) DEFAULT charset= utf8mb4 DEFAULT collate = utf8mb4_general_ci;
INSERT INTO Z0CASE VALUES(123);
INSERT INTO Z0CASE VALUES('%^&*[];//\\');
INSERT INTO Z0CASE VALUES(NULL);
INSERT INTO Z0CASE VALUES('abc');
INSERT INTO Z0CASE VALUES('中文');
SELECT * FROM Z0CASE ORDER BY T1;
T1
NULL
%^&*[];//\
123
abc
中文
SELECT table_name,column_type,COLLATION_NAME,CHARACTER_SET_NAME FROM information_schema.columns WHERE table_name='Z0CASE';
table_name	column_type	COLLATION_NAME	CHARACTER_SET_NAME
z0case	char(50)	utf8mb4_general_ci	utf8mb4
SELECT table_name,table_collation FROM information_schema.tables WHERE table_name='Z0CASE';
table_name	table_collation
z0case	utf8mb4_general_ci
ALTER TABLE Z0CASE CONVERT TO CHARACTER SET 'utf8mb4' COLLATE 'utf8mb4_unicode_ci';
SELECT table_name,table_collation FROM information_schema.tables WHERE table_name='Z0CASE';
table_name	table_collation
z0case	utf8mb4_unicode_ci
SELECT * FROM Z0CASE ORDER BY T1;
T1
NULL
%^&*[];//\
123
abc
中文
insert
INSERT INTO Z0CASE VALUES(111);
INSERT INTO Z0CASE VALUES('2001');
INSERT INTO Z0CASE VALUES('!*?< >aB12 中文');
INSERT INTO Z0CASE VALUES(b'0101101');
INSERT INTO Z0CASE VALUES('2021-10-01 12:23:35.54');
INSERT INTO Z0CASE VALUES('2011-11-01');
INSERT INTO Z0CASE VALUES('22:22:35');
INSERT INTO Z0CASE VALUES(12.345);
INSERT INTO Z0CASE VALUES(null);
SELECT table_name,column_type,COLLATION_NAME,CHARACTER_SET_NAME FROM information_schema.columns WHERE table_name='Z0CASE';
table_name	column_type	COLLATION_NAME	CHARACTER_SET_NAME
z0case	char(50)	utf8mb4_unicode_ci	utf8mb4
SELECT table_name,table_collation FROM information_schema.tables WHERE table_name='Z0CASE';
table_name	table_collation
z0case	utf8mb4_unicode_ci
SELECT * FROM Z0CASE ORDER BY T1;
T1
NULL
NULL
-
!*?< >aB12 中文
%^&*[];//\
111
12.345
123
2001
2011-11-01
2021-10-01 12:23:35.54
22:22:35
abc
中文
update
UPDATE Z0CASE SET T1=NULL WHERE T1='111';
UPDATE Z0CASE SET T1='12:31:56' WHERE T1=2001;
Warnings:
Warning	1292	Truncated incorrect DECIMAL value: '%^&*[];//\'
Warning	1292	Truncated incorrect DECIMAL value: 'abc'
Warning	1292	Truncated incorrect DECIMAL value: '中文'
Warning	1292	Truncated incorrect DECIMAL value: '!*?< >aB12 中文'
Warning	1292	Truncated incorrect DECIMAL value: '2021-10-01 12:23:35.54'
Warning	1292	Truncated incorrect DECIMAL value: '2011-11-01'
Warning	1292	Truncated incorrect DECIMAL value: '22:22:35'
UPDATE Z0CASE SET T1=1221.34 WHERE T1='2011-11-01';
UPDATE Z0CASE SET T1='Aa1$< >中文' WHERE T1='12.345';
UPDATE Z0CASE SET T1=b'0101101' WHERE T1='abc';
SELECT table_name,column_type,COLLATION_NAME,CHARACTER_SET_NAME FROM information_schema.columns WHERE table_name='Z0CASE';
table_name	column_type	COLLATION_NAME	CHARACTER_SET_NAME
z0case	char(50)	utf8mb4_unicode_ci	utf8mb4
SELECT table_name,table_collation FROM information_schema.tables WHERE table_name='Z0CASE';
table_name	table_collation
z0case	utf8mb4_unicode_ci
SELECT * FROM Z0CASE ORDER BY T1;
T1
NULL
NULL
NULL
-
-
!*?< >aB12 中文
%^&*[];//\
12:31:56
1221.34
123
2021-10-01 12:23:35.54
22:22:35
Aa1$< >中文
中文
delete
DELETE FROM Z0CASE WHERE T1=1221.34;
Warnings:
Warning	1292	Truncated incorrect DECIMAL value: '%^&*[];//\'
Warning	1292	Truncated incorrect DECIMAL value: '中文'
Warning	1292	Truncated incorrect DECIMAL value: '12:31:56'
Warning	1292	Truncated incorrect DECIMAL value: '!*?< >aB12 中文'
Warning	1292	Truncated incorrect DECIMAL value: '2021-10-01 12:23:35.54'
Warning	1292	Truncated incorrect DECIMAL value: '22:22:35'
Warning	1292	Truncated incorrect DECIMAL value: 'Aa1$< >中文'
DELETE FROM Z0CASE WHERE T1='2021-10-01 12:23:35.54';
DELETE FROM Z0CASE WHERE T1 IS NULL;
DELETE FROM Z0CASE WHERE T1=b'0101101';
SELECT * FROM Z0CASE ORDER BY T1;
T1
!*?< >aB12 中文
%^&*[];//\
12:31:56
123
22:22:35
Aa1$< >中文
中文
varchar
DROP TABLE Z0CASE;
CREATE TABLE Z0CASE(T1 VARCHAR(50)) DEFAULT charset= utf8mb4 DEFAULT collate = utf8mb4_general_ci;
INSERT INTO Z0CASE VALUES(123);
INSERT INTO Z0CASE VALUES('%^&*[];//\\');
INSERT INTO Z0CASE VALUES(NULL);
INSERT INTO Z0CASE VALUES('abc');
INSERT INTO Z0CASE VALUES('中文');
SELECT * FROM Z0CASE ORDER BY T1;
T1
NULL
%^&*[];//\
123
abc
中文
SELECT table_name,column_type,COLLATION_NAME,CHARACTER_SET_NAME FROM information_schema.columns WHERE table_name='Z0CASE';
table_name	column_type	COLLATION_NAME	CHARACTER_SET_NAME
z0case	varchar(50)	utf8mb4_general_ci	utf8mb4
SELECT table_name,table_collation FROM information_schema.tables WHERE table_name='Z0CASE';
table_name	table_collation
z0case	utf8mb4_general_ci
ALTER TABLE Z0CASE CONVERT TO CHARACTER SET 'utf8mb4' COLLATE 'utf8mb4_unicode_ci';
SELECT table_name,table_collation FROM information_schema.tables WHERE table_name='Z0CASE';
table_name	table_collation
z0case	utf8mb4_unicode_ci
SELECT * FROM Z0CASE ORDER BY T1;
T1
NULL
%^&*[];//\
123
abc
中文
insert
INSERT INTO Z0CASE VALUES(111);
INSERT INTO Z0CASE VALUES('2001');
INSERT INTO Z0CASE VALUES('!*?< >aB12 中文');
INSERT INTO Z0CASE VALUES(b'0101101');
INSERT INTO Z0CASE VALUES('2021-10-01 12:23:35.54');
INSERT INTO Z0CASE VALUES('2011-11-01');
INSERT INTO Z0CASE VALUES('22:22:35');
INSERT INTO Z0CASE VALUES(12.345);
INSERT INTO Z0CASE VALUES(null);
SELECT table_name,column_type,COLLATION_NAME,CHARACTER_SET_NAME FROM information_schema.columns WHERE table_name='Z0CASE';
table_name	column_type	COLLATION_NAME	CHARACTER_SET_NAME
z0case	varchar(50)	utf8mb4_unicode_ci	utf8mb4
SELECT table_name,table_collation FROM information_schema.tables WHERE table_name='Z0CASE';
table_name	table_collation
z0case	utf8mb4_unicode_ci
SELECT * FROM Z0CASE ORDER BY T1;
T1
NULL
NULL
-
!*?< >aB12 中文
%^&*[];//\
111
12.345
123
2001
2011-11-01
2021-10-01 12:23:35.54
22:22:35
abc
中文
update
UPDATE Z0CASE SET T1=NULL WHERE T1='111';
UPDATE Z0CASE SET T1='12:31:56' WHERE T1=2001;
Warnings:
Warning	1292	Truncated incorrect DECIMAL value: '%^&*[];//\'
Warning	1292	Truncated incorrect DECIMAL value: 'abc'
Warning	1292	Truncated incorrect DECIMAL value: '中文'
Warning	1292	Truncated incorrect DECIMAL value: '!*?< >aB12 中文'
Warning	1292	Truncated incorrect DECIMAL value: '2021-10-01 12:23:35.54'
Warning	1292	Truncated incorrect DECIMAL value: '2011-11-01'
Warning	1292	Truncated incorrect DECIMAL value: '22:22:35'
UPDATE Z0CASE SET T1=1221.34 WHERE T1='2011-11-01';
UPDATE Z0CASE SET T1='Aa1$< >中文' WHERE T1='12.345';
UPDATE Z0CASE SET T1=b'0101101' WHERE T1='abc';
SELECT table_name,column_type,COLLATION_NAME,CHARACTER_SET_NAME FROM information_schema.columns WHERE table_name='Z0CASE';
table_name	column_type	COLLATION_NAME	CHARACTER_SET_NAME
z0case	varchar(50)	utf8mb4_unicode_ci	utf8mb4
SELECT table_name,table_collation FROM information_schema.tables WHERE table_name='Z0CASE';
table_name	table_collation
z0case	utf8mb4_unicode_ci
SELECT * FROM Z0CASE ORDER BY T1;
T1
NULL
NULL
NULL
-
-
!*?< >aB12 中文
%^&*[];//\
12:31:56
1221.34
123
2021-10-01 12:23:35.54
22:22:35
Aa1$< >中文
中文
delete
DELETE FROM Z0CASE WHERE T1=1221.34;
Warnings:
Warning	1292	Truncated incorrect DECIMAL value: '%^&*[];//\'
Warning	1292	Truncated incorrect DECIMAL value: '中文'
Warning	1292	Truncated incorrect DECIMAL value: '12:31:56'
Warning	1292	Truncated incorrect DECIMAL value: '!*?< >aB12 中文'
Warning	1292	Truncated incorrect DECIMAL value: '2021-10-01 12:23:35.54'
Warning	1292	Truncated incorrect DECIMAL value: '22:22:35'
Warning	1292	Truncated incorrect DECIMAL value: 'Aa1$< >中文'
DELETE FROM Z0CASE WHERE T1='2021-10-01 12:23:35.54';
DELETE FROM Z0CASE WHERE T1 IS NULL;
DELETE FROM Z0CASE WHERE T1=b'0101101';
SELECT * FROM Z0CASE ORDER BY T1;
T1
!*?< >aB12 中文
%^&*[];//\
12:31:56
123
22:22:35
Aa1$< >中文
中文
TEXT
DROP TABLE Z0CASE;
CREATE TABLE Z0CASE(T1 TEXT) DEFAULT charset= utf8mb4 DEFAULT collate = utf8mb4_general_ci;
INSERT INTO Z0CASE VALUES(123);
INSERT INTO Z0CASE VALUES('%^&*[];//\\');
INSERT INTO Z0CASE VALUES(NULL);
INSERT INTO Z0CASE VALUES('abc');
INSERT INTO Z0CASE VALUES('中文');
SELECT * FROM Z0CASE ORDER BY T1;
T1
NULL
%^&*[];//\
123
abc
中文
SELECT table_name,column_type,COLLATION_NAME,CHARACTER_SET_NAME FROM information_schema.columns WHERE table_name='Z0CASE';
table_name	column_type	COLLATION_NAME	CHARACTER_SET_NAME
z0case	text	utf8mb4_general_ci	utf8mb4
SELECT table_name,table_collation FROM information_schema.tables WHERE table_name='Z0CASE';
table_name	table_collation
z0case	utf8mb4_general_ci
ALTER TABLE Z0CASE CONVERT TO CHARACTER SET 'utf8mb4' COLLATE 'utf8mb4_unicode_ci';
SELECT table_name,table_collation FROM information_schema.tables WHERE table_name='Z0CASE';
table_name	table_collation
z0case	utf8mb4_unicode_ci
SELECT * FROM Z0CASE ORDER BY T1;
T1
NULL
%^&*[];//\
123
abc
中文
insert
INSERT INTO Z0CASE VALUES(111);
INSERT INTO Z0CASE VALUES('2001');
INSERT INTO Z0CASE VALUES('!*?< >aB12 中文');
INSERT INTO Z0CASE VALUES(b'0101101');
INSERT INTO Z0CASE VALUES('2021-10-01 12:23:35.54');
INSERT INTO Z0CASE VALUES('2011-11-01');
INSERT INTO Z0CASE VALUES('22:22:35');
INSERT INTO Z0CASE VALUES(12.345);
INSERT INTO Z0CASE VALUES(null);
SELECT table_name,column_type,COLLATION_NAME,CHARACTER_SET_NAME FROM information_schema.columns WHERE table_name='Z0CASE';
table_name	column_type	COLLATION_NAME	CHARACTER_SET_NAME
z0case	text	utf8mb4_unicode_ci	utf8mb4
SELECT table_name,table_collation FROM information_schema.tables WHERE table_name='Z0CASE';
table_name	table_collation
z0case	utf8mb4_unicode_ci
SELECT * FROM Z0CASE ORDER BY T1;
T1
NULL
NULL
-
!*?< >aB12 中文
%^&*[];//\
111
12.345
123
2001
2011-11-01
2021-10-01 12:23:35.54
22:22:35
abc
中文
update
UPDATE Z0CASE SET T1=NULL WHERE T1='111';
UPDATE Z0CASE SET T1='12:31:56' WHERE T1=2001;
Warnings:
Warning	1292	Truncated incorrect DECIMAL value: '%^&*[];//\'
Warning	1292	Truncated incorrect DECIMAL value: 'abc'
Warning	1292	Truncated incorrect DECIMAL value: '中文'
Warning	1292	Truncated incorrect DECIMAL value: '!*?< >aB12 中文'
Warning	1292	Truncated incorrect DECIMAL value: '2021-10-01 12:23:35.54'
Warning	1292	Truncated incorrect DECIMAL value: '2011-11-01'
Warning	1292	Truncated incorrect DECIMAL value: '22:22:35'
UPDATE Z0CASE SET T1=1221.34 WHERE T1='2011-11-01';
UPDATE Z0CASE SET T1='Aa1$< >中文' WHERE T1='12.345';
UPDATE Z0CASE SET T1=b'0101101' WHERE T1='abc';
SELECT table_name,column_type,COLLATION_NAME,CHARACTER_SET_NAME FROM information_schema.columns WHERE table_name='Z0CASE';
table_name	column_type	COLLATION_NAME	CHARACTER_SET_NAME
z0case	text	utf8mb4_unicode_ci	utf8mb4
SELECT table_name,table_collation FROM information_schema.tables WHERE table_name='Z0CASE';
table_name	table_collation
z0case	utf8mb4_unicode_ci
SELECT * FROM Z0CASE ORDER BY T1;
T1
NULL
NULL
NULL
-
-
!*?< >aB12 中文
%^&*[];//\
12:31:56
1221.34
123
2021-10-01 12:23:35.54
22:22:35
Aa1$< >中文
中文
delete
DELETE FROM Z0CASE WHERE T1=1221.34;
Warnings:
Warning	1292	Truncated incorrect DECIMAL value: '%^&*[];//\'
Warning	1292	Truncated incorrect DECIMAL value: '-'
Warning	1292	Truncated incorrect DECIMAL value: '中文'
Warning	1292	Truncated incorrect DECIMAL value: '12:31:56'
Warning	1292	Truncated incorrect DECIMAL value: '!*?< >aB12 中文'
Warning	1292	Truncated incorrect DECIMAL value: '-'
Warning	1292	Truncated incorrect DECIMAL value: '2021-10-01 12:23:35.54'
Warning	1292	Truncated incorrect DECIMAL value: '22:22:35'
Warning	1292	Truncated incorrect DECIMAL value: 'Aa1$< >中文'
DELETE FROM Z0CASE WHERE T1='2021-10-01 12:23:35.54';
DELETE FROM Z0CASE WHERE T1 IS NULL;
DELETE FROM Z0CASE WHERE T1=b'0101101';
SELECT * FROM Z0CASE ORDER BY T1;
T1
!*?< >aB12 中文
%^&*[];//\
12:31:56
123
22:22:35
Aa1$< >中文
中文
LONGTEXT
DROP TABLE Z0CASE;
CREATE TABLE Z0CASE(T1 LONGTEXT) DEFAULT charset= utf8mb4 DEFAULT collate = utf8mb4_general_ci;
INSERT INTO Z0CASE VALUES(123);
INSERT INTO Z0CASE VALUES('%^&*[];//\\');
INSERT INTO Z0CASE VALUES(NULL);
INSERT INTO Z0CASE VALUES('abc');
INSERT INTO Z0CASE VALUES('中文');
SELECT * FROM Z0CASE ORDER BY T1;
T1
NULL
%^&*[];//\
123
abc
中文
SELECT table_name,column_type,COLLATION_NAME,CHARACTER_SET_NAME FROM information_schema.columns WHERE table_name='Z0CASE';
table_name	column_type	COLLATION_NAME	CHARACTER_SET_NAME
z0case	longtext	utf8mb4_general_ci	utf8mb4
SELECT table_name,table_collation FROM information_schema.tables WHERE table_name='Z0CASE';
table_name	table_collation
z0case	utf8mb4_general_ci
ALTER TABLE Z0CASE CONVERT TO CHARACTER SET 'utf8mb4' COLLATE 'utf8mb4_unicode_ci';
SELECT table_name,table_collation FROM information_schema.tables WHERE table_name='Z0CASE';
table_name	table_collation
z0case	utf8mb4_unicode_ci
SELECT * FROM Z0CASE ORDER BY T1;
T1
NULL
%^&*[];//\
123
abc
中文
insert
INSERT INTO Z0CASE VALUES(111);
INSERT INTO Z0CASE VALUES('2001');
INSERT INTO Z0CASE VALUES('!*?< >aB12 中文');
INSERT INTO Z0CASE VALUES(b'0101101');
INSERT INTO Z0CASE VALUES('2021-10-01 12:23:35.54');
INSERT INTO Z0CASE VALUES('2011-11-01');
INSERT INTO Z0CASE VALUES('22:22:35');
INSERT INTO Z0CASE VALUES(12.345);
INSERT INTO Z0CASE VALUES(null);
SELECT table_name,column_type,COLLATION_NAME,CHARACTER_SET_NAME FROM information_schema.columns WHERE table_name='Z0CASE';
table_name	column_type	COLLATION_NAME	CHARACTER_SET_NAME
z0case	longtext	utf8mb4_unicode_ci	utf8mb4
SELECT table_name,table_collation FROM information_schema.tables WHERE table_name='Z0CASE';
table_name	table_collation
z0case	utf8mb4_unicode_ci
SELECT * FROM Z0CASE ORDER BY T1;
T1
NULL
NULL
-
!*?< >aB12 中文
%^&*[];//\
111
12.345
123
2001
2011-11-01
2021-10-01 12:23:35.54
22:22:35
abc
中文
update
UPDATE Z0CASE SET T1=NULL WHERE T1='111';
UPDATE Z0CASE SET T1='12:31:56' WHERE T1=2001;
Warnings:
Warning	1292	Truncated incorrect DECIMAL value: '%^&*[];//\'
Warning	1292	Truncated incorrect DECIMAL value: 'abc'
Warning	1292	Truncated incorrect DECIMAL value: '中文'
Warning	1292	Truncated incorrect DECIMAL value: '!*?< >aB12 中文'
Warning	1292	Truncated incorrect DECIMAL value: '2021-10-01 12:23:35.54'
Warning	1292	Truncated incorrect DECIMAL value: '2011-11-01'
Warning	1292	Truncated incorrect DECIMAL value: '22:22:35'
UPDATE Z0CASE SET T1=1221.34 WHERE T1='2011-11-01';
UPDATE Z0CASE SET T1='Aa1$< >中文' WHERE T1='12.345';
UPDATE Z0CASE SET T1=b'0101101' WHERE T1='abc';
SELECT table_name,column_type,COLLATION_NAME,CHARACTER_SET_NAME FROM information_schema.columns WHERE table_name='Z0CASE';
table_name	column_type	COLLATION_NAME	CHARACTER_SET_NAME
z0case	longtext	utf8mb4_unicode_ci	utf8mb4
SELECT table_name,table_collation FROM information_schema.tables WHERE table_name='Z0CASE';
table_name	table_collation
z0case	utf8mb4_unicode_ci
SELECT * FROM Z0CASE ORDER BY T1;
T1
NULL
NULL
NULL
-
-
!*?< >aB12 中文
%^&*[];//\
12:31:56
1221.34
123
2021-10-01 12:23:35.54
22:22:35
Aa1$< >中文
中文
delete
DELETE FROM Z0CASE WHERE T1=1221.34;
Warnings:
Warning	1292	Truncated incorrect DECIMAL value: '%^&*[];//\'
Warning	1292	Truncated incorrect DECIMAL value: '-'
Warning	1292	Truncated incorrect DECIMAL value: '中文'
Warning	1292	Truncated incorrect DECIMAL value: '12:31:56'
Warning	1292	Truncated incorrect DECIMAL value: '!*?< >aB12 中文'
Warning	1292	Truncated incorrect DECIMAL value: '-'
Warning	1292	Truncated incorrect DECIMAL value: '2021-10-01 12:23:35.54'
Warning	1292	Truncated incorrect DECIMAL value: '22:22:35'
Warning	1292	Truncated incorrect DECIMAL value: 'Aa1$< >中文'
DELETE FROM Z0CASE WHERE T1='2021-10-01 12:23:35.54';
DELETE FROM Z0CASE WHERE T1 IS NULL;
DELETE FROM Z0CASE WHERE T1=b'0101101';
SELECT * FROM Z0CASE ORDER BY T1;
T1
!*?< >aB12 中文
%^&*[];//\
12:31:56
123
22:22:35
Aa1$< >中文
中文
BLOB
DROP TABLE Z0CASE;
CREATE TABLE Z0CASE(T1 BLOB) DEFAULT charset= utf8mb4 DEFAULT collate = utf8mb4_general_ci;
INSERT INTO Z0CASE VALUES(123);
INSERT INTO Z0CASE VALUES('%^&*[];//\\');
INSERT INTO Z0CASE VALUES(NULL);
INSERT INTO Z0CASE VALUES('abc');
INSERT INTO Z0CASE VALUES('中文');
SELECT * FROM Z0CASE ORDER BY T1;
T1
NULL
%^&*[];//\
123
abc
中文
SELECT table_name,column_type,COLLATION_NAME,CHARACTER_SET_NAME FROM information_schema.columns WHERE table_name='Z0CASE';
table_name	column_type	COLLATION_NAME	CHARACTER_SET_NAME
z0case	blob	NULL	NULL
SELECT table_name,table_collation FROM information_schema.tables WHERE table_name='Z0CASE';
table_name	table_collation
z0case	utf8mb4_general_ci
ALTER TABLE Z0CASE CONVERT TO CHARACTER SET 'utf8mb4' COLLATE 'utf8mb4_unicode_ci';
SELECT table_name,table_collation FROM information_schema.tables WHERE table_name='Z0CASE';
table_name	table_collation
z0case	utf8mb4_unicode_ci
SELECT * FROM Z0CASE ORDER BY T1;
T1
NULL
%^&*[];//\
123
abc
中文
insert
INSERT INTO Z0CASE VALUES(111);
INSERT INTO Z0CASE VALUES('2001');
INSERT INTO Z0CASE VALUES('!*?< >aB12 中文');
INSERT INTO Z0CASE VALUES(b'0101101');
INSERT INTO Z0CASE VALUES('2021-10-01 12:23:35.54');
INSERT INTO Z0CASE VALUES('2011-11-01');
INSERT INTO Z0CASE VALUES('22:22:35');
INSERT INTO Z0CASE VALUES(12.345);
INSERT INTO Z0CASE VALUES(null);
SELECT table_name,column_type,COLLATION_NAME,CHARACTER_SET_NAME FROM information_schema.columns WHERE table_name='Z0CASE';
table_name	column_type	COLLATION_NAME	CHARACTER_SET_NAME
z0case	blob	NULL	NULL
SELECT table_name,table_collation FROM information_schema.tables WHERE table_name='Z0CASE';
table_name	table_collation
z0case	utf8mb4_unicode_ci
SELECT * FROM Z0CASE ORDER BY T1*1;
T1
NULL
NULL
%^&*[];//\
abc
中文
!*?< >aB12 中文
-
12.345
22:22:35
111
123
2001
2011-11-01
2021-10-01 12:23:35.54
Warnings:
Warning	1292	Truncated incorrect DOUBLE value: '%^&*[];//\'
Warning	1292	Truncated incorrect DOUBLE value: 'abc'
Warning	1292	Truncated incorrect DOUBLE value: '中文'
Warning	1292	Truncated incorrect DOUBLE value: '!*?< >aB12 中文'
Warning	1292	Truncated incorrect DOUBLE value: '-'
Warning	1292	Truncated incorrect DOUBLE value: '2021-10-01 12:23:35.54'
Warning	1292	Truncated incorrect DOUBLE value: '2011-11-01'
Warning	1292	Truncated incorrect DOUBLE value: '22:22:35'
update
UPDATE Z0CASE SET T1=NULL WHERE T1='111';
UPDATE Z0CASE SET T1='12:31:56' WHERE T1=2001;
Warnings:
Warning	1292	Truncated incorrect DECIMAL value: '%^&*[];//\'
Warning	1292	Truncated incorrect DECIMAL value: 'abc'
Warning	1292	Truncated incorrect DECIMAL value: '中文'
Warning	1292	Truncated incorrect DECIMAL value: '!*?< >aB12 中文'
Warning	1292	Truncated incorrect DECIMAL value: '2021-10-01 12:23:35.54'
Warning	1292	Truncated incorrect DECIMAL value: '2011-11-01'
Warning	1292	Truncated incorrect DECIMAL value: '22:22:35'
UPDATE Z0CASE SET T1=1221.34 WHERE T1='2011-11-01';
UPDATE Z0CASE SET T1='Aa1$< >中文' WHERE T1='12.345';
UPDATE Z0CASE SET T1=b'0101101' WHERE T1='abc';
SELECT table_name,column_type,COLLATION_NAME,CHARACTER_SET_NAME FROM information_schema.columns WHERE table_name='Z0CASE';
table_name	column_type	COLLATION_NAME	CHARACTER_SET_NAME
z0case	blob	NULL	NULL
SELECT table_name,table_collation FROM information_schema.tables WHERE table_name='Z0CASE';
table_name	table_collation
z0case	utf8mb4_unicode_ci
SELECT * FROM Z0CASE ORDER BY T1*1;
T1
NULL
NULL
NULL
%^&*[];//\
-
中文
!*?< >aB12 中文
-
Aa1$< >中文
12:31:56
22:22:35
123
1221.34
2021-10-01 12:23:35.54
Warnings:
Warning	1292	Truncated incorrect DOUBLE value: '%^&*[];//\'
Warning	1292	Truncated incorrect DOUBLE value: '-'
Warning	1292	Truncated incorrect DOUBLE value: '中文'
Warning	1292	Truncated incorrect DOUBLE value: '12:31:56'
Warning	1292	Truncated incorrect DOUBLE value: '!*?< >aB12 中文'
Warning	1292	Truncated incorrect DOUBLE value: '-'
Warning	1292	Truncated incorrect DOUBLE value: '2021-10-01 12:23:35.54'
Warning	1292	Truncated incorrect DOUBLE value: '22:22:35'
Warning	1292	Truncated incorrect DOUBLE value: 'Aa1$< >中文'
delete
DELETE FROM Z0CASE WHERE T1=1221.34;
Warnings:
Warning	1292	Truncated incorrect DECIMAL value: '%^&*[];//\'
Warning	1292	Truncated incorrect DECIMAL value: '-'
Warning	1292	Truncated incorrect DECIMAL value: '中文'
Warning	1292	Truncated incorrect DECIMAL value: '12:31:56'
Warning	1292	Truncated incorrect DECIMAL value: '!*?< >aB12 中文'
Warning	1292	Truncated incorrect DECIMAL value: '-'
Warning	1292	Truncated incorrect DECIMAL value: '2021-10-01 12:23:35.54'
Warning	1292	Truncated incorrect DECIMAL value: '22:22:35'
Warning	1292	Truncated incorrect DECIMAL value: 'Aa1$< >中文'
DELETE FROM Z0CASE WHERE T1='2021-10-01 12:23:35.54';
DELETE FROM Z0CASE WHERE T1 IS NULL;
DELETE FROM Z0CASE WHERE T1=b'0101101';
SELECT * FROM Z0CASE ORDER BY T1*1;
T1
%^&*[];//\
中文
!*?< >aB12 中文
Aa1$< >中文
12:31:56
22:22:35
123
Warnings:
Warning	1292	Truncated incorrect DOUBLE value: '%^&*[];//\'
Warning	1292	Truncated incorrect DOUBLE value: '中文'
Warning	1292	Truncated incorrect DOUBLE value: '12:31:56'
Warning	1292	Truncated incorrect DOUBLE value: '!*?< >aB12 中文'
Warning	1292	Truncated incorrect DOUBLE value: '22:22:35'
Warning	1292	Truncated incorrect DOUBLE value: 'Aa1$< >中文'
VARBINARY
DROP TABLE Z0CASE;
CREATE TABLE Z0CASE(T1 VARBINARY(50)) DEFAULT charset= utf8mb4 DEFAULT collate = utf8mb4_general_ci;
INSERT INTO Z0CASE VALUES(123);
INSERT INTO Z0CASE VALUES('%^&*[];//\\');
INSERT INTO Z0CASE VALUES(NULL);
INSERT INTO Z0CASE VALUES('abc');
INSERT INTO Z0CASE VALUES('中文');
SELECT * FROM Z0CASE ORDER BY T1;
T1
NULL
%^&*[];//\
123
abc
中文
SELECT table_name,column_type,COLLATION_NAME,CHARACTER_SET_NAME FROM information_schema.columns WHERE table_name='Z0CASE';
table_name	column_type	COLLATION_NAME	CHARACTER_SET_NAME
z0case	varbinary(50)	NULL	NULL
SELECT table_name,table_collation FROM information_schema.tables WHERE table_name='Z0CASE';
table_name	table_collation
z0case	utf8mb4_general_ci
ALTER TABLE Z0CASE CONVERT TO CHARACTER SET 'utf8mb4' COLLATE 'utf8mb4_unicode_ci';
SELECT table_name,table_collation FROM information_schema.tables WHERE table_name='Z0CASE';
table_name	table_collation
z0case	utf8mb4_unicode_ci
SELECT * FROM Z0CASE ORDER BY T1;
T1
NULL
%^&*[];//\
123
abc
中文
insert
INSERT INTO Z0CASE VALUES(111);
INSERT INTO Z0CASE VALUES('2001');
INSERT INTO Z0CASE VALUES('!*?< >aB12 中文');
INSERT INTO Z0CASE VALUES(b'0101101');
INSERT INTO Z0CASE VALUES('2021-10-01 12:23:35.54');
INSERT INTO Z0CASE VALUES('2011-11-01');
INSERT INTO Z0CASE VALUES('22:22:35');
INSERT INTO Z0CASE VALUES(12.345);
INSERT INTO Z0CASE VALUES(null);
SELECT table_name,column_type,COLLATION_NAME,CHARACTER_SET_NAME FROM information_schema.columns WHERE table_name='Z0CASE';
table_name	column_type	COLLATION_NAME	CHARACTER_SET_NAME
z0case	varbinary(50)	NULL	NULL
SELECT table_name,table_collation FROM information_schema.tables WHERE table_name='Z0CASE';
table_name	table_collation
z0case	utf8mb4_unicode_ci
SELECT * FROM Z0CASE ORDER BY T1*1;
T1
NULL
NULL
%^&*[];//\
abc
中文
!*?< >aB12 中文
-
12.345
22:22:35
111
123
2001
2011-11-01
2021-10-01 12:23:35.54
Warnings:
Warning	1292	Truncated incorrect DOUBLE value: '%^&*[];//\'
Warning	1292	Truncated incorrect DOUBLE value: 'abc'
Warning	1292	Truncated incorrect DOUBLE value: '中文'
Warning	1292	Truncated incorrect DOUBLE value: '!*?< >aB12 中文'
Warning	1292	Truncated incorrect DOUBLE value: '-'
Warning	1292	Truncated incorrect DOUBLE value: '2021-10-01 12:23:35.54'
Warning	1292	Truncated incorrect DOUBLE value: '2011-11-01'
Warning	1292	Truncated incorrect DOUBLE value: '22:22:35'
update
UPDATE Z0CASE SET T1=NULL WHERE T1='111';
UPDATE Z0CASE SET T1='12:31:56' WHERE T1=2001;
Warnings:
Warning	1292	Truncated incorrect DECIMAL value: '%^&*[];//\'
Warning	1292	Truncated incorrect DECIMAL value: 'abc'
Warning	1292	Truncated incorrect DECIMAL value: '中文'
Warning	1292	Truncated incorrect DECIMAL value: '!*?< >aB12 中文'
Warning	1292	Truncated incorrect DECIMAL value: '2021-10-01 12:23:35.54'
Warning	1292	Truncated incorrect DECIMAL value: '2011-11-01'
Warning	1292	Truncated incorrect DECIMAL value: '22:22:35'
UPDATE Z0CASE SET T1=1221.34 WHERE T1='2011-11-01';
UPDATE Z0CASE SET T1='Aa1$< >中文' WHERE T1='12.345';
UPDATE Z0CASE SET T1=b'0101101' WHERE T1='abc';
SELECT table_name,column_type,COLLATION_NAME,CHARACTER_SET_NAME FROM information_schema.columns WHERE table_name='Z0CASE';
table_name	column_type	COLLATION_NAME	CHARACTER_SET_NAME
z0case	varbinary(50)	NULL	NULL
SELECT table_name,table_collation FROM information_schema.tables WHERE table_name='Z0CASE';
table_name	table_collation
z0case	utf8mb4_unicode_ci
SELECT * FROM Z0CASE ORDER BY T1*1;
T1
NULL
NULL
NULL
%^&*[];//\
-
中文
!*?< >aB12 中文
-
Aa1$< >中文
12:31:56
22:22:35
123
1221.34
2021-10-01 12:23:35.54
Warnings:
Warning	1292	Truncated incorrect DOUBLE value: '%^&*[];//\'
Warning	1292	Truncated incorrect DOUBLE value: '-'
Warning	1292	Truncated incorrect DOUBLE value: '中文'
Warning	1292	Truncated incorrect DOUBLE value: '12:31:56'
Warning	1292	Truncated incorrect DOUBLE value: '!*?< >aB12 中文'
Warning	1292	Truncated incorrect DOUBLE value: '-'
Warning	1292	Truncated incorrect DOUBLE value: '2021-10-01 12:23:35.54'
Warning	1292	Truncated incorrect DOUBLE value: '22:22:35'
Warning	1292	Truncated incorrect DOUBLE value: 'Aa1$< >中文'
delete
DELETE FROM Z0CASE WHERE T1=1221.34;
Warnings:
Warning	1292	Truncated incorrect DECIMAL value: '%^&*[];//\'
Warning	1292	Truncated incorrect DECIMAL value: '中文'
Warning	1292	Truncated incorrect DECIMAL value: '12:31:56'
Warning	1292	Truncated incorrect DECIMAL value: '!*?< >aB12 中文'
Warning	1292	Truncated incorrect DECIMAL value: '2021-10-01 12:23:35.54'
Warning	1292	Truncated incorrect DECIMAL value: '22:22:35'
Warning	1292	Truncated incorrect DECIMAL value: 'Aa1$< >中文'
DELETE FROM Z0CASE WHERE T1='2021-10-01 12:23:35.54';
DELETE FROM Z0CASE WHERE T1 IS NULL;
DELETE FROM Z0CASE WHERE T1=b'0101101';
SELECT * FROM Z0CASE ORDER BY T1*1;
T1
%^&*[];//\
中文
!*?< >aB12 中文
Aa1$< >中文
12:31:56
22:22:35
123
Warnings:
Warning	1292	Truncated incorrect DOUBLE value: '%^&*[];//\'
Warning	1292	Truncated incorrect DOUBLE value: '中文'
Warning	1292	Truncated incorrect DOUBLE value: '12:31:56'
Warning	1292	Truncated incorrect DOUBLE value: '!*?< >aB12 中文'
Warning	1292	Truncated incorrect DOUBLE value: '22:22:35'
Warning	1292	Truncated incorrect DOUBLE value: 'Aa1$< >中文'
ENUM
DROP TABLE Z0CASE;
CREATE TABLE Z0CASE(T1 ENUM('123','abc','中文','%^&*[];//\\','111','2021-10-01 12:23:35.54','2011-11-01','12.345',b'0101101')) DEFAULT charset= utf8mb4 DEFAULT collate = utf8mb4_general_ci;
INSERT INTO Z0CASE VALUES('123');
INSERT INTO Z0CASE VALUES('%^&*[];//\\');
INSERT INTO Z0CASE VALUES(NULL);
INSERT INTO Z0CASE VALUES('abc');
INSERT INTO Z0CASE VALUES('中文');
SELECT * FROM Z0CASE ORDER BY T1;
T1
NULL
123
abc
中文
%^&*[];//\
SELECT table_name,column_type,COLLATION_NAME,CHARACTER_SET_NAME FROM information_schema.columns WHERE table_name='Z0CASE';
table_name	column_type	COLLATION_NAME	CHARACTER_SET_NAME
z0case	enum('123','abc','中文','%^&*[];//\','111','2021-10-01 12:23:35.54','2011-11-01','12.345','-')	utf8mb4_general_ci	utf8mb4
SELECT table_name,table_collation FROM information_schema.tables WHERE table_name='Z0CASE';
table_name	table_collation
z0case	utf8mb4_general_ci
ALTER TABLE Z0CASE CONVERT TO CHARACTER SET 'utf8mb4' COLLATE 'utf8mb4_unicode_ci';
SELECT table_name,table_collation FROM information_schema.tables WHERE table_name='Z0CASE';
table_name	table_collation
z0case	utf8mb4_unicode_ci
SELECT * FROM Z0CASE ORDER BY T1;
T1
NULL
123
abc
中文
%^&*[];//\
insert
INSERT INTO Z0CASE VALUES(111);
INSERT INTO Z0CASE VALUES('2001');
INSERT INTO Z0CASE VALUES('!*?< >aB12 中文');
INSERT INTO Z0CASE VALUES('22:22:35');
INSERT INTO Z0CASE VALUES(12.345);
INSERT INTO Z0CASE VALUES(b'0101101');
INSERT INTO Z0CASE VALUES('2021-10-01 12:23:35.54');
INSERT INTO Z0CASE VALUES(null);
INSERT INTO Z0CASE VALUES('2011-11-01');
SELECT table_name,column_type,COLLATION_NAME,CHARACTER_SET_NAME FROM information_schema.columns WHERE table_name='Z0CASE';
table_name	column_type	COLLATION_NAME	CHARACTER_SET_NAME
z0case	enum('123','abc','中文','%^&*[];//\','111','2021-10-01 12:23:35.54','2011-11-01','12.345','-')	utf8mb4_unicode_ci	utf8mb4
SELECT table_name,table_collation FROM information_schema.tables WHERE table_name='Z0CASE';
table_name	table_collation
z0case	utf8mb4_unicode_ci
SELECT * FROM Z0CASE ORDER BY T1;
T1
NULL
NULL





123
abc
中文
%^&*[];//\
2021-10-01 12:23:35.54
2011-11-01
-
update
UPDATE Z0CASE SET T1=NULL WHERE T1='111';
UPDATE Z0CASE SET T1='22:22:35' WHERE T1=2001;
UPDATE Z0CASE SET T1=12.345 WHERE T1='2011-11-01';
UPDATE Z0CASE SET T1=b'0101101' WHERE T1='abc';
SELECT table_name,column_type,COLLATION_NAME,CHARACTER_SET_NAME FROM information_schema.columns WHERE table_name='Z0CASE';
table_name	column_type	COLLATION_NAME	CHARACTER_SET_NAME
z0case	enum('123','abc','中文','%^&*[];//\','111','2021-10-01 12:23:35.54','2011-11-01','12.345','-')	utf8mb4_unicode_ci	utf8mb4
SELECT table_name,table_collation FROM information_schema.tables WHERE table_name='Z0CASE';
table_name	table_collation
z0case	utf8mb4_unicode_ci
SELECT * FROM Z0CASE ORDER BY T1;
T1
NULL
NULL






123
中文
%^&*[];//\
2021-10-01 12:23:35.54
-
-
delete
DELETE FROM Z0CASE WHERE T1=12.345;
DELETE FROM Z0CASE WHERE T1='2021-10-01 12:23:35.54';
DELETE FROM Z0CASE WHERE T1 IS NULL;
DELETE FROM Z0CASE WHERE T1=b'0101101';
SELECT * FROM Z0CASE ORDER BY T1;
T1






123
中文
%^&*[];//\
INT
DROP TABLE Z0CASE;
CREATE TABLE Z0CASE(T1 INT) DEFAULT charset= utf8mb4 DEFAULT collate = utf8mb4_general_ci;
INSERT INTO Z0CASE VALUES(123);
INSERT INTO Z0CASE VALUES(123.3445);
INSERT INTO Z0CASE VALUES(NULL);
SELECT * FROM Z0CASE ORDER BY T1;
T1
NULL
123
123
SELECT table_name,column_type,COLLATION_NAME,CHARACTER_SET_NAME FROM information_schema.columns WHERE table_name='Z0CASE';
table_name	column_type	COLLATION_NAME	CHARACTER_SET_NAME
z0case	int(11)	NULL	NULL
SELECT table_name,table_collation FROM information_schema.tables WHERE table_name='Z0CASE';
table_name	table_collation
z0case	utf8mb4_general_ci
ALTER TABLE Z0CASE CONVERT TO CHARACTER SET 'utf8mb4' COLLATE 'utf8mb4_unicode_ci';
SELECT table_name,table_collation FROM information_schema.tables WHERE table_name='Z0CASE';
table_name	table_collation
z0case	utf8mb4_unicode_ci
SELECT * FROM Z0CASE ORDER BY T1;
T1
NULL
123
123
insert
INSERT INTO Z0CASE VALUES(111);
INSERT INTO Z0CASE VALUES('2001');
INSERT INTO Z0CASE VALUES('!*?< >aB12 中文');
INSERT INTO Z0CASE VALUES(b'0101101');
INSERT INTO Z0CASE VALUES('2021-10-01 12:23:35.54');
INSERT INTO Z0CASE VALUES('2011-11-01');
INSERT INTO Z0CASE VALUES('22:22:35');
INSERT INTO Z0CASE VALUES(12.345);
INSERT INTO Z0CASE VALUES(null);
SELECT table_name,column_type,COLLATION_NAME,CHARACTER_SET_NAME FROM information_schema.columns WHERE table_name='Z0CASE';
table_name	column_type	COLLATION_NAME	CHARACTER_SET_NAME
z0case	int(11)	NULL	NULL
SELECT table_name,table_collation FROM information_schema.tables WHERE table_name='Z0CASE';
table_name	table_collation
z0case	utf8mb4_unicode_ci
SELECT * FROM Z0CASE ORDER BY T1;
T1
NULL
NULL
0
12
22
45
111
123
123
2001
2011
2021
update
UPDATE Z0CASE SET T1=NULL WHERE T1='111';
UPDATE Z0CASE SET T1='12:31:56' WHERE T1=2001;
UPDATE Z0CASE SET T1=1221.34 WHERE T1=2001;
UPDATE Z0CASE SET T1='Aa1$< >中文' WHERE T1='111';
UPDATE Z0CASE SET T1=b'0101101' WHERE T1=111;
SELECT table_name,column_type,COLLATION_NAME,CHARACTER_SET_NAME FROM information_schema.columns WHERE table_name='Z0CASE';
table_name	column_type	COLLATION_NAME	CHARACTER_SET_NAME
z0case	int(11)	NULL	NULL
SELECT table_name,table_collation FROM information_schema.tables WHERE table_name='Z0CASE';
table_name	table_collation
z0case	utf8mb4_unicode_ci
SELECT * FROM Z0CASE ORDER BY T1;
T1
NULL
NULL
NULL
0
12
12
22
45
123
123
2011
2021
delete
DELETE FROM Z0CASE WHERE T1=1221.34;
DELETE FROM Z0CASE WHERE T1 IS NULL;
SELECT * FROM Z0CASE ORDER BY T1;
T1
0
12
12
22
45
123
123
2011
2021
DOUBLE
DROP TABLE Z0CASE;
CREATE TABLE Z0CASE(T1 DOUBLE(26,0)) DEFAULT charset= utf8mb4 DEFAULT collate = utf8mb4_general_ci;
INSERT INTO Z0CASE VALUES(123);
INSERT INTO Z0CASE VALUES('123.3445');
INSERT INTO Z0CASE VALUES(641231122123.5445);
INSERT INTO Z0CASE VALUES(NULL);
SELECT * FROM Z0CASE ORDER BY T1;
T1
NULL
123
123
641231122124
SELECT table_name,column_type,COLLATION_NAME,CHARACTER_SET_NAME FROM information_schema.columns WHERE table_name='Z0CASE';
table_name	column_type	COLLATION_NAME	CHARACTER_SET_NAME
z0case	double(26,0)	NULL	NULL
SELECT table_name,table_collation FROM information_schema.tables WHERE table_name='Z0CASE';
table_name	table_collation
z0case	utf8mb4_general_ci
ALTER TABLE Z0CASE CONVERT TO CHARACTER SET 'utf8mb4' COLLATE 'utf8mb4_unicode_ci';
SELECT table_name,table_collation FROM information_schema.tables WHERE table_name='Z0CASE';
table_name	table_collation
z0case	utf8mb4_unicode_ci
SELECT * FROM Z0CASE ORDER BY T1;
T1
NULL
123
123
641231122124
insert
INSERT INTO Z0CASE VALUES(111);
INSERT INTO Z0CASE VALUES('2001');
INSERT INTO Z0CASE VALUES('!*?< >aB12 中文');
Warnings:
Warning	1292	Truncated incorrect DOUBLE value: '!*?< >aB12 中文'
INSERT INTO Z0CASE VALUES(b'0101101');
INSERT INTO Z0CASE VALUES('2021-10-01 12:23:35.54');
Warnings:
Warning	1292	Truncated incorrect DOUBLE value: '2021-10-01 12:23:35.54'
INSERT INTO Z0CASE VALUES('2011-11-01');
Warnings:
Warning	1292	Truncated incorrect DOUBLE value: '2011-11-01'
INSERT INTO Z0CASE VALUES('22:22:35');
Warnings:
Warning	1292	Truncated incorrect DOUBLE value: '22:22:35'
INSERT INTO Z0CASE VALUES(12.3456);
INSERT INTO Z0CASE VALUES(null);
SELECT table_name,column_type,COLLATION_NAME,CHARACTER_SET_NAME FROM information_schema.columns WHERE table_name='Z0CASE';
table_name	column_type	COLLATION_NAME	CHARACTER_SET_NAME
z0case	double(26,0)	NULL	NULL
SELECT table_name,table_collation FROM information_schema.tables WHERE table_name='Z0CASE';
table_name	table_collation
z0case	utf8mb4_unicode_ci
SELECT * FROM Z0CASE ORDER BY T1;
T1
NULL
NULL
0
12
22
45
111
123
123
2001
2011
2021
641231122124
update
UPDATE Z0CASE SET T1=NULL WHERE T1='111';
UPDATE Z0CASE SET T1='12:31:56' WHERE T1=2001;
Warnings:
Warning	1292	Truncated incorrect DOUBLE value: '12:31:56'
UPDATE Z0CASE SET T1=1221.34 WHERE T1='2001';
UPDATE Z0CASE SET T1='Aa1$< >中文' WHERE T1=111;
UPDATE Z0CASE SET T1=b'0101101' WHERE T1=111;
SELECT table_name,column_type,COLLATION_NAME,CHARACTER_SET_NAME FROM information_schema.columns WHERE table_name='Z0CASE';
table_name	column_type	COLLATION_NAME	CHARACTER_SET_NAME
z0case	double(26,0)	NULL	NULL
SELECT table_name,table_collation FROM information_schema.tables WHERE table_name='Z0CASE';
table_name	table_collation
z0case	utf8mb4_unicode_ci
SELECT * FROM Z0CASE ORDER BY T1;
T1
NULL
NULL
NULL
0
12
12
22
45
123
123
2011
2021
641231122124
delete
DELETE FROM Z0CASE WHERE T1=1221.34;
DELETE FROM Z0CASE WHERE T1 IS NULL;
SELECT * FROM Z0CASE ORDER BY T1;
T1
0
12
12
22
45
123
123
2011
2021
641231122124
DATE
DROP TABLE Z0CASE;
CREATE TABLE Z0CASE(T1 DATE) DEFAULT charset= utf8mb4 DEFAULT collate = utf8mb4_general_ci;
INSERT INTO Z0CASE VALUES('20210321');
INSERT INTO Z0CASE VALUES('2020-11-21');
INSERT INTO Z0CASE VALUES('2021-01-21 11:58:39.456');
INSERT INTO Z0CASE VALUES(NULL);
SELECT * FROM Z0CASE ORDER BY T1;
T1
NULL
2020-11-21
2021-01-21
2021-03-21
SELECT table_name,column_type,COLLATION_NAME,CHARACTER_SET_NAME FROM information_schema.columns WHERE table_name='Z0CASE';
table_name	column_type	COLLATION_NAME	CHARACTER_SET_NAME
z0case	date	NULL	NULL
SELECT table_name,table_collation FROM information_schema.tables WHERE table_name='Z0CASE';
table_name	table_collation
z0case	utf8mb4_general_ci
ALTER TABLE Z0CASE CONVERT TO CHARACTER SET 'utf8mb4' COLLATE 'utf8mb4_unicode_ci';
SELECT table_name,table_collation FROM information_schema.tables WHERE table_name='Z0CASE';
table_name	table_collation
z0case	utf8mb4_unicode_ci
SELECT * FROM Z0CASE ORDER BY T1;
T1
NULL
2020-11-21
2021-01-21
2021-03-21
insert
INSERT INTO Z0CASE VALUES(111);
INSERT INTO Z0CASE VALUES('2001');
INSERT INTO Z0CASE VALUES('!*?< >aB12 中文');
INSERT INTO Z0CASE VALUES(b'0101101');
INSERT INTO Z0CASE VALUES('2021-10-01 12:23:35.54');
INSERT INTO Z0CASE VALUES('2011-11-01');
INSERT INTO Z0CASE VALUES('22:22:35');
INSERT INTO Z0CASE VALUES(12.3456);
INSERT INTO Z0CASE VALUES(null);
SELECT table_name,column_type,COLLATION_NAME,CHARACTER_SET_NAME FROM information_schema.columns WHERE table_name='Z0CASE';
table_name	column_type	COLLATION_NAME	CHARACTER_SET_NAME
z0case	date	NULL	NULL
SELECT table_name,table_collation FROM information_schema.tables WHERE table_name='Z0CASE';
table_name	table_collation
z0case	utf8mb4_unicode_ci
SELECT * FROM Z0CASE ORDER BY T1;
T1
NULL
NULL
0000-00-00
0000-00-00
0000-00-00
0000-00-00
0000-00-00
2000-01-11
2011-11-01
2020-11-21
2021-01-21
2021-03-21
2021-10-01
update
UPDATE Z0CASE SET T1=NULL WHERE T1='2020-11-21';
UPDATE Z0CASE SET T1='12:31:56' WHERE T1='2021-01-21';
UPDATE Z0CASE SET T1=1221.34 WHERE T1='2021-01-21';
UPDATE Z0CASE SET T1='Aa1$< >中文' WHERE T1='2021-01-21';
UPDATE Z0CASE SET T1=b'0101101' WHERE T1='2021-01-21';
UPDATE Z0CASE SET T1='2011-11-11' WHERE T1='2021-01-21';
UPDATE Z0CASE SET T1='2012-12-21 09:10:21' WHERE T1='2011-11-11';
SELECT table_name,column_type,COLLATION_NAME,CHARACTER_SET_NAME FROM information_schema.columns WHERE table_name='Z0CASE';
table_name	column_type	COLLATION_NAME	CHARACTER_SET_NAME
z0case	date	NULL	NULL
SELECT table_name,table_collation FROM information_schema.tables WHERE table_name='Z0CASE';
table_name	table_collation
z0case	utf8mb4_unicode_ci
SELECT * FROM Z0CASE ORDER BY T1;
T1
NULL
NULL
NULL
0000-00-00
0000-00-00
0000-00-00
0000-00-00
0000-00-00
0000-00-00
2000-01-11
2011-11-01
2021-03-21
2021-10-01
delete
DELETE FROM Z0CASE WHERE T1=0;
DELETE FROM Z0CASE WHERE T1 IS NULL;
SELECT * FROM Z0CASE ORDER BY T1;
T1
2000-01-11
2011-11-01
2021-03-21
2021-10-01
TIME
DROP TABLE Z0CASE;
CREATE TABLE Z0CASE(T1 TIME) DEFAULT charset= utf8mb4 DEFAULT collate = utf8mb4_general_ci;
INSERT INTO Z0CASE VALUES('2020-11-21');
INSERT INTO Z0CASE VALUES('2021-01-21 11:58:39.456');
INSERT INTO Z0CASE VALUES('21:28:33.556');
INSERT INTO Z0CASE VALUES('2001');
INSERT INTO Z0CASE VALUES(NULL);
SELECT * FROM Z0CASE ORDER BY T1;
T1
NULL
00:20:01
00:20:20
11:58:39
21:28:34
SELECT table_name,column_type,COLLATION_NAME,CHARACTER_SET_NAME FROM information_schema.columns WHERE table_name='Z0CASE';
table_name	column_type	COLLATION_NAME	CHARACTER_SET_NAME
z0case	time	NULL	NULL
SELECT table_name,table_collation FROM information_schema.tables WHERE table_name='Z0CASE';
table_name	table_collation
z0case	utf8mb4_general_ci
ALTER TABLE Z0CASE CONVERT TO CHARACTER SET 'utf8mb4' COLLATE 'utf8mb4_unicode_ci';
SELECT table_name,table_collation FROM information_schema.tables WHERE table_name='Z0CASE';
table_name	table_collation
z0case	utf8mb4_unicode_ci
SELECT * FROM Z0CASE ORDER BY T1;
T1
NULL
00:20:01
00:20:20
11:58:39
21:28:34
insert
INSERT INTO Z0CASE VALUES(71);
INSERT INTO Z0CASE VALUES('2001');
INSERT INTO Z0CASE VALUES('!*?< >aB12 中文');
INSERT INTO Z0CASE VALUES(b'0101101');
INSERT INTO Z0CASE VALUES('2021-10-01 12:23:35.54');
INSERT INTO Z0CASE VALUES('2011-11-01');
INSERT INTO Z0CASE VALUES('22:22:35');
INSERT INTO Z0CASE VALUES(72.7476);
INSERT INTO Z0CASE VALUES(null);
SELECT table_name,column_type,COLLATION_NAME,CHARACTER_SET_NAME FROM information_schema.columns WHERE table_name='Z0CASE';
table_name	column_type	COLLATION_NAME	CHARACTER_SET_NAME
z0case	time	NULL	NULL
SELECT table_name,table_collation FROM information_schema.tables WHERE table_name='Z0CASE';
table_name	table_collation
z0case	utf8mb4_unicode_ci
SELECT * FROM Z0CASE ORDER BY T1;
T1
NULL
NULL
00:00:00
00:00:00
00:00:00
00:00:00
00:20:01
00:20:01
00:20:11
00:20:20
11:58:39
12:23:36
21:28:34
22:22:35
update
UPDATE Z0CASE SET T1=NULL WHERE T1='22:22:35';
UPDATE Z0CASE SET T1='12:31:56' WHERE T1='21:28:34';
UPDATE Z0CASE SET T1=1221.34 WHERE T1='12:31:56';
UPDATE Z0CASE SET T1='Aa1$< >中文' WHERE T1='12:31:56';
UPDATE Z0CASE SET T1=b'0101101' WHERE T1='12:31:56';
UPDATE Z0CASE SET T1='2011-11-11' WHERE T1='12:31:56';
UPDATE Z0CASE SET T1='2012-12-21 09:10:21' WHERE T1='12:31:56';
SELECT table_name,column_type,COLLATION_NAME,CHARACTER_SET_NAME FROM information_schema.columns WHERE table_name='Z0CASE';
table_name	column_type	COLLATION_NAME	CHARACTER_SET_NAME
z0case	time	NULL	NULL
SELECT table_name,table_collation FROM information_schema.tables WHERE table_name='Z0CASE';
table_name	table_collation
z0case	utf8mb4_unicode_ci
SELECT * FROM Z0CASE ORDER BY T1;
T1
NULL
NULL
NULL
00:00:00
00:00:00
00:00:00
00:00:00
00:12:21
00:20:01
00:20:01
00:20:11
00:20:20
11:58:39
12:23:36
delete
DELETE FROM Z0CASE WHERE T1='0';
DELETE FROM Z0CASE WHERE T1 IS NULL;
SELECT * FROM Z0CASE ORDER BY T1;
T1
00:12:21
00:20:01
00:20:01
00:20:11
00:20:20
11:58:39
12:23:36
DROP TABLE Z0CASE;
DROP USER 'zhang'@'%';
DROP DATABASE charset_test;
########Empty recycle bin, delete test database, tables, etc ##########
