purge recyclebin;
# Environmental cleaning
DROP USER zhang;
ERROR HY000: Operation DROP USER failed for 'zhang'@'%'
CREATE USER 'zhang'@'%' IDENTIFIED BY 'zhang';
GRANT all ON *.* TO 'zhang'@'%';
CREATE DATABASE IF NOT EXISTS charset_test;
USE charset_test;
SET sql_mode='';
SELECT @@sql_mode;
@@sql_mode


DROP TABLE Z0CASE;
DROP TABLE Z1CASE;
SET
CREATE TABLE Z0CASE(T1 SET('123','%^&*[];//\\','abc','ä¸­æ–‡','Ab') PRIMARY KEY) DEFAULT charset= utf8mb4 DEFAULT collate = utf8mb4_general_ci;
INSERT INTO Z0CASE VALUES('123');
INSERT INTO Z0CASE VALUES('%^&*[];//\\');
INSERT INTO Z0CASE VALUES('abc');
INSERT INTO Z0CASE VALUES('ä¸­æ–‡');
SELECT T1,HEX(T1) FROM Z0CASE ORDER BY T1*1;
T1	HEX(T1)
123	313233
%^&*[];//\	255E262A5B5D3B2F2F5C
abc	616263
ä¸­æ–‡	E4B8ADE69687
SELECT table_name,column_type,COLLATION_NAME,CHARACTER_SET_NAME FROM information_schema.columns WHERE table_name='Z0CASE';
table_name	column_type	COLLATION_NAME	CHARACTER_SET_NAME
z0case	set('123','%^&*[];//\','abc','ä¸­æ–‡','Ab')	utf8mb4_general_ci	utf8mb4
SELECT table_name,table_collation FROM information_schema.tables WHERE table_name='Z0CASE';
table_name	table_collation
z0case	utf8mb4_general_ci
ALTER TABLE Z0CASE CONVERT TO CHARACTER SET 'binary' COLLATE 'binary';
SELECT table_name,table_collation FROM information_schema.tables WHERE table_name='Z0CASE';
table_name	table_collation
z0case	binary
SHOW INDEX FROM Z0CASE;
Table	Non_unique	Key_name	Seq_in_index	Column_name	Collation	Cardinality	Sub_part	Packed	Null	Index_type	Comment	Index_comment	Visible	Expression
z0case	0	PRIMARY	1	T1	A	NULL	NULL	NULL		BTREE	available		YES	NULL
SELECT T1,HEX(T1) FROM Z0CASE ORDER BY T1*1;
T1	HEX(T1)
123	313233
%^&*[];//\	255E262A5B5D3B2F2F5C
abc	616263
ä¸­æ–‡	E4B8ADE69687
INSERT INTO Z0CASE VALUES(123);
SELECT * FROM Z0CASE WHERE T1 IN('123');
T1
123
INSERT INTO Z0CASE VALUES(null);
ERROR 23000: Column 'T1' cannot be null
INSERT INTO Z0CASE VALUES('');
SELECT T1,HEX(T1) FROM Z0CASE ORDER BY T1*1;
T1	HEX(T1)
	
123	313233
%^&*[];//\	255E262A5B5D3B2F2F5C
abc	616263
ä¸­æ–‡	E4B8ADE69687
123,%^&*[];//\,ä¸­æ–‡,Ab	3132332C255E262A5B5D3B2F2F5C2CE4B8ADE696872C4162
UPDATE Z0CASE SET T1=NULL WHERE T1='123';
ERROR 23000: Duplicate entry '0' for key 'PRIMARY'
UPDATE Z0CASE SET T1=123 WHERE T1='123';
ERROR 23000: Duplicate entry '27' for key 'PRIMARY'
UPDATE Z0CASE SET T1='ab' WHERE T1='123';
ERROR 23000: Duplicate entry '0' for key 'PRIMARY'
UPDATE Z0CASE SET T1='Ab' WHERE T1='123';
SELECT T1,HEX(T1) FROM Z0CASE ORDER BY T1*1;
T1	HEX(T1)
	
%^&*[];//\	255E262A5B5D3B2F2F5C
abc	616263
ä¸­æ–‡	E4B8ADE69687
Ab	4162
123,%^&*[];//\,ä¸­æ–‡,Ab	3132332C255E262A5B5D3B2F2F5C2CE4B8ADE696872C4162
DROP TABLE Z0CASE;
CREATE TABLE Z0CASE(T1 SET('123','%^&*[];//\\','abc','ä¸­æ–‡','Ab') UNIQUE) DEFAULT charset='binary' DEFAULT collate='binary';
INSERT INTO Z0CASE VALUES('123');
INSERT INTO Z0CASE VALUES('%^&*[];//\\');
INSERT INTO Z0CASE VALUES('abc');
INSERT INTO Z0CASE VALUES('ä¸­æ–‡');
SELECT T1,HEX(T1) FROM Z0CASE ORDER BY T1*1;
T1	HEX(T1)
123	313233
%^&*[];//\	255E262A5B5D3B2F2F5C
abc	616263
ä¸­æ–‡	E4B8ADE69687
SELECT table_name,column_type,COLLATION_NAME,CHARACTER_SET_NAME FROM information_schema.columns WHERE table_name='Z0CASE';
table_name	column_type	COLLATION_NAME	CHARACTER_SET_NAME
z0case	set('123','%^&*[];//\','abc','ä¸­æ–‡','Ab')	binary	binary
SELECT table_name,table_collation FROM information_schema.tables WHERE table_name='Z0CASE';
table_name	table_collation
z0case	binary
ALTER TABLE Z0CASE CONVERT TO CHARACTER SET 'gbk' COLLATE 'gbk_bin';
SELECT table_name,table_collation FROM information_schema.tables WHERE table_name='Z0CASE';
table_name	table_collation
z0case	gbk_bin
SHOW INDEX FROM Z0CASE;
Table	Non_unique	Key_name	Seq_in_index	Column_name	Collation	Cardinality	Sub_part	Packed	Null	Index_type	Comment	Index_comment	Visible	Expression
z0case	0	T1	1	T1	A	NULL	NULL	NULL	YES	BTREE	available		YES	NULL
SELECT T1,HEX(T1) FROM Z0CASE ORDER BY T1*1;
T1	HEX(T1)
123	313233
%^&*[];//\	255E262A5B5D3B2F2F5C
abc	616263
ä¸­æ–‡	E4B8ADE69687
INSERT INTO Z0CASE VALUES('123');
ERROR 23000: Duplicate entry '1' for key 'T1'
INSERT INTO Z0CASE VALUES('ABC');
UPDATE Z0CASE SET T1='' WHERE T1='abc';
ERROR 23000: Duplicate entry '0' for key 'T1'
UPDATE Z0CASE SET T1='ä¸­æ–‡' WHERE T1='abc';
ERROR 23000: Duplicate entry '8' for key 'T1'
SELECT T1,HEX(T1) FROM Z0CASE ORDER BY T1*1;
T1	HEX(T1)
	
123	313233
%^&*[];//\	255E262A5B5D3B2F2F5C
abc	616263
ä¸­æ–‡	E4B8ADE69687
DROP TABLE Z0CASE;
CREATE TABLE Z0CASE(T1 SET('123','%^&*[];//\\','abc','ä¸­æ–‡','Ab'),T2 ENUM('122','20:22:32','ABC',b'1100101','ab')) DEFAULT charset= 'binary' DEFAULT collate = 'binary';
INSERT INTO Z0CASE VALUES('123','122');
INSERT INTO Z0CASE VALUES('%^&*[];//\\','20:22:32');
INSERT INTO Z0CASE VALUES('abc','ABC');
INSERT INTO Z0CASE VALUES('ä¸­æ–‡',b'1100101');
SELECT T1,HEX(T1) FROM Z0CASE ORDER BY T1*1;
T1	HEX(T1)
123	313233
%^&*[];//\	255E262A5B5D3B2F2F5C
abc	616263
ä¸­æ–‡	E4B8ADE69687
SELECT table_name,column_type,COLLATION_NAME,CHARACTER_SET_NAME FROM information_schema.columns WHERE table_name='Z0CASE';
table_name	column_type	COLLATION_NAME	CHARACTER_SET_NAME
z0case	set('123','%^&*[];//\','abc','ä¸­æ–‡','Ab')	binary	binary
z0case	enum('122','20:22:32','ABC','e','ab')	binary	binary
SELECT table_name,table_collation FROM information_schema.tables WHERE table_name='Z0CASE';
table_name	table_collation
z0case	binary
CREATE INDEX ind ON Z0CASE(T1,T2);
SHOW INDEX FROM Z0CASE;
Table	Non_unique	Key_name	Seq_in_index	Column_name	Collation	Cardinality	Sub_part	Packed	Null	Index_type	Comment	Index_comment	Visible	Expression
z0case	1	ind	1	T1	A	NULL	NULL	NULL	YES	BTREE	available		YES	NULL
z0case	1	ind	2	T2	A	NULL	NULL	NULL	YES	BTREE	available		YES	NULL
ALTER TABLE Z0CASE CONVERT TO CHARACTER SET 'utf8mb4' COLLATE 'utf8mb4_bin';
SELECT table_name,table_collation FROM information_schema.tables WHERE table_name='Z0CASE';
table_name	table_collation
z0case	utf8mb4_bin
SHOW INDEX FROM Z0CASE;
Table	Non_unique	Key_name	Seq_in_index	Column_name	Collation	Cardinality	Sub_part	Packed	Null	Index_type	Comment	Index_comment	Visible	Expression
z0case	1	ind	1	T1	A	NULL	NULL	NULL	YES	BTREE	available		YES	NULL
z0case	1	ind	2	T2	A	NULL	NULL	NULL	YES	BTREE	available		YES	NULL
SELECT T1,HEX(T1) FROM Z0CASE ORDER BY T1*1;
T1	HEX(T1)
123	313233
%^&*[];//\	255E262A5B5D3B2F2F5C
abc	616263
ä¸­æ–‡	E4B8ADE69687
INSERT INTO Z0CASE VALUES(123,'122');
UPDATE Z0CASE SET T1='ABC' WHERE T2='20:22:32';
UPDATE Z0CASE SET T1='Ab' WHERE T2='ABC';
SELECT T1,HEX(T1) FROM Z0CASE ORDER BY T1*1;
T1	HEX(T1)
	
123	313233
ä¸­æ–‡	E4B8ADE69687
Ab	4162
123,%^&*[];//\,ä¸­æ–‡,Ab	3132332C255E262A5B5D3B2F2F5C2CE4B8ADE696872C4162
DROP TABLE Z0CASE;
CREATE TABLE Z1CASE(T2 SET('123','%^&*[];//\\') PRIMARY KEY) DEFAULT charset= 'binary' DEFAULT collate = 'binary';
CREATE TABLE Z0CASE(T1 SET('123','%^&*[];//\\'),CONSTRAINT fk_t1_t2 FOREIGN KEY(T1) REFERENCES Z1CASE(T2)) DEFAULT charset= 'binary' DEFAULT collate = 'binary';
ALTER TABLE Z0CASE CONVERT TO CHARACTER SET 'gbk' COLLATE 'gbk_bin';
SELECT table_name,table_collation FROM information_schema.tables WHERE table_name='Z0CASE';
table_name	table_collation
z0case	gbk_bin
SHOW INDEX FROM Z0CASE;
Table	Non_unique	Key_name	Seq_in_index	Column_name	Collation	Cardinality	Sub_part	Packed	Null	Index_type	Comment	Index_comment	Visible	Expression
DROP TABLE Z0CASE;
DROP TABLE Z1CASE;
CREATE TABLE Z0CASE(T1 SET('123','%^&*[];//\\','abc','ä¸­æ–‡',b'1100101','') NOT NULL) DEFAULT charset= 'binary' DEFAULT collate = 'binary';
INSERT INTO Z0CASE VALUES('123');
INSERT INTO Z0CASE VALUES('%^&*[];//\\');
INSERT INTO Z0CASE VALUES('abc');
INSERT INTO Z0CASE VALUES('ä¸­æ–‡');
INSERT INTO Z0CASE VALUES(b'1100101');
SELECT T1,HEX(T1) FROM Z0CASE ORDER BY T1*1;
T1	HEX(T1)
123	313233
%^&*[];//\	255E262A5B5D3B2F2F5C
abc	616263
ä¸­æ–‡	E4B8ADE69687
e	65
SELECT table_name,column_type,COLLATION_NAME,CHARACTER_SET_NAME FROM information_schema.columns WHERE table_name='Z0CASE';
table_name	column_type	COLLATION_NAME	CHARACTER_SET_NAME
z0case	set('123','%^&*[];//\','abc','ä¸­æ–‡','e','')	binary	binary
SELECT table_name,table_collation FROM information_schema.tables WHERE table_name='Z0CASE';
table_name	table_collation
z0case	binary
ALTER TABLE Z0CASE CONVERT TO CHARACTER SET 'gbk' COLLATE 'gbk_bin';
SELECT table_name,table_collation FROM information_schema.tables WHERE table_name='Z0CASE';
table_name	table_collation
z0case	gbk_bin
SELECT T1,HEX(T1) FROM Z0CASE ORDER BY T1*1;
T1	HEX(T1)
123	313233
%^&*[];//\	255E262A5B5D3B2F2F5C
abc	616263
ä¸­æ–‡	E4B8ADE69687
e	65
INSERT INTO Z0CASE VALUES(NULL);
ERROR 23000: Column 'T1' cannot be null
INSERT INTO Z0CASE VALUES('');
SELECT T1,HEX(T1) FROM Z0CASE ORDER BY T1*1;
T1	HEX(T1)
	
123	313233
%^&*[];//\	255E262A5B5D3B2F2F5C
abc	616263
ä¸­æ–‡	E4B8ADE69687
e	65
UPDATE Z0CASE SET T1=NULL WHERE T1='123';
Warnings:
Warning	1048	Column 'T1' cannot be null
UPDATE Z0CASE SET T1='aBc' WHERE T1='123';
SELECT T1,HEX(T1) FROM Z0CASE ORDER BY T1*1;
T1	HEX(T1)
	
	
%^&*[];//\	255E262A5B5D3B2F2F5C
abc	616263
ä¸­æ–‡	E4B8ADE69687
e	65
UPDATE Z0CASE SET T1='' WHERE T1='123';
SELECT T1,HEX(T1) FROM Z0CASE ORDER BY T1*1;
T1	HEX(T1)
	
	
%^&*[];//\	255E262A5B5D3B2F2F5C
abc	616263
ä¸­æ–‡	E4B8ADE69687
e	65
DROP TABLE Z0CASE;
CREATE TABLE Z0CASE(T1 SET('123','%^&*[];//\\','abc','ä¸­æ–‡',b'1100101','') DEFAULT 'abc',T2 INT) DEFAULT charset= 'binary' DEFAULT collate = 'binary';
INSERT INTO Z0CASE VALUES('',1);
INSERT INTO Z0CASE VALUES('%^&*[];//\\',2);
INSERT INTO Z0CASE VALUES('abc',3);
INSERT INTO Z0CASE VALUES('ä¸­æ–‡',4);
INSERT INTO Z0CASE VALUES(b'1100101',5);
INSERT INTO Z0CASE VALUES(NULL,6);
INSERT INTO Z0CASE(T2) VALUES(7);
SELECT T1,HEX(T1),T2 FROM Z0CASE ORDER BY T2;
T1	HEX(T1)	T2
		1
%^&*[];//\	255E262A5B5D3B2F2F5C	2
abc	616263	3
ä¸­æ–‡	E4B8ADE69687	4
e	65	5
NULL	NULL	6
abc	616263	7
SELECT table_name,column_type,COLLATION_NAME,CHARACTER_SET_NAME FROM information_schema.columns WHERE table_name='Z0CASE';
table_name	column_type	COLLATION_NAME	CHARACTER_SET_NAME
z0case	set('123','%^&*[];//\','abc','ä¸­æ–‡','e','')	binary	binary
z0case	int(11)	NULL	NULL
SELECT table_name,table_collation FROM information_schema.tables WHERE table_name='Z0CASE';
table_name	table_collation
z0case	binary
ALTER TABLE Z0CASE CONVERT TO CHARACTER SET 'utf16' COLLATE 'utf16_bin';
SELECT table_name,table_collation FROM information_schema.tables WHERE table_name='Z0CASE';
table_name	table_collation
z0case	utf16_bin
SELECT T1,HEX(T1),T2 FROM Z0CASE ORDER BY T2;
T1	HEX(T1)	T2
		1
%^&*[];//\	255E262A5B5D3B2F2F5C	2
abc	616263	3
ä¸­æ–‡	E4B8ADE69687	4
e	65	5
NULL	NULL	6
abc	616263	7
INSERT INTO Z0CASE(T2) VALUES(8);
INSERT INTO Z0CASE VALUES('NN',9);
INSERT INTO Z0CASE VALUES('',10);
INSERT INTO Z0CASE VALUES(NULL,11);
SELECT T1,HEX(T1),T2 FROM Z0CASE ORDER BY T2;
T1	HEX(T1)	T2
		1
%^&*[];//\	255E262A5B5D3B2F2F5C	2
abc	616263	3
ä¸­æ–‡	E4B8ADE69687	4
e	65	5
NULL	NULL	6
abc	616263	7
abc	616263	8
		9
		10
NULL	NULL	11
BIT
DROP TABLE Z0CASE;
CREATE TABLE Z0CASE(T1 BIT(20) PRIMARY KEY) DEFAULT charset= utf8mb4 DEFAULT collate = utf8mb4_general_ci;
INSERT INTO Z0CASE VALUES(b'01011001011011011010');
INSERT INTO Z0CASE VALUES(b'01011001011');
INSERT INTO Z0CASE VALUES(b'0');
SELECT BIN(T1) FROM Z0CASE ORDER BY T1;
BIN(T1)
0
1011001011
1011001011011011010
SELECT table_name,column_type,COLLATION_NAME,CHARACTER_SET_NAME FROM information_schema.columns WHERE table_name='Z0CASE';
table_name	column_type	COLLATION_NAME	CHARACTER_SET_NAME
z0case	bit(20)	NULL	NULL
SELECT table_name,table_collation FROM information_schema.tables WHERE table_name='Z0CASE';
table_name	table_collation
z0case	utf8mb4_general_ci
ALTER TABLE Z0CASE CONVERT TO CHARACTER SET 'binary' COLLATE 'binary';
SELECT table_name,table_collation FROM information_schema.tables WHERE table_name='Z0CASE';
table_name	table_collation
z0case	binary
SHOW INDEX FROM Z0CASE;
Table	Non_unique	Key_name	Seq_in_index	Column_name	Collation	Cardinality	Sub_part	Packed	Null	Index_type	Comment	Index_comment	Visible	Expression
z0case	0	PRIMARY	1	T1	A	NULL	NULL	NULL		BTREE	available		YES	NULL
SELECT BIN(T1) FROM Z0CASE ORDER BY T1;
BIN(T1)
0
1011001011
1011001011011011010
INSERT INTO Z0CASE VALUES(b'0');
ERROR 23000: Duplicate entry '0' for key 'PRIMARY'
INSERT INTO Z0CASE VALUES(null);
ERROR 23000: Column 'T1' cannot be null
INSERT INTO Z0CASE VALUES('');
ERROR 23000: Duplicate entry '0' for key 'PRIMARY'
INSERT INTO Z0CASE VALUES('A');
SELECT T1,BIN(T1) FROM Z0CASE ORDER BY T1;
T1	BIN(T1)
   	0
  A	1000001
 Ë	1011001011
–Ú	1011001011011011010
UPDATE Z0CASE SET T1=NULL WHERE T1=b'0';
Warnings:
Warning	1048	Column 'T1' cannot be null
UPDATE Z0CASE SET T1=b'00000000001011001011' WHERE T1=b'0';
ERROR 23000: Duplicate entry '715' for key 'PRIMARY'
UPDATE Z0CASE SET T1='' WHERE T1=b'0';
SELECT T1,BIN(T1) FROM Z0CASE ORDER BY T1;
T1	BIN(T1)
   	0
  A	1000001
 Ë	1011001011
–Ú	1011001011011011010
UPDATE Z0CASE SET T1='ab' WHERE T1=b'00000000000000000000';
SELECT T1,BIN(T1) FROM Z0CASE ORDER BY T1;
T1	BIN(T1)
  A	1000001
 Ë	1011001011
 ab	110000101100010
–Ú	1011001011011011010
DROP TABLE Z0CASE;
CREATE TABLE Z0CASE(T1 BIT(20) UNIQUE) DEFAULT charset='binary' DEFAULT collate='binary';
INSERT INTO Z0CASE VALUES(b'01011001011011011010');
INSERT INTO Z0CASE VALUES(b'01011001011');
INSERT INTO Z0CASE VALUES(b'0');
SELECT T1,BIN(T1) FROM Z0CASE ORDER BY T1;
T1	BIN(T1)
   	0
 Ë	1011001011
–Ú	1011001011011011010
SELECT table_name,column_type,COLLATION_NAME,CHARACTER_SET_NAME FROM information_schema.columns WHERE table_name='Z0CASE';
table_name	column_type	COLLATION_NAME	CHARACTER_SET_NAME
z0case	bit(20)	NULL	NULL
SELECT table_name,table_collation FROM information_schema.tables WHERE table_name='Z0CASE';
table_name	table_collation
z0case	binary
ALTER TABLE Z0CASE CONVERT TO CHARACTER SET 'gbk' COLLATE 'gbk_bin';
SELECT table_name,table_collation FROM information_schema.tables WHERE table_name='Z0CASE';
table_name	table_collation
z0case	gbk_bin
SHOW INDEX FROM Z0CASE;
Table	Non_unique	Key_name	Seq_in_index	Column_name	Collation	Cardinality	Sub_part	Packed	Null	Index_type	Comment	Index_comment	Visible	Expression
z0case	0	T1	1	T1	A	NULL	NULL	NULL	YES	BTREE	available		YES	NULL
SELECT T1,BIN(T1) FROM Z0CASE ORDER BY T1;
T1	BIN(T1)
   	0
 Ë	1011001011
–Ú	1011001011011011010
INSERT INTO Z0CASE VALUES(b'00000000000000000000');
ERROR 23000: Duplicate entry '0' for key 'T1'
INSERT INTO Z0CASE VALUES(0);
ERROR 23000: Duplicate entry '0' for key 'T1'
INSERT INTO Z0CASE VALUES('A');
INSERT INTO Z0CASE VALUES(NULL);
SELECT T1,BIN(T1) FROM Z0CASE ORDER BY T1;
T1	BIN(T1)
NULL	NULL
   	0
  A	1000001
 Ë	1011001011
–Ú	1011001011011011010
UPDATE Z0CASE SET T1=b'01011001011011011010' WHERE T1=b'00000000000000000000';
ERROR 23000: Duplicate entry '366298' for key 'T1'
UPDATE Z0CASE SET T1=NULL WHERE T1=b'00000000000000000000';
SELECT T1,BIN(T1) FROM Z0CASE ORDER BY T1;
T1	BIN(T1)
NULL	NULL
NULL	NULL
  A	1000001
 Ë	1011001011
–Ú	1011001011011011010
DROP TABLE Z0CASE;
CREATE TABLE Z0CASE(T1 BIT(20),T2 BIT(20)) DEFAULT charset= 'binary' DEFAULT collate = 'binary';
INSERT INTO Z0CASE VALUES(b'01011001011011011010',b'01011001011011011010');
INSERT INTO Z0CASE VALUES(b'01011001011',b'11011011010');
INSERT INTO Z0CASE VALUES(b'0',b'1');
SELECT T1,BIN(T1),T2 FROM Z0CASE ORDER BY T1;
T1	BIN(T1)	T2
   	0	  
 Ë	1011001011	 Ú
–Ú	1011001011011011010	–Ú
SELECT table_name,column_type,COLLATION_NAME,CHARACTER_SET_NAME FROM information_schema.columns WHERE table_name='Z0CASE';
table_name	column_type	COLLATION_NAME	CHARACTER_SET_NAME
z0case	bit(20)	NULL	NULL
z0case	bit(20)	NULL	NULL
SELECT table_name,table_collation FROM information_schema.tables WHERE table_name='Z0CASE';
table_name	table_collation
z0case	binary
CREATE INDEX ind ON Z0CASE(T1,T2);
SHOW INDEX FROM Z0CASE;
Table	Non_unique	Key_name	Seq_in_index	Column_name	Collation	Cardinality	Sub_part	Packed	Null	Index_type	Comment	Index_comment	Visible	Expression
z0case	1	ind	1	T1	A	NULL	NULL	NULL	YES	BTREE	available		YES	NULL
z0case	1	ind	2	T2	A	NULL	NULL	NULL	YES	BTREE	available		YES	NULL
ALTER TABLE Z0CASE CONVERT TO CHARACTER SET 'utf8mb4' COLLATE 'utf8mb4_bin';
SELECT table_name,table_collation FROM information_schema.tables WHERE table_name='Z0CASE';
table_name	table_collation
z0case	utf8mb4_bin
SHOW INDEX FROM Z0CASE;
Table	Non_unique	Key_name	Seq_in_index	Column_name	Collation	Cardinality	Sub_part	Packed	Null	Index_type	Comment	Index_comment	Visible	Expression
z0case	1	ind	1	T1	A	NULL	NULL	NULL	YES	BTREE	available		YES	NULL
z0case	1	ind	2	T2	A	NULL	NULL	NULL	YES	BTREE	available		YES	NULL
SELECT T1,BIN(T1),T2 FROM Z0CASE ORDER BY T1;
T1	BIN(T1)	T2
   	0	  
 Ë	1011001011	 Ú
–Ú	1011001011011011010	–Ú
INSERT INTO Z0CASE VALUES(b'01001011',b'11011010');
INSERT INTO Z0CASE VALUES('','');
SELECT T1,BIN(T1),T2 FROM Z0CASE ORDER BY T1;
T1	BIN(T1)	T2
   	0	   
   	0	  
  K	1001011	  Ú
 Ë	1011001011	 Ú
–Ú	1011001011011011010	–Ú
UPDATE Z0CASE SET T1='' WHERE T1=b'00000000000001001011';
UPDATE Z0CASE SET T1='a' WHERE T1=b'00000000000000000000';
SELECT T1,BIN(T1),T2 FROM Z0CASE ORDER BY T1;
T1	BIN(T1)	T2
  a	1100001	   
  a	1100001	  
  a	1100001	  Ú
 Ë	1011001011	 Ú
–Ú	1011001011011011010	–Ú
DROP TABLE Z0CASE;
CREATE TABLE Z1CASE(T2 BIT(20) PRIMARY KEY) DEFAULT charset= 'binary' DEFAULT collate = 'binary';
CREATE TABLE Z0CASE(T1 BIT(20),CONSTRAINT fk_t1_t2 FOREIGN KEY(T1) REFERENCES Z1CASE(T2)) DEFAULT charset= 'binary' DEFAULT collate = 'binary';
SELECT table_name,column_type,COLLATION_NAME,CHARACTER_SET_NAME FROM information_schema.columns WHERE table_name='Z0CASE';
table_name	column_type	COLLATION_NAME	CHARACTER_SET_NAME
z0case	bit(20)	NULL	NULL
SELECT table_name,table_collation FROM information_schema.tables WHERE table_name='Z0CASE';
table_name	table_collation
z0case	binary
ALTER TABLE Z0CASE CONVERT TO CHARACTER SET 'gbk' COLLATE 'gbk_bin';
SELECT table_name,table_collation FROM information_schema.tables WHERE table_name='Z0CASE';
table_name	table_collation
z0case	gbk_bin
SHOW INDEX FROM Z0CASE;
Table	Non_unique	Key_name	Seq_in_index	Column_name	Collation	Cardinality	Sub_part	Packed	Null	Index_type	Comment	Index_comment	Visible	Expression
INSERT INTO Z0CASE VALUES(b'010011001');
ERROR 23000: Cannot add or update a child row: a foreign key constraint fails
INSERT INTO Z0CASE VALUES('');
ERROR 23000: Cannot add or update a child row: a foreign key constraint fails
INSERT INTO Z0CASE VALUES(null);
SELECT T1,BIN(T1) FROM Z0CASE ORDER BY T1;
T1	BIN(T1)
NULL	NULL
DROP TABLE Z0CASE;
DROP TABLE Z1CASE;
CREATE TABLE Z0CASE(T1 BIT(20) NOT NULL) DEFAULT charset= 'binary' DEFAULT collate = 'binary';
INSERT INTO Z0CASE VALUES(b'01011001011011011010');
INSERT INTO Z0CASE VALUES(b'01011001011');
INSERT INTO Z0CASE VALUES(b'0');
INSERT INTO Z0CASE VALUES(b'1100101');
SELECT T1,BIN(T1) FROM Z0CASE ORDER BY T1;
T1	BIN(T1)
   	0
  e	1100101
 Ë	1011001011
–Ú	1011001011011011010
SELECT table_name,column_type,COLLATION_NAME,CHARACTER_SET_NAME FROM information_schema.columns WHERE table_name='Z0CASE';
table_name	column_type	COLLATION_NAME	CHARACTER_SET_NAME
z0case	bit(20)	NULL	NULL
SELECT table_name,table_collation FROM information_schema.tables WHERE table_name='Z0CASE';
table_name	table_collation
z0case	binary
ALTER TABLE Z0CASE CONVERT TO CHARACTER SET 'gbk' COLLATE 'gbk_bin';
SELECT table_name,table_collation FROM information_schema.tables WHERE table_name='Z0CASE';
table_name	table_collation
z0case	gbk_bin
SELECT T1,BIN(T1) FROM Z0CASE ORDER BY T1;
T1	BIN(T1)
   	0
  e	1100101
 Ë	1011001011
–Ú	1011001011011011010
INSERT INTO Z0CASE VALUES(NULL);
ERROR 23000: Column 'T1' cannot be null
INSERT INTO Z0CASE VALUES('');
SELECT T1,BIN(T1) FROM Z0CASE ORDER BY T1;
T1	BIN(T1)
   	0
   	0
  e	1100101
 Ë	1011001011
–Ú	1011001011011011010
UPDATE Z0CASE SET T1=NULL WHERE T1=b'00000000000000000000';
Warnings:
Warning	1048	Column 'T1' cannot be null
UPDATE Z0CASE SET T1='' WHERE T1=b'00000000000000000000';
UPDATE Z0CASE SET T1='23' WHERE T1=b'00000000000001100101';
SELECT T1,BIN(T1) FROM Z0CASE ORDER BY T1;
T1	BIN(T1)
   	0
   	0
 Ë	1011001011
 23	11001000110011
–Ú	1011001011011011010
DROP TABLE Z0CASE;
CREATE TABLE Z0CASE(T1 BIT(20) DEFAULT b'00000000000000000000',T2 INT) DEFAULT charset= 'binary' DEFAULT collate = 'binary';
INSERT INTO Z0CASE VALUES('',1);
INSERT INTO Z0CASE VALUES(b'1011100101',2);
INSERT INTO Z0CASE VALUES(b'11100101',3);
INSERT INTO Z0CASE VALUES(NULL,4);
INSERT INTO Z0CASE(T2) VALUES(5);
SELECT T1,BIN(T1),T2 FROM Z0CASE ORDER BY T2;
T1	BIN(T1)	T2
   	0	1
 å	1011100101	2
  å	11100101	3
NULL	NULL	4
   	0	5
SELECT table_name,column_type,COLLATION_NAME,CHARACTER_SET_NAME FROM information_schema.columns WHERE table_name='Z0CASE';
table_name	column_type	COLLATION_NAME	CHARACTER_SET_NAME
z0case	bit(20)	NULL	NULL
z0case	int(11)	NULL	NULL
SELECT table_name,table_collation FROM information_schema.tables WHERE table_name='Z0CASE';
table_name	table_collation
z0case	binary
ALTER TABLE Z0CASE CONVERT TO CHARACTER SET 'utf16' COLLATE 'utf16_bin';
SELECT table_name,table_collation FROM information_schema.tables WHERE table_name='Z0CASE';
table_name	table_collation
z0case	utf16_bin
SELECT T1,BIN(T1),T2 FROM Z0CASE ORDER BY T2;
T1	BIN(T1)	T2
   	0	1
 å	1011100101	2
  å	11100101	3
NULL	NULL	4
   	0	5
INSERT INTO Z0CASE(T2) VALUES(6);
INSERT INTO Z0CASE VALUES('NN',7);
INSERT INTO Z0CASE VALUES('',8);
SELECT T1,BIN(T1),T2 FROM Z0CASE ORDER BY T2;
T1	BIN(T1)	T2
   	0	1
 å	1011100101	2
  å	11100101	3
NULL	NULL	4
   	0	5
   	0	6
 NN	100111001001110	7
   	0	8
INT
DROP TABLE Z0CASE;
CREATE TABLE Z0CASE(T1 INT PRIMARY KEY) DEFAULT charset= utf8mb4 DEFAULT collate = utf8mb4_general_ci;
INSERT INTO Z0CASE VALUES('123');
INSERT INTO Z0CASE VALUES(234);
INSERT INTO Z0CASE VALUES(0);
SELECT * FROM Z0CASE ORDER BY T1;
T1
0
123
234
SELECT table_name,column_type,COLLATION_NAME,CHARACTER_SET_NAME FROM information_schema.columns WHERE table_name='Z0CASE';
table_name	column_type	COLLATION_NAME	CHARACTER_SET_NAME
z0case	int(11)	NULL	NULL
SELECT table_name,table_collation FROM information_schema.tables WHERE table_name='Z0CASE';
table_name	table_collation
z0case	utf8mb4_general_ci
ALTER TABLE Z0CASE CONVERT TO CHARACTER SET 'binary' COLLATE 'binary';
SELECT table_name,table_collation FROM information_schema.tables WHERE table_name='Z0CASE';
table_name	table_collation
z0case	binary
SHOW INDEX FROM Z0CASE;
Table	Non_unique	Key_name	Seq_in_index	Column_name	Collation	Cardinality	Sub_part	Packed	Null	Index_type	Comment	Index_comment	Visible	Expression
z0case	0	PRIMARY	1	T1	A	NULL	NULL	NULL		BTREE	available		YES	NULL
SELECT * FROM Z0CASE ORDER BY T1;
T1
0
123
234
INSERT INTO Z0CASE VALUES(123);
ERROR 23000: Duplicate entry '123' for key 'PRIMARY'
INSERT INTO Z0CASE VALUES(null);
ERROR 23000: Column 'T1' cannot be null
INSERT INTO Z0CASE VALUES('');
ERROR 23000: Duplicate entry '0' for key 'PRIMARY'
SELECT * FROM Z0CASE ORDER BY T1;
T1
0
123
234
UPDATE Z0CASE SET T1=NULL WHERE T1='123';
ERROR 23000: Duplicate entry '0' for key 'PRIMARY'
UPDATE Z0CASE SET T1=123 WHERE T1=0;
ERROR 23000: Duplicate entry '123' for key 'PRIMARY'
UPDATE Z0CASE SET T1=b'101010' WHERE T1='123';
SELECT * FROM Z0CASE ORDER BY T1;
T1
0
42
234
DROP TABLE Z0CASE;
CREATE TABLE Z0CASE(T1 INT UNIQUE) DEFAULT charset='binary' DEFAULT collate='binary';
INSERT INTO Z0CASE VALUES('123');
INSERT INTO Z0CASE VALUES(234);
INSERT INTO Z0CASE VALUES(0);
SELECT * FROM Z0CASE ORDER BY T1;
T1
0
123
234
SELECT table_name,column_type,COLLATION_NAME,CHARACTER_SET_NAME FROM information_schema.columns WHERE table_name='Z0CASE';
table_name	column_type	COLLATION_NAME	CHARACTER_SET_NAME
z0case	int(11)	NULL	NULL
SELECT table_name,table_collation FROM information_schema.tables WHERE table_name='Z0CASE';
table_name	table_collation
z0case	binary
ALTER TABLE Z0CASE CONVERT TO CHARACTER SET 'gbk' COLLATE 'gbk_bin';
SELECT table_name,table_collation FROM information_schema.tables WHERE table_name='Z0CASE';
table_name	table_collation
z0case	gbk_bin
SHOW INDEX FROM Z0CASE;
Table	Non_unique	Key_name	Seq_in_index	Column_name	Collation	Cardinality	Sub_part	Packed	Null	Index_type	Comment	Index_comment	Visible	Expression
z0case	0	T1	1	T1	A	NULL	NULL	NULL	YES	BTREE	available		YES	NULL
SELECT * FROM Z0CASE ORDER BY T1;
T1
0
123
234
INSERT INTO Z0CASE VALUES('123');
ERROR 23000: Duplicate entry '123' for key 'T1'
INSERT INTO Z0CASE VALUES('');
ERROR 23000: Duplicate entry '0' for key 'T1'
INSERT INTO Z0CASE VALUES(b'0');
ERROR 23000: Duplicate entry '0' for key 'T1'
INSERT INTO Z0CASE VALUES(b'01101');
SELECT * FROM Z0CASE ORDER BY T1;
T1
0
13
123
234
UPDATE Z0CASE SET T1=0 WHERE T1=123;
ERROR 23000: Duplicate entry '0' for key 'T1'
UPDATE Z0CASE SET T1=b'0' WHERE T1=123;
ERROR 23000: Duplicate entry '0' for key 'T1'
UPDATE Z0CASE SET T1=NULL WHERE T1=123;
SELECT * FROM Z0CASE ORDER BY T1;
T1
NULL
0
13
234
DROP TABLE Z0CASE;
CREATE TABLE Z0CASE(T1 INT,T2 INT) DEFAULT charset= 'binary' DEFAULT collate = 'binary';
INSERT INTO Z0CASE VALUES('123','123');
INSERT INTO Z0CASE VALUES(234,234);
INSERT INTO Z0CASE VALUES(0,0);
SELECT * FROM Z0CASE ORDER BY T1;
T1	T2
0	0
123	123
234	234
SELECT table_name,column_type,COLLATION_NAME,CHARACTER_SET_NAME FROM information_schema.columns WHERE table_name='Z0CASE';
table_name	column_type	COLLATION_NAME	CHARACTER_SET_NAME
z0case	int(11)	NULL	NULL
z0case	int(11)	NULL	NULL
SELECT table_name,table_collation FROM information_schema.tables WHERE table_name='Z0CASE';
table_name	table_collation
z0case	binary
CREATE INDEX ind ON Z0CASE(T1,T2);
SHOW INDEX FROM Z0CASE;
Table	Non_unique	Key_name	Seq_in_index	Column_name	Collation	Cardinality	Sub_part	Packed	Null	Index_type	Comment	Index_comment	Visible	Expression
z0case	1	ind	1	T1	A	NULL	NULL	NULL	YES	BTREE	available		YES	NULL
z0case	1	ind	2	T2	A	NULL	NULL	NULL	YES	BTREE	available		YES	NULL
ALTER TABLE Z0CASE CONVERT TO CHARACTER SET 'utf8mb4' COLLATE 'utf8mb4_bin';
SELECT table_name,table_collation FROM information_schema.tables WHERE table_name='Z0CASE';
table_name	table_collation
z0case	utf8mb4_bin
SHOW INDEX FROM Z0CASE;
Table	Non_unique	Key_name	Seq_in_index	Column_name	Collation	Cardinality	Sub_part	Packed	Null	Index_type	Comment	Index_comment	Visible	Expression
z0case	1	ind	1	T1	A	NULL	NULL	NULL	YES	BTREE	available		YES	NULL
z0case	1	ind	2	T2	A	NULL	NULL	NULL	YES	BTREE	available		YES	NULL
SELECT * FROM Z0CASE ORDER BY T1;
T1	T2
0	0
123	123
234	234
INSERT INTO Z0CASE VALUES(123,'122');
SELECT * FROM Z0CASE ORDER BY T1;
T1	T2
0	0
123	122
123	123
234	234
UPDATE Z0CASE SET T1=NULL WHERE T2=123;
UPDATE Z0CASE SET T1=b'01001' WHERE T2='123';
SELECT * FROM Z0CASE ORDER BY T1;
T1	T2
0	0
9	123
123	122
234	234
DROP TABLE Z0CASE;
CREATE TABLE Z1CASE(T2 INT PRIMARY KEY) DEFAULT charset= 'binary' DEFAULT collate = 'binary';
CREATE TABLE Z0CASE(T1 INT,CONSTRAINT fk_t1_t2 FOREIGN KEY(T1) REFERENCES Z1CASE(T2)) DEFAULT charset= 'binary' DEFAULT collate = 'binary';
ALTER TABLE Z0CASE CONVERT TO CHARACTER SET 'gbk' COLLATE 'gbk_bin';
SELECT table_name,table_collation FROM information_schema.tables WHERE table_name='Z0CASE';
table_name	table_collation
z0case	gbk_bin
INSERT INTO Z0CASE VALUES(0);
ERROR 23000: Cannot add or update a child row: a foreign key constraint fails
INSERT INTO Z0CASE VALUES('');
ERROR 23000: Cannot add or update a child row: a foreign key constraint fails
INSERT INTO Z0CASE VALUES(NULL);
SELECT * FROM Z0CASE;
T1
NULL
UPDATE Z0CASE SET T1=1;
ERROR 23000: Cannot add or update a child row: a foreign key constraint fails
UPDATE Z0CASE SET T1='';
ERROR 23000: Cannot add or update a child row: a foreign key constraint fails
DROP TABLE Z0CASE;
DROP TABLE Z1CASE;
CREATE TABLE Z0CASE(T1 INT NOT NULL) DEFAULT charset= 'binary' DEFAULT collate = 'binary';
INSERT INTO Z0CASE VALUES('123');
INSERT INTO Z0CASE VALUES(0);
SELECT * FROM Z0CASE ORDER BY T1;
T1
0
123
SELECT table_name,column_type,COLLATION_NAME,CHARACTER_SET_NAME FROM information_schema.columns WHERE table_name='Z0CASE';
table_name	column_type	COLLATION_NAME	CHARACTER_SET_NAME
z0case	int(11)	NULL	NULL
SELECT table_name,table_collation FROM information_schema.tables WHERE table_name='Z0CASE';
table_name	table_collation
z0case	binary
ALTER TABLE Z0CASE CONVERT TO CHARACTER SET 'gbk' COLLATE 'gbk_bin';
SELECT table_name,table_collation FROM information_schema.tables WHERE table_name='Z0CASE';
table_name	table_collation
z0case	gbk_bin
SELECT * FROM Z0CASE ORDER BY T1;
T1
0
123
INSERT INTO Z0CASE VALUES(NULL);
ERROR 23000: Column 'T1' cannot be null
INSERT INTO Z0CASE VALUES('');
SELECT * FROM Z0CASE ORDER BY T1;
T1
0
0
123
UPDATE Z0CASE SET T1=NULL WHERE T1='123';
Warnings:
Warning	1048	Column 'T1' cannot be null
UPDATE Z0CASE SET T1='' WHERE T1='123';
SELECT * FROM Z0CASE ORDER BY T1;
T1
0
0
0
DROP TABLE Z0CASE;
CREATE TABLE Z0CASE(T1 INT DEFAULT '100',T2 INT) DEFAULT charset= 'binary' DEFAULT collate = 'binary';
INSERT INTO Z0CASE VALUES('123',1);
INSERT INTO Z0CASE VALUES(b'1100101',2);
INSERT INTO Z0CASE VALUES(NULL,3);
INSERT INTO Z0CASE(T2) VALUES(4);
SELECT * FROM Z0CASE ORDER BY T2;
T1	T2
123	1
101	2
NULL	3
100	4
SELECT table_name,column_type,COLLATION_NAME,CHARACTER_SET_NAME FROM information_schema.columns WHERE table_name='Z0CASE';
table_name	column_type	COLLATION_NAME	CHARACTER_SET_NAME
z0case	int(11)	NULL	NULL
z0case	int(11)	NULL	NULL
SELECT table_name,table_collation FROM information_schema.tables WHERE table_name='Z0CASE';
table_name	table_collation
z0case	binary
ALTER TABLE Z0CASE CONVERT TO CHARACTER SET 'utf16' COLLATE 'utf16_bin';
SELECT table_name,table_collation FROM information_schema.tables WHERE table_name='Z0CASE';
table_name	table_collation
z0case	utf16_bin
SELECT * FROM Z0CASE ORDER BY T2;
T1	T2
123	1
101	2
NULL	3
100	4
INSERT INTO Z0CASE(T2) VALUES(5);
INSERT INTO Z0CASE VALUES('',6);
INSERT INTO Z0CASE VALUES(NULL,7);
SELECT * FROM Z0CASE ORDER BY T2;
T1	T2
123	1
101	2
NULL	3
100	4
100	5
0	6
NULL	7
FLOAT
DROP TABLE Z0CASE;
CREATE TABLE Z0CASE(T1 FLOAT(10,0) PRIMARY KEY) DEFAULT charset= utf8mb4 DEFAULT collate = utf8mb4_general_ci;
INSERT INTO Z0CASE VALUES('123');
INSERT INTO Z0CASE VALUES(234.345);
INSERT INTO Z0CASE VALUES(0);
SELECT * FROM Z0CASE ORDER BY T1;
T1
0
123
234
SELECT table_name,column_type,COLLATION_NAME,CHARACTER_SET_NAME FROM information_schema.columns WHERE table_name='Z0CASE';
table_name	column_type	COLLATION_NAME	CHARACTER_SET_NAME
z0case	float(10,0)	NULL	NULL
SELECT table_name,table_collation FROM information_schema.tables WHERE table_name='Z0CASE';
table_name	table_collation
z0case	utf8mb4_general_ci
ALTER TABLE Z0CASE CONVERT TO CHARACTER SET 'binary' COLLATE 'binary';
SELECT table_name,table_collation FROM information_schema.tables WHERE table_name='Z0CASE';
table_name	table_collation
z0case	binary
SHOW INDEX FROM Z0CASE;
Table	Non_unique	Key_name	Seq_in_index	Column_name	Collation	Cardinality	Sub_part	Packed	Null	Index_type	Comment	Index_comment	Visible	Expression
z0case	0	PRIMARY	1	T1	A	NULL	NULL	NULL		BTREE	available		YES	NULL
SELECT * FROM Z0CASE ORDER BY T1;
T1
0
123
234
INSERT INTO Z0CASE VALUES(123);
ERROR 23000: Duplicate entry '123' for key 'PRIMARY'
INSERT INTO Z0CASE VALUES(null);
ERROR 23000: Column 'T1' cannot be null
INSERT INTO Z0CASE VALUES('');
ERROR 23000: Duplicate entry '0' for key 'PRIMARY'
UPDATE Z0CASE SET T1=NULL WHERE T1=123;
ERROR 23000: Duplicate entry '0' for key 'PRIMARY'
UPDATE Z0CASE SET T1=123 WHERE T1=0;
ERROR 23000: Duplicate entry '123' for key 'PRIMARY'
UPDATE Z0CASE SET T1=b'01111011' WHERE T1=0;
ERROR 23000: Duplicate entry '123' for key 'PRIMARY'
SELECT * FROM Z0CASE ORDER BY T1;
T1
0
123
234
DROP TABLE Z0CASE;
CREATE TABLE Z0CASE(T1 FLOAT(10,0) UNIQUE) DEFAULT charset='binary' DEFAULT collate='binary';
INSERT INTO Z0CASE VALUES('123');
INSERT INTO Z0CASE VALUES(234.345);
INSERT INTO Z0CASE VALUES(0);
SELECT * FROM Z0CASE ORDER BY T1;
T1
0
123
234
SELECT table_name,column_type,COLLATION_NAME,CHARACTER_SET_NAME FROM information_schema.columns WHERE table_name='Z0CASE';
table_name	column_type	COLLATION_NAME	CHARACTER_SET_NAME
z0case	float(10,0)	NULL	NULL
SELECT table_name,table_collation FROM information_schema.tables WHERE table_name='Z0CASE';
table_name	table_collation
z0case	binary
ALTER TABLE Z0CASE CONVERT TO CHARACTER SET 'gbk' COLLATE 'gbk_bin';
SELECT table_name,table_collation FROM information_schema.tables WHERE table_name='Z0CASE';
table_name	table_collation
z0case	gbk_bin
SHOW INDEX FROM Z0CASE;
Table	Non_unique	Key_name	Seq_in_index	Column_name	Collation	Cardinality	Sub_part	Packed	Null	Index_type	Comment	Index_comment	Visible	Expression
z0case	0	T1	1	T1	A	NULL	NULL	NULL	YES	BTREE	available		YES	NULL
SELECT * FROM Z0CASE ORDER BY T1;
T1
0
123
234
INSERT INTO Z0CASE VALUES('123');
ERROR 23000: Duplicate entry '123' for key 'T1'
INSERT INTO Z0CASE VALUES('');
ERROR 23000: Duplicate entry '0' for key 'T1'
INSERT INTO Z0CASE VALUES(b'0');
ERROR 23000: Duplicate entry '0' for key 'T1'
UPDATE Z0CASE SET T1=0 WHERE T1=123;
ERROR 23000: Duplicate entry '0' for key 'T1'
UPDATE Z0CASE SET T1=b'0' WHERE T1=123;
ERROR 23000: Duplicate entry '0' for key 'T1'
UPDATE Z0CASE SET T1=NULL WHERE T1=123;
SELECT * FROM Z0CASE ORDER BY T1;
T1
NULL
0
234
DROP TABLE Z0CASE;
CREATE TABLE Z0CASE(T1 FLOAT(10,0),T2 FLOAT(10,0)) DEFAULT charset= 'binary' DEFAULT collate = 'binary';
INSERT INTO Z0CASE VALUES('123','123');
INSERT INTO Z0CASE VALUES(234,234);
INSERT INTO Z0CASE VALUES(0,0);
SELECT * FROM Z0CASE ORDER BY T1;
T1	T2
0	0
123	123
234	234
SELECT table_name,column_type,COLLATION_NAME,CHARACTER_SET_NAME FROM information_schema.columns WHERE table_name='Z0CASE';
table_name	column_type	COLLATION_NAME	CHARACTER_SET_NAME
z0case	float(10,0)	NULL	NULL
z0case	float(10,0)	NULL	NULL
SELECT table_name,table_collation FROM information_schema.tables WHERE table_name='Z0CASE';
table_name	table_collation
z0case	binary
CREATE INDEX ind ON Z0CASE(T1,T2);
SHOW INDEX FROM Z0CASE;
Table	Non_unique	Key_name	Seq_in_index	Column_name	Collation	Cardinality	Sub_part	Packed	Null	Index_type	Comment	Index_comment	Visible	Expression
z0case	1	ind	1	T1	A	NULL	NULL	NULL	YES	BTREE	available		YES	NULL
z0case	1	ind	2	T2	A	NULL	NULL	NULL	YES	BTREE	available		YES	NULL
ALTER TABLE Z0CASE CONVERT TO CHARACTER SET 'utf8mb4' COLLATE 'utf8mb4_bin';
SELECT table_name,table_collation FROM information_schema.tables WHERE table_name='Z0CASE';
table_name	table_collation
z0case	utf8mb4_bin
SHOW INDEX FROM Z0CASE;
Table	Non_unique	Key_name	Seq_in_index	Column_name	Collation	Cardinality	Sub_part	Packed	Null	Index_type	Comment	Index_comment	Visible	Expression
z0case	1	ind	1	T1	A	NULL	NULL	NULL	YES	BTREE	available		YES	NULL
z0case	1	ind	2	T2	A	NULL	NULL	NULL	YES	BTREE	available		YES	NULL
SELECT * FROM Z0CASE ORDER BY T1;
T1	T2
0	0
123	123
234	234
INSERT INTO Z0CASE VALUES(123,'122');
SELECT * FROM Z0CASE ORDER BY T1;
T1	T2
0	0
123	122
123	123
234	234
UPDATE Z0CASE SET T1=NULL WHERE T2=123;
UPDATE Z0CASE SET T1=b'01001' WHERE T2='123';
SELECT * FROM Z0CASE ORDER BY T1;
T1	T2
0	0
9	123
123	122
234	234
DROP TABLE Z0CASE;
CREATE TABLE Z1CASE(T2 FLOAT(10,0) PRIMARY KEY) DEFAULT charset= 'binary' DEFAULT collate = 'binary';
CREATE TABLE Z0CASE(T1 FLOAT(10,0),CONSTRAINT fk_t1_t2 FOREIGN KEY(T1) REFERENCES Z1CASE(T2)) DEFAULT charset= 'binary' DEFAULT collate = 'binary';
ALTER TABLE Z0CASE CONVERT TO CHARACTER SET 'gbk' COLLATE 'gbk_bin';
SELECT table_name,table_collation FROM information_schema.tables WHERE table_name='Z0CASE';
table_name	table_collation
z0case	gbk_bin
INSERT INTO Z0CASE VALUES(0);
ERROR 23000: Cannot add or update a child row: a foreign key constraint fails
INSERT INTO Z0CASE VALUES('');
ERROR 23000: Cannot add or update a child row: a foreign key constraint fails
INSERT INTO Z0CASE VALUES(NULL);
SELECT * FROM Z0CASE ORDER BY T1;
T1
NULL
UPDATE Z0CASE SET T1=1;
ERROR 23000: Cannot add or update a child row: a foreign key constraint fails
UPDATE Z0CASE SET T1='';
ERROR 23000: Cannot add or update a child row: a foreign key constraint fails
DROP TABLE Z0CASE;
DROP TABLE Z1CASE;
CREATE TABLE Z0CASE(T1 FLOAT(10,0) NOT NULL) DEFAULT charset= 'binary' DEFAULT collate = 'binary';
INSERT INTO Z0CASE VALUES('123');
INSERT INTO Z0CASE VALUES(0);
SELECT * FROM Z0CASE ORDER BY T1;
T1
0
123
SELECT table_name,column_type,COLLATION_NAME,CHARACTER_SET_NAME FROM information_schema.columns WHERE table_name='Z0CASE';
table_name	column_type	COLLATION_NAME	CHARACTER_SET_NAME
z0case	float(10,0)	NULL	NULL
SELECT table_name,table_collation FROM information_schema.tables WHERE table_name='Z0CASE';
table_name	table_collation
z0case	binary
ALTER TABLE Z0CASE CONVERT TO CHARACTER SET 'gbk' COLLATE 'gbk_bin';
SELECT table_name,table_collation FROM information_schema.tables WHERE table_name='Z0CASE';
table_name	table_collation
z0case	gbk_bin
SELECT * FROM Z0CASE ORDER BY T1;
T1
0
123
INSERT INTO Z0CASE VALUES(NULL);
ERROR 23000: Column 'T1' cannot be null
INSERT INTO Z0CASE VALUES('');
SELECT * FROM Z0CASE ORDER BY T1;
T1
0
0
123
UPDATE Z0CASE SET T1=NULL WHERE T1='123';
Warnings:
Warning	1048	Column 'T1' cannot be null
UPDATE Z0CASE SET T1='' WHERE T1='123';
SELECT * FROM Z0CASE ORDER BY T1;
T1
0
0
0
DROP TABLE Z0CASE;
CREATE TABLE Z0CASE(T1 FLOAT(10,0) DEFAULT '60.99',T2 INT) DEFAULT charset= 'binary' DEFAULT collate = 'binary';
INSERT INTO Z0CASE VALUES('123',1);
INSERT INTO Z0CASE VALUES(b'1100101',2);
INSERT INTO Z0CASE VALUES(NULL,3);
INSERT INTO Z0CASE(T2) VALUES(4);
SELECT * FROM Z0CASE ORDER BY T2;
T1	T2
123	1
101	2
NULL	3
61	4
SELECT table_name,column_type,COLLATION_NAME,CHARACTER_SET_NAME FROM information_schema.columns WHERE table_name='Z0CASE';
table_name	column_type	COLLATION_NAME	CHARACTER_SET_NAME
z0case	float(10,0)	NULL	NULL
z0case	int(11)	NULL	NULL
SELECT table_name,table_collation FROM information_schema.tables WHERE table_name='Z0CASE';
table_name	table_collation
z0case	binary
ALTER TABLE Z0CASE CONVERT TO CHARACTER SET 'utf16' COLLATE 'utf16_bin';
SELECT table_name,table_collation FROM information_schema.tables WHERE table_name='Z0CASE';
table_name	table_collation
z0case	utf16_bin
SELECT * FROM Z0CASE ORDER BY T2;
T1	T2
123	1
101	2
NULL	3
61	4
INSERT INTO Z0CASE(T2) VALUES(5);
INSERT INTO Z0CASE VALUES('',6);
INSERT INTO Z0CASE VALUES(NULL,7);
SELECT * FROM Z0CASE ORDER BY T2;
T1	T2
123	1
101	2
NULL	3
61	4
61	5
0	6
NULL	7
DOUBLE
DROP TABLE Z0CASE;
CREATE TABLE Z0CASE(T1 DOUBLE(25,0) PRIMARY KEY) DEFAULT charset= utf8mb4 DEFAULT collate = utf8mb4_general_ci;
INSERT INTO Z0CASE VALUES('123');
INSERT INTO Z0CASE VALUES(234.345);
INSERT INTO Z0CASE VALUES(0);
SELECT * FROM Z0CASE ORDER BY T1;
T1
0
123
234
SELECT table_name,column_type,COLLATION_NAME,CHARACTER_SET_NAME FROM information_schema.columns WHERE table_name='Z0CASE';
table_name	column_type	COLLATION_NAME	CHARACTER_SET_NAME
z0case	double(25,0)	NULL	NULL
SELECT table_name,table_collation FROM information_schema.tables WHERE table_name='Z0CASE';
table_name	table_collation
z0case	utf8mb4_general_ci
ALTER TABLE Z0CASE CONVERT TO CHARACTER SET 'binary' COLLATE 'binary';
SELECT table_name,table_collation FROM information_schema.tables WHERE table_name='Z0CASE';
table_name	table_collation
z0case	binary
SHOW INDEX FROM Z0CASE;
Table	Non_unique	Key_name	Seq_in_index	Column_name	Collation	Cardinality	Sub_part	Packed	Null	Index_type	Comment	Index_comment	Visible	Expression
z0case	0	PRIMARY	1	T1	A	NULL	NULL	NULL		BTREE	available		YES	NULL
SELECT * FROM Z0CASE ORDER BY T1;
T1
0
123
234
INSERT INTO Z0CASE VALUES(123);
ERROR 23000: Duplicate entry '123' for key 'PRIMARY'
INSERT INTO Z0CASE VALUES(null);
ERROR 23000: Column 'T1' cannot be null
INSERT INTO Z0CASE VALUES('');
ERROR 23000: Duplicate entry '0' for key 'PRIMARY'
UPDATE Z0CASE SET T1=NULL WHERE T1=123;
ERROR 23000: Duplicate entry '0' for key 'PRIMARY'
UPDATE Z0CASE SET T1=123 WHERE T1=0;
ERROR 23000: Duplicate entry '123' for key 'PRIMARY'
UPDATE Z0CASE SET T1=b'01111011' WHERE T1=0;
ERROR 23000: Duplicate entry '123' for key 'PRIMARY'
DROP TABLE Z0CASE;
CREATE TABLE Z0CASE(T1 DOUBLE(25,0) UNIQUE) DEFAULT charset='binary' DEFAULT collate='binary';
INSERT INTO Z0CASE VALUES('123');
INSERT INTO Z0CASE VALUES(234.345);
INSERT INTO Z0CASE VALUES(0);
SELECT * FROM Z0CASE ORDER BY T1;
T1
0
123
234
SELECT table_name,column_type,COLLATION_NAME,CHARACTER_SET_NAME FROM information_schema.columns WHERE table_name='Z0CASE';
table_name	column_type	COLLATION_NAME	CHARACTER_SET_NAME
z0case	double(25,0)	NULL	NULL
SELECT table_name,table_collation FROM information_schema.tables WHERE table_name='Z0CASE';
table_name	table_collation
z0case	binary
ALTER TABLE Z0CASE CONVERT TO CHARACTER SET 'gbk' COLLATE 'gbk_bin';
SELECT table_name,table_collation FROM information_schema.tables WHERE table_name='Z0CASE';
table_name	table_collation
z0case	gbk_bin
SHOW INDEX FROM Z0CASE;
Table	Non_unique	Key_name	Seq_in_index	Column_name	Collation	Cardinality	Sub_part	Packed	Null	Index_type	Comment	Index_comment	Visible	Expression
z0case	0	T1	1	T1	A	NULL	NULL	NULL	YES	BTREE	available		YES	NULL
SELECT * FROM Z0CASE ORDER BY T1;
T1
0
123
234
INSERT INTO Z0CASE VALUES('123');
ERROR 23000: Duplicate entry '123' for key 'T1'
INSERT INTO Z0CASE VALUES('');
ERROR 23000: Duplicate entry '0' for key 'T1'
INSERT INTO Z0CASE VALUES(b'0');
ERROR 23000: Duplicate entry '0' for key 'T1'
UPDATE Z0CASE SET T1=0 WHERE T1=123;
ERROR 23000: Duplicate entry '0' for key 'T1'
UPDATE Z0CASE SET T1=b'0' WHERE T1=123;
ERROR 23000: Duplicate entry '0' for key 'T1'
UPDATE Z0CASE SET T1=NULL WHERE T1=123;
SELECT * FROM Z0CASE ORDER BY T1;
T1
NULL
0
234
DROP TABLE Z0CASE;
CREATE TABLE Z0CASE(T1 DOUBLE(25,0),T2 DOUBLE(25,0)) DEFAULT charset= 'binary' DEFAULT collate = 'binary';
INSERT INTO Z0CASE VALUES('123','123');
INSERT INTO Z0CASE VALUES(234,234);
INSERT INTO Z0CASE VALUES(0,0);
SELECT * FROM Z0CASE ORDER BY T1;
T1	T2
0	0
123	123
234	234
SELECT table_name,column_type,COLLATION_NAME,CHARACTER_SET_NAME FROM information_schema.columns WHERE table_name='Z0CASE';
table_name	column_type	COLLATION_NAME	CHARACTER_SET_NAME
z0case	double(25,0)	NULL	NULL
z0case	double(25,0)	NULL	NULL
SELECT table_name,table_collation FROM information_schema.tables WHERE table_name='Z0CASE';
table_name	table_collation
z0case	binary
CREATE INDEX ind ON Z0CASE(T1,T2);
SHOW INDEX FROM Z0CASE;
Table	Non_unique	Key_name	Seq_in_index	Column_name	Collation	Cardinality	Sub_part	Packed	Null	Index_type	Comment	Index_comment	Visible	Expression
z0case	1	ind	1	T1	A	NULL	NULL	NULL	YES	BTREE	available		YES	NULL
z0case	1	ind	2	T2	A	NULL	NULL	NULL	YES	BTREE	available		YES	NULL
ALTER TABLE Z0CASE CONVERT TO CHARACTER SET 'utf8mb4' COLLATE 'utf8mb4_bin';
SELECT table_name,table_collation FROM information_schema.tables WHERE table_name='Z0CASE';
table_name	table_collation
z0case	utf8mb4_bin
SHOW INDEX FROM Z0CASE;
Table	Non_unique	Key_name	Seq_in_index	Column_name	Collation	Cardinality	Sub_part	Packed	Null	Index_type	Comment	Index_comment	Visible	Expression
z0case	1	ind	1	T1	A	NULL	NULL	NULL	YES	BTREE	available		YES	NULL
z0case	1	ind	2	T2	A	NULL	NULL	NULL	YES	BTREE	available		YES	NULL
SELECT * FROM Z0CASE ORDER BY T1;
T1	T2
0	0
123	123
234	234
INSERT INTO Z0CASE VALUES(123,'122');
SELECT * FROM Z0CASE ORDER BY T1;
T1	T2
0	0
123	122
123	123
234	234
UPDATE Z0CASE SET T1=NULL WHERE T2=123;
UPDATE Z0CASE SET T1=b'01001' WHERE T2='123';
SELECT * FROM Z0CASE ORDER BY T1;
T1	T2
0	0
9	123
123	122
234	234
DROP TABLE Z0CASE;
CREATE TABLE Z1CASE(T2 DOUBLE(25,0) PRIMARY KEY) DEFAULT charset= 'binary' DEFAULT collate = 'binary';
CREATE TABLE Z0CASE(T1 DOUBLE(25,0),CONSTRAINT fk_t1_t2 FOREIGN KEY(T1) REFERENCES Z1CASE(T2)) DEFAULT charset= 'binary' DEFAULT collate = 'binary';
ALTER TABLE Z0CASE CONVERT TO CHARACTER SET 'gbk' COLLATE 'gbk_bin';
SELECT table_name,table_collation FROM information_schema.tables WHERE table_name='Z0CASE';
table_name	table_collation
z0case	gbk_bin
INSERT INTO Z0CASE VALUES(0);
ERROR 23000: Cannot add or update a child row: a foreign key constraint fails
INSERT INTO Z0CASE VALUES('');
ERROR 23000: Cannot add or update a child row: a foreign key constraint fails
INSERT INTO Z0CASE VALUES(NULL);
SELECT * FROM Z0CASE ORDER BY T1;
T1
NULL
UPDATE Z0CASE SET T1=0.125;
ERROR 23000: Cannot add or update a child row: a foreign key constraint fails
UPDATE Z0CASE SET T1='';
ERROR 23000: Cannot add or update a child row: a foreign key constraint fails
DROP TABLE Z0CASE;
DROP TABLE Z1CASE;
CREATE TABLE Z0CASE(T1 DOUBLE(25,0) NOT NULL) DEFAULT charset= 'binary' DEFAULT collate = 'binary';
INSERT INTO Z0CASE VALUES('123');
INSERT INTO Z0CASE VALUES(0);
SELECT * FROM Z0CASE ORDER BY T1;
T1
0
123
SELECT table_name,column_type,COLLATION_NAME,CHARACTER_SET_NAME FROM information_schema.columns WHERE table_name='Z0CASE';
table_name	column_type	COLLATION_NAME	CHARACTER_SET_NAME
z0case	double(25,0)	NULL	NULL
SELECT table_name,table_collation FROM information_schema.tables WHERE table_name='Z0CASE';
table_name	table_collation
z0case	binary
ALTER TABLE Z0CASE CONVERT TO CHARACTER SET 'gbk' COLLATE 'gbk_bin';
SELECT table_name,table_collation FROM information_schema.tables WHERE table_name='Z0CASE';
table_name	table_collation
z0case	gbk_bin
SELECT * FROM Z0CASE ORDER BY T1;
T1
0
123
INSERT INTO Z0CASE VALUES(NULL);
ERROR 23000: Column 'T1' cannot be null
INSERT INTO Z0CASE VALUES('');
UPDATE Z0CASE SET T1=NULL WHERE T1='123';
Warnings:
Warning	1048	Column 'T1' cannot be null
UPDATE Z0CASE SET T1='' WHERE T1='123';
SELECT * FROM Z0CASE ORDER BY T1;
T1
0
0
0
DROP TABLE Z0CASE;
CREATE TABLE Z0CASE(T1 DOUBLE(25,0) DEFAULT '60.99',T2 INT) DEFAULT charset= 'binary' DEFAULT collate = 'binary';
INSERT INTO Z0CASE VALUES('123',1);
INSERT INTO Z0CASE VALUES(b'1100101',2);
INSERT INTO Z0CASE VALUES(NULL,3);
INSERT INTO Z0CASE(T2) VALUES(4);
SELECT * FROM Z0CASE ORDER BY T2;
T1	T2
123	1
101	2
NULL	3
61	4
SELECT table_name,column_type,COLLATION_NAME,CHARACTER_SET_NAME FROM information_schema.columns WHERE table_name='Z0CASE';
table_name	column_type	COLLATION_NAME	CHARACTER_SET_NAME
z0case	double(25,0)	NULL	NULL
z0case	int(11)	NULL	NULL
SELECT table_name,table_collation FROM information_schema.tables WHERE table_name='Z0CASE';
table_name	table_collation
z0case	binary
ALTER TABLE Z0CASE CONVERT TO CHARACTER SET 'utf16' COLLATE 'utf16_bin';
SELECT table_name,table_collation FROM information_schema.tables WHERE table_name='Z0CASE';
table_name	table_collation
z0case	utf16_bin
SELECT * FROM Z0CASE ORDER BY T2;
T1	T2
123	1
101	2
NULL	3
61	4
INSERT INTO Z0CASE(T2) VALUES(5);
INSERT INTO Z0CASE VALUES('',6);
INSERT INTO Z0CASE VALUES(NULL,7);
SELECT * FROM Z0CASE ORDER BY T2;
T1	T2
123	1
101	2
NULL	3
61	4
61	5
0	6
NULL	7
DATE
DROP TABLE Z0CASE;
CREATE TABLE Z0CASE(T1 DATE PRIMARY KEY) DEFAULT charset= utf8mb4 DEFAULT collate = utf8mb4_general_ci;
INSERT INTO Z0CASE VALUES('9999-12-31');
INSERT INTO Z0CASE VALUES('1000-01-01');
INSERT INTO Z0CASE VALUES(0);
SELECT * FROM Z0CASE ORDER BY T1;
T1
0000-00-00
1000-01-01
9999-12-31
SELECT table_name,column_type,COLLATION_NAME,CHARACTER_SET_NAME FROM information_schema.columns WHERE table_name='Z0CASE';
table_name	column_type	COLLATION_NAME	CHARACTER_SET_NAME
z0case	date	NULL	NULL
SELECT table_name,table_collation FROM information_schema.tables WHERE table_name='Z0CASE';
table_name	table_collation
z0case	utf8mb4_general_ci
ALTER TABLE Z0CASE CONVERT TO CHARACTER SET 'binary' COLLATE 'binary';
SELECT table_name,table_collation FROM information_schema.tables WHERE table_name='Z0CASE';
table_name	table_collation
z0case	binary
SHOW INDEX FROM Z0CASE;
Table	Non_unique	Key_name	Seq_in_index	Column_name	Collation	Cardinality	Sub_part	Packed	Null	Index_type	Comment	Index_comment	Visible	Expression
z0case	0	PRIMARY	1	T1	A	NULL	NULL	NULL		BTREE	available		YES	NULL
SELECT * FROM Z0CASE ORDER BY T1;
T1
0000-00-00
1000-01-01
9999-12-31
INSERT INTO Z0CASE VALUES(0);
ERROR 23000: Duplicate entry '0000-00-00' for key 'PRIMARY'
INSERT INTO Z0CASE VALUES(null);
ERROR 23000: Column 'T1' cannot be null
INSERT INTO Z0CASE VALUES('');
ERROR 23000: Duplicate entry '0000-00-00' for key 'PRIMARY'
UPDATE Z0CASE SET T1=NULL WHERE T1='1000-01-01';
ERROR 23000: Duplicate entry '0000-00-00' for key 'PRIMARY'
UPDATE Z0CASE SET T1=123 WHERE T1='1000-01-01';
SELECT * FROM Z0CASE ORDER BY T1;
T1
0000-00-00
2000-01-23
9999-12-31
UPDATE Z0CASE SET T1='' WHERE T1='1000-01-01';
SELECT * FROM Z0CASE ORDER BY T1;
T1
0000-00-00
2000-01-23
9999-12-31
DROP TABLE Z0CASE;
CREATE TABLE Z0CASE(T1 DATE UNIQUE) DEFAULT charset='binary' DEFAULT collate='binary';
INSERT INTO Z0CASE VALUES('9999-12-31');
INSERT INTO Z0CASE VALUES('1000-01-01');
INSERT INTO Z0CASE VALUES(0);
SELECT * FROM Z0CASE ORDER BY T1;
T1
0000-00-00
1000-01-01
9999-12-31
SELECT table_name,column_type,COLLATION_NAME,CHARACTER_SET_NAME FROM information_schema.columns WHERE table_name='Z0CASE';
table_name	column_type	COLLATION_NAME	CHARACTER_SET_NAME
z0case	date	NULL	NULL
SELECT table_name,table_collation FROM information_schema.tables WHERE table_name='Z0CASE';
table_name	table_collation
z0case	binary
ALTER TABLE Z0CASE CONVERT TO CHARACTER SET 'gbk' COLLATE 'gbk_bin';
SELECT table_name,table_collation FROM information_schema.tables WHERE table_name='Z0CASE';
table_name	table_collation
z0case	gbk_bin
SHOW INDEX FROM Z0CASE;
Table	Non_unique	Key_name	Seq_in_index	Column_name	Collation	Cardinality	Sub_part	Packed	Null	Index_type	Comment	Index_comment	Visible	Expression
z0case	0	T1	1	T1	A	NULL	NULL	NULL	YES	BTREE	available		YES	NULL
SELECT * FROM Z0CASE ORDER BY T1;
T1
0000-00-00
1000-01-01
9999-12-31
INSERT INTO Z0CASE VALUES(0);
ERROR 23000: Duplicate entry '0000-00-00' for key 'T1'
INSERT INTO Z0CASE VALUES('');
ERROR 23000: Duplicate entry '0000-00-00' for key 'T1'
INSERT INTO Z0CASE VALUES(null);
SELECT * FROM Z0CASE ORDER BY T1;
T1
NULL
0000-00-00
1000-01-01
9999-12-31
UPDATE Z0CASE SET T1=0 WHERE T1='1000-01-01';
ERROR 23000: Duplicate entry '0000-00-00' for key 'T1'
UPDATE Z0CASE SET T1='0' WHERE T1='1000-01-01';
ERROR 23000: Duplicate entry '0000-00-00' for key 'T1'
UPDATE Z0CASE SET T1=NULL WHERE T1='1000-01-01';
SELECT * FROM Z0CASE ORDER BY T1;
T1
NULL
NULL
0000-00-00
9999-12-31
DROP TABLE Z0CASE;
CREATE TABLE Z0CASE(T1 DATE,T2 DATE) DEFAULT charset= 'binary' DEFAULT collate = 'binary';
INSERT INTO Z0CASE VALUES('9999-12-31','9999-12-31');
INSERT INTO Z0CASE VALUES('1000-01-01','1000-01-01');
INSERT INTO Z0CASE VALUES(0,0);
SELECT * FROM Z0CASE ORDER BY T1;
T1	T2
0000-00-00	0000-00-00
1000-01-01	1000-01-01
9999-12-31	9999-12-31
SELECT table_name,column_type,COLLATION_NAME,CHARACTER_SET_NAME FROM information_schema.columns WHERE table_name='Z0CASE';
table_name	column_type	COLLATION_NAME	CHARACTER_SET_NAME
z0case	date	NULL	NULL
z0case	date	NULL	NULL
SELECT table_name,table_collation FROM information_schema.tables WHERE table_name='Z0CASE';
table_name	table_collation
z0case	binary
CREATE INDEX ind ON Z0CASE(T1,T2);
SHOW INDEX FROM Z0CASE;
Table	Non_unique	Key_name	Seq_in_index	Column_name	Collation	Cardinality	Sub_part	Packed	Null	Index_type	Comment	Index_comment	Visible	Expression
z0case	1	ind	1	T1	A	NULL	NULL	NULL	YES	BTREE	available		YES	NULL
z0case	1	ind	2	T2	A	NULL	NULL	NULL	YES	BTREE	available		YES	NULL
ALTER TABLE Z0CASE CONVERT TO CHARACTER SET 'utf8mb4' COLLATE 'utf8mb4_bin';
SELECT table_name,table_collation FROM information_schema.tables WHERE table_name='Z0CASE';
table_name	table_collation
z0case	utf8mb4_bin
SHOW INDEX FROM Z0CASE;
Table	Non_unique	Key_name	Seq_in_index	Column_name	Collation	Cardinality	Sub_part	Packed	Null	Index_type	Comment	Index_comment	Visible	Expression
z0case	1	ind	1	T1	A	NULL	NULL	NULL	YES	BTREE	available		YES	NULL
z0case	1	ind	2	T2	A	NULL	NULL	NULL	YES	BTREE	available		YES	NULL
SELECT * FROM Z0CASE ORDER BY T1;
T1	T2
0000-00-00	0000-00-00
1000-01-01	1000-01-01
9999-12-31	9999-12-31
INSERT INTO Z0CASE VALUES('1000-01-01','1000-01-01');
SELECT * FROM Z0CASE ORDER BY T1;
T1	T2
0000-00-00	0000-00-00
1000-01-01	1000-01-01
1000-01-01	1000-01-01
9999-12-31	9999-12-31
UPDATE Z0CASE SET T1=NULL WHERE T2='1000-01-01';
SELECT * FROM Z0CASE ORDER BY T1;
T1	T2
NULL	1000-01-01
NULL	1000-01-01
0000-00-00	0000-00-00
9999-12-31	9999-12-31
DROP TABLE Z0CASE;
CREATE TABLE Z1CASE(T2 DATE PRIMARY KEY) DEFAULT charset= 'binary' DEFAULT collate = 'binary';
CREATE TABLE Z0CASE(T1 DATE,CONSTRAINT fk_t1_t2 FOREIGN KEY(T1) REFERENCES Z1CASE(T2)) DEFAULT charset= 'binary' DEFAULT collate = 'binary';
ALTER TABLE Z0CASE CONVERT TO CHARACTER SET 'gbk' COLLATE 'gbk_bin';
SELECT table_name,table_collation FROM information_schema.tables WHERE table_name='Z0CASE';
table_name	table_collation
z0case	gbk_bin
INSERT INTO Z0CASE VALUES('2022-01-02');
ERROR 23000: Cannot add or update a child row: a foreign key constraint fails
INSERT INTO Z0CASE VALUES('');
ERROR 23000: Cannot add or update a child row: a foreign key constraint fails
INSERT INTO Z0CASE VALUES(NULL);
SELECT * FROM Z0CASE ORDER BY T1;
T1
NULL
UPDATE Z0CASE SET T1='2020-02-02';
ERROR 23000: Cannot add or update a child row: a foreign key constraint fails
UPDATE Z0CASE SET T1='';
ERROR 23000: Cannot add or update a child row: a foreign key constraint fails
DROP TABLE Z0CASE;
DROP TABLE Z1CASE;
CREATE TABLE Z0CASE(T1 DATE NOT NULL) DEFAULT charset= 'binary' DEFAULT collate = 'binary';
INSERT INTO Z0CASE VALUES('9999-12-31');
INSERT INTO Z0CASE VALUES('1000-01-01');
INSERT INTO Z0CASE VALUES(0);
SELECT * FROM Z0CASE ORDER BY T1;
T1
0000-00-00
1000-01-01
9999-12-31
SELECT table_name,column_type,COLLATION_NAME,CHARACTER_SET_NAME FROM information_schema.columns WHERE table_name='Z0CASE';
table_name	column_type	COLLATION_NAME	CHARACTER_SET_NAME
z0case	date	NULL	NULL
SELECT table_name,table_collation FROM information_schema.tables WHERE table_name='Z0CASE';
table_name	table_collation
z0case	binary
ALTER TABLE Z0CASE CONVERT TO CHARACTER SET 'gbk' COLLATE 'gbk_bin';
SELECT table_name,table_collation FROM information_schema.tables WHERE table_name='Z0CASE';
table_name	table_collation
z0case	gbk_bin
SELECT * FROM Z0CASE ORDER BY T1;
T1
0000-00-00
1000-01-01
9999-12-31
INSERT INTO Z0CASE VALUES(NULL);
ERROR 23000: Column 'T1' cannot be null
INSERT INTO Z0CASE VALUES('');
UPDATE Z0CASE SET T1=NULL WHERE T1='1000-01-01';
Warnings:
Warning	1048	Column 'T1' cannot be null
UPDATE Z0CASE SET T1='' WHERE T1='1000-01-01';
SELECT * FROM Z0CASE ORDER BY T1;
T1
0000-00-00
0000-00-00
0000-00-00
9999-12-31
DROP TABLE Z0CASE;
CREATE TABLE Z0CASE(T1 DATE DEFAULT '2021-10-29',T2 INT) DEFAULT charset= 'binary' DEFAULT collate = 'binary';
INSERT INTO Z0CASE VALUES('9999-12-31',1);
INSERT INTO Z0CASE VALUES('1000-01-01',2);
INSERT INTO Z0CASE VALUES(NULL,3);
INSERT INTO Z0CASE(T2) VALUES(4);
SELECT * FROM Z0CASE ORDER BY T2;
T1	T2
9999-12-31	1
1000-01-01	2
NULL	3
2021-10-29	4
SELECT table_name,column_type,COLLATION_NAME,CHARACTER_SET_NAME FROM information_schema.columns WHERE table_name='Z0CASE';
table_name	column_type	COLLATION_NAME	CHARACTER_SET_NAME
z0case	date	NULL	NULL
z0case	int(11)	NULL	NULL
SELECT table_name,table_collation FROM information_schema.tables WHERE table_name='Z0CASE';
table_name	table_collation
z0case	binary
ALTER TABLE Z0CASE CONVERT TO CHARACTER SET 'utf16' COLLATE 'utf16_bin';
SELECT table_name,table_collation FROM information_schema.tables WHERE table_name='Z0CASE';
table_name	table_collation
z0case	utf16_bin
SELECT * FROM Z0CASE ORDER BY T2;
T1	T2
9999-12-31	1
1000-01-01	2
NULL	3
2021-10-29	4
INSERT INTO Z0CASE(T2) VALUES(5);
INSERT INTO Z0CASE VALUES('',6);
INSERT INTO Z0CASE VALUES(NULL,7);
SELECT * FROM Z0CASE ORDER BY T2;
T1	T2
9999-12-31	1
1000-01-01	2
NULL	3
2021-10-29	4
2021-10-29	5
0000-00-00	6
NULL	7
TIME
DROP TABLE Z0CASE;
CREATE TABLE Z0CASE(T1 TIME(2) PRIMARY KEY) DEFAULT charset= utf8mb4 DEFAULT collate = utf8mb4_general_ci;
INSERT INTO Z0CASE VALUES('23:59:59.156');
INSERT INTO Z0CASE VALUES('00:00:00.546');
INSERT INTO Z0CASE VALUES(0);
SELECT * FROM Z0CASE ORDER BY T1;
T1
00:00:00.00
00:00:00.55
23:59:59.16
SELECT table_name,column_type,COLLATION_NAME,CHARACTER_SET_NAME FROM information_schema.columns WHERE table_name='Z0CASE';
table_name	column_type	COLLATION_NAME	CHARACTER_SET_NAME
z0case	time(2)	NULL	NULL
SELECT table_name,table_collation FROM information_schema.tables WHERE table_name='Z0CASE';
table_name	table_collation
z0case	utf8mb4_general_ci
ALTER TABLE Z0CASE CONVERT TO CHARACTER SET 'binary' COLLATE 'binary';
SELECT table_name,table_collation FROM information_schema.tables WHERE table_name='Z0CASE';
table_name	table_collation
z0case	binary
SHOW INDEX FROM Z0CASE;
Table	Non_unique	Key_name	Seq_in_index	Column_name	Collation	Cardinality	Sub_part	Packed	Null	Index_type	Comment	Index_comment	Visible	Expression
z0case	0	PRIMARY	1	T1	A	NULL	NULL	NULL		BTREE	available		YES	NULL
SELECT * FROM Z0CASE ORDER BY T1;
T1
00:00:00.00
00:00:00.55
23:59:59.16
INSERT INTO Z0CASE VALUES(0);
ERROR 23000: Duplicate entry '00:00:00.00' for key 'PRIMARY'
INSERT INTO Z0CASE VALUES(null);
ERROR 23000: Column 'T1' cannot be null
INSERT INTO Z0CASE VALUES('');
ERROR 23000: Duplicate entry '00:00:00.00' for key 'PRIMARY'
INSERT INTO Z0CASE VALUES('00:00:00.55');
ERROR 23000: Duplicate entry '00:00:00.55' for key 'PRIMARY'
INSERT INTO Z0CASE VALUES('00:00:00.556');
SELECT * FROM Z0CASE ORDER BY T1;
T1
00:00:00.00
00:00:00.55
00:00:00.56
23:59:59.16
UPDATE Z0CASE SET T1=NULL WHERE T1='00:00:00.55';
ERROR 23000: Duplicate entry '00:00:00.00' for key 'PRIMARY'
UPDATE Z0CASE SET T1='23:59:59.16' WHERE T1='00:00:00.55';
ERROR 23000: Duplicate entry '23:59:59.16' for key 'PRIMARY'
UPDATE Z0CASE SET T1='' WHERE T1='00:00:00.55';
ERROR 23000: Duplicate entry '00:00:00.00' for key 'PRIMARY'
UPDATE Z0CASE SET T1='23:59:59.151' WHERE T1='00:00:00.55';
SELECT * FROM Z0CASE ORDER BY T1;
T1
00:00:00.00
00:00:00.56
23:59:59.15
23:59:59.16
DROP TABLE Z0CASE;
CREATE TABLE Z0CASE(T1 TIME(2) UNIQUE) DEFAULT charset='binary' DEFAULT collate='binary';
INSERT INTO Z0CASE VALUES('23:59:59.156');
INSERT INTO Z0CASE VALUES('00:00:00.546');
INSERT INTO Z0CASE VALUES(0);
SELECT * FROM Z0CASE ORDER BY T1;
T1
00:00:00.00
00:00:00.55
23:59:59.16
SELECT table_name,column_type,COLLATION_NAME,CHARACTER_SET_NAME FROM information_schema.columns WHERE table_name='Z0CASE';
table_name	column_type	COLLATION_NAME	CHARACTER_SET_NAME
z0case	time(2)	NULL	NULL
SELECT table_name,table_collation FROM information_schema.tables WHERE table_name='Z0CASE';
table_name	table_collation
z0case	binary
ALTER TABLE Z0CASE CONVERT TO CHARACTER SET 'gbk' COLLATE 'gbk_bin';
SELECT table_name,table_collation FROM information_schema.tables WHERE table_name='Z0CASE';
table_name	table_collation
z0case	gbk_bin
SHOW INDEX FROM Z0CASE;
Table	Non_unique	Key_name	Seq_in_index	Column_name	Collation	Cardinality	Sub_part	Packed	Null	Index_type	Comment	Index_comment	Visible	Expression
z0case	0	T1	1	T1	A	NULL	NULL	NULL	YES	BTREE	available		YES	NULL
SELECT * FROM Z0CASE ORDER BY T1;
T1
00:00:00.00
00:00:00.55
23:59:59.16
INSERT INTO Z0CASE VALUES('00:00:00.546');
ERROR 23000: Duplicate entry '00:00:00.55' for key 'T1'
INSERT INTO Z0CASE VALUES('00:00:00.551');
ERROR 23000: Duplicate entry '00:00:00.55' for key 'T1'
INSERT INTO Z0CASE VALUES('0');
ERROR 23000: Duplicate entry '00:00:00.00' for key 'T1'
INSERT INTO Z0CASE VALUES('');
ERROR 23000: Duplicate entry '00:00:00.00' for key 'T1'
INSERT INTO Z0CASE VALUES(null);
SELECT * FROM Z0CASE ORDER BY T1;
T1
NULL
00:00:00.00
00:00:00.55
23:59:59.16
UPDATE Z0CASE SET T1=0 WHERE T1='00:00:00.55';
ERROR 23000: Duplicate entry '00:00:00.00' for key 'T1'
UPDATE Z0CASE SET T1='0' WHERE T1='00:00:00.55';
ERROR 23000: Duplicate entry '00:00:00.00' for key 'T1'
UPDATE Z0CASE SET T1='' WHERE T1='00:00:00.55';
ERROR 23000: Duplicate entry '00:00:00.00' for key 'T1'
UPDATE Z0CASE SET T1=NULL WHERE T1='00:00:00.55';
SELECT * FROM Z0CASE ORDER BY T1;
T1
NULL
NULL
00:00:00.00
23:59:59.16
DROP TABLE Z0CASE;
CREATE TABLE Z0CASE(T1 TIME(2),T2 TIME(2)) DEFAULT charset= 'binary' DEFAULT collate = 'binary';
INSERT INTO Z0CASE VALUES('23:59:59.156','23:59:59.163');
INSERT INTO Z0CASE VALUES('00:00:00.546','00:00:00.544');
INSERT INTO Z0CASE VALUES(0,'0');
SELECT * FROM Z0CASE ORDER BY T1;
T1	T2
00:00:00.00	00:00:00.00
00:00:00.55	00:00:00.54
23:59:59.16	23:59:59.16
SELECT table_name,column_type,COLLATION_NAME,CHARACTER_SET_NAME FROM information_schema.columns WHERE table_name='Z0CASE';
table_name	column_type	COLLATION_NAME	CHARACTER_SET_NAME
z0case	time(2)	NULL	NULL
z0case	time(2)	NULL	NULL
SELECT table_name,table_collation FROM information_schema.tables WHERE table_name='Z0CASE';
table_name	table_collation
z0case	binary
CREATE INDEX ind ON Z0CASE(T1,T2);
SHOW INDEX FROM Z0CASE;
Table	Non_unique	Key_name	Seq_in_index	Column_name	Collation	Cardinality	Sub_part	Packed	Null	Index_type	Comment	Index_comment	Visible	Expression
z0case	1	ind	1	T1	A	NULL	NULL	NULL	YES	BTREE	available		YES	NULL
z0case	1	ind	2	T2	A	NULL	NULL	NULL	YES	BTREE	available		YES	NULL
ALTER TABLE Z0CASE CONVERT TO CHARACTER SET 'utf8mb4' COLLATE 'utf8mb4_bin';
SELECT table_name,table_collation FROM information_schema.tables WHERE table_name='Z0CASE';
table_name	table_collation
z0case	utf8mb4_bin
SHOW INDEX FROM Z0CASE;
Table	Non_unique	Key_name	Seq_in_index	Column_name	Collation	Cardinality	Sub_part	Packed	Null	Index_type	Comment	Index_comment	Visible	Expression
z0case	1	ind	1	T1	A	NULL	NULL	NULL	YES	BTREE	available		YES	NULL
z0case	1	ind	2	T2	A	NULL	NULL	NULL	YES	BTREE	available		YES	NULL
SELECT * FROM Z0CASE ORDER BY T1;
T1	T2
00:00:00.00	00:00:00.00
00:00:00.55	00:00:00.54
23:59:59.16	23:59:59.16
INSERT INTO Z0CASE VALUES('01:10:10.552','01:10:10.555');
SELECT * FROM Z0CASE ORDER BY T1;
T1	T2
00:00:00.00	00:00:00.00
00:00:00.55	00:00:00.54
01:10:10.55	01:10:10.56
23:59:59.16	23:59:59.16
UPDATE Z0CASE SET T1=NULL WHERE T2='00:00:00.54';
SELECT * FROM Z0CASE ORDER BY T1;
T1	T2
NULL	00:00:00.54
00:00:00.00	00:00:00.00
01:10:10.55	01:10:10.56
23:59:59.16	23:59:59.16
DROP TABLE Z0CASE;
CREATE TABLE Z1CASE(T2 TIME(2) PRIMARY KEY) DEFAULT charset= 'binary' DEFAULT collate = 'binary';
CREATE TABLE Z0CASE(T1 TIME(2),CONSTRAINT fk_t1_t2 FOREIGN KEY(T1) REFERENCES Z1CASE(T2)) DEFAULT charset= 'binary' DEFAULT collate = 'binary';
ALTER TABLE Z0CASE CONVERT TO CHARACTER SET 'gbk' COLLATE 'gbk_bin';
SELECT table_name,table_collation FROM information_schema.tables WHERE table_name='Z0CASE';
table_name	table_collation
z0case	gbk_bin
INSERT INTO Z0CASE VALUES('01:10:10.552');
ERROR 23000: Cannot add or update a child row: a foreign key constraint fails
INSERT INTO Z0CASE VALUES('');
ERROR 23000: Cannot add or update a child row: a foreign key constraint fails
INSERT INTO Z0CASE VALUES(NULL);
SELECT * FROM Z0CASE ORDER BY T1;
T1
NULL
UPDATE Z0CASE SET T1='01:10:10.552';
ERROR 23000: Cannot add or update a child row: a foreign key constraint fails
UPDATE Z0CASE SET T1='';
ERROR 23000: Cannot add or update a child row: a foreign key constraint fails
DROP TABLE Z0CASE;
DROP TABLE Z1CASE;
CREATE TABLE Z0CASE(T1 TIME(2) NOT NULL) DEFAULT charset= 'binary' DEFAULT collate = 'binary';
INSERT INTO Z0CASE VALUES('01:10:10.552');
INSERT INTO Z0CASE VALUES(0);
SELECT * FROM Z0CASE ORDER BY T1;
T1
00:00:00.00
01:10:10.55
SELECT table_name,column_type,COLLATION_NAME,CHARACTER_SET_NAME FROM information_schema.columns WHERE table_name='Z0CASE';
table_name	column_type	COLLATION_NAME	CHARACTER_SET_NAME
z0case	time(2)	NULL	NULL
SELECT table_name,table_collation FROM information_schema.tables WHERE table_name='Z0CASE';
table_name	table_collation
z0case	binary
ALTER TABLE Z0CASE CONVERT TO CHARACTER SET 'gbk' COLLATE 'gbk_bin';
SELECT table_name,table_collation FROM information_schema.tables WHERE table_name='Z0CASE';
table_name	table_collation
z0case	gbk_bin
SELECT * FROM Z0CASE ORDER BY T1;
T1
00:00:00.00
01:10:10.55
INSERT INTO Z0CASE VALUES(NULL);
ERROR 23000: Column 'T1' cannot be null
INSERT INTO Z0CASE VALUES('');
INSERT INTO Z0CASE VALUES('11:12:13.555');
SELECT * FROM Z0CASE ORDER BY T1;
T1
00:00:00.00
00:00:00.00
01:10:10.55
11:12:13.56
UPDATE Z0CASE SET T1=NULL WHERE T1='01:10:10.55';
Warnings:
Warning	1048	Column 'T1' cannot be null
UPDATE Z0CASE SET T1='' WHERE T1='01:10:10.55';
UPDATE Z0CASE SET T1='01:10:10' WHERE T1='01:10:10.55';
SELECT * FROM Z0CASE ORDER BY T1;
T1
00:00:00.00
00:00:00.00
00:00:00.00
11:12:13.56
DROP TABLE Z0CASE;
CREATE TABLE Z0CASE(T1 TIME(2) DEFAULT '12:00:00.00',T2 INT) DEFAULT charset= 'binary' DEFAULT collate = 'binary';
INSERT INTO Z0CASE VALUES('11:10:12.23456',1);
INSERT INTO Z0CASE VALUES(NULL,2);
INSERT INTO Z0CASE(T2) VALUES(3);
SELECT * FROM Z0CASE ORDER BY T2;
T1	T2
11:10:12.23	1
NULL	2
12:00:00.00	3
SELECT table_name,column_type,COLLATION_NAME,CHARACTER_SET_NAME FROM information_schema.columns WHERE table_name='Z0CASE';
table_name	column_type	COLLATION_NAME	CHARACTER_SET_NAME
z0case	time(2)	NULL	NULL
z0case	int(11)	NULL	NULL
SELECT table_name,table_collation FROM information_schema.tables WHERE table_name='Z0CASE';
table_name	table_collation
z0case	binary
ALTER TABLE Z0CASE CONVERT TO CHARACTER SET 'utf16' COLLATE 'utf16_bin';
SELECT table_name,table_collation FROM information_schema.tables WHERE table_name='Z0CASE';
table_name	table_collation
z0case	utf16_bin
SELECT * FROM Z0CASE ORDER BY T2;
T1	T2
11:10:12.23	1
NULL	2
12:00:00.00	3
INSERT INTO Z0CASE(T2) VALUES(4);
INSERT INTO Z0CASE VALUES('',5);
INSERT INTO Z0CASE VALUES(NULL,6);
SELECT * FROM Z0CASE ORDER BY T2;
T1	T2
11:10:12.23	1
NULL	2
12:00:00.00	3
12:00:00.00	4
00:00:00.00	5
NULL	6
TIMESTAMP
DROP TABLE Z0CASE;
CREATE TABLE Z0CASE(T1 TIMESTAMP(2) PRIMARY KEY) DEFAULT charset= utf8mb4 DEFAULT collate = utf8mb4_general_ci;
INSERT INTO Z0CASE VALUES('2000-01-02 23:59:59.156');
INSERT INTO Z0CASE VALUES('2021-01-03 00:00:00.546');
INSERT INTO Z0CASE VALUES(0);
SELECT * FROM Z0CASE ORDER BY T1;
T1
0000-00-00 00:00:00.00
2000-01-02 23:59:59.16
2021-01-03 00:00:00.55
SELECT table_name,column_type,COLLATION_NAME,CHARACTER_SET_NAME FROM information_schema.columns WHERE table_name='Z0CASE';
table_name	column_type	COLLATION_NAME	CHARACTER_SET_NAME
z0case	timestamp(2)	NULL	NULL
SELECT table_name,table_collation FROM information_schema.tables WHERE table_name='Z0CASE';
table_name	table_collation
z0case	utf8mb4_general_ci
ALTER TABLE Z0CASE CONVERT TO CHARACTER SET 'binary' COLLATE 'binary';
SELECT table_name,table_collation FROM information_schema.tables WHERE table_name='Z0CASE';
table_name	table_collation
z0case	binary
SHOW INDEX FROM Z0CASE;
Table	Non_unique	Key_name	Seq_in_index	Column_name	Collation	Cardinality	Sub_part	Packed	Null	Index_type	Comment	Index_comment	Visible	Expression
z0case	0	PRIMARY	1	T1	A	NULL	NULL	NULL		BTREE	available		YES	NULL
SELECT * FROM Z0CASE ORDER BY T1;
T1
0000-00-00 00:00:00.00
2000-01-02 23:59:59.16
2021-01-03 00:00:00.55
INSERT INTO Z0CASE VALUES(0);
ERROR 23000: Duplicate entry '0000-00-00 00:00:00.000000' for key 'PRIMARY'
INSERT INTO Z0CASE VALUES(null);
ERROR 23000: Column 'T1' cannot be null
INSERT INTO Z0CASE VALUES('');
ERROR 23000: Duplicate entry '0000-00-00 00:00:00.000000' for key 'PRIMARY'
INSERT INTO Z0CASE VALUES('2000-01-02 23:59:59.16');
ERROR 23000: Duplicate entry '2000-01-02 23:59:59.160000' for key 'PRIMARY'
INSERT INTO Z0CASE VALUES('2000-01-02 00:00:00.556');
SELECT * FROM Z0CASE ORDER BY T1;
T1
0000-00-00 00:00:00.00
2000-01-02 00:00:00.56
2000-01-02 23:59:59.16
2021-01-03 00:00:00.55
UPDATE Z0CASE SET T1=NULL WHERE T1='2000-01-02 00:00:00.56';
ERROR 23000: Duplicate entry '0000-00-00 00:00:00.000000' for key 'PRIMARY'
UPDATE Z0CASE SET T1='2000-01-02 23:59:59.16' WHERE T1='2000-01-02 00:00:00.56';
ERROR 23000: Duplicate entry '2000-01-02 23:59:59.160000' for key 'PRIMARY'
UPDATE Z0CASE SET T1='' WHERE T1='2000-01-02 00:00:00.56';
ERROR 23000: Duplicate entry '0000-00-00 00:00:00.000000' for key 'PRIMARY'
UPDATE Z0CASE SET T1='2000-01-02 23:59:59.151' WHERE T1='2000-01-02 00:00:00.56';
SELECT * FROM Z0CASE ORDER BY T1;
T1
0000-00-00 00:00:00.00
2000-01-02 23:59:59.15
2000-01-02 23:59:59.16
2021-01-03 00:00:00.55
DROP TABLE Z0CASE;
CREATE TABLE Z0CASE(T1 TIMESTAMP(2) UNIQUE) DEFAULT charset='binary' DEFAULT collate='binary';
INSERT INTO Z0CASE VALUES('2000-01-02 23:59:59.156');
INSERT INTO Z0CASE VALUES('2000-01-02 00:00:00.546');
INSERT INTO Z0CASE VALUES(0);
SELECT * FROM Z0CASE ORDER BY T1;
T1
0000-00-00 00:00:00.00
2000-01-02 00:00:00.55
2000-01-02 23:59:59.16
SELECT table_name,column_type,COLLATION_NAME,CHARACTER_SET_NAME FROM information_schema.columns WHERE table_name='Z0CASE';
table_name	column_type	COLLATION_NAME	CHARACTER_SET_NAME
z0case	timestamp(2)	NULL	NULL
SELECT table_name,table_collation FROM information_schema.tables WHERE table_name='Z0CASE';
table_name	table_collation
z0case	binary
ALTER TABLE Z0CASE CONVERT TO CHARACTER SET 'gbk' COLLATE 'gbk_bin';
SELECT table_name,table_collation FROM information_schema.tables WHERE table_name='Z0CASE';
table_name	table_collation
z0case	gbk_bin
SHOW INDEX FROM Z0CASE;
Table	Non_unique	Key_name	Seq_in_index	Column_name	Collation	Cardinality	Sub_part	Packed	Null	Index_type	Comment	Index_comment	Visible	Expression
z0case	0	T1	1	T1	A	NULL	NULL	NULL	YES	BTREE	available		YES	NULL
SELECT * FROM Z0CASE ORDER BY T1;
T1
0000-00-00 00:00:00.00
2000-01-02 00:00:00.55
2000-01-02 23:59:59.16
INSERT INTO Z0CASE VALUES('2000-01-02 00:00:00.546');
ERROR 23000: Duplicate entry '2000-01-02 00:00:00.550000' for key 'T1'
INSERT INTO Z0CASE VALUES(0);
ERROR 23000: Duplicate entry '0000-00-00 00:00:00.000000' for key 'T1'
INSERT INTO Z0CASE VALUES('0');
ERROR 23000: Duplicate entry '0000-00-00 00:00:00.000000' for key 'T1'
INSERT INTO Z0CASE VALUES('');
ERROR 23000: Duplicate entry '0000-00-00 00:00:00.000000' for key 'T1'
INSERT INTO Z0CASE VALUES(null);
SELECT * FROM Z0CASE ORDER BY T1;
T1
NULL
0000-00-00 00:00:00.00
2000-01-02 00:00:00.55
2000-01-02 23:59:59.16
UPDATE Z0CASE SET T1=0 WHERE T1='2000-01-02 00:00:00.55';
ERROR 23000: Duplicate entry '0000-00-00 00:00:00.000000' for key 'T1'
UPDATE Z0CASE SET T1='0' WHERE T1='2000-01-02 00:00:00.55';
ERROR 23000: Duplicate entry '0000-00-00 00:00:00.000000' for key 'T1'
UPDATE Z0CASE SET T1='' WHERE T1='2000-01-02 00:00:00.55';
ERROR 23000: Duplicate entry '0000-00-00 00:00:00.000000' for key 'T1'
UPDATE Z0CASE SET T1=NULL WHERE T1='2000-01-02 00:00:00.55';
SELECT * FROM Z0CASE ORDER BY T1;
T1
NULL
NULL
0000-00-00 00:00:00.00
2000-01-02 23:59:59.16
DROP TABLE Z0CASE;
CREATE TABLE Z0CASE(T1 TIMESTAMP(2),T2 TIMESTAMP(2)) DEFAULT charset= 'binary' DEFAULT collate = 'binary';
INSERT INTO Z0CASE VALUES('2000-01-02 23:59:59.156','2000-01-02 23:59:59.163');
INSERT INTO Z0CASE VALUES('2000-01-02 00:00:00.546','2000-01-02 00:00:00.544');
SELECT * FROM Z0CASE ORDER BY T1;
T1	T2
2000-01-02 00:00:00.55	2000-01-02 00:00:00.54
2000-01-02 23:59:59.16	2000-01-02 23:59:59.16
SELECT table_name,column_type,COLLATION_NAME,CHARACTER_SET_NAME FROM information_schema.columns WHERE table_name='Z0CASE';
table_name	column_type	COLLATION_NAME	CHARACTER_SET_NAME
z0case	timestamp(2)	NULL	NULL
z0case	timestamp(2)	NULL	NULL
SELECT table_name,table_collation FROM information_schema.tables WHERE table_name='Z0CASE';
table_name	table_collation
z0case	binary
CREATE INDEX ind ON Z0CASE(T1,T2);
SHOW INDEX FROM Z0CASE;
Table	Non_unique	Key_name	Seq_in_index	Column_name	Collation	Cardinality	Sub_part	Packed	Null	Index_type	Comment	Index_comment	Visible	Expression
z0case	1	ind	1	T1	A	NULL	NULL	NULL	YES	BTREE	available		YES	NULL
z0case	1	ind	2	T2	A	NULL	NULL	NULL	YES	BTREE	available		YES	NULL
ALTER TABLE Z0CASE CONVERT TO CHARACTER SET 'utf8mb4' COLLATE 'utf8mb4_bin';
SELECT table_name,table_collation FROM information_schema.tables WHERE table_name='Z0CASE';
table_name	table_collation
z0case	utf8mb4_bin
SHOW INDEX FROM Z0CASE;
Table	Non_unique	Key_name	Seq_in_index	Column_name	Collation	Cardinality	Sub_part	Packed	Null	Index_type	Comment	Index_comment	Visible	Expression
z0case	1	ind	1	T1	A	NULL	NULL	NULL	YES	BTREE	available		YES	NULL
z0case	1	ind	2	T2	A	NULL	NULL	NULL	YES	BTREE	available		YES	NULL
SELECT * FROM Z0CASE ORDER BY T1;
T1	T2
2000-01-02 00:00:00.55	2000-01-02 00:00:00.54
2000-01-02 23:59:59.16	2000-01-02 23:59:59.16
INSERT INTO Z0CASE VALUES('2020-01-01 01:10:10.552','2020-01-01 01:10:10.555');
SELECT * FROM Z0CASE ORDER BY T1;
T1	T2
2000-01-02 00:00:00.55	2000-01-02 00:00:00.54
2000-01-02 23:59:59.16	2000-01-02 23:59:59.16
2020-01-01 01:10:10.55	2020-01-01 01:10:10.56
UPDATE Z0CASE SET T1=NULL WHERE T2='2000-01-02 00:00:00.54';
SELECT * FROM Z0CASE ORDER BY T1;
T1	T2
NULL	2000-01-02 00:00:00.54
2000-01-02 23:59:59.16	2000-01-02 23:59:59.16
2020-01-01 01:10:10.55	2020-01-01 01:10:10.56
DROP TABLE Z0CASE;
CREATE TABLE Z1CASE(T2 TIMESTAMP(2) PRIMARY KEY) DEFAULT charset= 'binary' DEFAULT collate = 'binary';
CREATE TABLE Z0CASE(T1 TIMESTAMP(2),CONSTRAINT fk_t1_t2 FOREIGN KEY(T1) REFERENCES Z1CASE(T2)) DEFAULT charset= 'binary' DEFAULT collate = 'binary';
ALTER TABLE Z0CASE CONVERT TO CHARACTER SET 'gbk' COLLATE 'gbk_bin';
SELECT table_name,table_collation FROM information_schema.tables WHERE table_name='Z0CASE';
table_name	table_collation
z0case	gbk_bin
INSERT INTO Z0CASE VALUES('2020-01-01 01:10:10.552');
ERROR 23000: Cannot add or update a child row: a foreign key constraint fails
INSERT INTO Z0CASE VALUES('');
ERROR 23000: Cannot add or update a child row: a foreign key constraint fails
INSERT INTO Z0CASE VALUES(NULL);
SELECT * FROM Z0CASE ORDER BY T1;
T1
NULL
UPDATE Z0CASE SET T1='2020-01-01 01:10:10.552';
ERROR 23000: Cannot add or update a child row: a foreign key constraint fails
UPDATE Z0CASE SET T1='';
ERROR 23000: Cannot add or update a child row: a foreign key constraint fails
DROP TABLE Z0CASE;
DROP TABLE Z1CASE;
CREATE TABLE Z0CASE(T1 TIMESTAMP(2) NOT NULL) DEFAULT charset= 'binary' DEFAULT collate = 'binary';
INSERT INTO Z0CASE VALUES('2020-01-01 01:10:10.552');
INSERT INTO Z0CASE VALUES(0);
SELECT * FROM Z0CASE ORDER BY T1;
T1
0000-00-00 00:00:00.00
2020-01-01 01:10:10.55
SELECT table_name,column_type,COLLATION_NAME,CHARACTER_SET_NAME FROM information_schema.columns WHERE table_name='Z0CASE';
table_name	column_type	COLLATION_NAME	CHARACTER_SET_NAME
z0case	timestamp(2)	NULL	NULL
SELECT table_name,table_collation FROM information_schema.tables WHERE table_name='Z0CASE';
table_name	table_collation
z0case	binary
ALTER TABLE Z0CASE CONVERT TO CHARACTER SET 'gbk' COLLATE 'gbk_bin';
SELECT table_name,table_collation FROM information_schema.tables WHERE table_name='Z0CASE';
table_name	table_collation
z0case	gbk_bin
SELECT * FROM Z0CASE ORDER BY T1;
T1
0000-00-00 00:00:00.00
2020-01-01 01:10:10.55
INSERT INTO Z0CASE VALUES(NULL);
ERROR 23000: Column 'T1' cannot be null
INSERT INTO Z0CASE VALUES('');
INSERT INTO Z0CASE VALUES('2020-01-01 11:12:13.555');
SELECT * FROM Z0CASE ORDER BY T1;
T1
0000-00-00 00:00:00.00
0000-00-00 00:00:00.00
2020-01-01 01:10:10.55
2020-01-01 11:12:13.56
UPDATE Z0CASE SET T1=NULL WHERE T1='2020-01-01 11:12:13.56';
Warnings:
Warning	1048	Column 'T1' cannot be null
UPDATE Z0CASE SET T1='' WHERE T1='2020-01-01 11:12:13.56';
UPDATE Z0CASE SET T1='2000-10-01 01:10:10.106' WHERE T1='2020-01-01 11:12:13.56';
SELECT * FROM Z0CASE ORDER BY T1;
T1
0000-00-00 00:00:00.00
0000-00-00 00:00:00.00
0000-00-00 00:00:00.00
2020-01-01 01:10:10.55
DROP TABLE Z0CASE;
CREATE TABLE Z0CASE(T1 TIMESTAMP(2) DEFAULT '2020-01-01 12:00:00.00',T2 INT) DEFAULT charset= 'binary' DEFAULT collate = 'binary';
INSERT INTO Z0CASE VALUES('2000-10-01 11:10:12.23456',1);
INSERT INTO Z0CASE VALUES(NULL,2);
INSERT INTO Z0CASE(T2) VALUES(3);
SELECT * FROM Z0CASE ORDER BY T2;
T1	T2
2000-10-01 11:10:12.23	1
NULL	2
2020-01-01 12:00:00.00	3
SELECT table_name,column_type,COLLATION_NAME,CHARACTER_SET_NAME FROM information_schema.columns WHERE table_name='Z0CASE';
table_name	column_type	COLLATION_NAME	CHARACTER_SET_NAME
z0case	timestamp(2)	NULL	NULL
z0case	int(11)	NULL	NULL
SELECT table_name,table_collation FROM information_schema.tables WHERE table_name='Z0CASE';
table_name	table_collation
z0case	binary
ALTER TABLE Z0CASE CONVERT TO CHARACTER SET 'utf16' COLLATE 'utf16_bin';
SELECT table_name,table_collation FROM information_schema.tables WHERE table_name='Z0CASE';
table_name	table_collation
z0case	utf16_bin
SELECT * FROM Z0CASE ORDER BY T2;
T1	T2
2000-10-01 11:10:12.23	1
NULL	2
2020-01-01 12:00:00.00	3
INSERT INTO Z0CASE(T2) VALUES(4);
INSERT INTO Z0CASE VALUES('',5);
INSERT INTO Z0CASE VALUES(NULL,6);
SELECT * FROM Z0CASE ORDER BY T2;
T1	T2
2000-10-01 11:10:12.23	1
NULL	2
2020-01-01 12:00:00.00	3
2020-01-01 12:00:00.00	4
0000-00-00 00:00:00.00	5
NULL	6
YEAR
DROP TABLE Z0CASE;
CREATE TABLE Z0CASE(T1 YEAR PRIMARY KEY) DEFAULT charset= utf8mb4 DEFAULT collate = utf8mb4_general_ci;
INSERT INTO Z0CASE VALUES('2000');
INSERT INTO Z0CASE VALUES('2021');
INSERT INTO Z0CASE VALUES(0);
SELECT * FROM Z0CASE ORDER BY T1;
T1
0000
2000
2021
SELECT table_name,column_type,COLLATION_NAME,CHARACTER_SET_NAME FROM information_schema.columns WHERE table_name='Z0CASE';
table_name	column_type	COLLATION_NAME	CHARACTER_SET_NAME
z0case	year(4)	NULL	NULL
SELECT table_name,table_collation FROM information_schema.tables WHERE table_name='Z0CASE';
table_name	table_collation
z0case	utf8mb4_general_ci
ALTER TABLE Z0CASE CONVERT TO CHARACTER SET 'binary' COLLATE 'binary';
SELECT table_name,table_collation FROM information_schema.tables WHERE table_name='Z0CASE';
table_name	table_collation
z0case	binary
SHOW INDEX FROM Z0CASE;
Table	Non_unique	Key_name	Seq_in_index	Column_name	Collation	Cardinality	Sub_part	Packed	Null	Index_type	Comment	Index_comment	Visible	Expression
z0case	0	PRIMARY	1	T1	A	NULL	NULL	NULL		BTREE	available		YES	NULL
SELECT * FROM Z0CASE ORDER BY T1;
T1
0000
2000
2021
INSERT INTO Z0CASE VALUES(0);
ERROR 23000: Duplicate entry '0000' for key 'PRIMARY'
INSERT INTO Z0CASE VALUES(null);
ERROR 23000: Column 'T1' cannot be null
INSERT INTO Z0CASE VALUES('');
ERROR 23000: Duplicate entry '0000' for key 'PRIMARY'
INSERT INTO Z0CASE VALUES('2000');
ERROR 23000: Duplicate entry '2000' for key 'PRIMARY'
INSERT INTO Z0CASE VALUES('2005');
SELECT * FROM Z0CASE ORDER BY T1;
T1
0000
2000
2005
2021
UPDATE Z0CASE SET T1=NULL WHERE T1='2000';
ERROR 23000: Duplicate entry '0000' for key 'PRIMARY'
UPDATE Z0CASE SET T1='2005' WHERE T1='2000';
ERROR 23000: Duplicate entry '2005' for key 'PRIMARY'
UPDATE Z0CASE SET T1='' WHERE T1='2000';
SELECT * FROM Z0CASE ORDER BY T1;
T1
0000
2000
2005
2021
DROP TABLE Z0CASE;
CREATE TABLE Z0CASE(T1 YEAR UNIQUE) DEFAULT charset='binary' DEFAULT collate='binary';
INSERT INTO Z0CASE VALUES('2000');
INSERT INTO Z0CASE VALUES(0);
SELECT * FROM Z0CASE ORDER BY T1;
T1
0000
2000
SELECT table_name,column_type,COLLATION_NAME,CHARACTER_SET_NAME FROM information_schema.columns WHERE table_name='Z0CASE';
table_name	column_type	COLLATION_NAME	CHARACTER_SET_NAME
z0case	year(4)	NULL	NULL
SELECT table_name,table_collation FROM information_schema.tables WHERE table_name='Z0CASE';
table_name	table_collation
z0case	binary
ALTER TABLE Z0CASE CONVERT TO CHARACTER SET 'gbk' COLLATE 'gbk_bin';
SELECT table_name,table_collation FROM information_schema.tables WHERE table_name='Z0CASE';
table_name	table_collation
z0case	gbk_bin
SHOW INDEX FROM Z0CASE;
Table	Non_unique	Key_name	Seq_in_index	Column_name	Collation	Cardinality	Sub_part	Packed	Null	Index_type	Comment	Index_comment	Visible	Expression
z0case	0	T1	1	T1	A	NULL	NULL	NULL	YES	BTREE	available		YES	NULL
SELECT * FROM Z0CASE ORDER BY T1;
T1
0000
2000
INSERT INTO Z0CASE VALUES('2000');
ERROR 23000: Duplicate entry '2000' for key 'T1'
INSERT INTO Z0CASE VALUES(0);
ERROR 23000: Duplicate entry '0000' for key 'T1'
INSERT INTO Z0CASE VALUES('0');
ERROR 23000: Duplicate entry '2000' for key 'T1'
INSERT INTO Z0CASE VALUES('');
ERROR 23000: Duplicate entry '0000' for key 'T1'
INSERT INTO Z0CASE VALUES(null);
SELECT * FROM Z0CASE ORDER BY T1;
T1
NULL
0000
2000
UPDATE Z0CASE SET T1=0 WHERE T1='2000';
ERROR 23000: Duplicate entry '0000' for key 'T1'
UPDATE Z0CASE SET T1='0' WHERE T1='2000';
SELECT * FROM Z0CASE ORDER BY T1;
T1
NULL
0000
2000
UPDATE Z0CASE SET T1='' WHERE T1='2000';
UPDATE Z0CASE SET T1=NULL WHERE T1='2000';
SELECT * FROM Z0CASE ORDER BY T1;
T1
NULL
NULL
0000
DROP TABLE Z0CASE;
CREATE TABLE Z0CASE(T1 YEAR,T2 YEAR) DEFAULT charset= 'binary' DEFAULT collate = 'binary';
INSERT INTO Z0CASE VALUES('2000','2003');
INSERT INTO Z0CASE VALUES('2006','2004');
INSERT INTO Z0CASE VALUES(0,'0');
SELECT * FROM Z0CASE ORDER BY T1;
T1	T2
0000	2000
2000	2003
2006	2004
SELECT table_name,column_type,COLLATION_NAME,CHARACTER_SET_NAME FROM information_schema.columns WHERE table_name='Z0CASE';
table_name	column_type	COLLATION_NAME	CHARACTER_SET_NAME
z0case	year(4)	NULL	NULL
z0case	year(4)	NULL	NULL
SELECT table_name,table_collation FROM information_schema.tables WHERE table_name='Z0CASE';
table_name	table_collation
z0case	binary
CREATE INDEX ind ON Z0CASE(T1,T2);
SHOW INDEX FROM Z0CASE;
Table	Non_unique	Key_name	Seq_in_index	Column_name	Collation	Cardinality	Sub_part	Packed	Null	Index_type	Comment	Index_comment	Visible	Expression
z0case	1	ind	1	T1	A	NULL	NULL	NULL	YES	BTREE	available		YES	NULL
z0case	1	ind	2	T2	A	NULL	NULL	NULL	YES	BTREE	available		YES	NULL
ALTER TABLE Z0CASE CONVERT TO CHARACTER SET 'utf8mb4' COLLATE 'utf8mb4_bin';
SELECT table_name,table_collation FROM information_schema.tables WHERE table_name='Z0CASE';
table_name	table_collation
z0case	utf8mb4_bin
SHOW INDEX FROM Z0CASE;
Table	Non_unique	Key_name	Seq_in_index	Column_name	Collation	Cardinality	Sub_part	Packed	Null	Index_type	Comment	Index_comment	Visible	Expression
z0case	1	ind	1	T1	A	NULL	NULL	NULL	YES	BTREE	available		YES	NULL
z0case	1	ind	2	T2	A	NULL	NULL	NULL	YES	BTREE	available		YES	NULL
SELECT * FROM Z0CASE ORDER BY T1;
T1	T2
0000	2000
2000	2003
2006	2004
INSERT INTO Z0CASE VALUES('2020','2020');
SELECT * FROM Z0CASE ORDER BY T1;
T1	T2
0000	2000
2000	2003
2006	2004
2020	2020
UPDATE Z0CASE SET T1=NULL WHERE T2='2000';
SELECT * FROM Z0CASE ORDER BY T1;
T1	T2
NULL	2000
2000	2003
2006	2004
2020	2020
DROP TABLE Z0CASE;
CREATE TABLE Z1CASE(T2 YEAR PRIMARY KEY) DEFAULT charset= 'binary' DEFAULT collate = 'binary';
CREATE TABLE Z0CASE(T1 YEAR,CONSTRAINT fk_t1_t2 FOREIGN KEY(T1) REFERENCES Z1CASE(T2)) DEFAULT charset= 'binary' DEFAULT collate = 'binary';
ALTER TABLE Z0CASE CONVERT TO CHARACTER SET 'gbk' COLLATE 'gbk_bin';
SELECT table_name,table_collation FROM information_schema.tables WHERE table_name='Z0CASE';
table_name	table_collation
z0case	gbk_bin
INSERT INTO Z0CASE VALUES('2020');
ERROR 23000: Cannot add or update a child row: a foreign key constraint fails
INSERT INTO Z0CASE VALUES('');
ERROR 23000: Cannot add or update a child row: a foreign key constraint fails
INSERT INTO Z0CASE VALUES(NULL);
SELECT * FROM Z0CASE ORDER BY T1;
T1
NULL
UPDATE Z0CASE SET T1='2020';
ERROR 23000: Cannot add or update a child row: a foreign key constraint fails
UPDATE Z0CASE SET T1='';
ERROR 23000: Cannot add or update a child row: a foreign key constraint fails
DROP TABLE Z0CASE;
DROP TABLE Z1CASE;
CREATE TABLE Z0CASE(T1 YEAR NOT NULL) DEFAULT charset= 'binary' DEFAULT collate = 'binary';
INSERT INTO Z0CASE VALUES('2020');
INSERT INTO Z0CASE VALUES(0);
SELECT * FROM Z0CASE ORDER BY T1;
T1
0000
2020
SELECT table_name,column_type,COLLATION_NAME,CHARACTER_SET_NAME FROM information_schema.columns WHERE table_name='Z0CASE';
table_name	column_type	COLLATION_NAME	CHARACTER_SET_NAME
z0case	year(4)	NULL	NULL
SELECT table_name,table_collation FROM information_schema.tables WHERE table_name='Z0CASE';
table_name	table_collation
z0case	binary
ALTER TABLE Z0CASE CONVERT TO CHARACTER SET 'gbk' COLLATE 'gbk_bin';
SELECT table_name,table_collation FROM information_schema.tables WHERE table_name='Z0CASE';
table_name	table_collation
z0case	gbk_bin
SELECT * FROM Z0CASE ORDER BY T1;
T1
0000
2020
INSERT INTO Z0CASE VALUES(NULL);
ERROR 23000: Column 'T1' cannot be null
INSERT INTO Z0CASE VALUES('');
SELECT * FROM Z0CASE ORDER BY T1;
T1
0000
0000
2020
INSERT INTO Z0CASE VALUES('2021');
SELECT * FROM Z0CASE ORDER BY T1;
T1
0000
0000
2020
2021
UPDATE Z0CASE SET T1=NULL WHERE T1='2020';
Warnings:
Warning	1048	Column 'T1' cannot be null
UPDATE Z0CASE SET T1='' WHERE T1='2020';
SELECT * FROM Z0CASE ORDER BY T1;
T1
0000
0000
0000
2021
UPDATE Z0CASE SET T1='2000' WHERE T1='2021';
SELECT * FROM Z0CASE ORDER BY T1;
T1
0000
0000
0000
2000
DROP TABLE Z0CASE;
CREATE TABLE Z0CASE(T1 YEAR DEFAULT '2021',T2 INT) DEFAULT charset= 'binary' DEFAULT collate = 'binary';
INSERT INTO Z0CASE VALUES('2000',1);
INSERT INTO Z0CASE VALUES(NULL,2);
INSERT INTO Z0CASE(T2) VALUES(3);
SELECT * FROM Z0CASE ORDER BY T2;
T1	T2
2000	1
NULL	2
2021	3
SELECT table_name,column_type,COLLATION_NAME,CHARACTER_SET_NAME FROM information_schema.columns WHERE table_name='Z0CASE';
table_name	column_type	COLLATION_NAME	CHARACTER_SET_NAME
z0case	year(4)	NULL	NULL
z0case	int(11)	NULL	NULL
SELECT table_name,table_collation FROM information_schema.tables WHERE table_name='Z0CASE';
table_name	table_collation
z0case	binary
ALTER TABLE Z0CASE CONVERT TO CHARACTER SET 'utf16' COLLATE 'utf16_bin';
SELECT table_name,table_collation FROM information_schema.tables WHERE table_name='Z0CASE';
table_name	table_collation
z0case	utf16_bin
SELECT * FROM Z0CASE ORDER BY T2;
T1	T2
2000	1
NULL	2
2021	3
INSERT INTO Z0CASE(T2) VALUES(4);
SELECT * FROM Z0CASE ORDER BY T2;
T1	T2
2000	1
NULL	2
2021	3
2021	4
INSERT INTO Z0CASE VALUES('',5);
INSERT INTO Z0CASE VALUES(NULL,6);
SELECT * FROM Z0CASE ORDER BY T2;
T1	T2
2000	1
NULL	2
2021	3
2021	4
0000	5
NULL	6
DROP TABLE Z0CASE;
DROP USER 'zhang'@'%';
DROP DATABASE charset_test;
########Empty recycle bin, delete test database, tables, etc ##########
