drop table if exists t;
drop table if exists t1;
alter system ob_vector_memory_limit_percentage=30;
select sleep(5);
sleep(5)
0
=============no vector index + offline ddl + insert data + create vector index + update data + delete data=============
=============add column before/after/first=============
create table t(c1 int primary key, c2 vector(3), c3 char(10)) partition by range(c1) (partition p0 values less than (10), partition p1 values less than (20), partition p2 values less than maxvalue);
alter table t add a1 vector(3) before c1;
alter table t add a2 vector(3) after a1;
alter table t add a3 vector(3) first;
insert into t values([0.12121,2.2323,2],[0.12121,2.2323,2],[0.12121,2.2323,2],1,[0.12121,2.2323,2],'a');
insert into t values([0.12121,2.2323,2],[0.12121,2.2323,2],[0.12121,2.2323,2],11,[0.12121,2.2323,2],'a');
insert into t values([0.12121,2.2323,2],[0.12121,2.2323,2],[0.12121,2.2323,2],2,[0.12121,2.2323,2],'a');
insert into t values([0.12121,2.2323,2],[0.12121,2.2323,2],[0.12121,2.2323,2],12,[0.12121,2.2323,2],'a');
insert into t values([0.12121,2.2323,2],[0.12121,2.2323,2],[0.12121,2.2323,2],3,[0.12121,2.2323,2],'a');
insert into t values([0.12121,2.2323,2],[0.12121,2.2323,2],[0.12121,2.2323,2],13,[0.12121,2.2323,2],'a');
insert into t values([0.12121,2.2323,2],[0.12121,2.2323,2],[0.12121,2.2323,2],33,[0.12121,2.2323,2],'a');
insert into t values([0.12121,2.2323,2],[0.12121,2.2323,2],[0.12121,2.2323,2],43,[0.12121,2.2323,2],'a');
insert into t values([0.12121,2.2323,2],[0.12121,2.2323,2],[0.12121,2.2323,2],4,[0.12121,2.2323,2],'a');
insert into t values([0.12121,2.2323,2],[0.12121,2.2323,2],[0.12121,2.2323,2],14,[0.12121,2.2323,2],'a');
insert into t values([0.12121,2.2323,2],[0.12121,2.2323,2],[0.12121,2.2323,2],24,[0.12121,2.2323,2],'a');
create vector index idx_1 on t(a1) with (distance=l2,type=hnsw);
insert into t partition(p0) values([0.12121,2.2323,2],[0.12121,2.2323,2],[0.12121,2.2323,2],5,[0.12121,2.2323,2],'a');
insert into t partition(p0) values([0.12121,2.2323,2],[0.12121,2.2323,2],[0.12121,2.2323,2],6,[0.12121,2.2323,2],'a');
insert into t partition(p1) values([0.12121,2.2323,2],[0.12121,2.2323,2],[0.12121,2.2323,2],16,[0.12121,2.2323,2],'a');
insert into t partition(p2) values([0.12121,2.2323,2],[0.12121,2.2323,2],[0.12121,2.2323,2],26,[0.12121,2.2323,2],'a');
update t set c3='b' where c1=3;
update t set c3='c' where c1=13;
update t set c3='d' where c1=33;
update t set c3='e' where c1=26;
delete from t where c1=3;
delete from t where c1=13;
delete from t where c1=26;
delete from t where c1%2=0;
select a.a1 from t as a inner join (select * from t where c3='d' order by l2_distance(a1, '[0.12121,0.1212,3]') approx limit 10) b on a.c1=b.c1;
a1
[0.12121,2.2323,2]
explain select a.a1 from t as a inner join (select * from t where c3='d' order by l2_distance(a1, '[0.12121,0.1212,3]') approx limit 10) b on a.c1=b.c1;
Query Plan
=================================================================================================
|ID|OPERATOR                                                     |NAME    |EST.ROWS|EST.TIME(us)|
-------------------------------------------------------------------------------------------------
|0 |PX COORDINATOR                                               |        |1       |0|
|1 |└─EXCHANGE OUT DISTR                                         |:EX10002|1       |0|
|2 |  └─HASH JOIN                                                |        |1       |0|
|3 |    ├─EXCHANGE IN DISTR                                      |        |1       |0|
|4 |    │ └─EXCHANGE OUT DISTR (PKEY)                            |:EX10001|1       |0|
|5 |    │   └─SUBPLAN SCAN                                       |b       |1       |0|
|6 |    │     └─LIMIT                                            |        |1       |0|
|7 |    │       └─EXCHANGE IN MERGE SORT DISTR                   |        |1       |0|
|8 |    │         └─EXCHANGE OUT DISTR                           |:EX10000|1       |0|
|9 |    │           └─TOP-N SORT                                 |        |1       |0|
|10|    │             └─PX PARTITION ITERATOR                    |        |1       |0|
|11|    │               └─VECTOR INDEX ADAPTIVE SCAN (PRE-FILTER)|t       |1       |0|
|12|    └─PX PARTITION ITERATOR                                  |        |5       |0|
|13|      └─TABLE FULL SCAN                                      |a       |5       |0|
=================================================================================================
Outputs & filters:
-------------------------------------
  0 - output([INTERNAL_FUNCTION(a.a1)]), filter(nil), rowset=16
  1 - output([INTERNAL_FUNCTION(a.a1)]), filter(nil), rowset=16
      dop=1
  2 - output([a.a1]), filter(nil), rowset=16
      equal_conds([a.c1 = b.c1]), other_conds(nil)
  3 - output([b.c1]), filter(nil), rowset=16
  4 - output([b.c1]), filter(nil), rowset=16
      (#keys=1, [b.c1]), is_single, dop=1
  5 - output([b.c1]), filter(nil), rowset=16
      access([b.c1])
  6 - output([t.a3], [t.a1], [t.a2], [t.c1], [t.c2], [t.c3]), filter(nil), rowset=16
      limit(10), offset(nil)
  7 - output([t.a3], [t.a1], [t.a2], [t.c1], [t.c2], [t.c3]), filter(nil), rowset=16
      sort_keys([l2_distance(t.a1, cast('[0.12121,0.1212,3]', ARRAY(18, -1))), ASC])
  8 - output([t.a3], [t.a1], [t.a2], [t.c1], [t.c2], [t.c3], [l2_distance(t.a1, cast('[0.12121,0.1212,3]', ARRAY(18, -1)))]), filter(nil), rowset=16
      dop=1
  9 - output([t.a3], [t.a1], [t.a2], [t.c1], [t.c2], [t.c3], [l2_distance(t.a1, cast('[0.12121,0.1212,3]', ARRAY(18, -1)))]), filter(nil), rowset=16
      sort_keys([l2_distance(t.a1, cast('[0.12121,0.1212,3]', ARRAY(18, -1))), ASC]), topn(10)
 10 - output([t.c1], [t.a1], [t.c3], [t.a3], [t.a2], [t.c2], [l2_distance(t.a1, cast('[0.12121,0.1212,3]', ARRAY(18, -1)))]), filter(nil), rowset=16
      force partition granule
 11 - output([t.c1], [t.a1], [t.c3], [t.a3], [t.a2], [t.c2], [l2_distance(t.a1, cast('[0.12121,0.1212,3]', ARRAY(18, -1)))]), filter([t.c3 = 'd']), rowset=16
      access([t.c1], [t.a1], [t.c3], [t.a3], [t.a2], [t.c2]), partitions(p[0-2])
      is_index_back=true, is_global_index=false, filter_before_indexback[false], 
      range_key([t.c1]), range(MIN ; MAX)always true
 12 - output([a.c1], [a.a1]), filter(nil), rowset=16
      affinitize, force partition granule
 13 - output([a.c1], [a.a1]), filter(nil), rowset=16
      access([a.c1], [a.a1]), partitions(p[0-2])
      is_index_back=false, is_global_index=false, 
      range_key([a.c1]), range(MIN ; MAX)always true
=============modify column before/after/first=============
drop table if exists t;
create table t(c1 int primary key, c2 vector(3), c3 char(10)) partition by range(c1) (partition p0 values less than (10), partition p1 values less than (20), partition p2 values less than maxvalue);
insert into t(c3,c2,c1) values('a',[0.12121,2.2323,2],1);
insert into t(c3,c2,c1) values('a',[0.12121,2.2323,2],2);
insert into t(c3,c2,c1) values('a',[0.12121,2.2323,2],11);
alter table t modify column c2 vector(3) first;
alter table t modify column c1 int after c3;
alter table t modify column c3 char(10) before c2;
insert into t(c3,c2,c1) values('a',[0.12121,2.2323,2],12);
insert into t(c3,c2,c1) values('a',[0.12121,2.2323,2],21);
insert into t(c3,c2,c1) values('a',[0.12121,2.2323,2],22);
create vector index idx_1 on t(c2) with (distance=l2,type=hnsw);
insert into t partition(p0) values('a',[0.12121,2.2323,2],3);
insert into t partition(p1) values('a',[0.12121,2.2323,2],13);
insert into t partition(p2) values('a',[0.12121,2.2323,2],23);
update t set c3='b' where c1=3;
update t set c3='c' where c1=13;
update t set c3='d' where c1=23;
delete from t where c1=3;
delete from t where c1=13;
delete from t where c1%2=1;
select a.c1,a.c2 from t as a inner join (select * from t where c1<10 order by l2_distance(c2, '[0.12121,0.1212,3]') approx limit 10) b on a.c1=b.c1;
c1	c2
2	[0.12121,2.2323,2]
explain select a.c1,a.c2 from t as a inner join (select * from t where c1<10 order by l2_distance(c2, '[0.12121,0.1212,3]') approx limit 10) b on a.c1=b.c1;
Query Plan
=========================================================================================
|ID|OPERATOR                                             |NAME    |EST.ROWS|EST.TIME(us)|
-----------------------------------------------------------------------------------------
|0 |PX COORDINATOR                                       |        |1       |0|
|1 |└─EXCHANGE OUT DISTR                                 |:EX10001|1       |0|
|2 |  └─HASH JOIN                                        |        |1       |0|
|3 |    ├─EXCHANGE IN DISTR                              |        |1       |0|
|4 |    │ └─EXCHANGE OUT DISTR (PKEY)                    |:EX10000|1       |0|
|5 |    │   └─SUBPLAN SCAN                               |b       |1       |0|
|6 |    │     └─TOP-N SORT                               |        |1       |0|
|7 |    │       └─VECTOR INDEX ADAPTIVE SCAN (PRE-FILTER)|t       |1       |0|
|8 |    └─PX PARTITION ITERATOR                          |        |3       |0|
|9 |      └─TABLE FULL SCAN                              |a       |3       |0|
=========================================================================================
Outputs & filters:
-------------------------------------
  0 - output([INTERNAL_FUNCTION(a.c1, a.c2)]), filter(nil), rowset=16
  1 - output([INTERNAL_FUNCTION(a.c1, a.c2)]), filter(nil), rowset=16
      dop=1
  2 - output([a.c1], [a.c2]), filter(nil), rowset=16
      equal_conds([a.c1 = b.c1]), other_conds(nil)
  3 - output([b.c1]), filter(nil), rowset=16
  4 - output([b.c1]), filter(nil), rowset=16
      (#keys=1, [b.c1]), is_single, dop=1
  5 - output([b.c1]), filter(nil), rowset=16
      access([b.c1])
  6 - output([t.c3], [t.c2], [t.c1]), filter(nil), rowset=16
      sort_keys([l2_distance(t.c2, cast('[0.12121,0.1212,3]', ARRAY(18, -1))), ASC]), topn(10)
  7 - output([t.c1], [t.c2], [t.c3], [l2_distance(t.c2, cast('[0.12121,0.1212,3]', ARRAY(18, -1)))]), filter([t.c1 < 10]), rowset=16
      access([t.c1], [t.c2], [t.c3]), partitions(p0)
      is_index_back=true, is_global_index=false, filter_before_indexback[false], 
      range_key([t.c1]), range(NULL ; 10)
  8 - output([a.c1], [a.c2]), filter(nil), rowset=16
      affinitize, force partition granule
  9 - output([a.c1], [a.c2]), filter(nil), rowset=16
      access([a.c1], [a.c2]), partitions(p[0-2])
      is_index_back=false, is_global_index=false, 
      range_key([a.c1]), range(MIN ; MAX)always true
=============add auto_increment column=============
drop table if exists t;
create table t(c1 int primary key, c2 vector(3), c3 char(10)) partition by range(c1) (partition p0 values less than (10), partition p1 values less than (20), partition p2 values less than maxvalue);
alter table t add column a1 int auto_increment;
insert into t(c3,c2,c1) values('a',[0.12121,2.2323,2],1);
insert into t(c3,c2,c1) values('a',[0.12121,2.2323,2],2);
insert into t(c3,c2,c1) values('a',[0.12121,2.2323,2],11);
insert into t(c3,c2,c1) values('a',[0.12121,2.2323,2],12);
insert into t(c3,c2,c1) values('a',[0.12121,2.2323,2],21);
insert into t(c3,c2,c1) values('a',[0.12121,2.2323,2],22);
create vector index idx_1 on t(c2) with (distance=l2,type=hnsw);
insert into t partition(p0) values(3,[0.12121,2.2323,2],'a',default);
insert into t partition(p1) values(13,[0.12121,2.2323,2],'a',default);
insert into t partition(p2) values(23,[0.12121,2.2323,2],'a',default);
update t set c3='b' where c1=3;
update t set c3='c' where c1=13;
update t set c3='d' where c1=23;
delete from t where c1=3;
delete from t where c1=13;
delete from t where c1%2=1;
select a.c1,a.c2 from t as a inner join (select * from t where c1<10 order by l2_distance(c2, '[0.12121,0.1212,3]') approx limit 10) b on a.c1=b.c1;
c1	c2
2	[0.12121,2.2323,2]
explain select a.c1,a.c2 from t as a inner join (select * from t where c1<10 order by l2_distance(c2, '[0.12121,0.1212,3]') approx limit 10) b on a.c1=b.c1;
Query Plan
=========================================================================================
|ID|OPERATOR                                             |NAME    |EST.ROWS|EST.TIME(us)|
-----------------------------------------------------------------------------------------
|0 |PX COORDINATOR                                       |        |1       |0|
|1 |└─EXCHANGE OUT DISTR                                 |:EX10001|1       |0|
|2 |  └─HASH JOIN                                        |        |1       |0|
|3 |    ├─EXCHANGE IN DISTR                              |        |1       |0|
|4 |    │ └─EXCHANGE OUT DISTR (PKEY)                    |:EX10000|1       |0|
|5 |    │   └─SUBPLAN SCAN                               |b       |1       |0|
|6 |    │     └─TOP-N SORT                               |        |1       |0|
|7 |    │       └─VECTOR INDEX ADAPTIVE SCAN (PRE-FILTER)|t       |1       |0|
|8 |    └─PX PARTITION ITERATOR                          |        |3       |0|
|9 |      └─TABLE FULL SCAN                              |a       |3       |0|
=========================================================================================
Outputs & filters:
-------------------------------------
  0 - output([INTERNAL_FUNCTION(a.c1, a.c2)]), filter(nil), rowset=16
  1 - output([INTERNAL_FUNCTION(a.c1, a.c2)]), filter(nil), rowset=16
      dop=1
  2 - output([a.c1], [a.c2]), filter(nil), rowset=16
      equal_conds([a.c1 = b.c1]), other_conds(nil)
  3 - output([b.c1]), filter(nil), rowset=16
  4 - output([b.c1]), filter(nil), rowset=16
      (#keys=1, [b.c1]), is_single, dop=1
  5 - output([b.c1]), filter(nil), rowset=16
      access([b.c1])
  6 - output([t.c1], [t.c2], [t.c3], [t.a1]), filter(nil), rowset=16
      sort_keys([l2_distance(t.c2, cast('[0.12121,0.1212,3]', ARRAY(18, -1))), ASC]), topn(10)
  7 - output([t.c1], [t.c2], [t.c3], [t.a1], [l2_distance(t.c2, cast('[0.12121,0.1212,3]', ARRAY(18, -1)))]), filter([t.c1 < 10]), rowset=16
      access([t.c1], [t.c2], [t.c3], [t.a1]), partitions(p0)
      is_index_back=true, is_global_index=false, filter_before_indexback[false], 
      range_key([t.c1]), range(NULL ; 10)
  8 - output([a.c1], [a.c2]), filter(nil), rowset=16
      affinitize, force partition granule
  9 - output([a.c1], [a.c2]), filter(nil), rowset=16
      access([a.c1], [a.c2]), partitions(p[0-2])
      is_index_back=false, is_global_index=false, 
      range_key([a.c1]), range(MIN ; MAX)always true
=============add/drop primary key=============
drop table if exists t;
create table t(c1 int primary key, c2 vector(3), c3 char(10)) partition by range(c1) (partition p0 values less than (10), partition p1 values less than (20), partition p2 values less than maxvalue);
insert into t(c3,c2,c1) values('a',[0.12121,2.2323,2],1);
insert into t(c3,c2,c1) values('a',[0.12121,2.2323,2],2);
insert into t(c3,c2,c1) values('a',[0.12121,2.2323,2],11);
insert into t(c3,c2,c1) values('a',[0.12121,2.2323,2],12);
alter table t add column a1 int auto_increment;
alter table t drop primary key, add primary key(a1,c1);
insert into t(c3,c2,c1) values('a',[0.12121,2.2323,2],21);
insert into t(c3,c2,c1) values('a',[0.12121,2.2323,2],22);
create vector index idx_1 on t(c2) with (distance=l2,type=hnsw);
insert into t partition(p0) values(3,[0.12121,2.2323,2],'a',default);
insert into t partition(p1) values(13,[0.12121,2.2323,2],'a',default);
insert into t partition(p2) values(23,[0.12121,2.2323,2],'a',default);
update t set c3='b' where c1=3;
update t set c3='c' where c1=13;
update t set c3='d' where c1=23;
delete from t where c1=3;
delete from t where c1=13;
delete from t where c1%2=1;
select a.c1,a.c2 from t as a inner join (select * from t where c1<10 order by l2_distance(c2, '[0.12121,0.1212,3]') approx limit 10) b on a.c1=b.c1;
c1	c2
2	[0.12121,2.2323,2]
explain select a.c1,a.c2 from t as a inner join (select * from t where c1<10 order by l2_distance(c2, '[0.12121,0.1212,3]') approx limit 10) b on a.c1=b.c1;
Query Plan
=========================================================================================
|ID|OPERATOR                                             |NAME    |EST.ROWS|EST.TIME(us)|
-----------------------------------------------------------------------------------------
|0 |PX COORDINATOR                                       |        |1       |0|
|1 |└─EXCHANGE OUT DISTR                                 |:EX10001|1       |0|
|2 |  └─HASH JOIN                                        |        |1       |0|
|3 |    ├─EXCHANGE IN DISTR                              |        |1       |0|
|4 |    │ └─EXCHANGE OUT DISTR (PKEY)                    |:EX10000|1       |0|
|5 |    │   └─SUBPLAN SCAN                               |b       |1       |0|
|6 |    │     └─TOP-N SORT                               |        |1       |0|
|7 |    │       └─VECTOR INDEX ADAPTIVE SCAN (PRE-FILTER)|t       |1       |0|
|8 |    └─PX PARTITION ITERATOR                          |        |3       |0|
|9 |      └─TABLE FULL SCAN                              |a       |3       |0|
=========================================================================================
Outputs & filters:
-------------------------------------
  0 - output([INTERNAL_FUNCTION(a.c1, a.c2)]), filter(nil), rowset=16
  1 - output([INTERNAL_FUNCTION(a.c1, a.c2)]), filter(nil), rowset=16
      dop=1
  2 - output([a.c1], [a.c2]), filter(nil), rowset=16
      equal_conds([a.c1 = b.c1]), other_conds(nil)
  3 - output([b.c1]), filter(nil), rowset=16
  4 - output([b.c1]), filter(nil), rowset=16
      (#keys=1, [b.c1]), is_single, dop=1
  5 - output([b.c1]), filter(nil), rowset=16
      access([b.c1])
  6 - output([t.c1], [t.c2], [t.c3], [t.a1]), filter(nil), rowset=16
      sort_keys([l2_distance(t.c2, cast('[0.12121,0.1212,3]', ARRAY(18, -1))), ASC]), topn(10)
  7 - output([t.a1], [t.c1], [t.c2], [t.c3], [l2_distance(t.c2, cast('[0.12121,0.1212,3]', ARRAY(18, -1)))]), filter([t.c1 < 10]), rowset=16
      access([t.a1], [t.c1], [t.c2], [t.c3]), partitions(p0)
      is_index_back=true, is_global_index=false, filter_before_indexback[false], 
      range_key([t.a1], [t.c1]), range(MIN,MIN ; MAX,MAX)always true
  8 - output([a.c1], [a.c2]), filter(nil), rowset=16
      affinitize, force partition granule
  9 - output([a.c1], [a.c2]), filter(nil), rowset=16
      access([a.c1], [a.c2]), partitions(p[0-2])
      is_index_back=false, is_global_index=false, 
      range_key([a.a1], [a.c1]), range(MIN,MIN ; MAX,MAX)always true
=============modify column auto_increment=============
drop table if exists t;
create table t(c1 int primary key, c2 vector(3), c3 char(10)) partition by range(c1) (partition p0 values less than (10), partition p1 values less than (20), partition p2 values less than maxvalue);
insert into t(c3,c2,c1) values('a',[0.12121,2.2323,2],1);
insert into t(c3,c2,c1) values('a',[0.12121,2.2323,2],2);
insert into t(c3,c2,c1) values('a',[0.12121,2.2323,2],11);
alter table t modify column c1 int auto_increment;
insert into t(c3,c2,c1) values('a',[0.12121,2.2323,2],default);
insert into t(c3,c2,c1) values('a',[0.12121,2.2323,2],21);
insert into t(c3,c2,c1) values('a',[0.12121,2.2323,2],default);
create vector index idx_1 on t(c2) with (distance=l2,type=hnsw);
insert into t partition(p0) values(3,[0.12121,2.2323,2],'a');
insert into t partition(p1) values(13,[0.12121,2.2323,2],'a');
insert into t partition(p2) values(23,[0.12121,2.2323,2],'a');
update t set c3='b' where c1=3;
update t set c3='c' where c1=13;
update t set c3='d' where c1=23;
delete from t where c1=3;
delete from t where c1=13;
delete from t where c1%2=1;
select a.c1,a.c2 from t as a inner join (select * from t where c1<10 order by l2_distance(c2, '[0.12121,0.1212,3]') approx limit 10) b on a.c1=b.c1;
c1	c2
2	[0.12121,2.2323,2]
explain select a.c1,a.c2 from t as a inner join (select * from t where c1<10 order by l2_distance(c2, '[0.12121,0.1212,3]') approx limit 10) b on a.c1=b.c1;
Query Plan
=========================================================================================
|ID|OPERATOR                                             |NAME    |EST.ROWS|EST.TIME(us)|
-----------------------------------------------------------------------------------------
|0 |PX COORDINATOR                                       |        |1       |0|
|1 |└─EXCHANGE OUT DISTR                                 |:EX10001|1       |0|
|2 |  └─HASH JOIN                                        |        |1       |0|
|3 |    ├─EXCHANGE IN DISTR                              |        |1       |0|
|4 |    │ └─EXCHANGE OUT DISTR (PKEY)                    |:EX10000|1       |0|
|5 |    │   └─SUBPLAN SCAN                               |b       |1       |0|
|6 |    │     └─TOP-N SORT                               |        |1       |0|
|7 |    │       └─VECTOR INDEX ADAPTIVE SCAN (PRE-FILTER)|t       |1       |0|
|8 |    └─PX PARTITION ITERATOR                          |        |3       |0|
|9 |      └─TABLE FULL SCAN                              |a       |3       |0|
=========================================================================================
Outputs & filters:
-------------------------------------
  0 - output([INTERNAL_FUNCTION(a.c1, a.c2)]), filter(nil), rowset=16
  1 - output([INTERNAL_FUNCTION(a.c1, a.c2)]), filter(nil), rowset=16
      dop=1
  2 - output([a.c1], [a.c2]), filter(nil), rowset=16
      equal_conds([a.c1 = b.c1]), other_conds(nil)
  3 - output([b.c1]), filter(nil), rowset=16
  4 - output([b.c1]), filter(nil), rowset=16
      (#keys=1, [b.c1]), is_single, dop=1
  5 - output([b.c1]), filter(nil), rowset=16
      access([b.c1])
  6 - output([t.c1], [t.c2], [t.c3]), filter(nil), rowset=16
      sort_keys([l2_distance(t.c2, cast('[0.12121,0.1212,3]', ARRAY(18, -1))), ASC]), topn(10)
  7 - output([t.c1], [t.c2], [t.c3], [l2_distance(t.c2, cast('[0.12121,0.1212,3]', ARRAY(18, -1)))]), filter([t.c1 < 10]), rowset=16
      access([t.c1], [t.c2], [t.c3]), partitions(p0)
      is_index_back=true, is_global_index=false, filter_before_indexback[false], 
      range_key([t.c1]), range(NULL ; 10)
  8 - output([a.c1], [a.c2]), filter(nil), rowset=16
      affinitize, force partition granule
  9 - output([a.c1], [a.c2]), filter(nil), rowset=16
      access([a.c1], [a.c2]), partitions(p[0-2])
      is_index_back=false, is_global_index=false, 
      range_key([a.c1]), range(MIN ; MAX)always true
modify column type
drop table if exists t;
create table t(c1 int primary key, c2 vector(3), c3 char(10)) partition by range(c1) (partition p0 values less than (10), partition p1 values less than (20), partition p2 values less than maxvalue);
insert into t(c3,c2,c1) values('a',[0.12121,2.2323,2],1);
insert into t(c3,c2,c1) values('a',[0.12121,2.2323,2],2);
insert into t(c3,c2,c1) values('a',[0.12121,2.2323,2],11);
alter table t modify c2 vector(4);
ERROR 22000: Invalid dimension for vector.
alter table t modify c3 char(20);
insert into t(c3,c2,c1) values('a',[0.12121,2.2323,2],12);
insert into t(c3,c2,c1) values('a',[0.12121,2.2323,2],21);
insert into t(c3,c2,c1) values('a',[0.12121,2.2323,2],22);
create vector index idx_1 on t(c2) with (distance=l2,type=hnsw);
insert into t partition(p0) values(3,[0.12121,2.2323,2],'a');
insert into t partition(p1) values(13,[0.12121,2.2323,2],'a');
insert into t partition(p2) values(23,[0.12121,2.2323,2],'a');
update t set c3='b' where c1=3;
update t set c3='c' where c1=13;
update t set c3='d' where c1=23;
delete from t where c1=3;
delete from t where c1=13;
delete from t where c1%2=1;
select a.c1,a.c2 from t as a inner join (select * from t where c1<10 order by l2_distance(c2, '[0.12121,0.1212,3]') approx limit 10) b on a.c1=b.c1;
c1	c2
2	[0.12121,2.2323,2]
explain select a.c1,a.c2 from t as a inner join (select * from t where c1<10 order by l2_distance(c2, '[0.12121,0.1212,3]') approx limit 10) b on a.c1=b.c1;
Query Plan
=========================================================================================
|ID|OPERATOR                                             |NAME    |EST.ROWS|EST.TIME(us)|
-----------------------------------------------------------------------------------------
|0 |PX COORDINATOR                                       |        |1       |0|
|1 |└─EXCHANGE OUT DISTR                                 |:EX10001|1       |0|
|2 |  └─HASH JOIN                                        |        |1       |0|
|3 |    ├─EXCHANGE IN DISTR                              |        |1       |0|
|4 |    │ └─EXCHANGE OUT DISTR (PKEY)                    |:EX10000|1       |0|
|5 |    │   └─SUBPLAN SCAN                               |b       |1       |0|
|6 |    │     └─TOP-N SORT                               |        |1       |0|
|7 |    │       └─VECTOR INDEX ADAPTIVE SCAN (PRE-FILTER)|t       |1       |0|
|8 |    └─PX PARTITION ITERATOR                          |        |3       |0|
|9 |      └─TABLE FULL SCAN                              |a       |3       |0|
=========================================================================================
Outputs & filters:
-------------------------------------
  0 - output([INTERNAL_FUNCTION(a.c1, a.c2)]), filter(nil), rowset=16
  1 - output([INTERNAL_FUNCTION(a.c1, a.c2)]), filter(nil), rowset=16
      dop=1
  2 - output([a.c1], [a.c2]), filter(nil), rowset=16
      equal_conds([a.c1 = b.c1]), other_conds(nil)
  3 - output([b.c1]), filter(nil), rowset=16
  4 - output([b.c1]), filter(nil), rowset=16
      (#keys=1, [b.c1]), is_single, dop=1
  5 - output([b.c1]), filter(nil), rowset=16
      access([b.c1])
  6 - output([t.c1], [t.c2], [t.c3]), filter(nil), rowset=16
      sort_keys([l2_distance(t.c2, cast('[0.12121,0.1212,3]', ARRAY(18, -1))), ASC]), topn(10)
  7 - output([t.c1], [t.c2], [t.c3], [l2_distance(t.c2, cast('[0.12121,0.1212,3]', ARRAY(18, -1)))]), filter([t.c1 < 10]), rowset=16
      access([t.c1], [t.c2], [t.c3]), partitions(p0)
      is_index_back=true, is_global_index=false, filter_before_indexback[false], 
      range_key([t.c1]), range(NULL ; 10)
  8 - output([a.c1], [a.c2]), filter(nil), rowset=16
      affinitize, force partition granule
  9 - output([a.c1], [a.c2]), filter(nil), rowset=16
      access([a.c1], [a.c2]), partitions(p[0-2])
      is_index_back=false, is_global_index=false, 
      range_key([a.c1]), range(MIN ; MAX)always true
=============modify column primary key=============
drop table if exists t;
create table t(c1 int, c2 vector(3), c3 char(10)) partition by range(c1) (partition p0 values less than (10), partition p1 values less than (20), partition p2 values less than maxvalue);
insert into t(c3,c2,c1) values('a',[0.12121,2.2323,2],1);
insert into t(c3,c2,c1) values('a',[0.12121,2.2323,2],2);
insert into t(c3,c2,c1) values('a',[0.12121,2.2323,2],11);
alter table t modify column c1 int primary key;
insert into t(c3,c2,c1) values('a',[0.12121,2.2323,2],12);
insert into t(c3,c2,c1) values('a',[0.12121,2.2323,2],21);
insert into t(c3,c2,c1) values('a',[0.12121,2.2323,2],22);
create vector index idx_1 on t(c2) with (distance=l2,type=hnsw);
insert into t partition(p0) values(3,[0.12121,2.2323,2],'a');
insert into t partition(p1) values(13,[0.12121,2.2323,2],'a');
insert into t partition(p2) values(23,[0.12121,2.2323,2],'a');
update t set c3='b' where c1=3;
update t set c3='c' where c1=13;
update t set c3='d' where c1=23;
delete from t where c1=3;
delete from t where c1=13;
delete from t where c1%2=1;
select a.c1,a.c2 from t as a inner join (select * from t where c1<10 order by l2_distance(c2, '[0.12121,0.1212,3]') approx limit 10) b on a.c1=b.c1;
c1	c2
2	[0.12121,2.2323,2]
explain select a.c1,a.c2 from t as a inner join (select * from t where c1<10 order by l2_distance(c2, '[0.12121,0.1212,3]') approx limit 10) b on a.c1=b.c1;
Query Plan
=========================================================================================
|ID|OPERATOR                                             |NAME    |EST.ROWS|EST.TIME(us)|
-----------------------------------------------------------------------------------------
|0 |PX COORDINATOR                                       |        |1       |0|
|1 |└─EXCHANGE OUT DISTR                                 |:EX10001|1       |0|
|2 |  └─HASH JOIN                                        |        |1       |0|
|3 |    ├─EXCHANGE IN DISTR                              |        |1       |0|
|4 |    │ └─EXCHANGE OUT DISTR (PKEY)                    |:EX10000|1       |0|
|5 |    │   └─SUBPLAN SCAN                               |b       |1       |0|
|6 |    │     └─TOP-N SORT                               |        |1       |0|
|7 |    │       └─VECTOR INDEX ADAPTIVE SCAN (PRE-FILTER)|t       |1       |0|
|8 |    └─PX PARTITION ITERATOR                          |        |3       |0|
|9 |      └─TABLE FULL SCAN                              |a       |3       |0|
=========================================================================================
Outputs & filters:
-------------------------------------
  0 - output([INTERNAL_FUNCTION(a.c1, a.c2)]), filter(nil), rowset=16
  1 - output([INTERNAL_FUNCTION(a.c1, a.c2)]), filter(nil), rowset=16
      dop=1
  2 - output([a.c1], [a.c2]), filter(nil), rowset=16
      equal_conds([a.c1 = b.c1]), other_conds(nil)
  3 - output([b.c1]), filter(nil), rowset=16
  4 - output([b.c1]), filter(nil), rowset=16
      (#keys=1, [b.c1]), is_single, dop=1
  5 - output([b.c1]), filter(nil), rowset=16
      access([b.c1])
  6 - output([t.c1], [t.c2], [t.c3]), filter(nil), rowset=16
      sort_keys([l2_distance(t.c2, cast('[0.12121,0.1212,3]', ARRAY(18, -1))), ASC]), topn(10)
  7 - output([t.c1], [t.c2], [t.c3], [l2_distance(t.c2, cast('[0.12121,0.1212,3]', ARRAY(18, -1)))]), filter([t.c1 < 10]), rowset=16
      access([t.c1], [t.c2], [t.c3]), partitions(p0)
      is_index_back=true, is_global_index=false, filter_before_indexback[false], 
      range_key([t.c1]), range(NULL ; 10)
  8 - output([a.c1], [a.c2]), filter(nil), rowset=16
      affinitize, force partition granule
  9 - output([a.c1], [a.c2]), filter(nil), rowset=16
      access([a.c1], [a.c2]), partitions(p[0-2])
      is_index_back=false, is_global_index=false, 
      range_key([a.c1]), range(MIN ; MAX)always true
=============add stored column=============
drop table if exists t;
create table t(c1 int, c2 vector(3), c3 char(10)) partition by range(c1) (partition p0 values less than (10), partition p1 values less than (20), partition p2 values less than maxvalue);
insert into t(c3,c2,c1) values('a',[0.12121,2.2323,2],1);
insert into t(c3,c2,c1) values('a',[0.12121,2.2323,2],2);
insert into t(c3,c2,c1) values('a',[0.12121,2.2323,2],11);
alter table t add column a1 vector(3) generated always as (c2 + [1,1,1]) stored;
insert into t(c3,c2,c1) values('a',[0.12121,2.2323,2],12);
insert into t(c3,c2,c1) values('a',[0.12121,2.2323,2],21);
insert into t(c3,c2,c1) values('a',[0.12121,2.2323,2],22);
alter table t add primary key(c1);
create vector index idx_1 on t(c2) with (distance=l2,type=hnsw);
insert into t partition(p0) values(3,[0.12121,2.2323,2],'a',default);
insert into t partition(p1) values(13,[0.12121,2.2323,2],'a',default);
insert into t partition(p2) values(23,[0.12121,2.2323,2],'a',default);
update t set c3='b' where c1=3;
update t set c3='c' where c1=13;
update t set c3='d' where c1=23;
delete from t where c1=3;
delete from t where c1=13;
delete from t where c1%2=1;
select a.c1,a.c2 from t as a inner join (select * from t where c1<10 order by l2_distance(c2, '[0.12121,0.1212,3]') approx limit 10) b on a.c1=b.c1;
c1	c2
2	[0.12121,2.2323,2]
explain select a.c1,a.c2 from t as a inner join (select * from t where c1<10 order by l2_distance(c2, '[0.12121,0.1212,3]') approx limit 10) b on a.c1=b.c1;
Query Plan
=========================================================================================
|ID|OPERATOR                                             |NAME    |EST.ROWS|EST.TIME(us)|
-----------------------------------------------------------------------------------------
|0 |PX COORDINATOR                                       |        |1       |0|
|1 |└─EXCHANGE OUT DISTR                                 |:EX10001|1       |0|
|2 |  └─HASH JOIN                                        |        |1       |0|
|3 |    ├─EXCHANGE IN DISTR                              |        |1       |0|
|4 |    │ └─EXCHANGE OUT DISTR (PKEY)                    |:EX10000|1       |0|
|5 |    │   └─SUBPLAN SCAN                               |b       |1       |0|
|6 |    │     └─TOP-N SORT                               |        |1       |0|
|7 |    │       └─VECTOR INDEX ADAPTIVE SCAN (PRE-FILTER)|t       |1       |0|
|8 |    └─PX PARTITION ITERATOR                          |        |3       |0|
|9 |      └─TABLE FULL SCAN                              |a       |3       |0|
=========================================================================================
Outputs & filters:
-------------------------------------
  0 - output([INTERNAL_FUNCTION(a.c1, a.c2)]), filter(nil), rowset=16
  1 - output([INTERNAL_FUNCTION(a.c1, a.c2)]), filter(nil), rowset=16
      dop=1
  2 - output([a.c1], [a.c2]), filter(nil), rowset=16
      equal_conds([a.c1 = b.c1]), other_conds(nil)
  3 - output([b.c1]), filter(nil), rowset=16
  4 - output([b.c1]), filter(nil), rowset=16
      (#keys=1, [b.c1]), is_single, dop=1
  5 - output([b.c1]), filter(nil), rowset=16
      access([b.c1])
  6 - output([t.c1], [t.c2], [t.c3], [t.a1]), filter(nil), rowset=16
      sort_keys([l2_distance(t.c2, cast('[0.12121,0.1212,3]', ARRAY(18, -1))), ASC]), topn(10)
  7 - output([t.c1], [t.c2], [t.a1], [t.c3], [l2_distance(t.c2, cast('[0.12121,0.1212,3]', ARRAY(18, -1)))]), filter([t.c1 < 10]), rowset=16
      access([t.c1], [t.c2], [t.a1], [t.c3]), partitions(p0)
      is_index_back=true, is_global_index=false, filter_before_indexback[false], 
      range_key([t.c1]), range(NULL ; 10)
  8 - output([a.c1], [a.c2]), filter(nil), rowset=16
      affinitize, force partition granule
  9 - output([a.c1], [a.c2]), filter(nil), rowset=16
      access([a.c1], [a.c2]), partitions(p[0-2])
      is_index_back=false, is_global_index=false, 
      range_key([a.c1]), range(MIN ; MAX)always true
=============drop stored column=============
drop table if exists t;
create table t(c1 int primary key, c2 vector(3), c3 char(10), a1 int as (l2_distance(c2, '[1,1,1]'))) partition by range(c1) (partition p0 values less than (10), partition p1 values less than (20), partition p2 values less than maxvalue);
insert into t(c3,c2,c1) values('a',[0.12121,2.2323,2],1);
insert into t(c3,c2,c1) values('a',[0.12121,2.2323,2],2);
insert into t(c3,c2,c1) values('a',[0.12121,2.2323,2],11);
insert into t(c3,c2,c1) values('a',[0.12121,2.2323,2],12);
insert into t(c3,c2,c1) values('a',[0.12121,2.2323,2],21);
insert into t(c3,c2,c1) values('a',[0.12121,2.2323,2],22);
create vector index idx_1 on t(c2) with (distance=l2,type=hnsw);
insert into t partition(p0) values(3,[0.12121,2.2323,2],'a',default);
insert into t partition(p1) values(13,[0.12121,2.2323,2],'a',default);
insert into t partition(p2) values(23,[0.12121,2.2323,2],'a',default);
update t set c3='b' where c1=3;
update t set c3='c' where c1=13;
update t set c3='d' where c1=23;
delete from t where c1=3;
delete from t where c1=13;
delete from t where c1%2=1;
select a.c1,a.c2 from t as a inner join (select * from t where c1<10 order by l2_distance(c2, '[0.12121,0.1212,3]') approx limit 10) b on a.c1=b.c1;
c1	c2
2	[0.12121,2.2323,2]
explain select a.c1,a.c2 from t as a inner join (select * from t where c1<10 order by l2_distance(c2, '[0.12121,0.1212,3]') approx limit 10) b on a.c1=b.c1;
Query Plan
=========================================================================================
|ID|OPERATOR                                             |NAME    |EST.ROWS|EST.TIME(us)|
-----------------------------------------------------------------------------------------
|0 |PX COORDINATOR                                       |        |1       |0|
|1 |└─EXCHANGE OUT DISTR                                 |:EX10001|1       |0|
|2 |  └─HASH JOIN                                        |        |1       |0|
|3 |    ├─EXCHANGE IN DISTR                              |        |1       |0|
|4 |    │ └─EXCHANGE OUT DISTR (PKEY)                    |:EX10000|1       |0|
|5 |    │   └─SUBPLAN SCAN                               |b       |1       |0|
|6 |    │     └─TOP-N SORT                               |        |1       |0|
|7 |    │       └─VECTOR INDEX ADAPTIVE SCAN (PRE-FILTER)|t       |1       |0|
|8 |    └─PX PARTITION ITERATOR                          |        |3       |0|
|9 |      └─TABLE FULL SCAN                              |a       |3       |0|
=========================================================================================
Outputs & filters:
-------------------------------------
  0 - output([INTERNAL_FUNCTION(a.c1, a.c2)]), filter(nil), rowset=16
  1 - output([INTERNAL_FUNCTION(a.c1, a.c2)]), filter(nil), rowset=16
      dop=1
  2 - output([a.c1], [a.c2]), filter(nil), rowset=16
      equal_conds([a.c1 = b.c1]), other_conds(nil)
  3 - output([b.c1]), filter(nil), rowset=16
  4 - output([b.c1]), filter(nil), rowset=16
      (#keys=1, [b.c1]), is_single, dop=1
  5 - output([b.c1]), filter(nil), rowset=16
      access([b.c1])
  6 - output([t.c1], [t.c2], [t.c3], [column_conv(INT,PS:(11,0),NULL,cast(l2_distance(t.c2, cast('[1,1,1]', ARRAY(18, -1))), INT(-1, 0)))]), filter(nil), rowset=16
      sort_keys([l2_distance(t.c2, cast('[0.12121,0.1212,3]', ARRAY(18, -1))), ASC]), topn(10)
  7 - output([t.c1], [t.c2], [t.c3], [column_conv(INT,PS:(11,0),NULL,cast(l2_distance(t.c2, cast('[1,1,1]', ARRAY(18, -1))), INT(-1, 0)))], [l2_distance(t.c2,
       cast('[0.12121,0.1212,3]', ARRAY(18, -1)))]), filter([t.c1 < 10]), rowset=16
      access([t.c1], [t.c2], [t.c3], [t.a1]), partitions(p0)
      is_index_back=true, is_global_index=false, filter_before_indexback[false], 
      range_key([t.c1]), range(NULL ; 10)
  8 - output([a.c1], [a.c2]), filter(nil), rowset=16
      affinitize, force partition granule
  9 - output([a.c1], [a.c2]), filter(nil), rowset=16
      access([a.c1], [a.c2]), partitions(p[0-2])
      is_index_back=false, is_global_index=false, 
      range_key([a.c1]), range(MIN ; MAX)always true
drop index idx_1 on t;
alter table t drop column a1;
=============multi column operation=============
drop table if exists t;
create table t(c1 int primary key, c2 vector(3), c3 char(10), a1 int as (l2_distance(c2, '[1,1,1]'))) partition by range(c1) (partition p0 values less than (10), partition p1 values less than (20), partition p2 values less than maxvalue);
insert into t(c3,c2,c1) values('a',[0.12121,2.2323,2],1);
insert into t(c3,c2,c1) values('a',[0.12121,2.2323,2],2);
insert into t(c3,c2,c1) values('a',[0.12121,2.2323,2],11);
alter table t modify column c3 char(20),
add column a2 int as (c1 % 2),
drop column a1;
insert into t(c3,c2,c1) values('a',[0.12121,2.2323,2],12);
insert into t(c3,c2,c1) values('a',[0.12121,2.2323,2],21);
insert into t(c3,c2,c1) values('a',[0.12121,2.2323,2],22);
create vector index idx_1 on t(c2) with (distance=l2,type=hnsw);
insert into t partition(p0) values(3,[0.12121,2.2323,2],'a',default);
insert into t partition(p1) values(13,[0.12121,2.2323,2],'a',default);
insert into t partition(p2) values(23,[0.12121,2.2323,2],'a',default);
update t set c3='b' where c1=3;
update t set c3='c' where c1=13;
update t set c3='d' where c1=23;
delete from t where c1=3;
delete from t where c1=13;
delete from t where c1%2=1;
select a.c1,a.c2 from t as a inner join (select * from t where c1<10 order by l2_distance(c2, '[0.12121,0.1212,3]') approx limit 10) b on a.c1=b.c1;
c1	c2
2	[0.12121,2.2323,2]
explain select a.c1,a.c2 from t as a inner join (select * from t where c1<10 order by l2_distance(c2, '[0.12121,0.1212,3]') approx limit 10) b on a.c1=b.c1;
Query Plan
=========================================================================================
|ID|OPERATOR                                             |NAME    |EST.ROWS|EST.TIME(us)|
-----------------------------------------------------------------------------------------
|0 |PX COORDINATOR                                       |        |1       |0|
|1 |└─EXCHANGE OUT DISTR                                 |:EX10001|1       |0|
|2 |  └─HASH JOIN                                        |        |1       |0|
|3 |    ├─EXCHANGE IN DISTR                              |        |1       |0|
|4 |    │ └─EXCHANGE OUT DISTR (PKEY)                    |:EX10000|1       |0|
|5 |    │   └─SUBPLAN SCAN                               |b       |1       |0|
|6 |    │     └─TOP-N SORT                               |        |1       |0|
|7 |    │       └─VECTOR INDEX ADAPTIVE SCAN (PRE-FILTER)|t       |1       |0|
|8 |    └─PX PARTITION ITERATOR                          |        |3       |0|
|9 |      └─TABLE FULL SCAN                              |a       |3       |0|
=========================================================================================
Outputs & filters:
-------------------------------------
  0 - output([INTERNAL_FUNCTION(a.c1, a.c2)]), filter(nil), rowset=16
  1 - output([INTERNAL_FUNCTION(a.c1, a.c2)]), filter(nil), rowset=16
      dop=1
  2 - output([a.c1], [a.c2]), filter(nil), rowset=16
      equal_conds([a.c1 = b.c1]), other_conds(nil)
  3 - output([b.c1]), filter(nil), rowset=16
  4 - output([b.c1]), filter(nil), rowset=16
      (#keys=1, [b.c1]), is_single, dop=1
  5 - output([b.c1]), filter(nil), rowset=16
      access([b.c1])
  6 - output([t.c1], [t.c2], [t.c3], [column_conv(INT,PS:(11,0),NULL,cast(t.c1 % 2, INT(-1, 0)))]), filter(nil), rowset=16
      sort_keys([l2_distance(t.c2, cast('[0.12121,0.1212,3]', ARRAY(18, -1))), ASC]), topn(10)
  7 - output([t.c1], [t.c2], [t.c3], [column_conv(INT,PS:(11,0),NULL,cast(t.c1 % 2, INT(-1, 0)))], [l2_distance(t.c2, cast('[0.12121,0.1212,3]', ARRAY(18,
       -1)))]), filter([t.c1 < 10]), rowset=16
      access([t.c1], [t.c2], [t.c3], [t.a2]), partitions(p0)
      is_index_back=true, is_global_index=false, filter_before_indexback[false], 
      range_key([t.c1]), range(NULL ; 10)
  8 - output([a.c1], [a.c2]), filter(nil), rowset=16
      affinitize, force partition granule
  9 - output([a.c1], [a.c2]), filter(nil), rowset=16
      access([a.c1], [a.c2]), partitions(p[0-2])
      is_index_back=false, is_global_index=false, 
      range_key([a.c1]), range(MIN ; MAX)always true
truncate table t;
=============convert to character=============
drop table if exists t;
create table t(c1 int primary key, c2 vector(3), c3 char(10), a1 int as (l2_distance(c2, '[1,1,1]'))) partition by range(c1) (partition p0 values less than (10), partition p1 values less than (20), partition p2 values less than maxvalue);
insert into t(c3,c2,c1) values('a',[0.12121,2.2323,2],1);
insert into t(c3,c2,c1) values('a',[0.12121,2.2323,2],2);
insert into t(c3,c2,c1) values('a',[0.12121,2.2323,2],11);
alter table t convert to character set gbk;
insert into t(c3,c2,c1) values('a',[0.12121,2.2323,2],12);
insert into t(c3,c2,c1) values('a',[0.12121,2.2323,2],21);
insert into t(c3,c2,c1) values('a',[0.12121,2.2323,2],22);
create vector index idx_1 on t(c2) with (distance=l2,type=hnsw);
insert into t partition(p0) values(3,[0.12121,2.2323,2],'a',default);
insert into t partition(p1) values(13,[0.12121,2.2323,2],'a',default);
insert into t partition(p2) values(23,[0.12121,2.2323,2],'a',default);
update t set c3='b' where c1=3;
update t set c3='c' where c1=13;
update t set c3='d' where c1=23;
delete from t where c1=3;
delete from t where c1=13;
delete from t where c1%2=1;
select a.c1,a.c2 from t as a inner join (select * from t where c1<10 order by l2_distance(c2, '[0.12121,0.1212,3]') approx limit 10) b on a.c1=b.c1;
c1	c2
2	[0.12121,2.2323,2]
explain select a.c1,a.c2 from t as a inner join (select * from t where c1<10 order by l2_distance(c2, '[0.12121,0.1212,3]') approx limit 10) b on a.c1=b.c1;
Query Plan
=========================================================================================
|ID|OPERATOR                                             |NAME    |EST.ROWS|EST.TIME(us)|
-----------------------------------------------------------------------------------------
|0 |PX COORDINATOR                                       |        |1       |0|
|1 |└─EXCHANGE OUT DISTR                                 |:EX10001|1       |0|
|2 |  └─HASH JOIN                                        |        |1       |0|
|3 |    ├─EXCHANGE IN DISTR                              |        |1       |0|
|4 |    │ └─EXCHANGE OUT DISTR (PKEY)                    |:EX10000|1       |0|
|5 |    │   └─SUBPLAN SCAN                               |b       |1       |0|
|6 |    │     └─TOP-N SORT                               |        |1       |0|
|7 |    │       └─VECTOR INDEX ADAPTIVE SCAN (PRE-FILTER)|t       |1       |0|
|8 |    └─PX PARTITION ITERATOR                          |        |3       |0|
|9 |      └─TABLE FULL SCAN                              |a       |3       |0|
=========================================================================================
Outputs & filters:
-------------------------------------
  0 - output([INTERNAL_FUNCTION(a.c1, a.c2)]), filter(nil), rowset=16
  1 - output([INTERNAL_FUNCTION(a.c1, a.c2)]), filter(nil), rowset=16
      dop=1
  2 - output([a.c1], [a.c2]), filter(nil), rowset=16
      equal_conds([a.c1 = b.c1]), other_conds(nil)
  3 - output([b.c1]), filter(nil), rowset=16
  4 - output([b.c1]), filter(nil), rowset=16
      (#keys=1, [b.c1]), is_single, dop=1
  5 - output([b.c1]), filter(nil), rowset=16
      access([b.c1])
  6 - output([t.c1], [t.c2], [t.c3], [column_conv(INT,PS:(11,0),NULL,cast(l2_distance(t.c2, cast('[1,1,1]', ARRAY(18, -1))), INT(-1, 0)))]), filter(nil), rowset=16
      sort_keys([l2_distance(t.c2, cast('[0.12121,0.1212,3]', ARRAY(18, -1))), ASC]), topn(10)
  7 - output([t.c1], [t.c2], [t.c3], [column_conv(INT,PS:(11,0),NULL,cast(l2_distance(t.c2, cast('[1,1,1]', ARRAY(18, -1))), INT(-1, 0)))], [l2_distance(t.c2,
       cast('[0.12121,0.1212,3]', ARRAY(18, -1)))]), filter([t.c1 < 10]), rowset=16
      access([t.c1], [t.c2], [t.c3], [t.a1]), partitions(p0)
      is_index_back=true, is_global_index=false, filter_before_indexback[false], 
      range_key([t.c1]), range(NULL ; 10)
  8 - output([a.c1], [a.c2]), filter(nil), rowset=16
      affinitize, force partition granule
  9 - output([a.c1], [a.c2]), filter(nil), rowset=16
      access([a.c1], [a.c2]), partitions(p[0-2])
      is_index_back=false, is_global_index=false, 
      range_key([a.c1]), range(MIN ; MAX)always true
alter table t drop partition p1;
alter table t truncate partition p0;
=============partition by=============
drop table if exists t;
create table t(c1 int primary key, c2 vector(3), c3 char(10), a1 int as (l2_distance(c2, '[1,1,1]'))) partition by range(c1) (partition p0 values less than (10), partition p1 values less than (20), partition p2 values less than maxvalue);
insert into t(c3,c2,c1) values('a',[0.12121,2.2323,2],1);
insert into t(c3,c2,c1) values('a',[0.12121,2.2323,2],2);
insert into t(c3,c2,c1) values('a',[0.12121,2.2323,2],11);
alter table t partition by hash(c1) partitions 5;
insert into t(c3,c2,c1) values('a',[0.12121,2.2323,2],12);
insert into t(c3,c2,c1) values('a',[0.12121,2.2323,2],21);
insert into t(c3,c2,c1) values('a',[0.12121,2.2323,2],22);
create vector index idx_1 on t(c2) with (distance=l2,type=hnsw);
insert into t values(3,[0.12121,2.2323,2],'a',default);
insert into t values(13,[0.12121,2.2323,2],'a',default);
insert into t values(23,[0.12121,2.2323,2],'a',default);
update t set c3='b' where c1=3;
update t set c3='c' where c1=13;
update t set c3='d' where c1=23;
delete from t where c1=3;
delete from t where c1=13;
delete from t where c1%2=1;
select a.c1,a.c2 from t as a inner join (select * from t where c1<10 order by l2_distance(c2, '[0.12121,0.1212,3]') approx limit 10) b on a.c1=b.c1;
c1	c2
2	[0.12121,2.2323,2]
explain select a.c1,a.c2 from t as a inner join (select * from t where c1<10 order by l2_distance(c2, '[0.12121,0.1212,3]') approx limit 10) b on a.c1=b.c1;
Query Plan
=================================================================================================
|ID|OPERATOR                                                     |NAME    |EST.ROWS|EST.TIME(us)|
-------------------------------------------------------------------------------------------------
|0 |PX COORDINATOR                                               |        |1       |0|
|1 |└─EXCHANGE OUT DISTR                                         |:EX10002|1       |0|
|2 |  └─HASH JOIN                                                |        |1       |0|
|3 |    ├─EXCHANGE IN DISTR                                      |        |1       |0|
|4 |    │ └─EXCHANGE OUT DISTR (PKEY)                            |:EX10001|1       |0|
|5 |    │   └─SUBPLAN SCAN                                       |b       |1       |0|
|6 |    │     └─LIMIT                                            |        |1       |0|
|7 |    │       └─EXCHANGE IN MERGE SORT DISTR                   |        |1       |0|
|8 |    │         └─EXCHANGE OUT DISTR                           |:EX10000|1       |0|
|9 |    │           └─TOP-N SORT                                 |        |1       |0|
|10|    │             └─PX PARTITION ITERATOR                    |        |1       |0|
|11|    │               └─VECTOR INDEX ADAPTIVE SCAN (PRE-FILTER)|t       |1       |0|
|12|    └─PX PARTITION ITERATOR                                  |        |3       |0|
|13|      └─TABLE FULL SCAN                                      |a       |3       |0|
=================================================================================================
Outputs & filters:
-------------------------------------
  0 - output([INTERNAL_FUNCTION(a.c1, a.c2)]), filter(nil), rowset=16
  1 - output([INTERNAL_FUNCTION(a.c1, a.c2)]), filter(nil), rowset=16
      dop=1
  2 - output([a.c1], [a.c2]), filter(nil), rowset=16
      equal_conds([a.c1 = b.c1]), other_conds(nil)
  3 - output([b.c1]), filter(nil), rowset=16
  4 - output([b.c1]), filter(nil), rowset=16
      (#keys=1, [b.c1]), is_single, dop=1
  5 - output([b.c1]), filter(nil), rowset=16
      access([b.c1])
  6 - output([t.c1], [t.c2], [t.c3], [column_conv(INT,PS:(11,0),NULL,cast(l2_distance(t.c2, cast('[1,1,1]', ARRAY(18, -1))), INT(-1, 0)))]), filter(nil), rowset=16
      limit(10), offset(nil)
  7 - output([t.c1], [t.c2], [t.c3], [column_conv(INT,PS:(11,0),NULL,cast(l2_distance(t.c2, cast('[1,1,1]', ARRAY(18, -1))), INT(-1, 0)))]), filter(nil), rowset=16
      sort_keys([l2_distance(t.c2, cast('[0.12121,0.1212,3]', ARRAY(18, -1))), ASC])
  8 - output([t.c1], [t.c2], [t.c3], [column_conv(INT,PS:(11,0),NULL,cast(l2_distance(t.c2, cast('[1,1,1]', ARRAY(18, -1))), INT(-1, 0)))], [l2_distance(t.c2,
       cast('[0.12121,0.1212,3]', ARRAY(18, -1)))]), filter(nil), rowset=16
      dop=1
  9 - output([t.c1], [t.c2], [t.c3], [column_conv(INT,PS:(11,0),NULL,cast(l2_distance(t.c2, cast('[1,1,1]', ARRAY(18, -1))), INT(-1, 0)))], [l2_distance(t.c2,
       cast('[0.12121,0.1212,3]', ARRAY(18, -1)))]), filter(nil), rowset=16
      sort_keys([l2_distance(t.c2, cast('[0.12121,0.1212,3]', ARRAY(18, -1))), ASC]), topn(10)
 10 - output([t.c1], [t.c2], [t.c3], [column_conv(INT,PS:(11,0),NULL,cast(l2_distance(t.c2, cast('[1,1,1]', ARRAY(18, -1))), INT(-1, 0)))], [l2_distance(t.c2,
       cast('[0.12121,0.1212,3]', ARRAY(18, -1)))]), filter(nil), rowset=16
      force partition granule
 11 - output([t.c1], [t.c2], [t.c3], [column_conv(INT,PS:(11,0),NULL,cast(l2_distance(t.c2, cast('[1,1,1]', ARRAY(18, -1))), INT(-1, 0)))], [l2_distance(t.c2,
       cast('[0.12121,0.1212,3]', ARRAY(18, -1)))]), filter([t.c1 < 10]), rowset=16
      access([t.c1], [t.c2], [t.c3], [t.a1]), partitions(p[0-4])
      is_index_back=true, is_global_index=false, filter_before_indexback[false], 
      range_key([t.c1]), range(NULL ; 10)
 12 - output([a.c1], [a.c2]), filter(nil), rowset=16
      affinitize, force partition granule
 13 - output([a.c1], [a.c2]), filter(nil), rowset=16
      access([a.c1], [a.c2]), partitions(p[0-4])
      is_index_back=false, is_global_index=false, 
      range_key([a.c1]), range(MIN ; MAX)always true
