======================
=  vector index dml  =
======================
insert
drop table if exists t;
select sleep(5);
sleep(5)
0
alter system ob_vector_memory_limit_percentage=30;
select sleep(5);
sleep(5)
0
create table t(c1 vector(3), c2 array(float), c3 int auto_increment, primary key(c3), vector index idx_1(c1) with (distance=l2, type=hnsw));
drop procedure if exists pl1;
create procedure pl1(ll int)
begin
set @x=1;
set @y=1;
repeat
insert into t values (concat('[',1,',',1,',',@x,']'), concat('[',1,',',1,',',@y,']'), default);
set @x=@x+1;
set @y=@y+1;
until @x>ll end repeat;
end //
call pl1(100);
create vector index idx_2 on t(c2) with (distance=l2, type=hnsw);
ERROR 0A000: Not supported feature or function
SELECT
CASE
WHEN 8 !=
(SELECT COUNT(*)
FROM (
SELECT *
FROM t
ORDER BY l2_distance(c1, [1,8,30]) APPROXIMATE
LIMIT 8) AS tmp1
JOIN
(SELECT *
FROM t
ORDER BY l2_distance(c1, [1,8,30])
LIMIT 8) AS tmp2
ON tmp1.c3 = tmp2.c3)
THEN '有问题'
        ELSE '没问题'
    END AS result;
result
有问题
insert into t values ([1,1,101],[1,1,101],101),('[1,1,102]',[1,1,102],102),('[1,1,103]','[1,1,103]',103);
select * from t;
c1	c2	c3
[1,1,1]	[1,1,1]	1
[1,1,2]	[1,1,2]	2
[1,1,3]	[1,1,3]	3
[1,1,4]	[1,1,4]	4
[1,1,5]	[1,1,5]	5
[1,1,6]	[1,1,6]	6
[1,1,7]	[1,1,7]	7
[1,1,8]	[1,1,8]	8
[1,1,9]	[1,1,9]	9
[1,1,10]	[1,1,10]	10
[1,1,11]	[1,1,11]	11
[1,1,12]	[1,1,12]	12
[1,1,13]	[1,1,13]	13
[1,1,14]	[1,1,14]	14
[1,1,15]	[1,1,15]	15
[1,1,16]	[1,1,16]	16
[1,1,17]	[1,1,17]	17
[1,1,18]	[1,1,18]	18
[1,1,19]	[1,1,19]	19
[1,1,20]	[1,1,20]	20
[1,1,21]	[1,1,21]	21
[1,1,22]	[1,1,22]	22
[1,1,23]	[1,1,23]	23
[1,1,24]	[1,1,24]	24
[1,1,25]	[1,1,25]	25
[1,1,26]	[1,1,26]	26
[1,1,27]	[1,1,27]	27
[1,1,28]	[1,1,28]	28
[1,1,29]	[1,1,29]	29
[1,1,30]	[1,1,30]	30
[1,1,31]	[1,1,31]	31
[1,1,32]	[1,1,32]	32
[1,1,33]	[1,1,33]	33
[1,1,34]	[1,1,34]	34
[1,1,35]	[1,1,35]	35
[1,1,36]	[1,1,36]	36
[1,1,37]	[1,1,37]	37
[1,1,38]	[1,1,38]	38
[1,1,39]	[1,1,39]	39
[1,1,40]	[1,1,40]	40
[1,1,41]	[1,1,41]	41
[1,1,42]	[1,1,42]	42
[1,1,43]	[1,1,43]	43
[1,1,44]	[1,1,44]	44
[1,1,45]	[1,1,45]	45
[1,1,46]	[1,1,46]	46
[1,1,47]	[1,1,47]	47
[1,1,48]	[1,1,48]	48
[1,1,49]	[1,1,49]	49
[1,1,50]	[1,1,50]	50
[1,1,51]	[1,1,51]	51
[1,1,52]	[1,1,52]	52
[1,1,53]	[1,1,53]	53
[1,1,54]	[1,1,54]	54
[1,1,55]	[1,1,55]	55
[1,1,56]	[1,1,56]	56
[1,1,57]	[1,1,57]	57
[1,1,58]	[1,1,58]	58
[1,1,59]	[1,1,59]	59
[1,1,60]	[1,1,60]	60
[1,1,61]	[1,1,61]	61
[1,1,62]	[1,1,62]	62
[1,1,63]	[1,1,63]	63
[1,1,64]	[1,1,64]	64
[1,1,65]	[1,1,65]	65
[1,1,66]	[1,1,66]	66
[1,1,67]	[1,1,67]	67
[1,1,68]	[1,1,68]	68
[1,1,69]	[1,1,69]	69
[1,1,70]	[1,1,70]	70
[1,1,71]	[1,1,71]	71
[1,1,72]	[1,1,72]	72
[1,1,73]	[1,1,73]	73
[1,1,74]	[1,1,74]	74
[1,1,75]	[1,1,75]	75
[1,1,76]	[1,1,76]	76
[1,1,77]	[1,1,77]	77
[1,1,78]	[1,1,78]	78
[1,1,79]	[1,1,79]	79
[1,1,80]	[1,1,80]	80
[1,1,81]	[1,1,81]	81
[1,1,82]	[1,1,82]	82
[1,1,83]	[1,1,83]	83
[1,1,84]	[1,1,84]	84
[1,1,85]	[1,1,85]	85
[1,1,86]	[1,1,86]	86
[1,1,87]	[1,1,87]	87
[1,1,88]	[1,1,88]	88
[1,1,89]	[1,1,89]	89
[1,1,90]	[1,1,90]	90
[1,1,91]	[1,1,91]	91
[1,1,92]	[1,1,92]	92
[1,1,93]	[1,1,93]	93
[1,1,94]	[1,1,94]	94
[1,1,95]	[1,1,95]	95
[1,1,96]	[1,1,96]	96
[1,1,97]	[1,1,97]	97
[1,1,98]	[1,1,98]	98
[1,1,99]	[1,1,99]	99
[1,1,100]	[1,1,100]	100
[1,1,101]	[1,1,101]	101
[1,1,102]	[1,1,102]	102
[1,1,103]	[1,1,103]	103
insert ignore
insert ignore into t values ([1,1,101],[1,1,101],104),([1,1,106],[1,1,106],103),([1,1,105],[1,1,105],105);
select * from t;
c1	c2	c3
[1,1,1]	[1,1,1]	1
[1,1,2]	[1,1,2]	2
[1,1,3]	[1,1,3]	3
[1,1,4]	[1,1,4]	4
[1,1,5]	[1,1,5]	5
[1,1,6]	[1,1,6]	6
[1,1,7]	[1,1,7]	7
[1,1,8]	[1,1,8]	8
[1,1,9]	[1,1,9]	9
[1,1,10]	[1,1,10]	10
[1,1,11]	[1,1,11]	11
[1,1,12]	[1,1,12]	12
[1,1,13]	[1,1,13]	13
[1,1,14]	[1,1,14]	14
[1,1,15]	[1,1,15]	15
[1,1,16]	[1,1,16]	16
[1,1,17]	[1,1,17]	17
[1,1,18]	[1,1,18]	18
[1,1,19]	[1,1,19]	19
[1,1,20]	[1,1,20]	20
[1,1,21]	[1,1,21]	21
[1,1,22]	[1,1,22]	22
[1,1,23]	[1,1,23]	23
[1,1,24]	[1,1,24]	24
[1,1,25]	[1,1,25]	25
[1,1,26]	[1,1,26]	26
[1,1,27]	[1,1,27]	27
[1,1,28]	[1,1,28]	28
[1,1,29]	[1,1,29]	29
[1,1,30]	[1,1,30]	30
[1,1,31]	[1,1,31]	31
[1,1,32]	[1,1,32]	32
[1,1,33]	[1,1,33]	33
[1,1,34]	[1,1,34]	34
[1,1,35]	[1,1,35]	35
[1,1,36]	[1,1,36]	36
[1,1,37]	[1,1,37]	37
[1,1,38]	[1,1,38]	38
[1,1,39]	[1,1,39]	39
[1,1,40]	[1,1,40]	40
[1,1,41]	[1,1,41]	41
[1,1,42]	[1,1,42]	42
[1,1,43]	[1,1,43]	43
[1,1,44]	[1,1,44]	44
[1,1,45]	[1,1,45]	45
[1,1,46]	[1,1,46]	46
[1,1,47]	[1,1,47]	47
[1,1,48]	[1,1,48]	48
[1,1,49]	[1,1,49]	49
[1,1,50]	[1,1,50]	50
[1,1,51]	[1,1,51]	51
[1,1,52]	[1,1,52]	52
[1,1,53]	[1,1,53]	53
[1,1,54]	[1,1,54]	54
[1,1,55]	[1,1,55]	55
[1,1,56]	[1,1,56]	56
[1,1,57]	[1,1,57]	57
[1,1,58]	[1,1,58]	58
[1,1,59]	[1,1,59]	59
[1,1,60]	[1,1,60]	60
[1,1,61]	[1,1,61]	61
[1,1,62]	[1,1,62]	62
[1,1,63]	[1,1,63]	63
[1,1,64]	[1,1,64]	64
[1,1,65]	[1,1,65]	65
[1,1,66]	[1,1,66]	66
[1,1,67]	[1,1,67]	67
[1,1,68]	[1,1,68]	68
[1,1,69]	[1,1,69]	69
[1,1,70]	[1,1,70]	70
[1,1,71]	[1,1,71]	71
[1,1,72]	[1,1,72]	72
[1,1,73]	[1,1,73]	73
[1,1,74]	[1,1,74]	74
[1,1,75]	[1,1,75]	75
[1,1,76]	[1,1,76]	76
[1,1,77]	[1,1,77]	77
[1,1,78]	[1,1,78]	78
[1,1,79]	[1,1,79]	79
[1,1,80]	[1,1,80]	80
[1,1,81]	[1,1,81]	81
[1,1,82]	[1,1,82]	82
[1,1,83]	[1,1,83]	83
[1,1,84]	[1,1,84]	84
[1,1,85]	[1,1,85]	85
[1,1,86]	[1,1,86]	86
[1,1,87]	[1,1,87]	87
[1,1,88]	[1,1,88]	88
[1,1,89]	[1,1,89]	89
[1,1,90]	[1,1,90]	90
[1,1,91]	[1,1,91]	91
[1,1,92]	[1,1,92]	92
[1,1,93]	[1,1,93]	93
[1,1,94]	[1,1,94]	94
[1,1,95]	[1,1,95]	95
[1,1,96]	[1,1,96]	96
[1,1,97]	[1,1,97]	97
[1,1,98]	[1,1,98]	98
[1,1,99]	[1,1,99]	99
[1,1,100]	[1,1,100]	100
[1,1,101]	[1,1,101]	101
[1,1,102]	[1,1,102]	102
[1,1,103]	[1,1,103]	103
[1,1,101]	[1,1,101]	104
[1,1,105]	[1,1,105]	105
set ob_enable_index_direct_select=1;
count(*)
105
count(*)
0
count(*)
0
call dbms_vector.refresh_index('idx_1', 't');
call dbms_vector.refresh_index('idx_1', 't', 'c1', 1, 'FAST');
truncate t;
insert into t values ([1,1,101],[1,1,101],101),('[1,1,102]',[1,1,102],102),('[1,1,103]','[1,1,103]',103);
call pl1(100);
count(*)
103
count(*)
0
count(*)
0
call dbms_vector.rebuild_index('idx_1', 't', 'c1');
count(*)
0
count(*)
0
count(*)
1
on duplicate key update
truncate t;
insert into t values ([1,1,1],[1,1,1],1),([2,2,2],[2,2,2],2),([3,3,3],[3,3,3],3);
insert into t values ([4,4,4],[4,4,4],1) on duplicate key update c3=4;
select * from t;
c1	c2	c3
[2,2,2]	[2,2,2]	2
[3,3,3]	[3,3,3]	3
[1,1,1]	[1,1,1]	4
insert into t values ([4,4,4],[4,4,4],4) on duplicate key update c1=[4,4,4], c2=[4,4,4];
select * from t;
c1	c2	c3
[2,2,2]	[2,2,2]	2
[3,3,3]	[3,3,3]	3
[4,4,4]	[4,4,4]	4
insert into t values ([5,5,5],[5,5,5],4), ([6,6,6],[6,6,6],4) on duplicate key update c3=5;
insert partition
drop table if exists t;
create table t(c1 vector(3), c2 array(float), c3 int auto_increment, c4 timestamp, primary key(c3, c4), vector index idx_1(c1) with (distance=l2, type=hnsw)) partition by range(unix_timestamp(c4)) (partition p0 values less than (unix_timestamp('2010-01-01')), partition p1 values less than(unix_timestamp('2020-01-01')));
drop procedure if exists pl1;
create procedure pl1(ll int)
begin
set @x=1;
set @y=1;
repeat
set @y=floor(2000 + rand() * 20);
set @m=floor(rand() * 12) + 1;
set @n=floor(rand() * 28) + 1;
insert into t values (concat('[',1,',',1,',',@x,']'), concat('[',1,',',1,',',@y,']'), default, concat(@y,'-', @m,'-', @n));
set @x=@x+1;
set @y=@y+1;
until @x>ll end repeat;
end //
call pl1(100);
insert into t partition(p1) values ('[1,1,101]', [1,1,2014], default, '2014-09-17'), ('[1,1,101]', [1,1,2014], default, '2014-09-17');
call dbms_vector.refresh_index('idx_1', 't', 'c1', 1, 'FAST');
count(*)
0
count(*)
102
call dbms_vector.rebuild_index('idx_1', 't', 'c1');
count(*)
0
count(*)
0
direct()
drop table if exists t;
drop table if exists t1;
drop table if exists t2;
create table t(c1 vector(3), c2 array(float), c3 int auto_increment, c4 timestamp, primary key(c3, c4), vector index idx_1(c1) with (distance=l2, type=hnsw)) partition by range(unix_timestamp(c4)) (partition p0 values less than (unix_timestamp('2010-01-01')), partition p1 values less than(unix_timestamp('2020-01-01')));
create table t1(c1 vector(3), c2 array(float), c3 int auto_increment, c4 timestamp, primary key(c3, c4), vector index idx_1(c1) with (distance=l2, type=hnsw)) partition by range(unix_timestamp(c4)) (partition p0 values less than (unix_timestamp('2010-01-01')), partition p1 values less than(unix_timestamp('2020-01-01')));
create table  t2(c1 vector(3), c2 array(float), c3 int auto_increment, c4 timestamp, primary key(c3, c4), vector index idx_1(c1) with (distance=l2, type=hnsw));
insert into t1 values('[1,1,101]', [1,1,2014], default, '2014-10-17'), ('[1,1,101]', [1,1,2014], default, '2014-11-17');
insert into t2 values('[1,1,101]', [1,1,2014], default, '2014-09-17'), ('[1,1,101]', [1,1,2014], default, '2014-09-17');
alter table t1 modify c3 int;
explain extended insert /*+ direct(true, 100, 'full') enable_parallel_dml parallel(16)*/ into t1 select * from t;
ERROR 0A000: direct-load does not support table has generated column
insert /*+ direct(true, 100, 'full') enable_parallel_dml parallel(16)*/ into t1 select * from t;
ERROR 0A000: direct-load does not support table has generated column
drop index idx_1 on t1;
insert /*+ direct(true, 100, 'full') enable_parallel_dml parallel(16)*/ into t1 select * from t;
select count(*) from t join t1 on t.c1=t1.c1 and t.c2=t1.c2 and t.c3=t1.c3 and t.c4=t1.c4;
count(*)
0
explain extended insert /*+ direct(true, 10, 'inc') enable_parallel_dml parallel(2)*/ into t1 select * from t2;
Query Plan
=================================================================================
|ID|OPERATOR                              |NAME           |EST.ROWS|EST.TIME(us)|
---------------------------------------------------------------------------------
|0 |PX COORDINATOR                        |               |2       |0|
|1 |└─EXCHANGE OUT DISTR                  |:EX10001       |2       |0|
|2 |  └─INSERT                            |               |2       |0|
|3 |    └─EXCHANGE IN DISTR               |               |2       |0|
|4 |      └─EXCHANGE OUT DISTR (PKEY HASH)|:EX10000       |2       |0|
|5 |        └─SUBPLAN SCAN                |ANONYMOUS_VIEW1|2       |0|
|6 |          └─PX BLOCK ITERATOR         |               |2       |0|
|7 |            └─TABLE FULL SCAN         |t2             |2       |0|
=================================================================================
Outputs & filters:
-------------------------------------
  0 - output(nil), filter(nil), rowset=16
  1 - output(nil), filter(nil), rowset=16
      dop=2
  2 - output(nil), filter(nil), rowset=16
      columns([{t1: ({t1: (t1.c3(), t1.c4(), t1.c1(), t1.c2())})}]), partitions(p[0-1]), 
      column_values([column_conv(INT,PS:(11,0),NOT NULL,ANONYMOUS_VIEW1.c3())()], [column_conv(TIMESTAMP,PS:(19,0),NOT NULL,
      timestamp_nvl(ANONYMOUS_VIEW1.c4(), cast(current_timestamp()(), TIMESTAMP(19, 0))())())()],
       [column_conv(ARRAY,PS:(-1,-1),NULL,ANONYMOUS_VIEW1.c1())()], [column_conv(ARRAY,PS:(-1,-1),NULL,ANONYMOUS_VIEW1.c2())()])
  3 - output([PARTITION_ID()], [column_conv(INT,PS:(11,0),NOT NULL,ANONYMOUS_VIEW1.c3())()], [column_conv(TIMESTAMP,
      PS:(19,0),NOT NULL,timestamp_nvl(ANONYMOUS_VIEW1.c4(), cast(current_timestamp()(), TIMESTAMP(19, 0))())())()],
       [ANONYMOUS_VIEW1.c1()], [ANONYMOUS_VIEW1.c2()]), filter(nil), rowset=16
  4 - output([PARTITION_ID()], [column_conv(INT,PS:(11,0),NOT NULL,ANONYMOUS_VIEW1.c3())()], [column_conv(TIMESTAMP,
      PS:(19,0),NOT NULL,timestamp_nvl(ANONYMOUS_VIEW1.c4(), cast(current_timestamp()(), TIMESTAMP(19, 0))())())()],
       [ANONYMOUS_VIEW1.c1()], [ANONYMOUS_VIEW1.c2()]), filter(nil), rowset=16
      (#keys=1, [unix_timestamp(column_conv(TIMESTAMP,PS:(19,0),NOT NULL,timestamp_nvl(ANONYMOUS_VIEW1.c4(), cast(current_timestamp()(),
       TIMESTAMP(19, 0))())())())()]), dop=2
  5 - output([ANONYMOUS_VIEW1.c1()], [ANONYMOUS_VIEW1.c2()], [ANONYMOUS_VIEW1.c3()], [ANONYMOUS_VIEW1.c4()]), filter(nil), rowset=16
      access([ANONYMOUS_VIEW1.c1()], [ANONYMOUS_VIEW1.c2()], [ANONYMOUS_VIEW1.c3()], [ANONYMOUS_VIEW1.c4()])
  6 - output([t2.c1()], [t2.c2()], [t2.c3()], [t2.c4()]), filter(nil), rowset=16
  7 - output([t2.c3()], [t2.c4()], [t2.c1()], [t2.c2()]), filter(nil), rowset=16
      access([t2.c3()], [t2.c4()], [t2.c1()], [t2.c2()]), partitions(p0)
      is_index_back=false, is_global_index=false, 
      range_key([t2.c3()], [t2.c4()]), range(MIN,MIN ; MAX,MAX)always true
Used Hint:
-------------------------------------
  /*+
      
      PARALLEL(2)
      ENABLE_PARALLEL_DML
      DIRECT(TRUE, 10, 'INC')
  */
Qb name trace:
-------------------------------------
  stmt_id:0, stmt_type:T_EXPLAIN 
  stmt_id:1, INS$1 > INS$B2DE4D68
  stmt_id:2, SEL$1
Outline Data: 
-------------------------------------
  /*+
      BEGIN_OUTLINE_DATA
      PARALLEL(@"SEL$1" "test"."t2"@"SEL$1" 2)
      FULL(@"SEL$1" "test"."t2"@"SEL$1")
      PRED_DEDUCE(@"INS$1")
      PARALLEL(2)
      ENABLE_PARALLEL_DML
      OPTIMIZER_FEATURES_ENABLE('')
      DIRECT(TRUE, 10, 'INC')
      END_OUTLINE_DATA
  */
Optimization Info:
-------------------------------------
  t2:
      table_rows:2
      physical_range_rows:2
      logical_range_rows:2
      index_back_rows:0
      output_rows:2
      table_dop:2
      dop_method:Global DOP
      avaiable_index_name:[idx_1, rowkey_vid_table, vid_rowkey_table, idx_1_index_id_table, idx_1_index_snapshot_data_table, t2]
      pruned_index_name:[idx_1, rowkey_vid_table, vid_rowkey_table, idx_1_index_id_table, idx_1_index_snapshot_data_table]
      stats info:[version=1970-01-01 08:00:00.000000, is_locked=0, is_expired=0]
      dynamic sampling level:0
      estimation method:[DEFAULT, STORAGE]
  Plan Type:
      DISTRIBUTED
  Note:
      Degree of Parallelism is 2 because of hint
      Direct-mode inc is enabled in insert into select
insert /*+ direct(true, 10, 'inc') enable_parallel_dml parallel(2)*/ into t1 select * from t2;
select count(*) from t2 join t1 on t2.c1=t1.c1 and t2.c2=t1.c2 and t2.c3=t1.c3 and t2.c4=t1.c4;
count(*)
2
create vector index idx_1 on t1(c1) with (distance=l2, type=hnsw);
explain select * from t1 order by l2_distance(c1, '[1,2,30]') approx limit 8;
Query Plan
==================================================================
|ID|OPERATOR                     |NAME     |EST.ROWS|EST.TIME(us)|
------------------------------------------------------------------
|0 |LIMIT                        |         |1       |0|
|1 |└─PX COORDINATOR MERGE SORT  |         |1       |0|
|2 |  └─EXCHANGE OUT DISTR       |:EX10000 |1       |0|
|3 |    └─TOP-N SORT             |         |1       |0|
|4 |      └─PX PARTITION ITERATOR|         |1       |0|
|5 |        └─TABLE FULL SCAN    |t1(idx_1)|1       |0|
==================================================================
Outputs & filters:
-------------------------------------
  0 - output([t1.c1], [t1.c2], [t1.c3], [t1.c4]), filter(nil), rowset=16
      limit(8), offset(nil)
  1 - output([t1.c1], [t1.c2], [t1.c3], [t1.c4]), filter(nil), rowset=16
      sort_keys([l2_distance(t1.c1, cast('[1,2,30]', ARRAY(18, -1))), ASC])
  2 - output([t1.c1], [t1.c2], [t1.c3], [t1.c4], [l2_distance(t1.c1, cast('[1,2,30]', ARRAY(18, -1)))]), filter(nil), rowset=16
      dop=1
  3 - output([t1.c1], [t1.c2], [t1.c3], [t1.c4], [l2_distance(t1.c1, cast('[1,2,30]', ARRAY(18, -1)))]), filter(nil), rowset=16
      sort_keys([l2_distance(t1.c1, cast('[1,2,30]', ARRAY(18, -1))), ASC]), topn(8)
  4 - output([t1.c3], [t1.c4], [t1.c1], [t1.c2], [l2_distance(t1.c1, cast('[1,2,30]', ARRAY(18, -1)))]), filter(nil), rowset=16
      force partition granule
  5 - output([t1.c3], [t1.c4], [t1.c1], [t1.c2], [l2_distance(t1.c1, cast('[1,2,30]', ARRAY(18, -1)))]), filter(nil), rowset=16
      access([t1.c3], [t1.c4], [t1.c1], [t1.c2]), partitions(p[0-1])
      is_index_back=true, is_global_index=false, 
      123
select * from t1 order by l2_distance(c1, '[1,2,30]') approx limit 8;
c1	c2	c3	c4
[1,1,101]	[1,1,2014]	1	2014-09-17 00:00:00
[1,1,101]	[1,1,2014]	1	2014-10-17 00:00:00
[1,1,101]	[1,1,2014]	2	2014-09-17 00:00:00
[1,1,101]	[1,1,2014]	2	2014-11-17 00:00:00
call dbms_vector.refresh_index('idx_1', 't', 'c1', 1, 'FAST');
count(*)
0
count(*)
0
load data
drop table if exists t;
drop table if exists t1;
create table t(c1 vector(3), c2 array(float), c3 int primary key);
insert into t values('[1,1,101]', [1,1,2014], 1), ('[1,1,101]', [1,1,2014], 2);
select * into outfile '/data/1/test.file1' from t;
create table t1 like t;
load data /*+ direct(true, 100, 'full') parallel(10)*/ infile '/data/1/test.file1' into table t1;
ERROR 0A000: Not supported feature or function
select count(*) from t join t1 on t.c1=t1.c1 and t.c2=t1.c2 and t.c3=t1.c3;
count(*)
0
truncate t1;
load data /*+ direct(true, 100, 'inc') parallel(10)*/ infile '/data/1/test.file1' into table t1;
ERROR 0A000: Not supported feature or function
select count(*) from t join t1 on t.c1=t1.c1 and t.c2=t1.c2 and t.c3=t1.c3;
count(*)
0
select * into outfile '/data/1/test.file1' from t;
drop table t1;
create table t1 like t;
load data /*+ direct(true, 100, 'full') parallel(10)*/ infile '/data/1/test.file1' into table t1;
ERROR 0A000: Not supported feature or function
select count(*) from t join t1 on t.c1=t1.c1 and t.c2=t1.c2 and t.c3=t1.c3;
count(*)
0
truncate t1;
insert into view
drop table if exists t;
create table t(c1 vector(3), c2 array(float), c3 int auto_increment, c4 timestamp, primary key(c3, c4), vector index idx_1(c1) with (distance=l2, type=hnsw)) partition by range(unix_timestamp(c4)) (partition p0 values less than (unix_timestamp('2010-01-01')), partition p1 values less than(unix_timestamp('2020-01-01')));
call pl1(100);
drop view if exists v;
drop materialized view if exists m;
create view v as select * from t order by l2_distance(c1, '[1,2,30]') approx limit 10;
create materialized view m refresh complete on demand as select * from t order by l2_distance(c1, '[1,2,10]') approx limit 10;
insert into v values('[1,1,105]', [1,1,1090], default, '2018-9-19');
ERROR HY000: The target table v of the INSERT is not insertable-into
insert into m values('[1,1,105]', [1,1,1090], default, '2019-9-18');
ERROR 0A000: DML operation on materialized view (log) is not supported
drop view if exists v1;
create view v1 as select * from t where c3>100;
insert into v1 values('[1,1,105]', [1,1,1090], default, '2019-9-18');
drop materialized view if exists m1;
create materialized view m1 refresh complete on demand as select * from t where c3>100;
insert into m1 values('[1,1,105]', [1,1,1090], default, '2019-9-18');
ERROR 0A000: DML operation on materialized view (log) is not supported
drop index idx_1 on t;
create vector index idx_1 on m1(c1) with(distance=l2, type=hnsw);
ERROR 0A000: create vector index on view table is not supported
create index idx_2 on m1(c3);
select count(*) from m,m1;
count(*)
10
drop view if exists v2;
create view v2 as select * from m1;
insert into v2 values('[1,1,105]', [1,1,1090], default, '2019-9-18');
select * from m1,v2;
c1	c2	c3	c4	c1	c2	c3	c4
[1,1,105]	[1,1,1090]	101	2019-09-18 00:00:00	[1,1,105]	[1,1,1090]	101	2019-09-18 00:00:00
[1,1,105]	[1,1,1090]	101	2019-09-18 00:00:00	[1,1,105]	[1,1,1090]	NULL	2019-09-18 00:00:00
[1,1,105]	[1,1,1090]	NULL	2019-09-18 00:00:00	[1,1,105]	[1,1,1090]	101	2019-09-18 00:00:00
[1,1,105]	[1,1,1090]	NULL	2019-09-18 00:00:00	[1,1,105]	[1,1,1090]	NULL	2019-09-18 00:00:00
vector type
drop table if exists t;
create table t(c1 vector(2), c2 float[]);
insert into t values (null, null);
insert into t values ('[-1,-2]', '[-1,-2]');
insert into t values ('[0.122,0.233231]','[0.122,0.233231]');
insert into t values ([-1,-2], [-1,-2]);
insert into t values ([0.122,0.233231], [0.122,0.233231]);
insert into select
drop table if exists t;
drop table if exists t1;
create table t(c1 vector(2), c2 float[], c3 int primary key, vector index idx_1(c1) with (distance=l2,type=hnsw));
create table t1(c1 vector(2), c2 float[], c3 int primary key, vector index idx_1(c1) with (distance=l2,type=hnsw));
insert into t values ('[-1,-2]', '[-1,-2]',1);
insert into t values ('[0.122,0.233231]','[0.122,0.233231]',2);
insert into t values ([-1,-2], [-1,-2],3);
insert into t values ([0.122,0.233231], [0.122,0.233231],4);
insert into t values ([1,1], [1,1],5);
insert into t1 select * from t where t.c3>2;
explain select * from t1 order by l2_distance(c1, '[1,1]') approx limit 2;
Query Plan
====================================================
|ID|OPERATOR       |NAME     |EST.ROWS|EST.TIME(us)|
----------------------------------------------------
|0 |TABLE FULL SCAN|t1(idx_1)|3       |0|
====================================================
Outputs & filters:
-------------------------------------
  0 - output([t1.c1], [t1.c2], [t1.c3]), filter(nil), rowset=16
      access([t1.c3], [t1.c1], [t1.c2]), partitions(p0)
      is_index_back=true, is_global_index=false, 
      123
select * from t1 order by l2_distance(c1, '[1,1]') approx limit 2;
c1	c2	c3
[1,1]	[1,1]	5
[0.122,0.233231]	[0.122,0.233231]	4
select * from t1 order by l2_distance(c1, '[1,1]') limit 2;
c1	c2	c3
[1,1]	[1,1]	5
[0.122,0.233231]	[0.122,0.233231]	4
insert overwrite
drop table if exists t;
drop table if exists t1;
create table t(c1 vector(3), c2 array(float), c3 int auto_increment, c4 timestamp, primary key(c3, c4), vector index idx_1(c1) with (distance=l2, type=hnsw)) partition by range(unix_timestamp(c4)) (partition p0 values less than (unix_timestamp('2010-01-01')), partition p1 values less than(unix_timestamp('2020-01-01')));
create table t1(c1 vector(3), c2 array(float), c3 int auto_increment, c4 timestamp, primary key(c3, c4), vector index idx_1(c1) with (distance=l2, type=hnsw)) partition by range(unix_timestamp(c4)) (partition p0 values less than (unix_timestamp('2010-01-01')), partition p1 values less than(unix_timestamp('2020-01-01')));
call pl1(100);
insert /*+ parallel(10) */ overwrite t1 select * from t where t.c3>90;
ERROR 0A000: insert overwrite with direct-load does not support table has generated column
drop index idx_1 on t1;
explain extended insert /*+ parallel(10) */ overwrite t1 select * from t where t.c3>90;
Query Plan
=================================================================================
|ID|OPERATOR                              |NAME           |EST.ROWS|EST.TIME(us)|
---------------------------------------------------------------------------------
|0 |PX COORDINATOR                        |               |10      |0|
|1 |└─EXCHANGE OUT DISTR                  |:EX10001       |10      |0|
|2 |  └─INSERT                            |               |10      |0|
|3 |    └─EXCHANGE IN DISTR               |               |10      |0|
|4 |      └─EXCHANGE OUT DISTR (PKEY HASH)|:EX10000       |10      |0|
|5 |        └─SUBPLAN SCAN                |ANONYMOUS_VIEW1|10      |0|
|6 |          └─PX BLOCK ITERATOR         |               |10      |0|
|7 |            └─TABLE RANGE SCAN        |t              |10      |0|
=================================================================================
Outputs & filters:
-------------------------------------
  0 - output(nil), filter(nil), rowset=16
  1 - output(nil), filter(nil), rowset=16
      dop=10
  2 - output(nil), filter(nil), rowset=16
      columns([{t1: ({t1: (t1.c3(), t1.c4(), t1.c1(), t1.c2())})}]), partitions(p[0-1]), 
      column_values([column_conv(INT,PS:(11,0),NOT NULL,t1.c3.nextval(column_conv(INT,PS:(11,0),NOT NULL,ANONYMOUS_VIEW1.c3())())())()],
       [column_conv(TIMESTAMP,PS:(19,0),NOT NULL,timestamp_nvl(ANONYMOUS_VIEW1.c4(), cast(current_timestamp()(), TIMESTAMP(19, 0))())())(
      )], [column_conv(ARRAY,PS:(-1,-1),NULL,ANONYMOUS_VIEW1.c1())()], [column_conv(ARRAY,PS:(-1,-1),NULL,ANONYMOUS_VIEW1.c2())()])
  3 - output([PARTITION_ID()], [column_conv(INT,PS:(11,0),NOT NULL,t1.c3.nextval(column_conv(INT,PS:(11,0),NOT NULL,ANONYMOUS_VIEW1.c3())())())(0
()], [column_conv(TIMESTAMP,PS:(19,0),NOT NULL,timestamp_nvl(ANONYMOUS_VIEW1.c4(), cast(current_timestamp()(), TIMESTAMP(19,
       0))())())()], [ANONYMOUS_VIEW1.c1()], [ANONYMOUS_VIEW1.c2()]), filter(nil), rowset=16
  4 - output([PARTITION_ID()], [column_conv(INT,PS:(11,0),NOT NULL,t1.c3.nextval(column_conv(INT,PS:(11,0),NOT NULL,ANONYMOUS_VIEW1.c3())())())(0
()], [column_conv(TIMESTAMP,PS:(19,0),NOT NULL,timestamp_nvl(ANONYMOUS_VIEW1.c4(), cast(current_timestamp()(), TIMESTAMP(19,
       0))())())()], [ANONYMOUS_VIEW1.c1()], [ANONYMOUS_VIEW1.c2()]), filter(nil), rowset=16
      (#keys=1, [unix_timestamp(column_conv(TIMESTAMP,PS:(19,0),NOT NULL,timestamp_nvl(ANONYMOUS_VIEW1.c4(), cast(current_timestamp()(),
       TIMESTAMP(19, 0))())())())()]), dop=10
  5 - output([ANONYMOUS_VIEW1.c1()], [ANONYMOUS_VIEW1.c2()], [ANONYMOUS_VIEW1.c3()], [ANONYMOUS_VIEW1.c4()]), filter(nil), rowset=16
      access([ANONYMOUS_VIEW1.c1()], [ANONYMOUS_VIEW1.c2()], [ANONYMOUS_VIEW1.c3()], [ANONYMOUS_VIEW1.c4()])
  6 - output([t.c1()], [t.c2()], [t.c3()], [t.c4()]), filter(nil), rowset=16
  7 - output([t.c3()], [t.c4()], [t.c1()], [t.c2()]), filter(nil), rowset=16
      access([t.c3()], [t.c4()], [t.c1()], [t.c2()]), partitions(p[0-1])
      is_index_back=false, is_global_index=false, 
      range_key([t.c3()], [t.c4()]), range(90,MAX ; MAX,MAX), 
      range_cond([t.c3() > 90()()])
Used Hint:
-------------------------------------
  /*+
      
      PARALLEL(10)
  */
Qb name trace:
-------------------------------------
  stmt_id:0, stmt_type:T_EXPLAIN 
  stmt_id:1, INS$1 > INS$B2DE4D68
  stmt_id:2, SEL$1
Outline Data: 
-------------------------------------
  /*+
      BEGIN_OUTLINE_DATA
      PARALLEL(@"SEL$1" "test"."t"@"SEL$1" 10)
      FULL(@"SEL$1" "test"."t"@"SEL$1")
      PRED_DEDUCE(@"INS$1")
      PARALLEL(10)
      ENABLE_PARALLEL_DML
      OPTIMIZER_FEATURES_ENABLE('')
      END_OUTLINE_DATA
  */
Optimization Info:
-------------------------------------
  t:
      table_rows:100
      physical_range_rows:10
      logical_range_rows:10
      index_back_rows:0
      output_rows:10
      table_dop:10
      dop_method:Global DOP
      avaiable_index_name:[idx_1, rowkey_vid_table, vid_rowkey_table, idx_1_index_id_table, idx_1_index_snapshot_data_table, t]
      pruned_index_name:[idx_1, rowkey_vid_table, vid_rowkey_table, idx_1_index_id_table, idx_1_index_snapshot_data_table]
      stats info:[version=1970-01-01 08:00:00.000000, is_locked=0, is_expired=0]
      dynamic sampling level:0
      estimation method:[DEFAULT, STORAGE]
  Plan Type:
      DISTRIBUTED
  Parameters:
      :0 => 90
  Note:
      Degree of Parallelism is 10 because of hint
      Overwrite table with full direct mode
insert /*+ parallel(10) */ overwrite t1 select * from t where t.c3>90;
replace into
drop table if exists t;
drop table if exists t1;
create table t(c1 vector(3), c2 array(float), c3 int auto_increment, c4 timestamp, primary key(c3, c4), vector index idx_1(c1) with (distance=l2, type=hnsw)) partition by range(unix_timestamp(c4)) (partition p0 values less than (unix_timestamp('2010-01-01')), partition p1 values less than(unix_timestamp('2020-01-01')));
replace into t values ([1,1,100], [1,1,2018], 100, '2018-08-15');
replace into t values ([1,1,101], [1,1,2019], 100, '2018-08-15');
select * from t;
c1	c2	c3	c4
[1,1,101]	[1,1,2019]	100	2018-08-15 00:00:00
drop view if exists v;
create view v as select * from t where c3 >30;
replace into v values ([1,1,102], [1,1,2019], 20, '2018-08-15');
replace into v values ([1,1,103], [1,1,2019], 50, '2018-08-15');
drop materialized view if exists m;
create materialized view m as select * from t order by l2_distance(c1, [1,1,20]),c3 approx limit 1;
ERROR 0A000: Multi order by item when using vector index is not supported
create materialized view m as select * from t order by l2_distance(c1, [1,1,99]) approx limit 1;
select * from m;
c1	c2	c3	c4
[1,1,101]	[1,1,2019]	100	2018-08-15 00:00:00
replace into t select * from m where m.c3>30;
select * from t;
c1	c2	c3	c4
[1,1,102]	[1,1,2019]	20	2018-08-15 00:00:00
[1,1,103]	[1,1,2019]	50	2018-08-15 00:00:00
[1,1,101]	[1,1,2019]	100	2018-08-15 00:00:00
replace into t partition(p1) values ([1,1,101], [1,1,2019], 30, '2018-08-15');
replace into t partition(p1) values ([1,1,101], [1,1,2019], 30, '2009-08-15');
ERROR HY000: Found a row not matching the given partition set
update
drop table if exists t;
drop table if exists t1;
create table t(c1 vector(3), c2 array(float), c3 int auto_increment, c4 timestamp, primary key(c3, c4), vector index idx_1(c1) with (distance=l2, type=hnsw)) partition by range(unix_timestamp(c4)) (partition p0 values less than (unix_timestamp('2010-01-01')), partition p1 values less than(unix_timestamp('2020-01-01')));
create table t1(c1 vector(3), c2 array(float), c3 int auto_increment, c4 timestamp, primary key(c3, c4), vector index idx_1(c1) with (distance=l2, type=hnsw)) partition by range(unix_timestamp(c4)) (partition p0 values less than (unix_timestamp('2010-01-01')), partition p1 values less than(unix_timestamp('2020-01-01')));
call pl1(10);
insert into t1 select * from t;
alter table t modify c4 timestamp default current_timestamp;
update t set t.c1=[2,2,2] where t.c3=1;
select count(*) from t where t.c3=1;
count(*)
1
update t set c4='2018-1-10' order by c3 limit 3;
select count(*) from t;
count(*)
10
update t partition(p1) set c4='2019-10-19' where c3>5;
select count(*) from t;
count(*)
10
alter table t1 modify c4 timestamp default current_timestamp;
update t, t1 partition(p1) set t.c4='2011-1-1',t1.c1='[2,2,2]' where t.c4=t1.c4;
insert into t values([1,1,1],[1,1,1],200,'2015-5-5');
insert into t values([1,1,1],[1,1,1],201,'2015-5-5');
update t set c3=201 where c3=200 and c4='2015-5-5';
ERROR 23000: Duplicate entry '201-2015-05-05 00:00:00.000000' for key 'PRIMARY'
update ignore t set c3=201 where c3=200 and c4='2015-5-5';
drop view if exists v;
create view v as select * from t where c3>100;
update v set c3=201 where c3=200 and c4='2015-5-5';
ERROR 23000: Duplicate entry '201-2015-05-05 00:00:00.000000' for key 'PRIMARY'
update ignore v set c3=201 where c3=200 and c4='2015-5-5';
update v set c3=202 where c3=200 and c4='2015-5-5';
select count(*) from t,v where t.c3>100 and t.c3=v.c3;
count(*)
2
select
drop table if exists t;
create table t (c1 vector(3), c2 array(float), c3 int auto_increment, c4 json,c5 int generated always as (cast(json_unquote(json_extract(c4, '$.age')) as unsigned)) virtual, primary key(c3),vector index idx_1(c1) with(distance=l2, type=hnsw), index idx_2(c5));
insert into t values([0.3232323,0.455656,null], [0.3232323,0.455656,null],default, '{"name":"c","age":20}', default);
ERROR 42000: Null value
insert into t values('[0.3232323,0.455656,0.564534t4]', '[0.3232323,0.455656,0.564534t4]',default, '{"name":"a","age":18}', default);
ERROR 22032: Invalid JSON text.
drop table if exists t;
create table t (c1 vector(3), c2 array(float), c3 int auto_increment, c4 json,c5 int generated always as (cast(json_unquote(json_extract(c4, '$.age')) as unsigned)) virtual, primary key(c3),vector index idx_1(c1) with(distance=l2, type=hnsw), index idx_2(c5));
insert into t values('[0.23233454,0.2323233,0.123242]', '[0.23233454,0.2323233,0.123242]',default, '{"name":"a","age":18}', default);
insert into t values('[0.3232323,0.455656,0.5645344]', '[0.3232323,0.455656,0.5645344]',default, '{"name":"a","age":18}', default);
insert into t values([-0.978696,-0.4564654,-0.123123132], [-0.978696,-0.4564654,-0.123123132],default, '{"name":"d","age":21}', default);
insert into t values('[0.3232323,0.45565e-6,0.564534e4]', '[0.3232323,0.45565e-6,0.564534e4]',default, '{"name":"a","age":18}', default);
explain select /*+ read_consistency(weak) */ * from t order by l2_distance(c1, '[1,1,1]') approx limit 2;
ERROR 0A000: when using vector index, weak read is not supported
select /*+ read_consistency(weak) */ * from t order by l2_distance(c1, '[1,1,1]') approx limit 2;
ERROR 0A000: when using vector index, weak read is not supported
explain select /*+ read_consistency(weak) */ * from t where c5=18;
Query Plan
====================================================
|ID|OPERATOR        |NAME    |EST.ROWS|EST.TIME(us)|
----------------------------------------------------
|0 |TABLE RANGE SCAN|t(idx_2)|3       |0|
====================================================
Outputs & filters:
-------------------------------------
  0 - output([t.c1], [t.c2], [t.c3], [t.c4], [column_conv(INT,PS:(11,0),NULL,cast(cast(json_unquote(json_extract(t.c4, '$.age')), BIGINT UNSIGNED(0, 0)),
       INT(-1, 0)))]), filter(nil), rowset=16
      access([t.c3], [t.c4], [t.c5], [t.c1], [t.c2]), partitions(p0)
      is_index_back=true, is_global_index=false, 
      range_key([t.c5], [t.c3]), range(18,MIN ; 18,MAX), 
      range_cond([t.c5 = 18])
select /*+ read_consistency(weak) */ * from t where c5=18;
c1	c2	c3	c4	c5
drop index idx_1 on t;
explain select /*+ read_consistency(weak) */ * from t order by l2_distance(c1, '[1,1,1]') approx limit 2;
Query Plan
=================================================
|ID|OPERATOR         |NAME|EST.ROWS|EST.TIME(us)|
-------------------------------------------------
|0 |TOP-N SORT       |    |2       |0|
|1 |└─TABLE FULL SCAN|t   |4       |0|
=================================================
Outputs & filters:
-------------------------------------
  0 - output([t.c1], [t.c2], [t.c3], [t.c4], [column_conv(INT,PS:(11,0),NULL,cast(cast(json_unquote(json_extract(t.c4, '$.age')), BIGINT UNSIGNED(0, 0)),
       INT(-1, 0)))]), filter(nil), rowset=16
      sort_keys([l2_distance(t.c1, cast('[1,1,1]', ARRAY(18, -1))), ASC]), topn(2)
  1 - output([t.c3], [t.c4], [column_conv(INT,PS:(11,0),NULL,cast(cast(json_unquote(json_extract(t.c4, '$.age')), BIGINT UNSIGNED(0, 0)), INT(-1, 0)))],
       [t.c1], [t.c2]), filter(nil), rowset=16
      access([t.c3], [t.c4], [t.c1], [t.c2]), partitions(p0)
      is_index_back=false, is_global_index=false, 
      123
select /*+ read_consistency(weak) */ * from t order by l2_distance(c1, '[1,1,1]') approx limit 2;
c1	c2	c3	c4	c5
[0.323232,0.455656,0.564534]	[0.323232,0.455656,0.564534]	2	{"age": 18, "name": "a"}	18
[0.232335,0.232323,0.123242]	[0.232335,0.232323,0.123242]	1	{"age": 18, "name": "a"}	18
explain select /*+ read_consistency(weak) */ * from t where c5=18;
Query Plan
====================================================
|ID|OPERATOR        |NAME    |EST.ROWS|EST.TIME(us)|
----------------------------------------------------
|0 |TABLE RANGE SCAN|t(idx_2)|3       |0|
====================================================
Outputs & filters:
-------------------------------------
  0 - output([t.c1], [t.c2], [t.c3], [t.c4], [column_conv(INT,PS:(11,0),NULL,cast(cast(json_unquote(json_extract(t.c4, '$.age')), BIGINT UNSIGNED(0, 0)),
       INT(-1, 0)))]), filter(nil), rowset=16
      access([t.c3], [t.c4], [t.c5], [t.c1], [t.c2]), partitions(p0)
      is_index_back=true, is_global_index=false, 
      range_key([t.c5], [t.c3]), range(18,MIN ; 18,MAX), 
      range_cond([t.c5 = 18])
select /*+ read_consistency(weak) */ * from t where c5=18;
c1	c2	c3	c4	c5
[0.232335,0.232323,0.123242]	[0.232335,0.232323,0.123242]	1	{"age": 18, "name": "a"}	18
[0.323232,0.455656,0.564534]	[0.323232,0.455656,0.564534]	2	{"age": 18, "name": "a"}	18
[0.323232,0.00000045565,5645.34]	[0.323232,0.00000045565,5645.34]	4	{"age": 18, "name": "a"}	18
create vector index idx_1 on t(c1) with (distance=l2,type=hnsw);
select distinct c1 from t order by l2_distance(c1, '[1,1,1]') approx limit 2;
ERROR 22000: Invalid data type for the operation
select distinct c5 from t order by l2_distance(c1, '[1,1,1]') approx limit 2;
c5
18
select all c1 from t order by l2_distance(c1, '[1,1,1]') approx limit 2;
c1
[0.323232,0.455656,0.564534]
[0.232335,0.232323,0.123242]
select all c5 from t order by l2_distance(c1, '[1,1,1]') approx limit 2;
c5
18
18
select unique c1 from t order by l2_distance(c1, '[1,1,1]') approx limit 2;
ERROR 22000: Invalid data type for the operation
select unique c5 from t order by l2_distance(c1, '[1,1,1]') approx limit 2;
c5
18
select sql_calc_found_rows * from t order by l2_distance(c1, '[1,1,1]') approx limit 3;
c1	c2	c3	c4	c5
[0.323232,0.455656,0.564534]	[0.323232,0.455656,0.564534]	2	{"age": 18, "name": "a"}	18
[0.232335,0.232323,0.123242]	[0.232335,0.232323,0.123242]	1	{"age": 18, "name": "a"}	18
[-0.978696,-0.456465,-0.123123]	[-0.978696,-0.456465,-0.123123]	3	{"age": 21, "name": "d"}	21
select found_rows();
found_rows()
3
select sql_calc_found_rows * from t where c5=18 order by c3 limit 1;
c1	c2	c3	c4	c5
[0.232335,0.232323,0.123242]	[0.232335,0.232323,0.123242]	1	{"age": 18, "name": "a"}	18
select found_rows();
found_rows()
3
drop table if exists t1;
create table t1 (c1 vector(3), c2 int auto_increment primary key);
insert into t1 values ('[0.23233454,0.2323233,0.123242]', default);
insert into t1 values ('[0.3232323,0.455656,0.5645344]', default);
insert into t1 values ('[1,1,1]', default);
select * from t natural join t1;
ERROR HY000: Invalid argument
select * from t inner join t1 on t.c1=t1.c1 order by l2_distance(t.c1, '[1,1,1]') approx limit 2;
c1	c2	c3	c4	c5	c1	c2
[0.323232,0.455656,0.564534]	[0.323232,0.455656,0.564534]	2	{"age": 18, "name": "a"}	18	[0.323232,0.455656,0.564534]	2
[0.232335,0.232323,0.123242]	[0.232335,0.232323,0.123242]	1	{"age": 18, "name": "a"}	18	[0.232335,0.232323,0.123242]	1
explain select * from t cross join t1 on t.c1=t1.c1 order by l2_distance(t.c1, '[1,1,1]') approx limit 2;
Query Plan
=======================================================
|ID|OPERATOR           |NAME    |EST.ROWS|EST.TIME(us)|
-------------------------------------------------------
|0 |TOP-N SORT         |        |2       |0|
|1 |└─HASH JOIN        |        |3       |0|
|2 |  ├─TABLE FULL SCAN|t1      |3       |0|
|3 |  └─TABLE FULL SCAN|t(idx_1)|4       |0|
=======================================================
Outputs & filters:
-------------------------------------
  0 - output([t.c1], [t.c2], [t.c3], [t.c4], [column_conv(INT,PS:(11,0),NULL,cast(cast(json_unquote(json_extract(t.c4, '$.age')), BIGINT UNSIGNED(0, 0)),
       INT(-1, 0)))], [t1.c1], [t1.c2]), filter(nil), rowset=16
      sort_keys([l2_distance(t.c1, cast('[1,1,1]', ARRAY(18, -1))), ASC]), topn(2)
  1 - output([l2_distance(t.c1, cast('[1,1,1]', ARRAY(18, -1)))], [t.c1], [t.c2], [t.c3], [t.c4], [column_conv(INT,PS:(11,0),NULL,cast(cast(json_unquote(json_extract(t.c4,
       '$.age')), BIGINT UNSIGNED(0, 0)), INT(-1, 0)))], [t1.c1], [t1.c2]), filter(nil), rowset=16
      equal_conds([t.c1 = t1.c1]), other_conds(nil)
  2 - output([t1.c2], [t1.c1]), filter(nil), rowset=16
      access([t1.c2], [t1.c1]), partitions(p0)
      is_index_back=false, is_global_index=false, 
      123
  3 - output([t.c3], [t.c4], [column_conv(INT,PS:(11,0),NULL,cast(cast(json_unquote(json_extract(t.c4, '$.age')), BIGINT UNSIGNED(0, 0)), INT(-1, 0)))],
       [t.c1], [t.c2], [l2_distance(t.c1, cast('[1,1,1]', ARRAY(18, -1)))]), filter(nil), rowset=16
      access([t.c3], [t.c4], [t.c1], [t.c2]), partitions(p0)
      is_index_back=true, is_global_index=false, 
      123
select * from t cross join t1 on t.c1=t1.c1 order by l2_distance(t.c1, '[1,1,1]') approx limit 2;
c1	c2	c3	c4	c5	c1	c2
[0.323232,0.455656,0.564534]	[0.323232,0.455656,0.564534]	2	{"age": 18, "name": "a"}	18	[0.323232,0.455656,0.564534]	2
[0.232335,0.232323,0.123242]	[0.232335,0.232323,0.123242]	1	{"age": 18, "name": "a"}	18	[0.232335,0.232323,0.123242]	1
explain select * from t left join t1 on t.c1=t1.c1 order by l2_distance(t.c1, '[1,1,1]') approx limit 2;
Query Plan
============================================================
|ID|OPERATOR                |NAME    |EST.ROWS|EST.TIME(us)|
------------------------------------------------------------
|0 |TOP-N SORT              |        |2       |0|
|1 |└─HASH RIGHT OUTER JOIN |        |4       |0|
|2 |  ├─TABLE FULL SCAN     |t1      |3       |0|
|3 |  └─TABLE FULL SCAN     |t(idx_1)|4       |0|
============================================================
Outputs & filters:
-------------------------------------
  0 - output([t.c1], [t.c2], [t.c3], [t.c4], [column_conv(INT,PS:(11,0),NULL,cast(cast(json_unquote(json_extract(t.c4, '$.age')), BIGINT UNSIGNED(0, 0)),
       INT(-1, 0)))], [t1.c1], [t1.c2]), filter(nil), rowset=16
      sort_keys([l2_distance(t.c1, cast('[1,1,1]', ARRAY(18, -1))), ASC]), topn(2)
  1 - output([l2_distance(t.c1, cast('[1,1,1]', ARRAY(18, -1)))], [t.c1], [t.c2], [t.c3], [t.c4], [column_conv(INT,PS:(11,0),NULL,cast(cast(json_unquote(json_extract(t.c4,
       '$.age')), BIGINT UNSIGNED(0, 0)), INT(-1, 0)))], [t1.c1], [t1.c2]), filter(nil), rowset=16
      equal_conds([t.c1 = t1.c1]), other_conds(nil)
  2 - output([t1.c2], [t1.c1]), filter(nil), rowset=16
      access([t1.c2], [t1.c1]), partitions(p0)
      is_index_back=false, is_global_index=false, 
      123
  3 - output([t.c3], [t.c4], [column_conv(INT,PS:(11,0),NULL,cast(cast(json_unquote(json_extract(t.c4, '$.age')), BIGINT UNSIGNED(0, 0)), INT(-1, 0)))],
       [t.c1], [t.c2], [l2_distance(t.c1, cast('[1,1,1]', ARRAY(18, -1)))]), filter(nil), rowset=16
      access([t.c3], [t.c4], [t.c1], [t.c2]), partitions(p0)
      is_index_back=true, is_global_index=false, 
      123
select * from t left join t1 on t.c1=t1.c1 order by l2_distance(t.c1, '[1,1,1]') approx limit 2;
c1	c2	c3	c4	c5	c1	c2
[0.323232,0.455656,0.564534]	[0.323232,0.455656,0.564534]	2	{"age": 18, "name": "a"}	18	[0.323232,0.455656,0.564534]	2
[0.232335,0.232323,0.123242]	[0.232335,0.232323,0.123242]	1	{"age": 18, "name": "a"}	18	[0.232335,0.232323,0.123242]	1
explain select * from t right join t1 on t.c1=t1.c1 order by l2_distance(t.c1, '[1,1,1]') approx limit 2;
Query Plan
=======================================================
|ID|OPERATOR           |NAME    |EST.ROWS|EST.TIME(us)|
-------------------------------------------------------
|0 |TOP-N SORT         |        |2       |0|
|1 |└─HASH OUTER JOIN  |        |3       |0|
|2 |  ├─TABLE FULL SCAN|t1      |3       |0|
|3 |  └─TABLE FULL SCAN|t(idx_1)|4       |0|
=======================================================
Outputs & filters:
-------------------------------------
  0 - output([t.c1], [t.c2], [t.c3], [t.c4], [column_conv(INT,PS:(11,0),NULL,cast(cast(json_unquote(json_extract(t.c4, '$.age')), BIGINT UNSIGNED(0, 0)),
       INT(-1, 0)))], [t1.c1], [t1.c2]), filter(nil), rowset=16
      sort_keys([l2_distance(t.c1, cast('[1,1,1]', ARRAY(18, -1))), ASC]), topn(2)
  1 - output([l2_distance(t.c1, cast('[1,1,1]', ARRAY(18, -1)))], [t.c1], [t.c2], [t.c3], [t.c4], [column_conv(INT,PS:(11,0),NULL,cast(cast(json_unquote(json_extract(t.c4,
       '$.age')), BIGINT UNSIGNED(0, 0)), INT(-1, 0)))], [t1.c1], [t1.c2]), filter(nil), rowset=16
      equal_conds([t.c1 = t1.c1]), other_conds(nil)
  2 - output([t1.c2], [t1.c1]), filter(nil), rowset=16
      access([t1.c2], [t1.c1]), partitions(p0)
      is_index_back=false, is_global_index=false, 
      123
  3 - output([t.c3], [t.c4], [column_conv(INT,PS:(11,0),NULL,cast(cast(json_unquote(json_extract(t.c4, '$.age')), BIGINT UNSIGNED(0, 0)), INT(-1, 0)))],
       [t.c1], [t.c2], [l2_distance(t.c1, cast('[1,1,1]', ARRAY(18, -1)))]), filter(nil), rowset=16
      access([t.c3], [t.c4], [t.c1], [t.c2]), partitions(p0)
      is_index_back=true, is_global_index=false, 
      123
select * from t right join t1 on t.c1=t1.c1 order by l2_distance(t.c1, '[1,1,1]') approx limit 2;
c1	c2	c3	c4	c5	c1	c2
NULL	NULL	NULL	NULL	NULL	[1,1,1]	3
[0.323232,0.455656,0.564534]	[0.323232,0.455656,0.564534]	2	{"age": 18, "name": "a"}	18	[0.323232,0.455656,0.564534]	2
explain select * from t full join t1 on t.c1=t1.c1 order by l2_distance(t.c1, '[1,1,1]') approx limit 2;
Query Plan
===========================================================
|ID|OPERATOR               |NAME    |EST.ROWS|EST.TIME(us)|
-----------------------------------------------------------
|0 |TOP-N SORT             |        |2       |0|
|1 |└─HASH FULL OUTER JOIN |        |4       |0|
|2 |  ├─TABLE FULL SCAN    |t1      |3       |0|
|3 |  └─TABLE FULL SCAN    |t(idx_1)|4       |0|
===========================================================
Outputs & filters:
-------------------------------------
  0 - output([t.c1], [t.c2], [t.c3], [t.c4], [column_conv(INT,PS:(11,0),NULL,cast(cast(json_unquote(json_extract(t.c4, '$.age')), BIGINT UNSIGNED(0, 0)),
       INT(-1, 0)))], [t1.c1], [t1.c2]), filter(nil), rowset=16
      sort_keys([l2_distance(t.c1, cast('[1,1,1]', ARRAY(18, -1))), ASC]), topn(2)
  1 - output([l2_distance(t.c1, cast('[1,1,1]', ARRAY(18, -1)))], [t.c1], [t.c2], [t.c3], [t.c4], [column_conv(INT,PS:(11,0),NULL,cast(cast(json_unquote(json_extract(t.c4,
       '$.age')), BIGINT UNSIGNED(0, 0)), INT(-1, 0)))], [t1.c1], [t1.c2]), filter(nil), rowset=16
      equal_conds([t.c1 = t1.c1]), other_conds(nil)
  2 - output([t1.c2], [t1.c1]), filter(nil), rowset=16
      access([t1.c2], [t1.c1]), partitions(p0)
      is_index_back=false, is_global_index=false, 
      123
  3 - output([t.c3], [t.c4], [column_conv(INT,PS:(11,0),NULL,cast(cast(json_unquote(json_extract(t.c4, '$.age')), BIGINT UNSIGNED(0, 0)), INT(-1, 0)))],
       [t.c1], [t.c2], [l2_distance(t.c1, cast('[1,1,1]', ARRAY(18, -1)))]), filter(nil), rowset=16
      access([t.c3], [t.c4], [t.c1], [t.c2]), partitions(p0)
      is_index_back=true, is_global_index=false, 
      123
select * from t full join t1 on t.c1=t1.c1 order by l2_distance(t.c1, '[1,1,1]') approx limit 2;
c1	c2	c3	c4	c5	c1	c2
NULL	NULL	NULL	NULL	NULL	[1,1,1]	3
[0.323232,0.455656,0.564534]	[0.323232,0.455656,0.564534]	2	{"age": 18, "name": "a"}	18	[0.323232,0.455656,0.564534]	2
select c1,c2 from t1 union all select c1,c3 from t order by l2_distance(c1, '[1,1,1]') limit 3;
c1	c2
[1,1,1]	3
[0.323232,0.455656,0.564534]	2
[0.323232,0.455656,0.564534]	2
select c1,c2 from t1 union select c1,c3 from t order by l2_distance(c1, '[1,1,1]') limit 3;
c1	c2
[1,1,1]	3
[0.323232,0.455656,0.564534]	2
[0.232335,0.232323,0.123242]	1
select c1,c2 from t1 except select c1,c3 from t order by l2_distance(c1, '[1,1,1]') limit 3;
c1	c2
[1,1,1]	3
select c1,c2 from t1 intersect select c1,c3 from t order by l2_distance(c1, '[1,1,1]') limit 3;
c1	c2
[0.323232,0.455656,0.564534]	2
[0.232335,0.232323,0.123242]	1
explain select /*+ index(t idx_1) */ c1,c2 from t order by l2_distance(c1, '[1,1,1]') limit 2;
Query Plan
=================================================
|ID|OPERATOR         |NAME|EST.ROWS|EST.TIME(us)|
-------------------------------------------------
|0 |TOP-N SORT       |    |2       |0|
|1 |└─TABLE FULL SCAN|t   |4       |0|
=================================================
Outputs & filters:
-------------------------------------
  0 - output([t.c1], [t.c2]), filter(nil), rowset=16
      sort_keys([l2_distance(t.c1, cast('[1,1,1]', ARRAY(18, -1))), ASC]), topn(2)
  1 - output([t.c1], [t.c2]), filter(nil), rowset=16
      access([t.c1], [t.c2]), partitions(p0)
      is_index_back=false, is_global_index=false, 
      123
select /*+ index(t idx_1) */ c1,c2 from t order by l2_distance(c1, '[1,1,1]') limit 2;
c1	c2
[0.323232,0.455656,0.564534]	[0.323232,0.455656,0.564534]
[0.232335,0.232323,0.123242]	[0.232335,0.232323,0.123242]
explain select * from t use index(idx_1) order by l2_distance(c1, '[1,1,1]') limit 2;
Query Plan
=================================================
|ID|OPERATOR         |NAME|EST.ROWS|EST.TIME(us)|
-------------------------------------------------
|0 |TOP-N SORT       |    |2       |0|
|1 |└─TABLE FULL SCAN|t   |4       |0|
=================================================
Outputs & filters:
-------------------------------------
  0 - output([t.c1], [t.c2], [t.c3], [t.c4], [column_conv(INT,PS:(11,0),NULL,cast(cast(json_unquote(json_extract(t.c4, '$.age')), BIGINT UNSIGNED(0, 0)),
       INT(-1, 0)))]), filter(nil), rowset=16
      sort_keys([l2_distance(t.c1, cast('[1,1,1]', ARRAY(18, -1))), ASC]), topn(2)
  1 - output([t.c3], [t.c4], [column_conv(INT,PS:(11,0),NULL,cast(cast(json_unquote(json_extract(t.c4, '$.age')), BIGINT UNSIGNED(0, 0)), INT(-1, 0)))],
       [t.c1], [t.c2]), filter(nil), rowset=16
      access([t.c3], [t.c4], [t.c1], [t.c2]), partitions(p0)
      is_index_back=false, is_global_index=false, 
      123
select * from t use index(idx_1) order by l2_distance(c1, '[1,1,1]') limit 2;
c1	c2	c3	c4	c5
[0.323232,0.455656,0.564534]	[0.323232,0.455656,0.564534]	2	{"age": 18, "name": "a"}	18
[0.232335,0.232323,0.123242]	[0.232335,0.232323,0.123242]	1	{"age": 18, "name": "a"}	18
explain select * from t force index(idx_1) order by l2_distance(c1, '[1,1,1]') limit 2;
Query Plan
=================================================
|ID|OPERATOR         |NAME|EST.ROWS|EST.TIME(us)|
-------------------------------------------------
|0 |TOP-N SORT       |    |2       |0|
|1 |└─TABLE FULL SCAN|t   |4       |0|
=================================================
Outputs & filters:
-------------------------------------
  0 - output([t.c1], [t.c2], [t.c3], [t.c4], [column_conv(INT,PS:(11,0),NULL,cast(cast(json_unquote(json_extract(t.c4, '$.age')), BIGINT UNSIGNED(0, 0)),
       INT(-1, 0)))]), filter(nil), rowset=16
      sort_keys([l2_distance(t.c1, cast('[1,1,1]', ARRAY(18, -1))), ASC]), topn(2)
  1 - output([t.c3], [t.c4], [column_conv(INT,PS:(11,0),NULL,cast(cast(json_unquote(json_extract(t.c4, '$.age')), BIGINT UNSIGNED(0, 0)), INT(-1, 0)))],
       [t.c1], [t.c2]), filter(nil), rowset=16
      access([t.c3], [t.c4], [t.c1], [t.c2]), partitions(p0)
      is_index_back=false, is_global_index=false, 
      123
select * from t force index(idx_1) order by l2_distance(c1, '[1,1,1]') limit 2;
c1	c2	c3	c4	c5
[0.323232,0.455656,0.564534]	[0.323232,0.455656,0.564534]	2	{"age": 18, "name": "a"}	18
[0.232335,0.232323,0.123242]	[0.232335,0.232323,0.123242]	1	{"age": 18, "name": "a"}	18
explain select * from t ignore index(idx_1) order by l2_distance(c1, '[1,1,1]') approx limit 2;
Query Plan
===================================================
|ID|OPERATOR       |NAME    |EST.ROWS|EST.TIME(us)|
---------------------------------------------------
|0 |TABLE FULL SCAN|t(idx_1)|1       |0|
===================================================
Outputs & filters:
-------------------------------------
  0 - output([t.c1], [t.c2], [t.c3], [t.c4], [column_conv(INT,PS:(11,0),NULL,cast(cast(json_unquote(json_extract(t.c4, '$.age')), BIGINT UNSIGNED(0, 0)),
       INT(-1, 0)))]), filter(nil), rowset=16
      access([t.c3], [t.c4], [t.c1], [t.c2]), partitions(p0)
      is_index_back=true, is_global_index=false, 
      123
select * from t ignore index(idx_1) order by l2_distance(c1, '[1,1,1]') approx limit 2;
c1	c2	c3	c4	c5
[0.323232,0.455656,0.564534]	[0.323232,0.455656,0.564534]	2	{"age": 18, "name": "a"}	18
[0.232335,0.232323,0.123242]	[0.232335,0.232323,0.123242]	1	{"age": 18, "name": "a"}	18
explain select * from t order by l2_distance(c1, '[1,1,1]') desc approx limit 2;
Query Plan
===================================================
|ID|OPERATOR       |NAME    |EST.ROWS|EST.TIME(us)|
---------------------------------------------------
|0 |TABLE FULL SCAN|t(idx_1)|1       |0|
===================================================
Outputs & filters:
-------------------------------------
  0 - output([t.c1], [t.c2], [t.c3], [t.c4], [column_conv(INT,PS:(11,0),NULL,cast(cast(json_unquote(json_extract(t.c4, '$.age')), BIGINT UNSIGNED(0, 0)),
       INT(-1, 0)))]), filter(nil), rowset=16
      access([t.c3], [t.c4], [t.c1], [t.c2]), partitions(p0)
      is_index_back=true, is_global_index=false, 
      123
select * from t order by l2_distance(c1, '[1,1,1]') desc approx limit 2;
c1	c2	c3	c4	c5
[0.323232,0.455656,0.564534]	[0.323232,0.455656,0.564534]	2	{"age": 18, "name": "a"}	18
[0.232335,0.232323,0.123242]	[0.232335,0.232323,0.123242]	1	{"age": 18, "name": "a"}	18
explain select * from t order by l2_distance(c1, '[1,1,1]') asc approx limit 2;
Query Plan
===================================================
|ID|OPERATOR       |NAME    |EST.ROWS|EST.TIME(us)|
---------------------------------------------------
|0 |TABLE FULL SCAN|t(idx_1)|1       |0|
===================================================
Outputs & filters:
-------------------------------------
  0 - output([t.c1], [t.c2], [t.c3], [t.c4], [column_conv(INT,PS:(11,0),NULL,cast(cast(json_unquote(json_extract(t.c4, '$.age')), BIGINT UNSIGNED(0, 0)),
       INT(-1, 0)))]), filter(nil), rowset=16
      access([t.c3], [t.c4], [t.c1], [t.c2]), partitions(p0)
      is_index_back=true, is_global_index=false, 
      123
select * from t order by l2_distance(c1, '[1,1,1]') asc approx limit 2;
c1	c2	c3	c4	c5
[0.323232,0.455656,0.564534]	[0.323232,0.455656,0.564534]	2	{"age": 18, "name": "a"}	18
[0.232335,0.232323,0.123242]	[0.232335,0.232323,0.123242]	1	{"age": 18, "name": "a"}	18
explain select * from t group by c5 having c5<30 order by l2_distance(c1, '[1,1,1]') approx limit 6;
Query Plan
=======================================================
|ID|OPERATOR           |NAME    |EST.ROWS|EST.TIME(us)|
-------------------------------------------------------
|0 |TOP-N SORT         |        |1       |0|
|1 |└─HASH GROUP BY    |        |1       |0|
|2 |  └─TABLE FULL SCAN|t(idx_1)|1       |0|
=======================================================
Outputs & filters:
-------------------------------------
  0 - output([t.c1], [t.c2], [t.c3], [t.c4], [column_conv(INT,PS:(11,0),NULL,cast(cast(json_unquote(json_extract(t.c4, '$.age')), BIGINT UNSIGNED(0, 0)),
       INT(-1, 0)))]), filter(nil), rowset=16
      sort_keys([l2_distance(t.c1, cast('[1,1,1]', ARRAY(18, -1))), ASC]), topn(6)
  1 - output([l2_distance(t.c1, cast('[1,1,1]', ARRAY(18, -1)))], [t.c1], [t.c2], [t.c3], [t.c4], [column_conv(INT,PS:(11,0),NULL,cast(cast(json_unquote(json_extract(t.c4,
       '$.age')), BIGINT UNSIGNED(0, 0)), INT(-1, 0)))]), filter([column_conv(INT,PS:(11,0),NULL,cast(cast(json_unquote(json_extract(t.c4, '$.age')), BIGINT UNSIGNED(0,
       0)), INT(-1, 0))) < 30]), rowset=16
      group([column_conv(INT,PS:(11,0),NULL,cast(cast(json_unquote(json_extract(t.c4, '$.age')), BIGINT UNSIGNED(0, 0)), INT(-1, 0)))]), agg_func(nil)
  2 - output([t.c3], [t.c4], [column_conv(INT,PS:(11,0),NULL,cast(cast(json_unquote(json_extract(t.c4, '$.age')), BIGINT UNSIGNED(0, 0)), INT(-1, 0)))],
       [t.c1], [t.c2], [l2_distance(t.c1, cast('[1,1,1]', ARRAY(18, -1)))]), filter(nil), rowset=16
      access([t.c3], [t.c4], [t.c1], [t.c2]), partitions(p0)
      is_index_back=true, is_global_index=false, 
      123
select * from t group by c5 having c5<30 order by l2_distance(c1, '[1,1,1]') approx limit 6;
c1	c2	c3	c4	c5
[0.323232,0.455656,0.564534]	[0.323232,0.455656,0.564534]	2	{"age": 18, "name": "a"}	18
[-0.978696,-0.456465,-0.123123]	[-0.978696,-0.456465,-0.123123]	3	{"age": 21, "name": "d"}	21
explain select * from t order by l2_distance(c1, '[1,1,1]') approx limit 2 for update;
Query Plan
=======================================================
|ID|OPERATOR           |NAME    |EST.ROWS|EST.TIME(us)|
-------------------------------------------------------
|0 |MATERIAL           |        |1       |0|
|1 |└─FOR UPDATE       |        |1       |0|
|2 |  └─TABLE FULL SCAN|t(idx_1)|1       |0|
=======================================================
Outputs & filters:
-------------------------------------
  0 - output([t.c1], [t.c2], [t.c3], [t.c4], [column_conv(INT,PS:(11,0),NULL,cast(cast(json_unquote(json_extract(t.c4, '$.age')), BIGINT UNSIGNED(0, 0)),
       INT(-1, 0)))]), filter(nil), rowset=16
  1 - output([t.c1], [t.c2], [t.c3], [t.c4], [column_conv(INT,PS:(11,0),NULL,cast(cast(json_unquote(json_extract(t.c4, '$.age')), BIGINT UNSIGNED(0, 0)),
       INT(-1, 0)))]), filter(nil), rowset=16
      lock tables(t)
  2 - output([t.c3], [t.c4], [column_conv(INT,PS:(11,0),NULL,cast(cast(json_unquote(json_extract(t.c4, '$.age')), BIGINT UNSIGNED(0, 0)), INT(-1, 0)))],
       [t.c1], [t.c2]), filter(nil), rowset=16
      access([t.c3], [t.c4], [t.c1], [t.c2]), partitions(p0)
      is_index_back=true, is_global_index=false, with_vid=true, 
      123
select * from t order by l2_distance(c1, '[1,1,1]') approx limit 2 for update;
c1	c2	c3	c4	c5
[0.323232,0.455656,0.564534]	[0.323232,0.455656,0.564534]	2	{"age": 18, "name": "a"}	18
[0.232335,0.232323,0.123242]	[0.232335,0.232323,0.123242]	1	{"age": 18, "name": "a"}	18
explain select * from t order by l2_distance(c1, '[1,1,1]') approx limit 2 lock in share mode;
Query Plan
=======================================================
|ID|OPERATOR           |NAME    |EST.ROWS|EST.TIME(us)|
-------------------------------------------------------
|0 |MATERIAL           |        |1       |0|
|1 |└─FOR UPDATE       |        |1       |0|
|2 |  └─TABLE FULL SCAN|t(idx_1)|1       |0|
=======================================================
Outputs & filters:
-------------------------------------
  0 - output([t.c1], [t.c2], [t.c3], [t.c4], [column_conv(INT,PS:(11,0),NULL,cast(cast(json_unquote(json_extract(t.c4, '$.age')), BIGINT UNSIGNED(0, 0)),
       INT(-1, 0)))]), filter(nil), rowset=16
  1 - output([t.c1], [t.c2], [t.c3], [t.c4], [column_conv(INT,PS:(11,0),NULL,cast(cast(json_unquote(json_extract(t.c4, '$.age')), BIGINT UNSIGNED(0, 0)),
       INT(-1, 0)))]), filter(nil), rowset=16
      lock tables(t)
  2 - output([t.c3], [t.c4], [column_conv(INT,PS:(11,0),NULL,cast(cast(json_unquote(json_extract(t.c4, '$.age')), BIGINT UNSIGNED(0, 0)), INT(-1, 0)))],
       [t.c1], [t.c2]), filter(nil), rowset=16
      access([t.c3], [t.c4], [t.c1], [t.c2]), partitions(p0)
      is_index_back=true, is_global_index=false, with_vid=true, 
      123
select * from t order by l2_distance(c1, '[1,1,1]') approx limit 2 lock in share mode;
c1	c2	c3	c4	c5
[0.323232,0.455656,0.564534]	[0.323232,0.455656,0.564534]	2	{"age": 18, "name": "a"}	18
[0.232335,0.232323,0.123242]	[0.232335,0.232323,0.123242]	1	{"age": 18, "name": "a"}	18
explain select * from t where l2_distance(c1, '[1,1,1]') < 10 order by l2_distance(c1, '[1,1,1]') approx limit 2;
Query Plan
=====================================================
|ID|OPERATOR         |NAME    |EST.ROWS|EST.TIME(us)|
-----------------------------------------------------
|0 |TOP-N SORT       |        |1       |0|
|1 |└─TABLE FULL SCAN|t(idx_1)|1       |0|
=====================================================
Outputs & filters:
-------------------------------------
  0 - output([t.c1], [t.c2], [t.c3], [t.c4], [column_conv(INT,PS:(11,0),NULL,cast(cast(json_unquote(json_extract(t.c4, '$.age')), BIGINT UNSIGNED(0, 0)),
       INT(-1, 0)))]), filter(nil), rowset=16
      sort_keys([l2_distance(t.c1, cast('[1,1,1]', ARRAY(18, -1))), ASC]), topn(2)
  1 - output([t.c3], [t.c4], [column_conv(INT,PS:(11,0),NULL,cast(cast(json_unquote(json_extract(t.c4, '$.age')), BIGINT UNSIGNED(0, 0)), INT(-1, 0)))],
       [t.c1], [t.c2], [l2_distance(t.c1, cast('[1,1,1]', ARRAY(18, -1)))]), filter([l2_distance(t.c1, cast('[1,1,1]', ARRAY(18, -1))) < cast(10, DOUBLE(-1, -1))]), rowset=16
      access([t.c3], [t.c4], [t.c1], [t.c2]), partitions(p0)
      is_index_back=true, is_global_index=false, filter_before_indexback[false], 
      123
select * from t where l2_distance(c1, '[1,1,1]') < 10 and c3 >1 order by l2_distance(c1, '[1,1,1]') approx limit 2;
c1	c2	c3	c4	c5
[0.323232,0.455656,0.564534]	[0.323232,0.455656,0.564534]	2	{"age": 18, "name": "a"}	18
explain select * from t where l2_distance(c1, '[1,1,1]') between 1 and 10 order by l2_distance(c1, '[1,1,1]') approx limit 2;
Query Plan
=====================================================
|ID|OPERATOR         |NAME    |EST.ROWS|EST.TIME(us)|
-----------------------------------------------------
|0 |TOP-N SORT       |        |1       |0|
|1 |└─TABLE FULL SCAN|t(idx_1)|1       |0|
=====================================================
Outputs & filters:
-------------------------------------
  0 - output([t.c1], [t.c2], [t.c3], [t.c4], [column_conv(INT,PS:(11,0),NULL,cast(cast(json_unquote(json_extract(t.c4, '$.age')), BIGINT UNSIGNED(0, 0)),
       INT(-1, 0)))]), filter(nil), rowset=16
      sort_keys([l2_distance(t.c1, cast('[1,1,1]', ARRAY(18, -1))), ASC]), topn(2)
  1 - output([t.c3], [t.c4], [column_conv(INT,PS:(11,0),NULL,cast(cast(json_unquote(json_extract(t.c4, '$.age')), BIGINT UNSIGNED(0, 0)), INT(-1, 0)))],
       [t.c1], [t.c2], [l2_distance(t.c1, cast('[1,1,1]', ARRAY(18, -1)))]), filter([l2_distance(t.c1, cast('[1,1,1]', ARRAY(18, -1))) >= cast(1, DOUBLE(-1, -1))],
       [l2_distance(t.c1, cast('[1,1,1]', ARRAY(18, -1))) <= cast(10, DOUBLE(-1, -1))]), rowset=16
      access([t.c3], [t.c4], [t.c1], [t.c2]), partitions(p0)
      is_index_back=true, is_global_index=false, filter_before_indexback[false,false], 
      123
select * from t where l2_distance(c1, '[1,1,1]') between 1 and 10 order by l2_distance(c1, '[1,1,1]') approx limit 2;
c1	c2	c3	c4	c5
[0.232335,0.232323,0.123242]	[0.232335,0.232323,0.123242]	1	{"age": 18, "name": "a"}	18
explain select * from t where json_value(c4, '$.name') like 'a' order by l2_distance(c1, '[1,1,1]') approx limit 2;
Query Plan
=====================================================
|ID|OPERATOR         |NAME    |EST.ROWS|EST.TIME(us)|
-----------------------------------------------------
|0 |TOP-N SORT       |        |1       |0|
|1 |└─TABLE FULL SCAN|t(idx_1)|1       |0|
=====================================================
Outputs & filters:
-------------------------------------
  0 - output([t.c1], [t.c2], [t.c3], [t.c4], [column_conv(INT,PS:(11,0),NULL,cast(cast(json_unquote(json_extract(t.c4, '$.age')), BIGINT UNSIGNED(0, 0)),
       INT(-1, 0)))]), filter(nil), rowset=16
      sort_keys([l2_distance(t.c1, cast('[1,1,1]', ARRAY(18, -1))), ASC]), topn(2)
  1 - output([t.c3], [t.c4], [column_conv(INT,PS:(11,0),NULL,cast(cast(json_unquote(json_extract(t.c4, '$.age')), BIGINT UNSIGNED(0, 0)), INT(-1, 0)))],
       [t.c1], [t.c2], [l2_distance(t.c1, cast('[1,1,1]', ARRAY(18, -1)))]), filter([(T_OP_LIKE, json_value(t.c4, '$.name', 2199026204695, 0, 0, 3, NULL, 3, NULL,
       3, 3), 'a', '\\')]), rowset=16
      access([t.c3], [t.c4], [t.c1], [t.c2]), partitions(p0)
      is_index_back=true, is_global_index=false, filter_before_indexback[false], 
      123
select * from t where json_value(c4, '$.name') like 'a' order by l2_distance(c1, '[1,1,1]') approx limit 2;
c1	c2	c3	c4	c5
[0.323232,0.455656,0.564534]	[0.323232,0.455656,0.564534]	2	{"age": 18, "name": "a"}	18
[0.232335,0.232323,0.123242]	[0.232335,0.232323,0.123242]	1	{"age": 18, "name": "a"}	18
explain select * from t where exists(select c3 from t where c3>2) order by l2_distance(c1, '[1,1,1]') approx limit 2;
Query Plan
========================================================
|ID|OPERATOR            |NAME    |EST.ROWS|EST.TIME(us)|
--------------------------------------------------------
|0 |TOP-N SORT          |        |1       |0|
|1 |└─SUBPLAN FILTER    |        |1       |0|
|2 |  ├─TABLE FULL SCAN |t(idx_1)|1       |0|
|3 |  └─TABLE RANGE SCAN|t       |2       |0|
========================================================
Outputs & filters:
-------------------------------------
  0 - output([t.c1], [t.c2], [t.c3], [t.c4], [column_conv(INT,PS:(11,0),NULL,cast(cast(json_unquote(json_extract(t.c4, '$.age')), BIGINT UNSIGNED(0, 0)),
       INT(-1, 0)))]), filter(nil), rowset=16
      sort_keys([l2_distance(t.c1, cast('[1,1,1]', ARRAY(18, -1))), ASC]), topn(2)
  1 - output([l2_distance(t.c1, cast('[1,1,1]', ARRAY(18, -1)))], [t.c1], [t.c2], [t.c3], [t.c4], [column_conv(INT,PS:(11,0),NULL,cast(cast(json_unquote(json_extract(t.c4,
       '$.age')), BIGINT UNSIGNED(0, 0)), INT(-1, 0)))]), filter(nil), rowset=16
      exec_params_(nil), onetime_exprs_([(T_OP_EXISTS, subquery(1))(:0)]), init_plan_idxs_(nil), use_batch=false
  2 - output([t.c3], [t.c4], [column_conv(INT,PS:(11,0),NULL,cast(cast(json_unquote(json_extract(t.c4, '$.age')), BIGINT UNSIGNED(0, 0)), INT(-1, 0)))],
       [t.c1], [t.c2], [l2_distance(t.c1, cast('[1,1,1]', ARRAY(18, -1)))]), filter(nil), startup_filter([:0]), rowset=16
      access([t.c3], [t.c4], [t.c1], [t.c2]), partitions(p0)
      is_index_back=true, is_global_index=false, 
      123
  3 - output([t.c3]), filter(nil), rowset=16
      access([t.c3]), partitions(p0)
      is_index_back=false, is_global_index=false, 
      range_key([t.c3]), range(2 ; MAX), 
      range_cond([t.c3 > 2])
select * from t where exists(select c3 from t where c3>2) order by l2_distance(c1, '[1,1,1]') approx limit 2;
c1	c2	c3	c4	c5
[0.323232,0.455656,0.564534]	[0.323232,0.455656,0.564534]	2	{"age": 18, "name": "a"}	18
[0.232335,0.232323,0.123242]	[0.232335,0.232323,0.123242]	1	{"age": 18, "name": "a"}	18
drop table if exists t;
create table t(c1 vector(3), c2 int, primary key(c2), vector index idx_1(c1) with (distance=l2,type=hnsw));
insert into t values('[1,1,1]',1),('[2,2,2]',2);
explain select * from t order by l1_distance(c1, [0,1,1]) limit 1;
Query Plan
=================================================
|ID|OPERATOR         |NAME|EST.ROWS|EST.TIME(us)|
-------------------------------------------------
|0 |TOP-N SORT       |    |1       |0|
|1 |└─TABLE FULL SCAN|t   |2       |0|
=================================================
Outputs & filters:
-------------------------------------
  0 - output([t.c1], [t.c2]), filter(nil), rowset=16
      sort_keys([l1_distance(t.c1, cast(array(0, 1, 1), ARRAY(18, -1))), ASC]), topn(1)
  1 - output([t.c2], [t.c1]), filter(nil), rowset=16
      access([t.c2], [t.c1]), partitions(p0)
      is_index_back=false, is_global_index=false, 
      123
select * from t order by l1_distance(c1, [0,1,1]) limit 1;
c1	c2
[1,1,1]	1
drop table if exists t;
create table t(c1 vector(3), c2 int, primary key(c2), vector index idx_1(c1) with (distance=l2,type=hnsw));
insert into t values('[1,1,1]',1),('[2,2,2]',2);
drop table if exists t;
drop table if exists t1;
======================
=  vector index dml  =
======================
alter system ob_vector_memory_limit_percentage=30;
insert
drop table if exists t;
Warnings:
Note	1051	Unknown table 'test.t'
create table t(c1 vector(3), c2 array(float), c3 int auto_increment, primary key(c3), vector index idx_1(c1) with (distance=l2, type=hnsw));
drop procedure if exists pl1;
create procedure pl1(ll int)
begin
set @x=1;
set @y=1;
repeat
insert into t values (concat('[',1,',',1,',',@x,']'), concat('[',1,',',1,',',@y,']'), default);
set @x=@x+1;
set @y=@y+1;
until @x>ll end repeat;
end //
call pl1(100);
create vector index idx_2 on t(c2) with (distance=l2, type=hnsw);
ERROR 0A000: Not supported feature or function
SELECT
CASE
WHEN 8 !=
(SELECT COUNT(*)
FROM (
SELECT *
FROM t
ORDER BY l2_distance(c1, [1,8,30]) APPROXIMATE
LIMIT 8) AS tmp1
JOIN
(SELECT *
FROM t
ORDER BY l2_distance(c1, [1,8,30])
LIMIT 8) AS tmp2
ON tmp1.c3 = tmp2.c3)
THEN '有问题'
        ELSE '没问题'
    END AS result;
result
有问题
insert into t values ([1,1,101],[1,1,101],101),('[1,1,102]',[1,1,102],102),('[1,1,103]','[1,1,103]',103);
select * from t;
c1	c2	c3
[1,1,1]	[1,1,1]	1
[1,1,2]	[1,1,2]	2
[1,1,3]	[1,1,3]	3
[1,1,4]	[1,1,4]	4
[1,1,5]	[1,1,5]	5
[1,1,6]	[1,1,6]	6
[1,1,7]	[1,1,7]	7
[1,1,8]	[1,1,8]	8
[1,1,9]	[1,1,9]	9
[1,1,10]	[1,1,10]	10
[1,1,11]	[1,1,11]	11
[1,1,12]	[1,1,12]	12
[1,1,13]	[1,1,13]	13
[1,1,14]	[1,1,14]	14
[1,1,15]	[1,1,15]	15
[1,1,16]	[1,1,16]	16
[1,1,17]	[1,1,17]	17
[1,1,18]	[1,1,18]	18
[1,1,19]	[1,1,19]	19
[1,1,20]	[1,1,20]	20
[1,1,21]	[1,1,21]	21
[1,1,22]	[1,1,22]	22
[1,1,23]	[1,1,23]	23
[1,1,24]	[1,1,24]	24
[1,1,25]	[1,1,25]	25
[1,1,26]	[1,1,26]	26
[1,1,27]	[1,1,27]	27
[1,1,28]	[1,1,28]	28
[1,1,29]	[1,1,29]	29
[1,1,30]	[1,1,30]	30
[1,1,31]	[1,1,31]	31
[1,1,32]	[1,1,32]	32
[1,1,33]	[1,1,33]	33
[1,1,34]	[1,1,34]	34
[1,1,35]	[1,1,35]	35
[1,1,36]	[1,1,36]	36
[1,1,37]	[1,1,37]	37
[1,1,38]	[1,1,38]	38
[1,1,39]	[1,1,39]	39
[1,1,40]	[1,1,40]	40
[1,1,41]	[1,1,41]	41
[1,1,42]	[1,1,42]	42
[1,1,43]	[1,1,43]	43
[1,1,44]	[1,1,44]	44
[1,1,45]	[1,1,45]	45
[1,1,46]	[1,1,46]	46
[1,1,47]	[1,1,47]	47
[1,1,48]	[1,1,48]	48
[1,1,49]	[1,1,49]	49
[1,1,50]	[1,1,50]	50
[1,1,51]	[1,1,51]	51
[1,1,52]	[1,1,52]	52
[1,1,53]	[1,1,53]	53
[1,1,54]	[1,1,54]	54
[1,1,55]	[1,1,55]	55
[1,1,56]	[1,1,56]	56
[1,1,57]	[1,1,57]	57
[1,1,58]	[1,1,58]	58
[1,1,59]	[1,1,59]	59
[1,1,60]	[1,1,60]	60
[1,1,61]	[1,1,61]	61
[1,1,62]	[1,1,62]	62
[1,1,63]	[1,1,63]	63
[1,1,64]	[1,1,64]	64
[1,1,65]	[1,1,65]	65
[1,1,66]	[1,1,66]	66
[1,1,67]	[1,1,67]	67
[1,1,68]	[1,1,68]	68
[1,1,69]	[1,1,69]	69
[1,1,70]	[1,1,70]	70
[1,1,71]	[1,1,71]	71
[1,1,72]	[1,1,72]	72
[1,1,73]	[1,1,73]	73
[1,1,74]	[1,1,74]	74
[1,1,75]	[1,1,75]	75
[1,1,76]	[1,1,76]	76
[1,1,77]	[1,1,77]	77
[1,1,78]	[1,1,78]	78
[1,1,79]	[1,1,79]	79
[1,1,80]	[1,1,80]	80
[1,1,81]	[1,1,81]	81
[1,1,82]	[1,1,82]	82
[1,1,83]	[1,1,83]	83
[1,1,84]	[1,1,84]	84
[1,1,85]	[1,1,85]	85
[1,1,86]	[1,1,86]	86
[1,1,87]	[1,1,87]	87
[1,1,88]	[1,1,88]	88
[1,1,89]	[1,1,89]	89
[1,1,90]	[1,1,90]	90
[1,1,91]	[1,1,91]	91
[1,1,92]	[1,1,92]	92
[1,1,93]	[1,1,93]	93
[1,1,94]	[1,1,94]	94
[1,1,95]	[1,1,95]	95
[1,1,96]	[1,1,96]	96
[1,1,97]	[1,1,97]	97
[1,1,98]	[1,1,98]	98
[1,1,99]	[1,1,99]	99
[1,1,100]	[1,1,100]	100
[1,1,101]	[1,1,101]	101
[1,1,102]	[1,1,102]	102
[1,1,103]	[1,1,103]	103
insert ignore
insert ignore into t values ([1,1,101],[1,1,101],104),([1,1,106],[1,1,106],103),([1,1,105],[1,1,105],105);
select * from t;
c1	c2	c3
[1,1,1]	[1,1,1]	1
[1,1,2]	[1,1,2]	2
[1,1,3]	[1,1,3]	3
[1,1,4]	[1,1,4]	4
[1,1,5]	[1,1,5]	5
[1,1,6]	[1,1,6]	6
[1,1,7]	[1,1,7]	7
[1,1,8]	[1,1,8]	8
[1,1,9]	[1,1,9]	9
[1,1,10]	[1,1,10]	10
[1,1,11]	[1,1,11]	11
[1,1,12]	[1,1,12]	12
[1,1,13]	[1,1,13]	13
[1,1,14]	[1,1,14]	14
[1,1,15]	[1,1,15]	15
[1,1,16]	[1,1,16]	16
[1,1,17]	[1,1,17]	17
[1,1,18]	[1,1,18]	18
[1,1,19]	[1,1,19]	19
[1,1,20]	[1,1,20]	20
[1,1,21]	[1,1,21]	21
[1,1,22]	[1,1,22]	22
[1,1,23]	[1,1,23]	23
[1,1,24]	[1,1,24]	24
[1,1,25]	[1,1,25]	25
[1,1,26]	[1,1,26]	26
[1,1,27]	[1,1,27]	27
[1,1,28]	[1,1,28]	28
[1,1,29]	[1,1,29]	29
[1,1,30]	[1,1,30]	30
[1,1,31]	[1,1,31]	31
[1,1,32]	[1,1,32]	32
[1,1,33]	[1,1,33]	33
[1,1,34]	[1,1,34]	34
[1,1,35]	[1,1,35]	35
[1,1,36]	[1,1,36]	36
[1,1,37]	[1,1,37]	37
[1,1,38]	[1,1,38]	38
[1,1,39]	[1,1,39]	39
[1,1,40]	[1,1,40]	40
[1,1,41]	[1,1,41]	41
[1,1,42]	[1,1,42]	42
[1,1,43]	[1,1,43]	43
[1,1,44]	[1,1,44]	44
[1,1,45]	[1,1,45]	45
[1,1,46]	[1,1,46]	46
[1,1,47]	[1,1,47]	47
[1,1,48]	[1,1,48]	48
[1,1,49]	[1,1,49]	49
[1,1,50]	[1,1,50]	50
[1,1,51]	[1,1,51]	51
[1,1,52]	[1,1,52]	52
[1,1,53]	[1,1,53]	53
[1,1,54]	[1,1,54]	54
[1,1,55]	[1,1,55]	55
[1,1,56]	[1,1,56]	56
[1,1,57]	[1,1,57]	57
[1,1,58]	[1,1,58]	58
[1,1,59]	[1,1,59]	59
[1,1,60]	[1,1,60]	60
[1,1,61]	[1,1,61]	61
[1,1,62]	[1,1,62]	62
[1,1,63]	[1,1,63]	63
[1,1,64]	[1,1,64]	64
[1,1,65]	[1,1,65]	65
[1,1,66]	[1,1,66]	66
[1,1,67]	[1,1,67]	67
[1,1,68]	[1,1,68]	68
[1,1,69]	[1,1,69]	69
[1,1,70]	[1,1,70]	70
[1,1,71]	[1,1,71]	71
[1,1,72]	[1,1,72]	72
[1,1,73]	[1,1,73]	73
[1,1,74]	[1,1,74]	74
[1,1,75]	[1,1,75]	75
[1,1,76]	[1,1,76]	76
[1,1,77]	[1,1,77]	77
[1,1,78]	[1,1,78]	78
[1,1,79]	[1,1,79]	79
[1,1,80]	[1,1,80]	80
[1,1,81]	[1,1,81]	81
[1,1,82]	[1,1,82]	82
[1,1,83]	[1,1,83]	83
[1,1,84]	[1,1,84]	84
[1,1,85]	[1,1,85]	85
[1,1,86]	[1,1,86]	86
[1,1,87]	[1,1,87]	87
[1,1,88]	[1,1,88]	88
[1,1,89]	[1,1,89]	89
[1,1,90]	[1,1,90]	90
[1,1,91]	[1,1,91]	91
[1,1,92]	[1,1,92]	92
[1,1,93]	[1,1,93]	93
[1,1,94]	[1,1,94]	94
[1,1,95]	[1,1,95]	95
[1,1,96]	[1,1,96]	96
[1,1,97]	[1,1,97]	97
[1,1,98]	[1,1,98]	98
[1,1,99]	[1,1,99]	99
[1,1,100]	[1,1,100]	100
[1,1,101]	[1,1,101]	101
[1,1,102]	[1,1,102]	102
[1,1,103]	[1,1,103]	103
[1,1,101]	[1,1,101]	104
[1,1,105]	[1,1,105]	105
set ob_enable_index_direct_select=1;
count(*)
105
count(*)
0
count(*)
0
call dbms_vector.refresh_index('idx_1', 't');
call dbms_vector.refresh_index('idx_1', 't', 'c1', 1, 'FAST');
truncate t;
insert into t values ([1,1,101],[1,1,101],101),('[1,1,102]',[1,1,102],102),('[1,1,103]','[1,1,103]',103);
call pl1(100);
count(*)
103
count(*)
0
count(*)
0
call dbms_vector.rebuild_index('idx_1', 't', 'c1');
count(*)
0
count(*)
0
count(*)
1
on duplicate key update
truncate t;
insert into t values ([1,1,1],[1,1,1],1),([2,2,2],[2,2,2],2),([3,3,3],[3,3,3],3);
insert into t values ([4,4,4],[4,4,4],1) on duplicate key update c3=4;
select * from t;
c1	c2	c3
[2,2,2]	[2,2,2]	2
[3,3,3]	[3,3,3]	3
[1,1,1]	[1,1,1]	4
insert into t values ([4,4,4],[4,4,4],4) on duplicate key update c1=[4,4,4], c2=[4,4,4];
select * from t;
c1	c2	c3
[2,2,2]	[2,2,2]	2
[3,3,3]	[3,3,3]	3
[4,4,4]	[4,4,4]	4
insert into t values ([5,5,5],[5,5,5],4), ([6,6,6],[6,6,6],4) on duplicate key update c3=5;
insert partition
drop table if exists t;
create table t(c1 vector(3), c2 array(float), c3 int auto_increment, c4 timestamp, primary key(c3, c4), vector index idx_1(c1) with (distance=l2, type=hnsw)) partition by range(unix_timestamp(c4)) (partition p0 values less than (unix_timestamp('2010-01-01')), partition p1 values less than(unix_timestamp('2020-01-01')));
drop procedure if exists pl1;
create procedure pl1(ll int)
begin
set @x=1;
repeat
set @y=floor(2000 + rand() * 20);
set @m=floor(rand() * 12) + 1;
set @n=floor(rand() * 28) + 1;
set @a=floor(rand() * 100) + 1;
set @b=floor(rand() * 100) + 1;
set @c=floor(rand() * 100) + 1;
set @d=floor(rand() * 100) + 1;
set @e=floor(rand() * 100) + 1;
set @f=floor(rand() * 100) + 1;
insert into t values (concat('[',@a,',',@b,',',@c,']'), concat('[',@d,',',@e,',',@f,']'), default, concat(@y,'-', @m,'-', @n));
set @x=@x+1;
until @x>100 end repeat;
end //
call pl1(100);
insert into t partition(p1) values ('[1,1,101]', [1,1,2014], default, '2014-09-17'), ('[1,1,101]', [1,1,2014], default, '2014-09-17');
call dbms_vector.refresh_index('idx_1', 't', 'c1', 1, 'FAST');
count(*)
0
count(*)
102
call dbms_vector.rebuild_index('idx_1', 't', 'c1');
count(*)
0
count(*)
0
direct()
drop table if exists t;
drop table if exists t1;
drop table if exists t2;
create table t(c1 vector(3), c2 array(float), c3 int auto_increment, c4 timestamp, primary key(c3, c4), vector index idx_1(c1) with (distance=l2, type=hnsw)) partition by range(unix_timestamp(c4)) (partition p0 values less than (unix_timestamp('2010-01-01')), partition p1 values less than(unix_timestamp('2020-01-01')));
create table t1(c1 vector(3), c2 array(float), c3 int auto_increment, c4 timestamp, primary key(c3, c4), vector index idx_1(c1) with (distance=l2, type=hnsw)) partition by range(unix_timestamp(c4)) (partition p0 values less than (unix_timestamp('2010-01-01')), partition p1 values less than(unix_timestamp('2020-01-01')));
create table  t2(c1 vector(3), c2 array(float), c3 int auto_increment, c4 timestamp, primary key(c3, c4), vector index idx_1(c1) with (distance=l2, type=hnsw));
insert into t1 values('[1,1,101]', [1,1,2014], default, '2014-10-17'), ('[1,1,101]', [1,1,2014], default, '2014-11-17');
insert into t2 values('[1,1,101]', [1,1,2014], default, '2014-09-17'), ('[1,1,101]', [1,1,2014], default, '2014-09-17');
alter table t1 modify c3 int;
explain extended insert /*+ direct(true, 100, 'full') enable_parallel_dml parallel(16)*/ into t1 select * from t;
ERROR 0A000: direct-load does not support table has generated column
insert /*+ direct(true, 100, 'full') enable_parallel_dml parallel(16)*/ into t1 select * from t;
ERROR 0A000: direct-load does not support table has generated column
drop index idx_1 on t1;
insert /*+ direct(true, 100, 'full') enable_parallel_dml parallel(16)*/ into t1 select * from t;
select count(*) from t join t1 on t.c1=t1.c1 and t.c2=t1.c2 and t.c3=t1.c3 and t.c4=t1.c4;
count(*)
0
explain extended insert /*+ direct(true, 10, 'inc') enable_parallel_dml parallel(2)*/ into t1 select * from t2;
Query Plan
=================================================================================
|ID|OPERATOR                              |NAME           |EST.ROWS|EST.TIME(us)|
---------------------------------------------------------------------------------
|0 |PX COORDINATOR                        |               |2       |0|
|1 |└─EXCHANGE OUT DISTR                  |:EX10001       |2       |0|
|2 |  └─INSERT                            |               |2       |0|
|3 |    └─EXCHANGE IN DISTR               |               |2       |0|
|4 |      └─EXCHANGE OUT DISTR (PKEY HASH)|:EX10000       |2       |0|
|5 |        └─SUBPLAN SCAN                |ANONYMOUS_VIEW1|2       |0|
|6 |          └─PX BLOCK ITERATOR         |               |2       |0|
|7 |            └─TABLE FULL SCAN         |t2             |2       |0|
=================================================================================
Outputs & filters:
-------------------------------------
  0 - output(nil), filter(nil), rowset=16
  1 - output(nil), filter(nil), rowset=16
      dop=2
  2 - output(nil), filter(nil), rowset=16
      columns([{t1: ({t1: (t1.c3(), t1.c4(), t1.c1(), t1.c2())})}]), partitions(p[0-1]), 
      column_values([column_conv(INT,PS:(11,0),NOT NULL,ANONYMOUS_VIEW1.c3())()], [column_conv(TIMESTAMP,PS:(19,0),NOT NULL,
      timestamp_nvl(ANONYMOUS_VIEW1.c4(), cast(current_timestamp()(), TIMESTAMP(19, 0))())())()],
       [column_conv(ARRAY,PS:(-1,-1),NULL,ANONYMOUS_VIEW1.c1())()], [column_conv(ARRAY,PS:(-1,-1),NULL,ANONYMOUS_VIEW1.c2())()])
  3 - output([PARTITION_ID()], [column_conv(INT,PS:(11,0),NOT NULL,ANONYMOUS_VIEW1.c3())()], [column_conv(TIMESTAMP,
      PS:(19,0),NOT NULL,timestamp_nvl(ANONYMOUS_VIEW1.c4(), cast(current_timestamp()(), TIMESTAMP(19, 0))())())()],
       [ANONYMOUS_VIEW1.c1()], [ANONYMOUS_VIEW1.c2()]), filter(nil), rowset=16
  4 - output([PARTITION_ID()], [column_conv(INT,PS:(11,0),NOT NULL,ANONYMOUS_VIEW1.c3())()], [column_conv(TIMESTAMP,
      PS:(19,0),NOT NULL,timestamp_nvl(ANONYMOUS_VIEW1.c4(), cast(current_timestamp()(), TIMESTAMP(19, 0))())())()],
       [ANONYMOUS_VIEW1.c1()], [ANONYMOUS_VIEW1.c2()]), filter(nil), rowset=16
      (#keys=1, [unix_timestamp(column_conv(TIMESTAMP,PS:(19,0),NOT NULL,timestamp_nvl(ANONYMOUS_VIEW1.c4(), cast(current_timestamp()(),
       TIMESTAMP(19, 0))())())())()]), dop=2
  5 - output([ANONYMOUS_VIEW1.c1()], [ANONYMOUS_VIEW1.c2()], [ANONYMOUS_VIEW1.c3()], [ANONYMOUS_VIEW1.c4()]), filter(nil), rowset=16
      access([ANONYMOUS_VIEW1.c1()], [ANONYMOUS_VIEW1.c2()], [ANONYMOUS_VIEW1.c3()], [ANONYMOUS_VIEW1.c4()])
  6 - output([t2.c1()], [t2.c2()], [t2.c3()], [t2.c4()]), filter(nil), rowset=16
  7 - output([t2.c3()], [t2.c4()], [t2.c1()], [t2.c2()]), filter(nil), rowset=16
      access([t2.c3()], [t2.c4()], [t2.c1()], [t2.c2()]), partitions(p0)
      is_index_back=false, is_global_index=false, 
      range_key([t2.c3()], [t2.c4()]), range(MIN,MIN ; MAX,MAX)always true
Used Hint:
-------------------------------------
  /*+
      
      PARALLEL(2)
      ENABLE_PARALLEL_DML
      DIRECT(TRUE, 10, 'INC')
  */
Qb name trace:
-------------------------------------
  stmt_id:0, stmt_type:T_EXPLAIN 
  stmt_id:1, INS$1 > INS$B2DE4D68
  stmt_id:2, SEL$1
Outline Data: 
-------------------------------------
  /*+
      BEGIN_OUTLINE_DATA
      PARALLEL(@"SEL$1" "test"."t2"@"SEL$1" 2)
      FULL(@"SEL$1" "test"."t2"@"SEL$1")
      PRED_DEDUCE(@"INS$1")
      PARALLEL(2)
      ENABLE_PARALLEL_DML
      OPTIMIZER_FEATURES_ENABLE('')
      DIRECT(TRUE, 10, 'INC')
      END_OUTLINE_DATA
  */
Optimization Info:
-------------------------------------
  t2:
      table_rows:2
      physical_range_rows:2
      logical_range_rows:2
      index_back_rows:0
      output_rows:2
      table_dop:2
      dop_method:Global DOP
      avaiable_index_name:[idx_1, rowkey_vid_table, vid_rowkey_table, idx_1_index_id_table, idx_1_index_snapshot_data_table, t2]
      pruned_index_name:[idx_1, rowkey_vid_table, vid_rowkey_table, idx_1_index_id_table, idx_1_index_snapshot_data_table]
      stats info:[version=1970-01-01 08:00:00.000000, is_locked=0, is_expired=0]
      dynamic sampling level:0
      estimation method:[DEFAULT, STORAGE]
  Plan Type:
      DISTRIBUTED
  Note:
      Degree of Parallelism is 2 because of hint
      Direct-mode inc is enabled in insert into select
insert /*+ direct(true, 10, 'inc') enable_parallel_dml parallel(2)*/ into t1 select * from t2;
select count(*) from t2 join t1 on t2.c1=t1.c1 and t2.c2=t1.c2 and t2.c3=t1.c3 and t2.c4=t1.c4;
count(*)
2
create vector index idx_1 on t1(c1) with (distance=l2, type=hnsw);
explain select * from t1 order by l2_distance(c1, '[1,2,30]') approx limit 8;
Query Plan
==================================================================
|ID|OPERATOR                     |NAME     |EST.ROWS|EST.TIME(us)|
------------------------------------------------------------------
|0 |LIMIT                        |         |1       |0|
|1 |└─PX COORDINATOR MERGE SORT  |         |1       |0|
|2 |  └─EXCHANGE OUT DISTR       |:EX10000 |1       |0|
|3 |    └─TOP-N SORT             |         |1       |0|
|4 |      └─PX PARTITION ITERATOR|         |1       |0|
|5 |        └─TABLE FULL SCAN    |t1(idx_1)|1       |0|
==================================================================
Outputs & filters:
-------------------------------------
  0 - output([t1.c1], [t1.c2], [t1.c3], [t1.c4]), filter(nil), rowset=16
      limit(8), offset(nil)
  1 - output([t1.c1], [t1.c2], [t1.c3], [t1.c4]), filter(nil), rowset=16
      sort_keys([l2_distance(t1.c1, cast('[1,2,30]', ARRAY(18, -1))), ASC])
  2 - output([t1.c1], [t1.c2], [t1.c3], [t1.c4], [l2_distance(t1.c1, cast('[1,2,30]', ARRAY(18, -1)))]), filter(nil), rowset=16
      dop=1
  3 - output([t1.c1], [t1.c2], [t1.c3], [t1.c4], [l2_distance(t1.c1, cast('[1,2,30]', ARRAY(18, -1)))]), filter(nil), rowset=16
      sort_keys([l2_distance(t1.c1, cast('[1,2,30]', ARRAY(18, -1))), ASC]), topn(8)
  4 - output([t1.c3], [t1.c4], [t1.c1], [t1.c2], [l2_distance(t1.c1, cast('[1,2,30]', ARRAY(18, -1)))]), filter(nil), rowset=16
      force partition granule
  5 - output([t1.c3], [t1.c4], [t1.c1], [t1.c2], [l2_distance(t1.c1, cast('[1,2,30]', ARRAY(18, -1)))]), filter(nil), rowset=16
      access([t1.c3], [t1.c4], [t1.c1], [t1.c2]), partitions(p[0-1])
      is_index_back=true, is_global_index=false, 
      123
select * from t1 order by l2_distance(c1, '[1,2,30]') approx limit 8;
c1	c2	c3	c4
[1,1,101]	[1,1,2014]	1	2014-09-17 00:00:00
[1,1,101]	[1,1,2014]	1	2014-10-17 00:00:00
[1,1,101]	[1,1,2014]	2	2014-09-17 00:00:00
[1,1,101]	[1,1,2014]	2	2014-11-17 00:00:00
call dbms_vector.refresh_index('idx_1', 't', 'c1', 1, 'FAST');
count(*)
0
count(*)
0
load data
drop table if exists t;
drop table if exists t1;
create table t(c1 vector(3), c2 array(float), c3 int primary key);
insert into t values('[1,1,101]', [1,1,2014], 1), ('[1,1,101]', [1,1,2014], 2);
select * into outfile '/data/1/test.file1' from t;
create table t1 like t;
load data /*+ direct(true, 100, 'full') parallel(10)*/ infile '/data/1/test.file1' into table t1;
ERROR 0A000: Not supported feature or function
select count(*) from t join t1 on t.c1=t1.c1 and t.c2=t1.c2 and t.c3=t1.c3;
count(*)
0
truncate t1;
load data /*+ direct(true, 100, 'inc') parallel(10)*/ infile '/data/1/test.file1' into table t1;
ERROR 0A000: Not supported feature or function
select count(*) from t join t1 on t.c1=t1.c1 and t.c2=t1.c2 and t.c3=t1.c3;
count(*)
0
select * into outfile '/data/1/test.file1' from t;
drop table t1;
create table t1 like t;
load data /*+ direct(true, 100, 'full') parallel(10)*/ infile '/data/1/test.file1' into table t1;
ERROR 0A000: Not supported feature or function
select count(*) from t join t1 on t.c1=t1.c1 and t.c2=t1.c2 and t.c3=t1.c3;
count(*)
0
truncate t1;
insert into view
drop table if exists t;
create table t(c1 vector(3), c2 array(float), c3 int auto_increment, c4 timestamp, primary key(c3, c4), vector index idx_1(c1) with (distance=l2, type=hnsw)) partition by range(unix_timestamp(c4)) (partition p0 values less than (unix_timestamp('2010-01-01')), partition p1 values less than(unix_timestamp('2020-01-01')));
call pl1(100);
drop view if exists v;
drop materialized view if exists m;
create view v as select * from t order by l2_distance(c1, '[1,2,30]') approx limit 10;
create materialized view m refresh complete on demand as select * from t order by l2_distance(c1, '[1,2,10]') approx limit 10;
insert into v values('[1,1,105]', [1,1,1090], default, '2018-9-19');
ERROR HY000: The target table v of the INSERT is not insertable-into
insert into m values('[1,1,105]', [1,1,1090], default, '2019-9-18');
ERROR 0A000: DML operation on materialized view (log) is not supported
drop view if exists v1;
create view v1 as select * from t where c3>100;
insert into v1 values('[1,1,105]', [1,1,1090], default, '2019-9-18');
drop materialized view if exists m1;
create materialized view m1 refresh complete on demand as select * from t where c3>100;
insert into m1 values('[1,1,105]', [1,1,1090], default, '2019-9-18');
ERROR 0A000: DML operation on materialized view (log) is not supported
drop index idx_1 on t;
create vector index idx_1 on m1(c1) with(distance=l2, type=hnsw);
ERROR 0A000: create vector index on view table is not supported
create index idx_2 on m1(c3);
select count(*) from m,m1;
count(*)
10
drop view if exists v2;
create view v2 as select * from m1;
insert into v2 values('[1,1,105]', [1,1,1090], default, '2019-9-18');
select * from m1,v2;
c1	c2	c3	c4	c1	c2	c3	c4
[1,1,105]	[1,1,1090]	101	2019-09-18 00:00:00	[1,1,105]	[1,1,1090]	101	2019-09-18 00:00:00
[1,1,105]	[1,1,1090]	101	2019-09-18 00:00:00	[1,1,105]	[1,1,1090]	NULL	2019-09-18 00:00:00
[1,1,105]	[1,1,1090]	NULL	2019-09-18 00:00:00	[1,1,105]	[1,1,1090]	101	2019-09-18 00:00:00
[1,1,105]	[1,1,1090]	NULL	2019-09-18 00:00:00	[1,1,105]	[1,1,1090]	NULL	2019-09-18 00:00:00
vector type
drop table if exists t;
create table t(c1 vector(2), c2 float[]);
insert into t values (null, null);
insert into t values ('[-1,-2]', '[-1,-2]');
insert into t values ('[0.122,0.233231]','[0.122,0.233231]');
insert into t values ([-1,-2], [-1,-2]);
insert into t values ([0.122,0.233231], [0.122,0.233231]);
insert into select
drop table if exists t;
drop table if exists t1;
create table t(c1 vector(2), c2 float[], c3 int primary key, vector index idx_1(c1) with (distance=l2,type=hnsw));
create table t1(c1 vector(2), c2 float[], c3 int primary key, vector index idx_1(c1) with (distance=l2,type=hnsw));
insert into t values ('[-1,-2]', '[-1,-2]',1);
insert into t values ('[0.122,0.233231]','[0.122,0.233231]',2);
insert into t values ([-1,-2], [-1,-2],3);
insert into t values ([0.122,0.233231], [0.122,0.233231],4);
insert into t values ([1,1], [1,1],5);
insert into t1 select * from t where t.c3>2;
explain select * from t1 order by l2_distance(c1, '[1,1]') approx limit 2;
Query Plan
====================================================
|ID|OPERATOR       |NAME     |EST.ROWS|EST.TIME(us)|
----------------------------------------------------
|0 |TABLE FULL SCAN|t1(idx_1)|3       |0|
====================================================
Outputs & filters:
-------------------------------------
  0 - output([t1.c1], [t1.c2], [t1.c3]), filter(nil), rowset=16
      access([t1.c3], [t1.c1], [t1.c2]), partitions(p0)
      is_index_back=true, is_global_index=false, 
      123
select * from t1 order by l2_distance(c1, '[1,1]') approx limit 2;
c1	c2	c3
[1,1]	[1,1]	5
[0.122,0.233231]	[0.122,0.233231]	4
select * from t1 order by l2_distance(c1, '[1,1]') limit 2;
c1	c2	c3
[1,1]	[1,1]	5
[0.122,0.233231]	[0.122,0.233231]	4
insert overwrite
drop table if exists t;
drop table if exists t1;
create table t(c1 vector(3), c2 array(float), c3 int auto_increment, c4 timestamp, primary key(c3, c4), vector index idx_1(c1) with (distance=l2, type=hnsw)) partition by range(unix_timestamp(c4)) (partition p0 values less than (unix_timestamp('2010-01-01')), partition p1 values less than(unix_timestamp('2020-01-01')));
create table t1(c1 vector(3), c2 array(float), c3 int auto_increment, c4 timestamp, primary key(c3, c4), vector index idx_1(c1) with (distance=l2, type=hnsw)) partition by range(unix_timestamp(c4)) (partition p0 values less than (unix_timestamp('2010-01-01')), partition p1 values less than(unix_timestamp('2020-01-01')));
call pl1(100);
insert /*+ parallel(10) */ overwrite t1 select * from t where t.c3>90;
ERROR 0A000: insert overwrite with direct-load does not support table has generated column
drop index idx_1 on t1;
explain extended insert /*+ parallel(10) */ overwrite t1 select * from t where t.c3>90;
Query Plan
=================================================================================
|ID|OPERATOR                              |NAME           |EST.ROWS|EST.TIME(us)|
---------------------------------------------------------------------------------
|0 |PX COORDINATOR                        |               |10      |0|
|1 |└─EXCHANGE OUT DISTR                  |:EX10001       |10      |0|
|2 |  └─INSERT                            |               |10      |0|
|3 |    └─EXCHANGE IN DISTR               |               |10      |0|
|4 |      └─EXCHANGE OUT DISTR (PKEY HASH)|:EX10000       |10      |0|
|5 |        └─SUBPLAN SCAN                |ANONYMOUS_VIEW1|10      |0|
|6 |          └─PX BLOCK ITERATOR         |               |10      |0|
|7 |            └─TABLE RANGE SCAN        |t              |10      |0|
=================================================================================
Outputs & filters:
-------------------------------------
  0 - output(nil), filter(nil), rowset=16
  1 - output(nil), filter(nil), rowset=16
      dop=10
  2 - output(nil), filter(nil), rowset=16
      columns([{t1: ({t1: (t1.c3(), t1.c4(), t1.c1(), t1.c2())})}]), partitions(p[0-1]), 
      column_values([column_conv(INT,PS:(11,0),NOT NULL,t1.c3.nextval(column_conv(INT,PS:(11,0),NOT NULL,ANONYMOUS_VIEW1.c3())())())()],
       [column_conv(TIMESTAMP,PS:(19,0),NOT NULL,timestamp_nvl(ANONYMOUS_VIEW1.c4(), cast(current_timestamp()(), TIMESTAMP(19, 0))())())(
      )], [column_conv(ARRAY,PS:(-1,-1),NULL,ANONYMOUS_VIEW1.c1())()], [column_conv(ARRAY,PS:(-1,-1),NULL,ANONYMOUS_VIEW1.c2())()])
  3 - output([PARTITION_ID()], [column_conv(INT,PS:(11,0),NOT NULL,t1.c3.nextval(column_conv(INT,PS:(11,0),NOT NULL,ANONYMOUS_VIEW1.c3())())())(0
()], [column_conv(TIMESTAMP,PS:(19,0),NOT NULL,timestamp_nvl(ANONYMOUS_VIEW1.c4(), cast(current_timestamp()(), TIMESTAMP(19,
       0))())())()], [ANONYMOUS_VIEW1.c1()], [ANONYMOUS_VIEW1.c2()]), filter(nil), rowset=16
  4 - output([PARTITION_ID()], [column_conv(INT,PS:(11,0),NOT NULL,t1.c3.nextval(column_conv(INT,PS:(11,0),NOT NULL,ANONYMOUS_VIEW1.c3())())())(0
()], [column_conv(TIMESTAMP,PS:(19,0),NOT NULL,timestamp_nvl(ANONYMOUS_VIEW1.c4(), cast(current_timestamp()(), TIMESTAMP(19,
       0))())())()], [ANONYMOUS_VIEW1.c1()], [ANONYMOUS_VIEW1.c2()]), filter(nil), rowset=16
      (#keys=1, [unix_timestamp(column_conv(TIMESTAMP,PS:(19,0),NOT NULL,timestamp_nvl(ANONYMOUS_VIEW1.c4(), cast(current_timestamp()(),
       TIMESTAMP(19, 0))())())())()]), dop=10
  5 - output([ANONYMOUS_VIEW1.c1()], [ANONYMOUS_VIEW1.c2()], [ANONYMOUS_VIEW1.c3()], [ANONYMOUS_VIEW1.c4()]), filter(nil), rowset=16
      access([ANONYMOUS_VIEW1.c1()], [ANONYMOUS_VIEW1.c2()], [ANONYMOUS_VIEW1.c3()], [ANONYMOUS_VIEW1.c4()])
  6 - output([t.c1()], [t.c2()], [t.c3()], [t.c4()]), filter(nil), rowset=16
  7 - output([t.c3()], [t.c4()], [t.c1()], [t.c2()]), filter(nil), rowset=16
      access([t.c3()], [t.c4()], [t.c1()], [t.c2()]), partitions(p[0-1])
      is_index_back=false, is_global_index=false, 
      range_key([t.c3()], [t.c4()]), range(90,MAX ; MAX,MAX), 
      range_cond([t.c3() > 90()()])
Used Hint:
-------------------------------------
  /*+
      
      PARALLEL(10)
  */
Qb name trace:
-------------------------------------
  stmt_id:0, stmt_type:T_EXPLAIN 
  stmt_id:1, INS$1 > INS$B2DE4D68
  stmt_id:2, SEL$1
Outline Data: 
-------------------------------------
  /*+
      BEGIN_OUTLINE_DATA
      PARALLEL(@"SEL$1" "test"."t"@"SEL$1" 10)
      FULL(@"SEL$1" "test"."t"@"SEL$1")
      PRED_DEDUCE(@"INS$1")
      PARALLEL(10)
      ENABLE_PARALLEL_DML
      OPTIMIZER_FEATURES_ENABLE('')
      END_OUTLINE_DATA
  */
Optimization Info:
-------------------------------------
  t:
      table_rows:100
      physical_range_rows:10
      logical_range_rows:10
      index_back_rows:0
      output_rows:10
      table_dop:10
      dop_method:Global DOP
      avaiable_index_name:[idx_1, rowkey_vid_table, vid_rowkey_table, idx_1_index_id_table, idx_1_index_snapshot_data_table, t]
      pruned_index_name:[idx_1, rowkey_vid_table, vid_rowkey_table, idx_1_index_id_table, idx_1_index_snapshot_data_table]
      stats info:[version=1970-01-01 08:00:00.000000, is_locked=0, is_expired=0]
      dynamic sampling level:0
      estimation method:[DEFAULT, STORAGE]
  Plan Type:
      DISTRIBUTED
  Parameters:
      :0 => 90
  Note:
      Degree of Parallelism is 10 because of hint
      Overwrite table with full direct mode
insert /*+ parallel(10) */ overwrite t1 select * from t where t.c3>90;
replace into
drop table if exists t;
drop table if exists t1;
create table t(c1 vector(3), c2 array(float), c3 int auto_increment, c4 timestamp, primary key(c3, c4), vector index idx_1(c1) with (distance=l2, type=hnsw)) partition by range(unix_timestamp(c4)) (partition p0 values less than (unix_timestamp('2010-01-01')), partition p1 values less than(unix_timestamp('2020-01-01')));
replace into t values ([1,1,100], [1,1,2018], 100, '2018-08-15');
replace into t values ([1,1,101], [1,1,2019], 100, '2018-08-15');
select * from t;
c1	c2	c3	c4
[1,1,101]	[1,1,2019]	100	2018-08-15 00:00:00
drop view if exists v;
create view v as select * from t where c3 >30;
replace into v values ([1,1,102], [1,1,2019], 20, '2018-08-15');
replace into v values ([1,1,103], [1,1,2019], 50, '2018-08-15');
drop materialized view if exists m;
create materialized view m as select * from t order by l2_distance(c1, [1,1,99]),c3 approx limit 1;
ERROR 0A000: Multi order by item when using vector index is not supported
create materialized view m as select * from t order by l2_distance(c1, [1,1,99]) approx limit 1;
select * from m;
c1	c2	c3	c4
[1,1,101]	[1,1,2019]	100	2018-08-15 00:00:00
replace into t select * from m where m.c3>30;
select * from t;
c1	c2	c3	c4
[1,1,102]	[1,1,2019]	20	2018-08-15 00:00:00
[1,1,103]	[1,1,2019]	50	2018-08-15 00:00:00
[1,1,101]	[1,1,2019]	100	2018-08-15 00:00:00
replace into t partition(p1) values ([1,1,101], [1,1,2019], 30, '2018-08-15');
replace into t partition(p1) values ([1,1,101], [1,1,2019], 30, '2009-08-15');
ERROR HY000: Found a row not matching the given partition set
update
drop table if exists t;
drop table if exists t1;
Warnings:
Note	1051	Unknown table 'test.t1'
create table t(c1 vector(3), c2 array(float), c3 int auto_increment, c4 timestamp, primary key(c3, c4), vector index idx_1(c1) with (distance=l2, type=hnsw)) partition by range(unix_timestamp(c4)) (partition p0 values less than (unix_timestamp('2010-01-01')), partition p1 values less than(unix_timestamp('2020-01-01')));
create table t1(c1 vector(3), c2 array(float), c3 int auto_increment, c4 timestamp, primary key(c3, c4), vector index idx_1(c1) with (distance=l2, type=hnsw)) partition by range(unix_timestamp(c4)) (partition p0 values less than (unix_timestamp('2010-01-01')), partition p1 values less than(unix_timestamp('2020-01-01')));
call pl1(10);
insert into t1 select * from t;
alter table t modify c4 timestamp default current_timestamp;
update t set t.c1=[2,2,2] where t.c3=1;
select count(*) from t where t.c3=1;
count(*)
1
update t set c4='2018-1-10' order by c3 limit 3;
select count(*) from t;
count(*)
100
update t partition(p1) set c4='2019-10-19' where c3>5;
select count(*) from t;
count(*)
100
alter table t1 modify c4 timestamp default current_timestamp;
update t, t1 partition(p1) set t.c4='2011-1-1',t1.c1='[2,2,2]' where t.c4=t1.c4;
insert into t values([1,1,1],[1,1,1],200,'2015-5-5');
insert into t values([1,1,1],[1,1,1],201,'2015-5-5');
update t set c3=201 where c3=200 and c4='2015-5-5';
ERROR 23000: Duplicate entry '201-2015-05-05 00:00:00.000000' for key 'PRIMARY'
update ignore t set c3=201 where c3=200 and c4='2015-5-5';
drop view if exists v;
create view v as select * from t where c3>100;
update v set c3=201 where c3=200 and c4='2015-5-5';
ERROR 23000: Duplicate entry '201-2015-05-05 00:00:00.000000' for key 'PRIMARY'
update ignore v set c3=201 where c3=200 and c4='2015-5-5';
update v set c3=202 where c3=200 and c4='2015-5-5';
select count(*) from t,v where t.c3>100 and t.c3=v.c3;
count(*)
2
select
drop table if exists t;
create table t (c1 vector(3), c2 array(float), c3 int auto_increment, c4 json,c5 int generated always as (cast(json_unquote(json_extract(c4, '$.age')) as unsigned)) virtual, primary key(c3),vector index idx_1(c1) with(distance=l2, type=hnsw), index idx_2(c5));
insert into t values([0.3232323,0.455656,null], [0.3232323,0.455656,null],default, '{"name":"c","age":20}', default);
ERROR 42000: Null value
insert into t values('[0.3232323,0.455656,0.564534t4]', '[0.3232323,0.455656,0.564534t4]',default, '{"name":"a","age":18}', default);
ERROR 22032: Invalid JSON text.
drop table if exists t;
create table t (c1 vector(3), c2 array(float), c3 int auto_increment, c4 json,c5 int generated always as (cast(json_unquote(json_extract(c4, '$.age')) as unsigned)) virtual, primary key(c3),vector index idx_1(c1) with(distance=l2, type=hnsw), index idx_2(c5));
insert into t values('[0.23233454,0.2323233,0.123242]', '[0.23233454,0.2323233,0.123242]',default, '{"name":"a","age":18}', default);
insert into t values('[0.3232323,0.455656,0.5645344]', '[0.3232323,0.455656,0.5645344]',default, '{"name":"a","age":18}', default);
insert into t values([-0.978696,-0.4564654,-0.123123132], [-0.978696,-0.4564654,-0.123123132],default, '{"name":"d","age":21}', default);
insert into t values('[0.3232323,0.45565e-6,0.564534e4]', '[0.3232323,0.45565e-6,0.564534e4]',default, '{"name":"a","age":18}', default);
explain select /*+ read_consistency(weak) */ * from t order by l2_distance(c1, '[1,1,1]') approx limit 2;
ERROR 0A000: when using vector index, weak read is not supported
select /*+ read_consistency(weak) */ * from t order by l2_distance(c1, '[1,1,1]') approx limit 2;
ERROR 0A000: when using vector index, weak read is not supported
explain select /*+ read_consistency(weak) */ * from t where c5=18;
Query Plan
====================================================
|ID|OPERATOR        |NAME    |EST.ROWS|EST.TIME(us)|
----------------------------------------------------
|0 |TABLE RANGE SCAN|t(idx_2)|3       |0|
====================================================
Outputs & filters:
-------------------------------------
  0 - output([t.c1], [t.c2], [t.c3], [t.c4], [column_conv(INT,PS:(11,0),NULL,cast(cast(json_unquote(json_extract(t.c4, '$.age')), BIGINT UNSIGNED(0, 0)),
       INT(-1, 0)))]), filter(nil), rowset=16
      access([t.c3], [t.c4], [t.c5], [t.c1], [t.c2]), partitions(p0)
      is_index_back=true, is_global_index=false, 
      range_key([t.c5], [t.c3]), range(18,MIN ; 18,MAX), 
      range_cond([t.c5 = 18])
select /*+ read_consistency(weak) */ * from t where c5=18;
c1	c2	c3	c4	c5
drop index idx_1 on t;
explain select /*+ read_consistency(weak) */ * from t order by l2_distance(c1, '[1,1,1]') approx limit 2;
Query Plan
=================================================
|ID|OPERATOR         |NAME|EST.ROWS|EST.TIME(us)|
-------------------------------------------------
|0 |TOP-N SORT       |    |2       |0|
|1 |└─TABLE FULL SCAN|t   |4       |0|
=================================================
Outputs & filters:
-------------------------------------
  0 - output([t.c1], [t.c2], [t.c3], [t.c4], [column_conv(INT,PS:(11,0),NULL,cast(cast(json_unquote(json_extract(t.c4, '$.age')), BIGINT UNSIGNED(0, 0)),
       INT(-1, 0)))]), filter(nil), rowset=16
      sort_keys([l2_distance(t.c1, cast('[1,1,1]', ARRAY(18, -1))), ASC]), topn(2)
  1 - output([t.c3], [t.c4], [column_conv(INT,PS:(11,0),NULL,cast(cast(json_unquote(json_extract(t.c4, '$.age')), BIGINT UNSIGNED(0, 0)), INT(-1, 0)))],
       [t.c1], [t.c2]), filter(nil), rowset=16
      access([t.c3], [t.c4], [t.c1], [t.c2]), partitions(p0)
      is_index_back=false, is_global_index=false, 
      123
select /*+ read_consistency(weak) */ * from t order by l2_distance(c1, '[1,1,1]') approx limit 2;
c1	c2	c3	c4	c5
[0.323232,0.455656,0.564534]	[0.323232,0.455656,0.564534]	2	{"age": 18, "name": "a"}	18
[0.232335,0.232323,0.123242]	[0.232335,0.232323,0.123242]	1	{"age": 18, "name": "a"}	18
explain select /*+ read_consistency(weak) */ * from t where c5=18;
Query Plan
====================================================
|ID|OPERATOR        |NAME    |EST.ROWS|EST.TIME(us)|
----------------------------------------------------
|0 |TABLE RANGE SCAN|t(idx_2)|3       |0|
====================================================
Outputs & filters:
-------------------------------------
  0 - output([t.c1], [t.c2], [t.c3], [t.c4], [column_conv(INT,PS:(11,0),NULL,cast(cast(json_unquote(json_extract(t.c4, '$.age')), BIGINT UNSIGNED(0, 0)),
       INT(-1, 0)))]), filter(nil), rowset=16
      access([t.c3], [t.c4], [t.c5], [t.c1], [t.c2]), partitions(p0)
      is_index_back=true, is_global_index=false, 
      range_key([t.c5], [t.c3]), range(18,MIN ; 18,MAX), 
      range_cond([t.c5 = 18])
select /*+ read_consistency(weak) */ * from t where c5=18;
c1	c2	c3	c4	c5
[0.232335,0.232323,0.123242]	[0.232335,0.232323,0.123242]	1	{"age": 18, "name": "a"}	18
[0.323232,0.455656,0.564534]	[0.323232,0.455656,0.564534]	2	{"age": 18, "name": "a"}	18
[0.323232,0.00000045565,5645.34]	[0.323232,0.00000045565,5645.34]	4	{"age": 18, "name": "a"}	18
create vector index idx_1 on t(c1) with (distance=l2,type=hnsw);
select distinct c1 from t order by l2_distance(c1, '[1,1,1]') approx limit 2;
ERROR 22000: Invalid data type for the operation
select distinct c5 from t order by l2_distance(c1, '[1,1,1]') approx limit 2;
c5
18
select all c1 from t order by l2_distance(c1, '[1,1,1]') approx limit 2;
c1
[0.323232,0.455656,0.564534]
[0.232335,0.232323,0.123242]
select all c5 from t order by l2_distance(c1, '[1,1,1]') approx limit 2;
c5
18
18
select unique c1 from t order by l2_distance(c1, '[1,1,1]') approx limit 2;
ERROR 22000: Invalid data type for the operation
select unique c5 from t order by l2_distance(c1, '[1,1,1]') approx limit 2;
c5
18
select sql_calc_found_rows * from t order by l2_distance(c1, '[1,1,1]') approx limit 3;
c1	c2	c3	c4	c5
[0.323232,0.455656,0.564534]	[0.323232,0.455656,0.564534]	2	{"age": 18, "name": "a"}	18
[0.232335,0.232323,0.123242]	[0.232335,0.232323,0.123242]	1	{"age": 18, "name": "a"}	18
[-0.978696,-0.456465,-0.123123]	[-0.978696,-0.456465,-0.123123]	3	{"age": 21, "name": "d"}	21
select found_rows();
found_rows()
3
select sql_calc_found_rows * from t where c5=18 order by c3 limit 1;
c1	c2	c3	c4	c5
[0.232335,0.232323,0.123242]	[0.232335,0.232323,0.123242]	1	{"age": 18, "name": "a"}	18
select found_rows();
found_rows()
3
drop table if exists t1;
create table t1 (c1 vector(3), c2 int auto_increment primary key);
insert into t1 values ('[0.23233454,0.2323233,0.123242]', default);
insert into t1 values ('[0.3232323,0.455656,0.5645344]', default);
insert into t1 values ('[1,1,1]', default);
select * from t natural join t1;
ERROR HY000: Invalid argument
select * from t inner join t1 on t.c1=t1.c1 order by l2_distance(t.c1, '[1,1,1]') approx limit 2;
c1	c2	c3	c4	c5	c1	c2
[0.323232,0.455656,0.564534]	[0.323232,0.455656,0.564534]	2	{"age": 18, "name": "a"}	18	[0.323232,0.455656,0.564534]	2
[0.232335,0.232323,0.123242]	[0.232335,0.232323,0.123242]	1	{"age": 18, "name": "a"}	18	[0.232335,0.232323,0.123242]	1
explain select * from t cross join t1 on t.c1=t1.c1 order by l2_distance(t.c1, '[1,1,1]') approx limit 2;
Query Plan
=======================================================
|ID|OPERATOR           |NAME    |EST.ROWS|EST.TIME(us)|
-------------------------------------------------------
|0 |TOP-N SORT         |        |2       |0|
|1 |└─HASH JOIN        |        |3       |0|
|2 |  ├─TABLE FULL SCAN|t1      |3       |0|
|3 |  └─TABLE FULL SCAN|t(idx_1)|4       |0|
=======================================================
Outputs & filters:
-------------------------------------
  0 - output([t.c1], [t.c2], [t.c3], [t.c4], [column_conv(INT,PS:(11,0),NULL,cast(cast(json_unquote(json_extract(t.c4, '$.age')), BIGINT UNSIGNED(0, 0)),
       INT(-1, 0)))], [t1.c1], [t1.c2]), filter(nil), rowset=16
      sort_keys([l2_distance(t.c1, cast('[1,1,1]', ARRAY(18, -1))), ASC]), topn(2)
  1 - output([l2_distance(t.c1, cast('[1,1,1]', ARRAY(18, -1)))], [t.c1], [t.c2], [t.c3], [t.c4], [column_conv(INT,PS:(11,0),NULL,cast(cast(json_unquote(json_extract(t.c4,
       '$.age')), BIGINT UNSIGNED(0, 0)), INT(-1, 0)))], [t1.c1], [t1.c2]), filter(nil), rowset=16
      equal_conds([t.c1 = t1.c1]), other_conds(nil)
  2 - output([t1.c2], [t1.c1]), filter(nil), rowset=16
      access([t1.c2], [t1.c1]), partitions(p0)
      is_index_back=false, is_global_index=false, 
      123
  3 - output([t.c3], [t.c4], [column_conv(INT,PS:(11,0),NULL,cast(cast(json_unquote(json_extract(t.c4, '$.age')), BIGINT UNSIGNED(0, 0)), INT(-1, 0)))],
       [t.c1], [t.c2], [l2_distance(t.c1, cast('[1,1,1]', ARRAY(18, -1)))]), filter(nil), rowset=16
      access([t.c3], [t.c4], [t.c1], [t.c2]), partitions(p0)
      is_index_back=true, is_global_index=false, 
      123
select * from t cross join t1 on t.c1=t1.c1 order by l2_distance(t.c1, '[1,1,1]') approx limit 2;
c1	c2	c3	c4	c5	c1	c2
[0.323232,0.455656,0.564534]	[0.323232,0.455656,0.564534]	2	{"age": 18, "name": "a"}	18	[0.323232,0.455656,0.564534]	2
[0.232335,0.232323,0.123242]	[0.232335,0.232323,0.123242]	1	{"age": 18, "name": "a"}	18	[0.232335,0.232323,0.123242]	1
explain select * from t left join t1 on t.c1=t1.c1 order by l2_distance(t.c1, '[1,1,1]') approx limit 2;
Query Plan
============================================================
|ID|OPERATOR                |NAME    |EST.ROWS|EST.TIME(us)|
------------------------------------------------------------
|0 |TOP-N SORT              |        |2       |0|
|1 |└─HASH RIGHT OUTER JOIN |        |4       |0|
|2 |  ├─TABLE FULL SCAN     |t1      |3       |0|
|3 |  └─TABLE FULL SCAN     |t(idx_1)|4       |0|
============================================================
Outputs & filters:
-------------------------------------
  0 - output([t.c1], [t.c2], [t.c3], [t.c4], [column_conv(INT,PS:(11,0),NULL,cast(cast(json_unquote(json_extract(t.c4, '$.age')), BIGINT UNSIGNED(0, 0)),
       INT(-1, 0)))], [t1.c1], [t1.c2]), filter(nil), rowset=16
      sort_keys([l2_distance(t.c1, cast('[1,1,1]', ARRAY(18, -1))), ASC]), topn(2)
  1 - output([l2_distance(t.c1, cast('[1,1,1]', ARRAY(18, -1)))], [t.c1], [t.c2], [t.c3], [t.c4], [column_conv(INT,PS:(11,0),NULL,cast(cast(json_unquote(json_extract(t.c4,
       '$.age')), BIGINT UNSIGNED(0, 0)), INT(-1, 0)))], [t1.c1], [t1.c2]), filter(nil), rowset=16
      equal_conds([t.c1 = t1.c1]), other_conds(nil)
  2 - output([t1.c2], [t1.c1]), filter(nil), rowset=16
      access([t1.c2], [t1.c1]), partitions(p0)
      is_index_back=false, is_global_index=false, 
      123
  3 - output([t.c3], [t.c4], [column_conv(INT,PS:(11,0),NULL,cast(cast(json_unquote(json_extract(t.c4, '$.age')), BIGINT UNSIGNED(0, 0)), INT(-1, 0)))],
       [t.c1], [t.c2], [l2_distance(t.c1, cast('[1,1,1]', ARRAY(18, -1)))]), filter(nil), rowset=16
      access([t.c3], [t.c4], [t.c1], [t.c2]), partitions(p0)
      is_index_back=true, is_global_index=false, 
      123
select * from t left join t1 on t.c1=t1.c1 order by l2_distance(t.c1, '[1,1,1]') approx limit 2;
c1	c2	c3	c4	c5	c1	c2
[0.323232,0.455656,0.564534]	[0.323232,0.455656,0.564534]	2	{"age": 18, "name": "a"}	18	[0.323232,0.455656,0.564534]	2
[0.232335,0.232323,0.123242]	[0.232335,0.232323,0.123242]	1	{"age": 18, "name": "a"}	18	[0.232335,0.232323,0.123242]	1
explain select * from t right join t1 on t.c1=t1.c1 order by l2_distance(t.c1, '[1,1,1]') approx limit 2;
Query Plan
=======================================================
|ID|OPERATOR           |NAME    |EST.ROWS|EST.TIME(us)|
-------------------------------------------------------
|0 |TOP-N SORT         |        |2       |0|
|1 |└─HASH OUTER JOIN  |        |3       |0|
|2 |  ├─TABLE FULL SCAN|t1      |3       |0|
|3 |  └─TABLE FULL SCAN|t(idx_1)|4       |0|
=======================================================
Outputs & filters:
-------------------------------------
  0 - output([t.c1], [t.c2], [t.c3], [t.c4], [column_conv(INT,PS:(11,0),NULL,cast(cast(json_unquote(json_extract(t.c4, '$.age')), BIGINT UNSIGNED(0, 0)),
       INT(-1, 0)))], [t1.c1], [t1.c2]), filter(nil), rowset=16
      sort_keys([l2_distance(t.c1, cast('[1,1,1]', ARRAY(18, -1))), ASC]), topn(2)
  1 - output([l2_distance(t.c1, cast('[1,1,1]', ARRAY(18, -1)))], [t.c1], [t.c2], [t.c3], [t.c4], [column_conv(INT,PS:(11,0),NULL,cast(cast(json_unquote(json_extract(t.c4,
       '$.age')), BIGINT UNSIGNED(0, 0)), INT(-1, 0)))], [t1.c1], [t1.c2]), filter(nil), rowset=16
      equal_conds([t.c1 = t1.c1]), other_conds(nil)
  2 - output([t1.c2], [t1.c1]), filter(nil), rowset=16
      access([t1.c2], [t1.c1]), partitions(p0)
      is_index_back=false, is_global_index=false, 
      123
  3 - output([t.c3], [t.c4], [column_conv(INT,PS:(11,0),NULL,cast(cast(json_unquote(json_extract(t.c4, '$.age')), BIGINT UNSIGNED(0, 0)), INT(-1, 0)))],
       [t.c1], [t.c2], [l2_distance(t.c1, cast('[1,1,1]', ARRAY(18, -1)))]), filter(nil), rowset=16
      access([t.c3], [t.c4], [t.c1], [t.c2]), partitions(p0)
      is_index_back=true, is_global_index=false, 
      123
select * from t right join t1 on t.c1=t1.c1 order by l2_distance(t.c1, '[1,1,1]') approx limit 2;
c1	c2	c3	c4	c5	c1	c2
NULL	NULL	NULL	NULL	NULL	[1,1,1]	3
[0.323232,0.455656,0.564534]	[0.323232,0.455656,0.564534]	2	{"age": 18, "name": "a"}	18	[0.323232,0.455656,0.564534]	2
explain select * from t full join t1 on t.c1=t1.c1 order by l2_distance(t.c1, '[1,1,1]') approx limit 2;
Query Plan
===========================================================
|ID|OPERATOR               |NAME    |EST.ROWS|EST.TIME(us)|
-----------------------------------------------------------
|0 |TOP-N SORT             |        |2       |0|
|1 |└─HASH FULL OUTER JOIN |        |4       |0|
|2 |  ├─TABLE FULL SCAN    |t1      |3       |0|
|3 |  └─TABLE FULL SCAN    |t(idx_1)|4       |0|
===========================================================
Outputs & filters:
-------------------------------------
  0 - output([t.c1], [t.c2], [t.c3], [t.c4], [column_conv(INT,PS:(11,0),NULL,cast(cast(json_unquote(json_extract(t.c4, '$.age')), BIGINT UNSIGNED(0, 0)),
       INT(-1, 0)))], [t1.c1], [t1.c2]), filter(nil), rowset=16
      sort_keys([l2_distance(t.c1, cast('[1,1,1]', ARRAY(18, -1))), ASC]), topn(2)
  1 - output([l2_distance(t.c1, cast('[1,1,1]', ARRAY(18, -1)))], [t.c1], [t.c2], [t.c3], [t.c4], [column_conv(INT,PS:(11,0),NULL,cast(cast(json_unquote(json_extract(t.c4,
       '$.age')), BIGINT UNSIGNED(0, 0)), INT(-1, 0)))], [t1.c1], [t1.c2]), filter(nil), rowset=16
      equal_conds([t.c1 = t1.c1]), other_conds(nil)
  2 - output([t1.c2], [t1.c1]), filter(nil), rowset=16
      access([t1.c2], [t1.c1]), partitions(p0)
      is_index_back=false, is_global_index=false, 
      123
  3 - output([t.c3], [t.c4], [column_conv(INT,PS:(11,0),NULL,cast(cast(json_unquote(json_extract(t.c4, '$.age')), BIGINT UNSIGNED(0, 0)), INT(-1, 0)))],
       [t.c1], [t.c2], [l2_distance(t.c1, cast('[1,1,1]', ARRAY(18, -1)))]), filter(nil), rowset=16
      access([t.c3], [t.c4], [t.c1], [t.c2]), partitions(p0)
      is_index_back=true, is_global_index=false, 
      123
select * from t full join t1 on t.c1=t1.c1 order by l2_distance(t.c1, '[1,1,1]') approx limit 2;
c1	c2	c3	c4	c5	c1	c2
NULL	NULL	NULL	NULL	NULL	[1,1,1]	3
[0.323232,0.455656,0.564534]	[0.323232,0.455656,0.564534]	2	{"age": 18, "name": "a"}	18	[0.323232,0.455656,0.564534]	2
select c1,c2 from t1 union all select c1,c3 from t order by l2_distance(c1, '[1,1,1]') limit 3;
c1	c2
[1,1,1]	3
[0.323232,0.455656,0.564534]	2
[0.323232,0.455656,0.564534]	2
select c1,c2 from t1 union select c1,c3 from t order by l2_distance(c1, '[1,1,1]') limit 3;
c1	c2
[1,1,1]	3
[0.323232,0.455656,0.564534]	2
[0.232335,0.232323,0.123242]	1
select c1,c2 from t1 except select c1,c3 from t order by l2_distance(c1, '[1,1,1]') limit 3;
c1	c2
[1,1,1]	3
select c1,c2 from t1 intersect select c1,c3 from t order by l2_distance(c1, '[1,1,1]') limit 3;
c1	c2
[0.323232,0.455656,0.564534]	2
[0.232335,0.232323,0.123242]	1
explain select /*+ index(t idx_1) */ c1,c2 from t order by l2_distance(c1, '[1,1,1]') limit 2;
Query Plan
=================================================
|ID|OPERATOR         |NAME|EST.ROWS|EST.TIME(us)|
-------------------------------------------------
|0 |TOP-N SORT       |    |2       |0|
|1 |└─TABLE FULL SCAN|t   |4       |0|
=================================================
Outputs & filters:
-------------------------------------
  0 - output([t.c1], [t.c2]), filter(nil), rowset=16
      sort_keys([l2_distance(t.c1, cast('[1,1,1]', ARRAY(18, -1))), ASC]), topn(2)
  1 - output([t.c1], [t.c2]), filter(nil), rowset=16
      access([t.c1], [t.c2]), partitions(p0)
      is_index_back=false, is_global_index=false, 
      123
select /*+ index(t idx_1) */ c1,c2 from t order by l2_distance(c1, '[1,1,1]') limit 2;
c1	c2
[0.323232,0.455656,0.564534]	[0.323232,0.455656,0.564534]
[0.232335,0.232323,0.123242]	[0.232335,0.232323,0.123242]
explain select * from t use index(idx_1) order by l2_distance(c1, '[1,1,1]') limit 2;
Query Plan
=================================================
|ID|OPERATOR         |NAME|EST.ROWS|EST.TIME(us)|
-------------------------------------------------
|0 |TOP-N SORT       |    |2       |0|
|1 |└─TABLE FULL SCAN|t   |4       |0|
=================================================
Outputs & filters:
-------------------------------------
  0 - output([t.c1], [t.c2], [t.c3], [t.c4], [column_conv(INT,PS:(11,0),NULL,cast(cast(json_unquote(json_extract(t.c4, '$.age')), BIGINT UNSIGNED(0, 0)),
       INT(-1, 0)))]), filter(nil), rowset=16
      sort_keys([l2_distance(t.c1, cast('[1,1,1]', ARRAY(18, -1))), ASC]), topn(2)
  1 - output([t.c3], [t.c4], [column_conv(INT,PS:(11,0),NULL,cast(cast(json_unquote(json_extract(t.c4, '$.age')), BIGINT UNSIGNED(0, 0)), INT(-1, 0)))],
       [t.c1], [t.c2]), filter(nil), rowset=16
      access([t.c3], [t.c4], [t.c1], [t.c2]), partitions(p0)
      is_index_back=false, is_global_index=false, 
      123
select * from t use index(idx_1) order by l2_distance(c1, '[1,1,1]') limit 2;
c1	c2	c3	c4	c5
[0.323232,0.455656,0.564534]	[0.323232,0.455656,0.564534]	2	{"age": 18, "name": "a"}	18
[0.232335,0.232323,0.123242]	[0.232335,0.232323,0.123242]	1	{"age": 18, "name": "a"}	18
explain select * from t force index(idx_1) order by l2_distance(c1, '[1,1,1]') limit 2;
Query Plan
=================================================
|ID|OPERATOR         |NAME|EST.ROWS|EST.TIME(us)|
-------------------------------------------------
|0 |TOP-N SORT       |    |2       |0|
|1 |└─TABLE FULL SCAN|t   |4       |0|
=================================================
Outputs & filters:
-------------------------------------
  0 - output([t.c1], [t.c2], [t.c3], [t.c4], [column_conv(INT,PS:(11,0),NULL,cast(cast(json_unquote(json_extract(t.c4, '$.age')), BIGINT UNSIGNED(0, 0)),
       INT(-1, 0)))]), filter(nil), rowset=16
      sort_keys([l2_distance(t.c1, cast('[1,1,1]', ARRAY(18, -1))), ASC]), topn(2)
  1 - output([t.c3], [t.c4], [column_conv(INT,PS:(11,0),NULL,cast(cast(json_unquote(json_extract(t.c4, '$.age')), BIGINT UNSIGNED(0, 0)), INT(-1, 0)))],
       [t.c1], [t.c2]), filter(nil), rowset=16
      access([t.c3], [t.c4], [t.c1], [t.c2]), partitions(p0)
      is_index_back=false, is_global_index=false, 
      123
select * from t force index(idx_1) order by l2_distance(c1, '[1,1,1]') limit 2;
c1	c2	c3	c4	c5
[0.323232,0.455656,0.564534]	[0.323232,0.455656,0.564534]	2	{"age": 18, "name": "a"}	18
[0.232335,0.232323,0.123242]	[0.232335,0.232323,0.123242]	1	{"age": 18, "name": "a"}	18
explain select * from t ignore index(idx_1) order by l2_distance(c1, '[1,1,1]') approx limit 2;
Query Plan
===================================================
|ID|OPERATOR       |NAME    |EST.ROWS|EST.TIME(us)|
---------------------------------------------------
|0 |TABLE FULL SCAN|t(idx_1)|1       |0|
===================================================
Outputs & filters:
-------------------------------------
  0 - output([t.c1], [t.c2], [t.c3], [t.c4], [column_conv(INT,PS:(11,0),NULL,cast(cast(json_unquote(json_extract(t.c4, '$.age')), BIGINT UNSIGNED(0, 0)),
       INT(-1, 0)))]), filter(nil), rowset=16
      access([t.c3], [t.c4], [t.c1], [t.c2]), partitions(p0)
      is_index_back=true, is_global_index=false, 
      123
select * from t ignore index(idx_1) order by l2_distance(c1, '[1,1,1]') approx limit 2;
c1	c2	c3	c4	c5
[0.323232,0.455656,0.564534]	[0.323232,0.455656,0.564534]	2	{"age": 18, "name": "a"}	18
[0.232335,0.232323,0.123242]	[0.232335,0.232323,0.123242]	1	{"age": 18, "name": "a"}	18
explain select * from t order by l2_distance(c1, '[1,1,1]') desc approx limit 2;
Query Plan
===================================================
|ID|OPERATOR       |NAME    |EST.ROWS|EST.TIME(us)|
---------------------------------------------------
|0 |TABLE FULL SCAN|t(idx_1)|1       |0|
===================================================
Outputs & filters:
-------------------------------------
  0 - output([t.c1], [t.c2], [t.c3], [t.c4], [column_conv(INT,PS:(11,0),NULL,cast(cast(json_unquote(json_extract(t.c4, '$.age')), BIGINT UNSIGNED(0, 0)),
       INT(-1, 0)))]), filter(nil), rowset=16
      access([t.c3], [t.c4], [t.c1], [t.c2]), partitions(p0)
      is_index_back=true, is_global_index=false, 
      123
select * from t order by l2_distance(c1, '[1,1,1]') desc approx limit 2;
c1	c2	c3	c4	c5
[0.323232,0.455656,0.564534]	[0.323232,0.455656,0.564534]	2	{"age": 18, "name": "a"}	18
[0.232335,0.232323,0.123242]	[0.232335,0.232323,0.123242]	1	{"age": 18, "name": "a"}	18
explain select * from t order by l2_distance(c1, '[1,1,1]') asc approx limit 2;
Query Plan
===================================================
|ID|OPERATOR       |NAME    |EST.ROWS|EST.TIME(us)|
---------------------------------------------------
|0 |TABLE FULL SCAN|t(idx_1)|1       |0|
===================================================
Outputs & filters:
-------------------------------------
  0 - output([t.c1], [t.c2], [t.c3], [t.c4], [column_conv(INT,PS:(11,0),NULL,cast(cast(json_unquote(json_extract(t.c4, '$.age')), BIGINT UNSIGNED(0, 0)),
       INT(-1, 0)))]), filter(nil), rowset=16
      access([t.c3], [t.c4], [t.c1], [t.c2]), partitions(p0)
      is_index_back=true, is_global_index=false, 
      123
select * from t order by l2_distance(c1, '[1,1,1]') asc approx limit 2;
c1	c2	c3	c4	c5
[0.323232,0.455656,0.564534]	[0.323232,0.455656,0.564534]	2	{"age": 18, "name": "a"}	18
[0.232335,0.232323,0.123242]	[0.232335,0.232323,0.123242]	1	{"age": 18, "name": "a"}	18
explain select * from t group by c5 having c5<30 order by l2_distance(c1, '[1,1,1]') approx limit 6;
Query Plan
=======================================================
|ID|OPERATOR           |NAME    |EST.ROWS|EST.TIME(us)|
-------------------------------------------------------
|0 |TOP-N SORT         |        |1       |0|
|1 |└─HASH GROUP BY    |        |1       |0|
|2 |  └─TABLE FULL SCAN|t(idx_1)|1       |0|
=======================================================
Outputs & filters:
-------------------------------------
  0 - output([t.c1], [t.c2], [t.c3], [t.c4], [column_conv(INT,PS:(11,0),NULL,cast(cast(json_unquote(json_extract(t.c4, '$.age')), BIGINT UNSIGNED(0, 0)),
       INT(-1, 0)))]), filter(nil), rowset=16
      sort_keys([l2_distance(t.c1, cast('[1,1,1]', ARRAY(18, -1))), ASC]), topn(6)
  1 - output([l2_distance(t.c1, cast('[1,1,1]', ARRAY(18, -1)))], [t.c1], [t.c2], [t.c3], [t.c4], [column_conv(INT,PS:(11,0),NULL,cast(cast(json_unquote(json_extract(t.c4,
       '$.age')), BIGINT UNSIGNED(0, 0)), INT(-1, 0)))]), filter([column_conv(INT,PS:(11,0),NULL,cast(cast(json_unquote(json_extract(t.c4, '$.age')), BIGINT UNSIGNED(0,
       0)), INT(-1, 0))) < 30]), rowset=16
      group([column_conv(INT,PS:(11,0),NULL,cast(cast(json_unquote(json_extract(t.c4, '$.age')), BIGINT UNSIGNED(0, 0)), INT(-1, 0)))]), agg_func(nil)
  2 - output([t.c3], [t.c4], [column_conv(INT,PS:(11,0),NULL,cast(cast(json_unquote(json_extract(t.c4, '$.age')), BIGINT UNSIGNED(0, 0)), INT(-1, 0)))],
       [t.c1], [t.c2], [l2_distance(t.c1, cast('[1,1,1]', ARRAY(18, -1)))]), filter(nil), rowset=16
      access([t.c3], [t.c4], [t.c1], [t.c2]), partitions(p0)
      is_index_back=true, is_global_index=false, 
      123
select * from t group by c5 having c5<30 order by l2_distance(c1, '[1,1,1]') approx limit 6;
c1	c2	c3	c4	c5
[0.323232,0.455656,0.564534]	[0.323232,0.455656,0.564534]	2	{"age": 18, "name": "a"}	18
[-0.978696,-0.456465,-0.123123]	[-0.978696,-0.456465,-0.123123]	3	{"age": 21, "name": "d"}	21
explain select * from t order by l2_distance(c1, '[1,1,1]') approx limit 2 for update;
Query Plan
=======================================================
|ID|OPERATOR           |NAME    |EST.ROWS|EST.TIME(us)|
-------------------------------------------------------
|0 |MATERIAL           |        |1       |0|
|1 |└─FOR UPDATE       |        |1       |0|
|2 |  └─TABLE FULL SCAN|t(idx_1)|1       |0|
=======================================================
Outputs & filters:
-------------------------------------
  0 - output([t.c1], [t.c2], [t.c3], [t.c4], [column_conv(INT,PS:(11,0),NULL,cast(cast(json_unquote(json_extract(t.c4, '$.age')), BIGINT UNSIGNED(0, 0)),
       INT(-1, 0)))]), filter(nil), rowset=16
  1 - output([t.c1], [t.c2], [t.c3], [t.c4], [column_conv(INT,PS:(11,0),NULL,cast(cast(json_unquote(json_extract(t.c4, '$.age')), BIGINT UNSIGNED(0, 0)),
       INT(-1, 0)))]), filter(nil), rowset=16
      lock tables(t)
  2 - output([t.c3], [t.c4], [column_conv(INT,PS:(11,0),NULL,cast(cast(json_unquote(json_extract(t.c4, '$.age')), BIGINT UNSIGNED(0, 0)), INT(-1, 0)))],
       [t.c1], [t.c2]), filter(nil), rowset=16
      access([t.c3], [t.c4], [t.c1], [t.c2]), partitions(p0)
      is_index_back=true, is_global_index=false, with_vid=true, 
      123
select * from t order by l2_distance(c1, '[1,1,1]') approx limit 2 for update;
c1	c2	c3	c4	c5
[0.323232,0.455656,0.564534]	[0.323232,0.455656,0.564534]	2	{"age": 18, "name": "a"}	18
[0.232335,0.232323,0.123242]	[0.232335,0.232323,0.123242]	1	{"age": 18, "name": "a"}	18
explain select * from t order by l2_distance(c1, '[1,1,1]') approx limit 2 lock in share mode;
Query Plan
=======================================================
|ID|OPERATOR           |NAME    |EST.ROWS|EST.TIME(us)|
-------------------------------------------------------
|0 |MATERIAL           |        |1       |0|
|1 |└─FOR UPDATE       |        |1       |0|
|2 |  └─TABLE FULL SCAN|t(idx_1)|1       |0|
=======================================================
Outputs & filters:
-------------------------------------
  0 - output([t.c1], [t.c2], [t.c3], [t.c4], [column_conv(INT,PS:(11,0),NULL,cast(cast(json_unquote(json_extract(t.c4, '$.age')), BIGINT UNSIGNED(0, 0)),
       INT(-1, 0)))]), filter(nil), rowset=16
  1 - output([t.c1], [t.c2], [t.c3], [t.c4], [column_conv(INT,PS:(11,0),NULL,cast(cast(json_unquote(json_extract(t.c4, '$.age')), BIGINT UNSIGNED(0, 0)),
       INT(-1, 0)))]), filter(nil), rowset=16
      lock tables(t)
  2 - output([t.c3], [t.c4], [column_conv(INT,PS:(11,0),NULL,cast(cast(json_unquote(json_extract(t.c4, '$.age')), BIGINT UNSIGNED(0, 0)), INT(-1, 0)))],
       [t.c1], [t.c2]), filter(nil), rowset=16
      access([t.c3], [t.c4], [t.c1], [t.c2]), partitions(p0)
      is_index_back=true, is_global_index=false, with_vid=true, 
      123
select * from t order by l2_distance(c1, '[1,1,1]') approx limit 2 lock in share mode;
c1	c2	c3	c4	c5
[0.323232,0.455656,0.564534]	[0.323232,0.455656,0.564534]	2	{"age": 18, "name": "a"}	18
[0.232335,0.232323,0.123242]	[0.232335,0.232323,0.123242]	1	{"age": 18, "name": "a"}	18
explain select * from t where l2_distance(c1, '[1,1,1]') < 10 order by l2_distance(c1, '[1,1,1]') approx limit 2;
Query Plan
=====================================================
|ID|OPERATOR         |NAME    |EST.ROWS|EST.TIME(us)|
-----------------------------------------------------
|0 |TOP-N SORT       |        |1       |0|
|1 |└─TABLE FULL SCAN|t(idx_1)|1       |0|
=====================================================
Outputs & filters:
-------------------------------------
  0 - output([t.c1], [t.c2], [t.c3], [t.c4], [column_conv(INT,PS:(11,0),NULL,cast(cast(json_unquote(json_extract(t.c4, '$.age')), BIGINT UNSIGNED(0, 0)),
       INT(-1, 0)))]), filter(nil), rowset=16
      sort_keys([l2_distance(t.c1, cast('[1,1,1]', ARRAY(18, -1))), ASC]), topn(2)
  1 - output([t.c3], [t.c4], [column_conv(INT,PS:(11,0),NULL,cast(cast(json_unquote(json_extract(t.c4, '$.age')), BIGINT UNSIGNED(0, 0)), INT(-1, 0)))],
       [t.c1], [t.c2], [l2_distance(t.c1, cast('[1,1,1]', ARRAY(18, -1)))]), filter([l2_distance(t.c1, cast('[1,1,1]', ARRAY(18, -1))) < cast(10, DOUBLE(-1, -1))]), rowset=16
      access([t.c3], [t.c4], [t.c1], [t.c2]), partitions(p0)
      is_index_back=true, is_global_index=false, filter_before_indexback[false], 
      123
select * from t where l2_distance(c1, '[1,1,1]') < 10 and c3 >1 order by l2_distance(c1, '[1,1,1]') approx limit 2;
c1	c2	c3	c4	c5
[0.323232,0.455656,0.564534]	[0.323232,0.455656,0.564534]	2	{"age": 18, "name": "a"}	18
explain select * from t where l2_distance(c1, '[1,1,1]') between 1 and 10 order by l2_distance(c1, '[1,1,1]') approx limit 2;
Query Plan
=====================================================
|ID|OPERATOR         |NAME    |EST.ROWS|EST.TIME(us)|
-----------------------------------------------------
|0 |TOP-N SORT       |        |1       |0|
|1 |└─TABLE FULL SCAN|t(idx_1)|1       |0|
=====================================================
Outputs & filters:
-------------------------------------
  0 - output([t.c1], [t.c2], [t.c3], [t.c4], [column_conv(INT,PS:(11,0),NULL,cast(cast(json_unquote(json_extract(t.c4, '$.age')), BIGINT UNSIGNED(0, 0)),
       INT(-1, 0)))]), filter(nil), rowset=16
      sort_keys([l2_distance(t.c1, cast('[1,1,1]', ARRAY(18, -1))), ASC]), topn(2)
  1 - output([t.c3], [t.c4], [column_conv(INT,PS:(11,0),NULL,cast(cast(json_unquote(json_extract(t.c4, '$.age')), BIGINT UNSIGNED(0, 0)), INT(-1, 0)))],
       [t.c1], [t.c2], [l2_distance(t.c1, cast('[1,1,1]', ARRAY(18, -1)))]), filter([l2_distance(t.c1, cast('[1,1,1]', ARRAY(18, -1))) >= cast(1, DOUBLE(-1, -1))],
       [l2_distance(t.c1, cast('[1,1,1]', ARRAY(18, -1))) <= cast(10, DOUBLE(-1, -1))]), rowset=16
      access([t.c3], [t.c4], [t.c1], [t.c2]), partitions(p0)
      is_index_back=true, is_global_index=false, filter_before_indexback[false,false], 
      123
select * from t where l2_distance(c1, '[1,1,1]') between 1 and 10 order by l2_distance(c1, '[1,1,1]') approx limit 2;
c1	c2	c3	c4	c5
[0.232335,0.232323,0.123242]	[0.232335,0.232323,0.123242]	1	{"age": 18, "name": "a"}	18
explain select * from t where json_value(c4, '$.name') like 'a' order by l2_distance(c1, '[1,1,1]') approx limit 2;
Query Plan
=====================================================
|ID|OPERATOR         |NAME    |EST.ROWS|EST.TIME(us)|
-----------------------------------------------------
|0 |TOP-N SORT       |        |1       |0|
|1 |└─TABLE FULL SCAN|t(idx_1)|1       |0|
=====================================================
Outputs & filters:
-------------------------------------
  0 - output([t.c1], [t.c2], [t.c3], [t.c4], [column_conv(INT,PS:(11,0),NULL,cast(cast(json_unquote(json_extract(t.c4, '$.age')), BIGINT UNSIGNED(0, 0)),
       INT(-1, 0)))]), filter(nil), rowset=16
      sort_keys([l2_distance(t.c1, cast('[1,1,1]', ARRAY(18, -1))), ASC]), topn(2)
  1 - output([t.c3], [t.c4], [column_conv(INT,PS:(11,0),NULL,cast(cast(json_unquote(json_extract(t.c4, '$.age')), BIGINT UNSIGNED(0, 0)), INT(-1, 0)))],
       [t.c1], [t.c2], [l2_distance(t.c1, cast('[1,1,1]', ARRAY(18, -1)))]), filter([(T_OP_LIKE, json_value(t.c4, '$.name', 2199026204695, 0, 0, 3, NULL, 3, NULL,
       3, 3), 'a', '\\')]), rowset=16
      access([t.c3], [t.c4], [t.c1], [t.c2]), partitions(p0)
      is_index_back=true, is_global_index=false, filter_before_indexback[false], 
      123
select * from t where json_value(c4, '$.name') like 'a' order by l2_distance(c1, '[1,1,1]') approx limit 2;
c1	c2	c3	c4	c5
[0.323232,0.455656,0.564534]	[0.323232,0.455656,0.564534]	2	{"age": 18, "name": "a"}	18
[0.232335,0.232323,0.123242]	[0.232335,0.232323,0.123242]	1	{"age": 18, "name": "a"}	18
explain select * from t where exists(select c3 from t where c3>2) order by l2_distance(c1, '[1,1,1]') approx limit 2;
Query Plan
========================================================
|ID|OPERATOR            |NAME    |EST.ROWS|EST.TIME(us)|
--------------------------------------------------------
|0 |TOP-N SORT          |        |1       |0|
|1 |└─SUBPLAN FILTER    |        |1       |0|
|2 |  ├─TABLE FULL SCAN |t(idx_1)|1       |0|
|3 |  └─TABLE RANGE SCAN|t       |2       |0|
========================================================
Outputs & filters:
-------------------------------------
  0 - output([t.c1], [t.c2], [t.c3], [t.c4], [column_conv(INT,PS:(11,0),NULL,cast(cast(json_unquote(json_extract(t.c4, '$.age')), BIGINT UNSIGNED(0, 0)),
       INT(-1, 0)))]), filter(nil), rowset=16
      sort_keys([l2_distance(t.c1, cast('[1,1,1]', ARRAY(18, -1))), ASC]), topn(2)
  1 - output([l2_distance(t.c1, cast('[1,1,1]', ARRAY(18, -1)))], [t.c1], [t.c2], [t.c3], [t.c4], [column_conv(INT,PS:(11,0),NULL,cast(cast(json_unquote(json_extract(t.c4,
       '$.age')), BIGINT UNSIGNED(0, 0)), INT(-1, 0)))]), filter(nil), rowset=16
      exec_params_(nil), onetime_exprs_([(T_OP_EXISTS, subquery(1))(:0)]), init_plan_idxs_(nil), use_batch=false
  2 - output([t.c3], [t.c4], [column_conv(INT,PS:(11,0),NULL,cast(cast(json_unquote(json_extract(t.c4, '$.age')), BIGINT UNSIGNED(0, 0)), INT(-1, 0)))],
       [t.c1], [t.c2], [l2_distance(t.c1, cast('[1,1,1]', ARRAY(18, -1)))]), filter(nil), startup_filter([:0]), rowset=16
      access([t.c3], [t.c4], [t.c1], [t.c2]), partitions(p0)
      is_index_back=true, is_global_index=false, 
      123
  3 - output([t.c3]), filter(nil), rowset=16
      access([t.c3]), partitions(p0)
      is_index_back=false, is_global_index=false, 
      range_key([t.c3]), range(2 ; MAX), 
      range_cond([t.c3 > 2])
select * from t where exists(select c3 from t where c3>2) order by l2_distance(c1, '[1,1,1]') approx limit 2;
c1	c2	c3	c4	c5
[0.323232,0.455656,0.564534]	[0.323232,0.455656,0.564534]	2	{"age": 18, "name": "a"}	18
[0.232335,0.232323,0.123242]	[0.232335,0.232323,0.123242]	1	{"age": 18, "name": "a"}	18
drop table if exists t;
create table t(c1 vector(3), c2 int, primary key(c2), vector index idx_1(c1) with (distance=l2,type=hnsw));
insert into t values('[1,1,1]',1),('[2,2,2]',2);
explain select * from t order by l1_distance(c1, [0,1,1]) limit 1;
Query Plan
=================================================
|ID|OPERATOR         |NAME|EST.ROWS|EST.TIME(us)|
-------------------------------------------------
|0 |TOP-N SORT       |    |1       |0|
|1 |└─TABLE FULL SCAN|t   |2       |0|
=================================================
Outputs & filters:
-------------------------------------
  0 - output([t.c1], [t.c2]), filter(nil), rowset=16
      sort_keys([l1_distance(t.c1, cast(array(0, 1, 1), ARRAY(18, -1))), ASC]), topn(1)
  1 - output([t.c2], [t.c1]), filter(nil), rowset=16
      access([t.c2], [t.c1]), partitions(p0)
      is_index_back=false, is_global_index=false, 
      123
select * from t order by l1_distance(c1, [0,1,1]) limit 1;
c1	c2
[1,1,1]	1
drop table if exists t;
create table t(c1 vector(3), c2 int, primary key(c2), vector index idx_1(c1) with (distance=l2,type=hnsw));
insert into t values('[1,1,1]',1),('[2,2,2]',2);
explain select * from t order by inner_product(c1, [0,1,1]) limit 1;
Query Plan
=================================================
|ID|OPERATOR         |NAME|EST.ROWS|EST.TIME(us)|
-------------------------------------------------
|0 |TOP-N SORT       |    |1       |0|
|1 |└─TABLE FULL SCAN|t   |2       |0|
=================================================
Outputs & filters:
-------------------------------------
  0 - output([t.c1], [t.c2]), filter(nil), rowset=16
      sort_keys([inner_product(t.c1, cast(array(0, 1, 1), ARRAY(18, -1))), ASC]), topn(1)
  1 - output([t.c2], [t.c1]), filter(nil), rowset=16
      access([t.c2], [t.c1]), partitions(p0)
      is_index_back=false, is_global_index=false, 
      123
select * from t order by inner_product(c1, [0,1,1]) limit 1;
c1	c2
[1,1,1]	1
explain select * from t order by negative_inner_product(c1, [0,1,1]) limit 1;
Query Plan
=================================================
|ID|OPERATOR         |NAME|EST.ROWS|EST.TIME(us)|
-------------------------------------------------
|0 |TOP-N SORT       |    |1       |0|
|1 |└─TABLE FULL SCAN|t   |2       |0|
=================================================
Outputs & filters:
-------------------------------------
  0 - output([t.c1], [t.c2]), filter(nil), rowset=16
      sort_keys([negative_inner_product(t.c1, cast(array(0, 1, 1), ARRAY(18, -1))), ASC]), topn(1)
  1 - output([t.c2], [t.c1]), filter(nil), rowset=16
      access([t.c2], [t.c1]), partitions(p0)
      is_index_back=false, is_global_index=false, 
      123
select * from t order by negative_inner_product(c1, [0,1,1]) limit 1;
c1	c2
[2,2,2]	2
explain select * from t order by l2_distance(c1, [0,1,1]) limit 1;
Query Plan
=================================================
|ID|OPERATOR         |NAME|EST.ROWS|EST.TIME(us)|
-------------------------------------------------
|0 |TOP-N SORT       |    |1       |0|
|1 |└─TABLE FULL SCAN|t   |2       |0|
=================================================
Outputs & filters:
-------------------------------------
  0 - output([t.c1], [t.c2]), filter(nil), rowset=16
      sort_keys([l2_distance(t.c1, cast(array(0, 1, 1), ARRAY(18, -1))), ASC]), topn(1)
  1 - output([t.c2], [t.c1]), filter(nil), rowset=16
      access([t.c2], [t.c1]), partitions(p0)
      is_index_back=false, is_global_index=false, 
      123
select * from t order by l2_distance(c1, [0,1,1]) limit 1;
c1	c2
[1,1,1]	1
drop table if exists t;
create table t(c1 vector(3), c2 int, primary key(c2), vector index idx_1(c1) with (distance=l2,type=hnsw));
insert into t values('[1,1,1]',1),('[2,2,2]',2);
explain select * from t order by inner_product(c1, [0,1,1]) approx limit 1;
Query Plan
=================================================
|ID|OPERATOR         |NAME|EST.ROWS|EST.TIME(us)|
-------------------------------------------------
|0 |TOP-N SORT       |    |1       |0|
|1 |└─TABLE FULL SCAN|t   |2       |0|
=================================================
Outputs & filters:
-------------------------------------
  0 - output([t.c1], [t.c2]), filter(nil), rowset=16
      sort_keys([inner_product(t.c1, cast(array(0, 1, 1), ARRAY(18, -1))), ASC]), topn(1)
  1 - output([t.c2], [t.c1]), filter(nil), rowset=16
      access([t.c2], [t.c1]), partitions(p0)
      is_index_back=false, is_global_index=false, 
      123
select * from t order by inner_product(c1, [0,1,1]) approx limit 1;
c1	c2
[1,1,1]	1
explain select * from t order by negative_inner_product(c1, [0,1,1]) approx limit 1;
Query Plan
=================================================
|ID|OPERATOR         |NAME|EST.ROWS|EST.TIME(us)|
-------------------------------------------------
|0 |TOP-N SORT       |    |1       |0|
|1 |└─TABLE FULL SCAN|t   |2       |0|
=================================================
Outputs & filters:
-------------------------------------
  0 - output([t.c1], [t.c2]), filter(nil), rowset=16
      sort_keys([negative_inner_product(t.c1, cast(array(0, 1, 1), ARRAY(18, -1))), ASC]), topn(1)
  1 - output([t.c2], [t.c1]), filter(nil), rowset=16
      access([t.c2], [t.c1]), partitions(p0)
      is_index_back=false, is_global_index=false, 
      123
select * from t order by negative_inner_product(c1, [0,1,1]) approx limit 1;
c1	c2
[2,2,2]	2
drop index idx_1 on t;
create vector index idx_1 on t(c1) with (distance=inner_product,type=hnsw);
explain select * from t order by l2_distance(c1, [0,1,1]) approx limit 1;
Query Plan
=================================================
|ID|OPERATOR         |NAME|EST.ROWS|EST.TIME(us)|
-------------------------------------------------
|0 |TOP-N SORT       |    |1       |0|
|1 |└─TABLE FULL SCAN|t   |2       |0|
=================================================
Outputs & filters:
-------------------------------------
  0 - output([t.c1], [t.c2]), filter(nil), rowset=16
      sort_keys([l2_distance(t.c1, cast(array(0, 1, 1), ARRAY(18, -1))), ASC]), topn(1)
  1 - output([t.c2], [t.c1]), filter(nil), rowset=16
      access([t.c2], [t.c1]), partitions(p0)
      is_index_back=false, is_global_index=false, 
      123
select * from t order by l2_distance(c1, [0,1,1]) approx limit 1;
c1	c2
[1,1,1]	1
drop table if exists t;
create table t(c1 vector(3), c2 int, primary key(c2), vector index idx_1(c1) with (distance=inner_product,type=hnsw));
insert into t values('[1,1,1]',1),('[2,2,2]',2);
explain select * from t order by inner_product(c1, [0,1,1]) approx limit 1;
Query Plan
=================================================
|ID|OPERATOR         |NAME|EST.ROWS|EST.TIME(us)|
-------------------------------------------------
|0 |TOP-N SORT       |    |1       |0|
|1 |└─TABLE FULL SCAN|t   |2       |0|
=================================================
Outputs & filters:
-------------------------------------
  0 - output([t.c1], [t.c2]), filter(nil), rowset=16
      sort_keys([inner_product(t.c1, cast(array(0, 1, 1), ARRAY(18, -1))), ASC]), topn(1)
  1 - output([t.c2], [t.c1]), filter(nil), rowset=16
      access([t.c2], [t.c1]), partitions(p0)
      is_index_back=false, is_global_index=false, 
      123
select * from t order by inner_product(c1, [0,1,1]) approx limit 1;
c1	c2
[1,1,1]	1
drop table if exists t;
create table t(c1 vector(3), c2 int, primary key(c2), vector index idx_1(c1) with (distance=inner_product,type=hnsw));
insert into t values('[1,1,1]',1),('[2,2,2]',2);
explain select * from t order by negative_inner_product(c1, [0,1,1]) approx limit 1;
Query Plan
===================================================
|ID|OPERATOR       |NAME    |EST.ROWS|EST.TIME(us)|
---------------------------------------------------
|0 |TABLE FULL SCAN|t(idx_1)|2       |0|
===================================================
Outputs & filters:
-------------------------------------
  0 - output([t.c1], [t.c2]), filter(nil), rowset=16
      access([t.c2], [t.c1]), partitions(p0)
      is_index_back=true, is_global_index=false, 
      123
select * from t order by negative_inner_product(c1, [0,1,1]) approx limit 1;
c1	c2
[2,2,2]	2
drop index idx_1 on t;
create vector index idx_1 on t(c1) with (distance=l2,type=hnsw);
explain select * from t order by l2_distance(c1, [0,1,1]) approx limit 1;
Query Plan
===================================================
|ID|OPERATOR       |NAME    |EST.ROWS|EST.TIME(us)|
---------------------------------------------------
|0 |TABLE FULL SCAN|t(idx_1)|1       |0|
===================================================
Outputs & filters:
-------------------------------------
  0 - output([t.c1], [t.c2]), filter(nil), rowset=16
      access([t.c2], [t.c1]), partitions(p0)
      is_index_back=true, is_global_index=false, 
      123
select * from t order by l2_distance(c1, [0,1,1]) approx limit 1;
c1	c2
[1,1,1]	1
drop table if exists t;
create table t(c1 vector(3), c2 int, primary key(c2));
insert into t values('[1,1,1]',1),('[2,2,2]',2);
explain select * from t order by negative_inner_product(c1, [0,1,1]) approx limit 1;
Query Plan
=================================================
|ID|OPERATOR         |NAME|EST.ROWS|EST.TIME(us)|
-------------------------------------------------
|0 |TOP-N SORT       |    |1       |0|
|1 |└─TABLE FULL SCAN|t   |2       |0|
=================================================
Outputs & filters:
-------------------------------------
  0 - output([t.c1], [t.c2]), filter(nil), rowset=16
      sort_keys([negative_inner_product(t.c1, cast(array(0, 1, 1), ARRAY(18, -1))), ASC]), topn(1)
  1 - output([t.c2], [t.c1]), filter(nil), rowset=16
      access([t.c2], [t.c1]), partitions(p0)
      is_index_back=false, is_global_index=false, 
      123
select * from t order by negative_inner_product(c1, [0,1,1]) approx limit 1;
c1	c2
[2,2,2]	2
explain select * from t order by l2_distance(c1, [0,1,1]) approx limit 1;
Query Plan
=================================================
|ID|OPERATOR         |NAME|EST.ROWS|EST.TIME(us)|
-------------------------------------------------
|0 |TOP-N SORT       |    |1       |0|
|1 |└─TABLE FULL SCAN|t   |2       |0|
=================================================
Outputs & filters:
-------------------------------------
  0 - output([t.c1], [t.c2]), filter(nil), rowset=16
      sort_keys([l2_distance(t.c1, cast(array(0, 1, 1), ARRAY(18, -1))), ASC]), topn(1)
  1 - output([t.c2], [t.c1]), filter(nil), rowset=16
      access([t.c2], [t.c1]), partitions(p0)
      is_index_back=false, is_global_index=false, 
      123
select * from t order by l2_distance(c1, [0,1,1]) approx limit 1;
c1	c2
[1,1,1]	1
explain select * from t order by inner_product(c1, [0,1,1]) approx limit 1;
Query Plan
=================================================
|ID|OPERATOR         |NAME|EST.ROWS|EST.TIME(us)|
-------------------------------------------------
|0 |TOP-N SORT       |    |1       |0|
|1 |└─TABLE FULL SCAN|t   |2       |0|
=================================================
Outputs & filters:
-------------------------------------
  0 - output([t.c1], [t.c2]), filter(nil), rowset=16
      sort_keys([inner_product(t.c1, cast(array(0, 1, 1), ARRAY(18, -1))), ASC]), topn(1)
  1 - output([t.c2], [t.c1]), filter(nil), rowset=16
      access([t.c2], [t.c1]), partitions(p0)
      is_index_back=false, is_global_index=false, 
      123
select * from t order by inner_product(c1, [0,1,1]) approx limit 1;
c1	c2
[1,1,1]	1
drop table if exists t;
create table t(c1 vector(3), c2 int, primary key(c2));
insert into t values('[1,1,1]',1),('[2,2,2]',2);
explain select * from t order by l1_distance(c1, [0,1,1]) approx limit 1;
ERROR 0A000: Using vector index without vector_sort_expr is not supported
select * from t order by l1_distance(c1, [0,1,1]) approx limit 1;
ERROR 0A000: Using vector index without vector_sort_expr is not supported
create vector index idx_1 on t(c1) with(distance=inner_product, type=hnsw);
explain select * from t order by l1_distance(c1, [0,1,1]) approx limit 1;
ERROR 0A000: Using vector index without vector_sort_expr is not supported
select * from t order by l1_distance(c1, [0,1,1]) approx limit 1;
ERROR 0A000: Using vector index without vector_sort_expr is not supported
drop table if exists t;
create table t(c1 vector(3), c2 int, primary key(c2), vector index idx_1(c1) with (distance=l2,type=hnsw));
insert into t values('[1,1,1]',1),('[2,2,2]',2);
explain select * from t order by inner_product(c1, [0,1,1]) approx limit 1;
Query Plan
=================================================
|ID|OPERATOR         |NAME|EST.ROWS|EST.TIME(us)|
-------------------------------------------------
|0 |TOP-N SORT       |    |1       |0|
|1 |└─TABLE FULL SCAN|t   |2       |0|
=================================================
Outputs & filters:
-------------------------------------
  0 - output([t.c1], [t.c2]), filter(nil), rowset=16
      sort_keys([inner_product(t.c1, cast(array(0, 1, 1), ARRAY(18, -1))), ASC]), topn(1)
  1 - output([t.c2], [t.c1]), filter(nil), rowset=16
      access([t.c2], [t.c1]), partitions(p0)
      is_index_back=false, is_global_index=false, 
      123
select * from t order by inner_product(c1, [0,1,1]) approx limit 1;
c1	c2
[1,1,1]	1
explain select * from t order by negative_inner_product(c1, [0,1,1]) approx limit 1;
Query Plan
=================================================
|ID|OPERATOR         |NAME|EST.ROWS|EST.TIME(us)|
-------------------------------------------------
|0 |TOP-N SORT       |    |1       |0|
|1 |└─TABLE FULL SCAN|t   |2       |0|
=================================================
Outputs & filters:
-------------------------------------
  0 - output([t.c1], [t.c2]), filter(nil), rowset=16
      sort_keys([negative_inner_product(t.c1, cast(array(0, 1, 1), ARRAY(18, -1))), ASC]), topn(1)
  1 - output([t.c2], [t.c1]), filter(nil), rowset=16
      access([t.c2], [t.c1]), partitions(p0)
      is_index_back=false, is_global_index=false, 
      123
select * from t order by negative_inner_product(c1, [0,1,1]) approx limit 1;
c1	c2
[2,2,2]	2
drop index idx_1 on t;
create vector index idx_1 on t(c1) with (distance=inner_product,type=hnsw);
explain select * from t order by l2_distance(c1, [0,1,1]) approx limit 1;
Query Plan
=================================================
|ID|OPERATOR         |NAME|EST.ROWS|EST.TIME(us)|
-------------------------------------------------
|0 |TOP-N SORT       |    |1       |0|
|1 |└─TABLE FULL SCAN|t   |2       |0|
=================================================
Outputs & filters:
-------------------------------------
  0 - output([t.c1], [t.c2]), filter(nil), rowset=16
      sort_keys([l2_distance(t.c1, cast(array(0, 1, 1), ARRAY(18, -1))), ASC]), topn(1)
  1 - output([t.c2], [t.c1]), filter(nil), rowset=16
      access([t.c2], [t.c1]), partitions(p0)
      is_index_back=false, is_global_index=false, 
      123
select * from t order by l2_distance(c1, [0,1,1]) approx limit 1;
c1	c2
[1,1,1]	1
drop table if exists t;
create table t(c1 vector(3), c2 int, primary key(c2), vector index idx_1(c1) with (distance=inner_product,type=hnsw));
insert into t values('[1,1,1]',1),('[2,2,2]',2);
explain select * from t order by inner_product(c1, [0,1,1]) approx limit 1;
Query Plan
=================================================
|ID|OPERATOR         |NAME|EST.ROWS|EST.TIME(us)|
-------------------------------------------------
|0 |TOP-N SORT       |    |1       |0|
|1 |└─TABLE FULL SCAN|t   |2       |0|
=================================================
Outputs & filters:
-------------------------------------
  0 - output([t.c1], [t.c2]), filter(nil), rowset=16
      sort_keys([inner_product(t.c1, cast(array(0, 1, 1), ARRAY(18, -1))), ASC]), topn(1)
  1 - output([t.c2], [t.c1]), filter(nil), rowset=16
      access([t.c2], [t.c1]), partitions(p0)
      is_index_back=false, is_global_index=false, 
      123
select * from t order by inner_product(c1, [0,1,1]) approx limit 1;
c1	c2
[1,1,1]	1
drop table if exists t;
create table t(c1 vector(3), c2 int, primary key(c2), vector index idx_1(c1) with (distance=inner_product,type=hnsw));
insert into t values('[1,1,1]',1),('[2,2,2]',2);
explain select * from t order by negative_inner_product(c1, [0,1,1]) approx limit 1;
Query Plan
===================================================
|ID|OPERATOR       |NAME    |EST.ROWS|EST.TIME(us)|
---------------------------------------------------
|0 |TABLE FULL SCAN|t(idx_1)|2       |0|
===================================================
Outputs & filters:
-------------------------------------
  0 - output([t.c1], [t.c2]), filter(nil), rowset=16
      access([t.c2], [t.c1]), partitions(p0)
      is_index_back=true, is_global_index=false, 
      123
select * from t order by negative_inner_product(c1, [0,1,1]) approx limit 1;
c1	c2
[2,2,2]	2
drop index idx_1 on t;
create vector index idx_1 on t(c1) with (distance=l2,type=hnsw);
explain select * from t order by l2_distance(c1, [0,1,1]) approx limit 1;
Query Plan
===================================================
|ID|OPERATOR       |NAME    |EST.ROWS|EST.TIME(us)|
---------------------------------------------------
|0 |TABLE FULL SCAN|t(idx_1)|1       |0|
===================================================
Outputs & filters:
-------------------------------------
  0 - output([t.c1], [t.c2]), filter(nil), rowset=16
      access([t.c2], [t.c1]), partitions(p0)
      is_index_back=true, is_global_index=false, 
      123
select * from t order by l2_distance(c1, [0,1,1]) approx limit 1;
c1	c2
[1,1,1]	1
drop table if exists t;
create table t(c1 vector(3), c2 int, primary key(c2));
insert into t values('[1,1,1]',1),('[2,2,2]',2);
explain select * from t order by negative_inner_product(c1, [0,1,1]) approx limit 1;
Query Plan
=================================================
|ID|OPERATOR         |NAME|EST.ROWS|EST.TIME(us)|
-------------------------------------------------
|0 |TOP-N SORT       |    |1       |0|
|1 |└─TABLE FULL SCAN|t   |2       |0|
=================================================
Outputs & filters:
-------------------------------------
  0 - output([t.c1], [t.c2]), filter(nil), rowset=16
      sort_keys([negative_inner_product(t.c1, cast(array(0, 1, 1), ARRAY(18, -1))), ASC]), topn(1)
  1 - output([t.c2], [t.c1]), filter(nil), rowset=16
      access([t.c2], [t.c1]), partitions(p0)
      is_index_back=false, is_global_index=false, 
      123
select * from t order by negative_inner_product(c1, [0,1,1]) approx limit 1;
c1	c2
[2,2,2]	2
explain select * from t order by l2_distance(c1, [0,1,1]) approx limit 1;
Query Plan
=================================================
|ID|OPERATOR         |NAME|EST.ROWS|EST.TIME(us)|
-------------------------------------------------
|0 |TOP-N SORT       |    |1       |0|
|1 |└─TABLE FULL SCAN|t   |2       |0|
=================================================
Outputs & filters:
-------------------------------------
  0 - output([t.c1], [t.c2]), filter(nil), rowset=16
      sort_keys([l2_distance(t.c1, cast(array(0, 1, 1), ARRAY(18, -1))), ASC]), topn(1)
  1 - output([t.c2], [t.c1]), filter(nil), rowset=16
      access([t.c2], [t.c1]), partitions(p0)
      is_index_back=false, is_global_index=false, 
      123
select * from t order by l2_distance(c1, [0,1,1]) approx limit 1;
c1	c2
[1,1,1]	1
explain select * from t order by inner_product(c1, [0,1,1]) approx limit 1;
Query Plan
=================================================
|ID|OPERATOR         |NAME|EST.ROWS|EST.TIME(us)|
-------------------------------------------------
|0 |TOP-N SORT       |    |1       |0|
|1 |└─TABLE FULL SCAN|t   |2       |0|
=================================================
Outputs & filters:
-------------------------------------
  0 - output([t.c1], [t.c2]), filter(nil), rowset=16
      sort_keys([inner_product(t.c1, cast(array(0, 1, 1), ARRAY(18, -1))), ASC]), topn(1)
  1 - output([t.c2], [t.c1]), filter(nil), rowset=16
      access([t.c2], [t.c1]), partitions(p0)
      is_index_back=false, is_global_index=false, 
      123
select * from t order by inner_product(c1, [0,1,1]) approx limit 1;
c1	c2
[1,1,1]	1
drop table if exists t;
create table t(c1 vector(3), c2 int, primary key(c2));
insert into t values('[1,1,1]',1),('[2,2,2]',2);
explain select * from t order by l1_distance(c1, [0,1,1]) approx limit 1;
ERROR 0A000: Using vector index without vector_sort_expr is not supported
select * from t order by l1_distance(c1, [0,1,1]) approx limit 1;
ERROR 0A000: Using vector index without vector_sort_expr is not supported
create vector index idx_1 on t(c1) with(distance=inner_product, type=hnsw);
explain select * from t order by l1_distance(c1, [0,1,1]) approx limit 1;
ERROR 0A000: Using vector index without vector_sort_expr is not supported
select * from t order by l1_distance(c1, [0,1,1]) approx limit 1;
ERROR 0A000: Using vector index without vector_sort_expr is not supported
