#Environmental cleaning
drop user hjw@'%';
create user hjw identified by 'hjw';
grant all on *.* to hjw WITH GRANT OPTION;
#character-4  库默认gbk
set character_set_client =gbk;
set character_set_connection =gbk;
set character_set_results =gbk;
set character_set_database =gbk;
Show variables like 'character%';
Variable_name	Value
character_sets_dir	
character_set_client	gbk
character_set_connection	gbk
character_set_database	gbk
character_set_filesystem	binary
character_set_results	gbk
character_set_server	utf8mb4
character_set_system	utf8mb4
#character-4-2   存储过程
#while循环
drop procedure if exists procedure_1;
CREATE PROCEDURE procedure_1()
BEGIN
DECLARE i varchar(50) charset binary DEFAULT 1;
DECLARE j varchar(50) charset binary DEFAULT 50;
WHILE i < j  DO
select i from dual;
SET i = i + 1;
END WHILE;
COMMIT;
END /
call procedure_1();
i
i
i
i
i
1
2
3
4
5
drop procedure if exists procedure_1;
CREATE PROCEDURE procedure_1()
BEGIN
DECLARE i varchar(50) charset utf16 DEFAULT 1;
DECLARE j varchar(50) charset utf16 DEFAULT 50;
WHILE i < j  DO
select i from dual;
SET i = i + 1;
END WHILE;
COMMIT;
END /
call procedure_1();
i
i
i
i
i
1
2
3
4
5
drop procedure if exists procedure_1;
CREATE PROCEDURE procedure_1()
BEGIN
DECLARE i varchar(50) charset gbk DEFAULT 1;
DECLARE j varchar(50) charset gbk DEFAULT 50;
WHILE i < j  DO
select i from dual;
SET i = i + 1;
END WHILE;
COMMIT;
END /
call procedure_1();
i
i
i
i
i
1
2
3
4
5
drop procedure if exists procedure_1;
CREATE PROCEDURE procedure_1()
BEGIN
DECLARE i varchar(50) charset latin1 DEFAULT 1;
DECLARE j varchar(50) charset latin1 DEFAULT 50;
WHILE i < j  DO
select i from dual;
SET i = i + 1;
END WHILE;
COMMIT;
END /
call procedure_1();
i
i
i
i
i
1
2
3
4
5
drop procedure if exists procedure_1;
CREATE PROCEDURE procedure_1()
BEGIN
DECLARE i varchar(50) charset gb18030 DEFAULT 1;
DECLARE j varchar(50) charset gb18030 DEFAULT 50;
WHILE i < j  DO
select i from dual;
SET i = i + 1;
END WHILE;
COMMIT;
END /
call procedure_1();
i
i
i
i
i
1
2
3
4
5
drop procedure if exists procedure_1;
CREATE PROCEDURE procedure_1()
BEGIN
DECLARE i varchar(50) charset latin1 DEFAULT 'asas';
DECLARE j varchar(50) charset latin1 DEFAULT 'ऊँचाई ताप प्रदूषण में बिंदु पचास सेंटीमीटर';
WHILE i < j  DO
select i from dual;
SET i = i + 1;
END WHILE;
COMMIT;
END /
ERROR HY000: Incorrect string value
drop procedure if exists procedure_1;
CREATE PROCEDURE procedure_1()
BEGIN
DECLARE i varchar(50) charset gbk DEFAULT 'asas';
DECLARE j varchar(50) charset latin1 DEFAULT 'ऊँचाई ताप प्रदूषण में बिंदु पचास सेंटीमीटर';
WHILE i < j  DO
select i from dual;
SET i = i + 1;
END WHILE;
COMMIT;
END /
ERROR HY000: Incorrect string value
#while循环
drop procedure if exists procedure_1;
CREATE PROCEDURE PROCEDURE_1()
BEGIN
DECLARE i varchar(50) charset gbk DEFAULT '1';
DECLARE j varchar(50) charset binary DEFAULT 'ऊँचाई ताप प्रदूषण में बिंदु पचास सेंटीमीटर';
REPEAT
select i as a from dual;
SET i = i + 1;
UNTIL i > j-i+5 END REPEAT;
END;
/
ERROR HY000: Incorrect string value
drop procedure if exists procedure_1;
CREATE PROCEDURE PROCEDURE_1()
BEGIN
DECLARE i varchar(50) charset gbk DEFAULT '1';
DECLARE j varchar(50) charset utf16 DEFAULT 'ऊँचाई ताप प्रदूषण में बिंदु पचास सेंटीमीटर';
REPEAT
select i as a from dual;
SET i = i + 1;
UNTIL i > j-i+5 END REPEAT;
END;
/
ERROR HY000: Incorrect string value
drop procedure if exists procedure_1;
CREATE PROCEDURE PROCEDURE_1()
BEGIN
DECLARE i varchar(50) charset gbk DEFAULT '1';
DECLARE j varchar(50) charset gbk DEFAULT 'ऊँचाई ताप प्रदूषण में बिंदु पचास सेंटीमीटर';
REPEAT
select i as a from dual;
SET i = i + 1;
UNTIL i > j-i+5 END REPEAT;
END;
/
ERROR HY000: Incorrect string value
drop procedure if exists procedure_1;
CREATE PROCEDURE PROCEDURE_1()
BEGIN
DECLARE i varchar(50) charset gbk DEFAULT '1';
DECLARE j varchar(50) charset latin1 DEFAULT 'ऊँचाई ताप प्रदूषण में बिंदु पचास सेंटीमीटर';
REPEAT
select i as a from dual;
SET i = i + 1;
UNTIL i > j-i+5 END REPEAT;
END;
/
ERROR HY000: Incorrect string value
drop procedure if exists procedure_1;
CREATE PROCEDURE PROCEDURE_1()
BEGIN
DECLARE i varchar(50) charset gbk DEFAULT '1';
DECLARE j varchar(50) charset gb18030 DEFAULT 'ऊँचाई ताप प्रदूषण में बिंदु पचास सेंटीमीटर';
REPEAT
select i as a from dual;
SET i = i + 1;
UNTIL i > j-i+5 END REPEAT;
END;
/
ERROR HY000: Incorrect string value
#loop循环
drop procedure if exists procedure_1;
create procedure procedure_1()
begin
DECLARE i varchar(50) charset gbk DEFAULT '1';
DECLARE j varchar(50) charset gb18030 DEFAULT 'ऊँचाई ताप प्रदूषण में बिंदु पचास सेंटीमीटर';
lp : loop
select i as a from dual;
set i = i + 1;
if i > j-i+5 then
leave lp;
end if;
end loop;
end;
/
ERROR HY000: Incorrect string value
drop procedure if exists procedure_1;
create procedure procedure_1()
begin
DECLARE i varchar(50) charset gbk DEFAULT '1';
DECLARE j varchar(50) charset binary DEFAULT 'ऊँचाई ताप प्रदूषण में बिंदु पचास सेंटीमीटर';
lp : loop
select i as a from dual;
set i = i + 1;
if i > j-i+5 then
leave lp;
end if;
end loop;
end;
/
ERROR HY000: Incorrect string value
drop procedure if exists procedure_1;
create procedure procedure_1()
begin
DECLARE i varchar(50) charset gbk DEFAULT '1';
DECLARE j varchar(50) charset utf16 DEFAULT 'ऊँचाई ताप प्रदूषण में बिंदु पचास सेंटीमीटर';
lp : loop
select i as a from dual;
set i = i + 1;
if i > j-i+5 then
leave lp;
end if;
end loop;
end;
/
ERROR HY000: Incorrect string value
drop procedure if exists procedure_1;
create procedure procedure_1()
begin
DECLARE i varchar(50) charset gbk DEFAULT '1';
DECLARE j varchar(50) charset gbk DEFAULT 'ऊँचाई ताप प्रदूषण में बिंदु पचास सेंटीमीटर';
lp : loop
select i as a from dual;
set i = i + 1;
if i > j-i+5 then
leave lp;
end if;
end loop;
end;
/
ERROR HY000: Incorrect string value
drop procedure if exists procedure_1;
create procedure procedure_1()
begin
DECLARE i varchar(50) charset gbk DEFAULT '1';
DECLARE j varchar(50) charset latin1 DEFAULT 'ऊँचाई ताप प्रदूषण में बिंदु पचास सेंटीमीटर';
lp : loop
select i as a from dual;
set i = i + 1;
if i > j-i+5 then
leave lp;
end if;
end loop;
end;
/
ERROR HY000: Incorrect string value
drop procedure if exists procedure_1;
#character-3-3 触发器
#insert
drop table test1;
drop table test2;
drop TRIGGER TRIGGER_1;
ERROR HY000: Trigger does not exist
CREATE table test2(c1 int);
insert into test2 values(6);
select * from test2;
c1
6
CREATE TABLE test1(
h1 varchar(100),
h2 varchar(100) charset binary,
h3 varchar(100) charset utf16,
h4 varchar(100) charset gbk,
h5 varchar(100) charset latin1,
h6 varchar(100) charset gb18030);
CREATE TRIGGER TRIGGER_1 BEFORE UPDATE ON test2
FOR EACH ROW
BEGIN
insert into test1(h1,h2,h3,h6) values(
'Ah, itu resmi',
'Ah, waa rasmi',
'ah ????????????',
'ああ、それは公式です');
END ;
/
update test2 set c1=9;
select * from test1;
h1	h2	h3	h4	h5	h6
Ah, itu resmi	Ah, waa rasmi	ah ????????????	NULL	NULL	ああ、それは公式です
drop TRIGGER if EXISTS TRIGGER_1;
CREATE TRIGGER TRIGGER_1 BEFORE UPDATE ON test2
FOR EACH ROW
BEGIN
insert into test1(h4) values('Ah, ew ferm? ye');
END ;
/
update test2 set c1=9;
drop TRIGGER if EXISTS TRIGGER_1;
CREATE TRIGGER TRIGGER_1 BEFORE UPDATE ON test2
FOR EACH ROW
BEGIN
insert into test1(h5) values('ऊँचाई ताप प्रदूषण में बिंदु पचास सेंटीमीटर');
END ;
/
ERROR HY000: Incorrect string value
update test2 set c1=9;
drop TRIGGER if EXISTS TRIGGER_1;
Warnings:
Note	1360	Trigger does not exist
#update
select * from test1;
h1	h2	h3	h4	h5	h6
Ah, itu resmi	Ah, waa rasmi	ah ????????????	NULL	NULL	ああ、それは公式です
NULL	NULL	NULL	Ah, ew ferm? ye	NULL	NULL
select * from test2;
c1
9
CREATE TRIGGER TRIGGER_1 BEFORE UPDATE ON test2
FOR EACH ROW
BEGIN
update test1 set h5='dsgfagsd' where h5 is null;
update test1 set h4='aaaabaaa' where h4 is null;
END ;
/
update test2 set c1=4;
select * from test1;
h1	h2	h3	h4	h5	h6
Ah, itu resmi	Ah, waa rasmi	ah ????????????	aaaabaaa	dsgfagsd	ああ、それは公式です
NULL	NULL	NULL	Ah, ew ferm? ye	dsgfagsd	NULL
drop TRIGGER if EXISTS TRIGGER_1;
CREATE TRIGGER TRIGGER_1 BEFORE UPDATE ON test2
FOR EACH ROW
BEGIN
update test1 set
h1='ऊँचाई ताप प्रदूषण में बिंदु पचास सेंटीमीटर',
h2='Punto cinquanta ',
h3='Կետ հիսուն ',
h6='အမြင့်ငါးဆယ်စင်တီ။';
END ;
/
ERROR HY000: Incorrect string value
update test2 set c1=4;
select * from test1;
h1	h2	h3	h4	h5	h6
Ah, itu resmi	Ah, waa rasmi	ah ????????????	aaaabaaa	dsgfagsd	ああ、それは公式です
NULL	NULL	NULL	Ah, ew ferm? ye	dsgfagsd	NULL
drop TRIGGER if EXISTS TRIGGER_1;
Warnings:
Note	1360	Trigger does not exist
#delete
drop table test1;
drop table test2;
drop TRIGGER TRIGGER_1;
ERROR HY000: Trigger does not exist
CREATE table test2(c1 int);
insert into test2 values(6);
select * from test2;
c1
6
CREATE TABLE test1(
h1 varchar(100),
h2 varchar(100) charset binary,
h3 varchar(100) charset utf16,
h6 varchar(100) charset gb18030);
insert into test1(h1,h2,h3,h6) values(
'Ah, itu resmi',
'Ah, waa rasmi',
'ah ????????????',
'ああ、それは公式です');
select * from test1;
h1	h2	h3	h6
Ah, itu resmi	Ah, waa rasmi	ah ????????????	ああ、それは公式です
CREATE TRIGGER TRIGGER_1 BEFORE UPDATE ON test2
FOR EACH ROW
BEGIN
DELETE from test1 where h6='ああ、それは公式です';
END ;
/
update test2 set c1=4;
select * from test1;
h1	h2	h3	h6
drop TRIGGER if EXISTS TRIGGER_1;
drop table test1;
drop table test2;
#character-3-5 udf
#普通函数
drop FUNCTION func_1;
CREATE FUNCTION func_1(bb VARCHAR(150) charset binary)
RETURNS VARCHAR(150)
DETERMINISTIC
BEGIN
RETURN bb;
END ;
/
select func_1('ああ、それは公式です') from dual;
func_1('ああ、それは公式です')
ああ、それは公式です
DROP FUNCTION if EXISTS func_1;
CREATE FUNCTION func_1(bb VARCHAR(150) charset utf16)
RETURNS VARCHAR(150)
DETERMINISTIC
BEGIN
RETURN bb;
END ;
/
select func_1('ああ、それは公式です') from dual;
func_1('ああ、それは公式です')
ああ、それは公式です
DROP FUNCTION if EXISTS func_1;
CREATE FUNCTION func_1(bb VARCHAR(150) charset gbk)
RETURNS VARCHAR(150)
DETERMINISTIC
BEGIN
RETURN bb;
END ;
/
select func_1('ああ、それは公式です') from dual;
func_1('ああ、それは公式です')
ああ、それは公式です
DROP FUNCTION if EXISTS func_1;
CREATE FUNCTION func_1(bb VARCHAR(150) charset latin1)
RETURNS VARCHAR(150)
DETERMINISTIC
BEGIN
RETURN bb;
END ;
/
select func_1('ああ、それは公式です') from dual;
func_1('ああ、それは公式です')
???????????????
DROP FUNCTION if EXISTS func_1;
CREATE FUNCTION func_1(bb VARCHAR(150) charset gb18030)
RETURNS VARCHAR(150)
DETERMINISTIC
BEGIN
RETURN bb;
END ;
/
select func_1('ああ、それは公式です') from dual;
func_1('ああ、それは公式です')
ああ、それは公式です
#其他函数
DROP FUNCTION IF exists func_1;
create
function func_1(num1 varchar(150) charset gbk, num2 varchar(150) charset latin1)
returns varchar(150)
DETERMINISTIC
begin
declare res varchar(150);
if(num1 > num2) then
set res = num1;
elseif (num1 < num2) then
set res = num2;
else
set res = num1;
end if;
return res;
end;
/
Warnings:
Warning	5002	Resolve error
SELECT func_1(1,2);
ERROR HY000: Illegal mix of collations (gbk_chinese_ci,IMPLICIT), (latin1_swedish_ci,IMPLICIT)
SELECT func_1('dsagfsa','的赛果发热袜个人');
ERROR HY000: Illegal mix of collations (gbk_chinese_ci,IMPLICIT), (latin1_swedish_ci,IMPLICIT)
SELECT func_1('的赛果发热袜个人','dsagfsa');
ERROR HY000: Illegal mix of collations (gbk_chinese_ci,IMPLICIT), (latin1_swedish_ci,IMPLICIT)
SELECT func_1('的赛果发热袜个人','ああ、それは公式です');
ERROR HY000: Illegal mix of collations (gbk_chinese_ci,IMPLICIT), (latin1_swedish_ci,IMPLICIT)
SELECT func_1('ああ、それは公式です','的赛果发热袜个人');
ERROR HY000: Illegal mix of collations (gbk_chinese_ci,IMPLICIT), (latin1_swedish_ci,IMPLICIT)
DROP FUNCTION IF exists func_1;
#########清空回收站,删除测试数据库,表等 ##########
drop user hjw@'%' ;
