#Environmental cleaning
drop user hjw@'%';
create user hjw identified by 'hjw';
grant all on *.* to hjw WITH GRANT OPTION;
#character-7	  字符集不一致
#character-7-3 租户为默认gb18030
purge recyclebin;
drop user if exists ucharset ;
create user 'ucharset' identified by 'larp123';
grant all privileges on *.* to 'ucharset' with grant option;
SELECT @@character_set_connection;
@@character_set_connection
utf8mb4
set names gbk;
SELECT @@character_set_connection;
@@character_set_connection
gbk
set character_set_database =gbk;
Show variables like 'character%';
Variable_name	Value
character_sets_dir	
character_set_client	gbk
character_set_connection	gbk
character_set_database	gbk
character_set_filesystem	binary
character_set_results	gbk
character_set_server	utf8mb4
character_set_system	utf8mb4
#存储过程=====while循环
drop procedure if exists procedure_1;
CREATE PROCEDURE procedure_1()
BEGIN
DECLARE i varchar(50) DEFAULT 1;
DECLARE j varchar(50) DEFAULT 10;
WHILE i < j  DO
SELECT CONVERT('राति जकाँ' USING utf8) AS c1;
SELECT CONVERT('手段和各位和特务' USING gbk) AS c2;
SET i = i + 1;
END WHILE;
COMMIT;
END /
call procedure_1();
c1
c2
राति जकाँ
手段和各位和特务
#repeat循环
drop procedure if exists procedure_1;
CREATE PROCEDURE PROCEDURE_1()
BEGIN
DECLARE i varchar(50) DEFAULT 1;
DECLARE j varchar(50) DEFAULT 1;
REPEAT
SELECT CONVERT('राति जकाँ' USING utf8) AS c1;
SELECT CONVERT('手段和各位和特务' USING gbk) AS c2;
SET i = i + 1;
UNTIL i > j-i+5 END REPEAT;
END;
/
call procedure_1();
c1
c2
c1
c2
c1
c2
राति जकाँ
手段和各位和特务
राति जकाँ
手段和各位和特务
राति जकाँ
手段和各位和特务
#loop循环
drop procedure if exists procedure_1;
create procedure procedure_1()
begin
DECLARE i varchar(50) DEFAULT 1;
DECLARE j varchar(50) DEFAULT 1;
lp : loop
SELECT CONVERT('राति जकाँ' USING utf8) AS c1;
SELECT CONVERT('手段和各位和特务' USING gbk) AS c2;
set i = i + 1;
if i > j-i+5 then
leave lp;
end if;
end loop;
end;
/
call procedure_1();
c1
c2
c1
c2
c1
c2
राति जकाँ
手段和各位和特务
राति जकाँ
手段和各位和特务
राति जकाँ
手段和各位和特务
#触发器======insert
#insert
drop table test1;
drop table test2;
drop TRIGGER TRIGGER_1;
ERROR HY000: Trigger does not exist
CREATE table test2(c1 int);
insert into test2 values(6);
select * from test2;
c1
6
CREATE TABLE test1(
h1 varchar(100),
h2 varchar(100) charset latin1,
h3 varchar(100) charset gb18030);
CREATE TRIGGER TRIGGER_1 BEFORE UPDATE ON test2
FOR EACH ROW
BEGIN
insert into test1(h1,h2,h3) values(
'爱人覅我确认',
(SELECT CONVERT('u饿哦通过' USING utf8)),
(SELECT CONVERT('राति जकाँ'  USING gb18030)));
END ;
/
Warnings:
Warning	5884	TRIGGER 'test.TRIGGER_1' compile error
update test2 set c1=9;
ERROR HY000: Incorrect string value
select * from test1;
h1	h2	h3
drop TRIGGER if EXISTS TRIGGER_1;
CREATE TRIGGER TRIGGER_1 BEFORE UPDATE ON test2
FOR EACH ROW
BEGIN
insert into test1(h1,h2,h3) values(
'认为他还让我挺好',
(SELECT CONVERT('shgtrsराति' USING utf8)),
(SELECT CONVERT('राति safrs'  USING gb18030)));
END ;
/
Warnings:
Warning	5884	TRIGGER 'test.TRIGGER_1' compile error
update test2 set c1=9;
ERROR HY000: Incorrect string value
select * from test1;
h1	h2	h3
drop TRIGGER if EXISTS TRIGGER_1;
#触发器======update
CREATE TRIGGER TRIGGER_1 BEFORE UPDATE ON test2
FOR EACH ROW
BEGIN
update test1 set h1='的手工缝纫',h2=(SELECT CONVERT('dshbewgt' USING utf8)),h3=(SELECT CONVERT('任务和沙特人'  USING gb18030)) where h1='爱人覅我确认';
END ;
/
ERROR HY000: Incorrect string value
update test2 set c1=9;
select * from test1;
h1	h2	h3
#触发器======delete
drop TRIGGER if EXISTS TRIGGER_1;
Warnings:
Note	1360	Trigger does not exist
CREATE TRIGGER TRIGGER_1 BEFORE UPDATE ON test2
FOR EACH ROW
BEGIN
delete from test1 where h2=(SELECT CONVERT('dshbewgt' USING utf8));
END ;
/
update test2 set c1=9;
select * from test1;
h1	h2	h3
drop TRIGGER if EXISTS TRIGGER_1;
CREATE TRIGGER TRIGGER_1 BEFORE UPDATE ON test2
FOR EACH ROW
BEGIN
delete from test1 where h2=(SELECT CONVERT(null USING gb18030));
END ;
/
update test2 set c1=9;
ERROR HY000: Illegal mix of collations (latin1_swedish_ci,IMPLICIT), (gb18030_chinese_ci,IMPLICIT)
select * from test1;
h1	h2	h3
#自定义函数
drop FUNCTION if EXISTS func_1;
CREATE FUNCTION func_1(bb VARCHAR(150) charset utf8)
RETURNS VARCHAR(150)
DETERMINISTIC
BEGIN
RETURN bb;
END ;
/
select func_1(null) from dual;
func_1(null)
NULL
select func_1('dsahfiwr') from dual;
func_1('dsahfiwr')
dsahfiwr
select func_1('和个人四u额我个人') from dual;
func_1('和个人四u额我个人')
和个人四u额我个人
select func_1('जर्मन हाय हमरा देबाक लेल कहलक') from dual;
ERROR HY000: Incorrect string value
drop FUNCTION if EXISTS func_1;
CREATE FUNCTION func_1(bb VARCHAR(150) charset gbk)
RETURNS VARCHAR(150)
DETERMINISTIC
BEGIN
RETURN (select '和个人四u额我个人' from dual);
END ;
/
select func_1(null) from dual;
func_1(null)
和个人四u额我个人
select func_1('dsahfiwr') from dual;
func_1('dsahfiwr')
和个人四u额我个人
select func_1('和个人四u额我个人') from dual;
func_1('和个人四u额我个人')
和个人四u额我个人
select func_1('जर्मन हाय हमरा देबाक लेल कहलक') from dual;
ERROR HY000: Incorrect string value
#库latin1/字段utf8/gbk
SELECT @@character_set_connection;
@@character_set_connection
gbk
set names latin1;
SELECT @@character_set_connection;
@@character_set_connection
latin1
set character_set_database =latin1;
Show variables like 'character%';
Variable_name	Value
character_sets_dir	
character_set_client	latin1
character_set_connection	latin1
character_set_database	latin1
character_set_filesystem	binary
character_set_results	latin1
character_set_server	utf8mb4
character_set_system	utf8mb4
#存储过程=====while循环
drop procedure if exists procedure_1;
CREATE PROCEDURE procedure_1()
BEGIN
DECLARE i varchar(50) DEFAULT 1;
DECLARE j varchar(50) DEFAULT 10;
WHILE i < j  DO
SELECT CONVERT('手段和各位和特务' USING gbk) AS c1;
SELECT CONVERT('手段和各位和特务' USING utf8) AS c2;
SELECT CONVERT('राति जकाँ' USING UTF8) AS c3;
SET i = i + 1;
END WHILE;
COMMIT;
END /
call procedure_1();
c1
c2
c3
?�?????�????????�??�????
手段和各位和特务
राति जकाँ
#repeat循环
drop procedure if exists procedure_1;
CREATE PROCEDURE PROCEDURE_1()
BEGIN
DECLARE i varchar(50) DEFAULT 1;
DECLARE j varchar(50) DEFAULT 1;
REPEAT
SELECT CONVERT('手段和各位和特务' USING gbk) AS c1;
SELECT CONVERT('手段和各位和特务' USING utf8) AS c2;
SELECT CONVERT('राति जकाँ' USING UTF8) AS c3;
SET i = i + 1;
UNTIL i > j-i+5 END REPEAT;
END;
/
call procedure_1();
c1
c2
c3
c1
c2
c3
c1
c2
c3
?�?????�????????�??�????
手段和各位和特务
राति जकाँ
?�?????�????????�??�????
手段和各位和特务
राति जकाँ
?�?????�????????�??�????
手段和各位和特务
राति जकाँ
#loop循环
drop procedure if exists procedure_1;
create procedure procedure_1()
begin
DECLARE i varchar(50) DEFAULT 1;
DECLARE j varchar(50) DEFAULT 1;
lp : loop
SELECT CONVERT('手段和各位和特务' USING gbk) AS c1;
SELECT CONVERT('手段和各位和特务' USING utf8) AS c2;
SELECT CONVERT('राति जकाँ' USING UTF8) AS c3;
set i = i + 1;
if i > j-i+5 then
leave lp;
end if;
end loop;
end;
/
call procedure_1();
c1
c2
c3
c1
c2
c3
c1
c2
c3
?�?????�????????�??�????
手段和各位和特务
राति जकाँ
?�?????�????????�??�????
手段和各位和特务
राति जकाँ
?�?????�????????�??�????
手段和各位和特务
राति जकाँ
#触发器======insert
#insert
drop table test1;
drop table test2;
drop TRIGGER TRIGGER_1;
ERROR HY000: Trigger does not exist
CREATE table test2(c1 int);
insert into test2 values(6);
select * from test2;
c1
6
CREATE TABLE test1(
h1 varchar(100),
h2 varchar(100) charset gbk,
h3 varchar(100) charset gb18030);
CREATE TRIGGER TRIGGER_1 BEFORE UPDATE ON test2
FOR EACH ROW
BEGIN
insert into test1(h1,h2,h3) values(
'爱人覅我确认',
(SELECT CONVERT('u饿哦通过' USING gbk)),
(SELECT CONVERT('राति जकाँ'  USING utf8)));
END ;
/
update test2 set c1=9;
select * from test1;
h1	h2	h3
爱人覅我确认	u�???�?�??�??	राति जकाँ
drop TRIGGER if EXISTS TRIGGER_1;
CREATE TRIGGER TRIGGER_1 BEFORE UPDATE ON test2
FOR EACH ROW
BEGIN
insert into test1(h1,h2,h3) values(
'认为他还让我挺好',
(SELECT CONVERT('shgtrsराति' USING gbk)),
(SELECT CONVERT('राति safrs'  USING utf8)));
END ;
/
update test2 set c1=9;
select * from test1;
h1	h2	h3
爱人覅我确认	u�???�?�??�??	राति जकाँ
认为他还让我挺好	shgtrsर�?त�?	राति safrs
drop TRIGGER if EXISTS TRIGGER_1;
#触发器======update
CREATE TRIGGER TRIGGER_1 BEFORE UPDATE ON test2
FOR EACH ROW
BEGIN
update test1 set h1='的手工缝纫',h2=(SELECT CONVERT('dshbewgt' USING gbk)),h3=(SELECT CONVERT('任务和沙特人'  USING utf8)) where h1='爱人覅我确认';
END ;
/
update test2 set c1=9;
select * from test1;
h1	h2	h3
的手工缝纫	dshbewgt	任务和沙特人
认为他还让我挺好	shgtrsर�?त�?	राति safrs
drop TRIGGER if EXISTS TRIGGER_1;
#触发器======delete
CREATE TRIGGER TRIGGER_1 BEFORE UPDATE ON test2
FOR EACH ROW
BEGIN
delete from test1 where h2=(SELECT CONVERT('dshbewgt' USING gbk));
END ;
/
update test2 set c1=9;
select * from test1;
h1	h2	h3
认为他还让我挺好	shgtrsर�?त�?	राति safrs
drop TRIGGER if EXISTS TRIGGER_1;
CREATE TRIGGER TRIGGER_1 BEFORE UPDATE ON test2
FOR EACH ROW
BEGIN
delete from test1 where h2=(SELECT CONVERT(null USING utf8));
END ;
/
update test2 set c1=9;
select * from test1;
h1	h2	h3
认为他还让我挺好	shgtrsर�?त�?	राति safrs
#character-7-4 租户为默认latin1
purge recyclebin;
SELECT @@character_set_connection;
@@character_set_connection
latin1
set names utf8;
SELECT @@character_set_connection;
@@character_set_connection
utf8mb4
set character_set_database =utf8;
Show variables like 'character%';
Variable_name	Value
character_sets_dir	
character_set_client	utf8mb4
character_set_connection	utf8mb4
character_set_database	utf8mb4
character_set_filesystem	binary
character_set_results	utf8mb4
character_set_server	utf8mb4
character_set_system	utf8mb4
#库utf8/表字段gbk/18030
#存储过程=====while循环
drop procedure if exists procedure_1;
CREATE PROCEDURE procedure_1()
BEGIN
DECLARE i varchar(50) DEFAULT 1;
DECLARE j varchar(50) DEFAULT 10;
WHILE i < j  DO
SELECT CONVERT('手段和各位和特务' USING gbk) AS c1;
SELECT CONVERT('手段和各位和特务' USING gb18030) AS c2;
SELECT CONVERT('राति जकाँ' USING UTF8) AS c3;
SET i = i + 1;
END WHILE;
COMMIT;
END /
call procedure_1();
c1
c2
c3
手段和各位和特务
手段和各位和特务
राति जकाँ
#repeat循环
drop procedure if exists procedure_1;
CREATE PROCEDURE PROCEDURE_1()
BEGIN
DECLARE i varchar(50) DEFAULT 1;
DECLARE j varchar(50) DEFAULT 1;
REPEAT
SELECT CONVERT('手段和各位和特务' USING gbk) AS c1;
SELECT CONVERT('手段和各位和特务' USING gb18030) AS c2;
SELECT CONVERT('राति जकाँ' USING UTF8) AS c3;
SET i = i + 1;
UNTIL i > j-i+5 END REPEAT;
END;
/
call procedure_1();
c1
c2
c3
c1
c2
c3
c1
c2
c3
手段和各位和特务
手段和各位和特务
राति जकाँ
手段和各位和特务
手段和各位和特务
राति जकाँ
手段和各位和特务
手段和各位和特务
राति जकाँ
#loop循环
drop procedure if exists procedure_1;
create procedure procedure_1()
begin
DECLARE i varchar(50) DEFAULT 1;
DECLARE j varchar(50) DEFAULT 1;
lp : loop
SELECT CONVERT('手段和各位和特务' USING gbk) AS c1;
SELECT CONVERT('手段和各位和特务' USING gb18030) AS c2;
SELECT CONVERT('राति जकाँ' USING UTF8) AS c3;
set i = i + 1;
if i > j-i+5 then
leave lp;
end if;
end loop;
end;
/
call procedure_1();
c1
c2
c3
c1
c2
c3
c1
c2
c3
手段和各位和特务
手段和各位和特务
राति जकाँ
手段和各位和特务
手段和各位和特务
राति जकाँ
手段和各位和特务
手段和各位和特务
राति जकाँ
#触发器======insert
#insert
drop table test1;
drop table test2;
drop TRIGGER TRIGGER_1;
ERROR HY000: Trigger does not exist
CREATE table test2(c1 int);
insert into test2 values(6);
select * from test2;
c1
6
CREATE TABLE test1(
h1 varchar(100),
h2 varchar(100) charset gbk,
h3 varchar(100) charset gb18030);
CREATE TRIGGER TRIGGER_1 BEFORE UPDATE ON test2
FOR EACH ROW
BEGIN
insert into test1(h1,h2,h3) values(
'爱人覅我确认',
(SELECT CONVERT('u饿哦通过' USING gbk)),
(SELECT CONVERT('राति जकाँ'  USING gb18030)));
END ;
/
update test2 set c1=9;
select * from test1;
h1	h2	h3
爱人覅我确认	u饿哦通过	राति जकाँ
drop TRIGGER if EXISTS TRIGGER_1;
CREATE TRIGGER TRIGGER_1 BEFORE UPDATE ON test2
FOR EACH ROW
BEGIN
insert into test1(h1,h2,h3) values(
'认为他还让我挺好',
(SELECT CONVERT('shgtrsराति' USING gbk)),
(SELECT CONVERT('राति safrs'  USING gb18030)));
END ;
/
update test2 set c1=9;
select * from test1;
h1	h2	h3
爱人覅我确认	u饿哦通过	राति जकाँ
认为他还让我挺好	shgtrs????	राति safrs
drop TRIGGER if EXISTS TRIGGER_1;
#触发器======update
CREATE TRIGGER TRIGGER_1 BEFORE UPDATE ON test2
FOR EACH ROW
BEGIN
update test1 set h1='的手工缝纫',h2=(SELECT CONVERT('dshbewgt' USING gbk)),h3=(SELECT CONVERT('任务和沙特人'  USING gb18030)) where h1='爱人覅我确认';
END ;
/
update test2 set c1=9;
select * from test1;
h1	h2	h3
的手工缝纫	dshbewgt	任务和沙特人
认为他还让我挺好	shgtrs????	राति safrs
drop TRIGGER if EXISTS TRIGGER_1;
#触发器======delete
CREATE TRIGGER TRIGGER_1 BEFORE UPDATE ON test2
FOR EACH ROW
BEGIN
delete from test1 where h2=(SELECT CONVERT('dshbewgt' USING gbk));
END ;
/
update test2 set c1=9;
select * from test1;
h1	h2	h3
认为他还让我挺好	shgtrs????	राति safrs
drop TRIGGER if EXISTS TRIGGER_1;
CREATE TRIGGER TRIGGER_1 BEFORE UPDATE ON test2
FOR EACH ROW
BEGIN
delete from test1 where h2=(SELECT CONVERT(null USING gb18030));
END ;
/
update test2 set c1=9;
ERROR HY000: Illegal mix of collations (gbk_chinese_ci,IMPLICIT), (gb18030_chinese_ci,IMPLICIT)
select * from test1;
h1	h2	h3
认为他还让我挺好	shgtrs????	राति safrs
#库gbk/字段utf8/18030
SELECT @@character_set_connection;
@@character_set_connection
utf8mb4
set names gbk;
SELECT @@character_set_connection;
@@character_set_connection
gbk
set character_set_database =gbk;
Show variables like 'character%';
Variable_name	Value
character_sets_dir	
character_set_client	gbk
character_set_connection	gbk
character_set_database	gbk
character_set_filesystem	binary
character_set_results	gbk
character_set_server	utf8mb4
character_set_system	utf8mb4
#存储过程=====while循环
drop procedure if exists procedure_1;
CREATE PROCEDURE procedure_1()
BEGIN
DECLARE i varchar(50) DEFAULT 1;
DECLARE j varchar(50) DEFAULT 10;
WHILE i < j  DO
SELECT CONVERT('手段和各位和特务' USING utf8) AS c1;
SELECT CONVERT('手段和各位和特务' USING gb18030) AS c2;
SELECT CONVERT('राति जकाँ' USING UTF8) AS c3;
SET i = i + 1;
END WHILE;
COMMIT;
END /
call procedure_1();
c1
c2
c3
手段和各位和特务
手段和各位和特务
राति जकाँ
#repeat循环
drop procedure if exists procedure_1;
CREATE PROCEDURE PROCEDURE_1()
BEGIN
DECLARE i varchar(50) DEFAULT 1;
DECLARE j varchar(50) DEFAULT 1;
REPEAT
SELECT CONVERT('手段和各位和特务' USING utf8) AS c1;
SELECT CONVERT('手段和各位和特务' USING gb18030) AS c2;
SELECT CONVERT('राति जकाँ' USING UTF8) AS c3;
SET i = i + 1;
UNTIL i > j-i+5 END REPEAT;
END;
/
call procedure_1();
c1
c2
c3
c1
c2
c3
c1
c2
c3
手段和各位和特务
手段和各位和特务
राति जकाँ
手段和各位和特务
手段和各位和特务
राति जकाँ
手段和各位和特务
手段和各位和特务
राति जकाँ
#loop循环
drop procedure if exists procedure_1;
create procedure procedure_1()
begin
DECLARE i varchar(50) DEFAULT 1;
DECLARE j varchar(50) DEFAULT 1;
lp : loop
SELECT CONVERT('手段和各位和特务' USING utf8) AS c1;
SELECT CONVERT('手段和各位和特务' USING gb18030) AS c2;
SELECT CONVERT('राति जकाँ' USING UTF8) AS c3;
set i = i + 1;
if i > j-i+5 then
leave lp;
end if;
end loop;
end;
/
call procedure_1();
c1
c2
c3
c1
c2
c3
c1
c2
c3
手段和各位和特务
手段和各位和特务
राति जकाँ
手段和各位和特务
手段和各位和特务
राति जकाँ
手段和各位和特务
手段和各位和特务
राति जकाँ
#触发器======insert
#insert
drop table test1;
drop table test2;
drop TRIGGER TRIGGER_1;
ERROR HY000: Trigger does not exist
CREATE table test2(c1 int);
insert into test2 values(6);
select * from test2;
c1
6
CREATE TABLE test1(
h1 varchar(100),
h2 varchar(100) charset utf8,
h3 varchar(100) charset gb18030);
CREATE TRIGGER TRIGGER_1 BEFORE UPDATE ON test2
FOR EACH ROW
BEGIN
insert into test1(h1,h2,h3) values(
'爱人覅我确认',
(SELECT CONVERT('u饿哦通过' USING utf8)),
(SELECT CONVERT('राति जकाँ'  USING gb18030)));
END ;
/
Warnings:
Warning	5884	TRIGGER 'test.TRIGGER_1' compile error
update test2 set c1=9;
select * from test1;
h1	h2	h3
爱人覅我确认	u饿哦通过	राति जकाँ
drop TRIGGER if EXISTS TRIGGER_1;
CREATE TRIGGER TRIGGER_1 BEFORE UPDATE ON test2
FOR EACH ROW
BEGIN
insert into test1(h1,h2,h3) values(
'认为他还让我挺好',
(SELECT CONVERT('shgtrsराति' USING utf8)),
(SELECT CONVERT('राति safrs'  USING gb18030)));
END ;
/
Warnings:
Warning	5884	TRIGGER 'test.TRIGGER_1' compile error
update test2 set c1=9;
select * from test1;
h1	h2	h3
爱人覅我确认	u饿哦通过	राति जकाँ
认为他还让我挺好	shgtrsराति	राति safrs
drop TRIGGER if EXISTS TRIGGER_1;
#触发器======update
CREATE TRIGGER TRIGGER_1 BEFORE UPDATE ON test2
FOR EACH ROW
BEGIN
update test1 set h1='的手工缝纫',h2=(SELECT CONVERT('dshbewgt' USING utf8)),h3=(SELECT CONVERT('任务和沙特人'  USING gb18030)) where h1='爱人覅我确认';
END ;
/
ERROR HY000: Incorrect string value
update test2 set c1=9;
select * from test1;
h1	h2	h3
爱人覅我确认	u饿哦通过	राति जकाँ
认为他还让我挺好	shgtrsराति	राति safrs
drop TRIGGER if EXISTS TRIGGER_1;
Warnings:
Note	1360	Trigger does not exist
#触发器======delete
CREATE TRIGGER TRIGGER_1 BEFORE UPDATE ON test2
FOR EACH ROW
BEGIN
delete from test1 where h2=(SELECT CONVERT('dshbewgt' USING utf8));
END ;
/
update test2 set c1=9;
select * from test1;
h1	h2	h3
爱人覅我确认	u饿哦通过	राति जकाँ
认为他还让我挺好	shgtrsराति	राति safrs
drop TRIGGER if EXISTS TRIGGER_1;
CREATE TRIGGER TRIGGER_1 BEFORE UPDATE ON test2
FOR EACH ROW
BEGIN
delete from test1 where h2=(SELECT CONVERT(null USING gb18030));
END ;
/
update test2 set c1=9;
select * from test1;
h1	h2	h3
爱人覅我确认	u饿哦通过	राति जकाँ
认为他还让我挺好	shgtrsराति	राति safrs
#########清空回收站,删除测试数据库,表等 ##########
drop user if exists hjw@'%' ;
