#Environmental cleaning
drop user hjw@'%';
create user hjw identified by 'hjw';
grant all on *.* to hjw WITH GRANT OPTION;
#character-5  库默认latin1
set character_set_client =latin1;
set character_set_connection =latin1;
set character_set_results =latin1;
set character_set_database =latin1;
Show variables like 'character%';
Variable_name	Value
character_sets_dir	
character_set_client	latin1
character_set_connection	latin1
character_set_database	latin1
character_set_filesystem	binary
character_set_results	latin1
character_set_server	utf8mb4
character_set_system	utf8mb4
#character-5-2   存储过程
#while循环
drop procedure if exists procedure_1;
CREATE PROCEDURE procedure_1()
BEGIN
DECLARE i varchar(50) charset binary DEFAULT 1;
DECLARE j varchar(50) charset binary DEFAULT 50;
WHILE i < j  DO
select i from dual;
SET i = i + 1;
END WHILE;
COMMIT;
END /
call procedure_1();
i
i
i
i
i
1
2
3
4
5
drop procedure if exists procedure_1;
CREATE PROCEDURE procedure_1()
BEGIN
DECLARE i varchar(50) charset utf16 DEFAULT 1;
DECLARE j varchar(50) charset utf16 DEFAULT 50;
WHILE i < j  DO
select i from dual;
SET i = i + 1;
END WHILE;
COMMIT;
END /
call procedure_1();
i
i
i
i
i
1
2
3
4
5
drop procedure if exists procedure_1;
CREATE PROCEDURE procedure_1()
BEGIN
DECLARE i varchar(50) charset gbk DEFAULT 1;
DECLARE j varchar(50) charset gbk DEFAULT 50;
WHILE i < j  DO
select i from dual;
SET i = i + 1;
END WHILE;
COMMIT;
END /
call procedure_1();
i
i
i
i
i
1
2
3
4
5
drop procedure if exists procedure_1;
CREATE PROCEDURE procedure_1()
BEGIN
DECLARE i varchar(50) charset latin1 DEFAULT 1;
DECLARE j varchar(50) charset latin1 DEFAULT 50;
WHILE i < j  DO
select i from dual;
SET i = i + 1;
END WHILE;
COMMIT;
END /
call procedure_1();
i
i
i
i
i
1
2
3
4
5
drop procedure if exists procedure_1;
CREATE PROCEDURE procedure_1()
BEGIN
DECLARE i varchar(50) charset gb18030 DEFAULT 1;
DECLARE j varchar(50) charset gb18030 DEFAULT 50;
WHILE i < j  DO
select i from dual;
SET i = i + 1;
END WHILE;
COMMIT;
END /
call procedure_1();
i
i
i
i
i
1
2
3
4
5
drop procedure if exists procedure_1;
CREATE PROCEDURE procedure_1()
BEGIN
DECLARE i varchar(50) charset latin1 DEFAULT 'asas';
DECLARE j varchar(50) charset latin1 DEFAULT 'အမြင့်ငါးဆယ်စင်တီမီတာတွင်';
WHILE i < j  DO
select i from dual;
SET i = i + 1;
END WHILE;
COMMIT;
END /
call procedure_1();
ERROR 22001: Data too long for column
drop procedure if exists procedure_1;
CREATE PROCEDURE procedure_1()
BEGIN
DECLARE i varchar(50) charset utf8 DEFAULT 'asas';
DECLARE j varchar(50) charset latin1 DEFAULT 'အမြင့်ငါးဆယ်စင်တီမီတာတွင်';
WHILE i < j  DO
select i from dual;
SET i = i + 1;
END WHILE;
COMMIT;
END /
call procedure_1();
ERROR 22001: Data too long for column
#while循环
drop procedure if exists procedure_1;
CREATE PROCEDURE PROCEDURE_1()
BEGIN
DECLARE i varchar(50) charset latin1 DEFAULT '1';
DECLARE j varchar(50) charset binary DEFAULT 'အမြင့်ငါးဆယ်စင်တီမီတာတွင်';
REPEAT
select i as a from dual;
SET i = i + 1;
UNTIL i > j-i+5 END REPEAT;
END;
/
call procedure_1();
ERROR 22001: Data too long for column
drop procedure if exists procedure_1;
CREATE PROCEDURE PROCEDURE_1()
BEGIN
DECLARE i varchar(50) charset latin1 DEFAULT '1';
DECLARE j varchar(50) charset utf16 DEFAULT 'အမြင့်ငါးဆယ်စင်တီမီတာတွင်';
REPEAT
select i as a from dual;
SET i = i + 1;
UNTIL i > j-i+5 END REPEAT;
END;
/
call procedure_1();
ERROR 22001: Data too long for column
drop procedure if exists procedure_1;
CREATE PROCEDURE PROCEDURE_1()
BEGIN
DECLARE i varchar(50) charset latin1 DEFAULT '对着我说给他';
DECLARE j varchar(50) charset gbk DEFAULT '对着我说给他';
REPEAT
select i as a from dual;
SET i = i + 1;
UNTIL i > j-i+5 END REPEAT;
END;
/
Warnings:
Warning	5002	Resolve error
call procedure_1();
ERROR HY000: Incorrect string value
drop procedure if exists procedure_1;
CREATE PROCEDURE PROCEDURE_1()
BEGIN
DECLARE i varchar(50) charset latin1 DEFAULT '1';
DECLARE j varchar(50) charset latin1 DEFAULT 'dsfgds';
REPEAT
select i as a from dual;
SET i = i + 1;
UNTIL i > j-i+5 END REPEAT;
END;
/
call procedure_1();
a
a
1
2
Warnings:
Warning	1292	Truncated incorrect DOUBLE value: 'dsfgds'
drop procedure if exists procedure_1;
CREATE PROCEDURE PROCEDURE_1()
BEGIN
DECLARE i varchar(50) charset latin1 DEFAULT '1';
DECLARE j varchar(50) charset gb18030 DEFAULT '的沙特人';
REPEAT
select i as a from dual;
SET i = i + 1;
UNTIL i > j-i+5 END REPEAT;
END;
/
call procedure_1();
a
a
1
2
Warnings:
Warning	1292	Truncated incorrect DOUBLE value: '的沙特人'
#loop循环
drop procedure if exists procedure_1;
create procedure procedure_1()
begin
DECLARE i varchar(50) charset latin1 DEFAULT '1';
DECLARE j varchar(50) charset gb18030 DEFAULT '鬼iu哦百谷虎';
lp : loop
select i as a from dual;
set i = i + 1;
if i > j-i+5 then
leave lp;
end if;
end loop;
end;
/
call procedure_1();
a
a
1
2
Warnings:
Warning	1292	Truncated incorrect DOUBLE value: '鬼iu哦百谷虎'
drop procedure if exists procedure_1;
create procedure procedure_1()
begin
DECLARE i varchar(50) charset latin1 DEFAULT '1';
DECLARE j varchar(50) charset binary DEFAULT '胡哈哈';
lp : loop
select i as a from dual;
set i = i + 1;
if i > j-i+5 then
leave lp;
end if;
end loop;
end;
/
call procedure_1();
a
a
1
2
Warnings:
Warning	1292	Truncated incorrect DOUBLE value: '???'
drop procedure if exists procedure_1;
create procedure procedure_1()
begin
DECLARE i varchar(50) charset latin1 DEFAULT '1';
DECLARE j varchar(50) charset utf16 DEFAULT 'အမြင့်ငါးဆယ်စင်တီမီတာတွင်';
lp : loop
select i as a from dual;
set i = i + 1;
if i > j-i+5 then
leave lp;
end if;
end loop;
end;
/
call procedure_1();
ERROR 22001: Data too long for column
drop procedure if exists procedure_1;
create procedure procedure_1()
begin
DECLARE i varchar(50) charset latin1 DEFAULT '1';
DECLARE j varchar(50) charset gbk DEFAULT 'အမြင့်ငါးဆယ်စင်တီမီတာတွင်';
lp : loop
select i as a from dual;
set i = i + 1;
if i > j-i+5 then
leave lp;
end if;
end loop;
end;
/
Warnings:
Warning	5002	Resolve error
call procedure_1();
ERROR HY000: Incorrect string value
drop procedure if exists procedure_1;
create procedure procedure_1()
begin
DECLARE i varchar(50) charset latin1 DEFAULT '1';
DECLARE j varchar(50) charset latin1 DEFAULT 'အမြင့်ငါးဆယ်စင်တီမီတာတွင်';
lp : loop
select i as a from dual;
set i = i + 1;
if i > j-i+5 then
leave lp;
end if;
end loop;
end;
/
call procedure_1();
ERROR 22001: Data too long for column
drop procedure if exists procedure_1;
#character-5-3 触发器
#insert
drop table test1;
drop table test2;
drop TRIGGER TRIGGER_1;
ERROR HY000: Trigger does not exist
CREATE table test2(c1 int);
insert into test2 values(6);
select * from test2;
c1
6
CREATE TABLE test1(
h1 varchar(100),
h2 varchar(100) charset binary,
h3 varchar(100) charset utf16,
h4 varchar(100) charset gbk,
h5 varchar(100) charset latin1,
h6 varchar(100) charset gb18030);
CREATE TRIGGER TRIGGER_1 BEFORE UPDATE ON test2
FOR EACH ROW
BEGIN
insert into test1(h1,h2,h3,h6) values(
'Ah, itu resmi',
'Ah, waa rasmi',
'ah ????????????',
'ああ、それは公式です');
END ;
/
update test2 set c1=9;
select * from test1;
h1	h2	h3	h4	h5	h6
Ah, itu resmi	Ah, waa rasmi	ah ????????????	NULL	NULL	ああ、それは公式です
drop TRIGGER if EXISTS TRIGGER_1;
CREATE TRIGGER TRIGGER_1 BEFORE UPDATE ON test2
FOR EACH ROW
BEGIN
insert into test1(h4) values('Ah, ew ferm? ye');
END ;
/
update test2 set c1=9;
drop TRIGGER if EXISTS TRIGGER_1;
CREATE TRIGGER TRIGGER_1 BEFORE UPDATE ON test2
FOR EACH ROW
BEGIN
insert into test1(h5) values('အမြင့်ငါးဆယ်စင်တီမီတာတွင်');
END ;
/
update test2 set c1=9;
drop TRIGGER if EXISTS TRIGGER_1;
#update
select * from test1;
h1	h2	h3	h4	h5	h6
Ah, itu resmi	Ah, waa rasmi	ah ????????????	NULL	NULL	ああ、それは公式です
NULL	NULL	NULL	Ah, ew ferm? ye	NULL	NULL
NULL	NULL	NULL	NULL	အမြင့်ငါးဆယ်စင်တီမီတာတွင်	NULL
select * from test2;
c1
9
CREATE TRIGGER TRIGGER_1 BEFORE UPDATE ON test2
FOR EACH ROW
BEGIN
update test1 set h5='dsgfagsd' where h5 is null;
update test1 set h4='aaaabaaa' where h4 is null;
END ;
/
update test2 set c1=4;
select * from test1;
h1	h2	h3	h4	h5	h6
Ah, itu resmi	Ah, waa rasmi	ah ????????????	aaaabaaa	dsgfagsd	ああ、それは公式です
NULL	NULL	NULL	Ah, ew ferm? ye	dsgfagsd	NULL
NULL	NULL	NULL	aaaabaaa	အမြင့်ငါးဆယ်စင်တီမီတာတွင်	NULL
drop TRIGGER if EXISTS TRIGGER_1;
CREATE TRIGGER TRIGGER_1 BEFORE UPDATE ON test2
FOR EACH ROW
BEGIN
update test1 set
h1='反对各五个发热我个人问题',
h2='dsgferthert ',
h3='Աղտոտվածություն',
h6='အမြင့်ငါးဆယ်စင်တီမီတာတွင်';
END ;
/
update test2 set c1=4;
select * from test1;
h1	h2	h3	h4	h5	h6
反对各五个发热我个人问题	dsgferthert 	Աղտոտվածություն	aaaabaaa	dsgfagsd	အမြင့်ငါးဆယ်စင်တီမီတာတွင်
反对各五个发热我个人问题	dsgferthert 	Աղտոտվածություն	Ah, ew ferm? ye	dsgfagsd	အမြင့်ငါးဆယ်စင်တီမီတာတွင်
反对各五个发热我个人问题	dsgferthert 	Աղտոտվածություն	aaaabaaa	အမြင့်ငါးဆယ်စင်တီမီတာတွင်	အမြင့်ငါးဆယ်စင်တီမီတာတွင်
drop TRIGGER if EXISTS TRIGGER_1;
#delete
drop table test1;
drop table test2;
drop TRIGGER TRIGGER_1;
ERROR HY000: Trigger does not exist
CREATE table test2(c1 int);
insert into test2 values(6);
select * from test2;
c1
6
CREATE TABLE test1(
h1 varchar(100),
h2 varchar(100) charset binary,
h3 varchar(100) charset utf16,
h6 varchar(100) charset gb18030);
insert into test1(h1,h2,h3,h6) values(
'Ah, itu resmi',
'Ah, waa rasmi',
'ah ????????????',
'ああ、それは公式です');
select * from test1;
h1	h2	h3	h6
Ah, itu resmi	Ah, waa rasmi	ah ????????????	ああ、それは公式です
CREATE TRIGGER TRIGGER_1 BEFORE UPDATE ON test2
FOR EACH ROW
BEGIN
DELETE from test1 where h6='ああ、それは公式です';
END ;
/
update test2 set c1=4;
select * from test1;
h1	h2	h3	h6
drop TRIGGER if EXISTS TRIGGER_1;
drop table test1;
drop table test2;
#character-5-5 udf
#普通函数
drop FUNCTION func_1;
CREATE FUNCTION func_1(bb VARCHAR(150) charset binary)
RETURNS VARCHAR(150)
DETERMINISTIC
BEGIN
RETURN bb;
END ;
/
select func_1('အမြင့်ငါးဆယ်စင်တီမီတာတွင်') from dual;
func_1('အမြင့်ငါးဆယ်စင်တီမီတာတွင်')
အမြင့်ငါးဆယ်စင်တီမီတာတွင်
DROP FUNCTION if EXISTS func_1;
CREATE FUNCTION func_1(bb VARCHAR(150) charset utf16)
RETURNS VARCHAR(150)
DETERMINISTIC
BEGIN
RETURN bb;
END ;
/
select func_1('官方可有苦头') from dual;
func_1('官方可有苦头')
官方可有苦头
DROP FUNCTION if EXISTS func_1;
CREATE FUNCTION func_1(bb VARCHAR(150) charset gbk)
RETURNS VARCHAR(150)
DETERMINISTIC
BEGIN
RETURN bb;
END ;
/
select func_1('官方可有苦头') from dual;
func_1('官方可有苦头')
????�??????��???�?
DROP FUNCTION if EXISTS func_1;
CREATE FUNCTION func_1(bb VARCHAR(150) charset latin1)
RETURNS VARCHAR(150)
DETERMINISTIC
BEGIN
RETURN bb;
END ;
/
select func_1('官方可有苦头') from dual;
func_1('官方可有苦头')
官方可有苦头
DROP FUNCTION if EXISTS func_1;
CREATE FUNCTION func_1(bb VARCHAR(150) charset gb18030)
RETURNS VARCHAR(150)
DETERMINISTIC
BEGIN
RETURN bb;
END ;
/
select func_1('官方可有苦头') from dual;
func_1('官方可有苦头')
官方可有苦头
#其他函数
DROP FUNCTION IF exists func_1;
create
function func_1(num1 varchar(150) charset utf8mb4, num2 varchar(150) charset latin1)
returns varchar(150)
DETERMINISTIC
begin
declare res varchar(150);
if(num1 > num2) then
set res = num1;
elseif (num1 < num2) then
set res = num2;
else
set res = num1;
end if;
return res;
end;
/
SELECT func_1(1,2);
func_1(1,2)
2
SELECT func_1('dsagfsa','的赛果发热袜个人');
func_1('dsagfsa','的赛果发热袜个人')
dsagfsa
SELECT func_1('的赛果发热袜个人','dsagfsa');
func_1('的赛果发热袜个人','dsagfsa')
dsagfsa
SELECT func_1('的赛果发热袜个人','အမြင့်ငါးဆယ်စင်တီမီတာတွင် ');
func_1('的赛果发热袜个人','အမြင့်ငါးဆယ်စင်တီမီတာတွင် ')
的赛果发热袜个人
SELECT func_1('အမြင့်ငါးဆယ်စင်တီမီတာတွင်','的赛果发热袜个人');
func_1('အမြင့်ငါးဆယ်စင်တီမီတာတွင်','的赛果发热袜个人')
的赛果发热袜个人
DROP FUNCTION IF exists func_1;
#########清空回收站,删除测试数据库,表等 ##########
drop user hjw@'%' ;
