drop database if exists db1;
create database db1;
use db1;
result_format: 4
alter system flush plan cache global;
affected rows: 0

alter system set _rowsets_enabled=false;
affected rows: 0

set autocommit = false;
affected rows: 0

alter system set ob_enable_batched_multi_statement=true;
affected rows: 0

#case when
drop table if exists t1;
affected rows: 0
Warnings:
Note	1051	Unknown table 'db1.t1'
create table t1(c1 int ,c2 char(30) not null default 'AA');
affected rows: 0
insert into t1 values(1,'AA'),(2,'BB'),(3,'CC');
affected rows: 3
info: Records: 3  Duplicates: 0  Warnings: 0
SET @aa:='阿aa五';
affected rows: 0
SET @bb:='阿a6';
affected rows: 0
set @cc:='阿a77';
affected rows: 0
select * from t1;
+------+----+
| c1   | c2 |
+------+----+
|    1 | AA |
|    2 | BB |
|    3 | CC |
+------+----+
affected rows: 3
insert into t1 select c1,case c2 when 'AA' then 'A' when 'BB' then 'B' else 'C' end as c2 from t1;
insert into t1 select c1,case c2 when 'AA' then @aa when 'BB' then @bb else @cc end as c2 from t1;//
affected rows: 3
info:  Records: 3  Duplicates: 0  Warnings: 0
affected rows: 6
info: Records: 6  Duplicates: 0  Warnings: 0
select * from t1;
+------+----------+
| c1   | c2       |
+------+----------+
|    1 | A        |
|    1 | AA       |
|    1 | 阿a77    |
|    1 | 阿aa五   |
|    2 | B        |
|    2 | BB       |
|    2 | 阿a6     |
|    2 | 阿a77    |
|    3 | C        |
|    3 | CC       |
|    3 | 阿a77    |
|    3 | 阿a77    |
+------+----------+
affected rows: 12

select hit_count, is_batched_multi_stmt, statement, query_sql from oceanbase.gv$OB_PLAN_CACHE_PLAN_STAT where statement like 'insert into t1 select%' order by hit_count;
+-----------+-----------------------+----------------------------------------------------------------------------------------------+----------------------------------------------------------------------------------------------------+
| hit_count | is_batched_multi_stmt | statement                                                                                    | query_sql                                                                                          |
+-----------+-----------------------+----------------------------------------------------------------------------------------------+----------------------------------------------------------------------------------------------------+
|         0 |                     0 | insert into t1 select c1,case c2 when ? then ? when ? then ? else ? end as c2 from t1;       | insert into t1 select c1,case c2 when 'AA' then 'A' when 'BB' then 'B' else 'C' end as c2 from t1; |
|         0 |                     0 | insert into t1 select c1,case c2 when ? then ? when ? then ? else ? end as c2 from t1;       | insert into t1 select c1,case c2 when ? then ? when ? then ? else ? end as c2 from t1;             |
|         0 |                     0 | insert into t1 select c1,case c2 when ? then @aa when ? then @bb else @cc end as c2 from t1; | insert into t1 select c1,case c2 when 'AA' then @aa when 'BB' then @bb else @cc end as c2 from t1; |
|         0 |                     0 | insert into t1 select c1,case c2 when ? then @aa when ? then @bb else @cc end as c2 from t1; | insert into t1 select c1,case c2 when ? then @aa when ? then @bb else @cc end as c2 from t1;       |
+-----------+-----------------------+----------------------------------------------------------------------------------------------+----------------------------------------------------------------------------------------------------+
affected rows: 4
drop table t1;
affected rows: 0

#batch insert+select... 不支持优化
alter system flush plan cache global;
affected rows: 0
drop table if exists t2;
affected rows: 0
Warnings:
Note	1051	Unknown table 'db1.t2'
create table t2(c1 int ,c2 char(30) not null default 'AA');
affected rows: 0
insert into t2 values(1,'AA'),(2,'BB'),(3,'CC'),(4,'DD'),(5,'EE'),(6,'FF');
affected rows: 6
info: Records: 6  Duplicates: 0  Warnings: 0
insert into t2 select c1,case c2 when 'AA' then 'A' when 'BB' then 'B' else 'C' end as c2 from t2;
insert into t2 select c1,case c2 when 'AA' then 'Q' when 'BB' then 'K' else 'A' end as c2 from t2;//
affected rows: 6
info:  Records: 6  Duplicates: 0  Warnings: 0
affected rows: 12
info: Records: 12  Duplicates: 0  Warnings: 0
select * from t2;
+------+----+
| c1   | c2 |
+------+----+
|    1 | A  |
|    1 | A  |
|    1 | AA |
|    1 | Q  |
|    2 | A  |
|    2 | B  |
|    2 | BB |
|    2 | K  |
|    3 | A  |
|    3 | A  |
|    3 | C  |
|    3 | CC |
|    4 | A  |
|    4 | A  |
|    4 | C  |
|    4 | DD |
|    5 | A  |
|    5 | A  |
|    5 | C  |
|    5 | EE |
|    6 | A  |
|    6 | A  |
|    6 | C  |
|    6 | FF |
+------+----+
affected rows: 24

select hit_count, is_batched_multi_stmt, statement, query_sql from oceanbase.gv$OB_PLAN_CACHE_PLAN_STAT where statement like 'insert into t2 select%' order by hit_count;
+-----------+-----------------------+----------------------------------------------------------------------------------------+----------------------------------------------------------------------------------------------------+
| hit_count | is_batched_multi_stmt | statement                                                                              | query_sql                                                                                          |
+-----------+-----------------------+----------------------------------------------------------------------------------------+----------------------------------------------------------------------------------------------------+
|         1 |                     0 | insert into t2 select c1,case c2 when ? then ? when ? then ? else ? end as c2 from t2; | insert into t2 select c1,case c2 when 'AA' then 'A' when 'BB' then 'B' else 'C' end as c2 from t2; |
|         1 |                     0 | insert into t2 select c1,case c2 when ? then ? when ? then ? else ? end as c2 from t2; | insert into t2 select c1,case c2 when ? then ? when ? then ? else ? end as c2 from t2;             |
+-----------+-----------------------+----------------------------------------------------------------------------------------+----------------------------------------------------------------------------------------------------+
affected rows: 2
drop table t2;
affected rows: 0

drop table if exists t3;
affected rows: 0
Warnings:
Note	1051	Unknown table 'db1.t3'
create table t3(c1 int ,c2 char(30) not null default 'AA');
affected rows: 0
insert into t3 values(1,'AA'),(2,'BB'),(3,'CC'),(4,'DD'),(5,'EE'),(6,'FF');
affected rows: 6
info: Records: 6  Duplicates: 0  Warnings: 0
delete from t3 where c1 = case when c1=1 then 2 else c1 end;delete from t3 where c1 = case when c1=3 then 4 else c1 end;//
affected rows: 5
affected rows: 1
select * from t3;
+------+----+
| c1   | c2 |
+------+----+
+------+----+
affected rows: 0

select hit_count, is_batched_multi_stmt, statement, query_sql from oceanbase.gv$OB_PLAN_CACHE_PLAN_STAT where statement like 'delete from t3 where c1 = %' order by hit_count;
+-----------+-----------------------+--------------------------------------------------------------+--------------------------------------------------------------------------------------------------------------------------+
| hit_count | is_batched_multi_stmt | statement                                                    | query_sql                                                                                                                |
+-----------+-----------------------+--------------------------------------------------------------+--------------------------------------------------------------------------------------------------------------------------+
|         0 |                     1 | delete from t3 where c1 = case when c1=? then ? else c1 end  | delete from t3 where c1 = case when c1=1 then 2 else c1 end;delete from t3 where c1 = case when c1=3 then 4 else c1 end; |
|         1 |                     0 | delete from t3 where c1 = case when c1=? then ? else c1 end; | delete from t3 where c1 = case when c1=1 then 2 else c1 end;                                                             |
|         1 |                     0 | delete from t3 where c1 = case when c1=? then ? else c1 end; | delete from t3 where c1 = case when c1=? then ? else c1 end;                                                             |
+-----------+-----------------------+--------------------------------------------------------------+--------------------------------------------------------------------------------------------------------------------------+
affected rows: 3
drop table t3;
affected rows: 0

#浮点型
alter system flush plan cache global;
affected rows: 0
drop table if exists t4;
affected rows: 0
Warnings:
Note	1051	Unknown table 'db1.t4'
create table t4 (c1 float ,c2 double not null,c3 decimal(5,3),key index_c1_c2(c1,c2));
affected rows: 0
create index index_c3 on t4(c3);
affected rows: 0
insert into t4 values(1.111,1.111,1.111),(2.111,2.222,2.333),(3.111,3.222,3.333);
affected rows: 3
info: Records: 3  Duplicates: 0  Warnings: 0
insert into t4 values(11.111,11.111,11.111),(12.111,12.222,12.333);
affected rows: 2
info: Records: 2  Duplicates: 0  Warnings: 0
commit;
affected rows: 0

insert into t4 select c1,c3,case c2 when 1.111 then 2 when 2.222 then 3 else 2.5 end as c2 from t4 limit 1;
insert into t4 select c1,c3,case c2 when 1.111 then 2.666 when 2.222 then 3.666 else 2.555 end as c2 from t4 limit 1;//
affected rows: 1
affected rows: 1
select * from t4;
+--------+--------+--------+
| c1     | c2     | c3     |
+--------+--------+--------+
|  1.111 |  1.111 |  1.111 |
|  1.111 |  1.111 |  2.000 |
|  1.111 |  1.111 |  2.666 |
|  2.111 |  2.222 |  2.333 |
|  3.111 |  3.222 |  3.333 |
| 11.111 | 11.111 | 11.111 |
| 12.111 | 12.222 | 12.333 |
+--------+--------+--------+
affected rows: 7

select hit_count, is_batched_multi_stmt, statement, query_sql from oceanbase.gv$OB_PLAN_CACHE_PLAN_STAT where statement like 'insert into t4 select %' order by hit_count;
+-----------+-----------------------+---------------------------------------------------------------------------------------------------+-----------------------------------------------------------------------------------------------------------------------+
| hit_count | is_batched_multi_stmt | statement                                                                                         | query_sql                                                                                                             |
+-----------+-----------------------+---------------------------------------------------------------------------------------------------+-----------------------------------------------------------------------------------------------------------------------+
|         0 |                     0 | insert into t4 select c1,c3,case c2 when ? then ? when ? then ? else ? end as c2 from t4 limit ?; | insert into t4 select c1,c3,case c2 when 1.111 then 2 when 2.222 then 3 else 2.5 end as c2 from t4 limit 1;           |
|         0 |                     0 | insert into t4 select c1,c3,case c2 when ? then ? when ? then ? else ? end as c2 from t4 limit ?; | insert into t4 select c1,c3,case c2 when 1.111 then 2.666 when 2.222 then 3.666 else 2.555 end as c2 from t4 limit 1; |
|         0 |                     0 | insert into t4 select c1,c3,case c2 when ? then ? when ? then ? else ? end as c2 from t4 limit ?; | insert into t4 select c1,c3,case c2 when ? then ? when ? then ? else ? end as c2 from t4 limit ?;                     |
|         0 |                     0 | insert into t4 select c1,c3,case c2 when ? then ? when ? then ? else ? end as c2 from t4 limit ?; | insert into t4 select c1,c3,case c2 when ? then ? when ? then ? else ? end as c2 from t4 limit ?;                     |
+-----------+-----------------------+---------------------------------------------------------------------------------------------------+-----------------------------------------------------------------------------------------------------------------------+
affected rows: 4
rollback;
affected rows: 0

delete from t4 where c2 = case when c2 = 1.111 then 5.111 else c2 end;delete from t4 where c2 = case when c2 = 2.222 then 1.111  else c2 end;//
affected rows: 4
affected rows: 1
select * from t4;
+------+----+------+
| c1   | c2 | c3   |
+------+----+------+
+------+----+------+
affected rows: 0

select hit_count, is_batched_multi_stmt, statement, query_sql from oceanbase.gv$OB_PLAN_CACHE_PLAN_STAT where statement like 'delete from t4 where c1 = %' order by hit_count;
+-----------+-----------------------+-----------+-----------+
| hit_count | is_batched_multi_stmt | statement | query_sql |
+-----------+-----------------------+-----------+-----------+
+-----------+-----------------------+-----------+-----------+
affected rows: 0
drop table t4;
affected rows: 0


#时间类型
drop table if exists t5;
affected rows: 0
Warnings:
Note	1051	Unknown table 'db1.t5'
create table t5 (c1 datetime not null,c2 year ,c3 timestamp not null)
partition by key(c1)
partitions 3;
affected rows: 0
insert into t5 values('2000-01-01','2000','2000-01-01'),('2001-01-01','2001','2001-01-01'),('2002-01-01','2002','2002-01-01'),('2003-01-01','2003','2003-01-01'),('2004-01-01','2004','2004-01-01'),('2005-01-01','2005','2005-01-01');
affected rows: 6
info: Records: 6  Duplicates: 0  Warnings: 0
commit;
affected rows: 0
select * from t5 order by c1;
+---------------------+------+---------------------+
| c1                  | c2   | c3                  |
+---------------------+------+---------------------+
| 2000-01-01 00:00:00 | 2000 | 2000-01-01 00:00:00 |
| 2001-01-01 00:00:00 | 2001 | 2001-01-01 00:00:00 |
| 2002-01-01 00:00:00 | 2002 | 2002-01-01 00:00:00 |
| 2003-01-01 00:00:00 | 2003 | 2003-01-01 00:00:00 |
| 2004-01-01 00:00:00 | 2004 | 2004-01-01 00:00:00 |
| 2005-01-01 00:00:00 | 2005 | 2005-01-01 00:00:00 |
+---------------------+------+---------------------+
affected rows: 6

insert into t5 select c1,c2,case c3 when '2000-01-01' then last_day('2000-01-01') when '2001-01-01' then date_add('2001-01-01',interval 1 day) else date_sub(c3,interval 20 day) end as c3 from t5;
insert into t5 select c1,c2,case c3 when '2003-01-01' then subdate('2003-01-01',interval 31 day)  when '2004-01-01' then subdate('2004-01-01',20)  else adddate('2005-01-01',70) end as c3 from t5;//
affected rows: 6
info:  Records: 6  Duplicates: 0  Warnings: 0
affected rows: 12
info: Records: 12  Duplicates: 0  Warnings: 0
select * from t5 order by c1;
+---------------------+------+---------------------+
| c1                  | c2   | c3                  |
+---------------------+------+---------------------+
| 2000-01-01 00:00:00 | 2000 | 2000-01-01 00:00:00 |
| 2000-01-01 00:00:00 | 2000 | 2000-01-31 00:00:00 |
| 2000-01-01 00:00:00 | 2000 | 2005-03-12 00:00:00 |
| 2000-01-01 00:00:00 | 2000 | 2005-03-12 00:00:00 |
| 2001-01-01 00:00:00 | 2001 | 2001-01-01 00:00:00 |
| 2001-01-01 00:00:00 | 2001 | 2001-01-02 00:00:00 |
| 2001-01-01 00:00:00 | 2001 | 2005-03-12 00:00:00 |
| 2001-01-01 00:00:00 | 2001 | 2005-03-12 00:00:00 |
| 2002-01-01 00:00:00 | 2002 | 2001-12-12 00:00:00 |
| 2002-01-01 00:00:00 | 2002 | 2002-01-01 00:00:00 |
| 2002-01-01 00:00:00 | 2002 | 2005-03-12 00:00:00 |
| 2002-01-01 00:00:00 | 2002 | 2005-03-12 00:00:00 |
| 2003-01-01 00:00:00 | 2003 | 2002-12-01 00:00:00 |
| 2003-01-01 00:00:00 | 2003 | 2002-12-12 00:00:00 |
| 2003-01-01 00:00:00 | 2003 | 2003-01-01 00:00:00 |
| 2003-01-01 00:00:00 | 2003 | 2005-03-12 00:00:00 |
| 2004-01-01 00:00:00 | 2004 | 2003-12-12 00:00:00 |
| 2004-01-01 00:00:00 | 2004 | 2003-12-12 00:00:00 |
| 2004-01-01 00:00:00 | 2004 | 2004-01-01 00:00:00 |
| 2004-01-01 00:00:00 | 2004 | 2005-03-12 00:00:00 |
| 2005-01-01 00:00:00 | 2005 | 2004-12-12 00:00:00 |
| 2005-01-01 00:00:00 | 2005 | 2005-01-01 00:00:00 |
| 2005-01-01 00:00:00 | 2005 | 2005-03-12 00:00:00 |
| 2005-01-01 00:00:00 | 2005 | 2005-03-12 00:00:00 |
+---------------------+------+---------------------+
affected rows: 24

select hit_count, is_batched_multi_stmt, statement, query_sql from oceanbase.gv$OB_PLAN_CACHE_PLAN_STAT where statement like 'insert into t5 select c1,c2,case c3 when %' order by hit_count;
+-----------+-----------------------+--------------------------------------------------------------------------------------------------------------------------------------------------------+-----------------------------------------------------------------------------------------------------------------------------------------------------------------------------------------------------+
| hit_count | is_batched_multi_stmt | statement                                                                                                                                              | query_sql                                                                                                                                                                                           |
+-----------+-----------------------+--------------------------------------------------------------------------------------------------------------------------------------------------------+-----------------------------------------------------------------------------------------------------------------------------------------------------------------------------------------------------+
|         0 |                     0 | insert into t5 select c1,c2,case c3 when ? then last_day(?) when ? then date_add(?,interval ? day) else date_sub(c3,interval ? day) end as c3 from t5; | insert into t5 select c1,c2,case c3 when '2000-01-01' then last_day('2000-01-01') when '2001-01-01' then date_add('2001-01-01',interval 1 day) else date_sub(c3,interval 20 day) end as c3 from t5; |
|         0 |                     0 | insert into t5 select c1,c2,case c3 when ? then subdate(?,interval ? day)  when ? then subdate(?,?)  else adddate(?,?) end as c3 from t5;              | insert into t5 select c1,c2,case c3 when '2003-01-01' then subdate('2003-01-01',interval 31 day)  when '2004-01-01' then subdate('2004-01-01',20)  else adddate('2005-01-01',70) end as c3 from t5; |
+-----------+-----------------------+--------------------------------------------------------------------------------------------------------------------------------------------------------+-----------------------------------------------------------------------------------------------------------------------------------------------------------------------------------------------------+
affected rows: 2
rollback;
affected rows: 0

delete from t5 where c2 = case when 2000 then year('2001-05-07') else c2 end;
delete from t5 where c2 = case when 2002 then extract(year from '2003-07-02') else c2 end;
delete from t5 where c2 = case when 2004 then year(date_sub('2005-01-02', interval 31 day)) else c2 end;//
affected rows: 1
affected rows: 1
affected rows: 1
select * from t5 order by c2;
+---------------------+------+---------------------+
| c1                  | c2   | c3                  |
+---------------------+------+---------------------+
| 2000-01-01 00:00:00 | 2000 | 2000-01-01 00:00:00 |
| 2002-01-01 00:00:00 | 2002 | 2002-01-01 00:00:00 |
| 2005-01-01 00:00:00 | 2005 | 2005-01-01 00:00:00 |
+---------------------+------+---------------------+
affected rows: 3

select hit_count, is_batched_multi_stmt, statement, query_sql from oceanbase.gv$OB_PLAN_CACHE_PLAN_STAT where statement like 'delete from t5 where c2 = case when %' order by hit_count;
+-----------+-----------------------+-------------------------------------------------------------------------------------------+----------------------------------------------------------------------------------------------------------+
| hit_count | is_batched_multi_stmt | statement                                                                                 | query_sql                                                                                                |
+-----------+-----------------------+-------------------------------------------------------------------------------------------+----------------------------------------------------------------------------------------------------------+
|         0 |                     0 | delete from t5 where c2 = case when ? then extract(year from ?) else c2 end;              | delete from t5 where c2 = case when 2002 then extract(year from '2003-07-02') else c2 end;               |
|         0 |                     0 | delete from t5 where c2 = case when ? then year(?) else c2 end;                           | delete from t5 where c2 = case when 2000 then year('2001-05-07') else c2 end;                            |
|         0 |                     0 | delete from t5 where c2 = case when ? then year(date_sub(?, interval ? day)) else c2 end; | delete from t5 where c2 = case when 2004 then year(date_sub('2005-01-02', interval 31 day)) else c2 end; |
+-----------+-----------------------+-------------------------------------------------------------------------------------------+----------------------------------------------------------------------------------------------------------+
affected rows: 3
drop table t5;
affected rows: 0


#字符串类型
drop table if exists t6;
affected rows: 0
Warnings:
Note	1051	Unknown table 'db1.t6'
create  table t6(c1 varchar(60) not null,c2 varbinary(30),c3 binary(30) default 'Zz');
affected rows: 0
create index index_c1_c2_c3 on t6(c1,c2,c3);
affected rows: 0
insert into t6 values('张三','AAA','壹');
affected rows: 1
insert into t6 values('李四','BBB','贰');
affected rows: 1
insert into t6 values('王五','CCC','叁');
affected rows: 1
commit;
affected rows: 0
select * from t6;
+--------+------+--------------------------------+
| c1     | c2   | c3                             |
+--------+------+--------------------------------+
| 张三   | AAA  | 壹                             |
| 李四   | BBB  | 贰                             |
| 王五   | CCC  | 叁                             |
+--------+------+--------------------------------+
affected rows: 3

insert into t6 select c1,c3,case c2 when 'AAA' then reverse('abc') when 'CCC' then right('QWERRYT',4) else substring('asdadasd2qwe1',8) end from t6;
insert into t6 select c1,c3,case c2 when 'AAA' then concat('张三','AA') when 'CCC' then concat('李四',reverse('kxjgn')) else repeat('王五',2) end from t6;//
affected rows: 3
info:  Records: 3  Duplicates: 0  Warnings: 0
affected rows: 6
info: Records: 6  Duplicates: 0  Warnings: 0
select * from t6 order by c1;
+--------+--------------------------------+--------------------------------+
| c1     | c2                             | c3                             |
+--------+--------------------------------+--------------------------------+
| 张三   | AAA                            | 壹                             |
| 张三   | cba                            | 王五王五                       |
| 张三   | 壹                             | cba                            |
| 张三   | 壹                             | 张三AA                         |
| 李四   | BBB                            | 贰                             |
| 李四   | d2qwe1                         | 王五王五                       |
| 李四   | 贰                             | d2qwe1                         |
| 李四   | 贰                             | 王五王五                       |
| 王五   | CCC                            | 叁                             |
| 王五   | RRYT                           | 王五王五                       |
| 王五   | 叁                             | RRYT                           |
| 王五   | 叁                             | 李四ngjxk                      |
+--------+--------------------------------+--------------------------------+
affected rows: 12

select hit_count, is_batched_multi_stmt, statement, query_sql from oceanbase.gv$OB_PLAN_CACHE_PLAN_STAT where statement like 'insert into t6 select c1,c3,case c2 when %' order by hit_count;
+-----------+-----------------------+----------------------------------------------------------------------------------------------------------------------------+------------------------------------------------------------------------------------------------------------------------------------------------------------------+
| hit_count | is_batched_multi_stmt | statement                                                                                                                  | query_sql                                                                                                                                                        |
+-----------+-----------------------+----------------------------------------------------------------------------------------------------------------------------+------------------------------------------------------------------------------------------------------------------------------------------------------------------+
|         0 |                     0 | insert into t6 select c1,c3,case c2 when ? then concat(?,?) when ? then concat(?,reverse(?)) else repeat(?,?) end from t6; | insert into t6 select c1,c3,case c2 when 'AAA' then concat('张三','AA') when 'CCC' then concat('李四',reverse('kxjgn')) else repeat('王五',2) end from t6;       |
|         0 |                     0 | insert into t6 select c1,c3,case c2 when ? then concat(?,?) when ? then concat(?,reverse(?)) else repeat(?,?) end from t6; | insert into t6 select c1,c3,case c2 when 'AAA' then concat('张三','AA') when 'CCC' then concat('李四',reverse('kxjgn')) else repeat('王五',2) end from t6;       |
|         0 |                     0 | insert into t6 select c1,c3,case c2 when ? then reverse(?) when ? then right(?,?) else substring(?,8) end from t6;         | insert into t6 select c1,c3,case c2 when 'AAA' then reverse('abc') when 'CCC' then right('QWERRYT',4) else substring('asdadasd2qwe1',8) end from t6;             |
|         0 |                     0 | insert into t6 select c1,c3,case c2 when ? then reverse(?) when ? then right(?,?) else substring(?,8) end from t6;         | insert into t6 select c1,c3,case c2 when 'AAA' then reverse('abc') when 'CCC' then right('QWERRYT',4) else substring('asdadasd2qwe1',8) end from t6;             |
+-----------+-----------------------+----------------------------------------------------------------------------------------------------------------------------+------------------------------------------------------------------------------------------------------------------------------------------------------------------+
affected rows: 4
rollback;
affected rows: 0

delete from t6 where c1 = case c1 when '张三' then concat('李','四') else c1 end;
delete from t6 where c1 = case c1 when '王五' then concat(substr('ASDASDA',5),'asd') else c1 end;//
affected rows: 2
affected rows: 1
select * from t6 order by c1;
+----+------+------+
| c1 | c2   | c3   |
+----+------+------+
+----+------+------+
affected rows: 0

select hit_count, is_batched_multi_stmt, statement, query_sql from oceanbase.gv$OB_PLAN_CACHE_PLAN_STAT where statement like 'delete from t6 where c1 = case c1 when %' order by hit_count;
+-----------+-----------------------+----------------------------------------------------------------------------------+-----------------------------------------------------------------------------------------------------+
| hit_count | is_batched_multi_stmt | statement                                                                        | query_sql                                                                                           |
+-----------+-----------------------+----------------------------------------------------------------------------------+-----------------------------------------------------------------------------------------------------+
|         0 |                     0 | delete from t6 where c1 = case c1 when ? then concat(?,?) else c1 end;           | delete from t6 where c1 = case c1 when '张三' then concat('李','四') else c1 end;                   |
|         0 |                     0 | delete from t6 where c1 = case c1 when ? then concat(?,?) else c1 end;           | delete from t6 where c1 = case c1 when ? then concat(?,?) else c1 end;                              |
|         0 |                     0 | delete from t6 where c1 = case c1 when ? then concat(substr(?,5),?) else c1 end; | delete from t6 where c1 = case c1 when '王五' then concat(substr('ASDASDA',5),'asd') else c1 end;   |
|         0 |                     0 | delete from t6 where c1 = case c1 when ? then concat(substr(?,5),?) else c1 end; | delete from t6 where c1 = case c1 when ? then concat(substr(?,5),?) else c1 end;                    |
+-----------+-----------------------+----------------------------------------------------------------------------------+-----------------------------------------------------------------------------------------------------+
affected rows: 4
drop table t6;
affected rows: 0

#集合
drop table if exists t7;
affected rows: 0
Warnings:
Note	1051	Unknown table 'db1.t7'
create table t7(c1 enum('a','b','c','1','2','3','','1.11','刘'),c2 set('张','王','李','','2.222','3','6','#$@'));
affected rows: 0
insert into t7 values('1','张'),('2','王'),('3','李');
affected rows: 3
info: Records: 3  Duplicates: 0  Warnings: 0
commit;
affected rows: 0
select * from t7;
+------+------+
| c1   | c2   |
+------+------+
| 1    | 张   |
| 2    | 王   |
| 3    | 李   |
+------+------+
affected rows: 3

insert into t7 select c1,case c2 when '张' then '3' when '李' then '6' else '' end from t7;
insert into t7 select c1,case c2 when '张' then '王' when '李' then '王' else '2.222' end from t7;//
affected rows: 3
info:  Records: 3  Duplicates: 0  Warnings: 0
affected rows: 6
info: Records: 6  Duplicates: 0  Warnings: 0
select * from t7 order by c1;
+------+-------+
| c1   | c2    |
+------+-------+
| 1    | 2.222 |
| 1    | 3     |
| 1    | 张    |
| 1    | 王    |
| 2    |       |
| 2    | 2.222 |
| 2    | 2.222 |
| 2    | 王    |
| 3    | 2.222 |
| 3    | 6     |
| 3    | 李    |
| 3    | 王    |
+------+-------+
affected rows: 12

select hit_count, is_batched_multi_stmt, statement, query_sql from oceanbase.gv$OB_PLAN_CACHE_PLAN_STAT where statement like 'insert into t7 select c1,case c2 when %' order by hit_count;
+-----------+-----------------------+----------------------------------------------------------------------------------+-----------------------------------------------------------------------------------------------+
| hit_count | is_batched_multi_stmt | statement                                                                        | query_sql                                                                                     |
+-----------+-----------------------+----------------------------------------------------------------------------------+-----------------------------------------------------------------------------------------------+
|         1 |                     0 | insert into t7 select c1,case c2 when ? then ? when ? then ? else ? end from t7; | insert into t7 select c1,case c2 when '张' then '3' when '李' then '6' else '' end from t7;   |
|         1 |                     0 | insert into t7 select c1,case c2 when ? then ? when ? then ? else ? end from t7; | insert into t7 select c1,case c2 when '张' then '3' when '李' then '6' else '' end from t7;   |
+-----------+-----------------------+----------------------------------------------------------------------------------+-----------------------------------------------------------------------------------------------+
affected rows: 2
rollback;
affected rows: 0

delete from t7 where c1 = case c1 when '1' then '2' else c1 end;
delete from t7 where c1 = case c1 when '3' then '5' else c1 end;//
affected rows: 2
affected rows: 1
select * from t7 order by c1;
+------+------+
| c1   | c2   |
+------+------+
+------+------+
affected rows: 0

select hit_count, is_batched_multi_stmt, statement, query_sql from oceanbase.gv$OB_PLAN_CACHE_PLAN_STAT where statement like 'delete from t7 where c1 = case c1 when %' order by hit_count;
+-----------+-----------------------+--------------------------------------------------------------+-----------------------------------------------------------------------------------------------------------------------------------+
| hit_count | is_batched_multi_stmt | statement                                                    | query_sql                                                                                                                         |
+-----------+-----------------------+--------------------------------------------------------------+-----------------------------------------------------------------------------------------------------------------------------------+
delete from t7 where c1 = case c1 when '3' then '5' else c1 end; |
|         0 |                     1 | delete from t7 where c1 = case c1 when ? then ? else c1 end  | delete from t7 where c1 = case c1 when '1' then '2' else c1 end;
|         1 |                     0 | delete from t7 where c1 = case c1 when ? then ? else c1 end; | delete from t7 where c1 = case c1 when '1' then '2' else c1 end;                                                                  |
|         1 |                     0 | delete from t7 where c1 = case c1 when ? then ? else c1 end; | delete from t7 where c1 = case c1 when ? then ? else c1 end;                                                                      |
+-----------+-----------------------+--------------------------------------------------------------+-----------------------------------------------------------------------------------------------------------------------------------+
affected rows: 3
drop table t7;
affected rows: 0

#bit型
drop table if exists t8;
affected rows: 0
Warnings:
Note	1051	Unknown table 'db1.t8'
create table t8(c1 bit(64),c2 bit(64));
affected rows: 0
insert into t8 values(10,15),(11,16),(12,17);
affected rows: 3
info: Records: 3  Duplicates: 0  Warnings: 0
commit;
affected rows: 0
select bin(c1),bin(c2) from t8;
+---------+---------+
| bin(c1) | bin(c2) |
+---------+---------+
| 1010    | 1111    |
| 1011    | 10000   |
| 1100    | 10001   |
+---------+---------+
affected rows: 3

insert into t8 select c1,case c2 when b'1111' then b'11101' when b'10000' then 18 else 21 end from t8;
insert into t8 select c1,case c2 when b'1111' then 22 when b'10000' then 23 else 24 end from t8;//
affected rows: 3
info:  Records: 3  Duplicates: 0  Warnings: 0
affected rows: 6
info: Records: 6  Duplicates: 0  Warnings: 0
select bin(c1),bin(c2) from t8;
+---------+----------------+
| bin(c1) | bin(c2)        |
+---------+----------------+
| 1010    | 10110          |
| 1010    | 11000          |
| 1010    | 11101          |
| 1010    | 1111           |
| 1011    | 10000          |
| 1011    | 10111          |
| 1011    | 11000          |
| 1011    | 11000100111000 |
| 1100    | 10001          |
| 1100    | 11000          |
| 1100    | 11000          |
| 1100    | 11001000110001 |
+---------+----------------+
affected rows: 12
rollback;
affected rows: 0

drop table t8;
affected rows: 0


alter system set _rowsets_enabled=true;
affected rows: 0
set autocommit = true;
affected rows: 0
alter system set ob_enable_batched_multi_statement=false;
affected rows: 0

drop database db1;
affected rows: 0


