drop table if exists t1, t2, t0;
CREATE TABLE t0 (
i0 INTEGER
);
INSERT INTO t0 VALUES (0),(1),(2),(3),(4);
CREATE TABLE t1 (f1 INTEGER, f2 INTEGER, f3 INTEGER,
KEY(f1), KEY(f1,f2), KEY(f3));
INSERT INTO t1
SELECT i0, i0 + 10*i0,
i0 + 10*i0 + 100*i0
FROM t0 AS a0;
INSERT INTO t1
SELECT i0, i0 + 10*i0,
i0 + 10*i0 + 100*i0
FROM t0 AS a0;
INSERT INTO t1 VALUES (NULL, 1, 2);
INSERT INTO t1 VALUES (NULL, 1, 3);
SET optimizer_switch="derived_merge=off,derived_condition_pushdown=on";
Warnings:
Warning	1235	This system variable now is mock not supported
EXPLAIN FORMAT=TRADITIONAL SELECT * FROM (SELECT f1, f2 FROM t1) as dt WHERE f1 > 2;
SELECT * FROM (SELECT f1, f2 FROM t1) as dt WHERE f1 > 2;
f1	f2
3	33
3	33
4	44
4	44
EXPLAIN FORMAT=TRADITIONAL SELECT * FROM (SELECT f1, f2 FROM t1) as dt
WHERE f1 < 3 and f2 > 11;
SELECT * FROM (SELECT f1, f2 FROM t1) as dt
WHERE f1 < 3 and f2 > 11;
f1	f2
2	22
2	22
EXPLAIN FORMAT=TRADITIONAL SELECT * FROM (SELECT f1, f2, f3 FROM t1) as dt
WHERE f1 > 2 and f2 < 25 and f3 > 200;
SELECT * FROM (SELECT f1, f2, f3 FROM t1) as dt
WHERE f1 > 2 and f2 < 25 and f3 > 200;
f1	f2	f3
EXPLAIN FORMAT=TRADITIONAL SELECT * FROM (SELECT f1, f2, f3 FROM t1) as dt
WHERE f1 > 3 and f2 < 50 or f3 > 200;
SELECT * FROM (SELECT f1, f2, f3 FROM t1) as dt
WHERE f1 > 3 and f2 < 50 or f3 > 200;
f1	f2	f3
2	22	222
3	33	333
4	44	444
2	22	222
3	33	333
4	44	444
EXPLAIN FORMAT=TRADITIONAL SELECT t1.f2 as f2, dt.f1 as f1, dt.f3 as f3 FROM t1,
(SELECT f1, f2, f3 FROM t1) as dt
WHERE (dt.f1 = 6) or( t1.f2 = 50 and dt.f3 = 200);
SELECT t1.f2 as f2, dt.f1 as f1, dt.f3 as f3 FROM t1,
(SELECT f1, f2, f3 FROM t1) as dt
WHERE (dt.f1 = 6) or( t1.f2 = 50 and dt.f3 = 200);
f2	f1	f3
EXPLAIN FORMAT=TRADITIONAL SELECT /*+ JOIN_ORDER(t0, dt) */ * FROM
(SELECT f1, f2, f3 FROM t1) as dt, t0
WHERE f1 > 3 and f2 < 50 and i0 > 3;
SELECT /*+ JOIN_ORDER(t0, dt) */ * FROM
(SELECT f1, f2, f3 FROM t1) as dt, t0
WHERE f1 > 3 and f2 < 50 and i0 > 3;
f1	f2	f3	i0
4	44	444	4
4	44	444	4
EXPLAIN FORMAT=TRADITIONAL SELECT * FROM (SELECT * FROM (SELECT * FROM t1) as dt1) as dt2
WHERE f1 > 3 and f2 < 50 and f3 > 200;
SELECT * FROM (SELECT * FROM (SELECT * FROM t1) as dt1) as dt2
WHERE f1 > 3 and f2 < 50 and f3 > 200;
f1	f2	f3
4	44	444
4	44	444
EXPLAIN FORMAT=TRADITIONAL SELECT * FROM (SELECT f1, f2, f3 FROM t1) as dt
WHERE (f1 > 2 and f2 < 35) and (f1+f3) > 300;
SELECT * FROM (SELECT f1, f2, f3 FROM t1) as dt
WHERE (f1 > 2 and f2 < 35) and (f1+f3) > 300;
f1	f2	f3
3	33	333
3	33	333
EXPLAIN FORMAT=TRADITIONAL SELECT * FROM (SELECT f1, f2, f3 FROM t1) as dt
WHERE (f1 > 2 and f2 < 35) or (f1+f3) > 300 or (f1 < 2);
SELECT * FROM (SELECT f1, f2, f3 FROM t1) as dt
WHERE (f1 > 2 and f2 < 35) or (f1+f3) > 300 or (f1 < 2);
f1	f2	f3
0	0	0
1	11	111
3	33	333
4	44	444
0	0	0
1	11	111
3	33	333
4	44	444
EXPLAIN FORMAT=TRADITIONAL SELECT * FROM (SELECT f1, f2 FROM t1) as dt1,
(SELECT f3 FROM t1) as dt2
WHERE (f1 > 2 and f2 < 35) and (f1+f3) > 300
and (f3 < 400);
SELECT * FROM (SELECT f1, f2 FROM t1) as dt1,
(SELECT f3 FROM t1) as dt2
WHERE (f1 > 2 and f2 < 35) and (f1+f3) > 300
and (f3 < 400);
f1	f2	f3
3	33	333
3	33	333
3	33	333
3	33	333
EXPLAIN FORMAT=TRADITIONAL SELECT * FROM (SELECT * FROM (SELECT f1, f2 FROM t1) as dt1,
(SELECT f3 FROM t1) as dt2) as dt3
WHERE (f1 > 2 and f2 < 35) and (f1+f3) > 200
and (f3 < 300);
SELECT * FROM (SELECT * FROM (SELECT f1, f2 FROM t1) as dt1,
(SELECT f3 FROM t1) as dt2) as dt3
WHERE (f1 > 2 and f2 < 35) and (f1+f3) > 200
and (f3 < 300);
f1	f2	f3
3	33	222
3	33	222
3	33	222
3	33	222
EXPLAIN FORMAT=TRADITIONAL SELECT i, j, k FROM (SELECT f1 as i, f2 as j, f2 as k FROM t1) as dt
WHERE i > 1 and i+j > 40;
SELECT i, j, k FROM (SELECT f1 as i, f2 as j, f2 as k FROM t1) as dt
WHERE i > 1 and i+j > 40;
i	j	k
4	44	44
4	44	44
EXPLAIN FORMAT=TRADITIONAL SELECT i, j, k
FROM (SELECT l as i, m as j, n as k
FROM (SELECT f1 as l, f2 as m, f3 as n
FROM t1) as dt1 ) as dt2
WHERE i > 1 and i+j > 40;
SELECT i, j, k
FROM (SELECT l as i, m as j, n as k
FROM (SELECT f1 as l, f2 as m, f3 as n
FROM t1) as dt1 ) as dt2
WHERE i > 1 and i+j > 40;
i	j	k
4	44	444
4	44	444
EXPLAIN FORMAT=TRADITIONAL SELECT i, j, l, m, n
FROM (SELECT f1 as i, f2 as j FROM t1 ) as dt1 ,
(SELECT f1 as l, f2 as m, f3 as n FROM t1) as dt2
WHERE i > 1 and i+j > 40 and m < 20 and m+i > 20;
SELECT i, j, l, m, n
FROM (SELECT f1 as i, f2 as j FROM t1 ) as dt1 ,
(SELECT f1 as l, f2 as m, f3 as n FROM t1) as dt2
WHERE i > 1 and i+j > 40 and m < 20 and m+i > 20;
i	j	l	m	n
EXPLAIN FORMAT=TRADITIONAL SELECT * FROM
(SELECT (i+j) AS g, f1 FROM
(SELECT (f1+f2) AS i, (f1-f2) AS j FROM
(SELECT f1+10 AS f1, f2+10 AS f2 FROM t1) AS dt0)
AS dt1,
(SELECT f1, f2 FROM t1) AS dt2) AS dt3 WHERE g > 26 and g+f1 > 31;
SELECT * FROM
(SELECT (i+j) AS g, f1 FROM
(SELECT (f1+f2) AS i, (f1-f2) AS j FROM
(SELECT f1+10 AS f1, f2+10 AS f2 FROM t1) AS dt0)
AS dt1,
(SELECT f1, f2 FROM t1) AS dt2) AS dt3 WHERE g > 26 and g+f1 > 31;
g	f1
28	4
28	4
28	4
28	4
EXPLAIN FORMAT=TRADITIONAL SELECT l, m  FROM (SELECT (i+3) as l, (j+4) as m FROM
(SELECT (f1+f2) as i, (f3+10) as j FROM t1) as
dt1) as dt2 WHERE l > 20 and l+m > 10 ;
SELECT l, m  FROM (SELECT (i+3) as l, (j+4) as m FROM
(SELECT (f1+f2) as i, (f3+10) as j FROM t1) as
dt1) as dt2 WHERE l > 20 and l+m > 10 ;
l	m
27	236
39	347
51	458
27	236
39	347
51	458
EXPLAIN FORMAT=TRADITIONAL SELECT i FROM (SELECT f1 FROM t1) as dt(i) WHERE i > 10;
SELECT i FROM (SELECT f1 FROM t1) as dt(i) WHERE i > 10;
i
EXPLAIN FORMAT=TRADITIONAL SELECT m FROM (SELECT k+2 as l
FROM (SELECT f1+f2 as j
FROM t1) as dt1(k)) as dt(m)
WHERE m > 30;
SELECT m FROM (SELECT k+2 as l
FROM (SELECT f1+f2 as j
FROM t1) as dt1(k)) as dt(m)
WHERE m > 30;
m
38
38
50
50
EXPLAIN FORMAT=TRADITIONAL SELECT f1 FROM (SELECT f1, SUM(f2) FROM t1 GROUP BY f1) as dt
WHERE f1 > 3;
SELECT f1 FROM (SELECT f1, SUM(f2) FROM t1 GROUP BY f1) as dt
WHERE f1 > 3;
f1
4
EXPLAIN FORMAT=TRADITIONAL SELECT f1 FROM (SELECT f1, f2, SUM(f3) FROM t1 GROUP BY f1,f2) as dt
WHERE f1+f2 > 30;
SELECT f1 FROM (SELECT f1, f2, SUM(f3) FROM t1 GROUP BY f1,f2) as dt
WHERE f1+f2 > 30;
f1
3
4
EXPLAIN FORMAT=TRADITIONAL SELECT f1
FROM (SELECT f1, SUM(f2) FROM t1 GROUP BY f1 WITH ROLLUP) as dt
WHERE f1 IS NULL;
SELECT f1
FROM (SELECT f1, SUM(f2) FROM t1 GROUP BY f1 WITH ROLLUP) as dt
WHERE f1 IS NULL;
f1
NULL
NULL
EXPLAIN FORMAT=TRADITIONAL SELECT *
FROM (SELECT f1 as j, SUM(f2) as sum
FROM t1 GROUP BY f1 WITH ROLLUP) as dt WHERE j+sum > 50 OR
j IS NULL;
SELECT *
FROM (SELECT f1 as j, SUM(f2) as sum
FROM t1 GROUP BY f1 WITH ROLLUP) as dt WHERE j+sum > 50 OR
j IS NULL;
j	sum
NULL	2
3	66
4	88
NULL	222
EXPLAIN FORMAT=TRADITIONAL SELECT *
FROM (SELECT f1 as j, SUM(f2) as sum
FROM t1 GROUP BY f1 WITH ROLLUP
HAVING AVG(f2) > 1) AS dt WHERE j+sum > 50 OR
j IS NULL;
SELECT *
FROM (SELECT f1 as j, SUM(f2) as sum
FROM t1 GROUP BY f1 WITH ROLLUP
HAVING AVG(f2) > 1) AS dt WHERE j+sum > 50 OR
j IS NULL;
j	sum
3	66
4	88
NULL	222
EXPLAIN FORMAT=TRADITIONAL SELECT f1 FROM (SELECT f1, f2 FROM t1 ORDER BY f2) as dt
WHERE f1 > 3;
SELECT f1 FROM (SELECT f1, f2 FROM t1 ORDER BY f2) as dt
WHERE f1 > 3;
f1
4
4
EXPLAIN FORMAT=TRADITIONAL SELECT f1 FROM (SELECT f1, f2 FROM t1 ORDER BY f2 LIMIT 4) as dt
WHERE f1 > 0 ;
SELECT f1 FROM (SELECT f1, f2 FROM t1 ORDER BY f2 LIMIT 4) as dt
WHERE f1 > 0 ;
f1
EXPLAIN FORMAT=TRADITIONAL SELECT f1 FROM (SELECT f1, f2 FROM t1 LIMIT 4) as dt WHERE f1 > 0;
SELECT f1 FROM (SELECT f1, f2 FROM t1 LIMIT 4) as dt WHERE f1 > 0;
f1
1
2
3
set sql_mode="";
EXPLAIN FORMAT=TRADITIONAL SELECT * FROM (SELECT f1, SUM(f2) OVER() FROM t1 GROUP BY f1) as dt
WHERE f1 > 2;
SELECT * FROM (SELECT f1, SUM(f2) OVER() FROM t1 GROUP BY f1) as dt
WHERE f1 > 2;
f1	SUM(f2) OVER()
3	111
4	111
EXPLAIN FORMAT=TRADITIONAL SELECT *
FROM (SELECT f1, SUM(f2) OVER(PARTITION BY f1)
FROM t1 GROUP BY f1) as dt WHERE f1 > 2;
SELECT *
FROM (SELECT f1, SUM(f2) OVER(PARTITION BY f1)
FROM t1 GROUP BY f1) as dt WHERE f1 > 2;
f1	SUM(f2) OVER(PARTITION BY f1)
3	33
4	44
EXPLAIN FORMAT=TRADITIONAL SELECT *
FROM (SELECT f1, f2, SUM(f3) OVER(PARTITION BY f2)
FROM t1 GROUP BY f1) as dt WHERE f2 > 30;
SELECT *
FROM (SELECT f1, f2, SUM(f3) OVER(PARTITION BY f2)
FROM t1 GROUP BY f1) as dt WHERE f2 > 30;
f1	f2	SUM(f3) OVER(PARTITION BY f2)
3	33	333
4	44	444
EXPLAIN FORMAT=TRADITIONAL SELECT *
FROM (SELECT f1, f2, SUM(f3) OVER(PARTITION BY f1)
FROM t1 GROUP BY f1) as dt
WHERE f1 > 2 and f2 > 30 and (f1+f2) > 40;
SELECT *
FROM (SELECT f1, f2, SUM(f3) OVER(PARTITION BY f1)
FROM t1 GROUP BY f1) as dt
WHERE f1 > 2 and f2 > 30 and (f1+f2) > 40;
f1	f2	SUM(f3) OVER(PARTITION BY f1)
4	44	444
EXPLAIN FORMAT=TRADITIONAL SELECT *
FROM (SELECT f1, f2, SUM(f3) OVER(PARTITION BY f1,f2)
FROM t1 GROUP BY f1) as dt
WHERE f1 > 2 and f2 > 30 and (f1+f2) > 40;
SELECT *
FROM (SELECT f1, f2, SUM(f3) OVER(PARTITION BY f1,f2)
FROM t1 GROUP BY f1) as dt
WHERE f1 > 2 and f2 > 30 and (f1+f2) > 40;
f1	f2	SUM(f3) OVER(PARTITION BY f1,f2)
4	44	444
EXPLAIN FORMAT=TRADITIONAL SELECT *
FROM (SELECT f1, f2, SUM(f3) OVER(PARTITION BY f1,f2),
AVG(f3) OVER (PARTITION BY f1)
FROM t1 GROUP BY f1) as dt
WHERE f1 > 2 and f2 > 30 and (f1+f2) > 40;
SELECT *
FROM (SELECT f1, f2, SUM(f3) OVER(PARTITION BY f1,f2),
AVG(f3) OVER (PARTITION BY f1)
FROM t1 GROUP BY f1) as dt
WHERE f1 > 2 and f2 > 30 and (f1+f2) > 40;
f1	f2	SUM(f3) OVER(PARTITION BY f1,f2)	AVG(f3) OVER (PARTITION BY f1)
4	44	444	444.0000
EXPLAIN FORMAT=TRADITIONAL SELECT *
FROM (SELECT f1, SUM(f2) as SUM, AVG(f3) OVER (PARTITION BY SUM(f2))
FROM t1 GROUP BY f1) as dt
WHERE SUM > 40;
SELECT *
FROM (SELECT f1, SUM(f2) as SUM, AVG(f3) OVER (PARTITION BY SUM(f2))
FROM t1 GROUP BY f1) as dt
WHERE SUM > 40;
f1	SUM	AVG(f3) OVER (PARTITION BY SUM(f2))
2	44	222.0000
3	66	333.0000
4	88	444.0000
EXPLAIN FORMAT=TRADITIONAL SELECT *
FROM (SELECT f1, SUM(f2) OVER (PARTITION by f1,f2),
AVG(f3) OVER (PARTITION BY f2,f1),
FIRST_VALUE(f3) OVER (PARTITION by f1)
FROM t1) as dt
WHERE f1 > 2 ;
SELECT *
FROM (SELECT f1, SUM(f2) OVER (PARTITION by f1,f2),
AVG(f3) OVER (PARTITION BY f2,f1),
FIRST_VALUE(f3) OVER (PARTITION by f1)
FROM t1) as dt
WHERE f1 > 2 ;
f1	SUM(f2) OVER (PARTITION by f1,f2)	AVG(f3) OVER (PARTITION BY f2,f1)	FIRST_VALUE(f3) OVER (PARTITION by f1)
3	66	333.0000	333
3	66	333.0000	333
4	88	444.0000	444
4	88	444.0000	444
EXPLAIN FORMAT=TRADITIONAL SELECT *
FROM (SELECT f1, SUM(f1) OVER (PARTITION by f2),
AVG(f2) OVER (PARTITION BY f1)
FROM t1) as dt
WHERE f1 > 2 ;
SELECT *
FROM (SELECT f1, SUM(f1) OVER (PARTITION by f2),
AVG(f2) OVER (PARTITION BY f1)
FROM t1) as dt
WHERE f1 > 2 ;
f1	SUM(f1) OVER (PARTITION by f2)	AVG(f2) OVER (PARTITION BY f1)
3	6	33.0000
3	6	33.0000
4	8	44.0000
4	8	44.0000
set sql_mode=default;
SET @p1 = 3;
PREPARE p FROM "SELECT f1
FROM (SELECT f1 FROM t1) as dt WHERE f1 > ?";
EXECUTE p USING @p1;
f1
4
4
PREPARE p FROM "EXPLAIN FORMAT=TRADITIONAL SELECT f1
FROM (SELECT f1 FROM t1) as dt WHERE f1 > ?";
EXECUTE p USING @p1;
DROP PREPARE p;
SET @p1 = 1;
PREPARE p FROM "EXPLAIN FORMAT=TRADITIONAL SELECT l, m
FROM (SELECT (i+3) as l, (j+4) as m
FROM (SELECT (f1+f2) AS i, (f3+?) AS j
FROM t1) AS dt1
) AS dt2
WHERE l > 20 and l+m > 10 ";
EXECUTE p USING @p1;
PREPARE p FROM "SELECT l, m
FROM (SELECT (i+3) as l, (j+4) as m
FROM (SELECT (f1+f2) AS i, (f3+?) AS j
FROM t1) AS dt1
) AS dt2
WHERE l > 20 and l+m > 10 ";
EXECUTE p USING @p1;
EXPLAIN FORMAT=TRADITIONAL SELECT * FROM (SELECT RAND() as a FROM t1) as dt
WHERE a > 0.5;
EXPLAIN FORMAT=TRADITIONAL SELECT * FROM (SELECT f1, SUM(f2) FROM t1 GROUP BY f1) as dt
WHERE f1 > 3*RAND() AND f1 < 10;
EXPLAIN FORMAT=TRADITIONAL SELECT * FROM
(SELECT f1, SUM(f2) OVER(PARTITION BY f1) FROM t1) as dt
WHERE f1 > 3*RAND() AND f1 < 10;
EXPLAIN FORMAT=TRADITIONAL SELECT * FROM
(SELECT f1 FROM t1) as dt
WHERE f1 > 3*RAND() AND f1<10;
EXPLAIN FORMAT=TRADITIONAL SELECT f1 FROM
(SELECT (SELECT 1 FROM t1 LIMIT 1) as f1 FROM t1) as dt WHERE f1 = 1;
SELECT f1 FROM
(SELECT (SELECT 1 FROM t1 LIMIT 1) as f1 FROM t1) as dt WHERE f1 = 1;
f1
1
1
1
1
1
1
1
1
1
1
1
1
DROP PROCEDURE p1;|
CREATE FUNCTION p() RETURNS INTEGER
BEGIN
DECLARE retn INTEGER;
SELECT count(f1) FROM t1 INTO retn;
RETURN retn;
END|
EXPLAIN FORMAT=TRADITIONAL SELECT * FROM (SELECT f1, SUM(f2) FROM t1 GROUP BY f1) as dt
WHERE p() = 1;
SELECT * FROM (SELECT f1, SUM(f2) FROM t1 GROUP BY f1) as dt
WHERE p() = 1;
f1	SUM(f2)
DROP FUNCTION p;
CREATE FUNCTION p() RETURNS INTEGER DETERMINISTIC
BEGIN
DECLARE retn INTEGER;
SELECT count(f1) FROM t1 INTO retn;
RETURN retn;
END|
EXPLAIN FORMAT=TRADITIONAL SELECT * FROM (SELECT f1, SUM(f2) FROM t1 GROUP BY f1) as dt
WHERE p() = 1;
SELECT * FROM (SELECT f1, SUM(f2) FROM t1 GROUP BY f1) as dt
WHERE p() = 1;
f1	SUM(f2)
DROP FUNCTION p;
CREATE PROCEDURE p()
BEGIN
DECLARE val INTEGER;
SET val = 2;
EXPLAIN FORMAT=TRADITIONAL SELECT AVG(f1) FROM (SELECT * FROM t1) as dt
WHERE f2 > val;
SELECT AVG(f1) FROM (SELECT * FROM t1) as dt WHERE f2 > val;
END|
CALL p();
DROP PROCEDURE p;
EXPLAIN FORMAT=TRADITIONAL SELECT * FROM ((WITH qn AS (SELECT 10*f1 as f1 FROM t1),
qn2 AS (SELECT 3*f1 AS f2 FROM qn)
SELECT * from qn2)) as dt WHERE f2 > 1;
SELECT * FROM ((WITH qn AS (SELECT 10*f1 as f1 FROM t1),
qn2 AS (SELECT 3*f1 AS f2 FROM qn)
SELECT * from qn2)) as dt WHERE f2 > 1;
f2
120
120
30
30
60
60
90
90
EXPLAIN FORMAT=TRADITIONAL SELECT * FROM ((WITH qn AS (SELECT 10*f1 as f1 FROM t1),
qn2 AS (SELECT 3*f1 AS f2 FROM qn)
SELECT * from qn,qn2)) as dt WHERE f1 < 10 and f2 > 1;
SELECT * FROM ((WITH qn AS (SELECT 10*f1 as f1 FROM t1),
qn2 AS (SELECT 3*f1 AS f2 FROM qn)
SELECT * from qn,qn2)) as dt WHERE f1 < 10 and f2 > 1;
f1	f2
0	120
0	120
0	120
0	120
0	30
0	30
0	30
0	30
0	60
0	60
0	60
0	60
0	90
0	90
0	90
0	90
EXPLAIN FORMAT=TRADITIONAL SELECT * FROM t1 JOIN (SELECT f1, f2 FROM t1) as dt USING (f2)
WHERE dt.f1 > 31 and t1.f2  > 40;
SELECT * FROM t1 JOIN (SELECT f1, f2 FROM t1) as dt USING (f2)
WHERE dt.f1 > 31 and t1.f2  > 40;
f2	f1	f3	f1
EXPLAIN FORMAT=TRADITIONAL SELECT * FROM t1 LEFT JOIN (SELECT f1, f2 FROM t1) as dt USING (f2)
WHERE dt.f1 is null;
SELECT * FROM t1 LEFT JOIN (SELECT f1, f2 FROM t1) as dt USING (f2)
WHERE dt.f1 is null;
f2	f1	f3	f1
1	NULL	2	NULL
1	NULL	2	NULL
1	NULL	3	NULL
1	NULL	3	NULL
EXPLAIN FORMAT=TRADITIONAL SELECT * FROM t1 LEFT JOIN (SELECT f1, f2 FROM t1) as dt USING (f2)
WHERE dt.f1 > 3;
SELECT * FROM t1 LEFT JOIN (SELECT f1, f2 FROM t1) as dt USING (f2)
WHERE dt.f1 > 3;
f2	f1	f3	f1
44	4	444	4
44	4	444	4
44	4	444	4
44	4	444	4
EXPLAIN FORMAT=TRADITIONAL SELECT * FROM t1 INNER JOIN (SELECT f1, f2 FROM t1) as dt
ON dt.f1 > 3;
SELECT * FROM t1 INNER JOIN (SELECT f1, f2 FROM t1) as dt
ON dt.f1 > 3;
f1	f2	f3	f1	f2
0	0	0	4	44
0	0	0	4	44
0	0	0	4	44
0	0	0	4	44
1	11	111	4	44
1	11	111	4	44
1	11	111	4	44
1	11	111	4	44
2	22	222	4	44
2	22	222	4	44
2	22	222	4	44
2	22	222	4	44
3	33	333	4	44
3	33	333	4	44
3	33	333	4	44
3	33	333	4	44
4	44	444	4	44
4	44	444	4	44
4	44	444	4	44
4	44	444	4	44
NULL	1	2	4	44
NULL	1	2	4	44
NULL	1	3	4	44
NULL	1	3	4	44
EXPLAIN FORMAT = TRADITIONAL SELECT * FROM t1 INNER JOIN(SELECT t2.f1, t2.f2 FROM t1
LEFT JOIN t1 AS t2 ON TRUE) AS dt ON dt.f1 > 3;
set optimizer_switch="derived_merge=on";
Warnings:
Warning	1235	This system variable now is mock not supported
EXPLAIN FORMAT=TRADITIONAL SELECT * FROM (SELECT * FROM (SELECT f1, SUM(f2) AS sum
FROM t1 GROUP BY f1) as dt1
WHERE f1 > 10) dt2 WHERE sum > 10;
SELECT * FROM (SELECT * FROM (SELECT f1, SUM(f2) AS sum
FROM t1 GROUP BY f1) as dt1
WHERE f1 > 10) dt2 WHERE sum > 10;
f1	sum
EXPLAIN FORMAT=TRADITIONAL SELECT * FROM (SELECT f1, SUM(f2) AS sum
FROM (SELECT f1, f2 FROM t1 WHERE f1 > 10) as dt1
GROUP BY f1) dt2 WHERE sum > 10;
SELECT * FROM (SELECT f1, SUM(f2) AS sum
FROM (SELECT f1, f2 FROM t1 WHERE f1 > 10) as dt1
GROUP BY f1) dt2 WHERE sum > 10;
f1	sum
SELECT * FROM
(SELECT f1 FROM (SELECT f1 FROM t1) AS dt1 GROUP BY f1) AS dt2
WHERE f1 > 3;
f1
4
SELECT * FROM
(SELECT dt1.f1 FROM (SELECT f1 FROM t1) AS dt1, t1 AS t0
GROUP BY dt1.f1) AS dt2
WHERE dt2.f1 > 3;
f1
4
EXPLAIN SELECT /*+ no_merge(dt,dt1) */ * FROM
((SELECT f1, f2 FROM t1) as dt, (SELECT f1, f2 FROM t1) as dt1) WHERE FALSE;
SELECT /*+ no_merge(dt,dt1) */ * FROM
((SELECT f1, f2 FROM t1) as dt, (SELECT f1, f2 FROM t1) as dt1) WHERE FALSE;
f1	f2	f1	f2
set optimizer_switch="derived_merge=off";
Warnings:
Warning	1235	This system variable now is mock not supported
EXPLAIN FORMAT=TRADITIONAL SELECT /*+ NO_DERIVED_CONDITION_PUSHDOWN(dt2) */ * FROM
(SELECT * FROM (SELECT * FROM t1) as dt1) as dt2 WHERE f1 > 3;
SELECT /*+ NO_DERIVED_CONDITION_PUSHDOWN(dt2) */ * FROM
(SELECT * FROM (SELECT * FROM t1) as dt1) as dt2 WHERE f1 > 3;
f1	f2	f3
4	44	444
4	44	444
EXPLAIN FORMAT=TRADITIONAL SELECT /*+ NO_DERIVED_CONDITION_PUSHDOWN() */ * FROM
(SELECT * FROM (SELECT * FROM t1) as dt1) as dt2 WHERE f1 > 3;
SELECT /*+ NO_DERIVED_CONDITION_PUSHDOWN() */ * FROM
(SELECT * FROM (SELECT * FROM t1) as dt1) as dt2 WHERE f1 > 3;
f1	f2	f3
4	44	444
4	44	444
set optimizer_switch="derived_condition_pushdown=off";
Warnings:
Warning	1235	This system variable now is mock not supported
EXPLAIN FORMAT=TRADITIONAL SELECT /*+ DERIVED_CONDITION_PUSHDOWN(dt2) */ * FROM
(SELECT /*+ NO_DERIVED_CONDITION_PUSHDOWN(dt1) */ * FROM
(SELECT * FROM t1) as dt1) as dt2 WHERE f1 > 3;
SELECT /*+ DERIVED_CONDITION_PUSHDOWN(dt2) */ * FROM
(SELECT /*+ NO_DERIVED_CONDITION_PUSHDOWN(dt1) */ * FROM
(SELECT * FROM t1) as dt1) as dt2 WHERE f1 > 3;
f1	f2	f3
4	44	444
4	44	444
set optimizer_switch=default;
Warnings:
Warning	1235	This system variable now is mock not supported
# Bug#31491972: WL8084: SERVER CRASH FROM
#               JOIN::UPDATE_SARGABLE_FROM_CONST()
SELECT f1 FROM (SELECT DISTINCT * FROM t1 WHERE f2 = 4) AS alias1
WHERE ( alias1 . f1 = 24 AND alias1 . f3 = 101 );
f1
SELECT f1 FROM (SELECT DISTINCT * FROM t1 WHERE f2 = 4) AS alias1
WHERE ( alias1 . f1 BETWEEN 24 AND 30 AND alias1 . f3 BETWEEN 101 and 103);
f1
DROP TABLE t0, t1;
#
# Bug#31603289:CRASH IN TABLE_LIST::GET_CLONE_FOR_DERIVED_EXPR,
#              ASSERTION `FALSE' IN TABLE_LIST::GET_DERIVED_EXPR
#
CREATE TABLE t(f0 INTEGER PRIMARY KEY, f1 INTEGER,f2 INTEGER);
SELECT NULL IN(SELECT (f1 between 0 and 1)
FROM (SELECT f1 FROM t WHERE  (@b:=NULL) - f2)as dt
);
NULL IN(SELECT (f1 between 0 and 1)
FROM (SELECT f1 FROM t WHERE  (@b:=NULL) - f2)as dt
)
0
DROP TABLE t;
#
# Bug#32127562:ERROR 3566 (HY000): ACCESS TO NATIVE FUNCTION IS
#              REJECTED
#
set optimizer_switch="derived_merge=off";
Warnings:
Warning	1235	This system variable now is mock not supported
SELECT 1 FROM information_schema.tables WHERE 12 IN (CONCAT_WS(TABLE_ROWS, ''));
1
set optimizer_switch="derived_merge=on";
Warnings:
Warning	1235	This system variable now is mock not supported
# BUG#32150145: 8.0.22+ RELEASE BUILD QUERY FAILS SILENTLY,
#                DEBUG ASSERTION `THD->IS_ERROR()'
#
CREATE TABLE t1(g INTEGER);
SELECT w.g FROM t1 INNER JOIN (
SELECT g, ROW_NUMBER() OVER (PARTITION BY g) AS r FROM t1
) w ON w.g=t1.g AND w.r=1 WHERE w.g IS NULL;
g
DROP TABLE t1;
#
# BUG#32863713: CTE CRASH IN QUERY_BLOCK::MASTER_QUERY_EXPRESSION
#
CREATE TABLE t(f1 INTEGER);
EXPLAIN SELECT a1, a2
FROM (SELECT MAX(2) AS a1 FROM t) as dt1,
(SELECT @a AS a2 FROM t) as dt2
WHERE dt1.a1 <= dt2.a2;
SELECT a1, a2
FROM (SELECT MAX(f1) AS a1 FROM t) as dt1,
(SELECT @a AS a2 FROM t) as dt2
WHERE dt1.a1 <= dt2.a2;
a1	a2
DROP TABLE t;
#
# Bug#32905044: CRASH AT CONDITION_PUSHDOWN::REPLACE_COLUMNS_IN_COND
#	       DURIN RQG CONCURRENCY RUNS
CREATE TABLE t(f1 INTEGER);
CREATE ALGORITHM=temptable VIEW v AS SELECT f1 FROM t;
SELECT f1 FROM (SELECT f1 FROM v) AS dt1 NATURAL JOIN v dt2 WHERE f1 > 5;
f1
DROP TABLE t;
DROP VIEW v;
#
# Bug#32959186: DERIVED CONDITION PUSHDOWN IS NOT AVAILABLE FOR
#               INSERT ... SELECT QUERIES
CREATE TABLE t1(f1 INTEGER, KEY(f1));
CREATE TABLE t2(f1 INTEGER);
INSERT INTO t1 VALUES (1),(2),(3),(4),(5);
CREATE ALGORITHM=temptable VIEW v AS SELECT f1 FROM t1;
EXPLAIN format=TRADITIONAL INSERT INTO t2 SELECT * FROM v WHERE f1=2;
INSERT INTO t2 SELECT * FROM v WHERE f1=2;
EXPLAIN format=TRADITIONAL UPDATE t2 SET f1=3 WHERE f1 IN (SELECT f1 FROM v WHERE f1=2);
UPDATE t2 SET f1=3 WHERE f1 IN (SELECT f1 FROM v WHERE f1=2);
EXPLAIN format=TRADITIONAL DELETE FROM t2 WHERE f1 IN (SELECT f1 FROM v WHERE f1=3);
DELETE FROM t2 WHERE f1 IN (SELECT f1 FROM v WHERE f1=3);
DROP TABLE t1;
DROP TABLE t2;
DROp VIEW v;
#
# Bug#33341080: Derived condition pushdown rewrite ignores user variables
#
CREATE TABLE t1(f1 INTEGER);
INSERT INTO t1 VALUES (100),(200),(300),(400),(500);
SET @rownum_r=0;
EXPLAIN FORMAT=TRADITIONAL SELECT *
FROM (SELECT f1, (@rownum_r := @rownum_r + 1) AS r FROM t1) AS dt
WHERE dt.f1 = 300;
SET @rownum_r=0;
SELECT *
FROM (SELECT f1, (@rownum_r := @rownum_r + 1) AS r FROM t1) AS dt
WHERE dt.f1 = 300;
f1	r
300	3
DROP TABLE t1;
CREATE TABLE t0 (
i0 INTEGER
);
INSERT INTO t0 VALUES (0),(1),(2),(3),(4);
CREATE TABLE t1 (f1 INTEGER, f2 INTEGER, f3 INTEGER,
KEY(f1), KEY(f1,f2), KEY(f3));
INSERT INTO t1
SELECT i0, i0 + 10*i0,
i0 + 10*i0 + 100*i0
FROM t0 AS a0;
INSERT INTO t1
SELECT i0, i0 + 10*i0,
i0 + 10*i0 + 100*i0
FROM t0 AS a0;
INSERT INTO t1 VALUES (NULL, 1, 2);
INSERT INTO t1 VALUES (NULL, 1, 3);
CREATE TABLE t2 LIKE t1;
INSERT INTO t2 SELECT * FROM t1;
EXPLAIN FORMAT=TRADITIONAL SELECT *
FROM (SELECT f1, f2 FROM t1
UNION
SELECT f1, f2 FROM t2) as dt
WHERE f1 > 2;
SELECT *
FROM (SELECT f1, f2 FROM t1
UNION
SELECT f1, f2 FROM t2) as dt
WHERE f1 > 2;
f1	f2
3	33
4	44
EXPLAIN FORMAT=TRADITIONAL SELECT *
FROM (SELECT f1, f2 FROM t1
INTERSECT
SELECT f1, f2 FROM t2) as dt
WHERE f1 > 2;
SELECT *
FROM (SELECT f1, f2 FROM t1
INTERSECT
SELECT f1, f2 FROM t2) as dt
WHERE f1 > 2;
f1	f2
3	33
4	44
EXPLAIN FORMAT=TRADITIONAL SELECT *
FROM (SELECT f1, f2 FROM t1
EXCEPT
SELECT f1, f2 FROM t2) as dt
WHERE f1 > 2;
SELECT *
FROM (SELECT f1, f2 FROM t1
EXCEPT
SELECT f1, f2 FROM t2) as dt
WHERE f1 > 2;
f1	f2
EXPLAIN FORMAT=TRADITIONAL SELECT *
FROM (SELECT * FROM (SELECT * FROM t1
UNION
SELECT * FROM t1) as dt1
UNION
SELECT * FROM t2) as dt2
WHERE (f1+f2) > 22;
SELECT *
FROM (SELECT * FROM (SELECT * FROM t1
UNION
SELECT * FROM t1) as dt1
UNION
SELECT * FROM t2) as dt2
WHERE (f1+f2) > 22;
f1	f2	f3
2	22	222
3	33	333
4	44	444
EXPLAIN FORMAT=TRADITIONAL SELECT *
FROM (SELECT * FROM (SELECT * FROM t1
INTERSECT
SELECT * FROM t1) as dt1
INTERSECT
SELECT * FROM t2) as dt2
WHERE (f1+f2) > 22;
SELECT *
FROM (SELECT * FROM (SELECT * FROM t1
INTERSECT
SELECT * FROM t1) as dt1
INTERSECT
SELECT * FROM t2) as dt2
WHERE (f1+f2) > 22;
f1	f2	f3
2	22	222
3	33	333
4	44	444
EXPLAIN FORMAT=TRADITIONAL SELECT i, j, k
FROM (SELECT f1 as i, f2 as j, f3 as k FROM t1
UNION
SELECT f1 as l, f2 as m, f3 as n FROM t2) as dt
WHERE i > 1 and i+j > 40 and k < 500;
SELECT i, j, k
FROM (SELECT f1 as i, f2 as j, f3 as k FROM t1
UNION
SELECT f1 as l, f2 as m, f3 as n FROM t2) as dt
WHERE i > 1 and i+j > 40 and k < 500;
i	j	k
4	44	444
EXPLAIN FORMAT=TRADITIONAL SELECT i, j
FROM (SELECT f1+f2 as i, f2+f3 as j FROM t1
UNION
SELECT f1 as l, f2+f3 as m FROM t2) as dt
WHERE i > 30 and i+j > 300;
EXPLAIN FORMAT=TRADITIONAL SELECT i, j
FROM (SELECT f1+f2 as i, f2+f3 as j FROM t1
INTERSECT
SELECT f1 as l, f2+f3 as m FROM t2) as dt
WHERE i > 30 and i+j > 300;
EXPLAIN FORMAT=TRADITIONAL SELECT i
FROM (SELECT f1 FROM t1
UNION
SELECT f2 FROM t2) as dt(i)
WHERE i > 10;
SELECT i
FROM (SELECT f1 FROM t1
UNION
SELECT f2 FROM t2) as dt(i)
WHERE i > 10;
i
11
22
33
44
EXPLAIN FORMAT=TRADITIONAL SELECT *
FROM (SELECT f1, SUM(f2) FROM t1 GROUP BY f1
UNION
SELECT f1, f2 FROM t1) as dt
WHERE f1 > 3;
SELECT *
FROM (SELECT f1, SUM(f2) FROM t1 GROUP BY f1
UNION
SELECT f1, f2 FROM t1) as dt
WHERE f1 > 3;
f1	SUM(f2)
4	44
4	88
EXPLAIN FORMAT=TRADITIONAL SELECT *
FROM (SELECT f1 as j, SUM(f2) as sum
FROM t1 GROUP BY f1 WITH ROLLUP
HAVING AVG(f2) > 1
UNION ALL
SELECT f1 as j, SUM(f2) as sum
FROM t1 GROUP BY f1) AS dt
WHERE j+sum > 50 OR j IS NULL;
SELECT *
FROM (SELECT f1 as j, SUM(f2) as sum
FROM t1 GROUP BY f1 WITH ROLLUP
HAVING AVG(f2) > 1
UNION ALL
SELECT f1 as j, SUM(f2) as sum
FROM t1 GROUP BY f1) AS dt
WHERE j+sum > 50 OR j IS NULL;
j	sum
3	66
4	88
NULL	222
NULL	2
3	66
4	88
EXPLAIN FORMAT=TRADITIONAL SELECT f1
FROM (SELECT f1, f2 FROM t1
UNION
SELECT f1, f2 FROM t2 ORDER BY f2) as dt
WHERE f1 > 3;
SELECT f1
FROM (SELECT f1, f2 FROM t1
UNION
SELECT f1, f2 FROM t2 ORDER BY f2) as dt
WHERE f1 > 3;
f1
4
EXPLAIN FORMAT=TRADITIONAL SELECT *
FROM (SELECT f1, f2, SUM(f2) OVER(PARTITION BY f1,f2)
FROM t1 GROUP BY f1, f2
UNION ALL
SELECT f1, f2, SUM(f2) OVER(PARTITION BY f1,f2)
FROM t2 GROUP BY f1,f2) as dt
WHERE f1 > 2 and f2 > 30 and (f1+f2) > 40;
SELECT *
FROM (SELECT f1, f2, SUM(f2) OVER(PARTITION BY f1,f2)
FROM t1 GROUP BY f1, f2
UNION ALL
SELECT f1, f2, SUM(f2) OVER(PARTITION BY f1,f2)
FROM t2 GROUP BY f1,f2) as dt
WHERE f1 > 2 and f2 > 30 and (f1+f2) > 40;
f1	f2	SUM(f2) OVER(PARTITION BY f1,f2)
4	44	44
4	44	44
EXPLAIN FORMAT=TRADITIONAL SELECT *
FROM (SELECT f1, f2, SUM(f2) OVER(PARTITION BY f1,f2)
FROM t1 GROUP BY f1, f2
INTERSECT ALL
SELECT f1, f2, SUM(f2) OVER(PARTITION BY f1,f2)
FROM t2 GROUP BY f1,f2) as dt
WHERE f1 > 2 and f2 > 30 and (f1+f2) > 40;
SELECT *
FROM (SELECT f1, f2, SUM(f2) OVER(PARTITION BY f1,f2)
FROM t1 GROUP BY f1, f2
INTERSECT ALL
SELECT f1, f2, SUM(f2) OVER(PARTITION BY f1,f2)
FROM t2 GROUP BY f1,f2) as dt
WHERE f1 > 2 and f2 > 30 and (f1+f2) > 40;
ERROR 42000: You have an error in your SQL syntax; check the manual that corresponds to your OceanBase version for the right syntax to use near 'ALL
SELECT f1, f2, SUM(f2) OVER(PARTITION BY f1,f2)
FROM t2 GROUP BY f1,f2) as d' at line 4
set sql_mode=default;
SET @p1 = 3;
PREPARE p FROM "SELECT f1
FROM (SELECT f1 FROM t1
UNION
SELECT f1 FROM t1) as dt WHERE f1 > ?";
EXECUTE p USING @p1;
f1
4
PREPARE p FROM "EXPLAIN FORMAT=TRADITIONAL SELECT f1
FROM (SELECT f1 FROM t1
UNION
SELECT f1 FROM t1) as dt WHERE f1 > ?";
EXECUTE p USING @p1;
DROP PREPARE p;
SET @p1=1, @p2=2, @p3=3, @p4=4, @p5=5, @p6=6;
PREPARE p FROM "EXPLAIN FORMAT=TRADITIONAL SELECT l,m
FROM (SELECT (i+10+?) as l, (j+11+?) as m
FROM (SELECT (f1+f2) as i, (f3+?) as j
FROM t1 UNION
SELECT (f1+f3) as i, (f2+?) as j
FROM t2) as dt1
GROUP BY l,m) as dt2
WHERE l > 20 and ?-m+? > 10";
EXECUTE p USING @p1, @p2, @p3, @p4, @p5, @p6;
PREPARE p FROM "SELECT l,m
FROM (SELECT (i+10+?) as l, (j+11+?) as m
FROM (SELECT (f1+f2) as i, (f3+?) as j
FROM t1 UNION
SELECT (f1+f3) as i, (f2+?) as j
FROM t2) as dt1
GROUP BY l,m) as dt2
WHERE l > 20 and ?-m+? > 10";
EXECUTE p USING @p1, @p2, @p3, @p4, @p5, @p6;
EXPLAIN FORMAT=TRADITIONAL SELECT *
FROM (SELECT f1 as a FROM t1
UNION ALL
SELECT RAND() as a FROM t1) as dt
WHERE a > 0.5;
EXPLAIN FORMAT=TRADITIONAL SELECT *
FROM (SELECT f1, SUM(f2) FROM t1 GROUP BY f1
UNION ALL
SELECT f1, f2 FROM t1) as dt
WHERE f1 > 3*RAND() AND f1 < 10;
EXPLAIN FORMAT=TRADITIONAL SELECT *
FROM (SELECT f1, SUM(f2) FROM t1 GROUP BY f1
INTERSECT ALL
SELECT f1, f2 FROM t1) as dt
WHERE f1 > 3*RAND() AND f1 < 10;
EXPLAIN FORMAT=TRADITIONAL SELECT f1
FROM (SELECT f1 FROM t1
UNION ALL
SELECT (SELECT 1 FROM t1 LIMIT 1) as f1 FROM t1) as dt
WHERE f1 = 1;
SELECT f1
FROM (SELECT f1 FROM t1
UNION ALL
SELECT (SELECT 1 FROM t1 LIMIT 1) as f1 FROM t1) as dt
WHERE f1 = 1;
f1
1
1
1
1
1
1
1
1
1
1
1
1
1
1
EXPLAIN FORMAT=TRADITIONAL SELECT f1
FROM (SELECT f1 FROM t1
UNION ALL
SELECT f1 FROM t1 LIMIT 1) as dt
WHERE f1 = 1;
EXPLAIN FORMAT=TRADITIONAL SELECT f1
FROM (SELECT f1 FROM t1
UNION ALL
(SELECT f1 FROM t1 LIMIT 1)) as dt
WHERE f1 = 1;
CREATE FUNCTION p() RETURNS INTEGER
BEGIN
DECLARE retn INTEGER;
SELECT count(f1) FROM t1 INTO retn;
RETURN retn;
END|
EXPLAIN FORMAT=TRADITIONAL SELECT *
FROM (SELECT f1, SUM(f2) FROM t1 GROUP BY f1
UNION
SELECT f1, f2 FROM t1) as dt
WHERE p() = 1;
SELECT *
FROM (SELECT f1, SUM(f2) FROM t1 GROUP BY f1
UNION
SELECT f1, f2 FROM t1) as dt
WHERE p() = 1;
f1	SUM(f2)
DROP FUNCTION p;
CREATE FUNCTION p() RETURNS INTEGER DETERMINISTIC
BEGIN
DECLARE retn INTEGER;
SELECT 1 INTO retn;
RETURN retn;
END|
EXPLAIN FORMAT=TRADITIONAL SELECT *
FROM (SELECT f1, SUM(f2) FROM t1 GROUP BY f1
UNION
SELECT f1, f2 FROM t1) as dt
WHERE p() = 1;
SELECT *
FROM (SELECT f1, SUM(f2) FROM t1 GROUP BY f1
UNION
SELECT f1, f2 FROM t1) as dt
WHERE p() = 1;
f1	SUM(f2)
0	0
1	11
1	22
2	22
2	44
3	33
3	66
4	44
4	88
NULL	1
NULL	2
DROP FUNCTION p;
CREATE PROCEDURE p()
BEGIN
DECLARE val INTEGER;
SET val = 2;
EXPLAIN FORMAT=TRADITIONAL SELECT AVG(f1)
FROM (SELECT * FROM t1
UNION
SELECT * FROM t1) as dt
WHERE f2 > val;
SELECT AVG(f1)
FROM (SELECT * FROM t1
UNION
SELECT * FROM t1) as dt
WHERE f2 > val;
END|
CALL p();
DROP PROCEDURE p;
EXPLAIN FORMAT=TRADITIONAL WITH recursive qn AS
(SELECT 10*f1 as f1 FROM t1
UNION
SELECT * FROM qn) SELECT * FROM qn WHERE f1 > 1;
WITH recursive qn AS
(SELECT 10*f1 as f1 FROM t1
UNION
SELECT * FROM qn) SELECT * FROM qn WHERE f1 > 1;
ERROR 0A000: recursive UNION DISTINCT in Recursive Common Table Expression not supported
EXPLAIN FORMAT=TRADITIONAL SELECT *
FROM t1 JOIN (SELECT f1, f2 FROM t1
UNION SELECT f1, f2 FROM t1) as dt USING (f2)
WHERE dt.f1 > 31 and t1.f2  > 40;
SELECT *
FROM t1 JOIN (SELECT f1, f2 FROM t1
UNION SELECT f1, f2 FROM t1) as dt USING (f2)
WHERE dt.f1 > 31 and t1.f2  > 40;
f2	f1	f3	f1
EXPLAIN FORMAT=TRADITIONAL SELECT *
FROM t1 JOIN (SELECT f1, f2 FROM t1
EXCEPT SELECT f1, f2 FROM t1) as dt USING (f2)
WHERE dt.f1 > 31 and t1.f2  > 40;
SELECT *
FROM t1 JOIN (SELECT f1, f2 FROM t1
EXCEPT SELECT f1, f2 FROM t1) as dt USING (f2)
WHERE dt.f1 > 31 and t1.f2  > 40;
f2	f1	f3	f1
EXPLAIN FORMAT=TRADITIONAL SELECT *
FROM (SELECT *
FROM (SELECT f1, f2 FROM t1
UNION
SELECT f1, f2 FROM t1) as dt1
WHERE f1 > 10) dt2
WHERE f2 > 30;
SELECT *
FROM (SELECT *
FROM (SELECT f1, f2 FROM t1
UNION
SELECT f1, f2 FROM t1) as dt1
WHERE f1 > 10) dt2
WHERE f2 > 30;
f1	f2
EXPLAIN FORMAT=TRADITIONAL SELECT *
FROM (SELECT f1, f2
FROM (SELECT f1+f2 as f1, f2 FROM t1) as dt1
UNION
SELECT f1, f2 FROM t1) as dt2
WHERE f1 > 30;
SELECT *
FROM (SELECT f1, f2
FROM (SELECT f1+f2 as f1, f2 FROM t1) as dt1
UNION
SELECT f1, f2 FROM t1) as dt2
WHERE f1 > 30;
f1	f2
36	33
48	44
CREATE ALGORITHM=temptable VIEW v AS (SELECT f1,f2,f3 FROM t1
UNION
SELECT f1,f2,f3 FROM t1);
EXPLAIN format=TRADITIONAL INSERT INTO t2 SELECT * FROM v WHERE f1=2;
INSERT INTO t2 SELECT * FROM v WHERE f1=2;
EXPLAIN format=TRADITIONAL UPDATE t2 SET f1=3 WHERE f1 IN (SELECT f1 FROM v WHERE f1=2);
UPDATE t2 SET f1=3 WHERE f1 IN (SELECT f1 FROM v WHERE f1=2);
EXPLAIN format=TRADITIONAL UPDATE t2 JOIN v ON t2.f2=v.f2
SET t2.f1 = t2.f1 + v.f1
WHERE v.f2 > 10;
UPDATE t2 JOIN v ON t2.f2=v.f2 SET t2.f1 = t2.f1 + v.f1 WHERE v.f2 > 10;
EXPLAIN format=TRADITIONAL DELETE FROM t2 WHERE f1 IN (SELECT f1 FROM v WHERE f1=3);
DELETE FROM t2 WHERE f1 IN (SELECT f1 FROM v WHERE f1=3);
EXPLAIN format=TRADITIONAL DELETE t2 FROM t2 JOIN v ON t2.f2=v.f2 WHERE v.f2 > 10;
DELETE t2 FROM t2 JOIN v ON t2.f2=v.f2 WHERE v.f2 > 10;
DROP VIEW v;
DROP TABLE t0;
DROP TABLE t1;
DROP TABLE t2;
CREATE TABLE t1(f1 VARBINARY(10000));
SELECT * FROM (SELECT f1 FROM t1 UNION SELECT f1 FROM t1) as dt WHERE f1 > '10';
f1
DROP TABLE t1;
#
# Bug#33791802: Query with multiple JOINs stopped working
#
drop VIEW if exists v1, v2;
CREATE TABLE t1(f1 INTEGER, f2 INTEGER);
CREATE VIEW v1 AS SELECT * FROM t1 UNION SELECT * FROM t1;
CREATE VIEW v2 AS SELECT * FROM v1;
SELECT t1.f1 FROM t1 JOIN v2 USING(f2) WHERE v2.f2 = 1;
f1
DROP TABLE t1;
DROP VIEW v1;
DROP VIEW v2;
SELECT a.table_name, d.table_name
FROM information_schema.key_column_usage a
JOIN information_schema.table_constraints b
USING (table_schema , table_name , constraint_name)
JOIN information_schema.referential_constraints c
ON (c.constraint_name = b.constraint_name AND
c.table_name = b.table_name AND
c.constraint_schema = b.table_schema)
LEFT JOIN information_schema.table_constraints d
ON (a.referenced_table_schema = d.table_schema AND
a.referenced_table_name = d.table_name AND
d.constraint_type IN ('UNIQUE' , 'PRIMARY KEY'))
WHERE b.constraint_type = 'FOREIGN KEY'
ORDER BY a.table_name , a.ordinal_position;
#
# Bug#33838439: ExtractValue not working properly with COUNT
#
CREATE TABLE t1 (f1 INTEGER);
SET @a = 0;
EXPLAIN SELECT COUNT(*) FROM (SELECT SUM(f1) FROM t1) as dt WHERE @a = 1;
SELECT COUNT(*) FROM (SELECT SUM(f1) FROM t1) as dt WHERE @a = 1;
COUNT(*)
0
DROP TABLE t1;
#
# Bug#34148712: Incorrect DATETIME value: '' on latest MySQL 8.0.29
#
CREATE TABLE t1 (f1 INTEGER UNSIGNED);
PREPARE stmt FROM "SELECT *
FROM (SELECT NOW() AS time FROM t1 WHERE f1 = ?
UNION
SELECT NOW() AS time FROM t1 WHERE f1 = 0) AS dt
WHERE time <= ?";
SET @a = 1;
SET @b = '2022-05-06 16:49:45';
EXECUTE stmt USING @a, @b;
time
PREPARE stmt FROM "EXPLAIN FORMAT=TRADITIONAL SELECT *
FROM (SELECT NOW() AS time FROM t1 WHERE f1 = ?
UNION
SELECT NOW() AS time FROM t1 WHERE f1 = 0) AS dt
WHERE time <= ?";
EXECUTE stmt USING @a, @b;
SET @a = 2;
SET @b = '2023-05-06 16:49:45';
EXECUTE stmt USING @a, @b;
DROP TABLE t1;
#
# Bug#34298238: Assertion `cond->is_bool_func()' failed in MySQL 8.0.29
#
CREATE TABLE t1 (f1 INTEGER);
INSERT INTO t1 VALUES (1);
SELECT * FROM (SELECT f1 FROM t1 UNION SELECT f1 FROM t1) AS dt WHERE f1 <> 0.5;
f1
1
DROP TABLE t1;
#
# Bug#34515868: Temptable views on information_schema fails on filters
#
CREATE ALGORITHM=TEMPTABLE VIEW v1 AS
SELECT VIEW_DEFINITION FROM INFORMATION_SCHEMA.VIEWS;
SELECT * FROM v1 WHERE VIEW_DEFINITION LIKE 'x';
VIEW_DEFINITION
CREATE ALGORITHM=TEMPTABLE VIEW v2 AS SELECT * FROM v1;
SELECT * FROM v2 WHERE VIEW_DEFINITION LIKE 'x';
VIEW_DEFINITION
CREATE ALGORITHM=TEMPTABLE VIEW v3 AS
SELECT * FROM (SELECT * FROM v1 UNION SELECT * FROM v2) AS dt;
SELECT * FROM v3 WHERE VIEW_DEFINITION LIKE 'x';
VIEW_DEFINITION
DROP VIEW v1, v2, v3;
# Bug#34359297: Incorrect work of query with union in inner select
CREATE TABLE t1 (
str VARCHAR(200) CHARACTER SET utf16 COLLATE utf16_unicode_ci
) ENGINE=InnoDB;
Warnings:
Warning	1286	Unknown storage engine 'InnoDB'
CREATE TABLE t2 (
str VARCHAR(200) CHARACTER SET utf16 COLLATE utf16_unicode_ci
) ENGINE=InnoDB;
Warnings:
Warning	1286	Unknown storage engine 'InnoDB'
INSERT INTO t1 VALUES (_utf8mb4'Patch');
EXPLAIN FORMAT=TRADITIONAL SELECT dt.str
FROM (SELECT t2.str
FROM t2
WHERE t2.str LIKE _latin1'Patc%' ESCAPE _latin1'\\'
      UNION ALL
SELECT t1.str
FROM t1
WHERE t1.str LIKE _latin1'Patc%' ESCAPE _latin1'\\'
     ) AS dt
WHERE dt.str LIKE _latin1'P%' ESCAPE _latin1'\\';
SELECT dt.str
FROM (SELECT t2.str
FROM t2
WHERE t2.str LIKE _latin1'Patc%' ESCAPE _latin1'\\'
      UNION ALL
SELECT t1.str
FROM t1
WHERE t1.str LIKE _latin1'Patc%' ESCAPE _latin1'\\'
     ) AS dt
WHERE dt.str LIKE _latin1'P%' ESCAPE _latin1'\\';
str
Patch
DROP TABLE t1, t2;
#
# Bug#34781533: Result set is incorrect
#
CREATE TABLE t1 (f1 INTEGER, f2 INTEGER);
INSERT INTO t1 VALUES (NULL, NULL);
SELECT 1
FROM (SELECT 1
FROM t1 LEFT JOIN (SELECT 1 AS f1 FROM t1) AS dt1
ON dt1.f1 = t1.f2
WHERE dt1.f1 IS NOT NULL) AS dt2,
(SELECT 1 FROM t1 UNION ALL SELECT 2 FROM t1) AS dt3;
1
DROP TABLE t1;
#
# Bug#34919799: Assertion `cond->is_bool_func()' failed.
#
CREATE TABLE t1 (f1 TINYINT);
SELECT f1 FROM (SELECT f1 FROM t1 UNION SELECT f1 FROM t1 ) AS dt
WHERE f1 > -32768 OR f1 = 1;
f1
DROP TABLE t1;
#
# Bug#34996488: utf8mb4 identifiers stopped working since
#               8.0.32 release
#
SELECT * FROM (SELECT 'å' AS x) AS dt WHERE x = 'å';
x
å
CREATE TABLE t1 (f1 VARCHAR(10));
INSERT INTO t1 VALUES('å');
SELECT * FROM (SELECT f1 FROM t1 UNION SELECT f1 FROM t1) AS dt WHERE f1 = 'å';
f1
å
DROP TABLE t1;
