#
# Bug#13335170 - ASSERT IN
# PLAN_CHANGE_WATCHDOG::~PLAN_CHANGE_WATCHDOG() ON SELECT DISTINCT 
#
DROP TABLE t1;
CREATE TABLE t1 (
col_int_key int(11) NOT NULL,
col_time_key time NOT NULL,
col_datetime_key datetime NOT NULL,
KEY col_int_key (col_int_key),
KEY col_time_key (col_time_key),
KEY col_datetime_key (col_datetime_key)
) ENGINE=InnoDB;
Warnings:
Warning	1286	Unknown storage engine 'InnoDB'
INSERT INTO t1 VALUES (7,'06:17:39','2003-08-21 00:00:00');
SELECT DISTINCT col_int_key
FROM t1
WHERE col_int_key IN  ( 18, 6, 84, 4, 0, 2, 8, 3, 7, 9, 1 )
AND col_datetime_key BETWEEN '2001-08-04' AND '2003-06-13'
ORDER BY col_time_key
LIMIT 3;
col_int_key
DROP TABLE t1;

# BUG#13581713 ONLY_FULL_GROUP_BY DOES NOT BLOCK "SELECT
# DISTINCT A ORDER BY B"

DROP TABLE t1;
create table t1(a int, b int, c int) engine=InnoDB;
Warnings:
Warning	1286	Unknown storage engine 'InnoDB'
DROP TABLE t2;
create table t2(a int, b int, c int) engine=InnoDB;
Warnings:
Warning	1286	Unknown storage engine 'InnoDB'
insert into t2 values();
# Test when selecting from base table
insert into t1 values(100,1,2),(200,1,1),(300,2,1),(400,2,2);
select distinct b from t1 order by c;
b
2
1
select distinct min(b) from t1 group by a order by min(c);
min(b)
1
2
Insert rows in different order:
delete from t1;
insert into t1 values(200,1,1),(100,1,2),(400,2,2),(300,2,1);
And get a different order. Query is executed like this:
- First, DISTINCT, using a tmp MEMORY table with a unique
index, thus if two rows have the same 'b' but a different 'c',
the second row is rejected, so the first value of 'c' wins
(=> randomness of 'c')
- Second, ORDER BY on the random 'c'.
select distinct b from t1 order by c;
Random order too (same reason):
select distinct min(b) from t1 group by a order by min(c);
This query gives random order:
select distinct b from t1 order by c;
and this one too:
select distinct b from t1 order by b-1,b+1,c;
and this one too:
select distinct min(b) from t1 group by a order by min(c);
Not random (though Standard bans aggregates from ORDER BY):
select distinct min(b) from t1 group by a order by min(b);
select distinct min(b) from t1 group by a order by -min(b);
All group exprs are in select list => DISTINCT is removed => no error
select distinct a, min(b) from t1 group by a order by max(b-2)-min(c*5);
This one is standard:
select distinct min(b) as z from t1 group by a order by z;
Other queries:
select distinct b from t1 where b<0 order by rand();
select distinct b from t1 order by 45.0+3;
select (select distinct b from t1 as S2 where b=7 order by S3.a) from t1 as S3;
select distinct b from t1 order by abs(b);
select distinct b as z from t1 order by abs(z);
select distinct b from t1 order by abs(b+a);
select distinct abs(b) as z from t1 order by z;
select distinct abs(b) as z from t1 order by abs(b);
select distinct abs(b) from t1 order by abs(b);
Not ok: ABS(b)+1 is neither a SELECTed expression nor an alias
to one, and mentions a column of FROM tables.
select distinct abs(b) as z from t1 order by abs(b)+1;
select distinct abs(b) as z from t1 order by z+1;
select distinct abs(b) from t1 order by abs(b)+1;
select distinct abs(b) as z from t1 order by floor(10*b);
select distinct abs(b) from t1 order by floor(10*b);
Two offending columns; error message needs to report only one
select distinct abs(b) from t1 order by floor(10*b),floor(10*a);
select distinct abs(b) from t1 as S2 order by
(select floor(10*S2.b) from t1 as S3 limit 1);
Ok as S2.b in SELECT list
select distinct abs(b),b from t1 as S2 order by
(select floor(10*S2.b) from t1 as S3 limit 1);
Ok as subq does not use columns of FROM clause of ordered Q.
select distinct abs(b) from t1 as S2 order by
(select floor(10*S3.b) from t1 as S3 limit 1);
Subq as alias => ok
select distinct abs(b),
(select floor(10*S3.b) from t1 as S3 limit 1) as subq
from t1 as S2 order by subq;
Bad field in left or right argument of ALL/ANY(subq):
select distinct abs(b) from t1 as S2 order by
floor(10*S2.b) IN (select floor(10*S3.b) from t1 as S3);
select distinct abs(b) from t1 as S2 order by
floor(10*S2.b) > ALL(select floor(10*S3.b) from t1 as S3);
select distinct abs(b) from t1 as S2 order by
floor(10*10) IN (select floor(10*S2.b) from t1 as S3);
select distinct abs(b) from t1 as S2 order by
floor(10*10) > ALL(select floor(10*S2.b) from t1 as S3);
Aggregates:
SELECT distinct 1 FROM t1 group by a order by count(*);
SELECT distinct 1 FROM t1 group by a order by count(*)-count(*);
Test ANY_VALUE
SELECT distinct 1 FROM t1 group by a order by any_value(count(*)-count(b));
SELECT distinct 1 FROM t1 group by a order by any_value(count(*))-any_value(count(b));
All group exprs are in select list => DISTINCT is removed => no error
SELECT distinct a, min(b) FROM t1 group by a order by count(*)-count(*);
SELECT distinct 1 FROM t1 group by a order by count(*)-count(b);
aggregation in outer Q => constant in inner Q
select * from t1 as t2 where t2.a in
(SELECT distinct 1 FROM t1 group by a order by count(t2.a)-max(t2.a));
ORDER BY expressions are in SELECT list => ok
SELECT distinct 1, count(*)-count(b) FROM t1 group by a order by count(*)-count(b);
Without GROUP BY, aggregates yield a single row, no random order
SELECT distinct sum(a) FROM t1 order by count(*)-count(*);
SELECT distinct sum(a) FROM t1 order by count(*)-count(b);
Verify that DISTINCT is optimized away even if the aggregate
function is hidden in a subquery
QA's query is properly rejected:
SELECT DISTINCT GP1.a AS g1 FROM t1 AS GP1
WHERE GP1.a >= 0
ORDER BY GP1.b LIMIT 8;
result order does change depending on chosen plan.
SELECT DISTINCT GP1.a AS g1 FROM t1 AS GP1
WHERE GP1.a >= 0
ORDER BY 2+ANY_VALUE(GP1.b) LIMIT 8;
DELETE FROM t1;
# Test when selecting from view
DROP VIEW v1;
create view v1 as select t1.* from t1 left join t2 on 1;
insert into t1 values(100,1,2),(200,1,1),(300,2,1),(400,2,2);
select distinct b from v1 order by c;
select distinct min(b) from v1 group by a order by min(c);
Insert rows in different order:
delete from t1;
insert into t1 values(200,1,1),(100,1,2),(400,2,2),(300,2,1);
And get a different order. Query is executed like this:
- First, DISTINCT, using a tmp MEMORY table with a unique
index, thus if two rows have the same 'b' but a different 'c',
the second row is rejected, so the first value of 'c' wins
(=> randomness of 'c')
- Second, ORDER BY on the random 'c'.
select distinct b from v1 order by c;
Random order too (same reason):
select distinct min(b) from v1 group by a order by min(c);
This query gives random order:
select distinct b from v1 order by c;
and this one too:
select distinct b from v1 order by b-1,b+1,c;
and this one too:
select distinct min(b) from v1 group by a order by min(c);
Not random (though Standard bans aggregates from ORDER BY):
select distinct min(b) from v1 group by a order by min(b);
select distinct min(b) from v1 group by a order by -min(b);
All group exprs are in select list => DISTINCT is removed => no error
select distinct a, min(b) from v1 group by a order by max(b-2)-min(c*5);
This one is standard:
select distinct min(b) as z from v1 group by a order by z;
Other queries:
select distinct b from v1 where b<0 order by rand();
select distinct b from v1 order by 45.0+3;
select (select distinct b from v1 as S2 where b=7 order by S3.a) from v1 as S3;
select distinct b from v1 order by abs(b);
select distinct b as z from v1 order by abs(z);
select distinct b from v1 order by abs(b+a);
select distinct abs(b) as z from v1 order by z;
select distinct abs(b) as z from v1 order by abs(b);
select distinct abs(b) from v1 order by abs(b);
Not ok: ABS(b)+1 is neither a SELECTed expression nor an alias
to one, and mentions a column of FROM tables.
select distinct abs(b) as z from v1 order by abs(b)+1;
select distinct abs(b) as z from v1 order by z+1;
select distinct abs(b) from v1 order by abs(b)+1;
select distinct abs(b) as z from v1 order by floor(10*b);
select distinct abs(b) from v1 order by floor(10*b);
Two offending columns; error message needs to report only one
select distinct abs(b) from v1 order by floor(10*b),floor(10*a);
select distinct abs(b) from v1 as S2 order by
(select floor(10*S2.b) from v1 as S3 limit 1);
Ok as S2.b in SELECT list
select distinct abs(b),b from v1 as S2 order by
(select floor(10*S2.b) from v1 as S3 limit 1);
Ok as subq does not use columns of FROM clause of ordered Q.
select distinct abs(b) from v1 as S2 order by
(select floor(10*S3.b) from v1 as S3 limit 1);
Subq as alias => ok
select distinct abs(b),
(select floor(10*S3.b) from v1 as S3 limit 1) as subq
from v1 as S2 order by subq;
Bad field in left or right argument of ALL/ANY(subq):
select distinct abs(b) from v1 as S2 order by
floor(10*S2.b) IN (select floor(10*S3.b) from v1 as S3);
select distinct abs(b) from v1 as S2 order by
floor(10*S2.b) > ALL(select floor(10*S3.b) from v1 as S3);
select distinct abs(b) from v1 as S2 order by
floor(10*10) IN (select floor(10*S2.b) from v1 as S3);
select distinct abs(b) from v1 as S2 order by
floor(10*10) > ALL(select floor(10*S2.b) from v1 as S3);
Aggregates:
SELECT distinct 1 FROM t1 group by a order by count(*);
SELECT distinct 1 FROM t1 group by a order by count(*)-count(*);
Test ANY_VALUE
SELECT distinct 1 FROM t1 group by a order by any_value(count(*)-count(b));
SELECT distinct 1 FROM t1 group by a order by any_value(count(*))-any_value(count(b));
All group exprs are in select list => DISTINCT is removed => no error
SELECT distinct a, min(b) FROM t1 group by a order by count(*)-count(*);
SELECT distinct 1 FROM t1 group by a order by count(*)-count(b);
aggregation in outer Q => constant in inner Q
select * from t1 as t2 where t2.a in
(SELECT distinct 1 FROM t1 group by a order by count(t2.a)-max(t2.a));
ORDER BY expressions are in SELECT list => ok
SELECT distinct 1, count(*)-count(b) FROM t1 group by a order by count(*)-count(b);
Without GROUP BY, aggregates yield a single row, no random order
SELECT distinct sum(a) FROM t1 order by count(*)-count(*);
SELECT distinct sum(a) FROM t1 order by count(*)-count(b);
Verify that DISTINCT is optimized away even if the aggregate
function is hidden in a subquery
QA's query is properly rejected:
SELECT DISTINCT GP1.a AS g1 FROM v1 AS GP1
WHERE GP1.a >= 0
ORDER BY GP1.b LIMIT 8;
result order does change depending on chosen plan.
SELECT DISTINCT GP1.a AS g1 FROM v1 AS GP1
WHERE GP1.a >= 0
ORDER BY 2+ANY_VALUE(GP1.b) LIMIT 8;
DELETE FROM t1;
drop view v1;
# Test when selecting from view, again
create view v1 as select t1.a*2 as a, t1.b*2 as b, t1.c*2 as c from t1;
insert into t1 values(100,1,2),(200,1,1),(300,2,1),(400,2,2);
select distinct b from v1 order by c;
select distinct min(b) from v1 group by a order by min(c);
Insert rows in different order:
delete from t1;
insert into t1 values(200,1,1),(100,1,2),(400,2,2),(300,2,1);
And get a different order. Query is executed like this:
- First, DISTINCT, using a tmp MEMORY table with a unique
index, thus if two rows have the same 'b' but a different 'c',
the second row is rejected, so the first value of 'c' wins
(=> randomness of 'c')
- Second, ORDER BY on the random 'c'.
select distinct b from v1 order by c;
Random order too (same reason):
select distinct min(b) from v1 group by a order by min(c);
This query gives random order:
select distinct b from v1 order by c;
and this one too:
select distinct b from v1 order by b-1,b+1,c;
and this one too:
select distinct min(b) from v1 group by a order by min(c);
Not random (though Standard bans aggregates from ORDER BY):
select distinct min(b) from v1 group by a order by min(b);
select distinct min(b) from v1 group by a order by -min(b);
All group exprs are in select list => DISTINCT is removed => no error
select distinct a, min(b) from v1 group by a order by max(b-2)-min(c*5);
This one is standard:
select distinct min(b) as z from v1 group by a order by z;
Other queries:
select distinct b from v1 where b<0 order by rand();
select distinct b from v1 order by 45.0+3;
select (select distinct b from v1 as S2 where b=7 order by S3.a) from v1 as S3;
select distinct b from v1 order by abs(b);
select distinct b as z from v1 order by abs(z);
select distinct b from v1 order by abs(b+a);
select distinct abs(b) as z from v1 order by z;
select distinct abs(b) as z from v1 order by abs(b);
select distinct abs(b) from v1 order by abs(b);
Not ok: ABS(b)+1 is neither a SELECTed expression nor an alias
to one, and mentions a column of FROM tables.
select distinct abs(b) as z from v1 order by abs(b)+1;
select distinct abs(b) as z from v1 order by z+1;
select distinct abs(b) from v1 order by abs(b)+1;
select distinct abs(b) as z from v1 order by floor(10*b);
select distinct abs(b) from v1 order by floor(10*b);
Two offending columns; error message needs to report only one
select distinct abs(b) from v1 order by floor(10*b),floor(10*a);
select distinct abs(b) from v1 as S2 order by
(select floor(10*S2.b) from v1 as S3 limit 1);
Ok as S2.b in SELECT list
select distinct abs(b),b from v1 as S2 order by
(select floor(10*S2.b) from v1 as S3 limit 1);
Ok as subq does not use columns of FROM clause of ordered Q.
select distinct abs(b) from v1 as S2 order by
(select floor(10*S3.b) from v1 as S3 limit 1);
Subq as alias => ok
select distinct abs(b),
(select floor(10*S3.b) from v1 as S3 limit 1) as subq
from v1 as S2 order by subq;
Bad field in left or right argument of ALL/ANY(subq):
select distinct abs(b) from v1 as S2 order by
floor(10*S2.b) IN (select floor(10*S3.b) from v1 as S3);
select distinct abs(b) from v1 as S2 order by
floor(10*S2.b) > ALL(select floor(10*S3.b) from v1 as S3);
select distinct abs(b) from v1 as S2 order by
floor(10*10) IN (select floor(10*S2.b) from v1 as S3);
select distinct abs(b) from v1 as S2 order by
floor(10*10) > ALL(select floor(10*S2.b) from v1 as S3);
Aggregates:
SELECT distinct 1 FROM t1 group by a order by count(*);
SELECT distinct 1 FROM t1 group by a order by count(*)-count(*);
Test ANY_VALUE
SELECT distinct 1 FROM t1 group by a order by any_value(count(*)-count(b));
SELECT distinct 1 FROM t1 group by a order by any_value(count(*))-any_value(count(b));
All group exprs are in select list => DISTINCT is removed => no error
SELECT distinct a, min(b) FROM t1 group by a order by count(*)-count(*);
SELECT distinct 1 FROM t1 group by a order by count(*)-count(b);
aggregation in outer Q => constant in inner Q
select * from t1 as t2 where t2.a in
(SELECT distinct 1 FROM t1 group by a order by count(t2.a)-max(t2.a));
ORDER BY expressions are in SELECT list => ok
SELECT distinct 1, count(*)-count(b) FROM t1 group by a order by count(*)-count(b);
Without GROUP BY, aggregates yield a single row, no random order
SELECT distinct sum(a) FROM t1 order by count(*)-count(*);
SELECT distinct sum(a) FROM t1 order by count(*)-count(b);
Verify that DISTINCT is optimized away even if the aggregate
function is hidden in a subquery
QA's query is properly rejected:
SELECT DISTINCT GP1.a AS g1 FROM v1 AS GP1
WHERE GP1.a >= 0
ORDER BY GP1.b LIMIT 8;
result order does change depending on chosen plan.
SELECT DISTINCT GP1.a AS g1 FROM v1 AS GP1
WHERE GP1.a >= 0
ORDER BY 2+ANY_VALUE(GP1.b) LIMIT 8;
DELETE FROM t1;
drop view v1;
# Test when selecting from derived table
insert into t1 values(100,1,2),(200,1,1),(300,2,1),(400,2,2);
select distinct b from (SELECT t1.* FROM t1 left join t2 on 1) AS derived order by c;
select distinct min(b) from (SELECT t1.* FROM t1 left join t2 on 1) AS derived group by a order by min(c);
Insert rows in different order:
delete from t1;
insert into t1 values(200,1,1),(100,1,2),(400,2,2),(300,2,1);
And get a different order. Query is executed like this:
- First, DISTINCT, using a tmp MEMORY table with a unique
index, thus if two rows have the same 'b' but a different 'c',
the second row is rejected, so the first value of 'c' wins
(=> randomness of 'c')
- Second, ORDER BY on the random 'c'.
select distinct b from (SELECT t1.* FROM t1 left join t2 on 1) AS derived order by c;
Random order too (same reason):
select distinct min(b) from (SELECT t1.* FROM t1 left join t2 on 1) AS derived group by a order by min(c);
This query gives random order:
select distinct b from (SELECT t1.* FROM t1 left join t2 on 1) AS derived order by c;
and this one too:
select distinct b from (SELECT t1.* FROM t1 left join t2 on 1) AS derived order by b-1,b+1,c;
and this one too:
select distinct min(b) from (SELECT t1.* FROM t1 left join t2 on 1) AS derived group by a order by min(c);
Not random (though Standard bans aggregates from ORDER BY):
select distinct min(b) from (SELECT t1.* FROM t1 left join t2 on 1) AS derived group by a order by min(b);
select distinct min(b) from (SELECT t1.* FROM t1 left join t2 on 1) AS derived group by a order by -min(b);
All group exprs are in select list => DISTINCT is removed => no error
select distinct a, min(b) from (SELECT t1.* FROM t1 left join t2 on 1) AS derived group by a order by max(b-2)-min(c*5);
This one is standard:
select distinct min(b) as z from (SELECT t1.* FROM t1 left join t2 on 1) AS derived group by a order by z;
Other queries:
select distinct b from (SELECT t1.* FROM t1 left join t2 on 1) AS derived where b<0 order by rand();
select distinct b from (SELECT t1.* FROM t1 left join t2 on 1) AS derived order by 45.0+3;
select (select distinct b from (SELECT t1.* FROM t1 left join t2 on 1) as S2 where b=7 order by S3.a) from (SELECT t1.* FROM t1 left join t2 on 1) as S3;
select distinct b from (SELECT t1.* FROM t1 left join t2 on 1) AS derived order by abs(b);
select distinct b as z from (SELECT t1.* FROM t1 left join t2 on 1) AS derived order by abs(z);
select distinct b from (SELECT t1.* FROM t1 left join t2 on 1) AS derived order by abs(b+a);
select distinct abs(b) as z from (SELECT t1.* FROM t1 left join t2 on 1) AS derived order by z;
select distinct abs(b) as z from (SELECT t1.* FROM t1 left join t2 on 1) AS derived order by abs(b);
select distinct abs(b) from (SELECT t1.* FROM t1 left join t2 on 1) AS derived order by abs(b);
Not ok: ABS(b)+1 is neither a SELECTed expression nor an alias
to one, and mentions a column of FROM tables.
select distinct abs(b) as z from (SELECT t1.* FROM t1 left join t2 on 1) AS derived order by abs(b)+1;
select distinct abs(b) as z from (SELECT t1.* FROM t1 left join t2 on 1) AS derived order by z+1;
select distinct abs(b) from (SELECT t1.* FROM t1 left join t2 on 1) AS derived order by abs(b)+1;
select distinct abs(b) as z from (SELECT t1.* FROM t1 left join t2 on 1) AS derived order by floor(10*b);
select distinct abs(b) from (SELECT t1.* FROM t1 left join t2 on 1) AS derived order by floor(10*b);
Two offending columns; error message needs to report only one
select distinct abs(b) from (SELECT t1.* FROM t1 left join t2 on 1) AS derived order by floor(10*b),floor(10*a);
select distinct abs(b) from (SELECT t1.* FROM t1 left join t2 on 1) as S2 order by
(select floor(10*S2.b) from (SELECT t1.* FROM t1 left join t2 on 1) as S3 limit 1);
Ok as S2.b in SELECT list
select distinct abs(b),b from (SELECT t1.* FROM t1 left join t2 on 1) as S2 order by
(select floor(10*S2.b) from (SELECT t1.* FROM t1 left join t2 on 1) as S3 limit 1);
Ok as subq does not use columns of FROM clause of ordered Q.
select distinct abs(b) from (SELECT t1.* FROM t1 left join t2 on 1) as S2 order by
(select floor(10*S3.b) from (SELECT t1.* FROM t1 left join t2 on 1) as S3 limit 1);
Subq as alias => ok
select distinct abs(b),
(select floor(10*S3.b) from (SELECT t1.* FROM t1 left join t2 on 1) as S3 limit 1) as subq
from (SELECT t1.* FROM t1 left join t2 on 1) as S2 order by subq;
Bad field in left or right argument of ALL/ANY(subq):
select distinct abs(b) from (SELECT t1.* FROM t1 left join t2 on 1) as S2 order by
floor(10*S2.b) IN (select floor(10*S3.b) from (SELECT t1.* FROM t1 left join t2 on 1) as S3);
select distinct abs(b) from (SELECT t1.* FROM t1 left join t2 on 1) as S2 order by
floor(10*S2.b) > ALL(select floor(10*S3.b) from (SELECT t1.* FROM t1 left join t2 on 1) as S3);
select distinct abs(b) from (SELECT t1.* FROM t1 left join t2 on 1) as S2 order by
floor(10*10) IN (select floor(10*S2.b) from (SELECT t1.* FROM t1 left join t2 on 1) as S3);
select distinct abs(b) from (SELECT t1.* FROM t1 left join t2 on 1) as S2 order by
floor(10*10) > ALL(select floor(10*S2.b) from (SELECT t1.* FROM t1 left join t2 on 1) as S3);
Aggregates:
SELECT distinct 1 FROM t1 group by a order by count(*);
SELECT distinct 1 FROM t1 group by a order by count(*)-count(*);
Test ANY_VALUE
SELECT distinct 1 FROM t1 group by a order by any_value(count(*)-count(b));
SELECT distinct 1 FROM t1 group by a order by any_value(count(*))-any_value(count(b));
All group exprs are in select list => DISTINCT is removed => no error
SELECT distinct a, min(b) FROM t1 group by a order by count(*)-count(*);
SELECT distinct 1 FROM t1 group by a order by count(*)-count(b);
aggregation in outer Q => constant in inner Q
select * from t1 as t2 where t2.a in
(SELECT distinct 1 FROM t1 group by a order by count(t2.a)-max(t2.a));
ORDER BY expressions are in SELECT list => ok
SELECT distinct 1, count(*)-count(b) FROM t1 group by a order by count(*)-count(b);
Without GROUP BY, aggregates yield a single row, no random order
SELECT distinct sum(a) FROM t1 order by count(*)-count(*);
SELECT distinct sum(a) FROM t1 order by count(*)-count(b);
Verify that DISTINCT is optimized away even if the aggregate
function is hidden in a subquery
QA's query is properly rejected:
SELECT DISTINCT GP1.a AS g1 FROM (SELECT t1.* FROM t1 left join t2 on 1) AS GP1
WHERE GP1.a >= 0
ORDER BY GP1.b LIMIT 8;
result order does change depending on chosen plan.
SELECT DISTINCT GP1.a AS g1 FROM (SELECT t1.* FROM t1 left join t2 on 1) AS GP1
WHERE GP1.a >= 0
ORDER BY 2+ANY_VALUE(GP1.b) LIMIT 8;
DELETE FROM t1;
select distinct t1_outer.a from t1 t1_outer
order by t1_outer.b;
select distinct t1_outer.a from t1 t1_outer
order by (select max(t1_outer.b+t1_inner.b) from t1 t1_inner);
select
(select distinct 1 from t1 t1_inner
group by t1_inner.a order by max(t1_outer.b))
from t1 t1_outer;
drop table t1, t2;
