DROP TABLE t1;
CREATE TABLE t1 (int_col INTEGER, string_col VARCHAR(255));
INSERT INTO t1 (int_col, string_col) VALUES (-1, "foo"), (1, "bar");
CREATE INDEX int_func_index ON t1 ((ABS(int_col)));
CREATE INDEX string_func_index ON t1 ((SUBSTRING(string_col, 1, 2)));
# We should see the functional index syntax in SHOW CREATE TABLE
SHOW CREATE TABLE t1;
Table	Create Table
t1	CREATE TABLE `t1` (
  `int_col` int(11) DEFAULT NULL,
  `string_col` varchar(255) DEFAULT NULL,
  KEY `int_func_index` ((ABS(`int_col`))) BLOCK_SIZE 16384 LOCAL,
  KEY `string_func_index` ((substr(`string_col`,1,2))) BLOCK_SIZE 16384 LOCAL
) ORGANIZATION INDEX DEFAULT CHARSET = utf8mb4 ROW_FORMAT = DYNAMIC COMPRESSION = 'zstd_1.3.8' REPLICA_NUM = 1 BLOCK_SIZE = 16384 USE_BLOOM_FILTER = FALSE ENABLE_MACRO_BLOCK_BLOOM_FILTER = FALSE TABLET_SIZE = 134217728 PCTFREE = 0
# INFORMATION_SCHEMA.STATISTICS should show the expression and no column
# name
SELECT * FROM INFORMATION_SCHEMA.STATISTICS
WHERE INDEX_NAME IN ('int_func_index', 'string_func_index');
TABLE_CATALOG	TABLE_SCHEMA	TABLE_NAME	NON_UNIQUE	INDEX_SCHEMA	INDEX_NAME	SEQ_IN_INDEX	COLUMN_NAME	COLLATION	CARDINALITY	SUB_PART	PACKED	NULLABLE	INDEX_TYPE	COMMENT	INDEX_COMMENT	IS_VISIBLE	EXPRESSION
def	test	t1	1	test	int_func_index	1	SYS_NC18$	A	NULL	NULL	NULL	YES	BTREE	VALID		YES	ABS(`int_col`)
def	test	t1	1	test	string_func_index	1	SYS_NC19$	A	NULL	NULL	NULL	YES	BTREE	VALID		YES	substr(`string_col`,1,2)
# INFORMATION_SCHEMA.COLUMNS should not show the hidden generated
# columns.
SELECT COUNT(*) AS should_be_2 FROM INFORMATION_SCHEMA.COLUMNS
WHERE TABLE_NAME = "t1" and TABLE_SCHEMA = database();
should_be_2
2
# INFORMATION_SCHEMA.INNODB_COLUMNS should not show the hidden generated
# columns.
# The optimizer should be able to make use of the functional index.
# Also, the query printed as a warning from EXPLAIN should display the
# expression and not the name of the hidden generated column.
EXPLAIN SELECT * FROM t1 WHERE SUBSTRING(string_col, 1, 2) = "fo";
EXPLAIN SELECT * FROM t1 WHERE ABS(int_col) = 1;
# Creating multiple nameless functional indexes should automatically
# generate new names that doesn't collide.
DROP TABLE t2;
CREATE TABLE t2 (
col1 INT,
INDEX ((col1 * 2)),
INDEX ((col1 * 4)),
INDEX ((col1 * 6)));
SHOW CREATE TABLE t2;
Table	Create Table
t2	CREATE TABLE `t2` (
  `col1` int(11) DEFAULT NULL,
  KEY `functional_index` ((`col1` * 2)) BLOCK_SIZE 16384 LOCAL,
  KEY `functional_index_2` ((`col1` * 4)) BLOCK_SIZE 16384 LOCAL,
  KEY `functional_index_3` ((`col1` * 6)) BLOCK_SIZE 16384 LOCAL
) ORGANIZATION INDEX DEFAULT CHARSET = utf8mb4 ROW_FORMAT = DYNAMIC COMPRESSION = 'zstd_1.3.8' REPLICA_NUM = 1 BLOCK_SIZE = 16384 USE_BLOOM_FILTER = FALSE ENABLE_MACRO_BLOCK_BLOOM_FILTER = FALSE TABLET_SIZE = 134217728 PCTFREE = 0
DROP TABLE t2;
# Adding a multi-column index with both a functional part and a
# non-functional part should work just fine.
CREATE INDEX combined_index ON t1 ((int_col + int_col), string_col);
SHOW CREATE TABLE t1;
Table	Create Table
t1	CREATE TABLE `t1` (
  `int_col` int(11) DEFAULT NULL,
  `string_col` varchar(255) DEFAULT NULL,
  KEY `int_func_index` ((ABS(`int_col`))) BLOCK_SIZE 16384 LOCAL,
  KEY `string_func_index` ((substr(`string_col`,1,2))) BLOCK_SIZE 16384 LOCAL,
  KEY `combined_index` ((`int_col` + `int_col`), `string_col`) BLOCK_SIZE 16384 LOCAL
) ORGANIZATION INDEX DEFAULT CHARSET = utf8mb4 ROW_FORMAT = DYNAMIC COMPRESSION = 'zstd_1.3.8' REPLICA_NUM = 1 BLOCK_SIZE = 16384 USE_BLOOM_FILTER = FALSE ENABLE_MACRO_BLOCK_BLOOM_FILTER = FALSE TABLET_SIZE = 134217728 PCTFREE = 0
SELECT * FROM t1 order by 1;
int_col	string_col
-1	foo
1	bar
# ...and, the optimizer should be able to use this multi-column index
EXPLAIN SELECT * FROM t1 WHERE int_col + int_col = 2 AND string_col = "bar";
# Test that if we have a string column with the same name as a function,
# we will pick the function. To pick the column, skip the enclosing
# parentheses around the expression.
ALTER TABLE t1 ADD COLUMN rand VARCHAR(255);
CREATE INDEX name_collision ON t1 ((rand(2)));
ERROR HY000: Expression of functional index contains a disallowed function.
CREATE INDEX name_collision ON t1 ((`rand`(2)));
ERROR HY000: Expression of functional index contains a disallowed function.
DROP TABLE t1;
# Check that in case of errors when saving data to the generated column,
# the functional index name is printed and not the auto generated name
# of the generated column.
CREATE TABLE t1 (f1 JSON, f2 VARCHAR(255));
CREATE INDEX my_functional_index ON t1 ((CAST(f1 AS DECIMAL(2, 1))));
CREATE INDEX my_functional_index_2 ON t1 ((CAST(f2 AS CHAR(1))));
CREATE INDEX idx1 ON t1 ((CAST(f2 AS JSON)));
ERROR 42000: Cannot create a functional index on a function that returns a JSON or GEOMETRY value.
INSERT INTO t1 (f1) VALUES (CAST(1000 AS JSON));
ERROR 22003: Out of range value for column 'SYS_NC18$' at row 1
INSERT INTO t1 (f2) VALUES ("lorem ipsum");
ERROR 22007: Incorrect value
# In non-strict mode, a warning should be printed.
SET @@sql_mode='';
INSERT INTO t1 (f1) VALUES (CAST(1000 AS JSON));
ERROR 22003: Out of range value for column 'SYS_NC18$' at row 1
INSERT INTO t1 (f2) VALUES ("lorem ipsum");
ERROR 22007: Incorrect value
DROP TABLE t1;
SET @@sql_mode=DEFAULT;
CREATE TABLE t1 (t1_id INT NOT NULL AUTO_INCREMENT PRIMARY KEY);
CREATE INDEX idx1 ON t1 ((t1_id + t1_id));
ERROR HY000: Functional index 'idx1' cannot refer to an auto-increment column.
DROP TABLE t1;
# Check that "SHOW KEYS" prints out the expression for generated columns
# (Column_name should be NULL, and Expression should contain the
# expression).
CREATE TABLE t1 (col1 INT, col2 INT);
CREATE INDEX idx1 ON t1 (col1, (col1 + col2));
SHOW KEYS FROM t1;
Table	Non_unique	Key_name	Seq_in_index	Column_name	Collation	Cardinality	Sub_part	Packed	Null	Index_type	Comment	Index_comment	Visible	Expression
t1	1	idx1	1	col1	A	NULL	NULL	NULL	YES	BTREE	available		YES	NULL
t1	1	idx1	2	SYS_NC18$	A	NULL	NULL	NULL	YES	BTREE	available		YES	(`col1` + `col2`)
# Create a functional index with many functional key parts. Bug#27168185.
CREATE INDEX idx2
ON t1 ((col1 + 1), (col1 + 2), (col1 + 3), (col1 + 4), (col1 + 5));
# Check that if we try to add a column with the same name as a hidden
# column, we get an internal error. The column name of the generated
# column is `!hidden!index_name!key_part!counter`.
ALTER TABLE t1 ADD COLUMN `!hidden!idx1!1!0` INT NOT NULL;
ALTER TABLE t1 ADD COLUMN `!hidden!idx3!0!0` INT NOT NULL;
CREATE INDEX idx3 ON t1 ((col1-col2));
ALTER TABLE t1 ADD COLUMN `!hidden!idx3!0!1` INT NOT NULL;
DROP TABLE t1;
# Creating a functional index on already existing columns using
# ALTER TABLE should work just fine.
CREATE TABLE t1 (col1 INT, col2 INT);
ALTER TABLE t1 ADD INDEX ((ABS(col1))), ADD INDEX ((ABS(col2)));
SHOW CREATE TABLE t1;
Table	Create Table
t1	CREATE TABLE `t1` (
  `col1` int(11) DEFAULT NULL,
  `col2` int(11) DEFAULT NULL,
  KEY `functional_index` ((ABS(`col1`))) BLOCK_SIZE 16384 LOCAL,
  KEY `functional_index_2` ((ABS(`col2`))) BLOCK_SIZE 16384 LOCAL
) ORGANIZATION INDEX DEFAULT CHARSET = utf8mb4 ROW_FORMAT = DYNAMIC COMPRESSION = 'zstd_1.3.8' REPLICA_NUM = 1 BLOCK_SIZE = 16384 USE_BLOOM_FILTER = FALSE ENABLE_MACRO_BLOCK_BLOOM_FILTER = FALSE TABLET_SIZE = 134217728 PCTFREE = 0
# Adding a functional index to a column that is created in the same
# ALTER TABLE statement should work.
ALTER TABLE t1 ADD COLUMN col3 INT, ADD INDEX ((col1 - col3));
DROP TABLE t1;
# Adding a functional index using CREATE TABLE should work
CREATE TABLE t1 (col1 INT, INDEX ((ABS(col1))));
DROP TABLE t1;
# Print out functional indexes on a temporary table. Note that
# "Column_name" should be empty (NULL), and Expression should contain the
# expression for the functional index.
CREATE TABLE t1 (col1 INT, INDEX ((CONCAT(''))));
ERROR 42000: Specified key was too long; max key length is 16384 bytes
# Check that a functional index cannot be a part of the primary key
CREATE TABLE t1 (col1 INT, PRIMARY KEY ((ABS(col1))));
ERROR 42000: You have an error in your SQL syntax; check the manual that corresponds to your OceanBase version for the right syntax to use near '(ABS(col1))))' at line 1
CREATE TABLE t1 (col1 INT, PRIMARY KEY (col1, (ABS(col1))));
ERROR 42000: You have an error in your SQL syntax; check the manual that corresponds to your OceanBase version for the right syntax to use near '(ABS(col1))))' at line 1
CREATE TABLE t1 (col1 INT, col2 INT, PRIMARY KEY (col1, (ABS(col1)), col2));
ERROR 42000: You have an error in your SQL syntax; check the manual that corresponds to your OceanBase version for the right syntax to use near '(ABS(col1)), col2))' at line 1
CREATE TABLE t1 (col1 INT, col2 INT);
ALTER TABLE t1 ADD PRIMARY KEY ((ABS(col1)));
ERROR 42000: You have an error in your SQL syntax; check the manual that corresponds to your OceanBase version for the right syntax to use near '(ABS(col1)))' at line 1
ALTER TABLE t1 ADD PRIMARY KEY (col2, (ABS(col1)));
ERROR 42000: You have an error in your SQL syntax; check the manual that corresponds to your OceanBase version for the right syntax to use near '(ABS(col1)))' at line 1
ALTER TABLE t1 ADD PRIMARY KEY (col1, col2, (ABS(col1)));
ERROR 42000: You have an error in your SQL syntax; check the manual that corresponds to your OceanBase version for the right syntax to use near '(ABS(col1)))' at line 1
DROP TABLE t1;
# Check that descending functional index works
# Test integer index over a JSON key
CREATE TABLE t1(f1 JSON, INDEX idx1 ((CAST(f1->"$.id" AS UNSIGNED))));
INSERT INTO t1 VALUES(CAST('{"id":1}' AS JSON)), (CAST('{"id":2}' AS JSON)),
(CAST('{"id":3}' AS JSON)), (CAST('{"id":4}' AS JSON)),
(CAST('{"id":5}' AS JSON)), (CAST('{"id":6}' AS JSON)),
(CAST('{"id":7}' AS JSON)), (CAST('{"id":8}' AS JSON)),
(CAST('{"id":9}' AS JSON)), (CAST('{"id":10}' AS JSON));
SELECT * FROM t1 order by 1;
f1
{"id": 1}
{"id": 2}
{"id": 3}
{"id": 4}
{"id": 5}
{"id": 6}
{"id": 7}
{"id": 8}
{"id": 9}
{"id": 10}
SELECT * FROM t1 WHERE f1->"$.id"= 5;
f1
{"id": 5}
EXPLAIN SELECT * FROM t1 WHERE f1->"$.id"= 5;
SELECT * FROM t1 WHERE f1->"$.id" IN (1,2,3);
f1
{"id": 1}
{"id": 2}
{"id": 3}
EXPLAIN SELECT * FROM t1 WHERE f1->"$.id" IN (1,2,3);
DROP TABLE t1;
Test string index over a JSON key
CREATE TABLE t1(f1 JSON, INDEX idx1 ((CAST(f1->>"$.id" AS CHAR(10)))));
INSERT INTO t1 VALUES
(CAST('{"id":"a"}' AS JSON)), (CAST('{"id":"b"}' AS JSON)),
(CAST('{"id":"v"}' AS JSON)), (CAST('{"id":"c"}' AS JSON)),
(CAST('{"id":"x"}' AS JSON)), (CAST('{"id":"\'z"}' AS JSON)),
  (JSON_OBJECT("id",JSON_QUOTE("n"))), (CAST('{"id":"w"}' AS JSON)),
  (CAST('{"id":"m"}' AS JSON)), (CAST('{"id":"q"}' AS JSON));
SELECT * FROM t1 order by 1;
f1
{"id": "\"n\""}
{"id": "'z"}
{"id": "a"}
{"id": "b"}
{"id": "c"}
{"id": "m"}
{"id": "q"}
{"id": "v"}
{"id": "w"}
{"id": "x"}
SELECT * FROM t1 WHERE CAST(f1->>"$.id" AS CHAR(10)) = "\"n\"";
f1
{"id": "\"n\""}
EXPLAIN SELECT * FROM t1 WHERE CAST(f1->>"$.id" AS CHAR(10)) = "\"n\"";
SELECT * FROM t1 WHERE CAST(f1->>"$.id" AS CHAR(10)) IN ("'z", "\"n\"","a");
f1
{"id": "'z"}
{"id": "\"n\""}
{"id": "a"}
EXPLAIN SELECT * FROM t1 WHERE CAST(f1->>"$.id" AS CHAR(10)) IN ("'z", "\"n\"","a");
DROP TABLE t1;
CREATE TABLE t1(f1 JSON, INDEX idx1 ((CAST(f1->>"$.name" AS CHAR(30)) COLLATE utf8mb4_bin)));
INSERT INTO t1 VALUES
('{"name": "james"}'),
('{"name": "JAMES"}'),
('{"name": "Peter"}'),
('{"name": "parker"}');
SELECT * FROM t1 order by 1;
f1
{"name": "JAMES"}
{"name": "Peter"}
{"name": "james"}
{"name": "parker"}
# Should not return any rows, and should use the index
SELECT * FROM t1 WHERE f1->>"$.name" = "James";
f1
EXPLAIN SELECT * FROM t1 WHERE f1->>"$.name" = "James";
# Should return one row, and should use the index
SELECT * FROM t1 WHERE f1->>"$.name" = "james";
f1
{"name": "james"}
EXPLAIN SELECT * FROM t1 WHERE f1->>"$.name" = "james";
# Should return one row, and should use the index
SELECT * FROM t1 WHERE CAST(f1->>"$.name" AS CHAR(30)) COLLATE utf8mb4_bin = "james";
f1
{"name": "james"}
EXPLAIN SELECT * FROM t1 WHERE CAST(f1->>"$.name" AS CHAR(30)) COLLATE utf8mb4_bin = "james";
DROP TABLE t1;
# Test that doing an UPDATE on a hidden generated column returns "column
# not found".
CREATE TABLE t1 (col1 INT, INDEX idx1 ((col1 + col1)));
# Update the hidden generated column.
UPDATE t1 SET `!hidden!idx1!0!0` = 123;
ERROR 42S22: Unknown column '!hidden!idx1!0!0' in 'field list'
DROP TABLE t1;
#
# Bug#28037245 VIRTUAL COLUMN IS ALLOWED IN THE WHERE CLAUSE FOR SQL
#              QUERY
#
DROP TABLE t3;
CREATE TABLE t3 (c1 INT);
CREATE INDEX int_func_index ON t3 ((ABS(c1)));
SELECT * FROM t3 WHERE `!hidden!int_func_index!0!0`=1;
ERROR 42S22: Unknown column '!hidden!int_func_index!0!0' in 'where clause'
DROP TABLE t3;
#
# Bug#28037375 ALTER TABLE DROP OF A NORMAL COLUMN RAISES ERROR
#
DROP TABLE t6;
CREATE TABLE t6 (c1 INT, c2 INT);
CREATE INDEX int_func_index ON t6 ((ABS(c1)));
ALTER TABLE t6 DROP COLUMN c2;
DROP TABLE t6;
# Check that a functional index on a function that returns geometry data
# isn't allowed.
CREATE TABLE t1(x VARCHAR(100), KEY ((ST_GeomFromText(x))));
ERROR HY000: Spatial functional index is not supported.
# See that we don't print out the names of the hidden generated columns,
# but rather the expression that they represent.
CREATE TABLE t1(x VARCHAR(30), INDEX idx ((CAST(x->>'$.name' AS CHAR(30)))));
INSERT INTO t1 VALUES ('{"name":"knut"}');
SELECT * FROM t1 order by 1;
x
{"name":"knut"}
EXPLAIN FORMAT=JSON SELECT * FROM t1 WHERE CAST(x->>'$.name' AS CHAR(30)) = 'knut';
DROP TABLE t1;
# Check that we cannot drop the last visible column when we have hidden
# generated columns.
DROP TABLE t;
CREATE TABLE t(x INT, KEY((1+1)));
ALTER TABLE t DROP COLUMN x;
ERROR HY000: table must have at least one column that is not invisible
DROP TABLE t;
# See that we print out the correct error message in case of duplicate
# index names.
CREATE TABLE t (x INT);
CREATE INDEX idx ON t ((x+1));
CREATE INDEX idx ON t ((x+2));
ERROR 42000: Duplicate key name 'idx'
DROP TABLE t;
#
# Bug#28206859 SERVER CRASHED WHEN NORMAL INDEX WAS CREATED USING NEW
#              FUNCTIONAL INDEX SYNTAX
#
DROP TABLE t2;
CREATE TABLE t2(a INT, b INT, INDEX id2 ((a)));
ERROR HY000: Functional index on a column is not supported. Consider using a regular index instead.
#
# Bug#28206912 ASSERTION `TABLE_LIST->TABLE' FAILED.
#
CREATE TABLE t2(a INT, b INT, INDEX id2 ((a+b+c)));
ERROR 42000: Key column 'c' doesn't exist in table
#
# Bug#28216475 SIG 11 IN ITEM_FIELD::REPLACE_FIELD_PROCESSOR DURING
#              CREATE TABLE
#
CREATE TABLE IF NOT EXISTS table470 ( pk INTEGER AUTO_INCREMENT, a1
VARCHAR(3) NOT NULL, b1 DATETIME NOT NULL, c1 TEXT NOT NULL, d1 TEXT NULL,
PRIMARY KEY (a1), KEY ((VALUES(d1))));
ERROR HY000: Expression of functional index contains a disallowed function.
CREATE TABLE  table44 ( pk INTEGER AUTO_INCREMENT, a1 TEXT NOT NULL, b1
DATETIME NOT NULL, c1 TIME NOT NULL, d1 BLOB NOT NULL, PRIMARY KEY (a1), KEY
((VALUES(d1))));
ERROR 42000: The used storage engine can't index column 'a1'
#
# Bug #28222789 SIG 11 IN BITMAP<64U>::INTERSECT DURING CREATE INDEX
#
#
# Bug#28218591 WRONG ERROR MESSAGE WHILE CREATING FUNCTIONAL INDEX
#
DROP TABLE t;
CREATE TABLE t(a INT, b INT, INDEX c((null)));
ERROR 42000: The used storage engine can't index column 'SYS_NC18$'
# Blank functional index name should give a "Incorrect index name" error
CREATE TABLE t1(x INT, KEY `` ((x + 1)));
ERROR 42000: Incorrect index name ''
# Check that we don't use the functional index in case of a collation
# mismatch
CREATE TABLE t(x VARCHAR(10), KEY k ((CAST(CONCAT(x,x) AS BINARY))));
INSERT INTO t VALUES ('x');
SELECT * FROM t order by 1;
x
x
EXPLAIN SELECT * FROM t WHERE CONCAT(x,x) = 'XX';
DROP TABLE t;
#
# Bug#28244585 ERROR WHILE CREATING TABLE WITH FUNCTIONAL INDEXES INSIDE
#              PROCEDURES.
DROP PROCEDURE p1;//
CREATE PROCEDURE p1() BEGIN
CREATE TABLE t(a INT,b INT,UNIQUE INDEX i((a+b)));
END//
CALL p1();
CALL p1();
ERROR 42S01: Table 't' already exists
DROP TABLE t;
CALL p1();
DROP TABLE t;
DROP PROCEDURE p1;
# Code coverage tests
CREATE TABLE t1 (
col4 TEXT NOT NULL
, INDEX ((ST_AsBinary(col4)))
);
ERROR HY000: Cannot create a functional index on an expression that returns a BLOB or TEXT. Please consider using CAST.
# See that we get a reasonable error message when trying to remove a
# column that is a part of a functional index.
DROP TABLE t1;
CREATE TABLE t1 (col1 INT, col2 INT, col3 INT, INDEX idx ((col1 + col2 + col3)));
ALTER TABLE t1 DROP COLUMN col2;
ERROR HY000: Column 'col2' has a functional index dependency and cannot be dropped or renamed.
ALTER TABLE t1 DROP COLUMN col3;
ERROR HY000: Column 'col3' has a functional index dependency and cannot be dropped or renamed.
ALTER TABLE t1 DROP INDEX idx;
ALTER TABLE t1 DROP COLUMN col3;
DROP TABLE t1;
# Check that INFORMATION_SCHEMA.KEY_COLUMN_USAGE doesn't reveal any
# functional indexes, since this view provides information about columns
# and a functional index does not represent a column per se.
CREATE TABLE t (
col1 INT
, UNIQUE INDEX regular_index (col1)
, UNIQUE INDEX functional_index ((ABS(col1))));
SELECT CONSTRAINT_NAME FROM INFORMATION_SCHEMA.KEY_COLUMN_USAGE WHERE table_name = "t";
CONSTRAINT_NAME
functional_index
regular_index
DROP TABLE t;
#
# Bug#28526493 ASSERTION WHEN CREATING A FUNCTIONAL INDEX ON A SUBQUERY
#
DROP TABLE t1;
CREATE TABLE t1 (x INT);
CREATE TABLE t2 (y INT, KEY (((SELECT * FROM t1))));
ERROR 0A000: use subquery in generated column not supported
CREATE TABLE t2 (y INT, KEY (((SELECT x FROM t1))));
ERROR 0A000: use subquery in generated column not supported
CREATE TABLE t2 (y INT, KEY (((SELECT 1 FROM t1))));
ERROR 0A000: use subquery in generated column not supported
DROP TABLE t1;
#
# Bug#28643252	ASSERT FAILURE WHEN FUNCTIONAL INDEX EXPRESSION IS A LIST
#
CREATE TABLE t (j JSON, KEY k (((j,j))));
ERROR 42000: The used storage engine can't index column 'SYS_NC17$'
#
# Bug#29360763	WL#1075: FUNCTIONAL INDEX: INCORRECT ERROR MESSAGE REVEALS
#              HIDDEN COLUMN NAME
#
DROP TABLE t1;
CREATE TABLE t1 (
j1 JSON,
j3 JSON,
KEY my_idx ((CAST(j1->'$[0]' as SIGNED))),
KEY my_idx_char ((CAST(j3->'$[0]' as CHAR(10))))
);
ALTER TABLE t1 RENAME KEY my_idx_char TO my_idx;
ERROR 42000: Duplicate key name 'my_idx'
DROP TABLE t1;
#
# Bug#29317684 REPLICATION IS SENSITIVE TO ORDER OF HIDDEN COLUMNS FOR
#              FUNCTIONAL INDEXES
#
CREATE TABLE t1 (col1 INT, INDEX ((col1 + col1)));
SELECT COLUMN_NAME, ORDINAL_POSITION FROM INFORMATION_SCHEMA.COLUMNS
WHERE TABLE_NAME = "t1" and table_schema =database();
COLUMN_NAME	ORDINAL_POSITION
col1	1
ALTER TABLE t1 ADD COLUMN col2 INT;
SELECT COLUMN_NAME, ORDINAL_POSITION FROM INFORMATION_SCHEMA.COLUMNS
WHERE TABLE_NAME = "t1" and table_schema =database();
COLUMN_NAME	ORDINAL_POSITION
col1	1
col2	2
DROP TABLE t1;
# See that INSTANT ADD COLUMN still works with this bugfix.
CREATE TABLE t1 (col1 INT, col2 INT AS (col1 + col1), INDEX (col2));
ALTER TABLE t1 ADD COLUMN new_col INT AFTER col1, ALGORITHM=INSTANT;
ERROR 42000: You have an error in your SQL syntax; check the manual that corresponds to your OceanBase version for the right syntax to use near 'ALGORITHM=INSTANT' at line 1
DROP TABLE t1;
#
# Bug#29934661 FUNCTIONAL INDEX SEEMS TO MALFUNCTION WITH UNSIGNED COLUMN
#
# The hidden column that is added should have a data type that can store
# the absolute value of an unsigned data type.
CREATE TABLE t0(c0 INT UNSIGNED, INDEX idx ((ABS(c0))));
INSERT INTO t0 (c0) VALUES (4294967294);
DROP TABLE t0;
#
# Bug#29723353: ADDING FUNCTIONAL INDEX ON JSON EXPRESSION CHANGES RESULT
#
DROP TABLE t;
CREATE TABLE t(j JSON);
INSERT INTO t VALUES ('{"x":"abc"}'), ('{"x":"ABC"}');
SELECT j FROM t WHERE j->>'$.x' = 'abc';
j
{"x": "abc"}
SELECT j FROM t WHERE j->'$.x' = 'abc';
j
{"x": "abc"}
CREATE INDEX idx ON t((CAST(j->>'$.x' AS CHAR(100))));
SELECT j FROM t WHERE j->>'$.x' = 'abc';
j
{"x": "abc"}
SELECT j FROM t WHERE j->'$.x' = 'abc';
j
{"x": "abc"}
ALTER TABLE t DROP INDEX idx;
CREATE INDEX idx ON t((CAST(j->'$.x' AS CHAR(100))));
SELECT j FROM t WHERE j->>'$.x' = 'abc';
j
{"x": "abc"}
SELECT j FROM t WHERE j->'$.x' = 'abc';
j
{"x": "abc"}
DROP TABLE t;
##
## Bug #31017765 CREATE TABLE ... SELECT FAILS IF THERE IS A FUNCTIONAL INDEX
##
##
CREATE TEMPORARY TABLE issue_functional_key_part (
sold_on DATETIME NOT NULL DEFAULT NOW(),
INDEX sold_on_date ((DATE(sold_on)))
)
SELECT NOW() `sold_on`;
ERROR 0A000: MySQL compatible temporary table not supported
#
# Bug#30838749: PERFORMANCE DROP WHEN CREATING A FUNCTIONAL INDEX
#
CREATE TABLE t1(x INT, KEY k ((x+1)));
SELECT * FROM t1 order by 1;
x
EXPLAIN FORMAT=JSON SELECT * FROM t1;
CREATE TABLE t2(j JSON);
#
# Bug#32287186: FAILED TO CREATE FUNCTION INDEX,
# COLUMN NAME IS UPPERCASE CHARACTER
#
# Verify that normal index creation is case-insensitive on
# column name
DROP TABLE t1;
CREATE TABLE t1 (id INT, name VARCHAR(50), INDEX (NAME));
DROP TABLE t2;
CREATE TABLE t2 (id INT, name VARCHAR(50), INDEX (name));
DROP TABLE t3;
CREATE TABLE t3 (id INT, NAME VARCHAR(50), INDEX (name));
DROP TABLE t4;
CREATE TABLE t4 (id INT, NAME VARCHAR(50), INDEX (NAME));
# Now verify that functional index creation is case-insensitive
# on column name as well
DROP TABLE t5;
CREATE TABLE t5 (id INT, name VARCHAR(50),
INDEX ((SUBSTR(name, 1, 2))));
DROP TABLE t6;
CREATE TABLE t6 (id INT, name VARCHAR(50),
INDEX ((SUBSTR(NAME, 1, 2))));
DROP TABLE t7;
CREATE TABLE t7 (id INT, NAME VARCHAR(50),
INDEX ((SUBSTR(name, 1, 2))));
DROP TABLE t8;
CREATE TABLE t8 (id INT, NAME VARCHAR(50),
INDEX ((SUBSTR(NAME, 1, 2))));
# Cleanup
DROP TABLE t1;
DROP TABLE t2;
DROP TABLE t3;
DROP TABLE t4;
DROP TABLE t5;
DROP TABLE t6;
DROP TABLE t7;
DROP TABLE t8;
#
# Bug#33851055: Correlated subquery does not use functional index
#
DROP TABLE t;
CREATE TABLE t (
id INT DEFAULT NULL,
KEY functional_index ((id * id))
);
CREATE TABLE t2 (
id INT NOT NULL AUTO_INCREMENT,
val INT,
PRIMARY KEY (id)
);
INSERT INTO t(id) VALUES (1), (1), (2), (-1), (-2);
INSERT INTO t2(val) VALUES (1), (2), (3), (4);
SELECT * FROM t order by 1;
id
-2
-1
1
1
2
SELECT * FROM t2 order by 1;
id	val
1	1
2	2
3	3
4	4
EXPLAIN SELECT id, val, (SELECT id FROM t WHERE (id * id) = val LIMIT 1) AS tid FROM t2;
SELECT id, val, (SELECT id FROM t WHERE (id * id) = val LIMIT 1) AS tid FROM t2;
id	val	tid
1	1	-1
4	4	-2
2	2	NULL
3	3	NULL
EXPLAIN SELECT id, val, (SELECT id FROM t WHERE (id * id) BETWEEN val and val + 2 LIMIT 1) AS tid FROM t2;
SELECT id, val, (SELECT id FROM t WHERE (id * id) BETWEEN val and val + 2 LIMIT 1) AS tid FROM t2;
id	val	tid
1	1	1
2	2	2
3	3	2
4	4	2
EXPLAIN SELECT id, val, (SELECT id FROM t WHERE (id * id) IN (val) LIMIT 1) AS tid FROM t2;
SELECT id, val, (SELECT id FROM t WHERE (id * id) IN (val) LIMIT 1) AS tid FROM t2;
id	val	tid
1	1	-1
4	4	-2
2	2	NULL
3	3	NULL
EXPLAIN SELECT id, val, (SELECT id FROM t WHERE (id * id) = val + (SELECT 1 FROM t WHERE id > 1) LIMIT 1) AS tid FROM t2;
SELECT id, val, (SELECT id FROM t WHERE (id * id) = val + (SELECT 1 FROM t WHERE id > 1) LIMIT 1) AS tid FROM t2;
id	val	tid
1	1	NULL
2	2	NULL
3	3	2
4	4	NULL
DROP TABLE t, t2;
