#
# Bug#30311271 RAND() < RAND() RESULTS IN IMPOSSIBLE WHERE
#
# See that the optimizer does not consider two instances of RAND() as
# equal.
#
# Bug#33535379 Wrong value for RAND() expression when aggregating on empty table.
#
DROP TABLE t;
CREATE TABLE t ( i1 INT, i2 INT);
SELECT * FROM t;
i1	i2
EXPLAIN INSERT INTO t SELECT MAX(i1), FLOOR(RAND(0)*1000) FROM t;
INSERT INTO t SELECT MAX(i1), FLOOR(RAND(0)*1000) FROM t;
SELECT * FROM t;
i1	i2
NULL	155
INSERT INTO t VALUES (1,1),(2,2),(3,3);
EXPLAIN INSERT INTO t SELECT MAX(i1), FLOOR(RAND(0)*1000) FROM t;
INSERT INTO t SELECT MAX(i1), FLOOR(RAND(0)*1000) FROM t;
SELECT * FROM t;
i1	i2
1	1
2	2
3	155
3	3
NULL	155
DELETE FROM t;
EXPLAIN INSERT INTO t SELECT MAX(i1), FLOOR(RAND(0)*1000)
+ EXTRACT(YEAR FROM NOW()) DIV 1000 FROM t;
INSERT INTO t SELECT MAX(i1), FLOOR(RAND(0)*1000)
+ EXTRACT(YEAR FROM NOW()) DIV 1000 FROM t;
SELECT * FROM t;
i1	i2
NULL	157
INSERT INTO t VALUES (1,1),(2,2),(3,3);
EXPLAIN INSERT INTO t SELECT MAX(i1), FLOOR(RAND(0)*1000)
+ EXTRACT(YEAR FROM NOW()) DIV 1000 FROM t;
INSERT INTO t SELECT MAX(i1), FLOOR(RAND(0)*1000)
+ EXTRACT(YEAR FROM NOW()) DIV 1000 FROM t;
SELECT * FROM t;
i1	i2
1	1
2	2
3	157
3	3
NULL	157
EXPLAIN INSERT INTO t SELECT MAX(i1), FLOOR(RAND(0)*1000)
+ EXTRACT(YEAR FROM NOW()) DIV 1000 FROM t GROUP BY i2;
INSERT INTO t SELECT MAX(i1), FLOOR(RAND(0)*1000)
+ EXTRACT(YEAR FROM NOW()) DIV 1000 FROM t GROUP BY i2;
SELECT i1 FROM t;
i1
1
1
2
2
3
3
3
3
NULL
SELECT i2 FROM t;
i2
1
157
157
157
2
3
333
622
640
DROP TABLE t;
#
# Bug#33834514: 'RAND(0)' gives inconsistent results with hypergraph
#
CREATE TABLE t (i INT);
INSERT INTO t VALUES (1), (2), (3);
SELECT r FROM t LEFT JOIN (SELECT RAND(0) AS r) AS dt ON TRUE;
r
0.15522042769493574
0.15522042769493574
0.15522042769493574
DROP TABLE t;
