SET SQL_WARNINGS=1;
DROP TABLE t1;
CREATE TABLE t1 (
a tinytext NOT NULL,
b tinyint(3) unsigned NOT NULL default '0',
PRIMARY KEY (a(32),b)
) ENGINE=MyISAM;
ERROR 42000: You have an error in your SQL syntax; check the manual that corresponds to your OceanBase version for the right syntax to use near '(32),b)
) ENGINE=MyISAM' at line 4
CREATE TABLE t1 (c CHAR(10) NOT NULL,i INT NOT NULL AUTO_INCREMENT,
UNIQUE (c,i)) ENGINE=MYISAM;
Warnings:
Warning	1286	Unknown storage engine 'MYISAM'
INSERT IGNORE INTO t1 (c) VALUES (NULL),(NULL);
Warnings:
Warning	1048	Column 'c' cannot be null
Warning	1048	Column 'c' cannot be null
SELECT * FROM t1;
c	i
	1
	2
INSERT INTO t1 (c) VALUES ('a'),('a');
SELECT * FROM t1;
c	i
	1
	2
a	3
a	4
DROP TABLE IF EXISTS t1;
CREATE TABLE t1 (c CHAR(10) NULL, i INT NOT NULL AUTO_INCREMENT,
UNIQUE (c,i)) ENGINE=MYISAM;
Warnings:
Warning	1286	Unknown storage engine 'MYISAM'
INSERT INTO t1 (c) VALUES (NULL),(NULL);
SELECT * FROM t1;
c	i
NULL	1
NULL	2
INSERT INTO t1 (c) VALUES ('a'),('a');
SELECT * FROM t1;
c	i
NULL	1
NULL	2
a	3
a	4
drop table t1;
CREATE TABLE t1 (id int unsigned auto_increment, name char(50), primary key (id)) engine=myisam;
Warnings:
Warning	1286	Unknown storage engine 'myisam'
insert into t1 (name) values ('a'), ('b'),('c'),('d'),('e'),('f'),('g');
ALTER TABLE t1 DROP PRIMARY KEY;
ALTER TABLE t1 ADD INDEX (id);
drop table t1;
create table t1 (c varchar(30), t text, unique (c(2)), unique (t(3))) charset utf8 engine=myisam;
Warnings:
Warning	1286	Unknown storage engine 'myisam'
show create table t1;
Table	Create Table
t1	CREATE TABLE `t1` (
  `c` varchar(30) DEFAULT NULL,
  `t` text DEFAULT NULL,
  UNIQUE KEY `c` (`c`(2)) BLOCK_SIZE 16384 LOCAL,
  UNIQUE KEY `t` (`t`(3)) BLOCK_SIZE 16384 LOCAL
) ORGANIZATION INDEX DEFAULT CHARSET = utf8mb4 ROW_FORMAT = DYNAMIC COMPRESSION = 'zstd_1.3.8' REPLICA_NUM = 1 BLOCK_SIZE = 16384 USE_BLOOM_FILTER = FALSE ENABLE_MACRO_BLOCK_BLOOM_FILTER = FALSE TABLET_SIZE = 134217728 PCTFREE = 0
insert t1 values ('cccc', 'tttt'),
(0xD0B1212223D0B1D0B1D0B1D0B1D0B1, 0xD0B1D0B1212223D0B1D0B1D0B1D0B1),
(0xD0B1222123D0B1D0B1D0B1D0B1D0B1, 0xD0B1D0B1222123D0B1D0B1D0B1D0B1);
insert t1 (c) values ('cc22');
ERROR 23000: Duplicate entry 'cc' for key 'c'
insert t1 (t) values ('ttt22');
ERROR 23000: Duplicate entry 'ttt' for key 't'
insert t1 (c) values (0xD0B1212322D0B1D0B1D0B1D0B1D0B1);
ERROR 23000: Duplicate entry 'б!' for key 'c'
insert t1 (t) values (0xD0B1D0B1212322D0B1D0B1D0B1D0B1);
ERROR 23000: Duplicate entry 'бб!' for key 't'
select c from t1 where c='cccc';
c
cccc
select t from t1 where t='tttt';
t
tttt
select c from t1 where c=0xD0B1212223D0B1D0B1D0B1D0B1D0B1;
c
б!"#ббббб
select t from t1 where t=0xD0B1D0B1212223D0B1D0B1D0B1D0B1;
t
бб!"#бббб
drop table t1;
DROP TABLE IF EXISTS t1;
Warnings:
Note	1051	Unknown table 'test.t1'
CREATE TABLE t1 (
c1 int,
c2 varbinary(240),
UNIQUE KEY (c1),
KEY (c2)
) ENGINE=MyISAM;
Warnings:
Warning	1286	Unknown storage engine 'MyISAM'
INSERT INTO t1 VALUES (1,'\Z\Z\Z\Z');
INSERT INTO t1 VALUES (2,'\Z\Z\Z\Z\Z\Z');
INSERT INTO t1 VALUES (3,'\Z\Z\Z\Z');
select c1 from t1 where c2='\Z\Z\Z\Z';
c1
1
3
DELETE FROM t1 WHERE (c1 = 1);
select c1 from t1 where c2='\Z\Z\Z\Z';
c1
3
DELETE FROM t1 WHERE (c1 = 3);
select c1 from t1 where c2='\Z\Z\Z\Z';
c1
truncate table t1;
insert into t1 values(1,"aaaa"),(2,"aaab"),(3,"aaac"),(4,"aaccc");
delete from t1 where c1=3;
delete from t1 where c1=1;
delete from t1 where c1=4;
drop table t1;
create table t1 (
c1 int,
c2 varchar(20) not null,
primary key (c1),
key (c2(10))
) engine=myisam;
Warnings:
Warning	1286	Unknown storage engine 'myisam'
insert into t1 values (1,'');
insert into t1 values (2,' \t\tTest String');
insert into t1 values (3,' \n\tTest String');
update t1 set c2 = 'New Test String' where c1 = 1;
select * from t1;
c1	c2
1	New Test String
2	 		Test String
3	 
	Test String
drop table t1;
CREATE TABLE t1( a TINYINT, KEY(a) ) ENGINE=MyISAM;
Warnings:
Warning	1286	Unknown storage engine 'MyISAM'
INSERT INTO t1 VALUES( 1 );
ALTER TABLE t1 DISABLE KEYS;
ERROR 42000: You have an error in your SQL syntax; check the manual that corresponds to your OceanBase version for the right syntax to use near 'DISABLE KEYS' at line 1
drop table t1;
CREATE TABLE t1 (a INT, b INT, INDEX (a,b)) engine=myisam;
Warnings:
Warning	1286	Unknown storage engine 'myisam'
INSERT INTO t1 (a, b)
VALUES
(1,1), (1,2), (1,3), (1,4), (1,5),
(2,2), (2,3), (2,1), (3,1), (4,1), (4,2), (4,3), (4,4), (4,5), (4,6),
(5,1), (5,2), (5,3), (5,4), (5,5);
SELECT 1 as RES FROM t1 AS t1_outer WHERE
(SELECT max(b) FROM t1 GROUP BY a HAVING a < 2) > 12;
RES
DROP TABLE t1;
#
# Bug#18144: Cost with FORCE/USE index seems incorrect in some cases.
#
# We are interested in showing that the cost for the last plan is higher
# than for the preceding two plans.
#
CREATE TABLE t1( a INT, b INT, KEY( a ) ) engine=myisam;
Warnings:
Warning	1286	Unknown storage engine 'myisam'
INSERT INTO t1 values (1, 2), (1, 3), (2, 3), (2, 4), (3, 4), (3, 5);
SHOW STATUS LIKE 'Last_query_cost';
Variable_name	Value
SHOW STATUS LIKE 'Last_query_cost';
Variable_name	Value
SHOW STATUS LIKE 'Last_query_cost';
Variable_name	Value
DROP TABLE t1;
#
# Additional coverage for handling of key algorithm in index definition.
#
#
# 1) Default case. If key algorithm was not specified explicitly and
#    this is normal key (not spatial or fulltext) storage engine
#    default key algorithm is used.
#  
DROP TABLE tm;
create table tm (k int, index (k)) charset utf8mb4 engine=myisam;
Warnings:
Warning	1286	Unknown storage engine 'myisam'
#
# Key algorithm is not shown in SHOW CREATE TABLE output in this case
#
show create table tm;
Table	Create Table
tm	CREATE TABLE `tm` (
  `k` int(11) DEFAULT NULL,
  KEY `k` (`k`) BLOCK_SIZE 16384 LOCAL
) ORGANIZATION INDEX DEFAULT CHARSET = utf8mb4 ROW_FORMAT = DYNAMIC COMPRESSION = 'zstd_1.3.8' REPLICA_NUM = 1 BLOCK_SIZE = 16384 USE_BLOOM_FILTER = FALSE ENABLE_MACRO_BLOCK_BLOOM_FILTER = FALSE TABLET_SIZE = 134217728 PCTFREE = 0
#
# But visible in I_S.STATISTICS
#
select table_name, index_type from information_schema.statistics
where table_schema = 'test' and table_name ='tm' order by table_name;
table_name	index_type
tm	BTREE
#
# Same applies when keys are added by ALTER TABLE
#
alter table tm add column l int, add index (l);
show create table tm;
Table	Create Table
tm	CREATE TABLE `tm` (
  `k` int(11) DEFAULT NULL,
  `l` int(11) DEFAULT NULL,
  KEY `k` (`k`) BLOCK_SIZE 16384 LOCAL,
  KEY `l` (`l`) BLOCK_SIZE 16384 LOCAL
) ORGANIZATION INDEX DEFAULT CHARSET = utf8mb4 ROW_FORMAT = DYNAMIC COMPRESSION = 'zstd_1.3.8' REPLICA_NUM = 1 BLOCK_SIZE = 16384 USE_BLOOM_FILTER = FALSE ENABLE_MACRO_BLOCK_BLOOM_FILTER = FALSE TABLET_SIZE = 134217728 PCTFREE = 0
select table_name, index_type from information_schema.statistics
where table_schema = 'test' and table_name = 'tm' and index_name = 'l'
  order by table_name;
table_name	index_type
tm	BTREE
drop tables tm;
#
# 2) For SPATIAL and FULLTEXT keys we always use special key
#    algorithms and there is no way to specify it explicitly.
#
create table tm (pk int primary key, p point not null SRID 0, spatial index (p))
charset utf8mb4 engine=myisam;
Warnings:
Warning	1286	Unknown storage engine 'myisam'
#
# Key algorithm is not shown in SHOW CREATE TABLE output in this
# case as well.
#
show create table tm;
Table	Create Table
tm	CREATE TABLE `tm` (
  `pk` int(11) NOT NULL,
  `p` point NOT NULL /*!80003 SRID 0 */,
  PRIMARY KEY (`pk`),
  SPATIAL KEY `p` (`p`) BLOCK_SIZE 16384 LOCAL
) ORGANIZATION INDEX DEFAULT CHARSET = utf8mb4 ROW_FORMAT = DYNAMIC COMPRESSION = 'zstd_1.3.8' REPLICA_NUM = 1 BLOCK_SIZE = 16384 USE_BLOOM_FILTER = FALSE ENABLE_MACRO_BLOCK_BLOOM_FILTER = FALSE TABLET_SIZE = 134217728 PCTFREE = 0
#
# But visible in I_S.STATISTICS
#
select table_name, index_type from information_schema.statistics
where table_schema = 'test' and table_name = 'tm' and index_name = 'p'
  order by table_name;
table_name	index_type
tm	BTREE
tm	BTREE
#
# Same applies when keys are added by ALTER TABLE
#
alter table tm add column q point not null SRID 0;
ERROR 22004: Invalid use of NULL value
alter table tm add spatial index (q);
ERROR 42000: Key column 'q' doesn't exist in table
select table_name, index_type from information_schema.statistics
where table_schema = 'test' and table_name = 'tm' and index_name = 'q'
  order by table_name;
table_name	index_type
drop tables tm;
#
# Same applies to FULLTEXT indexes.
#
#
# 3) If key algorithm was specified explicitly and it is supported
#    by the storage engine it will be used.
#
create table tm (k int, index using btree (k)) charset utf8mb4 engine=myisam;
Warnings:
Warning	1286	Unknown storage engine 'myisam'
#
# In this case it is shown in SHOW CREATE TABLE output
#
show create table tm;
Table	Create Table
tm	CREATE TABLE `tm` (
  `k` int(11) DEFAULT NULL,
  KEY `k` (`k`) BLOCK_SIZE 16384 LOCAL
) ORGANIZATION INDEX DEFAULT CHARSET = utf8mb4 ROW_FORMAT = DYNAMIC COMPRESSION = 'zstd_1.3.8' REPLICA_NUM = 1 BLOCK_SIZE = 16384 USE_BLOOM_FILTER = FALSE ENABLE_MACRO_BLOCK_BLOOM_FILTER = FALSE TABLET_SIZE = 134217728 PCTFREE = 0
#
# Also visible in I_S.STATISTICS
#
select table_name, index_type from information_schema.statistics
where table_schema = 'test' and table_name = 'tm' order by table_name;
table_name	index_type
tm	BTREE
#
# Same applies when keys are added by ALTER TABLE
#
# Note that the information that algorithm was provided explicitly is
# preserved by ALTER TABLE.
alter table tm add column l int, add index using btree (l);
show create table tm;
Table	Create Table
tm	CREATE TABLE `tm` (
  `k` int(11) DEFAULT NULL,
  `l` int(11) DEFAULT NULL,
  KEY `k` (`k`) BLOCK_SIZE 16384 LOCAL,
  KEY `l` (`l`) BLOCK_SIZE 16384 LOCAL
) ORGANIZATION INDEX DEFAULT CHARSET = utf8mb4 ROW_FORMAT = DYNAMIC COMPRESSION = 'zstd_1.3.8' REPLICA_NUM = 1 BLOCK_SIZE = 16384 USE_BLOOM_FILTER = FALSE ENABLE_MACRO_BLOCK_BLOOM_FILTER = FALSE TABLET_SIZE = 134217728 PCTFREE = 0
select table_name, index_type from information_schema.statistics
where table_schema = 'test' and table_name = 'tm' and index_name = 'l'
  order by table_name;
table_name	index_type
tm	BTREE
drop tables tm;
#
# 7) Key algorithm and ALTER TABLE ALGORITHM=INPLACE
#
# Changing key algorithm from one used by default to the same one
# but specified explicitly should be inplace/fast operation.
