#
# BUG#30869674 - OPTIMIZE TABLE ON MYISAM CAN INCREASE TABLE SIZE (~2X) AND REDUCE PERFORMANCE
#
DROP DATABASE IF EXISTS test_bug30869674;
SET sql_mode = 'NO_ENGINE_SUBSTITUTION';
CREATE DATABASE test_bug30869674;
USE test_bug30869674;
DROP TABLE t1;
CREATE TABLE t1(id int, name varchar(255), description varchar(255), count int, primary key(id)) ENGINE=myisam;
Warnings:
Warning	1286	Unknown storage engine 'myisam'
INSERT INTO t1 VALUES (1, "test1", "description1", 1), (2, "test2", "description2", 2), (3, "test3", "description3", 3);
SELECT * FROM test_bug30869674.t1;
id	name	description	count
1	test1	description1	1
2	test2	description2	2
3	test3	description3	3
UPDATE t1 SET name="testing test2" WHERE id=2;
OPTIMIZE TABLE t1;
SELECT * FROM test_bug30869674.t1;
id	name	description	count
1	test1	description1	1
2	testing test2	description2	2
3	test3	description3	3
DROP DATABASE test_bug30869674;
