SET SESSION SQL_MODE='STRICT_ALL_TABLES,NO_ZERO_IN_DATE';
SET @old_log_output= @@global.log_output;
SET GLOBAL log_output="FILE,TABLE";
Warnings:
Warning	1235	This system variable now is mock not supported
drop table if exists t1,t2;
drop table if exists t1aa,t2aa;
drop database if exists mysqltest;
drop database if exists mysqltest1;
delete from mysql.user where user='mysqltest_1' || user='mysqltest_2' || user='mysqltest_3';
ERROR 0A000: DML operation on Virtual Table/Temporary Table not supported
delete from mysql.db where user='mysqltest_1' || user='mysqltest_2' || user='mysqltest_3';
ERROR 0A000: DML operation on Virtual Table/Temporary Table not supported
create table t1 (a int not null primary key, b int not null,c int not null, key(b,c));
insert into t1 values (1,2,2),(2,2,3),(3,2,4),(4,2,4);
-- Here we enable metadata just to check that the collation of the
-- resultset is non-binary for string type. This should be changed
-- after Bug#29394 is implemented.
insert into t1 values (5,5,5);
show index from t1;
Catalog	Database	Table	Table_alias	Column	Column_alias	Type	Length	Max length	Is_null	Flags	Decimals	Charsetnr
def		subquery_alias	subquery_alias	Table	Table	253	1024	2	N	1	0	45
def		subquery_alias	subquery_alias	Non_unique	Non_unique	8	20	1	N	32769	0	63
def		subquery_alias	subquery_alias	Key_name	Key_name	253	512	7	N	16387	0	45
def		subquery_alias	subquery_alias	Seq_in_index	Seq_in_index	8	20	1	N	49155	0	63
def		subquery_alias	subquery_alias	Column_name	Column_name	253	512	1	N	1	0	45
def		subquery_alias	subquery_alias	Collation	Collation	253	512	1	Y	0	0	45
def		subquery_alias	subquery_alias	Cardinality	Cardinality	8	20	0	Y	32768	0	63
def		subquery_alias	subquery_alias	Sub_part	Sub_part	253	1024	0	Y	0	0	45
def		subquery_alias	subquery_alias	Packed	Packed	253	1024	0	Y	0	0	45
def		subquery_alias	subquery_alias	Null	Null	253	512	0	N	1	0	45
def		subquery_alias	subquery_alias	Index_type	Index_type	253	512	5	N	1	0	45
def		subquery_alias	subquery_alias	Comment	Comment	253	16384	9	Y	0	0	45
def		subquery_alias	subquery_alias	Index_comment	Index_comment	253	16384	0	N	1	0	45
def		subquery_alias	subquery_alias	Visible	Visible	253	12	3	N	1	0	45
def		subquery_alias	subquery_alias	Expression	Expression	253	1048576	0	Y	0	0	45
Table	Non_unique	Key_name	Seq_in_index	Column_name	Collation	Cardinality	Sub_part	Packed	Null	Index_type	Comment	Index_comment	Visible	Expression
t1	0	PRIMARY	1	a	A	NULL	NULL	NULL		BTREE	available		YES	NULL
t1	1	b	1	b	A	NULL	NULL	NULL		BTREE	available		YES	NULL
t1	1	b	2	c	A	NULL	NULL	NULL		BTREE	available		YES	NULL
insert into t1 values (5,5,5);
ERROR 23000: Duplicate entry '5' for key 'PRIMARY'
-- Here we enable metadata just to check that the collation of the
-- resultset is non-binary for string type. This should be changed
-- after Bug#29394 is implemented.
optimize table t1;
optimize table t1;
drop table t1;
-- Here we enable metadata just to check that the collation of the
-- resultset is non-binary for string type. This should be changed
-- after Bug#29394 is implemented.
show variables like "wait_timeout%";
Catalog	Database	Table	Table_alias	Column	Column_alias	Type	Length	Max length	Is_null	Flags	Decimals	Charsetnr
def		subquery_alias	subquery_alias	Variable_name	Variable_name	253	512	12	N	1	0	45
def		subquery_alias	subquery_alias	Value	Value	253	262144	5	Y	0	0	45
Variable_name	Value
wait_timeout	28800
show variables like "WAIT_timeout%";
Catalog	Database	Table	Table_alias	Column	Column_alias	Type	Length	Max length	Is_null	Flags	Decimals	Charsetnr
def		subquery_alias	subquery_alias	Variable_name	Variable_name	253	512	12	N	1	0	45
def		subquery_alias	subquery_alias	Value	Value	253	262144	5	Y	0	0	45
Variable_name	Value
wait_timeout	28800
show variables like "this_doesn't_exists%";
Catalog	Database	Table	Table_alias	Column	Column_alias	Type	Length	Max length	Is_null	Flags	Decimals	Charsetnr
def		subquery_alias	subquery_alias	Variable_name	Variable_name	253	512	0	N	1	0	45
def		subquery_alias	subquery_alias	Value	Value	253	262144	0	Y	0	0	45
Variable_name	Value
show table status from test like "this_doesn't_exists%";
Catalog	Database	Table	Table_alias	Column	Column_alias	Type	Length	Max length	Is_null	Flags	Decimals	Charsetnr
def		subquery_alias	subquery_alias	Name	Name	253	1024	0	N	1	0	45
def		subquery_alias	subquery_alias	Engine	Engine	253	36	0	Y	0	0	45
def		subquery_alias	subquery_alias	Version	Version	8	20	0	Y	32768	0	63
def		subquery_alias	subquery_alias	Row_format	Row_format	253	512	0	Y	0	0	45
def		subquery_alias	subquery_alias	Rows	Rows	8	20	0	Y	32800	0	63
def		subquery_alias	subquery_alias	Avg_row_length	Avg_row_length	8	20	0	Y	32800	0	63
def		subquery_alias	subquery_alias	Data_length	Data_length	8	20	0	Y	32800	0	63
def		subquery_alias	subquery_alias	Max_data_length	Max_data_length	6	0	0	Y	32896	0	63
def		subquery_alias	subquery_alias	Index_length	Index_length	6	0	0	Y	32896	0	63
def		subquery_alias	subquery_alias	Data_free	Data_free	6	0	0	Y	32896	0	63
def		subquery_alias	subquery_alias	Auto_increment	Auto_increment	8	20	0	Y	32800	0	63
def		subquery_alias	subquery_alias	Create_time	Create_time	7	26	0	Y	1152	6	63
def		subquery_alias	subquery_alias	Update_time	Update_time	7	26	0	Y	1152	6	63
def		subquery_alias	subquery_alias	Check_time	Check_time	6	0	0	Y	32896	0	63
def		subquery_alias	subquery_alias	Collation	Collation	253	72	0	Y	0	0	45
def		subquery_alias	subquery_alias	Checksum	Checksum	8	20	0	Y	32768	0	63
def		subquery_alias	subquery_alias	Create_options	Create_options	253	0	0	Y	0	0	45
def		subquery_alias	subquery_alias	Comment	Comment	253	16384	0	N	1	0	45
Name	Engine	Version	Row_format	Rows	Avg_row_length	Data_length	Max_data_length	Index_length	Data_free	Auto_increment	Create_time	Update_time	Check_time	Collation	Checksum	Create_options	Comment
show databases;
show databases like "test%";
Catalog	Database	Table	Table_alias	Column	Column_alias	Type	Length	Max length	Is_null	Flags	Decimals	Charsetnr
def		subquery_alias	subquery_alias	Database	Database (test%)	253	512	4	N	1	0	45
Database (test%)
test
create table t1 (
test_set set( 'val1', 'val2', 'val3' ) not null default '',
name char(20) default 'O''Brien' comment 'O''Brien as default',
c int not null comment 'int column',
`c-b` int comment 'name with a minus',
`space 2` int comment 'name with a space'
  ) comment = 'it\'s a table' ;
set sql_quote_show_create=0;
set sql_quote_show_create=1;
show full columns from t1;
Field	Type	Collation	Null	Key	Default	Extra	Privileges	Comment
test_set	set('val1','val2','val3')	NULL	NO				SELECT,INSERT,UPDATE,REFERENCES	
name	char(20)	utf8mb4_general_ci	YES		O'Brien		SELECT,INSERT,UPDATE,REFERENCES	O'Brien as default
c	int(11)	NULL	NO		NULL		SELECT,INSERT,UPDATE,REFERENCES	int column
c-b	int(11)	NULL	YES		NULL		SELECT,INSERT,UPDATE,REFERENCES	name with a minus
space 2	int(11)	NULL	YES		NULL		SELECT,INSERT,UPDATE,REFERENCES	name with a space
drop table t1;
create table t1 (a int not null, unique aa (a));
drop table t1;
create table t1 (a int not null, primary key (a));
drop table t1;
create table t1(n int);
insert into t1 values (1);
drop table t1;
create table t1 (a decimal(9,2), b decimal (9,0), e double(9,2), f double(5,0), h float(3,2), i float(3,0));
show columns from t1;
Field	Type	Null	Key	Default	Extra
a	decimal(9,2)	YES		NULL	
b	decimal(9,0)	YES		NULL	
e	double(9,2)	YES		NULL	
f	double(5,0)	YES		NULL	
h	float(3,2)	YES		NULL	
i	float(3,0)	YES		NULL	
show full columns from t1;
Field	Type	Collation	Null	Key	Default	Extra	Privileges	Comment
a	decimal(9,2)	NULL	YES		NULL		SELECT,INSERT,UPDATE,REFERENCES	
b	decimal(9,0)	NULL	YES		NULL		SELECT,INSERT,UPDATE,REFERENCES	
e	double(9,2)	NULL	YES		NULL		SELECT,INSERT,UPDATE,REFERENCES	
f	double(5,0)	NULL	YES		NULL		SELECT,INSERT,UPDATE,REFERENCES	
h	float(3,2)	NULL	YES		NULL		SELECT,INSERT,UPDATE,REFERENCES	
i	float(3,0)	NULL	YES		NULL		SELECT,INSERT,UPDATE,REFERENCES	
drop table t1;
create table t1 (a int not null);
create table t2 select max(a) from t1;
show columns from t2;
Field	Type	Null	Key	Default	Extra
max(a)	int(11)	YES		NULL	
drop table t1,t2;
create table t1 (c decimal, d double, f float, r real);
show columns from t1;
Field	Type	Null	Key	Default	Extra
c	decimal(10,0)	YES		NULL	
d	double	YES		NULL	
f	float	YES		NULL	
r	double	YES		NULL	
drop table t1;
create table t1 (c decimal(3,3), d double(3,3), f float(3,3));
show columns from t1;
Field	Type	Null	Key	Default	Extra
c	decimal(3,3)	YES		NULL	
d	double(3,3)	YES		NULL	
f	float(3,3)	YES		NULL	
drop table t1;
SET @old_sql_mode= @@sql_mode, sql_mode= '';
SET @old_sql_quote_show_create= @@sql_quote_show_create, sql_quote_show_create= OFF;
CREATE TABLE ```ab``cd``` (i INT);
SHOW CREATE TABLE ```ab``cd```;
Table	Create Table
`ab`cd`	CREATE TABLE ```ab``cd``` (
  i int(11) DEFAULT NULL
) ORGANIZATION INDEX DEFAULT CHARSET = utf8mb4 ROW_FORMAT = DYNAMIC COMPRESSION = 'zstd_1.3.8' REPLICA_NUM = 1 BLOCK_SIZE = 16384 USE_BLOOM_FILTER = FALSE ENABLE_MACRO_BLOCK_BLOOM_FILTER = FALSE TABLET_SIZE = 134217728 PCTFREE = 0
DROP TABLE ```ab``cd```;
CREATE TABLE ```ab````cd``` (i INT);
SHOW CREATE TABLE ```ab````cd```;
Table	Create Table
`ab``cd`	CREATE TABLE ```ab````cd``` (
  i int(11) DEFAULT NULL
) ORGANIZATION INDEX DEFAULT CHARSET = utf8mb4 ROW_FORMAT = DYNAMIC COMPRESSION = 'zstd_1.3.8' REPLICA_NUM = 1 BLOCK_SIZE = 16384 USE_BLOOM_FILTER = FALSE ENABLE_MACRO_BLOCK_BLOOM_FILTER = FALSE TABLET_SIZE = 134217728 PCTFREE = 0
DROP TABLE ```ab````cd```;
CREATE TABLE ```a` (i INT);
SHOW CREATE TABLE ```a`;
Table	Create Table
`a	CREATE TABLE ```a` (
  i int(11) DEFAULT NULL
) ORGANIZATION INDEX DEFAULT CHARSET = utf8mb4 ROW_FORMAT = DYNAMIC COMPRESSION = 'zstd_1.3.8' REPLICA_NUM = 1 BLOCK_SIZE = 16384 USE_BLOOM_FILTER = FALSE ENABLE_MACRO_BLOCK_BLOOM_FILTER = FALSE TABLET_SIZE = 134217728 PCTFREE = 0
DROP TABLE ```a`;
CREATE TABLE `a.1` (i INT);
SHOW CREATE TABLE `a.1`;
Table	Create Table
a.1	CREATE TABLE `a.1` (
  i int(11) DEFAULT NULL
) ORGANIZATION INDEX DEFAULT CHARSET = utf8mb4 ROW_FORMAT = DYNAMIC COMPRESSION = 'zstd_1.3.8' REPLICA_NUM = 1 BLOCK_SIZE = 16384 USE_BLOOM_FILTER = FALSE ENABLE_MACRO_BLOCK_BLOOM_FILTER = FALSE TABLET_SIZE = 134217728 PCTFREE = 0
DROP TABLE `a.1`;
SET sql_mode= 'ANSI_QUOTES';
CREATE TABLE """a" (i INT);
SHOW CREATE TABLE """a";
Table	Create Table
"a	CREATE TABLE """a" (
  i int(11) DEFAULT NULL
) ORGANIZATION INDEX DEFAULT CHARSET = utf8mb4 ROW_FORMAT = DYNAMIC COMPRESSION = 'zstd_1.3.8' REPLICA_NUM = 1 BLOCK_SIZE = 16384 USE_BLOOM_FILTER = FALSE ENABLE_MACRO_BLOCK_BLOOM_FILTER = FALSE TABLET_SIZE = 134217728 PCTFREE = 0
DROP TABLE """a";
SET sql_mode= '';
SET sql_quote_show_create= OFF;
CREATE TABLE t1 (i INT);
DROP TABLE t1;
CREATE TABLE `table` (i INT);
SHOW CREATE TABLE `table`;
Table	Create Table
table	CREATE TABLE `table` (
  i int(11) DEFAULT NULL
) ORGANIZATION INDEX DEFAULT CHARSET = utf8mb4 ROW_FORMAT = DYNAMIC COMPRESSION = 'zstd_1.3.8' REPLICA_NUM = 1 BLOCK_SIZE = 16384 USE_BLOOM_FILTER = FALSE ENABLE_MACRO_BLOCK_BLOOM_FILTER = FALSE TABLET_SIZE = 134217728 PCTFREE = 0
DROP TABLE `table`;
SET sql_quote_show_create= @old_sql_quote_show_create;
SET sql_mode= @old_sql_mode;
select @@max_heap_table_size;
@@max_heap_table_size
16777216
CREATE TABLE t1 (
a int(11) default NULL,
KEY a USING BTREE (a)
) ENGINE=HEAP;
Warnings:
Warning	1286	Unknown storage engine 'HEAP'
CREATE TABLE t2 (
b int(11) default NULL,
index(b)
) ENGINE=HEAP;
Warnings:
Warning	1286	Unknown storage engine 'HEAP'
DROP TABLE t3;
CREATE TABLE t3 (
a int(11) default NULL,
b int(11) default NULL,
KEY a USING BTREE (a),
index(b)
) ENGINE=HEAP;
Warnings:
Warning	1286	Unknown storage engine 'HEAP'
insert into t1 values (1),(2);
insert into t2 values (1),(2);
insert into t3 values (1,1),(2,2);
show table status;
insert into t1 values (3),(4);
insert into t2 values (3),(4);
insert into t3 values (3,3),(4,4);
show table status;
insert into t1 values (5);
insert into t2 values (5);
insert into t3 values (5,5);
show table status;
delete from t1 where a=3;
delete from t2 where b=3;
delete from t3 where a=3;
show table status;
truncate table t1;
truncate table t2;
truncate table t3;
show table status;
insert into t1 values (5);
insert into t2 values (5);
insert into t3 values (5,5);
show table status;
delete from t1 where a=5;
delete from t2 where b=5;
delete from t3 where a=5;
show table status;
drop table t1, t2, t3;
drop user mysqltest_1@'%';
drop user mysqltest_2@'%';
drop user mysqltest_3@'%';
drop database if exists mysqltest;
create database mysqltest;
show create database mysqltest;
Database	Create Database
mysqltest	CREATE DATABASE `mysqltest` DEFAULT CHARACTER SET = utf8mb4 REPLICA_NUM = 1
create table mysqltest.t1(a int);
insert into mysqltest.t1 values(1);
create user mysqltest_1@'%', mysqltest_2@'%', mysqltest_3@'%';
grant select on `mysqltest`.* to mysqltest_1@'%';
grant usage  on `mysqltest`.* to mysqltest_2@'%';
grant drop   on `mysqltest`.* to mysqltest_3@'%';
grant all on `test`.* to mysqltest_1 WITH GRANT OPTION;
grant all on `test`.* to mysqltest_2 WITH GRANT OPTION;
grant all on `test`.* to mysqltest_3 WITH GRANT OPTION;
select * from t1;
a
1
show create database mysqltest;
Database	Create Database
mysqltest	CREATE DATABASE `mysqltest` DEFAULT CHARACTER SET = utf8mb4 REPLICA_NUM = 1
drop table t1;
ERROR 42000: DROP command denied to user 'mysqltest_1'@'%' for table 't1'
drop database mysqltest;
ERROR 42000: Access denied for user 'mysqltest_1'@'%' to database 'mysqltest'
select * from mysqltest.t1;
ERROR 42000: SELECT command denied to user 'mysqltest_2'@'%' for table 't1'
show create database mysqltest;
ERROR 42000: Access denied for user 'mysqltest_2'@'%' to database 'mysqltest'
drop table mysqltest.t1;
ERROR 42000: DROP command denied to user 'mysqltest_2'@'%' for table 't1'
drop database mysqltest;
ERROR 42000: Access denied for user 'mysqltest_2'@'%' to database 'mysqltest'
select * from mysqltest.t1;
ERROR 42000: SELECT command denied to user 'mysqltest_3'@'%' for table 't1'
show create database mysqltest;
Database	Create Database
mysqltest	CREATE DATABASE `mysqltest` DEFAULT CHARACTER SET = utf8mb4 REPLICA_NUM = 1
drop table mysqltest.t1;
drop database mysqltest;
set names binary;
delete from mysql.user
where user='mysqltest_1' || user='mysqltest_2' || user='mysqltest_3';
ERROR 0A000: DML operation on Virtual Table/Temporary Table not supported
delete from mysql.db
where user='mysqltest_1' || user='mysqltest_2' || user='mysqltest_3';
ERROR 0A000: DML operation on Virtual Table/Temporary Table not supported
create table t1 (
c1 int NOT NULL,
c2 int NOT NULL,
PRIMARY KEY USING HASH (c1),
INDEX USING BTREE(c2)
);
DROP TABLE t1;

# Bug#12183 #show open tables behavior doesn't match grammar.

DROP DATABASE IF EXISTS mysqltest1;
CREATE DATABASE mysqltest1;
use mysqltest1;

CREATE TABLE t1(a INT);
CREATE TABLE t2(a INT);


SELECT 1 FROM t1;
1
SELECT 1 FROM t2;
1






DROP DATABASE mysqltest1;
use test;

SHOW TABLES FROM non_existing_database;
ERROR 42000: Unknown database 'non_existing_database'
End of 4.1 tests
SHOW TABLES FROM no_such_database;
ERROR 42000: Unknown database 'no_such_database'
SHOW COLUMNS FROM no_such_table;
ERROR 42S02: Table 'test.no_such_table' doesn't exist
SET GLOBAL EVENT_SCHEDULER = OFF;
CREATE TABLE t1 (f1 INT, f2 INT);
INSERT INTO t1 VALUES(10, 20);
show status like 'slow_queries';
Variable_name	Value
show tables;
show status like 'slow_queries';
Variable_name	Value
select 1 from t1 limit 1;
1
1
show status like 'slow_queries';
Variable_name	Value
DROP TABLE t1;
create table t1 (a int);
create trigger tr1 before insert on t1 for each row
begin
end;
DROP VIEW v1;
create view v1 as select a from t1;
DROP PROCEDURE p1;
create procedure p1()
begin
end;
DROP FUNCTION f1;
create function f1()
returns int
return 0;
show databases;
show tables;
show events;
ERROR 42000: You have an error in your SQL syntax; check the manual that corresponds to your OceanBase version for the right syntax to use near 'events' at line 1
show table status;
show plugins;
Warnings:
Warning	1235	This statement is not supported
show columns in t1;
Field	Type	Null	Key	Default	Extra
a	int(11)	YES		NULL	
show slave hosts;
ERROR 42000: You have an error in your SQL syntax; check the manual that corresponds to your OceanBase version for the right syntax to use near 'slave hosts' at line 1
show keys in t1;
Table	Non_unique	Key_name	Seq_in_index	Column_name	Collation	Cardinality	Sub_part	Packed	Null	Index_type	Comment	Index_comment	Visible	Expression
show storage engines;
ENGINE	SUPPORT	COMMENT	TRANSACTIONS	XA	SAVEPOINTS
InnoDB	YES	Supports transactions	YES	NO	YES
show privileges;
Privilege	Context	Comment
Alter	Tables	To alter the table
Create	Databases,Tables,Indexes	To create new databases and tables
Create view	Tables	To create new views
Create user	Server Admin	To create new users
Delete	Tables	To delete existing rows
Drop	Databases,Tables	To drop databases, tables, and views
Grant option	Databases,Tables,Functions,Procedures	To give to other users those privileges you possess
Index	Tables	To create or drop indexes
Insert	Tables	To insert data into tables
Process	Server Admin	To view the plain text of currently executing queries
Select	Tables	To retrieve rows from table
Show databases	Server Admin	To see all databases with SHOW DATABASES
Show view	Tables	To see views with SHOW CREATE VIEW
Super	Server Admin	To use KILL thread, SET GLOBAL, CHANGE MASTER, etc.
Update	Tables	To update existing rows
Usage	Server Admin	No privileges - allow connect only
show count(*) warnings;
@@session.warning_count
0
show count(*) errors;
@@session.error_count
0
show warnings;
Level	Code	Message
show master status;
ERROR 42000: You have an error in your SQL syntax; check the manual that corresponds to your OceanBase version for the right syntax to use near 'master status' at line 1
show slave status;
ERROR 42000: You have an error in your SQL syntax; check the manual that corresponds to your OceanBase version for the right syntax to use near 'slave status' at line 1
show procedure status;
show create event e1;
ERROR 42000: You have an error in your SQL syntax; check the manual that corresponds to your OceanBase version for the right syntax to use near 'event e1' at line 1
show status like 'slow_queries';
Variable_name	Value
drop view v1;
drop table t1;
drop procedure p1;
drop function f1;
DROP DATABASE IF EXISTS mysqltest1;
DROP TABLE IF EXISTS t1;
DROP VIEW IF EXISTS v1;
DROP PROCEDURE IF EXISTS p1;
DROP FUNCTION IF EXISTS f1;
CREATE DATABASE mysqltest1;
CREATE TABLE t1(c INT NOT NULL PRIMARY KEY);
CREATE TRIGGER t1_bi BEFORE INSERT ON t1 FOR EACH ROW SET @a = 1;
CREATE VIEW v1 AS SELECT 1;
CREATE PROCEDURE p1() SELECT 1;
CREATE FUNCTION f1() RETURNS INT RETURN 1;
set names utf8;
-- Here we enable metadata just to check that the collation of the
-- resultset is non-binary for string type. This should be changed
-- after Bug#29394 is implemented.
----------------------------------------------------------------
SHOW CHARACTER SET LIKE 'utf8';
Catalog	Database	Table	Table_alias	Column	Column_alias	Type	Length	Max length	Is_null	Flags	Decimals	Charsetnr
def		subquery_alias	subquery_alias	Charset	Charset	253	512	0	N	1	0	45
def		subquery_alias	subquery_alias	Description	Description	253	256	0	N	1	0	45
def		subquery_alias	subquery_alias	Default collation	Default collation	253	512	0	N	1	0	45
def		subquery_alias	subquery_alias	Maxlen	Maxlen	8	20	0	N	32769	0	63
Charset	Description	Default collation	Maxlen
----------------------------------------------------------------
SHOW COLLATION LIKE 'latin1_bin';
Catalog	Database	Table	Table_alias	Column	Column_alias	Type	Length	Max length	Is_null	Flags	Decimals	Charsetnr
def		subquery_alias	subquery_alias	Collation	Collation	253	512	10	N	1	0	45
def		subquery_alias	subquery_alias	Charset	Charset	253	512	6	N	1	0	45
def		subquery_alias	subquery_alias	Id	Id	8	20	2	N	32769	0	63
def		subquery_alias	subquery_alias	Default	Default	253	16	0	N	1	0	45
def		subquery_alias	subquery_alias	Compiled	Compiled	253	16	3	N	1	0	45
def		subquery_alias	subquery_alias	Sortlen	Sortlen	8	20	1	N	32769	0	63
Collation	Charset	Id	Default	Compiled	Sortlen
latin1_bin	latin1	47		Yes	1
----------------------------------------------------------------
SHOW CREATE DATABASE mysqltest1;
Catalog	Database	Table	Table_alias	Column	Column_alias	Type	Length	Max length	Is_null	Flags	Decimals	Charsetnr
def		subquery_alias	subquery_alias	Database	Database	253	512	10	N	1	0	45
def		subquery_alias	subquery_alias	Create Database	Create Database	253	16384	76	N	1	0	45
Database	Create Database
mysqltest1	CREATE DATABASE `mysqltest1` DEFAULT CHARACTER SET = utf8mb4 REPLICA_NUM = 1
----------------------------------------------------------------
SHOW DATABASES LIKE 'mysqltest1';
Catalog	Database	Table	Table_alias	Column	Column_alias	Type	Length	Max length	Is_null	Flags	Decimals	Charsetnr
def		subquery_alias	subquery_alias	Database	Database (mysqltest1)	253	512	10	N	1	0	45
Database (mysqltest1)
mysqltest1
----------------------------------------------------------------
----------------------------------------------------------------
SHOW INDEX FROM t1;
Catalog	Database	Table	Table_alias	Column	Column_alias	Type	Length	Max length	Is_null	Flags	Decimals	Charsetnr
def		subquery_alias	subquery_alias	Table	Table	253	1024	2	N	1	0	45
def		subquery_alias	subquery_alias	Non_unique	Non_unique	8	20	1	N	32769	0	63
def		subquery_alias	subquery_alias	Key_name	Key_name	253	512	7	N	16387	0	45
def		subquery_alias	subquery_alias	Seq_in_index	Seq_in_index	8	20	1	N	49155	0	63
def		subquery_alias	subquery_alias	Column_name	Column_name	253	512	1	N	1	0	45
def		subquery_alias	subquery_alias	Collation	Collation	253	512	1	Y	0	0	45
def		subquery_alias	subquery_alias	Cardinality	Cardinality	8	20	0	Y	32768	0	63
def		subquery_alias	subquery_alias	Sub_part	Sub_part	253	1024	0	Y	0	0	45
def		subquery_alias	subquery_alias	Packed	Packed	253	1024	0	Y	0	0	45
def		subquery_alias	subquery_alias	Null	Null	253	512	0	N	1	0	45
def		subquery_alias	subquery_alias	Index_type	Index_type	253	512	5	N	1	0	45
def		subquery_alias	subquery_alias	Comment	Comment	253	16384	9	Y	0	0	45
def		subquery_alias	subquery_alias	Index_comment	Index_comment	253	16384	0	N	1	0	45
def		subquery_alias	subquery_alias	Visible	Visible	253	12	3	N	1	0	45
def		subquery_alias	subquery_alias	Expression	Expression	253	1048576	0	Y	0	0	45
Table	Non_unique	Key_name	Seq_in_index	Column_name	Collation	Cardinality	Sub_part	Packed	Null	Index_type	Comment	Index_comment	Visible	Expression
t1	0	PRIMARY	1	c	A	NULL	NULL	NULL		BTREE	available		YES	NULL
----------------------------------------------------------------
SELECT
TABLE_CATALOG,
TABLE_SCHEMA,
TABLE_NAME,
TABLE_TYPE,
ENGINE,
ROW_FORMAT,
TABLE_COLLATION,
CREATE_OPTIONS,
TABLE_COMMENT
FROM INFORMATION_SCHEMA.TABLES
WHERE table_name = 't1' and TABLE_SCHEMA = database();
Catalog	Database	Table	Table_alias	Column	Column_alias	Type	Length	Max length	Is_null	Flags	Decimals	Charsetnr
def	information_schema	tables	tables	TABLE_CATALOG	TABLE_CATALOG	253	2048	3	N	1	0	45
def	information_schema	tables	tables	TABLE_SCHEMA	TABLE_SCHEMA	254	256	4	N	1	0	45
def	information_schema	tables	tables	TABLE_NAME	TABLE_NAME	254	256	2	Y	0	0	45
def	information_schema	tables	tables	TABLE_TYPE	TABLE_TYPE	253	256	10	N	1	0	45
def	information_schema	tables	tables	ENGINE	ENGINE	253	256	6	N	1	0	45
def	information_schema	tables	tables	ROW_FORMAT	ROW_FORMAT	253	40	7	Y	0	0	45
def	information_schema	tables	tables	TABLE_COLLATION	TABLE_COLLATION	253	128	18	N	1	0	45
def	information_schema	tables	tables	CREATE_OPTIONS	CREATE_OPTIONS	253	1020	0	Y	0	0	45
def	information_schema	tables	tables	TABLE_COMMENT	TABLE_COMMENT	252	65535	0	Y	16	0	45
TABLE_CATALOG	TABLE_SCHEMA	TABLE_NAME	TABLE_TYPE	ENGINE	ROW_FORMAT	TABLE_COLLATION	CREATE_OPTIONS	TABLE_COMMENT
def	test	t1	BASE TABLE	InnoDB	DYNAMIC	utf8mb4_general_ci	NULL	
----------------------------------------------------------------
----------------------------------------------------------------
SHOW TABLES LIKE 't1';
Catalog	Database	Table	Table_alias	Column	Column_alias	Type	Length	Max length	Is_null	Flags	Decimals	Charsetnr
def		subquery_alias	subquery_alias	table_name	Tables_in_test (t1)	253	1024	2	N	16387	0	45
Tables_in_test (t1)
t1
----------------------------------------------------------------
SHOW COLUMNS FROM t1;
Catalog	Database	Table	Table_alias	Column	Column_alias	Type	Length	Max length	Is_null	Flags	Decimals	Charsetnr
def		subquery_alias	subquery_alias	Field	Field	253	512	1	N	16387	0	45
def		subquery_alias	subquery_alias	Type	Type	253	4194304	7	N	1	0	45
def		subquery_alias	subquery_alias	Null	Null	253	16	2	N	1	0	45
def		subquery_alias	subquery_alias	Key	Key	253	16	3	N	1	0	45
def		subquery_alias	subquery_alias	Default	Default	253	16384	0	Y	0	0	45
def		subquery_alias	subquery_alias	Extra	Extra	253	16384	0	N	1	0	45
Field	Type	Null	Key	Default	Extra
c	int(11)	NO	PRI	NULL	
----------------------------------------------------------------
----------------------------------------------------------------
----------------------------------------------------------------
----------------------------------------------------------------
----------------------------------------------------------------
----------------------------------------------------------------
----------------------------------------------------------------
----------------------------------------------------------------
----------------------------------------------------------------
DROP DATABASE mysqltest1;
DROP TABLE t1;
DROP VIEW v1;
DROP PROCEDURE p1;
DROP FUNCTION f1;
set names koi8r;
ERROR 42000: Unknown character set: 'koi8r'
DROP DATABASE IF EXISTS mysqltest1;
CREATE DATABASE mysqltest1;
use mysqltest1;
CREATE TABLE t1(讼滔嗡? INT);
ERROR 42000: You have an error in your SQL syntax; check the manual that corresponds to your OceanBase version for the right syntax to use near '? INT)' at line 1

---> Dumping mysqltest1 to outfile1


DROP DATABASE mysqltest1;


---> Restoring mysqltest1...
use test;
drop user mysqltest_4@'%';
drop database if exists mysqltest;
create database mysqltest;
show create database mysqltest;
Database	Create Database
mysqltest	CREATE DATABASE `mysqltest` DEFAULT CHARACTER SET = utf8mb4 REPLICA_NUM = 1
create table mysqltest.t1(a int);
insert into mysqltest.t1 values(1);
create user mysqltest_4@'%';
grant select on `mysqltest`.`t1` to mysqltest_4@'%';
show create database mysqltest;
Database	Create Database
mysqltest	CREATE DATABASE `mysqltest` DEFAULT CHARACTER SET = utf8mb4 REPLICA_NUM = 1
delete from mysql.user where user='mysqltest_4';
ERROR 0A000: DML operation on Virtual Table/Temporary Table not supported
delete from mysql.db where user='mysqltest_4';
ERROR 0A000: DML operation on Virtual Table/Temporary Table not supported
delete from mysql.tables_priv where user='mysqltest_4';
ERROR 42S02: Table 'mysql.tables_priv' doesn't exist
drop database mysqltest;
show plugins;
create database `mysqlttest\1`;
create table `mysqlttest\1`.`a\b` (a int);
show tables from `mysqlttest\1`;
Tables_in_mysqlttest\1
a\b
show fields from `mysqlttest\1`.`a\b`;
Field	Type	Null	Key	Default	Extra
a	int(11)	YES		NULL	
show columns from `a\b` from `mysqlttest\1`;
Field	Type	Null	Key	Default	Extra
a	int(11)	YES		NULL	
show keys from `mysqlttest\1`.`a\b`;
Table	Non_unique	Key_name	Seq_in_index	Column_name	Collation	Cardinality	Sub_part	Packed	Null	Index_type	Comment	Index_comment	Visible	Expression
drop table `mysqlttest\1`.`a\b`;
drop database `mysqlttest\1`;
show engine foobar status;
Type	Name	Status
show engine foobar logs;
ERROR 42000: You have an error in your SQL syntax; check the manual that corresponds to your OceanBase version for the right syntax to use near 'logs' at line 1
show engine foobar mutex;
Type	Name	Status
show engine mutex status;
Type	Name	Status
show engine csv status;
Type	Name	Status
show engine csv logs;
ERROR 42000: You have an error in your SQL syntax; check the manual that corresponds to your OceanBase version for the right syntax to use near 'logs' at line 1
show engine csv mutex;
Type	Name	Status
set names utf8;
drop table if exists `茅t茅`;
create table `茅t茅` (field1 int);
show full tables;
drop table `茅t茅`;
set names latin1;
#
# Bug#4374 SHOW TABLE STATUS FROM ignores collation_connection
# Character set: Latin-1 (ISO-8859-1)
#
SET NAMES latin1;
DROP DATABASE `鋊`;
CREATE DATABASE `鋊`;
CREATE TABLE `鋊`.`鋊` (a int) ENGINE=Memory;
Warnings:
Warning	1286	Unknown storage engine 'Memory'
SHOW TABLE STATUS FROM `鋊` LIKE '?';
Name	Engine	Version	Row_format	Rows	Avg_row_length	Data_length	Max_data_length	Index_length	Data_free	Auto_increment	Create_time	Update_time	Check_time	Collation	Checksum	Create_options	Comment
DROP DATABASE `鋊`;
show columns from `#mysql50#????????`;
Got one of the listed errors
DROP TABLE IF EXISTS t1;
DROP PROCEDURE IF EXISTS p1;
CREATE TABLE t1(c1 INT);
DROP trigger t1_bi;
CREATE TRIGGER t1_bi BEFORE INSERT ON t1 FOR EACH ROW SET @a = 1;
SHOW CREATE TRIGGER t1_bi;
Trigger	sql_mode	SQL Original Statement	character_set_client	collation_connection	Database Collation
t1_bi	STRICT_ALL_TABLES,NO_ZERO_IN_DATE	CREATE DEFINER = admin@% TRIGGER t1_bi BEFORE INSERT ON t1 FOR EACH ROW SET @a = 1	latin1	latin1	utf8mb4
CREATE PROCEDURE p1() SHOW CREATE TRIGGER t1_bi;
CALL p1();
Trigger	sql_mode	SQL Original Statement	character_set_client	collation_connection	Database Collation
t1_bi	STRICT_ALL_TABLES,NO_ZERO_IN_DATE	CREATE DEFINER = admin@% TRIGGER t1_bi BEFORE INSERT ON t1 FOR EACH ROW SET @a = 1	latin1	latin1	utf8mb4
CALL p1();
Trigger	sql_mode	SQL Original Statement	character_set_client	collation_connection	Database Collation
t1_bi	STRICT_ALL_TABLES,NO_ZERO_IN_DATE	CREATE DEFINER = admin@% TRIGGER t1_bi BEFORE INSERT ON t1 FOR EACH ROW SET @a = 1	latin1	latin1	utf8mb4
CALL p1();
Trigger	sql_mode	SQL Original Statement	character_set_client	collation_connection	Database Collation
t1_bi	STRICT_ALL_TABLES,NO_ZERO_IN_DATE	CREATE DEFINER = admin@% TRIGGER t1_bi BEFORE INSERT ON t1 FOR EACH ROW SET @a = 1	latin1	latin1	utf8mb4
CALL p1();
Trigger	sql_mode	SQL Original Statement	character_set_client	collation_connection	Database Collation
t1_bi	STRICT_ALL_TABLES,NO_ZERO_IN_DATE	CREATE DEFINER = admin@% TRIGGER t1_bi BEFORE INSERT ON t1 FOR EACH ROW SET @a = 1	latin1	latin1	utf8mb4
CALL p1();
Trigger	sql_mode	SQL Original Statement	character_set_client	collation_connection	Database Collation
t1_bi	STRICT_ALL_TABLES,NO_ZERO_IN_DATE	CREATE DEFINER = admin@% TRIGGER t1_bi BEFORE INSERT ON t1 FOR EACH ROW SET @a = 1	latin1	latin1	utf8mb4
CALL p1();
Trigger	sql_mode	SQL Original Statement	character_set_client	collation_connection	Database Collation
t1_bi	STRICT_ALL_TABLES,NO_ZERO_IN_DATE	CREATE DEFINER = admin@% TRIGGER t1_bi BEFORE INSERT ON t1 FOR EACH ROW SET @a = 1	latin1	latin1	utf8mb4
CALL p1();
Trigger	sql_mode	SQL Original Statement	character_set_client	collation_connection	Database Collation
t1_bi	STRICT_ALL_TABLES,NO_ZERO_IN_DATE	CREATE DEFINER = admin@% TRIGGER t1_bi BEFORE INSERT ON t1 FOR EACH ROW SET @a = 1	latin1	latin1	utf8mb4
CALL p1();
Trigger	sql_mode	SQL Original Statement	character_set_client	collation_connection	Database Collation
t1_bi	STRICT_ALL_TABLES,NO_ZERO_IN_DATE	CREATE DEFINER = admin@% TRIGGER t1_bi BEFORE INSERT ON t1 FOR EACH ROW SET @a = 1	latin1	latin1	utf8mb4
CALL p1();
Trigger	sql_mode	SQL Original Statement	character_set_client	collation_connection	Database Collation
t1_bi	STRICT_ALL_TABLES,NO_ZERO_IN_DATE	CREATE DEFINER = admin@% TRIGGER t1_bi BEFORE INSERT ON t1 FOR EACH ROW SET @a = 1	latin1	latin1	utf8mb4
CALL p1();
Trigger	sql_mode	SQL Original Statement	character_set_client	collation_connection	Database Collation
t1_bi	STRICT_ALL_TABLES,NO_ZERO_IN_DATE	CREATE DEFINER = admin@% TRIGGER t1_bi BEFORE INSERT ON t1 FOR EACH ROW SET @a = 1	latin1	latin1	utf8mb4
PREPARE stmt1 FROM 'SHOW CREATE TRIGGER t1_bi';
EXECUTE stmt1;
Trigger	sql_mode	SQL Original Statement	character_set_client	collation_connection	Database Collation
t1_bi	STRICT_ALL_TABLES,NO_ZERO_IN_DATE	CREATE DEFINER = admin@% TRIGGER t1_bi BEFORE INSERT ON t1 FOR EACH ROW SET @a = 1	latin1	latin1	utf8mb4
EXECUTE stmt1;
Trigger	sql_mode	SQL Original Statement	character_set_client	collation_connection	Database Collation
t1_bi	STRICT_ALL_TABLES,NO_ZERO_IN_DATE	CREATE DEFINER = admin@% TRIGGER t1_bi BEFORE INSERT ON t1 FOR EACH ROW SET @a = 1	latin1	latin1	utf8mb4
EXECUTE stmt1;
Trigger	sql_mode	SQL Original Statement	character_set_client	collation_connection	Database Collation
t1_bi	STRICT_ALL_TABLES,NO_ZERO_IN_DATE	CREATE DEFINER = admin@% TRIGGER t1_bi BEFORE INSERT ON t1 FOR EACH ROW SET @a = 1	latin1	latin1	utf8mb4
EXECUTE stmt1;
Trigger	sql_mode	SQL Original Statement	character_set_client	collation_connection	Database Collation
t1_bi	STRICT_ALL_TABLES,NO_ZERO_IN_DATE	CREATE DEFINER = admin@% TRIGGER t1_bi BEFORE INSERT ON t1 FOR EACH ROW SET @a = 1	latin1	latin1	utf8mb4
EXECUTE stmt1;
Trigger	sql_mode	SQL Original Statement	character_set_client	collation_connection	Database Collation
t1_bi	STRICT_ALL_TABLES,NO_ZERO_IN_DATE	CREATE DEFINER = admin@% TRIGGER t1_bi BEFORE INSERT ON t1 FOR EACH ROW SET @a = 1	latin1	latin1	utf8mb4
EXECUTE stmt1;
Trigger	sql_mode	SQL Original Statement	character_set_client	collation_connection	Database Collation
t1_bi	STRICT_ALL_TABLES,NO_ZERO_IN_DATE	CREATE DEFINER = admin@% TRIGGER t1_bi BEFORE INSERT ON t1 FOR EACH ROW SET @a = 1	latin1	latin1	utf8mb4
EXECUTE stmt1;
Trigger	sql_mode	SQL Original Statement	character_set_client	collation_connection	Database Collation
t1_bi	STRICT_ALL_TABLES,NO_ZERO_IN_DATE	CREATE DEFINER = admin@% TRIGGER t1_bi BEFORE INSERT ON t1 FOR EACH ROW SET @a = 1	latin1	latin1	utf8mb4
EXECUTE stmt1;
Trigger	sql_mode	SQL Original Statement	character_set_client	collation_connection	Database Collation
t1_bi	STRICT_ALL_TABLES,NO_ZERO_IN_DATE	CREATE DEFINER = admin@% TRIGGER t1_bi BEFORE INSERT ON t1 FOR EACH ROW SET @a = 1	latin1	latin1	utf8mb4
EXECUTE stmt1;
Trigger	sql_mode	SQL Original Statement	character_set_client	collation_connection	Database Collation
t1_bi	STRICT_ALL_TABLES,NO_ZERO_IN_DATE	CREATE DEFINER = admin@% TRIGGER t1_bi BEFORE INSERT ON t1 FOR EACH ROW SET @a = 1	latin1	latin1	utf8mb4
EXECUTE stmt1;
Trigger	sql_mode	SQL Original Statement	character_set_client	collation_connection	Database Collation
t1_bi	STRICT_ALL_TABLES,NO_ZERO_IN_DATE	CREATE DEFINER = admin@% TRIGGER t1_bi BEFORE INSERT ON t1 FOR EACH ROW SET @a = 1	latin1	latin1	utf8mb4
DROP TABLE t1;
DROP PROCEDURE p1;
DEALLOCATE PREPARE stmt1;
set names koi8r;
ERROR 42000: Unknown character set: 'koi8r'
DROP VIEW IF EXISTS v1;
DROP PROCEDURE IF EXISTS p1;
DROP FUNCTION IF EXISTS f1;
DROP TABLE IF EXISTS t1;
CREATE VIEW v1 AS SELECT '耘釉' AS test;
CREATE PROCEDURE p1() SELECT '耘釉' AS test;
CREATE FUNCTION f1() RETURNS CHAR(10) RETURN '耘釉';
CREATE TABLE t1(c1 CHAR(10));
CREATE TRIGGER t1_bi BEFORE INSERT ON t1
FOR EACH ROW
SET NEW.c1 = '耘釉';
set names utf8;
SHOW CREATE TRIGGER t1_bi;
Trigger	sql_mode	SQL Original Statement	character_set_client	collation_connection	Database Collation
t1_bi	STRICT_ALL_TABLES,NO_ZERO_IN_DATE	CREATE DEFINER = admin@% TRIGGER t1_bi BEFORE INSERT ON t1
FOR EACH ROW
SET NEW.c1 = 'è€˜é‡‰'	latin1	latin1	utf8mb4
DROP VIEW v1;
DROP PROCEDURE p1;
DROP FUNCTION f1;
DROP TABLE t1;
SHOW STORAGE ENGINES;
drop user test_u@'%';
CREATE USER test_u@'%';
GRANT PROCESS ON *.* TO test_u;
grant all on `test`.* to test_u WITH GRANT OPTION;
SHOW ENGINE MYISAM MUTEX;
SHOW ENGINE MYISAM STATUS;
DROP USER test_u@'%';
#
# Bug #48985: show create table crashes if previous access to the table
#    was killed
#
SHOW CREATE TABLE non_existent;
ERROR 42S02: Table 'test.non_existent' doesn't exist
End of 5.1 tests
#
# Bug#52593 SHOW CREATE TABLE is blocked if table is locked
#           for write by another connection
DROP TABLE IF EXISTS t1;
CREATE TABLE t1 (i INT PRIMARY KEY);
LOCK TABLE t1 WRITE;
# Switching to connection 'con1'.
# This statement used to be blocked.
# Switching to connection 'default'.
UNLOCK TABLES;
DROP TABLE t1;
#
# Bug#54905 Connection with WRITE lock cannot ALTER table due to
#           concurrent SHOW CREATE
#
DROP TABLE IF EXISTS t1;
CREATE TABLE t1(a INT);
# Connection con1
LOCK TABLE t1 WRITE;
# Connection default
START TRANSACTION;
# Connection con1
ALTER TABLE t1 CHARACTER SET = utf8;
UNLOCK TABLES;
# Connection default
COMMIT;
DROP TABLE t1;
#
# Bug#55498 SHOW CREATE TRIGGER takes wrong type of metadata lock.
#
DROP TABLE IF EXISTS t1;
CREATE TABLE t1 (a INT);
CREATE TRIGGER t1_bi BEFORE INSERT ON t1 FOR EACH ROW SET new.a = 1;
# Test 1: SHOW CREATE TRIGGER with WRITE locked table.
# Connection con1
LOCK TABLE t1 WRITE;
# Connection default
SHOW CREATE TRIGGER t1_bi;
Trigger	sql_mode	SQL Original Statement	character_set_client	collation_connection	Database Collation
t1_bi	STRICT_ALL_TABLES,NO_ZERO_IN_DATE	CREATE DEFINER = admin@% TRIGGER t1_bi BEFORE INSERT ON t1 FOR EACH ROW SET new.a = 1	utf8mb4	utf8mb4	utf8mb4
# Connection con1
UNLOCK TABLES;
# Test 2: ALTER TABLE with SHOW CREATE TRIGGER in transaction
# Connection default
START TRANSACTION;
SHOW CREATE TRIGGER t1_bi;
Trigger	sql_mode	SQL Original Statement	character_set_client	collation_connection	Database Collation
t1_bi	STRICT_ALL_TABLES,NO_ZERO_IN_DATE	CREATE DEFINER = admin@% TRIGGER t1_bi BEFORE INSERT ON t1 FOR EACH ROW SET new.a = 1	utf8mb4	utf8mb4	utf8mb4
# Connection con1
ALTER TABLE t1 CHARACTER SET = utf8;
# Connection default
COMMIT;
DROP TRIGGER t1_bi;
DROP TABLE t1;
#
# Bug#57306 SHOW PROCESSLIST does not display string literals well.
#
SET NAMES latin1;
SELECT GET_LOCK('t', 1000);
GET_LOCK('t', 1000)
1
SET NAMES latin1;
SELECT GET_LOCK('t',1000) AS '贸贸贸贸';;
SHOW PROCESSLIST;
SET NAMES utf8;
SHOW PROCESSLIST;
SELECT RELEASE_LOCK('t');
RELEASE_LOCK('t')
1
SET NAMES latin1;
#
# Bug#58996 SHOW CREATE TRIGGER fails when subject table is shadowed by
#           a temporary table.
#
DROP TABLE IF EXISTS t1;
CREATE TABLE t1 (a INT);
CREATE TRIGGER t1_bi BEFORE INSERT ON t1 FOR EACH ROW BEGIN END;
SHOW CREATE TRIGGER t1_bi;
Trigger	sql_mode	SQL Original Statement	character_set_client	collation_connection	Database Collation
t1_bi	STRICT_ALL_TABLES,NO_ZERO_IN_DATE	CREATE DEFINER = admin@% TRIGGER t1_bi BEFORE INSERT ON t1 FOR EACH ROW BEGIN END	latin1	latin1	utf8mb4
#
# WL#6454: Deprecate SHOW AUTHORS and SHOW CONTRIBUTORS
#
# These statements were deprecated in 5.5 and removed in 5.6.
# They should therefore give ER_PARSE_ERROR here.
SHOW AUTHORS;
ERROR 42000: You have an error in your SQL syntax; check the manual that corresponds to your OceanBase version for the right syntax to use near 'AUTHORS' at line 1
SHOW CONTRIBUTORS;
ERROR 42000: You have an error in your SQL syntax; check the manual that corresponds to your OceanBase version for the right syntax to use near 'CONTRIBUTORS' at line 1
#
# Bug#20709462: GENERATED COLUMNS NOT PRINTED CORRECTLY IN
#               SHOW CREATE TABLE
#
DROP TABLE t1;
CREATE TABLE t1 (i CHAR(3),
n CHAR(20) CHARACTER SET utf8 GENERATED ALWAYS AS (md5(i)));
# Use SHOW CREATE TABLE output below unmodified to re-create table
DROP TABLE t1;
CREATE TABLE `t1` (
`i` char(3) DEFAULT NULL,
`n` char(20) CHARACTER SET utf8 GENERATED ALWAYS AS (md5(i)) VIRTUAL
) ENGINE=InnoDB DEFAULT CHARSET=latin1;
Warnings:
Warning	1286	Unknown storage engine 'InnoDB'
DROP TABLE t1;
#
# Bug#24800048 - SHOW TABLES FROM DATABASE HANGS ON WINDOWS PLATFORM
#
CREATE DATABASE unknown;
# On case sensitive file system following statement fails as DB name
# is in different case. Following statement works fine on case insensitive
# file systems.
SHOW TABLES FROM UNKNOWN;
Tables_in_UNKNOWN
# On case sensitive file system following statement fails as DB name
# is in different case. Following statement works fine on case insensitive
# file systems.
# Without fix following SHOW TABLES statements hangs in Windows (with
# lower_case_table_names=1).
SHOW TABLES FROM UNKNOWN;
Tables_in_UNKNOWN
DROP DATABASE unknown;
#
# WL#9570 -  Extend SHOW statements to list hidden columns and index
#            information.
#
#            Test case to verify hidden columns, index and index elements
#            display in INFORMATION_SCHEMA queries and SHOW statements.
#            EXPECTATION: INFORMATION_SCHEMA.COLUMNS/STATISTICS*/KEY_COLUMN_USAGE
#                         SHOW [FULL] COLUMNS and SHOW INDEX should not display
#                         hidden columns, indexes and index elements.
#                         SHOW EXTENED [FULL] COLUMNS and SHOW EXTENDED INDEX
#                         should display hidden columns, index and index elements
#                         too.
#
#
CREATE TABLE t1 (c1 int(11) NOT NULL,
c2 int(11) DEFAULT NULL,
c3 text,
PRIMARY KEY (c1));
CREATE INDEX c2d ON t1(c2);
# With fix, following statements should not show the hidden columns.
SHOW COLUMNS FROM t1;
Field	Type	Null	Key	Default	Extra
c1	int(11)	#	#	#	#
c2	int(11)	#	#	#	#
c3	text	#	#	#	#
SHOW FULL COLUMNS FROM t1;
Field	Type	Collation	Null	Key	Default	Extra	Privileges	Comment
c1	int(11)	#	#	#	#	#	#	#
c2	int(11)	#	#	#	#	#	#	#
c3	text	#	#	#	#	#	#	#
SELECT table_name, column_name, column_type FROM
INFORMATION_SCHEMA.COLUMNS WHERE table_name='t1' and TABLE_SCHEMA = database();
table_name	column_name	column_type
t1	c1	int(11)
t1	c2	int(11)
t1	c3	text
# EXTENDED keyword is introduced to list the hidden columns.
SHOW EXTENDED COLUMNS FROM t1;
Field	Type	Null	Key	Default	Extra
c1	int(11)	#	#	#	#
c2	int(11)	#	#	#	#
c3	text	#	#	#	#
SHOW EXTENDED FULL COLUMNS FROM t1;
Field	Type	Collation	Null	Key	Default	Extra	Privileges	Comment
c1	int(11)	#	#	#	#	#	#	#
c2	int(11)	#	#	#	#	#	#	#
c3	text	#	#	#	#	#	#	#
# With fix, following statements should not show the hidden index and
# index columns.
SHOW INDEX FROM t1;
Table	Non_unique	Key_name	Seq_in_index	Column_name	Collation	Cardinality	Sub_part	Packed	Null	Index_type	Comment	Index_comment	Visible	Expression
t1	0	PRIMARY	1	c1	A	NULL	NULL	NULL		BTREE	available		YES	NULL
t1	1	c2d	1	c2	A	NULL	NULL	NULL	YES	BTREE	available		YES	NULL
SELECT table_schema, table_name, index_name, column_name FROM
INFORMATION_SCHEMA.STATISTICS WHERE table_name='t1' and TABLE_SCHEMA = database();
table_schema	table_name	index_name	column_name
test	t1	PRIMARY	c1
test	t1	c2d	c2
SELECT constraint_schema, constraint_name, table_name, column_name FROM
INFORMATION_SCHEMA.KEY_COLUMN_USAGE WHERE table_name='t1' and TABLE_SCHEMA = database();
constraint_schema	constraint_name	table_name	column_name
test	PRIMARY	t1	c1
# EXTENDED keyword is introduced to list the hidden index and index
# columns.
SHOW EXTENDED INDEX FROM t1;
Table	Non_unique	Key_name	Seq_in_index	Column_name	Collation	Cardinality	Sub_part	Packed	Null	Index_type	Comment	Index_comment	Visible	Expression
t1	0	PRIMARY	1	c1	A	NULL	NULL	NULL		BTREE	available		YES	NULL
t1	0	PRIMARY	2	c2	A	NULL	NULL	NULL		BTREE	available		YES	NULL
t1	0	PRIMARY	3	c3	A	NULL	NULL	NULL		BTREE	available		YES	NULL
t1	1	c2d	1	c2	A	NULL	NULL	NULL	YES	BTREE	available		YES	NULL
t1	1	c2d	2	c1	A	NULL	NULL	NULL		BTREE	available		YES	NULL
DROP TABLE t1;
#
# Bug#27387773 COLUMN OPTION FOR DESCRIBE IS IGNORED
#
#
# Bug#11754608 MYSQL DOESN'T SHOW WHAT COLLATION WAS USED IF THAT
# COLLATION IS THE DEFAU
#
CREATE TABLE t1 (f1 CHAR(1),
f2 CHAR(1) COLLATE UTF8_BIN,
f3 CHAR(1),
f4 CHAR(1) CHARSET UTF8MB4);
# The SHOW command should show the utf8mb4 charset for f4 after ALTER.
ALTER TABLE t1 ADD COLUMN f5 CHAR(1);
ALTER TABLE t1 ADD COLUMN f6 CHAR(1) CHARSET UTF8MB4;
# The SHOW command should show the utf8mb4 charset for f6 after ALTER.
# Check if we retain the property after CREATE SELECT.
CREATE TABLE t2 AS SELECT * FROM t1;
SHOW CREATE TABLE t2;
Table	Create Table
t2	CREATE TABLE `t2` (
  `f1` char(1) DEFAULT NULL,
  `f2` char(1) CHARACTER SET utf8mb4 COLLATE utf8mb4_bin DEFAULT NULL,
  `f3` char(1) DEFAULT NULL,
  `f4` char(1) DEFAULT NULL,
  `f5` char(1) DEFAULT NULL,
  `f6` char(1) DEFAULT NULL
) ORGANIZATION INDEX DEFAULT CHARSET = utf8mb4 ROW_FORMAT = DYNAMIC COMPRESSION = 'zstd_1.3.8' REPLICA_NUM = 1 BLOCK_SIZE = 16384 USE_BLOOM_FILTER = FALSE ENABLE_MACRO_BLOCK_BLOOM_FILTER = FALSE TABLET_SIZE = 134217728 PCTFREE = 0
# Check if we retain the property after CREATE LIKE.
CREATE TABLE t3 LIKE t1;
SHOW CREATE TABLE t3;
Table	Create Table
t3	CREATE TABLE `t3` (
  `f1` char(1) DEFAULT NULL,
  `f2` char(1) CHARACTER SET utf8mb4 COLLATE utf8mb4_bin DEFAULT NULL,
  `f3` char(1) DEFAULT NULL,
  `f4` char(1) DEFAULT NULL,
  `f5` char(1) DEFAULT NULL,
  `f6` char(1) DEFAULT NULL
) ORGANIZATION INDEX DEFAULT CHARSET = utf8mb4 ROW_FORMAT = DYNAMIC COMPRESSION = 'zstd_1.3.8' REPLICA_NUM = 1 BLOCK_SIZE = 16384 USE_BLOOM_FILTER = FALSE ENABLE_MACRO_BLOCK_BLOOM_FILTER = FALSE TABLET_SIZE = 134217728 PCTFREE = 0
DROP TABLE t1;
DROP TABLE t2;
DROP TABLE t3;
SET @@global.log_output = @old_log_output;
Warnings:
Warning	1235	This system variable now is mock not supported
TRUNCATE TABLE mysql.general_log;
ERROR 42S02: Table 'mysql.general_log' doesn't exist
TRUNCATE TABLE mysql.slow_log;
ERROR 42S02: Table 'mysql.slow_log' doesn't exist
