drop table if exists t1, t2;
create table t1(a int) engine=innodb;
Warnings:
Warning	1286	Unknown storage engine 'innodb'
create table t2(a int) engine=innodb;
Warnings:
Warning	1286	Unknown storage engine 'innodb'
insert into t1 values(10),(11),(12),(13),(14),(15),(16);
insert into t2 values(100),(11),(120);
explain format=json update t1 set t1.a=3 where a=(select a from t2);
explain update t1 set t1.a=3 where a=(select a from t2);
explain format=json delete from t1 where a=(select a from t2);
explain delete from t1 where a=(select a from t2);
# This line exists only to help #--skip_if_hypergraph diffing.
explain update t1 set t1.a=3 where a in (select a from t2);
update t1 set t1.a=3 where a in (select a from t2);
select * from t1;
a
10
12
13
14
15
16
3
delete from t1;
insert into t1 values(10),(11),(12),(13),(14),(15),(16);
explain delete from t1 where a in (select a from t2);
delete from t1 where a in (select a from t2);
select * from t1;
a
10
12
13
14
15
16
delete from t1;
insert into t1 values(10),(11),(12),(13),(14),(15),(16);
explain update t1 set t1.a=3 where a in (select /*+ no_semijoin() */ a from t2);
explain delete from t1 where a in (select /*+ no_semijoin() */ a from t2);
delete from t1;
insert into t1 values(10),(11),(12);
explain update t1 set t1.a=3 where a in (select /*+ no_semijoin() */ a from t2);
explain delete from t1 where a in (select /*+ no_semijoin() */ a from t2);
delete from t1;
insert into t1 values(10),(11),(12),(13),(14),(15),(16);
explain format=json update t1 set t1.a=3 where a in (select /*+ subquery(intoexists) */ a from t2);
explain update t1 set t1.a=3 where a in (select /*+ subquery(intoexists) */ a from t2);
explain format=json delete from t1 where a in (select /*+ subquery(intoexists) */ a from t2);
explain delete from t1 where a in (select /*+ subquery(intoexists) */ a from t2);
set optimizer_switch='semijoin=off,materialization=off';
explain format=json update t1 set t1.a=3 where a in (select a from t2);
explain format=json delete from t1 where a in (select a from t2);
set optimizer_switch=default;
alter table t1 engine=myisam;
Warnings:
Warning	1286	Unknown storage engine 'myisam'
alter table t2 engine=myisam;
Warnings:
Warning	1286	Unknown storage engine 'myisam'
explain update t1 set t1.a=3 where a in (select a from t2);
update t1 set t1.a=3 where a in (select a from t2);
select * from t1;
a
10
12
13
14
15
16
3
delete from t1;
insert into t1 values(10),(11),(12),(13),(14),(15),(16);
explain delete from t1 where a in (select a from t2);
delete from t1 where a in (select a from t2);
select * from t1;
a
10
12
13
14
15
16
delete from t1;
insert into t1 values(10),(11),(12),(13),(14),(15),(16);
alter table t1 engine=memory;
Warnings:
Warning	1286	Unknown storage engine 'memory'
alter table t2 engine=memory;
Warnings:
Warning	1286	Unknown storage engine 'memory'
explain update t1 set t1.a=3 where a in (select a from t2);
update t1 set t1.a=3 where a in (select a from t2);
select * from t1;
a
10
12
13
14
15
16
3
delete from t1;
insert into t1 values(10),(11),(12),(13),(14),(15),(16);
explain delete from t1 where a in (select a from t2);
delete from t1 where a in (select a from t2);
select * from t1;
a
10
12
13
14
15
16
delete from t1;
insert into t1 values(10),(11),(12),(13),(14),(15),(16);
alter table t1 engine=innodb;
Warnings:
Warning	1286	Unknown storage engine 'innodb'
set transaction isolation level repeatable read;
explain update t1 set t1.a=3 where a in (select a from t2);
set transaction isolation level read committed;
explain update t1 set t1.a=3 where a in (select a from t2);
alter table t1 engine=myisam;
explain update t1 set t1.a=3 where a in (select a from t2);
drop table t1,t2;
