SET SESSION windowing_use_high_precision=FALSE;
ERROR HY000: Unknown system variable 'windowing_use_high_precision'
DROP TABLE t;
CREATE TABLE t(i INT, li BIGINT, b VARBINARY(8), lb VARBINARY(24), d DOUBLE GENERATED ALWAYS AS (i*1.0));
INSERT INTO t(i, li, b, lb) VALUES
(NULL, NULL, NULL, NULL),
(0, 0, X'0000000000000000',
X'000000000000000000000000000000000000000000000000'),
(0, 0, X'0000000000000000',
X'000000000000000000000000000000000000000000000000'),
(1, 1, X'0000000000000001',
X'000000000000000000000000000000000000000000000001'),
(1, 1, X'0000000000000001',
X'000000000000000000000000000000000000000000000001'),
(2, 2, X'0000000000000002',
X'000000000000000000000000000000000000000000000002'),
(2, 2, X'0000000000000002',
X'000000000000000000000000000000000000000000000002'),
(3, 3, X'0000000000000003',
X'000000000000000000000000000000000000000000000003'),
(3, 3, X'0000000000000003',
X'000000000000000000000000000000000000000000000003'),
(4, 4, X'0000000000000004',
X'000000000000000000000000000000000000000000000004'),
(4, 4, X'0000000000000004',
X'000000000000000000000000000000000000000000000004'),
(5, 5, X'0000000000000005',
X'000000000000000000000000000000000000000000000005'),
(6, 6, X'0000000000000006',
X'000000000000000000000000000000000000000000000006'),
(X'01234567', X'0123456789ABCDEF', X'0123456789ABCDEF',
X'000000000000000000000000000000000123456789ABCDEF'),
(X'01200567', X'0120056789ABCDEF', X'0120056789ABCDEF',
X'0120056789ABCDEF0120056789ABCDEF0120056789ABCDEF'),
(X'01200567', X'0120056789ABCDEF', X'0120056789ABCDEF',
X'0120056789ABCDEF0120056789ABCDEF0120056789ABCDEF'),
(X'01200117', X'0120011789ABCDEF', X'0120011789ABCDEF',
X'0120011789ABCDEF0120011789ABCDEF0120011789ABCDEF');
Ascending
SELECT HEX(i), HEX(li), HEX(b), HEX(lb),
HEX(BIT_OR(i) OVER w), HEX(BIT_OR(li) OVER w),
HEX(BIT_OR(b) OVER w), HEX(BIT_OR(lb) OVER w),
SUM(d) OVER w AS dsum
FROM t
WINDOW w AS (ORDER BY i ROWS 2 PRECEDING);
HEX(i)	HEX(li)	HEX(b)	HEX(lb)	HEX(BIT_OR(i) OVER w)	HEX(BIT_OR(li) OVER w)	HEX(BIT_OR(b) OVER w)	HEX(BIT_OR(lb) OVER w)	dsum
NULL	NULL	NULL	NULL	0	0	0	0	NULL
0	0	0000000000000000	000000000000000000000000000000000000000000000000	0	0	0	0	0
0	0	0000000000000000	000000000000000000000000000000000000000000000000	0	0	0	0	0
1	1	0000000000000001	000000000000000000000000000000000000000000000001	1	1	0	0	1
1	1	0000000000000001	000000000000000000000000000000000000000000000001	1	1	0	0	2
2	2	0000000000000002	000000000000000000000000000000000000000000000002	3	3	0	0	4
2	2	0000000000000002	000000000000000000000000000000000000000000000002	3	3	0	0	5
3	3	0000000000000003	000000000000000000000000000000000000000000000003	3	3	0	0	7
3	3	0000000000000003	000000000000000000000000000000000000000000000003	3	3	0	0	8
4	4	0000000000000004	000000000000000000000000000000000000000000000004	7	7	0	0	10
4	4	0000000000000004	000000000000000000000000000000000000000000000004	7	7	0	0	11
5	5	0000000000000005	000000000000000000000000000000000000000000000005	5	5	0	0	13
6	6	0000000000000006	000000000000000000000000000000000000000000000006	7	7	0	0	15
1200117	120011789ABCDEF	0120011789ABCDEF	0120011789ABCDEF0120011789ABCDEF0120011789ABCDEF	1200117	120011789ABCDEF	0	0	18874658
1200567	120056789ABCDEF	0120056789ABCDEF	0120056789ABCDEF0120056789ABCDEF0120056789ABCDEF	1200577	120057789ABCDEF	0	0	37750404
1200567	120056789ABCDEF	0120056789ABCDEF	0120056789ABCDEF0120056789ABCDEF0120056789ABCDEF	1200577	120057789ABCDEF	0	0	56626149
1234567	123456789ABCDEF	0123456789ABCDEF	000000000000000000000000000000000123456789ABCDEF	1234567	123456789ABCDEF	0	0	56840245
Show whether we run in optimized or non-optimized mode, cf.
our dummy double d SUM which forces non-optimized mode
iff windowing_use_high_precision==TRUE
EXPLAIN FORMAT=JSON
SELECT HEX(i), HEX(li), HEX(b), HEX(lb),
HEX(BIT_OR(i) OVER w), HEX(BIT_OR(li) OVER w),
HEX(BIT_OR(b) OVER w), HEX(BIT_OR(lb) OVER w),
SUM(d) OVER w AS dsum
FROM t
WINDOW w AS (ORDER BY i ROWS 2 PRECEDING);
SELECT HEX(i), HEX(li), HEX(b), HEX(lb),
HEX(BIT_XOR(i) OVER w), HEX(BIT_XOR(li) OVER w),
HEX(BIT_XOR(b) OVER w), HEX(BIT_XOR(lb) OVER w),
SUM(d) OVER w AS dsum
FROM t
WINDOW w AS (ORDER BY i ROWS 2 PRECEDING);
HEX(i)	HEX(li)	HEX(b)	HEX(lb)	HEX(BIT_XOR(i) OVER w)	HEX(BIT_XOR(li) OVER w)	HEX(BIT_XOR(b) OVER w)	HEX(BIT_XOR(lb) OVER w)	dsum
NULL	NULL	NULL	NULL	0	0	0	0	NULL
0	0	0000000000000000	000000000000000000000000000000000000000000000000	0	0	0	0	0
0	0	0000000000000000	000000000000000000000000000000000000000000000000	0	0	0	0	0
1	1	0000000000000001	000000000000000000000000000000000000000000000001	1	1	0	0	1
1	1	0000000000000001	000000000000000000000000000000000000000000000001	0	0	0	0	2
2	2	0000000000000002	000000000000000000000000000000000000000000000002	2	2	0	0	4
2	2	0000000000000002	000000000000000000000000000000000000000000000002	1	1	0	0	5
3	3	0000000000000003	000000000000000000000000000000000000000000000003	3	3	0	0	7
3	3	0000000000000003	000000000000000000000000000000000000000000000003	2	2	0	0	8
4	4	0000000000000004	000000000000000000000000000000000000000000000004	4	4	0	0	10
4	4	0000000000000004	000000000000000000000000000000000000000000000004	3	3	0	0	11
5	5	0000000000000005	000000000000000000000000000000000000000000000005	5	5	0	0	13
6	6	0000000000000006	000000000000000000000000000000000000000000000006	7	7	0	0	15
1200117	120011789ABCDEF	0120011789ABCDEF	0120011789ABCDEF0120011789ABCDEF0120011789ABCDEF	1200114	120011789ABCDEC	0	0	18874658
1200567	120056789ABCDEF	0120056789ABCDEF	0120056789ABCDEF0120056789ABCDEF0120056789ABCDEF	476	47000000006	0	0	37750404
1200567	120056789ABCDEF	0120056789ABCDEF	0120056789ABCDEF0120056789ABCDEF0120056789ABCDEF	1200117	120011789ABCDEF	0	0	56626149
1234567	123456789ABCDEF	0123456789ABCDEF	000000000000000000000000000000000123456789ABCDEF	1234567	123456789ABCDEF	0	0	56840245
SELECT HEX(i), HEX(li), HEX(b), HEX(lb),
HEX(BIT_AND(i) OVER w), HEX(BIT_AND(li) OVER w),
HEX(BIT_AND(b) OVER w), HEX(BIT_AND(lb) OVER w),
SUM(d) OVER w AS dsum
FROM t
WINDOW w AS (ORDER BY i ROWS 2 PRECEDING);
HEX(i)	HEX(li)	HEX(b)	HEX(lb)	HEX(BIT_AND(i) OVER w)	HEX(BIT_AND(li) OVER w)	HEX(BIT_AND(b) OVER w)	HEX(BIT_AND(lb) OVER w)	dsum
NULL	NULL	NULL	NULL	FFFFFFFFFFFFFFFF	FFFFFFFFFFFFFFFF	FFFFFFFFFFFFFFFF	FFFFFFFFFFFFFFFF	NULL
0	0	0000000000000000	000000000000000000000000000000000000000000000000	0	0	0	0	0
0	0	0000000000000000	000000000000000000000000000000000000000000000000	0	0	0	0	0
1	1	0000000000000001	000000000000000000000000000000000000000000000001	0	0	0	0	1
1	1	0000000000000001	000000000000000000000000000000000000000000000001	0	0	0	0	2
2	2	0000000000000002	000000000000000000000000000000000000000000000002	0	0	0	0	4
2	2	0000000000000002	000000000000000000000000000000000000000000000002	0	0	0	0	5
3	3	0000000000000003	000000000000000000000000000000000000000000000003	2	2	0	0	7
3	3	0000000000000003	000000000000000000000000000000000000000000000003	2	2	0	0	8
4	4	0000000000000004	000000000000000000000000000000000000000000000004	0	0	0	0	10
4	4	0000000000000004	000000000000000000000000000000000000000000000004	0	0	0	0	11
5	5	0000000000000005	000000000000000000000000000000000000000000000005	4	4	0	0	13
6	6	0000000000000006	000000000000000000000000000000000000000000000006	4	4	0	0	15
1200117	120011789ABCDEF	0120011789ABCDEF	0120011789ABCDEF0120011789ABCDEF0120011789ABCDEF	4	4	0	0	18874658
1200567	120056789ABCDEF	0120056789ABCDEF	0120056789ABCDEF0120056789ABCDEF0120056789ABCDEF	6	6	0	0	37750404
1200567	120056789ABCDEF	0120056789ABCDEF	0120056789ABCDEF0120056789ABCDEF0120056789ABCDEF	1200107	120010789ABCDEF	0	0	56626149
1234567	123456789ABCDEF	0123456789ABCDEF	000000000000000000000000000000000123456789ABCDEF	1200567	120056789ABCDEF	0	0	56840245
Descending: NULLS last
SELECT HEX(i), HEX(li), HEX(b), HEX(lb),
HEX(BIT_OR(i) OVER w), HEX(BIT_OR(li) OVER w),
HEX(BIT_OR(b) OVER w), HEX(BIT_OR(lb) OVER w),
SUM(d) OVER w AS dsum
FROM t
WINDOW w AS (ORDER BY i DESC ROWS BETWEEN CURRENT ROW AND 2 FOLLOWING);
HEX(i)	HEX(li)	HEX(b)	HEX(lb)	HEX(BIT_OR(i) OVER w)	HEX(BIT_OR(li) OVER w)	HEX(BIT_OR(b) OVER w)	HEX(BIT_OR(lb) OVER w)	dsum
1234567	123456789ABCDEF	0123456789ABCDEF	000000000000000000000000000000000123456789ABCDEF	1234567	123456789ABCDEF	0	0	56840245
1200567	120056789ABCDEF	0120056789ABCDEF	0120056789ABCDEF0120056789ABCDEF0120056789ABCDEF	1200577	120057789ABCDEF	0	0	56626149
1200567	120056789ABCDEF	0120056789ABCDEF	0120056789ABCDEF0120056789ABCDEF0120056789ABCDEF	1200577	120057789ABCDEF	0	0	37750404
1200117	120011789ABCDEF	0120011789ABCDEF	0120011789ABCDEF0120011789ABCDEF0120011789ABCDEF	1200117	120011789ABCDEF	0	0	18874658
6	6	0000000000000006	000000000000000000000000000000000000000000000006	7	7	0	0	15
5	5	0000000000000005	000000000000000000000000000000000000000000000005	5	5	0	0	13
4	4	0000000000000004	000000000000000000000000000000000000000000000004	7	7	0	0	11
4	4	0000000000000004	000000000000000000000000000000000000000000000004	7	7	0	0	10
3	3	0000000000000003	000000000000000000000000000000000000000000000003	3	3	0	0	8
3	3	0000000000000003	000000000000000000000000000000000000000000000003	3	3	0	0	7
2	2	0000000000000002	000000000000000000000000000000000000000000000002	3	3	0	0	5
2	2	0000000000000002	000000000000000000000000000000000000000000000002	3	3	0	0	4
1	1	0000000000000001	000000000000000000000000000000000000000000000001	1	1	0	0	2
1	1	0000000000000001	000000000000000000000000000000000000000000000001	1	1	0	0	1
0	0	0000000000000000	000000000000000000000000000000000000000000000000	0	0	0	0	0
0	0	0000000000000000	000000000000000000000000000000000000000000000000	0	0	0	0	0
NULL	NULL	NULL	NULL	0	0	0	0	NULL
SELECT HEX(i), HEX(li), HEX(b), HEX(lb),
HEX(BIT_XOR(i) OVER w), HEX(BIT_XOR(li) OVER w),
HEX(BIT_XOR(b) OVER w), HEX(BIT_XOR(lb) OVER w),
SUM(d) OVER w AS dsum
FROM t
WINDOW w AS (ORDER BY i DESC ROWS BETWEEN CURRENT ROW AND 2 FOLLOWING);
HEX(i)	HEX(li)	HEX(b)	HEX(lb)	HEX(BIT_XOR(i) OVER w)	HEX(BIT_XOR(li) OVER w)	HEX(BIT_XOR(b) OVER w)	HEX(BIT_XOR(lb) OVER w)	dsum
1234567	123456789ABCDEF	0123456789ABCDEF	000000000000000000000000000000000123456789ABCDEF	1234567	123456789ABCDEF	0	0	56840245
1200567	120056789ABCDEF	0120056789ABCDEF	0120056789ABCDEF0120056789ABCDEF0120056789ABCDEF	1200117	120011789ABCDEF	0	0	56626149
1200567	120056789ABCDEF	0120056789ABCDEF	0120056789ABCDEF0120056789ABCDEF0120056789ABCDEF	476	47000000006	0	0	37750404
1200117	120011789ABCDEF	0120011789ABCDEF	0120011789ABCDEF0120011789ABCDEF0120011789ABCDEF	1200114	120011789ABCDEC	0	0	18874658
6	6	0000000000000006	000000000000000000000000000000000000000000000006	7	7	0	0	15
5	5	0000000000000005	000000000000000000000000000000000000000000000005	5	5	0	0	13
4	4	0000000000000004	000000000000000000000000000000000000000000000004	3	3	0	0	11
4	4	0000000000000004	000000000000000000000000000000000000000000000004	4	4	0	0	10
3	3	0000000000000003	000000000000000000000000000000000000000000000003	2	2	0	0	8
3	3	0000000000000003	000000000000000000000000000000000000000000000003	3	3	0	0	7
2	2	0000000000000002	000000000000000000000000000000000000000000000002	1	1	0	0	5
2	2	0000000000000002	000000000000000000000000000000000000000000000002	2	2	0	0	4
1	1	0000000000000001	000000000000000000000000000000000000000000000001	0	0	0	0	2
1	1	0000000000000001	000000000000000000000000000000000000000000000001	1	1	0	0	1
0	0	0000000000000000	000000000000000000000000000000000000000000000000	0	0	0	0	0
0	0	0000000000000000	000000000000000000000000000000000000000000000000	0	0	0	0	0
NULL	NULL	NULL	NULL	0	0	0	0	NULL
SELECT HEX(i), HEX(li), HEX(b), HEX(lb),
HEX(BIT_AND(i) OVER w), HEX(BIT_AND(li) OVER w),
HEX(BIT_AND(b) OVER w), HEX(BIT_AND(lb) OVER w),
SUM(d) OVER w AS dsum
FROM t
WINDOW w AS (ORDER BY i DESC ROWS BETWEEN CURRENT ROW AND 2 FOLLOWING);
HEX(i)	HEX(li)	HEX(b)	HEX(lb)	HEX(BIT_AND(i) OVER w)	HEX(BIT_AND(li) OVER w)	HEX(BIT_AND(b) OVER w)	HEX(BIT_AND(lb) OVER w)	dsum
1234567	123456789ABCDEF	0123456789ABCDEF	000000000000000000000000000000000123456789ABCDEF	1200567	120056789ABCDEF	0	0	56840245
1200567	120056789ABCDEF	0120056789ABCDEF	0120056789ABCDEF0120056789ABCDEF0120056789ABCDEF	1200107	120010789ABCDEF	0	0	56626149
1200567	120056789ABCDEF	0120056789ABCDEF	0120056789ABCDEF0120056789ABCDEF0120056789ABCDEF	6	6	0	0	37750404
1200117	120011789ABCDEF	0120011789ABCDEF	0120011789ABCDEF0120011789ABCDEF0120011789ABCDEF	4	4	0	0	18874658
6	6	0000000000000006	000000000000000000000000000000000000000000000006	4	4	0	0	15
5	5	0000000000000005	000000000000000000000000000000000000000000000005	4	4	0	0	13
4	4	0000000000000004	000000000000000000000000000000000000000000000004	0	0	0	0	11
4	4	0000000000000004	000000000000000000000000000000000000000000000004	0	0	0	0	10
3	3	0000000000000003	000000000000000000000000000000000000000000000003	2	2	0	0	8
3	3	0000000000000003	000000000000000000000000000000000000000000000003	2	2	0	0	7
2	2	0000000000000002	000000000000000000000000000000000000000000000002	0	0	0	0	5
2	2	0000000000000002	000000000000000000000000000000000000000000000002	0	0	0	0	4
1	1	0000000000000001	000000000000000000000000000000000000000000000001	0	0	0	0	2
1	1	0000000000000001	000000000000000000000000000000000000000000000001	0	0	0	0	1
0	0	0000000000000000	000000000000000000000000000000000000000000000000	0	0	0	0	0
0	0	0000000000000000	000000000000000000000000000000000000000000000000	0	0	0	0	0
NULL	NULL	NULL	NULL	FFFFFFFFFFFFFFFF	FFFFFFFFFFFFFFFF	FFFFFFFFFFFFFFFF	FFFFFFFFFFFFFFFF	NULL

Test that varying length string give an error if in same partition

Insert a short b at end of partition
INSERT INTO t(i, li, b, lb) VALUES
(10, 10, x'0A', x'00000000000000000000000000000000000000000000000A');
SELECT HEX(BIT_AND(b) OVER w),
SUM(d) OVER w AS dsum
FROM t
WINDOW w AS (ORDER BY i ROWS 2 PRECEDING);
HEX(BIT_AND(b) OVER w)	dsum
FFFFFFFFFFFFFFFF	NULL
0	0
0	0
0	1
0	2
0	4
0	5
0	7
0	8
0	10
0	11
0	13
0	15
0	21
0	18874663
0	37750408
0	56626149
0	56840245
DELETE FROM t WHERE i = 10;
Insert a short b at start of partition
INSERT INTO t(i, li, b, lb) VALUES
(-1, -1, x'0A', x'00000000000000000000000000000000000000000000000A');
SELECT HEX(BIT_AND(b) OVER w),
SUM(d) OVER w AS dsum
FROM t
WINDOW w AS (ORDER BY i ROWS 2 PRECEDING);
HEX(BIT_AND(b) OVER w)	dsum
FFFFFFFFFFFFFFFF	NULL
0	-1
0	-1
0	-1
0	1
0	2
0	4
0	5
0	7
0	8
0	10
0	11
0	13
0	15
0	18874658
0	37750404
0	56626149
0	56840245
DELETE FROM t WHERE i = -1;
Insert a short b in middle of partition
INSERT INTO t(i, li, b, lb) VALUES
(4, 4, x'04', x'000000000000000000000000000000000000000000000004');
SELECT HEX(BIT_AND(b) OVER w),
SUM(d) OVER w AS dsum
FROM t
WINDOW w AS (ORDER BY i ROWS 2 PRECEDING);
HEX(BIT_AND(b) OVER w)	dsum
FFFFFFFFFFFFFFFF	NULL
0	0
0	0
0	1
0	2
0	4
0	5
0	7
0	8
0	10
0	11
0	12
0	13
0	15
0	18874658
0	37750404
0	56626149
0	56840245
Partitioning on bit string length should make it work again
SELECT HEX(BIT_AND(b) OVER w),
SUM(d) OVER w AS dsum
FROM t
WINDOW w AS (PARTITION BY LENGTH(b) ORDER BY i ROWS 2 PRECEDING);
HEX(BIT_AND(b) OVER w)	dsum
FFFFFFFFFFFFFFFF	NULL
0	4
0	0
0	0
0	1
0	2
0	4
0	5
0	7
0	8
0	10
0	11
0	13
0	15
0	18874658
0	37750404
0	56626149
0	56840245
DROP TABLE t;
Test with empty frame at beginning and end: bitops don't get
NULL then but a "neutral" value
CREATE TABLE t(
c0004 LONGTEXT CHARACTER SET latin1 COLLATE latin1_bin
GENERATED ALWAYS AS (_utf8mb4'1') VIRTUAL NOT NULL,
d DOUBLE GENERATED ALWAYS AS (1.0))
ENGINE=InnoDB DEFAULT CHARSET=utf8mb4;
Warnings:
Warning	1286	Unknown storage engine 'InnoDB'
INSERT INTO t VALUES (), (), (), (), ();
SELECT c0004,
BIT_AND(c0004) OVER w,
BIT_OR(c0004)  OVER w,
BIT_XOR(c0004) OVER w,
SUM(d) OVER w AS dsum
FROM t
WINDOW w AS (ORDER BY c0004 ROWS BETWEEN 5 PRECEDING AND 3 PRECEDING);
c0004	BIT_AND(c0004) OVER w	BIT_OR(c0004)  OVER w	BIT_XOR(c0004) OVER w	dsum
1	18446744073709551615	0	0	NULL
1	18446744073709551615	0	0	NULL
1	18446744073709551615	0	0	NULL
1	1	1	1	1
1	1	1	0	2
SELECT c0004,
BIT_AND(c0004) OVER w,
BIT_OR(c0004)  OVER w,
BIT_XOR(c0004) OVER w,
SUM(d) OVER w AS dsum
FROM t
WINDOW w AS (ORDER BY c0004 ROWS BETWEEN 3 FOLLOWING AND 5 FOLLOWING);
c0004	BIT_AND(c0004) OVER w	BIT_OR(c0004)  OVER w	BIT_XOR(c0004) OVER w	dsum
1	1	1	0	2
1	1	1	1	1
1	18446744073709551615	0	0	NULL
1	18446744073709551615	0	0	NULL
1	18446744073709551615	0	0	NULL
DROP TABLE t;
CREATE TABLE t(i int, b VARBINARY(511), d DOUBLE GENERATED ALWAYS AS (i*1.0));
INSERT INTO t(i,b) VALUES (1, REPEAT(x'00', 511)),
(1, REPEAT(x'FF', 511)),
(1, REPEAT(x'77', 511)),
(1, REPEAT(x'11', 511));
SELECT '---',
HEX(BIT_OR(b) OVER w) AS `OR`,
HEX(BIT_AND(b) OVER w) AS `AND`,
HEX(BIT_XOR(b) OVER w) AS `XOR`,
SUM(d) OVER w AS dsum
FROM t
WINDOW w AS (ORDER BY i ROWS BETWEEN 1 PRECEDING AND CURRENT ROW);
---	---
OR	0
AND	0
XOR	0
dsum	1
---	---
OR	0
AND	0
XOR	0
dsum	2
---	---
OR	0
AND	0
XOR	0
dsum	2
---	---
OR	0
AND	0
XOR	0
dsum	2
DROP TABLE t;
CREATE TABLE t(i int, b VARBINARY(512), d DOUBLE GENERATED ALWAYS AS (i*1.0));
INSERT INTO t(i,b) VALUES (1, REPEAT(x'00', 512)),
(1, REPEAT(x'FF', 512)),
(1, REPEAT(x'77', 512)),
(1, REPEAT(x'11', 512));
SELECT '---',
HEX(BIT_OR(b) OVER w) AS `OR`,
HEX(BIT_AND(b) OVER w) AS `AND`,
HEX(BIT_XOR(b) OVER w) AS `XOR`,
SUM(d) OVER w AS dsum
FROM t
WINDOW w AS (ORDER BY i ROWS BETWEEN 1 PRECEDING AND CURRENT ROW);
---	---
OR	0
AND	0
XOR	0
dsum	1
---	---
OR	0
AND	0
XOR	0
dsum	2
---	---
OR	0
AND	0
XOR	0
dsum	2
---	---
OR	0
AND	0
XOR	0
dsum	2
DROP TABLE t;
# When switching from a partition to another, Item_sum_bit::clear()
# is called; it must reset Item_sum::m_digit_cnt if inversion is used
# inside the new frame.
CREATE TABLE t (id DECIMAL(3,1), b BINARY(9), d DOUBLE GENERATED ALWAYS AS (id*1.0));
INSERT INTO t(id, b)
VALUES (5.0,0x000000000000000000), (7.0,0x070000000000000007),
(6.0,0xFFFFFFFFFFFFFFFFFF), (5.5,0xFFFFFFFFFFFFFFFFFF);
SELECT id, id<=6 AS part, HEX(b), HEX(BIT_AND(b) OVER w),
SUM(d) OVER w AS dsum
FROM t
WINDOW w AS (PARTITION BY id<=6 ORDER BY id
ROWS BETWEEN 1 PRECEDING AND CURRENT ROW);
id	part	HEX(b)	HEX(BIT_AND(b) OVER w)	dsum
7.0	0	070000000000000007	0	7
5.0	1	000000000000000000	0	5
5.5	1	FFFFFFFFFFFFFFFFFF	0	10.5
6.0	1	FFFFFFFFFFFFFFFFFF	0	11.5
DROP TABLE t;
SET SESSION windowing_use_high_precision=TRUE;
ERROR HY000: Unknown system variable 'windowing_use_high_precision'
DROP TABLE t;
CREATE TABLE t(i INT, li BIGINT, b VARBINARY(8), lb VARBINARY(24), d DOUBLE GENERATED ALWAYS AS (i*1.0));
INSERT INTO t(i, li, b, lb) VALUES
(NULL, NULL, NULL, NULL),
(0, 0, X'0000000000000000',
X'000000000000000000000000000000000000000000000000'),
(0, 0, X'0000000000000000',
X'000000000000000000000000000000000000000000000000'),
(1, 1, X'0000000000000001',
X'000000000000000000000000000000000000000000000001'),
(1, 1, X'0000000000000001',
X'000000000000000000000000000000000000000000000001'),
(2, 2, X'0000000000000002',
X'000000000000000000000000000000000000000000000002'),
(2, 2, X'0000000000000002',
X'000000000000000000000000000000000000000000000002'),
(3, 3, X'0000000000000003',
X'000000000000000000000000000000000000000000000003'),
(3, 3, X'0000000000000003',
X'000000000000000000000000000000000000000000000003'),
(4, 4, X'0000000000000004',
X'000000000000000000000000000000000000000000000004'),
(4, 4, X'0000000000000004',
X'000000000000000000000000000000000000000000000004'),
(5, 5, X'0000000000000005',
X'000000000000000000000000000000000000000000000005'),
(6, 6, X'0000000000000006',
X'000000000000000000000000000000000000000000000006'),
(X'01234567', X'0123456789ABCDEF', X'0123456789ABCDEF',
X'000000000000000000000000000000000123456789ABCDEF'),
(X'01200567', X'0120056789ABCDEF', X'0120056789ABCDEF',
X'0120056789ABCDEF0120056789ABCDEF0120056789ABCDEF'),
(X'01200567', X'0120056789ABCDEF', X'0120056789ABCDEF',
X'0120056789ABCDEF0120056789ABCDEF0120056789ABCDEF'),
(X'01200117', X'0120011789ABCDEF', X'0120011789ABCDEF',
X'0120011789ABCDEF0120011789ABCDEF0120011789ABCDEF');
Ascending
SELECT HEX(i), HEX(li), HEX(b), HEX(lb),
HEX(BIT_OR(i) OVER w), HEX(BIT_OR(li) OVER w),
HEX(BIT_OR(b) OVER w), HEX(BIT_OR(lb) OVER w),
SUM(d) OVER w AS dsum
FROM t
WINDOW w AS (ORDER BY i ROWS 2 PRECEDING);
HEX(i)	HEX(li)	HEX(b)	HEX(lb)	HEX(BIT_OR(i) OVER w)	HEX(BIT_OR(li) OVER w)	HEX(BIT_OR(b) OVER w)	HEX(BIT_OR(lb) OVER w)	dsum
NULL	NULL	NULL	NULL	0	0	0	0	NULL
0	0	0000000000000000	000000000000000000000000000000000000000000000000	0	0	0	0	0
0	0	0000000000000000	000000000000000000000000000000000000000000000000	0	0	0	0	0
1	1	0000000000000001	000000000000000000000000000000000000000000000001	1	1	0	0	1
1	1	0000000000000001	000000000000000000000000000000000000000000000001	1	1	0	0	2
2	2	0000000000000002	000000000000000000000000000000000000000000000002	3	3	0	0	4
2	2	0000000000000002	000000000000000000000000000000000000000000000002	3	3	0	0	5
3	3	0000000000000003	000000000000000000000000000000000000000000000003	3	3	0	0	7
3	3	0000000000000003	000000000000000000000000000000000000000000000003	3	3	0	0	8
4	4	0000000000000004	000000000000000000000000000000000000000000000004	7	7	0	0	10
4	4	0000000000000004	000000000000000000000000000000000000000000000004	7	7	0	0	11
5	5	0000000000000005	000000000000000000000000000000000000000000000005	5	5	0	0	13
6	6	0000000000000006	000000000000000000000000000000000000000000000006	7	7	0	0	15
1200117	120011789ABCDEF	0120011789ABCDEF	0120011789ABCDEF0120011789ABCDEF0120011789ABCDEF	1200117	120011789ABCDEF	0	0	18874658
1200567	120056789ABCDEF	0120056789ABCDEF	0120056789ABCDEF0120056789ABCDEF0120056789ABCDEF	1200577	120057789ABCDEF	0	0	37750404
1200567	120056789ABCDEF	0120056789ABCDEF	0120056789ABCDEF0120056789ABCDEF0120056789ABCDEF	1200577	120057789ABCDEF	0	0	56626149
1234567	123456789ABCDEF	0123456789ABCDEF	000000000000000000000000000000000123456789ABCDEF	1234567	123456789ABCDEF	0	0	56840245
Show whether we run in optimized or non-optimized mode, cf.
our dummy double d SUM which forces non-optimized mode
iff windowing_use_high_precision==TRUE
EXPLAIN FORMAT=JSON
SELECT HEX(i), HEX(li), HEX(b), HEX(lb),
HEX(BIT_OR(i) OVER w), HEX(BIT_OR(li) OVER w),
HEX(BIT_OR(b) OVER w), HEX(BIT_OR(lb) OVER w),
SUM(d) OVER w AS dsum
FROM t
WINDOW w AS (ORDER BY i ROWS 2 PRECEDING);
SELECT HEX(i), HEX(li), HEX(b), HEX(lb),
HEX(BIT_XOR(i) OVER w), HEX(BIT_XOR(li) OVER w),
HEX(BIT_XOR(b) OVER w), HEX(BIT_XOR(lb) OVER w),
SUM(d) OVER w AS dsum
FROM t
WINDOW w AS (ORDER BY i ROWS 2 PRECEDING);
HEX(i)	HEX(li)	HEX(b)	HEX(lb)	HEX(BIT_XOR(i) OVER w)	HEX(BIT_XOR(li) OVER w)	HEX(BIT_XOR(b) OVER w)	HEX(BIT_XOR(lb) OVER w)	dsum
NULL	NULL	NULL	NULL	0	0	0	0	NULL
0	0	0000000000000000	000000000000000000000000000000000000000000000000	0	0	0	0	0
0	0	0000000000000000	000000000000000000000000000000000000000000000000	0	0	0	0	0
1	1	0000000000000001	000000000000000000000000000000000000000000000001	1	1	0	0	1
1	1	0000000000000001	000000000000000000000000000000000000000000000001	0	0	0	0	2
2	2	0000000000000002	000000000000000000000000000000000000000000000002	2	2	0	0	4
2	2	0000000000000002	000000000000000000000000000000000000000000000002	1	1	0	0	5
3	3	0000000000000003	000000000000000000000000000000000000000000000003	3	3	0	0	7
3	3	0000000000000003	000000000000000000000000000000000000000000000003	2	2	0	0	8
4	4	0000000000000004	000000000000000000000000000000000000000000000004	4	4	0	0	10
4	4	0000000000000004	000000000000000000000000000000000000000000000004	3	3	0	0	11
5	5	0000000000000005	000000000000000000000000000000000000000000000005	5	5	0	0	13
6	6	0000000000000006	000000000000000000000000000000000000000000000006	7	7	0	0	15
1200117	120011789ABCDEF	0120011789ABCDEF	0120011789ABCDEF0120011789ABCDEF0120011789ABCDEF	1200114	120011789ABCDEC	0	0	18874658
1200567	120056789ABCDEF	0120056789ABCDEF	0120056789ABCDEF0120056789ABCDEF0120056789ABCDEF	476	47000000006	0	0	37750404
1200567	120056789ABCDEF	0120056789ABCDEF	0120056789ABCDEF0120056789ABCDEF0120056789ABCDEF	1200117	120011789ABCDEF	0	0	56626149
1234567	123456789ABCDEF	0123456789ABCDEF	000000000000000000000000000000000123456789ABCDEF	1234567	123456789ABCDEF	0	0	56840245
SELECT HEX(i), HEX(li), HEX(b), HEX(lb),
HEX(BIT_AND(i) OVER w), HEX(BIT_AND(li) OVER w),
HEX(BIT_AND(b) OVER w), HEX(BIT_AND(lb) OVER w),
SUM(d) OVER w AS dsum
FROM t
WINDOW w AS (ORDER BY i ROWS 2 PRECEDING);
HEX(i)	HEX(li)	HEX(b)	HEX(lb)	HEX(BIT_AND(i) OVER w)	HEX(BIT_AND(li) OVER w)	HEX(BIT_AND(b) OVER w)	HEX(BIT_AND(lb) OVER w)	dsum
NULL	NULL	NULL	NULL	FFFFFFFFFFFFFFFF	FFFFFFFFFFFFFFFF	FFFFFFFFFFFFFFFF	FFFFFFFFFFFFFFFF	NULL
0	0	0000000000000000	000000000000000000000000000000000000000000000000	0	0	0	0	0
0	0	0000000000000000	000000000000000000000000000000000000000000000000	0	0	0	0	0
1	1	0000000000000001	000000000000000000000000000000000000000000000001	0	0	0	0	1
1	1	0000000000000001	000000000000000000000000000000000000000000000001	0	0	0	0	2
2	2	0000000000000002	000000000000000000000000000000000000000000000002	0	0	0	0	4
2	2	0000000000000002	000000000000000000000000000000000000000000000002	0	0	0	0	5
3	3	0000000000000003	000000000000000000000000000000000000000000000003	2	2	0	0	7
3	3	0000000000000003	000000000000000000000000000000000000000000000003	2	2	0	0	8
4	4	0000000000000004	000000000000000000000000000000000000000000000004	0	0	0	0	10
4	4	0000000000000004	000000000000000000000000000000000000000000000004	0	0	0	0	11
5	5	0000000000000005	000000000000000000000000000000000000000000000005	4	4	0	0	13
6	6	0000000000000006	000000000000000000000000000000000000000000000006	4	4	0	0	15
1200117	120011789ABCDEF	0120011789ABCDEF	0120011789ABCDEF0120011789ABCDEF0120011789ABCDEF	4	4	0	0	18874658
1200567	120056789ABCDEF	0120056789ABCDEF	0120056789ABCDEF0120056789ABCDEF0120056789ABCDEF	6	6	0	0	37750404
1200567	120056789ABCDEF	0120056789ABCDEF	0120056789ABCDEF0120056789ABCDEF0120056789ABCDEF	1200107	120010789ABCDEF	0	0	56626149
1234567	123456789ABCDEF	0123456789ABCDEF	000000000000000000000000000000000123456789ABCDEF	1200567	120056789ABCDEF	0	0	56840245
Descending: NULLS last
SELECT HEX(i), HEX(li), HEX(b), HEX(lb),
HEX(BIT_OR(i) OVER w), HEX(BIT_OR(li) OVER w),
HEX(BIT_OR(b) OVER w), HEX(BIT_OR(lb) OVER w),
SUM(d) OVER w AS dsum
FROM t
WINDOW w AS (ORDER BY i DESC ROWS BETWEEN CURRENT ROW AND 2 FOLLOWING);
HEX(i)	HEX(li)	HEX(b)	HEX(lb)	HEX(BIT_OR(i) OVER w)	HEX(BIT_OR(li) OVER w)	HEX(BIT_OR(b) OVER w)	HEX(BIT_OR(lb) OVER w)	dsum
1234567	123456789ABCDEF	0123456789ABCDEF	000000000000000000000000000000000123456789ABCDEF	1234567	123456789ABCDEF	0	0	56840245
1200567	120056789ABCDEF	0120056789ABCDEF	0120056789ABCDEF0120056789ABCDEF0120056789ABCDEF	1200577	120057789ABCDEF	0	0	56626149
1200567	120056789ABCDEF	0120056789ABCDEF	0120056789ABCDEF0120056789ABCDEF0120056789ABCDEF	1200577	120057789ABCDEF	0	0	37750404
1200117	120011789ABCDEF	0120011789ABCDEF	0120011789ABCDEF0120011789ABCDEF0120011789ABCDEF	1200117	120011789ABCDEF	0	0	18874658
6	6	0000000000000006	000000000000000000000000000000000000000000000006	7	7	0	0	15
5	5	0000000000000005	000000000000000000000000000000000000000000000005	5	5	0	0	13
4	4	0000000000000004	000000000000000000000000000000000000000000000004	7	7	0	0	11
4	4	0000000000000004	000000000000000000000000000000000000000000000004	7	7	0	0	10
3	3	0000000000000003	000000000000000000000000000000000000000000000003	3	3	0	0	8
3	3	0000000000000003	000000000000000000000000000000000000000000000003	3	3	0	0	7
2	2	0000000000000002	000000000000000000000000000000000000000000000002	3	3	0	0	5
2	2	0000000000000002	000000000000000000000000000000000000000000000002	3	3	0	0	4
1	1	0000000000000001	000000000000000000000000000000000000000000000001	1	1	0	0	2
1	1	0000000000000001	000000000000000000000000000000000000000000000001	1	1	0	0	1
0	0	0000000000000000	000000000000000000000000000000000000000000000000	0	0	0	0	0
0	0	0000000000000000	000000000000000000000000000000000000000000000000	0	0	0	0	0
NULL	NULL	NULL	NULL	0	0	0	0	NULL
SELECT HEX(i), HEX(li), HEX(b), HEX(lb),
HEX(BIT_XOR(i) OVER w), HEX(BIT_XOR(li) OVER w),
HEX(BIT_XOR(b) OVER w), HEX(BIT_XOR(lb) OVER w),
SUM(d) OVER w AS dsum
FROM t
WINDOW w AS (ORDER BY i DESC ROWS BETWEEN CURRENT ROW AND 2 FOLLOWING);
HEX(i)	HEX(li)	HEX(b)	HEX(lb)	HEX(BIT_XOR(i) OVER w)	HEX(BIT_XOR(li) OVER w)	HEX(BIT_XOR(b) OVER w)	HEX(BIT_XOR(lb) OVER w)	dsum
1234567	123456789ABCDEF	0123456789ABCDEF	000000000000000000000000000000000123456789ABCDEF	1234567	123456789ABCDEF	0	0	56840245
1200567	120056789ABCDEF	0120056789ABCDEF	0120056789ABCDEF0120056789ABCDEF0120056789ABCDEF	1200117	120011789ABCDEF	0	0	56626149
1200567	120056789ABCDEF	0120056789ABCDEF	0120056789ABCDEF0120056789ABCDEF0120056789ABCDEF	476	47000000006	0	0	37750404
1200117	120011789ABCDEF	0120011789ABCDEF	0120011789ABCDEF0120011789ABCDEF0120011789ABCDEF	1200114	120011789ABCDEC	0	0	18874658
6	6	0000000000000006	000000000000000000000000000000000000000000000006	7	7	0	0	15
5	5	0000000000000005	000000000000000000000000000000000000000000000005	5	5	0	0	13
4	4	0000000000000004	000000000000000000000000000000000000000000000004	3	3	0	0	11
4	4	0000000000000004	000000000000000000000000000000000000000000000004	4	4	0	0	10
3	3	0000000000000003	000000000000000000000000000000000000000000000003	2	2	0	0	8
3	3	0000000000000003	000000000000000000000000000000000000000000000003	3	3	0	0	7
2	2	0000000000000002	000000000000000000000000000000000000000000000002	1	1	0	0	5
2	2	0000000000000002	000000000000000000000000000000000000000000000002	2	2	0	0	4
1	1	0000000000000001	000000000000000000000000000000000000000000000001	0	0	0	0	2
1	1	0000000000000001	000000000000000000000000000000000000000000000001	1	1	0	0	1
0	0	0000000000000000	000000000000000000000000000000000000000000000000	0	0	0	0	0
0	0	0000000000000000	000000000000000000000000000000000000000000000000	0	0	0	0	0
NULL	NULL	NULL	NULL	0	0	0	0	NULL
SELECT HEX(i), HEX(li), HEX(b), HEX(lb),
HEX(BIT_AND(i) OVER w), HEX(BIT_AND(li) OVER w),
HEX(BIT_AND(b) OVER w), HEX(BIT_AND(lb) OVER w),
SUM(d) OVER w AS dsum
FROM t
WINDOW w AS (ORDER BY i DESC ROWS BETWEEN CURRENT ROW AND 2 FOLLOWING);
HEX(i)	HEX(li)	HEX(b)	HEX(lb)	HEX(BIT_AND(i) OVER w)	HEX(BIT_AND(li) OVER w)	HEX(BIT_AND(b) OVER w)	HEX(BIT_AND(lb) OVER w)	dsum
1234567	123456789ABCDEF	0123456789ABCDEF	000000000000000000000000000000000123456789ABCDEF	1200567	120056789ABCDEF	0	0	56840245
1200567	120056789ABCDEF	0120056789ABCDEF	0120056789ABCDEF0120056789ABCDEF0120056789ABCDEF	1200107	120010789ABCDEF	0	0	56626149
1200567	120056789ABCDEF	0120056789ABCDEF	0120056789ABCDEF0120056789ABCDEF0120056789ABCDEF	6	6	0	0	37750404
1200117	120011789ABCDEF	0120011789ABCDEF	0120011789ABCDEF0120011789ABCDEF0120011789ABCDEF	4	4	0	0	18874658
6	6	0000000000000006	000000000000000000000000000000000000000000000006	4	4	0	0	15
5	5	0000000000000005	000000000000000000000000000000000000000000000005	4	4	0	0	13
4	4	0000000000000004	000000000000000000000000000000000000000000000004	0	0	0	0	11
4	4	0000000000000004	000000000000000000000000000000000000000000000004	0	0	0	0	10
3	3	0000000000000003	000000000000000000000000000000000000000000000003	2	2	0	0	8
3	3	0000000000000003	000000000000000000000000000000000000000000000003	2	2	0	0	7
2	2	0000000000000002	000000000000000000000000000000000000000000000002	0	0	0	0	5
2	2	0000000000000002	000000000000000000000000000000000000000000000002	0	0	0	0	4
1	1	0000000000000001	000000000000000000000000000000000000000000000001	0	0	0	0	2
1	1	0000000000000001	000000000000000000000000000000000000000000000001	0	0	0	0	1
0	0	0000000000000000	000000000000000000000000000000000000000000000000	0	0	0	0	0
0	0	0000000000000000	000000000000000000000000000000000000000000000000	0	0	0	0	0
NULL	NULL	NULL	NULL	FFFFFFFFFFFFFFFF	FFFFFFFFFFFFFFFF	FFFFFFFFFFFFFFFF	FFFFFFFFFFFFFFFF	NULL

Test that varying length string give an error if in same partition

Insert a short b at end of partition
INSERT INTO t(i, li, b, lb) VALUES
(10, 10, x'0A', x'00000000000000000000000000000000000000000000000A');
SELECT HEX(BIT_AND(b) OVER w),
SUM(d) OVER w AS dsum
FROM t
WINDOW w AS (ORDER BY i ROWS 2 PRECEDING);
HEX(BIT_AND(b) OVER w)	dsum
FFFFFFFFFFFFFFFF	NULL
0	0
0	0
0	1
0	2
0	4
0	5
0	7
0	8
0	10
0	11
0	13
0	15
0	21
0	18874663
0	37750408
0	56626149
0	56840245
DELETE FROM t WHERE i = 10;
Insert a short b at start of partition
INSERT INTO t(i, li, b, lb) VALUES
(-1, -1, x'0A', x'00000000000000000000000000000000000000000000000A');
SELECT HEX(BIT_AND(b) OVER w),
SUM(d) OVER w AS dsum
FROM t
WINDOW w AS (ORDER BY i ROWS 2 PRECEDING);
HEX(BIT_AND(b) OVER w)	dsum
FFFFFFFFFFFFFFFF	NULL
0	-1
0	-1
0	-1
0	1
0	2
0	4
0	5
0	7
0	8
0	10
0	11
0	13
0	15
0	18874658
0	37750404
0	56626149
0	56840245
DELETE FROM t WHERE i = -1;
Insert a short b in middle of partition
INSERT INTO t(i, li, b, lb) VALUES
(4, 4, x'04', x'000000000000000000000000000000000000000000000004');
SELECT HEX(BIT_AND(b) OVER w),
SUM(d) OVER w AS dsum
FROM t
WINDOW w AS (ORDER BY i ROWS 2 PRECEDING);
HEX(BIT_AND(b) OVER w)	dsum
FFFFFFFFFFFFFFFF	NULL
0	0
0	0
0	1
0	2
0	4
0	5
0	7
0	8
0	10
0	11
0	12
0	13
0	15
0	18874658
0	37750404
0	56626149
0	56840245
Partitioning on bit string length should make it work again
SELECT HEX(BIT_AND(b) OVER w),
SUM(d) OVER w AS dsum
FROM t
WINDOW w AS (PARTITION BY LENGTH(b) ORDER BY i ROWS 2 PRECEDING);
HEX(BIT_AND(b) OVER w)	dsum
FFFFFFFFFFFFFFFF	NULL
0	4
0	0
0	0
0	1
0	2
0	4
0	5
0	7
0	8
0	10
0	11
0	13
0	15
0	18874658
0	37750404
0	56626149
0	56840245
DROP TABLE t;
Test with empty frame at beginning and end: bitops don't get
NULL then but a "neutral" value
CREATE TABLE t(
c0004 LONGTEXT CHARACTER SET latin1 COLLATE latin1_bin
GENERATED ALWAYS AS (_utf8mb4'1') VIRTUAL NOT NULL,
d DOUBLE GENERATED ALWAYS AS (1.0))
ENGINE=InnoDB DEFAULT CHARSET=utf8mb4;
Warnings:
Warning	1286	Unknown storage engine 'InnoDB'
INSERT INTO t VALUES (), (), (), (), ();
SELECT c0004,
BIT_AND(c0004) OVER w,
BIT_OR(c0004)  OVER w,
BIT_XOR(c0004) OVER w,
SUM(d) OVER w AS dsum
FROM t
WINDOW w AS (ORDER BY c0004 ROWS BETWEEN 5 PRECEDING AND 3 PRECEDING);
c0004	BIT_AND(c0004) OVER w	BIT_OR(c0004)  OVER w	BIT_XOR(c0004) OVER w	dsum
1	18446744073709551615	0	0	NULL
1	18446744073709551615	0	0	NULL
1	18446744073709551615	0	0	NULL
1	1	1	1	1
1	1	1	0	2
SELECT c0004,
BIT_AND(c0004) OVER w,
BIT_OR(c0004)  OVER w,
BIT_XOR(c0004) OVER w,
SUM(d) OVER w AS dsum
FROM t
WINDOW w AS (ORDER BY c0004 ROWS BETWEEN 3 FOLLOWING AND 5 FOLLOWING);
c0004	BIT_AND(c0004) OVER w	BIT_OR(c0004)  OVER w	BIT_XOR(c0004) OVER w	dsum
1	1	1	0	2
1	1	1	1	1
1	18446744073709551615	0	0	NULL
1	18446744073709551615	0	0	NULL
1	18446744073709551615	0	0	NULL
DROP TABLE t;
CREATE TABLE t(i int, b VARBINARY(511), d DOUBLE GENERATED ALWAYS AS (i*1.0));
INSERT INTO t(i,b) VALUES (1, REPEAT(x'00', 511)),
(1, REPEAT(x'FF', 511)),
(1, REPEAT(x'77', 511)),
(1, REPEAT(x'11', 511));
SELECT '---',
HEX(BIT_OR(b) OVER w) AS `OR`,
HEX(BIT_AND(b) OVER w) AS `AND`,
HEX(BIT_XOR(b) OVER w) AS `XOR`,
SUM(d) OVER w AS dsum
FROM t
WINDOW w AS (ORDER BY i ROWS BETWEEN 1 PRECEDING AND CURRENT ROW);
---	---
OR	0
AND	0
XOR	0
dsum	1
---	---
OR	0
AND	0
XOR	0
dsum	2
---	---
OR	0
AND	0
XOR	0
dsum	2
---	---
OR	0
AND	0
XOR	0
dsum	2
DROP TABLE t;
CREATE TABLE t(i int, b VARBINARY(512), d DOUBLE GENERATED ALWAYS AS (i*1.0));
INSERT INTO t(i,b) VALUES (1, REPEAT(x'00', 512)),
(1, REPEAT(x'FF', 512)),
(1, REPEAT(x'77', 512)),
(1, REPEAT(x'11', 512));
SELECT '---',
HEX(BIT_OR(b) OVER w) AS `OR`,
HEX(BIT_AND(b) OVER w) AS `AND`,
HEX(BIT_XOR(b) OVER w) AS `XOR`,
SUM(d) OVER w AS dsum
FROM t
WINDOW w AS (ORDER BY i ROWS BETWEEN 1 PRECEDING AND CURRENT ROW);
---	---
OR	0
AND	0
XOR	0
dsum	1
---	---
OR	0
AND	0
XOR	0
dsum	2
---	---
OR	0
AND	0
XOR	0
dsum	2
---	---
OR	0
AND	0
XOR	0
dsum	2
DROP TABLE t;
# When switching from a partition to another, Item_sum_bit::clear()
# is called; it must reset Item_sum::m_digit_cnt if inversion is used
# inside the new frame.
CREATE TABLE t (id DECIMAL(3,1), b BINARY(9), d DOUBLE GENERATED ALWAYS AS (id*1.0));
INSERT INTO t(id, b)
VALUES (5.0,0x000000000000000000), (7.0,0x070000000000000007),
(6.0,0xFFFFFFFFFFFFFFFFFF), (5.5,0xFFFFFFFFFFFFFFFFFF);
SELECT id, id<=6 AS part, HEX(b), HEX(BIT_AND(b) OVER w),
SUM(d) OVER w AS dsum
FROM t
WINDOW w AS (PARTITION BY id<=6 ORDER BY id
ROWS BETWEEN 1 PRECEDING AND CURRENT ROW);
id	part	HEX(b)	HEX(BIT_AND(b) OVER w)	dsum
7.0	0	070000000000000007	0	7
5.0	1	000000000000000000	0	5
5.5	1	FFFFFFFFFFFFFFFFFF	0	10.5
6.0	1	FFFFFFFFFFFFFFFFFF	0	11.5
DROP TABLE t;
