# Explain of SQL window functions.
# ----------------------------------------------------------------------
SET NAMES utf8;
Single window function (plus ORDER BY).
DROP TABLE t;
CREATE TABLE t(i INT, j INT);
INSERT INTO t VALUES (1,1), (1,4), (1,2), (1,4);
Single partition, no sorting
With LIMIT
Single ordered partition
View with window function
DROP VIEW v;
CREATE VIEW v AS
SELECT i, j, SUM(i+j) OVER (ORDER BY j DESC ROWS UNBOUNDED PRECEDING) foo FROM t;
SHOW CREATE VIEW v;
View	Create View	character_set_client	collation_connection
v	CREATE VIEW `v` AS select `test`.`t`.`i` AS `i`,`test`.`t`.`j` AS `j`,sum((`test`.`t`.`i` + `test`.`t`.`j`)) over( ORDER BY `test`.`t`.`j` DESC  ROWS BETWEEN  UNBOUNDED  PRECEDING  AND  CURRENT ROW ) AS `foo` from `test`.`t`	utf8mb4	utf8mb4_general_ci
DROP VIEW v;
TRUNCATE TABLE t;
Check my_decimal bug: no warning if c=a+b and c is one of a,b... just fails over 9 digits
INSERT INTO t VALUES (999961560, DEFAULT), (44721, DEFAULT);
DROP TABLE t;
CREATE TABLE t(i INT, j INT, k INT);
INSERT INTO t VALUES (1,1,1), (1,4,1), (1,2,1), (1,4,1);
INSERT INTO t VALUES (1,1,2), (1,4,2), (1,2,2), (1,4,2);
INSERT INTO t VALUES (1,1,3), (1,4,3), (1,2,3), (1,4,3);
INSERT INTO t VALUES (1,1,4), (1,4,4), (1,2,4), (1,4,4);
----------------------------------------------------------------------
-    Combination with GROUP BY
----------------------------------------------------------------------
DROP TABLE t;
----------------------------------------------------------------------
-    Some RANK, DENSE_RANK tests
----------------------------------------------------------------------
DROP TABLE t1;
CREATE TABLE t1 (id INTEGER, sex CHAR(1));
INSERT INTO t1 VALUES (1, 'M'),
(2, 'F'),
(3, 'F'),
(4, 'F'),
(5, 'M');
DROP TABLE t2;
CREATE TABLE t2 (user_id INTEGER NOT NULL, date DATE);
INSERT INTO t2 VALUES (1, '2002-06-09'),
(2, '2002-06-09'),
(1, '2002-06-09'),
(3, '2002-06-09'),
(4, '2002-06-09'),
(4, '2002-06-09'),
(5, '2002-06-09');
Explicit window definition, WINDOW DESC ordering from GROUP BY
Explicit window definition, window ordering from DISTINCT GROUP BY
Explicit window definition, window ordering from GROUP BY, final ORDER BY
With NULLs
INSERT INTO t1 VALUES (10, NULL), (11, NULL);
Aggregate with GROUP BY arguments to window function
Aggregate with GROUP BY in window's ORDER BY clause, with aggregate present in
SELECT list or not.
Implicit group aggregate arguments to window function and in
window's ORDER BY clause
Several partitions, several window functions over the same window
CREATE TABLE t(d decimal(10,2), date DATE);
INSERT INTO t values  (10.4, '2002-06-09'),
(20.5, '2002-06-09'),
(10.4, '2002-06-10'),
(3,    '2002-06-09'),
(40.2, '2015-08-01'),
(40.2, '2002-06-09'),
(5,    '2015-08-01');
DROP TABLE t;
Check that SUM stays that same when it sees NULL values
CREATE TABLE t(i INT, j INT);
INSERT INTO t VALUES (1,NULL),
(1,NULL),
(1,1),
(1,NULL),
(1,2),
(2,1),
(2,2),
(2,NULL),
(2,NULL);
Check that aggregate window functions that reference columns not in the SELECT list work
----------------------------------------------------------------------
-    Some ROW_NUMBER tests
----------------------------------------------------------------------
----------------------------------------------------------------------
-    Window function in subquery
----------------------------------------------------------------------
----------------------------------------------------------------------
-    Window function in parent and subquery
----------------------------------------------------------------------
----------------------------------------------------------------------
-    Multiple windows
----------------------------------------------------------------------
a little more windows + subquery
With LIMIT
----------------------------------------------------------------------
-    SUM, AVG, COUNT with frames
----------------------------------------------------------------------
try the same as a view
CREATE VIEW v AS
SELECT id, SUM(id) OVER w, sex FROM t1
WINDOW w AS (PARTITION BY sex ORDER BY id
ROWS BETWEEN 2 PRECEDING AND 1 PRECEDING);
SHOW CREATE VIEW v;
View	Create View	character_set_client	collation_connection
v	CREATE VIEW `v` AS select `test`.`t1`.`id` AS `id`,sum(`test`.`t1`.`id`) over( PARTITION BY `test`.`t1`.`sex` ORDER BY `test`.`t1`.`id` ASC  ROWS BETWEEN 2 PRECEDING  AND 1 PRECEDING ) AS `SUM(id) OVER w`,`test`.`t1`.`sex` AS `sex` from `test`.`t1`	utf8mb4	utf8mb4_general_ci
DROP VIEW v;
AVG, SUM with double type
DROP TABLE td;
CREATE TABLE td(d DOUBLE);
INSERT INTO td VALUES (2),(2),(3),(1),(1.2),(NULL);
Check system variable "windowing_use_high_precision"
TRUNCATE td;
INSERT INTO td VALUES (1.7976931348623157E+307), (1);
should be default off:
SHOW VARIABLES LIKE 'windowing_use_high_precision';
Variable_name	Value
allow unsafe optimization: result changes
SET SESSION windowing_use_high_precision=FALSE;
ERROR HY000: Unknown system variable 'windowing_use_high_precision'
SET SESSION windowing_use_high_precision=TRUE;
ERROR HY000: Unknown system variable 'windowing_use_high_precision'
bugfix: AVG for moving range frame
TRUNCATE td;
INSERT INTO td VALUES (10),(1),(2),(3),(4),(5),(6),(7),(8),(9);
SET SESSION windowing_use_high_precision=FALSE;
ERROR HY000: Unknown system variable 'windowing_use_high_precision'
SET SESSION windowing_use_high_precision=TRUE;
ERROR HY000: Unknown system variable 'windowing_use_high_precision'
INSERT INTO td SELECT * FROM td;
SET SESSION windowing_use_high_precision=FALSE;
ERROR HY000: Unknown system variable 'windowing_use_high_precision'
SET SESSION windowing_use_high_precision=TRUE;
ERROR HY000: Unknown system variable 'windowing_use_high_precision'
DROP TABLE td;
----------------------------------------------------------------------
-    NTILE (requires two passes over partition).
-    Currently suboptimal in that it causes N*N reads of tmp buffer
----------------------------------------------------------------------
combo with frame
Try one where there are no extras
DELETE FROM t1 WHERE id=11;
INSERT INTO t1 VALUES (11, NULL);
Simulated NTILE via other SQL window functions. Exercises an
an expression containing window functions defined on different
windows
NTILE in combination with a frame that doesn't cover current row (was bug)
----------------------------------------------------------------------
-    SUM with frames in combination with non-framing window functions
-    ROW_NUMBER and RANK
----------------------------------------------------------------------
INSERT INTO t1 VALUES (10, NULL);
----------------------------------------------------------------------
-    FIRST_VALUE
----------------------------------------------------------------------
INSERT INTO t1 VALUES (NULL, 'M');
select id, FIRST_VALUE(id) OVER (ROWS UNBOUNDED PRECEDING) FROM t1;
id	FIRST_VALUE(id) OVER (ROWS UNBOUNDED PRECEDING)
1	1
2	1
3	1
4	1
5	1
10	1
11	1
10	1
NULL	1
CREATE VIEW v AS
SELECT id, FIRST_VALUE(id) OVER w FROM t1 WINDOW w AS (ORDER BY id RANGE BETWEEN CURRENT ROW AND UNBOUNDED FOLLOWING);
SHOW CREATE VIEW v;
View	Create View	character_set_client	collation_connection
v	CREATE VIEW `v` AS select `test`.`t1`.`id` AS `id`,nth_value(`test`.`t1`.`id`,1) from first respect nulls over( ORDER BY `test`.`t1`.`id` ASC  RANGE BETWEEN  CURRENT ROW  AND  UNBOUNDED  FOLLOWING ) AS `FIRST_VALUE(id) OVER w` from `test`.`t1`	utf8mb4	utf8mb4_general_ci
DROP VIEW v;
DROP TABLE td1;
CREATE TABLE td1 (id DOUBLE, sex CHAR(1));
INSERT INTO td1 SELECT * FROM t1;
DROP TABLE td1;
DROP TABLE td_dec;
CREATE TABLE td_dec (id DECIMAL(10,2), sex CHAR(1));
INSERT INTO td_dec SELECT * FROM t1;
DROP TABLE td_dec;
DROP TABLE td_str;
CREATE TABLE td_str (id VARCHAR(20), sex CHAR(1));
INSERT INTO td_str SELECT * FROM t1;
DROP TABLE td_str;
DROP TABLE t_date;
CREATE TABLE t_date(id DATE);
INSERT INTO t_date VALUES ('2002-06-09'),
('2002-06-09'),
('2002-06-10'),
('2002-06-09'),
('2015-08-01'),
('2002-06-09'),
('2015-08-01');
CREATE VIEW v AS
SELECT id, FIRST_VALUE(id) OVER w FROM t_date WINDOW w AS (ORDER BY id RANGE BETWEEN CURRENT ROW AND UNBOUNDED FOLLOWING);
SHOW CREATE VIEW v;
View	Create View	character_set_client	collation_connection
v	CREATE VIEW `v` AS select `test`.`t_date`.`id` AS `id`,nth_value(`test`.`t_date`.`id`,1) from first respect nulls over( ORDER BY `test`.`t_date`.`id` ASC  RANGE BETWEEN  CURRENT ROW  AND  UNBOUNDED  FOLLOWING ) AS `FIRST_VALUE(id) OVER w` from `test`.`t_date`	utf8mb4	utf8mb4_general_ci
DROP VIEW v;
CREATE VIEW v AS
SELECT id, FIRST_VALUE(id) OVER w FROM t_date WINDOW w AS (ORDER BY id RANGE BETWEEN INTERVAL 2 DAY FOLLOWING AND INTERVAL 3 DAY FOLLOWING);
SHOW CREATE VIEW v;
View	Create View	character_set_client	collation_connection
v	CREATE VIEW `v` AS select `test`.`t_date`.`id` AS `id`,nth_value(`test`.`t_date`.`id`,1) from first respect nulls over( ORDER BY `test`.`t_date`.`id` ASC  RANGE BETWEEN  INTERVAL 2 DAY  FOLLOWING  AND  INTERVAL 3 DAY  FOLLOWING ) AS `FIRST_VALUE(id) OVER w` from `test`.`t_date`	utf8mb4	utf8mb4_general_ci
DROP VIEW v;
DROP TABLE t_date;
DROP TABLE t_time;
CREATE TABLE t_time(t TIME, ts TIMESTAMP);
INSERT INTO t_time VALUES ('12:30', '2016-07-05 08:30:42');
INSERT INTO t_time VALUES ('22:30', '2015-07-05 08:30:43');
INSERT INTO t_time VALUES ('13:30', '2014-07-05 08:30:44');
INSERT INTO t_time VALUES ('01:30', '2013-07-05 08:30:45');
INSERT INTO t_time VALUES ('15:30', '2016-08-05 08:31:42');
INSERT INTO t_time VALUES ('20:30', '2016-09-05 08:32:42');
INSERT INTO t_time VALUES ('04:30', '2016-10-05 08:33:42');
INSERT INTO t_time VALUES ('06:30', '2016-11-05 08:34:42');
INSERT INTO t_time VALUES ('18:30', '2016-07-05 09:30:42');
INSERT INTO t_time VALUES ('21:30', '2016-07-06 10:30:42');
INSERT INTO t_time VALUES ('00:30', '2016-07-07 11:30:42');
INSERT INTO t_time VALUES ('00:31', '2016-07-08 12:30:42');
DROP TABLE t_time2;
CREATE TABLE t_time2(t TIME, ts TIMESTAMP, p INTEGER DEFAULT 1);
INSERT INTO t_time2(t, ts) SELECT * FROM t_time;
UPDATE t_time2 SET p=p+1;
INSERT INTO t_time2(t, ts) SELECT * FROM t_time;
DROP TABLE t_time, t_time2;
----------------------------------------------------------------------
-    Aggregates with RANGE frame specification
----------------------------------------------------------------------
Make t11 a clone of t1 but with an extra partitioning column, but other values
repeated, so we can test it the same frames work on more than one partition
DROP TABLE t11;
CREATE TABLE t11 (id INTEGER, sex CHAR(1), p INTEGER DEFAULT 1);
INSERT INTO t11(id, sex) SELECT * FROM t1;
UPDATE t11 SET p=p+1;
INSERT INTO t11(id, sex) SELECT * FROM t1;
Make t22 a clone of t2 but with an extra partitioning column, but other values
repeated, so we can test it the same frames work on more than one partition
DROP TABLE t22;
CREATE TABLE t22 (user_id INTEGER NOT NULL, date DATE, p INTEGER DEFAULT 1);
INSERT INTO t22(user_id, date) SELECT * FROM t2;
UPDATE t22 SET p=p+1;
INSERT INTO t22(user_id, date) SELECT * FROM t2;
Implicit frame due to ORDER BY, with last in peer group as upper bound
Window function use of same field in different windows, both of which
need buffering. In this case we need subsequent rewrites of arg fields
Field pointer in tmp files for window 2..n The intervening internal
window buffering in each step used to mess that up.
Check descending order by with RANGE: 2 PRECEDING in this case means larger than
current row.
update t2 set date=date + user_id;
DROP TABLE t3;
CREATE TABLE t3(d DOUBLE);
INSERT INTO t3
VALUES (1.1),(1.9),(4.0),(8.3),(16.0),(24.0),(20.1),(22.0),(23.0);
----------------------------------------------------------------------
-    wf over JSON
----------------------------------------------------------------------
DROP TABLE tj;
CREATE TABLE tj(j JSON, i INT DEFAULT 7);
INSERT INTO tj(j) VALUES ('1'), ('2'), ('3'), ('4'), ('5'), (NULL);
INSERT INTO tj(j) VALUES ('3.14');
INSERT INTO tj(j) VALUES ('[1,2,3]');
----------------------------------------------------------------------
-    SELECT DISTINCT
----------------------------------------------------------------------
One window
Several windows with final ORDER BY also
UPDATE tj SET i=i+CASE WHEN JSON_TYPE(j) = 'ARRAY' THEN 1 ELSE j END;
UPDATE tj SET i=7 where i=8 AND JSON_TYPE(j) != 'ARRAY';
DROP TABLE tj2;
CREATE TABLE tj2 AS SELECT * FROM tj;
UPDATE tj2 SET i=MOD(i,3);
With GROUP BY
Bug fix GROUP BY with window function referring column used in grouping expression
DROP TABLE tj2;
----------------------------------------------------------------------
-    Bug fixes
----------------------------------------------------------------------
Bug fix for FIRST_VALUE, LAST_VALUE when not buffered processing
Bug missing hidden column (j) induction to select list: FIRST_VALUE/LAST_VALUE
Fix for lineno in warnings buffered and unbuffered windows
Bug fix for UNION
DROP TABLE tj;
----------------------------------------------------------------------
-    More JSON
----------------------------------------------------------------------
CREATE TABLE tj(j JSON);
INSERT INTO tj VALUES ('1'), ('2'), ('3'), ('4'), ('5'), (NULL);
INSERT INTO tj VALUES ('3.14');
INSERT INTO tj VALUES ('[1,2,3]');
DROP TABLE t5;
CREATE TABLE t5(b BIGINT UNSIGNED);
INSERT INTO t5 VALUES (1), (2), (3), (4), (5), (6), (7);
last row should have COUNT(*) == 0 , not 1 (bug fix)
DROP TABLE t6;
CREATE TABLE t6(t TIME, ts TIMESTAMP);
INSERT INTO t6 VALUES ('12:30', '2016-07-05 08:30:42');
INSERT INTO t6 VALUES ('22:30', '2015-07-05 08:30:43');
INSERT INTO t6 VALUES ('13:30', '2014-07-05 08:30:44');
INSERT INTO t6 VALUES ('01:30', '2013-07-05 08:30:45');
INSERT INTO t6 VALUES ('15:30', '2016-08-05 08:31:42');
INSERT INTO t6 VALUES ('20:30', '2016-09-05 08:32:42');
INSERT INTO t6 VALUES ('04:30', '2016-10-05 08:33:42');
INSERT INTO t6 VALUES ('06:30', '2016-11-05 08:34:42');
INSERT INTO t6 VALUES ('18:30', '2016-07-05 09:30:42');
INSERT INTO t6 VALUES ('21:30', '2016-07-06 10:30:42');
INSERT INTO t6 VALUES ('00:30', '2016-07-07 11:30:42');
INSERT INTO t6 VALUES ('00:31', '2016-07-08 12:30:42');
INTERVAL specified with string as below failed
----------------------------------------------------------------------
-    Window spec inheritance
----------------------------------------------------------------------
DROP VIEW v;
CREATE VIEW v AS
SELECT COUNT(*) OVER w0,
COUNT(*) OVER w,
COUNT(*) OVER w1 FROM t6
WINDOW w0 AS (),
w AS (w0 ORDER BY t),
w1 AS (w RANGE BETWEEN INTERVAL 24 HOUR  PRECEDING AND INTERVAL '2:2' MINUTE_SECOND FOLLOWING);
SHOW CREATE VIEW v;
View	Create View	character_set_client	collation_connection
v	CREATE VIEW `v` AS select count(0) over() AS `COUNT(*) OVER w0`,count(0) over( ORDER BY `test`.`t6`.`t` ASC  RANGE BETWEEN  UNBOUNDED  PRECEDING  AND  CURRENT ROW ) AS `COUNT(*) OVER w`,count(0) over( ORDER BY `test`.`t6`.`t` ASC  RANGE BETWEEN  INTERVAL 24 HOUR  PRECEDING  AND  INTERVAL '2:2' MINUTE_SECOND  FOLLOWING ) AS `COUNT(*) OVER w1` from `test`.`t6`	utf8mb4	utf8mb4_general_ci
DROP VIEW v;
----------------------------------------------------------------------
- Bugs with induction of hidden fields from window function also used
- in ORDER BY/PARTITION BY
----------------------------------------------------------------------
Bug for AVG in presence of several NULLs
INSERT INTO t1 VALUES (NULL, 'F');
Check frame size, COUNT(*) vs COUNT(<column>) in frames with NULLs
DROP TABLE ss;
CREATE TABLE ss(c CHAR(1));
INSERT INTO ss VALUES ('M');
DROP TABLE t, t1, t11, t2, t22, t3, t5, t6, tj, ss;
----------------------------------------------------------------------
-    ORDER BY + RANK with more than one ordering expression
----------------------------------------------------------------------
CREATE TABLE t(i INT, j INT, k INT);
INSERT INTO t VALUES (1,1,1),
(1,1,2),
(1,1,2),
(1,2,1),
(1,2,2),
(2,1,1),
(2,1,1),
(2,1,2),
(2,2,1),
(2,2,2);
DROP TABLE t;
----------------------------------------------------------------------
-    Gulutzan's sanity tests in
-    http://ocelot.ca/blog/blog/2016/04/18/mariadb-10-2-window-functions/
-    His comments are quoted.
----------------------------------------------------------------------
SET @savmode=@@SESSION.SQL_MODE;
SET SESSION SQL_MODE='STRICT_ALL_TABLES,NO_ZERO_IN_DATE,ONLY_FULL_GROUP_BY';
CREATE TABLE t1 (s1 INT, s2 CHAR(5));
INSERT INTO t1 VALUES (1, 'a');
INSERT INTO t1 VALUES (NULL, NULL);
INSERT INTO t1 VALUES (1, NULL);
INSERT INTO t1 VALUES (NULL, 'a');
INSERT INTO t1 VALUES (2, 'b');
INSERT INTO t1 VALUES (-1, '');
"The following statements all cause the MariaDB server to crash"
MySQL doesn't crash
"The following statements all give the wrong answers with MariaDB"
Correct with MySQL.
"The following statement causes the client to hang (it loops in
mysql_store_result, I think this is the first time I've seen this type of
error)"
No issue with MySQL
DROP TABLE t1;
SET SESSION SQL_MODE=@savmode;
Some negative tests (from Srikanth)
CREATE TABLE t (a INT, b INT, c INT);
INSERT INTO t VALUES (1,1,1), (1,1,2), (1,1,3),
(1,2,1), (1,2,2), (1,2,3),
(1,3,1), (1,3,2), (1,3,3),
(2,1,1), (2,1,2), (2,1,3),
(2,2,1), (2,2,2), (2,2,3),
(2,3,1), (2,3,2), (2,3,3);
Wfs OK in ORDER BY, but not in WHERE or HAVING clauses
Windows should only be allowed in order by of a simple table query
This is legal, though:
(select a from t) union (select a from t order by (row_number() over ()));
a
1
2
Non constants as frame bounds
Non-unique window name
Illegal legacy position indication in window's ORDER BY clause
Crashed: more than one window in subquery
Crashed: expression containing window function(s) in subquery
Wrong result if subquery window function referenced another column in the select list
This was OK, but:
this one failed with NULL as sum
Window function having subquery in argument:
DROP TABLE u;
CREATE TABLE u(d INT);
SELECT AVG(a * (SELECT a*d FROM u)) OVER
(PARTITION BY (SELECT a+d FROM u) ORDER BY (SELECT d FROM u)) FROM t;
AVG(a * (SELECT a*d FROM u)) OVER
(PARTITION BY (SELECT a+d FROM u) ORDER BY (SELECT d FROM u))
NULL
NULL
NULL
NULL
NULL
NULL
NULL
NULL
NULL
NULL
NULL
NULL
NULL
NULL
NULL
NULL
NULL
NULL
DROP TABLE u;
Crash due to unguarded access for window name string for an unnamed
window while producing the error message
Check that DISTINCT is not allowed in wfs
Check that GROUPS bounds unit is not supported yet
Check that EXCLUDE in frames is not supported yet
Check Nested wfs
DROP TABLE t;
Crash report (Srikanth)
CREATE TABLE t(a int, b int);
INSERT INTO t VALUES (1,1),(2,1),(3,2),(4,2),(5,3),(6,3);
DROP TABLE t;
Wrong result (Srikanth)
CREATE TABLE t1(a INT, b INT);
INSERT INTO t1 VALUES (1,2),
(1,3);
INSERT INTO t1 VALUES (1,3);
DROP TABLE t1;
frame buffer navigation assert
DROP TABLE ta;
CREATE TABLE ta (a INT(11) DEFAULT NULL, b INT(11) DEFAULT NULL);
INSERT INTO  ta VALUES (1,1), (1,2), (1,3), (2,1), (2,2), (2,3);
DROP TABLE ta;
Nullability fix bug for COUNT OVER in non optimized eval strategy
CREATE TABLE t(d DOUBLE);
INSERT INTO t VALUES (1.0), (2.0), (3.0);
DROP TABLE t;
Bug in inverse logic with initial NULL and RANGE BETWEEN N FOLLOWING AND M FOLLOWING
CREATE TABLE t1 (d DOUBLE, id INT, sex CHAR(1), n INT NOT NULL AUTO_INCREMENT, PRIMARY KEY(n));
INSERT INTO t1(d, id, sex) VALUES (1.0, 1, 'M'),
(2.0, 2, 'F'),
(3.0, 3, 'F'),
(4.0, 4, 'F'),
(5.0, 5, 'M'),
(NULL, NULL, 'M'),
(10.0, 10, NULL),
(10.0, 10, NULL),
(11.0, 11, NULL);
SET windowing_use_high_precision= OFF;
ERROR HY000: Unknown system variable 'windowing_use_high_precision'
SET windowing_use_high_precision= ON;
ERROR HY000: Unknown system variable 'windowing_use_high_precision'
DROP TABLE t1;
Bug in inverse logic with e.g. ROWS BETWEEN UNBOUNDED PRECEDING AND 1
FOLLOWING: at end of partition, when no rows are removed or added we
lacked initialization of aggregates in optimized mode.
CREATE TABLE t (i char(10), j int);
INSERT INTO t VALUES('A', 1);
INSERT INTO t VALUES('A', 3);
INSERT INTO t VALUES('A', 5);
INSERT INTO t VALUES('B', 1);
INSERT INTO t VALUES('B', 7);
Test definition_position: references don't count, only definitions,
thus we have an unnamed, then another unnamed (based on w but not
exactly w) then w then two unnamed.
DROP TABLE t;
#
# Bug#26114396 WL#9603: SIG11 AT OPT_EXPLAIN_JSON_NAMESPACE::WINDOW_CTX::FORMAT_BODY
#
CREATE TABLE t1(a int,b int);
CREATE TABLE t2(a int,b int);
INSERT INTO t1 VALUES (0,1);
INSERT INTO t2 VALUES
(2,8),(81,0),(6,7),(8,1),(4,0),(0,2),(6,5),(5,4),(0,6),(9,3),
(5,0),(6,254),(6,0),(2,7),(8,73),(9,7),(3,5),(0,5),(7,75),(2,1);
SELECT ROW_NUMBER() OVER () AS rn
FROM ( t1 LEFT JOIN t2 ON (t2.a <= t1 . a ) )
WHERE t1.a = 3
GROUP BY t1.a;
rn
DROP TABLE t1,t2;
#
# Printing the true number of "using temporary table"
#
CREATE TABLE t1(a INT, b INT);
INSERT INTO t1 VALUES(1, 1);
SELECT t1.a, SUM(t2.b) OVER(ORDER BY t1.a) FROM t1, t1 AS t2 ORDER BY t2.a;
a	SUM(t2.b) OVER(ORDER BY t1.a)
1	1
SHOW STATUS LIKE 'Created_tmp_tables';
Variable_name	Value
DROP TABLE t1;
#
# Bug#26612356 WINDOW FUNCTIONS: FIX COST ESTIMATES
#
CREATE TABLE t(i INT);
INSERT INTO t VALUES
(2), (3), (1), (5), (8), (4), (6), (2), (10), (16), (4), (6), (2),
(10), (16), (8), (12), (4), (20), (32), (19), (29), (9), (49), (79),
(39), (59), (19), (99), (159), (39), (59), (19), (99), (159), (79),
(119), (39), (199), (319);
Final ORDER BY i could be eliminated
Sorting for 2nd window redundant and skipped
Could be optimized further to drop final ordering
Reordering of windows could have made it possible to eliminate final ORDER BY
Implicit grouping should eliminate windowing ordering costs: only one row
Used to miss printing the sorting key
Test optimizer trace with window costs
SET optimizer_trace="enabled=on";
Warnings:
Warning	1235	This system variable now is mock not supported
SELECT ROW_NUMBER() OVER (PARTITION BY i), SUM(i) OVER (ORDER BY i DESC) FROM t GROUP BY i ORDER BY i;
ROW_NUMBER() OVER (PARTITION BY i)	SUM(i) OVER (ORDER BY i DESC)
1	1297
1	1296
1	1294
1	1291
1	1287
1	1282
1	1276
1	1268
1	1259
1	1249
1	1237
1	1221
1	1202
1	1182
1	1153
1	1121
1	1082
1	1033
1	974
1	895
1	796
1	677
1	518
1	319
SELECT REGEXP_SUBSTR(TRACE, 'join_optimization.*', 1, 1, 'n') FROM INFORMATION_SCHEMA.OPTIMIZER_TRACE;
REGEXP_SUBSTR(TRACE, 'join_optimization.*', 1, 1, 'n')
SET optimizer_trace="enabled=off";
Warnings:
Warning	1235	This system variable now is mock not supported
DROP TABLE t;
