# In-memory tmp tables
# WL#883 Non-recursive WITH clause (common table expression)
DROP TABLE t1;
create table t1(a int, b int, c int);
insert into t1 values(null,null,null),(2,3,4);
WITH qn AS (SELECT a FROM t1)
SELECT 1 FROM dual;
1
1
# two query names
WITH qn AS (SELECT a FROM t1), qn2 as (select b from t1)
SELECT 1 FROM dual;
1
1
# duplicate query names
WITH qn AS (SELECT a FROM t1), qn as (select b from t1)
SELECT 1 FROM qn;
ERROR 42000: Not unique table/alias: 'qn'
#  multiple refs
WITH qn AS (SELECT b as a FROM t1)
SELECT qn.a, qn2.a  FROM qn, qn as qn2;
a	a
3	3
3	NULL
NULL	3
NULL	NULL
WITH qn AS (SELECT b as a FROM t1),
qn2 AS (SELECT c FROM t1 WHERE a IS NULL or a>0)
SELECT qn.a, qn2.c  FROM qn, qn2;
a	c
3	4
3	NULL
NULL	4
NULL	NULL
# qn2 ref qn:
WITH qn AS (SELECT 10*a as a FROM t1),
qn2 AS (SELECT 3*a FROM qn)
SELECT * from qn2;
3*a
NULL
60
WITH qn AS (SELECT a FROM t1), qn2 AS (SELECT a FROM qn)
SELECT * from qn2;
a
NULL
2
WITH qn AS (SELECT b as a FROM t1),
qn2 AS (SELECT a FROM qn WHERE a IS NULL or a>0)
SELECT qn.a, qn2.a  FROM qn, qn2;
a	a
3	3
3	NULL
NULL	3
NULL	NULL
explain WITH qn AS (SELECT b as a FROM t1),
qn2 AS (SELECT a FROM qn WHERE a IS NULL or a>0)
SELECT qn.a, qn2.a  FROM qn, qn2;
# forward ref (should error)
DROP TABLE qn;
WITH qn2 AS (SELECT a FROM qn WHERE a IS NULL or a>0),
qn AS (SELECT b as a FROM t1)
SELECT qn2.a  FROM qn2;
ERROR 42S02: Table 'test.qn' doesn't exist
with qn1 as (with qn3 as (select * from qn2) select * from qn3),
qn2 as (select 1)
select * from qn1;
ERROR 42S02: Table 'test.qn2' doesn't exist
# This is valid; it is to test moving boundaries.
# When we resolve qn3, resolving qn1 moves the right bound to
# qn0, but the bound is properly restored so that we can later
# resolve qn2.
with qn0 as (select 1), qn1 as (select * from qn0), qn2 as (select 1), qn3 as (select 1 from qn1, qn2) select 1 from qn3;
1
1
# No ref
explain with qn as (select 1) select 2;
with qn as (select 1) select 2;
# circular ref
WITH qn2 AS (SELECT a FROM qn WHERE a IS NULL or a>0),
qn AS (SELECT b as a FROM qn2)
SELECT qn.a  FROM qn;
ERROR 42S02: Table 'test.qn' doesn't exist
# recursive
WITH qn AS (SELECT a FROM qn)
SELECT qn.a FROM qn;
ERROR 42S02: Table 'test.qn' doesn't exist
WITH qn1 AS (SELECT a FROM qn3),
qn2 AS (SELECT a FROM qn1),
qn3 AS (SELECT a FROM t1),
qn4 AS (SELECT a FROM qn2)
SELECT a FROM qn4;
ERROR 42S02: Table 'test.qn3' doesn't exist
# ref from subq
with qn as (select * from t1) select (select max(a) from qn);
(select max(a) from qn)
2
# QN defined in subq
SELECT (WITH qn AS (SELECT 10*a as a FROM t1),
qn2 AS (SELECT 3*a AS b FROM qn)
SELECT * from qn2 LIMIT 1)
FROM t1;
(WITH qn AS (SELECT 10*a as a FROM t1),
qn2 AS (SELECT 3*a AS b FROM qn)
SELECT * from qn2 LIMIT 1)
NULL
NULL
SELECT *
FROM (WITH qn AS (SELECT 10*a as a FROM t1),
qn2 AS (SELECT 3*a AS b FROM qn)
SELECT * from qn2)
AS dt;
b
NULL
60
# WITH in WITH
with qn as
(with qn2 as (select "qn2" as a from t1) select "qn", a from qn2)
select * from qn;
qn	a
qn	qn2
qn	qn2
# outer ref to a table, placed in a QN in a subq (later)
# QN defined in view
DROP VIEW v;
CREATE VIEW v AS
WITH qn AS (SELECT 10*a as a FROM t1),
qn2 AS (SELECT 3*a AS b FROM qn)
SELECT * from qn2;
SELECT * FROM v;
b
NULL
60
DROP VIEW v;
# CREATE INSERT SELECT
CREATE TABLE t2
WITH qn AS (SELECT 10*a as a FROM t1),
qn2 AS (SELECT 3*a AS b FROM qn)
SELECT * from qn2;
SELECT * FROM t2;
b
NULL
60
INSERT INTO t2
WITH qn AS (SELECT 10*a as a FROM t1),
qn2 AS (SELECT 3*a AS b FROM qn)
SELECT * from qn2;
SELECT * FROM t2;
b
NULL
60
NULL
60
DROP TABLE t2;
# Double use of QN in two subqueries.
explain with qn as (select * from t1 limit 10)
select (select max(a) from qn where a=0),
(select min(b) from qn where b=3);
with qn as (select * from t1 limit 10)
select (select max(a) from qn where a=0),
(select min(b) from qn where b=3);
(select max(a) from qn where a=0)	(select min(b) from qn where b=3)
NULL	3
# when QN, when table.
DROP TABLE qn;
create table qn select "base";
select * from qn;
base
base
with qn as (select "with") select * from qn;
with
with
# In a non-recursive WITH, the scope of the QN doesn't extend to its
# subquery, so "qn" inside AS() is the base table.
WITH qn AS (select * from qn) select * from qn;
base
base
# View doesn't look out to external QNs
create view v as select * from qn;
select * from v;
base
base
with qn as (select "with") select * from v;
base
base
with qn as (select * from v) select * from qn;
base
base
# Even if the base table is temporarily dropped
drop table qn;
with qn as (select "with") select * from v;
ERROR 42S22: View 'test.v' references invalid table(s) or column(s) or function(s) or definer/invoker of view lack rights to use them
with qn as (select * from v) select * from qn;
ERROR 42S22: View 'test.v' references invalid table(s) or column(s) or function(s) or definer/invoker of view lack rights to use them
create table qn select "base" as a;
# Neither does SP
DROP function f;
create function f() returns varchar(10)
return (select * from qn);
select f();
f()
base
with qn as (select "with") select f();
f()
base
with qn as (select f()) select * from qn;
f()
base
# QN shadows tmp table
DROP TABLE qn;
create table qn select "base" as a;
with qn as (select "with" as a) select a from test.qn;
a
base
with qn as (select "with" as a) select qn.a from test.qn;
a
base
with qn as (select "with" as a) select test.qn.a from test.qn;
a
base
drop table qn;
with qn as (select "with" as a) select a from test.qn;
ERROR 42S02: Table 'test.qn' doesn't exist
with qn as (select "with" as a) select qn.a from test.qn;
ERROR 42S02: Table 'test.qn' doesn't exist
with qn as (select "with" as a) select test.qn.a from test.qn;
ERROR 42S02: Table 'test.qn' doesn't exist
# Unions
WITH qn AS (SELECT b as a FROM t1 UNION SELECT b+5 FROM t1),
qn2 AS (SELECT a FROM qn WHERE a IS NULL or a>0)
SELECT qn.a FROM qn
UNION SELECT qn2.a FROM qn2 WHERE qn2.a>3;
a
NULL
3
8
# No double WITH
with qn as (select "with" as a)
with qn2 as (select "with" as a)
select a from test.qn;
ERROR 42000: You have an error in your SQL syntax; check the manual that corresponds to your OceanBase version for the right syntax to use near 'with qn2 as (select "with" as a)
select a from test.qn' at line 2
# with comma
with qn as (select "with" as a),
with qn2 as (select "with" as a)
select a from test.qn;
ERROR 42000: You have an error in your SQL syntax; check the manual that corresponds to your OceanBase version for the right syntax to use near 'with qn2 as (select "with" as a)
select a from test.qn' at line 2
# ORDER BY removed unless there is LIMIT or single table (check "Using filesort")
explain
with qn as (select a from t1 order by 1)
select a from qn;
explain
with qn as (select a from t1 order by 1)
select qn.a from qn, t1 as t2;
explain
with qn as (select a from t1 order by 1 limit 10)
select qn.a from qn, t1 as t2;
# Merge hint
explain
with qn as (select a from t1),
qn2 as (select b from t1)
select /*+ merge(qn) no_merge(qn2) */ qn.a,qn2.b from qn, qn2;
explain
with qn as (select a from t1)
select /*+ merge(qn) no_merge(qn2) */ qn2.a from qn, qn as qn2;
# FD detection
set @@sql_mode ='STRICT_ALL_TABLES,NO_ZERO_IN_DATE ';
with qn as (select a, b from t1)
select b from qn group by a;
b
NULL
3
with qn as (select a, b from t1 where a=b)
select b from qn group by a;
b
with qn as (select a, sum(b) as s from t1 group by a)
select s from qn group by a;
s
NULL
3
# CTEs work if used in SET
set @myvar=
(with qn as (select a, sum(b) as s from t1 group by a)
select s from qn group by a having s is not null);
select @myvar;
@myvar
3
# CTE works with semijoin
explain with cte as (select * from t1 as t2 limit 1)
select * from t1 where t1.a in (select a+0 from cte);
with cte as (select * from t1 as t2 limit 1)
select * from t1 where t1.a in (select a+0 from cte);
a	b	c
explain with cte as (select * from t1 as t2)
select * from t1 where t1.a in (select a+0 from cte);
with cte as (select * from t1 as t2)
select * from t1 where t1.a in (select a+0 from cte);
a	b	c
2	3	4
# Column names
# empty list
with qn () as (select 1) select * from qn, qn qn1;
ERROR 42000: You have an error in your SQL syntax; check the manual that corresponds to your OceanBase version for the right syntax to use near ') as (select 1) select * from qn, qn qn1' at line 1
# Materialization
with qn (foo, bar) as (select 1) select * from qn, qn qn1;
ERROR HY000: View's SELECT and view's field list have different column counts
explain with qn (foo, bar) as (select 1, 2 from t1 limit 2) select * from qn, qn qn1;
with qn (foo, bar) as (select 1, 2 from t1 limit 2) select * from qn, qn qn1;
foo	bar	foo	bar
1	2	1	2
1	2	1	2
1	2	1	2
1	2	1	2
with qn (foo, bar) as (select 1 as col, 2 as coll from t1 limit 2) select * from qn, qn qn1;
foo	bar	foo	bar
1	2	1	2
1	2	1	2
1	2	1	2
1	2	1	2
with qn (foo, bar) as (select 1 as col, 2 as coll union
select a,b from t1) select qn1.bar from qn qn1;
bar
NULL
2
3
with qn (foo, bar) as (select a, b from t1 limit 2) select qn.bar,foo from qn;
bar	foo
NULL	NULL
3	2
drop table t3;
create table t3
with qn (foo, bar) as (select a, b from t1 limit 2) select bar,foo from qn;
desc t3;
Field	Type	Null	Key	Default	Extra
bar	int(11)	YES		NULL	
foo	int(11)	YES		NULL	
drop table t3;
# Merge
with qn (foo, bar) as (select 1 from t1) select * from qn, qn qn1;
ERROR HY000: View's SELECT and view's field list have different column counts
with qn (foo, bar) as (select 1, 2 from t1) select * from qn, qn qn1;
foo	bar	foo	bar
1	2	1	2
1	2	1	2
1	2	1	2
1	2	1	2
explain with qn (foo, bar) as (select 1, 2 from t1) select * from qn, qn qn1;
with qn (foo, bar) as (select 1 as col, 2 as coll from t1) select * from qn, qn qn1;
foo	bar	foo	bar
1	2	1	2
1	2	1	2
1	2	1	2
1	2	1	2
with qn (foo, bar) as (select a, b from t1) select qn1.bar,foo from qn qn1;
bar	foo
NULL	NULL
3	2
create table t3
with qn (foo, bar) as (select a, b from t1) select bar,foo from qn;
desc t3;
Field	Type	Null	Key	Default	Extra
bar	int(11)	YES		NULL	
foo	int(11)	YES		NULL	
drop table t3;
# Disambiguates same-name expressions
with qn as (select 1,1) select * from qn;
ERROR 42S21: Duplicate column name '1'
with qn (foo, bar) as (select 1,1) select * from qn;
foo	bar
1	1
with qn as (select 1,1 from t1) select * from qn;
ERROR 42S21: Duplicate column name '1'
with qn (foo, bar) as (select 1,1 from t1) select * from qn;
foo	bar
1	1
1	1
# Duplicate names are forbidden
with qn (foo, foo) as (select 1,2) select * from qn;
ERROR 42S21: Duplicate column name 'foo'
# Derived tables support this too
select * from (select '1', 1) dt(foo,bar);
select * from (select a,b from t1) dt(foo,bar);
foo	bar
NULL	NULL
2	3
select * from (select a from t1) dt(foo,bar);
ERROR HY000: View's SELECT and view's field list have different column counts
# Column names for QN/DT are printed
DROP view v1;
create view v1 as
with qn (foo, bar) as (select 1,1) select * from qn;
show fields from v1;
Field	Type	Null	Key	Default	Extra
foo	bigint(1)	NO			
bar	bigint(1)	NO			
select * from v1;
foo	bar
1	1
drop view v1;
create view v1 as
select * from (select 1,1) dt(foo,bar);
select * from v1;
foo	bar
1	1
drop view v1;
drop view v1;
create view v1 as
with qn (foo, bar) as (select 1,1 from t1) select * from qn;
select * from v1;
foo	bar
1	1
1	1
drop view v1;
# printing with back-quoting is necessary, when using a
# reserved word as column name.
# Works for views too. Using testcase of:
# Bug#23265335 SPECIFYING A NAME FOR VIEW'S COLUMN IN CREATE VIEW MAKES SELECT FAIL
create view v1 (bar) as
select 1 as foo from dual group by foo union select 2 order by foo;
select * from v1;
bar
1
2
# The column's name for the view
select TABLE_NAME,COLUMN_NAME from information_schema.columns
where TABLE_SCHEMA='test' and TABLE_NAME='v1';
TABLE_NAME	COLUMN_NAME
v1	bar
# is different from the alias in the defining SELECT
select VIEW_DEFINITION from information_schema.views
where TABLE_SCHEMA='test' and TABLE_NAME='v1';
VIEW_DEFINITION
(select 1 AS `bar` group by '1') union (select 2 AS `bar`) order by 1
drop view v1;
create view v1 (bar) as
select 1, 2 from t1;
ERROR HY000: View's SELECT and view's field list have different column counts
drop table t1;
# Prove that a materialized QN is shared among all references:
create table t1(a int);
insert into t1 values(1),(2),(3),(4);
with qn as (select 123 as col)
select * from qn;
col
123
show status like "handler_write";
Variable_name	Value
with qn as (select 123 as col)
select * from qn, qn as qn1;
col	col
123	123
show status like "handler_write";
Variable_name	Value
create view qn as select 123 as col;
select * from qn, qn as qn1;
col	col
123	123
show status like "handler_write";
Variable_name	Value
drop view qn;
drop table t1;
# Printing of WITH to DD for view
DROP VIEW v;
create view v as
select (with qn as (select "with") select * from qn) as scal_subq
from dual;
select * from v;
scal_subq
with
drop view v;
create view v as select * from (with qn as (select "with") select * from qn) as dt;
select * from v;
with
with
drop view v;
# Printing of merged/materialized QN, with or without alias
create table t1 (a int);
explain with qne as (select a from t1),
qnm as (select a from t1),
qnea as (select a from t1),
qnma as (select a from t1)
select /*+ merge(qne) no_merge(qnm) merge(alias1) no_merge(alias2) */
qne.a,qnm.a,alias1.a,alias2.a
from qne, qnm, qnea as alias1, qnma as alias2;
drop table t1;
# Automatic index creation if materialized
create table t1 (a int);
insert into t1(a) values (1),(2),(3),(4),(5),(6),(7),(8),(9),(0);
# EXPLAIN should not fill the tmp table
# Should use auto_key0 and ref access.
explain with tt as (select * from t1)
select /*+ no_merge(tt) */ tt.a
from t1 straight_join tt where t1.a=tt.a
limit 1;
show status like "handler_write";
Variable_name	Value
with tt as (select * from t1)
select /*+ no_merge(tt) */ tt.a
from t1 straight_join tt where t1.a=tt.a
limit 1;
a
1
show status like "handler_write";
Variable_name	Value
# With two references
with tt as (select * from t1)
select /*+ no_merge(tt) no_merge(tt_)*/ tt.a
from t1 straight_join tt straight_join tt as tt_
where t1.a=tt.a and tt.a=tt_.a
limit 1;
a
1
# One merged, one materialized: index creation on the second
# should of course ignore the first
with q as (select * from t1)
select /*+ merge(q) no_merge(q1) */ * from q, q q1 where q.a=1 and q1.a=2;
a	a
1	2
drop table t1;
# Must not create more than 64 indexes.
# Choice between two auto_key:
create table t1(a int, b int);
insert into t1 values (null, 6), (null, 10);
# Test the covering key; note that MEMORY doesn't use a
# covering key (always reads the "data file"). But InnoDB does.
explain with t2 as
(select * from t1)
SELECT /*+ no_merge(t2) */ * FROM t2
WHERE (a = a OR b <= 6) AND (a IS NULL);
with t2 as
(select * from t1)
SELECT /*+ no_merge(t2) */ * FROM t2
WHERE (a = a OR b <= 6) AND (a IS NULL);
a	b
NULL	6
drop table t1;
# QN referencing view of same name isn't a "recursive view",
# shouldn't cause ER_VIEW_RECURSIVE
create view v1 as select "with";
with v1 as (select * from v1) select * from v1;
with
with
drop view v1;
# QN inside view
create view v1 as
with qn as (select 1 as col) select * from qn;
select * from v1;
col
1
drop view v1;
create table t1(a int, b int);
# Alas merge hints are ignored in views (filed Bug#23017428)
create view v1 as
with qn as (select a from t1),
qn2 as (select b from t1)
select /*+ merge(qn) no_merge(qn2) */ qn.a,qn2.b from qn, qn2;
explain select * from v1;
drop view v1;
# Materializing view doesn't impose materializing query name
create algorithm=temptable view v1 as
with qn as (select a from t1)
select qn.a  from qn;
explain select * from v1;
drop view v1;
drop table t1;
# CTE referenced four times, including in subqueries in other CTEs
create table sales_days(day_of_sale DATE, amount INT);
insert into sales_days values
('2015-01-02', 100), ('2015-01-05', 200),
('2015-02-02', 10),  ('2015-02-10', 100),
('2015-03-02', 10),  ('2015-03-18', 1);
with
# first CTE: one row per month, with amount sold on all days of month
sales_by_month(month,total) as
(select month(day_of_sale), sum(amount) from sales_days
where year(day_of_sale)=2015
group by month(day_of_sale)),
# second CTE: best month
best_month(month, total, award) as
(select month, total, "best" from sales_by_month
where total=(select max(total) from sales_by_month)),
# 3rd CTE: worst month
worst_month(month, total, award) as
(select month, total, "worst" from sales_by_month
where total=(select min(total) from sales_by_month))
# Now show results:
select * from best_month union all select * from worst_month;
month	total	award
1	300	best
3	11	worst
drop table sales_days;
# Special parser command not allowed to users.
parse_cte ( select 1 ) ;
ERROR 42000: You have an error in your SQL syntax; check the manual that corresponds to your OceanBase version for the right syntax to use near 'parse_cte ( select 1 )' at line 1
# Query names are a partial workaround to the problem that
# user-created temp tables can't be referenced twice.
# Using a query name in UPDATE
create table t1(a int, b int);
insert into t1 values(1,2),(3,4);
create table t2 select * from t1;
set autocommit=0;
# Multi-table syntax
with qn as (select a, b from t1) update t1, qn set qn.a=qn.a+10;
ERROR HY000: The target table  of the UPDATE is not updatable
select * from t1;
a	b
1	2
3	4
rollback;
explain with qn as (select a+2 as a, b from t1) update t1, qn set t1.a=qn.a+10 where t1.a-qn.a=0;
with qn as (select a+2 as a, b from t1) update t1, qn set t1.a=qn.a+10 where t1.a-qn.a=0;
select * from t1;
a	b
1	2
13	4
rollback;
explain with qn as (select a+2 as a, b from t2) update t1, qn set t1.a=qn.a+10 where t1.a-qn.a=0;
with qn as (select a+2 as a, b from t2) update t1, qn set t1.a=qn.a+10 where t1.a-qn.a=0;
select * from t1;
a	b
1	2
13	4
rollback;
explain with qn as (select a+2 as a, b from t2) update /*+ no_merge(qn) */ t1, qn set t1.a=qn.a+10 where t1.a-qn.a=0;
with qn as (select a+2 as a, b from t2) update /*+ no_merge(qn) */ t1, qn set t1.a=qn.a+10 where t1.a-qn.a=0;
select * from t1;
a	b
1	2
13	4
rollback;
# Two references to query name
explain with qn as (select a+2 as a, b from t2)
update t1, qn, qn as qn2 set t1.a=qn.a+10 where t1.a-qn.a=0 and qn.b=qn2.b;
with qn as (select a+2 as a, b from t2)
update t1, qn, qn as qn2 set t1.a=qn.a+10 where t1.a-qn.a=0 and qn.b=qn2.b;
select * from t1;
a	b
1	2
13	4
rollback;
# Single-table syntax
explain with qn as (select a+2 as a, b from t2) update t1
set t1.a=(select qn.a+10 from qn where t1.a-qn.a=0 limit 1);
with qn as (select a+2 as a, b from t2) update t1
set t1.a=(select qn.a+10 from qn where t1.a-qn.a=0 limit 1);
select * from t1;
a	b
NULL	2
13	4
rollback;
explain with qn as (select a+2 as a, b from t2) update t1
set t1.a=(select /*+ merge(qn) */ qn.a+10 from qn where t1.a-qn.a=0 limit 1);
with qn as (select a+2 as a, b from t2) update t1
set t1.a=(select /*+ merge(qn) */ qn.a+10 from qn where t1.a-qn.a=0 limit 1);
select * from t1;
a	b
NULL	2
13	4
rollback;
# Using a query name in DELETE
# Multi-table syntax
with qn as (select a, b from t1) delete qn from t1,qn;
ERROR HY000: The target table qn of the DELETE is not updatable
select * from t1;
a	b
1	2
3	4
rollback;
explain with qn as (select a+2 as a, b from t1) delete t1 from t1, qn where t1.a-qn.a=0;
with qn as (select a+2 as a, b from t1) delete t1 from t1, qn where t1.a-qn.a=0;
select * from t1;
a	b
1	2
rollback;
explain with qn as (select a+2 as a, b from t2) delete t1 from t1, qn where t1.a-qn.a=0;
with qn as (select a+2 as a, b from t2) delete t1 from t1, qn where t1.a-qn.a=0;
select * from t1;
a	b
1	2
rollback;
explain with qn as (select a+2 as a, b from t2) delete /*+ no_merge(qn) */ t1 from t1, qn where t1.a-qn.a=0;
with qn as (select a+2 as a, b from t2) delete /*+ no_merge(qn) */ t1 from t1, qn where t1.a-qn.a=0;
select * from t1;
a	b
1	2
rollback;
explain with qn as (select a+2 as a, b from t2)
delete t1 from t1, qn, qn as qn2 where t1.a-qn.a=0 and qn.b=qn2.b;
with qn as (select a+2 as a, b from t2)
delete t1 from t1, qn, qn as qn2 where t1.a-qn.a=0 and qn.b=qn2.b;
select * from t1;
a	b
1	2
rollback;
# Single-table syntax
explain with qn as (select a+2 as a, b from t2)
delete from t1 where t1.a=(select qn.a from qn where t1.a-qn.a=0 limit 1);
with qn as (select a+2 as a, b from t2)
delete from t1 where t1.a=(select qn.a from qn where t1.a-qn.a=0 limit 1);
select * from t1;
a	b
1	2
rollback;
explain with qn as (select a+2 as a, b from t2)
delete from t1 where t1.a=(select /*+ merge(qn) */ qn.a from qn where t1.a-qn.a=0 limit 1);
with qn as (select a+2 as a, b from t2)
delete from t1 where t1.a=(select /*+ merge(qn) */ qn.a from qn where t1.a-qn.a=0 limit 1);
select * from t1;
a	b
1	2
rollback;
drop table t1,t2;
set autocommit=default;
# No default db
select database();
database()
test
create database mysqltest1;
use mysqltest1;
drop database mysqltest1;
select database();
database()
NULL
with qn as (select 1) select * from qn;
1
1
# Back to usual db 'test'
use test;
show status like 'Created_tmp_disk_tables';
Variable_name	Value
# On-disk tmp tables
# WL#883 Non-recursive WITH clause (common table expression)
DROP TABLE t1;
create table t1(a int, b int, c int);
insert into t1 values(null,null,null),(2,3,4);
WITH qn AS (SELECT a FROM t1)
SELECT 1 FROM dual;
1
1
# two query names
WITH qn AS (SELECT a FROM t1), qn2 as (select b from t1)
SELECT 1 FROM dual;
1
1
# duplicate query names
WITH qn AS (SELECT a FROM t1), qn as (select b from t1)
SELECT 1 FROM qn;
ERROR 42000: Not unique table/alias: 'qn'
#  multiple refs
WITH qn AS (SELECT b as a FROM t1)
SELECT qn.a, qn2.a  FROM qn, qn as qn2;
a	a
3	3
3	NULL
NULL	3
NULL	NULL
WITH qn AS (SELECT b as a FROM t1),
qn2 AS (SELECT c FROM t1 WHERE a IS NULL or a>0)
SELECT qn.a, qn2.c  FROM qn, qn2;
a	c
3	4
3	NULL
NULL	4
NULL	NULL
# qn2 ref qn:
WITH qn AS (SELECT 10*a as a FROM t1),
qn2 AS (SELECT 3*a FROM qn)
SELECT * from qn2;
3*a
NULL
60
WITH qn AS (SELECT a FROM t1), qn2 AS (SELECT a FROM qn)
SELECT * from qn2;
a
NULL
2
WITH qn AS (SELECT b as a FROM t1),
qn2 AS (SELECT a FROM qn WHERE a IS NULL or a>0)
SELECT qn.a, qn2.a  FROM qn, qn2;
a	a
3	3
3	NULL
NULL	3
NULL	NULL
explain WITH qn AS (SELECT b as a FROM t1),
qn2 AS (SELECT a FROM qn WHERE a IS NULL or a>0)
SELECT qn.a, qn2.a  FROM qn, qn2;
# forward ref (should error)
DROP TABLE qn;
WITH qn2 AS (SELECT a FROM qn WHERE a IS NULL or a>0),
qn AS (SELECT b as a FROM t1)
SELECT qn2.a  FROM qn2;
ERROR 42S02: Table 'test.qn' doesn't exist
with qn1 as (with qn3 as (select * from qn2) select * from qn3),
qn2 as (select 1)
select * from qn1;
ERROR 42S02: Table 'test.qn2' doesn't exist
# This is valid; it is to test moving boundaries.
# When we resolve qn3, resolving qn1 moves the right bound to
# qn0, but the bound is properly restored so that we can later
# resolve qn2.
with qn0 as (select 1), qn1 as (select * from qn0), qn2 as (select 1), qn3 as (select 1 from qn1, qn2) select 1 from qn3;
1
1
# No ref
explain with qn as (select 1) select 2;
with qn as (select 1) select 2;
# circular ref
WITH qn2 AS (SELECT a FROM qn WHERE a IS NULL or a>0),
qn AS (SELECT b as a FROM qn2)
SELECT qn.a  FROM qn;
ERROR 42S02: Table 'test.qn' doesn't exist
# recursive
WITH qn AS (SELECT a FROM qn)
SELECT qn.a FROM qn;
ERROR 42S02: Table 'test.qn' doesn't exist
WITH qn1 AS (SELECT a FROM qn3),
qn2 AS (SELECT a FROM qn1),
qn3 AS (SELECT a FROM t1),
qn4 AS (SELECT a FROM qn2)
SELECT a FROM qn4;
ERROR 42S02: Table 'test.qn3' doesn't exist
# ref from subq
with qn as (select * from t1) select (select max(a) from qn);
(select max(a) from qn)
2
# QN defined in subq
SELECT (WITH qn AS (SELECT 10*a as a FROM t1),
qn2 AS (SELECT 3*a AS b FROM qn)
SELECT * from qn2 LIMIT 1)
FROM t1;
(WITH qn AS (SELECT 10*a as a FROM t1),
qn2 AS (SELECT 3*a AS b FROM qn)
SELECT * from qn2 LIMIT 1)
NULL
NULL
SELECT *
FROM (WITH qn AS (SELECT 10*a as a FROM t1),
qn2 AS (SELECT 3*a AS b FROM qn)
SELECT * from qn2)
AS dt;
b
NULL
60
# WITH in WITH
with qn as
(with qn2 as (select "qn2" as a from t1) select "qn", a from qn2)
select * from qn;
qn	a
qn	qn2
qn	qn2
# outer ref to a table, placed in a QN in a subq (later)
# QN defined in view
DROP VIEW v;
CREATE VIEW v AS
WITH qn AS (SELECT 10*a as a FROM t1),
qn2 AS (SELECT 3*a AS b FROM qn)
SELECT * from qn2;
SELECT * FROM v;
b
NULL
60
DROP VIEW v;
# CREATE INSERT SELECT
CREATE TABLE t2
WITH qn AS (SELECT 10*a as a FROM t1),
qn2 AS (SELECT 3*a AS b FROM qn)
SELECT * from qn2;
SELECT * FROM t2;
b
NULL
60
INSERT INTO t2
WITH qn AS (SELECT 10*a as a FROM t1),
qn2 AS (SELECT 3*a AS b FROM qn)
SELECT * from qn2;
SELECT * FROM t2;
b
NULL
60
NULL
60
DROP TABLE t2;
# Double use of QN in two subqueries.
explain with qn as (select * from t1 limit 10)
select (select max(a) from qn where a=0),
(select min(b) from qn where b=3);
with qn as (select * from t1 limit 10)
select (select max(a) from qn where a=0),
(select min(b) from qn where b=3);
(select max(a) from qn where a=0)	(select min(b) from qn where b=3)
NULL	3
# when QN, when table.
DROP TABLE qn;
create table qn select "base";
select * from qn;
base
base
with qn as (select "with") select * from qn;
with
with
# In a non-recursive WITH, the scope of the QN doesn't extend to its
# subquery, so "qn" inside AS() is the base table.
WITH qn AS (select * from qn) select * from qn;
base
base
# View doesn't look out to external QNs
create view v as select * from qn;
select * from v;
base
base
with qn as (select "with") select * from v;
base
base
with qn as (select * from v) select * from qn;
base
base
# Even if the base table is temporarily dropped
drop table qn;
with qn as (select "with") select * from v;
ERROR 42S22: View 'test.v' references invalid table(s) or column(s) or function(s) or definer/invoker of view lack rights to use them
with qn as (select * from v) select * from qn;
ERROR 42S22: View 'test.v' references invalid table(s) or column(s) or function(s) or definer/invoker of view lack rights to use them
create table qn select "base" as a;
# Neither does SP
DROP function f;
create function f() returns varchar(10)
return (select * from qn);
select f();
f()
base
with qn as (select "with") select f();
f()
base
with qn as (select f()) select * from qn;
f()
base
# QN shadows tmp table
DROP TABLE qn;
create table qn select "base" as a;
with qn as (select "with" as a) select a from test.qn;
a
base
with qn as (select "with" as a) select qn.a from test.qn;
a
base
with qn as (select "with" as a) select test.qn.a from test.qn;
a
base
drop table qn;
with qn as (select "with" as a) select a from test.qn;
ERROR 42S02: Table 'test.qn' doesn't exist
with qn as (select "with" as a) select qn.a from test.qn;
ERROR 42S02: Table 'test.qn' doesn't exist
with qn as (select "with" as a) select test.qn.a from test.qn;
ERROR 42S02: Table 'test.qn' doesn't exist
# Unions
WITH qn AS (SELECT b as a FROM t1 UNION SELECT b+5 FROM t1),
qn2 AS (SELECT a FROM qn WHERE a IS NULL or a>0)
SELECT qn.a FROM qn
UNION SELECT qn2.a FROM qn2 WHERE qn2.a>3;
a
NULL
3
8
# No double WITH
with qn as (select "with" as a)
with qn2 as (select "with" as a)
select a from test.qn;
ERROR 42000: You have an error in your SQL syntax; check the manual that corresponds to your OceanBase version for the right syntax to use near 'with qn2 as (select "with" as a)
select a from test.qn' at line 2
# with comma
with qn as (select "with" as a),
with qn2 as (select "with" as a)
select a from test.qn;
ERROR 42000: You have an error in your SQL syntax; check the manual that corresponds to your OceanBase version for the right syntax to use near 'with qn2 as (select "with" as a)
select a from test.qn' at line 2
# ORDER BY removed unless there is LIMIT or single table (check "Using filesort")
explain
with qn as (select a from t1 order by 1)
select a from qn;
explain
with qn as (select a from t1 order by 1)
select qn.a from qn, t1 as t2;
explain
with qn as (select a from t1 order by 1 limit 10)
select qn.a from qn, t1 as t2;
# Merge hint
explain
with qn as (select a from t1),
qn2 as (select b from t1)
select /*+ merge(qn) no_merge(qn2) */ qn.a,qn2.b from qn, qn2;
explain
with qn as (select a from t1)
select /*+ merge(qn) no_merge(qn2) */ qn2.a from qn, qn as qn2;
# FD detection
set @@sql_mode ='STRICT_ALL_TABLES,NO_ZERO_IN_DATE ';
with qn as (select a, b from t1)
select b from qn group by a;
b
NULL
3
with qn as (select a, b from t1 where a=b)
select b from qn group by a;
b
with qn as (select a, sum(b) as s from t1 group by a)
select s from qn group by a;
s
NULL
3
# CTEs work if used in SET
set @myvar=
(with qn as (select a, sum(b) as s from t1 group by a)
select s from qn group by a having s is not null);
select @myvar;
@myvar
3
# CTE works with semijoin
explain with cte as (select * from t1 as t2 limit 1)
select * from t1 where t1.a in (select a+0 from cte);
with cte as (select * from t1 as t2 limit 1)
select * from t1 where t1.a in (select a+0 from cte);
a	b	c
explain with cte as (select * from t1 as t2)
select * from t1 where t1.a in (select a+0 from cte);
with cte as (select * from t1 as t2)
select * from t1 where t1.a in (select a+0 from cte);
a	b	c
2	3	4
# Column names
# empty list
with qn () as (select 1) select * from qn, qn qn1;
ERROR 42000: You have an error in your SQL syntax; check the manual that corresponds to your OceanBase version for the right syntax to use near ') as (select 1) select * from qn, qn qn1' at line 1
# Materialization
with qn (foo, bar) as (select 1) select * from qn, qn qn1;
ERROR HY000: View's SELECT and view's field list have different column counts
explain with qn (foo, bar) as (select 1, 2 from t1 limit 2) select * from qn, qn qn1;
with qn (foo, bar) as (select 1, 2 from t1 limit 2) select * from qn, qn qn1;
foo	bar	foo	bar
1	2	1	2
1	2	1	2
1	2	1	2
1	2	1	2
with qn (foo, bar) as (select 1 as col, 2 as coll from t1 limit 2) select * from qn, qn qn1;
foo	bar	foo	bar
1	2	1	2
1	2	1	2
1	2	1	2
1	2	1	2
with qn (foo, bar) as (select 1 as col, 2 as coll union
select a,b from t1) select qn1.bar from qn qn1;
bar
NULL
2
3
with qn (foo, bar) as (select a, b from t1 limit 2) select qn.bar,foo from qn;
bar	foo
NULL	NULL
3	2
drop table t3;
create table t3
with qn (foo, bar) as (select a, b from t1 limit 2) select bar,foo from qn;
desc t3;
Field	Type	Null	Key	Default	Extra
bar	int(11)	YES		NULL	
foo	int(11)	YES		NULL	
drop table t3;
# Merge
with qn (foo, bar) as (select 1 from t1) select * from qn, qn qn1;
ERROR HY000: View's SELECT and view's field list have different column counts
with qn (foo, bar) as (select 1, 2 from t1) select * from qn, qn qn1;
foo	bar	foo	bar
1	2	1	2
1	2	1	2
1	2	1	2
1	2	1	2
explain with qn (foo, bar) as (select 1, 2 from t1) select * from qn, qn qn1;
with qn (foo, bar) as (select 1 as col, 2 as coll from t1) select * from qn, qn qn1;
foo	bar	foo	bar
1	2	1	2
1	2	1	2
1	2	1	2
1	2	1	2
with qn (foo, bar) as (select a, b from t1) select qn1.bar,foo from qn qn1;
bar	foo
NULL	NULL
3	2
create table t3
with qn (foo, bar) as (select a, b from t1) select bar,foo from qn;
desc t3;
Field	Type	Null	Key	Default	Extra
bar	int(11)	YES		NULL	
foo	int(11)	YES		NULL	
drop table t3;
# Disambiguates same-name expressions
with qn as (select 1,1) select * from qn;
ERROR 42S21: Duplicate column name '1'
with qn (foo, bar) as (select 1,1) select * from qn;
foo	bar
1	1
with qn as (select 1,1 from t1) select * from qn;
ERROR 42S21: Duplicate column name '1'
with qn (foo, bar) as (select 1,1 from t1) select * from qn;
foo	bar
1	1
1	1
# Duplicate names are forbidden
with qn (foo, foo) as (select 1,2) select * from qn;
ERROR 42S21: Duplicate column name 'foo'
# Derived tables support this too
select * from (select '1', 1) dt(foo,bar);
select * from (select a,b from t1) dt(foo,bar);
foo	bar
NULL	NULL
2	3
select * from (select a from t1) dt(foo,bar);
ERROR HY000: View's SELECT and view's field list have different column counts
# Column names for QN/DT are printed
DROP view v1;
create view v1 as
with qn (foo, bar) as (select 1,1) select * from qn;
show fields from v1;
Field	Type	Null	Key	Default	Extra
foo	bigint(1)	NO			
bar	bigint(1)	NO			
select * from v1;
foo	bar
1	1
drop view v1;
create view v1 as
select * from (select 1,1) dt(foo,bar);
select * from v1;
foo	bar
1	1
drop view v1;
drop view v1;
create view v1 as
with qn (foo, bar) as (select 1,1 from t1) select * from qn;
select * from v1;
foo	bar
1	1
1	1
drop view v1;
# printing with back-quoting is necessary, when using a
# reserved word as column name.
# Works for views too. Using testcase of:
# Bug#23265335 SPECIFYING A NAME FOR VIEW'S COLUMN IN CREATE VIEW MAKES SELECT FAIL
create view v1 (bar) as
select 1 as foo from dual group by foo union select 2 order by foo;
select * from v1;
bar
1
2
# The column's name for the view
select TABLE_NAME,COLUMN_NAME from information_schema.columns
where TABLE_SCHEMA='test' and TABLE_NAME='v1';
TABLE_NAME	COLUMN_NAME
v1	bar
# is different from the alias in the defining SELECT
select VIEW_DEFINITION from information_schema.views
where TABLE_SCHEMA='test' and TABLE_NAME='v1';
VIEW_DEFINITION
(select 1 AS `bar` group by '1') union (select 2 AS `bar`) order by 1
drop view v1;
create view v1 (bar) as
select 1, 2 from t1;
ERROR HY000: View's SELECT and view's field list have different column counts
drop table t1;
# Prove that a materialized QN is shared among all references:
create table t1(a int);
insert into t1 values(1),(2),(3),(4);
with qn as (select 123 as col)
select * from qn;
col
123
show status like "handler_write";
Variable_name	Value
with qn as (select 123 as col)
select * from qn, qn as qn1;
col	col
123	123
show status like "handler_write";
Variable_name	Value
create view qn as select 123 as col;
select * from qn, qn as qn1;
col	col
123	123
show status like "handler_write";
Variable_name	Value
drop view qn;
drop table t1;
# Printing of WITH to DD for view
DROP VIEW v;
create view v as
select (with qn as (select "with") select * from qn) as scal_subq
from dual;
select * from v;
scal_subq
with
drop view v;
create view v as select * from (with qn as (select "with") select * from qn) as dt;
select * from v;
with
with
drop view v;
# Printing of merged/materialized QN, with or without alias
create table t1 (a int);
explain with qne as (select a from t1),
qnm as (select a from t1),
qnea as (select a from t1),
qnma as (select a from t1)
select /*+ merge(qne) no_merge(qnm) merge(alias1) no_merge(alias2) */
qne.a,qnm.a,alias1.a,alias2.a
from qne, qnm, qnea as alias1, qnma as alias2;
drop table t1;
# Automatic index creation if materialized
create table t1 (a int);
insert into t1(a) values (1),(2),(3),(4),(5),(6),(7),(8),(9),(0);
# EXPLAIN should not fill the tmp table
# Should use auto_key0 and ref access.
explain with tt as (select * from t1)
select /*+ no_merge(tt) */ tt.a
from t1 straight_join tt where t1.a=tt.a
limit 1;
show status like "handler_write";
Variable_name	Value
with tt as (select * from t1)
select /*+ no_merge(tt) */ tt.a
from t1 straight_join tt where t1.a=tt.a
limit 1;
a
1
show status like "handler_write";
Variable_name	Value
# With two references
with tt as (select * from t1)
select /*+ no_merge(tt) no_merge(tt_)*/ tt.a
from t1 straight_join tt straight_join tt as tt_
where t1.a=tt.a and tt.a=tt_.a
limit 1;
a
1
# One merged, one materialized: index creation on the second
# should of course ignore the first
with q as (select * from t1)
select /*+ merge(q) no_merge(q1) */ * from q, q q1 where q.a=1 and q1.a=2;
a	a
1	2
drop table t1;
# Must not create more than 64 indexes.
# Choice between two auto_key:
create table t1(a int, b int);
insert into t1 values (null, 6), (null, 10);
# Test the covering key; note that MEMORY doesn't use a
# covering key (always reads the "data file"). But InnoDB does.
explain with t2 as
(select * from t1)
SELECT /*+ no_merge(t2) */ * FROM t2
WHERE (a = a OR b <= 6) AND (a IS NULL);
with t2 as
(select * from t1)
SELECT /*+ no_merge(t2) */ * FROM t2
WHERE (a = a OR b <= 6) AND (a IS NULL);
a	b
NULL	6
drop table t1;
# QN referencing view of same name isn't a "recursive view",
# shouldn't cause ER_VIEW_RECURSIVE
create view v1 as select "with";
with v1 as (select * from v1) select * from v1;
with
with
drop view v1;
# QN inside view
create view v1 as
with qn as (select 1 as col) select * from qn;
select * from v1;
col
1
drop view v1;
create table t1(a int, b int);
# Alas merge hints are ignored in views (filed Bug#23017428)
create view v1 as
with qn as (select a from t1),
qn2 as (select b from t1)
select /*+ merge(qn) no_merge(qn2) */ qn.a,qn2.b from qn, qn2;
explain select * from v1;
drop view v1;
# Materializing view doesn't impose materializing query name
create algorithm=temptable view v1 as
with qn as (select a from t1)
select qn.a  from qn;
explain select * from v1;
drop view v1;
drop table t1;
# CTE referenced four times, including in subqueries in other CTEs
create table sales_days(day_of_sale DATE, amount INT);
insert into sales_days values
('2015-01-02', 100), ('2015-01-05', 200),
('2015-02-02', 10),  ('2015-02-10', 100),
('2015-03-02', 10),  ('2015-03-18', 1);
with
# first CTE: one row per month, with amount sold on all days of month
sales_by_month(month,total) as
(select month(day_of_sale), sum(amount) from sales_days
where year(day_of_sale)=2015
group by month(day_of_sale)),
# second CTE: best month
best_month(month, total, award) as
(select month, total, "best" from sales_by_month
where total=(select max(total) from sales_by_month)),
# 3rd CTE: worst month
worst_month(month, total, award) as
(select month, total, "worst" from sales_by_month
where total=(select min(total) from sales_by_month))
# Now show results:
select * from best_month union all select * from worst_month;
month	total	award
1	300	best
3	11	worst
drop table sales_days;
# Special parser command not allowed to users.
parse_cte ( select 1 ) ;
ERROR 42000: You have an error in your SQL syntax; check the manual that corresponds to your OceanBase version for the right syntax to use near 'parse_cte ( select 1 )' at line 1
# Query names are a partial workaround to the problem that
# user-created temp tables can't be referenced twice.
# Using a query name in UPDATE
create table t1(a int, b int);
insert into t1 values(1,2),(3,4);
create table t2 select * from t1;
set autocommit=0;
# Multi-table syntax
with qn as (select a, b from t1) update t1, qn set qn.a=qn.a+10;
ERROR HY000: The target table  of the UPDATE is not updatable
select * from t1;
a	b
1	2
3	4
rollback;
explain with qn as (select a+2 as a, b from t1) update t1, qn set t1.a=qn.a+10 where t1.a-qn.a=0;
with qn as (select a+2 as a, b from t1) update t1, qn set t1.a=qn.a+10 where t1.a-qn.a=0;
select * from t1;
a	b
1	2
13	4
rollback;
explain with qn as (select a+2 as a, b from t2) update t1, qn set t1.a=qn.a+10 where t1.a-qn.a=0;
with qn as (select a+2 as a, b from t2) update t1, qn set t1.a=qn.a+10 where t1.a-qn.a=0;
select * from t1;
a	b
1	2
13	4
rollback;
explain with qn as (select a+2 as a, b from t2) update /*+ no_merge(qn) */ t1, qn set t1.a=qn.a+10 where t1.a-qn.a=0;
with qn as (select a+2 as a, b from t2) update /*+ no_merge(qn) */ t1, qn set t1.a=qn.a+10 where t1.a-qn.a=0;
select * from t1;
a	b
1	2
13	4
rollback;
# Two references to query name
explain with qn as (select a+2 as a, b from t2)
update t1, qn, qn as qn2 set t1.a=qn.a+10 where t1.a-qn.a=0 and qn.b=qn2.b;
with qn as (select a+2 as a, b from t2)
update t1, qn, qn as qn2 set t1.a=qn.a+10 where t1.a-qn.a=0 and qn.b=qn2.b;
select * from t1;
a	b
1	2
13	4
rollback;
# Single-table syntax
explain with qn as (select a+2 as a, b from t2) update t1
set t1.a=(select qn.a+10 from qn where t1.a-qn.a=0 limit 1);
with qn as (select a+2 as a, b from t2) update t1
set t1.a=(select qn.a+10 from qn where t1.a-qn.a=0 limit 1);
select * from t1;
a	b
NULL	2
13	4
rollback;
explain with qn as (select a+2 as a, b from t2) update t1
set t1.a=(select /*+ merge(qn) */ qn.a+10 from qn where t1.a-qn.a=0 limit 1);
with qn as (select a+2 as a, b from t2) update t1
set t1.a=(select /*+ merge(qn) */ qn.a+10 from qn where t1.a-qn.a=0 limit 1);
select * from t1;
a	b
NULL	2
13	4
rollback;
# Using a query name in DELETE
# Multi-table syntax
with qn as (select a, b from t1) delete qn from t1,qn;
ERROR HY000: The target table qn of the DELETE is not updatable
select * from t1;
a	b
1	2
3	4
rollback;
explain with qn as (select a+2 as a, b from t1) delete t1 from t1, qn where t1.a-qn.a=0;
with qn as (select a+2 as a, b from t1) delete t1 from t1, qn where t1.a-qn.a=0;
select * from t1;
a	b
1	2
rollback;
explain with qn as (select a+2 as a, b from t2) delete t1 from t1, qn where t1.a-qn.a=0;
with qn as (select a+2 as a, b from t2) delete t1 from t1, qn where t1.a-qn.a=0;
select * from t1;
a	b
1	2
rollback;
explain with qn as (select a+2 as a, b from t2) delete /*+ no_merge(qn) */ t1 from t1, qn where t1.a-qn.a=0;
with qn as (select a+2 as a, b from t2) delete /*+ no_merge(qn) */ t1 from t1, qn where t1.a-qn.a=0;
select * from t1;
a	b
1	2
rollback;
explain with qn as (select a+2 as a, b from t2)
delete t1 from t1, qn, qn as qn2 where t1.a-qn.a=0 and qn.b=qn2.b;
with qn as (select a+2 as a, b from t2)
delete t1 from t1, qn, qn as qn2 where t1.a-qn.a=0 and qn.b=qn2.b;
select * from t1;
a	b
1	2
rollback;
# Single-table syntax
explain with qn as (select a+2 as a, b from t2)
delete from t1 where t1.a=(select qn.a from qn where t1.a-qn.a=0 limit 1);
with qn as (select a+2 as a, b from t2)
delete from t1 where t1.a=(select qn.a from qn where t1.a-qn.a=0 limit 1);
select * from t1;
a	b
1	2
rollback;
explain with qn as (select a+2 as a, b from t2)
delete from t1 where t1.a=(select /*+ merge(qn) */ qn.a from qn where t1.a-qn.a=0 limit 1);
with qn as (select a+2 as a, b from t2)
delete from t1 where t1.a=(select /*+ merge(qn) */ qn.a from qn where t1.a-qn.a=0 limit 1);
select * from t1;
a	b
1	2
rollback;
drop table t1,t2;
set autocommit=default;
# No default db
select database();
database()
test
create database mysqltest1;
use mysqltest1;
drop database mysqltest1;
select database();
database()
NULL
with qn as (select 1) select * from qn;
1
1
# Back to usual db 'test'
use test;
show status like 'Created_tmp_disk_tables';
Variable_name	Value
