drop database IF EXISTS  db1;
create database db1;
use db1;
##设置超时时间
SET wait_timeout=30000000;
SET ob_trx_timeout = 30000000;
SET ob_query_timeout = 30000000;
##设置相同sql_mode;
SET @@sql_mode='STRICT_TRANS_TABLES,NO_ENGINE_SUBSTITUTION,no_zero_date,no_zero_in_date,PIPES_AS_CONCAT';
##基本语法
##after+update+follows/precedes
drop table if exists t1;
Warnings:
Note	1051	Unknown table 'db1.t1'
drop table if exists t2;
Warnings:
Note	1051	Unknown table 'db1.t2'
create table t1 (c1 int, c2 varchar(128)) default charset='utf8';
create table t2 (a1 int, a2 varchar(128)) default charset='utf8';
insert into t1 values(5, '爱E族');
create trigger tr1
after update on t1
for each row 
begin
insert into t2 values(7,'www.com');
update t2 set a2 = 'a2' where a1 =7;
end
//
create trigger tr2
after update on t1 
for each row follows tr1
begin
insert into t2 values(6,'www.com');
update t2 set a2 = 'aa' where a1 =7;
end 
//
update t1 set c1=6 where c2='爱E族';
select * from t1;
c1	c2
6	爱E族
select * from t2;
a1	a2
6	www.com
7	aa
SELECT ACTION_ORDER  FROM information_schema.triggers WHERE trigger_name= 'tr1' and trigger_schema ='db1';
ACTION_ORDER
1
SELECT ACTION_ORDER  FROM information_schema.triggers WHERE trigger_name= 'tr2' and trigger_schema ='db1';
ACTION_ORDER
2
drop table if exists t1;
drop table if exists t2;
create table t1 (c1 int, c2 varchar(128)) default charset='utf8';
create table t2 (a1 int, a2 varchar(128)) default charset='utf8';
insert into t1 values(5, '爱E族');
create trigger tr1
after update on t1
for each row 
begin
insert into t2 values(7,'www.com');
update t2 set a2 = 'a2' where a1 =7;
end
//
create trigger tr2
after update on t1 
for each row precedes tr1
begin
insert into t2 values(6,'www.com');
update t2 set a2 = 'aa' where a1 =7;
end 
//
update t1 set c1=6 where c2='爱E族';
select * from t1;
c1	c2
6	爱E族
select * from t2;
a1	a2
6	www.com
7	a2
SELECT ACTION_ORDER  FROM information_schema.triggers WHERE trigger_name= 'tr1' and trigger_schema ='db1';
ACTION_ORDER
2
SELECT ACTION_ORDER  FROM information_schema.triggers WHERE trigger_name= 'tr2' and trigger_schema ='db1';
ACTION_ORDER
1
##after+insert+follows/precedes
drop table if exists t1;
drop table if exists t2;
create table t1 (c1 int, c2 varchar(128)) default charset='utf8';
create table t2 (a1 int, a2 varchar(128)) default charset='utf8';
create trigger tr1
after insert on t1
for each row 
begin
insert into t2 values(7,'www.com');
update t2 set a2 = 'a2' where a1 =7;
end
//
create trigger tr2
after insert on t1 
for each row follows tr1
begin
insert into t2 values(6,'www.com');
update t2 set a2 = 'aa' where a1 =7;
end 
//
insert into t1 values(5, '爱E族');
select * from t1;
c1	c2
5	爱E族
select * from t2;
a1	a2
6	www.com
7	aa
SELECT ACTION_ORDER  FROM information_schema.triggers WHERE trigger_name= 'tr1' and trigger_schema ='db1';
ACTION_ORDER
1
SELECT ACTION_ORDER  FROM information_schema.triggers WHERE trigger_name= 'tr2' and trigger_schema ='db1';
ACTION_ORDER
2
drop table if exists t1;
drop table if exists t2;
create table t1 (c1 int, c2 varchar(128)) default charset='utf8';
create table t2 (a1 int, a2 varchar(128)) default charset='utf8';
create trigger tr1
after insert on t1
for each row 
begin
insert into t2 values(7,'www.com');
update t2 set a2 = 'a2' where a1 =7;
end
//
create trigger tr2
after insert on t1 
for each row precedes tr1
begin
insert into t2 values(6,'www.com');
update t2 set a2 = 'aa' where a1 =7;
end 
//
insert into t1 values(5, '爱E族');
select * from t1;
c1	c2
5	爱E族
select * from t2;
a1	a2
6	www.com
7	a2
SELECT ACTION_ORDER  FROM information_schema.triggers WHERE trigger_name= 'tr1' and trigger_schema ='db1';
ACTION_ORDER
2
SELECT ACTION_ORDER  FROM information_schema.triggers WHERE trigger_name= 'tr2' and trigger_schema ='db1';
ACTION_ORDER
1
##after+delete+follows/precedes
drop table if exists t1;
drop table if exists t2;
create table t1 (c1 int, c2 varchar(128)) default charset='utf8';
create table t2 (a1 int, a2 varchar(128)) default charset='utf8';
insert into t1 values(5, '爱E族');
create trigger tr1
after delete on t1
for each row 
begin
insert into t2 values(7,'www.com');
update t2 set a2 = 'a2' where a1 =7;
end
//
create trigger tr2
after delete on t1 
for each row follows tr1
begin
insert into t2 values(6,'www.com');
update t2 set a2 = 'aa' where a1 =7;
end 
//
delete from t1 where c1=5;
select * from t1;
c1	c2
select * from t2;
a1	a2
6	www.com
7	aa
SELECT ACTION_ORDER  FROM information_schema.triggers WHERE trigger_name= 'tr1' and trigger_schema ='db1';
ACTION_ORDER
1
SELECT ACTION_ORDER  FROM information_schema.triggers WHERE trigger_name= 'tr2' and trigger_schema ='db1';
ACTION_ORDER
2
drop table if exists t1;
drop table if exists t2;
create table t1 (c1 int, c2 varchar(128)) default charset='utf8';
create table t2 (a1 int, a2 varchar(128)) default charset='utf8';
insert into t1 values(5, '爱E族');
create trigger tr1
after delete on t1
for each row 
begin
insert into t2 values(7,'www.com');
update t2 set a2 = 'a2' where a1 =7;
end
//
create trigger tr2
after delete on t1 
for each row precedes tr1
begin
insert into t2 values(6,'www.com');
update t2 set a2 = 'aa' where a1 =7;
end 
//
delete from t1 where c1=5;
select * from t1;
c1	c2
select * from t2;
a1	a2
6	www.com
7	a2
SELECT ACTION_ORDER  FROM information_schema.triggers WHERE trigger_name= 'tr1' and trigger_schema ='db1';
ACTION_ORDER
2
SELECT ACTION_ORDER  FROM information_schema.triggers WHERE trigger_name= 'tr2' and trigger_schema ='db1';
ACTION_ORDER
1
##before+update+folows/precedes
drop table if exists t1;
drop table if exists t2;
create table t1 (c1 int, c2 varchar(128)) default charset='utf8';
create table t2 (a1 int, a2 varchar(128)) default charset='utf8';
insert into t1 values(5, '爱E族');
create trigger tr1
before update on t1
for each row 
begin
insert into t2 values(7,'www.com');
update t2 set a2 = 'a2' where a1 =7;
end
//
create trigger tr2
before update on t1 
for each row follows tr1
begin
insert into t2 values(6,'www.com');
update t2 set a2 = 'aa' where a1 =7;
end 
//
update t1 set c1=6 where c2='爱E族';
select * from t1;
c1	c2
6	爱E族
select * from t2;
a1	a2
6	www.com
7	aa
SELECT ACTION_ORDER  FROM information_schema.triggers WHERE trigger_name= 'tr1' and trigger_schema ='db1';
ACTION_ORDER
1
SELECT ACTION_ORDER  FROM information_schema.triggers WHERE trigger_name= 'tr2' and trigger_schema ='db1';
ACTION_ORDER
2
drop table if exists t1;
drop table if exists t2;
create table t1 (c1 int, c2 varchar(128)) default charset='utf8';
create table t2 (a1 int, a2 varchar(128)) default charset='utf8';
insert into t1 values(5, '爱E族');
create trigger tr1
before update on t1
for each row 
begin
insert into t2 values(7,'www.com');
update t2 set a2 = 'a2' where a1 =7;
end
//
create trigger tr2
before update on t1 
for each row precedes tr1
begin
insert into t2 values(6,'www.com');
update t2 set a2 = 'aa' where a1 =7;
end 
//
update t1 set c1=6 where c2='爱E族';
select * from t1;
c1	c2
6	爱E族
select * from t2;
a1	a2
6	www.com
7	a2
SELECT ACTION_ORDER  FROM information_schema.triggers WHERE trigger_name= 'tr1' and trigger_schema ='db1';
ACTION_ORDER
2
SELECT ACTION_ORDER  FROM information_schema.triggers WHERE trigger_name= 'tr2' and trigger_schema ='db1';
ACTION_ORDER
1
##before+insert+folows/precedes
drop table if exists t1;
drop table if exists t2;
create table t1 (c1 int, c2 varchar(128)) default charset='utf8';
create table t2 (a1 int, a2 varchar(128)) default charset='utf8';
create trigger tr1
before insert on t1
for each row 
begin
insert into t2 values(7,'www.com');
update t2 set a2 = 'a2' where a1 =7;
end
//
create trigger tr2
before insert on t1 
for each row follows tr1
begin
insert into t2 values(6,'www.com');
update t2 set a2 = 'aa' where a1 =7;
end 
//
insert into t1 values(5, '爱E族');
select * from t1;
c1	c2
5	爱E族
select * from t2;
a1	a2
6	www.com
7	aa
SELECT ACTION_ORDER  FROM information_schema.triggers WHERE trigger_name= 'tr1' and trigger_schema ='db1';
ACTION_ORDER
1
SELECT ACTION_ORDER  FROM information_schema.triggers WHERE trigger_name= 'tr2' and trigger_schema ='db1';
ACTION_ORDER
2
drop table if exists t1;
drop table if exists t2;
create table t1 (c1 int, c2 varchar(128)) default charset='utf8';
create table t2 (a1 int, a2 varchar(128)) default charset='utf8';
create trigger tr1
before insert on t1
for each row 
begin
insert into t2 values(7,'www.com');
update t2 set a2 = 'a2' where a1 =7;
end
//
create trigger tr2
before insert on t1 
for each row precedes tr1
begin
insert into t2 values(6,'www.com');
update t2 set a2 = 'aa' where a1 =7;
end 
//
insert into t1 values(5, '爱E族');
select * from t1;
c1	c2
5	爱E族
select * from t2;
a1	a2
6	www.com
7	a2
SELECT ACTION_ORDER  FROM information_schema.triggers WHERE trigger_name= 'tr1' and trigger_schema ='db1';
ACTION_ORDER
2
SELECT ACTION_ORDER  FROM information_schema.triggers WHERE trigger_name= 'tr2' and trigger_schema ='db1';
ACTION_ORDER
1
##before+delete+folows/precedes
drop table if exists t1;
drop table if exists t2;
create table t1 (c1 int, c2 varchar(128)) default charset='utf8';
create table t2 (a1 int, a2 varchar(128)) default charset='utf8';
insert into t1 values(5, '爱E族');
create trigger tr1
before delete on t1
for each row 
begin
insert into t2 values(7,'www.com');
update t2 set a2 = 'a2' where a1 =7;
end
//
create trigger tr2
before delete on t1 
for each row follows tr1
begin
insert into t2 values(6,'www.com');
update t2 set a2 = 'aa' where a1 =7;
end 
//
delete from t1 where c1=5;
select * from t1;
c1	c2
select * from t2;
a1	a2
6	www.com
7	aa
SELECT ACTION_ORDER  FROM information_schema.triggers WHERE trigger_name= 'tr1' and trigger_schema ='db1';
ACTION_ORDER
1
SELECT ACTION_ORDER  FROM information_schema.triggers WHERE trigger_name= 'tr2' and trigger_schema ='db1';
ACTION_ORDER
2
drop table if exists t1;
drop table if exists t2;
create table t1 (c1 int, c2 varchar(128)) default charset='utf8';
create table t2 (a1 int, a2 varchar(128)) default charset='utf8';
insert into t1 values(5, '爱E族');
create trigger tr1
before delete on t1
for each row 
begin
insert into t2 values(7,'www.com');
update t2 set a2 = 'a2' where a1 =7;
end
//
create trigger tr2
before delete on t1 
for each row precedes tr1
begin
insert into t2 values(6,'www.com');
update t2 set a2 = 'aa' where a1 =7;
end 
//
delete from t1 where c1=5;
select * from t1;
c1	c2
select * from t2;
a1	a2
6	www.com
7	a2
SELECT ACTION_ORDER  FROM information_schema.triggers WHERE trigger_name= 'tr1' and trigger_schema ='db1';
ACTION_ORDER
2
SELECT ACTION_ORDER  FROM information_schema.triggers WHERE trigger_name= 'tr2' and trigger_schema ='db1';
ACTION_ORDER
1
##创建两个触发器,再删除不带可选参数,创建带可选参数的触发器
drop table if exists t1;
drop table if exists t2;
create table t1 (c1 int, c2 varchar(128)) default charset='utf8';
create table t2 (a1 int, a2 varchar(128)) default charset='utf8';
insert into t1 values(5, '爱E族');
create trigger tr1
before update on t1
for each row 
begin
insert into t2 values(7,'www.com');
update t2 set a2 = 'a2' where a1 =7;
end
//
create trigger tr2
before update on t1 
for each row precedes tr1
begin
insert into t2 values(6,'www.com');
update t2 set a2 = 'aa' where a1 =7;
end 
//
drop trigger tr1;
create trigger tr1
before update on t1
for each row follows tr2
begin
insert into t2 values(7,'www.com');
update t2 set a2 = 'a2' where a1 =7;
end
//
create trigger tr3
before update on t1
for each row precedes tr2
begin
insert into t2 values(7,'www.com');
update t2 set a2 = 'a2' where a1 =7;
end
//
update t1 set c1=6 where c2='爱E族';
select * from t1;
c1	c2
6	爱E族
select * from t2;
a1	a2
6	www.com
7	a2
7	a2
SELECT ACTION_ORDER  FROM information_schema.triggers WHERE trigger_name= 'tr1' and trigger_schema ='db1';
ACTION_ORDER
3
SELECT ACTION_ORDER  FROM information_schema.triggers WHERE trigger_name= 'tr2' and trigger_schema ='db1';
ACTION_ORDER
2
SELECT ACTION_ORDER  FROM information_schema.triggers WHERE trigger_name= 'tr3' and trigger_schema ='db1';
ACTION_ORDER
1
##多触发器
##单表
drop table if exists t1;
drop table if exists t2;
drop table if exists t3;
Warnings:
Note	1051	Unknown table 'db1.t3'
create table t1 (c1 int, c2 varchar(128)) default charset='utf8';
create table t2 (a1 int, a2 varchar(128)) default charset='utf8';
create table t3 (b1 int, b2 varchar(128)) default charset='utf8';
insert into t1 values(5, '爱E族');
create trigger tr1
after update on t1
for each row 
begin
insert into t2 values(7,'www.com');
end
//
create trigger tr2
after update on t1 
for each row follows tr1
begin
insert into t2 values(null,'ww.com');
delete from t2 where a1 is null;
end 
//
create trigger tr3
after update on t1 
for each row precedes tr1
begin
insert into t2 values(6,'w.com');
end 
//
create trigger tr4
after update on t1 
for each row precedes tr1
begin
insert into t2 values(5,'w.com');
end 
//
create trigger tr5
after update on t1 
for each row follows tr1
begin
insert into t2 values(4,'w.com');
end 
//
create trigger tr6
after update on t1 
for each row precedes tr1
begin
insert into t2 values(2,'w.com');
end 
//
create trigger tr7
after update on t1 
for each row precedes tr1
begin
insert into t2 values(45,'w.com');
end 
//
update t1 set c1=6 where c2='爱E族';
select * from t1;
c1	c2
6	爱E族
select * from t2;
a1	a2
2	w.com
4	w.com
45	w.com
5	w.com
6	w.com
7	www.com
select * from t3;
b1	b2
##多表
drop table if exists t1;
drop table if exists t2;
drop table if exists t3;
create table t1 (c1 int, c2 varchar(128)) default charset='utf8';
create table t2 (a1 int, a2 varchar(128)) default charset='utf8';
create table t3 (b1 int, b2 varchar(128)) default charset='utf8';
insert into t1 values(5, '爱E族');
create trigger tr1
before update on t1
for each row 
begin
insert into t2 values(7,'www.com');
end
//
create trigger tr2
before update on t1 
for each row follows tr1
begin
insert into t2 values(null,'ww.com');
end 
//
create trigger tr3
before update on t1 
for each row precedes tr1
begin
insert into t2 values(6,'w.com');
end 
//
create trigger tr4
before update on t2
for each row 
begin
insert into t3 values(5,'w.com');
end
//
create trigger tr5
before update on t2 
for each row follows tr4
begin
insert into t3 values(4,'w.com');
end 
//
create trigger tr6
before update on t2 
for each row precedes tr5
begin
insert into t3 values(2,'w.com');
end 
//
create trigger tr7
before update on t3 
for each row 
begin
insert into t1 values(45,'w.com');
end 
//
create trigger tr8
before update on t3 
for each row precedes tr7
begin
insert into t1 values(55,'w.com');
end 
//
update t1 set c1=6 where c2='爱E族';
update t2 set a1=1 where a1 is null;
update t3 set b1=11 where b1=5;
select * from t1;
c1	c2
45	w.com
55	w.com
6	爱E族
select * from t2;
a1	a2
1	ww.com
6	w.com
7	www.com
select * from t3;
b1	b2
11	w.com
2	w.com
4	w.com
drop table if exists t1;
drop table if exists t2;
drop table if exists t3;
create table t1 (c1 int, c2 varchar(128)) default charset='utf8';
create table t2 (a1 int, a2 varchar(128)) default charset='utf8';
create table t3 (b1 int, b2 varchar(128)) default charset='utf8';
insert into t1 values(5, '爱E族');
create trigger tr1
after update on t1
for each row 
begin
insert into t2 values(7,'www.com');
end
//
create trigger tr2
after update on t1 
for each row follows tr1
begin
insert into t2 values(null,'ww.com');
delete from t2 where a1 is null;
end 
//
create trigger tr3
after update on t1 
for each row precedes tr1
begin
insert into t2 values(6,'w.com');
end 
//
create trigger tr4
after update on t1 
for each row precedes tr1
begin
insert into t2 values(5,'w.com');
end 
//
create trigger tr5
after update on t1 
for each row follows tr1
begin
insert into t2 values(4,'w.com');
end 
//
create trigger tr6
after update on t1 
for each row precedes tr1
begin
insert into t2 values(2,'w.com');
end 
//
create trigger tr7
after update on t1 
for each row precedes tr1
begin
insert into t2 values(45,'w.com');
end 
//
update t1 set c1=6 where c2='爱E族';
select * from t1;
c1	c2
6	爱E族
select * from t2;
a1	a2
2	w.com
4	w.com
45	w.com
5	w.com
6	w.com
7	www.com
select * from t3;
b1	b2
##删除不含可选参数的基础触发器
drop table if exists t1;
drop table if exists t2;
drop table if exists t3;
create table t1 (c1 int, c2 varchar(128)) default charset='utf8';
create table t2 (a1 int, a2 varchar(128)) default charset='utf8';
insert into t1 values(5, '爱E族');
create trigger tr1
before update on t1
for each row 
begin
insert into t2 values(7,'www.com');
end
//
create trigger tr2
before update on t1 
for each row follows tr1
begin
insert into t2 values(null,'ww.com');
end 
//
drop trigger tr1;
##此处bug,预期不报错,实际结果报错;
update t1 set c1=6 where c2='爱E族';
drop table if exists t1;
drop table if exists t2;
drop table if exists t3;
Warnings:
Note	1051	Unknown table 'db1.t3'
create table t1 (c1 int, c2 varchar(128)) default charset='utf8';
create table t2 (a1 int, a2 varchar(128)) default charset='utf8';
insert into t1 values(5, '爱E族');
create trigger tr1
after update on t1
for each row 
begin
insert into t2 values(7,'www.com');
end
//
create trigger tr2
after update on t1 
for each row follows tr1
begin
insert into t2 values(null,'ww.com');
end 
//
drop trigger tr1;
update t1 set c1=6 where c2='爱E族';
##删除包含可选参数FOLLOWS
drop table if exists t1;
drop table if exists t2;
create table t1 (c1 int, c2 varchar(128)) default charset='utf8';
create table t2 (a1 int, a2 varchar(128)) default charset='utf8';
insert into t1 values(5, '爱E族');
create trigger tr1
before update on t1
for each row 
begin
insert into t2 values(7,'www.com');
end
//
create trigger tr2
before update on t1 
for each row follows tr1
begin
insert into t2 values(null,'ww.com');
end 
//
drop trigger tr2;
update t1 set c1=8 where c2='爱E族';
select * from t1;
c1	c2
8	爱E族
select * from t2;
a1	a2
7	www.com
drop table if exists t1;
drop table if exists t2;
create table t1 (c1 int, c2 varchar(128)) default charset='utf8';
create table t2 (a1 int, a2 varchar(128)) default charset='utf8';
insert into t1 values(5, '爱E族');
create trigger tr1
after update on t1
for each row 
begin
insert into t2 values(7,'www.com');
end
//
create trigger tr2
after update on t1 
for each row follows tr1
begin
insert into t2 values(null,'ww.com');
end 
//
drop trigger tr2;
update t1 set c1=8 where c2='爱E族';
select * from t1;
c1	c2
8	爱E族
select * from t2;
a1	a2
7	www.com
##删除包含可选参数precedes
drop table if exists t1;
drop table if exists t2;
create table t1 (c1 int, c2 varchar(128)) default charset='utf8';
create table t2 (a1 int, a2 varchar(128)) default charset='utf8';
insert into t1 values(5, '爱E族');
create trigger tr1
before update on t1
for each row 
begin
insert into t2 values(7,'www.com');
end
//
create trigger tr2
before update on t1 
for each row precedes tr1
begin
insert into t2 values(null,'ww.com');
end 
//
drop trigger tr2;
update t1 set c1=8 where c2='爱E族';
select * from t1;
c1	c2
8	爱E族
select * from t2;
a1	a2
7	www.com
SELECT ACTION_ORDER  FROM information_schema.triggers WHERE trigger_name= 'tr1' and trigger_schema ='db1';
ACTION_ORDER
1
SELECT ACTION_ORDER  FROM information_schema.triggers WHERE trigger_name= 'tr2' and trigger_schema ='db1';
ACTION_ORDER
drop table if exists t1;
drop table if exists t2;
create table t1 (c1 int, c2 varchar(128)) default charset='utf8';
create table t2 (a1 int, a2 varchar(128)) default charset='utf8';
insert into t1 values(5, '爱E族');
create trigger tr1
after update on t1
for each row 
begin
insert into t2 values(7,'www.com');
end
//
create trigger tr2
after update on t1 
for each row precedes tr1
begin
insert into t2 values(null,'ww.com');
end 
//
drop trigger tr2;
update t1 set c1=8 where c2='爱E族';
select * from t1;
c1	c2
8	爱E族
select * from t2;
a1	a2
7	www.com
##删除之后创建不含可选参数的触发器
drop table if exists t1;
drop table if exists t2;
create table t1 (c1 int, c2 varchar(128)) default charset='utf8';
create table t2 (a1 int, a2 varchar(128)) default charset='utf8';
insert into t1 values(5, '爱E族');
create trigger tr1
before update on t1
for each row 
begin
insert into t2 values(7,'www.com');
end
//
create trigger tr2
before update on t1 
for each row follows tr1
begin
insert into t2 values(null,'ww.com');
end 
//
create trigger tr3
before update on t1 
for each row precedes tr1
begin
insert into t2 values(8,'ww.com');
end 
//
drop trigger tr1;
create trigger tr1
before update on t1
for each row 
begin
insert into t2 values(7,'www.com');
end
//
update t1 set c1=7 where c2='爱E族';
select * from t1;
c1	c2
7	爱E族
select * from t2;
a1	a2
7	www.com
8	ww.com
NULL	ww.com
drop table if exists t1;
drop table if exists t2;
create table t1 (c1 int, c2 varchar(128)) default charset='utf8';
create table t2 (a1 int, a2 varchar(128)) default charset='utf8';
insert into t1 values(5, '爱E族');
create trigger tr1
after update on t1
for each row 
begin
insert into t2 values(7,'www.com');
end
//
create trigger tr2
after update on t1 
for each row follows tr1
begin
insert into t2 values(null,'ww.com');
end 
//
drop trigger tr1;
create trigger tr1
after update on t1
for each row 
begin
insert into t2 values(7,'www.com');
end
//
update t1 set c1=7 where c2='爱E族';
select * from t1;
c1	c2
7	爱E族
select * from t2;
a1	a2
7	www.com
NULL	ww.com
##删除之后创建包含可选参数的触发器
drop table if exists t1;
drop table if exists t2;
create table t1 (c1 int, c2 varchar(128)) default charset='utf8';
create table t2 (a1 int, a2 varchar(128)) default charset='utf8';
insert into t1 values(5, '爱E族');
create trigger tr1
before update on t1
for each row 
begin
insert into t2 values(7,'www.com');
end
//
create trigger tr2
before update on t1 
for each row follows tr1
begin
insert into t2 values(null,'ww.com');
end 
//
drop trigger tr2;
update t1 set c1=7 where c2='爱E族';
create trigger tr2
before update on t1 
for each row precedes tr1
begin
insert into t2 values(null,'ww.com');
end 
//
update t1 set c1=8 where c2='爱E族';
select * from t1;
c1	c2
8	爱E族
select * from t2;
a1	a2
7	www.com
7	www.com
NULL	ww.com
drop table if exists t1;
drop table if exists t2;
create table t1 (c1 int, c2 varchar(128)) default charset='utf8';
create table t2 (a1 int, a2 varchar(128)) default charset='utf8';
insert into t1 values(5, '爱E族');
create trigger tr1
after update on t1
for each row 
begin
insert into t2 values(7,'www.com');
end
//
create trigger tr2
after update on t1 
for each row follows tr1
begin
insert into t2 values(null,'ww.com');
end 
//
drop trigger tr2;
update t1 set c1=7 where c2='爱E族';
create trigger tr2
after update on t1 
for each row precedes tr1
begin
insert into t2 values(null,'ww.com');
end 
//
update t1 set c1=7 where c2='爱E族';
select * from t1;
c1	c2
7	爱E族
select * from t2;
a1	a2
7	www.com
7	www.com
NULL	ww.com
##触发异常处理
drop table if exists t1;
drop table if exists t2;
create table t1 (c1 int, c2 varchar(128)) default charset='utf8';
create table t2 (a1 int, a2 varchar(128)) default charset='utf8';
insert into t1 values(5, '爱E族');
create trigger tr1
after update on t1
for each row 
begin
insert into t2 values(7,'www.com');
update t2 set a2 = 'a2' where a1 =s;
end
//
create trigger tr2
after update on t1 
for each row follows tr1
begin
insert into t2 values(6,'www.com');
update t2 set a2 = 'aa' where a1 =7;
end 
//
update t1 set c1=6 where c2='爱E族';
ERROR 42S22: Unknown column 's' in 'where clause'
drop table if exists t1;
drop table if exists t2;
create table t1 (c1 int, c2 varchar(128)) default charset='utf8';
create table t2 (a1 int, a2 varchar(128)) default charset='utf8';
insert into t1 values(5, '爱E族');
create trigger tr1
after update on t1
for each row 
begin
insert into t2 values(7,'www.com');
end
//
create trigger tr2
after update on t1 
for each row follows tr1
begin
insert into t2 values(6,'www.com');
update t2 set a2 = 'aa' where a1 =s;
end 
//
update t1 set c1=6 where c2='爱E族';
ERROR 42S22: Unknown column 's' in 'where clause'
##变量赋值
drop table if exists t1;
drop table if exists t2;
create table t1 (c1 int, c2 varchar(128)) default charset='utf8';
create table t2 (a1 int, a2 varchar(128)) default charset='utf8';
insert into t1 values(5, '爱E族');
create trigger tr1
after update on t1
for each row set @a=@b+1
//
create trigger tr2
after update on t1 
for each row follows tr1
set @b=@a+@b
//
set @a=1;
set @b=1;
update t1 set c1=6 where c2='爱E族';
select @a;
@a
2
select @b;
@b
3
drop table if exists t1;
drop table if exists t2;
create table t1 (c1 int, c2 varchar(128)) default charset='utf8';
create table t2 (a1 int, a2 varchar(128)) default charset='utf8';
insert into t1 values(5, '爱E族');
create trigger tr1
before update on t1
for each row set @a=@b+1
//
create trigger tr2
before update on t1 
for each row follows tr1
set @b=@a+@b
//
set @a=1;
set @b=1;
update t1 set c1=6 where c2='爱E族';
select @a;
@a
2
select @b;
@b
3
drop table if exists t1;
drop table if exists t2;
create table t1 (c1 int, c2 varchar(128)) default charset='utf8';
create table t2 (a1 int, a2 varchar(128)) default charset='utf8';
insert into t1 values(5, '爱E族');
create trigger tr1
after update on t1
for each row set @a=@b+1
//
create trigger tr2
after update on t1 
for each row precedes tr1
set @b=@a+@b
//
set @a=1;
set @b=1;
update t1 set c1=6 where c2='爱E族';
select @a;
@a
3
select @b;
@b
2
drop table if exists t1;
drop table if exists t2;
create table t1 (c1 int, c2 varchar(128)) default charset='utf8';
create table t2 (a1 int, a2 varchar(128)) default charset='utf8';
insert into t1 values(5, '爱E族');
create trigger tr1
before update on t1
for each row set @a=@b+1
//
create trigger tr2
before update on t1 
for each row precedes tr1
set @b=@a+@b
//
set @a=false;
set @b=true;
update t1 set c1=6 where c2='爱E族';
select @a;
@a
2
select @b;
@b
1
drop table if exists t1;
drop table if exists t2;
create table t1 (c1 int, c2 varchar(128)) default charset='utf8';
create table t2 (a1 int, a2 varchar(128)) default charset='utf8';
insert into t1 values(5, '爱E族');
create trigger tr1
before update on t1
for each row set @a=@b+@a
//
create trigger tr2
before update on t1 
for each row precedes tr1 set @b=@a+@b 
//
set @a=false;
set @b=true;
update t1 set c1=6 where c2='爱E族';
update t1 set c1=6 where c2='爱E族';
update t1 set c1=6 where c2='爱E族';
update t1 set c1=6 where c2='爱E族';
update t1 set c1=6 where c2='爱E族';
update t1 set c1=6 where c2='爱E族';
##多次触发ob报错1264,
update t1 set c1=6 where c2='爱E族';
##new变量和old变量
drop table if exists t1;
drop table if exists t2;
create table t1 (c1 int, c2 varchar(128)) default charset='utf8';
create table t2 (a1 int, a2 varchar(128)) default charset='utf8';
create trigger tr1
before insert on t1
for each row
insert into t2 values(new.c2,new.c1),(2,3);
//
create trigger tr2
before insert on t1
for each row follows tr1
delete from t2 where a2=new.c2;
//
create trigger tr3
before insert on t1
for each row precedes tr1
insert into t2 values(2,3),(new.c1,new.c2);
//
insert into t1 values(4, 5);
select * from t1;
c1	c2
4	5
select * from t2;
a1	a2
2	3
2	3
5	4
drop table if exists t1;
drop table if exists t2;
create table t1 (c1 int, c2 varchar(128)) default charset='utf8';
create table t2 (a1 int, a2 varchar(128)) default charset='utf8';
insert into t1 values(4,5);
create trigger tr1
before delete on t1
for each row
insert into t2 values(old.c1,old.c2),(2,3);
//
create trigger tr2
before delete on t1
for each row follows tr1
delete from t2 where a2=5;
//
create trigger tr3
before delete on t1
for each row precedes tr1
insert into t2 values(old.c2,old.c1);
//
delete from t1 where c1=4;
select * from t1;
c1	c2
select * from t2;
a1	a2
2	3
5	4
drop table if exists t1;
drop table if exists t2;
create table t1 (c1 int, c2 varchar(128)) default charset='utf8';
create table t2 (a1 int, a2 varchar(128)) default charset='utf8';
insert into t1 values(4,null);
insert into t2 values(2,3);
insert into t2 values(1,4);
insert into t2 values(null,0);
create trigger tr1
before update on t1
for each row
update t2 set a1=new.c2 where a2=old.c1;
//
create trigger tr2
before update on t1
for each row follows tr1
delete from t2 where a2=new.c2;
//
create trigger tr3
before update on t1
for each row 
insert into t2 values(new.c1,old.c2)
//
update t1 set c2=3 where c1=4;
select * from t1;
c1	c2
4	3
select * from t2;
a1	a2
3	4
4	NULL
NULL	0
##声明变量传值
drop table if exists t1;
drop table if exists t2;
create table t1 (c1 int, c2 varchar(128)) default charset='utf8';
create table t2 (a1 int, a2 varchar(128)) default charset='utf8';
insert into t2 values(3,'指令');
create trigger tr1 after insert
on t1 for each row
begin
declare c int;
set c = (select a1 from t2 where a1=new.c1);
update t2 set a1 = c + 1 where a1 = new.c1;
end //
create trigger tr2 after insert
on t1 for each row follows tr1
begin
declare d varchar(64);
set d ='零零';
update t2 set a2 = d  where a1 = new.c1+1;
end 
//
insert into t1 values(3,'零零');
select * from t1;
c1	c2
3	零零
select * from t2;
a1	a2
4	零零
########清空回收站，删除测试数据库，表等 ##########
drop table if exists t1;
drop table if exists t2;
drop table if exists t3;
drop database IF EXISTS  db1;
