# 环境清理
purge recyclebin;
drop user ykk@'%';
create user ykk IDENTIFIED BY 'ykk';
grant all on *.* to ykk WITH GRANT OPTION;
DROP DATABASE ykk_db1;
CREATE DATABASE ykk_db1;
DROP DATABASE ykk;
CREATE DATABASE ykk;
USE ykk_db1;
DROP TABLE t1;
ERROR 42S02: Unknown table 'ykk_db1.t1'
CREATE TABLE t1(
c1 int,
c2 int,
c3 int
);
DROP TABLE t2;
ERROR 42S02: Unknown table 'ykk_db1.t2'
CREATE TABLE t2(
c1 int
);
DROP USER ykk1;
CREATE USER 'ykk1'@'%' IDENTIFIED BY 'ykk123';
DROP USER ykk2;
CREATE USER 'ykk2'@'%' IDENTIFIED BY 'ykk123';
DROP USER ykk3;
CREATE USER 'ykk3'@'%' IDENTIFIED BY 'ykk123';
DROP USER ykk4;
CREATE USER 'ykk4'@'%' IDENTIFIED BY 'ykk123';
GRANT SELECT ON ykk_db1.t1 TO ykk4 WITH GRANT OPTION;
DROP USER ykk5;
CREATE USER 'ykk5'@'%' IDENTIFIED BY 'ykk123';
GRANT SELECT ON ykk_db1.t1 TO ykk1;
GRANT SELECT ON ykk_db1.t2 TO ykk1;
GRANT SELECT ON ykk_db1.t1 TO ykk3 WITH GRANT OPTION;
# ykk1授权给ykk2，预期失败
GRANT SELECT ON ykk_db1.t1 TO ykk2;
ERROR 42000: GRANT command denied to user 'ykk1'@'%' for table 't1'
SELECT * FROM t1;
c1	c2	c3
# ykk3授权给ykk2
GRANT SELECT ON ykk_db1.t1 TO ykk2;
#  查询t1，验证SELECT权限
USE ykk_db1;
SELECT * FROM t1;
c1	c2	c3
REVOKE SELECT ON ykk_db1.t1 FROM ykk1;
#  查询t1，验证SELECT权限
USE ykk_db1;
SELECT * FROM ykk_db1.t1;
ERROR 42000: SELECT command denied to user 'ykk1'@'%' for table 't1'
#  查询t1，验证SELECT权限
USE ykk_db1;
SELECT * FROM t1;
c1	c2	c3
REVOKE SELECT ON ykk_db1.t1 FROM ykk3 WITH GRANT OPTION;
ERROR 42000: You have an error in your SQL syntax; check the manual that corresponds to your OceanBase version for the right syntax to use near 'WITH GRANT OPTION' at line 1
# 再次执行用户ykk4的SELECT授权语句
GRANT SELECT ON ykk_db1.t1 TO ykk4;
GRANT SELECT ON ykk_db1.t1 TO ykk4 WITH GRANT OPTION;
GRANT SELECT ON ykk_db1.t1 TO ykk2;
GRANT SELECT ON ykk_db1.t1 TO ykk2;
REVOKE SELECT ON ykk_db1.t1 FROM ykk1;
Got one of the listed errors
REVOKE INSERT ON ykk_db1.t1 FROM ykk1;
Got one of the listed errors
REVOKE UPDATE ON ykk_db1.t1 FROM ykk1;
Got one of the listed errors
# 给用户ykk1授权SELECT
GRANT SELECT ON ykk_db1.t1 TO ykk1;
# 撤销用户ykk1的UPDATE/INSERT权限
REVOKE INSERT ON ykk_db1.t1 FROM ykk1;
REVOKE UPDATE ON ykk_db1.t1 FROM ykk1;
# 给用户ykk1授权INSERT
GRANT INSERT ON ykk_db1.t1 TO ykk1;
# 撤销用户ykk1的UPDATE/SELECT权限
REVOKE SELECT ON ykk_db1.t1 FROM ykk1;
REVOKE UPDATE ON ykk_db1.t1 FROM ykk1;
# 给用户ykk1授权UPDATE
GRANT UPDATE ON ykk_db1.t1 TO ykk1;
# 撤销用户ykk1的INSERT/SELECT权限
REVOKE SELECT ON ykk_db1.t1 FROM ykk1;
REVOKE INSERT ON ykk_db1.t1 FROM ykk1;
DROP USER ykk1;
CREATE USER 'ykk1'@'%' IDENTIFIED BY 'ykk123';
use ykk_db1;
DROP TABLE t_sel;
CREATE TABLE t_sel(
c1 int,
c2 varchar(50),
c3 varchar(50),
c4 varchar(50)
);
DROP TABLE t_ins;
CREATE TABLE t_ins(
c1 int,
c2 varchar(50),
c3 varchar(50),
c4 varchar(50)
);
DROP TABLE t_upd;
CREATE TABLE t_upd(
c1 int,
c2 varchar(50),
c3 varchar(50),
c4 varchar(50)
);
# 授权单列/多列 SELECT 权限
GRANT SELECT(c1) ON ykk_db1.t_sel TO ykk1;
GRANT SELECT(c2,c3,c4) ON ykk_db1.t_sel TO ykk1;
# 授权单列/多列 INSERT 权限
GRANT INSERT(c1) ON ykk_db1.t_ins TO ykk1;
GRANT INSERT(c2,c3,c4) ON ykk_db1.t_ins TO ykk1;
# 授权单列/多列 UPDATE 权限
GRANT UPDATE(c1) ON ykk_db1.t_upd TO ykk1;
GRANT UPDATE(c2,c3,c4) ON ykk_db1.t_upd TO ykk1;
# 查询授权语法
SHOW GRANTS FOR ykk1;
Grants for ykk1@%
GRANT INSERT (`c1`, `c2`, `c3`, `c4`) ON `ykk_db1`.`t_ins` TO 'ykk1'
GRANT SELECT (`c1`, `c2`, `c3`, `c4`) ON `ykk_db1`.`t_sel` TO 'ykk1'
GRANT UPDATE (`c1`, `c2`, `c3`, `c4`) ON `ykk_db1`.`t_upd` TO 'ykk1'
GRANT USAGE ON *.* TO 'ykk1'
# 查询列权限表
SELECT Host,Db,User,Table_name,Column_name,Column_priv FROM mysql.columns_priv ORDER BY user,Column_name;
Host	Db	User	Table_name	Column_name	Column_priv
%	ykk_db1	ykk1	t_ins	c1	Insert
%	ykk_db1	ykk1	t_ins	c2	Insert
%	ykk_db1	ykk1	t_ins	c3	Insert
%	ykk_db1	ykk1	t_ins	c4	Insert
%	ykk_db1	ykk1	t_sel	c1	Select
%	ykk_db1	ykk1	t_sel	c2	Select
%	ykk_db1	ykk1	t_sel	c3	Select
%	ykk_db1	ykk1	t_sel	c4	Select
%	ykk_db1	ykk1	t_upd	c1	Update
%	ykk_db1	ykk1	t_upd	c2	Update
%	ykk_db1	ykk1	t_upd	c3	Update
%	ykk_db1	ykk1	t_upd	c4	Update
# 查询权限视图
SELECT * FROM information_schema.COLUMN_PRIVILEGES WHERE TABLE_SCHEMA = 'ykk_db1' ORDER BY GRANTEE,TABLE_NAME,Column_name;
GRANTEE	TABLE_CATALOG	TABLE_SCHEMA	TABLE_NAME	COLUMN_NAME	PRIVILEGE_TYPE	IS_GRANTABLE
'ykk1'@'%'	def	ykk_db1	t_ins	c1	INSERT	NO
'ykk1'@'%'	def	ykk_db1	t_ins	c2	INSERT	NO
'ykk1'@'%'	def	ykk_db1	t_ins	c3	INSERT	NO
'ykk1'@'%'	def	ykk_db1	t_ins	c4	INSERT	NO
'ykk1'@'%'	def	ykk_db1	t_sel	c1	SELECT	NO
'ykk1'@'%'	def	ykk_db1	t_sel	c2	SELECT	NO
'ykk1'@'%'	def	ykk_db1	t_sel	c3	SELECT	NO
'ykk1'@'%'	def	ykk_db1	t_sel	c4	SELECT	NO
'ykk1'@'%'	def	ykk_db1	t_upd	c1	UPDATE	NO
'ykk1'@'%'	def	ykk_db1	t_upd	c2	UPDATE	NO
'ykk1'@'%'	def	ykk_db1	t_upd	c3	UPDATE	NO
'ykk1'@'%'	def	ykk_db1	t_upd	c4	UPDATE	NO
use ykk_db1;
SELECT c1 FROM t_sel;
c1
SELECT c2,c3,c4 FROM t_sel;
c2	c3	c4
SELECT c1,c2,c3,c4 FROM t_sel;
c1	c2	c3	c4
SELECT * FROM t_sel;
c1	c2	c3	c4
INSERT t_ins(c1) VALUES(1);
INSERT t_ins(c2,c3,c4) VALUES('a','b','c');
INSERT t_ins(c1,c2,c3,c4) VALUES(2,'x','y','z');
INSERT t_ins VALUES(3,'x','y','z');
UPDATE t_upd SET c1 = 1;
UPDATE t_upd SET c2 = 'h', c3 = 'j', c4 = 'k';
UPDATE t_upd SET c1 = 2, c2 = 'h', c3 = 'j', c4 = 'k';
DROP USER ykk1;
CREATE USER 'ykk1'@'%' IDENTIFIED BY 'ykk123';
DROP USER ykk2;
CREATE USER 'ykk2'@'%' IDENTIFIED BY 'ykk123';
DROP USER ykk3;
CREATE USER 'ykk3'@'%' IDENTIFIED BY 'ykk123';
DROP USER ykk4;
CREATE USER 'ykk4'@'%' IDENTIFIED BY 'ykk123';
DROP USER ykk5;
CREATE USER 'ykk5'@'%' IDENTIFIED BY 'ykk123';
use ykk_db1;
DROP TABLE t_com1;
CREATE TABLE t_com1(
c1 int,
c2 varchar(50),
c3 varchar(50),
c4 varchar(50)
);
DROP TABLE t_com2;
CREATE TABLE t_com2(
c1 int,
c2 varchar(50),
c3 varchar(50),
c4 varchar(50)
);
DROP TABLE t_com3;
CREATE TABLE t_com3(
c1 int,
c2 varchar(50),
c3 varchar(50),
c4 varchar(50)
);
# 授权单列/多列 SELECT+INSERT 权限
GRANT SELECT(c1), INSERT(c1) ON ykk_db1.t_com1 TO ykk1;
GRANT SELECT(c2,c3,c4), INSERT(c2,c3,c4) ON ykk_db1.t_com2 TO ykk1;
SHOW GRANTS FOR ykk1;
Grants for ykk1@%
GRANT INSERT (`c1`), SELECT (`c1`) ON `ykk_db1`.`t_com1` TO 'ykk1'
GRANT INSERT (`c2`, `c3`, `c4`), SELECT (`c2`, `c3`, `c4`) ON `ykk_db1`.`t_com2` TO 'ykk1'
GRANT USAGE ON *.* TO 'ykk1'
SELECT Host,Db,User,Table_name,Column_name,Column_priv FROM mysql.columns_priv WHERE USER = 'ykk1';
Host	Db	User	Table_name	Column_name	Column_priv
%	ykk_db1	ykk1	t_com1	c1	Select,Insert
%	ykk_db1	ykk1	t_com2	c2	Select,Insert
%	ykk_db1	ykk1	t_com2	c3	Select,Insert
%	ykk_db1	ykk1	t_com2	c4	Select,Insert
SELECT * FROM information_schema.COLUMN_PRIVILEGES WHERE GRANTEE = "'ykk1'@'%'" ORDER BY TABLE_NAME,Column_name;
GRANTEE	TABLE_CATALOG	TABLE_SCHEMA	TABLE_NAME	COLUMN_NAME	PRIVILEGE_TYPE	IS_GRANTABLE
'ykk1'@'%'	def	ykk_db1	t_com1	c1	INSERT	NO
'ykk1'@'%'	def	ykk_db1	t_com1	c1	SELECT	NO
'ykk1'@'%'	def	ykk_db1	t_com2	c2	INSERT	NO
'ykk1'@'%'	def	ykk_db1	t_com2	c2	SELECT	NO
'ykk1'@'%'	def	ykk_db1	t_com2	c3	INSERT	NO
'ykk1'@'%'	def	ykk_db1	t_com2	c3	SELECT	NO
'ykk1'@'%'	def	ykk_db1	t_com2	c4	INSERT	NO
'ykk1'@'%'	def	ykk_db1	t_com2	c4	SELECT	NO
# 授权单列/多列 SELECT+UPDATE 权限
GRANT SELECT(c1), UPDATE(c1) ON ykk_db1.t_com1 TO ykk2;
GRANT SELECT(c2,c3,c4), UPDATE(c2,c3,c4) ON ykk_db1.t_com2 TO ykk2;
SHOW GRANTS FOR ykk2;
Grants for ykk2@%
GRANT UPDATE (`c1`), SELECT (`c1`) ON `ykk_db1`.`t_com1` TO 'ykk2'
GRANT UPDATE (`c2`, `c3`, `c4`), SELECT (`c2`, `c3`, `c4`) ON `ykk_db1`.`t_com2` TO 'ykk2'
GRANT USAGE ON *.* TO 'ykk2'
SELECT Host,Db,User,Table_name,Column_name,Column_priv FROM mysql.columns_priv WHERE USER = 'ykk2';
Host	Db	User	Table_name	Column_name	Column_priv
%	ykk_db1	ykk2	t_com1	c1	Select,Update
%	ykk_db1	ykk2	t_com2	c2	Select,Update
%	ykk_db1	ykk2	t_com2	c3	Select,Update
%	ykk_db1	ykk2	t_com2	c4	Select,Update
SELECT * FROM information_schema.COLUMN_PRIVILEGES WHERE GRANTEE = "'ykk2'@'%'" ORDER BY TABLE_NAME,Column_name;
GRANTEE	TABLE_CATALOG	TABLE_SCHEMA	TABLE_NAME	COLUMN_NAME	PRIVILEGE_TYPE	IS_GRANTABLE
'ykk2'@'%'	def	ykk_db1	t_com1	c1	SELECT	NO
'ykk2'@'%'	def	ykk_db1	t_com1	c1	UPDATE	NO
'ykk2'@'%'	def	ykk_db1	t_com2	c2	SELECT	NO
'ykk2'@'%'	def	ykk_db1	t_com2	c2	UPDATE	NO
'ykk2'@'%'	def	ykk_db1	t_com2	c3	SELECT	NO
'ykk2'@'%'	def	ykk_db1	t_com2	c3	UPDATE	NO
'ykk2'@'%'	def	ykk_db1	t_com2	c4	SELECT	NO
'ykk2'@'%'	def	ykk_db1	t_com2	c4	UPDATE	NO
# 授权单列/多列 INSERT+UPDATE 权限
GRANT INSERT(c1), UPDATE(c1) ON ykk_db1.t_com1 TO ykk3;
GRANT INSERT(c2,c3,c4), UPDATE(c2,c3,c4) ON ykk_db1.t_com2 TO ykk3;
SHOW GRANTS FOR ykk3;
Grants for ykk3@%
GRANT INSERT (`c1`), UPDATE (`c1`) ON `ykk_db1`.`t_com1` TO 'ykk3'
GRANT INSERT (`c2`, `c3`, `c4`), UPDATE (`c2`, `c3`, `c4`) ON `ykk_db1`.`t_com2` TO 'ykk3'
GRANT USAGE ON *.* TO 'ykk3'
SELECT Host,Db,User,Table_name,Column_name,Column_priv FROM mysql.columns_priv WHERE USER = 'ykk3';
Host	Db	User	Table_name	Column_name	Column_priv
%	ykk_db1	ykk3	t_com1	c1	Insert,Update
%	ykk_db1	ykk3	t_com2	c2	Insert,Update
%	ykk_db1	ykk3	t_com2	c3	Insert,Update
%	ykk_db1	ykk3	t_com2	c4	Insert,Update
SELECT * FROM information_schema.COLUMN_PRIVILEGES WHERE GRANTEE = "'ykk3'@'%'" ORDER BY TABLE_NAME,Column_name;
GRANTEE	TABLE_CATALOG	TABLE_SCHEMA	TABLE_NAME	COLUMN_NAME	PRIVILEGE_TYPE	IS_GRANTABLE
'ykk3'@'%'	def	ykk_db1	t_com1	c1	INSERT	NO
'ykk3'@'%'	def	ykk_db1	t_com1	c1	UPDATE	NO
'ykk3'@'%'	def	ykk_db1	t_com2	c2	INSERT	NO
'ykk3'@'%'	def	ykk_db1	t_com2	c2	UPDATE	NO
'ykk3'@'%'	def	ykk_db1	t_com2	c3	INSERT	NO
'ykk3'@'%'	def	ykk_db1	t_com2	c3	UPDATE	NO
'ykk3'@'%'	def	ykk_db1	t_com2	c4	INSERT	NO
'ykk3'@'%'	def	ykk_db1	t_com2	c4	UPDATE	NO
# 分别给不同的列授不同的权限
GRANT SELECT(c1), INSERT(c2), UPDATE(c3) ON ykk_db1.t_com1 TO ykk4;
GRANT SELECT(c1,c2), INSERT(c2,c3), UPDATE(c3,c4) ON ykk_db1.t_com2 TO ykk4;
SHOW GRANTS FOR ykk4;
Grants for ykk4@%
GRANT INSERT (`c2`), UPDATE (`c3`), SELECT (`c1`) ON `ykk_db1`.`t_com1` TO 'ykk4'
GRANT INSERT (`c2`, `c3`), UPDATE (`c3`, `c4`), SELECT (`c1`, `c2`) ON `ykk_db1`.`t_com2` TO 'ykk4'
GRANT USAGE ON *.* TO 'ykk4'
SELECT Host,Db,User,Table_name,Column_name,Column_priv FROM mysql.columns_priv WHERE USER = 'ykk4';
Host	Db	User	Table_name	Column_name	Column_priv
%	ykk_db1	ykk4	t_com1	c1	Select
%	ykk_db1	ykk4	t_com1	c2	Insert
%	ykk_db1	ykk4	t_com1	c3	Update
%	ykk_db1	ykk4	t_com2	c1	Select
%	ykk_db1	ykk4	t_com2	c2	Select,Insert
%	ykk_db1	ykk4	t_com2	c3	Insert,Update
%	ykk_db1	ykk4	t_com2	c4	Update
SELECT * FROM information_schema.COLUMN_PRIVILEGES WHERE GRANTEE = "'ykk4'@'%'" ORDER BY TABLE_NAME,Column_name;
GRANTEE	TABLE_CATALOG	TABLE_SCHEMA	TABLE_NAME	COLUMN_NAME	PRIVILEGE_TYPE	IS_GRANTABLE
'ykk4'@'%'	def	ykk_db1	t_com1	c1	SELECT	NO
'ykk4'@'%'	def	ykk_db1	t_com1	c2	INSERT	NO
'ykk4'@'%'	def	ykk_db1	t_com1	c3	UPDATE	NO
'ykk4'@'%'	def	ykk_db1	t_com2	c1	SELECT	NO
'ykk4'@'%'	def	ykk_db1	t_com2	c2	INSERT	NO
'ykk4'@'%'	def	ykk_db1	t_com2	c2	SELECT	NO
'ykk4'@'%'	def	ykk_db1	t_com2	c3	INSERT	NO
'ykk4'@'%'	def	ykk_db1	t_com2	c3	UPDATE	NO
'ykk4'@'%'	def	ykk_db1	t_com2	c4	UPDATE	NO
GRANT SELECT ON ykk.* TO ykk1;
GRANT SELECT ON ykk.* TO ykk2;
GRANT SELECT ON ykk.* TO ykk3;
GRANT SELECT ON ykk.* TO ykk4;
GRANT SELECT ON ykk.* TO ykk5;
## 验证 SELECT+INSERT 权限
INSERT into ykk_db1.t_com1(c1) VALUES(1);
INSERT into ykk_db1.t_com1(c1) VALUES(2);
SELECT c1 FROM ykk_db1.t_com1;
c1
1
2
SELECT c1 FROM ykk_db1.t_com1 WHERE c1 = 1;
c1
1
INSERT into ykk_db1.t_com1(c1) SELECT c1 FROM ykk_db1.t_com1 WHERE c1 = 1;
INSERT into ykk_db1.t_com2(c1) VALUES(1);
ERROR 42000: INSERT command denied to user 'ykk1'@'%' for column 'c1' in table 't_com2'
SELECT c2 FROM ykk_db1.t_com1;
ERROR 42000: SELECT command denied to user 'ykk1'@'%' for column 'c2' in table 't_com1'
SELECT c1 FROM ykk_db1.t_com2;
ERROR 42000: SELECT command denied to user 'ykk1'@'%' for column 'c1' in table 't_com2'
INSERT into ykk_db1.t_com2(c2,c3,c4) VALUES('a','b','c');
SELECT c2 FROM ykk_db1.t_com2;
c2
a
SELECT c3,c4 FROM ykk_db1.t_com2 WHERE c2 = 'a';
c3	c4
b	c
INSERT into ykk_db1.t_com2(c2) SELECT c4 FROM ykk_db1.t_com2 WHERE c2 = 'a';
INSERT into ykk_db1.t_com1(c2) VALUES('11');
ERROR 42000: INSERT command denied to user 'ykk1'@'%' for column 'c2' in table 't_com1'
INSERT into ykk_db1.t_com2(c1) VALUES(1);
ERROR 42000: INSERT command denied to user 'ykk1'@'%' for column 'c1' in table 't_com2'
SELECT * FROM ykk_db1.t_com2;
ERROR 42000: SELECT command denied to user 'ykk1'@'%' for column 'c1' in table 't_com2'
SELECT * FROM ykk_db1.t_com1;
ERROR 42000: SELECT command denied to user 'ykk1'@'%' for column 'c2' in table 't_com1'
## 验证 SELECT+UPDATE 权限
SELECT c1 FROM ykk_db1.t_com1;
c1
1
1
2
SELECT c1 FROM ykk_db1.t_com1 WHERE c1 = 1;
c1
1
1
UPDATE ykk_db1.t_com1 SET c1 = 2;
UPDATE ykk_db1.t_com1 SET c1 = 3 WHERE c1 = 1;
SELECT c2 FROM ykk_db1.t_com1;
ERROR 42000: SELECT command denied to user 'ykk2'@'%' for column 'c2' in table 't_com1'
SELECT c1 FROM ykk_db1.t_com2;
ERROR 42000: SELECT command denied to user 'ykk2'@'%' for column 'c1' in table 't_com2'
UPDATE ykk_db1.t_com1 SET c2 = 'xxx';
ERROR 42000: UPDATE command denied to user 'ykk2'@'%' for column 'c2' in table 't_com1'
UPDATE ykk_db1.t_com1 SET c1 = 3 WHERE c2 = 'xxx';
ERROR 42000: SELECT command denied to user 'ykk2'@'%' for column 'c2' in table 't_com1'
SELECT c2 FROM ykk_db1.t_com2;
c2
a
c
SELECT c3,c4 FROM ykk_db1.t_com2 WHERE c2 = 'a';
c3	c4
b	c
UPDATE ykk_db1.t_com2 SET c2 = 'a', c3 = 'j', c4 = 'k';
UPDATE ykk_db1.t_com2 SET c2 = (SELECT c3 FROM ykk_db1.t_com2 WHERE c4 = 'v');
SELECT c1 FROM ykk_db1.t_com2;
ERROR 42000: SELECT command denied to user 'ykk2'@'%' for column 'c1' in table 't_com2'
SELECT c2 FROM ykk_db1.t_com1;
ERROR 42000: SELECT command denied to user 'ykk2'@'%' for column 'c2' in table 't_com1'
UPDATE ykk_db1.t_com1 SET c2 = 'a';
ERROR 42000: UPDATE command denied to user 'ykk2'@'%' for column 'c2' in table 't_com1'
UPDATE ykk_db1.t_com2 SET c1 = 10;
ERROR 42000: UPDATE command denied to user 'ykk2'@'%' for column 'c1' in table 't_com2'
## 验证 INSERT+UPDATE 权限
INSERT INTO ykk_db1.t_com1(c1) VALUES(3);
INSERT INTO ykk_db1.t_com2(c2,c3,c4) VALUES('asd','xxx','ccc');
UPDATE ykk_db1.t_com1 SET c1 = 2;
UPDATE ykk_db1.t_com2 SET c2 = 'aaa';
UPDATE ykk_db1.t_com2 SET c3 = 'ccc';
UPDATE ykk_db1.t_com2 SET c4 = 'ggg';
UPDATE ykk_db1.t_com2 SET c2 = '111', c3 = 'sss', c4 = '333';
INSERT INTO ykk_db1.t_com1 VALUES(3,'xxx','ccc','sss');
ERROR 42000: INSERT command denied to user 'ykk3'@'%' for column 'c2' in table 't_com1'
INSERT INTO ykk_db1.t_com2 VALUES(3,'xxx','ccc','sss');
ERROR 42000: INSERT command denied to user 'ykk3'@'%' for column 'c1' in table 't_com2'
INSERT INTO ykk_db1.t_com1(c2,c3,c4) VALUES(3,'xxx','ccc');
ERROR 42000: INSERT command denied to user 'ykk3'@'%' for column 'c2' in table 't_com1'
INSERT INTO ykk_db1.t_com2(c1) VALUES(3);
ERROR 42000: INSERT command denied to user 'ykk3'@'%' for column 'c1' in table 't_com2'
UPDATE ykk_db1.t_com1 SET c2 = 'xxx';
ERROR 42000: UPDATE command denied to user 'ykk3'@'%' for column 'c2' in table 't_com1'
UPDATE ykk_db1.t_com2 SET c1 = 3;
ERROR 42000: UPDATE command denied to user 'ykk3'@'%' for column 'c1' in table 't_com2'
USE ykk_db1;
# 验证分别给不同的列授不同的权限
INSERT INTO ykk_db1.t_com1(c2) VALUES(11);
SELECT c1 FROM ykk_db1.t_com1 ORDER BY c1;
c1
2
2
2
2
NULL
UPDATE ykk_db1.t_com1 SET c3 = 22;
INSERT INTO ykk_db1.t_com1(c2) SELECT c1 FROM ykk_db1.t_com1;
UPDATE ykk_db1.t_com1 SET c3 = (SELECT c1 FROM ykk_db1.t_com1 LIMIT 1);
SELECT c1,c2 FROM ykk_db1.t_com2;
c1	c2
NULL	111
NULL	111
NULL	111
INSERT INTO ykk_db1.t_com2(c2,c3) VALUES ('xxx','asa');
UPDATE ykk_db1.t_com2 SET c3 = '15', c4 = 'as';
INSERT INTO ykk_db1.t_com2(c2) SELECT c2 FROM ykk_db1.t_com2;
INSERT INTO ykk_db1.t_com2(c3) SELECT c2 FROM ykk_db1.t_com2;
UPDATE ykk_db1.t_com2 SET c3 = c2 WHERE c1 = 1;
UPDATE ykk_db1.t_com2 SET c4 = c2 WHERE c1 = 1;
UPDATE ykk_db1.t_com2 SET c4 = (SELECT c2 FROM ykk_db1.t_com2 WHERE c2 = 'a');
UPDATE ykk_db1.t_com2 SET c4 = (SELECT c2 FROM ykk_db1.t_com2 WHERE c2 = 'b');
SELECT c2 FROM ykk_db1.t_com1;
ERROR 42000: SELECT command denied to user 'ykk4'@'%' for column 'c2' in table 't_com1'
SELECT c3 FROM ykk_db1.t_com1;
ERROR 42000: SELECT command denied to user 'ykk4'@'%' for column 'c3' in table 't_com1'
SELECT c4 FROM ykk_db1.t_com1;
ERROR 42000: SELECT command denied to user 'ykk4'@'%' for column 'c4' in table 't_com1'
SELECT * FROM ykk_db1.t_com1;
ERROR 42000: SELECT command denied to user 'ykk4'@'%' for column 'c2' in table 't_com1'
INSERT INTO ykk_db1.t_com1(c1) VALUES('11');
ERROR 42000: INSERT command denied to user 'ykk4'@'%' for column 'c1' in table 't_com1'
INSERT INTO ykk_db1.t_com1(c3) VALUES('11');
ERROR 42000: INSERT command denied to user 'ykk4'@'%' for column 'c3' in table 't_com1'
INSERT INTO ykk_db1.t_com1(c4) VALUES('11');
ERROR 42000: INSERT command denied to user 'ykk4'@'%' for column 'c4' in table 't_com1'
UPDATE ykk_db1.t_com1 SET c1 = 22;
ERROR 42000: UPDATE command denied to user 'ykk4'@'%' for column 'c1' in table 't_com1'
UPDATE ykk_db1.t_com1 SET c2 = '22';
ERROR 42000: UPDATE command denied to user 'ykk4'@'%' for column 'c2' in table 't_com1'
UPDATE ykk_db1.t_com1 SET c4 = '22';
ERROR 42000: UPDATE command denied to user 'ykk4'@'%' for column 'c4' in table 't_com1'
SELECT * FROM ykk_db1.t_com2;
ERROR 42000: SELECT command denied to user 'ykk4'@'%' for column 'c3' in table 't_com2'
INSERT INTO ykk_db1.t_com2(c1) VALUES(1);
ERROR 42000: INSERT command denied to user 'ykk4'@'%' for column 'c1' in table 't_com2'
INSERT INTO ykk_db1.t_com2 VALUES(1,'2','3','4');
ERROR 42000: INSERT command denied to user 'ykk4'@'%' for column 'c1' in table 't_com2'
UPDATE ykk_db1.t_com2 SET c1 = 55;
ERROR 42000: UPDATE command denied to user 'ykk4'@'%' for column 'c1' in table 't_com2'
UPDATE ykk_db1.t_com2 SET c1 = 3, c2 = c3, c4 = c2 WHERE c4 = 'aaa';
ERROR 42000: UPDATE command denied to user 'ykk4'@'%' for column 'c1' in table 't_com2'
# 同时授权表和表列SELECT/INSERT/UPDATE权限
GRANT SELECT(c1), INSERT(c1), UPDATE(c1) ON ykk_db1.t_com3 TO ykk5;
# 查询授权语法
SHOW GRANTS FOR ykk5;
Grants for ykk5@%
GRANT INSERT (`c1`), UPDATE (`c1`), SELECT (`c1`) ON `ykk_db1`.`t_com3` TO 'ykk5'
GRANT SELECT ON `ykk`.* TO 'ykk5'
GRANT USAGE ON *.* TO 'ykk5'
# 查询列权限表
SELECT Host,Db,User,Table_name,Column_name,Column_priv FROM mysql.columns_priv WHERE user = 'ykk5';
Host	Db	User	Table_name	Column_name	Column_priv
%	ykk_db1	ykk5	t_com3	c1	Select,Insert,Update
# 查询权限视图
SELECT * FROM information_schema.COLUMN_PRIVILEGES WHERE GRANTEE = "'ykk5'@'%'" ORDER BY GRANTEE,TABLE_NAME,Column_name;
GRANTEE	TABLE_CATALOG	TABLE_SCHEMA	TABLE_NAME	COLUMN_NAME	PRIVILEGE_TYPE	IS_GRANTABLE
'ykk5'@'%'	def	ykk_db1	t_com3	c1	INSERT	NO
'ykk5'@'%'	def	ykk_db1	t_com3	c1	SELECT	NO
'ykk5'@'%'	def	ykk_db1	t_com3	c1	UPDATE	NO
GRANT SELECT, INSERT, UPDATE ON ykk_db1.t_com3 TO ykk5;
# 查询授权语法
SHOW GRANTS FOR ykk5;
Grants for ykk5@%
GRANT INSERT, INSERT (`c1`), UPDATE, UPDATE (`c1`), SELECT, SELECT (`c1`) ON `ykk_db1`.`t_com3` TO 'ykk5'
GRANT SELECT ON `ykk`.* TO 'ykk5'
GRANT USAGE ON *.* TO 'ykk5'
# 查询列权限表
SELECT Host,Db,User,Table_name,Column_name,Column_priv FROM mysql.columns_priv WHERE user = 'ykk5';
Host	Db	User	Table_name	Column_name	Column_priv
%	ykk_db1	ykk5	t_com3	c1	Select,Insert,Update
# 查询权限视图
SELECT * FROM information_schema.COLUMN_PRIVILEGES WHERE GRANTEE = "'ykk5'@'%'" ORDER BY TABLE_NAME,Column_name;
GRANTEE	TABLE_CATALOG	TABLE_SCHEMA	TABLE_NAME	COLUMN_NAME	PRIVILEGE_TYPE	IS_GRANTABLE
'ykk5'@'%'	def	ykk_db1	t_com3	c1	INSERT	NO
'ykk5'@'%'	def	ykk_db1	t_com3	c1	SELECT	NO
'ykk5'@'%'	def	ykk_db1	t_com3	c1	UPDATE	NO
# 验证权限
SELECT c1 FROM ykk_db1.t_com3;
c1
SELECT c2,c3,c4 FROM ykk_db1.t_com3;
c2	c3	c4
SELECT * FROM ykk_db1.t_com3;
c1	c2	c3	c4
INSERT INTO ykk_db1.t_com3 VALUES(1,'2','3','aaa');
UPDATE ykk_db1.t_com3 SET c1 = 10;
UPDATE ykk_db1.t_com3 SET c1 = 2, c2 = c3 WHERE c4 = 'aaa';
INSERT INTO ykk_db1.t_com3(c1,c2,c3,c4) SELECT c1,c2,c3,c4 FROM ykk_db1.t_com3;
INSERT INTO ykk_db1.t_com3(c1,c2,c3,c4) SELECT c1,c2,c3,c4 FROM ykk_db1.t_com3 WHERE c1 = 1;
UPDATE ykk_db1.t_com3 SET c1 = 2, c2 = c3, c3 = c4, c4 = c2;
# 撤销单列/多列 SELECT+INSERT 权限
REVOKE SELECT(c1), INSERT(c1) ON ykk_db1.t_com1 FROM ykk1;
REVOKE SELECT(c2,c3,c4), INSERT(c2,c3,c4) ON ykk_db1.t_com2 FROM ykk1;
SELECT Host,Db,User,Table_name,Column_name,Column_priv FROM mysql.columns_priv WHERE USER = 'ykk1';
Host	Db	User	Table_name	Column_name	Column_priv
SELECT * FROM information_schema.COLUMN_PRIVILEGES WHERE GRANTEE = "'ykk1'@'%'" ORDER BY TABLE_NAME,Column_name;
GRANTEE	TABLE_CATALOG	TABLE_SCHEMA	TABLE_NAME	COLUMN_NAME	PRIVILEGE_TYPE	IS_GRANTABLE
# 撤销单列/多列 SELECT+UPDATE 权限
REVOKE SELECT(c1), UPDATE(c1) ON ykk_db1.t_com1 FROM ykk2;
REVOKE SELECT(c2,c3,c4), UPDATE(c2,c3,c4) ON ykk_db1.t_com2 FROM ykk2;
SELECT Host,Db,User,Table_name,Column_name,Column_priv FROM mysql.columns_priv WHERE USER = 'ykk2';
Host	Db	User	Table_name	Column_name	Column_priv
SELECT * FROM information_schema.COLUMN_PRIVILEGES WHERE GRANTEE = "'ykk2'@'%'" ORDER BY TABLE_NAME,Column_name;
GRANTEE	TABLE_CATALOG	TABLE_SCHEMA	TABLE_NAME	COLUMN_NAME	PRIVILEGE_TYPE	IS_GRANTABLE
# 撤销单列/多列 INSERT+UPDATE 权限
REVOKE INSERT(c1), UPDATE(c1) ON ykk_db1.t_com1 FROM ykk3;
REVOKE INSERT(c2,c3,c4), UPDATE(c2,c3,c4) ON ykk_db1.t_com2 FROM ykk3;
SELECT Host,Db,User,Table_name,Column_name,Column_priv FROM mysql.columns_priv WHERE USER = 'ykk3';
Host	Db	User	Table_name	Column_name	Column_priv
SELECT * FROM information_schema.COLUMN_PRIVILEGES WHERE GRANTEE = "'ykk3'@'%'" ORDER BY TABLE_NAME,Column_name;
GRANTEE	TABLE_CATALOG	TABLE_SCHEMA	TABLE_NAME	COLUMN_NAME	PRIVILEGE_TYPE	IS_GRANTABLE
# 撤销分别给不同的不同的权限
REVOKE SELECT(c1), INSERT(c2), UPDATE(c3) ON ykk_db1.t_com1 FROM ykk4;
REVOKE SELECT(c1,c2), INSERT(c2,c3), UPDATE(c3,c4) ON ykk_db1.t_com2 FROM ykk4;
SELECT Host,Db,User,Table_name,Column_name,Column_priv FROM mysql.columns_priv WHERE USER = 'ykk4';
Host	Db	User	Table_name	Column_name	Column_priv
SELECT * FROM information_schema.COLUMN_PRIVILEGES WHERE GRANTEE = "'ykk4'@'%'" ORDER BY TABLE_NAME,Column_name;
GRANTEE	TABLE_CATALOG	TABLE_SCHEMA	TABLE_NAME	COLUMN_NAME	PRIVILEGE_TYPE	IS_GRANTABLE
# 验证 撤销SELECT+INSERT 权限
INSERT into ykk_db1.t_com1(c1) VALUES(1);
ERROR 42000: INSERT command denied to user 'ykk1'@'%' for table 't_com1'
INSERT into ykk_db1.t_com1(c1) VALUES(2);
ERROR 42000: INSERT command denied to user 'ykk1'@'%' for table 't_com1'
SELECT c1 FROM ykk_db1.t_com1;
ERROR 42000: SELECT command denied to user 'ykk1'@'%' for table 't_com1'
SELECT c1 FROM ykk_db1.t_com1 WHERE c1 = 1;
ERROR 42000: SELECT command denied to user 'ykk1'@'%' for table 't_com1'
INSERT into ykk_db1.t_com1(c1) SELECT c1 FROM ykk_db1.t_com1 WHERE c1 = 1;
ERROR 42000: INSERT command denied to user 'ykk1'@'%' for table 't_com1'
INSERT into ykk_db1.t_com2(c2,c3,c4) VALUES('a','b','c');
ERROR 42000: INSERT command denied to user 'ykk1'@'%' for table 't_com2'
SELECT c2 FROM ykk_db1.t_com2;
ERROR 42000: SELECT command denied to user 'ykk1'@'%' for table 't_com2'
SELECT c3,c4 FROM ykk_db1.t_com2 WHERE c2 = 'a';
ERROR 42000: SELECT command denied to user 'ykk1'@'%' for table 't_com2'
INSERT into ykk_db1.t_com2(c2) SELECT c4 FROM ykk_db1.t_com2 WHERE c2 = 'a';
ERROR 42000: INSERT command denied to user 'ykk1'@'%' for table 't_com2'
SELECT * FROM ykk_db1.t_com1;
ERROR 42000: SELECT command denied to user 'ykk1'@'%' for table 't_com1'
# 验证 撤销SELECT+UPDATE 权限
SELECT c1 FROM ykk_db1.t_com1;
ERROR 42000: SELECT command denied to user 'ykk2'@'%' for table 't_com1'
SELECT c1 FROM ykk_db1.t_com1 WHERE c1 = 1;
ERROR 42000: SELECT command denied to user 'ykk2'@'%' for table 't_com1'
UPDATE ykk_db1.t_com1 SET c1 = 2;
ERROR 42000: UPDATE command denied to user 'ykk2'@'%' for table 't_com1'
UPDATE ykk_db1.t_com1 SET c1 = 3 WHERE c1 = 1;
ERROR 42000: UPDATE command denied to user 'ykk2'@'%' for table 't_com1'
SELECT c2 FROM ykk_db1.t_com2;
ERROR 42000: SELECT command denied to user 'ykk2'@'%' for table 't_com2'
SELECT c3,c4 FROM ykk_db1.t_com2 WHERE c2 = 'a';
ERROR 42000: SELECT command denied to user 'ykk2'@'%' for table 't_com2'
UPDATE ykk_db1.t_com2 SET c2 = 'a', c3 = 'j', c4 = 'k';
ERROR 42000: UPDATE command denied to user 'ykk2'@'%' for table 't_com2'
UPDATE ykk_db1.t_com2 SET c2 = (SELECT c3 FROM ykk_db1.t_com2 WHERE c4 = 'v');
ERROR 42000: UPDATE command denied to user 'ykk2'@'%' for table 't_com2'
# 验证 撤销INSERT+UPDATE 权限
INSERT INTO ykk_db1.t_com1(c1) VALUES(3);
ERROR 42000: INSERT command denied to user 'ykk3'@'%' for table 't_com1'
INSERT INTO ykk_db1.t_com2(c2,c3,c4) VALUES('asd','xxx','ccc');
ERROR 42000: INSERT command denied to user 'ykk3'@'%' for table 't_com2'
UPDATE ykk_db1.t_com1 SET c1 = 2;
ERROR 42000: UPDATE command denied to user 'ykk3'@'%' for table 't_com1'
UPDATE ykk_db1.t_com2 SET c2 = 'aaa';
ERROR 42000: UPDATE command denied to user 'ykk3'@'%' for table 't_com2'
UPDATE ykk_db1.t_com2 SET c3 = 'ccc';
ERROR 42000: UPDATE command denied to user 'ykk3'@'%' for table 't_com2'
UPDATE ykk_db1.t_com2 SET c4 = 'ggg';
ERROR 42000: UPDATE command denied to user 'ykk3'@'%' for table 't_com2'
UPDATE ykk_db1.t_com2 SET c2 = '111', c3 = 'sss', c4 = '333';
ERROR 42000: UPDATE command denied to user 'ykk3'@'%' for table 't_com2'
# 验证撤销不同列的不同的权限
INSERT INTO ykk_db1.t_com1(c2) VALUES(11);
ERROR 42000: INSERT command denied to user 'ykk4'@'%' for table 't_com1'
SELECT c1 FROM ykk_db1.t_com1;
ERROR 42000: SELECT command denied to user 'ykk4'@'%' for table 't_com1'
UPDATE ykk_db1.t_com1 SET c3 = 22;
ERROR 42000: UPDATE command denied to user 'ykk4'@'%' for table 't_com1'
INSERT INTO ykk_db1.t_com1(c2) SELECT c1 FROM ykk_db1.t_com1;
ERROR 42000: INSERT command denied to user 'ykk4'@'%' for table 't_com1'
UPDATE ykk_db1.t_com1 SET c3 = (SELECT c1 FROM ykk_db1.t_com1);
ERROR 42000: UPDATE command denied to user 'ykk4'@'%' for table 't_com1'
SELECT c1,c2 FROM ykk_db1.t_com2;
ERROR 42000: SELECT command denied to user 'ykk4'@'%' for table 't_com2'
INSERT INTO ykk_db1.t_com2(c2,c3) VALUES ('xxx','asa');
ERROR 42000: INSERT command denied to user 'ykk4'@'%' for table 't_com2'
UPDATE ykk_db1.t_com2 SET c3 = '15', c4 = 'as';
ERROR 42000: UPDATE command denied to user 'ykk4'@'%' for table 't_com2'
INSERT INTO ykk_db1.t_com2(c2) SELECT c2 FROM ykk_db1.t_com2;
ERROR 42000: INSERT command denied to user 'ykk4'@'%' for table 't_com2'
INSERT INTO ykk_db1.t_com2(c3) SELECT c2 FROM ykk_db1.t_com2;
ERROR 42000: INSERT command denied to user 'ykk4'@'%' for table 't_com2'
UPDATE ykk_db1.t_com2 SET c3 = c2 WHERE c1 = 1;
ERROR 42000: UPDATE command denied to user 'ykk4'@'%' for table 't_com2'
UPDATE ykk_db1.t_com2 SET c4 = c2 WHERE c1 = 1;
ERROR 42000: UPDATE command denied to user 'ykk4'@'%' for table 't_com2'
UPDATE ykk_db1.t_com2 SET c4 = (SELECT c2 FROM ykk_db1.t_com2 WHERE c2 = 'a');
ERROR 42000: UPDATE command denied to user 'ykk4'@'%' for table 't_com2'
UPDATE ykk_db1.t_com2 SET c4 = (SELECT c2 FROM ykk_db1.t_com2 WHERE c2 = 'b');
ERROR 42000: UPDATE command denied to user 'ykk4'@'%' for table 't_com2'
DROP USER ykk5;
CREATE USER 'ykk5'@'%' IDENTIFIED BY 'ykk123';
GRANT SELECT ON ykk.* TO ykk5;
GRANT SELECT(c1,c2,c3,c4), INSERT(c1,c2,c3,c4), UPDATE(c1,c2,c3,c4) ON ykk_db1.t_com3 TO ykk5;
GRANT SELECT, INSERT, UPDATE ON ykk_db1.t_com3 TO ykk5;
REVOKE SELECT(c1,c2,c3,c4), INSERT(c1,c2,c3,c4), UPDATE(c1,c2,c3,c4) ON ykk_db1.t_com3 FROM ykk5;
SELECT Host,Db,User,Table_name,Column_name,Column_priv FROM mysql.columns_priv WHERE user = 'ykk5';
Host	Db	User	Table_name	Column_name	Column_priv
SELECT * FROM information_schema.COLUMN_PRIVILEGES WHERE GRANTEE = "'ykk5'@'%'" ORDER BY GRANTEE,TABLE_NAME,Column_name;
GRANTEE	TABLE_CATALOG	TABLE_SCHEMA	TABLE_NAME	COLUMN_NAME	PRIVILEGE_TYPE	IS_GRANTABLE
# 验证权限
SELECT c1 FROM ykk_db1.t_com3;
c1
2
2
SELECT c2,c3,c4 FROM ykk_db1.t_com3;
c2	c3	c4
3	aaa	3
3	aaa	3
SELECT * FROM ykk_db1.t_com3;
c1	c2	c3	c4
2	3	aaa	3
2	3	aaa	3
INSERT INTO ykk_db1.t_com3 VALUES(1,'2','3','aaa');
UPDATE ykk_db1.t_com3 SET c1 = 10;
UPDATE ykk_db1.t_com3 SET c1 = 2, c2 = c3 WHERE c4 = 'aaa';
INSERT INTO ykk_db1.t_com3(c1,c2,c3,c4) SELECT c1,c2,c3,c4 FROM ykk_db1.t_com3;
INSERT INTO ykk_db1.t_com3(c1,c2,c3,c4) SELECT c1,c2,c3,c4 FROM ykk_db1.t_com3 WHERE c1 = 1;
UPDATE ykk_db1.t_com3 SET c1 = 2, c2 = c3, c3 = c4, c4 = c2;
GRANT SELECT(c1,c2,c3,c4), INSERT(c1,c2,c3,c4), UPDATE(c1,c2,c3,c4) ON ykk_db1.t_com3 TO ykk5;
REVOKE SELECT, INSERT, UPDATE ON ykk_db1.t_com3 FROM ykk5;
SELECT Host,Db,User,Table_name,Column_name,Column_priv FROM mysql.columns_priv WHERE user = 'ykk5';
Host	Db	User	Table_name	Column_name	Column_priv
SELECT * FROM information_schema.COLUMN_PRIVILEGES WHERE GRANTEE = "'ykk5'@'%'" ORDER BY TABLE_NAME,Column_name;
GRANTEE	TABLE_CATALOG	TABLE_SCHEMA	TABLE_NAME	COLUMN_NAME	PRIVILEGE_TYPE	IS_GRANTABLE
# 验证权限
SELECT c1 FROM ykk_db1.t_com3;
ERROR 42000: SELECT command denied to user 'ykk5'@'%' for table 't_com3'
SELECT c2,c3,c4 FROM ykk_db1.t_com3;
ERROR 42000: SELECT command denied to user 'ykk5'@'%' for table 't_com3'
SELECT * FROM ykk_db1.t_com3;
ERROR 42000: SELECT command denied to user 'ykk5'@'%' for table 't_com3'
INSERT INTO ykk_db1.t_com3 VALUES(1,'2','3','aaa');
ERROR 42000: INSERT command denied to user 'ykk5'@'%' for table 't_com3'
UPDATE ykk_db1.t_com3 SET c1 = 10;
ERROR 42000: UPDATE command denied to user 'ykk5'@'%' for table 't_com3'
UPDATE ykk_db1.t_com3 SET c1 = 2, c2 = c3 WHERE c4 = 'aaa';
ERROR 42000: UPDATE command denied to user 'ykk5'@'%' for table 't_com3'
INSERT INTO ykk_db1.t_com3(c1,c2,c3,c4) SELECT c1,c2,c3,c4 FROM ykk_db1.t_com3;
ERROR 42000: INSERT command denied to user 'ykk5'@'%' for table 't_com3'
INSERT INTO ykk_db1.t_com3(c1,c2,c3,c4) SELECT c1,c2,c3,c4 FROM ykk_db1.t_com3 WHERE c1 = 1;
ERROR 42000: INSERT command denied to user 'ykk5'@'%' for table 't_com3'
UPDATE ykk_db1.t_com3 SET c1 = 2, c2 = c3, c3 = c4, c4 = c2;
ERROR 42000: UPDATE command denied to user 'ykk5'@'%' for table 't_com3'
GRANT SELECT(c1,c2,c3,c4), INSERT(c1,c2,c3,c4), UPDATE(c1,c2,c3,c4) ON ykk_db1.t_com3 TO ykk5;
SELECT Host,Db,User,Table_name,Column_name,Column_priv FROM mysql.columns_priv WHERE user = 'ykk5';
Host	Db	User	Table_name	Column_name	Column_priv
%	ykk_db1	ykk5	t_com3	c1	Select,Insert,Update
%	ykk_db1	ykk5	t_com3	c2	Select,Insert,Update
%	ykk_db1	ykk5	t_com3	c3	Select,Insert,Update
%	ykk_db1	ykk5	t_com3	c4	Select,Insert,Update
SELECT * FROM information_schema.COLUMN_PRIVILEGES WHERE GRANTEE = "'ykk5'@'%'" ORDER BY GRANTEE,TABLE_NAME,Column_name;
GRANTEE	TABLE_CATALOG	TABLE_SCHEMA	TABLE_NAME	COLUMN_NAME	PRIVILEGE_TYPE	IS_GRANTABLE
'ykk5'@'%'	def	ykk_db1	t_com3	c1	INSERT	NO
'ykk5'@'%'	def	ykk_db1	t_com3	c1	SELECT	NO
'ykk5'@'%'	def	ykk_db1	t_com3	c1	UPDATE	NO
'ykk5'@'%'	def	ykk_db1	t_com3	c2	INSERT	NO
'ykk5'@'%'	def	ykk_db1	t_com3	c2	SELECT	NO
'ykk5'@'%'	def	ykk_db1	t_com3	c2	UPDATE	NO
'ykk5'@'%'	def	ykk_db1	t_com3	c3	INSERT	NO
'ykk5'@'%'	def	ykk_db1	t_com3	c3	SELECT	NO
'ykk5'@'%'	def	ykk_db1	t_com3	c3	UPDATE	NO
'ykk5'@'%'	def	ykk_db1	t_com3	c4	INSERT	NO
'ykk5'@'%'	def	ykk_db1	t_com3	c4	SELECT	NO
'ykk5'@'%'	def	ykk_db1	t_com3	c4	UPDATE	NO
REVOKE ALL ON ykk_db1.t_com3 FROM ykk5;
SELECT Host,Db,User,Table_name,Column_name,Column_priv FROM mysql.columns_priv WHERE user = 'ykk5';
Host	Db	User	Table_name	Column_name	Column_priv
SELECT * FROM information_schema.COLUMN_PRIVILEGES WHERE GRANTEE = "'ykk5'@'%'" ORDER BY TABLE_NAME,Column_name;
GRANTEE	TABLE_CATALOG	TABLE_SCHEMA	TABLE_NAME	COLUMN_NAME	PRIVILEGE_TYPE	IS_GRANTABLE
# 验证权限
SELECT c1 FROM ykk_db1.t_com3;
ERROR 42000: SELECT command denied to user 'ykk5'@'%' for table 't_com3'
SELECT c2,c3,c4 FROM ykk_db1.t_com3;
ERROR 42000: SELECT command denied to user 'ykk5'@'%' for table 't_com3'
SELECT * FROM ykk_db1.t_com3;
ERROR 42000: SELECT command denied to user 'ykk5'@'%' for table 't_com3'
INSERT INTO ykk_db1.t_com3 VALUES(1,'2','3','aaa');
ERROR 42000: INSERT command denied to user 'ykk5'@'%' for table 't_com3'
UPDATE ykk_db1.t_com3 SET c1 = 10;
ERROR 42000: UPDATE command denied to user 'ykk5'@'%' for table 't_com3'
UPDATE ykk_db1.t_com3 SET c1 = 2, c2 = c3 WHERE c4 = 'aaa';
ERROR 42000: UPDATE command denied to user 'ykk5'@'%' for table 't_com3'
INSERT INTO ykk_db1.t_com3(c1,c2,c3,c4) SELECT c1,c2,c3,c4 FROM ykk_db1.t_com3;
ERROR 42000: INSERT command denied to user 'ykk5'@'%' for table 't_com3'
INSERT INTO ykk_db1.t_com3(c1,c2,c3,c4) SELECT c1,c2,c3,c4 FROM ykk_db1.t_com3 WHERE c1 = 1;
ERROR 42000: INSERT command denied to user 'ykk5'@'%' for table 't_com3'
UPDATE ykk_db1.t_com3 SET c1 = 2, c2 = c3, c3 = c4, c4 = c2;
ERROR 42000: UPDATE command denied to user 'ykk5'@'%' for table 't_com3'
GRANT SELECT(c1) ON ykk_db1.t_com1 TO ykk1;
GRANT SELECT(c1) ON ykk.* TO ykk1;
SELECT Host,Db,User,Table_name,Column_name,Column_priv FROM mysql.columns_priv WHERE user = 'ykk1';
Host	Db	User	Table_name	Column_name	Column_priv
%	ykk_db1	ykk1	t_com1	c1	Select
SELECT * FROM information_schema.COLUMN_PRIVILEGES WHERE GRANTEE = "'ykk1'@'%'" ORDER BY GRANTEE,TABLE_NAME,Column_name;
GRANTEE	TABLE_CATALOG	TABLE_SCHEMA	TABLE_NAME	COLUMN_NAME	PRIVILEGE_TYPE	IS_GRANTABLE
'ykk1'@'%'	def	ykk_db1	t_com1	c1	SELECT	NO
REVOKE SELECT ON ykk_db1.t_com1 FROM ykk1;
SELECT Host,Db,User,Table_name,Column_name,Column_priv FROM mysql.columns_priv WHERE user = 'ykk1';
Host	Db	User	Table_name	Column_name	Column_priv
SELECT * FROM information_schema.COLUMN_PRIVILEGES WHERE GRANTEE = "'ykk1'@'%'" ORDER BY GRANTEE,TABLE_NAME,Column_name;
GRANTEE	TABLE_CATALOG	TABLE_SCHEMA	TABLE_NAME	COLUMN_NAME	PRIVILEGE_TYPE	IS_GRANTABLE
select c1 from ykk_db1.t_com1;
ERROR 42000: SELECT command denied to user 'ykk1'@'%' for table 't_com1'
select * from ykk_db1.t_com1;
ERROR 42000: SELECT command denied to user 'ykk1'@'%' for table 't_com1'
DROP USER ykk1;
CREATE USER 'ykk1'@'%' IDENTIFIED BY 'ykk123';
GRANT SELECT(Db,user,table_name,Column_priv) ON mysql.columns_priv TO ykk1;
SELECT Db,user,table_name,Column_priv FROM mysql.columns_priv WHERE user = 'ykk1';
Db	user	table_name	Column_priv
mysql	ykk1	columns_priv	Select
mysql	ykk1	columns_priv	Select
mysql	ykk1	columns_priv	Select
mysql	ykk1	columns_priv	Select
SELECT Host,Db,User,Table_name,Column_name,Column_priv FROM mysql.columns_priv;
ERROR 42000: SELECT command denied to user 'ykk1'@'%' for column 'Host' in table 'columns_priv'
GRANT CREATE(c1) ON ykk_db1.t_com1 TO ykk1;
ERROR 42000: You have an error in your SQL syntax; check the manual that corresponds to your OceanBase version for the right syntax to use near '(c1) ON ykk_db1.t_com1 TO ykk1' at line 1
REVOKE CREATE(c1) ON ykk_db1.t_com1 FROM ykk1;
ERROR 42000: You have an error in your SQL syntax; check the manual that corresponds to your OceanBase version for the right syntax to use near '(c1) ON ykk_db1.t_com1 FROM ykk1' at line 1
GRANT ALTER(c1) ON ykk_db1.t_com1 TO ykk1;
ERROR 42000: You have an error in your SQL syntax; check the manual that corresponds to your OceanBase version for the right syntax to use near '(c1) ON ykk_db1.t_com1 TO ykk1' at line 1
REVOKE ALTER(c1) ON ykk_db1.t_com1 FROM ykk1;
ERROR 42000: You have an error in your SQL syntax; check the manual that corresponds to your OceanBase version for the right syntax to use near '(c1) ON ykk_db1.t_com1 FROM ykk1' at line 1
GRANT DROP(c1) ON ykk_db1.t_com1 TO ykk1;
ERROR 42000: You have an error in your SQL syntax; check the manual that corresponds to your OceanBase version for the right syntax to use near '(c1) ON ykk_db1.t_com1 TO ykk1' at line 1
REVOKE DROP(c1) ON ykk_db1.t_com1 FROM ykk1;
ERROR 42000: You have an error in your SQL syntax; check the manual that corresponds to your OceanBase version for the right syntax to use near '(c1) ON ykk_db1.t_com1 FROM ykk1' at line 1
GRANT TRUNCATE(c1) ON ykk_db1.t_com1 TO ykk1;
ERROR 42000: You have an error in your SQL syntax; check the manual that corresponds to your OceanBase version for the right syntax to use near '(c1) ON ykk_db1.t_com1 TO ykk1' at line 1
REVOKE TRUNCATE(c1) ON ykk_db1.t_com1 FROM ykk1;
ERROR 42000: You have an error in your SQL syntax; check the manual that corresponds to your OceanBase version for the right syntax to use near '(c1) ON ykk_db1.t_com1 FROM ykk1' at line 1
GRANT DELETE(c1) ON ykk_db1.t_com1 TO ykk1;
ERROR 42000: You have an error in your SQL syntax; check the manual that corresponds to your OceanBase version for the right syntax to use near '(c1) ON ykk_db1.t_com1 TO ykk1' at line 1
REVOKE DELETE(c1) ON ykk_db1.t_com1 FROM ykk1;
ERROR 42000: You have an error in your SQL syntax; check the manual that corresponds to your OceanBase version for the right syntax to use near '(c1) ON ykk_db1.t_com1 FROM ykk1' at line 1
DROP DATABASE data1;
CREATE DATABASE data1;
USE data1;
CREATE TABLE t1(
c1 varchar(20),
c2 varchar(20),
c3 varchar(20),
c4 varchar(20)
);
GRANT SELECT(c1,c2,c3,c4) ON data1.t1 TO ykk1;
ALTER TABLE t1 DROP c2;
SELECT Host,Db,User,Table_name,Column_name,Column_priv FROM mysql.columns_priv WHERE user = 'ykk1' AND Table_name = 't1' AND Db = 'data1';
Host	Db	User	Table_name	Column_name	Column_priv
%	data1	ykk1	t1	c1	Select
%	data1	ykk1	t1	c2	Select
%	data1	ykk1	t1	c3	Select
%	data1	ykk1	t1	c4	Select
SELECT * FROM data1.t1;
c1	c3	c4
USE data1;
ALTER TABLE t1 CHANGE c1 c11 INT;
SELECT Host,Db,User,Table_name,Column_name,Column_priv FROM mysql.columns_priv WHERE user = 'ykk1' AND Table_name = 't1' AND Db = 'data1';
Host	Db	User	Table_name	Column_name	Column_priv
%	data1	ykk1	t1	c1	Select
%	data1	ykk1	t1	c2	Select
%	data1	ykk1	t1	c3	Select
%	data1	ykk1	t1	c4	Select
SELECT * FROM data1.t1;
ERROR 42000: SELECT command denied to user 'ykk1'@'%' for column 'c11' in table 't1'
USE data1;
ALTER TABLE t1 CHANGE c11 c1 INT;
SELECT Host,Db,User,Table_name,Column_name,Column_priv FROM mysql.columns_priv WHERE user = 'ykk1' AND Table_name = 't1' AND Db = 'data1';
Host	Db	User	Table_name	Column_name	Column_priv
%	data1	ykk1	t1	c1	Select
%	data1	ykk1	t1	c2	Select
%	data1	ykk1	t1	c3	Select
%	data1	ykk1	t1	c4	Select
SELECT * FROM data1.t1;
c1	c3	c4
USE data1;
DROP USER ykk1;
SELECT Host,Db,User,Table_name,Column_name,Column_priv FROM mysql.columns_priv WHERE user = 'ykk1';
Host	Db	User	Table_name	Column_name	Column_priv
CREATE USER 'ykk1'@'%' IDENTIFIED BY 'ykk123';
GRANT SELECT ON ykk.* TO ykk1;
SELECT Host,Db,User,Table_name,Column_name,Column_priv FROM mysql.columns_priv WHERE user = 'ykk1';
Host	Db	User	Table_name	Column_name	Column_priv
SELECT * FROM data1.t1;
ERROR 42000: SELECT command denied to user 'ykk1'@'%' for table 't1'
GRANT SELECT(c1,c2,c3,c4) ON data1.t1 TO ykk1;
USE data1;
DROP TABLE t1;
SELECT Host,Db,User,Table_name,Column_name,Column_priv FROM mysql.columns_priv WHERE Table_name = 't1' AND Db = 'data1';
Host	Db	User	Table_name	Column_name	Column_priv
%	data1	ykk1	t1	c1	Select
%	data1	ykk1	t1	c2	Select
%	data1	ykk1	t1	c3	Select
%	data1	ykk1	t1	c4	Select
CREATE TABLE t1(
c1 varchar(20),
c2 varchar(20),
c3 varchar(20),
c4 varchar(20)
);
SELECT Host,Db,User,Table_name,Column_name,Column_priv FROM mysql.columns_priv WHERE Table_name = 't1' AND Db = 'data1';
Host	Db	User	Table_name	Column_name	Column_priv
%	data1	ykk1	t1	c1	Select
%	data1	ykk1	t1	c2	Select
%	data1	ykk1	t1	c3	Select
%	data1	ykk1	t1	c4	Select
SELECT * FROM data1.t1;
c1	c2	c3	c4
DROP DATABASE data1;
SELECT Host,Db,User,Table_name,Column_name,Column_priv FROM mysql.columns_priv WHERE Db = 'data1';
Host	Db	User	Table_name	Column_name	Column_priv
%	data1	ykk1	t1	c1	Select
%	data1	ykk1	t1	c2	Select
%	data1	ykk1	t1	c3	Select
%	data1	ykk1	t1	c4	Select
CREATE DATABASE data1;
SELECT Host,Db,User,Table_name,Column_name,Column_priv FROM mysql.columns_priv WHERE Db = 'data1';
Host	Db	User	Table_name	Column_name	Column_priv
%	data1	ykk1	t1	c1	Select
%	data1	ykk1	t1	c2	Select
%	data1	ykk1	t1	c3	Select
%	data1	ykk1	t1	c4	Select
USE data1;
CREATE TABLE t1(
c1 varchar(20),
c2 varchar(20),
c3 varchar(20),
c4 varchar(20)
);
SELECT Host,Db,User,Table_name,Column_name,Column_priv FROM mysql.columns_priv WHERE Table_name = 't1' AND Db = 'data1';
Host	Db	User	Table_name	Column_name	Column_priv
%	data1	ykk1	t1	c1	Select
%	data1	ykk1	t1	c2	Select
%	data1	ykk1	t1	c3	Select
%	data1	ykk1	t1	c4	Select
SELECT * FROM data1.t1;
c1	c2	c3	c4
USE data1;
DROP TABLE t1;
CREATE TABLE t1(
c1 int,
c2 varchar(20),
c3 varchar(20),
c4 varchar(20)
);
INSERT INTO t1 VALUES(1,'a',null,null);
INSERT INTO t1 VALUES(2,'b',null,null);
INSERT INTO t1 VALUES(3,'c',null,null);
INSERT INTO t1 VALUES(4,'a',null,null);
INSERT INTO t1 VALUES(5,'b',null,null);
INSERT INTO t1 VALUES(6,'c',null,null);
CREATE INDEX inxt1 ON t1 (c1);
DROP TABLE t2;
CREATE TABLE t2(
c1 int,
c2 varchar(20),
c3 varchar(20),
c4 varchar(20)
);
INSERT INTO t2 VALUES(1,'AAA',null,null);
INSERT INTO t2 VALUES(2,'BBB',null,null);
INSERT INTO t2 VALUES(3,'CCC',null,null);
INSERT INTO t2 VALUES(4,'AAA',null,null);
INSERT INTO t2 VALUES(5,'BBB',null,null);
INSERT INTO t2 VALUES(6,'CCC',null,null);
DROP TABLE t3;
CREATE TABLE t3(
c1 int PRIMARY KEY,
c2 varchar(20),
c3 varchar(20),
c4 varchar(20)
);
DROP USER ykk1;
CREATE USER 'ykk1'@'%' IDENTIFIED BY 'ykk123';
GRANT SELECT(c1,c2), INSERT(c1,c2) ON data1.t1 TO ykk1;
GRANT SELECT(c1,c2,c3,c4), INSERT(c1,c2,c3,c4) ON data1.t2 TO ykk1;
GRANT SELECT(c1,c2,c3,c4), INSERT(c1,c2,c3,c4) ON data1.t3 TO ykk1;
GRANT CREATE ON data1.* TO ykk1;
USE data1;
SELECT c1,c2 FROM t1;
c1	c2
1	a
2	b
3	c
4	a
5	b
6	c
SELECT c3 FROM t1;
ERROR 42000: SELECT command denied to user 'ykk1'@'%' for column 'c3' in table 't1'
SELECT c2,c3 FROM t1;
ERROR 42000: SELECT command denied to user 'ykk1'@'%' for column 'c3' in table 't1'
SELECT * FROM t2;
c1	c2	c3	c4
1	AAA	NULL	NULL
2	BBB	NULL	NULL
3	CCC	NULL	NULL
4	AAA	NULL	NULL
5	BBB	NULL	NULL
6	CCC	NULL	NULL
SELECT * FROM t1;
ERROR 42000: SELECT command denied to user 'ykk1'@'%' for column 'c3' in table 't1'
SELECT c1,c2 FROM t1 WHERE c1 = 1;
c1	c2
1	a
SELECT c1,c2 FROM t1 WHERE c3 = '1';
ERROR 42000: SELECT command denied to user 'ykk1'@'%' for column 'c3' in table 't1'
SELECT c1,c2 FROM t1 GROUP BY c1;
c1	c2
1	a
2	b
3	c
4	a
5	b
6	c
SELECT c1,c2 FROM t1 GROUP BY c3;
ERROR 42000: SELECT command denied to user 'ykk1'@'%' for column 'c3' in table 't1'
SELECT c1,c2 FROM t1 ORDER BY c1;
c1	c2
1	a
2	b
3	c
4	a
5	b
6	c
SELECT c1,c2 FROM t1 ORDER BY c3;
ERROR 42000: SELECT command denied to user 'ykk1'@'%' for column 'c3' in table 't1'
SELECT t1.c1, t1.c2, t2.c1, t2.c2, t2.c3, t2.c4 FROM t1 LEFT JOIN t2 ON t1.c1 = t2.c1;
c1	c2	c1	c2	c3	c4
1	a	1	AAA	NULL	NULL
2	b	2	BBB	NULL	NULL
3	c	3	CCC	NULL	NULL
4	a	4	AAA	NULL	NULL
5	b	5	BBB	NULL	NULL
6	c	6	CCC	NULL	NULL
SELECT * FROM t1 LEFT JOIN t2 ON t1.c1 = t2.c1;
ERROR 42000: SELECT command denied to user 'ykk1'@'%' for column 'c3' in table 't1'
SELECT t1.c1, t1.c2, t1.c3, t1.c4, t2.c1, t2.c2, t2.c3, t2.c4 FROM t1 LEFT JOIN t2 ON t1.c1 = t2.c1;
ERROR 42000: SELECT command denied to user 'ykk1'@'%' for column 'c3' in table 't1'
SELECT c1, c2 INTO @var1,@var2 FROM t1 LIMIT 1;
SELECT c1, c2 INTO @var1,@var2 FROM t2 WHERE c1 = 4;
SELECT * INTO @var1,@var2,@var3,@var4 FROM t1;
ERROR 42000: SELECT command denied to user 'ykk1'@'%' for column 'c3' in table 't1'
SELECT c1, c2, c3, c4 INTO @var1,@var2,@var3,@var4 FROM t1;
ERROR 42000: SELECT command denied to user 'ykk1'@'%' for column 'c3' in table 't1'
SELECT c1, c2 INTO @var1,@var2 FROM t1 WHERE c3 = '4';
ERROR 42000: SELECT command denied to user 'ykk1'@'%' for column 'c3' in table 't1'
CREATE TABLE t4 AS SELECT c1,c2 FROM t1;
ERROR 42000: INSERT command denied to user 'ykk1'@'%' for table 't4'
CREATE TABLE t5 AS SELECT * FROM t2;
ERROR 42000: INSERT command denied to user 'ykk1'@'%' for table 't5'
CREATE TABLE tt4 AS SELECT * FROM t1;
ERROR 42000: INSERT command denied to user 'ykk1'@'%' for table 'tt4'
CREATE TABLE tt4 AS SELECT c1,c2,c3 FROM t1;
ERROR 42000: INSERT command denied to user 'ykk1'@'%' for table 'tt4'
CREATE TABLE tt4 AS SELECT c1,c2 FROM t1 WHERE c3 IS NULL;
ERROR 42000: INSERT command denied to user 'ykk1'@'%' for table 'tt4'
SELECT c1 FROM t1 UNION ALL SELECT c1 FROM t2;
c1
1
1
2
2
3
3
4
4
5
5
6
6
SELECT * FROM t1 UNION ALL SELECT * FROM t2;
ERROR 42000: SELECT command denied to user 'ykk1'@'%' for column 'c3' in table 't1'
INSERT INTO t1 SET c1 = 1, c2 = '2';
INSERT INTO t1 SET c1 = 1, c2 = '2', c3 = '3', c4 = '4';
ERROR 42000: INSERT command denied to user 'ykk1'@'%' for column 'c3' in table 't1'
INSERT INTO t2 SET c1 = 1, c2 = '2', c3 = '3', c4 = '4';
INSERT INTO t1 VALUES();
ERROR 42000: INSERT command denied to user 'ykk1'@'%' for column 'c3' in table 't1'
INSERT INTO t2 VALUES();
INSERT INTO t1 (c1, c2) VALUES (1, 'Value A') ON DUPLICATE KEY UPDATE c2 = VALUES(c2);
ERROR 42000: UPDATE command denied to user 'ykk1'@'%' for table 't1'
INSERT INTO t3 (c1, c2, c3, c4) VALUES (1, 'Value A', 'Value B', 'Value C') ON DUPLICATE KEY UPDATE c2 = VALUES(c2), c3 = VALUES(c3), c4 = VALUES(c4);
ERROR 42000: UPDATE command denied to user 'ykk1'@'%' for table 't3'
INSERT IGNORE INTO t1 (c1, c2) VALUES (1, 'A');
INSERT IGNORE INTO t3 (c1, c2, c3, c4) VALUES (1, 'A', 'B', 'C');
REPLACE INTO t1 (c1, c2) VALUES (1, 'A');
ERROR 42000: DELETE command denied to user 'ykk1'@'%' for table 't1'
REPLACE INTO t2 VALUES (1, 'A', 'B', 'C');
ERROR 42000: DELETE command denied to user 'ykk1'@'%' for table 't2'
GRANT SELECT, INSERT, UPDATE, DELETE ON data1.t1 TO ykk1;
GRANT SELECT, INSERT, UPDATE, DELETE ON data1.t2 TO ykk1;
GRANT SELECT, INSERT, UPDATE ON data1.t3 TO ykk1;
USE data1;
INSERT INTO t1 SET c1 = 1, c2 = '2';
INSERT INTO t1 SET c1 = 1, c2 = '2', c3 = '3', c4 = '4';
INSERT INTO t2 SET c1 = 1, c2 = '2', c3 = '3', c4 = '4';
INSERT INTO t1 VALUES();
INSERT INTO t2 VALUES();
INSERT INTO t1 (c1, c2) VALUES (1, 'Value A') ON DUPLICATE KEY UPDATE c2 = VALUES(c2);
INSERT INTO t3 (c1, c2, c3, c4) VALUES (1, 'Value A', 'Value B', 'Value C') ON DUPLICATE KEY UPDATE c2 = VALUES(c2), c3 = VALUES(c3), c4 = VALUES(c4);
INSERT IGNORE INTO t1 (c1, c2) VALUES (1, 'A');
INSERT IGNORE INTO t3 (c1, c2, c3, c4) VALUES (1, 'A', 'B', 'C');
REPLACE INTO t1 (c1, c2) VALUES (1, 'A');
REPLACE INTO t2 VALUES (1, 'A', 'B', 'C');
DROP USER ykk1;
CREATE USER 'ykk1'@'%' IDENTIFIED BY 'ykk123';
GRANT SELECT(c1,c2,c3,c4) ON data1.t1 TO ykk1;
GRANT SELECT ON data1.t2 TO ykk1;
USE data1;
SHOW CREATE TABLE t1;
SHOW CREATE TABLE t2;
Table	Create Table
  `c1` int(11) DEFAULT NULL,
  `c2` varchar(20) DEFAULT NULL,
  `c3` varchar(20) DEFAULT NULL,
  `c4` varchar(20) DEFAULT NULL
) ORGANIZATION INDEX DEFAULT CHARSET = utf8mb4 ROW_FORMAT = DYNAMIC COMPRESSION = 'zstd_1.3.8' REPLICA_NUM = 1 BLOCK_SIZE = 16384 USE_BLOOM_FILTER = FALSE ENABLE_MACRO_BLOCK_BLOOM_FILTER = FALSE TABLET_SIZE = 134217728 PCTFREE = 0
t2	CREATE TABLE `t2` (
SHOW COLUMNS FROM t1;
Field	Type	Null	Key	Default	Extra
c1	int(11)	YES	MUL	NULL	
c2	varchar(20)	YES		NULL	
c3	varchar(20)	YES		NULL	
c4	varchar(20)	YES		NULL	
SHOW COLUMNS FROM t2;
Field	Type	Null	Key	Default	Extra
c1	int(11)	YES		NULL	
c2	varchar(20)	YES		NULL	
c3	varchar(20)	YES		NULL	
c4	varchar(20)	YES		NULL	
SHOW COLUMNS FROM t1 like '%c1%';
Field	Type	Null	Key	Default	Extra
c1	int(11)	YES	MUL	NULL	
SHOW COLUMNS FROM t2 like '%c1%';
Field	Type	Null	Key	Default	Extra
c1	int(11)	YES		NULL	
SHOW INDEX FROM t1;
Table	Non_unique	Key_name	Seq_in_index	Column_name	Collation	Cardinality	Sub_part	Packed	Null	Index_type	Comment	Index_comment	Visible	Expression
t1	1	inxt1	1	c1	A	NULL	NULL	NULL	YES	BTREE	available		YES	NULL
SHOW INDEX FROM t2;
Table	Non_unique	Key_name	Seq_in_index	Column_name	Collation	Cardinality	Sub_part	Packed	Null	Index_type	Comment	Index_comment	Visible	Expression
SHOW TABLE STATUS like '%t1%';
SHOW TABLE STATUS like '%t2%';
SHOW FULL COLUMNS FROM t1;
Field	Type	Collation	Null	Key	Default	Extra	Privileges	Comment
c1	int(11)	NULL	YES	MUL	NULL		SELECT	
c2	varchar(20)	utf8mb4_general_ci	YES		NULL		SELECT	
c3	varchar(20)	utf8mb4_general_ci	YES		NULL		SELECT	
c4	varchar(20)	utf8mb4_general_ci	YES		NULL		SELECT	
SHOW FULL COLUMNS FROM t2;
Field	Type	Collation	Null	Key	Default	Extra	Privileges	Comment
c1	int(11)	NULL	YES		NULL		SELECT	
c2	varchar(20)	utf8mb4_general_ci	YES		NULL		SELECT	
c3	varchar(20)	utf8mb4_general_ci	YES		NULL		SELECT	
c4	varchar(20)	utf8mb4_general_ci	YES		NULL		SELECT	
REVOKE SELECT(c2,c3,c4) ON data1.t1 FROM ykk1;
REVOKE SELECT ON data1.t2 FROM ykk1;
USE data1;
SHOW CREATE TABLE t1;
ERROR 42000: SHOW command denied to user 'ykk1'@'%' for table 't1'
SHOW CREATE TABLE t2;
ERROR 42000: SHOW command denied to user 'ykk1'@'%' for table 't2'
SHOW COLUMNS FROM t1;
Field	Type	Null	Key	Default	Extra
c1	int(11)	YES	MUL	NULL	
SHOW COLUMNS FROM t2;
ERROR 42000: SELECT command denied to user 'ykk1'@'%' for table 't2'
SHOW COLUMNS FROM t1 like '%c2%';
Field	Type	Null	Key	Default	Extra
SHOW COLUMNS FROM t2 like '%c3%';
ERROR 42000: SELECT command denied to user 'ykk1'@'%' for table 't2'
SHOW INDEX FROM t1;
Table	Non_unique	Key_name	Seq_in_index	Column_name	Collation	Cardinality	Sub_part	Packed	Null	Index_type	Comment	Index_comment	Visible	Expression
t1	1	inxt1	1	c1	A	NULL	NULL	NULL	YES	BTREE	available		YES	NULL
SHOW INDEX FROM t2;
ERROR 42000: SELECT command denied to user 'ykk1'@'%' for table 't2'
SHOW TABLE STATUS like '%t1%';
SHOW TABLE STATUS like '%t2%';
SHOW FULL COLUMNS FROM t1;
Field	Type	Collation	Null	Key	Default	Extra	Privileges	Comment
c1	int(11)	NULL	YES	MUL	NULL		SELECT	
SHOW FULL COLUMNS FROM t2;
ERROR 42000: SELECT command denied to user 'ykk1'@'%' for table 't2'
DROP USER ykk1;
CREATE USER 'ykk1'@'%' IDENTIFIED BY 'ykk123';
DROP USER ykk2;
CREATE USER 'ykk2'@'%' IDENTIFIED BY 'ykk123';
DROP USER ykk3;
CREATE USER 'ykk3'@'%' IDENTIFIED BY 'ykk123';
DROP USER ykk4;
CREATE USER 'ykk4'@'%' IDENTIFIED BY 'ykk123';
USE data1;
DROP TABLE t1;
CREATE TABLE t1(
c1 INT NOT NULL,
c2 VARCHAR(100) NOT NULL,
c3 VARCHAR(100) NOT NULL,
c4 VARCHAR(200) AS (CONCAT(c1, c2)) STORED,
c5 VARCHAR(200) AS (CONCAT(c2, c3)) VIRTUAL,
PRIMARY KEY (c1) 
);
INSERT INTO t1(c1,c2,c3) VALUES(1001, 'AAAA', 'AAAAAAAA');
INSERT INTO t1(c1,c2,c3) VALUES(2001, 'BBBB', 'BBBBBBBB');
INSERT INTO t1(c1,c2,c3) VALUES(3001, 'CCCC', 'CCCCCCCC');
CREATE VIEW v1 AS SELECT * FROM t1;
DROP TABLE tt1;
CREATE TABLE tt1 (
c1 INT NOT NULL,
c2 VARCHAR(100) NOT NULL,
c3 VARCHAR(100) NOT NULL,
c4 VARCHAR(200) AS (CONCAT(c1, c2)) STORED,
c5 VARCHAR(200) AS (CONCAT(c2, c3)) VIRTUAL,
PRIMARY KEY (c1)
) PARTITION BY RANGE (c1) (
PARTITION p0 VALUES LESS THAN (1000),
PARTITION p1 VALUES LESS THAN (2000),
PARTITION p2 VALUES LESS THAN (3000),
PARTITION p3 VALUES LESS THAN MAXVALUE
);
INSERT INTO tt1(c1,c2,c3) VALUES(1001, 'AAAA', 'AAAAAAAA');
INSERT INTO tt1(c1,c2,c3) VALUES(2001, 'BBBB', 'BBBBBBBB');
INSERT INTO tt1(c1,c2,c3) VALUES(3001, 'CCCC', 'CCCCCCCC');
GRANT SELECT(c1,c2,c3,c4,c5), INSERT(c1,c2,c3,c4), UPDATE(c1,c2,c3,c4) ON data1.t1 TO ykk1;
GRANT SELECT(c1,c2,c3,c4,c5), INSERT(c1,c2,c3,c4), UPDATE(c1,c2,c3,c4) ON data1.v1 TO ykk1;
GRANT SELECT(c1,c2,c3,c4,c5), INSERT(c1,c2,c3,c4), UPDATE(c1,c2,c3,c4) ON data1.tt1 TO ykk1;
GRANT SELECT, INSERT, UPDATE ON data1.t1 TO ykk2;
GRANT SELECT, INSERT, UPDATE ON data1.v1 TO ykk2;
GRANT SELECT, INSERT, UPDATE ON data1.tt1 TO ykk2;
GRANT SELECT(c1,c2,c3), INSERT(c1,c2,c3), UPDATE(c1,c2,c3) ON data1.t1 TO ykk3;
GRANT SELECT(c1,c2,c3), INSERT(c1,c2,c3), UPDATE(c1,c2,c3) ON data1.v1 TO ykk3;
GRANT SELECT(c1,c2,c3), INSERT(c1,c2,c3), UPDATE(c1,c2,c3) ON data1.tt1 TO ykk3;
GRANT SELECT(c4,c5) ON data1.t1 TO ykk4;
GRANT SELECT(c4,c5) ON data1.v1 TO ykk4;
GRANT SELECT(c4,c5) ON data1.tt1 TO ykk4;
USE data1;
INSERT INTO t1(c1,c2,c3) VALUES(4001, 'DDDD', 'DDDDDDDD');
UPDATE t1 SET c3 = 'CCCCCCCCCCCCCCCC' WHERE c1 = 3001;
SELECT * FROM t1;
c1	c2	c3	c4	c5
1001	AAAA	AAAAAAAA	1001AAAA	AAAAAAAAAAAA
2001	BBBB	BBBBBBBB	2001BBBB	BBBBBBBBBBBB
3001	CCCC	CCCCCCCCCCCCCCCC	3001CCCC	CCCCCCCCCCCCCCCCCCCC
4001	DDDD	DDDDDDDD	4001DDDD	DDDDDDDDDDDD
INSERT INTO v1(c1,c2,c3) VALUES(5001, 'EEEE', 'EEEEEEEE');
UPDATE v1 SET c3 = 'CCCCCCCCCCCCCCCC' WHERE c1 = 3001;
SELECT * FROM v1;
c1	c2	c3	c4	c5
1001	AAAA	AAAAAAAA	1001AAAA	AAAAAAAAAAAA
2001	BBBB	BBBBBBBB	2001BBBB	BBBBBBBBBBBB
3001	CCCC	CCCCCCCCCCCCCCCC	3001CCCC	CCCCCCCCCCCCCCCCCCCC
4001	DDDD	DDDDDDDD	4001DDDD	DDDDDDDDDDDD
5001	EEEE	EEEEEEEE	5001EEEE	EEEEEEEEEEEE
INSERT INTO tt1(c1,c2,c3) VALUES(4001, 'DDDD', 'DDDDDDDD');
UPDATE tt1 SET c3 = 'CCCCCCCCCCCCCCCC' WHERE c1 = 3001;
SELECT * FROM tt1;
c1	c2	c3	c4	c5
1001	AAAA	AAAAAAAA	1001AAAA	AAAAAAAAAAAA
2001	BBBB	BBBBBBBB	2001BBBB	BBBBBBBBBBBB
3001	CCCC	CCCCCCCCCCCCCCCC	3001CCCC	CCCCCCCCCCCCCCCCCCCC
4001	DDDD	DDDDDDDD	4001DDDD	DDDDDDDDDDDD
USE data1;
INSERT INTO t1(c1,c2,c3) VALUES(6001, 'DDDD', 'DDDDDDDD');
UPDATE t1 SET c3 = 'CCCCCCCCCCCCCCCC' WHERE c1 = 3001;
SELECT * FROM t1;
c1	c2	c3	c4	c5
1001	AAAA	AAAAAAAA	1001AAAA	AAAAAAAAAAAA
2001	BBBB	BBBBBBBB	2001BBBB	BBBBBBBBBBBB
3001	CCCC	CCCCCCCCCCCCCCCC	3001CCCC	CCCCCCCCCCCCCCCCCCCC
4001	DDDD	DDDDDDDD	4001DDDD	DDDDDDDDDDDD
5001	EEEE	EEEEEEEE	5001EEEE	EEEEEEEEEEEE
6001	DDDD	DDDDDDDD	6001DDDD	DDDDDDDDDDDD
INSERT INTO v1(c1,c2,c3) VALUES(7001, 'DDDD', 'DDDDDDDD');
UPDATE v1 SET c3 = 'CCCCCCCCCCCCCCCC' WHERE c1 = 3001;
SELECT * FROM v1;
c1	c2	c3	c4	c5
1001	AAAA	AAAAAAAA	1001AAAA	AAAAAAAAAAAA
2001	BBBB	BBBBBBBB	2001BBBB	BBBBBBBBBBBB
3001	CCCC	CCCCCCCCCCCCCCCC	3001CCCC	CCCCCCCCCCCCCCCCCCCC
4001	DDDD	DDDDDDDD	4001DDDD	DDDDDDDDDDDD
5001	EEEE	EEEEEEEE	5001EEEE	EEEEEEEEEEEE
6001	DDDD	DDDDDDDD	6001DDDD	DDDDDDDDDDDD
7001	DDDD	DDDDDDDD	7001DDDD	DDDDDDDDDDDD
INSERT INTO tt1(c1,c2,c3) VALUES(5001, 'DDDD', 'DDDDDDDD');
UPDATE tt1 SET c3 = 'CCCCCCCCCCCCCCCC' WHERE c1 = 3001;
SELECT * FROM tt1;
c1	c2	c3	c4	c5
1001	AAAA	AAAAAAAA	1001AAAA	AAAAAAAAAAAA
2001	BBBB	BBBBBBBB	2001BBBB	BBBBBBBBBBBB
3001	CCCC	CCCCCCCCCCCCCCCC	3001CCCC	CCCCCCCCCCCCCCCCCCCC
4001	DDDD	DDDDDDDD	4001DDDD	DDDDDDDDDDDD
5001	DDDD	DDDDDDDD	5001DDDD	DDDDDDDDDDDD
USE data1;
INSERT INTO t1(c1,c2,c3) VALUES(8001, 'DDDD', 'DDDDDDDD');
UPDATE t1 SET c3 = 'CCCCCCCCCCCCCCCC' WHERE c1 = 3001;
SELECT * FROM t1;
ERROR 42000: SELECT command denied to user 'ykk3'@'%' for column 'c4' in table 't1'
INSERT INTO v1(c1,c2,c3) VALUES(9001, 'DDDD', 'DDDDDDDD');
UPDATE v1 SET c3 = 'CCCCCCCCCCCCCCCC' WHERE c1 = 3001;
SELECT * FROM v1;
ERROR 42000: SELECT command denied to user 'ykk3'@'%' for column 'c4' in table 'v1'
INSERT INTO tt1(c1,c2,c3) VALUES(6001, 'DDDD', 'DDDDDDDD');
UPDATE tt1 SET c3 = 'CCCCCCCCCCCCCCCC' WHERE c1 = 3001;
SELECT * FROM tt1;
ERROR 42000: SELECT command denied to user 'ykk3'@'%' for column 'c4' in table 'tt1'
USE data1;
SELECT * FROM t1;
ERROR 42000: SELECT command denied to user 'ykk4'@'%' for column 'c1' in table 't1'
SELECT * FROM v1;
ERROR 42000: SELECT command denied to user 'ykk4'@'%' for column 'c1' in table 'v1'
SELECT * FROM tt1;
ERROR 42000: SELECT command denied to user 'ykk4'@'%' for column 'c1' in table 'tt1'
SELECT c4,c5 FROM t1;
c4	c5
1001AAAA	AAAAAAAAAAAA
2001BBBB	BBBBBBBBBBBB
3001CCCC	CCCCCCCCCCCCCCCCCCCC
4001DDDD	DDDDDDDDDDDD
5001EEEE	EEEEEEEEEEEE
6001DDDD	DDDDDDDDDDDD
7001DDDD	DDDDDDDDDDDD
8001DDDD	DDDDDDDDDDDD
9001DDDD	DDDDDDDDDDDD
SELECT c4,c5 FROM v1;
c4	c5
1001AAAA	AAAAAAAAAAAA
2001BBBB	BBBBBBBBBBBB
3001CCCC	CCCCCCCCCCCCCCCCCCCC
4001DDDD	DDDDDDDDDDDD
5001EEEE	EEEEEEEEEEEE
6001DDDD	DDDDDDDDDDDD
7001DDDD	DDDDDDDDDDDD
8001DDDD	DDDDDDDDDDDD
9001DDDD	DDDDDDDDDDDD
SELECT c4,c5 FROM tt1;
c4	c5
1001AAAA	AAAAAAAAAAAA
2001BBBB	BBBBBBBBBBBB
3001CCCC	CCCCCCCCCCCCCCCCCCCC
4001DDDD	DDDDDDDDDDDD
5001DDDD	DDDDDDDDDDDD
6001DDDD	DDDDDDDDDDDD
USE data1;
DROP TABLE t1;
DROP TABLE tt1;
DROP VIEW v1;
DROP DATABASE data1;
DROP DATABASE ykk_db1;
DROP USER ykk1;
DROP USER ykk2;
DROP USER ykk3;
DROP USER ykk4;
