purge recyclebin;
result_format: 4
base64-4 pl
base64-4-1 存储过程 
DROP TABLE base_test1;
CREATE TABLE base_test1(  
  c1 int,  
  c2 float, 
  c3 DECIMAL(5,2) DEFAULT 8.8, 
  c4 VARCHAR(100), 
  c5 bit(10),
  c6 datetime, 
  c7 json NOT NULL,
  c8 SET('a', 'b', 'c', 'd'));
CREATE INDEX INDEX_base_test1_T1 ON base_test1(c4);
ALTER TABLE `base_test1` ADD INDEX INDEX_base_test1_T3 (c6, c1);
CREATE INDEX INDEX_base_test1_T5 USING HASH ON base_test1(c8);
insert into base_test1 values(from_base64(to_base64(0)),from_base64('MS4xMTEx'),2.2,from_base64(to_base64('asd汉字！@#￥%……!@@^&*&*()+{}:>?|')),from_base64(to_base64(b'1000001')),
from_base64(to_base64('2020-12-31 23:59:59.999999')),'[{"abs":123},"汉字123！@#$%^&*()_+",[0]]',from_base64(to_base64('b,d')));
DROP PROCEDURE base_pl;
CREATE  PROCEDURE base_pl(in a DATE)
begin
DECLARE i int;
    set i=20101005;
    while from_base64(to_base64(i)) <= from_base64(to_base64(20101010)) DO
            if a = (select (select date('2020-12-12'))) then
               insert into base_test1 values(from_base64(to_base64(0)),
			   from_base64('MS4xMTEx'),
			   2.2,
			   from_base64(to_base64('asd汉字')),
			   from_base64(to_base64(b'1000001')),
			   from_base64(to_base64('2020-10-10 23:59:59.999999')),
			   '[{"abs":123}]',
			   from_base64(to_base64('a,d')));

            elseif (select '2011-11-11')>a then
                   update base_test1 set c4 = to_base64('测试'),
							c6 = from_base64('MjAyMC0xMi0yMiAyMzo1OTo1OS45OTk5OTk=');
                else
                   replace into base_test1 values(from_base64(to_base64(0)),
				   from_base64('MS4xMTEx'),
				   2.2,
				   from_base64(to_base64('asd')),
				   from_base64(to_base64(b'1000001')),
				   from_base64(to_base64('2020-12-31 23:59:59.999999')),
				   '[{"abs":123},"汉字123！@#$%^&*()_+",[0]]',
				   from_base64(to_base64('b,d')));
                end if;
                set i = i + 1;
    end WHILE;
end;
//
select * from base_test1;
+------+--------+------+-------------------------------------------+------+---------------------+------------------------------------------------+------+
| c1   | c2     | c3   | c4                                        | c5   | c6                  | c7                                             | c8   |
+------+--------+------+-------------------------------------------+------+---------------------+------------------------------------------------+------+
|    0 | 1.1111 | 2.20 | asd汉字！@#￥%……!@@^&*&*()+{}:>?|         |  A   | 2021-01-01 00:00:00 | [{"abs": 123}, "汉字123！@#$%^&*()_+", [0]]    | b,d  |
+------+--------+------+-------------------------------------------+------+---------------------+------------------------------------------------+------+
call base_pl((select (select date('2020-12-12'))));
select * from base_test1;
+------+--------+------+-------------------------------------------+------+---------------------+------------------------------------------------+------+
| c1   | c2     | c3   | c4                                        | c5   | c6                  | c7                                             | c8   |
+------+--------+------+-------------------------------------------+------+---------------------+------------------------------------------------+------+
|    0 | 1.1111 | 2.20 | asd汉字！@#￥%……!@@^&*&*()+{}:>?|         |  A   | 2021-01-01 00:00:00 | [{"abs": 123}, "汉字123！@#$%^&*()_+", [0]]    | b,d  |
|    0 | 1.1111 | 2.20 | asd汉字                                   |  A   | 2020-10-11 00:00:00 | [{"abs": 123}]                                 | a,d  |
|    0 | 1.1111 | 2.20 | asd汉字                                   |  A   | 2020-10-11 00:00:00 | [{"abs": 123}]                                 | a,d  |
|    0 | 1.1111 | 2.20 | asd汉字                                   |  A   | 2020-10-11 00:00:00 | [{"abs": 123}]                                 | a,d  |
|    0 | 1.1111 | 2.20 | asd汉字                                   |  A   | 2020-10-11 00:00:00 | [{"abs": 123}]                                 | a,d  |
|    0 | 1.1111 | 2.20 | asd汉字                                   |  A   | 2020-10-11 00:00:00 | [{"abs": 123}]                                 | a,d  |
|    0 | 1.1111 | 2.20 | asd汉字                                   |  A   | 2020-10-11 00:00:00 | [{"abs": 123}]                                 | a,d  |
+------+--------+------+-------------------------------------------+------+---------------------+------------------------------------------------+------+
call base_pl((select (select date('2011-11-10'))));
select * from base_test1;
+------+--------+------+----------+------+---------------------+------------------------------------------------+------+
| c1   | c2     | c3   | c4       | c5   | c6                  | c7                                             | c8   |
+------+--------+------+----------+------+---------------------+------------------------------------------------+------+
|    0 | 1.1111 | 2.20 | 5rWL6K+V |  A   | 2020-12-23 00:00:00 | [{"abs": 123}, "汉字123！@#$%^&*()_+", [0]]    | b,d  |
|    0 | 1.1111 | 2.20 | 5rWL6K+V |  A   | 2020-12-23 00:00:00 | [{"abs": 123}]                                 | a,d  |
|    0 | 1.1111 | 2.20 | 5rWL6K+V |  A   | 2020-12-23 00:00:00 | [{"abs": 123}]                                 | a,d  |
|    0 | 1.1111 | 2.20 | 5rWL6K+V |  A   | 2020-12-23 00:00:00 | [{"abs": 123}]                                 | a,d  |
|    0 | 1.1111 | 2.20 | 5rWL6K+V |  A   | 2020-12-23 00:00:00 | [{"abs": 123}]                                 | a,d  |
|    0 | 1.1111 | 2.20 | 5rWL6K+V |  A   | 2020-12-23 00:00:00 | [{"abs": 123}]                                 | a,d  |
|    0 | 1.1111 | 2.20 | 5rWL6K+V |  A   | 2020-12-23 00:00:00 | [{"abs": 123}]                                 | a,d  |
+------+--------+------+----------+------+---------------------+------------------------------------------------+------+
call base_pl((select (select date('2011-11-12'))));
select * from base_test1;
+------+--------+------+----------+------+---------------------+------------------------------------------------+------+
| c1   | c2     | c3   | c4       | c5   | c6                  | c7                                             | c8   |
+------+--------+------+----------+------+---------------------+------------------------------------------------+------+
|    0 | 1.1111 | 2.20 | 5rWL6K+V |  A   | 2020-12-23 00:00:00 | [{"abs": 123}, "汉字123！@#$%^&*()_+", [0]]    | b,d  |
|    0 | 1.1111 | 2.20 | 5rWL6K+V |  A   | 2020-12-23 00:00:00 | [{"abs": 123}]                                 | a,d  |
|    0 | 1.1111 | 2.20 | 5rWL6K+V |  A   | 2020-12-23 00:00:00 | [{"abs": 123}]                                 | a,d  |
|    0 | 1.1111 | 2.20 | 5rWL6K+V |  A   | 2020-12-23 00:00:00 | [{"abs": 123}]                                 | a,d  |
|    0 | 1.1111 | 2.20 | 5rWL6K+V |  A   | 2020-12-23 00:00:00 | [{"abs": 123}]                                 | a,d  |
|    0 | 1.1111 | 2.20 | 5rWL6K+V |  A   | 2020-12-23 00:00:00 | [{"abs": 123}]                                 | a,d  |
|    0 | 1.1111 | 2.20 | 5rWL6K+V |  A   | 2020-12-23 00:00:00 | [{"abs": 123}]                                 | a,d  |
|    0 | 1.1111 | 2.20 | asd      |  A   | 2021-01-01 00:00:00 | [{"abs": 123}, "汉字123！@#$%^&*()_+", [0]]    | b,d  |
|    0 | 1.1111 | 2.20 | asd      |  A   | 2021-01-01 00:00:00 | [{"abs": 123}, "汉字123！@#$%^&*()_+", [0]]    | b,d  |
|    0 | 1.1111 | 2.20 | asd      |  A   | 2021-01-01 00:00:00 | [{"abs": 123}, "汉字123！@#$%^&*()_+", [0]]    | b,d  |
|    0 | 1.1111 | 2.20 | asd      |  A   | 2021-01-01 00:00:00 | [{"abs": 123}, "汉字123！@#$%^&*()_+", [0]]    | b,d  |
|    0 | 1.1111 | 2.20 | asd      |  A   | 2021-01-01 00:00:00 | [{"abs": 123}, "汉字123！@#$%^&*()_+", [0]]    | b,d  |
|    0 | 1.1111 | 2.20 | asd      |  A   | 2021-01-01 00:00:00 | [{"abs": 123}, "汉字123！@#$%^&*()_+", [0]]    | b,d  |
+------+--------+------+----------+------+---------------------+------------------------------------------------+------+
DROP PROCEDURE base_pl;
base64-4-2 函数 
DROP TABLE base_test1;
CREATE TABLE base_test1(  
  c1 int,  
  c2 float, 
  c3 DECIMAL(5,2) DEFAULT 8.8, 
  c4 VARCHAR(100), 
  c5 bit(10),
  c6 datetime, 
  c7 json NOT NULL,
  c8 SET('a', 'b', 'c', 'd'));
CREATE INDEX INDEX_base_test1_T1 ON base_test1(c4);
ALTER TABLE `base_test1` ADD INDEX INDEX_base_test1_T3 (c6, c1);
CREATE INDEX INDEX_base_test1_T5 USING HASH ON base_test1(c8);
insert into base_test1 values(from_base64(to_base64(0)),from_base64('MS4xMTEx'),2.2,from_base64(to_base64('asd汉字！@#￥%……!@@^&*&*()+{}:>?|')),from_base64(to_base64(b'1000001')),
from_base64(to_base64('2020-12-31 23:59:59.999999')),'[{"abs":123},"汉字123！@#$%^&*()_+",[0]]',from_base64(to_base64('b,d')));
DROP FUNCTION base_pl;
CREATE FUNCTION base_pl (a SMALLINT,b VARCHAR(20)) RETURNS INT DETERMINISTIC
BEGIN
	loop1: LOOP
		if a < 5 then
		   insert into base_test1 values(from_base64(to_base64(a)),
		   from_base64('MS4xMTEx'),
		   2.2,
		   from_base64(to_base64(b)),
		   from_base64(to_base64(b'1000001')),
		   from_base64(to_base64('2020-10-10 23:59:59.999999')),
		   '[{"abs":123}]',
		   from_base64(to_base64('a,d')));

		elseif 8 = a then
			   update base_test1 set c4 = to_base64(b),
						c6 = from_base64('MjAyMC0xMi0yMiAyMzo1OTo1OS45OTk5OTk=') where c1 < 3;
			LEAVE loop1;
		else
			   replace into base_test1 values(from_base64(to_base64(a)),
			   from_base64('MS4xMTEx'),
			   2.2,
			   from_base64(to_base64(b)),
			   from_base64(to_base64(b'1000001')),
			   from_base64(to_base64('2020-12-31 23:59:59.999999')),
			   '[{"abs":123},"汉字123！@#$%^&*()_+",[0]]',
			   from_base64(to_base64('b,d')));
				
		end if;
                set a = a + 1;

    end LOOP loop1;
	RETURN from_base64(to_base64(a));
END;
//
select * from base_test1;
+------+--------+------+-------------------------------------------+------+---------------------+------------------------------------------------+------+
| c1   | c2     | c3   | c4                                        | c5   | c6                  | c7                                             | c8   |
+------+--------+------+-------------------------------------------+------+---------------------+------------------------------------------------+------+
|    0 | 1.1111 | 2.20 | asd汉字！@#￥%……!@@^&*&*()+{}:>?|         |  A   | 2021-01-01 00:00:00 | [{"abs": 123}, "汉字123！@#$%^&*()_+", [0]]    | b,d  |
+------+--------+------+-------------------------------------------+------+---------------------+------------------------------------------------+------+
select base_pl(1,'hhhhhh');
+---------------------+
| base_pl(1,'hhhhhh') |
+---------------------+
|                   8 |
+---------------------+
select * from base_test1;
+------+--------+------+----------+------+---------------------+------------------------------------------------+------+
| c1   | c2     | c3   | c4       | c5   | c6                  | c7                                             | c8   |
+------+--------+------+----------+------+---------------------+------------------------------------------------+------+
|    0 | 1.1111 | 2.20 | aGhoaGho |  A   | 2020-12-23 00:00:00 | [{"abs": 123}, "汉字123！@#$%^&*()_+", [0]]    | b,d  |
|    1 | 1.1111 | 2.20 | aGhoaGho |  A   | 2020-12-23 00:00:00 | [{"abs": 123}]                                 | a,d  |
|    2 | 1.1111 | 2.20 | aGhoaGho |  A   | 2020-12-23 00:00:00 | [{"abs": 123}]                                 | a,d  |
|    3 | 1.1111 | 2.20 | hhhhhh   |  A   | 2020-10-11 00:00:00 | [{"abs": 123}]                                 | a,d  |
|    4 | 1.1111 | 2.20 | hhhhhh   |  A   | 2020-10-11 00:00:00 | [{"abs": 123}]                                 | a,d  |
|    5 | 1.1111 | 2.20 | hhhhhh   |  A   | 2021-01-01 00:00:00 | [{"abs": 123}, "汉字123！@#$%^&*()_+", [0]]    | b,d  |
|    6 | 1.1111 | 2.20 | hhhhhh   |  A   | 2021-01-01 00:00:00 | [{"abs": 123}, "汉字123！@#$%^&*()_+", [0]]    | b,d  |
|    7 | 1.1111 | 2.20 | hhhhhh   |  A   | 2021-01-01 00:00:00 | [{"abs": 123}, "汉字123！@#$%^&*()_+", [0]]    | b,d  |
+------+--------+------+----------+------+---------------------+------------------------------------------------+------+
DROP FUNCTION base_pl;
base64-4-3 触发器 
DROP TABLE base_test1;
CREATE TABLE base_test1(  
  c1 int,  
  c2 float, 
  c3 DECIMAL(5,2) DEFAULT 8.8, 
  c4 VARCHAR(100), 
  c5 bit(10),
  c6 datetime, 
  c7 json NOT NULL,
  c8 SET('a', 'b', 'c', 'd'));
CREATE INDEX INDEX_base_test1_T1 ON base_test1(c4);
ALTER TABLE `base_test1` ADD INDEX INDEX_base_test1_T3 (c6, c1);
CREATE INDEX INDEX_base_test1_T5 USING HASH ON base_test1(c8);
DROP TABLE base_test2;
CREATE TABLE base_test2(  
  c1 int,  
  c2 float, 
  c3 DECIMAL(5,2) DEFAULT 8.8, 
  c4 VARCHAR(100), 
  c5 bit(10),
  c6 datetime, 
  c7 json NOT NULL,
  c8 SET('a', 'b', 'c', 'd'));
DROP TRIGGER base_pl;
CREATE TRIGGER base_pl BEFORE INSERT
ON base_test2 FOR EACH ROW
BEGIN
DECLARE a int;
DECLARE b VARCHAR(20);
set a=1;
set b='insert';
loop1: LOOP
		if a < 4 then
		   insert into base_test1 values(from_base64(to_base64(a)),
		   from_base64('MS4xMTEx'),
		   2.2,
		   from_base64(to_base64(b)),
		   from_base64(to_base64(b'1000001')),
		   from_base64(to_base64('2020-10-10 23:59:59.999999')),
		   '[{"abs":123}]',
		   from_base64(to_base64('a,d')));

		elseif 6 = a then
			   update base_test1 set c4 = to_base64(b),
						c6 = from_base64('MjAyMC0xMi0yMiAyMzo1OTo1OS45OTk5OTk=') where c1 < 3;
			LEAVE loop1;
		else
			   replace into base_test1 values(from_base64(to_base64(a)),
			   from_base64('MS4xMTEx'),
			   2.2,
			   from_base64(to_base64('replace')),
			   from_base64(to_base64(b'1000001')),
			   from_base64(to_base64('2020-12-31 23:59:59.999999')),
			   '[{"abs":123},"汉字123！@#$%^&*()_+",[0]]',
			   from_base64(to_base64('b,d')));
				
		end if;
                set a = a + 1;

    end LOOP loop1;
END;
//
insert into base_test2 values(from_base64(to_base64(0)),from_base64('MS4xMTEx'),2.2,from_base64(to_base64('asd汉字！@#￥%……!@@^&*&*()+{}:>?|')),from_base64(to_base64(b'1000001')),
from_base64(to_base64('2020-12-31 23:59:59.999999')),'[{"abs":123},"汉字123！@#$%^&*()_+",[0]]',from_base64(to_base64('b,d')));
select * from base_test2;
+------+--------+------+-------------------------------------------+------+---------------------+------------------------------------------------+------+
| c1   | c2     | c3   | c4                                        | c5   | c6                  | c7                                             | c8   |
+------+--------+------+-------------------------------------------+------+---------------------+------------------------------------------------+------+
|    0 | 1.1111 | 2.20 | asd汉字！@#￥%……!@@^&*&*()+{}:>?|         |  A   | 2021-01-01 00:00:00 | [{"abs": 123}, "汉字123！@#$%^&*()_+", [0]]    | b,d  |
+------+--------+------+-------------------------------------------+------+---------------------+------------------------------------------------+------+
select * from base_test1;
+------+--------+------+----------+------+---------------------+------------------------------------------------+------+
| c1   | c2     | c3   | c4       | c5   | c6                  | c7                                             | c8   |
+------+--------+------+----------+------+---------------------+------------------------------------------------+------+
|    1 | 1.1111 | 2.20 | aW5zZXJ0 |  A   | 2020-12-23 00:00:00 | [{"abs": 123}]                                 | a,d  |
|    2 | 1.1111 | 2.20 | aW5zZXJ0 |  A   | 2020-12-23 00:00:00 | [{"abs": 123}]                                 | a,d  |
|    3 | 1.1111 | 2.20 | insert   |  A   | 2020-10-11 00:00:00 | [{"abs": 123}]                                 | a,d  |
|    4 | 1.1111 | 2.20 | replace  |  A   | 2021-01-01 00:00:00 | [{"abs": 123}, "汉字123！@#$%^&*()_+", [0]]    | b,d  |
|    5 | 1.1111 | 2.20 | replace  |  A   | 2021-01-01 00:00:00 | [{"abs": 123}, "汉字123！@#$%^&*()_+", [0]]    | b,d  |
+------+--------+------+----------+------+---------------------+------------------------------------------------+------+
DROP TRIGGER base_pl;
DROP TABLE base_test2;
DROP TABLE base_test1;
purge recyclebin;
