purge recyclebin;
result_format: 4
base64-3-1 dml + 普通表
DROP TABLE base_test1;
CREATE TABLE base_test1(  
  c1 int,  
  c2 float, 
  c3 DECIMAL(5,2), 
  c4 VARCHAR(100), 
  c5 bit(10),
  c6 datetime, 
  c7 json,
  c8 SET('a', 'b', 'c', 'd'));
DROP TABLE base_test2;
CREATE TABLE base_test2(  
  c1 int,  
  c2 float, 
  c3 DECIMAL(5,2), 
  c4 VARCHAR(100), 
  c5 bit(10),
  c6 datetime, 
  c7 json,
  c8 SET('a', 'b', 'c', 'd'));
insert into base_test2 values(0,1.1111,2.2,'asd汉字！@#￥%……!@@^&*&*()+{}:>?|',b'1000001','2020-12-31 23:59:59.999999'
,'[{"abs":123},"汉字123！@#$%^&*()_+",[0]]','b,d');
insert into base_test2 values(1,1.1111,2.2,'asd汉字！@#￥%……!@@^&*&*()+{}:>?|',b'1000001','2020-12-31 23:59:59.999999'
,'[{"abs":123},"汉字123！@#$%^&*()_+",[0]]','b,d');
insert into base_test2 values(2,1.1111,2.2,'asd汉字！@#￥%……!@@^&*&*()+{}:>?|',b'1000001','2020-12-31 23:59:59.999999'
,'[{"abs":123},"汉字123！@#$%^&*()_+",[0]]','b,d');
insert into base_test2 values(3,1.1111,2.2,'asd汉字！@#￥%……!@@^&*&*()+{}:>?|',b'1000001','2020-12-31 23:59:59.999999'
,'[{"abs":123},"汉字123！@#$%^&*()_+",[0]]','b,d');
insert into base_test2 values(4,1.1111,2.2,'asd汉字！@#￥%……!@@^&*&*()+{}:>?|',b'1000001','2020-12-31 23:59:59.999999'
,'[{"abs":123},"汉字123！@#$%^&*()_+",[0]]','b,d');
insert into base_test2 values(5,1.1111,2.2,'asd汉字！@#￥%……!@@^&*&*()+{}:>?|',b'1000001','2020-12-31 23:59:59.999999'
,'[{"abs":123},"汉字123！@#$%^&*()_+",[0]]','b,d');
insert into base_test1 select from_base64(to_base64(c1)),from_base64('MS4xMTEx'),c3,to_base64(c4),
from_base64(to_base64(c5)),from_base64(to_base64(c6)),c7,from_base64(to_base64(c8)) from base_test2;
select t1.* from base_test1 t1 ,base_test2 t2 where t1.c1=t2.c1 and t1.c2=t2.c2 and t1.c5=t2.c5 and t1.c6=t2.c6 and t1.c8=t2.c8;
+------+--------+------+----------------------------------------------------------+------+---------------------+------------------------------------------------+------+
| c1   | c2     | c3   | c4                                                       | c5   | c6                  | c7                                             | c8   |
+------+--------+------+----------------------------------------------------------+------+---------------------+------------------------------------------------+------+
|    0 | 1.1111 | 2.20 | YXNk5rGJ5a2X77yBQCPvv6Ul4oCm4oCmIUBAXiYqJiooKSt7fTo+P3w= |  A   | 2021-01-01 00:00:00 | [{"abs": 123}, "汉字123！@#$%^&*()_+", [0]]    | b,d  |
|    1 | 1.1111 | 2.20 | YXNk5rGJ5a2X77yBQCPvv6Ul4oCm4oCmIUBAXiYqJiooKSt7fTo+P3w= |  A   | 2021-01-01 00:00:00 | [{"abs": 123}, "汉字123！@#$%^&*()_+", [0]]    | b,d  |
|    2 | 1.1111 | 2.20 | YXNk5rGJ5a2X77yBQCPvv6Ul4oCm4oCmIUBAXiYqJiooKSt7fTo+P3w= |  A   | 2021-01-01 00:00:00 | [{"abs": 123}, "汉字123！@#$%^&*()_+", [0]]    | b,d  |
|    3 | 1.1111 | 2.20 | YXNk5rGJ5a2X77yBQCPvv6Ul4oCm4oCmIUBAXiYqJiooKSt7fTo+P3w= |  A   | 2021-01-01 00:00:00 | [{"abs": 123}, "汉字123！@#$%^&*()_+", [0]]    | b,d  |
|    4 | 1.1111 | 2.20 | YXNk5rGJ5a2X77yBQCPvv6Ul4oCm4oCmIUBAXiYqJiooKSt7fTo+P3w= |  A   | 2021-01-01 00:00:00 | [{"abs": 123}, "汉字123！@#$%^&*()_+", [0]]    | b,d  |
|    5 | 1.1111 | 2.20 | YXNk5rGJ5a2X77yBQCPvv6Ul4oCm4oCmIUBAXiYqJiooKSt7fTo+P3w= |  A   | 2021-01-01 00:00:00 | [{"abs": 123}, "汉字123！@#$%^&*()_+", [0]]    | b,d  |
+------+--------+------+----------------------------------------------------------+------+---------------------+------------------------------------------------+------+
update base_test1 set c2=from_base64(to_base64(123)) where c1 = 1;
select * from base_test1 where c1 = 1;
+------+------+------+----------------------------------------------------------+------+---------------------+------------------------------------------------+------+
| c1   | c2   | c3   | c4                                                       | c5   | c6                  | c7                                             | c8   |
+------+------+------+----------------------------------------------------------+------+---------------------+------------------------------------------------+------+
|    1 |  123 | 2.20 | YXNk5rGJ5a2X77yBQCPvv6Ul4oCm4oCmIUBAXiYqJiooKSt7fTo+P3w= |  A   | 2021-01-01 00:00:00 | [{"abs": 123}, "汉字123！@#$%^&*()_+", [0]]    | b,d  |
+------+------+------+----------------------------------------------------------+------+---------------------+------------------------------------------------+------+
replace into base_test1 values(from_base64(to_base64(0)),from_base64('MS4xMTEx'),2.2,from_base64(to_base64('asd汉字！@#￥%……!@@^&*&*()+{}:>?|')),from_base64(to_base64(b'1000001')),
from_base64(to_base64('2020-12-31 23:59:59.999999')),'[{"abs":123},"汉字123！@#$%^&*()_+",[0]]',from_base64(to_base64('b,d')));
select * from base_test1 where c1 = 0;
+------+--------+------+----------------------------------------------------------+------+---------------------+------------------------------------------------+------+
| c1   | c2     | c3   | c4                                                       | c5   | c6                  | c7                                             | c8   |
+------+--------+------+----------------------------------------------------------+------+---------------------+------------------------------------------------+------+
|    0 | 1.1111 | 2.20 | YXNk5rGJ5a2X77yBQCPvv6Ul4oCm4oCmIUBAXiYqJiooKSt7fTo+P3w= |  A   | 2021-01-01 00:00:00 | [{"abs": 123}, "汉字123！@#$%^&*()_+", [0]]    | b,d  |
|    0 | 1.1111 | 2.20 | asd汉字！@#￥%……!@@^&*&*()+{}:>?|                        |  A   | 2021-01-01 00:00:00 | [{"abs": 123}, "汉字123！@#$%^&*()_+", [0]]    | b,d  |
+------+--------+------+----------------------------------------------------------+------+---------------------+------------------------------------------------+------+
replace into base_test1 values(from_base64(to_base64(0)),from_base64('MS4xMTEx'),2.2,from_base64(to_base64('asd汉字！@#￥%……!@@^&*&*()+{}:>?|')),from_base64(to_base64(b'1000001')),
from_base64(to_base64('2020-12-31 23:59:59.999999')),'[{"abs":123},"汉字123！@#$%^&*()_+",[0]]',from_base64(to_base64('b,d')));
select * from base_test1 where c1 = 0;
+------+--------+------+----------------------------------------------------------+------+---------------------+------------------------------------------------+------+
| c1   | c2     | c3   | c4                                                       | c5   | c6                  | c7                                             | c8   |
+------+--------+------+----------------------------------------------------------+------+---------------------+------------------------------------------------+------+
|    0 | 1.1111 | 2.20 | YXNk5rGJ5a2X77yBQCPvv6Ul4oCm4oCmIUBAXiYqJiooKSt7fTo+P3w= |  A   | 2021-01-01 00:00:00 | [{"abs": 123}, "汉字123！@#$%^&*()_+", [0]]    | b,d  |
|    0 | 1.1111 | 2.20 | asd汉字！@#￥%……!@@^&*&*()+{}:>?|                        |  A   | 2021-01-01 00:00:00 | [{"abs": 123}, "汉字123！@#$%^&*()_+", [0]]    | b,d  |
|    0 | 1.1111 | 2.20 | asd汉字！@#￥%……!@@^&*&*()+{}:>?|                        |  A   | 2021-01-01 00:00:00 | [{"abs": 123}, "汉字123！@#$%^&*()_+", [0]]    | b,d  |
+------+--------+------+----------------------------------------------------------+------+---------------------+------------------------------------------------+------+
replace into base_test1
set c1 = from_base64(to_base64(888)),
	c4 = to_base64('测试'),
    c6 = from_base64('MjAyMC0xMi0yMiAyMzo1OTo1OS45OTk5OTk=');
select * from base_test1 where c1 = 888;
+------+------+------+----------+------+---------------------+------+------+
| c1   | c2   | c3   | c4       | c5   | c6                  | c7   | c8   |
+------+------+------+----------+------+---------------------+------+------+
|  888 | NULL | NULL | 5rWL6K+V | NULL | 2020-12-23 00:00:00 | NULL | NULL |
+------+------+------+----------+------+---------------------+------+------+
update base_test1 set c1 = from_base64(to_base64(888)),
	c4 = to_base64('测试'),
    c6 = from_base64('MjAyMC0xMi0yMiAyMzo1OTo1OS45OTk5OTk=');
select * from base_test1;
+------+--------+------+----------+------+---------------------+------------------------------------------------+------+
| c1   | c2     | c3   | c4       | c5   | c6                  | c7                                             | c8   |
+------+--------+------+----------+------+---------------------+------------------------------------------------+------+
|  888 | 1.1111 | 2.20 | 5rWL6K+V |  A   | 2020-12-23 00:00:00 | [{"abs": 123}, "汉字123！@#$%^&*()_+", [0]]    | b,d  |
|  888 |    123 | 2.20 | 5rWL6K+V |  A   | 2020-12-23 00:00:00 | [{"abs": 123}, "汉字123！@#$%^&*()_+", [0]]    | b,d  |
|  888 | 1.1111 | 2.20 | 5rWL6K+V |  A   | 2020-12-23 00:00:00 | [{"abs": 123}, "汉字123！@#$%^&*()_+", [0]]    | b,d  |
|  888 | 1.1111 | 2.20 | 5rWL6K+V |  A   | 2020-12-23 00:00:00 | [{"abs": 123}, "汉字123！@#$%^&*()_+", [0]]    | b,d  |
|  888 | 1.1111 | 2.20 | 5rWL6K+V |  A   | 2020-12-23 00:00:00 | [{"abs": 123}, "汉字123！@#$%^&*()_+", [0]]    | b,d  |
|  888 | 1.1111 | 2.20 | 5rWL6K+V |  A   | 2020-12-23 00:00:00 | [{"abs": 123}, "汉字123！@#$%^&*()_+", [0]]    | b,d  |
|  888 | 1.1111 | 2.20 | 5rWL6K+V |  A   | 2020-12-23 00:00:00 | [{"abs": 123}, "汉字123！@#$%^&*()_+", [0]]    | b,d  |
|  888 | 1.1111 | 2.20 | 5rWL6K+V |  A   | 2020-12-23 00:00:00 | [{"abs": 123}, "汉字123！@#$%^&*()_+", [0]]    | b,d  |
|  888 |   NULL | NULL | 5rWL6K+V | NULL | 2020-12-23 00:00:00 | NULL                                           | NULL |
+------+--------+------+----------+------+---------------------+------------------------------------------------+------+
delete from base_test1 where c1< from_base64(to_base64(1000));
select * from base_test1;
+------+------+------+------+------+------+------+------+
| c1   | c2   | c3   | c4   | c5   | c6   | c7   | c8   |
+------+------+------+------+------+------+------+------+
+------+------+------+------+------+------+------+------+
base64-3-2 dml + 普通表 + 约束 + 索引
DROP TABLE base_test1;
DROP TABLE base_test2;
CREATE TABLE base_test2(  
  c1 int primary key,  
  c2 float unique, 
  c3 DECIMAL(5,2) DEFAULT null, 
  c4 VARCHAR(100), 
  c5 bit(10),
  c6 datetime, 
  c7 json NOT NULL,
  c8 SET('a', 'b', 'c', 'd'));
CREATE TABLE base_test1(  
  c1 int primary key,  
  c2 float unique, 
  c3 DECIMAL(5,2) DEFAULT 8.8, 
  c4 VARCHAR(100), 
  c5 bit(10),
  c6 datetime, 
  c7 json NOT NULL,
  c8 SET('a', 'b', 'c', 'd'));
CREATE INDEX INDEX_base_test1_T1 ON base_test1(c4);
CREATE UNIQUE INDEX INDEX_base_test1_T2 ON base_test1(c3);
ALTER TABLE `base_test1` ADD INDEX INDEX_base_test1_T3 (c6, c1);
CREATE INDEX INDEX_base_test1_T5 USING HASH ON base_test1(c8);
insert into base_test2 values(0,1.1111,2.2,'asd汉字！@#￥%……!@@^&*&*()+{}:>?|',b'1000001','2020-12-31 23:59:59.999999'
,'[{"abs":123},"汉字123！@#$%^&*()_+",[0]]','b,d');
insert into base_test2 values(1,2.1111,3.2,'asd汉字！@#￥%……!@@^&*&*()+{}:>?|',b'01','2020-12-12 23:59:59.999999'
,'[{"abs":123},"汉字123！@#$%^&*()_+",[0]]','b,d');
insert into base_test2 values(2,3.1111,4.2,'汉字！@#￥%……!@@^&*&*()+{}:>?|',b'1000001','2020-12-13 23:59:59.999999'
,'[{"abs":123},"汉字123！@#$%^&*()_+",[0]]','b,d');
insert into base_test2 values(3,4.1111,5.2,'asd汉！@#￥%……!@@^&*&*()+{}:>?|',b'1000001','2020-12-14 23:59:59.999999'
,'[{"abs":123},"汉字123！@#$%^&*()_+",[0]]','b,d');
insert into base_test2 values(4,5.1111,6.2,'asd！@#￥%……!@@^&*&*()+{}:>?|',b'10','2020-12-31 23:59:59.999999'
,'[{"abs":123},"汉字123！@#$%^&*()_+",[0]]','b,d');
insert into base_test2 values(5,6.1111,7.2,'asd汉字！@#',b'1000001','2020-12-31 23:59:59.999999'
,'[{"abs":123},"汉字123！@#$%^&*()_+",[0]]','b,d,a');
insert into base_test1 select from_base64(to_base64(c1)),from_base64(c2),from_base64(to_base64(c3)),to_base64(c4),
from_base64(to_base64(c5)),from_base64(to_base64(c6)),c7,from_base64(to_base64(c8)) from base_test2;
select t1.* from base_test1 t1 ,base_test2 t2 where t1.c1=t2.c1 and t1.c5=t2.c5 and t1.c6=t2.c6 and t1.c8=t2.c8;
+----+------+------+----------------------------------------------------------+------+---------------------+------------------------------------------------+-------+
| c1 | c2   | c3   | c4                                                       | c5   | c6                  | c7                                             | c8    |
+----+------+------+----------------------------------------------------------+------+---------------------+------------------------------------------------+-------+
|  0 | NULL | 2.20 | YXNk5rGJ5a2X77yBQCPvv6Ul4oCm4oCmIUBAXiYqJiooKSt7fTo+P3w= |  A   | 2021-01-01 00:00:00 | [{"abs": 123}, "汉字123！@#$%^&*()_+", [0]]    | b,d   |
|  1 | NULL | 3.20 | YXNk5rGJ5a2X77yBQCPvv6Ul4oCm4oCmIUBAXiYqJiooKSt7fTo+P3w= |     | 2020-12-13 00:00:00 | [{"abs": 123}, "汉字123！@#$%^&*()_+", [0]]    | b,d   |
|  2 | NULL | 4.20 | 5rGJ5a2X77yBQCPvv6Ul4oCm4oCmIUBAXiYqJiooKSt7fTo+P3w=     |  A   | 2020-12-14 00:00:00 | [{"abs": 123}, "汉字123！@#$%^&*()_+", [0]]    | b,d   |
|  3 | NULL | 5.20 | YXNk5rGJ77yBQCPvv6Ul4oCm4oCmIUBAXiYqJiooKSt7fTo+P3w=     |  A   | 2020-12-15 00:00:00 | [{"abs": 123}, "汉字123！@#$%^&*()_+", [0]]    | b,d   |
|  4 | NULL | 6.20 | YXNk77yBQCPvv6Ul4oCm4oCmIUBAXiYqJiooKSt7fTo+P3w=         |     | 2021-01-01 00:00:00 | [{"abs": 123}, "汉字123！@#$%^&*()_+", [0]]    | b,d   |
|  5 | NULL | 7.20 | YXNk5rGJ5a2X77yBQCM=                                     |  A   | 2021-01-01 00:00:00 | [{"abs": 123}, "汉字123！@#$%^&*()_+", [0]]    | a,b,d |
+----+------+------+----------------------------------------------------------+------+---------------------+------------------------------------------------+-------+
update base_test1 set c2=from_base64(to_base64(123)) where c1 = 1;
select * from base_test1 where c1 = 1;
+----+------+------+----------------------------------------------------------+------+---------------------+------------------------------------------------+------+
| c1 | c2   | c3   | c4                                                       | c5   | c6                  | c7                                             | c8   |
+----+------+------+----------------------------------------------------------+------+---------------------+------------------------------------------------+------+
|  1 |  123 | 3.20 | YXNk5rGJ5a2X77yBQCPvv6Ul4oCm4oCmIUBAXiYqJiooKSt7fTo+P3w= |     | 2020-12-13 00:00:00 | [{"abs": 123}, "汉字123！@#$%^&*()_+", [0]]    | b,d  |
+----+------+------+----------------------------------------------------------+------+---------------------+------------------------------------------------+------+
update base_test1 set c2=from_base64(to_base64(1.1111)) where c1 = 1;
update base_test1 set c1=from_base64(to_base64(666)) where c1 = 1;
replace into base_test1 values(from_base64(to_base64(0)),from_base64('MS4xMTEx'),2.2,from_base64(to_base64('asd汉字！@#￥%……!@@^&*&*()+{}:>?|')),from_base64(to_base64(b'1000001')),
from_base64(to_base64('2020-12-31 23:59:59.999999')),'[{"abs":123},"汉字123！@#$%^&*()_+",[0]]',from_base64(to_base64('b,d')));
select * from base_test1 where c1 = 0;
+----+--------+------+-------------------------------------------+------+---------------------+------------------------------------------------+------+
| c1 | c2     | c3   | c4                                        | c5   | c6                  | c7                                             | c8   |
+----+--------+------+-------------------------------------------+------+---------------------+------------------------------------------------+------+
|  0 | 1.1111 | 2.20 | asd汉字！@#￥%……!@@^&*&*()+{}:>?|         |  A   | 2021-01-01 00:00:00 | [{"abs": 123}, "汉字123！@#$%^&*()_+", [0]]    | b,d  |
+----+--------+------+-------------------------------------------+------+---------------------+------------------------------------------------+------+
replace into base_test1 values(from_base64(to_base64(0)),from_base64('MS4xMTEx'),2.2,from_base64(to_base64('asd汉字！@#￥%……!@@^&*&*()+{}:>?|')),from_base64(to_base64(b'1000001')),
from_base64(to_base64('2020-12-31 23:59:59.999999')),'[{"abs":123},"汉字123！@#$%^&*()_+",[0]]',from_base64(to_base64('b,d')));
select * from base_test1 where c1 = 0;
+----+--------+------+-------------------------------------------+------+---------------------+------------------------------------------------+------+
| c1 | c2     | c3   | c4                                        | c5   | c6                  | c7                                             | c8   |
+----+--------+------+-------------------------------------------+------+---------------------+------------------------------------------------+------+
|  0 | 1.1111 | 2.20 | asd汉字！@#￥%……!@@^&*&*()+{}:>?|         |  A   | 2021-01-01 00:00:00 | [{"abs": 123}, "汉字123！@#$%^&*()_+", [0]]    | b,d  |
+----+--------+------+-------------------------------------------+------+---------------------+------------------------------------------------+------+
update base_test1 set c4 = to_base64('测试'),
    c6 = from_base64('MjAyMC0xMi0yMiAyMzo1OTo1OS45OTk5OTk=');
select * from base_test1;
+----+--------+------+----------+------+---------------------+------------------------------------------------+-------+
| c1 | c2     | c3   | c4       | c5   | c6                  | c7                                             | c8    |
+----+--------+------+----------+------+---------------------+------------------------------------------------+-------+
|  0 | 1.1111 | 2.20 | 5rWL6K+V |  A   | 2020-12-23 00:00:00 | [{"abs": 123}, "汉字123！@#$%^&*()_+", [0]]    | b,d   |
|  2 |   NULL | 4.20 | 5rWL6K+V |  A   | 2020-12-23 00:00:00 | [{"abs": 123}, "汉字123！@#$%^&*()_+", [0]]    | b,d   |
|  3 |   NULL | 5.20 | 5rWL6K+V |  A   | 2020-12-23 00:00:00 | [{"abs": 123}, "汉字123！@#$%^&*()_+", [0]]    | b,d   |
|  4 |   NULL | 6.20 | 5rWL6K+V |     | 2020-12-23 00:00:00 | [{"abs": 123}, "汉字123！@#$%^&*()_+", [0]]    | b,d   |
|  5 |   NULL | 7.20 | 5rWL6K+V |  A   | 2020-12-23 00:00:00 | [{"abs": 123}, "汉字123！@#$%^&*()_+", [0]]    | a,b,d |
+----+--------+------+----------+------+---------------------+------------------------------------------------+-------+
bug 
delete from base_test1 where c1 < (from_base64(to_base64(b'10'))+10);
Warnings:
Warning	1292	Truncated incorrect DOUBLE value: ''
Warning	1292	Truncated incorrect DOUBLE value: ''
Warning	1292	Truncated incorrect DOUBLE value: ''
Warning	1292	Truncated incorrect DOUBLE value: ''
Warning	1292	Truncated incorrect DOUBLE value: ''
Warning	1292	Truncated incorrect DOUBLE value: ''
Warning	1292	Truncated incorrect DOUBLE value: ''
Warning	1292	Truncated incorrect DOUBLE value: ''
Warning	1292	Truncated incorrect DOUBLE value: ''
Warning	1292	Truncated incorrect DOUBLE value: ''
Warning	1292	Truncated incorrect DOUBLE value: ''
Warning	1292	Truncated incorrect DOUBLE value: ''
Warning	1292	Truncated incorrect DOUBLE value: ''
Warning	1292	Truncated incorrect DOUBLE value: ''
Warning	1292	Truncated incorrect DOUBLE value: ''
Warning	1292	Truncated incorrect DOUBLE value: ''
Warning	1292	Truncated incorrect DOUBLE value: ''
select * from base_test1;
+----+------+------+------+------+------+----+------+
| c1 | c2   | c3   | c4   | c5   | c6   | c7 | c8   |
+----+------+------+------+------+------+----+------+
+----+------+------+------+------+------+----+------+
base64-3-3 dml + 视图 + 约束 + 索引
DROP TABLE base_test1;
DROP TABLE base_test2;
CREATE TABLE base_test2(  
  c1 int primary key,  
  c2 float unique, 
  c3 DECIMAL(5,2) DEFAULT null, 
  c4 VARCHAR(100), 
  c5 bit(10),
  c6 datetime, 
  c7 json NOT NULL,
  c8 SET('a', 'b', 'c', 'd'));
CREATE TABLE base_test1(  
  c1 int primary key,  
  c2 float unique, 
  c3 DECIMAL(5,2) DEFAULT 8.8, 
  c4 VARCHAR(100), 
  c5 bit(10),
  c6 datetime, 
  c7 json NOT NULL,
  c8 SET('a', 'b', 'c', 'd'));
CREATE INDEX INDEX_base_test1_T1 ON base_test1(c4);
CREATE UNIQUE INDEX INDEX_base_test1_T2 ON base_test1(c3);
ALTER TABLE `base_test1` ADD INDEX INDEX_base_test1_T3 (c6, c1);
CREATE INDEX INDEX_base_test1_T5 USING HASH ON base_test1(c8);
drop view view_test1;
CREATE VIEW view_test1 AS select * from base_test1;
insert into base_test2 values(0,1.1111,2.2,'asd汉字！@#￥%……!@@^&*&*()+{}:>?|',b'1000001','2020-12-31 23:59:59.999999'
,'[{"abs":123},"汉字123！@#$%^&*()_+",[0]]','b,d');
insert into base_test2 values(1,2.1111,3.2,'asd汉字！@#￥%……!@@^&*&*()+{}:>?|',b'01','2020-12-12 23:59:59.999999'
,'[{"abs":123},"汉字123！@#$%^&*()_+",[0]]','b,d');
insert into base_test2 values(2,3.1111,4.2,'汉字！@#￥%……!@@^&*&*()+{}:>?|',b'1000001','2020-12-13 23:59:59.999999'
,'[{"abs":123},"汉字123！@#$%^&*()_+",[0]]','b,d');
insert into base_test2 values(3,4.1111,5.2,'asd汉！@#￥%……!@@^&*&*()+{}:>?|',b'1000001','2020-12-14 23:59:59.999999'
,'[{"abs":123},"汉字123！@#$%^&*()_+",[0]]','b,d');
insert into base_test2 values(4,5.1111,6.2,'asd！@#￥%……!@@^&*&*()+{}:>?|',b'10','2020-12-31 23:59:59.999999'
,'[{"abs":123},"汉字123！@#$%^&*()_+",[0]]','b,d');
insert into base_test2 values(5,6.1111,7.2,'asd汉字！@#',b'1000001','2020-12-31 23:59:59.999999'
,'[{"abs":123},"汉字123！@#$%^&*()_+",[0]]','b,d,a');
insert into view_test1 select from_base64(to_base64(c1)),from_base64(c2),from_base64(to_base64(c3)),to_base64(c4),
from_base64(to_base64(c5)),from_base64(to_base64(c6)),c7,from_base64(to_base64(c8)) from base_test2;
select t1.* from view_test1 t1 ,base_test2 t2 where t1.c1=t2.c1 and t1.c5=t2.c5 and t1.c6=t2.c6 and t1.c8=t2.c8;
+----+------+------+----------------------------------------------------------+------+---------------------+------------------------------------------------+-------+
| c1 | c2   | c3   | c4                                                       | c5   | c6                  | c7                                             | c8    |
+----+------+------+----------------------------------------------------------+------+---------------------+------------------------------------------------+-------+
|  0 | NULL | 2.20 | YXNk5rGJ5a2X77yBQCPvv6Ul4oCm4oCmIUBAXiYqJiooKSt7fTo+P3w= |  A   | 2021-01-01 00:00:00 | [{"abs": 123}, "汉字123！@#$%^&*()_+", [0]]    | b,d   |
|  1 | NULL | 3.20 | YXNk5rGJ5a2X77yBQCPvv6Ul4oCm4oCmIUBAXiYqJiooKSt7fTo+P3w= |     | 2020-12-13 00:00:00 | [{"abs": 123}, "汉字123！@#$%^&*()_+", [0]]    | b,d   |
|  2 | NULL | 4.20 | 5rGJ5a2X77yBQCPvv6Ul4oCm4oCmIUBAXiYqJiooKSt7fTo+P3w=     |  A   | 2020-12-14 00:00:00 | [{"abs": 123}, "汉字123！@#$%^&*()_+", [0]]    | b,d   |
|  3 | NULL | 5.20 | YXNk5rGJ77yBQCPvv6Ul4oCm4oCmIUBAXiYqJiooKSt7fTo+P3w=     |  A   | 2020-12-15 00:00:00 | [{"abs": 123}, "汉字123！@#$%^&*()_+", [0]]    | b,d   |
|  4 | NULL | 6.20 | YXNk77yBQCPvv6Ul4oCm4oCmIUBAXiYqJiooKSt7fTo+P3w=         |     | 2021-01-01 00:00:00 | [{"abs": 123}, "汉字123！@#$%^&*()_+", [0]]    | b,d   |
|  5 | NULL | 7.20 | YXNk5rGJ5a2X77yBQCM=                                     |  A   | 2021-01-01 00:00:00 | [{"abs": 123}, "汉字123！@#$%^&*()_+", [0]]    | a,b,d |
+----+------+------+----------------------------------------------------------+------+---------------------+------------------------------------------------+-------+
update view_test1 set c2=from_base64(to_base64(123)) where c1 = 1;
select * from view_test1 where c1 = 1;
+----+------+------+----------------------------------------------------------+------+---------------------+------------------------------------------------+------+
| c1 | c2   | c3   | c4                                                       | c5   | c6                  | c7                                             | c8   |
+----+------+------+----------------------------------------------------------+------+---------------------+------------------------------------------------+------+
|  1 |  123 | 3.20 | YXNk5rGJ5a2X77yBQCPvv6Ul4oCm4oCmIUBAXiYqJiooKSt7fTo+P3w= |     | 2020-12-13 00:00:00 | [{"abs": 123}, "汉字123！@#$%^&*()_+", [0]]    | b,d  |
+----+------+------+----------------------------------------------------------+------+---------------------+------------------------------------------------+------+
update view_test1 set c2=from_base64(to_base64(1.1111)) where c1 = 1;
update view_test1 set c1=from_base64(to_base64(666)) where c1 = 1;
replace into view_test1 values(from_base64(to_base64(0)),from_base64('MS4xMTEx'),2.2,from_base64(to_base64('asd汉字！@#￥%……!@@^&*&*()+{}:>?|')),from_base64(to_base64(b'1000001')),
from_base64(to_base64('2020-12-31 23:59:59.999999')),'[{"abs":123},"汉字123！@#$%^&*()_+",[0]]',from_base64(to_base64('b,d')));
select * from view_test1 where c1 = 0;
+----+--------+------+-------------------------------------------+------+---------------------+------------------------------------------------+------+
| c1 | c2     | c3   | c4                                        | c5   | c6                  | c7                                             | c8   |
+----+--------+------+-------------------------------------------+------+---------------------+------------------------------------------------+------+
|  0 | 1.1111 | 2.20 | asd汉字！@#￥%……!@@^&*&*()+{}:>?|         |  A   | 2021-01-01 00:00:00 | [{"abs": 123}, "汉字123！@#$%^&*()_+", [0]]    | b,d  |
+----+--------+------+-------------------------------------------+------+---------------------+------------------------------------------------+------+
replace into view_test1 values(from_base64(to_base64(0)),from_base64('MS4xMTEx'),2.2,from_base64(to_base64('asd汉字！@#￥%……!@@^&*&*()+{}:>?|')),from_base64(to_base64(b'1000001')),
from_base64(to_base64('2020-12-31 23:59:59.999999')),'[{"abs":123},"汉字123！@#$%^&*()_+",[0]]',from_base64(to_base64('b,d')));
select * from view_test1 where c1 = 0;
+----+--------+------+-------------------------------------------+------+---------------------+------------------------------------------------+------+
| c1 | c2     | c3   | c4                                        | c5   | c6                  | c7                                             | c8   |
+----+--------+------+-------------------------------------------+------+---------------------+------------------------------------------------+------+
|  0 | 1.1111 | 2.20 | asd汉字！@#￥%……!@@^&*&*()+{}:>?|         |  A   | 2021-01-01 00:00:00 | [{"abs": 123}, "汉字123！@#$%^&*()_+", [0]]    | b,d  |
+----+--------+------+-------------------------------------------+------+---------------------+------------------------------------------------+------+
update view_test1 set c4 = to_base64('测试'),
    c6 = from_base64('MjAyMC0xMi0yMiAyMzo1OTo1OS45OTk5OTk=');
select * from view_test1;
+----+--------+------+----------+------+---------------------+------------------------------------------------+-------+
| c1 | c2     | c3   | c4       | c5   | c6                  | c7                                             | c8    |
+----+--------+------+----------+------+---------------------+------------------------------------------------+-------+
|  0 | 1.1111 | 2.20 | 5rWL6K+V |  A   | 2020-12-23 00:00:00 | [{"abs": 123}, "汉字123！@#$%^&*()_+", [0]]    | b,d   |
|  2 |   NULL | 4.20 | 5rWL6K+V |  A   | 2020-12-23 00:00:00 | [{"abs": 123}, "汉字123！@#$%^&*()_+", [0]]    | b,d   |
|  3 |   NULL | 5.20 | 5rWL6K+V |  A   | 2020-12-23 00:00:00 | [{"abs": 123}, "汉字123！@#$%^&*()_+", [0]]    | b,d   |
|  4 |   NULL | 6.20 | 5rWL6K+V |     | 2020-12-23 00:00:00 | [{"abs": 123}, "汉字123！@#$%^&*()_+", [0]]    | b,d   |
|  5 |   NULL | 7.20 | 5rWL6K+V |  A   | 2020-12-23 00:00:00 | [{"abs": 123}, "汉字123！@#$%^&*()_+", [0]]    | a,b,d |
+----+--------+------+----------+------+---------------------+------------------------------------------------+-------+
drop view view_test1;
base64-3-4 dml + range分区表+ 视图 + 约束 + 索引
DROP TABLE base_test2;
CREATE TABLE base_test2(  
  c1 int primary key,  
  c2 float unique, 
  c3 DECIMAL(5,2) DEFAULT null, 
  c4 VARCHAR(100), 
  c5 bit(10),
  c6 datetime, 
  c7 json NOT NULL,
  c8 SET('a', 'b', 'c', 'd'));
DROP TABLE base_test1;
CREATE TABLE base_test1(  
  c1 int primary key,  
  c2 float, 
  c3 DECIMAL(5,2) DEFAULT 8.8, 
  c4 VARCHAR(100), 
  c5 bit(10),
  c6 datetime, 
  c7 json NOT NULL,
  c8 SET('a', 'b', 'c', 'd'))
  PARTITION BY RANGE (c1)(
PARTITION less_2 VALUES less than (2),
PARTITION b_2_4 VALUES less than (4),
PARTITION b_4_2000 VALUES less than (2000),
PARTITION greater_2000 VALUES less than MAXVALUE);
CREATE INDEX INDEX_base_test1_T1 ON base_test1(c4);
ALTER TABLE `base_test1` ADD INDEX INDEX_base_test1_T3 (c6, c1);
CREATE INDEX INDEX_base_test1_T5 USING HASH ON base_test1(c8);
drop view view_test1;
CREATE VIEW view_test1 AS select * from base_test1;
insert into base_test2 values(0,1.1111,2.2,'asd汉字！@#￥%……!@@^&*&*()+{}:>?|',b'1000001','2020-12-31 23:59:59.999999'
,'[{"abs":123},"汉字123！@#$%^&*()_+",[0]]','b,d');
insert into base_test2 values(1,2.1111,3.2,'asd汉字！@#￥%……!@@^&*&*()+{}:>?|',b'01','2020-12-12 23:59:59.999999'
,'[{"abs":123},"汉字123！@#$%^&*()_+",[0]]','b,d');
insert into base_test2 values(2,3.1111,4.2,'汉字！@#￥%……!@@^&*&*()+{}:>?|',b'1000001','2020-12-13 23:59:59.999999'
,'[{"abs":123},"汉字123！@#$%^&*()_+",[0]]','b,d');
insert into base_test2 values(3,4.1111,5.2,'asd汉！@#￥%……!@@^&*&*()+{}:>?|',b'1000001','2020-12-14 23:59:59.999999'
,'[{"abs":123},"汉字123！@#$%^&*()_+",[0]]','b,d');
insert into base_test2 values(4,5.1111,6.2,'asd！@#￥%……!@@^&*&*()+{}:>?|',b'10','2020-12-31 23:59:59.999999'
,'[{"abs":123},"汉字123！@#$%^&*()_+",[0]]','b,d');
insert into base_test2 values(5,6.1111,7.2,'asd汉字！@#',b'1000001','2020-12-31 23:59:59.999999'
,'[{"abs":123},"汉字123！@#$%^&*()_+",[0]]','b,d,a');
insert into base_test1 select from_base64(to_base64(c1)),from_base64(c2),from_base64(to_base64(c3)),to_base64(c4),
from_base64(to_base64(c5)),from_base64(to_base64(c6)),c7,from_base64(to_base64(c8)) from base_test2;
select t1.* from view_test1 t1 ,base_test2 t2 where t1.c1=t2.c1 and t1.c5=t2.c5 and t1.c6=t2.c6 and t1.c8=t2.c8;
+----+------+------+----------------------------------------------------------+------+---------------------+------------------------------------------------+-------+
| c1 | c2   | c3   | c4                                                       | c5   | c6                  | c7                                             | c8    |
+----+------+------+----------------------------------------------------------+------+---------------------+------------------------------------------------+-------+
|  0 | NULL | 2.20 | YXNk5rGJ5a2X77yBQCPvv6Ul4oCm4oCmIUBAXiYqJiooKSt7fTo+P3w= |  A   | 2021-01-01 00:00:00 | [{"abs": 123}, "汉字123！@#$%^&*()_+", [0]]    | b,d   |
|  1 | NULL | 3.20 | YXNk5rGJ5a2X77yBQCPvv6Ul4oCm4oCmIUBAXiYqJiooKSt7fTo+P3w= |     | 2020-12-13 00:00:00 | [{"abs": 123}, "汉字123！@#$%^&*()_+", [0]]    | b,d   |
|  2 | NULL | 4.20 | 5rGJ5a2X77yBQCPvv6Ul4oCm4oCmIUBAXiYqJiooKSt7fTo+P3w=     |  A   | 2020-12-14 00:00:00 | [{"abs": 123}, "汉字123！@#$%^&*()_+", [0]]    | b,d   |
|  3 | NULL | 5.20 | YXNk5rGJ77yBQCPvv6Ul4oCm4oCmIUBAXiYqJiooKSt7fTo+P3w=     |  A   | 2020-12-15 00:00:00 | [{"abs": 123}, "汉字123！@#$%^&*()_+", [0]]    | b,d   |
|  4 | NULL | 6.20 | YXNk77yBQCPvv6Ul4oCm4oCmIUBAXiYqJiooKSt7fTo+P3w=         |     | 2021-01-01 00:00:00 | [{"abs": 123}, "汉字123！@#$%^&*()_+", [0]]    | b,d   |
|  5 | NULL | 7.20 | YXNk5rGJ5a2X77yBQCM=                                     |  A   | 2021-01-01 00:00:00 | [{"abs": 123}, "汉字123！@#$%^&*()_+", [0]]    | a,b,d |
+----+------+------+----------------------------------------------------------+------+---------------------+------------------------------------------------+-------+
update view_test1 set c2=from_base64(to_base64(123)) where c1 = 1;
select * from view_test1 where c1 = 1;
+----+------+------+----------------------------------------------------------+------+---------------------+------------------------------------------------+------+
| c1 | c2   | c3   | c4                                                       | c5   | c6                  | c7                                             | c8   |
+----+------+------+----------------------------------------------------------+------+---------------------+------------------------------------------------+------+
|  1 |  123 | 3.20 | YXNk5rGJ5a2X77yBQCPvv6Ul4oCm4oCmIUBAXiYqJiooKSt7fTo+P3w= |     | 2020-12-13 00:00:00 | [{"abs": 123}, "汉字123！@#$%^&*()_+", [0]]    | b,d  |
+----+------+------+----------------------------------------------------------+------+---------------------+------------------------------------------------+------+
update view_test1 set c2=from_base64(to_base64(1.1111)) where c1 = 1;
update view_test1 set c1=from_base64(to_base64(666)) where c1 = 1;
replace into view_test1 values(from_base64(to_base64(0)),from_base64('MS4xMTEx'),2.2,from_base64(to_base64('asd汉字！@#￥%……!@@^&*&*()+{}:>?|')),from_base64(to_base64(b'1000001')),
from_base64(to_base64('2020-12-31 23:59:59.999999')),'[{"abs":123},"汉字123！@#$%^&*()_+",[0]]',from_base64(to_base64('b,d')));
select * from view_test1 where c1 = 0;
+----+--------+------+-------------------------------------------+------+---------------------+------------------------------------------------+------+
| c1 | c2     | c3   | c4                                        | c5   | c6                  | c7                                             | c8   |
+----+--------+------+-------------------------------------------+------+---------------------+------------------------------------------------+------+
|  0 | 1.1111 | 2.20 | asd汉字！@#￥%……!@@^&*&*()+{}:>?|         |  A   | 2021-01-01 00:00:00 | [{"abs": 123}, "汉字123！@#$%^&*()_+", [0]]    | b,d  |
+----+--------+------+-------------------------------------------+------+---------------------+------------------------------------------------+------+
replace into view_test1 values(from_base64(to_base64(0)),from_base64('MS4xMTEx'),2.2,from_base64(to_base64('asd汉字！@#￥%……!@@^&*&*()+{}:>?|')),from_base64(to_base64(b'1000001')),
from_base64(to_base64('2020-12-31 23:59:59.999999')),'[{"abs":123},"汉字123！@#$%^&*()_+",[0]]',from_base64(to_base64('b,d')));
select * from view_test1 where c1 = 0;
+----+--------+------+-------------------------------------------+------+---------------------+------------------------------------------------+------+
| c1 | c2     | c3   | c4                                        | c5   | c6                  | c7                                             | c8   |
+----+--------+------+-------------------------------------------+------+---------------------+------------------------------------------------+------+
|  0 | 1.1111 | 2.20 | asd汉字！@#￥%……!@@^&*&*()+{}:>?|         |  A   | 2021-01-01 00:00:00 | [{"abs": 123}, "汉字123！@#$%^&*()_+", [0]]    | b,d  |
+----+--------+------+-------------------------------------------+------+---------------------+------------------------------------------------+------+
update view_test1 set c4 = to_base64('测试'),
    c6 = from_base64('MjAyMC0xMi0yMiAyMzo1OTo1OS45OTk5OTk=');
select * from view_test1;
+-----+--------+------+----------+------+---------------------+------------------------------------------------+-------+
| c1  | c2     | c3   | c4       | c5   | c6                  | c7                                             | c8    |
+-----+--------+------+----------+------+---------------------+------------------------------------------------+-------+
|   0 | 1.1111 | 2.20 | 5rWL6K+V |  A   | 2020-12-23 00:00:00 | [{"abs": 123}, "汉字123！@#$%^&*()_+", [0]]    | b,d   |
|   2 |   NULL | 4.20 | 5rWL6K+V |  A   | 2020-12-23 00:00:00 | [{"abs": 123}, "汉字123！@#$%^&*()_+", [0]]    | b,d   |
|   3 |   NULL | 5.20 | 5rWL6K+V |  A   | 2020-12-23 00:00:00 | [{"abs": 123}, "汉字123！@#$%^&*()_+", [0]]    | b,d   |
|   4 |   NULL | 6.20 | 5rWL6K+V |     | 2020-12-23 00:00:00 | [{"abs": 123}, "汉字123！@#$%^&*()_+", [0]]    | b,d   |
|   5 |   NULL | 7.20 | 5rWL6K+V |  A   | 2020-12-23 00:00:00 | [{"abs": 123}, "汉字123！@#$%^&*()_+", [0]]    | a,b,d |
| 666 | 1.1111 | 3.20 | 5rWL6K+V |     | 2020-12-23 00:00:00 | [{"abs": 123}, "汉字123！@#$%^&*()_+", [0]]    | b,d   |
+-----+--------+------+----------+------+---------------------+------------------------------------------------+-------+
drop view view_test1;
base64-3-5 dml + hash分区表 + 约束 + 索引
DROP TABLE base_test2;
CREATE TABLE base_test2(  
  c1 int primary key,  
  c2 float unique, 
  c3 DECIMAL(5,2) DEFAULT null, 
  c4 VARCHAR(100), 
  c5 bit(10),
  c6 datetime, 
  c7 json NOT NULL,
  c8 SET('a', 'b', 'c', 'd'));
DROP TABLE base_test1;
CREATE TABLE base_test1(  
  c1 int primary key,  
  c2 float, 
  c3 DECIMAL(5,2) DEFAULT 8.8, 
  c4 VARCHAR(100), 
  c5 bit(10),
  c6 datetime, 
  c7 json NOT NULL,
  c8 SET('a', 'b', 'c', 'd'))
  PARTITION BY HASH (c1)partitions 15;
CREATE INDEX INDEX_base_test1_T1 ON base_test1(c4);
ALTER TABLE `base_test1` ADD INDEX INDEX_base_test1_T3 (c6, c1);
CREATE INDEX INDEX_base_test1_T5 USING HASH ON base_test1(c8);
insert into base_test2 values(0,1.1111,2.2,'asd汉字！@#￥%……!@@^&*&*()+{}:>?|',b'1000001','2020-12-31 23:59:59.999999'
,'[{"abs":123},"汉字123！@#$%^&*()_+",[0]]','b,d');
insert into base_test2 values(1,2.1111,3.2,'asd汉字！@#￥%……!@@^&*&*()+{}:>?|',b'01','2020-12-12 23:59:59.999999'
,'[{"abs":123},"汉字123！@#$%^&*()_+",[0]]','b,d');
insert into base_test2 values(2,3.1111,4.2,'汉字！@#￥%……!@@^&*&*()+{}:>?|',b'1000001','2020-12-13 23:59:59.999999'
,'[{"abs":123},"汉字123！@#$%^&*()_+",[0]]','b,d');
insert into base_test2 values(3,4.1111,5.2,'asd汉！@#￥%……!@@^&*&*()+{}:>?|',b'1000001','2020-12-14 23:59:59.999999'
,'[{"abs":123},"汉字123！@#$%^&*()_+",[0]]','b,d');
insert into base_test2 values(4,5.1111,6.2,'asd！@#￥%……!@@^&*&*()+{}:>?|',b'10','2020-12-31 23:59:59.999999'
,'[{"abs":123},"汉字123！@#$%^&*()_+",[0]]','b,d');
insert into base_test2 values(5,6.1111,7.2,'asd汉字！@#',b'1000001','2020-12-31 23:59:59.999999'
,'[{"abs":123},"汉字123！@#$%^&*()_+",[0]]','b,d,a');
insert into base_test1 select from_base64(to_base64(c1)),from_base64(c2),from_base64(to_base64(c3)),to_base64(c4),
from_base64(to_base64(c5)),from_base64(to_base64(c6)),c7,from_base64(to_base64(c8)) from base_test2;
select t1.* from base_test1 t1 ,base_test2 t2 where t1.c1=t2.c1 and t1.c5=t2.c5 and t1.c6=t2.c6 and t1.c8=t2.c8;
+----+------+------+----------------------------------------------------------+------+---------------------+------------------------------------------------+-------+
| c1 | c2   | c3   | c4                                                       | c5   | c6                  | c7                                             | c8    |
+----+------+------+----------------------------------------------------------+------+---------------------+------------------------------------------------+-------+
|  0 | NULL | 2.20 | YXNk5rGJ5a2X77yBQCPvv6Ul4oCm4oCmIUBAXiYqJiooKSt7fTo+P3w= |  A   | 2021-01-01 00:00:00 | [{"abs": 123}, "汉字123！@#$%^&*()_+", [0]]    | b,d   |
|  1 | NULL | 3.20 | YXNk5rGJ5a2X77yBQCPvv6Ul4oCm4oCmIUBAXiYqJiooKSt7fTo+P3w= |     | 2020-12-13 00:00:00 | [{"abs": 123}, "汉字123！@#$%^&*()_+", [0]]    | b,d   |
|  2 | NULL | 4.20 | 5rGJ5a2X77yBQCPvv6Ul4oCm4oCmIUBAXiYqJiooKSt7fTo+P3w=     |  A   | 2020-12-14 00:00:00 | [{"abs": 123}, "汉字123！@#$%^&*()_+", [0]]    | b,d   |
|  3 | NULL | 5.20 | YXNk5rGJ77yBQCPvv6Ul4oCm4oCmIUBAXiYqJiooKSt7fTo+P3w=     |  A   | 2020-12-15 00:00:00 | [{"abs": 123}, "汉字123！@#$%^&*()_+", [0]]    | b,d   |
|  4 | NULL | 6.20 | YXNk77yBQCPvv6Ul4oCm4oCmIUBAXiYqJiooKSt7fTo+P3w=         |     | 2021-01-01 00:00:00 | [{"abs": 123}, "汉字123！@#$%^&*()_+", [0]]    | b,d   |
|  5 | NULL | 7.20 | YXNk5rGJ5a2X77yBQCM=                                     |  A   | 2021-01-01 00:00:00 | [{"abs": 123}, "汉字123！@#$%^&*()_+", [0]]    | a,b,d |
+----+------+------+----------------------------------------------------------+------+---------------------+------------------------------------------------+-------+
update base_test1 set c2=from_base64(to_base64(123)) where c1 = 1;
select * from base_test1 where c1 = 1;
+----+------+------+----------------------------------------------------------+------+---------------------+------------------------------------------------+------+
| c1 | c2   | c3   | c4                                                       | c5   | c6                  | c7                                             | c8   |
+----+------+------+----------------------------------------------------------+------+---------------------+------------------------------------------------+------+
|  1 |  123 | 3.20 | YXNk5rGJ5a2X77yBQCPvv6Ul4oCm4oCmIUBAXiYqJiooKSt7fTo+P3w= |     | 2020-12-13 00:00:00 | [{"abs": 123}, "汉字123！@#$%^&*()_+", [0]]    | b,d  |
+----+------+------+----------------------------------------------------------+------+---------------------+------------------------------------------------+------+
update base_test1 set c2=from_base64(to_base64(1.1111)) where c1 = 1;
update base_test1 set c1=from_base64(to_base64(666)) where c1 = 1;
replace into base_test1 values(from_base64(to_base64(0)),from_base64('MS4xMTEx'),2.2,from_base64(to_base64('asd汉字！@#￥%……!@@^&*&*()+{}:>?|')),from_base64(to_base64(b'1000001')),
from_base64(to_base64('2020-12-31 23:59:59.999999')),'[{"abs":123},"汉字123！@#$%^&*()_+",[0]]',from_base64(to_base64('b,d')));
select * from base_test1 where c1 = 0;
+----+--------+------+-------------------------------------------+------+---------------------+------------------------------------------------+------+
| c1 | c2     | c3   | c4                                        | c5   | c6                  | c7                                             | c8   |
+----+--------+------+-------------------------------------------+------+---------------------+------------------------------------------------+------+
|  0 | 1.1111 | 2.20 | asd汉字！@#￥%……!@@^&*&*()+{}:>?|         |  A   | 2021-01-01 00:00:00 | [{"abs": 123}, "汉字123！@#$%^&*()_+", [0]]    | b,d  |
+----+--------+------+-------------------------------------------+------+---------------------+------------------------------------------------+------+
replace into base_test1 values(from_base64(to_base64(0)),from_base64('MS4xMTEx'),2.2,from_base64(to_base64('asd汉字！@#￥%……!@@^&*&*()+{}:>?|')),from_base64(to_base64(b'1000001')),
from_base64(to_base64('2020-12-31 23:59:59.999999')),'[{"abs":123},"汉字123！@#$%^&*()_+",[0]]',from_base64(to_base64('b,d')));
select * from base_test1 where c1 = 0;
+----+--------+------+-------------------------------------------+------+---------------------+------------------------------------------------+------+
| c1 | c2     | c3   | c4                                        | c5   | c6                  | c7                                             | c8   |
+----+--------+------+-------------------------------------------+------+---------------------+------------------------------------------------+------+
|  0 | 1.1111 | 2.20 | asd汉字！@#￥%……!@@^&*&*()+{}:>?|         |  A   | 2021-01-01 00:00:00 | [{"abs": 123}, "汉字123！@#$%^&*()_+", [0]]    | b,d  |
+----+--------+------+-------------------------------------------+------+---------------------+------------------------------------------------+------+
update base_test1 set c4 = to_base64('测试'),
    c6 = from_base64('MjAyMC0xMi0yMiAyMzo1OTo1OS45OTk5OTk=');
select * from base_test1;
+-----+--------+------+----------+------+---------------------+------------------------------------------------+-------+
| c1  | c2     | c3   | c4       | c5   | c6                  | c7                                             | c8    |
+-----+--------+------+----------+------+---------------------+------------------------------------------------+-------+
|   0 | 1.1111 | 2.20 | 5rWL6K+V |  A   | 2020-12-23 00:00:00 | [{"abs": 123}, "汉字123！@#$%^&*()_+", [0]]    | b,d   |
|   2 |   NULL | 4.20 | 5rWL6K+V |  A   | 2020-12-23 00:00:00 | [{"abs": 123}, "汉字123！@#$%^&*()_+", [0]]    | b,d   |
|   3 |   NULL | 5.20 | 5rWL6K+V |  A   | 2020-12-23 00:00:00 | [{"abs": 123}, "汉字123！@#$%^&*()_+", [0]]    | b,d   |
|   4 |   NULL | 6.20 | 5rWL6K+V |     | 2020-12-23 00:00:00 | [{"abs": 123}, "汉字123！@#$%^&*()_+", [0]]    | b,d   |
|   5 |   NULL | 7.20 | 5rWL6K+V |  A   | 2020-12-23 00:00:00 | [{"abs": 123}, "汉字123！@#$%^&*()_+", [0]]    | a,b,d |
| 666 | 1.1111 | 3.20 | 5rWL6K+V |     | 2020-12-23 00:00:00 | [{"abs": 123}, "汉字123！@#$%^&*()_+", [0]]    | b,d   |
+-----+--------+------+----------+------+---------------------+------------------------------------------------+-------+
base64-3-6 dml + 生成列
DROP TABLE base_test1;
CREATE TABLE base_test1(  
  c1 int primary key,  
  c2 float, 
  c3 DECIMAL(5,2) DEFAULT null, 
  c4 VARCHAR(100), 
  c5 bit(10),
  c6 datetime, 
  c7 json NOT NULL,
  c8 SET('a', 'b', 'c', 'd'),
  c9 VARCHAR(200) AS (to_base64(c2)) virtual,
  c10 VARCHAR(200) AS (concat(from_base64(to_base64('abc')),c4)) stored);
insert into base_test1(c1,c2,c3,c4,c5,c6,c7,c8) values(0,1.1,2.2,'asd汉字！@#￥%……!@@^&*&*()+{}:>?|',b'1000001','2020-12-31 23:59:59.999999'
,'[{"abs":123},"汉字123！@#$%^&*()_+",[0]]','b,d');
select * from base_test1;
+----+------+------+-------------------------------------------+------+---------------------+------------------------------------------------+------+------+----------------------------------------------+
| c1 | c2   | c3   | c4                                        | c5   | c6                  | c7                                             | c8   | c9   | c10                                          |
+----+------+------+-------------------------------------------+------+---------------------+------------------------------------------------+------+------+----------------------------------------------+
|  0 |  1.1 | 2.20 | asd汉字！@#￥%……!@@^&*&*()+{}:>?|         |  A   | 2021-01-01 00:00:00 | [{"abs": 123}, "汉字123！@#$%^&*()_+", [0]]    | b,d  | MS4x | abcasd汉字！@#￥%……!@@^&*&*()+{}:>?|         |
+----+------+------+-------------------------------------------+------+---------------------+------------------------------------------------+------+------+----------------------------------------------+
select to_base64(c9) from base_test1;
+---------------+
| to_base64(c9) |
+---------------+
| TVM0eA==      |
+---------------+
select from_base64(c9) from base_test1;
+-----------------+
| from_base64(c9) |
+-----------------+
| 1.1             |
+-----------------+
select from_base64('TVM0eA==') from base_test1;
+-------------------------+
| from_base64('TVM0eA==') |
+-------------------------+
| MS4x                    |
+-------------------------+
select from_base64(to_base64(c9)) from base_test1;
+----------------------------+
| from_base64(to_base64(c9)) |
+----------------------------+
| MS4x                       |
+----------------------------+
select to_base64(c10) from base_test1;
+--------------------------------------------------------------+
| to_base64(c10)                                               |
+--------------------------------------------------------------+
| YWJjYXNk5rGJ5a2X77yBQCPvv6Ul4oCm4oCmIUBAXiYqJiooKSt7fTo+P3w= |
+--------------------------------------------------------------+
select from_base64(c10) from base_test1;
+------------------+
| from_base64(c10) |
+------------------+
| NULL             |
+------------------+
select from_base64(to_base64(c10)) from base_test1;
+----------------------------------------------+
| from_base64(to_base64(c10))                  |
+----------------------------------------------+
| abcasd汉字！@#￥%……!@@^&*&*()+{}:>?|         |
+----------------------------------------------+
update base_test1 set c2=from_base64(to_base64(123)) where c1 = 1;
select * from base_test1 where c1 = 1;
+----+------+------+------+------+------+----+------+------+------+
| c1 | c2   | c3   | c4   | c5   | c6   | c7 | c8   | c9   | c10  |
+----+------+------+------+------+------+----+------+------+------+
+----+------+------+------+------+------+----+------+------+------+
update base_test1 set c2=from_base64(to_base64(1.1111)) where c1 = 1;
update base_test1 set c1=from_base64(to_base64(666)) where c1 = 1;
replace into base_test1(c1,c2,c3,c4,c5,c6,c7,c8) values(from_base64(to_base64(0)),from_base64('MS4xMTEx'),2.2,from_base64(to_base64('asd汉字！@#￥%……!@@^&*&*()+{}:>?|')),from_base64(to_base64(b'1000001')),
from_base64(to_base64('2020-12-31 23:59:59.999999')),'[{"abs":123},"汉字123！@#$%^&*()_+",[0]]',from_base64(to_base64('b,d')));
select * from base_test1;
+----+--------+------+-------------------------------------------+------+---------------------+------------------------------------------------+------+----------+----------------------------------------------+
| c1 | c2     | c3   | c4                                        | c5   | c6                  | c7                                             | c8   | c9       | c10                                          |
+----+--------+------+-------------------------------------------+------+---------------------+------------------------------------------------+------+----------+----------------------------------------------+
|  0 | 1.1111 | 2.20 | asd汉字！@#￥%……!@@^&*&*()+{}:>?|         |  A   | 2021-01-01 00:00:00 | [{"abs": 123}, "汉字123！@#$%^&*()_+", [0]]    | b,d  | MS4xMTEx | abcasd汉字！@#￥%……!@@^&*&*()+{}:>?|         |
+----+--------+------+-------------------------------------------+------+---------------------+------------------------------------------------+------+----------+----------------------------------------------+
replace into base_test1(c1,c2,c3,c4,c5,c6,c7,c8) values(from_base64(to_base64(0)),from_base64('MS4xMTEx'),2.2,from_base64(to_base64('asd汉字！@#￥%……!@@^&*&*()+{}:>?|')),from_base64(to_base64(b'1000001')),
from_base64(to_base64('2020-12-31 23:59:59.999999')),'[{"abs":123},"汉字123！@#$%^&*()_+",[0]]',from_base64(to_base64('b,d')));
select * from base_test1;
+----+--------+------+-------------------------------------------+------+---------------------+------------------------------------------------+------+----------+----------------------------------------------+
| c1 | c2     | c3   | c4                                        | c5   | c6                  | c7                                             | c8   | c9       | c10                                          |
+----+--------+------+-------------------------------------------+------+---------------------+------------------------------------------------+------+----------+----------------------------------------------+
|  0 | 1.1111 | 2.20 | asd汉字！@#￥%……!@@^&*&*()+{}:>?|         |  A   | 2021-01-01 00:00:00 | [{"abs": 123}, "汉字123！@#$%^&*()_+", [0]]    | b,d  | MS4xMTEx | abcasd汉字！@#￥%……!@@^&*&*()+{}:>?|         |
+----+--------+------+-------------------------------------------+------+---------------------+------------------------------------------------+------+----------+----------------------------------------------+
update base_test1 set c2 = from_base64(to_base64(8.1)),
    c6 = from_base64('MjAyMC0xMi0yMiAyMzo1OTo1OS45OTk5OTk=');
select * from base_test1;
+----+------+------+-------------------------------------------+------+---------------------+------------------------------------------------+------+------+----------------------------------------------+
| c1 | c2   | c3   | c4                                        | c5   | c6                  | c7                                             | c8   | c9   | c10                                          |
+----+------+------+-------------------------------------------+------+---------------------+------------------------------------------------+------+------+----------------------------------------------+
|  0 |  8.1 | 2.20 | asd汉字！@#￥%……!@@^&*&*()+{}:>?|         |  A   | 2020-12-23 00:00:00 | [{"abs": 123}, "汉字123！@#$%^&*()_+", [0]]    | b,d  | OC4x | abcasd汉字！@#￥%……!@@^&*&*()+{}:>?|         |
+----+------+------+-------------------------------------------+------+---------------------+------------------------------------------------+------+------+----------------------------------------------+
DROP TABLE base_test1;
DROP TABLE base_test2;
purge recyclebin;
