drop table if exists t3;
drop table if exists t2;
drop table if exists t1;
create table t1 (c1 int primary key, c2 int, c3 int) partition by hash(c1) partitions 4;
create table t2 (c1 int primary key, c2 int, c3 int) partition by hash(c1) partitions 4;
insert into t1 values (1,1,1),(2,2,2),(3,3,3);
insert into t2 values (1,1,1),(2,2,3),(3,3,3);
select c3, (@rownum:= @rownum + 1) as ccbh from t1 a, (select @rownum:= 0) B;
c3	ccbh
1	1
2	2
3	3
explain update t1 a, t2 b set a.c2 = @val:=(a.c2 + 1) where a.c3 = b.c3 and a.c1 = '3';
Query Plan
=================================================================
|ID|OPERATOR                         |NAME|EST.ROWS|EST.TIME(us)|
-----------------------------------------------------------------
|0 |DISTRIBUTED UPDATE               |    |1       |46          |
|1 |└─MERGE JOIN                     |    |1       |14          |
|2 |  ├─DISTRIBUTED TABLE GET        |a   |1       |5           |
|3 |  └─SORT                         |    |3       |9           |
|4 |    └─DISTRIBUTED TABLE FULL SCAN|b   |3       |9           |
=================================================================
Outputs & filters:
-------------------------------------
  0 - output(nil), filter(nil)
      table_columns([{a: ({t1: (a.c1, a.c2, a.c3)}), hash_distinct}]),
      update([a.c2=column_conv(INT,PS:(11,0),NULL,cast((T_OP_ASSIGN, 'val', a.c2 + 1), INT(-1, 0)))])
  1 - output([a.c1], [a.c2], [a.c3]), filter(nil)
      equal_conds([a.c3 = b.c3]), other_conds(nil)
      merge_directions([ASC])
  2 - output([a.c1], [a.c2], [a.c3]), filter(nil)
      access([a.c1], [a.c2], [a.c3]), partitions(p3)
      is_index_back=false, is_global_index=false, keep_ordering=true, 
      range_key([a.c1]), range[3 ; 3], 
      range_cond([a.c1 = demote_cast('3', INT(11, 0))])
  3 - output([b.c3]), filter(nil)
      sort_keys([b.c3, ASC])
  4 - output([b.c3]), filter(nil)
      access([b.c3]), partitions(p[0-3])
      is_index_back=false, is_global_index=false, 
      range_key([b.c1]), range(MIN ; MAX)always true
update t1 a, t2 b set a.c2 = @val:=(a.c2 + 1) where a.c3 = b.c3 and a.c1 = '3';
select * from t1;
c1	c2	c3
1	1	1
2	2	2
3	4	3
select @val;
@val
4
drop table t2;
drop table t1;
create table t1 (c1 int primary key, c2 int, c3 int) partition by hash(c1) partitions 4;
create table t2 (c1 int primary key, c2 int, c3 int) partition by hash(c1) partitions 4;
insert into t1 values (1,1,1),(2,2,2),(3,3,3);
insert into t2 values (1,1,1),(2,2,3),(3,3,3);
update t2 set c2 = (@val:= c2) + 1 where c1 <= 2;
select * from t2;
c1	c2	c3
1	2	1
2	3	3
3	3	3
select @val;
@val
2
update t1 set c2 = (@val:= c2) + 1 where c3 >= 1;
select * from t1;
c1	c2	c3
1	2	1
2	3	2
3	4	3
select @val;
@val
3
drop table t2;
drop table t1;
create table t1 (c1 int primary key, c2 int, c3 int);
create table t2 (c1 int primary key, c2 int, c3 int);
insert into t1 values (1,1,1),(2,2,2),(3,3,3);
insert into t2 values (1,1,1),(2,2,3),(3,3,3);
select c3, (@rownum:= @rownum + 1) as ccbh from t1 a, (select @rownum:= 0) B;
c3	ccbh
1	1
2	2
3	3
update t1 a, t2 b set a.c2 = @val:=(a.c2 + 1) where a.c3 = b.c3 and a.c1 = '3';
select * from t1;
c1	c2	c3
1	1	1
2	2	2
3	4	3
select @val;
@val
4
drop table t2;
drop table t1;
create table t1 (c1 int primary key, c2 int, c3 int);
create table t2 (c1 int primary key, c2 int, c3 int);
insert into t1 values (1,1,1),(2,2,2),(3,3,3);
insert into t2 values (1,1,1),(2,2,3),(3,3,3);
update t2 set c2 = (@val:= c2) + 1 where c1 <= 2;
select * from t2;
c1	c2	c3
1	2	1
2	3	3
3	3	3
select @val;
@val
2
update t1 set c2 = (@val:= c2) + 1 where c3 >= 1;
select * from t1;
c1	c2	c3
1	2	1
2	3	2
3	4	3
select @val;
@val
3
drop table t2;
drop table t1;
create table t2 (c1 int primary key, c2 int, c3 int);
insert into t2 values (1,1,1),(2,2,2),(3,3,3);
create procedure test_pl_variable()
begin
update t2 set c2 = (@val:= c2) + 1 where c1 <= 2;
select @val;
end //
call test_pl_variable();
@val
2
select @val;
@val
2
select * from t2;
c1	c2	c3
1	2	1
2	3	2
3	3	3
drop table t2;
drop procedure test_pl_variable;
create table t1(c1 int primary key, c2 int) partition by hash(c1) partitions 4;
insert into t1 values (1,1),(2,2),(3,3),(4,4),(5,5);
select @var := c1 from (select c1 from t1 where c2 < 5 order by c1 limit 2) order by 1 desc;
@var := c1
2
1
Warnings:
Warning	1287	Setting user variables within expressions is deprecated and will be removed in a future release. Please use 'SET variable=expression, ... or SELECT expression(s) INTO variables(s)' instead
select @val;
@val
2
drop table t1;
create table t1 (c1 int primary key, c2 int, c3 int, c4 int) partition by hash(c1) partitions 4;
CREATE INDEX ind_c2 ON t1(c2) local;
insert into t1 values (1,2,3,4),(2,3,4,5),(3,4,5,6),(4,5,6,7),(5,6,7,8),(6,7,8,9);
set @val:=100;
explain select c2 from t1 where c2 <= 3 and @val := c2;
Query Plan
==================================================================
|ID|OPERATOR                    |NAME      |EST.ROWS|EST.TIME(us)|
------------------------------------------------------------------
|0 |DISTRIBUTED TABLE RANGE SCAN|t1(ind_c2)|2       |9           |
==================================================================
Outputs & filters:
-------------------------------------
  0 - output([t1.c2]), filter([(T_OP_ASSIGN, 'val', t1.c2)])
      access([t1.c2]), partitions(p[0-3])
      is_index_back=false, is_global_index=false, filter_before_indexback[false], 
      range_key([t1.c2], [t1.c1]), range(NULL,MAX ; 3,MAX), 
      range_cond([t1.c2 <= 3])
select c2 from t1 where c2 <= 3 and @val := c2;
c2
2
3
select @val;
@val
3
explain select * from t1 where c2 <= 3 and @val := c2;
Query Plan
==================================================================
|ID|OPERATOR                    |NAME      |EST.ROWS|EST.TIME(us)|
------------------------------------------------------------------
|0 |DISTRIBUTED TABLE RANGE SCAN|t1(ind_c2)|2       |21          |
==================================================================
Outputs & filters:
-------------------------------------
  0 - output([t1.c1], [t1.c2], [t1.c3], [t1.c4]), filter([(T_OP_ASSIGN, 'val', t1.c2)])
      access([t1.c1], [t1.c2], [t1.c3], [t1.c4]), partitions(p[0-3])
      is_index_back=true, is_global_index=false, filter_before_indexback[true], 
      range_key([t1.c2], [t1.c1]), range(NULL,MAX ; 3,MAX), 
      range_cond([t1.c2 <= 3])
select * from t1 where c2 <= 3 and @val := c2;
c1	c2	c3	c4
1	2	3	4
2	3	4	5
select @val;
@val
3
explain select * from t1 where c2 <= 3 and @val := c3;
Query Plan
==================================================================
|ID|OPERATOR                    |NAME      |EST.ROWS|EST.TIME(us)|
------------------------------------------------------------------
|0 |DISTRIBUTED TABLE RANGE SCAN|t1(ind_c2)|2       |23          |
==================================================================
Outputs & filters:
-------------------------------------
  0 - output([t1.c1], [t1.c2], [t1.c3], [t1.c4]), filter([(T_OP_ASSIGN, 'val', t1.c3)])
      access([t1.c1], [t1.c2], [t1.c3], [t1.c4]), partitions(p[0-3])
      is_index_back=true, is_global_index=false, filter_before_indexback[false], 
      range_key([t1.c2], [t1.c1]), range(NULL,MAX ; 3,MAX), 
      range_cond([t1.c2 <= 3])
select * from t1 where c2 <= 3 and @val := c3;
c1	c2	c3	c4
1	2	3	4
2	3	4	5
select @val;
@val
4
explain select * from t1 where c3 <= 4 and @val := c4;
Query Plan
===========================================================
|ID|OPERATOR                   |NAME|EST.ROWS|EST.TIME(us)|
-----------------------------------------------------------
|0 |DISTRIBUTED TABLE FULL SCAN|t1  |1       |9           |
===========================================================
Outputs & filters:
-------------------------------------
  0 - output([t1.c1], [t1.c2], [t1.c3], [t1.c4]), filter([t1.c3 <= 4], [(T_OP_ASSIGN, 'val', t1.c4)])
      access([t1.c1], [t1.c3], [t1.c4], [t1.c2]), partitions(p[0-3])
      is_index_back=false, is_global_index=false, filter_before_indexback[false,false], 
      range_key([t1.c1]), range(MIN ; MAX)always true
select * from t1 where c3 <= 4 and @val := c4;
c1	c2	c3	c4
1	2	3	4
2	3	4	5
select @val;
@val
5
drop table t1;
create table t1 (c1 int primary key, c2 int, c3 int, c4 int) partition by hash(c1) partitions 4;
CREATE INDEX ind_c2 ON t1(c2) global;
insert into t1 values (1,2,3,4),(2,3,4,5),(3,4,5,6),(4,5,6,7),(5,6,7,8),(6,7,8,9);
set @val:=100;
explain select c2 from t1 where c2 <= 3 and @val := c2;
Query Plan
==================================================================
|ID|OPERATOR                    |NAME      |EST.ROWS|EST.TIME(us)|
------------------------------------------------------------------
|0 |DISTRIBUTED TABLE RANGE SCAN|t1(ind_c2)|2       |3           |
==================================================================
Outputs & filters:
-------------------------------------
  0 - output([t1.c2]), filter([(T_OP_ASSIGN, 'val', t1.c2)])
      access([t1.c2]), partitions(p0)
      is_index_back=false, is_global_index=true, filter_before_indexback[false], 
      range_key([t1.c2], [t1.c1]), range(NULL,MAX ; 3,MAX), 
      range_cond([t1.c2 <= 3])
select c2 from t1 where c2 <= 3 and @val := c2;
c2
2
3
select @val;
@val
3
explain select * from t1 where c2 <= 3 and @val := c2;
Query Plan
==================================================================
|ID|OPERATOR                    |NAME      |EST.ROWS|EST.TIME(us)|
------------------------------------------------------------------
|0 |DISTRIBUTED TABLE RANGE SCAN|t1(ind_c2)|2       |42          |
==================================================================
Outputs & filters:
-------------------------------------
  0 - output([t1.c1], [t1.c2], [t1.c3], [t1.c4]), filter([(T_OP_ASSIGN, 'val', t1.c2)])
      access([t1.c1], [t1.c2], [t1.c3], [t1.c4]), partitions(p0)
      is_index_back=true, is_global_index=true, filter_before_indexback[true], 
      range_key([t1.c2], [t1.c1]), range(NULL,MAX ; 3,MAX), 
      range_cond([t1.c2 <= 3])
select * from t1 where c2 <= 3 and @val := c2;
c1	c2	c3	c4
1	2	3	4
2	3	4	5
select @val;
@val
3
explain select * from t1 where c2 <= 3 and @val := c3;
Query Plan
==================================================================
|ID|OPERATOR                    |NAME      |EST.ROWS|EST.TIME(us)|
------------------------------------------------------------------
|0 |DISTRIBUTED TABLE RANGE SCAN|t1(ind_c2)|2       |57          |
==================================================================
Outputs & filters:
-------------------------------------
  0 - output([t1.c1], [t1.c2], [t1.c3], [t1.c4]), filter([(T_OP_ASSIGN, 'val', t1.c3)])
      access([t1.c1], [t1.c3], [t1.c2], [t1.c4]), partitions(p0)
      is_index_back=true, is_global_index=true, filter_before_indexback[false], 
      range_key([t1.c2], [t1.c1]), range(NULL,MAX ; 3,MAX), 
      range_cond([t1.c2 <= 3])
select * from t1 where c2 <= 3 and @val := c3;
c1	c2	c3	c4
1	2	3	4
2	3	4	5
select @val;
@val
4
explain select * from t1 where c3 <= 4 and @val := c4;
Query Plan
===========================================================
|ID|OPERATOR                   |NAME|EST.ROWS|EST.TIME(us)|
-----------------------------------------------------------
|0 |DISTRIBUTED TABLE FULL SCAN|t1  |1       |9           |
===========================================================
Outputs & filters:
-------------------------------------
  0 - output([t1.c1], [t1.c2], [t1.c3], [t1.c4]), filter([t1.c3 <= 4], [(T_OP_ASSIGN, 'val', t1.c4)])
      access([t1.c1], [t1.c3], [t1.c4], [t1.c2]), partitions(p[0-3])
      is_index_back=false, is_global_index=false, filter_before_indexback[false,false], 
      range_key([t1.c1]), range(MIN ; MAX)always true
select * from t1 where c3 <= 4 and @val := c4;
c1	c2	c3	c4
1	2	3	4
2	3	4	5
select @val;
@val
5
drop table t1;
