ddl_mysql  主键操作 删除主键
drop table t1;
CREATE TABLE t1(
c1 int primary key,
c2 varchar(30)
)
PARTITION BY RANGE (c1) (
PARTITION p1 VALUES LESS THAN (15),
PARTITION p2 VALUES LESS THAN (35),
PARTITION p3 VALUES LESS THAN (50)
);
insert into t1(c1) values(20),(29),(35),(40),(15),(18);
drop table t2;
CREATE TABLE t2(
c1 int primary key,
c2 varchar(30)
);
insert into t2 values(21,'AA'),(9,null),(29,'SE'),(45,'GG');
ALTER TABLE t1 EXCHANGE PARTITION p2 WITH TABLE t2 WITHOUT VALIDATION;
select * from t1 partition(p2);
c1	c2
9	NULL
21	AA
29	SE
45	GG
select * from t2;
c1	c2
15	NULL
18	NULL
20	NULL
29	NULL
ALTER TABLE t1 DROP PRIMARY KEY;
select * from t1 partition(p2);
c1	c2
21	AA
29	SE
select * from t2;
c1	c2
15	NULL
18	NULL
20	NULL
29	NULL
drop table if exists t1;
CREATE TABLE t1(
c1 int primary key,
c2 varchar(30)
)
PARTITION BY RANGE (c1) (
PARTITION p1 VALUES LESS THAN (15),
PARTITION p2 VALUES LESS THAN (35),
PARTITION p3 VALUES LESS THAN (50)
);
insert into t1(c1) values(20),(29),(35),(40),(15),(18);
drop table if exists t2;
CREATE TABLE t2(
c1 int primary key,
c2 varchar(30)
);
insert into t2 values(21,'AA'),(9,null),(29,'SE'),(45,'GG');
ALTER TABLE t1 EXCHANGE PARTITION p2 WITH TABLE t2 WITHOUT VALIDATION;
select * from t1 partition(p2);
c1	c2
9	NULL
21	AA
29	SE
45	GG
select * from t2;
c1	c2
15	NULL
18	NULL
20	NULL
29	NULL
ALTER TABLE t2 DROP PRIMARY KEY;
select * from t1 partition(p2);
c1	c2
9	NULL
21	AA
29	SE
45	GG
select * from t2;
c1	c2
15	NULL
18	NULL
20	NULL
29	NULL
ddl_mysql  主键操作 添加主键
drop table if exists t1;
CREATE TABLE t1(
c1 int,
c2 varchar(30)
)
PARTITION BY RANGE (c1) (
PARTITION p1 VALUES LESS THAN (15),
PARTITION p2 VALUES LESS THAN (35),
PARTITION p3 VALUES LESS THAN (50)
);
insert into t1(c1) values(20),(29),(35),(40),(15),(18);
drop table if exists t2;
CREATE TABLE t2(
c1 int,
c2 varchar(30)
);
insert into t2 values(21,'AA'),(9,null),(29,'SE'),(45,'GG');
ALTER TABLE t1 EXCHANGE PARTITION p2 WITH TABLE t2 WITHOUT VALIDATION;
select * from t1;
c1	c2
21	AA
9	NULL
29	SE
45	GG
35	NULL
40	NULL
select * from t1 partition(p2);
c1	c2
21	AA
9	NULL
29	SE
45	GG
select * from t2;
c1	c2
20	NULL
29	NULL
15	NULL
18	NULL
ALTER TABLE t1 ADD PRIMARY KEY (c1);
select * from t1;
c1	c2
9	NULL
21	AA
29	SE
35	NULL
40	NULL
45	GG
select * from t1 partition(p2);
c1	c2
21	AA
29	SE
select * from t2;
c1	c2
20	NULL
29	NULL
15	NULL
18	NULL
ddl_mysql  列操作 添加列 add column
drop table pt_stored_test;
CREATE TABLE pt_stored_test (
c1 INT NOT NULL,
c2 DATE NOT NULL,
c3 VARCHAR(50) NOT NULL,
c4 INT AS (YEAR(c2)) STORED, 
PRIMARY KEY (c2)
)
PARTITION BY RANGE(YEAR(c2)) (
PARTITION p2019 VALUES LESS THAN (2020),
PARTITION p2020 VALUES LESS THAN (2021),
PARTITION p2021 VALUES LESS THAN (2022),
PARTITION p2022 VALUES LESS THAN (2023)
);
insert into pt_stored_test(c1,c2,c3) values(1,'2020-02-20','CC'),(2,'2020-08-20','dhh'),(5,'2021-09-20','mh'),(7,'2022-07-12','CC');
insert into pt_stored_test(c1,c2,c3) values(11,'2020-05-30','ruh'),(13,'2022-08-08','nhj'),(15,'2021-11-21','m11111h'),(17,'2022-09-12','CC');
drop table nt_stored_test;
CREATE TABLE nt_stored_test (
c1 INT NOT NULL,
c2 DATE NOT NULL,
c3 VARCHAR(50) NOT NULL,
c4 INT AS (YEAR(c2)) STORED,
PRIMARY KEY (c2)
);
insert into nt_stored_test(c1,c2,c3) values(30,'2030-02-20','CC'),(-80,'2021-08-20','dhh'),(60,'2000-01-20','mh'),(777,'2024-01-12','CC');
select * from pt_stored_test;
c1	c2	c3	c4
1	2020-02-20	CC	2020
11	2020-05-30	ruh	2020
2	2020-08-20	dhh	2020
5	2021-09-20	mh	2021
15	2021-11-21	m11111h	2021
7	2022-07-12	CC	2022
13	2022-08-08	nhj	2022
17	2022-09-12	CC	2022
ALTER TABLE pt_stored_test EXCHANGE PARTITION p2020 WITH TABLE nt_stored_test WITHOUT VALIDATION;
select * from pt_stored_test;
c1	c2	c3	c4
60	2000-01-20	mh	2000
-80	2021-08-20	dhh	2021
777	2024-01-12	CC	2024
30	2030-02-20	CC	2030
5	2021-09-20	mh	2021
15	2021-11-21	m11111h	2021
7	2022-07-12	CC	2022
13	2022-08-08	nhj	2022
17	2022-09-12	CC	2022
select * from pt_stored_test partition(p2020);
c1	c2	c3	c4
60	2000-01-20	mh	2000
-80	2021-08-20	dhh	2021
777	2024-01-12	CC	2024
30	2030-02-20	CC	2030
ALTER TABLE pt_stored_test ADD COLUMN c5 int;
select * from pt_stored_test;
c1	c2	c3	c4	c5
60	2000-01-20	mh	2000	NULL
-80	2021-08-20	dhh	2021	NULL
777	2024-01-12	CC	2024	NULL
30	2030-02-20	CC	2030	NULL
5	2021-09-20	mh	2021	NULL
15	2021-11-21	m11111h	2021	NULL
7	2022-07-12	CC	2022	NULL
13	2022-08-08	nhj	2022	NULL
17	2022-09-12	CC	2022	NULL
select * from pt_stored_test partition(p2020);
c1	c2	c3	c4	c5
60	2000-01-20	mh	2000	NULL
-80	2021-08-20	dhh	2021	NULL
777	2024-01-12	CC	2024	NULL
30	2030-02-20	CC	2030	NULL
select * from nt_stored_test;
c1	c2	c3	c4
1	2020-02-20	CC	2020
11	2020-05-30	ruh	2020
2	2020-08-20	dhh	2020
ALTER TABLE nt_stored_test ADD COLUMN c5 int;
select * from nt_stored_test;
c1	c2	c3	c4	c5
1	2020-02-20	CC	2020	NULL
11	2020-05-30	ruh	2020	NULL
2	2020-08-20	dhh	2020	NULL
ddl_mysql  列操作 删除列 drop column
drop table pt_unique_test1;
CREATE TABLE pt_unique_test1 (
c1 INT UNIQUE KEY ,
c2 VARCHAR(50) NOT NULL,
c3 int
)
PARTITION BY RANGE(c1) (
PARTITION p1 VALUES LESS THAN (10),
PARTITION p2 VALUES LESS THAN (20),
PARTITION p3 VALUES LESS THAN (30)
);
create index test on pt_unique_test1(c3);
insert into pt_unique_test1(c1,c2) values(1,'CC'),(21,'dhh'),(15,'mh'),(7,'CC');
drop table nt_unique_test1;
CREATE TABLE nt_unique_test1 (
c1 INT UNIQUE KEY,
c2 VARCHAR(50) NOT NULL,
c3 int
);
create index test on nt_unique_test1(c3);
insert into nt_unique_test1(c1,c2) values(2,'CC'),(12,'dhh'),(22,'mh'),(7,'CC');
ALTER TABLE pt_unique_test1 EXCHANGE PARTITION p2 WITH TABLE nt_unique_test1 WITHOUT VALIDATION;
select * from pt_unique_test1;
c1	c2	c3
1	CC	NULL
7	CC	NULL
2	CC	NULL
12	dhh	NULL
22	mh	NULL
7	CC	NULL
21	dhh	NULL
select * from pt_unique_test1 partition(p2);
c1	c2	c3
2	CC	NULL
12	dhh	NULL
22	mh	NULL
7	CC	NULL
删除列的操作是两表ddl，会重新构建和之前一样的表，如果上面存在索引的话，会去校验数据，如果表中存在不符合要求的数据的时候，就报错
ALTER TABLE pt_unique_test1 DROP COLUMN c3;
ERROR 23000: Duplicated primary key
select * from pt_unique_test1;
c1	c2	c3
1	CC	NULL
7	CC	NULL
2	CC	NULL
12	dhh	NULL
22	mh	NULL
7	CC	NULL
21	dhh	NULL
select * from pt_unique_test1 partition(p2);
c1	c2	c3
2	CC	NULL
12	dhh	NULL
22	mh	NULL
7	CC	NULL
ALTER TABLE nt_unique_test1 DROP COLUMN c3;
select * from nt_unique_test1;
c1	c2
15	mh
ddl_mysql  列操作 修改分区键列类型
drop table pt_decimal_test1;
CREATE TABLE pt_decimal_test1 (
c1 INT  ,
c2 decimal(10,5),
c3 float NOT null,
c4 double DEFAULT 3.14159
)
PARTITION BY RANGE(c1) (
PARTITION p1 VALUES LESS THAN (10),
PARTITION p2 VALUES LESS THAN (20),
PARTITION p3 VALUES LESS THAN (30)
);
insert into pt_decimal_test1(c1,c2,c3,c4) values(1,1,1,1),(12,12,12,12),(23,23,23,23),(4,4,4,4);
drop table nt_decimal_test1;
CREATE TABLE nt_decimal_test1 (
c1 INT ,
c2 decimal(10,5),
c3 float NOT null,
c4 double DEFAULT 3.14159
);
insert into nt_decimal_test1(c1,c2,c3,c4) values(1,1,1,1),(12,12,12,12),(23,23,23,23),(4,4,4,4);
ALTER TABLE pt_decimal_test1 EXCHANGE PARTITION p2 WITH TABLE nt_decimal_test1 WITHOUT VALIDATION;
select * from pt_decimal_test1;
c1	c2	c3	c4
1	1.00000	1	1
4	4.00000	4	4
1	1.00000	1	1
12	12.00000	12	12
23	23.00000	23	23
4	4.00000	4	4
23	23.00000	23	23
select * from pt_decimal_test1 partition(p2);
c1	c2	c3	c4
1	1.00000	1	1
12	12.00000	12	12
23	23.00000	23	23
4	4.00000	4	4
ALTER TABLE pt_decimal_test1 MODIFY c1 tinyint;
select * from pt_decimal_test1;
c1	c2	c3	c4
1	1.00000	1	1
4	4.00000	4	4
1	1.00000	1	1
4	4.00000	4	4
12	12.00000	12	12
23	23.00000	23	23
23	23.00000	23	23
select * from pt_decimal_test1 partition(p2);
c1	c2	c3	c4
12	12.00000	12	12
select * from nt_decimal_test1;
c1	c2	c3	c4
12	12.00000	12	12
ALTER TABLE nt_decimal_test1 MODIFY  c1 tinyint;
select * from nt_decimal_test1;
c1	c2	c3	c4
12	12.00000	12	12
ddl_mysql  列操作 修改列类型(非分区键)
drop table pt_decimal_test1;
CREATE TABLE pt_decimal_test1 (
c1 INT  ,
c2 decimal(10,5),
c3 float NOT null,
c4 double DEFAULT 3.14159
)
PARTITION BY RANGE(c1) (
PARTITION p1 VALUES LESS THAN (10),
PARTITION p2 VALUES LESS THAN (20),
PARTITION p3 VALUES LESS THAN (30)
);
insert into pt_decimal_test1(c1,c2,c3,c4) values(1,1,1,1),(12,12,12,12),(23,23,23,23),(4,4,4,4);
drop table nt_decimal_test1;
CREATE TABLE nt_decimal_test1 (
c1 INT ,
c2 decimal(10,5),
c3 float NOT null,
c4 double DEFAULT 3.14159
);
insert into nt_decimal_test1(c1,c2,c3,c4) values(1,1,1,1),(12,12,12,12),(23,23,23,23),(4,4,4,4);
ALTER TABLE pt_decimal_test1 EXCHANGE PARTITION p2 WITH TABLE nt_decimal_test1 WITHOUT VALIDATION;
select * from pt_decimal_test1;
c1	c2	c3	c4
1	1.00000	1	1
4	4.00000	4	4
1	1.00000	1	1
12	12.00000	12	12
23	23.00000	23	23
4	4.00000	4	4
23	23.00000	23	23
select * from pt_decimal_test1 partition(p2);
c1	c2	c3	c4
1	1.00000	1	1
12	12.00000	12	12
23	23.00000	23	23
4	4.00000	4	4
删除列的操作是两表ddl，会重新构建和之前一样的表，如果上面存在索引的话，会去校验数据，如果表中存在不符合要求的数据的时候，就报错
ALTER TABLE pt_decimal_test1 MODIFY c2 char(20);
ERROR 23000: Duplicated primary key
select * from pt_decimal_test1;
c1	c2	c3	c4
1	1.00000	1	1
4	4.00000	4	4
1	1.00000	1	1
12	12.00000	12	12
23	23.00000	23	23
4	4.00000	4	4
23	23.00000	23	23
select * from pt_decimal_test1 partition(p2);
c1	c2	c3	c4
1	1.00000	1	1
12	12.00000	12	12
23	23.00000	23	23
4	4.00000	4	4
ddl_mysql  列操作 修改分区键上约束 添加主键约束 不符合分区的数据还是存在  删除主键不符合分区的数据还是不存在
drop table pt_varchar_test1;
CREATE TABLE pt_varchar_test1 (
c1 INT ,
c2 varchar(30) NOT null,
c3 char(30) DEFAULT 3.14159,
c4 char(10)
)
PARTITION BY RANGE(c1) (
PARTITION p1 VALUES LESS THAN (10),
PARTITION p2 VALUES LESS THAN (20),
PARTITION p3 VALUES LESS THAN (30)
);
insert into pt_varchar_test1(c1,c2,c3,c4) values(1,1,1,1),(12,12,12,12),(23,23,23,23),(4,4,4,4);
drop table nt_varchar_test1;
CREATE TABLE nt_varchar_test1 (
c1 INT ,
c2 varchar(30) NOT null,
c3 char(30) DEFAULT 3.14159,
c4 char(10)
);
insert into nt_varchar_test1(c1,c2,c3,c4) values(1,1,1,1),(12,12,12,12),(23,23,23,23),(4,4,4,4);
ALTER TABLE pt_varchar_test1 EXCHANGE PARTITION p2 WITH TABLE nt_varchar_test1 WITHOUT VALIDATION;
select * from pt_varchar_test1 order by c1;
c1	c2	c3	c4
1	1	1	1
1	1	1	1
4	4	4	4
4	4	4	4
12	12	12	12
23	23	23	23
23	23	23	23
select * from pt_varchar_test1 partition(p2);
c1	c2	c3	c4
1	1	1	1
12	12	12	12
23	23	23	23
4	4	4	4
ALTER TABLE pt_varchar_test1 MODIFY COLUMN c1 INT NOT NULL;
select * from pt_varchar_test1 order by c1;
c1	c2	c3	c4
1	1	1	1
1	1	1	1
4	4	4	4
4	4	4	4
12	12	12	12
23	23	23	23
23	23	23	23
select * from pt_varchar_test1 partition(p2);
c1	c2	c3	c4
1	1	1	1
12	12	12	12
23	23	23	23
4	4	4	4
ALTER TABLE pt_varchar_test1 MODIFY COLUMN c1 INT PRIMARY KEY;
ERROR 23000: Duplicated primary key
select * from pt_varchar_test1 order by c1;
c1	c2	c3	c4
1	1	1	1
1	1	1	1
4	4	4	4
4	4	4	4
12	12	12	12
23	23	23	23
23	23	23	23
select * from pt_varchar_test1 partition(p2);
c1	c2	c3	c4
1	1	1	1
12	12	12	12
23	23	23	23
4	4	4	4
ALTER TABLE pt_varchar_test1 DROP PRIMARY KEY;
select * from pt_varchar_test1 order by c1;
c1	c2	c3	c4
1	1	1	1
1	1	1	1
4	4	4	4
4	4	4	4
12	12	12	12
23	23	23	23
23	23	23	23
select * from pt_varchar_test1 partition(p2);
c1	c2	c3	c4
1	1	1	1
12	12	12	12
23	23	23	23
4	4	4	4
ddl_mysql  列操作 修改列约束(非分区键) 
drop table pt_varchar_test1;
CREATE TABLE pt_varchar_test1 (
c1 INT PRIMARY KEY ,
c2 varchar(30) NOT null,
c3 char(30) DEFAULT 3.14159,
c4 char(10)
)
PARTITION BY RANGE(c1) (
PARTITION p1 VALUES LESS THAN (10),
PARTITION p2 VALUES LESS THAN (20),
PARTITION p3 VALUES LESS THAN (30)
);
insert into pt_varchar_test1(c1,c2,c3,c4) values(1,1,1,1),(12,12,12,12),(23,23,23,23),(4,4,4,4);
drop table nt_varchar_test1;
CREATE TABLE nt_varchar_test1 (
c1 INT primary KEY,
c2 varchar(30) NOT null,
c3 char(30) DEFAULT 3.14159,
c4 char(10)
);
insert into nt_varchar_test1(c1,c2,c3,c4) values(1,1,1,1),(12,12,12,12),(23,23,23,23),(4,4,4,4);
ALTER TABLE pt_varchar_test1 EXCHANGE PARTITION p2 WITH TABLE nt_varchar_test1 WITHOUT VALIDATION;
select * from pt_varchar_test1 order by c1;
c1	c2	c3	c4
1	1	1	1
4	4	4	4
1	1	1	1
4	4	4	4
12	12	12	12
23	23	23	23
23	23	23	23
select * from pt_varchar_test1 partition(p2);
c1	c2	c3	c4
1	1	1	1
4	4	4	4
12	12	12	12
23	23	23	23
ALTER TABLE pt_varchar_test1 MODIFY COLUMN c4 char(10) NOT NULL;
select * from pt_varchar_test1 order by c1;
c1	c2	c3	c4
1	1	1	1
4	4	4	4
1	1	1	1
4	4	4	4
12	12	12	12
23	23	23	23
23	23	23	23
select * from pt_varchar_test1 partition(p2);
c1	c2	c3	c4
1	1	1	1
4	4	4	4
12	12	12	12
23	23	23	23
ddl_mysql  列操作 修改新分区auto_increment值
drop table pt_varchar_test1;
CREATE TABLE pt_varchar_test1 (
c1 INT PRIMARY KEY,
c2 varchar(30) NOT null,
c3 char(30) DEFAULT 3.14159,
c4 char(10)
)
PARTITION BY RANGE(c1) (
PARTITION p1 VALUES LESS THAN (10),
PARTITION p2 VALUES LESS THAN (20),
PARTITION p3 VALUES LESS THAN (30)
);
insert into pt_varchar_test1(c1,c2,c3,c4) values(1,1,1,1),(12,12,12,12),(23,23,23,23),(4,4,4,4);
drop table nt_varchar_test1;
CREATE TABLE nt_varchar_test1 (
c1 INT PRIMARY KEY,
c2 varchar(30) NOT null,
c3 char(30) DEFAULT 3.14159,
c4 char(10)
);
insert into nt_varchar_test1(c1,c2,c3,c4) values(2,2,2,3),(13,13,13,13),(24,24,24,24),(5,5,5,5);
ALTER TABLE pt_varchar_test1 EXCHANGE PARTITION p2 WITH TABLE nt_varchar_test1 WITHOUT VALIDATION;
select * from pt_varchar_test1 order by c1;
c1	c2	c3	c4
1	1	1	1
4	4	4	4
2	2	2	3
5	5	5	5
13	13	13	13
24	24	24	24
23	23	23	23
select * from pt_varchar_test1 partition(p2);
c1	c2	c3	c4
2	2	2	3
5	5	5	5
13	13	13	13
24	24	24	24
ALTER TABLE pt_varchar_test1 MODIFY COLUMN c1 INT AUTO_INCREMENT;
select * from pt_varchar_test1 order by c1;
c1	c2	c3	c4
1	1	1	1
4	4	4	4
2	2	2	3
5	5	5	5
13	13	13	13
24	24	24	24
23	23	23	23
select * from pt_varchar_test1 partition(p2);
c1	c2	c3	c4
2	2	2	3
5	5	5	5
13	13	13	13
24	24	24	24
ddl_mysql  列操作 rename 非分区键,  分区键不允许重命名
drop table pt_varchar_test1;
CREATE TABLE pt_varchar_test1 (
c1 INT PRIMARY KEY,
c2 varchar(30) NOT null,
c3 char(30) DEFAULT 3.14159,
c4 char(10)
)
PARTITION BY RANGE(c1) (
PARTITION p1 VALUES LESS THAN (10),
PARTITION p2 VALUES LESS THAN (20),
PARTITION p3 VALUES LESS THAN (30)
);
insert into pt_varchar_test1(c1,c2,c3,c4) values(1,1,1,1),(12,12,12,12),(23,23,23,23),(4,4,4,4);
drop table nt_varchar_test1;
CREATE TABLE nt_varchar_test1 (
c1 INT PRIMARY KEY,
c2 varchar(30) NOT null,
c3 char(30) DEFAULT 3.14159,
c4 char(10)
);
insert into nt_varchar_test1(c1,c2,c3,c4) values(2,2,2,3),(13,13,13,13),(24,24,24,24),(5,5,5,5);
ALTER TABLE pt_varchar_test1 EXCHANGE PARTITION p2 WITH TABLE nt_varchar_test1 WITHOUT VALIDATION;
select * from pt_varchar_test1 order by c1;
c1	c2	c3	c4
1	1	1	1
4	4	4	4
2	2	2	3
5	5	5	5
13	13	13	13
24	24	24	24
23	23	23	23
select * from pt_varchar_test1 partition(p2);
c1	c2	c3	c4
2	2	2	3
5	5	5	5
13	13	13	13
24	24	24	24
ALTER TABLE pt_varchar_test1 RENAME COLUMN c2 TO c22;
select * from pt_varchar_test1 order by c1;
c1	c22	c3	c4
1	1	1	1
4	4	4	4
2	2	2	3
5	5	5	5
13	13	13	13
24	24	24	24
23	23	23	23
select * from pt_varchar_test1 partition(p2);
c1	c22	c3	c4
2	2	2	3
5	5	5	5
13	13	13	13
24	24	24	24
ddl_mysql  重复交换同一个分区
drop table pt_varchar_test1;
CREATE TABLE pt_varchar_test1 (
c1 INT PRIMARY KEY,
c2 varchar(30) NOT null,
c3 char(30) DEFAULT 3.14159,
c4 char(10)
)
PARTITION BY RANGE COLUMNS(c1) (
PARTITION p1 VALUES LESS THAN (10),
PARTITION p2 VALUES LESS THAN (20),
PARTITION p3 VALUES LESS THAN (30)
);
insert into pt_varchar_test1(c1,c2,c3,c4) values(1,1,1,1),(12,12,12,12),(23,23,23,23),(4,4,4,4);
drop table nt_varchar_test1;
CREATE TABLE nt_varchar_test1 (
c1 INT PRIMARY KEY,
c2 varchar(30) NOT null,
c3 char(30) DEFAULT 3.14159,
c4 char(10)
);
insert into nt_varchar_test1(c1,c2,c3,c4) values(2,2,2,3),(13,13,13,13),(24,24,24,24),(5,5,5,5);
ALTER TABLE pt_varchar_test1 EXCHANGE PARTITION p2 WITH TABLE nt_varchar_test1 WITHOUT VALIDATION;
select * from pt_varchar_test1 order by c1;
c1	c2	c3	c4
1	1	1	1
4	4	4	4
2	2	2	3
5	5	5	5
13	13	13	13
24	24	24	24
23	23	23	23
select * from pt_varchar_test1 partition(p2);
c1	c2	c3	c4
2	2	2	3
5	5	5	5
13	13	13	13
24	24	24	24
ALTER TABLE pt_varchar_test1 EXCHANGE PARTITION p2 WITH TABLE nt_varchar_test1 WITHOUT VALIDATION;
select * from pt_varchar_test1 order by c1;
c1	c2	c3	c4
1	1	1	1
4	4	4	4
12	12	12	12
23	23	23	23
select * from pt_varchar_test1 partition(p2);
c1	c2	c3	c4
12	12	12	12
ALTER TABLE pt_varchar_test1 EXCHANGE PARTITION p2 WITH TABLE nt_varchar_test1 WITHOUT VALIDATION;
select * from pt_varchar_test1 order by c1;
c1	c2	c3	c4
1	1	1	1
4	4	4	4
2	2	2	3
5	5	5	5
13	13	13	13
24	24	24	24
23	23	23	23
select * from pt_varchar_test1 partition(p2);
c1	c2	c3	c4
2	2	2	3
5	5	5	5
13	13	13	13
24	24	24	24
ddl_mysql  列操作 交换不同的二级分区 
drop table pt_varchar_test1;
CREATE TABLE pt_varchar_test1 (
c1 INT ,
c2 INT NOT null,
c3 char(30) DEFAULT 3.14159,
c4 char(10)
)
PARTITION BY RANGE COLUMNS(c1)
SUBPARTITION BY RANGE COLUMNS(c2)
SUBPARTITION TEMPLATE 
(SUBPARTITION mp0 VALUES LESS THAN(10),
SUBPARTITION mp1 VALUES LESS THAN(20),
SUBPARTITION mp2 VALUES LESS THAN(30)
)(
PARTITION p1 VALUES LESS THAN (10),
PARTITION p2 VALUES LESS THAN (20),
PARTITION p3 VALUES LESS THAN (30)
);
insert into pt_varchar_test1(c1,c2,c3,c4) values(1,1,1,1),(12,12,12,12),(23,23,23,23),(4,4,4,4);
drop table nt_varchar_test1;
CREATE TABLE nt_varchar_test1 (
c1 INT ,
c2 INT NOT null,
c3 char(30) DEFAULT 3.14159,
c4 char(10)
);
insert into nt_varchar_test1(c1,c2,c3,c4) values(6,6,6,6),(16,16,16,16),(26,26,26,26),(8,8,8,8);
select * from nt_varchar_test1;
c1	c2	c3	c4
6	6	6	6
16	16	16	16
26	26	26	26
8	8	8	8
ALTER TABLE pt_varchar_test1 EXCHANGE PARTITION p1smp0 WITH TABLE nt_varchar_test1 WITHOUT VALIDATION;
select * from pt_varchar_test1 order by c1;
c1	c2	c3	c4
6	6	6	6
8	8	8	8
12	12	12	12
16	16	16	16
23	23	23	23
26	26	26	26
select * from pt_varchar_test1 partition(p1smp0);
c1	c2	c3	c4
6	6	6	6
16	16	16	16
26	26	26	26
8	8	8	8
ALTER TABLE pt_varchar_test1 EXCHANGE PARTITION p1smp2 WITH TABLE nt_varchar_test1 WITHOUT VALIDATION;
select * from pt_varchar_test1 order by c1;
c1	c2	c3	c4
1	1	1	1
4	4	4	4
6	6	6	6
8	8	8	8
12	12	12	12
16	16	16	16
23	23	23	23
26	26	26	26
select * from pt_varchar_test1 partition(p1smp2);
c1	c2	c3	c4
1	1	1	1
4	4	4	4
ALTER TABLE pt_varchar_test1 EXCHANGE PARTITION p2smp0 WITH TABLE nt_varchar_test1 WITHOUT VALIDATION;
select * from pt_varchar_test1 order by c1;
c1	c2	c3	c4
1	1	1	1
4	4	4	4
6	6	6	6
8	8	8	8
12	12	12	12
16	16	16	16
23	23	23	23
26	26	26	26
select * from pt_varchar_test1 partition(p2smp0);
c1	c2	c3	c4
ddl_mysql  列操作 连续交换所有分区
drop table pt_varchar_test1;
CREATE TABLE pt_varchar_test1 (
c1 INT PRIMARY KEY,
c2 varchar(30) NOT null,
c3 char(30) DEFAULT 3.14159,
c4 char(10)
)
PARTITION BY RANGE COLUMNS(c1) (
PARTITION p1 VALUES LESS THAN (10),
PARTITION p2 VALUES LESS THAN (20),
PARTITION p3 VALUES LESS THAN (30)
);
insert into pt_varchar_test1(c1,c2,c3,c4) values(1,1,1,1),(12,12,12,12),(23,23,23,23),(4,4,4,4);
drop table nt_varchar_test1;
CREATE TABLE nt_varchar_test1 (
c1 INT PRIMARY KEY,
c2 varchar(30) NOT null,
c3 char(30) DEFAULT 3.14159,
c4 char(10)
);
insert into nt_varchar_test1(c1,c2,c3,c4) values(2,2,2,3),(13,13,13,13),(24,24,24,24),(5,5,5,5);
select * from nt_varchar_test1;
c1	c2	c3	c4
2	2	2	3
5	5	5	5
13	13	13	13
24	24	24	24
ALTER TABLE pt_varchar_test1 EXCHANGE PARTITION p1 WITH TABLE nt_varchar_test1 WITHOUT VALIDATION;
select * from pt_varchar_test1 order by c1;
c1	c2	c3	c4
2	2	2	3
5	5	5	5
13	13	13	13
24	24	24	24
12	12	12	12
23	23	23	23
select * from pt_varchar_test1 partition(p1) order by c1;
c1	c2	c3	c4
2	2	2	3
5	5	5	5
13	13	13	13
24	24	24	24
ALTER TABLE pt_varchar_test1 EXCHANGE PARTITION p2 WITH TABLE nt_varchar_test1 WITHOUT VALIDATION;
select * from pt_varchar_test1 order by c1;
c1	c2	c3	c4
2	2	2	3
5	5	5	5
13	13	13	13
24	24	24	24
1	1	1	1
4	4	4	4
23	23	23	23
select * from pt_varchar_test1 partition(p2);
c1	c2	c3	c4
1	1	1	1
4	4	4	4
ALTER TABLE pt_varchar_test1 EXCHANGE PARTITION p3 WITH TABLE nt_varchar_test1 WITHOUT VALIDATION;
select * from pt_varchar_test1 order by c1;
c1	c2	c3	c4
2	2	2	3
5	5	5	5
13	13	13	13
24	24	24	24
1	1	1	1
4	4	4	4
12	12	12	12
select * from pt_varchar_test1 partition(p3);
c1	c2	c3	c4
12	12	12	12
ddl_mysql  列操作 同一个PT表交换不同的NT表
drop table  pt_varchar_test1;
CREATE TABLE pt_varchar_test1 (
c1 INT PRIMARY KEY,
c2 varchar(30) NOT null,
c3 char(30) DEFAULT 3.14159,
c4 char(10)
)
PARTITION BY RANGE COLUMNS(c1) (
PARTITION p1 VALUES LESS THAN (10),
PARTITION p2 VALUES LESS THAN (20),
PARTITION p3 VALUES LESS THAN (30)
);
insert into pt_varchar_test1(c1,c2,c3,c4) values(1,1,1,1),(12,12,12,12),(23,23,23,23),(4,4,4,4);
drop table nt_varchar_test1;
CREATE TABLE nt_varchar_test1 (
c1 INT PRIMARY KEY,
c2 varchar(30) NOT null,
c3 char(30) DEFAULT 3.14159,
c4 char(10)
);
insert into nt_varchar_test1(c1,c2,c3,c4) values(2,2,2,3),(13,13,13,13),(24,24,24,24),(5,5,5,5);
drop table nt_varchar_test2;
CREATE TABLE nt_varchar_test2 (
c1 INT PRIMARY KEY,
c2 varchar(30) NOT null,
c3 char(30) DEFAULT 3.14159,
c4 char(10)
);
insert into nt_varchar_test2(c1,c2,c3,c4) values(6,6,6,6),(16,16,16,16),(26,26,26,26),(8,8,8,8);
select * from nt_varchar_test1;
c1	c2	c3	c4
2	2	2	3
5	5	5	5
13	13	13	13
24	24	24	24
ALTER TABLE pt_varchar_test1 EXCHANGE PARTITION p1 WITH TABLE nt_varchar_test1 WITHOUT VALIDATION;
select * from pt_varchar_test1 order by c1;
c1	c2	c3	c4
2	2	2	3
5	5	5	5
13	13	13	13
24	24	24	24
12	12	12	12
23	23	23	23
select * from pt_varchar_test1 partition(p1) order by c1;
c1	c2	c3	c4
2	2	2	3
5	5	5	5
13	13	13	13
24	24	24	24
ALTER TABLE pt_varchar_test1 EXCHANGE PARTITION p2 WITH TABLE nt_varchar_test2 WITHOUT VALIDATION;
select * from pt_varchar_test1 order by c1;
c1	c2	c3	c4
2	2	2	3
5	5	5	5
13	13	13	13
24	24	24	24
6	6	6	6
8	8	8	8
16	16	16	16
26	26	26	26
23	23	23	23
select * from pt_varchar_test1 partition(p2);
c1	c2	c3	c4
6	6	6	6
8	8	8	8
16	16	16	16
26	26	26	26
ALTER TABLE pt_varchar_test1 EXCHANGE PARTITION p3 WITH TABLE nt_varchar_test2 WITHOUT VALIDATION;
select * from pt_varchar_test1 order by c1;
c1	c2	c3	c4
2	2	2	3
5	5	5	5
13	13	13	13
24	24	24	24
6	6	6	6
8	8	8	8
16	16	16	16
26	26	26	26
12	12	12	12
select * from pt_varchar_test1 partition(p3);
c1	c2	c3	c4
12	12	12	12
ddl_mysql  列操作 添加新分区到交换后的分区表(add partition)
drop table  pt_varchar_test1;
CREATE TABLE pt_varchar_test1 (
c1 INT PRIMARY KEY,
c2 varchar(30) NOT null,
c3 char(30) DEFAULT 3.14159,
c4 char(10)
)
PARTITION BY RANGE COLUMNS(c1) (
PARTITION p1 VALUES LESS THAN (10),
PARTITION p2 VALUES LESS THAN (20),
PARTITION p3 VALUES LESS THAN (30)
);
insert into pt_varchar_test1(c1,c2,c3,c4) values(1,1,1,1),(12,12,12,12),(23,23,23,23),(4,4,4,4);
drop table nt_varchar_test1;
CREATE TABLE nt_varchar_test1 (
c1 INT PRIMARY KEY,
c2 varchar(30) NOT null,
c3 char(30) DEFAULT 3.14159,
c4 char(10)
);
insert into nt_varchar_test1(c1,c2,c3,c4) values(2,2,2,2),(13,13,13,13),(24,24,24,24),(5,5,5,5);
select * from nt_varchar_test1;
c1	c2	c3	c4
2	2	2	2
5	5	5	5
13	13	13	13
24	24	24	24
ALTER TABLE pt_varchar_test1 EXCHANGE PARTITION p1 WITH TABLE nt_varchar_test1 WITHOUT VALIDATION;
select * from pt_varchar_test1 order by c1;
c1	c2	c3	c4
2	2	2	2
5	5	5	5
13	13	13	13
24	24	24	24
12	12	12	12
23	23	23	23
select * from pt_varchar_test1 partition(p1) order by c1;
c1	c2	c3	c4
2	2	2	2
5	5	5	5
13	13	13	13
24	24	24	24
ALTER TABLE pt_varchar_test1 ADD PARTITION (PARTITION p4 VALUES LESS THAN (40));
select * from pt_varchar_test1 order by c1;
c1	c2	c3	c4
2	2	2	2
5	5	5	5
13	13	13	13
24	24	24	24
12	12	12	12
23	23	23	23
select * from pt_varchar_test1 partition(p1) order by c1;
c1	c2	c3	c4
2	2	2	2
5	5	5	5
13	13	13	13
24	24	24	24
select * from pt_varchar_test1 partition(p4);
c1	c2	c3	c4
ddl_mysql  列操作 删除或清空旧分区(drop/truncate partition)
drop table  pt_varchar_test1;
CREATE TABLE pt_varchar_test1 (
c1 INT ,
c2 INT NOT null,
c3 char(30) DEFAULT 3.14159,
c4 char(10)
)
PARTITION BY RANGE COLUMNS(c1)
SUBPARTITION BY RANGE COLUMNS(c2)
SUBPARTITION TEMPLATE 
(SUBPARTITION mp0 VALUES LESS THAN(10),
SUBPARTITION mp1 VALUES LESS THAN(20),
SUBPARTITION mp2 VALUES LESS THAN(30)
)(
PARTITION p1 VALUES LESS THAN (10),
PARTITION p2 VALUES LESS THAN (20),
PARTITION p3 VALUES LESS THAN (30)
);
insert into pt_varchar_test1(c1,c2,c3,c4) values(1,1,1,1),(12,12,12,12),(23,23,23,23),(4,4,4,4);
drop table nt_varchar_test1;
CREATE TABLE nt_varchar_test1 (
c1 INT ,
c2 INT NOT null,
c3 char(30) DEFAULT 3.14159,
c4 char(10)
);
insert into nt_varchar_test1(c1,c2,c3,c4) values(6,6,6,6),(16,16,16,16),(26,26,26,26),(8,8,8,8);
ALTER TABLE pt_varchar_test1 EXCHANGE PARTITION p1smp0 WITH TABLE nt_varchar_test1 WITHOUT VALIDATION;
select * from pt_varchar_test1 order by c1;
c1	c2	c3	c4
6	6	6	6
8	8	8	8
12	12	12	12
16	16	16	16
23	23	23	23
26	26	26	26
select * from pt_varchar_test1 partition(p1smp0);
c1	c2	c3	c4
6	6	6	6
16	16	16	16
26	26	26	26
8	8	8	8
ALTER TABLE pt_varchar_test1 TRUNCATE PARTITION p1;
select * from pt_varchar_test1 order by c1;
c1	c2	c3	c4
12	12	12	12
23	23	23	23
select * from pt_varchar_test1 partition(p1) order by c1;
c1	c2	c3	c4
ddl_mysql  列操作 对新分区表添加并行度
drop table  pt_varchar_test1;
CREATE TABLE pt_varchar_test1 (
c1 INT PRIMARY KEY,
c2 varchar(30) NOT null,
c3 char(30) DEFAULT 3.14159,
c4 char(10)
)
PARTITION BY RANGE COLUMNS(c1) (
PARTITION p1 VALUES LESS THAN (10),
PARTITION p2 VALUES LESS THAN (20),
PARTITION p3 VALUES LESS THAN (30)
);
insert into pt_varchar_test1(c1,c2,c3,c4) values(1,1,1,1),(12,12,12,12),(23,23,23,23),(4,4,4,4);
drop table nt_varchar_test1;
CREATE TABLE nt_varchar_test1 (
c1 INT PRIMARY KEY,
c2 varchar(30) NOT null,
c3 char(30) DEFAULT 3.14159,
c4 char(10)
);
insert into nt_varchar_test1(c1,c2,c3,c4) values(2,2,2,2),(13,13,13,13),(24,24,24,24),(5,5,5,5);
select * from nt_varchar_test1;
c1	c2	c3	c4
2	2	2	2
5	5	5	5
13	13	13	13
24	24	24	24
ALTER TABLE pt_varchar_test1 EXCHANGE PARTITION p1 WITH TABLE nt_varchar_test1 WITHOUT VALIDATION;
select * from pt_varchar_test1 order by c1;
c1	c2	c3	c4
2	2	2	2
5	5	5	5
13	13	13	13
24	24	24	24
12	12	12	12
23	23	23	23
select * from pt_varchar_test1 partition(p1) order by c1;
c1	c2	c3	c4
2	2	2	2
5	5	5	5
13	13	13	13
24	24	24	24
ALTER TABLE pt_varchar_test1 PARALLEL 4;
select * from pt_varchar_test1 partition(p1) order by c1;
c1	c2	c3	c4
2	2	2	2
5	5	5	5
13	13	13	13
24	24	24	24
select * from pt_varchar_test1 partition(p3);
c1	c2	c3	c4
23	23	23	23
ALTER TABLE pt_varchar_test1 EXCHANGE PARTITION p1 WITH TABLE nt_varchar_test1 WITHOUT VALIDATION;
select * from pt_varchar_test1 partition(p1) order by c1;
c1	c2	c3	c4
1	1	1	1
4	4	4	4
ALTER TABLE pt_varchar_test1 EXCHANGE PARTITION p1 WITH TABLE nt_varchar_test1 WITHOUT VALIDATION;
select * from pt_varchar_test1 partition(p1) order by c1;
c1	c2	c3	c4
2	2	2	2
5	5	5	5
13	13	13	13
24	24	24	24
ddl_mysql  压缩新分区(compress partition)
ALTER TABLE pt_varchar_test1  ROW_FORMAT = DYNAMIC;
select * from pt_varchar_test1 partition(p1) order by c1;
c1	c2	c3	c4
2	2	2	2
5	5	5	5
13	13	13	13
24	24	24	24
ALTER TABLE pt_varchar_test1 EXCHANGE PARTITION p1 WITH TABLE nt_varchar_test1 WITHOUT VALIDATION;
select * from pt_varchar_test1 partition(p1) order by c1;
c1	c2	c3	c4
1	1	1	1
4	4	4	4
alter table pt_varchar_test1 set row_format = redundant compression = 'lz4_1.0';
alter table nt_varchar_test1 set row_format = redundant compression = 'lz4_1.0';
ALTER TABLE pt_varchar_test1 EXCHANGE PARTITION p1 WITH TABLE nt_varchar_test1 WITHOUT VALIDATION;
select * from pt_varchar_test1 partition(p1) order by c1;
c1	c2	c3	c4
2	2	2	2
5	5	5	5
13	13	13	13
24	24	24	24
ALTER TABLE pt_varchar_test1  ROW_FORMAT = compact;
ALTER TABLE nt_varchar_test1  ROW_FORMAT = compact;
ALTER TABLE pt_varchar_test1 EXCHANGE PARTITION p1 WITH TABLE nt_varchar_test1 WITHOUT VALIDATION;
select * from pt_varchar_test1 partition(p1) order by c1;
c1	c2	c3	c4
1	1	1	1
4	4	4	4
ALTER TABLE pt_varchar_test1  ROW_FORMAT = compressed;
ALTER TABLE nt_varchar_test1  ROW_FORMAT = compressed;
ALTER TABLE pt_varchar_test1 EXCHANGE PARTITION p1 WITH TABLE nt_varchar_test1 WITHOUT VALIDATION;
select * from pt_varchar_test1 partition(p1) order by c1;
c1	c2	c3	c4
2	2	2	2
5	5	5	5
13	13	13	13
24	24	24	24
ALTER TABLE pt_varchar_test1  ROW_FORMAT = default;
ALTER TABLE nt_varchar_test1  ROW_FORMAT = default;
ALTER TABLE pt_varchar_test1 EXCHANGE PARTITION p1 WITH TABLE nt_varchar_test1 WITHOUT VALIDATION;
select * from pt_varchar_test1 partition(p1) order by c1;
c1	c2	c3	c4
1	1	1	1
4	4	4	4
ddl_mysql  创建视图/复制表  
CREATE OR REPLACE VIEW pt_v AS SELECT * FROM pt_varchar_test1 WHERE c1 > 0 WITH LOCAL CHECK OPTION;
select * from pt_v order by c1;
c1	c2	c3	c4
1	1	1	1
4	4	4	4
12	12	12	12
23	23	23	23
select * from pt_v partition(p1) order by c1;
c1	c2	c3	c4
1	1	1	1
4	4	4	4
12	12	12	12
23	23	23	23
select * from pt_varchar_test1 order by c1;
c1	c2	c3	c4
1	1	1	1
4	4	4	4
12	12	12	12
23	23	23	23
select * from pt_varchar_test1 partition(p1) order by c1;
c1	c2	c3	c4
1	1	1	1
4	4	4	4
CREATE OR REPLACE VIEW nt_v AS SELECT * FROM nt_varchar_test1 WHERE c1 > 0 WITH LOCAL CHECK OPTION;
ALTER TABLE pt_varchar_test1 EXCHANGE PARTITION p1 WITH TABLE nt_v WITHOUT VALIDATION;
ERROR 0A000: alter table type not supported
select * from nt_v;
c1	c2	c3	c4
2	2	2	2
5	5	5	5
13	13	13	13
24	24	24	24
select * from pt_varchar_test1 order by c1;
c1	c2	c3	c4
1	1	1	1
4	4	4	4
12	12	12	12
23	23	23	23
select * from pt_varchar_test1 partition(p1) order by c1;
c1	c2	c3	c4
1	1	1	1
4	4	4	4
ddl_mysql  创建索引
ALTER TABLE pt_varchar_test1 EXCHANGE PARTITION p1 WITH TABLE nt_varchar_test1 WITHOUT VALIDATION;
CREATE INDEX pt_idx1 ON pt_varchar_test1(c1);
select * from pt_varchar_test1 partition(p1) order by c1;
c1	c2	c3	c4
2	2	2	2
5	5	5	5
13	13	13	13
24	24	24	24
DROP INDEX pt_idx1 ON pt_varchar_test1;
ALTER TABLE pt_varchar_test1 EXCHANGE PARTITION p1 WITH TABLE nt_varchar_test1 WITHOUT VALIDATION;
drop table pt_t;
CREATE  table pt_t AS SELECT * FROM pt_varchar_test1 WHERE c1 > 0 ;
drop table pt_t;
CREATE  table pt_t like pt_varchar_test1 ;
TRUNCATE TABLE pt_varchar_test1;
dml_mysql  insert
drop table  pt_varchar_test1;
CREATE TABLE pt_varchar_test1 (
c1 INT PRIMARY KEY,
c2 BINARY(16) NOT null,
c3 VARBINARY(16),
c4 char(10)
)
PARTITION BY RANGE COLUMNS(c1) (
PARTITION p1 VALUES LESS THAN (10),
PARTITION p2 VALUES LESS THAN (20),
PARTITION p3 VALUES LESS THAN (30)
);
insert into pt_varchar_test1(c1,c2,c3,c4) values(1,UNHEX('4D7953514C'), UNHEX('4D7953514C'),1),(12,UNHEX('5465737444617461'),UNHEX('5465737444617461'),12),(23,UNHEX('42696E61727944617461'), UNHEX('42696E61727944617461'),23);
drop table nt_varchar_test1;
CREATE TABLE nt_varchar_test1 (
c1 INT PRIMARY KEY,
c2 BINARY(16) NOT null,
c3 VARBINARY(16),
c4 char(10)
);
insert into nt_varchar_test1(c1,c2,c3,c4) values(2,UNHEX('4D7953514C'), UNHEX('4D7953514C'),2),(13,UNHEX('5465737444617461'),UNHEX('5465737444617461'),13),(24,UNHEX('42696E61727944617461'), UNHEX('42696E61727944617461'),24);
ALTER TABLE pt_varchar_test1 EXCHANGE PARTITION p1 WITH TABLE nt_varchar_test1 WITHOUT VALIDATION;
select * from pt_varchar_test1 order by c1;
c1	c2	c3	c4
2	MySQL           	MySQL	2
13	TestData        	TestData	13
24	BinaryData      	BinaryData	24
12	TestData        	TestData	12
23	BinaryData      	BinaryData	23
select * from pt_varchar_test1 partition(p1) order by c1;
c1	c2	c3	c4
2	MySQL           	MySQL	2
13	TestData        	TestData	13
24	BinaryData      	BinaryData	24
insert into pt_varchar_test1(c1,c2,c3,c4) values(3,UNHEX('4D7953514C'), UNHEX('4D7953514C'),3);
select * from pt_varchar_test1 partition(p1) order by c1;
c1	c2	c3	c4
2	MySQL           	MySQL	2
3	MySQL           	MySQL	3
13	TestData        	TestData	13
24	BinaryData      	BinaryData	24
insert into nt_varchar_test1(c1,c2,c3,c4) values(14,UNHEX('5465737444617461'),UNHEX('5465737444617461'),14);
insert into nt_varchar_test1(c1,c3,c4) values(15,UNHEX('5465737444617461'),15);
ERROR HY000: Field 'c2' doesn't have a default value
select * from pt_varchar_test1 partition(p1) order by c1;
c1	c2	c3	c4
2	MySQL           	MySQL	2
3	MySQL           	MySQL	3
13	TestData        	TestData	13
24	BinaryData      	BinaryData	24
dml_mysql  update
UPDATE pt_varchar_test1 SET c1 = 4 ORDER BY c2 LIMIT 2;
ERROR HY000: fatal internal error in [check_old_row_legitimacy]
UPDATE pt_varchar_test1 SET c1 = 4 where c1 = 13;
select * from pt_varchar_test1 partition(p1) order by c1;
c1	c2	c3	c4
2	MySQL           	MySQL	2
3	MySQL           	MySQL	3
13	TestData        	TestData	13
24	BinaryData      	BinaryData	24
一起不进行数据校验，所以ob不报错， mysql 报错
UPDATE pt_varchar_test1 PARTITION(P1) SET c4 = 5 WHERE c1 > 1;
select * from pt_varchar_test1 partition(p1) order by c1;
c1	c2	c3	c4
2	MySQL           	MySQL	5
3	MySQL           	MySQL	5
13	TestData        	TestData	5
24	BinaryData      	BinaryData	5
dml_mysql  datele
delete from pt_varchar_test1 where c1 = 13;
select * from pt_varchar_test1 partition(p1) order by c1;
c1	c2	c3	c4
2	MySQL           	MySQL	5
3	MySQL           	MySQL	5
13	TestData        	TestData	5
24	BinaryData      	BinaryData	5
delete from pt_varchar_test1 where c2 = UNHEX('5465737444617461');
select * from pt_varchar_test1 partition(p1) order by c1;
c1	c2	c3	c4
2	MySQL           	MySQL	5
3	MySQL           	MySQL	5
13	TestData        	TestData	5
24	BinaryData      	BinaryData	5
delete from pt_varchar_test1;
select * from pt_varchar_test1 order by c1;
c1	c2	c3	c4
