result_format: 4
####ddl####
CREATE TABLE T1(C1 DECIMAL,C2 DECIMAL(10,10),C3 DECIMAL(0),C4 DECIMAL(65),C5 DECIMAL(65,30),C6 DECIMAL(3,2),C7 DECIMAL(0,0));
INSERT INTO T1 VALUES (NULL,NULL,NULL,NULL,NULL,NULL,NULL);
INSERT INTO T1 VALUES (0,0,0,0,0,0,0);
INSERT INTO T1 VALUES (0.123,0.123,0.123,0.123,0.123,0.123,0.123);
Warnings:
Warning	1265	Data truncated for column 'C1' at row 1
Warning	1265	Data truncated for column 'C3' at row 1
Warning	1265	Data truncated for column 'C4' at row 1
Warning	1265	Data truncated for column 'C6' at row 1
Warning	1265	Data truncated for column 'C7' at row 1
INSERT INTO T1 VALUES (1e-30,1e-30,1e-30,1e-30,1e-30,1e-30,1e-30);
Warnings:
Warning	1265	Data truncated for column 'C1' at row 1
Warning	1265	Data truncated for column 'C2' at row 1
Warning	1265	Data truncated for column 'C3' at row 1
Warning	1265	Data truncated for column 'C4' at row 1
Warning	1265	Data truncated for column 'C6' at row 1
Warning	1265	Data truncated for column 'C7' at row 1
INSERT INTO T1(C1,C3,C4,C5,C6,C7) VALUES(01,01,01,01,01,01);
INSERT INTO T1(C1,C3,C4,C5,C6,C7) VALUES(-1,-1,-1,-1,-1,-1);
INSERT INTO T1(C1,C2,C3,C4,C5,C6,C7) VALUES(-0.1,-0.1,-0.1,-0.1,-0.1,-0.1,-0.1);
Warnings:
Warning	1265	Data truncated for column 'C1' at row 1
Warning	1265	Data truncated for column 'C3' at row 1
Warning	1265	Data truncated for column 'C4' at row 1
Warning	1265	Data truncated for column 'C7' at row 1
INSERT INTO T1(C4) VALUES(1e+64);
INSERT INTO T1(C4) VALUES(-1e+64);
INSERT INTO T1(C1,C3,C4,C5,C7) VALUES(01010,01010,01010,01010,01010);
INSERT INTO T1(C1,C3,C4,C5,C7) VALUES(b'01010101010101',b'01010101010101',b'01010101010101',b'01010101010101',b'01010101010101');
SELECT * FROM T1;
+------+---------------+------+--------------------------------------------------------------------+-------------------------------------+-------+------+
| C1   | C2            | C3   | C4                                                                 | C5                                  | C6    | C7   |
+------+---------------+------+--------------------------------------------------------------------+-------------------------------------+-------+------+
| NULL |          NULL | NULL |                                                               NULL |                                NULL |  NULL | NULL |
|    0 |  0.0000000000 |    0 |                                                                  0 |    0.000000000000000000000000000000 |  0.00 |    0 |
|    0 |  0.1230000000 |    0 |                                                                  0 |    0.123000000000000000000000000000 |  0.12 |    0 |
|    0 |  0.0000000000 |    0 |                                                                  0 |    0.000000000000000000000000000001 |  0.00 |    0 |
|    1 |          NULL |    1 |                                                                  1 |    1.000000000000000000000000000000 |  1.00 |    1 |
|   -1 |          NULL |   -1 |                                                                 -1 |   -1.000000000000000000000000000000 | -1.00 |   -1 |
|    0 | -0.1000000000 |    0 |                                                                  0 |   -0.100000000000000000000000000000 | -0.10 |    0 |
| NULL |          NULL | NULL |  10000000000000000000000000000000000000000000000000000000000000000 |                                NULL |  NULL | NULL |
| NULL |          NULL | NULL | -10000000000000000000000000000000000000000000000000000000000000000 |                                NULL |  NULL | NULL |
| 1010 |          NULL | 1010 |                                                               1010 | 1010.000000000000000000000000000000 |  NULL | 1010 |
| 5461 |          NULL | 5461 |                                                               5461 | 5461.000000000000000000000000000000 |  NULL | 5461 |
+------+---------------+------+--------------------------------------------------------------------+-------------------------------------+-------+------+
DELETE FROM T1 WHERE C4 = 1E+64 OR C4 = -1E+64;
##create table as##
CREATE TABLE T2 AS SELECT C1 + 2 FROM T1;
DESC T2;
+--------+---------------+------+-----+---------+-------+
| Field  | Type          | Null | Key | Default | Extra |
+--------+---------------+------+-----+---------+-------+
| C1 + 2 | decimal(11,0) | YES  |     | NULL    |       |
+--------+---------------+------+-----+---------+-------+
DROP TABLE IF EXISTS T2;
CREATE TABLE T2 AS SELECT C1 + 2 C1,C2+2 C2,C3+2 C3,C4+2 C4,C5+2 C5,C6+2 C6,C7+2 C7 FROM T1;
DESC T2;
+-------+----------------+------+-----+---------+-------+
| Field | Type           | Null | Key | Default | Extra |
+-------+----------------+------+-----+---------+-------+
| C1    | decimal(11,0)  | YES  |     | NULL    |       |
| C2    | decimal(12,10) | YES  |     | NULL    |       |
| C3    | decimal(11,0)  | YES  |     | NULL    |       |
| C4    | decimal(65,0)  | YES  |     | NULL    |       |
| C5    | decimal(65,30) | YES  |     | NULL    |       |
| C6    | decimal(4,2)   | YES  |     | NULL    |       |
| C7    | decimal(11,0)  | YES  |     | NULL    |       |
+-------+----------------+------+-----+---------+-------+
DROP TABLE IF EXISTS T2;
CREATE TABLE T2 AS SELECT C1 - 2 C1,C2-2 C2,C3-2 C3,C4-2 C4,C5-2 C5,C6-2 C6,C7-2 C7 FROM T1;
DESC T2;
+-------+----------------+------+-----+---------+-------+
| Field | Type           | Null | Key | Default | Extra |
+-------+----------------+------+-----+---------+-------+
| C1    | decimal(11,0)  | YES  |     | NULL    |       |
| C2    | decimal(12,10) | YES  |     | NULL    |       |
| C3    | decimal(11,0)  | YES  |     | NULL    |       |
| C4    | decimal(65,0)  | YES  |     | NULL    |       |
| C5    | decimal(65,30) | YES  |     | NULL    |       |
| C6    | decimal(4,2)   | YES  |     | NULL    |       |
| C7    | decimal(11,0)  | YES  |     | NULL    |       |
+-------+----------------+------+-----+---------+-------+
DROP TABLE IF EXISTS T2;
CREATE TABLE T2 AS SELECT C1 * 2 C1,C2*2 C2,C3*2 C3,C4*2 C4,C5*2 C5,C6*2 C6,C7*2 C7 FROM T1;
DESC T2;
+-------+----------------+------+-----+---------+-------+
| Field | Type           | Null | Key | Default | Extra |
+-------+----------------+------+-----+---------+-------+
| C1    | decimal(11,0)  | YES  |     | NULL    |       |
| C2    | decimal(11,10) | YES  |     | NULL    |       |
| C3    | decimal(11,0)  | YES  |     | NULL    |       |
| C4    | decimal(65,0)  | YES  |     | NULL    |       |
| C5    | decimal(65,30) | YES  |     | NULL    |       |
| C6    | decimal(4,2)   | YES  |     | NULL    |       |
| C7    | decimal(11,0)  | YES  |     | NULL    |       |
+-------+----------------+------+-----+---------+-------+
DROP TABLE IF EXISTS T2;
CREATE TABLE T2 AS SELECT C1 / 2 C1,C2/2 C2,C3/2 C3,C4/2 C4,C5/2 C5,C6/2 C6,C7/2 C7 FROM T1;
DESC T2;
+-------+----------------+------+-----+---------+-------+
| Field | Type           | Null | Key | Default | Extra |
+-------+----------------+------+-----+---------+-------+
| C1    | decimal(14,4)  | YES  |     | NULL    |       |
| C2    | decimal(14,14) | YES  |     | NULL    |       |
| C3    | decimal(14,4)  | YES  |     | NULL    |       |
| C4    | decimal(65,4)  | YES  |     | NULL    |       |
| C5    | decimal(65,30) | YES  |     | NULL    |       |
| C6    | decimal(7,6)   | YES  |     | NULL    |       |
| C7    | decimal(14,4)  | YES  |     | NULL    |       |
+-------+----------------+------+-----+---------+-------+
DROP TABLE IF EXISTS T2;
CREATE TABLE T2 AS SELECT C1 % 2 C1,C2%2 C2,C3%2 C3,C4%2 C4,C5%2 C5,C6%2 C6,C7%2 C7 FROM T1;
DESC T2;
+-------+----------------+------+-----+---------+-------+
| Field | Type           | Null | Key | Default | Extra |
+-------+----------------+------+-----+---------+-------+
| C1    | decimal(10,0)  | YES  |     | NULL    |       |
| C2    | decimal(11,10) | YES  |     | NULL    |       |
| C3    | decimal(10,0)  | YES  |     | NULL    |       |
| C4    | decimal(65,0)  | YES  |     | NULL    |       |
| C5    | decimal(65,30) | YES  |     | NULL    |       |
| C6    | decimal(3,2)   | YES  |     | NULL    |       |
| C7    | decimal(10,0)  | YES  |     | NULL    |       |
+-------+----------------+------+-----+---------+-------+
DROP TABLE IF EXISTS T2;
CREATE TABLE T2 AS SELECT C1 MOD 2 C1,C2 MOD 2 C2,C3 MOD 2 C3,C4 MOD 2 C4,C5 MOD 2 C5,C6 MOD 2 C6,C7 MOD 2 C7 FROM T1;
DESC T2;
+-------+----------------+------+-----+---------+-------+
| Field | Type           | Null | Key | Default | Extra |
+-------+----------------+------+-----+---------+-------+
| C1    | decimal(10,0)  | YES  |     | NULL    |       |
| C2    | decimal(11,10) | YES  |     | NULL    |       |
| C3    | decimal(10,0)  | YES  |     | NULL    |       |
| C4    | decimal(65,0)  | YES  |     | NULL    |       |
| C5    | decimal(65,30) | YES  |     | NULL    |       |
| C6    | decimal(3,2)   | YES  |     | NULL    |       |
| C7    | decimal(10,0)  | YES  |     | NULL    |       |
+-------+----------------+------+-----+---------+-------+
DROP TABLE IF EXISTS T2;
CREATE TABLE T2 AS SELECT C1 ^ 2 C1,C2 ^ 2 C2,C3 ^ 2 C3,C4 ^ 2 C4,C5 ^ 2 C5,C6 ^ 2 C6,C7 ^ 2 C7 FROM T1;
DESC T2;
+-------+---------------------+------+-----+---------+-------+
| Field | Type                | Null | Key | Default | Extra |
+-------+---------------------+------+-----+---------+-------+
| C1    | bigint(20) unsigned | YES  |     | NULL    |       |
| C2    | bigint(20) unsigned | YES  |     | NULL    |       |
| C3    | bigint(20) unsigned | YES  |     | NULL    |       |
| C4    | bigint(20) unsigned | YES  |     | NULL    |       |
| C5    | bigint(20) unsigned | YES  |     | NULL    |       |
| C6    | bigint(20) unsigned | YES  |     | NULL    |       |
| C7    | bigint(20) unsigned | YES  |     | NULL    |       |
+-------+---------------------+------+-----+---------+-------+
DROP TABLE IF EXISTS T2;
CREATE TABLE T2 AS SELECT C1 & 2 C1,C2 & 2 C2,C3 & 2 C3,C4 & 2 C4,C5 & 2 C5,C6 & 2 C6,C7 & 2 C7 FROM T1;
DESC T2;
+-------+---------------------+------+-----+---------+-------+
| Field | Type                | Null | Key | Default | Extra |
+-------+---------------------+------+-----+---------+-------+
| C1    | bigint(20) unsigned | YES  |     | NULL    |       |
| C2    | bigint(20) unsigned | YES  |     | NULL    |       |
| C3    | bigint(20) unsigned | YES  |     | NULL    |       |
| C4    | bigint(20) unsigned | YES  |     | NULL    |       |
| C5    | bigint(20) unsigned | YES  |     | NULL    |       |
| C6    | bigint(20) unsigned | YES  |     | NULL    |       |
| C7    | bigint(20) unsigned | YES  |     | NULL    |       |
+-------+---------------------+------+-----+---------+-------+
DROP TABLE IF EXISTS T2;
CREATE TABLE T2 AS SELECT C1 >> 2 C1,C2 >> 2 C2,C3 >> 2 C3,C4 >> 2 C4,C5 >> 2 C5,C6 >> 2 C6,C7 >> 2 C7 FROM T1;
DESC T2;
+-------+---------------------+------+-----+---------+-------+
| Field | Type                | Null | Key | Default | Extra |
+-------+---------------------+------+-----+---------+-------+
| C1    | bigint(20) unsigned | YES  |     | NULL    |       |
| C2    | bigint(20) unsigned | YES  |     | NULL    |       |
| C3    | bigint(20) unsigned | YES  |     | NULL    |       |
| C4    | bigint(20) unsigned | YES  |     | NULL    |       |
| C5    | bigint(20) unsigned | YES  |     | NULL    |       |
| C6    | bigint(20) unsigned | YES  |     | NULL    |       |
| C7    | bigint(20) unsigned | YES  |     | NULL    |       |
+-------+---------------------+------+-----+---------+-------+
DROP TABLE IF EXISTS T2;
CREATE TABLE T2 AS SELECT C1 << 2 C1,C2 << 2 C2,C3 << 2 C3,C4 << 2 C4,C5 << 2 C5,C6 << 2 C6,C7 << 2 C7 FROM T1;
DESC T2;
+-------+---------------------+------+-----+---------+-------+
| Field | Type                | Null | Key | Default | Extra |
+-------+---------------------+------+-----+---------+-------+
| C1    | bigint(20) unsigned | YES  |     | NULL    |       |
| C2    | bigint(20) unsigned | YES  |     | NULL    |       |
| C3    | bigint(20) unsigned | YES  |     | NULL    |       |
| C4    | bigint(20) unsigned | YES  |     | NULL    |       |
| C5    | bigint(20) unsigned | YES  |     | NULL    |       |
| C6    | bigint(20) unsigned | YES  |     | NULL    |       |
| C7    | bigint(20) unsigned | YES  |     | NULL    |       |
+-------+---------------------+------+-----+---------+-------+
##CREATE VIEW AS SELECT##
CREATE VIEW V2 AS SELECT C1 + 2 FROM T1;
DESC V2;
+--------+---------------+------+-----+---------+-------+
| Field  | Type          | Null | Key | Default | Extra |
+--------+---------------+------+-----+---------+-------+
| C1 + 2 | decimal(11,0) | YES  |     | NULL    |       |
+--------+---------------+------+-----+---------+-------+
DROP VIEW IF EXISTS V2;
CREATE VIEW V2 AS SELECT ROUND(C1) FROM T1;
DESC V2;
+-----------+---------------+------+-----+---------+-------+
| Field     | Type          | Null | Key | Default | Extra |
+-----------+---------------+------+-----+---------+-------+
| ROUND(C1) | decimal(11,0) | YES  |     | NULL    |       |
+-----------+---------------+------+-----+---------+-------+
##INDEX##
CREATE INDEX IN_DE_1 ON T1(C1);
CREATE INDEX IN_DE_2 ON T1(C1,C2 ASC);
CREATE INDEX IN_DE_3 ON T1(C1,C2,C3,C4,C5,C6,C7);
ALTER TABLE T1 DROP INDEX IN_DE_1;
ALTER TABLE T1 DROP INDEX IN_DE_2;
ALTER TABLE T1 DROP INDEX IN_DE_3;
ALTER TABLE T1 ADD INDEX IN_DE_1 (C1);
ALTER TABLE T1 ADD INDEX IN_DE_2 (C1,C2 ASC);
ALTER TABLE T1 ADD INDEX IN_DE_3 (C1,C2,C3,C4,C5,C6,C7);
ALTER TABLE T1 DROP INDEX IN_DE_1;
ALTER TABLE T1 DROP INDEX IN_DE_2;
ALTER TABLE T1 DROP INDEX IN_DE_3;
##PRIMARY##
drop table T4;
CREATE TABLE T4 (C1 DECIMAL PRIMARY KEY);
INSERT INTO T4 VALUES(NULL);
ERROR 23000: Column 'C1' cannot be null
INSERT INTO T4 VALUES(1.2);
Warnings:
Warning	1265	Data truncated for column 'C1' at row 1
INSERT INTO T4 VALUES(1.3);
ERROR 23000: Duplicate entry '1' for key 'PRIMARY'
DROP TABLE IF EXISTS T4;
CREATE TABLE T4(C1 DECIMAL,C2 DECIMAL(10,10),C3 DECIMAL(0),C4 DECIMAL(65),C5 DECIMAL(65,30),C6 DECIMAL(3,2),C7 DECIMAL(0,0));
ALTER TABLE T4 ADD PRIMARY KEY(C1);
ALTER TABLE T4 DROP PRIMARY KEY,ADD PRIMARY KEY(C1,C2,C3,C4,C5,C6,C7);
ALTER TABLE T4 DROP PRIMARY KEY;
##UNIQUE##
drop table T4;
CREATE TABLE T4 (C1 DECIMAL UNIQUE);
INSERT INTO T4 VALUES(1.2);
Warnings:
Warning	1265	Data truncated for column 'C1' at row 1
INSERT INTO T4 VALUES(1.2);
ERROR 23000: Duplicate entry '1' for key 'C1'
drop table T4;
CREATE TABLE T4 (C1 DECIMAL ,C2 DECIMAL(10,10));
ALTER TABLE T4 ADD CONSTRAINT UN_KEY UNIQUE(C1);
ALTER TABLE T4 DROP INDEX UN_KEY;
ALTER TABLE T4 ADD CONSTRAINT UN_KEY UNIQUE(C1,C2);
INSERT INTO T4 VALUES(1.2,0);
Warnings:
Warning	1265	Data truncated for column 'C1' at row 1
INSERT INTO T4 VALUES(1.3,-0);
ERROR 23000: Duplicate entry '1-0.0000000000' for key 'UN_KEY'
ALTER TABLE T4 DROP INDEX UN_KEY;
drop table T4;
CREATE TABLE T4 (C1 DECIMAL PRIMARY KEY,C2 DECIMAL(10,10) UNIQUE);
ALTER TABLE T4 MODIFY C1 DECIMAL(65) UNIQUE;
ALTER TABLE T4 DROP PRIMARY KEY;
ALTER TABLE T4 MODIFY C2 DECIMAL(11,3) PRIMARY KEY;
##NULL/NOT NULL##
drop table T4;
CREATE TABLE T4 (C1 DECIMAL NOT NULL,C2 DECIMAL(10,9) NULL);
INSERT INTO T4(C1) VALUES(NULL);
ERROR 23000: Column 'C1' cannot be null
INSERT INTO T4(C2) VALUES(NULL);
ERROR HY000: Field 'C1' doesn't have a default value
INSERT INTO T4 VALUES(1.2,1.2);
Warnings:
Warning	1265	Data truncated for column 'C1' at row 1
INSERT INTO T4(C1) VALUES(1.2);
Warnings:
Warning	1265	Data truncated for column 'C1' at row 1
drop table T4;
CREATE TABLE T4 (C1 DECIMAL ,C2 DECIMAL(10,9) NULL);
ALTER TABLE T4 MODIFY COLUMN C1 DECIMAL(65) NULL;
ALTER TABLE T4 MODIFY COLUMN C2 DECIMAL NOT NULL;
##DEFAULT##
drop table T4;
CREATE TABLE T4 (C1 DECIMAL DEFAULT 1E+9 ,C2 DECIMAL(10,9) DEFAULT NULL);
INSERT INTO T4(C2) VALUES (NULL);
SELECT * FROM T4;
+------------+------+
| C1         | C2   |
+------------+------+
| 1000000000 | NULL |
+------------+------+
drop table T4;
CREATE TABLE T4 (C1 DECIMAL PRIMARY KEY,C2 DECIMAL(10,9) UNIQUE);
ALTER TABLE T4 ALTER COLUMN C1 SET DEFAULT 1E+9;
ALTER TABLE T4 ALTER COLUMN C2 SET DEFAULT NULL;
DESC T4;
+-------+---------------+------+-----+------------+-------+
| Field | Type          | Null | Key | Default    | Extra |
+-------+---------------+------+-----+------------+-------+
| C1    | decimal(10,0) | NO   | PRI | 1000000000 |       |
| C2    | decimal(10,9) | YES  | UNI | NULL       |       |
+-------+---------------+------+-----+------------+-------+
drop table T4;
CREATE TABLE T4 (C1 DECIMAL DEFAULT 0.1,C2 DECIMAL(10,9) NOT NULL);
ALTER TABLE T4 ALTER COLUMN C2 SET DEFAULT -0.2;
##CHECK##
drop table T4;
CREATE TABLE T4 (C1 DECIMAL CHECK(C1>0),C2 DECIMAL(10,9) CHECK(C2<0));
DESC T4;
+-------+---------------+------+-----+---------+-------+
| Field | Type          | Null | Key | Default | Extra |
+-------+---------------+------+-----+---------+-------+
| C1    | decimal(10,0) | YES  |     | NULL    |       |
| C2    | decimal(10,9) | YES  |     | NULL    |       |
+-------+---------------+------+-----+---------+-------+
drop table T4;
CREATE TABLE T4 (C1 DECIMAL(1) CHECK(C1>10));
drop table T4;
CREATE TABLE T4 (C1 DECIMAL,C2 DECIMAL(10,9),CONSTRAINT CHE_DE_C1 CHECK(C1>0));
INSERT INTO T4(C1) VALUES(-1);
ERROR HY000: check constraint violated
drop table T4;
CREATE TABLE T4 (C1 DECIMAL,C2 DECIMAL(10,2),CONSTRAINT CHE_DE_C1 CHECK(C1>0 AND C2<0));
INSERT INTO T4(C1) VALUES(-0.00);
ERROR HY000: check constraint violated
INSERT INTO T4(C2) VALUES(0.001);
ERROR HY000: check constraint violated
drop table T4;
CREATE TABLE T4 (C1 DECIMAL,C2 DECIMAL(10,2));
ALTER TABLE T4 ADD CONSTRAINT CHE_DE CHECK(C1>10 AND C2<0);
##FOREIGN KEY##
ALTER TABLE T1 ADD CONSTRAINT UN_KEY UNIQUE(C5);
drop table T4;
CREATE TABLE T4 (C1 DECIMAL,C2 DECIMAL(10,2),FOREIGN KEY(C1) REFERENCES T1(C5));
INSERT INTO T4(C1) VALUES(-0.00);
INSERT INTO T4(C1) VALUES(2);
ERROR 23000: Cannot add or update a child row: a foreign key constraint fails
drop table T4;
CREATE TABLE T4 (C1 DECIMAL ,C2 DECIMAL(10,2));
ALTER TABLE T4 ADD CONSTRAINT FK1 FOREIGN KEY(C1) REFERENCES T1(C5);
ALTER TABLE T4 ADD CONSTRAINT FK2 FOREIGN KEY(C2) REFERENCES T1(C5);
INSERT INTO T4(C1) VALUES(0.2);
Warnings:
Warning	1265	Data truncated for column 'C1' at row 1
INSERT INTO T4(C2) VALUES(0.2);
ERROR 23000: Cannot add or update a child row: a foreign key constraint fails
INSERT INTO T4(C1) VALUES(1.00001);
Warnings:
Warning	1265	Data truncated for column 'C1' at row 1
INSERT INTO T4(C2) VALUES(1.00001);
Warnings:
Warning	1265	Data truncated for column 'C2' at row 1
##ALTER ADD##
ALTER TABLE T4 ADD C3 DECIMAL(0);
ALTER TABLE T4 ADD C4 DECIMAL(2,0) DEFAULT 99;
ALTER TABLE T4 ADD C5 DECIMAL(1) NOT NULL;
ALTER TABLE T4 ADD C6 DECIMAL(11,3) NULL;
ALTER TABLE T4 ADD C7 DECIMAL(13,5) UNIQUE;
DESC T4;
+-------+---------------+------+-----+---------+-------+
| Field | Type          | Null | Key | Default | Extra |
+-------+---------------+------+-----+---------+-------+
| C1    | decimal(10,0) | YES  |     | NULL    |       |
| C2    | decimal(10,2) | YES  |     | NULL    |       |
| C3    | decimal(10,0) | YES  |     | NULL    |       |
| C4    | decimal(2,0)  | YES  |     | 99      |       |
| C5    | decimal(1,0)  | NO   |     | NULL    |       |
| C6    | decimal(11,3) | YES  |     | NULL    |       |
| C7    | decimal(13,5) | YES  | UNI | NULL    |       |
+-------+---------------+------+-----+---------+-------+
##ALTER MODIFY##
ALTER TABLE T4 DROP FOREIGN KEY FK1;
ALTER TABLE T4 DROP FOREIGN KEY FK2;
DELETE FROM T4;
ALTER TABLE T4 MODIFY C1 DECIMAL(65,30) NOT NULL;
ALTER TABLE T4 MODIFY C2 DOUBLE(65,30) NULL;
ALTER TABLE T4 MODIFY C3 FLOAT(65,30) DEFAULT 99;
ALTER TABLE T4 MODIFY C4 INT CHECK(C4>10);
ALTER TABLE T4 MODIFY C5 VARCHAR(10) UNIQUE;
ALTER TABLE T4 MODIFY C6 CHAR(10);
ALTER TABLE T4 MODIFY C7 DATE;
ALTER TABLE T4 MODIFY C1 DECIMAL NOT NULL;
ALTER TABLE T4 MODIFY C2 DECIMAL(1) ;
ALTER TABLE T4 MODIFY C3 DECIMAL(2);
ALTER TABLE T4 MODIFY C4 DECIMAL(3);
ERROR 0A000: Alter column with check constraint not supported
ALTER TABLE T4 MODIFY C5 DECIMAL(4);
ALTER TABLE T4 MODIFY C6 DECIMAL(5);
ALTER TABLE T4 MODIFY C7 DECIMAL(6);
DROP TABLE T4;
CREATE TABLE T4 (C1 FLOAT,C2 DOUBLE,C3 CHAR(10),C4 VARCHAR(10),C5 NUMBER(10),C6 INT,C7 FLOAT(10),C8 NUMERIC(10));
INSERT INTO T4 VALUES ('1.2','1.2','1.2','1.2','1.2','1.2','1.2','1.2');
Warnings:
Warning	1265	Data truncated for column 'C5' at row 1
Warning	1265	Data truncated for column 'C8' at row 1
ALTER TABLE T4 MODIFY C1 DECIMAL;
ALTER TABLE T4 MODIFY C2 DECIMAL;
ALTER TABLE T4 MODIFY C3 DECIMAL;
ALTER TABLE T4 MODIFY C4 DECIMAL;
ALTER TABLE T4 MODIFY C5 DECIMAL;
ALTER TABLE T4 MODIFY C6 DECIMAL;
ALTER TABLE T4 MODIFY C7 DECIMAL;
ALTER TABLE T4 MODIFY C8 DECIMAL(1,1);
ERROR 22003: Out of range value for column
ALTER TABLE T4 DROP COLUMN C2;
ALTER TABLE T4 DROP COLUMN C3;
ALTER TABLE T4 DROP COLUMN C4;
ALTER TABLE T4 DROP COLUMN C5;
ALTER TABLE T4 DROP COLUMN C6;
ALTER TABLE T4 DROP COLUMN C7;
ALTER TABLE T4 DROP COLUMN C8;
####ALTER RENAME####
ALTER TABLE T4 CHANGE COLUMN C1 COL1 DECIMAL;
DESC T4;
+-------+---------------+------+-----+---------+-------+
| Field | Type          | Null | Key | Default | Extra |
+-------+---------------+------+-----+---------+-------+
| COL1  | decimal(10,0) | YES  |     | NULL    |       |
+-------+---------------+------+-----+---------+-------+
ALTER TABLE T4 CHANGE COLUMN COL1 C1 DECIMAL;
DESC T4;
+-------+---------------+------+-----+---------+-------+
| Field | Type          | Null | Key | Default | Extra |
+-------+---------------+------+-----+---------+-------+
| C1    | decimal(10,0) | YES  |     | NULL    |       |
+-------+---------------+------+-----+---------+-------+
ALTER TABLE T4 MODIFY COLUMN C1 INT AUTO_INCREMENT;
ALTER TABLE T4 AUTO_INCREMENT=12;
##comment##
ALTER TABLE T4 MODIFY COLUMN C1 DECIMAL(65) COMMENT 'DECIMAL_INT列';
SHOW CREATE TABLE T4;
Table	Create Table
t4	CREATE TABLE `t4` (
  `C1` decimal(65,0) DEFAULT NULL COMMENT 'DECIMAL_INT列'
) ORGANIZATION INDEX DEFAULT CHARSET = utf8mb4 ROW_FORMAT = DYNAMIC COMPRESSION = 'zstd_1.3.8' REPLICA_NUM = 1 BLOCK_SIZE = 16384 USE_BLOOM_FILTER = FALSE ENABLE_MACRO_BLOCK_BLOOM_FILTER = FALSE TABLET_SIZE = 134217728 PCTFREE = 0
DROP TABLE T4;
CREATE TABLE T4 (C1 DECIMAL ,C2 DECIMAL(10,2) AS (123.456) COMMENT 'DECIMAL_INT列');
SHOW CREATE TABLE T4;
Table	Create Table
t4	CREATE TABLE `t4` (
  `C1` decimal(10,0) DEFAULT NULL,
  `C2` decimal(10,2) GENERATED ALWAYS AS (123.456) VIRTUAL COMMENT 'DECIMAL_INT列'
) ORGANIZATION INDEX DEFAULT CHARSET = utf8mb4 ROW_FORMAT = DYNAMIC COMPRESSION = 'zstd_1.3.8' REPLICA_NUM = 1 BLOCK_SIZE = 16384 USE_BLOOM_FILTER = FALSE ENABLE_MACRO_BLOCK_BLOOM_FILTER = FALSE TABLET_SIZE = 134217728 PCTFREE = 0
INSERT INTO T4(C1) VALUES(1);
Warnings:
Warning	1265	Data truncated for column 'C2' at row 1
SELECT * FROM T4;
+------+--------+
| C1   | C2     |
+------+--------+
|    1 | 123.46 |
+------+--------+
###STORED VIRTUAL###
ALTER TABLE T4 ADD COLUMN (C3 DECIMAL GENERATED ALWAYS AS (c1 + 1) STORED);
ALTER TABLE T4 ADD COLUMN (C4 DECIMAL(2,1) GENERATED ALWAYS AS (c1 + 1) VIRTUAL);
INSERT INTO T4(C1) VALUES (1.23);
Warnings:
Warning	1265	Data truncated for column 'C1' at row 1
Warning	1265	Data truncated for column 'C2' at row 1
INSERT INTO T4(C1) VALUES (12.34);
ERROR 22003: Out of range value for column 'C4' at row 1
ALTER TABLE T4 DROP COLUMN C3;
ALTER TABLE T4 DROP COLUMN C4;
###PARTITION###
drop table T4;
CREATE TABLE T4 (C1 DECIMAL(1) ,C2 INT);
ALTER TABLE T4 PARTITION BY KEY(C1) PARTITIONS 5;
ALTER TABLE T4 PARTITION BY HASH(C1) PARTITIONS 5;
ERROR HY000: Field 'C1' is of a not allowed type for this type of partitioning
ALTER TABLE T4 PARTITION BY RANGE(C1)
(PARTITION P0 VALUES LESS THAN (0),
 PARTITION P1 VALUES LESS THAN (10));
ERROR HY000: Field 'C1' is of a not allowed type for this type of partitioning
ALTER TABLE T4 PARTITION BY LIST(C1)
(PARTITION P0 VALUES IN (0,10),
 PARTITION P1 VALUES IN (20,30));
ERROR HY000: Field 'C1' is of a not allowed type for this type of partitioning
##SUBPATITION##
ALTER TABLE T4 PARTITION BY KEY(C1) SUBPARTITION BY KEY(C1,C2) SUBPARTITIONS 2 PARTITIONS 5;
drop table T4;
CREATE TABLE T4 (C1 DECIMAL PRIMARY KEY) PARTITION BY HASH(C1) PARTITIONS 2;
ERROR HY000: Field 'C1' is of a not allowed type for this type of partitioning
CREATE TABLE T4(C1 DECIMAL,C2 DECIMAL(10,10),C3 DECIMAL(0),C4 DECIMAL(65),C5 DECIMAL(65,30),C6 DECIMAL(3,2),C7 DECIMAL(0,0)) PARTITION BY KEY(C1,C2,C3,C4,C5,C6,C7) PARTITIONS 3;
INSERT INTO T4 VALUES (NULL,NULL,NULL,NULL,NULL,NULL,NULL);
INSERT INTO T4 VALUES (0,0,0,0,0,0,0);
INSERT INTO T4 VALUES (0.123,0.123,0.123,0.123,0.123,0.123,0.123);
Warnings:
Warning	1265	Data truncated for column 'C1' at row 1
Warning	1265	Data truncated for column 'C3' at row 1
Warning	1265	Data truncated for column 'C4' at row 1
Warning	1265	Data truncated for column 'C6' at row 1
Warning	1265	Data truncated for column 'C7' at row 1
INSERT INTO T4 VALUES (1e-30,1e-30,1e-30,1e-30,1e-30,1e-30,1e-30);
Warnings:
Warning	1265	Data truncated for column 'C1' at row 1
Warning	1265	Data truncated for column 'C2' at row 1
Warning	1265	Data truncated for column 'C3' at row 1
Warning	1265	Data truncated for column 'C4' at row 1
Warning	1265	Data truncated for column 'C6' at row 1
Warning	1265	Data truncated for column 'C7' at row 1
INSERT INTO T4(C1,C3,C4,C5,C6,C7) VALUES(01,01,01,01,01,01);
INSERT INTO T4(C1,C3,C4,C5,C6,C7) VALUES(-1,-1,-1,-1,-1,-1);
INSERT INTO T4(C1,C2,C3,C4,C5,C6,C7) VALUES(-0.1,-0.1,-0.1,-0.1,-0.1,-0.1,-0.1);
Warnings:
Warning	1265	Data truncated for column 'C1' at row 1
Warning	1265	Data truncated for column 'C3' at row 1
Warning	1265	Data truncated for column 'C4' at row 1
Warning	1265	Data truncated for column 'C7' at row 1
SELECT * FROM T4;
+------+---------------+------+------+-----------------------------------+-------+------+
| C1   | C2            | C3   | C4   | C5                                | C6    | C7   |
+------+---------------+------+------+-----------------------------------+-------+------+
| NULL |          NULL | NULL | NULL |                              NULL |  NULL | NULL |
|    0 |  0.0000000000 |    0 |    0 |  0.000000000000000000000000000000 |  0.00 |    0 |
|    0 | -0.1000000000 |    0 |    0 | -0.100000000000000000000000000000 | -0.10 |    0 |
|    0 |  0.1230000000 |    0 |    0 |  0.123000000000000000000000000000 |  0.12 |    0 |
|    0 |  0.0000000000 |    0 |    0 |  0.000000000000000000000000000001 |  0.00 |    0 |
|    1 |          NULL |    1 |    1 |  1.000000000000000000000000000000 |  1.00 |    1 |
|   -1 |          NULL |   -1 |   -1 | -1.000000000000000000000000000000 | -1.00 |   -1 |
+------+---------------+------+------+-----------------------------------+-------+------+
ALTER TABLE T4 DROP PARTITION P0;
ERROR 0A000: Drop hash partition not supported
