result_format: 4
##ÂÆö‰πâdecimalÁ±ªÂûãÂàóÂü∫Êú¨ÂÆö‰πâ##
CREATE TABLE T1(A DECIMAL(66));
ERROR 42000: Too big precision 66 specified for column 'A'. Maximum is 65.
CREATE TABLE T1(A DECIMAL(-1));
ERROR 42000: You have an error in your SQL syntax; check the manual that corresponds to your OceanBase version for the right syntax to use near '-1))' at line 1
CREATE TABLE T1(A DECIMAL(0,1));
ERROR 42000: For float(M,D), double(M,D) or decimal(M,D), M must be >= D (column 'A').
CREATE TABLE T1(A DECIMAL(10,11));
ERROR 42000: For float(M,D), double(M,D) or decimal(M,D), M must be >= D (column 'A').
CREATE TABLE T1(A DECIMAL(10,-11));
ERROR 42000: You have an error in your SQL syntax; check the manual that corresponds to your OceanBase version for the right syntax to use near '-11))' at line 1
CREATE TABLE T1(A DECIMAL(-0));
ERROR 42000: You have an error in your SQL syntax; check the manual that corresponds to your OceanBase version for the right syntax to use near '-0))' at line 1
CREATE TABLE T1(A DECIMAL(65,31));
ERROR 42000: Too big scale 31 specified for column 'A'. Maximum is 30.
CREATE TABLE T1(A DECIMAL(65,-0));
ERROR 42000: You have an error in your SQL syntax; check the manual that corresponds to your OceanBase version for the right syntax to use near '-0))' at line 1
CREATE TABLE T1(A DECIMAL(NULL));
ERROR 42000: You have an error in your SQL syntax; check the manual that corresponds to your OceanBase version for the right syntax to use near 'NULL))' at line 1
CREATE TABLE T1(A DECIMAL(0.1));
ERROR 42000: You have an error in your SQL syntax; check the manual that corresponds to your OceanBase version for the right syntax to use near '0.1))' at line 1
CREATE TABLE T1(A DECIMAL(1,1.1));
ERROR 42000: You have an error in your SQL syntax; check the manual that corresponds to your OceanBase version for the right syntax to use near '1.1))' at line 1
CREATE TABLE T1(A DECIMAL(0,0));
DROP TABLE IF EXISTS T1;
CREATE TABLE T1(A DECIMAL(1)UNSIGNED ZEROFILL);
DROP TABLE IF EXISTS T1;
CREATE TABLE T1(A DEC,B NUMERIC,C FIXED);
DESC T1;
+-------+---------------+------+-----+---------+-------+
| Field | Type          | Null | Key | Default | Extra |
+-------+---------------+------+-----+---------+-------+
| A     | decimal(10,0) | YES  |     | NULL    |       |
| B     | decimal(10,0) | YES  |     | NULL    |       |
| C     | decimal(10,0) | YES  |     | NULL    |       |
+-------+---------------+------+-----+---------+-------+
DROP TABLE IF EXISTS T1;
CREATE TABLE T1(A DECIMAL,B DECIMAL(10,10),C DECIMAL(0)UNSIGNED,D DECIMAL(65),E DECIMAL(65,30),F DECIMAL(3,2),G DECIMAL(0,0)ZEROFILL);
##null##
INSERT INTO T1 VALUES(NULL,NULL,NULL,NULL,NULL,NULL,NULL);
##''##
INSERT INTO T1 VALUES('','','','','','','');
ERROR HY000: Incorrect decimal value for column 'A' at row 1
INSERT INTO T1(A) VALUES('');
ERROR HY000: Incorrect decimal value for column 'A' at row 1
INSERT INTO T1(B) VALUES('');
ERROR HY000: Incorrect decimal value for column 'B' at row 1
INSERT INTO T1(C) VALUES('');
ERROR HY000: Incorrect decimal value for column 'C' at row 1
INSERT INTO T1(D) VALUES('');
ERROR HY000: Incorrect decimal value for column 'D' at row 1
INSERT INTO T1(E) VALUES('');
ERROR HY000: Incorrect decimal value for column 'E' at row 1
INSERT INTO T1(F) VALUES('');
ERROR HY000: Incorrect decimal value for column 'F' at row 1
INSERT INTO T1(G) VALUES('');
ERROR HY000: Incorrect decimal value for column 'G' at row 1
##0##
INSERT INTO T1 VALUES(0,0,0,0,0,0,0);
SELECT * FROM T1;
+------+--------------+------+------+----------------------------------+------+------------+
| A    | B            | C    | D    | E                                | F    | G          |
+------+--------------+------+------+----------------------------------+------+------------+
| NULL |         NULL | NULL | NULL |                             NULL | NULL |       NULL |
|    0 | 0.0000000000 |    0 |    0 | 0.000000000000000000000000000000 | 0.00 | 0000000000 |
+------+--------------+------+------+----------------------------------+------+------------+
##01##
insert into t1(a) values (01);
insert into t1(b) values (01);
ERROR 22003: Out of range value for column 'B' at row 1
insert into t1(c) values (01);
insert into t1(d) values (01);
insert into t1(e) values (01);
insert into t1(f) values (01);
insert into t1(g) values (01);
SELECT * FROM T1;
+------+--------------+------+------+----------------------------------+------+------------+
| A    | B            | C    | D    | E                                | F    | G          |
+------+--------------+------+------+----------------------------------+------+------------+
| NULL |         NULL | NULL | NULL |                             NULL | NULL |       NULL |
|    0 | 0.0000000000 |    0 |    0 | 0.000000000000000000000000000000 | 0.00 | 0000000000 |
|    1 |         NULL | NULL | NULL |                             NULL | NULL |       NULL |
| NULL |         NULL |    1 | NULL |                             NULL | NULL |       NULL |
| NULL |         NULL | NULL |    1 |                             NULL | NULL |       NULL |
| NULL |         NULL | NULL | NULL | 1.000000000000000000000000000000 | NULL |       NULL |
| NULL |         NULL | NULL | NULL |                             NULL | 1.00 |       NULL |
| NULL |         NULL | NULL | NULL |                             NULL | NULL | 0000000001 |
+------+--------------+------+------+----------------------------------+------+------------+
DELETE FROM T1;
##0.123##
insert into t1(a) values (0.123);
Warnings:
Warning	1265	Data truncated for column 'A' at row 1
insert into t1(b) values (0.123);
insert into t1(c) values (0.123);
Warnings:
Warning	1265	Data truncated for column '"test"."t1"."C"' at row 1
insert into t1(d) values (0.123);
Warnings:
Warning	1265	Data truncated for column 'D' at row 1
insert into t1(e) values (0.123);
insert into t1(f) values (0.123);
Warnings:
Warning	1265	Data truncated for column 'F' at row 1
insert into t1(g) values (0.123);
Warnings:
Warning	1265	Data truncated for column '"test"."t1"."G"' at row 1
SELECT * FROM T1;
+------+--------------+------+------+----------------------------------+------+------------+
| A    | B            | C    | D    | E                                | F    | G          |
+------+--------------+------+------+----------------------------------+------+------------+
|    0 |         NULL | NULL | NULL |                             NULL | NULL |       NULL |
| NULL | 0.1230000000 | NULL | NULL |                             NULL | NULL |       NULL |
| NULL |         NULL |    0 | NULL |                             NULL | NULL |       NULL |
| NULL |         NULL | NULL |    0 |                             NULL | NULL |       NULL |
| NULL |         NULL | NULL | NULL | 0.123000000000000000000000000000 | NULL |       NULL |
| NULL |         NULL | NULL | NULL |                             NULL | 0.12 |       NULL |
| NULL |         NULL | NULL | NULL |                             NULL | NULL | 0000000000 |
+------+--------------+------+------+----------------------------------+------+------------+
DELETE FROM T1;
##-1##
insert into t1(a) values (-1);
insert into t1(b) values (-1);
ERROR 22003: Out of range value for column 'B' at row 1
insert into t1(c) values (-1);
ERROR 22003: Out of range value for column 'C' at row 1
insert into t1(d) values (-1);
insert into t1(e) values (-1);
insert into t1(f) values (-1);
insert into t1(g) values (-1);
ERROR 22003: Out of range value for column 'G' at row 1
SELECT * FROM T1;
+------+------+------+------+-----------------------------------+-------+------+
| A    | B    | C    | D    | E                                 | F     | G    |
+------+------+------+------+-----------------------------------+-------+------+
|   -1 | NULL | NULL | NULL |                              NULL |  NULL | NULL |
| NULL | NULL | NULL |   -1 |                              NULL |  NULL | NULL |
| NULL | NULL | NULL | NULL | -1.000000000000000000000000000000 |  NULL | NULL |
| NULL | NULL | NULL | NULL |                              NULL | -1.00 | NULL |
+------+------+------+------+-----------------------------------+-------+------+
DELETE FROM T1;
##-0.1##
insert into t1(a) values (-0.1);
Warnings:
Warning	1265	Data truncated for column 'A' at row 1
insert into t1(b) values (-0.1);
insert into t1(c) values (-0.1);
ERROR 22003: Out of range value for column 'C' at row 1
insert into t1(d) values (-0.1);
Warnings:
Warning	1265	Data truncated for column 'D' at row 1
insert into t1(e) values (-0.1);
insert into t1(f) values (-0.1);
insert into t1(g) values (-0.1);
ERROR 22003: Out of range value for column 'G' at row 1
SELECT * FROM T1;
+------+---------------+------+------+-----------------------------------+-------+------+
| A    | B             | C    | D    | E                                 | F     | G    |
+------+---------------+------+------+-----------------------------------+-------+------+
|    0 |          NULL | NULL | NULL |                              NULL |  NULL | NULL |
| NULL | -0.1000000000 | NULL | NULL |                              NULL |  NULL | NULL |
| NULL |          NULL | NULL |    0 |                              NULL |  NULL | NULL |
| NULL |          NULL | NULL | NULL | -0.100000000000000000000000000000 |  NULL | NULL |
| NULL |          NULL | NULL | NULL |                              NULL | -0.10 | NULL |
+------+---------------+------+------+-----------------------------------+-------+------+
DELETE FROM T1;
##1e+64##
insert into t1(a) values (1e+64);
ERROR 22003: Out of range value for column 'A' at row 1
insert into t1(b) values (1e+64);
ERROR 22003: Out of range value for column 'B' at row 1
insert into t1(c) values (1e+64);
ERROR 22003: Out of range value for column 'C' at row 1
insert into t1(d) values (1e+64);
insert into t1(e) values (1e+64);
ERROR 22003: Out of range value for column 'E' at row 1
insert into t1(f) values (1e+64);
ERROR 22003: Out of range value for column 'F' at row 1
insert into t1(g) values (1e+64);
ERROR 22003: Out of range value for column 'G' at row 1
SELECT * FROM T1;
+------+------+------+-------------------------------------------------------------------+------+------+------+
| A    | B    | C    | D                                                                 | E    | F    | G    |
+------+------+------+-------------------------------------------------------------------+------+------+------+
| NULL | NULL | NULL | 10000000000000000000000000000000000000000000000000000000000000000 | NULL | NULL | NULL |
+------+------+------+-------------------------------------------------------------------+------+------+------+
DELETE FROM T1;
##1e-64##
insert into t1(a) values (1e-64);
Warnings:
Warning	1265	Data truncated for column 'A' at row 1
insert into t1(b) values (1e-64);
Warnings:
Warning	1265	Data truncated for column 'B' at row 1
insert into t1(c) values (1e-64);
Warnings:
Warning	1265	Data truncated for column '"test"."t1"."C"' at row 1
insert into t1(d) values (1e-64);
Warnings:
Warning	1265	Data truncated for column 'D' at row 1
insert into t1(e) values (1e-64);
Warnings:
Warning	1265	Data truncated for column 'E' at row 1
insert into t1(f) values (1e-64);
Warnings:
Warning	1265	Data truncated for column 'F' at row 1
insert into t1(g) values (1e-64);
Warnings:
Warning	1265	Data truncated for column '"test"."t1"."G"' at row 1
SELECT * FROM T1;
+------+--------------+------+------+----------------------------------+------+------------+
| A    | B            | C    | D    | E                                | F    | G          |
+------+--------------+------+------+----------------------------------+------+------------+
|    0 |         NULL | NULL | NULL |                             NULL | NULL |       NULL |
| NULL | 0.0000000000 | NULL | NULL |                             NULL | NULL |       NULL |
| NULL |         NULL |    0 | NULL |                             NULL | NULL |       NULL |
| NULL |         NULL | NULL |    0 |                             NULL | NULL |       NULL |
| NULL |         NULL | NULL | NULL | 0.000000000000000000000000000000 | NULL |       NULL |
| NULL |         NULL | NULL | NULL |                             NULL | 0.00 |       NULL |
| NULL |         NULL | NULL | NULL |                             NULL | NULL | 0000000000 |
+------+--------------+------+------+----------------------------------+------+------------+
DELETE FROM T1;
##1e-31##
insert into t1(a) values (1e-31);
Warnings:
Warning	1265	Data truncated for column 'A' at row 1
insert into t1(b) values (1e-31);
Warnings:
Warning	1265	Data truncated for column 'B' at row 1
insert into t1(c) values (1e-31);
Warnings:
Warning	1265	Data truncated for column '"test"."t1"."C"' at row 1
insert into t1(d) values (1e-31);
Warnings:
Warning	1265	Data truncated for column 'D' at row 1
insert into t1(e) values (1e-31);
Warnings:
Warning	1265	Data truncated for column 'E' at row 1
insert into t1(f) values (1e-31);
Warnings:
Warning	1265	Data truncated for column 'F' at row 1
insert into t1(g) values (1e-31);
Warnings:
Warning	1265	Data truncated for column '"test"."t1"."G"' at row 1
SELECT * FROM T1;
+------+--------------+------+------+----------------------------------+------+------------+
| A    | B            | C    | D    | E                                | F    | G          |
+------+--------------+------+------+----------------------------------+------+------------+
|    0 |         NULL | NULL | NULL |                             NULL | NULL |       NULL |
| NULL | 0.0000000000 | NULL | NULL |                             NULL | NULL |       NULL |
| NULL |         NULL |    0 | NULL |                             NULL | NULL |       NULL |
| NULL |         NULL | NULL |    0 |                             NULL | NULL |       NULL |
| NULL |         NULL | NULL | NULL | 0.000000000000000000000000000000 | NULL |       NULL |
| NULL |         NULL | NULL | NULL |                             NULL | 0.00 |       NULL |
| NULL |         NULL | NULL | NULL |                             NULL | NULL | 0000000000 |
+------+--------------+------+------+----------------------------------+------+------------+
DELETE FROM T1;
##-1E+64##
insert into t1(a) values (-1E+64);
ERROR 22003: Out of range value for column 'A' at row 1
insert into t1(b) values (-1E+64);
ERROR 22003: Out of range value for column 'B' at row 1
insert into t1(c) values (-1E+64);
ERROR 22003: Out of range value for column 'C' at row 1
insert into t1(d) values (-1E+64);
insert into t1(e) values (-1E+64);
ERROR 22003: Out of range value for column 'E' at row 1
insert into t1(f) values (-1E+64);
ERROR 22003: Out of range value for column 'F' at row 1
insert into t1(g) values (-1E+64);
ERROR 22003: Out of range value for column 'G' at row 1
SELECT * FROM T1;
+------+------+------+--------------------------------------------------------------------+------+------+------+
| A    | B    | C    | D                                                                  | E    | F    | G    |
+------+------+------+--------------------------------------------------------------------+------+------+------+
| NULL | NULL | NULL | -10000000000000000000000000000000000000000000000000000000000000000 | NULL | NULL | NULL |
+------+------+------+--------------------------------------------------------------------+------+------+------+
DELETE FROM T1;
##0101##
insert into t1(a) values (01010);
insert into t1(b) values (01010);
ERROR 22003: Out of range value for column 'B' at row 1
insert into t1(c) values (01010);
insert into t1(d) values (01010);
insert into t1(e) values (01010);
insert into t1(f) values (01010);
ERROR 22003: Out of range value for column 'F' at row 1
insert into t1(g) values (01010);
SELECT * FROM T1;
+------+------+------+------+-------------------------------------+------+------------+
| A    | B    | C    | D    | E                                   | F    | G          |
+------+------+------+------+-------------------------------------+------+------------+
| 1010 | NULL | NULL | NULL |                                NULL | NULL |       NULL |
| NULL | NULL | 1010 | NULL |                                NULL | NULL |       NULL |
| NULL | NULL | NULL | 1010 |                                NULL | NULL |       NULL |
| NULL | NULL | NULL | NULL | 1010.000000000000000000000000000000 | NULL |       NULL |
| NULL | NULL | NULL | NULL |                                NULL | NULL | 0000001010 |
+------+------+------+------+-------------------------------------+------+------------+
DELETE FROM T1;
##'010'##
insert into t1(a) values ('010');
insert into t1(b) values ('010');
ERROR 22003: Out of range value for column 'B' at row 1
insert into t1(c) values ('010');
insert into t1(d) values ('010');
insert into t1(e) values ('010');
insert into t1(f) values ('010');
ERROR 22003: Out of range value for column 'F' at row 1
insert into t1(g) values ('010');
SELECT * FROM T1;
+------+------+------+------+-----------------------------------+------+------------+
| A    | B    | C    | D    | E                                 | F    | G          |
+------+------+------+------+-----------------------------------+------+------------+
|   10 | NULL | NULL | NULL |                              NULL | NULL |       NULL |
| NULL | NULL |   10 | NULL |                              NULL | NULL |       NULL |
| NULL | NULL | NULL |   10 |                              NULL | NULL |       NULL |
| NULL | NULL | NULL | NULL | 10.000000000000000000000000000000 | NULL |       NULL |
| NULL | NULL | NULL | NULL |                              NULL | NULL | 0000000010 |
+------+------+------+------+-----------------------------------+------+------------+
DELETE FROM T1;
##b'01010101010101'##
insert into t1(a) values (b'01010101010101');
insert into t1(b) values (b'01010101010101');
ERROR 22003: Out of range value for column 'B' at row 1
insert into t1(c) values (b'01010101010101');
insert into t1(d) values (b'01010101010101');
insert into t1(e) values (b'01010101010101');
insert into t1(f) values (b'01010101010101');
ERROR 22003: Out of range value for column 'F' at row 1
insert into t1(g) values (b'01010101010101');
SELECT * FROM T1;
+------+------+------+------+-------------------------------------+------+------------+
| A    | B    | C    | D    | E                                   | F    | G          |
+------+------+------+------+-------------------------------------+------+------------+
| 5461 | NULL | NULL | NULL |                                NULL | NULL |       NULL |
| NULL | NULL | 5461 | NULL |                                NULL | NULL |       NULL |
| NULL | NULL | NULL | 5461 |                                NULL | NULL |       NULL |
| NULL | NULL | NULL | NULL | 5461.000000000000000000000000000000 | NULL |       NULL |
| NULL | NULL | NULL | NULL |                                NULL | NULL | 0000005461 |
+------+------+------+------+-------------------------------------+------+------------+
DELETE FROM T1;
##CONV(HEX('ABCDEF'),16, 10)##
insert into t1(a) values (CONV(HEX('ABCDEF'),16, 10));
ERROR 22003: Out of range value for column 'A' at row 1
insert into t1(b) values (CONV(HEX('ABCDEF'),16, 10));
ERROR 22003: Out of range value for column 'B' at row 1
insert into t1(c) values (CONV(HEX('ABCDEF'),16, 10));
ERROR 22003: Out of range value for column 'C' at row 1
insert into t1(d) values (CONV(HEX('ABCDEF'),16, 10));
insert into t1(e) values (CONV(HEX('ABCDEF'),16, 10));
insert into t1(f) values (CONV(HEX('ABCDEF'),16, 10));
ERROR 22003: Out of range value for column 'F' at row 1
insert into t1(g) values (CONV(HEX('ABCDEF'),16, 10));
ERROR 22003: Out of range value for column 'G' at row 1
SELECT * FROM T1;
+------+------+------+----------------+-----------------------------------------------+------+------+
| A    | B    | C    | D              | E                                             | F    | G    |
+------+------+------+----------------+-----------------------------------------------+------+------+
| NULL | NULL | NULL | 71752852194630 |                                          NULL | NULL | NULL |
| NULL | NULL | NULL |           NULL | 71752852194630.000000000000000000000000000000 | NULL | NULL |
+------+------+------+----------------+-----------------------------------------------+------+------+
DELETE FROM T1;
##0XABCDEF##
insert into t1(a) values (0XABCDEF);
ERROR 42000: You have an error in your SQL syntax; check the manual that corresponds to your OceanBase version for the right syntax to use near '0XABCDEF)' at line 1
insert into t1(b) values (0XABCDEF);
ERROR 42000: You have an error in your SQL syntax; check the manual that corresponds to your OceanBase version for the right syntax to use near '0XABCDEF)' at line 1
insert into t1(c) values (0XABCDEF);
ERROR 42000: You have an error in your SQL syntax; check the manual that corresponds to your OceanBase version for the right syntax to use near '0XABCDEF)' at line 1
insert into t1(d) values (0XABCDEF);
ERROR 42000: You have an error in your SQL syntax; check the manual that corresponds to your OceanBase version for the right syntax to use near '0XABCDEF)' at line 1
insert into t1(e) values (0XABCDEF);
ERROR 42000: You have an error in your SQL syntax; check the manual that corresponds to your OceanBase version for the right syntax to use near '0XABCDEF)' at line 1
insert into t1(f) values (0XABCDEF);
ERROR 42000: You have an error in your SQL syntax; check the manual that corresponds to your OceanBase version for the right syntax to use near '0XABCDEF)' at line 1
insert into t1(g) values (0XABCDEF);
ERROR 42000: You have an error in your SQL syntax; check the manual that corresponds to your OceanBase version for the right syntax to use near '0XABCDEF)' at line 1
SELECT * FROM T1;
+------+------+------+------+------+------+------+
| A    | B    | C    | D    | E    | F    | G    |
+------+------+------+------+------+------+------+
+------+------+------+------+------+------+------+
CREATE TABLE T2(A FLOAT(10),B DOUBLE(10,10),C INT(10),D TINYINT(10),E NUMBER(10,10));
INSERT INTO T2 VALUES(0,0,0,0,0);
DROP TABLE IF EXISTS T2;
CREATE TABLE T2(A SMALLINT(10),B MEDIUMINT(10),C INTEGER(10),D BIGINT(10),E BIT(10));
INSERT INTO T2 VALUES(0,0,0,0,0);
##Á±ªÂûãËΩ¨Êç¢##
##decimaËΩ¨ÂÖ∂‰ªñÁ±ªÂûã##
##ÂÖ∂‰ªñÁ±ªÂûãËΩ¨DECIMAL##
DROP TABLE IF EXISTS T1;
CREATE TABLE T1(C1 DECIMAL,C2 DECIMAL(10,10),C3 DECIMAL(0)UNSIGNED,C4 DECIMAL(65),C5 DECIMAL(65,30),C6 DECIMAL(3,2),C7 DECIMAL(0,0)ZEROFILL);
INSERT INTO T1 VALUES (NULL,NULL,NULL,NULL,NULL,NULL,NULL);
INSERT INTO T1 VALUES (0,0,0,0,0,0,0);
INSERT INTO T1 VALUES (0.123,0.123,0.123,0.123,0.123,0.123,0.123);
Warnings:
Warning	1265	Data truncated for column 'C1' at row 1
Warning	1265	Data truncated for column 'C4' at row 1
Warning	1265	Data truncated for column 'C6' at row 1
Warning	1265	Data truncated for column '"test"."t1"."C3"' at row 1
Warning	1265	Data truncated for column '"test"."t1"."C7"' at row 1
INSERT INTO T1 VALUES (1e-30,1e-30,1e-30,1e-30,1e-30,1e-30,1e-30);
Warnings:
Warning	1265	Data truncated for column 'C1' at row 1
Warning	1265	Data truncated for column 'C2' at row 1
Warning	1265	Data truncated for column 'C4' at row 1
Warning	1265	Data truncated for column 'C6' at row 1
Warning	1265	Data truncated for column '"test"."t1"."C3"' at row 1
Warning	1265	Data truncated for column '"test"."t1"."C7"' at row 1
INSERT INTO T1(C1,C3,C4,C5,C6,C7) VALUES(01,01,01,01,01,01);
INSERT INTO T1(C1,C4,C5,C6) VALUES(-1,-1,-1,-1);
INSERT INTO T1(C1,C2,C4,C5,C6) VALUES(-0.1,-0.1,-0.1,-0.1,-0.1);
Warnings:
Warning	1265	Data truncated for column 'C1' at row 1
Warning	1265	Data truncated for column 'C4' at row 1
INSERT INTO T1(C4) VALUES(1e+64);
INSERT INTO T1(C4) VALUES(-1e+64);
INSERT INTO T1(C1,C3,C4,C5,C7) VALUES(01010,01010,01010,01010,01010);
INSERT INTO T1(C1,C3,C4,C5,C7) VALUES(b'01010101010101',b'01010101010101',b'01010101010101',b'01010101010101',b'01010101010101');
INSERT INTO T1(C1,C3,C4,C5,C7) VALUES(0XABCDEF,0XABCDEF,0XABCDEF,0XABCDEF,0XABCDEF);
ERROR 42000: You have an error in your SQL syntax; check the manual that corresponds to your OceanBase version for the right syntax to use near '0XABCDEF,0XABCDEF,0XABCDEF,0XABCDEF,0XABCDEF)' at line 1
SELECT * FROM T1;
+------+---------------+------+--------------------------------------------------------------------+-------------------------------------+-------+------------+
| C1   | C2            | C3   | C4                                                                 | C5                                  | C6    | C7         |
+------+---------------+------+--------------------------------------------------------------------+-------------------------------------+-------+------------+
| NULL |          NULL | NULL |                                                               NULL |                                NULL |  NULL |       NULL |
|    0 |  0.0000000000 |    0 |                                                                  0 |    0.000000000000000000000000000000 |  0.00 | 0000000000 |
|    0 |  0.1230000000 |    0 |                                                                  0 |    0.123000000000000000000000000000 |  0.12 | 0000000000 |
|    0 |  0.0000000000 |    0 |                                                                  0 |    0.000000000000000000000000000001 |  0.00 | 0000000000 |
|    1 |          NULL |    1 |                                                                  1 |    1.000000000000000000000000000000 |  1.00 | 0000000001 |
|   -1 |          NULL | NULL |                                                                 -1 |   -1.000000000000000000000000000000 | -1.00 |       NULL |
|    0 | -0.1000000000 | NULL |                                                                  0 |   -0.100000000000000000000000000000 | -0.10 |       NULL |
| NULL |          NULL | NULL |  10000000000000000000000000000000000000000000000000000000000000000 |                                NULL |  NULL |       NULL |
| NULL |          NULL | NULL | -10000000000000000000000000000000000000000000000000000000000000000 |                                NULL |  NULL |       NULL |
| 1010 |          NULL | 1010 |                                                               1010 | 1010.000000000000000000000000000000 |  NULL | 0000001010 |
| 5461 |          NULL | 5461 |                                                               5461 | 5461.000000000000000000000000000000 |  NULL | 0000005461 |
+------+---------------+------+--------------------------------------------------------------------+-------------------------------------+-------+------------+
##CAST##
SELECT CAST(C1 AS DECIMAL(20,10)),CAST(C2 AS DECIMAL(20,10)),CAST(C3 AS DECIMAL(20,10)),CAST(C4 AS DECIMAL(20,10)),CAST(C5 AS DECIMAL(20,10)),CAST(C6 AS DECIMAL(20,10)),CAST(C7 AS DECIMAL(20,10))  FROM T1;
+----------------------------+----------------------------+----------------------------+----------------------------+----------------------------+----------------------------+----------------------------+
| CAST(C1 AS DECIMAL(20,10)) | CAST(C2 AS DECIMAL(20,10)) | CAST(C3 AS DECIMAL(20,10)) | CAST(C4 AS DECIMAL(20,10)) | CAST(C5 AS DECIMAL(20,10)) | CAST(C6 AS DECIMAL(20,10)) | CAST(C7 AS DECIMAL(20,10)) |
+----------------------------+----------------------------+----------------------------+----------------------------+----------------------------+----------------------------+----------------------------+
|                       NULL |                       NULL |                       NULL |                       NULL |                       NULL |                       NULL |                       NULL |
|               0.0000000000 |               0.0000000000 |               0.0000000000 |               0.0000000000 |               0.0000000000 |               0.0000000000 |               0.0000000000 |
|               0.0000000000 |               0.1230000000 |               0.0000000000 |               0.0000000000 |               0.1230000000 |               0.1200000000 |               0.0000000000 |
|               0.0000000000 |               0.0000000000 |               0.0000000000 |               0.0000000000 |               0.0000000000 |               0.0000000000 |               0.0000000000 |
|               1.0000000000 |                       NULL |               1.0000000000 |               1.0000000000 |               1.0000000000 |               1.0000000000 |               1.0000000000 |
|              -1.0000000000 |                       NULL |                       NULL |              -1.0000000000 |              -1.0000000000 |              -1.0000000000 |                       NULL |
|               0.0000000000 |              -0.1000000000 |                       NULL |               0.0000000000 |              -0.1000000000 |              -0.1000000000 |                       NULL |
|                       NULL |                       NULL |                       NULL |      9999999999.9999999999 |                       NULL |                       NULL |                       NULL |
|                       NULL |                       NULL |                       NULL |     -9999999999.9999999999 |                       NULL |                       NULL |                       NULL |
|            1010.0000000000 |                       NULL |            1010.0000000000 |            1010.0000000000 |            1010.0000000000 |                       NULL |            1010.0000000000 |
|            5461.0000000000 |                       NULL |            5461.0000000000 |            5461.0000000000 |            5461.0000000000 |                       NULL |            5461.0000000000 |
+----------------------------+----------------------------+----------------------------+----------------------------+----------------------------+----------------------------+----------------------------+
SELECT CONVERT(C1 , NUMERIC(20,10)),CONVERT(C2 , NUMERIC(20,10)),CONVERT(C3 , NUMERIC(20,10)),CONVERT(C4 , NUMERIC(20,10)),CONVERT(C5 , NUMERIC(20,10)),CONVERT(C6 , NUMERIC(20,10)),CONVERT(C7 , NUMERIC(20,10))  FROM T1;
+------------------------------+------------------------------+------------------------------+------------------------------+------------------------------+------------------------------+------------------------------+
| CONVERT(C1 , NUMERIC(20,10)) | CONVERT(C2 , NUMERIC(20,10)) | CONVERT(C3 , NUMERIC(20,10)) | CONVERT(C4 , NUMERIC(20,10)) | CONVERT(C5 , NUMERIC(20,10)) | CONVERT(C6 , NUMERIC(20,10)) | CONVERT(C7 , NUMERIC(20,10)) |
+------------------------------+------------------------------+------------------------------+------------------------------+------------------------------+------------------------------+------------------------------+
|                         NULL |                         NULL |                         NULL |                         NULL |                         NULL |                         NULL |                         NULL |
|                 0.0000000000 |                 0.0000000000 |                 0.0000000000 |                 0.0000000000 |                 0.0000000000 |                 0.0000000000 |                 0.0000000000 |
|                 0.0000000000 |                 0.1230000000 |                 0.0000000000 |                 0.0000000000 |                 0.1230000000 |                 0.1200000000 |                 0.0000000000 |
|                 0.0000000000 |                 0.0000000000 |                 0.0000000000 |                 0.0000000000 |                 0.0000000000 |                 0.0000000000 |                 0.0000000000 |
|                 1.0000000000 |                         NULL |                 1.0000000000 |                 1.0000000000 |                 1.0000000000 |                 1.0000000000 |                 1.0000000000 |
|                -1.0000000000 |                         NULL |                         NULL |                -1.0000000000 |                -1.0000000000 |                -1.0000000000 |                         NULL |
|                 0.0000000000 |                -0.1000000000 |                         NULL |                 0.0000000000 |                -0.1000000000 |                -0.1000000000 |                         NULL |
|                         NULL |                         NULL |                         NULL |        9999999999.9999999999 |                         NULL |                         NULL |                         NULL |
|                         NULL |                         NULL |                         NULL |       -9999999999.9999999999 |                         NULL |                         NULL |                         NULL |
|              1010.0000000000 |                         NULL |              1010.0000000000 |              1010.0000000000 |              1010.0000000000 |                         NULL |              1010.0000000000 |
|              5461.0000000000 |                         NULL |              5461.0000000000 |              5461.0000000000 |              5461.0000000000 |                         NULL |              5461.0000000000 |
+------------------------------+------------------------------+------------------------------+------------------------------+------------------------------+------------------------------+------------------------------+
SELECT CAST(C1 AS CHAR),CAST(C2 AS CHAR),CAST(C3 AS CHAR),CAST(C4 AS CHAR),CAST(C5 AS CHAR),CAST(C6 AS CHAR),CAST(C7 AS CHAR)  FROM T1;
+------------------+------------------+------------------+--------------------------------------------------------------------+-------------------------------------+------------------+------------------+
| CAST(C1 AS CHAR) | CAST(C2 AS CHAR) | CAST(C3 AS CHAR) | CAST(C4 AS CHAR)                                                   | CAST(C5 AS CHAR)                    | CAST(C6 AS CHAR) | CAST(C7 AS CHAR) |
+------------------+------------------+------------------+--------------------------------------------------------------------+-------------------------------------+------------------+------------------+
| NULL             | NULL             | NULL             | NULL                                                               | NULL                                | NULL             | NULL             |
| 0                | 0.0000000000     | 0                | 0                                                                  | 0.000000000000000000000000000000    | 0.00             | 0000000000       |
| 0                | 0.1230000000     | 0                | 0                                                                  | 0.123000000000000000000000000000    | 0.12             | 0000000000       |
| 0                | 0.0000000000     | 0                | 0                                                                  | 0.000000000000000000000000000001    | 0.00             | 0000000000       |
| 1                | NULL             | 1                | 1                                                                  | 1.000000000000000000000000000000    | 1.00             | 0000000001       |
| -1               | NULL             | NULL             | -1                                                                 | -1.000000000000000000000000000000   | -1.00            | NULL             |
| 0                | -0.1000000000    | NULL             | 0                                                                  | -0.100000000000000000000000000000   | -0.10            | NULL             |
| NULL             | NULL             | NULL             | 10000000000000000000000000000000000000000000000000000000000000000  | NULL                                | NULL             | NULL             |
| NULL             | NULL             | NULL             | -10000000000000000000000000000000000000000000000000000000000000000 | NULL                                | NULL             | NULL             |
| 1010             | NULL             | 1010             | 1010                                                               | 1010.000000000000000000000000000000 | NULL             | 0000001010       |
| 5461             | NULL             | 5461             | 5461                                                               | 5461.000000000000000000000000000000 | NULL             | 0000005461       |
+------------------+------------------+------------------+--------------------------------------------------------------------+-------------------------------------+------------------+------------------+
SELECT CAST(C1 AS CHAR(10)),CAST(C2 AS CHAR(10)),CAST(C3 AS CHAR(10)),CAST(C4 AS CHAR(10)),CAST(C5 AS CHAR(10)),CAST(C6 AS CHAR(10)),CAST(C7 AS CHAR(10))  FROM T1;
+----------------------+----------------------+----------------------+----------------------+----------------------+----------------------+----------------------+
| CAST(C1 AS CHAR(10)) | CAST(C2 AS CHAR(10)) | CAST(C3 AS CHAR(10)) | CAST(C4 AS CHAR(10)) | CAST(C5 AS CHAR(10)) | CAST(C6 AS CHAR(10)) | CAST(C7 AS CHAR(10)) |
+----------------------+----------------------+----------------------+----------------------+----------------------+----------------------+----------------------+
| NULL                 | NULL                 | NULL                 | NULL                 | NULL                 | NULL                 | NULL                 |
| 0                    | 0.00000000           | 0                    | 0                    | 0.00000000           | 0.00                 | 0000000000           |
| 0                    | 0.12300000           | 0                    | 0                    | 0.12300000           | 0.12                 | 0000000000           |
| 0                    | 0.00000000           | 0                    | 0                    | 0.00000000           | 0.00                 | 0000000000           |
| 1                    | NULL                 | 1                    | 1                    | 1.00000000           | 1.00                 | 0000000001           |
| -1                   | NULL                 | NULL                 | -1                   | -1.0000000           | -1.00                | NULL                 |
| 0                    | -0.1000000           | NULL                 | 0                    | -0.1000000           | -0.10                | NULL                 |
| NULL                 | NULL                 | NULL                 | 1000000000           | NULL                 | NULL                 | NULL                 |
| NULL                 | NULL                 | NULL                 | -100000000           | NULL                 | NULL                 | NULL                 |
| 1010                 | NULL                 | 1010                 | 1010                 | 1010.00000           | NULL                 | 0000001010           |
| 5461                 | NULL                 | 5461                 | 5461                 | 5461.00000           | NULL                 | 0000005461           |
+----------------------+----------------------+----------------------+----------------------+----------------------+----------------------+----------------------+
SELECT CAST(C1 AS DATE),CAST(C2 AS DATE),CAST(C3 AS DATE),CAST(C4 AS DATE),CAST(C5 AS DATE),CAST(C6 AS DATE),CAST(C7 AS DATE)  FROM T1;
+------------------+------------------+------------------+------------------+------------------+------------------+------------------+
| CAST(C1 AS DATE) | CAST(C2 AS DATE) | CAST(C3 AS DATE) | CAST(C4 AS DATE) | CAST(C5 AS DATE) | CAST(C6 AS DATE) | CAST(C7 AS DATE) |
+------------------+------------------+------------------+------------------+------------------+------------------+------------------+
| NULL             | NULL             | NULL             | NULL             | NULL             | NULL             | NULL             |
| 0000-00-00       | 0000-00-00       | 0000-00-00       | 0000-00-00       | 0000-00-00       | 0000-00-00       | 0000-00-00       |
| 0000-00-00       | 0000-00-00       | 0000-00-00       | 0000-00-00       | 0000-00-00       | 0000-00-00       | 0000-00-00       |
| 0000-00-00       | 0000-00-00       | 0000-00-00       | 0000-00-00       | 0000-00-00       | 0000-00-00       | 0000-00-00       |
| NULL             | NULL             | NULL             | NULL             | NULL             | NULL             | NULL             |
| NULL             | NULL             | NULL             | NULL             | NULL             | NULL             | NULL             |
| 0000-00-00       | NULL             | NULL             | 0000-00-00       | NULL             | NULL             | NULL             |
| NULL             | NULL             | NULL             | NULL             | NULL             | NULL             | NULL             |
| NULL             | NULL             | NULL             | NULL             | NULL             | NULL             | NULL             |
| 2000-10-10       | NULL             | 2000-10-10       | 2000-10-10       | 2000-10-10       | NULL             | 2000-10-10       |
| NULL             | NULL             | NULL             | NULL             | NULL             | NULL             | NULL             |
+------------------+------------------+------------------+------------------+------------------+------------------+------------------+
SELECT CAST(C1 AS DATETIME),CAST(C2 AS DATETIME),CAST(C3 AS DATETIME),CAST(C4 AS DATETIME),CAST(C5 AS DATETIME),CAST(C6 AS DATETIME),CAST(C7 AS DATETIME)  FROM T1;
+----------------------+----------------------+----------------------+----------------------+----------------------+----------------------+----------------------+
| CAST(C1 AS DATETIME) | CAST(C2 AS DATETIME) | CAST(C3 AS DATETIME) | CAST(C4 AS DATETIME) | CAST(C5 AS DATETIME) | CAST(C6 AS DATETIME) | CAST(C7 AS DATETIME) |
+----------------------+----------------------+----------------------+----------------------+----------------------+----------------------+----------------------+
| NULL                 | NULL                 | NULL                 | NULL                 | NULL                 | NULL                 | NULL                 |
| 0000-00-00 00:00:00  | 0000-00-00 00:00:00  | 0000-00-00 00:00:00  | 0000-00-00 00:00:00  | 0000-00-00 00:00:00  | 0000-00-00 00:00:00  | 0000-00-00 00:00:00  |
| 0000-00-00 00:00:00  | 0000-00-00 00:00:00  | 0000-00-00 00:00:00  | 0000-00-00 00:00:00  | 0000-00-00 00:00:00  | 0000-00-00 00:00:00  | 0000-00-00 00:00:00  |
| 0000-00-00 00:00:00  | 0000-00-00 00:00:00  | 0000-00-00 00:00:00  | 0000-00-00 00:00:00  | 0000-00-00 00:00:00  | 0000-00-00 00:00:00  | 0000-00-00 00:00:00  |
| NULL                 | NULL                 | NULL                 | NULL                 | NULL                 | NULL                 | NULL                 |
| NULL                 | NULL                 | NULL                 | NULL                 | NULL                 | NULL                 | NULL                 |
| 0000-00-00 00:00:00  | NULL                 | NULL                 | 0000-00-00 00:00:00  | NULL                 | NULL                 | NULL                 |
| NULL                 | NULL                 | NULL                 | NULL                 | NULL                 | NULL                 | NULL                 |
| NULL                 | NULL                 | NULL                 | NULL                 | NULL                 | NULL                 | NULL                 |
| 2000-10-10 00:00:00  | NULL                 | 2000-10-10 00:00:00  | 2000-10-10 00:00:00  | 2000-10-10 00:00:00  | NULL                 | 2000-10-10 00:00:00  |
| NULL                 | NULL                 | NULL                 | NULL                 | NULL                 | NULL                 | NULL                 |
+----------------------+----------------------+----------------------+----------------------+----------------------+----------------------+----------------------+
SELECT CAST(C1 AS TIME),CAST(C2 AS TIME),CAST(C3 AS TIME),CAST(C4 AS TIME),CAST(C5 AS TIME),CAST(C6 AS TIME),CAST(C7 AS TIME)  FROM T1;
+------------------+------------------+------------------+------------------+------------------+------------------+------------------+
| CAST(C1 AS TIME) | CAST(C2 AS TIME) | CAST(C3 AS TIME) | CAST(C4 AS TIME) | CAST(C5 AS TIME) | CAST(C6 AS TIME) | CAST(C7 AS TIME) |
+------------------+------------------+------------------+------------------+------------------+------------------+------------------+
| NULL             | NULL             | NULL             | NULL             | NULL             | NULL             | NULL             |
| 00:00:00         | 00:00:00         | 00:00:00         | 00:00:00         | 00:00:00         | 00:00:00         | 00:00:00         |
| 00:00:00         | 00:00:00         | 00:00:00         | 00:00:00         | 00:00:00         | 00:00:00         | 00:00:00         |
| 00:00:00         | 00:00:00         | 00:00:00         | 00:00:00         | 00:00:00         | 00:00:00         | 00:00:00         |
| 00:00:01         | NULL             | 00:00:01         | 00:00:01         | 00:00:01         | 00:00:01         | 00:00:01         |
| -00:00:01        | NULL             | NULL             | -00:00:01        | -00:00:01        | -00:00:01        | NULL             |
| 00:00:00         | 00:00:00         | NULL             | 00:00:00         | 00:00:00         | 00:00:00         | NULL             |
| NULL             | NULL             | NULL             | 00:00:00         | NULL             | NULL             | NULL             |
| NULL             | NULL             | NULL             | NULL             | NULL             | NULL             | NULL             |
| 00:10:10         | NULL             | 00:10:10         | 00:10:10         | 00:10:10         | NULL             | 00:10:10         |
| NULL             | NULL             | NULL             | NULL             | NULL             | NULL             | NULL             |
+------------------+------------------+------------------+------------------+------------------+------------------+------------------+
SELECT CAST(C1 AS SIGNED),CAST(C2 AS SIGNED),CAST(C3 AS SIGNED),CAST(C4 AS SIGNED),CAST(C5 AS SIGNED),CAST(C6 AS SIGNED),CAST(C7 AS SIGNED)  FROM T1;
+--------------------+--------------------+--------------------+----------------------+--------------------+--------------------+--------------------+
| CAST(C1 AS SIGNED) | CAST(C2 AS SIGNED) | CAST(C3 AS SIGNED) | CAST(C4 AS SIGNED)   | CAST(C5 AS SIGNED) | CAST(C6 AS SIGNED) | CAST(C7 AS SIGNED) |
+--------------------+--------------------+--------------------+----------------------+--------------------+--------------------+--------------------+
|               NULL |               NULL |               NULL |                 NULL |               NULL |               NULL |               NULL |
|                  0 |                  0 |                  0 |                    0 |                  0 |                  0 |                  0 |
|                  0 |                  0 |                  0 |                    0 |                  0 |                  0 |                  0 |
|                  0 |                  0 |                  0 |                    0 |                  0 |                  0 |                  0 |
|                  1 |               NULL |                  1 |                    1 |                  1 |                  1 |                  1 |
|                 -1 |               NULL |               NULL |                   -1 |                 -1 |                 -1 |               NULL |
|                  0 |                  0 |               NULL |                    0 |                  0 |                  0 |               NULL |
|               NULL |               NULL |               NULL |  9223372036854775807 |               NULL |               NULL |               NULL |
|               NULL |               NULL |               NULL | -9223372036854775808 |               NULL |               NULL |               NULL |
|               1010 |               NULL |               1010 |                 1010 |               1010 |               NULL |               1010 |
|               5461 |               NULL |               5461 |                 5461 |               5461 |               NULL |               5461 |
+--------------------+--------------------+--------------------+----------------------+--------------------+--------------------+--------------------+
SELECT CAST(C1 AS UNSIGNED),CAST(C2 AS UNSIGNED),CAST(C3 AS UNSIGNED),CAST(C4 AS UNSIGNED),CAST(C5 AS UNSIGNED),CAST(C6 AS UNSIGNED),CAST(C7 AS UNSIGNED)  FROM T1;
+----------------------+----------------------+----------------------+----------------------+----------------------+----------------------+----------------------+
| CAST(C1 AS UNSIGNED) | CAST(C2 AS UNSIGNED) | CAST(C3 AS UNSIGNED) | CAST(C4 AS UNSIGNED) | CAST(C5 AS UNSIGNED) | CAST(C6 AS UNSIGNED) | CAST(C7 AS UNSIGNED) |
+----------------------+----------------------+----------------------+----------------------+----------------------+----------------------+----------------------+
|                 NULL |                 NULL |                 NULL |                 NULL |                 NULL |                 NULL |                 NULL |
|                    0 |                    0 |                    0 |                    0 |                    0 |                    0 |                    0 |
|                    0 |                    0 |                    0 |                    0 |                    0 |                    0 |                    0 |
|                    0 |                    0 |                    0 |                    0 |                    0 |                    0 |                    0 |
|                    1 |                 NULL |                    1 |                    1 |                    1 |                    1 |                    1 |
|                    0 |                 NULL |                 NULL |                    0 |                    0 |                    0 |                 NULL |
|                    0 |                    0 |                 NULL |                    0 |                    0 |                    0 |                 NULL |
|                 NULL |                 NULL |                 NULL | 18446744073709551615 |                 NULL |                 NULL |                 NULL |
|                 NULL |                 NULL |                 NULL |                    0 |                 NULL |                 NULL |                 NULL |
|                 1010 |                 NULL |                 1010 |                 1010 |                 1010 |                 NULL |                 1010 |
|                 5461 |                 NULL |                 5461 |                 5461 |                 5461 |                 NULL |                 5461 |
+----------------------+----------------------+----------------------+----------------------+----------------------+----------------------+----------------------+
SELECT CAST(C1 AS JSON),CAST(C2 AS JSON),CAST(C3 AS JSON),CAST(C4 AS JSON),CAST(C5 AS JSON),CAST(C6 AS JSON),CAST(C7 AS JSON)  FROM T1;
+------------------+------------------+------------------+--------------------------------------------------------------------+-------------------------------------+------------------+------------------+
| CAST(C1 AS JSON) | CAST(C2 AS JSON) | CAST(C3 AS JSON) | CAST(C4 AS JSON)                                                   | CAST(C5 AS JSON)                    | CAST(C6 AS JSON) | CAST(C7 AS JSON) |
+------------------+------------------+------------------+--------------------------------------------------------------------+-------------------------------------+------------------+------------------+
| NULL             | NULL             | NULL             | NULL                                                               | NULL                                | NULL             | NULL             |
| 0                | 0.0000000000     | 0                | 0                                                                  | 0.000000000000000000000000000000    | 0.00             | 0                |
| 0                | 0.1230000000     | 0                | 0                                                                  | 0.123000000000000000000000000000    | 0.12             | 0                |
| 0                | 0.0000000000     | 0                | 0                                                                  | 0.000000000000000000000000000001    | 0.00             | 0                |
| 1                | NULL             | 1                | 1                                                                  | 1.000000000000000000000000000000    | 1.00             | 1                |
| -1               | NULL             | NULL             | -1                                                                 | -1.000000000000000000000000000000   | -1.00            | NULL             |
| 0                | -0.1000000000    | NULL             | 0                                                                  | -0.100000000000000000000000000000   | -0.10            | NULL             |
| NULL             | NULL             | NULL             | 10000000000000000000000000000000000000000000000000000000000000000  | NULL                                | NULL             | NULL             |
| NULL             | NULL             | NULL             | -10000000000000000000000000000000000000000000000000000000000000000 | NULL                                | NULL             | NULL             |
| 1010             | NULL             | 1010             | 1010                                                               | 1010.000000000000000000000000000000 | NULL             | 1010             |
| 5461             | NULL             | 5461             | 5461                                                               | 5461.000000000000000000000000000000 | NULL             | 5461             |
+------------------+------------------+------------------+--------------------------------------------------------------------+-------------------------------------+------------------+------------------+
##BOOL/BOOLEAN/TINYINT##
DROP TABLE IF EXISTS T2;
CREATE TABLE T2(C1 BOOL,C2 BOOLEAN,C3 TINYINT);
INSERT INTO T2 SELECT C1,C2,C3 FROM T1 WHERE C1 = 0;
SELECT * FROM T2;
+------+------+------+
| C1   | C2   | C3   |
+------+------+------+
|    0 |    0 |    0 |
|    0 |    0 |    0 |
|    0 |    0 |    0 |
|    0 |    0 | NULL |
+------+------+------+
INSERT INTO T2 VALUES(1,1,1);
SELECT CAST(C1 AS DECIMAL),CAST(C1 AS DECIMAL(65,0)) FROM T2;
+---------------------+---------------------------+
| CAST(C1 AS DECIMAL) | CAST(C1 AS DECIMAL(65,0)) |
+---------------------+---------------------------+
|                   0 |                         0 |
|                   0 |                         0 |
|                   0 |                         0 |
|                   0 |                         0 |
|                   1 |                         1 |
+---------------------+---------------------------+
SELECT CAST(C2 AS DECIMAL),CAST(C2 AS DECIMAL(65,0)) FROM T2;
+---------------------+---------------------------+
| CAST(C2 AS DECIMAL) | CAST(C2 AS DECIMAL(65,0)) |
+---------------------+---------------------------+
|                   0 |                         0 |
|                   0 |                         0 |
|                   0 |                         0 |
|                   0 |                         0 |
|                   1 |                         1 |
+---------------------+---------------------------+
SELECT CAST(C3 AS DECIMAL),CAST(C3 AS DECIMAL(65,0)) FROM T2;
+---------------------+---------------------------+
| CAST(C3 AS DECIMAL) | CAST(C3 AS DECIMAL(65,0)) |
+---------------------+---------------------------+
|                   0 |                         0 |
|                   0 |                         0 |
|                   0 |                         0 |
|                NULL |                      NULL |
|                   1 |                         1 |
+---------------------+---------------------------+
DROP TABLE IF EXISTS T3;
Warnings:
Note	1051	Unknown table 'test.t3'
CREATE TABLE T3(C1 DECIMAL,C2 DECIMAL(65,0));
INSERT INTO T3 SELECT C1,C1 FROM T2;
INSERT INTO T3 SELECT C2,C2 FROM T2;
INSERT INTO T3 SELECT C3,C3 FROM T2;
SELECT * FROM T3;
+------+------+
| C1   | C2   |
+------+------+
|    0 |    0 |
|    0 |    0 |
|    0 |    0 |
|    0 |    0 |
|    1 |    1 |
|    0 |    0 |
|    0 |    0 |
|    0 |    0 |
|    0 |    0 |
|    1 |    1 |
|    0 |    0 |
|    0 |    0 |
|    0 |    0 |
| NULL | NULL |
|    1 |    1 |
+------+------+
##INT##
DROP TABLE IF EXISTS T2;
CREATE TABLE T2(C1 SMALLINT,C2 INT,C3 INTEGER,C4 BIGINT);
INSERT INTO T2 SELECT C1,C2,C3,C5 FROM T1 WHERE C1 < 32768;
SELECT * FROM T2;
+------+------+------+------+
| C1   | C2   | C3   | C4   |
+------+------+------+------+
|    0 |    0 |    0 |    0 |
|    0 |    0 |    0 |    0 |
|    0 |    0 |    0 |    0 |
|    1 | NULL |    1 |    1 |
|   -1 | NULL | NULL |   -1 |
|    0 |    0 | NULL |    0 |
| 1010 | NULL | 1010 | 1010 |
| 5461 | NULL | 5461 | 5461 |
+------+------+------+------+
SELECT CAST(C1 AS DECIMAL),CAST(C1 AS DECIMAL(65,0)) FROM T2;
+---------------------+---------------------------+
| CAST(C1 AS DECIMAL) | CAST(C1 AS DECIMAL(65,0)) |
+---------------------+---------------------------+
|                   0 |                         0 |
|                   0 |                         0 |
|                   0 |                         0 |
|                   1 |                         1 |
|                  -1 |                        -1 |
|                   0 |                         0 |
|                1010 |                      1010 |
|                5461 |                      5461 |
+---------------------+---------------------------+
SELECT CAST(C2 AS DECIMAL),CAST(C2 AS DECIMAL(65,0)) FROM T2;
+---------------------+---------------------------+
| CAST(C2 AS DECIMAL) | CAST(C2 AS DECIMAL(65,0)) |
+---------------------+---------------------------+
|                   0 |                         0 |
|                   0 |                         0 |
|                   0 |                         0 |
|                NULL |                      NULL |
|                NULL |                      NULL |
|                   0 |                         0 |
|                NULL |                      NULL |
|                NULL |                      NULL |
+---------------------+---------------------------+
SELECT CAST(C3 AS DECIMAL),CAST(C3 AS DECIMAL(65,0)) FROM T2;
+---------------------+---------------------------+
| CAST(C3 AS DECIMAL) | CAST(C3 AS DECIMAL(65,0)) |
+---------------------+---------------------------+
|                   0 |                         0 |
|                   0 |                         0 |
|                   0 |                         0 |
|                   1 |                         1 |
|                NULL |                      NULL |
|                NULL |                      NULL |
|                1010 |                      1010 |
|                5461 |                      5461 |
+---------------------+---------------------------+
SELECT CAST(C4 AS DECIMAL),CAST(C4 AS DECIMAL(65,0)) FROM T2;
+---------------------+---------------------------+
| CAST(C4 AS DECIMAL) | CAST(C4 AS DECIMAL(65,0)) |
+---------------------+---------------------------+
|                   0 |                         0 |
|                   0 |                         0 |
|                   0 |                         0 |
|                   1 |                         1 |
|                  -1 |                        -1 |
|                   0 |                         0 |
|                1010 |                      1010 |
|                5461 |                      5461 |
+---------------------+---------------------------+
INSERT INTO T3 SELECT C1,C1 FROM T2;
INSERT INTO T3 SELECT C2,C2 FROM T2;
INSERT INTO T3 SELECT C3,C3 FROM T2;
INSERT INTO T3 SELECT C4,C4 FROM T2;
SELECT * FROM T3;
+------+------+
| C1   | C2   |
+------+------+
|    0 |    0 |
|    0 |    0 |
|    0 |    0 |
|    0 |    0 |
|    1 |    1 |
|    0 |    0 |
|    0 |    0 |
|    0 |    0 |
|    0 |    0 |
|    1 |    1 |
|    0 |    0 |
|    0 |    0 |
|    0 |    0 |
| NULL | NULL |
|    1 |    1 |
|    0 |    0 |
|    0 |    0 |
|    0 |    0 |
|    1 |    1 |
|   -1 |   -1 |
|    0 |    0 |
| 1010 | 1010 |
| 5461 | 5461 |
|    0 |    0 |
|    0 |    0 |
|    0 |    0 |
| NULL | NULL |
| NULL | NULL |
|    0 |    0 |
| NULL | NULL |
| NULL | NULL |
|    0 |    0 |
|    0 |    0 |
|    0 |    0 |
|    1 |    1 |
| NULL | NULL |
| NULL | NULL |
| 1010 | 1010 |
| 5461 | 5461 |
|    0 |    0 |
|    0 |    0 |
|    0 |    0 |
|    1 |    1 |
|   -1 |   -1 |
|    0 |    0 |
| 1010 | 1010 |
| 5461 | 5461 |
+------+------+
##FLOAT,DOUBLE##
DROP TABLE IF EXISTS T2;
CREATE TABLE T2(C1 FLOAT,C2 DOUBLE,C3 FLOAT(20,10),C4 DOUBLE(20,10));
INSERT INTO T2 SELECT C1,C2,C3,C5 FROM T1;
SELECT * FROM T2;
+------+-------+-----------------+-----------------+
| C1   | C2    | C3              | C4              |
+------+-------+-----------------+-----------------+
| NULL |  NULL |            NULL |            NULL |
|    0 |     0 |    0.0000000000 |    0.0000000000 |
|    0 | 0.123 |    0.0000000000 |    0.1230000000 |
|    0 |     0 |    0.0000000000 |    0.0000000000 |
|    1 |  NULL |    1.0000000000 |    1.0000000000 |
|   -1 |  NULL |            NULL |   -1.0000000000 |
|    0 |  -0.1 |            NULL |   -0.1000000000 |
| NULL |  NULL |            NULL |            NULL |
| NULL |  NULL |            NULL |            NULL |
| 1010 |  NULL | 1010.0000000000 | 1010.0000000000 |
| 5461 |  NULL | 5461.0000000000 | 5461.0000000000 |
+------+-------+-----------------+-----------------+
SELECT CAST(C1 AS DECIMAL),CAST(C1 AS DECIMAL(65,0)) FROM T2;
+---------------------+---------------------------+
| CAST(C1 AS DECIMAL) | CAST(C1 AS DECIMAL(65,0)) |
+---------------------+---------------------------+
|                NULL |                      NULL |
|                   0 |                         0 |
|                   0 |                         0 |
|                   0 |                         0 |
|                   1 |                         1 |
|                  -1 |                        -1 |
|                   0 |                         0 |
|                NULL |                      NULL |
|                NULL |                      NULL |
|                1010 |                      1010 |
|                5461 |                      5461 |
+---------------------+---------------------------+
SELECT CAST(C2 AS DECIMAL),CAST(C2 AS DECIMAL(65,0)) FROM T2;
+---------------------+---------------------------+
| CAST(C2 AS DECIMAL) | CAST(C2 AS DECIMAL(65,0)) |
+---------------------+---------------------------+
|                NULL |                      NULL |
|                   0 |                         0 |
|                   0 |                         0 |
|                   0 |                         0 |
|                NULL |                      NULL |
|                NULL |                      NULL |
|                   0 |                         0 |
|                NULL |                      NULL |
|                NULL |                      NULL |
|                NULL |                      NULL |
|                NULL |                      NULL |
+---------------------+---------------------------+
SELECT CAST(C3 AS DECIMAL),CAST(C3 AS DECIMAL(65,0)) FROM T2;
+---------------------+---------------------------+
| CAST(C3 AS DECIMAL) | CAST(C3 AS DECIMAL(65,0)) |
+---------------------+---------------------------+
|                NULL |                      NULL |
|                   0 |                         0 |
|                   0 |                         0 |
|                   0 |                         0 |
|                   1 |                         1 |
|                NULL |                      NULL |
|                NULL |                      NULL |
|                NULL |                      NULL |
|                NULL |                      NULL |
|                1010 |                      1010 |
|                5461 |                      5461 |
+---------------------+---------------------------+
SELECT CAST(C4 AS DECIMAL),CAST(C4 AS DECIMAL(65,0)) FROM T2;
+---------------------+---------------------------+
| CAST(C4 AS DECIMAL) | CAST(C4 AS DECIMAL(65,0)) |
+---------------------+---------------------------+
|                NULL |                      NULL |
|                   0 |                         0 |
|                   0 |                         0 |
|                   0 |                         0 |
|                   1 |                         1 |
|                  -1 |                        -1 |
|                   0 |                         0 |
|                NULL |                      NULL |
|                NULL |                      NULL |
|                1010 |                      1010 |
|                5461 |                      5461 |
+---------------------+---------------------------+
DELETE FROM T3;
INSERT INTO T3 SELECT C1,C1 FROM T2;
INSERT INTO T3 SELECT C2,C2 FROM T2;
Warnings:
Warning	1265	Data truncated for column 'C1' at row 3
Warning	1265	Data truncated for column 'C2' at row 3
Warning	1265	Data truncated for column 'C1' at row 7
Warning	1265	Data truncated for column 'C2' at row 7
INSERT INTO T3 SELECT C3,C3 FROM T2;
INSERT INTO T3 SELECT C4,C4 FROM T2;
Warnings:
Warning	1265	Data truncated for column 'C1' at row 3
Warning	1265	Data truncated for column 'C2' at row 3
Warning	1265	Data truncated for column 'C1' at row 7
Warning	1265	Data truncated for column 'C2' at row 7
SELECT * FROM T3;
+------+------+
| C1   | C2   |
+------+------+
| NULL | NULL |
|    0 |    0 |
|    0 |    0 |
|    0 |    0 |
|    1 |    1 |
|   -1 |   -1 |
|    0 |    0 |
| NULL | NULL |
| NULL | NULL |
| 1010 | 1010 |
| 5461 | 5461 |
| NULL | NULL |
|    0 |    0 |
|    0 |    0 |
|    0 |    0 |
| NULL | NULL |
| NULL | NULL |
|    0 |    0 |
| NULL | NULL |
| NULL | NULL |
| NULL | NULL |
| NULL | NULL |
| NULL | NULL |
|    0 |    0 |
|    0 |    0 |
|    0 |    0 |
|    1 |    1 |
| NULL | NULL |
| NULL | NULL |
| NULL | NULL |
| NULL | NULL |
| 1010 | 1010 |
| 5461 | 5461 |
| NULL | NULL |
|    0 |    0 |
|    0 |    0 |
|    0 |    0 |
|    1 |    1 |
|   -1 |   -1 |
|    0 |    0 |
| NULL | NULL |
| NULL | NULL |
| 1010 | 1010 |
| 5461 | 5461 |
+------+------+
##BIT##
DROP TABLE IF EXISTS T2;
CREATE TABLE T2(C1 BIT);
INSERT INTO T2(C1) SELECT C1 FROM T1 WHERE C1 BETWEEN 0 AND 1;
SELECT * FROM T2;
+------+
| C1   |
+------+
|      |
|      |
|      |
|     |
|      |
+------+
SELECT CAST(C1 AS DECIMAL),CAST(C1 AS DECIMAL(65,0)) FROM T2;
+---------------------+---------------------------+
| CAST(C1 AS DECIMAL) | CAST(C1 AS DECIMAL(65,0)) |
+---------------------+---------------------------+
|                   0 |                         0 |
|                   0 |                         0 |
|                   0 |                         0 |
|                   1 |                         1 |
|                   0 |                         0 |
+---------------------+---------------------------+
DELETE FROM T3;
INSERT INTO T3 SELECT C1,C1 FROM T2;
SELECT * FROM T3;
+------+------+
| C1   | C2   |
+------+------+
|    0 |    0 |
|    0 |    0 |
|    0 |    0 |
|    1 |    1 |
|    0 |    0 |
+------+------+
##CHAR##
DROP TABLE IF EXISTS T2;
CREATE TABLE T2(C1 CHAR(66),C2 VARCHAR(66),C3 BINARY(66),C4 VARBINARY(66));
INSERT INTO T2 SELECT C1,C2,C3,C4 FROM T1;
SELECT * FROM T2;
+------+---------------+--------------------------------------------------------------------+--------------------------------------------------------------------+
| C1   | C2            | C3                                                                 | C4                                                                 |
+------+---------------+--------------------------------------------------------------------+--------------------------------------------------------------------+
| NULL | NULL          | NULL                                                               | NULL                                                               |
| 0    | 0.0000000000  | 0                                                                  | 0                                                                  |
| 0    | 0.1230000000  | 0                                                                  | 0                                                                  |
| 0    | 0.0000000000  | 0                                                                  | 0                                                                  |
| 1    | NULL          | 1                                                                  | 1                                                                  |
| -1   | NULL          | NULL                                                               | -1                                                                 |
| 0    | -0.1000000000 | NULL                                                               | 0                                                                  |
| NULL | NULL          | NULL                                                               | 10000000000000000000000000000000000000000000000000000000000000000  |
| NULL | NULL          | NULL                                                               | -10000000000000000000000000000000000000000000000000000000000000000 |
| 1010 | NULL          | 1010                                                               | 1010                                                               |
| 5461 | NULL          | 5461                                                               | 5461                                                               |
+------+---------------+--------------------------------------------------------------------+--------------------------------------------------------------------+
SELECT CAST(C1 AS DECIMAL),CAST(C1 AS DECIMAL(65,0)) FROM T2;
+---------------------+---------------------------+
| CAST(C1 AS DECIMAL) | CAST(C1 AS DECIMAL(65,0)) |
+---------------------+---------------------------+
|                NULL |                      NULL |
|                   0 |                         0 |
|                   0 |                         0 |
|                   0 |                         0 |
|                   1 |                         1 |
|                  -1 |                        -1 |
|                   0 |                         0 |
|                NULL |                      NULL |
|                NULL |                      NULL |
|                1010 |                      1010 |
|                5461 |                      5461 |
+---------------------+---------------------------+
SELECT CAST(C2 AS DECIMAL),CAST(C2 AS DECIMAL(65,0)) FROM T2;
+---------------------+---------------------------+
| CAST(C2 AS DECIMAL) | CAST(C2 AS DECIMAL(65,0)) |
+---------------------+---------------------------+
|                NULL |                      NULL |
|                   0 |                         0 |
|                   0 |                         0 |
|                   0 |                         0 |
|                NULL |                      NULL |
|                NULL |                      NULL |
|                   0 |                         0 |
|                NULL |                      NULL |
|                NULL |                      NULL |
|                NULL |                      NULL |
|                NULL |                      NULL |
+---------------------+---------------------------+
SELECT CAST(C3 AS DECIMAL),CAST(C3 AS DECIMAL(65,0)) FROM T2;
+---------------------+---------------------------+
| CAST(C3 AS DECIMAL) | CAST(C3 AS DECIMAL(65,0)) |
+---------------------+---------------------------+
|                NULL |                      NULL |
|                   0 |                         0 |
|                   0 |                         0 |
|                   0 |                         0 |
|                   1 |                         1 |
|                NULL |                      NULL |
|                NULL |                      NULL |
|                NULL |                      NULL |
|                NULL |                      NULL |
|                1010 |                      1010 |
|                5461 |                      5461 |
+---------------------+---------------------------+
Warnings:
Warning	1292	Truncated incorrect DECIMAL value: '0'
Warning	1292	Truncated incorrect DECIMAL value: '0'
Warning	1292	Truncated incorrect DECIMAL value: '0'
Warning	1292	Truncated incorrect DECIMAL value: '1'
Warning	1292	Truncated incorrect DECIMAL value: '1010'
Warning	1292	Truncated incorrect DECIMAL value: '5461'
Warning	1292	Truncated incorrect DECIMAL value: '0'
Warning	1292	Truncated incorrect DECIMAL value: '0'
Warning	1292	Truncated incorrect DECIMAL value: '0'
Warning	1292	Truncated incorrect DECIMAL value: '1'
Warning	1292	Truncated incorrect DECIMAL value: '1010'
Warning	1292	Truncated incorrect DECIMAL value: '5461'
SELECT CAST(C4 AS DECIMAL),CAST(C4 AS DECIMAL(65,0)) FROM T2;
+---------------------+--------------------------------------------------------------------+
| CAST(C4 AS DECIMAL) | CAST(C4 AS DECIMAL(65,0))                                          |
+---------------------+--------------------------------------------------------------------+
|                NULL |                                                               NULL |
|                   0 |                                                                  0 |
|                   0 |                                                                  0 |
|                   0 |                                                                  0 |
|                   1 |                                                                  1 |
|                  -1 |                                                                 -1 |
|                   0 |                                                                  0 |
|          9999999999 |  10000000000000000000000000000000000000000000000000000000000000000 |
|         -9999999999 | -10000000000000000000000000000000000000000000000000000000000000000 |
|                1010 |                                                               1010 |
|                5461 |                                                               5461 |
+---------------------+--------------------------------------------------------------------+
DELETE FROM T3;
INSERT INTO T3 SELECT C1,C1 FROM T2;
INSERT INTO T3 SELECT C2,C2 FROM T2;
Warnings:
Warning	1265	Data truncated for column 'C1' at row 3
Warning	1265	Data truncated for column 'C2' at row 3
Warning	1265	Data truncated for column 'C1' at row 7
Warning	1265	Data truncated for column 'C2' at row 7
INSERT INTO T3 SELECT C3,C3 FROM T2;
ERROR HY000: Incorrect decimal value for column 'C1' at row 2
INSERT INTO T3 SELECT C4,C4 FROM T2;
ERROR 22003: Out of range value for column 'C1' at row 8
SELECT * FROM T3;
+------+------+
| C1   | C2   |
+------+------+
| NULL | NULL |
|    0 |    0 |
|    0 |    0 |
|    0 |    0 |
|    1 |    1 |
|   -1 |   -1 |
|    0 |    0 |
| NULL | NULL |
| NULL | NULL |
| 1010 | 1010 |
| 5461 | 5461 |
| NULL | NULL |
|    0 |    0 |
|    0 |    0 |
|    0 |    0 |
| NULL | NULL |
| NULL | NULL |
|    0 |    0 |
| NULL | NULL |
| NULL | NULL |
| NULL | NULL |
| NULL | NULL |
+------+------+
##DATE##
DROP TABLE IF EXISTS T2;
CREATE TABLE T2(C1 DATETIME,C2 TIMESTAMP,C3 DATE,C4 TIME,C5 YEAR);
INSERT INTO T2 SELECT C1,C1,C1,C1,C1 FROM T1 WHERE C1 = 0;
SELECT * FROM T2;
+---------------------+---------------------+------------+----------+------+
| C1                  | C2                  | C3         | C4       | C5   |
+---------------------+---------------------+------------+----------+------+
| 0000-00-00 00:00:00 | 0000-00-00 00:00:00 | 0000-00-00 | 00:00:00 | 2000 |
| 0000-00-00 00:00:00 | 0000-00-00 00:00:00 | 0000-00-00 | 00:00:00 | 2000 |
| 0000-00-00 00:00:00 | 0000-00-00 00:00:00 | 0000-00-00 | 00:00:00 | 2000 |
| 0000-00-00 00:00:00 | 0000-00-00 00:00:00 | 0000-00-00 | 00:00:00 | 2000 |
+---------------------+---------------------+------------+----------+------+
SELECT CAST(C1 AS DECIMAL),CAST(C1 AS DECIMAL(65,0)) FROM T2;
+---------------------+---------------------------+
| CAST(C1 AS DECIMAL) | CAST(C1 AS DECIMAL(65,0)) |
+---------------------+---------------------------+
|                   0 |                         0 |
|                   0 |                         0 |
|                   0 |                         0 |
|                   0 |                         0 |
+---------------------+---------------------------+
SELECT CAST(C2 AS DECIMAL),CAST(C2 AS DECIMAL(65,0)) FROM T2;
+---------------------+---------------------------+
| CAST(C2 AS DECIMAL) | CAST(C2 AS DECIMAL(65,0)) |
+---------------------+---------------------------+
|                   0 |                         0 |
|                   0 |                         0 |
|                   0 |                         0 |
|                   0 |                         0 |
+---------------------+---------------------------+
SELECT CAST(C3 AS DECIMAL),CAST(C3 AS DECIMAL(65,0)) FROM T2;
+---------------------+---------------------------+
| CAST(C3 AS DECIMAL) | CAST(C3 AS DECIMAL(65,0)) |
+---------------------+---------------------------+
|                   0 |                         0 |
|                   0 |                         0 |
|                   0 |                         0 |
|                   0 |                         0 |
+---------------------+---------------------------+
SELECT CAST(C4 AS DECIMAL),CAST(C4 AS DECIMAL(65,0)) FROM T2;
+---------------------+---------------------------+
| CAST(C4 AS DECIMAL) | CAST(C4 AS DECIMAL(65,0)) |
+---------------------+---------------------------+
|                   0 |                         0 |
|                   0 |                         0 |
|                   0 |                         0 |
|                   0 |                         0 |
+---------------------+---------------------------+
SELECT CAST(C5 AS DECIMAL),CAST(C5 AS DECIMAL(65,0)) FROM T2;
+---------------------+---------------------------+
| CAST(C5 AS DECIMAL) | CAST(C5 AS DECIMAL(65,0)) |
+---------------------+---------------------------+
|                2000 |                      2000 |
|                2000 |                      2000 |
|                2000 |                      2000 |
|                2000 |                      2000 |
+---------------------+---------------------------+
DELETE FROM T3;
INSERT INTO T3 SELECT C1,C1 FROM T2;
INSERT INTO T3 SELECT C2,C2 FROM T2;
INSERT INTO T3 SELECT C3,C3 FROM T2;
INSERT INTO T3 SELECT C4,C4 FROM T2;
INSERT INTO T3 SELECT C5,C5 FROM T2;
SELECT * FROM T3;
+------+------+
| C1   | C2   |
+------+------+
|    0 |    0 |
|    0 |    0 |
|    0 |    0 |
|    0 |    0 |
|    0 |    0 |
|    0 |    0 |
|    0 |    0 |
|    0 |    0 |
|    0 |    0 |
|    0 |    0 |
|    0 |    0 |
|    0 |    0 |
|    0 |    0 |
|    0 |    0 |
|    0 |    0 |
|    0 |    0 |
| 2000 | 2000 |
| 2000 | 2000 |
| 2000 | 2000 |
| 2000 | 2000 |
+------+------+
##BLOB,TEXT##
DROP TABLE IF EXISTS T2;
CREATE TABLE T2(C1 BLOB,C2 TINYBLOB,C3 MEDIUMBLOB,C4 LONGBLOB,C5 TINYTEXT,C6 TEXT,C7 LONGTEXT);
INSERT INTO T2 SELECT * FROM T1;
SELECT * FROM T2;
+------+---------------+------+--------------------------------------------------------------------+-------------------------------------+-------+------------+
| C1   | C2            | C3   | C4                                                                 | C5                                  | C6    | C7         |
+------+---------------+------+--------------------------------------------------------------------+-------------------------------------+-------+------------+
| NULL | NULL          | NULL | NULL                                                               | NULL                                | NULL  | NULL       |
| 0    | 0.0000000000  | 0    | 0                                                                  | 0.000000000000000000000000000000    | 0.00  | 0000000000 |
| 0    | 0.1230000000  | 0    | 0                                                                  | 0.123000000000000000000000000000    | 0.12  | 0000000000 |
| 0    | 0.0000000000  | 0    | 0                                                                  | 0.000000000000000000000000000001    | 0.00  | 0000000000 |
| 1    | NULL          | 1    | 1                                                                  | 1.000000000000000000000000000000    | 1.00  | 0000000001 |
| -1   | NULL          | NULL | -1                                                                 | -1.000000000000000000000000000000   | -1.00 | NULL       |
| 0    | -0.1000000000 | NULL | 0                                                                  | -0.100000000000000000000000000000   | -0.10 | NULL       |
| NULL | NULL          | NULL | 10000000000000000000000000000000000000000000000000000000000000000  | NULL                                | NULL  | NULL       |
| NULL | NULL          | NULL | -10000000000000000000000000000000000000000000000000000000000000000 | NULL                                | NULL  | NULL       |
| 1010 | NULL          | 1010 | 1010                                                               | 1010.000000000000000000000000000000 | NULL  | 0000001010 |
| 5461 | NULL          | 5461 | 5461                                                               | 5461.000000000000000000000000000000 | NULL  | 0000005461 |
+------+---------------+------+--------------------------------------------------------------------+-------------------------------------+-------+------------+
SELECT CAST(C1 AS DECIMAL),CAST(C1 AS DECIMAL(65,0)) FROM T2;
+---------------------+---------------------------+
| CAST(C1 AS DECIMAL) | CAST(C1 AS DECIMAL(65,0)) |
+---------------------+---------------------------+
|                NULL |                      NULL |
|                   0 |                         0 |
|                   0 |                         0 |
|                   0 |                         0 |
|                   1 |                         1 |
|                  -1 |                        -1 |
|                   0 |                         0 |
|                NULL |                      NULL |
|                NULL |                      NULL |
|                1010 |                      1010 |
|                5461 |                      5461 |
+---------------------+---------------------------+
SELECT CAST(C2 AS DECIMAL),CAST(C2 AS DECIMAL(65,0)) FROM T2;
+---------------------+---------------------------+
| CAST(C2 AS DECIMAL) | CAST(C2 AS DECIMAL(65,0)) |
+---------------------+---------------------------+
|                NULL |                      NULL |
|                   0 |                         0 |
|                   0 |                         0 |
|                   0 |                         0 |
|                NULL |                      NULL |
|                NULL |                      NULL |
|                   0 |                         0 |
|                NULL |                      NULL |
|                NULL |                      NULL |
|                NULL |                      NULL |
|                NULL |                      NULL |
+---------------------+---------------------------+
SELECT CAST(C3 AS DECIMAL),CAST(C3 AS DECIMAL(65,0)) FROM T2;
+---------------------+---------------------------+
| CAST(C3 AS DECIMAL) | CAST(C3 AS DECIMAL(65,0)) |
+---------------------+---------------------------+
|                NULL |                      NULL |
|                   0 |                         0 |
|                   0 |                         0 |
|                   0 |                         0 |
|                   1 |                         1 |
|                NULL |                      NULL |
|                NULL |                      NULL |
|                NULL |                      NULL |
|                NULL |                      NULL |
|                1010 |                      1010 |
|                5461 |                      5461 |
+---------------------+---------------------------+
SELECT CAST(C4 AS DECIMAL),CAST(C4 AS DECIMAL(65,0)) FROM T2;
+---------------------+--------------------------------------------------------------------+
| CAST(C4 AS DECIMAL) | CAST(C4 AS DECIMAL(65,0))                                          |
+---------------------+--------------------------------------------------------------------+
|                NULL |                                                               NULL |
|                   0 |                                                                  0 |
|                   0 |                                                                  0 |
|                   0 |                                                                  0 |
|                   1 |                                                                  1 |
|                  -1 |                                                                 -1 |
|                   0 |                                                                  0 |
|          9999999999 |  10000000000000000000000000000000000000000000000000000000000000000 |
|         -9999999999 | -10000000000000000000000000000000000000000000000000000000000000000 |
|                1010 |                                                               1010 |
|                5461 |                                                               5461 |
+---------------------+--------------------------------------------------------------------+
SELECT CAST(C5 AS DECIMAL),CAST(C5 AS DECIMAL(65,0)) FROM T2;
+---------------------+---------------------------+
| CAST(C5 AS DECIMAL) | CAST(C5 AS DECIMAL(65,0)) |
+---------------------+---------------------------+
|                NULL |                      NULL |
|                   0 |                         0 |
|                   0 |                         0 |
|                   0 |                         0 |
|                   1 |                         1 |
|                  -1 |                        -1 |
|                   0 |                         0 |
|                NULL |                      NULL |
|                NULL |                      NULL |
|                1010 |                      1010 |
|                5461 |                      5461 |
+---------------------+---------------------------+
SELECT CAST(C6 AS DECIMAL),CAST(C6 AS DECIMAL(65,0)) FROM T2;
+---------------------+---------------------------+
| CAST(C6 AS DECIMAL) | CAST(C6 AS DECIMAL(65,0)) |
+---------------------+---------------------------+
|                NULL |                      NULL |
|                   0 |                         0 |
|                   0 |                         0 |
|                   0 |                         0 |
|                   1 |                         1 |
|                  -1 |                        -1 |
|                   0 |                         0 |
|                NULL |                      NULL |
|                NULL |                      NULL |
|                NULL |                      NULL |
|                NULL |                      NULL |
+---------------------+---------------------------+
SELECT CAST(C7 AS DECIMAL),CAST(C7 AS DECIMAL(65,0)) FROM T2;
+---------------------+---------------------------+
| CAST(C7 AS DECIMAL) | CAST(C7 AS DECIMAL(65,0)) |
+---------------------+---------------------------+
|                NULL |                      NULL |
|                   0 |                         0 |
|                   0 |                         0 |
|                   0 |                         0 |
|                   1 |                         1 |
|                NULL |                      NULL |
|                NULL |                      NULL |
|                NULL |                      NULL |
|                NULL |                      NULL |
|                1010 |                      1010 |
|                5461 |                      5461 |
+---------------------+---------------------------+
DELETE FROM T3;
INSERT INTO T3 SELECT C1,C1 FROM T2;
INSERT INTO T3 SELECT C2,C2 FROM T2;
Warnings:
Warning	1265	Data truncated for column 'C1' at row 3
Warning	1265	Data truncated for column 'C2' at row 3
Warning	1265	Data truncated for column 'C1' at row 7
Warning	1265	Data truncated for column 'C2' at row 7
INSERT INTO T3 SELECT C3,C3 FROM T2;
INSERT INTO T3 SELECT C4,C4 FROM T2;
ERROR 22003: Out of range value for column 'C1' at row 8
INSERT INTO T3 SELECT C5,C5 FROM T2;
Warnings:
Warning	1265	Data truncated for column 'C1' at row 3
Warning	1265	Data truncated for column 'C2' at row 3
Warning	1265	Data truncated for column 'C1' at row 4
Warning	1265	Data truncated for column 'C2' at row 4
Warning	1265	Data truncated for column 'C1' at row 7
Warning	1265	Data truncated for column 'C2' at row 7
INSERT INTO T3 SELECT C6,C6 FROM T2;
Warnings:
Warning	1265	Data truncated for column 'C1' at row 3
Warning	1265	Data truncated for column 'C2' at row 3
Warning	1265	Data truncated for column 'C1' at row 7
Warning	1265	Data truncated for column 'C2' at row 7
INSERT INTO T3 SELECT C7,C7 FROM T2;
SELECT * FROM T3;
+------+------+
| C1   | C2   |
+------+------+
| NULL | NULL |
|    0 |    0 |
|    0 |    0 |
|    0 |    0 |
|    1 |    1 |
|   -1 |   -1 |
|    0 |    0 |
| NULL | NULL |
| NULL | NULL |
| 1010 | 1010 |
| 5461 | 5461 |
| NULL | NULL |
|    0 |    0 |
|    0 |    0 |
|    0 |    0 |
| NULL | NULL |
| NULL | NULL |
|    0 |    0 |
| NULL | NULL |
| NULL | NULL |
| NULL | NULL |
| NULL | NULL |
| NULL | NULL |
|    0 |    0 |
|    0 |    0 |
|    0 |    0 |
|    1 |    1 |
| NULL | NULL |
| NULL | NULL |
| NULL | NULL |
| NULL | NULL |
| 1010 | 1010 |
| 5461 | 5461 |
| NULL | NULL |
|    0 |    0 |
|    0 |    0 |
|    0 |    0 |
|    1 |    1 |
|   -1 |   -1 |
|    0 |    0 |
| NULL | NULL |
| NULL | NULL |
| 1010 | 1010 |
| 5461 | 5461 |
| NULL | NULL |
|    0 |    0 |
|    0 |    0 |
|    0 |    0 |
|    1 |    1 |
|   -1 |   -1 |
|    0 |    0 |
| NULL | NULL |
| NULL | NULL |
| NULL | NULL |
| NULL | NULL |
| NULL | NULL |
|    0 |    0 |
|    0 |    0 |
|    0 |    0 |
|    1 |    1 |
| NULL | NULL |
| NULL | NULL |
| NULL | NULL |
| NULL | NULL |
| 1010 | 1010 |
| 5461 | 5461 |
+------+------+
##ENUM,SET##
DROP TABLE IF EXISTS T2;
CREATE TABLE T2(C1 ENUM('0'),C2 SET('0'));
INSERT INTO T2 SELECT C1,C1 FROM T1 WHERE C1 = 0;
ERROR 01000: Data truncated for column 'C1' at row 1
INSERT INTO T2 SELECT CONVERT(C1,CHAR),CONVERT(C1,CHAR) FROM T1 WHERE C1 = 0;
SELECT * FROM T2;
+------+------+
| C1   | C2   |
+------+------+
| 0    | 0    |
| 0    | 0    |
| 0    | 0    |
| 0    | 0    |
+------+------+
SELECT CAST(C1 AS DECIMAL),CAST(C1 AS DECIMAL(65,0)) FROM T2;
+---------------------+---------------------------+
| CAST(C1 AS DECIMAL) | CAST(C1 AS DECIMAL(65,0)) |
+---------------------+---------------------------+
|                   1 |                         1 |
|                   1 |                         1 |
|                   1 |                         1 |
|                   1 |                         1 |
+---------------------+---------------------------+
SELECT CAST(C2 AS DECIMAL),CAST(C2 AS DECIMAL(65,0)) FROM T2;
+---------------------+---------------------------+
| CAST(C2 AS DECIMAL) | CAST(C2 AS DECIMAL(65,0)) |
+---------------------+---------------------------+
|                   1 |                         1 |
|                   1 |                         1 |
|                   1 |                         1 |
|                   1 |                         1 |
+---------------------+---------------------------+
DELETE FROM T3;
INSERT INTO T3 SELECT C1,C1 FROM T2;
INSERT INTO T3 SELECT C2,C2 FROM T2;
SELECT * FROM T3;
+------+------+
| C1   | C2   |
+------+------+
|    1 |    1 |
|    1 |    1 |
|    1 |    1 |
|    1 |    1 |
|    1 |    1 |
|    1 |    1 |
|    1 |    1 |
|    1 |    1 |
+------+------+
##JSON##
DROP TABLE IF EXISTS T2;
CREATE TABLE T2(C1 JSON);
INSERT INTO T2 SELECT C1 FROM T1 WHERE C1 = 0;
SELECT * FROM T2;
+------+
| C1   |
+------+
| 0    |
| 0    |
| 0    |
| 0    |
+------+
SELECT CAST(C1 AS DECIMAL),CAST(C1 AS DECIMAL(65,0)) FROM T2;
+---------------------+---------------------------+
| CAST(C1 AS DECIMAL) | CAST(C1 AS DECIMAL(65,0)) |
+---------------------+---------------------------+
|                   0 |                         0 |
|                   0 |                         0 |
|                   0 |                         0 |
|                   0 |                         0 |
+---------------------+---------------------------+
DELETE FROM T3;
INSERT INTO T3 SELECT C1,C1 FROM T2;
SELECT * FROM T3;
+------+------+
| C1   | C2   |
+------+------+
|    0 |    0 |
|    0 |    0 |
|    0 |    0 |
|    0 |    0 |
+------+------+
##ËøêÁÆó##
SELECT C1+C2+C3+C4+C5+C6+C7 FROM T1;
+----------------------------------+
| C1+C2+C3+C4+C5+C6+C7             |
+----------------------------------+
|                             NULL |
| 0.000000000000000000000000000000 |
| 0.366000000000000000000000000000 |
| 0.000000000000000000000000000001 |
|                             NULL |
|                             NULL |
|                             NULL |
|                             NULL |
|                             NULL |
|                             NULL |
|                             NULL |
+----------------------------------+
SELECT C1-C2-C3-C4-C5-C6-C7 FROM T1;
+-----------------------------------+
| C1-C2-C3-C4-C5-C6-C7              |
+-----------------------------------+
|                              NULL |
|  0.000000000000000000000000000000 |
| -0.366000000000000000000000000000 |
| -0.000000000000000000000000000001 |
|                              NULL |
|                              NULL |
|                              NULL |
|                              NULL |
|                              NULL |
|                              NULL |
|                              NULL |
+-----------------------------------+
SELECT C1*C2*C3*C4*C5*C6*C7 FROM T1;
+----------------------------------+
| C1*C2*C3*C4*C5*C6*C7             |
+----------------------------------+
|                             NULL |
| 0.000000000000000000000000000000 |
| 0.000000000000000000000000000000 |
| 0.000000000000000000000000000000 |
|                             NULL |
|                             NULL |
|                             NULL |
|                             NULL |
|                             NULL |
|                             NULL |
|                             NULL |
+----------------------------------+
SELECT C1/C2/C3/C4/C5/C6/C7 FROM T1;
+----------------------+
| C1/C2/C3/C4/C5/C6/C7 |
+----------------------+
|                 NULL |
|                 NULL |
|                 NULL |
|                 NULL |
|                 NULL |
|                 NULL |
|                 NULL |
|                 NULL |
|                 NULL |
|                 NULL |
|                 NULL |
+----------------------+
##decimalÂàÜÊîØÈ¶ñÊ¨°ÊâßË°åËøôÊù°sqlÂæàÊÖ¢##
SELECT C1%C2%C3%C4%C5%C6%C7 FROM T1 WHERE C1 != 0;
+----------------------+
| C1%C2%C3%C4%C5%C6%C7 |
+----------------------+
|                 NULL |
|                 NULL |
|                 NULL |
|                 NULL |
+----------------------+
SELECT C1 DIV C2 DIV C3 DIV C4 DIV C5 DIV C6 DIV C7 FROM T1;
+----------------------------------------------+
| C1 DIV C2 DIV C3 DIV C4 DIV C5 DIV C6 DIV C7 |
+----------------------------------------------+
|                                         NULL |
|                                         NULL |
|                                         NULL |
|                                         NULL |
|                                         NULL |
|                                         NULL |
|                                         NULL |
|                                         NULL |
|                                         NULL |
|                                         NULL |
|                                         NULL |
+----------------------------------------------+
SELECT C1 MOD C2 MOD C3 MOD C4 MOD C5 MOD C6 MOD C7 FROM T1;
+----------------------------------------------+
| C1 MOD C2 MOD C3 MOD C4 MOD C5 MOD C6 MOD C7 |
+----------------------------------------------+
|                                         NULL |
|                                         NULL |
|                                         NULL |
|                                         NULL |
|                                         NULL |
|                                         NULL |
|                                         NULL |
|                                         NULL |
|                                         NULL |
|                                         NULL |
|                                         NULL |
+----------------------------------------------+
SELECT C1&C2|C3^C5<<C6>>C7 FROM T1;
+---------------------+
| C1&C2|C3^C5<<C6>>C7 |
+---------------------+
|                NULL |
|                   0 |
|                   0 |
|                   0 |
|                NULL |
|                NULL |
|                NULL |
|                NULL |
|                NULL |
|                NULL |
|                NULL |
+---------------------+
SELECT +C3 ^ C2 % +C5 * +C7 FROM T1;
+----------------------------------+
| +C3 ^ C2 % +C5 * +C7             |
+----------------------------------+
|                             NULL |
|                             NULL |
| 0.000000000000000000000000000000 |
| 0.000000000000000000000000000000 |
|                             NULL |
|                             NULL |
|                             NULL |
|                             NULL |
|                             NULL |
|                             NULL |
|                             NULL |
+----------------------------------+
SELECT +C7 - C1 - +C1 << C1 FROM T1;
+----------------------+
| +C7 - C1 - +C1 << C1 |
+----------------------+
|                 NULL |
|                    0 |
|                    0 |
|                    0 |
| 18446744073709551614 |
|                 NULL |
|                 NULL |
|                 NULL |
|                 NULL |
|                    0 |
|                    0 |
+----------------------+
SELECT -C2 MOD C3 / -C3 + -C6 FROM T1;
+------------------------+
| -C2 MOD C3 / -C3 + -C6 |
+------------------------+
|                   NULL |
|                   NULL |
|                   NULL |
|                   NULL |
|                   NULL |
|                   NULL |
|                   NULL |
|                   NULL |
|                   NULL |
|                   NULL |
|                   NULL |
+------------------------+
##BINARY##
SELECT BINARY C1,BINARY C2,BINARY C3,BINARY C4,BINARY C5,BINARY C6,BINARY C7 FROM T1;
+-----------+---------------+-----------+--------------------------------------------------------------------+-------------------------------------+-----------+------------+
| BINARY C1 | BINARY C2     | BINARY C3 | BINARY C4                                                          | BINARY C5                           | BINARY C6 | BINARY C7  |
+-----------+---------------+-----------+--------------------------------------------------------------------+-------------------------------------+-----------+------------+
| NULL      | NULL          | NULL      | NULL                                                               | NULL                                | NULL      | NULL       |
| 0         | 0.0000000000  | 0         | 0                                                                  | 0.000000000000000000000000000000    | 0.00      | 0000000000 |
| 0         | 0.1230000000  | 0         | 0                                                                  | 0.123000000000000000000000000000    | 0.12      | 0000000000 |
| 0         | 0.0000000000  | 0         | 0                                                                  | 0.000000000000000000000000000001    | 0.00      | 0000000000 |
| 1         | NULL          | 1         | 1                                                                  | 1.000000000000000000000000000000    | 1.00      | 0000000001 |
| -1        | NULL          | NULL      | -1                                                                 | -1.000000000000000000000000000000   | -1.00     | NULL       |
| 0         | -0.1000000000 | NULL      | 0                                                                  | -0.100000000000000000000000000000   | -0.10     | NULL       |
| NULL      | NULL          | NULL      | 10000000000000000000000000000000000000000000000000000000000000000  | NULL                                | NULL      | NULL       |
| NULL      | NULL          | NULL      | -10000000000000000000000000000000000000000000000000000000000000000 | NULL                                | NULL      | NULL       |
| 1010      | NULL          | 1010      | 1010                                                               | 1010.000000000000000000000000000000 | NULL      | 0000001010 |
| 5461      | NULL          | 5461      | 5461                                                               | 5461.000000000000000000000000000000 | NULL      | 0000005461 |
+-----------+---------------+-----------+--------------------------------------------------------------------+-------------------------------------+-----------+------------+
##CASE WHEN##
SELECT CASE WHEN C1 > C2 THEN 1 END FROM T1;
+------------------------------+
| CASE WHEN C1 > C2 THEN 1 END |
+------------------------------+
|                         NULL |
|                         NULL |
|                         NULL |
|                         NULL |
|                         NULL |
|                         NULL |
|                            1 |
|                         NULL |
|                         NULL |
|                         NULL |
|                         NULL |
+------------------------------+
##ÁªìÊûú‰∏émaster‰∏ç‰∏ÄËá¥ÔºåÂæÖ‰øÆÂ§ç##
SELECT CASE WHEN C1 = C2 AND C2 > C3 THEN 1 END R1 FROM T1;
+------+
| R1   |
+------+
| NULL |
| NULL |
| NULL |
| NULL |
| NULL |
| NULL |
| NULL |
| NULL |
| NULL |
| NULL |
| NULL |
+------+
SELECT CASE WHEN C2 > C3 OR C3 < C4 THEN 1 END R1 FROM T1;
+------+
| R1   |
+------+
| NULL |
| NULL |
|    1 |
| NULL |
| NULL |
| NULL |
| NULL |
| NULL |
| NULL |
| NULL |
| NULL |
+------+
SELECT CASE WHEN C4 IN(0,1) || C5 NOT IN(0,1) THEN 1 END R1 FROM T1;
+------+
| R1   |
+------+
| NULL |
|    1 |
|    1 |
|    1 |
|    1 |
|    1 |
|    1 |
| NULL |
| NULL |
|    1 |
|    1 |
+------+
SELECT CASE WHEN C5 NOT IN(0,1) && C6 BETWEEN -1 AND 1 THEN 1 END R1 FROM T1;
+------+
| R1   |
+------+
| NULL |
| NULL |
|    1 |
|    1 |
| NULL |
|    1 |
|    1 |
| NULL |
| NULL |
| NULL |
| NULL |
+------+
SELECT CASE WHEN C6 BETWEEN -1 AND 1 XOR C7 NOT BETWEEN -1 AND 1 THEN 1 END R1 FROM T1;
+------+
| R1   |
+------+
| NULL |
|    1 |
|    1 |
|    1 |
|    1 |
| NULL |
| NULL |
| NULL |
| NULL |
| NULL |
| NULL |
+------+
SELECT CASE WHEN NOT C7 NOT BETWEEN -1 AND 1 THEN 1 END R1 FROM T1;
+------+
| R1   |
+------+
| NULL |
|    1 |
|    1 |
|    1 |
|    1 |
| NULL |
| NULL |
| NULL |
| NULL |
| NULL |
| NULL |
+------+
SELECT CASE WHEN ! C1 LIKE '0' THEN 1 END R1 FROM T1;
+------+
| R1   |
+------+
| NULL |
| NULL |
| NULL |
| NULL |
|    1 |
|    1 |
| NULL |
| NULL |
| NULL |
|    1 |
|    1 |
+------+
##ÂáΩÊï∞ÂµåÂ•ó##
DROP TABLE IF EXISTS T1;
CREATE TABLE T1(C1 DECIMAL,C2 DECIMAL(10,10),C3 DECIMAL(0),C4 DECIMAL(65),C5 DECIMAL(65,30),C6 DECIMAL(3,2),C7 DECIMAL(0,0));
INSERT INTO T1 VALUES (NULL,NULL,NULL,NULL,NULL,NULL,NULL);
INSERT INTO T1 VALUES (0,0,0,0,0,0,0);
INSERT INTO T1 VALUES (0.123,0.123,0.123,0.123,0.123,0.123,0.123);
Warnings:
Warning	1265	Data truncated for column 'C1' at row 1
Warning	1265	Data truncated for column 'C3' at row 1
Warning	1265	Data truncated for column 'C4' at row 1
Warning	1265	Data truncated for column 'C6' at row 1
Warning	1265	Data truncated for column 'C7' at row 1
INSERT INTO T1 VALUES (1e-30,1e-30,1e-30,1e-30,1e-30,1e-30,1e-30);
Warnings:
Warning	1265	Data truncated for column 'C1' at row 1
Warning	1265	Data truncated for column 'C2' at row 1
Warning	1265	Data truncated for column 'C3' at row 1
Warning	1265	Data truncated for column 'C4' at row 1
Warning	1265	Data truncated for column 'C6' at row 1
Warning	1265	Data truncated for column 'C7' at row 1
INSERT INTO T1(C1,C3,C4,C5,C6,C7) VALUES(01,01,01,01,01,01);
INSERT INTO T1(C1,C3,C4,C5,C6,C7) VALUES(-1,-1,-1,-1,-1,-1);
INSERT INTO T1(C1,C2,C3,C4,C5,C6,C7) VALUES(-0.1,-0.1,-0.1,-0.1,-0.1,-0.1,-0.1);
Warnings:
Warning	1265	Data truncated for column 'C1' at row 1
Warning	1265	Data truncated for column 'C3' at row 1
Warning	1265	Data truncated for column 'C4' at row 1
Warning	1265	Data truncated for column 'C7' at row 1
INSERT INTO T1(C4) VALUES(1e+64);
INSERT INTO T1(C4) VALUES(-1e+64);
INSERT INTO T1(C1,C3,C4,C5,C7) VALUES(01010,01010,01010,01010,01010);
INSERT INTO T1(C1,C3,C4,C5,C7) VALUES(b'01010101010101',b'01010101010101',b'01010101010101',b'01010101010101',b'01010101010101');
SELECT * FROM T1;
+------+---------------+------+--------------------------------------------------------------------+-------------------------------------+-------+------+
| C1   | C2            | C3   | C4                                                                 | C5                                  | C6    | C7   |
+------+---------------+------+--------------------------------------------------------------------+-------------------------------------+-------+------+
| NULL |          NULL | NULL |                                                               NULL |                                NULL |  NULL | NULL |
|    0 |  0.0000000000 |    0 |                                                                  0 |    0.000000000000000000000000000000 |  0.00 |    0 |
|    0 |  0.1230000000 |    0 |                                                                  0 |    0.123000000000000000000000000000 |  0.12 |    0 |
|    0 |  0.0000000000 |    0 |                                                                  0 |    0.000000000000000000000000000001 |  0.00 |    0 |
|    1 |          NULL |    1 |                                                                  1 |    1.000000000000000000000000000000 |  1.00 |    1 |
|   -1 |          NULL |   -1 |                                                                 -1 |   -1.000000000000000000000000000000 | -1.00 |   -1 |
|    0 | -0.1000000000 |    0 |                                                                  0 |   -0.100000000000000000000000000000 | -0.10 |    0 |
| NULL |          NULL | NULL |  10000000000000000000000000000000000000000000000000000000000000000 |                                NULL |  NULL | NULL |
| NULL |          NULL | NULL | -10000000000000000000000000000000000000000000000000000000000000000 |                                NULL |  NULL | NULL |
| 1010 |          NULL | 1010 |                                                               1010 | 1010.000000000000000000000000000000 |  NULL | 1010 |
| 5461 |          NULL | 5461 |                                                               5461 | 5461.000000000000000000000000000000 |  NULL | 5461 |
+------+---------------+------+--------------------------------------------------------------------+-------------------------------------+-------+------+
##Êï∞Â≠¶ÂáΩÊï∞##
SELECT ABS(C1),ABS(C2),ABS(C3),ABS(C4),ABS(C5),ABS(C6),ABS(C7) FROM T1;
+---------+--------------+---------+-------------------------------------------------------------------+-------------------------------------+---------+---------+
| ABS(C1) | ABS(C2)      | ABS(C3) | ABS(C4)                                                           | ABS(C5)                             | ABS(C6) | ABS(C7) |
+---------+--------------+---------+-------------------------------------------------------------------+-------------------------------------+---------+---------+
|    NULL |         NULL |    NULL |                                                              NULL |                                NULL |    NULL |    NULL |
|       0 | 0.0000000000 |       0 |                                                                 0 |    0.000000000000000000000000000000 |    0.00 |       0 |
|       0 | 0.1230000000 |       0 |                                                                 0 |    0.123000000000000000000000000000 |    0.12 |       0 |
|       0 | 0.0000000000 |       0 |                                                                 0 |    0.000000000000000000000000000001 |    0.00 |       0 |
|       1 |         NULL |       1 |                                                                 1 |    1.000000000000000000000000000000 |    1.00 |       1 |
|       1 |         NULL |       1 |                                                                 1 |    1.000000000000000000000000000000 |    1.00 |       1 |
|       0 | 0.1000000000 |       0 |                                                                 0 |    0.100000000000000000000000000000 |    0.10 |       0 |
|    NULL |         NULL |    NULL | 10000000000000000000000000000000000000000000000000000000000000000 |                                NULL |    NULL |    NULL |
|    NULL |         NULL |    NULL | 10000000000000000000000000000000000000000000000000000000000000000 |                                NULL |    NULL |    NULL |
|    1010 |         NULL |    1010 |                                                              1010 | 1010.000000000000000000000000000000 |    NULL |    1010 |
|    5461 |         NULL |    5461 |                                                              5461 | 5461.000000000000000000000000000000 |    NULL |    5461 |
+---------+--------------+---------+-------------------------------------------------------------------+-------------------------------------+---------+---------+
SELECT ACOS(C1),ACOS(C2),ACOS(C3),ACOS(C4),ACOS(C5),ACOS(C6),ACOS(C7) FROM T1;
+--------------------+--------------------+--------------------+--------------------+--------------------+--------------------+--------------------+
| ACOS(C1)           | ACOS(C2)           | ACOS(C3)           | ACOS(C4)           | ACOS(C5)           | ACOS(C6)           | ACOS(C7)           |
+--------------------+--------------------+--------------------+--------------------+--------------------+--------------------+--------------------+
|               NULL |               NULL |               NULL |               NULL |               NULL |               NULL |               NULL |
| 1.5707963267948966 | 1.5707963267948966 | 1.5707963267948966 | 1.5707963267948966 | 1.5707963267948966 | 1.5707963267948966 | 1.5707963267948966 |
| 1.5707963267948966 | 1.4474840516030247 | 1.5707963267948966 | 1.5707963267948966 | 1.4474840516030247 | 1.4505064444001086 | 1.5707963267948966 |
| 1.5707963267948966 | 1.5707963267948966 | 1.5707963267948966 | 1.5707963267948966 | 1.5707963267948966 | 1.5707963267948966 | 1.5707963267948966 |
|                  0 |               NULL |                  0 |                  0 |                  0 |                  0 |                  0 |
|  3.141592653589793 |               NULL |  3.141592653589793 |  3.141592653589793 |  3.141592653589793 |  3.141592653589793 |  3.141592653589793 |
| 1.5707963267948966 | 1.6709637479564565 | 1.5707963267948966 | 1.5707963267948966 | 1.6709637479564565 | 1.6709637479564565 | 1.5707963267948966 |
|               NULL |               NULL |               NULL |               NULL |               NULL |               NULL |               NULL |
|               NULL |               NULL |               NULL |               NULL |               NULL |               NULL |               NULL |
|               NULL |               NULL |               NULL |               NULL |               NULL |               NULL |               NULL |
|               NULL |               NULL |               NULL |               NULL |               NULL |               NULL |               NULL |
+--------------------+--------------------+--------------------+--------------------+--------------------+--------------------+--------------------+
SELECT ASIN(C1),ASIN(C2),ASIN(C3),ASIN(C4),ASIN(C5),ASIN(C6),ASIN(C7) FROM T1;
+---------------------+---------------------+---------------------+---------------------+---------------------+---------------------+---------------------+
| ASIN(C1)            | ASIN(C2)            | ASIN(C3)            | ASIN(C4)            | ASIN(C5)            | ASIN(C6)            | ASIN(C7)            |
+---------------------+---------------------+---------------------+---------------------+---------------------+---------------------+---------------------+
|                NULL |                NULL |                NULL |                NULL |                NULL |                NULL |                NULL |
|                   0 |                   0 |                   0 |                   0 |                   0 |                   0 |                   0 |
|                   0 | 0.12331227519187199 |                   0 |                   0 | 0.12331227519187199 | 0.12028988239478806 |                   0 |
|                   0 |                   0 |                   0 |                   0 |               1e-30 |                   0 |                   0 |
|  1.5707963267948966 |                NULL |  1.5707963267948966 |  1.5707963267948966 |  1.5707963267948966 |  1.5707963267948966 |  1.5707963267948966 |
| -1.5707963267948966 |                NULL | -1.5707963267948966 | -1.5707963267948966 | -1.5707963267948966 | -1.5707963267948966 | -1.5707963267948966 |
|                   0 | -0.1001674211615598 |                   0 |                   0 | -0.1001674211615598 | -0.1001674211615598 |                   0 |
|                NULL |                NULL |                NULL |                NULL |                NULL |                NULL |                NULL |
|                NULL |                NULL |                NULL |                NULL |                NULL |                NULL |                NULL |
|                NULL |                NULL |                NULL |                NULL |                NULL |                NULL |                NULL |
|                NULL |                NULL |                NULL |                NULL |                NULL |                NULL |                NULL |
+---------------------+---------------------+---------------------+---------------------+---------------------+---------------------+---------------------+
SELECT ATAN(C1),ATAN(C2),ATAN(C3),ATAN(C4),ATAN(C5),ATAN(C6),ATAN(C7) FROM T1;
+---------------------+----------------------+---------------------+---------------------+----------------------+----------------------+---------------------+
| ATAN(C1)            | ATAN(C2)             | ATAN(C3)            | ATAN(C4)            | ATAN(C5)             | ATAN(C6)             | ATAN(C7)            |
+---------------------+----------------------+---------------------+---------------------+----------------------+----------------------+---------------------+
|                NULL |                 NULL |                NULL |                NULL |                 NULL |                 NULL |                NULL |
|                   0 |                    0 |                   0 |                   0 |                    0 |                    0 |                   0 |
|                   0 |  0.12238528147180266 |                   0 |                   0 |  0.12238528147180266 |  0.11942892601833845 |                   0 |
|                   0 |                    0 |                   0 |                   0 |                1e-30 |                    0 |                   0 |
|  0.7853981633974483 |                 NULL |  0.7853981633974483 |  0.7853981633974483 |   0.7853981633974483 |   0.7853981633974483 |  0.7853981633974483 |
| -0.7853981633974483 |                 NULL | -0.7853981633974483 | -0.7853981633974483 |  -0.7853981633974483 |  -0.7853981633974483 | -0.7853981633974483 |
|                   0 | -0.09966865249116204 |                   0 |                   0 | -0.09966865249116204 | -0.09966865249116204 |                   0 |
|                NULL |                 NULL |                NULL |  1.5707963267948966 |                 NULL |                 NULL |                NULL |
|                NULL |                 NULL |                NULL | -1.5707963267948966 |                 NULL |                 NULL |                NULL |
|  1.5698062281085254 |                 NULL |  1.5698062281085254 |  1.5698062281085254 |   1.5698062281085254 |                 NULL |  1.5698062281085254 |
|  1.5706132101516403 |                 NULL |  1.5706132101516403 |  1.5706132101516403 |   1.5706132101516403 |                 NULL |  1.5706132101516403 |
+---------------------+----------------------+---------------------+---------------------+----------------------+----------------------+---------------------+
SELECT ATAN2(C1,C2),ATAN2(C2,C3),ATAN2(C3,C4),ATAN2(C4,C5),ATAN2(C5,C6),ATAN2(C6,C7),ATAN2(C7,C1) FROM T1;
+-------------------+---------------------+--------------------+--------------------+--------------------+---------------------+--------------------+
| ATAN2(C1,C2)      | ATAN2(C2,C3)        | ATAN2(C3,C4)       | ATAN2(C4,C5)       | ATAN2(C5,C6)       | ATAN2(C6,C7)        | ATAN2(C7,C1)       |
+-------------------+---------------------+--------------------+--------------------+--------------------+---------------------+--------------------+
|              NULL |                NULL |               NULL |               NULL |               NULL |                NULL |               NULL |
|                 0 |                   0 |                  0 |                  0 |                  0 |                   0 |                  0 |
|                 0 |  1.5707963267948966 |                  0 |                  0 | 0.7977432152416728 |  1.5707963267948966 |                  0 |
|                 0 |                   0 |                  0 |                  0 | 1.5707963267948966 |                   0 |                  0 |
|              NULL |                NULL | 0.7853981633974483 | 0.7853981633974483 | 0.7853981633974483 |  0.7853981633974483 | 0.7853981633974483 |
|              NULL |                NULL | -2.356194490192345 | -2.356194490192345 | -2.356194490192345 |  -2.356194490192345 | -2.356194490192345 |
| 3.141592653589793 | -1.5707963267948966 |                  0 |  3.141592653589793 | -2.356194490192345 | -1.5707963267948966 |                  0 |
|              NULL |                NULL |               NULL |               NULL |               NULL |                NULL |               NULL |
|              NULL |                NULL |               NULL |               NULL |               NULL |                NULL |               NULL |
|              NULL |                NULL | 0.7853981633974483 | 0.7853981633974483 |               NULL |                NULL | 0.7853981633974483 |
|              NULL |                NULL | 0.7853981633974483 | 0.7853981633974483 |               NULL |                NULL | 0.7853981633974483 |
+-------------------+---------------------+--------------------+--------------------+--------------------+---------------------+--------------------+
SELECT BIT_COUNT(C1),BIT_COUNT(C2),BIT_COUNT(C3),BIT_COUNT(C4),BIT_COUNT(C5),BIT_COUNT(C6),BIT_COUNT(C7) FROM T1;
+---------------+---------------+---------------+---------------+---------------+---------------+---------------+
| BIT_COUNT(C1) | BIT_COUNT(C2) | BIT_COUNT(C3) | BIT_COUNT(C4) | BIT_COUNT(C5) | BIT_COUNT(C6) | BIT_COUNT(C7) |
+---------------+---------------+---------------+---------------+---------------+---------------+---------------+
|          NULL |          NULL |          NULL |          NULL |          NULL |          NULL |          NULL |
|             0 |             0 |             0 |             0 |             0 |             0 |             0 |
|             0 |             0 |             0 |             0 |             0 |             0 |             0 |
|             0 |             0 |             0 |             0 |             0 |             0 |             0 |
|             1 |          NULL |             1 |             1 |             1 |             1 |             1 |
|            64 |          NULL |            64 |            64 |            64 |            64 |            64 |
|             0 |             0 |             0 |             0 |             0 |             0 |             0 |
|          NULL |          NULL |          NULL |             0 |          NULL |          NULL |          NULL |
|          NULL |          NULL |          NULL |             0 |          NULL |          NULL |          NULL |
|             7 |          NULL |             7 |             7 |             7 |          NULL |             7 |
|             7 |          NULL |             7 |             7 |             7 |          NULL |             7 |
+---------------+---------------+---------------+---------------+---------------+---------------+---------------+
SELECT CEIL(C1),CEIL(C2),CEIL(C3),CEIL(C4),CEIL(C5),CEIL(C6),CEIL(C7) FROM T1;
+----------+----------+----------+--------------------------------------------------------------------+----------+----------+----------+
| CEIL(C1) | CEIL(C2) | CEIL(C3) | CEIL(C4)                                                           | CEIL(C5) | CEIL(C6) | CEIL(C7) |
+----------+----------+----------+--------------------------------------------------------------------+----------+----------+----------+
|     NULL |     NULL |     NULL |                                                               NULL |     NULL |     NULL |     NULL |
|        0 |        0 |        0 |                                                                  0 |        0 |        0 |        0 |
|        0 |        1 |        0 |                                                                  0 |        1 |        1 |        0 |
|        0 |        0 |        0 |                                                                  0 |        1 |        0 |        0 |
|        1 |     NULL |        1 |                                                                  1 |        1 |        1 |        1 |
|       -1 |     NULL |       -1 |                                                                 -1 |       -1 |       -1 |       -1 |
|        0 |        0 |        0 |                                                                  0 |        0 |        0 |        0 |
|     NULL |     NULL |     NULL |  10000000000000000000000000000000000000000000000000000000000000000 |     NULL |     NULL |     NULL |
|     NULL |     NULL |     NULL | -10000000000000000000000000000000000000000000000000000000000000000 |     NULL |     NULL |     NULL |
|     1010 |     NULL |     1010 |                                                               1010 |     1010 |     NULL |     1010 |
|     5461 |     NULL |     5461 |                                                               5461 |     5461 |     NULL |     5461 |
+----------+----------+----------+--------------------------------------------------------------------+----------+----------+----------+
SELECT CEILING(C1),CEILING(C2),CEILING(C3),CEILING(C4),CEILING(C5),CEILING(C6),CEILING(C7) FROM T1;
+-------------+-------------+-------------+--------------------------------------------------------------------+-------------+-------------+-------------+
| CEILING(C1) | CEILING(C2) | CEILING(C3) | CEILING(C4)                                                        | CEILING(C5) | CEILING(C6) | CEILING(C7) |
+-------------+-------------+-------------+--------------------------------------------------------------------+-------------+-------------+-------------+
|        NULL |        NULL |        NULL |                                                               NULL |        NULL |        NULL |        NULL |
|           0 |           0 |           0 |                                                                  0 |           0 |           0 |           0 |
|           0 |           1 |           0 |                                                                  0 |           1 |           1 |           0 |
|           0 |           0 |           0 |                                                                  0 |           1 |           0 |           0 |
|           1 |        NULL |           1 |                                                                  1 |           1 |           1 |           1 |
|          -1 |        NULL |          -1 |                                                                 -1 |          -1 |          -1 |          -1 |
|           0 |           0 |           0 |                                                                  0 |           0 |           0 |           0 |
|        NULL |        NULL |        NULL |  10000000000000000000000000000000000000000000000000000000000000000 |        NULL |        NULL |        NULL |
|        NULL |        NULL |        NULL | -10000000000000000000000000000000000000000000000000000000000000000 |        NULL |        NULL |        NULL |
|        1010 |        NULL |        1010 |                                                               1010 |        1010 |        NULL |        1010 |
|        5461 |        NULL |        5461 |                                                               5461 |        5461 |        NULL |        5461 |
+-------------+-------------+-------------+--------------------------------------------------------------------+-------------+-------------+-------------+
SELECT CONV(C1,10,16),CONV(C2,10,2),CONV(C3,10,16),CONV(C4,10,2),CONV(C5,10,16),CONV(C6,10,2),CONV(C7,10,16) FROM T1;
+------------------+---------------+------------------+------------------------------------------------------------------+------------------+------------------------------------------------------------------+------------------+
| CONV(C1,10,16)   | CONV(C2,10,2) | CONV(C3,10,16)   | CONV(C4,10,2)                                                    | CONV(C5,10,16)   | CONV(C6,10,2)                                                    | CONV(C7,10,16)   |
+------------------+---------------+------------------+------------------------------------------------------------------+------------------+------------------------------------------------------------------+------------------+
| NULL             | NULL          | NULL             | NULL                                                             | NULL             | NULL                                                             | NULL             |
| 0                | 0             | 0                | 0                                                                | 0                | 0                                                                | 0                |
| 0                | 0             | 0                | 0                                                                | 0                | 0                                                                | 0                |
| 0                | 0             | 0                | 0                                                                | 0                | 0                                                                | 0                |
| 1                | NULL          | 1                | 1                                                                | 1                | 1                                                                | 1                |
| FFFFFFFFFFFFFFFF | NULL          | FFFFFFFFFFFFFFFF | 1111111111111111111111111111111111111111111111111111111111111111 | FFFFFFFFFFFFFFFF | 1111111111111111111111111111111111111111111111111111111111111111 | FFFFFFFFFFFFFFFF |
| 0                | 0             | 0                | 0                                                                | 0                | 0                                                                | 0                |
| NULL             | NULL          | NULL             | 1111111111111111111111111111111111111111111111111111111111111111 | NULL             | NULL                                                             | NULL             |
| NULL             | NULL          | NULL             | 1111111111111111111111111111111111111111111111111111111111111111 | NULL             | NULL                                                             | NULL             |
| 3F2              | NULL          | 3F2              | 1111110010                                                       | 3F2              | NULL                                                             | 3F2              |
| 1555             | NULL          | 1555             | 1010101010101                                                    | 1555             | NULL                                                             | 1555             |
+------------------+---------------+------------------+------------------------------------------------------------------+------------------+------------------------------------------------------------------+------------------+
SELECT COS(C1),COS(C2),COS(C3),COS(C4),COS(C5),COS(C6),COS(C7) FROM T1;
+----------------------+--------------------+----------------------+----------------------+----------------------+--------------------+----------------------+
| COS(C1)              | COS(C2)            | COS(C3)              | COS(C4)              | COS(C5)              | COS(C6)            | COS(C7)              |
+----------------------+--------------------+----------------------+----------------------+----------------------+--------------------+----------------------+
|                 NULL |               NULL |                 NULL |                 NULL |                 NULL |               NULL |                 NULL |
|                    1 |                  1 |                    1 |                    1 |                    1 |                  1 |                    1 |
|                    1 | 0.9924450321351935 |                    1 |                    1 |   0.9924450321351935 | 0.9928086358538663 |                    1 |
|                    1 |                  1 |                    1 |                    1 |                    1 |                  1 |                    1 |
|   0.5403023058681398 |               NULL |   0.5403023058681398 |   0.5403023058681398 |   0.5403023058681398 | 0.5403023058681398 |   0.5403023058681398 |
|   0.5403023058681398 |               NULL |   0.5403023058681398 |   0.5403023058681398 |   0.5403023058681398 | 0.5403023058681398 |   0.5403023058681398 |
|                    1 | 0.9950041652780258 |                    1 |                    1 |   0.9950041652780258 | 0.9950041652780258 |                    1 |
|                 NULL |               NULL |                 NULL |   0.5833475601006048 |                 NULL |               NULL |                 NULL |
|                 NULL |               NULL |                 NULL |   0.5833475601006048 |                 NULL |               NULL |                 NULL |
| -0.02203634525193134 |               NULL | -0.02203634525193134 | -0.02203634525193134 | -0.02203634525193134 |               NULL | -0.02203634525193134 |
|   0.6121907704210643 |               NULL |   0.6121907704210643 |   0.6121907704210643 |   0.6121907704210643 |               NULL |   0.6121907704210643 |
+----------------------+--------------------+----------------------+----------------------+----------------------+--------------------+----------------------+
SELECT COT(C1),COT(C2),COT(C3),COT(C4),COT(C5),COT(C6),COT(C7) FROM T1;
ERROR 22003: result Double value is out of range
SELECT CRC32(C1),CRC32(C2),CRC32(C3),CRC32(C4),CRC32(C5),CRC32(C6),CRC32(C7) FROM T1;
+------------+------------+------------+------------+------------+------------+------------+
| CRC32(C1)  | CRC32(C2)  | CRC32(C3)  | CRC32(C4)  | CRC32(C5)  | CRC32(C6)  | CRC32(C7)  |
+------------+------------+------------+------------+------------+------------+------------+
|       NULL |       NULL |       NULL |       NULL |       NULL |       NULL |       NULL |
| 4108050209 | 1493058618 | 4108050209 | 4108050209 |  534981550 |  438520328 | 4108050209 |
| 4108050209 |  390398049 | 4108050209 | 4108050209 | 3880943049 | 3979745893 | 4108050209 |
| 4108050209 | 1493058618 | 4108050209 | 4108050209 | 1759779640 |  438520328 | 4108050209 |
| 2212294583 |       NULL | 2212294583 | 2212294583 | 3996724740 | 2728340845 | 2212294583 |
|  808273962 |       NULL |  808273962 |  808273962 | 1685394151 | 2091445977 |  808273962 |
| 4108050209 |  936346722 | 4108050209 | 4108050209 | 2848977989 | 3708795133 | 4108050209 |
|       NULL |       NULL |       NULL | 2025006875 |       NULL |       NULL |       NULL |
|       NULL |       NULL |       NULL | 1704584060 |       NULL |       NULL |       NULL |
| 2906427990 |       NULL | 2906427990 | 2906427990 | 4186262176 |       NULL | 2906427990 |
|  487656332 |       NULL |  487656332 |  487656332 | 2450631337 |       NULL |  487656332 |
+------------+------------+------------+------------+------------+------------+------------+
SELECT DEGREES(C1),DEGREES(C2),DEGREES(C3),DEGREES(C4),DEGREES(C5),DEGREES(C6),DEGREES(C7) FROM T1;
+--------------------+--------------------+--------------------+-----------------------+-----------------------+--------------------+--------------------+
| DEGREES(C1)        | DEGREES(C2)        | DEGREES(C3)        | DEGREES(C4)           | DEGREES(C5)           | DEGREES(C6)        | DEGREES(C7)        |
+--------------------+--------------------+--------------------+-----------------------+-----------------------+--------------------+--------------------+
|               NULL |               NULL |               NULL |                  NULL |                  NULL |               NULL |               NULL |
|                  0 |                  0 |                  0 |                     0 |                     0 |                  0 |                  0 |
|                  0 |  7.047380880109126 |                  0 |                     0 |     7.047380880109126 |  6.875493541569878 |                  0 |
|                  0 |                  0 |                  0 |                     0 | 5.729577951308233e-29 |                  0 |                  0 |
|  57.29577951308232 |               NULL |  57.29577951308232 |     57.29577951308232 |     57.29577951308232 |  57.29577951308232 |  57.29577951308232 |
| -57.29577951308232 |               NULL | -57.29577951308232 |    -57.29577951308232 |    -57.29577951308232 | -57.29577951308232 | -57.29577951308232 |
|                  0 | -5.729577951308233 |                  0 |                     0 |    -5.729577951308233 | -5.729577951308233 |                  0 |
|               NULL |               NULL |               NULL |  5.729577951308233e65 |                  NULL |               NULL |               NULL |
|               NULL |               NULL |               NULL | -5.729577951308233e65 |                  NULL |               NULL |               NULL |
| 57868.737308213145 |               NULL | 57868.737308213145 |    57868.737308213145 |    57868.737308213145 |               NULL | 57868.737308213145 |
| 312892.25192094257 |               NULL | 312892.25192094257 |    312892.25192094257 |    312892.25192094257 |               NULL | 312892.25192094257 |
+--------------------+--------------------+--------------------+-----------------------+-----------------------+--------------------+--------------------+
SELECT ABS(C1),ABS(C2),ABS(C3),ABS(C4),ABS(C5),ABS(C6),ABS(C7) FROM T1;
+---------+--------------+---------+-------------------------------------------------------------------+-------------------------------------+---------+---------+
| ABS(C1) | ABS(C2)      | ABS(C3) | ABS(C4)                                                           | ABS(C5)                             | ABS(C6) | ABS(C7) |
+---------+--------------+---------+-------------------------------------------------------------------+-------------------------------------+---------+---------+
|    NULL |         NULL |    NULL |                                                              NULL |                                NULL |    NULL |    NULL |
|       0 | 0.0000000000 |       0 |                                                                 0 |    0.000000000000000000000000000000 |    0.00 |       0 |
|       0 | 0.1230000000 |       0 |                                                                 0 |    0.123000000000000000000000000000 |    0.12 |       0 |
|       0 | 0.0000000000 |       0 |                                                                 0 |    0.000000000000000000000000000001 |    0.00 |       0 |
|       1 |         NULL |       1 |                                                                 1 |    1.000000000000000000000000000000 |    1.00 |       1 |
|       1 |         NULL |       1 |                                                                 1 |    1.000000000000000000000000000000 |    1.00 |       1 |
|       0 | 0.1000000000 |       0 |                                                                 0 |    0.100000000000000000000000000000 |    0.10 |       0 |
|    NULL |         NULL |    NULL | 10000000000000000000000000000000000000000000000000000000000000000 |                                NULL |    NULL |    NULL |
|    NULL |         NULL |    NULL | 10000000000000000000000000000000000000000000000000000000000000000 |                                NULL |    NULL |    NULL |
|    1010 |         NULL |    1010 |                                                              1010 | 1010.000000000000000000000000000000 |    NULL |    1010 |
|    5461 |         NULL |    5461 |                                                              5461 | 5461.000000000000000000000000000000 |    NULL |    5461 |
+---------+--------------+---------+-------------------------------------------------------------------+-------------------------------------+---------+---------+
SELECT FLOOR(C1),FLOOR(C2),FLOOR(C3),FLOOR(C4),FLOOR(C5),FLOOR(C6),FLOOR(C7) FROM T1;
+-----------+-----------+-----------+--------------------------------------------------------------------+-----------+-----------+-----------+
| FLOOR(C1) | FLOOR(C2) | FLOOR(C3) | FLOOR(C4)                                                          | FLOOR(C5) | FLOOR(C6) | FLOOR(C7) |
+-----------+-----------+-----------+--------------------------------------------------------------------+-----------+-----------+-----------+
|      NULL |      NULL |      NULL |                                                               NULL |      NULL |      NULL |      NULL |
|         0 |         0 |         0 |                                                                  0 |         0 |         0 |         0 |
|         0 |         0 |         0 |                                                                  0 |         0 |         0 |         0 |
|         0 |         0 |         0 |                                                                  0 |         0 |         0 |         0 |
|         1 |      NULL |         1 |                                                                  1 |         1 |         1 |         1 |
|        -1 |      NULL |        -1 |                                                                 -1 |        -1 |        -1 |        -1 |
|         0 |        -1 |         0 |                                                                  0 |        -1 |        -1 |         0 |
|      NULL |      NULL |      NULL |  10000000000000000000000000000000000000000000000000000000000000000 |      NULL |      NULL |      NULL |
|      NULL |      NULL |      NULL | -10000000000000000000000000000000000000000000000000000000000000000 |      NULL |      NULL |      NULL |
|      1010 |      NULL |      1010 |                                                               1010 |      1010 |      NULL |      1010 |
|      5461 |      NULL |      5461 |                                                               5461 |      5461 |      NULL |      5461 |
+-----------+-----------+-----------+--------------------------------------------------------------------+-----------+-----------+-----------+
SELECT LN(C1),LN(C2),LN(C3),LN(C4),LN(C5),LN(C6),LN(C7) FROM T1;
+-------------------+---------------------+-------------------+--------------------+---------------------+--------------------+-------------------+
| LN(C1)            | LN(C2)              | LN(C3)            | LN(C4)             | LN(C5)              | LN(C6)             | LN(C7)            |
+-------------------+---------------------+-------------------+--------------------+---------------------+--------------------+-------------------+
|              NULL |                NULL |              NULL |               NULL |                NULL |               NULL |              NULL |
|              NULL |                NULL |              NULL |               NULL |                NULL |               NULL |              NULL |
|              NULL | -2.0955709236097197 |              NULL |               NULL | -2.0955709236097197 | -2.120263536200091 |              NULL |
|              NULL |                NULL |              NULL |               NULL |  -69.07755278982137 |               NULL |              NULL |
|                 0 |                NULL |                 0 |                  0 |                   0 |                  0 |                 0 |
|              NULL |                NULL |              NULL |               NULL |                NULL |               NULL |              NULL |
|              NULL |                NULL |              NULL |               NULL |                NULL |               NULL |              NULL |
|              NULL |                NULL |              NULL | 147.36544595161894 |                NULL |               NULL |              NULL |
|              NULL |                NULL |              NULL |               NULL |                NULL |               NULL |              NULL |
| 6.917705609835305 |                NULL | 6.917705609835305 |  6.917705609835305 |   6.917705609835305 |               NULL | 6.917705609835305 |
| 8.605387202152153 |                NULL | 8.605387202152153 |  8.605387202152153 |   8.605387202152153 |               NULL | 8.605387202152153 |
+-------------------+---------------------+-------------------+--------------------+---------------------+--------------------+-------------------+
SELECT LOG(C1),LOG(C2),LOG(C3),LOG(C4),LOG(C5),LOG(C6),LOG(C7) FROM T1;
+-------------------+---------------------+-------------------+--------------------+---------------------+--------------------+-------------------+
| LOG(C1)           | LOG(C2)             | LOG(C3)           | LOG(C4)            | LOG(C5)             | LOG(C6)            | LOG(C7)           |
+-------------------+---------------------+-------------------+--------------------+---------------------+--------------------+-------------------+
|              NULL |                NULL |              NULL |               NULL |                NULL |               NULL |              NULL |
|              NULL |                NULL |              NULL |               NULL |                NULL |               NULL |              NULL |
|              NULL | -2.0955709236097197 |              NULL |               NULL | -2.0955709236097197 | -2.120263536200091 |              NULL |
|              NULL |                NULL |              NULL |               NULL |  -69.07755278982137 |               NULL |              NULL |
|                 0 |                NULL |                 0 |                  0 |                   0 |                  0 |                 0 |
|              NULL |                NULL |              NULL |               NULL |                NULL |               NULL |              NULL |
|              NULL |                NULL |              NULL |               NULL |                NULL |               NULL |              NULL |
|              NULL |                NULL |              NULL | 147.36544595161894 |                NULL |               NULL |              NULL |
|              NULL |                NULL |              NULL |               NULL |                NULL |               NULL |              NULL |
| 6.917705609835305 |                NULL | 6.917705609835305 |  6.917705609835305 |   6.917705609835305 |               NULL | 6.917705609835305 |
| 8.605387202152153 |                NULL | 8.605387202152153 |  8.605387202152153 |   8.605387202152153 |               NULL | 8.605387202152153 |
+-------------------+---------------------+-------------------+--------------------+---------------------+--------------------+-------------------+
SELECT LOG(C1,C2),LOG(C2,C3),LOG(C3,C4),LOG(C4,C5),LOG(C5,C6),LOG(C6,C7),LOG(C7,C1) FROM T1;
+------------+------------+------------+------------+--------------------+------------+------------+
| LOG(C1,C2) | LOG(C2,C3) | LOG(C3,C4) | LOG(C4,C5) | LOG(C5,C6)         | LOG(C6,C7) | LOG(C7,C1) |
+------------+------------+------------+------------+--------------------+------------+------------+
|       NULL |       NULL |       NULL |       NULL |               NULL |       NULL |       NULL |
|       NULL |       NULL |       NULL |       NULL |               NULL |       NULL |       NULL |
|       NULL |       NULL |       NULL |       NULL | 1.0117832387881376 |       NULL |       NULL |
|       NULL |       NULL |       NULL |       NULL |               NULL |       NULL |       NULL |
|       NULL |       NULL |       NULL |       NULL |               NULL |       NULL |       NULL |
|       NULL |       NULL |       NULL |       NULL |               NULL |       NULL |       NULL |
|       NULL |       NULL |       NULL |       NULL |               NULL |       NULL |       NULL |
|       NULL |       NULL |       NULL |       NULL |               NULL |       NULL |       NULL |
|       NULL |       NULL |       NULL |       NULL |               NULL |       NULL |       NULL |
|       NULL |       NULL |          1 |          1 |               NULL |       NULL |          1 |
|       NULL |       NULL |          1 |          1 |               NULL |       NULL |          1 |
+------------+------------+------------+------------+--------------------+------------+------------+
SELECT LOG10(C1),LOG10(C2),LOG10(C3),LOG10(C4),LOG10(C5),LOG10(C6),LOG10(C7) FROM T1;
+--------------------+---------------------+--------------------+--------------------+---------------------+---------------------+--------------------+
| LOG10(C1)          | LOG10(C2)           | LOG10(C3)          | LOG10(C4)          | LOG10(C5)           | LOG10(C6)           | LOG10(C7)          |
+--------------------+---------------------+--------------------+--------------------+---------------------+---------------------+--------------------+
|               NULL |                NULL |               NULL |               NULL |                NULL |                NULL |               NULL |
|               NULL |                NULL |               NULL |               NULL |                NULL |                NULL |               NULL |
|               NULL | -0.9100948885606021 |               NULL |               NULL | -0.9100948885606021 | -0.9208187539523752 |               NULL |
|               NULL |                NULL |               NULL |               NULL |                 -30 |                NULL |               NULL |
|                  0 |                NULL |                  0 |                  0 |                   0 |                   0 |                  0 |
|               NULL |                NULL |               NULL |               NULL |                NULL |                NULL |               NULL |
|               NULL |                NULL |               NULL |               NULL |                NULL |                NULL |               NULL |
|               NULL |                NULL |               NULL |                 64 |                NULL |                NULL |               NULL |
|               NULL |                NULL |               NULL |               NULL |                NULL |                NULL |               NULL |
| 3.0043213737826426 |                NULL | 3.0043213737826426 | 3.0043213737826426 |  3.0043213737826426 |                NULL | 3.0043213737826426 |
| 3.7372721765355434 |                NULL | 3.7372721765355434 | 3.7372721765355434 |  3.7372721765355434 |                NULL | 3.7372721765355434 |
+--------------------+---------------------+--------------------+--------------------+---------------------+---------------------+--------------------+
SELECT LOG2(C1),LOG2(C2),LOG2(C3),LOG2(C4),LOG2(C5),LOG2(C6),LOG2(C7) FROM T1;
+--------------------+---------------------+--------------------+--------------------+---------------------+---------------------+--------------------+
| LOG2(C1)           | LOG2(C2)            | LOG2(C3)           | LOG2(C4)           | LOG2(C5)            | LOG2(C6)            | LOG2(C7)           |
+--------------------+---------------------+--------------------+--------------------+---------------------+---------------------+--------------------+
|               NULL |                NULL |               NULL |               NULL |                NULL |                NULL |               NULL |
|               NULL |                NULL |               NULL |               NULL |                NULL |                NULL |               NULL |
|               NULL | -3.0232697793228476 |               NULL |               NULL | -3.0232697793228476 | -3.0588936890535687 |               NULL |
|               NULL |                NULL |               NULL |               NULL |  -99.65784284662087 |                NULL |               NULL |
|                  0 |                NULL |                  0 |                  0 |                   0 |                   0 |                  0 |
|               NULL |                NULL |               NULL |               NULL |                NULL |                NULL |               NULL |
|               NULL |                NULL |               NULL |               NULL |                NULL |                NULL |               NULL |
|               NULL |                NULL |               NULL |  212.6033980727912 |                NULL |                NULL |               NULL |
|               NULL |                NULL |               NULL |               NULL |                NULL |                NULL |               NULL |
|  9.980139577639157 |                NULL |  9.980139577639157 |  9.980139577639157 |   9.980139577639157 |                NULL |  9.980139577639157 |
| 12.414949441474263 |                NULL | 12.414949441474263 | 12.414949441474263 |  12.414949441474263 |                NULL | 12.414949441474263 |
+--------------------+---------------------+--------------------+--------------------+---------------------+---------------------+--------------------+
SELECT MOD(C1,C2),MOD(C2,C3),MOD(C3,C4),MOD(C4,C5),MOD(C5,C6),MOD(C6,C7),MOD(C7,C1) FROM T1;
+--------------+------------+------------+----------------------------------+----------------------------------+------------+------------+
| MOD(C1,C2)   | MOD(C2,C3) | MOD(C3,C4) | MOD(C4,C5)                       | MOD(C5,C6)                       | MOD(C6,C7) | MOD(C7,C1) |
+--------------+------------+------------+----------------------------------+----------------------------------+------------+------------+
|         NULL |       NULL |       NULL |                             NULL |                             NULL |       NULL |       NULL |
|         NULL |       NULL |       NULL |                             NULL |                             NULL |       NULL |       NULL |
| 0.0000000000 |       NULL |       NULL | 0.000000000000000000000000000000 | 0.003000000000000000000000000000 |       NULL |       NULL |
|         NULL |       NULL |       NULL | 0.000000000000000000000000000000 |                             NULL |       NULL |       NULL |
|         NULL |       NULL |          0 | 0.000000000000000000000000000000 | 0.000000000000000000000000000000 |       0.00 |          0 |
|         NULL |       NULL |          0 | 0.000000000000000000000000000000 | 0.000000000000000000000000000000 |       0.00 |          0 |
| 0.0000000000 |       NULL |       NULL | 0.000000000000000000000000000000 | 0.000000000000000000000000000000 |       NULL |       NULL |
|         NULL |       NULL |       NULL |                             NULL |                             NULL |       NULL |       NULL |
|         NULL |       NULL |       NULL |                             NULL |                             NULL |       NULL |       NULL |
|         NULL |       NULL |          0 | 0.000000000000000000000000000000 |                             NULL |       NULL |          0 |
|         NULL |       NULL |          0 | 0.000000000000000000000000000000 |                             NULL |       NULL |          0 |
+--------------+------------+------------+----------------------------------+----------------------------------+------------+------------+
SELECT NEG(C1),NEG(C2),NEG(C3),NEG(C4),NEG(C5),NEG(C6),NEG(C7) FROM T1;
+---------+---------------+---------+--------------------------------------------------------------------+--------------------------------------+---------+---------+
| NEG(C1) | NEG(C2)       | NEG(C3) | NEG(C4)                                                            | NEG(C5)                              | NEG(C6) | NEG(C7) |
+---------+---------------+---------+--------------------------------------------------------------------+--------------------------------------+---------+---------+
|    NULL |          NULL |    NULL |                                                               NULL |                                 NULL |    NULL |    NULL |
|       0 |  0.0000000000 |       0 |                                                                  0 |     0.000000000000000000000000000000 |    0.00 |       0 |
|       0 | -0.1230000000 |       0 |                                                                  0 |    -0.123000000000000000000000000000 |   -0.12 |       0 |
|       0 |  0.0000000000 |       0 |                                                                  0 |    -0.000000000000000000000000000001 |    0.00 |       0 |
|      -1 |          NULL |      -1 |                                                                 -1 |    -1.000000000000000000000000000000 |   -1.00 |      -1 |
|       1 |          NULL |       1 |                                                                  1 |     1.000000000000000000000000000000 |    1.00 |       1 |
|       0 |  0.1000000000 |       0 |                                                                  0 |     0.100000000000000000000000000000 |    0.10 |       0 |
|    NULL |          NULL |    NULL | -10000000000000000000000000000000000000000000000000000000000000000 |                                 NULL |    NULL |    NULL |
|    NULL |          NULL |    NULL |  10000000000000000000000000000000000000000000000000000000000000000 |                                 NULL |    NULL |    NULL |
|   -1010 |          NULL |   -1010 |                                                              -1010 | -1010.000000000000000000000000000000 |    NULL |   -1010 |
|   -5461 |          NULL |   -5461 |                                                              -5461 | -5461.000000000000000000000000000000 |    NULL |   -5461 |
+---------+---------------+---------+--------------------------------------------------------------------+--------------------------------------+---------+---------+
SELECT POW(C1,C2),POW(C2,C3),POW(C3,C4),POW(C4,C5),POW(C5,C6),POW(C6,C7),POW(C7,C1) FROM T1;
ERROR 22003: value is out of range
SELECT POWER(C1,C2),POWER(C2,C3),POWER(C3,C4),POWER(C4,C5),POWER(C5,C6),POWER(C6,C7),POWER(C7,C1) FROM T1;
ERROR 22003: value is out of range
SELECT RADIANS(C1),RADIANS(C2),RADIANS(C3),RADIANS(C4),RADIANS(C5),RADIANS(C6),RADIANS(C7) FROM T1;
+-----------------------+------------------------+-----------------------+------------------------+------------------------+------------------------+-----------------------+
| RADIANS(C1)           | RADIANS(C2)            | RADIANS(C3)           | RADIANS(C4)            | RADIANS(C5)            | RADIANS(C6)            | RADIANS(C7)           |
+-----------------------+------------------------+-----------------------+------------------------+------------------------+------------------------+-----------------------+
|                  NULL |                   NULL |                  NULL |                   NULL |                   NULL |                   NULL |                  NULL |
|                     0 |                      0 |                     0 |                      0 |                      0 |                      0 |                     0 |
|                     0 |  0.0021467549799530253 |                     0 |                      0 |  0.0021467549799530253 |  0.0020943951023931952 |                     0 |
|                     0 |                      0 |                     0 |                      0 | 1.7453292519943296e-32 |                      0 |                     0 |
|  0.017453292519943295 |                   NULL |  0.017453292519943295 |   0.017453292519943295 |   0.017453292519943295 |   0.017453292519943295 |  0.017453292519943295 |
| -0.017453292519943295 |                   NULL | -0.017453292519943295 |  -0.017453292519943295 |  -0.017453292519943295 |  -0.017453292519943295 | -0.017453292519943295 |
|                     0 | -0.0017453292519943296 |                     0 |                      0 | -0.0017453292519943296 | -0.0017453292519943296 |                     0 |
|                  NULL |                   NULL |                  NULL |  1.7453292519943297e62 |                   NULL |                   NULL |                  NULL |
|                  NULL |                   NULL |                  NULL | -1.7453292519943297e62 |                   NULL |                   NULL |                  NULL |
|     17.62782544514273 |                   NULL |     17.62782544514273 |      17.62782544514273 |      17.62782544514273 |                   NULL |     17.62782544514273 |
|     95.31243045141034 |                   NULL |     95.31243045141034 |      95.31243045141034 |      95.31243045141034 |                   NULL |     95.31243045141034 |
+-----------------------+------------------------+-----------------------+------------------------+------------------------+------------------------+-----------------------+
SELECT RAND(C1),RAND(C2),RAND(C3),RAND(C4),RAND(C5),RAND(C6),RAND(C7) FROM T1;
+---------------------+---------------------+---------------------+---------------------+---------------------+---------------------+---------------------+
| RAND(C1)            | RAND(C2)            | RAND(C3)            | RAND(C4)            | RAND(C5)            | RAND(C6)            | RAND(C7)            |
+---------------------+---------------------+---------------------+---------------------+---------------------+---------------------+---------------------+
| 0.15522042769493574 | 0.15522042769493574 | 0.15522042769493574 | 0.15522042769493574 | 0.15522042769493574 | 0.15522042769493574 | 0.15522042769493574 |
| 0.15522042769493574 | 0.15522042769493574 | 0.15522042769493574 | 0.15522042769493574 | 0.15522042769493574 | 0.15522042769493574 | 0.15522042769493574 |
| 0.15522042769493574 | 0.15522042769493574 | 0.15522042769493574 | 0.15522042769493574 | 0.15522042769493574 | 0.15522042769493574 | 0.15522042769493574 |
| 0.15522042769493574 | 0.15522042769493574 | 0.15522042769493574 | 0.15522042769493574 | 0.15522042769493574 | 0.15522042769493574 | 0.15522042769493574 |
| 0.40540353712197724 | 0.15522042769493574 | 0.40540353712197724 | 0.40540353712197724 | 0.40540353712197724 | 0.40540353712197724 | 0.40540353712197724 |
|  0.9050373219931845 | 0.15522042769493574 |  0.9050373219931845 |  0.9050373219931845 |  0.9050373219931845 |  0.9050373219931845 |  0.9050373219931845 |
| 0.15522042769493574 | 0.15522042769493574 | 0.15522042769493574 | 0.15522042769493574 | 0.15522042769493574 | 0.15522042769493574 | 0.15522042769493574 |
| 0.15522042769493574 | 0.15522042769493574 | 0.15522042769493574 |  0.9050373219931845 | 0.15522042769493574 | 0.15522042769493574 | 0.15522042769493574 |
| 0.15522042769493574 | 0.15522042769493574 | 0.15522042769493574 | 0.15522042769493574 | 0.15522042769493574 | 0.15522042769493574 | 0.15522042769493574 |
|  0.8401607143135376 | 0.15522042769493574 |  0.8401607143135376 |  0.8401607143135376 |  0.8401607143135376 | 0.15522042769493574 |  0.8401607143135376 |
| 0.40517973844444355 | 0.15522042769493574 | 0.40517973844444355 | 0.40517973844444355 | 0.40517973844444355 | 0.15522042769493574 | 0.40517973844444355 |
+---------------------+---------------------+---------------------+---------------------+---------------------+---------------------+---------------------+
SELECT ROUND(C1),ROUND(C2),ROUND(C3),ROUND(C4),ROUND(C5),ROUND(C6),ROUND(C7) FROM T1;
+-----------+-----------+-----------+--------------------------------------------------------------------+-----------+-----------+-----------+
| ROUND(C1) | ROUND(C2) | ROUND(C3) | ROUND(C4)                                                          | ROUND(C5) | ROUND(C6) | ROUND(C7) |
+-----------+-----------+-----------+--------------------------------------------------------------------+-----------+-----------+-----------+
|      NULL |      NULL |      NULL |                                                               NULL |      NULL |      NULL |      NULL |
|         0 |         0 |         0 |                                                                  0 |         0 |         0 |         0 |
|         0 |         0 |         0 |                                                                  0 |         0 |         0 |         0 |
|         0 |         0 |         0 |                                                                  0 |         0 |         0 |         0 |
|         1 |      NULL |         1 |                                                                  1 |         1 |         1 |         1 |
|        -1 |      NULL |        -1 |                                                                 -1 |        -1 |        -1 |        -1 |
|         0 |         0 |         0 |                                                                  0 |         0 |         0 |         0 |
|      NULL |      NULL |      NULL |  10000000000000000000000000000000000000000000000000000000000000000 |      NULL |      NULL |      NULL |
|      NULL |      NULL |      NULL | -10000000000000000000000000000000000000000000000000000000000000000 |      NULL |      NULL |      NULL |
|      1010 |      NULL |      1010 |                                                               1010 |      1010 |      NULL |      1010 |
|      5461 |      NULL |      5461 |                                                               5461 |      5461 |      NULL |      5461 |
+-----------+-----------+-----------+--------------------------------------------------------------------+-----------+-----------+-----------+
SELECT ROUND(C1,C2),ROUND(C2,C3),ROUND(C3,C4),ROUND(C4,C5),ROUND(C5,C6),ROUND(C6,C7),ROUND(C7,C1) FROM T1;
+--------------+--------------+--------------+--------------+----------------------------------+--------------+--------------+
| ROUND(C1,C2) | ROUND(C2,C3) | ROUND(C3,C4) | ROUND(C4,C5) | ROUND(C5,C6)                     | ROUND(C6,C7) | ROUND(C7,C1) |
+--------------+--------------+--------------+--------------+----------------------------------+--------------+--------------+
|         NULL |         NULL |         NULL |         NULL |                             NULL |         NULL |         NULL |
|            0 | 0.0000000000 |            0 |            0 | 0.000000000000000000000000000000 |         0.00 |            0 |
|            0 | 0.0000000000 |            0 |            0 | 0.000000000000000000000000000000 |         0.00 |            0 |
|            0 | 0.0000000000 |            0 |            0 | 0.000000000000000000000000000000 |         0.00 |            0 |
|         NULL |         NULL |            1 |            1 | 1.000000000000000000000000000000 |         1.00 |            1 |
|         NULL |         NULL |            0 |            0 | 0.000000000000000000000000000000 |         0.00 |            0 |
|            0 | 0.0000000000 |            0 |            0 | 0.000000000000000000000000000000 |         0.00 |            0 |
|         NULL |         NULL |         NULL |         NULL |                             NULL |         NULL |         NULL |
|         NULL |         NULL |         NULL |         NULL |                             NULL |         NULL |         NULL |
|         NULL |         NULL |         1010 |         1010 |                             NULL |         NULL |         1010 |
|         NULL |         NULL |         5461 |         5461 |                             NULL |         NULL |         5461 |
+--------------+--------------+--------------+--------------+----------------------------------+--------------+--------------+
SELECT SIGN(C1),SIGN(C2),SIGN(C3),SIGN(C4),SIGN(C5),SIGN(C6),SIGN(C7) FROM T1;
+----------+----------+----------+----------+----------+----------+----------+
| SIGN(C1) | SIGN(C2) | SIGN(C3) | SIGN(C4) | SIGN(C5) | SIGN(C6) | SIGN(C7) |
+----------+----------+----------+----------+----------+----------+----------+
|     NULL |     NULL |     NULL |     NULL |     NULL |     NULL |     NULL |
|        0 |        0 |        0 |        0 |        0 |        0 |        0 |
|        0 |        1 |        0 |        0 |        1 |        1 |        0 |
|        0 |        0 |        0 |        0 |        1 |        0 |        0 |
|        1 |     NULL |        1 |        1 |        1 |        1 |        1 |
|       -1 |     NULL |       -1 |       -1 |       -1 |       -1 |       -1 |
|        0 |       -1 |        0 |        0 |       -1 |       -1 |        0 |
|     NULL |     NULL |     NULL |        1 |     NULL |     NULL |     NULL |
|     NULL |     NULL |     NULL |       -1 |     NULL |     NULL |     NULL |
|        1 |     NULL |        1 |        1 |        1 |     NULL |        1 |
|        1 |     NULL |        1 |        1 |        1 |     NULL |        1 |
+----------+----------+----------+----------+----------+----------+----------+
SELECT SIN(C1),SIN(C2),SIN(C3),SIN(C4),SIN(C5),SIN(C6),SIN(C7) FROM T1;
+---------------------+----------------------+---------------------+---------------------+----------------------+----------------------+---------------------+
| SIN(C1)             | SIN(C2)              | SIN(C3)             | SIN(C4)             | SIN(C5)              | SIN(C6)              | SIN(C7)             |
+---------------------+----------------------+---------------------+---------------------+----------------------+----------------------+---------------------+
|                NULL |                 NULL |                NULL |                NULL |                 NULL |                 NULL |                NULL |
|                   0 |                    0 |                   0 |                   0 |                    0 |                    0 |                   0 |
|                   0 |  0.12269009002431533 |                   0 |                   0 |  0.12269009002431533 |  0.11971220728891936 |                   0 |
|                   0 |                    0 |                   0 |                   0 |                1e-30 |                    0 |                   0 |
|  0.8414709848078965 |                 NULL |  0.8414709848078965 |  0.8414709848078965 |   0.8414709848078965 |   0.8414709848078965 |  0.8414709848078965 |
| -0.8414709848078965 |                 NULL | -0.8414709848078965 | -0.8414709848078965 |  -0.8414709848078965 |  -0.8414709848078965 | -0.8414709848078965 |
|                   0 | -0.09983341664682815 |                   0 |                   0 | -0.09983341664682815 | -0.09983341664682815 |                   0 |
|                NULL |                 NULL |                NULL | -0.8122226444298825 |                 NULL |                 NULL |                NULL |
|                NULL |                 NULL |                NULL |  0.8122226444298825 |                 NULL |                 NULL |                NULL |
| -0.9997571702608278 |                 NULL | -0.9997571702608278 | -0.9997571702608278 |  -0.9997571702608278 |                 NULL | -0.9997571702608278 |
|  0.7907100989688091 |                 NULL |  0.7907100989688091 |  0.7907100989688091 |   0.7907100989688091 |                 NULL |  0.7907100989688091 |
+---------------------+----------------------+---------------------+---------------------+----------------------+----------------------+---------------------+
SELECT SQRT(C1),SQRT(C2),SQRT(C3),SQRT(C4),SQRT(C5),SQRT(C6),SQRT(C7) FROM T1;
+-------------------+--------------------+-------------------+-------------------+--------------------+---------------------+-------------------+
| SQRT(C1)          | SQRT(C2)           | SQRT(C3)          | SQRT(C4)          | SQRT(C5)           | SQRT(C6)            | SQRT(C7)          |
+-------------------+--------------------+-------------------+-------------------+--------------------+---------------------+-------------------+
|              NULL |               NULL |              NULL |              NULL |               NULL |                NULL |              NULL |
|                 0 |                  0 |                 0 |                 0 |                  0 |                   0 |                 0 |
|                 0 | 0.3507135583350036 |                 0 |                 0 | 0.3507135583350036 | 0.34641016151377546 |                 0 |
|                 0 |                  0 |                 0 |                 0 |  0.000000000000001 |                   0 |                 0 |
|                 1 |               NULL |                 1 |                 1 |                  1 |                   1 |                 1 |
|              NULL |               NULL |              NULL |              NULL |               NULL |                NULL |              NULL |
|                 0 |               NULL |                 0 |                 0 |               NULL |                NULL |                 0 |
|              NULL |               NULL |              NULL |              1e32 |               NULL |                NULL |              NULL |
|              NULL |               NULL |              NULL |              NULL |               NULL |                NULL |              NULL |
| 31.78049716414141 |               NULL | 31.78049716414141 | 31.78049716414141 |  31.78049716414141 |                NULL | 31.78049716414141 |
| 73.89857914736926 |               NULL | 73.89857914736926 | 73.89857914736926 |  73.89857914736926 |                NULL | 73.89857914736926 |
+-------------------+--------------------+-------------------+-------------------+--------------------+---------------------+-------------------+
SELECT TAN(C1),TAN(C2),TAN(C3),TAN(C4),TAN(C5),TAN(C6),TAN(C7) FROM T1;
+---------------------+----------------------+---------------------+---------------------+----------------------+----------------------+---------------------+
| TAN(C1)             | TAN(C2)              | TAN(C3)             | TAN(C4)             | TAN(C5)              | TAN(C6)              | TAN(C7)             |
+---------------------+----------------------+---------------------+---------------------+----------------------+----------------------+---------------------+
|                NULL |                 NULL |                NULL |                NULL |                 NULL |                 NULL |                NULL |
|                   0 |                    0 |                   0 |                   0 |                    0 |                    0 |                   0 |
|                   0 |  0.12362406586927442 |                   0 |                   0 |  0.12362406586927442 |   0.1205793372113053 |                   0 |
|                   0 |                    0 |                   0 |                   0 |                1e-30 |                    0 |                   0 |
|  1.5574077246549023 |                 NULL |  1.5574077246549023 |  1.5574077246549023 |   1.5574077246549023 |   1.5574077246549023 |  1.5574077246549023 |
| -1.5574077246549023 |                 NULL | -1.5574077246549023 | -1.5574077246549023 |  -1.5574077246549023 |  -1.5574077246549023 | -1.5574077246549023 |
|                   0 | -0.10033467208545055 |                   0 |                   0 | -0.10033467208545055 | -0.10033467208545055 |                   0 |
|                NULL |                 NULL |                NULL | -1.3923477185535935 |                 NULL |                 NULL |                NULL |
|                NULL |                 NULL |                NULL |  1.3923477185535935 |                 NULL |                 NULL |                NULL |
|    45.3685563023753 |                 NULL |    45.3685563023753 |    45.3685563023753 |     45.3685563023753 |                 NULL |    45.3685563023753 |
|   1.291607350475015 |                 NULL |   1.291607350475015 |   1.291607350475015 |    1.291607350475015 |                 NULL |   1.291607350475015 |
+---------------------+----------------------+---------------------+---------------------+----------------------+----------------------+---------------------+
SELECT TRUNCATE(C1,C2),TRUNCATE(C2,C3),TRUNCATE(C3,C4),TRUNCATE(C4,C5),TRUNCATE(C5,C6),TRUNCATE(C6,C7),TRUNCATE(C7,C1) FROM T1;
+-----------------+-----------------+-----------------+-----------------+----------------------------------+-----------------+-----------------+
| TRUNCATE(C1,C2) | TRUNCATE(C2,C3) | TRUNCATE(C3,C4) | TRUNCATE(C4,C5) | TRUNCATE(C5,C6)                  | TRUNCATE(C6,C7) | TRUNCATE(C7,C1) |
+-----------------+-----------------+-----------------+-----------------+----------------------------------+-----------------+-----------------+
|            NULL |            NULL |            NULL |            NULL |                             NULL |            NULL |            NULL |
|               0 |    0.0000000000 |               0 |               0 | 0.000000000000000000000000000000 |            0.00 |               0 |
|               0 |    0.0000000000 |               0 |               0 | 0.000000000000000000000000000000 |            0.00 |               0 |
|               0 |    0.0000000000 |               0 |               0 | 0.000000000000000000000000000000 |            0.00 |               0 |
|            NULL |            NULL |               1 |               1 | 1.000000000000000000000000000000 |            1.00 |               1 |
|            NULL |            NULL |               0 |               0 | 0.000000000000000000000000000000 |            0.00 |               0 |
|               0 |    0.0000000000 |               0 |               0 | 0.000000000000000000000000000000 |            0.00 |               0 |
|            NULL |            NULL |            NULL |            NULL |                             NULL |            NULL |            NULL |
|            NULL |            NULL |            NULL |            NULL |                             NULL |            NULL |            NULL |
|            NULL |            NULL |            1010 |            1010 |                             NULL |            NULL |            1010 |
|            NULL |            NULL |            5461 |            5461 |                             NULL |            NULL |            5461 |
+-----------------+-----------------+-----------------+-----------------+----------------------------------+-----------------+-----------------+
##Â≠óÁ¨¶‰∏≤ÂáΩÊï∞##
##ASCII##
SELECT ASCII(C1),ASCII(C2),ASCII(C3),ASCII(C4),ASCII(C5),ASCII(C6),ASCII(C7) FROM T1;
+-----------+-----------+-----------+-----------+-----------+-----------+-----------+
| ASCII(C1) | ASCII(C2) | ASCII(C3) | ASCII(C4) | ASCII(C5) | ASCII(C6) | ASCII(C7) |
+-----------+-----------+-----------+-----------+-----------+-----------+-----------+
|      NULL |      NULL |      NULL |      NULL |      NULL |      NULL |      NULL |
|        48 |        48 |        48 |        48 |        48 |        48 |        48 |
|        48 |        48 |        48 |        48 |        48 |        48 |        48 |
|        48 |        48 |        48 |        48 |        48 |        48 |        48 |
|        49 |      NULL |        49 |        49 |        49 |        49 |        49 |
|        45 |      NULL |        45 |        45 |        45 |        45 |        45 |
|        48 |        45 |        48 |        48 |        45 |        45 |        48 |
|      NULL |      NULL |      NULL |        49 |      NULL |      NULL |      NULL |
|      NULL |      NULL |      NULL |        45 |      NULL |      NULL |      NULL |
|        49 |      NULL |        49 |        49 |        49 |      NULL |        49 |
|        53 |      NULL |        53 |        53 |        53 |      NULL |        53 |
+-----------+-----------+-----------+-----------+-----------+-----------+-----------+
##BIN##
SELECT BIN(C1),BIN(C2),BIN(C3),BIN(C4),BIN(C5),BIN(C6),BIN(C7) FROM T1;
+------------------------------------------------------------------+---------+------------------------------------------------------------------+------------------------------------------------------------------+------------------------------------------------------------------+------------------------------------------------------------------+------------------------------------------------------------------+
| BIN(C1)                                                          | BIN(C2) | BIN(C3)                                                          | BIN(C4)                                                          | BIN(C5)                                                          | BIN(C6)                                                          | BIN(C7)                                                          |
+------------------------------------------------------------------+---------+------------------------------------------------------------------+------------------------------------------------------------------+------------------------------------------------------------------+------------------------------------------------------------------+------------------------------------------------------------------+
| NULL                                                             | NULL    | NULL                                                             | NULL                                                             | NULL                                                             | NULL                                                             | NULL                                                             |
| 0                                                                | 0       | 0                                                                | 0                                                                | 0                                                                | 0                                                                | 0                                                                |
| 0                                                                | 0       | 0                                                                | 0                                                                | 0                                                                | 0                                                                | 0                                                                |
| 0                                                                | 0       | 0                                                                | 0                                                                | 0                                                                | 0                                                                | 0                                                                |
| 1                                                                | NULL    | 1                                                                | 1                                                                | 1                                                                | 1                                                                | 1                                                                |
| 1111111111111111111111111111111111111111111111111111111111111111 | NULL    | 1111111111111111111111111111111111111111111111111111111111111111 | 1111111111111111111111111111111111111111111111111111111111111111 | 1111111111111111111111111111111111111111111111111111111111111111 | 1111111111111111111111111111111111111111111111111111111111111111 | 1111111111111111111111111111111111111111111111111111111111111111 |
| 0                                                                | 0       | 0                                                                | 0                                                                | 0                                                                | 0                                                                | 0                                                                |
| NULL                                                             | NULL    | NULL                                                             | 1111111111111111111111111111111111111111111111111111111111111111 | NULL                                                             | NULL                                                             | NULL                                                             |
| NULL                                                             | NULL    | NULL                                                             | 1111111111111111111111111111111111111111111111111111111111111111 | NULL                                                             | NULL                                                             | NULL                                                             |
| 1111110010                                                       | NULL    | 1111110010                                                       | 1111110010                                                       | 1111110010                                                       | NULL                                                             | 1111110010                                                       |
| 1010101010101                                                    | NULL    | 1010101010101                                                    | 1010101010101                                                    | 1010101010101                                                    | NULL                                                             | 1010101010101                                                    |
+------------------------------------------------------------------+---------+------------------------------------------------------------------+------------------------------------------------------------------+------------------------------------------------------------------+------------------------------------------------------------------+------------------------------------------------------------------+
##BIT_LENGTH##
SELECT BIT_LENGTH(C1),BIT_LENGTH(C2),BIT_LENGTH(C3),BIT_LENGTH(C4),BIT_LENGTH(C5),BIT_LENGTH(C6),BIT_LENGTH(C7) FROM T1;
+----------------+----------------+----------------+----------------+----------------+----------------+----------------+
| BIT_LENGTH(C1) | BIT_LENGTH(C2) | BIT_LENGTH(C3) | BIT_LENGTH(C4) | BIT_LENGTH(C5) | BIT_LENGTH(C6) | BIT_LENGTH(C7) |
+----------------+----------------+----------------+----------------+----------------+----------------+----------------+
|           NULL |           NULL |           NULL |           NULL |           NULL |           NULL |           NULL |
|              8 |             96 |              8 |              8 |            256 |             32 |              8 |
|              8 |             96 |              8 |              8 |            256 |             32 |              8 |
|              8 |             96 |              8 |              8 |            256 |             32 |              8 |
|              8 |           NULL |              8 |              8 |            256 |             32 |              8 |
|             16 |           NULL |             16 |             16 |            264 |             40 |             16 |
|              8 |            104 |              8 |              8 |            264 |             40 |              8 |
|           NULL |           NULL |           NULL |            520 |           NULL |           NULL |           NULL |
|           NULL |           NULL |           NULL |            528 |           NULL |           NULL |           NULL |
|             32 |           NULL |             32 |             32 |            280 |           NULL |             32 |
|             32 |           NULL |             32 |             32 |            280 |           NULL |             32 |
+----------------+----------------+----------------+----------------+----------------+----------------+----------------+
##CHAR##
SELECT CHAR(C1),CHAR(C2),CHAR(C3),CHAR(C4),CHAR(C5),CHAR(C6),CHAR(C7) FROM T1;
+----------+----------+----------+----------+----------+----------+----------+
| CHAR(C1) | CHAR(C2) | CHAR(C3) | CHAR(C4) | CHAR(C5) | CHAR(C6) | CHAR(C7) |
+----------+----------+----------+----------+----------+----------+----------+
|          |          |          |          |          |          |          |
|          |          |          |          |          |          |          |
|          |          |          |          |          |          |          |
|          |          |          |          |          |          |          |
|         |          |         |         |         |         |         |
| ˇˇˇˇ         |          | ˇˇˇˇ         | ˇˇˇˇ         | ˇˇˇˇ         | ˇˇˇˇ         | ˇˇˇˇ         |
|          |          |          |          |          |          |          |
|          |          |          | ˇˇˇˇ         |          |          |          |
|          |          |          |          |          |          |          |
| Ú        |          | Ú        | Ú        | Ú        |          | Ú        |
| U       |          | U       | U       | U       |          | U       |
+----------+----------+----------+----------+----------+----------+----------+
##CHAR_LENGTH##
SELECT CHAR_LENGTH(C1),CHAR_LENGTH(C2),CHAR_LENGTH(C3),CHAR_LENGTH(C4),CHAR_LENGTH(C5),CHAR_LENGTH(C6),CHAR_LENGTH(C7) FROM T1;
+-----------------+-----------------+-----------------+-----------------+-----------------+-----------------+-----------------+
| CHAR_LENGTH(C1) | CHAR_LENGTH(C2) | CHAR_LENGTH(C3) | CHAR_LENGTH(C4) | CHAR_LENGTH(C5) | CHAR_LENGTH(C6) | CHAR_LENGTH(C7) |
+-----------------+-----------------+-----------------+-----------------+-----------------+-----------------+-----------------+
|            NULL |            NULL |            NULL |            NULL |            NULL |            NULL |            NULL |
|               1 |              12 |               1 |               1 |              32 |               4 |               1 |
|               1 |              12 |               1 |               1 |              32 |               4 |               1 |
|               1 |              12 |               1 |               1 |              32 |               4 |               1 |
|               1 |            NULL |               1 |               1 |              32 |               4 |               1 |
|               2 |            NULL |               2 |               2 |              33 |               5 |               2 |
|               1 |              13 |               1 |               1 |              33 |               5 |               1 |
|            NULL |            NULL |            NULL |              65 |            NULL |            NULL |            NULL |
|            NULL |            NULL |            NULL |              66 |            NULL |            NULL |            NULL |
|               4 |            NULL |               4 |               4 |              35 |            NULL |               4 |
|               4 |            NULL |               4 |               4 |              35 |            NULL |               4 |
+-----------------+-----------------+-----------------+-----------------+-----------------+-----------------+-----------------+
##CHARACTER_LENGTH##
SELECT CHARACTER_LENGTH(C1),CHARACTER_LENGTH(C2),CHARACTER_LENGTH(C3),CHARACTER_LENGTH(C4),CHARACTER_LENGTH(C5),CHARACTER_LENGTH(C6),CHARACTER_LENGTH(C7) FROM T1;
+----------------------+----------------------+----------------------+----------------------+----------------------+----------------------+----------------------+
| CHARACTER_LENGTH(C1) | CHARACTER_LENGTH(C2) | CHARACTER_LENGTH(C3) | CHARACTER_LENGTH(C4) | CHARACTER_LENGTH(C5) | CHARACTER_LENGTH(C6) | CHARACTER_LENGTH(C7) |
+----------------------+----------------------+----------------------+----------------------+----------------------+----------------------+----------------------+
|                 NULL |                 NULL |                 NULL |                 NULL |                 NULL |                 NULL |                 NULL |
|                    1 |                   12 |                    1 |                    1 |                   32 |                    4 |                    1 |
|                    1 |                   12 |                    1 |                    1 |                   32 |                    4 |                    1 |
|                    1 |                   12 |                    1 |                    1 |                   32 |                    4 |                    1 |
|                    1 |                 NULL |                    1 |                    1 |                   32 |                    4 |                    1 |
|                    2 |                 NULL |                    2 |                    2 |                   33 |                    5 |                    2 |
|                    1 |                   13 |                    1 |                    1 |                   33 |                    5 |                    1 |
|                 NULL |                 NULL |                 NULL |                   65 |                 NULL |                 NULL |                 NULL |
|                 NULL |                 NULL |                 NULL |                   66 |                 NULL |                 NULL |                 NULL |
|                    4 |                 NULL |                    4 |                    4 |                   35 |                 NULL |                    4 |
|                    4 |                 NULL |                    4 |                    4 |                   35 |                 NULL |                    4 |
+----------------------+----------------------+----------------------+----------------------+----------------------+----------------------+----------------------+
##CONCAT##
SELECT CONCAT(C1,C2),CONCAT(C2,C3),CONCAT(C3,C4),CONCAT(C4,C5),CONCAT(C5,C6),CONCAT(C6,C7),CONCAT(C7,C1) FROM T1;
+----------------+----------------+---------------+-----------------------------------------+----------------------------------------+---------------+---------------+
| CONCAT(C1,C2)  | CONCAT(C2,C3)  | CONCAT(C3,C4) | CONCAT(C4,C5)                           | CONCAT(C5,C6)                          | CONCAT(C6,C7) | CONCAT(C7,C1) |
+----------------+----------------+---------------+-----------------------------------------+----------------------------------------+---------------+---------------+
| NULL           | NULL           | NULL          | NULL                                    | NULL                                   | NULL          | NULL          |
| 00.0000000000  | 0.00000000000  | 00            | 00.000000000000000000000000000000       | 0.0000000000000000000000000000000.00   | 0.000         | 00            |
| 00.1230000000  | 0.12300000000  | 00            | 00.123000000000000000000000000000       | 0.1230000000000000000000000000000.12   | 0.120         | 00            |
| 00.0000000000  | 0.00000000000  | 00            | 00.000000000000000000000000000001       | 0.0000000000000000000000000000010.00   | 0.000         | 00            |
| NULL           | NULL           | 11            | 11.000000000000000000000000000000       | 1.0000000000000000000000000000001.00   | 1.001         | 11            |
| NULL           | NULL           | -1-1          | -1-1.000000000000000000000000000000     | -1.000000000000000000000000000000-1.00 | -1.00-1       | -1-1          |
| 0-0.1000000000 | -0.10000000000 | 00            | 0-0.100000000000000000000000000000      | -0.100000000000000000000000000000-0.10 | -0.100        | 00            |
| NULL           | NULL           | NULL          | NULL                                    | NULL                                   | NULL          | NULL          |
| NULL           | NULL           | NULL          | NULL                                    | NULL                                   | NULL          | NULL          |
| NULL           | NULL           | 10101010      | 10101010.000000000000000000000000000000 | NULL                                   | NULL          | 10101010      |
| NULL           | NULL           | 54615461      | 54615461.000000000000000000000000000000 | NULL                                   | NULL          | 54615461      |
+----------------+----------------+---------------+-----------------------------------------+----------------------------------------+---------------+---------------+
##CONCAT_WS##
SELECT CONCAT_WS(C1,C1,C2),CONCAT_WS(C2,C2,C3),CONCAT_WS(C3,C3,C4),CONCAT_WS(C4,C4,C5),CONCAT_WS(C5,C5,C6),CONCAT_WS(C6,C6,C7),CONCAT_WS(C7,C7,C1) FROM T1;
+---------------------+-----------------------------+---------------------+--------------------------------------------------------------------+-------------------------------------------------------------------------+---------------------+---------------------+
| CONCAT_WS(C1,C1,C2) | CONCAT_WS(C2,C2,C3)         | CONCAT_WS(C3,C3,C4) | CONCAT_WS(C4,C4,C5)                                                | CONCAT_WS(C5,C5,C6)                                                     | CONCAT_WS(C6,C6,C7) | CONCAT_WS(C7,C7,C1) |
+---------------------+-----------------------------+---------------------+--------------------------------------------------------------------+-------------------------------------------------------------------------+---------------------+---------------------+
| NULL                | NULL                        | NULL                | NULL                                                               | NULL                                                                    | NULL                | NULL                |
| 000.0000000000      | 0.00000000000.00000000000   | 000                 | 000.000000000000000000000000000000                                 | 0.0000000000000000000000000000000.0000000000000000000000000000000.00    | 0.000.000           | 000                 |
| 000.1230000000      | 0.12300000000.12300000000   | 000                 | 000.123000000000000000000000000000                                 | 0.1230000000000000000000000000000.1230000000000000000000000000000.12    | 0.120.120           | 000                 |
| 000.0000000000      | 0.00000000000.00000000000   | 000                 | 000.000000000000000000000000000001                                 | 0.0000000000000000000000000000010.0000000000000000000000000000010.00    | 0.000.000           | 000                 |
| 1                   | NULL                        | 111                 | 111.000000000000000000000000000000                                 | 1.0000000000000000000000000000001.0000000000000000000000000000001.00    | 1.001.001           | 111                 |
| -1                  | NULL                        | -1-1-1              | -1-1-1.000000000000000000000000000000                              | -1.000000000000000000000000000000-1.000000000000000000000000000000-1.00 | -1.00-1.00-1        | -1-1-1              |
| 00-0.1000000000     | -0.1000000000-0.10000000000 | 000                 | 00-0.100000000000000000000000000000                                | -0.100000000000000000000000000000-0.100000000000000000000000000000-0.10 | -0.10-0.100         | 000                 |
| NULL                | NULL                        | NULL                | 10000000000000000000000000000000000000000000000000000000000000000  | NULL                                                                    | NULL                | NULL                |
| NULL                | NULL                        | NULL                | -10000000000000000000000000000000000000000000000000000000000000000 | NULL                                                                    | NULL                | NULL                |
| 1010                | NULL                        | 101010101010        | 101010101010.000000000000000000000000000000                        | 1010.000000000000000000000000000000                                     | NULL                | 101010101010        |
| 5461                | NULL                        | 546154615461        | 546154615461.000000000000000000000000000000                        | 5461.000000000000000000000000000000                                     | NULL                | 546154615461        |
+---------------------+-----------------------------+---------------------+--------------------------------------------------------------------+-------------------------------------------------------------------------+---------------------+---------------------+
##ELT##
SELECT ELT(C1,C2),ELT(C2,C3),ELT(C3,C4),ELT(C4,C5),ELT(C5,C6),ELT(C6,C7),ELT(C7,C1) FROM T1;
+------------+------------+------------+----------------------------------+------------+------------+------------+
| ELT(C1,C2) | ELT(C2,C3) | ELT(C3,C4) | ELT(C4,C5)                       | ELT(C5,C6) | ELT(C6,C7) | ELT(C7,C1) |
+------------+------------+------------+----------------------------------+------------+------------+------------+
| NULL       | NULL       | NULL       | NULL                             | NULL       | NULL       | NULL       |
| NULL       | NULL       | NULL       | NULL                             | NULL       | NULL       | NULL       |
| NULL       | NULL       | NULL       | NULL                             | NULL       | NULL       | NULL       |
| NULL       | NULL       | NULL       | NULL                             | NULL       | NULL       | NULL       |
| NULL       | NULL       | 1          | 1.000000000000000000000000000000 | 1.00       | 1          | 1          |
| NULL       | NULL       | NULL       | NULL                             | NULL       | NULL       | NULL       |
| NULL       | NULL       | NULL       | NULL                             | NULL       | NULL       | NULL       |
| NULL       | NULL       | NULL       | NULL                             | NULL       | NULL       | NULL       |
| NULL       | NULL       | NULL       | NULL                             | NULL       | NULL       | NULL       |
| NULL       | NULL       | NULL       | NULL                             | NULL       | NULL       | NULL       |
| NULL       | NULL       | NULL       | NULL                             | NULL       | NULL       | NULL       |
+------------+------------+------------+----------------------------------+------------+------------+------------+
##EXPORT_SET##
SELECT EXPORT_SET(C1,C2,C3),EXPORT_SET(C2,C3,C4),EXPORT_SET(C3,C4,C5),EXPORT_SET(C5,C6,C7),EXPORT_SET(C6,C7,C1) FROM T1;
+---------------------------------------------------------------------------------------------------------------------------------+---------------------------------------------------------------------------------------------------------------------------------+-----------------------------------------------------------------------------------------------------------------------------------------------------------------------------------------------------------------------------------------------------------------------------------------------------------------------------------------------------------------------------------------------------------------------------------------------------------------------------------------------------------------------------------------------------------------------------------------------------------------------------------------------------------------------------------------------------------------------------------------------------------------------------------------------------------------------------------------------------------------------------------------------------------------------------------------------------------------------------------------------------------------------------------------------------------------------------------------------------------------------------------------------------------------------------------------------------------------------------------------------------------------------------------------------------------------------------------------------------------------------------------------------------------------------------------------------------------------------------------------------------------------------------------------------------------------------------------------------------------------------------------------------------------------------------------------------------------------------------------------------------------------------------------------------------------------------------------------------------------------------------------------------------------------------------------------------------------------------------------------------------------------------------------------------------------------------------------------------------------------------------------------------------------------------------------------------------------------------------------------------------------------+-------------------------------------------------------------------------------------------------------------------------------------------------------------------------------------------------------------------------------------------------------------------------------------------------------------------------------------------------------------------------------------------------+-------------------------------------------------------------------------------------------------------------------------------------------------------------------------------------------------+
| EXPORT_SET(C1,C2,C3)                                                                                                            | EXPORT_SET(C2,C3,C4)                                                                                                            | EXPORT_SET(C3,C4,C5)                                                                                                                                                                                                                                                                                                                                                                                                                                                                                                                                                                                                                                                                                                                                                                                                                                                                                                                                                                                                                                             | EXPORT_SET(C5,C6,C7)                                                                                                                                                                                                                                                                                                                                                                            | EXPORT_SET(C6,C7,C1)                                                                                                                                                                            |
+---------------------------------------------------------------------------------------------------------------------------------+---------------------------------------------------------------------------------------------------------------------------------+-----------------------------------------------------------------------------------------------------------------------------------------------------------------------------------------------------------------------------------------------------------------------------------------------------------------------------------------------------------------------------------------------------------------------------------------------------------------------------------------------------------------------------------------------------------------------------------------------------------------------------------------------------------------------------------------------------------------------------------------------------------------------------------------------------------------------------------------------------------------------------------------------------------------------------------------------------------------------------------------------------------------------------------------------------------------------------------------------------------------------------------------------------------------------------------------------------------------------------------------------------------------------------------------------------------------------------------------------------------------------------------------------------------------------------------------------------------------------------------------------------------------------------------------------------------------------------------------------------------------------------------------------------------------------------------------------------------------------------------------------------------------------------------------------------------------------------------------------------------------------------------------------------------------------------------------------------------------------------------------------------------------------------------------------------------------------------------------------------------------------------------------------------------------------------------------------------------------------------------------------------------------+-------------------------------------------------------------------------------------------------------------------------------------------------------------------------------------------------------------------------------------------------------------------------------------------------------------------------------------------------------------------------------------------------+-------------------------------------------------------------------------------------------------------------------------------------------------------------------------------------------------+
| NULL                                                                                                                            | NULL                                                                                                                            | NULL                                                                                                                                                                                                                                                                                                                                                                                                                                                                                                                                                                                                                                                                                                                                                                                                                                                                                                                                                                                                                                                             | NULL                                                                                                                                                                                                                                                                                                                                                                                            | NULL                                                                                                                                                                                            |
| 0,0,0,0,0,0,0,0,0,0,0,0,0,0,0,0,0,0,0,0,0,0,0,0,0,0,0,0,0,0,0,0,0,0,0,0,0,0,0,0,0,0,0,0,0,0,0,0,0,0,0,0,0,0,0,0,0,0,0,0,0,0,0,0 | 0,0,0,0,0,0,0,0,0,0,0,0,0,0,0,0,0,0,0,0,0,0,0,0,0,0,0,0,0,0,0,0,0,0,0,0,0,0,0,0,0,0,0,0,0,0,0,0,0,0,0,0,0,0,0,0,0,0,0,0,0,0,0,0 | 0.000000000000000000000000000000,0.000000000000000000000000000000,0.000000000000000000000000000000,0.000000000000000000000000000000,0.000000000000000000000000000000,0.000000000000000000000000000000,0.000000000000000000000000000000,0.000000000000000000000000000000,0.000000000000000000000000000000,0.000000000000000000000000000000,0.000000000000000000000000000000,0.000000000000000000000000000000,0.000000000000000000000000000000,0.000000000000000000000000000000,0.000000000000000000000000000000,0.000000000000000000000000000000,0.000000000000000000000000000000,0.000000000000000000000000000000,0.000000000000000000000000000000,0.000000000000000000000000000000,0.000000000000000000000000000000,0.000000000000000000000000000000,0.000000000000000000000000000000,0.000000000000000000000000000000,0.000000000000000000000000000000,0.000000000000000000000000000000,0.000000000000000000000000000000,0.000000000000000000000000000000,0.000000000000000000000000000000,0.000000000000000000000000000000,0.000000000000000000000000000000,0.000000000000000000000000000000,0.000000000000000000000000000000,0.000000000000000000000000000000,0.000000000000000000000000000000,0.000000000000000000000000000000,0.000000000000000000000000000000,0.000000000000000000000000000000,0.000000000000000000000000000000,0.000000000000000000000000000000,0.000000000000000000000000000000,0.000000000000000000000000000000,0.000000000000000000000000000000,0.000000000000000000000000000000,0.000000000000000000000000000000,0.000000000000000000000000000000,0.000000000000000000000000000000,0.000000000000000000000000000000,0.000000000000000000000000000000,0.000000000000000000000000000000,0.000000000000000000000000000000,0.000000000000000000000000000000,0.000000000000000000000000000000,0.000000000000000000000000000000,0.000000000000000000000000000000,0.000000000000000000000000000000,0.000000000000000000000000000000,0.000000000000000000000000000000,0.000000000000000000000000000000,0.000000000000000000000000000000,0.000000000000000000000000000000,0.000000000000000000000000000000,0.000000000000000000000000000000,0.000000000000000000000000000000 | 0,0,0,0,0,0,0,0,0,0,0,0,0,0,0,0,0,0,0,0,0,0,0,0,0,0,0,0,0,0,0,0,0,0,0,0,0,0,0,0,0,0,0,0,0,0,0,0,0,0,0,0,0,0,0,0,0,0,0,0,0,0,0,0                                                                                                                                                                                                                                                                 | 0,0,0,0,0,0,0,0,0,0,0,0,0,0,0,0,0,0,0,0,0,0,0,0,0,0,0,0,0,0,0,0,0,0,0,0,0,0,0,0,0,0,0,0,0,0,0,0,0,0,0,0,0,0,0,0,0,0,0,0,0,0,0,0                                                                 |
| 0,0,0,0,0,0,0,0,0,0,0,0,0,0,0,0,0,0,0,0,0,0,0,0,0,0,0,0,0,0,0,0,0,0,0,0,0,0,0,0,0,0,0,0,0,0,0,0,0,0,0,0,0,0,0,0,0,0,0,0,0,0,0,0 | 0,0,0,0,0,0,0,0,0,0,0,0,0,0,0,0,0,0,0,0,0,0,0,0,0,0,0,0,0,0,0,0,0,0,0,0,0,0,0,0,0,0,0,0,0,0,0,0,0,0,0,0,0,0,0,0,0,0,0,0,0,0,0,0 | 0.123000000000000000000000000000,0.123000000000000000000000000000,0.123000000000000000000000000000,0.123000000000000000000000000000,0.123000000000000000000000000000,0.123000000000000000000000000000,0.123000000000000000000000000000,0.123000000000000000000000000000,0.123000000000000000000000000000,0.123000000000000000000000000000,0.123000000000000000000000000000,0.123000000000000000000000000000,0.123000000000000000000000000000,0.123000000000000000000000000000,0.123000000000000000000000000000,0.123000000000000000000000000000,0.123000000000000000000000000000,0.123000000000000000000000000000,0.123000000000000000000000000000,0.123000000000000000000000000000,0.123000000000000000000000000000,0.123000000000000000000000000000,0.123000000000000000000000000000,0.123000000000000000000000000000,0.123000000000000000000000000000,0.123000000000000000000000000000,0.123000000000000000000000000000,0.123000000000000000000000000000,0.123000000000000000000000000000,0.123000000000000000000000000000,0.123000000000000000000000000000,0.123000000000000000000000000000,0.123000000000000000000000000000,0.123000000000000000000000000000,0.123000000000000000000000000000,0.123000000000000000000000000000,0.123000000000000000000000000000,0.123000000000000000000000000000,0.123000000000000000000000000000,0.123000000000000000000000000000,0.123000000000000000000000000000,0.123000000000000000000000000000,0.123000000000000000000000000000,0.123000000000000000000000000000,0.123000000000000000000000000000,0.123000000000000000000000000000,0.123000000000000000000000000000,0.123000000000000000000000000000,0.123000000000000000000000000000,0.123000000000000000000000000000,0.123000000000000000000000000000,0.123000000000000000000000000000,0.123000000000000000000000000000,0.123000000000000000000000000000,0.123000000000000000000000000000,0.123000000000000000000000000000,0.123000000000000000000000000000,0.123000000000000000000000000000,0.123000000000000000000000000000,0.123000000000000000000000000000,0.123000000000000000000000000000,0.123000000000000000000000000000,0.123000000000000000000000000000,0.123000000000000000000000000000 | 0,0,0,0,0,0,0,0,0,0,0,0,0,0,0,0,0,0,0,0,0,0,0,0,0,0,0,0,0,0,0,0,0,0,0,0,0,0,0,0,0,0,0,0,0,0,0,0,0,0,0,0,0,0,0,0,0,0,0,0,0,0,0,0                                                                                                                                                                                                                                                                 | 0,0,0,0,0,0,0,0,0,0,0,0,0,0,0,0,0,0,0,0,0,0,0,0,0,0,0,0,0,0,0,0,0,0,0,0,0,0,0,0,0,0,0,0,0,0,0,0,0,0,0,0,0,0,0,0,0,0,0,0,0,0,0,0                                                                 |
| 0,0,0,0,0,0,0,0,0,0,0,0,0,0,0,0,0,0,0,0,0,0,0,0,0,0,0,0,0,0,0,0,0,0,0,0,0,0,0,0,0,0,0,0,0,0,0,0,0,0,0,0,0,0,0,0,0,0,0,0,0,0,0,0 | 0,0,0,0,0,0,0,0,0,0,0,0,0,0,0,0,0,0,0,0,0,0,0,0,0,0,0,0,0,0,0,0,0,0,0,0,0,0,0,0,0,0,0,0,0,0,0,0,0,0,0,0,0,0,0,0,0,0,0,0,0,0,0,0 | 0.000000000000000000000000000001,0.000000000000000000000000000001,0.000000000000000000000000000001,0.000000000000000000000000000001,0.000000000000000000000000000001,0.000000000000000000000000000001,0.000000000000000000000000000001,0.000000000000000000000000000001,0.000000000000000000000000000001,0.000000000000000000000000000001,0.000000000000000000000000000001,0.000000000000000000000000000001,0.000000000000000000000000000001,0.000000000000000000000000000001,0.000000000000000000000000000001,0.000000000000000000000000000001,0.000000000000000000000000000001,0.000000000000000000000000000001,0.000000000000000000000000000001,0.000000000000000000000000000001,0.000000000000000000000000000001,0.000000000000000000000000000001,0.000000000000000000000000000001,0.000000000000000000000000000001,0.000000000000000000000000000001,0.000000000000000000000000000001,0.000000000000000000000000000001,0.000000000000000000000000000001,0.000000000000000000000000000001,0.000000000000000000000000000001,0.000000000000000000000000000001,0.000000000000000000000000000001,0.000000000000000000000000000001,0.000000000000000000000000000001,0.000000000000000000000000000001,0.000000000000000000000000000001,0.000000000000000000000000000001,0.000000000000000000000000000001,0.000000000000000000000000000001,0.000000000000000000000000000001,0.000000000000000000000000000001,0.000000000000000000000000000001,0.000000000000000000000000000001,0.000000000000000000000000000001,0.000000000000000000000000000001,0.000000000000000000000000000001,0.000000000000000000000000000001,0.000000000000000000000000000001,0.000000000000000000000000000001,0.000000000000000000000000000001,0.000000000000000000000000000001,0.000000000000000000000000000001,0.000000000000000000000000000001,0.000000000000000000000000000001,0.000000000000000000000000000001,0.000000000000000000000000000001,0.000000000000000000000000000001,0.000000000000000000000000000001,0.000000000000000000000000000001,0.000000000000000000000000000001,0.000000000000000000000000000001,0.000000000000000000000000000001,0.000000000000000000000000000001,0.000000000000000000000000000001 | 0,0,0,0,0,0,0,0,0,0,0,0,0,0,0,0,0,0,0,0,0,0,0,0,0,0,0,0,0,0,0,0,0,0,0,0,0,0,0,0,0,0,0,0,0,0,0,0,0,0,0,0,0,0,0,0,0,0,0,0,0,0,0,0                                                                                                                                                                                                                                                                 | 0,0,0,0,0,0,0,0,0,0,0,0,0,0,0,0,0,0,0,0,0,0,0,0,0,0,0,0,0,0,0,0,0,0,0,0,0,0,0,0,0,0,0,0,0,0,0,0,0,0,0,0,0,0,0,0,0,0,0,0,0,0,0,0                                                                 |
| NULL                                                                                                                            | NULL                                                                                                                            | 1,1.000000000000000000000000000000,1.000000000000000000000000000000,1.000000000000000000000000000000,1.000000000000000000000000000000,1.000000000000000000000000000000,1.000000000000000000000000000000,1.000000000000000000000000000000,1.000000000000000000000000000000,1.000000000000000000000000000000,1.000000000000000000000000000000,1.000000000000000000000000000000,1.000000000000000000000000000000,1.000000000000000000000000000000,1.000000000000000000000000000000,1.000000000000000000000000000000,1.000000000000000000000000000000,1.000000000000000000000000000000,1.000000000000000000000000000000,1.000000000000000000000000000000,1.000000000000000000000000000000,1.000000000000000000000000000000,1.000000000000000000000000000000,1.000000000000000000000000000000,1.000000000000000000000000000000,1.000000000000000000000000000000,1.000000000000000000000000000000,1.000000000000000000000000000000,1.000000000000000000000000000000,1.000000000000000000000000000000,1.000000000000000000000000000000,1.000000000000000000000000000000,1.000000000000000000000000000000,1.000000000000000000000000000000,1.000000000000000000000000000000,1.000000000000000000000000000000,1.000000000000000000000000000000,1.000000000000000000000000000000,1.000000000000000000000000000000,1.000000000000000000000000000000,1.000000000000000000000000000000,1.000000000000000000000000000000,1.000000000000000000000000000000,1.000000000000000000000000000000,1.000000000000000000000000000000,1.000000000000000000000000000000,1.000000000000000000000000000000,1.000000000000000000000000000000,1.000000000000000000000000000000,1.000000000000000000000000000000,1.000000000000000000000000000000,1.000000000000000000000000000000,1.000000000000000000000000000000,1.000000000000000000000000000000,1.000000000000000000000000000000,1.000000000000000000000000000000,1.000000000000000000000000000000,1.000000000000000000000000000000,1.000000000000000000000000000000,1.000000000000000000000000000000,1.000000000000000000000000000000,1.000000000000000000000000000000,1.000000000000000000000000000000,1.000000000000000000000000000000 | 1.00,1,1,1,1,1,1,1,1,1,1,1,1,1,1,1,1,1,1,1,1,1,1,1,1,1,1,1,1,1,1,1,1,1,1,1,1,1,1,1,1,1,1,1,1,1,1,1,1,1,1,1,1,1,1,1,1,1,1,1,1,1,1,1                                                                                                                                                                                                                                                              | 1,1,1,1,1,1,1,1,1,1,1,1,1,1,1,1,1,1,1,1,1,1,1,1,1,1,1,1,1,1,1,1,1,1,1,1,1,1,1,1,1,1,1,1,1,1,1,1,1,1,1,1,1,1,1,1,1,1,1,1,1,1,1,1                                                                 |
| NULL                                                                                                                            | NULL                                                                                                                            | -1,-1,-1,-1,-1,-1,-1,-1,-1,-1,-1,-1,-1,-1,-1,-1,-1,-1,-1,-1,-1,-1,-1,-1,-1,-1,-1,-1,-1,-1,-1,-1,-1,-1,-1,-1,-1,-1,-1,-1,-1,-1,-1,-1,-1,-1,-1,-1,-1,-1,-1,-1,-1,-1,-1,-1,-1,-1,-1,-1,-1,-1,-1,-1                                                                                                                                                                                                                                                                                                                                                                                                                                                                                                                                                                                                                                                                                                                                                                                                                                                                  | -1.00,-1.00,-1.00,-1.00,-1.00,-1.00,-1.00,-1.00,-1.00,-1.00,-1.00,-1.00,-1.00,-1.00,-1.00,-1.00,-1.00,-1.00,-1.00,-1.00,-1.00,-1.00,-1.00,-1.00,-1.00,-1.00,-1.00,-1.00,-1.00,-1.00,-1.00,-1.00,-1.00,-1.00,-1.00,-1.00,-1.00,-1.00,-1.00,-1.00,-1.00,-1.00,-1.00,-1.00,-1.00,-1.00,-1.00,-1.00,-1.00,-1.00,-1.00,-1.00,-1.00,-1.00,-1.00,-1.00,-1.00,-1.00,-1.00,-1.00,-1.00,-1.00,-1.00,-1.00 | -1,-1,-1,-1,-1,-1,-1,-1,-1,-1,-1,-1,-1,-1,-1,-1,-1,-1,-1,-1,-1,-1,-1,-1,-1,-1,-1,-1,-1,-1,-1,-1,-1,-1,-1,-1,-1,-1,-1,-1,-1,-1,-1,-1,-1,-1,-1,-1,-1,-1,-1,-1,-1,-1,-1,-1,-1,-1,-1,-1,-1,-1,-1,-1 |
| 0,0,0,0,0,0,0,0,0,0,0,0,0,0,0,0,0,0,0,0,0,0,0,0,0,0,0,0,0,0,0,0,0,0,0,0,0,0,0,0,0,0,0,0,0,0,0,0,0,0,0,0,0,0,0,0,0,0,0,0,0,0,0,0 | 0,0,0,0,0,0,0,0,0,0,0,0,0,0,0,0,0,0,0,0,0,0,0,0,0,0,0,0,0,0,0,0,0,0,0,0,0,0,0,0,0,0,0,0,0,0,0,0,0,0,0,0,0,0,0,0,0,0,0,0,0,0,0,0 | -0.100000000000000000000000000000,-0.100000000000000000000000000000,-0.100000000000000000000000000000,-0.100000000000000000000000000000,-0.100000000000000000000000000000,-0.100000000000000000000000000000,-0.100000000000000000000000000000,-0.100000000000000000000000000000,-0.100000000000000000000000000000,-0.100000000000000000000000000000,-0.100000000000000000000000000000,-0.100000000000000000000000000000,-0.100000000000000000000000000000,-0.100000000000000000000000000000,-0.100000000000000000000000000000,-0.100000000000000000000000000000,-0.100000000000000000000000000000,-0.100000000000000000000000000000,-0.100000000000000000000000000000,-0.100000000000000000000000000000,-0.100000000000000000000000000000,-0.100000000000000000000000000000,-0.100000000000000000000000000000,-0.100000000000000000000000000000,-0.100000000000000000000000000000,-0.100000000000000000000000000000,-0.100000000000000000000000000000,-0.100000000000000000000000000000,-0.100000000000000000000000000000,-0.100000000000000000000000000000,-0.100000000000000000000000000000,-0.100000000000000000000000000000,-0.100000000000000000000000000000,-0.100000000000000000000000000000,-0.100000000000000000000000000000,-0.100000000000000000000000000000,-0.100000000000000000000000000000,-0.100000000000000000000000000000,-0.100000000000000000000000000000,-0.100000000000000000000000000000,-0.100000000000000000000000000000,-0.100000000000000000000000000000,-0.100000000000000000000000000000,-0.100000000000000000000000000000,-0.100000000000000000000000000000,-0.100000000000000000000000000000,-0.100000000000000000000000000000,-0.100000000000000000000000000000,-0.100000000000000000000000000000,-0.100000000000000000000000000000,-0.100000000000000000000000000000,-0.100000000000000000000000000000,-0.100000000000000000000000000000,-0.100000000000000000000000000000,-0.100000000000000000000000000000,-0.100000000000000000000000000000,-0.100000000000000000000000000000,-0.100000000000000000000000000000,-0.100000000000000000000000000000,-0.100000000000000000000000000000,-0.100000000000000000000000000000,-0.100000000000000000000000000000,-0.100000000000000000000000000000,-0.100000000000000000000000000000 | 0,0,0,0,0,0,0,0,0,0,0,0,0,0,0,0,0,0,0,0,0,0,0,0,0,0,0,0,0,0,0,0,0,0,0,0,0,0,0,0,0,0,0,0,0,0,0,0,0,0,0,0,0,0,0,0,0,0,0,0,0,0,0,0                                                                                                                                                                                                                                                                 | 0,0,0,0,0,0,0,0,0,0,0,0,0,0,0,0,0,0,0,0,0,0,0,0,0,0,0,0,0,0,0,0,0,0,0,0,0,0,0,0,0,0,0,0,0,0,0,0,0,0,0,0,0,0,0,0,0,0,0,0,0,0,0,0                                                                 |
| NULL                                                                                                                            | NULL                                                                                                                            | NULL                                                                                                                                                                                                                                                                                                                                                                                                                                                                                                                                                                                                                                                                                                                                                                                                                                                                                                                                                                                                                                                             | NULL                                                                                                                                                                                                                                                                                                                                                                                            | NULL                                                                                                                                                                                            |
| NULL                                                                                                                            | NULL                                                                                                                            | NULL                                                                                                                                                                                                                                                                                                                                                                                                                                                                                                                                                                                                                                                                                                                                                                                                                                                                                                                                                                                                                                                             | NULL                                                                                                                                                                                                                                                                                                                                                                                            | NULL                                                                                                                                                                                            |
| NULL                                                                                                                            | NULL                                                                                                                            | 1010.000000000000000000000000000000,1010,1010.000000000000000000000000000000,1010.000000000000000000000000000000,1010,1010,1010,1010,1010,1010,1010.000000000000000000000000000000,1010.000000000000000000000000000000,1010.000000000000000000000000000000,1010.000000000000000000000000000000,1010.000000000000000000000000000000,1010.000000000000000000000000000000,1010.000000000000000000000000000000,1010.000000000000000000000000000000,1010.000000000000000000000000000000,1010.000000000000000000000000000000,1010.000000000000000000000000000000,1010.000000000000000000000000000000,1010.000000000000000000000000000000,1010.000000000000000000000000000000,1010.000000000000000000000000000000,1010.000000000000000000000000000000,1010.000000000000000000000000000000,1010.000000000000000000000000000000,1010.000000000000000000000000000000,1010.000000000000000000000000000000,1010.000000000000000000000000000000,1010.000000000000000000000000000000,1010.000000000000000000000000000000,1010.000000000000000000000000000000,1010.000000000000000000000000000000,1010.000000000000000000000000000000,1010.000000000000000000000000000000,1010.000000000000000000000000000000,1010.000000000000000000000000000000,1010.000000000000000000000000000000,1010.000000000000000000000000000000,1010.000000000000000000000000000000,1010.000000000000000000000000000000,1010.000000000000000000000000000000,1010.000000000000000000000000000000,1010.000000000000000000000000000000,1010.000000000000000000000000000000,1010.000000000000000000000000000000,1010.000000000000000000000000000000,1010.000000000000000000000000000000,1010.000000000000000000000000000000,1010.000000000000000000000000000000,1010.000000000000000000000000000000,1010.000000000000000000000000000000,1010.000000000000000000000000000000,1010.000000000000000000000000000000,1010.000000000000000000000000000000,1010.000000000000000000000000000000,1010.000000000000000000000000000000,1010.000000000000000000000000000000,1010.000000000000000000000000000000,1010.000000000000000000000000000000,1010.000000000000000000000000000000,1010.000000000000000000000000000000 | NULL                                                                                                                                                                                                                                                                                                                                                                                            | NULL                                                                                                                                                                                            |
| NULL                                                                                                                            | NULL                                                                                                                            | 5461,5461.000000000000000000000000000000,5461,5461.000000000000000000000000000000,5461,5461.000000000000000000000000000000,5461,5461.000000000000000000000000000000,5461,5461.000000000000000000000000000000,5461,5461.000000000000000000000000000000,5461,5461.000000000000000000000000000000,5461.000000000000000000000000000000,5461.000000000000000000000000000000,5461.000000000000000000000000000000,5461.000000000000000000000000000000,5461.000000000000000000000000000000,5461.000000000000000000000000000000,5461.000000000000000000000000000000,5461.000000000000000000000000000000,5461.000000000000000000000000000000,5461.000000000000000000000000000000,5461.000000000000000000000000000000,5461.000000000000000000000000000000,5461.000000000000000000000000000000,5461.000000000000000000000000000000,5461.000000000000000000000000000000,5461.000000000000000000000000000000,5461.000000000000000000000000000000,5461.000000000000000000000000000000,5461.000000000000000000000000000000,5461.000000000000000000000000000000,5461.000000000000000000000000000000,5461.000000000000000000000000000000,5461.000000000000000000000000000000,5461.000000000000000000000000000000,5461.000000000000000000000000000000,5461.000000000000000000000000000000,5461.000000000000000000000000000000,5461.000000000000000000000000000000,5461.000000000000000000000000000000,5461.000000000000000000000000000000,5461.000000000000000000000000000000,5461.000000000000000000000000000000,5461.000000000000000000000000000000,5461.000000000000000000000000000000,5461.000000000000000000000000000000,5461.000000000000000000000000000000,5461.000000000000000000000000000000,5461.000000000000000000000000000000,5461.000000000000000000000000000000,5461.000000000000000000000000000000,5461.000000000000000000000000000000,5461.000000000000000000000000000000,5461.000000000000000000000000000000,5461.000000000000000000000000000000,5461.000000000000000000000000000000,5461.000000000000000000000000000000,5461.000000000000000000000000000000,5461.000000000000000000000000000000,5461.000000000000000000000000000000,5461.000000000000000000000000000000 | NULL                                                                                                                                                                                                                                                                                                                                                                                            | NULL                                                                                                                                                                                            |
+---------------------------------------------------------------------------------------------------------------------------------+---------------------------------------------------------------------------------------------------------------------------------+-----------------------------------------------------------------------------------------------------------------------------------------------------------------------------------------------------------------------------------------------------------------------------------------------------------------------------------------------------------------------------------------------------------------------------------------------------------------------------------------------------------------------------------------------------------------------------------------------------------------------------------------------------------------------------------------------------------------------------------------------------------------------------------------------------------------------------------------------------------------------------------------------------------------------------------------------------------------------------------------------------------------------------------------------------------------------------------------------------------------------------------------------------------------------------------------------------------------------------------------------------------------------------------------------------------------------------------------------------------------------------------------------------------------------------------------------------------------------------------------------------------------------------------------------------------------------------------------------------------------------------------------------------------------------------------------------------------------------------------------------------------------------------------------------------------------------------------------------------------------------------------------------------------------------------------------------------------------------------------------------------------------------------------------------------------------------------------------------------------------------------------------------------------------------------------------------------------------------------------------------------------------+-------------------------------------------------------------------------------------------------------------------------------------------------------------------------------------------------------------------------------------------------------------------------------------------------------------------------------------------------------------------------------------------------+-------------------------------------------------------------------------------------------------------------------------------------------------------------------------------------------------+
##FIELD##
SELECT FIELD(C1,C2,C3),FIELD(C2,C3,C4),FIELD(C3,C4,C5),FIELD(C5,C6,C7),FIELD(C6,C7,C1) FROM T1;
+-----------------+-----------------+-----------------+-----------------+-----------------+
| FIELD(C1,C2,C3) | FIELD(C2,C3,C4) | FIELD(C3,C4,C5) | FIELD(C5,C6,C7) | FIELD(C6,C7,C1) |
+-----------------+-----------------+-----------------+-----------------+-----------------+
|               0 |               0 |               0 |               0 |               0 |
|               1 |               1 |               1 |               1 |               1 |
|               2 |               0 |               1 |               0 |               0 |
|               1 |               1 |               1 |               0 |               1 |
|               2 |               0 |               1 |               1 |               1 |
|               2 |               0 |               1 |               1 |               1 |
|               2 |               0 |               1 |               1 |               0 |
|               0 |               0 |               0 |               0 |               0 |
|               0 |               0 |               0 |               0 |               0 |
|               2 |               0 |               1 |               2 |               0 |
|               2 |               0 |               1 |               2 |               0 |
+-----------------+-----------------+-----------------+-----------------+-----------------+
##FIND_IN_SET##
SELECT FIND_IN_SET(C1,C2),FIND_IN_SET(C2,C3),FIND_IN_SET(C3,C4),FIND_IN_SET(C4,C5),FIND_IN_SET(C5,C6),FIND_IN_SET(C6,C7),FIND_IN_SET(C7,C1) FROM T1;
+--------------------+--------------------+--------------------+--------------------+--------------------+--------------------+--------------------+
| FIND_IN_SET(C1,C2) | FIND_IN_SET(C2,C3) | FIND_IN_SET(C3,C4) | FIND_IN_SET(C4,C5) | FIND_IN_SET(C5,C6) | FIND_IN_SET(C6,C7) | FIND_IN_SET(C7,C1) |
+--------------------+--------------------+--------------------+--------------------+--------------------+--------------------+--------------------+
|               NULL |               NULL |               NULL |               NULL |               NULL |               NULL |               NULL |
|                  0 |                  0 |                  1 |                  0 |                  0 |                  0 |                  1 |
|                  0 |                  0 |                  1 |                  0 |                  0 |                  0 |                  1 |
|                  0 |                  0 |                  1 |                  0 |                  0 |                  0 |                  1 |
|               NULL |               NULL |                  1 |                  0 |                  0 |                  0 |                  1 |
|               NULL |               NULL |                  1 |                  0 |                  0 |                  0 |                  1 |
|                  0 |                  0 |                  1 |                  0 |                  0 |                  0 |                  1 |
|               NULL |               NULL |               NULL |               NULL |               NULL |               NULL |               NULL |
|               NULL |               NULL |               NULL |               NULL |               NULL |               NULL |               NULL |
|               NULL |               NULL |                  1 |                  0 |               NULL |               NULL |                  1 |
|               NULL |               NULL |                  1 |                  0 |               NULL |               NULL |                  1 |
+--------------------+--------------------+--------------------+--------------------+--------------------+--------------------+--------------------+
##FORMAT##
SELECT FORMAT(C1,C2),FORMAT(C2,C3),FORMAT(C3,C4),FORMAT(C4,C5),FORMAT(C5,C6),FORMAT(C6,C7),FORMAT(C7,C1) FROM T1;
+---------------+---------------+--------------------------------------+--------------------------------------+---------------+---------------+--------------------------------------+
| FORMAT(C1,C2) | FORMAT(C2,C3) | FORMAT(C3,C4)                        | FORMAT(C4,C5)                        | FORMAT(C5,C6) | FORMAT(C6,C7) | FORMAT(C7,C1)                        |
+---------------+---------------+--------------------------------------+--------------------------------------+---------------+---------------+--------------------------------------+
| NULL          | NULL          | NULL                                 | NULL                                 | NULL          | NULL          | NULL                                 |
| 0             | 0             | 0                                    | 0                                    | 0             | 0             | 0                                    |
| 0             | 0             | 0                                    | 0                                    | 0             | 0             | 0                                    |
| 0             | 0             | 0                                    | 0                                    | 0             | 0             | 0                                    |
| NULL          | NULL          | 1.0                                  | 1.0                                  | 1.0           | 1.0           | 1.0                                  |
| NULL          | NULL          | -1                                   | -1                                   | -1            | -1            | -1                                   |
| 0             | 0             | 0                                    | 0                                    | 0             | 0             | 0                                    |
| NULL          | NULL          | NULL                                 | NULL                                 | NULL          | NULL          | NULL                                 |
| NULL          | NULL          | NULL                                 | NULL                                 | NULL          | NULL          | NULL                                 |
| NULL          | NULL          | 1,010.000000000000000000000000000000 | 1,010.000000000000000000000000000000 | NULL          | NULL          | 1,010.000000000000000000000000000000 |
| NULL          | NULL          | 5,461.000000000000000000000000000000 | 5,461.000000000000000000000000000000 | NULL          | NULL          | 5,461.000000000000000000000000000000 |
+---------------+---------------+--------------------------------------+--------------------------------------+---------------+---------------+--------------------------------------+
##HEX##
SELECT HEX(C1),HEX(C2),HEX(C3),HEX(C4),HEX(C5),HEX(C6),HEX(C7) FROM T1;
+------------------+---------+------------------+------------------+------------------+------------------+------------------+
| HEX(C1)          | HEX(C2) | HEX(C3)          | HEX(C4)          | HEX(C5)          | HEX(C6)          | HEX(C7)          |
+------------------+---------+------------------+------------------+------------------+------------------+------------------+
| NULL             | NULL    | NULL             | NULL             | NULL             | NULL             | NULL             |
| 0                | 0       | 0                | 0                | 0                | 0                | 0                |
| 0                | 0       | 0                | 0                | 0                | 0                | 0                |
| 0                | 0       | 0                | 0                | 0                | 0                | 0                |
| 1                | NULL    | 1                | 1                | 1                | 1                | 1                |
| FFFFFFFFFFFFFFFF | NULL    | FFFFFFFFFFFFFFFF | FFFFFFFFFFFFFFFF | FFFFFFFFFFFFFFFF | FFFFFFFFFFFFFFFF | FFFFFFFFFFFFFFFF |
| 0                | 0       | 0                | 0                | 0                | 0                | 0                |
| NULL             | NULL    | NULL             | FFFFFFFFFFFFFFFF | NULL             | NULL             | NULL             |
| NULL             | NULL    | NULL             | FFFFFFFFFFFFFFFF | NULL             | NULL             | NULL             |
| 3F2              | NULL    | 3F2              | 3F2              | 3F2              | NULL             | 3F2              |
| 1555             | NULL    | 1555             | 1555             | 1555             | NULL             | 1555             |
+------------------+---------+------------------+------------------+------------------+------------------+------------------+
##INSERT##
SELECT INSERT(C1,C2,C3,C4),INSERT(C2,C3,C4,C5),INSERT(C3,C4,C5,C6),INSERT(C4,C5,C6,C7),INSERT(C5,C6,C7,C1) FROM T1;
+---------------------+---------------------+---------------------+---------------------+-----------------------------------+
| INSERT(C1,C2,C3,C4) | INSERT(C2,C3,C4,C5) | INSERT(C3,C4,C5,C6) | INSERT(C4,C5,C6,C7) | INSERT(C5,C6,C7,C1)               |
+---------------------+---------------------+---------------------+---------------------+-----------------------------------+
| NULL                | NULL                | NULL                | NULL                | NULL                              |
| 0                   | 0.0000000000        | 0                   | 0                   | 0.000000000000000000000000000000  |
| 0                   | 0.1230000000        | 0                   | 0                   | 0.123000000000000000000000000000  |
| 0                   | 0.0000000000        | 0                   | 0                   | 0.000000000000000000000000000001  |
| NULL                | NULL                | 1.00                | 1                   | 1.000000000000000000000000000000  |
| NULL                | NULL                | -1                  | -1                  | -1.000000000000000000000000000000 |
| 0                   | -0.1000000000       | 0                   | 0                   | -0.100000000000000000000000000000 |
| NULL                | NULL                | NULL                | NULL                | NULL                              |
| NULL                | NULL                | NULL                | NULL                | NULL                              |
| NULL                | NULL                | NULL                | NULL                | NULL                              |
| NULL                | NULL                | NULL                | NULL                | NULL                              |
+---------------------+---------------------+---------------------+---------------------+-----------------------------------+
##INSTR##
SELECT INSTR(C1,C2),INSTR(C2,C3),INSTR(C3,C4),INSTR(C4,C5),INSTR(C5,C6),INSTR(C6,C7),INSTR(C7,C1) FROM T1;
+--------------+--------------+--------------+--------------+--------------+--------------+--------------+
| INSTR(C1,C2) | INSTR(C2,C3) | INSTR(C3,C4) | INSTR(C4,C5) | INSTR(C5,C6) | INSTR(C6,C7) | INSTR(C7,C1) |
+--------------+--------------+--------------+--------------+--------------+--------------+--------------+
|         NULL |         NULL |         NULL |         NULL |         NULL |         NULL |         NULL |
|            0 |            1 |            1 |            0 |            1 |            1 |            1 |
|            0 |            1 |            1 |            0 |            1 |            1 |            1 |
|            0 |            1 |            1 |            0 |            1 |            1 |            1 |
|         NULL |         NULL |            1 |            0 |            1 |            1 |            1 |
|         NULL |         NULL |            1 |            0 |            1 |            1 |            1 |
|            0 |            2 |            1 |            0 |            1 |            2 |            1 |
|         NULL |         NULL |         NULL |         NULL |         NULL |         NULL |         NULL |
|         NULL |         NULL |         NULL |         NULL |         NULL |         NULL |         NULL |
|         NULL |         NULL |            1 |            0 |         NULL |         NULL |            1 |
|         NULL |         NULL |            1 |            0 |         NULL |         NULL |            1 |
+--------------+--------------+--------------+--------------+--------------+--------------+--------------+
##INT2IP##
SELECT INT2IP(C1),INT2IP(C2),INT2IP(C3),INT2IP(C4),INT2IP(C5),INT2IP(C6),INT2IP(C7) FROM T1;
+------------+------------+------------+------------+------------+------------+------------+
| INT2IP(C1) | INT2IP(C2) | INT2IP(C3) | INT2IP(C4) | INT2IP(C5) | INT2IP(C6) | INT2IP(C7) |
+------------+------------+------------+------------+------------+------------+------------+
| NULL       | NULL       | NULL       | NULL       | NULL       | NULL       | NULL       |
| 0.0.0.0    | 0.0.0.0    | 0.0.0.0    | 0.0.0.0    | 0.0.0.0    | 0.0.0.0    | 0.0.0.0    |
| 0.0.0.0    | 0.0.0.0    | 0.0.0.0    | 0.0.0.0    | 0.0.0.0    | 0.0.0.0    | 0.0.0.0    |
| 0.0.0.0    | 0.0.0.0    | 0.0.0.0    | 0.0.0.0    | 0.0.0.0    | 0.0.0.0    | 0.0.0.0    |
| 0.0.0.1    | NULL       | 0.0.0.1    | 0.0.0.1    | 0.0.0.1    | 0.0.0.1    | 0.0.0.1    |
| NULL       | NULL       | NULL       | NULL       | NULL       | NULL       | NULL       |
| 0.0.0.0    | 0.0.0.0    | 0.0.0.0    | 0.0.0.0    | 0.0.0.0    | 0.0.0.0    | 0.0.0.0    |
| NULL       | NULL       | NULL       | NULL       | NULL       | NULL       | NULL       |
| NULL       | NULL       | NULL       | NULL       | NULL       | NULL       | NULL       |
| 0.0.3.242  | NULL       | 0.0.3.242  | 0.0.3.242  | 0.0.3.242  | NULL       | 0.0.3.242  |
| 0.0.21.85  | NULL       | 0.0.21.85  | 0.0.21.85  | 0.0.21.85  | NULL       | 0.0.21.85  |
+------------+------------+------------+------------+------------+------------+------------+
##IP2INT##
SELECT IP2INT(C1),IP2INT(C2),IP2INT(C3),IP2INT(C4),IP2INT(C5),IP2INT(C6),IP2INT(C7) FROM T1;
+------------+------------+------------+------------+------------+------------+------------+
| IP2INT(C1) | IP2INT(C2) | IP2INT(C3) | IP2INT(C4) | IP2INT(C5) | IP2INT(C6) | IP2INT(C7) |
+------------+------------+------------+------------+------------+------------+------------+
|       NULL |       NULL |       NULL |       NULL |       NULL |       NULL |       NULL |
|       NULL |       NULL |       NULL |       NULL |       NULL |       NULL |       NULL |
|       NULL |       NULL |       NULL |       NULL |       NULL |       NULL |       NULL |
|       NULL |       NULL |       NULL |       NULL |       NULL |       NULL |       NULL |
|       NULL |       NULL |       NULL |       NULL |       NULL |       NULL |       NULL |
|       NULL |       NULL |       NULL |       NULL |       NULL |       NULL |       NULL |
|       NULL |       NULL |       NULL |       NULL |       NULL |       NULL |       NULL |
|       NULL |       NULL |       NULL |       NULL |       NULL |       NULL |       NULL |
|       NULL |       NULL |       NULL |       NULL |       NULL |       NULL |       NULL |
|       NULL |       NULL |       NULL |       NULL |       NULL |       NULL |       NULL |
|       NULL |       NULL |       NULL |       NULL |       NULL |       NULL |       NULL |
+------------+------------+------------+------------+------------+------------+------------+
##LCASE##
SELECT LCASE(C1),LCASE(C2),LCASE(C3),LCASE(C4),LCASE(C5),LCASE(C6),LCASE(C7) FROM T1;
+-----------+---------------+-----------+--------------------------------------------------------------------+-------------------------------------+-----------+-----------+
| LCASE(C1) | LCASE(C2)     | LCASE(C3) | LCASE(C4)                                                          | LCASE(C5)                           | LCASE(C6) | LCASE(C7) |
+-----------+---------------+-----------+--------------------------------------------------------------------+-------------------------------------+-----------+-----------+
| NULL      | NULL          | NULL      | NULL                                                               | NULL                                | NULL      | NULL      |
| 0         | 0.0000000000  | 0         | 0                                                                  | 0.000000000000000000000000000000    | 0.00      | 0         |
| 0         | 0.1230000000  | 0         | 0                                                                  | 0.123000000000000000000000000000    | 0.12      | 0         |
| 0         | 0.0000000000  | 0         | 0                                                                  | 0.000000000000000000000000000001    | 0.00      | 0         |
| 1         | NULL          | 1         | 1                                                                  | 1.000000000000000000000000000000    | 1.00      | 1         |
| -1        | NULL          | -1        | -1                                                                 | -1.000000000000000000000000000000   | -1.00     | -1        |
| 0         | -0.1000000000 | 0         | 0                                                                  | -0.100000000000000000000000000000   | -0.10     | 0         |
| NULL      | NULL          | NULL      | 10000000000000000000000000000000000000000000000000000000000000000  | NULL                                | NULL      | NULL      |
| NULL      | NULL          | NULL      | -10000000000000000000000000000000000000000000000000000000000000000 | NULL                                | NULL      | NULL      |
| 1010      | NULL          | 1010      | 1010                                                               | 1010.000000000000000000000000000000 | NULL      | 1010      |
| 5461      | NULL          | 5461      | 5461                                                               | 5461.000000000000000000000000000000 | NULL      | 5461      |
+-----------+---------------+-----------+--------------------------------------------------------------------+-------------------------------------+-----------+-----------+
##LEFT##
SELECT LEFT(C1,C2),LEFT(C2,C3),LEFT(C3,C4),LEFT(C4,C5),LEFT(C5,C6),LEFT(C6,C7),LEFT(C7,C1) FROM T1;
+-------------+-------------+-------------+-------------+-------------+-------------+-------------+
| LEFT(C1,C2) | LEFT(C2,C3) | LEFT(C3,C4) | LEFT(C4,C5) | LEFT(C5,C6) | LEFT(C6,C7) | LEFT(C7,C1) |
+-------------+-------------+-------------+-------------+-------------+-------------+-------------+
| NULL        | NULL        | NULL        | NULL        | NULL        | NULL        | NULL        |
|             |             |             |             |             |             |             |
|             |             |             |             |             |             |             |
|             |             |             |             |             |             |             |
| NULL        | NULL        | 1           | 1           | 1           | 1           | 1           |
| NULL        | NULL        |             |             |             |             |             |
|             |             |             |             |             |             |             |
| NULL        | NULL        | NULL        | NULL        | NULL        | NULL        | NULL        |
| NULL        | NULL        | NULL        | NULL        | NULL        | NULL        | NULL        |
| NULL        | NULL        | 1010        | 1010        | NULL        | NULL        | 1010        |
| NULL        | NULL        | 5461        | 5461        | NULL        | NULL        | 5461        |
+-------------+-------------+-------------+-------------+-------------+-------------+-------------+
##LENGTH##
SELECT LENGTH(C1),LENGTH(C2),LENGTH(C3),LENGTH(C4),LENGTH(C5),LENGTH(C6),LENGTH(C7) FROM T1;
+------------+------------+------------+------------+------------+------------+------------+
| LENGTH(C1) | LENGTH(C2) | LENGTH(C3) | LENGTH(C4) | LENGTH(C5) | LENGTH(C6) | LENGTH(C7) |
+------------+------------+------------+------------+------------+------------+------------+
|       NULL |       NULL |       NULL |       NULL |       NULL |       NULL |       NULL |
|          1 |         12 |          1 |          1 |         32 |          4 |          1 |
|          1 |         12 |          1 |          1 |         32 |          4 |          1 |
|          1 |         12 |          1 |          1 |         32 |          4 |          1 |
|          1 |       NULL |          1 |          1 |         32 |          4 |          1 |
|          2 |       NULL |          2 |          2 |         33 |          5 |          2 |
|          1 |         13 |          1 |          1 |         33 |          5 |          1 |
|       NULL |       NULL |       NULL |         65 |       NULL |       NULL |       NULL |
|       NULL |       NULL |       NULL |         66 |       NULL |       NULL |       NULL |
|          4 |       NULL |          4 |          4 |         35 |       NULL |          4 |
|          4 |       NULL |          4 |          4 |         35 |       NULL |          4 |
+------------+------------+------------+------------+------------+------------+------------+
##LOCATE##
SELECT LOCATE(C1,C2),LOCATE(C2,C3,C4),LOCATE(C3,C4),LOCATE(C4,C5,C6),LOCATE(C5,C6),LOCATE(C6,C7,C1),LOCATE(C7,C1) FROM T1;
+---------------+------------------+---------------+------------------+---------------+------------------+---------------+
| LOCATE(C1,C2) | LOCATE(C2,C3,C4) | LOCATE(C3,C4) | LOCATE(C4,C5,C6) | LOCATE(C5,C6) | LOCATE(C6,C7,C1) | LOCATE(C7,C1) |
+---------------+------------------+---------------+------------------+---------------+------------------+---------------+
|          NULL |             NULL |          NULL |             NULL |          NULL |             NULL |          NULL |
|             1 |                0 |             1 |                0 |             0 |                0 |             1 |
|             1 |                0 |             1 |                0 |             0 |                0 |             1 |
|             1 |                0 |             1 |                0 |             0 |                0 |             1 |
|          NULL |             NULL |             1 |                1 |             0 |                0 |             1 |
|          NULL |             NULL |             1 |                0 |             0 |                0 |             1 |
|             2 |                0 |             1 |                0 |             0 |                0 |             1 |
|          NULL |             NULL |          NULL |             NULL |          NULL |             NULL |          NULL |
|          NULL |             NULL |          NULL |             NULL |          NULL |             NULL |          NULL |
|          NULL |             NULL |             1 |                0 |          NULL |             NULL |             1 |
|          NULL |             NULL |             1 |                0 |          NULL |             NULL |             1 |
+---------------+------------------+---------------+------------------+---------------+------------------+---------------+
##LOWER##
SELECT LOWER(C1),LOWER(C2),LOWER(C3),LOWER(C4),LOWER(C5),LOWER(C6),LOWER(C7) FROM T1;
+-----------+---------------+-----------+--------------------------------------------------------------------+-------------------------------------+-----------+-----------+
| LOWER(C1) | LOWER(C2)     | LOWER(C3) | LOWER(C4)                                                          | LOWER(C5)                           | LOWER(C6) | LOWER(C7) |
+-----------+---------------+-----------+--------------------------------------------------------------------+-------------------------------------+-----------+-----------+
| NULL      | NULL          | NULL      | NULL                                                               | NULL                                | NULL      | NULL      |
| 0         | 0.0000000000  | 0         | 0                                                                  | 0.000000000000000000000000000000    | 0.00      | 0         |
| 0         | 0.1230000000  | 0         | 0                                                                  | 0.123000000000000000000000000000    | 0.12      | 0         |
| 0         | 0.0000000000  | 0         | 0                                                                  | 0.000000000000000000000000000001    | 0.00      | 0         |
| 1         | NULL          | 1         | 1                                                                  | 1.000000000000000000000000000000    | 1.00      | 1         |
| -1        | NULL          | -1        | -1                                                                 | -1.000000000000000000000000000000   | -1.00     | -1        |
| 0         | -0.1000000000 | 0         | 0                                                                  | -0.100000000000000000000000000000   | -0.10     | 0         |
| NULL      | NULL          | NULL      | 10000000000000000000000000000000000000000000000000000000000000000  | NULL                                | NULL      | NULL      |
| NULL      | NULL          | NULL      | -10000000000000000000000000000000000000000000000000000000000000000 | NULL                                | NULL      | NULL      |
| 1010      | NULL          | 1010      | 1010                                                               | 1010.000000000000000000000000000000 | NULL      | 1010      |
| 5461      | NULL          | 5461      | 5461                                                               | 5461.000000000000000000000000000000 | NULL      | 5461      |
+-----------+---------------+-----------+--------------------------------------------------------------------+-------------------------------------+-----------+-----------+
##LPAD##
SELECT LPAD(C1,C2,C3),LPAD(C2,C3,C4),LPAD(C3,C4,C5),LPAD(C5,C6,C7),LPAD(C6,C7,C1) FROM T1;
+----------------+----------------+---------------------------------------------------------------------------------------------------------------------------------------------------------------------------------------------------------------------------------------------------------------------------------------------------------------------------------------------------------------------------------------------------------------------------------------------------------------------------------------------------------------------------------------------------------------------------------------------------------------------------------------------------------------------------------------------------------------------------------------------------------------------------------------------------------------------------------------------------------------------------------------------------------------------------------------------------------------------------------------------------------------------------------------------------------------------------------------------------------------------------------------------------------------------------------------------------------------------------------------------------------------------------------------------------------------------------------------------------------------------------------------------------------------------------------------------------------------------------------------------------------------------------------------------------------------------------------------------------------------------------------------------------------------------------------------------------------------------------------------------------------------------------------------------------------------------------------------------------------------------------------------------------------------------------------------------------------------------------------------------------------------------------------------------------------------------------------------------------------------------------------------------------------------------------------------------------------------------------------------------------------------------------------------------------------------------------------------------------------------------------------------------------------------------------------------------------------------------------------------------------------------------------------------------------------------------------------------------------------------------------------------------------------------------------------------------------------------------------------------------------------------------------------------------------------------------------------------------------------------------------------------------------------------------------------------------------------------------------------------------------------------------------------------------------------------------------------------------------------------------------------------------------------------------------------------------------------------------------------------------------------------------------------------------------------------------------------------------------------------------------------------------------------------------------------------------------------------------------------------------------------------------------------------------------------------------------------------------------------------------------------------------------------------------------------------------------------------------------------------------------------------------------------------------------------------------------------------------------------------------------------------------------------------------------------------------------------------------------------------------------------------------------------------------------------------------------------------------------------------------------------------------------------------------------------------------------------------------------------------------------------------------------------------------------------------------------------------------------------------------------------------------------------------------------------------------------------------------------------------------------------------------------------------------------------------------------------------------------------------------------------------------------------------------------------------------------------------------------------------------------------------------------------------------------------------------------------------------------------------------------------------------------------------------------------------------------------------------------------------------------------------------------------------------------------------------------------------------------------------------------------------------------------------------------------------------------------------------------------------------------------------------------------------------------------------------------------------------------------------------------------------------------------------------------------------------------------------------------------------------------------------------------------------------------------------------------------------------------------------------------------------------------------------------------------------+----------------+----------------+
| LPAD(C1,C2,C3) | LPAD(C2,C3,C4) | LPAD(C3,C4,C5)                                                                                                                                                                                                                                                                                                                                                                                                                                                                                                                                                                                                                                                                                                                                                                                                                                                                                                                                                                                                                                                   | LPAD(C5,C6,C7) | LPAD(C6,C7,C1) |
+----------------+----------------+---------------------------------------------------------------------------------------------------------------------------------------------------------------------------------------------------------------------------------------------------------------------------------------------------------------------------------------------------------------------------------------------------------------------------------------------------------------------------------------------------------------------------------------------------------------------------------------------------------------------------------------------------------------------------------------------------------------------------------------------------------------------------------------------------------------------------------------------------------------------------------------------------------------------------------------------------------------------------------------------------------------------------------------------------------------------------------------------------------------------------------------------------------------------------------------------------------------------------------------------------------------------------------------------------------------------------------------------------------------------------------------------------------------------------------------------------------------------------------------------------------------------------------------------------------------------------------------------------------------------------------------------------------------------------------------------------------------------------------------------------------------------------------------------------------------------------------------------------------------------------------------------------------------------------------------------------------------------------------------------------------------------------------------------------------------------------------------------------------------------------------------------------------------------------------------------------------------------------------------------------------------------------------------------------------------------------------------------------------------------------------------------------------------------------------------------------------------------------------------------------------------------------------------------------------------------------------------------------------------------------------------------------------------------------------------------------------------------------------------------------------------------------------------------------------------------------------------------------------------------------------------------------------------------------------------------------------------------------------------------------------------------------------------------------------------------------------------------------------------------------------------------------------------------------------------------------------------------------------------------------------------------------------------------------------------------------------------------------------------------------------------------------------------------------------------------------------------------------------------------------------------------------------------------------------------------------------------------------------------------------------------------------------------------------------------------------------------------------------------------------------------------------------------------------------------------------------------------------------------------------------------------------------------------------------------------------------------------------------------------------------------------------------------------------------------------------------------------------------------------------------------------------------------------------------------------------------------------------------------------------------------------------------------------------------------------------------------------------------------------------------------------------------------------------------------------------------------------------------------------------------------------------------------------------------------------------------------------------------------------------------------------------------------------------------------------------------------------------------------------------------------------------------------------------------------------------------------------------------------------------------------------------------------------------------------------------------------------------------------------------------------------------------------------------------------------------------------------------------------------------------------------------------------------------------------------------------------------------------------------------------------------------------------------------------------------------------------------------------------------------------------------------------------------------------------------------------------------------------------------------------------------------------------------------------------------------------------------------------------------------------------------------------------------------------------+----------------+----------------+
| NULL           | NULL           | NULL                                                                                                                                                                                                                                                                                                                                                                                                                                                                                                                                                                                                                                                                                                                                                                                                                                                                                                                                                                                                                                                             | NULL           | NULL           |
|                |                |                                                                                                                                                                                                                                                                                                                                                                                                                                                                                                                                                                                                                                                                                                                                                                                                                                                                                                                                                                                                                                                                  |                |                |
|                |                |                                                                                                                                                                                                                                                                                                                                                                                                                                                                                                                                                                                                                                                                                                                                                                                                                                                                                                                                                                                                                                                                  |                |                |
|                |                |                                                                                                                                                                                                                                                                                                                                                                                                                                                                                                                                                                                                                                                                                                                                                                                                                                                                                                                                                                                                                                                                  |                |                |
| NULL           | NULL           | 1                                                                                                                                                                                                                                                                                                                                                                                                                                                                                                                                                                                                                                                                                                                                                                                                                                                                                                                                                                                                                                                                | 1              | 1              |
| NULL           | NULL           | NULL                                                                                                                                                                                                                                                                                                                                                                                                                                                                                                                                                                                                                                                                                                                                                                                                                                                                                                                                                                                                                                                             | NULL           | NULL           |
|                |                |                                                                                                                                                                                                                                                                                                                                                                                                                                                                                                                                                                                                                                                                                                                                                                                                                                                                                                                                                                                                                                                                  |                |                |
| NULL           | NULL           | NULL                                                                                                                                                                                                                                                                                                                                                                                                                                                                                                                                                                                                                                                                                                                                                                                                                                                                                                                                                                                                                                                             | NULL           | NULL           |
| NULL           | NULL           | NULL                                                                                                                                                                                                                                                                                                                                                                                                                                                                                                                                                                                                                                                                                                                                                                                                                                                                                                                                                                                                                                                             | NULL           | NULL           |
| NULL           | NULL           | 1010.0000000000000000000000000000001010.0000000000000000000000000000001010.0000000000000000000000000000001010.0000000000000000000000000000001010.0000000000000000000000000000001010.0000000000000000000000000000001010.0000000000000000000000000000001010.0000000000000000000000000000001010.0000000000000000000000000000001010.0000000000000000000000000000001010.0000000000000000000000000000001010.0000000000000000000000000000001010.0000000000000000000000000000001010.0000000000000000000000000000001010.0000000000000000000000000000001010.0000000000000000000000000000001010.0000000000000000000000000000001010.0000000000000000000000000000001010.0000000000000000000000000000001010.0000000000000000000000000000001010.0000000000000000000000000000001010.0000000000000000000000000000001010.0000000000000000000000000000001010.0000000000000000000000000000001010.0000000000000000000000000000001010.0000000000000000000000000000001010.0000000000000000000000000000001010.0000000000000000000000000000001010.0000000000000000000001010               | NULL           | NULL           |
| NULL           | NULL           | 5461.0000000000000000000000000000005461.0000000000000000000000000000005461.0000000000000000000000000000005461.0000000000000000000000000000005461.0000000000000000000000000000005461.0000000000000000000000000000005461.0000000000000000000000000000005461.0000000000000000000000000000005461.0000000000000000000000000000005461.0000000000000000000000000000005461.0000000000000000000000000000005461.0000000000000000000000000000005461.0000000000000000000000000000005461.0000000000000000000000000000005461.0000000000000000000000000000005461.0000000000000000000000000000005461.0000000000000000000000000000005461.0000000000000000000000000000005461.0000000000000000000000000000005461.0000000000000000000000000000005461.0000000000000000000000000000005461.0000000000000000000000000000005461.0000000000000000000000000000005461.0000000000000000000000000000005461.0000000000000000000000000000005461.0000000000000000000000000000005461.0000000000000000000000000000005461.0000000000000000000000000000005461.0000000000000000000000000000005461.0000000000000000000000000000005461.0000000000000000000000000000005461.0000000000000000000000000000005461.0000000000000000000000000000005461.0000000000000000000000000000005461.0000000000000000000000000000005461.0000000000000000000000000000005461.0000000000000000000000000000005461.0000000000000000000000000000005461.0000000000000000000000000000005461.0000000000000000000000000000005461.0000000000000000000000000000005461.0000000000000000000000000000005461.0000000000000000000000000000005461.0000000000000000000000000000005461.0000000000000000000000000000005461.0000000000000000000000000000005461.0000000000000000000000000000005461.0000000000000000000000000000005461.0000000000000000000000000000005461.0000000000000000000000000000005461.0000000000000000000000000000005461.0000000000000000000000000000005461.0000000000000000000000000000005461.0000000000000000000000000000005461.0000000000000000000000000000005461.0000000000000000000000000000005461.0000000000000000000000000000005461.0000000000000000000000000000005461.0000000000000000000000000000005461.0000000000000000000000000000005461.0000000000000000000000000000005461.0000000000000000000000000000005461.0000000000000000000000000000005461.0000000000000000000000000000005461.0000000000000000000000000000005461.0000000000000000000000000000005461.0000000000000000000000000000005461.0000000000000000000000000000005461.0000000000000000000000000000005461.0000000000000000000000000000005461.0000000000000000000000000000005461.0000000000000000000000000000005461.0000000000000000000000000000005461.0000000000000000000000000000005461.0000000000000000000000000000005461.0000000000000000000000000000005461.0000000000000000000000000000005461.0000000000000000000000000000005461.0000000000000000000000000000005461.0000000000000000000000000000005461.0000000000000000000000000000005461.0000000000000000000000000000005461.0000000000000000000000000000005461.0000000000000000000000000000005461.0000000000000000000000000000005461.0000000000000000000000000000005461.0000000000000000000000000000005461.0000000000000000000000000000005461.0000000000000000000000000000005461.0000000000000000000000000000005461.0000000000000000000000000000005461.0000000000000000000000000000005461.0000000000000000000000000000005461.0000000000000000000000000000005461.0000000000000000000000000000005461.0000000000000000000000000000005461.0000000000000000000000000000005461.0000000000000000000000000000005461.0000000000000000000000000000005461.0000000000000000000000000000005461.0000000000000000000000000000005461.0000000000000000000000000000005461.0000000000000000000000000000005461.0000000000000000000000000000005461.0000000000000000000000000000005461.0000000000000000000000000000005461.0000000000000000000000000000005461.0000000000000000000000000000005461.0000000000000000000000000000005461.0000000000000000000000000000005461.0000000000000000000000000000005461.0000000000000000000000000000005461.0000000000000000000000000000005461.0000000000000000000000000000005461.0000000000000000000000000000005461.0000000000000000000000000000005461.0000000000000000000000000000005461.0000000000000000000000000000005461.0000000000000000000000000000005461.0000000000000000000000000000005461.0000000000000000000000000000005461.0000000000000000000000000000005461.0000000000000000000000000000005461.0000000000000000000000000000005461.0000000000000000000000000000005461.0000000000000000000000000000005461.0000000000000000000000000000005461.0000000000000000000000000000005461.0000000000000000000000000000005461.0000000000000000000000000000005461.0000000000000000000000000000005461.0000000000000000000000000000005461.0000000000000000000000000000005461.0000000000000000000000000000005461.0000000000000000000000000000005461.0000000000000000000000000000005461.0000000000000000000000000000005461.0000000000000000000000000000005461.0000000000000000000000000000005461.0000000000000000000000000000005461.0000000000000000000000000000005461.0000000000000000000000000000005461.0000000000000000000000000000005461.0000000000000000000000000000005461.0000000000000000000000000000005461.0000000000000000000000000000005461.0000000000000000000000000000005461.0000000000000000000000000000005461.0000000000000000000000000000005461.0000000000000000000000000000005461.0000000000000000000000000000005461.0000000000000000000000000000005461.0000000000000000000000000000005461.0000000000000000000000000000005461.0000000000000000000000000000005461.0000000000000000000000000005461 | NULL           | NULL           |
+----------------+----------------+---------------------------------------------------------------------------------------------------------------------------------------------------------------------------------------------------------------------------------------------------------------------------------------------------------------------------------------------------------------------------------------------------------------------------------------------------------------------------------------------------------------------------------------------------------------------------------------------------------------------------------------------------------------------------------------------------------------------------------------------------------------------------------------------------------------------------------------------------------------------------------------------------------------------------------------------------------------------------------------------------------------------------------------------------------------------------------------------------------------------------------------------------------------------------------------------------------------------------------------------------------------------------------------------------------------------------------------------------------------------------------------------------------------------------------------------------------------------------------------------------------------------------------------------------------------------------------------------------------------------------------------------------------------------------------------------------------------------------------------------------------------------------------------------------------------------------------------------------------------------------------------------------------------------------------------------------------------------------------------------------------------------------------------------------------------------------------------------------------------------------------------------------------------------------------------------------------------------------------------------------------------------------------------------------------------------------------------------------------------------------------------------------------------------------------------------------------------------------------------------------------------------------------------------------------------------------------------------------------------------------------------------------------------------------------------------------------------------------------------------------------------------------------------------------------------------------------------------------------------------------------------------------------------------------------------------------------------------------------------------------------------------------------------------------------------------------------------------------------------------------------------------------------------------------------------------------------------------------------------------------------------------------------------------------------------------------------------------------------------------------------------------------------------------------------------------------------------------------------------------------------------------------------------------------------------------------------------------------------------------------------------------------------------------------------------------------------------------------------------------------------------------------------------------------------------------------------------------------------------------------------------------------------------------------------------------------------------------------------------------------------------------------------------------------------------------------------------------------------------------------------------------------------------------------------------------------------------------------------------------------------------------------------------------------------------------------------------------------------------------------------------------------------------------------------------------------------------------------------------------------------------------------------------------------------------------------------------------------------------------------------------------------------------------------------------------------------------------------------------------------------------------------------------------------------------------------------------------------------------------------------------------------------------------------------------------------------------------------------------------------------------------------------------------------------------------------------------------------------------------------------------------------------------------------------------------------------------------------------------------------------------------------------------------------------------------------------------------------------------------------------------------------------------------------------------------------------------------------------------------------------------------------------------------------------------------------------------------------------------------------------------------------------------------------------------+----------------+----------------+
##LTRIM##
SELECT LTRIM(C1),LTRIM(C2),LTRIM(C3),LTRIM(C4),LTRIM(C5),LTRIM(C6),LTRIM(C7) FROM T1;
+-----------+---------------+-----------+--------------------------------------------------------------------+-------------------------------------+-----------+-----------+
| LTRIM(C1) | LTRIM(C2)     | LTRIM(C3) | LTRIM(C4)                                                          | LTRIM(C5)                           | LTRIM(C6) | LTRIM(C7) |
+-----------+---------------+-----------+--------------------------------------------------------------------+-------------------------------------+-----------+-----------+
| NULL      | NULL          | NULL      | NULL                                                               | NULL                                | NULL      | NULL      |
| 0         | 0.0000000000  | 0         | 0                                                                  | 0.000000000000000000000000000000    | 0.00      | 0         |
| 0         | 0.1230000000  | 0         | 0                                                                  | 0.123000000000000000000000000000    | 0.12      | 0         |
| 0         | 0.0000000000  | 0         | 0                                                                  | 0.000000000000000000000000000001    | 0.00      | 0         |
| 1         | NULL          | 1         | 1                                                                  | 1.000000000000000000000000000000    | 1.00      | 1         |
| -1        | NULL          | -1        | -1                                                                 | -1.000000000000000000000000000000   | -1.00     | -1        |
| 0         | -0.1000000000 | 0         | 0                                                                  | -0.100000000000000000000000000000   | -0.10     | 0         |
| NULL      | NULL          | NULL      | 10000000000000000000000000000000000000000000000000000000000000000  | NULL                                | NULL      | NULL      |
| NULL      | NULL          | NULL      | -10000000000000000000000000000000000000000000000000000000000000000 | NULL                                | NULL      | NULL      |
| 1010      | NULL          | 1010      | 1010                                                               | 1010.000000000000000000000000000000 | NULL      | 1010      |
| 5461      | NULL          | 5461      | 5461                                                               | 5461.000000000000000000000000000000 | NULL      | 5461      |
+-----------+---------------+-----------+--------------------------------------------------------------------+-------------------------------------+-----------+-----------+
##MAKE_SET##
SELECT MAKE_SET(C1,C2,C3),MAKE_SET(C2,C3,C4),MAKE_SET(C3,C4,C5),MAKE_SET(C5,C6,C7),MAKE_SET(C6,C7,C1) FROM T1;
+--------------------+--------------------+--------------------------------------+--------------------+--------------------+
| MAKE_SET(C1,C2,C3) | MAKE_SET(C2,C3,C4) | MAKE_SET(C3,C4,C5)                   | MAKE_SET(C5,C6,C7) | MAKE_SET(C6,C7,C1) |
+--------------------+--------------------+--------------------------------------+--------------------+--------------------+
| NULL               | NULL               | NULL                                 | NULL               | NULL               |
|                    |                    |                                      |                    |                    |
|                    |                    |                                      |                    |                    |
|                    |                    |                                      |                    |                    |
|                    | NULL               | 1                                    | 1.00               | 1                  |
| -1                 | NULL               | -1,-1.000000000000000000000000000000 | -1.00,-1           | -1,-1              |
|                    |                    |                                      |                    |                    |
| NULL               | NULL               | NULL                                 | NULL               | NULL               |
| NULL               | NULL               | NULL                                 | NULL               | NULL               |
| 1010               | NULL               | 1010.000000000000000000000000000000  | 1010               | NULL               |
|                    | NULL               | 5461                                 |                    | NULL               |
+--------------------+--------------------+--------------------------------------+--------------------+--------------------+
##MID##
SELECT MID(C1,C2),MID(C2,C3),MID(C3,C4),MID(C4,C5),MID(C5,C6),MID(C6,C7),MID(C7,C1) FROM T1;
+------------+------------+------------+------------+----------------------------------+------------+------------+
| MID(C1,C2) | MID(C2,C3) | MID(C3,C4) | MID(C4,C5) | MID(C5,C6)                       | MID(C6,C7) | MID(C7,C1) |
+------------+------------+------------+------------+----------------------------------+------------+------------+
| NULL       | NULL       | NULL       | NULL       | NULL                             | NULL       | NULL       |
|            |            |            |            |                                  |            |            |
|            |            |            |            |                                  |            |            |
|            |            |            |            |                                  |            |            |
| NULL       | NULL       | 1          | 1          | 1.000000000000000000000000000000 | 1.00       | 1          |
| NULL       | NULL       | 1          | 1          | 0                                | 0          | 1          |
|            |            |            |            |                                  |            |            |
| NULL       | NULL       | NULL       | NULL       | NULL                             | NULL       | NULL       |
| NULL       | NULL       | NULL       | NULL       | NULL                             | NULL       | NULL       |
| NULL       | NULL       |            |            | NULL                             | NULL       |            |
| NULL       | NULL       |            |            | NULL                             | NULL       |            |
+------------+------------+------------+------------+----------------------------------+------------+------------+
##OCT##
SELECT OCT(C1),OCT(C2),OCT(C3),OCT(C4),OCT(C5),OCT(C6),OCT(C7) FROM T1;
+------------------------+---------+------------------------+------------------------+------------------------+------------------------+------------------------+
| OCT(C1)                | OCT(C2) | OCT(C3)                | OCT(C4)                | OCT(C5)                | OCT(C6)                | OCT(C7)                |
+------------------------+---------+------------------------+------------------------+------------------------+------------------------+------------------------+
| NULL                   | NULL    | NULL                   | NULL                   | NULL                   | NULL                   | NULL                   |
| 0                      | 0       | 0                      | 0                      | 0                      | 0                      | 0                      |
| 0                      | 0       | 0                      | 0                      | 0                      | 0                      | 0                      |
| 0                      | 0       | 0                      | 0                      | 0                      | 0                      | 0                      |
| 1                      | NULL    | 1                      | 1                      | 1                      | 1                      | 1                      |
| 1777777777777777777777 | NULL    | 1777777777777777777777 | 1777777777777777777777 | 1777777777777777777777 | 1777777777777777777777 | 1777777777777777777777 |
| 0                      | 0       | 0                      | 0                      | 0                      | 0                      | 0                      |
| NULL                   | NULL    | NULL                   | 1777777777777777777777 | NULL                   | NULL                   | NULL                   |
| NULL                   | NULL    | NULL                   | 1777777777777777777777 | NULL                   | NULL                   | NULL                   |
| 1762                   | NULL    | 1762                   | 1762                   | 1762                   | NULL                   | 1762                   |
| 12525                  | NULL    | 12525                  | 12525                  | 12525                  | NULL                   | 12525                  |
+------------------------+---------+------------------------+------------------------+------------------------+------------------------+------------------------+
##OCTET_LENGTH##
SELECT OCTET_LENGTH(C1),OCTET_LENGTH(C2),OCTET_LENGTH(C3),OCTET_LENGTH(C4),OCTET_LENGTH(C5),OCTET_LENGTH(C6),OCTET_LENGTH(C7) FROM T1;
+------------------+------------------+------------------+------------------+------------------+------------------+------------------+
| OCTET_LENGTH(C1) | OCTET_LENGTH(C2) | OCTET_LENGTH(C3) | OCTET_LENGTH(C4) | OCTET_LENGTH(C5) | OCTET_LENGTH(C6) | OCTET_LENGTH(C7) |
+------------------+------------------+------------------+------------------+------------------+------------------+------------------+
|             NULL |             NULL |             NULL |             NULL |             NULL |             NULL |             NULL |
|                1 |               12 |                1 |                1 |               32 |                4 |                1 |
|                1 |               12 |                1 |                1 |               32 |                4 |                1 |
|                1 |               12 |                1 |                1 |               32 |                4 |                1 |
|                1 |             NULL |                1 |                1 |               32 |                4 |                1 |
|                2 |             NULL |                2 |                2 |               33 |                5 |                2 |
|                1 |               13 |                1 |                1 |               33 |                5 |                1 |
|             NULL |             NULL |             NULL |               65 |             NULL |             NULL |             NULL |
|             NULL |             NULL |             NULL |               66 |             NULL |             NULL |             NULL |
|                4 |             NULL |                4 |                4 |               35 |             NULL |                4 |
|                4 |             NULL |                4 |                4 |               35 |             NULL |                4 |
+------------------+------------------+------------------+------------------+------------------+------------------+------------------+
##ORD##
SELECT ORD(C1),ORD(C2),ORD(C3),ORD(C4),ORD(C5),ORD(C6),ORD(C7) FROM T1;
+---------+---------+---------+---------+---------+---------+---------+
| ORD(C1) | ORD(C2) | ORD(C3) | ORD(C4) | ORD(C5) | ORD(C6) | ORD(C7) |
+---------+---------+---------+---------+---------+---------+---------+
|    NULL |    NULL |    NULL |    NULL |    NULL |    NULL |    NULL |
|      48 |      48 |      48 |      48 |      48 |      48 |      48 |
|      48 |      48 |      48 |      48 |      48 |      48 |      48 |
|      48 |      48 |      48 |      48 |      48 |      48 |      48 |
|      49 |    NULL |      49 |      49 |      49 |      49 |      49 |
|      45 |    NULL |      45 |      45 |      45 |      45 |      45 |
|      48 |      45 |      48 |      48 |      45 |      45 |      48 |
|    NULL |    NULL |    NULL |      49 |    NULL |    NULL |    NULL |
|    NULL |    NULL |    NULL |      45 |    NULL |    NULL |    NULL |
|      49 |    NULL |      49 |      49 |      49 |    NULL |      49 |
|      53 |    NULL |      53 |      53 |      53 |    NULL |      53 |
+---------+---------+---------+---------+---------+---------+---------+
##POSITION##
SELECT POSITION(C1 IN C2),POSITION(C2 IN C3),POSITION(C3 IN C4),POSITION(C4 IN C5),POSITION(C5 IN C6),POSITION(C6 IN C7),POSITION(C7 IN C1) FROM T1;
+--------------------+--------------------+--------------------+--------------------+--------------------+--------------------+--------------------+
| POSITION(C1 IN C2) | POSITION(C2 IN C3) | POSITION(C3 IN C4) | POSITION(C4 IN C5) | POSITION(C5 IN C6) | POSITION(C6 IN C7) | POSITION(C7 IN C1) |
+--------------------+--------------------+--------------------+--------------------+--------------------+--------------------+--------------------+
|               NULL |               NULL |               NULL |               NULL |               NULL |               NULL |               NULL |
|                  1 |                  0 |                  1 |                  1 |                  0 |                  0 |                  1 |
|                  1 |                  0 |                  1 |                  1 |                  0 |                  0 |                  1 |
|                  1 |                  0 |                  1 |                  1 |                  0 |                  0 |                  1 |
|               NULL |               NULL |                  1 |                  1 |                  0 |                  0 |                  1 |
|               NULL |               NULL |                  1 |                  1 |                  0 |                  0 |                  1 |
|                  2 |                  0 |                  1 |                  2 |                  0 |                  0 |                  1 |
|               NULL |               NULL |               NULL |               NULL |               NULL |               NULL |               NULL |
|               NULL |               NULL |               NULL |               NULL |               NULL |               NULL |               NULL |
|               NULL |               NULL |                  1 |                  1 |               NULL |               NULL |                  1 |
|               NULL |               NULL |                  1 |                  1 |               NULL |               NULL |                  1 |
+--------------------+--------------------+--------------------+--------------------+--------------------+--------------------+--------------------+
##QUOTE##
SELECT QUOTE(C1),QUOTE(C2),QUOTE(C3),QUOTE(C4),QUOTE(C5),QUOTE(C6),QUOTE(C7) FROM T1;
+-----------+-----------------+-----------+----------------------------------------------------------------------+---------------------------------------+-----------+-----------+
| QUOTE(C1) | QUOTE(C2)       | QUOTE(C3) | QUOTE(C4)                                                            | QUOTE(C5)                             | QUOTE(C6) | QUOTE(C7) |
+-----------+-----------------+-----------+----------------------------------------------------------------------+---------------------------------------+-----------+-----------+
| NULL      | NULL            | NULL      | NULL                                                                 | NULL                                  | NULL      | NULL      |
| '0'       | '0.0000000000'  | '0'       | '0'                                                                  | '0.000000000000000000000000000000'    | '0.00'    | '0'       |
| '0'       | '0.1230000000'  | '0'       | '0'                                                                  | '0.123000000000000000000000000000'    | '0.12'    | '0'       |
| '0'       | '0.0000000000'  | '0'       | '0'                                                                  | '0.000000000000000000000000000001'    | '0.00'    | '0'       |
| '1'       | NULL            | '1'       | '1'                                                                  | '1.000000000000000000000000000000'    | '1.00'    | '1'       |
| '-1'      | NULL            | '-1'      | '-1'                                                                 | '-1.000000000000000000000000000000'   | '-1.00'   | '-1'      |
| '0'       | '-0.1000000000' | '0'       | '0'                                                                  | '-0.100000000000000000000000000000'   | '-0.10'   | '0'       |
| NULL      | NULL            | NULL      | '10000000000000000000000000000000000000000000000000000000000000000'  | NULL                                  | NULL      | NULL      |
| NULL      | NULL            | NULL      | '-10000000000000000000000000000000000000000000000000000000000000000' | NULL                                  | NULL      | NULL      |
| '1010'    | NULL            | '1010'    | '1010'                                                               | '1010.000000000000000000000000000000' | NULL      | '1010'    |
| '5461'    | NULL            | '5461'    | '5461'                                                               | '5461.000000000000000000000000000000' | NULL      | '5461'    |
+-----------+-----------------+-----------+----------------------------------------------------------------------+---------------------------------------+-----------+-----------+
##REGEXP,RLIKE##
SELECT C1 REGEXP C2,C2 RLIKE C3 FROM T1;
+--------------+-------------+
| C1 REGEXP C2 | C2 RLIKE C3 |
+--------------+-------------+
|         NULL |        NULL |
|            0 |           1 |
|            0 |           1 |
|            0 |           1 |
|         NULL |        NULL |
|         NULL |        NULL |
|            0 |           1 |
|         NULL |        NULL |
|         NULL |        NULL |
|         NULL |        NULL |
|         NULL |        NULL |
+--------------+-------------+
##REGEXP_INSTR##
SELECT REGEXP_INSTR(C1,C2),REGEXP_INSTR(C2,C3),REGEXP_INSTR(C3,C4),REGEXP_INSTR(C4,C5),REGEXP_INSTR(C5,C6),REGEXP_INSTR(C6,C7),REGEXP_INSTR(C7,C1) FROM T1;
+---------------------+---------------------+---------------------+---------------------+---------------------+---------------------+---------------------+
| REGEXP_INSTR(C1,C2) | REGEXP_INSTR(C2,C3) | REGEXP_INSTR(C3,C4) | REGEXP_INSTR(C4,C5) | REGEXP_INSTR(C5,C6) | REGEXP_INSTR(C6,C7) | REGEXP_INSTR(C7,C1) |
+---------------------+---------------------+---------------------+---------------------+---------------------+---------------------+---------------------+
|                NULL |                NULL |                NULL |                NULL |                NULL |                NULL |                NULL |
|                   0 |                   1 |                   1 |                   0 |                   1 |                   1 |                   1 |
|                   0 |                   1 |                   1 |                   0 |                   1 |                   1 |                   1 |
|                   0 |                   1 |                   1 |                   0 |                   1 |                   1 |                   1 |
|                NULL |                NULL |                   1 |                   0 |                   1 |                   1 |                   1 |
|                NULL |                NULL |                   1 |                   0 |                   1 |                   1 |                   1 |
|                   0 |                   2 |                   1 |                   0 |                   1 |                   2 |                   1 |
|                NULL |                NULL |                NULL |                NULL |                NULL |                NULL |                NULL |
|                NULL |                NULL |                NULL |                NULL |                NULL |                NULL |                NULL |
|                NULL |                NULL |                   1 |                   0 |                NULL |                NULL |                   1 |
|                NULL |                NULL |                   1 |                   0 |                NULL |                NULL |                   1 |
+---------------------+---------------------+---------------------+---------------------+---------------------+---------------------+---------------------+
##REGEXP_LIKE##
SELECT REGEXP_LIKE(C1,C2),REGEXP_LIKE(C2,C3),REGEXP_LIKE(C3,C4),REGEXP_LIKE(C4,C5),REGEXP_LIKE(C5,C6),REGEXP_LIKE(C6,C7),REGEXP_LIKE(C7,C1) FROM T1;
+--------------------+--------------------+--------------------+--------------------+--------------------+--------------------+--------------------+
| REGEXP_LIKE(C1,C2) | REGEXP_LIKE(C2,C3) | REGEXP_LIKE(C3,C4) | REGEXP_LIKE(C4,C5) | REGEXP_LIKE(C5,C6) | REGEXP_LIKE(C6,C7) | REGEXP_LIKE(C7,C1) |
+--------------------+--------------------+--------------------+--------------------+--------------------+--------------------+--------------------+
|               NULL |               NULL |               NULL |               NULL |               NULL |               NULL |               NULL |
|                  0 |                  1 |                  1 |                  0 |                  1 |                  1 |                  1 |
|                  0 |                  1 |                  1 |                  0 |                  1 |                  1 |                  1 |
|                  0 |                  1 |                  1 |                  0 |                  1 |                  1 |                  1 |
|               NULL |               NULL |                  1 |                  0 |                  1 |                  1 |                  1 |
|               NULL |               NULL |                  1 |                  0 |                  1 |                  1 |                  1 |
|                  0 |                  1 |                  1 |                  0 |                  1 |                  1 |                  1 |
|               NULL |               NULL |               NULL |               NULL |               NULL |               NULL |               NULL |
|               NULL |               NULL |               NULL |               NULL |               NULL |               NULL |               NULL |
|               NULL |               NULL |                  1 |                  0 |               NULL |               NULL |                  1 |
|               NULL |               NULL |                  1 |                  0 |               NULL |               NULL |                  1 |
+--------------------+--------------------+--------------------+--------------------+--------------------+--------------------+--------------------+
##REGEXP_REPLACE##
SELECT REGEXP_REPLACE(C1,C2),REGEXP_REPLACE(C2,C3),REGEXP_REPLACE(C3,C4),REGEXP_REPLACE(C4,C5),REGEXP_REPLACE(C5,C6),REGEXP_REPLACE(C6,C7),REGEXP_REPLACE(C7,C1) FROM T1;
+-----------------------+-----------------------+-----------------------+-----------------------+------------------------------+-----------------------+-----------------------+
| REGEXP_REPLACE(C1,C2) | REGEXP_REPLACE(C2,C3) | REGEXP_REPLACE(C3,C4) | REGEXP_REPLACE(C4,C5) | REGEXP_REPLACE(C5,C6)        | REGEXP_REPLACE(C6,C7) | REGEXP_REPLACE(C7,C1) |
+-----------------------+-----------------------+-----------------------+-----------------------+------------------------------+-----------------------+-----------------------+
| NULL                  | NULL                  | NULL                  | NULL                  | NULL                         | NULL                  | NULL                  |
| 0                     | .                     |                       | 0                     |                              | .                     |                       |
| 0                     | .123                  |                       | 0                     | 3000000000000000000000000000 | .12                   |                       |
| 0                     | .                     |                       | 0                     | 0001                         | .                     |                       |
| NULL                  | NULL                  |                       | 1                     | 0000000000000000000000000000 | .00                   |                       |
| NULL                  | NULL                  |                       | -1                    | 0000000000000000000000000000 | .00                   |                       |
| 0                     | -.1                   |                       | 0                     | 0000000000000000000000000000 | -.1                   |                       |
| NULL                  | NULL                  | NULL                  | NULL                  | NULL                         | NULL                  | NULL                  |
| NULL                  | NULL                  | NULL                  | NULL                  | NULL                         | NULL                  | NULL                  |
| NULL                  | NULL                  |                       | 1010                  | NULL                         | NULL                  |                       |
| NULL                  | NULL                  |                       | 5461                  | NULL                         | NULL                  |                       |
+-----------------------+-----------------------+-----------------------+-----------------------+------------------------------+-----------------------+-----------------------+
##REGEXP_SUBSTR##
SELECT REGEXP_SUBSTR(C1,C2),REGEXP_SUBSTR(C2,C3),REGEXP_SUBSTR(C3,C4),REGEXP_SUBSTR(C4,C5),REGEXP_SUBSTR(C5,C6),REGEXP_SUBSTR(C6,C7),REGEXP_SUBSTR(C7,C1) FROM T1;
+----------------------+----------------------+----------------------+----------------------+----------------------+----------------------+----------------------+
| REGEXP_SUBSTR(C1,C2) | REGEXP_SUBSTR(C2,C3) | REGEXP_SUBSTR(C3,C4) | REGEXP_SUBSTR(C4,C5) | REGEXP_SUBSTR(C5,C6) | REGEXP_SUBSTR(C6,C7) | REGEXP_SUBSTR(C7,C1) |
+----------------------+----------------------+----------------------+----------------------+----------------------+----------------------+----------------------+
| NULL                 | NULL                 | NULL                 | NULL                 | NULL                 | NULL                 | NULL                 |
| NULL                 | 0                    | 0                    | NULL                 | 0.00                 | 0                    | 0                    |
| NULL                 | 0                    | 0                    | NULL                 | 0.12                 | 0                    | 0                    |
| NULL                 | 0                    | 0                    | NULL                 | 0.00                 | 0                    | 0                    |
| NULL                 | NULL                 | 1                    | NULL                 | 1.00                 | 1                    | 1                    |
| NULL                 | NULL                 | -1                   | NULL                 | -1.00                | -1                   | -1                   |
| NULL                 | 0                    | 0                    | NULL                 | -0.10                | 0                    | 0                    |
| NULL                 | NULL                 | NULL                 | NULL                 | NULL                 | NULL                 | NULL                 |
| NULL                 | NULL                 | NULL                 | NULL                 | NULL                 | NULL                 | NULL                 |
| NULL                 | NULL                 | 1010                 | NULL                 | NULL                 | NULL                 | 1010                 |
| NULL                 | NULL                 | 5461                 | NULL                 | NULL                 | NULL                 | 5461                 |
+----------------------+----------------------+----------------------+----------------------+----------------------+----------------------+----------------------+
##REPEAT##
SELECT REPEAT(C1,C2),REPEAT(C2,C3),REPEAT(C5,C6),REPEAT(C6,C7),REPEAT(C7,C1) FROM T1 LIMIT 9;
+---------------+---------------+----------------------------------+---------------+---------------+
| REPEAT(C1,C2) | REPEAT(C2,C3) | REPEAT(C5,C6)                    | REPEAT(C6,C7) | REPEAT(C7,C1) |
+---------------+---------------+----------------------------------+---------------+---------------+
| NULL          | NULL          | NULL                             | NULL          | NULL          |
|               |               |                                  |               |               |
|               |               |                                  |               |               |
|               |               |                                  |               |               |
| NULL          | NULL          | 1.000000000000000000000000000000 | 1.00          | 1             |
| NULL          | NULL          |                                  |               |               |
|               |               |                                  |               |               |
| NULL          | NULL          | NULL                             | NULL          | NULL          |
| NULL          | NULL          | NULL                             | NULL          | NULL          |
+---------------+---------------+----------------------------------+---------------+---------------+
##REPLACE##
SELECT REPLACE(C1,C2,C3),REPLACE(C2,C3,C4),REPLACE(C3,C4,C5),REPLACE(C5,C6,C7),REPLACE(C6,C7,C1) FROM T1;
+-------------------+-------------------+-------------------------------------+--------------------------------+-------------------+
| REPLACE(C1,C2,C3) | REPLACE(C2,C3,C4) | REPLACE(C3,C4,C5)                   | REPLACE(C5,C6,C7)              | REPLACE(C6,C7,C1) |
+-------------------+-------------------+-------------------------------------+--------------------------------+-------------------+
| NULL              | NULL              | NULL                                | NULL                           | NULL              |
| 0                 | 0.0000000000      | 0.000000000000000000000000000000    | 00000000000000000000000000000  | 0.00              |
| 0                 | 0.1230000000      | 0.123000000000000000000000000000    | 03000000000000000000000000000  | 0.12              |
| 0                 | 0.0000000000      | 0.000000000000000000000000000001    | 00000000000000000000000000001  | 0.00              |
| NULL              | NULL              | 1.000000000000000000000000000000    | 10000000000000000000000000000  | 1.00              |
| NULL              | NULL              | -1.000000000000000000000000000000   | -10000000000000000000000000000 | -1.00             |
| 0                 | -0.1000000000     | -0.100000000000000000000000000000   | 00000000000000000000000000000  | -0.10             |
| NULL              | NULL              | NULL                                | NULL                           | NULL              |
| NULL              | NULL              | NULL                                | NULL                           | NULL              |
| NULL              | NULL              | 1010.000000000000000000000000000000 | NULL                           | NULL              |
| NULL              | NULL              | 5461.000000000000000000000000000000 | NULL                           | NULL              |
+-------------------+-------------------+-------------------------------------+--------------------------------+-------------------+
##REVERSE##
SELECT REVERSE(C1),REVERSE(C2),REVERSE(C3),REVERSE(C4),REVERSE(C5),REVERSE(C6),REVERSE(C7) FROM T1;
+-------------+---------------+-------------+--------------------------------------------------------------------+-------------------------------------+-------------+-------------+
| REVERSE(C1) | REVERSE(C2)   | REVERSE(C3) | REVERSE(C4)                                                        | REVERSE(C5)                         | REVERSE(C6) | REVERSE(C7) |
+-------------+---------------+-------------+--------------------------------------------------------------------+-------------------------------------+-------------+-------------+
| NULL        | NULL          | NULL        | NULL                                                               | NULL                                | NULL        | NULL        |
| 0           | 0000000000.0  | 0           | 0                                                                  | 000000000000000000000000000000.0    | 00.0        | 0           |
| 0           | 0000000321.0  | 0           | 0                                                                  | 000000000000000000000000000321.0    | 21.0        | 0           |
| 0           | 0000000000.0  | 0           | 0                                                                  | 100000000000000000000000000000.0    | 00.0        | 0           |
| 1           | NULL          | 1           | 1                                                                  | 000000000000000000000000000000.1    | 00.1        | 1           |
| 1-          | NULL          | 1-          | 1-                                                                 | 000000000000000000000000000000.1-   | 00.1-       | 1-          |
| 0           | 0000000001.0- | 0           | 0                                                                  | 000000000000000000000000000001.0-   | 01.0-       | 0           |
| NULL        | NULL          | NULL        | 00000000000000000000000000000000000000000000000000000000000000001  | NULL                                | NULL        | NULL        |
| NULL        | NULL          | NULL        | 00000000000000000000000000000000000000000000000000000000000000001- | NULL                                | NULL        | NULL        |
| 0101        | NULL          | 0101        | 0101                                                               | 000000000000000000000000000000.0101 | NULL        | 0101        |
| 1645        | NULL          | 1645        | 1645                                                               | 000000000000000000000000000000.1645 | NULL        | 1645        |
+-------------+---------------+-------------+--------------------------------------------------------------------+-------------------------------------+-------------+-------------+
##RIGHT##
SELECT RIGHT(C1,C2),RIGHT(C2,C3),RIGHT(C3,C4),RIGHT(C4,C5),RIGHT(C5,C6),RIGHT(C6,C7),RIGHT(C7,C1) FROM T1;
+--------------+--------------+--------------+--------------+--------------+--------------+--------------+
| RIGHT(C1,C2) | RIGHT(C2,C3) | RIGHT(C3,C4) | RIGHT(C4,C5) | RIGHT(C5,C6) | RIGHT(C6,C7) | RIGHT(C7,C1) |
+--------------+--------------+--------------+--------------+--------------+--------------+--------------+
| NULL         | NULL         | NULL         | NULL         | NULL         | NULL         | NULL         |
|              |              |              |              |              |              |              |
|              |              |              |              |              |              |              |
|              |              |              |              |              |              |              |
| NULL         | NULL         | 1            | 1            | 0            | 0            | 1            |
| NULL         | NULL         |              |              |              |              |              |
|              |              |              |              |              |              |              |
| NULL         | NULL         | NULL         | NULL         | NULL         | NULL         | NULL         |
| NULL         | NULL         | NULL         | NULL         | NULL         | NULL         | NULL         |
| NULL         | NULL         | 1010         | 1010         | NULL         | NULL         | 1010         |
| NULL         | NULL         | 5461         | 5461         | NULL         | NULL         | 5461         |
+--------------+--------------+--------------+--------------+--------------+--------------+--------------+
##RPAD##
SELECT RPAD(C1,C2,C3),RPAD(C2,C3,C4),RPAD(C3,C4,C5),RPAD(C5,C6,C7),RPAD(C6,C7,C1) FROM T1 LIMIT 10;
+----------------+----------------+----------------------------------------------------------------------------------------------------------------------------------------------------------------------------------------------------------------------------------------------------------------------------------------------------------------------------------------------------------------------------------------------------------------------------------------------------------------------------------------------------------------------------------------------------------------------------------------------------------------------------------------------------------------------------------------------------------------------------------------------------------------------------------------------------------------------------------------------------------------------------------------------------------------------------------------------------------------------------------------------------------------------------------------------------+----------------+----------------+
| RPAD(C1,C2,C3) | RPAD(C2,C3,C4) | RPAD(C3,C4,C5)                                                                                                                                                                                                                                                                                                                                                                                                                                                                                                                                                                                                                                                                                                                                                                                                                                                                                                                                                                                                                                     | RPAD(C5,C6,C7) | RPAD(C6,C7,C1) |
+----------------+----------------+----------------------------------------------------------------------------------------------------------------------------------------------------------------------------------------------------------------------------------------------------------------------------------------------------------------------------------------------------------------------------------------------------------------------------------------------------------------------------------------------------------------------------------------------------------------------------------------------------------------------------------------------------------------------------------------------------------------------------------------------------------------------------------------------------------------------------------------------------------------------------------------------------------------------------------------------------------------------------------------------------------------------------------------------------+----------------+----------------+
| NULL           | NULL           | NULL                                                                                                                                                                                                                                                                                                                                                                                                                                                                                                                                                                                                                                                                                                                                                                                                                                                                                                                                                                                                                                               | NULL           | NULL           |
|                |                |                                                                                                                                                                                                                                                                                                                                                                                                                                                                                                                                                                                                                                                                                                                                                                                                                                                                                                                                                                                                                                                    |                |                |
|                |                |                                                                                                                                                                                                                                                                                                                                                                                                                                                                                                                                                                                                                                                                                                                                                                                                                                                                                                                                                                                                                                                    |                |                |
|                |                |                                                                                                                                                                                                                                                                                                                                                                                                                                                                                                                                                                                                                                                                                                                                                                                                                                                                                                                                                                                                                                                    |                |                |
| NULL           | NULL           | 1                                                                                                                                                                                                                                                                                                                                                                                                                                                                                                                                                                                                                                                                                                                                                                                                                                                                                                                                                                                                                                                  | 1              | 1              |
| NULL           | NULL           | NULL                                                                                                                                                                                                                                                                                                                                                                                                                                                                                                                                                                                                                                                                                                                                                                                                                                                                                                                                                                                                                                               | NULL           | NULL           |
|                |                |                                                                                                                                                                                                                                                                                                                                                                                                                                                                                                                                                                                                                                                                                                                                                                                                                                                                                                                                                                                                                                                    |                |                |
| NULL           | NULL           | NULL                                                                                                                                                                                                                                                                                                                                                                                                                                                                                                                                                                                                                                                                                                                                                                                                                                                                                                                                                                                                                                               | NULL           | NULL           |
| NULL           | NULL           | NULL                                                                                                                                                                                                                                                                                                                                                                                                                                                                                                                                                                                                                                                                                                                                                                                                                                                                                                                                                                                                                                               | NULL           | NULL           |
| NULL           | NULL           | 10101010.0000000000000000000000000000001010.0000000000000000000000000000001010.0000000000000000000000000000001010.0000000000000000000000000000001010.0000000000000000000000000000001010.0000000000000000000000000000001010.0000000000000000000000000000001010.0000000000000000000000000000001010.0000000000000000000000000000001010.0000000000000000000000000000001010.0000000000000000000000000000001010.0000000000000000000000000000001010.0000000000000000000000000000001010.0000000000000000000000000000001010.0000000000000000000000000000001010.0000000000000000000000000000001010.0000000000000000000000000000001010.0000000000000000000000000000001010.0000000000000000000000000000001010.0000000000000000000000000000001010.0000000000000000000000000000001010.0000000000000000000000000000001010.0000000000000000000000000000001010.0000000000000000000000000000001010.0000000000000000000000000000001010.0000000000000000000000000000001010.0000000000000000000000000000001010.0000000000000000000000000000001010.000000000000000000000 | NULL           | NULL           |
+----------------+----------------+----------------------------------------------------------------------------------------------------------------------------------------------------------------------------------------------------------------------------------------------------------------------------------------------------------------------------------------------------------------------------------------------------------------------------------------------------------------------------------------------------------------------------------------------------------------------------------------------------------------------------------------------------------------------------------------------------------------------------------------------------------------------------------------------------------------------------------------------------------------------------------------------------------------------------------------------------------------------------------------------------------------------------------------------------+----------------+----------------+
##RTRIM##
SELECT RTRIM(C1),RTRIM(C2),RTRIM(C3),RTRIM(C4),RTRIM(C5),RTRIM(C6),RTRIM(C7) FROM T1;
+-----------+---------------+-----------+--------------------------------------------------------------------+-------------------------------------+-----------+-----------+
| RTRIM(C1) | RTRIM(C2)     | RTRIM(C3) | RTRIM(C4)                                                          | RTRIM(C5)                           | RTRIM(C6) | RTRIM(C7) |
+-----------+---------------+-----------+--------------------------------------------------------------------+-------------------------------------+-----------+-----------+
| NULL      | NULL          | NULL      | NULL                                                               | NULL                                | NULL      | NULL      |
| 0         | 0.0000000000  | 0         | 0                                                                  | 0.000000000000000000000000000000    | 0.00      | 0         |
| 0         | 0.1230000000  | 0         | 0                                                                  | 0.123000000000000000000000000000    | 0.12      | 0         |
| 0         | 0.0000000000  | 0         | 0                                                                  | 0.000000000000000000000000000001    | 0.00      | 0         |
| 1         | NULL          | 1         | 1                                                                  | 1.000000000000000000000000000000    | 1.00      | 1         |
| -1        | NULL          | -1        | -1                                                                 | -1.000000000000000000000000000000   | -1.00     | -1        |
| 0         | -0.1000000000 | 0         | 0                                                                  | -0.100000000000000000000000000000   | -0.10     | 0         |
| NULL      | NULL          | NULL      | 10000000000000000000000000000000000000000000000000000000000000000  | NULL                                | NULL      | NULL      |
| NULL      | NULL          | NULL      | -10000000000000000000000000000000000000000000000000000000000000000 | NULL                                | NULL      | NULL      |
| 1010      | NULL          | 1010      | 1010                                                               | 1010.000000000000000000000000000000 | NULL      | 1010      |
| 5461      | NULL          | 5461      | 5461                                                               | 5461.000000000000000000000000000000 | NULL      | 5461      |
+-----------+---------------+-----------+--------------------------------------------------------------------+-------------------------------------+-----------+-----------+
##SPACE##
SELECT SPACE(C1),SPACE(C2),SPACE(C3),SPACE(C5),SPACE(C6),SPACE(C7) FROM T1 LIMIT 9;
+-----------+-----------+-----------+-----------+-----------+-----------+
| SPACE(C1) | SPACE(C2) | SPACE(C3) | SPACE(C5) | SPACE(C6) | SPACE(C7) |
+-----------+-----------+-----------+-----------+-----------+-----------+
| NULL      | NULL      | NULL      | NULL      | NULL      | NULL      |
|           |           |           |           |           |           |
|           |           |           |           |           |           |
|           |           |           |           |           |           |
|           | NULL      |           |           |           |           |
|           | NULL      |           |           |           |           |
|           |           |           |           |           |           |
| NULL      | NULL      | NULL      | NULL      | NULL      | NULL      |
| NULL      | NULL      | NULL      | NULL      | NULL      | NULL      |
+-----------+-----------+-----------+-----------+-----------+-----------+
##STRCMP##
SELECT STRCMP(C1,C2),STRCMP(C2,C3),STRCMP(C3,C4),STRCMP(C4,C5),STRCMP(C5,C6),STRCMP(C6,C7),STRCMP(C7,C1) FROM T1;
+---------------+---------------+---------------+---------------+---------------+---------------+---------------+
| STRCMP(C1,C2) | STRCMP(C2,C3) | STRCMP(C3,C4) | STRCMP(C4,C5) | STRCMP(C5,C6) | STRCMP(C6,C7) | STRCMP(C7,C1) |
+---------------+---------------+---------------+---------------+---------------+---------------+---------------+
|          NULL |          NULL |          NULL |          NULL |          NULL |          NULL |          NULL |
|            -1 |             1 |             0 |            -1 |             1 |             1 |             0 |
|            -1 |             1 |             0 |            -1 |             1 |             1 |             0 |
|            -1 |             1 |             0 |            -1 |             1 |             1 |             0 |
|          NULL |          NULL |             0 |            -1 |             1 |             1 |             0 |
|          NULL |          NULL |             0 |            -1 |             1 |             1 |             0 |
|             1 |            -1 |             0 |             1 |             1 |            -1 |             0 |
|          NULL |          NULL |          NULL |          NULL |          NULL |          NULL |          NULL |
|          NULL |          NULL |          NULL |          NULL |          NULL |          NULL |          NULL |
|          NULL |          NULL |             0 |            -1 |          NULL |          NULL |             0 |
|          NULL |          NULL |             0 |            -1 |          NULL |          NULL |             0 |
+---------------+---------------+---------------+---------------+---------------+---------------+---------------+
##SUBSTR##
SELECT SUBSTR(C1,C2),SUBSTR(C2,C3,C4),SUBSTR(C3,C4),SUBSTR(C4,C5,C6),SUBSTR(C5,C6),SUBSTR(C6,C7,C1),SUBSTR(C7,C1) FROM T1;
+---------------+------------------+---------------+------------------+----------------------------------+------------------+---------------+
| SUBSTR(C1,C2) | SUBSTR(C2,C3,C4) | SUBSTR(C3,C4) | SUBSTR(C4,C5,C6) | SUBSTR(C5,C6)                    | SUBSTR(C6,C7,C1) | SUBSTR(C7,C1) |
+---------------+------------------+---------------+------------------+----------------------------------+------------------+---------------+
| NULL          | NULL             | NULL          | NULL             | NULL                             | NULL             | NULL          |
|               |                  |               |                  |                                  |                  |               |
|               |                  |               |                  |                                  |                  |               |
|               |                  |               |                  |                                  |                  |               |
| NULL          | NULL             | 1             | 1                | 1.000000000000000000000000000000 | 1                | 1             |
| NULL          | NULL             | 1             |                  | 0                                |                  | 1             |
|               |                  |               |                  |                                  |                  |               |
| NULL          | NULL             | NULL          | NULL             | NULL                             | NULL             | NULL          |
| NULL          | NULL             | NULL          | NULL             | NULL                             | NULL             | NULL          |
| NULL          | NULL             |               | NULL             | NULL                             | NULL             |               |
| NULL          | NULL             |               | NULL             | NULL                             | NULL             |               |
+---------------+------------------+---------------+------------------+----------------------------------+------------------+---------------+
##SUBSTRING##
SELECT SUBSTRING(C1,C2),SUBSTRING(C2,C3,C4),SUBSTRING(C3,C4),SUBSTRING(C4,C5,C6),SUBSTRING(C5,C6),SUBSTRING(C6,C7,C1),SUBSTRING(C7,C1) FROM T1;
+------------------+---------------------+------------------+---------------------+----------------------------------+---------------------+------------------+
| SUBSTRING(C1,C2) | SUBSTRING(C2,C3,C4) | SUBSTRING(C3,C4) | SUBSTRING(C4,C5,C6) | SUBSTRING(C5,C6)                 | SUBSTRING(C6,C7,C1) | SUBSTRING(C7,C1) |
+------------------+---------------------+------------------+---------------------+----------------------------------+---------------------+------------------+
| NULL             | NULL                | NULL             | NULL                | NULL                             | NULL                | NULL             |
|                  |                     |                  |                     |                                  |                     |                  |
|                  |                     |                  |                     |                                  |                     |                  |
|                  |                     |                  |                     |                                  |                     |                  |
| NULL             | NULL                | 1                | 1                   | 1.000000000000000000000000000000 | 1                   | 1                |
| NULL             | NULL                | 1                |                     | 0                                |                     | 1                |
|                  |                     |                  |                     |                                  |                     |                  |
| NULL             | NULL                | NULL             | NULL                | NULL                             | NULL                | NULL             |
| NULL             | NULL                | NULL             | NULL                | NULL                             | NULL                | NULL             |
| NULL             | NULL                |                  | NULL                | NULL                             | NULL                |                  |
| NULL             | NULL                |                  | NULL                | NULL                             | NULL                |                  |
+------------------+---------------------+------------------+---------------------+----------------------------------+---------------------+------------------+
##SUBSTRING_INDEX##
SELECT SUBSTRING_INDEX(C1,C2,C3),SUBSTRING_INDEX(C2,C3,C4),SUBSTRING_INDEX(C3,C4,C5),SUBSTRING_INDEX(C5,C6,C7),SUBSTRING_INDEX(C6,C7,C1) FROM T1;
+---------------------------+---------------------------+---------------------------+------------------------------+---------------------------+
| SUBSTRING_INDEX(C1,C2,C3) | SUBSTRING_INDEX(C2,C3,C4) | SUBSTRING_INDEX(C3,C4,C5) | SUBSTRING_INDEX(C5,C6,C7)    | SUBSTRING_INDEX(C6,C7,C1) |
+---------------------------+---------------------------+---------------------------+------------------------------+---------------------------+
| NULL                      | NULL                      | NULL                      | NULL                         | NULL                      |
|                           |                           |                           |                              |                           |
|                           |                           |                           |                              |                           |
|                           |                           |                           |                              |                           |
| NULL                      | NULL                      |                           |                              |                           |
| NULL                      | NULL                      |                           | 0000000000000000000000000000 | .00                       |
|                           |                           |                           |                              |                           |
| NULL                      | NULL                      | NULL                      | NULL                         | NULL                      |
| NULL                      | NULL                      | NULL                      | NULL                         | NULL                      |
| NULL                      | NULL                      | 1010                      | NULL                         | NULL                      |
| NULL                      | NULL                      | 5461                      | NULL                         | NULL                      |
+---------------------------+---------------------------+---------------------------+------------------------------+---------------------------+
##TRIM##
SELECT TRIM(C1),TRIM(C2),TRIM(C3),TRIM(C4),TRIM(C5),TRIM(C6),TRIM(C7) FROM T1;
+----------+---------------+----------+--------------------------------------------------------------------+-------------------------------------+----------+----------+
| TRIM(C1) | TRIM(C2)      | TRIM(C3) | TRIM(C4)                                                           | TRIM(C5)                            | TRIM(C6) | TRIM(C7) |
+----------+---------------+----------+--------------------------------------------------------------------+-------------------------------------+----------+----------+
| NULL     | NULL          | NULL     | NULL                                                               | NULL                                | NULL     | NULL     |
| 0        | 0.0000000000  | 0        | 0                                                                  | 0.000000000000000000000000000000    | 0.00     | 0        |
| 0        | 0.1230000000  | 0        | 0                                                                  | 0.123000000000000000000000000000    | 0.12     | 0        |
| 0        | 0.0000000000  | 0        | 0                                                                  | 0.000000000000000000000000000001    | 0.00     | 0        |
| 1        | NULL          | 1        | 1                                                                  | 1.000000000000000000000000000000    | 1.00     | 1        |
| -1       | NULL          | -1       | -1                                                                 | -1.000000000000000000000000000000   | -1.00    | -1       |
| 0        | -0.1000000000 | 0        | 0                                                                  | -0.100000000000000000000000000000   | -0.10    | 0        |
| NULL     | NULL          | NULL     | 10000000000000000000000000000000000000000000000000000000000000000  | NULL                                | NULL     | NULL     |
| NULL     | NULL          | NULL     | -10000000000000000000000000000000000000000000000000000000000000000 | NULL                                | NULL     | NULL     |
| 1010     | NULL          | 1010     | 1010                                                               | 1010.000000000000000000000000000000 | NULL     | 1010     |
| 5461     | NULL          | 5461     | 5461                                                               | 5461.000000000000000000000000000000 | NULL     | 5461     |
+----------+---------------+----------+--------------------------------------------------------------------+-------------------------------------+----------+----------+
##UCASE##
SELECT UCASE(C1),UCASE(C2),UCASE(C3),UCASE(C4),UCASE(C5),UCASE(C6),UCASE(C7) FROM T1;
+-----------+---------------+-----------+--------------------------------------------------------------------+-------------------------------------+-----------+-----------+
| UCASE(C1) | UCASE(C2)     | UCASE(C3) | UCASE(C4)                                                          | UCASE(C5)                           | UCASE(C6) | UCASE(C7) |
+-----------+---------------+-----------+--------------------------------------------------------------------+-------------------------------------+-----------+-----------+
| NULL      | NULL          | NULL      | NULL                                                               | NULL                                | NULL      | NULL      |
| 0         | 0.0000000000  | 0         | 0                                                                  | 0.000000000000000000000000000000    | 0.00      | 0         |
| 0         | 0.1230000000  | 0         | 0                                                                  | 0.123000000000000000000000000000    | 0.12      | 0         |
| 0         | 0.0000000000  | 0         | 0                                                                  | 0.000000000000000000000000000001    | 0.00      | 0         |
| 1         | NULL          | 1         | 1                                                                  | 1.000000000000000000000000000000    | 1.00      | 1         |
| -1        | NULL          | -1        | -1                                                                 | -1.000000000000000000000000000000   | -1.00     | -1        |
| 0         | -0.1000000000 | 0         | 0                                                                  | -0.100000000000000000000000000000   | -0.10     | 0         |
| NULL      | NULL          | NULL      | 10000000000000000000000000000000000000000000000000000000000000000  | NULL                                | NULL      | NULL      |
| NULL      | NULL          | NULL      | -10000000000000000000000000000000000000000000000000000000000000000 | NULL                                | NULL      | NULL      |
| 1010      | NULL          | 1010      | 1010                                                               | 1010.000000000000000000000000000000 | NULL      | 1010      |
| 5461      | NULL          | 5461      | 5461                                                               | 5461.000000000000000000000000000000 | NULL      | 5461      |
+-----------+---------------+-----------+--------------------------------------------------------------------+-------------------------------------+-----------+-----------+
##UNHEX##
SELECT UNHEX(C1),UNHEX(C2),UNHEX(C3),UNHEX(C4),UNHEX(C5),UNHEX(C6),UNHEX(C7) FROM T1;
+-----------+-----------+-----------+-----------------------------------+-----------+-----------+-----------+
| UNHEX(C1) | UNHEX(C2) | UNHEX(C3) | UNHEX(C4)                         | UNHEX(C5) | UNHEX(C6) | UNHEX(C7) |
+-----------+-----------+-----------+-----------------------------------+-----------+-----------+-----------+
| NULL      | NULL      | NULL      | NULL                              | NULL      | NULL      | NULL      |
|           | NULL      |           |                                   | NULL      | NULL      |           |
|           | NULL      |           |                                   | NULL      | NULL      |           |
|           | NULL      |           |                                   | NULL      | NULL      |           |
|          | NULL      |          |                                  | NULL      | NULL      |          |
| NULL      | NULL      | NULL      | NULL                              | NULL      | NULL      | NULL      |
|           | NULL      |           |                                   | NULL      | NULL      |           |
| NULL      | NULL      | NULL      |                                  | NULL      | NULL      | NULL      |
| NULL      | NULL      | NULL      | NULL                              | NULL      | NULL      | NULL      |
|         | NULL      |         |                                 | NULL      | NULL      |         |
| Ta        | NULL      | Ta        | Ta                                | NULL      | NULL      | Ta        |
+-----------+-----------+-----------+-----------------------------------+-----------+-----------+-----------+
##UPPER##
SELECT UPPER(C1),UPPER(C2),UPPER(C3),UPPER(C4),UPPER(C5),UPPER(C6),UPPER(C7) FROM T1;
+-----------+---------------+-----------+--------------------------------------------------------------------+-------------------------------------+-----------+-----------+
| UPPER(C1) | UPPER(C2)     | UPPER(C3) | UPPER(C4)                                                          | UPPER(C5)                           | UPPER(C6) | UPPER(C7) |
+-----------+---------------+-----------+--------------------------------------------------------------------+-------------------------------------+-----------+-----------+
| NULL      | NULL          | NULL      | NULL                                                               | NULL                                | NULL      | NULL      |
| 0         | 0.0000000000  | 0         | 0                                                                  | 0.000000000000000000000000000000    | 0.00      | 0         |
| 0         | 0.1230000000  | 0         | 0                                                                  | 0.123000000000000000000000000000    | 0.12      | 0         |
| 0         | 0.0000000000  | 0         | 0                                                                  | 0.000000000000000000000000000001    | 0.00      | 0         |
| 1         | NULL          | 1         | 1                                                                  | 1.000000000000000000000000000000    | 1.00      | 1         |
| -1        | NULL          | -1        | -1                                                                 | -1.000000000000000000000000000000   | -1.00     | -1        |
| 0         | -0.1000000000 | 0         | 0                                                                  | -0.100000000000000000000000000000   | -0.10     | 0         |
| NULL      | NULL          | NULL      | 10000000000000000000000000000000000000000000000000000000000000000  | NULL                                | NULL      | NULL      |
| NULL      | NULL          | NULL      | -10000000000000000000000000000000000000000000000000000000000000000 | NULL                                | NULL      | NULL      |
| 1010      | NULL          | 1010      | 1010                                                               | 1010.000000000000000000000000000000 | NULL      | 1010      |
| 5461      | NULL          | 5461      | 5461                                                               | 5461.000000000000000000000000000000 | NULL      | 5461      |
+-----------+---------------+-----------+--------------------------------------------------------------------+-------------------------------------+-----------+-----------+
##WEIGHT_STRING##
SELECT WEIGHT_STRING(C1),WEIGHT_STRING(C2),WEIGHT_STRING(C3),WEIGHT_STRING(C4),WEIGHT_STRING(C5),WEIGHT_STRING(C6),WEIGHT_STRING(C7) FROM T1;
+-------------------+-------------------+-------------------+-------------------+-------------------+-------------------+-------------------+
| WEIGHT_STRING(C1) | WEIGHT_STRING(C2) | WEIGHT_STRING(C3) | WEIGHT_STRING(C4) | WEIGHT_STRING(C5) | WEIGHT_STRING(C6) | WEIGHT_STRING(C7) |
+-------------------+-------------------+-------------------+-------------------+-------------------+-------------------+-------------------+
| NULL              | NULL              | NULL              | NULL              | NULL              | NULL              | NULL              |
| NULL              | NULL              | NULL              | NULL              | NULL              | NULL              | NULL              |
| NULL              | NULL              | NULL              | NULL              | NULL              | NULL              | NULL              |
| NULL              | NULL              | NULL              | NULL              | NULL              | NULL              | NULL              |
| NULL              | NULL              | NULL              | NULL              | NULL              | NULL              | NULL              |
| NULL              | NULL              | NULL              | NULL              | NULL              | NULL              | NULL              |
| NULL              | NULL              | NULL              | NULL              | NULL              | NULL              | NULL              |
| NULL              | NULL              | NULL              | NULL              | NULL              | NULL              | NULL              |
| NULL              | NULL              | NULL              | NULL              | NULL              | NULL              | NULL              |
| NULL              | NULL              | NULL              | NULL              | NULL              | NULL              | NULL              |
| NULL              | NULL              | NULL              | NULL              | NULL              | NULL              | NULL              |
+-------------------+-------------------+-------------------+-------------------+-------------------+-------------------+-------------------+
##TO_BASE64##
SELECT TO_BASE64(C1),TO_BASE64(C2),TO_BASE64(C3),TO_BASE64(C4),TO_BASE64(C5),TO_BASE64(C6),TO_BASE64(C7) FROM T1;
+---------------+----------------------+---------------+-------------------------------------------------------------------------------------------+--------------------------------------------------+---------------+---------------+
| TO_BASE64(C1) | TO_BASE64(C2)        | TO_BASE64(C3) | TO_BASE64(C4)                                                                             | TO_BASE64(C5)                                    | TO_BASE64(C6) | TO_BASE64(C7) |
+---------------+----------------------+---------------+-------------------------------------------------------------------------------------------+--------------------------------------------------+---------------+---------------+
| NULL          | NULL                 | NULL          | NULL                                                                                      | NULL                                             | NULL          | NULL          |
| MA==          | MC4wMDAwMDAwMDAw     | MA==          | MA==                                                                                      | MC4wMDAwMDAwMDAwMDAwMDAwMDAwMDAwMDAwMDAwMDA=     | MC4wMA==      | MA==          |
| MA==          | MC4xMjMwMDAwMDAw     | MA==          | MA==                                                                                      | MC4xMjMwMDAwMDAwMDAwMDAwMDAwMDAwMDAwMDAwMDA=     | MC4xMg==      | MA==          |
| MA==          | MC4wMDAwMDAwMDAw     | MA==          | MA==                                                                                      | MC4wMDAwMDAwMDAwMDAwMDAwMDAwMDAwMDAwMDAwMDE=     | MC4wMA==      | MA==          |
| MQ==          | NULL                 | MQ==          | MQ==                                                                                      | MS4wMDAwMDAwMDAwMDAwMDAwMDAwMDAwMDAwMDAwMDA=     | MS4wMA==      | MQ==          |
| LTE=          | NULL                 | LTE=          | LTE=                                                                                      | LTEuMDAwMDAwMDAwMDAwMDAwMDAwMDAwMDAwMDAwMDAw     | LTEuMDA=      | LTE=          |
| MA==          | LTAuMTAwMDAwMDAwMA== | MA==          | MA==                                                                                      | LTAuMTAwMDAwMDAwMDAwMDAwMDAwMDAwMDAwMDAwMDAw     | LTAuMTA=      | MA==          |
| NULL          | NULL                 | NULL          | MTAwMDAwMDAwMDAwMDAwMDAwMDAwMDAwMDAwMDAwMDAwMDAwMDAwMDAwMDAwMDAwMDAwMDAwMDAw
MDAwMDAwMDA= | NULL                                             | NULL          | NULL          |
| NULL          | NULL                 | NULL          | LTEwMDAwMDAwMDAwMDAwMDAwMDAwMDAwMDAwMDAwMDAwMDAwMDAwMDAwMDAwMDAwMDAwMDAwMDAw
MDAwMDAwMDAw | NULL                                             | NULL          | NULL          |
| MTAxMA==      | NULL                 | MTAxMA==      | MTAxMA==                                                                                  | MTAxMC4wMDAwMDAwMDAwMDAwMDAwMDAwMDAwMDAwMDAwMDA= | NULL          | MTAxMA==      |
| NTQ2MQ==      | NULL                 | NTQ2MQ==      | NTQ2MQ==                                                                                  | NTQ2MS4wMDAwMDAwMDAwMDAwMDAwMDAwMDAwMDAwMDAwMDA= | NULL          | NTQ2MQ==      |
+---------------+----------------------+---------------+-------------------------------------------------------------------------------------------+--------------------------------------------------+---------------+---------------+
##FROM_BASE64##
SELECT FROM_BASE64(C1),FROM_BASE64(C2),FROM_BASE64(C3),FROM_BASE64(C4),FROM_BASE64(C5),FROM_BASE64(C6),FROM_BASE64(C7) FROM T1;
+-----------------+-----------------+-----------------+-----------------+-----------------+-----------------+-----------------+
| FROM_BASE64(C1) | FROM_BASE64(C2) | FROM_BASE64(C3) | FROM_BASE64(C4) | FROM_BASE64(C5) | FROM_BASE64(C6) | FROM_BASE64(C7) |
+-----------------+-----------------+-----------------+-----------------+-----------------+-----------------+-----------------+
| NULL            | NULL            | NULL            | NULL            | NULL            | NULL            | NULL            |
| NULL            | NULL            | NULL            | NULL            | NULL            | NULL            | NULL            |
| NULL            | NULL            | NULL            | NULL            | NULL            | NULL            | NULL            |
| NULL            | NULL            | NULL            | NULL            | NULL            | NULL            | NULL            |
| NULL            | NULL            | NULL            | NULL            | NULL            | NULL            | NULL            |
| NULL            | NULL            | NULL            | NULL            | NULL            | NULL            | NULL            |
| NULL            | NULL            | NULL            | NULL            | NULL            | NULL            | NULL            |
| NULL            | NULL            | NULL            | NULL            | NULL            | NULL            | NULL            |
| NULL            | NULL            | NULL            | NULL            | NULL            | NULL            | NULL            |
| ◊Mt              | NULL            | ◊Mt              | ◊Mt              | NULL            | NULL            | ◊Mt              |
| Áéµ              | NULL            | Áéµ              | Áéµ              | NULL            | NULL            | Áéµ              |
+-----------------+-----------------+-----------------+-----------------+-----------------+-----------------+-----------------+
##SOUNDEX##
SELECT SOUNDEX(C1),SOUNDEX(C2),SOUNDEX(C3),SOUNDEX(C4),SOUNDEX(C5),SOUNDEX(C6),SOUNDEX(C7) FROM T1;
+-------------+-------------+-------------+-------------+-------------+-------------+-------------+
| SOUNDEX(C1) | SOUNDEX(C2) | SOUNDEX(C3) | SOUNDEX(C4) | SOUNDEX(C5) | SOUNDEX(C6) | SOUNDEX(C7) |
+-------------+-------------+-------------+-------------+-------------+-------------+-------------+
| NULL        | NULL        | NULL        | NULL        | NULL        | NULL        | NULL        |
|             |             |             |             |             |             |             |
|             |             |             |             |             |             |             |
|             |             |             |             |             |             |             |
|             | NULL        |             |             |             |             |             |
|             | NULL        |             |             |             |             |             |
|             |             |             |             |             |             |             |
| NULL        | NULL        | NULL        |             | NULL        | NULL        | NULL        |
| NULL        | NULL        | NULL        |             | NULL        | NULL        | NULL        |
|             | NULL        |             |             |             | NULL        |             |
|             | NULL        |             |             |             | NULL        |             |
+-------------+-------------+-------------+-------------+-------------+-------------+-------------+
##Êó∂Èó¥Êó•ÊúüÂáΩÊï∞##
##SCN_TO_TIMESTAMP##
SELECT SCN_TO_TIMESTAMP(C7) FROM T1 WHERE C1 =1;
+----------------------------+
| SCN_TO_TIMESTAMP(C7)       |
+----------------------------+
| 1970-01-01 08:00:00.000000 |
+----------------------------+
##FROM_DAYS##
SELECT FROM_DAYS(C1),FROM_DAYS(C2),FROM_DAYS(C3),FROM_DAYS(C4),FROM_DAYS(C5),FROM_DAYS(C6),FROM_DAYS(C7) FROM T1;
+---------------+---------------+---------------+---------------+---------------+---------------+---------------+
| FROM_DAYS(C1) | FROM_DAYS(C2) | FROM_DAYS(C3) | FROM_DAYS(C4) | FROM_DAYS(C5) | FROM_DAYS(C6) | FROM_DAYS(C7) |
+---------------+---------------+---------------+---------------+---------------+---------------+---------------+
| NULL          | NULL          | NULL          | NULL          | NULL          | NULL          | NULL          |
| 0000-00-00    | 0000-00-00    | 0000-00-00    | 0000-00-00    | 0000-00-00    | 0000-00-00    | 0000-00-00    |
| 0000-00-00    | 0000-00-00    | 0000-00-00    | 0000-00-00    | 0000-00-00    | 0000-00-00    | 0000-00-00    |
| 0000-00-00    | 0000-00-00    | 0000-00-00    | 0000-00-00    | 0000-00-00    | 0000-00-00    | 0000-00-00    |
| 0000-00-00    | NULL          | 0000-00-00    | 0000-00-00    | 0000-00-00    | 0000-00-00    | 0000-00-00    |
| 0000-00-00    | NULL          | 0000-00-00    | 0000-00-00    | 0000-00-00    | 0000-00-00    | 0000-00-00    |
| 0000-00-00    | 0000-00-00    | 0000-00-00    | 0000-00-00    | 0000-00-00    | 0000-00-00    | 0000-00-00    |
| NULL          | NULL          | NULL          | 0000-00-00    | NULL          | NULL          | NULL          |
| NULL          | NULL          | NULL          | 0000-00-00    | NULL          | NULL          | NULL          |
| 0002-10-07    | NULL          | 0002-10-07    | 0002-10-07    | 0002-10-07    | NULL          | 0002-10-07    |
| 0014-12-14    | NULL          | 0014-12-14    | 0014-12-14    | 0014-12-14    | NULL          | 0014-12-14    |
+---------------+---------------+---------------+---------------+---------------+---------------+---------------+
##ADDDATE##
SELECT ADDDATE(C1,C2),ADDTIME(C2,C3) FROM T1;
+----------------+-----------------+
| ADDDATE(C1,C2) | ADDTIME(C2,C3)  |
+----------------+-----------------+
| NULL           | NULL            |
| NULL           | 00:00:00        |
| NULL           | 00:00:00.123000 |
| NULL           | 00:00:00        |
| NULL           | NULL            |
| NULL           | NULL            |
| NULL           | 00:00:00.100000 |
| NULL           | NULL            |
| NULL           | NULL            |
| NULL           | NULL            |
| NULL           | NULL            |
+----------------+-----------------+
##CONVERT_TZ##
SELECT CONVERT_TZ(C1,C2,C3) FROM T1;
+----------------------+
| CONVERT_TZ(C1,C2,C3) |
+----------------------+
| NULL                 |
| NULL                 |
| NULL                 |
| NULL                 |
| NULL                 |
| NULL                 |
| NULL                 |
| NULL                 |
| NULL                 |
| NULL                 |
| NULL                 |
+----------------------+
##DATE##
SELECT DATE(C1) FROM T1;
+------------+
| DATE(C1)   |
+------------+
| NULL       |
| 0000-00-00 |
| 0000-00-00 |
| 0000-00-00 |
| NULL       |
| NULL       |
| 0000-00-00 |
| NULL       |
| NULL       |
| 2000-10-10 |
| NULL       |
+------------+
##DATE_FORMAT##
SELECT DATE_FORMAT(C1,C2) FROM T1;
+--------------------+
| DATE_FORMAT(C1,C2) |
+--------------------+
| NULL               |
| NULL               |
| NULL               |
| NULL               |
| NULL               |
| NULL               |
| NULL               |
| NULL               |
| NULL               |
| NULL               |
| NULL               |
+--------------------+
####
SELECT DATEDIFF(C1,C2) FROM T1;
+-----------------+
| DATEDIFF(C1,C2) |
+-----------------+
|            NULL |
|            NULL |
|            NULL |
|            NULL |
|            NULL |
|            NULL |
|            NULL |
|            NULL |
|            NULL |
|            NULL |
|            NULL |
+-----------------+
####
SELECT DAYOFMONTH(C1),DAYOFWEEK(C2),DAYOFYEAR(C3) FROM T1;
+----------------+---------------+---------------+
| DAYOFMONTH(C1) | DAYOFWEEK(C2) | DAYOFYEAR(C3) |
+----------------+---------------+---------------+
|           NULL |          NULL |          NULL |
|              0 |          NULL |          NULL |
|              0 |          NULL |          NULL |
|              0 |          NULL |          NULL |
|           NULL |          NULL |          NULL |
|           NULL |          NULL |          NULL |
|              0 |          NULL |          NULL |
|           NULL |          NULL |          NULL |
|           NULL |          NULL |          NULL |
|             10 |          NULL |           284 |
|           NULL |          NULL |          NULL |
+----------------+---------------+---------------+
####
SELECT HOUR(C1),MINUTE(C2),SECOND(C3) FROM T1;
+----------+------------+------------+
| HOUR(C1) | MINUTE(C2) | SECOND(C3) |
+----------+------------+------------+
|     NULL |       NULL |       NULL |
|        0 |          0 |          0 |
|        0 |          0 |          0 |
|        0 |          0 |          0 |
|        0 |       NULL |          1 |
|        0 |       NULL |          1 |
|        0 |          0 |          0 |
|     NULL |       NULL |       NULL |
|     NULL |       NULL |       NULL |
|        0 |       NULL |         10 |
|     NULL |       NULL |       NULL |
+----------+------------+------------+
####
SELECT LAST_DAY(C1) FROM T1;
+--------------+
| LAST_DAY(C1) |
+--------------+
| NULL         |
| NULL         |
| NULL         |
| NULL         |
| NULL         |
| NULL         |
| NULL         |
| NULL         |
| NULL         |
| 2000-10-31   |
| NULL         |
+--------------+
####
SELECT MAKEDATE(C1,C2) FROM T1;
+-----------------+
| MAKEDATE(C1,C2) |
+-----------------+
| NULL            |
| NULL            |
| NULL            |
| NULL            |
| NULL            |
| NULL            |
| NULL            |
| NULL            |
| NULL            |
| NULL            |
| NULL            |
+-----------------+
####
SELECT MAKETIME(C1,C2,C3) FROM T1;
+--------------------+
| MAKETIME(C1,C2,C3) |
+--------------------+
| NULL               |
| 00:00:00.000000    |
| 00:00:00.000000    |
| 00:00:00.000000    |
| NULL               |
| NULL               |
| 00:00:00.000000    |
| NULL               |
| NULL               |
| NULL               |
| NULL               |
+--------------------+
####
SELECT MICROSECOND(C1) FROM T1;
+-----------------+
| MICROSECOND(C1) |
+-----------------+
|            NULL |
|               0 |
|               0 |
|               0 |
|               0 |
|               0 |
|               0 |
|            NULL |
|            NULL |
|               0 |
|            NULL |
+-----------------+
####
SELECT MONTH(C1),MONTHNAME(C2),WEEK(C3),WEEKDAY(C4),WEEKOFYEAR(C5),YEARWEEK(C6),YEAR(C7),DAY(C1),DAYNAME(C2) FROM T1;
+-----------+---------------+----------+-------------+----------------+--------------+----------+---------+-------------+
| MONTH(C1) | MONTHNAME(C2) | WEEK(C3) | WEEKDAY(C4) | WEEKOFYEAR(C5) | YEARWEEK(C6) | YEAR(C7) | DAY(C1) | DAYNAME(C2) |
+-----------+---------------+----------+-------------+----------------+--------------+----------+---------+-------------+
|      NULL | NULL          |     NULL |        NULL |           NULL |         NULL |     NULL |    NULL | NULL        |
|         0 | NULL          |     NULL |        NULL |           NULL |         NULL |        0 |       0 | NULL        |
|         0 | NULL          |     NULL |        NULL |           NULL |         NULL |        0 |       0 | NULL        |
|         0 | NULL          |     NULL |        NULL |           NULL |         NULL |        0 |       0 | NULL        |
|      NULL | NULL          |     NULL |        NULL |           NULL |         NULL |     NULL |    NULL | NULL        |
|      NULL | NULL          |     NULL |        NULL |           NULL |         NULL |     NULL |    NULL | NULL        |
|         0 | NULL          |     NULL |        NULL |           NULL |         NULL |        0 |       0 | NULL        |
|      NULL | NULL          |     NULL |        NULL |           NULL |         NULL |     NULL |    NULL | NULL        |
|      NULL | NULL          |     NULL |        NULL |           NULL |         NULL |     NULL |    NULL | NULL        |
|        10 | NULL          |       41 |           1 |             41 |         NULL |     2000 |      10 | NULL        |
|      NULL | NULL          |     NULL |        NULL |           NULL |         NULL |     NULL |    NULL | NULL        |
+-----------+---------------+----------+-------------+----------------+--------------+----------+---------+-------------+
####
SELECT PERIOD_ADD(C1,C2),PERIOD_DIFF(C2,C3) FROM T1;
+-------------------+--------------------+
| PERIOD_ADD(C1,C2) | PERIOD_DIFF(C2,C3) |
+-------------------+--------------------+
|              NULL |               NULL |
|                 0 |                  0 |
|                 0 |                  0 |
|                 0 |                  0 |
|              NULL |               NULL |
|              NULL |               NULL |
|                 0 |                  0 |
|              NULL |               NULL |
|              NULL |               NULL |
|              NULL |               NULL |
|              NULL |               NULL |
+-------------------+--------------------+
####
SELECT QUARTER(C1) FROM T1;
+-------------+
| QUARTER(C1) |
+-------------+
|        NULL |
|        NULL |
|        NULL |
|        NULL |
|        NULL |
|        NULL |
|        NULL |
|        NULL |
|        NULL |
|           4 |
|        NULL |
+-------------+
####
SELECT SEC_TO_TIME(C1) FROM T1;
+-----------------+
| SEC_TO_TIME(C1) |
+-----------------+
| NULL            |
| 00:00:00        |
| 00:00:00        |
| 00:00:00        |
| 00:00:01        |
| -00:00:01       |
| 00:00:00        |
| NULL            |
| NULL            |
| 00:16:50        |
| 01:31:01        |
+-----------------+
####
SELECT SUBDATE(C1,C2),SUBTIME(C2,C3) FROM T1;
+----------------+-----------------+
| SUBDATE(C1,C2) | SUBTIME(C2,C3)  |
+----------------+-----------------+
| NULL           | NULL            |
| NULL           | 00:00:00        |
| NULL           | 00:00:00.123000 |
| NULL           | 00:00:00        |
| NULL           | NULL            |
| NULL           | NULL            |
| NULL           | 00:00:00.100000 |
| NULL           | NULL            |
| NULL           | NULL            |
| NULL           | NULL            |
| NULL           | NULL            |
+----------------+-----------------+
####
SELECT TIME(C1),TIME_FORMAT(C2,'%H %k %h %I %l') FROM T1;
+-----------+----------------------------------+
| TIME(C1)  | TIME_FORMAT(C2,'%H %k %h %I %l') |
+-----------+----------------------------------+
| NULL      | NULL                             |
| 00:00:00  | 00 0 12 12 12                    |
| 00:00:00  | 00 0 12 12 12                    |
| 00:00:00  | 00 0 12 12 12                    |
| 00:00:01  | NULL                             |
| -00:00:01 | NULL                             |
| 00:00:00  | -00 0 12 12 12                   |
| NULL      | NULL                             |
| NULL      | NULL                             |
| 00:10:10  | NULL                             |
| NULL      | NULL                             |
+-----------+----------------------------------+
####
SELECT TIME_TO_SEC(C1) FROM T1;
+-----------------+
| TIME_TO_SEC(C1) |
+-----------------+
|            NULL |
|               0 |
|               0 |
|               0 |
|               1 |
|              -1 |
|               0 |
|            NULL |
|            NULL |
|             610 |
|            NULL |
+-----------------+
####
SELECT TIMEDIFF(C1,C2) FROM T1;
+------------------+
| TIMEDIFF(C1,C2)  |
+------------------+
| NULL             |
| 00:00:00.000000  |
| -00:00:00.123000 |
| 00:00:00.000000  |
| NULL             |
| NULL             |
| -00:00:00.100000 |
| NULL             |
| NULL             |
| NULL             |
| NULL             |
+------------------+
####
SELECT TO_DAYS(C1),TO_SECONDS(C2) FROM T1;
+-------------+----------------+
| TO_DAYS(C1) | TO_SECONDS(C2) |
+-------------+----------------+
|        NULL |           NULL |
|        NULL |           NULL |
|        NULL |           NULL |
|        NULL |           NULL |
|        NULL |           NULL |
|        NULL |           NULL |
|        NULL |           NULL |
|        NULL |           NULL |
|        NULL |           NULL |
|      730768 |           NULL |
|        NULL |           NULL |
+-------------+----------------+
####
SELECT UNIX_TIMESTAMP(C1) FROM T1;
+--------------------+
| UNIX_TIMESTAMP(C1) |
+--------------------+
|               NULL |
|                  0 |
|                  0 |
|                  0 |
|                  0 |
|                  0 |
|                  0 |
|               NULL |
|               NULL |
|          971107200 |
|                  0 |
+--------------------+
####
SELECT USEC_TO_TIME(C1) FROM T1;
+----------------------------+
| USEC_TO_TIME(C1)           |
+----------------------------+
| NULL                       |
| 1970-01-01 08:00:00.000000 |
| 1970-01-01 08:00:00.000000 |
| 1970-01-01 08:00:00.000000 |
| 1970-01-01 08:00:00.000001 |
| 1970-01-01 07:59:59.999999 |
| 1970-01-01 08:00:00.000000 |
| NULL                       |
| NULL                       |
| 1970-01-01 08:00:00.001010 |
| 1970-01-01 08:00:00.005461 |
+----------------------------+
##ÊØîËæÉÂáΩÊï∞##
##GREATEST##
SELECT GREATEST(C1,C2,C3),GREATEST(C2,C3,C4),GREATEST(C3,C4,C5),GREATEST(C4,C5,C6),GREATEST(C5,C6,C7) FROM T1;
+--------------------+--------------------+-------------------------------------+-----------------------------------+-----------------------------------+
| GREATEST(C1,C2,C3) | GREATEST(C2,C3,C4) | GREATEST(C3,C4,C5)                  | GREATEST(C4,C5,C6)                | GREATEST(C5,C6,C7)                |
+--------------------+--------------------+-------------------------------------+-----------------------------------+-----------------------------------+
|               NULL |               NULL |                                NULL |                              NULL |                              NULL |
|       0.0000000000 |       0.0000000000 |    0.000000000000000000000000000000 |  0.000000000000000000000000000000 |  0.000000000000000000000000000000 |
|       0.1230000000 |       0.1230000000 |    0.123000000000000000000000000000 |  0.123000000000000000000000000000 |  0.123000000000000000000000000000 |
|       0.0000000000 |       0.0000000000 |    0.000000000000000000000000000001 |  0.000000000000000000000000000001 |  0.000000000000000000000000000001 |
|               NULL |               NULL |    1.000000000000000000000000000000 |  1.000000000000000000000000000000 |  1.000000000000000000000000000000 |
|               NULL |               NULL |   -1.000000000000000000000000000000 | -1.000000000000000000000000000000 | -1.000000000000000000000000000000 |
|       0.0000000000 |       0.0000000000 |    0.000000000000000000000000000000 |  0.000000000000000000000000000000 |  0.000000000000000000000000000000 |
|               NULL |               NULL |                                NULL |                              NULL |                              NULL |
|               NULL |               NULL |                                NULL |                              NULL |                              NULL |
|               NULL |               NULL | 1010.000000000000000000000000000000 |                              NULL |                              NULL |
|               NULL |               NULL | 5461.000000000000000000000000000000 |                              NULL |                              NULL |
+--------------------+--------------------+-------------------------------------+-----------------------------------+-----------------------------------+
##INTERVAL##
##ÁªìÊûú‰∏ç‰∏ÄËá¥ÔºåÂæÖ‰øÆÂ§ç##
##ISNULL##
SELECT ISNULL(C1),ISNULL(C2),ISNULL(C3),ISNULL(C4),ISNULL(C5),ISNULL(C6),ISNULL(C7) FROM T1;
+------------+------------+------------+------------+------------+------------+------------+
| ISNULL(C1) | ISNULL(C2) | ISNULL(C3) | ISNULL(C4) | ISNULL(C5) | ISNULL(C6) | ISNULL(C7) |
+------------+------------+------------+------------+------------+------------+------------+
|          1 |          1 |          1 |          1 |          1 |          1 |          1 |
|          0 |          0 |          0 |          0 |          0 |          0 |          0 |
|          0 |          0 |          0 |          0 |          0 |          0 |          0 |
|          0 |          0 |          0 |          0 |          0 |          0 |          0 |
|          0 |          1 |          0 |          0 |          0 |          0 |          0 |
|          0 |          1 |          0 |          0 |          0 |          0 |          0 |
|          0 |          0 |          0 |          0 |          0 |          0 |          0 |
|          1 |          1 |          1 |          0 |          1 |          1 |          1 |
|          1 |          1 |          1 |          0 |          1 |          1 |          1 |
|          0 |          1 |          0 |          0 |          0 |          1 |          0 |
|          0 |          1 |          0 |          0 |          0 |          1 |          0 |
+------------+------------+------------+------------+------------+------------+------------+
##LEAST##
SELECT LEAST(C1,C2,C3),LEAST(C2,C3,C4),LEAST(C3,C4,C5),LEAST(C4,C5,C6),LEAST(C5,C6,C7) FROM T1;
+-----------------+-----------------+-------------------------------------+-----------------------------------+-----------------------------------+
| LEAST(C1,C2,C3) | LEAST(C2,C3,C4) | LEAST(C3,C4,C5)                     | LEAST(C4,C5,C6)                   | LEAST(C5,C6,C7)                   |
+-----------------+-----------------+-------------------------------------+-----------------------------------+-----------------------------------+
|            NULL |            NULL |                                NULL |                              NULL |                              NULL |
|    0.0000000000 |    0.0000000000 |    0.000000000000000000000000000000 |  0.000000000000000000000000000000 |  0.000000000000000000000000000000 |
|    0.0000000000 |    0.0000000000 |    0.000000000000000000000000000000 |  0.000000000000000000000000000000 |  0.000000000000000000000000000000 |
|    0.0000000000 |    0.0000000000 |    0.000000000000000000000000000000 |  0.000000000000000000000000000000 |  0.000000000000000000000000000000 |
|            NULL |            NULL |    1.000000000000000000000000000000 |  1.000000000000000000000000000000 |  1.000000000000000000000000000000 |
|            NULL |            NULL |   -1.000000000000000000000000000000 | -1.000000000000000000000000000000 | -1.000000000000000000000000000000 |
|   -0.1000000000 |   -0.1000000000 |   -0.100000000000000000000000000000 | -0.100000000000000000000000000000 | -0.100000000000000000000000000000 |
|            NULL |            NULL |                                NULL |                              NULL |                              NULL |
|            NULL |            NULL |                                NULL |                              NULL |                              NULL |
|            NULL |            NULL | 1010.000000000000000000000000000000 |                              NULL |                              NULL |
|            NULL |            NULL | 5461.000000000000000000000000000000 |                              NULL |                              NULL |
+-----------------+-----------------+-------------------------------------+-----------------------------------+-----------------------------------+
##ÊµÅÁ®ãÊéßÂà∂ÂáΩÊï∞##
SELECT IF(C1,C2,C3) FROM T1;
+--------------+
| IF(C1,C2,C3) |
+--------------+
|         NULL |
| 0.0000000000 |
| 0.0000000000 |
| 0.0000000000 |
|         NULL |
|         NULL |
| 0.0000000000 |
|         NULL |
|         NULL |
|         NULL |
|         NULL |
+--------------+
SELECT IFNULL(C1,C2) FROM T1;
+-----------------+
| IFNULL(C1,C2)   |
+-----------------+
|            NULL |
|    0.0000000000 |
|    0.0000000000 |
|    0.0000000000 |
|    1.0000000000 |
|   -1.0000000000 |
|    0.0000000000 |
|            NULL |
|            NULL |
| 1010.0000000000 |
| 5461.0000000000 |
+-----------------+
SELECT NULLIF(C1,C2) FROM T1;
+---------------+
| NULLIF(C1,C2) |
+---------------+
|          NULL |
|          NULL |
|             0 |
|          NULL |
|             1 |
|            -1 |
|             0 |
|          NULL |
|          NULL |
|          1010 |
|          5461 |
+---------------+
##ÂÖ∂‰ªñÂáΩÊï∞##
SELECT ANY_VALUE(C1) FROM T1;
+---------------+
| ANY_VALUE(C1) |
+---------------+
|          NULL |
|             0 |
|             0 |
|             0 |
|             1 |
|            -1 |
|             0 |
|          NULL |
|          NULL |
|          1010 |
|          5461 |
+---------------+
SELECT COALESCE(C1) FROM T1;
+--------------+
| COALESCE(C1) |
+--------------+
|         NULL |
|            0 |
|            0 |
|            0 |
|            1 |
|           -1 |
|            0 |
|         NULL |
|         NULL |
|         1010 |
|         5461 |
+--------------+
SELECT DEFAULT(C1) FROM T1;
+-------------+
| DEFAULT(C1) |
+-------------+
|        NULL |
|        NULL |
|        NULL |
|        NULL |
|        NULL |
|        NULL |
|        NULL |
|        NULL |
|        NULL |
|        NULL |
|        NULL |
+-------------+
SELECT INET_ATON(C1) FROM T1;
+---------------+
| INET_ATON(C1) |
+---------------+
|          NULL |
|             0 |
|             0 |
|             0 |
|             1 |
|          NULL |
|             0 |
|          NULL |
|          NULL |
|          NULL |
|          NULL |
+---------------+
Warnings:
Warning	1411	Incorrect string value for function inet_aton
Warning	1411	Incorrect string value for function inet_aton
Warning	1411	Incorrect string value for function inet_aton
SELECT INET_NTOA(C1) FROM T1;
+---------------+
| INET_NTOA(C1) |
+---------------+
| NULL          |
| 0.0.0.0       |
| 0.0.0.0       |
| 0.0.0.0       |
| 0.0.0.1       |
| NULL          |
| 0.0.0.0       |
| NULL          |
| NULL          |
| 0.0.3.242     |
| 0.0.21.85     |
+---------------+
SELECT INET6_ATON(C1) FROM T1;
+----------------+
| INET6_ATON(C1) |
+----------------+
| NULL           |
| NULL           |
| NULL           |
| NULL           |
| NULL           |
| NULL           |
| NULL           |
| NULL           |
| NULL           |
| NULL           |
| NULL           |
+----------------+
Warnings:
Warning	1411	Incorrect string value for function inet6_aton
Warning	1411	Incorrect string value for function inet6_aton
Warning	1411	Incorrect string value for function inet6_aton
Warning	1411	Incorrect string value for function inet6_aton
Warning	1411	Incorrect string value for function inet6_aton
Warning	1411	Incorrect string value for function inet6_aton
Warning	1411	Incorrect string value for function inet6_aton
Warning	1411	Incorrect string value for function inet6_aton
SELECT INET6_NTOA(C1) FROM T1;
+----------------+
| INET6_NTOA(C1) |
+----------------+
| NULL           |
| NULL           |
| NULL           |
| NULL           |
| NULL           |
| NULL           |
| NULL           |
| NULL           |
| NULL           |
| NULL           |
| NULL           |
+----------------+
SELECT IS_IPV4(C1) FROM T1;
+-------------+
| IS_IPV4(C1) |
+-------------+
|           0 |
|           0 |
|           0 |
|           0 |
|           0 |
|           0 |
|           0 |
|           0 |
|           0 |
|           0 |
|           0 |
+-------------+
SELECT IS_IPV4_COMPAT(C1) FROM T1;
+--------------------+
| IS_IPV4_COMPAT(C1) |
+--------------------+
|                  0 |
|                  0 |
|                  0 |
|                  0 |
|                  0 |
|                  0 |
|                  0 |
|                  0 |
|                  0 |
|                  0 |
|                  0 |
+--------------------+
SELECT IS_IPV6(C1) FROM T1;
+-------------+
| IS_IPV6(C1) |
+-------------+
|           0 |
|           0 |
|           0 |
|           0 |
|           0 |
|           0 |
|           0 |
|           0 |
|           0 |
|           0 |
|           0 |
+-------------+
SELECT IS_UUID(C1) FROM T1;
+-------------+
| IS_UUID(C1) |
+-------------+
|        NULL |
|           0 |
|           0 |
|           0 |
|           0 |
|           0 |
|           0 |
|        NULL |
|        NULL |
|           0 |
|           0 |
+-------------+
SELECT NVL(C1,C2) FROM T1;
+-----------------+
| NVL(C1,C2)      |
+-----------------+
|            NULL |
|    0.0000000000 |
|    0.0000000000 |
|    0.0000000000 |
|    1.0000000000 |
|   -1.0000000000 |
|    0.0000000000 |
|            NULL |
|            NULL |
| 1010.0000000000 |
| 5461.0000000000 |
+-----------------+
SELECT AES_DECRYPT(C1,C2) FROM T1;
+--------------------+
| AES_DECRYPT(C1,C2) |
+--------------------+
| NULL               |
| NULL               |
| NULL               |
| NULL               |
| NULL               |
| NULL               |
| NULL               |
| NULL               |
| NULL               |
| NULL               |
| NULL               |
+--------------------+
SELECT AES_ENCRYPT(C1,C2) FROM T1;
+--------------------+
| AES_ENCRYPT(C1,C2) |
+--------------------+
| NULL               |
| ZQ…ÚΩ†ﬁâ?Æœ[/∫           |
| 'i¢]Ù: LÎ5ìÁHl.ÿ         |
| ZQ…ÚΩ†ﬁâ?Æœ[/∫           |
| NULL               |
| NULL               |
| ÇH[ Í®ûiÑ“ëÇD          |
| NULL               |
| NULL               |
| NULL               |
| NULL               |
+--------------------+
SELECT COMPRESS(C1) FROM T1;
+------------------+
| COMPRESS(C1)     |
+------------------+
| NULL             |
|    xú3   1 1     |
|    xú3   1 1     |
|    xú3   1 1     |
|    xú3  2 2     |
|    xú”5  ç _      |
|    xú3   1 1     |
| NULL             |
| NULL             |
|    xú3404  Í √    |
|    xú3513  —   |
+------------------+
SELECT DECODE(C1,C2) FROM T1;
+---------------+
| DECODE(C1,C2) |
+---------------+
| NULL          |
| :             |
| =             |
| :             |
| NULL          |
| NULL          |
| ´              |
| NULL          |
| NULL          |
| NULL          |
| NULL          |
+---------------+
SELECT DES_DECRYPT(C1,C2) FROM T1;
+--------------------+
| DES_DECRYPT(C1,C2) |
+--------------------+
| NULL               |
| 0                  |
| 0                  |
| 0                  |
| 1                  |
| -1                 |
| 0                  |
| NULL               |
| NULL               |
| 1010               |
| 5461               |
+--------------------+
SELECT DES_ENCRYPT(C1,C2) FROM T1;
+--------------------+
| DES_ENCRYPT(C1,C2) |
+--------------------+
| NULL               |
| ˇQ™æ∫dXs£               |
| ˇíÖy(3É              |
| ˇQ™æ∫dXs£               |
| NULL               |
| NULL               |
| ˇ∂[72»…πr              |
| NULL               |
| NULL               |
| NULL               |
| NULL               |
+--------------------+
Warnings:
Warning	1108	Incorrect parameters to procedure 'des_encrypt'
Warning	1108	Incorrect parameters to procedure 'des_encrypt'
Warning	1108	Incorrect parameters to procedure 'des_encrypt'
Warning	1108	Incorrect parameters to procedure 'des_encrypt'
SELECT ENCODE(C1,C2) FROM T1;
+---------------+
| ENCODE(C1,C2) |
+---------------+
| NULL          |
| ◊              |
| å              |
| ◊              |
| NULL          |
| NULL          |
| ~             |
| NULL          |
| NULL          |
| NULL          |
| NULL          |
+---------------+
SELECT ENCRYPT(C1,C2) FROM T1;
+----------------+
| ENCRYPT(C1,C2) |
+----------------+
| NULL           |
| 0.nGReqgX7aJo  |
| 0.nGReqgX7aJo  |
| 0.nGReqgX7aJo  |
| NULL           |
| NULL           |
| NULL           |
| NULL           |
| NULL           |
| NULL           |
| NULL           |
+----------------+
SELECT MD5(C1) FROM T1;
+----------------------------------+
| MD5(C1)                          |
+----------------------------------+
| NULL                             |
| cfcd208495d565ef66e7dff9f98764da |
| cfcd208495d565ef66e7dff9f98764da |
| cfcd208495d565ef66e7dff9f98764da |
| c4ca4238a0b923820dcc509a6f75849b |
| 6bb61e3b7bce0931da574d19d1d82c88 |
| cfcd208495d565ef66e7dff9f98764da |
| NULL                             |
| NULL                             |
| 1e48c4420b7073bc11916c6c1de226bb |
| b9009beb804fa097c04d226a8ba5102e |
+----------------------------------+
SELECT CHARSET(C1),CHARSET(C2),CHARSET(C3),CHARSET(C4),CHARSET(C5),CHARSET(C6),CHARSET(C7) FROM T1;
+-------------+-------------+-------------+-------------+-------------+-------------+-------------+
| CHARSET(C1) | CHARSET(C2) | CHARSET(C3) | CHARSET(C4) | CHARSET(C5) | CHARSET(C6) | CHARSET(C7) |
+-------------+-------------+-------------+-------------+-------------+-------------+-------------+
| binary      | binary      | binary      | binary      | binary      | binary      | binary      |
| binary      | binary      | binary      | binary      | binary      | binary      | binary      |
| binary      | binary      | binary      | binary      | binary      | binary      | binary      |
| binary      | binary      | binary      | binary      | binary      | binary      | binary      |
| binary      | binary      | binary      | binary      | binary      | binary      | binary      |
| binary      | binary      | binary      | binary      | binary      | binary      | binary      |
| binary      | binary      | binary      | binary      | binary      | binary      | binary      |
| binary      | binary      | binary      | binary      | binary      | binary      | binary      |
| binary      | binary      | binary      | binary      | binary      | binary      | binary      |
| binary      | binary      | binary      | binary      | binary      | binary      | binary      |
| binary      | binary      | binary      | binary      | binary      | binary      | binary      |
+-------------+-------------+-------------+-------------+-------------+-------------+-------------+
SELECT COERCIBILITY(C1),COERCIBILITY(C2),COERCIBILITY(C3),COERCIBILITY(C4),COERCIBILITY(C5),COERCIBILITY(C6),COERCIBILITY(C7) FROM T1;
+------------------+------------------+------------------+------------------+------------------+------------------+------------------+
| COERCIBILITY(C1) | COERCIBILITY(C2) | COERCIBILITY(C3) | COERCIBILITY(C4) | COERCIBILITY(C5) | COERCIBILITY(C6) | COERCIBILITY(C7) |
+------------------+------------------+------------------+------------------+------------------+------------------+------------------+
|                5 |                5 |                5 |                5 |                5 |                5 |                5 |
|                5 |                5 |                5 |                5 |                5 |                5 |                5 |
|                5 |                5 |                5 |                5 |                5 |                5 |                5 |
|                5 |                5 |                5 |                5 |                5 |                5 |                5 |
|                5 |                5 |                5 |                5 |                5 |                5 |                5 |
|                5 |                5 |                5 |                5 |                5 |                5 |                5 |
|                5 |                5 |                5 |                5 |                5 |                5 |                5 |
|                5 |                5 |                5 |                5 |                5 |                5 |                5 |
|                5 |                5 |                5 |                5 |                5 |                5 |                5 |
|                5 |                5 |                5 |                5 |                5 |                5 |                5 |
|                5 |                5 |                5 |                5 |                5 |                5 |                5 |
+------------------+------------------+------------------+------------------+------------------+------------------+------------------+
SELECT COLLATION(C1),COLLATION(C2),COLLATION(C3),COLLATION(C4),COLLATION(C5),COLLATION(C6),COLLATION(C7) FROM T1;
+---------------+---------------+---------------+---------------+---------------+---------------+---------------+
| COLLATION(C1) | COLLATION(C2) | COLLATION(C3) | COLLATION(C4) | COLLATION(C5) | COLLATION(C6) | COLLATION(C7) |
+---------------+---------------+---------------+---------------+---------------+---------------+---------------+
| binary        | binary        | binary        | binary        | binary        | binary        | binary        |
| binary        | binary        | binary        | binary        | binary        | binary        | binary        |
| binary        | binary        | binary        | binary        | binary        | binary        | binary        |
| binary        | binary        | binary        | binary        | binary        | binary        | binary        |
| binary        | binary        | binary        | binary        | binary        | binary        | binary        |
| binary        | binary        | binary        | binary        | binary        | binary        | binary        |
| binary        | binary        | binary        | binary        | binary        | binary        | binary        |
| binary        | binary        | binary        | binary        | binary        | binary        | binary        |
| binary        | binary        | binary        | binary        | binary        | binary        | binary        |
| binary        | binary        | binary        | binary        | binary        | binary        | binary        |
| binary        | binary        | binary        | binary        | binary        | binary        | binary        |
+---------------+---------------+---------------+---------------+---------------+---------------+---------------+
##Á™óÂè£ÂáΩÊï∞##
##APPROX_COUNT_DISTINCT(expr) OVER over_clause##
SELECT APPROX_COUNT_DISTINCT(C1) OVER (PARTITION BY C2 ORDER BY C3 ROWS BETWEEN UNBOUNDED PRECEDING AND CURRENT ROW) COL FROM T1;
+------+
| COL  |
+------+
|    0 |
|    0 |
|    0 |
|    1 |
|    2 |
|    3 |
|    4 |
|    1 |
|    1 |
|    1 |
|    1 |
+------+
##AVG([ DISTINCT | ALL ] expr) OVER(analytic_clause) ##
SELECT AVG(C1) OVER (PARTITION BY C2 ORDER BY C3 RANGE BETWEEN 2 PRECEDING AND 2 FOLLOWING) COL FROM T1;
+-----------+
| COL       |
+-----------+
|      NULL |
|      NULL |
|      NULL |
|    0.0000 |
|    0.0000 |
| 1010.0000 |
| 5461.0000 |
|    0.0000 |
|    0.0000 |
|    0.0000 |
|    0.0000 |
+-----------+
##BIT_AND(expr) OVER (analytic_clause)##
SELECT BIT_AND(C1) OVER (PARTITION BY C2 ORDER BY C3 RANGE BETWEEN 2 PRECEDING AND 2 FOLLOWING) COL FROM T1;
+----------------------+
| COL                  |
+----------------------+
| 18446744073709551615 |
| 18446744073709551615 |
| 18446744073709551615 |
|                    1 |
|                    1 |
|                 1010 |
|                 5461 |
|                    0 |
|                    0 |
|                    0 |
|                    0 |
+----------------------+
##BIT_OR(expr) OVER (analytic_clause)##
SELECT BIT_OR(C1) OVER (PARTITION BY C2 ORDER BY C3 ROWS BETWEEN 2 PRECEDING AND 2 FOLLOWING) COL FROM T1;
+----------------------+
| COL                  |
+----------------------+
|                    0 |
| 18446744073709551615 |
| 18446744073709551615 |
| 18446744073709551615 |
| 18446744073709551615 |
| 18446744073709551615 |
|                 6135 |
|                    0 |
|                    0 |
|                    0 |
|                    0 |
+----------------------+
##BIT_XOR(expr) OVER (analytic_clause)##
SELECT BIT_XOR(C1) OVER (PARTITION BY C2 ORDER BY C3 ROWS BETWEEN 2 PRECEDING AND 2 FOLLOWING) COL FROM T1;
+----------------------+
| COL                  |
+----------------------+
|                    0 |
| 18446744073709551615 |
| 18446744073709551614 |
| 18446744073709550604 |
| 18446744073709545817 |
| 18446744073709545817 |
|                 5798 |
|                    0 |
|                    0 |
|                    0 |
|                    0 |
+----------------------+
##COUNT({ * | [ DISTINCT | ALL ] expr }) OVER (analytic_clause)##
SELECT COUNT(C1) OVER (PARTITION BY C2 ORDER BY C3 ROWS BETWEEN 2 PRECEDING AND 2 FOLLOWING) COL FROM T1;
+------+
| COL  |
+------+
|    0 |
|    1 |
|    2 |
|    3 |
|    4 |
|    4 |
|    3 |
|    1 |
|    2 |
|    2 |
|    1 |
+------+
##CUME_DIST() OVER ([ query_partition_clause ] order_by_clause)##
SELECT CUME_DIST() OVER (PARTITION BY C2 ORDER BY C3 ROWS BETWEEN 2 PRECEDING AND 2 FOLLOWING) COL FROM T1;
+---------------------+
| COL                 |
+---------------------+
| 0.42857142857142855 |
| 0.42857142857142855 |
| 0.42857142857142855 |
|  0.5714285714285714 |
|  0.7142857142857143 |
|  0.8571428571428571 |
|                   1 |
|                   1 |
|                   1 |
|                   1 |
|                   1 |
+---------------------+
##DENSE_RANK() OVER([ query_partition_clause ] order_by_clause)##
SELECT DENSE_RANK() OVER (PARTITION BY C2 ORDER BY C3 ROWS BETWEEN 2 PRECEDING AND 2 FOLLOWING) COL FROM T1;
+-----+
| COL |
+-----+
|   1 |
|   1 |
|   1 |
|   2 |
|   3 |
|   4 |
|   5 |
|   1 |
|   1 |
|   1 |
|   1 |
+-----+
##FIRST_VALUE/LAST_VALUE { (expr) [ {RESPECT | IGNORE} NULLS ] | (expr [ {RESPECT | IGNORE} NULLS ])} OVER (analytic_clause)##
SELECT FIRST_VALUE(C1) RESPECT NULLS OVER (PARTITION BY C2 ORDER BY C3 ROWS BETWEEN 2 PRECEDING AND 2 FOLLOWING) COL FROM T1;
+------+
| COL  |
+------+
| NULL |
| NULL |
| NULL |
| NULL |
| NULL |
|   -1 |
|    1 |
|    0 |
|    0 |
|    0 |
|    0 |
+------+
SELECT LAST_VALUE(C1) IGNORE NULLS OVER (PARTITION BY C2 ORDER BY C3 ROWS BETWEEN 2 PRECEDING AND 2 FOLLOWING) COL FROM T1;
+------+
| COL  |
+------+
| NULL |
|   -1 |
|    1 |
| 1010 |
| 5461 |
| 5461 |
| 5461 |
|    0 |
|    0 |
|    0 |
|    0 |
+------+
##LAG( value_expr [, offset [, default]]) [ { RESPECT | IGNORE } NULLS ] OVER ()##
SELECT LAG(C1,2,C2) IGNORE NULLS OVER (PARTITION BY C2 ORDER BY C3 ROWS BETWEEN 2 PRECEDING AND 2 FOLLOWING) COL FROM T1;
+---------------+
| COL           |
+---------------+
|          NULL |
|          NULL |
|          NULL |
|          NULL |
|          NULL |
| -1.0000000000 |
|  1.0000000000 |
| -0.1000000000 |
|  0.0000000000 |
|  0.0000000000 |
|  0.1230000000 |
+---------------+
SELECT LAG(C1,2) IGNORE NULLS OVER (PARTITION BY C2 ORDER BY C3 ROWS BETWEEN 2 PRECEDING AND 2 FOLLOWING) COL FROM T1;
+------+
| COL  |
+------+
| NULL |
| NULL |
| NULL |
| NULL |
| NULL |
|   -1 |
|    1 |
| NULL |
| NULL |
| NULL |
| NULL |
+------+
SELECT LAG(C1,2) OVER (PARTITION BY C2 ORDER BY C3 ROWS BETWEEN 2 PRECEDING AND 2 FOLLOWING) COL FROM T1;
+------+
| COL  |
+------+
| NULL |
| NULL |
| NULL |
| NULL |
| NULL |
|   -1 |
|    1 |
| NULL |
| NULL |
| NULL |
| NULL |
+------+
##LEAD ( value_expr [, offset [, default]]) [ { RESPECT | IGNORE } NULLS ] OVER ()##
SELECT LEAD(C1,2,C2) IGNORE NULLS OVER (PARTITION BY C2 ORDER BY C3 ROWS BETWEEN 2 PRECEDING AND 2 FOLLOWING) COL FROM T1;
+-----------------+
| COL             |
+-----------------+
|    1.0000000000 |
|    1.0000000000 |
|    1.0000000000 |
| 1010.0000000000 |
| 5461.0000000000 |
|            NULL |
|            NULL |
|   -0.1000000000 |
|    0.0000000000 |
|    0.0000000000 |
|    0.1230000000 |
+-----------------+
##MAX([ DISTINCT | ALL ] expr) OVER (analytic_clause)##
SELECT MAX(C1) OVER (PARTITION BY C2 ORDER BY C3 ROWS BETWEEN 2 PRECEDING AND 2 FOLLOWING) COL FROM T1;
+------+
| COL  |
+------+
| NULL |
|   -1 |
|    1 |
| 1010 |
| 5461 |
| 5461 |
| 5461 |
|    0 |
|    0 |
|    0 |
|    0 |
+------+
SELECT MAX(DISTINCT C1) OVER (PARTITION BY C2 ORDER BY C3 ROWS BETWEEN 2 PRECEDING AND 2 FOLLOWING) COL FROM T1;
+------+
| COL  |
+------+
| NULL |
|   -1 |
|    1 |
| 1010 |
| 5461 |
| 5461 |
| 5461 |
|    0 |
|    0 |
|    0 |
|    0 |
+------+
##MIN([ DISTINCT | ALL ] expr) OVER (analytic_clause)##
SELECT MIN(C1) OVER (PARTITION BY C2 ORDER BY C3 ROWS BETWEEN 2 PRECEDING AND 2 FOLLOWING) COL FROM T1;
+------+
| COL  |
+------+
| NULL |
|   -1 |
|   -1 |
|   -1 |
|   -1 |
|   -1 |
|    1 |
|    0 |
|    0 |
|    0 |
|    0 |
+------+
SELECT MIN(DISTINCT C1) OVER (PARTITION BY C2 ORDER BY C3 ROWS BETWEEN 2 PRECEDING AND 2 FOLLOWING) COL FROM T1;
+------+
| COL  |
+------+
| NULL |
|   -1 |
|   -1 |
|   -1 |
|   -1 |
|   -1 |
|    1 |
|    0 |
|    0 |
|    0 |
|    0 |
+------+
##NTH_VALUE (measure_expr, n) [ FROM { FIRST | LAST } ] [ { RESPECT | IGNORE } NULLS ] OVER (analytic_clause)##
SELECT NTH_VALUE(C1,2) FROM FIRST IGNORE NULLS OVER (PARTITION BY C2 ORDER BY C3 ROWS BETWEEN 2 PRECEDING AND 2 FOLLOWING) COL FROM T1;
+------+
| COL  |
+------+
| NULL |
| NULL |
|    1 |
|    1 |
|    1 |
|    1 |
| 1010 |
| NULL |
|    0 |
|    0 |
| NULL |
+------+
##NTILE(2) OVER ()##
SELECT NTILE(1) OVER (PARTITION BY C2 ORDER BY C3 ROWS BETWEEN 2 PRECEDING AND 2 FOLLOWING) COL FROM T1;
+------+
| COL  |
+------+
|    1 |
|    1 |
|    1 |
|    1 |
|    1 |
|    1 |
|    1 |
|    1 |
|    1 |
|    1 |
|    1 |
+------+
##PERCENT_RANK( ) OVER ()##
SELECT PERCENT_RANK() OVER (PARTITION BY C2 ORDER BY C3 ROWS BETWEEN 2 PRECEDING AND 3 FOLLOWING) COL FROM T1;
+--------------------+
| COL                |
+--------------------+
|                  0 |
|                  0 |
|                  0 |
|                0.5 |
| 0.6666666666666666 |
| 0.8333333333333334 |
|                  1 |
|                  0 |
|                  0 |
|                  0 |
|                  0 |
+--------------------+
##RANK() OVER ()##
SELECT RANK() OVER (PARTITION BY C2 ORDER BY C3 ROWS BETWEEN 2 PRECEDING AND 3 FOLLOWING) COL FROM T1;
+-----+
| COL |
+-----+
|   1 |
|   1 |
|   1 |
|   4 |
|   5 |
|   6 |
|   7 |
|   1 |
|   1 |
|   1 |
|   1 |
+-----+
##STD([ ALL] expr) OVER over_clause##
SELECT STD(C1) OVER (PARTITION BY C2 ORDER BY C3 ROWS BETWEEN 3 PRECEDING AND 4 FOLLOWING) COL FROM T1;
+--------------------+
| COL                |
+--------------------+
|                  1 |
|  476.1192661041512 |
| 2256.8873891933554 |
| 2256.8873891933554 |
| 2256.8873891933554 |
| 2256.8873891933554 |
| 2256.8873891933554 |
|                  0 |
|                  0 |
|                  0 |
|                  0 |
+--------------------+
##STDDEV([ ALL ] expr) OVER (analytic_clause)##
SELECT STDDEV(C1) OVER (PARTITION BY C2 ORDER BY C3 ROWS BETWEEN 3 PRECEDING AND 4 FOLLOWING) COL FROM T1;
+--------------------+
| COL                |
+--------------------+
|                  1 |
|  476.1192661041512 |
| 2256.8873891933554 |
| 2256.8873891933554 |
| 2256.8873891933554 |
| 2256.8873891933554 |
| 2256.8873891933554 |
|                  0 |
|                  0 |
|                  0 |
|                  0 |
+--------------------+
##STDDEV_POP([ ALL ] expr) OVER (analytic_clause)##
SELECT STDDEV_POP(C1) OVER (PARTITION BY C2 ORDER BY C3 ROWS BETWEEN 3 PRECEDING AND 4 FOLLOWING) COL FROM T1;
+--------------------+
| COL                |
+--------------------+
|                  1 |
|  476.1192661041512 |
| 2256.8873891933554 |
| 2256.8873891933554 |
| 2256.8873891933554 |
| 2256.8873891933554 |
| 2256.8873891933554 |
|                  0 |
|                  0 |
|                  0 |
|                  0 |
+--------------------+
##STDDEV_SAMP([ ALL ] expr) OVER (analytic_clause)##
SELECT STDDEV_SAMP(C1) OVER (PARTITION BY C2 ORDER BY C3 ROWS BETWEEN 3 PRECEDING AND 4 FOLLOWING) COL FROM T1;
+--------------------+
| COL                |
+--------------------+
| 1.4142135623730951 |
|  583.1246293317864 |
| 2606.0290833629106 |
| 2606.0290833629106 |
| 2606.0290833629106 |
| 2606.0290833629106 |
| 2606.0290833629106 |
|               NULL |
|                  0 |
|                  0 |
|               NULL |
+--------------------+
##SUM([ DISTINCT | ALL ] expr) OVER (analytic_clause)##
SELECT SUM(C1) OVER (PARTITION BY C2 ORDER BY C3 ROWS BETWEEN 3 PRECEDING AND 4 FOLLOWING) COL FROM T1;
+------+
| COL  |
+------+
|    0 |
| 1010 |
| 6471 |
| 6471 |
| 6471 |
| 6471 |
| 6471 |
|    0 |
|    0 |
|    0 |
|    0 |
+------+
SELECT SUM(C1) OVER (PARTITION BY C2 ORDER BY C3 ROWS BETWEEN 3 PRECEDING AND 4 FOLLOWING) COL FROM T1;
+------+
| COL  |
+------+
|    0 |
| 1010 |
| 6471 |
| 6471 |
| 6471 |
| 6471 |
| 6471 |
|    0 |
|    0 |
|    0 |
|    0 |
+------+
##VAR_POP([ALL] expr) OVER over_clause##
SELECT VAR_POP(C1) OVER (PARTITION BY C2 ORDER BY C3 ROWS BETWEEN 3 PRECEDING AND 4 FOLLOWING) COL FROM T1;
+--------------------+
| COL                |
+--------------------+
|                  1 |
| 226689.55555555556 |
|       5093540.6875 |
|       5093540.6875 |
|       5093540.6875 |
|       5093540.6875 |
|       5093540.6875 |
|                  0 |
|                  0 |
|                  0 |
|                  0 |
+--------------------+
##VAR_SAMP([ALL] expr) OVER over_clause##
SELECT VAR_SAMP(C1) OVER (PARTITION BY C2 ORDER BY C3 ROWS BETWEEN 3 PRECEDING AND 4 FOLLOWING) COL FROM T1;
+-------------------+
| COL               |
+-------------------+
|                 2 |
| 340034.3333333333 |
| 6791387.583333333 |
| 6791387.583333333 |
| 6791387.583333333 |
| 6791387.583333333 |
| 6791387.583333333 |
|              NULL |
|                 0 |
|                 0 |
|              NULL |
+-------------------+
##VARIANCE([ ALL ] expr) OVER (analytic_clause)##
SELECT VARIANCE(C1) OVER (PARTITION BY C2 ORDER BY C3 ROWS BETWEEN 3 PRECEDING AND 4 FOLLOWING) COL FROM T1;
+--------------------+
| COL                |
+--------------------+
|                  1 |
| 226689.55555555556 |
|       5093540.6875 |
|       5093540.6875 |
|       5093540.6875 |
|       5093540.6875 |
|       5093540.6875 |
|                  0 |
|                  0 |
|                  0 |
|                  0 |
+--------------------+
