ob1=OBI(cluster=1:1,proxy_num=0,init_unit_cpu=5);
ob1.reboot;
alter system set enable_auto_leader_switch = false;
use test;
drop table if exists t1;
Warnings:
Note	1051	Unknown table 'test.t1'
create table t1(a longtext, b longblob, c longtext, d longtext, e longtext);
set ob_query_timeout=100000000;
begin;
insert into t1 values('2', '2', '2', '2', '2');
commit;
select /*+read_consistency(weak)+*/ count(*) from t1;
count(*)
2
select /*+read_consistency(weak)+*/ a from t1 where a != '2';
a
aaaaaaaaaa
delete from t1;
begin;
commit;
select /*+read_consistency(weak)+*/ count(*) from t1;
count(*)
1
select /*+read_consistency(weak)+*/ a from t1;
a
aaaaaaaaaa
delete from t1;
begin;
commit;
select /*+read_consistency(weak)+*/ count(*) from t1;
count(*)
2
select /*+read_consistency(weak)+*/ a from t1;
a
aaaaaaaaaa
aaaaaaaaaa
delete from t1;
alter system set_tp tp_no = 42, error_code = 4023, frequency = 1;
begin;
commit;
alter system set_tp tp_no = 42, error_code = 4023, frequency = 0;
select /*+read_consistency(weak)+*/ count(*) from t1;
count(*)
2
delete from t1;
alter system set_tp tp_no = 42, error_code = 4023, frequency = 1;
begin;
commit;
alter system set_tp tp_no = 42, error_code = 4023, frequency = 0;
select /*+read_consistency(weak)+*/ count(*) from t1;
count(*)
2
select /*+read_consistency(weak)+*/ a from t1;
a
aaaaaaaaaa
aaaaaaaaaa
delete from t1;
