drop table t1;
drop table t2;
drop table t3;
create table t1(c1 int, c2 int, c3 int) partition by hash(c1) partitions 4;
create table t2(c1 int, c2 int, c3 int) partition by hash(c1) partitions 4;
create table t3(c1 int, c2 int, c3 int);
insert into t1 values (1,1,1),(2,2,2),(3,3,3);
insert into t2 values (1,2,3),(2,3,4),(3,4,5),(4,5,6);
insert into t3 values (1,1,1),(2,2,2),(3,3,3);
set autocommit = false;
result_format: 4
explain_protocol: 0
explain basic merge into t1 using (select * from t2 where c1 = 1) t2 on (t1.c2 = t2.c2) when matched then update set c3 = t2.c3 where t1.c1 = 2;
Query Plan
===============================
|ID|OPERATOR             |NAME|
-------------------------------
|0 |MERGE                |    |
|1 |└─HASH JOIN          |    |
|2 |  ├─SUBPLAN SCAN     |T2  |
|3 |  │ └─TABLE FULL SCAN|T2  |
|4 |  └─TABLE FULL SCAN  |T1  |
===============================
Outputs & filters:
-------------------------------------
  0 - output(nil), filter(nil)
      columns([{T1: ({T1: (T1.__pk_increment, T1.C1, T1.C2, T1.C3)})}]),
      update([T1.C3=column_conv(NUMBER,PS:(-1,0),NULL,T2.C3)]), 
      insert_conds(nil), update_conds(nil), delete_conds(nil)
  1 - output([T1.__pk_increment], [T1.C1], [T1.C2], [T1.C3], [T2.C3]), filter(nil), rowset=16
      equal_conds([T1.C2 = T2.C2]), other_conds(nil)
  2 - output([T2.C2], [T2.C3]), filter(nil), rowset=16
      access([T2.C2], [T2.C3])
  3 - output([T2.C2], [T2.C3]), filter([T2.C1 = 1]), rowset=16
      access([T2.C1], [T2.C2], [T2.C3]), partitions(p1)
      is_index_back=false, is_global_index=false, filter_before_indexback[false], 
      range_key([T2.__pk_increment]), range(MIN ; MAX)always true
  4 - output([T1.__pk_increment], [T1.C1], [T1.C2], [T1.C3]), filter([T1.C1 = 2]), rowset=16
      access([T1.__pk_increment], [T1.C1], [T1.C2], [T1.C3]), partitions(p0)
      is_index_back=false, is_global_index=false, filter_before_indexback[false], 
      range_key([T1.__pk_increment]), range(MIN ; MAX)always true
merge into t1 using (select * from t2 where c1 = 1) t2 on (t1.c2 = t2.c2) when matched then update set c3 = t2.c3 where t1.c1 = 2;
select * from t1;
+------+------+------+
| C1   | C2   | C3   |
+------+------+------+
|    2 |    2 |    3 |
|    1 |    1 |    1 |
|    3 |    3 |    3 |
+------+------+------+
rollback;
merge into t1 using (select * from t2 where c1 = 1) t2 on (t1.c2 = t2.c2) when matched then update set c3 = t2.c3 where t1.c1 = 2;
select is_hit_plan from sys.gv$ob_sql_audit where trace_id = last_trace_id() and query_sql like 'merge into%';
+-------------+
| IS_HIT_PLAN |
+-------------+
|           1 |
+-------------+
rollback;

explain basic merge into t1 partition (p0) using (select * from t2 partition (p0)) t2 on (t1.c2 = t2.c2) when matched then update set c3 = t2.c3;
Query Plan
===============================
|ID|OPERATOR             |NAME|
-------------------------------
|0 |DISTRIBUTED MERGE    |    |
|1 |└─HASH JOIN          |    |
|2 |  ├─SUBPLAN SCAN     |T2  |
|3 |  │ └─TABLE FULL SCAN|T2  |
|4 |  └─TABLE FULL SCAN  |T1  |
===============================
Outputs & filters:
-------------------------------------
  0 - output(nil), filter(nil)
      columns([{T1: ({T1: (T1.__pk_increment, T1.C1, T1.C2, T1.C3)})}]),
      update([T1.C3=column_conv(NUMBER,PS:(-1,0),NULL,T2.C3)]), 
      insert_conds(nil), update_conds(nil), delete_conds(nil)
  1 - output([T1.__pk_increment], [T1.C1], [T1.C2], [T1.C3], [T2.C3]), filter(nil), rowset=16
      equal_conds([T1.C2 = T2.C2]), other_conds(nil)
  2 - output([T2.C2], [T2.C3]), filter(nil), rowset=16
      access([T2.C2], [T2.C3])
  3 - output([T2.C2], [T2.C3]), filter(nil), rowset=16
      access([T2.C2], [T2.C3]), partitions(p0)
      is_index_back=false, is_global_index=false, 
      range_key([T2.__pk_increment]), range(MIN ; MAX)always true
  4 - output([T1.__pk_increment], [T1.C1], [T1.C2], [T1.C3]), filter(nil), rowset=16
      access([T1.__pk_increment], [T1.C1], [T1.C2], [T1.C3]), partitions(p0)
      is_index_back=false, is_global_index=false, 
      range_key([T1.__pk_increment]), range(MIN ; MAX)always true
merge into t1 partition (p0) using (select * from t2 partition (p0)) t2 on (t1.c2 = t2.c2) when matched then update set c3 = t2.c3;
select * from t1;
+------+------+------+
| C1   | C2   | C3   |
+------+------+------+
|    2 |    2 |    2 |
|    1 |    1 |    1 |
|    3 |    3 |    3 |
+------+------+------+
rollback;
merge into t1 partition (p0) using (select * from t2 partition (p0)) t2 on (t1.c2 = t2.c2) when matched then update set c3 = t2.c3;
select is_hit_plan from sys.gv$ob_sql_audit where trace_id = last_trace_id() and query_sql like 'merge into%';
+-------------+
| IS_HIT_PLAN |
+-------------+
|           1 |
+-------------+
rollback;

explain basic merge into t1 using (select * from t2 where 1 = 1) t2 on (t1.c1 = t2.c1) when matched then update set c3 = t2.c3 where 1 = 1;
Query Plan
=========================================
|ID|OPERATOR                   |NAME    |
-----------------------------------------
|0 |PX COORDINATOR             |        |
|1 |└─EXCHANGE OUT DISTR       |:EX10000|
|2 |  └─PX PARTITION ITERATOR  |        |
|3 |    └─MERGE                |        |
|4 |      └─HASH JOIN          |        |
|5 |        ├─SUBPLAN SCAN     |T2      |
|6 |        │ └─TABLE FULL SCAN|T2      |
|7 |        └─TABLE FULL SCAN  |T1      |
=========================================
Outputs & filters:
-------------------------------------
  0 - output(nil), filter(nil), rowset=16
  1 - output(nil), filter(nil), rowset=16
      dop=1
  2 - output(nil), filter(nil), rowset=16
      partition wise, force partition granule
  3 - output(nil), filter(nil)
      columns([{T1: ({T1: (T1.__pk_increment, T1.C1, T1.C2, T1.C3)})}]),
      update([T1.C3=column_conv(NUMBER,PS:(-1,0),NULL,T2.C3)]), 
      insert_conds(nil), update_conds(nil), delete_conds(nil)
  4 - output([T1.__pk_increment], [T1.C1], [T1.C2], [T1.C3], [T2.C3]), filter(nil), rowset=16
      equal_conds([T1.C1 = T2.C1]), other_conds(nil)
  5 - output([T2.C1], [T2.C3]), filter(nil), rowset=16
      access([T2.C1], [T2.C3])
  6 - output([T2.C1], [T2.C3]), filter(nil), rowset=16
      access([T2.C1], [T2.C3]), partitions(p[0-3])
      is_index_back=false, is_global_index=false, 
      range_key([T2.__pk_increment]), range(MIN ; MAX)always true
  7 - output([T1.__pk_increment], [T1.C1], [T1.C2], [T1.C3]), filter(nil), rowset=16
      access([T1.__pk_increment], [T1.C1], [T1.C2], [T1.C3]), partitions(p[0-3])
      is_index_back=false, is_global_index=false, 
      range_key([T1.__pk_increment]), range(MIN ; MAX)always true
merge into t1 using (select * from t2 where 1 = 1) t2 on (t1.c1 = t2.c1) when matched then update set c3 = t2.c3 where 1 = 1;
select * from t1;
+------+------+------+
| C1   | C2   | C3   |
+------+------+------+
|    2 |    2 |    4 |
|    1 |    1 |    3 |
|    3 |    3 |    5 |
+------+------+------+
rollback;
merge into t1 using (select * from t2 where 1 = 1) t2 on (t1.c1 = t2.c1) when matched then update set c3 = t2.c3 where 1 = 1;
select is_hit_plan from sys.gv$ob_sql_audit where trace_id = last_trace_id() and query_sql like 'merge into%';
+-------------+
| IS_HIT_PLAN |
+-------------+
|           1 |
+-------------+
rollback;

explain basic merge into t1 using (select * from t2 where 1 = 1) t2 on (t1.c2 = t2.c2) when matched then update set c3 = t2.c3 where 1 = 1;
Query Plan
=============================================
|ID|OPERATOR                       |NAME    |
---------------------------------------------
|0 |DISTRIBUTED MERGE              |        |
|1 |└─HASH JOIN                    |        |
|2 |  ├─PX COORDINATOR             |        |
|3 |  │ └─EXCHANGE OUT DISTR       |:EX10000|
|4 |  │   └─SUBPLAN SCAN           |T2      |
|5 |  │     └─PX PARTITION ITERATOR|        |
|6 |  │       └─TABLE FULL SCAN    |T2      |
|7 |  └─PX COORDINATOR             |        |
|8 |    └─EXCHANGE OUT DISTR       |:EX20000|
|9 |      └─PX PARTITION ITERATOR  |        |
|10|        └─TABLE FULL SCAN      |T1      |
=============================================
Outputs & filters:
-------------------------------------
  0 - output(nil), filter(nil)
      columns([{T1: ({T1: (T1.__pk_increment, T1.C1, T1.C2, T1.C3)})}]),
      update([T1.C3=column_conv(NUMBER,PS:(-1,0),NULL,T2.C3)]), 
      insert_conds(nil), update_conds(nil), delete_conds(nil)
  1 - output([T1.__pk_increment], [T1.C1], [T1.C2], [T1.C3], [T2.C3]), filter(nil), rowset=16
      equal_conds([T1.C2 = T2.C2]), other_conds(nil)
  2 - output([T2.C2], [T2.C3]), filter(nil), rowset=16
  3 - output([T2.C2], [T2.C3]), filter(nil), rowset=16
      dop=1
  4 - output([T2.C2], [T2.C3]), filter(nil), rowset=16
      access([T2.C2], [T2.C3])
  5 - output([T2.C2], [T2.C3]), filter(nil), rowset=16
      force partition granule
  6 - output([T2.C2], [T2.C3]), filter(nil), rowset=16
      access([T2.C2], [T2.C3]), partitions(p[0-3])
      is_index_back=false, is_global_index=false, 
      range_key([T2.__pk_increment]), range(MIN ; MAX)always true
  7 - output([T1.__pk_increment], [T1.C1], [T1.C2], [T1.C3]), filter(nil), rowset=16
  8 - output([T1.__pk_increment], [T1.C1], [T1.C2], [T1.C3]), filter(nil), rowset=16
      dop=1
  9 - output([T1.__pk_increment], [T1.C1], [T1.C2], [T1.C3]), filter(nil), rowset=16
      force partition granule
 10 - output([T1.__pk_increment], [T1.C1], [T1.C2], [T1.C3]), filter(nil), rowset=16
      access([T1.__pk_increment], [T1.C1], [T1.C2], [T1.C3]), partitions(p[0-3])
      is_index_back=false, is_global_index=false, 
      range_key([T1.__pk_increment]), range(MIN ; MAX)always true
merge into t1 using (select * from t2 where 1 = 1) t2 on (t1.c2 = t2.c2) when matched then update set c3 = t2.c3 where 1 = 1;
select * from t1;
+------+------+------+
| C1   | C2   | C3   |
+------+------+------+
|    2 |    2 |    3 |
|    1 |    1 |    1 |
|    3 |    3 |    4 |
+------+------+------+
rollback;
merge into t1 using (select * from t2 where 1 = 1) t2 on (t1.c2 = t2.c2) when matched then update set c3 = t2.c3 where 1 = 1;
select is_hit_plan from sys.gv$ob_sql_audit where trace_id = last_trace_id() and query_sql like 'merge into%';
+-------------+
| IS_HIT_PLAN |
+-------------+
|           1 |
+-------------+
rollback;

explain basic merge into t1 using (select * from t2 partition (p1)) t2 on (t1.c2 = t2.c2) when matched then update set c3 = t2.c3 where t1.c1 = 2 when not matched then insert values (t2.c3, t2.c2, t2.c1);
Query Plan
===========================================
|ID|OPERATOR                     |NAME    |
-------------------------------------------
|0 |DISTRIBUTED MERGE            |        |
|1 |└─HASH OUTER JOIN            |        |
|2 |  ├─SUBPLAN SCAN             |T2      |
|3 |  │ └─TABLE FULL SCAN        |T2      |
|4 |  └─PX COORDINATOR           |        |
|5 |    └─EXCHANGE OUT DISTR     |:EX10000|
|6 |      └─PX PARTITION ITERATOR|        |
|7 |        └─TABLE FULL SCAN    |T1      |
===========================================
Outputs & filters:
-------------------------------------
  0 - output(nil), filter(nil)
      columns([{T1: ({T1: (T1.__pk_increment, T1.C1, T1.C2, T1.C3)})}]), partitions(p[0-3]), 
      column_values([T_HIDDEN_PK], [column_conv(NUMBER,PS:(-1,0),NULL,T2.C3)], [column_conv(NUMBER,PS:(-1,0),NULL,T2.C2)], [column_conv(NUMBER,PS:(-1,0),
      NULL,T2.C1)]),
      update([T1.C3=column_conv(NUMBER,PS:(-1,0),NULL,T2.C3)]), 
      insert_conds(nil), update_conds([T1.C1 = 2]), delete_conds(nil)
  1 - output([T1.__pk_increment], [T1.C1], [T1.C2], [T1.C3], [T2.C3], [T2.C2], [T2.C1]), filter(nil), rowset=16
      equal_conds([T1.C2 = T2.C2]), other_conds(nil)
  2 - output([T2.C2], [T2.C3], [T2.C1]), filter(nil), rowset=16
      access([T2.C2], [T2.C3], [T2.C1])
  3 - output([T2.C1], [T2.C2], [T2.C3]), filter(nil), rowset=16
      access([T2.C1], [T2.C2], [T2.C3]), partitions(p1)
      is_index_back=false, is_global_index=false, 
      range_key([T2.__pk_increment]), range(MIN ; MAX)always true
  4 - output([T1.__pk_increment], [T1.C1], [T1.C2], [T1.C3]), filter(nil), rowset=16
  5 - output([T1.__pk_increment], [T1.C1], [T1.C2], [T1.C3]), filter(nil), rowset=16
      dop=1
  6 - output([T1.__pk_increment], [T1.C1], [T1.C2], [T1.C3]), filter(nil), rowset=16
      force partition granule
  7 - output([T1.__pk_increment], [T1.C1], [T1.C2], [T1.C3]), filter(nil), rowset=16
      access([T1.__pk_increment], [T1.C1], [T1.C2], [T1.C3]), partitions(p[0-3])
      is_index_back=false, is_global_index=false, 
      range_key([T1.__pk_increment]), range(MIN ; MAX)always true
merge into t1 using (select * from t2 partition (p1)) t2 on (t1.c2 = t2.c2) when matched then update set c3 = t2.c3 where t1.c1 = 2 when not matched then insert values (t2.c3, t2.c2, t2.c1);
select * from t1;
+------+------+------+
| C1   | C2   | C3   |
+------+------+------+
|    2 |    2 |    3 |
|    1 |    1 |    1 |
|    3 |    3 |    3 |
|    6 |    5 |    4 |
+------+------+------+
rollback;
merge into t1 using (select * from t2 partition (p1)) t2 on (t1.c2 = t2.c2) when matched then update set c3 = t2.c3 where t1.c1 = 2 when not matched then insert values (t2.c3, t2.c2, t2.c1);
select is_hit_plan from sys.gv$ob_sql_audit where trace_id = last_trace_id() and query_sql like 'merge into%';
+-------------+
| IS_HIT_PLAN |
+-------------+
|           1 |
+-------------+
rollback;

explain basic merge into t1 using (select * from t2 partition (p1)) t2 on (t1.c2 = t2.c2) when matched then update set c3 = t2.c3 where t1.c1 = 2 when not matched then insert values (t2.c1, t2.c2, t2.c3);
Query Plan
===========================================
|ID|OPERATOR                     |NAME    |
-------------------------------------------
|0 |DISTRIBUTED MERGE            |        |
|1 |└─HASH OUTER JOIN            |        |
|2 |  ├─SUBPLAN SCAN             |T2      |
|3 |  │ └─TABLE FULL SCAN        |T2      |
|4 |  └─PX COORDINATOR           |        |
|5 |    └─EXCHANGE OUT DISTR     |:EX10000|
|6 |      └─PX PARTITION ITERATOR|        |
|7 |        └─TABLE FULL SCAN    |T1      |
===========================================
Outputs & filters:
-------------------------------------
  0 - output(nil), filter(nil)
      columns([{T1: ({T1: (T1.__pk_increment, T1.C1, T1.C2, T1.C3)})}]), partitions(p[0-3]), 
      column_values([T_HIDDEN_PK], [column_conv(NUMBER,PS:(-1,0),NULL,T2.C1)], [column_conv(NUMBER,PS:(-1,0),NULL,T2.C2)], [column_conv(NUMBER,PS:(-1,0),
      NULL,T2.C3)]),
      update([T1.C3=column_conv(NUMBER,PS:(-1,0),NULL,T2.C3)]), 
      insert_conds(nil), update_conds([T1.C1 = 2]), delete_conds(nil)
  1 - output([T1.__pk_increment], [T1.C1], [T1.C2], [T1.C3], [T2.C3], [T2.C2], [T2.C1]), filter(nil), rowset=16
      equal_conds([T1.C2 = T2.C2]), other_conds(nil)
  2 - output([T2.C2], [T2.C1], [T2.C3]), filter(nil), rowset=16
      access([T2.C2], [T2.C1], [T2.C3])
  3 - output([T2.C1], [T2.C2], [T2.C3]), filter(nil), rowset=16
      access([T2.C1], [T2.C2], [T2.C3]), partitions(p1)
      is_index_back=false, is_global_index=false, 
      range_key([T2.__pk_increment]), range(MIN ; MAX)always true
  4 - output([T1.__pk_increment], [T1.C1], [T1.C2], [T1.C3]), filter(nil), rowset=16
  5 - output([T1.__pk_increment], [T1.C1], [T1.C2], [T1.C3]), filter(nil), rowset=16
      dop=1
  6 - output([T1.__pk_increment], [T1.C1], [T1.C2], [T1.C3]), filter(nil), rowset=16
      force partition granule
  7 - output([T1.__pk_increment], [T1.C1], [T1.C2], [T1.C3]), filter(nil), rowset=16
      access([T1.__pk_increment], [T1.C1], [T1.C2], [T1.C3]), partitions(p[0-3])
      is_index_back=false, is_global_index=false, 
      range_key([T1.__pk_increment]), range(MIN ; MAX)always true
merge into t1 using (select * from t2 partition (p1)) t2 on (t1.c2 = t2.c2) when matched then update set c3 = t2.c3 where t1.c1 = 2 when not matched then insert values (t2.c1, t2.c2, t2.c3);
select * from t1;
+------+------+------+
| C1   | C2   | C3   |
+------+------+------+
|    2 |    2 |    3 |
|    1 |    1 |    1 |
|    4 |    5 |    6 |
|    3 |    3 |    3 |
+------+------+------+
rollback;
merge into t1 using (select * from t2 partition (p1)) t2 on (t1.c2 = t2.c2) when matched then update set c3 = t2.c3 where t1.c1 = 2 when not matched then insert values (t2.c1, t2.c2, t2.c3);
select is_hit_plan from sys.gv$ob_sql_audit where trace_id = last_trace_id() and query_sql like 'merge into%';
+-------------+
| IS_HIT_PLAN |
+-------------+
|           1 |
+-------------+
rollback;

explain basic merge into t1 using (select * from t2 partition (p1)) t2 on (t1.c2 = t2.c2) when matched then update set c3 = t2.c3 where t1.c1 = 2 delete where t1.c3 <= 3;
Query Plan
===============================
|ID|OPERATOR             |NAME|
-------------------------------
|0 |MERGE                |    |
|1 |└─HASH JOIN          |    |
|2 |  ├─TABLE FULL SCAN  |T1  |
|3 |  └─SUBPLAN SCAN     |T2  |
|4 |    └─TABLE FULL SCAN|T2  |
===============================
Outputs & filters:
-------------------------------------
  0 - output(nil), filter(nil)
      columns([{T1: ({T1: (T1.__pk_increment, T1.C1, T1.C2, T1.C3)})}]),
      update([T1.C3=column_conv(NUMBER,PS:(-1,0),NULL,T2.C3)]), 
      insert_conds(nil), update_conds(nil), delete_conds([column_conv(NUMBER,PS:(-1,0),NULL,T2.C3) <= 3])
  1 - output([T1.__pk_increment], [T1.C1], [T1.C2], [T1.C3], [T2.C3]), filter(nil), rowset=16
      equal_conds([T1.C2 = T2.C2]), other_conds(nil)
  2 - output([T1.__pk_increment], [T1.C1], [T1.C2], [T1.C3]), filter([T1.C1 = 2]), rowset=16
      access([T1.__pk_increment], [T1.C1], [T1.C2], [T1.C3]), partitions(p0)
      is_index_back=false, is_global_index=false, filter_before_indexback[false], 
      range_key([T1.__pk_increment]), range(MIN ; MAX)always true
  3 - output([T2.C2], [T2.C3]), filter(nil), rowset=16
      access([T2.C2], [T2.C3])
  4 - output([T2.C2], [T2.C3]), filter(nil), rowset=16
      access([T2.C2], [T2.C3]), partitions(p1)
      is_index_back=false, is_global_index=false, 
      range_key([T2.__pk_increment]), range(MIN ; MAX)always true
merge into t1 using (select * from t2 partition (p1)) t2 on (t1.c2 = t2.c2) when matched then update set c3 = t2.c3 where t1.c1 = 2 delete where t1.c3 <= 3;
select * from t1;
+------+------+------+
| C1   | C2   | C3   |
+------+------+------+
|    1 |    1 |    1 |
|    3 |    3 |    3 |
+------+------+------+
rollback;
merge into t1 using (select * from t2 partition (p1)) t2 on (t1.c2 = t2.c2) when matched then update set c3 = t2.c3 where t1.c1 = 2 delete where t1.c3 <= 3;
select is_hit_plan from sys.gv$ob_sql_audit where trace_id = last_trace_id() and query_sql like 'merge into%';
+-------------+
| IS_HIT_PLAN |
+-------------+
|           1 |
+-------------+
rollback;

explain basic merge /*+PQ_DISTRIBUTE(T1 PARTITION NONE) LEADING(T2 T1) NO_USE_DISTRIBUTED_DML*/ into t1 using t2 on (t1.c1 = t2.c2) when matched then update set c3 = t2.c3;
Query Plan
=================================================
|ID|OPERATOR                           |NAME    |
-------------------------------------------------
|0 |DISTRIBUTED MERGE                  |        |
|1 |└─PX COORDINATOR                   |        |
|2 |  └─EXCHANGE OUT DISTR             |:EX10001|
|3 |    └─HASH JOIN                    |        |
|4 |      ├─EXCHANGE IN DISTR          |        |
|5 |      │ └─EXCHANGE OUT DISTR (PKEY)|:EX10000|
|6 |      │   └─PX PARTITION ITERATOR  |        |
|7 |      │     └─TABLE FULL SCAN      |T2      |
|8 |      └─PX PARTITION ITERATOR      |        |
|9 |        └─TABLE FULL SCAN          |T1      |
=================================================
Outputs & filters:
-------------------------------------
  0 - output(nil), filter(nil)
      columns([{T1: ({T1: (T1.__pk_increment, T1.C1, T1.C2, T1.C3)})}]),
      update([T1.C3=column_conv(NUMBER,PS:(-1,0),NULL,T2.C3)]), 
      insert_conds(nil), update_conds(nil), delete_conds(nil)
  1 - output([T1.__pk_increment], [T1.C1], [T1.C2], [T1.C3], [T2.C3]), filter(nil), rowset=16
  2 - output([T1.__pk_increment], [T1.C1], [T1.C2], [T1.C3], [T2.C3]), filter(nil), rowset=16
      dop=1
  3 - output([T1.__pk_increment], [T1.C1], [T1.C2], [T1.C3], [T2.C3]), filter(nil), rowset=16
      equal_conds([T1.C1 = T2.C2]), other_conds(nil)
  4 - output([T2.C2], [T2.C3]), filter(nil), rowset=16
  5 - output([T2.C2], [T2.C3]), filter(nil), rowset=16
      (#keys=1, [T2.C2]), dop=1
  6 - output([T2.C2], [T2.C3]), filter(nil), rowset=16
      force partition granule
  7 - output([T2.C2], [T2.C3]), filter(nil), rowset=16
      access([T2.C2], [T2.C3]), partitions(p[0-3])
      is_index_back=false, is_global_index=false, 
      range_key([T2.__pk_increment]), range(MIN ; MAX)always true
  8 - output([T1.__pk_increment], [T1.C1], [T1.C2], [T1.C3]), filter(nil), rowset=16
      affinitize, force partition granule
  9 - output([T1.__pk_increment], [T1.C1], [T1.C2], [T1.C3]), filter(nil), rowset=16
      access([T1.__pk_increment], [T1.C1], [T1.C2], [T1.C3]), partitions(p[0-3])
      is_index_back=false, is_global_index=false, 
      range_key([T1.__pk_increment]), range(MIN ; MAX)always true
merge /*+PQ_DISTRIBUTE(T1 PARTITION NONE) LEADING(T2 T1) NO_USE_DISTRIBUTED_DML*/ into t1 using t2 on (t1.c1 = t2.c2) when matched then update set c3 = t2.c3;
select * from t1;
+------+------+------+
| C1   | C2   | C3   |
+------+------+------+
|    2 |    2 |    3 |
|    1 |    1 |    1 |
|    3 |    3 |    4 |
+------+------+------+
rollback;

explain basic merge /*+PQ_DISTRIBUTE(T2 PARTITION NONE) LEADING(T3 T2) NO_USE_DISTRIBUTED_DML FULL(t3)*/ into t3 using t2 on (t3.c2 = t2.c1) when matched then update set c3 = t2.c3;
Query Plan
=================================================
|ID|OPERATOR                           |NAME    |
-------------------------------------------------
|0 |MERGE                              |        |
|1 |└─PX COORDINATOR                   |        |
|2 |  └─EXCHANGE OUT DISTR             |:EX10001|
|3 |    └─HASH JOIN                    |        |
|4 |      ├─EXCHANGE IN DISTR          |        |
|5 |      │ └─EXCHANGE OUT DISTR (PKEY)|:EX10000|
|6 |      │   └─TABLE FULL SCAN        |T3      |
|7 |      └─PX PARTITION ITERATOR      |        |
|8 |        └─TABLE FULL SCAN          |T2      |
=================================================
Outputs & filters:
-------------------------------------
  0 - output(nil), filter(nil)
      columns([{T3: ({T3: (T3.__pk_increment, T3.C1, T3.C2, T3.C3)})}]),
      update([T3.C3=column_conv(NUMBER,PS:(-1,0),NULL,T2.C3)]), 
      insert_conds(nil), update_conds(nil), delete_conds(nil)
  1 - output([T3.__pk_increment], [T3.C1], [T3.C2], [T3.C3], [T2.C3]), filter(nil), rowset=16
  2 - output([T3.__pk_increment], [T3.C1], [T3.C2], [T3.C3], [T2.C3]), filter(nil), rowset=16
      dop=1
  3 - output([T3.__pk_increment], [T3.C1], [T3.C2], [T3.C3], [T2.C3]), filter(nil), rowset=16
      equal_conds([T3.C2 = T2.C1]), other_conds(nil)
  4 - output([T3.__pk_increment], [T3.C1], [T3.C2], [T3.C3]), filter(nil), rowset=16
  5 - output([T3.__pk_increment], [T3.C1], [T3.C2], [T3.C3]), filter(nil), rowset=16
      (#keys=1, [T3.C2]), is_single, dop=1
  6 - output([T3.__pk_increment], [T3.C1], [T3.C2], [T3.C3]), filter(nil), rowset=16
      access([T3.__pk_increment], [T3.C1], [T3.C2], [T3.C3]), partitions(p0)
      is_index_back=false, is_global_index=false, 
      range_key([T3.__pk_increment]), range(MIN ; MAX)always true
  7 - output([T2.C1], [T2.C3]), filter(nil), rowset=16
      affinitize, force partition granule
  8 - output([T2.C1], [T2.C3]), filter(nil), rowset=16
      access([T2.C1], [T2.C3]), partitions(p[0-3])
      is_index_back=false, is_global_index=false, 
      range_key([T2.__pk_increment]), range(MIN ; MAX)always true
merge /*+PQ_DISTRIBUTE(T2 PARTITION NONE) LEADING(T3 T2) NO_USE_DISTRIBUTED_DML FULL(t3)*/ into t3 using t2 on (t3.c2 = t2.c1) when matched then update set c3 = t2.c3;
select * from t3;
+------+------+------+
| C1   | C2   | C3   |
+------+------+------+
|    1 |    1 |    3 |
|    2 |    2 |    4 |
|    3 |    3 |    5 |
+------+------+------+
rollback;

explain basic merge /*+PQ_DISTRIBUTE(T2 PARTITION NONE) LEADING(T1 T2) NO_USE_DISTRIBUTED_DML*/ into t1 using t2 on (t1.c1 = 1 and t1.c2 = t2.c1) when matched then update set c3 = t2.c3;
Query Plan
=================================================
|ID|OPERATOR                           |NAME    |
-------------------------------------------------
|0 |MERGE                              |        |
|1 |└─PX COORDINATOR                   |        |
|2 |  └─EXCHANGE OUT DISTR             |:EX10001|
|3 |    └─HASH JOIN                    |        |
|4 |      ├─EXCHANGE IN DISTR          |        |
|5 |      │ └─EXCHANGE OUT DISTR (PKEY)|:EX10000|
|6 |      │   └─TABLE FULL SCAN        |T1      |
|7 |      └─PX PARTITION ITERATOR      |        |
|8 |        └─TABLE FULL SCAN          |T2      |
=================================================
Outputs & filters:
-------------------------------------
  0 - output(nil), filter(nil)
      columns([{T1: ({T1: (T1.__pk_increment, T1.C1, T1.C2, T1.C3)})}]),
      update([T1.C3=column_conv(NUMBER,PS:(-1,0),NULL,T2.C3)]), 
      insert_conds(nil), update_conds(nil), delete_conds(nil)
  1 - output([T1.__pk_increment], [T1.C1], [T1.C2], [T1.C3], [T2.C3]), filter(nil), rowset=16
  2 - output([T1.__pk_increment], [T1.C1], [T1.C2], [T1.C3], [T2.C3]), filter(nil), rowset=16
      dop=1
  3 - output([T1.__pk_increment], [T1.C1], [T1.C2], [T1.C3], [T2.C3]), filter(nil), rowset=16
      equal_conds([T1.C2 = T2.C1]), other_conds(nil)
  4 - output([T1.__pk_increment], [T1.C1], [T1.C2], [T1.C3]), filter(nil), rowset=16
  5 - output([T1.__pk_increment], [T1.C1], [T1.C2], [T1.C3]), filter(nil), rowset=16
      (#keys=1, [T1.C2]), is_single, dop=1
  6 - output([T1.__pk_increment], [T1.C1], [T1.C2], [T1.C3]), filter([T1.C1 = 1]), rowset=16
      access([T1.__pk_increment], [T1.C1], [T1.C2], [T1.C3]), partitions(p1)
      is_index_back=false, is_global_index=false, filter_before_indexback[false], 
      range_key([T1.__pk_increment]), range(MIN ; MAX)always true
  7 - output([T2.C1], [T2.C3]), filter(nil), rowset=16
      affinitize, force partition granule
  8 - output([T2.C1], [T2.C3]), filter(nil), rowset=16
      access([T2.C1], [T2.C3]), partitions(p[0-3])
      is_index_back=false, is_global_index=false, 
      range_key([T2.__pk_increment]), range(MIN ; MAX)always true
merge /*+PQ_DISTRIBUTE(T2 PARTITION NONE) LEADING(T1 T2) NO_USE_DISTRIBUTED_DML*/ into t1 using t2 on (t1.c1 = 1 and t1.c2 = t2.c1) when matched then update set c3 = t2.c3;
select * from t1;
+------+------+------+
| C1   | C2   | C3   |
+------+------+------+
|    2 |    2 |    2 |
|    1 |    1 |    3 |
|    3 |    3 |    3 |
+------+------+------+
rollback;

explain basic merge /*+PQ_DISTRIBUTE(T2 PARTITION NONE) LEADING(T1 T2) NO_USE_DISTRIBUTED_DML*/ into t1 using t2 on (t1.c1 = 1 and t1.c2 = t2.c1) when not matched then insert values (1,t2.c2,t2.c3);
Query Plan
=================================================
|ID|OPERATOR                           |NAME    |
-------------------------------------------------
|0 |MERGE                              |        |
|1 |└─PX COORDINATOR                   |        |
|2 |  └─EXCHANGE OUT DISTR             |:EX10001|
|3 |    └─HASH RIGHT OUTER JOIN        |        |
|4 |      ├─EXCHANGE IN DISTR          |        |
|5 |      │ └─EXCHANGE OUT DISTR (PKEY)|:EX10000|
|6 |      │   └─TABLE FULL SCAN        |T1      |
|7 |      └─PX PARTITION ITERATOR      |        |
|8 |        └─TABLE FULL SCAN          |T2      |
=================================================
Outputs & filters:
-------------------------------------
  0 - output(nil), filter(nil)
      columns([{T1: ({T1: (T1.__pk_increment, T1.C1, T1.C2, T1.C3)})}]), partitions(p1), 
      column_values([T_HIDDEN_PK], [column_conv(NUMBER,PS:(-1,0),NULL,1)], [column_conv(NUMBER,PS:(-1,0),NULL,T2.C2)], [column_conv(NUMBER,PS:(-1,0),NULL,
      T2.C3)]), 
      insert_conds(nil), update_conds(nil), delete_conds(nil)
  1 - output([T1.__pk_increment], [T1.C1], [T1.C2], [T1.C3], [T2.C2], [T2.C3]), filter(nil), rowset=16
  2 - output([T1.__pk_increment], [T1.C1], [T1.C2], [T1.C3], [T2.C2], [T2.C3]), filter(nil), rowset=16
      dop=1
  3 - output([T1.__pk_increment], [T1.C1], [T1.C2], [T1.C3], [T2.C2], [T2.C3]), filter(nil), rowset=16
      equal_conds([T1.C2 = T2.C1]), other_conds(nil)
  4 - output([T1.__pk_increment], [T1.C1], [T1.C2], [T1.C3]), filter(nil), rowset=16
  5 - output([T1.__pk_increment], [T1.C1], [T1.C2], [T1.C3]), filter(nil), rowset=16
      (#keys=1, [T1.C2]), is_single, dop=1
  6 - output([T1.__pk_increment], [T1.C1], [T1.C2], [T1.C3]), filter([T1.C1 = 1]), rowset=16
      access([T1.__pk_increment], [T1.C1], [T1.C2], [T1.C3]), partitions(p1)
      is_index_back=false, is_global_index=false, filter_before_indexback[false], 
      range_key([T1.__pk_increment]), range(MIN ; MAX)always true
  7 - output([T2.C1], [T2.C2], [T2.C3]), filter(nil), rowset=16
      affinitize, force partition granule
  8 - output([T2.C1], [T2.C2], [T2.C3]), filter(nil), rowset=16
      access([T2.C1], [T2.C2], [T2.C3]), partitions(p[0-3])
      is_index_back=false, is_global_index=false, 
      range_key([T2.__pk_increment]), range(MIN ; MAX)always true
merge /*+PQ_DISTRIBUTE(T2 PARTITION NONE) LEADING(T1 T2) NO_USE_DISTRIBUTED_DML*/ into t1 using t2 on (t1.c1 = 1 and t1.c2 = t2.c1) when not matched then insert values (1,t2.c2,t2.c3);
select * from t1;
+------+------+------+
| C1   | C2   | C3   |
+------+------+------+
|    2 |    2 |    2 |
|    1 |    1 |    1 |
|    1 |    3 |    4 |
|    1 |    5 |    6 |
|    1 |    4 |    5 |
|    3 |    3 |    3 |
+------+------+------+
rollback;

drop table t1;
drop table t2;
drop table t3;

create global temporary table t1(c1 int, c2 int, c3 int) ON COMMIT PRESERVE ROWS;
create global temporary table t2(c1 int, c2 int, c3 int) ON COMMIT PRESERVE ROWS;
insert into t1 values (1,1,1),(2,2,2),(3,3,3),(4,4,4);
insert into t2 values (1,2,3),(2,3,4),(3,4,5),(5,6,7);

explain basic merge into t1 using t2 on (t1.c1 = t2.c1) when matched then update set T1.c2 = t2.c2;
Query Plan
===================================================
|ID|OPERATOR              |NAME                   |
---------------------------------------------------
|0 |MERGE                 |                       |
|1 |└─HASH JOIN           |                       |
|2 |  ├─SUBPLAN SCAN      |VIEW1                  |
|3 |  │ └─TABLE RANGE SCAN|T2(IDX_FOR_HEAP_GTT_T2)|
|4 |  └─SUBPLAN SCAN      |VIEW2                  |
|5 |    └─TABLE RANGE SCAN|T1(IDX_FOR_HEAP_GTT_T1)|
===================================================
Outputs & filters:
-------------------------------------
  0 - output(nil), filter(nil)
      columns([{VIEW2: ({T1: (VIEW2.T1.__pk_increment, VIEW2.T1.SYS_SESSION_ID, VIEW2.T1.SYS_SESS_CREATE_TIME, VIEW2.T1.C1, VIEW2.T1.C2, VIEW2.T1.C3)})}]),
      
      update([VIEW2.T1.C2=column_conv(NUMBER,PS:(-1,0),NULL,VIEW1.T2.C2)]), 
      insert_conds(nil), update_conds(nil), delete_conds(nil)
  1 - output([VIEW2.T1.__pk_increment], [VIEW2.T1.SYS_SESSION_ID], [VIEW2.T1.SYS_SESS_CREATE_TIME], [VIEW2.T1.C1], [VIEW2.T1.C2], [VIEW2.T1.C3], [VIEW1.T2.C2]), filter(nil), rowset=16
      equal_conds([VIEW2.T1.C1 = VIEW1.T2.C1]), other_conds(nil)
  2 - output([VIEW1.T2.C1], [VIEW1.T2.C2]), filter(nil), rowset=16
      access([VIEW1.T2.C1], [VIEW1.T2.C2])
  3 - output([T2.C1], [T2.C2]), filter(nil), rowset=16
      access([T2.C1], [T2.C2]), partition
      is_index_back=false, is_global_index=false, 
      range_key([T2.SYS_SESSION_ID], [T2.__pk_increment]), range(sessionid,MIN ; sessionid,MAX), 
      range_cond([T2.SYS_SESSION_ID = temp_table_ssid(0)])
  4 - output([VIEW2.T1.C1], [VIEW2.T1.__pk_increment], [VIEW2.T1.SYS_SESSION_ID], [VIEW2.T1.SYS_SESS_CREATE_TIME], [VIEW2.T1.C2], [VIEW2.T1.C3]), filter(nil), rowset=16
      access([VIEW2.T1.C1], [VIEW2.T1.__pk_increment], [VIEW2.T1.SYS_SESSION_ID], [VIEW2.T1.SYS_SESS_CREATE_TIME], [VIEW2.T1.C2], [VIEW2.T1.C3])
  5 - output([T1.C1], [T1.__pk_increment], [T1.SYS_SESSION_ID], [T1.SYS_SESS_CREATE_TIME], [T1.C2], [T1.C3]), filter(nil), rowset=16
      access([T1.__pk_increment], [T1.SYS_SESSION_ID], [T1.SYS_SESS_CREATE_TIME], [T1.C1], [T1.C2], [T1.C3]), partition
      is_index_back=true, is_global_index=false, 
      range_key([T1.SYS_SESSION_ID], [T1.__pk_increment]), range(sessionid,MIN ; sessionid,MAX), 
      range_cond([T1.SYS_SESSION_ID = temp_table_ssid(0)])

merge into t1 using t2 on (t1.c1 = t2.c1) when matched then update set T1.c2 = t2.c2;
select * from t1;
+------+------+------+
| C1   | C2   | C3   |
+------+------+------+
|    1 |    2 |    1 |
|    2 |    3 |    2 |
|    3 |    4 |    3 |
|    4 |    4 |    4 |
+------+------+------+
rollback;

merge into t1 using t2 on (t1.c1 = t2.c1) when matched then update set T1.c2 = t2.c2;
select is_hit_plan from sys.gv$ob_sql_audit where trace_id = last_trace_id() and query_sql like 'merge into%';
+-------------+
| IS_HIT_PLAN |
+-------------+
|           1 |
+-------------+

drop table t1;
drop table t2;
