result_format: 4
drop table if exists t1;
drop table if exists t2;
where conditions
create table t1 (c1 int, c2 varchar(100));
insert into t1 values (0, '全部明细');
insert into t1 values (1, '其他');
insert into t1 values (0, '全部明细');

select * from t1 where c1 = '全部明细';
+------+--------------+
| c1   | c2           |
+------+--------------+
|    0 | 全部明细     |
|    0 | 全部明细     |
+------+--------------+
Warnings:
Warning	1292	Truncated incorrect DECIMAL value: '全部明细'
Warning	1292	Truncated incorrect DECIMAL value: '全部明细'
select * from t1 where c1 = cast('全部明细' as decimal);
+------+--------------+
| c1   | c2           |
+------+--------------+
|    0 | 全部明细     |
|    0 | 全部明细     |
+------+--------------+
Warnings:
Warning	1292	Truncated incorrect DECIMAL value: '全部明细'
Warning	1292	Truncated incorrect DECIMAL value: '全部明细'
select * from t1 where c1 = c2;
+------+--------------+
| c1   | c2           |
+------+--------------+
|    0 | 全部明细     |
|    0 | 全部明细     |
+------+--------------+
Warnings:
Warning	1292	Truncated incorrect DECIMAL value: '全部明细'
Warning	1292	Truncated incorrect DECIMAL value: '其他'
Warning	1292	Truncated incorrect DECIMAL value: '全部明细'
select * from t1 where c1 = cast(c2 as decimal);
+------+--------------+
| c1   | c2           |
+------+--------------+
|    0 | 全部明细     |
|    0 | 全部明细     |
+------+--------------+
Warnings:
Warning	1292	Truncated incorrect DECIMAL value: '全部明细'
Warning	1292	Truncated incorrect DECIMAL value: '其他'
Warning	1292	Truncated incorrect DECIMAL value: '全部明细'

set sql_mode = 'strict_all_tables';
delete from t1 where c1 = '全部明细';
ERROR 22007: Truncated incorrect DECIMAL value: '全部明细'
delete from t1 where c1 = cast('全部明细' as decimal);
ERROR 22007: Truncated incorrect DECIMAL value: '全部明细'
delete from t1 where c1 = c2;
ERROR 22007: Truncated incorrect DECIMAL value: '全部明细'
delete from t1 where c1 = cast(c2 as decimal);
ERROR 22007: Truncated incorrect DECIMAL value: '全部明细'

set sql_mode = '';
set autocommit = 0;
delete from t1 where c1 = '全部明细';
Warnings:
Warning	1292	Truncated incorrect DECIMAL value: '全部明细'
Warning	1292	Truncated incorrect DECIMAL value: '全部明细'
rollback;

delete from t1 where c1 = cast('全部明细' as decimal);
Warnings:
Warning	1292	Truncated incorrect DECIMAL value: '全部明细'
Warning	1292	Truncated incorrect DECIMAL value: '全部明细'
rollback;

delete from t1 where c1 = c2;
Warnings:
Warning	1292	Truncated incorrect DECIMAL value: '全部明细'
Warning	1292	Truncated incorrect DECIMAL value: '其他'
Warning	1292	Truncated incorrect DECIMAL value: '全部明细'
rollback;

delete from t1 where c1 = cast(c2 as decimal);
Warnings:
Warning	1292	Truncated incorrect DECIMAL value: '全部明细'
Warning	1292	Truncated incorrect DECIMAL value: '其他'
Warning	1292	Truncated incorrect DECIMAL value: '全部明细'
rollback;

set autocommit = 1;
set sql_mode = 'strict_all_tables';
select * from t1;
+------+--------------+
| c1   | c2           |
+------+--------------+
|    0 | 全部明细     |
|    1 | 其他         |
|    0 | 全部明细     |
+------+--------------+

drop table t1;

dml operator
decimal_int
create table t1 (c1 decimal, c2 decimal(10, 2));
insert into t1 values ('全部明细', null);
ERROR HY000: Incorrect decimal value for column 'c1' at row 1
insert into t1 values (null, '全部明细');
ERROR HY000: Incorrect decimal value for column 'c2' at row 1
insert into t1 values ('1.23', null);
Warnings:
Warning	1265	Data truncated for column 'c1' at row 1
insert into t1 values (null, '2.345');
Warnings:
Warning	1265	Data truncated for column 'c2' at row 1
select * from t1;
+------+------+
| c1   | c2   |
+------+------+
|    1 | NULL |
| NULL | 2.35 |
+------+------+

set sql_mode = '';
insert into t1 values ('全部明细', null);
Warnings:
Warning	1366	Incorrect decimal value for column 'c1' at row 1
insert into t1 values (null, '全部明细');
Warnings:
Warning	1366	Incorrect decimal value for column 'c2' at row 1
insert into t1 values ('1.23', null);
Warnings:
Warning	1265	Data truncated for column 'c1' at row 1
insert into t1 values (null, '2.345');
Warnings:
Warning	1265	Data truncated for column 'c2' at row 1
select * from t1;
+------+------+
| c1   | c2   |
+------+------+
|    1 | NULL |
| NULL | 2.35 |
|    0 | NULL |
| NULL | 0.00 |
|    1 | NULL |
| NULL | 2.35 |
+------+------+

set sql_mode = 'strict_all_tables';
update t1 set c1 = '全部明细';
ERROR HY000: Incorrect decimal value for column 'c1' at row 1
update t1 set c1 = '1.23';
Warnings:
Warning	1265	Data truncated for column 'c1' at row 1
update t1 set c2 = '全部明细';
ERROR HY000: Incorrect decimal value for column 'c2' at row 1
update t1 set c2 = '2.345';
Warnings:
Warning	1265	Data truncated for column 'c2' at row 1
select * from t1;
+------+------+
| c1   | c2   |
+------+------+
|    1 | 2.35 |
|    1 | 2.35 |
|    1 | 2.35 |
|    1 | 2.35 |
|    1 | 2.35 |
|    1 | 2.35 |
+------+------+

set sql_mode = '';
update t1 set c1 = '全部明细';
Warnings:
Warning	1366	Incorrect decimal value for column 'c1' at row 1
update t1 set c1 = '1.23';
Warnings:
Warning	1265	Data truncated for column 'c1' at row 1
update t1 set c2 = '全部明细';
Warnings:
Warning	1366	Incorrect decimal value for column 'c2' at row 1
update t1 set c2 = '2.345';
Warnings:
Warning	1265	Data truncated for column 'c2' at row 1
select * from t1;
+------+------+
| c1   | c2   |
+------+------+
|    1 | 2.35 |
|    1 | 2.35 |
|    1 | 2.35 |
|    1 | 2.35 |
|    1 | 2.35 |
|    1 | 2.35 |
+------+------+

truncate table t1;

set sql_mode = 'strict_all_tables';
create table t2 (c1 varchar(200));
insert into t2 values ('全部明细'), ('1.23'), ('2.345');

insert into t1(c1) select * from t2;
ERROR HY000: Incorrect decimal value for column 'c1' at row 1
insert into t1(c2) select * from t2;
ERROR HY000: Incorrect decimal value for column 'c2' at row 1

set sql_mode = '';
insert into t1(c1) select * from t2;
Warnings:
Warning	1366	Incorrect decimal value for column 'c1' at row 1
Warning	1265	Data truncated for column 'c1' at row 2
Warning	1265	Data truncated for column 'c1' at row 3
insert into t1(c2) select * from t2;
Warnings:
Warning	1366	Incorrect decimal value for column 'c2' at row 1
Warning	1265	Data truncated for column 'c2' at row 3

drop table t1, t2;
alter system set _enable_decimal_int_type = false;
set sql_mode = 'strict_all_tables';
number
create table t1 (c1 decimal, c2 decimal(10, 2));
insert into t1 values ('全部明细', null);
ERROR HY000: Incorrect decimal value for column 'c1' at row 1
insert into t1 values (null, '全部明细');
ERROR HY000: Incorrect decimal value for column 'c2' at row 1
insert into t1 values ('1.23', null);
Warnings:
Warning	1265	Data truncated for column '"test"."t1"."c1"' at row 1
insert into t1 values (null, '2.345');
Warnings:
Warning	1265	Data truncated for column '"test"."t1"."c2"' at row 1
select * from t1;
+------+------+
| c1   | c2   |
+------+------+
|    1 | NULL |
| NULL | 2.35 |
+------+------+

set sql_mode = '';
insert into t1 values ('全部明细', null);
Warnings:
Warning	1366	Incorrect decimal value for column 'c1' at row 1
insert into t1 values (null, '全部明细');
Warnings:
Warning	1366	Incorrect decimal value for column 'c2' at row 1
insert into t1 values ('1.23', null);
Warnings:
Warning	1265	Data truncated for column '"test"."t1"."c1"' at row 1
insert into t1 values (null, '2.345');
Warnings:
Warning	1265	Data truncated for column '"test"."t1"."c2"' at row 1
select * from t1;
+------+------+
| c1   | c2   |
+------+------+
|    1 | NULL |
| NULL | 2.35 |
|    0 | NULL |
| NULL | 0.00 |
|    1 | NULL |
| NULL | 2.35 |
+------+------+

set sql_mode = 'strict_all_tables';
update t1 set c1 = '全部明细';
ERROR HY000: Incorrect decimal value for column 'c1' at row 1
update t1 set c1 = '1.23';
Warnings:
Warning	1265	Data truncated for column '"test"."t1"."c1"' at row 1
update t1 set c2 = '全部明细';
ERROR HY000: Incorrect decimal value for column 'c2' at row 1
update t1 set c2 = '2.345';
Warnings:
Warning	1265	Data truncated for column '"test"."t1"."c2"' at row 1
select * from t1;
+------+------+
| c1   | c2   |
+------+------+
|    1 | 2.35 |
|    1 | 2.35 |
|    1 | 2.35 |
|    1 | 2.35 |
|    1 | 2.35 |
|    1 | 2.35 |
+------+------+

set sql_mode = '';
update t1 set c1 = '全部明细';
Warnings:
Warning	1366	Incorrect decimal value for column 'c1' at row 1
update t1 set c1 = '1.23';
Warnings:
Warning	1265	Data truncated for column '"test"."t1"."c1"' at row 1
update t1 set c2 = '全部明细';
Warnings:
Warning	1366	Incorrect decimal value for column 'c2' at row 1
update t1 set c2 = '2.345';
Warnings:
Warning	1265	Data truncated for column '"test"."t1"."c2"' at row 1
select * from t1;
+------+------+
| c1   | c2   |
+------+------+
|    1 | 2.35 |
|    1 | 2.35 |
|    1 | 2.35 |
|    1 | 2.35 |
|    1 | 2.35 |
|    1 | 2.35 |
+------+------+

truncate table t1;

set sql_mode = 'strict_all_tables';
create table t2 (c1 varchar(200));
insert into t2 values ('全部明细'), ('1.23'), ('2.345');

insert into t1(c1) select * from t2;
ERROR HY000: Incorrect decimal value for column 'c1' at row 1
insert into t1(c2) select * from t2;
ERROR HY000: Incorrect decimal value for column 'c2' at row 1

set sql_mode = '';
insert into t1(c1) select * from t2;
Warnings:
Warning	1366	Incorrect decimal value for column 'c1' at row 1
Warning	1265	Data truncated for column '"test"."t1"."c1"' at row 2
Warning	1265	Data truncated for column '"test"."t1"."c1"' at row 3
insert into t1(c2) select * from t2;
Warnings:
Warning	1366	Incorrect decimal value for column 'c2' at row 1
Warning	1265	Data truncated for column '"test"."t1"."c2"' at row 3

drop table t1, t2;

alter system set _enable_decimal_int_type = true;
create table t1 (z0_test0 decimal(10,2));
ALTER TABLE t1 PARTITION BY range columns(Z0_TEST0) SUBPARTITION BY range columns(Z0_TEST0) (PARTITION P1 VALUES LESS THAN('M') (SUBPARTITION part01 VALUES LESS THAN('A'), SUBPARTITION part02 VALUES LESS THAN('B'), SUBPARTITION part03 VALUES LESS THAN('C'), SUBPARTITION part04 VALUES LESS THAN('D'), SUBPARTITION part05 VALUES LESS THAN
('E')), PARTITION P2 VALUES LESS THAN('Z') (SUBPARTITION part06 VALUES LESS THAN('A'), SUBPARTITION part07 VALUES LESS THAN('B'), SUBPARTITION part08 VALUES LESS THAN('C'), SUBPARTITION part09 VALUES LESS THAN('D'), SUBPARTITION part10 VALUES LESS THAN('E')));
ERROR HY000: VALUES LESS THAN value must be strictly increasing for each partition
drop table t1;
