# ----------------------------------------------------------------------
# Test of array_max.
# ----------------------------------------------------------------------
drop table if exists t1;
select array_max([NULL]);
array_max([NULL])
NULL
select array_max([1,2,3]);
array_max([1,2,3])
3
select array_max([1,2,4]);
array_max([1,2,4])
4
select array_max([1,2,-4]);
array_max([1,2,-4])
2
select array_max([1.1,2.2,4.4]);
array_max([1.1,2.2,4.4])
4.4
select array_max([1,2,NULL,3]);
array_max([1,2,NULL,3])
3
select array_max([[1,2]]);
ERROR 0A000: nested array not supported
select array_max([[1],[2]]);
ERROR 0A000: nested array not supported
select array_max(['1','2']);
array_max(['1','2'])
2
select array_max(['a','b','c','d']);
array_max(['a','b','c','d'])
d
select array_max(["hello", "hi"]);
array_max(["hello", "hi"])
hi
select array_max(['a','b',NULL,'c','d',NULL]);
array_max(['a','b',NULL,'c','d',NULL])
d
select array_max(array_append([1,2,3],4));
array_max(array_append([1,2,3],4))
4
select array_max(array_append(["hello", "world"],'OceanBase'));
array_max(array_append(["hello", "world"],'OceanBase'))
world
select array_min([NULL]);
array_min([NULL])
NULL
select array_min([1,2,3]);
array_min([1,2,3])
1
select array_min([1,2,4]);
array_min([1,2,4])
1
select array_min([1,2,-4]);
array_min([1,2,-4])
-4
select array_min([1.1,2.2,4.4]);
array_min([1.1,2.2,4.4])
1.1
select array_min([1,2,NULL,3]);
array_min([1,2,NULL,3])
1
select array_min([[1,2]]);
ERROR 0A000: nested array not supported
select array_min([[1],[2]]);
ERROR 0A000: nested array not supported
select array_min(['1','2']);
array_min(['1','2'])
1
select array_min(['a','b','c','d']);
array_min(['a','b','c','d'])
a
select array_min(["hello", "hi"]);
array_min(["hello", "hi"])
hello
select array_min(['a','b',NULL,'c','d',NULL]);
array_min(['a','b',NULL,'c','d',NULL])
a
select array_min(array_append([1,2,3],4));
array_min(array_append([1,2,3],4))
1
select array_min(array_append(["hello", "world"],'OceanBase'));
array_min(array_append(["hello", "world"],'OceanBase'))
OceanBase
CREATE TABLE t1 (id int primary key, arr_tint Array(TINYINT), arr_sint Array(SMALLINT), arr_int Array(INT), arr_bint Array(BIGINT),
arr_utint Array(TINYINT UNSIGNED), arr_usint Array(SMALLINT UNSIGNED), arr_uint Array(INT UNSIGNED), arr_ubint Array(BIGINT UNSIGNED),
arr_flt Array(FLOAT), arr_dob Array(DOUBLE), vec vector(3), vchar Array(varchar(10)));
INSERT INTO t1(id) VALUES(1);
INSERT INTO t1 VALUES(2, [-1,2,1], [-1,2,1], [-1,2,1], [-1,2,1],
[0,2,1], [0,2,1], [0,2,1], [0,2,1],
[-1,2,1], [-1,2,1], [-1,2,1], ["hello", "world", "OceanBase"]);
INSERT INTO t1 VALUES(3, [-128,NULL,127], [-32768,NULL,32767], [-2147483648,NULL,2147483647], [-9223372036854775808,NULL,9223372036854775807],
[0,NULL,255], [0,NULL,65535], [0,NULL,4294967295], [0,NULL,9223372036854775807],
[-3.402823466E+38,NULL,-1.175494351E-38], [-1.7976931348623157E+308,NULL,-2.2250738585072014E-308], [0,0,0], ["hello",NULL,"hi"]);
select arr_tint, array_max(arr_tint) from t1;
arr_tint	array_max(arr_tint)
NULL	NULL
[-1,2,1]	2
[-128,NULL,127]	127
select arr_sint, array_max(arr_sint) from t1;
arr_sint	array_max(arr_sint)
NULL	NULL
[-1,2,1]	2
[-32768,NULL,32767]	32767
select arr_int, array_max(arr_int) from t1;
arr_int	array_max(arr_int)
NULL	NULL
[-1,2,1]	2
[-2147483648,NULL,2147483647]	2147483647
select arr_bint, array_max(arr_bint) from t1;
arr_bint	array_max(arr_bint)
NULL	NULL
[-1,2,1]	2
[-9223372036854775808,NULL,9223372036854775807]	9223372036854775807
select arr_utint, array_max(arr_utint) from t1;
arr_utint	array_max(arr_utint)
NULL	NULL
[0,2,1]	2
[0,NULL,255]	255
select arr_usint, array_max(arr_usint) from t1;
arr_usint	array_max(arr_usint)
NULL	NULL
[0,2,1]	2
[0,NULL,65535]	65535
select arr_uint, array_max(arr_uint) from t1;
arr_uint	array_max(arr_uint)
NULL	NULL
[0,2,1]	2
[0,NULL,4294967295]	4294967295
select arr_ubint, array_max(arr_ubint) from t1;
arr_ubint	array_max(arr_ubint)
NULL	NULL
[0,2,1]	2
[0,NULL,9223372036854775807]	9223372036854775807
select arr_flt, array_max(arr_flt) from t1;
arr_flt	array_max(arr_flt)
NULL	NULL
[-1,2,1]	2
[-3.40282e38,NULL,-1.17549e-38]	-1.17549e-38
select arr_dob, array_max(arr_dob) from t1;
arr_dob	array_max(arr_dob)
NULL	NULL
[-1,2,1]	2
[-1.7976931348623157e308,NULL,-2.2250738585072014e-308]	-2.2250738585072014e-308
select vec, array_max(vec) from t1;
vec	array_max(vec)
NULL	NULL
[-1,2,1]	2
[0,0,0]	0
select vec, array_max(vchar) from t1;
vec	array_max(vchar)
NULL	NULL
[-1,2,1]	world
[0,0,0]	hi
select /*+ OPT_PARAM('enable_rich_vector_format', 'FALSE') */ arr_tint, array_max(arr_tint) from t1;
arr_tint	array_max(arr_tint)
NULL	NULL
[-1,2,1]	2
[-128,NULL,127]	127
select /*+ OPT_PARAM('enable_rich_vector_format', 'FALSE') */ arr_sint, array_max(arr_sint) from t1;
arr_sint	array_max(arr_sint)
NULL	NULL
[-1,2,1]	2
[-32768,NULL,32767]	32767
select /*+ OPT_PARAM('enable_rich_vector_format', 'FALSE') */ arr_int, array_max(arr_int) from t1;
arr_int	array_max(arr_int)
NULL	NULL
[-1,2,1]	2
[-2147483648,NULL,2147483647]	2147483647
select /*+ OPT_PARAM('enable_rich_vector_format', 'FALSE') */ arr_bint, array_max(arr_bint) from t1;
arr_bint	array_max(arr_bint)
NULL	NULL
[-1,2,1]	2
[-9223372036854775808,NULL,9223372036854775807]	9223372036854775807
select /*+ OPT_PARAM('enable_rich_vector_format', 'FALSE') */ arr_utint, array_max(arr_utint) from t1;
arr_utint	array_max(arr_utint)
NULL	NULL
[0,2,1]	2
[0,NULL,255]	255
select /*+ OPT_PARAM('enable_rich_vector_format', 'FALSE') */ arr_usint, array_max(arr_usint) from t1;
arr_usint	array_max(arr_usint)
NULL	NULL
[0,2,1]	2
[0,NULL,65535]	65535
select /*+ OPT_PARAM('enable_rich_vector_format', 'FALSE') */ arr_uint, array_max(arr_uint) from t1;
arr_uint	array_max(arr_uint)
NULL	NULL
[0,2,1]	2
[0,NULL,4294967295]	4294967295
select /*+ OPT_PARAM('enable_rich_vector_format', 'FALSE') */ arr_ubint, array_max(arr_ubint) from t1;
arr_ubint	array_max(arr_ubint)
NULL	NULL
[0,2,1]	2
[0,NULL,9223372036854775807]	9223372036854775807
select /*+ OPT_PARAM('enable_rich_vector_format', 'FALSE') */ arr_flt, array_max(arr_flt) from t1;
arr_flt	array_max(arr_flt)
NULL	NULL
[-1,2,1]	2
[-3.40282e38,NULL,-1.17549e-38]	-1.17549e-38
select /*+ OPT_PARAM('enable_rich_vector_format', 'FALSE') */ arr_dob, array_max(arr_dob) from t1;
arr_dob	array_max(arr_dob)
NULL	NULL
[-1,2,1]	2
[-1.7976931348623157e308,NULL,-2.2250738585072014e-308]	-2.2250738585072014e-308
select /*+ OPT_PARAM('enable_rich_vector_format', 'FALSE') */ vec, array_max(vec) from t1;
vec	array_max(vec)
NULL	NULL
[-1,2,1]	2
[0,0,0]	0
select /*+ OPT_PARAM('enable_rich_vector_format', 'FALSE') */ vec, array_max(vchar) from t1;
vec	array_max(vchar)
NULL	NULL
[-1,2,1]	world
[0,0,0]	hi
select /*+ OPT_PARAM('rowsets_enabled', 'FALSE') */ arr_tint, array_max(arr_tint) from t1;
arr_tint	array_max(arr_tint)
NULL	NULL
[-1,2,1]	2
[-128,NULL,127]	127
select /*+ OPT_PARAM('rowsets_enabled', 'FALSE') */ arr_sint, array_max(arr_sint) from t1;
arr_sint	array_max(arr_sint)
NULL	NULL
[-1,2,1]	2
[-32768,NULL,32767]	32767
select /*+ OPT_PARAM('rowsets_enabled', 'FALSE') */ arr_int, array_max(arr_int) from t1;
arr_int	array_max(arr_int)
NULL	NULL
[-1,2,1]	2
[-2147483648,NULL,2147483647]	2147483647
select /*+ OPT_PARAM('rowsets_enabled', 'FALSE') */ arr_bint, array_max(arr_bint) from t1;
arr_bint	array_max(arr_bint)
NULL	NULL
[-1,2,1]	2
[-9223372036854775808,NULL,9223372036854775807]	9223372036854775807
select /*+ OPT_PARAM('rowsets_enabled', 'FALSE') */ arr_utint, array_max(arr_utint) from t1;
arr_utint	array_max(arr_utint)
NULL	NULL
[0,2,1]	2
[0,NULL,255]	255
select /*+ OPT_PARAM('rowsets_enabled', 'FALSE') */ arr_usint, array_max(arr_usint) from t1;
arr_usint	array_max(arr_usint)
NULL	NULL
[0,2,1]	2
[0,NULL,65535]	65535
select /*+ OPT_PARAM('rowsets_enabled', 'FALSE') */ arr_uint, array_max(arr_uint) from t1;
arr_uint	array_max(arr_uint)
NULL	NULL
[0,2,1]	2
[0,NULL,4294967295]	4294967295
select /*+ OPT_PARAM('rowsets_enabled', 'FALSE') */ arr_ubint, array_max(arr_ubint) from t1;
arr_ubint	array_max(arr_ubint)
NULL	NULL
[0,2,1]	2
[0,NULL,9223372036854775807]	9223372036854775807
select /*+ OPT_PARAM('rowsets_enabled', 'FALSE') */ arr_flt, array_max(arr_flt) from t1;
arr_flt	array_max(arr_flt)
NULL	NULL
[-1,2,1]	2
[-3.40282e38,NULL,-1.17549e-38]	-1.17549e-38
select /*+ OPT_PARAM('rowsets_enabled', 'FALSE') */ arr_dob, array_max(arr_dob) from t1;
arr_dob	array_max(arr_dob)
NULL	NULL
[-1,2,1]	2
[-1.7976931348623157e308,NULL,-2.2250738585072014e-308]	-2.2250738585072014e-308
select /*+ OPT_PARAM('rowsets_enabled', 'FALSE') */ vec, array_max(vec) from t1;
vec	array_max(vec)
NULL	NULL
[-1,2,1]	2
[0,0,0]	0
select /*+ OPT_PARAM('rowsets_enabled', 'FALSE') */ vec, array_max(vchar) from t1;
vec	array_max(vchar)
NULL	NULL
[-1,2,1]	world
[0,0,0]	hi
select arr_tint, array_min(arr_tint) from t1;
arr_tint	array_min(arr_tint)
NULL	NULL
[-1,2,1]	-1
[-128,NULL,127]	-128
select arr_sint, array_min(arr_sint) from t1;
arr_sint	array_min(arr_sint)
NULL	NULL
[-1,2,1]	-1
[-32768,NULL,32767]	-32768
select arr_int, array_min(arr_int) from t1;
arr_int	array_min(arr_int)
NULL	NULL
[-1,2,1]	-1
[-2147483648,NULL,2147483647]	-2147483648
select arr_bint, array_min(arr_bint) from t1;
arr_bint	array_min(arr_bint)
NULL	NULL
[-1,2,1]	-1
[-9223372036854775808,NULL,9223372036854775807]	-9223372036854775808
select arr_utint, array_min(arr_utint) from t1;
arr_utint	array_min(arr_utint)
NULL	NULL
[0,2,1]	0
[0,NULL,255]	0
select arr_usint, array_min(arr_usint) from t1;
arr_usint	array_min(arr_usint)
NULL	NULL
[0,2,1]	0
[0,NULL,65535]	0
select arr_uint, array_min(arr_uint) from t1;
arr_uint	array_min(arr_uint)
NULL	NULL
[0,2,1]	0
[0,NULL,4294967295]	0
select arr_ubint, array_min(arr_ubint) from t1;
arr_ubint	array_min(arr_ubint)
NULL	NULL
[0,2,1]	0
[0,NULL,9223372036854775807]	0
select arr_flt, array_min(arr_flt) from t1;
arr_flt	array_min(arr_flt)
NULL	NULL
[-1,2,1]	-1
[-3.40282e38,NULL,-1.17549e-38]	-3.40282e38
select arr_dob, array_min(arr_dob) from t1;
arr_dob	array_min(arr_dob)
NULL	NULL
[-1,2,1]	-1
[-1.7976931348623157e308,NULL,-2.2250738585072014e-308]	-1.7976931348623157e308
select vec, array_min(vec) from t1;
vec	array_min(vec)
NULL	NULL
[-1,2,1]	-1
[0,0,0]	0
select vec, array_min(vchar) from t1;
vec	array_min(vchar)
NULL	NULL
[-1,2,1]	OceanBase
[0,0,0]	hello
select /*+ OPT_PARAM('enable_rich_vector_format', 'FALSE') */ arr_tint, array_min(arr_tint) from t1;
arr_tint	array_min(arr_tint)
NULL	NULL
[-1,2,1]	-1
[-128,NULL,127]	-128
select /*+ OPT_PARAM('enable_rich_vector_format', 'FALSE') */ arr_sint, array_min(arr_sint) from t1;
arr_sint	array_min(arr_sint)
NULL	NULL
[-1,2,1]	-1
[-32768,NULL,32767]	-32768
select /*+ OPT_PARAM('enable_rich_vector_format', 'FALSE') */ arr_int, array_min(arr_int) from t1;
arr_int	array_min(arr_int)
NULL	NULL
[-1,2,1]	-1
[-2147483648,NULL,2147483647]	-2147483648
select /*+ OPT_PARAM('enable_rich_vector_format', 'FALSE') */ arr_bint, array_min(arr_bint) from t1;
arr_bint	array_min(arr_bint)
NULL	NULL
[-1,2,1]	-1
[-9223372036854775808,NULL,9223372036854775807]	-9223372036854775808
select /*+ OPT_PARAM('enable_rich_vector_format', 'FALSE') */ arr_utint, array_min(arr_utint) from t1;
arr_utint	array_min(arr_utint)
NULL	NULL
[0,2,1]	0
[0,NULL,255]	0
select /*+ OPT_PARAM('enable_rich_vector_format', 'FALSE') */ arr_usint, array_min(arr_usint) from t1;
arr_usint	array_min(arr_usint)
NULL	NULL
[0,2,1]	0
[0,NULL,65535]	0
select /*+ OPT_PARAM('enable_rich_vector_format', 'FALSE') */ arr_uint, array_min(arr_uint) from t1;
arr_uint	array_min(arr_uint)
NULL	NULL
[0,2,1]	0
[0,NULL,4294967295]	0
select /*+ OPT_PARAM('enable_rich_vector_format', 'FALSE') */ arr_ubint, array_min(arr_ubint) from t1;
arr_ubint	array_min(arr_ubint)
NULL	NULL
[0,2,1]	0
[0,NULL,9223372036854775807]	0
select /*+ OPT_PARAM('enable_rich_vector_format', 'FALSE') */ arr_flt, array_min(arr_flt) from t1;
arr_flt	array_min(arr_flt)
NULL	NULL
[-1,2,1]	-1
[-3.40282e38,NULL,-1.17549e-38]	-3.40282e38
select /*+ OPT_PARAM('enable_rich_vector_format', 'FALSE') */ arr_dob, array_min(arr_dob) from t1;
arr_dob	array_min(arr_dob)
NULL	NULL
[-1,2,1]	-1
[-1.7976931348623157e308,NULL,-2.2250738585072014e-308]	-1.7976931348623157e308
select /*+ OPT_PARAM('enable_rich_vector_format', 'FALSE') */ vec, array_min(vec) from t1;
vec	array_min(vec)
NULL	NULL
[-1,2,1]	-1
[0,0,0]	0
select /*+ OPT_PARAM('enable_rich_vector_format', 'FALSE') */ vec, array_min(vchar) from t1;
vec	array_min(vchar)
NULL	NULL
[-1,2,1]	OceanBase
[0,0,0]	hello
select /*+ OPT_PARAM('rowsets_enabled', 'FALSE') */ arr_tint, array_min(arr_tint) from t1;
arr_tint	array_min(arr_tint)
NULL	NULL
[-1,2,1]	-1
[-128,NULL,127]	-128
select /*+ OPT_PARAM('rowsets_enabled', 'FALSE') */ arr_sint, array_min(arr_sint) from t1;
arr_sint	array_min(arr_sint)
NULL	NULL
[-1,2,1]	-1
[-32768,NULL,32767]	-32768
select /*+ OPT_PARAM('rowsets_enabled', 'FALSE') */ arr_int, array_min(arr_int) from t1;
arr_int	array_min(arr_int)
NULL	NULL
[-1,2,1]	-1
[-2147483648,NULL,2147483647]	-2147483648
select /*+ OPT_PARAM('rowsets_enabled', 'FALSE') */ arr_bint, array_min(arr_bint) from t1;
arr_bint	array_min(arr_bint)
NULL	NULL
[-1,2,1]	-1
[-9223372036854775808,NULL,9223372036854775807]	-9223372036854775808
select /*+ OPT_PARAM('rowsets_enabled', 'FALSE') */ arr_utint, array_min(arr_utint) from t1;
arr_utint	array_min(arr_utint)
NULL	NULL
[0,2,1]	0
[0,NULL,255]	0
select /*+ OPT_PARAM('rowsets_enabled', 'FALSE') */ arr_usint, array_min(arr_usint) from t1;
arr_usint	array_min(arr_usint)
NULL	NULL
[0,2,1]	0
[0,NULL,65535]	0
select /*+ OPT_PARAM('rowsets_enabled', 'FALSE') */ arr_uint, array_min(arr_uint) from t1;
arr_uint	array_min(arr_uint)
NULL	NULL
[0,2,1]	0
[0,NULL,4294967295]	0
select /*+ OPT_PARAM('rowsets_enabled', 'FALSE') */ arr_ubint, array_min(arr_ubint) from t1;
arr_ubint	array_min(arr_ubint)
NULL	NULL
[0,2,1]	0
[0,NULL,9223372036854775807]	0
select /*+ OPT_PARAM('rowsets_enabled', 'FALSE') */ arr_flt, array_min(arr_flt) from t1;
arr_flt	array_min(arr_flt)
NULL	NULL
[-1,2,1]	-1
[-3.40282e38,NULL,-1.17549e-38]	-3.40282e38
select /*+ OPT_PARAM('rowsets_enabled', 'FALSE') */ arr_dob, array_min(arr_dob) from t1;
arr_dob	array_min(arr_dob)
NULL	NULL
[-1,2,1]	-1
[-1.7976931348623157e308,NULL,-2.2250738585072014e-308]	-1.7976931348623157e308
select /*+ OPT_PARAM('rowsets_enabled', 'FALSE') */ vec, array_min(vec) from t1;
vec	array_min(vec)
NULL	NULL
[-1,2,1]	-1
[0,0,0]	0
select /*+ OPT_PARAM('rowsets_enabled', 'FALSE') */ vec, array_min(vchar) from t1;
vec	array_min(vchar)
NULL	NULL
[-1,2,1]	OceanBase
[0,0,0]	hello
drop table if exists t_create;
create table t_create as select array_max(NULL), array_max([1,2,3,4]), array_min(NULL), array_min([1,2,3,4]);
desc t_create;
Field	Type	Null	Key	Default	Extra
array_max(NULL)	tinyint unsigned	YES		NULL	
array_max([1,2,3,4])	bigint(20)	YES		NULL	
array_min(NULL)	tinyint unsigned	YES		NULL	
array_min([1,2,3,4])	bigint(20)	YES		NULL	
select * from t_create;
array_max(NULL)	array_max([1,2,3,4])	array_min(NULL)	array_min([1,2,3,4])
NULL	4	NULL	1
drop table t_create;
create table t_create as select array_max(NULL), array_max(arr_tint), array_min(NULL), array_min(arr_tint) from t1;
desc t_create;
Field	Type	Null	Key	Default	Extra
array_max(NULL)	tinyint unsigned	YES		NULL	
array_max(arr_tint)	tinyint(4)	YES		NULL	
array_min(NULL)	tinyint unsigned	YES		NULL	
array_min(arr_tint)	tinyint(4)	YES		NULL	
select * from t_create;
array_max(NULL)	array_max(arr_tint)	array_min(NULL)	array_min(arr_tint)
NULL	NULL	NULL	NULL
NULL	2	NULL	-1
NULL	127	NULL	-128
drop table t_create;
with array_data as (
select id, arr_tint from t1
where id IN (2, 3)
)
select id, array_max(arr_tint), array_min(arr_tint) from array_data order by id;
id	array_max(arr_tint)	array_min(arr_tint)
2	2	-1
3	127	-128
with tmax as (
select id, array_max(arr_tint), array_min(arr_tint) from t1
)
select * from tmax order by id;
id	array_max(arr_tint)	array_min(arr_tint)
1	NULL	NULL
2	2	-1
3	127	-128
INSERT IGNORE INTO t1(id, arr_tint) select id + 2, [array_max(arr_tint), array_min(arr_tint)] from t1;
INSERT INTO t1(id, arr_tint) VALUES(6, [array_max(null)]);
INSERT INTO t1(id, arr_tint) VALUES(7, [null]);
REPLACE INTO t1(id, arr_tint) VALUES(7, [array_max([1,2,4]), array_min([1,2,4])]);
select id, arr_tint from t1 order by id;
id	arr_tint
1	NULL
2	[-1,2,1]
3	[-128,NULL,127]
4	[2,-1]
5	[127,-128]
6	[NULL]
7	[4,1]
update /*+ ENABLE_PARALLEL_DML parallel(256) */
t1 set arr_tint = [array_max(null), array_min([-1, 2, 3])] where id = 2;
update t1 set arr_tint = [array_min([-1, 2, 3]), array_max(null)] where id = 3;
select id, arr_tint from t1 order by id;
id	arr_tint
1	NULL
2	[NULL,-1]
3	[-1,NULL]
4	[2,-1]
5	[127,-128]
6	[NULL]
7	[4,1]
delete /*+ ENABLE_PARALLEL_DML parallel(256) */ from t1 where array_max(arr_tint) > 1;
select id, arr_tint from t1 order by id;
id	arr_tint
1	NULL
2	[NULL,-1]
3	[-1,NULL]
6	[NULL]
select array_max();
ERROR 42000: Incorrect parameter count in the call to native function 'array_max'
select array_max(1);
ERROR 22000: invalid obj type for type promotion: left_type=ARRAY right_type=BIGINT
select array_max(NULL);
array_max(NULL)
NULL
select array_min();
ERROR 42000: Incorrect parameter count in the call to native function 'array_min'
select array_min(1);
ERROR 22000: invalid obj type for type promotion: left_type=ARRAY right_type=BIGINT
select array_min(NULL);
array_min(NULL)
NULL
drop table if exists t1;
drop table if exists tt1;
create table tt1(c1 array(int));
select array_min([null]) from tt1;
array_min([null])
select array_max([null]) from tt1;
array_max([null])
insert into tt1 values([1,2,3]);
select array_min([null]) from tt1;
array_min([null])
NULL
select array_max([null]) from tt1;
array_max([null])
NULL
drop table if exists tt;
create table tt(id int, arr_int int[], arr_dint array(array(int)), arr_vec array(vector(1)), arr_char array(varchar(10)));
insert into tt values(1, [1], [[1], [2]], [[1], [2]], ['a', 'b']);
insert into tt values(2, null, [[1], [2]], [[1], [2]], ['a', 'b']);
insert into tt values(3, array_remove([1], 1), [[1], [2]], [[1], [2]], ['a', 'b']);
insert into tt values(4, [null, 1], [[1], [2]], [[1], [2]], ['a', 'b']);
insert into tt values(5, [null], [[1], [2]], [[1], [2]], ['a', 'b']);
insert into tt values(6, [1], null, [[1], [2]], ['a', 'b']);
insert into tt values(7, [1], array_remove([[1]], [1]), [[1], [2]], ['a', 'b']);
insert into tt values(8, [1], [null, [2]], [[1], [2]], ['a', 'b']);
insert into tt values(9, [1], array_append(array_remove([[1]],[1]), null), [[1], [2]], ['a', 'b']);
insert into tt values(10, [1], [[null], [2]], [[1], [2]], ['a', 'b']);
insert into tt values(11, [1], [[null, 1], [2]], [[1], [2]], ['a', 'b']);
insert into tt values(12, [1], [array_remove([1], 1)], [[1], [2]], ['a', 'b']);
insert into tt values(13, [1], [array_remove([1], 1), [2]], [[1], [2]], ['a', 'b']);
insert into tt values(14, [1], [[1], [2]], null, ['a', 'b']);
insert into tt values(15, [1], [[1], [2]], array_remove([[1]], [1]), ['a', 'b']);
insert into tt values(16, [1], [[1], [2]], array_append(array_remove([[1]],[1]), null), ['a', 'b']);
insert into tt values(17, [1], [[1], [2]], [[1], [2]], null);
insert into tt values(18, [1], [[1], [2]], [[1], [2]], array_remove(['a'], 'a'));
insert into tt values(19, [1], [[1], [2]], [[1], [2]], array_append(array_remove(['a'],'a'), null));
select id, array_max(arr_int) from tt;
id	array_max(arr_int)
1	1
2	NULL
3	NULL
4	1
5	NULL
6	1
7	1
8	1
9	1
10	1
11	1
12	1
13	1
14	1
15	1
16	1
17	1
18	1
19	1
select id, array_min(arr_int) from tt;
id	array_min(arr_int)
1	1
2	NULL
3	NULL
4	1
5	NULL
6	1
7	1
8	1
9	1
10	1
11	1
12	1
13	1
14	1
15	1
16	1
17	1
18	1
19	1
drop table if exists tt;
