# ----------------------------------------------------------------------
# Test of array_avg.
# ----------------------------------------------------------------------
drop table if exists t1;
select array_avg([9223372036854775807,1]);
ERROR 22003: Array value is out of range in 'BIGINT'
select array_avg([-9223372036854775808,-1]);
ERROR 22003: Array value is out of range in 'BIGINT'
select array_avg([1.7976931348623157E+308,1.1E+300]);
ERROR 22003: Array value is out of range in 'DOUBLE'
select array_avg([1.7976931348623157E+308,1.0E+308]);
ERROR 22003: Array value is out of range in 'DOUBLE'
select array_avg([18446744073709551615,18446744073709551614]);
ERROR 22003: Array value is out of range in 'BIGINT UNSIGNED'
select array_avg([NULL]);
array_avg([NULL])
0
select array_avg([1,2,3]);
array_avg([1,2,3])
2
select array_avg([1,2,4]);
array_avg([1,2,4])
2.3333333333333335
select array_avg([1,2,-4]);
array_avg([1,2,-4])
-0.3333333333333333
select array_avg([1.1,2.2,4.4]);
array_avg([1.1,2.2,4.4])
2.566666666666667
select array_avg([1,2,NULL,3]);
array_avg([1,2,NULL,3])
1.5
select array_avg([18446744073709551615]);
array_avg([18446744073709551615])
1.8446744073709552e19
select array_avg([[1,2]]);
ERROR 0A000: array_avg with multi-dimension array not supported
select array_avg([[1],[2]]);
ERROR 0A000: array_avg with multi-dimension array not supported
select array_avg(['1','2']);
ERROR 0A000: array_avg with non-numeric type not supported
select array_avg(array_append([1,2,3],4));
array_avg(array_append([1,2,3],4))
2.5
CREATE TABLE t1 (id int primary key, arr_tint Array(TINYINT), arr_sint Array(SMALLINT), arr_int Array(INT), arr_bint Array(BIGINT),
arr_utint Array(TINYINT UNSIGNED), arr_usint Array(SMALLINT UNSIGNED), arr_uint Array(INT UNSIGNED), arr_ubint Array(BIGINT UNSIGNED),
arr_flt Array(FLOAT), arr_dob Array(DOUBLE), vec vector(3));
INSERT INTO t1(id) VALUES(1);
INSERT INTO t1 VALUES(2, [-1,2,1], [-1,2,1], [-1,2,1], [-1,2,1],
[0,2,1], [0,2,1], [0,2,1], [0,2,1],
[-1,2,1], [-1,2,1], [-1,2,1]);
INSERT INTO t1 VALUES(3, [-128,127], [-32768,32767], [-2147483648,2147483647], [-9223372036854775808,9223372036854775807],
[0,255], [0,65535], [0,4294967295], [0,9223372036854775807],
[-3.402823466E+38,-1.175494351E-38], [-1.7976931348623157E+308,-2.2250738585072014E-308], [0,0,0]);
select arr_tint, array_avg(arr_tint) from t1;
arr_tint	array_avg(arr_tint)
NULL	NULL
[-1,2,1]	0.6666666666666666
[-128,127]	-0.5
select arr_sint, array_avg(arr_sint) from t1;
arr_sint	array_avg(arr_sint)
NULL	NULL
[-1,2,1]	0.6666666666666666
[-32768,32767]	-0.5
select arr_int, array_avg(arr_int) from t1;
arr_int	array_avg(arr_int)
NULL	NULL
[-1,2,1]	0.6666666666666666
[-2147483648,2147483647]	-0.5
select arr_bint, array_avg(arr_bint) from t1;
arr_bint	array_avg(arr_bint)
NULL	NULL
[-1,2,1]	0.6666666666666666
[-9223372036854775808,9223372036854775807]	-0.5
select arr_utint, array_avg(arr_utint) from t1;
arr_utint	array_avg(arr_utint)
NULL	NULL
[0,2,1]	1
[0,255]	127.5
select arr_usint, array_avg(arr_usint) from t1;
arr_usint	array_avg(arr_usint)
NULL	NULL
[0,2,1]	1
[0,65535]	32767.5
select arr_uint, array_avg(arr_uint) from t1;
arr_uint	array_avg(arr_uint)
NULL	NULL
[0,2,1]	1
[0,4294967295]	2147483647.5
select arr_ubint, array_avg(arr_ubint) from t1;
arr_ubint	array_avg(arr_ubint)
NULL	NULL
[0,2,1]	1
[0,9223372036854775807]	4.611686018427388e18
select arr_flt, array_avg(arr_flt) from t1;
arr_flt	array_avg(arr_flt)
NULL	NULL
[-1,2,1]	0.6666666666666666
[-3.40282e38,-1.17549e-38]	-1.7014117331926443e38
select arr_dob, array_avg(arr_dob) from t1;
arr_dob	array_avg(arr_dob)
NULL	NULL
[-1,2,1]	0.6666666666666666
[-1.7976931348623157e308,-2.2250738585072014e-308]	-8.988465674311579e307
select vec, array_avg(vec) from t1;
vec	array_avg(vec)
NULL	NULL
[-1,2,1]	0.6666666666666666
[0,0,0]	0
select /*+ OPT_PARAM('enable_rich_vector_format', 'FALSE') */ arr_tint, array_avg(arr_tint) from t1;
arr_tint	array_avg(arr_tint)
NULL	NULL
[-1,2,1]	0.6666666666666666
[-128,127]	-0.5
select /*+ OPT_PARAM('enable_rich_vector_format', 'FALSE') */ arr_sint, array_avg(arr_sint) from t1;
arr_sint	array_avg(arr_sint)
NULL	NULL
[-1,2,1]	0.6666666666666666
[-32768,32767]	-0.5
select /*+ OPT_PARAM('enable_rich_vector_format', 'FALSE') */ arr_int, array_avg(arr_int) from t1;
arr_int	array_avg(arr_int)
NULL	NULL
[-1,2,1]	0.6666666666666666
[-2147483648,2147483647]	-0.5
select /*+ OPT_PARAM('enable_rich_vector_format', 'FALSE') */ arr_bint, array_avg(arr_bint) from t1;
arr_bint	array_avg(arr_bint)
NULL	NULL
[-1,2,1]	0.6666666666666666
[-9223372036854775808,9223372036854775807]	-0.5
select /*+ OPT_PARAM('enable_rich_vector_format', 'FALSE') */ arr_utint, array_avg(arr_utint) from t1;
arr_utint	array_avg(arr_utint)
NULL	NULL
[0,2,1]	1
[0,255]	127.5
select /*+ OPT_PARAM('enable_rich_vector_format', 'FALSE') */ arr_usint, array_avg(arr_usint) from t1;
arr_usint	array_avg(arr_usint)
NULL	NULL
[0,2,1]	1
[0,65535]	32767.5
select /*+ OPT_PARAM('enable_rich_vector_format', 'FALSE') */ arr_uint, array_avg(arr_uint) from t1;
arr_uint	array_avg(arr_uint)
NULL	NULL
[0,2,1]	1
[0,4294967295]	2147483647.5
select /*+ OPT_PARAM('enable_rich_vector_format', 'FALSE') */ arr_ubint, array_avg(arr_ubint) from t1;
arr_ubint	array_avg(arr_ubint)
NULL	NULL
[0,2,1]	1
[0,9223372036854775807]	4.611686018427388e18
select /*+ OPT_PARAM('enable_rich_vector_format', 'FALSE') */ arr_flt, array_avg(arr_flt) from t1;
arr_flt	array_avg(arr_flt)
NULL	NULL
[-1,2,1]	0.6666666666666666
[-3.40282e38,-1.17549e-38]	-1.7014117331926443e38
select /*+ OPT_PARAM('enable_rich_vector_format', 'FALSE') */ arr_dob, array_avg(arr_dob) from t1;
arr_dob	array_avg(arr_dob)
NULL	NULL
[-1,2,1]	0.6666666666666666
[-1.7976931348623157e308,-2.2250738585072014e-308]	-8.988465674311579e307
select /*+ OPT_PARAM('enable_rich_vector_format', 'FALSE') */ vec, array_avg(vec) from t1;
vec	array_avg(vec)
NULL	NULL
[-1,2,1]	0.6666666666666666
[0,0,0]	0
select /*+ OPT_PARAM('rowsets_enabled', 'FALSE') */ arr_tint, array_avg(arr_tint) from t1;
arr_tint	array_avg(arr_tint)
NULL	NULL
[-1,2,1]	0.6666666666666666
[-128,127]	-0.5
select /*+ OPT_PARAM('rowsets_enabled', 'FALSE') */ arr_sint, array_avg(arr_sint) from t1;
arr_sint	array_avg(arr_sint)
NULL	NULL
[-1,2,1]	0.6666666666666666
[-32768,32767]	-0.5
select /*+ OPT_PARAM('rowsets_enabled', 'FALSE') */ arr_int, array_avg(arr_int) from t1;
arr_int	array_avg(arr_int)
NULL	NULL
[-1,2,1]	0.6666666666666666
[-2147483648,2147483647]	-0.5
select /*+ OPT_PARAM('rowsets_enabled', 'FALSE') */ arr_bint, array_avg(arr_bint) from t1;
arr_bint	array_avg(arr_bint)
NULL	NULL
[-1,2,1]	0.6666666666666666
[-9223372036854775808,9223372036854775807]	-0.5
select /*+ OPT_PARAM('rowsets_enabled', 'FALSE') */ arr_utint, array_avg(arr_utint) from t1;
arr_utint	array_avg(arr_utint)
NULL	NULL
[0,2,1]	1
[0,255]	127.5
select /*+ OPT_PARAM('rowsets_enabled', 'FALSE') */ arr_usint, array_avg(arr_usint) from t1;
arr_usint	array_avg(arr_usint)
NULL	NULL
[0,2,1]	1
[0,65535]	32767.5
select /*+ OPT_PARAM('rowsets_enabled', 'FALSE') */ arr_uint, array_avg(arr_uint) from t1;
arr_uint	array_avg(arr_uint)
NULL	NULL
[0,2,1]	1
[0,4294967295]	2147483647.5
select /*+ OPT_PARAM('rowsets_enabled', 'FALSE') */ arr_ubint, array_avg(arr_ubint) from t1;
arr_ubint	array_avg(arr_ubint)
NULL	NULL
[0,2,1]	1
[0,9223372036854775807]	4.611686018427388e18
select /*+ OPT_PARAM('rowsets_enabled', 'FALSE') */ arr_flt, array_avg(arr_flt) from t1;
arr_flt	array_avg(arr_flt)
NULL	NULL
[-1,2,1]	0.6666666666666666
[-3.40282e38,-1.17549e-38]	-1.7014117331926443e38
select /*+ OPT_PARAM('rowsets_enabled', 'FALSE') */ arr_dob, array_avg(arr_dob) from t1;
arr_dob	array_avg(arr_dob)
NULL	NULL
[-1,2,1]	0.6666666666666666
[-1.7976931348623157e308,-2.2250738585072014e-308]	-8.988465674311579e307
select /*+ OPT_PARAM('rowsets_enabled', 'FALSE') */ vec, array_avg(vec) from t1;
vec	array_avg(vec)
NULL	NULL
[-1,2,1]	0.6666666666666666
[0,0,0]	0
drop table if exists t_create;
create table t_create as select array_avg(NULL), array_avg([1,2,3,4]);
desc t_create;
Field	Type	Null	Key	Default	Extra
array_avg(NULL)	double	YES		NULL	
array_avg([1,2,3,4])	double	YES		NULL	
select * from t_create;
array_avg(NULL)	array_avg([1,2,3,4])
NULL	2.5
drop table t_create;
create table t_create as select array_avg(NULL), array_avg(arr_tint) from t1;
desc t_create;
Field	Type	Null	Key	Default	Extra
array_avg(NULL)	double	YES		NULL	
array_avg(arr_tint)	double	YES		NULL	
select * from t_create;
array_avg(NULL)	array_avg(arr_tint)
NULL	NULL
NULL	0.6666666666666666
NULL	-0.5
drop table t_create;
with array_data as (
select id, arr_int from t1
where id IN (2, 3)
)
select id, array_avg(arr_int) from array_data order by id;
id	array_avg(arr_int)
2	0.6666666666666666
3	-0.5
with tavg as (
select id, array_avg(arr_int) from t1
)
select * from tavg order by id;
id	array_avg(arr_int)
1	NULL
2	0.6666666666666666
3	-0.5
INSERT IGNORE INTO t1(id, arr_int) 
select id + 2, [array_avg(arr_bint), array_avg(arr_tint), array_avg(arr_int)]
from t1;
select id, arr_int from t1 order by id;
id	arr_int
1	NULL
2	[-1,2,1]
3	[-2147483648,2147483647]
4	[1,1,1]
5	[0,0,0]
update /*+ ENABLE_PARALLEL_DML parallel(256) */
t1 set arr_int = [array_avg(null), array_avg(arr_bint), array_avg(arr_tint)]
where id = 2;
update t1 set arr_int = [array_avg(null), array_avg(arr_bint), array_avg(arr_tint)]
where id = 3;
select id, arr_int from t1 order by id;
id	arr_int
1	NULL
2	[NULL,1,1]
3	[NULL,0,0]
4	[1,1,1]
5	[0,0,0]
delete /*+ ENABLE_PARALLEL_DML parallel(256) */ from t1 where array_avg(arr_int) <= 0;
select id, arr_int from t1 order by id;
id	arr_int
1	NULL
2	[NULL,1,1]
4	[1,1,1]
select array_avg();
ERROR 42000: Incorrect parameter count in the call to native function 'array_avg'
select array_avg(1);
ERROR 22000: invalid obj type for type promotion: left_type=ARRAY right_type=BIGINT
select array_avg(NULL);
array_avg(NULL)
NULL
drop table if exists t1;
select array_avg([9223372036854775604,-9223372036854775808]);
array_avg([9223372036854775604,-9223372036854775808])
-102
select array_avg([9223372036854775604]);
array_avg([9223372036854775604])
9.223372036854776e18
select array_avg([-9223372036854775808]);
array_avg([-9223372036854775808])
-9.223372036854776e18
drop table if exists tt;
create table tt(id int, arr_int int[], arr_dint array(array(int)), arr_vec array(vector(1)), arr_char array(varchar(10)));
insert into tt values(1, [1], [[1], [2]], [[1], [2]], ['a', 'b']);
insert into tt values(2, null, [[1], [2]], [[1], [2]], ['a', 'b']);
insert into tt values(3, array_remove([1], 1), [[1], [2]], [[1], [2]], ['a', 'b']);
insert into tt values(4, [null, 1], [[1], [2]], [[1], [2]], ['a', 'b']);
insert into tt values(5, [null], [[1], [2]], [[1], [2]], ['a', 'b']);
insert into tt values(6, [1], null, [[1], [2]], ['a', 'b']);
insert into tt values(7, [1], array_remove([[1]], [1]), [[1], [2]], ['a', 'b']);
insert into tt values(8, [1], [null, [2]], [[1], [2]], ['a', 'b']);
insert into tt values(9, [1], array_append(array_remove([[1]],[1]), null), [[1], [2]], ['a', 'b']);
insert into tt values(10, [1], [[null], [2]], [[1], [2]], ['a', 'b']);
insert into tt values(11, [1], [[null, 1], [2]], [[1], [2]], ['a', 'b']);
insert into tt values(12, [1], [array_remove([1], 1)], [[1], [2]], ['a', 'b']);
insert into tt values(13, [1], [array_remove([1], 1), [2]], [[1], [2]], ['a', 'b']);
insert into tt values(14, [1], [[1], [2]], null, ['a', 'b']);
insert into tt values(15, [1], [[1], [2]], array_remove([[1]], [1]), ['a', 'b']);
insert into tt values(16, [1], [[1], [2]], array_append(array_remove([[1]],[1]), null), ['a', 'b']);
insert into tt values(17, [1], [[1], [2]], [[1], [2]], null);
insert into tt values(18, [1], [[1], [2]], [[1], [2]], array_remove(['a'], 'a'));
insert into tt values(19, [1], [[1], [2]], [[1], [2]], array_append(array_remove(['a'],'a'), null));
select id, array_avg(arr_int) from tt;
id	array_avg(arr_int)
1	1
2	NULL
3	0
4	0.5
5	0
6	1
7	1
8	1
9	1
10	1
11	1
12	1
13	1
14	1
15	1
16	1
17	1
18	1
19	1
drop table if exists tt;
