# ----------------------------------------------------------------------
# Test of array_slice.
# ----------------------------------------------------------------------
select array_except([1,2,3], [1,2]);
array_except([1,2,3], [1,2])
[3]
select array_except([1,1,2,2,3], [1,2]);
array_except([1,1,2,2,3], [1,2])
[3]
select array_except([1,2,3], [1,1,2]);
array_except([1,2,3], [1,1,2])
[3]
select array_except([1.1,2.2,1], [1]);
array_except([1.1,2.2,1], [1])
[1.1,2.2]
select array_except(["test", "array"], ["test"]);
array_except(["test", "array"], ["test"])
["array"]
select array_except(["test", "array"], [1,2]);
array_except(["test", "array"], [1,2])
["test","array"]
select array_except([1, null], [null]);
array_except([1, null], [null])
[1]
select array_except(null, [1]);
array_except(null, [1])
NULL
select array_except(array_remove([1],1),array_remove([1],1));
array_except(array_remove([1],1),array_remove([1],1))
[]
select array_except(array_remove([1],1), [1,2,3]);
array_except(array_remove([1],1), [1,2,3])
[]
select array_except([1,2,3], array_remove([1],1));
array_except([1,2,3], array_remove([1],1))
[1,2,3]
select array_except(["test", "array"], array_remove(["A"],"A"));
array_except(["test", "array"], array_remove(["A"],"A"))
["test","array"]
select array_except(array_remove(["A"],"A"), ["test", "array"]);
array_except(array_remove(["A"],"A"), ["test", "array"])
[]
select array_except([[1],[1],[3]],array_remove([[1]],[1]));
array_except([[1],[1],[3]],array_remove([[1]],[1]))
[[1],[3]]
select array_except(array_remove([[1]],[1]), [[1],[2],[3]]);
array_except(array_remove([[1]],[1]), [[1],[2],[3]])
[]
select array_except([1,2,3], NULL);
array_except([1,2,3], NULL)
NULL
select array_except(NULL, [1,2,3]);
array_except(NULL, [1,2,3])
NULL
select array_except(1, null);
ERROR 22000: Invalid data type for the operation
select array_except([1,2]);
ERROR 42000: Incorrect parameter count in the call to native function 'array_except'
select array_except([1,2], [1], [2]);
ERROR 42000: Incorrect parameter count in the call to native function 'array_except'
select array_except(1, 2);
ERROR 22000: Invalid data type for the operation
select array_except(1, "test");
ERROR 22000: Invalid data type for the operation
select array_except("test", 1);
ERROR 22000: Invalid data type for the operation
drop table if exists arr_t1;
CREATE TABLE arr_t1(id int,
c1 int,
c2 double,
arr_tint Array(TINYINT),
arr_sint Array(SMALLINT),
arr_int Array(INT),
arr_bint Array(BIGINT),
arr_uint Array(INT UNSIGNED),
arr_utint Array(TINYINT UNSIGNED),
arr_usint Array(SMALLINT UNSIGNED),
arr_usbigint Array(BIGINT UNSIGNED),
arr_vchar Array(VARCHAR(10)),
arr_double Array(DOUBLE),
arr_float Array(FLOAT),
c3 ARRAY(ARRAY(FLOAT)),
c4 ARRAY(ARRAY(double)),
c5 ARRAY(ARRAY(INT)),
c6 ARRAY(ARRAY(SMALLINT))
);
insert into arr_t1 values(1,
1,
2,
[1,2,3,null],
[1,2,3],
[1,2,3],
[1,2,3,null],
[1,2,3],
[1,2,3],
[1,2,3,null],
[1,2,3],
["a","b","c"],
[1.1,2.2,3.3],
[1.1,2.2,3.3],
[[1.1,2.2,3.3],[4.4,5.5,6.6]],
[[1.1,2.2,3.3],[4.4,5.5,6.6]],
[[1,2,3],[4,5,6]],
[[1,2],[4,5,6]]
);
insert into arr_t1 values(2,
2,
2,
[1,2],
[1,2],
[1,2],
[2,3],
[3],
[3],
[3],
[3],
["c"],
[1.1,2.2,3.3],
[1.1,2.2,3.3],
[[3.3],[4.4,5.5,6.6]],
[[1.1,2.2,3.3],[4.4]],
[[1,2,3],[4,5,6]],
[[1,2],[4,5,6]]
);
insert into arr_t1 values(3,
-1,
2,
[1,3],
[1,2],
[1,3],
[2,3],
[3],
[2,3],
[1,3],
[3],
["c"],
[1.1,2.2,3.3],
[1.1,2.2,3.3],
[[1.1,2.2,3.3],[4.4]],
[[1.1,2.2,3.3],[6.6]],
[[1,2,3],[4,5,6]],
[[1,2],[4,5,6]]
);
insert into arr_t1 values(4,
1,
-1,
[3],
[1,3],
[2],
[2],
[1],
[3],
[3],
[1,2],
["a","b"],
[1.1,2.2,3.3],
[1.1,2.2,3.3],
[[1.1],[4.4,5.5,6.6]],
[[1.1,3.3],[4.4,5.5,6.6]],
[[1,2,3],[4,5,6]],
[[1,2],[4,5,6]]
);
insert into arr_t1 values(5,
NULL,
-1,
[1,3],
[1,3],
[1,2,3],
[1,2],
[1,3],
[1,2],
[2,3],
[1,2],
["a","c"],
[1.1,2.2,3.3],
[1.1,2.2,3.3],
[[1.1,2.2,3.3],[4.4,5.5,6.6]],
[[1.1,2.2,3.3],[4.4,5.5,6.6]],
[[1,2,3],[4,5,6]],
[[1,2],[4,5,6]]
);
insert into arr_t1 values(6,
1,
NULL,
[1,2,3],
[1,2,3],
[1,2,3],
[1,2,3],
[1,2,3],
[1,2,3],
[1,2,3],
[1,2,3],
["a","b","c"],
[1.1,2.2,3.3],
[1.1,2.2,3.3],
[[1.1,2.2,3.3],[4.4,5.5,6.6]],
[[1.1,2.2,3.3],[4.4,5.5,6.6]],
[[1,2,3],[4,5,6]],
[[1,2],[4,5,6]]
);
select * from arr_t1 order by id;
id	c1	c2	arr_tint	arr_sint	arr_int	arr_bint	arr_uint	arr_utint	arr_usint	arr_usbigint	arr_vchar	arr_double	arr_float	c3	c4	c5	c6
1	1	2	[1,2,3,NULL]	[1,2,3]	[1,2,3]	[1,2,3,NULL]	[1,2,3]	[1,2,3]	[1,2,3,NULL]	[1,2,3]	["a","b","c"]	[1.1,2.2,3.3]	[1.1,2.2,3.3]	[[1.1,2.2,3.3],[4.4,5.5,6.6]]	[[1.1,2.2,3.3],[4.4,5.5,6.6]]	[[1,2,3],[4,5,6]]	[[1,2],[4,5,6]]
2	2	2	[1,2]	[1,2]	[1,2]	[2,3]	[3]	[3]	[3]	[3]	["c"]	[1.1,2.2,3.3]	[1.1,2.2,3.3]	[[3.3],[4.4,5.5,6.6]]	[[1.1,2.2,3.3],[4.4]]	[[1,2,3],[4,5,6]]	[[1,2],[4,5,6]]
3	-1	2	[1,3]	[1,2]	[1,3]	[2,3]	[3]	[2,3]	[1,3]	[3]	["c"]	[1.1,2.2,3.3]	[1.1,2.2,3.3]	[[1.1,2.2,3.3],[4.4]]	[[1.1,2.2,3.3],[6.6]]	[[1,2,3],[4,5,6]]	[[1,2],[4,5,6]]
4	1	-1	[3]	[1,3]	[2]	[2]	[1]	[3]	[3]	[1,2]	["a","b"]	[1.1,2.2,3.3]	[1.1,2.2,3.3]	[[1.1],[4.4,5.5,6.6]]	[[1.1,3.3],[4.4,5.5,6.6]]	[[1,2,3],[4,5,6]]	[[1,2],[4,5,6]]
5	NULL	-1	[1,3]	[1,3]	[1,2,3]	[1,2]	[1,3]	[1,2]	[2,3]	[1,2]	["a","c"]	[1.1,2.2,3.3]	[1.1,2.2,3.3]	[[1.1,2.2,3.3],[4.4,5.5,6.6]]	[[1.1,2.2,3.3],[4.4,5.5,6.6]]	[[1,2,3],[4,5,6]]	[[1,2],[4,5,6]]
6	1	NULL	[1,2,3]	[1,2,3]	[1,2,3]	[1,2,3]	[1,2,3]	[1,2,3]	[1,2,3]	[1,2,3]	["a","b","c"]	[1.1,2.2,3.3]	[1.1,2.2,3.3]	[[1.1,2.2,3.3],[4.4,5.5,6.6]]	[[1.1,2.2,3.3],[4.4,5.5,6.6]]	[[1,2,3],[4,5,6]]	[[1,2],[4,5,6]]
select array_except(arr_tint, arr_sint) from arr_t1 order by id;
array_except(arr_tint, arr_sint)
[NULL]
[]
[3]
[]
[]
[]
select array_except(arr_tint, arr_int) from arr_t1 order by id;
array_except(arr_tint, arr_int)
[NULL]
[]
[]
[3]
[]
[]
select array_except(arr_tint, arr_bint) from arr_t1 order by id;
array_except(arr_tint, arr_bint)
[]
[1]
[1]
[3]
[3]
[]
select array_except(arr_tint, arr_uint) from arr_t1 order by id;
array_except(arr_tint, arr_uint)
[NULL]
[1,2]
[1]
[3]
[]
[]
select array_except(arr_tint, arr_usint) from arr_t1 order by id;
array_except(arr_tint, arr_usint)
[]
[1,2]
[]
[]
[1]
[]
select array_except(arr_tint, arr_usbigint) from arr_t1 order by id;
array_except(arr_tint, arr_usbigint)
[NULL]
[1,2]
[1]
[3]
[3]
[]
select array_except(arr_tint, arr_vchar) from arr_t1 order by id;
array_except(arr_tint, arr_vchar)
["1","2","3",NULL]
["1","2"]
["1","3"]
["3"]
["1","3"]
["1","2","3"]
select array_except(arr_int, arr_sint) from arr_t1 order by id;
array_except(arr_int, arr_sint)
[]
[]
[3]
[2]
[2]
[]
select array_except(arr_int, arr_tint) from arr_t1 order by id;
array_except(arr_int, arr_tint)
[]
[]
[]
[2]
[2]
[]
select array_except(arr_int, arr_bint) from arr_t1 order by id;
array_except(arr_int, arr_bint)
[]
[1]
[1]
[]
[3]
[]
select array_except(arr_int, arr_uint) from arr_t1 order by id;
array_except(arr_int, arr_uint)
[]
[1,2]
[1]
[2]
[2]
[]
select array_except(arr_int, arr_usint) from arr_t1 order by id;
array_except(arr_int, arr_usint)
[]
[1,2]
[]
[2]
[1]
[]
select array_except(arr_int, arr_usbigint) from arr_t1 order by id;
array_except(arr_int, arr_usbigint)
[]
[1,2]
[1]
[]
[3]
[]
select array_except(arr_int, arr_vchar) from arr_t1 order by id;
array_except(arr_int, arr_vchar)
["1","2","3"]
["1","2"]
["1","3"]
["2"]
["1","2","3"]
["1","2","3"]
select array_except(arr_bint, arr_sint) from arr_t1 order by id;
array_except(arr_bint, arr_sint)
[NULL]
[3]
[3]
[2]
[2]
[]
select array_except(arr_bint, arr_int) from arr_t1 order by id;
array_except(arr_bint, arr_int)
[NULL]
[3]
[2]
[]
[]
[]
select array_except(arr_bint, arr_tint) from arr_t1 order by id;
array_except(arr_bint, arr_tint)
[]
[3]
[2]
[2]
[2]
[]
select array_except(arr_bint, arr_uint) from arr_t1 order by id;
array_except(arr_bint, arr_uint)
[NULL]
[2]
[2]
[2]
[2]
[]
select array_except(arr_bint, arr_usint) from arr_t1 order by id;
array_except(arr_bint, arr_usint)
[]
[2]
[2]
[2]
[1]
[]
select array_except(arr_bint, arr_usbigint) from arr_t1 order by id;
array_except(arr_bint, arr_usbigint)
[NULL]
[2]
[2]
[]
[]
[]
select array_except(arr_bint, arr_vchar) from arr_t1 order by id;
array_except(arr_bint, arr_vchar)
["1","2","3",NULL]
["2","3"]
["2","3"]
["2"]
["1","2"]
["1","2","3"]
select array_except(arr_vchar, arr_sint) from arr_t1 order by id;
array_except(arr_vchar, arr_sint)
["a","b","c"]
["c"]
["c"]
["a","b"]
["a","c"]
["a","b","c"]
select array_except(arr_vchar, arr_int) from arr_t1 order by id;
array_except(arr_vchar, arr_int)
["a","b","c"]
["c"]
["c"]
["a","b"]
["a","c"]
["a","b","c"]
select array_except(arr_vchar, arr_bint) from arr_t1 order by id;
array_except(arr_vchar, arr_bint)
["a","b","c"]
["c"]
["c"]
["a","b"]
["a","c"]
["a","b","c"]
select array_except(arr_vchar, arr_uint) from arr_t1 order by id;
array_except(arr_vchar, arr_uint)
["a","b","c"]
["c"]
["c"]
["a","b"]
["a","c"]
["a","b","c"]
select array_except(arr_vchar, arr_usint) from arr_t1 order by id;
array_except(arr_vchar, arr_usint)
["a","b","c"]
["c"]
["c"]
["a","b"]
["a","c"]
["a","b","c"]
select array_except(arr_vchar, arr_usbigint) from arr_t1 order by id;
array_except(arr_vchar, arr_usbigint)
["a","b","c"]
["c"]
["c"]
["a","b"]
["a","c"]
["a","b","c"]
select array_except(arr_vchar, arr_tint) from arr_t1 order by id;
array_except(arr_vchar, arr_tint)
["a","b","c"]
["c"]
["c"]
["a","b"]
["a","c"]
["a","b","c"]
select array_except(c3, c4) from arr_t1 order by id;
array_except(c3, c4)
[[1.100000023841858,2.200000047683716,3.299999952316284],[4.400000095367432,5.5,6.599999904632568]]
[[3.299999952316284],[4.400000095367432,5.5,6.599999904632568]]
[[1.100000023841858,2.200000047683716,3.299999952316284],[4.400000095367432]]
[[1.100000023841858],[4.400000095367432,5.5,6.599999904632568]]
[[1.100000023841858,2.200000047683716,3.299999952316284],[4.400000095367432,5.5,6.599999904632568]]
[[1.100000023841858,2.200000047683716,3.299999952316284],[4.400000095367432,5.5,6.599999904632568]]
select array_except(c4, c3) from arr_t1 order by id;
array_except(c4, c3)
[[1.1,2.2,3.3],[4.4,5.5,6.6]]
[[1.1,2.2,3.3],[4.4]]
[[1.1,2.2,3.3],[6.6]]
[[1.1,3.3],[4.4,5.5,6.6]]
[[1.1,2.2,3.3],[4.4,5.5,6.6]]
[[1.1,2.2,3.3],[4.4,5.5,6.6]]
select array_except(c5, c6) from arr_t1 order by id;
array_except(c5, c6)
[[1,2,3]]
[[1,2,3]]
[[1,2,3]]
[[1,2,3]]
[[1,2,3]]
[[1,2,3]]
select array_except(c6, c5) from arr_t1 order by id;
array_except(c6, c5)
[[1,2]]
[[1,2]]
[[1,2]]
[[1,2]]
[[1,2]]
[[1,2]]
select array_except(c3, c5) from arr_t1 order by id;
array_except(c3, c5)
[[1.100000023841858,2.200000047683716,3.299999952316284],[4.400000095367432,5.5,6.599999904632568]]
[[3.299999952316284],[4.400000095367432,5.5,6.599999904632568]]
[[1.100000023841858,2.200000047683716,3.299999952316284],[4.400000095367432]]
[[1.100000023841858],[4.400000095367432,5.5,6.599999904632568]]
[[1.100000023841858,2.200000047683716,3.299999952316284],[4.400000095367432,5.5,6.599999904632568]]
[[1.100000023841858,2.200000047683716,3.299999952316284],[4.400000095367432,5.5,6.599999904632568]]
select array_except(arr_double, arr_float) from arr_t1 order by id;
array_except(arr_double, arr_float)
[1.1,2.2,3.3]
[1.1,2.2,3.3]
[1.1,2.2,3.3]
[1.1,2.2,3.3]
[1.1,2.2,3.3]
[1.1,2.2,3.3]
select array_except(arr_float, arr_double) from arr_t1 order by id;
array_except(arr_float, arr_double)
[1.100000023841858,2.200000047683716,3.299999952316284]
[1.100000023841858,2.200000047683716,3.299999952316284]
[1.100000023841858,2.200000047683716,3.299999952316284]
[1.100000023841858,2.200000047683716,3.299999952316284]
[1.100000023841858,2.200000047683716,3.299999952316284]
[1.100000023841858,2.200000047683716,3.299999952316284]
select /*+ OPT_PARAM('enable_rich_vector_format', 'FALSE') */ array_except(arr_tint, arr_sint) from arr_t1 order by id;
array_except(arr_tint, arr_sint)
[NULL]
[]
[3]
[]
[]
[]
select /*+ OPT_PARAM('enable_rich_vector_format', 'FALSE') */ array_except(arr_tint, arr_int) from arr_t1 order by id;
array_except(arr_tint, arr_int)
[NULL]
[]
[]
[3]
[]
[]
select /*+ OPT_PARAM('enable_rich_vector_format', 'FALSE') */ array_except(arr_tint, arr_bint) from arr_t1 order by id;
array_except(arr_tint, arr_bint)
[]
[1]
[1]
[3]
[3]
[]
select /*+ OPT_PARAM('enable_rich_vector_format', 'FALSE') */ array_except(arr_tint, arr_uint) from arr_t1 order by id;
array_except(arr_tint, arr_uint)
[NULL]
[1,2]
[1]
[3]
[]
[]
select /*+ OPT_PARAM('enable_rich_vector_format', 'FALSE') */ array_except(arr_tint, arr_usint) from arr_t1 order by id;
array_except(arr_tint, arr_usint)
[]
[1,2]
[]
[]
[1]
[]
select /*+ OPT_PARAM('enable_rich_vector_format', 'FALSE') */ array_except(arr_tint, arr_usbigint) from arr_t1 order by id;
array_except(arr_tint, arr_usbigint)
[NULL]
[1,2]
[1]
[3]
[3]
[]
select /*+ OPT_PARAM('enable_rich_vector_format', 'FALSE') */ array_except(arr_tint, arr_vchar) from arr_t1 order by id;
array_except(arr_tint, arr_vchar)
["1","2","3",NULL]
["1","2"]
["1","3"]
["3"]
["1","3"]
["1","2","3"]
select /*+ OPT_PARAM('enable_rich_vector_format', 'FALSE') */ array_except(arr_int, arr_sint) from arr_t1 order by id;
array_except(arr_int, arr_sint)
[]
[]
[3]
[2]
[2]
[]
select /*+ OPT_PARAM('enable_rich_vector_format', 'FALSE') */ array_except(arr_int, arr_tint) from arr_t1 order by id;
array_except(arr_int, arr_tint)
[]
[]
[]
[2]
[2]
[]
select /*+ OPT_PARAM('enable_rich_vector_format', 'FALSE') */ array_except(arr_int, arr_bint) from arr_t1 order by id;
array_except(arr_int, arr_bint)
[]
[1]
[1]
[]
[3]
[]
select /*+ OPT_PARAM('enable_rich_vector_format', 'FALSE') */ array_except(arr_int, arr_uint) from arr_t1 order by id;
array_except(arr_int, arr_uint)
[]
[1,2]
[1]
[2]
[2]
[]
select /*+ OPT_PARAM('enable_rich_vector_format', 'FALSE') */ array_except(arr_int, arr_usint) from arr_t1 order by id;
array_except(arr_int, arr_usint)
[]
[1,2]
[]
[2]
[1]
[]
select /*+ OPT_PARAM('enable_rich_vector_format', 'FALSE') */ array_except(arr_int, arr_usbigint) from arr_t1 order by id;
array_except(arr_int, arr_usbigint)
[]
[1,2]
[1]
[]
[3]
[]
select /*+ OPT_PARAM('enable_rich_vector_format', 'FALSE') */ array_except(arr_int, arr_vchar) from arr_t1 order by id;
array_except(arr_int, arr_vchar)
["1","2","3"]
["1","2"]
["1","3"]
["2"]
["1","2","3"]
["1","2","3"]
select /*+ OPT_PARAM('enable_rich_vector_format', 'FALSE') */ array_except(arr_bint, arr_sint) from arr_t1 order by id;
array_except(arr_bint, arr_sint)
[NULL]
[3]
[3]
[2]
[2]
[]
select /*+ OPT_PARAM('enable_rich_vector_format', 'FALSE') */ array_except(arr_bint, arr_int) from arr_t1 order by id;
array_except(arr_bint, arr_int)
[NULL]
[3]
[2]
[]
[]
[]
select /*+ OPT_PARAM('enable_rich_vector_format', 'FALSE') */ array_except(arr_bint, arr_tint) from arr_t1 order by id;
array_except(arr_bint, arr_tint)
[]
[3]
[2]
[2]
[2]
[]
select /*+ OPT_PARAM('enable_rich_vector_format', 'FALSE') */ array_except(arr_bint, arr_uint) from arr_t1 order by id;
array_except(arr_bint, arr_uint)
[NULL]
[2]
[2]
[2]
[2]
[]
select /*+ OPT_PARAM('enable_rich_vector_format', 'FALSE') */ array_except(arr_bint, arr_usint) from arr_t1 order by id;
array_except(arr_bint, arr_usint)
[]
[2]
[2]
[2]
[1]
[]
select /*+ OPT_PARAM('enable_rich_vector_format', 'FALSE') */ array_except(arr_bint, arr_usbigint) from arr_t1 order by id;
array_except(arr_bint, arr_usbigint)
[NULL]
[2]
[2]
[]
[]
[]
select /*+ OPT_PARAM('enable_rich_vector_format', 'FALSE') */ array_except(arr_bint, arr_vchar) from arr_t1 order by id;
array_except(arr_bint, arr_vchar)
["1","2","3",NULL]
["2","3"]
["2","3"]
["2"]
["1","2"]
["1","2","3"]
select /*+ OPT_PARAM('enable_rich_vector_format', 'FALSE') */ array_except(arr_vchar, arr_sint) from arr_t1 order by id;
array_except(arr_vchar, arr_sint)
["a","b","c"]
["c"]
["c"]
["a","b"]
["a","c"]
["a","b","c"]
select /*+ OPT_PARAM('enable_rich_vector_format', 'FALSE') */ array_except(arr_vchar, arr_int) from arr_t1 order by id;
array_except(arr_vchar, arr_int)
["a","b","c"]
["c"]
["c"]
["a","b"]
["a","c"]
["a","b","c"]
select /*+ OPT_PARAM('enable_rich_vector_format', 'FALSE') */ array_except(arr_vchar, arr_bint) from arr_t1 order by id;
array_except(arr_vchar, arr_bint)
["a","b","c"]
["c"]
["c"]
["a","b"]
["a","c"]
["a","b","c"]
select /*+ OPT_PARAM('enable_rich_vector_format', 'FALSE') */ array_except(arr_vchar, arr_uint) from arr_t1 order by id;
array_except(arr_vchar, arr_uint)
["a","b","c"]
["c"]
["c"]
["a","b"]
["a","c"]
["a","b","c"]
select /*+ OPT_PARAM('enable_rich_vector_format', 'FALSE') */ array_except(arr_vchar, arr_usint) from arr_t1 order by id;
array_except(arr_vchar, arr_usint)
["a","b","c"]
["c"]
["c"]
["a","b"]
["a","c"]
["a","b","c"]
select /*+ OPT_PARAM('enable_rich_vector_format', 'FALSE') */ array_except(arr_vchar, arr_usbigint) from arr_t1 order by id;
array_except(arr_vchar, arr_usbigint)
["a","b","c"]
["c"]
["c"]
["a","b"]
["a","c"]
["a","b","c"]
select /*+ OPT_PARAM('enable_rich_vector_format', 'FALSE') */ array_except(arr_vchar, arr_tint) from arr_t1 order by id;
array_except(arr_vchar, arr_tint)
["a","b","c"]
["c"]
["c"]
["a","b"]
["a","c"]
["a","b","c"]
select /*+ OPT_PARAM('enable_rich_vector_format', 'FALSE') */ array_except(c3, c4) from arr_t1 order by id;
array_except(c3, c4)
[[1.100000023841858,2.200000047683716,3.299999952316284],[4.400000095367432,5.5,6.599999904632568]]
[[3.299999952316284],[4.400000095367432,5.5,6.599999904632568]]
[[1.100000023841858,2.200000047683716,3.299999952316284],[4.400000095367432]]
[[1.100000023841858],[4.400000095367432,5.5,6.599999904632568]]
[[1.100000023841858,2.200000047683716,3.299999952316284],[4.400000095367432,5.5,6.599999904632568]]
[[1.100000023841858,2.200000047683716,3.299999952316284],[4.400000095367432,5.5,6.599999904632568]]
select /*+ OPT_PARAM('enable_rich_vector_format', 'FALSE') */ array_except(c4, c3) from arr_t1 order by id;
array_except(c4, c3)
[[1.1,2.2,3.3],[4.4,5.5,6.6]]
[[1.1,2.2,3.3],[4.4]]
[[1.1,2.2,3.3],[6.6]]
[[1.1,3.3],[4.4,5.5,6.6]]
[[1.1,2.2,3.3],[4.4,5.5,6.6]]
[[1.1,2.2,3.3],[4.4,5.5,6.6]]
select /*+ OPT_PARAM('enable_rich_vector_format', 'FALSE') */ array_except(c5, c6) from arr_t1 order by id;
array_except(c5, c6)
[[1,2,3]]
[[1,2,3]]
[[1,2,3]]
[[1,2,3]]
[[1,2,3]]
[[1,2,3]]
select /*+ OPT_PARAM('enable_rich_vector_format', 'FALSE') */ array_except(c6, c5) from arr_t1 order by id;
array_except(c6, c5)
[[1,2]]
[[1,2]]
[[1,2]]
[[1,2]]
[[1,2]]
[[1,2]]
select /*+ OPT_PARAM('enable_rich_vector_format', 'FALSE') */ array_except(c3, c5) from arr_t1 order by id;
array_except(c3, c5)
[[1.100000023841858,2.200000047683716,3.299999952316284],[4.400000095367432,5.5,6.599999904632568]]
[[3.299999952316284],[4.400000095367432,5.5,6.599999904632568]]
[[1.100000023841858,2.200000047683716,3.299999952316284],[4.400000095367432]]
[[1.100000023841858],[4.400000095367432,5.5,6.599999904632568]]
[[1.100000023841858,2.200000047683716,3.299999952316284],[4.400000095367432,5.5,6.599999904632568]]
[[1.100000023841858,2.200000047683716,3.299999952316284],[4.400000095367432,5.5,6.599999904632568]]
select /*+ OPT_PARAM('enable_rich_vector_format', 'FALSE') */ array_except(arr_double, arr_float) from arr_t1 order by id;
array_except(arr_double, arr_float)
[1.1,2.2,3.3]
[1.1,2.2,3.3]
[1.1,2.2,3.3]
[1.1,2.2,3.3]
[1.1,2.2,3.3]
[1.1,2.2,3.3]
select /*+ OPT_PARAM('enable_rich_vector_format', 'FALSE') */ array_except(arr_float, arr_double) from arr_t1 order by id;
array_except(arr_float, arr_double)
[1.100000023841858,2.200000047683716,3.299999952316284]
[1.100000023841858,2.200000047683716,3.299999952316284]
[1.100000023841858,2.200000047683716,3.299999952316284]
[1.100000023841858,2.200000047683716,3.299999952316284]
[1.100000023841858,2.200000047683716,3.299999952316284]
[1.100000023841858,2.200000047683716,3.299999952316284]
select /*+ OPT_PARAM('rowsets_enabled', 'FALSE') */ array_except(arr_tint, arr_sint) from arr_t1 order by id;
array_except(arr_tint, arr_sint)
[NULL]
[]
[3]
[]
[]
[]
select /*+ OPT_PARAM('rowsets_enabled', 'FALSE') */ array_except(arr_tint, arr_int) from arr_t1 order by id;
array_except(arr_tint, arr_int)
[NULL]
[]
[]
[3]
[]
[]
select /*+ OPT_PARAM('rowsets_enabled', 'FALSE') */ array_except(arr_tint, arr_bint) from arr_t1 order by id;
array_except(arr_tint, arr_bint)
[]
[1]
[1]
[3]
[3]
[]
select /*+ OPT_PARAM('rowsets_enabled', 'FALSE') */ array_except(arr_tint, arr_uint) from arr_t1 order by id;
array_except(arr_tint, arr_uint)
[NULL]
[1,2]
[1]
[3]
[]
[]
select /*+ OPT_PARAM('rowsets_enabled', 'FALSE') */ array_except(arr_tint, arr_usint) from arr_t1 order by id;
array_except(arr_tint, arr_usint)
[]
[1,2]
[]
[]
[1]
[]
select /*+ OPT_PARAM('rowsets_enabled', 'FALSE') */ array_except(arr_tint, arr_usbigint) from arr_t1 order by id;
array_except(arr_tint, arr_usbigint)
[NULL]
[1,2]
[1]
[3]
[3]
[]
select /*+ OPT_PARAM('rowsets_enabled', 'FALSE') */ array_except(arr_tint, arr_vchar) from arr_t1 order by id;
array_except(arr_tint, arr_vchar)
["1","2","3",NULL]
["1","2"]
["1","3"]
["3"]
["1","3"]
["1","2","3"]
select /*+ OPT_PARAM('rowsets_enabled', 'FALSE') */ array_except(arr_int, arr_sint) from arr_t1 order by id;
array_except(arr_int, arr_sint)
[]
[]
[3]
[2]
[2]
[]
select /*+ OPT_PARAM('rowsets_enabled', 'FALSE') */ array_except(arr_int, arr_tint) from arr_t1 order by id;
array_except(arr_int, arr_tint)
[]
[]
[]
[2]
[2]
[]
select /*+ OPT_PARAM('rowsets_enabled', 'FALSE') */ array_except(arr_int, arr_bint) from arr_t1 order by id;
array_except(arr_int, arr_bint)
[]
[1]
[1]
[]
[3]
[]
select /*+ OPT_PARAM('rowsets_enabled', 'FALSE') */ array_except(arr_int, arr_uint) from arr_t1 order by id;
array_except(arr_int, arr_uint)
[]
[1,2]
[1]
[2]
[2]
[]
select /*+ OPT_PARAM('rowsets_enabled', 'FALSE') */ array_except(arr_int, arr_usint) from arr_t1 order by id;
array_except(arr_int, arr_usint)
[]
[1,2]
[]
[2]
[1]
[]
select /*+ OPT_PARAM('rowsets_enabled', 'FALSE') */ array_except(arr_int, arr_usbigint) from arr_t1 order by id;
array_except(arr_int, arr_usbigint)
[]
[1,2]
[1]
[]
[3]
[]
select /*+ OPT_PARAM('rowsets_enabled', 'FALSE') */ array_except(arr_int, arr_vchar) from arr_t1 order by id;
array_except(arr_int, arr_vchar)
["1","2","3"]
["1","2"]
["1","3"]
["2"]
["1","2","3"]
["1","2","3"]
select /*+ OPT_PARAM('rowsets_enabled', 'FALSE') */ array_except(arr_bint, arr_sint) from arr_t1 order by id;
array_except(arr_bint, arr_sint)
[NULL]
[3]
[3]
[2]
[2]
[]
select /*+ OPT_PARAM('rowsets_enabled', 'FALSE') */ array_except(arr_bint, arr_int) from arr_t1 order by id;
array_except(arr_bint, arr_int)
[NULL]
[3]
[2]
[]
[]
[]
select /*+ OPT_PARAM('rowsets_enabled', 'FALSE') */ array_except(arr_bint, arr_tint) from arr_t1 order by id;
array_except(arr_bint, arr_tint)
[]
[3]
[2]
[2]
[2]
[]
select /*+ OPT_PARAM('rowsets_enabled', 'FALSE') */ array_except(arr_bint, arr_uint) from arr_t1 order by id;
array_except(arr_bint, arr_uint)
[NULL]
[2]
[2]
[2]
[2]
[]
select /*+ OPT_PARAM('rowsets_enabled', 'FALSE') */ array_except(arr_bint, arr_usint) from arr_t1 order by id;
array_except(arr_bint, arr_usint)
[]
[2]
[2]
[2]
[1]
[]
select /*+ OPT_PARAM('rowsets_enabled', 'FALSE') */ array_except(arr_bint, arr_usbigint) from arr_t1 order by id;
array_except(arr_bint, arr_usbigint)
[NULL]
[2]
[2]
[]
[]
[]
select /*+ OPT_PARAM('rowsets_enabled', 'FALSE') */ array_except(arr_bint, arr_vchar) from arr_t1 order by id;
array_except(arr_bint, arr_vchar)
["1","2","3",NULL]
["2","3"]
["2","3"]
["2"]
["1","2"]
["1","2","3"]
select /*+ OPT_PARAM('rowsets_enabled', 'FALSE') */ array_except(arr_vchar, arr_sint) from arr_t1 order by id;
array_except(arr_vchar, arr_sint)
["a","b","c"]
["c"]
["c"]
["a","b"]
["a","c"]
["a","b","c"]
select /*+ OPT_PARAM('rowsets_enabled', 'FALSE') */ array_except(arr_vchar, arr_int) from arr_t1 order by id;
array_except(arr_vchar, arr_int)
["a","b","c"]
["c"]
["c"]
["a","b"]
["a","c"]
["a","b","c"]
select /*+ OPT_PARAM('rowsets_enabled', 'FALSE') */ array_except(arr_vchar, arr_bint) from arr_t1 order by id;
array_except(arr_vchar, arr_bint)
["a","b","c"]
["c"]
["c"]
["a","b"]
["a","c"]
["a","b","c"]
select /*+ OPT_PARAM('rowsets_enabled', 'FALSE') */ array_except(arr_vchar, arr_uint) from arr_t1 order by id;
array_except(arr_vchar, arr_uint)
["a","b","c"]
["c"]
["c"]
["a","b"]
["a","c"]
["a","b","c"]
select /*+ OPT_PARAM('rowsets_enabled', 'FALSE') */ array_except(arr_vchar, arr_usint) from arr_t1 order by id;
array_except(arr_vchar, arr_usint)
["a","b","c"]
["c"]
["c"]
["a","b"]
["a","c"]
["a","b","c"]
select /*+ OPT_PARAM('rowsets_enabled', 'FALSE') */ array_except(arr_vchar, arr_usbigint) from arr_t1 order by id;
array_except(arr_vchar, arr_usbigint)
["a","b","c"]
["c"]
["c"]
["a","b"]
["a","c"]
["a","b","c"]
select /*+ OPT_PARAM('rowsets_enabled', 'FALSE') */ array_except(arr_vchar, arr_tint) from arr_t1 order by id;
array_except(arr_vchar, arr_tint)
["a","b","c"]
["c"]
["c"]
["a","b"]
["a","c"]
["a","b","c"]
select /*+ OPT_PARAM('rowsets_enabled', 'FALSE') */ array_except(c3, c4) from arr_t1 order by id;
array_except(c3, c4)
[[1.100000023841858,2.200000047683716,3.299999952316284],[4.400000095367432,5.5,6.599999904632568]]
[[3.299999952316284],[4.400000095367432,5.5,6.599999904632568]]
[[1.100000023841858,2.200000047683716,3.299999952316284],[4.400000095367432]]
[[1.100000023841858],[4.400000095367432,5.5,6.599999904632568]]
[[1.100000023841858,2.200000047683716,3.299999952316284],[4.400000095367432,5.5,6.599999904632568]]
[[1.100000023841858,2.200000047683716,3.299999952316284],[4.400000095367432,5.5,6.599999904632568]]
select /*+ OPT_PARAM('rowsets_enabled', 'FALSE') */ array_except(c4, c3) from arr_t1 order by id;
array_except(c4, c3)
[[1.1,2.2,3.3],[4.4,5.5,6.6]]
[[1.1,2.2,3.3],[4.4]]
[[1.1,2.2,3.3],[6.6]]
[[1.1,3.3],[4.4,5.5,6.6]]
[[1.1,2.2,3.3],[4.4,5.5,6.6]]
[[1.1,2.2,3.3],[4.4,5.5,6.6]]
select /*+ OPT_PARAM('rowsets_enabled', 'FALSE') */ array_except(c5, c6) from arr_t1 order by id;
array_except(c5, c6)
[[1,2,3]]
[[1,2,3]]
[[1,2,3]]
[[1,2,3]]
[[1,2,3]]
[[1,2,3]]
select /*+ OPT_PARAM('rowsets_enabled', 'FALSE') */ array_except(c6, c5) from arr_t1 order by id;
array_except(c6, c5)
[[1,2]]
[[1,2]]
[[1,2]]
[[1,2]]
[[1,2]]
[[1,2]]
select /*+ OPT_PARAM('rowsets_enabled', 'FALSE') */ array_except(c3, c5) from arr_t1 order by id;
array_except(c3, c5)
[[1.100000023841858,2.200000047683716,3.299999952316284],[4.400000095367432,5.5,6.599999904632568]]
[[3.299999952316284],[4.400000095367432,5.5,6.599999904632568]]
[[1.100000023841858,2.200000047683716,3.299999952316284],[4.400000095367432]]
[[1.100000023841858],[4.400000095367432,5.5,6.599999904632568]]
[[1.100000023841858,2.200000047683716,3.299999952316284],[4.400000095367432,5.5,6.599999904632568]]
[[1.100000023841858,2.200000047683716,3.299999952316284],[4.400000095367432,5.5,6.599999904632568]]
select /*+ OPT_PARAM('rowsets_enabled', 'FALSE') */ array_except(arr_double, arr_float) from arr_t1 order by id;
array_except(arr_double, arr_float)
[1.1,2.2,3.3]
[1.1,2.2,3.3]
[1.1,2.2,3.3]
[1.1,2.2,3.3]
[1.1,2.2,3.3]
[1.1,2.2,3.3]
select /*+ OPT_PARAM('rowsets_enabled', 'FALSE') */ array_except(arr_float, arr_double) from arr_t1 order by id;
array_except(arr_float, arr_double)
[1.100000023841858,2.200000047683716,3.299999952316284]
[1.100000023841858,2.200000047683716,3.299999952316284]
[1.100000023841858,2.200000047683716,3.299999952316284]
[1.100000023841858,2.200000047683716,3.299999952316284]
[1.100000023841858,2.200000047683716,3.299999952316284]
[1.100000023841858,2.200000047683716,3.299999952316284]
with array_data as (
select id, arr_tint, arr_sint from arr_t1
where id IN(5, 6)
)
select id, array_except(arr_tint, arr_sint) from array_data order by id;
id	array_except(arr_tint, arr_sint)
5	[]
6	[]
with texcept as (
select id, array_except(arr_tint, arr_sint) from arr_t1
where id IN(5, 6)
)
select * from texcept order by id;
id	array_except(arr_tint, arr_sint)
5	[]
6	[]
INSERT IGNORE INTO arr_t1(id, arr_int) select id + 7, array_except(arr_tint, arr_sint) from arr_t1;
INSERT INTO arr_t1(id, arr_int) VALUES(14, [array_except(null, null)]);
select id, arr_int from arr_t1 order by id;
id	arr_int
1	[1,2,3]
2	[1,2]
3	[1,3]
4	[2]
5	[1,2,3]
6	[1,2,3]
8	[NULL]
9	[]
10	[3]
11	[]
12	[]
13	[]
14	[NULL]
drop table if exists t1;
CREATE TABLE t1 (id int primary key, arr_tint Array(TINYINT), arr_sint Array(SMALLINT), arr_int Array(INT), arr_bint Array(BIGINT),
arr_utint Array(TINYINT UNSIGNED), arr_usint Array(SMALLINT UNSIGNED), arr_uint Array(INT UNSIGNED), arr_ubint Array(BIGINT UNSIGNED),
arr_flt Array(FLOAT), arr_dob Array(DOUBLE), vec vector(3))
PARTITION BY RANGE (id) (
PARTITION p1 VALUES LESS THAN (2),
PARTITION p3 VALUES LESS THAN (10)
);
INSERT INTO t1(id) VALUES(1);
INSERT INTO t1 VALUES(2, [-1,2,1], [-1,2,1], [-1,2,1], [-1,2,1],
[0,2,1], [0,2,1], [0,2,1], [0,2,1],
[-1,2,1], [-1,2,1], [-1,2,1]);
INSERT INTO t1 VALUES(3, [-128,127], [-32768,32767], [-2147483648,2147483647], [-9223372036854775808,9223372036854775807],
[0,255], [0,65535], [0,4294967295], [0,9223372036854775807],
[-3.402823466E+38,-1.175494351E-38], [-1.7976931348623157E+308,-2.2250738585072014E-308], [0,0,0]);
UPDATE t1
SET id = 8
WHERE id = 1;
update /*+ ENABLE_PARALLEL_DML parallel(256) */ 
t1 set arr_int = array_except(arr_int, arr_sint) where id = 2;
update t1 set arr_int = array_except(arr_int, arr_sint) where id = 3;
select id, arr_int from t1 order by id;
id	arr_int
2	[]
3	[-2147483648,2147483647]
8	NULL
drop table if exists t1;
drop table if exists arr_t1;
