# ----------------------------------------------------------------------
# Test of array_sort.
# ----------------------------------------------------------------------
drop table if exists t1;
select array_sort([NULL]);
array_sort([NULL])
[NULL]
select array_sort([NULL,NULL,NULL]);
array_sort([NULL,NULL,NULL])
[NULL,NULL,NULL]
select array_sort([2,1,3]);
array_sort([2,1,3])
[1,2,3]
select array_sort([2,-1,3]);
array_sort([2,-1,3])
[-1,2,3]
select array_sort([2.1,3,1,1]);
array_sort([2.1,3,1,1])
[1,1,2.1,3]
select array_sort([NULL,1,2,NULL,2,NULL,NULL]);
array_sort([NULL,1,2,NULL,2,NULL,NULL])
[1,2,2,NULL,NULL,NULL,NULL]
select array_sort([1.1,2.2]);
array_sort([1.1,2.2])
[1.1,2.2]
select array_sort([1.1,2.3,2.2]);
array_sort([1.1,2.3,2.2])
[1.1,2.2,2.3]
select array_sort(['a','b','c','d']);
array_sort(['a','b','c','d'])
["a","b","c","d"]
select array_sort(['a','a','A',NULL]);
array_sort(['a','a','A',NULL])
["A","a","a",NULL]
select array_sort(["hello", "hi"]);
array_sort(["hello", "hi"])
["hello","hi"]
select array_sort(["hello","hello",NULL,NULL,"OceanBase"]);
array_sort(["hello","hello",NULL,NULL,"OceanBase"])
["OceanBase","hello","hello",NULL,NULL]
select array_sort([[NULL],NULL]);
ERROR 0A000: array_sort with multi-dimension array not supported
select array_sort([[1,2,3],[4]]);
ERROR 0A000: array_sort with multi-dimension array not supported
select array_sort(element_at([1,2,3], 2));
ERROR 22000: invalid obj type for type promotion: left_type=ARRAY right_type=BIGINT
select array_sort(element_at([[1,2],[3,4]], 1));
array_sort(element_at([[1,2],[3,4]], 1))
[1,2]
CREATE TABLE t1 (id int primary key, c1 Array(BigInt), c2 Array(BigInt UNSIGNED), c3 Array(double), c4 vector(3));
INSERT INTO t1(id) VALUES(1);
INSERT INTO t1 VALUES(2, [NULL], [NULL], [NULL], [0,0,0]);
INSERT INTO t1 VALUES(3, [-9223372036854775808,9223372036854775807,NULL,0,NULL], [cast(9223372036854775807 as unsigned),18446744073709551615,NULL,cast(0 as unsigned),NULL], [1.1,1.2,NULL,3.3], [1,3,2]);
select id, array_sort(c1), array_sort(c2), array_sort(c3), array_sort(c4) from t1;
id	array_sort(c1)	array_sort(c2)	array_sort(c3)	array_sort(c4)
1	NULL	NULL	NULL	NULL
2	[NULL]	[NULL]	[NULL]	[0,0,0]
3	[-9223372036854775808,0,9223372036854775807,NULL,NULL]	[0,9223372036854775807,18446744073709551615,NULL,NULL]	[1.1,1.2,3.3,NULL]	[1,2,3]
select /*+ OPT_PARAM('enable_rich_vector_format', 'FALSE') */ id, array_sort(c1), array_sort(c2), array_sort(c3), array_sort(c4) from t1;
id	array_sort(c1)	array_sort(c2)	array_sort(c3)	array_sort(c4)
1	NULL	NULL	NULL	NULL
2	[NULL]	[NULL]	[NULL]	[0,0,0]
3	[-9223372036854775808,0,9223372036854775807,NULL,NULL]	[0,9223372036854775807,18446744073709551615,NULL,NULL]	[1.1,1.2,3.3,NULL]	[1,2,3]
select /*+ OPT_PARAM('rowsets_enabled', 'FALSE') */ id, array_sort(c1), array_sort(c2), array_sort(c3), array_sort(c4) from t1;
id	array_sort(c1)	array_sort(c2)	array_sort(c3)	array_sort(c4)
1	NULL	NULL	NULL	NULL
2	[NULL]	[NULL]	[NULL]	[0,0,0]
3	[-9223372036854775808,0,9223372036854775807,NULL,NULL]	[0,9223372036854775807,18446744073709551615,NULL,NULL]	[1.1,1.2,3.3,NULL]	[1,2,3]
drop table if exists t_create;
create table t_create as select array_sort(NULL), array_sort([1,2,5,4]);
desc t_create;
Field	Type	Null	Key	Default	Extra
array_sort(NULL)	binary(0)	YES		NULL	
array_sort([1,2,5,4])	ARRAY(BIGINT)	YES		NULL	
select * from t_create;
array_sort(NULL)	array_sort([1,2,5,4])
NULL	[1,2,4,5]
drop table t_create;
create table t_create as select array_sort(NULL), array_sort(c1) from t1;
desc t_create;
Field	Type	Null	Key	Default	Extra
array_sort(NULL)	binary(0)	YES		NULL	
array_sort(c1)	ARRAY(BIGINT)	YES		NULL	
select * from t_create;
array_sort(NULL)	array_sort(c1)
NULL	NULL
NULL	[NULL]
NULL	[-9223372036854775808,0,9223372036854775807,NULL,NULL]
drop table t_create;
with array_data as (
select id, c1 from t1
)
select id, array_sort(c1) from array_data;
id	array_sort(c1)
1	NULL
2	[NULL]
3	[-9223372036854775808,0,9223372036854775807,NULL,NULL]
with tsort as (
select id, array_sort(c1) from t1
)
select * from tsort;
id	array_sort(c1)
1	NULL
2	[NULL]
3	[-9223372036854775808,0,9223372036854775807,NULL,NULL]
INSERT IGNORE INTO t1(id, c1) select id + 2, array_sort(c1) from t1;
REPLACE INTO t1(id, c1) VALUES(5, array_sort([NULL]));
select id, c1 from t1 order by id;
id	c1
1	NULL
2	[NULL]
3	[-9223372036854775808,9223372036854775807,NULL,0,NULL]
4	[NULL]
5	[NULL]
update /*+ ENABLE_PARALLEL_DML parallel(256) */
t1 set c1 = array_sort(c1);
update t1 set c1 = array_sort(c1) where id = 1;
select id, c1 from t1 order by id;
id	c1
1	NULL
2	[NULL]
3	[-9223372036854775808,0,9223372036854775807,NULL,NULL]
4	[NULL]
5	[NULL]
select array_sort();
ERROR 42000: Incorrect parameter count in the call to native function 'array_sort'
select array_sort(1);
ERROR 22000: invalid obj type for type promotion: left_type=ARRAY right_type=BIGINT
select array_sort(NULL);
array_sort(NULL)
NULL
drop table t1;
drop table if exists tt;
create table tt(id int, arr_int int[], arr_dint array(array(int)), arr_vec array(vector(1)), arr_char array(varchar(10)));
insert into tt values(1, [1], [[1], [2]], [[1], [2]], ['a', 'b']);
insert into tt values(2, null, [[1], [2]], [[1], [2]], ['a', 'b']);
insert into tt values(3, array_remove([1], 1), [[1], [2]], [[1], [2]], ['a', 'b']);
insert into tt values(4, [null, 1], [[1], [2]], [[1], [2]], ['a', 'b']);
insert into tt values(5, [null], [[1], [2]], [[1], [2]], ['a', 'b']);
insert into tt values(6, [1], null, [[1], [2]], ['a', 'b']);
insert into tt values(7, [1], array_remove([[1]], [1]), [[1], [2]], ['a', 'b']);
insert into tt values(8, [1], [null, [2]], [[1], [2]], ['a', 'b']);
insert into tt values(9, [1], array_append(array_remove([[1]],[1]), null), [[1], [2]], ['a', 'b']);
insert into tt values(10, [1], [[null], [2]], [[1], [2]], ['a', 'b']);
insert into tt values(11, [1], [[null, 1], [2]], [[1], [2]], ['a', 'b']);
insert into tt values(12, [1], [array_remove([1], 1)], [[1], [2]], ['a', 'b']);
insert into tt values(13, [1], [array_remove([1], 1), [2]], [[1], [2]], ['a', 'b']);
insert into tt values(14, [1], [[1], [2]], null, ['a', 'b']);
insert into tt values(15, [1], [[1], [2]], array_remove([[1]], [1]), ['a', 'b']);
insert into tt values(16, [1], [[1], [2]], array_append(array_remove([[1]],[1]), null), ['a', 'b']);
insert into tt values(17, [1], [[1], [2]], [[1], [2]], null);
insert into tt values(18, [1], [[1], [2]], [[1], [2]], array_remove(['a'], 'a'));
insert into tt values(19, [1], [[1], [2]], [[1], [2]], array_append(array_remove(['a'],'a'), null));
select id, array_sort(arr_int) from tt;
id	array_sort(arr_int)
1	[1]
2	NULL
3	[]
4	[1,NULL]
5	[NULL]
6	[1]
7	[1]
8	[1]
9	[1]
10	[1]
11	[1]
12	[1]
13	[1]
14	[1]
15	[1]
16	[1]
17	[1]
18	[1]
19	[1]
select id, array_sort(arr_char) from tt;
id	array_sort(arr_char)
1	["a","b"]
2	["a","b"]
3	["a","b"]
4	["a","b"]
5	["a","b"]
6	["a","b"]
7	["a","b"]
8	["a","b"]
9	["a","b"]
10	["a","b"]
11	["a","b"]
12	["a","b"]
13	["a","b"]
14	["a","b"]
15	["a","b"]
16	["a","b"]
17	NULL
18	[]
19	[NULL]
drop table if exists tt;
