# ----------------------------------------------------------------------
# Test of array_compact.
# ----------------------------------------------------------------------
drop table if exists t1, t2;
select array_compact([NULL]);
array_compact([NULL])
[NULL]
select array_compact([NULL,NULL,NULL]);
array_compact([NULL,NULL,NULL])
[NULL]
select array_compact([1,2,3]);
array_compact([1,2,3])
[1,2,3]
select array_compact([1,1,2,1,1]);
array_compact([1,1,2,1,1])
[1,2,1]
select array_compact([NULL,NULL,1,2,NULL,2,NULL,NULL]);
array_compact([NULL,NULL,1,2,NULL,2,NULL,NULL])
[NULL,1,2,NULL,2,NULL]
select array_compact([1.1,2.2]);
array_compact([1.1,2.2])
[1.1,2.2]
select array_compact([1.1,2.2,2.2]);
array_compact([1.1,2.2,2.2])
[1.1,2.2]
select array_compact(['a','b','c','d']);
array_compact(['a','b','c','d'])
["a","b","c","d"]
select array_compact(['a','a','A',NULL]);
array_compact(['a','a','A',NULL])
["a","A",NULL]
select array_compact(["hello", "hi"]);
array_compact(["hello", "hi"])
["hello","hi"]
select array_compact(["hello","hello",NULL,NULL,"OceanBase"]);
array_compact(["hello","hello",NULL,NULL,"OceanBase"])
["hello",NULL,"OceanBase"]
select array_compact([[NULL],NULL]);
array_compact([[NULL],NULL])
[[NULL],NULL]
select array_compact([[1,2,3],[4]]);
array_compact([[1,2,3],[4]])
[[1,2,3],[4]]
select array_compact([[1,2,3],[1,2,3],[4],[4]]);
array_compact([[1,2,3],[1,2,3],[4],[4]])
[[1,2,3],[4]]
select array_compact([[1,2,3],NULL,NULL,[4,5],[4]]);
array_compact([[1,2,3],NULL,NULL,[4,5],[4]])
[[1,2,3],NULL,[4,5],[4]]
select array_compact([[1,2,3,NULL],[4,NULL],[4,NULL]]);
array_compact([[1,2,3,NULL],[4,NULL],[4,NULL]])
[[1,2,3,NULL],[4,NULL]]
select array_compact([[1.1],[1.1],[1.1,2.2],NULL,NULL]);
array_compact([[1.1],[1.1],[1.1,2.2],NULL,NULL])
[[1.1],[1.1,2.2],NULL]
select array_compact([['a','b','c','d'],['a','b','c','d'],['a','b','c','d']]);
array_compact([['a','b','c','d'],['a','b','c','d'],['a','b','c','d']])
[["a","b","c","d"]]
select array_compact([NULL,NULL,['a',NULL],['a',NULL],['d']]);
array_compact([NULL,NULL,['a',NULL],['a',NULL],['d']])
[NULL,["a",NULL],["d"]]
select array_compact([["hello", "world"],["hi", "what"],["hi", "what"],["are you?"]]);
array_compact([["hello", "world"],["hi", "what"],["hi", "what"],["are you?"]])
[["hello","world"],["hi","what"],["are you?"]]
select array_compact(element_at([1,2,3], 2));
ERROR 22000: invalid obj type for type promotion: left_type=ARRAY right_type=BIGINT
select array_compact(element_at([[1,2],[3,4]], 1));
array_compact(element_at([[1,2],[3,4]], 1))
[1,2]
select array_compact(element_at([[1,1],[4,4]], 1));
array_compact(element_at([[1,1],[4,4]], 1))
[1]
select array_compact(element_at([[1,2],[3,4]], 10));
array_compact(element_at([[1,2],[3,4]], 10))
NULL
select array_compact(element_at([["hello", "world"], ["hi", "what"], ["are you?"]], 3));
array_compact(element_at([["hello", "world"], ["hi", "what"], ["are you?"]], 3))
["are you?"]
select array_compact(array_append([1,2,3], 3));
array_compact(array_append([1,2,3], 3))
[1,2,3]
select array_compact(array_append([["hello", "world"], ["hi", "what"], ["are you?"]], ["hi", "what"]));
array_compact(array_append([["hello", "world"], ["hi", "what"], ["are you?"]], ["hi", "what"]))
[["hello","world"],["hi","what"],["are you?"],["hi","what"]]
CREATE TABLE t1 (id int primary key, c1 Array(BigInt), c2 Array(double), c3 Array(varchar(1)), c4 Array(varchar(10)), c5 vector(3));
INSERT INTO t1(id) VALUES(1);
INSERT INTO t1 VALUES(2, [NULL], [NULL], [NULL], [NULL], [0,0,0]);
INSERT INTO t1 VALUES(3, [1,1,NULL,3], [1.1,1.1,NULL,3.3], ['a','a',NULL,'c'], ['hello','hello',NULL,'Ocean'], [1,1,3]);
select id, array_compact(c1), array_compact(c2), array_compact(c3), array_compact(c4), array_compact(c5) from t1;
id	array_compact(c1)	array_compact(c2)	array_compact(c3)	array_compact(c4)	array_compact(c5)
1	NULL	NULL	NULL	NULL	NULL
2	[NULL]	[NULL]	[NULL]	[NULL]	[0]
3	[1,NULL,3]	[1.1,NULL,3.3]	["a",NULL,"c"]	["hello",NULL,"Ocean"]	[1,3]
select /*+ OPT_PARAM('enable_rich_vector_format', 'FALSE') */ id, array_compact(c1), array_compact(c2), array_compact(c3), array_compact(c4), array_compact(c5) from t1;
id	array_compact(c1)	array_compact(c2)	array_compact(c3)	array_compact(c4)	array_compact(c5)
1	NULL	NULL	NULL	NULL	NULL
2	[NULL]	[NULL]	[NULL]	[NULL]	[0]
3	[1,NULL,3]	[1.1,NULL,3.3]	["a",NULL,"c"]	["hello",NULL,"Ocean"]	[1,3]
select /*+ OPT_PARAM('rowsets_enabled', 'FALSE') */ id, array_compact(c1), array_compact(c2), array_compact(c3), array_compact(c4), array_compact(c5) from t1;
id	array_compact(c1)	array_compact(c2)	array_compact(c3)	array_compact(c4)	array_compact(c5)
1	NULL	NULL	NULL	NULL	NULL
2	[NULL]	[NULL]	[NULL]	[NULL]	[0]
3	[1,NULL,3]	[1.1,NULL,3.3]	["a",NULL,"c"]	["hello",NULL,"Ocean"]	[1,3]
create table t2 (id int, c1 int[][], c2 float[][], c3 varchar(1)[][], c4 varchar(10)[][]);
INSERT INTO t2(id) VALUES(1);
INSERT INTO t2 VALUES(2, [[NULL]], [[NULL]], [[NULL]], [[NULL]]);
INSERT INTO t2 VALUES(3, [[NULL],[NULL]], [[NULL],[NULL]], [[NULL],[NULL]], [[NULL],[NULL]]);
INSERT INTO t2 VALUES(4, [[1,2],[1,2],NULL,NULL], [[1.1,2.2],[1.1,2.2],NULL,NULL], [['a','b'],['a','b'],NULL,NULL], [['hello', 'world'],['hello', 'world'],NULL,NULL]);
select id, array_compact(c1), array_compact(c2), array_compact(c3), array_compact(c4) from t2;
id	array_compact(c1)	array_compact(c2)	array_compact(c3)	array_compact(c4)
1	NULL	NULL	NULL	NULL
2	[[NULL]]	[[NULL]]	[[NULL]]	[[NULL]]
3	[[NULL]]	[[NULL]]	[[NULL]]	[[NULL]]
4	[[1,2],NULL]	[[1.1,2.2],NULL]	[["a","b"],NULL]	[["hello","world"],NULL]
select /*+ OPT_PARAM('enable_rich_vector_format', 'FALSE') */ id, array_compact(c1), array_compact(c2), array_compact(c3), array_compact(c4) from t2;
id	array_compact(c1)	array_compact(c2)	array_compact(c3)	array_compact(c4)
1	NULL	NULL	NULL	NULL
2	[[NULL]]	[[NULL]]	[[NULL]]	[[NULL]]
3	[[NULL]]	[[NULL]]	[[NULL]]	[[NULL]]
4	[[1,2],NULL]	[[1.1,2.2],NULL]	[["a","b"],NULL]	[["hello","world"],NULL]
select /*+ OPT_PARAM('rowsets_enabled', 'FALSE') */ id, array_compact(c1), array_compact(c2), array_compact(c3), array_compact(c4) from t2;
id	array_compact(c1)	array_compact(c2)	array_compact(c3)	array_compact(c4)
1	NULL	NULL	NULL	NULL
2	[[NULL]]	[[NULL]]	[[NULL]]	[[NULL]]
3	[[NULL]]	[[NULL]]	[[NULL]]	[[NULL]]
4	[[1,2],NULL]	[[1.1,2.2],NULL]	[["a","b"],NULL]	[["hello","world"],NULL]
drop table if exists t_create;
create table t_create as select array_compact(NULL), array_compact([1,2,3,4]);
desc t_create;
Field	Type	Null	Key	Default	Extra
array_compact(NULL)	binary(0)	YES		NULL	
array_compact([1,2,3,4])	ARRAY(BIGINT)	YES		NULL	
select * from t_create;
array_compact(NULL)	array_compact([1,2,3,4])
NULL	[1,2,3,4]
drop table t_create;
create table t_create as select array_compact(NULL), array_compact(c1) from t1;
desc t_create;
Field	Type	Null	Key	Default	Extra
array_compact(NULL)	binary(0)	YES		NULL	
array_compact(c1)	ARRAY(BIGINT)	YES		NULL	
select * from t_create;
array_compact(NULL)	array_compact(c1)
NULL	NULL
NULL	[NULL]
NULL	[1,NULL,3]
drop table t_create;
INSERT IGNORE t1(id, c1) select id + 2, array_compact(c1) from t1;
select id, c1 from t1 order by id;
id	c1
1	NULL
2	[NULL]
3	[1,1,NULL,3]
4	[NULL]
5	[1,NULL,3]
update /*+ ENABLE_PARALLEL_DML parallel(256) */
t1 set c1 = array_compact(c1) where id > 1;
update t1 set c1 = array_compact([null, 1, 1, 2]) where id = 1;
select id, c1 from t1 order by id;
id	c1
1	[NULL,1,2]
2	[NULL]
3	[1,NULL,3]
4	[NULL]
5	[1,NULL,3]
select array_compact();
ERROR 42000: Incorrect parameter count in the call to native function 'array_compact'
select array_compact(1);
ERROR 22000: invalid obj type for type promotion: left_type=ARRAY right_type=BIGINT
select array_compact(NULL);
array_compact(NULL)
NULL
drop table t1, t2;
drop table if exists tt;
create table tt(id int, arr_int int[], arr_dint array(array(int)), arr_vec array(vector(1)), arr_char array(varchar(10)));
insert into tt values(1, [1], [[1], [2]], [[1], [2]], ['a', 'b']);
insert into tt values(2, null, [[1], [2]], [[1], [2]], ['a', 'b']);
insert into tt values(3, array_remove([1], 1), [[1], [2]], [[1], [2]], ['a', 'b']);
insert into tt values(4, [null, 1], [[1], [2]], [[1], [2]], ['a', 'b']);
insert into tt values(5, [null], [[1], [2]], [[1], [2]], ['a', 'b']);
insert into tt values(6, [1], null, [[1], [2]], ['a', 'b']);
insert into tt values(7, [1], array_remove([[1]], [1]), [[1], [2]], ['a', 'b']);
insert into tt values(8, [1], [null, [2]], [[1], [2]], ['a', 'b']);
insert into tt values(9, [1], array_append(array_remove([[1]],[1]), null), [[1], [2]], ['a', 'b']);
insert into tt values(10, [1], [[null], [2]], [[1], [2]], ['a', 'b']);
insert into tt values(11, [1], [[null, 1], [2]], [[1], [2]], ['a', 'b']);
insert into tt values(12, [1], [array_remove([1], 1)], [[1], [2]], ['a', 'b']);
insert into tt values(13, [1], [array_remove([1], 1), [2]], [[1], [2]], ['a', 'b']);
insert into tt values(14, [1], [[1], [2]], null, ['a', 'b']);
insert into tt values(15, [1], [[1], [2]], array_remove([[1]], [1]), ['a', 'b']);
insert into tt values(16, [1], [[1], [2]], array_append(array_remove([[1]],[1]), null), ['a', 'b']);
insert into tt values(17, [1], [[1], [2]], [[1], [2]], null);
insert into tt values(18, [1], [[1], [2]], [[1], [2]], array_remove(['a'], 'a'));
insert into tt values(19, [1], [[1], [2]], [[1], [2]], array_append(array_remove(['a'],'a'), null));
select id, array_compact(arr_int) from tt;
id	array_compact(arr_int)
1	[1]
2	NULL
3	[]
4	[NULL,1]
5	[NULL]
6	[1]
7	[1]
8	[1]
9	[1]
10	[1]
11	[1]
12	[1]
13	[1]
14	[1]
15	[1]
16	[1]
17	[1]
18	[1]
19	[1]
select id, array_compact(arr_dint) from tt;
id	array_compact(arr_dint)
1	[[1],[2]]
2	[[1],[2]]
3	[[1],[2]]
4	[[1],[2]]
5	[[1],[2]]
6	NULL
7	[]
8	[NULL,[2]]
9	[NULL]
10	[[NULL],[2]]
11	[[NULL,1],[2]]
12	[[]]
13	[[],[2]]
14	[[1],[2]]
15	[[1],[2]]
16	[[1],[2]]
17	[[1],[2]]
18	[[1],[2]]
19	[[1],[2]]
select id, array_compact(arr_vec) from tt;
id	array_compact(arr_vec)
1	[[1],[2]]
2	[[1],[2]]
3	[[1],[2]]
4	[[1],[2]]
5	[[1],[2]]
6	[[1],[2]]
7	[[1],[2]]
8	[[1],[2]]
9	[[1],[2]]
10	[[1],[2]]
11	[[1],[2]]
12	[[1],[2]]
13	[[1],[2]]
14	NULL
15	[]
16	[NULL]
17	[[1],[2]]
18	[[1],[2]]
19	[[1],[2]]
select id, array_compact(arr_char) from tt;
id	array_compact(arr_char)
1	["a","b"]
2	["a","b"]
3	["a","b"]
4	["a","b"]
5	["a","b"]
6	["a","b"]
7	["a","b"]
8	["a","b"]
9	["a","b"]
10	["a","b"]
11	["a","b"]
12	["a","b"]
13	["a","b"]
14	["a","b"]
15	["a","b"]
16	["a","b"]
17	NULL
18	[]
19	[NULL]
drop table if exists tt;
