# ----------------------------------------------------------------------
# Test of array_range.
# ----------------------------------------------------------------------
drop table if exists t1, t2;
select array_range(NULL);
array_range(NULL)
NULL
select array_range(NULL, NULL);
array_range(NULL, NULL)
NULL
select array_range(NULL, NULL, NULL);
array_range(NULL, NULL, NULL)
NULL
select array_range(0);
array_range(0)
[]
select array_range(1);
array_range(1)
[0]
select array_range(10);
array_range(10)
[0,1,2,3,4,5,6,7,8,9]
select array_range(10.1);
array_range(10.1)
[0,1,2,3,4,5,6,7,8,9]
select array_range(10.6);
array_range(10.6)
[0,1,2,3,4,5,6,7,8,9,10]
select array_range("10.5a");
array_range("10.5a")
[0,1,2,3,4,5,6,7,8,9]
Warnings:
Warning	1292	Truncated incorrect INTEGER value: '10.5a'
select array_range('2.5');
array_range('2.5')
[0,1]
Warnings:
Warning	1292	Truncated incorrect INTEGER value: '2.5'
select cardinality(array_range(2000000));
cardinality(array_range(2000000))
2000000
select array_range(2000001);
ERROR HY000: Size overflow
select array_range(-1);
ERROR HY000: Invalid argument
select array_range(1.1);
array_range(1.1)
[0]
select array_range('a');
array_range('a')
[]
Warnings:
Warning	1292	Truncated incorrect INTEGER value: 'a'
select array_range(-2, 5);
array_range(-2, 5)
[-2,-1,0,1,2,3,4]
select array_range(-2, 1999999);
ERROR HY000: Size overflow
select array_range(0, NULL);
array_range(0, NULL)
NULL
select array_range(3, 3);
array_range(3, 3)
[]
select array_range(3, 2);
array_range(3, 2)
[]
select array_range('1.5','4.5');
array_range('1.5','4.5')
[1,2,3]
Warnings:
Warning	1292	Truncated incorrect INTEGER value: '1.5'
Warning	1292	Truncated incorrect INTEGER value: '4.5'
select array_range('10e-1','25e-1');
array_range('10e-1','25e-1')
[10,11,12,13,14,15,16,17,18,19,20,21,22,23,24]
Warnings:
Warning	1292	Truncated incorrect INTEGER value: '10e-1'
Warning	1292	Truncated incorrect INTEGER value: '25e-1'
select array_range(-100,9223372036854775806,9223372036854775804);
array_range(-100,9223372036854775806,9223372036854775804)
[-100,9223372036854775704]
select array_range(-9223372036854775808,9223372036854775807,9223372036854775807);
array_range(-9223372036854775808,9223372036854775807,9223372036854775807)
[-9223372036854775808,-1,9223372036854775806]
select array_range(100,-9223372036854775806,-9223372036854775804);
array_range(100,-9223372036854775806,-9223372036854775804)
[100,-9223372036854775704]
select array_range(-100,9223372036854775806,922337203685477580);
array_range(-100,9223372036854775806,922337203685477580)
[-100,922337203685477480,1844674407370955060,2767011611056432640,3689348814741910220,4611686018427387800,5534023222112865380,6456360425798342960,7378697629483820540,8301034833169298120,9223372036854775700]
select array_range(100,-9223372036854775806,-922337203685477580);
array_range(100,-9223372036854775806,-922337203685477580)
[100,-922337203685477480,-1844674407370955060,-2767011611056432640,-3689348814741910220,-4611686018427387800,-5534023222112865380,-6456360425798342960,-7378697629483820540,-8301034833169298120,-9223372036854775700]
select array_range(9223372036854775807,-9223372036854775808,-92233720368547758);
array_range(9223372036854775807,-9223372036854775808,-92233720368547758)
[9223372036854775807,9131138316486228049,9038904596117680291,8946670875749132533,8854437155380584775,8762203435012037017,8669969714643489259,8577735994274941501,8485502273906393743,8393268553537845985,8301034833169298227,8208801112800750469,8116567392432202711,8024333672063654953,7932099951695107195,7839866231326559437,7747632510958011679,7655398790589463921,7563165070220916163,7470931349852368405,7378697629483820647,7286463909115272889,7194230188746725131,7101996468378177373,7009762748009629615,6917529027641081857,6825295307272534099,6733061586903986341,6640827866535438583,6548594146166890825,6456360425798343067,6364126705429795309,6271892985061247551,6179659264692699793,6087425544324152035,5995191823955604277,5902958103587056519,5810724383218508761,5718490662849961003,5626256942481413245,5534023222112865487,5441789501744317729,5349555781375769971,5257322061007222213,5165088340638674455,5072854620270126697,4980620899901578939,4888387179533031181,4796153459164483423,4703919738795935665,4611686018427387907,4519452298058840149,4427218577690292391,4334984857321744633,4242751136953196875,4150517416584649117,4058283696216101359,3966049975847553601,3873816255479005843,3781582535110458085,3689348814741910327,3597115094373362569,3504881374004814811,3412647653636267053,3320413933267719295,3228180212899171537,3135946492530623779,3043712772162076021,2951479051793528263,2859245331424980505,2767011611056432747,2674777890687884989,2582544170319337231,2490310449950789473,2398076729582241715,2305843009213693957,2213609288845146199,2121375568476598441,2029141848108050683,1936908127739502925,1844674407370955167,1752440687002407409,1660206966633859651,1567973246265311893,1475739525896764135,1383505805528216377,1291272085159668619,1199038364791120861,1106804644422573103,1014570924054025345,922337203685477587,830103483316929829,737869762948382071,645636042579834313,553402322211286555,461168601842738797,368934881474191039,276701161105643281,184467440737095523,92233720368547765,7,-92233720368547751,-184467440737095509,-276701161105643267,-368934881474191025,-461168601842738783,-553402322211286541,-645636042579834299,-737869762948382057,-830103483316929815,-922337203685477573,-1014570924054025331,-1106804644422573089,-1199038364791120847,-1291272085159668605,-1383505805528216363,-1475739525896764121,-1567973246265311879,-1660206966633859637,-1752440687002407395,-1844674407370955153,-1936908127739502911,-2029141848108050669,-2121375568476598427,-2213609288845146185,-2305843009213693943,-2398076729582241701,-2490310449950789459,-2582544170319337217,-2674777890687884975,-2767011611056432733,-2859245331424980491,-2951479051793528249,-3043712772162076007,-3135946492530623765,-3228180212899171523,-3320413933267719281,-3412647653636267039,-3504881374004814797,-3597115094373362555,-3689348814741910313,-3781582535110458071,-3873816255479005829,-3966049975847553587,-4058283696216101345,-4150517416584649103,-4242751136953196861,-4334984857321744619,-4427218577690292377,-4519452298058840135,-4611686018427387893,-4703919738795935651,-4796153459164483409,-4888387179533031167,-4980620899901578925,-5072854620270126683,-5165088340638674441,-5257322061007222199,-5349555781375769957,-5441789501744317715,-5534023222112865473,-5626256942481413231,-5718490662849960989,-5810724383218508747,-5902958103587056505,-5995191823955604263,-6087425544324152021,-6179659264692699779,-6271892985061247537,-6364126705429795295,-6456360425798343053,-6548594146166890811,-6640827866535438569,-6733061586903986327,-6825295307272534085,-6917529027641081843,-7009762748009629601,-7101996468378177359,-7194230188746725117,-7286463909115272875,-7378697629483820633,-7470931349852368391,-7563165070220916149,-7655398790589463907,-7747632510958011665,-7839866231326559423,-7932099951695107181,-8024333672063654939,-8116567392432202697,-8208801112800750455,-8301034833169298213,-8393268553537845971,-8485502273906393729,-8577735994274941487,-8669969714643489245,-8762203435012037003,-8854437155380584761,-8946670875749132519,-9038904596117680277,-9131138316486228035,-9223372036854775793]
select array_range(9223372036854775807,-9223372036854775808,-9223372036854775808);
array_range(9223372036854775807,-9223372036854775808,-9223372036854775808)
[9223372036854775807,-1]
select array_range(-2, 6, 2);
array_range(-2, 6, 2)
[-2,0,2,4]
select array_range(-2, 6.4, 2);
array_range(-2, 6.4, 2)
[-2,0,2,4]
select array_range(-2, 5.7, 2);
array_range(-2, 5.7, 2)
[-2,0,2,4]
select array_range(-2, "6a", 2);
array_range(-2, "6a", 2)
[-2,0,2,4]
Warnings:
Warning	1292	Truncated incorrect INTEGER value: '6a'
select array_range(-2, 6, 2.3);
array_range(-2, 6, 2.3)
[-2,0,2,4]
select array_range(-2, 6, 1.5);
array_range(-2, 6, 1.5)
[-2,0,2,4]
select array_range(-2, 6, "2a");
array_range(-2, 6, "2a")
[-2,0,2,4]
Warnings:
Warning	1292	Truncated incorrect INTEGER value: '2a'
select array_range(-2, 6, -1);
array_range(-2, 6, -1)
[]
select array_range(4, -6, -2);
array_range(4, -6, -2)
[4,2,0,-2,-4]
select array_range(4, -6, 1);
array_range(4, -6, 1)
[]
select array_range(-2, 6, NULL);
array_range(-2, 6, NULL)
NULL
select array_range('1.5','4.5','1.5');
array_range('1.5','4.5','1.5')
[1,2,3]
Warnings:
Warning	1292	Truncated incorrect INTEGER value: '1.5'
Warning	1292	Truncated incorrect INTEGER value: '4.5'
Warning	1292	Truncated incorrect INTEGER value: '1.5'
select array_range('10e-1','25e-1','15e-1');
array_range('10e-1','25e-1','15e-1')
[10]
Warnings:
Warning	1292	Truncated incorrect INTEGER value: '10e-1'
Warning	1292	Truncated incorrect INTEGER value: '25e-1'
Warning	1292	Truncated incorrect INTEGER value: '15e-1'
select array_range(-2000000, 2000002, 2);
ERROR HY000: Size overflow
create table t1 (id int primary key, c1 tinyint[]);
insert into t1 values (1, array_range(10));
insert into t1 values (2, array_range(2, -6, -1));
insert into t1 values (3, array_range(NULL));
insert into t1 values (4, array_range(200));
ERROR 22003: Out of range value for column 'c1' at row 1
select * from t1;
id	c1
1	[0,1,2,3,4,5,6,7,8,9]
2	[2,1,0,-1,-2,-3,-4,-5]
3	NULL
with array_data as (
select id from t1
) 
select id, array_range(id) from array_data order by id;
id	array_range(id)
1	[0]
2	[0,1]
3	[0,1,2]
with trange as (
select id, array_range(id) from t1
)
select * from trange order by id;
id	array_range(id)
1	[0]
2	[0,1]
3	[0,1,2]
INSERT IGNORE INTO t1 (id, c1) select id + 2, array_range(id) from t1;
INSERT INTO t1 (id, c1) VALUES(6, array_range(null));
REPLACE INTO t1 (id, c1) VALUES(5, array_range(null));
select * from t1 order by id;
id	c1
1	[0,1,2,3,4,5,6,7,8,9]
2	[2,1,0,-1,-2,-3,-4,-5]
3	NULL
4	[0,1]
5	NULL
6	NULL
update /*+ ENABLE_PARALLEL_DML parallel(256) */
t1 set c1 = array_range(id);
update t1 set c1 = array_range(null) where id = 1;
select id, c1 from t1 order by id;
id	c1
1	NULL
2	[0,1]
3	[0,1,2]
4	[0,1,2,3]
5	[0,1,2,3,4]
6	[0,1,2,3,4,5]
drop table t1;
drop table if exists tt3;
create table tt3(id int ,a1 varchar(50),a2 binary(10),a3 varbinary(10),a4 text,a5 blob);
insert into tt3 values(1,'3','3','3','3','3');
select array_range(a3) from tt3;
array_range(a3)
[0,1,2]
select array_range(a2) from tt3;
array_range(a2)
[0,1,2]
Warnings:
Warning	1292	Truncated incorrect INTEGER value: '3'
select array_range(a4) from tt3;
array_range(a4)
[0,1,2]
select array_range(a5) from tt3;
array_range(a5)
[0,1,2]
drop table if exists tt3;
select array_range(944264,944264924020);
ERROR HY000: Size overflow
select array_range(944264,944264924020,2);
ERROR HY000: Size overflow
select array_range(944264,944264924020,1);
ERROR HY000: Size overflow
select array_range(382926,3829261516245);
ERROR HY000: Size overflow
select array_range(1347681,1347681457162);
ERROR HY000: Size overflow
