# ----------------------------------------------------------------------
# Test of array_prepend.
# ----------------------------------------------------------------------
drop table if exists t1, t2, t3;
select array_prepend([1,2,3], 2);
array_prepend([1,2,3], 2)
[2,1,2,3]
select array_prepend([1,2,3], 0);
array_prepend([1,2,3], 0)
[0,1,2,3]
select array_prepend([1,2,3], -1);
array_prepend([1,2,3], -1)
[-1,1,2,3]
select array_prepend([1,2,3], 4);
array_prepend([1,2,3], 4)
[4,1,2,3]
select array_prepend([1,2,3], NULL);
array_prepend([1,2,3], NULL)
[NULL,1,2,3]
select array_prepend([NULL], 1);
array_prepend([NULL], 1)
[1,NULL]
select array_prepend([NULL], NULL);
array_prepend([NULL], NULL)
[NULL,NULL]
select array_prepend([1,NULL,3], 2);
array_prepend([1,NULL,3], 2)
[2,1,NULL,3]
select array_prepend(['a','b','c'], 2);
array_prepend(['a','b','c'], 2)
["2","a","b","c"]
select array_prepend([1,2,3], '2');
array_prepend([1,2,3], '2')
["2","1","2","3"]
select array_prepend([1,2,3], [2]);
ERROR 22000: array type mismatch found between definition and data
select array_prepend([1,2,3], 'hi');
array_prepend([1,2,3], 'hi')
["hi","1","2","3"]
select array_prepend([1,2,3], 2.1);
array_prepend([1,2,3], 2.1)
[2.1,1,2,3]
select array_prepend([1.1,2.2,3.3], 4);
array_prepend([1.1,2.2,3.3], 4)
[4,1.1,2.2,3.3]
select array_prepend([1.1,2.2,3.3], '4');
array_prepend([1.1,2.2,3.3], '4')
["4","1.1","2.2","3.3"]
select array_prepend([100, 3.14159268888, 4.56, 7.88], 3.14159);
array_prepend([100, 3.14159268888, 4.56, 7.88], 3.14159)
[3.14159,100,3.14159268888,4.56,7.88]
select array_prepend(["hello", "hi"], "OceanBase");
array_prepend(["hello", "hi"], "OceanBase")
["OceanBase","hello","hi"]
select array_prepend(["1", "2", "a"], 1);
array_prepend(["1", "2", "a"], 1)
["1","1","2","a"]
select array_prepend(["1", "2", "a"], "OceanBase");
array_prepend(["1", "2", "a"], "OceanBase")
["OceanBase","1","2","a"]
select array_prepend(["hello", "hi"], 1);
array_prepend(["hello", "hi"], 1)
["1","hello","hi"]
select array_prepend(["hello", "hi"], NULL);
array_prepend(["hello", "hi"], NULL)
[NULL,"hello","hi"]
select array_prepend([[1,2],[3,4]], [5]);
array_prepend([[1,2],[3,4]], [5])
[[5],[1,2],[3,4]]
select array_prepend([[1,2],[3,4]], NULL);
array_prepend([[1,2],[3,4]], NULL)
[NULL,[1,2],[3,4]]
select array_prepend([[1,2],[3,4]], ['5']);
array_prepend([[1,2],[3,4]], ['5'])
[["5"],["1","2"],["3","4"]]
select array_prepend([[1,2],[3,4]], ['55']);
array_prepend([[1,2],[3,4]], ['55'])
[["55"],["1","2"],["3","4"]]
select array_prepend([[1,2],[3,4]], [NULL]);
array_prepend([[1,2],[3,4]], [NULL])
[[NULL],[1,2],[3,4]]
select array_prepend([[1,2],[3,4]], [5.5,6.6]);
array_prepend([[1,2],[3,4]], [5.5,6.6])
[[5.5,6.6],[1,2],[3,4]]
select array_prepend([[1,2],[3,4]], [5.5,NULL]);
array_prepend([[1,2],[3,4]], [5.5,NULL])
[[5.5,NULL],[1,2],[3,4]]
select array_prepend([[100, 3.14159268888, 4.56, 7.88]], [3.14159]);
array_prepend([[100, 3.14159268888, 4.56, 7.88]], [3.14159])
[[3.14159],[100,3.14159268888,4.56,7.88]]
select array_prepend([[1.1,2.2],[3.3,4.4]], [5]);
array_prepend([[1.1,2.2],[3.3,4.4]], [5])
[[5],[1.1,2.2],[3.3,4.4]]
select array_prepend([[1.1,2.2],[3.3,4.4]], ['a']);
array_prepend([[1.1,2.2],[3.3,4.4]], ['a'])
[["a"],["1.1","2.2"],["3.3","4.4"]]
select array_prepend([[1.1,2.2],[3.3,4.4]], ['Hello','OceanBase']);
array_prepend([[1.1,2.2],[3.3,4.4]], ['Hello','OceanBase'])
[["Hello","OceanBase"],["1.1","2.2"],["3.3","4.4"]]
select array_prepend([["a", "b"]], [5.5,NULL]);
array_prepend([["a", "b"]], [5.5,NULL])
[["5.5",NULL],["a","b"]]
select array_prepend([["hello", "world"]], [5.5,NULL]);
array_prepend([["hello", "world"]], [5.5,NULL])
[["5.5",NULL],["hello","world"]]
select array_prepend([[1,2],[3,4]], 5);
ERROR 22000: Invalid data type for the operation
select array_prepend([["hello", "world"], ["hi", "what"], ["are you?"]], ["are you?"]);
array_prepend([["hello", "world"], ["hi", "what"], ["are you?"]], ["are you?"])
[["are you?"],["hello","world"],["hi","what"],["are you?"]]
CREATE TABLE t1 (id int, c1 Array(BigInt), c2 Array(double), c3 Array(varchar(1)), c4 Array(varchar(10)), c5 vector(3));
INSERT INTO t1(id) VALUES(1);
INSERT INTO t1 VALUES(2, [NULL], [NULL], [NULL], [NULL], [0,0,0]);
INSERT INTO t1 VALUES(3, [1,2,3], [1.1,2.2,3.3], ['a','b','c'], ['hello', 'world'], [1,2,3]);
select id, array_prepend(c1, id) from t1;
id	array_prepend(c1, id)
1	NULL
2	[2,NULL]
3	[3,1,2,3]
select id, array_prepend(c1, 100) from t1;
id	array_prepend(c1, 100)
1	NULL
2	[100,NULL]
3	[100,1,2,3]
select id, array_prepend(c1, 1.1) from t1;
id	array_prepend(c1, 1.1)
1	NULL
2	[1.1,NULL]
3	[1.1,1,2,3]
select id, array_prepend(c1, 'a') from t1;
id	array_prepend(c1, 'a')
1	NULL
2	["a",NULL]
3	["a","1","2","3"]
select id, array_prepend(c1, 'OceanBase') from t1;
id	array_prepend(c1, 'OceanBase')
1	NULL
2	["OceanBase",NULL]
3	["OceanBase","1","2","3"]
select id, array_prepend(c1, NULL) from t1;
id	array_prepend(c1, NULL)
1	NULL
2	[NULL,NULL]
3	[NULL,1,2,3]
select id, array_prepend(c2, id) from t1;
id	array_prepend(c2, id)
1	NULL
2	[2,NULL]
3	[3,1.1,2.2,3.3]
select id, array_prepend(c2, 100) from t1;
id	array_prepend(c2, 100)
1	NULL
2	[100,NULL]
3	[100,1.1,2.2,3.3]
select id, array_prepend(c2, 1.1) from t1;
id	array_prepend(c2, 1.1)
1	NULL
2	[1.1,NULL]
3	[1.1,1.1,2.2,3.3]
select id, array_prepend(c2, 'a') from t1;
id	array_prepend(c2, 'a')
1	NULL
2	["a",NULL]
3	["a","1.1","2.2","3.3"]
select id, array_prepend(c2, 'OceanBase') from t1;
id	array_prepend(c2, 'OceanBase')
1	NULL
2	["OceanBase",NULL]
3	["OceanBase","1.1","2.2","3.3"]
select id, array_prepend(c2, NULL) from t1;
id	array_prepend(c2, NULL)
1	NULL
2	[NULL,NULL]
3	[NULL,1.1,2.2,3.3]
select id, array_prepend(c3, id) from t1;
id	array_prepend(c3, id)
1	NULL
2	["2",NULL]
3	["3","a","b","c"]
select id, array_prepend(c3, 100) from t1;
id	array_prepend(c3, 100)
1	NULL
2	["100",NULL]
3	["100","a","b","c"]
select id, array_prepend(c3, 1.1) from t1;
id	array_prepend(c3, 1.1)
1	NULL
2	["1.1",NULL]
3	["1.1","a","b","c"]
select id, array_prepend(c3, 'a') from t1;
id	array_prepend(c3, 'a')
1	NULL
2	["a",NULL]
3	["a","a","b","c"]
select id, array_prepend(c3, 'OceanBase') from t1;
id	array_prepend(c3, 'OceanBase')
1	NULL
2	["OceanBase",NULL]
3	["OceanBase","a","b","c"]
select id, array_prepend(c3, NULL) from t1;
id	array_prepend(c3, NULL)
1	NULL
2	[NULL,NULL]
3	[NULL,"a","b","c"]
select id, array_prepend(c4, id) from t1;
id	array_prepend(c4, id)
1	NULL
2	["2",NULL]
3	["3","hello","world"]
select id, array_prepend(c4, 100) from t1;
id	array_prepend(c4, 100)
1	NULL
2	["100",NULL]
3	["100","hello","world"]
select id, array_prepend(c4, 1.1) from t1;
id	array_prepend(c4, 1.1)
1	NULL
2	["1.1",NULL]
3	["1.1","hello","world"]
select id, array_prepend(c4, 'a') from t1;
id	array_prepend(c4, 'a')
1	NULL
2	["a",NULL]
3	["a","hello","world"]
select id, array_prepend(c4, 'OceanBase') from t1;
id	array_prepend(c4, 'OceanBase')
1	NULL
2	["OceanBase",NULL]
3	["OceanBase","hello","world"]
select id, array_prepend(c4, NULL) from t1;
id	array_prepend(c4, NULL)
1	NULL
2	[NULL,NULL]
3	[NULL,"hello","world"]
select id, array_prepend(c5, id) from t1;
id	array_prepend(c5, id)
1	NULL
2	[2,0,0,0]
3	[3,1,2,3]
select id, array_prepend(c5, 100) from t1;
id	array_prepend(c5, 100)
1	NULL
2	[100,0,0,0]
3	[100,1,2,3]
select id, array_prepend(c5, 1.1) from t1;
id	array_prepend(c5, 1.1)
1	NULL
2	[1.1,0,0,0]
3	[1.1,1,2,3]
select id, array_prepend(c5, 'a') from t1;
id	array_prepend(c5, 'a')
1	NULL
2	["a","0","0","0"]
3	["a","1","2","3"]
select id, array_prepend(c5, 'OceanBase') from t1;
id	array_prepend(c5, 'OceanBase')
1	NULL
2	["OceanBase","0","0","0"]
3	["OceanBase","1","2","3"]
select id, array_prepend(c5, NULL) from t1;
ERROR 42000: Null value
select /*+ OPT_PARAM('enable_rich_vector_format', 'FALSE') */ id, array_prepend(c1, id) from t1;
id	array_prepend(c1, id)
1	NULL
2	[2,NULL]
3	[3,1,2,3]
select /*+ OPT_PARAM('enable_rich_vector_format', 'FALSE') */ id, array_prepend(c1, 100) from t1;
id	array_prepend(c1, 100)
1	NULL
2	[100,NULL]
3	[100,1,2,3]
select /*+ OPT_PARAM('enable_rich_vector_format', 'FALSE') */ id, array_prepend(c1, 1.1) from t1;
id	array_prepend(c1, 1.1)
1	NULL
2	[1.1,NULL]
3	[1.1,1,2,3]
select /*+ OPT_PARAM('enable_rich_vector_format', 'FALSE') */ id, array_prepend(c1, 'a') from t1;
id	array_prepend(c1, 'a')
1	NULL
2	["a",NULL]
3	["a","1","2","3"]
select /*+ OPT_PARAM('enable_rich_vector_format', 'FALSE') */ id, array_prepend(c1, 'OceanBase') from t1;
id	array_prepend(c1, 'OceanBase')
1	NULL
2	["OceanBase",NULL]
3	["OceanBase","1","2","3"]
select /*+ OPT_PARAM('enable_rich_vector_format', 'FALSE') */ id, array_prepend(c1, NULL) from t1;
id	array_prepend(c1, NULL)
1	NULL
2	[NULL,NULL]
3	[NULL,1,2,3]
select /*+ OPT_PARAM('enable_rich_vector_format', 'FALSE') */ id, array_prepend(c2, id) from t1;
id	array_prepend(c2, id)
1	NULL
2	[2,NULL]
3	[3,1.1,2.2,3.3]
select /*+ OPT_PARAM('enable_rich_vector_format', 'FALSE') */ id, array_prepend(c2, 100) from t1;
id	array_prepend(c2, 100)
1	NULL
2	[100,NULL]
3	[100,1.1,2.2,3.3]
select /*+ OPT_PARAM('enable_rich_vector_format', 'FALSE') */ id, array_prepend(c2, 1.1) from t1;
id	array_prepend(c2, 1.1)
1	NULL
2	[1.1,NULL]
3	[1.1,1.1,2.2,3.3]
select /*+ OPT_PARAM('enable_rich_vector_format', 'FALSE') */ id, array_prepend(c2, 'a') from t1;
id	array_prepend(c2, 'a')
1	NULL
2	["a",NULL]
3	["a","1.1","2.2","3.3"]
select /*+ OPT_PARAM('enable_rich_vector_format', 'FALSE') */ id, array_prepend(c2, 'OceanBase') from t1;
id	array_prepend(c2, 'OceanBase')
1	NULL
2	["OceanBase",NULL]
3	["OceanBase","1.1","2.2","3.3"]
select /*+ OPT_PARAM('enable_rich_vector_format', 'FALSE') */ id, array_prepend(c2, NULL) from t1;
id	array_prepend(c2, NULL)
1	NULL
2	[NULL,NULL]
3	[NULL,1.1,2.2,3.3]
select /*+ OPT_PARAM('enable_rich_vector_format', 'FALSE') */ id, array_prepend(c3, id) from t1;
id	array_prepend(c3, id)
1	NULL
2	["2",NULL]
3	["3","a","b","c"]
select /*+ OPT_PARAM('enable_rich_vector_format', 'FALSE') */ id, array_prepend(c3, 100) from t1;
id	array_prepend(c3, 100)
1	NULL
2	["100",NULL]
3	["100","a","b","c"]
select /*+ OPT_PARAM('enable_rich_vector_format', 'FALSE') */ id, array_prepend(c3, 1.1) from t1;
id	array_prepend(c3, 1.1)
1	NULL
2	["1.1",NULL]
3	["1.1","a","b","c"]
select /*+ OPT_PARAM('enable_rich_vector_format', 'FALSE') */ id, array_prepend(c3, 'a') from t1;
id	array_prepend(c3, 'a')
1	NULL
2	["a",NULL]
3	["a","a","b","c"]
select /*+ OPT_PARAM('enable_rich_vector_format', 'FALSE') */ id, array_prepend(c3, 'OceanBase') from t1;
id	array_prepend(c3, 'OceanBase')
1	NULL
2	["OceanBase",NULL]
3	["OceanBase","a","b","c"]
select /*+ OPT_PARAM('enable_rich_vector_format', 'FALSE') */ id, array_prepend(c3, NULL) from t1;
id	array_prepend(c3, NULL)
1	NULL
2	[NULL,NULL]
3	[NULL,"a","b","c"]
select /*+ OPT_PARAM('enable_rich_vector_format', 'FALSE') */ id, array_prepend(c4, id) from t1;
id	array_prepend(c4, id)
1	NULL
2	["2",NULL]
3	["3","hello","world"]
select /*+ OPT_PARAM('enable_rich_vector_format', 'FALSE') */ id, array_prepend(c4, 100) from t1;
id	array_prepend(c4, 100)
1	NULL
2	["100",NULL]
3	["100","hello","world"]
select /*+ OPT_PARAM('enable_rich_vector_format', 'FALSE') */ id, array_prepend(c4, 1.1) from t1;
id	array_prepend(c4, 1.1)
1	NULL
2	["1.1",NULL]
3	["1.1","hello","world"]
select /*+ OPT_PARAM('enable_rich_vector_format', 'FALSE') */ id, array_prepend(c4, 'a') from t1;
id	array_prepend(c4, 'a')
1	NULL
2	["a",NULL]
3	["a","hello","world"]
select /*+ OPT_PARAM('enable_rich_vector_format', 'FALSE') */ id, array_prepend(c4, 'OceanBase') from t1;
id	array_prepend(c4, 'OceanBase')
1	NULL
2	["OceanBase",NULL]
3	["OceanBase","hello","world"]
select /*+ OPT_PARAM('enable_rich_vector_format', 'FALSE') */ id, array_prepend(c4, NULL) from t1;
id	array_prepend(c4, NULL)
1	NULL
2	[NULL,NULL]
3	[NULL,"hello","world"]
select /*+ OPT_PARAM('enable_rich_vector_format', 'FALSE') */ id, array_prepend(c5, id) from t1;
id	array_prepend(c5, id)
1	NULL
2	[2,0,0,0]
3	[3,1,2,3]
select /*+ OPT_PARAM('enable_rich_vector_format', 'FALSE') */ id, array_prepend(c5, 100) from t1;
id	array_prepend(c5, 100)
1	NULL
2	[100,0,0,0]
3	[100,1,2,3]
select /*+ OPT_PARAM('enable_rich_vector_format', 'FALSE') */ id, array_prepend(c5, 1.1) from t1;
id	array_prepend(c5, 1.1)
1	NULL
2	[1.1,0,0,0]
3	[1.1,1,2,3]
select /*+ OPT_PARAM('enable_rich_vector_format', 'FALSE') */ id, array_prepend(c5, 'a') from t1;
id	array_prepend(c5, 'a')
1	NULL
2	["a","0","0","0"]
3	["a","1","2","3"]
select /*+ OPT_PARAM('enable_rich_vector_format', 'FALSE') */ id, array_prepend(c5, 'OceanBase') from t1;
id	array_prepend(c5, 'OceanBase')
1	NULL
2	["OceanBase","0","0","0"]
3	["OceanBase","1","2","3"]
select /*+ OPT_PARAM('enable_rich_vector_format', 'FALSE') */ id, array_prepend(c5, NULL) from t1;
ERROR 42000: Null value
select /*+ OPT_PARAM('rowsets_enabled', 'FALSE') */ id, array_prepend(c1, id) from t1;
id	array_prepend(c1, id)
1	NULL
2	[2,NULL]
3	[3,1,2,3]
select /*+ OPT_PARAM('rowsets_enabled', 'FALSE') */ id, array_prepend(c1, 100) from t1;
id	array_prepend(c1, 100)
1	NULL
2	[100,NULL]
3	[100,1,2,3]
select /*+ OPT_PARAM('rowsets_enabled', 'FALSE') */ id, array_prepend(c1, 1.1) from t1;
id	array_prepend(c1, 1.1)
1	NULL
2	[1.1,NULL]
3	[1.1,1,2,3]
select /*+ OPT_PARAM('rowsets_enabled', 'FALSE') */ id, array_prepend(c1, 'a') from t1;
id	array_prepend(c1, 'a')
1	NULL
2	["a",NULL]
3	["a","1","2","3"]
select /*+ OPT_PARAM('rowsets_enabled', 'FALSE') */ id, array_prepend(c1, 'OceanBase') from t1;
id	array_prepend(c1, 'OceanBase')
1	NULL
2	["OceanBase",NULL]
3	["OceanBase","1","2","3"]
select /*+ OPT_PARAM('rowsets_enabled', 'FALSE') */ id, array_prepend(c1, NULL) from t1;
id	array_prepend(c1, NULL)
1	NULL
2	[NULL,NULL]
3	[NULL,1,2,3]
select /*+ OPT_PARAM('rowsets_enabled', 'FALSE') */ id, array_prepend(c2, id) from t1;
id	array_prepend(c2, id)
1	NULL
2	[2,NULL]
3	[3,1.1,2.2,3.3]
select /*+ OPT_PARAM('rowsets_enabled', 'FALSE') */ id, array_prepend(c2, 100) from t1;
id	array_prepend(c2, 100)
1	NULL
2	[100,NULL]
3	[100,1.1,2.2,3.3]
select /*+ OPT_PARAM('rowsets_enabled', 'FALSE') */ id, array_prepend(c2, 1.1) from t1;
id	array_prepend(c2, 1.1)
1	NULL
2	[1.1,NULL]
3	[1.1,1.1,2.2,3.3]
select /*+ OPT_PARAM('rowsets_enabled', 'FALSE') */ id, array_prepend(c2, 'a') from t1;
id	array_prepend(c2, 'a')
1	NULL
2	["a",NULL]
3	["a","1.1","2.2","3.3"]
select /*+ OPT_PARAM('rowsets_enabled', 'FALSE') */ id, array_prepend(c2, 'OceanBase') from t1;
id	array_prepend(c2, 'OceanBase')
1	NULL
2	["OceanBase",NULL]
3	["OceanBase","1.1","2.2","3.3"]
select /*+ OPT_PARAM('rowsets_enabled', 'FALSE') */ id, array_prepend(c2, NULL) from t1;
id	array_prepend(c2, NULL)
1	NULL
2	[NULL,NULL]
3	[NULL,1.1,2.2,3.3]
select /*+ OPT_PARAM('rowsets_enabled', 'FALSE') */ id, array_prepend(c3, id) from t1;
id	array_prepend(c3, id)
1	NULL
2	["2",NULL]
3	["3","a","b","c"]
select /*+ OPT_PARAM('rowsets_enabled', 'FALSE') */ id, array_prepend(c3, 100) from t1;
id	array_prepend(c3, 100)
1	NULL
2	["100",NULL]
3	["100","a","b","c"]
select /*+ OPT_PARAM('rowsets_enabled', 'FALSE') */ id, array_prepend(c3, 1.1) from t1;
id	array_prepend(c3, 1.1)
1	NULL
2	["1.1",NULL]
3	["1.1","a","b","c"]
select /*+ OPT_PARAM('rowsets_enabled', 'FALSE') */ id, array_prepend(c3, 'a') from t1;
id	array_prepend(c3, 'a')
1	NULL
2	["a",NULL]
3	["a","a","b","c"]
select /*+ OPT_PARAM('rowsets_enabled', 'FALSE') */ id, array_prepend(c3, 'OceanBase') from t1;
id	array_prepend(c3, 'OceanBase')
1	NULL
2	["OceanBase",NULL]
3	["OceanBase","a","b","c"]
select /*+ OPT_PARAM('rowsets_enabled', 'FALSE') */ id, array_prepend(c3, NULL) from t1;
id	array_prepend(c3, NULL)
1	NULL
2	[NULL,NULL]
3	[NULL,"a","b","c"]
select /*+ OPT_PARAM('rowsets_enabled', 'FALSE') */ id, array_prepend(c4, id) from t1;
id	array_prepend(c4, id)
1	NULL
2	["2",NULL]
3	["3","hello","world"]
select /*+ OPT_PARAM('rowsets_enabled', 'FALSE') */ id, array_prepend(c4, 100) from t1;
id	array_prepend(c4, 100)
1	NULL
2	["100",NULL]
3	["100","hello","world"]
select /*+ OPT_PARAM('rowsets_enabled', 'FALSE') */ id, array_prepend(c4, 1.1) from t1;
id	array_prepend(c4, 1.1)
1	NULL
2	["1.1",NULL]
3	["1.1","hello","world"]
select /*+ OPT_PARAM('rowsets_enabled', 'FALSE') */ id, array_prepend(c4, 'a') from t1;
id	array_prepend(c4, 'a')
1	NULL
2	["a",NULL]
3	["a","hello","world"]
select /*+ OPT_PARAM('rowsets_enabled', 'FALSE') */ id, array_prepend(c4, 'OceanBase') from t1;
id	array_prepend(c4, 'OceanBase')
1	NULL
2	["OceanBase",NULL]
3	["OceanBase","hello","world"]
select /*+ OPT_PARAM('rowsets_enabled', 'FALSE') */ id, array_prepend(c4, NULL) from t1;
id	array_prepend(c4, NULL)
1	NULL
2	[NULL,NULL]
3	[NULL,"hello","world"]
select /*+ OPT_PARAM('rowsets_enabled', 'FALSE') */ id, array_prepend(c5, id) from t1;
id	array_prepend(c5, id)
1	NULL
2	[2,0,0,0]
3	[3,1,2,3]
select /*+ OPT_PARAM('rowsets_enabled', 'FALSE') */ id, array_prepend(c5, 100) from t1;
id	array_prepend(c5, 100)
1	NULL
2	[100,0,0,0]
3	[100,1,2,3]
select /*+ OPT_PARAM('rowsets_enabled', 'FALSE') */ id, array_prepend(c5, 1.1) from t1;
id	array_prepend(c5, 1.1)
1	NULL
2	[1.1,0,0,0]
3	[1.1,1,2,3]
select /*+ OPT_PARAM('rowsets_enabled', 'FALSE') */ id, array_prepend(c5, 'a') from t1;
id	array_prepend(c5, 'a')
1	NULL
2	["a","0","0","0"]
3	["a","1","2","3"]
select /*+ OPT_PARAM('rowsets_enabled', 'FALSE') */ id, array_prepend(c5, 'OceanBase') from t1;
id	array_prepend(c5, 'OceanBase')
1	NULL
2	["OceanBase","0","0","0"]
3	["OceanBase","1","2","3"]
select /*+ OPT_PARAM('rowsets_enabled', 'FALSE') */ id, array_prepend(c5, NULL) from t1;
ERROR 42000: Null value
create table t2 (id int, vec vector(4));
insert into t2 values (1, (select array_prepend(c5, 4) from t1 where id = 1));
insert into t2 values (2, (select array_prepend(c5, 4) from t1 where id = 2));
insert into t2 values (3, (select array_prepend(c5, 4) from t1 where id = 3));
select * from t2;
id	vec
1	NULL
2	[4,0,0,0]
3	[4,1,2,3]
create table t3 (id int primary key, c1 int[][], c2 float[][], c3 varchar(1)[][], c4 varchar(10)[][]);
INSERT INTO t3(id) VALUES(1);
INSERT INTO t3 VALUES(2, [[NULL]], [[NULL]], [[NULL]], [[NULL]]);
INSERT INTO t3 VALUES(3, [[1,2,3],[4,5]], [[1.1,2.2,3.3],[4.4,5.5]], [['a','b','c'],['d','e']], [['hello', 'world'], ['hi']]);
select id, array_prepend(c1, [id]) from t3;
id	array_prepend(c1, [id])
1	NULL
2	[[2],[NULL]]
3	[[3],[1,2,3],[4,5]]
select id, array_prepend(c1, [6,7]) from t3;
id	array_prepend(c1, [6,7])
1	NULL
2	[[6,7],[NULL]]
3	[[6,7],[1,2,3],[4,5]]
select id, array_prepend(c1, [6.6,7.7]) from t3;
id	array_prepend(c1, [6.6,7.7])
1	NULL
2	[[6.6,7.7],[NULL]]
3	[[6.6,7.7],[1,2,3],[4,5]]
select id, array_prepend(c1, ['f','g']) from t3;
id	array_prepend(c1, ['f','g'])
1	NULL
2	[["f","g"],[NULL]]
3	[["f","g"],["1","2","3"],["4","5"]]
select id, array_prepend(c1, ['Ocean','Base']) from t3;
id	array_prepend(c1, ['Ocean','Base'])
1	NULL
2	[["Ocean","Base"],[NULL]]
3	[["Ocean","Base"],["1","2","3"],["4","5"]]
select id, array_prepend(c1, NULL) from t3;
id	array_prepend(c1, NULL)
1	NULL
2	[NULL,[NULL]]
3	[NULL,[1,2,3],[4,5]]
select id, array_prepend(c2, [id]) from t3;
id	array_prepend(c2, [id])
1	NULL
2	[[2],[NULL]]
3	[[3],[1.100000023841858,2.200000047683716,3.299999952316284],[4.400000095367432,5.5]]
select id, array_prepend(c2, [6,7]) from t3;
id	array_prepend(c2, [6,7])
1	NULL
2	[[6,7],[NULL]]
3	[[6,7],[1.100000023841858,2.200000047683716,3.299999952316284],[4.400000095367432,5.5]]
select id, array_prepend(c2, [6.6,7.7]) from t3;
id	array_prepend(c2, [6.6,7.7])
1	NULL
2	[[6.6,7.7],[NULL]]
3	[[6.6,7.7],[1.100000023841858,2.200000047683716,3.299999952316284],[4.400000095367432,5.5]]
select id, array_prepend(c2, ['f','g']) from t3;
id	array_prepend(c2, ['f','g'])
1	NULL
2	[["f","g"],[NULL]]
3	[["f","g"],["1.1","2.2","3.3"],["4.4","5.5"]]
select id, array_prepend(c2, ['Ocean','Base']) from t3;
id	array_prepend(c2, ['Ocean','Base'])
1	NULL
2	[["Ocean","Base"],[NULL]]
3	[["Ocean","Base"],["1.1","2.2","3.3"],["4.4","5.5"]]
select id, array_prepend(c2, NULL) from t3;
id	array_prepend(c2, NULL)
1	NULL
2	[NULL,[NULL]]
3	[NULL,[1.1,2.2,3.3],[4.4,5.5]]
select id, array_prepend(c3, [id]) from t3;
id	array_prepend(c3, [id])
1	NULL
2	[["2"],[NULL]]
3	[["3"],["a","b","c"],["d","e"]]
select id, array_prepend(c3, [6,7]) from t3;
id	array_prepend(c3, [6,7])
1	NULL
2	[["6","7"],[NULL]]
3	[["6","7"],["a","b","c"],["d","e"]]
select id, array_prepend(c3, [6.6,7.7]) from t3;
id	array_prepend(c3, [6.6,7.7])
1	NULL
2	[["6.6","7.7"],[NULL]]
3	[["6.6","7.7"],["a","b","c"],["d","e"]]
select id, array_prepend(c3, ['f','g']) from t3;
id	array_prepend(c3, ['f','g'])
1	NULL
2	[["f","g"],[NULL]]
3	[["f","g"],["a","b","c"],["d","e"]]
select id, array_prepend(c3, ['Ocean','Base']) from t3;
id	array_prepend(c3, ['Ocean','Base'])
1	NULL
2	[["Ocean","Base"],[NULL]]
3	[["Ocean","Base"],["a","b","c"],["d","e"]]
select id, array_prepend(c3, NULL) from t3;
id	array_prepend(c3, NULL)
1	NULL
2	[NULL,[NULL]]
3	[NULL,["a","b","c"],["d","e"]]
select id, array_prepend(c4, [id]) from t3;
id	array_prepend(c4, [id])
1	NULL
2	[["2"],[NULL]]
3	[["3"],["hello","world"],["hi"]]
select id, array_prepend(c4, [6,7]) from t3;
id	array_prepend(c4, [6,7])
1	NULL
2	[["6","7"],[NULL]]
3	[["6","7"],["hello","world"],["hi"]]
select id, array_prepend(c4, [6.6,7.7]) from t3;
id	array_prepend(c4, [6.6,7.7])
1	NULL
2	[["6.6","7.7"],[NULL]]
3	[["6.6","7.7"],["hello","world"],["hi"]]
select id, array_prepend(c4, ['f','g']) from t3;
id	array_prepend(c4, ['f','g'])
1	NULL
2	[["f","g"],[NULL]]
3	[["f","g"],["hello","world"],["hi"]]
select id, array_prepend(c4, ['Ocean','Base']) from t3;
id	array_prepend(c4, ['Ocean','Base'])
1	NULL
2	[["Ocean","Base"],[NULL]]
3	[["Ocean","Base"],["hello","world"],["hi"]]
select id, array_prepend(c4, NULL) from t3;
id	array_prepend(c4, NULL)
1	NULL
2	[NULL,[NULL]]
3	[NULL,["hello","world"],["hi"]]
select /*+ OPT_PARAM('enable_rich_vector_format', 'FALSE') */  id, array_prepend(c1, [id]) from t3;
id	array_prepend(c1, [id])
1	NULL
2	[[2],[NULL]]
3	[[3],[1,2,3],[4,5]]
select /*+ OPT_PARAM('enable_rich_vector_format', 'FALSE') */  id, array_prepend(c1, [6,7]) from t3;
id	array_prepend(c1, [6,7])
1	NULL
2	[[6,7],[NULL]]
3	[[6,7],[1,2,3],[4,5]]
select /*+ OPT_PARAM('enable_rich_vector_format', 'FALSE') */  id, array_prepend(c1, [6.6,7.7]) from t3;
id	array_prepend(c1, [6.6,7.7])
1	NULL
2	[[6.6,7.7],[NULL]]
3	[[6.6,7.7],[1,2,3],[4,5]]
select /*+ OPT_PARAM('enable_rich_vector_format', 'FALSE') */  id, array_prepend(c1, ['f','g']) from t3;
id	array_prepend(c1, ['f','g'])
1	NULL
2	[["f","g"],[NULL]]
3	[["f","g"],["1","2","3"],["4","5"]]
select /*+ OPT_PARAM('enable_rich_vector_format', 'FALSE') */  id, array_prepend(c1, ['Ocean','Base']) from t3;
id	array_prepend(c1, ['Ocean','Base'])
1	NULL
2	[["Ocean","Base"],[NULL]]
3	[["Ocean","Base"],["1","2","3"],["4","5"]]
select /*+ OPT_PARAM('enable_rich_vector_format', 'FALSE') */  id, array_prepend(c1, NULL) from t3;
id	array_prepend(c1, NULL)
1	NULL
2	[NULL,[NULL]]
3	[NULL,[1,2,3],[4,5]]
select /*+ OPT_PARAM('enable_rich_vector_format', 'FALSE') */  id, array_prepend(c2, [id]) from t3;
id	array_prepend(c2, [id])
1	NULL
2	[[2],[NULL]]
3	[[3],[1.100000023841858,2.200000047683716,3.299999952316284],[4.400000095367432,5.5]]
select /*+ OPT_PARAM('enable_rich_vector_format', 'FALSE') */  id, array_prepend(c2, [6,7]) from t3;
id	array_prepend(c2, [6,7])
1	NULL
2	[[6,7],[NULL]]
3	[[6,7],[1.100000023841858,2.200000047683716,3.299999952316284],[4.400000095367432,5.5]]
select /*+ OPT_PARAM('enable_rich_vector_format', 'FALSE') */  id, array_prepend(c2, [6.6,7.7]) from t3;
id	array_prepend(c2, [6.6,7.7])
1	NULL
2	[[6.6,7.7],[NULL]]
3	[[6.6,7.7],[1.100000023841858,2.200000047683716,3.299999952316284],[4.400000095367432,5.5]]
select /*+ OPT_PARAM('enable_rich_vector_format', 'FALSE') */  id, array_prepend(c2, ['f','g']) from t3;
id	array_prepend(c2, ['f','g'])
1	NULL
2	[["f","g"],[NULL]]
3	[["f","g"],["1.1","2.2","3.3"],["4.4","5.5"]]
select /*+ OPT_PARAM('enable_rich_vector_format', 'FALSE') */  id, array_prepend(c2, ['Ocean','Base']) from t3;
id	array_prepend(c2, ['Ocean','Base'])
1	NULL
2	[["Ocean","Base"],[NULL]]
3	[["Ocean","Base"],["1.1","2.2","3.3"],["4.4","5.5"]]
select /*+ OPT_PARAM('enable_rich_vector_format', 'FALSE') */  id, array_prepend(c2, NULL) from t3;
id	array_prepend(c2, NULL)
1	NULL
2	[NULL,[NULL]]
3	[NULL,[1.1,2.2,3.3],[4.4,5.5]]
select /*+ OPT_PARAM('enable_rich_vector_format', 'FALSE') */  id, array_prepend(c3, [id]) from t3;
id	array_prepend(c3, [id])
1	NULL
2	[["2"],[NULL]]
3	[["3"],["a","b","c"],["d","e"]]
select /*+ OPT_PARAM('enable_rich_vector_format', 'FALSE') */  id, array_prepend(c3, [6,7]) from t3;
id	array_prepend(c3, [6,7])
1	NULL
2	[["6","7"],[NULL]]
3	[["6","7"],["a","b","c"],["d","e"]]
select /*+ OPT_PARAM('enable_rich_vector_format', 'FALSE') */  id, array_prepend(c3, [6.6,7.7]) from t3;
id	array_prepend(c3, [6.6,7.7])
1	NULL
2	[["6.6","7.7"],[NULL]]
3	[["6.6","7.7"],["a","b","c"],["d","e"]]
select /*+ OPT_PARAM('enable_rich_vector_format', 'FALSE') */  id, array_prepend(c3, ['f','g']) from t3;
id	array_prepend(c3, ['f','g'])
1	NULL
2	[["f","g"],[NULL]]
3	[["f","g"],["a","b","c"],["d","e"]]
select /*+ OPT_PARAM('enable_rich_vector_format', 'FALSE') */  id, array_prepend(c3, ['Ocean','Base']) from t3;
id	array_prepend(c3, ['Ocean','Base'])
1	NULL
2	[["Ocean","Base"],[NULL]]
3	[["Ocean","Base"],["a","b","c"],["d","e"]]
select /*+ OPT_PARAM('enable_rich_vector_format', 'FALSE') */  id, array_prepend(c3, NULL) from t3;
id	array_prepend(c3, NULL)
1	NULL
2	[NULL,[NULL]]
3	[NULL,["a","b","c"],["d","e"]]
select /*+ OPT_PARAM('enable_rich_vector_format', 'FALSE') */  id, array_prepend(c4, [id]) from t3;
id	array_prepend(c4, [id])
1	NULL
2	[["2"],[NULL]]
3	[["3"],["hello","world"],["hi"]]
select /*+ OPT_PARAM('enable_rich_vector_format', 'FALSE') */  id, array_prepend(c4, [6,7]) from t3;
id	array_prepend(c4, [6,7])
1	NULL
2	[["6","7"],[NULL]]
3	[["6","7"],["hello","world"],["hi"]]
select /*+ OPT_PARAM('enable_rich_vector_format', 'FALSE') */  id, array_prepend(c4, [6.6,7.7]) from t3;
id	array_prepend(c4, [6.6,7.7])
1	NULL
2	[["6.6","7.7"],[NULL]]
3	[["6.6","7.7"],["hello","world"],["hi"]]
select /*+ OPT_PARAM('enable_rich_vector_format', 'FALSE') */  id, array_prepend(c4, ['f','g']) from t3;
id	array_prepend(c4, ['f','g'])
1	NULL
2	[["f","g"],[NULL]]
3	[["f","g"],["hello","world"],["hi"]]
select /*+ OPT_PARAM('enable_rich_vector_format', 'FALSE') */  id, array_prepend(c4, ['Ocean','Base']) from t3;
id	array_prepend(c4, ['Ocean','Base'])
1	NULL
2	[["Ocean","Base"],[NULL]]
3	[["Ocean","Base"],["hello","world"],["hi"]]
select /*+ OPT_PARAM('enable_rich_vector_format', 'FALSE') */  id, array_prepend(c4, NULL) from t3;
id	array_prepend(c4, NULL)
1	NULL
2	[NULL,[NULL]]
3	[NULL,["hello","world"],["hi"]]
select /*+ OPT_PARAM('rowsets_enabled', 'FALSE') */  id, array_prepend(c1, [id]) from t3;
id	array_prepend(c1, [id])
1	NULL
2	[[2],[NULL]]
3	[[3],[1,2,3],[4,5]]
select /*+ OPT_PARAM('rowsets_enabled', 'FALSE') */  id, array_prepend(c1, [6,7]) from t3;
id	array_prepend(c1, [6,7])
1	NULL
2	[[6,7],[NULL]]
3	[[6,7],[1,2,3],[4,5]]
select /*+ OPT_PARAM('rowsets_enabled', 'FALSE') */  id, array_prepend(c1, [6.6,7.7]) from t3;
id	array_prepend(c1, [6.6,7.7])
1	NULL
2	[[6.6,7.7],[NULL]]
3	[[6.6,7.7],[1,2,3],[4,5]]
select /*+ OPT_PARAM('rowsets_enabled', 'FALSE') */  id, array_prepend(c1, ['f','g']) from t3;
id	array_prepend(c1, ['f','g'])
1	NULL
2	[["f","g"],[NULL]]
3	[["f","g"],["1","2","3"],["4","5"]]
select /*+ OPT_PARAM('rowsets_enabled', 'FALSE') */  id, array_prepend(c1, ['Ocean','Base']) from t3;
id	array_prepend(c1, ['Ocean','Base'])
1	NULL
2	[["Ocean","Base"],[NULL]]
3	[["Ocean","Base"],["1","2","3"],["4","5"]]
select /*+ OPT_PARAM('rowsets_enabled', 'FALSE') */  id, array_prepend(c1, NULL) from t3;
id	array_prepend(c1, NULL)
1	NULL
2	[NULL,[NULL]]
3	[NULL,[1,2,3],[4,5]]
select /*+ OPT_PARAM('rowsets_enabled', 'FALSE') */  id, array_prepend(c2, [id]) from t3;
id	array_prepend(c2, [id])
1	NULL
2	[[2],[NULL]]
3	[[3],[1.100000023841858,2.200000047683716,3.299999952316284],[4.400000095367432,5.5]]
select /*+ OPT_PARAM('rowsets_enabled', 'FALSE') */  id, array_prepend(c2, [6,7]) from t3;
id	array_prepend(c2, [6,7])
1	NULL
2	[[6,7],[NULL]]
3	[[6,7],[1.100000023841858,2.200000047683716,3.299999952316284],[4.400000095367432,5.5]]
select /*+ OPT_PARAM('rowsets_enabled', 'FALSE') */  id, array_prepend(c2, [6.6,7.7]) from t3;
id	array_prepend(c2, [6.6,7.7])
1	NULL
2	[[6.6,7.7],[NULL]]
3	[[6.6,7.7],[1.100000023841858,2.200000047683716,3.299999952316284],[4.400000095367432,5.5]]
select /*+ OPT_PARAM('rowsets_enabled', 'FALSE') */  id, array_prepend(c2, ['f','g']) from t3;
id	array_prepend(c2, ['f','g'])
1	NULL
2	[["f","g"],[NULL]]
3	[["f","g"],["1.1","2.2","3.3"],["4.4","5.5"]]
select /*+ OPT_PARAM('rowsets_enabled', 'FALSE') */  id, array_prepend(c2, ['Ocean','Base']) from t3;
id	array_prepend(c2, ['Ocean','Base'])
1	NULL
2	[["Ocean","Base"],[NULL]]
3	[["Ocean","Base"],["1.1","2.2","3.3"],["4.4","5.5"]]
select /*+ OPT_PARAM('rowsets_enabled', 'FALSE') */  id, array_prepend(c2, NULL) from t3;
id	array_prepend(c2, NULL)
1	NULL
2	[NULL,[NULL]]
3	[NULL,[1.1,2.2,3.3],[4.4,5.5]]
select /*+ OPT_PARAM('rowsets_enabled', 'FALSE') */  id, array_prepend(c3, [id]) from t3;
id	array_prepend(c3, [id])
1	NULL
2	[["2"],[NULL]]
3	[["3"],["a","b","c"],["d","e"]]
select /*+ OPT_PARAM('rowsets_enabled', 'FALSE') */  id, array_prepend(c3, [6,7]) from t3;
id	array_prepend(c3, [6,7])
1	NULL
2	[["6","7"],[NULL]]
3	[["6","7"],["a","b","c"],["d","e"]]
select /*+ OPT_PARAM('rowsets_enabled', 'FALSE') */  id, array_prepend(c3, [6.6,7.7]) from t3;
id	array_prepend(c3, [6.6,7.7])
1	NULL
2	[["6.6","7.7"],[NULL]]
3	[["6.6","7.7"],["a","b","c"],["d","e"]]
select /*+ OPT_PARAM('rowsets_enabled', 'FALSE') */  id, array_prepend(c3, ['f','g']) from t3;
id	array_prepend(c3, ['f','g'])
1	NULL
2	[["f","g"],[NULL]]
3	[["f","g"],["a","b","c"],["d","e"]]
select /*+ OPT_PARAM('rowsets_enabled', 'FALSE') */  id, array_prepend(c3, ['Ocean','Base']) from t3;
id	array_prepend(c3, ['Ocean','Base'])
1	NULL
2	[["Ocean","Base"],[NULL]]
3	[["Ocean","Base"],["a","b","c"],["d","e"]]
select /*+ OPT_PARAM('rowsets_enabled', 'FALSE') */  id, array_prepend(c3, NULL) from t3;
id	array_prepend(c3, NULL)
1	NULL
2	[NULL,[NULL]]
3	[NULL,["a","b","c"],["d","e"]]
select /*+ OPT_PARAM('rowsets_enabled', 'FALSE') */  id, array_prepend(c4, [id]) from t3;
id	array_prepend(c4, [id])
1	NULL
2	[["2"],[NULL]]
3	[["3"],["hello","world"],["hi"]]
select /*+ OPT_PARAM('rowsets_enabled', 'FALSE') */  id, array_prepend(c4, [6,7]) from t3;
id	array_prepend(c4, [6,7])
1	NULL
2	[["6","7"],[NULL]]
3	[["6","7"],["hello","world"],["hi"]]
select /*+ OPT_PARAM('rowsets_enabled', 'FALSE') */  id, array_prepend(c4, [6.6,7.7]) from t3;
id	array_prepend(c4, [6.6,7.7])
1	NULL
2	[["6.6","7.7"],[NULL]]
3	[["6.6","7.7"],["hello","world"],["hi"]]
select /*+ OPT_PARAM('rowsets_enabled', 'FALSE') */  id, array_prepend(c4, ['f','g']) from t3;
id	array_prepend(c4, ['f','g'])
1	NULL
2	[["f","g"],[NULL]]
3	[["f","g"],["hello","world"],["hi"]]
select /*+ OPT_PARAM('rowsets_enabled', 'FALSE') */  id, array_prepend(c4, ['Ocean','Base']) from t3;
id	array_prepend(c4, ['Ocean','Base'])
1	NULL
2	[["Ocean","Base"],[NULL]]
3	[["Ocean","Base"],["hello","world"],["hi"]]
select /*+ OPT_PARAM('rowsets_enabled', 'FALSE') */  id, array_prepend(c4, NULL) from t3;
id	array_prepend(c4, NULL)
1	NULL
2	[NULL,[NULL]]
3	[NULL,["hello","world"],["hi"]]
select array_prepend(c1) from t3;
ERROR 42000: Incorrect parameter count in the call to native function 'array_prepend'
select id, array_prepend(c1, [id]) from t3 order by id for update;
id	array_prepend(c1, [id])
1	NULL
2	[[2],[NULL]]
3	[[3],[1,2,3],[4,5]]
select /*+read_consistency(weak) */ id, array_prepend(c1, [id]) from t3 order by id;
id	array_prepend(c1, [id])
1	NULL
2	[[2],[NULL]]
3	[[3],[1,2,3],[4,5]]
select /*+ ENABLE_PARALLEL_DML parallel(256) */ id, array_prepend(c1, [id]) from t3 order by id;
id	array_prepend(c1, [id])
1	NULL
2	[[2],[NULL]]
3	[[3],[1,2,3],[4,5]]
with array_data as (
select id, c1 from t3
where id IN(2, 3)
)
select id, array_prepend(c1, [id]) from array_data order by id;
id	array_prepend(c1, [id])
2	[[2],[NULL]]
3	[[3],[1,2,3],[4,5]]
with parray as (
select id, array_prepend(c1, [id]) from t3
)
select * from parray order by id;
id	array_prepend(c1, [id])
1	NULL
2	[[2],[NULL]]
3	[[3],[1,2,3],[4,5]]
INSERT INTO t3(id, c1) VALUES(4, array_prepend([[1], [2]], [4]));
INSERT IGNORE INTO t3(id, c1) SELECT id + 10, array_prepend(c1, [id]) from t3 where c1 IS NOT NULL;
INSERT INTO t3(id, c1) VALUES(4, array_prepend([[1], [2]], [4])) ON DUPLICATE KEY UPDATE c1 = array_prepend([[1], [2]], [5]);
REPLACE INTO t3(id, c1) VALUES(4, array_prepend([[1], [2]], [4]));
INSERT IGNORE INTO t3(id, c1) VALUES(4, array_prepend([[1], [2]], [6]));
INSERT INTO t3(id, c1) VALUES(5, array_prepend(null, null));
select id, c1 from t3 order by id;
id	c1
1	NULL
2	[[NULL]]
3	[[1,2,3],[4,5]]
4	[[4],[1],[2]]
5	NULL
12	[[2],[NULL]]
13	[[3],[1,2,3],[4,5]]
14	[[4],[4],[1],[2]]
UPDATE t3 
SET id = 8 
where id = 1;
update /*+ ENABLE_PARALLEL_DML parallel(256) */ 
t3 set c1 = array_prepend([[1], [2]], [8]) 
where id = 8;
update t3 set c1 = array_prepend(null, [id]) where id = 3;
select id, c1 from t3 order by id;
id	c1
2	[[NULL]]
3	NULL
4	[[4],[1],[2]]
5	NULL
8	[[8],[1],[2]]
12	[[2],[NULL]]
13	[[3],[1,2,3],[4,5]]
14	[[4],[4],[1],[2]]
delete /*+ ENABLE_PARALLEL_DML parallel(256) */ from t3 where array_prepend(c1, [id]) = [[2], [NULL]];
delete from t3 where id in (select id from t3 where array_prepend(c1, [id]) = [[12], [2], [NULL]]);
select id, c1 from t3 order by id;
id	c1
3	NULL
4	[[4],[1],[2]]
5	NULL
8	[[8],[1],[2]]
13	[[3],[1,2,3],[4,5]]
14	[[4],[4],[1],[2]]
select array_prepend();
ERROR 42000: Incorrect parameter count in the call to native function 'array_prepend'
select array_prepend('.',2);
ERROR 22000: invalid obj type for type promotion: left_type=ARRAY right_type=VARCHAR
select array_prepend(NULL,2);
array_prepend(NULL,2)
NULL
select array_prepend(NULL,NULL);
array_prepend(NULL,NULL)
NULL
drop table if exists t1, t2, t3;
drop table if exists tt;
create table tt(id int, arr_int int[], arr_dint array(array(int)), arr_vec array(vector(1)), arr_char array(varchar(10)));
insert into tt values(1, [1], [[1], [2]], [[1], [2]], ['a', 'b']);
insert into tt values(2, null, [[1], [2]], [[1], [2]], ['a', 'b']);
insert into tt values(3, array_remove([1], 1), [[1], [2]], [[1], [2]], ['a', 'b']);
insert into tt values(4, [null, 1], [[1], [2]], [[1], [2]], ['a', 'b']);
insert into tt values(5, [null], [[1], [2]], [[1], [2]], ['a', 'b']);
insert into tt values(6, [1], null, [[1], [2]], ['a', 'b']);
insert into tt values(7, [1], array_remove([[1]], [1]), [[1], [2]], ['a', 'b']);
insert into tt values(8, [1], [null, [2]], [[1], [2]], ['a', 'b']);
insert into tt values(9, [1], array_append(array_remove([[1]],[1]), null), [[1], [2]], ['a', 'b']);
insert into tt values(10, [1], [[null], [2]], [[1], [2]], ['a', 'b']);
insert into tt values(11, [1], [[null, 1], [2]], [[1], [2]], ['a', 'b']);
insert into tt values(12, [1], [array_remove([1], 1)], [[1], [2]], ['a', 'b']);
insert into tt values(13, [1], [array_remove([1], 1), [2]], [[1], [2]], ['a', 'b']);
insert into tt values(14, [1], [[1], [2]], null, ['a', 'b']);
insert into tt values(15, [1], [[1], [2]], array_remove([[1]], [1]), ['a', 'b']);
insert into tt values(16, [1], [[1], [2]], array_append(array_remove([[1]],[1]), null), ['a', 'b']);
insert into tt values(17, [1], [[1], [2]], [[1], [2]], null);
insert into tt values(18, [1], [[1], [2]], [[1], [2]], array_remove(['a'], 'a'));
insert into tt values(19, [1], [[1], [2]], [[1], [2]], array_append(array_remove(['a'],'a'), null));
select id, array_prepend(arr_int, 2) from tt;
id	array_prepend(arr_int, 2)
1	[2,1]
2	NULL
3	[2]
4	[2,NULL,1]
5	[2,NULL]
6	[2,1]
7	[2,1]
8	[2,1]
9	[2,1]
10	[2,1]
11	[2,1]
12	[2,1]
13	[2,1]
14	[2,1]
15	[2,1]
16	[2,1]
17	[2,1]
18	[2,1]
19	[2,1]
select id, array_prepend(arr_dint, [2]) from tt;
id	array_prepend(arr_dint, [2])
1	[[2],[1],[2]]
2	[[2],[1],[2]]
3	[[2],[1],[2]]
4	[[2],[1],[2]]
5	[[2],[1],[2]]
6	NULL
7	[[2]]
8	[[2],NULL,[2]]
9	[[2],NULL]
10	[[2],[NULL],[2]]
11	[[2],[NULL,1],[2]]
12	[[2],[]]
13	[[2],[],[2]]
14	[[2],[1],[2]]
15	[[2],[1],[2]]
16	[[2],[1],[2]]
17	[[2],[1],[2]]
18	[[2],[1],[2]]
19	[[2],[1],[2]]
select id, array_prepend(arr_vec, [1]) from tt;
id	array_prepend(arr_vec, [1])
1	[[1],[1],[2]]
2	[[1],[1],[2]]
3	[[1],[1],[2]]
4	[[1],[1],[2]]
5	[[1],[1],[2]]
6	[[1],[1],[2]]
7	[[1],[1],[2]]
8	[[1],[1],[2]]
9	[[1],[1],[2]]
10	[[1],[1],[2]]
11	[[1],[1],[2]]
12	[[1],[1],[2]]
13	[[1],[1],[2]]
14	NULL
15	[[1]]
16	[[1],NULL]
17	[[1],[1],[2]]
18	[[1],[1],[2]]
19	[[1],[1],[2]]
select id, array_prepend(arr_char, 'c') from tt;
id	array_prepend(arr_char, 'c')
1	["c","a","b"]
2	["c","a","b"]
3	["c","a","b"]
4	["c","a","b"]
5	["c","a","b"]
6	["c","a","b"]
7	["c","a","b"]
8	["c","a","b"]
9	["c","a","b"]
10	["c","a","b"]
11	["c","a","b"]
12	["c","a","b"]
13	["c","a","b"]
14	["c","a","b"]
15	["c","a","b"]
16	["c","a","b"]
17	NULL
18	["c"]
19	["c",NULL]
drop table if exists tt;
select array_append(map(1,[1]),null);
ERROR 22000: Invalid data type for the operation
select array_prepend(map(1,[1]),null);
ERROR 22000: Invalid data type for the operation
select array_contains(map(1,[1]),null);
ERROR 22000: Invalid data type for the operation
select array_position(map(1,[1]),null);
ERROR 22000: Invalid data type for the operation
select array_remove(map(1,[1]),null);
ERROR 22000: Invalid data type for the operation
