# ----------------------------------------------------------------------
# Test of reverse(array).
# ----------------------------------------------------------------------
drop table if exists t1, t2;
select reverse([NULL]);
reverse([NULL])
[NULL]
select reverse([1,2,3]);
reverse([1,2,3])
[3,2,1]
select reverse([1,2,3,NULL]);
reverse([1,2,3,NULL])
[NULL,3,2,1]
select reverse([1.1,2.2]);
reverse([1.1,2.2])
[2.2,1.1]
select reverse(['a','b','c','d']);
reverse(['a','b','c','d'])
["d","c","b","a"]
select reverse(["hello", "hi"]);
reverse(["hello", "hi"])
["hi","hello"]
select reverse([[NULL],NULL]);
reverse([[NULL],NULL])
[NULL,[NULL]]
select reverse([[1,2,3],[4]]);
reverse([[1,2,3],[4]])
[[4],[1,2,3]]
select reverse([[1,2,3,NULL],[4,NULL]]);
reverse([[1,2,3,NULL],[4,NULL]])
[[4,NULL],[1,2,3,NULL]]
select reverse([[1,2],[NULL,NULL]]);
reverse([[1,2],[NULL,NULL]])
[[NULL,NULL],[1,2]]
select reverse([['a','b','c','d']]);
reverse([['a','b','c','d']])
[["a","b","c","d"]]
select reverse([['a','b','c'],['d']]);
reverse([['a','b','c'],['d']])
[["d"],["a","b","c"]]
select reverse([['a','b',NULL,'c'],[NULL,'d']]);
reverse([['a','b',NULL,'c'],[NULL,'d']])
[[NULL,"d"],["a","b",NULL,"c"]]
select reverse([['a','b',NULL,'c'],[NULL,'d'],NULL]);
reverse([['a','b',NULL,'c'],[NULL,'d'],NULL])
[NULL,[NULL,"d"],["a","b",NULL,"c"]]
select reverse([["hello", "world"], ["hi", "what"], ["are you?"]]);
reverse([["hello", "world"], ["hi", "what"], ["are you?"]])
[["are you?"],["hi","what"],["hello","world"]]
select reverse(element_at([[1,2],[3,4]], 1));
reverse(element_at([[1,2],[3,4]], 1))
[2,1]
select reverse(element_at([[1,2],[3,4]], 10));
reverse(element_at([[1,2],[3,4]], 10))
NULL
select reverse(element_at([["hello", "world"], ["hi", "what"], ["are you?"]], 3));
reverse(element_at([["hello", "world"], ["hi", "what"], ["are you?"]], 3))
["are you?"]
select reverse(array_append([1,2,3], 4));
reverse(array_append([1,2,3], 4))
[4,3,2,1]
select reverse(array_append([["hello", "world"], ["hi", "what"], ["are you?"]], [NULL, "OceanBase"]));
reverse(array_append([["hello", "world"], ["hi", "what"], ["are you?"]], [NULL, "OceanBase"]))
[[NULL,"OceanBase"],["are you?"],["hi","what"],["hello","world"]]
CREATE TABLE t1 (id int primary key, c1 Array(BigInt), c2 Array(double), c3 Array(varchar(1)), c4 Array(varchar(10)), c5 vector(3));
INSERT INTO t1(id) VALUES(1);
INSERT INTO t1 VALUES(2, [NULL], [NULL], [NULL], [NULL], [0,0,0]);
INSERT INTO t1 VALUES(3, [1,2,NULL,3], [1.1,2.2,NULL,3.3], ['a','b',NULL,'c'], ['hello','world',NULL,'Ocean'], [1,2,3]);
select id, reverse(c1), reverse(c2), reverse(c3), reverse(c4), reverse(c5) from t1;
id	reverse(c1)	reverse(c2)	reverse(c3)	reverse(c4)	reverse(c5)
1	NULL	NULL	NULL	NULL	NULL
2	[NULL]	[NULL]	[NULL]	[NULL]	[0,0,0]
3	[3,NULL,2,1]	[3.3,NULL,2.2,1.1]	["c",NULL,"b","a"]	["Ocean",NULL,"world","hello"]	[3,2,1]
create table t2 (id int, c1 int[][], c2 float[][], c3 varchar(1)[][], c4 varchar(10)[][]);
INSERT INTO t2(id) VALUES(1);
INSERT INTO t2 VALUES(2, [[NULL]], [[NULL]], [[NULL]], [[NULL]]);
INSERT INTO t2 VALUES(3, [[1,2,3],[4,NULL]], [[1.1,2.2,3.3],[4.4,NULL]], [['a','b','c'],['d',NULL]], [['hello', 'world'], ['hi',NULL]]);
INSERT INTO t2 VALUES(4, [[1,2,3],[4,NULL],NULL], [[1.1,2.2,3.3],[4.4,NULL],NULL], [['a','b','c'],['d',NULL],NULL], [['hello', 'world'], ['hi',NULL],NULL]);
select id, reverse(c1), reverse(c2), reverse(c3), reverse(c4) from t2;
id	reverse(c1)	reverse(c2)	reverse(c3)	reverse(c4)
1	NULL	NULL	NULL	NULL
2	[[NULL]]	[[NULL]]	[[NULL]]	[[NULL]]
3	[[4,NULL],[1,2,3]]	[[4.4,NULL],[1.1,2.2,3.3]]	[["d",NULL],["a","b","c"]]	[["hi",NULL],["hello","world"]]
4	[NULL,[4,NULL],[1,2,3]]	[NULL,[4.4,NULL],[1.1,2.2,3.3]]	[NULL,["d",NULL],["a","b","c"]]	[NULL,["hi",NULL],["hello","world"]]
drop table if exists t_create;
create table t_create as select reverse(NULL), reverse([1,2,3,4]);
desc t_create;
Field	Type	Null	Key	Default	Extra
reverse(NULL)	varbinary(0)	YES		NULL	
reverse([1,2,3,4])	ARRAY(BIGINT)	YES		NULL	
select * from t_create;
reverse(NULL)	reverse([1,2,3,4])
NULL	[4,3,2,1]
drop table t_create;
create table t_create as select reverse(NULL), reverse(c1) from t1;
desc t_create;
Field	Type	Null	Key	Default	Extra
reverse(NULL)	varbinary(0)	YES		NULL	
reverse(c1)	ARRAY(BIGINT)	YES		NULL	
select * from t_create;
reverse(NULL)	reverse(c1)
NULL	NULL
NULL	[NULL]
NULL	[3,NULL,2,1]
drop table t_create;
select reverse(null);
reverse(null)
NULL
with array_data as (
select id, c1 from t1
)
select id, reverse(c1) from array_data;
id	reverse(c1)
1	NULL
2	[NULL]
3	[3,NULL,2,1]
with treverse as (
select id, reverse(c1) from t1
)
select * from treverse;
id	reverse(c1)
1	NULL
2	[NULL]
3	[3,NULL,2,1]
INSERT IGNORE INTO t1(id, c1) select id + 2, reverse(c1) from t1;
INSERT INTO t1(id, c1) VALUES(7, reverse(null));
REPLACE INTO t1(id, c1) VALUES(5, reverse(null));
select id, c1 from t1 order by id;
id	c1
1	NULL
2	[NULL]
3	[1,2,NULL,3]
4	[NULL]
5	NULL
7	NULL
update /*+ ENABLE_PARALLEL_DML parallel(256) */
t1 set c1 = reverse(c1);
update t1 set c1 = reverse(c1) where id = 1;
select id, c1 from t1 order by id;
id	c1
1	NULL
2	[NULL]
3	[3,NULL,2,1]
4	[NULL]
5	NULL
7	NULL
drop table if exists t1, t2;
drop table if exists tt;
create table tt(id int, arr_int int[], arr_dint array(array(int)), arr_vec array(vector(1)), arr_char array(varchar(10)));
insert into tt values(1, [1], [[1], [2]], [[1], [2]], ['a', 'b']);
insert into tt values(2, null, [[1], [2]], [[1], [2]], ['a', 'b']);
insert into tt values(3, array_remove([1], 1), [[1], [2]], [[1], [2]], ['a', 'b']);
insert into tt values(4, [null, 1], [[1], [2]], [[1], [2]], ['a', 'b']);
insert into tt values(5, [null], [[1], [2]], [[1], [2]], ['a', 'b']);
insert into tt values(6, [1], null, [[1], [2]], ['a', 'b']);
insert into tt values(7, [1], array_remove([[1]], [1]), [[1], [2]], ['a', 'b']);
insert into tt values(8, [1], [null, [2]], [[1], [2]], ['a', 'b']);
insert into tt values(9, [1], array_append(array_remove([[1]],[1]), null), [[1], [2]], ['a', 'b']);
insert into tt values(10, [1], [[null], [2]], [[1], [2]], ['a', 'b']);
insert into tt values(11, [1], [[null, 1], [2]], [[1], [2]], ['a', 'b']);
insert into tt values(12, [1], [array_remove([1], 1)], [[1], [2]], ['a', 'b']);
insert into tt values(13, [1], [array_remove([1], 1), [2]], [[1], [2]], ['a', 'b']);
insert into tt values(14, [1], [[1], [2]], null, ['a', 'b']);
insert into tt values(15, [1], [[1], [2]], array_remove([[1]], [1]), ['a', 'b']);
insert into tt values(16, [1], [[1], [2]], array_append(array_remove([[1]],[1]), null), ['a', 'b']);
insert into tt values(17, [1], [[1], [2]], [[1], [2]], null);
insert into tt values(18, [1], [[1], [2]], [[1], [2]], array_remove(['a'], 'a'));
insert into tt values(19, [1], [[1], [2]], [[1], [2]], array_append(array_remove(['a'],'a'), null));
select id, reverse(arr_int) from tt;
id	reverse(arr_int)
1	[1]
2	NULL
3	[]
4	[1,NULL]
5	[NULL]
6	[1]
7	[1]
8	[1]
9	[1]
10	[1]
11	[1]
12	[1]
13	[1]
14	[1]
15	[1]
16	[1]
17	[1]
18	[1]
19	[1]
select id, reverse(arr_dint) from tt;
id	reverse(arr_dint)
1	[[2],[1]]
2	[[2],[1]]
3	[[2],[1]]
4	[[2],[1]]
5	[[2],[1]]
6	NULL
7	[]
8	[[2],NULL]
9	[NULL]
10	[[2],[NULL]]
11	[[2],[NULL,1]]
12	[[]]
13	[[2],[]]
14	[[2],[1]]
15	[[2],[1]]
16	[[2],[1]]
17	[[2],[1]]
18	[[2],[1]]
19	[[2],[1]]
select id, reverse(arr_vec) from tt;
id	reverse(arr_vec)
1	[[2],[1]]
2	[[2],[1]]
3	[[2],[1]]
4	[[2],[1]]
5	[[2],[1]]
6	[[2],[1]]
7	[[2],[1]]
8	[[2],[1]]
9	[[2],[1]]
10	[[2],[1]]
11	[[2],[1]]
12	[[2],[1]]
13	[[2],[1]]
14	NULL
15	[]
16	[NULL]
17	[[2],[1]]
18	[[2],[1]]
19	[[2],[1]]
select id, reverse(arr_char) from tt;
id	reverse(arr_char)
1	["b","a"]
2	["b","a"]
3	["b","a"]
4	["b","a"]
5	["b","a"]
6	["b","a"]
7	["b","a"]
8	["b","a"]
9	["b","a"]
10	["b","a"]
11	["b","a"]
12	["b","a"]
13	["b","a"]
14	["b","a"]
15	["b","a"]
16	["b","a"]
17	NULL
18	[]
19	[NULL]
drop table if exists tt;
