drop table sourceTable;
drop table targetTable;
drop view targetView;
drop table t1;
drop table t2;
create global temporary table sourcetable(id int, sales int) on commit preserve rows;
create table targettable(id int primary key, sales int) partition by hash(id) partitions 4;
create index gkey_merge_subquery on targetTable(sales) global;
create view targetView as select * from targetTable;
truncate table targetTable;
truncate table sourceTable;
insert into targetTable values(1,1),(2,2),(3,3);
insert into sourceTable values(1,2),(2,4),(3,6),(4,8);
explain merge into targetTable t1 using (select * from sourceTable) t2 on (t1.id = t2.id) when matched then update set t1.sales = t2.sales;
Query Plan
===========================================================================================
|ID|OPERATOR              |NAME                                     |EST.ROWS|EST.TIME(us)|
-------------------------------------------------------------------------------------------
|0 |DISTRIBUTED MERGE     |                                         |3       |6           |
|1 |└─HASH JOIN           |                                         |3       |6           |
|2 |  ├─TABLE FULL SCAN   |T1(GKEY_MERGE_SUBQUERY)                  |3       |3           |
|3 |  └─SUBPLAN SCAN      |T2                                       |4       |3           |
|4 |    └─TABLE RANGE SCAN|SOURCETABLE(IDX_FOR_HEAP_GTT_SOURCETABLE)|4       |3           |
===========================================================================================
Outputs & filters:
-------------------------------------
  0 - output(nil), filter(nil)
      columns([{T1: ({TARGETTABLE: (T1.ID, T1.SALES)}, {GKEY_MERGE_SUBQUERY: (T1.SALES, T1.ID)})}]),
      update([T1.SALES=column_conv(NUMBER,PS:(-1,0),NULL,T2.SALES)]), 
      insert_conds(nil), update_conds(nil), delete_conds(nil)
  1 - output([T1.ID], [T1.SALES], [T2.SALES]), filter(nil), rowset=16
      equal_conds([T1.ID = T2.ID]), other_conds(nil)
  2 - output([T1.ID], [T1.SALES]), filter(nil), rowset=16
      access([T1.ID], [T1.SALES]), partition
      is_index_back=false, is_global_index=true, 
      range_key([T1.SALES], [T1.ID]), range(MIN,MIN ; MAX,MAX)always true
  3 - output([T2.ID], [T2.SALES]), filter(nil), rowset=16
      access([T2.ID], [T2.SALES])
  4 - output([SOURCETABLE.ID], [SOURCETABLE.SALES]), filter(nil), rowset=16
      access([SOURCETABLE.ID], [SOURCETABLE.SALES]), partition
      is_index_back=false, is_global_index=false, 
      range_key([SOURCETABLE.SYS_SESSION_ID], [SOURCETABLE.__pk_increment]), range(sessionid,MIN ; sessionid,MAX), 
      range_cond([SOURCETABLE.SYS_SESSION_ID = temp_table_ssid(0)])
merge into targetTable t1 using (select * from sourceTable) t2 on (t1.id = t2.id) when matched then update set t1.sales = t2.sales;
select * from targetTable;
ID	SALES
1	2
2	4
3	6
merge into targetTable t1 using (select * from sourceTable) t2 on (t1.id = t2.id) when matched then update set t1.sales = t2.sales * 2;
select * from targetTable;
ID	SALES
1	4
2	8
3	12
drop table targetTable;
drop table sourceTable;
create global temporary table t1(c1 int primary key, c2 int) on commit preserve rows;
create global temporary table t2(c1 int primary key, c2 int) on commit preserve rows;
insert into t1 values(1,1),(2,2),(3,3);
insert into t2 values(1,2),(2,4),(3,6),(4,8);
merge into t1 using (select * from t2) t2 on (t1.c2 * 2 = t2.c2) when matched then update set t1.c1 = t2.c1 * 10;
select * from t1;
C1	C2
10	1
20	2
30	3
drop table t1;
drop table t2;
create table t1(c1 int, c2 int, c3 int, primary key(c1, c2)) partition by hash(c1) partitions 4;
create index gkey_merge_subquery on t1(c2, c3) global;
create global temporary table t2(c1 int, c2 int, c3 int, primary key(c1, c2)) on commit preserve rows;
insert into t1 values(1,1,1),(2,2,2),(3,3,3);
insert into t2 values(1,2,2),(2,4,4),(3,6,6),(4,8,8);
explain merge into t1 using (select * from t2) t2 on (t1.c1 = t2.c1) when matched then update set t1.c2 = t2.c2;
Query Plan
=========================================================================
|ID|OPERATOR              |NAME                   |EST.ROWS|EST.TIME(us)|
-------------------------------------------------------------------------
|0 |DISTRIBUTED MERGE     |                       |3       |6           |
|1 |└─MERGE JOIN          |                       |3       |6           |
|2 |  ├─SUBPLAN SCAN      |T2                     |4       |3           |
|3 |  │ └─TABLE RANGE SCAN|T2                     |4       |3           |
|4 |  └─SORT              |                       |3       |3           |
|5 |    └─TABLE FULL SCAN |T1(GKEY_MERGE_SUBQUERY)|3       |3           |
=========================================================================
Outputs & filters:
-------------------------------------
  0 - output(nil), filter(nil)
      columns([{T1: ({T1: (T1.C1, T1.C2, T1.C3)}, {GKEY_MERGE_SUBQUERY: (T1.C2, T1.C3, T1.C1)})}]),
      update([T1.C2=column_conv(NUMBER,PS:(-1,0),NOT NULL,T2.C2)]), 
      insert_conds(nil), update_conds(nil), delete_conds(nil)
  1 - output([T1.C1], [T1.C2], [T1.C3], [T2.C2]), filter(nil), rowset=16
      equal_conds([T1.C1 = T2.C1]), other_conds(nil)
      merge_directions([ASC])
  2 - output([T2.C1], [T2.C2]), filter(nil), rowset=16
      access([T2.C1], [T2.C2])
  3 - output([T2.C1], [T2.C2]), filter(nil), rowset=16
      access([T2.C1], [T2.C2]), partition
      is_index_back=false, is_global_index=false, 
      range_key([T2.SYS_SESSION_ID], [T2.C1], [T2.C2]), range(sessionid,MIN,MIN ; sessionid,MAX,MAX), 
      range_cond([T2.SYS_SESSION_ID = temp_table_ssid(0)])
  4 - output([T1.C1], [T1.C2], [T1.C3]), filter(nil), rowset=16
      sort_keys([T1.C1, ASC])
  5 - output([T1.C1], [T1.C2], [T1.C3]), filter(nil), rowset=16
      access([T1.C1], [T1.C2], [T1.C3]), partition
      is_index_back=false, is_global_index=true, 
      range_key([T1.C2], [T1.C3], [T1.C1]), range(MIN,MIN,MIN ; MAX,MAX,MAX)always true
merge into t1 using (select * from t2) t2 on (t1.c1 = t2.c1) when matched then update set t1.c2 = t2.c2;
select * from t1;
C1	C2	C3
1	2	1
2	4	2
3	6	3
drop table t1;
drop table t2;
create table t1(c1 int primary key, c2 int, c3 int, unique(c3, c2)) partition by hash(c1) partitions 4;
create global temporary table t2(c1 int, c2 int, c3 int, unique(c3, c2)) on commit preserve rows;
insert into t1 values(1,1,1),(2,2,2),(3,3,3);
insert into t2 values(1,2,2),(2,4,4),(3,6,6),(4,8,8);
merge into t1 using (select * from t2) t2 on (t1.c1 = t2.c1) when matched then update set t1.c2 = t2.c2;
select * from t1;
C1	C2	C3
1	2	1
2	4	2
3	6	3
drop table t1;
drop table t2;
create table t1(c1 int primary key, c2 int, c3 int) partition by hash(c1) partitions 4;
create index gkey_merge_subquery on t1(c2, c3) global;
create global temporary table t2(c1 int primary key, c2 int, c3 int) on commit preserve rows;
insert into t1 values(1,1,1),(2,2,2),(3,3,3);
insert into t2 values(1,2,2),(2,4,4),(3,6,6),(4,8,8);
explain merge into t1 using (select * from t2) t2 on (t1.c1 = t2.c1) when matched then update set t1.c2 = t1.c2 + t2.c2;
Query Plan
=========================================================================
|ID|OPERATOR              |NAME                   |EST.ROWS|EST.TIME(us)|
-------------------------------------------------------------------------
|0 |DISTRIBUTED MERGE     |                       |3       |6           |
|1 |└─MERGE JOIN          |                       |3       |6           |
|2 |  ├─SUBPLAN SCAN      |T2                     |4       |3           |
|3 |  │ └─TABLE RANGE SCAN|T2                     |4       |3           |
|4 |  └─SORT              |                       |3       |3           |
|5 |    └─TABLE FULL SCAN |T1(GKEY_MERGE_SUBQUERY)|3       |3           |
=========================================================================
Outputs & filters:
-------------------------------------
  0 - output(nil), filter(nil)
      columns([{T1: ({T1: (T1.C1, T1.C2, T1.C3)}, {GKEY_MERGE_SUBQUERY: (T1.C2, T1.C3, T1.C1)})}]),
      update([T1.C2=column_conv(NUMBER,PS:(-1,0),NULL,T1.C2 + T2.C2)]), 
      insert_conds(nil), update_conds(nil), delete_conds(nil)
  1 - output([T1.C1], [T1.C2], [T1.C3], [T2.C2]), filter(nil), rowset=16
      equal_conds([T1.C1 = T2.C1]), other_conds(nil)
      merge_directions([ASC])
  2 - output([T2.C1], [T2.C2]), filter(nil), rowset=16
      access([T2.C1], [T2.C2])
  3 - output([T2.C1], [T2.C2]), filter(nil), rowset=16
      access([T2.C1], [T2.C2]), partition
      is_index_back=false, is_global_index=false, 
      range_key([T2.SYS_SESSION_ID], [T2.C1]), range(sessionid,MIN ; sessionid,MAX), 
      range_cond([T2.SYS_SESSION_ID = temp_table_ssid(0)])
  4 - output([T1.C1], [T1.C2], [T1.C3]), filter(nil), rowset=16
      sort_keys([T1.C1, ASC])
  5 - output([T1.C1], [T1.C2], [T1.C3]), filter(nil), rowset=16
      access([T1.C1], [T1.C2], [T1.C3]), partition
      is_index_back=false, is_global_index=true, 
      range_key([T1.C2], [T1.C3], [T1.C1]), range(MIN,MIN,MIN ; MAX,MAX,MAX)always true
merge into t1 using (select * from t2) t2 on (t1.c1 = t2.c1) when matched then update set t1.c2 = t1.c2 + t2.c2;
select * from t1;
C1	C2	C3
1	3	1
2	6	2
3	9	3
explain merge into t1 using (select * from t2) t2 on (t1.c1 = t2.c1) when matched then update set t1.c2 = t2.c2 ,t1.c3=t2.c3;
Query Plan
=========================================================================
|ID|OPERATOR              |NAME                   |EST.ROWS|EST.TIME(us)|
-------------------------------------------------------------------------
|0 |DISTRIBUTED MERGE     |                       |3       |7           |
|1 |└─HASH JOIN           |                       |3       |7           |
|2 |  ├─TABLE FULL SCAN   |T1(GKEY_MERGE_SUBQUERY)|3       |3           |
|3 |  └─SUBPLAN SCAN      |T2                     |4       |3           |
|4 |    └─TABLE RANGE SCAN|T2                     |4       |3           |
=========================================================================
Outputs & filters:
-------------------------------------
  0 - output(nil), filter(nil)
      columns([{T1: ({T1: (T1.C1, T1.C2, T1.C3)}, {GKEY_MERGE_SUBQUERY: (T1.C2, T1.C3, T1.C1)})}]),
      update([T1.C2=column_conv(NUMBER,PS:(-1,0),NULL,T2.C2)], [T1.C3=column_conv(NUMBER,PS:(-1,0),NULL,T2.C3)]), 
      insert_conds(nil), update_conds(nil), delete_conds(nil)
  1 - output([T1.C1], [T1.C2], [T1.C3], [T2.C2], [T2.C3]), filter(nil), rowset=16
      equal_conds([T1.C1 = T2.C1]), other_conds(nil)
  2 - output([T1.C1], [T1.C2], [T1.C3]), filter(nil), rowset=16
      access([T1.C1], [T1.C2], [T1.C3]), partition
      is_index_back=false, is_global_index=true, 
      range_key([T1.C2], [T1.C3], [T1.C1]), range(MIN,MIN,MIN ; MAX,MAX,MAX)always true
  3 - output([T2.C1], [T2.C2], [T2.C3]), filter(nil), rowset=16
      access([T2.C1], [T2.C2], [T2.C3])
  4 - output([T2.C1], [T2.C2], [T2.C3]), filter(nil), rowset=16
      access([T2.C1], [T2.C2], [T2.C3]), partition
      is_index_back=false, is_global_index=false, 
      range_key([T2.SYS_SESSION_ID], [T2.C1]), range(sessionid,MIN ; sessionid,MAX), 
      range_cond([T2.SYS_SESSION_ID = temp_table_ssid(0)])
merge into t1 using (select * from t2) t2 on (t1.c1 = t2.c1) when matched then update set t1.c2 = t2.c2 ,t1.c3=t2.c3;
select * from t1;
C1	C2	C3
1	2	2
2	4	4
3	6	6
explain merge into t1 using (select * from t2) t2 on (t1.c1 = t2.c1) when matched then update set t1.c2 = abs(t2.c2 * -1) + 100;
Query Plan
=========================================================================
|ID|OPERATOR              |NAME                   |EST.ROWS|EST.TIME(us)|
-------------------------------------------------------------------------
|0 |DISTRIBUTED MERGE     |                       |3       |7           |
|1 |└─MERGE JOIN          |                       |3       |7           |
|2 |  ├─SUBPLAN SCAN      |T2                     |4       |3           |
|3 |  │ └─TABLE RANGE SCAN|T2                     |4       |3           |
|4 |  └─SORT              |                       |3       |4           |
|5 |    └─TABLE FULL SCAN |T1(GKEY_MERGE_SUBQUERY)|3       |3           |
=========================================================================
Outputs & filters:
-------------------------------------
  0 - output(nil), filter(nil)
      columns([{T1: ({T1: (T1.C1, T1.C2, T1.C3)}, {GKEY_MERGE_SUBQUERY: (T1.C2, T1.C3, T1.C1)})}]),
      update([T1.C2=column_conv(NUMBER,PS:(-1,0),NULL,ABS(T2.C2 * -1) + 100)]), 
      insert_conds(nil), update_conds(nil), delete_conds(nil)
  1 - output([T1.C1], [T1.C2], [T1.C3], [T2.C2]), filter(nil), rowset=16
      equal_conds([T1.C1 = T2.C1]), other_conds(nil)
      merge_directions([ASC])
  2 - output([T2.C1], [T2.C2]), filter(nil), rowset=16
      access([T2.C1], [T2.C2])
  3 - output([T2.C1], [T2.C2]), filter(nil), rowset=16
      access([T2.C1], [T2.C2]), partition
      is_index_back=false, is_global_index=false, 
      range_key([T2.SYS_SESSION_ID], [T2.C1]), range(sessionid,MIN ; sessionid,MAX), 
      range_cond([T2.SYS_SESSION_ID = temp_table_ssid(0)])
  4 - output([T1.C1], [T1.C2], [T1.C3]), filter(nil), rowset=16
      sort_keys([T1.C1, ASC])
  5 - output([T1.C1], [T1.C2], [T1.C3]), filter(nil), rowset=16
      access([T1.C1], [T1.C2], [T1.C3]), partition
      is_index_back=false, is_global_index=true, 
      range_key([T1.C2], [T1.C3], [T1.C1]), range(MIN,MIN,MIN ; MAX,MAX,MAX)always true
merge into t1 using (select * from t2) t2 on (t1.c1 = t2.c1) when matched then update set t1.c2 = abs(t2.c2 * -1) + 100;
select * from t1;
C1	C2	C3
1	102	2
2	104	4
3	106	6
drop table t1;
drop table t2;
create table t1(c1 int primary key, c2 int) partition by hash(c1) partitions 4;
create global temporary table t2(c1 int primary key, c2 int) on commit preserve rows;
insert into t1 values(1,1),(2,2),(3,3);
insert into t2 values(1,2),(2,4),(3,6),(4,8);
explain merge into t1 using (select * from t2) t2 on (t1.c1 = t2.c1) when matched then update set t1.c2 = t2.c2 where t1.c1 = 2;
Query Plan
=============================================================
|ID|OPERATOR                     |NAME|EST.ROWS|EST.TIME(us)|
-------------------------------------------------------------
|0 |MERGE                        |    |1       |11          |
|1 |└─NESTED-LOOP JOIN CARTESIAN |    |1       |11          |
|2 |  ├─SUBPLAN SCAN             |T2  |1       |5           |
|3 |  │ └─TABLE GET              |T2  |1       |5           |
|4 |  └─TABLE GET                |T1  |1       |5           |
=============================================================
Outputs & filters:
-------------------------------------
  0 - output(nil), filter(nil)
      columns([{T1: ({T1: (T1.C1, T1.C2)})}]),
      update([T1.C2=column_conv(NUMBER,PS:(-1,0),NULL,T2.C2)]), 
      insert_conds(nil), update_conds(nil), delete_conds(nil)
  1 - output([T1.C1], [T1.C2], [T2.C2]), filter(nil), rowset=16
      conds(nil), nl_params_(nil), use_batch=false
  2 - output([T2.C2]), filter(nil), rowset=16
      access([T2.C2])
  3 - output([T2.C2]), filter(nil), rowset=16
      access([T2.C2]), partition
      is_index_back=false, is_global_index=false, 
      range_key([T2.SYS_SESSION_ID], [T2.C1]), range[sessionid,2 ; sessionid,2], 
      range_cond([T2.SYS_SESSION_ID = temp_table_ssid(0)], [2 = T2.C1])
  4 - output([T1.C1], [T1.C2]), filter(nil), rowset=16
      access([T1.C1], [T1.C2]), partition
      is_index_back=false, is_global_index=false, 
      range_key([T1.C1]), range[2 ; 2], 
      range_cond([T1.C1 = 2])
merge into t1 using (select * from t2) t2 on (t1.c1 = t2.c1) when matched then update set t1.c2 = t2.c2 where t1.c1 = 2;
select * from t1;
C1	C2
2	4
1	1
3	3
merge into t1 using (select * from t2) t2 on (t1.c1 = t2.c1) when matched then update set t1.c2 = t2.c2 where t1.c2 = 3;
select * from t1;
C1	C2
2	4
1	1
3	6
merge into t1 using (select * from t2) t2 on (t1.c1 = t2.c1) when matched then update set t1.c2 = t2.c2 where t1.c1 > t2.c1;
select * from t1;
C1	C2
2	4
1	1
3	6
drop table t1;
drop table t2;
create table t1(c1 int primary key, c2 int) partition by hash(c1) partitions 4;
create index gkey_merge_subquery on t1(c2) global;
create global temporary table t2(c1 int primary key, c2 int) on commit preserve rows;
insert into t1 values(1,1),(-1,-1),(2,2),(-2,-2),(3,3),(-3,-3);
insert into t2 values(1,2),(2,4),(3,6),(4,8);
merge into t1 using (select * from t2) t2 on (abs(t1.c1) = t2.c1) when matched then update set t1.c2 = t2.c2;
select * from t1;
C1	C2
-1	2
1	2
-2	4
2	4
-3	6
3	6
drop table t1;
drop table t2;
create table t1(c1 int primary key, c2 int) partition by hash(c1) partitions 4;
create global temporary table t2(c1 int primary key, c2 int) on commit preserve rows;
insert into t1 values(1,1),(2,2),(3,3);
insert into t2 values(1,2),(2,4),(3,6),(4,8);
explain merge into t1 using (select * from t2) t2 on (t1.c1 = t2.c1) when matched then update set t1.c2 = t2.c2 delete where t1.c1 = 2;
Query Plan
=======================================================================
|ID|OPERATOR                           |NAME    |EST.ROWS|EST.TIME(us)|
-----------------------------------------------------------------------
|0 |DISTRIBUTED MERGE                  |        |3       |21          |
|1 |└─PX COORDINATOR                   |        |3       |21          |
|2 |  └─EXCHANGE OUT DISTR             |:EX10001|3       |21          |
|3 |    └─HASH JOIN                    |        |3       |20          |
|4 |      ├─PX PARTITION ITERATOR      |        |3       |9           |
|5 |      │ └─TABLE FULL SCAN          |T1      |3       |9           |
|6 |      └─EXCHANGE IN DISTR          |        |4       |10          |
|7 |        └─EXCHANGE OUT DISTR (PKEY)|:EX10000|4       |8           |
|8 |          └─SUBPLAN SCAN           |T2      |4       |3           |
|9 |            └─TABLE RANGE SCAN     |T2      |4       |3           |
=======================================================================
Outputs & filters:
-------------------------------------
  0 - output(nil), filter(nil)
      columns([{T1: ({T1: (T1.C1, T1.C2)})}]),
      update([T1.C2=column_conv(NUMBER,PS:(-1,0),NULL,T2.C2)]), 
      insert_conds(nil), update_conds(nil), delete_conds([T1.C1 = 2])
  1 - output([T1.C1], [T1.C2], [T2.C2]), filter(nil), rowset=16
  2 - output([T1.C1], [T1.C2], [T2.C2]), filter(nil), rowset=16
      dop=1
  3 - output([T1.C1], [T1.C2], [T2.C2]), filter(nil), rowset=16
      equal_conds([T1.C1 = T2.C1]), other_conds(nil)
  4 - output([T1.C1], [T1.C2]), filter(nil), rowset=16
      affinitize, force partition granule
  5 - output([T1.C1], [T1.C2]), filter(nil), rowset=16
      access([T1.C1], [T1.C2]), partitions(p[0-3])
      is_index_back=false, is_global_index=false, 
      range_key([T1.C1]), range(MIN ; MAX)always true
  6 - output([T2.C1], [T2.C2]), filter(nil), rowset=16
  7 - output([T2.C1], [T2.C2]), filter(nil), rowset=16
      (#keys=1, [T2.C1]), is_single, dop=1
  8 - output([T2.C1], [T2.C2]), filter(nil), rowset=16
      access([T2.C1], [T2.C2])
  9 - output([T2.C1], [T2.C2]), filter(nil), rowset=16
      access([T2.C1], [T2.C2]), partition
      is_index_back=false, is_global_index=false, 
      range_key([T2.SYS_SESSION_ID], [T2.C1]), range(sessionid,MIN ; sessionid,MAX), 
      range_cond([T2.SYS_SESSION_ID = temp_table_ssid(0)])
merge into t1 using (select * from t2) t2 on (t1.c1 = t2.c1) when matched then update set t1.c2 = t2.c2 delete where t1.c1 = 2;
select * from t1;
C1	C2
1	2
3	6
truncate table t1;
truncate table t2;
insert into t1 values(1,1),(2,2),(3,3);
insert into t2 values(1,2),(2,4),(3,6),(4,8);
merge into t1 using (select * from t2) t2 on (t1.c1 = t2.c1) when matched then update set t1.c2 = t2.c2 delete where t2.c1 = 2;
select * from t1;
C1	C2
1	2
3	6
truncate table t1;
truncate table t2;
insert into t1 values(1,1),(2,2),(3,3);
insert into t2 values(1,2),(2,4),(3,6),(4,8);
merge into t1 using (select * from t2) t2 on (t1.c1 = t2.c1) when matched then update set t1.c2 = t2.c2 delete where t1.c1 > 1;
select * from t1;
C1	C2
1	2
truncate table t1;
truncate table t2;
insert into t1 values(1,1),(2,2),(3,3);
insert into t2 values(1,2),(2,4),(3,6),(4,8);
merge into t1 using (select * from t2) t2 on (t1.c1 = t2.c1) when matched then update set t1.c2 = t2.c2 delete where t2.c1 > 1;
select * from t1;
C1	C2
1	2
truncate table t1;
truncate table t2;
insert into t1 values(1,1),(2,2),(3,3);
insert into t2 values(1,2),(2,4),(3,6),(4,8);
merge into t1 using (select * from t2) t2 on (t1.c1 = t2.c1) when matched then update set t1.c2 = t2.c2 delete where t1.c1 = t2.c1 ;
select * from t1;
C1	C2
truncate table t1;
truncate table t2;
insert into t1 values(1,1),(2,2),(3,3);
insert into t2 values(1,2),(2,4),(3,6),(4,8);
merge into t1 using (select * from t2) t2 on (t1.c1 = t2.c1) when matched then update set t1.c2 = t2.c2 delete where t1.c1 + t2.c1 > 1;
select * from t1;
C1	C2
truncate table t1;
truncate table t2;
insert into t1 values(1,1),(2,2),(3,3);
insert into t2 values(1,2),(2,4),(3,6),(4,8);
merge into t1 using (select * from t2) t2 on (t1.c1 = t2.c1) when matched then update set t1.c2 = t2.c2 delete where t1.c2 > 5;
select * from t1;
C1	C2
2	4
1	2
truncate table t1;
truncate table t2;
insert into t1 values(1,1),(2,2),(3,3);
insert into t2 values(1,2),(2,4),(3,6),(4,8);
merge into t1 using (select * from t2) t2 on (t1.c1 = t2.c1) when matched then update set t1.c2 = t2.c2 delete where t1.c2 = 4;
select * from t1;
C1	C2
1	2
3	6
