result_format: 4
create table t1(c1 int, c2 int, c3 int, primary key(c1)) partition by hash(c1) partitions 4;
insert into t1 values(1, 1, 1);
insert into t1 values(2, 2, 2);
insert into t1 values(3, 3, 3);
insert into t1 values(4, 4, 4);
insert into t1 values(5, 5, 5);

create global temporary table t2(c1 int primary key, c2 int) on commit preserve rows;
insert into t2 values(1, 2);
insert into t2 values(2, 3);

explain merge into t1 using t2 on (t1.c1 = t2.c2) when matched then update set t1.c2 = t2.c2 when not matched then insert (t1.c1, t1.c2) values(t2.c1, t2.c2);
Query Plan
=======================================================================
|ID|OPERATOR                           |NAME    |EST.ROWS|EST.TIME(us)|
-----------------------------------------------------------------------
|0 |DISTRIBUTED MERGE                  |        |2       |17          |
|1 |└─PX COORDINATOR                   |        |2       |17          |
|2 |  └─EXCHANGE OUT DISTR             |:EX10001|2       |16          |
|3 |    └─HASH OUTER JOIN              |        |2       |16          |
|4 |      ├─EXCHANGE IN DISTR          |        |2       |7           |
|5 |      │ └─EXCHANGE OUT DISTR (PKEY)|:EX10000|2       |5           |
|6 |      │   └─SUBPLAN SCAN           |VIEW1   |2       |3           |
|7 |      │     └─TABLE RANGE SCAN     |T2      |2       |3           |
|8 |      └─PX PARTITION ITERATOR      |        |5       |9           |
|9 |        └─TABLE FULL SCAN          |T1      |5       |9           |
=======================================================================
Outputs & filters:
-------------------------------------
  0 - output(nil), filter(nil)
      columns([{T1: ({T1: (T1.C1, T1.C2, T1.C3)})}]), partitions(p[0-3]), 
      column_values([column_conv(NUMBER,PS:(-1,0),NOT NULL,VIEW1.T2.C1)], [column_conv(NUMBER,PS:(-1,0),NULL,VIEW1.T2.C2)], [column_conv(NUMBER,PS:(-1,0),
      NULL,cast(NULL, NUMBER(-1, 0)))]),
      update([T1.C2=column_conv(NUMBER,PS:(-1,0),NULL,VIEW1.T2.C2)]), 
      insert_conds(nil), update_conds(nil), delete_conds(nil)
  1 - output([T1.C1], [T1.C2], [T1.C3], [VIEW1.T2.C2], [VIEW1.T2.C1]), filter(nil), rowset=16
  2 - output([T1.C1], [T1.C2], [T1.C3], [VIEW1.T2.C2], [VIEW1.T2.C1]), filter(nil), rowset=16
      dop=1
  3 - output([T1.C1], [T1.C2], [T1.C3], [VIEW1.T2.C2], [VIEW1.T2.C1]), filter(nil), rowset=16
      equal_conds([T1.C1 = VIEW1.T2.C2]), other_conds(nil)
  4 - output([VIEW1.T2.C2], [VIEW1.T2.C1]), filter(nil), rowset=16
  5 - output([VIEW1.T2.C2], [VIEW1.T2.C1]), filter(nil), rowset=16
      (#keys=1, [VIEW1.T2.C2]), is_single, dop=1
  6 - output([VIEW1.T2.C2], [VIEW1.T2.C1]), filter(nil), rowset=16
      access([VIEW1.T2.C2], [VIEW1.T2.C1])
  7 - output([T2.C2], [T2.C1]), filter(nil), rowset=16
      access([T2.C1], [T2.C2]), partition
      is_index_back=false, is_global_index=false, 
      range_key([T2.SYS_SESSION_ID], [T2.C1]), range(sessionid,MIN ; sessionid,MAX), 
      range_cond([T2.SYS_SESSION_ID = temp_table_ssid(0)])
  8 - output([T1.C1], [T1.C2], [T1.C3]), filter(nil), rowset=16
      affinitize, force partition granule
  9 - output([T1.C1], [T1.C2], [T1.C3]), filter(nil), rowset=16
      access([T1.C1], [T1.C2], [T1.C3]), partitions(p[0-3])
      is_index_back=false, is_global_index=false, 
      range_key([T1.C1]), range(MIN ; MAX)always true

create index gkey on t1(c2, c3) global;
explain merge into t1 using t2 on (t1.c1 = t2.c2) when matched then update set t1.c2 = t2.c2 when not matched then insert (t1.c1, t1.c2) values(t2.c1, t2.c2);
Query Plan
==========================================================
|ID|OPERATOR              |NAME    |EST.ROWS|EST.TIME(us)|
----------------------------------------------------------
|0 |DISTRIBUTED MERGE     |        |2       |6           |
|1 |└─HASH OUTER JOIN     |        |2       |6           |
|2 |  ├─SUBPLAN SCAN      |VIEW1   |2       |3           |
|3 |  │ └─TABLE RANGE SCAN|T2      |2       |3           |
|4 |  └─TABLE FULL SCAN   |T1(GKEY)|5       |3           |
==========================================================
Outputs & filters:
-------------------------------------
  0 - output(nil), filter(nil)
      columns([{T1: ({T1: (T1.C1, T1.C2, T1.C3)}, {GKEY: (T1.C2, T1.C3, T1.C1)})}]), partitions(p[0-3]), 
      column_values([column_conv(NUMBER,PS:(-1,0),NOT NULL,VIEW1.T2.C1)], [column_conv(NUMBER,PS:(-1,0),NULL,VIEW1.T2.C2)], [column_conv(NUMBER,PS:(-1,0),
      NULL,cast(NULL, NUMBER(-1, 0)))]),
      update([T1.C2=column_conv(NUMBER,PS:(-1,0),NULL,VIEW1.T2.C2)]), 
      insert_conds(nil), update_conds(nil), delete_conds(nil)
  1 - output([T1.C1], [T1.C2], [T1.C3], [VIEW1.T2.C2], [VIEW1.T2.C1]), filter(nil), rowset=16
      equal_conds([T1.C1 = VIEW1.T2.C2]), other_conds(nil)
  2 - output([VIEW1.T2.C2], [VIEW1.T2.C1]), filter(nil), rowset=16
      access([VIEW1.T2.C2], [VIEW1.T2.C1])
  3 - output([T2.C2], [T2.C1]), filter(nil), rowset=16
      access([T2.C1], [T2.C2]), partition
      is_index_back=false, is_global_index=false, 
      range_key([T2.SYS_SESSION_ID], [T2.C1]), range(sessionid,MIN ; sessionid,MAX), 
      range_cond([T2.SYS_SESSION_ID = temp_table_ssid(0)])
  4 - output([T1.C1], [T1.C2], [T1.C3]), filter(nil), rowset=16
      access([T1.C1], [T1.C2], [T1.C3]), partition
      is_index_back=false, is_global_index=true, 
      range_key([T1.C2], [T1.C3], [T1.C1]), range(MIN,MIN,MIN ; MAX,MAX,MAX)always true
merge into t1 using t2 on (t1.c1 = t2.c2) when matched then update set t1.c2 = t2.c2 when not matched then insert (t1.c1, t1.c2) values(t2.c1, t2.c2);
select * from t1;
+----+------+------+
| C1 | C2   | C3   |
+----+------+------+
|  1 |    1 |    1 |
|  2 |    2 |    2 |
|  3 |    3 |    3 |
|  4 |    4 |    4 |
|  5 |    5 |    5 |
+----+------+------+

drop table t1;
drop table t2;
create table t1(c1 int primary key, c2 int) partition by hash(c1) partitions 4;
create global temporary table t2(c1 int, c2 int) on commit preserve rows;
insert into t1 values(1, 1);
insert into t1 values(2, 2);
insert into t1 values(3, 3);
insert into t1 values(4, 4);
insert into t1 values(5, 5);
insert into t2 values(1, 2);
insert into t2 values(2, 3);
insert into t2 values(7, 8);
alter table t1 enable row movement;

explain merge into t1 using t2 on (t1.c1 = t2.c1) when matched then update set t1.c2 = t2.c2;
Query Plan
======================================================================================
|ID|OPERATOR                           |NAME                   |EST.ROWS|EST.TIME(us)|
--------------------------------------------------------------------------------------
|0 |DISTRIBUTED MERGE                  |                       |3       |19          |
|1 |└─PX COORDINATOR                   |                       |3       |19          |
|2 |  └─EXCHANGE OUT DISTR             |:EX10001               |3       |19          |
|3 |    └─HASH JOIN                    |                       |3       |18          |
|4 |      ├─EXCHANGE IN DISTR          |                       |3       |9           |
|5 |      │ └─EXCHANGE OUT DISTR (PKEY)|:EX10000               |3       |7           |
|6 |      │   └─SUBPLAN SCAN           |VIEW1                  |3       |3           |
|7 |      │     └─TABLE RANGE SCAN     |T2(IDX_FOR_HEAP_GTT_T2)|3       |3           |
|8 |      └─PX PARTITION ITERATOR      |                       |5       |9           |
|9 |        └─TABLE FULL SCAN          |T1                     |5       |9           |
======================================================================================
Outputs & filters:
-------------------------------------
  0 - output(nil), filter(nil)
      columns([{T1: ({T1: (T1.C1, T1.C2)})}]),
      update([T1.C2=column_conv(NUMBER,PS:(-1,0),NULL,VIEW1.T2.C2)]), 
      insert_conds(nil), update_conds(nil), delete_conds(nil)
  1 - output([T1.C1], [T1.C2], [VIEW1.T2.C2]), filter(nil), rowset=16
  2 - output([T1.C1], [T1.C2], [VIEW1.T2.C2]), filter(nil), rowset=16
      dop=1
  3 - output([T1.C1], [T1.C2], [VIEW1.T2.C2]), filter(nil), rowset=16
      equal_conds([T1.C1 = VIEW1.T2.C1]), other_conds(nil)
  4 - output([VIEW1.T2.C1], [VIEW1.T2.C2]), filter(nil), rowset=16
  5 - output([VIEW1.T2.C1], [VIEW1.T2.C2]), filter(nil), rowset=16
      (#keys=1, [VIEW1.T2.C1]), is_single, dop=1
  6 - output([VIEW1.T2.C1], [VIEW1.T2.C2]), filter(nil), rowset=16
      access([VIEW1.T2.C1], [VIEW1.T2.C2])
  7 - output([T2.C1], [T2.C2]), filter(nil), rowset=16
      access([T2.C1], [T2.C2]), partition
      is_index_back=false, is_global_index=false, 
      range_key([T2.SYS_SESSION_ID], [T2.__pk_increment]), range(sessionid,MIN ; sessionid,MAX), 
      range_cond([T2.SYS_SESSION_ID = temp_table_ssid(0)])
  8 - output([T1.C1], [T1.C2]), filter(nil), rowset=16
      affinitize, force partition granule
  9 - output([T1.C1], [T1.C2]), filter(nil), rowset=16
      access([T1.C1], [T1.C2]), partitions(p[0-3])
      is_index_back=false, is_global_index=false, 
      range_key([T1.C1]), range(MIN ; MAX)always true
merge into t1 using t2 on (t1.c1 = t2.c1) when matched then update set t1.c2 = t2.c2;
select * from t1;
+----+------+
| C1 | C2   |
+----+------+
|  2 |    3 |
|  1 |    2 |
|  4 |    4 |
|  3 |    3 |
|  5 |    5 |
+----+------+

explain merge into t1 using t2 on (t1.c2 = t2.c2) when matched then update set t1.c1 = t2.c1;
Query Plan
================================================================================
|ID|OPERATOR                     |NAME                   |EST.ROWS|EST.TIME(us)|
--------------------------------------------------------------------------------
|0 |DISTRIBUTED MERGE            |                       |3       |22          |
|1 |└─HASH JOIN                  |                       |3       |22          |
|2 |  ├─SUBPLAN SCAN             |VIEW1                  |3       |3           |
|3 |  │ └─TABLE RANGE SCAN       |T2(IDX_FOR_HEAP_GTT_T2)|3       |3           |
|4 |  └─PX COORDINATOR           |                       |5       |19          |
|5 |    └─EXCHANGE OUT DISTR     |:EX10000               |5       |16          |
|6 |      └─PX PARTITION ITERATOR|                       |5       |9           |
|7 |        └─TABLE FULL SCAN    |T1                     |5       |9           |
================================================================================
Outputs & filters:
-------------------------------------
  0 - output(nil), filter(nil)
      columns([{T1: ({T1: (T1.C1, T1.C2)})}]),
      update([T1.C1=column_conv(NUMBER,PS:(-1,0),NOT NULL,VIEW1.T2.C1)]), 
      insert_conds(nil), update_conds(nil), delete_conds(nil)
  1 - output([T1.C1], [T1.C2], [VIEW1.T2.C1]), filter(nil), rowset=16
      equal_conds([T1.C2 = VIEW1.T2.C2]), other_conds(nil)
  2 - output([VIEW1.T2.C2], [VIEW1.T2.C1]), filter(nil), rowset=16
      access([VIEW1.T2.C2], [VIEW1.T2.C1])
  3 - output([T2.C2], [T2.C1]), filter(nil), rowset=16
      access([T2.C2], [T2.C1]), partition
      is_index_back=false, is_global_index=false, 
      range_key([T2.SYS_SESSION_ID], [T2.__pk_increment]), range(sessionid,MIN ; sessionid,MAX), 
      range_cond([T2.SYS_SESSION_ID = temp_table_ssid(0)])
  4 - output([T1.C1], [T1.C2]), filter(nil), rowset=16
  5 - output([T1.C1], [T1.C2]), filter(nil), rowset=16
      dop=1
  6 - output([T1.C1], [T1.C2]), filter(nil), rowset=16
      force partition granule
  7 - output([T1.C1], [T1.C2]), filter(nil), rowset=16
      access([T1.C1], [T1.C2]), partitions(p[0-3])
      is_index_back=false, is_global_index=false, 
      range_key([T1.C1]), range(MIN ; MAX)always true
merge into t1 using t2 on (t1.c2 = t2.c2) when matched then update set t1.c1 = t2.c1;
ERROR 23000: unique constraint '2' for key 'T1_OBPK_1234' violated
select * from t1;
+----+------+
| C1 | C2   |
+----+------+
|  2 |    3 |
|  1 |    2 |
|  4 |    4 |
|  3 |    3 |
|  5 |    5 |
+----+------+

### 测试merge的delete、udpate和insert功能
drop table t1;
drop table t2;
create table t1(c1 int primary key, c2 int) partition by hash(c1) partitions 4;
create global temporary table t2(c1 int, c2 int) on commit preserve rows;

create index gkey on t1(c2) global;
insert into t1 values(1, 1);
insert into t1 values(2, 2);

insert into t2 values(1, 2);

merge into t1 using t2 on (t1.c1 = t2.c1) when matched then update set t1.c2 = t2.c2 delete where (t1.c2 = 2);
select * from t1;
+----+------+
| C1 | C2   |
+----+------+
|  2 |    2 |
+----+------+

truncate table t1;
truncate table t2;

insert into t1 values(1, 1);

insert into t2 values(2, 2);
merge into t1 using t2 on (t1.c1 = t2. c1) when not matched then insert(t1.c1, t1.c2) values(t2.c1, t2.c2);
select * from t1;
+----+------+
| C1 | C2   |
+----+------+
|  1 |    1 |
|  2 |    2 |
+----+------+

delete from t2;
insert into t2 values(2, 3);
merge into t1 using t2 on (t1.c1 = t2.c1) when matched then update set t1.c2 = t2.c2;
select * from t1;
+----+------+
| C1 | C2   |
+----+------+
|  1 |    1 |
|  2 |    3 |
+----+------+

truncate table t1;
truncate table t2;
insert into t1 values(1, 1);
insert into t2 values(1, 2);
insert into t2 values(1, 3);
merge into t1 using t2 on (t1.c1 = t2.c1) when matched then update set t1.c2 = t2.c2;
ERROR HY000: unable to get a stable set of rows in the source tables

drop table t1;
drop table t2;
create table t1(c1 int primary key, c2 int) partition by hash(c1) partitions 4;
create index gkey on t1(c2) global;
create global temporary table t2(c1 int, c2 int) on commit preserve rows;
insert into t1 values(1, 2);
insert into t1 values(2, 3);
insert into t2 values(1, 1);
insert into t2 values(2, 2);
create view vv as select c1, c2 from t2;
explain merge into t1 using vv on (t1.c1 = vv.c1) when matched then update set t1.c2 = 100;
Query Plan
=========================================================================
|ID|OPERATOR              |NAME                   |EST.ROWS|EST.TIME(us)|
-------------------------------------------------------------------------
|0 |DISTRIBUTED MERGE     |                       |2       |6           |
|1 |└─HASH JOIN           |                       |2       |6           |
|2 |  ├─SUBPLAN SCAN      |VV                     |2       |3           |
|3 |  │ └─TABLE RANGE SCAN|T2(IDX_FOR_HEAP_GTT_T2)|2       |3           |
|4 |  └─TABLE FULL SCAN   |T1(GKEY)               |2       |3           |
=========================================================================
Outputs & filters:
-------------------------------------
  0 - output(nil), filter(nil)
      columns([{T1: ({T1: (T1.C1, T1.C2)}, {GKEY: (T1.C2, T1.C1)})}]),
      update([T1.C2=column_conv(NUMBER,PS:(-1,0),NULL,100)]), 
      insert_conds(nil), update_conds(nil), delete_conds(nil)
  1 - output([T1.C1], [T1.C2]), filter(nil), rowset=16
      equal_conds([T1.C1 = VV.C1]), other_conds(nil)
  2 - output([VV.C1]), filter(nil), rowset=16
      access([VV.C1])
  3 - output([T2.C1]), filter(nil), rowset=16
      access([T2.C1]), partition
      is_index_back=false, is_global_index=false, 
      range_key([T2.SYS_SESSION_ID], [T2.__pk_increment]), range(sessionid,MIN ; sessionid,MAX), 
      range_cond([T2.SYS_SESSION_ID = temp_table_ssid(0)])
  4 - output([T1.C1], [T1.C2]), filter(nil), rowset=16
      access([T1.C1], [T1.C2]), partition
      is_index_back=false, is_global_index=true, 
      range_key([T1.C2], [T1.C1]), range(MIN,MIN ; MAX,MAX)always true
merge into t1 using vv on (t1.c1 = vv.c1) when matched then update set t1.c2 = 100;
explain merge into vv using t1 on (vv.c1 = t1.c1) when matched then update set vv.c2 = 200;
Query Plan
=========================================================================
|ID|OPERATOR              |NAME                   |EST.ROWS|EST.TIME(us)|
-------------------------------------------------------------------------
|0 |MERGE                 |                       |2       |13          |
|1 |└─HASH JOIN           |                       |2       |13          |
|2 |  ├─TABLE FULL SCAN   |T1(GKEY)               |2       |3           |
|3 |  └─SUBPLAN SCAN      |VV                     |2       |10          |
|4 |    └─TABLE RANGE SCAN|T2(IDX_FOR_HEAP_GTT_T2)|2       |10          |
=========================================================================
Outputs & filters:
-------------------------------------
  0 - output(nil), filter(nil)
      columns([{VV: ({T2: (VV.T2.__pk_increment, VV.T2.SYS_SESSION_ID, VV.T2.SYS_SESS_CREATE_TIME, VV.C1, VV.C2)})}]),
      update([VV.C2=column_conv(NUMBER,PS:(-1,0),NULL,200)]), 
      insert_conds(nil), update_conds(nil), delete_conds(nil)
  1 - output([VV.T2.__pk_increment], [VV.T2.SYS_SESSION_ID], [VV.T2.SYS_SESS_CREATE_TIME], [VV.C1], [VV.C2]), filter(nil), rowset=16
      equal_conds([VV.C1 = T1.C1]), other_conds(nil)
  2 - output([T1.C1]), filter(nil), rowset=16
      access([T1.C1]), partition
      is_index_back=false, is_global_index=true, 
      range_key([T1.C2], [T1.C1]), range(MIN,MIN ; MAX,MAX)always true
  3 - output([VV.C1], [VV.C2], [VV.T2.__pk_increment], [VV.T2.SYS_SESSION_ID], [VV.T2.SYS_SESS_CREATE_TIME]), filter(nil), rowset=16
      access([VV.C1], [VV.C2], [VV.T2.__pk_increment], [VV.T2.SYS_SESSION_ID], [VV.T2.SYS_SESS_CREATE_TIME])
  4 - output([T2.C1], [T2.C2], [T2.__pk_increment], [T2.SYS_SESSION_ID], [T2.SYS_SESS_CREATE_TIME]), filter(nil), rowset=16
      access([T2.__pk_increment], [T2.SYS_SESSION_ID], [T2.C1], [T2.C2], [T2.SYS_SESS_CREATE_TIME]), partition
      is_index_back=true, is_global_index=false, 
      range_key([T2.SYS_SESSION_ID], [T2.__pk_increment]), range(sessionid,MIN ; sessionid,MAX), 
      range_cond([T2.SYS_SESSION_ID = temp_table_ssid(0)])
merge into vv using t1 on (vv.c1 = t1.c1) when matched then update set vv.c2 = 200;

drop table t1;
drop table t2;
