drop table sourceTable;
drop table targetTable;
drop view targetView;
drop table t1;
drop table t2;
drop table a1;
drop table a2;
create global temporary table sourcetable(id int, sales int) on commit preserve rows;
create table targettable(id int primary key, sales int) partition by hash(id) partitions 4;
create index gkey on targetTable(sales) global;
create view targetView as select * from targetTable;
truncate table targetTable;
truncate table sourceTable;
insert into targetTable values(1,1),(2,2),(3,3);
insert into sourceTable values(1,2),(2,4),(3,6),(4,8);
explain merge into targetTable t1 using sourceTable t2 on (t1.id = t2.id) when matched then update set t1.sales = t2.sales;
Query Plan
==================================================================================
|ID|OPERATOR              |NAME                            |EST.ROWS|EST.TIME(us)|
----------------------------------------------------------------------------------
|0 |DISTRIBUTED MERGE     |                                |3       |6           |
|1 |└─HASH JOIN           |                                |3       |6           |
|2 |  ├─TABLE FULL SCAN   |T1(GKEY)                        |3       |3           |
|3 |  └─SUBPLAN SCAN      |VIEW1                           |4       |3           |
|4 |    └─TABLE RANGE SCAN|T2(IDX_FOR_HEAP_GTT_SOURCETABLE)|4       |3           |
==================================================================================
Outputs & filters:
-------------------------------------
  0 - output(nil), filter(nil)
      columns([{T1: ({TARGETTABLE: (T1.ID, T1.SALES)}, {GKEY: (T1.SALES, T1.ID)})}]),
      update([T1.SALES=column_conv(NUMBER,PS:(-1,0),NULL,VIEW1.T2.SALES)]), 
      insert_conds(nil), update_conds(nil), delete_conds(nil)
  1 - output([T1.ID], [T1.SALES], [VIEW1.T2.SALES]), filter(nil), rowset=16
      equal_conds([T1.ID = VIEW1.T2.ID]), other_conds(nil)
  2 - output([T1.ID], [T1.SALES]), filter(nil), rowset=16
      access([T1.ID], [T1.SALES]), partition
      is_index_back=false, is_global_index=true, 
      range_key([T1.SALES], [T1.ID]), range(MIN,MIN ; MAX,MAX)always true
  3 - output([VIEW1.T2.ID], [VIEW1.T2.SALES]), filter(nil), rowset=16
      access([VIEW1.T2.ID], [VIEW1.T2.SALES])
  4 - output([T2.ID], [T2.SALES]), filter(nil), rowset=16
      access([T2.ID], [T2.SALES]), partition
      is_index_back=false, is_global_index=false, 
      range_key([T2.SYS_SESSION_ID], [T2.__pk_increment]), range(sessionid,MIN ; sessionid,MAX), 
      range_cond([T2.SYS_SESSION_ID = temp_table_ssid(0)])
merge into targetTable t1 using sourceTable t2 on (t1.id = t2.id) when matched then update set t1.sales = t2.sales;
select * from targetTable;
ID	SALES
1	2
2	4
3	6
merge into targetTable t1 using sourceTable t2 on (t1.id = t2.id) when matched then update set t1.sales = t2.sales * 2;
select * from targetTable;
ID	SALES
1	4
2	8
3	12
create global temporary table t1(c1 int primary key, c2 int) on commit preserve rows;
create global temporary table t2(c1 int primary key, c2 int) on commit preserve rows;
insert into t1 values(1,1),(2,2),(3,3);
insert into t2 values(1,2),(2,4),(3,6),(4,8);
merge into t1 using t2 on (t1.c2 * 2 = t2.c2) when matched then update set t1.c1 = t2.c1 * 10;
select * from t1;
C1	C2
10	1
20	2
30	3
drop table t1;
drop table t2;
create table t1(c1 int, c2 int, c3 int, primary key(c1, c2)) partition by hash(c1) partitions 4;
create global temporary table t2(c1 int, c2 int, c3 int, primary key(c1, c2)) on commit preserve rows;
insert into t1 values(1,1,1),(2,2,2),(3,3,3);
insert into t2 values(1,2,2),(2,4,4),(3,6,6),(4,8,8);
explain merge into t1 using t2 on (t1.c1 = t2.c1) when matched then update set t1.c2 = t2.c2;
Query Plan
=======================================================================
|ID|OPERATOR                           |NAME    |EST.ROWS|EST.TIME(us)|
-----------------------------------------------------------------------
|0 |DISTRIBUTED MERGE                  |        |3       |21          |
|1 |└─PX COORDINATOR                   |        |3       |21          |
|2 |  └─EXCHANGE OUT DISTR             |:EX10001|3       |21          |
|3 |    └─HASH JOIN                    |        |3       |20          |
|4 |      ├─EXCHANGE IN DISTR          |        |4       |10          |
|5 |      │ └─EXCHANGE OUT DISTR (PKEY)|:EX10000|4       |8           |
|6 |      │   └─SUBPLAN SCAN           |VIEW1   |4       |3           |
|7 |      │     └─TABLE RANGE SCAN     |T2      |4       |3           |
|8 |      └─PX PARTITION ITERATOR      |        |3       |9           |
|9 |        └─TABLE FULL SCAN          |T1      |3       |9           |
=======================================================================
Outputs & filters:
-------------------------------------
  0 - output(nil), filter(nil)
      columns([{T1: ({T1: (T1.C1, T1.C2, T1.C3)})}]),
      update([T1.C2=column_conv(NUMBER,PS:(-1,0),NOT NULL,VIEW1.T2.C2)]), 
      insert_conds(nil), update_conds(nil), delete_conds(nil)
  1 - output([T1.C1], [T1.C2], [T1.C3], [VIEW1.T2.C2]), filter(nil), rowset=16
  2 - output([T1.C1], [T1.C2], [T1.C3], [VIEW1.T2.C2]), filter(nil), rowset=16
      dop=1
  3 - output([T1.C1], [T1.C2], [T1.C3], [VIEW1.T2.C2]), filter(nil), rowset=16
      equal_conds([T1.C1 = VIEW1.T2.C1]), other_conds(nil)
  4 - output([VIEW1.T2.C1], [VIEW1.T2.C2]), filter(nil), rowset=16
  5 - output([VIEW1.T2.C1], [VIEW1.T2.C2]), filter(nil), rowset=16
      (#keys=1, [VIEW1.T2.C1]), is_single, dop=1
  6 - output([VIEW1.T2.C1], [VIEW1.T2.C2]), filter(nil), rowset=16
      access([VIEW1.T2.C1], [VIEW1.T2.C2])
  7 - output([T2.C1], [T2.C2]), filter(nil), rowset=16
      access([T2.C1], [T2.C2]), partition
      is_index_back=false, is_global_index=false, 
      range_key([T2.SYS_SESSION_ID], [T2.C1], [T2.C2]), range(sessionid,MIN,MIN ; sessionid,MAX,MAX), 
      range_cond([T2.SYS_SESSION_ID = temp_table_ssid(0)])
  8 - output([T1.C1], [T1.C2], [T1.C3]), filter(nil), rowset=16
      affinitize, force partition granule
  9 - output([T1.C1], [T1.C2], [T1.C3]), filter(nil), rowset=16
      access([T1.C1], [T1.C2], [T1.C3]), partitions(p[0-3])
      is_index_back=false, is_global_index=false, 
      range_key([T1.C1], [T1.C2]), range(MIN,MIN ; MAX,MAX)always true
merge into t1 using t2 on (t1.c1 = t2.c1) when matched then update set t1.c2 = t2.c2;
select * from t1;
C1	C2	C3
2	4	2
1	2	1
3	6	3
drop table t1;
drop table t2;
create table t1(c1 int primary key, c2 int, c3 int, unique(c3, c2)) partition by hash(c1) partitions 4;
create global temporary table t2(c1 int, c2 int, c3 int, unique(c3, c2)) on commit preserve rows;
insert into t1 values(1,1,1),(2,2,2),(3,3,3);
insert into t2 values(1,2,2),(2,4,4),(3,6,6),(4,8,8);
merge into t1 using t2 on (t1.c1 = t2.c1) when matched then update set t1.c2 = t2.c2;
select * from t1;
C1	C2	C3
1	2	1
2	4	2
3	6	3
drop table t1;
drop table t2;
create table t1(c1 int primary key, c2 int, c3 int) partition by hash(c1) partitions 5;
create global temporary table t2(c1 int primary key, c2 int, c3 int) on commit preserve rows;
insert into t1 values(1,1,1),(2,2,2),(3,3,3);
insert into t2 values(1,2,2),(2,4,4),(3,6,6),(4,8,8);
explain merge into t1 using t2 on (t1.c1 = t2.c1) when matched then update set t1.c2 = t1.c2 + t2.c2;
Query Plan
=======================================================================
|ID|OPERATOR                           |NAME    |EST.ROWS|EST.TIME(us)|
-----------------------------------------------------------------------
|0 |DISTRIBUTED MERGE                  |        |3       |23          |
|1 |└─PX COORDINATOR                   |        |3       |23          |
|2 |  └─EXCHANGE OUT DISTR             |:EX10001|3       |23          |
|3 |    └─HASH JOIN                    |        |3       |23          |
|4 |      ├─EXCHANGE IN DISTR          |        |4       |10          |
|5 |      │ └─EXCHANGE OUT DISTR (PKEY)|:EX10000|4       |8           |
|6 |      │   └─SUBPLAN SCAN           |VIEW1   |4       |3           |
|7 |      │     └─TABLE RANGE SCAN     |T2      |4       |3           |
|8 |      └─PX PARTITION ITERATOR      |        |3       |11          |
|9 |        └─TABLE FULL SCAN          |T1      |3       |11          |
=======================================================================
Outputs & filters:
-------------------------------------
  0 - output(nil), filter(nil)
      columns([{T1: ({T1: (T1.C1, T1.C2, T1.C3)})}]),
      update([T1.C2=column_conv(NUMBER,PS:(-1,0),NULL,T1.C2 + VIEW1.T2.C2)]), 
      insert_conds(nil), update_conds(nil), delete_conds(nil)
  1 - output([T1.C1], [T1.C2], [T1.C3], [VIEW1.T2.C2]), filter(nil), rowset=16
  2 - output([T1.C1], [T1.C2], [T1.C3], [VIEW1.T2.C2]), filter(nil), rowset=16
      dop=1
  3 - output([T1.C1], [T1.C2], [T1.C3], [VIEW1.T2.C2]), filter(nil), rowset=16
      equal_conds([T1.C1 = VIEW1.T2.C1]), other_conds(nil)
  4 - output([VIEW1.T2.C1], [VIEW1.T2.C2]), filter(nil), rowset=16
  5 - output([VIEW1.T2.C1], [VIEW1.T2.C2]), filter(nil), rowset=16
      (#keys=1, [VIEW1.T2.C1]), is_single, dop=1
  6 - output([VIEW1.T2.C1], [VIEW1.T2.C2]), filter(nil), rowset=16
      access([VIEW1.T2.C1], [VIEW1.T2.C2])
  7 - output([T2.C1], [T2.C2]), filter(nil), rowset=16
      access([T2.C1], [T2.C2]), partition
      is_index_back=false, is_global_index=false, 
      range_key([T2.SYS_SESSION_ID], [T2.C1]), range(sessionid,MIN ; sessionid,MAX), 
      range_cond([T2.SYS_SESSION_ID = temp_table_ssid(0)])
  8 - output([T1.C1], [T1.C2], [T1.C3]), filter(nil), rowset=16
      affinitize, force partition granule
  9 - output([T1.C1], [T1.C2], [T1.C3]), filter(nil), rowset=16
      access([T1.C1], [T1.C2], [T1.C3]), partitions(p[0-4])
      is_index_back=false, is_global_index=false, 
      range_key([T1.C1]), range(MIN ; MAX)always true
merge into t1 using t2 on (t1.c1 = t2.c1) when matched then update set t1.c2 = t1.c2 + t2.c2;
select * from t1;
C1	C2	C3
2	6	2
1	3	1
3	9	3
merge into t1 using t2 on (t1.c1 = t2.c1) when matched then update set t1.c2 = t2.c2 ,t1.c3=t2.c3;
select * from t1;
C1	C2	C3
2	4	4
1	2	2
3	6	6
merge into t1 using t2 on (t1.c1 = t2.c1) when matched then update set t1.c2 = abs(t2.c2 * -1) + 100;
select * from t1;
C1	C2	C3
2	104	4
1	102	2
3	106	6
drop table t1;
drop table t2;
create table t1(c1 int primary key, c2 int) partition by hash(c1) partitions 4;
create index gkey_merge_update on t1(c2) global;
create global temporary table t2(c1 int primary key, c2 int) on commit preserve rows;
insert into t1 values(1,1),(2,2),(3,3);
insert into t2 values(1,2),(2,4),(3,6),(4,8);
merge into t1 using t2 on (t1.c1 = t2.c1) when matched then update set t1.c2 = t2.c2 where t1.c1 = 2;
select * from t1;
C1	C2
1	1
2	4
3	3
merge into t1 using t2 on (t1.c1 = t2.c1) when matched then update set t1.c2 = t2.c2 where t1.c2 = 3;
select * from t1;
C1	C2
1	1
2	4
3	6
merge into t1 using t2 on (t1.c1 = t2.c1) when matched then update set t1.c2 = t2.c2 where t1.c1 > t2.c1;
select * from t1;
C1	C2
1	1
2	4
3	6
drop table t1;
drop table t2;
create table t1(c1 int primary key, c2 int) partition by hash(c1) partitions 8;
create global temporary table t2(c1 int primary key, c2 int) on commit preserve rows;
insert into t1 values(1,1),(-1,-1),(2,2),(-2,-2),(3,3),(-3,-3);
insert into t2 values(1,2),(2,4),(3,6),(4,8);
explain merge into t1 using t2 on (abs(t1.c1) = t2.c1) when matched then update set t1.c2 = t2.c2;
Query Plan
=================================================================
|ID|OPERATOR                     |NAME    |EST.ROWS|EST.TIME(us)|
-----------------------------------------------------------------
|0 |DISTRIBUTED MERGE            |        |4       |33          |
|1 |└─HASH JOIN                  |        |4       |33          |
|2 |  ├─SUBPLAN SCAN             |VIEW1   |4       |3           |
|3 |  │ └─TABLE RANGE SCAN       |T2      |4       |3           |
|4 |  └─PX COORDINATOR           |        |6       |29          |
|5 |    └─EXCHANGE OUT DISTR     |:EX10000|6       |25          |
|6 |      └─PX PARTITION ITERATOR|        |6       |18          |
|7 |        └─TABLE FULL SCAN    |T1      |6       |18          |
=================================================================
Outputs & filters:
-------------------------------------
  0 - output(nil), filter(nil)
      columns([{T1: ({T1: (T1.C1, T1.C2)})}]),
      update([T1.C2=column_conv(NUMBER,PS:(-1,0),NULL,VIEW1.T2.C2)]), 
      insert_conds(nil), update_conds(nil), delete_conds(nil)
  1 - output([T1.C1], [T1.C2], [VIEW1.T2.C2]), filter(nil), rowset=16
      equal_conds([ABS(T1.C1) = VIEW1.T2.C1]), other_conds(nil)
  2 - output([VIEW1.T2.C1], [VIEW1.T2.C2]), filter(nil), rowset=16
      access([VIEW1.T2.C1], [VIEW1.T2.C2])
  3 - output([T2.C1], [T2.C2]), filter(nil), rowset=16
      access([T2.C1], [T2.C2]), partition
      is_index_back=false, is_global_index=false, 
      range_key([T2.SYS_SESSION_ID], [T2.C1]), range(sessionid,MIN ; sessionid,MAX), 
      range_cond([T2.SYS_SESSION_ID = temp_table_ssid(0)])
  4 - output([T1.C1], [T1.C2]), filter(nil), rowset=16
  5 - output([T1.C1], [T1.C2]), filter(nil), rowset=16
      dop=1
  6 - output([T1.C1], [T1.C2]), filter(nil), rowset=16
      force partition granule
  7 - output([T1.C1], [T1.C2]), filter(nil), rowset=16
      access([T1.C1], [T1.C2]), partitions(p[0-7])
      is_index_back=false, is_global_index=false, 
      range_key([T1.C1]), range(MIN ; MAX)always true
merge into t1 using t2 on (abs(t1.c1) = t2.c1) when matched then update set t1.c2 = t2.c2;
select * from t1;
C1	C2
-1	2
2	4
1	2
-3	6
3	6
-2	4
drop table t1;
drop table t2;
create table t1(c1 int primary key, c2 int) partition by hash(c1) partitions 7;
create index gkey_merge_update on t1(c2) global;
create global temporary table t2(c1 int primary key, c2 int) on commit preserve rows;
insert into t1 values(1,1),(2,2),(3,3);
insert into t2 values(1,2),(2,4),(3,6),(4,8);
merge into t1 using t2 on (t1.c1 = t2.c1) when matched then update set t1.c2 = t2.c2 delete where t1.c1 = 2;
select * from t1;
C1	C2
1	2
3	6
truncate table t1;
truncate table t2;
insert into t1 values(1,1),(2,2),(3,3);
insert into t2 values(1,2),(2,4),(3,6),(4,8);
merge into t1 using t2 on (t1.c1 = t2.c1) when matched then update set t1.c2 = t2.c2 delete where t2.c1 = 2;
select * from t1;
C1	C2
1	2
3	6
truncate table t1;
truncate table t2;
insert into t1 values(1,1),(2,2),(3,3);
insert into t2 values(1,2),(2,4),(3,6),(4,8);
merge into t1 using t2 on (t1.c1 = t2.c1) when matched then update set t1.c2 = t2.c2 delete where t1.c1 > 1;
select * from t1;
C1	C2
1	2
truncate table t1;
truncate table t2;
insert into t1 values(1,1),(2,2),(3,3);
insert into t2 values(1,2),(2,4),(3,6),(4,8);
merge into t1 using t2 on (t1.c1 = t2.c1) when matched then update set t1.c2 = t2.c2 delete where t2.c1 > 1;
select * from t1;
C1	C2
1	2
truncate table t1;
truncate table t2;
insert into t1 values(1,1),(2,2),(3,3);
insert into t2 values(1,2),(2,4),(3,6),(4,8);
merge into t1 using t2 on (t1.c1 = t2.c1) when matched then update set t1.c2 = t2.c2 delete where t1.c1 = t2.c1 ;
select * from t1;
C1	C2
truncate table t1;
truncate table t2;
insert into t1 values(1,1),(2,2),(3,3);
insert into t2 values(1,2),(2,4),(3,6),(4,8);
merge into t1 using t2 on (t1.c1 = t2.c1) when matched then update set t1.c2 = t2.c2 delete where t1.c1 + t2.c1 > 1;
select * from t1;
C1	C2
truncate table t1;
truncate table t2;
insert into t1 values(1,1),(2,2),(3,3);
insert into t2 values(1,2),(2,4),(3,6),(4,8);
merge into t1 using t2 on (t1.c1 = t2.c1) when matched then update set t1.c2 = t2.c2 delete where t1.c2 > 5;
select * from t1;
C1	C2
1	2
2	4
truncate table t1;
truncate table t2;
insert into t1 values(1,1),(2,2),(3,3);
insert into t2 values(1,2),(2,4),(3,6),(4,8);
merge into t1 using t2 on (t1.c1 = t2.c1) when matched then update set t1.c2 = t2.c2 delete where t1.c2 = 4;
select * from t1;
C1	C2
1	2
3	6
create table a1(c1 int primary key, c2 int) partition by hash(c1) partitions 5;
create global temporary table a2(c1 int, c2 int) on commit preserve rows;
insert into a1 values(1,1),(2,2),(3,3);
insert into a2 values(1,2),(2,4),(3,6),(4,8);
explain merge into a1 using a2 on (a1.c1 = a2.c1) when matched then update set a1.c2 = a2.c2;
Query Plan
======================================================================================
|ID|OPERATOR                           |NAME                   |EST.ROWS|EST.TIME(us)|
--------------------------------------------------------------------------------------
|0 |DISTRIBUTED MERGE                  |                       |3       |23          |
|1 |└─PX COORDINATOR                   |                       |3       |23          |
|2 |  └─EXCHANGE OUT DISTR             |:EX10001               |3       |23          |
|3 |    └─HASH JOIN                    |                       |3       |22          |
|4 |      ├─PX PARTITION ITERATOR      |                       |3       |11          |
|5 |      │ └─TABLE FULL SCAN          |A1                     |3       |11          |
|6 |      └─EXCHANGE IN DISTR          |                       |4       |10          |
|7 |        └─EXCHANGE OUT DISTR (PKEY)|:EX10000               |4       |8           |
|8 |          └─SUBPLAN SCAN           |VIEW1                  |4       |3           |
|9 |            └─TABLE RANGE SCAN     |A2(IDX_FOR_HEAP_GTT_A2)|4       |3           |
======================================================================================
Outputs & filters:
-------------------------------------
  0 - output(nil), filter(nil)
      columns([{A1: ({A1: (A1.C1, A1.C2)})}]),
      update([A1.C2=column_conv(NUMBER,PS:(-1,0),NULL,VIEW1.A2.C2)]), 
      insert_conds(nil), update_conds(nil), delete_conds(nil)
  1 - output([A1.C1], [A1.C2], [VIEW1.A2.C2]), filter(nil), rowset=16
  2 - output([A1.C1], [A1.C2], [VIEW1.A2.C2]), filter(nil), rowset=16
      dop=1
  3 - output([A1.C1], [A1.C2], [VIEW1.A2.C2]), filter(nil), rowset=16
      equal_conds([A1.C1 = VIEW1.A2.C1]), other_conds(nil)
  4 - output([A1.C1], [A1.C2]), filter(nil), rowset=16
      affinitize, force partition granule
  5 - output([A1.C1], [A1.C2]), filter(nil), rowset=16
      access([A1.C1], [A1.C2]), partitions(p[0-4])
      is_index_back=false, is_global_index=false, 
      range_key([A1.C1]), range(MIN ; MAX)always true
  6 - output([VIEW1.A2.C1], [VIEW1.A2.C2]), filter(nil), rowset=16
  7 - output([VIEW1.A2.C1], [VIEW1.A2.C2]), filter(nil), rowset=16
      (#keys=1, [VIEW1.A2.C1]), is_single, dop=1
  8 - output([VIEW1.A2.C1], [VIEW1.A2.C2]), filter(nil), rowset=16
      access([VIEW1.A2.C1], [VIEW1.A2.C2])
  9 - output([A2.C1], [A2.C2]), filter(nil), rowset=16
      access([A2.C1], [A2.C2]), partition
      is_index_back=false, is_global_index=false, 
      range_key([A2.SYS_SESSION_ID], [A2.__pk_increment]), range(sessionid,MIN ; sessionid,MAX), 
      range_cond([A2.SYS_SESSION_ID = temp_table_ssid(0)])
merge into a1 using a2 on (a1.c1 = a2.c1) when matched then update set a1.c2 = a2.c2;
select * from a1;
C1	C2
2	4
1	2
3	6
truncate table a1;
truncate table a2;
insert into a1 values(1,1),(2,2),(3,3);
insert into a2 values(1,2),(2,4),(3,6),(4,8);
alter table a1 enable row movement;
explain merge into a1 using a2 on (2 * a1.c2 = a2.c2) when matched then update set a1.c1 =  2* a2.c2;
Query Plan
================================================================================
|ID|OPERATOR                     |NAME                   |EST.ROWS|EST.TIME(us)|
--------------------------------------------------------------------------------
|0 |DISTRIBUTED MERGE            |                       |3       |20          |
|1 |└─HASH JOIN                  |                       |3       |20          |
|2 |  ├─SUBPLAN SCAN             |VIEW1                  |4       |3           |
|3 |  │ └─TABLE RANGE SCAN       |A2(IDX_FOR_HEAP_GTT_A2)|4       |3           |
|4 |  └─PX COORDINATOR           |                       |3       |17          |
|5 |    └─EXCHANGE OUT DISTR     |:EX10000               |3       |15          |
|6 |      └─PX PARTITION ITERATOR|                       |3       |11          |
|7 |        └─TABLE FULL SCAN    |A1                     |3       |11          |
================================================================================
Outputs & filters:
-------------------------------------
  0 - output(nil), filter(nil)
      columns([{A1: ({A1: (A1.C1, A1.C2)})}]),
      update([A1.C1=column_conv(NUMBER,PS:(-1,0),NOT NULL,2 * VIEW1.A2.C2)]), 
      insert_conds(nil), update_conds(nil), delete_conds(nil)
  1 - output([A1.C1], [A1.C2], [VIEW1.A2.C2]), filter(nil), rowset=16
      equal_conds([cast(2, NUMBER(-1, -85)) * A1.C2 = VIEW1.A2.C2]), other_conds(nil)
  2 - output([VIEW1.A2.C2]), filter(nil), rowset=16
      access([VIEW1.A2.C2])
  3 - output([A2.C2]), filter(nil), rowset=16
      access([A2.C2]), partition
      is_index_back=false, is_global_index=false, 
      range_key([A2.SYS_SESSION_ID], [A2.__pk_increment]), range(sessionid,MIN ; sessionid,MAX), 
      range_cond([A2.SYS_SESSION_ID = temp_table_ssid(0)])
  4 - output([A1.C1], [A1.C2]), filter(nil), rowset=16
  5 - output([A1.C1], [A1.C2]), filter(nil), rowset=16
      dop=1
  6 - output([A1.C1], [A1.C2]), filter(nil), rowset=16
      force partition granule
  7 - output([A1.C1], [A1.C2]), filter(nil), rowset=16
      access([A1.C1], [A1.C2]), partitions(p[0-4])
      is_index_back=false, is_global_index=false, 
      range_key([A1.C1]), range(MIN ; MAX)always true
merge into a1 using a2 on (2 * a1.c2 = a2.c2) when matched then update set a1.c1 =  2* a2.c2;
select * from a1;
C1	C2
4	1
8	2
12	3
drop table t1;
drop table t2;
create table t1(c1 int primary key, c2 int) partition by hash(c1) partitions 5;
create global temporary table t2(c1 int primary key, c2 int) on commit preserve rows;
insert into t1 values(1,1);
insert into t2 values(-1,-2),(1,2);
merge into t1 using t2 on (t1.c1 = t2.c1) when matched then update set t1.c1 = t2.c2;
ERROR HY000: Columns referenced in the ON Clause cannot be updated:'T1'.'C1'
merge into t1 using t2 on (t1.c1 = t2.c1) when matched then update set t2.c2 = t2.c2 delete where t1.c1 + t2.c2 = 2;
ERROR 42S22: invalid identifier 'T2.C2' in 'field list'
merge into t1 using t2 on (t1.c1 = abs(-t2.c1)) when matched then update set t1.c1 = t2.c2;
ERROR HY000: Columns referenced in the ON Clause cannot be updated:'T1'.'C1'
drop table t1;
drop table t2;
create table t1(c1 int primary key, c2 int) partition by hash(c1) partitions 5;
create table t2(c1 int primary key, c2 int) partition by hash(c1) partitions 5;
insert into t1 values(1, 1), (2, 2), (3, 3);
insert into t2 values(1, 2), (2, 4), (3, 6), (4, 8);
explain merge into t1 using t2 on (t1.c1 = t2.c1) when matched then update set t1.c2 = t2.c2;
Query Plan
=============================================================
|ID|OPERATOR                 |NAME    |EST.ROWS|EST.TIME(us)|
-------------------------------------------------------------
|0 |PX COORDINATOR           |        |3       |23          |
|1 |└─EXCHANGE OUT DISTR     |:EX10000|3       |23          |
|2 |  └─PX PARTITION ITERATOR|        |3       |22          |
|3 |    └─MERGE              |        |3       |22          |
|4 |      └─MERGE JOIN       |        |3       |22          |
|5 |        ├─TABLE FULL SCAN|T1      |3       |11          |
|6 |        └─TABLE FULL SCAN|T2      |4       |11          |
=============================================================
Outputs & filters:
-------------------------------------
  0 - output(nil), filter(nil), rowset=16
  1 - output(nil), filter(nil), rowset=16
      dop=1
  2 - output(nil), filter(nil), rowset=16
      partition wise, force partition granule
  3 - output(nil), filter(nil)
      columns([{T1: ({T1: (T1.C1, T1.C2)})}]),
      update([T1.C2=column_conv(NUMBER,PS:(-1,0),NULL,T2.C2)]), 
      insert_conds(nil), update_conds(nil), delete_conds(nil)
  4 - output([T1.C1], [T1.C2], [T2.C2]), filter(nil), rowset=16
      equal_conds([T1.C1 = T2.C1]), other_conds(nil)
      merge_directions([ASC])
  5 - output([T1.C1], [T1.C2]), filter(nil), rowset=16
      access([T1.C1], [T1.C2]), partitions(p[0-4])
      is_index_back=false, is_global_index=false, 
      range_key([T1.C1]), range(MIN ; MAX)always true
  6 - output([T2.C1], [T2.C2]), filter(nil), rowset=16
      access([T2.C1], [T2.C2]), partitions(p[0-4])
      is_index_back=false, is_global_index=false, 
      range_key([T2.C1]), range(MIN ; MAX)always true
explain merge into t1 using t2 on (t1.c1 + 1 = t2.c1 + 1) when matched then update set t1.c2 = t2.c2;
Query Plan
=================================================================
|ID|OPERATOR                     |NAME    |EST.ROWS|EST.TIME(us)|
-----------------------------------------------------------------
|0 |DISTRIBUTED MERGE            |        |3       |36          |
|1 |└─HASH JOIN                  |        |3       |36          |
|2 |  ├─PX COORDINATOR           |        |3       |17          |
|3 |  │ └─EXCHANGE OUT DISTR     |:EX10000|3       |15          |
|4 |  │   └─PX PARTITION ITERATOR|        |3       |11          |
|5 |  │     └─TABLE FULL SCAN    |T1      |3       |11          |
|6 |  └─PX COORDINATOR           |        |4       |19          |
|7 |    └─EXCHANGE OUT DISTR     |:EX20000|4       |16          |
|8 |      └─PX PARTITION ITERATOR|        |4       |11          |
|9 |        └─TABLE FULL SCAN    |T2      |4       |11          |
=================================================================
Outputs & filters:
-------------------------------------
  0 - output(nil), filter(nil)
      columns([{T1: ({T1: (T1.C1, T1.C2)})}]),
      update([T1.C2=column_conv(NUMBER,PS:(-1,0),NULL,T2.C2)]), 
      insert_conds(nil), update_conds(nil), delete_conds(nil)
  1 - output([T1.C1], [T1.C2], [T2.C2]), filter(nil), rowset=16
      equal_conds([T1.C1 + cast(1, NUMBER(-1, -85)) = T2.C1 + cast(1, NUMBER(-1, -85))]), other_conds(nil)
  2 - output([T1.C1], [T1.C2]), filter(nil), rowset=16
  3 - output([T1.C1], [T1.C2]), filter(nil), rowset=16
      dop=1
  4 - output([T1.C1], [T1.C2]), filter(nil), rowset=16
      force partition granule
  5 - output([T1.C1], [T1.C2]), filter(nil), rowset=16
      access([T1.C1], [T1.C2]), partitions(p[0-4])
      is_index_back=false, is_global_index=false, 
      range_key([T1.C1]), range(MIN ; MAX)always true
  6 - output([T2.C1], [T2.C2]), filter(nil), rowset=16
  7 - output([T2.C1], [T2.C2]), filter(nil), rowset=16
      dop=1
  8 - output([T2.C1], [T2.C2]), filter(nil), rowset=16
      force partition granule
  9 - output([T2.C1], [T2.C2]), filter(nil), rowset=16
      access([T2.C1], [T2.C2]), partitions(p[0-4])
      is_index_back=false, is_global_index=false, 
      range_key([T2.C1]), range(MIN ; MAX)always true
merge into t1 using t2 on (t1.c1 = t2.c1) when matched then update set t1.c2 = t2.c2;
select * from t1;
C1	C2
2	4
1	2
3	6
drop table t1;
drop table t2;
