drop table sourceTable;
drop table targetTable;
drop view targetView;
drop table t1;
drop table t2;
drop table a1;
drop table a2;
create global temporary table sourcetable(id int, sales int) on commit preserve rows;
create global temporary table targettable(id int, sales int) on commit preserve rows;
create view targetView as select * from targetTable;
truncate table targetTable;
truncate table sourceTable;
insert into targetTable values(1,1),(2,2),(3,3);
insert into sourceTable values(1,2),(2,4),(3,6),(4,8);
explain merge into targetTable t1 using sourceTable t2 on (t1.id = t2.id) when matched then update set t1.sales = t2.sales;
Query Plan
==================================================================================
|ID|OPERATOR              |NAME                            |EST.ROWS|EST.TIME(us)|
----------------------------------------------------------------------------------
|0 |MERGE                 |                                |3       |17          |
|1 |└─HASH JOIN           |                                |3       |17          |
|2 |  ├─SUBPLAN SCAN      |VIEW1                           |4       |3           |
|3 |  │ └─TABLE RANGE SCAN|T2(IDX_FOR_HEAP_GTT_SOURCETABLE)|4       |3           |
|4 |  └─SUBPLAN SCAN      |VIEW2                           |3       |13          |
|5 |    └─TABLE RANGE SCAN|T1(IDX_FOR_HEAP_GTT_TARGETTABLE)|3       |13          |
==================================================================================
Outputs & filters:
-------------------------------------
  0 - output(nil), filter(nil)
      columns([{VIEW2: ({TARGETTABLE: (VIEW2.T1.__pk_increment, VIEW2.T1.SYS_SESSION_ID, VIEW2.T1.SYS_SESS_CREATE_TIME, VIEW2.T1.ID, VIEW2.T1.SALES)})}]),
      
      update([VIEW2.T1.SALES=column_conv(NUMBER,PS:(-1,0),NULL,VIEW1.T2.SALES)]), 
      insert_conds(nil), update_conds(nil), delete_conds(nil)
  1 - output([VIEW2.T1.__pk_increment], [VIEW2.T1.SYS_SESSION_ID], [VIEW2.T1.SYS_SESS_CREATE_TIME], [VIEW2.T1.ID], [VIEW2.T1.SALES], [VIEW1.T2.SALES]), filter(nil), rowset=16
      equal_conds([VIEW2.T1.ID = VIEW1.T2.ID]), other_conds(nil)
  2 - output([VIEW1.T2.ID], [VIEW1.T2.SALES]), filter(nil), rowset=16
      access([VIEW1.T2.ID], [VIEW1.T2.SALES])
  3 - output([T2.ID], [T2.SALES]), filter(nil), rowset=16
      access([T2.ID], [T2.SALES]), partition
      is_index_back=false, is_global_index=false, 
      range_key([T2.SYS_SESSION_ID], [T2.__pk_increment]), range(sessionid,MIN ; sessionid,MAX), 
      range_cond([T2.SYS_SESSION_ID = temp_table_ssid(0)])
  4 - output([VIEW2.T1.ID], [VIEW2.T1.__pk_increment], [VIEW2.T1.SYS_SESSION_ID], [VIEW2.T1.SYS_SESS_CREATE_TIME], [VIEW2.T1.SALES]), filter(nil), rowset=16
      access([VIEW2.T1.ID], [VIEW2.T1.__pk_increment], [VIEW2.T1.SYS_SESSION_ID], [VIEW2.T1.SYS_SESS_CREATE_TIME], [VIEW2.T1.SALES])
  5 - output([T1.ID], [T1.__pk_increment], [T1.SYS_SESSION_ID], [T1.SYS_SESS_CREATE_TIME], [T1.SALES]), filter(nil), rowset=16
      access([T1.__pk_increment], [T1.SYS_SESSION_ID], [T1.SYS_SESS_CREATE_TIME], [T1.ID], [T1.SALES]), partition
      is_index_back=true, is_global_index=false, 
      range_key([T1.SYS_SESSION_ID], [T1.__pk_increment]), range(sessionid,MIN ; sessionid,MAX), 
      range_cond([T1.SYS_SESSION_ID = temp_table_ssid(0)])
merge into targetTable t1 using sourceTable t2 on (t1.id = t2.id) when matched then update set t1.sales = t2.sales;
select * from targetTable;
ID	SALES
1	2
2	4
3	6
merge into targetTable t1 using sourceTable t2 on (t1.id = t2.id) when matched then update set t1.sales = t2.sales * 2;
select * from targetTable;
ID	SALES
1	4
2	8
3	12
create global temporary table t1(c1 int primary key, c2 int) on commit preserve rows;
create global temporary table t2(c1 int primary key, c2 int) on commit preserve rows;
insert into t1 values(1,1),(2,2),(3,3);
insert into t2 values(1,2),(2,4),(3,6),(4,8);
merge into t1 using t2 on (t1.c2 * 2 = t2.c2) when matched then update set t1.c1 = t2.c1 * 10;
select * from t1;
C1	C2
10	1
20	2
30	3
drop table t1;
drop table t2;
create global temporary table t1(c1 int, c2 int, c3 int, primary key(c1, c2)) on commit preserve rows;
create global temporary table t2(c1 int, c2 int, c3 int, primary key(c1, c2)) on commit preserve rows;
insert into t1 values(1,1,1),(2,2,2),(3,3,3);
insert into t2 values(1,2,2),(2,4,4),(3,6,6),(4,8,8);
merge into t1 using t2 on (t1.c1 = t2.c1) when matched then update set t1.c2 = t2.c2;
select * from t1;
C1	C2	C3
1	2	1
2	4	2
3	6	3
drop table t1;
drop table t2;
create global temporary table t1(c1 int, c2 int, c3 int, unique(c3, c2)) on commit preserve rows;
create global temporary table t2(c1 int, c2 int, c3 int, unique(c3, c2)) on commit preserve rows;
insert into t1 values(1,1,1),(2,2,2),(3,3,3);
insert into t2 values(1,2,2),(2,4,4),(3,6,6),(4,8,8);
merge into t1 using t2 on (t1.c1 = t2.c1) when matched then update set t1.c2 = t2.c2;
select * from t1;
C1	C2	C3
1	2	1
2	4	2
3	6	3
drop table t1;
drop table t2;
create global temporary table t1(c1 int primary key, c2 int, c3 int) on commit preserve rows;
create global temporary table t2(c1 int primary key, c2 int, c3 int) on commit preserve rows;
insert into t1 values(1,1,1),(2,2,2),(3,3,3);
insert into t2 values(1,2,2),(2,4,4),(3,6,6),(4,8,8);
merge into t1 using t2 on (t1.c1 = t2.c1) when matched then update set t1.c2 = t1.c2 + t2.c2;
select * from t1;
C1	C2	C3
1	3	1
2	6	2
3	9	3
merge into t1 using t2 on (t1.c1 = t2.c1) when matched then update set t1.c2 = t2.c2 ,t1.c3=t2.c3;
select * from t1;
C1	C2	C3
1	2	2
2	4	4
3	6	6
merge into t1 using t2 on (t1.c1 = t2.c1) when matched then update set t1.c2 = abs(t2.c2 * -1) + 100;
select * from t1;
C1	C2	C3
1	102	2
2	104	4
3	106	6
drop table t1;
drop table t2;
create global temporary table t1(c1 int primary key, c2 int) on commit preserve rows;
create global temporary table t2(c1 int primary key, c2 int) on commit preserve rows;
insert into t1 values(1,1),(2,2),(3,3);
insert into t2 values(1,2),(2,4),(3,6),(4,8);
merge into t1 using t2 on (t1.c1 = t2.c1) when matched then update set t1.c2 = t2.c2 where t1.c1 = 2;
select * from t1;
C1	C2
1	1
2	4
3	3
merge into t1 using t2 on (t1.c1 = t2.c1) when matched then update set t1.c2 = t2.c2 where t1.c2 = 3;
select * from t1;
C1	C2
1	1
2	4
3	6
merge into t1 using t2 on (t1.c1 = t2.c1) when matched then update set t1.c2 = t2.c2 where t1.c1 > t2.c1;
select * from t1;
C1	C2
1	1
2	4
3	6
drop table t1;
drop table t2;
create global temporary table t1(c1 int primary key, c2 int) on commit preserve rows;
create global temporary table t2(c1 int primary key, c2 int) on commit preserve rows;
insert into t1 values(1,1),(-1,-1),(2,2),(-2,-2),(3,3),(-3,-3);
insert into t2 values(1,2),(2,4),(3,6),(4,8);
merge into t1 using t2 on (abs(t1.c1) = t2.c1) when matched then update set t1.c2 = t2.c2;
select * from t1;
C1	C2
-3	6
-2	4
-1	2
1	2
2	4
3	6
drop table t1;
drop table t2;
create global temporary table t1(c1 int primary key, c2 int) on commit preserve rows;
create global temporary table t2(c1 int primary key, c2 int) on commit preserve rows;
insert into t1 values(1,1),(2,2),(3,3);
insert into t2 values(1,2),(2,4),(3,6),(4,8);
merge into t1 using t2 on (t1.c1 = t2.c1) when matched then update set t1.c2 = t2.c2 delete where t1.c1 = 2;
select * from t1;
C1	C2
1	2
3	6
truncate table t1;
truncate table t2;
insert into t1 values(1,1),(2,2),(3,3);
insert into t2 values(1,2),(2,4),(3,6),(4,8);
merge into t1 using t2 on (t1.c1 = t2.c1) when matched then update set t1.c2 = t2.c2 delete where t2.c1 = 2;
select * from t1;
C1	C2
1	2
3	6
truncate table t1;
truncate table t2;
insert into t1 values(1,1),(2,2),(3,3);
insert into t2 values(1,2),(2,4),(3,6),(4,8);
merge into t1 using t2 on (t1.c1 = t2.c1) when matched then update set t1.c2 = t2.c2 delete where t1.c1 > 1;
select * from t1;
C1	C2
1	2
truncate table t1;
truncate table t2;
insert into t1 values(1,1),(2,2),(3,3);
insert into t2 values(1,2),(2,4),(3,6),(4,8);
merge into t1 using t2 on (t1.c1 = t2.c1) when matched then update set t1.c2 = t2.c2 delete where t2.c1 > 1;
select * from t1;
C1	C2
1	2
truncate table t1;
truncate table t2;
insert into t1 values(1,1),(2,2),(3,3);
insert into t2 values(1,2),(2,4),(3,6),(4,8);
merge into t1 using t2 on (t1.c1 = t2.c1) when matched then update set t1.c2 = t2.c2 delete where t1.c1 = t2.c1 ;
select * from t1;
C1	C2
truncate table t1;
truncate table t2;
insert into t1 values(1,1),(2,2),(3,3);
insert into t2 values(1,2),(2,4),(3,6),(4,8);
merge into t1 using t2 on (t1.c1 = t2.c1) when matched then update set t1.c2 = t2.c2 delete where t1.c1 + t2.c1 > 1;
select * from t1;
C1	C2
truncate table t1;
truncate table t2;
insert into t1 values(1,1),(2,2),(3,3);
insert into t2 values(1,2),(2,4),(3,6),(4,8);
merge into t1 using t2 on (t1.c1 = t2.c1) when matched then update set t1.c2 = t2.c2 delete where t1.c2 > 5;
select * from t1;
C1	C2
1	2
2	4
truncate table t1;
truncate table t2;
insert into t1 values(1,1),(2,2),(3,3);
insert into t2 values(1,2),(2,4),(3,6),(4,8);
merge into t1 using t2 on (t1.c1 = t2.c1) when matched then update set t1.c2 = t2.c2 delete where t1.c2 = 4;
select * from t1;
C1	C2
1	2
3	6
create global temporary table a1(c1 int, c2 int) on commit preserve rows;
create global temporary table a2(c1 int, c2 int) on commit preserve rows;
insert into a1 values(1,1),(2,2),(3,3);
insert into a2 values(1,2),(2,4),(3,6),(4,8);
merge into a1 using a2 on (a1.c1 = a2.c1) when matched then update set a1.c2 = a2.c2;
select * from a1;
C1	C2
1	2
2	4
3	6
truncate table a1;
truncate table a2;
insert into a1 values(1,1),(2,2),(3,3);
insert into a2 values(1,2),(2,4),(3,6),(4,8);
merge into a1 using a2 on (2 * a1.c2 = a2.c2) when matched then update set a1.c1 =  2* a2.c2;
select * from a1;
C1	C2
4	1
8	2
12	3
drop table t1;
drop table t2;
create global temporary table t1(c1 int primary key, c2 int) on commit preserve rows;
create global temporary table t2(c1 int primary key, c2 int) on commit preserve rows;
insert into t1 values(1,1);
insert into t2 values(-1,-2),(1,2);
merge into t1 using t2 on (t1.c1 = t2.c1) when matched then update set t1.c1 = t2.c2;
ERROR HY000: Columns referenced in the ON Clause cannot be updated:'T1'.'C1'
merge into t1 using t2 on (t1.c1 = t2.c1) when matched then update set t2.c2 = t2.c2 delete where t1.c1 + t2.c2 = 2;
ERROR 42S22: invalid identifier 'T2.C2' in 'field list'
merge into t1 using t2 on (t1.c1 = abs(-t2.c1)) when matched then update set t1.c1 = t2.c2;
ERROR HY000: Columns referenced in the ON Clause cannot be updated:'T1'.'C1'
drop table t1;
drop table t2;
create global temporary table t1(c1 int primary key, c2 int) on commit preserve rows;
create table t2(c1 int primary key, c2 int) partition by hash(c1) partitions 5;
insert into t1 values(1, 1), (2, 2), (3, 3);
insert into t2 values(1, 2), (2, 4), (3, 6), (4, 8);
explain merge into t1 using t2 on (t1.c1 = t2.c1) when matched then update set t1.c2 = t2.c2;
Query Plan
=======================================================================
|ID|OPERATOR                           |NAME    |EST.ROWS|EST.TIME(us)|
-----------------------------------------------------------------------
|0 |MERGE                              |        |3       |24          |
|1 |└─PX COORDINATOR                   |        |3       |24          |
|2 |  └─EXCHANGE OUT DISTR             |:EX10001|3       |24          |
|3 |    └─HASH JOIN                    |        |3       |24          |
|4 |      ├─PX PARTITION ITERATOR      |        |4       |11          |
|5 |      │ └─TABLE FULL SCAN          |T2      |4       |11          |
|6 |      └─EXCHANGE IN DISTR          |        |3       |12          |
|7 |        └─EXCHANGE OUT DISTR (PKEY)|:EX10000|3       |9           |
|8 |          └─SUBPLAN SCAN           |VIEW1   |3       |3           |
|9 |            └─TABLE RANGE SCAN     |T1      |3       |3           |
=======================================================================
Outputs & filters:
-------------------------------------
  0 - output(nil), filter(nil)
      columns([{VIEW1: ({T1: (VIEW1.T1.SYS_SESSION_ID, VIEW1.T1.C1, VIEW1.T1.SYS_SESS_CREATE_TIME, VIEW1.T1.C2)})}]),
      update([VIEW1.T1.C2=column_conv(NUMBER,PS:(-1,0),NULL,T2.C2)]), 
      insert_conds(nil), update_conds(nil), delete_conds(nil)
  1 - output([VIEW1.T1.SYS_SESSION_ID], [VIEW1.T1.C1], [VIEW1.T1.SYS_SESS_CREATE_TIME], [VIEW1.T1.C2], [T2.C2]), filter(nil), rowset=16
  2 - output([VIEW1.T1.SYS_SESSION_ID], [VIEW1.T1.C1], [VIEW1.T1.SYS_SESS_CREATE_TIME], [VIEW1.T1.C2], [T2.C2]), filter(nil), rowset=16
      dop=1
  3 - output([VIEW1.T1.SYS_SESSION_ID], [VIEW1.T1.C1], [VIEW1.T1.SYS_SESS_CREATE_TIME], [VIEW1.T1.C2], [T2.C2]), filter(nil), rowset=16
      equal_conds([VIEW1.T1.C1 = T2.C1]), other_conds(nil)
  4 - output([T2.C1], [T2.C2]), filter(nil), rowset=16
      affinitize, force partition granule
  5 - output([T2.C1], [T2.C2]), filter(nil), rowset=16
      access([T2.C1], [T2.C2]), partitions(p[0-4])
      is_index_back=false, is_global_index=false, 
      range_key([T2.C1]), range(MIN ; MAX)always true
  6 - output([VIEW1.T1.SYS_SESSION_ID], [VIEW1.T1.C1], [VIEW1.T1.SYS_SESS_CREATE_TIME], [VIEW1.T1.C2]), filter(nil), rowset=16
  7 - output([VIEW1.T1.SYS_SESSION_ID], [VIEW1.T1.C1], [VIEW1.T1.SYS_SESS_CREATE_TIME], [VIEW1.T1.C2]), filter(nil), rowset=16
      (#keys=1, [VIEW1.T1.C1]), is_single, dop=1
  8 - output([VIEW1.T1.C1], [VIEW1.T1.SYS_SESSION_ID], [VIEW1.T1.SYS_SESS_CREATE_TIME], [VIEW1.T1.C2]), filter(nil), rowset=16
      access([VIEW1.T1.C1], [VIEW1.T1.SYS_SESSION_ID], [VIEW1.T1.SYS_SESS_CREATE_TIME], [VIEW1.T1.C2])
  9 - output([T1.C1], [T1.SYS_SESSION_ID], [T1.SYS_SESS_CREATE_TIME], [T1.C2]), filter(nil), rowset=16
      access([T1.SYS_SESSION_ID], [T1.C1], [T1.SYS_SESS_CREATE_TIME], [T1.C2]), partition
      is_index_back=false, is_global_index=false, 
      range_key([T1.SYS_SESSION_ID], [T1.C1]), range(sessionid,MIN ; sessionid,MAX), 
      range_cond([T1.SYS_SESSION_ID = temp_table_ssid(0)])
explain merge into t1 using t2 on (t1.c1 + 1 = t2.c1 + 1) when matched then update set t1.c2 = t2.c2;
Query Plan
=================================================================
|ID|OPERATOR                     |NAME    |EST.ROWS|EST.TIME(us)|
-----------------------------------------------------------------
|0 |MERGE                        |        |3       |23          |
|1 |└─HASH JOIN                  |        |3       |23          |
|2 |  ├─PX COORDINATOR           |        |4       |19          |
|3 |  │ └─EXCHANGE OUT DISTR     |:EX10000|4       |16          |
|4 |  │   └─PX PARTITION ITERATOR|        |4       |11          |
|5 |  │     └─TABLE FULL SCAN    |T2      |4       |11          |
|6 |  └─SUBPLAN SCAN             |VIEW1   |3       |3           |
|7 |    └─TABLE RANGE SCAN       |T1      |3       |3           |
=================================================================
Outputs & filters:
-------------------------------------
  0 - output(nil), filter(nil)
      columns([{VIEW1: ({T1: (VIEW1.T1.SYS_SESSION_ID, VIEW1.T1.C1, VIEW1.T1.SYS_SESS_CREATE_TIME, VIEW1.T1.C2)})}]),
      update([VIEW1.T1.C2=column_conv(NUMBER,PS:(-1,0),NULL,T2.C2)]), 
      insert_conds(nil), update_conds(nil), delete_conds(nil)
  1 - output([VIEW1.T1.SYS_SESSION_ID], [VIEW1.T1.C1], [VIEW1.T1.SYS_SESS_CREATE_TIME], [VIEW1.T1.C2], [T2.C2]), filter(nil), rowset=16
      equal_conds([VIEW1.T1.C1 + cast(1, NUMBER(-1, -85)) = T2.C1 + cast(1, NUMBER(-1, -85))]), other_conds(nil)
  2 - output([T2.C1], [T2.C2]), filter(nil), rowset=16
  3 - output([T2.C1], [T2.C2]), filter(nil), rowset=16
      dop=1
  4 - output([T2.C1], [T2.C2]), filter(nil), rowset=16
      force partition granule
  5 - output([T2.C1], [T2.C2]), filter(nil), rowset=16
      access([T2.C1], [T2.C2]), partitions(p[0-4])
      is_index_back=false, is_global_index=false, 
      range_key([T2.C1]), range(MIN ; MAX)always true
  6 - output([VIEW1.T1.C1], [VIEW1.T1.SYS_SESSION_ID], [VIEW1.T1.SYS_SESS_CREATE_TIME], [VIEW1.T1.C2]), filter(nil), rowset=16
      access([VIEW1.T1.C1], [VIEW1.T1.SYS_SESSION_ID], [VIEW1.T1.SYS_SESS_CREATE_TIME], [VIEW1.T1.C2])
  7 - output([T1.C1], [T1.SYS_SESSION_ID], [T1.SYS_SESS_CREATE_TIME], [T1.C2]), filter(nil), rowset=16
      access([T1.SYS_SESSION_ID], [T1.C1], [T1.SYS_SESS_CREATE_TIME], [T1.C2]), partition
      is_index_back=false, is_global_index=false, 
      range_key([T1.SYS_SESSION_ID], [T1.C1]), range(sessionid,MIN ; sessionid,MAX), 
      range_cond([T1.SYS_SESSION_ID = temp_table_ssid(0)])
merge into t1 using t2 on (t1.c1 = t2.c1) when matched then update set t1.c2 = t2.c2;
select * from t1;
C1	C2
1	2
2	4
3	6
drop table t1;
drop table t2;
drop table t1;
drop table t4;
create global temporary table t1(a int, b int, c int) on commit preserve rows;
create global temporary table t4(a int, b int, c int) on commit preserve rows;
insert into t1 values(1,1,1);
insert into t1 values(2,2,2);
insert into t4 values(1,1,1);
insert into t4 values(2,2,2);
insert into t4 values(3,3,3);
insert into t4 values(4,4,4);
merge into t4 using (select * from t1)v on (t4.a = v.a) when matched then update set t4.c = v.c + 1 when not matched then insert (t4.a, t4.b, t4.c) values(v.a, v.b, v.c);
select * from t4;
A	B	C
1	1	2
2	2	3
3	3	3
4	4	4
merge into t4 using (select * from t1)v on (t4.a = v.a) when matched then update set t4.c = v.c + 1 when not matched then insert (t4.a, t4.b, t4.c) values(v.a, v.b, v.c);
select * from t4;
A	B	C
1	1	2
2	2	3
3	3	3
4	4	4
merge into t4 using (select * from t1)v on (t4.a = v.a) when matched then update set t4.c = v.c + 1 when not matched then insert (t4.a, t4.b, t4.c) values(v.a, v.b, v.c);
select * from t4;
A	B	C
1	1	2
2	2	3
3	3	3
4	4	4
merge into t4 using (select * from t1)v on (t4.a = v.a) when matched then update set t4.c = v.c + 1 when not matched then insert (t4.a, t4.b, t4.c) values(v.a, v.b, v.c);
select * from t4;
A	B	C
1	1	2
2	2	3
3	3	3
4	4	4
merge into t4 using (select * from t1)v on (t4.a = v.a) when matched then update set t4.c = v.c + 1 when not matched then insert (t4.a, t4.b, t4.c) values(v.a, v.b, v.c);
select * from t4;
A	B	C
1	1	2
2	2	3
3	3	3
4	4	4
drop table t1;
drop table t2;
create global temporary table t1 (c1 int, c2 int) on commit preserve rows;
create global temporary table t2 (c1 int, c2 int) on commit preserve rows;
insert into t1 with cte(a,b) as (select 1, 1 from dual union all select a + 1, a + 1 from cte where a <= 50) select * from cte;
merge into t2 using t1 on (t1.c1 = t2.c1) when matched then update set t2.c2 = t1.c2 when not matched then insert (t2.c1, t2.c2) values (t1.c1, t1.c2);
merge into t2 using t1 on (t1.c1 = t2.c1) when matched then update set t2.c2 = t1.c2 when not matched then insert (t2.c1, t2.c2) values (t1.c1, t1.c2);
select * from t2 order by t2.c1;
C1	C2
1	1
2	2
3	3
4	4
5	5
6	6
7	7
8	8
9	9
10	10
11	11
12	12
13	13
14	14
15	15
16	16
17	17
18	18
19	19
20	20
21	21
22	22
23	23
24	24
25	25
26	26
27	27
28	28
29	29
30	30
31	31
32	32
33	33
34	34
35	35
36	36
37	37
38	38
39	39
40	40
41	41
42	42
43	43
44	44
45	45
46	46
47	47
48	48
49	49
50	50
51	51
delete from t2;
merge into t2 using t1 on (t1.c1 = t2.c1) when not matched then insert (t2.c1, t2.c2) values (t1.c1, t1.c2) when matched then update set t2.c2 = t1.c2;
merge into t2 using t1 on (t1.c1 = t2.c1) when not matched then insert (t2.c1, t2.c2) values (t1.c1, t1.c2) when matched then update set t2.c2 = t1.c2;
select * from t2 order by t2.c1;
C1	C2
1	1
2	2
3	3
4	4
5	5
6	6
7	7
8	8
9	9
10	10
11	11
12	12
13	13
14	14
15	15
16	16
17	17
18	18
19	19
20	20
21	21
22	22
23	23
24	24
25	25
26	26
27	27
28	28
29	29
30	30
31	31
32	32
33	33
34	34
35	35
36	36
37	37
38	38
39	39
40	40
41	41
42	42
43	43
44	44
45	45
46	46
47	47
48	48
49	49
50	50
51	51
DROP TABLE t1;
DROP TABLE t2;
create global temporary table t1 (c1 int, c2 int) on commit preserve rows;
create global temporary table t2 (c1 int, c2 int) on commit preserve rows;
INSERT INTO t1 VALUES (1, 1);
INSERT INTO t1 VALUES (2, 2);
INSERT INTO t1 VALUES (3, 3);
INSERT INTO t2 VALUES (1, 2);
INSERT INTO t2 VALUES (2, 4);
INSERT INTO t2 VALUES (3, 6);
INSERT INTO t2 VALUES (4, 8);
merge INTO t1 USING t2 ON (t1.c1 > 1) WHEN matched THEN UPDATE SET t1.c2 = t2.c2;
ERROR HY000: unable to get a stable set of rows in the source tables
DROP TABLE T1;
DROP TABLE T2;
drop table tab1;
drop table tab;
