drop table t1;
drop table t2;
drop table stu;
drop table stu1;
result_format: 4
create global temporary table t1(c1 int primary key, c2 int) on commit preserve rows;
create global temporary table t2(c1 int primary key, c2 int) on commit preserve rows;
insert into t1 values(1, 2);
insert into t2 values(1, 4);
insert into t2 values(2, 5);

explain merge into t1 using t2 on (t2.c1 = t1.c1) when matched then update set t1.c2 = 10 delete where t1.c2 = 10 when not matched then insert values(1, 100);
Query Plan
=======================================================
|ID|OPERATOR              |NAME |EST.ROWS|EST.TIME(us)|
-------------------------------------------------------
|0 |MERGE                 |     |2       |5           |
|1 |└─MERGE OUTER JOIN    |     |2       |5           |
|2 |  ├─SUBPLAN SCAN      |VIEW1|2       |3           |
|3 |  │ └─TABLE RANGE SCAN|T2   |2       |3           |
|4 |  └─SUBPLAN SCAN      |VIEW2|1       |3           |
|5 |    └─TABLE RANGE SCAN|T1   |1       |3           |
=======================================================
Outputs & filters:
-------------------------------------
  0 - output(nil), filter(nil)
      columns([{VIEW2: ({T1: (VIEW2.T1.SYS_SESSION_ID, VIEW2.T1.C1, VIEW2.T1.SYS_SESS_CREATE_TIME, VIEW2.T1.C2)})}]), partition, 
      column_values([column_conv(BIGINT,PS:(-1,-1),NOT NULL,temp_table_ssid(0))], [column_conv(NUMBER,PS:(-1,0),NOT NULL,1)], [column_conv(BIGINT,PS:(-1,
      -1),NULL,0)], [column_conv(NUMBER,PS:(-1,0),NULL,100)]),
      update([VIEW2.T1.C2=column_conv(NUMBER,PS:(-1,0),NULL,10)]), 
      insert_conds(nil), update_conds(nil), delete_conds([column_conv(NUMBER,PS:(-1,0),NULL,10) = 10])
  1 - output([VIEW2.T1.SYS_SESSION_ID], [VIEW2.T1.C1], [VIEW2.T1.SYS_SESS_CREATE_TIME], [VIEW2.T1.C2]), filter(nil), rowset=16
      equal_conds([VIEW1.T2.C1 = VIEW2.T1.C1]), other_conds(nil)
      merge_directions([ASC])
  2 - output([VIEW1.T2.C1]), filter(nil), rowset=16
      access([VIEW1.T2.C1])
  3 - output([T2.C1]), filter(nil), rowset=16
      access([T2.C1]), partition
      is_index_back=false, is_global_index=false, 
      range_key([T2.SYS_SESSION_ID], [T2.C1]), range(sessionid,MIN ; sessionid,MAX), 
      range_cond([T2.SYS_SESSION_ID = temp_table_ssid(0)])
  4 - output([VIEW2.T1.C1], [VIEW2.T1.SYS_SESSION_ID], [VIEW2.T1.SYS_SESS_CREATE_TIME], [VIEW2.T1.C2]), filter(nil), rowset=16
      access([VIEW2.T1.C1], [VIEW2.T1.SYS_SESSION_ID], [VIEW2.T1.SYS_SESS_CREATE_TIME], [VIEW2.T1.C2])
  5 - output([T1.C1], [T1.SYS_SESSION_ID], [T1.SYS_SESS_CREATE_TIME], [T1.C2]), filter(nil), rowset=16
      access([T1.SYS_SESSION_ID], [T1.C1], [T1.SYS_SESS_CREATE_TIME], [T1.C2]), partition
      is_index_back=false, is_global_index=false, 
      range_key([T1.SYS_SESSION_ID], [T1.C1]), range(sessionid,MIN ; sessionid,MAX), 
      range_cond([T1.SYS_SESSION_ID = temp_table_ssid(0)])
merge into t1 using t2 on (t2.c1 = t1.c1) when matched then update set t1.c2 = 10 delete where t1.c2 = 10 when not matched then insert values(1, 100);
select * from t1;
+----+------+
| C1 | C2   |
+----+------+
|  1 |  100 |
+----+------+

select * from t1;
+----+------+
| C1 | C2   |
+----+------+
|  1 |  100 |
+----+------+

truncate table t1;
truncate table t2;
insert into t1 values(1, 2);
insert into t1 values(2, 3);
insert into t2 values(1, 2);
insert into t2 values(2, 5);
insert into t2 values(3, 3);

explain merge into t1 using t2 on (t1.c2 = t2.c2) when matched then update set t1.c1 = 10 delete where t1.c1 = 10 when not matched then insert values(2, 200);
Query Plan
=======================================================
|ID|OPERATOR              |NAME |EST.ROWS|EST.TIME(us)|
-------------------------------------------------------
|0 |MERGE                 |     |3       |6           |
|1 |└─HASH OUTER JOIN     |     |3       |6           |
|2 |  ├─SUBPLAN SCAN      |VIEW1|3       |3           |
|3 |  │ └─TABLE RANGE SCAN|T2   |3       |3           |
|4 |  └─SUBPLAN SCAN      |VIEW2|2       |3           |
|5 |    └─TABLE RANGE SCAN|T1   |2       |3           |
=======================================================
Outputs & filters:
-------------------------------------
  0 - output(nil), filter(nil)
      columns([{VIEW2: ({T1: (VIEW2.T1.SYS_SESSION_ID, VIEW2.T1.C1, VIEW2.T1.SYS_SESS_CREATE_TIME, VIEW2.T1.C2)})}]), partition, 
      column_values([column_conv(BIGINT,PS:(-1,-1),NOT NULL,temp_table_ssid(0))], [column_conv(NUMBER,PS:(-1,0),NOT NULL,2)], [column_conv(BIGINT,PS:(-1,
      -1),NULL,0)], [column_conv(NUMBER,PS:(-1,0),NULL,200)]),
      update([VIEW2.T1.C1=column_conv(NUMBER,PS:(-1,0),NOT NULL,10)]), 
      insert_conds(nil), update_conds(nil), delete_conds([column_conv(NUMBER,PS:(-1,0),NOT NULL,10) = 10])
  1 - output([VIEW2.T1.SYS_SESSION_ID], [VIEW2.T1.C1], [VIEW2.T1.SYS_SESS_CREATE_TIME], [VIEW2.T1.C2]), filter(nil), rowset=16
      equal_conds([VIEW2.T1.C2 = VIEW1.T2.C2]), other_conds(nil)
  2 - output([VIEW1.T2.C2]), filter(nil), rowset=16
      access([VIEW1.T2.C2])
  3 - output([T2.C2]), filter(nil), rowset=16
      access([T2.C2]), partition
      is_index_back=false, is_global_index=false, 
      range_key([T2.SYS_SESSION_ID], [T2.C1]), range(sessionid,MIN ; sessionid,MAX), 
      range_cond([T2.SYS_SESSION_ID = temp_table_ssid(0)])
  4 - output([VIEW2.T1.C2], [VIEW2.T1.SYS_SESSION_ID], [VIEW2.T1.C1], [VIEW2.T1.SYS_SESS_CREATE_TIME]), filter(nil), rowset=16
      access([VIEW2.T1.C2], [VIEW2.T1.SYS_SESSION_ID], [VIEW2.T1.C1], [VIEW2.T1.SYS_SESS_CREATE_TIME])
  5 - output([T1.C2], [T1.SYS_SESSION_ID], [T1.C1], [T1.SYS_SESS_CREATE_TIME]), filter(nil), rowset=16
      access([T1.SYS_SESSION_ID], [T1.C1], [T1.SYS_SESS_CREATE_TIME], [T1.C2]), partition
      is_index_back=false, is_global_index=false, 
      range_key([T1.SYS_SESSION_ID], [T1.C1]), range(sessionid,MIN ; sessionid,MAX), 
      range_cond([T1.SYS_SESSION_ID = temp_table_ssid(0)])
merge into t1 using t2 on (t1.c2 = t2.c2) when matched then update set t1.c1 = 10 delete where t1.c1 = 10 when not matched then insert values(2, 200);
select * from t1;
+----+------+
| C1 | C2   |
+----+------+
|  2 |  200 |
+----+------+

truncate table t1;
truncate table t2;
insert into t1 values(1, 2);
insert into t1 values(2, 3);
insert into t2 values(1, 2);
insert into t2 values(2, 5);

explain merge into t1 using t2 on (t1.c2 = t2.c2) when matched then update set t1.c1 = 3 when not matched then insert values(3, 200);
Query Plan
=======================================================
|ID|OPERATOR              |NAME |EST.ROWS|EST.TIME(us)|
-------------------------------------------------------
|0 |MERGE                 |     |2       |6           |
|1 |└─HASH OUTER JOIN     |     |2       |6           |
|2 |  ├─SUBPLAN SCAN      |VIEW1|2       |3           |
|3 |  │ └─TABLE RANGE SCAN|T2   |2       |3           |
|4 |  └─SUBPLAN SCAN      |VIEW2|2       |3           |
|5 |    └─TABLE RANGE SCAN|T1   |2       |3           |
=======================================================
Outputs & filters:
-------------------------------------
  0 - output(nil), filter(nil)
      columns([{VIEW2: ({T1: (VIEW2.T1.SYS_SESSION_ID, VIEW2.T1.C1, VIEW2.T1.SYS_SESS_CREATE_TIME, VIEW2.T1.C2)})}]), partition, 
      column_values([column_conv(BIGINT,PS:(-1,-1),NOT NULL,temp_table_ssid(0))], [column_conv(NUMBER,PS:(-1,0),NOT NULL,3)], [column_conv(BIGINT,PS:(-1,
      -1),NULL,0)], [column_conv(NUMBER,PS:(-1,0),NULL,200)]),
      update([VIEW2.T1.C1=column_conv(NUMBER,PS:(-1,0),NOT NULL,3)]), 
      insert_conds(nil), update_conds(nil), delete_conds(nil)
  1 - output([VIEW2.T1.SYS_SESSION_ID], [VIEW2.T1.C1], [VIEW2.T1.SYS_SESS_CREATE_TIME], [VIEW2.T1.C2]), filter(nil), rowset=16
      equal_conds([VIEW2.T1.C2 = VIEW1.T2.C2]), other_conds(nil)
  2 - output([VIEW1.T2.C2]), filter(nil), rowset=16
      access([VIEW1.T2.C2])
  3 - output([T2.C2]), filter(nil), rowset=16
      access([T2.C2]), partition
      is_index_back=false, is_global_index=false, 
      range_key([T2.SYS_SESSION_ID], [T2.C1]), range(sessionid,MIN ; sessionid,MAX), 
      range_cond([T2.SYS_SESSION_ID = temp_table_ssid(0)])
  4 - output([VIEW2.T1.C2], [VIEW2.T1.SYS_SESSION_ID], [VIEW2.T1.C1], [VIEW2.T1.SYS_SESS_CREATE_TIME]), filter(nil), rowset=16
      access([VIEW2.T1.C2], [VIEW2.T1.SYS_SESSION_ID], [VIEW2.T1.C1], [VIEW2.T1.SYS_SESS_CREATE_TIME])
  5 - output([T1.C2], [T1.SYS_SESSION_ID], [T1.C1], [T1.SYS_SESS_CREATE_TIME]), filter(nil), rowset=16
      access([T1.SYS_SESSION_ID], [T1.C1], [T1.SYS_SESS_CREATE_TIME], [T1.C2]), partition
      is_index_back=false, is_global_index=false, 
      range_key([T1.SYS_SESSION_ID], [T1.C1]), range(sessionid,MIN ; sessionid,MAX), 
      range_cond([T1.SYS_SESSION_ID = temp_table_ssid(0)])
merge into t1 using t2 on (t1.c2 = t2.c2) when matched then update set t1.c1 = 3 when not matched then insert values(3, 200);
ERROR 23000: unique constraint 'sessionid-3' for key '' violated
select * from t1;
+----+------+
| C1 | C2   |
+----+------+
|  1 |    2 |
|  2 |    3 |
+----+------+

truncate table t1;
truncate table t2;
insert into t1 values(1, 2);
insert into t1 values(2, 3);
insert into t2 values(1, 2);
insert into t2 values(2, 5);
insert into t2 values(3, 3);
explain merge into t1 using t2 on (t1.c2 = t2.c2) when matched then update set t1.c1 = t1.c1 + 10 when not matched then insert values(12, 200);
Query Plan
=======================================================
|ID|OPERATOR              |NAME |EST.ROWS|EST.TIME(us)|
-------------------------------------------------------
|0 |MERGE                 |     |3       |6           |
|1 |└─HASH OUTER JOIN     |     |3       |6           |
|2 |  ├─SUBPLAN SCAN      |VIEW1|3       |3           |
|3 |  │ └─TABLE RANGE SCAN|T2   |3       |3           |
|4 |  └─SUBPLAN SCAN      |VIEW2|2       |3           |
|5 |    └─TABLE RANGE SCAN|T1   |2       |3           |
=======================================================
Outputs & filters:
-------------------------------------
  0 - output(nil), filter(nil)
      columns([{VIEW2: ({T1: (VIEW2.T1.SYS_SESSION_ID, VIEW2.T1.C1, VIEW2.T1.SYS_SESS_CREATE_TIME, VIEW2.T1.C2)})}]), partition, 
      column_values([column_conv(BIGINT,PS:(-1,-1),NOT NULL,temp_table_ssid(0))], [column_conv(NUMBER,PS:(-1,0),NOT NULL,12)], [column_conv(BIGINT,PS:(-1,
      -1),NULL,0)], [column_conv(NUMBER,PS:(-1,0),NULL,200)]),
      update([VIEW2.T1.C1=column_conv(NUMBER,PS:(-1,0),NOT NULL,VIEW2.T1.C1 + 10)]), 
      insert_conds(nil), update_conds(nil), delete_conds(nil)
  1 - output([VIEW2.T1.SYS_SESSION_ID], [VIEW2.T1.C1], [VIEW2.T1.SYS_SESS_CREATE_TIME], [VIEW2.T1.C2]), filter(nil), rowset=16
      equal_conds([VIEW2.T1.C2 = VIEW1.T2.C2]), other_conds(nil)
  2 - output([VIEW1.T2.C2]), filter(nil), rowset=16
      access([VIEW1.T2.C2])
  3 - output([T2.C2]), filter(nil), rowset=16
      access([T2.C2]), partition
      is_index_back=false, is_global_index=false, 
      range_key([T2.SYS_SESSION_ID], [T2.C1]), range(sessionid,MIN ; sessionid,MAX), 
      range_cond([T2.SYS_SESSION_ID = temp_table_ssid(0)])
  4 - output([VIEW2.T1.C2], [VIEW2.T1.SYS_SESSION_ID], [VIEW2.T1.C1], [VIEW2.T1.SYS_SESS_CREATE_TIME]), filter(nil), rowset=16
      access([VIEW2.T1.C2], [VIEW2.T1.SYS_SESSION_ID], [VIEW2.T1.C1], [VIEW2.T1.SYS_SESS_CREATE_TIME])
  5 - output([T1.C2], [T1.SYS_SESSION_ID], [T1.C1], [T1.SYS_SESS_CREATE_TIME]), filter(nil), rowset=16
      access([T1.SYS_SESSION_ID], [T1.C1], [T1.SYS_SESS_CREATE_TIME], [T1.C2]), partition
      is_index_back=false, is_global_index=false, 
      range_key([T1.SYS_SESSION_ID], [T1.C1]), range(sessionid,MIN ; sessionid,MAX), 
      range_cond([T1.SYS_SESSION_ID = temp_table_ssid(0)])
merge into t1 using t2 on (t1.c2 = t2.c2) when matched then update set t1.c1 = t1.c1 + 10 when not matched then insert values(12, 200);
ERROR 23000: unique constraint 'sessionid-12' for key '' violated
select * from t1;
+----+------+
| C1 | C2   |
+----+------+
|  1 |    2 |
|  2 |    3 |
+----+------+

truncate table t1;
truncate table t2;
insert into t1 values(1, 2);
insert into t2 values(1, 2);
insert into t2 values(2, 2);

explain merge into t1 using t2 on (t1.c2 = t2.c2) when matched then update set t1.c1 = t1.c1 + t2.c1 delete where t1.c1 = 2;
Query Plan
=======================================================
|ID|OPERATOR              |NAME |EST.ROWS|EST.TIME(us)|
-------------------------------------------------------
|0 |MERGE                 |     |1       |6           |
|1 |└─HASH JOIN           |     |1       |6           |
|2 |  ├─SUBPLAN SCAN      |VIEW2|1       |3           |
|3 |  │ └─TABLE RANGE SCAN|T1   |1       |3           |
|4 |  └─SUBPLAN SCAN      |VIEW1|2       |3           |
|5 |    └─TABLE RANGE SCAN|T2   |2       |3           |
=======================================================
Outputs & filters:
-------------------------------------
  0 - output(nil), filter(nil)
      columns([{VIEW2: ({T1: (VIEW2.T1.SYS_SESSION_ID, VIEW2.T1.C1, VIEW2.T1.SYS_SESS_CREATE_TIME, VIEW2.T1.C2)})}]),
      update([VIEW2.T1.C1=column_conv(NUMBER,PS:(-1,0),NOT NULL,VIEW2.T1.C1 + VIEW1.T2.C1)]), 
      insert_conds(nil), update_conds(nil), delete_conds([column_conv(NUMBER,PS:(-1,0),NOT NULL,VIEW2.T1.C1 + VIEW1.T2.C1) = 2])
  1 - output([VIEW2.T1.SYS_SESSION_ID], [VIEW2.T1.C1], [VIEW2.T1.SYS_SESS_CREATE_TIME], [VIEW2.T1.C2], [VIEW1.T2.C1]), filter(nil), rowset=16
      equal_conds([VIEW2.T1.C2 = VIEW1.T2.C2]), other_conds(nil)
  2 - output([VIEW2.T1.C2], [VIEW2.T1.SYS_SESSION_ID], [VIEW2.T1.C1], [VIEW2.T1.SYS_SESS_CREATE_TIME]), filter(nil), rowset=16
      access([VIEW2.T1.C2], [VIEW2.T1.SYS_SESSION_ID], [VIEW2.T1.C1], [VIEW2.T1.SYS_SESS_CREATE_TIME])
  3 - output([T1.C2], [T1.SYS_SESSION_ID], [T1.C1], [T1.SYS_SESS_CREATE_TIME]), filter(nil), rowset=16
      access([T1.SYS_SESSION_ID], [T1.C1], [T1.SYS_SESS_CREATE_TIME], [T1.C2]), partition
      is_index_back=false, is_global_index=false, 
      range_key([T1.SYS_SESSION_ID], [T1.C1]), range(sessionid,MIN ; sessionid,MAX), 
      range_cond([T1.SYS_SESSION_ID = temp_table_ssid(0)])
  4 - output([VIEW1.T2.C2], [VIEW1.T2.C1]), filter(nil), rowset=16
      access([VIEW1.T2.C2], [VIEW1.T2.C1])
  5 - output([T2.C2], [T2.C1]), filter(nil), rowset=16
      access([T2.C1], [T2.C2]), partition
      is_index_back=false, is_global_index=false, 
      range_key([T2.SYS_SESSION_ID], [T2.C1]), range(sessionid,MIN ; sessionid,MAX), 
      range_cond([T2.SYS_SESSION_ID = temp_table_ssid(0)])
merge into t1 using t2 on (t1.c2 = t2.c2) when matched then update set t1.c1 = t1.c1 + t2.c1 delete where t1.c1 = 2;
ERROR HY000: unable to get a stable set of rows in the source tables
select * from t1;
+----+------+
| C1 | C2   |
+----+------+
|  1 |    2 |
+----+------+

truncate table t1;
truncate table t2;
insert into t1 values(1, 2);
insert into t2 values(1, 2);
insert into t2 values(2, 2);

explain merge into t1 using t2 on (t1.c2 = t2.c2) when matched then update set t1.c1 = t1.c1 + t2.c1 delete where t1.c1 = 3;
Query Plan
=======================================================
|ID|OPERATOR              |NAME |EST.ROWS|EST.TIME(us)|
-------------------------------------------------------
|0 |MERGE                 |     |1       |6           |
|1 |└─HASH JOIN           |     |1       |6           |
|2 |  ├─SUBPLAN SCAN      |VIEW2|1       |3           |
|3 |  │ └─TABLE RANGE SCAN|T1   |1       |3           |
|4 |  └─SUBPLAN SCAN      |VIEW1|2       |3           |
|5 |    └─TABLE RANGE SCAN|T2   |2       |3           |
=======================================================
Outputs & filters:
-------------------------------------
  0 - output(nil), filter(nil)
      columns([{VIEW2: ({T1: (VIEW2.T1.SYS_SESSION_ID, VIEW2.T1.C1, VIEW2.T1.SYS_SESS_CREATE_TIME, VIEW2.T1.C2)})}]),
      update([VIEW2.T1.C1=column_conv(NUMBER,PS:(-1,0),NOT NULL,VIEW2.T1.C1 + VIEW1.T2.C1)]), 
      insert_conds(nil), update_conds(nil), delete_conds([column_conv(NUMBER,PS:(-1,0),NOT NULL,VIEW2.T1.C1 + VIEW1.T2.C1) = 3])
  1 - output([VIEW2.T1.SYS_SESSION_ID], [VIEW2.T1.C1], [VIEW2.T1.SYS_SESS_CREATE_TIME], [VIEW2.T1.C2], [VIEW1.T2.C1]), filter(nil), rowset=16
      equal_conds([VIEW2.T1.C2 = VIEW1.T2.C2]), other_conds(nil)
  2 - output([VIEW2.T1.C2], [VIEW2.T1.SYS_SESSION_ID], [VIEW2.T1.C1], [VIEW2.T1.SYS_SESS_CREATE_TIME]), filter(nil), rowset=16
      access([VIEW2.T1.C2], [VIEW2.T1.SYS_SESSION_ID], [VIEW2.T1.C1], [VIEW2.T1.SYS_SESS_CREATE_TIME])
  3 - output([T1.C2], [T1.SYS_SESSION_ID], [T1.C1], [T1.SYS_SESS_CREATE_TIME]), filter(nil), rowset=16
      access([T1.SYS_SESSION_ID], [T1.C1], [T1.SYS_SESS_CREATE_TIME], [T1.C2]), partition
      is_index_back=false, is_global_index=false, 
      range_key([T1.SYS_SESSION_ID], [T1.C1]), range(sessionid,MIN ; sessionid,MAX), 
      range_cond([T1.SYS_SESSION_ID = temp_table_ssid(0)])
  4 - output([VIEW1.T2.C2], [VIEW1.T2.C1]), filter(nil), rowset=16
      access([VIEW1.T2.C2], [VIEW1.T2.C1])
  5 - output([T2.C2], [T2.C1]), filter(nil), rowset=16
      access([T2.C1], [T2.C2]), partition
      is_index_back=false, is_global_index=false, 
      range_key([T2.SYS_SESSION_ID], [T2.C1]), range(sessionid,MIN ; sessionid,MAX), 
      range_cond([T2.SYS_SESSION_ID = temp_table_ssid(0)])
merge into t1 using t2 on (t1.c2 = t2.c2) when matched then update set t1.c1 = t1.c1 + t2.c1 delete where t1.c1 = 3;
ERROR HY000: specified row no longer exists
select * from t1;
+----+------+
| C1 | C2   |
+----+------+
|  1 |    2 |
+----+------+

truncate table t1;
truncate table t2;
insert into t1 values(1, 2);
insert into t1 values(2, 3);
insert into t1 values(3, 4);
insert into t2 values(1, 2);
insert into t2 values(2, 11);
insert into t2 values(3, 3);
insert into t2 values(4, 12);
insert into t2 values(5, 4);

explain merge into t1 using t2 on (t1.c2 = t2.c2) when matched then update set t1.c1 = t1.c1 + 100 when not matched then insert values(t2.c1 + 1, 100);
Query Plan
=========================================================
|ID|OPERATOR                |NAME |EST.ROWS|EST.TIME(us)|
---------------------------------------------------------
|0 |MERGE                   |     |5       |7           |
|1 |└─HASH RIGHT OUTER JOIN |     |5       |7           |
|2 |  ├─SUBPLAN SCAN        |VIEW2|3       |3           |
|3 |  │ └─TABLE RANGE SCAN  |T1   |3       |3           |
|4 |  └─SUBPLAN SCAN        |VIEW1|5       |3           |
|5 |    └─TABLE RANGE SCAN  |T2   |5       |3           |
=========================================================
Outputs & filters:
-------------------------------------
  0 - output(nil), filter(nil)
      columns([{VIEW2: ({T1: (VIEW2.T1.SYS_SESSION_ID, VIEW2.T1.C1, VIEW2.T1.SYS_SESS_CREATE_TIME, VIEW2.T1.C2)})}]), partition, 
      column_values([column_conv(BIGINT,PS:(-1,-1),NOT NULL,temp_table_ssid(0))], [column_conv(NUMBER,PS:(-1,0),NOT NULL,VIEW1.T2.C1 + 1)], [column_conv(BIGINT,
      PS:(-1,-1),NULL,0)], [column_conv(NUMBER,PS:(-1,0),NULL,100)]),
      update([VIEW2.T1.C1=column_conv(NUMBER,PS:(-1,0),NOT NULL,VIEW2.T1.C1 + 100)]), 
      insert_conds(nil), update_conds(nil), delete_conds(nil)
  1 - output([VIEW2.T1.SYS_SESSION_ID], [VIEW2.T1.C1], [VIEW2.T1.SYS_SESS_CREATE_TIME], [VIEW2.T1.C2], [VIEW1.T2.C1]), filter(nil), rowset=16
      equal_conds([VIEW2.T1.C2 = VIEW1.T2.C2]), other_conds(nil)
  2 - output([VIEW2.T1.C2], [VIEW2.T1.SYS_SESSION_ID], [VIEW2.T1.C1], [VIEW2.T1.SYS_SESS_CREATE_TIME]), filter(nil), rowset=16
      access([VIEW2.T1.C2], [VIEW2.T1.SYS_SESSION_ID], [VIEW2.T1.C1], [VIEW2.T1.SYS_SESS_CREATE_TIME])
  3 - output([T1.C2], [T1.SYS_SESSION_ID], [T1.C1], [T1.SYS_SESS_CREATE_TIME]), filter(nil), rowset=16
      access([T1.SYS_SESSION_ID], [T1.C1], [T1.SYS_SESS_CREATE_TIME], [T1.C2]), partition
      is_index_back=false, is_global_index=false, 
      range_key([T1.SYS_SESSION_ID], [T1.C1]), range(sessionid,MIN ; sessionid,MAX), 
      range_cond([T1.SYS_SESSION_ID = temp_table_ssid(0)])
  4 - output([VIEW1.T2.C2], [VIEW1.T2.C1]), filter(nil), rowset=16
      access([VIEW1.T2.C2], [VIEW1.T2.C1])
  5 - output([T2.C2], [T2.C1]), filter(nil), rowset=16
      access([T2.C1], [T2.C2]), partition
      is_index_back=false, is_global_index=false, 
      range_key([T2.SYS_SESSION_ID], [T2.C1]), range(sessionid,MIN ; sessionid,MAX), 
      range_cond([T2.SYS_SESSION_ID = temp_table_ssid(0)])
merge into t1 using t2 on (t1.c2 = t2.c2) when matched then update set t1.c1 = t1.c1 + 100 when not matched then insert values(t2.c1 + 1, 100);
select * from t1;
+-----+------+
| C1  | C2   |
+-----+------+
|   3 |  100 |
|   5 |  100 |
| 101 |    2 |
| 102 |    3 |
| 103 |    4 |
+-----+------+

truncate table t1;
truncate table t2;
insert into t1 values(1, 2);
insert into t2 values(1, 3);
insert into t2 values(2, 2);
explain merge into t1 using t2 on (t1.c2 = t2.c2) when matched then update set t1.c1 = 100 when not matched then insert values(100, 100);
Query Plan
=======================================================
|ID|OPERATOR              |NAME |EST.ROWS|EST.TIME(us)|
-------------------------------------------------------
|0 |MERGE                 |     |2       |6           |
|1 |└─HASH OUTER JOIN     |     |2       |6           |
|2 |  ├─SUBPLAN SCAN      |VIEW1|2       |3           |
|3 |  │ └─TABLE RANGE SCAN|T2   |2       |3           |
|4 |  └─SUBPLAN SCAN      |VIEW2|1       |3           |
|5 |    └─TABLE RANGE SCAN|T1   |1       |3           |
=======================================================
Outputs & filters:
-------------------------------------
  0 - output(nil), filter(nil)
      columns([{VIEW2: ({T1: (VIEW2.T1.SYS_SESSION_ID, VIEW2.T1.C1, VIEW2.T1.SYS_SESS_CREATE_TIME, VIEW2.T1.C2)})}]), partition, 
      column_values([column_conv(BIGINT,PS:(-1,-1),NOT NULL,temp_table_ssid(0))], [column_conv(NUMBER,PS:(-1,0),NOT NULL,100)], [column_conv(BIGINT,PS:(-1,
      -1),NULL,0)], [column_conv(NUMBER,PS:(-1,0),NULL,100)]),
      update([VIEW2.T1.C1=column_conv(NUMBER,PS:(-1,0),NOT NULL,100)]), 
      insert_conds(nil), update_conds(nil), delete_conds(nil)
  1 - output([VIEW2.T1.SYS_SESSION_ID], [VIEW2.T1.C1], [VIEW2.T1.SYS_SESS_CREATE_TIME], [VIEW2.T1.C2]), filter(nil), rowset=16
      equal_conds([VIEW2.T1.C2 = VIEW1.T2.C2]), other_conds(nil)
  2 - output([VIEW1.T2.C2]), filter(nil), rowset=16
      access([VIEW1.T2.C2])
  3 - output([T2.C2]), filter(nil), rowset=16
      access([T2.C2]), partition
      is_index_back=false, is_global_index=false, 
      range_key([T2.SYS_SESSION_ID], [T2.C1]), range(sessionid,MIN ; sessionid,MAX), 
      range_cond([T2.SYS_SESSION_ID = temp_table_ssid(0)])
  4 - output([VIEW2.T1.C2], [VIEW2.T1.SYS_SESSION_ID], [VIEW2.T1.C1], [VIEW2.T1.SYS_SESS_CREATE_TIME]), filter(nil), rowset=16
      access([VIEW2.T1.C2], [VIEW2.T1.SYS_SESSION_ID], [VIEW2.T1.C1], [VIEW2.T1.SYS_SESS_CREATE_TIME])
  5 - output([T1.C2], [T1.SYS_SESSION_ID], [T1.C1], [T1.SYS_SESS_CREATE_TIME]), filter(nil), rowset=16
      access([T1.SYS_SESSION_ID], [T1.C1], [T1.SYS_SESS_CREATE_TIME], [T1.C2]), partition
      is_index_back=false, is_global_index=false, 
      range_key([T1.SYS_SESSION_ID], [T1.C1]), range(sessionid,MIN ; sessionid,MAX), 
      range_cond([T1.SYS_SESSION_ID = temp_table_ssid(0)])
merge into t1 using t2 on (t1.c2 = t2.c2) when matched then update set t1.c1 = 100 when not matched then insert values(100, 100);
ERROR 23000: unique constraint 'sessionid-100' for key '' violated
select * from t1;
+----+------+
| C1 | C2   |
+----+------+
|  1 |    2 |
+----+------+

truncate table t1;
truncate table t2;
insert into t1 values(1, 1);
insert into t1 values(2, 2);

insert into t2 values(1, 1);
insert into t2 values(2, 2);

merge into t1 using t2 on (t1.c2 = t2.c2) when matched then update set t1.c1 = t1.c1 + 1;

select * from t1;
+----+------+
| C1 | C2   |
+----+------+
|  2 |    1 |
|  3 |    2 |
+----+------+

create global temporary table stu(s1 number primary key, s2 nvarchar2(64) not null, s3 integer default trunc(66.6666666,5), constraint stu_ch check( s2>1)) on commit preserve rows;
create global temporary table stu1(s1 number primary key, s2 nvarchar2(128) not null, s3 integer default trunc(88.8888888,5), constraint stu1_ch check(s1>1 and s2>1 and s3>1)) on commit preserve rows;
insert into stu values(1.111111, 1.111111, 11);
insert into stu1 values(1.111111, 1.111111, 11);
merge into stu a using stu1 b on (a.s1=b.s1) when matched then update set a.s2=1;
ERROR HY000: check constraint violated
merge into stu a using stu1 b on (1=2) when not matched then insert values(3, 1, 4);
ERROR HY000: check constraint violated

merge into stu a using stu1 b on (a.s1=b.s1) when matched then update set a.s2=4;
merge into stu a using stu1 b on (1=2) when not matched then insert values(3, 3, 4);
