purge recyclebin;
DROP TABLE IF EXISTS t1;
DROP TABLE IF EXISTS t2;
#mysql_drop-2
#mysql_drop-2-1/mysql_drop-2-3
#CREATE DATA (DATA TYPE + INDEX + CONSTRAINT)
CREATE TABLE t1(c0 INT(4) ZEROFILL,
c1 FLOAT AUTO_INCREMENT PRIMARY KEY,
c2 DOUBLE NOT NULL,
c3 CHAR(10) DEFAULT 'A',
c4 VARCHAR(10) UNIQUE,
c5 CHAR(10),
c6 INT,
c7 TIME,
c8 YEAR ,CHECK(c8>=c0));
INSERT INTO t1 VALUES(1,1.0,1.1,'中文','','',0,'11:11:11','2000'),
(2,1.1,1.2,'中-文','A','a',1,'11:11:11','2001'),
(3,1.2,2.2,'中=文','B','a',1,'11:11:11','2002'),
(4,1.3,3.2,'中+文','C','a',1,'11:11:11','2003'),
(5,1.4,4.2,'中0文','D','a',1,'11:11:11','2004'),
(6,1.5,5.2,'中9文','E','a',1,'11:11:11','2005'),
(7,1.6,6.2,'中8文','F','a',1,'11:11:11','2006'),
(8,1.7,7.2,'中7文','G','a',1,'11:11:11','2007'),
(9,1.8,8.2,'中6文','H','a',1,'11:11:11','2011'),
(10,1.9,9.2,'中5文','I','a',1,'11:11:11','2012'),
(11,2.0,1.9,'中4文','J','a',1,'11:11:11','2011'),
(12,2.1,1.8,'中3文','K','a',1,'11:11:11','2012');
CREATE INDEX ind_1 ON t1(c5);
CREATE INDEX ind_2 ON t1(c6,c7);
#使用as关键字创建复制表
CREATE TABLE t2 AS SELECT * FROM t1;
SELECT * FROM t2 ORDER BY 1;
c0	c1	c2	c3	c4	c5	c6	c7	c8
0001	1	1.1	中文			0	11:11:11	2000
0002	1.1	1.2	中-文	A	a	1	11:11:11	2001
0003	1.2	2.2	中=文	B	a	1	11:11:11	2002
0004	1.3	3.2	中+文	C	a	1	11:11:11	2003
0005	1.4	4.2	中0文	D	a	1	11:11:11	2004
0006	1.5	5.2	中9文	E	a	1	11:11:11	2005
0007	1.6	6.2	中8文	F	a	1	11:11:11	2006
0008	1.7	7.2	中7文	G	a	1	11:11:11	2007
0009	1.8	8.2	中6文	H	a	1	11:11:11	2011
0010	1.9	9.2	中5文	I	a	1	11:11:11	2012
0011	2	1.9	中4文	J	a	1	11:11:11	2011
0012	2.1	1.8	中3文	K	a	1	11:11:11	2012
DESC t2;
Field	Type	Null	Key	Default	Extra
c0	int(4) unsigned	YES		NULL	
c1	float	NO		NULL	
c2	double	NO		NULL	
c3	char(10)	YES		A	
c4	varchar(10)	YES		NULL	
c5	char(10)	YES		NULL	
c6	int(11)	YES		NULL	
c7	time	YES		NULL	
c8	year(4)	YES		NULL	
ALTER TABLE t2 DROP COLUMN c0;
DESC t2;
Field	Type	Null	Key	Default	Extra
c1	float	NO		NULL	
c2	double	NO		NULL	
c3	char(10)	YES		A	
c4	varchar(10)	YES		NULL	
c5	char(10)	YES		NULL	
c6	int(11)	YES		NULL	
c7	time	YES		NULL	
c8	year(4)	YES		NULL	
INSERT INTO t2 VALUES(1,1.0,1.1,'中文','','',0,'11:11:11','2000');
INSERT INTO t2 VALUES(1.0,1.1,'中2文','L','b',2,'12:12:12','2020');
SELECT * FROM t2 ORDER BY 1,2,3;
c1	c2	c3	c4	c5	c6	c7	c8
1	1.1	中2文	L	b	2	12:12:12	2020
1	1.1	中文			0	11:11:11	2000
1.1	1.2	中-文	A	a	1	11:11:11	2001
1.2	2.2	中=文	B	a	1	11:11:11	2002
1.3	3.2	中+文	C	a	1	11:11:11	2003
1.4	4.2	中0文	D	a	1	11:11:11	2004
1.5	5.2	中9文	E	a	1	11:11:11	2005
1.6	6.2	中8文	F	a	1	11:11:11	2006
1.7	7.2	中7文	G	a	1	11:11:11	2007
1.8	8.2	中6文	H	a	1	11:11:11	2011
1.9	9.2	中5文	I	a	1	11:11:11	2012
2	1.9	中4文	J	a	1	11:11:11	2011
2.1	1.8	中3文	K	a	1	11:11:11	2012
ALTER TABLE t2 DROP COLUMN c1;
ALTER TABLE t2 DROP COLUMN c2;
ALTER TABLE t2 DROP COLUMN c3;
ALTER TABLE t2 DROP COLUMN c4;
ALTER TABLE t2 DROP COLUMN c5;
ALTER TABLE t2 DROP COLUMN c6;
ALTER TABLE t2 DROP COLUMN c8;
ALTER TABLE t2 DROP COLUMN c7;
DESC t2;
Field	Type	Null	Key	Default	Extra
c7	time	YES		NULL	
INSERT INTO t2 VALUES(13,1.0,1.1,'中文','','',0,'11:11:11','2000');
INSERT INTO t2 VALUES('00:20:21');
SELECT * FROM t2 ORDER BY 1;
c7
00:20:21
11:11:11
11:11:11
11:11:11
11:11:11
11:11:11
11:11:11
11:11:11
11:11:11
11:11:11
11:11:11
11:11:11
11:11:11
12:12:12
#设置为非严格模式
SET sql_mode='';
DROP TABLE IF EXISTS t2;
CREATE TABLE t2 AS SELECT * FROM t1;
DESC t2;
Field	Type	Null	Key	Default	Extra
c0	int(4) unsigned	YES		NULL	
c1	float	NO		NULL	
c2	double	NO		NULL	
c3	char(10)	YES		A	
c4	varchar(10)	YES		NULL	
c5	char(10)	YES		NULL	
c6	int(11)	YES		NULL	
c7	time	YES		NULL	
c8	year(4)	YES		NULL	
ALTER TABLE t2 DROP COLUMN c0;
ALTER TABLE t2 DROP COLUMN c1;
ALTER TABLE t2 DROP COLUMN c2;
ALTER TABLE t2 DROP COLUMN c3;
ALTER TABLE t2 DROP COLUMN c4;
ALTER TABLE t2 DROP COLUMN c5;
ALTER TABLE t2 DROP COLUMN c6;
ALTER TABLE t2 DROP COLUMN c8;
ALTER TABLE t2 DROP COLUMN c7;
DESC t2;
Field	Type	Null	Key	Default	Extra
c7	time	YES		NULL	
INSERT INTO t2 VALUES(13,1.0,1.1,'中文','','',0,'11:11:11','2000');
INSERT INTO t2 VALUES('00:20:21');
SELECT * FROM t2 ORDER BY 1;
c7
00:20:21
11:11:11
11:11:11
11:11:11
11:11:11
11:11:11
11:11:11
11:11:11
11:11:11
11:11:11
11:11:11
11:11:11
11:11:11
#使用like关键字创建复制表
DROP TABLE IF EXISTS t2;
CREATE TABLE t2 LIKE t1;
INSERT INTO t2 SELECT * FROM t1;
SELECT * FROM t2 ORDER BY c0;
c0	c1	c2	c3	c4	c5	c6	c7	c8
0001	1	1.1	中文			0	11:11:11	2000
0002	1.1	1.2	中-文	A	a	1	11:11:11	2001
0003	1.2	2.2	中=文	B	a	1	11:11:11	2002
0004	1.3	3.2	中+文	C	a	1	11:11:11	2003
0005	1.4	4.2	中0文	D	a	1	11:11:11	2004
0006	1.5	5.2	中9文	E	a	1	11:11:11	2005
0007	1.6	6.2	中8文	F	a	1	11:11:11	2006
0008	1.7	7.2	中7文	G	a	1	11:11:11	2007
0009	1.8	8.2	中6文	H	a	1	11:11:11	2011
0010	1.9	9.2	中5文	I	a	1	11:11:11	2012
0011	2	1.9	中4文	J	a	1	11:11:11	2011
0012	2.1	1.8	中3文	K	a	1	11:11:11	2012
DESC t2;
Field	Type	Null	Key	Default	Extra
c0	int(4) unsigned	YES		NULL	
c1	float	NO	PRI	NULL	auto_increment
c2	double	NO		NULL	
c3	char(10)	YES		A	
c4	varchar(10)	YES	UNI	NULL	
c5	char(10)	YES	MUL	NULL	
c6	int(11)	YES	MUL	NULL	
c7	time	YES		NULL	
c8	year(4)	YES		NULL	
ALTER TABLE t2 DROP COLUMN c0;
ALTER TABLE t2 DROP COLUMN c1;
ALTER TABLE t2 DROP COLUMN c2;
ALTER TABLE t2 DROP COLUMN c4;
ALTER TABLE t2 DROP COLUMN c5;
ALTER TABLE t2 DROP COLUMN c6;
ALTER TABLE t2 DROP COLUMN c8;
INSERT INTO t2 VALUES(13,1.0,1.1,'中文','','',0,'11:11:11','2000');
#设置为严格模式
SET sql_mode='STRICT_TRANS_TABLES,STRICT_ALL_TABLES';
DROP TABLE IF EXISTS t2;
CREATE TABLE t2 LIKE t1;
INSERT INTO t2 SELECT * FROM t1;
SELECT * FROM t2 ORDER BY c0;
c0	c1	c2	c3	c4	c5	c6	c7	c8
0001	1	1.1	中文			0	11:11:11	2000
0002	1.1	1.2	中-文	A	a	1	11:11:11	2001
0003	1.2	2.2	中=文	B	a	1	11:11:11	2002
0004	1.3	3.2	中+文	C	a	1	11:11:11	2003
0005	1.4	4.2	中0文	D	a	1	11:11:11	2004
0006	1.5	5.2	中9文	E	a	1	11:11:11	2005
0007	1.6	6.2	中8文	F	a	1	11:11:11	2006
0008	1.7	7.2	中7文	G	a	1	11:11:11	2007
0009	1.8	8.2	中6文	H	a	1	11:11:11	2011
0010	1.9	9.2	中5文	I	a	1	11:11:11	2012
0011	2	1.9	中4文	J	a	1	11:11:11	2011
0012	2.1	1.8	中3文	K	a	1	11:11:11	2012
ALTER TABLE t2 DROP COLUMN c0;
ALTER TABLE t2 DROP COLUMN c1;
ALTER TABLE t2 DROP COLUMN c2;
ALTER TABLE t2 DROP COLUMN c3;
ALTER TABLE t2 DROP COLUMN c4;
ALTER TABLE t2 DROP COLUMN c5;
ALTER TABLE t2 DROP COLUMN c6;
ALTER TABLE t2 DROP COLUMN c8;
DESC t2;
Field	Type	Null	Key	Default	Extra
c0	int(4) unsigned	YES		NULL	
c1	float	NO	PRI	NULL	auto_increment
c7	time	YES	MUL	NULL	
c8	year(4)	YES		NULL	
INSERT INTO t2 VALUES(13,1.0,1.1,'中文','','',0,'11:11:11','2000');
INSERT INTO t2 VALUES(13,2.2,'L','b','1','17:11:11','2007');
SELECT * FROM t2 ORDER BY 1;
c0	c1	c7	c8
0001	1	11:11:11	2000
0002	1.1	11:11:11	2001
0003	1.2	11:11:11	2002
0004	1.3	11:11:11	2003
0005	1.4	11:11:11	2004
0006	1.5	11:11:11	2005
0007	1.6	11:11:11	2006
0008	1.7	11:11:11	2007
0009	1.8	11:11:11	2011
0010	1.9	11:11:11	2012
0011	2	11:11:11	2011
0012	2.1	11:11:11	2012
#联合主键和外键
DROP TABLE IF EXISTS t1;
DROP TABLE IF EXISTS t2;
CREATE TABLE t2(c0 INT(4) ZEROFILL PRIMARY KEY);
INSERT INTO t2 VALUES(1),(2),(3),(4),(5),(6),(7),(8),(9),(10),(11),(12),(13);
CREATE TABLE t1(c0 INT(4) ZEROFILL,
c1 FLOAT ,
c2 DOUBLE NOT NULL,
c3 CHAR(10) DEFAULT 'A',
c4 VARCHAR(10) UNIQUE,
c5 CHAR(10),
c6 INT,
c7 TIME,
c8 YEAR ,CHECK(c8>=c6),
PRIMARY KEY(c1,c2),
CONSTRAINT fk_t1_t2_int FOREIGN KEY(c0) REFERENCES t2(c0));
INSERT INTO t1 VALUES(1,1.0,1.1,'中文','','',0,'11:11:11','2000'),
(2,1.1,1.2,'中!文','A','a',1,'11:11:11','2001'),
(3,1.2,2.2,'中!文','B','a',1,'11:11:11','2002'),
(4,1.3,3.2,'中!文','C','a',1,'11:11:11','2003'),
(5,1.4,4.2,'中!文','D','a',1,'11:11:11','2004'),
(6,1.5,5.2,'中!文','E','a',1,'11:11:11','2005'),
(7,1.6,6.2,'中!文','F','a',1,'11:11:11','2006'),
(8,1.7,7.2,'中!文','G','a',1,'11:11:11','2007'),
(9,1.8,8.2,'中!文','H','a',1,'11:11:11','2011'),
(10,1.9,9.2,'中!文','I','a',1,'11:11:11','2012'),
(11,2.0,1.9,'中!文','J','a',1,'11:11:11','2011'),
(12,2.1,1.8,'中!文','K','a',1,'11:11:11','2012');
COMMIT;
#使用like关键字创建复制表
DROP TABLE IF EXISTS t3;
CREATE TABLE t3 LIKE t1;
INSERT INTO t3 SELECT * FROM t1;
SELECT * FROM t3 ORDER BY c0;
c0	c1	c2	c3	c4	c5	c6	c7	c8
0001	1	1.1	中文			0	11:11:11	2000
0002	1.1	1.2	中!文	A	a	1	11:11:11	2001
0003	1.2	2.2	中!文	B	a	1	11:11:11	2002
0004	1.3	3.2	中!文	C	a	1	11:11:11	2003
0005	1.4	4.2	中!文	D	a	1	11:11:11	2004
0006	1.5	5.2	中!文	E	a	1	11:11:11	2005
0007	1.6	6.2	中!文	F	a	1	11:11:11	2006
0008	1.7	7.2	中!文	G	a	1	11:11:11	2007
0009	1.8	8.2	中!文	H	a	1	11:11:11	2011
0010	1.9	9.2	中!文	I	a	1	11:11:11	2012
0011	2	1.9	中!文	J	a	1	11:11:11	2011
0012	2.1	1.8	中!文	K	a	1	11:11:11	2012
DESC t3;
Field	Type	Null	Key	Default	Extra
c0	int(4) unsigned	YES		NULL	
c1	float	NO	PRI	NULL	
c2	double	NO	PRI	NULL	
c3	char(10)	YES		A	
c4	varchar(10)	YES	UNI	NULL	
c5	char(10)	YES		NULL	
c6	int(11)	YES		NULL	
c7	time	YES		NULL	
c8	year(4)	YES		NULL	
ALTER TABLE t3 DROP COLUMN c0;
ALTER TABLE t3 DROP COLUMN c1;
ALTER TABLE t3 DROP COLUMN c2;
DESC t3;
Field	Type	Null	Key	Default	Extra
c1	float	NO	PRI	NULL	
c2	double	NO	PRI	NULL	
c3	char(10)	YES		A	
c4	varchar(10)	YES	UNI	NULL	
c5	char(10)	YES		NULL	
c6	int(11)	YES		NULL	
c7	time	YES		NULL	
c8	year(4)	YES		NULL	
INSERT INTO t3 VALUES(13,2.2,1.7,'中文','L','a',0,'11:11:11','2000');
INSERT INTO t3 VALUES(2.2,1.7,'中文','L','a',0,'11:11:11','2000');
SELECT * FROM t3 ORDER BY 1;
c1	c2	c3	c4	c5	c6	c7	c8
1	1.1	中文			0	11:11:11	2000
1.1	1.2	中!文	A	a	1	11:11:11	2001
1.2	2.2	中!文	B	a	1	11:11:11	2002
1.3	3.2	中!文	C	a	1	11:11:11	2003
1.4	4.2	中!文	D	a	1	11:11:11	2004
1.5	5.2	中!文	E	a	1	11:11:11	2005
1.6	6.2	中!文	F	a	1	11:11:11	2006
1.7	7.2	中!文	G	a	1	11:11:11	2007
1.8	8.2	中!文	H	a	1	11:11:11	2011
1.9	9.2	中!文	I	a	1	11:11:11	2012
2	1.9	中!文	J	a	1	11:11:11	2011
2.1	1.8	中!文	K	a	1	11:11:11	2012
2.2	1.7	中文	L	a	0	11:11:11	2000
#设置为非严格模式
SET sql_mode='';
DROP TABLE IF EXISTS t3;
CREATE TABLE t3 LIKE t1;
INSERT INTO t3 SELECT * FROM t1;
SELECT * FROM t3 ORDER BY c0;
c0	c1	c2	c3	c4	c5	c6	c7	c8
0001	1	1.1	中文			0	11:11:11	2000
0002	1.1	1.2	中!文	A	a	1	11:11:11	2001
0003	1.2	2.2	中!文	B	a	1	11:11:11	2002
0004	1.3	3.2	中!文	C	a	1	11:11:11	2003
0005	1.4	4.2	中!文	D	a	1	11:11:11	2004
0006	1.5	5.2	中!文	E	a	1	11:11:11	2005
0007	1.6	6.2	中!文	F	a	1	11:11:11	2006
0008	1.7	7.2	中!文	G	a	1	11:11:11	2007
0009	1.8	8.2	中!文	H	a	1	11:11:11	2011
0010	1.9	9.2	中!文	I	a	1	11:11:11	2012
0011	2	1.9	中!文	J	a	1	11:11:11	2011
0012	2.1	1.8	中!文	K	a	1	11:11:11	2012
DESC t3;
Field	Type	Null	Key	Default	Extra
c0	int(4) unsigned	YES		NULL	
c1	float	NO	PRI	NULL	
c2	double	NO	PRI	NULL	
c3	char(10)	YES		A	
c4	varchar(10)	YES	UNI	NULL	
c5	char(10)	YES		NULL	
c6	int(11)	YES		NULL	
c7	time	YES		NULL	
c8	year(4)	YES		NULL	
ALTER TABLE t3 DROP COLUMN c0;
ALTER TABLE t3 DROP COLUMN c1;
ALTER TABLE t3 DROP COLUMN c2;
DESC t3;
Field	Type	Null	Key	Default	Extra
c1	float	NO	PRI	NULL	
c2	double	NO	PRI	NULL	
c3	char(10)	YES		A	
c4	varchar(10)	YES	UNI	NULL	
c5	char(10)	YES		NULL	
c6	int(11)	YES		NULL	
c7	time	YES		NULL	
c8	year(4)	YES		NULL	
INSERT INTO t3 VALUES(13,2.2,1.7,'中文','L','a',0,'11:11:11','2000');
INSERT INTO t3 VALUES(2.2,1.7,'中文','L','a',0,'11:11:11','2000');
SELECT * FROM t3 ORDER BY 1;
c1	c2	c3	c4	c5	c6	c7	c8
1	1.1	中文			0	11:11:11	2000
1.1	1.2	中!文	A	a	1	11:11:11	2001
1.2	2.2	中!文	B	a	1	11:11:11	2002
1.3	3.2	中!文	C	a	1	11:11:11	2003
1.4	4.2	中!文	D	a	1	11:11:11	2004
1.5	5.2	中!文	E	a	1	11:11:11	2005
1.6	6.2	中!文	F	a	1	11:11:11	2006
1.7	7.2	中!文	G	a	1	11:11:11	2007
1.8	8.2	中!文	H	a	1	11:11:11	2011
1.9	9.2	中!文	I	a	1	11:11:11	2012
2	1.9	中!文	J	a	1	11:11:11	2011
2.1	1.8	中!文	K	a	1	11:11:11	2012
2.2	1.7	中文	L	a	0	11:11:11	2000
#使用as关键字创建复制表
DROP TABLE IF EXISTS t3;
CREATE TABLE t3 AS SELECT * FROM t1;
SELECT * FROM t3 ORDER BY c0;
c0	c1	c2	c3	c4	c5	c6	c7	c8
0001	1	1.1	中文			0	11:11:11	2000
0002	1.1	1.2	中!文	A	a	1	11:11:11	2001
0003	1.2	2.2	中!文	B	a	1	11:11:11	2002
0004	1.3	3.2	中!文	C	a	1	11:11:11	2003
0005	1.4	4.2	中!文	D	a	1	11:11:11	2004
0006	1.5	5.2	中!文	E	a	1	11:11:11	2005
0007	1.6	6.2	中!文	F	a	1	11:11:11	2006
0008	1.7	7.2	中!文	G	a	1	11:11:11	2007
0009	1.8	8.2	中!文	H	a	1	11:11:11	2011
0010	1.9	9.2	中!文	I	a	1	11:11:11	2012
0011	2	1.9	中!文	J	a	1	11:11:11	2011
0012	2.1	1.8	中!文	K	a	1	11:11:11	2012
DESC t3;
Field	Type	Null	Key	Default	Extra
c0	int(4) unsigned	YES		NULL	
c1	float	NO		NULL	
c2	double	NO		NULL	
c3	char(10)	YES		A	
c4	varchar(10)	YES		NULL	
c5	char(10)	YES		NULL	
c6	int(11)	YES		NULL	
c7	time	YES		NULL	
c8	year(4)	YES		NULL	
ALTER TABLE t3 DROP COLUMN c0,DROP COLUMN c1,DROP COLUMN c2;
DESC t3;
Field	Type	Null	Key	Default	Extra
c3	char(10)	YES		A	
c4	varchar(10)	YES		NULL	
c5	char(10)	YES		NULL	
c6	int(11)	YES		NULL	
c7	time	YES		NULL	
c8	year(4)	YES		NULL	
INSERT INTO t3 VALUES(13,2.2,1.7,'中文','L','a',0,'11:11:11','2000');
INSERT INTO t3 VALUES('中文','L','a',0,'11:11:11','2000');
SELECT * FROM t3 ORDER BY 2;
c3	c4	c5	c6	c7	c8
中文			0	11:11:11	2000
中!文	A	a	1	11:11:11	2001
中!文	B	a	1	11:11:11	2002
中!文	C	a	1	11:11:11	2003
中!文	D	a	1	11:11:11	2004
中!文	E	a	1	11:11:11	2005
中!文	F	a	1	11:11:11	2006
中!文	G	a	1	11:11:11	2007
中!文	H	a	1	11:11:11	2011
中!文	I	a	1	11:11:11	2012
中!文	J	a	1	11:11:11	2011
中!文	K	a	1	11:11:11	2012
中文	L	a	0	11:11:11	2000
#生成列
#mysql_drop-2-4
DROP TABLE IF EXISTS t1;
DROP TABLE IF EXISTS t2;
DROP TABLE IF EXISTS t3;
CREATE TABLE t1(c0 INT(3),
c1 FLOAT,
c2 DOUBLE NOT NULL,
c3 CHAR(10) DEFAULT 'A',
c4 CHAR(10) GENERATED ALWAYS AS (UPPER(c3)) VIRTUAL COMMENT '字符串生成列',
c5 INT GENERATED ALWAYS AS (c0*2) STORED COMMENT '数值生成列',
c6 TIME);
INSERT INTO t1(c0,c1,c2,c3,c6) VALUES(1,1.0,1.1,'','11:11:11'),
(2,1.1,1.2,'a','11:11:11'),
(3,1.2,2.2,'b','11:11:11'),
(4,1.3,3.2,'c','11:11:11'),
(5,1.4,4.2,'d','11:11:11');
COMMIT;
#使用as关键字创建复制表
CREATE TABLE t3 AS SELECT * FROM t1;
SELECT * FROM t3 ORDER BY c0;
c0	c1	c2	c3	c4	c5	c6
1	1	1.1			2	11:11:11
2	1.1	1.2	a	A	4	11:11:11
3	1.2	2.2	b	B	6	11:11:11
4	1.3	3.2	c	C	8	11:11:11
5	1.4	4.2	d	D	10	11:11:11
DESC t3;
Field	Type	Null	Key	Default	Extra
c0	int(3)	YES		NULL	
c1	float	YES		NULL	
c2	double	NO		NULL	
c3	char(10)	YES		A	
c4	char(10)	YES		NULL	
c5	int(11)	YES		NULL	
c6	time	YES		NULL	
ALTER TABLE t3 DROP COLUMN c0,DROP COLUMN c3,DROP COLUMN c4,DROP COLUMN c5;
DESC t3;
Field	Type	Null	Key	Default	Extra
c1	float	YES		NULL	
c2	double	NO		NULL	
c6	time	YES		NULL	
INSERT INTO t3(c0,c1,c2,c3,c6) VALUES(6,1.7,8.2,'e','11:11:11');
INSERT INTO t3(c1,c2,c6) VALUES(1.7,8.2,'11:11:11');
SELECT * FROM t3 ORDER BY 1;
c1	c2	c6
1	1.1	11:11:11
1.1	1.2	11:11:11
1.2	2.2	11:11:11
1.3	3.2	11:11:11
1.4	4.2	11:11:11
1.7	8.2	11:11:11
#使用like关键字创建复制表
DROP TABLE IF EXISTS t3;
CREATE TABLE t3 LIKE t1;
INSERT INTO t3(c0,c1,c2,c3,c6) VALUES(1,1.0,1.1,'','11:11:11'),
(2,1.1,1.2,'a','11:11:11'),
(3,1.2,2.2,'b','11:11:11'),
(4,1.3,3.2,'c','11:11:11'),
(5,1.4,4.2,'d','11:11:11');
SELECT * FROM t3 ORDER BY c0;
c0	c1	c2	c3	c4	c5	c6
1	1	1.1			2	11:11:11
2	1.1	1.2	a	A	4	11:11:11
3	1.2	2.2	b	B	6	11:11:11
4	1.3	3.2	c	C	8	11:11:11
5	1.4	4.2	d	D	10	11:11:11
DESC t3;
Field	Type	Null	Key	Default	Extra
c0	int(3)	YES		NULL	
c1	float	YES		NULL	
c2	double	NO		NULL	
c3	char(10)	YES		A	
c4	char(10)	YES		UPPER(`c3`)	VIRTUAL GENERATED
c5	int(11)	YES		(`c0` * 2)	STORED GENERATED
c6	time	YES		NULL	
ALTER TABLE t3 DROP COLUMN c0;
ALTER TABLE t3 DROP COLUMN c3,DROP COLUMN c4,DROP COLUMN c5;
ALTER TABLE t3 DROP COLUMN c4,DROP COLUMN c5;
DESC t3;
Field	Type	Null	Key	Default	Extra
c0	int(3)	YES		NULL	
c1	float	YES		NULL	
c2	double	NO		NULL	
c3	char(10)	YES		A	
c6	time	YES		NULL	
INSERT INTO t3(c0,c1,c2,c3,c6) VALUES(6,1.5,5.1,'e','11:11:11');
SELECT * FROM t3 ORDER BY 1;
c0	c1	c2	c3	c6
1	1	1.1		11:11:11
2	1.1	1.2	a	11:11:11
3	1.2	2.2	b	11:11:11
4	1.3	3.2	c	11:11:11
5	1.4	4.2	d	11:11:11
6	1.5	5.1	e	11:11:11
#设置为严格模式
SET sql_mode='STRICT_TRANS_TABLES,STRICT_ALL_TABLES';
#使用as关键字创建复制表
DROP TABLE IF EXISTS t3;
CREATE TABLE t3 AS SELECT * FROM t1;
SELECT * FROM t3 ORDER BY c0;
c0	c1	c2	c3	c4	c5	c6
1	1	1.1			2	11:11:11
2	1.1	1.2	a	A	4	11:11:11
3	1.2	2.2	b	B	6	11:11:11
4	1.3	3.2	c	C	8	11:11:11
5	1.4	4.2	d	D	10	11:11:11
DESC t3;
Field	Type	Null	Key	Default	Extra
c0	int(3)	YES		NULL	
c1	float	YES		NULL	
c2	double	NO		NULL	
c3	char(10)	YES		A	
c4	char(10)	YES		NULL	
c5	int(11)	YES		NULL	
c6	time	YES		NULL	
ALTER TABLE t3 DROP COLUMN c0,DROP COLUMN c3,DROP COLUMN c4,DROP COLUMN c5;
DESC t3;
Field	Type	Null	Key	Default	Extra
c1	float	YES		NULL	
c2	double	NO		NULL	
c6	time	YES		NULL	
INSERT INTO t3(c0,c1,c2,c3,c6) VALUES(6,1.7,8.2,'e','11:11:11');
INSERT INTO t3(c1,c2,c6) VALUES(1.7,8.2,'11:11:11');
SELECT * FROM t3 ORDER BY c1;
c1	c2	c6
1	1.1	11:11:11
1.1	1.2	11:11:11
1.2	2.2	11:11:11
1.3	3.2	11:11:11
1.4	4.2	11:11:11
1.7	8.2	11:11:11
#使用like关键字创建复制表
DROP TABLE IF EXISTS t3;
CREATE TABLE t3 LIKE t1;
INSERT INTO t3(c0,c1,c2,c3,c6) VALUES(1,1.0,1.1,'','11:11:11'),
(2,1.1,1.2,'a','11:11:11'),
(3,1.2,2.2,'b','11:11:11'),
(4,1.3,3.2,'c','11:11:11'),
(5,1.4,4.2,'d','11:11:11');
SELECT * FROM t3 ORDER BY c0;
c0	c1	c2	c3	c4	c5	c6
1	1	1.1			2	11:11:11
2	1.1	1.2	a	A	4	11:11:11
3	1.2	2.2	b	B	6	11:11:11
4	1.3	3.2	c	C	8	11:11:11
5	1.4	4.2	d	D	10	11:11:11
DESC t3;
Field	Type	Null	Key	Default	Extra
c0	int(3)	YES		NULL	
c1	float	YES		NULL	
c2	double	NO		NULL	
c3	char(10)	YES		A	
c4	char(10)	YES		UPPER(`c3`)	VIRTUAL GENERATED
c5	int(11)	YES		(`c0` * 2)	STORED GENERATED
c6	time	YES		NULL	
ALTER TABLE t3 DROP COLUMN c0;
ALTER TABLE t3 DROP COLUMN c3,DROP COLUMN c4,DROP COLUMN c5;
ALTER TABLE t3 DROP COLUMN c4,DROP COLUMN c5;
DESC t3;
Field	Type	Null	Key	Default	Extra
c0	int(3)	YES		NULL	
c1	float	YES		NULL	
c2	double	NO		NULL	
c3	char(10)	YES		A	
c6	time	YES		NULL	
INSERT INTO t3(c0,c1,c2,c3,c6) VALUES(6,1.5,5.1,'e','11:11:11');
SELECT * FROM t3 ORDER BY 1;
c0	c1	c2	c3	c6
1	1	1.1		11:11:11
2	1.1	1.2	a	11:11:11
3	1.2	2.2	b	11:11:11
4	1.3	3.2	c	11:11:11
5	1.4	4.2	d	11:11:11
6	1.5	5.1	e	11:11:11
#创建复制表并删除所有列
DROP TABLE IF EXISTS t1;
CREATE TABLE t1(c0 INT(4) ZEROFILL,
c1 FLOAT AUTO_INCREMENT PRIMARY KEY,
c2 DOUBLE NOT NULL,
c3 CHAR(10) DEFAULT 'A',
c4 VARCHAR(10) UNIQUE,
c5 CHAR(10),
c6 INT,
c7 TIME,
c8 YEAR ,CHECK(c8>=c0));
INSERT INTO t1 VALUES(1,1.0,1.1,'中文','','',0,'11:11:11','2000'),
(2,1.1,1.2,'中-文','A','a',1,'11:11:11','2001'),
(3,1.2,2.2,'中=文','B','a',1,'11:11:11','2002'),
(4,1.3,3.2,'中+文','C','a',1,'11:11:11','2003'),
(5,1.4,4.2,'中0文','D','a',1,'11:11:11','2004'),
(6,1.5,5.2,'中9文','E','a',1,'11:11:11','2005'),
(7,1.6,6.2,'中8文','F','a',1,'11:11:11','2006'),
(8,1.7,7.2,'中7文','G','a',1,'11:11:11','2007'),
(9,1.8,8.2,'中6文','H','a',1,'11:11:11','2011'),
(10,1.9,9.2,'中5文','I','a',1,'11:11:11','2012'),
(11,2.0,1.9,'中4文','J','a',1,'11:11:11','2011'),
(12,2.1,1.8,'中3文','K','a',1,'11:11:11','2012');
CREATE INDEX ind_1 ON t1(c5);
CREATE INDEX ind_2 ON t1(c6,c7);
DROP TABLE IF EXISTS t3;
CREATE TABLE t3 AS SELECT * FROM t1;
SELECT * FROM t3 ORDER BY 1;
c0	c1	c2	c3	c4	c5	c6	c7	c8
0001	1	1.1	中文			0	11:11:11	2000
0002	1.1	1.2	中-文	A	a	1	11:11:11	2001
0003	1.2	2.2	中=文	B	a	1	11:11:11	2002
0004	1.3	3.2	中+文	C	a	1	11:11:11	2003
0005	1.4	4.2	中0文	D	a	1	11:11:11	2004
0006	1.5	5.2	中9文	E	a	1	11:11:11	2005
0007	1.6	6.2	中8文	F	a	1	11:11:11	2006
0008	1.7	7.2	中7文	G	a	1	11:11:11	2007
0009	1.8	8.2	中6文	H	a	1	11:11:11	2011
0010	1.9	9.2	中5文	I	a	1	11:11:11	2012
0011	2	1.9	中4文	J	a	1	11:11:11	2011
0012	2.1	1.8	中3文	K	a	1	11:11:11	2012
DESC t3;
Field	Type	Null	Key	Default	Extra
c0	int(4) unsigned	YES		NULL	
c1	float	NO		NULL	
c2	double	NO		NULL	
c3	char(10)	YES		A	
c4	varchar(10)	YES		NULL	
c5	char(10)	YES		NULL	
c6	int(11)	YES		NULL	
c7	time	YES		NULL	
c8	year(4)	YES		NULL	
ALTER TABLE t3 DROP COLUMN c0,DROP COLUMN c1,DROP COLUMN c2,DROP COLUMN c3,DROP COLUMN c4,DROP COLUMN c5,DROP COLUMN c6,DROP COLUMN c7,DROP COLUMN c8;
ALTER TABLE t3 DROP COLUMN c1,DROP COLUMN c2,DROP COLUMN c3,DROP COLUMN c4,DROP COLUMN c5,DROP COLUMN c6,DROP COLUMN c7,DROP COLUMN c8;
DESC t3;
Field	Type	Null	Key	Default	Extra
c0	int(4) unsigned	YES		NULL	
ALTER TABLE t3 DROP COLUMN c0;
INSERT INTO t3 VALUES(1,1.0,1.1,'中文','','',0,'11:11:11','2000');
INSERT INTO t3 VALUES(13);
SELECT * FROM t3 ORDER BY 1;
c0
0001
0002
0003
0004
0005
0006
0007
0008
0009
0010
0011
0012
0013
DROP TABLE IF EXISTS t3;
CREATE TABLE t3 LIKE t1;
INSERT INTO t3 SELECT * FROM t1;
SELECT * FROM t3 ORDER BY 1;
c0	c1	c2	c3	c4	c5	c6	c7	c8
0001	1	1.1	中文			0	11:11:11	2000
0002	1.1	1.2	中-文	A	a	1	11:11:11	2001
0003	1.2	2.2	中=文	B	a	1	11:11:11	2002
0004	1.3	3.2	中+文	C	a	1	11:11:11	2003
0005	1.4	4.2	中0文	D	a	1	11:11:11	2004
0006	1.5	5.2	中9文	E	a	1	11:11:11	2005
0007	1.6	6.2	中8文	F	a	1	11:11:11	2006
0008	1.7	7.2	中7文	G	a	1	11:11:11	2007
0009	1.8	8.2	中6文	H	a	1	11:11:11	2011
0010	1.9	9.2	中5文	I	a	1	11:11:11	2012
0011	2	1.9	中4文	J	a	1	11:11:11	2011
0012	2.1	1.8	中3文	K	a	1	11:11:11	2012
DESC t3;
Field	Type	Null	Key	Default	Extra
c0	int(4) unsigned	YES		NULL	
c1	float	NO	PRI	NULL	auto_increment
c2	double	NO		NULL	
c3	char(10)	YES		A	
c4	varchar(10)	YES	UNI	NULL	
c5	char(10)	YES	MUL	NULL	
c6	int(11)	YES	MUL	NULL	
c7	time	YES		NULL	
c8	year(4)	YES		NULL	
ALTER TABLE t3 DROP COLUMN c0,DROP COLUMN c1,DROP COLUMN c2,DROP COLUMN c3,DROP COLUMN c4,DROP COLUMN c5,DROP COLUMN c6,DROP COLUMN c7,DROP COLUMN c8;
DESC t3;
Field	Type	Null	Key	Default	Extra
c0	int(4) unsigned	YES		NULL	
c1	float	NO	PRI	NULL	auto_increment
c2	double	NO		NULL	
c3	char(10)	YES		A	
c4	varchar(10)	YES	UNI	NULL	
c5	char(10)	YES	MUL	NULL	
c6	int(11)	YES	MUL	NULL	
c7	time	YES		NULL	
c8	year(4)	YES		NULL	
INSERT INTO t3 VALUES(12,2.1,1.8,'中3文','K','a',1,'11:11:11','2012');
INSERT INTO t3 VALUES(13,2.2,1.7,'中4文','L','b',3,'11:11:11','2013');
SELECT * FROM t3 ORDER BY 1;
c0	c1	c2	c3	c4	c5	c6	c7	c8
0001	1	1.1	中文			0	11:11:11	2000
0002	1.1	1.2	中-文	A	a	1	11:11:11	2001
0003	1.2	2.2	中=文	B	a	1	11:11:11	2002
0004	1.3	3.2	中+文	C	a	1	11:11:11	2003
0005	1.4	4.2	中0文	D	a	1	11:11:11	2004
0006	1.5	5.2	中9文	E	a	1	11:11:11	2005
0007	1.6	6.2	中8文	F	a	1	11:11:11	2006
0008	1.7	7.2	中7文	G	a	1	11:11:11	2007
0009	1.8	8.2	中6文	H	a	1	11:11:11	2011
0010	1.9	9.2	中5文	I	a	1	11:11:11	2012
0011	2	1.9	中4文	J	a	1	11:11:11	2011
0012	2.1	1.8	中3文	K	a	1	11:11:11	2012
0013	2.2	1.7	中4文	L	b	3	11:11:11	2013
#删除列并修改新增列
#CREATE DATA (DATA TYPE + INDEX + CONSTRAINT)
DROP TABLE IF EXISTS t1;
CREATE TABLE t1(c0 INT(5) ZEROFILL,
c1 FLOAT NOT NULL,
c2 DOUBLE AUTO_INCREMENT PRIMARY KEY,
c3 BIT(20) DEFAULT 0,
c4 BLOB,
c5 TEXT,
c6 VARCHAR(50) UNIQUE,
c7 CHAR(50),
c8 BINARY(50) NOT NULL,
c9 VARBINARY(50) NOT NULL,
c10 ENUM('a','b','c','d','e','f','g','h'),
c11 SET('i','j','k','l','m','n','o','p'),
c12 TIME NOT NULL,
c13 DATE NOT NULL,
c14 DATETIME NOT NULL,
c15 TIMESTAMP NOT NULL,
c16 YEAR ,CHECK(c16>=2000));
INSERT INTO t1 VALUES(1,1.5,1,'',x'89504E470D0A1A0A0000000D4948445206105000000097048597300000EC300000EC301C76FA8640000001','89504E470D0A1A0A00C76FA8640000001E49444154384F6350DAE843','','','teshu*符号@$￥%','SHUZI!1234567','a','i','20:12:12','2000-12-12','2000-01-01 01:01:01','2001-01-01 12:01:01.34567','2000'),
(2,2.5,2,b'110101',x'89504E470D0A1A0A0000000D4997300000EC300000EC301C76FA8640000001E49444154384','89504E470D0A1A0A00C76FA8640000001E49444154384F6350DAE843','中文—汉化','english_language','teshu*符号@$￥%','SHUZI!1234567','b','i','21:12:12','2001-12-22','2001-01-01 13:01:01','2001-11-01 11:01:01.34567','2010'),
(3,3.5,3,b'011101',x'89504E470D0A1A0A00C76FA8640000001E49444154384F6350DAE843126220493550F1A8066242','89504E470D0A1A0A00C76FA8640000001E49444154384F6350DAE843','删除时使用情景','english_language','teshu*符号@$￥%','SHUZI!1234567','c','i','22:12:12','2002-12-02','2002-01-01 14:01:01','2002-12-01 02:01:01.34567','2000'),
(4,4.5,4,b'010111',x'89504E470D0A1A0A00C76FA8640000001E49444154384F6350DAE843126220493550F1A8066242','89504E470D0A1A0A00C76FA8640000001E49444154384F6350DAE843','删除中——汉化','english_language','teshu*符号@$￥%','SHUZI!1234567','d','j','23:12:12','2003-12-11','2003-01-01 15:01:01','2002-11-01 03:01:01.34567','2010'),
(5,5.5,5,b'111101',x'89504E470D0A1A0A00C76FA8640000001E49444154384F6350DAE843126220493550','89504E470D0A1A0A00C76FA8640000001E49444154384F6350DAE843','删除中文*汉化删除','english_language','teshu*符号@$￥%','SHUZI!1234567','e','k','20:22:12','2004-12-12','2004-01-01 16:01:01','2002-02-04 05:01:01.34567','2000'),
(6,6.5,6,b'110111',x'89504E470D0A1A0A00C76FA8640000001E49444154384F6350DAE843126220493550','89504E470D0A1A0A00C76FA8640000001E49444154384F6350DAE843','除列时使用情景','english_language','teshu*符号@$￥%','SHUZI!1234567','f','k','20:32:12','2021-12-13','2010-01-01 21:01:01','2003-03-01 04:01:01.34567','2010');
INSERT INTO t1 VALUES(7,7.5,7,b'01101',x'89504E470D0A1A0A00C76FA8640000001E49444154384F6350DAE843126220493550','89504E470D0A1A0A00C76FA8640000001E49444154384F6350DAE843','删列时使用情景','english_language','teshu*符号@$￥%','SHUZI!1234567','g','l','20:42:12','2020-12-14','2011-01-01 22:01:01','2004-04-01 05:01:01.34567','2000'),
(8,8.5,8,b'01001',x'89504E470D0A1A0A00C76FA8640000001E49444154384F6350DAE843126220493550','89504E470D0A1A0A00C76FA8640000001E49444154384F6350DAE843','删除列使用情景','english_language','teshu*符号@$￥%','SHUZI!1234567','h','l','20:52:12','2015-12-15','2012-01-01 23:01:01','2005-05-01 06:01:01.34567','2020'),
(9,9.5,9,b'10101',x'89504E470D0A1A0A00C76FA8640000001E49444154384F6350DAE843126220493550','89504E470D0A1A0A00C76FA8640000001E49444154384F6350DAE843','删中文——汉化删除','english_language','teshu*符号@$￥%','SHUZI!1234567','a','l','20:12:42','2014-12-16','2013-01-01 20:01:01','2006-06-01 07:01:01.34567','2000'),
(10,10.5,10,b'0010101',x'89504E470D0A1A0A00C76FA8640000001E49444154384F6350DAE843','89504E470D0A1A0A00C76FA8640000001E49444154384F6350DAE843126220493550','删除列时用情景','english_language','teshu*符号@$￥%','SHUZI!1234567','a','m','21:12:52','2013-12-17','2014-01-01 01:11:01','2007-07-01 08:01:01.34567','2020'),
(11,1.15,11,b'0100101',x'89504E470D0A1A0A00C76FA8640000001E49444154384F6350DAE843','89504E470D0A1A0A00C76FA8640000001E49444154384F6350DAE843126220493550','中文——汉化删除','english_language','teshu*符号@$￥%','SHUZI!1234567','b','n','21:12:32','2012-12-18','2011-01-01 01:21:01','2008-08-01 01:01:01.34567','2010'),
(12,1.25,12,b'0101001',x'89504E470D0A1A0A00C76FA8640000001E49444154384F6350DAE843','89504E470D0A1A0A00C76FA8640000001E49444154384F6350DAE843126220493550','删除中文——汉化','english_language','teshu*符号@$￥%','SHUZI!1234567','b','n','22:12:22','2011-12-19','2010-01-01 01:31:01','2009-09-01 01:01:01.34567','2020'),
(13,1.35,13,b'0101010',x'89504E470D0A1A0A00C76FA8640000001E49444154384F6350DAE843','89504E470D0A1A0A00C76FA8640000001E49444154384F6350DAE843126220493550F1','删除列时使情景','english_language','teshu*符号@$￥%','SHUZI!1234567','c','m','22:12:12','2017-12-10','2018-01-01 01:41:01','2010-10-01 01:01:01.34567','2000');
INSERT INTO t1 VALUES(14,1.45,14,b'0101011',x'89504E470D0A1A0A00C76FA8640000001E49444154384F6350DAE843','89504E470D0A1A0A00C76FA8640000001E49444154384F6350DAE843126220493550F1A80662426C34940647','中文—删除化','english_language','teshu*符号@$￥%','SHUZI!1234567','c','o','23:12:02','2016-12-02','2019-01-01 01:01:51','2020-11-01 01:01:01.34567','2020'),
(15,1.55,15,b'0101101',x'89504E470D0A1A0A00C76FA8640000001E49444154384F6350DAE843','89504E470D0A1A0A0009444154384F6350DAE843126220493550F1A80662426C349406472801006AC91F1040F','中删除—汉化','english_language','teshu*符号@$￥%','SHUZI!1234567','d','o','23:12:12','2015-02-12','2020-01-01 01:51:01','2011-12-01 01:01:01.34567','2000'),
(16,1.65,16,b'0110101',x'89504E470D0A1A0A00C76FA8640000001E49444154384F6350DAE843','89504E470D0A1A0A0000049444154384F6350DAE843126220493550F1A80662426C349406472801006AC91F1040F79','删除列时使用景','english_language','teshu*符号@$￥%','SHUZI!1234567','d','p','11:12:12','2014-12-12','2022-01-01 01:41:01','2013-01-01 01:01:01.34567','2010'),
(17,1.75,17,b'1010101',x'89504E470D0A1A0A00C76FA8640000001E49444154384F6350DAE843','89504E470D0A1A0A009444154384F6350DAE843126220493550F1A80662426C349406472801006AC91F1040F796BD','删除——汉化','english_language','teshu*符号@$￥%','SHUZI!1234567','e','o','12:12:12','2013-02-02','2021-01-01 01:31:01','2000-02-01 01:01:01.34567','2000'),
(18,1.85,18,b'11010101',x'89504E470D0A1A0A00C76FA8640000001E49444154384F6350DAE843','89504E470D0A1A0A0000000D4997300000EC300000EC301C76FA8640000001E49444154384F6350DAE843126220493550F1A80662426','删除列时使用情','english_language','teshu*符号@$￥%','SHUZI!1234567','g','i','16:12:12','2012-12-12','2023-01-01 01:21:01','2000-03-01 01:01:01.3','2020'),
(19,1.95,19,b'01110101',x'89504E470D0A1A0A00C76FA8640000001E49444154384F6350DAE843','89504E470D0A1A0A0040000001E49444154384F6350DAE843126220493550F1A80662426C349406472801006AC91F1040F79','中文删除','english_language','teshu*符号@$￥%','SHUZI!1234567','f','l','17:12:12','2011-02-02','2022-01-01 01:11:01','2000-04-01 01:01:01.367','2010'),
(20,1.05,20,b'01010111',x'89504E470D0A1A0A00C76FA8640000001E49444154384F6350DAE843','89504E470D0A1A0A0000970485979444154384F6350DAE843126220493550F1A80662426C349406472801006AC91F1040F796BD','删除列时使用','english_language','teshu*符号@$￥%','SHUZI!1234567','f','i','18:12:12','2001-02-10','2019-01-01 01:11:01','2000-05-01 01:01:01.34','2020'),
(21,2.05,21,b'01011101',x'89504E470D0A1A0A00C76FA8640000001E49444154384F6350DAE843','89504E470D0A1A0A0000000EC300000EC301C76FA8640000001E49444154384F6350DAE843126220493550F','中文删除汉化','english_language','teshu*符号@$￥%','SHUZI!1234567','f','j','19:12:12','2022-12-12','1980-01-01 01:41:01','2000-06-01 01:01:01.34567','2010');
COMMIT;
CREATE INDEX ind_1 ON t1(c12);
CREATE INDEX ind_2 ON t1(c1,c3,c13,c14);
#使用like关键字创建复制表
DROP TABLE IF EXISTS t3;
CREATE TABLE t3 LIKE t1;
INSERT INTO t3 SELECT * FROM t1;
DESC t3;
Field	Type	Null	Key	Default	Extra
c0	int(5) unsigned	YES		NULL	
c1	float	NO	MUL	NULL	
c2	double	NO	PRI	NULL	auto_increment
c3	bit(20)	YES		b'0'	
c4	blob	YES		NULL	
c5	text	YES		NULL	
c6	varchar(50)	YES	UNI	NULL	
c7	char(50)	YES		NULL	
c8	binary(50)	NO		NULL	
c9	varbinary(50)	NO		NULL	
c10	enum('a','b','c','d','e','f','g','h')	YES		NULL	
c11	set('i','j','k','l','m','n','o','p')	YES		NULL	
c12	time	NO	MUL	NULL	
c13	date	NO		NULL	
c14	datetime	NO		NULL	
c15	timestamp	NO		NULL	
c16	year(4)	YES		NULL	
#删除列并新增列
ALTER TABLE t3 DROP COLUMN c10 ,ADD COLUMN c17 INT(5) ZEROFILL;
DESC t3;
Field	Type	Null	Key	Default	Extra
c0	int(5) unsigned	YES		NULL	
c1	float	NO	MUL	NULL	
c2	double	NO	PRI	NULL	auto_increment
c3	bit(20)	YES		b'0'	
c4	blob	YES		NULL	
c5	text	YES		NULL	
c6	varchar(50)	YES	UNI	NULL	
c7	char(50)	YES		NULL	
c8	binary(50)	NO		NULL	
c9	varbinary(50)	NO		NULL	
c11	set('i','j','k','l','m','n','o','p')	YES		NULL	
c12	time	NO	MUL	NULL	
c13	date	NO		NULL	
c14	datetime	NO		NULL	
c15	timestamp	NO		NULL	
c16	year(4)	YES		NULL	
c17	int(5) unsigned	YES		NULL	
INSERT INTO t3 VALUES(22,2.05,23,b'01011101',x'89504E470D0A1A0A00C76FA8640000001E49444154384F6350DAE843','89504E470D0A1A0A0000000EC300000EC301C76FA8640000001E49444154384F6350DAE843126220493550F','中文删$除汉化','english_language','teshu*符号@$￥%','SHUZI!1234567','f','j','19:12:12','2022-12-12','1980-01-01 01:41:01','2000-06-01 01:01:01.34567','2010');
INSERT INTO t3 VALUES(22,2.06,23,b'01011101',x'89504E470D0A1A0A00C76FA8640000001E49444154384F6350DAE843','89504E470D0A1A0A0000000EC300000EC301C76FA8640000001E49444154384F6350DAE843126220493550F','中文删$除汉化','english_language','teshu*符号@$￥%','SHUZI!1234567','j','19:12:12','2022-12-12','1980-01-01 01:41:01','2000-06-01 01:01:01.34567','2010',1);
SELECT c10 FROM t3;
SELECT c17 FROM t3;
c17
NULL
NULL
NULL
NULL
NULL
NULL
NULL
NULL
NULL
NULL
NULL
NULL
NULL
NULL
NULL
NULL
NULL
NULL
NULL
NULL
NULL
00001
#删除并新增相同的列名
#此处MYSQL成功，OB报错，在和开发确认
DESC t3;
Field	Type	Null	Key	Default	Extra
c0	int(5) unsigned	YES		NULL	
c1	float	NO	MUL	NULL	
c2	double	NO	PRI	NULL	auto_increment
c3	bit(20)	YES		b'0'	
c4	blob	YES		NULL	
c5	text	YES		NULL	
c6	varchar(50)	YES	UNI	NULL	
c7	char(50)	YES		NULL	
c8	binary(50)	NO		NULL	
c9	varbinary(50)	NO		NULL	
c11	set('i','j','k','l','m','n','o','p')	YES		NULL	
c12	time	NO	MUL	NULL	
c13	date	NO		NULL	
c14	datetime	NO		NULL	
c15	timestamp	NO		NULL	
c16	year(4)	YES		NULL	
c17	int(5) unsigned	YES		NULL	
SELECT c0 FROM t3 ORDER BY 1;
c0
00001
00002
00003
00004
00005
00006
00007
00008
00009
00010
00011
00012
00013
00014
00015
00016
00017
00018
00019
00020
00021
00022
#删除多列并新增列带属性
ALTER TABLE t3 DROP COLUMN c0 ,ADD COLUMN c18 CHAR(50) CHARACTER SET 'gb18030' COLLATE 'gb18030_bin';
DESC t3;
Field	Type	Null	Key	Default	Extra
c1	float	NO	MUL	NULL	
c2	double	NO	PRI	NULL	auto_increment
c3	bit(20)	YES		b'0'	
c4	blob	YES		NULL	
c5	text	YES		NULL	
c6	varchar(50)	YES	UNI	NULL	
c7	char(50)	YES		NULL	
c8	binary(50)	NO		NULL	
c9	varbinary(50)	NO		NULL	
c11	set('i','j','k','l','m','n','o','p')	YES		NULL	
c12	time	NO	MUL	NULL	
c13	date	NO		NULL	
c14	datetime	NO		NULL	
c15	timestamp	NO		NULL	
c16	year(4)	YES		NULL	
c17	int(5) unsigned	YES		NULL	
c18	char(50)	YES		NULL	
INSERT INTO t3 VALUES(2.07,24,b'01011101',x'89504E470D0A1A0A00C76FA8640000001E49444154384F6350DAE843','89504E470D0A1A0A0000000EC300000EC301C76FA8640000001E49444154384F6350DAE843126220493550F','中文删=除汉化','english_language','teshu*符号@$￥%','SHUZI!1234567','i','19:12:12','2022-12-12','1980-01-01 01:41:01','2000-06-01 01:01:01.34567','2010',11,'A');
SELECT c18 FROM t3 ORDER BY 1;
c18
NULL
NULL
NULL
NULL
NULL
NULL
NULL
NULL
NULL
NULL
NULL
NULL
NULL
NULL
NULL
NULL
NULL
NULL
NULL
NULL
NULL
NULL
A
#删除列并指定新增列位置
ALTER TABLE t3 DROP COLUMN c4 ,ADD COLUMN c0 INT FIRST;
DESC t3;
Field	Type	Null	Key	Default	Extra
c0	int(11)	YES		NULL	
c1	float	NO	MUL	NULL	
c2	double	NO	PRI	NULL	auto_increment
c3	bit(20)	YES		b'0'	
c5	text	YES		NULL	
c6	varchar(50)	YES	UNI	NULL	
c7	char(50)	YES		NULL	
c8	binary(50)	NO		NULL	
c9	varbinary(50)	NO		NULL	
c11	set('i','j','k','l','m','n','o','p')	YES		NULL	
c12	time	NO	MUL	NULL	
c13	date	NO		NULL	
c14	datetime	NO		NULL	
c15	timestamp	NO		NULL	
c16	year(4)	YES		NULL	
c17	int(5) unsigned	YES		NULL	
c18	char(50)	YES		NULL	
INSERT INTO t3 VALUES(2.07,24,b'01011101',x'89504E470D0A1A0A00C76FA8640000001E49444154384F6350DAE843','89504E470D0A1A0A0000000EC300000EC301C76FA8640000001E49444154384F6350DAE843126220493550F','中文删=除汉化','english_language','teshu*符号@$￥%','SHUZI!1234567','i','19:12:12','2022-12-12','1980-01-01 01:41:01','2000-06-01 01:01:01.34567','2010',11,'A');
INSERT INTO t3 VALUES(10,2.08,25,b'11111101','89504E470D0A1A0A0000000EC300000EC301C76FA8640000001E49444154384F6350DAE843126220493550F','中文删0除汉化','english_language','teshu*符号@$￥%','SHUZI!1234567','i','12:12:12','2022-12-22','1982-01-21 01:41:01','2002-06-21 02:21:21.34567','2012',12,'B');
SELECT c0 FROM t3 ORDER BY 1;
c0
NULL
NULL
NULL
NULL
NULL
NULL
NULL
NULL
NULL
NULL
NULL
NULL
NULL
NULL
NULL
NULL
NULL
NULL
NULL
NULL
NULL
NULL
NULL
10
#删除多列并新增生成列
ALTER TABLE t3 DROP COLUMN c0 ,ADD COLUMN c19 CHAR(100) GENERATED ALWAYS AS (CONCAT(c6,c7)) VIRTUAL NOT NULL COMMENT '字符串生成列';
DESC t3;
Field	Type	Null	Key	Default	Extra
c1	float	NO	MUL	NULL	
c2	double	NO	PRI	NULL	auto_increment
c3	bit(20)	YES		b'0'	
c5	text	YES		NULL	
c6	varchar(50)	YES	UNI	NULL	
c7	char(50)	YES		NULL	
c8	binary(50)	NO		NULL	
c9	varbinary(50)	NO		NULL	
c11	set('i','j','k','l','m','n','o','p')	YES		NULL	
c12	time	NO	MUL	NULL	
c13	date	NO		NULL	
c14	datetime	NO		NULL	
c15	timestamp	NO		NULL	
c16	year(4)	YES		NULL	
c17	int(5) unsigned	YES		NULL	
c18	char(50)	YES		NULL	
c19	char(100)	NO		CONCAT(`c6`,`c7`)	VIRTUAL GENERATED
INSERT INTO t3(c1,c2,c3,c5,c6,c7,c8,c9,c11,c12,c13,c14,c15,c16,c17,c18)
VALUES(2.09,26,b'11011101','89504E470D0A1A0A0000000EC300000EC301C76FA8640000001E49444154384F6350DAE843126220493550F','中文删9除汉化','englishlanguage','teshu符号@$￥%','SHUZI!1234567','k','19:22:22','2020-12-12','1982-01-01 01:41:01','2000-06-01 01:01:01.34567','2012',13,'C');
SELECT c19 FROM t3 ORDER BY 1;
c19

中删除—汉化english_language
中文——汉化删除english_language
中文—删除化english_language
中文—汉化english_language
中文删$除汉化english_language
中文删0除汉化english_language
中文删9除汉化englishlanguage
中文删=除汉化english_language
中文删除english_language
中文删除汉化english_language
删中文——汉化删除english_language
删列时使用情景english_language
删除——汉化english_language
删除中——汉化english_language
删除中文*汉化删除english_language
删除中文——汉化english_language
删除列使用情景english_language
删除列时使情景english_language
删除列时使用english_language
删除列时使用情english_language
删除列时使用景english_language
删除列时用情景english_language
删除时使用情景english_language
除列时使用情景english_language
#使用as关键字创建复制表
DROP TABLE IF EXISTS t3;
CREATE TABLE t3 AS SELECT * FROM t1;
DESC t3;
Field	Type	Null	Key	Default	Extra
c0	int(5) unsigned	YES		NULL	
c1	float	NO		NULL	
c2	double	NO		NULL	
c3	bit(20)	YES		b'0'	
c4	blob	YES		NULL	
c5	text	YES		NULL	
c6	varchar(50)	YES		NULL	
c7	char(50)	YES		NULL	
c8	binary(50)	NO		NULL	
c9	varbinary(50)	NO		NULL	
c10	enum('a','b','c','d','e','f','g','h')	YES		NULL	
c11	set('i','j','k','l','m','n','o','p')	YES		NULL	
c12	time	NO		NULL	
c13	date	NO		NULL	
c14	datetime	NO		NULL	
c15	timestamp	NO		NULL	
c16	year(4)	YES		NULL	
ALTER TABLE t3 DROP COLUMN c10 ,ADD COLUMN c17 INT(5) ZEROFILL;
DESC t3;
Field	Type	Null	Key	Default	Extra
c0	int(5) unsigned	YES		NULL	
c1	float	NO		NULL	
c2	double	NO		NULL	
c3	bit(20)	YES		b'0'	
c4	blob	YES		NULL	
c5	text	YES		NULL	
c6	varchar(50)	YES		NULL	
c7	char(50)	YES		NULL	
c8	binary(50)	NO		NULL	
c9	varbinary(50)	NO		NULL	
c11	set('i','j','k','l','m','n','o','p')	YES		NULL	
c12	time	NO		NULL	
c13	date	NO		NULL	
c14	datetime	NO		NULL	
c15	timestamp	NO		NULL	
c16	year(4)	YES		NULL	
c17	int(5) unsigned	YES		NULL	
INSERT INTO t3 VALUES(22,2.05,23,b'01011101',x'89504E470D0A1A0A00C76FA8640000001E49444154384F6350DAE843','89504E470D0A1A0A0000000EC300000EC301C76FA8640000001E49444154384F6350DAE843126220493550F','中文删$除汉化','english_language','teshu*符号@$￥%','SHUZI!1234567','f','j','19:12:12','2022-12-12','1980-01-01 01:41:01','2000-06-01 01:01:01.34567','2010');
INSERT INTO t3 VALUES(22,2.06,23,b'01011101',x'89504E470D0A1A0A00C76FA8640000001E49444154384F6350DAE843','89504E470D0A1A0A0000000EC300000EC301C76FA8640000001E49444154384F6350DAE843126220493550F','中文删$除汉化','english_language','teshu*符号@$￥%','SHUZI!1234567','j','19:12:12','2022-12-12','1980-01-01 01:41:01','2000-06-01 01:01:01.34567','2010',1);
SELECT c10 FROM t3;
SELECT c17 FROM t3;
c17
NULL
NULL
NULL
NULL
NULL
NULL
NULL
NULL
NULL
NULL
NULL
NULL
NULL
NULL
NULL
NULL
NULL
NULL
NULL
NULL
NULL
00001
#删除并新增相同的列名
#此处MYSQL成功，OB报错，在和开发确认
DESC t3;
Field	Type	Null	Key	Default	Extra
c0	int(5) unsigned	YES		NULL	
c1	float	NO		NULL	
c2	double	NO		NULL	
c3	bit(20)	YES		b'0'	
c4	blob	YES		NULL	
c5	text	YES		NULL	
c6	varchar(50)	YES		NULL	
c7	char(50)	YES		NULL	
c8	binary(50)	NO		NULL	
c9	varbinary(50)	NO		NULL	
c11	set('i','j','k','l','m','n','o','p')	YES		NULL	
c12	time	NO		NULL	
c13	date	NO		NULL	
c14	datetime	NO		NULL	
c15	timestamp	NO		NULL	
c16	year(4)	YES		NULL	
c17	int(5) unsigned	YES		NULL	
SELECT c0 FROM t3 ORDER BY 1;
c0
00001
00002
00003
00004
00005
00006
00007
00008
00009
00010
00011
00012
00013
00014
00015
00016
00017
00018
00019
00020
00021
00022
#删除多列并新增列带属性
ALTER TABLE t3 DROP COLUMN c0 ,ADD COLUMN c18 CHAR(50) CHARACTER SET 'gb18030' COLLATE 'gb18030_bin';
DESC t3;
Field	Type	Null	Key	Default	Extra
c1	float	NO		NULL	
c2	double	NO		NULL	
c3	bit(20)	YES		b'0'	
c4	blob	YES		NULL	
c5	text	YES		NULL	
c6	varchar(50)	YES		NULL	
c7	char(50)	YES		NULL	
c8	binary(50)	NO		NULL	
c9	varbinary(50)	NO		NULL	
c11	set('i','j','k','l','m','n','o','p')	YES		NULL	
c12	time	NO		NULL	
c13	date	NO		NULL	
c14	datetime	NO		NULL	
c15	timestamp	NO		NULL	
c16	year(4)	YES		NULL	
c17	int(5) unsigned	YES		NULL	
c18	char(50)	YES		NULL	
INSERT INTO t3 VALUES(2.07,24,b'01011101',x'89504E470D0A1A0A00C76FA8640000001E49444154384F6350DAE843','89504E470D0A1A0A0000000EC300000EC301C76FA8640000001E49444154384F6350DAE843126220493550F','中文删=除汉化','english_language','teshu*符号@$￥%','SHUZI!1234567','i','19:12:12','2022-12-12','1980-01-01 01:41:01','2000-06-01 01:01:01.34567','2010',11,'A');
SELECT c18 FROM t3 ORDER BY 1;
c18
NULL
NULL
NULL
NULL
NULL
NULL
NULL
NULL
NULL
NULL
NULL
NULL
NULL
NULL
NULL
NULL
NULL
NULL
NULL
NULL
NULL
NULL
A
#删除列并指定新增列位置
ALTER TABLE t3 DROP COLUMN c4 ,ADD COLUMN c0 INT FIRST;
DESC t3;
Field	Type	Null	Key	Default	Extra
c0	int(11)	YES		NULL	
c1	float	NO		NULL	
c2	double	NO		NULL	
c3	bit(20)	YES		b'0'	
c5	text	YES		NULL	
c6	varchar(50)	YES		NULL	
c7	char(50)	YES		NULL	
c8	binary(50)	NO		NULL	
c9	varbinary(50)	NO		NULL	
c11	set('i','j','k','l','m','n','o','p')	YES		NULL	
c12	time	NO		NULL	
c13	date	NO		NULL	
c14	datetime	NO		NULL	
c15	timestamp	NO		NULL	
c16	year(4)	YES		NULL	
c17	int(5) unsigned	YES		NULL	
c18	char(50)	YES		NULL	
INSERT INTO t3 VALUES(2.07,24,b'01011101',x'89504E470D0A1A0A00C76FA8640000001E49444154384F6350DAE843','89504E470D0A1A0A0000000EC300000EC301C76FA8640000001E49444154384F6350DAE843126220493550F','中文删=除汉化','english_language','teshu*符号@$￥%','SHUZI!1234567','i','19:12:12','2022-12-12','1980-01-01 01:41:01','2000-06-01 01:01:01.34567','2010',11,'A');
INSERT INTO t3 VALUES(10,2.08,25,b'11111101','89504E470D0A1A0A0000000EC300000EC301C76FA8640000001E49444154384F6350DAE843126220493550F','中文删0除汉化','english_language','teshu*符号@$￥%','SHUZI!1234567','i','12:12:12','2022-12-22','1982-01-21 01:41:01','2002-06-21 02:21:21.34567','2012',12,'B');
SELECT c0 FROM t3 ORDER BY 1;
c0
NULL
NULL
NULL
NULL
NULL
NULL
NULL
NULL
NULL
NULL
NULL
NULL
NULL
NULL
NULL
NULL
NULL
NULL
NULL
NULL
NULL
NULL
NULL
10
#删除多列并新增生成列
ALTER TABLE t3 DROP COLUMN c0 ,ADD COLUMN c19 CHAR(100) GENERATED ALWAYS AS (CONCAT(c6,c7)) VIRTUAL NOT NULL COMMENT '字符串生成列';
DESC t3;
Field	Type	Null	Key	Default	Extra
c1	float	NO		NULL	
c2	double	NO		NULL	
c3	bit(20)	YES		b'0'	
c5	text	YES		NULL	
c6	varchar(50)	YES		NULL	
c7	char(50)	YES		NULL	
c8	binary(50)	NO		NULL	
c9	varbinary(50)	NO		NULL	
c11	set('i','j','k','l','m','n','o','p')	YES		NULL	
c12	time	NO		NULL	
c13	date	NO		NULL	
c14	datetime	NO		NULL	
c15	timestamp	NO		NULL	
c16	year(4)	YES		NULL	
c17	int(5) unsigned	YES		NULL	
c18	char(50)	YES		NULL	
c19	char(100)	NO		CONCAT(`c6`,`c7`)	VIRTUAL GENERATED
INSERT INTO t3(c1,c2,c3,c5,c6,c7,c8,c9,c11,c12,c13,c14,c15,c16,c17,c18)
VALUES(2.09,26,b'11011101','89504E470D0A1A0A0000000EC300000EC301C76FA8640000001E49444154384F6350DAE843126220493550F','中文删9除汉化','englishlanguage','teshu符号@$￥%','SHUZI!1234567','k','19:22:22','2020-12-12','1982-01-01 01:41:01','2000-06-01 01:01:01.34567','2012',13,'C');
SELECT c19 FROM t3 ORDER BY 1;
c19

中删除—汉化english_language
中文——汉化删除english_language
中文—删除化english_language
中文—汉化english_language
中文删$除汉化english_language
中文删0除汉化english_language
中文删9除汉化englishlanguage
中文删=除汉化english_language
中文删除english_language
中文删除汉化english_language
删中文——汉化删除english_language
删列时使用情景english_language
删除——汉化english_language
删除中——汉化english_language
删除中文*汉化删除english_language
删除中文——汉化english_language
删除列使用情景english_language
删除列时使情景english_language
删除列时使用english_language
删除列时使用情english_language
删除列时使用景english_language
删除列时用情景english_language
删除时使用情景english_language
除列时使用情景english_language
#删除多列
#使用like关键字创建复制表
DROP TABLE IF EXISTS t3;
CREATE TABLE t3 LIKE t1;
INSERT INTO t3 SELECT * FROM t1;
DESC t3;
Field	Type	Null	Key	Default	Extra
c0	int(5) unsigned	YES		NULL	
c1	float	NO	MUL	NULL	
c2	double	NO	PRI	NULL	auto_increment
c3	bit(20)	YES		b'0'	
c4	blob	YES		NULL	
c5	text	YES		NULL	
c6	varchar(50)	YES	UNI	NULL	
c7	char(50)	YES		NULL	
c8	binary(50)	NO		NULL	
c9	varbinary(50)	NO		NULL	
c10	enum('a','b','c','d','e','f','g','h')	YES		NULL	
c11	set('i','j','k','l','m','n','o','p')	YES		NULL	
c12	time	NO	MUL	NULL	
c13	date	NO		NULL	
c14	datetime	NO		NULL	
c15	timestamp	NO		NULL	
c16	year(4)	YES		NULL	
ALTER TABLE t3 DROP COLUMN c1 ,DROP COLUMN c2 ,DROP COLUMN c3;
ALTER TABLE t3 DROP COLUMN c1 ,DROP COLUMN c3 ,DROP COLUMN c4;
ALTER TABLE t3 DROP COLUMN c4 ,DROP COLUMN c5 ,DROP COLUMN c8 ,DROP COLUMN c9;
DESC t3;
Field	Type	Null	Key	Default	Extra
c0	int(5) unsigned	YES		NULL	
c2	double	NO	PRI	NULL	auto_increment
c5	text	YES		NULL	
c6	varchar(50)	YES	UNI	NULL	
c7	char(50)	YES		NULL	
c8	binary(50)	NO		NULL	
c9	varbinary(50)	NO		NULL	
c10	enum('a','b','c','d','e','f','g','h')	YES		NULL	
c11	set('i','j','k','l','m','n','o','p')	YES		NULL	
c12	time	NO	MUL	NULL	
c13	date	NO	MUL	NULL	
c14	datetime	NO		NULL	
c15	timestamp	NO		NULL	
c16	year(4)	YES		NULL	
DELETE FROM t3 WHERE c8='english_language';
UPDATE t3 SET c9='english_language';
INSERT INTO t3 VALUES(2.07,24,b'01011101',x'89504E470D0A1A0A00C76FA8640000001E49444154384F6350DAE843','89504E470D0A1A0A0000000EC300000EC301C76FA8640000001E49444154384F6350DAE843126220493550F','中文删=除汉化','english_language','teshu*符号@$￥%','SHUZI!1234567','j','19:12:12','2022-12-12','1980-01-01 01:41:01','2000-06-01 01:01:01.34567','2010',2,'A');
INSERT INTO t3 VALUES(22,2.08,25,b'01011111','中文删-除汉化','english_language','a','i','19:12:12','2022-12-12','1980-01-01 01:41:01','2000-06-01 01:01:01.34567','2010');
SELECT * FROM t3 ORDER BY 1;
c0	c2	c5	c6	c7	c8	c9	c10	c11	c12	c13	c14	c15	c16
00001	1	89504E470D0A1A0A00C76FA8640000001E49444154384F6350DAE843			teshu*符号@$￥%                                	english_language	a	i	20:12:12	2000-12-12	2000-01-01 01:01:01	2001-01-01 12:01:01	2000
00002	2	89504E470D0A1A0A00C76FA8640000001E49444154384F6350DAE843	中文—汉化	english_language	teshu*符号@$￥%                                	english_language	b	i	21:12:12	2001-12-22	2001-01-01 13:01:01	2001-11-01 11:01:01	2010
00003	3	89504E470D0A1A0A00C76FA8640000001E49444154384F6350DAE843	删除时使用情景	english_language	teshu*符号@$￥%                                	english_language	c	i	22:12:12	2002-12-02	2002-01-01 14:01:01	2002-12-01 02:01:01	2000
00004	4	89504E470D0A1A0A00C76FA8640000001E49444154384F6350DAE843	删除中——汉化	english_language	teshu*符号@$￥%                                	english_language	d	j	23:12:12	2003-12-11	2003-01-01 15:01:01	2002-11-01 03:01:01	2010
00005	5	89504E470D0A1A0A00C76FA8640000001E49444154384F6350DAE843	删除中文*汉化删除	english_language	teshu*符号@$￥%                                	english_language	e	k	20:22:12	2004-12-12	2004-01-01 16:01:01	2002-02-04 05:01:01	2000
00006	6	89504E470D0A1A0A00C76FA8640000001E49444154384F6350DAE843	除列时使用情景	english_language	teshu*符号@$￥%                                	english_language	f	k	20:32:12	2021-12-13	2010-01-01 21:01:01	2003-03-01 04:01:01	2010
00007	7	89504E470D0A1A0A00C76FA8640000001E49444154384F6350DAE843	删列时使用情景	english_language	teshu*符号@$￥%                                	english_language	g	l	20:42:12	2020-12-14	2011-01-01 22:01:01	2004-04-01 05:01:01	2000
00008	8	89504E470D0A1A0A00C76FA8640000001E49444154384F6350DAE843	删除列使用情景	english_language	teshu*符号@$￥%                                	english_language	h	l	20:52:12	2015-12-15	2012-01-01 23:01:01	2005-05-01 06:01:01	2020
00009	9	89504E470D0A1A0A00C76FA8640000001E49444154384F6350DAE843	删中文——汉化删除	english_language	teshu*符号@$￥%                                	english_language	a	l	20:12:42	2014-12-16	2013-01-01 20:01:01	2006-06-01 07:01:01	2000
00010	10	89504E470D0A1A0A00C76FA8640000001E49444154384F6350DAE843126220493550	删除列时用情景	english_language	teshu*符号@$￥%                                	english_language	a	m	21:12:52	2013-12-17	2014-01-01 01:11:01	2007-07-01 08:01:01	2020
00011	11	89504E470D0A1A0A00C76FA8640000001E49444154384F6350DAE843126220493550	中文——汉化删除	english_language	teshu*符号@$￥%                                	english_language	b	n	21:12:32	2012-12-18	2011-01-01 01:21:01	2008-08-01 01:01:01	2010
00012	12	89504E470D0A1A0A00C76FA8640000001E49444154384F6350DAE843126220493550	删除中文——汉化	english_language	teshu*符号@$￥%                                	english_language	b	n	22:12:22	2011-12-19	2010-01-01 01:31:01	2009-09-01 01:01:01	2020
00013	13	89504E470D0A1A0A00C76FA8640000001E49444154384F6350DAE843126220493550F1	删除列时使情景	english_language	teshu*符号@$￥%                                	english_language	c	m	22:12:12	2017-12-10	2018-01-01 01:41:01	2010-10-01 01:01:01	2000
00014	14	89504E470D0A1A0A00C76FA8640000001E49444154384F6350DAE843126220493550F1A80662426C34940647	中文—删除化	english_language	teshu*符号@$￥%                                	english_language	c	o	23:12:02	2016-12-02	2019-01-01 01:01:51	2020-11-01 01:01:01	2020
00015	15	89504E470D0A1A0A0009444154384F6350DAE843126220493550F1A80662426C349406472801006AC91F1040F	中删除—汉化	english_language	teshu*符号@$￥%                                	english_language	d	o	23:12:12	2015-02-12	2020-01-01 01:51:01	2011-12-01 01:01:01	2000
00016	16	89504E470D0A1A0A0000049444154384F6350DAE843126220493550F1A80662426C349406472801006AC91F1040F79	删除列时使用景	english_language	teshu*符号@$￥%                                	english_language	d	p	11:12:12	2014-12-12	2022-01-01 01:41:01	2013-01-01 01:01:01	2010
00017	17	89504E470D0A1A0A009444154384F6350DAE843126220493550F1A80662426C349406472801006AC91F1040F796BD	删除——汉化	english_language	teshu*符号@$￥%                                	english_language	e	o	12:12:12	2013-02-02	2021-01-01 01:31:01	2000-02-01 01:01:01	2000
00018	18	89504E470D0A1A0A0000000D4997300000EC300000EC301C76FA8640000001E49444154384F6350DAE843126220493550F1A80662426	删除列时使用情	english_language	teshu*符号@$￥%                                	english_language	g	i	16:12:12	2012-12-12	2023-01-01 01:21:01	2000-03-01 01:01:01	2020
00019	19	89504E470D0A1A0A0040000001E49444154384F6350DAE843126220493550F1A80662426C349406472801006AC91F1040F79	中文删除	english_language	teshu*符号@$￥%                                	english_language	f	l	17:12:12	2011-02-02	2022-01-01 01:11:01	2000-04-01 01:01:01	2010
00020	20	89504E470D0A1A0A0000970485979444154384F6350DAE843126220493550F1A80662426C349406472801006AC91F1040F796BD	删除列时使用	english_language	teshu*符号@$￥%                                	english_language	f	i	18:12:12	2001-02-10	2019-01-01 01:11:01	2000-05-01 01:01:01	2020
00021	21	89504E470D0A1A0A0000000EC300000EC301C76FA8640000001E49444154384F6350DAE843126220493550F	中文删除汉化	english_language	teshu*符号@$￥%                                	english_language	f	j	19:12:12	2022-12-12	1980-01-01 01:41:01	2000-06-01 01:01:01	2010
#使用as关键字创建复制表
DROP TABLE IF EXISTS t3;
CREATE TABLE t3 AS SELECT * FROM t1;
DESC t3;
Field	Type	Null	Key	Default	Extra
c0	int(5) unsigned	YES		NULL	
c1	float	NO		NULL	
c2	double	NO		NULL	
c3	bit(20)	YES		b'0'	
c4	blob	YES		NULL	
c5	text	YES		NULL	
c6	varchar(50)	YES		NULL	
c7	char(50)	YES		NULL	
c8	binary(50)	NO		NULL	
c9	varbinary(50)	NO		NULL	
c10	enum('a','b','c','d','e','f','g','h')	YES		NULL	
c11	set('i','j','k','l','m','n','o','p')	YES		NULL	
c12	time	NO		NULL	
c13	date	NO		NULL	
c14	datetime	NO		NULL	
c15	timestamp	NO		NULL	
c16	year(4)	YES		NULL	
ALTER TABLE t3 DROP COLUMN c1 ,DROP COLUMN c2 ,DROP COLUMN c3;
ALTER TABLE t3 DROP COLUMN c4 ,DROP COLUMN c5 ,DROP COLUMN c8 ,DROP COLUMN c9;
DESC t3;
Field	Type	Null	Key	Default	Extra
c0	int(5) unsigned	YES		NULL	
c6	varchar(50)	YES		NULL	
c7	char(50)	YES		NULL	
c10	enum('a','b','c','d','e','f','g','h')	YES		NULL	
c11	set('i','j','k','l','m','n','o','p')	YES		NULL	
c12	time	NO		NULL	
c13	date	NO		NULL	
c14	datetime	NO		NULL	
c15	timestamp	NO		NULL	
c16	year(4)	YES		NULL	
DELETE FROM t3 WHERE c8='english_language';
UPDATE t3 SET c9='english_language';
INSERT INTO t3 VALUES(2.07,24,b'01011101',x'89504E470D0A1A0A00C76FA8640000001E49444154384F6350DAE843','89504E470D0A1A0A0000000EC300000EC301C76FA8640000001E49444154384F6350DAE843126220493550F','中文删=除汉化','english_language','teshu*符号@$￥%','SHUZI!1234567','j','19:12:12','2022-12-12','1980-01-01 01:41:01','2000-06-01 01:01:01.34567','2010',2,'A');
INSERT INTO t3 VALUES(22,'中文删-除汉化','english_language','a','i','19:12:12','2022-12-12','1980-01-01 01:41:01','2000-06-01 01:01:01.34567','2010');
SELECT c0 FROM t3 ORDER BY 1;
c0
00001
00002
00003
00004
00005
00006
00007
00008
00009
00010
00011
00012
00013
00014
00015
00016
00017
00018
00019
00020
00021
00022
#以下操作都暂不支持，后续支持后再完善case
#删除列并修改唯一约束列
DROP TABLE IF EXISTS t2;
DROP TABLE IF EXISTS t1;
#########Empty recycle bin, delete test database, tables, etc##########
purge recyclebin;
