purge recyclebin;
DROP TABLE IF EXISTS t1;
DROP TABLE IF EXISTS t2;
#mysql_drop-4
#mysql_drop-4-3
#mysql_drop-4-3-1
#单基表试图
#基表带有不同类型数据和不同约束以及不同索引
#CREATE DATA (DATA TYPE + INDEX + CONSTRAINT)
CREATE TABLE t1(c0 INT(5) ZEROFILL,
c1 FLOAT AUTO_INCREMENT PRIMARY KEY,
c2 DOUBLE NOT NULL,
c3 CHAR(10) DEFAULT 'A',
c4 VARCHAR(10) UNIQUE,
c5 CHAR(10),
c6 INT,
c7 TIME,
c8 YEAR ,CHECK(c8>=2000));
INSERT INTO t1 VALUES(1,1.0,1.1,'中文','','',0,'11:11:11','2000'),
(2,1.1,1.2,'中!文','A','a',1,'11:11:11','2001'),
(3,1.2,2.2,'中!文','B','a',1,'11:11:11','2002'),
(4,1.3,3.2,'中!文','C','a',1,'11:11:11','2003'),
(5,1.4,4.2,'中!文','D','a',1,'11:11:11','2004'),
(6,1.5,5.2,'中!文','E','a',1,'11:11:11','2005'),
(7,1.6,6.2,'中!文','F','a',1,'11:11:11','2006'),
(8,1.7,7.2,'中!文','G','a',1,'11:11:11','2007'),
(9,1.8,8.2,'中!文','H','a',1,'11:11:11','2011'),
(10,1.9,9.2,'中!文','I','a',1,'11:11:11','2012'),
(11,2.0,1.9,'中!文','J','a',1,'11:11:11','2011'),
(12,2.1,1.8,'中!文','K','a',1,'11:11:11','2012');
CREATE INDEX ind_1 ON t1(c5);
CREATE INDEX ind_2 ON t1(c6,c7);
drop view v1;
CREATE VIEW v1 AS SELECT * FROM t1;
SELECT * FROM v1 ORDER BY c0;
c0	c1	c2	c3	c4	c5	c6	c7	c8
00001	1	1.1	中文			0	11:11:11	2000
00002	1.1	1.2	中!文	A	a	1	11:11:11	2001
00003	1.2	2.2	中!文	B	a	1	11:11:11	2002
00004	1.3	3.2	中!文	C	a	1	11:11:11	2003
00005	1.4	4.2	中!文	D	a	1	11:11:11	2004
00006	1.5	5.2	中!文	E	a	1	11:11:11	2005
00007	1.6	6.2	中!文	F	a	1	11:11:11	2006
00008	1.7	7.2	中!文	G	a	1	11:11:11	2007
00009	1.8	8.2	中!文	H	a	1	11:11:11	2011
00010	1.9	9.2	中!文	I	a	1	11:11:11	2012
00011	2	1.9	中!文	J	a	1	11:11:11	2011
00012	2.1	1.8	中!文	K	a	1	11:11:11	2012
DESC v1;
Field	Type	Null	Key	Default	Extra
c0	int(5) unsigned	YES		NULL	
c1	float	NO		NULL	
c2	double	NO		NULL	
c3	char(10)	YES			
c4	varchar(10)	YES		NULL	
c5	char(10)	YES		NULL	
c6	int(11)	YES		NULL	
c7	time	YES		NULL	
c8	year(4)	YES		NULL	
ALTER TABLE v1 DROP c0;
ALTER TABLE v1 DROP c0,DROP c1,DROP c2,DROP c3,DROP c4,DROP c5,DROP c6,DROP c7,DROP c8;
DESC v1;
Field	Type	Null	Key	Default	Extra
c0	int(5) unsigned	YES		NULL	
c1	float	NO		NULL	
c2	double	NO		NULL	
c3	char(10)	YES			
c4	varchar(10)	YES		NULL	
c5	char(10)	YES		NULL	
c6	int(11)	YES		NULL	
c7	time	YES		NULL	
c8	year(4)	YES		NULL	
INSERT INTO v1 VALUES(13,2.2,1.7,'中0文','L','a',2,'12:12:12','2022');
INSERT INTO v1 VALUES(13,2.2,'L','a',2,'12:12:12','2022');
DROP TABLE t1;
CREATE TABLE t1(c0 INT(5) ZEROFILL,
c1 FLOAT AUTO_INCREMENT PRIMARY KEY,
c2 DOUBLE NOT NULL,
c3 CHAR(10) DEFAULT 'A',
c4 VARCHAR(10) UNIQUE,
c5 CHAR(10),
c6 INT,
c7 TIME,
c8 YEAR ,CHECK(c8>=2000));
INSERT INTO t1 VALUES(1,1.0,1.1,'中文','','',0,'11:11:11','2000'),
(2,1.1,1.2,'中!文','A','a',1,'11:11:11','2001'),
(3,1.2,2.2,'中!文','B','a',1,'11:11:11','2002'),
(4,1.3,3.2,'中!文','C','a',1,'11:11:11','2003'),
(5,1.4,4.2,'中!文','D','a',1,'11:11:11','2004'),
(6,1.5,5.2,'中!文','E','a',1,'11:11:11','2005'),
(7,1.6,6.2,'中!文','F','a',1,'11:11:11','2006'),
(8,1.7,7.2,'中!文','G','a',1,'11:11:11','2007'),
(9,1.8,8.2,'中!文','H','a',1,'11:11:11','2011'),
(10,1.9,9.2,'中!文','I','a',1,'11:11:11','2012'),
(11,2.0,1.9,'中!文','J','a',1,'11:11:11','2011'),
(12,2.1,1.8,'中!文','K','a',1,'11:11:11','2012');
CREATE INDEX ind_1 ON t1(c5);
CREATE INDEX ind_2 ON t1(c6,c7);
DROP VIEW v1;
CREATE VIEW v1 AS SELECT * FROM t1;
SELECT * FROM v1 ORDER BY c0;
c0	c1	c2	c3	c4	c5	c6	c7	c8
00001	1	1.1	中文			0	11:11:11	2000
00002	1.1	1.2	中!文	A	a	1	11:11:11	2001
00003	1.2	2.2	中!文	B	a	1	11:11:11	2002
00004	1.3	3.2	中!文	C	a	1	11:11:11	2003
00005	1.4	4.2	中!文	D	a	1	11:11:11	2004
00006	1.5	5.2	中!文	E	a	1	11:11:11	2005
00007	1.6	6.2	中!文	F	a	1	11:11:11	2006
00008	1.7	7.2	中!文	G	a	1	11:11:11	2007
00009	1.8	8.2	中!文	H	a	1	11:11:11	2011
00010	1.9	9.2	中!文	I	a	1	11:11:11	2012
00011	2	1.9	中!文	J	a	1	11:11:11	2011
00012	2.1	1.8	中!文	K	a	1	11:11:11	2012
DESC v1;
Field	Type	Null	Key	Default	Extra
c0	int(5) unsigned	YES		NULL	
c1	float	NO		NULL	
c2	double	NO		NULL	
c3	char(10)	YES			
c4	varchar(10)	YES		NULL	
c5	char(10)	YES		NULL	
c6	int(11)	YES		NULL	
c7	time	YES		NULL	
c8	year(4)	YES		NULL	
#多基表试图
DROP VIEW IF EXISTS v1;
DROP TABLE IF EXISTS t2;
DROP TABLE IF EXISTS t1;
CREATE TABLE t1(c0 INT(5) PRIMARY KEY,
c1 FLOAT ,
c2 DOUBLE NOT NULL,
c3 CHAR(10) DEFAULT 'A',
c4 VARCHAR(10) UNIQUE,
c5 CHAR(10),
c6 INT,
c7 TIME,
c8 YEAR ,CHECK(c8>=2000));
CREATE TABLE t2(c0 INT(5),
c1 FLOAT,
c2 DOUBLE NOT NULL,
c3 CHAR(10) DEFAULT 'A',
c4 VARCHAR(10) UNIQUE,
c5 CHAR(10),
c6 INT,
c7 TIME,
c8 YEAR ,CHECK(c8>=2000),
CONSTRAINT fk_c0_c0 FOREIGN KEY(c0) REFERENCES t1(c0));
INSERT INTO t1 VALUES(1,1.0,1.1,'中文','','',0,'11:11:11','2000'),
(2,1.1,1.2,'中!文','A','a',1,'11:11:11','2001'),
(3,1.2,2.2,'中!文','B','a',1,'11:11:11','2002'),
(4,1.3,3.2,'中!文','C','a',1,'11:11:11','2003'),
(5,1.4,4.2,'中!文','D','a',1,'11:11:11','2004'),
(6,1.5,5.2,'中!文','E','a',1,'11:11:11','2005'),
(7,1.6,6.2,'中!文','F','a',1,'11:11:11','2006'),
(8,1.7,7.2,'中!文','G','a',1,'11:11:11','2007'),
(9,1.8,8.2,'中!文','H','a',1,'11:11:11','2011'),
(10,1.9,9.2,'中!文','I','a',1,'11:11:11','2012'),
(11,2.0,1.9,'中!文','J','a',1,'11:11:11','2011'),
(12,2.1,1.8,'中!文','K','a',1,'11:11:11','2012');
INSERT INTO t2 VALUES(1,1.0,1.1,'中文','','',0,'11:11:11','2000'),
(2,1.1,1.2,'中!文','A','a',1,'11:11:11','2001'),
(3,1.2,2.2,'中!文','B','a',1,'11:11:11','2002'),
(4,1.3,3.2,'中!文','C','a',1,'11:11:11','2003'),
(5,1.4,4.2,'中!文','D','a',1,'11:11:11','2004'),
(6,1.5,5.2,'中!文','E','a',1,'11:11:11','2005'),
(7,1.6,6.2,'中!文','F','a',1,'11:11:11','2006'),
(8,1.7,7.2,'中!文','G','a',1,'11:11:11','2007'),
(9,1.8,8.2,'中!文','H','a',1,'11:11:11','2011'),
(10,1.9,9.2,'中!文','I','a',1,'11:11:11','2012'),
(11,2.0,1.9,'中!文','J','a',1,'11:11:11','2011'),
(12,2.1,1.8,'中!文','K','a',1,'11:11:11','2012');
CREATE INDEX ind_1 ON t1(c5);
CREATE INDEX ind_2 ON t2(c6,c7);
CREATE VIEW v1 AS SELECT t1.c0,t2.c1,t1.c3,t2.c4,t1.c5,t2.c6,t1.c7,t2.c8 FROM t1 JOIN t2 ON t1.c0=t2.c0;
SELECT * FROM v1 ORDER BY 1;
c0	c1	c3	c4	c5	c6	c7	c8
1	1	中文			0	11:11:11	2000
2	1.1	中!文	A	a	1	11:11:11	2001
3	1.2	中!文	B	a	1	11:11:11	2002
4	1.3	中!文	C	a	1	11:11:11	2003
5	1.4	中!文	D	a	1	11:11:11	2004
6	1.5	中!文	E	a	1	11:11:11	2005
7	1.6	中!文	F	a	1	11:11:11	2006
8	1.7	中!文	G	a	1	11:11:11	2007
9	1.8	中!文	H	a	1	11:11:11	2011
10	1.9	中!文	I	a	1	11:11:11	2012
11	2	中!文	J	a	1	11:11:11	2011
12	2.1	中!文	K	a	1	11:11:11	2012
DESC v1;
Field	Type	Null	Key	Default	Extra
c0	int(5)	NO		NULL	
c1	float	YES		NULL	
c3	char(10)	YES			
c4	varchar(10)	YES		NULL	
c5	char(10)	YES		NULL	
c6	int(11)	YES		NULL	
c7	time	YES		NULL	
c8	year(4)	YES		NULL	
ALTER TABLE v1 DROP c1;
DESC v1;
Field	Type	Null	Key	Default	Extra
c0	int(5)	NO		NULL	
c1	float	YES		NULL	
c3	char(10)	YES			
c4	varchar(10)	YES		NULL	
c5	char(10)	YES		NULL	
c6	int(11)	YES		NULL	
c7	time	YES		NULL	
c8	year(4)	YES		NULL	
SELECT * FROM v1 ORDER BY 1;
c0	c1	c3	c4	c5	c6	c7	c8
1	1	中文			0	11:11:11	2000
2	1.1	中!文	A	a	1	11:11:11	2001
3	1.2	中!文	B	a	1	11:11:11	2002
4	1.3	中!文	C	a	1	11:11:11	2003
5	1.4	中!文	D	a	1	11:11:11	2004
6	1.5	中!文	E	a	1	11:11:11	2005
7	1.6	中!文	F	a	1	11:11:11	2006
8	1.7	中!文	G	a	1	11:11:11	2007
9	1.8	中!文	H	a	1	11:11:11	2011
10	1.9	中!文	I	a	1	11:11:11	2012
11	2	中!文	J	a	1	11:11:11	2011
12	2.1	中!文	K	a	1	11:11:11	2012
UPDATE v1 SET c0=13,c6=10 WHERE c1=1.1;
DESC t2;
Field	Type	Null	Key	Default	Extra
c0	int(5)	YES		NULL	
c1	float	YES		NULL	
c2	double	NO		NULL	
c3	char(10)	YES		A	
c4	varchar(10)	YES	UNI	NULL	
c5	char(10)	YES		NULL	
c6	int(11)	YES	MUL	NULL	
c7	time	YES		NULL	
c8	year(4)	YES		NULL	
SELECT * FROM t2 ORDER BY 1;
c0	c1	c2	c3	c4	c5	c6	c7	c8
1	1	1.1	中文			0	11:11:11	2000
2	1.1	1.2	中!文	A	a	1	11:11:11	2001
3	1.2	2.2	中!文	B	a	1	11:11:11	2002
4	1.3	3.2	中!文	C	a	1	11:11:11	2003
5	1.4	4.2	中!文	D	a	1	11:11:11	2004
6	1.5	5.2	中!文	E	a	1	11:11:11	2005
7	1.6	6.2	中!文	F	a	1	11:11:11	2006
8	1.7	7.2	中!文	G	a	1	11:11:11	2007
9	1.8	8.2	中!文	H	a	1	11:11:11	2011
10	1.9	9.2	中!文	I	a	1	11:11:11	2012
11	2	1.9	中!文	J	a	1	11:11:11	2011
12	2.1	1.8	中!文	K	a	1	11:11:11	2012
UPDATE t2 SET c0=13,c6=10 WHERE c1=1.1;
SELECT * FROM t2 ORDER BY 1;
c0	c1	c2	c3	c4	c5	c6	c7	c8
1	1	1.1	中文			0	11:11:11	2000
2	1.1	1.2	中!文	A	a	1	11:11:11	2001
3	1.2	2.2	中!文	B	a	1	11:11:11	2002
4	1.3	3.2	中!文	C	a	1	11:11:11	2003
5	1.4	4.2	中!文	D	a	1	11:11:11	2004
6	1.5	5.2	中!文	E	a	1	11:11:11	2005
7	1.6	6.2	中!文	F	a	1	11:11:11	2006
8	1.7	7.2	中!文	G	a	1	11:11:11	2007
9	1.8	8.2	中!文	H	a	1	11:11:11	2011
10	1.9	9.2	中!文	I	a	1	11:11:11	2012
11	2	1.9	中!文	J	a	1	11:11:11	2011
12	2.1	1.8	中!文	K	a	1	11:11:11	2012
#新增、修改、删除基表列，对试图的影响
DROP VIEW IF EXISTS v1;
CREATE VIEW v1 AS SELECT t1.c0,t2.c2,t1.c3,t2.c4,t1.c5,t2.c6,t1.c7,t2.c8 FROM t1 JOIN t2 ON t1.c0=t2.c0;
SELECT * FROM v1 ORDER BY 1;
c0	c2	c3	c4	c5	c6	c7	c8
1	1.1	中文			0	11:11:11	2000
2	1.2	中!文	A	a	1	11:11:11	2001
3	2.2	中!文	B	a	1	11:11:11	2002
4	3.2	中!文	C	a	1	11:11:11	2003
5	4.2	中!文	D	a	1	11:11:11	2004
6	5.2	中!文	E	a	1	11:11:11	2005
7	6.2	中!文	F	a	1	11:11:11	2006
8	7.2	中!文	G	a	1	11:11:11	2007
9	8.2	中!文	H	a	1	11:11:11	2011
10	9.2	中!文	I	a	1	11:11:11	2012
11	1.9	中!文	J	a	1	11:11:11	2011
12	1.8	中!文	K	a	1	11:11:11	2012
DESC v1;
Field	Type	Null	Key	Default	Extra
c0	int(5)	NO		NULL	
c2	double	NO		NULL	
c3	char(10)	YES			
c4	varchar(10)	YES		NULL	
c5	char(10)	YES		NULL	
c6	int(11)	YES		NULL	
c7	time	YES		NULL	
c8	year(4)	YES		NULL	
UPDATE v1 SET c0=13,c6=10 WHERE c2=1.1;
UPDATE v1 SET c5='b',c3='中0文' WHERE c2=1.1;
SELECT * FROM v1 ORDER BY 1;
c0	c2	c3	c4	c5	c6	c7	c8
1	1.1	中0文		b	0	11:11:11	2000
2	1.2	中!文	A	a	1	11:11:11	2001
3	2.2	中!文	B	a	1	11:11:11	2002
4	3.2	中!文	C	a	1	11:11:11	2003
5	4.2	中!文	D	a	1	11:11:11	2004
6	5.2	中!文	E	a	1	11:11:11	2005
7	6.2	中!文	F	a	1	11:11:11	2006
8	7.2	中!文	G	a	1	11:11:11	2007
9	8.2	中!文	H	a	1	11:11:11	2011
10	9.2	中!文	I	a	1	11:11:11	2012
11	1.9	中!文	J	a	1	11:11:11	2011
12	1.8	中!文	K	a	1	11:11:11	2012
SELECT * FROM t1 ORDER BY 1;
c0	c1	c2	c3	c4	c5	c6	c7	c8
1	1	1.1	中0文		b	0	11:11:11	2000
2	1.1	1.2	中!文	A	a	1	11:11:11	2001
3	1.2	2.2	中!文	B	a	1	11:11:11	2002
4	1.3	3.2	中!文	C	a	1	11:11:11	2003
5	1.4	4.2	中!文	D	a	1	11:11:11	2004
6	1.5	5.2	中!文	E	a	1	11:11:11	2005
7	1.6	6.2	中!文	F	a	1	11:11:11	2006
8	1.7	7.2	中!文	G	a	1	11:11:11	2007
9	1.8	8.2	中!文	H	a	1	11:11:11	2011
10	1.9	9.2	中!文	I	a	1	11:11:11	2012
11	2	1.9	中!文	J	a	1	11:11:11	2011
12	2.1	1.8	中!文	K	a	1	11:11:11	2012
SELECT * FROM t2 ORDER BY 1;
c0	c1	c2	c3	c4	c5	c6	c7	c8
1	1	1.1	中文			0	11:11:11	2000
2	1.1	1.2	中!文	A	a	1	11:11:11	2001
3	1.2	2.2	中!文	B	a	1	11:11:11	2002
4	1.3	3.2	中!文	C	a	1	11:11:11	2003
5	1.4	4.2	中!文	D	a	1	11:11:11	2004
6	1.5	5.2	中!文	E	a	1	11:11:11	2005
7	1.6	6.2	中!文	F	a	1	11:11:11	2006
8	1.7	7.2	中!文	G	a	1	11:11:11	2007
9	1.8	8.2	中!文	H	a	1	11:11:11	2011
10	1.9	9.2	中!文	I	a	1	11:11:11	2012
11	2	1.9	中!文	J	a	1	11:11:11	2011
12	2.1	1.8	中!文	K	a	1	11:11:11	2012
DROP TABLE IF EXISTS t2;
DROP TABLE IF EXISTS t1;
DROP VIEW IF EXISTS v1;
#########Empty recycle bin, delete test database, tables, etc##########
purge recyclebin;
