#Environmental cleaning
drop user hjw@'%';
create user hjw identified by 'hjw';
grant all on *.* to hjw WITH GRANT OPTION;
DROP TABLE  t2;
DROP TABLE t1;
#mysql_drop-5
#TRIGGER
#CREATE DATA
CREATE TABLE t1(c0 INT(5) PRIMARY KEY,
c1 FLOAT ,
c2 DOUBLE NOT NULL,
c3 CHAR(10) DEFAULT 'A',
c4 VARCHAR(10) UNIQUE,
c5 CHAR(10),
c6 INT,
c7 TIME,
c8 YEAR ,CHECK(c8>=2000));
INSERT INTO t1 VALUES(1,1.0,1.1,'中文','','',0,'11:11:11','2000'),
(2,1.1,1.2,'中!文','A','a',1,'11:11:11','2001'),
(3,1.2,2.2,'中!文','B','a',1,'11:11:11','2002'),
(4,1.3,3.2,'中!文','C','a',1,'11:11:11','2003'),
(5,1.4,4.2,'中!文','D','a',1,'11:11:11','2004'),
(6,1.5,5.2,'中!文','E','a',1,'11:11:11','2005'),
(7,1.6,6.2,'中!文','F','a',1,'11:11:11','2006'),
(8,1.7,7.2,'中!文','G','a',1,'11:11:11','2007'),
(9,1.8,8.2,'中!文','H','a',1,'11:11:11','2011'),
(10,1.9,9.2,'中!文','I','a',1,'11:11:11','2012'),
(11,2.0,1.9,'中!文','J','a',1,'11:11:11','2011'),
(12,2.1,1.8,'中!文','K','a',1,'11:11:11','2012');
CREATE TABLE t2(c0 INT(4),
c1 FLOAT UNIQUE,
c2 DOUBLE,
c3 CHAR(10),
c4 VARCHAR(5),
c5 INT,
c6 TIME,
CONSTRAINT fk_c0_c0 FOREIGN KEY(c0) REFERENCES t1(c0));
INSERT INTO t2 VALUES(1,1.0,1.1,'中文','',0,'11:11:11'),
(2,1.1,1.2,'中!文','a',1,'11:11:11'),
(3,1.2,2.2,'中!文','a',1,'11:11:11'),
(4,1.3,3.2,'中!文','a',1,'11:11:11'),
(5,1.4,4.2,'中!文','a',1,'11:11:11');
#创建trigger后，删除引用列，然后触发trigger执行
#insert型触发器
DROP TRIGGER  trg_insert;
CREATE TRIGGER trg_insert AFTER INSERT ON t2
FOR EACH ROW
BEGIN
DECLARE a VARCHAR(10);
SET a=CONCAT(NEW.c4,'A');
INSERT INTO t1(c0,c1,c2,c4,c5,c6,c7,c8) VALUES(NEW.c0+10,NEW.c1,NEW.c2,a,NEW.c5,NEW.c6,'12:12:12','2020');
END
//
#删除非引用列
ALTER TABLE t2 DROP c3;
INSERT INTO t2 VALUES(6,1.5,5.2,'a',1,'11:11:11');
SELECT * FROM t1 ORDER BY 1;
c0	c1	c2	c3	c4	c5	c6	c7	c8
1	1	1.1	中文			0	11:11:11	2000
2	1.1	1.2	中!文	A	a	1	11:11:11	2001
3	1.2	2.2	中!文	B	a	1	11:11:11	2002
4	1.3	3.2	中!文	C	a	1	11:11:11	2003
5	1.4	4.2	中!文	D	a	1	11:11:11	2004
6	1.5	5.2	中!文	E	a	1	11:11:11	2005
7	1.6	6.2	中!文	F	a	1	11:11:11	2006
8	1.7	7.2	中!文	G	a	1	11:11:11	2007
9	1.8	8.2	中!文	H	a	1	11:11:11	2011
10	1.9	9.2	中!文	I	a	1	11:11:11	2012
11	2	1.9	中!文	J	a	1	11:11:11	2011
12	2.1	1.8	中!文	K	a	1	11:11:11	2012
16	1.5	5.2	A	aA	1	111111	12:12:12	2020
SELECT * FROM t2 ORDER BY 1;
c0	c1	c2	c4	c5	c6
1	1	1.1		0	11:11:11
2	1.1	1.2	a	1	11:11:11
3	1.2	2.2	a	1	11:11:11
4	1.3	3.2	a	1	11:11:11
5	1.4	4.2	a	1	11:11:11
6	1.5	5.2	a	1	11:11:11
#删除引用列
ALTER TABLE t2 DROP c2;
INSERT INTO t2 VALUES(7,1.6,'b',2,'12:12:12');
#重新创建触发器
DROP TRIGGER  trg_insert;
CREATE TRIGGER trg_insert AFTER INSERT ON t2
FOR EACH ROW
BEGIN
DECLARE a VARCHAR(10);
SET a=CONCAT(NEW.c4,'A');
INSERT INTO t1(c0,c1,c2,c4,c5,c6,c7,c8) VALUES(NEW.c0+10,NEW.c1,0,a,NEW.c5,NEW.c6,'12:12:12','2020');
END
//
INSERT INTO t2 VALUES(7,1.6,'b',2,'12:12:12');
SELECT * FROM t1 ORDER BY 1;
c0	c1	c2	c3	c4	c5	c6	c7	c8
1	1	1.1	中文			0	11:11:11	2000
2	1.1	1.2	中!文	A	a	1	11:11:11	2001
3	1.2	2.2	中!文	B	a	1	11:11:11	2002
4	1.3	3.2	中!文	C	a	1	11:11:11	2003
5	1.4	4.2	中!文	D	a	1	11:11:11	2004
6	1.5	5.2	中!文	E	a	1	11:11:11	2005
7	1.6	6.2	中!文	F	a	1	11:11:11	2006
8	1.7	7.2	中!文	G	a	1	11:11:11	2007
9	1.8	8.2	中!文	H	a	1	11:11:11	2011
10	1.9	9.2	中!文	I	a	1	11:11:11	2012
11	2	1.9	中!文	J	a	1	11:11:11	2011
12	2.1	1.8	中!文	K	a	1	11:11:11	2012
16	1.5	5.2	A	aA	1	111111	12:12:12	2020
17	1.6	0	A	bA	2	121212	12:12:12	2020
SELECT * FROM t2 ORDER BY 1;
c0	c1	c4	c5	c6
1	1		0	11:11:11
2	1.1	a	1	11:11:11
3	1.2	a	1	11:11:11
4	1.3	a	1	11:11:11
5	1.4	a	1	11:11:11
6	1.5	a	1	11:11:11
7	1.6	b	2	12:12:12
ALTER TABLE t1 DROP c1;
DESC t1;
Field	Type	Null	Key	Default	Extra
c0	int(5)	NO	PRI	NULL	
c2	double	NO		NULL	
c3	char(10)	YES		A	
c4	varchar(10)	YES	UNI	NULL	
c5	char(10)	YES		NULL	
c6	int(11)	YES		NULL	
c7	time	YES		NULL	
c8	year(4)	YES		NULL	
INSERT INTO t2 VALUES(8,1.7,'c',3,'13:13:13');
SELECT * FROM t1 ORDER BY 1;
c0	c2	c3	c4	c5	c6	c7	c8
1	1.1	中文			0	11:11:11	2000
2	1.2	中!文	A	a	1	11:11:11	2001
3	2.2	中!文	B	a	1	11:11:11	2002
4	3.2	中!文	C	a	1	11:11:11	2003
5	4.2	中!文	D	a	1	11:11:11	2004
6	5.2	中!文	E	a	1	11:11:11	2005
7	6.2	中!文	F	a	1	11:11:11	2006
8	7.2	中!文	G	a	1	11:11:11	2007
9	8.2	中!文	H	a	1	11:11:11	2011
10	9.2	中!文	I	a	1	11:11:11	2012
11	1.9	中!文	J	a	1	11:11:11	2011
12	1.8	中!文	K	a	1	11:11:11	2012
16	5.2	A	aA	1	111111	12:12:12	2020
17	0	A	bA	2	121212	12:12:12	2020
SELECT * FROM t2 ORDER BY 1;
c0	c1	c4	c5	c6
1	1		0	11:11:11
2	1.1	a	1	11:11:11
3	1.2	a	1	11:11:11
4	1.3	a	1	11:11:11
5	1.4	a	1	11:11:11
6	1.5	a	1	11:11:11
7	1.6	b	2	12:12:12
#update型触发器
DROP TABLE  t2;
DROP TABLE  t1;
CREATE TABLE t1(c0 INT(5) PRIMARY KEY,
c1 FLOAT ,
c2 DOUBLE NOT NULL,
c3 CHAR(10) DEFAULT 'A',
c4 VARCHAR(10) UNIQUE,
c5 CHAR(10),
c6 INT,
c7 TIME,
c8 YEAR ,CHECK(c8>=2000));
INSERT INTO t1 VALUES(1,1.0,1.1,'中文','','',0,'11:11:11','2000'),
(2,1.1,1.2,'中!文','A','a',1,'11:11:11','2001'),
(3,1.2,2.2,'中!文','B','a',2,'11:11:11','2002'),
(4,1.3,3.2,'中!文','C','a',3,'11:11:11','2003'),
(5,1.4,4.2,'中!文','D','a',4,'11:11:11','2004'),
(6,1.5,5.2,'中!文','E','a',5,'11:11:11','2005'),
(7,1.6,6.2,'中!文','F','a',6,'11:11:11','2006'),
(8,1.7,7.2,'中!文','G','a',7,'11:11:11','2007'),
(9,1.8,8.2,'中!文','H','a',8,'11:11:11','2011'),
(10,1.9,9.2,'中!文','I','a',9,'11:11:11','2012'),
(11,2.0,1.9,'中!文','J','a',10,'11:11:11','2011'),
(12,2.1,1.8,'中!文','K','a',11,'11:11:11','2012');
CREATE TABLE t2(c0 INT(4),
c1 FLOAT UNIQUE,
c2 DOUBLE,
c3 CHAR(10),
c4 VARCHAR(5),
c5 INT,
c6 TIME,
CONSTRAINT fk_c0_c0 FOREIGN KEY(c0) REFERENCES t1(c0));
INSERT INTO t2 VALUES(1,1.0,1.1,'中文','',0,'11:11:11'),
(2,1.1,1.2,'中!文','a',1,'11:11:11'),
(3,1.2,2.2,'中!文','a',2,'11:11:11'),
(4,1.3,3.2,'中!文','a',3,'11:11:11'),
(5,1.4,4.2,'中!文','a',4,'11:11:11');
DROP TRIGGER  trg_update;
CREATE TRIGGER trg_update BEFORE UPDATE ON t2
FOR EACH ROW
BEGIN
UPDATE t1 SET c1=NEW.c1,c2=NEW.c2,c4=CONCAT(NEW.c4,'A'),c7=NEW.c6 WHERE c6=NEW.c5; 
END
//
#删除非引用列
ALTER TABLE t2 DROP c3;
UPDATE t2 SET c1=1.5,c2=5.2,c4='b',c5=1,c6='12:12:12' WHERE c0=1;
SELECT * FROM t1 ORDER BY 1;
c0	c1	c2	c3	c4	c5	c6	c7	c8
1	1	1.1	中文			0	11:11:11	2000
2	1.5	5.2	中!文	bA	a	1	12:12:12	2001
3	1.2	2.2	中!文	B	a	2	11:11:11	2002
4	1.3	3.2	中!文	C	a	3	11:11:11	2003
5	1.4	4.2	中!文	D	a	4	11:11:11	2004
6	1.5	5.2	中!文	E	a	5	11:11:11	2005
7	1.6	6.2	中!文	F	a	6	11:11:11	2006
8	1.7	7.2	中!文	G	a	7	11:11:11	2007
9	1.8	8.2	中!文	H	a	8	11:11:11	2011
10	1.9	9.2	中!文	I	a	9	11:11:11	2012
11	2	1.9	中!文	J	a	10	11:11:11	2011
12	2.1	1.8	中!文	K	a	11	11:11:11	2012
SELECT * FROM t2 ORDER BY 1;
c0	c1	c2	c4	c5	c6
1	1.5	5.2	b	1	12:12:12
2	1.1	1.2	a	1	11:11:11
3	1.2	2.2	a	2	11:11:11
4	1.3	3.2	a	3	11:11:11
5	1.4	4.2	a	4	11:11:11
#删除引用列
ALTER TABLE t2 DROP c2;
UPDATE t2 SET c1=1.6,c4='c',c5=2,c6='13:13:13' WHERE c0=1;
SELECT * FROM t1 ORDER BY 1;
c0	c1	c2	c3	c4	c5	c6	c7	c8
1	1	1.1	中文			0	11:11:11	2000
2	1.5	5.2	中!文	bA	a	1	12:12:12	2001
3	1.2	2.2	中!文	B	a	2	11:11:11	2002
4	1.3	3.2	中!文	C	a	3	11:11:11	2003
5	1.4	4.2	中!文	D	a	4	11:11:11	2004
6	1.5	5.2	中!文	E	a	5	11:11:11	2005
7	1.6	6.2	中!文	F	a	6	11:11:11	2006
8	1.7	7.2	中!文	G	a	7	11:11:11	2007
9	1.8	8.2	中!文	H	a	8	11:11:11	2011
10	1.9	9.2	中!文	I	a	9	11:11:11	2012
11	2	1.9	中!文	J	a	10	11:11:11	2011
12	2.1	1.8	中!文	K	a	11	11:11:11	2012
SELECT * FROM t2 ORDER BY 1;
c0	c1	c4	c5	c6
1	1.5	b	1	12:12:12
2	1.1	a	1	11:11:11
3	1.2	a	2	11:11:11
4	1.3	a	3	11:11:11
5	1.4	a	4	11:11:11
#重新创建触发器
DROP TRIGGER  trg_update;
CREATE TRIGGER trg_update BEFORE UPDATE ON t2
FOR EACH ROW
BEGIN
UPDATE t1 SET c1=NEW.c1,c2=NEW.c1+1.1,c4=CONCAT(NEW.c4,'A'),c7=NEW.c6 WHERE c6=NEW.c5; 
END
//
UPDATE t2 SET c1=1.6,c4='c',c5=2,c6='13:13:13' WHERE c0=1;
SELECT * FROM t1 ORDER BY 1;
c0	c1	c2	c3	c4	c5	c6	c7	c8
1	1	1.1	中文			0	11:11:11	2000
2	1.5	5.2	中!文	bA	a	1	12:12:12	2001
3	1.6	2.700000023841858	中!文	cA	a	2	13:13:13	2002
4	1.3	3.2	中!文	C	a	3	11:11:11	2003
5	1.4	4.2	中!文	D	a	4	11:11:11	2004
6	1.5	5.2	中!文	E	a	5	11:11:11	2005
7	1.6	6.2	中!文	F	a	6	11:11:11	2006
8	1.7	7.2	中!文	G	a	7	11:11:11	2007
9	1.8	8.2	中!文	H	a	8	11:11:11	2011
10	1.9	9.2	中!文	I	a	9	11:11:11	2012
11	2	1.9	中!文	J	a	10	11:11:11	2011
12	2.1	1.8	中!文	K	a	11	11:11:11	2012
SELECT * FROM t2 ORDER BY 1;
c0	c1	c4	c5	c6
1	1.6	c	2	13:13:13
2	1.1	a	1	11:11:11
3	1.2	a	2	11:11:11
4	1.3	a	3	11:11:11
5	1.4	a	4	11:11:11
ALTER TABLE t1 DROP c2;
DESC t1;
Field	Type	Null	Key	Default	Extra
c0	int(5)	NO	PRI	NULL	
c1	float	YES		NULL	
c3	char(10)	YES		A	
c4	varchar(10)	YES	UNI	NULL	
c5	char(10)	YES		NULL	
c6	int(11)	YES		NULL	
c7	time	YES		NULL	
c8	year(4)	YES		NULL	
UPDATE t2 SET c1=1.7,c4='d',c5=3,c6='14:14:14' WHERE c0=2;
SELECT * FROM t1 ORDER BY 1;
c0	c1	c3	c4	c5	c6	c7	c8
1	1	中文			0	11:11:11	2000
2	1.5	中!文	bA	a	1	12:12:12	2001
3	1.6	中!文	cA	a	2	13:13:13	2002
4	1.3	中!文	C	a	3	11:11:11	2003
5	1.4	中!文	D	a	4	11:11:11	2004
6	1.5	中!文	E	a	5	11:11:11	2005
7	1.6	中!文	F	a	6	11:11:11	2006
8	1.7	中!文	G	a	7	11:11:11	2007
9	1.8	中!文	H	a	8	11:11:11	2011
10	1.9	中!文	I	a	9	11:11:11	2012
11	2	中!文	J	a	10	11:11:11	2011
12	2.1	中!文	K	a	11	11:11:11	2012
SELECT * FROM t2 ORDER BY 1;
c0	c1	c4	c5	c6
1	1.6	c	2	13:13:13
2	1.1	a	1	11:11:11
3	1.2	a	2	11:11:11
4	1.3	a	3	11:11:11
5	1.4	a	4	11:11:11
#重新创建触发器
DROP TRIGGER  trg_update;
CREATE TRIGGER trg_update BEFORE UPDATE ON t2
FOR EACH ROW
BEGIN
UPDATE t1 SET c1=NEW.c1,c4=CONCAT(NEW.c4,'A'),c7=NEW.c6 WHERE c6=NEW.c5; 
END
//
UPDATE t2 SET c1=1.7,c4='d',c5=3,c6='14:14:14' WHERE c0=2;
SELECT * FROM t1 ORDER BY 1;
c0	c1	c3	c4	c5	c6	c7	c8
1	1	中文			0	11:11:11	2000
2	1.5	中!文	bA	a	1	12:12:12	2001
3	1.6	中!文	cA	a	2	13:13:13	2002
4	1.7	中!文	dA	a	3	14:14:14	2003
5	1.4	中!文	D	a	4	11:11:11	2004
6	1.5	中!文	E	a	5	11:11:11	2005
7	1.6	中!文	F	a	6	11:11:11	2006
8	1.7	中!文	G	a	7	11:11:11	2007
9	1.8	中!文	H	a	8	11:11:11	2011
10	1.9	中!文	I	a	9	11:11:11	2012
11	2	中!文	J	a	10	11:11:11	2011
12	2.1	中!文	K	a	11	11:11:11	2012
SELECT * FROM t2 ORDER BY 1;
c0	c1	c4	c5	c6
1	1.6	c	2	13:13:13
2	1.7	d	3	14:14:14
3	1.2	a	2	11:11:11
4	1.3	a	3	11:11:11
5	1.4	a	4	11:11:11
#delete型触发器
DROP TABLE  t2;
DROP TABLE  t1;
CREATE TABLE t1(c0 INT(5) PRIMARY KEY,
c1 FLOAT ,
c2 DOUBLE NOT NULL,
c3 CHAR(10) DEFAULT 'A',
c4 VARCHAR(10) UNIQUE,
c5 CHAR(10),
c6 INT,
c7 TIME,
c8 YEAR ,CHECK(c8>=2000));
INSERT INTO t1 VALUES(1,1.0,1.1,'中文','','',0,'11:11:11','2000'),
(2,1.1,1.2,'中!文','A','a',1,'11:11:11','2001'),
(3,1.2,2.2,'中!文','B','a',2,'11:11:11','2002'),
(4,1.3,3.2,'中!文','C','a',3,'11:11:11','2003'),
(5,1.4,4.2,'中!文','D','a',4,'11:11:11','2004'),
(6,1.5,5.2,'中!文','E','a',5,'11:11:11','2005'),
(7,1.6,6.2,'中!文','F','a',6,'11:11:11','2006'),
(8,1.7,7.2,'中!文','G','a',7,'11:11:11','2007'),
(9,1.8,8.2,'中!文','H','a',8,'11:11:11','2011'),
(10,1.9,9.2,'中!文','I','a',9,'11:11:11','2012'),
(11,2.0,1.9,'中!文','J','a',10,'11:11:11','2011'),
(12,2.1,1.8,'中!文','K','a',11,'11:11:11','2012');
CREATE TABLE t2(c0 INT(4),
c1 FLOAT,
c2 DOUBLE,
c3 CHAR(10),
c4 VARCHAR(5),
c5 INT,
c6 TIME,
CONSTRAINT fk_c0_c0 FOREIGN KEY(c0) REFERENCES t1(c0));
INSERT INTO t2 VALUES(1,1.0,1.1,'中文','',0,'11:11:11'),
(2,1.1,1.2,'中!文','a',1,'11:11:11'),
(3,1.2,2.2,'中!文','a',2,'11:11:11'),
(4,1.3,3.2,'中!文','a',3,'11:11:11'),
(5,1.4,4.2,'中!文','a',4,'11:11:11');
DROP TRIGGER  trg_delete;
CREATE TRIGGER trg_delete AFTER DELETE ON t2
FOR EACH ROW
BEGIN
DELETE FROM t1 WHERE c1=OLD.c1 OR c2=OLD.c2;
END
//
#删除非引用列
ALTER TABLE t2 DROP c3;
DELETE FROM t2 WHERE c3='中文';
DELETE FROM t2 WHERE c5=1;
SELECT * FROM t1 ORDER BY 1;
c0	c1	c2	c3	c4	c5	c6	c7	c8
1	1	1.1	中文			0	11:11:11	2000
3	1.2	2.2	中!文	B	a	2	11:11:11	2002
4	1.3	3.2	中!文	C	a	3	11:11:11	2003
5	1.4	4.2	中!文	D	a	4	11:11:11	2004
6	1.5	5.2	中!文	E	a	5	11:11:11	2005
7	1.6	6.2	中!文	F	a	6	11:11:11	2006
8	1.7	7.2	中!文	G	a	7	11:11:11	2007
9	1.8	8.2	中!文	H	a	8	11:11:11	2011
10	1.9	9.2	中!文	I	a	9	11:11:11	2012
11	2	1.9	中!文	J	a	10	11:11:11	2011
12	2.1	1.8	中!文	K	a	11	11:11:11	2012
SELECT * FROM t2 ORDER BY 1;
c0	c1	c2	c4	c5	c6
1	1	1.1		0	11:11:11
3	1.2	2.2	a	2	11:11:11
4	1.3	3.2	a	3	11:11:11
5	1.4	4.2	a	4	11:11:11
DELETE FROM t2 WHERE c1 LIKE '1.2%';
SELECT * FROM t1 ORDER BY 1;
c0	c1	c2	c3	c4	c5	c6	c7	c8
1	1	1.1	中文			0	11:11:11	2000
4	1.3	3.2	中!文	C	a	3	11:11:11	2003
5	1.4	4.2	中!文	D	a	4	11:11:11	2004
6	1.5	5.2	中!文	E	a	5	11:11:11	2005
7	1.6	6.2	中!文	F	a	6	11:11:11	2006
8	1.7	7.2	中!文	G	a	7	11:11:11	2007
9	1.8	8.2	中!文	H	a	8	11:11:11	2011
10	1.9	9.2	中!文	I	a	9	11:11:11	2012
11	2	1.9	中!文	J	a	10	11:11:11	2011
12	2.1	1.8	中!文	K	a	11	11:11:11	2012
SELECT * FROM t2 ORDER BY 1;
c0	c1	c2	c4	c5	c6
1	1	1.1		0	11:11:11
4	1.3	3.2	a	3	11:11:11
5	1.4	4.2	a	4	11:11:11
ALTER TABLE t2 DROP c1,DROP c2;
DELETE FROM t2 WHERE c5=0;
SELECT * FROM t1 ORDER BY 1;
c0	c1	c2	c3	c4	c5	c6	c7	c8
1	1	1.1	中文			0	11:11:11	2000
4	1.3	3.2	中!文	C	a	3	11:11:11	2003
5	1.4	4.2	中!文	D	a	4	11:11:11	2004
6	1.5	5.2	中!文	E	a	5	11:11:11	2005
7	1.6	6.2	中!文	F	a	6	11:11:11	2006
8	1.7	7.2	中!文	G	a	7	11:11:11	2007
9	1.8	8.2	中!文	H	a	8	11:11:11	2011
10	1.9	9.2	中!文	I	a	9	11:11:11	2012
11	2	1.9	中!文	J	a	10	11:11:11	2011
12	2.1	1.8	中!文	K	a	11	11:11:11	2012
SELECT * FROM t2 ORDER BY 1;
c0	c4	c5	c6
1		0	11:11:11
4	a	3	11:11:11
5	a	4	11:11:11
DROP TABLE  t2;
DROP TABLE  t1;
CREATE TABLE t1(c0 INT(5) PRIMARY KEY,
c1 FLOAT ,
c2 DOUBLE NOT NULL,
c3 CHAR(10) DEFAULT 'A',
c4 VARCHAR(10) UNIQUE,
c5 CHAR(10),
c6 INT,
c7 TIME,
c8 YEAR ,CHECK(c8>=2000));
INSERT INTO t1 VALUES(1,1.0,1.1,'中文','','',0,'11:11:11','2000'),
(2,1.1,1.2,'中!文','A','a',1,'11:11:11','2001'),
(3,1.2,2.2,'中!文','B','a',2,'11:11:11','2002'),
(4,1.3,3.2,'中!文','C','a',3,'11:11:11','2003'),
(5,1.4,4.2,'中!文','D','a',4,'11:11:11','2004'),
(6,1.5,5.2,'中!文','E','a',5,'11:11:11','2005'),
(7,1.6,6.2,'中!文','F','a',6,'11:11:11','2006'),
(8,1.7,7.2,'中!文','G','a',7,'11:11:11','2007'),
(9,1.8,8.2,'中!文','H','a',8,'11:11:11','2011'),
(10,1.9,9.2,'中!文','I','a',9,'11:11:11','2012'),
(11,2.0,1.9,'中!文','J','a',10,'11:11:11','2011'),
(12,2.1,1.8,'中!文','K','a',11,'11:11:11','2012');
CREATE TABLE t2(c0 INT(4),
c1 FLOAT,
c2 DOUBLE,
c3 CHAR(10),
c4 VARCHAR(5),
c5 INT,
c6 TIME,
CONSTRAINT fk_c0_c0 FOREIGN KEY(c0) REFERENCES t1(c0));
INSERT INTO t2 VALUES(1,1.0,1.1,'中文','',0,'11:11:11'),
(2,1.1,1.2,'中!文','a',1,'11:11:11'),
(3,1.2,2.2,'中!文','a',2,'11:11:11'),
(4,1.3,3.2,'中!文','a',3,'11:11:11'),
(5,1.4,4.2,'中!文','a',4,'11:11:11');
DROP TRIGGER  trg_delete;
CREATE TRIGGER trg_delete AFTER DELETE ON t2
FOR EACH ROW
BEGIN
DELETE FROM t1 WHERE c1=OLD.c1 OR c2=OLD.c2;
END
//
ALTER TABLE t1 DROP c1;
DELETE FROM t2 WHERE c2=1.1;
#创建trigger时添加删除列，然后触发trigger执行
DROP TABLE  t2;
DROP TABLE  t1;
CREATE TABLE t1(c0 INT(5) PRIMARY KEY,
c1 FLOAT ,
c2 DOUBLE NOT NULL,
c3 CHAR(10) DEFAULT 'A',
c4 VARCHAR(10) UNIQUE,
c5 CHAR(10),
c6 INT,
c7 TIME,
c8 YEAR ,CHECK(c8>=2000));
INSERT INTO t1 VALUES(1,1.0,1.1,'中文','','',0,'11:11:11','2000'),
(2,1.1,1.2,'中!文','A','a',1,'11:11:11','2001'),
(3,1.2,2.2,'中!文','B','a',2,'11:11:11','2002'),
(4,1.3,3.2,'中!文','C','a',3,'11:11:11','2003'),
(5,1.4,4.2,'中!文','D','a',4,'11:11:11','2004'),
(6,1.5,5.2,'中!文','E','a',5,'11:11:11','2005'),
(7,1.6,6.2,'中!文','F','a',6,'11:11:11','2006'),
(8,1.7,7.2,'中!文','G','a',7,'11:11:11','2007'),
(9,1.8,8.2,'中!文','H','a',8,'11:11:11','2011'),
(10,1.9,9.2,'中!文','I','a',9,'11:11:11','2012'),
(11,2.0,1.9,'中!文','J','a',10,'11:11:11','2011'),
(12,2.1,1.8,'中!文','K','a',11,'11:11:11','2012');
CREATE TABLE t2(c0 INT(4),
c1 FLOAT,
c2 DOUBLE,
c3 CHAR(10),
c4 VARCHAR(5),
c5 INT,
c6 TIME,
CONSTRAINT fk_c0_c0 FOREIGN KEY(c0) REFERENCES t1(c0));
INSERT INTO t2 VALUES(1,1.0,1.1,'中文','',0,'11:11:11'),
(2,1.1,1.2,'中!文','a',1,'11:11:11'),
(3,1.2,2.2,'中!文','a',2,'11:11:11'),
(4,1.3,3.2,'中!文','a',3,'11:11:11'),
(5,1.4,4.2,'中!文','a',4,'11:11:11');
#DELETE型触发器
DROP TRIGGER  trg_delete;
CREATE TRIGGER trg_delete AFTER DELETE ON t2
FOR EACH ROW
BEGIN
ALTER TABLE t1 DROP c1;
END
//
#UPDATE型触发器
DROP TRIGGER  trg_update;
//
CREATE TRIGGER trg_update AFTER UPDATE ON t2
FOR EACH ROW
BEGIN
ALTER TABLE t1 DROP c1;
END
//
#INSERT型触发器
DROP TRIGGER  trg_insert;
//
CREATE TRIGGER trg_insert AFTER INSERT ON t2
FOR EACH ROW
BEGIN
ALTER TABLE t1 DROP c1;
END
//
DROP TABLE  t2;
DROP TABLE  t1;
# Clean up users
drop user hjw@'%' ;
