drop table if exists test, t1;
create table test(c1 int primary key, c2 int, c3 int);
affected rows: 0
affected rows: 0
affected rows: 0
replace into test values(1,2,3), (2,3,4), (1,2,5), (2,4,6);
affected rows: 6
info: Records: 4  Duplicates: 2  Warnings: 0
select * from test;
c1	c2	c3
1	2	5
2	4	6
affected rows: 2
replace into test values(3,4,5),(4,5,6),(3,6,2),(3,5,2),(3,4,1);
affected rows: 8
info: Records: 5  Duplicates: 3  Warnings: 0
select * from test;
c1	c2	c3
1	2	5
2	4	6
3	4	1
4	5	6
affected rows: 4
insert into test values(1,2,3),(1,4,2),(1,3,2) on duplicate key update c3 = c3 + 1;
affected rows: 6
info: Records: 3  Duplicates: 3  Warnings: 0
select * from test;
c1	c2	c3
1	2	8
2	4	6
3	4	1
4	5	6
affected rows: 4
drop table test;
affected rows: 0
create table test(c1 int primary key, c2 int unique key, c3 int);
affected rows: 0
affected rows: 0
affected rows: 0
replace into test values(1,2,3), (2,3,4), (1,2,5), (2,4,6), (2,4,7);
affected rows: 8
info: Records: 5  Duplicates: 3  Warnings: 0
select * from test;
c1	c2	c3
1	2	5
2	4	7
affected rows: 2
replace into test values(3,4,5),(4,5,6),(3,6,2),(3,5,2),(3,4,1);
affected rows: 10
info: Records: 5  Duplicates: 5  Warnings: 0
select * from test;
c1	c2	c3
1	2	5
3	4	1
affected rows: 2
insert into test values(1,2,3),(1,4,2),(1,3,2) on duplicate key update c3 = c3 + 1;
affected rows: 6
info: Records: 3  Duplicates: 3  Warnings: 0
select * from test;
c1	c2	c3
1	2	8
3	4	1
affected rows: 2
drop table test;
affected rows: 0
create table test(c1 int primary key, c2 int);
affected rows: 0
affected rows: 0
affected rows: 0
insert into test values(1,2), (2,3),(4,2);
affected rows: 3
info: Records: 3  Duplicates: 0  Warnings: 0
update test set c1 = c1 + 1 where c1 in (1,2,3,4) limit 2;
ERROR 23000: Duplicate entry '2' for key 'PRIMARY'
select 8 from test;
8
8
8
8
affected rows: 3
drop table test;
affected rows: 0
create table t1 (c1 int primary key);
affected rows: 0
affected rows: 0
affected rows: 0
insert into t1 values(-100),(6),(10);
affected rows: 3
info: Records: 3  Duplicates: 0  Warnings: 0
select * from t1 where c1 in (-100,5,6,10) limit 2;
c1
-100
6
affected rows: 2
update t1 set c1 = 5 where c1 in (-100,5,6,10) limit 2;
ERROR 23000: Duplicate entry '5' for key 'PRIMARY'
drop table t1;
affected rows: 0
