drop table if exists t1,t2,t3,t4;
drop table if exists t1;
CREATE TABLE t1 (a INT PRIMARY KEY, b INT NOT NULL);
INSERT INTO t1 (a) VALUES (1);
ERROR HY000: Field 'b' doesn't have a default value
INSERT INTO t1 (a) VALUES (1) ON DUPLICATE KEY UPDATE a = b;
ERROR HY000: Field 'b' doesn't have a default value
drop table t1;
create table t1(pk1 int, pk2 int, pk3 int default 0, primary key(pk1,pk2), extra int);
insert /*agadgafdgafdghfdhggh*/ into t1(pk1,pk2) values(0,1),(-1,0);
insert into t1(pk1,pk2) values(1,2),(2,3);
insert into t1(pk2,pk1) values(4,3),(5,4);
select * from t1;
pk1	pk2	pk3	extra
-1	0	0	NULL
0	1	0	NULL
1	2	0	NULL
2	3	0	NULL
3	4	0	NULL
4	5	0	NULL
select pk2,pk1 from t1;
pk2	pk1
0	-1
1	0
2	1
3	2
4	3
5	4
drop table t1;
create table t1(pk1 int primary key, a int);
insert into t1 values(0,1),(-1,0);
insert into t1(pk1,a) values(1,2),(2,3);
insert into t1(a,pk1) values(4,3),(5,4);
select * from t1;
pk1	a
-1	0
0	1
1	2
2	3
3	4
4	5
select a,pk1 from t1;
a	pk1
0	-1
1	0
2	1
3	2
4	3
5	4
drop table t1;
create table t1(pk1 int, pk2 int, primary key(pk1,pk2), extra int);
insert into t1(pk1,pk2) values(0,1),(-1,0),(3,1),(4,0),(5,1),(6,0);
insert into t1(pk1,pk2) values(1,2),(2,3),(7,1),(8,0),(9,1),(10,0);
create table t2(pk1 int, pk2 int, primary key(pk1,pk2), extra int);
insert into t2 select * from t1;
select * from (select * from t1) as tmp1 where pk1>0;
pk1	pk2	extra
1	2	NULL
2	3	NULL
3	1	NULL
4	0	NULL
5	1	NULL
6	0	NULL
7	1	NULL
8	0	NULL
9	1	NULL
10	0	NULL
select * from t1;
pk1	pk2	extra
-1	0	NULL
0	1	NULL
1	2	NULL
2	3	NULL
3	1	NULL
4	0	NULL
5	1	NULL
6	0	NULL
7	1	NULL
8	0	NULL
9	1	NULL
10	0	NULL
select * from t1 where pk1>0 limit 1,10;
pk1	pk2	extra
2	3	NULL
3	1	NULL
4	0	NULL
5	1	NULL
6	0	NULL
7	1	NULL
8	0	NULL
9	1	NULL
10	0	NULL
select * from t1 where pk1>0 limit 3,10;
pk1	pk2	extra
4	0	NULL
5	1	NULL
6	0	NULL
7	1	NULL
8	0	NULL
9	1	NULL
10	0	NULL
select * from (select * from t1) tt1;
pk1	pk2	extra
-1	0	NULL
0	1	NULL
1	2	NULL
2	3	NULL
3	1	NULL
4	0	NULL
5	1	NULL
6	0	NULL
7	1	NULL
8	0	NULL
9	1	NULL
10	0	NULL
delete from t1 where pk2=3 and pk1=2;
drop table t1;
create table t1(c1 int primary key, c2 datetime default now(), c3 datetime default now());
desc t1;
Field	Type	Null	Key	Default	Extra
c1	int(11)	NO	PRI	NULL	
c2	datetime	YES		CURRENT_TIMESTAMP	
c3	datetime	YES		CURRENT_TIMESTAMP	
insert into t1 values(1, now(), now());
drop table if exists t1,t2;
CREATE TABLE t1(a BIGINT primary key);
INSERT INTO t1 VALUES (0xFFFFFFFFFFFFF);
INSERT INTO t1 VALUES (0xF);
select * from t1;
a
15
4503599627370495
SELECT * FROM t1 WHERE a=-1 OR a=-2 OR a=16;
a
SELECT * FROM t1 WHERE a in (-1,-2,16);
a
CREATE TABLE t2(a int primary key);
INSERT INTO t2 VALUES (0xF1);
INSERT INTO t2 VALUES (0x01);
select * from t2;
a
1
241
select * from t2 where a=1;
a
1
select * from t2 where a in (1);
a
1
drop table if exists test, tt;
create table test (c1 int ,c2 int, c3 int);
insert into test values(1,c1+1,c1+2);
insert into test values(2,c1+1,c3+2);
insert into test values(4,c1+1,c2+2);
select * from test;
c1	c2	c3
1	2	3
2	3	NULL
4	5	7
insert into test set c1 = 32, c3 = c1+ c2;
insert into test set c1 = 22, c3 = c1+ 2;
select * from test;
c1	c2	c3
1	2	3
2	3	NULL
4	5	7
32	NULL	NULL
22	NULL	24
drop table if exists test, tt;
create table test (c1 int ,c2 int, c3 varchar(4));
insert into test values(1,2,c1+c2);
insert into test (c3,c1,c2) values('1', c3+1,c2+c3);
select * from test;
c1	c2	c3
1	2	3
2	NULL	1
drop table if exists test, tt;
create table test(c1 int, c2 int, c3 int, c4 char(14) default 'nihao' primary key) partition by key(c4) partitions 4;
insert into test values(1,2,3, 'damdam');
insert into test(c1,c2,c3) values(10,2,3);
select * from test partition(p0);
c1	c2	c3	c4
select * from test partition(p1);
c1	c2	c3	c4
1	2	3	damdam
10	2	3	nihao
select * from test partition(p2);
c1	c2	c3	c4
select * from test partition(p3);
c1	c2	c3	c4
create table tt(c1 int,c2 int, c3 int);
insert into tt values(4,5,6);
insert into test(c1,c2,c3) select * from tt;
ERROR 0A000: Insert data cross partition not supported
select * from test partition(p3);
c1	c2	c3	c4
drop table test;
create table test (c1 int, c2 int, c3 int, c4 int default 5 primary key) partition by hash(c4) partitions 3;
insert into test(c1,c2,c3) select * from tt;
ERROR 0A000: Insert data cross partition not supported
insert into test values(1,2,3,6);
insert into test values(3,2,2,c1+2);
insert into test set c1 = 4, c4 = c1 + 3;
insert into test values(5,2,3,17);
insert into test values(10, c1+3, c2+3, c3+5);
insert into test values(6,2,3,212);
select * from test partition(p0);
c1	c2	c3	c4
1	2	3	6
10	13	16	21
select * from test partition(p1);
c1	c2	c3	c4
4	NULL	NULL	7
select * from test partition(p2);
c1	c2	c3	c4
3	2	2	5
5	2	3	17
6	2	3	212
drop table test;
create table test(c1 int primary key, c2 int, c3 int);
insert into test set c1= 1 on duplicate key update c2 = values(c2) + c3;
select * from test;
c1	c2	c3
1	NULL	NULL
insert into test set c1= 1 on duplicate key update c2 = values(c2) + c3;
select * from test;
c1	c2	c3
1	NULL	NULL
insert into test set c1= 1 on duplicate key update c2 = values(c2) + c1;
select * from test;
c1	c2	c3
1	NULL	NULL
insert into test set c2 = 3, c1 = c2 + 1 on duplicate key update c3 = values(c1) + c2;
select * from test;
c1	c2	c3
1	NULL	NULL
4	3	NULL
insert into test set c2 = 3, c1 = c2 + 1 on duplicate key update c3 = values(c1) + c2, c2 = c3 + c1;
select * from test;
c1	c2	c3
1	NULL	NULL
4	11	7
drop table test;
create table test(c1 int unsigned, c2 int unsigned) partition by range(c1) (partition p0 values less than (100), partition p1 values less than (200),partition p2 values less than (300));
explain insert into test values(1,1000), (120,1000), (2,1000);
Query Plan
============================================
|ID|OPERATOR           |NAME|EST. ROWS|COST|
--------------------------------------------
|0 |EXCHANGE IN DISTR  |    |0        |0   |
|1 | EXCHANGE OUT DISTR|    |0        |0   |
|2 |  INSERT           |    |0        |0   |
|3 |   EXPRESSION      |    |0        |0   |
============================================

Outputs & filters: 
-------------------------------------
  0 - output(nil), filter(nil)
  1 - output(nil), filter(nil)
  2 - output([nextval(1)], [?], [()], [__values.c1], [__values.c2]), filter(nil), 
      columns([test.__pk_increment], [test.__pk_cluster_id], [test.__pk_partition_id], [test.c1], [test.c2]), partitions(p[0-1])
  3 - output([__values.c1], [__values.c2]), filter(nil)
      values({1, 1000}, {120, 1000}, {2, 1000})

insert into test values(1,1000), (120,1000), (2,1000);
select * from test order by c1, c2;
c1	c2
1	1000
2	1000
120	1000
insert into test values(1,1000), (120,1000), (2,1000);
select * from test order by c1, c2;
c1	c2
1	1000
1	1000
2	1000
2	1000
120	1000
120	1000
insert into test values(1,1000), (120,1000), ("helloworld",1000);
ERROR HY000: Incorrect integer value
select * from test order by c1, c2;
c1	c2
1	1000
1	1000
2	1000
2	1000
120	1000
120	1000
insert into test values(1,1000), (120,1000), (2,1000),(1,1000), (120,1000), (2,1000),(1,1000), (120,1000), (2,1000),(1,1000), (120,1000), (2,1000),(1,1000), (120,1000), (2,1000),(1,1000), (120,1000), (2,1000),(1,1000), (120,1000), (2,1000),(1,1000), (120,1000), (2,1000),(1,1000), (120,1000), (2,1000),(1,1000), (120,1000), (2,1000),(1,1000), (120,1000), (2,1000),(1,1000), (120,1000), (2,1000),(1,1000), (120,1000), (2,1000),(1,1000), (120,1000), (2,1000),(1,1000), (120,1000), (2,1000),(1,1000), (120,1000), (2,1000),(1,1000), (120,1000), (2,1000),(1,1000), (120,1000), (2,1000),(1,1000), (120,1000), (2,1000),(1,1000), (120,1000), (2,1000),(1,1000), (120,1000), (2,1000),(1,1000), (120,1000), (2,1000),(1,1000), (120,1000), (2,1000),(1,1000), (120,1000), (2,1000),(1,1000), (120,1000), (2,1000),(1,1000), (120,1000), (2,1000),(1,1000), (120,1000), (2,1000),(1,1000), (120,1000), (2,1000),(1,1000), (120,1000), (2,1000),(1,1000), (120,1000), (2,1000),(1,1000), (120,1000), (2,1000),(1,1000), (120,1000), (2,1000),(1,1000), (120,1000), (2,1000),(1,1000), (120,1000), (2,1000),(1,1000), (120,1000), (2,1000),(1,1000), (120,1000), (2,1000),(1,1000), (120,1000), (2,1000),(1,1000), (120,1000), (2,1000),(1,1000), (120,1000), (2,1000),(1,1000), (120,1000), (2,1000),(1,1000), (120,1000), (2,1000),(1,1000), (120,1000), (2,1000),(1,1000), (120,1000), (2,1000),(1,1000), (120,1000), (2,1000),(1,1000), (120,1000), (2,1000),(1,1000), (120,1000), (2,1000),(1,1000), (120,1000), (2,1000),(1,1000), (120,1000), (2,1000),(1,1000), (120,1000), (2,1000),(1,1000), (120,1000), (2,1000),(1,1000), (120,1000), (2,1000),(1,1000), (120,1000), (2,1000),(1,1000), (120,1000), (2,1000),(1,1000), (120,1000), (2,1000),(1,1000), (120,1000), (2,1000),(1,1000), (120,1000), (2,1000),(1,1000), (120,1000), (2,1000),(1,1000), (120,1000), (2,1000),(1,1000), (120,1000), (2,1000),(1,1000), (120,1000), (2,1000),(1,1000), (120,1000), (2,1000),(1,1000), (120,1000), (2,1000),(1,1000), (120,1000), (2,1000),(1,1000), (120,1000), (2,1000),(1,1000), (120,1000), (2,1000),(1,1000), (120,1000), (2,1000),(1,1000), (120,1000), (2,1000),(1,1000), (120,1000), (2,1000),(1,1000), (120,1000), (2,1000);
select * from test order by c1, c2;
c1	c2
1	1000
1	1000
1	1000
1	1000
1	1000
1	1000
1	1000
1	1000
1	1000
1	1000
1	1000
1	1000
1	1000
1	1000
1	1000
1	1000
1	1000
1	1000
1	1000
1	1000
1	1000
1	1000
1	1000
1	1000
1	1000
1	1000
1	1000
1	1000
1	1000
1	1000
1	1000
1	1000
1	1000
1	1000
1	1000
1	1000
1	1000
1	1000
1	1000
1	1000
1	1000
1	1000
1	1000
1	1000
1	1000
1	1000
1	1000
1	1000
1	1000
1	1000
1	1000
1	1000
1	1000
1	1000
1	1000
1	1000
1	1000
1	1000
1	1000
1	1000
1	1000
1	1000
1	1000
1	1000
1	1000
1	1000
1	1000
1	1000
1	1000
1	1000
1	1000
2	1000
2	1000
2	1000
2	1000
2	1000
2	1000
2	1000
2	1000
2	1000
2	1000
2	1000
2	1000
2	1000
2	1000
2	1000
2	1000
2	1000
2	1000
2	1000
2	1000
2	1000
2	1000
2	1000
2	1000
2	1000
2	1000
2	1000
2	1000
2	1000
2	1000
2	1000
2	1000
2	1000
2	1000
2	1000
2	1000
2	1000
2	1000
2	1000
2	1000
2	1000
2	1000
2	1000
2	1000
2	1000
2	1000
2	1000
2	1000
2	1000
2	1000
2	1000
2	1000
2	1000
2	1000
2	1000
2	1000
2	1000
2	1000
2	1000
2	1000
2	1000
2	1000
2	1000
2	1000
2	1000
2	1000
2	1000
2	1000
2	1000
2	1000
2	1000
120	1000
120	1000
120	1000
120	1000
120	1000
120	1000
120	1000
120	1000
120	1000
120	1000
120	1000
120	1000
120	1000
120	1000
120	1000
120	1000
120	1000
120	1000
120	1000
120	1000
120	1000
120	1000
120	1000
120	1000
120	1000
120	1000
120	1000
120	1000
120	1000
120	1000
120	1000
120	1000
120	1000
120	1000
120	1000
120	1000
120	1000
120	1000
120	1000
120	1000
120	1000
120	1000
120	1000
120	1000
120	1000
120	1000
120	1000
120	1000
120	1000
120	1000
120	1000
120	1000
120	1000
120	1000
120	1000
120	1000
120	1000
120	1000
120	1000
120	1000
120	1000
120	1000
120	1000
120	1000
120	1000
120	1000
120	1000
120	1000
120	1000
120	1000
120	1000
drop table test;
create table test(c1 bigint, c2 bigint, c3 datetime, primary key(c1,c2,c3))  partition by hash(c1) subpartition by range columns(c3) subpartition template (subpartition p0 values less than ('2016-01-01'), subpartition p1 values less than ('2116-01-01')) partitions 5;
explain insert into test values(1,1,"2016-01-01"),(100,100,"2015-01-01"),(1000,1000,"2015-11-01"),(10000,10000,"2018-01-01");
Query Plan
============================================
|ID|OPERATOR           |NAME|EST. ROWS|COST|
--------------------------------------------
|0 |EXCHANGE IN DISTR  |    |0        |0   |
|1 | EXCHANGE OUT DISTR|    |0        |0   |
|2 |  INSERT           |    |0        |0   |
|3 |   EXPRESSION      |    |0        |0   |
============================================

Outputs & filters: 
-------------------------------------
  0 - output(nil), filter(nil)
  1 - output(nil), filter(nil)
  2 - output([__values.c1], [__values.c2], [__values.c3]), filter(nil), 
      columns([test.c1], [test.c2], [test.c3]), partitions(p0sp[0-1], p1sp1)
  3 - output([__values.c1], [__values.c2], [__values.c3]), filter(nil)
      values({1, 1, '2016-01-01'}, {100, 100, '2015-01-01'}, {1000, 1000, '2015-11-01'}, {10000, 10000, '2018-01-01'})

insert into test values(1,1,"2016-01-01"),(100,100,"2015-01-01"),(1000,1000,"2015-11-01"),(10000,10000,"2018-01-01");
select * from test order by c1, c2, c3;
c1	c2	c3
1	1	2016-01-01 00:00:00
100	100	2015-01-01 00:00:00
1000	1000	2015-11-01 00:00:00
10000	10000	2018-01-01 00:00:00
insert into test values(1,1,"2016-01-01"),(100,100,"2015-01-01"),(1000,1000,"2015-11-01"),(10000,10000,"2018-01-01");
ERROR 23000: Duplicated primary key
select * from test order by c1, c2, c3;
c1	c2	c3
1	1	2016-01-01 00:00:00
100	100	2015-01-01 00:00:00
1000	1000	2015-11-01 00:00:00
10000	10000	2018-01-01 00:00:00
insert into test values(1,1,"2016-01-01"),(100,100,"2015-01-01"),(1000,1000,"xxxxxxxxxx"),(10000,10000,"2018-01-01");
ERROR 22007: Incorrect value
select * from test order by c1, c2, c3;
c1	c2	c3
1	1	2016-01-01 00:00:00
100	100	2015-01-01 00:00:00
1000	1000	2015-11-01 00:00:00
10000	10000	2018-01-01 00:00:00
drop table test;
