drop table if exists t1,t2,t3,t4,test;
create table t1(c1 int primary key, c2 int);
create table t2(c1 int, c2 int);
create table t3(c1 int primary key, c2 int, c3 int);
create table t4(c1 int primary key, c2 int) partition by hash(c1) partitions 3;
create table test(c1 int primary key auto_increment, c2 int);
insert into t1 values(1, 1), (2, 2);
insert into t2 values(3, 3), (4, 4);
insert into t1 select * from t2;
select * from t1;
c1	c2
1	1
2	2
3	3
4	4
insert into t2 select * from t1;
select * from t2;
c1	c2
3	3
4	4
1	1
2	2
3	3
4	4
insert into t2(c2) select c2 from t2;
select * from t2;
c1	c2
3	3
4	4
1	1
2	2
3	3
4	4
NULL	3
NULL	4
NULL	1
NULL	2
NULL	3
NULL	4
insert into t1 select * from t1;
ERROR 23000: Duplicate entry '1' for key 'PRIMARY'
insert into t2 select * from t2;
select * from t2;
c1	c2
3	3
4	4
1	1
2	2
3	3
4	4
NULL	3
NULL	4
NULL	1
NULL	2
NULL	3
NULL	4
3	3
4	4
1	1
2	2
3	3
4	4
NULL	3
NULL	4
NULL	1
NULL	2
NULL	3
NULL	4
insert into t2 select c1, c2 from t3;
select * from t2;
c1	c2
3	3
4	4
1	1
2	2
3	3
4	4
NULL	3
NULL	4
NULL	1
NULL	2
NULL	3
NULL	4
3	3
4	4
1	1
2	2
3	3
4	4
NULL	3
NULL	4
NULL	1
NULL	2
NULL	3
NULL	4
insert into t3 select distinct c1, c2, c1 from t2 where c1 is not null;
select * from t3;
c1	c2	c3
1	1	1
2	2	2
3	3	3
4	4	4
insert into t1 select * from t4;
ERROR 0A000: Distributed insert sql not supported
insert into t1 select t3.c1, t3.c2 from t3 join t4 using(c1);
ERROR 0A000: Distributed insert sql not supported
insert into t1 (select c1, c2 from t3 union select c1, c2 from t4);
ERROR 0A000: Distributed insert sql not supported
delete from t2;
insert into t2 (c1) select c1 from t1;
select * from t2;
c1	c2
1	NULL
2	NULL
3	NULL
4	NULL
insert into test(c2) select c1 from t1;
select * from test;
c1	c2
1	1
2	2
3	3
4	4
insert into test(c2) select c1 from t1;
select * from test;
c1	c2
1	1
2	2
3	3
4	4
8	1
9	2
10	3
11	4
drop table t1, t2, t3, t4;
create table t1(c1 int primary key, c2 int, d int default 5);
create table t2(c3 int primary key, c4 int, d int);
insert into t2 values(1,2,3),(3,3,4);
insert into t1 select * from t2 on duplicate key update t1.c1 = t1.c1 + 1;
insert into t1 select * from t2 on duplicate key update t1.c1 = t1.c1 + 1;
select * from t1;
c1	c2	d
2	2	3
4	3	4
insert into t1 select * from t2 on duplicate key update t1.c1 = t1.c1 + 1 + values(c1), c2 = c1 + 3;
delete from t1;
insert into t1(c1) select c3 from t2 on duplicate key update t1.c1 = t1.c1 + 1;
insert into t1(c1) select c3 from t2 on duplicate key update t1.c1 = t1.c1 + 1;
insert into t1(c1) select c3 from t2 on duplicate key update c1 = t1.c1 + 1 + values(c1), c2 = c1 + 3;
select * from t1;
c1	c2	d
1	NULL	5
2	NULL	5
3	NULL	5
4	NULL	5
drop table t1,t2;
create table t1(c1 int primary key auto_increment, c2 int, c3 int);
create table t2(c4 int primary key, c5 int, c6 int);
insert into t2 values(1,2,3), (3,3,4);
insert into t1(c2,c3) select c4,c5 from t2;
insert into t1(c2,c3) select c4,c5 from t2 on duplicate key update t1.c2 = values(t1.c2) + values(t1.c3);
select * from t1;
c1	c2	c3
1	1	2
2	3	3
4	1	2
5	3	3
drop table t1,t2;
