drop table if exists test;
create table test(c1 int, c2 int, c3 int);
insert into test values(1,1,1),(2,2,2),(3,3,3);
select * from test;
c1	c2	c3
1	1	1
2	2	2
3	3	3
drop table test;
create table test(c1 int primary key, c2 int, c3 int);
insert into test values(1,1,1),(2,2,2),(3,3,3);
select * from test;
c1	c2	c3
1	1	1
2	2	2
3	3	3
insert into test values(1,1,1),(2,2,2),(3,3,3) on duplicate key update c2 = values(c1)+ values(c3),
c3 = values(c1) + values(c3) + values(c2);
select * from test;
c1	c2	c3
1	2	3
2	4	6
3	6	9
insert into test values(4, c1+1, c1+2), (5, c1 + c2, c2+c1+c3), (6,c1+c2, c2+c1+c3);
select * from test;
c1	c2	c3
1	2	3
2	4	6
3	6	9
4	5	6
5	NULL	NULL
6	NULL	NULL
insert into test values(4, c1+1, c1+2), (5, c1 + c2, c2+c1+c3), (6,c1+c2, c2+c1+c3) on duplicate key
update c2 = values(c1)+ values(c3), c3 = values(c1) + values(c3) + values(c2);
select * from test;
c1	c2	c3
1	2	3
2	4	6
3	6	9
4	10	15
5	NULL	NULL
6	NULL	NULL
insert into test set c1 = 7, c2=c1+5, c3=c1+c2;
insert into test set c1 = 8, c2=c1+5, c3=c1+c2 + c3;
select * from test;
c1	c2	c3
1	2	3
2	4	6
3	6	9
4	10	15
5	NULL	NULL
6	NULL	NULL
7	12	19
8	13	NULL
insert into test set c1 = 7, c2=c1+5, c3=c1+c2 on duplicate key update c2 = values(c1)+ values(c3),
c3 = values(c1) + values(c3) + values(c2);
insert into test set c1 = 8, c2=c1+5, c3=c1+c2 + c3 on duplicate key update c2 = values(c1)+ values(c3), c3 = values(c1) + values(c3) + values(c2);
select * from test;
c1	c2	c3
1	2	3
2	4	6
3	6	9
4	10	15
5	NULL	NULL
6	NULL	NULL
7	26	38
8	NULL	NULL
drop table test;
create table test(c1 int primary key auto_increment, c2 int, c3 int);
insert into test values(1,1,1),(2,2,2),(3,3,3);
select * from test;
c1	c2	c3
1	1	1
2	2	2
3	3	3
insert into test values(1,1,1),(2,2,2),(3,3,3) on duplicate key update c2 = values(c1)+ values(c3),
c3 = values(c1) + values(c3) + values(c2);
select * from test;
c1	c2	c3
1	2	3
2	4	6
3	6	9
insert into test values(4, c1+1, c1+2), (5, c1 + c2, c2+c1+c3), (6,c1+c2, c2+c1+c3);
select * from test;
c1	c2	c3
1	2	3
2	4	6
3	6	9
4	5	6
5	NULL	NULL
6	NULL	NULL
insert into test values(4, c1+1, c1+2), (5, c1 + c2, c2+c1+c3), (6,c1+c2, c2+c1+c3) on duplicate key
update c2 = values(c1)+ values(c3), c3 = values(c1) + values(c3) + values(c2);
select * from test;
c1	c2	c3
1	2	3
2	4	6
3	6	9
4	10	15
5	NULL	NULL
6	NULL	NULL
insert into test set c1 = 7, c2=c1+5, c3=c1+c2;
insert into test set c1 = 8, c2=c1+5, c3=c1+c2 + c3;
select * from test;
c1	c2	c3
1	2	3
2	4	6
3	6	9
4	10	15
5	NULL	NULL
6	NULL	NULL
7	12	19
8	13	NULL
insert into test set c1 = 7, c2=c1+5, c3=c1+c2 on duplicate key update c2 = values(c1)+ values(c3),
c3 = values(c1) + values(c3) + values(c2);
insert into test set c1 = 8, c2=c1+5, c3=c1+c2 + c3 on duplicate key update c2 = values(c1)+ values(c3), c3 = values(c1) + values(c3) + values(c2);
select * from test;
c1	c2	c3
1	2	3
2	4	6
3	6	9
4	10	15
5	NULL	NULL
6	NULL	NULL
7	26	38
8	NULL	NULL
delete from test;
insert into test(c2,c3) values(c1+1, c1+2), (c1 + c2, c2+c1+c3), (c1+c2, c2+c1+c3);
select * from test;
c1	c2	c3
1000004	1	2
1000005	NULL	NULL
1000006	NULL	NULL
insert into test (c2,c3)values(c1+1, c1+2), (c1 + c2, c2+c1+c3), (c1+c2, c2+c1+c3) on duplicate key
update c2 = values(c1)+ values(c3), c3 = values(c1) + values(c3) + values(c2);
select * from test;
c1	c2	c3
1000004	1	2
1000005	NULL	NULL
1000006	NULL	NULL
1000007	1	2
1000008	NULL	NULL
1000009	NULL	NULL
insert into test set c2=c1+5, c3=c1+c2;
insert into test set c2=c1+5, c3=c1+c2 + c3;
select * from test;
c1	c2	c3
1000004	1	2
1000005	NULL	NULL
1000006	NULL	NULL
1000007	1	2
1000008	NULL	NULL
1000009	NULL	NULL
1000010	5	5
1000011	5	NULL
insert into test set c1 = 2, c2=c1+5, c3=c1+c2 on duplicate key update c2 = values(c1)+ values(c3),
c3 = values(c1) + values(c3) + values(c2);
insert into test set c1 = 3, c2=c1+5, c3=c1+c2 + c3 on duplicate key update c2 = values(c1)+ values(c3), c3 = values(c1) + values(c3) + values(c2);
select * from test;
c1	c2	c3
2	7	9
3	8	NULL
1000004	1	2
1000005	NULL	NULL
1000006	NULL	NULL
1000007	1	2
1000008	NULL	NULL
1000009	NULL	NULL
1000010	5	5
1000011	5	NULL
drop table test;
create table test(c1 int primary key, c2 char(5), c3 char(8));
insert into test values(1, 'sbc    ', concat(c2, 'd'));
select * from test;
c1	c2	c3
1	sbc	sbcd
set @@sql_mode='';
insert into test values(1, 'deeeeee', concat(c2, 'de')), (2, 'eeee22aa', 'eeff')on duplicate key update c3 = values(c2);
select * from test;
c1	c2	c3
1	sbc	deeee
2	eeee2	eeff
insert into test values(1, 'deeeeee', concat(c2, 'de')), (2, 'eeee22aa', 'eeff')on duplicate key update c3 = values(c2);
select * from test;
c1	c2	c3
1	sbc	deeee
2	eeee2	eeee2
set @@sql_mode ='pad_char_to_full_length';
insert into test values(1, 'dee', concat(c2, 'de')), (2, 'eeee22aa', 'eeff')on duplicate key update c3 = values(c2);
select * from test;
c1	c2	c3
1	sbc  	dee     
2	eeee2	eeee2   
insert into test values(1, 'dee', concat(c2, 'de')), (2, 'eeee22aa', 'eeff')on duplicate key update c3 = values(c2);
select * from test;
c1	c2	c3
1	sbc  	dee     
2	eeee2	eeee2   
drop table test;
create table test(c1 int default 3, c2 int);
insert into test values(1, values(c2));
insert into test values(2, values(c1));
insert into test values(values(c1), 3);
insert into test values(values(c2), 4);
insert into test values(values(c2), values(c1));
select * from test;
c1	c2
1	NULL
2	NULL
NULL	3
NULL	4
NULL	NULL
drop table test;
create table test(c1 binary(4), c2 binary(5));
insert into test values(4, c1 + 1);
Warnings:
Warning	1292	Truncated incorrect DOUBLE value: '4'
insert into test values(4, concat(c1,1));
select hex(c1),hex(c2) from test;
hex(c1)	hex(c2)
34000000	3500000000
34000000	3400000031
drop table test;
