drop table if exists test;
create table test (c1 int primary key, c2 int unique key, c3 int, c4 char(3));
insert into test values(1,2,3,4);
insert into test values(1,1,1,1);
ERROR 23000: Duplicate entry '1' for key 'PRIMARY'
insert ignore into test values(1,1,1,1);
insert  into test values(2,2,3,4);
ERROR 23000: Duplicate entry '2' for key 'c2'
insert ignore into test values(2,2,3,4);
insert into test values(3,3,3,3);
insert ignore into test values(4,3,3,3);
delete from test;
insert into test values(1,2,3,4);
insert into test values(3,3,3,3);
insert ignore into test values(1,1,1,1) on duplicate key update c1 = 1;
select * from test;
c1	c2	c3	c4
1	2	3	4
3	3	3	3
insert ignore into test values(1,1,1,1) on duplicate key update c2 = 2;
select * from test;
c1	c2	c3	c4
1	2	3	4
3	3	3	3
insert ignore into test values(1,1,1,1) on duplicate key update c2 = 4;
select * from test;
c1	c2	c3	c4
1	4	3	4
3	3	3	3
insert ignore into test values(1,1,1,1) on duplicate key update c2 = 3;
select * from test;
c1	c2	c3	c4
1	4	3	4
3	3	3	3
delete from test;
insert into test values(1,2,3,4);
insert into test values(3,3,3,3);
insert into test values(1,1,1,1) on duplicate key update c4 = 'hello';
ERROR 22001: Data too long for column
insert ignore into test values(1,1,1,1) on duplicate key update c4 = 'hello';
drop table test;
create table test (c1 int primary key, c2 time, c3 char(3));
insert into test values(1, 0, 'nihoaaw');
ERROR 22001: Data too long for column 'c3' at row 1
insert ignore test values(1, 0, 'nihoaaw');
select * from test;
c1	c2	c3
1	00:00:00	nih
set sql_mode='';
insert ignore test values(2, 0, 'nihoaaw');
select * from test;
c1	c2	c3
1	00:00:00	nih
2	00:00:00	nih
set sql_mode='strict_all_tables';
drop table test;
create table test (c1 int primary key, c2 time, c3 char(3));
start transaction;
insert into test values(1, 0, 'ni');
insert into test values(2, 0, 'nihoaaw');
ERROR 22001: Data too long for column 'c3' at row 1
select * from test;
c1	c2	c3
1	00:00:00	ni
insert ignore into test values(3, 0, 'nihoaaw');
select * from test;
c1	c2	c3
1	00:00:00	ni
3	00:00:00	nih
update test set c2 = '12:12:12', c3 = 'hoense';
ERROR 22001: Data too long for column
select * from test;
c1	c2	c3
1	00:00:00	ni
3	00:00:00	nih
update ignore test set c2 = '12:12:12', c3 = 'hoense';
select * from test;
c1	c2	c3
1	12:12:12	hoe
3	12:12:12	hoe
commit;
select * from test;
c1	c2	c3
1	12:12:12	hoe
3	12:12:12	hoe
drop table test;
