drop table if exists t1,t2,t3,t4,t5,t6,t7,t8,t9,bug58912;
drop database if exists mysqltest;
CREATE TABLE bug58912 (a varbinary(600), b varchar(600), PRIMARY KEY(a));
INSERT INTO bug58912 VALUES(REPEAT('a',600),REPEAT('b',600));
UPDATE bug58912 SET a=REPEAT('a',500);
create table t1 (id int unsigned not null auto_increment, code tinyint unsigned not null, name char(20) not null, primary key (id), key (code), unique (name)) ;
insert into t1 (code, name) values (1, 'Tim'), (1, 'Monty'), (2, 'David'), (2, 'Erik'), (3, 'Sasha'), (3, 'Jeremy'), (4, 'Matt');
select id, code, name from t1 order by id;
id	code	name
1	1	Tim
2	1	Monty
3	2	David
4	2	Erik
5	3	Sasha
6	3	Jeremy
7	4	Matt
update t1 set id = 8, name = 'Sinisa' where id < 3;
ERROR 23000: Duplicate entry '8' for key 'PRIMARY'
select id, code, name from t1 order by id;
id	code	name
1	1	Tim
2	1	Monty
3	2	David
4	2	Erik
5	3	Sasha
6	3	Jeremy
7	4	Matt
update t1 set id = id + 10, name = 'Ralph' where id < 4;
ERROR 23000: Duplicate entry 'Ralph' for key 'name'
select id, code, name from t1 order by id;
id	code	name
1	1	Tim
2	1	Monty
3	2	David
4	2	Erik
5	3	Sasha
6	3	Jeremy
7	4	Matt
drop table t1;
CREATE TABLE t1 (
id int(11) NOT NULL auto_increment,
parent_id int(11) DEFAULT '0' NOT NULL,
level tinyint(4) DEFAULT '0' NOT NULL,
PRIMARY KEY (id),
KEY parent_id (parent_id),
KEY level (level)
) ;
INSERT INTO t1 VALUES (1,0,0),(3,1,1),(4,1,1),(8,2,2),(9,2,2),(17,3,2),(22,4,2),(24,4,2),(28,5,2),(29,5,2),(30,5,2),(31,6,2),(32,6,2),(33,6,2),(203,7,2),(202,7,2),(20,3,2),(157,0,0),(193,5,2),(40,7,2),(2,1,1),(15,2,2),(6,1,1),(34,6,2),(35,6,2),(16,3,2),(7,1,1),(36,7,2),(18,3,2),(26,5,2),(27,5,2),(183,4,2),(38,7,2),(25,5,2),(37,7,2),(21,4,2),(19,3,2),(5,1,1),(179,5,2);
update t1 set parent_id=parent_id+100;
select * from t1 where parent_id=102;
id	parent_id	level
8	102	2
9	102	2
15	102	2
update t1 set id=id+1000;
update t1 set id=1024 where id=1009;
Got one of the listed errors
select * from t1;
id	parent_id	level
1001	100	0
1002	101	1
1003	101	1
1004	101	1
1005	101	1
1006	101	1
1007	101	1
1008	102	2
1009	102	2
1015	102	2
1016	103	2
1017	103	2
1018	103	2
1019	103	2
1020	103	2
1021	104	2
1022	104	2
1024	104	2
1025	105	2
1026	105	2
1027	105	2
1028	105	2
1029	105	2
1030	105	2
1031	106	2
1032	106	2
1033	106	2
1034	106	2
1035	106	2
1036	107	2
1037	107	2
1038	107	2
1040	107	2
1157	100	0
1179	105	2
1183	104	2
1193	105	2
1202	107	2
1203	107	2
update t1 set id=id+1;
select * from t1;
id	parent_id	level
1002	100	0
1003	101	1
1004	101	1
1005	101	1
1006	101	1
1007	101	1
1008	101	1
1009	102	2
1010	102	2
1016	102	2
1017	103	2
1018	103	2
1019	103	2
1020	103	2
1021	103	2
1022	104	2
1023	104	2
1025	104	2
1026	105	2
1027	105	2
1028	105	2
1029	105	2
1030	105	2
1031	105	2
1032	106	2
1033	106	2
1034	106	2
1035	106	2
1036	106	2
1037	107	2
1038	107	2
1039	107	2
1041	107	2
1158	100	0
1180	105	2
1184	104	2
1194	105	2
1203	107	2
1204	107	2
update t1 set id=1023 where id=1010;
Got one of the listed errors
select * from t1 where parent_id=102;
id	parent_id	level
1009	102	2
1010	102	2
1016	102	2
explain  select level from t1 where level=1;
Query Plan
=====================================================
|ID|OPERATOR        |NAME     |EST.ROWS|EST.TIME(us)|
-----------------------------------------------------
|0 |TABLE RANGE SCAN|t1(level)|6       |3           |
=====================================================
Outputs & filters:
-------------------------------------
  0 - output([t1.level]), filter(nil), rowset=16
      access([t1.level]), partitions(p0)
      is_index_back=false, is_global_index=false, 
      range_key([t1.level], [t1.id]), range(1,MIN ; 1,MAX), 
      range_cond([t1.level = 1])
explain  select level,id from t1 where level=1;
Query Plan
=====================================================
|ID|OPERATOR        |NAME     |EST.ROWS|EST.TIME(us)|
-----------------------------------------------------
|0 |TABLE RANGE SCAN|t1(level)|6       |3           |
=====================================================
Outputs & filters:
-------------------------------------
  0 - output([t1.level], [t1.id]), filter(nil), rowset=16
      access([t1.id], [t1.level]), partitions(p0)
      is_index_back=false, is_global_index=false, 
      range_key([t1.level], [t1.id]), range(1,MIN ; 1,MAX), 
      range_cond([t1.level = 1])
explain  select level,id,parent_id from t1 where level=1;
Query Plan
=====================================================
|ID|OPERATOR        |NAME     |EST.ROWS|EST.TIME(us)|
-----------------------------------------------------
|0 |TABLE RANGE SCAN|t1(level)|6       |38          |
=====================================================
Outputs & filters:
-------------------------------------
  0 - output([t1.level], [t1.id], [t1.parent_id]), filter(nil), rowset=16
      access([t1.id], [t1.level], [t1.parent_id]), partitions(p0)
      is_index_back=true, is_global_index=false, 
      range_key([t1.level], [t1.id]), range(1,MIN ; 1,MAX), 
      range_cond([t1.level = 1])
select level,id from t1 where level=1;
level	id
1	1003
1	1004
1	1005
1	1006
1	1007
1	1008
select level,id,parent_id from t1 where level=1;
level	id	parent_id
1	1003	101
1	1004	101
1	1005	101
1	1006	101
1	1007	101
1	1008	101
show keys from t1;
Table	Non_unique	Key_name	Seq_in_index	Column_name	Collation	Cardinality	Sub_part	Packed	Null	Index_type	Comment	Index_comment	Visible	Expression
t1	0	PRIMARY	1	id	A	#	NULL	NULL		BTREE	available		YES	NULL
t1	1	parent_id	1	parent_id	A	#	NULL	NULL		BTREE	available		YES	NULL
t1	1	level	1	level	A	#	NULL	NULL		BTREE	available		YES	NULL
drop table t1;
CREATE TABLE t1 (
gesuchnr int(11) DEFAULT '0' NOT NULL,
benutzer_id int(11) DEFAULT '0' NOT NULL,
PRIMARY KEY (gesuchnr,benutzer_id)
) ;
replace into t1 (gesuchnr,benutzer_id) values (2,1);
replace into t1 (gesuchnr,benutzer_id) values (1,1);
replace into t1 (gesuchnr,benutzer_id) values (1,1);
select * from t1;
gesuchnr	benutzer_id
1	1
2	1
drop table t1;
create table t1 (a int) ;
insert into t1 values (1), (2);
delete from t1 where a = 1;
select * from t1;
a
2
drop table t1;
create table t1 (a int,b varchar(20)) ;
insert into t1 values (1,""), (2,"testing");
delete from t1 where a = 1;
select * from t1;
a	b
2	testing
create index skr on t1 (a);
insert into t1 values (3,""), (4,"testing");
show keys from t1;
Table	Non_unique	Key_name	Seq_in_index	Column_name	Collation	Cardinality	Sub_part	Packed	Null	Index_type	Comment	Index_comment	Visible	Expression
t1	1	skr	1	a	A	#	NULL	NULL	YES	BTREE	available		YES	NULL
drop table t1;
create table t1 (a int,b varchar(20),key(a)) ;
insert into t1 values (1,""), (2,"testing");
select * from t1 where a = 1;
a	b
1	
drop table t1;
create table t1 (n int not null primary key) ;
set autocommit=0;
insert into t1 values (4);
rollback;
select n, "after rollback" from t1;
n	after rollback
insert into t1 values (4);
commit;
select n, "after commit" from t1;
n	after commit
4	after commit
commit;
insert into t1 values (5);
insert into t1 values (4);
ERROR 23000: Duplicate entry '4' for key 'PRIMARY'
commit;
select n, "after commit" from t1;
n	after commit
4	after commit
5	after commit
set autocommit=1;
insert into t1 values (6);
insert into t1 values (4);
ERROR 23000: Duplicate entry '4' for key 'PRIMARY'
select n from t1;
n
4
5
6
set autocommit=0;
drop table t1;
create table t1 (n int not null primary key) ;
start transaction;
insert into t1 values (4);
commit;
commit;
select * from t1;
n
4
drop table t1;
create table t1 ( id int NOT NULL PRIMARY KEY, nom varchar(64)) ;
begin;
insert into t1 values(1,'hamdouni');
select id as afterbegin_id,nom as afterbegin_nom from t1;
afterbegin_id	afterbegin_nom
1	hamdouni
rollback;
select id as afterrollback_id,nom as afterrollback_nom from t1;
afterrollback_id	afterrollback_nom
set autocommit=0;
insert into t1 values(2,'mysql');
select id as afterautocommit0_id,nom as afterautocommit0_nom from t1;
afterautocommit0_id	afterautocommit0_nom
2	mysql
rollback;
select id as afterrollback_id,nom as afterrollback_nom from t1;
afterrollback_id	afterrollback_nom
set autocommit=1;
drop table t1;
CREATE TABLE t1 (id char(8) not null primary key, val int not null) ;
insert into t1 values ('pippo', 12);
insert into t1 values ('pippo', 12);
ERROR 23000: Duplicate entry 'pippo' for key 'PRIMARY'
delete from t1;
delete from t1 where id = 'pippo';
select * from t1;
id	val
insert into t1 values ('pippo', 12);
set autocommit=0;
delete from t1;
rollback;
select * from t1;
id	val
pippo	12
delete from t1;
commit;
select * from t1;
id	val
drop table t1;
create table t1 (a integer) ;
start transaction;
rename table t1 to t2;
create table t1 (b integer) ;
insert into t1 values (1);
rollback;
drop table t1;
rename table t2 to t1;
drop table t1;
set autocommit=1;
CREATE TABLE t1 (ID INTEGER NOT NULL PRIMARY KEY, NAME VARCHAR(64)) ;
INSERT INTO t1 VALUES (1, 'Jochen');
select * from t1;
ID	NAME
1	Jochen
drop table t1;
CREATE TABLE t1 ( _userid VARCHAR(60) NOT NULL PRIMARY KEY) ;
set autocommit=0;
INSERT INTO t1  SET _userid='marc@anyware.co.uk';
COMMIT;
SELECT * FROM t1;
_userid
marc@anyware.co.uk
SELECT _userid FROM t1 WHERE _userid='marc@anyware.co.uk';
_userid
marc@anyware.co.uk
drop table t1;
set autocommit=1;
CREATE TABLE t1 (
user_id int(10) DEFAULT '0' NOT NULL,
name varchar(100),
phone varchar(100),
ref_email varchar(100) DEFAULT '' NOT NULL,
detail varchar(200),
PRIMARY KEY (user_id,ref_email)
);
INSERT INTO t1 VALUES (10292,'sanjeev','29153373','sansh777@hotmail.com','xxx'),(10292,'shirish','2333604','shirish@yahoo.com','ddsds'),(10292,'sonali','323232','sonali@bolly.com','filmstar');
select * from t1 where user_id=10292;
user_id	name	phone	ref_email	detail
10292	sanjeev	29153373	sansh777@hotmail.com	xxx
10292	shirish	2333604	shirish@yahoo.com	ddsds
10292	sonali	323232	sonali@bolly.com	filmstar
INSERT INTO t1 VALUES (10291,'sanjeev','29153373','sansh777@hotmail.com','xxx'),(10293,'shirish','2333604','shirish@yahoo.com','ddsds');
select * from t1 where user_id=10292;
user_id	name	phone	ref_email	detail
10292	sanjeev	29153373	sansh777@hotmail.com	xxx
10292	shirish	2333604	shirish@yahoo.com	ddsds
10292	sonali	323232	sonali@bolly.com	filmstar
select * from t1 where user_id>=10292;
user_id	name	phone	ref_email	detail
10292	sanjeev	29153373	sansh777@hotmail.com	xxx
10292	shirish	2333604	shirish@yahoo.com	ddsds
10292	sonali	323232	sonali@bolly.com	filmstar
10293	shirish	2333604	shirish@yahoo.com	ddsds
select * from t1 where user_id>10292;
user_id	name	phone	ref_email	detail
10293	shirish	2333604	shirish@yahoo.com	ddsds
select * from t1 where user_id<10292;
user_id	name	phone	ref_email	detail
10291	sanjeev	29153373	sansh777@hotmail.com	xxx
drop table t1;
CREATE TABLE t1 (a int not null, b int not null,c int not null,
key(a),primary key(a,b), unique(c),key(a),unique(b));
show index from t1;
Table	Non_unique	Key_name	Seq_in_index	Column_name	Collation	Cardinality	Sub_part	Packed	Null	Index_type	Comment	Index_comment	Visible	Expression
t1	0	PRIMARY	1	a	A	#	NULL	NULL		BTREE	available		YES	NULL
t1	0	PRIMARY	2	b	A	#	NULL	NULL		BTREE	available		YES	NULL
t1	1	a	1	a	A	#	NULL	NULL		BTREE	available		YES	NULL
t1	0	c	1	c	A	#	NULL	NULL		BTREE	available		YES	NULL
t1	1	a_2	1	a	A	#	NULL	NULL		BTREE	available		YES	NULL
t1	0	b	1	b	A	#	NULL	NULL		BTREE	available		YES	NULL
drop table t1;
create table t1 (col1 int not null, col2 char(4) not null, primary key(col1));
alter table t1 ;
insert into t1 values ('1','1'),('5','2'),('2','3'),('3','4'),('4','4');
select * from t1;
col1	col2
1	1
2	3
3	4
4	4
5	2
update t1 set col2='7' where col1='4';
select * from t1;
col1	col2
1	1
2	3
3	4
4	7
5	2
alter table t1 add co3 int not null;
select * from t1;
col1	col2	co3
1	1	0
2	3	0
3	4	0
4	7	0
5	2	0
update t1 set col2='9' where col1='2';
select * from t1;
col1	col2	co3
1	1	0
2	9	0
3	4	0
4	7	0
5	2	0
drop table t1;
create table t1 (a int not null , b int, primary key (a)) ;
create table t2 (a int not null , b int, primary key (a)) ;
insert into t1 VALUES (1,3) , (2,3), (3,3);
select * from t1;
a	b
1	3
2	3
3	3
insert into t2 select * from t1;
select * from t2;
a	b
1	3
2	3
3	3
delete from t1 where b = 3;
select * from t1;
a	b
insert into t1 select * from t2;
select * from t1;
a	b
1	3
2	3
3	3
select * from t2;
a	b
1	3
2	3
3	3
drop table t1,t2;
CREATE TABLE t1 (
user_name varchar(12),
password varchar(512),
subscribed char(1),
user_id int(11) DEFAULT '0' NOT NULL,
quota bigint(20),
weight double,
access_date date,
access_time time,
approved datetime,
dummy_primary_key int(11) NOT NULL auto_increment,
PRIMARY KEY (dummy_primary_key)
) ;
INSERT INTO t1 VALUES ('user_0','somepassword','N',0,0,0,'2000-09-07','23:06:59','2000-09-07 23:06:59',1);
INSERT INTO t1 VALUES ('user_1','somepassword','Y',1,1,1,'2000-09-07','23:06:59','2000-09-07 23:06:59',2);
INSERT INTO t1 VALUES ('user_2','somepassword','N',2,2,1.4142135623731,'2000-09-07','23:06:59','2000-09-07 23:06:59',3);
INSERT INTO t1 VALUES ('user_3','somepassword','Y',3,3,1.7320508075689,'2000-09-07','23:06:59','2000-09-07 23:06:59',4);
INSERT INTO t1 VALUES ('user_4','somepassword','N',4,4,2,'2000-09-07','23:06:59','2000-09-07 23:06:59',5);
select  user_name, password , subscribed, user_id, quota, weight, access_date, access_time, approved, dummy_primary_key from t1 order by user_name;
user_name	password	subscribed	user_id	quota	weight	access_date	access_time	approved	dummy_primary_key
user_0	somepassword	N	0	0	0	2000-09-07	23:06:59	2000-09-07 23:06:59	1
user_1	somepassword	Y	1	1	1	2000-09-07	23:06:59	2000-09-07 23:06:59	2
user_2	somepassword	N	2	2	1.4142135623731	2000-09-07	23:06:59	2000-09-07 23:06:59	3
user_3	somepassword	Y	3	3	1.7320508075689	2000-09-07	23:06:59	2000-09-07 23:06:59	4
user_4	somepassword	N	4	4	2	2000-09-07	23:06:59	2000-09-07 23:06:59	5
drop table t1;
CREATE TABLE t1 (
id int(11) NOT NULL auto_increment,
parent_id int(11) DEFAULT '0' NOT NULL,
level tinyint(4) DEFAULT '0' NOT NULL,
KEY (id),
KEY parent_id (parent_id),
KEY level (level)
) ;
INSERT INTO t1 VALUES (1,0,0),(3,1,1),(4,1,1),(8,2,2),(9,2,2),(17,3,2),(22,4,2),(24,4,2),(28,5,2),(29,5,2),(30,5,2),(31,6,2),(32,6,2),(33,6,2),(203,7,2),(202,7,2),(20,3,2),(157,0,0),(193,5,2),(40,7,2),(2,1,1),(15,2,2),(6,1,1),(34,6,2),(35,6,2),(16,3,2),(7,1,1),(36,7,2),(18,3,2),(26,5,2),(27,5,2),(183,4,2),(38,7,2),(25,5,2),(37,7,2),(21,4,2),(19,3,2),(5,1,1);
INSERT INTO t1 values (179,5,2);
update t1 set parent_id=parent_id+100;
select * from t1 where parent_id=102;
id	parent_id	level
8	102	2
9	102	2
15	102	2
update t1 set id=id+1000;
update t1 set id=1024 where id=1009;
select * from t1;
id	parent_id	level
1001	100	0
1003	101	1
1004	101	1
1008	102	2
1024	102	2
1017	103	2
1022	104	2
1024	104	2
1028	105	2
1029	105	2
1030	105	2
1031	106	2
1032	106	2
1033	106	2
1203	107	2
1202	107	2
1020	103	2
1157	100	0
1193	105	2
1040	107	2
1002	101	1
1015	102	2
1006	101	1
1034	106	2
1035	106	2
1016	103	2
1007	101	1
1036	107	2
1018	103	2
1026	105	2
1027	105	2
1183	104	2
1038	107	2
1025	105	2
1037	107	2
1021	104	2
1019	103	2
1005	101	1
1179	105	2
update t1 set id=id+1;
select * from t1;
id	parent_id	level
1002	100	0
1004	101	1
1005	101	1
1009	102	2
1025	102	2
1018	103	2
1023	104	2
1025	104	2
1029	105	2
1030	105	2
1031	105	2
1032	106	2
1033	106	2
1034	106	2
1204	107	2
1203	107	2
1021	103	2
1158	100	0
1194	105	2
1041	107	2
1003	101	1
1016	102	2
1007	101	1
1035	106	2
1036	106	2
1017	103	2
1008	101	1
1037	107	2
1019	103	2
1027	105	2
1028	105	2
1184	104	2
1039	107	2
1026	105	2
1038	107	2
1022	104	2
1020	103	2
1006	101	1
1180	105	2
update t1 set id=1023 where id=1010;
select * from t1 where parent_id=102;
id	parent_id	level
1009	102	2
1025	102	2
1016	102	2
explain  select level from t1 where level=1;
Query Plan
=====================================================
|ID|OPERATOR        |NAME     |EST.ROWS|EST.TIME(us)|
-----------------------------------------------------
|0 |TABLE RANGE SCAN|t1(level)|6       |3           |
=====================================================
Outputs & filters:
-------------------------------------
  0 - output([t1.level]), filter(nil), rowset=16
      access([t1.level]), partitions(p0)
      is_index_back=false, is_global_index=false, 
      range_key([t1.level], [t1.__pk_increment]), range(1,MIN ; 1,MAX), 
      range_cond([t1.level = 1])
select level,id from t1 where level=1;
level	id
1	1004
1	1005
1	1003
1	1007
1	1008
1	1006
select level,id,parent_id from t1 where level=1;
level	id	parent_id
1	1004	101
1	1005	101
1	1003	101
1	1007	101
1	1008	101
1	1006	101
select level,id from t1 where level=1 order by id;
level	id
1	1003
1	1004
1	1005
1	1006
1	1007
1	1008
delete from t1 where level=1;
select * from t1;
id	parent_id	level
1002	100	0
1009	102	2
1025	102	2
1018	103	2
1023	104	2
1025	104	2
1029	105	2
1030	105	2
1031	105	2
1032	106	2
1033	106	2
1034	106	2
1204	107	2
1203	107	2
1021	103	2
1158	100	0
1194	105	2
1041	107	2
1016	102	2
1035	106	2
1036	106	2
1017	103	2
1037	107	2
1019	103	2
1027	105	2
1028	105	2
1184	104	2
1039	107	2
1026	105	2
1038	107	2
1022	104	2
1020	103	2
1180	105	2
drop table t1;
CREATE TABLE t1 (
sca_code char(6) NOT NULL,
cat_code char(6) NOT NULL,
sca_desc varchar(50),
lan_code char(2) NOT NULL,
sca_pic varchar(100),
sca_sdesc varchar(50),
sca_sch_desc varchar(16),
PRIMARY KEY (sca_code, cat_code, lan_code),
INDEX sca_pic (sca_pic)
) ;
INSERT INTO t1 ( sca_code, cat_code, sca_desc, lan_code, sca_pic, sca_sdesc, sca_sch_desc) VALUES ( 'PD', 'J', 'PENDANT', 'EN', NULL, NULL, 'PENDANT'),( 'RI', 'J', 'RING', 'EN', NULL, NULL, 'RING'),( 'QQ', 'N', 'RING', 'EN', 'not null', NULL, 'RING');
select count(*) from t1 where sca_code = 'PD';
count(*)
1
select count(*) from t1 where sca_code <= 'PD';
count(*)
1
select count(*) from t1 where sca_pic is null;
count(*)
2
alter table t1 drop index sca_pic;
alter table t1 add index sca_pic (cat_code, sca_pic);
select count(*) from t1 where sca_code='PD' and sca_pic is null;
count(*)
1
select count(*) from t1 where cat_code='E';
count(*)
0
alter table t1 drop index sca_pic;
alter table t1 add index (sca_pic, cat_code);
select count(*) from t1 where sca_code='PD' and sca_pic is null;
count(*)
1
select count(*) from t1 where sca_pic >= 'n';
count(*)
1
select sca_pic from t1 where sca_pic is null;
sca_pic
NULL
NULL
update t1 set sca_pic="test" where sca_pic is null;
delete from t1 where sca_code='pd';
drop table t1;
set @a:=now();
CREATE TABLE t1 (a int not null, b timestamp not null, primary key (a)) ;
insert into t1 (a) values(1),(2),(3);
select t1.a from t1  join t1 as t2 where t1.b >= @a order by t1.a;
a
1
1
1
2
2
2
3
3
3
select a from t1 join t1 as t2 where b >= @a order by a;
ERROR 23000: Column 'b' in where clause is ambiguous
update t1 set a=5 where a=1;
select a from t1;
a
2
3
5
drop table t1;
create table t1 (a varchar(100) not null, primary key(a), b int not null) ;
insert into t1 values("hello",1),("world",2);
select * from t1 order by b desc;
a	b
world	2
hello	1
show keys from t1;
Table	Non_unique	Key_name	Seq_in_index	Column_name	Collation	Cardinality	Sub_part	Packed	Null	Index_type	Comment	Index_comment	Visible	Expression
t1	0	PRIMARY	1	a	A	#	NULL	NULL		BTREE	available		YES	NULL
drop table t1;
create table t1 (i int, j int ) ;
insert into t1 values (1,2);
select * from t1 where i=1 and j=2;
i	j
1	2
create index ax1 on t1 (i,j);
select * from t1 where i=1 and j=2;
i	j
1	2
drop table t1;
CREATE TABLE t1 (
a int unsigned NOT NULL,
b int unsigned NOT NULL,
UNIQUE (a, b)
) ;
INSERT INTO t1 VALUES (1, 1);
SELECT MIN(B),MAX(b) FROM t1 WHERE t1.a = 1;
MIN(B)	MAX(b)
1	1
drop table t1;
CREATE TABLE t1 (a int unsigned NOT NULL) ;
INSERT INTO t1 VALUES (1);
SELECT * FROM t1;
a
1
DROP TABLE t1;
create table t1 (a int  primary key,b int, c int, d int, e int, f int, g int, h int, i int, j int, k int, l int, m int, n int, o int, p int, q int, r int, s int, t int, u int, v int, w int, x int, y int, z int, a1 int, a2 int, a3 int, a4 int, a5 int, a6 int, a7 int, a8 int, a9 int, b1 int, b2 int, b3 int, b4 int, b5 int, b6 int) ;
insert into t1 values (1,1,1,1,1,1,1,1,1,1,1,1,1,1,1,1,1,1,1,1,1,1,1,1,1,1,1,1,1,1,1,1,1,1,1,1,1,1,1,1,1);
explain  select * from t1 where a > 0 and a < 50;
Query Plan
================================================
|ID|OPERATOR        |NAME|EST.ROWS|EST.TIME(us)|
------------------------------------------------
|0 |TABLE RANGE SCAN|t1  |1       |4           |
================================================
Outputs & filters:
-------------------------------------
  0 - output([t1.a], [t1.b], [t1.c], [t1.d], [t1.e], [t1.f], [t1.g], [t1.h], [t1.i], [t1.j], [t1.k], [t1.l], [t1.m], [t1.n], [t1.o], [t1.p], [t1.q], [t1.r],
       [t1.s], [t1.t], [t1.u], [t1.v], [t1.w], [t1.x], [t1.y], [t1.z], [t1.a1], [t1.a2], [t1.a3], [t1.a4], [t1.a5], [t1.a6], [t1.a7], [t1.a8], [t1.a9], [t1.b1],
       [t1.b2], [t1.b3], [t1.b4], [t1.b5], [t1.b6]), filter(nil), rowset=16
      access([t1.a], [t1.b], [t1.c], [t1.d], [t1.e], [t1.f], [t1.g], [t1.h], [t1.i], [t1.j], [t1.k], [t1.l], [t1.m], [t1.n], [t1.o], [t1.p], [t1.q], [t1.r],
       [t1.s], [t1.t], [t1.u], [t1.v], [t1.w], [t1.x], [t1.y], [t1.z], [t1.a1], [t1.a2], [t1.a3], [t1.a4], [t1.a5], [t1.a6], [t1.a7], [t1.a8], [t1.a9], [t1.b1],
       [t1.b2], [t1.b3], [t1.b4], [t1.b5], [t1.b6]), partitions(p0)
      is_index_back=false, is_global_index=false, 
      range_key([t1.a]), range(0 ; 50), 
      range_cond([t1.a > 0], [t1.a < 50])
drop table t1;
create table t1 (id int NOT NULL,id2 int NOT NULL,id3 int NOT NULL,dummy1 char(30),primary key (id,id2),index index_id3 (id3)) ;
insert into t1 values (0,0,0,'ABCDEFGHIJ'),(2,2,2,'BCDEFGHIJK'),(1,1,1,'CDEFGHIJKL');
insert into t1 values (99,1,2,'D'),(1,1,2,'D');
ERROR 23000: Duplicate entry '1-1' for key 'PRIMARY'
select id from t1;
id
0
1
2
select id from t1;
id
0
1
2
DROP TABLE t1;
create table t1 (id int NOT NULL,id2 int NOT NULL,id3 int NOT NULL,dummy1 char(30),primary key (id,id2),index index_id3 (id3)) ;
insert into t1 values (0,0,0,'ABCDEFGHIJ'),(2,2,2,'BCDEFGHIJK'),(1,1,1,'CDEFGHIJKL');
begin;
insert into t1 values (99,1,2,'D'),(1,1,2,'D');
ERROR 23000: Duplicate entry '1-1' for key 'PRIMARY'
select id from t1;
id
0
1
2
insert into t1 values (100,1,2,'D'),(1,1,99,'D');
ERROR 23000: Duplicate entry '1-1' for key 'PRIMARY'
commit;
select id,id3 from t1;
id	id3
0	0
1	1
2	2
DROP TABLE t1;
create table t1 (a char(20), unique (a)) ;
drop table t1;
create table t1 (a char(20), index (a)) ;
show create table t1;
Table	Create Table
t1	CREATE TABLE `t1` (
  `a` char(20) DEFAULT NULL,
  KEY `a` (`a`) BLOCK_SIZE 16384 LOCAL
) ORGANIZATION INDEX DEFAULT CHARSET = utf8mb4 COMPRESSION = 'lz4_1.0' REPLICA_NUM = NUM BLOCK_SIZE = SIZE USE_BLOOM_FILTER = FALSE ENABLE_MACRO_BLOCK_BLOOM_FILTER = FALSE TABLET_SIZE = SIZE PCTFREE = 10
drop table t1;
create table t1 (a int not null auto_increment, primary key(a)) ;
insert into t1 values (NULL),(NULL),(NULL);
delete from t1 where a=3;
insert into t1 values (NULL);
select * from t1;
a
1
2
4
alter table t1 add b int;
select * from t1;
a	b
1	NULL
2	NULL
4	NULL
drop table t1;
create table t1
(
id int auto_increment primary key,
name varchar(32) not null,
value varchar(512) not null,
uid int not null,
unique key(name,uid)
) ;
insert into t1 values (1,'one','one value',101),
(2,'two','two value',102),(3,'three','three value',103);
replace into t1 (value,name,uid) values ('other value','two',102);
delete from t1 where uid=102;
replace into t1 (value,name,uid) values ('other value','two',102);
replace into t1 (value,name,uid) values ('other value','two',102);
select * from t1;
id	name	value	uid
1	one	one value	101
3	three	three value	103
6	two	other value	102
drop table t1;
create database mysqltest;
create table mysqltest.t1 (a int not null);
insert into mysqltest.t1 values(1);
create table mysqltest.t2 (a int not null);
insert into mysqltest.t2 values(1);
create table mysqltest.t3 (a int not null);
insert into mysqltest.t3 values(1);
commit;
drop database mysqltest;
show tables from mysqltest;
ERROR 42000: Unknown database 'mysqltest'
set autocommit=0;
create table t1 (a int not null);
insert into t1 values(1),(2);
truncate table t1;
commit;
truncate table t1;
truncate table t1;
select * from t1;
a
insert into t1 values(1),(2);
delete from t1;
select * from t1;
a
commit;
drop table t1;
set autocommit=1;
create table t1 (a int not null);
insert into t1 values(1),(2);
truncate table t1;
insert into t1 values(1),(2);
select * from t1;
a
1
2
truncate table t1;
insert into t1 values(1),(2);
delete from t1;
select * from t1;
a
drop table t1;
create table t1 (a int not null, b int not null, c int not null, primary key (a),key(b)) ;
insert into t1 values (3,3,3),(1,1,1),(2,2,2),(4,4,4);
explain  select * from t1 order by a;
Query Plan
===============================================
|ID|OPERATOR       |NAME|EST.ROWS|EST.TIME(us)|
-----------------------------------------------
|0 |TABLE FULL SCAN|t1  |4       |3           |
===============================================
Outputs & filters:
-------------------------------------
  0 - output([t1.a], [t1.b], [t1.c]), filter(nil), rowset=16
      access([t1.a], [t1.b], [t1.c]), partitions(p0)
      is_index_back=false, is_global_index=false, 
      range_key([t1.a]), range(MIN ; MAX)always true
explain  select * from t1 order by b;
Query Plan
=================================================
|ID|OPERATOR         |NAME|EST.ROWS|EST.TIME(us)|
-------------------------------------------------
|0 |SORT             |    |4       |3           |
|1 |└─TABLE FULL SCAN|t1  |4       |3           |
=================================================
Outputs & filters:
-------------------------------------
  0 - output([t1.a], [t1.b], [t1.c]), filter(nil), rowset=16
      sort_keys([t1.b, ASC])
  1 - output([t1.a], [t1.b], [t1.c]), filter(nil), rowset=16
      access([t1.a], [t1.b], [t1.c]), partitions(p0)
      is_index_back=false, is_global_index=false, 
      range_key([t1.a]), range(MIN ; MAX)always true
explain  select * from t1 order by c;
Query Plan
=================================================
|ID|OPERATOR         |NAME|EST.ROWS|EST.TIME(us)|
-------------------------------------------------
|0 |SORT             |    |4       |3           |
|1 |└─TABLE FULL SCAN|t1  |4       |3           |
=================================================
Outputs & filters:
-------------------------------------
  0 - output([t1.a], [t1.b], [t1.c]), filter(nil), rowset=16
      sort_keys([t1.c, ASC])
  1 - output([t1.a], [t1.b], [t1.c]), filter(nil), rowset=16
      access([t1.a], [t1.b], [t1.c]), partitions(p0)
      is_index_back=false, is_global_index=false, 
      range_key([t1.a]), range(MIN ; MAX)always true
explain  select a from t1 order by a;
Query Plan
===============================================
|ID|OPERATOR       |NAME|EST.ROWS|EST.TIME(us)|
-----------------------------------------------
|0 |TABLE FULL SCAN|t1  |4       |3           |
===============================================
Outputs & filters:
-------------------------------------
  0 - output([t1.a]), filter(nil), rowset=16
      access([t1.a]), partitions(p0)
      is_index_back=false, is_global_index=false, 
      range_key([t1.a]), range(MIN ; MAX)always true
explain  select b from t1 order by b;
Query Plan
================================================
|ID|OPERATOR       |NAME |EST.ROWS|EST.TIME(us)|
------------------------------------------------
|0 |TABLE FULL SCAN|t1(b)|4       |3           |
================================================
Outputs & filters:
-------------------------------------
  0 - output([t1.b]), filter(nil), rowset=16
      access([t1.b]), partitions(p0)
      is_index_back=false, is_global_index=false, 
      range_key([t1.b], [t1.a]), range(MIN,MIN ; MAX,MAX)always true
explain  select a,b from t1 order by b;
Query Plan
================================================
|ID|OPERATOR       |NAME |EST.ROWS|EST.TIME(us)|
------------------------------------------------
|0 |TABLE FULL SCAN|t1(b)|4       |3           |
================================================
Outputs & filters:
-------------------------------------
  0 - output([t1.a], [t1.b]), filter(nil), rowset=16
      access([t1.a], [t1.b]), partitions(p0)
      is_index_back=false, is_global_index=false, 
      range_key([t1.b], [t1.a]), range(MIN,MIN ; MAX,MAX)always true
explain  select a,b from t1;
Query Plan
================================================
|ID|OPERATOR       |NAME |EST.ROWS|EST.TIME(us)|
------------------------------------------------
|0 |TABLE FULL SCAN|t1(b)|4       |3           |
================================================
Outputs & filters:
-------------------------------------
  0 - output([t1.a], [t1.b]), filter(nil), rowset=16
      access([t1.a], [t1.b]), partitions(p0)
      is_index_back=false, is_global_index=false, 
      range_key([t1.b], [t1.a]), range(MIN,MIN ; MAX,MAX)always true
explain  select a,b,c from t1;
Query Plan
===============================================
|ID|OPERATOR       |NAME|EST.ROWS|EST.TIME(us)|
-----------------------------------------------
|0 |TABLE FULL SCAN|t1  |4       |3           |
===============================================
Outputs & filters:
-------------------------------------
  0 - output([t1.a], [t1.b], [t1.c]), filter(nil), rowset=16
      access([t1.a], [t1.b], [t1.c]), partitions(p0)
      is_index_back=false, is_global_index=false, 
      range_key([t1.a]), range(MIN ; MAX)always true
drop table t1;
create table t1 (t int not null, key (t)) ;
desc t1;
Field	Type	Null	Key	Default	Extra
t	int(11)	NO	MUL	NULL	
drop table t1;
create table t1 (id int unsigned not null auto_increment, code tinyint unsigned not null, name char(20) not null, primary key (id), key (code), unique (name)) ;
BEGIN;
insert into t1 (code, name) values (1, 'Tim'), (1, 'Monty'), (2, 'David');
select id, code, name from t1 order by id;
id	code	name
1	1	Tim
2	1	Monty
3	2	David
COMMIT;
BEGIN;
insert into t1 (code, name) values (2, 'Erik'), (3, 'Sasha');
select id, code, name from t1 order by id;
id	code	name
1	1	Tim
2	1	Monty
3	2	David
4	2	Erik
5	3	Sasha
COMMIT;
BEGIN;
insert into t1 (code, name) values (3, 'Jeremy'), (4, 'Matt');
select id, code, name from t1 order by id;
id	code	name
1	1	Tim
2	1	Monty
3	2	David
4	2	Erik
5	3	Sasha
6	3	Jeremy
7	4	Matt
COMMIT;
DROP TABLE t1;
drop table if exists t1, t2;
CREATE TABLE t1 (a int, PRIMARY KEY (a));
CREATE TABLE t2 (a int, PRIMARY KEY (a)) ;
insert into t1 values (1);
insert into t2 values (1),(2);
select count(*) from t2 /* must be 2 as restored after rollback caused by the error */;
count(*)
2
drop table t1, t2;
drop table if exists t1, t2;
CREATE TABLE t1 (a int, PRIMARY KEY (a));
CREATE TABLE t2 (a int, PRIMARY KEY (a)) ;
insert into t1 values (1);
insert into t2 values (1),(2);
select count(*) from t2 /* must be 2 as restored after rollback caused by the error */;
count(*)
2
drop table t1, t2;
create table t1 (a int, b int) ;
insert into t1 values(20,null);
select t2.b, ifnull(t2.b,"this is null") from t1 as t2 left join t1 as t3 on
t2.b=t3.a;
b	ifnull(t2.b,"this is null")
NULL	this is null
select t2.b, ifnull(t2.b,"this is null") from t1 as t2 left join t1 as t3 on
t2.b=t3.a order by 1;
b	ifnull(t2.b,"this is null")
NULL	this is null
insert into t1 values(10,null);
select t2.b, ifnull(t2.b,"this is null") from t1 as t2 left join t1 as t3 on
t2.b=t3.a order by 1;
b	ifnull(t2.b,"this is null")
NULL	this is null
NULL	this is null
drop table t1;
create table t1 (a varchar(10) not null);
create table t2 (b varchar(10) not null unique) ;
select t1.a from t1,t2 where t1.a=t2.b;
a
drop table t1,t2;
create table t1 (a int not null, b int, primary key (a)) ;
create table t2 (a int not null, b int, primary key (a)) ;
insert into t1 values (10, 20);
insert into t2 values (10, 20);
drop table t1,t2;
CREATE TABLE t1 (id INT NOT NULL, PRIMARY KEY (id)) ;
CREATE TABLE t2 (id INT PRIMARY KEY, t1_id INT, INDEX par_ind (t1_id)) ;
insert into t1 set id=1;
insert into t2 set id=1, t1_id=1;
select * from t1;
id
1
select * from t2;
id	t1_id
1	1
drop table t2,t1;
CREATE TABLE t1(id INT NOT NULL,  PRIMARY KEY (id)) ;
CREATE TABLE t2(id  INT PRIMARY KEY, t1_id INT, INDEX par_ind (t1_id)) ;
INSERT INTO t1 VALUES(1);
INSERT INTO t2 VALUES(1, 1);
SELECT * from t1;
id
1
DROP TABLE t1,t2;
set autocommit=0;
CREATE TABLE t1 (id CHAR(15) NOT NULL, value CHAR(40) NOT NULL, PRIMARY KEY(id)) ;
CREATE TABLE t2 (id CHAR(15) NOT NULL, value CHAR(40) NOT NULL, PRIMARY KEY(id)) ;
CREATE TABLE t3 (id1 CHAR(15) NOT NULL, id2 CHAR(15) NOT NULL, PRIMARY KEY(id1, id2)) ;
INSERT INTO t3 VALUES("my-test-1", "my-test-2");
COMMIT;
INSERT INTO t1 VALUES("this-key", "will disappear");
INSERT INTO t2 VALUES("this-key", "will also disappear");
DELETE FROM t3 WHERE id1="my-test-1";
SELECT * FROM t1;
id	value
this-key	will disappear
SELECT * FROM t2;
id	value
this-key	will also disappear
SELECT * FROM t3;
id1	id2
ROLLBACK;
SELECT * FROM t1;
id	value
SELECT * FROM t2;
id	value
SELECT * FROM t3;
id1	id2
my-test-1	my-test-2
SELECT * FROM t3 WHERE id1="my-test-1" ##LOCK IN SHARE MODE;
id1	id2
my-test-1	my-test-2
COMMIT;
set autocommit=1;
DROP TABLE t1,t2,t3;
CREATE TABLE t1 (a int not null primary key, b int not null, unique (b)) ;
INSERT INTO t1 values (1,1),(2,2),(3,3),(4,4),(5,5),(6,6),(7,7),(8,8),(9,9);
UPDATE t1 set a=a+100 where b between 2 and 3 and a < 1000;
SELECT * from t1;
a	b
1	1
102	2
103	3
4	4
5	5
6	6
7	7
8	8
9	9
drop table t1;
CREATE TABLE t2 ( NEXT_T         BIGINT NOT NULL PRIMARY KEY);
CREATE TABLE t1 (  B_ID           INTEGER NOT NULL PRIMARY KEY) ;
SET AUTOCOMMIT=0;
INSERT INTO t1 ( B_ID ) VALUES ( 1 );
INSERT INTO t2 ( NEXT_T ) VALUES ( 1 );
ROLLBACK;
SELECT * FROM t1;
B_ID
drop table  t1,t2;
create table t1  ( pk         int primary key,    parent     int not null,    child      int not null,       index (parent)  ) ;
insert into t1 values   (1,0,4),  (2,1,3),  (3,2,1),  (4,1,2);
select distinct  parent,child   from t1   order by parent;
parent	child
0	4
1	2
1	3
2	1
drop table t1;
create table t1 (id int primary key auto_increment, fk int, index index_fk (fk)) ;
insert into t1 (id) values (null),(null),(null),(null),(null);
update t1 set fk=69 where fk is null order by id limit 1;
SELECT * from t1;
id	fk
1	69
2	NULL
3	NULL
4	NULL
5	NULL
drop table t1;
create table t1 (a int not null, b int not null, key (a));
insert into t1 values (1,1),(1,2),(1,3),(3,1),(3,2),(3,3),(3,1),(3,2),(3,3),(2,1),(2,2),(2,3);
SET @tmp=0;
update t1 set b=(@tmp:=@tmp+1) order by a;
update t1 set b=99 where a=1 order by b asc limit 1;
update t1 set b=100 where a=1 order by b desc limit 2;
update t1 set a=a+10+b where a=1 order by b;
select * from t1 order by a,b;
a	b
2	4
2	5
2	6
3	7
3	8
3	9
3	10
3	11
3	12
13	2
111	100
111	100
drop table t1;
create table t1 ( c char(8) not null ) ;
insert into t1 values ('0'),('1'),('2'),('3'),('4'),('5'),('6'),('7'),('8'),('9');
insert into t1 values ('A'),('B'),('C'),('D'),('E'),('F');
alter table t1 add b char(8) not null;
alter table t1 add a char(8) not null;
update t1 set a=c, b=c;
create table t2 (c char(8) not null, b char(8) not null, a char(8) not null, primary key(a,b,c)) ;
insert into t2 select * from t1;
drop table t1,t2;
SET AUTOCOMMIT=1;
create table t1 (a integer auto_increment primary key) ;
insert into t1 (a) values (NULL),(NULL);
truncate table t1;
insert into t1 (a) values (NULL),(NULL);
SELECT * from t1;
a
1
2
drop table t1;
CREATE TABLE t1 (`id 1` INT NOT NULL, PRIMARY KEY (`id 1`)) ;
CREATE TABLE t2 (id INT PRIMARY KEY, t1_id INT, INDEX par_ind (t1_id)) ;
drop table t2,t1;
create table `t1` (`id` int( 11 ) not null  ,primary key ( `id` )) ;
insert into `t1`values ( 1 ) ;
create table `t2` (`id` int( 11 ) not null,unique key `id` ( `id` )) ;
insert into `t2`values ( 1 ) ;
create table `t3` (`id` int( 11 ) not null ,key `id` ( `id` )) ;
insert into `t3`values ( 1 ) ;
update t3 set  t3.id=7  where t1.id =1 and t2.id = t1.id and t3.id = t2.id;
ERROR 42S22: Unknown column 't1.id' in 'where clause'
drop table t3,t2,t1;
CREATE TABLE t1 (
c1 VARCHAR(8), c2 VARCHAR(8),
PRIMARY KEY (c1, c2)
) ;
CREATE TABLE t2 (
c0 INT PRIMARY KEY,
c1 VARCHAR(8) UNIQUE) ;
INSERT INTO t1 VALUES ('old', 'somevalu'), ('other', 'anyvalue');
INSERT INTO t2 VALUES (10, 'old'), (20, 'other');
UPDATE t1 SET c1 = 'other' WHERE c1 = 'old';
DROP TABLE t2,t1;
create table t1(
id int primary key,
pid int,
index(pid));
insert into t1 values(0,0),(1,0),(2,1),(3,2),(4,3),(5,4),(6,5),(7,6),
(8,7),(9,8),(10,9),(11,10),(12,11),(13,12),(14,13),(15,14);
delete from t1 where id=0;
delete from t1 where id=15;
delete from t1 where id=0;
drop table t1;
CREATE TABLE t1 (col1 int(1));
CREATE TABLE t2 (col1 int(1),stamp TIMESTAMP,INDEX stamp_idx (stamp));
insert into t1 values (1),(2),(3);
insert into t2 values (1, 20020204130000),(2, 20020204130000),(4,20020204310000 ),(5,20020204230000);
ERROR 22007: Incorrect datetime value for column 'stamp' at row 3
SELECT col1 FROM t1 UNION SELECT col1 FROM t2 WHERE stamp <
'20020204120000' GROUP BY col1;
col1
1
2
3
drop table t1,t2;
CREATE TABLE t1 (
`id` int(10) unsigned NOT NULL auto_increment,
`id_object` int(10) unsigned ,
`id_version` int(10) unsigned NOT NULL ,
`label` varchar(100) NOT NULL ,
`description` varchar(512),
PRIMARY KEY  (`id`),
KEY `id_object` (`id_object`),
KEY `id_version` (`id_version`)
) ;
INSERT INTO t1 VALUES("6", "3382", "9", "Test", NULL), ("7", "102", "5", "Le Pekin (Test)", NULL),("584", "1794", "4", "Test de resto", NULL),("837", "1822", "6", "Test 3", NULL),("1119", "3524", "1", "Societe Test", NULL),("1122", "3525", "1", "Fournisseur Test", NULL);
CREATE TABLE t2 (
`id` int(10) unsigned NOT NULL auto_increment,
`id_version` int(10) unsigned NOT NULL,
PRIMARY KEY  (`id`),
KEY `id_version` (`id_version`)
) ;
INSERT INTO t2 VALUES("3524", "1"),("3525", "1"),("1794", "4"),("102", "5"),("1822", "6"),("3382", "9");
SELECT t2.id, t1.`label` FROM t2 INNER JOIN
(SELECT t1.id_object as id_object FROM t1 WHERE t1.`label` LIKE '%test%') AS lbl 
ON (t2.id = lbl.id_object) INNER JOIN t1 ON (t2.id = t1.id_object) ORDER BY 1;
id	label
102	Le Pekin (Test)
1794	Test de resto
1822	Test 3
3382	Test
3524	Societe Test
3525	Fournisseur Test
drop table t1,t2;
create table t1 (a int, b varchar(200), c varchar(512) not null);
create table t2 (a int, b varchar(200), c varchar(512) not null);
create table t3 (a int, b varchar(200), c varchar(512) not null);
insert t1 values (1, "aaa", "bbb"), (NULL, "", "ccccc"), (0, NULL, "");
insert t2 select * from t1;
insert t3 select * from t1;
drop table t1,t2,t3;
create table t1 (id int,  name char(10) not null,  name2 char(10) not null) ;
insert into t1 values(1,'first','fff'),(2,'second','sss'),(3,'third','ttt');
select trim(name2) from t1  union all  select trim(name) from t1 union all select trim(id) from t1;
trim(name2)
fff
sss
ttt
first
second
third
1
2
3
drop table t1;
create table t1 (a int) ;
create table t2 like t1;
drop table t1,t2;
create table t1 (id int(11) not null, id2 int(11) not null, unique (id,id2)) ;
create table t2 (id int(11) not null) ;
show create table t1;
Table	Create Table
t1	CREATE TABLE `t1` (
  `id` int(11) NOT NULL,
  `id2` int(11) NOT NULL,
  UNIQUE KEY `id` (`id`, `id2`) BLOCK_SIZE 16384 LOCAL
) ORGANIZATION INDEX DEFAULT CHARSET = utf8mb4 COMPRESSION = 'lz4_1.0' REPLICA_NUM = NUM BLOCK_SIZE = SIZE USE_BLOOM_FILTER = FALSE ENABLE_MACRO_BLOCK_BLOOM_FILTER = FALSE TABLET_SIZE = SIZE PCTFREE = 10
show create table t2;
Table	Create Table
t2	CREATE TABLE `t2` (
  `id` int(11) NOT NULL
) ORGANIZATION INDEX DEFAULT CHARSET = utf8mb4 COMPRESSION = 'lz4_1.0' REPLICA_NUM = NUM BLOCK_SIZE = SIZE USE_BLOOM_FILTER = FALSE ENABLE_MACRO_BLOCK_BLOOM_FILTER = FALSE TABLET_SIZE = SIZE PCTFREE = 10
create index id on t2 (id);
show create table t2;
Table	Create Table
t2	CREATE TABLE `t2` (
  `id` int(11) NOT NULL,
  KEY `id` (`id`) BLOCK_SIZE 16384 LOCAL
) ORGANIZATION INDEX DEFAULT CHARSET = utf8mb4 COMPRESSION = 'lz4_1.0' REPLICA_NUM = NUM BLOCK_SIZE = SIZE USE_BLOOM_FILTER = FALSE ENABLE_MACRO_BLOCK_BLOOM_FILTER = FALSE TABLET_SIZE = SIZE PCTFREE = 10
create index id2 on t2 (id);
show create table t2;
Table	Create Table
t2	CREATE TABLE `t2` (
  `id` int(11) NOT NULL,
  KEY `id` (`id`) BLOCK_SIZE 16384 LOCAL,
  KEY `id2` (`id`) BLOCK_SIZE 16384 LOCAL
) ORGANIZATION INDEX DEFAULT CHARSET = utf8mb4 COMPRESSION = 'lz4_1.0' REPLICA_NUM = NUM BLOCK_SIZE = SIZE USE_BLOOM_FILTER = FALSE ENABLE_MACRO_BLOCK_BLOOM_FILTER = FALSE TABLET_SIZE = SIZE PCTFREE = 10
drop index id2 on t2;
drop index id on t2;
show create table t2;
Table	Create Table
t2	CREATE TABLE `t2` (
  `id` int(11) NOT NULL
) ORGANIZATION INDEX DEFAULT CHARSET = utf8mb4 COMPRESSION = 'lz4_1.0' REPLICA_NUM = NUM BLOCK_SIZE = SIZE USE_BLOOM_FILTER = FALSE ENABLE_MACRO_BLOCK_BLOOM_FILTER = FALSE TABLET_SIZE = SIZE PCTFREE = 10
drop table t1,t2;
create table t2 (id int(11) not null, id2 int(11) not null) ;
show create table t2;
Table	Create Table
t2	CREATE TABLE `t2` (
  `id` int(11) NOT NULL,
  `id2` int(11) NOT NULL
) ORGANIZATION INDEX DEFAULT CHARSET = utf8mb4 COMPRESSION = 'lz4_1.0' REPLICA_NUM = NUM BLOCK_SIZE = SIZE USE_BLOOM_FILTER = FALSE ENABLE_MACRO_BLOCK_BLOOM_FILTER = FALSE TABLET_SIZE = SIZE PCTFREE = 10
create unique index id on t2 (id,id2);
show create table t2;
Table	Create Table
t2	CREATE TABLE `t2` (
  `id` int(11) NOT NULL,
  `id2` int(11) NOT NULL,
  UNIQUE KEY `id` (`id`, `id2`) BLOCK_SIZE 16384 LOCAL
) ORGANIZATION INDEX DEFAULT CHARSET = utf8mb4 COMPRESSION = 'lz4_1.0' REPLICA_NUM = NUM BLOCK_SIZE = SIZE USE_BLOOM_FILTER = FALSE ENABLE_MACRO_BLOCK_BLOOM_FILTER = FALSE TABLET_SIZE = SIZE PCTFREE = 10
drop table t2;
create table t1 (c char(10), index (c,c)) ;
ERROR 42S21: Duplicate column name 'c'
create table t1 (c1 char(10), c2 char(10), index (c1,c2,c1)) ;
ERROR 42S21: Duplicate column name 'c1'
create table t1 (c1 char(10), c2 char(10), index (c1,c1,c2)) ;
ERROR 42S21: Duplicate column name 'c1'
create table t1 (c1 char(10), c2 char(10), index (c2,c1,c1)) ;
ERROR 42S21: Duplicate column name 'c1'
create table t1 (c1 char(10), c2 char(10)) ;
alter table t1 add key (c1,c1);
ERROR 42S21: Duplicate column name 'c1'
alter table t1 add key (c2,c1,c1);
ERROR 42S21: Duplicate column name 'c1'
alter table t1 add key (c1,c2,c1);
ERROR 42S21: Duplicate column name 'c1'
alter table t1 add key (c1,c1,c2);
ERROR 42S21: Duplicate column name 'c1'
drop table t1;
CREATE TABLE t1 (a_id tinyint(4) NOT NULL, PRIMARY KEY  (a_id))  ;
INSERT INTO t1 VALUES (1),(2),(3);
CREATE TABLE t2 (b_id tinyint(4) NOT NULL ,b_a tinyint(4) NOT NULL , PRIMARY KEY  (b_id), KEY  (b_a));
INSERT INTO t2 VALUES (1,1),(2,1),(3,1),(4,2),(5,2);
SELECT * FROM (SELECT t1.*,GROUP_CONCAT(t2.b_id SEPARATOR ',') as b_list FROM (t1 LEFT JOIN (t2) on t1.a_id = t2.b_a) GROUP BY t1.a_id ) AS xyz;
a_id	b_list
1	1,2,3
2	4,5
3	NULL
DROP TABLE t2;
DROP TABLE t1;
create table t1 (a int) ;
insert into t1 values (4711);
truncate t1;
insert into t1 values (42);
select * from t1;
a
42
drop table t1;
create table t1 (a int) ;
insert into t1 values (4711);
truncate t1;
insert into t1 values (42);
select * from t1;
a
42
drop table t1;
create table t1 (a int not null, b int not null, c varbinary(512) not null, d int not null, e int, primary key (a,b,c,d)) ;
insert into t1 values (2,2,"b",2,2),(1,1,"a",1,1),(3,3,"ab",3,3);
select * from t1 order by a,b,c,d;
a	b	c	d	e
1	1	a	1	1
2	2	b	2	2
3	3	ab	3	3
explain  select * from t1 order by a,b,c,d;
Query Plan
===============================================
|ID|OPERATOR       |NAME|EST.ROWS|EST.TIME(us)|
-----------------------------------------------
|0 |TABLE FULL SCAN|t1  |3       |3           |
===============================================
Outputs & filters:
-------------------------------------
  0 - output([t1.a], [t1.b], [t1.c], [t1.d], [t1.e]), filter(nil), rowset=16
      access([t1.a], [t1.b], [t1.c], [t1.d], [t1.e]), partitions(p0)
      is_index_back=false, is_global_index=false, 
      range_key([t1.a], [t1.b], [t1.c], [t1.d]), range(MIN,MIN,MIN,MIN ; MAX,MAX,MAX,MAX)always true
drop table t1;
create table t1 (a char(1), b char(1), key(a, b)) ;
insert into t1 values ('8', '6'), ('4', '7');
select min(a) from t1;
min(a)
4
select min(b) from t1 where a='8';
min(b)
6
drop table t1;
create table t1 (x bigint unsigned not null primary key) ;
insert into t1(x) values (0xfffffffffffffff0),(0xfffffffffffffff1);
select * from t1;
x
18446744073709551600
18446744073709551601
select count(*) from t1 where x>0;
count(*)
2
select count(*) from t1 where x=0;
count(*)
0
select count(*) from t1 where x<0;
count(*)
0
select count(*) from t1 where x < -16;
count(*)
0
select count(*) from t1 where x = -16;
count(*)
0
explain  select count(*) from t1 where x > -16;
Query Plan
==================================================
|ID|OPERATOR          |NAME|EST.ROWS|EST.TIME(us)|
--------------------------------------------------
|0 |SCALAR GROUP BY   |    |1       |3           |
|1 |└─TABLE RANGE SCAN|t1  |2       |3           |
==================================================
Outputs & filters:
-------------------------------------
  0 - output([T_FUN_COUNT_SUM(T_FUN_COUNT(*))]), filter(nil), rowset=16
      group(nil), agg_func([T_FUN_COUNT_SUM(T_FUN_COUNT(*))])
  1 - output([T_FUN_COUNT(*)]), filter(nil), rowset=16
      access(nil), partitions(p0)
      is_index_back=false, is_global_index=false, 
      range_key([t1.x]), range[0 ; MAX), 
      range_cond([t1.x > -16]), 
      pushdown_aggregation([T_FUN_COUNT(*)])
select count(*) from t1 where x > -16;
count(*)
2
select * from t1 where x > -16;
x
18446744073709551600
18446744073709551601
select count(*) from t1 where x = 18446744073709551601;
count(*)
1
drop table t1;
SELECT variable_value FROM information_schema.global_status WHERE LOWER(variable_name) = 'innodb_buffer_pool_pages_total';
variable_value
SELECT variable_value FROM information_schema.global_status WHERE LOWER(variable_name) = 'innodb_page_size';
variable_value
SELECT variable_value - @innodb_rows_deleted_orig FROM information_schema.global_status WHERE LOWER(variable_name) = 'innodb_rows_deleted';
variable_value - @innodb_rows_deleted_orig
SELECT variable_value - @innodb_rows_inserted_orig FROM information_schema.global_status WHERE LOWER(variable_name) = 'innodb_rows_inserted';
variable_value - @innodb_rows_inserted_orig
SELECT variable_value - @innodb_rows_updated_orig FROM information_schema.global_status WHERE LOWER(variable_name) = 'innodb_rows_updated';
variable_value - @innodb_rows_updated_orig
SELECT variable_value - @innodb_row_lock_waits_orig FROM information_schema.global_status WHERE LOWER(variable_name) = 'innodb_row_lock_waits';
variable_value - @innodb_row_lock_waits_orig
SELECT variable_value - @innodb_row_lock_current_waits_orig FROM information_schema.global_status WHERE LOWER(variable_name) = 'innodb_row_lock_current_waits';
variable_value - @innodb_row_lock_current_waits_orig
SELECT variable_value - @innodb_row_lock_time_orig FROM information_schema.global_status WHERE LOWER(variable_name) = 'innodb_row_lock_time';
variable_value - @innodb_row_lock_time_orig
SELECT variable_value - @innodb_row_lock_time_max_orig FROM information_schema.global_status WHERE LOWER(variable_name) = 'innodb_row_lock_time_max';
variable_value - @innodb_row_lock_time_max_orig
SELECT variable_value - @innodb_row_lock_time_avg_orig FROM information_schema.global_status WHERE LOWER(variable_name) = 'innodb_row_lock_time_avg';
variable_value - @innodb_row_lock_time_avg_orig
drop table if exists t1,t2,t3;
--- Testing varchar ---
--- Testing varchar ---
create table t1 (v varchar(10), c char(10), t varchar(1024));
insert into t1 values('+ ', '+ ', '+ ');
set @a=repeat(' ',20);
insert into t1 values (concat('+',@a),concat('+',@a),concat('+',@a));
Warnings:
Warning	1265	Data truncated for column '"test"."t1"."v"' at row 1
Warning	1265	Data truncated for column '"test"."t1"."c"' at row 1
select concat('*',v,'*',c,'*',t,'*') from t1;
concat('*',v,'*',c,'*',t,'*')
*+ *+*+ *
*+         *+*+                    *
show create table t1;
Table	Create Table
t1	CREATE TABLE `t1` (
  `v` varchar(10) DEFAULT NULL,
  `c` char(10) DEFAULT NULL,
  `t` varchar(1024) DEFAULT NULL
) ORGANIZATION INDEX DEFAULT CHARSET = utf8mb4 COMPRESSION = 'lz4_1.0' REPLICA_NUM = NUM BLOCK_SIZE = SIZE USE_BLOOM_FILTER = FALSE ENABLE_MACRO_BLOCK_BLOOM_FILTER = FALSE TABLET_SIZE = SIZE PCTFREE = 10
create table t2 like t1;
show create table t2;
Table	Create Table
t2	CREATE TABLE `t2` (
  `v` varchar(10) DEFAULT NULL,
  `c` char(10) DEFAULT NULL,
  `t` varchar(1024) DEFAULT NULL
) ORGANIZATION INDEX DEFAULT CHARSET = utf8mb4 COMPRESSION = 'lz4_1.0' REPLICA_NUM = NUM BLOCK_SIZE = SIZE USE_BLOOM_FILTER = FALSE ENABLE_MACRO_BLOCK_BLOOM_FILTER = FALSE TABLET_SIZE = SIZE PCTFREE = 10
create table t3 like t2;
show create table t3;
Table	Create Table
t3	CREATE TABLE `t3` (
  `v` varchar(10) DEFAULT NULL,
  `c` char(10) DEFAULT NULL,
  `t` varchar(1024) DEFAULT NULL
) ORGANIZATION INDEX DEFAULT CHARSET = utf8mb4 COMPRESSION = 'lz4_1.0' REPLICA_NUM = NUM BLOCK_SIZE = SIZE USE_BLOOM_FILTER = FALSE ENABLE_MACRO_BLOCK_BLOOM_FILTER = FALSE TABLET_SIZE = SIZE PCTFREE = 10
select concat('*',v,'*',c,'*',t,'*') from t1;
concat('*',v,'*',c,'*',t,'*')
*+ *+*+ *
*+         *+*+                    *
drop table t1,t2,t3;
create table t1 (v varchar(10), c char(10), t varchar(512), key(v), key(c), key(t));
show create table t1;
Table	Create Table
t1	CREATE TABLE `t1` (
  `v` varchar(10) DEFAULT NULL,
  `c` char(10) DEFAULT NULL,
  `t` varchar(512) DEFAULT NULL,
  KEY `v` (`v`) BLOCK_SIZE 16384 LOCAL,
  KEY `c` (`c`) BLOCK_SIZE 16384 LOCAL,
  KEY `t` (`t`) BLOCK_SIZE 16384 LOCAL
) ORGANIZATION INDEX DEFAULT CHARSET = utf8mb4 COMPRESSION = 'lz4_1.0' REPLICA_NUM = NUM BLOCK_SIZE = SIZE USE_BLOOM_FILTER = FALSE ENABLE_MACRO_BLOCK_BLOOM_FILTER = FALSE TABLET_SIZE = SIZE PCTFREE = 10
select count(*) from t1;
count(*)
1070
insert into t1 values(concat('a',char(1)),concat('a',char(1)),concat('a',char(1)));
select count(*) from t1 where v='a';
count(*)
20
select count(*) from t1 where c='a';
count(*)
20
select count(*) from t1 where t='a';
count(*)
20
select count(*) from t1 where v='a  ';
count(*)
20
select count(*) from t1 where c='a  ';
count(*)
20
select count(*) from t1 where t='a  ';
count(*)
20
select count(*) from t1 where v between 'a' and 'a ';
count(*)
20
select count(*) from t1 where v between 'a' and 'a ' and v between 'a  ' and 'b\n';
count(*)
20
select count(*) from t1 where v like 'a%';
count(*)
21
select count(*) from t1 where c like 'a%';
count(*)
21
select count(*) from t1 where t like 'a%';
count(*)
21
select count(*) from t1 where v like 'a %';
count(*)
18
explain select count(*) from t1 where v='a  ';
Query Plan
===================================================
|ID|OPERATOR          |NAME |EST.ROWS|EST.TIME(us)|
---------------------------------------------------
|0 |SCALAR GROUP BY   |     |1       |3           |
|1 |└─TABLE RANGE SCAN|t1(v)|20      |3           |
===================================================
Outputs & filters:
-------------------------------------
  0 - output([T_FUN_COUNT_SUM(T_FUN_COUNT(*))]), filter(nil), rowset=256
      group(nil), agg_func([T_FUN_COUNT_SUM(T_FUN_COUNT(*))])
  1 - output([T_FUN_COUNT(*)]), filter(nil), rowset=256
      access(nil), partitions(p0)
      is_index_back=false, is_global_index=false, 
      range_key([t1.v], [t1.__pk_increment]), range(a  ,MIN ; a  ,MAX), 
      range_cond([t1.v = 'a  ']), 
      pushdown_aggregation([T_FUN_COUNT(*)])
explain select count(*) from t1 where c='a  ';
Query Plan
===================================================
|ID|OPERATOR          |NAME |EST.ROWS|EST.TIME(us)|
---------------------------------------------------
|0 |SCALAR GROUP BY   |     |1       |3           |
|1 |└─TABLE RANGE SCAN|t1(c)|20      |3           |
===================================================
Outputs & filters:
-------------------------------------
  0 - output([T_FUN_COUNT_SUM(T_FUN_COUNT(*))]), filter(nil), rowset=256
      group(nil), agg_func([T_FUN_COUNT_SUM(T_FUN_COUNT(*))])
  1 - output([T_FUN_COUNT(*)]), filter(nil), rowset=256
      access(nil), partitions(p0)
      is_index_back=false, is_global_index=false, 
      range_key([t1.c], [t1.__pk_increment]), range(a  ,MIN ; a  ,MAX), 
      range_cond([t1.c = 'a  ']), 
      pushdown_aggregation([T_FUN_COUNT(*)])
explain select count(*) from t1 where t='a  ';
Query Plan
===================================================
|ID|OPERATOR          |NAME |EST.ROWS|EST.TIME(us)|
---------------------------------------------------
|0 |SCALAR GROUP BY   |     |1       |3           |
|1 |└─TABLE RANGE SCAN|t1(t)|20      |3           |
===================================================
Outputs & filters:
-------------------------------------
  0 - output([T_FUN_COUNT_SUM(T_FUN_COUNT(*))]), filter(nil), rowset=256
      group(nil), agg_func([T_FUN_COUNT_SUM(T_FUN_COUNT(*))])
  1 - output([T_FUN_COUNT(*)]), filter(nil), rowset=256
      access(nil), partitions(p0)
      is_index_back=false, is_global_index=false, 
      range_key([t1.t], [t1.__pk_increment]), range(a  ,MIN ; a  ,MAX), 
      range_cond([t1.t = 'a  ']), 
      pushdown_aggregation([T_FUN_COUNT(*)])
explain select count(*) from t1 where v like 'a%';
Query Plan
===================================================
|ID|OPERATOR          |NAME |EST.ROWS|EST.TIME(us)|
---------------------------------------------------
|0 |SCALAR GROUP BY   |     |1       |3           |
|1 |└─TABLE RANGE SCAN|t1(v)|21      |3           |
===================================================
Outputs & filters:
-------------------------------------
  0 - output([T_FUN_COUNT_SUM(T_FUN_COUNT(*))]), filter(nil), rowset=256
      group(nil), agg_func([T_FUN_COUNT_SUM(T_FUN_COUNT(*))])
  1 - output([T_FUN_COUNT(*)]), filter(nil), rowset=256
      access(nil), partitions(p0)
      is_index_back=false, is_global_index=false, 
      range_key([t1.v], [t1.__pk_increment]), range(a,MIN ; a￿￿￿￿￿￿￿￿￿￿￿￿￿,MAX), 
      range_cond([(T_OP_LIKE, t1.v, 'a%', '\\')]), 
      pushdown_aggregation([T_FUN_COUNT(*)])
explain select count(*) from t1 where v between 'a' and 'a ';
Query Plan
===================================================
|ID|OPERATOR          |NAME |EST.ROWS|EST.TIME(us)|
---------------------------------------------------
|0 |SCALAR GROUP BY   |     |1       |3           |
|1 |└─TABLE RANGE SCAN|t1(v)|20      |3           |
===================================================
Outputs & filters:
-------------------------------------
  0 - output([T_FUN_COUNT_SUM(T_FUN_COUNT(*))]), filter(nil), rowset=256
      group(nil), agg_func([T_FUN_COUNT_SUM(T_FUN_COUNT(*))])
  1 - output([T_FUN_COUNT(*)]), filter(nil), rowset=256
      access(nil), partitions(p0)
      is_index_back=false, is_global_index=false, 
      range_key([t1.v], [t1.__pk_increment]), range(a,MIN ; a ,MAX), 
      range_cond([t1.v >= 'a'], [t1.v <= 'a ']), 
      pushdown_aggregation([T_FUN_COUNT(*)])
explain select count(*) from t1 where v between 'a' and 'a ' and v between 'a  ' and 'b\n';
Query Plan
===================================================
|ID|OPERATOR          |NAME |EST.ROWS|EST.TIME(us)|
---------------------------------------------------
|0 |SCALAR GROUP BY   |     |1       |3           |
|1 |└─TABLE RANGE SCAN|t1(v)|20      |3           |
===================================================
Outputs & filters:
-------------------------------------
  0 - output([T_FUN_COUNT_SUM(T_FUN_COUNT(*))]), filter(nil), rowset=256
      group(nil), agg_func([T_FUN_COUNT_SUM(T_FUN_COUNT(*))])
  1 - output([T_FUN_COUNT(*)]), filter(nil), rowset=256
      access(nil), partitions(p0)
      is_index_back=false, is_global_index=false, 
      range_key([t1.v], [t1.__pk_increment]), range(a,MIN ; a ,MAX), 
      range_cond([t1.v >= 'a'], [t1.v <= 'a '], [t1.v >= 'a  '], [t1.v <= 'b\n']), 
      pushdown_aggregation([T_FUN_COUNT(*)])
alter table t1 add key(v);
select concat('*',v,'*',c,'*',t,'*') as qq from t1 where v='a';
qq
*a*a*a*
*A*A*A*
*a *a*a *
*A *A*A *
*a  *a*a  *
*A  *A*A  *
*a   *a*a   *
*A   *A*A   *
*a    *a*a    *
*A    *A*A    *
*a     *a*a     *
*A     *A*A     *
*a      *a*a      *
*A      *A*A      *
*a       *a*a       *
*A       *A*A       *
*a        *a*a        *
*A        *A*A        *
*a         *a*a         *
*A         *A*A         *
explain select * from t1 where v='a';
Query Plan
=================================================
|ID|OPERATOR        |NAME |EST.ROWS|EST.TIME(us)|
-------------------------------------------------
|0 |TABLE RANGE SCAN|t1(v)|20      |55          |
=================================================
Outputs & filters:
-------------------------------------
  0 - output([t1.v], [t1.c], [t1.t]), filter(nil), rowset=256
      access([t1.__pk_increment], [t1.v], [t1.c], [t1.t]), partitions(p0)
      is_index_back=true, is_global_index=false, 
      range_key([t1.v], [t1.__pk_increment]), range(a,MIN ; a,MAX), 
      range_cond([t1.v = 'a'])
select hex(v), hex(c), hex(t) from t1;
hex(v)	hex(c)	hex(t)
6A	6A	6A
69	69	69
68	68	68
67	67	67
66	66	66
65	65	65
64	64	64
63	63	63
62	62	62
61	61	61
60	60	60
5F	5F	5F
5E	5E	5E
5D	5D	5D
5C	5C	5C
5B	5B	5B
5A	5A	5A
59	59	59
58	58	58
57	57	57
56	56	56
55	55	55
54	54	54
53	53	53
52	52	52
51	51	51
50	50	50
4F	4F	4F
4E	4E	4E
4D	4D	4D
4C	4C	4C
4B	4B	4B
4A	4A	4A
49	49	49
48	48	48
47	47	47
46	46	46
45	45	45
44	44	44
43	43	43
42	42	42
41	41	41
40	40	40
3F	3F	3F
3E	3E	3E
3D	3D	3D
3C	3C	3C
3B	3B	3B
3A	3A	3A
39	39	39
38	38	38
37	37	37
36	36	36
35	35	35
34	34	34
33	33	33
32	32	32
31	31	31
30	30	30
2F	2F	2F
2E	2E	2E
2D	2D	2D
2C	2C	2C
2B	2B	2B
2A	2A	2A
29	29	29
28	28	28
27	27	27
26	26	26
25	25	25
24	24	24
23	23	23
22	22	22
21	21	21
20		20
1F	1F	1F
1E	1E	1E
1D	1D	1D
1C	1C	1C
1B	1B	1B
1A	1A	1A
19	19	19
18	18	18
17	17	17
16	16	16
15	15	15
14	14	14
13	13	13
12	12	12
11	11	11
10	10	10
0F	0F	0F
0E	0E	0E
0D	0D	0D
0C	0C	0C
0B	0B	0B
0A	0A	0A
09	09	09
08	08	08
07	07	07
06	06	06
05	05	05
04	04	04
03	03	03
02	02	02
01	01	01
00	00	00
6A20	6A	6A20
6920	69	6920
6820	68	6820
6720	67	6720
6620	66	6620
6520	65	6520
6420	64	6420
6320	63	6320
6220	62	6220
6120	61	6120
6020	60	6020
5F20	5F	5F20
5E20	5E	5E20
5D20	5D	5D20
5C20	5C	5C20
5B20	5B	5B20
5A20	5A	5A20
5920	59	5920
5820	58	5820
5720	57	5720
5620	56	5620
5520	55	5520
5420	54	5420
5320	53	5320
5220	52	5220
5120	51	5120
5020	50	5020
4F20	4F	4F20
4E20	4E	4E20
4D20	4D	4D20
4C20	4C	4C20
4B20	4B	4B20
4A20	4A	4A20
4920	49	4920
4820	48	4820
4720	47	4720
4620	46	4620
4520	45	4520
4420	44	4420
4320	43	4320
4220	42	4220
4120	41	4120
4020	40	4020
3F20	3F	3F20
3E20	3E	3E20
3D20	3D	3D20
3C20	3C	3C20
3B20	3B	3B20
3A20	3A	3A20
3920	39	3920
3820	38	3820
3720	37	3720
3620	36	3620
3520	35	3520
3420	34	3420
3320	33	3320
3220	32	3220
3120	31	3120
3020	30	3020
2F20	2F	2F20
2E20	2E	2E20
2D20	2D	2D20
2C20	2C	2C20
2B20	2B	2B20
2A20	2A	2A20
2920	29	2920
2820	28	2820
2720	27	2720
2620	26	2620
2520	25	2520
2420	24	2420
2320	23	2320
2220	22	2220
2120	21	2120
2020		2020
1F20	1F	1F20
1E20	1E	1E20
1D20	1D	1D20
1C20	1C	1C20
1B20	1B	1B20
1A20	1A	1A20
1920	19	1920
1820	18	1820
1720	17	1720
1620	16	1620
1520	15	1520
1420	14	1420
1320	13	1320
1220	12	1220
1120	11	1120
1020	10	1020
0F20	0F	0F20
0E20	0E	0E20
0D20	0D	0D20
0C20	0C	0C20
0B20	0B	0B20
0A20	0A	0A20
0920	09	0920
0820	08	0820
0720	07	0720
0620	06	0620
0520	05	0520
0420	04	0420
0320	03	0320
0220	02	0220
0120	01	0120
0020	00	0020
6A2020	6A	6A2020
692020	69	692020
682020	68	682020
672020	67	672020
662020	66	662020
652020	65	652020
642020	64	642020
632020	63	632020
622020	62	622020
612020	61	612020
602020	60	602020
5F2020	5F	5F2020
5E2020	5E	5E2020
5D2020	5D	5D2020
5C2020	5C	5C2020
5B2020	5B	5B2020
5A2020	5A	5A2020
592020	59	592020
582020	58	582020
572020	57	572020
562020	56	562020
552020	55	552020
542020	54	542020
532020	53	532020
522020	52	522020
512020	51	512020
502020	50	502020
4F2020	4F	4F2020
4E2020	4E	4E2020
4D2020	4D	4D2020
4C2020	4C	4C2020
4B2020	4B	4B2020
4A2020	4A	4A2020
492020	49	492020
482020	48	482020
472020	47	472020
462020	46	462020
452020	45	452020
442020	44	442020
432020	43	432020
422020	42	422020
412020	41	412020
402020	40	402020
3F2020	3F	3F2020
3E2020	3E	3E2020
3D2020	3D	3D2020
3C2020	3C	3C2020
3B2020	3B	3B2020
3A2020	3A	3A2020
392020	39	392020
382020	38	382020
372020	37	372020
362020	36	362020
352020	35	352020
342020	34	342020
332020	33	332020
322020	32	322020
312020	31	312020
302020	30	302020
2F2020	2F	2F2020
2E2020	2E	2E2020
2D2020	2D	2D2020
2C2020	2C	2C2020
2B2020	2B	2B2020
2A2020	2A	2A2020
292020	29	292020
282020	28	282020
272020	27	272020
262020	26	262020
252020	25	252020
242020	24	242020
232020	23	232020
222020	22	222020
212020	21	212020
202020		202020
1F2020	1F	1F2020
1E2020	1E	1E2020
1D2020	1D	1D2020
1C2020	1C	1C2020
1B2020	1B	1B2020
1A2020	1A	1A2020
192020	19	192020
182020	18	182020
172020	17	172020
162020	16	162020
152020	15	152020
142020	14	142020
132020	13	132020
122020	12	122020
112020	11	112020
102020	10	102020
0F2020	0F	0F2020
0E2020	0E	0E2020
0D2020	0D	0D2020
0C2020	0C	0C2020
0B2020	0B	0B2020
0A2020	0A	0A2020
092020	09	092020
082020	08	082020
072020	07	072020
062020	06	062020
052020	05	052020
042020	04	042020
032020	03	032020
022020	02	022020
012020	01	012020
002020	00	002020
6A202020	6A	6A202020
69202020	69	69202020
68202020	68	68202020
67202020	67	67202020
66202020	66	66202020
65202020	65	65202020
64202020	64	64202020
63202020	63	63202020
62202020	62	62202020
61202020	61	61202020
60202020	60	60202020
5F202020	5F	5F202020
5E202020	5E	5E202020
5D202020	5D	5D202020
5C202020	5C	5C202020
5B202020	5B	5B202020
5A202020	5A	5A202020
59202020	59	59202020
58202020	58	58202020
57202020	57	57202020
56202020	56	56202020
55202020	55	55202020
54202020	54	54202020
53202020	53	53202020
52202020	52	52202020
51202020	51	51202020
50202020	50	50202020
4F202020	4F	4F202020
4E202020	4E	4E202020
4D202020	4D	4D202020
4C202020	4C	4C202020
4B202020	4B	4B202020
4A202020	4A	4A202020
49202020	49	49202020
48202020	48	48202020
47202020	47	47202020
46202020	46	46202020
45202020	45	45202020
44202020	44	44202020
43202020	43	43202020
42202020	42	42202020
41202020	41	41202020
40202020	40	40202020
3F202020	3F	3F202020
3E202020	3E	3E202020
3D202020	3D	3D202020
3C202020	3C	3C202020
3B202020	3B	3B202020
3A202020	3A	3A202020
39202020	39	39202020
38202020	38	38202020
37202020	37	37202020
36202020	36	36202020
35202020	35	35202020
34202020	34	34202020
33202020	33	33202020
32202020	32	32202020
31202020	31	31202020
30202020	30	30202020
2F202020	2F	2F202020
2E202020	2E	2E202020
2D202020	2D	2D202020
2C202020	2C	2C202020
2B202020	2B	2B202020
2A202020	2A	2A202020
29202020	29	29202020
28202020	28	28202020
27202020	27	27202020
26202020	26	26202020
25202020	25	25202020
24202020	24	24202020
23202020	23	23202020
22202020	22	22202020
21202020	21	21202020
20202020		20202020
1F202020	1F	1F202020
1E202020	1E	1E202020
1D202020	1D	1D202020
1C202020	1C	1C202020
1B202020	1B	1B202020
1A202020	1A	1A202020
19202020	19	19202020
18202020	18	18202020
17202020	17	17202020
16202020	16	16202020
15202020	15	15202020
14202020	14	14202020
13202020	13	13202020
12202020	12	12202020
11202020	11	11202020
10202020	10	10202020
0F202020	0F	0F202020
0E202020	0E	0E202020
0D202020	0D	0D202020
0C202020	0C	0C202020
0B202020	0B	0B202020
0A202020	0A	0A202020
09202020	09	09202020
08202020	08	08202020
07202020	07	07202020
06202020	06	06202020
05202020	05	05202020
04202020	04	04202020
03202020	03	03202020
02202020	02	02202020
01202020	01	01202020
00202020	00	00202020
6A20202020	6A	6A20202020
6920202020	69	6920202020
6820202020	68	6820202020
6720202020	67	6720202020
6620202020	66	6620202020
6520202020	65	6520202020
6420202020	64	6420202020
6320202020	63	6320202020
6220202020	62	6220202020
6120202020	61	6120202020
6020202020	60	6020202020
5F20202020	5F	5F20202020
5E20202020	5E	5E20202020
5D20202020	5D	5D20202020
5C20202020	5C	5C20202020
5B20202020	5B	5B20202020
5A20202020	5A	5A20202020
5920202020	59	5920202020
5820202020	58	5820202020
5720202020	57	5720202020
5620202020	56	5620202020
5520202020	55	5520202020
5420202020	54	5420202020
5320202020	53	5320202020
5220202020	52	5220202020
5120202020	51	5120202020
5020202020	50	5020202020
4F20202020	4F	4F20202020
4E20202020	4E	4E20202020
4D20202020	4D	4D20202020
4C20202020	4C	4C20202020
4B20202020	4B	4B20202020
4A20202020	4A	4A20202020
4920202020	49	4920202020
4820202020	48	4820202020
4720202020	47	4720202020
4620202020	46	4620202020
4520202020	45	4520202020
4420202020	44	4420202020
4320202020	43	4320202020
4220202020	42	4220202020
4120202020	41	4120202020
4020202020	40	4020202020
3F20202020	3F	3F20202020
3E20202020	3E	3E20202020
3D20202020	3D	3D20202020
3C20202020	3C	3C20202020
3B20202020	3B	3B20202020
3A20202020	3A	3A20202020
3920202020	39	3920202020
3820202020	38	3820202020
3720202020	37	3720202020
3620202020	36	3620202020
3520202020	35	3520202020
3420202020	34	3420202020
3320202020	33	3320202020
3220202020	32	3220202020
3120202020	31	3120202020
3020202020	30	3020202020
2F20202020	2F	2F20202020
2E20202020	2E	2E20202020
2D20202020	2D	2D20202020
2C20202020	2C	2C20202020
2B20202020	2B	2B20202020
2A20202020	2A	2A20202020
2920202020	29	2920202020
2820202020	28	2820202020
2720202020	27	2720202020
2620202020	26	2620202020
2520202020	25	2520202020
2420202020	24	2420202020
2320202020	23	2320202020
2220202020	22	2220202020
2120202020	21	2120202020
2020202020		2020202020
1F20202020	1F	1F20202020
1E20202020	1E	1E20202020
1D20202020	1D	1D20202020
1C20202020	1C	1C20202020
1B20202020	1B	1B20202020
1A20202020	1A	1A20202020
1920202020	19	1920202020
1820202020	18	1820202020
1720202020	17	1720202020
1620202020	16	1620202020
1520202020	15	1520202020
1420202020	14	1420202020
1320202020	13	1320202020
1220202020	12	1220202020
1120202020	11	1120202020
1020202020	10	1020202020
0F20202020	0F	0F20202020
0E20202020	0E	0E20202020
0D20202020	0D	0D20202020
0C20202020	0C	0C20202020
0B20202020	0B	0B20202020
0A20202020	0A	0A20202020
0920202020	09	0920202020
0820202020	08	0820202020
0720202020	07	0720202020
0620202020	06	0620202020
0520202020	05	0520202020
0420202020	04	0420202020
0320202020	03	0320202020
0220202020	02	0220202020
0120202020	01	0120202020
0020202020	00	0020202020
6A2020202020	6A	6A2020202020
692020202020	69	692020202020
682020202020	68	682020202020
672020202020	67	672020202020
662020202020	66	662020202020
652020202020	65	652020202020
642020202020	64	642020202020
632020202020	63	632020202020
622020202020	62	622020202020
612020202020	61	612020202020
602020202020	60	602020202020
5F2020202020	5F	5F2020202020
5E2020202020	5E	5E2020202020
5D2020202020	5D	5D2020202020
5C2020202020	5C	5C2020202020
5B2020202020	5B	5B2020202020
5A2020202020	5A	5A2020202020
592020202020	59	592020202020
582020202020	58	582020202020
572020202020	57	572020202020
562020202020	56	562020202020
552020202020	55	552020202020
542020202020	54	542020202020
532020202020	53	532020202020
522020202020	52	522020202020
512020202020	51	512020202020
502020202020	50	502020202020
4F2020202020	4F	4F2020202020
4E2020202020	4E	4E2020202020
4D2020202020	4D	4D2020202020
4C2020202020	4C	4C2020202020
4B2020202020	4B	4B2020202020
4A2020202020	4A	4A2020202020
492020202020	49	492020202020
482020202020	48	482020202020
472020202020	47	472020202020
462020202020	46	462020202020
452020202020	45	452020202020
442020202020	44	442020202020
432020202020	43	432020202020
422020202020	42	422020202020
412020202020	41	412020202020
402020202020	40	402020202020
3F2020202020	3F	3F2020202020
3E2020202020	3E	3E2020202020
3D2020202020	3D	3D2020202020
3C2020202020	3C	3C2020202020
3B2020202020	3B	3B2020202020
3A2020202020	3A	3A2020202020
392020202020	39	392020202020
382020202020	38	382020202020
372020202020	37	372020202020
362020202020	36	362020202020
352020202020	35	352020202020
342020202020	34	342020202020
332020202020	33	332020202020
322020202020	32	322020202020
312020202020	31	312020202020
302020202020	30	302020202020
2F2020202020	2F	2F2020202020
2E2020202020	2E	2E2020202020
2D2020202020	2D	2D2020202020
2C2020202020	2C	2C2020202020
2B2020202020	2B	2B2020202020
2A2020202020	2A	2A2020202020
292020202020	29	292020202020
282020202020	28	282020202020
272020202020	27	272020202020
262020202020	26	262020202020
252020202020	25	252020202020
242020202020	24	242020202020
232020202020	23	232020202020
222020202020	22	222020202020
212020202020	21	212020202020
202020202020		202020202020
1F2020202020	1F	1F2020202020
1E2020202020	1E	1E2020202020
1D2020202020	1D	1D2020202020
1C2020202020	1C	1C2020202020
1B2020202020	1B	1B2020202020
1A2020202020	1A	1A2020202020
192020202020	19	192020202020
182020202020	18	182020202020
172020202020	17	172020202020
162020202020	16	162020202020
152020202020	15	152020202020
142020202020	14	142020202020
132020202020	13	132020202020
122020202020	12	122020202020
112020202020	11	112020202020
102020202020	10	102020202020
0F2020202020	0F	0F2020202020
0E2020202020	0E	0E2020202020
0D2020202020	0D	0D2020202020
0C2020202020	0C	0C2020202020
0B2020202020	0B	0B2020202020
0A2020202020	0A	0A2020202020
092020202020	09	092020202020
082020202020	08	082020202020
072020202020	07	072020202020
062020202020	06	062020202020
052020202020	05	052020202020
042020202020	04	042020202020
032020202020	03	032020202020
022020202020	02	022020202020
012020202020	01	012020202020
002020202020	00	002020202020
6A202020202020	6A	6A202020202020
69202020202020	69	69202020202020
68202020202020	68	68202020202020
67202020202020	67	67202020202020
66202020202020	66	66202020202020
65202020202020	65	65202020202020
64202020202020	64	64202020202020
63202020202020	63	63202020202020
62202020202020	62	62202020202020
61202020202020	61	61202020202020
60202020202020	60	60202020202020
5F202020202020	5F	5F202020202020
5E202020202020	5E	5E202020202020
5D202020202020	5D	5D202020202020
5C202020202020	5C	5C202020202020
5B202020202020	5B	5B202020202020
5A202020202020	5A	5A202020202020
59202020202020	59	59202020202020
58202020202020	58	58202020202020
57202020202020	57	57202020202020
56202020202020	56	56202020202020
55202020202020	55	55202020202020
54202020202020	54	54202020202020
53202020202020	53	53202020202020
52202020202020	52	52202020202020
51202020202020	51	51202020202020
50202020202020	50	50202020202020
4F202020202020	4F	4F202020202020
4E202020202020	4E	4E202020202020
4D202020202020	4D	4D202020202020
4C202020202020	4C	4C202020202020
4B202020202020	4B	4B202020202020
4A202020202020	4A	4A202020202020
49202020202020	49	49202020202020
48202020202020	48	48202020202020
47202020202020	47	47202020202020
46202020202020	46	46202020202020
45202020202020	45	45202020202020
44202020202020	44	44202020202020
43202020202020	43	43202020202020
42202020202020	42	42202020202020
41202020202020	41	41202020202020
40202020202020	40	40202020202020
3F202020202020	3F	3F202020202020
3E202020202020	3E	3E202020202020
3D202020202020	3D	3D202020202020
3C202020202020	3C	3C202020202020
3B202020202020	3B	3B202020202020
3A202020202020	3A	3A202020202020
39202020202020	39	39202020202020
38202020202020	38	38202020202020
37202020202020	37	37202020202020
36202020202020	36	36202020202020
35202020202020	35	35202020202020
34202020202020	34	34202020202020
33202020202020	33	33202020202020
32202020202020	32	32202020202020
31202020202020	31	31202020202020
30202020202020	30	30202020202020
2F202020202020	2F	2F202020202020
2E202020202020	2E	2E202020202020
2D202020202020	2D	2D202020202020
2C202020202020	2C	2C202020202020
2B202020202020	2B	2B202020202020
2A202020202020	2A	2A202020202020
29202020202020	29	29202020202020
28202020202020	28	28202020202020
27202020202020	27	27202020202020
26202020202020	26	26202020202020
25202020202020	25	25202020202020
24202020202020	24	24202020202020
23202020202020	23	23202020202020
22202020202020	22	22202020202020
21202020202020	21	21202020202020
20202020202020		20202020202020
1F202020202020	1F	1F202020202020
1E202020202020	1E	1E202020202020
1D202020202020	1D	1D202020202020
1C202020202020	1C	1C202020202020
1B202020202020	1B	1B202020202020
1A202020202020	1A	1A202020202020
19202020202020	19	19202020202020
18202020202020	18	18202020202020
17202020202020	17	17202020202020
16202020202020	16	16202020202020
15202020202020	15	15202020202020
14202020202020	14	14202020202020
13202020202020	13	13202020202020
12202020202020	12	12202020202020
11202020202020	11	11202020202020
10202020202020	10	10202020202020
0F202020202020	0F	0F202020202020
0E202020202020	0E	0E202020202020
0D202020202020	0D	0D202020202020
0C202020202020	0C	0C202020202020
0B202020202020	0B	0B202020202020
0A202020202020	0A	0A202020202020
09202020202020	09	09202020202020
08202020202020	08	08202020202020
07202020202020	07	07202020202020
06202020202020	06	06202020202020
05202020202020	05	05202020202020
04202020202020	04	04202020202020
03202020202020	03	03202020202020
02202020202020	02	02202020202020
01202020202020	01	01202020202020
00202020202020	00	00202020202020
6A20202020202020	6A	6A20202020202020
6920202020202020	69	6920202020202020
6820202020202020	68	6820202020202020
6720202020202020	67	6720202020202020
6620202020202020	66	6620202020202020
6520202020202020	65	6520202020202020
6420202020202020	64	6420202020202020
6320202020202020	63	6320202020202020
6220202020202020	62	6220202020202020
6120202020202020	61	6120202020202020
6020202020202020	60	6020202020202020
5F20202020202020	5F	5F20202020202020
5E20202020202020	5E	5E20202020202020
5D20202020202020	5D	5D20202020202020
5C20202020202020	5C	5C20202020202020
5B20202020202020	5B	5B20202020202020
5A20202020202020	5A	5A20202020202020
5920202020202020	59	5920202020202020
5820202020202020	58	5820202020202020
5720202020202020	57	5720202020202020
5620202020202020	56	5620202020202020
5520202020202020	55	5520202020202020
5420202020202020	54	5420202020202020
5320202020202020	53	5320202020202020
5220202020202020	52	5220202020202020
5120202020202020	51	5120202020202020
5020202020202020	50	5020202020202020
4F20202020202020	4F	4F20202020202020
4E20202020202020	4E	4E20202020202020
4D20202020202020	4D	4D20202020202020
4C20202020202020	4C	4C20202020202020
4B20202020202020	4B	4B20202020202020
4A20202020202020	4A	4A20202020202020
4920202020202020	49	4920202020202020
4820202020202020	48	4820202020202020
4720202020202020	47	4720202020202020
4620202020202020	46	4620202020202020
4520202020202020	45	4520202020202020
4420202020202020	44	4420202020202020
4320202020202020	43	4320202020202020
4220202020202020	42	4220202020202020
4120202020202020	41	4120202020202020
4020202020202020	40	4020202020202020
3F20202020202020	3F	3F20202020202020
3E20202020202020	3E	3E20202020202020
3D20202020202020	3D	3D20202020202020
3C20202020202020	3C	3C20202020202020
3B20202020202020	3B	3B20202020202020
3A20202020202020	3A	3A20202020202020
3920202020202020	39	3920202020202020
3820202020202020	38	3820202020202020
3720202020202020	37	3720202020202020
3620202020202020	36	3620202020202020
3520202020202020	35	3520202020202020
3420202020202020	34	3420202020202020
3320202020202020	33	3320202020202020
3220202020202020	32	3220202020202020
3120202020202020	31	3120202020202020
3020202020202020	30	3020202020202020
2F20202020202020	2F	2F20202020202020
2E20202020202020	2E	2E20202020202020
2D20202020202020	2D	2D20202020202020
2C20202020202020	2C	2C20202020202020
2B20202020202020	2B	2B20202020202020
2A20202020202020	2A	2A20202020202020
2920202020202020	29	2920202020202020
2820202020202020	28	2820202020202020
2720202020202020	27	2720202020202020
2620202020202020	26	2620202020202020
2520202020202020	25	2520202020202020
2420202020202020	24	2420202020202020
2320202020202020	23	2320202020202020
2220202020202020	22	2220202020202020
2120202020202020	21	2120202020202020
2020202020202020		2020202020202020
1F20202020202020	1F	1F20202020202020
1E20202020202020	1E	1E20202020202020
1D20202020202020	1D	1D20202020202020
1C20202020202020	1C	1C20202020202020
1B20202020202020	1B	1B20202020202020
1A20202020202020	1A	1A20202020202020
1920202020202020	19	1920202020202020
1820202020202020	18	1820202020202020
1720202020202020	17	1720202020202020
1620202020202020	16	1620202020202020
1520202020202020	15	1520202020202020
1420202020202020	14	1420202020202020
1320202020202020	13	1320202020202020
1220202020202020	12	1220202020202020
1120202020202020	11	1120202020202020
1020202020202020	10	1020202020202020
0F20202020202020	0F	0F20202020202020
0E20202020202020	0E	0E20202020202020
0D20202020202020	0D	0D20202020202020
0C20202020202020	0C	0C20202020202020
0B20202020202020	0B	0B20202020202020
0A20202020202020	0A	0A20202020202020
0920202020202020	09	0920202020202020
0820202020202020	08	0820202020202020
0720202020202020	07	0720202020202020
0620202020202020	06	0620202020202020
0520202020202020	05	0520202020202020
0420202020202020	04	0420202020202020
0320202020202020	03	0320202020202020
0220202020202020	02	0220202020202020
0120202020202020	01	0120202020202020
0020202020202020	00	0020202020202020
6A2020202020202020	6A	6A2020202020202020
692020202020202020	69	692020202020202020
682020202020202020	68	682020202020202020
672020202020202020	67	672020202020202020
662020202020202020	66	662020202020202020
652020202020202020	65	652020202020202020
642020202020202020	64	642020202020202020
632020202020202020	63	632020202020202020
622020202020202020	62	622020202020202020
612020202020202020	61	612020202020202020
602020202020202020	60	602020202020202020
5F2020202020202020	5F	5F2020202020202020
5E2020202020202020	5E	5E2020202020202020
5D2020202020202020	5D	5D2020202020202020
5C2020202020202020	5C	5C2020202020202020
5B2020202020202020	5B	5B2020202020202020
5A2020202020202020	5A	5A2020202020202020
592020202020202020	59	592020202020202020
582020202020202020	58	582020202020202020
572020202020202020	57	572020202020202020
562020202020202020	56	562020202020202020
552020202020202020	55	552020202020202020
542020202020202020	54	542020202020202020
532020202020202020	53	532020202020202020
522020202020202020	52	522020202020202020
512020202020202020	51	512020202020202020
502020202020202020	50	502020202020202020
4F2020202020202020	4F	4F2020202020202020
4E2020202020202020	4E	4E2020202020202020
4D2020202020202020	4D	4D2020202020202020
4C2020202020202020	4C	4C2020202020202020
4B2020202020202020	4B	4B2020202020202020
4A2020202020202020	4A	4A2020202020202020
492020202020202020	49	492020202020202020
482020202020202020	48	482020202020202020
472020202020202020	47	472020202020202020
462020202020202020	46	462020202020202020
452020202020202020	45	452020202020202020
442020202020202020	44	442020202020202020
432020202020202020	43	432020202020202020
422020202020202020	42	422020202020202020
412020202020202020	41	412020202020202020
402020202020202020	40	402020202020202020
3F2020202020202020	3F	3F2020202020202020
3E2020202020202020	3E	3E2020202020202020
3D2020202020202020	3D	3D2020202020202020
3C2020202020202020	3C	3C2020202020202020
3B2020202020202020	3B	3B2020202020202020
3A2020202020202020	3A	3A2020202020202020
392020202020202020	39	392020202020202020
382020202020202020	38	382020202020202020
372020202020202020	37	372020202020202020
362020202020202020	36	362020202020202020
352020202020202020	35	352020202020202020
342020202020202020	34	342020202020202020
332020202020202020	33	332020202020202020
322020202020202020	32	322020202020202020
312020202020202020	31	312020202020202020
302020202020202020	30	302020202020202020
2F2020202020202020	2F	2F2020202020202020
2E2020202020202020	2E	2E2020202020202020
2D2020202020202020	2D	2D2020202020202020
2C2020202020202020	2C	2C2020202020202020
2B2020202020202020	2B	2B2020202020202020
2A2020202020202020	2A	2A2020202020202020
292020202020202020	29	292020202020202020
282020202020202020	28	282020202020202020
272020202020202020	27	272020202020202020
262020202020202020	26	262020202020202020
252020202020202020	25	252020202020202020
242020202020202020	24	242020202020202020
232020202020202020	23	232020202020202020
222020202020202020	22	222020202020202020
212020202020202020	21	212020202020202020
202020202020202020		202020202020202020
1F2020202020202020	1F	1F2020202020202020
1E2020202020202020	1E	1E2020202020202020
1D2020202020202020	1D	1D2020202020202020
1C2020202020202020	1C	1C2020202020202020
1B2020202020202020	1B	1B2020202020202020
1A2020202020202020	1A	1A2020202020202020
192020202020202020	19	192020202020202020
182020202020202020	18	182020202020202020
172020202020202020	17	172020202020202020
162020202020202020	16	162020202020202020
152020202020202020	15	152020202020202020
142020202020202020	14	142020202020202020
132020202020202020	13	132020202020202020
122020202020202020	12	122020202020202020
112020202020202020	11	112020202020202020
102020202020202020	10	102020202020202020
0F2020202020202020	0F	0F2020202020202020
0E2020202020202020	0E	0E2020202020202020
0D2020202020202020	0D	0D2020202020202020
0C2020202020202020	0C	0C2020202020202020
0B2020202020202020	0B	0B2020202020202020
0A2020202020202020	0A	0A2020202020202020
092020202020202020	09	092020202020202020
082020202020202020	08	082020202020202020
072020202020202020	07	072020202020202020
062020202020202020	06	062020202020202020
052020202020202020	05	052020202020202020
042020202020202020	04	042020202020202020
032020202020202020	03	032020202020202020
022020202020202020	02	022020202020202020
012020202020202020	01	012020202020202020
002020202020202020	00	002020202020202020
6A202020202020202020	6A	6A202020202020202020
69202020202020202020	69	69202020202020202020
68202020202020202020	68	68202020202020202020
67202020202020202020	67	67202020202020202020
66202020202020202020	66	66202020202020202020
65202020202020202020	65	65202020202020202020
64202020202020202020	64	64202020202020202020
63202020202020202020	63	63202020202020202020
62202020202020202020	62	62202020202020202020
61202020202020202020	61	61202020202020202020
60202020202020202020	60	60202020202020202020
5F202020202020202020	5F	5F202020202020202020
5E202020202020202020	5E	5E202020202020202020
5D202020202020202020	5D	5D202020202020202020
5C202020202020202020	5C	5C202020202020202020
5B202020202020202020	5B	5B202020202020202020
5A202020202020202020	5A	5A202020202020202020
59202020202020202020	59	59202020202020202020
58202020202020202020	58	58202020202020202020
57202020202020202020	57	57202020202020202020
56202020202020202020	56	56202020202020202020
55202020202020202020	55	55202020202020202020
54202020202020202020	54	54202020202020202020
53202020202020202020	53	53202020202020202020
52202020202020202020	52	52202020202020202020
51202020202020202020	51	51202020202020202020
50202020202020202020	50	50202020202020202020
4F202020202020202020	4F	4F202020202020202020
4E202020202020202020	4E	4E202020202020202020
4D202020202020202020	4D	4D202020202020202020
4C202020202020202020	4C	4C202020202020202020
4B202020202020202020	4B	4B202020202020202020
4A202020202020202020	4A	4A202020202020202020
49202020202020202020	49	49202020202020202020
48202020202020202020	48	48202020202020202020
47202020202020202020	47	47202020202020202020
46202020202020202020	46	46202020202020202020
45202020202020202020	45	45202020202020202020
44202020202020202020	44	44202020202020202020
43202020202020202020	43	43202020202020202020
42202020202020202020	42	42202020202020202020
41202020202020202020	41	41202020202020202020
40202020202020202020	40	40202020202020202020
3F202020202020202020	3F	3F202020202020202020
3E202020202020202020	3E	3E202020202020202020
3D202020202020202020	3D	3D202020202020202020
3C202020202020202020	3C	3C202020202020202020
3B202020202020202020	3B	3B202020202020202020
3A202020202020202020	3A	3A202020202020202020
39202020202020202020	39	39202020202020202020
38202020202020202020	38	38202020202020202020
37202020202020202020	37	37202020202020202020
36202020202020202020	36	36202020202020202020
35202020202020202020	35	35202020202020202020
34202020202020202020	34	34202020202020202020
33202020202020202020	33	33202020202020202020
32202020202020202020	32	32202020202020202020
31202020202020202020	31	31202020202020202020
30202020202020202020	30	30202020202020202020
2F202020202020202020	2F	2F202020202020202020
2E202020202020202020	2E	2E202020202020202020
2D202020202020202020	2D	2D202020202020202020
2C202020202020202020	2C	2C202020202020202020
2B202020202020202020	2B	2B202020202020202020
2A202020202020202020	2A	2A202020202020202020
29202020202020202020	29	29202020202020202020
28202020202020202020	28	28202020202020202020
27202020202020202020	27	27202020202020202020
26202020202020202020	26	26202020202020202020
25202020202020202020	25	25202020202020202020
24202020202020202020	24	24202020202020202020
23202020202020202020	23	23202020202020202020
22202020202020202020	22	22202020202020202020
21202020202020202020	21	21202020202020202020
20202020202020202020		20202020202020202020
1F202020202020202020	1F	1F202020202020202020
1E202020202020202020	1E	1E202020202020202020
1D202020202020202020	1D	1D202020202020202020
1C202020202020202020	1C	1C202020202020202020
1B202020202020202020	1B	1B202020202020202020
1A202020202020202020	1A	1A202020202020202020
19202020202020202020	19	19202020202020202020
18202020202020202020	18	18202020202020202020
17202020202020202020	17	17202020202020202020
16202020202020202020	16	16202020202020202020
15202020202020202020	15	15202020202020202020
14202020202020202020	14	14202020202020202020
13202020202020202020	13	13202020202020202020
12202020202020202020	12	12202020202020202020
11202020202020202020	11	11202020202020202020
10202020202020202020	10	10202020202020202020
0F202020202020202020	0F	0F202020202020202020
0E202020202020202020	0E	0E202020202020202020
0D202020202020202020	0D	0D202020202020202020
0C202020202020202020	0C	0C202020202020202020
0B202020202020202020	0B	0B202020202020202020
0A202020202020202020	0A	0A202020202020202020
09202020202020202020	09	09202020202020202020
08202020202020202020	08	08202020202020202020
07202020202020202020	07	07202020202020202020
06202020202020202020	06	06202020202020202020
05202020202020202020	05	05202020202020202020
04202020202020202020	04	04202020202020202020
03202020202020202020	03	03202020202020202020
02202020202020202020	02	02202020202020202020
01202020202020202020	01	01202020202020202020
00202020202020202020	00	00202020202020202020
6101	6101	6101
select hex(v),count(*) from t1 group by v limit 10;
hex(v)	count(*)
00	10
01	10
02	10
03	10
04	10
05	10
06	10
07	10
08	10
09	10
select hex(v),count(t) from t1 group by v limit 10;
hex(v)	count(t)
6A	20
69	20
68	20
67	20
66	20
65	20
64	20
63	20
62	20
61	20
select hex(v),count(c) from t1 group by v limit 10;
hex(v)	count(c)
6A	20
69	20
68	20
67	20
66	20
65	20
64	20
63	20
62	20
61	20
select c,count(*) from t1 group by c limit 10;
c	count(*)
 	10
	10
	10
	10
	10
	10
	10
	10
	10
		10
select c,count(t) from t1 group by c limit 10;
c	count(t)
j	20
i	20
h	20
g	20
f	20
e	20
d	20
c	20
b	20
a	20
select t,count(*) from t1 group by t limit 10;
t	count(*)
 	10
	10
	10
	10
	10
	10
	10
	10
	10
		10
select t,count(t) from t1 group by t limit 10;
t	count(t)
 	10
	10
	10
	10
	10
	10
	10
	10
	10
		10
alter table t1 modify v varchar(300), drop key v, drop key v_2;
alter table t1 add key v (v);
show create table t1;
Table	Create Table
t1	CREATE TABLE `t1` (
  `v` varchar(300) DEFAULT NULL,
  `c` char(10) DEFAULT NULL,
  `t` varchar(512) DEFAULT NULL,
  KEY `c` (`c`) BLOCK_SIZE 16384 LOCAL,
  KEY `t` (`t`) BLOCK_SIZE 16384 LOCAL,
  KEY `v` (`v`) BLOCK_SIZE 16384 LOCAL
) ORGANIZATION INDEX DEFAULT CHARSET = utf8mb4 COMPRESSION = 'lz4_1.0' REPLICA_NUM = NUM BLOCK_SIZE = SIZE USE_BLOOM_FILTER = FALSE ENABLE_MACRO_BLOCK_BLOOM_FILTER = FALSE TABLET_SIZE = SIZE PCTFREE = 10
select count(*) from t1 where v='a';
count(*)
20
select count(*) from t1 where v='a  ';
count(*)
20
select count(*) from t1 where v between 'a' and 'a ';
count(*)
20
select count(*) from t1 where v between 'a' and 'a ' and v between 'a  ' and 'b\n';
count(*)
20
select count(*) from t1 where v like 'a%';
count(*)
21
select count(*) from t1 where v like 'a %';
count(*)
18
explain select count(*) from t1 where v='a  ';
Query Plan
===================================================
|ID|OPERATOR          |NAME |EST.ROWS|EST.TIME(us)|
---------------------------------------------------
|0 |SCALAR GROUP BY   |     |1       |3           |
|1 |└─TABLE RANGE SCAN|t1(v)|20      |3           |
===================================================
Outputs & filters:
-------------------------------------
  0 - output([T_FUN_COUNT_SUM(T_FUN_COUNT(*))]), filter(nil), rowset=256
      group(nil), agg_func([T_FUN_COUNT_SUM(T_FUN_COUNT(*))])
  1 - output([T_FUN_COUNT(*)]), filter(nil), rowset=256
      access(nil), partitions(p0)
      is_index_back=false, is_global_index=false, 
      range_key([t1.v], [t1.__pk_increment]), range(a  ,MIN ; a  ,MAX), 
      range_cond([t1.v = 'a  ']), 
      pushdown_aggregation([T_FUN_COUNT(*)])
explain select count(*) from t1 where v like 'a%';
Query Plan
===================================================
|ID|OPERATOR          |NAME |EST.ROWS|EST.TIME(us)|
---------------------------------------------------
|0 |SCALAR GROUP BY   |     |1       |3           |
|1 |└─TABLE RANGE SCAN|t1(v)|21      |3           |
===================================================
Outputs & filters:
-------------------------------------
  0 - output([T_FUN_COUNT_SUM(T_FUN_COUNT(*))]), filter(nil), rowset=256
      group(nil), agg_func([T_FUN_COUNT_SUM(T_FUN_COUNT(*))])
  1 - output([T_FUN_COUNT(*)]), filter(nil), rowset=256
      access(nil), partitions(p0)
      is_index_back=false, is_global_index=false, 
      range_key([t1.v], [t1.__pk_increment]), range(a,MIN ; a￿￿￿￿￿￿￿￿￿￿￿￿￿￿￿￿￿￿￿￿￿￿￿￿￿￿￿￿￿￿￿￿￿￿￿￿￿￿￿￿￿￿￿￿￿￿�
      �￿￿￿￿￿￿￿￿￿￿￿￿￿￿￿￿￿￿￿￿￿￿￿￿￿￿￿￿￿￿￿￿￿￿￿￿￿￿￿￿￿￿￿￿￿￿￿￿￿￿￿￿￿￿￿￿￿￿￿￿￿￿￿￿￿￿�
      �￿￿￿￿￿￿￿￿￿￿￿￿￿￿￿￿￿￿￿￿￿￿￿￿￿￿￿￿￿￿￿￿￿￿￿￿￿￿￿￿￿￿￿￿￿￿￿￿￿￿￿￿￿￿￿￿￿￿￿￿￿￿￿￿￿￿�
      �￿￿￿￿￿￿￿￿￿￿￿￿￿￿￿￿￿￿￿￿￿￿￿￿￿￿￿￿￿￿￿￿￿￿￿￿￿￿￿￿￿￿￿￿￿￿￿￿￿￿￿￿￿￿￿￿￿￿￿￿￿￿￿￿￿￿�
      �￿￿￿￿￿￿￿￿￿￿￿￿￿￿￿￿￿￿￿￿￿￿￿￿￿￿￿￿￿￿￿￿￿￿￿￿￿￿￿￿￿￿￿￿￿￿￿￿￿￿￿￿￿￿￿￿￿￿￿￿￿￿￿￿￿￿�
      �￿￿￿￿￿￿￿￿￿￿￿￿￿￿￿￿￿￿￿￿￿￿￿￿￿￿￿￿￿￿￿￿￿￿￿￿￿￿￿￿￿￿￿￿￿￿￿￿￿￿￿￿￿￿￿￿￿￿￿￿￿￿￿￿￿￿�
      �￿￿￿￿￿￿￿￿￿￿￿￿￿￿￿￿￿  ,MAX), 
      range_cond([(T_OP_LIKE, t1.v, 'a%', '\\')]), 
      pushdown_aggregation([T_FUN_COUNT(*)])
explain select count(*) from t1 where v between 'a' and 'a ';
Query Plan
===================================================
|ID|OPERATOR          |NAME |EST.ROWS|EST.TIME(us)|
---------------------------------------------------
|0 |SCALAR GROUP BY   |     |1       |3           |
|1 |└─TABLE RANGE SCAN|t1(v)|20      |3           |
===================================================
Outputs & filters:
-------------------------------------
  0 - output([T_FUN_COUNT_SUM(T_FUN_COUNT(*))]), filter(nil), rowset=256
      group(nil), agg_func([T_FUN_COUNT_SUM(T_FUN_COUNT(*))])
  1 - output([T_FUN_COUNT(*)]), filter(nil), rowset=256
      access(nil), partitions(p0)
      is_index_back=false, is_global_index=false, 
      range_key([t1.v], [t1.__pk_increment]), range(a,MIN ; a ,MAX), 
      range_cond([t1.v >= 'a'], [t1.v <= 'a ']), 
      pushdown_aggregation([T_FUN_COUNT(*)])
explain select count(*) from t1 where v between 'a' and 'a ' and v between 'a  ' and 'b\n';
Query Plan
===================================================
|ID|OPERATOR          |NAME |EST.ROWS|EST.TIME(us)|
---------------------------------------------------
|0 |SCALAR GROUP BY   |     |1       |3           |
|1 |└─TABLE RANGE SCAN|t1(v)|20      |3           |
===================================================
Outputs & filters:
-------------------------------------
  0 - output([T_FUN_COUNT_SUM(T_FUN_COUNT(*))]), filter(nil), rowset=256
      group(nil), agg_func([T_FUN_COUNT_SUM(T_FUN_COUNT(*))])
  1 - output([T_FUN_COUNT(*)]), filter(nil), rowset=256
      access(nil), partitions(p0)
      is_index_back=false, is_global_index=false, 
      range_key([t1.v], [t1.__pk_increment]), range(a,MIN ; a ,MAX), 
      range_cond([t1.v >= 'a'], [t1.v <= 'a '], [t1.v >= 'a  '], [t1.v <= 'b\n']), 
      pushdown_aggregation([T_FUN_COUNT(*)])
explain select * from t1 where v='a';
Query Plan
=================================================
|ID|OPERATOR        |NAME |EST.ROWS|EST.TIME(us)|
-------------------------------------------------
|0 |TABLE RANGE SCAN|t1(v)|20      |58          |
=================================================
Outputs & filters:
-------------------------------------
  0 - output([t1.v], [t1.c], [t1.t]), filter(nil), rowset=256
      access([t1.__pk_increment], [t1.v], [t1.c], [t1.t]), partitions(p0)
      is_index_back=true, is_global_index=false, 
      range_key([t1.v], [t1.__pk_increment]), range(a,MIN ; a,MAX), 
      range_cond([t1.v = 'a'])
select v,count(*) from t1 group by v limit 10;
v	count(*)
 	10
	10
	10
	10
	10
	10
	10
	10
	10
		10
select v,count(t) from t1 group by v limit 10;
v	count(t)
j	20
i	20
h	20
g	20
f	20
e	20
d	20
c	20
b	20
a	20
alter table t1 drop key v;
alter table t1 add key v (v);
show create table t1;
Table	Create Table
t1	CREATE TABLE `t1` (
  `v` varchar(300) DEFAULT NULL,
  `c` char(10) DEFAULT NULL,
  `t` varchar(512) DEFAULT NULL,
  KEY `c` (`c`) BLOCK_SIZE 16384 LOCAL,
  KEY `t` (`t`) BLOCK_SIZE 16384 LOCAL,
  KEY `v` (`v`) BLOCK_SIZE 16384 LOCAL
) ORGANIZATION INDEX DEFAULT CHARSET = utf8mb4 COMPRESSION = 'lz4_1.0' REPLICA_NUM = NUM BLOCK_SIZE = SIZE USE_BLOOM_FILTER = FALSE ENABLE_MACRO_BLOCK_BLOOM_FILTER = FALSE TABLET_SIZE = SIZE PCTFREE = 10
select count(*) from t1 where v='a';
count(*)
20
select count(*) from t1 where v='a  ';
count(*)
20
select count(*) from t1 where v between 'a' and 'a ';
count(*)
20
select count(*) from t1 where v between 'a' and 'a ' and v between 'a  ' and 'b\n';
count(*)
20
select count(*) from t1 where v like 'a%';
count(*)
21
select count(*) from t1 where v like 'a %';
count(*)
18
explain select count(*) from t1 where v='a  ';
Query Plan
===================================================
|ID|OPERATOR          |NAME |EST.ROWS|EST.TIME(us)|
---------------------------------------------------
|0 |SCALAR GROUP BY   |     |1       |3           |
|1 |└─TABLE RANGE SCAN|t1(v)|20      |3           |
===================================================
Outputs & filters:
-------------------------------------
  0 - output([T_FUN_COUNT_SUM(T_FUN_COUNT(*))]), filter(nil), rowset=256
      group(nil), agg_func([T_FUN_COUNT_SUM(T_FUN_COUNT(*))])
  1 - output([T_FUN_COUNT(*)]), filter(nil), rowset=256
      access(nil), partitions(p0)
      is_index_back=false, is_global_index=false, 
      range_key([t1.v], [t1.__pk_increment]), range(a  ,MIN ; a  ,MAX), 
      range_cond([t1.v = 'a  ']), 
      pushdown_aggregation([T_FUN_COUNT(*)])
explain select count(*) from t1 where v like 'a%';
Query Plan
===================================================
|ID|OPERATOR          |NAME |EST.ROWS|EST.TIME(us)|
---------------------------------------------------
|0 |SCALAR GROUP BY   |     |1       |3           |
|1 |└─TABLE RANGE SCAN|t1(v)|21      |3           |
===================================================
Outputs & filters:
-------------------------------------
  0 - output([T_FUN_COUNT_SUM(T_FUN_COUNT(*))]), filter(nil), rowset=256
      group(nil), agg_func([T_FUN_COUNT_SUM(T_FUN_COUNT(*))])
  1 - output([T_FUN_COUNT(*)]), filter(nil), rowset=256
      access(nil), partitions(p0)
      is_index_back=false, is_global_index=false, 
      range_key([t1.v], [t1.__pk_increment]), range(a,MIN ; a￿￿￿￿￿￿￿￿￿￿￿￿￿￿￿￿￿￿￿￿￿￿￿￿￿￿￿￿￿￿￿￿￿￿￿￿￿￿￿￿￿￿￿￿￿￿�
      �￿￿￿￿￿￿￿￿￿￿￿￿￿￿￿￿￿￿￿￿￿￿￿￿￿￿￿￿￿￿￿￿￿￿￿￿￿￿￿￿￿￿￿￿￿￿￿￿￿￿￿￿￿￿￿￿￿￿￿￿￿￿￿￿￿￿�
      �￿￿￿￿￿￿￿￿￿￿￿￿￿￿￿￿￿￿￿￿￿￿￿￿￿￿￿￿￿￿￿￿￿￿￿￿￿￿￿￿￿￿￿￿￿￿￿￿￿￿￿￿￿￿￿￿￿￿￿￿￿￿￿￿￿￿�
      �￿￿￿￿￿￿￿￿￿￿￿￿￿￿￿￿￿￿￿￿￿￿￿￿￿￿￿￿￿￿￿￿￿￿￿￿￿￿￿￿￿￿￿￿￿￿￿￿￿￿￿￿￿￿￿￿￿￿￿￿￿￿￿￿￿￿�
      �￿￿￿￿￿￿￿￿￿￿￿￿￿￿￿￿￿￿￿￿￿￿￿￿￿￿￿￿￿￿￿￿￿￿￿￿￿￿￿￿￿￿￿￿￿￿￿￿￿￿￿￿￿￿￿￿￿￿￿￿￿￿￿￿￿￿�
      �￿￿￿￿￿￿￿￿￿￿￿￿￿￿￿￿￿￿￿￿￿￿￿￿￿￿￿￿￿￿￿￿￿￿￿￿￿￿￿￿￿￿￿￿￿￿￿￿￿￿￿￿￿￿￿￿￿￿￿￿￿￿￿￿￿￿�
      �￿￿￿￿￿￿￿￿￿￿￿￿￿￿￿￿￿  ,MAX), 
      range_cond([(T_OP_LIKE, t1.v, 'a%', '\\')]), 
      pushdown_aggregation([T_FUN_COUNT(*)])
explain select count(*) from t1 where v between 'a' and 'a ';
Query Plan
===================================================
|ID|OPERATOR          |NAME |EST.ROWS|EST.TIME(us)|
---------------------------------------------------
|0 |SCALAR GROUP BY   |     |1       |3           |
|1 |└─TABLE RANGE SCAN|t1(v)|20      |3           |
===================================================
Outputs & filters:
-------------------------------------
  0 - output([T_FUN_COUNT_SUM(T_FUN_COUNT(*))]), filter(nil), rowset=256
      group(nil), agg_func([T_FUN_COUNT_SUM(T_FUN_COUNT(*))])
  1 - output([T_FUN_COUNT(*)]), filter(nil), rowset=256
      access(nil), partitions(p0)
      is_index_back=false, is_global_index=false, 
      range_key([t1.v], [t1.__pk_increment]), range(a,MIN ; a ,MAX), 
      range_cond([t1.v >= 'a'], [t1.v <= 'a ']), 
      pushdown_aggregation([T_FUN_COUNT(*)])
explain select count(*) from t1 where v between 'a' and 'a ' and v between 'a  ' and 'b\n';
Query Plan
===================================================
|ID|OPERATOR          |NAME |EST.ROWS|EST.TIME(us)|
---------------------------------------------------
|0 |SCALAR GROUP BY   |     |1       |3           |
|1 |└─TABLE RANGE SCAN|t1(v)|20      |3           |
===================================================
Outputs & filters:
-------------------------------------
  0 - output([T_FUN_COUNT_SUM(T_FUN_COUNT(*))]), filter(nil), rowset=256
      group(nil), agg_func([T_FUN_COUNT_SUM(T_FUN_COUNT(*))])
  1 - output([T_FUN_COUNT(*)]), filter(nil), rowset=256
      access(nil), partitions(p0)
      is_index_back=false, is_global_index=false, 
      range_key([t1.v], [t1.__pk_increment]), range(a,MIN ; a ,MAX), 
      range_cond([t1.v >= 'a'], [t1.v <= 'a '], [t1.v >= 'a  '], [t1.v <= 'b\n']), 
      pushdown_aggregation([T_FUN_COUNT(*)])
explain select * from t1 where v='a';
Query Plan
=================================================
|ID|OPERATOR        |NAME |EST.ROWS|EST.TIME(us)|
-------------------------------------------------
|0 |TABLE RANGE SCAN|t1(v)|20      |58          |
=================================================
Outputs & filters:
-------------------------------------
  0 - output([t1.v], [t1.c], [t1.t]), filter(nil), rowset=256
      access([t1.__pk_increment], [t1.v], [t1.c], [t1.t]), partitions(p0)
      is_index_back=true, is_global_index=false, 
      range_key([t1.v], [t1.__pk_increment]), range(a,MIN ; a,MAX), 
      range_cond([t1.v = 'a'])
select v,count(*) from t1 group by v limit 10;
v	count(*)
 	10
	10
	10
	10
	10
	10
	10
	10
	10
		10
select v,count(t) from t1 group by v limit 10;
v	count(t)
j	20
i	20
h	20
g	20
f	20
e	20
d	20
c	20
b	20
a	20
alter table t1 modify v varchar(600), drop key v;
alter table t1 add key v (v);
show create table t1;
Table	Create Table
t1	CREATE TABLE `t1` (
  `v` varchar(600) DEFAULT NULL,
  `c` char(10) DEFAULT NULL,
  `t` varchar(512) DEFAULT NULL,
  KEY `c` (`c`) BLOCK_SIZE 16384 LOCAL,
  KEY `t` (`t`) BLOCK_SIZE 16384 LOCAL,
  KEY `v` (`v`) BLOCK_SIZE 16384 LOCAL
) ORGANIZATION INDEX DEFAULT CHARSET = utf8mb4 COMPRESSION = 'lz4_1.0' REPLICA_NUM = NUM BLOCK_SIZE = SIZE USE_BLOOM_FILTER = FALSE ENABLE_MACRO_BLOCK_BLOOM_FILTER = FALSE TABLET_SIZE = SIZE PCTFREE = 10
select v,count(*) from t1 group by v limit 10;
v	count(*)
 	10
	10
	10
	10
	10
	10
	10
	10
	10
		10
select v,count(t) from t1 group by v limit 10;
v	count(t)
j	20
i	20
h	20
g	20
f	20
e	20
d	20
c	20
b	20
a	20
drop table t1;
create table t1 (a char(10), unique (a));
insert into t1 values ('a   ');
insert into t1 values ('a ');
ERROR 23000: Duplicate entry 'a' for key 'a'
alter table t1 modify a char(20);
insert into t1 values ('a '),('a  '),('a   '),('a         ');
ERROR 23000: Duplicate entry 'a' for key 'a'
insert into t1 values ('a     ');
ERROR 23000: Duplicate entry 'a' for key 'a'
insert into t1 values ('a          ');
ERROR 23000: Duplicate entry 'a' for key 'a'
insert into t1 values ('a ');
ERROR 23000: Duplicate entry 'a' for key 'a'
update t1 set a='a  ' where a like 'a%';
select concat(a,'.') from t1;
concat(a,'.')
a.
update t1 set a='abc    ' where a like 'a ';
select concat(a,'.') from t1;
concat(a,'.')
a.
update t1 set a='a      ' where a like 'a %';
select concat(a,'.') from t1;
concat(a,'.')
a.
update t1 set a='a  ' where a like 'a      ';
select concat(a,'.') from t1;
concat(a,'.')
a.
drop table t1;
create table t1 (v varchar(10), c char(10), t varchar(512), key(v), key(c), key(t));
show create table t1;
Table	Create Table
t1	CREATE TABLE `t1` (
  `v` varchar(10) DEFAULT NULL,
  `c` char(10) DEFAULT NULL,
  `t` varchar(512) DEFAULT NULL,
  KEY `v` (`v`) BLOCK_SIZE 16384 LOCAL,
  KEY `c` (`c`) BLOCK_SIZE 16384 LOCAL,
  KEY `t` (`t`) BLOCK_SIZE 16384 LOCAL
) ORGANIZATION INDEX DEFAULT CHARSET = utf8mb4 COMPRESSION = 'lz4_1.0' REPLICA_NUM = NUM BLOCK_SIZE = SIZE USE_BLOOM_FILTER = FALSE ENABLE_MACRO_BLOCK_BLOOM_FILTER = FALSE TABLET_SIZE = SIZE PCTFREE = 10
drop table t1;
create table t1 (v char(10) character set utf8);
show create table t1;
Table	Create Table
t1	CREATE TABLE `t1` (
  `v` char(10) DEFAULT NULL
) ORGANIZATION INDEX DEFAULT CHARSET = utf8mb4 COMPRESSION = 'lz4_1.0' REPLICA_NUM = NUM BLOCK_SIZE = SIZE USE_BLOOM_FILTER = FALSE ENABLE_MACRO_BLOCK_BLOOM_FILTER = FALSE TABLET_SIZE = SIZE PCTFREE = 10
drop table t1;
create table t1 (v varchar(10), c char(10));
show create table t1;
Table	Create Table
t1	CREATE TABLE `t1` (
  `v` varchar(10) DEFAULT NULL,
  `c` char(10) DEFAULT NULL
) ORGANIZATION INDEX DEFAULT CHARSET = utf8mb4 COMPRESSION = 'lz4_1.0' REPLICA_NUM = NUM BLOCK_SIZE = SIZE USE_BLOOM_FILTER = FALSE ENABLE_MACRO_BLOCK_BLOOM_FILTER = FALSE TABLET_SIZE = SIZE PCTFREE = 10
insert into t1 values('a','a'),('a ','a ');
select concat('*',v,'*',c,'*') from t1;
concat('*',v,'*',c,'*')
*a*a*
*a *a*
drop table t1;
create table t1 (v varchar(512), key(v));
insert into t1 values(repeat('a',512));
select length(v) from t1 where v=repeat('a',512);
length(v)
512
drop table t1;
create table t1(a int, b varchar(12), key ba(b, a));
insert into t1 values (1, 'A'), (20, NULL);
explain select * from t1 where a=20 and b is null;
Query Plan
==================================================
|ID|OPERATOR        |NAME  |EST.ROWS|EST.TIME(us)|
--------------------------------------------------
|0 |TABLE RANGE SCAN|t1(ba)|1       |3           |
==================================================
Outputs & filters:
-------------------------------------
  0 - output([t1.a], [t1.b]), filter(nil), rowset=16
      access([t1.a], [t1.b]), partitions(p0)
      is_index_back=false, is_global_index=false, 
      range_key([t1.b], [t1.a], [t1.__pk_increment]), range(NULL,20,MIN ; NULL,20,MAX), 
      range_cond([t1.a = 20], [t1.b IS NULL])
select * from t1 where a=20 and b is null;
a	b
20	NULL
drop table t1;
create table t1 (v varchar(512), key(v));
drop table t1;
create table t1 (v varchar(512));
show create table t1;
Table	Create Table
t1	CREATE TABLE `t1` (
  `v` varchar(512) DEFAULT NULL
) ORGANIZATION INDEX DEFAULT CHARSET = utf8mb4 COMPRESSION = 'lz4_1.0' REPLICA_NUM = NUM BLOCK_SIZE = SIZE USE_BLOOM_FILTER = FALSE ENABLE_MACRO_BLOCK_BLOOM_FILTER = FALSE TABLET_SIZE = SIZE PCTFREE = 10
drop table t1;
create table t1 (v varchar(512) character set utf8);
show create table t1;
Table	Create Table
t1	CREATE TABLE `t1` (
  `v` varchar(512) DEFAULT NULL
) ORGANIZATION INDEX DEFAULT CHARSET = utf8mb4 COMPRESSION = 'lz4_1.0' REPLICA_NUM = NUM BLOCK_SIZE = SIZE USE_BLOOM_FILTER = FALSE ENABLE_MACRO_BLOCK_BLOOM_FILTER = FALSE TABLET_SIZE = SIZE PCTFREE = 10
drop table t1;
create table t1 (a char(1), b char(1), key(a, b)) ;
insert into t1 values ('8', '6'), ('4', '7');
select min(a) from t1;
min(a)
4
select min(b) from t1 where a='8';
min(b)
6
drop table t1;
CREATE TABLE t1 ( `a` int(11) NOT NULL auto_increment, `b` int(11)  NULL,PRIMARY KEY  (`a`),UNIQUE KEY `b` (`b`)) ;
insert into t1 (b) values (1);
replace into t1 (b) values (2), (1), (3);
select * from t1;
a	b
3	1
2	2
4	3
truncate table t1;
insert into t1 (b) values (1);
replace into t1 (b) values (2);
replace into t1 (b) values (1);
replace into t1 (b) values (3);
select * from t1;
a	b
3	1
2	2
4	3
drop table t1;
create table t1 (rowid int not null auto_increment, val int not null,primary
key (rowid), unique(val)) ;
replace into t1 (val) values ('1'),('2');
replace into t1 (val) values ('1'),('2');
insert into t1 (val) values ('1'),('2');
ERROR 23000: Duplicate entry '1' for key 'val'
select * from t1;
rowid	val
3	1
4	2
drop table t1;
create table t1 (a int not null auto_increment primary key, val int) ;
insert into t1 (val) values (1);
update t1 set a=2 where a=1;
insert into t1 (val) values (1);
ERROR 23000: Duplicate entry '2' for key 'PRIMARY'
select * from t1;
a	val
2	1
drop table t1;
CREATE TABLE t1 (GRADE DECIMAL(4) NOT NULL, PRIMARY KEY (GRADE)) ;
INSERT INTO t1 (GRADE) VALUES (151),(252),(343);
SELECT GRADE  FROM t1 WHERE GRADE > 160 AND GRADE < 300;
GRADE
252
SELECT GRADE  FROM t1 WHERE GRADE= 151;
GRADE
151
DROP TABLE t1;
create table t1 (f1 varchar(10), f2 varchar(10), primary key (f1,f2)) ;
create table t2 (f3 varchar(10), f4 varchar(10), key (f4)) ;
insert into t2 values ('aa','cc');
insert into t1 values ('aa','bb'),('aa','cc');
select * from t1;
f1	f2
aa	bb
aa	cc
drop table t1,t2;
CREATE TABLE t1 (
id INTEGER NOT NULL AUTO_INCREMENT, PRIMARY KEY (id)
) ;
INSERT INTO t1 (id) VALUES (NULL);
SELECT * FROM t1;
id
1
TRUNCATE t1;
INSERT INTO t1 (id) VALUES (NULL);
SELECT * FROM t1;
id
1
DELETE FROM t1;
TRUNCATE t1;
INSERT INTO t1 (id) VALUES (NULL);
SELECT * FROM t1;
id
1
DROP TABLE t1;
create table t1 (col1 varchar(512), index (col1)) ;
create table t2 (col1 char(255), index (col1));
create table t3 (col1 binary(255), index (col1));
create table t4 (col1 varchar(767), index (col1));
create table t5 (col1 varchar(767) primary key);
create table t6 (col1 varbinary(767) primary key);
create table t7 (col1 varchar(512), index(col1));
create table t8 (col1 varbinary(512), index(col1));
drop table t1, t2, t3, t4, t5, t6, t7, t8;
create table t1 (col1 varchar(767), index(col1)) ;
create table t2 (col1 varbinary(767), index(col1)) ;
create table t3 (col1 varchar(512), index(col1)) ;
create table t4 (col1 varbinary(512), index(col1)) ;
show create table t1;
Table	Create Table
t1	CREATE TABLE `t1` (
  `col1` varchar(767) DEFAULT NULL,
  KEY `col1` (`col1`) BLOCK_SIZE 16384 LOCAL
) ORGANIZATION INDEX DEFAULT CHARSET = utf8mb4 COMPRESSION = 'lz4_1.0' REPLICA_NUM = NUM BLOCK_SIZE = SIZE USE_BLOOM_FILTER = FALSE ENABLE_MACRO_BLOCK_BLOOM_FILTER = FALSE TABLET_SIZE = SIZE PCTFREE = 10
drop table t1, t2, t3, t4;
create table t1 (s1 varbinary(2),primary key (s1)) ;
create table t2 (s1 binary(2),primary key (s1)) ;
create table t3 (s1 varchar(2) binary,primary key (s1)) ;
create table t4 (s1 char(2) binary,primary key (s1)) ;
insert into t1 values (0x41),(0x4120),(0x4100);
insert into t2 values (0x41),(0x4120),(0x4100);
ERROR 23000: Duplicate entry 'A' for key 'PRIMARY'
insert into t2 values (0x41),(0x4120);
insert into t3 values (0x41),(0x4120),(0x4100);
ERROR 23000: Duplicate entry 'A ' for key 'PRIMARY'
insert into t3 values (0x41),(0x4100);
insert into t4 values (0x41),(0x4120),(0x4100);
ERROR 23000: Duplicate entry 'A' for key 'PRIMARY'
insert into t4 values (0x41),(0x4100);
select hex(s1) from t1;
hex(s1)
41
4100
4120
select hex(s1) from t2;
hex(s1)
4100
4120
select hex(s1) from t3;
hex(s1)
4100
41
select hex(s1) from t4;
hex(s1)
4100
41
drop table t1,t2,t3,t4;
create table t1 (a int primary key,s1 varbinary(3) not null unique) ;
create table t2 (s1 binary(2) not null) ;
insert into t1 values(1,0x4100),(2,0x41),(3,0x4120),(4,0x42);
insert into t2 values(0x42);
insert into t2 values(0x41);
select hex(s1) from t2;
hex(s1)
4200
4100
update t1 set s1=0x123456 where a=2;
select hex(s1) from t2;
hex(s1)
4200
4100
update t1 set s1=0x12 where a=1;
update t1 set s1=0x12345678 where a=1;
ERROR 22001: Data too long for column 's1' at row 1
update t1 set s1=0x123457 where a=1;
update t1 set s1=0x1220 where a=1;
select hex(s1) from t2;
hex(s1)
4200
4100
update t1 set s1=0x1200 where a=1;
select hex(s1) from t2;
hex(s1)
4200
4100
update t1 set s1=0x4200 where a=1;
select hex(s1) from t2;
hex(s1)
4200
4100
delete from t1 where a=1;
delete from t1 where a=2;
update t2 set s1=0x4120;
delete from t1;
delete from t1 where a!=3;
select a,hex(s1) from t1;
a	hex(s1)
select hex(s1) from t2;
hex(s1)
4120
4120
drop table t2,t1;
create table t1 (a int primary key,s1 varchar(2) binary not null unique) ;
create table t2 (s1 char(2) binary not null) ;
insert into t1 values(1,0x4100),(2,0x41);
insert into t2 values(0x41);
select hex(s1) from t2;
hex(s1)
41
update t1 set s1=0x1234 where a=1;
select hex(s1) from t2;
hex(s1)
41
update t1 set s1=0x12 where a=2;
select hex(s1) from t2;
hex(s1)
41
delete from t1 where a=1;
delete from t1 where a=2;
select a,hex(s1) from t1;
a	hex(s1)
select hex(s1) from t2;
hex(s1)
41
drop table t2,t1;
create table t1(a date) ;
create table t2(a date, key(a)) ;
insert into t1 values('2005-10-01');
insert into t2 values('2005-10-01');
select * from t1, t2
where t2.a between t1.a - interval 2 day and t1.a + interval 2 day;
a	a
2005-10-01	2005-10-01
drop table t1, t2;
create table t1 (id int not null, f_id int not null, f int not null,
primary key(f_id, id)) ;
create table t2 (id int not null,s_id int not null,s varchar(200),
primary key(id)) ;
INSERT INTO t1 VALUES (8, 1, 3);
INSERT INTO t1 VALUES (1, 2, 1);
INSERT INTO t2 VALUES (1, 0, '');
INSERT INTO t2 VALUES (8, 1, '');
commit;
select ml.* from t1 as ml left join t2 as mm on (mm.id=ml.id)
where mm.id is null ;
id	f_id	f
drop table t1,t2;
SET SESSION TRANSACTION ISOLATION LEVEL READ COMMITTED;
SET SESSION TRANSACTION ISOLATION LEVEL READ COMMITTED;
set ob_trx_timeout=100000000;
set ob_trx_idle_timeout=120000000;
drop table if exists t1,t2,t3,t4,t5,t6,t7,t8,t9,bug58912;
create table t1(a int not null, b int, primary key(a)) ;
insert into t1 values(1,1),(2,2),(3,1),(4,2),(5,1),(6,2);
commit;
set autocommit = 0;
select * from t1;
a	b
1	1
2	2
3	1
4	2
5	1
6	2
update t1 set b = 5 where b = 1;
set ob_trx_timeout=100000000;
set ob_trx_idle_timeout=120000000;
set autocommit = 0;
select * from t1 where a = 2 and b = 2 for update;
a	b
2	2
commit;
drop table t1;
commit;
set ob_trx_timeout=100000000;
set ob_trx_idle_timeout=120000000;
create table t1(a int not null, b int, primary key(a)) ;
insert into t1 values (1,2),(5,3),(4,2);
create table t2(d int not null, e int, primary key(d)) ;
insert into t2 values (8,6),(12,1),(3,1);
commit;
set autocommit = 0;
select * from t2 for update;
d	e
3	1
8	6
12	1
set ob_trx_timeout=100000000;
set ob_trx_idle_timeout=120000000;
set autocommit = 0;
SET SESSION TRANSACTION ISOLATION LEVEL READ COMMITTED;
insert into t1 select * from t2;
update t1 set b = (select e from t2 where a = d);
create table t3(d int not null, e int, primary key(d));
select * from t2;
d	e
3	1
8	6
12	1
commit;
drop table t1, t2, t3;
commit;
set ob_trx_timeout=100000000;
set ob_trx_idle_timeout=120000000;
create table t1(a int not null, b int, primary key(a)) ;
insert into t1 values (1,2),(5,3),(4,2);
create table t2(a int not null, b int, primary key(a)) ;
insert into t2 values (8,6),(12,1),(3,1);
create table t3(d int not null, b int, primary key(d)) ;
insert into t3 values (8,6),(12,1),(3,1);
create table t5(a int not null, b int, primary key(a)) ;
insert into t5 values (1,2),(5,3),(4,2);
create table t6(d int not null, e int, primary key(d)) ;
insert into t6 values (8,6),(12,1),(3,1);
create table t8(a int not null, b int, primary key(a)) ;
insert into t8 values (1,2),(5,3),(4,2);
create table t9(d int not null, e int, primary key(d)) ;
insert into t9 values (8,6),(12,1),(3,1);
commit;
set autocommit = 0;
select * from t2 for update;
a	b
3	1
8	6
12	1
set ob_trx_timeout=100000000;
set ob_trx_idle_timeout=120000000;
set autocommit = 0;
insert into t1 select * from t2;
set ob_trx_timeout=100000000;
set ob_trx_idle_timeout=120000000;
set autocommit = 0;
update t3 set b = (select b from t2 where a = d);
set ob_trx_timeout=100000000;
set ob_trx_idle_timeout=120000000;
set autocommit = 0;
SET SESSION TRANSACTION ISOLATION LEVEL READ COMMITTED;
insert into t5 (select * from t2 );
set ob_trx_timeout=100000000;
set ob_trx_idle_timeout=120000000;
set autocommit = 0;
SET SESSION TRANSACTION ISOLATION LEVEL READ COMMITTED;
update t6 set e = (select b from t2 where a = d );
set ob_trx_timeout=100000000;
set ob_trx_idle_timeout=120000000;
set autocommit = 0;
SET SESSION TRANSACTION ISOLATION LEVEL READ COMMITTED;
insert into t8 (select * from t2 for update);
set ob_trx_timeout=100000000;
set ob_trx_idle_timeout=120000000;
set autocommit = 0;
SET SESSION TRANSACTION ISOLATION LEVEL READ COMMITTED;
update t9 set e = (select b from t2 where a = d for update);
Got one of the listed errors
Got one of the listed errors
drop table t1, t2, t3, t5, t6, t8, t9;
commit;
CREATE TABLE t1 (
a BIGINT(20) NOT NULL,
PRIMARY KEY  (a)
)  DEFAULT CHARSET=UTF8;
CREATE TABLE t2 (
a BIGINT(20) NOT NULL,
b VARCHAR(128) NOT NULL,
c varchar(256) NOT NULL,
PRIMARY KEY  (a, b),
KEY idx_t2_b_c (b)
)  DEFAULT CHARSET=UTF8;
INSERT INTO t1 VALUES (1);
INSERT INTO t2 VALUES (1, 'bar', 'vbar');
INSERT INTO t2 VALUES (1, 'BAR2', 'VBAR');
INSERT INTO t2 VALUES (1, 'bar_bar', 'bibi');
INSERT INTO t2 VALUES (1, 'customer_over', '1');
SELECT * FROM t2 WHERE b = 'customer_over';
a	b	c
1	customer_over	1
SELECT * FROM t2 WHERE BINARY b = 'customer_over';
a	b	c
1	customer_over	1
SELECT DISTINCT p0.a FROM t2 p0 WHERE p0.b = 'customer_over';
a
1
/* Bang: Empty result set, above was expected: */
SELECT DISTINCT p0.a FROM t2 p0 WHERE BINARY p0.b = 'customer_over';
a
1
SELECT p0.a FROM t2 p0 WHERE BINARY p0.b = 'customer_over';
a
1
drop table t2, t1;
CREATE TABLE t1 (a VARCHAR(32)  PRIMARY KEY)
;
INSERT INTO t1 VALUES (0xEFBCA4EFBCA4EFBCA4);
DELETE FROM t1;
INSERT INTO t1 VALUES ('DDD');
SELECT * FROM t1;
a
DDD
DROP TABLE t1;
CREATE TABLE t1 (id int PRIMARY KEY AUTO_INCREMENT) 
AUTO_INCREMENT=42;
INSERT INTO t1 VALUES (0),(347),(0);
SELECT * FROM t1;
id
42
347
348
SHOW CREATE TABLE t1;
Table	Create Table
t1	CREATE TABLE `t1` (
  `id` int(11) NOT NULL AUTO_INCREMENT,
  PRIMARY KEY (`id`)
) ORGANIZATION INDEX AUTO_INCREMENT = 349 AUTO_INCREMENT_MODE = 'ORDER' DEFAULT CHARSET = utf8mb4 COMPRESSION = 'lz4_1.0' REPLICA_NUM = NUM BLOCK_SIZE = SIZE USE_BLOOM_FILTER = FALSE ENABLE_MACRO_BLOCK_BLOOM_FILTER = FALSE TABLET_SIZE = SIZE PCTFREE = 10
CREATE TABLE t2 (id int PRIMARY KEY) ;
INSERT INTO t2 VALUES(42),(347),(348);
SHOW CREATE TABLE t1;
Table	Create Table
t1	CREATE TABLE `t1` (
  `id` int(11) NOT NULL AUTO_INCREMENT,
  PRIMARY KEY (`id`)
) ORGANIZATION INDEX AUTO_INCREMENT = 349 AUTO_INCREMENT_MODE = 'ORDER' DEFAULT CHARSET = utf8mb4 COMPRESSION = 'lz4_1.0' REPLICA_NUM = NUM BLOCK_SIZE = SIZE USE_BLOOM_FILTER = FALSE ENABLE_MACRO_BLOCK_BLOOM_FILTER = FALSE TABLET_SIZE = SIZE PCTFREE = 10
DROP TABLE t1,t2;
CREATE TABLE t1 (
c01 CHAR(255), c02 CHAR(255), c03 CHAR(255), c04 CHAR(255),
c05 CHAR(255), c06 CHAR(255), c07 CHAR(255), c08 CHAR(255),
c09 CHAR(255), c10 CHAR(255), c11 CHAR(255), c12 CHAR(255),
c13 CHAR(255), c14 CHAR(255), c15 CHAR(255), c16 CHAR(255),
c17 CHAR(255), c18 CHAR(255), c19 CHAR(255), c20 CHAR(255),
c21 CHAR(255), c22 CHAR(255), c23 CHAR(255), c24 CHAR(255),
c25 CHAR(255), c26 CHAR(255), c27 CHAR(255), c28 CHAR(255),
c29 CHAR(255), c30 CHAR(255), c31 CHAR(255), c32 CHAR(255)
);
DROP TABLE IF EXISTS t1;
CREATE TABLE t1(
id BIGINT(20) NOT NULL AUTO_INCREMENT PRIMARY KEY
) ;
INSERT INTO t1 VALUES(-10);
SELECT * FROM t1;
id
-10
INSERT INTO t1 VALUES(NULL);
SELECT * FROM t1;
id
-10
1
DROP TABLE t1;
SET TX_ISOLATION='read-committed';
SET AUTOCOMMIT=0;
DROP TABLE IF EXISTS t1, t2;
Warnings:
Note	1051	Unknown table 'test.t1'
Note	1051	Unknown table 'test.t2'
CREATE TABLE t1 ( a int ) ;
CREATE TABLE t2 LIKE t1;
SELECT * FROM t2;
a
SET TX_ISOLATION='read-committed';
SET AUTOCOMMIT=0;
INSERT INTO t1 VALUES (1);
COMMIT;
SELECT * FROM t1 WHERE a=1;
a
1
SET TX_ISOLATION='read-committed';
SET AUTOCOMMIT=0;
SELECT * FROM t2;
a
SET TX_ISOLATION='read-committed';
SET AUTOCOMMIT=0;
INSERT INTO t1 VALUES (2);
COMMIT;
SELECT * FROM t1 WHERE a=2;
a
2
SELECT * FROM t1 WHERE a=2;
a
2
DROP TABLE t1;
DROP TABLE t2;
create table t1 (i int, j int) ;
insert into t1 (i, j) values (1, 1), (2, 2);
update t1 set j = 2;
affected rows: 1
info: Rows matched: 2  Changed: 1  Warnings: 0
drop table t1;
create table t1 (id int) comment='this is a comment' ;
select table_comment, data_free > 0 as data_free_is_set
from information_schema.tables
where table_schema='test' and table_name = 't1';
table_comment	data_free_is_set
this is a comment	NULL
drop table t1;
CREATE TABLE t1 (
c1 INT(10) UNSIGNED NOT NULL AUTO_INCREMENT,
c2 VARCHAR(128) NOT NULL,
PRIMARY KEY(c1)
)  DEFAULT CHARSET=utf8 AUTO_INCREMENT=100;
CREATE TABLE t2 (
c1 INT(10) UNSIGNED NOT NULL AUTO_INCREMENT,
c2 INT(10) UNSIGNED DEFAULT NULL,
PRIMARY KEY(c1)
)  DEFAULT CHARSET=utf8 AUTO_INCREMENT=200;
SELECT AUTO_INCREMENT FROM INFORMATION_SCHEMA.TABLES WHERE table_name = 't2';
AUTO_INCREMENT
NULL
DROP TABLE t2;
DROP TABLE t1;
CREATE TABLE t1 (c1 int  NULL,
c2 int  NULL
)  ;
TRUNCATE TABLE t1;
affected rows: 0
INSERT INTO t1 VALUES (1, 1), (2, 2), (3, 3), (4, 4), (5, 5);
affected rows: 5
info: Records: 5  Duplicates: 0  Warnings: 0
TRUNCATE TABLE t1;
affected rows: 0
DROP TABLE t1;
Variable_name	Value
Variable_name	Value
Variable_name	Value
Variable_name	Value
create table t1 (f1 integer primary key) ;
select f1 from t1;
f1
drop table t1;
