drop table if exists t1,t2,t3,t4,t5,t6,t7,t8,t9;
drop database if exists mysqltest;
create table t1 (v varchar(16384));
drop table t1;
create table t1 (a char(1), b char(1), key(a, b));
insert into t1 values ('8', '6'), ('4', '7');
select min(a) from t1;
min(a)
4
select min(b) from t1 where a='8';
min(b)
6
drop table t1;
CREATE TABLE t1 ( `a` int(11) NOT NULL auto_increment, `b` int(11) default NULL,PRIMARY KEY  (`a`),UNIQUE KEY `b` (`b`));
insert into t1 (b) values (1);
replace into t1 (b) values (2), (1), (3);
select * from t1;
a	b
2	2
3	1
4	3
truncate table t1;
insert into t1 (b) values (1);
replace into t1 (b) values (2);
replace into t1 (b) values (1);
replace into t1 (b) values (3);
select * from t1;
a	b
2	2
3	1
4	3
drop table t1;
create table t1 (rowid int not null auto_increment, val int not null,primary
key (rowid), unique(val)) ;
replace into t1 (val) values ('1'),('2');
replace into t1 (val) values ('1'),('2');
insert into t1 (val) values ('1'),('2');
ERROR 23000: Duplicate entry '1' for key 'val'
select * from t1;
rowid	val
3	1
4	2
drop table t1;
create table t1 (a int not null auto_increment primary key, val int);
insert into t1 (val) values (1);
update t1 set a=2 where a=1;
insert into t1 (val) values (1);
ERROR 23000: Duplicate entry '2' for key 'PRIMARY'
select * from t1;
a	val
2	1
drop table t1;
CREATE TABLE t1 (GRADE DECIMAL(4) NOT NULL, PRIMARY KEY (GRADE));
INSERT INTO t1 (GRADE) VALUES (151),(252),(343);
SELECT GRADE  FROM t1 WHERE GRADE > 160 AND GRADE < 300;
GRADE
252
SELECT GRADE  FROM t1 WHERE GRADE= 151;
GRADE
151
DROP TABLE t1;
create table t1 (f1 varchar(10), f2 varchar(10), primary key (f1,f2));
create table t2 (f3 varchar(10), f4 varchar(10), key (f4)) ;
insert into t2 values ('aa','cc');
insert into t1 values ('aa','bb'),('aa','cc');
delete from t1 where f1='aa' and f2='cc';
select * from t1;
f1	f2
aa	bb
drop table t1,t2;
CREATE TABLE t1 (
id INTEGER NOT NULL AUTO_INCREMENT, PRIMARY KEY (id)
);
CREATE TABLE t2 ( id INTEGER NOT NULL);
INSERT INTO t1 (id) VALUES (NULL);
SELECT * FROM t1;
id
1
TRUNCATE t1;
INSERT INTO t1 (id) VALUES (NULL);
SELECT * FROM t1;
id
1
DELETE FROM t1;
TRUNCATE t1;
INSERT INTO t1 (id) VALUES (NULL);
SELECT * FROM t1;
id
1
DROP TABLE t2, t1;
create table t2 (col1 char(255), index (col1));
create table t3 (col1 binary(255), index (col1));
create table t4 (col1 varchar(767), index (col1));
create table t5 (col1 varchar(767) primary key);
create table t6 (col1 varbinary(767) primary key);
create table t7 (col1 varchar(512), index(col1));
create table t8 (col1 varbinary(512), index(col1));
drop table t2, t3, t4, t5, t6, t7, t8;
set ob_trx_timeout=100000000;
set ob_trx_idle_timeout=120000000;
drop table if exists t1,t2,t3,t4,t5, t6,t7,t8;
create table t1(a int not null);
insert into t1 values (1),(2);
set autocommit=0;
set ob_trx_timeout=100000000;
set ob_trx_idle_timeout=120000000;
insert into t1 values(3);
drop table t1;
create table t1(a int not null);
insert into t1 values (1),(2);
set autocommit=1;
set autocommit=1;
insert into t1 values(3);
drop table t1;
create table t1 (s1 varbinary(2),primary key (s1)) ;
create table t2 (s1 binary(2),primary key (s1)) ;
create table t3 (s1 varchar(2) binary,primary key (s1)) ;
create table t4 (s1 char(2) binary,primary key (s1)) ;
insert into t1 values (0x41),(0x4120),(0x4100);
insert into t2 values (0x41),(0x4120),(0x4100);
ERROR 23000: Duplicate entry 'A' for key 'PRIMARY'
insert into t2 values (0x41),(0x4120);
insert into t3 values (0x41),(0x4120),(0x4100);
ERROR 23000: Duplicate entry 'A ' for key 'PRIMARY'
insert into t3 values (0x41),(0x4100);
insert into t4 values (0x41),(0x4120),(0x4100);
ERROR 23000: Duplicate entry 'A' for key 'PRIMARY'
insert into t4 values (0x41),(0x4100);
select hex(s1) from t1;
hex(s1)
41
4100
4120
select hex(s1) from t2;
hex(s1)
4100
4120
select hex(s1) from t3;
hex(s1)
4100
41
select hex(s1) from t4;
hex(s1)
4100
41
drop table t1,t2,t3,t4;
create table t1 (a int primary key,s1 varchar(2) binary not null unique) ;
create table t2 (s1 char(2) binary not null);
insert into t1 values(1,0x4100),(2,0x41);
insert into t2 values(0x41);
select hex(s1) from t2;
hex(s1)
41
update t1 set s1=0x1234 where a=1;
select hex(s1) from t2;
hex(s1)
41
update t1 set s1=0x12 where a=2;
select hex(s1) from t2;
hex(s1)
41
delete from t1 where a=1;
delete from t1 where a=2;
select a,hex(s1) from t1;
a	hex(s1)
select hex(s1) from t2;
hex(s1)
41
drop table t2,t1;
create table t1(a date) ;
create table t2(a date, key(a)) ;
insert into t1 values('2005-10-01');
insert into t2 values('2005-10-01');
select * from t1, t2
where t2.a between t1.a - interval 2 day and t1.a + interval 2 day;
a	a
2005-10-01	2005-10-01
drop table t1, t2;
create table t1 (id int not null, f_id int not null, f int not null,
primary key(f_id, id)) ;
create table t2 (id int not null,s_id int not null,s varchar(200),
primary key(id)) ;
INSERT INTO t1 VALUES (8, 1, 3);
INSERT INTO t1 VALUES (1, 2, 1);
INSERT INTO t2 VALUES (1, 0, '');
INSERT INTO t2 VALUES (8, 1, '');
commit;
select ml.* from t1 as ml left join t2 as mm on (mm.id=ml.id)
where mm.id is null;
id	f_id	f
drop table t1,t2;
set ob_trx_timeout=100000000;
set ob_trx_idle_timeout=120000000;
create table t1(a int not null, b int, primary key(a)) ;
insert into t1 values(1,1),(2,2),(3,1),(4,2),(5,1),(6,2),(7,3);
commit;
set autocommit = 0;
update t1 set b = 5 where b = 1;
set ob_trx_timeout=100000000;
set ob_trx_idle_timeout=120000000;
set autocommit = 0;
select * from t1 where a = 7 and b = 3 for update;
a	b
7	3
commit;
commit;
drop table t1;
set ob_trx_timeout=100000000;
set ob_trx_idle_timeout=120000000;
create table t1(a int not null, b int, primary key(a)) ;
insert into t1 values(1,1),(2,2),(3,1),(4,2),(5,1),(6,2);
commit;
set autocommit = 0;
update t1 set b = 5 where b = 1;
set ob_trx_timeout=100000000;
set ob_trx_idle_timeout=120000000;
set autocommit = 0;
select * from t1 where a = 2 and b = 2 for update;
a	b
2	2
drop table t1;
commit;
ERROR 40000: Transaction rollbacked
commit;
set ob_trx_timeout=100000000;
set ob_trx_idle_timeout=120000000;
create table t1(a int not null, b int, primary key(a)) ;
insert into t1 values (1,2),(5,3),(4,2);
create table t2(d int not null, e int, primary key(d)) ;
insert into t2 values (8,6),(12,1),(3,1);
commit;
set autocommit = 0;
select * from t2 for update;
d	e
3	1
8	6
12	1
set ob_trx_timeout=100000000;
set ob_trx_idle_timeout=120000000;
set autocommit = 0;
insert into t1 select * from t2;
update t1 set b = (select e from t2 where a = d);
create table t3(d int not null, e int, primary key(d));
select * from t2;
d	e
3	1
8	6
12	1
commit;
commit;
set ob_trx_timeout=100000000;
set ob_trx_idle_timeout=120000000;
drop table t1, t2, t3;
create table t1(a int not null, b int, primary key(a)) ;
insert into t1 values (1,2),(5,3),(4,2);
create table t2(a int not null, b int, primary key(a)) ;
insert into t2 values (8,6),(12,1),(3,1);
create table t3(d int not null, b int, primary key(d)) ;
insert into t3 values (8,6),(12,1),(3,1);
create table t5(a int not null, b int, primary key(a)) ;
insert into t5 values (1,2),(5,3),(4,2);
create table t6(d int not null, e int, primary key(d)) ;
insert into t6 values (8,6),(12,1),(3,1);
create table t8(a int not null, b int, primary key(a)) ;
insert into t8 values (1,2),(5,3),(4,2);
create table t9(d int not null, e int, primary key(d)) ;
insert into t9 values (8,6),(12,1),(3,1);
commit;
set autocommit = 0;
select * from t2 for update;
a	b
3	1
8	6
12	1
set ob_trx_timeout=100000000;
set ob_trx_idle_timeout=120000000;
set autocommit = 0;
insert into t1 select * from t2;
set ob_trx_timeout=100000000;
set ob_trx_idle_timeout=120000000;
set autocommit = 0;
update t3 set b = (select b from t2 where a = d);
set ob_trx_timeout=100000000;
set ob_trx_idle_timeout=120000000;
set autocommit = 0;
create table t4(a int not null, b int, primary key(a))  select * from t2;
set ob_trx_timeout=100000000;
set ob_trx_idle_timeout=120000000;
set autocommit = 0;
insert into t5 (select * from t2 lock in share mode);
set ob_trx_timeout=100000000;
set ob_trx_idle_timeout=120000000;
set autocommit = 0;
update t6 set e = (select b from t2 where a = d lock in share mode);
set ob_trx_timeout=100000000;
set ob_trx_idle_timeout=120000000;
set autocommit = 0;
create table t7(a int not null, b int, primary key(a))  select * from t2 lock in share mode;
set ob_trx_timeout=100000000;
set ob_trx_idle_timeout=120000000;
set autocommit = 0;
insert into t8 (select * from t2 for update);
set ob_trx_timeout=100000000;
set ob_trx_idle_timeout=120000000;
set autocommit = 0;
update t9 set e = (select b from t2 where a = d for update);
set ob_trx_timeout=100000000;
set ob_trx_idle_timeout=120000000;
set autocommit = 0;
drop table t1, t2, t3, t5, t6, t8, t9;
CREATE TABLE t1 (DB_ROW_ID int) ;
drop table t1;
CREATE TABLE t1 (
a BIGINT(20) NOT NULL,
PRIMARY KEY  (a)
)  DEFAULT CHARSET=UTF8;
CREATE TABLE t2 (
a BIGINT(20) NOT NULL,
b VARCHAR(128) NOT NULL,
c varchar(256) NOT NULL,
PRIMARY KEY  (a,b),
KEY idx_t2_b_c (b,c)
)  DEFAULT CHARSET=UTF8;
INSERT INTO t1 VALUES (1);
INSERT INTO t2 VALUES (1, 'bar', 'vbar');
INSERT INTO t2 VALUES (1, 'BAR2', 'VBAR');
INSERT INTO t2 VALUES (1, 'bar_bar', 'bibi');
INSERT INTO t2 VALUES (1, 'customer_over', '1');
SELECT * FROM t2 WHERE b = 'customer_over';
a	b	c
1	customer_over	1
SELECT * FROM t2 WHERE BINARY b = 'customer_over';
a	b	c
1	customer_over	1
SELECT DISTINCT p0.a FROM t2 p0 WHERE p0.b = 'customer_over';
a
1
/* Bang: Empty result set, above was expected: */
SELECT DISTINCT p0.a FROM t2 p0 WHERE BINARY p0.b = 'customer_over';
a
1
SELECT p0.a FROM t2 p0 WHERE BINARY p0.b = 'customer_over';
a
1
drop table t2, t1;
CREATE TABLE t1 ( a int );
BEGIN;
INSERT INTO t1 VALUES (1);
DROP TABLE t1;
CREATE TABLE t1 (a INT, INDEX(a));
CREATE TABLE t2 (a INT, INDEX(a));
INSERT INTO t1 VALUES (1);
INSERT INTO t2 VALUES (1);
SET @old_sql_mode = @@sql_mode;
SET @@sql_mode = 'STRICT_TRANS_TABLES';
ALTER TABLE t2 MODIFY a INT NULL;
SET @@sql_mode = @old_sql_mode;
DELETE FROM t1;
DROP TABLE t2,t1;
CREATE TABLE t1 (a VARCHAR(5) PRIMARY KEY);
INSERT INTO t1 VALUES (0xEFBCA4EFBCA4EFBCA4);
DELETE FROM t1;
INSERT INTO t1 VALUES ('DDD');
SELECT * FROM t1;
a
DDD
DROP TABLE t1;
CREATE TABLE t1 (id int PRIMARY KEY AUTO_INCREMENT)
AUTO_INCREMENT=42;
INSERT INTO t1 VALUES (0),(347),(0);
SELECT * FROM t1;
id
42
347
348
SHOW CREATE TABLE t1;
Table	Create Table
t1	CREATE TABLE `t1` (
  `id` int(11) NOT NULL AUTO_INCREMENT,
  PRIMARY KEY (`id`)
) ORGANIZATION INDEX AUTO_INCREMENT = 349 AUTO_INCREMENT_MODE = 'ORDER' DEFAULT CHARSET = utf8mb4 COMPRESSION = 'lz4_1.0' REPLICA_NUM = NUM BLOCK_SIZE = SIZE USE_BLOOM_FILTER = FALSE ENABLE_MACRO_BLOCK_BLOOM_FILTER = FALSE TABLET_SIZE = SIZE PCTFREE = 10
CREATE TABLE t2 (id int PRIMARY KEY);
INSERT INTO t2 VALUES(42),(347),(348);
SHOW CREATE TABLE t1;
Table	Create Table
t1	CREATE TABLE `t1` (
  `id` int(11) NOT NULL AUTO_INCREMENT,
  PRIMARY KEY (`id`)
) ORGANIZATION INDEX AUTO_INCREMENT = 349 AUTO_INCREMENT_MODE = 'ORDER' DEFAULT CHARSET = utf8mb4 COMPRESSION = 'lz4_1.0' REPLICA_NUM = NUM BLOCK_SIZE = SIZE USE_BLOOM_FILTER = FALSE ENABLE_MACRO_BLOCK_BLOOM_FILTER = FALSE TABLET_SIZE = SIZE PCTFREE = 10
DROP TABLE t1,t2;
CREATE TABLE t1 (
c01 CHAR(255), c02 CHAR(255), c03 CHAR(255), c04 CHAR(255),
c05 CHAR(255), c06 CHAR(255), c07 CHAR(255), c08 CHAR(255),
c09 CHAR(255), c10 CHAR(255), c11 CHAR(255), c12 CHAR(255),
c13 CHAR(255), c14 CHAR(255), c15 CHAR(255), c16 CHAR(255),
c17 CHAR(255), c18 CHAR(255), c19 CHAR(255), c20 CHAR(255),
c21 CHAR(255), c22 CHAR(255), c23 CHAR(255), c24 CHAR(255),
c25 CHAR(255), c26 CHAR(255), c27 CHAR(255), c28 CHAR(255),
c29 CHAR(255), c30 CHAR(255), c31 CHAR(255), c32 CHAR(255)
);
DROP TABLE IF EXISTS t1;
CREATE TABLE t1(
id BIGINT(20) NOT NULL AUTO_INCREMENT PRIMARY KEY
);
INSERT INTO t1 VALUES(-10);
SELECT * FROM t1;
id
-10
INSERT INTO t1 VALUES(NULL);
SELECT * FROM t1;
id
-10
1
DROP TABLE t1;
SET TX_ISOLATION='read-committed';
SET AUTOCOMMIT=0;
DROP TABLE IF EXISTS t1, t2;
Warnings:
Note	1051	Unknown table 'test.t1'
Note	1051	Unknown table 'test.t2'
CREATE TABLE t1 ( a int );
CREATE TABLE t2 LIKE t1;
SELECT * FROM t2;
a
SET TX_ISOLATION='read-committed';
SET AUTOCOMMIT=0;
INSERT INTO t1 VALUES (1);
COMMIT;
SELECT * FROM t1 WHERE a=1;
a
1
SET TX_ISOLATION='read-committed';
SET AUTOCOMMIT=0;
SELECT * FROM t2;
a
SET TX_ISOLATION='read-committed';
SET AUTOCOMMIT=0;
INSERT INTO t1 VALUES (2);
COMMIT;
SELECT * FROM t1 WHERE a=2;
a
2
SELECT * FROM t1 WHERE a=2;
a
2
DROP TABLE t1;
DROP TABLE t2;
create table t1 (i int, j int) ;
insert into t1 (i, j) values (1, 1), (2, 2);
update t1 set j = 2;
affected rows: 1
info: Rows matched: 2  Changed: 1  Warnings: 0
drop table t1;
create table t1 (id int) comment='this is a comment' ;
select table_comment, data_free > 0 as data_free_is_set
from information_schema.tables
where table_schema='test' and table_name = 't1';
table_comment	data_free_is_set
this is a comment	NULL
drop table t1;
CREATE TABLE t1 (
c1 INT(10) UNSIGNED NOT NULL AUTO_INCREMENT,
c2 VARCHAR(128) NOT NULL,
PRIMARY KEY(c1)
) DEFAULT CHARSET=utf8 AUTO_INCREMENT=100;
CREATE TABLE t2 (
c1 INT(10) UNSIGNED NOT NULL AUTO_INCREMENT,
c2 INT(10) UNSIGNED DEFAULT NULL,
PRIMARY KEY(c1)
) DEFAULT CHARSET=utf8 AUTO_INCREMENT=200;
SELECT AUTO_INCREMENT FROM INFORMATION_SCHEMA.TABLES WHERE table_name = 't2' ORDER BY CREATE_TIME DESC LIMIT 1;
AUTO_INCREMENT
NULL
SELECT AUTO_INCREMENT FROM INFORMATION_SCHEMA.TABLES WHERE table_name = 't2' ORDER BY CREATE_TIME DESC LIMIT 1;
AUTO_INCREMENT
NULL
DROP TABLE t2;
DROP TABLE t1;
CREATE TABLE t1 (c1 int default NULL,
c2 int default NULL);
TRUNCATE TABLE t1;
affected rows: 0
INSERT INTO t1 VALUES (1, 1), (2, 2), (3, 3), (4, 4), (5, 5);
affected rows: 5
info: Records: 5  Duplicates: 0  Warnings: 0
TRUNCATE TABLE t1;
affected rows: 0
DROP TABLE t1;
SHOW SESSION STATUS LIKE 'Handler_update%';
Variable_name	Value
SHOW SESSION STATUS LIKE 'Handler_delete%';
Variable_name	Value
UPDATE bug35537 SET c1 = 2 WHERE c1 = 1;
DELETE FROM bug35537 WHERE c1 = 2;
SHOW SESSION STATUS LIKE 'Handler_update%';
Variable_name	Value
SHOW SESSION STATUS LIKE 'Handler_delete%';
Variable_name	Value
DROP TABLE bug35537;
