drop table if exists t1,t2,t3,t1m,t1i,t2m,t2i,t4;
create table t1 (
c_id int(11) not null default '0',
org_id int(11) default null,
unique key contacts$c_id (c_id),
key contacts$org_id (org_id)
);
insert into t1 values
(2,null),(120,null),(141,null),(218,7), (128,1),
(151,2),(234,2),(236,2),(243,2),(255,2),(259,2),(232,3),(235,3),(238,3),
(246,3),(253,3),(269,3),(285,3),(291,3),(293,3),(131,4),(230,4),(231,4);
create table t2 (
slai_id int(11) not null default '0',
owner_tbl int(11) default null,
owner_id int(11) default null,
sla_id int(11) default null,
inc_web int(11) default null,
inc_email int(11) default null,
inc_chat int(11) default null,
inc_csr int(11) default null,
inc_total int(11) default null,
time_billed int(11) default null,
activedate timestamp null default null,
expiredate timestamp null default null,
state int(11) default null,
sla_set int(11) default null,
unique key t2$slai_id (slai_id),
key t2$owner_id (owner_id),
key t2$sla_id (sla_id)
);
insert into t2(slai_id, owner_tbl, owner_id, sla_id) values
(1,3,1,1), (3,3,10,2), (4,3,3,6), (5,3,2,5), (6,3,8,3), (7,3,9,7),
(8,3,6,8), (9,3,4,9), (10,3,5,10), (11,3,11,11), (12,3,7,12);
select si.slai_id
from t1 c join t2 si on
((si.owner_tbl = 3 and si.owner_id = c.org_id) or
( si.owner_tbl = 2 and si.owner_id = c.c_id))
where
c.c_id = 218 and expiredate is null;
slai_id
12
select * from t1 where org_id is null;
c_id	org_id
2	NULL
120	NULL
141	NULL
select si.slai_id
from t1 c join t2 si on
((si.owner_tbl = 3 and si.owner_id = c.org_id) or
( si.owner_tbl = 2 and si.owner_id = c.c_id))
where
c.c_id = 218 and expiredate is null;
slai_id
12
drop table t1, t2;
CREATE TABLE t1 (a int, b int, KEY b (b));
CREATE TABLE t2 (a int, b int, PRIMARY KEY  (a,b));
CREATE TABLE t3 (a int, b int, c int, PRIMARY KEY  (a),
UNIQUE KEY b (b,c), KEY a (a,b,c));
INSERT INTO t1 VALUES (1, 1);
INSERT INTO t1 SELECT a + 1, b + 1 FROM t1;
INSERT INTO t1 SELECT a + 2, b + 2 FROM t1;
INSERT INTO t2 VALUES (1,1),(1,2),(1,3),(1,4),(1,5),(1,6),(1,7),(1,8);
INSERT INTO t2 SELECT a + 1, b FROM t2;
DELETE FROM t2 WHERE a = 1 AND b < 2;
INSERT INTO t3 VALUES (1,1,1),(2,1,2);
INSERT INTO t3 SELECT a + 2, a + 2, 3 FROM t3;
INSERT INTO t3 SELECT a + 4, a + 4, 3 FROM t3;
SELECT  t1.b, t1.a FROM t1, t3, t2 WHERE
t3.a = t2.a AND t2.b = t1.a AND t3.b = 1 AND t3.c IN (1, 2)
ORDER BY t1.b LIMIT 2;
b	a
1	1
2	2
SELECT  t1.b, t1.a FROM t1, t3, t2 WHERE
t3.a = t2.a AND t2.b = t1.a AND t3.b = 1 AND t3.c IN (1, 2)
ORDER BY t1.b LIMIT 5;
b	a
1	1
2	2
2	2
3	3
3	3
DROP TABLE t1, t2, t3;
CREATE TABLE `t1` (`id1` INT) ;
INSERT INTO `t1` (`id1`) VALUES (1),(5),(2);
CREATE TABLE `t2` (
`id1` INT,
`id2` INT NOT NULL,
`id3` INT,
`id4` INT NOT NULL,
UNIQUE (`id2`,`id4`),
KEY (`id1`)
);
INSERT INTO `t2`(`id1`,`id2`,`id3`,`id4`) VALUES
(1,1,1,0),
(1,1,2,1),
(5,1,2,2),
(6,1,2,3),
(1,2,2,2),
(1,2,1,1);
SELECT `id1` FROM `t1` WHERE `id1` NOT IN (SELECT `id1` FROM `t2` WHERE `id2` = 1 AND `id3` = 2);
id1
2
DROP TABLE t1, t2;
create table t1 (c1 int);
drop table t1;
CREATE TABLE t1(c1 varchar(256), UNIQUE (c1), cnt INT DEFAULT 1);
INSERT INTO t1 (c1) VALUES ('1a');
SELECT * FROM t1;
c1	cnt
1a	1
INSERT INTO t1 (c1) VALUES ('1b') ON DUPLICATE KEY UPDATE cnt=cnt+1;
SELECT * FROM t1;
c1	cnt
1a	1
1b	1
DROP TABLE t1;
CREATE TABLE t1(c1 VARCHAR(2), UNIQUE (c1), cnt INT DEFAULT 1)
CHARACTER SET UTF8;
INSERT INTO t1 (c1) VALUES ('1a');
SELECT * FROM t1;
c1	cnt
1a	1
INSERT INTO t1 (c1) VALUES ('1b') ON DUPLICATE KEY UPDATE cnt=cnt+1;
SELECT * FROM t1;
c1	cnt
1a	1
1b	1
DROP TABLE t1;
CREATE TABLE t1(c1 CHAR(2), UNIQUE (c1), cnt INT DEFAULT 1)
CHARACTER SET UTF8;
INSERT INTO t1 (c1) VALUES ('1a');
SELECT * FROM t1;
c1	cnt
1a	1
INSERT INTO t1 (c1) VALUES ('1b') ON DUPLICATE KEY UPDATE cnt=cnt+1;
SELECT * FROM t1;
c1	cnt
1a	1
1b	1
DROP TABLE t1;
CREATE TABLE t1 (
a1 decimal(10,0) DEFAULT NULL,
a2 varbinary(256),
a3 time DEFAULT NULL,
a4 varbinary(256),
a5 char(175) DEFAULT NULL,
a6 timestamp NOT NULL DEFAULT '0000-00-00 00:00:00',
a7 varbinary(64),
INDEX idx (a6,a7,a5)
) ;
EXPLAIN BASIC SELECT a4 FROM t1 WHERE
a6=NULL AND
a4='UNcT5pIde4I6c2SheTo4gt92OV1jgJCVkXmzyf325R1DwLURkbYHwhydANIZMbKTgdcR5xS';
Query Plan
=========================
|ID|OPERATOR       |NAME|
-------------------------
|0 |TABLE FULL SCAN|t1  |
=========================
Outputs & filters:
-------------------------------------
  0 - output([t1.a4]), filter(nil), startup_filter([0]), rowset=16
      access([t1.a4]), partitions(p0)
      is_index_back=false, is_global_index=false, 
      range_key([t1.__pk_increment]), range(MIN ; MAX)always true
EXPLAIN BASIC SELECT t1.a4 FROM t1, t1 t WHERE
t.a6=t.a6 AND t1.a6=NULL AND
t1.a4='UNcT5pIde4I6c2SheTo4gt92OV1jgJCVkXmzyf325R1DwLURkbYHwhydANIZMbKTgdcR5xS';
Query Plan
=======================================
|ID|OPERATOR                   |NAME  |
---------------------------------------
|0 |NESTED-LOOP JOIN CARTESIAN |      |
|1 |├─TABLE FULL SCAN          |t1    |
|2 |└─MATERIAL                 |      |
|3 |  └─TABLE FULL SCAN        |t(idx)|
=======================================
Outputs & filters:
-------------------------------------
  0 - output([t1.a4]), filter(nil), startup_filter([0]), rowset=16
      conds(nil), nl_params_(nil), use_batch=false
  1 - output([t1.a4]), filter(nil), rowset=16
      access([t1.a4]), partitions(p0)
      is_index_back=false, is_global_index=false, 
      range_key([t1.__pk_increment]), range(MIN ; MAX)always true
  2 - output(nil), filter(nil), rowset=16
  3 - output(nil), filter(nil), rowset=16
      access(nil), partitions(p0)
      is_index_back=false, is_global_index=false, 
      range_key([t.a6], [t.a7], [t.a5], [t.__pk_increment]), range(MIN,MIN,MIN,MIN ; MAX,MAX,MAX,MAX)always true
DROP TABLE t1;
create table t1m (a int);
create table t1i (a int);
create table t2m (a int);
create table t2i (a int);
insert into t2m values (5);
insert into t2i values (5);
select min(a) from t1i;
min(a)
NULL
select min(7) from t1i;
min(7)
NULL
select min(7) from DUAL;
min(7)
7
explain basic select min(7) from t2i join t1i;
Query Plan
============================================
|ID|OPERATOR                         |NAME |
--------------------------------------------
|0 |SCALAR GROUP BY                  |     |
|1 |└─SUBPLAN SCAN                   |VIEW1|
|2 |  └─LIMIT                        |     |
|3 |    └─NESTED-LOOP JOIN CARTESIAN |     |
|4 |      ├─SUBPLAN SCAN             |VIEW2|
|5 |      │ └─TABLE FULL SCAN        |t2i  |
|6 |      └─MATERIAL                 |     |
|7 |        └─SUBPLAN SCAN           |VIEW3|
|8 |          └─TABLE FULL SCAN      |t1i  |
============================================
Outputs & filters:
-------------------------------------
  0 - output([T_FUN_MIN(7)]), filter(nil), rowset=16
      group(nil), agg_func([T_FUN_MIN(7)])
  1 - output(nil), filter(nil), rowset=16
      access(nil)
  2 - output([1]), filter(nil), rowset=16
      limit(1), offset(nil)
  3 - output(nil), filter(nil), rowset=16
      conds(nil), nl_params_(nil), use_batch=false
  4 - output(nil), filter(nil), rowset=16
      access(nil)
  5 - output([1]), filter(nil), rowset=16
      access(nil), partitions(p0)
      limit(1), offset(nil), is_index_back=false, is_global_index=false, 
      range_key([t2i.__pk_increment]), range(MIN ; MAX)always true
  6 - output(nil), filter(nil), rowset=16
  7 - output(nil), filter(nil), rowset=16
      access(nil)
  8 - output([1]), filter(nil), rowset=16
      access(nil), partitions(p0)
      limit(1), offset(nil), is_index_back=false, is_global_index=false, 
      range_key([t1i.__pk_increment]), range(MIN ; MAX)always true
select min(7) from t2i join t1i;
min(7)
NULL
select max(a) from t1i;
max(a)
NULL
select max(7) from t1i;
max(7)
NULL
select max(7) from DUAL;
max(7)
7
explain basic select max(7) from t2i join t1i;
Query Plan
============================================
|ID|OPERATOR                         |NAME |
--------------------------------------------
|0 |SCALAR GROUP BY                  |     |
|1 |└─SUBPLAN SCAN                   |VIEW1|
|2 |  └─LIMIT                        |     |
|3 |    └─NESTED-LOOP JOIN CARTESIAN |     |
|4 |      ├─SUBPLAN SCAN             |VIEW2|
|5 |      │ └─TABLE FULL SCAN        |t2i  |
|6 |      └─MATERIAL                 |     |
|7 |        └─SUBPLAN SCAN           |VIEW3|
|8 |          └─TABLE FULL SCAN      |t1i  |
============================================
Outputs & filters:
-------------------------------------
  0 - output([T_FUN_MAX(7)]), filter(nil), rowset=16
      group(nil), agg_func([T_FUN_MAX(7)])
  1 - output(nil), filter(nil), rowset=16
      access(nil)
  2 - output([1]), filter(nil), rowset=16
      limit(1), offset(nil)
  3 - output(nil), filter(nil), rowset=16
      conds(nil), nl_params_(nil), use_batch=false
  4 - output(nil), filter(nil), rowset=16
      access(nil)
  5 - output([1]), filter(nil), rowset=16
      access(nil), partitions(p0)
      limit(1), offset(nil), is_index_back=false, is_global_index=false, 
      range_key([t2i.__pk_increment]), range(MIN ; MAX)always true
  6 - output(nil), filter(nil), rowset=16
  7 - output(nil), filter(nil), rowset=16
      access(nil)
  8 - output([1]), filter(nil), rowset=16
      access(nil), partitions(p0)
      limit(1), offset(nil), is_index_back=false, is_global_index=false, 
      range_key([t1i.__pk_increment]), range(MIN ; MAX)always true
select max(7) from t2i join t1i;
max(7)
NULL
select 1, min(a) from t1i where a=99;
1	min(a)
1	NULL
select 1, min(a) from t1i where 1=99;
1	min(a)
1	NULL
select 1, min(1) from t1i where a=99;
1	min(1)
1	NULL
select 1, min(1) from t1i where 1=99;
1	min(1)
1	NULL
select 1, max(a) from t1i where a=99;
1	max(a)
1	NULL
select 1, max(a) from t1i where 1=99;
1	max(a)
1	NULL
select 1, max(1) from t1i where a=99;
1	max(1)
1	NULL
select 1, max(1) from t1i where 1=99;
1	max(1)
1	NULL
explain basic select count(*), min(7), max(7) from t1m, t1i;
Query Plan
=======================================
|ID|OPERATOR                     |NAME|
---------------------------------------
|0 |SCALAR GROUP BY              |    |
|1 |└─NESTED-LOOP JOIN CARTESIAN |    |
|2 |  ├─TABLE FULL SCAN          |t1m |
|3 |  └─MATERIAL                 |    |
|4 |    └─TABLE FULL SCAN        |t1i |
=======================================
Outputs & filters:
-------------------------------------
  0 - output([T_FUN_COUNT(*)], [T_FUN_MIN(7)], [T_FUN_MAX(7)]), filter(nil), rowset=16
      group(nil), agg_func([T_FUN_COUNT(*)], [T_FUN_MIN(7)], [T_FUN_MAX(7)])
  1 - output(nil), filter(nil), rowset=16
      conds(nil), nl_params_(nil), use_batch=false
  2 - output(nil), filter(nil), rowset=16
      access(nil), partitions(p0)
      is_index_back=false, is_global_index=false, 
      range_key([t1m.__pk_increment]), range(MIN ; MAX)always true
  3 - output(nil), filter(nil), rowset=16
  4 - output(nil), filter(nil), rowset=16
      access(nil), partitions(p0)
      is_index_back=false, is_global_index=false, 
      range_key([t1i.__pk_increment]), range(MIN ; MAX)always true
select count(*), min(7), max(7) from t1m, t1i;
count(*)	min(7)	max(7)
0	NULL	NULL
explain basic select count(*), min(7), max(7) from t1m, t2i;
Query Plan
=======================================
|ID|OPERATOR                     |NAME|
---------------------------------------
|0 |SCALAR GROUP BY              |    |
|1 |└─NESTED-LOOP JOIN CARTESIAN |    |
|2 |  ├─TABLE FULL SCAN          |t1m |
|3 |  └─MATERIAL                 |    |
|4 |    └─TABLE FULL SCAN        |t2i |
=======================================
Outputs & filters:
-------------------------------------
  0 - output([T_FUN_COUNT(*)], [T_FUN_MIN(7)], [T_FUN_MAX(7)]), filter(nil), rowset=16
      group(nil), agg_func([T_FUN_COUNT(*)], [T_FUN_MIN(7)], [T_FUN_MAX(7)])
  1 - output(nil), filter(nil), rowset=16
      conds(nil), nl_params_(nil), use_batch=false
  2 - output(nil), filter(nil), rowset=16
      access(nil), partitions(p0)
      is_index_back=false, is_global_index=false, 
      range_key([t1m.__pk_increment]), range(MIN ; MAX)always true
  3 - output(nil), filter(nil), rowset=16
  4 - output(nil), filter(nil), rowset=16
      access(nil), partitions(p0)
      is_index_back=false, is_global_index=false, 
      range_key([t2i.__pk_increment]), range(MIN ; MAX)always true
select count(*), min(7), max(7) from t1m, t2i;
count(*)	min(7)	max(7)
0	NULL	NULL
explain basic select count(*), min(7), max(7) from t2m, t1i;
Query Plan
=======================================
|ID|OPERATOR                     |NAME|
---------------------------------------
|0 |SCALAR GROUP BY              |    |
|1 |└─NESTED-LOOP JOIN CARTESIAN |    |
|2 |  ├─TABLE FULL SCAN          |t2m |
|3 |  └─MATERIAL                 |    |
|4 |    └─TABLE FULL SCAN        |t1i |
=======================================
Outputs & filters:
-------------------------------------
  0 - output([T_FUN_COUNT(*)], [T_FUN_MIN(7)], [T_FUN_MAX(7)]), filter(nil), rowset=16
      group(nil), agg_func([T_FUN_COUNT(*)], [T_FUN_MIN(7)], [T_FUN_MAX(7)])
  1 - output(nil), filter(nil), rowset=16
      conds(nil), nl_params_(nil), use_batch=false
  2 - output(nil), filter(nil), rowset=16
      access(nil), partitions(p0)
      is_index_back=false, is_global_index=false, 
      range_key([t2m.__pk_increment]), range(MIN ; MAX)always true
  3 - output(nil), filter(nil), rowset=16
  4 - output(nil), filter(nil), rowset=16
      access(nil), partitions(p0)
      is_index_back=false, is_global_index=false, 
      range_key([t1i.__pk_increment]), range(MIN ; MAX)always true
select count(*), min(7), max(7) from t2m, t1i;
count(*)	min(7)	max(7)
0	NULL	NULL
drop table t1m, t1i, t2m, t2i;
create table t1 (
a1 char(64), a2 char(64), b char(16), c char(16) not null, d char(16), dummy char(64) default ' ');
insert into t1 (a1, a2, b, c, d) values
('a','a','a','a111','xy1'),('a','a','a','b111','xy2'),('a','a','a','c111','xy3'),('a','a','a','d111','xy4'),
('a','a','b','e112','xy1'),('a','a','b','f112','xy2'),('a','a','b','g112','xy3'),('a','a','b','h112','xy4'),
('a','b','a','i121','xy1'),('a','b','a','j121','xy2'),('a','b','a','k121','xy3'),('a','b','a','l121','xy4'),
('a','b','b','m122','xy1'),('a','b','b','n122','xy2'),('a','b','b','o122','xy3'),('a','b','b','p122','xy4'),
('b','a','a','a211','xy1'),('b','a','a','b211','xy2'),('b','a','a','c211','xy3'),('b','a','a','d211','xy4'),
('b','a','b','e212','xy1'),('b','a','b','f212','xy2'),('b','a','b','g212','xy3'),('b','a','b','h212','xy4'),
('b','b','a','i221','xy1'),('b','b','a','j221','xy2'),('b','b','a','k221','xy3'),('b','b','a','l221','xy4'),
('b','b','b','m222','xy1'),('b','b','b','n222','xy2'),('b','b','b','o222','xy3'),('b','b','b','p222','xy4'),
('c','a','a','a311','xy1'),('c','a','a','b311','xy2'),('c','a','a','c311','xy3'),('c','a','a','d311','xy4'),
('c','a','b','e312','xy1'),('c','a','b','f312','xy2'),('c','a','b','g312','xy3'),('c','a','b','h312','xy4'),
('c','b','a','i321','xy1'),('c','b','a','j321','xy2'),('c','b','a','k321','xy3'),('c','b','a','l321','xy4'),
('c','b','b','m322','xy1'),('c','b','b','n322','xy2'),('c','b','b','o322','xy3'),('c','b','b','p322','xy4'),
('d','a','a','a411','xy1'),('d','a','a','b411','xy2'),('d','a','a','c411','xy3'),('d','a','a','d411','xy4'),
('d','a','b','e412','xy1'),('d','a','b','f412','xy2'),('d','a','b','g412','xy3'),('d','a','b','h412','xy4'),
('d','b','a','i421','xy1'),('d','b','a','j421','xy2'),('d','b','a','k421','xy3'),('d','b','a','l421','xy4'),
('d','b','b','m422','xy1'),('d','b','b','n422','xy2'),('d','b','b','o422','xy3'),('d','b','b','p422','xy4'),
('a','a','a','a111','xy1'),('a','a','a','b111','xy2'),('a','a','a','c111','xy3'),('a','a','a','d111','xy4'),
('a','a','b','e112','xy1'),('a','a','b','f112','xy2'),('a','a','b','g112','xy3'),('a','a','b','h112','xy4'),
('a','b','a','i121','xy1'),('a','b','a','j121','xy2'),('a','b','a','k121','xy3'),('a','b','a','l121','xy4'),
('a','b','b','m122','xy1'),('a','b','b','n122','xy2'),('a','b','b','o122','xy3'),('a','b','b','p122','xy4'),
('b','a','a','a211','xy1'),('b','a','a','b211','xy2'),('b','a','a','c211','xy3'),('b','a','a','d211','xy4'),
('b','a','b','e212','xy1'),('b','a','b','f212','xy2'),('b','a','b','g212','xy3'),('b','a','b','h212','xy4'),
('b','b','a','i221','xy1'),('b','b','a','j221','xy2'),('b','b','a','k221','xy3'),('b','b','a','l221','xy4'),
('b','b','b','m222','xy1'),('b','b','b','n222','xy2'),('b','b','b','o222','xy3'),('b','b','b','p222','xy4'),
('c','a','a','a311','xy1'),('c','a','a','b311','xy2'),('c','a','a','c311','xy3'),('c','a','a','d311','xy4'),
('c','a','b','e312','xy1'),('c','a','b','f312','xy2'),('c','a','b','g312','xy3'),('c','a','b','h312','xy4'),
('c','b','a','i321','xy1'),('c','b','a','j321','xy2'),('c','b','a','k321','xy3'),('c','b','a','l321','xy4'),
('c','b','b','m322','xy1'),('c','b','b','n322','xy2'),('c','b','b','o322','xy3'),('c','b','b','p322','xy4'),
('d','a','a','a411','xy1'),('d','a','a','b411','xy2'),('d','a','a','c411','xy3'),('d','a','a','d411','xy4'),
('d','a','b','e412','xy1'),('d','a','b','f412','xy2'),('d','a','b','g412','xy3'),('d','a','b','h412','xy4'),
('d','b','a','i421','xy1'),('d','b','a','j421','xy2'),('d','b','a','k421','xy3'),('d','b','a','l421','xy4'),
('d','b','b','m422','xy1'),('d','b','b','n422','xy2'),('d','b','b','o422','xy3'),('d','b','b','p422','xy4');
create table t4 (
pk_col int auto_increment primary key, a1 char(64), a2 char(64), b char(16), c char(16) not null, d char(16), dummy char(64) default ' '
);
insert into t4 (a1, a2, b, c, d, dummy) select * from t1;
create index idx12672_0 on t4 (a1);
create index idx12672_1 on t4 (a1,a2,b,c);
create index idx12672_2 on t4 (a1,a2,b);
select distinct a1 from t4 where pk_col not in (1,2,3,4);
a1
a
b
c
d
drop table t1,t4;
create table t1 (
a varchar(30), b varchar(30), primary key(a), key(b)
);
select distinct a from t1;
a
drop table t1;
create table t1(a int, key(a));
insert into t1 values(1);
select a, count(a) from t1 group by a;
a	count(a)
1	1
drop table t1;
create table t1 (f1 int, f2 char(1), primary key(f1,f2));
insert into t1 values ( 1,"e"),(2,"a"),( 3,"c"),(4,"d");
explain basic select distinct f1 a, f1 b from t1;
Query Plan
===========================
|ID|OPERATOR         |NAME|
---------------------------
|0 |MERGE DISTINCT   |    |
|1 |└─TABLE FULL SCAN|t1  |
===========================
Outputs & filters:
-------------------------------------
  0 - output([t1.f1], [t1.f1]), filter(nil), rowset=16
      distinct([t1.f1], [t1.f1])
  1 - output([t1.f1]), filter(nil), rowset=16
      access([t1.f1]), partitions(p0)
      is_index_back=false, is_global_index=false, 
      range_key([t1.f1], [t1.f2]), range(MIN,MIN ; MAX,MAX)always true
explain basic select distinct f1, f2 from t1;
Query Plan
=========================
|ID|OPERATOR       |NAME|
-------------------------
|0 |TABLE FULL SCAN|t1  |
=========================
Outputs & filters:
-------------------------------------
  0 - output([t1.f1], [t1.f2]), filter(nil), rowset=16
      access([t1.f1], [t1.f2]), partitions(p0)
      is_index_back=false, is_global_index=false, 
      range_key([t1.f1], [t1.f2]), range(MIN,MIN ; MAX,MAX)always true
drop table t1;
CREATE TABLE t1 (id int(11) NOT NULL PRIMARY KEY, name varchar(20),
INDEX (name));
CREATE TABLE t2 (id int(11) NOT NULL PRIMARY KEY, fkey int(11));
INSERT INTO t1 VALUES (1,'A1'),(2,'A2'),(3,'B');
INSERT INTO t2 VALUES (1,1),(2,2),(3,2),(4,3),(5,3);
EXPLAIN BASIC
SELECT COUNT(*) FROM t2 LEFT JOIN t1 ON t2.fkey = t1.id
WHERE t1.name LIKE 'A%';
Query Plan
==================================
|ID|OPERATOR            |NAME    |
----------------------------------
|0 |SCALAR GROUP BY     |        |
|1 |└─HASH JOIN         |        |
|2 |  ├─TABLE RANGE SCAN|t1(name)|
|3 |  └─TABLE FULL SCAN |t2      |
==================================
Outputs & filters:
-------------------------------------
  0 - output([T_FUN_COUNT(*)]), filter(nil), rowset=16
      group(nil), agg_func([T_FUN_COUNT(*)])
  1 - output(nil), filter(nil), rowset=16
      equal_conds([t2.fkey = t1.id]), other_conds(nil)
  2 - output([t1.id]), filter(nil), rowset=16
      access([t1.id]), partitions(p0)
      is_index_back=false, is_global_index=false, 
      range_key([t1.name], [t1.id]), range(A,MIN ; A￿￿￿￿￿￿￿￿￿￿￿￿￿￿￿￿￿￿￿￿￿￿￿￿￿￿ ,MAX), 
      range_cond([(T_OP_LIKE, t1.name, 'A%', '\\')])
  3 - output([t2.fkey]), filter(nil), rowset=16
      access([t2.fkey]), partitions(p0)
      is_index_back=false, is_global_index=false, 
      range_key([t2.id]), range(MIN ; MAX)always true
EXPLAIN BASIC
SELECT COUNT(*) FROM t2 LEFT JOIN t1 ON t2.fkey = t1.id
WHERE t1.name LIKE 'A%' OR FALSE;
Query Plan
==================================
|ID|OPERATOR            |NAME    |
----------------------------------
|0 |SCALAR GROUP BY     |        |
|1 |└─HASH JOIN         |        |
|2 |  ├─TABLE RANGE SCAN|t1(name)|
|3 |  └─TABLE FULL SCAN |t2      |
==================================
Outputs & filters:
-------------------------------------
  0 - output([T_FUN_COUNT(*)]), filter(nil), rowset=16
      group(nil), agg_func([T_FUN_COUNT(*)])
  1 - output(nil), filter(nil), rowset=16
      equal_conds([t2.fkey = t1.id]), other_conds(nil)
  2 - output([t1.id]), filter(nil), rowset=16
      access([t1.id]), partitions(p0)
      is_index_back=false, is_global_index=false, 
      range_key([t1.name], [t1.id]), range(A,MIN ; A￿￿￿￿￿￿￿￿￿￿￿￿￿￿￿￿￿￿￿￿￿￿￿￿￿￿ ,MAX), 
      range_cond([(T_OP_LIKE, t1.name, 'A%', '\\')])
  3 - output([t2.fkey]), filter(nil), rowset=16
      access([t2.fkey]), partitions(p0)
      is_index_back=false, is_global_index=false, 
      range_key([t2.id]), range(MIN ; MAX)always true
DROP TABLE t1,t2;
CREATE TABLE t1 (
id int NOT NULL,
name varchar(20) NOT NULL,
dept varchar(20) NOT NULL,
age tinyint(3) unsigned NOT NULL,
PRIMARY KEY (id),
INDEX (name,dept)
);
INSERT INTO t1(id, dept, age, name) VALUES
(3987, 'cs1', 10, 'rs1'), (3988, 'cs2', 20, 'rs1'), (3995, 'cs3', 10, 'rs2'),
(3996, 'cs4', 20, 'rs2'), (4003, 'cs5', 10, 'rs3'), (4004, 'cs6', 20, 'rs3'),
(4011, 'cs7', 10, 'rs4'), (4012, 'cs8', 20, 'rs4'), (4019, 'cs9', 10, 'rs5'),
(4020, 'cs10', 20, 'rs5'),(4027, 'cs11', 10, 'rs6'),(4028, 'cs12', 20, 'rs6');
EXPLAIN BASIC SELECT DISTINCT t1.name, t1.dept FROM t1 WHERE t1.name='rs5';
Query Plan
================================
|ID|OPERATOR          |NAME    |
--------------------------------
|0 |MERGE DISTINCT    |        |
|1 |└─TABLE RANGE SCAN|t1(name)|
================================
Outputs & filters:
-------------------------------------
  0 - output([t1.name], [t1.dept]), filter(nil), rowset=16
      distinct([t1.dept])
  1 - output([t1.name], [t1.dept]), filter(nil), rowset=16
      access([t1.name], [t1.dept]), partitions(p0)
      is_index_back=false, is_global_index=false, 
      range_key([t1.name], [t1.dept], [t1.id]), range(rs5,MIN,MIN ; rs5,MAX,MAX), 
      range_cond([t1.name = 'rs5'])
SELECT DISTINCT t1.name, t1.dept FROM t1 WHERE t1.name='rs5';
name	dept
rs5	cs10
rs5	cs9
DELETE FROM t1;
# Masking (#) number in "rows" column of the following EXPLAIN BASIC output, as it may vary (bug#47746).
EXPLAIN BASIC SELECT DISTINCT t1.name, t1.dept FROM t1 WHERE t1.name='rs5';
Query Plan
================================
|ID|OPERATOR          |NAME    |
--------------------------------
|0 |MERGE DISTINCT    |        |
|1 |└─TABLE RANGE SCAN|t1(name)|
================================
Outputs & filters:
-------------------------------------
  0 - output([t1.name], [t1.dept]), filter(nil), rowset=16
      distinct([t1.dept])
  1 - output([t1.name], [t1.dept]), filter(nil), rowset=16
      access([t1.name], [t1.dept]), partitions(p0)
      is_index_back=false, is_global_index=false, 
      range_key([t1.name], [t1.dept], [t1.id]), range(rs5,MIN,MIN ; rs5,MAX,MAX), 
      range_cond([t1.name = 'rs5'])
SELECT DISTINCT t1.name, t1.dept FROM t1 WHERE t1.name='rs5';
name	dept
DROP TABLE t1;
drop table if exists t1;
show variables like 'innodb_rollback_on_timeout';
Variable_name	Value
innodb_rollback_on_timeout	OFF
commit;
drop table if exists t1;
create table t1 (a int unsigned not null primary key);
insert into t1 values (1);
begin work;
insert into t1 values (2);
select * from t1;
a
1
2
begin work;
insert into t1 values (5);
select * from t1;
a
1
5
insert into t1 values (2);
ERROR HY000: Lock wait timeout exceeded; try restarting transaction
select * from t1;
a
1
5
commit;
select * from t1;
a
1
2
5
commit;
select * from t1;
a
1
2
5
drop table t1;
drop table if exists `test`;
CREATE TABLE `test` (`test1` varchar(3) NOT NULL,
`test2` varchar(4) NOT NULL,PRIMARY KEY  (`test1`));
INSERT INTO `test` (`test1`, `test2`) VALUES ('tes', '5678');
select * from test;
test1	test2
tes	5678
INSERT INTO `test` (`test1`, `test2`) VALUES ('tes', '1234')
ON DUPLICATE KEY UPDATE `test2` = '1234';
select * from test;
test1	test2
tes	1234
select * from test;
test1	test2
tes	1234
drop table test;
drop table if exists t1;
show variables like 'innodb_rollback_on_timeout';
Variable_name	Value
innodb_rollback_on_timeout	OFF
commit;
drop table if exists t1;
create table t1 (a int unsigned not null primary key);
insert into t1 values (1);
begin work;
insert into t1 values (2);
select * from t1;
a
1
2
begin work;
insert into t1 values (5);
select * from t1;
a
1
5
insert into t1 values (2);
ERROR HY000: Lock wait timeout exceeded; try restarting transaction
select * from t1;
a
1
5
commit;
select * from t1;
a
1
2
5
commit;
select * from t1;
a
1
2
5
drop table t1;
create table t1(
id int auto_increment,
c char(1) not null,
counter int not null default 1,
primary key (id),
unique key (c)
);
insert into t1 (id, c) values
(NULL, 'a'),
(NULL, 'a')
on duplicate key update id = values(id), counter = counter + 1;
select * from t1;
id	c	counter
2	a	2
insert into t1 (id, c) values
(NULL, 'b')
on duplicate key update id = values(id), counter = counter + 1;
select * from t1;
id	c	counter
2	a	2
3	b	1
truncate table t1;
insert into t1 (id, c) values (NULL, 'a');
select * from t1;
id	c	counter
1	a	1
insert into t1 (id, c) values (NULL, 'b'), (NULL, 'b')
on duplicate key update id = values(id), c = values(c), counter = counter + 1;
select * from t1;
id	c	counter
1	a	1
3	b	2
insert into t1 (id, c) values (NULL, 'a')
on duplicate key update id = values(id), c = values(c), counter = counter + 1;
select * from t1;
id	c	counter
3	b	2
4	a	2
drop table t1;
CREATE TABLE t1(
id int AUTO_INCREMENT PRIMARY KEY,
stat_id int NOT NULL,
acct_id int DEFAULT NULL,
INDEX idx1 (stat_id, acct_id),
INDEX idx2 (acct_id)
);
CREATE TABLE t2(
id int AUTO_INCREMENT PRIMARY KEY,
stat_id int NOT NULL,
acct_id int DEFAULT NULL,
INDEX idx1 (stat_id, acct_id),
INDEX idx2 (acct_id)
);
INSERT INTO t1(stat_id,acct_id) VALUES
(1,759), (2,831), (3,785), (4,854), (1,921),
(1,553), (2,589), (3,743), (2,827), (2,545),
(4,779), (4,783), (1,597), (1,785), (4,832),
(1,741), (1,833), (3,788), (2,973), (1,907);
INSERT INTO t1(stat_id,acct_id) SELECT stat_id, mod(id+100000, acct_id) FROM t1;
INSERT INTO t1(stat_id,acct_id) SELECT stat_id, mod(id+100000, acct_id) FROM t1;
INSERT INTO t1(stat_id,acct_id) SELECT stat_id, mod(id+100000, acct_id) FROM t1;
INSERT INTO t1(stat_id,acct_id) SELECT stat_id, mod(id+100000, acct_id) FROM t1;
INSERT INTO t1(stat_id,acct_id) SELECT stat_id, mod(id+100000, acct_id) FROM t1;
INSERT INTO t1(stat_id,acct_id) SELECT stat_id, mod(id+100000, acct_id) FROM t1;
INSERT INTO t1(stat_id,acct_id) SELECT stat_id, mod(id+100000, acct_id) FROM t1;
INSERT INTO t1(stat_id,acct_id) SELECT stat_id, mod(id+100000, acct_id) FROM t1;
INSERT INTO t1(stat_id,acct_id) SELECT stat_id, mod(id+100000, acct_id) FROM t1;
INSERT INTO t1(stat_id,acct_id) SELECT stat_id, mod(id+100000, acct_id) FROM t1;
UPDATE t1 SET acct_id=785 
WHERE MOD(stat_id,2)=0 AND MOD(id,stat_id)=MOD(acct_id,stat_id);
SELECT COUNT(*) FROM t1;
COUNT(*)
20480
EXPLAIN BASIC SELECT COUNT(*) FROM t1 WHERE acct_id=785;
Query Plan
================================
|ID|OPERATOR          |NAME    |
--------------------------------
|0 |SCALAR GROUP BY   |        |
|1 |└─TABLE RANGE SCAN|t1(idx2)|
================================
Outputs & filters:
-------------------------------------
  0 - output([T_FUN_COUNT_SUM(T_FUN_COUNT(*))]), filter(nil), rowset=256
      group(nil), agg_func([T_FUN_COUNT_SUM(T_FUN_COUNT(*))])
  1 - output([T_FUN_COUNT(*)]), filter(nil), rowset=256
      access(nil), partitions(p0)
      is_index_back=false, is_global_index=false, 
      range_key([t1.acct_id], [t1.id]), range(785,MIN ; 785,MAX), 
      range_cond([t1.acct_id = 785]), 
      pushdown_aggregation([T_FUN_COUNT(*)])
EXPLAIN BASIC SELECT COUNT(*) FROM t1 WHERE stat_id IN (1,3) AND acct_id=785;
Query Plan
================================
|ID|OPERATOR          |NAME    |
--------------------------------
|0 |SCALAR GROUP BY   |        |
|1 |└─TABLE RANGE SCAN|t1(idx1)|
================================
Outputs & filters:
-------------------------------------
  0 - output([T_FUN_COUNT_SUM(T_FUN_COUNT(*))]), filter(nil), rowset=16
      group(nil), agg_func([T_FUN_COUNT_SUM(T_FUN_COUNT(*))])
  1 - output([T_FUN_COUNT(*)]), filter(nil), rowset=16
      access(nil), partitions(p0)
      is_index_back=false, is_global_index=false, 
      range_key([t1.stat_id], [t1.acct_id], [t1.id]), range(1,785,MIN ; 1,785,MAX), (3,785,MIN ; 3,785,MAX), 
      range_cond([t1.stat_id IN (1, 3)], [t1.acct_id = 785]), 
      pushdown_aggregation([T_FUN_COUNT(*)])
INSERT INTO t2 SELECT * FROM t1;
EXPLAIN BASIC SELECT COUNT(*) FROM t2 WHERE stat_id IN (1,3) AND acct_id=785;
Query Plan
================================
|ID|OPERATOR          |NAME    |
--------------------------------
|0 |SCALAR GROUP BY   |        |
|1 |└─TABLE RANGE SCAN|t2(idx1)|
================================
Outputs & filters:
-------------------------------------
  0 - output([T_FUN_COUNT_SUM(T_FUN_COUNT(*))]), filter(nil), rowset=16
      group(nil), agg_func([T_FUN_COUNT_SUM(T_FUN_COUNT(*))])
  1 - output([T_FUN_COUNT(*)]), filter(nil), rowset=16
      access(nil), partitions(p0)
      is_index_back=false, is_global_index=false, 
      range_key([t2.stat_id], [t2.acct_id], [t2.id]), range(1,785,MIN ; 1,785,MAX), (3,785,MIN ; 3,785,MAX), 
      range_cond([t2.stat_id IN (1, 3)], [t2.acct_id = 785]), 
      pushdown_aggregation([T_FUN_COUNT(*)])
DROP TABLE t1,t2;
create table t1(a int);
alter table t1 comment '123';
show create table t1;
Table	Create Table
t1	CREATE TABLE `t1` (
  `a` int(11) DEFAULT NULL
) ORGANIZATION INDEX DEFAULT CHARSET = utf8mb4 COMPRESSION = 'lz4_1.0' REPLICA_NUM = NUM BLOCK_SIZE = SIZE USE_BLOOM_FILTER = FALSE ENABLE_MACRO_BLOCK_BLOOM_FILTER = FALSE TABLET_SIZE = SIZE PCTFREE = 10 COMMENT = '123'
drop table t1;
CREATE TABLE t1 (a CHAR(2), KEY (a));
INSERT INTO t1 VALUES ('uk'),('bg');
SELECT * FROM t1 WHERE a = 'uk';
a
uk
DELETE FROM t1 WHERE a = 'uk';
SELECT * FROM t1 WHERE a = 'uk';
a
UPDATE t1 SET a = 'us' WHERE a = 'uk';
SELECT * FROM t1 WHERE a = 'uk';
a
CREATE TABLE t2 (a CHAR(2), KEY (a));
INSERT INTO t2 VALUES ('uk'),('bg');
SELECT * FROM t2 WHERE a = 'uk';
a
uk
DELETE FROM t2 WHERE a = 'uk';
SELECT * FROM t2 WHERE a = 'uk';
a
INSERT INTO t2 VALUES ('uk');
UPDATE t2 SET a = 'us' WHERE a = 'uk';
SELECT * FROM t2 WHERE a = 'uk';
a
CREATE TABLE t3 (a CHAR(2), KEY (a));
INSERT INTO t3 VALUES ('uk'),('bg');
SELECT * FROM t3 WHERE a = 'uk';
a
uk
DELETE FROM t3 WHERE a = 'uk';
SELECT * FROM t3 WHERE a = 'uk';
a
INSERT INTO t3 VALUES ('uk');
UPDATE t3 SET a = 'us' WHERE a = 'uk';
SELECT * FROM t3 WHERE a = 'uk';
a
DROP TABLE t1,t2,t3;
drop table if exists t1,t2;
CREATE TABLE t1 (a INT) ;
CREATE TABLE t2 (a INT) ;
switch to connection c1
SET AUTOCOMMIT=0;
INSERT INTO t2 VALUES (1);
switch to connection c2
SET AUTOCOMMIT=0;
switch to connection c1
COMMIT;
INSERT INTO t1 VALUES (1);
DROP TABLE t1,t2;
switch to connection default
SET AUTOCOMMIT=default;
CREATE TABLE t1 (
id int NOT NULL auto_increment PRIMARY KEY,
b int NOT NULL,
c datetime NOT NULL,
INDEX idx_b(b),
INDEX idx_c(c)
) ;
CREATE TABLE t2 (
b int NOT NULL auto_increment PRIMARY KEY,
c datetime NOT NULL);
INSERT INTO t2(c) VALUES ('2007-01-01');
INSERT INTO t2(c) SELECT c FROM t2;
INSERT INTO t2(c) SELECT c FROM t2;
INSERT INTO t2(c) SELECT c FROM t2;
INSERT INTO t2(c) SELECT c FROM t2;
INSERT INTO t2(c) SELECT c FROM t2;
INSERT INTO t2(c) SELECT c FROM t2;
INSERT INTO t2(c) SELECT c FROM t2;
INSERT INTO t2(c) SELECT c FROM t2;
INSERT INTO t2(c) SELECT c FROM t2;
INSERT INTO t2(c) SELECT c FROM t2;
INSERT INTO t1(b,c) SELECT b,c FROM t2;
UPDATE t2 SET c='2007-01-02';
INSERT INTO t1(b,c) SELECT b,c FROM t2;
UPDATE t2 SET c='2007-01-03';
INSERT INTO t1(b,c) SELECT b,c FROM t2;
SELECT COUNT(*) FROM t1;
COUNT(*)
3072
EXPLAIN BASIC 
SELECT COUNT(*) FROM t1 
WHERE (c >= '2007-01-02' AND c <= '2007-01-03') OR b >= 1;
Query Plan
===========================
|ID|OPERATOR         |NAME|
---------------------------
|0 |SCALAR GROUP BY  |    |
|1 |└─TABLE FULL SCAN|t1  |
===========================
Outputs & filters:
-------------------------------------
  0 - output([T_FUN_COUNT_SUM(T_FUN_COUNT(*))]), filter(nil), rowset=256
      group(nil), agg_func([T_FUN_COUNT_SUM(T_FUN_COUNT(*))])
  1 - output([T_FUN_COUNT(*)]), filter([t1.c >= cast('2007-01-02', MYSQL_DATETIME(-1, -1)) AND t1.c <= cast('2007-01-03', MYSQL_DATETIME(-1, -1)) OR t1.b 
      >= 1]), rowset=256
      access([t1.c], [t1.b]), partitions(p0)
      is_index_back=false, is_global_index=false, filter_before_indexback[false], 
      range_key([t1.id]), range(MIN ; MAX)always true, 
      pushdown_aggregation([T_FUN_COUNT(*)])
SELECT COUNT(*) FROM t1 
WHERE (c >= '2007-01-02' AND c <= '2007-01-03') OR b >= 1;
COUNT(*)
3072
EXPLAIN BASIC 
SELECT COUNT(*) FROM t1 FORCE INDEX(idx_b, idx_c) 
WHERE (c >= '2007-01-02' AND c <= '2007-01-03') OR b >= 1;
Query Plan
================================
|ID|OPERATOR         |NAME     |
--------------------------------
|0 |SCALAR GROUP BY  |         |
|1 |└─TABLE FULL SCAN|t1(idx_c)|
================================
Outputs & filters:
-------------------------------------
  0 - output([T_FUN_COUNT(*)]), filter(nil), rowset=256
      group(nil), agg_func([T_FUN_COUNT(*)])
  1 - output(nil), filter([t1.c >= cast('2007-01-02', MYSQL_DATETIME(-1, -1)) AND t1.c <= cast('2007-01-03', MYSQL_DATETIME(-1, -1)) OR t1.b >= 1]), rowset=256
      access([t1.id], [t1.c], [t1.b]), partitions(p0)
      is_index_back=true, is_global_index=false, filter_before_indexback[false], 
      range_key([t1.c], [t1.id]), range(MIN,MIN ; MAX,MAX)always true
SELECT COUNT(*) FROM t1 FORCE INDEX(idx_b, idx_c)
WHERE (c >= '2007-01-02' AND c <= '2007-01-03') OR b >= 1;
COUNT(*)
3072
DROP TABLE t1,t2;
create table t1(f1 varchar(256) binary not null, key(f1));
insert into t1 values('aaa');
drop table t1;
CREATE TABLE t1 (a INT PRIMARY KEY, b INT, c FLOAT, KEY b(b));
INSERT INTO t1 VALUES (    1 , 1              , 1);
INSERT INTO t1 SELECT  a + 1 , MOD(a + 1 , 20), 1 FROM t1;
INSERT INTO t1 SELECT  a + 2 , MOD(a + 2 , 20), 1 FROM t1;
INSERT INTO t1 SELECT  a + 4 , MOD(a + 4 , 20), 1 FROM t1;
INSERT INTO t1 SELECT  a + 8 , MOD(a + 8 , 20), 1 FROM t1;
INSERT INTO t1 SELECT  a + 16, MOD(a + 16, 20), 1 FROM t1;
INSERT INTO t1 SELECT  a + 32, MOD(a + 32, 20), 1 FROM t1;
INSERT INTO t1 SELECT  a + 64, MOD(a + 64, 20), 1 FROM t1;
EXPLAIN BASIC SELECT b, SUM(c) FROM t1 GROUP BY b;
Query Plan
===========================
|ID|OPERATOR         |NAME|
---------------------------
|0 |HASH GROUP BY    |    |
|1 |└─TABLE FULL SCAN|t1  |
===========================
Outputs & filters:
-------------------------------------
  0 - output([t1.b], [T_FUN_SUM(cast(t1.c, DOUBLE(-1, -1)))]), filter(nil), rowset=256
      group([t1.b]), agg_func([T_FUN_SUM(cast(t1.c, DOUBLE(-1, -1)))])
  1 - output([t1.b], [t1.c]), filter(nil), rowset=256
      access([t1.b], [t1.c]), partitions(p0)
      is_index_back=false, is_global_index=false, 
      range_key([t1.a]), range(MIN ; MAX)always true
DROP TABLE t1;
drop table if exists t1;
show variables like 'innodb_rollback_on_timeout';
Variable_name	Value
innodb_rollback_on_timeout	OFF
commit;
drop table if exists t1;
create table t1 (a int unsigned not null primary key);
insert into t1 values (1);
begin work;
insert into t1 values (2);
select * from t1;
a
1
2
begin work;
insert into t1 values (5);
select * from t1;
a
1
5
insert into t1 values (2);
ERROR HY000: Lock wait timeout exceeded; try restarting transaction
select * from t1;
a
1
5
commit;
select * from t1;
a
1
2
5
commit;
select * from t1;
a
1
2
5
drop table t1;
drop table if exists t1;
create table t1 (a int);
alter table t1 alter a set default 1;
drop table t1;
CREATE TABLE t1 (a int, b int, PRIMARY KEY (a), KEY bkey (b)) ;
INSERT INTO t1 VALUES (1,2),(3,2),(2,2),(4,2),(5,2),(6,2),(7,2),(8,2);
INSERT INTO t1 SELECT a + 8, 2 FROM t1;
INSERT INTO t1 SELECT a + 16, 1 FROM t1;
EXPLAIN BASIC SELECT * FROM t1 WHERE b=2 ORDER BY a;
Query Plan	==============================
Query Plan	|ID|OPERATOR        |NAME    |
Query Plan	------------------------------
Query Plan	|0 |TABLE RANGE SCAN|t1(bkey)|
Query Plan	==============================
Query Plan	Outputs & filters:
Query Plan	-------------------------------------
Query Plan	  0 - output([t1.a], [t1.b]), filter(nil), rowset=256
Query Plan	      access([t1.a], [t1.b]), partitions(p0)
Query Plan	      is_index_back=false, is_global_index=false, 
Query Plan	      range_key([t1.b], [t1.a]), range(2,MIN ; 2,MAX), 
Query Plan	      range_cond([t1.b = 2])
SELECT * FROM t1 WHERE b=2 ORDER BY a;
a	b
1	2
2	2
3	2
4	2
5	2
6	2
7	2
8	2
9	2
10	2
11	2
12	2
13	2
14	2
15	2
16	2
EXPLAIN BASIC SELECT * FROM t1 WHERE b BETWEEN 1 AND 2 ORDER BY a;
Query Plan	================================
Query Plan	|ID|OPERATOR          |NAME    |
Query Plan	--------------------------------
Query Plan	|0 |SORT              |        |
Query Plan	|1 |└─TABLE RANGE SCAN|t1(bkey)|
Query Plan	================================
Query Plan	Outputs & filters:
Query Plan	-------------------------------------
Query Plan	  0 - output([t1.a], [t1.b]), filter(nil), rowset=256
Query Plan	      sort_keys([t1.a, ASC])
Query Plan	  1 - output([t1.a], [t1.b]), filter(nil), rowset=256
Query Plan	      access([t1.a], [t1.b]), partitions(p0)
Query Plan	      is_index_back=false, is_global_index=false, 
Query Plan	      range_key([t1.b], [t1.a]), range(1,MIN ; 2,MAX), 
Query Plan	      range_cond([t1.b >= 1], [t1.b <= 2])
SELECT * FROM t1 WHERE b BETWEEN 1 AND 2 ORDER BY a;
a	b
1	2
2	2
3	2
4	2
5	2
6	2
7	2
8	2
9	2
10	2
11	2
12	2
13	2
14	2
15	2
16	2
17	1
18	1
19	1
20	1
21	1
22	1
23	1
24	1
25	1
26	1
27	1
28	1
29	1
30	1
31	1
32	1
EXPLAIN BASIC SELECT * FROM t1 WHERE b BETWEEN 1 AND 2 ORDER BY b,a;
Query Plan	==============================
Query Plan	|ID|OPERATOR        |NAME    |
Query Plan	------------------------------
Query Plan	|0 |TABLE RANGE SCAN|t1(bkey)|
Query Plan	==============================
Query Plan	Outputs & filters:
Query Plan	-------------------------------------
Query Plan	  0 - output([t1.a], [t1.b]), filter(nil), rowset=256
Query Plan	      access([t1.a], [t1.b]), partitions(p0)
Query Plan	      is_index_back=false, is_global_index=false, 
Query Plan	      range_key([t1.b], [t1.a]), range(1,MIN ; 2,MAX), 
Query Plan	      range_cond([t1.b >= 1], [t1.b <= 2])
SELECT * FROM t1 WHERE b BETWEEN 1 AND 2 ORDER BY b,a;
a	b
17	1
18	1
19	1
20	1
21	1
22	1
23	1
24	1
25	1
26	1
27	1
28	1
29	1
30	1
31	1
32	1
1	2
2	2
3	2
4	2
5	2
6	2
7	2
8	2
9	2
10	2
11	2
12	2
13	2
14	2
15	2
16	2
CREATE TABLE t2 (a int, b int, c int, PRIMARY KEY (a), KEY bkey (b,c))
;
INSERT INTO t2 VALUES (1,1,1),(3,1,1),(2,1,1),(4,1,1);
INSERT INTO t2 SELECT a + 4, 1, 1 FROM t2;
INSERT INTO t2 SELECT a + 8, 1, 1 FROM t2;
EXPLAIN BASIC SELECT * FROM t2 WHERE b=1 ORDER BY a;
Query Plan	================================
Query Plan	|ID|OPERATOR          |NAME    |
Query Plan	--------------------------------
Query Plan	|0 |SORT              |        |
Query Plan	|1 |└─TABLE RANGE SCAN|t2(bkey)|
Query Plan	================================
Query Plan	Outputs & filters:
Query Plan	-------------------------------------
Query Plan	  0 - output([t2.a], [t2.b], [t2.c]), filter(nil), rowset=256
Query Plan	      sort_keys([t2.a, ASC])
Query Plan	  1 - output([t2.a], [t2.b], [t2.c]), filter(nil), rowset=256
Query Plan	      access([t2.a], [t2.b], [t2.c]), partitions(p0)
Query Plan	      is_index_back=false, is_global_index=false, 
Query Plan	      range_key([t2.b], [t2.c], [t2.a]), range(1,MIN,MIN ; 1,MAX,MAX), 
Query Plan	      range_cond([t2.b = 1])
SELECT * FROM t2 WHERE b=1 ORDER BY a;
a	b	c
1	1	1
2	1	1
3	1	1
4	1	1
5	1	1
6	1	1
7	1	1
8	1	1
9	1	1
10	1	1
11	1	1
12	1	1
13	1	1
14	1	1
15	1	1
16	1	1
EXPLAIN BASIC SELECT * FROM t2 WHERE b=1 AND c=1 ORDER BY a;
Query Plan	==============================
Query Plan	|ID|OPERATOR        |NAME    |
Query Plan	------------------------------
Query Plan	|0 |TABLE RANGE SCAN|t2(bkey)|
Query Plan	==============================
Query Plan	Outputs & filters:
Query Plan	-------------------------------------
Query Plan	  0 - output([t2.a], [t2.b], [t2.c]), filter(nil), rowset=256
Query Plan	      access([t2.a], [t2.b], [t2.c]), partitions(p0)
Query Plan	      is_index_back=false, is_global_index=false, 
Query Plan	      range_key([t2.b], [t2.c], [t2.a]), range(1,1,MIN ; 1,1,MAX), 
Query Plan	      range_cond([t2.b = 1], [t2.c = 1])
SELECT * FROM t2 WHERE b=1 AND c=1 ORDER BY a;
a	b	c
1	1	1
2	1	1
3	1	1
4	1	1
5	1	1
6	1	1
7	1	1
8	1	1
9	1	1
10	1	1
11	1	1
12	1	1
13	1	1
14	1	1
15	1	1
16	1	1
EXPLAIN BASIC SELECT * FROM t2 WHERE b=1 AND c=1 ORDER BY b,c,a;
Query Plan	==============================
Query Plan	|ID|OPERATOR        |NAME    |
Query Plan	------------------------------
Query Plan	|0 |TABLE RANGE SCAN|t2(bkey)|
Query Plan	==============================
Query Plan	Outputs & filters:
Query Plan	-------------------------------------
Query Plan	  0 - output([t2.a], [t2.b], [t2.c]), filter(nil), rowset=256
Query Plan	      access([t2.a], [t2.b], [t2.c]), partitions(p0)
Query Plan	      is_index_back=false, is_global_index=false, 
Query Plan	      range_key([t2.b], [t2.c], [t2.a]), range(1,1,MIN ; 1,1,MAX), 
Query Plan	      range_cond([t2.b = 1], [t2.c = 1])
SELECT * FROM t2 WHERE b=1 AND c=1 ORDER BY b,c,a;
a	b	c
1	1	1
2	1	1
3	1	1
4	1	1
5	1	1
6	1	1
7	1	1
8	1	1
9	1	1
10	1	1
11	1	1
12	1	1
13	1	1
14	1	1
15	1	1
16	1	1
EXPLAIN BASIC SELECT * FROM t2 WHERE b=1 AND c=1 ORDER BY c,a;
Query Plan	==============================
Query Plan	|ID|OPERATOR        |NAME    |
Query Plan	------------------------------
Query Plan	|0 |TABLE RANGE SCAN|t2(bkey)|
Query Plan	==============================
Query Plan	Outputs & filters:
Query Plan	-------------------------------------
Query Plan	  0 - output([t2.a], [t2.b], [t2.c]), filter(nil), rowset=256
Query Plan	      access([t2.a], [t2.b], [t2.c]), partitions(p0)
Query Plan	      is_index_back=false, is_global_index=false, 
Query Plan	      range_key([t2.b], [t2.c], [t2.a]), range(1,1,MIN ; 1,1,MAX), 
Query Plan	      range_cond([t2.b = 1], [t2.c = 1])
SELECT * FROM t2 WHERE b=1 AND c=1 ORDER BY c,a;
a	b	c
1	1	1
2	1	1
3	1	1
4	1	1
5	1	1
6	1	1
7	1	1
8	1	1
9	1	1
10	1	1
11	1	1
12	1	1
13	1	1
14	1	1
15	1	1
16	1	1
DROP TABLE t1,t2;
create table t1(a varchar(512));
insert into t1 values('aaa');
alter table t1 add index(a);
show create table t1;
Table	Create Table
t1	CREATE TABLE `t1` (
  `a` varchar(512) DEFAULT NULL,
  KEY `a` (`a`) BLOCK_SIZE 16384 LOCAL
) ORGANIZATION INDEX DEFAULT CHARSET = utf8mb4 COMPRESSION = 'lz4_1.0' REPLICA_NUM = NUM BLOCK_SIZE = SIZE USE_BLOOM_FILTER = FALSE ENABLE_MACRO_BLOCK_BLOOM_FILTER = FALSE TABLET_SIZE = SIZE PCTFREE = 10
drop table t1;
CREATE TABLE t1 (
a INT,
b INT,
KEY (b)
) ;
INSERT INTO t1 VALUES (1,10), (2,10), (2,20), (3,30);
START TRANSACTION;
SELECT * FROM t1 WHERE b=20 FOR UPDATE;
a	b
2	20
START TRANSACTION;
SELECT * FROM t1 WHERE b=10 ORDER BY A FOR UPDATE;
a	b
1	10
2	10
ROLLBACK;
DROP TABLE t1;
ROLLBACK;
CREATE TABLE t1(
a INT, 
b INT NOT NULL, 
c INT NOT NULL, 
d INT, 
UNIQUE KEY (c,b));
INSERT INTO t1 VALUES (1,1,1,50), (1,2,3,40), (2,1,3,4);
EXPLAIN BASIC SELECT c,b,d FROM t1 GROUP BY c,b,d;
Query Plan
=========================
|ID|OPERATOR       |NAME|
-------------------------
|0 |TABLE FULL SCAN|t1  |
=========================
Outputs & filters:
-------------------------------------
  0 - output([t1.c], [t1.b], [t1.d]), filter(nil), rowset=16
      access([t1.c], [t1.b], [t1.d]), partitions(p0)
      is_index_back=false, is_global_index=false, 
      range_key([t1.__pk_increment]), range(MIN ; MAX)always true
SELECT c,b,d FROM t1 GROUP BY c,b,d;
c	b	d
1	1	50
3	2	40
3	1	4
EXPLAIN BASIC SELECT c,b,d FROM t1 GROUP BY c,b,d ORDER BY NULL;
Query Plan
=========================
|ID|OPERATOR       |NAME|
-------------------------
|0 |TABLE FULL SCAN|t1  |
=========================
Outputs & filters:
-------------------------------------
  0 - output([t1.c], [t1.b], [t1.d]), filter(nil), rowset=16
      access([t1.c], [t1.b], [t1.d]), partitions(p0)
      is_index_back=false, is_global_index=false, 
      range_key([t1.__pk_increment]), range(MIN ; MAX)always true
SELECT c,b,d FROM t1 GROUP BY c,b,d ORDER BY NULL;
c	b	d
1	1	50
3	2	40
3	1	4
EXPLAIN BASIC SELECT c,b,d FROM t1 ORDER BY c,b,d;
Query Plan
===========================
|ID|OPERATOR         |NAME|
---------------------------
|0 |SORT             |    |
|1 |└─TABLE FULL SCAN|t1  |
===========================
Outputs & filters:
-------------------------------------
  0 - output([t1.c], [t1.b], [t1.d]), filter(nil), rowset=16
      sort_keys([t1.c, ASC], [t1.b, ASC])
  1 - output([t1.c], [t1.b], [t1.d]), filter(nil), rowset=16
      access([t1.c], [t1.b], [t1.d]), partitions(p0)
      is_index_back=false, is_global_index=false, 
      range_key([t1.__pk_increment]), range(MIN ; MAX)always true
SELECT c,b,d FROM t1 ORDER BY c,b,d;
c	b	d
1	1	50
3	1	4
3	2	40
EXPLAIN BASIC SELECT c,b,d FROM t1 GROUP BY c,b;
Query Plan
=========================
|ID|OPERATOR       |NAME|
-------------------------
|0 |TABLE FULL SCAN|t1  |
=========================
Outputs & filters:
-------------------------------------
  0 - output([t1.c], [t1.b], [t1.d]), filter(nil), rowset=16
      access([t1.c], [t1.b], [t1.d]), partitions(p0)
      is_index_back=false, is_global_index=false, 
      range_key([t1.__pk_increment]), range(MIN ; MAX)always true
SELECT c,b,d FROM t1 GROUP BY c,b;
c	b	d
1	1	50
3	2	40
3	1	4
EXPLAIN BASIC SELECT c,b   FROM t1 GROUP BY c,b;
Query Plan
==========================
|ID|OPERATOR       |NAME |
--------------------------
|0 |TABLE FULL SCAN|t1(c)|
==========================
Outputs & filters:
-------------------------------------
  0 - output([t1.c], [t1.b]), filter(nil), rowset=16
      access([t1.c], [t1.b]), partitions(p0)
      is_index_back=false, is_global_index=false, 
      range_key([t1.c], [t1.b], [t1.shadow_pk_0]), range(MIN,MIN,MIN ; MAX,MAX,MAX)always true
SELECT c,b   FROM t1 GROUP BY c,b;
c	b
1	1
3	1
3	2
DROP TABLE t1;
CREATE TABLE t1 (a INT, b INT, PRIMARY KEY (a), INDEX b (b)) ;
INSERT INTO t1(a,b) VALUES (1,1), (2,2), (3,2);
EXPLAIN BASIC SELECT * FROM t1 WHERE b=2 ORDER BY a ASC;
Query Plan	===========================
Query Plan	|ID|OPERATOR        |NAME |
Query Plan	---------------------------
Query Plan	|0 |TABLE RANGE SCAN|t1(b)|
Query Plan	===========================
Query Plan	Outputs & filters:
Query Plan	-------------------------------------
Query Plan	  0 - output([t1.a], [t1.b]), filter(nil), rowset=16
Query Plan	      access([t1.a], [t1.b]), partitions(p0)
Query Plan	      is_index_back=false, is_global_index=false, 
Query Plan	      range_key([t1.b], [t1.a]), range(2,MIN ; 2,MAX), 
Query Plan	      range_cond([t1.b = 2])
SELECT * FROM t1 WHERE b=2 ORDER BY a ASC;
a	b
2	2
3	2
EXPLAIN BASIC SELECT * FROM t1 WHERE b=2 ORDER BY a DESC;
Query Plan	===================================
Query Plan	|ID|OPERATOR        |NAME         |
Query Plan	-----------------------------------
Query Plan	|0 |TABLE RANGE SCAN|t1(b,Reverse)|
Query Plan	===================================
Query Plan	Outputs & filters:
Query Plan	-------------------------------------
Query Plan	  0 - output([t1.a], [t1.b]), filter(nil), rowset=16
Query Plan	      access([t1.a], [t1.b]), partitions(p0)
Query Plan	      is_index_back=false, is_global_index=false, 
Query Plan	      range_key([t1.b], [t1.a]), range(2,MIN ; 2,MAX), 
Query Plan	      range_cond([t1.b = 2])
SELECT * FROM t1 WHERE b=2 ORDER BY a DESC;
a	b
3	2
2	2
EXPLAIN BASIC SELECT * FROM t1 ORDER BY b ASC, a ASC;
Query Plan	==========================
Query Plan	|ID|OPERATOR       |NAME |
Query Plan	--------------------------
Query Plan	|0 |TABLE FULL SCAN|t1(b)|
Query Plan	==========================
Query Plan	Outputs & filters:
Query Plan	-------------------------------------
Query Plan	  0 - output([t1.a], [t1.b]), filter(nil), rowset=16
Query Plan	      access([t1.a], [t1.b]), partitions(p0)
Query Plan	      is_index_back=false, is_global_index=false, 
Query Plan	      range_key([t1.b], [t1.a]), range(MIN,MIN ; MAX,MAX)always true
SELECT * FROM t1 ORDER BY b ASC, a ASC;
a	b
1	1
2	2
3	2
EXPLAIN BASIC SELECT * FROM t1 ORDER BY b DESC, a DESC;
Query Plan	==================================
Query Plan	|ID|OPERATOR       |NAME         |
Query Plan	----------------------------------
Query Plan	|0 |TABLE FULL SCAN|t1(b,Reverse)|
Query Plan	==================================
Query Plan	Outputs & filters:
Query Plan	-------------------------------------
Query Plan	  0 - output([t1.a], [t1.b]), filter(nil), rowset=16
Query Plan	      access([t1.a], [t1.b]), partitions(p0)
Query Plan	      is_index_back=false, is_global_index=false, 
Query Plan	      range_key([t1.b], [t1.a]), range(MIN,MIN ; MAX,MAX)always true
SELECT * FROM t1 ORDER BY b DESC, a DESC;
a	b
3	2
2	2
1	1
EXPLAIN BASIC SELECT * FROM t1 ORDER BY b ASC, a DESC;
Query Plan	============================
Query Plan	|ID|OPERATOR         |NAME |
Query Plan	----------------------------
Query Plan	|0 |SORT             |     |
Query Plan	|1 |└─TABLE FULL SCAN|t1(b)|
Query Plan	============================
Query Plan	Outputs & filters:
Query Plan	-------------------------------------
Query Plan	  0 - output([t1.a], [t1.b]), filter(nil), rowset=16
Query Plan	      sort_keys([t1.b, ASC], [t1.a, DESC]), prefix_pos(1)
Query Plan	  1 - output([t1.a], [t1.b]), filter(nil), rowset=16
Query Plan	      access([t1.a], [t1.b]), partitions(p0)
Query Plan	      is_index_back=false, is_global_index=false, 
Query Plan	      range_key([t1.b], [t1.a]), range(MIN,MIN ; MAX,MAX)always true
SELECT * FROM t1 ORDER BY b ASC, a DESC;
a	b
1	1
3	2
2	2
EXPLAIN BASIC SELECT * FROM t1 ORDER BY b DESC, a ASC;
Query Plan	====================================
Query Plan	|ID|OPERATOR         |NAME         |
Query Plan	------------------------------------
Query Plan	|0 |SORT             |             |
Query Plan	|1 |└─TABLE FULL SCAN|t1(b,Reverse)|
Query Plan	====================================
Query Plan	Outputs & filters:
Query Plan	-------------------------------------
Query Plan	  0 - output([t1.a], [t1.b]), filter(nil), rowset=16
Query Plan	      sort_keys([t1.b, DESC], [t1.a, ASC]), prefix_pos(1)
Query Plan	  1 - output([t1.a], [t1.b]), filter(nil), rowset=16
Query Plan	      access([t1.a], [t1.b]), partitions(p0)
Query Plan	      is_index_back=false, is_global_index=false, 
Query Plan	      range_key([t1.b], [t1.a]), range(MIN,MIN ; MAX,MAX)always true
SELECT * FROM t1 ORDER BY b DESC, a ASC;
a	b
2	2
3	2
1	1
DROP TABLE t1;
create table t1(a char(10) not null, unique key aa(a),
b char(4) not null, unique key bb(b));
desc t1;
Field	Type	Null	Key	Default	Extra
a	char(10)	NO	UNI	NULL	
b	char(4)	NO	UNI	NULL	
show create table t1;
Table	Create Table
t1	CREATE TABLE `t1` (
  `a` char(10) NOT NULL,
  `b` char(4) NOT NULL,
  UNIQUE KEY `aa` (`a`) BLOCK_SIZE 16384 LOCAL,
  UNIQUE KEY `bb` (`b`) BLOCK_SIZE 16384 LOCAL
) ORGANIZATION INDEX DEFAULT CHARSET = utf8mb4 COMPRESSION = 'lz4_1.0' REPLICA_NUM = NUM BLOCK_SIZE = SIZE USE_BLOOM_FILTER = FALSE ENABLE_MACRO_BLOCK_BLOOM_FILTER = FALSE TABLET_SIZE = SIZE PCTFREE = 10
drop table t1;
CREATE TABLE t1 (id int, type char(6), d int, INDEX idx(id,d)) ;
INSERT INTO t1 VALUES 
(191, 'member', 1), (NULL, 'member', 3), (NULL, 'member', 4), (201, 'member', 2);
EXPLAIN BASIC SELECT * FROM t1 WHERE id=191 OR id IS NULL ORDER BY d;
Query Plan
===============================
|ID|OPERATOR          |NAME   |
-------------------------------
|0 |SORT              |       |
|1 |└─TABLE RANGE SCAN|t1(idx)|
===============================
Outputs & filters:
-------------------------------------
  0 - output([t1.id], [t1.type], [t1.d]), filter(nil), rowset=16
      sort_keys([t1.d, ASC])
  1 - output([t1.id], [t1.type], [t1.d]), filter(nil), rowset=16
      access([t1.__pk_increment], [t1.id], [t1.type], [t1.d]), partitions(p0)
      is_index_back=true, is_global_index=false, 
      range_key([t1.id], [t1.d], [t1.__pk_increment]), range(191,MIN,MIN ; 191,MAX,MAX), (NULL,MIN,MIN ; NULL,MAX,MAX), 
      range_cond([t1.id = 191 OR t1.id IS NULL])
SELECT * FROM t1 WHERE id=191 OR id IS NULL ORDER BY d;
id	type	d
191	member	1
NULL	member	3
NULL	member	4
DROP TABLE t1;
CREATE TABLE t1 (a int, b int, c int, PRIMARY KEY (a), KEY t1_b (b));
INSERT INTO t1 (a,b,c) VALUES (1,1,1), (2,1,1), (3,1,1), (4,1,1);
INSERT INTO t1 (a,b,c) SELECT a+4,b,c FROM t1;
EXPLAIN BASIC SELECT a, b, c FROM t1 WHERE b = 1 ORDER BY a DESC LIMIT 5;
Query Plan
======================================
|ID|OPERATOR        |NAME            |
--------------------------------------
|0 |TABLE RANGE SCAN|t1(t1_b,Reverse)|
======================================
Outputs & filters:
-------------------------------------
  0 - output([t1.a], [t1.b], [t1.c]), filter(nil), rowset=16
      access([t1.a], [t1.b], [t1.c]), partitions(p0)
      limit(5), offset(nil), is_index_back=true, is_global_index=false, 
      range_key([t1.b], [t1.a]), range(1,MIN ; 1,MAX), 
      range_cond([t1.b = 1])
SELECT a, b, c FROM t1 WHERE b = 1 ORDER BY a DESC LIMIT 5;
a	b	c
8	1	1
7	1	1
6	1	1
5	1	1
4	1	1
DROP TABLE t1;
DROP TABLE IF EXISTS t1;
CREATE TABLE t1 (a char(50)) ;
CREATE INDEX i1 on t1 (a);
SELECT * FROM t1 WHERE a = 'abcde';
a
DROP TABLE t1;
create table t1(f1 varchar(5) unique, f2 timestamp NOT NULL);
insert into t1(f1) values(1);
select @a:=f2 from t1;
@a:=f2
#
update t1 set f1=1;
select @b:=f2 from t1;
@b:=f2
#
select if(@a=@b,"ok","wrong");
if(@a=@b,"ok","wrong")
ok
insert into t1(f1) values (1) on duplicate key update f1="1";
select @b:=f2 from t1;
@b:=f2
#
select if(@a=@b,"ok","wrong");
if(@a=@b,"ok","wrong")
ok
insert into t1(f1) select f1 from t1 ;
ERROR 23000: Duplicate entry '1' for key 'f1'
select @b:=f2 from t1;
@b:=f2
#
select if(@a=@b,"ok","wrong");
if(@a=@b,"ok","wrong")
ok
drop table t1;
CREATE TABLE t1
(vid integer NOT NULL,
tid integer NOT NULL,
idx integer NOT NULL,
name varchar(128) NOT NULL,
type varchar(128) NULL,
PRIMARY KEY(idx, vid, tid),
UNIQUE(vid, tid, name)
) ;
INSERT INTO t1 VALUES
(1,1,1,'pk',NULL),(2,1,1,'pk',NULL),(3,1,1,'pk',NULL),(4,1,1,'c1',NULL),
(5,1,1,'pk',NULL),(1,1,2,'c1',NULL),(2,1,2,'c1',NULL),(3,1,2,'c1',NULL),
(4,1,2,'c2',NULL),(5,1,2,'c1',NULL),(2,1,3,'c2',NULL),(3,1,3,'c2',NULL),
(4,1,3,'pk',NULL),(5,1,3,'c2',NULL),
(2,1,4,'c_extra',NULL),(3,1,4,'c_extra',NULL);
EXPLAIN BASIC SELECT * FROM t1 FORCE INDEX (PRIMARY) WHERE tid = 1 AND vid = 3 ORDER BY idx DESC;
Query Plan
================================
|ID|OPERATOR       |NAME       |
--------------------------------
|0 |TABLE FULL SCAN|t1(Reverse)|
================================
Outputs & filters:
-------------------------------------
  0 - output([t1.vid], [t1.tid], [t1.idx], [t1.name], [t1.type]), filter([t1.tid = 1], [t1.vid = 3]), rowset=16
      access([t1.idx], [t1.vid], [t1.tid], [t1.name], [t1.type]), partitions(p0)
      is_index_back=false, is_global_index=false, filter_before_indexback[false,false], 
      range_key([t1.idx], [t1.vid], [t1.tid]), range(MIN,MIN,MIN ; MAX,MAX,MAX)always true
SELECT * FROM t1 FORCE INDEX (PRIMARY) WHERE tid = 1 AND vid = 3 ORDER BY idx DESC;
vid	tid	idx	name	type
3	1	4	c_extra	NULL
3	1	3	c2	NULL
3	1	2	c1	NULL
3	1	1	pk	NULL
DROP TABLE t1;
#
# Bug #44290: explain basic crashes for subquery with distinct in
#             SQL_SELECT::test_quick_select
#             (reproduced only with InnoDB tables)
#
CREATE TABLE t1 (c1 INT, c2 INT, c3 INT, KEY (c3), KEY (c2, c3));
INSERT INTO t1 VALUES (1,1,1), (1,1,1), (1,1,2), (1,1,1), (1,1,2);
SELECT 1 FROM (SELECT COUNT(DISTINCT c1) 
FROM t1 WHERE c2 IN (1, 1) AND c3 = 2 GROUP BY c2) x;
1
1
EXPLAIN BASIC 
SELECT 1 FROM (SELECT COUNT(DISTINCT c1) 
FROM t1 WHERE c2 IN (1, 1) AND c3 = 2 GROUP BY c2) x;
Query Plan
==============================
|ID|OPERATOR          |NAME  |
------------------------------
|0 |MERGE GROUP BY    |      |
|1 |└─TABLE RANGE SCAN|t1(c2)|
==============================
Outputs & filters:
-------------------------------------
  0 - output([1]), filter(nil), rowset=16
      group([t1.c2]), agg_func(nil)
  1 - output([t1.c2]), filter(nil), rowset=16
      access([t1.c2]), partitions(p0)
      is_index_back=false, is_global_index=false, 
      range_key([t1.c2], [t1.c3], [t1.__pk_increment]), range(1,2,MIN ; 1,2,MAX), 
      range_cond([t1.c2 IN (1, 1)], [t1.c3 = 2])
DROP TABLE t1;
CREATE TABLE t1 (c1 REAL, c2 REAL, c3 REAL, KEY (c3), KEY (c2, c3));
INSERT INTO t1 VALUES (1,1,1), (1,1,1), (1,1,2), (1,1,1), (1,1,2);
SELECT 1 FROM (SELECT COUNT(DISTINCT c1) 
FROM t1 WHERE c2 IN (1, 1) AND c3 = 2 GROUP BY c2) x;
1
1
EXPLAIN BASIC 
SELECT 1 FROM (SELECT COUNT(DISTINCT c1) 
FROM t1 WHERE c2 IN (1, 1) AND c3 = 2 GROUP BY c2) x;
Query Plan
==============================
|ID|OPERATOR          |NAME  |
------------------------------
|0 |MERGE GROUP BY    |      |
|1 |└─TABLE RANGE SCAN|t1(c2)|
==============================
Outputs & filters:
-------------------------------------
  0 - output([1]), filter(nil), rowset=16
      group([t1.c2]), agg_func(nil)
  1 - output([t1.c2]), filter(nil), rowset=16
      access([t1.c2]), partitions(p0)
      is_index_back=false, is_global_index=false, 
      range_key([t1.c2], [t1.c3], [t1.__pk_increment]), range(1,2,MIN ; 1,2,MAX), 
      range_cond([t1.c2 IN (cast(1, DOUBLE(-1, -1)), cast(1, DOUBLE(-1, -1)))], [t1.c3 = cast(2, DOUBLE(-1, -1))])
DROP TABLE t1;
CREATE TABLE t1 (c1 DECIMAL(12,2), c2 DECIMAL(12,2), c3 DECIMAL(12,2), KEY (c3), KEY (c2, c3));
INSERT INTO t1 VALUES (1,1,1), (1,1,1), (1,1,2), (1,1,1), (1,1,2);
SELECT 1 FROM (SELECT COUNT(DISTINCT c1) 
FROM t1 WHERE c2 IN (1, 1) AND c3 = 2 GROUP BY c2) x;
1
1
EXPLAIN BASIC 
SELECT 1 FROM (SELECT COUNT(DISTINCT c1) 
FROM t1 WHERE c2 IN (1, 1) AND c3 = 2 GROUP BY c2) x;
Query Plan
==============================
|ID|OPERATOR          |NAME  |
------------------------------
|0 |MERGE GROUP BY    |      |
|1 |└─TABLE RANGE SCAN|t1(c2)|
==============================
Outputs & filters:
-------------------------------------
  0 - output([1]), filter(nil), rowset=16
      group([t1.c2]), agg_func(nil)
  1 - output([t1.c2]), filter(nil), rowset=16
      access([t1.c2]), partitions(p0)
      is_index_back=false, is_global_index=false, 
      range_key([t1.c2], [t1.c3], [t1.__pk_increment]), range(1.00,2.00,MIN ; 1.00,2.00,MAX), 
      range_cond([t1.c2 IN (cast(1, DECIMAL_INT(12, 2)), cast(1, DECIMAL_INT(12, 2)))], [t1.c3 = cast(2, DECIMAL_INT(12, 2))])
DROP TABLE t1;
End of 5.1 tests
#
# Bug#43600: Incorrect type conversion caused wrong result.
#
CREATE TABLE t1 (
a int NOT NULL
);
CREATE TABLE t2 (
a int NOT NULL,
b int NOT NULL,
filler char(100) DEFAULT NULL,
KEY a (a,b)
);
insert into t1 values (0),(1),(2),(3),(4);
insert into t2 select A.a + 10 *B.a, 1, 'filler' from t1 A, t1 B;
explain basic select * from t1, t2 where t2.a=t1.a and t2.b + 1;
Query Plan
===========================
|ID|OPERATOR         |NAME|
---------------------------
|0 |HASH JOIN        |    |
|1 |├─TABLE FULL SCAN|t1  |
|2 |└─TABLE FULL SCAN|t2  |
===========================
Outputs & filters:
-------------------------------------
  0 - output([t1.a], [t2.a], [t2.b], [t2.filler]), filter(nil), rowset=256
      equal_conds([t2.a = t1.a]), other_conds(nil)
  1 - output([t1.a]), filter(nil), rowset=256
      access([t1.a]), partitions(p0)
      is_index_back=false, is_global_index=false, 
      range_key([t1.__pk_increment]), range(MIN ; MAX)always true
  2 - output([t2.a], [t2.b], [t2.filler]), filter([t2.b + 1]), rowset=256
      access([t2.a], [t2.b], [t2.filler]), partitions(p0)
      is_index_back=false, is_global_index=false, filter_before_indexback[false], 
      range_key([t2.__pk_increment]), range(MIN ; MAX)always true
select * from t1, t2 where t2.a=t1.a and t2.b + 1;
a	a	b	filler
0	0	1	filler
1	1	1	filler
2	2	1	filler
3	3	1	filler
4	4	1	filler
drop table t1,t2;
# End of test case for the bug#43600
#
# Bug#42643: InnoDB does not support replication of TRUNCATE TABLE
#
# Check that a TRUNCATE TABLE statement, needing an exclusive meta
# data lock, waits for a shared metadata lock owned by a concurrent
# transaction.
#
CREATE TABLE t1 (a INT);
INSERT INTO t1 VALUES (1),(2),(3);
BEGIN;
SELECT * FROM t1 ORDER BY a;
a
1
2
3
# Connection con1
TRUNCATE TABLE t1;;
# Connection default
ROLLBACK;
# Connection con1
# Reaping TRUNCATE TABLE
SELECT * FROM t1;
a
DROP TABLE t1;
# Disconnect con1
# Connection default
drop table if exists t1, t2, t3;
#
# BUG#35850: Performance regression in 5.1.23/5.1.24
#
create table t1(a int);
insert into t1 values (0),(1),(2),(3),(4),(5),(6),(7),(8),(9);
create table t2 (a int, b int, pk int, key(a,b), primary key(pk)) ;
# this must use key 'a', not PRIMARY:
explain  select a from t2 where a=b;
Query Plan
===============================================
|ID|OPERATOR       |NAME|EST.ROWS|EST.TIME(us)|
-----------------------------------------------
|0 |TABLE FULL SCAN|t2  |1       |3           |
===============================================
Outputs & filters:
-------------------------------------
  0 - output([t2.a]), filter([t2.a = t2.b]), rowset=16
      access([t2.a], [t2.b]), partitions(p0)
      is_index_back=false, is_global_index=false, filter_before_indexback[false], 
      range_key([t2.pk]), range(MIN ; MAX)always true
drop table t1, t2;
#
# Bug #40360: Binlog related errors with binlog off
#
SET SESSION TRANSACTION ISOLATION LEVEL READ COMMITTED;
CREATE TABLE t1 ( a INT );
INSERT INTO t1 VALUES(1);
DROP TABLE t1;
#
# Bug#37284 Crash in Field_string::type()
#
DROP TABLE IF EXISTS t1;
CREATE TABLE t1 (a char(50));
CREATE INDEX i1 on t1 (a);
SELECT * FROM t1 WHERE a = 'abcde';
a
DROP TABLE t1;
#
# Bug #37742: HA_EXTRA_KEYREAD flag is set when key contains only prefix of
# requested column
#
CREATE TABLE foo (a int, b int, c char(10),
PRIMARY KEY (c),
KEY b (b)
) ;
CREATE TABLE foo2 (a int, b int, c char(10),
PRIMARY KEY (c),
KEY b (b)
) ;
CREATE TABLE bar (a int, b int, c char(10),
PRIMARY KEY (c),
KEY b (b)
);
INSERT INTO foo VALUES
(1,2,'abcdefghij'), (2,3,''), (3,4,'klmnopqrst'),
(4,5,'uvwxyz'), (5,6,'meotnsyglt'), (4,5,'asfdewe');
INSERT INTO bar SELECT * FROM foo;
INSERT INTO foo2 SELECT * FROM foo;
EXPLAIN  SELECT c FROM bar WHERE b>2;;
Query Plan	==================================================
Query Plan	|ID|OPERATOR        |NAME  |EST.ROWS|EST.TIME(us)|
Query Plan	--------------------------------------------------
Query Plan	|0 |TABLE RANGE SCAN|bar(b)|5       |3           |
Query Plan	==================================================
Query Plan	Outputs & filters:
Query Plan	-------------------------------------
Query Plan	  0 - output([bar.c]), filter(nil), rowset=16
Query Plan	      access([bar.c]), partitions(p0)
Query Plan	      is_index_back=false, is_global_index=false, 
Query Plan	      range_key([bar.b], [bar.c]), range(2,MAX ; MAX,MAX), 
Query Plan	      range_cond([bar.b > 2])
EXPLAIN  SELECT c FROM foo WHERE b>2;;
Query Plan	==================================================
Query Plan	|ID|OPERATOR        |NAME  |EST.ROWS|EST.TIME(us)|
Query Plan	--------------------------------------------------
Query Plan	|0 |TABLE RANGE SCAN|foo(b)|5       |3           |
Query Plan	==================================================
Query Plan	Outputs & filters:
Query Plan	-------------------------------------
Query Plan	  0 - output([foo.c]), filter(nil), rowset=16
Query Plan	      access([foo.c]), partitions(p0)
Query Plan	      is_index_back=false, is_global_index=false, 
Query Plan	      range_key([foo.b], [foo.c]), range(2,MAX ; MAX,MAX), 
Query Plan	      range_cond([foo.b > 2])
EXPLAIN  SELECT c FROM foo2 WHERE b>2;;
Query Plan	===================================================
Query Plan	|ID|OPERATOR        |NAME   |EST.ROWS|EST.TIME(us)|
Query Plan	---------------------------------------------------
Query Plan	|0 |TABLE RANGE SCAN|foo2(b)|5       |3           |
Query Plan	===================================================
Query Plan	Outputs & filters:
Query Plan	-------------------------------------
Query Plan	  0 - output([foo2.c]), filter(nil), rowset=16
Query Plan	      access([foo2.c]), partitions(p0)
Query Plan	      is_index_back=false, is_global_index=false, 
Query Plan	      range_key([foo2.b], [foo2.c]), range(2,MAX ; MAX,MAX), 
Query Plan	      range_cond([foo2.b > 2])
EXPLAIN  SELECT c FROM bar WHERE c>'2';;
Query Plan	================================================
Query Plan	|ID|OPERATOR        |NAME|EST.ROWS|EST.TIME(us)|
Query Plan	------------------------------------------------
Query Plan	|0 |TABLE RANGE SCAN|bar |5       |3           |
Query Plan	================================================
Query Plan	Outputs & filters:
Query Plan	-------------------------------------
Query Plan	  0 - output([bar.c]), filter(nil), rowset=16
Query Plan	      access([bar.c]), partitions(p0)
Query Plan	      is_index_back=false, is_global_index=false, 
Query Plan	      range_key([bar.c]), range(2 ; MAX), 
Query Plan	      range_cond([bar.c > '2'])
EXPLAIN  SELECT c FROM foo WHERE c>'2';;
Query Plan	================================================
Query Plan	|ID|OPERATOR        |NAME|EST.ROWS|EST.TIME(us)|
Query Plan	------------------------------------------------
Query Plan	|0 |TABLE RANGE SCAN|foo |5       |3           |
Query Plan	================================================
Query Plan	Outputs & filters:
Query Plan	-------------------------------------
Query Plan	  0 - output([foo.c]), filter(nil), rowset=16
Query Plan	      access([foo.c]), partitions(p0)
Query Plan	      is_index_back=false, is_global_index=false, 
Query Plan	      range_key([foo.c]), range(2 ; MAX), 
Query Plan	      range_cond([foo.c > '2'])
EXPLAIN  SELECT c FROM foo2 WHERE c>'2';;
Query Plan	================================================
Query Plan	|ID|OPERATOR        |NAME|EST.ROWS|EST.TIME(us)|
Query Plan	------------------------------------------------
Query Plan	|0 |TABLE RANGE SCAN|foo2|5       |3           |
Query Plan	================================================
Query Plan	Outputs & filters:
Query Plan	-------------------------------------
Query Plan	  0 - output([foo2.c]), filter(nil), rowset=16
Query Plan	      access([foo2.c]), partitions(p0)
Query Plan	      is_index_back=false, is_global_index=false, 
Query Plan	      range_key([foo2.c]), range(2 ; MAX), 
Query Plan	      range_cond([foo2.c > '2'])
DROP TABLE foo, bar, foo2;
#
# Bug#41348: INSERT INTO tbl SELECT * FROM temp_tbl overwrites locking type of temp table
#
DROP TABLE IF EXISTS t1,t3,t2;
#
# Bug#37016: TRUNCATE TABLE removes some rows but not all
#
DROP TABLE IF EXISTS t1,t2,t3;
CREATE TABLE t1 (id INT NOT NULL, PRIMARY KEY (id));
CREATE TABLE t2 (id INT PRIMARY KEY,
t1_id INT, INDEX par_ind (t1_id));
INSERT INTO t1 VALUES (1),(2);
INSERT INTO t2 VALUES (3,2);
SET AUTOCOMMIT = 0;
START TRANSACTION;
TRUNCATE TABLE t1;
SELECT * FROM t1;
id
COMMIT;
SELECT * FROM t1;
id
START TRANSACTION;
TRUNCATE TABLE t1;
SELECT * FROM t1;
id
ROLLBACK;
SELECT * FROM t1;
id
SET AUTOCOMMIT = 1;
START TRANSACTION;
SELECT * FROM t1;
id
COMMIT;
TRUNCATE TABLE t1;
SELECT * FROM t1;
id
DELETE FROM t2 WHERE id = 3;
START TRANSACTION;
SELECT * FROM t1;
id
TRUNCATE TABLE t1;
ROLLBACK;
SELECT * FROM t1;
id
TRUNCATE TABLE t2;
DROP TABLE t2;
DROP TABLE t1;
#
# Bug#43580: Issue with Innodb on multi-table update
#
CREATE TABLE t1 (a INT, b INT, KEY (a));
CREATE TABLE t2 (a INT KEY, b INT, KEY (b));
CREATE TABLE t3 (a INT, b INT KEY, KEY (a));
CREATE TABLE t4 (a INT KEY, b INT, KEY (b));
INSERT INTO t1 VALUES (1, 1), (2, 2), (3, 3), (4, 4), (5, 5), (6, 6);
INSERT INTO t2 VALUES (1, 1), (2, 2), (3, 3), (4, 4), (5, 5);
INSERT INTO t3 VALUES (1, 101), (2, 102), (3, 103), (4, 104), (5, 105), (6, 106);
INSERT INTO t4 VALUES (1, 1), (2, 2), (3, 3), (4, 4), (5, 5);
DROP TABLE t1, t2, t3, t4;
#
# Bug#44886: SIGSEGV in test_if_skip_sort_order() -
#            uninitialized variable used as subscript 
#
CREATE TABLE t1 (a INT, b INT, c INT, d INT, PRIMARY KEY (b), KEY (a,c))
;
INSERT INTO t1 VALUES (1,1,1,0);
CREATE TABLE t2 (a INT, b INT, e INT, KEY (e));
INSERT INTO t2 VALUES (1,1,2);
CREATE TABLE t3 (a INT, b INT);
INSERT INTO t3 VALUES (1, 1);
SELECT * FROM t1, t2, t3
WHERE t1.a = t3.a AND (t1.b = t3.b OR t1.d) AND t2.b = t1.b AND t2.e = 2
GROUP BY t1.b;
a	b	c	d	a	b	e	a	b
1	1	1	0	1	1	2	1	1
DROP TABLE t1, t2, t3;
#
# Bug #45828: Optimizer won't use partial primary key if another 
# index can prevent filesort
#
CREATE TABLE `t1` (
c1 int NOT NULL,
c2 int NOT NULL,
c3 int NOT NULL,
PRIMARY KEY (c1,c2),
KEY  (c3)
);
INSERT INTO t1 VALUES (5,2,1246276747);
INSERT INTO t1 VALUES (2,1,1246281721);
INSERT INTO t1 VALUES (7,3,1246281756);
INSERT INTO t1 VALUES (4,2,1246282139);
INSERT INTO t1 VALUES (3,1,1246282230);
INSERT INTO t1 VALUES (1,0,1246282712);
INSERT INTO t1 VALUES (8,3,1246282765);
INSERT INTO t1 SELECT c1+10,c2+10,c3+10 FROM t1;
INSERT INTO t1 SELECT c1+100,c2+100,c3+100 from t1;
INSERT INTO t1 SELECT c1+1000,c2+1000,c3+1000 from t1;
INSERT INTO t1 SELECT c1+10000,c2+10000,c3+10000 from t1;
INSERT INTO t1 SELECT c1+100000,c2+100000,c3+100000 from t1;
INSERT INTO t1 SELECT c1+1000000,c2+1000000,c3+1000000 from t1;
SELECT * FROM t1 WHERE c1 = 99999999 AND c3 > 1 ORDER BY c3;
c1	c2	c3
EXPLAIN  SELECT * FROM t1 WHERE c1 = 99999999 AND c3 > 1 ORDER BY c3;
Query Plan
==================================================
|ID|OPERATOR          |NAME|EST.ROWS|EST.TIME(us)|
--------------------------------------------------
|0 |SORT              |    |1       |3           |
|1 |└─TABLE RANGE SCAN|t1  |1       |3           |
==================================================
Outputs & filters:
-------------------------------------
  0 - output([t1.c1], [t1.c2], [t1.c3]), filter(nil), rowset=16
      sort_keys([t1.c3, ASC])
  1 - output([t1.c1], [t1.c2], [t1.c3]), filter([t1.c3 > 1]), rowset=16
      access([t1.c1], [t1.c2], [t1.c3]), partitions(p0)
      is_index_back=false, is_global_index=false, filter_before_indexback[false], 
      range_key([t1.c1], [t1.c2]), range(99999999,MIN ; 99999999,MAX), 
      range_cond([t1.c1 = 99999999])
EXPLAIN  SELECT * FROM t1 FORCE INDEX (PRIMARY) WHERE c1 = 99999999 AND c3 > 1 ORDER BY c3;
Query Plan
==================================================
|ID|OPERATOR          |NAME|EST.ROWS|EST.TIME(us)|
--------------------------------------------------
|0 |SORT              |    |1       |3           |
|1 |└─TABLE RANGE SCAN|t1  |1       |3           |
==================================================
Outputs & filters:
-------------------------------------
  0 - output([t1.c1], [t1.c2], [t1.c3]), filter(nil), rowset=16
      sort_keys([t1.c3, ASC])
  1 - output([t1.c1], [t1.c2], [t1.c3]), filter([t1.c3 > 1]), rowset=16
      access([t1.c1], [t1.c2], [t1.c3]), partitions(p0)
      is_index_back=false, is_global_index=false, filter_before_indexback[false], 
      range_key([t1.c1], [t1.c2]), range(99999999,MIN ; 99999999,MAX), 
      range_cond([t1.c1 = 99999999])
CREATE TABLE t2 (
c1 int NOT NULL,
c2 int NOT NULL,
c3 int NOT NULL,
KEY (c1,c2),
KEY (c3)
);
explain  SELECT * FROM t2 WHERE c1 = 99999999 AND c3 > 1 ORDER BY c3;
Query Plan
====================================================
|ID|OPERATOR          |NAME  |EST.ROWS|EST.TIME(us)|
----------------------------------------------------
|0 |SORT              |      |1       |7           |
|1 |└─TABLE RANGE SCAN|t2(c1)|1       |7           |
====================================================
Outputs & filters:
-------------------------------------
  0 - output([t2.c1], [t2.c2], [t2.c3]), filter(nil), rowset=16
      sort_keys([t2.c3, ASC])
  1 - output([t2.c1], [t2.c3], [t2.c2]), filter([t2.c3 > 1]), rowset=16
      access([t2.__pk_increment], [t2.c1], [t2.c3], [t2.c2]), partitions(p0)
      is_index_back=true, is_global_index=false, filter_before_indexback[false], 
      range_key([t2.c1], [t2.c2], [t2.__pk_increment]), range(99999999,MIN,MIN ; 99999999,MAX,MAX), 
      range_cond([t2.c1 = 99999999])
DROP TABLE t1,t2;
#
# 36259: Optimizing with ORDER BY
#
CREATE TABLE t1 (
a INT NOT NULL AUTO_INCREMENT,
b INT NOT NULL,
c INT NOT NULL,
d VARCHAR(5),
e INT NOT NULL,
PRIMARY KEY (a), KEY i2 (b,c,d)
);
INSERT INTO t1 (b,c,d,e) VALUES (1,1,'a',1), (2,2,'b',2);
EXPLAIN  SELECT * FROM t1 WHERE b=1 AND c=1 ORDER BY a;
Query Plan
====================================================
|ID|OPERATOR          |NAME  |EST.ROWS|EST.TIME(us)|
----------------------------------------------------
|0 |SORT              |      |1       |8           |
|1 |└─TABLE RANGE SCAN|t1(i2)|1       |7           |
====================================================
Outputs & filters:
-------------------------------------
  0 - output([t1.a], [t1.b], [t1.c], [t1.d], [t1.e]), filter(nil), rowset=16
      sort_keys([t1.a, ASC])
  1 - output([t1.a], [t1.b], [t1.c], [t1.d], [t1.e]), filter(nil), rowset=16
      access([t1.a], [t1.b], [t1.c], [t1.d], [t1.e]), partitions(p0)
      is_index_back=true, is_global_index=false, 
      range_key([t1.b], [t1.c], [t1.d], [t1.a]), range(1,1,MIN,MIN ; 1,1,MAX,MAX), 
      range_cond([t1.b = 1], [t1.c = 1])
EXPLAIN  SELECT * FROM t1 FORCE INDEX(i2) WHERE b=1 and c=1 ORDER BY a;
Query Plan
====================================================
|ID|OPERATOR          |NAME  |EST.ROWS|EST.TIME(us)|
----------------------------------------------------
|0 |SORT              |      |1       |8           |
|1 |└─TABLE RANGE SCAN|t1(i2)|1       |7           |
====================================================
Outputs & filters:
-------------------------------------
  0 - output([t1.a], [t1.b], [t1.c], [t1.d], [t1.e]), filter(nil), rowset=16
      sort_keys([t1.a, ASC])
  1 - output([t1.a], [t1.b], [t1.c], [t1.d], [t1.e]), filter(nil), rowset=16
      access([t1.a], [t1.b], [t1.c], [t1.d], [t1.e]), partitions(p0)
      is_index_back=true, is_global_index=false, 
      range_key([t1.b], [t1.c], [t1.d], [t1.a]), range(1,1,MIN,MIN ; 1,1,MAX,MAX), 
      range_cond([t1.b = 1], [t1.c = 1])
EXPLAIN  SELECT * FROM t1 FORCE INDEX(PRIMARY) WHERE b=1 AND c=1 ORDER BY a;
Query Plan
===============================================
|ID|OPERATOR       |NAME|EST.ROWS|EST.TIME(us)|
-----------------------------------------------
|0 |TABLE FULL SCAN|t1  |1       |3           |
===============================================
Outputs & filters:
-------------------------------------
  0 - output([t1.a], [t1.b], [t1.c], [t1.d], [t1.e]), filter([t1.b = 1], [t1.c = 1]), rowset=16
      access([t1.a], [t1.b], [t1.c], [t1.d], [t1.e]), partitions(p0)
      is_index_back=false, is_global_index=false, filter_before_indexback[false,false], 
      range_key([t1.a]), range(MIN ; MAX)always true
DROP TABLE t1;
#
# Bug #47963: Wrong results when index is used
#
CREATE TABLE t1(
a VARCHAR(5) NOT NULL, 
b VARCHAR(5) NOT NULL,
c DATETIME NOT NULL,
KEY (c) 
);
INSERT INTO t1 VALUES('TEST', 'TEST', '2009-10-09 00:00:00');
SELECT * FROM t1 WHERE a = 'TEST' AND 
c >= '2009-10-09 00:00:00' AND c <= '2009-10-09 00:00:00';
a	b	c
TEST	TEST	2009-10-09 00:00:00
SELECT * FROM t1 WHERE a = 'TEST' AND 
c >= '2009-10-09 00:00:00.0' AND c <= '2009-10-09 00:00:00.0';
a	b	c
TEST	TEST	2009-10-09 00:00:00
SELECT * FROM t1 WHERE a = 'TEST' AND 
c >= '2009-10-09 00:00:00.0' AND c <= '2009-10-09 00:00:00';
a	b	c
TEST	TEST	2009-10-09 00:00:00
SELECT * FROM t1 WHERE a = 'TEST' AND 
c >= '2009-10-09 00:00:00' AND c <= '2009-10-09 00:00:00.0';
a	b	c
TEST	TEST	2009-10-09 00:00:00
SELECT * FROM t1 WHERE a = 'TEST' AND 
c >= '2009-10-09 00:00:00.000' AND c <= '2009-10-09 00:00:00.000';
a	b	c
TEST	TEST	2009-10-09 00:00:00
SELECT * FROM t1 WHERE a = 'TEST' AND 
c >= '2009-10-09 00:00:00.00' AND c <= '2009-10-09 00:00:00.001';
a	b	c
TEST	TEST	2009-10-09 00:00:00
SELECT * FROM t1 WHERE a = 'TEST' AND 
c >= '2009-10-09 00:00:00.001' AND c <= '2009-10-09 00:00:00.00';
a	b	c
EXPLAIN  SELECT * FROM t1 WHERE a = 'TEST' AND 
c >= '2009-10-09 00:00:00.001' AND c <= '2009-10-09 00:00:00.00';
Query Plan
===============================================
|ID|OPERATOR       |NAME|EST.ROWS|EST.TIME(us)|
-----------------------------------------------
|0 |TABLE FULL SCAN|t1  |0       |3           |
===============================================
Outputs & filters:
-------------------------------------
  0 - output([t1.a], [t1.b], [t1.c]), filter([t1.c >= cast('2009-10-09 00:00:00.001', MYSQL_DATETIME(-1, -1))], [t1.c <= cast('2009-10-09 00:00:00.00', 
      MYSQL_DATETIME(-1, -1))], [t1.a = 'TEST']), rowset=16
      access([t1.a], [t1.c], [t1.b]), partitions(p0)
      is_index_back=false, is_global_index=false, filter_before_indexback[false,false,false], 
      range_key([t1.__pk_increment]), range(MIN ; MAX)always true
DROP TABLE t1;
#
# Bug #46175: NULL read_view and consistent read assertion
#
CREATE TABLE t1(a CHAR(13),KEY(a));
CREATE TABLE t2(b DATETIME,KEY(b));
INSERT INTO t1 VALUES (),();
INSERT INTO t2 VALUES (),();
CREATE OR REPLACE VIEW v1 AS SELECT 1 FROM t2 
WHERE b =(SELECT a FROM t1 LIMIT 1);
# Should not crash
# Should not crash
#
# Bug #49324: more valgrind errors in test_if_skip_sort_order
#
CREATE TABLE t1 (a INT PRIMARY KEY) ;
# should not cause valgrind warnings
SELECT 1 FROM t1 JOIN t1 a USING(a) GROUP BY t1.a,t1.a;
1
DROP TABLE t1;
#
# Bug#50843: Filesort used instead of clustered index led to
#            performance degradation.
#
create table t1(f1 int not null primary key, f2 int) ;
create table t2(f1 int not null, key (f1)) ;
insert into t1 values (1,1),(2,2),(3,3);
insert into t2 values (1),(2),(3);
explain  select t1.* from t1 left join t2 using(f1) group by t1.f1;
Query Plan
===============================================
|ID|OPERATOR       |NAME|EST.ROWS|EST.TIME(us)|
-----------------------------------------------
|0 |TABLE FULL SCAN|t1  |3       |3           |
===============================================
Outputs & filters:
-------------------------------------
  0 - output([t1.f1], [t1.f2]), filter(nil), rowset=16
      access([t1.f1], [t1.f2]), partitions(p0)
      is_index_back=false, is_global_index=false, 
      range_key([t1.f1]), range(MIN ; MAX)always true
drop table t1,t2;
#
#
# Bug #39653: find_shortest_key in sql_select.cc does not consider
#             clustered primary keys
#
CREATE TABLE t1 (a INT PRIMARY KEY, b INT, c INT, d INT, e INT, f INT,
KEY (b,c));
INSERT INTO t1 VALUES (1,1,1,1,1,1), (2,2,2,2,2,2), (3,3,3,3,3,3),
(4,4,4,4,4,4), (5,5,5,5,5,5), (6,6,6,6,6,6),
(7,7,7,7,7,7), (8,8,8,8,8,8), (9,9,9,9,9,9),
(11,11,11,11,11,11);
EXPLAIN  SELECT COUNT(*) FROM t1;
Query Plan	==================================================
Query Plan	|ID|OPERATOR         |NAME |EST.ROWS|EST.TIME(us)|
Query Plan	--------------------------------------------------
Query Plan	|0 |SCALAR GROUP BY  |     |1       |3           |
Query Plan	|1 |└─TABLE FULL SCAN|t1(b)|10      |3           |
Query Plan	==================================================
Query Plan	Outputs & filters:
Query Plan	-------------------------------------
Query Plan	  0 - output([T_FUN_COUNT_SUM(T_FUN_COUNT(*))]), filter(nil), rowset=16
Query Plan	      group(nil), agg_func([T_FUN_COUNT_SUM(T_FUN_COUNT(*))])
Query Plan	  1 - output([T_FUN_COUNT(*)]), filter(nil), rowset=16
Query Plan	      access(nil), partitions(p0)
Query Plan	      is_index_back=false, is_global_index=false, 
Query Plan	      range_key([t1.b], [t1.c], [t1.a]), range(MIN,MIN,MIN ; MAX,MAX,MAX)always true, 
Query Plan	      pushdown_aggregation([T_FUN_COUNT(*)])
DROP TABLE t1;
#
# Bug #49838: DROP INDEX and ADD UNIQUE INDEX for same index may
#   corrupt definition at engine
#
CREATE TABLE t1 (a INT NOT NULL, b INT NOT NULL, KEY k (a,b)) 
;
ALTER TABLE t1 DROP INDEX k;
alter table t1 ADD UNIQUE INDEX k (a,b);
SHOW INDEXES FROM t1;;
Table	t1
Non_unique	0
Key_name	k
Seq_in_index	1
Column_name	a
Collation	A
Cardinality	NULL
Sub_part	NULL
Packed	NULL
Null	
Index_type	BTREE
Comment	available
Index_comment	
Visible	YES
Expression	NULL
Table	t1
Non_unique	0
Key_name	k
Seq_in_index	2
Column_name	b
Collation	A
Cardinality	NULL
Sub_part	NULL
Packed	NULL
Null	
Index_type	BTREE
Comment	available
Index_comment	
Visible	YES
Expression	NULL
DROP TABLE t1;
#
# Bug #53334: wrong result for outer join with impossible ON condition
# (see the same test case for MyISAM in join.test)
#
CREATE TABLE t1 (id INT PRIMARY KEY);
CREATE TABLE t2 (id INT);
INSERT INTO t1 VALUES (75);
INSERT INTO t1 VALUES (79);
INSERT INTO t1 VALUES (78);
INSERT INTO t1 VALUES (77);
REPLACE INTO t1 VALUES (76);
REPLACE INTO t1 VALUES (76);
INSERT INTO t1 VALUES (104);
INSERT INTO t1 VALUES (103);
INSERT INTO t1 VALUES (102);
INSERT INTO t1 VALUES (101);
INSERT INTO t1 VALUES (105);
INSERT INTO t1 VALUES (106);
INSERT INTO t1 VALUES (107);
INSERT INTO t2 VALUES (107),(75),(1000);
SELECT t1.id,t2.id FROM t2 LEFT JOIN t1 ON t1.id>=74 AND t1.id<=0
WHERE t2.id=75 AND t1.id IS NULL;
id	id
NULL	75
EXPLAIN  SELECT t1.id,t2.id FROM t2 LEFT JOIN t1 ON t1.id>=74 AND t1.id<=0
WHERE t2.id=75 AND t1.id IS NULL;
Query Plan
=================================================================
|ID|OPERATOR                        |NAME |EST.ROWS|EST.TIME(us)|
-----------------------------------------------------------------
|0 |NESTED-LOOP ANTI JOIN CARTESIAN |     |1       |5           |
|1 |├─TABLE FULL SCAN               |t2   |1       |3           |
|2 |└─MATERIAL                      |     |0       |3           |
|3 |  └─SUBPLAN SCAN                |VIEW1|0       |3           |
|4 |    └─TABLE RANGE SCAN          |t1   |0       |3           |
=================================================================
Outputs & filters:
-------------------------------------
  0 - output([cast(NULL, INT(11, 0))], [t2.id]), filter(nil), rowset=16
      conds(nil), nl_params_(nil), use_batch=false
  1 - output([t2.id]), filter([t2.id = 75]), rowset=16
      access([t2.id]), partitions(p0)
      is_index_back=false, is_global_index=false, filter_before_indexback[false], 
      range_key([t2.__pk_increment]), range(MIN ; MAX)always true
  2 - output(nil), filter(nil), rowset=16
  3 - output(nil), filter(nil), rowset=16
      access(nil)
  4 - output([1]), filter(nil), rowset=16
      access(nil), partitions(p0)
      limit(1), offset(nil), is_index_back=false, is_global_index=false, 
      range_key([t1.id]), range(MAX ; MIN)always false, 
      range_cond([t1.id >= 74], [t1.id <= 0])
DROP TABLE t1,t2;
#
# Bug#38999 valgrind warnings for update statement in function compare_record()
#
CREATE TABLE t1 (a INT PRIMARY KEY);
CREATE TABLE t2 (a INT PRIMARY KEY);
INSERT INTO t1 values (1),(2),(3),(4),(5);
INSERT INTO t2 values (1);
SELECT * FROM t1 WHERE a = 2;
a
2
DROP TABLE t1,t2;
#
# Bug #53830: !table || (!table->read_set || bitmap_is_set(table->read_set, field_index))
#
CREATE TABLE t1 (a INT, b INT, c INT, d INT,
PRIMARY KEY(a,b,c), KEY(b,d))
;
INSERT INTO t1 VALUES (0, 77, 1, 3);
UPDATE t1 SET d = 0 WHERE b = 77 AND c = 25;
DROP TABLE t1;
#
# Bug#50389 Using intersect does not return all rows
#
CREATE TABLE t1 (
f1 INT(10) NOT NULL,
f2 INT(10),
f3 INT(10),
f4 TINYINT(4),
f5 VARCHAR(50),
PRIMARY KEY (f1),
KEY idx1 (f2,f5,f4),
KEY idx2 (f2,f4)
);
SELECT * FROM t1 WHERE f1 IN
(3305028,3353871,3772880,3346860,4228206,3336022,
3470988,3305175,3329875,3817277,3856380,3796193,
3784744,4180925,4559596,3963734,3856391,4494153)
AND f5 = 'abcdefghijklmnopwrst' AND f2 = 1221457 AND f4 = 0 ;
f1	f2	f3	f4	f5
EXPLAIN  SELECT * FROM t1 WHERE f1 IN
(3305028,3353871,3772880,3346860,4228206,3336022,
3470988,3305175,3329875,3817277,3856380,3796193,
3784744,4180925,4559596,3963734,3856391,4494153)
AND f5 = 'abcdefghijklmnopwrst' AND f2 = 1221457 AND f4 = 0 ;
Query Plan
=========================================
|ID|OPERATOR |NAME|EST.ROWS|EST.TIME(us)|
-----------------------------------------
|0 |TABLE GET|t1  |18      |94          |
=========================================
Outputs & filters:
-------------------------------------
  0 - output([t1.f1], [t1.f2], [t1.f3], [t1.f4], [t1.f5]), filter([t1.f5 = 'abcdefghijklmnopwrst'], [t1.f2 = 1221457], [t1.f4 = 0]), rowset=256
      access([t1.f1], [t1.f5], [t1.f2], [t1.f4], [t1.f3]), partitions(p0)
      is_index_back=false, is_global_index=false, filter_before_indexback[false,false,false], 
      range_key([t1.f1]), range[3305028 ; 3305028], [3353871 ; 3353871], [3772880 ; 3772880], [3346860 ; 3346860], [4228206 ; 4228206], [3336022 ; 3336022],
       [3470988 ; 3470988], [3305175 ; 3305175], [3329875 ; 3329875], [3817277 ; 3817277], [3856380 ; 3856380], [3796193 ; 3796193], [3784744 ; 3784744], [4180925 
      ; 4180925], [4559596 ; 4559596], [3963734 ; 3963734], [3856391 ; 3856391], [4494153 ; 4494153], 
      range_cond([t1.f1 IN (3305028, 3353871, 3772880, 3346860, 4228206, 3336022, 3470988, 3305175, 3329875, 3817277, 3856380, 3796193, 3784744, 4180925,
       4559596, 3963734, 3856391, 4494153)])
DROP TABLE t1;
#
# Bug#51431 Wrong sort order after import of dump file
#
CREATE TABLE t1 (
f1 INT(11) NOT NULL,
f2 int(11) NOT NULL,
f3 int(11) NOT NULL,
f4 tinyint(1) NOT NULL,
PRIMARY KEY (f1),
UNIQUE KEY (f2, f3),
KEY (f4)
);
INSERT INTO t1 VALUES
(1,1,991,1), (2,1,992,1), (3,1,993,1), (4,1,994,1), (5,1,995,1),
(6,1,996,1), (7,1,997,1), (8,1,998,1), (10,1,999,1), (11,1,9910,1),
(16,1,9911,1), (17,1,9912,1), (18,1,9913,1), (19,1,9914,1), (20,1,9915,1),
(21,1,9916,1), (22,1,9917,1), (23,1,9918,1), (24,1,9919,1), (25,1,9920,1),
(26,1,9921,1), (27,1,9922,1);
SELECT * FROM t1 WHERE f2 = 1 AND f4 = TRUE
ORDER BY f1 DESC LIMIT 5;
f1	f2	f3	f4
27	1	9922	1
26	1	9921	1
25	1	9920	1
24	1	9919	1
23	1	9918	1
EXPLAIN  SELECT * FROM t1 WHERE f2 = 1 AND f4 = TRUE
ORDER BY f1 DESC LIMIT 5;
Query Plan
==========================================================
|ID|OPERATOR        |NAME          |EST.ROWS|EST.TIME(us)|
----------------------------------------------------------
|0 |TABLE RANGE SCAN|t1(f4,Reverse)|5       |60          |
==========================================================
Outputs & filters:
-------------------------------------
  0 - output([t1.f1], [t1.f2], [t1.f3], [t1.f4]), filter([t1.f2 = 1]), rowset=16
      access([t1.f1], [t1.f2], [t1.f4], [t1.f3]), partitions(p0)
      limit(5), offset(nil), is_index_back=true, is_global_index=false, filter_before_indexback[false], 
      range_key([t1.f4], [t1.f1]), range(1,MIN ; 1,MAX), 
      range_cond([t1.f4 = 1])
DROP TABLE t1;
#
# Bug#55656: mysqldump can be slower after bug #39653 fix
#
CREATE TABLE t1 (a INT , b INT, c INT, d INT,
KEY (b), PRIMARY KEY (a,b));
INSERT INTO t1 VALUES (1,1,1,1), (2,2,2,2), (3,3,3,3);
EXPLAIN  SELECT COUNT(*) FROM t1;
Query Plan	==================================================
Query Plan	|ID|OPERATOR         |NAME |EST.ROWS|EST.TIME(us)|
Query Plan	--------------------------------------------------
Query Plan	|0 |SCALAR GROUP BY  |     |1       |3           |
Query Plan	|1 |└─TABLE FULL SCAN|t1(b)|3       |3           |
Query Plan	==================================================
Query Plan	Outputs & filters:
Query Plan	-------------------------------------
Query Plan	  0 - output([T_FUN_COUNT_SUM(T_FUN_COUNT(*))]), filter(nil), rowset=16
Query Plan	      group(nil), agg_func([T_FUN_COUNT_SUM(T_FUN_COUNT(*))])
Query Plan	  1 - output([T_FUN_COUNT(*)]), filter(nil), rowset=16
Query Plan	      access(nil), partitions(p0)
Query Plan	      is_index_back=false, is_global_index=false, 
Query Plan	      range_key([t1.b], [t1.a]), range(MIN,MIN ; MAX,MAX)always true, 
Query Plan	      pushdown_aggregation([T_FUN_COUNT(*)])
DROP INDEX b ON t1;
CREATE INDEX b ON t1(a,b);
EXPLAIN  SELECT COUNT(*) FROM t1;
Query Plan	==================================================
Query Plan	|ID|OPERATOR         |NAME |EST.ROWS|EST.TIME(us)|
Query Plan	--------------------------------------------------
Query Plan	|0 |SCALAR GROUP BY  |     |1       |3           |
Query Plan	|1 |└─TABLE FULL SCAN|t1(b)|3       |3           |
Query Plan	==================================================
Query Plan	Outputs & filters:
Query Plan	-------------------------------------
Query Plan	  0 - output([T_FUN_COUNT_SUM(T_FUN_COUNT(*))]), filter(nil), rowset=16
Query Plan	      group(nil), agg_func([T_FUN_COUNT_SUM(T_FUN_COUNT(*))])
Query Plan	  1 - output([T_FUN_COUNT(*)]), filter(nil), rowset=16
Query Plan	      access(nil), partitions(p0)
Query Plan	      is_index_back=false, is_global_index=false, 
Query Plan	      range_key([t1.a], [t1.b]), range(MIN,MIN ; MAX,MAX)always true, 
Query Plan	      pushdown_aggregation([T_FUN_COUNT(*)])
DROP INDEX b ON t1;
CREATE INDEX b ON t1(a,b,c);
EXPLAIN  SELECT COUNT(*) FROM t1;
Query Plan	==================================================
Query Plan	|ID|OPERATOR         |NAME |EST.ROWS|EST.TIME(us)|
Query Plan	--------------------------------------------------
Query Plan	|0 |SCALAR GROUP BY  |     |1       |3           |
Query Plan	|1 |└─TABLE FULL SCAN|t1(b)|3       |3           |
Query Plan	==================================================
Query Plan	Outputs & filters:
Query Plan	-------------------------------------
Query Plan	  0 - output([T_FUN_COUNT_SUM(T_FUN_COUNT(*))]), filter(nil), rowset=16
Query Plan	      group(nil), agg_func([T_FUN_COUNT_SUM(T_FUN_COUNT(*))])
Query Plan	  1 - output([T_FUN_COUNT(*)]), filter(nil), rowset=16
Query Plan	      access(nil), partitions(p0)
Query Plan	      is_index_back=false, is_global_index=false, 
Query Plan	      range_key([t1.a], [t1.b], [t1.c]), range(MIN,MIN,MIN ; MAX,MAX,MAX)always true, 
Query Plan	      pushdown_aggregation([T_FUN_COUNT(*)])
DROP INDEX b ON t1;
CREATE INDEX b ON t1(a,b,c,d);
EXPLAIN  SELECT COUNT(*) FROM t1;
Query Plan	=================================================
Query Plan	|ID|OPERATOR         |NAME|EST.ROWS|EST.TIME(us)|
Query Plan	-------------------------------------------------
Query Plan	|0 |SCALAR GROUP BY  |    |1       |3           |
Query Plan	|1 |└─TABLE FULL SCAN|t1  |3       |3           |
Query Plan	=================================================
Query Plan	Outputs & filters:
Query Plan	-------------------------------------
Query Plan	  0 - output([T_FUN_COUNT_SUM(T_FUN_COUNT(*))]), filter(nil), rowset=16
Query Plan	      group(nil), agg_func([T_FUN_COUNT_SUM(T_FUN_COUNT(*))])
Query Plan	  1 - output([T_FUN_COUNT(*)]), filter(nil), rowset=16
Query Plan	      access(nil), partitions(p0)
Query Plan	      is_index_back=false, is_global_index=false, 
Query Plan	      range_key([t1.a], [t1.b]), range(MIN,MIN ; MAX,MAX)always true, 
Query Plan	      pushdown_aggregation([T_FUN_COUNT(*)])
DROP TABLE t1;
#
# Bug#55826: create table .. select crashes with when KILL_BAD_DATA 
#  is returned
#
#
# Bug#56862 Moved to innodb_16k.test
#
#
# Test for bug #39932 "create table fails if column for FK is in different
#                      case than in corr index".
#
drop tables if exists t1, t2;
create table t1 (pk int primary key);
create table t2 (fk int, key x (fk));
show create table t2;
Table	Create Table
t2	CREATE TABLE `t2` (
  `fk` int(11) DEFAULT NULL,
  KEY `x` (`fk`) BLOCK_SIZE 16384 LOCAL
) ORGANIZATION INDEX DEFAULT CHARSET = utf8mb4 COMPRESSION = 'lz4_1.0' REPLICA_NUM = NUM BLOCK_SIZE = SIZE USE_BLOOM_FILTER = FALSE ENABLE_MACRO_BLOCK_BLOOM_FILTER = FALSE TABLET_SIZE = SIZE PCTFREE = 10
drop table t2, t1;
#
# Bug#49604 "6.0 processing compound WHERE clause incorrectly 
#            with Innodb - extra rows"
#
CREATE TABLE t1 (
c1 INT NOT NULL,
c2 INT,
PRIMARY KEY (c1),
KEY k1 (c2)
);
INSERT INTO t1 VALUES (12,1);
INSERT INTO t1 VALUES (15,1);
INSERT INTO t1 VALUES (16,1);
INSERT INTO t1 VALUES (22,1);
INSERT INTO t1 VALUES (20,2);
CREATE TABLE t2 (
c1 INT NOT NULL,
c2 INT,
PRIMARY KEY (c1)
);
INSERT INTO t2 VALUES (1,2);
INSERT INTO t2 VALUES (2,9);
SELECT  t2.c2, t1.c2, t2.c1
FROM t1 JOIN t2 ON t1.c2 = t2.c1  
WHERE t2.c1 IN (2, 1, 6) OR t2.c1 NOT IN (1);
c2	c2	c1
2	1	1
2	1	1
2	1	1
2	1	1
9	2	2
DROP TABLE t1, t2;
#
# Bug#44613 SELECT statement inside FUNCTION takes a shared lock
#
DROP TABLE IF EXISTS t1;
CREATE TABLE t1(x INT PRIMARY KEY, y INT);
INSERT INTO t1 VALUES (1, 0), (2, 0);
# Connection default
START TRANSACTION;
# Connection con2
START TRANSACTION;
UPDATE t1 SET y = 1 WHERE x = 1;
COMMIT;
# Connection default
COMMIT;
DROP TABLE t1;
#
# Bug#42744: Crash when using a join buffer to join a table with a blob
# column and an additional column used for duplicate elimination.
#
CREATE TABLE t1 (a varbinary(16));
CREATE TABLE t2 (a int PRIMARY KEY,  b varbinary(16));
INSERT INTO t1 VALUES ('1'), (NULL);
INSERT INTO t2 VALUES (1, '1');
EXPLAIN 
SELECT t2.b FROM t1,t2 WHERE t1.a IN (SELECT 1 FROM t2);
Query Plan
================================================================
|ID|OPERATOR                       |NAME |EST.ROWS|EST.TIME(us)|
----------------------------------------------------------------
|0 |NESTED-LOOP JOIN CARTESIAN     |     |1       |7           |
|1 |├─TABLE FULL SCAN              |t2   |1       |3           |
|2 |└─MATERIAL                     |     |1       |5           |
|3 |  └─NESTED-LOOP JOIN CARTESIAN |     |1       |5           |
|4 |    ├─TABLE FULL SCAN          |t1   |1       |3           |
|5 |    └─MATERIAL                 |     |1       |3           |
|6 |      └─SUBPLAN SCAN           |VIEW1|1       |3           |
|7 |        └─TABLE FULL SCAN      |t2   |1       |3           |
================================================================
Outputs & filters:
-------------------------------------
  0 - output([t2.b]), filter(nil), rowset=16
      conds(nil), nl_params_(nil), use_batch=false
  1 - output([t2.b]), filter(nil), rowset=16
      access([t2.b]), partitions(p0)
      is_index_back=false, is_global_index=false, 
      range_key([t2.a]), range(MIN ; MAX)always true
  2 - output(nil), filter(nil), rowset=16
  3 - output(nil), filter(nil), rowset=16
      conds(nil), nl_params_(nil), use_batch=false
  4 - output(nil), filter([cast(t1.a, DECIMAL(-1, -1)) = cast(1, DECIMAL(20, 0))]), rowset=16
      access([t1.a]), partitions(p0)
      is_index_back=false, is_global_index=false, filter_before_indexback[false], 
      range_key([t1.__pk_increment]), range(MIN ; MAX)always true
  5 - output(nil), filter(nil), rowset=16
  6 - output(nil), filter(nil), rowset=16
      access(nil)
  7 - output([1]), filter(nil), rowset=16
      access(nil), partitions(p0)
      limit(1), offset(nil), is_index_back=false, is_global_index=false, 
      range_key([t2.a]), range(MIN ; MAX)always true
SELECT t2.b FROM t1,t2 WHERE t1.a IN (SELECT 1 FROM t2);
b
1
DROP TABLE t1,t2;
#
# Bug#48093: 6.0 Server not processing equivalent IN clauses properly 
#            with Innodb tables
#
CREATE TABLE t1 (
i int(11) DEFAULT NULL,
v1 varchar(1) DEFAULT NULL,
v2 varchar(20) DEFAULT NULL,
KEY i (i),
KEY v (v1,i)
);
INSERT INTO t1 VALUES (1,'f','no');
INSERT INTO t1 VALUES (2,'u','yes-u');
INSERT INTO t1 VALUES (2,'h','yes-h');
INSERT INTO t1 VALUES (3,'d','no');

SELECT v2  
FROM t1
WHERE v1  IN  ('f', 'd', 'h', 'u' ) AND i  =  2;
v2
yes-h
yes-u

# Should not use index_merge
EXPLAIN 
SELECT v2  
FROM t1
WHERE v1  IN  ('f', 'd', 'h', 'u' ) AND i  =  2;
Query Plan
=================================================
|ID|OPERATOR        |NAME |EST.ROWS|EST.TIME(us)|
-------------------------------------------------
|0 |TABLE RANGE SCAN|t1(v)|2       |22          |
=================================================
Outputs & filters:
-------------------------------------
  0 - output([t1.v2]), filter(nil), rowset=16
      access([t1.__pk_increment], [t1.v2]), partitions(p0)
      is_index_back=true, is_global_index=false, 
      range_key([t1.v1], [t1.i], [t1.__pk_increment]), range(f,2,MIN ; f,2,MAX), (d,2,MIN ; d,2,MAX), (h,2,MIN ; h,2,MAX), (u,2,MIN ; u,2,MAX), 
      range_cond([t1.v1 IN ('f', 'd', 'h', 'u')], [t1.i = 2])
DROP TABLE t1;
#
# Bug#54606 innodb fast alter table + pack_keys=0 
#           prevents adding new indexes
#
DROP TABLE IF EXISTS t1;
CREATE TABLE t1 (a INT, b CHAR(9), c INT, key(b));
CREATE INDEX a ON t1 (a);
CREATE INDEX c on t1 (c);
DROP TABLE t1;
#
# Bug#11762345 54927: DROPPING AND ADDING AN INDEX IN ONE
#              COMMAND CAN FAIL IN INNODB PLUGIN 1.0
#
DROP TABLE IF EXISTS t1;
CREATE TABLE t1 (id int, a  int, b  int, PRIMARY KEY (id),
INDEX a (a));
ALTER TABLE t1 DROP INDEX a;
alter table t1 ADD INDEX a (b, a);
ALTER TABLE t1 DROP INDEX a;
alter table t1 ADD INDEX (a, b);
DROP TABLE t1;
End of 6.0 tests
