drop database  IF EXISTS  zrytest;
create database zrytest  character set utf8;
use zrytest;
create table z1case(z1_test0 char(100),z1_test1 varchar(100),z1_test2 BLOB,z1_test3 TEXT,z1_test4 date,z1_test5 DECIMAL);
insert into z1case values('中文字符','中文字符','中文字符','中文字符','2020-10-10','123456');
insert into z1case values('123456','123456','123456','123456','2020-10-10','123456.00000');
insert into z1case values('ABCabc','ABCabc','ABCabc','ABCabc','2020-10-10','123456.00000001');
Warnings:
Warning	1265	Data truncated for column 'z1_test5' at row 1
insert into z1case values('2020-10-10 10:10:10','2020-10-10 10:10:10','2020-10-10 10:10:10','2020-10-10 10:10:10','2020-10-10','123456');
insert into z1case values('','','','','2020-10-10','000123456');
insert into z1case values(null,null,null,null,null,null);
create table z2case(z2_test0 set('中文 字符','654321','ABCDabcd ','!@#$%^&*','2020-10-10','2020-10-10 10:10:10','10:10:10'));
insert into z2case values('中文 字符');
insert into z2case values('654321');
insert into z2case values('ABCDabcd');
insert into z2case values('!@#$%^&*');
insert into z2case values('2020-10-10');
insert into z2case values('2020-10-10 10:10:10');
insert into z2case values('10:10:10');
insert into z2case values('');
insert into z2case values(null);
约束 not null
create table z0case(z0_test0 set('中文字符','123456','ABCabc','!@#$%^&*','2020-10-10','2020-10-10 10:10:10','10:10:10') not NULL);
insert
insert into z0case values('中文字符');
insert into z0case values('123456');
insert into z0case values('ABCabc');
insert into z0case values('!@#$%^&*');
insert into z0case values('2020-10-10');
insert into z0case values('2020-10-10 10:10:10');
insert into z0case values('10:10:10');
insert into z0case values('');
insert into z0case values(null);
ERROR 23000: Column 'z0_test0' cannot be null
insert into z0case values(' ');
ERROR 01000: Data truncated for column 'z0_test0' at row 1
insert into z0case values('中文字符  ');
insert into z0case values(123456);
ERROR 01000: Data truncated for column 'z0_test0' at row 1
insert into z0case values('abcabc');
insert into z0case values(nullif('中文字符','中文字符'));
ERROR 23000: Column 'z0_test0' cannot be null
insert into z0case select z2_test0 from z2case where z2_test0 is null;
ERROR 23000: Column 'z0_test0' cannot be null
select upper(z0_test0) from z0case;
upper(z0_test0)
中文字符
123456
ABCABC
!@#$%^&*
2020-10-10
2020-10-10 10:10:10
10:10:10

中文字符
ABCABC
select lower(z0_test0) from z0case;
lower(z0_test0)
中文字符
123456
abcabc
!@#$%^&*
2020-10-10
2020-10-10 10:10:10
10:10:10

中文字符
abcabc
select length(z0_test0) from z0case;
length(z0_test0)
12
6
6
8
10
19
8
0
12
6
select * from z0case group by z0_test0 having length(z0_test0)>6 ;
z0_test0
中文字符
!@#$%^&*
2020-10-10
2020-10-10 10:10:10
10:10:10
select SUBSTRING(z0_test0,2,5) from z0case;
SUBSTRING(z0_test0,2,5)
文字符
23456
BCabc
@#$%^
020-1
020-1
0:10:

文字符
BCabc
select COUNT(z0_test0) from z0case;
COUNT(z0_test0)
10
select min(z0_test0) from z0case;
min(z0_test0)

select MAX(z0_test0) from z0case;
MAX(z0_test0)
中文字符
select INSERT(z0_test0,1,2,'A') from z0case;
INSERT(z0_test0,1,2,'A')
A字符
A3456
ACabc
A#$%^&*
A20-10-10
A20-10-10 10:10:10
A:10:10

A字符
ACabc
select LEFT(z0_test0,3)from z0case;
LEFT(z0_test0,3)
中文字
123
ABC
!@#
202
202
10:

中文字
ABC
select nvl(z0_test0,NULL) from z0case;
nvl(z0_test0,NULL)
中文字符
123456
ABCabc
!@#$%^&*
2020-10-10
2020-10-10 10:10:10
10:10:10

中文字符
ABCabc
select nullif(z0_test0,'中文字符') from z0case;
nullif(z0_test0,'中文字符')
NULL
123456
ABCabc
!@#$%^&*
2020-10-10
2020-10-10 10:10:10
10:10:10

NULL
ABCabc
select nullif(z0_test0,123456) from z0case;
nullif(z0_test0,123456)
中文字符
123456
ABCabc
!@#$%^&*
2020-10-10
2020-10-10 10:10:10
10:10:10

中文字符
ABCabc
select STRCMP(z0_test0,z1_test0) from z0case,z1case where z0_test0=z1_test0;
STRCMP(z0_test0,z1_test0)
0
0
0
0
0
0
0
select STRCMP(z0_test0,z1_test1) from z0case,z1case where z0_test0=z1_test0;
STRCMP(z0_test0,z1_test1)
0
0
0
0
0
0
0
select STRCMP(z0_test0,z1_test2) from z0case,z1case where z0_test0=z1_test0;
STRCMP(z0_test0,z1_test2)
0
0
0
0
0
0
0
select STRCMP(z0_test0,z1_test3) from z0case,z1case where z0_test0=z1_test0;
STRCMP(z0_test0,z1_test3)
0
0
0
0
0
0
0
select STRCMP(z0_test0,z1_test4) from z0case,z1case where z0_test0=z1_test0;
STRCMP(z0_test0,z1_test4)
1
-1
1
1
-1
1
1
select STRCMP(z0_test0,z1_test5) from z0case,z1case where z0_test0=z1_test0;
STRCMP(z0_test0,z1_test5)
1
0
1
1
-1
1
1
select CONCAT(z0_test0,z1_test0) from z0case,z1case;
CONCAT(z0_test0,z1_test0)
中文字符中文字符
中文字符123456
中文字符ABCabc
中文字符2020-10-10 10:10:10
中文字符
NULL
123456中文字符
123456123456
123456ABCabc
1234562020-10-10 10:10:10
123456
NULL
ABCabc中文字符
ABCabc123456
ABCabcABCabc
ABCabc2020-10-10 10:10:10
ABCabc
NULL
!@#$%^&*中文字符
!@#$%^&*123456
!@#$%^&*ABCabc
!@#$%^&*2020-10-10 10:10:10
!@#$%^&*
NULL
2020-10-10中文字符
2020-10-10123456
2020-10-10ABCabc
2020-10-102020-10-10 10:10:10
2020-10-10
NULL
2020-10-10 10:10:10中文字符
2020-10-10 10:10:10123456
2020-10-10 10:10:10ABCabc
2020-10-10 10:10:102020-10-10 10:10:10
2020-10-10 10:10:10
NULL
10:10:10中文字符
10:10:10123456
10:10:10ABCabc
10:10:102020-10-10 10:10:10
10:10:10
NULL
中文字符
123456
ABCabc
2020-10-10 10:10:10

NULL
中文字符中文字符
中文字符123456
中文字符ABCabc
中文字符2020-10-10 10:10:10
中文字符
NULL
ABCabc中文字符
ABCabc123456
ABCabcABCabc
ABCabc2020-10-10 10:10:10
ABCabc
NULL
select CONCAT(z0_test0,z1_test1) from z0case,z1case;
CONCAT(z0_test0,z1_test1)
中文字符中文字符
中文字符123456
中文字符ABCabc
中文字符2020-10-10 10:10:10
中文字符
NULL
123456中文字符
123456123456
123456ABCabc
1234562020-10-10 10:10:10
123456
NULL
ABCabc中文字符
ABCabc123456
ABCabcABCabc
ABCabc2020-10-10 10:10:10
ABCabc
NULL
!@#$%^&*中文字符
!@#$%^&*123456
!@#$%^&*ABCabc
!@#$%^&*2020-10-10 10:10:10
!@#$%^&*
NULL
2020-10-10中文字符
2020-10-10123456
2020-10-10ABCabc
2020-10-102020-10-10 10:10:10
2020-10-10
NULL
2020-10-10 10:10:10中文字符
2020-10-10 10:10:10123456
2020-10-10 10:10:10ABCabc
2020-10-10 10:10:102020-10-10 10:10:10
2020-10-10 10:10:10
NULL
10:10:10中文字符
10:10:10123456
10:10:10ABCabc
10:10:102020-10-10 10:10:10
10:10:10
NULL
中文字符
123456
ABCabc
2020-10-10 10:10:10

NULL
中文字符中文字符
中文字符123456
中文字符ABCabc
中文字符2020-10-10 10:10:10
中文字符
NULL
ABCabc中文字符
ABCabc123456
ABCabcABCabc
ABCabc2020-10-10 10:10:10
ABCabc
NULL
select CONCAT(z0_test0,z1_test2) from z0case,z1case;
CONCAT(z0_test0,z1_test2)
中文字符中文字符
123456中文字符
ABCabc中文字符
!@#$%^&*中文字符
2020-10-10中文字符
2020-10-10 10:10:10中文字符
10:10:10中文字符
中文字符
中文字符中文字符
ABCabc中文字符
中文字符123456
123456123456
ABCabc123456
!@#$%^&*123456
2020-10-10123456
2020-10-10 10:10:10123456
10:10:10123456
123456
中文字符123456
ABCabc123456
中文字符ABCabc
123456ABCabc
ABCabcABCabc
!@#$%^&*ABCabc
2020-10-10ABCabc
2020-10-10 10:10:10ABCabc
10:10:10ABCabc
ABCabc
中文字符ABCabc
ABCabcABCabc
中文字符2020-10-10 10:10:10
1234562020-10-10 10:10:10
ABCabc2020-10-10 10:10:10
!@#$%^&*2020-10-10 10:10:10
2020-10-102020-10-10 10:10:10
2020-10-10 10:10:102020-10-10 10:10:10
10:10:102020-10-10 10:10:10
2020-10-10 10:10:10
中文字符2020-10-10 10:10:10
ABCabc2020-10-10 10:10:10
中文字符
123456
ABCabc
!@#$%^&*
2020-10-10
2020-10-10 10:10:10
10:10:10

中文字符
ABCabc
NULL
NULL
NULL
NULL
NULL
NULL
NULL
NULL
NULL
NULL
select CONCAT(z0_test0,z1_test4) from z0case,z1case;
CONCAT(z0_test0,z1_test4)
中文字符2020-10-10
中文字符2020-10-10
中文字符2020-10-10
中文字符2020-10-10
中文字符2020-10-10
NULL
1234562020-10-10
1234562020-10-10
1234562020-10-10
1234562020-10-10
1234562020-10-10
NULL
ABCabc2020-10-10
ABCabc2020-10-10
ABCabc2020-10-10
ABCabc2020-10-10
ABCabc2020-10-10
NULL
!@#$%^&*2020-10-10
!@#$%^&*2020-10-10
!@#$%^&*2020-10-10
!@#$%^&*2020-10-10
!@#$%^&*2020-10-10
NULL
2020-10-102020-10-10
2020-10-102020-10-10
2020-10-102020-10-10
2020-10-102020-10-10
2020-10-102020-10-10
NULL
2020-10-10 10:10:102020-10-10
2020-10-10 10:10:102020-10-10
2020-10-10 10:10:102020-10-10
2020-10-10 10:10:102020-10-10
2020-10-10 10:10:102020-10-10
NULL
10:10:102020-10-10
10:10:102020-10-10
10:10:102020-10-10
10:10:102020-10-10
10:10:102020-10-10
NULL
2020-10-10
2020-10-10
2020-10-10
2020-10-10
2020-10-10
NULL
中文字符2020-10-10
中文字符2020-10-10
中文字符2020-10-10
中文字符2020-10-10
中文字符2020-10-10
NULL
ABCabc2020-10-10
ABCabc2020-10-10
ABCabc2020-10-10
ABCabc2020-10-10
ABCabc2020-10-10
NULL
select CONCAT(z0_test0,z1_test5) from z0case,z1case;
CONCAT(z0_test0,z1_test5)
中文字符123456
中文字符123456
中文字符123456
中文字符123456
中文字符123456
NULL
123456123456
123456123456
123456123456
123456123456
123456123456
NULL
ABCabc123456
ABCabc123456
ABCabc123456
ABCabc123456
ABCabc123456
NULL
!@#$%^&*123456
!@#$%^&*123456
!@#$%^&*123456
!@#$%^&*123456
!@#$%^&*123456
NULL
2020-10-10123456
2020-10-10123456
2020-10-10123456
2020-10-10123456
2020-10-10123456
NULL
2020-10-10 10:10:10123456
2020-10-10 10:10:10123456
2020-10-10 10:10:10123456
2020-10-10 10:10:10123456
2020-10-10 10:10:10123456
NULL
10:10:10123456
10:10:10123456
10:10:10123456
10:10:10123456
10:10:10123456
NULL
123456
123456
123456
123456
123456
NULL
中文字符123456
中文字符123456
中文字符123456
中文字符123456
中文字符123456
NULL
ABCabc123456
ABCabc123456
ABCabc123456
ABCabc123456
ABCabc123456
NULL
select TRIM(z0_test0) from z0case;
TRIM(z0_test0)
中文字符
123456
ABCabc
!@#$%^&*
2020-10-10
2020-10-10 10:10:10
10:10:10

中文字符
ABCabc
select RPAD(z0_test0,10,1232) from z0case;
RPAD(z0_test0,10,1232)
中文字符123212
1234561232
ABCabc1232
!@#$%^&*12
2020-10-10
2020-10-10
10:10:1012
1232123212
中文字符123212
ABCabc1232
UPPER
update z0case set z0_test0=null where 1=1;
ERROR 23000: Column 'z0_test0' cannot be null
update z0case set z0_test0=123456 where 1=1;
ERROR 01000: Data truncated for column 'z0_test0' at row 1
update z0case set z0_test0='' where 1=1;
unique
drop table z0case;
create table z0case(z0_test0 set('中文字符','123456','ABCabc','!@#$%^&*','2020-10-10','2020-10-10 10:10:10','10:10:10') UNIQUE,z0_test1 set('中文字符','123456','ABC abc','!@#$%^&*','2020-10-10') );
insert into z0case values('中文字符','中文字符');
insert into z0case values('123456','123456');
insert into z0case values('ABCabc','ABC abc');
insert into z0case values('!@#$%^&*','!@#$%^&*');
insert into z0case values('2020-10-10','2020-10-10');
insert into z0case values('','');
insert into z0case values(null,null);
insert into z0case values('中文字符  ','中文字符');
ERROR 23000: Duplicate entry '1' for key 'z0_test0'
insert into z0case values(123456,'中文字符 ');
ERROR 01000: Data truncated for column 'z0_test0' at row 1
insert into z0case values('abcabc','ABC abc');
ERROR 23000: Duplicate entry '4' for key 'z0_test0'
insert into z0case values('ABCABC ','ABC abc');
ERROR 23000: Duplicate entry '4' for key 'z0_test0'
insert into z0case values('','ABC abc');
ERROR 23000: Duplicate entry '0' for key 'z0_test0'
insert into z0case values(' ','ABC abc');
ERROR 01000: Data truncated for column 'z0_test0' at row 1
insert into z0case values(null,null);
select *from  z1case;
z1_test0	z1_test1	z1_test2	z1_test3	z1_test4	z1_test5
中文字符	中文字符	中文字符	中文字符	2020-10-10	123456
123456	123456	123456	123456	2020-10-10	123456
ABCabc	ABCabc	ABCabc	ABCabc	2020-10-10	123456
2020-10-10 10:10:10	2020-10-10 10:10:10	2020-10-10 10:10:10	2020-10-10 10:10:10	2020-10-10	123456
				2020-10-10	123456
NULL	NULL	NULL	NULL	NULL	NULL
insert into z0case select z1_test0,z1_test0 from z1case where  z1_test0='中文字符';
ERROR 23000: Duplicate entry '1' for key 'z0_test0'
insert into z0case select z1_test0,z1_test0 from z1case where  z1_test0='123456';
ERROR 23000: Duplicate entry '2' for key 'z0_test0'
insert into z0case select z1_test0,z1_test0 from z1case where  z1_test0='ABCABC';
ERROR 01000: Data truncated for column 'z0_test1' at row 1
insert into z0case select z1_test0,z1_test0 from z1case where  z1_test0='';
ERROR 23000: Duplicate entry '0' for key 'z0_test0'
insert into z0case select z1_test0,z1_test0 from z1case where  z1_test0 is null;
insert into z0case select z1_test0,z1_test0 from z1case where  z1_test0=' ';
ERROR 23000: Duplicate entry '0' for key 'z0_test0'
insert char
insert into z0case select z1_test0,z1_test0 from z1case where  z1_test0='中文字符';
ERROR 23000: Duplicate entry '1' for key 'z0_test0'
insert into z0case select z1_test0,z1_test0 from z1case where  z1_test0='123456';
ERROR 23000: Duplicate entry '2' for key 'z0_test0'
insert into z0case select z1_test0,z1_test0 from z1case where  z1_test0='ABCABC';
ERROR 01000: Data truncated for column 'z0_test1' at row 1
insert into z0case select z1_test0,z1_test0 from z1case where  z1_test0='';
ERROR 23000: Duplicate entry '0' for key 'z0_test0'
insert into z0case select z1_test0,z1_test0 from z1case where  z1_test0 is null;
insert into z0case select z1_test0,z1_test0 from z1case where  z1_test0=' ';
ERROR 23000: Duplicate entry '0' for key 'z0_test0'
insert varchar
insert into z0case select z1_test1,z1_test1 from z1case where  z1_test0='中文字符';
ERROR 23000: Duplicate entry '1' for key 'z0_test0'
insert into z0case select z1_test1,z1_test1 from z1case where  z1_test0='123456';
ERROR 23000: Duplicate entry '2' for key 'z0_test0'
insert into z0case select z1_test1,z1_test1 from z1case where  z1_test0='ABCABC';
ERROR 01000: Data truncated for column 'z0_test1' at row 1
insert into z0case select z1_test1,z1_test1 from z1case where  z1_test0='';
ERROR 23000: Duplicate entry '0' for key 'z0_test0'
insert into z0case select z1_test1,z1_test1 from z1case where  z1_test0 is null;
insert into z0case select z1_test1,z1_test1 from z1case where  z1_test0=' ';
ERROR 23000: Duplicate entry '0' for key 'z0_test0'
blob
insert into z0case select z1_test2,z1_test1 from z1case where  z1_test0='中文字符';
ERROR 23000: Duplicate entry '1' for key 'z0_test0'
TEXT
insert into z0case select z1_test3,z1_test1 from z1case where  z1_test0='中文字符';
ERROR 23000: Duplicate entry '1' for key 'z0_test0'
date
insert into z0case select z1_test4,z1_test1 from z1case where  z1_test0='中文字符';
ERROR 23000: Duplicate entry '16' for key 'z0_test0'
insert into z0case select z1_test4,z1_test1 from z1case where  z1_test0='123456';
ERROR 23000: Duplicate entry '16' for key 'z0_test0'
insert into z0case select z1_test4,z1_test1 from z1case where  z1_test0='ABCABC';
ERROR 01000: Data truncated for column 'z0_test1' at row 1
insert into z0case select z1_test4,z1_test1 from z1case where  z1_test0='';
ERROR 23000: Duplicate entry '16' for key 'z0_test0'
UPDATE
update z0case set z0_test0='中文字符' limit 1;
update z0case set z0_test0='123456' limit 1;
ERROR 23000: Duplicate entry '2' for key 'z0_test0'
update z0case set z0_test0='ABCabc' limit 1;
ERROR 23000: Duplicate entry '4' for key 'z0_test0'
update z0case set z0_test0='!@#$%^&*' limit 1;
ERROR 23000: Duplicate entry '8' for key 'z0_test0'
update z0case set z0_test0='2020-10-10' limit 1;
ERROR 23000: Duplicate entry '16' for key 'z0_test0'
update z0case set z0_test0='' limit 1;
ERROR 23000: Duplicate entry '0' for key 'z0_test0'
update z0case set z0_test0=' ' limit 1;
ERROR 01000: Data truncated for column 'z0_test0' at row 1
update z0case set z0_test0=null  limit 1;
update z0case set z0_test0='中文字符    ' limit 1;
update z0case set z0_test0=123456 limit 1;
ERROR 01000: Data truncated for column 'z0_test0' at row 1
update z0case set z0_test0=LOWER('ABCabc') limit 1;
ERROR 23000: Duplicate entry '4' for key 'z0_test0'
update z0case set z0_test0=UPPER('ABCabc') limit 1;
ERROR 23000: Duplicate entry '4' for key 'z0_test0'
update z0case set z0_test0=UPPER('ABCabc ') limit 1;
ERROR 23000: Duplicate entry '4' for key 'z0_test0'
update z0case set z0_test0='    ' limit 1;
ERROR 01000: Data truncated for column 'z0_test0' at row 1
upper
DECIMAL
update z0case set z0_test0=(select z1_test5 from z1case where z1_test0='中文字符')  limit 1;
ERROR 01000: Data truncated for column 'z0_test0' at row 1
update z0case set z0_test0=(select z1_test5 from z1case where z1_test0='123456')  limit 1;
ERROR 01000: Data truncated for column 'z0_test0' at row 1
update z0case set z0_test0=(select z1_test5 from z1case where z1_test0='ABCabc')  limit 1;
ERROR 01000: Data truncated for column 'z0_test0' at row 1
update z0case set z0_test0=(select z1_test5 from z1case where z1_test0='!@#$%^&*')  limit 1;
update z0case set z0_test0=(select cast(123456 as BINARY) from dual) limit 1;
ERROR 23000: Duplicate entry '2' for key 'z0_test0'
update z0case set z0_test0= DATE_FORMAT('2020-10-10', '%Y/%m/%d')limit 1;
ERROR 01000: Data truncated for column 'z0_test0' at row 1
update z0case set z0_test0= DATE_FORMAT('2020-10-10', '%Y-%m-%d')limit 1;
ERROR 23000: Duplicate entry '16' for key 'z0_test0'
update z0case set z0_test0= (select z2_test0 from z2case where z2_test0='!@#$%^&*');
ERROR 23000: Duplicate entry '8' for key 'z0_test0'
update z0case set z0_test0= (select z2_test0 from z2case where z2_test0='2020-10-10');
ERROR 23000: Duplicate entry '16' for key 'z0_test0'
update z0case set z0_test0= (select z2_test0 from z2case where z2_test0='');
ERROR 23000: Duplicate entry '0' for key 'z0_test0'
drop table z0case;
primary key
create table z0case(z0_test0 set('中文字符','123456','ABCabc','!@#$%^&*','2020-10-10','2020-10-10 10:10:10','10:10:10') primary KEY,z0_test1 set('中文字符','123456','ABC abc','!@#$%^&*','2020-10-10') );
insert into z0case values('中文字符','中文字符');
insert into z0case values('123456','123456');
insert into z0case values('ABCabc','ABC abc');
insert into z0case values('!@#$%^&*','!@#$%^&*');
insert into z0case values('2020-10-10','2020-10-10');
insert into z0case values('','');
insert into z0case values(null,null);
ERROR 23000: Column 'z0_test0' cannot be null
insert into z0case values('中文字符 ',null);
ERROR 23000: Duplicate entry '1' for key 'PRIMARY'
insert into z0case values('abcabc  ',null);
ERROR 23000: Duplicate entry '4' for key 'PRIMARY'
insert into z0case values('ABCABC ',null);
ERROR 23000: Duplicate entry '4' for key 'PRIMARY'
update z0case set z0_test0=(select cast(123456 as BINARY) from dual) limit 1;
ERROR 23000: Duplicate entry '2' for key 'PRIMARY'
update z0case set z0_test0=(select cast('中文字符' as BINARY) from dual) limit 1;
ERROR 23000: Duplicate entry '1' for key 'PRIMARY'
update z0case set z0_test0=(select cast('' as BINARY) from dual) limit 1;
update z0case set z0_test0=(select cast(null as BINARY) from dual) limit 1;
ERROR 23000: Column 'z0_test0' cannot be null
select * from z0case where z0_test0 like '%A%';
z0_test0	z0_test1
ABCabc	ABC abc
select * from z0case where z0_test0> z0_test1;
z0_test0	z0_test1
ABCabc	ABC abc
index
drop table z0case;
create table z0case(z0_test0 set('中文字符','123456','ABCabc','!@#$%^&*','2020-10-10','2020-10-10 10:10:10','10:10:10'),z0_test1 set('中文字符','123456','ABC abc','!@#$%^&*','2020-10-10') );
insert into z0case values('中文字符','中文字符');
insert into z0case values('123456','123456');
insert into z0case values('ABCabc','ABC abc');
insert into z0case values('!@#$%^&*','!@#$%^&*');
insert into z0case values('2020-10-10','2020-10-10');
insert into z0case values('','');
insert into z0case values(null,null);
普通索引
CREATE INDEX set_index ON z0case(z0_test0,z0_test1);
select z0_test0,z0_test1 from z0case;
z0_test0	z0_test1
中文字符	中文字符
123456	123456
ABCabc	ABC abc
!@#$%^&*	!@#$%^&*
2020-10-10	2020-10-10
	
NULL	NULL
drop index set_index ON z0case;
唯一索引
CREATE UNIQUE INDEX set_index ON z0case (z0_test0) ;
select z0_test0,z0_test1 from z0case;
z0_test0	z0_test1
中文字符	中文字符
123456	123456
ABCabc	ABC abc
!@#$%^&*	!@#$%^&*
2020-10-10	2020-10-10
	
NULL	NULL
insert into z0case values('abcabc ','ABCabc');
ERROR 01000: Data truncated for column 'z0_test1' at row 1
drop index set_index ON z0case;
view
drop table z0case;
create table z0case(z0_test0 set('中文字符','123456','ABCabc','!@#$%^&*','2020-10-10','2020-10-10 10:10:10','10:10:10'),z0_test1 set('中文字符','123456','ABC abc','!@#$%^&*','2020-10-10') );
insert into z0case values('中文字符','中文字符');
insert into z0case values('123456','123456');
insert into z0case values('ABCabc','ABC abc');
insert into z0case values('!@#$%^&*','!@#$%^&*');
insert into z0case values('2020-10-10','2020-10-10');
insert into z0case values('','');
insert into z0case values(null,null);
create view set_view as select * from z0case;
select z0_test0,z0_test1 from z0case;
z0_test0	z0_test1
中文字符	中文字符
123456	123456
ABCabc	ABC abc
!@#$%^&*	!@#$%^&*
2020-10-10	2020-10-10
	
NULL	NULL
insert into set_view values ('中文字符','中文字符');
insert into set_view values ('123456','123456');
insert into set_view values ('ABCabc','ABC abc');
insert into set_view values ('','');
insert into set_view values (' ','');
ERROR 01000: Data truncated for column 'z0_test0' at row 1
insert into set_view values ('ABCabc  ','ABC abc');
insert into set_view values ('abcabc  ','ABC abc');
insert into set_view values ('ABCABC  ','ABC abc');
insert into set_view values (123456,'ABC abc');
ERROR 01000: Data truncated for column 'z0_test0' at row 1
insert into set_view values ('123456.0','ABC abc');
ERROR 01000: Data truncated for column 'z0_test0' at row 1
insert into set_view values (null,null);
update
UPDATE set_view set z0_test0='中文字符' limit 1;
UPDATE set_view set z0_test0='123456' limit 1;
UPDATE set_view set z0_test0='ABCabc' limit 1;
UPDATE set_view set z0_test0='' limit 1;
UPDATE set_view set z0_test0=' ' limit 1;
ERROR 01000: Data truncated for column 'z0_test0' at row 1
UPDATE set_view set z0_test0='ABCabc  ' limit 1;
UPDATE set_view set z0_test0='abcabc ' limit 1;
UPDATE set_view set z0_test0='ABCABC ' limit 1;
UPDATE set_view set z0_test0='0123456' limit 1;
ERROR 01000: Data truncated for column 'z0_test0' at row 1
UPDATE set_view set z0_test0=123456 limit 1;
ERROR 01000: Data truncated for column 'z0_test0' at row 1
UPDATE set_view set z0_test0=null limit 1;
delete
delete from set_view where z0_test0='中文字符';
delete from set_view where z0_test0=123456 ;
delete from set_view where z0_test0='123456';
delete from set_view where z0_test0='ABCabc ';
delete from set_view where z0_test0='ABCabc';
delete from set_view where z0_test0='';
delete from set_view where z0_test0 is NULL ;
ALTER
ADD SET
ALTER TABLE z0case ADD z0_test2 set('中文字符 ','123456','ABC abc','!@#$%^&*','2020-10-10');
delete from z0case;
insert into z0case values('中文字符','中文字符','中文字符 ');
insert into z0case values('123456','123456','123456');
insert into z0case values('ABCabc','ABC ABC','abc abc');
insert into z0case values('!@#$%^&*','!@#$%^&*','!@#$%^&*');
insert into z0case values('2020-10-10','2020-10-10','2020-10-10');
insert into z0case values('','','中文字符');
insert into z0case values(null,null,null );
insert into z0case values('ABCabc','ABC abc',' ABC abc');
ERROR 01000: Data truncated for column 'z0_test2' at row 1
select  * from z0case;
z0_test0	z0_test1	z0_test2
中文字符	中文字符	中文字符
123456	123456	123456
ABCabc	ABC abc	ABC abc
!@#$%^&*	!@#$%^&*	!@#$%^&*
2020-10-10	2020-10-10	2020-10-10
		中文字符
NULL	NULL	NULL
UPDATE z0case set z0_test2='中文字符' limit 1;
UPDATE z0case set z0_test2='123456' limit 1;
UPDATE z0case set z0_test2='ABCabc' limit 1;
ERROR 01000: Data truncated for column 'z0_test2' at row 1
UPDATE z0case set z0_test2='' limit 1;
UPDATE z0case set z0_test2=' ' limit 1;
ERROR 01000: Data truncated for column 'z0_test2' at row 1
UPDATE z0case set z0_test2='ABC abc  ' limit 1;
UPDATE z0case set z0_test2='abc abc ' limit 1;
UPDATE z0case set z0_test2='ABC ABC ' limit 1;
UPDATE z0case set z0_test2='0123456' limit 1;
ERROR 01000: Data truncated for column 'z0_test2' at row 1
UPDATE z0case set z0_test2=123456 limit 1;
ERROR 01000: Data truncated for column 'z0_test2' at row 1
UPDATE z0case set z0_test2=null limit 1;
alter typr
ALTER TABLE z0case DROP COLUMN z0_test2;
select  * from z0case;
z0_test0	z0_test1
中文字符	中文字符
123456	123456
ABCabc	ABC abc
!@#$%^&*	!@#$%^&*
2020-10-10	2020-10-10
	
NULL	NULL
alter table z0case modify column z0_test0 char(100) ;
alter table z0case modify column z0_test0 DECIMAL ;
ERROR 42000: Invalid numeric
alter table z0case modify column z0_test0 date ;
ERROR 22007: Incorrect value
alter table z0case modify column z0_test1 set ('中文字符 ','123456','ABC abc','!@#$%^&*','2020-10-10');
alter table z0case modify column z0_test0 set('中文字符 ','123456','ABC abc','!@#$%^&*','2020-10-10') ;
ERROR 01000: Data truncated for argument
alter 约束
alter table z0case  add primary key (z0_test0);
ERROR 22004: Invalid use of NULL value
#30608116 alter 表 set类型字段，添加非空约束，ob报错，mysql正常通过
alter table z0case  CHANGE COLUMN  z0_test0 z0_test0 CHAR(100)not null ;
ERROR 22004: Invalid use of NULL value
alter table z0case  add UNIQUE(z0_test0);
insert into z0case values(' ','');
ERROR 23000: Duplicate entry '' for key 'z0_test0'
insert into z0case values(null,null );
insert into z0case values('abcabc ','ABC abc');
ERROR 23000: Duplicate entry 'abcabc' for key 'z0_test0'
update z0case set z0_test0=upper('abcabc ') where z0_test0 is NULL;
ERROR 23000: Duplicate entry 'ABCABC' for key 'z0_test0'
