drop database if exists db_fork_other;
drop database if exists db_fork_other2;
drop user if exists 'test_user_a'@'%';
drop user if exists 'test_user_b'@'%';
create database db_fork_other;
create database db_fork_other2;
use db_fork_other;
SET wait_timeout=30000000;
SET ob_trx_timeout = 100000000;
SET ob_query_timeout = 100000000;
============================================
1. 多版本回收策略影响，undo_retention=0极端条件(p0)
============================================
# 设置undo_retention=0（极端条件）
alter system set undo_retention = 0;
drop table if exists t_undo_retention;
Warnings:
Note	1051	Unknown table 'db_fork_other.t_undo_retention'
drop table if exists t_undo_retention_fork;
Warnings:
Note	1051	Unknown table 'db_fork_other.t_undo_retention_fork'
create table t_undo_retention (
id int primary key,
name varchar(50),
value int
) partition by range(id) (
partition p0 values less than (100),
partition p1 values less than (200)
);
# 插入初始数据
insert into t_undo_retention values (1, 'Init1', 100);
insert into t_undo_retention values (101, 'Init2', 200);
# 验证初始数据
select count(*) as cnt from t_undo_retention;
cnt
2
select * from t_undo_retention order by id;
id	name	value
1	Init1	100
101	Init2	200
# Fork表（在undo_retention=0的条件下）
# 注意：undo_retention=0可能导致fork table需要更长时间，增加超时时间
fork table t_undo_retention to t_undo_retention_fork;
# 验证Fork后源表数据
select count(*) as src_cnt from t_undo_retention;
src_cnt
2
select * from t_undo_retention order by id;
id	name	value
1	Init1	100
101	Init2	200
# 验证Fork后目标表数据
select count(*) as fork_cnt from t_undo_retention_fork;
fork_cnt
2
select * from t_undo_retention_fork order by id;
id	name	value
1	Init1	100
101	Init2	200
# 验证数据一致性
select (select count(*) from t_undo_retention) as src_cnt, (select count(*) from t_undo_retention_fork) as fork_cnt;
src_cnt	fork_cnt
2	2
# 在undo_retention=0条件下，继续对源表进行操作
insert into t_undo_retention values (50, 'AfterFork1', 150);
update t_undo_retention set value = 101 where id = 1;
# 验证源表数据更新
select count(*) as src_cnt from t_undo_retention;
src_cnt
3
select * from t_undo_retention order by id;
id	name	value
1	Init1	101
50	AfterFork1	150
101	Init2	200
# 验证目标表数据未受影响（数据隔离）
select count(*) as fork_cnt from t_undo_retention_fork;
fork_cnt
2
select * from t_undo_retention_fork order by id;
id	name	value
1	Init1	100
101	Init2	200
# 恢复undo_retention设置（使用默认值或合理值）
alter system set undo_retention = 1800;
drop table t_undo_retention;
drop table t_undo_retention_fork;
drop database if exists db_fork_other;
drop database if exists db_fork_other2;
drop user if exists 'test_user_a'@'%';
drop user if exists 'test_user_b'@'%';
create database db_fork_other;
create database db_fork_other2;
use db_fork_other;
SET wait_timeout=30000000;
SET ob_trx_timeout = 100000000;
SET ob_query_timeout = 100000000;
============================================
2. 权限检查(p1)
============================================
# 2.1 用户对a表的权限是否带到a_fork表中
# 准备测试环境
create user 'test_user_a'@'%' identified by 'test123';
create user 'test_user_b'@'%' identified by 'test123';
drop table if exists t_perm_a;
Warnings:
Note	1051	Unknown table 'db_fork_other.t_perm_a'
drop table if exists t_perm_a_fork;
Warnings:
Note	1051	Unknown table 'db_fork_other.t_perm_a_fork'
create table t_perm_a (
id int primary key,
name varchar(50),
value int
) partition by range(id) (
partition p0 values less than (100),
partition p1 values less than (200)
);
insert into t_perm_a values (1, 'Data1', 100);
insert into t_perm_a values (101, 'Data2', 200);
# 首先检查test_user_a的初始权限（确保没有database级别的权限）
# 检查test_user_a对database的权限
show grants for 'test_user_a'@'%';
Grants for test_user_a@%
GRANT USAGE ON *.* TO 'test_user_a'
# 验证test_user_a初始状态下对源表没有权限
# 注意：需要先授予USAGE权限才能连接到数据库，但USAGE权限不会自动授予表权限
grant usage on db_fork_other.* to 'test_user_a'@'%';
# 现在可以连接数据库，但验证对源表没有权限（预期失败）
connect(127.0.0.1,test_user_a@sys,test123,db_fork_other,2887,);
ERROR 42000: Access denied for user 'test_user_a'@'%' to database 'db_fork_other'
# 授予test_user_a对源表的SELECT和INSERT权限
grant select, insert on db_fork_other.t_perm_a to 'test_user_a'@'%';
# 再次检查test_user_a的权限（确认只有对源表的显式权限）
show grants for 'test_user_a'@'%';
Grants for test_user_a@%
GRANT USAGE ON *.* TO 'test_user_a'
GRANT INSERT, SELECT ON `db_fork_other`.`t_perm_a` TO 'test_user_a'
# 验证test_user_a对源表的权限
select count(*) as cnt from t_perm_a;
cnt
2
select * from t_perm_a order by id;
id	name	value
1	Data1	100
101	Data2	200
# 使用root用户执行Fork操作
fork table t_perm_a to t_perm_a_fork;
# Fork后再次检查test_user_a的权限（确认权限没有变化）
show grants for 'test_user_a'@'%';
Grants for test_user_a@%
GRANT USAGE ON *.* TO 'test_user_a'
GRANT INSERT, SELECT ON `db_fork_other`.`t_perm_a` TO 'test_user_a'
# 验证test_user_a对源表的权限仍然有效
select count(*) as cnt from t_perm_a;
cnt
2
select * from t_perm_a order by id;
id	name	value
1	Data1	100
101	Data2	200
# 验证test_user_a对fork表的权限（权限不应自动迁移）
select * from t_perm_a_fork order by id;
ERROR 42000: SELECT command denied to user 'test_user_a'@'%' for table 't_perm_a_fork'
# 结论：用户对源表的权限不会自动带到fork表中
============================================
# 2.2 用户未显式授权，是否对本用户fork的表拥有权限
============================================
# test_user_a自己fork表
# 清理环境
drop table if exists t_self_fork;
Warnings:
Note	1051	Unknown table 'db_fork_other.t_self_fork'
drop table if exists t_self_fork_fork;
Warnings:
Note	1051	Unknown table 'db_fork_other.t_self_fork_fork'
# 重新建立干净的连接以确保权限状态
# 重新连接root用户，确保权限授予的准确性
# 重要修改：清理之前的权限，重新授予最小权限（为2.2准备「仅USAGE+CREATE TABLE」的干净起点）
# 仅收回2.1的表级权限（t_perm_a）；不执行revoke usage on db_fork_other.*，因部分环境会报5133且对2.2结论无影响，后续grant会得到USAGE+CREATE TABLE
revoke insert, select on db_fork_other.t_perm_a from 'test_user_a'@'%';
grant usage on db_fork_other.* to 'test_user_a'@'%';
# 关键修改：授予库级CREATE权限（OceanBase 库级仅支持 CREATE，不支持 create table 语法）
grant create on db_fork_other.* to 'test_user_a'@'%';
# 重新连接test_user_a
# 验证test_user_a的当前权限状态
show grants for 'test_user_a'@'%';
Grants for test_user_a@%
GRANT USAGE ON *.* TO 'test_user_a'
GRANT CREATE ON `db_fork_other`.* TO 'test_user_a'
# test_user_a创建表
create table t_self_fork (
id int primary key,
name varchar(50)
) partition by range(id) (
partition p0 values less than (100)
);
# 授予对源表的INSERT和SELECT权限（由root用户执行）
grant insert, select on db_fork_other.t_self_fork to 'test_user_a'@'%';
# Fork前检查test_user_a的权限（确认只有对源表的显式权限）
show grants for 'test_user_a'@'%';
Grants for test_user_a@%
GRANT USAGE ON *.* TO 'test_user_a'
GRANT CREATE ON `db_fork_other`.* TO 'test_user_a'
GRANT INSERT, SELECT ON `db_fork_other`.`t_self_fork` TO 'test_user_a'
# 切换到test_user_a执行数据操作
insert into t_self_fork values (1, 'Self1');
insert into t_self_fork values (50, 'Self2');
# 验证对源表的权限
select * from t_self_fork order by id;
id	name
1	Self1
50	Self2
# 检查当前权限详情
SELECT 
TABLE_SCHEMA,
TABLE_NAME, 
PRIVILEGE_TYPE,
GRANTEE
FROM information_schema.TABLE_PRIVILEGES 
WHERE GRANTEE LIKE '%test_user_a%' 
AND TABLE_SCHEMA = 'db_fork_other'
ORDER BY TABLE_NAME, PRIVILEGE_TYPE;
TABLE_SCHEMA	TABLE_NAME	PRIVILEGE_TYPE	GRANTEE
db_fork_other	t_self_fork	INSERT	'test_user_a'@'%'
db_fork_other	t_self_fork	SELECT	'test_user_a'@'%'
# test_user_a自己执行fork操作
fork table t_self_fork to t_self_fork_fork;
# Fork后立即检查权限状态
show grants for 'test_user_a'@'%';
Grants for test_user_a@%
GRANT USAGE ON *.* TO 'test_user_a'
GRANT CREATE ON `db_fork_other`.* TO 'test_user_a'
GRANT INSERT, SELECT ON `db_fork_other`.`t_self_fork` TO 'test_user_a'
# 检查FORK表的权限分布
SELECT 
TABLE_SCHEMA,
TABLE_NAME, 
PRIVILEGE_TYPE,
GRANTEE
FROM information_schema.TABLE_PRIVILEGES 
WHERE TABLE_SCHEMA = 'db_fork_other'
AND TABLE_NAME LIKE 't_self_fork%'
ORDER BY TABLE_NAME, GRANTEE, PRIVILEGE_TYPE;
TABLE_SCHEMA	TABLE_NAME	PRIVILEGE_TYPE	GRANTEE
db_fork_other	t_self_fork	INSERT	'test_user_a'@'%'
db_fork_other	t_self_fork	SELECT	'test_user_a'@'%'
# 验证test_user_a对自己fork的表是否有权限（预期应该失败）
select * from t_self_fork_fork order by id;
ERROR 42000: SELECT command denied to user 'test_user_a'@'%' for table 't_self_fork_fork'
# 2.3 用户A对用户B的表是否支持fork，授权create后是否支持fork？
drop table if exists t_user_b;
Warnings:
Note	1051	Unknown table 'db_fork_other.t_user_b'
drop table if exists t_user_b_fork;
Warnings:
Note	1051	Unknown table 'db_fork_other.t_user_b_fork'
# 使用test_user_b真实创建表（用户B的表）
# 授予test_user_b对数据库的CREATE、INSERT、SELECT权限（用于创建表和插入数据）
grant create, insert, select on db_fork_other.* to 'test_user_b'@'%';
# 创建test_user_b的连接
create table t_user_b (
id int primary key,
name varchar(50),
owner varchar(50) default 'user_b'
) partition by range(id) (
partition p0 values less than (100)
);
insert into t_user_b values (1, 'UserB_Data1', 'user_b');
insert into t_user_b values (50, 'UserB_Data2', 'user_b');
# 测试场景1：只有CREATE权限，没有SELECT权限
# 只授予test_user_a的CREATE权限（不授予SELECT权限）
grant create on db_fork_other.* to 'test_user_a'@'%';
# 重新连接以确保权限生效
# test_user_a尝试fork用户B的表（只有CREATE权限）
fork table t_user_b to t_user_b_fork;
ERROR 42000: SELECT command denied to user 'test_user_a'@'%' for table 't_user_b'
# 使用root授予test_user_a对db_fork_other的SELECT权限后，test_user_a才能fork用户B的表
grant select on db_fork_other.* to 'test_user_a'@'%';
# 重连test_user_a以使新权限生效，再执行一次fork
fork table t_user_b to t_user_b_fork;
# 验证fork操作成功（只要有CREATE权限就可以fork）
select count(*) as cnt from t_user_b_fork;
cnt
2
select * from t_user_b_fork order by id;
id	name	owner
1	UserB_Data1	user_b
50	UserB_Data2	user_b
# 验证test_user_a对fork表的权限（需要显式授权）
# 授予test_user_a对fork表的SELECT权限
# 验证授权后可以访问
# 结论：用户A对用户B的表，只要有CREATE权限就可以fork，但fork后需要显式授权才能访问
# 清理权限测试相关表
drop table if exists t_user_b;
drop user 'test_user_a'@'%';
drop user 'test_user_b'@'%';
drop table if exists t_perm_a, t_perm_a_fork, t_self_fork, t_self_fork_fork;
drop database db_fork_other;
drop database db_fork_other2;
============================================
3. 链式fork以及并行fork验证，检查各级目标表都相互独立(p1)
============================================
# 重建库供 section 3 及后续跨库 fork（section 2 结尾已 drop db_fork_other/db_fork_other2）
create database db_fork_other;
create database db_fork_other2;
use db_fork_other;
# 3.1 链式fork验证（A -> B -> C）
drop table if exists t_chain_a;
Warnings:
Note	1051	Unknown table 'db_fork_other.t_chain_a'
drop table if exists t_chain_b;
Warnings:
Note	1051	Unknown table 'db_fork_other.t_chain_b'
drop table if exists t_chain_c;
Warnings:
Note	1051	Unknown table 'db_fork_other.t_chain_c'
create table t_chain_a (
id int primary key,
name varchar(50),
value int,
level varchar(10) default 'A'
) partition by range(id) (
partition p0 values less than (100),
partition p1 values less than (200)
);
insert into t_chain_a values (1, 'Chain_A1', 100, 'A');
insert into t_chain_a values (101, 'Chain_A2', 200, 'A');
# 第一次fork: A -> B
fork table t_chain_a to t_chain_b;
# 验证第一次fork
select * from t_chain_a order by id;
id	name	value	level
1	Chain_A1	100	A
101	Chain_A2	200	A
select * from t_chain_b order by id;
id	name	value	level
1	Chain_A1	100	A
101	Chain_A2	200	A
# 第二次fork: B -> C
fork table t_chain_b to t_chain_c;
# 验证第二次fork
show create table t_chain_a;
Table	Create Table
t_chain_a	CREATE TABLE `t_chain_a` (
  `id` int(11) NOT NULL,
  `name` varchar(50) DEFAULT NULL,
  `value` int(11) DEFAULT NULL,
  `level` varchar(10) DEFAULT 'A',
  PRIMARY KEY (`id`)
) ORGANIZATION INDEX DEFAULT CHARSET = utf8mb4 ROW_FORMAT = DYNAMIC COMPRESSION = 'zstd_1.3.8' REPLICA_NUM = 1 BLOCK_SIZE = 16384 USE_BLOOM_FILTER = FALSE ENABLE_MACRO_BLOCK_BLOOM_FILTER = FALSE TABLET_SIZE = 134217728 PCTFREE = 0
 partition by range(id)
(partition `p0` values less than (100),
partition `p1` values less than (200))
show create table t_chain_b;
Table	Create Table
t_chain_b	CREATE TABLE `t_chain_b` (
  `id` int(11) NOT NULL,
  `name` varchar(50) DEFAULT NULL,
  `value` int(11) DEFAULT NULL,
  `level` varchar(10) DEFAULT 'A',
  PRIMARY KEY (`id`)
) ORGANIZATION INDEX DEFAULT CHARSET = utf8mb4 ROW_FORMAT = DYNAMIC COMPRESSION = 'zstd_1.3.8' REPLICA_NUM = 1 BLOCK_SIZE = 16384 USE_BLOOM_FILTER = FALSE ENABLE_MACRO_BLOCK_BLOOM_FILTER = FALSE TABLET_SIZE = 134217728 PCTFREE = 0
 partition by range(id)
(partition `p0` values less than (100),
partition `p1` values less than (200))
show create table t_chain_c;
Table	Create Table
t_chain_c	CREATE TABLE `t_chain_c` (
  `id` int(11) NOT NULL,
  `name` varchar(50) DEFAULT NULL,
  `value` int(11) DEFAULT NULL,
  `level` varchar(10) DEFAULT 'A',
  PRIMARY KEY (`id`)
) ORGANIZATION INDEX DEFAULT CHARSET = utf8mb4 ROW_FORMAT = DYNAMIC COMPRESSION = 'zstd_1.3.8' REPLICA_NUM = 1 BLOCK_SIZE = 16384 USE_BLOOM_FILTER = FALSE ENABLE_MACRO_BLOCK_BLOOM_FILTER = FALSE TABLET_SIZE = 134217728 PCTFREE = 0
 partition by range(id)
(partition `p0` values less than (100),
partition `p1` values less than (200))
select * from t_chain_a order by id;
id	name	value	level
1	Chain_A1	100	A
101	Chain_A2	200	A
select * from t_chain_b order by id;
id	name	value	level
1	Chain_A1	100	A
101	Chain_A2	200	A
select * from t_chain_c order by id;
id	name	value	level
1	Chain_A1	100	A
101	Chain_A2	200	A
# 修改表A（验证B和C不受影响）
insert into t_chain_a values (3, 'Chain_A4', 301, 'A');
# 修改表B（验证A和C不受影响）
insert into t_chain_b values (3, 'Chain_B2', 401, 'B');
# 修改表C（验证A和B不受影响）
insert into t_chain_c values (3, 'Chain_C1', 501, 'C');
# 验证三级表数据完全独立
select count(*) as a_cnt from t_chain_a;
a_cnt
3
select count(*) as b_cnt from t_chain_b;
b_cnt
3
select count(*) as c_cnt from t_chain_c;
c_cnt
3
select * from t_chain_a order by id;
id	name	value	level
1	Chain_A1	100	A
3	Chain_A4	301	A
101	Chain_A2	200	A
select * from t_chain_b order by id;
id	name	value	level
1	Chain_A1	100	A
3	Chain_B2	401	B
101	Chain_A2	200	A
select * from t_chain_c order by id;
id	name	value	level
1	Chain_A1	100	A
3	Chain_C1	501	C
101	Chain_A2	200	A
# 验证数据一致性：各级目标表都相互独立
select (select count(*) from t_chain_a) as a_cnt, 
(select count(*) from t_chain_b) as b_cnt, 
(select count(*) from t_chain_c) as c_cnt;
a_cnt	b_cnt	c_cnt
3	3	3
drop table t_chain_a;
drop table t_chain_b;
drop table t_chain_c;
# 3.2 并行fork验证（A -> B, A -> C）
drop table if exists t_parallel_a;
Warnings:
Note	1051	Unknown table 'db_fork_other.t_parallel_a'
drop table if exists t_parallel_b;
Warnings:
Note	1051	Unknown table 'db_fork_other.t_parallel_b'
drop table if exists t_parallel_c;
Warnings:
Note	1051	Unknown table 'db_fork_other.t_parallel_c'
create table t_parallel_a (
id int primary key,
name varchar(50),
value int,
source varchar(10) default 'A'
) partition by range(id) (
partition p0 values less than (100),
partition p1 values less than (200)
);
insert into t_parallel_a values (1, 'Parallel_A1', 100, 'A');
insert into t_parallel_a values (101, 'Parallel_A2', 200, 'A');
# 并行fork: A -> B
fork table t_parallel_a to t_parallel_b;
# 并行fork: A -> C（从同一个源表fork）
fork table t_parallel_a to t_parallel_c;
# 验证并行fork
show create table t_parallel_a;
Table	Create Table
t_parallel_a	CREATE TABLE `t_parallel_a` (
  `id` int(11) NOT NULL,
  `name` varchar(50) DEFAULT NULL,
  `value` int(11) DEFAULT NULL,
  `source` varchar(10) DEFAULT 'A',
  PRIMARY KEY (`id`)
) ORGANIZATION INDEX DEFAULT CHARSET = utf8mb4 ROW_FORMAT = DYNAMIC COMPRESSION = 'zstd_1.3.8' REPLICA_NUM = 1 BLOCK_SIZE = 16384 USE_BLOOM_FILTER = FALSE ENABLE_MACRO_BLOCK_BLOOM_FILTER = FALSE TABLET_SIZE = 134217728 PCTFREE = 0
 partition by range(id)
(partition `p0` values less than (100),
partition `p1` values less than (200))
show create table t_parallel_b;
Table	Create Table
t_parallel_b	CREATE TABLE `t_parallel_b` (
  `id` int(11) NOT NULL,
  `name` varchar(50) DEFAULT NULL,
  `value` int(11) DEFAULT NULL,
  `source` varchar(10) DEFAULT 'A',
  PRIMARY KEY (`id`)
) ORGANIZATION INDEX DEFAULT CHARSET = utf8mb4 ROW_FORMAT = DYNAMIC COMPRESSION = 'zstd_1.3.8' REPLICA_NUM = 1 BLOCK_SIZE = 16384 USE_BLOOM_FILTER = FALSE ENABLE_MACRO_BLOCK_BLOOM_FILTER = FALSE TABLET_SIZE = 134217728 PCTFREE = 0
 partition by range(id)
(partition `p0` values less than (100),
partition `p1` values less than (200))
show create table t_parallel_c;
Table	Create Table
t_parallel_c	CREATE TABLE `t_parallel_c` (
  `id` int(11) NOT NULL,
  `name` varchar(50) DEFAULT NULL,
  `value` int(11) DEFAULT NULL,
  `source` varchar(10) DEFAULT 'A',
  PRIMARY KEY (`id`)
) ORGANIZATION INDEX DEFAULT CHARSET = utf8mb4 ROW_FORMAT = DYNAMIC COMPRESSION = 'zstd_1.3.8' REPLICA_NUM = 1 BLOCK_SIZE = 16384 USE_BLOOM_FILTER = FALSE ENABLE_MACRO_BLOCK_BLOOM_FILTER = FALSE TABLET_SIZE = 134217728 PCTFREE = 0
 partition by range(id)
(partition `p0` values less than (100),
partition `p1` values less than (200))
select * from t_parallel_a order by id;
id	name	value	source
1	Parallel_A1	100	A
101	Parallel_A2	200	A
select * from t_parallel_b order by id;
id	name	value	source
1	Parallel_A1	100	A
101	Parallel_A2	200	A
select * from t_parallel_c order by id;
id	name	value	source
1	Parallel_A1	100	A
101	Parallel_A2	200	A
# 修改源表A（验证B和C不受影响）
insert into t_parallel_a values (50, 'Parallel_A3', 150, 'A');
update t_parallel_a set value = 101 where id = 1;
# 修改表B（验证A和C不受影响）
insert into t_parallel_b values (2, 'Parallel_B1', 201, 'B');
insert into t_parallel_b values (50, 'Parallel_B1', 201, 'B');
# 修改表C（验证A和B不受影响）bug
insert into t_parallel_c values (2, 'Parallel_C1', 301, 'C');
# 验证并行fork的表数据完全独立
select count(*) as a_cnt from t_parallel_a;
a_cnt
3
select count(*) as b_cnt from t_parallel_b;
b_cnt
4
select count(*) as c_cnt from t_parallel_c;
c_cnt
3
select * from t_parallel_a order by id;
id	name	value	source
1	Parallel_A1	101	A
50	Parallel_A3	150	A
101	Parallel_A2	200	A
select * from t_parallel_b order by id;
id	name	value	source
1	Parallel_A1	100	A
2	Parallel_B1	201	B
50	Parallel_B1	201	B
101	Parallel_A2	200	A
select * from t_parallel_c order by id;
id	name	value	source
1	Parallel_A1	100	A
2	Parallel_C1	301	C
101	Parallel_A2	200	A
# 验证数据一致性：并行fork的表都相互独立
select (select count(*) from t_parallel_a) as a_cnt, 
(select count(*) from t_parallel_b) as b_cnt, 
(select count(*) from t_parallel_c) as c_cnt;
a_cnt	b_cnt	c_cnt
3	4	3
drop table t_parallel_a;
drop table t_parallel_b;
drop table t_parallel_c;
============================================
4. 跨数据库fork表(p1)
============================================
drop table if exists t_cross_db_src;
Warnings:
Note	1051	Unknown table 'db_fork_other.t_cross_db_src'
drop table if exists db_fork_other2.t_cross_db_dst;
Warnings:
Note	1051	Unknown table 'db_fork_other2.t_cross_db_dst'
# 在db_fork_other数据库中创建源表
use db_fork_other;
create table t_cross_db_src (
id int primary key,
name varchar(50),
value int,
db_name varchar(50) default 'db_fork_other'
) partition by range(id) (
partition p0 values less than (100),
partition p1 values less than (200)
);
insert into t_cross_db_src values (1, 'CrossDB_Src1', 100, 'db_fork_other');
insert into t_cross_db_src values (101, 'CrossDB_Src2', 200, 'db_fork_other');
# 验证源表数据
select count(*) as cnt from t_cross_db_src;
cnt
2
select * from t_cross_db_src order by id;
id	name	value	db_name
1	CrossDB_Src1	100	db_fork_other
101	CrossDB_Src2	200	db_fork_other
# 跨数据库fork: db_fork_other.t_cross_db_src -> db_fork_other2.t_cross_db_dst
fork table t_cross_db_src to db_fork_other2.t_cross_db_dst;
show create table t_cross_db_src;
Table	Create Table
t_cross_db_src	CREATE TABLE `t_cross_db_src` (
  `id` int(11) NOT NULL,
  `name` varchar(50) DEFAULT NULL,
  `value` int(11) DEFAULT NULL,
  `db_name` varchar(50) DEFAULT 'db_fork_other',
  PRIMARY KEY (`id`)
) ORGANIZATION INDEX DEFAULT CHARSET = utf8mb4 ROW_FORMAT = DYNAMIC COMPRESSION = 'zstd_1.3.8' REPLICA_NUM = 1 BLOCK_SIZE = 16384 USE_BLOOM_FILTER = FALSE ENABLE_MACRO_BLOCK_BLOOM_FILTER = FALSE TABLET_SIZE = 134217728 PCTFREE = 0
 partition by range(id)
(partition `p0` values less than (100),
partition `p1` values less than (200))
# 验证目标表在另一个数据库中
use db_fork_other2;
show create table t_cross_db_dst;
Table	Create Table
t_cross_db_dst	CREATE TABLE `t_cross_db_dst` (
  `id` int(11) NOT NULL,
  `name` varchar(50) DEFAULT NULL,
  `value` int(11) DEFAULT NULL,
  `db_name` varchar(50) DEFAULT 'db_fork_other',
  PRIMARY KEY (`id`)
) ORGANIZATION INDEX DEFAULT CHARSET = utf8mb4 ROW_FORMAT = DYNAMIC COMPRESSION = 'zstd_1.3.8' REPLICA_NUM = 1 BLOCK_SIZE = 16384 USE_BLOOM_FILTER = FALSE ENABLE_MACRO_BLOCK_BLOOM_FILTER = FALSE TABLET_SIZE = 134217728 PCTFREE = 0
 partition by range(id)
(partition `p0` values less than (100),
partition `p1` values less than (200))
select count(*) as cnt from t_cross_db_dst;
cnt
2
select * from t_cross_db_dst order by id;
id	name	value	db_name
1	CrossDB_Src1	100	db_fork_other
101	CrossDB_Src2	200	db_fork_other
# 验证源表数据未受影响
use db_fork_other;
select count(*) as cnt from t_cross_db_src;
cnt
2
select * from t_cross_db_src order by id;
id	name	value	db_name
1	CrossDB_Src1	100	db_fork_other
101	CrossDB_Src2	200	db_fork_other
select count(*) as cnt from t_cross_db_dst;
ERROR 42S02: Table 'db_fork_other.t_cross_db_dst' doesn't exist
select * from t_cross_db_dst order by id;
ERROR 42S02: Table 'db_fork_other.t_cross_db_dst' doesn't exist
# 修改源表（验证目标表不受影响）
insert into t_cross_db_src values (50, 'CrossDB_Src3', 150, 'db_fork_other');
update t_cross_db_src set value = 101 where id = 1;
# 修改目标表（验证源表不受影响）
use db_fork_other2;
insert into t_cross_db_dst values (50, 'CrossDB_Dst1', 201, 'db_fork_other2');
insert into t_cross_db_dst values (2, 'CrossDB_Dst1', 201, 'db_fork_other2');
update t_cross_db_dst set value = 102 where id = 1;
# 验证跨数据库fork的表数据完全独立
use db_fork_other;
select count(*) as src_cnt from t_cross_db_src;
src_cnt
3
select * from t_cross_db_src order by id;
id	name	value	db_name
1	CrossDB_Src1	101	db_fork_other
50	CrossDB_Src3	150	db_fork_other
101	CrossDB_Src2	200	db_fork_other
use db_fork_other2;
select count(*) as dst_cnt from t_cross_db_dst;
dst_cnt
4
select * from t_cross_db_dst order by id;
id	name	value	db_name
1	CrossDB_Src1	102	db_fork_other
2	CrossDB_Dst1	201	db_fork_other2
50	CrossDB_Dst1	201	db_fork_other2
101	CrossDB_Src2	200	db_fork_other
# 验证数据一致性
use db_fork_other;
select (select count(*) from t_cross_db_src) as src_cnt;
src_cnt
3
use db_fork_other2;
select (select count(*) from t_cross_db_dst) as dst_cnt;
dst_cnt
4
# 清理跨数据库fork测试
use db_fork_other;
drop table t_cross_db_src;
use db_fork_other2;
drop table t_cross_db_dst;
============================================
5. fork关键字检查，不可作为变量名(p1)
============================================
# 5.1 尝试使用fork作为表名
# 注意：fork可能不是保留关键字，但作为DDL关键字，可能不能直接作为表名
# 测试使用fork作为表名（可能需要反引号）
create table `fork` (
id int primary key,
name varchar(50)
);
# 验证可以使用反引号创建fork表
select count(*) as cnt from `fork`;
cnt
0
insert into `fork` values (1, 'Test');
select * from `fork`;
id	name
1	Test
drop table `fork`;
# 5.2 尝试使用fork作为列名
create table t_keyword (
id int primary key,
`fork` varchar(50)
);
# 验证可以使用反引号创建fork列
insert into t_keyword values (1, 'ForkColumn');
select id, `fork` from t_keyword;
id	fork
1	ForkColumn
drop table t_keyword;
# 5.3 尝试使用fork作为变量名（在存储过程中）
# 创建存储过程，尝试使用fork作为变量名
CREATE PROCEDURE test_fork_keyword()
begin
declare `fork` int default 1;
select `fork` as fork_value;
end;
//
# 调用存储过程验证
call test_fork_keyword();
fork_value
1
# 清理存储过程
drop procedure if exists test_fork_keyword;
# 5.4 验证fork作为DDL关键字，在查询中可以使用反引号作为别名
create table t_keyword (
id int primary key,
name varchar(50)
);
insert into t_keyword values (1, 'Test');
# 使用反引号可以绕过关键字限制
select id as `fork` from t_keyword;
fork
1
# 验证fork关键字在DDL语句中的使用
# fork table是DDL关键字，不能作为普通标识符使用
# 但可以通过反引号绕过限制
drop table if exists t_keyword;
============================================
6. 清理
============================================
use db_fork_other;
drop table if exists t_undo_retention;
drop table if exists t_undo_retention_fork;
drop table if exists t_perm_a;
drop table if exists t_perm_a_fork;
drop table if exists t_self_fork;
drop table if exists t_self_fork_fork;
drop table if exists t_user_b;
drop table if exists t_user_b_fork;
drop table if exists t_chain_a;
drop table if exists t_chain_b;
drop table if exists t_chain_c;
drop table if exists t_parallel_a;
drop table if exists t_parallel_b;
drop table if exists t_parallel_c;
drop table if exists t_cross_db_src;
drop table if exists t_keyword;
drop database if exists db_fork_other;
drop database if exists db_fork_other2;
drop user if exists 'test_user_a'@'%';
drop user if exists 'test_user_b'@'%';
