drop database if exists db_fork_storage;
create database db_fork_storage;
use db_fork_storage;
SET wait_timeout=30000000;
SET ob_trx_timeout = 100000000;
SET ob_query_timeout = 100000000;
alter system set debug_sync_timeout = '60s';
alter system set _ob_ddl_timeout = '5s';
============================================
1. 压缩算法测试
============================================
# 1.1 不使用压缩算法
drop table if exists t_compression_none;
Warnings:
Note	1051	Unknown table 'db_fork_storage.t_compression_none'
drop table if exists t_compression_none_fork;
Warnings:
Note	1051	Unknown table 'db_fork_storage.t_compression_none_fork'
create table t_compression_none (
id int primary key,
name varchar(100),
data varchar(500)
) COMPRESSION = 'none' partition by range(id) (
partition p0 values less than (100),
partition p1 values less than (200)
) ;
insert into t_compression_none values (1, 'Test1', repeat('A', 200));
insert into t_compression_none values (101, 'Test2', repeat('B', 200));
insert into t_compression_none values (50, 'Test3', repeat('C', 200));
# 验证源表压缩算法设置
show create table t_compression_none;
Table	Create Table
t_compression_none	CREATE TABLE `t_compression_none` (
  `id` int(11) NOT NULL,
  `name` varchar(100) DEFAULT NULL,
  `data` varchar(500) DEFAULT NULL,
  PRIMARY KEY (`id`)
) ORGANIZATION INDEX DEFAULT CHARSET = utf8mb4 ROW_FORMAT = DYNAMIC COMPRESSION = 'compression_value' REPLICA_NUM = 1 BLOCK_SIZE = 16384 USE_BLOOM_FILTER = FALSE ENABLE_MACRO_BLOCK_BLOOM_FILTER = FALSE TABLET_SIZE = 134217728 PCTFREE = 0
 partition by range(id)
(partition `p0` values less than (100),
partition `p1` values less than (200))
# 验证源表数据
select count(*) as cnt from t_compression_none;
cnt
3
select id, name, length(data) as data_len from t_compression_none order by id;
id	name	data_len
1	Test1	200
50	Test3	200
101	Test2	200
# Fork表
fork table t_compression_none to t_compression_none_fork;
# 验证目标表压缩算法设置（应与源表一致）
show create table t_compression_none_fork;
Table	Create Table
t_compression_none_fork	CREATE TABLE `t_compression_none_fork` (
  `id` int(11) NOT NULL,
  `name` varchar(100) DEFAULT NULL,
  `data` varchar(500) DEFAULT NULL,
  PRIMARY KEY (`id`)
) ORGANIZATION INDEX DEFAULT CHARSET = utf8mb4 ROW_FORMAT = DYNAMIC COMPRESSION = 'compression_value' REPLICA_NUM = 1 BLOCK_SIZE = 16384 USE_BLOOM_FILTER = FALSE ENABLE_MACRO_BLOCK_BLOOM_FILTER = FALSE TABLET_SIZE = 134217728 PCTFREE = 0
 partition by range(id)
(partition `p0` values less than (100),
partition `p1` values less than (200))
# 验证目标表数据
select count(*) as cnt from t_compression_none_fork;
cnt
3
select id, name, length(data) as data_len from t_compression_none_fork order by id;
id	name	data_len
1	Test1	200
50	Test3	200
101	Test2	200
# 验证数据一致性
select (select count(*) from t_compression_none) as src_cnt, (select count(*) from t_compression_none_fork) as fork_cnt;
src_cnt	fork_cnt
3	3
# 注意：压缩算法验证说明
# 1. show create table 只能验证表结构中的压缩算法配置，不能验证存储层实际压缩效果
# 2. 压缩算法在存储层的实际生效需要数据落盘（major freeze/minor freeze）后才能体现
# 3. 要验证实际压缩效果，需要：
#    - 触发major freeze让数据落盘：alter system major freeze;
#    - 查询系统表查看压缩信息（需要存储层支持）
#    - 或比较不同压缩算法下的存储空间使用情况
# 4. 当前测试主要验证fork后表结构中的压缩算法配置是否正确继承
drop table t_compression_none;
drop table t_compression_none_fork;
# 1.2 lz4_1.0压缩算法
drop table if exists t_compression_lz4;
Warnings:
Note	1051	Unknown table 'db_fork_storage.t_compression_lz4'
drop table if exists t_compression_lz4_fork;
Warnings:
Note	1051	Unknown table 'db_fork_storage.t_compression_lz4_fork'
create table t_compression_lz4 (
id int primary key,
name varchar(100),
data varchar(500)
) COMPRESSION = 'lz4_1.0'  partition by range(id) (
partition p0 values less than (100),
partition p1 values less than (200)
) ;
insert into t_compression_lz4 values (1, 'Test1', repeat('A', 200));
insert into t_compression_lz4 values (101, 'Test2', repeat('B', 200));
insert into t_compression_lz4 values (50, 'Test3', repeat('C', 200));
# 验证源表压缩算法设置
show create table t_compression_lz4;
Table	Create Table
t_compression_lz4	CREATE TABLE `t_compression_lz4` (
  `id` int(11) NOT NULL,
  `name` varchar(100) DEFAULT NULL,
  `data` varchar(500) DEFAULT NULL,
  PRIMARY KEY (`id`)
) ORGANIZATION INDEX DEFAULT CHARSET = utf8mb4 ROW_FORMAT = DYNAMIC COMPRESSION = 'compression_value' REPLICA_NUM = 1 BLOCK_SIZE = 16384 USE_BLOOM_FILTER = FALSE ENABLE_MACRO_BLOCK_BLOOM_FILTER = FALSE TABLET_SIZE = 134217728 PCTFREE = 0
 partition by range(id)
(partition `p0` values less than (100),
partition `p1` values less than (200))
# 验证源表数据
select count(*) as cnt from t_compression_lz4;
cnt
3
select id, name, length(data) as data_len from t_compression_lz4 order by id;
id	name	data_len
1	Test1	200
50	Test3	200
101	Test2	200
# Fork表
fork table t_compression_lz4 to t_compression_lz4_fork;
# 验证目标表压缩算法设置
show create table t_compression_lz4_fork;
Table	Create Table
t_compression_lz4_fork	CREATE TABLE `t_compression_lz4_fork` (
  `id` int(11) NOT NULL,
  `name` varchar(100) DEFAULT NULL,
  `data` varchar(500) DEFAULT NULL,
  PRIMARY KEY (`id`)
) ORGANIZATION INDEX DEFAULT CHARSET = utf8mb4 ROW_FORMAT = DYNAMIC COMPRESSION = 'compression_value' REPLICA_NUM = 1 BLOCK_SIZE = 16384 USE_BLOOM_FILTER = FALSE ENABLE_MACRO_BLOCK_BLOOM_FILTER = FALSE TABLET_SIZE = 134217728 PCTFREE = 0
 partition by range(id)
(partition `p0` values less than (100),
partition `p1` values less than (200))
# 验证目标表数据
select count(*) as cnt from t_compression_lz4_fork;
cnt
3
select id, name, length(data) as data_len from t_compression_lz4_fork order by id;
id	name	data_len
1	Test1	200
50	Test3	200
101	Test2	200
# 验证数据一致性
select (select count(*) from t_compression_lz4) as src_cnt, (select count(*) from t_compression_lz4_fork) as fork_cnt;
src_cnt	fork_cnt
3	3
drop table t_compression_lz4;
drop table t_compression_lz4_fork;
# 1.3 zstd_1.0压缩算法
drop table if exists t_compression_zstd;
Warnings:
Note	1051	Unknown table 'db_fork_storage.t_compression_zstd'
drop table if exists t_compression_zstd_fork;
Warnings:
Note	1051	Unknown table 'db_fork_storage.t_compression_zstd_fork'
create table t_compression_zstd (
id int primary key,
name varchar(100),
data varchar(500)
) COMPRESSION = 'zstd_1.0' partition by range(id) (
partition p0 values less than (100),
partition p1 values less than (200)
) ;
insert into t_compression_zstd values (1, 'Test1', repeat('A', 200));
insert into t_compression_zstd values (101, 'Test2', repeat('B', 200));
insert into t_compression_zstd values (50, 'Test3', repeat('C', 200));
# 验证源表压缩算法设置
show create table t_compression_zstd;
Table	Create Table
t_compression_zstd	CREATE TABLE `t_compression_zstd` (
  `id` int(11) NOT NULL,
  `name` varchar(100) DEFAULT NULL,
  `data` varchar(500) DEFAULT NULL,
  PRIMARY KEY (`id`)
) ORGANIZATION INDEX DEFAULT CHARSET = utf8mb4 ROW_FORMAT = DYNAMIC COMPRESSION = 'compression_value' REPLICA_NUM = 1 BLOCK_SIZE = 16384 USE_BLOOM_FILTER = FALSE ENABLE_MACRO_BLOCK_BLOOM_FILTER = FALSE TABLET_SIZE = 134217728 PCTFREE = 0
 partition by range(id)
(partition `p0` values less than (100),
partition `p1` values less than (200))
# 验证源表数据
select count(*) as cnt from t_compression_zstd;
cnt
3
select id, name, length(data) as data_len from t_compression_zstd order by id;
id	name	data_len
1	Test1	200
50	Test3	200
101	Test2	200
# Fork表
fork table t_compression_zstd to t_compression_zstd_fork;
# 验证目标表压缩算法设置
show create table t_compression_zstd_fork;
Table	Create Table
t_compression_zstd_fork	CREATE TABLE `t_compression_zstd_fork` (
  `id` int(11) NOT NULL,
  `name` varchar(100) DEFAULT NULL,
  `data` varchar(500) DEFAULT NULL,
  PRIMARY KEY (`id`)
) ORGANIZATION INDEX DEFAULT CHARSET = utf8mb4 ROW_FORMAT = DYNAMIC COMPRESSION = 'compression_value' REPLICA_NUM = 1 BLOCK_SIZE = 16384 USE_BLOOM_FILTER = FALSE ENABLE_MACRO_BLOCK_BLOOM_FILTER = FALSE TABLET_SIZE = 134217728 PCTFREE = 0
 partition by range(id)
(partition `p0` values less than (100),
partition `p1` values less than (200))
# 验证目标表数据
select count(*) as cnt from t_compression_zstd_fork;
cnt
3
select id, name, length(data) as data_len from t_compression_zstd_fork order by id;
id	name	data_len
1	Test1	200
50	Test3	200
101	Test2	200
# 验证数据一致性
select (select count(*) from t_compression_zstd) as src_cnt, (select count(*) from t_compression_zstd_fork) as fork_cnt;
src_cnt	fork_cnt
3	3
drop table t_compression_zstd;
drop table t_compression_zstd_fork;
# 1.4 snappy_1.0压缩算法
drop table if exists t_compression_snappy;
Warnings:
Note	1051	Unknown table 'db_fork_storage.t_compression_snappy'
drop table if exists t_compression_snappy_fork;
Warnings:
Note	1051	Unknown table 'db_fork_storage.t_compression_snappy_fork'
create table t_compression_snappy (
id int primary key,
name varchar(100),
data varchar(500)
) COMPRESSION = 'snappy_1.0' partition by range(id) (
partition p0 values less than (100),
partition p1 values less than (200)
);
insert into t_compression_snappy values (1, 'Test1', repeat('A', 200));
insert into t_compression_snappy values (101, 'Test2', repeat('B', 200));
insert into t_compression_snappy values (50, 'Test3', repeat('C', 200));
# 验证源表压缩算法设置
show create table t_compression_snappy;
Table	Create Table
t_compression_snappy	CREATE TABLE `t_compression_snappy` (
  `id` int(11) NOT NULL,
  `name` varchar(100) DEFAULT NULL,
  `data` varchar(500) DEFAULT NULL,
  PRIMARY KEY (`id`)
) ORGANIZATION INDEX DEFAULT CHARSET = utf8mb4 ROW_FORMAT = DYNAMIC COMPRESSION = 'compression_value' REPLICA_NUM = 1 BLOCK_SIZE = 16384 USE_BLOOM_FILTER = FALSE ENABLE_MACRO_BLOCK_BLOOM_FILTER = FALSE TABLET_SIZE = 134217728 PCTFREE = 0
 partition by range(id)
(partition `p0` values less than (100),
partition `p1` values less than (200))
# 验证源表数据
select count(*) as cnt from t_compression_snappy;
cnt
3
select id, name, length(data) as data_len from t_compression_snappy order by id;
id	name	data_len
1	Test1	200
50	Test3	200
101	Test2	200
# Fork表
fork table t_compression_snappy to t_compression_snappy_fork;
# 验证目标表压缩算法设置
show create table t_compression_snappy_fork;
Table	Create Table
t_compression_snappy_fork	CREATE TABLE `t_compression_snappy_fork` (
  `id` int(11) NOT NULL,
  `name` varchar(100) DEFAULT NULL,
  `data` varchar(500) DEFAULT NULL,
  PRIMARY KEY (`id`)
) ORGANIZATION INDEX DEFAULT CHARSET = utf8mb4 ROW_FORMAT = DYNAMIC COMPRESSION = 'compression_value' REPLICA_NUM = 1 BLOCK_SIZE = 16384 USE_BLOOM_FILTER = FALSE ENABLE_MACRO_BLOCK_BLOOM_FILTER = FALSE TABLET_SIZE = 134217728 PCTFREE = 0
 partition by range(id)
(partition `p0` values less than (100),
partition `p1` values less than (200))
# 验证目标表数据
select count(*) as cnt from t_compression_snappy_fork;
cnt
3
select id, name, length(data) as data_len from t_compression_snappy_fork order by id;
id	name	data_len
1	Test1	200
50	Test3	200
101	Test2	200
# 验证数据一致性
select (select count(*) from t_compression_snappy) as src_cnt, (select count(*) from t_compression_snappy_fork) as fork_cnt;
src_cnt	fork_cnt
3	3
drop table t_compression_snappy;
drop table t_compression_snappy_fork;
# 1.5 zstd_1.3.8压缩算法
drop table if exists t_compression_zstd_138;
Warnings:
Note	1051	Unknown table 'db_fork_storage.t_compression_zstd_138'
drop table if exists t_compression_zstd_138_fork;
Warnings:
Note	1051	Unknown table 'db_fork_storage.t_compression_zstd_138_fork'
create table t_compression_zstd_138 (
id int primary key,
name varchar(100),
data varchar(500)
) COMPRESSION = 'zstd_1.3.8' partition by range(id) (
partition p0 values less than (100),
partition p1 values less than (200)
);
insert into t_compression_zstd_138 values (1, 'Test1', repeat('A', 200));
insert into t_compression_zstd_138 values (101, 'Test2', repeat('B', 200));
insert into t_compression_zstd_138 values (50, 'Test3', repeat('C', 200));
# 验证源表压缩算法设置
show create table t_compression_zstd_138;
Table	Create Table
t_compression_zstd_138	CREATE TABLE `t_compression_zstd_138` (
  `id` int(11) NOT NULL,
  `name` varchar(100) DEFAULT NULL,
  `data` varchar(500) DEFAULT NULL,
  PRIMARY KEY (`id`)
) ORGANIZATION INDEX DEFAULT CHARSET = utf8mb4 ROW_FORMAT = DYNAMIC COMPRESSION = 'compression_value' REPLICA_NUM = 1 BLOCK_SIZE = 16384 USE_BLOOM_FILTER = FALSE ENABLE_MACRO_BLOCK_BLOOM_FILTER = FALSE TABLET_SIZE = 134217728 PCTFREE = 0
 partition by range(id)
(partition `p0` values less than (100),
partition `p1` values less than (200))
# 验证源表数据
select count(*) as cnt from t_compression_zstd_138;
cnt
3
select id, name, length(data) as data_len from t_compression_zstd_138 order by id;
id	name	data_len
1	Test1	200
50	Test3	200
101	Test2	200
# Fork表
fork table t_compression_zstd_138 to t_compression_zstd_138_fork;
# 验证目标表压缩算法设置
show create table t_compression_zstd_138_fork;
Table	Create Table
t_compression_zstd_138_fork	CREATE TABLE `t_compression_zstd_138_fork` (
  `id` int(11) NOT NULL,
  `name` varchar(100) DEFAULT NULL,
  `data` varchar(500) DEFAULT NULL,
  PRIMARY KEY (`id`)
) ORGANIZATION INDEX DEFAULT CHARSET = utf8mb4 ROW_FORMAT = DYNAMIC COMPRESSION = 'compression_value' REPLICA_NUM = 1 BLOCK_SIZE = 16384 USE_BLOOM_FILTER = FALSE ENABLE_MACRO_BLOCK_BLOOM_FILTER = FALSE TABLET_SIZE = 134217728 PCTFREE = 0
 partition by range(id)
(partition `p0` values less than (100),
partition `p1` values less than (200))
# 验证目标表数据
select count(*) as cnt from t_compression_zstd_138_fork;
cnt
3
select id, name, length(data) as data_len from t_compression_zstd_138_fork order by id;
id	name	data_len
1	Test1	200
50	Test3	200
101	Test2	200
# 验证数据一致性
select (select count(*) from t_compression_zstd_138) as src_cnt, (select count(*) from t_compression_zstd_138_fork) as fork_cnt;
src_cnt	fork_cnt
3	3
# 注意：修改压缩算法后，存储层实际生效的时间需要确认
# 可能需要等待major freeze或minor freeze后新数据才使用新压缩算法
# 这里仅验证表结构设置，实际压缩效果需要存储层确认
drop table t_compression_zstd_138;
drop table t_compression_zstd_138_fork;
============================================
2. 存储方式测试
============================================
# 2.1 行存表（WITH COLUMN GROUP(all columns)）
drop table if exists t_storage_row;
Warnings:
Note	1051	Unknown table 'db_fork_storage.t_storage_row'
drop table if exists t_storage_row_fork;
Warnings:
Note	1051	Unknown table 'db_fork_storage.t_storage_row_fork'
create table t_storage_row (
id int primary key,
name varchar(50),
value int,
data varchar(100)
) partition by range(id) (
partition p0 values less than (100),
partition p1 values less than (200)
) WITH COLUMN GROUP(all columns);
# 插入初始数据
insert into t_storage_row values (1, 'Row1', 100, 'Data1');
insert into t_storage_row values (101, 'Row2', 200, 'Data2');
insert into t_storage_row values (50, 'Row3', 300, 'Data3');
# 验证源表存储方式设置
show create table t_storage_row;
Table	Create Table
t_storage_row	CREATE TABLE `t_storage_row` (
  `id` int(11) NOT NULL,
  `name` varchar(50) DEFAULT NULL,
  `value` int(11) DEFAULT NULL,
  `data` varchar(100) DEFAULT NULL,
  PRIMARY KEY (`id`)
) ORGANIZATION INDEX DEFAULT CHARSET = utf8mb4 ROW_FORMAT = DYNAMIC COMPRESSION = 'zstd_1.3.8' REPLICA_NUM = 1 BLOCK_SIZE = 16384 USE_BLOOM_FILTER = FALSE ENABLE_MACRO_BLOCK_BLOOM_FILTER = FALSE TABLET_SIZE = 134217728 PCTFREE = 0
 partition by range(id)
(partition `p0` values less than (100),
partition `p1` values less than (200)) WITH COLUMN GROUP(column_group_type)
# 验证源表数据
select count(*) as cnt from t_storage_row;
cnt
3
select * from t_storage_row order by id;
id	name	value	data
1	Row1	100	Data1
50	Row3	300	Data3
101	Row2	200	Data2
# Fork表
fork table t_storage_row to t_storage_row_fork;
# 验证目标表存储方式设置（应与源表一致）
show create table t_storage_row_fork;
Table	Create Table
t_storage_row_fork	CREATE TABLE `t_storage_row_fork` (
  `id` int(11) NOT NULL,
  `name` varchar(50) DEFAULT NULL,
  `value` int(11) DEFAULT NULL,
  `data` varchar(100) DEFAULT NULL,
  PRIMARY KEY (`id`)
) ORGANIZATION INDEX DEFAULT CHARSET = utf8mb4 ROW_FORMAT = DYNAMIC COMPRESSION = 'zstd_1.3.8' REPLICA_NUM = 1 BLOCK_SIZE = 16384 USE_BLOOM_FILTER = FALSE ENABLE_MACRO_BLOCK_BLOOM_FILTER = FALSE TABLET_SIZE = 134217728 PCTFREE = 0
 partition by range(id)
(partition `p0` values less than (100),
partition `p1` values less than (200)) WITH COLUMN GROUP(column_group_type)
# 验证目标表数据
select count(*) as cnt from t_storage_row_fork;
cnt
3
select * from t_storage_row_fork order by id;
id	name	value	data
1	Row1	100	Data1
50	Row3	300	Data3
101	Row2	200	Data2
# 验证数据一致性
select (select count(*) from t_storage_row) as src_cnt, (select count(*) from t_storage_row_fork) as fork_cnt;
src_cnt	fork_cnt
3	3
# 在源表和目标表插入相同主键数据（验证数据隔离）
insert into t_storage_row values (2, 'Source_Row2', 150, 'Source_Data2');
insert into t_storage_row_fork values (2, 'Fork_Row2', 250, 'Fork_Data2');
# 验证插入后数据隔离
select id, name, value, data from t_storage_row where id = 2;
id	name	value	data
2	Source_Row2	150	Source_Data2
select id, name, value, data from t_storage_row_fork where id = 2;
id	name	value	data
2	Fork_Row2	250	Fork_Data2
# DML操作测试：更新源表
update t_storage_row set value = 120, data = 'Updated_Source_Data1' where id = 1;
select id, name, value, data from t_storage_row where id = 1;
id	name	value	data
1	Row1	120	Updated_Source_Data1
# DML操作测试：更新目标表
update t_storage_row_fork set value = 220, data = 'Updated_Fork_Data1' where id = 1;
select id, name, value, data from t_storage_row_fork where id = 1;
id	name	value	data
1	Row1	220	Updated_Fork_Data1
# DML操作测试：删除源表数据
delete from t_storage_row where id = 50;
select count(*) as cnt from t_storage_row;
cnt
3
select count(*) as cnt from t_storage_row_fork;
cnt
4
# DML操作测试：删除目标表数据
delete from t_storage_row_fork where id = 101;
select count(*) as cnt from t_storage_row;
cnt
3
select count(*) as cnt from t_storage_row_fork;
cnt
3
# DDL操作测试：在源表添加列
alter table t_storage_row add column new_col varchar(50) default 'default_value';
show create table t_storage_row;
Table	Create Table
t_storage_row	CREATE TABLE `t_storage_row` (
  `id` int(11) NOT NULL,
  `name` varchar(50) DEFAULT NULL,
  `value` int(11) DEFAULT NULL,
  `data` varchar(100) DEFAULT NULL,
  `new_col` varchar(50) DEFAULT 'default_value',
  PRIMARY KEY (`id`)
) ORGANIZATION INDEX DEFAULT CHARSET = utf8mb4 ROW_FORMAT = DYNAMIC COMPRESSION = 'zstd_1.3.8' REPLICA_NUM = 1 BLOCK_SIZE = 16384 USE_BLOOM_FILTER = FALSE ENABLE_MACRO_BLOCK_BLOOM_FILTER = FALSE TABLET_SIZE = 134217728 PCTFREE = 0
 partition by range(id)
(partition `p0` values less than (100),
partition `p1` values less than (200)) WITH COLUMN GROUP(all columns)
show create table t_storage_row_fork;
Table	Create Table
t_storage_row_fork	CREATE TABLE `t_storage_row_fork` (
  `id` int(11) NOT NULL,
  `name` varchar(50) DEFAULT NULL,
  `value` int(11) DEFAULT NULL,
  `data` varchar(100) DEFAULT NULL,
  PRIMARY KEY (`id`)
) ORGANIZATION INDEX DEFAULT CHARSET = utf8mb4 ROW_FORMAT = DYNAMIC COMPRESSION = 'zstd_1.3.8' REPLICA_NUM = 1 BLOCK_SIZE = 16384 USE_BLOOM_FILTER = FALSE ENABLE_MACRO_BLOCK_BLOOM_FILTER = FALSE TABLET_SIZE = 134217728 PCTFREE = 0
 partition by range(id)
(partition `p0` values less than (100),
partition `p1` values less than (200)) WITH COLUMN GROUP(all columns)
# DDL操作测试：在目标表添加列
alter table t_storage_row_fork add column fork_col int default 999;
show create table t_storage_row;
Table	Create Table
t_storage_row	CREATE TABLE `t_storage_row` (
  `id` int(11) NOT NULL,
  `name` varchar(50) DEFAULT NULL,
  `value` int(11) DEFAULT NULL,
  `data` varchar(100) DEFAULT NULL,
  `new_col` varchar(50) DEFAULT 'default_value',
  PRIMARY KEY (`id`)
) ORGANIZATION INDEX DEFAULT CHARSET = utf8mb4 ROW_FORMAT = DYNAMIC COMPRESSION = 'zstd_1.3.8' REPLICA_NUM = 1 BLOCK_SIZE = 16384 USE_BLOOM_FILTER = FALSE ENABLE_MACRO_BLOCK_BLOOM_FILTER = FALSE TABLET_SIZE = 134217728 PCTFREE = 0
 partition by range(id)
(partition `p0` values less than (100),
partition `p1` values less than (200)) WITH COLUMN GROUP(all columns)
show create table t_storage_row_fork;
Table	Create Table
t_storage_row_fork	CREATE TABLE `t_storage_row_fork` (
  `id` int(11) NOT NULL,
  `name` varchar(50) DEFAULT NULL,
  `value` int(11) DEFAULT NULL,
  `data` varchar(100) DEFAULT NULL,
  `fork_col` int(11) DEFAULT '999',
  PRIMARY KEY (`id`)
) ORGANIZATION INDEX DEFAULT CHARSET = utf8mb4 ROW_FORMAT = DYNAMIC COMPRESSION = 'zstd_1.3.8' REPLICA_NUM = 1 BLOCK_SIZE = 16384 USE_BLOOM_FILTER = FALSE ENABLE_MACRO_BLOCK_BLOOM_FILTER = FALSE TABLET_SIZE = 134217728 PCTFREE = 0
 partition by range(id)
(partition `p0` values less than (100),
partition `p1` values less than (200)) WITH COLUMN GROUP(all columns)
# 验证最终数据
select id, name, value, data, new_col from t_storage_row order by id;
id	name	value	data	new_col
1	Row1	120	Updated_Source_Data1	default_value
2	Source_Row2	150	Source_Data2	default_value
101	Row2	200	Data2	default_value
select id, name, value, data, fork_col from t_storage_row_fork order by id;
id	name	value	data	fork_col
1	Row1	220	Updated_Fork_Data1	999
2	Fork_Row2	250	Fork_Data2	999
50	Row3	300	Data3	999
drop table t_storage_row;
drop table t_storage_row_fork;
# 2.2 列存表（WITH COLUMN GROUP(each column)）
drop table if exists t_storage_column;
Warnings:
Note	1051	Unknown table 'db_fork_storage.t_storage_column'
create table t_storage_column (
id int primary key,
name varchar(50),
value int,
data varchar(100)
) partition by range(id) (
partition p0 values less than (100),
partition p1 values less than (200)
) WITH COLUMN GROUP(each column);
# 插入初始数据
insert into t_storage_column values (1, 'Column1', 100, 'Data1');
insert into t_storage_column values (101, 'Column2', 200, 'Data2');
insert into t_storage_column values (50, 'Column3', 300, 'Data3');
# 验证源表存储方式设置
show create table t_storage_column;
Table	Create Table
t_storage_column	CREATE TABLE `t_storage_column` (
  `id` int(11) NOT NULL,
  `name` varchar(50) DEFAULT NULL,
  `value` int(11) DEFAULT NULL,
  `data` varchar(100) DEFAULT NULL,
  PRIMARY KEY (`id`)
) ORGANIZATION INDEX DEFAULT CHARSET = utf8mb4 ROW_FORMAT = DYNAMIC COMPRESSION = 'zstd_1.3.8' REPLICA_NUM = 1 BLOCK_SIZE = 16384 USE_BLOOM_FILTER = FALSE ENABLE_MACRO_BLOCK_BLOOM_FILTER = FALSE TABLET_SIZE = 134217728 PCTFREE = 0
 partition by range(id)
(partition `p0` values less than (100),
partition `p1` values less than (200)) WITH COLUMN GROUP(column_group_type)
# 验证源表数据
select count(*) as cnt from t_storage_column;
cnt
3
select * from t_storage_column order by id;
id	name	value	data
1	Column1	100	Data1
50	Column3	300	Data3
101	Column2	200	Data2
# Fork表
# 验证目标表存储方式设置（应与源表一致）
# 验证目标表数据
# 验证数据一致性
# 在源表和目标表插入相同主键数据（验证数据隔离）
# 验证插入后数据隔离
select id, name, value, data from t_storage_column where id = 2;
id	name	value	data
# DML操作测试：更新源表
update t_storage_column set value = 120, data = 'Updated_Source_Data1' where id = 1;
select id, name, value, data from t_storage_column where id = 1;
id	name	value	data
1	Column1	120	Updated_Source_Data1
# DML操作测试：更新目标表
# DML操作测试：删除源表数据
delete from t_storage_column where id = 50;
select count(*) as cnt from t_storage_column;
cnt
2
# DML操作测试：删除目标表数据
select count(*) as cnt from t_storage_column;
cnt
2
# DDL操作测试：在源表添加列
alter table t_storage_column add column new_col varchar(50) default 'default_value';
show create table t_storage_column;
Table	Create Table
t_storage_column	CREATE TABLE `t_storage_column` (
  `id` int(11) NOT NULL,
  `name` varchar(50) DEFAULT NULL,
  `value` int(11) DEFAULT NULL,
  `data` varchar(100) DEFAULT NULL,
  `new_col` varchar(50) DEFAULT 'default_value',
  PRIMARY KEY (`id`)
) ORGANIZATION INDEX DEFAULT CHARSET = utf8mb4 ROW_FORMAT = DYNAMIC COMPRESSION = 'zstd_1.3.8' REPLICA_NUM = 1 BLOCK_SIZE = 16384 USE_BLOOM_FILTER = FALSE ENABLE_MACRO_BLOCK_BLOOM_FILTER = FALSE TABLET_SIZE = 134217728 PCTFREE = 0
 partition by range(id)
(partition `p0` values less than (100),
partition `p1` values less than (200)) WITH COLUMN GROUP(each column)
# DDL操作测试：在目标表添加列
show create table t_storage_column;
Table	Create Table
t_storage_column	CREATE TABLE `t_storage_column` (
  `id` int(11) NOT NULL,
  `name` varchar(50) DEFAULT NULL,
  `value` int(11) DEFAULT NULL,
  `data` varchar(100) DEFAULT NULL,
  `new_col` varchar(50) DEFAULT 'default_value',
  PRIMARY KEY (`id`)
) ORGANIZATION INDEX DEFAULT CHARSET = utf8mb4 ROW_FORMAT = DYNAMIC COMPRESSION = 'zstd_1.3.8' REPLICA_NUM = 1 BLOCK_SIZE = 16384 USE_BLOOM_FILTER = FALSE ENABLE_MACRO_BLOCK_BLOOM_FILTER = FALSE TABLET_SIZE = 134217728 PCTFREE = 0
 partition by range(id)
(partition `p0` values less than (100),
partition `p1` values less than (200)) WITH COLUMN GROUP(each column)
# 验证最终数据
select id, name, value, data, new_col from t_storage_column order by id;
id	name	value	data	new_col
1	Column1	120	Updated_Source_Data1	default_value
101	Column2	200	Data2	default_value
drop table t_storage_column;
# 2.3 混合存储（ROW_FORMAT = DYNAMIC）
drop table if exists t_storage_mixed;
Warnings:
Note	1051	Unknown table 'db_fork_storage.t_storage_mixed'
drop table if exists t_storage_mixed_fork;
Warnings:
Note	1051	Unknown table 'db_fork_storage.t_storage_mixed_fork'
create table t_storage_mixed (
id int primary key,
name varchar(50),
value int,
data varchar(100)
)ROW_FORMAT = DYNAMIC partition by range(id) (
partition p0 values less than (100),
partition p1 values less than (200)
);
insert into t_storage_mixed values (1, 'Mixed1', 100, 'Data1');
insert into t_storage_mixed values (101, 'Mixed2', 200, 'Data2');
insert into t_storage_mixed values (50, 'Mixed3', 300, 'Data3');
# 验证源表存储方式设置
show create table t_storage_mixed;
Table	Create Table
t_storage_mixed	CREATE TABLE `t_storage_mixed` (
  `id` int(11) NOT NULL,
  `name` varchar(50) DEFAULT NULL,
  `value` int(11) DEFAULT NULL,
  `data` varchar(100) DEFAULT NULL,
  PRIMARY KEY (`id`)
) ORGANIZATION storage_type DEFAULT CHARSET = utf8mb4 ROW_FORMAT = DYNAMIC COMPRESSION = 'zstd_1.3.8' REPLICA_NUM = 1 BLOCK_SIZE = 16384 USE_BLOOM_FILTER = FALSE ENABLE_MACRO_BLOCK_BLOOM_FILTER = FALSE TABLET_SIZE = 134217728 PCTFREE = 0
 partition by range(id)
(partition `p0` values less than (100),
partition `p1` values less than (200))
# 验证源表数据
select count(*) as cnt from t_storage_mixed;
cnt
3
select * from t_storage_mixed order by id;
id	name	value	data
1	Mixed1	100	Data1
50	Mixed3	300	Data3
101	Mixed2	200	Data2
# Fork表
fork table t_storage_mixed to t_storage_mixed_fork;
# 验证目标表存储方式设置
show create table t_storage_mixed_fork;
Table	Create Table
t_storage_mixed_fork	CREATE TABLE `t_storage_mixed_fork` (
  `id` int(11) NOT NULL,
  `name` varchar(50) DEFAULT NULL,
  `value` int(11) DEFAULT NULL,
  `data` varchar(100) DEFAULT NULL,
  PRIMARY KEY (`id`)
) ORGANIZATION storage_type DEFAULT CHARSET = utf8mb4 ROW_FORMAT = DYNAMIC COMPRESSION = 'zstd_1.3.8' REPLICA_NUM = 1 BLOCK_SIZE = 16384 USE_BLOOM_FILTER = FALSE ENABLE_MACRO_BLOCK_BLOOM_FILTER = FALSE TABLET_SIZE = 134217728 PCTFREE = 0
 partition by range(id)
(partition `p0` values less than (100),
partition `p1` values less than (200))
# 验证目标表数据
select count(*) as cnt from t_storage_mixed_fork;
cnt
3
select * from t_storage_mixed_fork order by id;
id	name	value	data
1	Mixed1	100	Data1
50	Mixed3	300	Data3
101	Mixed2	200	Data2
# 验证数据一致性
select (select count(*) from t_storage_mixed) as src_cnt, (select count(*) from t_storage_mixed_fork) as fork_cnt;
src_cnt	fork_cnt
3	3
drop table t_storage_mixed;
drop table t_storage_mixed_fork;
============================================
3. 字符集类型测试
============================================
# 3.1 utf8mb4字符集
drop table if exists t_charset_utf8mb4;
Warnings:
Note	1051	Unknown table 'db_fork_storage.t_charset_utf8mb4'
drop table if exists t_charset_utf8mb4_fork;
Warnings:
Note	1051	Unknown table 'db_fork_storage.t_charset_utf8mb4_fork'
create table t_charset_utf8mb4 (
id int primary key,
name varchar(50) charset utf8mb4,
data varchar(100) charset utf8mb4
) DEFAULT CHARSET = utf8mb4 partition by range(id) (
partition p0 values less than (100),
partition p1 values less than (200)
) ;
insert into t_charset_utf8mb4 values (1, '测试UTF8MB4', '数据1');
insert into t_charset_utf8mb4 values (101, 'TestUTF8MB4', 'Data2');
insert into t_charset_utf8mb4 values (50, '😀🎉测试', 'Emoji数据');
# 验证源表字符集设置
show create table t_charset_utf8mb4;
Table	Create Table
t_charset_utf8mb4	CREATE TABLE `t_charset_utf8mb4` (
  `id` int(11) NOT NULL,
  `name` varchar(50) DEFAULT NULL,
  `data` varchar(100) DEFAULT NULL,
  PRIMARY KEY (`id`)
) ORGANIZATION INDEX DEFAULT CHARSET = charset_name ROW_FORMAT = DYNAMIC COMPRESSION = 'zstd_1.3.8' REPLICA_NUM = 1 BLOCK_SIZE = 16384 USE_BLOOM_FILTER = FALSE ENABLE_MACRO_BLOCK_BLOOM_FILTER = FALSE TABLET_SIZE = 134217728 PCTFREE = 0
 partition by range(id)
(partition `p0` values less than (100),
partition `p1` values less than (200))
# 验证源表数据
select count(*) as cnt from t_charset_utf8mb4;
cnt
3
select * from t_charset_utf8mb4 order by id;
id	name	data
1	测试UTF8MB4	数据1
50	😀🎉测试	Emoji数据
101	TestUTF8MB4	Data2
# Fork表
fork table t_charset_utf8mb4 to t_charset_utf8mb4_fork;
# 验证目标表字符集设置
show create table t_charset_utf8mb4_fork;
Table	Create Table
t_charset_utf8mb4_fork	CREATE TABLE `t_charset_utf8mb4_fork` (
  `id` int(11) NOT NULL,
  `name` varchar(50) DEFAULT NULL,
  `data` varchar(100) DEFAULT NULL,
  PRIMARY KEY (`id`)
) ORGANIZATION INDEX DEFAULT CHARSET = charset_name ROW_FORMAT = DYNAMIC COMPRESSION = 'zstd_1.3.8' REPLICA_NUM = 1 BLOCK_SIZE = 16384 USE_BLOOM_FILTER = FALSE ENABLE_MACRO_BLOCK_BLOOM_FILTER = FALSE TABLET_SIZE = 134217728 PCTFREE = 0
 partition by range(id)
(partition `p0` values less than (100),
partition `p1` values less than (200))
# 验证目标表数据
select count(*) as cnt from t_charset_utf8mb4_fork;
cnt
3
select * from t_charset_utf8mb4_fork order by id;
id	name	data
1	测试UTF8MB4	数据1
50	😀🎉测试	Emoji数据
101	TestUTF8MB4	Data2
# 验证数据一致性
select (select count(*) from t_charset_utf8mb4) as src_cnt, (select count(*) from t_charset_utf8mb4_fork) as fork_cnt;
src_cnt	fork_cnt
3	3
drop table t_charset_utf8mb4;
drop table t_charset_utf8mb4_fork;
# 3.2 utf8mb3字符集
drop table if exists t_charset_utf8mb3;
Warnings:
Note	1051	Unknown table 'db_fork_storage.t_charset_utf8mb3'
drop table if exists t_charset_utf8mb3_fork;
Warnings:
Note	1051	Unknown table 'db_fork_storage.t_charset_utf8mb3_fork'
create table t_charset_utf8mb3 (
id int primary key,
name varchar(50) charset utf8mb3,
data varchar(100) charset utf8mb3
) DEFAULT CHARSET = utf8mb3 partition by range(id) (
partition p0 values less than (100),
partition p1 values less than (200)
);
insert into t_charset_utf8mb3 values (1, 'TestUTF8MB3', 'Data1');
insert into t_charset_utf8mb3 values (101, '测试UTF8MB3', '数据2');
insert into t_charset_utf8mb3 values (50, 'Test3', 'Data3');
# 验证源表字符集设置
show create table t_charset_utf8mb3;
Table	Create Table
t_charset_utf8mb3	CREATE TABLE `t_charset_utf8mb3` (
  `id` int(11) NOT NULL,
  `name` varchar(50) DEFAULT NULL,
  `data` varchar(100) DEFAULT NULL,
  PRIMARY KEY (`id`)
) ORGANIZATION INDEX DEFAULT CHARSET = charset_name ROW_FORMAT = DYNAMIC COMPRESSION = 'zstd_1.3.8' REPLICA_NUM = 1 BLOCK_SIZE = 16384 USE_BLOOM_FILTER = FALSE ENABLE_MACRO_BLOCK_BLOOM_FILTER = FALSE TABLET_SIZE = 134217728 PCTFREE = 0
 partition by range(id)
(partition `p0` values less than (100),
partition `p1` values less than (200))
# 验证源表数据
select count(*) as cnt from t_charset_utf8mb3;
cnt
3
select * from t_charset_utf8mb3 order by id;
id	name	data
1	TestUTF8MB3	Data1
50	Test3	Data3
101	测试UTF8MB3	数据2
# Fork表
fork table t_charset_utf8mb3 to t_charset_utf8mb3_fork;
# 验证目标表字符集设置
show create table t_charset_utf8mb3_fork;
Table	Create Table
t_charset_utf8mb3_fork	CREATE TABLE `t_charset_utf8mb3_fork` (
  `id` int(11) NOT NULL,
  `name` varchar(50) DEFAULT NULL,
  `data` varchar(100) DEFAULT NULL,
  PRIMARY KEY (`id`)
) ORGANIZATION INDEX DEFAULT CHARSET = charset_name ROW_FORMAT = DYNAMIC COMPRESSION = 'zstd_1.3.8' REPLICA_NUM = 1 BLOCK_SIZE = 16384 USE_BLOOM_FILTER = FALSE ENABLE_MACRO_BLOCK_BLOOM_FILTER = FALSE TABLET_SIZE = 134217728 PCTFREE = 0
 partition by range(id)
(partition `p0` values less than (100),
partition `p1` values less than (200))
# 验证目标表数据
select count(*) as cnt from t_charset_utf8mb3_fork;
cnt
3
select * from t_charset_utf8mb3_fork order by id;
id	name	data
1	TestUTF8MB3	Data1
50	Test3	Data3
101	测试UTF8MB3	数据2
# 验证数据一致性
select (select count(*) from t_charset_utf8mb3) as src_cnt, (select count(*) from t_charset_utf8mb3_fork) as fork_cnt;
src_cnt	fork_cnt
3	3
drop table t_charset_utf8mb3;
drop table t_charset_utf8mb3_fork;
# 3.3 gbk字符集
drop table if exists t_charset_gbk;
Warnings:
Note	1051	Unknown table 'db_fork_storage.t_charset_gbk'
drop table if exists t_charset_gbk_fork;
Warnings:
Note	1051	Unknown table 'db_fork_storage.t_charset_gbk_fork'
create table t_charset_gbk (
id int primary key,
name varchar(50) charset gbk,
data varchar(100) charset gbk
) DEFAULT CHARSET = gbk partition by range(id) (
partition p0 values less than (100),
partition p1 values less than (200)
);
insert into t_charset_gbk values (1, '测试GBK', '数据1');
insert into t_charset_gbk values (101, 'TestGBK', 'Data2');
insert into t_charset_gbk values (50, '中文测试', 'GBK数据');
# 验证源表字符集设置
show create table t_charset_gbk;
Table	Create Table
t_charset_gbk	CREATE TABLE `t_charset_gbk` (
  `id` int(11) NOT NULL,
  `name` varchar(50) DEFAULT NULL,
  `data` varchar(100) DEFAULT NULL,
  PRIMARY KEY (`id`)
) ORGANIZATION INDEX DEFAULT CHARSET = charset_name ROW_FORMAT = DYNAMIC COMPRESSION = 'zstd_1.3.8' REPLICA_NUM = 1 BLOCK_SIZE = 16384 USE_BLOOM_FILTER = FALSE ENABLE_MACRO_BLOCK_BLOOM_FILTER = FALSE TABLET_SIZE = 134217728 PCTFREE = 0
 partition by range(id)
(partition `p0` values less than (100),
partition `p1` values less than (200))
# 验证源表数据
select count(*) as cnt from t_charset_gbk;
cnt
3
select * from t_charset_gbk order by id;
id	name	data
1	测试GBK	数据1
50	中文测试	GBK数据
101	TestGBK	Data2
# Fork表
fork table t_charset_gbk to t_charset_gbk_fork;
# 验证目标表字符集设置
show create table t_charset_gbk_fork;
Table	Create Table
t_charset_gbk_fork	CREATE TABLE `t_charset_gbk_fork` (
  `id` int(11) NOT NULL,
  `name` varchar(50) DEFAULT NULL,
  `data` varchar(100) DEFAULT NULL,
  PRIMARY KEY (`id`)
) ORGANIZATION INDEX DEFAULT CHARSET = charset_name ROW_FORMAT = DYNAMIC COMPRESSION = 'zstd_1.3.8' REPLICA_NUM = 1 BLOCK_SIZE = 16384 USE_BLOOM_FILTER = FALSE ENABLE_MACRO_BLOCK_BLOOM_FILTER = FALSE TABLET_SIZE = 134217728 PCTFREE = 0
 partition by range(id)
(partition `p0` values less than (100),
partition `p1` values less than (200))
# 验证目标表数据
select count(*) as cnt from t_charset_gbk_fork;
cnt
3
select * from t_charset_gbk_fork order by id;
id	name	data
1	测试GBK	数据1
50	中文测试	GBK数据
101	TestGBK	Data2
# 验证数据一致性
select (select count(*) from t_charset_gbk) as src_cnt, (select count(*) from t_charset_gbk_fork) as fork_cnt;
src_cnt	fork_cnt
3	3
drop table t_charset_gbk;
drop table t_charset_gbk_fork;
# 3.4 latin1字符集
drop table if exists t_charset_latin1;
Warnings:
Note	1051	Unknown table 'db_fork_storage.t_charset_latin1'
drop table if exists t_charset_latin1_fork;
Warnings:
Note	1051	Unknown table 'db_fork_storage.t_charset_latin1_fork'
create table t_charset_latin1 (
id int primary key,
name varchar(50) charset latin1,
data varchar(100) charset latin1
) DEFAULT CHARSET = latin1 partition by range(id) (
partition p0 values less than (100),
partition p1 values less than (200)
) ;
insert into t_charset_latin1 values (1, 'TestLatin1', 'Data1');
insert into t_charset_latin1 values (101, 'Test2', 'Data2');
insert into t_charset_latin1 values (50, 'Test3', 'Data3');
# 验证源表字符集设置
show create table t_charset_latin1;
Table	Create Table
t_charset_latin1	CREATE TABLE `t_charset_latin1` (
  `id` int(11) NOT NULL,
  `name` varchar(50) DEFAULT NULL,
  `data` varchar(100) DEFAULT NULL,
  PRIMARY KEY (`id`)
) ORGANIZATION INDEX DEFAULT CHARSET = charset_name ROW_FORMAT = DYNAMIC COMPRESSION = 'zstd_1.3.8' REPLICA_NUM = 1 BLOCK_SIZE = 16384 USE_BLOOM_FILTER = FALSE ENABLE_MACRO_BLOCK_BLOOM_FILTER = FALSE TABLET_SIZE = 134217728 PCTFREE = 0
 partition by range(id)
(partition `p0` values less than (100),
partition `p1` values less than (200))
# 验证源表数据
select count(*) as cnt from t_charset_latin1;
cnt
3
select * from t_charset_latin1 order by id;
id	name	data
1	TestLatin1	Data1
50	Test3	Data3
101	Test2	Data2
# Fork表
fork table t_charset_latin1 to t_charset_latin1_fork;
# 验证目标表字符集设置
show create table t_charset_latin1_fork;
Table	Create Table
t_charset_latin1_fork	CREATE TABLE `t_charset_latin1_fork` (
  `id` int(11) NOT NULL,
  `name` varchar(50) DEFAULT NULL,
  `data` varchar(100) DEFAULT NULL,
  PRIMARY KEY (`id`)
) ORGANIZATION INDEX DEFAULT CHARSET = charset_name ROW_FORMAT = DYNAMIC COMPRESSION = 'zstd_1.3.8' REPLICA_NUM = 1 BLOCK_SIZE = 16384 USE_BLOOM_FILTER = FALSE ENABLE_MACRO_BLOCK_BLOOM_FILTER = FALSE TABLET_SIZE = 134217728 PCTFREE = 0
 partition by range(id)
(partition `p0` values less than (100),
partition `p1` values less than (200))
# 验证目标表数据
select count(*) as cnt from t_charset_latin1_fork;
cnt
3
select * from t_charset_latin1_fork order by id;
id	name	data
1	TestLatin1	Data1
50	Test3	Data3
101	Test2	Data2
# 验证数据一致性
select (select count(*) from t_charset_latin1) as src_cnt, (select count(*) from t_charset_latin1_fork) as fork_cnt;
src_cnt	fork_cnt
3	3
drop table t_charset_latin1;
drop table t_charset_latin1_fork;
# 3.5 utf16字符集
drop table if exists t_charset_utf16;
Warnings:
Note	1051	Unknown table 'db_fork_storage.t_charset_utf16'
drop table if exists t_charset_utf16_fork;
Warnings:
Note	1051	Unknown table 'db_fork_storage.t_charset_utf16_fork'
create table t_charset_utf16 (
id int primary key,
name varchar(50) charset utf16,
data varchar(100) charset utf16
) DEFAULT CHARSET = utf16 partition by range(id) (
partition p0 values less than (100),
partition p1 values less than (200)
);
insert into t_charset_utf16 values (1, 'TestUTF16', 'Data1');
insert into t_charset_utf16 values (101, '测试UTF16', '数据2');
insert into t_charset_utf16 values (50, 'Test3', 'Data3');
# 验证源表字符集设置
show create table t_charset_utf16;
Table	Create Table
t_charset_utf16	CREATE TABLE `t_charset_utf16` (
  `id` int(11) NOT NULL,
  `name` varchar(50) DEFAULT NULL,
  `data` varchar(100) DEFAULT NULL,
  PRIMARY KEY (`id`)
) ORGANIZATION INDEX DEFAULT CHARSET = charset_name ROW_FORMAT = DYNAMIC COMPRESSION = 'zstd_1.3.8' REPLICA_NUM = 1 BLOCK_SIZE = 16384 USE_BLOOM_FILTER = FALSE ENABLE_MACRO_BLOCK_BLOOM_FILTER = FALSE TABLET_SIZE = 134217728 PCTFREE = 0
 partition by range(id)
(partition `p0` values less than (100),
partition `p1` values less than (200))
# 验证源表数据
select count(*) as cnt from t_charset_utf16;
cnt
3
select * from t_charset_utf16 order by id;
id	name	data
1	TestUTF16	Data1
50	Test3	Data3
101	测试UTF16	数据2
# Fork表
fork table t_charset_utf16 to t_charset_utf16_fork;
# 验证目标表字符集设置
show create table t_charset_utf16_fork;
Table	Create Table
t_charset_utf16_fork	CREATE TABLE `t_charset_utf16_fork` (
  `id` int(11) NOT NULL,
  `name` varchar(50) DEFAULT NULL,
  `data` varchar(100) DEFAULT NULL,
  PRIMARY KEY (`id`)
) ORGANIZATION INDEX DEFAULT CHARSET = charset_name ROW_FORMAT = DYNAMIC COMPRESSION = 'zstd_1.3.8' REPLICA_NUM = 1 BLOCK_SIZE = 16384 USE_BLOOM_FILTER = FALSE ENABLE_MACRO_BLOCK_BLOOM_FILTER = FALSE TABLET_SIZE = 134217728 PCTFREE = 0
 partition by range(id)
(partition `p0` values less than (100),
partition `p1` values less than (200))
# 验证目标表数据
select count(*) as cnt from t_charset_utf16_fork;
cnt
3
select * from t_charset_utf16_fork order by id;
id	name	data
1	TestUTF16	Data1
50	Test3	Data3
101	测试UTF16	数据2
# 验证数据一致性
select (select count(*) from t_charset_utf16) as src_cnt, (select count(*) from t_charset_utf16_fork) as fork_cnt;
src_cnt	fork_cnt
3	3
drop table t_charset_utf16;
drop table t_charset_utf16_fork;
============================================
4. 约束测试
============================================
# 4.1 非空约束
drop table if exists t_constraint_notnull;
Warnings:
Note	1051	Unknown table 'db_fork_storage.t_constraint_notnull'
drop table if exists t_constraint_notnull_fork;
Warnings:
Note	1051	Unknown table 'db_fork_storage.t_constraint_notnull_fork'
create table t_constraint_notnull (
id int primary key,
name varchar(50) not null,
value int not null,
data varchar(100)
) partition by range(id) (
partition p0 values less than (100),
partition p1 values less than (200)
);
insert into t_constraint_notnull values (1, 'Test1', 100, 'Data1');
insert into t_constraint_notnull values (101, 'Test2', 200, NULL);
insert into t_constraint_notnull values (50, 'Test3', 300, 'Data3');
# 验证源表约束
show create table t_constraint_notnull;
Table	Create Table
t_constraint_notnull	CREATE TABLE `t_constraint_notnull` (
  `id` int(11) NOT NULL,
  `name` varchar(50) NOT NULL,
  `value` int(11) NOT NULL,
  `data` varchar(100) DEFAULT NULL,
  PRIMARY KEY (`id`)
) ORGANIZATION INDEX DEFAULT CHARSET = utf8mb4 ROW_FORMAT = DYNAMIC COMPRESSION = 'zstd_1.3.8' REPLICA_NUM = 1 BLOCK_SIZE = 16384 USE_BLOOM_FILTER = FALSE ENABLE_MACRO_BLOCK_BLOOM_FILTER = FALSE TABLET_SIZE = 134217728 PCTFREE = 0
 partition by range(id)
(partition `p0` values less than (100),
partition `p1` values less than (200))
# 验证源表数据
select count(*) as cnt from t_constraint_notnull;
cnt
3
select * from t_constraint_notnull order by id;
id	name	value	data
1	Test1	100	Data1
50	Test3	300	Data3
101	Test2	200	NULL
# 测试非空约束（预期失败）
insert into t_constraint_notnull values (2, NULL, 100, 'Data');
ERROR 23000: Column 'name' cannot be null
# Fork表
fork table t_constraint_notnull to t_constraint_notnull_fork;
# 验证目标表约束（应与源表一致）
show create table t_constraint_notnull_fork;
Table	Create Table
t_constraint_notnull_fork	CREATE TABLE `t_constraint_notnull_fork` (
  `id` int(11) NOT NULL,
  `name` varchar(50) NOT NULL,
  `value` int(11) NOT NULL,
  `data` varchar(100) DEFAULT NULL,
  PRIMARY KEY (`id`)
) ORGANIZATION INDEX DEFAULT CHARSET = utf8mb4 ROW_FORMAT = DYNAMIC COMPRESSION = 'zstd_1.3.8' REPLICA_NUM = 1 BLOCK_SIZE = 16384 USE_BLOOM_FILTER = FALSE ENABLE_MACRO_BLOCK_BLOOM_FILTER = FALSE TABLET_SIZE = 134217728 PCTFREE = 0
 partition by range(id)
(partition `p0` values less than (100),
partition `p1` values less than (200))
# 验证目标表数据
select count(*) as cnt from t_constraint_notnull_fork;
cnt
3
select * from t_constraint_notnull_fork order by id;
id	name	value	data
1	Test1	100	Data1
50	Test3	300	Data3
101	Test2	200	NULL
# 测试目标表非空约束（预期失败）
insert into t_constraint_notnull_fork values (3, NULL, 100, 'Data');
ERROR 23000: Column 'name' cannot be null
# 验证数据一致性
select (select count(*) from t_constraint_notnull) as src_cnt, (select count(*) from t_constraint_notnull_fork) as fork_cnt;
src_cnt	fork_cnt
3	3
drop table t_constraint_notnull;
drop table t_constraint_notnull_fork;
# 4.2 唯一性约束
drop table if exists t_constraint_unique;
Warnings:
Note	1051	Unknown table 'db_fork_storage.t_constraint_unique'
drop table if exists t_constraint_unique_fork;
Warnings:
Note	1051	Unknown table 'db_fork_storage.t_constraint_unique_fork'
# 注意：分区表中的唯一索引必须包含分区键，因此使用非分区表来测试email的唯一性约束
create table t_constraint_unique (
id int primary key,
name varchar(50),
email varchar(100) unique,
value int
);
insert into t_constraint_unique values (1, 'Test1', 'test1@example.com', 100);
insert into t_constraint_unique values (101, 'Test2', 'test2@example.com', 200);
insert into t_constraint_unique values (50, 'Test3', 'test3@example.com', 300);
# 验证源表约束
show create table t_constraint_unique;
Table	Create Table
t_constraint_unique	CREATE TABLE `t_constraint_unique` (
  `id` int(11) NOT NULL,
  `name` varchar(50) DEFAULT NULL,
  `email` varchar(100) DEFAULT NULL,
  `value` int(11) DEFAULT NULL,
  PRIMARY KEY (`id`),
  UNIQUE KEY `email` (`email`) BLOCK_SIZE 16384 LOCAL
) ORGANIZATION INDEX DEFAULT CHARSET = utf8mb4 ROW_FORMAT = DYNAMIC COMPRESSION = 'zstd_1.3.8' REPLICA_NUM = 1 BLOCK_SIZE = 16384 USE_BLOOM_FILTER = FALSE ENABLE_MACRO_BLOCK_BLOOM_FILTER = FALSE TABLET_SIZE = 134217728 PCTFREE = 0
show indexes from t_constraint_unique;
Table	Non_unique	Key_name	Seq_in_index	Column_name	Collation	Cardinality	Sub_part	Packed	Null	Index_type	Comment	Index_comment	Visible	Expression
t_constraint_unique	0	PRIMARY	1	id	A	NULL	NULL	NULL		BTREE	available		YES	NULL
t_constraint_unique	0	email	1	email	A	NULL	NULL	NULL	YES	BTREE	available		YES	NULL
# 验证源表数据
select count(*) as cnt from t_constraint_unique;
cnt
3
select * from t_constraint_unique order by id;
id	name	email	value
1	Test1	test1@example.com	100
50	Test3	test3@example.com	300
101	Test2	test2@example.com	200
# 测试唯一性约束（预期失败）
insert into t_constraint_unique values (2, 'Test4', 'test1@example.com', 400);
ERROR 23000: Duplicate entry 'test1@example.com' for key 'email'
# Fork表
fork table t_constraint_unique to t_constraint_unique_fork;
# 验证目标表约束（应与源表一致）
show create table t_constraint_unique_fork;
Table	Create Table
t_constraint_unique_fork	CREATE TABLE `t_constraint_unique_fork` (
  `id` int(11) NOT NULL,
  `name` varchar(50) DEFAULT NULL,
  `email` varchar(100) DEFAULT NULL,
  `value` int(11) DEFAULT NULL,
  PRIMARY KEY (`id`),
  UNIQUE KEY `email` (`email`) BLOCK_SIZE 16384 LOCAL
) ORGANIZATION INDEX DEFAULT CHARSET = utf8mb4 ROW_FORMAT = DYNAMIC COMPRESSION = 'zstd_1.3.8' REPLICA_NUM = 1 BLOCK_SIZE = 16384 USE_BLOOM_FILTER = FALSE ENABLE_MACRO_BLOCK_BLOOM_FILTER = FALSE TABLET_SIZE = 134217728 PCTFREE = 0
show indexes from t_constraint_unique_fork;
Table	Non_unique	Key_name	Seq_in_index	Column_name	Collation	Cardinality	Sub_part	Packed	Null	Index_type	Comment	Index_comment	Visible	Expression
t_constraint_unique_fork	0	PRIMARY	1	id	A	NULL	NULL	NULL		BTREE	available		YES	NULL
t_constraint_unique_fork	0	email	1	email	A	NULL	NULL	NULL	YES	BTREE	available		YES	NULL
# 验证目标表数据
select count(*) as cnt from t_constraint_unique_fork;
cnt
3
select * from t_constraint_unique_fork order by id;
id	name	email	value
1	Test1	test1@example.com	100
50	Test3	test3@example.com	300
101	Test2	test2@example.com	200
# 测试目标表唯一性约束（预期失败）
insert into t_constraint_unique_fork values (3, 'Test5', 'test1@example.com', 500);
ERROR 23000: Duplicate entry 'test1@example.com' for key 'email'
# 验证数据一致性
select (select count(*) from t_constraint_unique) as src_cnt, (select count(*) from t_constraint_unique_fork) as fork_cnt;
src_cnt	fork_cnt
3	3
drop table t_constraint_unique;
drop table t_constraint_unique_fork;
# 4.3 主键约束
drop table if exists t_constraint_pk;
Warnings:
Note	1051	Unknown table 'db_fork_storage.t_constraint_pk'
drop table if exists t_constraint_pk_fork;
Warnings:
Note	1051	Unknown table 'db_fork_storage.t_constraint_pk_fork'
create table t_constraint_pk (
id int primary key,
name varchar(50),
value int
) partition by range(id) (
partition p0 values less than (100),
partition p1 values less than (200)
);
insert into t_constraint_pk values (1, 'Test1', 100);
insert into t_constraint_pk values (101, 'Test2', 200);
insert into t_constraint_pk values (50, 'Test3', 300);
# 验证源表主键约束
show create table t_constraint_pk;
Table	Create Table
t_constraint_pk	CREATE TABLE `t_constraint_pk` (
  `id` int(11) NOT NULL,
  `name` varchar(50) DEFAULT NULL,
  `value` int(11) DEFAULT NULL,
  PRIMARY KEY (`id`)
) ORGANIZATION INDEX DEFAULT CHARSET = utf8mb4 ROW_FORMAT = DYNAMIC COMPRESSION = 'zstd_1.3.8' REPLICA_NUM = 1 BLOCK_SIZE = 16384 USE_BLOOM_FILTER = FALSE ENABLE_MACRO_BLOCK_BLOOM_FILTER = FALSE TABLET_SIZE = 134217728 PCTFREE = 0
 partition by range(id)
(partition `p0` values less than (100),
partition `p1` values less than (200))
show indexes from t_constraint_pk;
Table	Non_unique	Key_name	Seq_in_index	Column_name	Collation	Cardinality	Sub_part	Packed	Null	Index_type	Comment	Index_comment	Visible	Expression
t_constraint_pk	0	PRIMARY	1	id	A	NULL	NULL	NULL		BTREE	available		YES	NULL
# 验证源表数据
select count(*) as cnt from t_constraint_pk;
cnt
3
select * from t_constraint_pk order by id;
id	name	value
1	Test1	100
50	Test3	300
101	Test2	200
# 测试主键约束（预期失败）
insert into t_constraint_pk values (1, 'Test4', 400);
ERROR 23000: Duplicate entry '1' for key 'PRIMARY'
# 测试主键非空约束（预期失败）
insert into t_constraint_pk values (NULL, 'Test5', 500);
ERROR 23000: Column 'id' cannot be null
# Fork表
fork table t_constraint_pk to t_constraint_pk_fork;
# 验证目标表主键约束（应与源表一致）
show create table t_constraint_pk_fork;
Table	Create Table
t_constraint_pk_fork	CREATE TABLE `t_constraint_pk_fork` (
  `id` int(11) NOT NULL,
  `name` varchar(50) DEFAULT NULL,
  `value` int(11) DEFAULT NULL,
  PRIMARY KEY (`id`)
) ORGANIZATION INDEX DEFAULT CHARSET = utf8mb4 ROW_FORMAT = DYNAMIC COMPRESSION = 'zstd_1.3.8' REPLICA_NUM = 1 BLOCK_SIZE = 16384 USE_BLOOM_FILTER = FALSE ENABLE_MACRO_BLOCK_BLOOM_FILTER = FALSE TABLET_SIZE = 134217728 PCTFREE = 0
 partition by range(id)
(partition `p0` values less than (100),
partition `p1` values less than (200))
show indexes from t_constraint_pk_fork;
Table	Non_unique	Key_name	Seq_in_index	Column_name	Collation	Cardinality	Sub_part	Packed	Null	Index_type	Comment	Index_comment	Visible	Expression
t_constraint_pk_fork	0	PRIMARY	1	id	A	NULL	NULL	NULL		BTREE	available		YES	NULL
# 验证目标表数据
select count(*) as cnt from t_constraint_pk_fork;
cnt
3
select * from t_constraint_pk_fork order by id;
id	name	value
1	Test1	100
50	Test3	300
101	Test2	200
# 测试目标表主键约束（预期失败）
insert into t_constraint_pk_fork values (1, 'Test6', 600);
ERROR 23000: Duplicate entry '1' for key 'PRIMARY'
# 验证数据一致性
select (select count(*) from t_constraint_pk) as src_cnt, (select count(*) from t_constraint_pk_fork) as fork_cnt;
src_cnt	fork_cnt
3	3
drop table t_constraint_pk;
drop table t_constraint_pk_fork;
# 4.4 外键约束
drop table if exists t_constraint_fk_child_fork;
Warnings:
Note	1051	Unknown table 'db_fork_storage.t_constraint_fk_child_fork'
drop table if exists t_constraint_fk_child;
Warnings:
Note	1051	Unknown table 'db_fork_storage.t_constraint_fk_child'
drop table if exists t_constraint_fk_parent_fork;
Warnings:
Note	1051	Unknown table 'db_fork_storage.t_constraint_fk_parent_fork'
drop table if exists t_constraint_fk_parent;
Warnings:
Note	1051	Unknown table 'db_fork_storage.t_constraint_fk_parent'
create table t_constraint_fk_parent (
id int primary key,
name varchar(50)
) partition by range(id) (
partition p0 values less than (100),
partition p1 values less than (200)
);
create table t_constraint_fk_child (
id int primary key,
parent_id int,
name varchar(50),
foreign key (parent_id) references t_constraint_fk_parent(id)
) partition by range(id) (
partition p0 values less than (100),
partition p1 values less than (200)
);
insert into t_constraint_fk_parent values (1, 'Parent1');
insert into t_constraint_fk_parent values (101, 'Parent2');
insert into t_constraint_fk_child values (1, 1, 'Child1');
insert into t_constraint_fk_child values (101, 101, 'Child2');
insert into t_constraint_fk_child values (50, 1, 'Child3');
# 验证源表外键约束
show create table t_constraint_fk_child;
Table	Create Table
t_constraint_fk_child	CREATE TABLE `t_constraint_fk_child` (
  `id` int(11) NOT NULL,
  `parent_id` int(11) DEFAULT NULL,
  `name` varchar(50) DEFAULT NULL,
  PRIMARY KEY (`id`),
  CONSTRAINT `t_constraint_fk_child_OBFK_1769762656394020` FOREIGN KEY (`parent_id`) REFERENCES `db_fork_storage`.`t_constraint_fk_parent`(`id`) ON UPDATE RESTRICT ON DELETE RESTRICT 
) ORGANIZATION INDEX DEFAULT CHARSET = utf8mb4 ROW_FORMAT = DYNAMIC COMPRESSION = 'zstd_1.3.8' REPLICA_NUM = 1 BLOCK_SIZE = 16384 USE_BLOOM_FILTER = FALSE ENABLE_MACRO_BLOCK_BLOOM_FILTER = FALSE TABLET_SIZE = 134217728 PCTFREE = 0
 partition by range(id)
(partition `p0` values less than (100),
partition `p1` values less than (200))
show indexes from t_constraint_fk_child;
Table	Non_unique	Key_name	Seq_in_index	Column_name	Collation	Cardinality	Sub_part	Packed	Null	Index_type	Comment	Index_comment	Visible	Expression
t_constraint_fk_child	0	PRIMARY	1	id	A	NULL	NULL	NULL		BTREE	available		YES	NULL
# 验证源表数据
select count(*) as cnt from t_constraint_fk_parent;
cnt
2
select count(*) as cnt from t_constraint_fk_child;
cnt
3
select * from t_constraint_fk_parent order by id;
id	name
1	Parent1
101	Parent2
select * from t_constraint_fk_child order by id;
id	parent_id	name
1	1	Child1
50	1	Child3
101	101	Child2
# 测试外键约束（预期失败）
insert into t_constraint_fk_child values (2, 999, 'InvalidChild');
ERROR 23000: Cannot add or update a child row: a foreign key constraint fails
# Fork父表
fork table t_constraint_fk_parent to t_constraint_fk_parent_fork;
# Fork子表
fork table t_constraint_fk_child to t_constraint_fk_child_fork;
# 验证目标表外键约束
# 注意：fork后外键约束可能不会fork，需要验证
show create table t_constraint_fk_child_fork;
Table	Create Table
t_constraint_fk_child_fork	CREATE TABLE `t_constraint_fk_child_fork` (
  `id` int(11) NOT NULL,
  `parent_id` int(11) DEFAULT NULL,
  `name` varchar(50) DEFAULT NULL,
  PRIMARY KEY (`id`)
) ORGANIZATION INDEX DEFAULT CHARSET = utf8mb4 ROW_FORMAT = DYNAMIC COMPRESSION = 'zstd_1.3.8' REPLICA_NUM = 1 BLOCK_SIZE = 16384 USE_BLOOM_FILTER = FALSE ENABLE_MACRO_BLOCK_BLOOM_FILTER = FALSE TABLET_SIZE = 134217728 PCTFREE = 0
 partition by range(id)
(partition `p0` values less than (100),
partition `p1` values less than (200))
show indexes from t_constraint_fk_child_fork;
Table	Non_unique	Key_name	Seq_in_index	Column_name	Collation	Cardinality	Sub_part	Packed	Null	Index_type	Comment	Index_comment	Visible	Expression
t_constraint_fk_child_fork	0	PRIMARY	1	id	A	NULL	NULL	NULL		BTREE	available		YES	NULL
# 验证目标表数据
select count(*) as cnt from t_constraint_fk_parent_fork;
cnt
2
select count(*) as cnt from t_constraint_fk_child_fork;
cnt
3
select * from t_constraint_fk_parent_fork order by id;
id	name
1	Parent1
101	Parent2
select * from t_constraint_fk_child_fork order by id;
id	parent_id	name
1	1	Child1
50	1	Child3
101	101	Child2
# 验证数据一致性
select (select count(*) from t_constraint_fk_parent) as src_cnt, (select count(*) from t_constraint_fk_parent_fork) as fork_cnt;
src_cnt	fork_cnt
2	2
select (select count(*) from t_constraint_fk_child) as src_cnt, (select count(*) from t_constraint_fk_child_fork) as fork_cnt;
src_cnt	fork_cnt
3	3
# 注意：如果fork后外键约束被保留，测试外键约束（预期失败）
# 如果fork后外键约束不被保留，可以插入无效外键值
# 这里先测试是否可以插入无效外键值（根据实际行为调整）
insert into t_constraint_fk_child_fork values (2, 999, 'InvalidChildFork');
select * from t_constraint_fk_child_fork where id = 2;
id	parent_id	name
2	999	InvalidChildFork
drop table t_constraint_fk_child;
drop table t_constraint_fk_child_fork;
drop table t_constraint_fk_parent;
drop table t_constraint_fk_parent_fork;
# 4.5 Check约束
drop table if exists t_constraint_check;
Warnings:
Note	1051	Unknown table 'db_fork_storage.t_constraint_check'
drop table if exists t_constraint_check_fork;
Warnings:
Note	1051	Unknown table 'db_fork_storage.t_constraint_check_fork'
create table t_constraint_check (
id int primary key,
name varchar(50),
value int,
status int,
constraint chk_value check (value > 0),
constraint chk_status check (status in (0, 1, 2))
) partition by range(id) (
partition p0 values less than (100),
partition p1 values less than (200)
);
insert into t_constraint_check values (1, 'Test1', 100, 1);
insert into t_constraint_check values (101, 'Test2', 200, 2);
insert into t_constraint_check values (50, 'Test3', 300, 0);
# 验证源表Check约束
show create table t_constraint_check;
Table	Create Table
t_constraint_check	CREATE TABLE `t_constraint_check` (
  `id` int(11) NOT NULL,
  `name` varchar(50) DEFAULT NULL,
  `value` int(11) DEFAULT NULL,
  `status` int(11) DEFAULT NULL,
  PRIMARY KEY (`id`),
  CONSTRAINT `chk_value` CHECK ((`value` > 0)),
  CONSTRAINT `chk_status` CHECK ((`status` in (0,1,2)))
) ORGANIZATION INDEX DEFAULT CHARSET = utf8mb4 ROW_FORMAT = DYNAMIC COMPRESSION = 'zstd_1.3.8' REPLICA_NUM = 1 BLOCK_SIZE = 16384 USE_BLOOM_FILTER = FALSE ENABLE_MACRO_BLOCK_BLOOM_FILTER = FALSE TABLET_SIZE = 134217728 PCTFREE = 0
 partition by range(id)
(partition `p0` values less than (100),
partition `p1` values less than (200))
# 验证源表数据
select count(*) as cnt from t_constraint_check;
cnt
3
select * from t_constraint_check order by id;
id	name	value	status
1	Test1	100	1
50	Test3	300	0
101	Test2	200	2
# 测试Check约束（预期失败）
insert into t_constraint_check values (2, 'Test4', -1, 1);
ERROR HY000: check constraint violated
insert into t_constraint_check values (3, 'Test5', 100, 5);
ERROR HY000: check constraint violated
# Fork表
fork table t_constraint_check to t_constraint_check_fork;
# 验证目标表Check约束（应与源表一致）
show create table t_constraint_check_fork;
Table	Create Table
t_constraint_check_fork	CREATE TABLE `t_constraint_check_fork` (
  `id` int(11) NOT NULL,
  `name` varchar(50) DEFAULT NULL,
  `value` int(11) DEFAULT NULL,
  `status` int(11) DEFAULT NULL,
  PRIMARY KEY (`id`),
  CONSTRAINT `t_constraint_check_fork_OBCHECK_1769762666520716` CHECK ((`value` > 0)),
  CONSTRAINT `t_constraint_check_fork_OBCHECK_1769762666520728` CHECK ((`status` in (0,1,2)))
) ORGANIZATION INDEX DEFAULT CHARSET = utf8mb4 ROW_FORMAT = DYNAMIC COMPRESSION = 'zstd_1.3.8' REPLICA_NUM = 1 BLOCK_SIZE = 16384 USE_BLOOM_FILTER = FALSE ENABLE_MACRO_BLOCK_BLOOM_FILTER = FALSE TABLET_SIZE = 134217728 PCTFREE = 0
 partition by range(id)
(partition `p0` values less than (100),
partition `p1` values less than (200))
# 验证目标表数据
select count(*) as cnt from t_constraint_check_fork;
cnt
3
select * from t_constraint_check_fork order by id;
id	name	value	status
1	Test1	100	1
50	Test3	300	0
101	Test2	200	2
# 测试目标表Check约束（预期失败）
insert into t_constraint_check_fork values (4, 'Test6', -1, 1);
ERROR HY000: check constraint violated
insert into t_constraint_check_fork values (5, 'Test7', 100, 5);
ERROR HY000: check constraint violated
# 验证数据一致性
select (select count(*) from t_constraint_check) as src_cnt, (select count(*) from t_constraint_check_fork) as fork_cnt;
src_cnt	fork_cnt
3	3
drop table t_constraint_check;
drop table t_constraint_check_fork;
============================================
5. 清理
============================================
drop database if exists db_fork_storage;
