drop database if exists db_fork_datatype;
create database db_fork_datatype;
use db_fork_datatype;
SET wait_timeout=30000000;
SET ob_trx_timeout = 100000000;
SET ob_query_timeout = 100000000;
============================================
1. 数值类型Fork测试
============================================
drop table if exists t_numeric;
Warnings:
Note	1051	Unknown table 'db_fork_datatype.t_numeric'
drop table if exists t_numeric_fork;
Warnings:
Note	1051	Unknown table 'db_fork_datatype.t_numeric_fork'
# 创建包含所有数值类型的源表
create table t_numeric (
id int primary key,
-- 整数类型
col_tinyint tinyint,
col_smallint smallint,
col_mediumint mediumint,
col_int int,
col_bigint bigint,
-- 定点数类型
col_decimal decimal(10,2),
col_numeric numeric(10,3),
-- 浮点数类型
col_float float(8,3),
col_double double(15,5),
col_real real(10,2),
-- 无符号整数
col_utinyint tinyint unsigned,
col_usmallint smallint unsigned,
col_umediumint mediumint unsigned,
col_uint int unsigned,
col_ubigint bigint unsigned,
-- 位类型
col_bit bit(8),
-- 布尔类型
col_bool boolean,
col_boolean boolean
);
# 插入各种数值类型数据
insert into t_numeric values (
10,
127, 32767, 8388607, 2147483647, 9223372036854775807, -- 有符号整数最大值
1234567.89, 987654.321,                                -- 定点数
12345.678, 123456789.12345, 123456.78,                -- 浮点数
255, 65535, 16777215, 4294967295, 18446744073709551615, -- 无符号整数最大值
b'10101010',                                          -- 位类型
true, false                                           -- 布尔类型
);
insert into t_numeric values (
11,
-128, -32768, -8388608, -2147483648, -9223372036854775808, -- 有符号整数最小值
-1234567.89, -987654.321,                               -- 定点数负数
-12345.678, -123456789.12345, -123456.78,               -- 浮点数负数
0, 0, 0, 0, 0,                                         -- 无符号零值
b'01010101',                                           -- 位类型
false, true                                            -- 布尔类型
);
# 边界值测试
insert into t_numeric values (
12,
0, 0, 0, 0, 0,                                        -- 零值
0.00, 0.000,                                          -- 定点数零值
0.0, 0.00000, 0.0,                                    -- 浮点数零值
0, 0, 0, 0, 0,                                        -- 无符号零值
b'00000000',                                          -- 位类型零值
false, true                                           -- 布尔类型
);
# 执行Fork Table
fork table t_numeric to t_numeric_fork;
# 验证Fork后的表结构
show create table t_numeric_fork;
Table	Create Table
t_numeric_fork	CREATE TABLE `t_numeric_fork` (
  `id` int(11) NOT NULL,
  `col_tinyint` tinyint(4) DEFAULT NULL,
  `col_smallint` smallint(6) DEFAULT NULL,
  `col_mediumint` mediumint(9) DEFAULT NULL,
  `col_int` int(11) DEFAULT NULL,
  `col_bigint` bigint(20) DEFAULT NULL,
  `col_decimal` decimal(10,2) DEFAULT NULL,
  `col_numeric` decimal(10,3) DEFAULT NULL,
  `col_float` float(8,3) DEFAULT NULL,
  `col_double` double(15,5) DEFAULT NULL,
  `col_real` double(10,2) DEFAULT NULL,
  `col_utinyint` tinyint(3) unsigned DEFAULT NULL,
  `col_usmallint` smallint(5) unsigned DEFAULT NULL,
  `col_umediumint` mediumint(8) unsigned DEFAULT NULL,
  `col_uint` int(10) unsigned DEFAULT NULL,
  `col_ubigint` bigint(20) unsigned DEFAULT NULL,
  `col_bit` bit(8) DEFAULT NULL,
  `col_bool` tinyint(1) DEFAULT NULL,
  `col_boolean` tinyint(1) DEFAULT NULL,
  PRIMARY KEY (`id`)
) ORGANIZATION INDEX DEFAULT CHARSET = utf8mb4 ROW_FORMAT = DYNAMIC COMPRESSION = 'zstd_1.3.8' REPLICA_NUM = replica_num BLOCK_SIZE = 16384 USE_BLOOM_FILTER = FALSE ENABLE_MACRO_BLOCK_BLOOM_FILTER = FALSE TABLET_SIZE = 134217728 PCTFREE = 0
show create table t_numeric;
Table	Create Table
t_numeric	CREATE TABLE `t_numeric` (
  `id` int(11) NOT NULL,
  `col_tinyint` tinyint(4) DEFAULT NULL,
  `col_smallint` smallint(6) DEFAULT NULL,
  `col_mediumint` mediumint(9) DEFAULT NULL,
  `col_int` int(11) DEFAULT NULL,
  `col_bigint` bigint(20) DEFAULT NULL,
  `col_decimal` decimal(10,2) DEFAULT NULL,
  `col_numeric` decimal(10,3) DEFAULT NULL,
  `col_float` float(8,3) DEFAULT NULL,
  `col_double` double(15,5) DEFAULT NULL,
  `col_real` double(10,2) DEFAULT NULL,
  `col_utinyint` tinyint(3) unsigned DEFAULT NULL,
  `col_usmallint` smallint(5) unsigned DEFAULT NULL,
  `col_umediumint` mediumint(8) unsigned DEFAULT NULL,
  `col_uint` int(10) unsigned DEFAULT NULL,
  `col_ubigint` bigint(20) unsigned DEFAULT NULL,
  `col_bit` bit(8) DEFAULT NULL,
  `col_bool` tinyint(1) DEFAULT NULL,
  `col_boolean` tinyint(1) DEFAULT NULL,
  PRIMARY KEY (`id`)
) ORGANIZATION INDEX DEFAULT CHARSET = utf8mb4 ROW_FORMAT = DYNAMIC COMPRESSION = 'zstd_1.3.8' REPLICA_NUM = 1 BLOCK_SIZE = 16384 USE_BLOOM_FILTER = FALSE ENABLE_MACRO_BLOCK_BLOOM_FILTER = FALSE TABLET_SIZE = 134217728 PCTFREE = 0
# Step 1: 验证Fork后数据与源表完全一致
# 验证记录数一致
select  count(*) as cnt from t_numeric
union all
select count(*) as cnt from t_numeric_fork;
cnt
3
3
# 验证数据内容完全一致
select s.id, 
s.col_tinyint = f.col_tinyint as tinyint_match,
s.col_smallint = f.col_smallint as smallint_match,
s.col_int = f.col_int as int_match,
s.col_bigint = f.col_bigint as bigint_match,
abs(s.col_decimal - f.col_decimal) < 0.01 as decimal_match,
abs(s.col_float - f.col_float) < 0.001 as float_match
from t_numeric s
join t_numeric_fork f on s.id = f.id
order by s.id;
id	tinyint_match	smallint_match	int_match	bigint_match	decimal_match	float_match
10	1	1	1	1	1	1
11	1	1	1	1	1	1
12	1	1	1	1	1	1
# 详细数据对比
select * from t_numeric order by id;
id	col_tinyint	col_smallint	col_mediumint	col_int	col_bigint	col_decimal	col_numeric	col_float	col_double	col_real	col_utinyint	col_usmallint	col_umediumint	col_uint	col_ubigint	col_bit	col_bool	col_boolean
10	127	32767	8388607	2147483647	9223372036854775807	1234567.89	987654.321	12345.678	123456789.12345	123456.78	255	65535	16777215	4294967295	18446744073709551615	BIT_VALUE	1	0
11	-128	-32768	-8388608	-2147483648	-9223372036854775808	-1234567.89	-987654.321	-12345.678	-123456789.12345	-123456.78	0	0	0	0	0	BIT_VALUE	0	1
12	0	0	0	0	0	0.00	0.000	0.000	0.00000	0.00	0	0	0	0	0	BIT_VALUE	0	1
select * from t_numeric_fork order by id;
id	col_tinyint	col_smallint	col_mediumint	col_int	col_bigint	col_decimal	col_numeric	col_float	col_double	col_real	col_utinyint	col_usmallint	col_umediumint	col_uint	col_ubigint	col_bit	col_bool	col_boolean
10	127	32767	8388607	2147483647	9223372036854775807	1234567.89	987654.321	12345.678	123456789.12345	123456.78	255	65535	16777215	4294967295	18446744073709551615	BIT_VALUE	1	0
11	-128	-32768	-8388608	-2147483648	-9223372036854775808	-1234567.89	-987654.321	-12345.678	-123456789.12345	-123456.78	0	0	0	0	0	BIT_VALUE	0	1
12	0	0	0	0	0	0.00	0.000	0.000	0.00000	0.00	0	0	0	0	0	BIT_VALUE	0	1
# ========== 数据隔离测试阶段 ==========
# Step 2: 删除Fork表数据，准备独立测试
delete from t_numeric_fork;
# 验证Fork表已清空，源表数据未受影响
select  count(*) as cnt from t_numeric_fork;
cnt
0
select count(*) as cnt from t_numeric;
cnt
3
# Step 3: 在Fork表中插入各种数值类型数据
# 插入边界值测试数据
insert into t_numeric_fork values (
10,
127, 32767, 8388607, 2147483647, 9223372036854775807, -- 有符号整数最大值
1234567.89, 987654.321,                                -- 定点数
12345.678, 123456789.12345, 123456.78,                -- 浮点数
255, 65535, 16777215, 4294967295, 18446744073709551615, -- 无符号整数最大值
b'10101010',                                          -- 位类型
true, false                                           -- 布尔类型
);
insert into t_numeric_fork values (
11,
-128, -32768, -8388608, -2147483648, -9223372036854775808, -- 有符号整数最小值
-1234567.89, -987654.321,                               -- 定点数负数
-12345.678, -123456789.12345, -123456.78,               -- 浮点数负数
0, 0, 0, 0, 0,                                         -- 无符号零值
b'01010101',                                           -- 位类型
false, true                                            -- 布尔类型
);
# 边界值测试
insert into t_numeric_fork values (
12,
0, 0, 0, 0, 0,                                        -- 零值
0.00, 0.000,                                          -- 定点数零值
0.0, 0.00000, 0.0,                                    -- 浮点数零值
0, 0, 0, 0, 0,                                        -- 无符号零值
b'00000000',                                          -- 位类型零值
false, true                                           -- 布尔类型
);
# Step 4: 验证Fork表新数据，源表数据未受影响
# 验证Fork表新数据
select count(*) as cnt from t_numeric_fork;
cnt
3
select * from t_numeric_fork order by id;
id	col_tinyint	col_smallint	col_mediumint	col_int	col_bigint	col_decimal	col_numeric	col_float	col_double	col_real	col_utinyint	col_usmallint	col_umediumint	col_uint	col_ubigint	col_bit	col_bool	col_boolean
10	127	32767	8388607	2147483647	9223372036854775807	1234567.89	987654.321	12345.678	123456789.12345	123456.78	255	65535	16777215	4294967295	18446744073709551615	BIT_VALUE	1	0
11	-128	-32768	-8388608	-2147483648	-9223372036854775808	-1234567.89	-987654.321	-12345.678	-123456789.12345	-123456.78	0	0	0	0	0	BIT_VALUE	0	1
12	0	0	0	0	0	0.00	0.000	0.000	0.00000	0.00	0	0	0	0	0	BIT_VALUE	0	1
# 验证源表数据未受影响
select count(*) as cnt from t_numeric;
cnt
3
select * from t_numeric order by id;
id	col_tinyint	col_smallint	col_mediumint	col_int	col_bigint	col_decimal	col_numeric	col_float	col_double	col_real	col_utinyint	col_usmallint	col_umediumint	col_uint	col_ubigint	col_bit	col_bool	col_boolean
10	127	32767	8388607	2147483647	9223372036854775807	1234567.89	987654.321	12345.678	123456789.12345	123456.78	255	65535	16777215	4294967295	18446744073709551615	BIT_VALUE	1	0
11	-128	-32768	-8388608	-2147483648	-9223372036854775808	-1234567.89	-987654.321	-12345.678	-123456789.12345	-123456.78	0	0	0	0	0	BIT_VALUE	0	1
12	0	0	0	0	0	0.00	0.000	0.000	0.00000	0.00	0	0	0	0	0	BIT_VALUE	0	1
# Step 5: 数据类型精度验证
# 验证数值精度保持
select id,
col_decimal,
col_numeric,
col_float,
col_double,
col_real
from t_numeric_fork 
where id in (10, 11, 12)
order by id;
id	col_decimal	col_numeric	col_float	col_double	col_real
10	1234567.89	987654.321	12345.678	123456789.12345	123456.78
11	-1234567.89	-987654.321	-12345.678	-123456789.12345	-123456.78
12	0.00	0.000	0.000	0.00000	0.00
# 验证无符号数范围
select id,
col_utinyint,
col_usmallint, 
col_umediumint,
col_uint,
col_ubigint
from t_numeric_fork 
where id in (10, 11, 12)
order by id;
id	col_utinyint	col_usmallint	col_umediumint	col_uint	col_ubigint
10	255	65535	16777215	4294967295	18446744073709551615
11	0	0	0	0	0
12	0	0	0	0	0
# Step 6: 位类型和布尔类型验证
select id,
bin(col_bit) as bit_binary,
col_bool,
col_boolean
from t_numeric_fork 
where id in (10, 11, 12)
order by id;
id	bit_binary	col_bool	col_boolean
10	10101010	1	0
11	1010101	0	1
12	0	0	1
# Step 7: 交叉操作测试
# 在源表插入数据，验证不影响Fork表
insert into t_numeric values (
20,
127,  -- TINYINT 最大值 (修正：原255超出范围)
32700,  -- SMALLINT 范围内
8000000,  -- MEDIUMINT 范围内  
2000000000,  -- INT 范围内
9000000000000000000,  -- BIGINT 范围内
999999.99, 888888.888,  -- DECIMAL/NUMERIC 范围内
54321.123, 1234567.89012, 98765.43,  -- 浮点数范围内
128,  -- TINYINT UNSIGNED 范围内 (0-255)
32000,  -- SMALLINT UNSIGNED 范围内
8000000,  -- MEDIUMINT UNSIGNED 范围内  
2000000000,  -- INT UNSIGNED 范围内
9000000000000000000,  -- BIGINT UNSIGNED 范围内
b'10100101',
true, false
);
# 验证源表新增数据
select * from t_numeric where id = 20;
id	col_tinyint	col_smallint	col_mediumint	col_int	col_bigint	col_decimal	col_numeric	col_float	col_double	col_real	col_utinyint	col_usmallint	col_umediumint	col_uint	col_ubigint	col_bit	col_bool	col_boolean
20	127	32700	8000000	2000000000	9000000000000000000	999999.99	888888.888	54321.121	1234567.89012	98765.43	128	32000	8000000	2000000000	9000000000000000000	BIT_VALUE	1	0
# 验证Fork表无新增数据
select count(*) as cnt from t_numeric_fork where id = 20;
cnt
0
# 在Fork表插入与源表相同ID的数据，验证数据隔离 bug 
insert into t_numeric_fork values (
20,  -- 与源表相同的ID
127,  -- TINYINT 最大值 (修正：原255超出范围)
32700,  -- SMALLINT 范围内
8000000,  -- MEDIUMINT 范围内  
2000000000,  -- INT 范围内
9000000000000000000,  -- BIGINT 范围内
999999.99, 888888.888,  -- DECIMAL/NUMERIC 范围内
54321.123, 1234567.89012, 98765.43,  -- 浮点数范围内
128,  -- TINYINT UNSIGNED 范围内 (0-255)
32000,  -- SMALLINT UNSIGNED 范围内
8000000,  -- MEDIUMINT UNSIGNED 范围内  
2000000000,  -- INT UNSIGNED 范围内
9000000000000000000,  -- BIGINT UNSIGNED 范围内
b'10100101',
true, false
);
ERROR 23000: Duplicate entry '20' for key 'PRIMARY'
# 验证相同ID数据隔离
select * from t_numeric where id = 10;
id	col_tinyint	col_smallint	col_mediumint	col_int	col_bigint	col_decimal	col_numeric	col_float	col_double	col_real	col_utinyint	col_usmallint	col_umediumint	col_uint	col_ubigint	col_bit	col_bool	col_boolean
10	127	32767	8388607	2147483647	9223372036854775807	1234567.89	987654.321	12345.678	123456789.12345	123456.78	255	65535	16777215	4294967295	18446744073709551615	BIT_VALUE	1	0
select * from t_numeric_fork where id = 10;
id	col_tinyint	col_smallint	col_mediumint	col_int	col_bigint	col_decimal	col_numeric	col_float	col_double	col_real	col_utinyint	col_usmallint	col_umediumint	col_uint	col_ubigint	col_bit	col_bool	col_boolean
10	127	32767	8388607	2147483647	9223372036854775807	1234567.89	987654.321	12345.678	123456789.12345	123456.78	255	65535	16777215	4294967295	18446744073709551615	BIT_VALUE	1	0
# 数值计算操作验证
# 在Fork表进行数值计算
update t_numeric_fork set 
col_int = col_int - 1,
col_decimal = col_decimal * 2,
col_double = col_double / 2
where id = 10;
# 验证Fork表数据已更新
select id, col_int, col_decimal, col_double 
from t_numeric_fork where id = 10;
id	col_int	col_decimal	col_double
10	2147483646	2469135.78	61728394.56172
# 验证源表数据未受影响
select id, col_int, col_decimal, col_double 
from t_numeric where id = 10;
id	col_int	col_decimal	col_double
10	2147483647	1234567.89	123456789.12345
# 数值类型约束验证
# 测试数值范围约束
insert into t_numeric_fork values (
30,
1000,  -- 超出tinyint范围
100,
100,
100,
100,
100.00,
100.000,
100.000,
100.00000,
100.00,
1000,  -- 超出tinyint unsigned范围
100,
100,
100,
100,
b'00000000',
true,
false
);
ERROR 22003: Out of range value for column 'col_tinyint' at row 1
# 验证约束生效，无新数据插入
select count(*) as cnt from t_numeric_fork where id = 30;
cnt
0
============================================
2. 时间日期类型Fork测试
============================================
drop table if exists t_datetime;
Warnings:
Note	1051	Unknown table 'db_fork_datatype.t_datetime'
drop table if exists t_datetime_fork;
Warnings:
Note	1051	Unknown table 'db_fork_datatype.t_datetime_fork'
# 创建包含所有时间日期类型的源表
create table t_datetime (
id int primary key,
-- 日期时间类型
col_date date,
col_time time,
col_datetime datetime,
col_timestamp timestamp,
col_year year,
-- 时间精度类型
col_datetime6 datetime(6),
col_timestamp6 timestamp(6),
col_time6 time(6)
);
# 插入各种时间日期数据
insert into t_datetime values (
1,
'2023-12-25',                              -- date
'12:30:45',                                -- time
'2023-12-25 12:30:45',                     -- datetime
'2023-12-25 12:30:45',                     -- timestamp
2023,                                      -- year
'2023-12-25 12:30:45.123456',              -- datetime(6)
'2023-12-25 12:30:45.654321',              -- timestamp(6)
'12:30:45.987654'                          -- time(6)
);
insert into t_datetime values (
2,
'1970-01-01',                              -- 最小日期
'00:00:00',                                -- 最小时间
'1970-01-01 00:00:00',                     -- 最小datetime
'1970-01-01 00:00:01',                     -- timestamp不能为0
1901,                                      -- 最小year
'1970-01-01 00:00:00.000000',              -- 最小datetime(6)
'1970-01-01 00:00:01.000000',              -- timestamp(6)不能为0
'00:00:00.000000'                          -- 最小time(6)
);
insert into t_datetime values (
3,
'9999-12-31',                              -- 最大日期
'23:59:59',                               -- 最大时间
'9999-12-31 23:59:59',                     -- 最大datetime
'2038-01-19 03:14:07',                     -- 最大timestamp
2155,                                      -- 最大year
'9999-12-31 23:59:59.999999',              -- 最大datetime(6)
'2038-01-19 03:14:07.999999',              -- 最大timestamp(6)
'23:59:59.999999'                         -- 最大time(6)
);
# 执行Fork Table
fork table t_datetime to t_datetime_fork;
# 验证Fork后的时间日期数据
select count(*) as cnt from t_datetime_fork;
cnt
3
select * from t_datetime_fork order by id;
id	col_date	col_time	col_datetime	col_timestamp	col_year	col_datetime6	col_timestamp6	col_time6
1	2023-12-25	12:30:45	2023-12-25 12:30:45	2023-12-25 12:30:45	2023	2023-12-25 12:30:45.123456	2023-12-25 12:30:45.654321	12:30:45.987654
2	1970-01-01	00:00:00	1970-01-01 00:00:00	1970-01-01 00:00:01	1901	1970-01-01 00:00:00.000000	1970-01-01 00:00:01.000000	00:00:00.000000
3	9999-12-31	23:59:59	9999-12-31 23:59:59	2038-01-19 03:14:07	2155	9999-12-31 23:59:59.999999	2038-01-19 03:14:07.999999	23:59:59.999999
# 验证源表数据未受影响
select count(*) as cnt from t_datetime;
cnt
3
select * from t_datetime order by id;
id	col_date	col_time	col_datetime	col_timestamp	col_year	col_datetime6	col_timestamp6	col_time6
1	2023-12-25	12:30:45	2023-12-25 12:30:45	2023-12-25 12:30:45	2023	2023-12-25 12:30:45.123456	2023-12-25 12:30:45.654321	12:30:45.987654
2	1970-01-01	00:00:00	1970-01-01 00:00:00	1970-01-01 00:00:01	1901	1970-01-01 00:00:00.000000	1970-01-01 00:00:01.000000	00:00:00.000000
3	9999-12-31	23:59:59	9999-12-31 23:59:59	2038-01-19 03:14:07	2155	9999-12-31 23:59:59.999999	2038-01-19 03:14:07.999999	23:59:59.999999
# 时间日期类型数据隔离测试
insert into t_datetime values (4, '2024-01-01', '01:01:01', '2024-01-01 01:01:01', '2024-01-01 01:01:01', 2024, '2024-01-01 01:01:01.111111', '2024-01-01 01:01:01.222222', '01:01:01.333333');
insert into t_datetime_fork values (5, '2024-02-02', '02:02:02', '2024-02-02 02:02:02', '2024-02-02 02:02:02', 2024, '2024-02-02 02:02:02.444444', '2024-02-02 02:02:02.555555', '02:02:02.666666');
# 验证数据隔离
select * from t_datetime where id in (4,5) order by id;
id	col_date	col_time	col_datetime	col_timestamp	col_year	col_datetime6	col_timestamp6	col_time6
4	2024-01-01	01:01:01	2024-01-01 01:01:01	2024-01-01 01:01:01	2024	2024-01-01 01:01:01.111111	2024-01-01 01:01:01.222222	01:01:01.333333
select * from t_datetime_fork where id in (4,5) order by id;
id	col_date	col_time	col_datetime	col_timestamp	col_year	col_datetime6	col_timestamp6	col_time6
5	2024-02-02	02:02:02	2024-02-02 02:02:02	2024-02-02 02:02:02	2024	2024-02-02 02:02:02.444444	2024-02-02 02:02:02.555555	02:02:02.666666
============================================
3. 字符串类型Fork测试
============================================
drop table if exists t_string;
Warnings:
Note	1051	Unknown table 'db_fork_datatype.t_string'
drop table if exists t_string_fork;
Warnings:
Note	1051	Unknown table 'db_fork_datatype.t_string_fork'
# 创建包含所有字符串类型的源表
create table t_string (
id int primary key,
-- 定长字符串
col_char char(10),
col_char_bin char(10) binary,
-- 变长字符串
col_varchar varchar(100),
col_varchar_bin varchar(100) binary,
-- 文本类型
col_tinytext tinytext,
col_text text,
col_mediumtext mediumtext,
col_longtext longtext,
-- 二进制字符串
col_binary binary(10),
col_varbinary varbinary(100),
-- 枚举和集合类型
col_enum enum('small','medium','large'),
col_set set('red','green','blue','yellow')
);
# 插入各种字符串数据
insert into t_string values (
1,
'char', 'CHARBIN',                                     -- char类型
'varchar data', 'VARCHAR BIN',                         -- varchar类型
'This is tinytext data',                               -- tinytext
'This is regular text data that can be quite long',    -- text
repeat('Medium text data ', 50),                       -- mediumtext
repeat('Long text data ', 200),                        -- longtext
'binary', 'varbinary data',                            -- 二进制类型
'large',                                               -- enum类型
'red,green,blue'                                       -- set类型
);
insert into t_string values (
2,
'test', 'TESTBIN',                                     -- char类型
'another varchar', 'ANOTHER BIN',                      -- varchar类型
'Another tinytext',                                    -- tinytext
'Another text field with different content',           -- text
repeat('Different medium ', 40),                       -- mediumtext
repeat('Different long ', 150),                        -- longtext
'bin2', 'varbin2',                                     -- 二进制类型
'small',                                               -- enum类型
'yellow,red'                                           -- set类型
);
# 边界值测试
insert into t_string values (
3,
'', '',                                                -- 空字符串
'', '',                                                -- 空varchar
'', '', '', '',                                        -- 空text类型
'', '',                                                -- 空二进制
'medium',                                              -- enum默认值
''                                                     -- 空set
);
# 执行Fork Table
fork table t_string to t_string_fork;
# 验证Fork后的字符串数据
select count(*) as cnt from t_string_fork;
cnt
3
select id, col_char, col_char_bin, col_varchar, col_varchar_bin, col_enum, col_set from t_string_fork order by id;
id	col_char	col_char_bin	col_varchar	col_varchar_bin	col_enum	col_set
1	char	CHARBIN	varchar data	VARCHAR BIN	large	red,green,blue
2	test	TESTBIN	another varchar	ANOTHER BIN	small	red,yellow
3					medium	
# 验证大文本数据长度
select id, 
length(col_tinytext) as tinytext_len,
length(col_text) as text_len,
length(col_mediumtext) as mediumtext_len,
length(col_longtext) as longtext_len
from t_string_fork order by id;
id	tinytext_len	text_len	mediumtext_len	longtext_len
1	21	48	850	3000
2	16	41	680	2250
3	0	0	0	0
# 验证源表数据未受影响
select count(*) as cnt from t_string;
cnt
3
select id, col_char, col_char_bin, col_varchar, col_varchar_bin, col_enum, col_set from t_string order by id;
id	col_char	col_char_bin	col_varchar	col_varchar_bin	col_enum	col_set
1	char	CHARBIN	varchar data	VARCHAR BIN	large	red,green,blue
2	test	TESTBIN	another varchar	ANOTHER BIN	small	red,yellow
3					medium	
select id, 
length(col_tinytext) as tinytext_len,
length(col_text) as text_len,
length(col_mediumtext) as mediumtext_len,
length(col_longtext) as longtext_len
from t_string order by id;
id	tinytext_len	text_len	mediumtext_len	longtext_len
1	21	48	850	3000
2	16	41	680	2250
3	0	0	0	0
# 字符串类型数据隔离测试
insert into t_string values (4, 'source', 'SOURCEBIN', 'source varchar', 'SOURCE BIN', 'Source tiny', 'Source text', 'Source medium', 'Source long', 'srcbin', 'srcvarbin', 'small', 'blue');
insert into t_string_fork values (5, 'fork', 'FORKBIN', 'fork varchar', 'FORK BIN', 'Fork tiny', 'Fork text', 'Fork medium', 'Fork long', 'forkbin', 'forkvarbin', 'large', 'green,yellow');
# 验证数据隔离
select * from t_string where id in (4,5) order by id;
id	col_char	col_char_bin	col_varchar	col_varchar_bin	col_tinytext	col_text	col_mediumtext	col_longtext	col_binary	col_varbinary	col_enum	col_set
4	source	SOURCEBIN	source varchar	SOURCE BIN	Source tiny	Source text	Source medium	Source long	srcbin    	srcvarbin	small	blue
select * from t_string_fork where id in (4,5) order by id;
id	col_char	col_char_bin	col_varchar	col_varchar_bin	col_tinytext	col_text	col_mediumtext	col_longtext	col_binary	col_varbinary	col_enum	col_set
5	fork	FORKBIN	fork varchar	FORK BIN	Fork tiny	Fork text	Fork medium	Fork long	forkbin   	forkvarbin	large	green,yellow
============================================
4. 大对象类型(LOB) Fork测试
============================================
drop table if exists t_lob;
Warnings:
Note	1051	Unknown table 'db_fork_datatype.t_lob'
drop table if exists t_lob_fork;
Warnings:
Note	1051	Unknown table 'db_fork_datatype.t_lob_fork'
# 创建包含LOB类型的源表
create table t_lob (
id int primary key,
-- BLOB类型
col_tinyblob tinyblob,
col_blob blob,
col_mediumblob mediumblob,
col_longblob longblob,
-- TEXT类型（作为LOB处理）
col_tinytext_lob tinytext,
col_text_lob text,
col_mediumtext_lob mediumtext,
col_longtext_lob longtext,
-- 大容量数据字段
col_large_varchar varchar(5000)
);
# 插入LOB数据 - 使用十六进制和长字符串
insert into t_lob values (
1,
x'0102030405060708',                                  -- tinyblob
x'112233445566778899AABBCCDDEEFF',                    -- blob
repeat(x'42', 10000),                                 -- mediumblob (10KB)
repeat(x'43', 50000),                                 -- longblob (50KB)
repeat('TinyText LOB data ', 10),                     -- tinytext
repeat('Regular Text LOB data ', 200),                -- text (约4KB)
repeat('Medium Text LOB data ', 2000),                -- mediumtext (约40KB)
repeat('Long Text LOB data ', 10000),                 -- longtext (约200KB)
repeat('Large varchar data ', 150)                    -- 大varchar
);
insert into t_lob values (
2,
x'F0F1F2F3F4F5F6F7',                                  -- tinyblob
x'99887766554433221100FFEEDDCCBBAA',                  -- blob
repeat(x'44', 5000),                                  -- mediumblob (5KB)
repeat(x'45', 30000),                                 -- longblob (30KB)
repeat('Second TinyText ', 8),                        -- tinytext
repeat('Second Text LOB ', 150),                      -- text
repeat('Second MediumText ', 1000),                   -- mediumtext
repeat('Second LongText ', 5000),                     -- longtext
repeat('Second large varchar ', 100)                  -- 大varchar
);
# 空值测试
insert into t_lob values (
3,
null, null, null, null,                              -- 空BLOB
null, null, null, null,                              -- 空TEXT
null                                                  -- 空varchar
);
# 执行Fork Table
fork table t_lob to t_lob_fork;
# 验证Fork后的LOB数据
select count(*) as cnt from t_lob_fork;
cnt
3
# 验证LOB数据长度和部分内容
select id,
length(col_tinyblob) as tinyblob_len,
length(col_blob) as blob_len,
length(col_mediumblob) as mediumblob_len,
length(col_longblob) as longblob_len,
length(col_tinytext_lob) as tinytext_len,
length(col_text_lob) as text_len,
length(col_mediumtext_lob) as mediumtext_len,
length(col_longtext_lob) as longtext_len,
length(col_large_varchar) as varchar_len
from t_lob_fork order by id;
id	tinyblob_len	blob_len	mediumblob_len	longblob_len	tinytext_len	text_len	mediumtext_len	longtext_len	varchar_len
1	8	15	10000	50000	180	4400	42000	190000	2850
2	8	16	5000	30000	128	2400	18000	80000	2100
3	NULL	NULL	NULL	NULL	NULL	NULL	NULL	NULL	NULL
# 验证LOB数据内容（前100字符）
select id,
hex(substr(col_tinyblob, 1, 8)) as tinyblob_hex,
hex(substr(col_blob, 1, 16)) as blob_hex,
substr(col_tinytext_lob, 1, 30) as tinytext_preview,
substr(col_text_lob, 1, 50) as text_preview
from t_lob_fork order by id;
id	tinyblob_hex	blob_hex	tinytext_preview	text_preview
1	0102030405060708	112233445566778899AABBCCDDEEFF	TinyText LOB data TinyText LOB	Regular Text LOB data Regular Text LOB data Regula
2	F0F1F2F3F4F5F6F7	99887766554433221100FFEEDDCCBBAA	Second TinyText Second TinyTex	Second Text LOB Second Text LOB Second Text LOB Se
3	NULL	NULL	NULL	NULL
# 验证源表数据未受影响
select count(*) as cnt from t_lob;
cnt
3
select id,
length(col_tinyblob) as tinyblob_len,
length(col_blob) as blob_len,
length(col_mediumblob) as mediumblob_len,
length(col_longblob) as longblob_len,
length(col_tinytext_lob) as tinytext_len,
length(col_text_lob) as text_len,
length(col_mediumtext_lob) as mediumtext_len,
length(col_longtext_lob) as longtext_len,
length(col_large_varchar) as varchar_len
from t_lob order by id;
id	tinyblob_len	blob_len	mediumblob_len	longblob_len	tinytext_len	text_len	mediumtext_len	longtext_len	varchar_len
1	8	15	10000	50000	180	4400	42000	190000	2850
2	8	16	5000	30000	128	2400	18000	80000	2100
3	NULL	NULL	NULL	NULL	NULL	NULL	NULL	NULL	NULL
# LOB类型数据隔离测试
insert into t_lob values (
4,
x'1234567890ABCDEF',                                  -- 新tinyblob
x'DEADBEEF12345678',                                  -- 新blob
repeat(x'46', 8000),                                  -- 新mediumblob
repeat(x'47', 40000),                                 -- 新longblob
'Source new tinytext',                                -- 新tinytext
'Source new text data for LOB testing',                -- 新text
repeat('Source medium ', 800),                        -- 新mediumtext
repeat('Source long ', 4000),                         -- 新longtext
'Source large varchar data for testing'               -- 新varchar
);
insert into t_lob_fork values (
5,
x'FEDCBA0987654321',                                  -- Fork tinyblob
x'CAFEBABE87654321',                                  -- Fork blob
repeat(x'48', 9000),                                  -- Fork mediumblob
repeat(x'49', 45000),                                 -- Fork longblob
'Fork new tinytext',                                  -- Fork tinytext
'Fork new text data for LOB testing',                 -- Fork text
repeat('Fork medium ', 900),                          -- Fork mediumtext
repeat('Fork long ', 4500),                           -- 修正：Fork longtext
'Fork large varchar data for testing'                 -- Fork varchar
);
# 验证数据隔离
select id, length(col_blob) as blob_len, substr(col_text_lob, 1, 20) as text_preview 
from t_lob where id in (4,5) order by id;
id	blob_len	text_preview
4	8	Source new text data
select id, length(col_blob) as blob_len, substr(col_text_lob, 1, 20) as text_preview 
from t_lob_fork where id in (4,5) order by id;
id	blob_len	text_preview
5	8	Fork new text data f
============================================
5. JSON类型Fork测试
============================================
drop table if exists t_json;
Warnings:
Note	1051	Unknown table 'db_fork_datatype.t_json'
drop table if exists t_json_fork;
Warnings:
Note	1051	Unknown table 'db_fork_datatype.t_json_fork'
# 创建包含JSON类型的源表
create table t_json (
id int primary key,
col_json json,
col_json_array json,
col_json_object json,
col_json_nested json,
col_json_large json
);
# 插入各种JSON数据
insert into t_json values (
1,
'{"name": "Alice", "age": 25, "city": "Beijing"}',                          -- 简单对象
'[1, 2, 3, 4, 5]',                                                         -- 数组
'{"key1": "value1", "key2": "value2", "number": 123}',                     -- 对象
'{"person": {"name": "Bob", "address": {"street": "Main St", "city": "Shanghai"}}, "tags": ["tag1", "tag2"]}', -- 嵌套对象
concat('{"large": "', repeat('x', 1000), '", "array": [', repeat('1,', 499), '1]}') -- 大JSON
);
insert into t_json values (
2,
'{"product": "Laptop", "price": 999.99, "specs": {"cpu": "i7", "ram": "16GB"}}', -- 复杂对象
'["red", "green", "blue", {"color": "yellow"}]',                            -- 混合数组
'{"boolean": true, "null": null, "number": 456.789}',                      -- 特殊类型
'{"employees": [{"name": "John", "age": 30}, {"name": "Jane", "age": 25}], "department": "IT"}', -- 对象数组
'{"long_array": [1,2,3,4,5,6,7,8,9,10,11,12,13,14,15,16,17,18,19,20]}'    -- 简化长数组
);
# 边界值测试
insert into t_json values (
3,
'{}',               -- 空对象
'[]',               -- 空数组
'null',             -- null值
'true',             -- 布尔值
'false'             -- 布尔值
);
# 执行Fork Table
fork table t_json to t_json_fork;
# 验证Fork后的JSON数据
select count(*) as cnt from t_json_fork;
cnt
3
select id, 
json_length(col_json) as json_len,
json_length(col_json_array) as array_len,
json_length(col_json_object) as object_len,
length(col_json) as json_str_len
from t_json_fork order by id;
id	json_len	array_len	object_len	json_str_len
1	3	5	3	47
2	3	4	3	77
3	0	0	1	2
# 验证JSON内容
select id, 
col_json->>'$.name' as name,
col_json->>'$.age' as age,
col_json_array->'$[0]' as first_elem,
col_json_object->>'$.key1' as key1_value
from t_json_fork where id = 1;
id	name	age	first_elem	key1_value
1	Alice	25	1	value1
# 验证源表数据未受影响
select count(*) as cnt from t_json;
cnt
3
select id, 
json_length(col_json) as json_len,
json_length(col_json_array) as array_len,
json_length(col_json_object) as object_len,
length(col_json) as json_str_len
from t_json order by id;
id	json_len	array_len	object_len	json_str_len
1	3	5	3	47
2	3	4	3	77
3	0	0	1	2
# JSON类型数据隔离测试
insert into t_json values (4, '{"type": "source", "data": "from original table"}', '["source", "array"]', '{"source": true}', '{"nested": {"level": "source"}}', '{"large": "source data"}');
insert into t_json_fork values (5, '{"type": "fork", "data": "from fork table"}', '["fork", "array"]', '{"fork": true}', '{"nested": {"level": "fork"}}', '{"large": "fork data"}');
# 验证数据隔离
select id, col_json->>'$.type' as type, col_json->>'$.data' as data 
from t_json where id in (4,5) order by id;
id	type	data
4	source	from original table
select id, col_json->>'$.type' as type, col_json->>'$.data' as data 
from t_json_fork where id in (4,5) order by id;
id	type	data
5	fork	from fork table
============================================
6. 数组类型（通过JSON模拟）Fork测试
============================================
drop table if exists t_array;
Warnings:
Note	1051	Unknown table 'db_fork_datatype.t_array'
drop table if exists t_array_fork;
Warnings:
Note	1051	Unknown table 'db_fork_datatype.t_array_fork'
# 创建模拟数组的表（使用JSON存储数组）
create table t_array (
id int primary key,
col_int_array json,          -- 整数数组
col_str_array json,          -- 字符串数组
col_mixed_array json,        -- 混合类型数组
col_2d_array json,           -- 二维数组
col_array_of_objects json    -- 对象数组
);
# 插入数组数据
insert into t_array values (
1,
'[1, 2, 3, 4, 5, 10, 20, 30, 40, 50]',                          -- 整数数组
'["apple", "banana", "cherry", "date", "elderberry"]',           -- 字符串数组
'[1, "two", 3.0, true, null, {"key": "value"}]',                -- 混合数组
'[[1, 2, 3], [4, 5, 6], [7, 8, 9]]',                            -- 二维数组
'[{"name": "John", "age": 30}, {"name": "Jane", "age": 25}]'     -- 对象数组
);
insert into t_array values (
2,
'[100, 200, 300, 400, 500]',                                    -- 大整数数组
'["red", "green", "blue", "yellow", "purple", "orange"]',        -- 颜色数组
'[false, 123.456, "string value", [1,2,3]]',                    -- 复杂混合数组
'[[10, 20], [30, 40], [50, 60], [70, 80]]',                     -- 二维数组2
'[{"id": 1, "value": "A"}, {"id": 2, "value": "B"}, {"id": 3, "value": "C"}]' -- 对象数组2
);
# 执行Fork Table
fork table t_array to t_array_fork;
# 验证Fork后的数组数据
select count(*) as cnt from t_array_fork;
cnt
2
select id,
json_length(col_int_array) as int_array_len,
json_length(col_str_array) as str_array_len,
json_length(col_2d_array) as 2d_array_len,
json_length(col_array_of_objects) as obj_array_len
from t_array_fork order by id;
id	int_array_len	str_array_len	2d_array_len	obj_array_len
1	10	5	3	2
2	5	6	4	3
# 验证数组内容
select id,
col_int_array->'$[0]' as first_int,
col_str_array->'$[1]' as second_str,
col_2d_array->'$[0][0]' as matrix_00,
col_array_of_objects->'$[0].name' as first_obj_name
from t_array_fork where id = 1;
id	first_int	second_str	matrix_00	first_obj_name
1	1	"banana"	1	"John"
# 验证源表数据未受影响
select count(*) as cnt from t_array;
cnt
2
select id,
json_length(col_int_array) as int_array_len,
json_length(col_str_array) as str_array_len,
json_length(col_2d_array) as 2d_array_len,
json_length(col_array_of_objects) as obj_array_len
from t_array order by id;
id	int_array_len	str_array_len	2d_array_len	obj_array_len
1	10	5	3	2
2	5	6	4	3
select id,
col_int_array->'$[0]' as first_int,
col_str_array->'$[1]' as second_str,
col_2d_array->'$[0][0]' as matrix_00,
col_array_of_objects->'$[0].name' as first_obj_name
from t_array where id = 1;
id	first_int	second_str	matrix_00	first_obj_name
1	1	"banana"	1	"John"
# 数组类型数据隔离测试
insert into t_array values (3, '[6,7,8]', '["fork","test"]', '[999]', '[[11,12],[13,14]]', '[{"test": "source"}]');
insert into t_array_fork values (4, '[9,10,11]', '["source","test"]', '[888]', '[[15,16],[17,18]]', '[{"test": "fork"}]');
# 验证数据隔离
select id, col_int_array, col_str_array->'$[0]' as first_str 
from t_array where id in (3,4) order by id;
id	col_int_array	first_str
3	[6, 7, 8]	"fork"
select id, col_int_array, col_str_array->'$[0]' as first_str 
from t_array_fork where id in (3,4) order by id;
id	col_int_array	first_str
4	[9, 10, 11]	"source"
============================================
7. 混合类型综合Fork测试
============================================
drop table if exists t_comprehensive;
Warnings:
Note	1051	Unknown table 'db_fork_datatype.t_comprehensive'
drop table if exists t_comprehensive_fork;
Warnings:
Note	1051	Unknown table 'db_fork_datatype.t_comprehensive_fork'
# 创建包含所有类型的综合表
create table t_comprehensive (
id int primary key,
-- 数值类型
col_num_int int,
col_num_decimal decimal(10,2),
col_num_double double,
-- 时间类型
col_date date,
col_datetime datetime,
col_timestamp timestamp,
-- 字符串类型
col_varchar varchar(100),
col_text text,
-- LOB类型
col_blob blob,
col_json json,
-- 数组类型（JSON模拟）
col_array json
);
# 插入综合数据
insert into t_comprehensive values (
1,
12345, 9999.99, 123.456,                    -- 数值类型
'2023-12-25', '2023-12-25 12:30:45', current_timestamp, -- 时间类型
'Sample varchar data',                       -- 字符串
'This is a text field with some content',    -- 文本
x'0102030405060708090A0B0C0D0E0F',          -- BLOB
'{"name": "Test", "values": [1,2,3]}',      -- JSON
'[1, 2, 3, 4, 5]'                           -- 数组
);
insert into t_comprehensive values (
2,
-6789, -1234.56, -78.901,                   -- 负数数值
'1970-01-01', '1970-01-01 00:00:00', '1970-01-01 00:00:01', -- 边界时间
'Another varchar string',                    -- 字符串
repeat('Long text content ', 50),            -- 长文本
repeat(x'42', 1000),                         -- 大BLOB
'{"negative": true, "data": {"nested": "value"}}', -- 复杂JSON
'["a", "b", "c", "d", "e"]'                  -- 字符串数组
);
# 执行Fork Table
fork table t_comprehensive to t_comprehensive_fork;
# 验证Fork后的综合数据
select count(*) as cnt from t_comprehensive_fork;
cnt
2
select id, col_num_int, col_num_decimal, col_date, col_varchar, 
length(col_text) as text_len, length(col_blob) as blob_len,
json_length(col_json) as json_len, json_length(col_array) as array_len
from t_comprehensive_fork order by id;
id	col_num_int	col_num_decimal	col_date	col_varchar	text_len	blob_len	json_len	array_len
1	12345	9999.99	2023-12-25	Sample varchar data	38	15	2	5
2	-6789	-1234.56	1970-01-01	Another varchar string	900	1000	2	5
# 验证源表数据未受影响
select count(*) as cnt from t_comprehensive;
cnt
2
select id, col_num_int, col_num_decimal, col_date, col_varchar, 
length(col_text) as text_len, length(col_blob) as blob_len,
json_length(col_json) as json_len, json_length(col_array) as array_len
from t_comprehensive order by id;
id	col_num_int	col_num_decimal	col_date	col_varchar	text_len	blob_len	json_len	array_len
1	12345	9999.99	2023-12-25	Sample varchar data	38	15	2	5
2	-6789	-1234.56	1970-01-01	Another varchar string	900	1000	2	5
# 综合类型数据隔离测试
# 在源表和Fork表中分别插入不同数据
insert into t_comprehensive values (
3,
333, 333.33, 333.333,
'2024-01-01', '2024-01-01 01:01:01', current_timestamp,
'Source new data',
'Source text content',
x'3333333333333333',
'{"source": "new data"}',
'[3, 3, 3]'
);
insert into t_comprehensive_fork values (
4,
444, 444.44, 444.444,
'2024-02-02', '2024-02-02 02:02:02', current_timestamp,
'Fork new data',
'Fork text content',
x'4444444444444444',
'{"fork": "new data"}',
'[4, 4, 4]'
);
# 验证数据隔离
select id, col_num_int, col_varchar, col_json->>'$.source' as source_data 
from t_comprehensive where id in (3,4) order by id;
id	col_num_int	col_varchar	source_data
3	333	Source new data	new data
select id, col_num_int, col_varchar, col_json->>'$.fork' as fork_data 
from t_comprehensive_fork where id in (3,4) order by id;
id	col_num_int	col_varchar	fork_data
4	444	Fork new data	new data
============================================
8. 清理测试环境
============================================
drop table if exists t_numeric;
drop table if exists t_numeric_fork;
drop table if exists t_datetime;
drop table if exists t_datetime_fork;
drop table if exists t_string;
drop table if exists t_string_fork;
drop table if exists t_lob;
drop table if exists t_lob_fork;
drop table if exists t_json;
drop table if exists t_json_fork;
drop table if exists t_array;
drop table if exists t_array_fork;
drop table if exists t_comprehensive;
drop table if exists t_comprehensive_fork;
drop database if exists db_fork_datatype;
alter system set _ob_enable_truncate_partition_preserve_global_index = false;
