DROP TABLE IF EXISTS t1,t2,t3,t4,t5,t6,t7,t8,t9,t10,t11,t12,t13,t14,t15,t16,t17,t18;
CREATE TABLE t8 (a char(10) character set utf8 not null);
INSERT INTO t8 VALUES ('a'),('a\0'),('a\t'),('a ');
SELECT hex(a),a='a', a='a ' FROM t8;
hex(a)	a='a'	a='a '
61	1	1
6100	0	0
6109	0	0
61	1	1
DROP TABLE t8;
CREATE TABLE t8(a VARCHAR(255), KEY(a)) DEFAULT CHARSET=utf8;
INSERT INTO t8 VALUES('uUABCDEFGHIGKLMNOPRSTUVWXYZbbbbbbbbbbbbbbbbbbbbbbbbbbbbbbbbbbbbbbbbbbbbbbbbbbbbbbbbbbbbbbbbbbbbbbbbbbbbbbbbbbbbbbbbbbbbbbbbbbbbbbbbbbbbbbbbbbbbbbbbbbbbbbbbbbbbbbbbbbbbbbbbbbbbbbbbbbbbbbbbbbbbbbbbbbbbbbbbbbbbbbbbbbbbbbbbbbbbbbbbbbbbbbbbbbbbbbbbbbbbbbbbbbb');
INSERT INTO t8 VALUES('uu');
INSERT INTO t8 VALUES('uU');
INSERT INTO t8 VALUES('uu');
INSERT INTO t8 VALUES('uuABC');
INSERT INTO t8 VALUES('UuABC');
INSERT INTO t8 VALUES('uuABC');
alter table t8 add b int;
INSERT INTO t8 VALUES('BCDEFGHIGKLMNOPRSTUVWXYZbbbbbbbbbbbbbbbbbbbbbbbbbbbbbbbbbbbbbbbbbbbbbbbbbbbbbbbbbbbbbbbbbbbbbbbbbbbbbbbbbbbbbbbbbbbbbbbbbbbbbbbbbbbbbbbbbbbbbbbbbbbbbbbbbbbbbbbbbbbbbbbbbbbbbbbbbbbbbbbbbbbbbbbbbbbbbbbbbbbbbbbbbbbbbbbbbbbbbbbbbbbbbbbbbbbbbbbbbbbbbbbbbbb',1);
INSERT INTO t8 VALUES('uuABCDEFGHIGKLMNOPRSTUVWXYZbbbbbbbbbbbbbbbbbbbbbbbbbbbbbbbbbbbbbbbbbbbbbbbbbbbbbbbbbbbbbbbbbbbbbbbbbbbbbbbbbbbbbbbbbbbbbbbbbbbbbbbbbbbbbbbbbbbbbbbbbbbbbbbbbbbbbbbbbbbbbbbbbbbbbbbbbbbbbbbbbbbbbbbbbbbbbbbbbbbbbbbbbbbbbbbbbbbbbbbbbbbbbbbbbbbbbbbbbbbbbbbbbbb',2);
delete from t8 where b=1;
INSERT INTO t8 VALUES('UUABCDEFGHIGKLMNOPRSTUVWXYZbbbbbbbbbbbbbbbbbbbbbbbbbbbbbbbbbbbbbbbbbbbbbbbbbbbbbbbbbbbbbbbbbbbbbbbbbbbbbbbbbbbbbbbbbbbbbbbbbbbbbbbbbbbbbbbbbbbbbbbbbbbbbbbbbbbbbbbbbbbbbbbbbbbbbbbbbbbbbbbbbbbbbbbbbbbbbbbbbbbbbbbbbbbbbbbbbbbbbbbbbbbbbbbbbbbbbbbbbbbbbbbbbbb',1);
INSERT INTO t8 VALUES('uuABCDEFGHIGKLMNOPRSTUVWXYZbbbbbbbbbbbbbbbbbbbbbbbbbbbbbbbbbbbbbbbbbbbbbbbbbbbbbbbbbbbbbbbbbbbbbbbbbbbbbbbbbbbbbbbbbbbbbbbbbbbbbbbbbbbbbbbbbbbbbbbbbbbbbbbbbbbbbbbbbbbbbbbbbbbbbbbbbbbbbbbbbbbbbbbbbbbbbbbbbbbbbbbbbbbbbbbbbbbbbbbbbbbbbbbbbbbbbbbbbbbbbbbbbbb',3);
INSERT INTO t8 VALUES('uuABCDEFGHIGKLMNOPRSTUVWXYZbbbbbbbbbbbbbbbbbbbbbbbbbbbbbbbbbbbbbbbbbbbbbbbbbbbbbbbbbbbbbbbbbbbbbbbbbbbbbbbbbbbbbbbbbbbbbbbbbbbbbbbbbbbbbbbbbbbbbbbbbbbbbbbbbbbbbbbbbbbbbbbbbbbbbbbbbbbbbbbbbbbbbbbbbbbbbbbbbbbbbbbbbbbbbbbbbbbbbbbbbbbbbbbbbbbbbbbbbbbbbbbbbbb',4);
delete from t8 where b=3;
INSERT INTO t8 VALUES('uUABCDEFGHIGKLMNOPRSTUVWXYZbbbbbbbbbbbbbbbbbbbbbbbbbbbbbbbbbbbbbbbbbbbbbbbbbbbbbbbbbbbbbbbbbbbbbbbbbbbbbbbbbbbbbbbbbbbbbbbbbbbbbbbbbbbbbbbbbbbbbbbbbbbbbbbbbbbbbbbbbbbbbbbbbbbbbbbbbbbbbbbbbbbbbbbbbbbbbbbbbbbbbbbbbbbbbbbbbbbbbbbbbbbbbbbbbbbbbbbbbbbbbbbbbbb',3);
UPDATE t8 SET a=REPEAT('Z',255) WHERE a LIKE 'uu%';
SELECT a,LENGTH(a) FROM t8;
a	LENGTH(a)
ZZZZZZZZZZZZZZZZZZZZZZZZZZZZZZZZZZZZZZZZZZZZZZZZZZZZZZZZZZZZZZZZZZZZZZZZZZZZZZZZZZZZZZZZZZZZZZZZZZZZZZZZZZZZZZZZZZZZZZZZZZZZZZZZZZZZZZZZZZZZZZZZZZZZZZZZZZZZZZZZZZZZZZZZZZZZZZZZZZZZZZZZZZZZZZZZZZZZZZZZZZZZZZZZZZZZZZZZZZZZZZZZZZZZZZZZZZZZZZZZZZZZZZZZZZZZZZZ	255
ZZZZZZZZZZZZZZZZZZZZZZZZZZZZZZZZZZZZZZZZZZZZZZZZZZZZZZZZZZZZZZZZZZZZZZZZZZZZZZZZZZZZZZZZZZZZZZZZZZZZZZZZZZZZZZZZZZZZZZZZZZZZZZZZZZZZZZZZZZZZZZZZZZZZZZZZZZZZZZZZZZZZZZZZZZZZZZZZZZZZZZZZZZZZZZZZZZZZZZZZZZZZZZZZZZZZZZZZZZZZZZZZZZZZZZZZZZZZZZZZZZZZZZZZZZZZZZZ	255
ZZZZZZZZZZZZZZZZZZZZZZZZZZZZZZZZZZZZZZZZZZZZZZZZZZZZZZZZZZZZZZZZZZZZZZZZZZZZZZZZZZZZZZZZZZZZZZZZZZZZZZZZZZZZZZZZZZZZZZZZZZZZZZZZZZZZZZZZZZZZZZZZZZZZZZZZZZZZZZZZZZZZZZZZZZZZZZZZZZZZZZZZZZZZZZZZZZZZZZZZZZZZZZZZZZZZZZZZZZZZZZZZZZZZZZZZZZZZZZZZZZZZZZZZZZZZZZZ	255
ZZZZZZZZZZZZZZZZZZZZZZZZZZZZZZZZZZZZZZZZZZZZZZZZZZZZZZZZZZZZZZZZZZZZZZZZZZZZZZZZZZZZZZZZZZZZZZZZZZZZZZZZZZZZZZZZZZZZZZZZZZZZZZZZZZZZZZZZZZZZZZZZZZZZZZZZZZZZZZZZZZZZZZZZZZZZZZZZZZZZZZZZZZZZZZZZZZZZZZZZZZZZZZZZZZZZZZZZZZZZZZZZZZZZZZZZZZZZZZZZZZZZZZZZZZZZZZZ	255
ZZZZZZZZZZZZZZZZZZZZZZZZZZZZZZZZZZZZZZZZZZZZZZZZZZZZZZZZZZZZZZZZZZZZZZZZZZZZZZZZZZZZZZZZZZZZZZZZZZZZZZZZZZZZZZZZZZZZZZZZZZZZZZZZZZZZZZZZZZZZZZZZZZZZZZZZZZZZZZZZZZZZZZZZZZZZZZZZZZZZZZZZZZZZZZZZZZZZZZZZZZZZZZZZZZZZZZZZZZZZZZZZZZZZZZZZZZZZZZZZZZZZZZZZZZZZZZZ	255
ZZZZZZZZZZZZZZZZZZZZZZZZZZZZZZZZZZZZZZZZZZZZZZZZZZZZZZZZZZZZZZZZZZZZZZZZZZZZZZZZZZZZZZZZZZZZZZZZZZZZZZZZZZZZZZZZZZZZZZZZZZZZZZZZZZZZZZZZZZZZZZZZZZZZZZZZZZZZZZZZZZZZZZZZZZZZZZZZZZZZZZZZZZZZZZZZZZZZZZZZZZZZZZZZZZZZZZZZZZZZZZZZZZZZZZZZZZZZZZZZZZZZZZZZZZZZZZZ	255
ZZZZZZZZZZZZZZZZZZZZZZZZZZZZZZZZZZZZZZZZZZZZZZZZZZZZZZZZZZZZZZZZZZZZZZZZZZZZZZZZZZZZZZZZZZZZZZZZZZZZZZZZZZZZZZZZZZZZZZZZZZZZZZZZZZZZZZZZZZZZZZZZZZZZZZZZZZZZZZZZZZZZZZZZZZZZZZZZZZZZZZZZZZZZZZZZZZZZZZZZZZZZZZZZZZZZZZZZZZZZZZZZZZZZZZZZZZZZZZZZZZZZZZZZZZZZZZZ	255
ZZZZZZZZZZZZZZZZZZZZZZZZZZZZZZZZZZZZZZZZZZZZZZZZZZZZZZZZZZZZZZZZZZZZZZZZZZZZZZZZZZZZZZZZZZZZZZZZZZZZZZZZZZZZZZZZZZZZZZZZZZZZZZZZZZZZZZZZZZZZZZZZZZZZZZZZZZZZZZZZZZZZZZZZZZZZZZZZZZZZZZZZZZZZZZZZZZZZZZZZZZZZZZZZZZZZZZZZZZZZZZZZZZZZZZZZZZZZZZZZZZZZZZZZZZZZZZZ	255
ZZZZZZZZZZZZZZZZZZZZZZZZZZZZZZZZZZZZZZZZZZZZZZZZZZZZZZZZZZZZZZZZZZZZZZZZZZZZZZZZZZZZZZZZZZZZZZZZZZZZZZZZZZZZZZZZZZZZZZZZZZZZZZZZZZZZZZZZZZZZZZZZZZZZZZZZZZZZZZZZZZZZZZZZZZZZZZZZZZZZZZZZZZZZZZZZZZZZZZZZZZZZZZZZZZZZZZZZZZZZZZZZZZZZZZZZZZZZZZZZZZZZZZZZZZZZZZZ	255
ZZZZZZZZZZZZZZZZZZZZZZZZZZZZZZZZZZZZZZZZZZZZZZZZZZZZZZZZZZZZZZZZZZZZZZZZZZZZZZZZZZZZZZZZZZZZZZZZZZZZZZZZZZZZZZZZZZZZZZZZZZZZZZZZZZZZZZZZZZZZZZZZZZZZZZZZZZZZZZZZZZZZZZZZZZZZZZZZZZZZZZZZZZZZZZZZZZZZZZZZZZZZZZZZZZZZZZZZZZZZZZZZZZZZZZZZZZZZZZZZZZZZZZZZZZZZZZZ	255
ZZZZZZZZZZZZZZZZZZZZZZZZZZZZZZZZZZZZZZZZZZZZZZZZZZZZZZZZZZZZZZZZZZZZZZZZZZZZZZZZZZZZZZZZZZZZZZZZZZZZZZZZZZZZZZZZZZZZZZZZZZZZZZZZZZZZZZZZZZZZZZZZZZZZZZZZZZZZZZZZZZZZZZZZZZZZZZZZZZZZZZZZZZZZZZZZZZZZZZZZZZZZZZZZZZZZZZZZZZZZZZZZZZZZZZZZZZZZZZZZZZZZZZZZZZZZZZZ	255
drop table t8;
SET collation_connection = 'utf8_general_ci';
CREATE TABLE t8 (c1 varchar(65536) character set utf8 collate utf8_general_ci);
insert into t8 values (repeat('बांग्लादे',1200));
insert into t8 values ('রবীন্দ্রনাথ ঠাকুর');
ALTER TABLE t8 ADD c2 varchar(65536) CHARACTER SET utf8 collate utf8_general_ci DEFAULT NULL;
INSERT INTO t8 values (repeat('রবীন্দ্রনাথ ঠাকুর',1300),'');
UPDATE t8 SET c2='यह हिन्दी में एक अलग वाक्य है. यह एक अलग कॉलम में जोड़ा जा रहा है' WHERE c2=NULL;
SELECT length(c1),c1, length(c2),c2 FROM t8;
length(c1)	c1	length(c2)	c2
32400	बांग्लादेबांग्लादेबांग्लादेबांग्लादेबांग्लादेबांग्लादेबांग्लादेबांग्लादेबांग्लादेबांग्लादेबांग्लादेबांग्लादेबांग्लादेबांग्लादेबांग्लादेबांग्लादेबांग्लादेबांग्लादेबांग्लादेबांग्लादेबांग्लादेबांग्लादेबांग्लादेबांग्लादेबांग्लादेबांग्लादेबांग्लादेबांग्लादेबांग्लादेबांग्लादेबांग्लादेबांग्लादेबांग्लादेबांग्लादेबांग्लादेबांग्लादेबांग्लादेबांग्लादेबांग्लादेबांग्लादेबांग्लादेबांग्लादेबांग्लादेबांग्लादेबांग्लादेबांग्लादेबांग्लादेबांग्लादेबांग्लादेबांग्लादेबांग्लादेबांग्लादेबांग्लादेबांग्लादेबांग्लादेबांग्लादेबांग्लादेबांग्लादेबांग्लादेबांग्लादेबांग्लादेबांग्लादेबांग्लादेबांग्लादेबांग्लादेबांग्लादेबांग्लादेबांग्लादेबांग्लादेबांग्लादेबांग्लादेबांग्लादेबांग्लादेबांग्लादेबांग्लादेबांग्लादेबांग्लादेबांग्लादेबांग्लादेबांग्लादेबांग्लादेबांग्लादेबांग्लादेबांग्लादेबांग्लादेबांग्लादेबांग्लादेबांग्लादेबांग्लादेबांग्लादेबांग्लादेबांग्लादेबांग्लादेबांग्लादेबांग्लादेबांग्लादेबांग्लादेबांग्लादेबांग्लादेबांग्लादेबांग्लादेबांग्लादेबांग्लादेबांग्लादेबांग्लादेबांग्लादेबांग्लादेबांग्लादेबांग्लादेबांग्लादेबांग्लादेबांग्लादेबांग्लादेबांग्लादेबांग्लादेबांग्लादेबांग्लादेबांग्लादेबांग्लादेबांग्लादेबांग्लादेबांग्लादेबांग्लादेबांग्लादेबांग्लादेबांग्लादेबांग्लादेबांग्लादेबांग्लादेबांग्लादेबांग्लादेबांग्लादेबांग्लादेबांग्लादेबांग्लादेबांग्लादेबांग्लादेबांग्लादेबांग्लादेबांग्लादेबांग्लादेबांग्लादेबांग्लादेबांग्लादेबांग्लादेबांग्लादेबांग्लादेबांग्लादेबांग्लादेबांग्लादेबांग्लादेबांग्लादेबांग्लादेबांग्लादेबांग्लादेबांग्लादेबांग्लादेबांग्लादेबांग्लादेबांग्लादेबांग्लादेबांग्लादेबांग्लादेबांग्लादेबांग्लादेबांग्लादेबांग्लादेबांग्लादेबांग्लादेबांग्लादेबांग्लादेबांग्लादेबांग्लादेबांग्लादेबांग्लादेबांग्लादेबांग्लादेबांग्लादेबांग्लादेबांग्लादेबांग्लादेबांग्लादेबांग्लादेबांग्लादेबांग्लादेबांग्लादेबांग्लादेबांग्लादेबांग्लादेबांग्लादेबांग्लादेबांग्लादेबांग्लादेबांग्लादेबांग्लादेबांग्लादेबांग्लादेबांग्लादेबांग्लादेबांग्लादेबांग्लादेबांग्लादेबांग्लादेबांग्लादेबांग्लादेबांग्लादेबांग्लादेबांग्लादेबांग्लादेबांग्लादेबांग्लादेबांग्लादेबांग्लादेबांग्लादेबांग्लादेबांग्लादेबांग्लादेबांग्लादेबांग्लादेबांग्लादेबांग्लादेबांग्लादेबांग्लादेबांग्लादेबांग्लादेबांग्लादेबांग्लादेबांग्लादेबांग्लादेबांग्लादेबांग्लादेबांग्लादेबांग्लादेबांग्लादेबांग्लादेबांग्लादेबांग्लादेबांग्लादेबांग्लादेबांग्लादेबांग्लादेबांग्लादेबांग्लादेबांग्लादेबांग्लादेबांग्लादेबांग्लादेबांग्लादेबांग्लादेबांग्लादेबांग्लादेबांग्लादेबांग्लादेबांग्लादेबांग्लादेबांग्लादेबांग्लादेबांग्लादेबांग्लादेबांग्लादेबांग्लादेबांग्लादेबांग्लादेबांग्लादेबांग्लादेबांग्लादेबांग्लादेबांग्लादेबांग्लादेबांग्लादेबांग्लादेबांग्लादेबांग्लादेबांग्लादेबांग्लादेबांग्लादेबांग्लादेबांग्लादेबांग्लादेबांग्लादेबांग्लादेबांग्लादेबांग्लादेबांग्लादेबांग्लादेबांग्लादेबांग्लादेबांग्लादेबांग्लादेबांग्लादेबांग्लादेबांग्लादेबांग्लादेबांग्लादेबांग्लादेबांग्लादेबांग्लादेबांग्लादेबांग्लादेबांग्लादेबांग्लादेबांग्लादेबांग्लादेबांग्लादेबांग्लादेबांग्लादेबांग्लादेबांग्लादेबांग्लादेबांग्लादेबांग्लादेबांग्लादेबांग्लादेबांग्लादेबांग्लादेबांग्लादेबांग्लादेबांग्लादेबांग्लादेबांग्लादेबांग्लादेबांग्लादेबांग्लादेबांग्लादेबांग्लादेबांग्लादेबांग्लादेबांग्लादेबांग्लादेबांग्लादेबांग्लादेबांग्लादेबांग्लादेबांग्लादेबांग्लादेबांग्लादेबांग्लादेबांग्लादेबांग्लादेबांग्लादेबांग्लादेबांग्लादेबांग्लादेबांग्लादेबांग्लादेबांग्लादेबांग्लादेबांग्लादेबांग्लादेबांग्लादेबांग्लादेबांग्लादेबांग्लादेबांग्लादेबांग्लादेबांग्लादेबांग्लादेबांग्लादेबांग्लादेबांग्लादेबांग्लादेबांग्लादेबांग्लादेबांग्लादेबांग्लादेबांग्लादेबांग्लादेबांग्लादेबांग्लादेबांग्लादेबांग्लादेबांग्लादेबांग्लादेबांग्लादेबांग्लादेबांग्लादेबांग्लादेबांग्लादेबांग्लादेबांग्लादेबांग्लादेबांग्लादेबांग्लादेबांग्लादेबांग्लादेबांग्लादेबांग्लादेबांग्लादेबांग्लादेबांग्लादेबांग्लादेबांग्लादेबांग्लादेबांग्लादेबांग्लादेबांग्लादेबांग्लादेबांग्लादेबांग्लादेबांग्लादेबांग्लादेबांग्लादेबांग्लादेबांग्लादेबांग्लादेबांग्लादेबांग्लादेबांग्लादेबांग्लादेबांग्लादेबांग्लादेबांग्लादेबांग्लादेबांग्लादेबांग्लादेबांग्लादेबांग्लादेबांग्लादेबांग्लादेबांग्लादेबांग्लादेबांग्लादेबांग्लादेबांग्लादेबांग्लादेबांग्लादेबांग्लादेबांग्लादेबांग्लादेबांग्लादेबांग्लादेबांग्लादेबांग्लादेबांग्लादेबांग्लादेबांग्लादेबांग्लादेबांग्लादेबांग्लादेबांग्लादेबांग्लादेबांग्लादेबांग्लादेबांग्लादेबांग्लादेबांग्लादेबांग्लादेबांग्लादेबांग्लादेबांग्लादेबांग्लादेबांग्लादेबांग्लादेबांग्लादेबांग्लादेबांग्लादेबांग्लादेबांग्लादेबांग्लादेबांग्लादेबांग्लादेबांग्लादेबांग्लादेबांग्लादेबांग्लादेबांग्लादेबांग्लादेबांग्लादेबांग्लादेबांग्लादेबांग्लादेबांग्लादेबांग्लादेबांग्लादेबांग्लादेबांग्लादेबांग्लादेबांग्लादेबांग्लादेबांग्लादेबांग्लादेबांग्लादेबांग्लादेबांग्लादेबांग्लादेबांग्लादेबांग्लादेबांग्लादेबांग्लादेबांग्लादेबांग्लादेबांग्लादेबांग्लादेबांग्लादेबांग्लादेबांग्लादेबांग्लादेबांग्लादेबांग्लादेबांग्लादेबांग्लादेबांग्लादेबांग्लादेबांग्लादेबांग्लादेबांग्लादेबांग्लादेबांग्लादेबांग्लादेबांग्लादेबांग्लादेबांग्लादेबांग्लादेबांग्लादेबांग्लादेबांग्लादेबांग्लादेबांग्लादेबांग्लादेबांग्लादेबांग्लादेबांग्लादेबांग्लादेबांग्लादेबांग्लादेबांग्लादेबांग्लादेबांग्लादेबांग्लादेबांग्लादेबांग्लादेबांग्लादेबांग्लादेबांग्लादेबांग्लादेबांग्लादेबांग्लादेबांग्लादेबांग्लादेबांग्लादेबांग्लादेबांग्लादेबांग्लादेबांग्लादेबांग्लादेबांग्लादेबांग्लादेबांग्लादेबांग्लादेबांग्लादेबांग्लादेबांग्लादेबांग्लादेबांग्लादेबांग्लादेबांग्लादेबांग्लादेबांग्लादेबांग्लादेबांग्लादेबांग्लादेबांग्लादेबांग्लादेबांग्लादेबांग्लादेबांग्लादेबांग्लादेबांग्लादेबांग्लादेबांग्लादेबांग्लादेबांग्लादेबांग्लादेबांग्लादेबांग्लादेबांग्लादेबांग्लादेबांग्लादेबांग्लादेबांग्लादेबांग्लादेबांग्लादेबांग्लादेबांग्लादेबांग्लादेबांग्लादेबांग्लादेबांग्लादेबांग्लादेबांग्लादेबांग्लादेबांग्लादेबांग्लादेबांग्लादेबांग्लादेबांग्लादेबांग्लादेबांग्लादेबांग्लादेबांग्लादेबांग्लादेबांग्लादेबांग्लादेबांग्लादेबांग्लादेबांग्लादेबांग्लादेबांग्लादेबांग्लादेबांग्लादेबांग्लादेबांग्लादेबांग्लादेबांग्लादेबांग्लादेबांग्लादेबांग्लादेबांग्लादेबांग्लादेबांग्लादेबांग्लादेबांग्लादेबांग्लादेबांग्लादेबांग्लादेबांग्लादेबांग्लादेबांग्लादेबांग्लादेबांग्लादेबांग्लादेबांग्लादेबांग्लादेबांग्लादेबांग्लादेबांग्लादेबांग्लादेबांग्लादेबांग्लादेबांग्लादेबांग्लादेबांग्लादेबांग्लादेबांग्लादेबांग्लादेबांग्लादेबांग्लादेबांग्लादेबांग्लादेबांग्लादेबांग्लादेबांग्लादेबांग्लादेबांग्लादेबांग्लादेबांग्लादेबांग्लादेबांग्लादेबांग्लादेबांग्लादेबांग्लादेबांग्लादेबांग्लादेबांग्लादेबांग्लादेबांग्लादेबांग्लादेबांग्लादेबांग्लादेबांग्लादेबांग्लादेबांग्लादेबांग्लादेबांग्लादेबांग्लादेबांग्लादेबांग्लादेबांग्लादेबांग्लादेबांग्लादेबांग्लादेबांग्लादेबांग्लादेबांग्लादेबांग्लादेबांग्लादेबांग्लादेबांग्लादेबांग्लादेबांग्लादेबांग्लादेबांग्लादेबांग्लादेबांग्लादेबांग्लादेबांग्लादेबांग्लादेबांग्लादेबांग्लादेबांग्लादेबांग्लादेबांग्लादेबांग्लादेबांग्लादेबांग्लादेबांग्लादेबांग्लादेबांग्लादेबांग्लादेबांग्लादेबांग्लादेबांग्लादेबांग्लादेबांग्लादेबांग्लादेबांग्लादेबांग्लादेबांग्लादेबांग्लादेबांग्लादेबांग्लादेबांग्लादेबांग्लादेबांग्लादेबांग्लादेबांग्लादेबांग्लादेबांग्लादेबांग्लादेबांग्लादेबांग्लादेबांग्लादेबांग्लादेबांग्लादेबांग्लादेबांग्लादेबांग्लादेबांग्लादेबांग्लादेबांग्लादेबांग्लादेबांग्लादेबांग्लादेबांग्लादेबांग्लादेबांग्लादेबांग्लादेबांग्लादेबांग्लादेबांग्लादेबांग्लादेबांग्लादेबांग्लादेबांग्लादेबांग्लादेबांग्लादेबांग्लादेबांग्लादेबांग्लादेबांग्लादेबांग्लादेबांग्लादेबांग्लादेबांग्लादेबांग्लादेबांग्लादेबांग्लादेबांग्लादेबांग्लादेबांग्लादेबांग्लादेबांग्लादेबांग्लादेबांग्लादेबांग्लादेबांग्लादेबांग्लादेबांग्लादेबांग्लादेबांग्लादेबांग्लादेबांग्लादेबांग्लादेबांग्लादेबांग्लादेबांग्लादेबांग्लादेबांग्लादेबांग्लादेबांग्लादेबांग्लादेबांग्लादेबांग्लादेबांग्लादेबांग्लादेबांग्लादेबांग्लादेबांग्लादेबांग्लादेबांग्लादेबांग्लादेबांग्लादेबांग्लादेबांग्लादेबांग्लादेबांग्लादेबांग्लादेबांग्लादेबांग्लादेबांग्लादेबांग्लादेबांग्लादेबांग्लादेबांग्लादेबांग्लादेबांग्लादेबांग्लादेबांग्लादेबांग्लादेबांग्लादेबांग्लादेबांग्लादेबांग्लादेबांग्लादेबांग्लादेबांग्लादेबांग्लादेबांग्लादेबांग्लादेबांग्लादेबांग्लादेबांग्लादेबांग्लादेबांग्लादेबांग्लादेबांग्लादेबांग्लादेबांग्लादेबांग्लादेबांग्लादेबांग्लादेबांग्लादेबांग्लादेबांग्लादेबांग्लादेबांग्लादेबांग्लादेबांग्लादेबांग्लादेबांग्लादेबांग्लादेबांग्लादेबांग्लादेबांग्लादेबांग्लादेबांग्लादेबांग्लादेबांग्लादेबांग्लादेबांग्लादेबांग्लादेबांग्लादेबांग्लादेबांग्लादेबांग्लादेबांग्लादेबांग्लादेबांग्लादेबांग्लादेबांग्लादेबांग्लादेबांग्लादेबांग्लादेबांग्लादेबांग्लादेबांग्लादेबांग्लादेबांग्लादेबांग्लादेबांग्लादेबांग्लादेबांग्लादेबांग्लादेबांग्लादेबांग्लादेबांग्लादेबांग्लादेबांग्लादेबांग्लादेबांग्लादेबांग्लादेबांग्लादेबांग्लादेबांग्लादेबांग्लादेबांग्लादेबांग्लादेबांग्लादेबांग्लादेबांग्लादेबांग्लादेबांग्लादेबांग्लादेबांग्लादेबांग्लादेबांग्लादेबांग्लादेबांग्लादेबांग्लादेबांग्लादेबांग्लादेबांग्लादेबांग्लादेबांग्लादेबांग्लादेबांग्लादेबांग्लादेबांग्लादेबांग्लादेबांग्लादेबांग्लादेबांग्लादेबांग्लादेबांग्लादेबांग्लादेबांग्लादेबांग्लादेबांग्लादेबांग्लादेबांग्लादेबांग्लादेबांग्लादेबांग्लादेबांग्लादेबांग्लादेबांग्लादेबांग्लादेबांग्लादेबांग्लादेबांग्लादेबांग्लादेबांग्लादेबांग्लादेबांग्लादेबांग्लादेबांग्लादेबांग्लादेबांग्लादेबांग्लादेबांग्लादेबांग्लादेबांग्लादेबांग्लादेबांग्लादेबांग्लादेबांग्लादेबांग्लादेबांग्लादेबांग्लादेबांग्लादेबांग्लादेबांग्लादेबांग्लादेबांग्लादेबांग्लादेबांग्लादेबांग्लादेबांग्लादेबांग्लादेबांग्लादेबांग्लादेबांग्लादेबांग्लादेबांग्लादेबांग्लादेबांग्लादेबांग्लादेबांग्लादेबांग्लादेबांग्लादेबांग्लादेबांग्लादेबांग्लादेबांग्लादेबांग्लादेबांग्लादेबांग्लादेबांग्लादेबांग्लादेबांग्लादेबांग्लादेबांग्लादेबांग्लादेबांग्लादेबांग्लादेबांग्लादेबांग्लादेबांग्लादेबांग्लादेबांग्लादेबांग्लादेबांग्लादेबांग्लादेबांग्लादेबांग्लादेबांग्लादेबांग्लादेबांग्लादेबांग्लादेबांग्लादेबांग्लादेबांग्लादेबांग्लादेबांग्लादेबांग्लादेबांग्लादेबांग्लादेबांग्लादेबांग्लादेबांग्लादेबांग्लादेबांग्लादेबांग्लादेबांग्लादेबांग्लादेबांग्लादेबांग्लादेबांग्लादेबांग्लादेबांग्लादेबांग्लादेबांग्लादेबांग्लादेबांग्लादेबांग्लादेबांग्लादेबांग्लादेबांग्लादेबांग्लादेबांग्लादेबांग्लादेबांग्लादेबांग्लादेबांग्लादेबांग्लादेबांग्लादेबांग्लादेबांग्लादेबांग्लादेबांग्लादेबांग्लादेबांग्लादेबांग्लादेबांग्लादेबांग्लादेबांग्लादेबांग्लादेबांग्लादेबांग्लादेबांग्लादेबांग्लादेबांग्लादेबांग्लादेबांग्लादेबांग्लादेबांग्लादेबांग्लादेबांग्लादेबांग्लादेबांग्लादेबांग्लादेबांग्लादेबांग्लादेबांग्लादेबांग्लादेबांग्लादेबांग्लादेबांग्लादेबांग्लादेबांग्लादेबांग्लादेबांग्लादेबांग्लादेबांग्लादेबांग्लादेबांग्लादेबांग्लादेबांग्लादेबांग्लादेबांग्लादेबांग्लादेबांग्लादेबांग्लादेबांग्लादेबांग्लादेबांग्लादेबांग्लादेबांग्लादेबांग्लादेबांग्लादेबांग्लादेबांग्लादेबांग्लादेबांग्लादेबांग्लादेबांग्लादेबांग्लादेबांग्लादेबांग्लादेबांग्लादेबांग्लादेबांग्लादेबांग्लादेबांग्लादेबांग्लादेबांग्लादेबांग्लादेबांग्लादेबांग्लादेबांग्लादेबांग्लादेबांग्लादेबांग्लादेबांग्लादेबांग्लादेबांग्लादेबांग्लादेबांग्लादेबांग्लादेबांग्लादेबांग्लादेबांग्लादेबांग्लादेबांग्लादेबांग्लादेबांग्लादेबांग्लादेबांग्लादेबांग्लादेबांग्लादेबांग्लादेबांग्लादेबांग्लादेबांग्लादेबांग्लादेबांग्लादेबांग्लादेबांग्लादेबांग्लादेबांग्लादेबांग्लादेबांग्लादेबांग्लादेबांग्लादेबांग्लादेबांग्लादेबांग्लादेबांग्लादेबांग्लादेबांग्लादेबांग्लादेबांग्लादेबांग्लादेबांग्लादेबांग्लादेबांग्लादेबांग्लादेबांग्लादेबांग्लादेबांग्लादेबांग्लादेबांग्लादेबांग्लादेबांग्लादेबांग्लादेबांग्लादेबांग्लादेबांग्लादेबांग्लादेबांग्लादेबांग्लादेबांग्लादेबांग्लादेबांग्लादेबांग्लादेबांग्लादेबांग्लादेबांग्लादेबांग्लादेबांग्लादेबांग्लादेबांग्लादेबांग्लादेबांग्लादेबांग्लादेबांग्लादेबांग्लादेबांग्लादेबांग्लादेबांग्लादे	NULL	NULL
49	রবীন্দ্রনাথ ঠাকুর	NULL	NULL
63700	রবীন্দ্রনাথ ঠাকুররবীন্দ্রনাথ ঠাকুররবীন্দ্রনাথ ঠাকুররবীন্দ্রনাথ ঠাকুররবীন্দ্রনাথ ঠাকুররবীন্দ্রনাথ ঠাকুররবীন্দ্রনাথ ঠাকুররবীন্দ্রনাথ ঠাকুররবীন্দ্রনাথ ঠাকুররবীন্দ্রনাথ ঠাকুররবীন্দ্রনাথ ঠাকুররবীন্দ্রনাথ ঠাকুররবীন্দ্রনাথ ঠাকুররবীন্দ্রনাথ ঠাকুররবীন্দ্রনাথ ঠাকুররবীন্দ্রনাথ ঠাকুররবীন্দ্রনাথ ঠাকুররবীন্দ্রনাথ ঠাকুররবীন্দ্রনাথ ঠাকুররবীন্দ্রনাথ ঠাকুররবীন্দ্রনাথ ঠাকুররবীন্দ্রনাথ ঠাকুররবীন্দ্রনাথ ঠাকুররবীন্দ্রনাথ ঠাকুররবীন্দ্রনাথ ঠাকুররবীন্দ্রনাথ ঠাকুররবীন্দ্রনাথ ঠাকুররবীন্দ্রনাথ ঠাকুররবীন্দ্রনাথ ঠাকুররবীন্দ্রনাথ ঠাকুররবীন্দ্রনাথ ঠাকুররবীন্দ্রনাথ ঠাকুররবীন্দ্রনাথ ঠাকুররবীন্দ্রনাথ ঠাকুররবীন্দ্রনাথ ঠাকুররবীন্দ্রনাথ ঠাকুররবীন্দ্রনাথ ঠাকুররবীন্দ্রনাথ ঠাকুররবীন্দ্রনাথ ঠাকুররবীন্দ্রনাথ ঠাকুররবীন্দ্রনাথ ঠাকুররবীন্দ্রনাথ ঠাকুররবীন্দ্রনাথ ঠাকুররবীন্দ্রনাথ ঠাকুররবীন্দ্রনাথ ঠাকুররবীন্দ্রনাথ ঠাকুররবীন্দ্রনাথ ঠাকুররবীন্দ্রনাথ ঠাকুররবীন্দ্রনাথ ঠাকুররবীন্দ্রনাথ ঠাকুররবীন্দ্রনাথ ঠাকুররবীন্দ্রনাথ ঠাকুররবীন্দ্রনাথ ঠাকুররবীন্দ্রনাথ ঠাকুররবীন্দ্রনাথ ঠাকুররবীন্দ্রনাথ ঠাকুররবীন্দ্রনাথ ঠাকুররবীন্দ্রনাথ ঠাকুররবীন্দ্রনাথ ঠাকুররবীন্দ্রনাথ ঠাকুররবীন্দ্রনাথ ঠাকুররবীন্দ্রনাথ ঠাকুররবীন্দ্রনাথ ঠাকুররবীন্দ্রনাথ ঠাকুররবীন্দ্রনাথ ঠাকুররবীন্দ্রনাথ ঠাকুররবীন্দ্রনাথ ঠাকুররবীন্দ্রনাথ ঠাকুররবীন্দ্রনাথ ঠাকুররবীন্দ্রনাথ ঠাকুররবীন্দ্রনাথ ঠাকুররবীন্দ্রনাথ ঠাকুররবীন্দ্রনাথ ঠাকুররবীন্দ্রনাথ ঠাকুররবীন্দ্রনাথ ঠাকুররবীন্দ্রনাথ ঠাকুররবীন্দ্রনাথ ঠাকুররবীন্দ্রনাথ ঠাকুররবীন্দ্রনাথ ঠাকুররবীন্দ্রনাথ ঠাকুররবীন্দ্রনাথ ঠাকুররবীন্দ্রনাথ ঠাকুররবীন্দ্রনাথ ঠাকুররবীন্দ্রনাথ ঠাকুররবীন্দ্রনাথ ঠাকুররবীন্দ্রনাথ ঠাকুররবীন্দ্রনাথ ঠাকুররবীন্দ্রনাথ ঠাকুররবীন্দ্রনাথ ঠাকুররবীন্দ্রনাথ ঠাকুররবীন্দ্রনাথ ঠাকুররবীন্দ্রনাথ ঠাকুররবীন্দ্রনাথ ঠাকুররবীন্দ্রনাথ ঠাকুররবীন্দ্রনাথ ঠাকুররবীন্দ্রনাথ ঠাকুররবীন্দ্রনাথ ঠাকুররবীন্দ্রনাথ ঠাকুররবীন্দ্রনাথ ঠাকুররবীন্দ্রনাথ ঠাকুররবীন্দ্রনাথ ঠাকুররবীন্দ্রনাথ ঠাকুররবীন্দ্রনাথ ঠাকুররবীন্দ্রনাথ ঠাকুররবীন্দ্রনাথ ঠাকুররবীন্দ্রনাথ ঠাকুররবীন্দ্রনাথ ঠাকুররবীন্দ্রনাথ ঠাকুররবীন্দ্রনাথ ঠাকুররবীন্দ্রনাথ ঠাকুররবীন্দ্রনাথ ঠাকুররবীন্দ্রনাথ ঠাকুররবীন্দ্রনাথ ঠাকুররবীন্দ্রনাথ ঠাকুররবীন্দ্রনাথ ঠাকুররবীন্দ্রনাথ ঠাকুররবীন্দ্রনাথ ঠাকুররবীন্দ্রনাথ ঠাকুররবীন্দ্রনাথ ঠাকুররবীন্দ্রনাথ ঠাকুররবীন্দ্রনাথ ঠাকুররবীন্দ্রনাথ ঠাকুররবীন্দ্রনাথ ঠাকুররবীন্দ্রনাথ ঠাকুররবীন্দ্রনাথ ঠাকুররবীন্দ্রনাথ ঠাকুররবীন্দ্রনাথ ঠাকুররবীন্দ্রনাথ ঠাকুররবীন্দ্রনাথ ঠাকুররবীন্দ্রনাথ ঠাকুররবীন্দ্রনাথ ঠাকুররবীন্দ্রনাথ ঠাকুররবীন্দ্রনাথ ঠাকুররবীন্দ্রনাথ ঠাকুররবীন্দ্রনাথ ঠাকুররবীন্দ্রনাথ ঠাকুররবীন্দ্রনাথ ঠাকুররবীন্দ্রনাথ ঠাকুররবীন্দ্রনাথ ঠাকুররবীন্দ্রনাথ ঠাকুররবীন্দ্রনাথ ঠাকুররবীন্দ্রনাথ ঠাকুররবীন্দ্রনাথ ঠাকুররবীন্দ্রনাথ ঠাকুররবীন্দ্রনাথ ঠাকুররবীন্দ্রনাথ ঠাকুররবীন্দ্রনাথ ঠাকুররবীন্দ্রনাথ ঠাকুররবীন্দ্রনাথ ঠাকুররবীন্দ্রনাথ ঠাকুররবীন্দ্রনাথ ঠাকুররবীন্দ্রনাথ ঠাকুররবীন্দ্রনাথ ঠাকুররবীন্দ্রনাথ ঠাকুররবীন্দ্রনাথ ঠাকুররবীন্দ্রনাথ ঠাকুররবীন্দ্রনাথ ঠাকুররবীন্দ্রনাথ ঠাকুররবীন্দ্রনাথ ঠাকুররবীন্দ্রনাথ ঠাকুররবীন্দ্রনাথ ঠাকুররবীন্দ্রনাথ ঠাকুররবীন্দ্রনাথ ঠাকুররবীন্দ্রনাথ ঠাকুররবীন্দ্রনাথ ঠাকুররবীন্দ্রনাথ ঠাকুররবীন্দ্রনাথ ঠাকুররবীন্দ্রনাথ ঠাকুররবীন্দ্রনাথ ঠাকুররবীন্দ্রনাথ ঠাকুররবীন্দ্রনাথ ঠাকুররবীন্দ্রনাথ ঠাকুররবীন্দ্রনাথ ঠাকুররবীন্দ্রনাথ ঠাকুররবীন্দ্রনাথ ঠাকুররবীন্দ্রনাথ ঠাকুররবীন্দ্রনাথ ঠাকুররবীন্দ্রনাথ ঠাকুররবীন্দ্রনাথ ঠাকুররবীন্দ্রনাথ ঠাকুররবীন্দ্রনাথ ঠাকুররবীন্দ্রনাথ ঠাকুররবীন্দ্রনাথ ঠাকুররবীন্দ্রনাথ ঠাকুররবীন্দ্রনাথ ঠাকুররবীন্দ্রনাথ ঠাকুররবীন্দ্রনাথ ঠাকুররবীন্দ্রনাথ ঠাকুররবীন্দ্রনাথ ঠাকুররবীন্দ্রনাথ ঠাকুররবীন্দ্রনাথ ঠাকুররবীন্দ্রনাথ ঠাকুররবীন্দ্রনাথ ঠাকুররবীন্দ্রনাথ ঠাকুররবীন্দ্রনাথ ঠাকুররবীন্দ্রনাথ ঠাকুররবীন্দ্রনাথ ঠাকুররবীন্দ্রনাথ ঠাকুররবীন্দ্রনাথ ঠাকুররবীন্দ্রনাথ ঠাকুররবীন্দ্রনাথ ঠাকুররবীন্দ্রনাথ ঠাকুররবীন্দ্রনাথ ঠাকুররবীন্দ্রনাথ ঠাকুররবীন্দ্রনাথ ঠাকুররবীন্দ্রনাথ ঠাকুররবীন্দ্রনাথ ঠাকুররবীন্দ্রনাথ ঠাকুররবীন্দ্রনাথ ঠাকুররবীন্দ্রনাথ ঠাকুররবীন্দ্রনাথ ঠাকুররবীন্দ্রনাথ ঠাকুররবীন্দ্রনাথ ঠাকুররবীন্দ্রনাথ ঠাকুররবীন্দ্রনাথ ঠাকুররবীন্দ্রনাথ ঠাকুররবীন্দ্রনাথ ঠাকুররবীন্দ্রনাথ ঠাকুররবীন্দ্রনাথ ঠাকুররবীন্দ্রনাথ ঠাকুররবীন্দ্রনাথ ঠাকুররবীন্দ্রনাথ ঠাকুররবীন্দ্রনাথ ঠাকুররবীন্দ্রনাথ ঠাকুররবীন্দ্রনাথ ঠাকুররবীন্দ্রনাথ ঠাকুররবীন্দ্রনাথ ঠাকুররবীন্দ্রনাথ ঠাকুররবীন্দ্রনাথ ঠাকুররবীন্দ্রনাথ ঠাকুররবীন্দ্রনাথ ঠাকুররবীন্দ্রনাথ ঠাকুররবীন্দ্রনাথ ঠাকুররবীন্দ্রনাথ ঠাকুররবীন্দ্রনাথ ঠাকুররবীন্দ্রনাথ ঠাকুররবীন্দ্রনাথ ঠাকুররবীন্দ্রনাথ ঠাকুররবীন্দ্রনাথ ঠাকুররবীন্দ্রনাথ ঠাকুররবীন্দ্রনাথ ঠাকুররবীন্দ্রনাথ ঠাকুররবীন্দ্রনাথ ঠাকুররবীন্দ্রনাথ ঠাকুররবীন্দ্রনাথ ঠাকুররবীন্দ্রনাথ ঠাকুররবীন্দ্রনাথ ঠাকুররবীন্দ্রনাথ ঠাকুররবীন্দ্রনাথ ঠাকুররবীন্দ্রনাথ ঠাকুররবীন্দ্রনাথ ঠাকুররবীন্দ্রনাথ ঠাকুররবীন্দ্রনাথ ঠাকুররবীন্দ্রনাথ ঠাকুররবীন্দ্রনাথ ঠাকুররবীন্দ্রনাথ ঠাকুররবীন্দ্রনাথ ঠাকুররবীন্দ্রনাথ ঠাকুররবীন্দ্রনাথ ঠাকুররবীন্দ্রনাথ ঠাকুররবীন্দ্রনাথ ঠাকুররবীন্দ্রনাথ ঠাকুররবীন্দ্রনাথ ঠাকুররবীন্দ্রনাথ ঠাকুররবীন্দ্রনাথ ঠাকুররবীন্দ্রনাথ ঠাকুররবীন্দ্রনাথ ঠাকুররবীন্দ্রনাথ ঠাকুররবীন্দ্রনাথ ঠাকুররবীন্দ্রনাথ ঠাকুররবীন্দ্রনাথ ঠাকুররবীন্দ্রনাথ ঠাকুররবীন্দ্রনাথ ঠাকুররবীন্দ্রনাথ ঠাকুররবীন্দ্রনাথ ঠাকুররবীন্দ্রনাথ ঠাকুররবীন্দ্রনাথ ঠাকুররবীন্দ্রনাথ ঠাকুররবীন্দ্রনাথ ঠাকুররবীন্দ্রনাথ ঠাকুররবীন্দ্রনাথ ঠাকুররবীন্দ্রনাথ ঠাকুররবীন্দ্রনাথ ঠাকুররবীন্দ্রনাথ ঠাকুররবীন্দ্রনাথ ঠাকুররবীন্দ্রনাথ ঠাকুররবীন্দ্রনাথ ঠাকুররবীন্দ্রনাথ ঠাকুররবীন্দ্রনাথ ঠাকুররবীন্দ্রনাথ ঠাকুররবীন্দ্রনাথ ঠাকুররবীন্দ্রনাথ ঠাকুররবীন্দ্রনাথ ঠাকুররবীন্দ্রনাথ ঠাকুররবীন্দ্রনাথ ঠাকুররবীন্দ্রনাথ ঠাকুররবীন্দ্রনাথ ঠাকুররবীন্দ্রনাথ ঠাকুররবীন্দ্রনাথ ঠাকুররবীন্দ্রনাথ ঠাকুররবীন্দ্রনাথ ঠাকুররবীন্দ্রনাথ ঠাকুররবীন্দ্রনাথ ঠাকুররবীন্দ্রনাথ ঠাকুররবীন্দ্রনাথ ঠাকুররবীন্দ্রনাথ ঠাকুররবীন্দ্রনাথ ঠাকুররবীন্দ্রনাথ ঠাকুররবীন্দ্রনাথ ঠাকুররবীন্দ্রনাথ ঠাকুররবীন্দ্রনাথ ঠাকুররবীন্দ্রনাথ ঠাকুররবীন্দ্রনাথ ঠাকুররবীন্দ্রনাথ ঠাকুররবীন্দ্রনাথ ঠাকুররবীন্দ্রনাথ ঠাকুররবীন্দ্রনাথ ঠাকুররবীন্দ্রনাথ ঠাকুররবীন্দ্রনাথ ঠাকুররবীন্দ্রনাথ ঠাকুররবীন্দ্রনাথ ঠাকুররবীন্দ্রনাথ ঠাকুররবীন্দ্রনাথ ঠাকুররবীন্দ্রনাথ ঠাকুররবীন্দ্রনাথ ঠাকুররবীন্দ্রনাথ ঠাকুররবীন্দ্রনাথ ঠাকুররবীন্দ্রনাথ ঠাকুররবীন্দ্রনাথ ঠাকুররবীন্দ্রনাথ ঠাকুররবীন্দ্রনাথ ঠাকুররবীন্দ্রনাথ ঠাকুররবীন্দ্রনাথ ঠাকুররবীন্দ্রনাথ ঠাকুররবীন্দ্রনাথ ঠাকুররবীন্দ্রনাথ ঠাকুররবীন্দ্রনাথ ঠাকুররবীন্দ্রনাথ ঠাকুররবীন্দ্রনাথ ঠাকুররবীন্দ্রনাথ ঠাকুররবীন্দ্রনাথ ঠাকুররবীন্দ্রনাথ ঠাকুররবীন্দ্রনাথ ঠাকুররবীন্দ্রনাথ ঠাকুররবীন্দ্রনাথ ঠাকুররবীন্দ্রনাথ ঠাকুররবীন্দ্রনাথ ঠাকুররবীন্দ্রনাথ ঠাকুররবীন্দ্রনাথ ঠাকুররবীন্দ্রনাথ ঠাকুররবীন্দ্রনাথ ঠাকুররবীন্দ্রনাথ ঠাকুররবীন্দ্রনাথ ঠাকুররবীন্দ্রনাথ ঠাকুররবীন্দ্রনাথ ঠাকুররবীন্দ্রনাথ ঠাকুররবীন্দ্রনাথ ঠাকুররবীন্দ্রনাথ ঠাকুররবীন্দ্রনাথ ঠাকুররবীন্দ্রনাথ ঠাকুররবীন্দ্রনাথ ঠাকুররবীন্দ্রনাথ ঠাকুররবীন্দ্রনাথ ঠাকুররবীন্দ্রনাথ ঠাকুররবীন্দ্রনাথ ঠাকুররবীন্দ্রনাথ ঠাকুররবীন্দ্রনাথ ঠাকুররবীন্দ্রনাথ ঠাকুররবীন্দ্রনাথ ঠাকুররবীন্দ্রনাথ ঠাকুররবীন্দ্রনাথ ঠাকুররবীন্দ্রনাথ ঠাকুররবীন্দ্রনাথ ঠাকুররবীন্দ্রনাথ ঠাকুররবীন্দ্রনাথ ঠাকুররবীন্দ্রনাথ ঠাকুররবীন্দ্রনাথ ঠাকুররবীন্দ্রনাথ ঠাকুররবীন্দ্রনাথ ঠাকুররবীন্দ্রনাথ ঠাকুররবীন্দ্রনাথ ঠাকুররবীন্দ্রনাথ ঠাকুররবীন্দ্রনাথ ঠাকুররবীন্দ্রনাথ ঠাকুররবীন্দ্রনাথ ঠাকুররবীন্দ্রনাথ ঠাকুররবীন্দ্রনাথ ঠাকুররবীন্দ্রনাথ ঠাকুররবীন্দ্রনাথ ঠাকুররবীন্দ্রনাথ ঠাকুররবীন্দ্রনাথ ঠাকুররবীন্দ্রনাথ ঠাকুররবীন্দ্রনাথ ঠাকুররবীন্দ্রনাথ ঠাকুররবীন্দ্রনাথ ঠাকুররবীন্দ্রনাথ ঠাকুররবীন্দ্রনাথ ঠাকুররবীন্দ্রনাথ ঠাকুররবীন্দ্রনাথ ঠাকুররবীন্দ্রনাথ ঠাকুররবীন্দ্রনাথ ঠাকুররবীন্দ্রনাথ ঠাকুররবীন্দ্রনাথ ঠাকুররবীন্দ্রনাথ ঠাকুররবীন্দ্রনাথ ঠাকুররবীন্দ্রনাথ ঠাকুররবীন্দ্রনাথ ঠাকুররবীন্দ্রনাথ ঠাকুররবীন্দ্রনাথ ঠাকুররবীন্দ্রনাথ ঠাকুররবীন্দ্রনাথ ঠাকুররবীন্দ্রনাথ ঠাকুররবীন্দ্রনাথ ঠাকুররবীন্দ্রনাথ ঠাকুররবীন্দ্রনাথ ঠাকুররবীন্দ্রনাথ ঠাকুররবীন্দ্রনাথ ঠাকুররবীন্দ্রনাথ ঠাকুররবীন্দ্রনাথ ঠাকুররবীন্দ্রনাথ ঠাকুররবীন্দ্রনাথ ঠাকুররবীন্দ্রনাথ ঠাকুররবীন্দ্রনাথ ঠাকুররবীন্দ্রনাথ ঠাকুররবীন্দ্রনাথ ঠাকুররবীন্দ্রনাথ ঠাকুররবীন্দ্রনাথ ঠাকুররবীন্দ্রনাথ ঠাকুররবীন্দ্রনাথ ঠাকুররবীন্দ্রনাথ ঠাকুররবীন্দ্রনাথ ঠাকুররবীন্দ্রনাথ ঠাকুররবীন্দ্রনাথ ঠাকুররবীন্দ্রনাথ ঠাকুররবীন্দ্রনাথ ঠাকুররবীন্দ্রনাথ ঠাকুররবীন্দ্রনাথ ঠাকুররবীন্দ্রনাথ ঠাকুররবীন্দ্রনাথ ঠাকুররবীন্দ্রনাথ ঠাকুররবীন্দ্রনাথ ঠাকুররবীন্দ্রনাথ ঠাকুররবীন্দ্রনাথ ঠাকুররবীন্দ্রনাথ ঠাকুররবীন্দ্রনাথ ঠাকুররবীন্দ্রনাথ ঠাকুররবীন্দ্রনাথ ঠাকুররবীন্দ্রনাথ ঠাকুররবীন্দ্রনাথ ঠাকুররবীন্দ্রনাথ ঠাকুররবীন্দ্রনাথ ঠাকুররবীন্দ্রনাথ ঠাকুররবীন্দ্রনাথ ঠাকুররবীন্দ্রনাথ ঠাকুররবীন্দ্রনাথ ঠাকুররবীন্দ্রনাথ ঠাকুররবীন্দ্রনাথ ঠাকুররবীন্দ্রনাথ ঠাকুররবীন্দ্রনাথ ঠাকুররবীন্দ্রনাথ ঠাকুররবীন্দ্রনাথ ঠাকুররবীন্দ্রনাথ ঠাকুররবীন্দ্রনাথ ঠাকুররবীন্দ্রনাথ ঠাকুররবীন্দ্রনাথ ঠাকুররবীন্দ্রনাথ ঠাকুররবীন্দ্রনাথ ঠাকুররবীন্দ্রনাথ ঠাকুররবীন্দ্রনাথ ঠাকুররবীন্দ্রনাথ ঠাকুররবীন্দ্রনাথ ঠাকুররবীন্দ্রনাথ ঠাকুররবীন্দ্রনাথ ঠাকুররবীন্দ্রনাথ ঠাকুররবীন্দ্রনাথ ঠাকুররবীন্দ্রনাথ ঠাকুররবীন্দ্রনাথ ঠাকুররবীন্দ্রনাথ ঠাকুররবীন্দ্রনাথ ঠাকুররবীন্দ্রনাথ ঠাকুররবীন্দ্রনাথ ঠাকুররবীন্দ্রনাথ ঠাকুররবীন্দ্রনাথ ঠাকুররবীন্দ্রনাথ ঠাকুররবীন্দ্রনাথ ঠাকুররবীন্দ্রনাথ ঠাকুররবীন্দ্রনাথ ঠাকুররবীন্দ্রনাথ ঠাকুররবীন্দ্রনাথ ঠাকুররবীন্দ্রনাথ ঠাকুররবীন্দ্রনাথ ঠাকুররবীন্দ্রনাথ ঠাকুররবীন্দ্রনাথ ঠাকুররবীন্দ্রনাথ ঠাকুররবীন্দ্রনাথ ঠাকুররবীন্দ্রনাথ ঠাকুররবীন্দ্রনাথ ঠাকুররবীন্দ্রনাথ ঠাকুররবীন্দ্রনাথ ঠাকুররবীন্দ্রনাথ ঠাকুররবীন্দ্রনাথ ঠাকুররবীন্দ্রনাথ ঠাকুররবীন্দ্রনাথ ঠাকুররবীন্দ্রনাথ ঠাকুররবীন্দ্রনাথ ঠাকুররবীন্দ্রনাথ ঠাকুররবীন্দ্রনাথ ঠাকুররবীন্দ্রনাথ ঠাকুররবীন্দ্রনাথ ঠাকুররবীন্দ্রনাথ ঠাকুররবীন্দ্রনাথ ঠাকুররবীন্দ্রনাথ ঠাকুররবীন্দ্রনাথ ঠাকুররবীন্দ্রনাথ ঠাকুররবীন্দ্রনাথ ঠাকুররবীন্দ্রনাথ ঠাকুররবীন্দ্রনাথ ঠাকুররবীন্দ্রনাথ ঠাকুররবীন্দ্রনাথ ঠাকুররবীন্দ্রনাথ ঠাকুররবীন্দ্রনাথ ঠাকুররবীন্দ্রনাথ ঠাকুররবীন্দ্রনাথ ঠাকুররবীন্দ্রনাথ ঠাকুররবীন্দ্রনাথ ঠাকুররবীন্দ্রনাথ ঠাকুররবীন্দ্রনাথ ঠাকুররবীন্দ্রনাথ ঠাকুররবীন্দ্রনাথ ঠাকুররবীন্দ্রনাথ ঠাকুররবীন্দ্রনাথ ঠাকুররবীন্দ্রনাথ ঠাকুররবীন্দ্রনাথ ঠাকুররবীন্দ্রনাথ ঠাকুররবীন্দ্রনাথ ঠাকুররবীন্দ্রনাথ ঠাকুররবীন্দ্রনাথ ঠাকুররবীন্দ্রনাথ ঠাকুররবীন্দ্রনাথ ঠাকুররবীন্দ্রনাথ ঠাকুররবীন্দ্রনাথ ঠাকুররবীন্দ্রনাথ ঠাকুররবীন্দ্রনাথ ঠাকুররবীন্দ্রনাথ ঠাকুররবীন্দ্রনাথ ঠাকুররবীন্দ্রনাথ ঠাকুররবীন্দ্রনাথ ঠাকুররবীন্দ্রনাথ ঠাকুররবীন্দ্রনাথ ঠাকুররবীন্দ্রনাথ ঠাকুররবীন্দ্রনাথ ঠাকুররবীন্দ্রনাথ ঠাকুররবীন্দ্রনাথ ঠাকুররবীন্দ্রনাথ ঠাকুররবীন্দ্রনাথ ঠাকুররবীন্দ্রনাথ ঠাকুররবীন্দ্রনাথ ঠাকুররবীন্দ্রনাথ ঠাকুররবীন্দ্রনাথ ঠাকুররবীন্দ্রনাথ ঠাকুররবীন্দ্রনাথ ঠাকুররবীন্দ্রনাথ ঠাকুররবীন্দ্রনাথ ঠাকুররবীন্দ্রনাথ ঠাকুররবীন্দ্রনাথ ঠাকুররবীন্দ্রনাথ ঠাকুররবীন্দ্রনাথ ঠাকুররবীন্দ্রনাথ ঠাকুররবীন্দ্রনাথ ঠাকুররবীন্দ্রনাথ ঠাকুররবীন্দ্রনাথ ঠাকুররবীন্দ্রনাথ ঠাকুররবীন্দ্রনাথ ঠাকুররবীন্দ্রনাথ ঠাকুররবীন্দ্রনাথ ঠাকুররবীন্দ্রনাথ ঠাকুররবীন্দ্রনাথ ঠাকুররবীন্দ্রনাথ ঠাকুররবীন্দ্রনাথ ঠাকুররবীন্দ্রনাথ ঠাকুররবীন্দ্রনাথ ঠাকুররবীন্দ্রনাথ ঠাকুররবীন্দ্রনাথ ঠাকুররবীন্দ্রনাথ ঠাকুররবীন্দ্রনাথ ঠাকুররবীন্দ্রনাথ ঠাকুররবীন্দ্রনাথ ঠাকুররবীন্দ্রনাথ ঠাকুররবীন্দ্রনাথ ঠাকুররবীন্দ্রনাথ ঠাকুররবীন্দ্রনাথ ঠাকুররবীন্দ্রনাথ ঠাকুররবীন্দ্রনাথ ঠাকুররবীন্দ্রনাথ ঠাকুররবীন্দ্রনাথ ঠাকুররবীন্দ্রনাথ ঠাকুররবীন্দ্রনাথ ঠাকুররবীন্দ্রনাথ ঠাকুররবীন্দ্রনাথ ঠাকুররবীন্দ্রনাথ ঠাকুররবীন্দ্রনাথ ঠাকুররবীন্দ্রনাথ ঠাকুররবীন্দ্রনাথ ঠাকুররবীন্দ্রনাথ ঠাকুররবীন্দ্রনাথ ঠাকুররবীন্দ্রনাথ ঠাকুররবীন্দ্রনাথ ঠাকুররবীন্দ্রনাথ ঠাকুররবীন্দ্রনাথ ঠাকুররবীন্দ্রনাথ ঠাকুররবীন্দ্রনাথ ঠাকুররবীন্দ্রনাথ ঠাকুররবীন্দ্রনাথ ঠাকুররবীন্দ্রনাথ ঠাকুররবীন্দ্রনাথ ঠাকুররবীন্দ্রনাথ ঠাকুররবীন্দ্রনাথ ঠাকুররবীন্দ্রনাথ ঠাকুররবীন্দ্রনাথ ঠাকুররবীন্দ্রনাথ ঠাকুররবীন্দ্রনাথ ঠাকুররবীন্দ্রনাথ ঠাকুররবীন্দ্রনাথ ঠাকুররবীন্দ্রনাথ ঠাকুররবীন্দ্রনাথ ঠাকুররবীন্দ্রনাথ ঠাকুররবীন্দ্রনাথ ঠাকুররবীন্দ্রনাথ ঠাকুররবীন্দ্রনাথ ঠাকুররবীন্দ্রনাথ ঠাকুররবীন্দ্রনাথ ঠাকুররবীন্দ্রনাথ ঠাকুররবীন্দ্রনাথ ঠাকুররবীন্দ্রনাথ ঠাকুররবীন্দ্রনাথ ঠাকুররবীন্দ্রনাথ ঠাকুররবীন্দ্রনাথ ঠাকুররবীন্দ্রনাথ ঠাকুররবীন্দ্রনাথ ঠাকুররবীন্দ্রনাথ ঠাকুররবীন্দ্রনাথ ঠাকুররবীন্দ্রনাথ ঠাকুররবীন্দ্রনাথ ঠাকুররবীন্দ্রনাথ ঠাকুররবীন্দ্রনাথ ঠাকুররবীন্দ্রনাথ ঠাকুররবীন্দ্রনাথ ঠাকুররবীন্দ্রনাথ ঠাকুররবীন্দ্রনাথ ঠাকুররবীন্দ্রনাথ ঠাকুররবীন্দ্রনাথ ঠাকুররবীন্দ্রনাথ ঠাকুররবীন্দ্রনাথ ঠাকুররবীন্দ্রনাথ ঠাকুররবীন্দ্রনাথ ঠাকুররবীন্দ্রনাথ ঠাকুররবীন্দ্রনাথ ঠাকুররবীন্দ্রনাথ ঠাকুররবীন্দ্রনাথ ঠাকুররবীন্দ্রনাথ ঠাকুররবীন্দ্রনাথ ঠাকুররবীন্দ্রনাথ ঠাকুররবীন্দ্রনাথ ঠাকুররবীন্দ্রনাথ ঠাকুররবীন্দ্রনাথ ঠাকুররবীন্দ্রনাথ ঠাকুররবীন্দ্রনাথ ঠাকুররবীন্দ্রনাথ ঠাকুররবীন্দ্রনাথ ঠাকুররবীন্দ্রনাথ ঠাকুররবীন্দ্রনাথ ঠাকুররবীন্দ্রনাথ ঠাকুররবীন্দ্রনাথ ঠাকুররবীন্দ্রনাথ ঠাকুররবীন্দ্রনাথ ঠাকুররবীন্দ্রনাথ ঠাকুররবীন্দ্রনাথ ঠাকুররবীন্দ্রনাথ ঠাকুররবীন্দ্রনাথ ঠাকুররবীন্দ্রনাথ ঠাকুররবীন্দ্রনাথ ঠাকুররবীন্দ্রনাথ ঠাকুররবীন্দ্রনাথ ঠাকুররবীন্দ্রনাথ ঠাকুররবীন্দ্রনাথ ঠাকুররবীন্দ্রনাথ ঠাকুররবীন্দ্রনাথ ঠাকুররবীন্দ্রনাথ ঠাকুররবীন্দ্রনাথ ঠাকুররবীন্দ্রনাথ ঠাকুররবীন্দ্রনাথ ঠাকুররবীন্দ্রনাথ ঠাকুররবীন্দ্রনাথ ঠাকুররবীন্দ্রনাথ ঠাকুররবীন্দ্রনাথ ঠাকুররবীন্দ্রনাথ ঠাকুররবীন্দ্রনাথ ঠাকুররবীন্দ্রনাথ ঠাকুররবীন্দ্রনাথ ঠাকুররবীন্দ্রনাথ ঠাকুররবীন্দ্রনাথ ঠাকুররবীন্দ্রনাথ ঠাকুররবীন্দ্রনাথ ঠাকুররবীন্দ্রনাথ ঠাকুররবীন্দ্রনাথ ঠাকুররবীন্দ্রনাথ ঠাকুররবীন্দ্রনাথ ঠাকুররবীন্দ্রনাথ ঠাকুররবীন্দ্রনাথ ঠাকুররবীন্দ্রনাথ ঠাকুররবীন্দ্রনাথ ঠাকুররবীন্দ্রনাথ ঠাকুররবীন্দ্রনাথ ঠাকুররবীন্দ্রনাথ ঠাকুররবীন্দ্রনাথ ঠাকুররবীন্দ্রনাথ ঠাকুররবীন্দ্রনাথ ঠাকুররবীন্দ্রনাথ ঠাকুররবীন্দ্রনাথ ঠাকুররবীন্দ্রনাথ ঠাকুররবীন্দ্রনাথ ঠাকুররবীন্দ্রনাথ ঠাকুররবীন্দ্রনাথ ঠাকুররবীন্দ্রনাথ ঠাকুররবীন্দ্রনাথ ঠাকুররবীন্দ্রনাথ ঠাকুররবীন্দ্রনাথ ঠাকুররবীন্দ্রনাথ ঠাকুররবীন্দ্রনাথ ঠাকুররবীন্দ্রনাথ ঠাকুররবীন্দ্রনাথ ঠাকুররবীন্দ্রনাথ ঠাকুররবীন্দ্রনাথ ঠাকুররবীন্দ্রনাথ ঠাকুররবীন্দ্রনাথ ঠাকুররবীন্দ্রনাথ ঠাকুররবীন্দ্রনাথ ঠাকুররবীন্দ্রনাথ ঠাকুররবীন্দ্রনাথ ঠাকুররবীন্দ্রনাথ ঠাকুররবীন্দ্রনাথ ঠাকুররবীন্দ্রনাথ ঠাকুররবীন্দ্রনাথ ঠাকুররবীন্দ্রনাথ ঠাকুররবীন্দ্রনাথ ঠাকুররবীন্দ্রনাথ ঠাকুররবীন্দ্রনাথ ঠাকুররবীন্দ্রনাথ ঠাকুররবীন্দ্রনাথ ঠাকুররবীন্দ্রনাথ ঠাকুররবীন্দ্রনাথ ঠাকুররবীন্দ্রনাথ ঠাকুররবীন্দ্রনাথ ঠাকুররবীন্দ্রনাথ ঠাকুররবীন্দ্রনাথ ঠাকুররবীন্দ্রনাথ ঠাকুররবীন্দ্রনাথ ঠাকুররবীন্দ্রনাথ ঠাকুররবীন্দ্রনাথ ঠাকুররবীন্দ্রনাথ ঠাকুররবীন্দ্রনাথ ঠাকুররবীন্দ্রনাথ ঠাকুররবীন্দ্রনাথ ঠাকুররবীন্দ্রনাথ ঠাকুররবীন্দ্রনাথ ঠাকুররবীন্দ্রনাথ ঠাকুররবীন্দ্রনাথ ঠাকুররবীন্দ্রনাথ ঠাকুররবীন্দ্রনাথ ঠাকুররবীন্দ্রনাথ ঠাকুররবীন্দ্রনাথ ঠাকুররবীন্দ্রনাথ ঠাকুররবীন্দ্রনাথ ঠাকুররবীন্দ্রনাথ ঠাকুররবীন্দ্রনাথ ঠাকুররবীন্দ্রনাথ ঠাকুররবীন্দ্রনাথ ঠাকুররবীন্দ্রনাথ ঠাকুররবীন্দ্রনাথ ঠাকুররবীন্দ্রনাথ ঠাকুররবীন্দ্রনাথ ঠাকুররবীন্দ্রনাথ ঠাকুররবীন্দ্রনাথ ঠাকুররবীন্দ্রনাথ ঠাকুররবীন্দ্রনাথ ঠাকুররবীন্দ্রনাথ ঠাকুররবীন্দ্রনাথ ঠাকুররবীন্দ্রনাথ ঠাকুররবীন্দ্রনাথ ঠাকুররবীন্দ্রনাথ ঠাকুররবীন্দ্রনাথ ঠাকুররবীন্দ্রনাথ ঠাকুররবীন্দ্রনাথ ঠাকুররবীন্দ্রনাথ ঠাকুররবীন্দ্রনাথ ঠাকুররবীন্দ্রনাথ ঠাকুররবীন্দ্রনাথ ঠাকুররবীন্দ্রনাথ ঠাকুররবীন্দ্রনাথ ঠাকুররবীন্দ্রনাথ ঠাকুররবীন্দ্রনাথ ঠাকুররবীন্দ্রনাথ ঠাকুররবীন্দ্রনাথ ঠাকুররবীন্দ্রনাথ ঠাকুররবীন্দ্রনাথ ঠাকুররবীন্দ্রনাথ ঠাকুররবীন্দ্রনাথ ঠাকুররবীন্দ্রনাথ ঠাকুররবীন্দ্রনাথ ঠাকুররবীন্দ্রনাথ ঠাকুররবীন্দ্রনাথ ঠাকুররবীন্দ্রনাথ ঠাকুররবীন্দ্রনাথ ঠাকুররবীন্দ্রনাথ ঠাকুররবীন্দ্রনাথ ঠাকুররবীন্দ্রনাথ ঠাকুররবীন্দ্রনাথ ঠাকুররবীন্দ্রনাথ ঠাকুররবীন্দ্রনাথ ঠাকুররবীন্দ্রনাথ ঠাকুররবীন্দ্রনাথ ঠাকুররবীন্দ্রনাথ ঠাকুররবীন্দ্রনাথ ঠাকুররবীন্দ্রনাথ ঠাকুররবীন্দ্রনাথ ঠাকুররবীন্দ্রনাথ ঠাকুররবীন্দ্রনাথ ঠাকুররবীন্দ্রনাথ ঠাকুররবীন্দ্রনাথ ঠাকুররবীন্দ্রনাথ ঠাকুররবীন্দ্রনাথ ঠাকুররবীন্দ্রনাথ ঠাকুররবীন্দ্রনাথ ঠাকুররবীন্দ্রনাথ ঠাকুররবীন্দ্রনাথ ঠাকুররবীন্দ্রনাথ ঠাকুররবীন্দ্রনাথ ঠাকুররবীন্দ্রনাথ ঠাকুররবীন্দ্রনাথ ঠাকুররবীন্দ্রনাথ ঠাকুররবীন্দ্রনাথ ঠাকুররবীন্দ্রনাথ ঠাকুররবীন্দ্রনাথ ঠাকুররবীন্দ্রনাথ ঠাকুররবীন্দ্রনাথ ঠাকুররবীন্দ্রনাথ ঠাকুররবীন্দ্রনাথ ঠাকুররবীন্দ্রনাথ ঠাকুররবীন্দ্রনাথ ঠাকুররবীন্দ্রনাথ ঠাকুররবীন্দ্রনাথ ঠাকুররবীন্দ্রনাথ ঠাকুররবীন্দ্রনাথ ঠাকুররবীন্দ্রনাথ ঠাকুররবীন্দ্রনাথ ঠাকুররবীন্দ্রনাথ ঠাকুররবীন্দ্রনাথ ঠাকুররবীন্দ্রনাথ ঠাকুররবীন্দ্রনাথ ঠাকুররবীন্দ্রনাথ ঠাকুররবীন্দ্রনাথ ঠাকুররবীন্দ্রনাথ ঠাকুররবীন্দ্রনাথ ঠাকুররবীন্দ্রনাথ ঠাকুররবীন্দ্রনাথ ঠাকুররবীন্দ্রনাথ ঠাকুররবীন্দ্রনাথ ঠাকুররবীন্দ্রনাথ ঠাকুররবীন্দ্রনাথ ঠাকুররবীন্দ্রনাথ ঠাকুররবীন্দ্রনাথ ঠাকুররবীন্দ্রনাথ ঠাকুররবীন্দ্রনাথ ঠাকুররবীন্দ্রনাথ ঠাকুররবীন্দ্রনাথ ঠাকুররবীন্দ্রনাথ ঠাকুররবীন্দ্রনাথ ঠাকুররবীন্দ্রনাথ ঠাকুররবীন্দ্রনাথ ঠাকুররবীন্দ্রনাথ ঠাকুররবীন্দ্রনাথ ঠাকুররবীন্দ্রনাথ ঠাকুররবীন্দ্রনাথ ঠাকুররবীন্দ্রনাথ ঠাকুররবীন্দ্রনাথ ঠাকুররবীন্দ্রনাথ ঠাকুররবীন্দ্রনাথ ঠাকুররবীন্দ্রনাথ ঠাকুররবীন্দ্রনাথ ঠাকুররবীন্দ্রনাথ ঠাকুররবীন্দ্রনাথ ঠাকুররবীন্দ্রনাথ ঠাকুররবীন্দ্রনাথ ঠাকুররবীন্দ্রনাথ ঠাকুররবীন্দ্রনাথ ঠাকুররবীন্দ্রনাথ ঠাকুররবীন্দ্রনাথ ঠাকুররবীন্দ্রনাথ ঠাকুররবীন্দ্রনাথ ঠাকুররবীন্দ্রনাথ ঠাকুররবীন্দ্রনাথ ঠাকুররবীন্দ্রনাথ ঠাকুররবীন্দ্রনাথ ঠাকুররবীন্দ্রনাথ ঠাকুররবীন্দ্রনাথ ঠাকুররবীন্দ্রনাথ ঠাকুররবীন্দ্রনাথ ঠাকুররবীন্দ্রনাথ ঠাকুররবীন্দ্রনাথ ঠাকুররবীন্দ্রনাথ ঠাকুররবীন্দ্রনাথ ঠাকুররবীন্দ্রনাথ ঠাকুররবীন্দ্রনাথ ঠাকুররবীন্দ্রনাথ ঠাকুররবীন্দ্রনাথ ঠাকুররবীন্দ্রনাথ ঠাকুররবীন্দ্রনাথ ঠাকুররবীন্দ্রনাথ ঠাকুররবীন্দ্রনাথ ঠাকুররবীন্দ্রনাথ ঠাকুররবীন্দ্রনাথ ঠাকুররবীন্দ্রনাথ ঠাকুররবীন্দ্রনাথ ঠাকুররবীন্দ্রনাথ ঠাকুররবীন্দ্রনাথ ঠাকুররবীন্দ্রনাথ ঠাকুররবীন্দ্রনাথ ঠাকুররবীন্দ্রনাথ ঠাকুররবীন্দ্রনাথ ঠাকুররবীন্দ্রনাথ ঠাকুররবীন্দ্রনাথ ঠাকুররবীন্দ্রনাথ ঠাকুররবীন্দ্রনাথ ঠাকুররবীন্দ্রনাথ ঠাকুররবীন্দ্রনাথ ঠাকুররবীন্দ্রনাথ ঠাকুররবীন্দ্রনাথ ঠাকুররবীন্দ্রনাথ ঠাকুররবীন্দ্রনাথ ঠাকুররবীন্দ্রনাথ ঠাকুররবীন্দ্রনাথ ঠাকুররবীন্দ্রনাথ ঠাকুররবীন্দ্রনাথ ঠাকুররবীন্দ্রনাথ ঠাকুররবীন্দ্রনাথ ঠাকুররবীন্দ্রনাথ ঠাকুররবীন্দ্রনাথ ঠাকুররবীন্দ্রনাথ ঠাকুররবীন্দ্রনাথ ঠাকুররবীন্দ্রনাথ ঠাকুররবীন্দ্রনাথ ঠাকুররবীন্দ্রনাথ ঠাকুররবীন্দ্রনাথ ঠাকুররবীন্দ্রনাথ ঠাকুররবীন্দ্রনাথ ঠাকুররবীন্দ্রনাথ ঠাকুররবীন্দ্রনাথ ঠাকুররবীন্দ্রনাথ ঠাকুররবীন্দ্রনাথ ঠাকুররবীন্দ্রনাথ ঠাকুররবীন্দ্রনাথ ঠাকুররবীন্দ্রনাথ ঠাকুররবীন্দ্রনাথ ঠাকুররবীন্দ্রনাথ ঠাকুররবীন্দ্রনাথ ঠাকুররবীন্দ্রনাথ ঠাকুররবীন্দ্রনাথ ঠাকুররবীন্দ্রনাথ ঠাকুররবীন্দ্রনাথ ঠাকুররবীন্দ্রনাথ ঠাকুররবীন্দ্রনাথ ঠাকুররবীন্দ্রনাথ ঠাকুররবীন্দ্রনাথ ঠাকুররবীন্দ্রনাথ ঠাকুররবীন্দ্রনাথ ঠাকুররবীন্দ্রনাথ ঠাকুররবীন্দ্রনাথ ঠাকুররবীন্দ্রনাথ ঠাকুররবীন্দ্রনাথ ঠাকুররবীন্দ্রনাথ ঠাকুররবীন্দ্রনাথ ঠাকুররবীন্দ্রনাথ ঠাকুররবীন্দ্রনাথ ঠাকুররবীন্দ্রনাথ ঠাকুররবীন্দ্রনাথ ঠাকুররবীন্দ্রনাথ ঠাকুররবীন্দ্রনাথ ঠাকুররবীন্দ্রনাথ ঠাকুররবীন্দ্রনাথ ঠাকুররবীন্দ্রনাথ ঠাকুররবীন্দ্রনাথ ঠাকুররবীন্দ্রনাথ ঠাকুররবীন্দ্রনাথ ঠাকুররবীন্দ্রনাথ ঠাকুররবীন্দ্রনাথ ঠাকুররবীন্দ্রনাথ ঠাকুররবীন্দ্রনাথ ঠাকুররবীন্দ্রনাথ ঠাকুররবীন্দ্রনাথ ঠাকুররবীন্দ্রনাথ ঠাকুররবীন্দ্রনাথ ঠাকুররবীন্দ্রনাথ ঠাকুররবীন্দ্রনাথ ঠাকুররবীন্দ্রনাথ ঠাকুররবীন্দ্রনাথ ঠাকুররবীন্দ্রনাথ ঠাকুররবীন্দ্রনাথ ঠাকুররবীন্দ্রনাথ ঠাকুররবীন্দ্রনাথ ঠাকুররবীন্দ্রনাথ ঠাকুররবীন্দ্রনাথ ঠাকুররবীন্দ্রনাথ ঠাকুররবীন্দ্রনাথ ঠাকুররবীন্দ্রনাথ ঠাকুররবীন্দ্রনাথ ঠাকুররবীন্দ্রনাথ ঠাকুররবীন্দ্রনাথ ঠাকুররবীন্দ্রনাথ ঠাকুররবীন্দ্রনাথ ঠাকুররবীন্দ্রনাথ ঠাকুররবীন্দ্রনাথ ঠাকুররবীন্দ্রনাথ ঠাকুররবীন্দ্রনাথ ঠাকুররবীন্দ্রনাথ ঠাকুররবীন্দ্রনাথ ঠাকুররবীন্দ্রনাথ ঠাকুররবীন্দ্রনাথ ঠাকুররবীন্দ্রনাথ ঠাকুররবীন্দ্রনাথ ঠাকুররবীন্দ্রনাথ ঠাকুররবীন্দ্রনাথ ঠাকুররবীন্দ্রনাথ ঠাকুররবীন্দ্রনাথ ঠাকুররবীন্দ্রনাথ ঠাকুররবীন্দ্রনাথ ঠাকুররবীন্দ্রনাথ ঠাকুররবীন্দ্রনাথ ঠাকুররবীন্দ্রনাথ ঠাকুররবীন্দ্রনাথ ঠাকুররবীন্দ্রনাথ ঠাকুররবীন্দ্রনাথ ঠাকুররবীন্দ্রনাথ ঠাকুররবীন্দ্রনাথ ঠাকুররবীন্দ্রনাথ ঠাকুররবীন্দ্রনাথ ঠাকুররবীন্দ্রনাথ ঠাকুররবীন্দ্রনাথ ঠাকুররবীন্দ্রনাথ ঠাকুররবীন্দ্রনাথ ঠাকুররবীন্দ্রনাথ ঠাকুররবীন্দ্রনাথ ঠাকুররবীন্দ্রনাথ ঠাকুররবীন্দ্রনাথ ঠাকুররবীন্দ্রনাথ ঠাকুররবীন্দ্রনাথ ঠাকুররবীন্দ্রনাথ ঠাকুররবীন্দ্রনাথ ঠাকুররবীন্দ্রনাথ ঠাকুররবীন্দ্রনাথ ঠাকুররবীন্দ্রনাথ ঠাকুররবীন্দ্রনাথ ঠাকুররবীন্দ্রনাথ ঠাকুররবীন্দ্রনাথ ঠাকুররবীন্দ্রনাথ ঠাকুররবীন্দ্রনাথ ঠাকুররবীন্দ্রনাথ ঠাকুররবীন্দ্রনাথ ঠাকুররবীন্দ্রনাথ ঠাকুররবীন্দ্রনাথ ঠাকুররবীন্দ্রনাথ ঠাকুররবীন্দ্রনাথ ঠাকুররবীন্দ্রনাথ ঠাকুররবীন্দ্রনাথ ঠাকুররবীন্দ্রনাথ ঠাকুররবীন্দ্রনাথ ঠাকুররবীন্দ্রনাথ ঠাকুররবীন্দ্রনাথ ঠাকুররবীন্দ্রনাথ ঠাকুররবীন্দ্রনাথ ঠাকুররবীন্দ্রনাথ ঠাকুররবীন্দ্রনাথ ঠাকুররবীন্দ্রনাথ ঠাকুররবীন্দ্রনাথ ঠাকুররবীন্দ্রনাথ ঠাকুররবীন্দ্রনাথ ঠাকুররবীন্দ্রনাথ ঠাকুররবীন্দ্রনাথ ঠাকুররবীন্দ্রনাথ ঠাকুররবীন্দ্রনাথ ঠাকুররবীন্দ্রনাথ ঠাকুররবীন্দ্রনাথ ঠাকুররবীন্দ্রনাথ ঠাকুররবীন্দ্রনাথ ঠাকুররবীন্দ্রনাথ ঠাকুররবীন্দ্রনাথ ঠাকুররবীন্দ্রনাথ ঠাকুররবীন্দ্রনাথ ঠাকুররবীন্দ্রনাথ ঠাকুররবীন্দ্রনাথ ঠাকুররবীন্দ্রনাথ ঠাকুররবীন্দ্রনাথ ঠাকুররবীন্দ্রনাথ ঠাকুররবীন্দ্রনাথ ঠাকুররবীন্দ্রনাথ ঠাকুররবীন্দ্রনাথ ঠাকুররবীন্দ্রনাথ ঠাকুররবীন্দ্রনাথ ঠাকুররবীন্দ্রনাথ ঠাকুররবীন্দ্রনাথ ঠাকুররবীন্দ্রনাথ ঠাকুররবীন্দ্রনাথ ঠাকুররবীন্দ্রনাথ ঠাকুররবীন্দ্রনাথ ঠাকুররবীন্দ্রনাথ ঠাকুররবীন্দ্রনাথ ঠাকুররবীন্দ্রনাথ ঠাকুররবীন্দ্রনাথ ঠাকুররবীন্দ্রনাথ ঠাকুররবীন্দ্রনাথ ঠাকুররবীন্দ্রনাথ ঠাকুররবীন্দ্রনাথ ঠাকুররবীন্দ্রনাথ ঠাকুররবীন্দ্রনাথ ঠাকুররবীন্দ্রনাথ ঠাকুররবীন্দ্রনাথ ঠাকুররবীন্দ্রনাথ ঠাকুররবীন্দ্রনাথ ঠাকুররবীন্দ্রনাথ ঠাকুররবীন্দ্রনাথ ঠাকুররবীন্দ্রনাথ ঠাকুররবীন্দ্রনাথ ঠাকুররবীন্দ্রনাথ ঠাকুররবীন্দ্রনাথ ঠাকুররবীন্দ্রনাথ ঠাকুররবীন্দ্রনাথ ঠাকুররবীন্দ্রনাথ ঠাকুররবীন্দ্রনাথ ঠাকুররবীন্দ্রনাথ ঠাকুররবীন্দ্রনাথ ঠাকুররবীন্দ্রনাথ ঠাকুররবীন্দ্রনাথ ঠাকুররবীন্দ্রনাথ ঠাকুররবীন্দ্রনাথ ঠাকুররবীন্দ্রনাথ ঠাকুররবীন্দ্রনাথ ঠাকুররবীন্দ্রনাথ ঠাকুররবীন্দ্রনাথ ঠাকুররবীন্দ্রনাথ ঠাকুররবীন্দ্রনাথ ঠাকুররবীন্দ্রনাথ ঠাকুররবীন্দ্রনাথ ঠাকুররবীন্দ্রনাথ ঠাকুররবীন্দ্রনাথ ঠাকুররবীন্দ্রনাথ ঠাকুররবীন্দ্রনাথ ঠাকুররবীন্দ্রনাথ ঠাকুররবীন্দ্রনাথ ঠাকুররবীন্দ্রনাথ ঠাকুররবীন্দ্রনাথ ঠাকুররবীন্দ্রনাথ ঠাকুররবীন্দ্রনাথ ঠাকুররবীন্দ্রনাথ ঠাকুররবীন্দ্রনাথ ঠাকুররবীন্দ্রনাথ ঠাকুররবীন্দ্রনাথ ঠাকুররবীন্দ্রনাথ ঠাকুররবীন্দ্রনাথ ঠাকুররবীন্দ্রনাথ ঠাকুররবীন্দ্রনাথ ঠাকুররবীন্দ্রনাথ ঠাকুররবীন্দ্রনাথ ঠাকুররবীন্দ্রনাথ ঠাকুররবীন্দ্রনাথ ঠাকুররবীন্দ্রনাথ ঠাকুররবীন্দ্রনাথ ঠাকুররবীন্দ্রনাথ ঠাকুররবীন্দ্রনাথ ঠাকুররবীন্দ্রনাথ ঠাকুররবীন্দ্রনাথ ঠাকুররবীন্দ্রনাথ ঠাকুররবীন্দ্রনাথ ঠাকুররবীন্দ্রনাথ ঠাকুররবীন্দ্রনাথ ঠাকুররবীন্দ্রনাথ ঠাকুররবীন্দ্রনাথ ঠাকুররবীন্দ্রনাথ ঠাকুররবীন্দ্রনাথ ঠাকুররবীন্দ্রনাথ ঠাকুররবীন্দ্রনাথ ঠাকুররবীন্দ্রনাথ ঠাকুররবীন্দ্রনাথ ঠাকুররবীন্দ্রনাথ ঠাকুররবীন্দ্রনাথ ঠাকুররবীন্দ্রনাথ ঠাকুররবীন্দ্রনাথ ঠাকুররবীন্দ্রনাথ ঠাকুররবীন্দ্রনাথ ঠাকুররবীন্দ্রনাথ ঠাকুররবীন্দ্রনাথ ঠাকুররবীন্দ্রনাথ ঠাকুররবীন্দ্রনাথ ঠাকুররবীন্দ্রনাথ ঠাকুররবীন্দ্রনাথ ঠাকুররবীন্দ্রনাথ ঠাকুররবীন্দ্রনাথ ঠাকুররবীন্দ্রনাথ ঠাকুররবীন্দ্রনাথ ঠাকুররবীন্দ্রনাথ ঠাকুররবীন্দ্রনাথ ঠাকুররবীন্দ্রনাথ ঠাকুররবীন্দ্রনাথ ঠাকুররবীন্দ্রনাথ ঠাকুররবীন্দ্রনাথ ঠাকুররবীন্দ্রনাথ ঠাকুররবীন্দ্রনাথ ঠাকুররবীন্দ্রনাথ ঠাকুররবীন্দ্রনাথ ঠাকুররবীন্দ্রনাথ ঠাকুররবীন্দ্রনাথ ঠাকুররবীন্দ্রনাথ ঠাকুররবীন্দ্রনাথ ঠাকুররবীন্দ্রনাথ ঠাকুররবীন্দ্রনাথ ঠাকুররবীন্দ্রনাথ ঠাকুররবীন্দ্রনাথ ঠাকুররবীন্দ্রনাথ ঠাকুররবীন্দ্রনাথ ঠাকুররবীন্দ্রনাথ ঠাকুররবীন্দ্রনাথ ঠাকুররবীন্দ্রনাথ ঠাকুররবীন্দ্রনাথ ঠাকুররবীন্দ্রনাথ ঠাকুররবীন্দ্রনাথ ঠাকুররবীন্দ্রনাথ ঠাকুররবীন্দ্রনাথ ঠাকুররবীন্দ্রনাথ ঠাকুররবীন্দ্রনাথ ঠাকুররবীন্দ্রনাথ ঠাকুররবীন্দ্রনাথ ঠাকুররবীন্দ্রনাথ ঠাকুররবীন্দ্রনাথ ঠাকুররবীন্দ্রনাথ ঠাকুররবীন্দ্রনাথ ঠাকুররবীন্দ্রনাথ ঠাকুররবীন্দ্রনাথ ঠাকুররবীন্দ্রনাথ ঠাকুররবীন্দ্রনাথ ঠাকুররবীন্দ্রনাথ ঠাকুররবীন্দ্রনাথ ঠাকুররবীন্দ্রনাথ ঠাকুররবীন্দ্রনাথ ঠাকুররবীন্দ্রনাথ ঠাকুররবীন্দ্রনাথ ঠাকুররবীন্দ্রনাথ ঠাকুররবীন্দ্রনাথ ঠাকুররবীন্দ্রনাথ ঠাকুররবীন্দ্রনাথ ঠাকুররবীন্দ্রনাথ ঠাকুররবীন্দ্রনাথ ঠাকুররবীন্দ্রনাথ ঠাকুররবীন্দ্রনাথ ঠাকুররবীন্দ্রনাথ ঠাকুররবীন্দ্রনাথ ঠাকুররবীন্দ্রনাথ ঠাকুররবীন্দ্রনাথ ঠাকুররবীন্দ্রনাথ ঠাকুররবীন্দ্রনাথ ঠাকুররবীন্দ্রনাথ ঠাকুররবীন্দ্রনাথ ঠাকুররবীন্দ্রনাথ ঠাকুররবীন্দ্রনাথ ঠাকুররবীন্দ্রনাথ ঠাকুররবীন্দ্রনাথ ঠাকুররবীন্দ্রনাথ ঠাকুররবীন্দ্রনাথ ঠাকুররবীন্দ্রনাথ ঠাকুররবীন্দ্রনাথ ঠাকুররবীন্দ্রনাথ ঠাকুররবীন্দ্রনাথ ঠাকুররবীন্দ্রনাথ ঠাকুররবীন্দ্রনাথ ঠাকুররবীন্দ্রনাথ ঠাকুররবীন্দ্রনাথ ঠাকুররবীন্দ্রনাথ ঠাকুররবীন্দ্রনাথ ঠাকুররবীন্দ্রনাথ ঠাকুররবীন্দ্রনাথ ঠাকুররবীন্দ্রনাথ ঠাকুররবীন্দ্রনাথ ঠাকুররবীন্দ্রনাথ ঠাকুররবীন্দ্রনাথ ঠাকুররবীন্দ্রনাথ ঠাকুররবীন্দ্রনাথ ঠাকুররবীন্দ্রনাথ ঠাকুররবীন্দ্রনাথ ঠাকুররবীন্দ্রনাথ ঠাকুররবীন্দ্রনাথ ঠাকুররবীন্দ্রনাথ ঠাকুররবীন্দ্রনাথ ঠাকুররবীন্দ্রনাথ ঠাকুর	0	
SELECT length(c1),c1, length(c2),c2 FROM t8 WHERE c1 LIKE _utf8 'রবীন%' COLLATE utf8_general_ci ;
length(c1)	c1	length(c2)	c2
49	রবীন্দ্রনাথ ঠাকুর	NULL	NULL
63700	রবীন্দ্রনাথ ঠাকুররবীন্দ্রনাথ ঠাকুররবীন্দ্রনাথ ঠাকুররবীন্দ্রনাথ ঠাকুররবীন্দ্রনাথ ঠাকুররবীন্দ্রনাথ ঠাকুররবীন্দ্রনাথ ঠাকুররবীন্দ্রনাথ ঠাকুররবীন্দ্রনাথ ঠাকুররবীন্দ্রনাথ ঠাকুররবীন্দ্রনাথ ঠাকুররবীন্দ্রনাথ ঠাকুররবীন্দ্রনাথ ঠাকুররবীন্দ্রনাথ ঠাকুররবীন্দ্রনাথ ঠাকুররবীন্দ্রনাথ ঠাকুররবীন্দ্রনাথ ঠাকুররবীন্দ্রনাথ ঠাকুররবীন্দ্রনাথ ঠাকুররবীন্দ্রনাথ ঠাকুররবীন্দ্রনাথ ঠাকুররবীন্দ্রনাথ ঠাকুররবীন্দ্রনাথ ঠাকুররবীন্দ্রনাথ ঠাকুররবীন্দ্রনাথ ঠাকুররবীন্দ্রনাথ ঠাকুররবীন্দ্রনাথ ঠাকুররবীন্দ্রনাথ ঠাকুররবীন্দ্রনাথ ঠাকুররবীন্দ্রনাথ ঠাকুররবীন্দ্রনাথ ঠাকুররবীন্দ্রনাথ ঠাকুররবীন্দ্রনাথ ঠাকুররবীন্দ্রনাথ ঠাকুররবীন্দ্রনাথ ঠাকুররবীন্দ্রনাথ ঠাকুররবীন্দ্রনাথ ঠাকুররবীন্দ্রনাথ ঠাকুররবীন্দ্রনাথ ঠাকুররবীন্দ্রনাথ ঠাকুররবীন্দ্রনাথ ঠাকুররবীন্দ্রনাথ ঠাকুররবীন্দ্রনাথ ঠাকুররবীন্দ্রনাথ ঠাকুররবীন্দ্রনাথ ঠাকুররবীন্দ্রনাথ ঠাকুররবীন্দ্রনাথ ঠাকুররবীন্দ্রনাথ ঠাকুররবীন্দ্রনাথ ঠাকুররবীন্দ্রনাথ ঠাকুররবীন্দ্রনাথ ঠাকুররবীন্দ্রনাথ ঠাকুররবীন্দ্রনাথ ঠাকুররবীন্দ্রনাথ ঠাকুররবীন্দ্রনাথ ঠাকুররবীন্দ্রনাথ ঠাকুররবীন্দ্রনাথ ঠাকুররবীন্দ্রনাথ ঠাকুররবীন্দ্রনাথ ঠাকুররবীন্দ্রনাথ ঠাকুররবীন্দ্রনাথ ঠাকুররবীন্দ্রনাথ ঠাকুররবীন্দ্রনাথ ঠাকুররবীন্দ্রনাথ ঠাকুররবীন্দ্রনাথ ঠাকুররবীন্দ্রনাথ ঠাকুররবীন্দ্রনাথ ঠাকুররবীন্দ্রনাথ ঠাকুররবীন্দ্রনাথ ঠাকুররবীন্দ্রনাথ ঠাকুররবীন্দ্রনাথ ঠাকুররবীন্দ্রনাথ ঠাকুররবীন্দ্রনাথ ঠাকুররবীন্দ্রনাথ ঠাকুররবীন্দ্রনাথ ঠাকুররবীন্দ্রনাথ ঠাকুররবীন্দ্রনাথ ঠাকুররবীন্দ্রনাথ ঠাকুররবীন্দ্রনাথ ঠাকুররবীন্দ্রনাথ ঠাকুররবীন্দ্রনাথ ঠাকুররবীন্দ্রনাথ ঠাকুররবীন্দ্রনাথ ঠাকুররবীন্দ্রনাথ ঠাকুররবীন্দ্রনাথ ঠাকুররবীন্দ্রনাথ ঠাকুররবীন্দ্রনাথ ঠাকুররবীন্দ্রনাথ ঠাকুররবীন্দ্রনাথ ঠাকুররবীন্দ্রনাথ ঠাকুররবীন্দ্রনাথ ঠাকুররবীন্দ্রনাথ ঠাকুররবীন্দ্রনাথ ঠাকুররবীন্দ্রনাথ ঠাকুররবীন্দ্রনাথ ঠাকুররবীন্দ্রনাথ ঠাকুররবীন্দ্রনাথ ঠাকুররবীন্দ্রনাথ ঠাকুররবীন্দ্রনাথ ঠাকুররবীন্দ্রনাথ ঠাকুররবীন্দ্রনাথ ঠাকুররবীন্দ্রনাথ ঠাকুররবীন্দ্রনাথ ঠাকুররবীন্দ্রনাথ ঠাকুররবীন্দ্রনাথ ঠাকুররবীন্দ্রনাথ ঠাকুররবীন্দ্রনাথ ঠাকুররবীন্দ্রনাথ ঠাকুররবীন্দ্রনাথ ঠাকুররবীন্দ্রনাথ ঠাকুররবীন্দ্রনাথ ঠাকুররবীন্দ্রনাথ ঠাকুররবীন্দ্রনাথ ঠাকুররবীন্দ্রনাথ ঠাকুররবীন্দ্রনাথ ঠাকুররবীন্দ্রনাথ ঠাকুররবীন্দ্রনাথ ঠাকুররবীন্দ্রনাথ ঠাকুররবীন্দ্রনাথ ঠাকুররবীন্দ্রনাথ ঠাকুররবীন্দ্রনাথ ঠাকুররবীন্দ্রনাথ ঠাকুররবীন্দ্রনাথ ঠাকুররবীন্দ্রনাথ ঠাকুররবীন্দ্রনাথ ঠাকুররবীন্দ্রনাথ ঠাকুররবীন্দ্রনাথ ঠাকুররবীন্দ্রনাথ ঠাকুররবীন্দ্রনাথ ঠাকুররবীন্দ্রনাথ ঠাকুররবীন্দ্রনাথ ঠাকুররবীন্দ্রনাথ ঠাকুররবীন্দ্রনাথ ঠাকুররবীন্দ্রনাথ ঠাকুররবীন্দ্রনাথ ঠাকুররবীন্দ্রনাথ ঠাকুররবীন্দ্রনাথ ঠাকুররবীন্দ্রনাথ ঠাকুররবীন্দ্রনাথ ঠাকুররবীন্দ্রনাথ ঠাকুররবীন্দ্রনাথ ঠাকুররবীন্দ্রনাথ ঠাকুররবীন্দ্রনাথ ঠাকুররবীন্দ্রনাথ ঠাকুররবীন্দ্রনাথ ঠাকুররবীন্দ্রনাথ ঠাকুররবীন্দ্রনাথ ঠাকুররবীন্দ্রনাথ ঠাকুররবীন্দ্রনাথ ঠাকুররবীন্দ্রনাথ ঠাকুররবীন্দ্রনাথ ঠাকুররবীন্দ্রনাথ ঠাকুররবীন্দ্রনাথ ঠাকুররবীন্দ্রনাথ ঠাকুররবীন্দ্রনাথ ঠাকুররবীন্দ্রনাথ ঠাকুররবীন্দ্রনাথ ঠাকুররবীন্দ্রনাথ ঠাকুররবীন্দ্রনাথ ঠাকুররবীন্দ্রনাথ ঠাকুররবীন্দ্রনাথ ঠাকুররবীন্দ্রনাথ ঠাকুররবীন্দ্রনাথ ঠাকুররবীন্দ্রনাথ ঠাকুররবীন্দ্রনাথ ঠাকুররবীন্দ্রনাথ ঠাকুররবীন্দ্রনাথ ঠাকুররবীন্দ্রনাথ ঠাকুররবীন্দ্রনাথ ঠাকুররবীন্দ্রনাথ ঠাকুররবীন্দ্রনাথ ঠাকুররবীন্দ্রনাথ ঠাকুররবীন্দ্রনাথ ঠাকুররবীন্দ্রনাথ ঠাকুররবীন্দ্রনাথ ঠাকুররবীন্দ্রনাথ ঠাকুররবীন্দ্রনাথ ঠাকুররবীন্দ্রনাথ ঠাকুররবীন্দ্রনাথ ঠাকুররবীন্দ্রনাথ ঠাকুররবীন্দ্রনাথ ঠাকুররবীন্দ্রনাথ ঠাকুররবীন্দ্রনাথ ঠাকুররবীন্দ্রনাথ ঠাকুররবীন্দ্রনাথ ঠাকুররবীন্দ্রনাথ ঠাকুররবীন্দ্রনাথ ঠাকুররবীন্দ্রনাথ ঠাকুররবীন্দ্রনাথ ঠাকুররবীন্দ্রনাথ ঠাকুররবীন্দ্রনাথ ঠাকুররবীন্দ্রনাথ ঠাকুররবীন্দ্রনাথ ঠাকুররবীন্দ্রনাথ ঠাকুররবীন্দ্রনাথ ঠাকুররবীন্দ্রনাথ ঠাকুররবীন্দ্রনাথ ঠাকুররবীন্দ্রনাথ ঠাকুররবীন্দ্রনাথ ঠাকুররবীন্দ্রনাথ ঠাকুররবীন্দ্রনাথ ঠাকুররবীন্দ্রনাথ ঠাকুররবীন্দ্রনাথ ঠাকুররবীন্দ্রনাথ ঠাকুররবীন্দ্রনাথ ঠাকুররবীন্দ্রনাথ ঠাকুররবীন্দ্রনাথ ঠাকুররবীন্দ্রনাথ ঠাকুররবীন্দ্রনাথ ঠাকুররবীন্দ্রনাথ ঠাকুররবীন্দ্রনাথ ঠাকুররবীন্দ্রনাথ ঠাকুররবীন্দ্রনাথ ঠাকুররবীন্দ্রনাথ ঠাকুররবীন্দ্রনাথ ঠাকুররবীন্দ্রনাথ ঠাকুররবীন্দ্রনাথ ঠাকুররবীন্দ্রনাথ ঠাকুররবীন্দ্রনাথ ঠাকুররবীন্দ্রনাথ ঠাকুররবীন্দ্রনাথ ঠাকুররবীন্দ্রনাথ ঠাকুররবীন্দ্রনাথ ঠাকুররবীন্দ্রনাথ ঠাকুররবীন্দ্রনাথ ঠাকুররবীন্দ্রনাথ ঠাকুররবীন্দ্রনাথ ঠাকুররবীন্দ্রনাথ ঠাকুররবীন্দ্রনাথ ঠাকুররবীন্দ্রনাথ ঠাকুররবীন্দ্রনাথ ঠাকুররবীন্দ্রনাথ ঠাকুররবীন্দ্রনাথ ঠাকুররবীন্দ্রনাথ ঠাকুররবীন্দ্রনাথ ঠাকুররবীন্দ্রনাথ ঠাকুররবীন্দ্রনাথ ঠাকুররবীন্দ্রনাথ ঠাকুররবীন্দ্রনাথ ঠাকুররবীন্দ্রনাথ ঠাকুররবীন্দ্রনাথ ঠাকুররবীন্দ্রনাথ ঠাকুররবীন্দ্রনাথ ঠাকুররবীন্দ্রনাথ ঠাকুররবীন্দ্রনাথ ঠাকুররবীন্দ্রনাথ ঠাকুররবীন্দ্রনাথ ঠাকুররবীন্দ্রনাথ ঠাকুররবীন্দ্রনাথ ঠাকুররবীন্দ্রনাথ ঠাকুররবীন্দ্রনাথ ঠাকুররবীন্দ্রনাথ ঠাকুররবীন্দ্রনাথ ঠাকুররবীন্দ্রনাথ ঠাকুররবীন্দ্রনাথ ঠাকুররবীন্দ্রনাথ ঠাকুররবীন্দ্রনাথ ঠাকুররবীন্দ্রনাথ ঠাকুররবীন্দ্রনাথ ঠাকুররবীন্দ্রনাথ ঠাকুররবীন্দ্রনাথ ঠাকুররবীন্দ্রনাথ ঠাকুররবীন্দ্রনাথ ঠাকুররবীন্দ্রনাথ ঠাকুররবীন্দ্রনাথ ঠাকুররবীন্দ্রনাথ ঠাকুররবীন্দ্রনাথ ঠাকুররবীন্দ্রনাথ ঠাকুররবীন্দ্রনাথ ঠাকুররবীন্দ্রনাথ ঠাকুররবীন্দ্রনাথ ঠাকুররবীন্দ্রনাথ ঠাকুররবীন্দ্রনাথ ঠাকুররবীন্দ্রনাথ ঠাকুররবীন্দ্রনাথ ঠাকুররবীন্দ্রনাথ ঠাকুররবীন্দ্রনাথ ঠাকুররবীন্দ্রনাথ ঠাকুররবীন্দ্রনাথ ঠাকুররবীন্দ্রনাথ ঠাকুররবীন্দ্রনাথ ঠাকুররবীন্দ্রনাথ ঠাকুররবীন্দ্রনাথ ঠাকুররবীন্দ্রনাথ ঠাকুররবীন্দ্রনাথ ঠাকুররবীন্দ্রনাথ ঠাকুররবীন্দ্রনাথ ঠাকুররবীন্দ্রনাথ ঠাকুররবীন্দ্রনাথ ঠাকুররবীন্দ্রনাথ ঠাকুররবীন্দ্রনাথ ঠাকুররবীন্দ্রনাথ ঠাকুররবীন্দ্রনাথ ঠাকুররবীন্দ্রনাথ ঠাকুররবীন্দ্রনাথ ঠাকুররবীন্দ্রনাথ ঠাকুররবীন্দ্রনাথ ঠাকুররবীন্দ্রনাথ ঠাকুররবীন্দ্রনাথ ঠাকুররবীন্দ্রনাথ ঠাকুররবীন্দ্রনাথ ঠাকুররবীন্দ্রনাথ ঠাকুররবীন্দ্রনাথ ঠাকুররবীন্দ্রনাথ ঠাকুররবীন্দ্রনাথ ঠাকুররবীন্দ্রনাথ ঠাকুররবীন্দ্রনাথ ঠাকুররবীন্দ্রনাথ ঠাকুররবীন্দ্রনাথ ঠাকুররবীন্দ্রনাথ ঠাকুররবীন্দ্রনাথ ঠাকুররবীন্দ্রনাথ ঠাকুররবীন্দ্রনাথ ঠাকুররবীন্দ্রনাথ ঠাকুররবীন্দ্রনাথ ঠাকুররবীন্দ্রনাথ ঠাকুররবীন্দ্রনাথ ঠাকুররবীন্দ্রনাথ ঠাকুররবীন্দ্রনাথ ঠাকুররবীন্দ্রনাথ ঠাকুররবীন্দ্রনাথ ঠাকুররবীন্দ্রনাথ ঠাকুররবীন্দ্রনাথ ঠাকুররবীন্দ্রনাথ ঠাকুররবীন্দ্রনাথ ঠাকুররবীন্দ্রনাথ ঠাকুররবীন্দ্রনাথ ঠাকুররবীন্দ্রনাথ ঠাকুররবীন্দ্রনাথ ঠাকুররবীন্দ্রনাথ ঠাকুররবীন্দ্রনাথ ঠাকুররবীন্দ্রনাথ ঠাকুররবীন্দ্রনাথ ঠাকুররবীন্দ্রনাথ ঠাকুররবীন্দ্রনাথ ঠাকুররবীন্দ্রনাথ ঠাকুররবীন্দ্রনাথ ঠাকুররবীন্দ্রনাথ ঠাকুররবীন্দ্রনাথ ঠাকুররবীন্দ্রনাথ ঠাকুররবীন্দ্রনাথ ঠাকুররবীন্দ্রনাথ ঠাকুররবীন্দ্রনাথ ঠাকুররবীন্দ্রনাথ ঠাকুররবীন্দ্রনাথ ঠাকুররবীন্দ্রনাথ ঠাকুররবীন্দ্রনাথ ঠাকুররবীন্দ্রনাথ ঠাকুররবীন্দ্রনাথ ঠাকুররবীন্দ্রনাথ ঠাকুররবীন্দ্রনাথ ঠাকুররবীন্দ্রনাথ ঠাকুররবীন্দ্রনাথ ঠাকুররবীন্দ্রনাথ ঠাকুররবীন্দ্রনাথ ঠাকুররবীন্দ্রনাথ ঠাকুররবীন্দ্রনাথ ঠাকুররবীন্দ্রনাথ ঠাকুররবীন্দ্রনাথ ঠাকুররবীন্দ্রনাথ ঠাকুররবীন্দ্রনাথ ঠাকুররবীন্দ্রনাথ ঠাকুররবীন্দ্রনাথ ঠাকুররবীন্দ্রনাথ ঠাকুররবীন্দ্রনাথ ঠাকুররবীন্দ্রনাথ ঠাকুররবীন্দ্রনাথ ঠাকুররবীন্দ্রনাথ ঠাকুররবীন্দ্রনাথ ঠাকুররবীন্দ্রনাথ ঠাকুররবীন্দ্রনাথ ঠাকুররবীন্দ্রনাথ ঠাকুররবীন্দ্রনাথ ঠাকুররবীন্দ্রনাথ ঠাকুররবীন্দ্রনাথ ঠাকুররবীন্দ্রনাথ ঠাকুররবীন্দ্রনাথ ঠাকুররবীন্দ্রনাথ ঠাকুররবীন্দ্রনাথ ঠাকুররবীন্দ্রনাথ ঠাকুররবীন্দ্রনাথ ঠাকুররবীন্দ্রনাথ ঠাকুররবীন্দ্রনাথ ঠাকুররবীন্দ্রনাথ ঠাকুররবীন্দ্রনাথ ঠাকুররবীন্দ্রনাথ ঠাকুররবীন্দ্রনাথ ঠাকুররবীন্দ্রনাথ ঠাকুররবীন্দ্রনাথ ঠাকুররবীন্দ্রনাথ ঠাকুররবীন্দ্রনাথ ঠাকুররবীন্দ্রনাথ ঠাকুররবীন্দ্রনাথ ঠাকুররবীন্দ্রনাথ ঠাকুররবীন্দ্রনাথ ঠাকুররবীন্দ্রনাথ ঠাকুররবীন্দ্রনাথ ঠাকুররবীন্দ্রনাথ ঠাকুররবীন্দ্রনাথ ঠাকুররবীন্দ্রনাথ ঠাকুররবীন্দ্রনাথ ঠাকুররবীন্দ্রনাথ ঠাকুররবীন্দ্রনাথ ঠাকুররবীন্দ্রনাথ ঠাকুররবীন্দ্রনাথ ঠাকুররবীন্দ্রনাথ ঠাকুররবীন্দ্রনাথ ঠাকুররবীন্দ্রনাথ ঠাকুররবীন্দ্রনাথ ঠাকুররবীন্দ্রনাথ ঠাকুররবীন্দ্রনাথ ঠাকুররবীন্দ্রনাথ ঠাকুররবীন্দ্রনাথ ঠাকুররবীন্দ্রনাথ ঠাকুররবীন্দ্রনাথ ঠাকুররবীন্দ্রনাথ ঠাকুররবীন্দ্রনাথ ঠাকুররবীন্দ্রনাথ ঠাকুররবীন্দ্রনাথ ঠাকুররবীন্দ্রনাথ ঠাকুররবীন্দ্রনাথ ঠাকুররবীন্দ্রনাথ ঠাকুররবীন্দ্রনাথ ঠাকুররবীন্দ্রনাথ ঠাকুররবীন্দ্রনাথ ঠাকুররবীন্দ্রনাথ ঠাকুররবীন্দ্রনাথ ঠাকুররবীন্দ্রনাথ ঠাকুররবীন্দ্রনাথ ঠাকুররবীন্দ্রনাথ ঠাকুররবীন্দ্রনাথ ঠাকুররবীন্দ্রনাথ ঠাকুররবীন্দ্রনাথ ঠাকুররবীন্দ্রনাথ ঠাকুররবীন্দ্রনাথ ঠাকুররবীন্দ্রনাথ ঠাকুররবীন্দ্রনাথ ঠাকুররবীন্দ্রনাথ ঠাকুররবীন্দ্রনাথ ঠাকুররবীন্দ্রনাথ ঠাকুররবীন্দ্রনাথ ঠাকুররবীন্দ্রনাথ ঠাকুররবীন্দ্রনাথ ঠাকুররবীন্দ্রনাথ ঠাকুররবীন্দ্রনাথ ঠাকুররবীন্দ্রনাথ ঠাকুররবীন্দ্রনাথ ঠাকুররবীন্দ্রনাথ ঠাকুররবীন্দ্রনাথ ঠাকুররবীন্দ্রনাথ ঠাকুররবীন্দ্রনাথ ঠাকুররবীন্দ্রনাথ ঠাকুররবীন্দ্রনাথ ঠাকুররবীন্দ্রনাথ ঠাকুররবীন্দ্রনাথ ঠাকুররবীন্দ্রনাথ ঠাকুররবীন্দ্রনাথ ঠাকুররবীন্দ্রনাথ ঠাকুররবীন্দ্রনাথ ঠাকুররবীন্দ্রনাথ ঠাকুররবীন্দ্রনাথ ঠাকুররবীন্দ্রনাথ ঠাকুররবীন্দ্রনাথ ঠাকুররবীন্দ্রনাথ ঠাকুররবীন্দ্রনাথ ঠাকুররবীন্দ্রনাথ ঠাকুররবীন্দ্রনাথ ঠাকুররবীন্দ্রনাথ ঠাকুররবীন্দ্রনাথ ঠাকুররবীন্দ্রনাথ ঠাকুররবীন্দ্রনাথ ঠাকুররবীন্দ্রনাথ ঠাকুররবীন্দ্রনাথ ঠাকুররবীন্দ্রনাথ ঠাকুররবীন্দ্রনাথ ঠাকুররবীন্দ্রনাথ ঠাকুররবীন্দ্রনাথ ঠাকুররবীন্দ্রনাথ ঠাকুররবীন্দ্রনাথ ঠাকুররবীন্দ্রনাথ ঠাকুররবীন্দ্রনাথ ঠাকুররবীন্দ্রনাথ ঠাকুররবীন্দ্রনাথ ঠাকুররবীন্দ্রনাথ ঠাকুররবীন্দ্রনাথ ঠাকুররবীন্দ্রনাথ ঠাকুররবীন্দ্রনাথ ঠাকুররবীন্দ্রনাথ ঠাকুররবীন্দ্রনাথ ঠাকুররবীন্দ্রনাথ ঠাকুররবীন্দ্রনাথ ঠাকুররবীন্দ্রনাথ ঠাকুররবীন্দ্রনাথ ঠাকুররবীন্দ্রনাথ ঠাকুররবীন্দ্রনাথ ঠাকুররবীন্দ্রনাথ ঠাকুররবীন্দ্রনাথ ঠাকুররবীন্দ্রনাথ ঠাকুররবীন্দ্রনাথ ঠাকুররবীন্দ্রনাথ ঠাকুররবীন্দ্রনাথ ঠাকুররবীন্দ্রনাথ ঠাকুররবীন্দ্রনাথ ঠাকুররবীন্দ্রনাথ ঠাকুররবীন্দ্রনাথ ঠাকুররবীন্দ্রনাথ ঠাকুররবীন্দ্রনাথ ঠাকুররবীন্দ্রনাথ ঠাকুররবীন্দ্রনাথ ঠাকুররবীন্দ্রনাথ ঠাকুররবীন্দ্রনাথ ঠাকুররবীন্দ্রনাথ ঠাকুররবীন্দ্রনাথ ঠাকুররবীন্দ্রনাথ ঠাকুররবীন্দ্রনাথ ঠাকুররবীন্দ্রনাথ ঠাকুররবীন্দ্রনাথ ঠাকুররবীন্দ্রনাথ ঠাকুররবীন্দ্রনাথ ঠাকুররবীন্দ্রনাথ ঠাকুররবীন্দ্রনাথ ঠাকুররবীন্দ্রনাথ ঠাকুররবীন্দ্রনাথ ঠাকুররবীন্দ্রনাথ ঠাকুররবীন্দ্রনাথ ঠাকুররবীন্দ্রনাথ ঠাকুররবীন্দ্রনাথ ঠাকুররবীন্দ্রনাথ ঠাকুররবীন্দ্রনাথ ঠাকুররবীন্দ্রনাথ ঠাকুররবীন্দ্রনাথ ঠাকুররবীন্দ্রনাথ ঠাকুররবীন্দ্রনাথ ঠাকুররবীন্দ্রনাথ ঠাকুররবীন্দ্রনাথ ঠাকুররবীন্দ্রনাথ ঠাকুররবীন্দ্রনাথ ঠাকুররবীন্দ্রনাথ ঠাকুররবীন্দ্রনাথ ঠাকুররবীন্দ্রনাথ ঠাকুররবীন্দ্রনাথ ঠাকুররবীন্দ্রনাথ ঠাকুররবীন্দ্রনাথ ঠাকুররবীন্দ্রনাথ ঠাকুররবীন্দ্রনাথ ঠাকুররবীন্দ্রনাথ ঠাকুররবীন্দ্রনাথ ঠাকুররবীন্দ্রনাথ ঠাকুররবীন্দ্রনাথ ঠাকুররবীন্দ্রনাথ ঠাকুররবীন্দ্রনাথ ঠাকুররবীন্দ্রনাথ ঠাকুররবীন্দ্রনাথ ঠাকুররবীন্দ্রনাথ ঠাকুররবীন্দ্রনাথ ঠাকুররবীন্দ্রনাথ ঠাকুররবীন্দ্রনাথ ঠাকুররবীন্দ্রনাথ ঠাকুররবীন্দ্রনাথ ঠাকুররবীন্দ্রনাথ ঠাকুররবীন্দ্রনাথ ঠাকুররবীন্দ্রনাথ ঠাকুররবীন্দ্রনাথ ঠাকুররবীন্দ্রনাথ ঠাকুররবীন্দ্রনাথ ঠাকুররবীন্দ্রনাথ ঠাকুররবীন্দ্রনাথ ঠাকুররবীন্দ্রনাথ ঠাকুররবীন্দ্রনাথ ঠাকুররবীন্দ্রনাথ ঠাকুররবীন্দ্রনাথ ঠাকুররবীন্দ্রনাথ ঠাকুররবীন্দ্রনাথ ঠাকুররবীন্দ্রনাথ ঠাকুররবীন্দ্রনাথ ঠাকুররবীন্দ্রনাথ ঠাকুররবীন্দ্রনাথ ঠাকুররবীন্দ্রনাথ ঠাকুররবীন্দ্রনাথ ঠাকুররবীন্দ্রনাথ ঠাকুররবীন্দ্রনাথ ঠাকুররবীন্দ্রনাথ ঠাকুররবীন্দ্রনাথ ঠাকুররবীন্দ্রনাথ ঠাকুররবীন্দ্রনাথ ঠাকুররবীন্দ্রনাথ ঠাকুররবীন্দ্রনাথ ঠাকুররবীন্দ্রনাথ ঠাকুররবীন্দ্রনাথ ঠাকুররবীন্দ্রনাথ ঠাকুররবীন্দ্রনাথ ঠাকুররবীন্দ্রনাথ ঠাকুররবীন্দ্রনাথ ঠাকুররবীন্দ্রনাথ ঠাকুররবীন্দ্রনাথ ঠাকুররবীন্দ্রনাথ ঠাকুররবীন্দ্রনাথ ঠাকুররবীন্দ্রনাথ ঠাকুররবীন্দ্রনাথ ঠাকুররবীন্দ্রনাথ ঠাকুররবীন্দ্রনাথ ঠাকুররবীন্দ্রনাথ ঠাকুররবীন্দ্রনাথ ঠাকুররবীন্দ্রনাথ ঠাকুররবীন্দ্রনাথ ঠাকুররবীন্দ্রনাথ ঠাকুররবীন্দ্রনাথ ঠাকুররবীন্দ্রনাথ ঠাকুররবীন্দ্রনাথ ঠাকুররবীন্দ্রনাথ ঠাকুররবীন্দ্রনাথ ঠাকুররবীন্দ্রনাথ ঠাকুররবীন্দ্রনাথ ঠাকুররবীন্দ্রনাথ ঠাকুররবীন্দ্রনাথ ঠাকুররবীন্দ্রনাথ ঠাকুররবীন্দ্রনাথ ঠাকুররবীন্দ্রনাথ ঠাকুররবীন্দ্রনাথ ঠাকুররবীন্দ্রনাথ ঠাকুররবীন্দ্রনাথ ঠাকুররবীন্দ্রনাথ ঠাকুররবীন্দ্রনাথ ঠাকুররবীন্দ্রনাথ ঠাকুররবীন্দ্রনাথ ঠাকুররবীন্দ্রনাথ ঠাকুররবীন্দ্রনাথ ঠাকুররবীন্দ্রনাথ ঠাকুররবীন্দ্রনাথ ঠাকুররবীন্দ্রনাথ ঠাকুররবীন্দ্রনাথ ঠাকুররবীন্দ্রনাথ ঠাকুররবীন্দ্রনাথ ঠাকুররবীন্দ্রনাথ ঠাকুররবীন্দ্রনাথ ঠাকুররবীন্দ্রনাথ ঠাকুররবীন্দ্রনাথ ঠাকুররবীন্দ্রনাথ ঠাকুররবীন্দ্রনাথ ঠাকুররবীন্দ্রনাথ ঠাকুররবীন্দ্রনাথ ঠাকুররবীন্দ্রনাথ ঠাকুররবীন্দ্রনাথ ঠাকুররবীন্দ্রনাথ ঠাকুররবীন্দ্রনাথ ঠাকুররবীন্দ্রনাথ ঠাকুররবীন্দ্রনাথ ঠাকুররবীন্দ্রনাথ ঠাকুররবীন্দ্রনাথ ঠাকুররবীন্দ্রনাথ ঠাকুররবীন্দ্রনাথ ঠাকুররবীন্দ্রনাথ ঠাকুররবীন্দ্রনাথ ঠাকুররবীন্দ্রনাথ ঠাকুররবীন্দ্রনাথ ঠাকুররবীন্দ্রনাথ ঠাকুররবীন্দ্রনাথ ঠাকুররবীন্দ্রনাথ ঠাকুররবীন্দ্রনাথ ঠাকুররবীন্দ্রনাথ ঠাকুররবীন্দ্রনাথ ঠাকুররবীন্দ্রনাথ ঠাকুররবীন্দ্রনাথ ঠাকুররবীন্দ্রনাথ ঠাকুররবীন্দ্রনাথ ঠাকুররবীন্দ্রনাথ ঠাকুররবীন্দ্রনাথ ঠাকুররবীন্দ্রনাথ ঠাকুররবীন্দ্রনাথ ঠাকুররবীন্দ্রনাথ ঠাকুররবীন্দ্রনাথ ঠাকুররবীন্দ্রনাথ ঠাকুররবীন্দ্রনাথ ঠাকুররবীন্দ্রনাথ ঠাকুররবীন্দ্রনাথ ঠাকুররবীন্দ্রনাথ ঠাকুররবীন্দ্রনাথ ঠাকুররবীন্দ্রনাথ ঠাকুররবীন্দ্রনাথ ঠাকুররবীন্দ্রনাথ ঠাকুররবীন্দ্রনাথ ঠাকুররবীন্দ্রনাথ ঠাকুররবীন্দ্রনাথ ঠাকুররবীন্দ্রনাথ ঠাকুররবীন্দ্রনাথ ঠাকুররবীন্দ্রনাথ ঠাকুররবীন্দ্রনাথ ঠাকুররবীন্দ্রনাথ ঠাকুররবীন্দ্রনাথ ঠাকুররবীন্দ্রনাথ ঠাকুররবীন্দ্রনাথ ঠাকুররবীন্দ্রনাথ ঠাকুররবীন্দ্রনাথ ঠাকুররবীন্দ্রনাথ ঠাকুররবীন্দ্রনাথ ঠাকুররবীন্দ্রনাথ ঠাকুররবীন্দ্রনাথ ঠাকুররবীন্দ্রনাথ ঠাকুররবীন্দ্রনাথ ঠাকুররবীন্দ্রনাথ ঠাকুররবীন্দ্রনাথ ঠাকুররবীন্দ্রনাথ ঠাকুররবীন্দ্রনাথ ঠাকুররবীন্দ্রনাথ ঠাকুররবীন্দ্রনাথ ঠাকুররবীন্দ্রনাথ ঠাকুররবীন্দ্রনাথ ঠাকুররবীন্দ্রনাথ ঠাকুররবীন্দ্রনাথ ঠাকুররবীন্দ্রনাথ ঠাকুররবীন্দ্রনাথ ঠাকুররবীন্দ্রনাথ ঠাকুররবীন্দ্রনাথ ঠাকুররবীন্দ্রনাথ ঠাকুররবীন্দ্রনাথ ঠাকুররবীন্দ্রনাথ ঠাকুররবীন্দ্রনাথ ঠাকুররবীন্দ্রনাথ ঠাকুররবীন্দ্রনাথ ঠাকুররবীন্দ্রনাথ ঠাকুররবীন্দ্রনাথ ঠাকুররবীন্দ্রনাথ ঠাকুররবীন্দ্রনাথ ঠাকুররবীন্দ্রনাথ ঠাকুররবীন্দ্রনাথ ঠাকুররবীন্দ্রনাথ ঠাকুররবীন্দ্রনাথ ঠাকুররবীন্দ্রনাথ ঠাকুররবীন্দ্রনাথ ঠাকুররবীন্দ্রনাথ ঠাকুররবীন্দ্রনাথ ঠাকুররবীন্দ্রনাথ ঠাকুররবীন্দ্রনাথ ঠাকুররবীন্দ্রনাথ ঠাকুররবীন্দ্রনাথ ঠাকুররবীন্দ্রনাথ ঠাকুররবীন্দ্রনাথ ঠাকুররবীন্দ্রনাথ ঠাকুররবীন্দ্রনাথ ঠাকুররবীন্দ্রনাথ ঠাকুররবীন্দ্রনাথ ঠাকুররবীন্দ্রনাথ ঠাকুররবীন্দ্রনাথ ঠাকুররবীন্দ্রনাথ ঠাকুররবীন্দ্রনাথ ঠাকুররবীন্দ্রনাথ ঠাকুররবীন্দ্রনাথ ঠাকুররবীন্দ্রনাথ ঠাকুররবীন্দ্রনাথ ঠাকুররবীন্দ্রনাথ ঠাকুররবীন্দ্রনাথ ঠাকুররবীন্দ্রনাথ ঠাকুররবীন্দ্রনাথ ঠাকুররবীন্দ্রনাথ ঠাকুররবীন্দ্রনাথ ঠাকুররবীন্দ্রনাথ ঠাকুররবীন্দ্রনাথ ঠাকুররবীন্দ্রনাথ ঠাকুররবীন্দ্রনাথ ঠাকুররবীন্দ্রনাথ ঠাকুররবীন্দ্রনাথ ঠাকুররবীন্দ্রনাথ ঠাকুররবীন্দ্রনাথ ঠাকুররবীন্দ্রনাথ ঠাকুররবীন্দ্রনাথ ঠাকুররবীন্দ্রনাথ ঠাকুররবীন্দ্রনাথ ঠাকুররবীন্দ্রনাথ ঠাকুররবীন্দ্রনাথ ঠাকুররবীন্দ্রনাথ ঠাকুররবীন্দ্রনাথ ঠাকুররবীন্দ্রনাথ ঠাকুররবীন্দ্রনাথ ঠাকুররবীন্দ্রনাথ ঠাকুররবীন্দ্রনাথ ঠাকুররবীন্দ্রনাথ ঠাকুররবীন্দ্রনাথ ঠাকুররবীন্দ্রনাথ ঠাকুররবীন্দ্রনাথ ঠাকুররবীন্দ্রনাথ ঠাকুররবীন্দ্রনাথ ঠাকুররবীন্দ্রনাথ ঠাকুররবীন্দ্রনাথ ঠাকুররবীন্দ্রনাথ ঠাকুররবীন্দ্রনাথ ঠাকুররবীন্দ্রনাথ ঠাকুররবীন্দ্রনাথ ঠাকুররবীন্দ্রনাথ ঠাকুররবীন্দ্রনাথ ঠাকুররবীন্দ্রনাথ ঠাকুররবীন্দ্রনাথ ঠাকুররবীন্দ্রনাথ ঠাকুররবীন্দ্রনাথ ঠাকুররবীন্দ্রনাথ ঠাকুররবীন্দ্রনাথ ঠাকুররবীন্দ্রনাথ ঠাকুররবীন্দ্রনাথ ঠাকুররবীন্দ্রনাথ ঠাকুররবীন্দ্রনাথ ঠাকুররবীন্দ্রনাথ ঠাকুররবীন্দ্রনাথ ঠাকুররবীন্দ্রনাথ ঠাকুররবীন্দ্রনাথ ঠাকুররবীন্দ্রনাথ ঠাকুররবীন্দ্রনাথ ঠাকুররবীন্দ্রনাথ ঠাকুররবীন্দ্রনাথ ঠাকুররবীন্দ্রনাথ ঠাকুররবীন্দ্রনাথ ঠাকুররবীন্দ্রনাথ ঠাকুররবীন্দ্রনাথ ঠাকুররবীন্দ্রনাথ ঠাকুররবীন্দ্রনাথ ঠাকুররবীন্দ্রনাথ ঠাকুররবীন্দ্রনাথ ঠাকুররবীন্দ্রনাথ ঠাকুররবীন্দ্রনাথ ঠাকুররবীন্দ্রনাথ ঠাকুররবীন্দ্রনাথ ঠাকুররবীন্দ্রনাথ ঠাকুররবীন্দ্রনাথ ঠাকুররবীন্দ্রনাথ ঠাকুররবীন্দ্রনাথ ঠাকুররবীন্দ্রনাথ ঠাকুররবীন্দ্রনাথ ঠাকুররবীন্দ্রনাথ ঠাকুররবীন্দ্রনাথ ঠাকুররবীন্দ্রনাথ ঠাকুররবীন্দ্রনাথ ঠাকুররবীন্দ্রনাথ ঠাকুররবীন্দ্রনাথ ঠাকুররবীন্দ্রনাথ ঠাকুররবীন্দ্রনাথ ঠাকুররবীন্দ্রনাথ ঠাকুররবীন্দ্রনাথ ঠাকুররবীন্দ্রনাথ ঠাকুররবীন্দ্রনাথ ঠাকুররবীন্দ্রনাথ ঠাকুররবীন্দ্রনাথ ঠাকুররবীন্দ্রনাথ ঠাকুররবীন্দ্রনাথ ঠাকুররবীন্দ্রনাথ ঠাকুররবীন্দ্রনাথ ঠাকুররবীন্দ্রনাথ ঠাকুররবীন্দ্রনাথ ঠাকুররবীন্দ্রনাথ ঠাকুররবীন্দ্রনাথ ঠাকুররবীন্দ্রনাথ ঠাকুররবীন্দ্রনাথ ঠাকুররবীন্দ্রনাথ ঠাকুররবীন্দ্রনাথ ঠাকুররবীন্দ্রনাথ ঠাকুররবীন্দ্রনাথ ঠাকুররবীন্দ্রনাথ ঠাকুররবীন্দ্রনাথ ঠাকুররবীন্দ্রনাথ ঠাকুররবীন্দ্রনাথ ঠাকুররবীন্দ্রনাথ ঠাকুররবীন্দ্রনাথ ঠাকুররবীন্দ্রনাথ ঠাকুররবীন্দ্রনাথ ঠাকুররবীন্দ্রনাথ ঠাকুররবীন্দ্রনাথ ঠাকুররবীন্দ্রনাথ ঠাকুররবীন্দ্রনাথ ঠাকুররবীন্দ্রনাথ ঠাকুররবীন্দ্রনাথ ঠাকুররবীন্দ্রনাথ ঠাকুররবীন্দ্রনাথ ঠাকুররবীন্দ্রনাথ ঠাকুররবীন্দ্রনাথ ঠাকুররবীন্দ্রনাথ ঠাকুররবীন্দ্রনাথ ঠাকুররবীন্দ্রনাথ ঠাকুররবীন্দ্রনাথ ঠাকুররবীন্দ্রনাথ ঠাকুররবীন্দ্রনাথ ঠাকুররবীন্দ্রনাথ ঠাকুররবীন্দ্রনাথ ঠাকুররবীন্দ্রনাথ ঠাকুররবীন্দ্রনাথ ঠাকুররবীন্দ্রনাথ ঠাকুররবীন্দ্রনাথ ঠাকুররবীন্দ্রনাথ ঠাকুররবীন্দ্রনাথ ঠাকুররবীন্দ্রনাথ ঠাকুররবীন্দ্রনাথ ঠাকুররবীন্দ্রনাথ ঠাকুররবীন্দ্রনাথ ঠাকুররবীন্দ্রনাথ ঠাকুররবীন্দ্রনাথ ঠাকুররবীন্দ্রনাথ ঠাকুররবীন্দ্রনাথ ঠাকুররবীন্দ্রনাথ ঠাকুররবীন্দ্রনাথ ঠাকুররবীন্দ্রনাথ ঠাকুররবীন্দ্রনাথ ঠাকুররবীন্দ্রনাথ ঠাকুররবীন্দ্রনাথ ঠাকুররবীন্দ্রনাথ ঠাকুররবীন্দ্রনাথ ঠাকুররবীন্দ্রনাথ ঠাকুররবীন্দ্রনাথ ঠাকুররবীন্দ্রনাথ ঠাকুররবীন্দ্রনাথ ঠাকুররবীন্দ্রনাথ ঠাকুররবীন্দ্রনাথ ঠাকুররবীন্দ্রনাথ ঠাকুররবীন্দ্রনাথ ঠাকুররবীন্দ্রনাথ ঠাকুররবীন্দ্রনাথ ঠাকুররবীন্দ্রনাথ ঠাকুররবীন্দ্রনাথ ঠাকুররবীন্দ্রনাথ ঠাকুররবীন্দ্রনাথ ঠাকুররবীন্দ্রনাথ ঠাকুররবীন্দ্রনাথ ঠাকুররবীন্দ্রনাথ ঠাকুররবীন্দ্রনাথ ঠাকুররবীন্দ্রনাথ ঠাকুররবীন্দ্রনাথ ঠাকুররবীন্দ্রনাথ ঠাকুররবীন্দ্রনাথ ঠাকুররবীন্দ্রনাথ ঠাকুররবীন্দ্রনাথ ঠাকুররবীন্দ্রনাথ ঠাকুররবীন্দ্রনাথ ঠাকুররবীন্দ্রনাথ ঠাকুররবীন্দ্রনাথ ঠাকুররবীন্দ্রনাথ ঠাকুররবীন্দ্রনাথ ঠাকুররবীন্দ্রনাথ ঠাকুররবীন্দ্রনাথ ঠাকুররবীন্দ্রনাথ ঠাকুররবীন্দ্রনাথ ঠাকুররবীন্দ্রনাথ ঠাকুররবীন্দ্রনাথ ঠাকুররবীন্দ্রনাথ ঠাকুররবীন্দ্রনাথ ঠাকুররবীন্দ্রনাথ ঠাকুররবীন্দ্রনাথ ঠাকুররবীন্দ্রনাথ ঠাকুররবীন্দ্রনাথ ঠাকুররবীন্দ্রনাথ ঠাকুররবীন্দ্রনাথ ঠাকুররবীন্দ্রনাথ ঠাকুররবীন্দ্রনাথ ঠাকুররবীন্দ্রনাথ ঠাকুররবীন্দ্রনাথ ঠাকুররবীন্দ্রনাথ ঠাকুররবীন্দ্রনাথ ঠাকুররবীন্দ্রনাথ ঠাকুররবীন্দ্রনাথ ঠাকুররবীন্দ্রনাথ ঠাকুররবীন্দ্রনাথ ঠাকুররবীন্দ্রনাথ ঠাকুররবীন্দ্রনাথ ঠাকুররবীন্দ্রনাথ ঠাকুররবীন্দ্রনাথ ঠাকুররবীন্দ্রনাথ ঠাকুররবীন্দ্রনাথ ঠাকুররবীন্দ্রনাথ ঠাকুররবীন্দ্রনাথ ঠাকুররবীন্দ্রনাথ ঠাকুররবীন্দ্রনাথ ঠাকুররবীন্দ্রনাথ ঠাকুররবীন্দ্রনাথ ঠাকুররবীন্দ্রনাথ ঠাকুররবীন্দ্রনাথ ঠাকুররবীন্দ্রনাথ ঠাকুররবীন্দ্রনাথ ঠাকুররবীন্দ্রনাথ ঠাকুররবীন্দ্রনাথ ঠাকুররবীন্দ্রনাথ ঠাকুররবীন্দ্রনাথ ঠাকুররবীন্দ্রনাথ ঠাকুররবীন্দ্রনাথ ঠাকুররবীন্দ্রনাথ ঠাকুররবীন্দ্রনাথ ঠাকুররবীন্দ্রনাথ ঠাকুররবীন্দ্রনাথ ঠাকুররবীন্দ্রনাথ ঠাকুররবীন্দ্রনাথ ঠাকুররবীন্দ্রনাথ ঠাকুররবীন্দ্রনাথ ঠাকুররবীন্দ্রনাথ ঠাকুররবীন্দ্রনাথ ঠাকুররবীন্দ্রনাথ ঠাকুররবীন্দ্রনাথ ঠাকুররবীন্দ্রনাথ ঠাকুররবীন্দ্রনাথ ঠাকুররবীন্দ্রনাথ ঠাকুররবীন্দ্রনাথ ঠাকুররবীন্দ্রনাথ ঠাকুররবীন্দ্রনাথ ঠাকুররবীন্দ্রনাথ ঠাকুররবীন্দ্রনাথ ঠাকুররবীন্দ্রনাথ ঠাকুররবীন্দ্রনাথ ঠাকুররবীন্দ্রনাথ ঠাকুররবীন্দ্রনাথ ঠাকুররবীন্দ্রনাথ ঠাকুররবীন্দ্রনাথ ঠাকুররবীন্দ্রনাথ ঠাকুররবীন্দ্রনাথ ঠাকুররবীন্দ্রনাথ ঠাকুররবীন্দ্রনাথ ঠাকুররবীন্দ্রনাথ ঠাকুররবীন্দ্রনাথ ঠাকুররবীন্দ্রনাথ ঠাকুররবীন্দ্রনাথ ঠাকুররবীন্দ্রনাথ ঠাকুররবীন্দ্রনাথ ঠাকুররবীন্দ্রনাথ ঠাকুররবীন্দ্রনাথ ঠাকুররবীন্দ্রনাথ ঠাকুররবীন্দ্রনাথ ঠাকুররবীন্দ্রনাথ ঠাকুররবীন্দ্রনাথ ঠাকুররবীন্দ্রনাথ ঠাকুররবীন্দ্রনাথ ঠাকুররবীন্দ্রনাথ ঠাকুররবীন্দ্রনাথ ঠাকুররবীন্দ্রনাথ ঠাকুররবীন্দ্রনাথ ঠাকুররবীন্দ্রনাথ ঠাকুররবীন্দ্রনাথ ঠাকুররবীন্দ্রনাথ ঠাকুররবীন্দ্রনাথ ঠাকুররবীন্দ্রনাথ ঠাকুররবীন্দ্রনাথ ঠাকুররবীন্দ্রনাথ ঠাকুররবীন্দ্রনাথ ঠাকুররবীন্দ্রনাথ ঠাকুররবীন্দ্রনাথ ঠাকুররবীন্দ্রনাথ ঠাকুররবীন্দ্রনাথ ঠাকুররবীন্দ্রনাথ ঠাকুররবীন্দ্রনাথ ঠাকুররবীন্দ্রনাথ ঠাকুররবীন্দ্রনাথ ঠাকুররবীন্দ্রনাথ ঠাকুররবীন্দ্রনাথ ঠাকুররবীন্দ্রনাথ ঠাকুররবীন্দ্রনাথ ঠাকুররবীন্দ্রনাথ ঠাকুররবীন্দ্রনাথ ঠাকুররবীন্দ্রনাথ ঠাকুররবীন্দ্রনাথ ঠাকুররবীন্দ্রনাথ ঠাকুররবীন্দ্রনাথ ঠাকুররবীন্দ্রনাথ ঠাকুররবীন্দ্রনাথ ঠাকুররবীন্দ্রনাথ ঠাকুররবীন্দ্রনাথ ঠাকুররবীন্দ্রনাথ ঠাকুররবীন্দ্রনাথ ঠাকুররবীন্দ্রনাথ ঠাকুররবীন্দ্রনাথ ঠাকুররবীন্দ্রনাথ ঠাকুররবীন্দ্রনাথ ঠাকুররবীন্দ্রনাথ ঠাকুররবীন্দ্রনাথ ঠাকুররবীন্দ্রনাথ ঠাকুররবীন্দ্রনাথ ঠাকুররবীন্দ্রনাথ ঠাকুররবীন্দ্রনাথ ঠাকুররবীন্দ্রনাথ ঠাকুররবীন্দ্রনাথ ঠাকুররবীন্দ্রনাথ ঠাকুররবীন্দ্রনাথ ঠাকুররবীন্দ্রনাথ ঠাকুররবীন্দ্রনাথ ঠাকুররবীন্দ্রনাথ ঠাকুররবীন্দ্রনাথ ঠাকুররবীন্দ্রনাথ ঠাকুররবীন্দ্রনাথ ঠাকুররবীন্দ্রনাথ ঠাকুররবীন্দ্রনাথ ঠাকুররবীন্দ্রনাথ ঠাকুররবীন্দ্রনাথ ঠাকুররবীন্দ্রনাথ ঠাকুররবীন্দ্রনাথ ঠাকুররবীন্দ্রনাথ ঠাকুররবীন্দ্রনাথ ঠাকুররবীন্দ্রনাথ ঠাকুররবীন্দ্রনাথ ঠাকুররবীন্দ্রনাথ ঠাকুররবীন্দ্রনাথ ঠাকুররবীন্দ্রনাথ ঠাকুররবীন্দ্রনাথ ঠাকুররবীন্দ্রনাথ ঠাকুররবীন্দ্রনাথ ঠাকুররবীন্দ্রনাথ ঠাকুররবীন্দ্রনাথ ঠাকুররবীন্দ্রনাথ ঠাকুররবীন্দ্রনাথ ঠাকুররবীন্দ্রনাথ ঠাকুররবীন্দ্রনাথ ঠাকুররবীন্দ্রনাথ ঠাকুররবীন্দ্রনাথ ঠাকুররবীন্দ্রনাথ ঠাকুররবীন্দ্রনাথ ঠাকুররবীন্দ্রনাথ ঠাকুররবীন্দ্রনাথ ঠাকুররবীন্দ্রনাথ ঠাকুররবীন্দ্রনাথ ঠাকুররবীন্দ্রনাথ ঠাকুররবীন্দ্রনাথ ঠাকুররবীন্দ্রনাথ ঠাকুররবীন্দ্রনাথ ঠাকুররবীন্দ্রনাথ ঠাকুররবীন্দ্রনাথ ঠাকুররবীন্দ্রনাথ ঠাকুররবীন্দ্রনাথ ঠাকুররবীন্দ্রনাথ ঠাকুররবীন্দ্রনাথ ঠাকুররবীন্দ্রনাথ ঠাকুররবীন্দ্রনাথ ঠাকুররবীন্দ্রনাথ ঠাকুররবীন্দ্রনাথ ঠাকুররবীন্দ্রনাথ ঠাকুররবীন্দ্রনাথ ঠাকুররবীন্দ্রনাথ ঠাকুররবীন্দ্রনাথ ঠাকুররবীন্দ্রনাথ ঠাকুররবীন্দ্রনাথ ঠাকুররবীন্দ্রনাথ ঠাকুররবীন্দ্রনাথ ঠাকুররবীন্দ্রনাথ ঠাকুররবীন্দ্রনাথ ঠাকুররবীন্দ্রনাথ ঠাকুররবীন্দ্রনাথ ঠাকুররবীন্দ্রনাথ ঠাকুররবীন্দ্রনাথ ঠাকুররবীন্দ্রনাথ ঠাকুররবীন্দ্রনাথ ঠাকুররবীন্দ্রনাথ ঠাকুররবীন্দ্রনাথ ঠাকুররবীন্দ্রনাথ ঠাকুররবীন্দ্রনাথ ঠাকুররবীন্দ্রনাথ ঠাকুররবীন্দ্রনাথ ঠাকুররবীন্দ্রনাথ ঠাকুররবীন্দ্রনাথ ঠাকুররবীন্দ্রনাথ ঠাকুররবীন্দ্রনাথ ঠাকুররবীন্দ্রনাথ ঠাকুররবীন্দ্রনাথ ঠাকুররবীন্দ্রনাথ ঠাকুররবীন্দ্রনাথ ঠাকুররবীন্দ্রনাথ ঠাকুররবীন্দ্রনাথ ঠাকুররবীন্দ্রনাথ ঠাকুররবীন্দ্রনাথ ঠাকুররবীন্দ্রনাথ ঠাকুররবীন্দ্রনাথ ঠাকুররবীন্দ্রনাথ ঠাকুররবীন্দ্রনাথ ঠাকুররবীন্দ্রনাথ ঠাকুররবীন্দ্রনাথ ঠাকুররবীন্দ্রনাথ ঠাকুররবীন্দ্রনাথ ঠাকুররবীন্দ্রনাথ ঠাকুররবীন্দ্রনাথ ঠাকুররবীন্দ্রনাথ ঠাকুররবীন্দ্রনাথ ঠাকুররবীন্দ্রনাথ ঠাকুররবীন্দ্রনাথ ঠাকুররবীন্দ্রনাথ ঠাকুররবীন্দ্রনাথ ঠাকুররবীন্দ্রনাথ ঠাকুররবীন্দ্রনাথ ঠাকুররবীন্দ্রনাথ ঠাকুররবীন্দ্রনাথ ঠাকুররবীন্দ্রনাথ ঠাকুররবীন্দ্রনাথ ঠাকুররবীন্দ্রনাথ ঠাকুররবীন্দ্রনাথ ঠাকুররবীন্দ্রনাথ ঠাকুররবীন্দ্রনাথ ঠাকুররবীন্দ্রনাথ ঠাকুররবীন্দ্রনাথ ঠাকুররবীন্দ্রনাথ ঠাকুররবীন্দ্রনাথ ঠাকুররবীন্দ্রনাথ ঠাকুররবীন্দ্রনাথ ঠাকুররবীন্দ্রনাথ ঠাকুররবীন্দ্রনাথ ঠাকুররবীন্দ্রনাথ ঠাকুররবীন্দ্রনাথ ঠাকুররবীন্দ্রনাথ ঠাকুররবীন্দ্রনাথ ঠাকুররবীন্দ্রনাথ ঠাকুররবীন্দ্রনাথ ঠাকুররবীন্দ্রনাথ ঠাকুররবীন্দ্রনাথ ঠাকুররবীন্দ্রনাথ ঠাকুররবীন্দ্রনাথ ঠাকুররবীন্দ্রনাথ ঠাকুররবীন্দ্রনাথ ঠাকুররবীন্দ্রনাথ ঠাকুররবীন্দ্রনাথ ঠাকুররবীন্দ্রনাথ ঠাকুররবীন্দ্রনাথ ঠাকুররবীন্দ্রনাথ ঠাকুররবীন্দ্রনাথ ঠাকুররবীন্দ্রনাথ ঠাকুররবীন্দ্রনাথ ঠাকুররবীন্দ্রনাথ ঠাকুররবীন্দ্রনাথ ঠাকুররবীন্দ্রনাথ ঠাকুররবীন্দ্রনাথ ঠাকুররবীন্দ্রনাথ ঠাকুররবীন্দ্রনাথ ঠাকুররবীন্দ্রনাথ ঠাকুররবীন্দ্রনাথ ঠাকুররবীন্দ্রনাথ ঠাকুররবীন্দ্রনাথ ঠাকুররবীন্দ্রনাথ ঠাকুররবীন্দ্রনাথ ঠাকুররবীন্দ্রনাথ ঠাকুররবীন্দ্রনাথ ঠাকুররবীন্দ্রনাথ ঠাকুররবীন্দ্রনাথ ঠাকুররবীন্দ্রনাথ ঠাকুররবীন্দ্রনাথ ঠাকুররবীন্দ্রনাথ ঠাকুররবীন্দ্রনাথ ঠাকুররবীন্দ্রনাথ ঠাকুররবীন্দ্রনাথ ঠাকুররবীন্দ্রনাথ ঠাকুররবীন্দ্রনাথ ঠাকুররবীন্দ্রনাথ ঠাকুররবীন্দ্রনাথ ঠাকুররবীন্দ্রনাথ ঠাকুররবীন্দ্রনাথ ঠাকুররবীন্দ্রনাথ ঠাকুররবীন্দ্রনাথ ঠাকুররবীন্দ্রনাথ ঠাকুররবীন্দ্রনাথ ঠাকুররবীন্দ্রনাথ ঠাকুররবীন্দ্রনাথ ঠাকুররবীন্দ্রনাথ ঠাকুররবীন্দ্রনাথ ঠাকুররবীন্দ্রনাথ ঠাকুররবীন্দ্রনাথ ঠাকুররবীন্দ্রনাথ ঠাকুররবীন্দ্রনাথ ঠাকুররবীন্দ্রনাথ ঠাকুররবীন্দ্রনাথ ঠাকুররবীন্দ্রনাথ ঠাকুররবীন্দ্রনাথ ঠাকুররবীন্দ্রনাথ ঠাকুররবীন্দ্রনাথ ঠাকুররবীন্দ্রনাথ ঠাকুররবীন্দ্রনাথ ঠাকুররবীন্দ্রনাথ ঠাকুররবীন্দ্রনাথ ঠাকুররবীন্দ্রনাথ ঠাকুররবীন্দ্রনাথ ঠাকুররবীন্দ্রনাথ ঠাকুররবীন্দ্রনাথ ঠাকুররবীন্দ্রনাথ ঠাকুররবীন্দ্রনাথ ঠাকুররবীন্দ্রনাথ ঠাকুররবীন্দ্রনাথ ঠাকুররবীন্দ্রনাথ ঠাকুররবীন্দ্রনাথ ঠাকুররবীন্দ্রনাথ ঠাকুররবীন্দ্রনাথ ঠাকুররবীন্দ্রনাথ ঠাকুররবীন্দ্রনাথ ঠাকুররবীন্দ্রনাথ ঠাকুররবীন্দ্রনাথ ঠাকুররবীন্দ্রনাথ ঠাকুররবীন্দ্রনাথ ঠাকুররবীন্দ্রনাথ ঠাকুররবীন্দ্রনাথ ঠাকুররবীন্দ্রনাথ ঠাকুররবীন্দ্রনাথ ঠাকুররবীন্দ্রনাথ ঠাকুররবীন্দ্রনাথ ঠাকুররবীন্দ্রনাথ ঠাকুররবীন্দ্রনাথ ঠাকুররবীন্দ্রনাথ ঠাকুররবীন্দ্রনাথ ঠাকুররবীন্দ্রনাথ ঠাকুররবীন্দ্রনাথ ঠাকুররবীন্দ্রনাথ ঠাকুররবীন্দ্রনাথ ঠাকুররবীন্দ্রনাথ ঠাকুররবীন্দ্রনাথ ঠাকুররবীন্দ্রনাথ ঠাকুররবীন্দ্রনাথ ঠাকুররবীন্দ্রনাথ ঠাকুররবীন্দ্রনাথ ঠাকুররবীন্দ্রনাথ ঠাকুররবীন্দ্রনাথ ঠাকুররবীন্দ্রনাথ ঠাকুর	0	
SELECT length(c1),c1, length(c2),c2 FROM t8 WHERE c1  LIKE _utf8 'রবীন%' COLLATE utf8_general_ci OR c2 LIKE _utf8 'जग' COLLATE utf8_general_ci;
length(c1)	c1	length(c2)	c2
49	রবীন্দ্রনাথ ঠাকুর	NULL	NULL
63700	রবীন্দ্রনাথ ঠাকুররবীন্দ্রনাথ ঠাকুররবীন্দ্রনাথ ঠাকুররবীন্দ্রনাথ ঠাকুররবীন্দ্রনাথ ঠাকুররবীন্দ্রনাথ ঠাকুররবীন্দ্রনাথ ঠাকুররবীন্দ্রনাথ ঠাকুররবীন্দ্রনাথ ঠাকুররবীন্দ্রনাথ ঠাকুররবীন্দ্রনাথ ঠাকুররবীন্দ্রনাথ ঠাকুররবীন্দ্রনাথ ঠাকুররবীন্দ্রনাথ ঠাকুররবীন্দ্রনাথ ঠাকুররবীন্দ্রনাথ ঠাকুররবীন্দ্রনাথ ঠাকুররবীন্দ্রনাথ ঠাকুররবীন্দ্রনাথ ঠাকুররবীন্দ্রনাথ ঠাকুররবীন্দ্রনাথ ঠাকুররবীন্দ্রনাথ ঠাকুররবীন্দ্রনাথ ঠাকুররবীন্দ্রনাথ ঠাকুররবীন্দ্রনাথ ঠাকুররবীন্দ্রনাথ ঠাকুররবীন্দ্রনাথ ঠাকুররবীন্দ্রনাথ ঠাকুররবীন্দ্রনাথ ঠাকুররবীন্দ্রনাথ ঠাকুররবীন্দ্রনাথ ঠাকুররবীন্দ্রনাথ ঠাকুররবীন্দ্রনাথ ঠাকুররবীন্দ্রনাথ ঠাকুররবীন্দ্রনাথ ঠাকুররবীন্দ্রনাথ ঠাকুররবীন্দ্রনাথ ঠাকুররবীন্দ্রনাথ ঠাকুররবীন্দ্রনাথ ঠাকুররবীন্দ্রনাথ ঠাকুররবীন্দ্রনাথ ঠাকুররবীন্দ্রনাথ ঠাকুররবীন্দ্রনাথ ঠাকুররবীন্দ্রনাথ ঠাকুররবীন্দ্রনাথ ঠাকুররবীন্দ্রনাথ ঠাকুররবীন্দ্রনাথ ঠাকুররবীন্দ্রনাথ ঠাকুররবীন্দ্রনাথ ঠাকুররবীন্দ্রনাথ ঠাকুররবীন্দ্রনাথ ঠাকুররবীন্দ্রনাথ ঠাকুররবীন্দ্রনাথ ঠাকুররবীন্দ্রনাথ ঠাকুররবীন্দ্রনাথ ঠাকুররবীন্দ্রনাথ ঠাকুররবীন্দ্রনাথ ঠাকুররবীন্দ্রনাথ ঠাকুররবীন্দ্রনাথ ঠাকুররবীন্দ্রনাথ ঠাকুররবীন্দ্রনাথ ঠাকুররবীন্দ্রনাথ ঠাকুররবীন্দ্রনাথ ঠাকুররবীন্দ্রনাথ ঠাকুররবীন্দ্রনাথ ঠাকুররবীন্দ্রনাথ ঠাকুররবীন্দ্রনাথ ঠাকুররবীন্দ্রনাথ ঠাকুররবীন্দ্রনাথ ঠাকুররবীন্দ্রনাথ ঠাকুররবীন্দ্রনাথ ঠাকুররবীন্দ্রনাথ ঠাকুররবীন্দ্রনাথ ঠাকুররবীন্দ্রনাথ ঠাকুররবীন্দ্রনাথ ঠাকুররবীন্দ্রনাথ ঠাকুররবীন্দ্রনাথ ঠাকুররবীন্দ্রনাথ ঠাকুররবীন্দ্রনাথ ঠাকুররবীন্দ্রনাথ ঠাকুররবীন্দ্রনাথ ঠাকুররবীন্দ্রনাথ ঠাকুররবীন্দ্রনাথ ঠাকুররবীন্দ্রনাথ ঠাকুররবীন্দ্রনাথ ঠাকুররবীন্দ্রনাথ ঠাকুররবীন্দ্রনাথ ঠাকুররবীন্দ্রনাথ ঠাকুররবীন্দ্রনাথ ঠাকুররবীন্দ্রনাথ ঠাকুররবীন্দ্রনাথ ঠাকুররবীন্দ্রনাথ ঠাকুররবীন্দ্রনাথ ঠাকুররবীন্দ্রনাথ ঠাকুররবীন্দ্রনাথ ঠাকুররবীন্দ্রনাথ ঠাকুররবীন্দ্রনাথ ঠাকুররবীন্দ্রনাথ ঠাকুররবীন্দ্রনাথ ঠাকুররবীন্দ্রনাথ ঠাকুররবীন্দ্রনাথ ঠাকুররবীন্দ্রনাথ ঠাকুররবীন্দ্রনাথ ঠাকুররবীন্দ্রনাথ ঠাকুররবীন্দ্রনাথ ঠাকুররবীন্দ্রনাথ ঠাকুররবীন্দ্রনাথ ঠাকুররবীন্দ্রনাথ ঠাকুররবীন্দ্রনাথ ঠাকুররবীন্দ্রনাথ ঠাকুররবীন্দ্রনাথ ঠাকুররবীন্দ্রনাথ ঠাকুররবীন্দ্রনাথ ঠাকুররবীন্দ্রনাথ ঠাকুররবীন্দ্রনাথ ঠাকুররবীন্দ্রনাথ ঠাকুররবীন্দ্রনাথ ঠাকুররবীন্দ্রনাথ ঠাকুররবীন্দ্রনাথ ঠাকুররবীন্দ্রনাথ ঠাকুররবীন্দ্রনাথ ঠাকুররবীন্দ্রনাথ ঠাকুররবীন্দ্রনাথ ঠাকুররবীন্দ্রনাথ ঠাকুররবীন্দ্রনাথ ঠাকুররবীন্দ্রনাথ ঠাকুররবীন্দ্রনাথ ঠাকুররবীন্দ্রনাথ ঠাকুররবীন্দ্রনাথ ঠাকুররবীন্দ্রনাথ ঠাকুররবীন্দ্রনাথ ঠাকুররবীন্দ্রনাথ ঠাকুররবীন্দ্রনাথ ঠাকুররবীন্দ্রনাথ ঠাকুররবীন্দ্রনাথ ঠাকুররবীন্দ্রনাথ ঠাকুররবীন্দ্রনাথ ঠাকুররবীন্দ্রনাথ ঠাকুররবীন্দ্রনাথ ঠাকুররবীন্দ্রনাথ ঠাকুররবীন্দ্রনাথ ঠাকুররবীন্দ্রনাথ ঠাকুররবীন্দ্রনাথ ঠাকুররবীন্দ্রনাথ ঠাকুররবীন্দ্রনাথ ঠাকুররবীন্দ্রনাথ ঠাকুররবীন্দ্রনাথ ঠাকুররবীন্দ্রনাথ ঠাকুররবীন্দ্রনাথ ঠাকুররবীন্দ্রনাথ ঠাকুররবীন্দ্রনাথ ঠাকুররবীন্দ্রনাথ ঠাকুররবীন্দ্রনাথ ঠাকুররবীন্দ্রনাথ ঠাকুররবীন্দ্রনাথ ঠাকুররবীন্দ্রনাথ ঠাকুররবীন্দ্রনাথ ঠাকুররবীন্দ্রনাথ ঠাকুররবীন্দ্রনাথ ঠাকুররবীন্দ্রনাথ ঠাকুররবীন্দ্রনাথ ঠাকুররবীন্দ্রনাথ ঠাকুররবীন্দ্রনাথ ঠাকুররবীন্দ্রনাথ ঠাকুররবীন্দ্রনাথ ঠাকুররবীন্দ্রনাথ ঠাকুররবীন্দ্রনাথ ঠাকুররবীন্দ্রনাথ ঠাকুররবীন্দ্রনাথ ঠাকুররবীন্দ্রনাথ ঠাকুররবীন্দ্রনাথ ঠাকুররবীন্দ্রনাথ ঠাকুররবীন্দ্রনাথ ঠাকুররবীন্দ্রনাথ ঠাকুররবীন্দ্রনাথ ঠাকুররবীন্দ্রনাথ ঠাকুররবীন্দ্রনাথ ঠাকুররবীন্দ্রনাথ ঠাকুররবীন্দ্রনাথ ঠাকুররবীন্দ্রনাথ ঠাকুররবীন্দ্রনাথ ঠাকুররবীন্দ্রনাথ ঠাকুররবীন্দ্রনাথ ঠাকুররবীন্দ্রনাথ ঠাকুররবীন্দ্রনাথ ঠাকুররবীন্দ্রনাথ ঠাকুররবীন্দ্রনাথ ঠাকুররবীন্দ্রনাথ ঠাকুররবীন্দ্রনাথ ঠাকুররবীন্দ্রনাথ ঠাকুররবীন্দ্রনাথ ঠাকুররবীন্দ্রনাথ ঠাকুররবীন্দ্রনাথ ঠাকুররবীন্দ্রনাথ ঠাকুররবীন্দ্রনাথ ঠাকুররবীন্দ্রনাথ ঠাকুররবীন্দ্রনাথ ঠাকুররবীন্দ্রনাথ ঠাকুররবীন্দ্রনাথ ঠাকুররবীন্দ্রনাথ ঠাকুররবীন্দ্রনাথ ঠাকুররবীন্দ্রনাথ ঠাকুররবীন্দ্রনাথ ঠাকুররবীন্দ্রনাথ ঠাকুররবীন্দ্রনাথ ঠাকুররবীন্দ্রনাথ ঠাকুররবীন্দ্রনাথ ঠাকুররবীন্দ্রনাথ ঠাকুররবীন্দ্রনাথ ঠাকুররবীন্দ্রনাথ ঠাকুররবীন্দ্রনাথ ঠাকুররবীন্দ্রনাথ ঠাকুররবীন্দ্রনাথ ঠাকুররবীন্দ্রনাথ ঠাকুররবীন্দ্রনাথ ঠাকুররবীন্দ্রনাথ ঠাকুররবীন্দ্রনাথ ঠাকুররবীন্দ্রনাথ ঠাকুররবীন্দ্রনাথ ঠাকুররবীন্দ্রনাথ ঠাকুররবীন্দ্রনাথ ঠাকুররবীন্দ্রনাথ ঠাকুররবীন্দ্রনাথ ঠাকুররবীন্দ্রনাথ ঠাকুররবীন্দ্রনাথ ঠাকুররবীন্দ্রনাথ ঠাকুররবীন্দ্রনাথ ঠাকুররবীন্দ্রনাথ ঠাকুররবীন্দ্রনাথ ঠাকুররবীন্দ্রনাথ ঠাকুররবীন্দ্রনাথ ঠাকুররবীন্দ্রনাথ ঠাকুররবীন্দ্রনাথ ঠাকুররবীন্দ্রনাথ ঠাকুররবীন্দ্রনাথ ঠাকুররবীন্দ্রনাথ ঠাকুররবীন্দ্রনাথ ঠাকুররবীন্দ্রনাথ ঠাকুররবীন্দ্রনাথ ঠাকুররবীন্দ্রনাথ ঠাকুররবীন্দ্রনাথ ঠাকুররবীন্দ্রনাথ ঠাকুররবীন্দ্রনাথ ঠাকুররবীন্দ্রনাথ ঠাকুররবীন্দ্রনাথ ঠাকুররবীন্দ্রনাথ ঠাকুররবীন্দ্রনাথ ঠাকুররবীন্দ্রনাথ ঠাকুররবীন্দ্রনাথ ঠাকুররবীন্দ্রনাথ ঠাকুররবীন্দ্রনাথ ঠাকুররবীন্দ্রনাথ ঠাকুররবীন্দ্রনাথ ঠাকুররবীন্দ্রনাথ ঠাকুররবীন্দ্রনাথ ঠাকুররবীন্দ্রনাথ ঠাকুররবীন্দ্রনাথ ঠাকুররবীন্দ্রনাথ ঠাকুররবীন্দ্রনাথ ঠাকুররবীন্দ্রনাথ ঠাকুররবীন্দ্রনাথ ঠাকুররবীন্দ্রনাথ ঠাকুররবীন্দ্রনাথ ঠাকুররবীন্দ্রনাথ ঠাকুররবীন্দ্রনাথ ঠাকুররবীন্দ্রনাথ ঠাকুররবীন্দ্রনাথ ঠাকুররবীন্দ্রনাথ ঠাকুররবীন্দ্রনাথ ঠাকুররবীন্দ্রনাথ ঠাকুররবীন্দ্রনাথ ঠাকুররবীন্দ্রনাথ ঠাকুররবীন্দ্রনাথ ঠাকুররবীন্দ্রনাথ ঠাকুররবীন্দ্রনাথ ঠাকুররবীন্দ্রনাথ ঠাকুররবীন্দ্রনাথ ঠাকুররবীন্দ্রনাথ ঠাকুররবীন্দ্রনাথ ঠাকুররবীন্দ্রনাথ ঠাকুররবীন্দ্রনাথ ঠাকুররবীন্দ্রনাথ ঠাকুররবীন্দ্রনাথ ঠাকুররবীন্দ্রনাথ ঠাকুররবীন্দ্রনাথ ঠাকুররবীন্দ্রনাথ ঠাকুররবীন্দ্রনাথ ঠাকুররবীন্দ্রনাথ ঠাকুররবীন্দ্রনাথ ঠাকুররবীন্দ্রনাথ ঠাকুররবীন্দ্রনাথ ঠাকুররবীন্দ্রনাথ ঠাকুররবীন্দ্রনাথ ঠাকুররবীন্দ্রনাথ ঠাকুররবীন্দ্রনাথ ঠাকুররবীন্দ্রনাথ ঠাকুররবীন্দ্রনাথ ঠাকুররবীন্দ্রনাথ ঠাকুররবীন্দ্রনাথ ঠাকুররবীন্দ্রনাথ ঠাকুররবীন্দ্রনাথ ঠাকুররবীন্দ্রনাথ ঠাকুররবীন্দ্রনাথ ঠাকুররবীন্দ্রনাথ ঠাকুররবীন্দ্রনাথ ঠাকুররবীন্দ্রনাথ ঠাকুররবীন্দ্রনাথ ঠাকুররবীন্দ্রনাথ ঠাকুররবীন্দ্রনাথ ঠাকুররবীন্দ্রনাথ ঠাকুররবীন্দ্রনাথ ঠাকুররবীন্দ্রনাথ ঠাকুররবীন্দ্রনাথ ঠাকুররবীন্দ্রনাথ ঠাকুররবীন্দ্রনাথ ঠাকুররবীন্দ্রনাথ ঠাকুররবীন্দ্রনাথ ঠাকুররবীন্দ্রনাথ ঠাকুররবীন্দ্রনাথ ঠাকুররবীন্দ্রনাথ ঠাকুররবীন্দ্রনাথ ঠাকুররবীন্দ্রনাথ ঠাকুররবীন্দ্রনাথ ঠাকুররবীন্দ্রনাথ ঠাকুররবীন্দ্রনাথ ঠাকুররবীন্দ্রনাথ ঠাকুররবীন্দ্রনাথ ঠাকুররবীন্দ্রনাথ ঠাকুররবীন্দ্রনাথ ঠাকুররবীন্দ্রনাথ ঠাকুররবীন্দ্রনাথ ঠাকুররবীন্দ্রনাথ ঠাকুররবীন্দ্রনাথ ঠাকুররবীন্দ্রনাথ ঠাকুররবীন্দ্রনাথ ঠাকুররবীন্দ্রনাথ ঠাকুররবীন্দ্রনাথ ঠাকুররবীন্দ্রনাথ ঠাকুররবীন্দ্রনাথ ঠাকুররবীন্দ্রনাথ ঠাকুররবীন্দ্রনাথ ঠাকুররবীন্দ্রনাথ ঠাকুররবীন্দ্রনাথ ঠাকুররবীন্দ্রনাথ ঠাকুররবীন্দ্রনাথ ঠাকুররবীন্দ্রনাথ ঠাকুররবীন্দ্রনাথ ঠাকুররবীন্দ্রনাথ ঠাকুররবীন্দ্রনাথ ঠাকুররবীন্দ্রনাথ ঠাকুররবীন্দ্রনাথ ঠাকুররবীন্দ্রনাথ ঠাকুররবীন্দ্রনাথ ঠাকুররবীন্দ্রনাথ ঠাকুররবীন্দ্রনাথ ঠাকুররবীন্দ্রনাথ ঠাকুররবীন্দ্রনাথ ঠাকুররবীন্দ্রনাথ ঠাকুররবীন্দ্রনাথ ঠাকুররবীন্দ্রনাথ ঠাকুররবীন্দ্রনাথ ঠাকুররবীন্দ্রনাথ ঠাকুররবীন্দ্রনাথ ঠাকুররবীন্দ্রনাথ ঠাকুররবীন্দ্রনাথ ঠাকুররবীন্দ্রনাথ ঠাকুররবীন্দ্রনাথ ঠাকুররবীন্দ্রনাথ ঠাকুররবীন্দ্রনাথ ঠাকুররবীন্দ্রনাথ ঠাকুররবীন্দ্রনাথ ঠাকুররবীন্দ্রনাথ ঠাকুররবীন্দ্রনাথ ঠাকুররবীন্দ্রনাথ ঠাকুররবীন্দ্রনাথ ঠাকুররবীন্দ্রনাথ ঠাকুররবীন্দ্রনাথ ঠাকুররবীন্দ্রনাথ ঠাকুররবীন্দ্রনাথ ঠাকুররবীন্দ্রনাথ ঠাকুররবীন্দ্রনাথ ঠাকুররবীন্দ্রনাথ ঠাকুররবীন্দ্রনাথ ঠাকুররবীন্দ্রনাথ ঠাকুররবীন্দ্রনাথ ঠাকুররবীন্দ্রনাথ ঠাকুররবীন্দ্রনাথ ঠাকুররবীন্দ্রনাথ ঠাকুররবীন্দ্রনাথ ঠাকুররবীন্দ্রনাথ ঠাকুররবীন্দ্রনাথ ঠাকুররবীন্দ্রনাথ ঠাকুররবীন্দ্রনাথ ঠাকুররবীন্দ্রনাথ ঠাকুররবীন্দ্রনাথ ঠাকুররবীন্দ্রনাথ ঠাকুররবীন্দ্রনাথ ঠাকুররবীন্দ্রনাথ ঠাকুররবীন্দ্রনাথ ঠাকুররবীন্দ্রনাথ ঠাকুররবীন্দ্রনাথ ঠাকুররবীন্দ্রনাথ ঠাকুররবীন্দ্রনাথ ঠাকুররবীন্দ্রনাথ ঠাকুররবীন্দ্রনাথ ঠাকুররবীন্দ্রনাথ ঠাকুররবীন্দ্রনাথ ঠাকুররবীন্দ্রনাথ ঠাকুররবীন্দ্রনাথ ঠাকুররবীন্দ্রনাথ ঠাকুররবীন্দ্রনাথ ঠাকুররবীন্দ্রনাথ ঠাকুররবীন্দ্রনাথ ঠাকুররবীন্দ্রনাথ ঠাকুররবীন্দ্রনাথ ঠাকুররবীন্দ্রনাথ ঠাকুররবীন্দ্রনাথ ঠাকুররবীন্দ্রনাথ ঠাকুররবীন্দ্রনাথ ঠাকুররবীন্দ্রনাথ ঠাকুররবীন্দ্রনাথ ঠাকুররবীন্দ্রনাথ ঠাকুররবীন্দ্রনাথ ঠাকুররবীন্দ্রনাথ ঠাকুররবীন্দ্রনাথ ঠাকুররবীন্দ্রনাথ ঠাকুররবীন্দ্রনাথ ঠাকুররবীন্দ্রনাথ ঠাকুররবীন্দ্রনাথ ঠাকুররবীন্দ্রনাথ ঠাকুররবীন্দ্রনাথ ঠাকুররবীন্দ্রনাথ ঠাকুররবীন্দ্রনাথ ঠাকুররবীন্দ্রনাথ ঠাকুররবীন্দ্রনাথ ঠাকুররবীন্দ্রনাথ ঠাকুররবীন্দ্রনাথ ঠাকুররবীন্দ্রনাথ ঠাকুররবীন্দ্রনাথ ঠাকুররবীন্দ্রনাথ ঠাকুররবীন্দ্রনাথ ঠাকুররবীন্দ্রনাথ ঠাকুররবীন্দ্রনাথ ঠাকুররবীন্দ্রনাথ ঠাকুররবীন্দ্রনাথ ঠাকুররবীন্দ্রনাথ ঠাকুররবীন্দ্রনাথ ঠাকুররবীন্দ্রনাথ ঠাকুররবীন্দ্রনাথ ঠাকুররবীন্দ্রনাথ ঠাকুররবীন্দ্রনাথ ঠাকুররবীন্দ্রনাথ ঠাকুররবীন্দ্রনাথ ঠাকুররবীন্দ্রনাথ ঠাকুররবীন্দ্রনাথ ঠাকুররবীন্দ্রনাথ ঠাকুররবীন্দ্রনাথ ঠাকুররবীন্দ্রনাথ ঠাকুররবীন্দ্রনাথ ঠাকুররবীন্দ্রনাথ ঠাকুররবীন্দ্রনাথ ঠাকুররবীন্দ্রনাথ ঠাকুররবীন্দ্রনাথ ঠাকুররবীন্দ্রনাথ ঠাকুররবীন্দ্রনাথ ঠাকুররবীন্দ্রনাথ ঠাকুররবীন্দ্রনাথ ঠাকুররবীন্দ্রনাথ ঠাকুররবীন্দ্রনাথ ঠাকুররবীন্দ্রনাথ ঠাকুররবীন্দ্রনাথ ঠাকুররবীন্দ্রনাথ ঠাকুররবীন্দ্রনাথ ঠাকুররবীন্দ্রনাথ ঠাকুররবীন্দ্রনাথ ঠাকুররবীন্দ্রনাথ ঠাকুররবীন্দ্রনাথ ঠাকুররবীন্দ্রনাথ ঠাকুররবীন্দ্রনাথ ঠাকুররবীন্দ্রনাথ ঠাকুররবীন্দ্রনাথ ঠাকুররবীন্দ্রনাথ ঠাকুররবীন্দ্রনাথ ঠাকুররবীন্দ্রনাথ ঠাকুররবীন্দ্রনাথ ঠাকুররবীন্দ্রনাথ ঠাকুররবীন্দ্রনাথ ঠাকুররবীন্দ্রনাথ ঠাকুররবীন্দ্রনাথ ঠাকুররবীন্দ্রনাথ ঠাকুররবীন্দ্রনাথ ঠাকুররবীন্দ্রনাথ ঠাকুররবীন্দ্রনাথ ঠাকুররবীন্দ্রনাথ ঠাকুররবীন্দ্রনাথ ঠাকুররবীন্দ্রনাথ ঠাকুররবীন্দ্রনাথ ঠাকুররবীন্দ্রনাথ ঠাকুররবীন্দ্রনাথ ঠাকুররবীন্দ্রনাথ ঠাকুররবীন্দ্রনাথ ঠাকুররবীন্দ্রনাথ ঠাকুররবীন্দ্রনাথ ঠাকুররবীন্দ্রনাথ ঠাকুররবীন্দ্রনাথ ঠাকুররবীন্দ্রনাথ ঠাকুররবীন্দ্রনাথ ঠাকুররবীন্দ্রনাথ ঠাকুররবীন্দ্রনাথ ঠাকুররবীন্দ্রনাথ ঠাকুররবীন্দ্রনাথ ঠাকুররবীন্দ্রনাথ ঠাকুররবীন্দ্রনাথ ঠাকুররবীন্দ্রনাথ ঠাকুররবীন্দ্রনাথ ঠাকুররবীন্দ্রনাথ ঠাকুররবীন্দ্রনাথ ঠাকুররবীন্দ্রনাথ ঠাকুররবীন্দ্রনাথ ঠাকুররবীন্দ্রনাথ ঠাকুররবীন্দ্রনাথ ঠাকুররবীন্দ্রনাথ ঠাকুররবীন্দ্রনাথ ঠাকুররবীন্দ্রনাথ ঠাকুররবীন্দ্রনাথ ঠাকুররবীন্দ্রনাথ ঠাকুররবীন্দ্রনাথ ঠাকুররবীন্দ্রনাথ ঠাকুররবীন্দ্রনাথ ঠাকুররবীন্দ্রনাথ ঠাকুররবীন্দ্রনাথ ঠাকুররবীন্দ্রনাথ ঠাকুররবীন্দ্রনাথ ঠাকুররবীন্দ্রনাথ ঠাকুররবীন্দ্রনাথ ঠাকুররবীন্দ্রনাথ ঠাকুররবীন্দ্রনাথ ঠাকুররবীন্দ্রনাথ ঠাকুররবীন্দ্রনাথ ঠাকুররবীন্দ্রনাথ ঠাকুররবীন্দ্রনাথ ঠাকুররবীন্দ্রনাথ ঠাকুররবীন্দ্রনাথ ঠাকুররবীন্দ্রনাথ ঠাকুররবীন্দ্রনাথ ঠাকুররবীন্দ্রনাথ ঠাকুররবীন্দ্রনাথ ঠাকুররবীন্দ্রনাথ ঠাকুররবীন্দ্রনাথ ঠাকুররবীন্দ্রনাথ ঠাকুররবীন্দ্রনাথ ঠাকুররবীন্দ্রনাথ ঠাকুররবীন্দ্রনাথ ঠাকুররবীন্দ্রনাথ ঠাকুররবীন্দ্রনাথ ঠাকুররবীন্দ্রনাথ ঠাকুররবীন্দ্রনাথ ঠাকুররবীন্দ্রনাথ ঠাকুররবীন্দ্রনাথ ঠাকুররবীন্দ্রনাথ ঠাকুররবীন্দ্রনাথ ঠাকুররবীন্দ্রনাথ ঠাকুররবীন্দ্রনাথ ঠাকুররবীন্দ্রনাথ ঠাকুররবীন্দ্রনাথ ঠাকুররবীন্দ্রনাথ ঠাকুররবীন্দ্রনাথ ঠাকুররবীন্দ্রনাথ ঠাকুররবীন্দ্রনাথ ঠাকুররবীন্দ্রনাথ ঠাকুররবীন্দ্রনাথ ঠাকুররবীন্দ্রনাথ ঠাকুররবীন্দ্রনাথ ঠাকুররবীন্দ্রনাথ ঠাকুররবীন্দ্রনাথ ঠাকুররবীন্দ্রনাথ ঠাকুররবীন্দ্রনাথ ঠাকুররবীন্দ্রনাথ ঠাকুররবীন্দ্রনাথ ঠাকুররবীন্দ্রনাথ ঠাকুররবীন্দ্রনাথ ঠাকুররবীন্দ্রনাথ ঠাকুররবীন্দ্রনাথ ঠাকুররবীন্দ্রনাথ ঠাকুররবীন্দ্রনাথ ঠাকুররবীন্দ্রনাথ ঠাকুররবীন্দ্রনাথ ঠাকুররবীন্দ্রনাথ ঠাকুররবীন্দ্রনাথ ঠাকুররবীন্দ্রনাথ ঠাকুররবীন্দ্রনাথ ঠাকুররবীন্দ্রনাথ ঠাকুররবীন্দ্রনাথ ঠাকুররবীন্দ্রনাথ ঠাকুররবীন্দ্রনাথ ঠাকুররবীন্দ্রনাথ ঠাকুররবীন্দ্রনাথ ঠাকুররবীন্দ্রনাথ ঠাকুররবীন্দ্রনাথ ঠাকুররবীন্দ্রনাথ ঠাকুররবীন্দ্রনাথ ঠাকুররবীন্দ্রনাথ ঠাকুররবীন্দ্রনাথ ঠাকুররবীন্দ্রনাথ ঠাকুররবীন্দ্রনাথ ঠাকুররবীন্দ্রনাথ ঠাকুররবীন্দ্রনাথ ঠাকুররবীন্দ্রনাথ ঠাকুররবীন্দ্রনাথ ঠাকুররবীন্দ্রনাথ ঠাকুররবীন্দ্রনাথ ঠাকুররবীন্দ্রনাথ ঠাকুররবীন্দ্রনাথ ঠাকুররবীন্দ্রনাথ ঠাকুররবীন্দ্রনাথ ঠাকুররবীন্দ্রনাথ ঠাকুররবীন্দ্রনাথ ঠাকুররবীন্দ্রনাথ ঠাকুররবীন্দ্রনাথ ঠাকুররবীন্দ্রনাথ ঠাকুররবীন্দ্রনাথ ঠাকুররবীন্দ্রনাথ ঠাকুররবীন্দ্রনাথ ঠাকুররবীন্দ্রনাথ ঠাকুররবীন্দ্রনাথ ঠাকুররবীন্দ্রনাথ ঠাকুররবীন্দ্রনাথ ঠাকুররবীন্দ্রনাথ ঠাকুররবীন্দ্রনাথ ঠাকুররবীন্দ্রনাথ ঠাকুররবীন্দ্রনাথ ঠাকুররবীন্দ্রনাথ ঠাকুররবীন্দ্রনাথ ঠাকুররবীন্দ্রনাথ ঠাকুররবীন্দ্রনাথ ঠাকুররবীন্দ্রনাথ ঠাকুররবীন্দ্রনাথ ঠাকুররবীন্দ্রনাথ ঠাকুররবীন্দ্রনাথ ঠাকুররবীন্দ্রনাথ ঠাকুররবীন্দ্রনাথ ঠাকুররবীন্দ্রনাথ ঠাকুররবীন্দ্রনাথ ঠাকুররবীন্দ্রনাথ ঠাকুররবীন্দ্রনাথ ঠাকুররবীন্দ্রনাথ ঠাকুররবীন্দ্রনাথ ঠাকুররবীন্দ্রনাথ ঠাকুররবীন্দ্রনাথ ঠাকুররবীন্দ্রনাথ ঠাকুররবীন্দ্রনাথ ঠাকুররবীন্দ্রনাথ ঠাকুররবীন্দ্রনাথ ঠাকুররবীন্দ্রনাথ ঠাকুররবীন্দ্রনাথ ঠাকুররবীন্দ্রনাথ ঠাকুররবীন্দ্রনাথ ঠাকুররবীন্দ্রনাথ ঠাকুররবীন্দ্রনাথ ঠাকুররবীন্দ্রনাথ ঠাকুররবীন্দ্রনাথ ঠাকুররবীন্দ্রনাথ ঠাকুররবীন্দ্রনাথ ঠাকুররবীন্দ্রনাথ ঠাকুররবীন্দ্রনাথ ঠাকুররবীন্দ্রনাথ ঠাকুররবীন্দ্রনাথ ঠাকুররবীন্দ্রনাথ ঠাকুররবীন্দ্রনাথ ঠাকুররবীন্দ্রনাথ ঠাকুররবীন্দ্রনাথ ঠাকুররবীন্দ্রনাথ ঠাকুররবীন্দ্রনাথ ঠাকুররবীন্দ্রনাথ ঠাকুররবীন্দ্রনাথ ঠাকুররবীন্দ্রনাথ ঠাকুররবীন্দ্রনাথ ঠাকুররবীন্দ্রনাথ ঠাকুররবীন্দ্রনাথ ঠাকুররবীন্দ্রনাথ ঠাকুররবীন্দ্রনাথ ঠাকুররবীন্দ্রনাথ ঠাকুররবীন্দ্রনাথ ঠাকুররবীন্দ্রনাথ ঠাকুররবীন্দ্রনাথ ঠাকুররবীন্দ্রনাথ ঠাকুররবীন্দ্রনাথ ঠাকুররবীন্দ্রনাথ ঠাকুররবীন্দ্রনাথ ঠাকুররবীন্দ্রনাথ ঠাকুররবীন্দ্রনাথ ঠাকুররবীন্দ্রনাথ ঠাকুররবীন্দ্রনাথ ঠাকুররবীন্দ্রনাথ ঠাকুররবীন্দ্রনাথ ঠাকুররবীন্দ্রনাথ ঠাকুররবীন্দ্রনাথ ঠাকুররবীন্দ্রনাথ ঠাকুররবীন্দ্রনাথ ঠাকুররবীন্দ্রনাথ ঠাকুররবীন্দ্রনাথ ঠাকুররবীন্দ্রনাথ ঠাকুররবীন্দ্রনাথ ঠাকুররবীন্দ্রনাথ ঠাকুররবীন্দ্রনাথ ঠাকুররবীন্দ্রনাথ ঠাকুররবীন্দ্রনাথ ঠাকুররবীন্দ্রনাথ ঠাকুররবীন্দ্রনাথ ঠাকুররবীন্দ্রনাথ ঠাকুররবীন্দ্রনাথ ঠাকুররবীন্দ্রনাথ ঠাকুররবীন্দ্রনাথ ঠাকুররবীন্দ্রনাথ ঠাকুররবীন্দ্রনাথ ঠাকুররবীন্দ্রনাথ ঠাকুররবীন্দ্রনাথ ঠাকুররবীন্দ্রনাথ ঠাকুররবীন্দ্রনাথ ঠাকুররবীন্দ্রনাথ ঠাকুররবীন্দ্রনাথ ঠাকুররবীন্দ্রনাথ ঠাকুররবীন্দ্রনাথ ঠাকুররবীন্দ্রনাথ ঠাকুররবীন্দ্রনাথ ঠাকুররবীন্দ্রনাথ ঠাকুররবীন্দ্রনাথ ঠাকুররবীন্দ্রনাথ ঠাকুররবীন্দ্রনাথ ঠাকুররবীন্দ্রনাথ ঠাকুররবীন্দ্রনাথ ঠাকুররবীন্দ্রনাথ ঠাকুররবীন্দ্রনাথ ঠাকুররবীন্দ্রনাথ ঠাকুররবীন্দ্রনাথ ঠাকুররবীন্দ্রনাথ ঠাকুররবীন্দ্রনাথ ঠাকুররবীন্দ্রনাথ ঠাকুররবীন্দ্রনাথ ঠাকুররবীন্দ্রনাথ ঠাকুররবীন্দ্রনাথ ঠাকুররবীন্দ্রনাথ ঠাকুররবীন্দ্রনাথ ঠাকুররবীন্দ্রনাথ ঠাকুররবীন্দ্রনাথ ঠাকুররবীন্দ্রনাথ ঠাকুররবীন্দ্রনাথ ঠাকুররবীন্দ্রনাথ ঠাকুররবীন্দ্রনাথ ঠাকুররবীন্দ্রনাথ ঠাকুররবীন্দ্রনাথ ঠাকুররবীন্দ্রনাথ ঠাকুররবীন্দ্রনাথ ঠাকুররবীন্দ্রনাথ ঠাকুররবীন্দ্রনাথ ঠাকুররবীন্দ্রনাথ ঠাকুররবীন্দ্রনাথ ঠাকুররবীন্দ্রনাথ ঠাকুররবীন্দ্রনাথ ঠাকুররবীন্দ্রনাথ ঠাকুররবীন্দ্রনাথ ঠাকুররবীন্দ্রনাথ ঠাকুররবীন্দ্রনাথ ঠাকুররবীন্দ্রনাথ ঠাকুররবীন্দ্রনাথ ঠাকুররবীন্দ্রনাথ ঠাকুররবীন্দ্রনাথ ঠাকুররবীন্দ্রনাথ ঠাকুররবীন্দ্রনাথ ঠাকুররবীন্দ্রনাথ ঠাকুররবীন্দ্রনাথ ঠাকুররবীন্দ্রনাথ ঠাকুররবীন্দ্রনাথ ঠাকুররবীন্দ্রনাথ ঠাকুররবীন্দ্রনাথ ঠাকুররবীন্দ্রনাথ ঠাকুররবীন্দ্রনাথ ঠাকুররবীন্দ্রনাথ ঠাকুররবীন্দ্রনাথ ঠাকুররবীন্দ্রনাথ ঠাকুররবীন্দ্রনাথ ঠাকুররবীন্দ্রনাথ ঠাকুররবীন্দ্রনাথ ঠাকুররবীন্দ্রনাথ ঠাকুররবীন্দ্রনাথ ঠাকুররবীন্দ্রনাথ ঠাকুররবীন্দ্রনাথ ঠাকুররবীন্দ্রনাথ ঠাকুররবীন্দ্রনাথ ঠাকুররবীন্দ্রনাথ ঠাকুররবীন্দ্রনাথ ঠাকুররবীন্দ্রনাথ ঠাকুররবীন্দ্রনাথ ঠাকুররবীন্দ্রনাথ ঠাকুররবীন্দ্রনাথ ঠাকুররবীন্দ্রনাথ ঠাকুররবীন্দ্রনাথ ঠাকুররবীন্দ্রনাথ ঠাকুররবীন্দ্রনাথ ঠাকুররবীন্দ্রনাথ ঠাকুররবীন্দ্রনাথ ঠাকুররবীন্দ্রনাথ ঠাকুররবীন্দ্রনাথ ঠাকুররবীন্দ্রনাথ ঠাকুররবীন্দ্রনাথ ঠাকুররবীন্দ্রনাথ ঠাকুররবীন্দ্রনাথ ঠাকুররবীন্দ্রনাথ ঠাকুররবীন্দ্রনাথ ঠাকুররবীন্দ্রনাথ ঠাকুররবীন্দ্রনাথ ঠাকুররবীন্দ্রনাথ ঠাকুররবীন্দ্রনাথ ঠাকুররবীন্দ্রনাথ ঠাকুররবীন্দ্রনাথ ঠাকুররবীন্দ্রনাথ ঠাকুররবীন্দ্রনাথ ঠাকুররবীন্দ্রনাথ ঠাকুররবীন্দ্রনাথ ঠাকুররবীন্দ্রনাথ ঠাকুররবীন্দ্রনাথ ঠাকুররবীন্দ্রনাথ ঠাকুররবীন্দ্রনাথ ঠাকুররবীন্দ্রনাথ ঠাকুররবীন্দ্রনাথ ঠাকুররবীন্দ্রনাথ ঠাকুররবীন্দ্রনাথ ঠাকুররবীন্দ্রনাথ ঠাকুররবীন্দ্রনাথ ঠাকুররবীন্দ্রনাথ ঠাকুররবীন্দ্রনাথ ঠাকুররবীন্দ্রনাথ ঠাকুররবীন্দ্রনাথ ঠাকুররবীন্দ্রনাথ ঠাকুররবীন্দ্রনাথ ঠাকুররবীন্দ্রনাথ ঠাকুররবীন্দ্রনাথ ঠাকুররবীন্দ্রনাথ ঠাকুররবীন্দ্রনাথ ঠাকুররবীন্দ্রনাথ ঠাকুররবীন্দ্রনাথ ঠাকুররবীন্দ্রনাথ ঠাকুররবীন্দ্রনাথ ঠাকুররবীন্দ্রনাথ ঠাকুররবীন্দ্রনাথ ঠাকুররবীন্দ্রনাথ ঠাকুররবীন্দ্রনাথ ঠাকুররবীন্দ্রনাথ ঠাকুররবীন্দ্রনাথ ঠাকুররবীন্দ্রনাথ ঠাকুররবীন্দ্রনাথ ঠাকুররবীন্দ্রনাথ ঠাকুররবীন্দ্রনাথ ঠাকুররবীন্দ্রনাথ ঠাকুররবীন্দ্রনাথ ঠাকুররবীন্দ্রনাথ ঠাকুররবীন্দ্রনাথ ঠাকুররবীন্দ্রনাথ ঠাকুররবীন্দ্রনাথ ঠাকুররবীন্দ্রনাথ ঠাকুররবীন্দ্রনাথ ঠাকুররবীন্দ্রনাথ ঠাকুররবীন্দ্রনাথ ঠাকুররবীন্দ্রনাথ ঠাকুররবীন্দ্রনাথ ঠাকুররবীন্দ্রনাথ ঠাকুররবীন্দ্রনাথ ঠাকুররবীন্দ্রনাথ ঠাকুররবীন্দ্রনাথ ঠাকুররবীন্দ্রনাথ ঠাকুররবীন্দ্রনাথ ঠাকুররবীন্দ্রনাথ ঠাকুররবীন্দ্রনাথ ঠাকুররবীন্দ্রনাথ ঠাকুররবীন্দ্রনাথ ঠাকুররবীন্দ্রনাথ ঠাকুররবীন্দ্রনাথ ঠাকুররবীন্দ্রনাথ ঠাকুররবীন্দ্রনাথ ঠাকুররবীন্দ্রনাথ ঠাকুররবীন্দ্রনাথ ঠাকুররবীন্দ্রনাথ ঠাকুররবীন্দ্রনাথ ঠাকুররবীন্দ্রনাথ ঠাকুররবীন্দ্রনাথ ঠাকুররবীন্দ্রনাথ ঠাকুররবীন্দ্রনাথ ঠাকুররবীন্দ্রনাথ ঠাকুররবীন্দ্রনাথ ঠাকুররবীন্দ্রনাথ ঠাকুররবীন্দ্রনাথ ঠাকুররবীন্দ্রনাথ ঠাকুররবীন্দ্রনাথ ঠাকুররবীন্দ্রনাথ ঠাকুররবীন্দ্রনাথ ঠাকুররবীন্দ্রনাথ ঠাকুররবীন্দ্রনাথ ঠাকুররবীন্দ্রনাথ ঠাকুররবীন্দ্রনাথ ঠাকুররবীন্দ্রনাথ ঠাকুররবীন্দ্রনাথ ঠাকুররবীন্দ্রনাথ ঠাকুররবীন্দ্রনাথ ঠাকুররবীন্দ্রনাথ ঠাকুররবীন্দ্রনাথ ঠাকুররবীন্দ্রনাথ ঠাকুররবীন্দ্রনাথ ঠাকুররবীন্দ্রনাথ ঠাকুররবীন্দ্রনাথ ঠাকুররবীন্দ্রনাথ ঠাকুররবীন্দ্রনাথ ঠাকুররবীন্দ্রনাথ ঠাকুররবীন্দ্রনাথ ঠাকুররবীন্দ্রনাথ ঠাকুররবীন্দ্রনাথ ঠাকুররবীন্দ্রনাথ ঠাকুররবীন্দ্রনাথ ঠাকুররবীন্দ্রনাথ ঠাকুররবীন্দ্রনাথ ঠাকুররবীন্দ্রনাথ ঠাকুররবীন্দ্রনাথ ঠাকুররবীন্দ্রনাথ ঠাকুররবীন্দ্রনাথ ঠাকুররবীন্দ্রনাথ ঠাকুররবীন্দ্রনাথ ঠাকুররবীন্দ্রনাথ ঠাকুররবীন্দ্রনাথ ঠাকুররবীন্দ্রনাথ ঠাকুররবীন্দ্রনাথ ঠাকুররবীন্দ্রনাথ ঠাকুররবীন্দ্রনাথ ঠাকুররবীন্দ্রনাথ ঠাকুররবীন্দ্রনাথ ঠাকুররবীন্দ্রনাথ ঠাকুররবীন্দ্রনাথ ঠাকুররবীন্দ্রনাথ ঠাকুররবীন্দ্রনাথ ঠাকুররবীন্দ্রনাথ ঠাকুররবীন্দ্রনাথ ঠাকুররবীন্দ্রনাথ ঠাকুররবীন্দ্রনাথ ঠাকুররবীন্দ্রনাথ ঠাকুররবীন্দ্রনাথ ঠাকুররবীন্দ্রনাথ ঠাকুররবীন্দ্রনাথ ঠাকুররবীন্দ্রনাথ ঠাকুররবীন্দ্রনাথ ঠাকুররবীন্দ্রনাথ ঠাকুররবীন্দ্রনাথ ঠাকুররবীন্দ্রনাথ ঠাকুররবীন্দ্রনাথ ঠাকুররবীন্দ্রনাথ ঠাকুররবীন্দ্রনাথ ঠাকুররবীন্দ্রনাথ ঠাকুররবীন্দ্রনাথ ঠাকুররবীন্দ্রনাথ ঠাকুররবীন্দ্রনাথ ঠাকুররবীন্দ্রনাথ ঠাকুররবীন্দ্রনাথ ঠাকুররবীন্দ্রনাথ ঠাকুররবীন্দ্রনাথ ঠাকুররবীন্দ্রনাথ ঠাকুররবীন্দ্রনাথ ঠাকুররবীন্দ্রনাথ ঠাকুররবীন্দ্রনাথ ঠাকুররবীন্দ্রনাথ ঠাকুররবীন্দ্রনাথ ঠাকুররবীন্দ্রনাথ ঠাকুররবীন্দ্রনাথ ঠাকুররবীন্দ্রনাথ ঠাকুররবীন্দ্রনাথ ঠাকুররবীন্দ্রনাথ ঠাকুররবীন্দ্রনাথ ঠাকুররবীন্দ্রনাথ ঠাকুররবীন্দ্রনাথ ঠাকুররবীন্দ্রনাথ ঠাকুররবীন্দ্রনাথ ঠাকুররবীন্দ্রনাথ ঠাকুররবীন্দ্রনাথ ঠাকুররবীন্দ্রনাথ ঠাকুররবীন্দ্রনাথ ঠাকুররবীন্দ্রনাথ ঠাকুররবীন্দ্রনাথ ঠাকুররবীন্দ্রনাথ ঠাকুররবীন্দ্রনাথ ঠাকুররবীন্দ্রনাথ ঠাকুররবীন্দ্রনাথ ঠাকুররবীন্দ্রনাথ ঠাকুররবীন্দ্রনাথ ঠাকুররবীন্দ্রনাথ ঠাকুররবীন্দ্রনাথ ঠাকুররবীন্দ্রনাথ ঠাকুররবীন্দ্রনাথ ঠাকুররবীন্দ্রনাথ ঠাকুররবীন্দ্রনাথ ঠাকুররবীন্দ্রনাথ ঠাকুররবীন্দ্রনাথ ঠাকুররবীন্দ্রনাথ ঠাকুররবীন্দ্রনাথ ঠাকুররবীন্দ্রনাথ ঠাকুররবীন্দ্রনাথ ঠাকুররবীন্দ্রনাথ ঠাকুররবীন্দ্রনাথ ঠাকুররবীন্দ্রনাথ ঠাকুররবীন্দ্রনাথ ঠাকুররবীন্দ্রনাথ ঠাকুররবীন্দ্রনাথ ঠাকুররবীন্দ্রনাথ ঠাকুররবীন্দ্রনাথ ঠাকুররবীন্দ্রনাথ ঠাকুররবীন্দ্রনাথ ঠাকুররবীন্দ্রনাথ ঠাকুররবীন্দ্রনাথ ঠাকুররবীন্দ্রনাথ ঠাকুররবীন্দ্রনাথ ঠাকুররবীন্দ্রনাথ ঠাকুররবীন্দ্রনাথ ঠাকুররবীন্দ্রনাথ ঠাকুররবীন্দ্রনাথ ঠাকুররবীন্দ্রনাথ ঠাকুররবীন্দ্রনাথ ঠাকুররবীন্দ্রনাথ ঠাকুররবীন্দ্রনাথ ঠাকুররবীন্দ্রনাথ ঠাকুররবীন্দ্রনাথ ঠাকুররবীন্দ্রনাথ ঠাকুররবীন্দ্রনাথ ঠাকুররবীন্দ্রনাথ ঠাকুররবীন্দ্রনাথ ঠাকুররবীন্দ্রনাথ ঠাকুররবীন্দ্রনাথ ঠাকুররবীন্দ্রনাথ ঠাকুররবীন্দ্রনাথ ঠাকুররবীন্দ্রনাথ ঠাকুররবীন্দ্রনাথ ঠাকুররবীন্দ্রনাথ ঠাকুররবীন্দ্রনাথ ঠাকুররবীন্দ্রনাথ ঠাকুররবীন্দ্রনাথ ঠাকুররবীন্দ্রনাথ ঠাকুররবীন্দ্রনাথ ঠাকুররবীন্দ্রনাথ ঠাকুররবীন্দ্রনাথ ঠাকুররবীন্দ্রনাথ ঠাকুররবীন্দ্রনাথ ঠাকুররবীন্দ্রনাথ ঠাকুররবীন্দ্রনাথ ঠাকুররবীন্দ্রনাথ ঠাকুররবীন্দ্রনাথ ঠাকুররবীন্দ্রনাথ ঠাকুররবীন্দ্রনাথ ঠাকুররবীন্দ্রনাথ ঠাকুররবীন্দ্রনাথ ঠাকুররবীন্দ্রনাথ ঠাকুররবীন্দ্রনাথ ঠাকুররবীন্দ্রনাথ ঠাকুররবীন্দ্রনাথ ঠাকুররবীন্দ্রনাথ ঠাকুররবীন্দ্রনাথ ঠাকুররবীন্দ্রনাথ ঠাকুররবীন্দ্রনাথ ঠাকুররবীন্দ্রনাথ ঠাকুররবীন্দ্রনাথ ঠাকুররবীন্দ্রনাথ ঠাকুররবীন্দ্রনাথ ঠাকুররবীন্দ্রনাথ ঠাকুররবীন্দ্রনাথ ঠাকুররবীন্দ্রনাথ ঠাকুররবীন্দ্রনাথ ঠাকুররবীন্দ্রনাথ ঠাকুররবীন্দ্রনাথ ঠাকুররবীন্দ্রনাথ ঠাকুররবীন্দ্রনাথ ঠাকুররবীন্দ্রনাথ ঠাকুররবীন্দ্রনাথ ঠাকুররবীন্দ্রনাথ ঠাকুররবীন্দ্রনাথ ঠাকুররবীন্দ্রনাথ ঠাকুররবীন্দ্রনাথ ঠাকুররবীন্দ্রনাথ ঠাকুররবীন্দ্রনাথ ঠাকুররবীন্দ্রনাথ ঠাকুররবীন্দ্রনাথ ঠাকুররবীন্দ্রনাথ ঠাকুররবীন্দ্রনাথ ঠাকুররবীন্দ্রনাথ ঠাকুররবীন্দ্রনাথ ঠাকুররবীন্দ্রনাথ ঠাকুররবীন্দ্রনাথ ঠাকুররবীন্দ্রনাথ ঠাকুররবীন্দ্রনাথ ঠাকুররবীন্দ্রনাথ ঠাকুররবীন্দ্রনাথ ঠাকুররবীন্দ্রনাথ ঠাকুররবীন্দ্রনাথ ঠাকুররবীন্দ্রনাথ ঠাকুররবীন্দ্রনাথ ঠাকুররবীন্দ্রনাথ ঠাকুররবীন্দ্রনাথ ঠাকুররবীন্দ্রনাথ ঠাকুররবীন্দ্রনাথ ঠাকুররবীন্দ্রনাথ ঠাকুররবীন্দ্রনাথ ঠাকুররবীন্দ্রনাথ ঠাকুররবীন্দ্রনাথ ঠাকুররবীন্দ্রনাথ ঠাকুররবীন্দ্রনাথ ঠাকুররবীন্দ্রনাথ ঠাকুররবীন্দ্রনাথ ঠাকুররবীন্দ্রনাথ ঠাকুররবীন্দ্রনাথ ঠাকুররবীন্দ্রনাথ ঠাকুররবীন্দ্রনাথ ঠাকুররবীন্দ্রনাথ ঠাকুররবীন্দ্রনাথ ঠাকুররবীন্দ্রনাথ ঠাকুররবীন্দ্রনাথ ঠাকুররবীন্দ্রনাথ ঠাকুররবীন্দ্রনাথ ঠাকুররবীন্দ্রনাথ ঠাকুররবীন্দ্রনাথ ঠাকুররবীন্দ্রনাথ ঠাকুররবীন্দ্রনাথ ঠাকুররবীন্দ্রনাথ ঠাকুররবীন্দ্রনাথ ঠাকুররবীন্দ্রনাথ ঠাকুররবীন্দ্রনাথ ঠাকুররবীন্দ্রনাথ ঠাকুররবীন্দ্রনাথ ঠাকুররবীন্দ্রনাথ ঠাকুররবীন্দ্রনাথ ঠাকুররবীন্দ্রনাথ ঠাকুররবীন্দ্রনাথ ঠাকুররবীন্দ্রনাথ ঠাকুররবীন্দ্রনাথ ঠাকুররবীন্দ্রনাথ ঠাকুররবীন্দ্রনাথ ঠাকুররবীন্দ্রনাথ ঠাকুররবীন্দ্রনাথ ঠাকুররবীন্দ্রনাথ ঠাকুররবীন্দ্রনাথ ঠাকুররবীন্দ্রনাথ ঠাকুররবীন্দ্রনাথ ঠাকুররবীন্দ্রনাথ ঠাকুররবীন্দ্রনাথ ঠাকুররবীন্দ্রনাথ ঠাকুররবীন্দ্রনাথ ঠাকুররবীন্দ্রনাথ ঠাকুররবীন্দ্রনাথ ঠাকুররবীন্দ্রনাথ ঠাকুররবীন্দ্রনাথ ঠাকুররবীন্দ্রনাথ ঠাকুররবীন্দ্রনাথ ঠাকুররবীন্দ্রনাথ ঠাকুররবীন্দ্রনাথ ঠাকুররবীন্দ্রনাথ ঠাকুররবীন্দ্রনাথ ঠাকুররবীন্দ্রনাথ ঠাকুররবীন্দ্রনাথ ঠাকুররবীন্দ্রনাথ ঠাকুররবীন্দ্রনাথ ঠাকুররবীন্দ্রনাথ ঠাকুররবীন্দ্রনাথ ঠাকুররবীন্দ্রনাথ ঠাকুররবীন্দ্রনাথ ঠাকুররবীন্দ্রনাথ ঠাকুররবীন্দ্রনাথ ঠাকুররবীন্দ্রনাথ ঠাকুররবীন্দ্রনাথ ঠাকুররবীন্দ্রনাথ ঠাকুররবীন্দ্রনাথ ঠাকুররবীন্দ্রনাথ ঠাকুররবীন্দ্রনাথ ঠাকুররবীন্দ্রনাথ ঠাকুররবীন্দ্রনাথ ঠাকুররবীন্দ্রনাথ ঠাকুররবীন্দ্রনাথ ঠাকুররবীন্দ্রনাথ ঠাকুররবীন্দ্রনাথ ঠাকুররবীন্দ্রনাথ ঠাকুররবীন্দ্রনাথ ঠাকুররবীন্দ্রনাথ ঠাকুররবীন্দ্রনাথ ঠাকুররবীন্দ্রনাথ ঠাকুররবীন্দ্রনাথ ঠাকুররবীন্দ্রনাথ ঠাকুররবীন্দ্রনাথ ঠাকুররবীন্দ্রনাথ ঠাকুররবীন্দ্রনাথ ঠাকুররবীন্দ্রনাথ ঠাকুররবীন্দ্রনাথ ঠাকুররবীন্দ্রনাথ ঠাকুররবীন্দ্রনাথ ঠাকুররবীন্দ্রনাথ ঠাকুররবীন্দ্রনাথ ঠাকুররবীন্দ্রনাথ ঠাকুররবীন্দ্রনাথ ঠাকুররবীন্দ্রনাথ ঠাকুররবীন্দ্রনাথ ঠাকুররবীন্দ্রনাথ ঠাকুররবীন্দ্রনাথ ঠাকুররবীন্দ্রনাথ ঠাকুররবীন্দ্রনাথ ঠাকুররবীন্দ্রনাথ ঠাকুররবীন্দ্রনাথ ঠাকুররবীন্দ্রনাথ ঠাকুররবীন্দ্রনাথ ঠাকুররবীন্দ্রনাথ ঠাকুররবীন্দ্রনাথ ঠাকুররবীন্দ্রনাথ ঠাকুররবীন্দ্রনাথ ঠাকুররবীন্দ্রনাথ ঠাকুররবীন্দ্রনাথ ঠাকুররবীন্দ্রনাথ ঠাকুররবীন্দ্রনাথ ঠাকুররবীন্দ্রনাথ ঠাকুররবীন্দ্রনাথ ঠাকুররবীন্দ্রনাথ ঠাকুররবীন্দ্রনাথ ঠাকুররবীন্দ্রনাথ ঠাকুররবীন্দ্রনাথ ঠাকুররবীন্দ্রনাথ ঠাকুররবীন্দ্রনাথ ঠাকুররবীন্দ্রনাথ ঠাকুররবীন্দ্রনাথ ঠাকুররবীন্দ্রনাথ ঠাকুররবীন্দ্রনাথ ঠাকুররবীন্দ্রনাথ ঠাকুররবীন্দ্রনাথ ঠাকুররবীন্দ্রনাথ ঠাকুররবীন্দ্রনাথ ঠাকুররবীন্দ্রনাথ ঠাকুররবীন্দ্রনাথ ঠাকুররবীন্দ্রনাথ ঠাকুররবীন্দ্রনাথ ঠাকুররবীন্দ্রনাথ ঠাকুররবীন্দ্রনাথ ঠাকুররবীন্দ্রনাথ ঠাকুররবীন্দ্রনাথ ঠাকুররবীন্দ্রনাথ ঠাকুররবীন্দ্রনাথ ঠাকুররবীন্দ্রনাথ ঠাকুররবীন্দ্রনাথ ঠাকুররবীন্দ্রনাথ ঠাকুররবীন্দ্রনাথ ঠাকুররবীন্দ্রনাথ ঠাকুররবীন্দ্রনাথ ঠাকুররবীন্দ্রনাথ ঠাকুররবীন্দ্রনাথ ঠাকুররবীন্দ্রনাথ ঠাকুররবীন্দ্রনাথ ঠাকুররবীন্দ্রনাথ ঠাকুররবীন্দ্রনাথ ঠাকুররবীন্দ্রনাথ ঠাকুররবীন্দ্রনাথ ঠাকুররবীন্দ্রনাথ ঠাকুররবীন্দ্রনাথ ঠাকুররবীন্দ্রনাথ ঠাকুররবীন্দ্রনাথ ঠাকুররবীন্দ্রনাথ ঠাকুররবীন্দ্রনাথ ঠাকুররবীন্দ্রনাথ ঠাকুররবীন্দ্রনাথ ঠাকুররবীন্দ্রনাথ ঠাকুররবীন্দ্রনাথ ঠাকুররবীন্দ্রনাথ ঠাকুররবীন্দ্রনাথ ঠাকুররবীন্দ্রনাথ ঠাকুররবীন্দ্রনাথ ঠাকুররবীন্দ্রনাথ ঠাকুররবীন্দ্রনাথ ঠাকুররবীন্দ্রনাথ ঠাকুররবীন্দ্রনাথ ঠাকুররবীন্দ্রনাথ ঠাকুররবীন্দ্রনাথ ঠাকুররবীন্দ্রনাথ ঠাকুররবীন্দ্রনাথ ঠাকুররবীন্দ্রনাথ ঠাকুররবীন্দ্রনাথ ঠাকুররবীন্দ্রনাথ ঠাকুররবীন্দ্রনাথ ঠাকুররবীন্দ্রনাথ ঠাকুররবীন্দ্রনাথ ঠাকুররবীন্দ্রনাথ ঠাকুররবীন্দ্রনাথ ঠাকুররবীন্দ্রনাথ ঠাকুররবীন্দ্রনাথ ঠাকুররবীন্দ্রনাথ ঠাকুররবীন্দ্রনাথ ঠাকুররবীন্দ্রনাথ ঠাকুররবীন্দ্রনাথ ঠাকুররবীন্দ্রনাথ ঠাকুররবীন্দ্রনাথ ঠাকুররবীন্দ্রনাথ ঠাকুররবীন্দ্রনাথ ঠাকুররবীন্দ্রনাথ ঠাকুররবীন্দ্রনাথ ঠাকুররবীন্দ্রনাথ ঠাকুররবীন্দ্রনাথ ঠাকুররবীন্দ্রনাথ ঠাকুর	0	
UPDATE t8 SET c1= REPEAT('৯',12000);
SELECT length(c1),length(c2) FROM t8;
length(c1)	length(c2)
36000	NULL
36000	NULL
36000	0
DROP TABLE t8;
SET collation_connection = default;
DROP TABLE IF EXISTS t1,t2,t3,t4,t5,t6,t7,t8,t9,t10,t11,t12,t13,t14,t15,t16,t17,t18;
