drop user zwc cascade;
create user zwc identified by zwc;
grant all on *.* to zwc with grant option;
grant dba to zwc;
#设置超时等待时间
SET wait_timeout=30000000;
SET ob_trx_timeout = 100000000;
SET ob_query_timeout = 100000000;
alter system flush plan cache global;
set autocommit = false;
alter system set ob_enable_batched_multi_statement='true';
#number+varchar
create table t1(c1 number ,c2 varchar(30) not null);
insert into t1 values(1,'AA');
insert into t1 values(2,'BB');
insert into t1 values(3,'CC');
SET @aa:='张三';
SET @bb:='李四';
set @cc:='王五';
insert into t1 select c1,case c2 when 'AA' then 'A' when 'BB' then 'B' else 'C' end as c2 from t1;
insert into t1 select c1,case c2 when 'AA' then @aa when 'BB' then @bb else @cc end as c2 from t1;//
select hit_count, is_batched_multi_stmt, statement, query_sql from gv$OB_PLAN_CACHE_PLAN_STAT where statement like 'insert into t1 select %' order by hit_count;
HIT_COUNT	IS_BATCHED_MULTI_STMT	STATEMENT	QUERY_SQL
0	0	insert into t1 select c1,case c2 when ? then ? when ? then ? else ? end as c2 from t1;	insert into t1 select c1,case c2 when 'AA' then 'A' when 'BB' then 'B' else 'C' end as c2 from t1;
0	0	insert into t1 select c1,case c2 when ? then ? when ? then ? else ? end as c2 from t1;	insert into t1 select c1,case c2 when ? then ? when ? then ? else ? end as c2 from t1;
0	0	insert into t1 select c1,case c2 when ? then @aa when ? then @bb else @cc end as c2 from t1;	insert into t1 select c1,case c2 when 'AA' then @aa when 'BB' then @bb else @cc end as c2 from t1;
0	0	insert into t1 select c1,case c2 when ? then @aa when ? then @bb else @cc end as c2 from t1;	insert into t1 select c1,case c2 when ? then @aa when ? then @bb else @cc end as c2 from t1;
drop table t1;
alter system flush plan cache global;
create table t2(c1 number ,c2 varchar(30) not null default 'AA');
insert into t2 values(1,'AA');
insert into t2 values(2,'BB');
insert into t2 values(3,'CC');
insert into t2 values(4,'DD');
insert into t2 values(5,'EE');
insert into t2 values(6,'FF');
commit;
insert into t2 select c1,case c2 when 'AA' then 'A' when 'BB' then 'B' else 'C' end as c2 from t2;
insert into t2 select c1,case c2 when 'AA' then 'Q' when 'BB' then 'K' else 'A' end as c2 from t2;//
select * from t2;
C1	C2
1	A
1	A
1	AA
1	Q
2	A
2	B
2	BB
2	K
3	A
3	A
3	C
3	CC
4	A
4	A
4	C
4	DD
5	A
5	A
5	C
5	EE
6	A
6	A
6	C
6	FF
select hit_count, is_batched_multi_stmt, statement, query_sql from gv$OB_PLAN_CACHE_PLAN_STAT where statement like 'insert into t2 select%' order by hit_count;
HIT_COUNT	IS_BATCHED_MULTI_STMT	STATEMENT	QUERY_SQL
1	0	insert into t2 select c1,case c2 when ? then ? when ? then ? else ? end as c2 from t2;	insert into t2 select c1,case c2 when 'AA' then 'A' when 'BB' then 'B' else 'C' end as c2 from t2;
1	0	insert into t2 select c1,case c2 when ? then ? when ? then ? else ? end as c2 from t2;	insert into t2 select c1,case c2 when ? then ? when ? then ? else ? end as c2 from t2;
drop table t2;
#binary_float,binary_double
alter system flush plan cache global;
create table t3(c1 binary_float,c2 binary_double,c3 decimal(5,3));
create index index_t3 on t3(c1,c2,c3);
insert into t3 values(1.111,1.111,1.111);
insert into t3 values(2.111,2.222,2.333);
insert into t3 values(3.111,3.222,3.333);
insert into t3 values(11.111,11.111,11.111);
insert into t3 values(12.111,12.222,12.333);
commit;
insert into t3 select c1,c3,case c2 when 1.111 then 2 when 2.222 then 3 else 2.5 end as c2 from t3 fetch next 1 rows only;
insert into t3 select c1,c3,case c2 when 1.111 then 2.666 when 2.222 then 3.666 else 2.555 end as c2 from t3 fetch next 1 rows only;//
select * from t3;
C1	C2	C3
1.11099994E+000	1.111E+000	1.111
1.11099994E+000	1.111E+000	2
1.11099994E+000	1.111E+000	2.666
1.11110001E+001	1.1111000000000001E+001	11.111
1.21110001E+001	1.2222E+001	12.333
2.11100006E+000	2.222E+000	2.333
3.11100006E+000	3.222E+000	3.333
select hit_count, is_batched_multi_stmt, statement, query_sql from gv$OB_PLAN_CACHE_PLAN_STAT where statement like 'insert into t3 select %' order by hit_count;
HIT_COUNT	IS_BATCHED_MULTI_STMT	STATEMENT	QUERY_SQL
1	0	insert into t3 select c1,c3,case c2 when ? then ? when ? then ? else ? end as c2 from t3 fetch next ? rows only;	insert into t3 select c1,c3,case c2 when 1.111 then 2 when 2.222 then 3 else 2.5 end as c2 from t3 fetch next 1 rows only;
1	0	insert into t3 select c1,c3,case c2 when ? then ? when ? then ? else ? end as c2 from t3 fetch next ? rows only;	insert into t3 select c1,c3,case c2 when ? then ? when ? then ? else ? end as c2 from t3 fetch next ? rows only;
rollback;
delete from t3 where c2 = case when c2 = 1.111 then 5.111 else c2 end;delete from t3 where c2 = case when c2 = 2.222 then 1.111  else c2 end;//
select * from t3;
C1	C2	C3
select hit_count, is_batched_multi_stmt, statement, query_sql from gv$OB_PLAN_CACHE_PLAN_STAT where statement like 'delete from t3 where %' order by hit_count;
HIT_COUNT	IS_BATCHED_MULTI_STMT	STATEMENT	QUERY_SQL
0	0	delete from t3 where c2 = case when c2 = ? then ?  else c2 end;	delete from t3 where c2 = case when c2 = 2.222 then 1.111  else c2 end;
0	0	delete from t3 where c2 = case when c2 = ? then ?  else c2 end;	delete from t3 where c2 = case when c2 = ? then ?  else c2 end;
0	0	delete from t3 where c2 = case when c2 = ? then ? else c2 end;	delete from t3 where c2 = case when c2 = 1.111 then 5.111 else c2 end;
0	0	delete from t3 where c2 = case when c2 = ? then ? else c2 end;	delete from t3 where c2 = case when c2 = ? then ? else c2 end;
drop table t3;
#date,timestamp
alter system flush plan cache global;
create table t5(c1 date not null,c2 timestamp not null) partition by list(c1)
(
partition p0 values('2022-01-01 10:35:00','2022-01-02 11:35:00','2022-01-03 12:35:00','2022-01-04 13:35:00','2022-01-05 14:35:00'),
partition p1 values('2022-01-06 10:35:00','2022-01-07 11:35:00','2022-01-08 12:35:00','2022-01-09 14:35:00','2022-01-10 15:35:00')
);
create index index_c1_C2 on t5(c1,c2);
insert into t5 values(to_date('2022-01-01 10:35:00','yyyy-mm-dd hh24:mi:ss'),to_date('2022-01-11 10:35:00','yyyy-mm-dd hh24:mi:ss'));
insert into t5 values(to_date('2022-01-02 11:35:00','yyyy-mm-dd hh24:mi:ss'),to_date('2022-01-12 11:35:00','yyyy-mm-dd hh24:mi:ss'));
insert into t5 values(to_date('2022-01-03 12:35:00','yyyy-mm-dd hh24:mi:ss'),to_date('2022-01-13 12:35:00','yyyy-mm-dd hh24:mi:ss'));
insert into t5 values(to_date('2022-01-06 10:35:00','yyyy-mm-dd hh24:mi:ss'),to_date('2022-01-16 10:35:00','yyyy-mm-dd hh24:mi:ss'));
insert into t5 values(to_date('2022-01-07 11:35:00','yyyy-mm-dd hh24:mi:ss'),to_date('2022-01-17 11:35:00','yyyy-mm-dd hh24:mi:ss'));
insert into t5 values(to_date('2022-01-08 12:35:00','yyyy-mm-dd hh24:mi:ss'),to_date('2022-01-18 12:35:00','yyyy-mm-dd hh24:mi:ss'));
commit;
select * from t5;
C1	C2
2022-01-01 10:35:00	2022-01-11 10:35:00.000000
2022-01-02 11:35:00	2022-01-12 11:35:00.000000
2022-01-03 12:35:00	2022-01-13 12:35:00.000000
2022-01-06 10:35:00	2022-01-16 10:35:00.000000
2022-01-07 11:35:00	2022-01-17 11:35:00.000000
2022-01-08 12:35:00	2022-01-18 12:35:00.000000
insert into t5 select c1,case when c2 = '2022-01-11 10:35:00' then '1998-09-09 09:09:09' when c2 = '2022-01-16 10:35:00' then '2000-01-01' else '2001-02-02 02:02:02' end as c2 from t5;
insert into t5 select c1,case when c2 = '2022-01-17 11:35:00' then '2008-08-08 08:08:08' when c2 = '2022-01-13 12:35:00' then '2006-06-06' else '2002-02-02 02:02:02' end as c2 from t5;//
select * from t5 order by c1;
C1	C2
2022-01-01 10:35:00	1998-09-09 09:09:09.000000
2022-01-01 10:35:00	2002-02-02 02:02:02.000000
2022-01-01 10:35:00	2002-02-02 02:02:02.000000
2022-01-01 10:35:00	2022-01-11 10:35:00.000000
2022-01-02 11:35:00	2001-02-02 02:02:02.000000
2022-01-02 11:35:00	2002-02-02 02:02:02.000000
2022-01-02 11:35:00	2002-02-02 02:02:02.000000
2022-01-02 11:35:00	2022-01-12 11:35:00.000000
2022-01-03 12:35:00	2001-02-02 02:02:02.000000
2022-01-03 12:35:00	2002-02-02 02:02:02.000000
2022-01-03 12:35:00	2006-06-06 00:00:00.000000
2022-01-03 12:35:00	2022-01-13 12:35:00.000000
2022-01-06 10:35:00	2000-01-01 00:00:00.000000
2022-01-06 10:35:00	2002-02-02 02:02:02.000000
2022-01-06 10:35:00	2002-02-02 02:02:02.000000
2022-01-06 10:35:00	2022-01-16 10:35:00.000000
2022-01-07 11:35:00	2001-02-02 02:02:02.000000
2022-01-07 11:35:00	2002-02-02 02:02:02.000000
2022-01-07 11:35:00	2008-08-08 08:08:08.000000
2022-01-07 11:35:00	2022-01-17 11:35:00.000000
2022-01-08 12:35:00	2001-02-02 02:02:02.000000
2022-01-08 12:35:00	2002-02-02 02:02:02.000000
2022-01-08 12:35:00	2002-02-02 02:02:02.000000
2022-01-08 12:35:00	2022-01-18 12:35:00.000000
select hit_count, is_batched_multi_stmt, statement, query_sql from gv$OB_PLAN_CACHE_PLAN_STAT where statement like 'insert into t5 select %' order by hit_count;
HIT_COUNT	IS_BATCHED_MULTI_STMT	STATEMENT	QUERY_SQL
1	0	insert into t5 select c1,case when c2 = ? then ? when c2 = ? then ? else ? end as c2 from t5;	insert into t5 select c1,case when c2 = '2022-01-11 10:35:00' then '1998-09-09 09:09:09' when c2 = '2022-01-16 10:35:00' then '2000-01-01' else '2001-02-02 02:02:02' end as c2 from t5;
rollback;
delete from t5 where c2 = case when c2 = '2022-01-11 10:35:00' then '2007-07-07 07:07:07' else c2 end;
ERROR 22000: inconsistent datatypes
delete from t5 where c2 = case when c2 = '2022-01-11 10:35:00' then '2007-07-07 07:07:07' else '2022-01-17 11:35:00' end;
delete from t5 where c2 = case when c2 = '2022-01-12 11:35:00' then '2008-08-08 08:08:08' else '2022-01-16 11:35:00' end;//
select * from t5 order by c1;
C1	C2
2022-01-01 10:35:00	2022-01-11 10:35:00.000000
2022-01-02 11:35:00	2022-01-12 11:35:00.000000
2022-01-03 12:35:00	2022-01-13 12:35:00.000000
2022-01-06 10:35:00	2022-01-16 10:35:00.000000
2022-01-08 12:35:00	2022-01-18 12:35:00.000000
select hit_count, is_batched_multi_stmt, statement, query_sql from gv$OB_PLAN_CACHE_PLAN_STAT where statement like 'delete from t5 where c2 = %' order by hit_count;
HIT_COUNT	IS_BATCHED_MULTI_STMT	STATEMENT	QUERY_SQL
0	1	delete from t5 where c2 = case when c2 = ? then ? else ? end	delete from t5 where c2 = case when c2 = '2022-01-11 10:35:00' then '2007-07-07 07:07:07' else '2022-01-17 11:35:00' end;
delete from t5 where c2 = case when c2 = '2022-01-12 11:35:00' then '2008-08-08 08:08:08' else '2022-01-16 11:35:00' end;
rollback;
drop table t5;
#raw
alter system flush plan cache global;
CREATE TABLE t6 (c1 RAW(10) not null default 'AA',c2 RAW(10) not null);
INSERT INTO t6 VALUES (utl_raw.cast_to_raw('A'),hextoraw('ff'));
INSERT INTO t6 VALUES (utl_raw.cast_to_raw('123'),hextoraw('aa'));
INSERT INTO t6 VALUES (utl_raw.cast_to_raw('B'),hextoraw('dd'));
INSERT INTO t6 VALUES (utl_raw.cast_to_raw('D'),hextoraw('cc'));
commit;
create index index_c1 on t6(c1);
select * from t6;
C1	C2
313233	AA
41	FF
42	DD
44	CC
insert into t6 select c1,case when c2 = 'FF' then 'fF' when c2 = 'DD' then 'dD' else '1F' end from t6;
insert into t6 select c1,case when c2 = 'AA' then 'D3' when c2 = 'CC' then '9F' else 'ee' end from t6;//
select * from t6 order by c1;
C1	C2
313233	1F
313233	AA
313233	D3
313233	EE
41	EE
41	EE
41	FF
41	FF
42	DD
42	DD
42	EE
42	EE
44	1F
44	9F
44	CC
44	EE
select hit_count, is_batched_multi_stmt, statement, query_sql from gv$OB_PLAN_CACHE_PLAN_STAT where statement like 'insert into t6 select %' order by hit_count;
HIT_COUNT	IS_BATCHED_MULTI_STMT	STATEMENT	QUERY_SQL
1	0	insert into t6 select c1,case when c2 = ? then ? when c2 = ? then ? else ? end from t6;	insert into t6 select c1,case when c2 = 'FF' then 'fF' when c2 = 'DD' then 'dD' else '1F' end from t6;
1	0	insert into t6 select c1,case when c2 = ? then ? when c2 = ? then ? else ? end from t6;	insert into t6 select c1,case when c2 = 'FF' then 'fF' when c2 = 'DD' then 'dD' else '1F' end from t6;
rollback;
delete from t6 where c1 = case when c1 = 'A' then '123' when c1 = '123' then 'D' else '42' end;
delete from t6 where c1 = case when c1 = '41' then '123' when c1 = '44' then 'D' else 'CC' end;//
select * from t6 order by c1;
C1	C2
313233	AA
41	FF
44	CC
select hit_count, is_batched_multi_stmt, statement, query_sql from gv$OB_PLAN_CACHE_PLAN_STAT where statement like 'delete from t6 where c1 = %' order by hit_count;
HIT_COUNT	IS_BATCHED_MULTI_STMT	STATEMENT	QUERY_SQL
0	1	delete from t6 where c1 = case when c1 = ? then ? when c1 = ? then ? else ? end	delete from t6 where c1 = case when c1 = 'A' then '123' when c1 = '123' then 'D' else '42' end;
delete from t6 where c1 = case when c1 = '41' then '123' when c1 = '44' then 'D' else 'CC' end;
rollback;
drop table t6;
#blob
alter system flush plan cache global;
create table t7(c1 blob,c2 blob);
insert into t7 values('a','10');
insert into t7 values('b','11');
insert into t7 values('c','12');
insert into t7 values('d','13');
insert into t7 values('e','14');
commit;
select * from t7;
C1	C2

	
	
	
	
	
insert into t7 select c1,case when c2 = '10' then 'a' when c2 = '12' then 'b' else 'c' end from t7;
ERROR 22000: inconsistent datatypes
insert into t7 select c1,case c2 when '10' then 'a' when '12' then 'b' else 'c' end from t7;
ERROR 22000: inconsistent datatypes
delete from t7 where c1 = case when c1 = 'a' then 'b' when c1 = 'c' then 'd' else 'e' end;
ERROR 22000: inconsistent datatypes
drop table t7;
#clob
create table t8 (c1 clob,c2 clob);
insert into t8 values('aaa','111');
insert into t8 values('bbb','222');
insert into t8 values('ccc','333');
insert into t8 values('ddd','444');
insert into t8 values('eee','555');
commit;
select * from t8;
C1	C2
aaa	111
bbb	222
ccc	333
ddd	444
eee	555
insert into t8 select c1,case when c2 = '111' then 'a' when c2 = '222' then 'b' else 'c' end from t8;
ERROR 22000: inconsistent datatypes
delete from t8 where c1 = case when c1 = 'aaa' then 'bbb' else 'eee' end;
ERROR 22000: inconsistent datatypes
drop table t8;
# Clean up users
drop user zwc cascade;
set autocommit = true;
alter system set ob_enable_batched_multi_statement='false';
